[I 2024-12-04 20:19:24,338] Trial 1540 finished with value: 0.6835090443422132 and parameters: {'n_estimators': 429, 'max_depth': 50, 'min_samples_split': 2, 'min_samples_leaf': 2, 'max_features': 'sqrt', 'bootstrap': False, 'criterion': 'squared_error'}. Best is trial 874 with value: 0.32176430753353746.
[I 2024-12-04 20:19:24,662] Trial 1479 finished with value: 0.4228013011425623 and parameters: {'n_estimators': 478, 'max_depth': 46, 'min_samples_split': 2, 'min_samples_leaf': 1, 'max_features': None, 'bootstrap': False, 'criterion': 'absolute_error'}. Best is trial 874 with value: 0.32176430753353746.
[I 2024-12-04 20:19:26,511] Trial 1541 finished with value: 0.3674452580217661 and parameters: {'n_estimators': 491, 'max_depth': 50, 'min_samples_split': 3, 'min_samples_leaf': 1, 'max_features': 'sqrt', 'bootstrap': False, 'criterion': 'squared_error'}. Best is trial 874 with value: 0.32176430753353746.
[I 2024-12-04 20:19:27,345] Trial 1542 finished with value: 0.3287553349702198 and parameters: {'n_estimators': 462, 'max_depth': 50, 'min_samples_split': 2, 'min_samples_leaf': 1, 'max_features': 'sqrt', 'bootstrap': False, 'criterion': 'squared_error'}. Best is trial 874 with value: 0.32176430753353746.
[I 2024-12-04 20:19:28,976] Trial 1543 finished with value: 0.3770127381273155 and parameters: {'n_estimators': 546, 'max_depth': 50, 'min_samples_split': 2, 'min_samples_leaf': 1, 'max_features': 'sqrt', 'bootstrap': True, 'criterion': 'squared_error'}. Best is trial 874 with value: 0.32176430753353746.
[I 2024-12-04 20:19:30,546] Trial 1544 finished with value: 0.4341254869845287 and parameters: {'n_estimators': 283, 'max_depth': 50, 'min_samples_split': 2, 'min_samples_leaf': 1, 'max_features': None, 'bootstrap': False, 'criterion': 'squared_error'}. Best is trial 874 with value: 0.32176430753353746.
[I 2024-12-04 20:19:32,416] Trial 1546 finished with value: 0.32269081148361717 and parameters: {'n_estimators': 339, 'max_depth': 50, 'min_samples_split': 2, 'min_samples_leaf': 1, 'max_features': 'sqrt', 'bootstrap': False, 'criterion': 'squared_error'}. Best is trial 874 with value: 0.32176430753353746.
[I 2024-12-04 20:19:33,484] Trial 1539 finished with value: 0.6118732861357111 and parameters: {'n_estimators': 459, 'max_depth': 48, 'min_samples_split': 13, 'min_samples_leaf': 1, 'max_features': 'sqrt', 'bootstrap': False, 'criterion': 'absolute_error'}. Best is trial 874 with value: 0.32176430753353746.
[I 2024-12-04 20:19:33,734] Trial 1547 finished with value: 1.3413355611428255 and parameters: {'n_estimators': 487, 'max_depth': 47, 'min_samples_split': 17, 'min_samples_leaf': 12, 'max_features': 'log2', 'bootstrap': False, 'criterion': 'absolute_error'}. Best is trial 874 with value: 0.32176430753353746.
[I 2024-12-04 20:19:34,887] Trial 1548 finished with value: 0.6533399487918606 and parameters: {'n_estimators': 171, 'max_depth': 43, 'min_samples_split': 2, 'min_samples_leaf': 2, 'max_features': 'sqrt', 'bootstrap': False, 'criterion': 'squared_error'}. Best is trial 874 with value: 0.32176430753353746.
[I 2024-12-04 20:19:35,927] Trial 1549 finished with value: 1.340031735355185 and parameters: {'n_estimators': 968, 'max_depth': 18, 'min_samples_split': 2, 'min_samples_leaf': 14, 'max_features': 'log2', 'bootstrap': False, 'criterion': 'absolute_error'}. Best is trial 874 with value: 0.32176430753353746.
[I 2024-12-04 20:19:36,881] Trial 1550 finished with value: 0.32375191398072833 and parameters: {'n_estimators': 310, 'max_depth': 50, 'min_samples_split': 2, 'min_samples_leaf': 1, 'max_features': 'sqrt', 'bootstrap': False, 'criterion': 'squared_error'}. Best is trial 874 with value: 0.32176430753353746.
[I 2024-12-04 20:19:37,354] Trial 1551 finished with value: 0.4037150016927134 and parameters: {'n_estimators': 238, 'max_depth': 43, 'min_samples_split': 3, 'min_samples_leaf': 1, 'max_features': 'sqrt', 'bootstrap': False, 'criterion': 'squared_error'}. Best is trial 874 with value: 0.32176430753353746.
[I 2024-12-04 20:19:38,179] Trial 1552 finished with value: 1.00741979839575 and parameters: {'n_estimators': 250, 'max_depth': 18, 'min_samples_split': 13, 'min_samples_leaf': 1, 'max_features': 'log2', 'bootstrap': True, 'criterion': 'squared_error'}. Best is trial 874 with value: 0.32176430753353746.
[I 2024-12-04 20:19:39,601] Trial 1553 finished with value: 0.3455000485991264 and parameters: {'n_estimators': 366, 'max_depth': 42, 'min_samples_split': 2, 'min_samples_leaf': 1, 'max_features': 'sqrt', 'bootstrap': False, 'criterion': 'squared_error'}. Best is trial 874 with value: 0.32176430753353746.
[I 2024-12-04 20:19:39,827] Trial 1554 finished with value: 0.38680274933731423 and parameters: {'n_estimators': 375, 'max_depth': 50, 'min_samples_split': 4, 'min_samples_leaf': 1, 'max_features': 'sqrt', 'bootstrap': False, 'criterion': 'squared_error'}. Best is trial 874 with value: 0.32176430753353746.
[I 2024-12-04 20:19:40,935] Trial 1555 finished with value: 1.191814514969924 and parameters: {'n_estimators': 509, 'max_depth': 46, 'min_samples_split': 7, 'min_samples_leaf': 13, 'max_features': 'sqrt', 'bootstrap': False, 'criterion': 'squared_error'}. Best is trial 874 with value: 0.32176430753353746.
[I 2024-12-04 20:19:42,675] Trial 1557 finished with value: 0.37104654742088394 and parameters: {'n_estimators': 352, 'max_depth': 50, 'min_samples_split': 2, 'min_samples_leaf': 1, 'max_features': 'sqrt', 'bootstrap': True, 'criterion': 'squared_error'}. Best is trial 874 with value: 0.32176430753353746.
[I 2024-12-04 20:19:43,162] Trial 1556 finished with value: 1.181994387035199 and parameters: {'n_estimators': 353, 'max_depth': 49, 'min_samples_split': 2, 'min_samples_leaf': 2, 'max_features': 'log2', 'bootstrap': False, 'criterion': 'absolute_error'}. Best is trial 874 with value: 0.32176430753353746.
[I 2024-12-04 20:19:44,358] Trial 1558 finished with value: 0.7006606410540388 and parameters: {'n_estimators': 483, 'max_depth': 41, 'min_samples_split': 2, 'min_samples_leaf': 2, 'max_features': 'sqrt', 'bootstrap': False, 'criterion': 'squared_error'}. Best is trial 874 with value: 0.32176430753353746.
[I 2024-12-04 20:19:44,775] Trial 1559 finished with value: 0.38531731888183357 and parameters: {'n_estimators': 269, 'max_depth': 50, 'min_samples_split': 4, 'min_samples_leaf': 1, 'max_features': 'sqrt', 'bootstrap': False, 'criterion': 'squared_error'}. Best is trial 874 with value: 0.32176430753353746.
[I 2024-12-04 20:19:46,028] Trial 1561 finished with value: 0.6695390229064061 and parameters: {'n_estimators': 289, 'max_depth': 41, 'min_samples_split': 2, 'min_samples_leaf': 2, 'max_features': 'sqrt', 'bootstrap': False, 'criterion': 'squared_error'}. Best is trial 874 with value: 0.32176430753353746.
[I 2024-12-04 20:19:46,098] Trial 1560 finished with value: 0.3455628578122842 and parameters: {'n_estimators': 268, 'max_depth': 43, 'min_samples_split': 2, 'min_samples_leaf': 1, 'max_features': 'sqrt', 'bootstrap': False, 'criterion': 'squared_error'}. Best is trial 874 with value: 0.32176430753353746.
[I 2024-12-04 20:19:47,664] Trial 1562 finished with value: 1.2764196182235021 and parameters: {'n_estimators': 620, 'max_depth': 32, 'min_samples_split': 3, 'min_samples_leaf': 9, 'max_features': 'log2', 'bootstrap': True, 'criterion': 'squared_error'}. Best is trial 874 with value: 0.32176430753353746.
[I 2024-12-04 20:19:48,299] Trial 1563 finished with value: 0.3454656383323428 and parameters: {'n_estimators': 314, 'max_depth': 43, 'min_samples_split': 2, 'min_samples_leaf': 1, 'max_features': 'sqrt', 'bootstrap': False, 'criterion': 'squared_error'}. Best is trial 874 with value: 0.32176430753353746.
[I 2024-12-04 20:19:49,301] Trial 1565 finished with value: 1.0901502648628072 and parameters: {'n_estimators': 197, 'max_depth': 49, 'min_samples_split': 3, 'min_samples_leaf': 2, 'max_features': 'log2', 'bootstrap': False, 'criterion': 'squared_error'}. Best is trial 874 with value: 0.32176430753353746.
[I 2024-12-04 20:19:49,717] Trial 1564 finished with value: 0.32432958404010126 and parameters: {'n_estimators': 308, 'max_depth': 50, 'min_samples_split': 2, 'min_samples_leaf': 1, 'max_features': 'sqrt', 'bootstrap': False, 'criterion': 'squared_error'}. Best is trial 874 with value: 0.32176430753353746.
[I 2024-12-04 20:19:51,622] Trial 1567 finished with value: 0.4147062509785209 and parameters: {'n_estimators': 491, 'max_depth': 43, 'min_samples_split': 4, 'min_samples_leaf': 1, 'max_features': 'sqrt', 'bootstrap': False, 'criterion': 'squared_error'}. Best is trial 874 with value: 0.32176430753353746.
[I 2024-12-04 20:19:51,688] Trial 1566 finished with value: 0.32331229904364467 and parameters: {'n_estimators': 422, 'max_depth': 50, 'min_samples_split': 2, 'min_samples_leaf': 1, 'max_features': 'sqrt', 'bootstrap': False, 'criterion': 'squared_error'}. Best is trial 874 with value: 0.32176430753353746.
[I 2024-12-04 20:19:53,411] Trial 1569 finished with value: 1.329230279868537 and parameters: {'n_estimators': 448, 'max_depth': 18, 'min_samples_split': 7, 'min_samples_leaf': 6, 'max_features': 'log2', 'bootstrap': True, 'criterion': 'absolute_error'}. Best is trial 874 with value: 0.32176430753353746.
[I 2024-12-04 20:19:54,243] Trial 1568 finished with value: 0.35142872072873427 and parameters: {'n_estimators': 431, 'max_depth': 43, 'min_samples_split': 2, 'min_samples_leaf': 1, 'max_features': 'sqrt', 'bootstrap': False, 'criterion': 'squared_error'}. Best is trial 874 with value: 0.32176430753353746.
[I 2024-12-04 20:19:55,773] Trial 1571 finished with value: 0.3260894582614822 and parameters: {'n_estimators': 228, 'max_depth': 50, 'min_samples_split': 2, 'min_samples_leaf': 1, 'max_features': 'sqrt', 'bootstrap': False, 'criterion': 'squared_error'}. Best is trial 874 with value: 0.32176430753353746.
[I 2024-12-04 20:19:56,260] Trial 1570 finished with value: 0.327528353582998 and parameters: {'n_estimators': 537, 'max_depth': 50, 'min_samples_split': 2, 'min_samples_leaf': 1, 'max_features': 'sqrt', 'bootstrap': False, 'criterion': 'squared_error'}. Best is trial 874 with value: 0.32176430753353746.
[I 2024-12-04 20:19:58,403] Trial 1573 finished with value: 0.32356484656231804 and parameters: {'n_estimators': 401, 'max_depth': 50, 'min_samples_split': 2, 'min_samples_leaf': 1, 'max_features': 'sqrt', 'bootstrap': False, 'criterion': 'squared_error'}. Best is trial 874 with value: 0.32176430753353746.
[I 2024-12-04 20:19:59,486] Trial 1574 finished with value: 1.169872261064638 and parameters: {'n_estimators': 320, 'max_depth': 10, 'min_samples_split': 5, 'min_samples_leaf': 2, 'max_features': 'log2', 'bootstrap': True, 'criterion': 'squared_error'}. Best is trial 874 with value: 0.32176430753353746.
[I 2024-12-04 20:20:01,501] Trial 1575 finished with value: 0.34971571421638126 and parameters: {'n_estimators': 400, 'max_depth': 42, 'min_samples_split': 2, 'min_samples_leaf': 1, 'max_features': 'sqrt', 'bootstrap': False, 'criterion': 'squared_error'}. Best is trial 874 with value: 0.32176430753353746.
[I 2024-12-04 20:20:01,900] Trial 1572 finished with value: 0.3513722591587443 and parameters: {'n_estimators': 224, 'max_depth': 48, 'min_samples_split': 2, 'min_samples_leaf': 1, 'max_features': 'sqrt', 'bootstrap': False, 'criterion': 'absolute_error'}. Best is trial 874 with value: 0.32176430753353746.
[I 2024-12-04 20:20:02,932] Trial 1576 finished with value: 0.6779647655171043 and parameters: {'n_estimators': 344, 'max_depth': 42, 'min_samples_split': 2, 'min_samples_leaf': 2, 'max_features': 'sqrt', 'bootstrap': False, 'criterion': 'squared_error'}. Best is trial 874 with value: 0.32176430753353746.
[I 2024-12-04 20:20:03,940] Trial 1577 finished with value: 0.3250062651881157 and parameters: {'n_estimators': 301, 'max_depth': 50, 'min_samples_split': 2, 'min_samples_leaf': 1, 'max_features': 'sqrt', 'bootstrap': False, 'criterion': 'squared_error'}. Best is trial 874 with value: 0.32176430753353746.
[I 2024-12-04 20:20:04,553] Trial 1578 finished with value: 0.32210014670580556 and parameters: {'n_estimators': 219, 'max_depth': 50, 'min_samples_split': 2, 'min_samples_leaf': 1, 'max_features': 'sqrt', 'bootstrap': False, 'criterion': 'squared_error'}. Best is trial 874 with value: 0.32176430753353746.
[I 2024-12-04 20:20:06,422] Trial 1579 finished with value: 0.3677398559497251 and parameters: {'n_estimators': 499, 'max_depth': 50, 'min_samples_split': 3, 'min_samples_leaf': 1, 'max_features': 'sqrt', 'bootstrap': False, 'criterion': 'squared_error'}. Best is trial 874 with value: 0.32176430753353746.
[I 2024-12-04 20:20:06,697] Trial 1580 finished with value: 1.299258204113962 and parameters: {'n_estimators': 790, 'max_depth': 26, 'min_samples_split': 10, 'min_samples_leaf': 11, 'max_features': 'sqrt', 'bootstrap': True, 'criterion': 'absolute_error'}. Best is trial 874 with value: 0.32176430753353746.
[I 2024-12-04 20:20:07,461] Trial 1581 finished with value: 0.6151843670020548 and parameters: {'n_estimators': 104, 'max_depth': 45, 'min_samples_split': 2, 'min_samples_leaf': 2, 'max_features': 'sqrt', 'bootstrap': False, 'criterion': 'squared_error'}. Best is trial 874 with value: 0.32176430753353746.
[I 2024-12-04 20:20:08,075] Trial 1582 finished with value: 0.6590502583719964 and parameters: {'n_estimators': 281, 'max_depth': 50, 'min_samples_split': 2, 'min_samples_leaf': 2, 'max_features': 'sqrt', 'bootstrap': False, 'criterion': 'squared_error'}. Best is trial 874 with value: 0.32176430753353746.
[I 2024-12-04 20:20:08,973] Trial 1583 finished with value: 0.33905859765503 and parameters: {'n_estimators': 160, 'max_depth': 46, 'min_samples_split': 2, 'min_samples_leaf': 1, 'max_features': 'sqrt', 'bootstrap': False, 'criterion': 'squared_error'}. Best is trial 874 with value: 0.32176430753353746.
[I 2024-12-04 20:20:09,983] Trial 1584 finished with value: 0.345693800649137 and parameters: {'n_estimators': 257, 'max_depth': 42, 'min_samples_split': 2, 'min_samples_leaf': 1, 'max_features': 'sqrt', 'bootstrap': False, 'criterion': 'squared_error'}. Best is trial 874 with value: 0.32176430753353746.
[I 2024-12-04 20:20:10,772] Trial 1585 finished with value: 0.9547061854131119 and parameters: {'n_estimators': 590, 'max_depth': 26, 'min_samples_split': 29, 'min_samples_leaf': 1, 'max_features': 'log2', 'bootstrap': True, 'criterion': 'squared_error'}. Best is trial 874 with value: 0.32176430753353746.
[I 2024-12-04 20:20:11,316] Trial 1586 finished with value: 0.3569976965849709 and parameters: {'n_estimators': 119, 'max_depth': 45, 'min_samples_split': 2, 'min_samples_leaf': 1, 'max_features': 'sqrt', 'bootstrap': False, 'criterion': 'squared_error'}. Best is trial 874 with value: 0.32176430753353746.
[I 2024-12-04 20:20:12,199] Trial 1587 finished with value: 0.38203215805730834 and parameters: {'n_estimators': 174, 'max_depth': 47, 'min_samples_split': 3, 'min_samples_leaf': 1, 'max_features': 'sqrt', 'bootstrap': False, 'criterion': 'squared_error'}. Best is trial 874 with value: 0.32176430753353746.
[I 2024-12-04 20:20:12,769] Trial 1588 finished with value: 0.3816350664787335 and parameters: {'n_estimators': 169, 'max_depth': 40, 'min_samples_split': 2, 'min_samples_leaf': 1, 'max_features': 'sqrt', 'bootstrap': False, 'criterion': 'squared_error'}. Best is trial 874 with value: 0.32176430753353746.
[I 2024-12-04 20:20:13,764] Trial 1589 finished with value: 0.3269983132965408 and parameters: {'n_estimators': 179, 'max_depth': 50, 'min_samples_split': 2, 'min_samples_leaf': 1, 'max_features': 'sqrt', 'bootstrap': False, 'criterion': 'squared_error'}. Best is trial 874 with value: 0.32176430753353746.
[I 2024-12-04 20:20:14,689] Trial 1590 finished with value: 0.32576298548563337 and parameters: {'n_estimators': 273, 'max_depth': 50, 'min_samples_split': 2, 'min_samples_leaf': 1, 'max_features': 'sqrt', 'bootstrap': False, 'criterion': 'squared_error'}. Best is trial 874 with value: 0.32176430753353746.
[I 2024-12-04 20:20:15,182] Trial 1591 finished with value: 0.569668019638651 and parameters: {'n_estimators': 287, 'max_depth': 49, 'min_samples_split': 5, 'min_samples_leaf': 1, 'max_features': 'log2', 'bootstrap': False, 'criterion': 'squared_error'}. Best is trial 874 with value: 0.32176430753353746.
[I 2024-12-04 20:20:16,197] Trial 1593 finished with value: 0.3965217261618132 and parameters: {'n_estimators': 106, 'max_depth': 50, 'min_samples_split': 4, 'min_samples_leaf': 1, 'max_features': 'sqrt', 'bootstrap': False, 'criterion': 'squared_error'}. Best is trial 874 with value: 0.32176430753353746.
[I 2024-12-04 20:20:16,200] Trial 1592 finished with value: 0.3954730937451512 and parameters: {'n_estimators': 285, 'max_depth': 44, 'min_samples_split': 4, 'min_samples_leaf': 1, 'max_features': 'sqrt', 'bootstrap': False, 'criterion': 'squared_error'}. Best is trial 874 with value: 0.32176430753353746.
[I 2024-12-04 20:20:17,632] Trial 1595 finished with value: 0.6703054353056231 and parameters: {'n_estimators': 218, 'max_depth': 41, 'min_samples_split': 4, 'min_samples_leaf': 2, 'max_features': 'sqrt', 'bootstrap': False, 'criterion': 'squared_error'}. Best is trial 874 with value: 0.32176430753353746.
[I 2024-12-04 20:20:18,359] Trial 1594 finished with value: 0.697498939903325 and parameters: {'n_estimators': 369, 'max_depth': 10, 'min_samples_split': 45, 'min_samples_leaf': 9, 'max_features': None, 'bootstrap': True, 'criterion': 'squared_error'}. Best is trial 874 with value: 0.32176430753353746.
[I 2024-12-04 20:20:18,916] Trial 1596 finished with value: 0.6648967969479749 and parameters: {'n_estimators': 238, 'max_depth': 50, 'min_samples_split': 4, 'min_samples_leaf': 2, 'max_features': 'sqrt', 'bootstrap': False, 'criterion': 'squared_error'}. Best is trial 874 with value: 0.32176430753353746.
[I 2024-12-04 20:20:19,775] Trial 1597 finished with value: 0.7849427922638347 and parameters: {'n_estimators': 267, 'max_depth': 50, 'min_samples_split': 2, 'min_samples_leaf': 2, 'max_features': 'sqrt', 'bootstrap': True, 'criterion': 'squared_error'}. Best is trial 874 with value: 0.32176430753353746.
[I 2024-12-04 20:20:20,502] Trial 1598 finished with value: 0.3601462996694804 and parameters: {'n_estimators': 209, 'max_depth': 50, 'min_samples_split': 3, 'min_samples_leaf': 1, 'max_features': 'sqrt', 'bootstrap': False, 'criterion': 'squared_error'}. Best is trial 874 with value: 0.32176430753353746.
[I 2024-12-04 20:20:21,553] Trial 1599 finished with value: 0.34648718857730565 and parameters: {'n_estimators': 191, 'max_depth': 42, 'min_samples_split': 2, 'min_samples_leaf': 1, 'max_features': 'sqrt', 'bootstrap': False, 'criterion': 'squared_error'}. Best is trial 874 with value: 0.32176430753353746.
[I 2024-12-04 20:20:22,944] Trial 1601 finished with value: 0.36714916932896086 and parameters: {'n_estimators': 239, 'max_depth': 49, 'min_samples_split': 3, 'min_samples_leaf': 1, 'max_features': 'sqrt', 'bootstrap': False, 'criterion': 'squared_error'}. Best is trial 874 with value: 0.32176430753353746.
[I 2024-12-04 20:20:24,240] Trial 1602 finished with value: 0.35973937165497083 and parameters: {'n_estimators': 211, 'max_depth': 50, 'min_samples_split': 3, 'min_samples_leaf': 1, 'max_features': 'sqrt', 'bootstrap': False, 'criterion': 'squared_error'}. Best is trial 874 with value: 0.32176430753353746.
[I 2024-12-04 20:20:24,493] Trial 1600 finished with value: 0.6106671851627115 and parameters: {'n_estimators': 939, 'max_depth': 24, 'min_samples_split': 5, 'min_samples_leaf': 15, 'max_features': None, 'bootstrap': False, 'criterion': 'squared_error'}. Best is trial 874 with value: 0.32176430753353746.
[I 2024-12-04 20:20:25,620] Trial 1603 finished with value: 0.6558021461160508 and parameters: {'n_estimators': 288, 'max_depth': 50, 'min_samples_split': 2, 'min_samples_leaf': 2, 'max_features': 'sqrt', 'bootstrap': False, 'criterion': 'squared_error'}. Best is trial 874 with value: 0.32176430753353746.
[I 2024-12-04 20:20:25,898] Trial 1604 finished with value: 0.6651485589644706 and parameters: {'n_estimators': 312, 'max_depth': 50, 'min_samples_split': 2, 'min_samples_leaf': 2, 'max_features': 'sqrt', 'bootstrap': False, 'criterion': 'squared_error'}. Best is trial 874 with value: 0.32176430753353746.
[I 2024-12-04 20:20:27,643] Trial 1605 finished with value: 0.3237071069356298 and parameters: {'n_estimators': 334, 'max_depth': 50, 'min_samples_split': 2, 'min_samples_leaf': 1, 'max_features': 'sqrt', 'bootstrap': False, 'criterion': 'squared_error'}. Best is trial 874 with value: 0.32176430753353746.
[I 2024-12-04 20:20:29,057] Trial 1607 finished with value: 0.3840763377319184 and parameters: {'n_estimators': 289, 'max_depth': 50, 'min_samples_split': 4, 'min_samples_leaf': 1, 'max_features': 'sqrt', 'bootstrap': False, 'criterion': 'squared_error'}. Best is trial 874 with value: 0.32176430753353746.
[I 2024-12-04 20:20:29,360] Trial 1606 finished with value: 1.0694032508387905 and parameters: {'n_estimators': 338, 'max_depth': 27, 'min_samples_split': 13, 'min_samples_leaf': 4, 'max_features': 'sqrt', 'bootstrap': False, 'criterion': 'absolute_error'}. Best is trial 874 with value: 0.32176430753353746.
[I 2024-12-04 20:20:30,916] Trial 1608 finished with value: 0.3232127850270016 and parameters: {'n_estimators': 254, 'max_depth': 50, 'min_samples_split': 2, 'min_samples_leaf': 1, 'max_features': 'sqrt', 'bootstrap': False, 'criterion': 'squared_error'}. Best is trial 874 with value: 0.32176430753353746.
[I 2024-12-04 20:20:31,045] Trial 1609 finished with value: 0.674897204723882 and parameters: {'n_estimators': 570, 'max_depth': 50, 'min_samples_split': 4, 'min_samples_leaf': 2, 'max_features': 'sqrt', 'bootstrap': False, 'criterion': 'squared_error'}. Best is trial 874 with value: 0.32176430753353746.
