[I 2024-12-04 15:01:21,865] Trial 952 finished with value: 0.6269047690121389 and parameters: {'n_estimators': 799, 'learning_rate': 0.027535230222832826, 'max_depth': 9, 'min_samples_split': 3, 'min_samples_leaf': 2, 'subsample': 0.7098690638514572, 'max_features': 'sqrt'}. Best is trial 603 with value: 0.45955205541891275.
[I 2024-12-04 15:01:25,473] Trial 939 finished with value: 0.5373819227065233 and parameters: {'n_estimators': 1447, 'learning_rate': 0.044410817978293174, 'max_depth': 12, 'min_samples_split': 18, 'min_samples_leaf': 1, 'subsample': 0.833690140367201, 'max_features': 'sqrt'}. Best is trial 603 with value: 0.45955205541891275.
[I 2024-12-04 15:01:26,180] Trial 936 finished with value: 0.47715147625124377 and parameters: {'n_estimators': 1312, 'learning_rate': 0.05597210541636782, 'max_depth': 11, 'min_samples_split': 19, 'min_samples_leaf': 1, 'subsample': 0.9417243680467606, 'max_features': None}. Best is trial 603 with value: 0.45955205541891275.
[I 2024-12-04 15:01:26,632] Trial 954 finished with value: 0.9095909402557351 and parameters: {'n_estimators': 961, 'learning_rate': 0.014453748510290389, 'max_depth': 3, 'min_samples_split': 19, 'min_samples_leaf': 5, 'subsample': 0.9097124360526981, 'max_features': 'log2'}. Best is trial 603 with value: 0.45955205541891275.
[I 2024-12-04 15:01:30,780] Trial 944 finished with value: 0.4987760225147679 and parameters: {'n_estimators': 1192, 'learning_rate': 0.055166461209640416, 'max_depth': 12, 'min_samples_split': 16, 'min_samples_leaf': 1, 'subsample': 0.9667551669872213, 'max_features': None}. Best is trial 603 with value: 0.45955205541891275.
[I 2024-12-04 15:01:31,155] Trial 937 finished with value: 0.5099894087026201 and parameters: {'n_estimators': 1387, 'learning_rate': 0.04166863985543768, 'max_depth': 12, 'min_samples_split': 16, 'min_samples_leaf': 1, 'subsample': 0.9936174216838418, 'max_features': None}. Best is trial 603 with value: 0.45955205541891275.
[I 2024-12-04 15:01:31,654] Trial 938 finished with value: 0.6396876278664337 and parameters: {'n_estimators': 1427, 'learning_rate': 0.050514984780244895, 'max_depth': 12, 'min_samples_split': 19, 'min_samples_leaf': 3, 'subsample': 0.9904565498393731, 'max_features': None}. Best is trial 603 with value: 0.45955205541891275.
[I 2024-12-04 15:01:33,687] Trial 962 finished with value: 0.9538807102080585 and parameters: {'n_estimators': 937, 'learning_rate': 0.02141535831198136, 'max_depth': 10, 'min_samples_split': 5, 'min_samples_leaf': 9, 'subsample': 0.9747156905089156, 'max_features': 'log2'}. Best is trial 603 with value: 0.45955205541891275.
[I 2024-12-04 15:01:34,733] Trial 943 finished with value: 0.6185416737533621 and parameters: {'n_estimators': 1328, 'learning_rate': 0.04518450468063914, 'max_depth': 12, 'min_samples_split': 20, 'min_samples_leaf': 2, 'subsample': 0.9985009522451322, 'max_features': None}. Best is trial 603 with value: 0.45955205541891275.
[I 2024-12-04 15:01:35,823] Trial 948 finished with value: 0.4868941522316056 and parameters: {'n_estimators': 1298, 'learning_rate': 0.06074417320769956, 'max_depth': 10, 'min_samples_split': 20, 'min_samples_leaf': 1, 'subsample': 0.9940899039268216, 'max_features': None}. Best is trial 603 with value: 0.45955205541891275.
[I 2024-12-04 15:01:36,600] Trial 941 finished with value: 0.4772097195463357 and parameters: {'n_estimators': 1441, 'learning_rate': 0.03577629555180805, 'max_depth': 11, 'min_samples_split': 20, 'min_samples_leaf': 1, 'subsample': 0.9825694255391979, 'max_features': None}. Best is trial 603 with value: 0.45955205541891275.
[I 2024-12-04 15:01:36,968] Trial 946 finished with value: 0.627690086627494 and parameters: {'n_estimators': 1365, 'learning_rate': 0.059384308451797166, 'max_depth': 12, 'min_samples_split': 20, 'min_samples_leaf': 2, 'subsample': 0.9362152008340393, 'max_features': None}. Best is trial 603 with value: 0.45955205541891275.
[I 2024-12-04 15:01:37,722] Trial 947 finished with value: 0.4962371799998522 and parameters: {'n_estimators': 1295, 'learning_rate': 0.0461057416607839, 'max_depth': 12, 'min_samples_split': 17, 'min_samples_leaf': 1, 'subsample': 0.9792210002468129, 'max_features': None}. Best is trial 603 with value: 0.45955205541891275.
[I 2024-12-04 15:01:40,717] Trial 953 finished with value: 0.5060019613676897 and parameters: {'n_estimators': 1217, 'learning_rate': 0.050858948136600864, 'max_depth': 10, 'min_samples_split': 19, 'min_samples_leaf': 1, 'subsample': 0.984016583852653, 'max_features': None}. Best is trial 603 with value: 0.45955205541891275.
[I 2024-12-04 15:01:41,168] Trial 950 finished with value: 0.4806359289719164 and parameters: {'n_estimators': 1392, 'learning_rate': 0.04712960834001947, 'max_depth': 12, 'min_samples_split': 17, 'min_samples_leaf': 1, 'subsample': 0.9762356912510796, 'max_features': None}. Best is trial 603 with value: 0.45955205541891275.
[I 2024-12-04 15:01:42,598] Trial 949 finished with value: 0.6711301550587097 and parameters: {'n_estimators': 1491, 'learning_rate': 0.0720895357850638, 'max_depth': 12, 'min_samples_split': 17, 'min_samples_leaf': 3, 'subsample': 0.9116718835444566, 'max_features': None}. Best is trial 603 with value: 0.45955205541891275.
[I 2024-12-04 15:01:45,454] Trial 960 finished with value: 0.7856633846047789 and parameters: {'n_estimators': 1487, 'learning_rate': 0.015952428155106817, 'max_depth': 11, 'min_samples_split': 14, 'min_samples_leaf': 5, 'subsample': 0.7924878005844229, 'max_features': 'log2'}. Best is trial 603 with value: 0.45955205541891275.
[I 2024-12-04 15:01:45,511] Trial 964 finished with value: 0.5961946600180942 and parameters: {'n_estimators': 1108, 'learning_rate': 0.05897819370246425, 'max_depth': 10, 'min_samples_split': 11, 'min_samples_leaf': 6, 'subsample': 0.8299221216521424, 'max_features': None}. Best is trial 603 with value: 0.45955205541891275.
[I 2024-12-04 15:01:48,562] Trial 951 finished with value: 0.5180974666271713 and parameters: {'n_estimators': 1500, 'learning_rate': 0.06947907758211148, 'max_depth': 12, 'min_samples_split': 15, 'min_samples_leaf': 1, 'subsample': 0.9934351354032412, 'max_features': None}. Best is trial 603 with value: 0.45955205541891275.
[I 2024-12-04 15:01:48,845] Trial 959 finished with value: 0.4706083447768339 and parameters: {'n_estimators': 1284, 'learning_rate': 0.05584142908756638, 'max_depth': 12, 'min_samples_split': 20, 'min_samples_leaf': 1, 'subsample': 0.9303544537040622, 'max_features': None}. Best is trial 603 with value: 0.45955205541891275.
[I 2024-12-04 15:01:49,682] Trial 955 finished with value: 0.4927340213816332 and parameters: {'n_estimators': 1459, 'learning_rate': 0.06245817542808144, 'max_depth': 12, 'min_samples_split': 18, 'min_samples_leaf': 1, 'subsample': 0.9423202067251045, 'max_features': None}. Best is trial 603 with value: 0.45955205541891275.
[I 2024-12-04 15:01:51,987] Trial 961 finished with value: 0.47085025510464856 and parameters: {'n_estimators': 1309, 'learning_rate': 0.05555917143164656, 'max_depth': 12, 'min_samples_split': 20, 'min_samples_leaf': 1, 'subsample': 0.9700723108700924, 'max_features': None}. Best is trial 603 with value: 0.45955205541891275.
[I 2024-12-04 15:01:52,393] Trial 957 finished with value: 0.49255149430686895 and parameters: {'n_estimators': 1445, 'learning_rate': 0.06957480567966691, 'max_depth': 12, 'min_samples_split': 19, 'min_samples_leaf': 1, 'subsample': 0.9307871142583279, 'max_features': None}. Best is trial 603 with value: 0.45955205541891275.
[I 2024-12-04 15:01:52,736] Trial 969 finished with value: 0.6627961692252403 and parameters: {'n_estimators': 1200, 'learning_rate': 0.010499109549881546, 'max_depth': 11, 'min_samples_split': 11, 'min_samples_leaf': 6, 'subsample': 0.9179255627153313, 'max_features': 'sqrt'}. Best is trial 603 with value: 0.45955205541891275.
[I 2024-12-04 15:01:53,471] Trial 956 finished with value: 0.4790174598828322 and parameters: {'n_estimators': 1488, 'learning_rate': 0.046617963411614456, 'max_depth': 11, 'min_samples_split': 19, 'min_samples_leaf': 1, 'subsample': 0.9691244292353435, 'max_features': None}. Best is trial 603 with value: 0.45955205541891275.
[I 2024-12-04 15:01:54,424] Trial 963 finished with value: 0.4867399681976014 and parameters: {'n_estimators': 1294, 'learning_rate': 0.05433245528706695, 'max_depth': 12, 'min_samples_split': 19, 'min_samples_leaf': 1, 'subsample': 0.9696011556239934, 'max_features': None}. Best is trial 603 with value: 0.45955205541891275.
[I 2024-12-04 15:01:54,425] Trial 958 finished with value: 0.648714369738144 and parameters: {'n_estimators': 1441, 'learning_rate': 0.09853320653629713, 'max_depth': 12, 'min_samples_split': 16, 'min_samples_leaf': 2, 'subsample': 0.9903846912122853, 'max_features': None}. Best is trial 603 with value: 0.45955205541891275.
[I 2024-12-04 15:01:55,536] Trial 976 finished with value: 0.5973654289985952 and parameters: {'n_estimators': 697, 'learning_rate': 0.05736907018620626, 'max_depth': 8, 'min_samples_split': 7, 'min_samples_leaf': 6, 'subsample': 0.9692832874640602, 'max_features': None}. Best is trial 603 with value: 0.45955205541891275.
[I 2024-12-04 15:01:57,502] Trial 967 finished with value: 0.6215476733917165 and parameters: {'n_estimators': 1188, 'learning_rate': 0.05257915754104206, 'max_depth': 12, 'min_samples_split': 20, 'min_samples_leaf': 3, 'subsample': 0.9997471151435918, 'max_features': None}. Best is trial 603 with value: 0.45955205541891275.
[I 2024-12-04 15:01:59,351] Trial 971 finished with value: 0.5449107296956626 and parameters: {'n_estimators': 1332, 'learning_rate': 0.056957013685681276, 'max_depth': 11, 'min_samples_split': 17, 'min_samples_leaf': 1, 'subsample': 0.9773770013909379, 'max_features': 'sqrt'}. Best is trial 603 with value: 0.45955205541891275.
[I 2024-12-04 15:02:01,347] Trial 965 finished with value: 0.4798291751790238 and parameters: {'n_estimators': 1441, 'learning_rate': 0.03458487044326299, 'max_depth': 12, 'min_samples_split': 20, 'min_samples_leaf': 1, 'subsample': 0.8895680185350635, 'max_features': None}. Best is trial 603 with value: 0.45955205541891275.
[I 2024-12-04 15:02:02,434] Trial 973 finished with value: 0.7019655091826068 and parameters: {'n_estimators': 1349, 'learning_rate': 0.04716440885804724, 'max_depth': 6, 'min_samples_split': 10, 'min_samples_leaf': 5, 'subsample': 0.8062375211208651, 'max_features': 'log2'}. Best is trial 603 with value: 0.45955205541891275.
[I 2024-12-04 15:02:02,788] Trial 982 finished with value: 0.47433685961688976 and parameters: {'n_estimators': 683, 'learning_rate': 0.08724029748338977, 'max_depth': 12, 'min_samples_split': 19, 'min_samples_leaf': 1, 'subsample': 0.9977386230816053, 'max_features': None}. Best is trial 603 with value: 0.45955205541891275.
[I 2024-12-04 15:02:02,882] Trial 968 finished with value: 0.4714697285847699 and parameters: {'n_estimators': 1237, 'learning_rate': 0.048888508201632375, 'max_depth': 12, 'min_samples_split': 20, 'min_samples_leaf': 1, 'subsample': 0.9642353003300083, 'max_features': None}. Best is trial 603 with value: 0.45955205541891275.
[I 2024-12-04 15:02:02,888] Trial 970 finished with value: 0.5304135683724046 and parameters: {'n_estimators': 1232, 'learning_rate': 0.07840847951638454, 'max_depth': 9, 'min_samples_split': 14, 'min_samples_leaf': 1, 'subsample': 0.9643651577525824, 'max_features': None}. Best is trial 603 with value: 0.45955205541891275.
[I 2024-12-04 15:02:03,568] Trial 966 finished with value: 0.6317119174037084 and parameters: {'n_estimators': 1451, 'learning_rate': 0.0679639008696974, 'max_depth': 12, 'min_samples_split': 20, 'min_samples_leaf': 2, 'subsample': 0.9329920495002377, 'max_features': None}. Best is trial 603 with value: 0.45955205541891275.
[I 2024-12-04 15:02:06,579] Trial 983 finished with value: 0.8391613949816923 and parameters: {'n_estimators': 1012, 'learning_rate': 0.0897948439319067, 'max_depth': 4, 'min_samples_split': 16, 'min_samples_leaf': 9, 'subsample': 0.8336576801765505, 'max_features': 'sqrt'}. Best is trial 603 with value: 0.45955205541891275.
[I 2024-12-04 15:02:08,630] Trial 979 finished with value: 0.6490609231837513 and parameters: {'n_estimators': 983, 'learning_rate': 0.07806977878826608, 'max_depth': 12, 'min_samples_split': 17, 'min_samples_leaf': 3, 'subsample': 0.9863422473556239, 'max_features': None}. Best is trial 603 with value: 0.45955205541891275.
[I 2024-12-04 15:02:09,368] Trial 977 finished with value: 0.6380973061993719 and parameters: {'n_estimators': 1103, 'learning_rate': 0.06973924808378301, 'max_depth': 10, 'min_samples_split': 17, 'min_samples_leaf': 3, 'subsample': 0.9903561293210658, 'max_features': None}. Best is trial 603 with value: 0.45955205541891275.
[I 2024-12-04 15:02:14,613] Trial 972 finished with value: 0.6412235114255842 and parameters: {'n_estimators': 1448, 'learning_rate': 0.061871263793980606, 'max_depth': 12, 'min_samples_split': 19, 'min_samples_leaf': 2, 'subsample': 0.995857714842172, 'max_features': None}. Best is trial 603 with value: 0.45955205541891275.
[I 2024-12-04 15:02:14,631] Trial 974 finished with value: 0.5519827736514265 and parameters: {'n_estimators': 1484, 'learning_rate': 0.0726214609751392, 'max_depth': 11, 'min_samples_split': 15, 'min_samples_leaf': 1, 'subsample': 0.8811727129343401, 'max_features': None}. Best is trial 603 with value: 0.45955205541891275.
[I 2024-12-04 15:02:15,188] Trial 978 finished with value: 0.48017009967221885 and parameters: {'n_estimators': 1201, 'learning_rate': 0.06742578263585812, 'max_depth': 12, 'min_samples_split': 20, 'min_samples_leaf': 1, 'subsample': 0.9696870330965023, 'max_features': None}. Best is trial 603 with value: 0.45955205541891275.
[I 2024-12-04 15:02:16,545] Trial 980 finished with value: 0.617760927260777 and parameters: {'n_estimators': 1183, 'learning_rate': 0.048330985224638884, 'max_depth': 12, 'min_samples_split': 18, 'min_samples_leaf': 2, 'subsample': 0.9901760037487465, 'max_features': None}. Best is trial 603 with value: 0.45955205541891275.
[I 2024-12-04 15:02:19,854] Trial 975 finished with value: 0.49481114860339503 and parameters: {'n_estimators': 1492, 'learning_rate': 0.09195748477997187, 'max_depth': 12, 'min_samples_split': 19, 'min_samples_leaf': 1, 'subsample': 0.8872660623331832, 'max_features': None}. Best is trial 603 with value: 0.45955205541891275.
[I 2024-12-04 15:02:22,088] Trial 987 finished with value: 0.7830057661015484 and parameters: {'n_estimators': 1440, 'learning_rate': 0.018175933768348307, 'max_depth': 8, 'min_samples_split': 13, 'min_samples_leaf': 10, 'subsample': 0.7512644133388652, 'max_features': 'sqrt'}. Best is trial 603 with value: 0.45955205541891275.
[I 2024-12-04 15:02:22,131] Trial 999 finished with value: 0.5211852731276777 and parameters: {'n_estimators': 780, 'learning_rate': 0.09569156778589978, 'max_depth': 9, 'min_samples_split': 17, 'min_samples_leaf': 1, 'subsample': 0.9923097312832564, 'max_features': None}. Best is trial 603 with value: 0.45955205541891275.
[I 2024-12-04 15:02:23,442] Trial 992 finished with value: 0.5140399860705517 and parameters: {'n_estimators': 974, 'learning_rate': 0.06039906126037099, 'max_depth': 10, 'min_samples_split': 16, 'min_samples_leaf': 1, 'subsample': 0.9938338402842097, 'max_features': None}. Best is trial 603 with value: 0.45955205541891275.
[I 2024-12-04 15:02:24,145] Trial 981 finished with value: 0.48589289462793056 and parameters: {'n_estimators': 1438, 'learning_rate': 0.08109412324499697, 'max_depth': 11, 'min_samples_split': 18, 'min_samples_leaf': 1, 'subsample': 0.990665428676636, 'max_features': None}. Best is trial 603 with value: 0.45955205541891275.
[I 2024-12-04 15:02:24,156] Trial 984 finished with value: 0.46263567521409504 and parameters: {'n_estimators': 1323, 'learning_rate': 0.04699495848479963, 'max_depth': 12, 'min_samples_split': 20, 'min_samples_leaf': 1, 'subsample': 0.9817438593430493, 'max_features': None}. Best is trial 603 with value: 0.45955205541891275.
[I 2024-12-04 15:02:25,783] Trial 988 finished with value: 0.6426333258608478 and parameters: {'n_estimators': 1228, 'learning_rate': 0.05996797870212682, 'max_depth': 11, 'min_samples_split': 17, 'min_samples_leaf': 3, 'subsample': 0.9123253002549322, 'max_features': None}. Best is trial 603 with value: 0.45955205541891275.
[I 2024-12-04 15:02:26,389] Trial 1001 finished with value: 0.5405110269143575 and parameters: {'n_estimators': 921, 'learning_rate': 0.07747996124956555, 'max_depth': 12, 'min_samples_split': 20, 'min_samples_leaf': 1, 'subsample': 0.9019526761119434, 'max_features': 'sqrt'}. Best is trial 603 with value: 0.45955205541891275.
[I 2024-12-04 15:02:27,447] Trial 990 finished with value: 0.6455770336351626 and parameters: {'n_estimators': 1160, 'learning_rate': 0.06636182118341036, 'max_depth': 10, 'min_samples_split': 16, 'min_samples_leaf': 2, 'subsample': 0.9054342753635253, 'max_features': None}. Best is trial 603 with value: 0.45955205541891275.
[I 2024-12-04 15:02:28,954] Trial 985 finished with value: 0.6196687306205524 and parameters: {'n_estimators': 1431, 'learning_rate': 0.04081355544080388, 'max_depth': 12, 'min_samples_split': 20, 'min_samples_leaf': 2, 'subsample': 0.89625376474193, 'max_features': None}. Best is trial 603 with value: 0.45955205541891275.
[I 2024-12-04 15:02:28,998] Trial 995 finished with value: 0.6605759178526269 and parameters: {'n_estimators': 1358, 'learning_rate': 0.021095098210181164, 'max_depth': 7, 'min_samples_split': 20, 'min_samples_leaf': 3, 'subsample': 0.6290134924184344, 'max_features': 'log2'}. Best is trial 603 with value: 0.45955205541891275.
[I 2024-12-04 15:02:29,102] Trial 1000 finished with value: 0.4875799079043601 and parameters: {'n_estimators': 867, 'learning_rate': 0.05639488793184598, 'max_depth': 10, 'min_samples_split': 20, 'min_samples_leaf': 1, 'subsample': 0.9876481384815963, 'max_features': None}. Best is trial 603 with value: 0.45955205541891275.
[I 2024-12-04 15:02:29,376] Trial 991 finished with value: 0.6473422171909048 and parameters: {'n_estimators': 1176, 'learning_rate': 0.05331912961201996, 'max_depth': 10, 'min_samples_split': 16, 'min_samples_leaf': 2, 'subsample': 0.9965607166606253, 'max_features': None}. Best is trial 603 with value: 0.45955205541891275.
[I 2024-12-04 15:02:30,300] Trial 998 finished with value: 0.6297489773534292 and parameters: {'n_estimators': 1014, 'learning_rate': 0.06662183968497962, 'max_depth': 12, 'min_samples_split': 20, 'min_samples_leaf': 4, 'subsample': 0.9926301356289622, 'max_features': None}. Best is trial 603 with value: 0.45955205541891275.
[I 2024-12-04 15:02:33,199] Trial 986 finished with value: 0.46863370178618635 and parameters: {'n_estimators': 1457, 'learning_rate': 0.09881602825066656, 'max_depth': 11, 'min_samples_split': 20, 'min_samples_leaf': 1, 'subsample': 0.9683589981530304, 'max_features': None}. Best is trial 603 with value: 0.45955205541891275.
[I 2024-12-04 15:02:34,012] Trial 989 finished with value: 0.47371105097443955 and parameters: {'n_estimators': 1334, 'learning_rate': 0.07549062047507175, 'max_depth': 12, 'min_samples_split': 20, 'min_samples_leaf': 1, 'subsample': 0.9718623902033422, 'max_features': None}. Best is trial 603 with value: 0.45955205541891275.
[I 2024-12-04 15:02:34,147] Trial 1010 finished with value: 0.6081486939136371 and parameters: {'n_estimators': 641, 'learning_rate': 0.061994566659902196, 'max_depth': 3, 'min_samples_split': 2, 'min_samples_leaf': 3, 'subsample': 0.7122322407809419, 'max_features': 'sqrt'}. Best is trial 603 with value: 0.45955205541891275.
[I 2024-12-04 15:02:36,548] Trial 1008 finished with value: 0.565247472790934 and parameters: {'n_estimators': 978, 'learning_rate': 0.08020722959791034, 'max_depth': 12, 'min_samples_split': 20, 'min_samples_leaf': 1, 'subsample': 0.9997233366170348, 'max_features': 'sqrt'}. Best is trial 603 with value: 0.45955205541891275.
[I 2024-12-04 15:02:37,479] Trial 1007 finished with value: 0.5173679908145697 and parameters: {'n_estimators': 864, 'learning_rate': 0.08173580021509069, 'max_depth': 11, 'min_samples_split': 11, 'min_samples_leaf': 1, 'subsample': 0.9856612741941495, 'max_features': None}. Best is trial 603 with value: 0.45955205541891275.
[I 2024-12-04 15:02:38,244] Trial 1022 finished with value: 1.0255934319992799 and parameters: {'n_estimators': 202, 'learning_rate': 0.018180464126801764, 'max_depth': 9, 'min_samples_split': 14, 'min_samples_leaf': 7, 'subsample': 0.6726809210594037, 'max_features': 'sqrt'}. Best is trial 603 with value: 0.45955205541891275.
[I 2024-12-04 15:02:39,330] Trial 1014 finished with value: 0.6184128542860051 and parameters: {'n_estimators': 508, 'learning_rate': 0.07796037486316111, 'max_depth': 12, 'min_samples_split': 15, 'min_samples_leaf': 4, 'subsample': 0.8884059024658434, 'max_features': None}. Best is trial 603 with value: 0.45955205541891275.
[I 2024-12-04 15:02:40,443] Trial 1006 finished with value: 0.6476285977281993 and parameters: {'n_estimators': 984, 'learning_rate': 0.07981176305707254, 'max_depth': 12, 'min_samples_split': 19, 'min_samples_leaf': 3, 'subsample': 0.9969359445196081, 'max_features': None}. Best is trial 603 with value: 0.45955205541891275.
[I 2024-12-04 15:02:40,444] Trial 996 finished with value: 0.4823971089969411 and parameters: {'n_estimators': 1345, 'learning_rate': 0.067750612122695, 'max_depth': 12, 'min_samples_split': 20, 'min_samples_leaf': 1, 'subsample': 0.9663731650834051, 'max_features': None}. Best is trial 603 with value: 0.45955205541891275.
[I 2024-12-04 15:02:42,303] Trial 994 finished with value: 0.4916697733766928 and parameters: {'n_estimators': 1430, 'learning_rate': 0.0756493349759545, 'max_depth': 12, 'min_samples_split': 16, 'min_samples_leaf': 1, 'subsample': 0.9202425040178933, 'max_features': None}. Best is trial 603 with value: 0.45955205541891275.
