[I 2024-12-04 20:27:00,778] Trial 1966 finished with value: 0.6617013029671751 and parameters: {'n_estimators': 304, 'max_depth': 50, 'min_samples_split': 2, 'min_samples_leaf': 2, 'max_features': 'sqrt', 'bootstrap': False, 'criterion': 'squared_error'}. Best is trial 1631 with value: 0.32128932742921457.
[I 2024-12-04 20:27:00,779] Trial 1965 finished with value: 1.3448241692039962 and parameters: {'n_estimators': 705, 'max_depth': 27, 'min_samples_split': 20, 'min_samples_leaf': 15, 'max_features': 'log2', 'bootstrap': False, 'criterion': 'absolute_error'}. Best is trial 1631 with value: 0.32128932742921457.
[I 2024-12-04 20:27:03,512] Trial 1967 finished with value: 0.3563752661363107 and parameters: {'n_estimators': 496, 'max_depth': 42, 'min_samples_split': 2, 'min_samples_leaf': 1, 'max_features': 'sqrt', 'bootstrap': False, 'criterion': 'squared_error'}. Best is trial 1631 with value: 0.32128932742921457.
[I 2024-12-04 20:27:03,933] Trial 1968 finished with value: 0.3271948455652018 and parameters: {'n_estimators': 518, 'max_depth': 50, 'min_samples_split': 2, 'min_samples_leaf': 1, 'max_features': 'sqrt', 'bootstrap': False, 'criterion': 'squared_error'}. Best is trial 1631 with value: 0.32128932742921457.
[I 2024-12-04 20:27:05,890] Trial 1969 finished with value: 0.32618657432518644 and parameters: {'n_estimators': 233, 'max_depth': 50, 'min_samples_split': 2, 'min_samples_leaf': 1, 'max_features': 'sqrt', 'bootstrap': False, 'criterion': 'squared_error'}. Best is trial 1631 with value: 0.32128932742921457.
[I 2024-12-04 20:27:06,009] Trial 1970 finished with value: 0.6993771272918146 and parameters: {'n_estimators': 455, 'max_depth': 42, 'min_samples_split': 3, 'min_samples_leaf': 2, 'max_features': 'sqrt', 'bootstrap': False, 'criterion': 'squared_error'}. Best is trial 1631 with value: 0.32128932742921457.
[I 2024-12-04 20:27:08,094] Trial 1972 finished with value: 0.6847990960302719 and parameters: {'n_estimators': 416, 'max_depth': 50, 'min_samples_split': 3, 'min_samples_leaf': 2, 'max_features': 'sqrt', 'bootstrap': False, 'criterion': 'squared_error'}. Best is trial 1631 with value: 0.32128932742921457.
[I 2024-12-04 20:27:09,286] Trial 1971 finished with value: 0.5373546477339874 and parameters: {'n_estimators': 283, 'max_depth': 48, 'min_samples_split': 3, 'min_samples_leaf': 2, 'max_features': None, 'bootstrap': False, 'criterion': 'squared_error'}. Best is trial 1631 with value: 0.32128932742921457.
[I 2024-12-04 20:27:10,405] Trial 1973 finished with value: 0.346082860403114 and parameters: {'n_estimators': 223, 'max_depth': 42, 'min_samples_split': 2, 'min_samples_leaf': 1, 'max_features': 'sqrt', 'bootstrap': False, 'criterion': 'squared_error'}. Best is trial 1631 with value: 0.32128932742921457.
[I 2024-12-04 20:27:11,698] Trial 1974 finished with value: 0.9613501563953577 and parameters: {'n_estimators': 907, 'max_depth': 46, 'min_samples_split': 29, 'min_samples_leaf': 3, 'max_features': 'sqrt', 'bootstrap': True, 'criterion': 'squared_error'}. Best is trial 1631 with value: 0.32128932742921457.
[I 2024-12-04 20:27:12,041] Trial 1975 finished with value: 0.6811607312086518 and parameters: {'n_estimators': 367, 'max_depth': 43, 'min_samples_split': 2, 'min_samples_leaf': 2, 'max_features': 'sqrt', 'bootstrap': False, 'criterion': 'squared_error'}. Best is trial 1631 with value: 0.32128932742921457.
[I 2024-12-04 20:27:13,997] Trial 1976 finished with value: 0.3908857688905214 and parameters: {'n_estimators': 572, 'max_depth': 50, 'min_samples_split': 4, 'min_samples_leaf': 1, 'max_features': 'sqrt', 'bootstrap': False, 'criterion': 'squared_error'}. Best is trial 1631 with value: 0.32128932742921457.
[I 2024-12-04 20:27:14,468] Trial 1977 finished with value: 0.3230288283209677 and parameters: {'n_estimators': 380, 'max_depth': 50, 'min_samples_split': 2, 'min_samples_leaf': 1, 'max_features': 'sqrt', 'bootstrap': False, 'criterion': 'squared_error'}. Best is trial 1631 with value: 0.32128932742921457.
[I 2024-12-04 20:27:16,201] Trial 1979 finished with value: 0.3864050390608274 and parameters: {'n_estimators': 371, 'max_depth': 50, 'min_samples_split': 4, 'min_samples_leaf': 1, 'max_features': 'sqrt', 'bootstrap': False, 'criterion': 'squared_error'}. Best is trial 1631 with value: 0.32128932742921457.
[I 2024-12-04 20:27:16,205] Trial 1978 finished with value: 0.3237871829641958 and parameters: {'n_estimators': 320, 'max_depth': 50, 'min_samples_split': 2, 'min_samples_leaf': 1, 'max_features': 'sqrt', 'bootstrap': False, 'criterion': 'squared_error'}. Best is trial 1631 with value: 0.32128932742921457.
[I 2024-12-04 20:27:18,298] Trial 1980 finished with value: 0.4123230158825541 and parameters: {'n_estimators': 423, 'max_depth': 43, 'min_samples_split': 4, 'min_samples_leaf': 1, 'max_features': 'sqrt', 'bootstrap': False, 'criterion': 'squared_error'}. Best is trial 1631 with value: 0.32128932742921457.
[I 2024-12-04 20:27:18,638] Trial 1981 finished with value: 0.3234324296702297 and parameters: {'n_estimators': 314, 'max_depth': 50, 'min_samples_split': 2, 'min_samples_leaf': 1, 'max_features': 'sqrt', 'bootstrap': False, 'criterion': 'squared_error'}. Best is trial 1631 with value: 0.32128932742921457.
[I 2024-12-04 20:27:19,923] Trial 1982 finished with value: 0.6682439935535592 and parameters: {'n_estimators': 358, 'max_depth': 50, 'min_samples_split': 3, 'min_samples_leaf': 2, 'max_features': 'sqrt', 'bootstrap': False, 'criterion': 'squared_error'}. Best is trial 1631 with value: 0.32128932742921457.
[I 2024-12-04 20:27:20,258] Trial 1937 finished with value: 0.5024979452834725 and parameters: {'n_estimators': 521, 'max_depth': 25, 'min_samples_split': 9, 'min_samples_leaf': 1, 'max_features': None, 'bootstrap': False, 'criterion': 'absolute_error'}. Best is trial 1631 with value: 0.32128932742921457.
[I 2024-12-04 20:27:20,920] Trial 1983 finished with value: 0.34769920260567966 and parameters: {'n_estimators': 272, 'max_depth': 42, 'min_samples_split': 2, 'min_samples_leaf': 1, 'max_features': 'sqrt', 'bootstrap': False, 'criterion': 'squared_error'}. Best is trial 1631 with value: 0.32128932742921457.
[I 2024-12-04 20:27:22,923] Trial 1986 finished with value: 0.39277639169530726 and parameters: {'n_estimators': 500, 'max_depth': 50, 'min_samples_split': 4, 'min_samples_leaf': 1, 'max_features': 'sqrt', 'bootstrap': False, 'criterion': 'squared_error'}. Best is trial 1631 with value: 0.32128932742921457.
[I 2024-12-04 20:27:24,626] Trial 1987 finished with value: 0.32504112217435555 and parameters: {'n_estimators': 268, 'max_depth': 50, 'min_samples_split': 2, 'min_samples_leaf': 1, 'max_features': 'sqrt', 'bootstrap': False, 'criterion': 'squared_error'}. Best is trial 1631 with value: 0.32128932742921457.
[I 2024-12-04 20:27:26,716] Trial 1988 finished with value: 0.3492837408006431 and parameters: {'n_estimators': 410, 'max_depth': 42, 'min_samples_split': 2, 'min_samples_leaf': 1, 'max_features': 'sqrt', 'bootstrap': False, 'criterion': 'squared_error'}. Best is trial 1631 with value: 0.32128932742921457.
[I 2024-12-04 20:27:28,330] Trial 1984 finished with value: 0.5838330870683719 and parameters: {'n_estimators': 360, 'max_depth': 24, 'min_samples_split': 12, 'min_samples_leaf': 11, 'max_features': None, 'bootstrap': False, 'criterion': 'absolute_error'}. Best is trial 1631 with value: 0.32128932742921457.
[I 2024-12-04 20:27:29,335] Trial 1989 finished with value: 0.43105905406528583 and parameters: {'n_estimators': 230, 'max_depth': 40, 'min_samples_split': 3, 'min_samples_leaf': 1, 'max_features': None, 'bootstrap': False, 'criterion': 'squared_error'}. Best is trial 1631 with value: 0.32128932742921457.
[I 2024-12-04 20:27:31,307] Trial 1985 finished with value: 0.4299480289686767 and parameters: {'n_estimators': 451, 'max_depth': 44, 'min_samples_split': 4, 'min_samples_leaf': 1, 'max_features': 'sqrt', 'bootstrap': False, 'criterion': 'absolute_error'}. Best is trial 1631 with value: 0.32128932742921457.
[I 2024-12-04 20:27:31,378] Trial 1991 finished with value: 0.3505162013839718 and parameters: {'n_estimators': 398, 'max_depth': 41, 'min_samples_split': 2, 'min_samples_leaf': 1, 'max_features': 'sqrt', 'bootstrap': False, 'criterion': 'squared_error'}. Best is trial 1631 with value: 0.32128932742921457.
[I 2024-12-04 20:27:33,121] Trial 1992 finished with value: 0.5106453166782388 and parameters: {'n_estimators': 255, 'max_depth': 50, 'min_samples_split': 2, 'min_samples_leaf': 1, 'max_features': 'log2', 'bootstrap': False, 'criterion': 'squared_error'}. Best is trial 1631 with value: 0.32128932742921457.
[I 2024-12-04 20:27:33,834] Trial 1993 finished with value: 0.3458150697253777 and parameters: {'n_estimators': 371, 'max_depth': 43, 'min_samples_split': 2, 'min_samples_leaf': 1, 'max_features': 'sqrt', 'bootstrap': False, 'criterion': 'squared_error'}. Best is trial 1631 with value: 0.32128932742921457.
[I 2024-12-04 20:27:34,116] Trial 1994 finished with value: 0.6311024438000183 and parameters: {'n_estimators': 119, 'max_depth': 50, 'min_samples_split': 3, 'min_samples_leaf': 2, 'max_features': 'sqrt', 'bootstrap': False, 'criterion': 'squared_error'}. Best is trial 1631 with value: 0.32128932742921457.
[I 2024-12-04 20:27:35,673] Trial 1995 finished with value: 0.6824810819634133 and parameters: {'n_estimators': 396, 'max_depth': 50, 'min_samples_split': 2, 'min_samples_leaf': 2, 'max_features': 'sqrt', 'bootstrap': False, 'criterion': 'squared_error'}. Best is trial 1631 with value: 0.32128932742921457.
[I 2024-12-04 20:27:36,830] Trial 1997 finished with value: 0.3739124974963073 and parameters: {'n_estimators': 108, 'max_depth': 41, 'min_samples_split': 2, 'min_samples_leaf': 1, 'max_features': 'sqrt', 'bootstrap': False, 'criterion': 'squared_error'}. Best is trial 1631 with value: 0.32128932742921457.
[I 2024-12-04 20:27:37,732] Trial 1990 finished with value: 0.34064274754317575 and parameters: {'n_estimators': 344, 'max_depth': 50, 'min_samples_split': 2, 'min_samples_leaf': 1, 'max_features': 'sqrt', 'bootstrap': False, 'criterion': 'absolute_error'}. Best is trial 1631 with value: 0.32128932742921457.
[I 2024-12-04 20:27:38,757] Trial 1998 finished with value: 0.32353349303693907 and parameters: {'n_estimators': 258, 'max_depth': 50, 'min_samples_split': 2, 'min_samples_leaf': 1, 'max_features': 'sqrt', 'bootstrap': False, 'criterion': 'squared_error'}. Best is trial 1631 with value: 0.32128932742921457.
[I 2024-12-04 20:27:39,871] Trial 1999 finished with value: 0.41357285269588945 and parameters: {'n_estimators': 405, 'max_depth': 42, 'min_samples_split': 2, 'min_samples_leaf': 1, 'max_features': 'sqrt', 'bootstrap': True, 'criterion': 'squared_error'}. Best is trial 1631 with value: 0.32128932742921457.
[I 2024-12-04 20:27:39,874] Trial 2000 finished with value: 0.6742525599033203 and parameters: {'n_estimators': 241, 'max_depth': 43, 'min_samples_split': 2, 'min_samples_leaf': 2, 'max_features': 'sqrt', 'bootstrap': False, 'criterion': 'squared_error'}. Best is trial 1631 with value: 0.32128932742921457.
[I 2024-12-04 20:27:41,607] Trial 1996 finished with value: 0.5370054873154658 and parameters: {'n_estimators': 949, 'max_depth': 49, 'min_samples_split': 15, 'min_samples_leaf': 1, 'max_features': None, 'bootstrap': False, 'criterion': 'squared_error'}. Best is trial 1631 with value: 0.32128932742921457.
[I 2024-12-04 20:27:42,725] Trial 2001 finished with value: 0.32352420311966096 and parameters: {'n_estimators': 398, 'max_depth': 50, 'min_samples_split': 2, 'min_samples_leaf': 1, 'max_features': 'sqrt', 'bootstrap': False, 'criterion': 'squared_error'}. Best is trial 1631 with value: 0.32128932742921457.
[I 2024-12-04 20:27:42,734] Trial 2002 finished with value: 0.9339809164493978 and parameters: {'n_estimators': 895, 'max_depth': 30, 'min_samples_split': 48, 'min_samples_leaf': 1, 'max_features': 'log2', 'bootstrap': True, 'criterion': 'squared_error'}. Best is trial 1631 with value: 0.32128932742921457.
[I 2024-12-04 20:27:44,203] Trial 2003 finished with value: 0.5586041410196565 and parameters: {'n_estimators': 420, 'max_depth': 43, 'min_samples_split': 2, 'min_samples_leaf': 1, 'max_features': 'log2', 'bootstrap': False, 'criterion': 'squared_error'}. Best is trial 1631 with value: 0.32128932742921457.
[I 2024-12-04 20:27:45,309] Trial 2006 finished with value: 1.27339326995026 and parameters: {'n_estimators': 499, 'max_depth': 5, 'min_samples_split': 24, 'min_samples_leaf': 11, 'max_features': 'log2', 'bootstrap': False, 'criterion': 'squared_error'}. Best is trial 1631 with value: 0.32128932742921457.
[I 2024-12-04 20:27:46,145] Trial 2004 finished with value: 0.32716430932497753 and parameters: {'n_estimators': 526, 'max_depth': 50, 'min_samples_split': 2, 'min_samples_leaf': 1, 'max_features': 'sqrt', 'bootstrap': False, 'criterion': 'squared_error'}. Best is trial 1631 with value: 0.32128932742921457.
[I 2024-12-04 20:27:47,445] Trial 2007 finished with value: 0.3627772864647886 and parameters: {'n_estimators': 432, 'max_depth': 50, 'min_samples_split': 3, 'min_samples_leaf': 1, 'max_features': 'sqrt', 'bootstrap': False, 'criterion': 'squared_error'}. Best is trial 1631 with value: 0.32128932742921457.
[I 2024-12-04 20:27:48,513] Trial 2008 finished with value: 0.3228754233952194 and parameters: {'n_estimators': 351, 'max_depth': 50, 'min_samples_split': 2, 'min_samples_leaf': 1, 'max_features': 'sqrt', 'bootstrap': False, 'criterion': 'squared_error'}. Best is trial 1631 with value: 0.32128932742921457.
[I 2024-12-04 20:27:50,833] Trial 2010 finished with value: 0.3556585510277388 and parameters: {'n_estimators': 476, 'max_depth': 43, 'min_samples_split': 2, 'min_samples_leaf': 1, 'max_features': 'sqrt', 'bootstrap': False, 'criterion': 'squared_error'}. Best is trial 1631 with value: 0.32128932742921457.
[I 2024-12-04 20:27:52,592] Trial 2011 finished with value: 0.32547120703687404 and parameters: {'n_estimators': 280, 'max_depth': 50, 'min_samples_split': 2, 'min_samples_leaf': 1, 'max_features': 'sqrt', 'bootstrap': False, 'criterion': 'squared_error'}. Best is trial 1631 with value: 0.32128932742921457.
[I 2024-12-04 20:27:54,155] Trial 2012 finished with value: 0.398125353916387 and parameters: {'n_estimators': 403, 'max_depth': 44, 'min_samples_split': 4, 'min_samples_leaf': 1, 'max_features': 'sqrt', 'bootstrap': False, 'criterion': 'squared_error'}. Best is trial 1631 with value: 0.32128932742921457.
[I 2024-12-04 20:27:54,158] Trial 2009 finished with value: 1.2284076985121815 and parameters: {'n_estimators': 938, 'max_depth': 23, 'min_samples_split': 41, 'min_samples_leaf': 2, 'max_features': 'log2', 'bootstrap': False, 'criterion': 'absolute_error'}. Best is trial 1631 with value: 0.32128932742921457.
[I 2024-12-04 20:27:55,628] Trial 2013 finished with value: 0.6677134494096665 and parameters: {'n_estimators': 310, 'max_depth': 49, 'min_samples_split': 4, 'min_samples_leaf': 2, 'max_features': 'sqrt', 'bootstrap': False, 'criterion': 'squared_error'}. Best is trial 1631 with value: 0.32128932742921457.
[I 2024-12-04 20:27:56,191] Trial 2014 finished with value: 0.4107412534273165 and parameters: {'n_estimators': 336, 'max_depth': 43, 'min_samples_split': 4, 'min_samples_leaf': 1, 'max_features': 'sqrt', 'bootstrap': False, 'criterion': 'squared_error'}. Best is trial 1631 with value: 0.32128932742921457.
[I 2024-12-04 20:27:57,447] Trial 2015 finished with value: 0.38593987326007806 and parameters: {'n_estimators': 350, 'max_depth': 50, 'min_samples_split': 4, 'min_samples_leaf': 1, 'max_features': 'sqrt', 'bootstrap': False, 'criterion': 'squared_error'}. Best is trial 1631 with value: 0.32128932742921457.
[I 2024-12-04 20:27:58,054] Trial 2016 finished with value: 0.32354571284096106 and parameters: {'n_estimators': 262, 'max_depth': 50, 'min_samples_split': 2, 'min_samples_leaf': 1, 'max_features': 'sqrt', 'bootstrap': False, 'criterion': 'squared_error'}. Best is trial 1631 with value: 0.32128932742921457.
[I 2024-12-04 20:27:59,095] Trial 2017 finished with value: 0.3459441509883677 and parameters: {'n_estimators': 213, 'max_depth': 42, 'min_samples_split': 2, 'min_samples_leaf': 1, 'max_features': 'sqrt', 'bootstrap': False, 'criterion': 'squared_error'}. Best is trial 1631 with value: 0.32128932742921457.
[I 2024-12-04 20:28:00,525] Trial 2019 finished with value: 0.8001450773329631 and parameters: {'n_estimators': 440, 'max_depth': 47, 'min_samples_split': 5, 'min_samples_leaf': 2, 'max_features': 'sqrt', 'bootstrap': True, 'criterion': 'squared_error'}. Best is trial 1631 with value: 0.32128932742921457.
[I 2024-12-04 20:28:00,836] Trial 2018 finished with value: 0.6647255301552484 and parameters: {'n_estimators': 152, 'max_depth': 48, 'min_samples_split': 19, 'min_samples_leaf': 9, 'max_features': None, 'bootstrap': True, 'criterion': 'absolute_error'}. Best is trial 1631 with value: 0.32128932742921457.
[I 2024-12-04 20:28:02,359] Trial 2020 finished with value: 0.6859978356737724 and parameters: {'n_estimators': 505, 'max_depth': 50, 'min_samples_split': 2, 'min_samples_leaf': 2, 'max_features': 'sqrt', 'bootstrap': False, 'criterion': 'squared_error'}. Best is trial 1631 with value: 0.32128932742921457.
[I 2024-12-04 20:28:03,156] Trial 2021 finished with value: 1.3388617751973133 and parameters: {'n_estimators': 941, 'max_depth': 9, 'min_samples_split': 12, 'min_samples_leaf': 11, 'max_features': 'log2', 'bootstrap': False, 'criterion': 'absolute_error'}. Best is trial 1631 with value: 0.32128932742921457.
[I 2024-12-04 20:28:04,284] Trial 2023 finished with value: 0.3457638794407316 and parameters: {'n_estimators': 100, 'max_depth': 50, 'min_samples_split': 2, 'min_samples_leaf': 1, 'max_features': 'sqrt', 'bootstrap': False, 'criterion': 'squared_error'}. Best is trial 1631 with value: 0.32128932742921457.
[I 2024-12-04 20:28:04,658] Trial 2022 finished with value: 0.34617706866406855 and parameters: {'n_estimators': 375, 'max_depth': 43, 'min_samples_split': 2, 'min_samples_leaf': 1, 'max_features': 'sqrt', 'bootstrap': False, 'criterion': 'squared_error'}. Best is trial 1631 with value: 0.32128932742921457.
[I 2024-12-04 20:28:05,572] Trial 2024 finished with value: 1.1456272792842899 and parameters: {'n_estimators': 271, 'max_depth': 29, 'min_samples_split': 2, 'min_samples_leaf': 2, 'max_features': 'log2', 'bootstrap': True, 'criterion': 'squared_error'}. Best is trial 1631 with value: 0.32128932742921457.
[I 2024-12-04 20:28:06,720] Trial 2025 finished with value: 1.1430125916187035 and parameters: {'n_estimators': 162, 'max_depth': 10, 'min_samples_split': 6, 'min_samples_leaf': 4, 'max_features': 'sqrt', 'bootstrap': False, 'criterion': 'absolute_error'}. Best is trial 1631 with value: 0.32128932742921457.
[I 2024-12-04 20:28:08,069] Trial 2026 finished with value: 0.32795152554709356 and parameters: {'n_estimators': 443, 'max_depth': 50, 'min_samples_split': 2, 'min_samples_leaf': 1, 'max_features': 'sqrt', 'bootstrap': False, 'criterion': 'squared_error'}. Best is trial 1631 with value: 0.32128932742921457.
[I 2024-12-04 20:28:08,739] Trial 2027 finished with value: 0.32393180183718623 and parameters: {'n_estimators': 319, 'max_depth': 50, 'min_samples_split': 2, 'min_samples_leaf': 1, 'max_features': 'sqrt', 'bootstrap': False, 'criterion': 'squared_error'}. Best is trial 1631 with value: 0.32128932742921457.
[I 2024-12-04 20:28:09,557] Trial 2028 finished with value: 0.6625664198762813 and parameters: {'n_estimators': 303, 'max_depth': 50, 'min_samples_split': 3, 'min_samples_leaf': 2, 'max_features': 'sqrt', 'bootstrap': False, 'criterion': 'squared_error'}. Best is trial 1631 with value: 0.32128932742921457.
[I 2024-12-04 20:28:10,076] Trial 2029 finished with value: 0.43156541272540005 and parameters: {'n_estimators': 138, 'max_depth': 43, 'min_samples_split': 4, 'min_samples_leaf': 1, 'max_features': 'sqrt', 'bootstrap': False, 'criterion': 'squared_error'}. Best is trial 1631 with value: 0.32128932742921457.
[I 2024-12-04 20:28:10,932] Trial 2030 finished with value: 0.6681853356081844 and parameters: {'n_estimators': 254, 'max_depth': 44, 'min_samples_split': 2, 'min_samples_leaf': 2, 'max_features': 'sqrt', 'bootstrap': False, 'criterion': 'squared_error'}. Best is trial 1631 with value: 0.32128932742921457.
[I 2024-12-04 20:28:11,354] Trial 2031 finished with value: 0.6598231063091491 and parameters: {'n_estimators': 218, 'max_depth': 50, 'min_samples_split': 2, 'min_samples_leaf': 2, 'max_features': 'sqrt', 'bootstrap': False, 'criterion': 'squared_error'}. Best is trial 1631 with value: 0.32128932742921457.
[I 2024-12-04 20:28:13,215] Trial 2032 finished with value: 0.7766766162386461 and parameters: {'n_estimators': 984, 'max_depth': 45, 'min_samples_split': 26, 'min_samples_leaf': 2, 'max_features': 'sqrt', 'bootstrap': False, 'criterion': 'squared_error'}. Best is trial 1631 with value: 0.32128932742921457.
[I 2024-12-04 20:28:13,965] Trial 2033 finished with value: 0.32347932950710123 and parameters: {'n_estimators': 400, 'max_depth': 50, 'min_samples_split': 2, 'min_samples_leaf': 1, 'max_features': 'sqrt', 'bootstrap': False, 'criterion': 'squared_error'}. Best is trial 1631 with value: 0.32128932742921457.
[I 2024-12-04 20:28:15,286] Trial 2034 finished with value: 0.3242568274330358 and parameters: {'n_estimators': 288, 'max_depth': 50, 'min_samples_split': 2, 'min_samples_leaf': 1, 'max_features': 'sqrt', 'bootstrap': False, 'criterion': 'squared_error'}. Best is trial 1631 with value: 0.32128932742921457.
[I 2024-12-04 20:28:15,568] Trial 2035 finished with value: 0.6945043900813883 and parameters: {'n_estimators': 519, 'max_depth': 41, 'min_samples_split': 4, 'min_samples_leaf': 2, 'max_features': 'sqrt', 'bootstrap': False, 'criterion': 'squared_error'}. Best is trial 1631 with value: 0.32128932742921457.
