[I 2024-12-04 00:26:51,580] Trial 1717 finished with value: 0.2370413722529667 and parameters: {'kernel': 'rbf', 'C': 27.26984726212763, 'gamma': 0.0038507642129411795, 'epsilon': 0.0010311556629092624}. Best is trial 1479 with value: 0.13978216740910654.
[I 2024-12-04 00:26:52,768] Trial 1712 finished with value: 0.17136995753583117 and parameters: {'kernel': 'rbf', 'C': 99.07540168540982, 'gamma': 0.020931653075593276, 'epsilon': 0.004327787623436961}. Best is trial 1479 with value: 0.13978216740910654.
[I 2024-12-04 00:26:53,008] Trial 1718 finished with value: 0.148255734892321 and parameters: {'kernel': 'rbf', 'C': 84.87365488422738, 'gamma': 0.006051842318376674, 'epsilon': 0.0011317442693451992}. Best is trial 1479 with value: 0.13978216740910654.
[I 2024-12-04 00:26:53,471] Trial 1719 finished with value: 0.2679924097564986 and parameters: {'kernel': 'rbf', 'C': 97.77857723038038, 'gamma': 0.0006043419933782689, 'epsilon': 0.0022233350087275706}. Best is trial 1479 with value: 0.13978216740910654.
[I 2024-12-04 00:26:53,812] Trial 1715 finished with value: 0.20951085260996533 and parameters: {'kernel': 'rbf', 'C': 96.2130611271683, 'gamma': 0.05504107421535224, 'epsilon': 0.008850980888303016}. Best is trial 1479 with value: 0.13978216740910654.
[I 2024-12-04 00:26:54,859] Trial 1722 finished with value: 0.25112783051962156 and parameters: {'kernel': 'rbf', 'C': 19.556779908336914, 'gamma': 0.003931116769992086, 'epsilon': 0.0010584328551262218}. Best is trial 1479 with value: 0.13978216740910654.
[I 2024-12-04 00:26:56,259] Trial 1721 finished with value: 0.15831106850661258 and parameters: {'kernel': 'rbf', 'C': 30.171832685558797, 'gamma': 0.024208935578324056, 'epsilon': 0.001023686694062792}. Best is trial 1479 with value: 0.13978216740910654.
[I 2024-12-04 00:26:56,259] Trial 1720 finished with value: 0.1410906363413542 and parameters: {'kernel': 'rbf', 'C': 90.85819256604503, 'gamma': 0.009409369691194065, 'epsilon': 0.0011035969097714412}. Best is trial 1479 with value: 0.13978216740910654.
[I 2024-12-04 00:26:58,112] Trial 1725 finished with value: 0.15344006793321777 and parameters: {'kernel': 'rbf', 'C': 82.72695735270587, 'gamma': 0.005511065489618586, 'epsilon': 0.0010429195611929222}. Best is trial 1479 with value: 0.13978216740910654.
[I 2024-12-04 00:26:59,035] Trial 1726 finished with value: 0.16101439003499904 and parameters: {'kernel': 'rbf', 'C': 94.26726602325657, 'gamma': 0.004268489571053478, 'epsilon': 0.0026517449352697416}. Best is trial 1479 with value: 0.13978216740910654.
[I 2024-12-04 00:26:59,766] Trial 1723 finished with value: 0.1403607470517693 and parameters: {'kernel': 'rbf', 'C': 96.07092697196026, 'gamma': 0.009149445497374491, 'epsilon': 0.001959114619024512}. Best is trial 1479 with value: 0.13978216740910654.
[I 2024-12-04 00:26:59,856] Trial 1729 finished with value: 0.18315438045191454 and parameters: {'kernel': 'rbf', 'C': 17.9458782876891, 'gamma': 0.010766462784528641, 'epsilon': 0.002695556581610011}. Best is trial 1479 with value: 0.13978216740910654.
[I 2024-12-04 00:27:00,144] Trial 1727 finished with value: 0.18481090734041952 and parameters: {'kernel': 'rbf', 'C': 19.253379851657574, 'gamma': 0.041731518068111255, 'epsilon': 0.002621755883438506}. Best is trial 1479 with value: 0.13978216740910654.
[I 2024-12-04 00:27:01,030] Trial 1728 finished with value: 0.1510515961849178 and parameters: {'kernel': 'rbf', 'C': 22.060120223965498, 'gamma': 0.023487303252994054, 'epsilon': 0.0010697559334255104}. Best is trial 1479 with value: 0.13978216740910654.
[I 2024-12-04 00:27:02,261] Trial 1724 finished with value: 0.17205226676527538 and parameters: {'kernel': 'rbf', 'C': 98.29020050147888, 'gamma': 0.02043972402708542, 'epsilon': 0.0021668471541674526}. Best is trial 1479 with value: 0.13978216740910654.
[I 2024-12-04 00:27:02,697] Trial 1731 finished with value: 0.1491930122010714 and parameters: {'kernel': 'rbf', 'C': 81.77985585408027, 'gamma': 0.0060412983272232846, 'epsilon': 0.007399532292849484}. Best is trial 1479 with value: 0.13978216740910654.
[I 2024-12-04 00:27:03,707] Trial 1734 finished with value: 0.9080685168539885 and parameters: {'kernel': 'poly', 'C': 32.941499389564704, 'gamma': 0.0008531805196466584, 'epsilon': 0.0013168082616934087}. Best is trial 1479 with value: 0.13978216740910654.
[I 2024-12-04 00:27:04,264] Trial 1733 finished with value: 0.2927326273044795 and parameters: {'kernel': 'rbf', 'C': 19.65718053991409, 'gamma': 0.00160634867473449, 'epsilon': 0.0035380405896454073}. Best is trial 1479 with value: 0.13978216740910654.
[I 2024-12-04 00:27:04,333] Trial 1732 finished with value: 0.16011129271906308 and parameters: {'kernel': 'rbf', 'C': 17.642842837841425, 'gamma': 0.015488366512576377, 'epsilon': 0.006047865077178511}. Best is trial 1479 with value: 0.13978216740910654.
[I 2024-12-04 00:27:05,806] Trial 1730 finished with value: 0.19855727126474074 and parameters: {'kernel': 'rbf', 'C': 84.00905542315164, 'gamma': 0.043782763510655784, 'epsilon': 0.0010787539304406425}. Best is trial 1479 with value: 0.13978216740910654.
[I 2024-12-04 00:27:09,026] Trial 1736 finished with value: 0.2210767527239495 and parameters: {'kernel': 'rbf', 'C': 20.824451830181193, 'gamma': 0.08104146246889063, 'epsilon': 0.0033562360559684723}. Best is trial 1479 with value: 0.13978216740910654.
[I 2024-12-04 00:27:09,289] Trial 1738 finished with value: 0.21432912451660027 and parameters: {'kernel': 'rbf', 'C': 86.33397741778484, 'gamma': 0.0021162971258531383, 'epsilon': 0.0010244958947399872}. Best is trial 1479 with value: 0.13978216740910654.
[I 2024-12-04 00:27:10,863] Trial 1739 finished with value: 0.1639580070089687 and parameters: {'kernel': 'rbf', 'C': 20.642823931801008, 'gamma': 0.012890615657717402, 'epsilon': 0.0010228346967131282}. Best is trial 1479 with value: 0.13978216740910654.
[I 2024-12-04 00:27:10,864] Trial 1735 finished with value: 0.17599169419237987 and parameters: {'kernel': 'rbf', 'C': 90.88674605764923, 'gamma': 0.024909968281454534, 'epsilon': 0.008283625343172465}. Best is trial 1479 with value: 0.13978216740910654.
[I 2024-12-04 00:27:11,125] Trial 1737 finished with value: 0.14096000461584623 and parameters: {'kernel': 'rbf', 'C': 90.07625266952056, 'gamma': 0.010003579389380393, 'epsilon': 0.003234634531801663}. Best is trial 1479 with value: 0.13978216740910654.
[I 2024-12-04 00:27:11,230] Trial 1741 finished with value: 0.15374925027396438 and parameters: {'kernel': 'rbf', 'C': 33.03533292211409, 'gamma': 0.010235558173215089, 'epsilon': 0.0010220790022654003}. Best is trial 1479 with value: 0.13978216740910654.
[I 2024-12-04 00:27:11,703] Trial 1742 finished with value: 1169.5351083527994 and parameters: {'kernel': 'sigmoid', 'C': 69.64142924564428, 'gamma': 0.0157194623357723, 'epsilon': 0.004133420228531575}. Best is trial 1479 with value: 0.13978216740910654.
[I 2024-12-04 00:27:13,488] Trial 1740 finished with value: 0.141601345947767 and parameters: {'kernel': 'rbf', 'C': 93.56835913466855, 'gamma': 0.009936502534148914, 'epsilon': 0.0010052645908482079}. Best is trial 1479 with value: 0.13978216740910654.
[I 2024-12-04 00:27:15,473] Trial 1746 finished with value: 0.2930492267184288 and parameters: {'kernel': 'rbf', 'C': 2.777526519175821, 'gamma': 0.00916634686148868, 'epsilon': 0.0037873680863283942}. Best is trial 1479 with value: 0.13978216740910654.
[I 2024-12-04 00:27:15,595] Trial 1747 finished with value: 0.2831126058027874 and parameters: {'kernel': 'rbf', 'C': 21.6540086791151, 'gamma': 0.0017173888084235733, 'epsilon': 0.003520982160958821}. Best is trial 1479 with value: 0.13978216740910654.
[I 2024-12-04 00:27:17,284] Trial 1748 finished with value: 0.21194701213548897 and parameters: {'kernel': 'rbf', 'C': 91.0044369243154, 'gamma': 0.002061127881192645, 'epsilon': 0.003817737550417324}. Best is trial 1479 with value: 0.13978216740910654.
[I 2024-12-04 00:27:17,660] Trial 1749 finished with value: 0.200938737918963 and parameters: {'kernel': 'rbf', 'C': 18.59798438251025, 'gamma': 0.008611576602390479, 'epsilon': 0.0031499982163088196}. Best is trial 1479 with value: 0.13978216740910654.
[I 2024-12-04 00:27:18,970] Trial 1750 finished with value: 0.9984821401816592 and parameters: {'kernel': 'poly', 'C': 0.21490711623016265, 'gamma': 0.00010288192386313033, 'epsilon': 0.006864779316123835}. Best is trial 1479 with value: 0.13978216740910654.
[I 2024-12-04 00:27:19,938] Trial 1743 finished with value: 0.1721688831340132 and parameters: {'kernel': 'rbf', 'C': 99.80835219175951, 'gamma': 0.020770149576416735, 'epsilon': 0.0020085041287637626}. Best is trial 1479 with value: 0.13978216740910654.
[I 2024-12-04 00:27:20,559] Trial 1753 finished with value: 0.8491741305369892 and parameters: {'kernel': 'poly', 'C': 0.0025757662337047202, 'gamma': 0.03850852889852743, 'epsilon': 0.07558871318029746}. Best is trial 1479 with value: 0.13978216740910654.
[I 2024-12-04 00:27:21,528] Trial 1751 finished with value: 0.15650006672120692 and parameters: {'kernel': 'rbf', 'C': 88.88750509470458, 'gamma': 0.004868852392641104, 'epsilon': 0.002281661624232589}. Best is trial 1479 with value: 0.13978216740910654.
[I 2024-12-04 00:27:24,745] Trial 1752 finished with value: 0.5850769604327427 and parameters: {'kernel': 'poly', 'C': 0.3827461664202151, 'gamma': 0.04592102861919956, 'epsilon': 0.003222313009364518}. Best is trial 1479 with value: 0.13978216740910654.
[I 2024-12-04 00:27:25,071] Trial 1757 finished with value: 0.25489462676194674 and parameters: {'kernel': 'rbf', 'C': 27.160776988082358, 'gamma': 0.0026002549534634625, 'epsilon': 0.002668163531039344}. Best is trial 1479 with value: 0.13978216740910654.
[I 2024-12-04 00:27:27,021] Trial 1755 finished with value: 0.14119424217835772 and parameters: {'kernel': 'rbf', 'C': 89.22436521833156, 'gamma': 0.008330244135596554, 'epsilon': 0.0030932444374636727}. Best is trial 1479 with value: 0.13978216740910654.
[I 2024-12-04 00:27:28,759] Trial 1756 finished with value: 0.15637711394820403 and parameters: {'kernel': 'rbf', 'C': 99.68971913401184, 'gamma': 0.012691656800877887, 'epsilon': 0.0024726686719714463}. Best is trial 1479 with value: 0.13978216740910654.
[I 2024-12-04 00:27:28,792] Trial 1754 finished with value: 0.18270119669836846 and parameters: {'kernel': 'rbf', 'C': 86.57760728418276, 'gamma': 0.029843248252232633, 'epsilon': 0.0023335913191389513}. Best is trial 1479 with value: 0.13978216740910654.
[I 2024-12-04 00:27:30,640] Trial 1760 finished with value: 0.23465647468082262 and parameters: {'kernel': 'rbf', 'C': 18.551011436971176, 'gamma': 0.005608380251133543, 'epsilon': 0.0032811917740052728}. Best is trial 1479 with value: 0.13978216740910654.
[I 2024-12-04 00:27:32,048] Trial 1761 finished with value: 0.7662820990166496 and parameters: {'kernel': 'poly', 'C': 8.781465397830853, 'gamma': 0.005711312981108733, 'epsilon': 0.0023184112890763772}. Best is trial 1479 with value: 0.13978216740910654.
[I 2024-12-04 00:27:32,716] Trial 1762 finished with value: 0.21178367729745876 and parameters: {'kernel': 'rbf', 'C': 30.223139216057792, 'gamma': 0.005134408526506328, 'epsilon': 0.001032366899643683}. Best is trial 1479 with value: 0.13978216740910654.
[I 2024-12-04 00:27:35,582] Trial 1763 finished with value: 0.1612889242372279 and parameters: {'kernel': 'rbf', 'C': 90.11732426939236, 'gamma': 0.004348991818550227, 'epsilon': 0.0048165429852072865}. Best is trial 1479 with value: 0.13978216740910654.
[I 2024-12-04 00:27:35,625] Trial 1764 finished with value: 0.2261215531530781 and parameters: {'kernel': 'rbf', 'C': 99.08178319517889, 'gamma': 0.001433859627985181, 'epsilon': 0.001898783388800213}. Best is trial 1479 with value: 0.13978216740910654.
[I 2024-12-04 00:27:37,203] Trial 1759 finished with value: 0.1830627401744676 and parameters: {'kernel': 'rbf', 'C': 78.01367920316885, 'gamma': 0.030494335040668518, 'epsilon': 0.0010196655376959547}. Best is trial 1479 with value: 0.13978216740910654.
[I 2024-12-04 00:27:37,825] Trial 1765 finished with value: 0.14800711839016523 and parameters: {'kernel': 'rbf', 'C': 24.7136159751273, 'gamma': 0.01714005316968013, 'epsilon': 0.0027455531442761205}. Best is trial 1479 with value: 0.13978216740910654.
[I 2024-12-04 00:27:40,429] Trial 1766 finished with value: 0.15639404983452979 and parameters: {'kernel': 'rbf', 'C': 19.702304339289924, 'gamma': 0.015309982471822779, 'epsilon': 0.0029124883817052876}. Best is trial 1479 with value: 0.13978216740910654.
[I 2024-12-04 00:27:41,141] Trial 1767 finished with value: 0.14754948014043345 and parameters: {'kernel': 'rbf', 'C': 27.81042899805937, 'gamma': 0.015046751606771887, 'epsilon': 0.008780228056790327}. Best is trial 1479 with value: 0.13978216740910654.
[I 2024-12-04 00:27:41,215] Trial 1768 finished with value: 0.1850477036895305 and parameters: {'kernel': 'rbf', 'C': 18.950520620279242, 'gamma': 0.010084511862508227, 'epsilon': 0.0027478245668120377}. Best is trial 1479 with value: 0.13978216740910654.
[I 2024-12-04 00:27:43,765] Trial 1770 finished with value: 0.24380395655234816 and parameters: {'kernel': 'rbf', 'C': 17.035383090283112, 'gamma': 0.005148194142521642, 'epsilon': 0.0010426830096061}. Best is trial 1479 with value: 0.13978216740910654.
[I 2024-12-04 00:27:46,695] Trial 1772 finished with value: 0.16360143595507143 and parameters: {'kernel': 'rbf', 'C': 88.2928572211385, 'gamma': 0.004265229841809639, 'epsilon': 0.001939143431499366}. Best is trial 1479 with value: 0.13978216740910654.
[I 2024-12-04 00:27:46,935] Trial 1773 finished with value: 0.2412913843794317 and parameters: {'kernel': 'rbf', 'C': 2.3666886886210805, 'gamma': 0.02943029712987009, 'epsilon': 0.0019731418541626125}. Best is trial 1479 with value: 0.13978216740910654.
[I 2024-12-04 00:27:48,388] Trial 1771 finished with value: 0.1408248066238057 and parameters: {'kernel': 'rbf', 'C': 97.09056692638913, 'gamma': 0.006987272508674943, 'epsilon': 0.0017912968876830089}. Best is trial 1479 with value: 0.13978216740910654.
[I 2024-12-04 00:27:48,489] Trial 1769 finished with value: 0.17234312389877138 and parameters: {'kernel': 'rbf', 'C': 96.24101994846184, 'gamma': 0.021650515219068158, 'epsilon': 0.003636432427069887}. Best is trial 1479 with value: 0.13978216740910654.
[I 2024-12-04 00:27:52,067] Trial 1777 finished with value: 0.22648074091558895 and parameters: {'kernel': 'rbf', 'C': 17.151706572850006, 'gamma': 0.006726986167400481, 'epsilon': 0.0021187418322118723}. Best is trial 1479 with value: 0.13978216740910654.
[I 2024-12-04 00:27:52,243] Trial 1774 finished with value: 0.15488197865903663 and parameters: {'kernel': 'rbf', 'C': 94.89192192680142, 'gamma': 0.00479088153362661, 'epsilon': 0.003821336639070331}. Best is trial 1479 with value: 0.13978216740910654.
[I 2024-12-04 00:27:54,630] Trial 1775 finished with value: 0.22237873149545692 and parameters: {'kernel': 'rbf', 'C': 90.2489874761992, 'gamma': 0.07824024948332112, 'epsilon': 0.003529788668631242}. Best is trial 1479 with value: 0.13978216740910654.
[I 2024-12-04 00:27:57,770] Trial 1780 finished with value: 0.3852408228643212 and parameters: {'kernel': 'rbf', 'C': 92.51817989894825, 'gamma': 0.00013932557038435464, 'epsilon': 0.09290423831677028}. Best is trial 1479 with value: 0.13978216740910654.
[I 2024-12-04 00:27:58,608] Trial 1779 finished with value: 0.1487695391047702 and parameters: {'kernel': 'rbf', 'C': 20.31886474085224, 'gamma': 0.020008148793115445, 'epsilon': 0.0010299246718317669}. Best is trial 1479 with value: 0.13978216740910654.
[I 2024-12-04 00:27:58,682] Trial 1778 finished with value: 0.18186467246475513 and parameters: {'kernel': 'rbf', 'C': 21.531918948613193, 'gamma': 0.038733676005936885, 'epsilon': 0.0027402992574398254}. Best is trial 1479 with value: 0.13978216740910654.
[I 2024-12-04 00:27:59,705] Trial 1776 finished with value: 0.17208520188194126 and parameters: {'kernel': 'rbf', 'C': 84.64640414098439, 'gamma': 0.021130456923835316, 'epsilon': 0.0010867660706697206}. Best is trial 1479 with value: 0.13978216740910654.
[I 2024-12-04 00:28:00,694] Trial 1781 finished with value: 0.4089889957634306 and parameters: {'kernel': 'rbf', 'C': 3.7768159568244237, 'gamma': 0.0017682606867781877, 'epsilon': 0.002021242583452605}. Best is trial 1479 with value: 0.13978216740910654.
[I 2024-12-04 00:28:02,377] Trial 1782 finished with value: 0.25661235412232336 and parameters: {'kernel': 'rbf', 'C': 82.60867279893306, 'gamma': 0.0008827689335720271, 'epsilon': 0.005846693516803579}. Best is trial 1479 with value: 0.13978216740910654.
[I 2024-12-04 00:28:02,997] Trial 1784 finished with value: 0.6644868472102208 and parameters: {'kernel': 'sigmoid', 'C': 15.682624731677048, 'gamma': 0.00027484411012643537, 'epsilon': 0.006669426303538675}. Best is trial 1479 with value: 0.13978216740910654.
[I 2024-12-04 00:28:04,204] Trial 1785 finished with value: 0.27986722054312796 and parameters: {'kernel': 'rbf', 'C': 7.458645943776587, 'gamma': 0.00478564723733386, 'epsilon': 0.007272533304695017}. Best is trial 1479 with value: 0.13978216740910654.
[I 2024-12-04 00:28:05,699] Trial 1786 finished with value: 0.25204066615133464 and parameters: {'kernel': 'rbf', 'C': 22.279253865061953, 'gamma': 0.0033964634510833614, 'epsilon': 0.0026518935738079293}. Best is trial 1479 with value: 0.13978216740910654.
[I 2024-12-04 00:28:07,196] Trial 1788 finished with value: 0.9464105825902338 and parameters: {'kernel': 'rbf', 'C': 0.015419747786992708, 'gamma': 0.4751444714893524, 'epsilon': 0.04244913422722355}. Best is trial 1479 with value: 0.13978216740910654.
[I 2024-12-04 00:28:10,195] Trial 1790 finished with value: 1731.58202015238 and parameters: {'kernel': 'sigmoid', 'C': 95.80445748044902, 'gamma': 0.018682067213537053, 'epsilon': 0.019527210751055582}. Best is trial 1479 with value: 0.13978216740910654.
[I 2024-12-04 00:28:11,216] Trial 1787 finished with value: 0.1580018917839695 and parameters: {'kernel': 'rbf', 'C': 99.30568780027714, 'gamma': 0.013405478426675095, 'epsilon': 0.006602025314019513}. Best is trial 1479 with value: 0.13978216740910654.
[I 2024-12-04 00:28:11,218] Trial 1538 finished with value: 0.3528933087915019 and parameters: {'kernel': 'linear', 'C': 81.37911847367396, 'gamma': 0.0011902432145908038, 'epsilon': 0.0013402452974062998}. Best is trial 1479 with value: 0.13978216740910654.
[I 2024-12-04 00:28:12,895] Trial 1789 finished with value: 0.14113842011828695 and parameters: {'kernel': 'rbf', 'C': 89.6028552124634, 'gamma': 0.009399550216963969, 'epsilon': 0.0012631327764225334}. Best is trial 1479 with value: 0.13978216740910654.
[I 2024-12-04 00:28:14,505] Trial 1792 finished with value: 0.16268176131984763 and parameters: {'kernel': 'rbf', 'C': 17.74049384496776, 'gamma': 0.014846881050135836, 'epsilon': 0.002153196556087317}. Best is trial 1479 with value: 0.13978216740910654.
[I 2024-12-04 00:28:14,785] Trial 1791 finished with value: 0.14739955777580044 and parameters: {'kernel': 'rbf', 'C': 82.49192532073985, 'gamma': 0.006274803217373532, 'epsilon': 0.0010345029793021139}. Best is trial 1479 with value: 0.13978216740910654.
[I 2024-12-04 00:28:15,178] Trial 1793 finished with value: 0.17075210670954602 and parameters: {'kernel': 'rbf', 'C': 94.67690691604568, 'gamma': 0.00365101077447065, 'epsilon': 0.0022741978957703524}. Best is trial 1479 with value: 0.13978216740910654.
[I 2024-12-04 00:28:18,691] Trial 1795 finished with value: 0.1850034069529697 and parameters: {'kernel': 'rbf', 'C': 92.14374093931197, 'gamma': 0.00311202985975975, 'epsilon': 0.0010344936446211822}. Best is trial 1479 with value: 0.13978216740910654.
[I 2024-12-04 00:28:20,136] Trial 1796 finished with value: 0.14283921693280244 and parameters: {'kernel': 'rbf', 'C': 73.5160511497987, 'gamma': 0.007697735406804177, 'epsilon': 0.001046591864240073}. Best is trial 1479 with value: 0.13978216740910654.
[I 2024-12-04 00:28:23,332] Trial 1797 finished with value: 0.1702054632125548 and parameters: {'kernel': 'rbf', 'C': 85.40451376009545, 'gamma': 0.02044562041929897, 'epsilon': 0.003372348840023962}. Best is trial 1479 with value: 0.13978216740910654.
[I 2024-12-04 00:28:24,055] Trial 1799 finished with value: 0.2612692487632247 and parameters: {'kernel': 'rbf', 'C': 36.33622744572618, 'gamma': 0.0016425010985324955, 'epsilon': 0.00100527826008366}. Best is trial 1479 with value: 0.13978216740910654.
[I 2024-12-04 00:28:24,057] Trial 1745 finished with value: 0.35256908566519624 and parameters: {'kernel': 'linear', 'C': 12.73449289127469, 'gamma': 0.004317106854840622, 'epsilon': 0.0041330517354018345}. Best is trial 1479 with value: 0.13978216740910654.
[I 2024-12-04 00:28:24,058] Trial 1448 finished with value: 0.35263873646505856 and parameters: {'kernel': 'linear', 'C': 79.88803994622322, 'gamma': 0.004963298265966767, 'epsilon': 0.0018011359869693191}. Best is trial 1479 with value: 0.13978216740910654.
[I 2024-12-04 00:28:25,857] Trial 1800 finished with value: 0.7916260507115094 and parameters: {'kernel': 'poly', 'C': 0.1358599849490422, 'gamma': 0.01805186052521824, 'epsilon': 0.0010554438551180988}. Best is trial 1479 with value: 0.13978216740910654.
[I 2024-12-04 00:28:25,974] Trial 1798 finished with value: 0.1589757618489783 and parameters: {'kernel': 'rbf', 'C': 94.68051143155776, 'gamma': 0.013666903395359406, 'epsilon': 0.0018196199325424202}. Best is trial 1479 with value: 0.13978216740910654.
[I 2024-12-04 00:28:29,012] Trial 1804 finished with value: 123.72648841115421 and parameters: {'kernel': 'sigmoid', 'C': 28.064500360325944, 'gamma': 0.0034354047997605794, 'epsilon': 0.003228636172816738}. Best is trial 1479 with value: 0.13978216740910654.
[I 2024-12-04 00:28:29,554] Trial 1805 finished with value: 0.6919578789969748 and parameters: {'kernel': 'poly', 'C': 90.44663253668197, 'gamma': 0.004202719749877894, 'epsilon': 0.0011214497915524408}. Best is trial 1479 with value: 0.13978216740910654.
