[I 2024-12-03 18:59:21,223] Trial 1264 finished with value: 0.1381641551206942 and parameters: {'kernel': 'linear', 'C': 16.928845147028984, 'gamma': 0.004898753074286228, 'epsilon': 0.007648974666169091}. Best is trial 345 with value: 0.13438257115663557.
[I 2024-12-03 18:59:21,730] Trial 1277 finished with value: 0.13575515028688043 and parameters: {'kernel': 'linear', 'C': 12.487777024604275, 'gamma': 0.004332537052917219, 'epsilon': 0.057963742610099546}. Best is trial 345 with value: 0.13438257115663557.
[I 2024-12-03 18:59:22,927] Trial 1281 finished with value: 0.364804042977836 and parameters: {'kernel': 'poly', 'C': 0.0035482128905721896, 'gamma': 0.3416160881035708, 'epsilon': 0.0015601914897762788}. Best is trial 345 with value: 0.13438257115663557.
[I 2024-12-03 18:59:23,381] Trial 1270 finished with value: 0.1352325291716638 and parameters: {'kernel': 'linear', 'C': 26.91214987967657, 'gamma': 0.0022101799973008197, 'epsilon': 0.05734383118330656}. Best is trial 345 with value: 0.13438257115663557.
[I 2024-12-03 18:59:23,871] Trial 1268 finished with value: 0.13559129171900505 and parameters: {'kernel': 'linear', 'C': 20.94372700812543, 'gamma': 0.04462123149729377, 'epsilon': 0.027688170664890124}. Best is trial 345 with value: 0.13438257115663557.
[I 2024-12-03 18:59:24,751] Trial 1197 finished with value: 0.1376444297355416 and parameters: {'kernel': 'linear', 'C': 96.33322194303017, 'gamma': 0.0032415079020255352, 'epsilon': 0.018242062292112407}. Best is trial 345 with value: 0.13438257115663557.
[I 2024-12-03 18:59:25,172] Trial 1211 finished with value: 0.13476643178061923 and parameters: {'kernel': 'linear', 'C': 99.19722521421541, 'gamma': 0.0029812641375660024, 'epsilon': 0.030253766280987825}. Best is trial 345 with value: 0.13438257115663557.
[I 2024-12-03 18:59:25,227] Trial 1191 finished with value: 0.13788224157854098 and parameters: {'kernel': 'linear', 'C': 91.89211332032183, 'gamma': 0.024060606866766927, 'epsilon': 0.013280883882757458}. Best is trial 345 with value: 0.13438257115663557.
[I 2024-12-03 18:59:25,229] Trial 1286 finished with value: 0.326839086388085 and parameters: {'kernel': 'rbf', 'C': 2.038552217555187, 'gamma': 0.0021257586471025627, 'epsilon': 0.01962529725191388}. Best is trial 345 with value: 0.13438257115663557.
[I 2024-12-03 18:59:29,661] Trial 1235 finished with value: 0.13687705710217282 and parameters: {'kernel': 'linear', 'C': 95.94879820346864, 'gamma': 0.02285960508356675, 'epsilon': 0.044618021609443455}. Best is trial 345 with value: 0.13438257115663557.
[I 2024-12-03 18:59:31,565] Trial 1188 finished with value: 0.1381800511027852 and parameters: {'kernel': 'linear', 'C': 95.74383324332692, 'gamma': 0.015490700666479083, 'epsilon': 0.006415079402713011}. Best is trial 345 with value: 0.13438257115663557.
[I 2024-12-03 18:59:37,855] Trial 1233 finished with value: 0.13528061288442175 and parameters: {'kernel': 'linear', 'C': 87.59645312568807, 'gamma': 0.0042665459265772395, 'epsilon': 0.06012905985223174}. Best is trial 345 with value: 0.13438257115663557.
[I 2024-12-03 18:59:39,009] Trial 1279 finished with value: 0.1398218396905355 and parameters: {'kernel': 'linear', 'C': 98.19723755925959, 'gamma': 0.0006288433951174388, 'epsilon': 0.08643418805596674}. Best is trial 345 with value: 0.13438257115663557.
[I 2024-12-03 18:59:43,020] Trial 1232 finished with value: 0.13754484276431198 and parameters: {'kernel': 'linear', 'C': 95.38775927676934, 'gamma': 0.0006330321371671191, 'epsilon': 0.020993564540301216}. Best is trial 345 with value: 0.13438257115663557.
[I 2024-12-03 18:59:45,496] Trial 1294 finished with value: 0.13815674939302203 and parameters: {'kernel': 'linear', 'C': 6.092150160751721, 'gamma': 0.01195942919168419, 'epsilon': 0.014459663443800801}. Best is trial 345 with value: 0.13438257115663557.
[I 2024-12-03 18:59:47,216] Trial 1285 finished with value: 0.13803566699722752 and parameters: {'kernel': 'linear', 'C': 16.479783506512565, 'gamma': 0.0005693715265941041, 'epsilon': 0.016524735476257952}. Best is trial 345 with value: 0.13438257115663557.
[I 2024-12-03 19:00:00,055] Trial 1243 finished with value: 0.1378568978110791 and parameters: {'kernel': 'linear', 'C': 97.80033240011373, 'gamma': 0.08489291824050971, 'epsilon': 0.008876976764338818}. Best is trial 345 with value: 0.13438257115663557.
[I 2024-12-03 19:00:02,463] Trial 1282 finished with value: 0.13819973930934656 and parameters: {'kernel': 'linear', 'C': 42.9689511572719, 'gamma': 0.010069595673561277, 'epsilon': 0.015948348961908814}. Best is trial 345 with value: 0.13438257115663557.
[I 2024-12-03 19:00:04,990] Trial 1278 finished with value: 0.13731045330643266 and parameters: {'kernel': 'linear', 'C': 93.30240457094428, 'gamma': 0.011658068658439885, 'epsilon': 0.022085594378963316}. Best is trial 345 with value: 0.13438257115663557.
[I 2024-12-03 19:00:09,540] Trial 1252 finished with value: 0.13561196947572185 and parameters: {'kernel': 'linear', 'C': 98.61071803303, 'gamma': 0.0012810288824675225, 'epsilon': 0.03490235256144617}. Best is trial 345 with value: 0.13438257115663557.
[I 2024-12-03 19:00:09,542] Trial 1300 finished with value: 0.13760229075832378 and parameters: {'kernel': 'linear', 'C': 5.596724267638235, 'gamma': 0.1013522077341203, 'epsilon': 0.005163079412386437}. Best is trial 345 with value: 0.13438257115663557.
[I 2024-12-03 19:00:10,731] Trial 1302 finished with value: 1.4748960405721585 and parameters: {'kernel': 'sigmoid', 'C': 0.025735641272700647, 'gamma': 0.9684493303911026, 'epsilon': 0.006017996217069001}. Best is trial 345 with value: 0.13438257115663557.
[I 2024-12-03 19:00:11,514] Trial 1259 finished with value: 0.13512066928561758 and parameters: {'kernel': 'linear', 'C': 99.58705216482406, 'gamma': 0.0018371927303785433, 'epsilon': 0.03862603820073659}. Best is trial 345 with value: 0.13438257115663557.
[I 2024-12-03 19:00:12,815] Trial 1305 finished with value: 1.3281189728011762 and parameters: {'kernel': 'rbf', 'C': 0.0014357537962341254, 'gamma': 0.020447716427681475, 'epsilon': 0.0011306525773769934}. Best is trial 345 with value: 0.13438257115663557.
[I 2024-12-03 19:00:19,478] Trial 1292 finished with value: 0.13490971187442352 and parameters: {'kernel': 'linear', 'C': 77.05970637676694, 'gamma': 0.0040647742937806085, 'epsilon': 0.03260617815594887}. Best is trial 345 with value: 0.13438257115663557.
[I 2024-12-03 19:00:20,834] Trial 1307 finished with value: 336.02512560767696 and parameters: {'kernel': 'sigmoid', 'C': 71.94359839690827, 'gamma': 0.00872245620667617, 'epsilon': 0.031205739776107723}. Best is trial 345 with value: 0.13438257115663557.
[I 2024-12-03 19:00:21,548] Trial 1288 finished with value: 0.13828447170493266 and parameters: {'kernel': 'linear', 'C': 25.797589154267325, 'gamma': 0.0013842455820755359, 'epsilon': 0.010723699340373481}. Best is trial 345 with value: 0.13438257115663557.
[I 2024-12-03 19:00:22,174] Trial 1301 finished with value: 0.13661676018567193 and parameters: {'kernel': 'linear', 'C': 19.203683125219534, 'gamma': 0.07373326714452656, 'epsilon': 0.02323409220411555}. Best is trial 345 with value: 0.13438257115663557.
[I 2024-12-03 19:00:22,360] Trial 1295 finished with value: 0.1351294954055792 and parameters: {'kernel': 'linear', 'C': 90.0741006334885, 'gamma': 0.0023404426895288367, 'epsilon': 0.0562792118021631}. Best is trial 345 with value: 0.13438257115663557.
[I 2024-12-03 19:00:22,661] Trial 1296 finished with value: 0.1381356220397729 and parameters: {'kernel': 'linear', 'C': 40.4212655935995, 'gamma': 0.0013841165516906447, 'epsilon': 0.01511539849408361}. Best is trial 345 with value: 0.13438257115663557.
[I 2024-12-03 19:00:24,131] Trial 1309 finished with value: 0.1825618557404634 and parameters: {'kernel': 'rbf', 'C': 30.853037821272604, 'gamma': 0.006063007060952547, 'epsilon': 0.10338474349652188}. Best is trial 345 with value: 0.13438257115663557.
[I 2024-12-03 19:00:24,210] Trial 1265 finished with value: 0.13566015125481254 and parameters: {'kernel': 'linear', 'C': 78.93135944412079, 'gamma': 0.010340557626838795, 'epsilon': 0.027229667584126867}. Best is trial 345 with value: 0.13438257115663557.
[I 2024-12-03 19:00:24,446] Trial 1311 finished with value: 1.3013897407264103 and parameters: {'kernel': 'rbf', 'C': 0.015936443893517123, 'gamma': 0.0008735457685825294, 'epsilon': 0.10766944185101895}. Best is trial 345 with value: 0.13438257115663557.
[I 2024-12-03 19:00:26,676] Trial 1262 finished with value: 0.13566004611107882 and parameters: {'kernel': 'linear', 'C': 95.58522772420022, 'gamma': 0.004353496447300362, 'epsilon': 0.0342906021935146}. Best is trial 345 with value: 0.13438257115663557.
[I 2024-12-03 19:00:27,305] Trial 1224 finished with value: 0.13815987924696213 and parameters: {'kernel': 'linear', 'C': 93.34058972648316, 'gamma': 0.003987562185433527, 'epsilon': 0.0071544354558206675}. Best is trial 345 with value: 0.13438257115663557.
[I 2024-12-03 19:00:27,727] Trial 1284 finished with value: 0.1373237295909868 and parameters: {'kernel': 'linear', 'C': 74.20077152614905, 'gamma': 0.03981442905684459, 'epsilon': 0.020231963077213}. Best is trial 345 with value: 0.13438257115663557.
[I 2024-12-03 19:00:31,536] Trial 1303 finished with value: 0.1381255376015278 and parameters: {'kernel': 'linear', 'C': 22.49754689647636, 'gamma': 0.003599137078284219, 'epsilon': 0.017046737520540842}. Best is trial 345 with value: 0.13438257115663557.
[I 2024-12-03 19:00:32,310] Trial 1304 finished with value: 0.13624255315189665 and parameters: {'kernel': 'linear', 'C': 20.97741093584167, 'gamma': 0.002239175085889738, 'epsilon': 0.026075708755717516}. Best is trial 345 with value: 0.13438257115663557.
[I 2024-12-03 19:00:32,726] Trial 1276 finished with value: 0.1368634966275117 and parameters: {'kernel': 'linear', 'C': 94.90051296398546, 'gamma': 0.03898224153810833, 'epsilon': 0.0446186866588118}. Best is trial 345 with value: 0.13438257115663557.
[I 2024-12-03 19:00:33,513] Trial 1280 finished with value: 0.13805225637545784 and parameters: {'kernel': 'linear', 'C': 70.07786885763046, 'gamma': 0.0020814000245650112, 'epsilon': 0.009746592844619423}. Best is trial 345 with value: 0.13438257115663557.
[I 2024-12-03 19:00:33,530] Trial 1320 finished with value: 0.24265856576362302 and parameters: {'kernel': 'linear', 'C': 0.0609551439029679, 'gamma': 0.05707576641662913, 'epsilon': 0.052789856793621075}. Best is trial 345 with value: 0.13438257115663557.
[I 2024-12-03 19:00:34,868] Trial 1322 finished with value: 1.0678773589361064 and parameters: {'kernel': 'poly', 'C': 91.02673547071511, 'gamma': 0.0011446410583553868, 'epsilon': 0.018293586820488754}. Best is trial 345 with value: 0.13438257115663557.
[I 2024-12-03 19:00:36,652] Trial 1323 finished with value: 0.14756464785198017 and parameters: {'kernel': 'linear', 'C': 20.81687574611727, 'gamma': 0.026767739166553617, 'epsilon': 0.13657324324369566}. Best is trial 345 with value: 0.13438257115663557.
[I 2024-12-03 19:00:37,739] Trial 1317 finished with value: 0.13542047919031439 and parameters: {'kernel': 'linear', 'C': 11.499090303552872, 'gamma': 0.03602504142509377, 'epsilon': 0.03751108284931424}. Best is trial 345 with value: 0.13438257115663557.
[I 2024-12-03 19:00:39,724] Trial 1316 finished with value: 0.13727015235759696 and parameters: {'kernel': 'linear', 'C': 14.50535981106481, 'gamma': 0.004990655317747619, 'epsilon': 0.02309191466272892}. Best is trial 345 with value: 0.13438257115663557.
[I 2024-12-03 19:00:41,334] Trial 1318 finished with value: 0.1351199650568142 and parameters: {'kernel': 'linear', 'C': 25.990870841255123, 'gamma': 0.009346371508909102, 'epsilon': 0.06345234422754933}. Best is trial 345 with value: 0.13438257115663557.
[I 2024-12-03 19:00:43,026] Trial 1289 finished with value: 0.13609085272157528 and parameters: {'kernel': 'linear', 'C': 39.676098502393316, 'gamma': 0.006228122474069529, 'epsilon': 0.025234494639784624}. Best is trial 345 with value: 0.13438257115663557.
[I 2024-12-03 19:00:50,657] Trial 1327 finished with value: 0.13820246767376637 and parameters: {'kernel': 'linear', 'C': 9.062395451624528, 'gamma': 0.01200863292627682, 'epsilon': 0.012967718624401397}. Best is trial 345 with value: 0.13438257115663557.
[I 2024-12-03 19:00:52,124] Trial 1244 finished with value: 0.1358048715922493 and parameters: {'kernel': 'linear', 'C': 95.2252351404788, 'gamma': 0.005211202986536619, 'epsilon': 0.026086285747248972}. Best is trial 345 with value: 0.13438257115663557.
[I 2024-12-03 19:00:52,968] Trial 1297 finished with value: 0.135069655913371 and parameters: {'kernel': 'linear', 'C': 76.06996115276829, 'gamma': 0.005376917208763903, 'epsilon': 0.029698631983982735}. Best is trial 345 with value: 0.13438257115663557.
[I 2024-12-03 19:00:54,227] Trial 1329 finished with value: 0.13578384815394987 and parameters: {'kernel': 'linear', 'C': 9.679167502384827, 'gamma': 0.0075619434131636585, 'epsilon': 0.05795587179347112}. Best is trial 345 with value: 0.13438257115663557.
[I 2024-12-03 19:00:54,682] Trial 1328 finished with value: 0.13817394164744837 and parameters: {'kernel': 'linear', 'C': 9.220356418718337, 'gamma': 0.2361974278551868, 'epsilon': 0.01340357588939596}. Best is trial 345 with value: 0.13438257115663557.
[I 2024-12-03 19:00:59,261] Trial 1333 finished with value: 0.13612109595538457 and parameters: {'kernel': 'linear', 'C': 4.048757290672429, 'gamma': 0.033983520753705684, 'epsilon': 0.04044290232350632}. Best is trial 345 with value: 0.13438257115663557.
[I 2024-12-03 19:01:00,055] Trial 1298 finished with value: 0.13762586013889033 and parameters: {'kernel': 'linear', 'C': 76.69138479957502, 'gamma': 0.0007273715019754996, 'epsilon': 0.0212166658487712}. Best is trial 345 with value: 0.13438257115663557.
[I 2024-12-03 19:01:01,315] Trial 1336 finished with value: 0.18467272694640807 and parameters: {'kernel': 'rbf', 'C': 81.32061797464566, 'gamma': 0.0006106884080966679, 'epsilon': 0.04270244665217019}. Best is trial 345 with value: 0.13438257115663557.
[I 2024-12-03 19:01:02,914] Trial 1330 finished with value: 0.13552347569694215 and parameters: {'kernel': 'linear', 'C': 13.20753048018813, 'gamma': 0.007939084109611727, 'epsilon': 0.032180828386191435}. Best is trial 345 with value: 0.13438257115663557.
[I 2024-12-03 19:01:04,852] Trial 1338 finished with value: 0.14948809231450808 and parameters: {'kernel': 'linear', 'C': 6.402682292221979, 'gamma': 0.06291884075759896, 'epsilon': 0.1292870087227507}. Best is trial 345 with value: 0.13438257115663557.
[I 2024-12-03 19:01:08,536] Trial 1290 finished with value: 0.13490859421364834 and parameters: {'kernel': 'linear', 'C': 91.17147307879078, 'gamma': 0.01057432571795843, 'epsilon': 0.029969821908120874}. Best is trial 345 with value: 0.13438257115663557.
[I 2024-12-03 19:01:09,547] Trial 1340 finished with value: 1.3592166069475349 and parameters: {'kernel': 'sigmoid', 'C': 0.00753890488553332, 'gamma': 0.00017839702158014574, 'epsilon': 0.0014056772674836333}. Best is trial 345 with value: 0.13438257115663557.
[I 2024-12-03 19:01:10,182] Trial 1335 finished with value: 0.13706161264100714 and parameters: {'kernel': 'linear', 'C': 31.314653747021705, 'gamma': 0.01690499955555886, 'epsilon': 0.07432609367155457}. Best is trial 345 with value: 0.13438257115663557.
[I 2024-12-03 19:01:11,142] Trial 1291 finished with value: 0.13734617422933432 and parameters: {'kernel': 'linear', 'C': 90.87726004345735, 'gamma': 0.008895458203184877, 'epsilon': 0.02109296255713682}. Best is trial 345 with value: 0.13438257115663557.
[I 2024-12-03 19:01:12,404] Trial 1343 finished with value: 8.394479055456218 and parameters: {'kernel': 'sigmoid', 'C': 8.346650829972724, 'gamma': 0.0038911602671225422, 'epsilon': 0.020158600449241507}. Best is trial 345 with value: 0.13438257115663557.
[I 2024-12-03 19:01:13,413] Trial 1331 finished with value: 0.13802214169623486 and parameters: {'kernel': 'linear', 'C': 15.813461283155776, 'gamma': 0.004567432120044586, 'epsilon': 0.013563004092362845}. Best is trial 345 with value: 0.13438257115663557.
[I 2024-12-03 19:01:14,330] Trial 1339 finished with value: 0.1357208440940585 and parameters: {'kernel': 'linear', 'C': 11.599275897455154, 'gamma': 0.2633888046263515, 'epsilon': 0.058391475676891756}. Best is trial 345 with value: 0.13438257115663557.
[I 2024-12-03 19:01:14,733] Trial 1345 finished with value: 0.5180613836888246 and parameters: {'kernel': 'rbf', 'C': 6.83215936000446, 'gamma': 0.11532402242695293, 'epsilon': 0.05649966998464305}. Best is trial 345 with value: 0.13438257115663557.
[I 2024-12-03 19:01:15,522] Trial 1310 finished with value: 0.13709420465946032 and parameters: {'kernel': 'linear', 'C': 94.3819832608205, 'gamma': 0.0026508886708136335, 'epsilon': 0.04828142748838188}. Best is trial 345 with value: 0.13438257115663557.
[I 2024-12-03 19:01:15,888] Trial 1274 finished with value: 0.13845819632239317 and parameters: {'kernel': 'linear', 'C': 95.49476331054306, 'gamma': 0.03645167901737978, 'epsilon': 0.012285809463585526}. Best is trial 345 with value: 0.13438257115663557.
[I 2024-12-03 19:01:16,238] Trial 1347 finished with value: 0.4235782739235756 and parameters: {'kernel': 'poly', 'C': 94.61284796594676, 'gamma': 0.0046698399625722704, 'epsilon': 0.0550884509663705}. Best is trial 345 with value: 0.13438257115663557.
[I 2024-12-03 19:01:16,688] Trial 1283 finished with value: 0.13806292058945907 and parameters: {'kernel': 'linear', 'C': 94.55109329834744, 'gamma': 0.004202756748812081, 'epsilon': 0.009934739131517796}. Best is trial 345 with value: 0.13438257115663557.
[I 2024-12-03 19:01:18,172] Trial 1349 finished with value: 0.993499476602863 and parameters: {'kernel': 'sigmoid', 'C': 0.03793939565079746, 'gamma': 0.005166245288520588, 'epsilon': 0.008777576699552193}. Best is trial 345 with value: 0.13438257115663557.
[I 2024-12-03 19:01:21,068] Trial 1341 finished with value: 0.13558506159697256 and parameters: {'kernel': 'linear', 'C': 15.10919961498799, 'gamma': 0.02283588874665695, 'epsilon': 0.05875539712556473}. Best is trial 345 with value: 0.13438257115663557.
[I 2024-12-03 19:01:21,802] Trial 1351 finished with value: 0.138665606283297 and parameters: {'kernel': 'linear', 'C': 1.5259257815779268, 'gamma': 0.004144129993461618, 'epsilon': 0.016697465625908275}. Best is trial 345 with value: 0.13438257115663557.
[I 2024-12-03 19:01:24,226] Trial 1354 finished with value: 0.14640341730780332 and parameters: {'kernel': 'linear', 'C': 5.17269020201168, 'gamma': 0.012383920699007026, 'epsilon': 0.10525579021611675}. Best is trial 345 with value: 0.13438257115663557.
[I 2024-12-03 19:01:27,083] Trial 1344 finished with value: 0.13528247233744906 and parameters: {'kernel': 'linear', 'C': 27.117627127845594, 'gamma': 0.015316769645940401, 'epsilon': 0.06468458497666882}. Best is trial 345 with value: 0.13438257115663557.
[I 2024-12-03 19:01:32,567] Trial 1352 finished with value: 0.13453395465199983 and parameters: {'kernel': 'linear', 'C': 14.966779192143772, 'gamma': 0.003884206379950785, 'epsilon': 0.03972917554929508}. Best is trial 345 with value: 0.13438257115663557.
[I 2024-12-03 19:01:32,599] Trial 1308 finished with value: 0.1355561568068844 and parameters: {'kernel': 'linear', 'C': 91.90307013790283, 'gamma': 0.0029296318059814953, 'epsilon': 0.03372903358449524}. Best is trial 345 with value: 0.13438257115663557.
[I 2024-12-03 19:01:37,518] Trial 1357 finished with value: 0.1360791616206532 and parameters: {'kernel': 'linear', 'C': 3.807398000419402, 'gamma': 0.002048323281506594, 'epsilon': 0.0376456535048624}. Best is trial 345 with value: 0.13438257115663557.
[I 2024-12-03 19:01:40,492] Trial 1353 finished with value: 0.1383067053509743 and parameters: {'kernel': 'linear', 'C': 10.906144450579314, 'gamma': 0.024300894118462615, 'epsilon': 0.010541972763534493}. Best is trial 345 with value: 0.13438257115663557.
[I 2024-12-03 19:01:41,448] Trial 1314 finished with value: 0.13518406933336982 and parameters: {'kernel': 'linear', 'C': 79.39887028135634, 'gamma': 0.07330156347873751, 'epsilon': 0.03326071640199264}. Best is trial 345 with value: 0.13438257115663557.
[I 2024-12-03 19:01:42,001] Trial 1350 finished with value: 0.14094168305224353 and parameters: {'kernel': 'linear', 'C': 93.76144775622558, 'gamma': 0.0065095824707036235, 'epsilon': 0.10864339905768877}. Best is trial 345 with value: 0.13438257115663557.
[I 2024-12-03 19:01:42,950] Trial 1356 finished with value: 0.13572826296471122 and parameters: {'kernel': 'linear', 'C': 14.37185471340711, 'gamma': 0.02403488847205601, 'epsilon': 0.03415486672832433}. Best is trial 345 with value: 0.13438257115663557.
[I 2024-12-03 19:01:43,648] Trial 1358 finished with value: 0.13574117743218575 and parameters: {'kernel': 'linear', 'C': 10.615226882530148, 'gamma': 0.004636357799579384, 'epsilon': 0.05808494731338439}. Best is trial 345 with value: 0.13438257115663557.
[I 2024-12-03 19:01:44,399] Trial 1299 finished with value: 0.13601201327047158 and parameters: {'kernel': 'linear', 'C': 90.9857580203894, 'gamma': 0.0016705995364732136, 'epsilon': 0.025260059012358616}. Best is trial 345 with value: 0.13438257115663557.
[I 2024-12-03 19:01:45,530] Trial 1342 finished with value: 0.1359438904181918 and parameters: {'kernel': 'linear', 'C': 19.78626848935468, 'gamma': 0.001372911188567263, 'epsilon': 0.025804801879799315}. Best is trial 345 with value: 0.13438257115663557.
[I 2024-12-03 19:01:45,531] Trial 1364 finished with value: 0.2591946299682527 and parameters: {'kernel': 'linear', 'C': 20.622808987499226, 'gamma': 0.0075739833758293575, 'epsilon': 0.37859497848990925}. Best is trial 345 with value: 0.13438257115663557.
