[I 2024-12-03 18:52:34,034] Trial 918 finished with value: 0.13564247324133594 and parameters: {'kernel': 'linear', 'C': 6.950100627070932, 'gamma': 0.00011208148891150967, 'epsilon': 0.028384941923643457}. Best is trial 345 with value: 0.13438257115663557.
[I 2024-12-03 18:52:35,180] Trial 937 finished with value: 0.13751647787188404 and parameters: {'kernel': 'linear', 'C': 2.0519413245600564, 'gamma': 0.01179043523511463, 'epsilon': 0.04945216897932581}. Best is trial 345 with value: 0.13438257115663557.
[I 2024-12-03 18:52:35,975] Trial 940 finished with value: 0.13629970992399829 and parameters: {'kernel': 'linear', 'C': 3.426110176918914, 'gamma': 0.00257024362860762, 'epsilon': 0.06376401545347204}. Best is trial 345 with value: 0.13438257115663557.
[I 2024-12-03 18:52:39,010] Trial 926 finished with value: 0.13560735923614567 and parameters: {'kernel': 'linear', 'C': 16.221761924289012, 'gamma': 0.0013311870614255762, 'epsilon': 0.06715577537480498}. Best is trial 345 with value: 0.13438257115663557.
[I 2024-12-03 18:52:40,453] Trial 942 finished with value: 0.13507915468242773 and parameters: {'kernel': 'linear', 'C': 4.711857200046137, 'gamma': 0.005923910243032179, 'epsilon': 0.04990322269657093}. Best is trial 345 with value: 0.13438257115663557.
[I 2024-12-03 18:52:41,113] Trial 932 finished with value: 0.13500044770462893 and parameters: {'kernel': 'linear', 'C': 16.760454863467835, 'gamma': 0.04215753467214722, 'epsilon': 0.0617258280713199}. Best is trial 345 with value: 0.13438257115663557.
[I 2024-12-03 18:52:42,073] Trial 944 finished with value: 0.1877240749481619 and parameters: {'kernel': 'linear', 'C': 8.0006221038524, 'gamma': 0.00010636538537758512, 'epsilon': 0.23086446599988839}. Best is trial 345 with value: 0.13438257115663557.
[I 2024-12-03 18:52:42,905] Trial 868 finished with value: 0.1356441285755028 and parameters: {'kernel': 'linear', 'C': 83.00371965644361, 'gamma': 0.0063058466052200775, 'epsilon': 0.041625595636496496}. Best is trial 345 with value: 0.13438257115663557.
[I 2024-12-03 18:52:45,533] Trial 922 finished with value: 0.13618098240474352 and parameters: {'kernel': 'linear', 'C': 28.03225803161149, 'gamma': 0.004402764646415956, 'epsilon': 0.051955138451235575}. Best is trial 345 with value: 0.13438257115663557.
[I 2024-12-03 18:52:46,141] Trial 791 finished with value: 0.13474122471915964 and parameters: {'kernel': 'linear', 'C': 86.8577587748993, 'gamma': 0.006251058237946478, 'epsilon': 0.031706510815025735}. Best is trial 345 with value: 0.13438257115663557.
[I 2024-12-03 18:52:46,216] Trial 820 finished with value: 0.13824789396735382 and parameters: {'kernel': 'linear', 'C': 83.65703767077754, 'gamma': 0.005050516595692939, 'epsilon': 0.011806595802891765}. Best is trial 345 with value: 0.13438257115663557.
[I 2024-12-03 18:52:47,011] Trial 928 finished with value: 0.14405677119636662 and parameters: {'kernel': 'linear', 'C': 86.21220637496977, 'gamma': 0.0024934444489643735, 'epsilon': 0.11860809079369368}. Best is trial 345 with value: 0.13438257115663557.
[I 2024-12-03 18:52:47,585] Trial 927 finished with value: 0.1405032762388518 and parameters: {'kernel': 'linear', 'C': 80.93149754963214, 'gamma': 0.0023998488160306077, 'epsilon': 0.1081793004337324}. Best is trial 345 with value: 0.13438257115663557.
[I 2024-12-03 18:52:47,972] Trial 950 finished with value: 19.192717589492133 and parameters: {'kernel': 'sigmoid', 'C': 1.163154740736472, 'gamma': 0.10576034847656665, 'epsilon': 0.17104774582553106}. Best is trial 345 with value: 0.13438257115663557.
[I 2024-12-03 18:52:48,024] Trial 949 finished with value: 1.0611039113191365 and parameters: {'kernel': 'poly', 'C': 0.014462061107401428, 'gamma': 0.02262770451761522, 'epsilon': 0.020286607496728476}. Best is trial 345 with value: 0.13438257115663557.
[I 2024-12-03 18:52:48,158] Trial 945 finished with value: 0.13609329359233216 and parameters: {'kernel': 'linear', 'C': 5.157332143539391, 'gamma': 0.10574665181084465, 'epsilon': 0.02998531029287464}. Best is trial 345 with value: 0.13438257115663557.
[I 2024-12-03 18:52:49,053] Trial 946 finished with value: 0.14266590154102354 and parameters: {'kernel': 'linear', 'C': 20.707435674656626, 'gamma': 0.06005968560768127, 'epsilon': 0.11298589066388326}. Best is trial 345 with value: 0.13438257115663557.
[I 2024-12-03 18:52:50,501] Trial 953 finished with value: 0.14702308826067412 and parameters: {'kernel': 'linear', 'C': 1.6648023099026406, 'gamma': 0.05976525392069755, 'epsilon': 0.08228945520310339}. Best is trial 345 with value: 0.13438257115663557.
[I 2024-12-03 18:52:51,642] Trial 957 finished with value: 1.364183967532668 and parameters: {'kernel': 'poly', 'C': 0.037168128336990396, 'gamma': 0.0006414149963688276, 'epsilon': 0.13464785012528346}. Best is trial 345 with value: 0.13438257115663557.
[I 2024-12-03 18:52:52,560] Trial 948 finished with value: 0.1411047845314602 and parameters: {'kernel': 'linear', 'C': 18.61526698731434, 'gamma': 0.02656798916673453, 'epsilon': 0.10861157626421926}. Best is trial 345 with value: 0.13438257115663557.
[I 2024-12-03 18:52:53,347] Trial 935 finished with value: 0.1356635012217634 and parameters: {'kernel': 'linear', 'C': 14.836139687986082, 'gamma': 0.0029279826404764223, 'epsilon': 0.03616105732183086}. Best is trial 345 with value: 0.13438257115663557.
[I 2024-12-03 18:52:54,642] Trial 933 finished with value: 0.13506066143584494 and parameters: {'kernel': 'linear', 'C': 47.47395353320864, 'gamma': 0.011500146788268174, 'epsilon': 0.05547533857396368}. Best is trial 345 with value: 0.13438257115663557.
[I 2024-12-03 18:52:55,759] Trial 839 finished with value: 0.13749174305299822 and parameters: {'kernel': 'linear', 'C': 91.17789384672177, 'gamma': 0.025117054764774556, 'epsilon': 0.020141545204112692}. Best is trial 345 with value: 0.13438257115663557.
[I 2024-12-03 18:52:56,794] Trial 947 finished with value: 0.13557974502920686 and parameters: {'kernel': 'linear', 'C': 16.120843342661328, 'gamma': 0.018815632311397552, 'epsilon': 0.05364188606255032}. Best is trial 345 with value: 0.13438257115663557.
[I 2024-12-03 18:52:57,479] Trial 869 finished with value: 0.13555442009900287 and parameters: {'kernel': 'linear', 'C': 86.8835336552124, 'gamma': 0.0033742118257805835, 'epsilon': 0.03384818860725469}. Best is trial 345 with value: 0.13438257115663557.
[I 2024-12-03 18:52:57,952] Trial 963 finished with value: 0.19445957873978428 and parameters: {'kernel': 'rbf', 'C': 10.172385212240087, 'gamma': 0.004233365987570819, 'epsilon': 0.08438738989667692}. Best is trial 345 with value: 0.13438257115663557.
[I 2024-12-03 18:53:02,480] Trial 938 finished with value: 0.1356700276009918 and parameters: {'kernel': 'linear', 'C': 87.23757365759522, 'gamma': 0.0027265719631803095, 'epsilon': 0.0672898789605147}. Best is trial 345 with value: 0.13438257115663557.
[I 2024-12-03 18:53:02,876] Trial 956 finished with value: 0.13553390357300923 and parameters: {'kernel': 'linear', 'C': 14.15859280976216, 'gamma': 0.03813817586484095, 'epsilon': 0.028482102073550272}. Best is trial 345 with value: 0.13438257115663557.
[I 2024-12-03 18:53:03,273] Trial 962 finished with value: 0.1365958856481324 and parameters: {'kernel': 'linear', 'C': 8.909289792827726, 'gamma': 0.026347579696764205, 'epsilon': 0.04591367536025638}. Best is trial 345 with value: 0.13438257115663557.
[I 2024-12-03 18:53:03,517] Trial 958 finished with value: 0.17749854439075624 and parameters: {'kernel': 'linear', 'C': 85.14151775393745, 'gamma': 0.02431667839591099, 'epsilon': 0.19848970998234977}. Best is trial 345 with value: 0.13438257115663557.
[I 2024-12-03 18:53:03,561] Trial 843 finished with value: 0.1381292691774881 and parameters: {'kernel': 'linear', 'C': 91.12998599580385, 'gamma': 0.0025535508221880302, 'epsilon': 0.015274962395754713}. Best is trial 345 with value: 0.13438257115663557.
[I 2024-12-03 18:53:03,871] Trial 966 finished with value: 0.36888764773453653 and parameters: {'kernel': 'rbf', 'C': 32.76438258068458, 'gamma': 0.06145245106460104, 'epsilon': 0.040770788319569734}. Best is trial 345 with value: 0.13438257115663557.
[I 2024-12-03 18:53:05,127] Trial 952 finished with value: 0.13683151191942852 and parameters: {'kernel': 'linear', 'C': 17.942330474120936, 'gamma': 0.04034951947950388, 'epsilon': 0.04445802868401206}. Best is trial 345 with value: 0.13438257115663557.
[I 2024-12-03 18:53:05,688] Trial 967 finished with value: 0.14171641822147374 and parameters: {'kernel': 'linear', 'C': 13.23317092863484, 'gamma': 0.008905647499206828, 'epsilon': 0.10786032633667507}. Best is trial 345 with value: 0.13438257115663557.
[I 2024-12-03 18:53:06,061] Trial 943 finished with value: 0.13528421910143268 and parameters: {'kernel': 'linear', 'C': 35.279488404008745, 'gamma': 0.00170425480925405, 'epsilon': 0.05869628786983375}. Best is trial 345 with value: 0.13438257115663557.
[I 2024-12-03 18:53:06,471] Trial 867 finished with value: 0.13558765598034556 and parameters: {'kernel': 'linear', 'C': 92.25871996707666, 'gamma': 0.02035953428475273, 'epsilon': 0.0337714588103043}. Best is trial 345 with value: 0.13438257115663557.
[I 2024-12-03 18:53:06,639] Trial 826 finished with value: 0.13769925245218928 and parameters: {'kernel': 'linear', 'C': 93.67936879874652, 'gamma': 0.007648448943591428, 'epsilon': 0.013973634965205489}. Best is trial 345 with value: 0.13438257115663557.
[I 2024-12-03 18:53:06,726] Trial 972 finished with value: 0.6773183935370188 and parameters: {'kernel': 'rbf', 'C': 0.1359829603289509, 'gamma': 0.012708136189753822, 'epsilon': 0.0012673001809190023}. Best is trial 345 with value: 0.13438257115663557.
[I 2024-12-03 18:53:07,865] Trial 969 finished with value: 0.14232246262569337 and parameters: {'kernel': 'linear', 'C': 5.9546878024655, 'gamma': 0.05823393027483869, 'epsilon': 0.08480627245775249}. Best is trial 345 with value: 0.13438257115663557.
[I 2024-12-03 18:53:09,106] Trial 976 finished with value: 0.22372694168948803 and parameters: {'kernel': 'linear', 'C': 0.13229706520975598, 'gamma': 0.0002215050799583425, 'epsilon': 0.11716275748018472}. Best is trial 345 with value: 0.13438257115663557.
[I 2024-12-03 18:53:09,989] Trial 977 finished with value: 0.15062267149123315 and parameters: {'kernel': 'linear', 'C': 4.0383573316695855, 'gamma': 0.20726702253925244, 'epsilon': 0.11396241429226632}. Best is trial 345 with value: 0.13438257115663557.
[I 2024-12-03 18:53:11,225] Trial 975 finished with value: 0.1387408940278373 and parameters: {'kernel': 'linear', 'C': 1.5288014431540613, 'gamma': 0.0634846617667581, 'epsilon': 0.01072772591330599}. Best is trial 345 with value: 0.13438257115663557.
[I 2024-12-03 18:53:11,753] Trial 978 finished with value: 0.13506202002036163 and parameters: {'kernel': 'linear', 'C': 4.768571061778696, 'gamma': 0.016867023021006324, 'epsilon': 0.06426155488017522}. Best is trial 345 with value: 0.13438257115663557.
[I 2024-12-03 18:53:11,760] Trial 971 finished with value: 0.1362881841080321 and parameters: {'kernel': 'linear', 'C': 4.200395940486818, 'gamma': 0.01128746319678635, 'epsilon': 0.03055780908699041}. Best is trial 345 with value: 0.13438257115663557.
[I 2024-12-03 18:53:13,033] Trial 960 finished with value: 0.1429074633842923 and parameters: {'kernel': 'linear', 'C': 92.6612671777665, 'gamma': 0.025700075336351123, 'epsilon': 0.11732160849987931}. Best is trial 345 with value: 0.13438257115663557.
[I 2024-12-03 18:53:13,038] Trial 964 finished with value: 0.1373164572900785 and parameters: {'kernel': 'linear', 'C': 13.288749542507777, 'gamma': 0.012190149062714092, 'epsilon': 0.01967647919854486}. Best is trial 345 with value: 0.13438257115663557.
[I 2024-12-03 18:53:13,061] Trial 955 finished with value: 0.13519443550291335 and parameters: {'kernel': 'linear', 'C': 33.32471311386583, 'gamma': 0.03832305165397609, 'epsilon': 0.056443693048663646}. Best is trial 345 with value: 0.13438257115663557.
[I 2024-12-03 18:53:14,476] Trial 983 finished with value: 1.1413750119106465 and parameters: {'kernel': 'poly', 'C': 0.8535480855617, 'gamma': 0.00141287762758901, 'epsilon': 0.004033916833766259}. Best is trial 345 with value: 0.13438257115663557.
[I 2024-12-03 18:53:15,554] Trial 985 finished with value: 0.18959414219704004 and parameters: {'kernel': 'linear', 'C': 0.1681033752396519, 'gamma': 0.001689426915948538, 'epsilon': 0.0031948427706174494}. Best is trial 345 with value: 0.13438257115663557.
[I 2024-12-03 18:53:20,764] Trial 984 finished with value: 0.14592654527466967 and parameters: {'kernel': 'linear', 'C': 94.61999337747724, 'gamma': 0.0062381396051830575, 'epsilon': 0.13118687644815624}. Best is trial 345 with value: 0.13438257115663557.
[I 2024-12-03 18:53:21,555] Trial 974 finished with value: 0.13811613214197332 and parameters: {'kernel': 'linear', 'C': 14.493855355715361, 'gamma': 0.004183512667988314, 'epsilon': 0.013007104348659653}. Best is trial 345 with value: 0.13438257115663557.
[I 2024-12-03 18:53:21,557] Trial 981 finished with value: 0.13624682480817893 and parameters: {'kernel': 'linear', 'C': 17.882129803054678, 'gamma': 0.029609764303733393, 'epsilon': 0.06995858317165833}. Best is trial 345 with value: 0.13438257115663557.
[I 2024-12-03 18:53:21,775] Trial 882 finished with value: 0.13566365957205803 and parameters: {'kernel': 'linear', 'C': 91.58959182328726, 'gamma': 0.0037840124575810254, 'epsilon': 0.026404451698920313}. Best is trial 345 with value: 0.13438257115663557.
[I 2024-12-03 18:53:23,656] Trial 992 finished with value: 0.15969085047442852 and parameters: {'kernel': 'rbf', 'C': 24.82639457680068, 'gamma': 0.0030108022121573736, 'epsilon': 0.012722364543890943}. Best is trial 345 with value: 0.13438257115663557.
[I 2024-12-03 18:53:28,032] Trial 914 finished with value: 0.13492833162549342 and parameters: {'kernel': 'linear', 'C': 91.74098765888036, 'gamma': 0.0010531637806356125, 'epsilon': 0.062475702875181095}. Best is trial 345 with value: 0.13438257115663557.
[I 2024-12-03 18:53:28,034] Trial 954 finished with value: 0.13691280667938935 and parameters: {'kernel': 'linear', 'C': 33.27622503112192, 'gamma': 0.0375536002096411, 'epsilon': 0.023070676707927593}. Best is trial 345 with value: 0.13438257115663557.
[I 2024-12-03 18:53:28,809] Trial 951 finished with value: 0.13789805722691792 and parameters: {'kernel': 'linear', 'C': 34.524783117101485, 'gamma': 0.009229892778472715, 'epsilon': 0.006026625942854852}. Best is trial 345 with value: 0.13438257115663557.
[I 2024-12-03 18:53:29,765] Trial 995 finished with value: 0.45327777421107024 and parameters: {'kernel': 'poly', 'C': 46.19880224688575, 'gamma': 0.005270579599216609, 'epsilon': 0.003931490351301662}. Best is trial 345 with value: 0.13438257115663557.
[I 2024-12-03 18:53:31,078] Trial 980 finished with value: 0.13560839108850273 and parameters: {'kernel': 'linear', 'C': 16.59117310981582, 'gamma': 0.008345612024046867, 'epsilon': 0.03719980599032549}. Best is trial 345 with value: 0.13438257115663557.
[I 2024-12-03 18:53:31,103] Trial 993 finished with value: 0.13531403043004736 and parameters: {'kernel': 'linear', 'C': 16.314986393495165, 'gamma': 0.012722680295795345, 'epsilon': 0.06530045467509984}. Best is trial 345 with value: 0.13438257115663557.
[I 2024-12-03 18:53:31,104] Trial 997 finished with value: 1.0039740903983976 and parameters: {'kernel': 'poly', 'C': 48.47546303028143, 'gamma': 0.0008799954298510205, 'epsilon': 0.05290290511532754}. Best is trial 345 with value: 0.13438257115663557.
[I 2024-12-03 18:53:31,767] Trial 996 finished with value: 0.20735038857173696 and parameters: {'kernel': 'linear', 'C': 28.7897476954158, 'gamma': 0.0004651638615632724, 'epsilon': 0.26814851493763087}. Best is trial 345 with value: 0.13438257115663557.
[I 2024-12-03 18:53:32,900] Trial 998 finished with value: 40.26088238528754 and parameters: {'kernel': 'sigmoid', 'C': 4.73441672854372, 'gamma': 0.013885609077490943, 'epsilon': 0.13408868067496366}. Best is trial 345 with value: 0.13438257115663557.
[I 2024-12-03 18:53:33,911] Trial 979 finished with value: 0.13494779456988704 and parameters: {'kernel': 'linear', 'C': 28.568604307866575, 'gamma': 0.08016800576662311, 'epsilon': 0.040309123898949556}. Best is trial 345 with value: 0.13438257115663557.
[I 2024-12-03 18:53:34,444] Trial 982 finished with value: 0.1366339206630301 and parameters: {'kernel': 'linear', 'C': 17.681077009031178, 'gamma': 0.0033648349798527802, 'epsilon': 0.023757993679831738}. Best is trial 345 with value: 0.13438257115663557.
[I 2024-12-03 18:53:35,540] Trial 994 finished with value: 0.13670130480952636 and parameters: {'kernel': 'linear', 'C': 3.097181922297206, 'gamma': 0.06722416962171002, 'epsilon': 0.03054144639012682}. Best is trial 345 with value: 0.13438257115663557.
[I 2024-12-03 18:53:35,540] Trial 921 finished with value: 0.1366914400548269 and parameters: {'kernel': 'linear', 'C': 97.2945133199305, 'gamma': 0.040849847261322424, 'epsilon': 0.05034287934259555}. Best is trial 345 with value: 0.13438257115663557.
[I 2024-12-03 18:53:36,265] Trial 999 finished with value: 0.1437233768097311 and parameters: {'kernel': 'linear', 'C': 14.22039463496009, 'gamma': 0.0006483045993755093, 'epsilon': 0.11878043010723487}. Best is trial 345 with value: 0.13438257115663557.
[I 2024-12-03 18:53:36,740] Trial 1003 finished with value: 0.1457125543990946 and parameters: {'kernel': 'linear', 'C': 10.753953464056842, 'gamma': 0.18662767310902126, 'epsilon': 0.12387919356410586}. Best is trial 345 with value: 0.13438257115663557.
[I 2024-12-03 18:53:37,084] Trial 1000 finished with value: 0.13887664351772194 and parameters: {'kernel': 'linear', 'C': 17.30340874500817, 'gamma': 0.03942397903713345, 'epsilon': 0.08250378908448756}. Best is trial 345 with value: 0.13438257115663557.
[I 2024-12-03 18:53:38,381] Trial 1008 finished with value: 1.0520537060942523 and parameters: {'kernel': 'sigmoid', 'C': 0.03027899467894399, 'gamma': 0.01793796705509339, 'epsilon': 0.03501575828541924}. Best is trial 345 with value: 0.13438257115663557.
[I 2024-12-03 18:53:38,522] Trial 1009 finished with value: 0.2435040197048932 and parameters: {'kernel': 'linear', 'C': 3.942349239253696, 'gamma': 0.012067060142964471, 'epsilon': 0.3501405217138241}. Best is trial 345 with value: 0.13438257115663557.
[I 2024-12-03 18:53:38,749] Trial 986 finished with value: 0.13552711575875276 and parameters: {'kernel': 'linear', 'C': 17.372003083598134, 'gamma': 0.00768419540800019, 'epsilon': 0.0281615780495335}. Best is trial 345 with value: 0.13438257115663557.
[I 2024-12-03 18:53:40,520] Trial 1012 finished with value: 407.78992988557616 and parameters: {'kernel': 'sigmoid', 'C': 77.06731939448984, 'gamma': 0.009505396994686296, 'epsilon': 0.40241185250951755}. Best is trial 345 with value: 0.13438257115663557.
[I 2024-12-03 18:53:42,194] Trial 934 finished with value: 0.1355781536220597 and parameters: {'kernel': 'linear', 'C': 67.81355387000967, 'gamma': 0.011090745271084645, 'epsilon': 0.037486470020313974}. Best is trial 345 with value: 0.13438257115663557.
[I 2024-12-03 18:53:42,195] Trial 1001 finished with value: 0.13693683377453125 and parameters: {'kernel': 'linear', 'C': 14.59975621936728, 'gamma': 0.040031220976707714, 'epsilon': 0.04516412893058078}. Best is trial 345 with value: 0.13438257115663557.
[I 2024-12-03 18:53:42,726] Trial 991 finished with value: 0.1380247762626534 and parameters: {'kernel': 'linear', 'C': 13.162258328833682, 'gamma': 0.010854261899412295, 'epsilon': 0.01607650633665801}. Best is trial 345 with value: 0.13438257115663557.
[I 2024-12-03 18:53:44,353] Trial 1016 finished with value: 0.9645054397447507 and parameters: {'kernel': 'sigmoid', 'C': 0.14053192121469055, 'gamma': 0.0012132751624548104, 'epsilon': 0.06982631033808108}. Best is trial 345 with value: 0.13438257115663557.
[I 2024-12-03 18:53:45,081] Trial 1013 finished with value: 0.13678777577903556 and parameters: {'kernel': 'linear', 'C': 3.184339758338416, 'gamma': 0.07856550291523547, 'epsilon': 0.03172400455138496}. Best is trial 345 with value: 0.13438257115663557.
[I 2024-12-03 18:53:45,290] Trial 936 finished with value: 0.13476992976736257 and parameters: {'kernel': 'linear', 'C': 77.27769869518195, 'gamma': 0.006435836074568711, 'epsilon': 0.039316882173168595}. Best is trial 345 with value: 0.13438257115663557.
[I 2024-12-03 18:53:46,069] Trial 1017 finished with value: 0.6600414737743595 and parameters: {'kernel': 'rbf', 'C': 1.0513296945873316, 'gamma': 0.11065676644236273, 'epsilon': 0.03019296824948881}. Best is trial 345 with value: 0.13438257115663557.
[I 2024-12-03 18:53:46,574] Trial 1011 finished with value: 0.1370223142050385 and parameters: {'kernel': 'linear', 'C': 5.3191074584365525, 'gamma': 0.22327328870672503, 'epsilon': 0.02135284262345693}. Best is trial 345 with value: 0.13438257115663557.
[I 2024-12-03 18:53:46,727] Trial 1018 finished with value: 1.326817054741404 and parameters: {'kernel': 'rbf', 'C': 0.036115510659634566, 'gamma': 0.8908913181560747, 'epsilon': 0.2414761973904444}. Best is trial 345 with value: 0.13438257115663557.
[I 2024-12-03 18:53:50,552] Trial 1020 finished with value: 0.1348949281257479 and parameters: {'kernel': 'linear', 'C': 4.8855820183136345, 'gamma': 0.06915508971286867, 'epsilon': 0.060765412943171525}. Best is trial 345 with value: 0.13438257115663557.
[I 2024-12-03 18:53:51,514] Trial 1007 finished with value: 0.13807599821590968 and parameters: {'kernel': 'linear', 'C': 10.80683520645865, 'gamma': 0.07174725381725015, 'epsilon': 0.016814135985500876}. Best is trial 345 with value: 0.13438257115663557.
[I 2024-12-03 18:53:52,450] Trial 1023 finished with value: 0.16512590650972506 and parameters: {'kernel': 'linear', 'C': 5.023409990169766, 'gamma': 0.038154280169455324, 'epsilon': 0.182592212950374}. Best is trial 345 with value: 0.13438257115663557.
