[I 2024-12-04 19:57:34,110] Trial 397 finished with value: 1.1007387530514685 and parameters: {'n_estimators': 501, 'max_depth': 9, 'min_samples_split': 2, 'min_samples_leaf': 6, 'max_features': 'sqrt', 'bootstrap': False, 'criterion': 'squared_error'}. Best is trial 193 with value: 0.3224133091717219.
[I 2024-12-04 19:57:35,256] Trial 398 finished with value: 0.3248946840201727 and parameters: {'n_estimators': 294, 'max_depth': 49, 'min_samples_split': 2, 'min_samples_leaf': 1, 'max_features': 'sqrt', 'bootstrap': False, 'criterion': 'squared_error'}. Best is trial 193 with value: 0.3224133091717219.
[I 2024-12-04 19:57:35,515] Trial 399 finished with value: 0.640212772613482 and parameters: {'n_estimators': 268, 'max_depth': 34, 'min_samples_split': 39, 'min_samples_leaf': 4, 'max_features': None, 'bootstrap': True, 'criterion': 'squared_error'}. Best is trial 193 with value: 0.3224133091717219.
[I 2024-12-04 19:57:36,476] Trial 400 finished with value: 1.1040781273185354 and parameters: {'n_estimators': 501, 'max_depth': 25, 'min_samples_split': 18, 'min_samples_leaf': 2, 'max_features': 'log2', 'bootstrap': False, 'criterion': 'squared_error'}. Best is trial 193 with value: 0.3224133091717219.
[I 2024-12-04 19:57:36,682] Trial 401 finished with value: 0.6598231063091491 and parameters: {'n_estimators': 218, 'max_depth': 50, 'min_samples_split': 4, 'min_samples_leaf': 2, 'max_features': 'sqrt', 'bootstrap': False, 'criterion': 'squared_error'}. Best is trial 193 with value: 0.3224133091717219.
[I 2024-12-04 19:57:39,936] Trial 403 finished with value: 0.7014494419920858 and parameters: {'n_estimators': 102, 'max_depth': 34, 'min_samples_split': 17, 'min_samples_leaf': 1, 'max_features': 'sqrt', 'bootstrap': False, 'criterion': 'absolute_error'}. Best is trial 193 with value: 0.3224133091717219.
[I 2024-12-04 19:57:41,528] Trial 404 finished with value: 0.3407845715221957 and parameters: {'n_estimators': 293, 'max_depth': 41, 'min_samples_split': 2, 'min_samples_leaf': 1, 'max_features': 'sqrt', 'bootstrap': False, 'criterion': 'squared_error'}. Best is trial 193 with value: 0.3224133091717219.
[I 2024-12-04 19:57:45,470] Trial 402 finished with value: 0.7986148124196901 and parameters: {'n_estimators': 851, 'max_depth': 50, 'min_samples_split': 43, 'min_samples_leaf': 10, 'max_features': None, 'bootstrap': True, 'criterion': 'absolute_error'}. Best is trial 193 with value: 0.3224133091717219.
[I 2024-12-04 19:57:46,948] Trial 406 finished with value: 0.8019797476508214 and parameters: {'n_estimators': 597, 'max_depth': 50, 'min_samples_split': 2, 'min_samples_leaf': 2, 'max_features': 'sqrt', 'bootstrap': True, 'criterion': 'squared_error'}. Best is trial 193 with value: 0.3224133091717219.
[I 2024-12-04 19:57:49,073] Trial 407 finished with value: 0.3280572080588456 and parameters: {'n_estimators': 442, 'max_depth': 50, 'min_samples_split': 2, 'min_samples_leaf': 1, 'max_features': 'sqrt', 'bootstrap': False, 'criterion': 'squared_error'}. Best is trial 193 with value: 0.3224133091717219.
[I 2024-12-04 19:57:50,255] Trial 408 finished with value: 0.8138160878021964 and parameters: {'n_estimators': 371, 'max_depth': 32, 'min_samples_split': 7, 'min_samples_leaf': 1, 'max_features': 'log2', 'bootstrap': True, 'criterion': 'squared_error'}. Best is trial 193 with value: 0.3224133091717219.
[I 2024-12-04 19:57:51,397] Trial 376 finished with value: 0.5050736751068446 and parameters: {'n_estimators': 352, 'max_depth': 15, 'min_samples_split': 9, 'min_samples_leaf': 1, 'max_features': None, 'bootstrap': False, 'criterion': 'absolute_error'}. Best is trial 193 with value: 0.3224133091717219.
[I 2024-12-04 19:57:52,284] Trial 409 finished with value: 0.8074375086527048 and parameters: {'n_estimators': 293, 'max_depth': 27, 'min_samples_split': 39, 'min_samples_leaf': 1, 'max_features': None, 'bootstrap': False, 'criterion': 'squared_error'}. Best is trial 193 with value: 0.3224133091717219.
[I 2024-12-04 19:57:53,498] Trial 405 finished with value: 0.5697199607056889 and parameters: {'n_estimators': 394, 'max_depth': 48, 'min_samples_split': 19, 'min_samples_leaf': 8, 'max_features': None, 'bootstrap': False, 'criterion': 'absolute_error'}. Best is trial 193 with value: 0.3224133091717219.
[I 2024-12-04 19:57:53,518] Trial 410 finished with value: 0.579076439734895 and parameters: {'n_estimators': 510, 'max_depth': 48, 'min_samples_split': 3, 'min_samples_leaf': 1, 'max_features': 'log2', 'bootstrap': True, 'criterion': 'squared_error'}. Best is trial 193 with value: 0.3224133091717219.
[I 2024-12-04 19:57:55,454] Trial 412 finished with value: 1.3351687643002186 and parameters: {'n_estimators': 754, 'max_depth': 23, 'min_samples_split': 5, 'min_samples_leaf': 7, 'max_features': 'log2', 'bootstrap': True, 'criterion': 'absolute_error'}. Best is trial 193 with value: 0.3224133091717219.
[I 2024-12-04 19:57:55,459] Trial 413 finished with value: 0.3271544904079437 and parameters: {'n_estimators': 267, 'max_depth': 49, 'min_samples_split': 2, 'min_samples_leaf': 1, 'max_features': 'sqrt', 'bootstrap': False, 'criterion': 'squared_error'}. Best is trial 193 with value: 0.3224133091717219.
[I 2024-12-04 19:57:56,964] Trial 415 finished with value: 0.7927928583719259 and parameters: {'n_estimators': 339, 'max_depth': 50, 'min_samples_split': 2, 'min_samples_leaf': 2, 'max_features': 'sqrt', 'bootstrap': True, 'criterion': 'squared_error'}. Best is trial 193 with value: 0.3224133091717219.
[I 2024-12-04 19:57:57,898] Trial 414 finished with value: 0.32375743260053436 and parameters: {'n_estimators': 378, 'max_depth': 49, 'min_samples_split': 2, 'min_samples_leaf': 1, 'max_features': 'sqrt', 'bootstrap': False, 'criterion': 'squared_error'}. Best is trial 193 with value: 0.3224133091717219.
[I 2024-12-04 19:58:00,152] Trial 411 finished with value: 1.111642381693692 and parameters: {'n_estimators': 865, 'max_depth': 13, 'min_samples_split': 2, 'min_samples_leaf': 4, 'max_features': 'sqrt', 'bootstrap': False, 'criterion': 'absolute_error'}. Best is trial 193 with value: 0.3224133091717219.
[I 2024-12-04 19:58:00,428] Trial 416 finished with value: 1.3047816795640241 and parameters: {'n_estimators': 818, 'max_depth': 14, 'min_samples_split': 6, 'min_samples_leaf': 4, 'max_features': 'log2', 'bootstrap': False, 'criterion': 'absolute_error'}. Best is trial 193 with value: 0.3224133091717219.
[I 2024-12-04 19:58:01,961] Trial 418 finished with value: 0.3251328347291972 and parameters: {'n_estimators': 270, 'max_depth': 50, 'min_samples_split': 2, 'min_samples_leaf': 1, 'max_features': 'sqrt', 'bootstrap': False, 'criterion': 'squared_error'}. Best is trial 193 with value: 0.3224133091717219.
[I 2024-12-04 19:58:03,125] Trial 420 finished with value: 0.6708210521986899 and parameters: {'n_estimators': 362, 'max_depth': 49, 'min_samples_split': 2, 'min_samples_leaf': 2, 'max_features': 'sqrt', 'bootstrap': False, 'criterion': 'squared_error'}. Best is trial 193 with value: 0.3224133091717219.
[I 2024-12-04 19:58:04,546] Trial 421 finished with value: 0.38716871079129983 and parameters: {'n_estimators': 341, 'max_depth': 49, 'min_samples_split': 4, 'min_samples_leaf': 1, 'max_features': 'sqrt', 'bootstrap': False, 'criterion': 'squared_error'}. Best is trial 193 with value: 0.3224133091717219.
[I 2024-12-04 19:58:05,957] Trial 422 finished with value: 0.3848641216261875 and parameters: {'n_estimators': 337, 'max_depth': 50, 'min_samples_split': 4, 'min_samples_leaf': 1, 'max_features': 'sqrt', 'bootstrap': False, 'criterion': 'squared_error'}. Best is trial 193 with value: 0.3224133091717219.
[I 2024-12-04 19:58:06,984] Trial 423 finished with value: 0.6559893277173311 and parameters: {'n_estimators': 164, 'max_depth': 34, 'min_samples_split': 2, 'min_samples_leaf': 1, 'max_features': 'log2', 'bootstrap': False, 'criterion': 'squared_error'}. Best is trial 193 with value: 0.3224133091717219.
[I 2024-12-04 19:58:08,835] Trial 424 finished with value: 0.32382732250479473 and parameters: {'n_estimators': 358, 'max_depth': 50, 'min_samples_split': 2, 'min_samples_leaf': 1, 'max_features': 'sqrt', 'bootstrap': False, 'criterion': 'squared_error'}. Best is trial 193 with value: 0.3224133091717219.
[I 2024-12-04 19:58:10,720] Trial 425 finished with value: 0.3229059477543427 and parameters: {'n_estimators': 366, 'max_depth': 50, 'min_samples_split': 2, 'min_samples_leaf': 1, 'max_features': 'sqrt', 'bootstrap': False, 'criterion': 'squared_error'}. Best is trial 193 with value: 0.3224133091717219.
[I 2024-12-04 19:58:11,996] Trial 417 finished with value: 0.6246636330463099 and parameters: {'n_estimators': 993, 'max_depth': 40, 'min_samples_split': 7, 'min_samples_leaf': 1, 'max_features': 'sqrt', 'bootstrap': True, 'criterion': 'absolute_error'}. Best is trial 193 with value: 0.3224133091717219.
[I 2024-12-04 19:58:13,214] Trial 427 finished with value: 0.7380343866308863 and parameters: {'n_estimators': 388, 'max_depth': 35, 'min_samples_split': 46, 'min_samples_leaf': 1, 'max_features': 'sqrt', 'bootstrap': True, 'criterion': 'squared_error'}. Best is trial 193 with value: 0.3224133091717219.
[I 2024-12-04 19:58:14,395] Trial 428 finished with value: 1.340889046850136 and parameters: {'n_estimators': 452, 'max_depth': 49, 'min_samples_split': 2, 'min_samples_leaf': 13, 'max_features': 'log2', 'bootstrap': False, 'criterion': 'absolute_error'}. Best is trial 193 with value: 0.3224133091717219.
[I 2024-12-04 19:58:16,662] Trial 429 finished with value: 0.32907602598923386 and parameters: {'n_estimators': 474, 'max_depth': 50, 'min_samples_split': 2, 'min_samples_leaf': 1, 'max_features': 'sqrt', 'bootstrap': False, 'criterion': 'squared_error'}. Best is trial 193 with value: 0.3224133091717219.
[I 2024-12-04 19:58:17,911] Trial 426 finished with value: 0.4610901520851936 and parameters: {'n_estimators': 446, 'max_depth': 50, 'min_samples_split': 2, 'min_samples_leaf': 1, 'max_features': 'sqrt', 'bootstrap': True, 'criterion': 'absolute_error'}. Best is trial 193 with value: 0.3224133091717219.
[I 2024-12-04 19:58:18,410] Trial 430 finished with value: 0.36085653659243067 and parameters: {'n_estimators': 319, 'max_depth': 40, 'min_samples_split': 2, 'min_samples_leaf': 1, 'max_features': 'sqrt', 'bootstrap': False, 'criterion': 'squared_error'}. Best is trial 193 with value: 0.3224133091717219.
[I 2024-12-04 19:58:19,278] Trial 431 finished with value: 1.2061570784941142 and parameters: {'n_estimators': 121, 'max_depth': 10, 'min_samples_split': 3, 'min_samples_leaf': 5, 'max_features': 'sqrt', 'bootstrap': True, 'criterion': 'absolute_error'}. Best is trial 193 with value: 0.3224133091717219.
[I 2024-12-04 19:58:20,891] Trial 432 finished with value: 0.32303015618779657 and parameters: {'n_estimators': 368, 'max_depth': 50, 'min_samples_split': 2, 'min_samples_leaf': 1, 'max_features': 'sqrt', 'bootstrap': False, 'criterion': 'squared_error'}. Best is trial 193 with value: 0.3224133091717219.
[I 2024-12-04 19:58:20,964] Trial 433 finished with value: 0.324148867593595 and parameters: {'n_estimators': 307, 'max_depth': 50, 'min_samples_split': 2, 'min_samples_leaf': 1, 'max_features': 'sqrt', 'bootstrap': False, 'criterion': 'squared_error'}. Best is trial 193 with value: 0.3224133091717219.
[I 2024-12-04 19:58:22,827] Trial 435 finished with value: 1.3406925244675918 and parameters: {'n_estimators': 886, 'max_depth': 38, 'min_samples_split': 5, 'min_samples_leaf': 14, 'max_features': 'log2', 'bootstrap': False, 'criterion': 'absolute_error'}. Best is trial 193 with value: 0.3224133091717219.
[I 2024-12-04 19:58:23,554] Trial 434 finished with value: 0.35667650278436597 and parameters: {'n_estimators': 470, 'max_depth': 42, 'min_samples_split': 2, 'min_samples_leaf': 1, 'max_features': 'sqrt', 'bootstrap': False, 'criterion': 'squared_error'}. Best is trial 193 with value: 0.3224133091717219.
[I 2024-12-04 19:58:24,749] Trial 436 finished with value: 1.1759618647381094 and parameters: {'n_estimators': 734, 'max_depth': 12, 'min_samples_split': 2, 'min_samples_leaf': 7, 'max_features': 'sqrt', 'bootstrap': True, 'criterion': 'squared_error'}. Best is trial 193 with value: 0.3224133091717219.
[I 2024-12-04 19:58:24,825] Trial 437 finished with value: 1.2215813641821371 and parameters: {'n_estimators': 635, 'max_depth': 50, 'min_samples_split': 29, 'min_samples_leaf': 4, 'max_features': 'log2', 'bootstrap': False, 'criterion': 'squared_error'}. Best is trial 193 with value: 0.3224133091717219.
[I 2024-12-04 19:58:26,341] Trial 439 finished with value: 0.692673881637709 and parameters: {'n_estimators': 453, 'max_depth': 50, 'min_samples_split': 2, 'min_samples_leaf': 2, 'max_features': 'sqrt', 'bootstrap': False, 'criterion': 'squared_error'}. Best is trial 193 with value: 0.3224133091717219.
[I 2024-12-04 19:58:27,605] Trial 438 finished with value: 1.0028795234881585 and parameters: {'n_estimators': 231, 'max_depth': 12, 'min_samples_split': 3, 'min_samples_leaf': 1, 'max_features': 'sqrt', 'bootstrap': True, 'criterion': 'absolute_error'}. Best is trial 193 with value: 0.3224133091717219.
[I 2024-12-04 19:58:28,000] Trial 440 finished with value: 0.4150641158471799 and parameters: {'n_estimators': 452, 'max_depth': 48, 'min_samples_split': 5, 'min_samples_leaf': 1, 'max_features': 'sqrt', 'bootstrap': False, 'criterion': 'squared_error'}. Best is trial 193 with value: 0.3224133091717219.
[I 2024-12-04 19:58:29,403] Trial 442 finished with value: 1.151496272101649 and parameters: {'n_estimators': 537, 'max_depth': 29, 'min_samples_split': 29, 'min_samples_leaf': 6, 'max_features': 'sqrt', 'bootstrap': True, 'criterion': 'squared_error'}. Best is trial 193 with value: 0.3224133091717219.
[I 2024-12-04 19:58:29,936] Trial 441 finished with value: 0.3237197440041261 and parameters: {'n_estimators': 416, 'max_depth': 50, 'min_samples_split': 2, 'min_samples_leaf': 1, 'max_features': 'sqrt', 'bootstrap': False, 'criterion': 'squared_error'}. Best is trial 193 with value: 0.3224133091717219.
[I 2024-12-04 19:58:31,153] Trial 443 finished with value: 1.2571623578590603 and parameters: {'n_estimators': 319, 'max_depth': 13, 'min_samples_split': 17, 'min_samples_leaf': 9, 'max_features': 'sqrt', 'bootstrap': False, 'criterion': 'absolute_error'}. Best is trial 193 with value: 0.3224133091717219.
[I 2024-12-04 19:58:32,077] Trial 444 finished with value: 0.38278144281355986 and parameters: {'n_estimators': 548, 'max_depth': 48, 'min_samples_split': 4, 'min_samples_leaf': 1, 'max_features': 'sqrt', 'bootstrap': False, 'criterion': 'squared_error'}. Best is trial 193 with value: 0.3224133091717219.
[I 2024-12-04 19:58:33,545] Trial 446 finished with value: 0.6762457139610907 and parameters: {'n_estimators': 563, 'max_depth': 49, 'min_samples_split': 4, 'min_samples_leaf': 2, 'max_features': 'sqrt', 'bootstrap': False, 'criterion': 'squared_error'}. Best is trial 193 with value: 0.3224133091717219.
[I 2024-12-04 19:58:33,758] Trial 445 finished with value: 0.3285869098894213 and parameters: {'n_estimators': 492, 'max_depth': 50, 'min_samples_split': 2, 'min_samples_leaf': 1, 'max_features': 'sqrt', 'bootstrap': False, 'criterion': 'squared_error'}. Best is trial 193 with value: 0.3224133091717219.
[I 2024-12-04 19:58:35,621] Trial 448 finished with value: 0.32348956166805265 and parameters: {'n_estimators': 322, 'max_depth': 50, 'min_samples_split': 2, 'min_samples_leaf': 1, 'max_features': 'sqrt', 'bootstrap': False, 'criterion': 'squared_error'}. Best is trial 193 with value: 0.3224133091717219.
[I 2024-12-04 19:58:36,874] Trial 447 finished with value: 0.43410860985115995 and parameters: {'n_estimators': 310, 'max_depth': 50, 'min_samples_split': 2, 'min_samples_leaf': 1, 'max_features': None, 'bootstrap': False, 'criterion': 'squared_error'}. Best is trial 193 with value: 0.3224133091717219.
[I 2024-12-04 19:58:37,244] Trial 449 finished with value: 0.34161245006449314 and parameters: {'n_estimators': 285, 'max_depth': 41, 'min_samples_split': 2, 'min_samples_leaf': 1, 'max_features': 'sqrt', 'bootstrap': False, 'criterion': 'squared_error'}. Best is trial 193 with value: 0.3224133091717219.
[I 2024-12-04 19:58:38,270] Trial 450 finished with value: 0.6727979382491839 and parameters: {'n_estimators': 302, 'max_depth': 41, 'min_samples_split': 2, 'min_samples_leaf': 2, 'max_features': 'sqrt', 'bootstrap': False, 'criterion': 'squared_error'}. Best is trial 193 with value: 0.3224133091717219.
[I 2024-12-04 19:58:39,011] Trial 451 finished with value: 1.1507689288440244 and parameters: {'n_estimators': 661, 'max_depth': 9, 'min_samples_split': 8, 'min_samples_leaf': 1, 'max_features': 'log2', 'bootstrap': True, 'criterion': 'squared_error'}. Best is trial 193 with value: 0.3224133091717219.
[I 2024-12-04 19:58:39,984] Trial 452 finished with value: 0.5381215729271613 and parameters: {'n_estimators': 386, 'max_depth': 50, 'min_samples_split': 3, 'min_samples_leaf': 1, 'max_features': 'log2', 'bootstrap': False, 'criterion': 'squared_error'}. Best is trial 193 with value: 0.3224133091717219.
[I 2024-12-04 19:58:40,102] Trial 453 finished with value: 0.6604583839877943 and parameters: {'n_estimators': 301, 'max_depth': 50, 'min_samples_split': 4, 'min_samples_leaf': 2, 'max_features': 'sqrt', 'bootstrap': False, 'criterion': 'squared_error'}. Best is trial 193 with value: 0.3224133091717219.
[I 2024-12-04 19:58:41,244] Trial 455 finished with value: 0.65910097795559 and parameters: {'n_estimators': 197, 'max_depth': 49, 'min_samples_split': 2, 'min_samples_leaf': 2, 'max_features': 'sqrt', 'bootstrap': False, 'criterion': 'squared_error'}. Best is trial 193 with value: 0.3224133091717219.
[I 2024-12-04 19:58:42,090] Trial 454 finished with value: 0.3233051337543817 and parameters: {'n_estimators': 364, 'max_depth': 50, 'min_samples_split': 2, 'min_samples_leaf': 1, 'max_features': 'sqrt', 'bootstrap': False, 'criterion': 'squared_error'}. Best is trial 193 with value: 0.3224133091717219.
[I 2024-12-04 19:58:43,391] Trial 456 finished with value: 0.393653385752051 and parameters: {'n_estimators': 470, 'max_depth': 48, 'min_samples_split': 2, 'min_samples_leaf': 1, 'max_features': 'sqrt', 'bootstrap': True, 'criterion': 'squared_error'}. Best is trial 193 with value: 0.3224133091717219.
[I 2024-12-04 19:58:44,096] Trial 457 finished with value: 0.3223992246327795 and parameters: {'n_estimators': 344, 'max_depth': 50, 'min_samples_split': 2, 'min_samples_leaf': 1, 'max_features': 'sqrt', 'bootstrap': False, 'criterion': 'squared_error'}. Best is trial 457 with value: 0.3223992246327795.
[I 2024-12-04 19:58:45,469] Trial 459 finished with value: 0.32276894222646274 and parameters: {'n_estimators': 222, 'max_depth': 50, 'min_samples_split': 2, 'min_samples_leaf': 1, 'max_features': 'sqrt', 'bootstrap': False, 'criterion': 'squared_error'}. Best is trial 457 with value: 0.3223992246327795.
[I 2024-12-04 19:58:45,475] Trial 458 finished with value: 0.3233071635671472 and parameters: {'n_estimators': 392, 'max_depth': 50, 'min_samples_split': 2, 'min_samples_leaf': 1, 'max_features': 'sqrt', 'bootstrap': False, 'criterion': 'squared_error'}. Best is trial 457 with value: 0.3223992246327795.
[I 2024-12-04 19:58:47,065] Trial 460 finished with value: 0.3349455866440582 and parameters: {'n_estimators': 149, 'max_depth': 49, 'min_samples_split': 2, 'min_samples_leaf': 1, 'max_features': 'sqrt', 'bootstrap': False, 'criterion': 'squared_error'}. Best is trial 457 with value: 0.3223992246327795.
[I 2024-12-04 19:58:48,057] Trial 461 finished with value: 0.7094288067836918 and parameters: {'n_estimators': 934, 'max_depth': 41, 'min_samples_split': 47, 'min_samples_leaf': 1, 'max_features': 'sqrt', 'bootstrap': True, 'criterion': 'squared_error'}. Best is trial 457 with value: 0.3223992246327795.
[I 2024-12-04 19:58:48,759] Trial 462 finished with value: 0.38732430779761845 and parameters: {'n_estimators': 389, 'max_depth': 50, 'min_samples_split': 4, 'min_samples_leaf': 1, 'max_features': 'sqrt', 'bootstrap': False, 'criterion': 'squared_error'}. Best is trial 457 with value: 0.3223992246327795.
[I 2024-12-04 19:58:49,824] Trial 463 finished with value: 0.32521955773697214 and parameters: {'n_estimators': 271, 'max_depth': 50, 'min_samples_split': 2, 'min_samples_leaf': 1, 'max_features': 'sqrt', 'bootstrap': False, 'criterion': 'squared_error'}. Best is trial 457 with value: 0.3223992246327795.
[I 2024-12-04 19:58:50,059] Trial 464 finished with value: 0.6954302726997392 and parameters: {'n_estimators': 440, 'max_depth': 42, 'min_samples_split': 2, 'min_samples_leaf': 2, 'max_features': 'sqrt', 'bootstrap': False, 'criterion': 'squared_error'}. Best is trial 457 with value: 0.3223992246327795.
[I 2024-12-04 19:58:51,580] Trial 465 finished with value: 0.38917822358535376 and parameters: {'n_estimators': 328, 'max_depth': 42, 'min_samples_split': 3, 'min_samples_leaf': 1, 'max_features': 'sqrt', 'bootstrap': False, 'criterion': 'squared_error'}. Best is trial 457 with value: 0.3223992246327795.
[I 2024-12-04 19:58:53,667] Trial 467 finished with value: 0.40099626784460124 and parameters: {'n_estimators': 492, 'max_depth': 36, 'min_samples_split': 2, 'min_samples_leaf': 1, 'max_features': 'sqrt', 'bootstrap': False, 'criterion': 'squared_error'}. Best is trial 457 with value: 0.3223992246327795.
[I 2024-12-04 19:59:03,560] Trial 419 finished with value: 0.5764229587388318 and parameters: {'n_estimators': 778, 'max_depth': 34, 'min_samples_split': 27, 'min_samples_leaf': 2, 'max_features': None, 'bootstrap': False, 'criterion': 'absolute_error'}. Best is trial 457 with value: 0.3223992246327795.
[I 2024-12-04 19:59:05,405] Trial 469 finished with value: 0.3238915190966349 and parameters: {'n_estimators': 359, 'max_depth': 50, 'min_samples_split': 2, 'min_samples_leaf': 1, 'max_features': 'sqrt', 'bootstrap': False, 'criterion': 'squared_error'}. Best is trial 457 with value: 0.3223992246327795.
