[I 2024-12-04 15:08:21,539] Trial 818 finished with value: 1.2693635028569847 and parameters: {'kernel_type': 'RBF', 'length_scale': 0.03482099880856566, 'noise_level': 0.00038766728307628915, 'constant_value': 5550.933648622815, 'nu': 0.5}. Best is trial 750 with value: 0.13435342446039877.
[I 2024-12-04 15:08:22,099] Trial 823 finished with value: 1.3007739143709502 and parameters: {'kernel_type': 'Matern', 'length_scale': 0.02974440254553507, 'noise_level': 0.0012519568466242356, 'constant_value': 45226.56325555404, 'nu': 1.5}. Best is trial 750 with value: 0.13435342446039877.
[I 2024-12-04 15:08:22,473] Trial 819 finished with value: 0.13435440394302964 and parameters: {'kernel_type': 'Matern', 'length_scale': 113.19865616368861, 'noise_level': 0.003991974561431786, 'constant_value': 83752.65032820545, 'nu': 1.5}. Best is trial 750 with value: 0.13435342446039877.
[I 2024-12-04 15:08:23,086] Trial 828 finished with value: 0.13435438242802933 and parameters: {'kernel_type': 'Matern', 'length_scale': 433.69750712051183, 'noise_level': 0.009990406196902106, 'constant_value': 83199.28194115238, 'nu': 1.5}. Best is trial 750 with value: 0.13435342446039877.
[I 2024-12-04 15:08:23,280] Trial 830 finished with value: 0.1343542842440377 and parameters: {'kernel_type': 'Matern', 'length_scale': 19.18155638313744, 'noise_level': 7.32084376904215e-05, 'constant_value': 15666.123467007319, 'nu': 1.5}. Best is trial 750 with value: 0.13435342446039877.
[I 2024-12-04 15:08:23,804] Trial 817 finished with value: 0.1343543471041348 and parameters: {'kernel_type': 'Matern', 'length_scale': 24.78157925071082, 'noise_level': 0.0003927707145810996, 'constant_value': 50283.45373622615, 'nu': 1.5}. Best is trial 750 with value: 0.13435342446039877.
[I 2024-12-04 15:08:23,913] Trial 813 finished with value: 0.13435440097100457 and parameters: {'kernel_type': 'Matern', 'length_scale': 2831.5441044384543, 'noise_level': 0.028696540493942317, 'constant_value': 93114.20171859858, 'nu': 1.5}. Best is trial 750 with value: 0.13435342446039877.
[I 2024-12-04 15:08:25,407] Trial 824 finished with value: 0.15167298601536341 and parameters: {'kernel_type': 'RBF', 'length_scale': 1.7164119934626645, 'noise_level': 0.08257257472693308, 'constant_value': 16674.627640482846, 'nu': 1.5}. Best is trial 750 with value: 0.13435342446039877.
[I 2024-12-04 15:08:27,614] Trial 820 finished with value: 1.269363457458972 and parameters: {'kernel_type': 'Matern', 'length_scale': 0.08815864831536516, 'noise_level': 0.0031165957053071102, 'constant_value': 38313.61793595211, 'nu': 1.5}. Best is trial 750 with value: 0.13435342446039877.
[I 2024-12-04 15:08:28,692] Trial 831 finished with value: 1.3007733681289206 and parameters: {'kernel_type': 'Matern', 'length_scale': 2135.6885212307584, 'noise_level': 0.17819320753118406, 'constant_value': 1.6691992355817655e-07, 'nu': 0.5}. Best is trial 750 with value: 0.13435342446039877.
[I 2024-12-04 15:08:29,499] Trial 822 finished with value: 1.2693635028576022 and parameters: {'kernel_type': 'Matern', 'length_scale': 0.003982245293737122, 'noise_level': 0.1610302845048214, 'constant_value': 4.275638473659134, 'nu': 0.5}. Best is trial 750 with value: 0.13435342446039877.
[I 2024-12-04 15:08:30,618] Trial 826 finished with value: 0.14859826758363254 and parameters: {'kernel_type': 'Matern', 'length_scale': 34.88984995714713, 'noise_level': 0.061278995792667004, 'constant_value': 14039.506771998267, 'nu': 2.5}. Best is trial 750 with value: 0.13435342446039877.
[I 2024-12-04 15:08:32,139] Trial 835 finished with value: 0.1343543995975399 and parameters: {'kernel_type': 'Matern', 'length_scale': 755.283207970682, 'noise_level': 7.606398225558338e-05, 'constant_value': 66079.66149991831, 'nu': 1.5}. Best is trial 750 with value: 0.13435342446039877.
[I 2024-12-04 15:08:34,336] Trial 829 finished with value: 0.13435442439013515 and parameters: {'kernel_type': 'Matern', 'length_scale': 1.7730711240392036, 'noise_level': 0.0023287326350679392, 'constant_value': 5135.022649813272, 'nu': 1.5}. Best is trial 750 with value: 0.13435342446039877.
[I 2024-12-04 15:08:36,426] Trial 825 finished with value: 0.13435442574424988 and parameters: {'kernel_type': 'Matern', 'length_scale': 8.135905625898664, 'noise_level': 0.0019108354087807773, 'constant_value': 36492.54362050277, 'nu': 1.5}. Best is trial 750 with value: 0.13435342446039877.
[I 2024-12-04 15:08:40,486] Trial 837 finished with value: 0.1343546951243256 and parameters: {'kernel_type': 'Matern', 'length_scale': 3278.3171958531884, 'noise_level': 0.7719527626780731, 'constant_value': 32838.76916085246, 'nu': 1.5}. Best is trial 750 with value: 0.13435342446039877.
[I 2024-12-04 15:08:40,504] Trial 832 finished with value: 1.2693635028399042 and parameters: {'kernel_type': 'RBF', 'length_scale': 15025.709545162725, 'noise_level': 2.3168212406230854e-06, 'constant_value': 0.0012042743385676468, 'nu': 1.5}. Best is trial 750 with value: 0.13435342446039877.
[I 2024-12-04 15:08:40,725] Trial 844 finished with value: 0.1725104026381798 and parameters: {'kernel_type': 'Matern', 'length_scale': 2.7723822166125736, 'noise_level': 0.0015183438537270252, 'constant_value': 2704.6487057638783, 'nu': 0.5}. Best is trial 750 with value: 0.13435342446039877.
[I 2024-12-04 15:08:42,586] Trial 836 finished with value: 0.13435443098256622 and parameters: {'kernel_type': 'Matern', 'length_scale': 9.999863882996866, 'noise_level': 0.04012751740482985, 'constant_value': 5472.976764925761, 'nu': 1.5}. Best is trial 750 with value: 0.13435342446039877.
[I 2024-12-04 15:08:44,362] Trial 840 finished with value: 0.15167307047706172 and parameters: {'kernel_type': 'RBF', 'length_scale': 1.6331293028134692, 'noise_level': 0.3989288948543089, 'constant_value': 6.340097045795563, 'nu': 1.5}. Best is trial 750 with value: 0.13435342446039877.
[I 2024-12-04 15:08:44,874] Trial 842 finished with value: 0.13435439986215547 and parameters: {'kernel_type': 'Matern', 'length_scale': 257.3127635290766, 'noise_level': 0.010462285359842487, 'constant_value': 71505.27539580034, 'nu': 1.5}. Best is trial 750 with value: 0.13435342446039877.
[I 2024-12-04 15:08:44,911] Trial 833 finished with value: 1.26936350285686 and parameters: {'kernel_type': 'Matern', 'length_scale': 18.37447413187681, 'noise_level': 9.213353840866505e-08, 'constant_value': 0.035719133321968355, 'nu': 1.5}. Best is trial 750 with value: 0.13435342446039877.
[I 2024-12-04 15:08:46,070] Trial 847 finished with value: 0.13435439157848586 and parameters: {'kernel_type': 'Matern', 'length_scale': 43.89105195683481, 'noise_level': 0.0027365848856740504, 'constant_value': 16066.408286786638, 'nu': 1.5}. Best is trial 750 with value: 0.13435342446039877.
[I 2024-12-04 15:08:47,327] Trial 841 finished with value: 0.17251037286614704 and parameters: {'kernel_type': 'Matern', 'length_scale': 44.4358973394171, 'noise_level': 0.0013305006090185275, 'constant_value': 35255.89890242113, 'nu': 0.5}. Best is trial 750 with value: 0.13435342446039877.
[I 2024-12-04 15:08:48,197] Trial 848 finished with value: 0.13435455062758483 and parameters: {'kernel_type': 'Matern', 'length_scale': 58.18312118162788, 'noise_level': 0.0007970595032412035, 'constant_value': 87902.63066648993, 'nu': 1.5}. Best is trial 750 with value: 0.13435342446039877.
[I 2024-12-04 15:08:48,999] Trial 843 finished with value: 0.13435500309585205 and parameters: {'kernel_type': 'Matern', 'length_scale': 9.339871360086558, 'noise_level': 0.0037122933360246037, 'constant_value': 26711.71611564216, 'nu': 1.5}. Best is trial 750 with value: 0.13435342446039877.
[I 2024-12-04 15:08:50,380] Trial 834 finished with value: 0.1343544301655417 and parameters: {'kernel_type': 'Matern', 'length_scale': 48.690413992070035, 'noise_level': 0.0022460752055650504, 'constant_value': 82696.05406381686, 'nu': 1.5}. Best is trial 750 with value: 0.13435342446039877.
[I 2024-12-04 15:08:50,997] Trial 849 finished with value: 1.2693635028539016 and parameters: {'kernel_type': 'Matern', 'length_scale': 0.016354811085288197, 'noise_level': 0.006245672615027041, 'constant_value': 95.96766523979683, 'nu': 1.5}. Best is trial 750 with value: 0.13435342446039877.
[I 2024-12-04 15:08:51,188] Trial 851 finished with value: 1.269363502820487 and parameters: {'kernel_type': 'Matern', 'length_scale': 0.0644158979967608, 'noise_level': 1.985584024684854e-06, 'constant_value': 0.0015584967261979446, 'nu': 1.5}. Best is trial 750 with value: 0.13435342446039877.
[I 2024-12-04 15:08:51,278] Trial 827 finished with value: 0.13435440042012567 and parameters: {'kernel_type': 'Matern', 'length_scale': 0.21643245577602002, 'noise_level': 0.011131341462633119, 'constant_value': 74969.00957192098, 'nu': 1.5}. Best is trial 750 with value: 0.13435342446039877.
[I 2024-12-04 15:08:51,377] Trial 854 finished with value: 0.13435440115863245 and parameters: {'kernel_type': 'Matern', 'length_scale': 1.437994341675107, 'noise_level': 1.7470635588844685e-06, 'constant_value': 0.12139237722088903, 'nu': 1.5}. Best is trial 750 with value: 0.13435342446039877.
[I 2024-12-04 15:08:54,023] Trial 846 finished with value: 0.13435441075439303 and parameters: {'kernel_type': 'Matern', 'length_scale': 0.8760639753393874, 'noise_level': 0.007252897063716907, 'constant_value': 40710.346410258106, 'nu': 1.5}. Best is trial 750 with value: 0.13435342446039877.
[I 2024-12-04 15:08:54,024] Trial 853 finished with value: 1.2693635028569692 and parameters: {'kernel_type': 'RBF', 'length_scale': 0.00722778918151841, 'noise_level': 1.3842302946233523e-06, 'constant_value': 5.821496806278557e-06, 'nu': 0.5}. Best is trial 750 with value: 0.13435342446039877.
[I 2024-12-04 15:08:54,345] Trial 839 finished with value: 0.1343543965019321 and parameters: {'kernel_type': 'Matern', 'length_scale': 2.8817015950750853, 'noise_level': 3.3384742599602176e-05, 'constant_value': 0.04557006718745514, 'nu': 1.5}. Best is trial 750 with value: 0.13435342446039877.
[I 2024-12-04 15:08:56,142] Trial 838 finished with value: 0.13435436838641496 and parameters: {'kernel_type': 'Matern', 'length_scale': 3.3729495617214806, 'noise_level': 0.04232442814360378, 'constant_value': 68543.19121383473, 'nu': 1.5}. Best is trial 750 with value: 0.13435342446039877.
[I 2024-12-04 15:08:58,198] Trial 856 finished with value: 0.13435436734052084 and parameters: {'kernel_type': 'Matern', 'length_scale': 479.74628494341783, 'noise_level': 0.26599254106165343, 'constant_value': 98210.86324772109, 'nu': 1.5}. Best is trial 750 with value: 0.13435342446039877.
[I 2024-12-04 15:08:58,769] Trial 861 finished with value: 1.3007745979657548 and parameters: {'kernel_type': 'Matern', 'length_scale': 1.0716550209851265, 'noise_level': 0.0011379487608852697, 'constant_value': 69413.39190467024, 'nu': 1.5}. Best is trial 750 with value: 0.13435342446039877.
[I 2024-12-04 15:08:59,013] Trial 845 finished with value: 0.1343543978000603 and parameters: {'kernel_type': 'Matern', 'length_scale': 38.65904470915976, 'noise_level': 0.39569471568155434, 'constant_value': 93563.8056572505, 'nu': 1.5}. Best is trial 750 with value: 0.13435342446039877.
[I 2024-12-04 15:08:59,016] Trial 857 finished with value: 0.1343544649883136 and parameters: {'kernel_type': 'Matern', 'length_scale': 3585.6805283176054, 'noise_level': 0.008673884328312037, 'constant_value': 3916.3987547019033, 'nu': 1.5}. Best is trial 750 with value: 0.13435342446039877.
[I 2024-12-04 15:08:59,026] Trial 852 finished with value: 0.1725103431326289 and parameters: {'kernel_type': 'Matern', 'length_scale': 21183.670214716407, 'noise_level': 0.009284385751696288, 'constant_value': 20725.75694884148, 'nu': 0.5}. Best is trial 750 with value: 0.13435342446039877.
[I 2024-12-04 15:08:59,999] Trial 850 finished with value: 0.1343543983171734 and parameters: {'kernel_type': 'Matern', 'length_scale': 3.8935391123952394, 'noise_level': 0.0003132620200660019, 'constant_value': 63629.9940113224, 'nu': 1.5}. Best is trial 750 with value: 0.13435342446039877.
[I 2024-12-04 15:09:01,311] Trial 862 finished with value: 1.2693635028569643 and parameters: {'kernel_type': 'RBF', 'length_scale': 0.0020333730286401985, 'noise_level': 0.00018409892423946762, 'constant_value': 0.2722120249078578, 'nu': 0.5}. Best is trial 750 with value: 0.13435342446039877.
[I 2024-12-04 15:09:02,672] Trial 858 finished with value: 0.14859825885622086 and parameters: {'kernel_type': 'Matern', 'length_scale': 4461.227574798901, 'noise_level': 0.1454750748214194, 'constant_value': 29978.76361712819, 'nu': 2.5}. Best is trial 750 with value: 0.13435342446039877.
[I 2024-12-04 15:09:05,071] Trial 860 finished with value: 0.13435439962773624 and parameters: {'kernel_type': 'Matern', 'length_scale': 9.425425251250081, 'noise_level': 0.00016860671784775275, 'constant_value': 63.2491635857416, 'nu': 1.5}. Best is trial 750 with value: 0.13435342446039877.
[I 2024-12-04 15:09:05,343] Trial 859 finished with value: 0.15167297848742908 and parameters: {'kernel_type': 'RBF', 'length_scale': 23.66460188539248, 'noise_level': 0.00016595488846961594, 'constant_value': 3638.468102081331, 'nu': 1.5}. Best is trial 750 with value: 0.13435342446039877.
[I 2024-12-04 15:09:07,307] Trial 855 finished with value: 1.2699993816116497 and parameters: {'kernel_type': 'Matern', 'length_scale': 41214.58329874642, 'noise_level': 1.4134515928676477e-07, 'constant_value': 3.59093350066765e-05, 'nu': 0.5}. Best is trial 750 with value: 0.13435342446039877.
[I 2024-12-04 15:09:07,377] Trial 863 finished with value: 0.13435439983953243 and parameters: {'kernel_type': 'Matern', 'length_scale': 45.50502015484231, 'noise_level': 0.05464437316355435, 'constant_value': 82433.85525762166, 'nu': 1.5}. Best is trial 750 with value: 0.13435342446039877.
[I 2024-12-04 15:09:07,954] Trial 868 finished with value: 0.13435438482431594 and parameters: {'kernel_type': 'Matern', 'length_scale': 79.20708434415619, 'noise_level': 0.4699524442502654, 'constant_value': 1176.5499399647822, 'nu': 1.5}. Best is trial 750 with value: 0.13435342446039877.
[I 2024-12-04 15:09:09,303] Trial 870 finished with value: 0.1343543837280682 and parameters: {'kernel_type': 'Matern', 'length_scale': 10635.888520971557, 'noise_level': 0.026471654888403362, 'constant_value': 1491.6878617936982, 'nu': 1.5}. Best is trial 750 with value: 0.13435342446039877.
[I 2024-12-04 15:09:10,835] Trial 867 finished with value: 1.300774597953732 and parameters: {'kernel_type': 'RBF', 'length_scale': 1.402290735632145, 'noise_level': 3.612768271953391e-07, 'constant_value': 419.53418619683833, 'nu': 0.5}. Best is trial 750 with value: 0.13435342446039877.
[I 2024-12-04 15:09:11,550] Trial 864 finished with value: 0.13435439876502753 and parameters: {'kernel_type': 'Matern', 'length_scale': 108.99103325950696, 'noise_level': 0.7621466251274623, 'constant_value': 235.5462390830771, 'nu': 1.5}. Best is trial 750 with value: 0.13435342446039877.
[I 2024-12-04 15:09:11,962] Trial 869 finished with value: 0.1343543977896694 and parameters: {'kernel_type': 'Matern', 'length_scale': 27.24232843352505, 'noise_level': 0.0074552994940632325, 'constant_value': 1432.7908611270134, 'nu': 1.5}. Best is trial 750 with value: 0.13435342446039877.
[I 2024-12-04 15:09:13,256] Trial 871 finished with value: 0.13435439754254885 and parameters: {'kernel_type': 'Matern', 'length_scale': 4704.67947507538, 'noise_level': 0.013983849148269346, 'constant_value': 95011.71726138103, 'nu': 1.5}. Best is trial 750 with value: 0.13435342446039877.
[I 2024-12-04 15:09:14,458] Trial 876 finished with value: 0.1343547329416049 and parameters: {'kernel_type': 'Matern', 'length_scale': 95.50890972752485, 'noise_level': 0.0006464278130355759, 'constant_value': 83252.27800258172, 'nu': 1.5}. Best is trial 750 with value: 0.13435342446039877.
[I 2024-12-04 15:09:15,973] Trial 865 finished with value: 0.13435443567388197 and parameters: {'kernel_type': 'Matern', 'length_scale': 0.7965292582433676, 'noise_level': 0.00041181122073900926, 'constant_value': 99734.45256820672, 'nu': 1.5}. Best is trial 750 with value: 0.13435342446039877.
[I 2024-12-04 15:09:16,713] Trial 874 finished with value: 1.269363502858274 and parameters: {'kernel_type': 'Matern', 'length_scale': 480.7249026671386, 'noise_level': 8.062935630268618e-05, 'constant_value': 136.7917800483036, 'nu': 1.5}. Best is trial 750 with value: 0.13435342446039877.
[I 2024-12-04 15:09:18,024] Trial 877 finished with value: 0.1343543998782433 and parameters: {'kernel_type': 'Matern', 'length_scale': 1.293585300387322, 'noise_level': 0.0014672851354533593, 'constant_value': 11.205097962881904, 'nu': 1.5}. Best is trial 750 with value: 0.13435342446039877.
[I 2024-12-04 15:09:19,589] Trial 879 finished with value: 0.1343543988578105 and parameters: {'kernel_type': 'Matern', 'length_scale': 0.49339036534364483, 'noise_level': 0.00806300446209829, 'constant_value': 386.165544940785, 'nu': 1.5}. Best is trial 750 with value: 0.13435342446039877.
[I 2024-12-04 15:09:20,263] Trial 878 finished with value: 0.1343543896492897 and parameters: {'kernel_type': 'Matern', 'length_scale': 1.8881204057337129, 'noise_level': 0.010576257026849818, 'constant_value': 63043.7682688759, 'nu': 1.5}. Best is trial 750 with value: 0.13435342446039877.
[I 2024-12-04 15:09:20,975] Trial 866 finished with value: 0.13435423201223914 and parameters: {'kernel_type': 'Matern', 'length_scale': 22.165741870534756, 'noise_level': 0.0011704637860607855, 'constant_value': 1464.286382103482, 'nu': 1.5}. Best is trial 750 with value: 0.13435342446039877.
[I 2024-12-04 15:09:26,364] Trial 872 finished with value: 0.17251037587577023 and parameters: {'kernel_type': 'Matern', 'length_scale': 59060.034190995815, 'noise_level': 0.08192815703521605, 'constant_value': 10.189699376136515, 'nu': 0.5}. Best is trial 750 with value: 0.13435342446039877.
[I 2024-12-04 15:09:26,586] Trial 884 finished with value: 0.13435398615381308 and parameters: {'kernel_type': 'Matern', 'length_scale': 27.746871649502154, 'noise_level': 0.0076140993197045224, 'constant_value': 81803.87919887555, 'nu': 1.5}. Best is trial 750 with value: 0.13435342446039877.
[I 2024-12-04 15:09:27,364] Trial 880 finished with value: 0.13435432518152404 and parameters: {'kernel_type': 'Matern', 'length_scale': 4.771268701069552, 'noise_level': 0.02082663521633472, 'constant_value': 60415.72445124835, 'nu': 1.5}. Best is trial 750 with value: 0.13435342446039877.
[I 2024-12-04 15:09:27,368] Trial 882 finished with value: 0.1343541050922322 and parameters: {'kernel_type': 'Matern', 'length_scale': 36.225848098306976, 'noise_level': 0.007123925621869554, 'constant_value': 83806.02895369104, 'nu': 1.5}. Best is trial 750 with value: 0.13435342446039877.
[I 2024-12-04 15:09:27,370] Trial 883 finished with value: 0.1343543991410954 and parameters: {'kernel_type': 'Matern', 'length_scale': 33.87656507104004, 'noise_level': 0.0004233570849950245, 'constant_value': 1550.7785491472068, 'nu': 1.5}. Best is trial 750 with value: 0.13435342446039877.
[I 2024-12-04 15:09:27,825] Trial 881 finished with value: 0.13435441551267124 and parameters: {'kernel_type': 'Matern', 'length_scale': 0.613771863100775, 'noise_level': 0.01569766712879996, 'constant_value': 1727.2995100246687, 'nu': 1.5}. Best is trial 750 with value: 0.13435342446039877.
[I 2024-12-04 15:09:28,102] Trial 888 finished with value: 0.13435384951072696 and parameters: {'kernel_type': 'Matern', 'length_scale': 116.08490162851592, 'noise_level': 0.5047355738260112, 'constant_value': 73264.68352999343, 'nu': 1.5}. Best is trial 750 with value: 0.13435342446039877.
[I 2024-12-04 15:09:29,320] Trial 885 finished with value: 0.1343543292219223 and parameters: {'kernel_type': 'Matern', 'length_scale': 659.1884200844289, 'noise_level': 0.04525819739557385, 'constant_value': 173.1624772554158, 'nu': 1.5}. Best is trial 750 with value: 0.13435342446039877.
[I 2024-12-04 15:09:29,849] Trial 875 finished with value: 0.13435417427586177 and parameters: {'kernel_type': 'Matern', 'length_scale': 33.33255934939699, 'noise_level': 0.009909061826892673, 'constant_value': 99759.23319338966, 'nu': 1.5}. Best is trial 750 with value: 0.13435342446039877.
[I 2024-12-04 15:09:30,126] Trial 891 finished with value: 0.13435438795255833 and parameters: {'kernel_type': 'Matern', 'length_scale': 3151.0386084673573, 'noise_level': 0.8876412737124618, 'constant_value': 1673.6961526244067, 'nu': 1.5}. Best is trial 750 with value: 0.13435342446039877.
[I 2024-12-04 15:09:30,137] Trial 887 finished with value: 0.13435436270508336 and parameters: {'kernel_type': 'Matern', 'length_scale': 568.9294413756355, 'noise_level': 0.0026447534402387085, 'constant_value': 751.9108713754626, 'nu': 1.5}. Best is trial 750 with value: 0.13435342446039877.
[I 2024-12-04 15:09:30,227] Trial 886 finished with value: 0.13435440326373674 and parameters: {'kernel_type': 'Matern', 'length_scale': 0.6754382607862286, 'noise_level': 0.0013113715345186975, 'constant_value': 953.0911867500035, 'nu': 1.5}. Best is trial 750 with value: 0.13435342446039877.
[I 2024-12-04 15:09:32,071] Trial 890 finished with value: 1.26936350285814 and parameters: {'kernel_type': 'RBF', 'length_scale': 7911.713302535646, 'noise_level': 0.0008661851518015886, 'constant_value': 50.01576787991014, 'nu': 1.5}. Best is trial 750 with value: 0.13435342446039877.
[I 2024-12-04 15:09:33,857] Trial 895 finished with value: 0.17251040258063355 and parameters: {'kernel_type': 'Matern', 'length_scale': 10.043544684882677, 'noise_level': 6.658291981662159e-05, 'constant_value': 0.24659894717555547, 'nu': 0.5}. Best is trial 750 with value: 0.13435342446039877.
