[I 2024-12-03 18:45:56,799] Trial 1193 finished with value: 0.8702101631735275 and parameters: {'kernel': 'sigmoid', 'C': 0.5231731978559091, 'gamma': 0.003942865004627606, 'epsilon': 0.1510243216195474}. Best is trial 1119 with value: 0.4485361816812923.
[I 2024-12-03 18:45:57,105] Trial 1194 finished with value: 0.530261720428879 and parameters: {'kernel': 'rbf', 'C': 18.171440577934316, 'gamma': 0.011637290276356604, 'epsilon': 0.1330984428248203}. Best is trial 1119 with value: 0.4485361816812923.
[I 2024-12-03 18:45:57,127] Trial 1174 finished with value: 0.6460884317688327 and parameters: {'kernel': 'rbf', 'C': 91.05938458089254, 'gamma': 0.05464238297951818, 'epsilon': 0.6941604707200326}. Best is trial 1119 with value: 0.4485361816812923.
[I 2024-12-03 18:45:57,319] Trial 1172 finished with value: 0.5351062771426579 and parameters: {'kernel': 'rbf', 'C': 20.783718874758843, 'gamma': 0.008475740012565002, 'epsilon': 0.11801096211926934}. Best is trial 1119 with value: 0.4485361816812923.
[I 2024-12-03 18:45:57,663] Trial 1179 finished with value: 0.4637414424145755 and parameters: {'kernel': 'rbf', 'C': 83.60823923864547, 'gamma': 0.009977650530926179, 'epsilon': 0.09451411391444756}. Best is trial 1119 with value: 0.4485361816812923.
[I 2024-12-03 18:45:57,903] Trial 1189 finished with value: 0.9249796602550596 and parameters: {'kernel': 'poly', 'C': 15.516016355862007, 'gamma': 0.015117453676482156, 'epsilon': 0.040204866515995676}. Best is trial 1119 with value: 0.4485361816812923.
[I 2024-12-03 18:45:58,286] Trial 1181 finished with value: 0.4845068607756851 and parameters: {'kernel': 'rbf', 'C': 89.70633472146852, 'gamma': 0.017301389847825095, 'epsilon': 0.1485914625079555}. Best is trial 1119 with value: 0.4485361816812923.
[I 2024-12-03 18:45:58,384] Trial 1182 finished with value: 0.5427920033755317 and parameters: {'kernel': 'rbf', 'C': 29.172143513335474, 'gamma': 0.005639832240170899, 'epsilon': 0.06271795920511682}. Best is trial 1119 with value: 0.4485361816812923.
[I 2024-12-03 18:45:58,879] Trial 1187 finished with value: 1.314307776176225 and parameters: {'kernel': 'rbf', 'C': 0.007192120860079223, 'gamma': 0.02353387288101268, 'epsilon': 0.011456631984963076}. Best is trial 1119 with value: 0.4485361816812923.
[I 2024-12-03 18:45:59,664] Trial 1188 finished with value: 0.7090361196317384 and parameters: {'kernel': 'rbf', 'C': 2.6677287743273257, 'gamma': 0.009002743929010798, 'epsilon': 0.16999772040821304}. Best is trial 1119 with value: 0.4485361816812923.
[I 2024-12-03 18:45:59,976] Trial 1197 finished with value: 0.45573683084130606 and parameters: {'kernel': 'rbf', 'C': 95.8645444732761, 'gamma': 0.010451370549021599, 'epsilon': 0.09511681672981709}. Best is trial 1119 with value: 0.4485361816812923.
[I 2024-12-03 18:46:00,100] Trial 1198 finished with value: 0.4928526991265767 and parameters: {'kernel': 'rbf', 'C': 87.9330238837025, 'gamma': 0.006324160152981408, 'epsilon': 0.09129913454118582}. Best is trial 1119 with value: 0.4485361816812923.
[I 2024-12-03 18:46:00,212] Trial 1195 finished with value: 0.46228166472503945 and parameters: {'kernel': 'rbf', 'C': 97.89125184195578, 'gamma': 0.018359719995252242, 'epsilon': 0.030182026831738793}. Best is trial 1119 with value: 0.4485361816812923.
[I 2024-12-03 18:46:00,340] Trial 1192 finished with value: 0.6171821235765143 and parameters: {'kernel': 'rbf', 'C': 37.60225234442544, 'gamma': 0.0725903678345688, 'epsilon': 0.13047747031946766}. Best is trial 1119 with value: 0.4485361816812923.
[I 2024-12-03 18:46:00,461] Trial 1191 finished with value: 0.7752712927522926 and parameters: {'kernel': 'poly', 'C': 5.2354715739822995, 'gamma': 0.06651569007746756, 'epsilon': 0.0711547287907966}. Best is trial 1119 with value: 0.4485361816812923.
[I 2024-12-03 18:46:00,465] Trial 1196 finished with value: 0.5207774653422147 and parameters: {'kernel': 'rbf', 'C': 92.07906867091077, 'gamma': 0.026104545998984673, 'epsilon': 0.10038922163769157}. Best is trial 1119 with value: 0.4485361816812923.
[I 2024-12-03 18:46:00,468] Trial 1185 finished with value: 0.6804995903729213 and parameters: {'kernel': 'rbf', 'C': 2.3025228956969164, 'gamma': 0.013096373876933007, 'epsilon': 0.04530639156112119}. Best is trial 1119 with value: 0.4485361816812923.
[I 2024-12-03 18:46:01,479] Trial 1202 finished with value: 0.5006538196418409 and parameters: {'kernel': 'rbf', 'C': 92.94489473156978, 'gamma': 0.005252275751554153, 'epsilon': 0.09023351656091061}. Best is trial 1119 with value: 0.4485361816812923.
[I 2024-12-03 18:46:01,511] Trial 1201 finished with value: 0.5397081103320692 and parameters: {'kernel': 'rbf', 'C': 92.7683755563836, 'gamma': 0.0031389027459058, 'epsilon': 0.066272847420112}. Best is trial 1119 with value: 0.4485361816812923.
[I 2024-12-03 18:46:01,969] Trial 1200 finished with value: 0.49268096621594054 and parameters: {'kernel': 'rbf', 'C': 17.3704197612121, 'gamma': 0.01765147324580227, 'epsilon': 0.03835099490557924}. Best is trial 1119 with value: 0.4485361816812923.
[I 2024-12-03 18:46:02,485] Trial 1206 finished with value: 261.05314314226155 and parameters: {'kernel': 'sigmoid', 'C': 31.67398583109654, 'gamma': 0.0643289684134311, 'epsilon': 0.027108873332856144}. Best is trial 1119 with value: 0.4485361816812923.
[I 2024-12-03 18:46:03,276] Trial 1209 finished with value: 1.3645462736371325 and parameters: {'kernel': 'poly', 'C': 0.17270169327035295, 'gamma': 0.0013411745047516204, 'epsilon': 0.044343093135803265}. Best is trial 1119 with value: 0.4485361816812923.
[I 2024-12-03 18:46:03,404] Trial 1212 finished with value: 0.5082709570542298 and parameters: {'kernel': 'rbf', 'C': 83.15380579442277, 'gamma': 0.011559359220995387, 'epsilon': 0.2760392336224549}. Best is trial 1119 with value: 0.4485361816812923.
[I 2024-12-03 18:46:03,610] Trial 1211 finished with value: 0.4799323062796174 and parameters: {'kernel': 'rbf', 'C': 21.71142958613475, 'gamma': 0.03668397960633966, 'epsilon': 0.06818863228643142}. Best is trial 1119 with value: 0.4485361816812923.
[I 2024-12-03 18:46:03,658] Trial 1205 finished with value: 0.5758202982237877 and parameters: {'kernel': 'linear', 'C': 1.504268978747767, 'gamma': 0.00413108599838006, 'epsilon': 0.0013453566985444716}. Best is trial 1119 with value: 0.4485361816812923.
[I 2024-12-03 18:46:03,659] Trial 1199 finished with value: 0.5735702766025592 and parameters: {'kernel': 'rbf', 'C': 92.6550914757994, 'gamma': 0.0019017099602796847, 'epsilon': 0.033919012378683756}. Best is trial 1119 with value: 0.4485361816812923.
[I 2024-12-03 18:46:04,120] Trial 1210 finished with value: 0.6095699544173349 and parameters: {'kernel': 'rbf', 'C': 94.57832450405614, 'gamma': 0.09928107312879172, 'epsilon': 0.07193309112273166}. Best is trial 1119 with value: 0.4485361816812923.
[I 2024-12-03 18:46:04,138] Trial 1203 finished with value: 0.5629142741301301 and parameters: {'kernel': 'linear', 'C': 59.56868100895857, 'gamma': 0.015805870310447008, 'epsilon': 0.0318588180463642}. Best is trial 1119 with value: 0.4485361816812923.
[I 2024-12-03 18:46:04,489] Trial 1208 finished with value: 0.4886971226430096 and parameters: {'kernel': 'rbf', 'C': 98.7200136750523, 'gamma': 0.022138069693598564, 'epsilon': 0.08652907673343573}. Best is trial 1119 with value: 0.4485361816812923.
[I 2024-12-03 18:46:04,899] Trial 1204 finished with value: 33.87754977374236 and parameters: {'kernel': 'sigmoid', 'C': 27.927765540477374, 'gamma': 0.009542584131748981, 'epsilon': 0.11893574939362424}. Best is trial 1119 with value: 0.4485361816812923.
[I 2024-12-03 18:46:04,913] Trial 1207 finished with value: 0.5668120393370006 and parameters: {'kernel': 'rbf', 'C': 24.34848444181996, 'gamma': 0.004540996035039424, 'epsilon': 0.04131124895158091}. Best is trial 1119 with value: 0.4485361816812923.
[I 2024-12-03 18:46:05,201] Trial 1214 finished with value: 0.59994817986632 and parameters: {'kernel': 'rbf', 'C': 15.406272980839152, 'gamma': 0.003903707248894994, 'epsilon': 0.057116342631399336}. Best is trial 1119 with value: 0.4485361816812923.
[I 2024-12-03 18:46:06,000] Trial 1222 finished with value: 0.6090383796209724 and parameters: {'kernel': 'rbf', 'C': 24.574862868499373, 'gamma': 0.0019592443931604362, 'epsilon': 0.3507665647664403}. Best is trial 1119 with value: 0.4485361816812923.
[I 2024-12-03 18:46:06,745] Trial 1218 finished with value: 0.5448566163385798 and parameters: {'kernel': 'rbf', 'C': 25.750579263462292, 'gamma': 0.05948631694444795, 'epsilon': 0.03646548404367695}. Best is trial 1119 with value: 0.4485361816812923.
[I 2024-12-03 18:46:06,909] Trial 1216 finished with value: 1.3042092654584065 and parameters: {'kernel': 'poly', 'C': 0.5454382449519923, 'gamma': 0.0008078204936000259, 'epsilon': 0.6832566446203061}. Best is trial 1119 with value: 0.4485361816812923.
[I 2024-12-03 18:46:07,852] Trial 1229 finished with value: 0.5381223889265174 and parameters: {'kernel': 'rbf', 'C': 13.034184358971197, 'gamma': 0.011618982477961323, 'epsilon': 0.0635692448108479}. Best is trial 1119 with value: 0.4485361816812923.
[I 2024-12-03 18:46:08,875] Trial 1190 finished with value: 0.7115535737281091 and parameters: {'kernel': 'sigmoid', 'C': 37.80175604254843, 'gamma': 0.0012297236867131992, 'epsilon': 0.05090032090968972}. Best is trial 1119 with value: 0.4485361816812923.
[I 2024-12-03 18:46:09,138] Trial 1221 finished with value: 0.5131360719031004 and parameters: {'kernel': 'rbf', 'C': 20.979099518874246, 'gamma': 0.01189281175187196, 'epsilon': 0.08242483270116778}. Best is trial 1119 with value: 0.4485361816812923.
[I 2024-12-03 18:46:10,146] Trial 1227 finished with value: 0.45559795841618694 and parameters: {'kernel': 'rbf', 'C': 95.36976205619726, 'gamma': 0.016868424075890454, 'epsilon': 0.045234091350606534}. Best is trial 1119 with value: 0.4485361816812923.
[I 2024-12-03 18:46:10,148] Trial 1224 finished with value: 9.55343799811305 and parameters: {'kernel': 'sigmoid', 'C': 1.1169283236064456, 'gamma': 0.09764780383314271, 'epsilon': 0.008284474168963994}. Best is trial 1119 with value: 0.4485361816812923.
[I 2024-12-03 18:46:10,237] Trial 1223 finished with value: 0.4491496270767528 and parameters: {'kernel': 'rbf', 'C': 97.9883434233287, 'gamma': 0.012670798061380436, 'epsilon': 0.07192255068632757}. Best is trial 1119 with value: 0.4485361816812923.
[I 2024-12-03 18:46:10,323] Trial 1220 finished with value: 0.48069934056801655 and parameters: {'kernel': 'rbf', 'C': 99.75902436590908, 'gamma': 0.013576956197301739, 'epsilon': 0.18459938886308708}. Best is trial 1119 with value: 0.4485361816812923.
[I 2024-12-03 18:46:10,636] Trial 1215 finished with value: 0.4912651452277118 and parameters: {'kernel': 'rbf', 'C': 99.71147403438307, 'gamma': 0.00931073739763326, 'epsilon': 0.2125235626488456}. Best is trial 1119 with value: 0.4485361816812923.
[I 2024-12-03 18:46:11,038] Trial 1234 finished with value: 0.4876533182336964 and parameters: {'kernel': 'rbf', 'C': 19.306670196713288, 'gamma': 0.04178354049050353, 'epsilon': 0.0773719417503373}. Best is trial 1119 with value: 0.4485361816812923.
[I 2024-12-03 18:46:11,298] Trial 1217 finished with value: 1.3737772009906584 and parameters: {'kernel': 'poly', 'C': 0.3320763541941172, 'gamma': 0.0001364804112992112, 'epsilon': 0.0010407850456623537}. Best is trial 1119 with value: 0.4485361816812923.
[I 2024-12-03 18:46:11,300] Trial 1219 finished with value: 1.3686773677005228 and parameters: {'kernel': 'poly', 'C': 0.0011610117009142613, 'gamma': 0.007979062591989826, 'epsilon': 0.009043237597399327}. Best is trial 1119 with value: 0.4485361816812923.
[I 2024-12-03 18:46:11,659] Trial 1225 finished with value: 0.4763559588033966 and parameters: {'kernel': 'rbf', 'C': 96.26225380260878, 'gamma': 0.007781700613355547, 'epsilon': 0.06551674637660465}. Best is trial 1119 with value: 0.4485361816812923.
[I 2024-12-03 18:46:11,797] Trial 1226 finished with value: 0.5483687773126144 and parameters: {'kernel': 'rbf', 'C': 28.473555369975305, 'gamma': 0.00529570166270143, 'epsilon': 0.18503724290019574}. Best is trial 1119 with value: 0.4485361816812923.
[I 2024-12-03 18:46:11,857] Trial 1213 finished with value: 0.8256470435314399 and parameters: {'kernel': 'sigmoid', 'C': 27.08641130473516, 'gamma': 0.0001531516230892137, 'epsilon': 0.4022238114258488}. Best is trial 1119 with value: 0.4485361816812923.
[I 2024-12-03 18:46:12,180] Trial 1239 finished with value: 0.5039150843282101 and parameters: {'kernel': 'rbf', 'C': 94.33579092802329, 'gamma': 0.005373607546970384, 'epsilon': 0.023901108315833995}. Best is trial 1119 with value: 0.4485361816812923.
[I 2024-12-03 18:46:12,442] Trial 1240 finished with value: 0.6084852546181816 and parameters: {'kernel': 'linear', 'C': 92.70057410295713, 'gamma': 0.06009469036950491, 'epsilon': 0.23828802801073518}. Best is trial 1119 with value: 0.4485361816812923.
[I 2024-12-03 18:46:12,676] Trial 1235 finished with value: 0.454471756211863 and parameters: {'kernel': 'rbf', 'C': 98.78327132309305, 'gamma': 0.016515568487178275, 'epsilon': 0.06658982728304884}. Best is trial 1119 with value: 0.4485361816812923.
[I 2024-12-03 18:46:12,782] Trial 1242 finished with value: 0.4741688647405377 and parameters: {'kernel': 'rbf', 'C': 14.97851456244827, 'gamma': 0.025350308144756646, 'epsilon': 0.05352784747728211}. Best is trial 1119 with value: 0.4485361816812923.
[I 2024-12-03 18:46:12,872] Trial 1243 finished with value: 0.5947725415359933 and parameters: {'kernel': 'rbf', 'C': 99.97994719230206, 'gamma': 0.11582296535444876, 'epsilon': 0.15215744324349484}. Best is trial 1119 with value: 0.4485361816812923.
[I 2024-12-03 18:46:13,126] Trial 1238 finished with value: 8.546538588041663 and parameters: {'kernel': 'sigmoid', 'C': 1.015611777388049, 'gamma': 0.09130786734911399, 'epsilon': 0.6467723814248472}. Best is trial 1119 with value: 0.4485361816812923.
[I 2024-12-03 18:46:13,131] Trial 1244 finished with value: 0.49583708217550587 and parameters: {'kernel': 'rbf', 'C': 18.325425908909608, 'gamma': 0.040937216984452934, 'epsilon': 0.1494643825869013}. Best is trial 1119 with value: 0.4485361816812923.
[I 2024-12-03 18:46:13,138] Trial 1232 finished with value: 0.5194865796887765 and parameters: {'kernel': 'rbf', 'C': 16.564218952302713, 'gamma': 0.013066193390927183, 'epsilon': 0.042945414648342506}. Best is trial 1119 with value: 0.4485361816812923.
[I 2024-12-03 18:46:13,249] Trial 1228 finished with value: 0.5798345339430075 and parameters: {'kernel': 'rbf', 'C': 99.46879051109401, 'gamma': 0.03301745754333478, 'epsilon': 0.30799435733447417}. Best is trial 1119 with value: 0.4485361816812923.
[I 2024-12-03 18:46:13,812] Trial 1233 finished with value: 0.5653148147560577 and parameters: {'kernel': 'rbf', 'C': 24.249057478944, 'gamma': 0.06854009012480075, 'epsilon': 0.040824479765089655}. Best is trial 1119 with value: 0.4485361816812923.
[I 2024-12-03 18:46:13,860] Trial 1230 finished with value: 0.6618377478809854 and parameters: {'kernel': 'linear', 'C': 68.86236911472675, 'gamma': 0.0029243123533838978, 'epsilon': 0.3594544601551181}. Best is trial 1119 with value: 0.4485361816812923.
[I 2024-12-03 18:46:13,863] Trial 1241 finished with value: 0.4729396093784723 and parameters: {'kernel': 'rbf', 'C': 18.857760536778958, 'gamma': 0.02811539464377377, 'epsilon': 0.09847232389425158}. Best is trial 1119 with value: 0.4485361816812923.
[I 2024-12-03 18:46:14,675] Trial 1231 finished with value: 0.45030343158234315 and parameters: {'kernel': 'rbf', 'C': 96.6267449528142, 'gamma': 0.01122478551036297, 'epsilon': 0.08655333233277825}. Best is trial 1119 with value: 0.4485361816812923.
[I 2024-12-03 18:46:14,820] Trial 1247 finished with value: 1.0094744567256233 and parameters: {'kernel': 'poly', 'C': 14.532663389137232, 'gamma': 0.009454975956467158, 'epsilon': 0.14892168274667117}. Best is trial 1119 with value: 0.4485361816812923.
[I 2024-12-03 18:46:15,262] Trial 1237 finished with value: 0.6360861566561984 and parameters: {'kernel': 'rbf', 'C': 96.57467960778175, 'gamma': 0.07971118750497201, 'epsilon': 0.030430982445456653}. Best is trial 1119 with value: 0.4485361816812923.
[I 2024-12-03 18:46:15,498] Trial 1246 finished with value: 0.508281561689111 and parameters: {'kernel': 'rbf', 'C': 20.357583462302177, 'gamma': 0.013201600811683579, 'epsilon': 0.11438536916066423}. Best is trial 1119 with value: 0.4485361816812923.
[I 2024-12-03 18:46:15,505] Trial 1249 finished with value: 2.415477697132899 and parameters: {'kernel': 'sigmoid', 'C': 14.823383228559475, 'gamma': 0.0042724091146463476, 'epsilon': 0.030167123589431966}. Best is trial 1119 with value: 0.4485361816812923.
[I 2024-12-03 18:46:16,657] Trial 1245 finished with value: 0.558331425562484 and parameters: {'kernel': 'rbf', 'C': 87.62934564857659, 'gamma': 0.0021129434172314793, 'epsilon': 0.12100634261120778}. Best is trial 1119 with value: 0.4485361816812923.
[I 2024-12-03 18:46:17,534] Trial 1236 finished with value: 0.5538829949827223 and parameters: {'kernel': 'linear', 'C': 58.63546976389597, 'gamma': 0.00031357475808480983, 'epsilon': 0.013334156054447021}. Best is trial 1119 with value: 0.4485361816812923.
[I 2024-12-03 18:46:18,268] Trial 1260 finished with value: 0.556937385713116 and parameters: {'kernel': 'rbf', 'C': 94.96295298821616, 'gamma': 0.0024279327071312752, 'epsilon': 0.051396319405146794}. Best is trial 1119 with value: 0.4485361816812923.
[I 2024-12-03 18:46:19,052] Trial 1254 finished with value: 0.5017080273575335 and parameters: {'kernel': 'rbf', 'C': 20.376692727155955, 'gamma': 0.022461141084548195, 'epsilon': 0.3016442656440725}. Best is trial 1119 with value: 0.4485361816812923.
[I 2024-12-03 18:46:19,124] Trial 1259 finished with value: 0.5454839456444394 and parameters: {'kernel': 'rbf', 'C': 20.480715834774404, 'gamma': 0.008660114695434812, 'epsilon': 0.23306319444525117}. Best is trial 1119 with value: 0.4485361816812923.
[I 2024-12-03 18:46:19,185] Trial 1253 finished with value: 0.5290176512162331 and parameters: {'kernel': 'rbf', 'C': 99.5340412294354, 'gamma': 0.028111261164279124, 'epsilon': 0.07545048427380455}. Best is trial 1119 with value: 0.4485361816812923.
[I 2024-12-03 18:46:19,189] Trial 1251 finished with value: 0.5338125960645735 and parameters: {'kernel': 'rbf', 'C': 26.01859206040772, 'gamma': 0.007464308312323347, 'epsilon': 0.08202410321571965}. Best is trial 1119 with value: 0.4485361816812923.
[I 2024-12-03 18:46:19,384] Trial 1252 finished with value: 0.5765735072883827 and parameters: {'kernel': 'rbf', 'C': 26.498884867910085, 'gamma': 0.003221739127831863, 'epsilon': 0.17265389782258833}. Best is trial 1119 with value: 0.4485361816812923.
[I 2024-12-03 18:46:20,632] Trial 1255 finished with value: 0.5850847513420858 and parameters: {'kernel': 'rbf', 'C': 20.10794887614711, 'gamma': 0.0036446008819847955, 'epsilon': 0.19076880105684887}. Best is trial 1119 with value: 0.4485361816812923.
[I 2024-12-03 18:46:20,714] Trial 1256 finished with value: 0.4613577808307814 and parameters: {'kernel': 'rbf', 'C': 97.05180282364337, 'gamma': 0.00943790490284179, 'epsilon': 0.10062962324143618}. Best is trial 1119 with value: 0.4485361816812923.
[I 2024-12-03 18:46:21,386] Trial 1262 finished with value: 0.5598049921133528 and parameters: {'kernel': 'rbf', 'C': 96.5764792430778, 'gamma': 0.014251905252737526, 'epsilon': 0.424465199244911}. Best is trial 1119 with value: 0.4485361816812923.
[I 2024-12-03 18:46:21,854] Trial 1261 finished with value: 0.47789376117138577 and parameters: {'kernel': 'rbf', 'C': 93.1723254913609, 'gamma': 0.007766122291631228, 'epsilon': 0.07220941419072509}. Best is trial 1119 with value: 0.4485361816812923.
[I 2024-12-03 18:46:22,593] Trial 1268 finished with value: 0.8115913858168249 and parameters: {'kernel': 'poly', 'C': 53.19273144291539, 'gamma': 0.02271687760826903, 'epsilon': 0.13837923551609524}. Best is trial 1119 with value: 0.4485361816812923.
[I 2024-12-03 18:46:22,645] Trial 1269 finished with value: 0.6612939553569919 and parameters: {'kernel': 'linear', 'C': 91.15447039814268, 'gamma': 0.48772469245620004, 'epsilon': 0.759880646785044}. Best is trial 1119 with value: 0.4485361816812923.
[I 2024-12-03 18:46:22,883] Trial 1266 finished with value: 0.4981627117707149 and parameters: {'kernel': 'rbf', 'C': 99.027725442343, 'gamma': 0.025520100750412868, 'epsilon': 0.06039326780642481}. Best is trial 1119 with value: 0.4485361816812923.
[I 2024-12-03 18:46:23,048] Trial 1248 finished with value: 0.5612816528249718 and parameters: {'kernel': 'linear', 'C': 61.50011134281475, 'gamma': 0.20234936842519904, 'epsilon': 0.02944478804128946}. Best is trial 1119 with value: 0.4485361816812923.
[I 2024-12-03 18:46:23,051] Trial 1265 finished with value: 0.6673877909725064 and parameters: {'kernel': 'rbf', 'C': 1.2482835661807703, 'gamma': 0.11376173324071427, 'epsilon': 0.008522485842009224}. Best is trial 1119 with value: 0.4485361816812923.
[I 2024-12-03 18:46:23,189] Trial 1257 finished with value: 0.48058250072261277 and parameters: {'kernel': 'rbf', 'C': 84.81661395480955, 'gamma': 0.008620706330979024, 'epsilon': 0.16363109534265477}. Best is trial 1119 with value: 0.4485361816812923.
[I 2024-12-03 18:46:23,303] Trial 1258 finished with value: 0.48000546019780976 and parameters: {'kernel': 'rbf', 'C': 93.2516488037595, 'gamma': 0.007550902763089984, 'epsilon': 0.04490988660479871}. Best is trial 1119 with value: 0.4485361816812923.
[I 2024-12-03 18:46:23,689] Trial 1264 finished with value: 0.5476623530535346 and parameters: {'kernel': 'rbf', 'C': 20.134288289876203, 'gamma': 0.006994259999801881, 'epsilon': 0.0634135549264073}. Best is trial 1119 with value: 0.4485361816812923.
[I 2024-12-03 18:46:24,512] Trial 1273 finished with value: 0.4866161430772894 and parameters: {'kernel': 'rbf', 'C': 30.27683650166251, 'gamma': 0.012531298470576, 'epsilon': 0.09384892546716073}. Best is trial 1119 with value: 0.4485361816812923.
