[I 2024-12-03 19:32:58,566] Trial 2440 finished with value: 0.8144037293436566 and parameters: {'kernel': 'rbf', 'C': 0.09438036712149751, 'gamma': 0.001914490743001201, 'epsilon': 0.01909835434293154}. Best is trial 88 with value: 0.3542875001421725.
[I 2024-12-03 19:32:59,671] Trial 2441 finished with value: 0.7708960649775983 and parameters: {'kernel': 'linear', 'C': 0.2558481865416681, 'gamma': 0.00043719691555287217, 'epsilon': 0.825925879368057}. Best is trial 88 with value: 0.3542875001421725.
[I 2024-12-03 19:33:00,853] Trial 2442 finished with value: 0.37196341520435217 and parameters: {'kernel': 'rbf', 'C': 91.86663131455202, 'gamma': 0.023585004856486784, 'epsilon': 0.3951461277583541}. Best is trial 88 with value: 0.3542875001421725.
[I 2024-12-03 19:33:02,116] Trial 2443 finished with value: 1.0628669880883372 and parameters: {'kernel': 'sigmoid', 'C': 0.00846901451732842, 'gamma': 0.0005687744798228695, 'epsilon': 0.33819172780375334}. Best is trial 88 with value: 0.3542875001421725.
[I 2024-12-03 19:33:14,717] Trial 591 finished with value: 43.98867948863423 and parameters: {'kernel': 'poly', 'C': 76.99623975310729, 'gamma': 0.19410333407015454, 'epsilon': 0.5228269063148178}. Best is trial 88 with value: 0.3542875001421725.
[I 2024-12-03 19:33:17,536] Trial 2445 finished with value: 0.38279218497482737 and parameters: {'kernel': 'rbf', 'C': 98.84637993958184, 'gamma': 0.013915566112415819, 'epsilon': 0.18700861234759425}. Best is trial 88 with value: 0.3542875001421725.
[I 2024-12-03 19:33:19,987] Trial 2446 finished with value: 0.39584334417847206 and parameters: {'kernel': 'rbf', 'C': 24.812749507111967, 'gamma': 0.053785505497668196, 'epsilon': 0.25053724815695533}. Best is trial 88 with value: 0.3542875001421725.
[I 2024-12-03 19:33:21,790] Trial 2447 finished with value: 0.36024074200146206 and parameters: {'kernel': 'rbf', 'C': 98.57871881329096, 'gamma': 0.03814447513873886, 'epsilon': 0.10276201571815805}. Best is trial 88 with value: 0.3542875001421725.
[I 2024-12-03 19:33:23,404] Trial 2448 finished with value: 0.3966613544030359 and parameters: {'kernel': 'rbf', 'C': 23.80053181381926, 'gamma': 0.08106208510991879, 'epsilon': 0.0875842895284107}. Best is trial 88 with value: 0.3542875001421725.
[I 2024-12-03 19:33:24,964] Trial 2449 finished with value: 0.4113599182496567 and parameters: {'kernel': 'rbf', 'C': 23.322654990478707, 'gamma': 0.10612131389369574, 'epsilon': 0.03159089671238737}. Best is trial 88 with value: 0.3542875001421725.
[I 2024-12-03 19:33:26,212] Trial 2450 finished with value: 0.4593019364250129 and parameters: {'kernel': 'rbf', 'C': 5.941970815333551, 'gamma': 0.024564467221503513, 'epsilon': 0.16793596686957413}. Best is trial 88 with value: 0.3542875001421725.
[I 2024-12-03 19:33:28,387] Trial 2451 finished with value: 0.3665130106641865 and parameters: {'kernel': 'rbf', 'C': 94.6251198577839, 'gamma': 0.025502818903400375, 'epsilon': 0.06944671890878347}. Best is trial 88 with value: 0.3542875001421725.
[I 2024-12-03 19:33:29,546] Trial 2452 finished with value: 0.41461259892823205 and parameters: {'kernel': 'rbf', 'C': 20.6287281715245, 'gamma': 0.010044828730145968, 'epsilon': 0.15111036413489867}. Best is trial 88 with value: 0.3542875001421725.
[I 2024-12-03 19:33:31,039] Trial 2453 finished with value: 0.4104299972189675 and parameters: {'kernel': 'rbf', 'C': 22.1161522914191, 'gamma': 0.0948579340437569, 'epsilon': 0.15797751010308772}. Best is trial 88 with value: 0.3542875001421725.
[I 2024-12-03 19:33:32,261] Trial 2454 finished with value: 0.4403449134294554 and parameters: {'kernel': 'rbf', 'C': 93.41448666346169, 'gamma': 0.11418021496782943, 'epsilon': 0.2113197107008023}. Best is trial 88 with value: 0.3542875001421725.
[I 2024-12-03 19:33:33,553] Trial 2455 finished with value: 0.38526752128894975 and parameters: {'kernel': 'rbf', 'C': 26.945691356119102, 'gamma': 0.039410985560673455, 'epsilon': 0.15046433898280406}. Best is trial 88 with value: 0.3542875001421725.
[I 2024-12-03 19:33:35,189] Trial 2456 finished with value: 0.4654885329919842 and parameters: {'kernel': 'rbf', 'C': 96.16328178579865, 'gamma': 0.16221390015576828, 'epsilon': 0.07202198066889456}. Best is trial 88 with value: 0.3542875001421725.
[I 2024-12-03 19:33:36,669] Trial 2457 finished with value: 0.4179806837455588 and parameters: {'kernel': 'rbf', 'C': 26.17663390510912, 'gamma': 0.025992450616020422, 'epsilon': 0.06391373689295901}. Best is trial 88 with value: 0.3542875001421725.
[I 2024-12-03 19:33:38,426] Trial 2458 finished with value: 0.41526798462624964 and parameters: {'kernel': 'rbf', 'C': 24.335474398247065, 'gamma': 0.01972188545591489, 'epsilon': 0.13026984953392465}. Best is trial 88 with value: 0.3542875001421725.
[I 2024-12-03 19:33:39,599] Trial 2459 finished with value: 0.5812330695299364 and parameters: {'kernel': 'rbf', 'C': 26.392213532147352, 'gamma': 0.2230071941386049, 'epsilon': 0.3024586571387147}. Best is trial 88 with value: 0.3542875001421725.
[I 2024-12-03 19:33:41,954] Trial 2460 finished with value: 0.42200723564182796 and parameters: {'kernel': 'rbf', 'C': 19.851402146812266, 'gamma': 0.03483179325891885, 'epsilon': 0.05484779832148642}. Best is trial 88 with value: 0.3542875001421725.
[I 2024-12-03 19:33:43,384] Trial 2461 finished with value: 0.36790547479081115 and parameters: {'kernel': 'rbf', 'C': 93.98447379188724, 'gamma': 0.06216523435944982, 'epsilon': 0.10625262059755167}. Best is trial 88 with value: 0.3542875001421725.
[I 2024-12-03 19:33:46,133] Trial 2462 finished with value: 0.36729106917523513 and parameters: {'kernel': 'rbf', 'C': 97.48905943141787, 'gamma': 0.027315190201373553, 'epsilon': 0.04260259436442558}. Best is trial 88 with value: 0.3542875001421725.
[I 2024-12-03 19:33:47,682] Trial 2463 finished with value: 0.4075858705403942 and parameters: {'kernel': 'rbf', 'C': 98.60926998839415, 'gamma': 0.0116073163745542, 'epsilon': 0.08867467587201447}. Best is trial 88 with value: 0.3542875001421725.
[I 2024-12-03 19:33:49,093] Trial 2464 finished with value: 0.38621621479822277 and parameters: {'kernel': 'rbf', 'C': 87.1522638244666, 'gamma': 0.06529216923688763, 'epsilon': 0.2713631376291562}. Best is trial 88 with value: 0.3542875001421725.
[I 2024-12-03 19:33:50,350] Trial 2465 finished with value: 0.36549903619763074 and parameters: {'kernel': 'rbf', 'C': 87.05313360197145, 'gamma': 0.02775789333612857, 'epsilon': 0.2605791956598449}. Best is trial 88 with value: 0.3542875001421725.
[I 2024-12-03 19:33:51,724] Trial 2466 finished with value: 27.351826275057192 and parameters: {'kernel': 'sigmoid', 'C': 0.7639007180045684, 'gamma': 0.6410067887706238, 'epsilon': 0.22139589066026724}. Best is trial 88 with value: 0.3542875001421725.
[I 2024-12-03 19:33:52,889] Trial 2467 finished with value: 0.7241592227174287 and parameters: {'kernel': 'linear', 'C': 0.17959931012656913, 'gamma': 0.19277546824290714, 'epsilon': 0.5514011878095206}. Best is trial 88 with value: 0.3542875001421725.
[I 2024-12-03 19:33:54,252] Trial 2468 finished with value: 0.8677981169586593 and parameters: {'kernel': 'linear', 'C': 0.018685581758230804, 'gamma': 0.01682275422884808, 'epsilon': 0.037994698715744506}. Best is trial 88 with value: 0.3542875001421725.
[I 2024-12-03 19:34:31,654] Trial 2469 finished with value: 0.7976062965445407 and parameters: {'kernel': 'linear', 'C': 27.428397285631394, 'gamma': 0.00014632178899486078, 'epsilon': 0.003390660532120434}. Best is trial 88 with value: 0.3542875001421725.
[I 2024-12-03 19:34:33,352] Trial 2470 finished with value: 0.4059240276912183 and parameters: {'kernel': 'rbf', 'C': 90.4783726806389, 'gamma': 0.11094439174791995, 'epsilon': 0.07403744763622941}. Best is trial 88 with value: 0.3542875001421725.
[I 2024-12-03 19:34:34,660] Trial 2471 finished with value: 0.403391301576913 and parameters: {'kernel': 'rbf', 'C': 23.161024688147734, 'gamma': 0.030580808330977913, 'epsilon': 0.148199410404516}. Best is trial 88 with value: 0.3542875001421725.
[I 2024-12-03 19:34:36,218] Trial 2472 finished with value: 0.3665635450350321 and parameters: {'kernel': 'rbf', 'C': 90.6809414993263, 'gamma': 0.02381750243515706, 'epsilon': 0.09642848363060434}. Best is trial 88 with value: 0.3542875001421725.
[I 2024-12-03 19:34:37,727] Trial 2473 finished with value: 0.4318765880590082 and parameters: {'kernel': 'rbf', 'C': 94.30572197979866, 'gamma': 0.13584779904806282, 'epsilon': 0.04934134652367781}. Best is trial 88 with value: 0.3542875001421725.
[I 2024-12-03 19:34:39,996] Trial 1208 finished with value: 14.080218948490227 and parameters: {'kernel': 'poly', 'C': 90.74043516047836, 'gamma': 0.12378216722775844, 'epsilon': 0.13510357959112584}. Best is trial 88 with value: 0.3542875001421725.
[I 2024-12-03 19:34:41,190] Trial 2475 finished with value: 0.4268151539795805 and parameters: {'kernel': 'rbf', 'C': 16.58666672640453, 'gamma': 0.06001697725163052, 'epsilon': 0.366389933067445}. Best is trial 88 with value: 0.3542875001421725.
[I 2024-12-03 19:34:42,505] Trial 2476 finished with value: 0.49075956968097456 and parameters: {'kernel': 'rbf', 'C': 4.991087582839708, 'gamma': 0.10869513580785566, 'epsilon': 0.04370981576310027}. Best is trial 88 with value: 0.3542875001421725.
[I 2024-12-03 19:34:43,857] Trial 2477 finished with value: 0.39240683798200793 and parameters: {'kernel': 'rbf', 'C': 95.21627603719192, 'gamma': 0.012996512176332947, 'epsilon': 0.17093223294116708}. Best is trial 88 with value: 0.3542875001421725.
[I 2024-12-03 19:34:45,850] Trial 2478 finished with value: 0.38628651727533286 and parameters: {'kernel': 'rbf', 'C': 27.339588101424333, 'gamma': 0.043491569525010945, 'epsilon': 0.10965330852475072}. Best is trial 88 with value: 0.3542875001421725.
[I 2024-12-03 19:34:46,965] Trial 2479 finished with value: 0.5551884134175578 and parameters: {'kernel': 'rbf', 'C': 21.631026291170425, 'gamma': 0.13035351899155034, 'epsilon': 0.4621980903655067}. Best is trial 88 with value: 0.3542875001421725.
[I 2024-12-03 19:35:00,293] Trial 2480 finished with value: 0.7639656876196651 and parameters: {'kernel': 'poly', 'C': 34.08953737986313, 'gamma': 0.02438949418389501, 'epsilon': 0.10825115806379863}. Best is trial 88 with value: 0.3542875001421725.
[I 2024-12-03 19:35:01,783] Trial 2481 finished with value: 0.36055959484556915 and parameters: {'kernel': 'rbf', 'C': 96.7855829318431, 'gamma': 0.05118503686892963, 'epsilon': 0.08650230007613158}. Best is trial 88 with value: 0.3542875001421725.
[I 2024-12-03 19:35:03,154] Trial 2482 finished with value: 527.9034717124059 and parameters: {'kernel': 'sigmoid', 'C': 22.9170002177948, 'gamma': 0.24307479445883004, 'epsilon': 0.2018366722762372}. Best is trial 88 with value: 0.3542875001421725.
[I 2024-12-03 19:35:04,454] Trial 2483 finished with value: 0.4730788316555799 and parameters: {'kernel': 'rbf', 'C': 98.00085238481586, 'gamma': 0.1634578594626749, 'epsilon': 0.10577720316234139}. Best is trial 88 with value: 0.3542875001421725.
[I 2024-12-03 19:35:05,716] Trial 2484 finished with value: 0.39746859583862454 and parameters: {'kernel': 'rbf', 'C': 94.40651316802614, 'gamma': 0.09507825615423511, 'epsilon': 0.1535196162645945}. Best is trial 88 with value: 0.3542875001421725.
[I 2024-12-03 19:35:07,339] Trial 2485 finished with value: 0.40574385701203697 and parameters: {'kernel': 'rbf', 'C': 92.87061167137249, 'gamma': 0.11203007860855396, 'epsilon': 0.03086113350188584}. Best is trial 88 with value: 0.3542875001421725.
[I 2024-12-03 19:35:08,548] Trial 2486 finished with value: 0.392463878433525 and parameters: {'kernel': 'rbf', 'C': 26.153976687594533, 'gamma': 0.06920044260157075, 'epsilon': 0.1825081788485502}. Best is trial 88 with value: 0.3542875001421725.
[I 2024-12-03 19:35:09,640] Trial 2487 finished with value: 0.48008090404503373 and parameters: {'kernel': 'rbf', 'C': 3.9342178902796694, 'gamma': 0.0159327435060614, 'epsilon': 0.32169017965833696}. Best is trial 88 with value: 0.3542875001421725.
[I 2024-12-03 19:35:14,503] Trial 2488 finished with value: 0.7942037972942573 and parameters: {'kernel': 'linear', 'C': 4.519938377316708, 'gamma': 0.052144765201911414, 'epsilon': 0.0037029894256227556}. Best is trial 88 with value: 0.3542875001421725.
[I 2024-12-03 19:35:15,713] Trial 2489 finished with value: 0.3676081445684587 and parameters: {'kernel': 'rbf', 'C': 89.40623181037209, 'gamma': 0.020227502647028144, 'epsilon': 0.2717436588559911}. Best is trial 88 with value: 0.3542875001421725.
[I 2024-12-03 19:35:17,199] Trial 2490 finished with value: 0.3660594069962428 and parameters: {'kernel': 'rbf', 'C': 96.58580733215149, 'gamma': 0.024472340055498965, 'epsilon': 0.10079703535750476}. Best is trial 88 with value: 0.3542875001421725.
[I 2024-12-03 19:35:36,797] Trial 2384 finished with value: 2.691130772055775 and parameters: {'kernel': 'poly', 'C': 70.01278345825442, 'gamma': 0.05169828577325907, 'epsilon': 0.0471084783485309}. Best is trial 88 with value: 0.3542875001421725.
[I 2024-12-03 19:35:52,850] Trial 2492 finished with value: 0.7178450393465479 and parameters: {'kernel': 'linear', 'C': 19.15868804222682, 'gamma': 0.020203336560471023, 'epsilon': 0.28751388107534886}. Best is trial 88 with value: 0.3542875001421725.
[I 2024-12-03 19:35:54,388] Trial 2493 finished with value: 0.5259453082117497 and parameters: {'kernel': 'rbf', 'C': 5.164695230756327, 'gamma': 0.19401911261075147, 'epsilon': 0.1317316236526697}. Best is trial 88 with value: 0.3542875001421725.
[I 2024-12-03 19:35:56,665] Trial 2494 finished with value: 0.3794885850279535 and parameters: {'kernel': 'rbf', 'C': 90.40738658475162, 'gamma': 0.019247423987131196, 'epsilon': 0.031523865201720604}. Best is trial 88 with value: 0.3542875001421725.
[I 2024-12-03 19:35:57,906] Trial 2495 finished with value: 0.4737162582445611 and parameters: {'kernel': 'rbf', 'C': 4.335979059971783, 'gamma': 0.007008130147494412, 'epsilon': 0.09062947773566744}. Best is trial 88 with value: 0.3542875001421725.
[I 2024-12-03 19:35:59,218] Trial 2496 finished with value: 0.39052536642694163 and parameters: {'kernel': 'rbf', 'C': 98.87641086609007, 'gamma': 0.059599778683427765, 'epsilon': 0.3127819274495232}. Best is trial 88 with value: 0.3542875001421725.
[I 2024-12-03 19:36:01,380] Trial 2497 finished with value: 0.39113882423171936 and parameters: {'kernel': 'rbf', 'C': 27.633212945964797, 'gamma': 0.07859173566170935, 'epsilon': 0.0385153548510385}. Best is trial 88 with value: 0.3542875001421725.
[I 2024-12-03 19:36:02,727] Trial 2498 finished with value: 0.3881090961346206 and parameters: {'kernel': 'rbf', 'C': 24.429377705394298, 'gamma': 0.06030802400952872, 'epsilon': 0.11695411829199395}. Best is trial 88 with value: 0.3542875001421725.
[I 2024-12-03 19:36:03,917] Trial 2499 finished with value: 0.4016211483380626 and parameters: {'kernel': 'rbf', 'C': 98.2810829198376, 'gamma': 0.009835557879879997, 'epsilon': 0.333670394405579}. Best is trial 88 with value: 0.3542875001421725.
[I 2024-12-03 19:38:22,684] Trial 1077 finished with value: 28.49412967577826 and parameters: {'kernel': 'poly', 'C': 74.29185693903119, 'gamma': 0.15645521674069363, 'epsilon': 0.3009023827798007}. Best is trial 88 with value: 0.3542875001421725.
[I 2024-12-03 19:39:10,887] Trial 2044 finished with value: 3.803825174632539 and parameters: {'kernel': 'poly', 'C': 16.84435816128584, 'gamma': 0.11425230397302591, 'epsilon': 0.16148690241735444}. Best is trial 88 with value: 0.3542875001421725.
[I 2024-12-03 19:42:20,524] Trial 200 finished with value: 11.870592776935823 and parameters: {'kernel': 'poly', 'C': 61.28365827478149, 'gamma': 0.12088090662287566, 'epsilon': 0.036680290227438996}. Best is trial 88 with value: 0.3542875001421725.
[I 2024-12-03 19:46:00,089] Trial 1507 finished with value: 17.06032193231431 and parameters: {'kernel': 'poly', 'C': 16.119753180209553, 'gamma': 0.2771074907933943, 'epsilon': 0.17336679366631488}. Best is trial 88 with value: 0.3542875001421725.
[I 2024-12-03 19:52:14,682] Trial 561 finished with value: 4.158656192478432 and parameters: {'kernel': 'poly', 'C': 61.90383252054563, 'gamma': 0.07143861108217821, 'epsilon': 0.10077926589006338}. Best is trial 88 with value: 0.3542875001421725.
[I 2024-12-03 19:56:09,042] Trial 1096 finished with value: 1.8694497226416877 and parameters: {'kernel': 'poly', 'C': 97.39506120724123, 'gamma': 0.029534082099867152, 'epsilon': 0.08811246417634641}. Best is trial 88 with value: 0.3542875001421725.
[I 2024-12-03 20:05:37,644] Trial 283 finished with value: 10.905263805341866 and parameters: {'kernel': 'poly', 'C': 81.51605338700094, 'gamma': 0.12424564946781663, 'epsilon': 0.12809997654667515}. Best is trial 88 with value: 0.3542875001421725.
[I 2024-12-03 20:06:25,904] Trial 2406 finished with value: 5.6375531146921505 and parameters: {'kernel': 'poly', 'C': 69.13356682913866, 'gamma': 0.10604503080527564, 'epsilon': 0.22164217510295164}. Best is trial 88 with value: 0.3542875001421725.
[I 2024-12-03 20:10:30,801] Trial 1873 finished with value: 2.9974195199266442 and parameters: {'kernel': 'poly', 'C': 87.17334495794977, 'gamma': 0.04557485346063549, 'epsilon': 0.10264756744719014}. Best is trial 88 with value: 0.3542875001421725.
[I 2024-12-03 20:10:52,758] Trial 2392 finished with value: 3.7194263680477007 and parameters: {'kernel': 'poly', 'C': 0.12854074731806553, 'gamma': 0.4695812605113973, 'epsilon': 0.0012114091913746343}. Best is trial 88 with value: 0.3542875001421725.
[I 2024-12-03 20:15:16,881] Trial 1446 finished with value: 13.040139112571248 and parameters: {'kernel': 'poly', 'C': 11.451011168881918, 'gamma': 0.6393264221832162, 'epsilon': 0.0017008719552802816}. Best is trial 88 with value: 0.3542875001421725.
[I 2024-12-03 20:17:01,983] Trial 780 finished with value: 4.457621918336968 and parameters: {'kernel': 'poly', 'C': 99.5781602492445, 'gamma': 0.12500168191167965, 'epsilon': 0.12238065313655344}. Best is trial 88 with value: 0.3542875001421725.
[I 2024-12-03 20:19:28,649] Trial 202 finished with value: 172.51065085585924 and parameters: {'kernel': 'poly', 'C': 52.874170639011055, 'gamma': 0.49421933145338615, 'epsilon': 0.03094784585137368}. Best is trial 88 with value: 0.3542875001421725.
[I 2024-12-03 20:24:26,814] Trial 448 finished with value: 3.4689266228346542 and parameters: {'kernel': 'poly', 'C': 0.23780294321443154, 'gamma': 0.43710428204649954, 'epsilon': 0.03673373692099331}. Best is trial 88 with value: 0.3542875001421725.
[I 2024-12-03 20:26:07,297] Trial 2140 finished with value: 4.683198092389145 and parameters: {'kernel': 'poly', 'C': 93.55501040815835, 'gamma': 0.059937991417786704, 'epsilon': 0.14368994152315165}. Best is trial 88 with value: 0.3542875001421725.
[I 2024-12-03 20:27:56,938] Trial 943 finished with value: 8.670357220471027 and parameters: {'kernel': 'poly', 'C': 74.25158093517545, 'gamma': 0.16814737261081644, 'epsilon': 0.04898202171131558}. Best is trial 88 with value: 0.3542875001421725.
[I 2024-12-03 20:29:20,874] Trial 1784 finished with value: 3.608830879287627 and parameters: {'kernel': 'poly', 'C': 11.987501348675039, 'gamma': 0.11795901980208176, 'epsilon': 0.009118070269000696}. Best is trial 88 with value: 0.3542875001421725.
[I 2024-12-03 20:30:08,001] Trial 2491 finished with value: 208.0023592123838 and parameters: {'kernel': 'poly', 'C': 97.3271815525303, 'gamma': 0.3143851294807243, 'epsilon': 0.07602760460678319}. Best is trial 88 with value: 0.3542875001421725.
[I 2024-12-03 20:31:18,090] Trial 1461 finished with value: 210.0179042379324 and parameters: {'kernel': 'poly', 'C': 2.4290674034173523, 'gamma': 0.9478478684033457, 'epsilon': 0.017117805209552375}. Best is trial 88 with value: 0.3542875001421725.
[I 2024-12-03 20:31:30,586] Trial 2474 finished with value: 5.249572338895137 and parameters: {'kernel': 'poly', 'C': 26.01819685091789, 'gamma': 0.11586822847474952, 'epsilon': 0.10522532243933143}. Best is trial 88 with value: 0.3542875001421725.
[I 2024-12-03 20:37:25,323] Trial 2143 finished with value: 4.400320245080852 and parameters: {'kernel': 'poly', 'C': 86.06732041658593, 'gamma': 0.06617486038626991, 'epsilon': 0.0562558837677566}. Best is trial 88 with value: 0.3542875001421725.
[I 2024-12-03 20:42:35,286] Trial 2444 finished with value: 8.268989530872206 and parameters: {'kernel': 'poly', 'C': 79.92782905762601, 'gamma': 0.15380815277855203, 'epsilon': 0.009188736614790425}. Best is trial 88 with value: 0.3542875001421725.
[I 2024-12-03 20:43:20,762] Trial 1620 finished with value: 25.66652844462601 and parameters: {'kernel': 'poly', 'C': 13.41278886556995, 'gamma': 0.38515280158297877, 'epsilon': 0.04333861679080886}. Best is trial 88 with value: 0.3542875001421725.
[I 2024-12-03 20:43:42,230] Trial 1643 finished with value: 44.726279556450564 and parameters: {'kernel': 'poly', 'C': 80.93672473273584, 'gamma': 0.20962153163934655, 'epsilon': 0.06203895896451253}. Best is trial 88 with value: 0.3542875001421725.
[I 2024-12-03 20:43:56,243] Trial 458 finished with value: 9.195913430364556 and parameters: {'kernel': 'poly', 'C': 5.251659633021364, 'gamma': 0.288446269486216, 'epsilon': 0.10444084732692543}. Best is trial 88 with value: 0.3542875001421725.
[I 2024-12-03 20:44:22,329] Trial 169 finished with value: 7.950138560788178 and parameters: {'kernel': 'poly', 'C': 0.903816761496013, 'gamma': 0.5767891394494875, 'epsilon': 0.0012862989652161665}. Best is trial 88 with value: 0.3542875001421725.
[I 2024-12-03 20:54:14,012] Trial 866 finished with value: 5982.585690852825 and parameters: {'kernel': 'poly', 'C': 64.15473001085935, 'gamma': 0.9086725849263343, 'epsilon': 0.006925098976335192}. Best is trial 88 with value: 0.3542875001421725.
[I 2024-12-03 20:57:30,184] Trial 1802 finished with value: 7.51723187488288 and parameters: {'kernel': 'poly', 'C': 83.40809677701652, 'gamma': 0.12508333543642203, 'epsilon': 0.06792395893983724}. Best is trial 88 with value: 0.3542875001421725.
