[I 2024-12-04 20:22:55,506] Trial 1750 finished with value: 0.3241660666406343 and parameters: {'n_estimators': 413, 'max_depth': 50, 'min_samples_split': 2, 'min_samples_leaf': 1, 'max_features': 'sqrt', 'bootstrap': False, 'criterion': 'squared_error'}. Best is trial 1631 with value: 0.32128932742921457.
[I 2024-12-04 20:22:57,330] Trial 1754 finished with value: 0.5037821906134832 and parameters: {'n_estimators': 182, 'max_depth': 45, 'min_samples_split': 2, 'min_samples_leaf': 3, 'max_features': None, 'bootstrap': True, 'criterion': 'squared_error'}. Best is trial 1631 with value: 0.32128932742921457.
[I 2024-12-04 20:22:59,513] Trial 1755 finished with value: 0.3570929648323684 and parameters: {'n_estimators': 441, 'max_depth': 42, 'min_samples_split': 2, 'min_samples_leaf': 1, 'max_features': 'sqrt', 'bootstrap': False, 'criterion': 'squared_error'}. Best is trial 1631 with value: 0.32128932742921457.
[I 2024-12-04 20:23:01,133] Trial 1756 finished with value: 0.3886926527891234 and parameters: {'n_estimators': 345, 'max_depth': 42, 'min_samples_split': 3, 'min_samples_leaf': 1, 'max_features': 'sqrt', 'bootstrap': False, 'criterion': 'squared_error'}. Best is trial 1631 with value: 0.32128932742921457.
[I 2024-12-04 20:23:08,211] Trial 1753 finished with value: 0.837729872813034 and parameters: {'n_estimators': 904, 'max_depth': 22, 'min_samples_split': 13, 'min_samples_leaf': 1, 'max_features': 'sqrt', 'bootstrap': True, 'criterion': 'absolute_error'}. Best is trial 1631 with value: 0.32128932742921457.
[I 2024-12-04 20:23:09,107] Trial 1751 finished with value: 0.6728589785308379 and parameters: {'n_estimators': 997, 'max_depth': 16, 'min_samples_split': 27, 'min_samples_leaf': 7, 'max_features': None, 'bootstrap': True, 'criterion': 'absolute_error'}. Best is trial 1631 with value: 0.32128932742921457.
[I 2024-12-04 20:23:10,305] Trial 1757 finished with value: 0.40601717437954715 and parameters: {'n_estimators': 304, 'max_depth': 42, 'min_samples_split': 3, 'min_samples_leaf': 1, 'max_features': 'sqrt', 'bootstrap': False, 'criterion': 'absolute_error'}. Best is trial 1631 with value: 0.32128932742921457.
[I 2024-12-04 20:23:10,653] Trial 1759 finished with value: 0.6904777508982128 and parameters: {'n_estimators': 514, 'max_depth': 43, 'min_samples_split': 2, 'min_samples_leaf': 2, 'max_features': 'sqrt', 'bootstrap': False, 'criterion': 'squared_error'}. Best is trial 1631 with value: 0.32128932742921457.
[I 2024-12-04 20:23:11,443] Trial 1758 finished with value: 0.5320342809175475 and parameters: {'n_estimators': 384, 'max_depth': 34, 'min_samples_split': 12, 'min_samples_leaf': 1, 'max_features': None, 'bootstrap': False, 'criterion': 'squared_error'}. Best is trial 1631 with value: 0.32128932742921457.
[I 2024-12-04 20:23:12,017] Trial 1761 finished with value: 0.46526488761765383 and parameters: {'n_estimators': 161, 'max_depth': 50, 'min_samples_split': 4, 'min_samples_leaf': 1, 'max_features': 'sqrt', 'bootstrap': True, 'criterion': 'squared_error'}. Best is trial 1631 with value: 0.32128932742921457.
[I 2024-12-04 20:23:12,463] Trial 1760 finished with value: 1.2061605612635644 and parameters: {'n_estimators': 211, 'max_depth': 7, 'min_samples_split': 2, 'min_samples_leaf': 5, 'max_features': 'sqrt', 'bootstrap': False, 'criterion': 'absolute_error'}. Best is trial 1631 with value: 0.32128932742921457.
[I 2024-12-04 20:23:13,916] Trial 1762 finished with value: 0.3493861170970311 and parameters: {'n_estimators': 388, 'max_depth': 43, 'min_samples_split': 2, 'min_samples_leaf': 1, 'max_features': 'sqrt', 'bootstrap': False, 'criterion': 'squared_error'}. Best is trial 1631 with value: 0.32128932742921457.
[I 2024-12-04 20:23:14,092] Trial 1764 finished with value: 0.32454447609322695 and parameters: {'n_estimators': 206, 'max_depth': 50, 'min_samples_split': 2, 'min_samples_leaf': 1, 'max_features': 'sqrt', 'bootstrap': False, 'criterion': 'squared_error'}. Best is trial 1631 with value: 0.32128932742921457.
[I 2024-12-04 20:23:14,382] Trial 1763 finished with value: 0.34754465929337 and parameters: {'n_estimators': 377, 'max_depth': 44, 'min_samples_split': 2, 'min_samples_leaf': 1, 'max_features': 'sqrt', 'bootstrap': False, 'criterion': 'squared_error'}. Best is trial 1631 with value: 0.32128932742921457.
[I 2024-12-04 20:23:16,406] Trial 1766 finished with value: 0.6864657770048692 and parameters: {'n_estimators': 418, 'max_depth': 50, 'min_samples_split': 2, 'min_samples_leaf': 2, 'max_features': 'sqrt', 'bootstrap': False, 'criterion': 'squared_error'}. Best is trial 1631 with value: 0.32128932742921457.
[I 2024-12-04 20:23:16,758] Trial 1767 finished with value: 1.278777066560377 and parameters: {'n_estimators': 692, 'max_depth': 19, 'min_samples_split': 2, 'min_samples_leaf': 10, 'max_features': 'log2', 'bootstrap': True, 'criterion': 'squared_error'}. Best is trial 1631 with value: 0.32128932742921457.
[I 2024-12-04 20:23:17,494] Trial 1765 finished with value: 1.2493966993864662 and parameters: {'n_estimators': 710, 'max_depth': 35, 'min_samples_split': 8, 'min_samples_leaf': 9, 'max_features': 'sqrt', 'bootstrap': False, 'criterion': 'absolute_error'}. Best is trial 1631 with value: 0.32128932742921457.
[I 2024-12-04 20:23:18,653] Trial 1768 finished with value: 0.3688530802818901 and parameters: {'n_estimators': 332, 'max_depth': 50, 'min_samples_split': 2, 'min_samples_leaf': 1, 'max_features': 'sqrt', 'bootstrap': True, 'criterion': 'squared_error'}. Best is trial 1631 with value: 0.32128932742921457.
[I 2024-12-04 20:23:19,264] Trial 1770 finished with value: 1.3162778268866924 and parameters: {'n_estimators': 494, 'max_depth': 43, 'min_samples_split': 9, 'min_samples_leaf': 15, 'max_features': 'sqrt', 'bootstrap': True, 'criterion': 'absolute_error'}. Best is trial 1631 with value: 0.32128932742921457.
[I 2024-12-04 20:23:20,767] Trial 1771 finished with value: 0.4185498467233394 and parameters: {'n_estimators': 466, 'max_depth': 42, 'min_samples_split': 4, 'min_samples_leaf': 1, 'max_features': 'sqrt', 'bootstrap': False, 'criterion': 'squared_error'}. Best is trial 1631 with value: 0.32128932742921457.
[I 2024-12-04 20:23:21,314] Trial 1772 finished with value: 0.3912421049706986 and parameters: {'n_estimators': 452, 'max_depth': 50, 'min_samples_split': 4, 'min_samples_leaf': 1, 'max_features': 'sqrt', 'bootstrap': False, 'criterion': 'squared_error'}. Best is trial 1631 with value: 0.32128932742921457.
[I 2024-12-04 20:23:23,019] Trial 1773 finished with value: 1.220652781554628 and parameters: {'n_estimators': 990, 'max_depth': 15, 'min_samples_split': 2, 'min_samples_leaf': 3, 'max_features': 'log2', 'bootstrap': True, 'criterion': 'squared_error'}. Best is trial 1631 with value: 0.32128932742921457.
[I 2024-12-04 20:23:23,433] Trial 1774 finished with value: 0.38728793079961127 and parameters: {'n_estimators': 387, 'max_depth': 50, 'min_samples_split': 4, 'min_samples_leaf': 1, 'max_features': 'sqrt', 'bootstrap': False, 'criterion': 'squared_error'}. Best is trial 1631 with value: 0.32128932742921457.
[I 2024-12-04 20:23:24,409] Trial 1775 finished with value: 0.6712877038329454 and parameters: {'n_estimators': 304, 'max_depth': 43, 'min_samples_split': 2, 'min_samples_leaf': 2, 'max_features': 'sqrt', 'bootstrap': False, 'criterion': 'squared_error'}. Best is trial 1631 with value: 0.32128932742921457.
[I 2024-12-04 20:23:25,337] Trial 1776 finished with value: 0.3232127850270016 and parameters: {'n_estimators': 254, 'max_depth': 50, 'min_samples_split': 2, 'min_samples_leaf': 1, 'max_features': 'sqrt', 'bootstrap': False, 'criterion': 'squared_error'}. Best is trial 1631 with value: 0.32128932742921457.
[I 2024-12-04 20:23:25,398] Trial 1769 finished with value: 0.3402684204536651 and parameters: {'n_estimators': 307, 'max_depth': 50, 'min_samples_split': 2, 'min_samples_leaf': 1, 'max_features': 'sqrt', 'bootstrap': False, 'criterion': 'absolute_error'}. Best is trial 1631 with value: 0.32128932742921457.
[I 2024-12-04 20:23:26,672] Trial 1777 finished with value: 0.32379502267017785 and parameters: {'n_estimators': 311, 'max_depth': 50, 'min_samples_split': 2, 'min_samples_leaf': 1, 'max_features': 'sqrt', 'bootstrap': False, 'criterion': 'squared_error'}. Best is trial 1631 with value: 0.32128932742921457.
[I 2024-12-04 20:23:26,989] Trial 1778 finished with value: 0.6671706341783521 and parameters: {'n_estimators': 338, 'max_depth': 50, 'min_samples_split': 2, 'min_samples_leaf': 2, 'max_features': 'sqrt', 'bootstrap': False, 'criterion': 'squared_error'}. Best is trial 1631 with value: 0.32128932742921457.
[I 2024-12-04 20:23:27,191] Trial 1779 finished with value: 0.6667303778270132 and parameters: {'n_estimators': 292, 'max_depth': 42, 'min_samples_split': 3, 'min_samples_leaf': 2, 'max_features': 'sqrt', 'bootstrap': False, 'criterion': 'squared_error'}. Best is trial 1631 with value: 0.32128932742921457.
[I 2024-12-04 20:23:28,761] Trial 1780 finished with value: 0.3479289643405619 and parameters: {'n_estimators': 269, 'max_depth': 42, 'min_samples_split': 2, 'min_samples_leaf': 1, 'max_features': 'sqrt', 'bootstrap': False, 'criterion': 'squared_error'}. Best is trial 1631 with value: 0.32128932742921457.
[I 2024-12-04 20:23:29,265] Trial 1781 finished with value: 0.3233579316635364 and parameters: {'n_estimators': 253, 'max_depth': 50, 'min_samples_split': 2, 'min_samples_leaf': 1, 'max_features': 'sqrt', 'bootstrap': False, 'criterion': 'squared_error'}. Best is trial 1631 with value: 0.32128932742921457.
[I 2024-12-04 20:23:30,267] Trial 1782 finished with value: 0.3244058611896864 and parameters: {'n_estimators': 424, 'max_depth': 50, 'min_samples_split': 2, 'min_samples_leaf': 1, 'max_features': 'sqrt', 'bootstrap': False, 'criterion': 'squared_error'}. Best is trial 1631 with value: 0.32128932742921457.
[I 2024-12-04 20:23:31,596] Trial 1784 finished with value: 0.3235529079870083 and parameters: {'n_estimators': 337, 'max_depth': 50, 'min_samples_split': 2, 'min_samples_leaf': 1, 'max_features': 'sqrt', 'bootstrap': False, 'criterion': 'squared_error'}. Best is trial 1631 with value: 0.32128932742921457.
[I 2024-12-04 20:23:31,675] Trial 1783 finished with value: 0.32885328744861403 and parameters: {'n_estimators': 484, 'max_depth': 50, 'min_samples_split': 2, 'min_samples_leaf': 1, 'max_features': 'sqrt', 'bootstrap': False, 'criterion': 'squared_error'}. Best is trial 1631 with value: 0.32128932742921457.
[I 2024-12-04 20:23:33,376] Trial 1785 finished with value: 0.3543118603859618 and parameters: {'n_estimators': 574, 'max_depth': 42, 'min_samples_split': 2, 'min_samples_leaf': 1, 'max_features': 'sqrt', 'bootstrap': False, 'criterion': 'squared_error'}. Best is trial 1631 with value: 0.32128932742921457.
[I 2024-12-04 20:23:33,376] Trial 1787 finished with value: 0.6621787926304485 and parameters: {'n_estimators': 336, 'max_depth': 21, 'min_samples_split': 4, 'min_samples_leaf': 1, 'max_features': 'sqrt', 'bootstrap': True, 'criterion': 'squared_error'}. Best is trial 1631 with value: 0.32128932742921457.
[I 2024-12-04 20:23:33,392] Trial 1786 finished with value: 0.6914186741956331 and parameters: {'n_estimators': 444, 'max_depth': 50, 'min_samples_split': 4, 'min_samples_leaf': 2, 'max_features': 'sqrt', 'bootstrap': False, 'criterion': 'squared_error'}. Best is trial 1631 with value: 0.32128932742921457.
[I 2024-12-04 20:23:35,794] Trial 1788 finished with value: 0.3461793930939451 and parameters: {'n_estimators': 311, 'max_depth': 43, 'min_samples_split': 2, 'min_samples_leaf': 1, 'max_features': 'sqrt', 'bootstrap': False, 'criterion': 'squared_error'}. Best is trial 1631 with value: 0.32128932742921457.
[I 2024-12-04 20:23:36,148] Trial 1789 finished with value: 0.3618030375949687 and parameters: {'n_estimators': 418, 'max_depth': 50, 'min_samples_split': 3, 'min_samples_leaf': 1, 'max_features': 'sqrt', 'bootstrap': False, 'criterion': 'squared_error'}. Best is trial 1631 with value: 0.32128932742921457.
[I 2024-12-04 20:23:36,939] Trial 1790 finished with value: 1.1682302787405232 and parameters: {'n_estimators': 524, 'max_depth': 39, 'min_samples_split': 33, 'min_samples_leaf': 4, 'max_features': 'sqrt', 'bootstrap': True, 'criterion': 'absolute_error'}. Best is trial 1631 with value: 0.32128932742921457.
[I 2024-12-04 20:23:37,184] Trial 1792 finished with value: 0.6176942956792074 and parameters: {'n_estimators': 104, 'max_depth': 43, 'min_samples_split': 2, 'min_samples_leaf': 2, 'max_features': 'sqrt', 'bootstrap': False, 'criterion': 'squared_error'}. Best is trial 1631 with value: 0.32128932742921457.
[I 2024-12-04 20:23:39,043] Trial 1793 finished with value: 0.34586861780302464 and parameters: {'n_estimators': 376, 'max_depth': 43, 'min_samples_split': 2, 'min_samples_leaf': 1, 'max_features': 'sqrt', 'bootstrap': False, 'criterion': 'squared_error'}. Best is trial 1631 with value: 0.32128932742921457.
[I 2024-12-04 20:23:39,044] Trial 1794 finished with value: 0.3594301642287163 and parameters: {'n_estimators': 382, 'max_depth': 50, 'min_samples_split': 3, 'min_samples_leaf': 1, 'max_features': 'sqrt', 'bootstrap': False, 'criterion': 'squared_error'}. Best is trial 1631 with value: 0.32128932742921457.
[I 2024-12-04 20:23:39,928] Trial 1791 finished with value: 0.8848954015542931 and parameters: {'n_estimators': 213, 'max_depth': 41, 'min_samples_split': 2, 'min_samples_leaf': 2, 'max_features': 'sqrt', 'bootstrap': False, 'criterion': 'absolute_error'}. Best is trial 1631 with value: 0.32128932742921457.
[I 2024-12-04 20:23:40,646] Trial 1795 finished with value: 0.3703325790522122 and parameters: {'n_estimators': 111, 'max_depth': 41, 'min_samples_split': 2, 'min_samples_leaf': 1, 'max_features': 'sqrt', 'bootstrap': False, 'criterion': 'squared_error'}. Best is trial 1631 with value: 0.32128932742921457.
[I 2024-12-04 20:23:40,988] Trial 1796 finished with value: 1.0886755174505514 and parameters: {'n_estimators': 441, 'max_depth': 48, 'min_samples_split': 3, 'min_samples_leaf': 7, 'max_features': 'sqrt', 'bootstrap': False, 'criterion': 'squared_error'}. Best is trial 1631 with value: 0.32128932742921457.
[I 2024-12-04 20:23:42,265] Trial 1798 finished with value: 0.6598203765006276 and parameters: {'n_estimators': 278, 'max_depth': 50, 'min_samples_split': 3, 'min_samples_leaf': 2, 'max_features': 'sqrt', 'bootstrap': False, 'criterion': 'squared_error'}. Best is trial 1631 with value: 0.32128932742921457.
[I 2024-12-04 20:23:44,110] Trial 1799 finished with value: 0.5562300115586911 and parameters: {'n_estimators': 656, 'max_depth': 47, 'min_samples_split': 2, 'min_samples_leaf': 1, 'max_features': 'log2', 'bootstrap': False, 'criterion': 'squared_error'}. Best is trial 1631 with value: 0.32128932742921457.
[I 2024-12-04 20:23:46,641] Trial 1797 finished with value: 0.8758736079602236 and parameters: {'n_estimators': 367, 'max_depth': 50, 'min_samples_split': 2, 'min_samples_leaf': 2, 'max_features': 'sqrt', 'bootstrap': False, 'criterion': 'absolute_error'}. Best is trial 1631 with value: 0.32128932742921457.
[I 2024-12-04 20:23:47,290] Trial 1801 finished with value: 0.5198526340075549 and parameters: {'n_estimators': 721, 'max_depth': 41, 'min_samples_split': 3, 'min_samples_leaf': 5, 'max_features': None, 'bootstrap': True, 'criterion': 'squared_error'}. Best is trial 1631 with value: 0.32128932742921457.
[I 2024-12-04 20:23:48,296] Trial 1802 finished with value: 0.38475682583194415 and parameters: {'n_estimators': 259, 'max_depth': 50, 'min_samples_split': 4, 'min_samples_leaf': 1, 'max_features': 'sqrt', 'bootstrap': False, 'criterion': 'squared_error'}. Best is trial 1631 with value: 0.32128932742921457.
[I 2024-12-04 20:23:48,365] Trial 1803 finished with value: 0.6492388105534139 and parameters: {'n_estimators': 166, 'max_depth': 50, 'min_samples_split': 3, 'min_samples_leaf': 2, 'max_features': 'sqrt', 'bootstrap': False, 'criterion': 'squared_error'}. Best is trial 1631 with value: 0.32128932742921457.
[I 2024-12-04 20:23:50,214] Trial 1800 finished with value: 0.8929922911269697 and parameters: {'n_estimators': 638, 'max_depth': 17, 'min_samples_split': 5, 'min_samples_leaf': 1, 'max_features': 'sqrt', 'bootstrap': True, 'criterion': 'absolute_error'}. Best is trial 1631 with value: 0.32128932742921457.
[I 2024-12-04 20:23:50,539] Trial 1804 finished with value: 0.39606461573610013 and parameters: {'n_estimators': 428, 'max_depth': 42, 'min_samples_split': 3, 'min_samples_leaf': 1, 'max_features': 'sqrt', 'bootstrap': False, 'criterion': 'squared_error'}. Best is trial 1631 with value: 0.32128932742921457.
[I 2024-12-04 20:23:51,236] Trial 1805 finished with value: 0.3233522130985557 and parameters: {'n_estimators': 410, 'max_depth': 50, 'min_samples_split': 2, 'min_samples_leaf': 1, 'max_features': 'sqrt', 'bootstrap': False, 'criterion': 'squared_error'}. Best is trial 1631 with value: 0.32128932742921457.
[I 2024-12-04 20:23:52,287] Trial 1806 finished with value: 0.3561961588115437 and parameters: {'n_estimators': 325, 'max_depth': 50, 'min_samples_split': 3, 'min_samples_leaf': 1, 'max_features': 'sqrt', 'bootstrap': False, 'criterion': 'squared_error'}. Best is trial 1631 with value: 0.32128932742921457.
[I 2024-12-04 20:23:52,749] Trial 1808 finished with value: 0.6672095238351607 and parameters: {'n_estimators': 316, 'max_depth': 50, 'min_samples_split': 2, 'min_samples_leaf': 2, 'max_features': 'sqrt', 'bootstrap': False, 'criterion': 'squared_error'}. Best is trial 1631 with value: 0.32128932742921457.
[I 2024-12-04 20:23:53,378] Trial 1807 finished with value: 0.34845586797283434 and parameters: {'n_estimators': 391, 'max_depth': 42, 'min_samples_split': 2, 'min_samples_leaf': 1, 'max_features': 'sqrt', 'bootstrap': False, 'criterion': 'squared_error'}. Best is trial 1631 with value: 0.32128932742921457.
[I 2024-12-04 20:23:54,695] Trial 1809 finished with value: 0.3255720375131862 and parameters: {'n_estimators': 279, 'max_depth': 50, 'min_samples_split': 2, 'min_samples_leaf': 1, 'max_features': 'sqrt', 'bootstrap': False, 'criterion': 'squared_error'}. Best is trial 1631 with value: 0.32128932742921457.
[I 2024-12-04 20:23:55,634] Trial 1810 finished with value: 0.32346326946587967 and parameters: {'n_estimators': 397, 'max_depth': 50, 'min_samples_split': 2, 'min_samples_leaf': 1, 'max_features': 'sqrt', 'bootstrap': False, 'criterion': 'squared_error'}. Best is trial 1631 with value: 0.32128932742921457.
[I 2024-12-04 20:23:56,511] Trial 1811 finished with value: 0.3287109662804592 and parameters: {'n_estimators': 470, 'max_depth': 50, 'min_samples_split': 2, 'min_samples_leaf': 1, 'max_features': 'sqrt', 'bootstrap': False, 'criterion': 'squared_error'}. Best is trial 1631 with value: 0.32128932742921457.
[I 2024-12-04 20:23:56,603] Trial 1812 finished with value: 0.3249743659709739 and parameters: {'n_estimators': 263, 'max_depth': 50, 'min_samples_split': 2, 'min_samples_leaf': 1, 'max_features': 'sqrt', 'bootstrap': False, 'criterion': 'squared_error'}. Best is trial 1631 with value: 0.32128932742921457.
[I 2024-12-04 20:23:57,431] Trial 1813 finished with value: 0.6921983755003747 and parameters: {'n_estimators': 420, 'max_depth': 42, 'min_samples_split': 2, 'min_samples_leaf': 2, 'max_features': 'sqrt', 'bootstrap': False, 'criterion': 'squared_error'}. Best is trial 1631 with value: 0.32128932742921457.
[I 2024-12-04 20:23:58,471] Trial 1814 finished with value: 0.39588544528807906 and parameters: {'n_estimators': 282, 'max_depth': 44, 'min_samples_split': 4, 'min_samples_leaf': 1, 'max_features': 'sqrt', 'bootstrap': False, 'criterion': 'squared_error'}. Best is trial 1631 with value: 0.32128932742921457.
[I 2024-12-04 20:23:58,841] Trial 1815 finished with value: 0.35532028253079784 and parameters: {'n_estimators': 314, 'max_depth': 50, 'min_samples_split': 3, 'min_samples_leaf': 1, 'max_features': 'sqrt', 'bootstrap': False, 'criterion': 'squared_error'}. Best is trial 1631 with value: 0.32128932742921457.
[I 2024-12-04 20:23:59,977] Trial 1817 finished with value: 1.108032364538249 and parameters: {'n_estimators': 127, 'max_depth': 29, 'min_samples_split': 3, 'min_samples_leaf': 3, 'max_features': 'sqrt', 'bootstrap': True, 'criterion': 'absolute_error'}. Best is trial 1631 with value: 0.32128932742921457.
[I 2024-12-04 20:24:00,823] Trial 1818 finished with value: 0.34370306092950986 and parameters: {'n_estimators': 280, 'max_depth': 43, 'min_samples_split': 2, 'min_samples_leaf': 1, 'max_features': 'sqrt', 'bootstrap': False, 'criterion': 'squared_error'}. Best is trial 1631 with value: 0.32128932742921457.
[I 2024-12-04 20:24:01,440] Trial 1816 finished with value: 0.43363614966010006 and parameters: {'n_estimators': 325, 'max_depth': 49, 'min_samples_split': 2, 'min_samples_leaf': 1, 'max_features': None, 'bootstrap': False, 'criterion': 'squared_error'}. Best is trial 1631 with value: 0.32128932742921457.
[I 2024-12-04 20:24:02,652] Trial 1820 finished with value: 0.34580725748515556 and parameters: {'n_estimators': 263, 'max_depth': 44, 'min_samples_split': 2, 'min_samples_leaf': 1, 'max_features': 'sqrt', 'bootstrap': False, 'criterion': 'squared_error'}. Best is trial 1631 with value: 0.32128932742921457.
[I 2024-12-04 20:24:02,723] Trial 1819 finished with value: 0.3545720532080552 and parameters: {'n_estimators': 506, 'max_depth': 43, 'min_samples_split': 2, 'min_samples_leaf': 1, 'max_features': 'sqrt', 'bootstrap': False, 'criterion': 'squared_error'}. Best is trial 1631 with value: 0.32128932742921457.
[I 2024-12-04 20:24:04,406] Trial 1821 finished with value: 0.5692039367171035 and parameters: {'n_estimators': 112, 'max_depth': 26, 'min_samples_split': 2, 'min_samples_leaf': 6, 'max_features': None, 'bootstrap': True, 'criterion': 'absolute_error'}. Best is trial 1631 with value: 0.32128932742921457.
