[I 2024-12-04 14:45:25,374] A new study created in RDB with name: Pc_rf
[I 2024-12-04 14:45:31,978] Trial 3 finished with value: 1.0660156237670653 and parameters: {'n_estimators': 247, 'max_depth': 38, 'min_samples_split': 16, 'min_samples_leaf': 10, 'max_features': 'log2', 'bootstrap': False, 'criterion': 'squared_error'}. Best is trial 2 with value: 0.6500194164687474.
[I 2024-12-04 14:45:32,012] Trial 2 finished with value: 0.6500194164687474 and parameters: {'n_estimators': 189, 'max_depth': 12, 'min_samples_split': 3, 'min_samples_leaf': 1, 'max_features': None, 'bootstrap': False, 'criterion': 'squared_error'}. Best is trial 2 with value: 0.6500194164687474.
[I 2024-12-04 14:45:33,321] Trial 9 finished with value: 1.0659309293551753 and parameters: {'n_estimators': 369, 'max_depth': 9, 'min_samples_split': 4, 'min_samples_leaf': 11, 'max_features': 'log2', 'bootstrap': False, 'criterion': 'squared_error'}. Best is trial 2 with value: 0.6500194164687474.
[I 2024-12-04 14:45:35,488] Trial 13 finished with value: 1.0544974340900743 and parameters: {'n_estimators': 789, 'max_depth': 26, 'min_samples_split': 2, 'min_samples_leaf': 7, 'max_features': 'log2', 'bootstrap': False, 'criterion': 'squared_error'}. Best is trial 2 with value: 0.6500194164687474.
[I 2024-12-04 14:45:37,546] Trial 8 finished with value: 1.0615594804827588 and parameters: {'n_estimators': 410, 'max_depth': 12, 'min_samples_split': 2, 'min_samples_leaf': 6, 'max_features': 'log2', 'bootstrap': True, 'criterion': 'squared_error'}. Best is trial 2 with value: 0.6500194164687474.
[I 2024-12-04 14:45:37,893] Trial 6 finished with value: 0.7232218852705989 and parameters: {'n_estimators': 626, 'max_depth': 35, 'min_samples_split': 14, 'min_samples_leaf': 3, 'max_features': 'sqrt', 'bootstrap': False, 'criterion': 'squared_error'}. Best is trial 2 with value: 0.6500194164687474.
[I 2024-12-04 14:45:39,018] Trial 11 finished with value: 0.9907385514482859 and parameters: {'n_estimators': 420, 'max_depth': 7, 'min_samples_split': 24, 'min_samples_leaf': 10, 'max_features': 'sqrt', 'bootstrap': False, 'criterion': 'absolute_error'}. Best is trial 18 with value: 0.583826014441999.
[I 2024-12-04 14:45:41,603] Trial 29 finished with value: 1.072036053937082 and parameters: {'n_estimators': 538, 'max_depth': 22, 'min_samples_split': 23, 'min_samples_leaf': 15, 'max_features': 'log2', 'bootstrap': False, 'criterion': 'squared_error'}. Best is trial 18 with value: 0.583826014441999.
[I 2024-12-04 14:45:42,682] Trial 18 finished with value: 0.583826014441999 and parameters: {'n_estimators': 132, 'max_depth': 30, 'min_samples_split': 19, 'min_samples_leaf': 4, 'max_features': None, 'bootstrap': True, 'criterion': 'absolute_error'}. Best is trial 18 with value: 0.583826014441999.
[I 2024-12-04 14:45:45,213] Trial 16 finished with value: 0.6555077004428607 and parameters: {'n_estimators': 124, 'max_depth': 19, 'min_samples_split': 9, 'min_samples_leaf': 1, 'max_features': 'sqrt', 'bootstrap': False, 'criterion': 'squared_error'}. Best is trial 18 with value: 0.583826014441999.
[I 2024-12-04 14:45:48,838] Trial 24 finished with value: 0.7928883052972473 and parameters: {'n_estimators': 168, 'max_depth': 39, 'min_samples_split': 7, 'min_samples_leaf': 3, 'max_features': 'sqrt', 'bootstrap': True, 'criterion': 'squared_error'}. Best is trial 18 with value: 0.583826014441999.
[I 2024-12-04 14:45:49,581] Trial 7 finished with value: 0.6840979570174168 and parameters: {'n_estimators': 326, 'max_depth': 34, 'min_samples_split': 3, 'min_samples_leaf': 1, 'max_features': 'log2', 'bootstrap': False, 'criterion': 'absolute_error'}. Best is trial 18 with value: 0.583826014441999.
[I 2024-12-04 14:45:51,851] Trial 19 finished with value: 1.0713646847028493 and parameters: {'n_estimators': 461, 'max_depth': 44, 'min_samples_split': 3, 'min_samples_leaf': 12, 'max_features': 'log2', 'bootstrap': True, 'criterion': 'squared_error'}. Best is trial 18 with value: 0.583826014441999.
[I 2024-12-04 14:45:51,932] Trial 21 finished with value: 0.9288342025505301 and parameters: {'n_estimators': 385, 'max_depth': 42, 'min_samples_split': 5, 'min_samples_leaf': 5, 'max_features': 'sqrt', 'bootstrap': True, 'criterion': 'absolute_error'}. Best is trial 18 with value: 0.583826014441999.
[I 2024-12-04 14:45:53,849] Trial 1 finished with value: 0.8212408448848214 and parameters: {'n_estimators': 218, 'max_depth': 20, 'min_samples_split': 2, 'min_samples_leaf': 1, 'max_features': 'log2', 'bootstrap': False, 'criterion': 'absolute_error'}. Best is trial 18 with value: 0.583826014441999.
[I 2024-12-04 14:45:55,276] Trial 30 finished with value: 0.6873809635725462 and parameters: {'n_estimators': 518, 'max_depth': 21, 'min_samples_split': 3, 'min_samples_leaf': 6, 'max_features': None, 'bootstrap': False, 'criterion': 'squared_error'}. Best is trial 34 with value: 0.5485865314212841.
[I 2024-12-04 14:45:56,798] Trial 33 finished with value: 1.042244349650309 and parameters: {'n_estimators': 419, 'max_depth': 28, 'min_samples_split': 13, 'min_samples_leaf': 14, 'max_features': 'sqrt', 'bootstrap': True, 'criterion': 'squared_error'}. Best is trial 34 with value: 0.5485865314212841.
[I 2024-12-04 14:45:57,542] Trial 34 finished with value: 0.5485865314212841 and parameters: {'n_estimators': 277, 'max_depth': 40, 'min_samples_split': 15, 'min_samples_leaf': 1, 'max_features': 'sqrt', 'bootstrap': False, 'criterion': 'squared_error'}. Best is trial 34 with value: 0.5485865314212841.
[I 2024-12-04 14:45:58,065] Trial 28 finished with value: 0.8105400561957118 and parameters: {'n_estimators': 250, 'max_depth': 23, 'min_samples_split': 13, 'min_samples_leaf': 1, 'max_features': 'log2', 'bootstrap': False, 'criterion': 'absolute_error'}. Best is trial 34 with value: 0.5485865314212841.
[I 2024-12-04 14:46:00,654] Trial 27 finished with value: 0.5549753204205806 and parameters: {'n_estimators': 506, 'max_depth': 40, 'min_samples_split': 16, 'min_samples_leaf': 1, 'max_features': None, 'bootstrap': False, 'criterion': 'squared_error'}. Best is trial 34 with value: 0.5485865314212841.
[I 2024-12-04 14:46:01,611] Trial 4 finished with value: 0.707940658338306 and parameters: {'n_estimators': 521, 'max_depth': 39, 'min_samples_split': 43, 'min_samples_leaf': 2, 'max_features': 'sqrt', 'bootstrap': False, 'criterion': 'absolute_error'}. Best is trial 34 with value: 0.5485865314212841.
[I 2024-12-04 14:46:03,668] Trial 32 finished with value: 0.5631579119286902 and parameters: {'n_estimators': 195, 'max_depth': 20, 'min_samples_split': 2, 'min_samples_leaf': 1, 'max_features': None, 'bootstrap': False, 'criterion': 'squared_error'}. Best is trial 34 with value: 0.5485865314212841.
[I 2024-12-04 14:46:04,460] Trial 10 finished with value: 0.7147904093241432 and parameters: {'n_estimators': 670, 'max_depth': 32, 'min_samples_split': 5, 'min_samples_leaf': 1, 'max_features': 'log2', 'bootstrap': False, 'criterion': 'absolute_error'}. Best is trial 38 with value: 0.5216799507243718.
[I 2024-12-04 14:46:06,163] Trial 36 finished with value: 0.8493892594844258 and parameters: {'n_estimators': 140, 'max_depth': 18, 'min_samples_split': 36, 'min_samples_leaf': 3, 'max_features': 'sqrt', 'bootstrap': True, 'criterion': 'absolute_error'}. Best is trial 38 with value: 0.5216799507243718.
[I 2024-12-04 14:46:06,207] Trial 31 finished with value: 0.6761922584395441 and parameters: {'n_estimators': 884, 'max_depth': 50, 'min_samples_split': 47, 'min_samples_leaf': 1, 'max_features': 'log2', 'bootstrap': False, 'criterion': 'squared_error'}. Best is trial 38 with value: 0.5216799507243718.
[I 2024-12-04 14:46:07,857] Trial 38 finished with value: 0.5216799507243718 and parameters: {'n_estimators': 217, 'max_depth': 49, 'min_samples_split': 13, 'min_samples_leaf': 1, 'max_features': 'sqrt', 'bootstrap': False, 'criterion': 'squared_error'}. Best is trial 38 with value: 0.5216799507243718.
[I 2024-12-04 14:46:10,333] Trial 40 finished with value: 0.5302646316205878 and parameters: {'n_estimators': 416, 'max_depth': 35, 'min_samples_split': 6, 'min_samples_leaf': 1, 'max_features': 'sqrt', 'bootstrap': False, 'criterion': 'squared_error'}. Best is trial 38 with value: 0.5216799507243718.
[I 2024-12-04 14:46:11,150] Trial 42 finished with value: 0.7290832211613608 and parameters: {'n_estimators': 240, 'max_depth': 49, 'min_samples_split': 32, 'min_samples_leaf': 3, 'max_features': 'sqrt', 'bootstrap': False, 'criterion': 'squared_error'}. Best is trial 38 with value: 0.5216799507243718.
[I 2024-12-04 14:46:11,961] Trial 22 finished with value: 0.8658853583785083 and parameters: {'n_estimators': 485, 'max_depth': 17, 'min_samples_split': 5, 'min_samples_leaf': 1, 'max_features': 'log2', 'bootstrap': True, 'criterion': 'absolute_error'}. Best is trial 45 with value: 0.5194248824727499.
[I 2024-12-04 14:46:12,220] Trial 45 finished with value: 0.5194248824727499 and parameters: {'n_estimators': 191, 'max_depth': 46, 'min_samples_split': 12, 'min_samples_leaf': 1, 'max_features': 'sqrt', 'bootstrap': False, 'criterion': 'squared_error'}. Best is trial 45 with value: 0.5194248824727499.
[I 2024-12-04 14:46:12,904] Trial 14 finished with value: 0.6171465557493546 and parameters: {'n_estimators': 630, 'max_depth': 43, 'min_samples_split': 28, 'min_samples_leaf': 1, 'max_features': 'sqrt', 'bootstrap': True, 'criterion': 'absolute_error'}. Best is trial 45 with value: 0.5194248824727499.
[I 2024-12-04 14:46:14,309] Trial 0 finished with value: 0.9532887472174578 and parameters: {'n_estimators': 799, 'max_depth': 10, 'min_samples_split': 18, 'min_samples_leaf': 1, 'max_features': 'log2', 'bootstrap': False, 'criterion': 'absolute_error'}. Best is trial 23 with value: 0.47300449942156964.
[I 2024-12-04 14:46:14,486] Trial 23 finished with value: 0.47300449942156964 and parameters: {'n_estimators': 236, 'max_depth': 19, 'min_samples_split': 8, 'min_samples_leaf': 1, 'max_features': None, 'bootstrap': True, 'criterion': 'absolute_error'}. Best is trial 23 with value: 0.47300449942156964.
[I 2024-12-04 14:46:15,684] Trial 44 finished with value: 0.4694361201373317 and parameters: {'n_estimators': 226, 'max_depth': 21, 'min_samples_split': 2, 'min_samples_leaf': 2, 'max_features': None, 'bootstrap': True, 'criterion': 'squared_error'}. Best is trial 44 with value: 0.4694361201373317.
[I 2024-12-04 14:46:16,417] Trial 35 finished with value: 0.6856570729555936 and parameters: {'n_estimators': 833, 'max_depth': 18, 'min_samples_split': 5, 'min_samples_leaf': 6, 'max_features': None, 'bootstrap': False, 'criterion': 'squared_error'}. Best is trial 44 with value: 0.4694361201373317.
[I 2024-12-04 14:46:16,541] Trial 39 finished with value: 0.670114411573471 and parameters: {'n_estimators': 209, 'max_depth': 23, 'min_samples_split': 9, 'min_samples_leaf': 9, 'max_features': None, 'bootstrap': True, 'criterion': 'absolute_error'}. Best is trial 44 with value: 0.4694361201373317.
[I 2024-12-04 14:46:17,564] Trial 46 finished with value: 0.6539885208645926 and parameters: {'n_estimators': 330, 'max_depth': 30, 'min_samples_split': 2, 'min_samples_leaf': 2, 'max_features': 'sqrt', 'bootstrap': False, 'criterion': 'squared_error'}. Best is trial 44 with value: 0.4694361201373317.
[I 2024-12-04 14:46:17,893] Trial 49 finished with value: 0.8897758483674892 and parameters: {'n_estimators': 421, 'max_depth': 39, 'min_samples_split': 5, 'min_samples_leaf': 2, 'max_features': 'log2', 'bootstrap': False, 'criterion': 'squared_error'}. Best is trial 44 with value: 0.4694361201373317.
[I 2024-12-04 14:46:18,048] Trial 17 finished with value: 0.574643779354982 and parameters: {'n_estimators': 198, 'max_depth': 41, 'min_samples_split': 6, 'min_samples_leaf': 1, 'max_features': None, 'bootstrap': False, 'criterion': 'absolute_error'}. Best is trial 44 with value: 0.4694361201373317.
[I 2024-12-04 14:46:18,439] Trial 15 finished with value: 0.6691268470086412 and parameters: {'n_estimators': 724, 'max_depth': 25, 'min_samples_split': 19, 'min_samples_leaf': 1, 'max_features': 'sqrt', 'bootstrap': False, 'criterion': 'absolute_error'}. Best is trial 44 with value: 0.4694361201373317.
[I 2024-12-04 14:46:18,920] Trial 48 finished with value: 0.5378025896829961 and parameters: {'n_estimators': 573, 'max_depth': 32, 'min_samples_split': 5, 'min_samples_leaf': 1, 'max_features': 'sqrt', 'bootstrap': False, 'criterion': 'squared_error'}. Best is trial 44 with value: 0.4694361201373317.
[I 2024-12-04 14:46:19,374] Trial 51 finished with value: 0.6246248018987248 and parameters: {'n_estimators': 334, 'max_depth': 40, 'min_samples_split': 47, 'min_samples_leaf': 1, 'max_features': 'sqrt', 'bootstrap': True, 'criterion': 'squared_error'}. Best is trial 44 with value: 0.4694361201373317.
[I 2024-12-04 14:46:21,572] Trial 43 finished with value: 0.5973436208195557 and parameters: {'n_estimators': 455, 'max_depth': 48, 'min_samples_split': 42, 'min_samples_leaf': 1, 'max_features': None, 'bootstrap': False, 'criterion': 'squared_error'}. Best is trial 44 with value: 0.4694361201373317.
[I 2024-12-04 14:46:24,018] Trial 53 finished with value: 0.6313627141685855 and parameters: {'n_estimators': 132, 'max_depth': 50, 'min_samples_split': 5, 'min_samples_leaf': 2, 'max_features': 'sqrt', 'bootstrap': False, 'criterion': 'squared_error'}. Best is trial 44 with value: 0.4694361201373317.
[I 2024-12-04 14:46:24,019] Trial 47 finished with value: 0.6338921380679544 and parameters: {'n_estimators': 128, 'max_depth': 39, 'min_samples_split': 32, 'min_samples_leaf': 1, 'max_features': 'sqrt', 'bootstrap': False, 'criterion': 'absolute_error'}. Best is trial 44 with value: 0.4694361201373317.
[I 2024-12-04 14:46:26,133] Trial 60 finished with value: 0.7029871388600417 and parameters: {'n_estimators': 108, 'max_depth': 36, 'min_samples_split': 13, 'min_samples_leaf': 1, 'max_features': 'log2', 'bootstrap': False, 'criterion': 'squared_error'}. Best is trial 44 with value: 0.4694361201373317.
[I 2024-12-04 14:46:26,722] Trial 41 finished with value: 0.48724398416327247 and parameters: {'n_estimators': 193, 'max_depth': 39, 'min_samples_split': 17, 'min_samples_leaf': 2, 'max_features': None, 'bootstrap': True, 'criterion': 'absolute_error'}. Best is trial 44 with value: 0.4694361201373317.
[I 2024-12-04 14:46:27,568] Trial 37 finished with value: 0.557199165447813 and parameters: {'n_estimators': 704, 'max_depth': 40, 'min_samples_split': 12, 'min_samples_leaf': 1, 'max_features': None, 'bootstrap': False, 'criterion': 'squared_error'}. Best is trial 44 with value: 0.4694361201373317.
[I 2024-12-04 14:46:33,597] Trial 64 finished with value: 0.6595290590204973 and parameters: {'n_estimators': 373, 'max_depth': 48, 'min_samples_split': 15, 'min_samples_leaf': 1, 'max_features': 'log2', 'bootstrap': True, 'criterion': 'squared_error'}. Best is trial 44 with value: 0.4694361201373317.
[I 2024-12-04 14:46:33,727] Trial 62 finished with value: 0.5123209294224896 and parameters: {'n_estimators': 198, 'max_depth': 21, 'min_samples_split': 2, 'min_samples_leaf': 3, 'max_features': None, 'bootstrap': True, 'criterion': 'squared_error'}. Best is trial 44 with value: 0.4694361201373317.
[I 2024-12-04 14:46:35,088] Trial 58 finished with value: 0.5097870469145898 and parameters: {'n_estimators': 438, 'max_depth': 28, 'min_samples_split': 3, 'min_samples_leaf': 3, 'max_features': None, 'bootstrap': True, 'criterion': 'squared_error'}. Best is trial 55 with value: 0.4376808190504977.
[I 2024-12-04 14:46:35,217] Trial 55 finished with value: 0.4376808190504977 and parameters: {'n_estimators': 310, 'max_depth': 20, 'min_samples_split': 2, 'min_samples_leaf': 1, 'max_features': None, 'bootstrap': True, 'criterion': 'squared_error'}. Best is trial 55 with value: 0.4376808190504977.
[I 2024-12-04 14:46:35,639] Trial 20 finished with value: 0.6617445937637703 and parameters: {'n_estimators': 883, 'max_depth': 17, 'min_samples_split': 3, 'min_samples_leaf': 8, 'max_features': None, 'bootstrap': True, 'criterion': 'absolute_error'}. Best is trial 55 with value: 0.4376808190504977.
[I 2024-12-04 14:46:35,641] Trial 65 finished with value: 0.5182176386697956 and parameters: {'n_estimators': 290, 'max_depth': 49, 'min_samples_split': 10, 'min_samples_leaf': 1, 'max_features': 'sqrt', 'bootstrap': False, 'criterion': 'squared_error'}. Best is trial 55 with value: 0.4376808190504977.
[I 2024-12-04 14:46:35,986] Trial 5 finished with value: 0.5805504568293971 and parameters: {'n_estimators': 337, 'max_depth': 21, 'min_samples_split': 6, 'min_samples_leaf': 1, 'max_features': None, 'bootstrap': False, 'criterion': 'absolute_error'}. Best is trial 55 with value: 0.4376808190504977.
[I 2024-12-04 14:46:35,992] Trial 63 finished with value: 0.5298883987938348 and parameters: {'n_estimators': 564, 'max_depth': 47, 'min_samples_split': 14, 'min_samples_leaf': 1, 'max_features': 'sqrt', 'bootstrap': False, 'criterion': 'squared_error'}. Best is trial 55 with value: 0.4376808190504977.
[I 2024-12-04 14:46:36,013] Trial 61 finished with value: 0.556898143695161 and parameters: {'n_estimators': 472, 'max_depth': 39, 'min_samples_split': 8, 'min_samples_leaf': 1, 'max_features': 'sqrt', 'bootstrap': True, 'criterion': 'squared_error'}. Best is trial 55 with value: 0.4376808190504977.
[I 2024-12-04 14:46:36,381] Trial 59 finished with value: 0.500247294853345 and parameters: {'n_estimators': 530, 'max_depth': 49, 'min_samples_split': 7, 'min_samples_leaf': 1, 'max_features': 'sqrt', 'bootstrap': False, 'criterion': 'squared_error'}. Best is trial 55 with value: 0.4376808190504977.
[I 2024-12-04 14:46:36,627] Trial 52 finished with value: 0.5282609223229009 and parameters: {'n_estimators': 136, 'max_depth': 14, 'min_samples_split': 15, 'min_samples_leaf': 1, 'max_features': None, 'bootstrap': True, 'criterion': 'absolute_error'}. Best is trial 55 with value: 0.4376808190504977.
[I 2024-12-04 14:46:36,849] Trial 12 finished with value: 0.5700658251190179 and parameters: {'n_estimators': 594, 'max_depth': 23, 'min_samples_split': 3, 'min_samples_leaf': 4, 'max_features': None, 'bootstrap': True, 'criterion': 'absolute_error'}. Best is trial 55 with value: 0.4376808190504977.
[I 2024-12-04 14:46:37,201] Trial 69 finished with value: 1.0036958973021506 and parameters: {'n_estimators': 153, 'max_depth': 9, 'min_samples_split': 3, 'min_samples_leaf': 2, 'max_features': 'log2', 'bootstrap': True, 'criterion': 'squared_error'}. Best is trial 55 with value: 0.4376808190504977.
[I 2024-12-04 14:46:38,432] Trial 67 finished with value: 0.9675043540030573 and parameters: {'n_estimators': 246, 'max_depth': 32, 'min_samples_split': 3, 'min_samples_leaf': 2, 'max_features': 'log2', 'bootstrap': True, 'criterion': 'squared_error'}. Best is trial 55 with value: 0.4376808190504977.
[I 2024-12-04 14:46:40,685] Trial 50 finished with value: 0.561370191382508 and parameters: {'n_estimators': 404, 'max_depth': 45, 'min_samples_split': 10, 'min_samples_leaf': 1, 'max_features': 'sqrt', 'bootstrap': False, 'criterion': 'absolute_error'}. Best is trial 55 with value: 0.4376808190504977.
[I 2024-12-04 14:46:42,242] Trial 73 finished with value: 0.9627630582348811 and parameters: {'n_estimators': 298, 'max_depth': 39, 'min_samples_split': 23, 'min_samples_leaf': 2, 'max_features': 'log2', 'bootstrap': True, 'criterion': 'absolute_error'}. Best is trial 55 with value: 0.4376808190504977.
[I 2024-12-04 14:46:43,506] Trial 56 finished with value: 0.6673629403281471 and parameters: {'n_estimators': 349, 'max_depth': 25, 'min_samples_split': 11, 'min_samples_leaf': 1, 'max_features': 'sqrt', 'bootstrap': True, 'criterion': 'absolute_error'}. Best is trial 55 with value: 0.4376808190504977.
[I 2024-12-04 14:46:43,549] Trial 54 finished with value: 0.532502738562093 and parameters: {'n_estimators': 188, 'max_depth': 13, 'min_samples_split': 10, 'min_samples_leaf': 1, 'max_features': None, 'bootstrap': True, 'criterion': 'absolute_error'}. Best is trial 55 with value: 0.4376808190504977.
[I 2024-12-04 14:46:43,836] Trial 80 finished with value: 0.8764703548991555 and parameters: {'n_estimators': 289, 'max_depth': 26, 'min_samples_split': 3, 'min_samples_leaf': 4, 'max_features': 'sqrt', 'bootstrap': True, 'criterion': 'squared_error'}. Best is trial 55 with value: 0.4376808190504977.
[I 2024-12-04 14:46:44,188] Trial 68 finished with value: 0.7572721491437298 and parameters: {'n_estimators': 209, 'max_depth': 24, 'min_samples_split': 2, 'min_samples_leaf': 2, 'max_features': 'sqrt', 'bootstrap': True, 'criterion': 'absolute_error'}. Best is trial 55 with value: 0.4376808190504977.
[I 2024-12-04 14:46:44,751] Trial 75 finished with value: 0.4859495571476882 and parameters: {'n_estimators': 250, 'max_depth': 13, 'min_samples_split': 2, 'min_samples_leaf': 1, 'max_features': None, 'bootstrap': True, 'criterion': 'squared_error'}. Best is trial 55 with value: 0.4376808190504977.
[I 2024-12-04 14:46:46,818] Trial 77 finished with value: 0.5648935097721652 and parameters: {'n_estimators': 147, 'max_depth': 14, 'min_samples_split': 2, 'min_samples_leaf': 4, 'max_features': None, 'bootstrap': True, 'criterion': 'squared_error'}. Best is trial 55 with value: 0.4376808190504977.
[I 2024-12-04 14:46:47,517] Trial 82 finished with value: 0.4715518411459471 and parameters: {'n_estimators': 132, 'max_depth': 37, 'min_samples_split': 2, 'min_samples_leaf': 2, 'max_features': None, 'bootstrap': True, 'criterion': 'squared_error'}. Best is trial 55 with value: 0.4376808190504977.
[I 2024-12-04 14:46:48,564] Trial 71 finished with value: 0.5101103887063428 and parameters: {'n_estimators': 383, 'max_depth': 23, 'min_samples_split': 3, 'min_samples_leaf': 3, 'max_features': None, 'bootstrap': True, 'criterion': 'squared_error'}. Best is trial 55 with value: 0.4376808190504977.
