[I 2024-12-03 18:47:38,033] Trial 594 finished with value: 0.14399355183833995 and parameters: {'kernel': 'linear', 'C': 7.970694527542787, 'gamma': 0.00038624889344827246, 'epsilon': 0.11415131327129828}. Best is trial 345 with value: 0.13438257115663557.
[I 2024-12-03 18:47:38,572] Trial 595 finished with value: 0.3743370612382241 and parameters: {'kernel': 'sigmoid', 'C': 36.72086776293389, 'gamma': 0.00012136651621329698, 'epsilon': 0.01202135124681015}. Best is trial 345 with value: 0.13438257115663557.
[I 2024-12-03 18:47:39,237] Trial 596 finished with value: 0.2143537216927837 and parameters: {'kernel': 'rbf', 'C': 5.54546372538624, 'gamma': 0.0048596351943924875, 'epsilon': 0.0553521403047484}. Best is trial 345 with value: 0.13438257115663557.
[I 2024-12-03 18:47:39,493] Trial 597 finished with value: 0.25497241692929257 and parameters: {'kernel': 'rbf', 'C': 56.78518766212263, 'gamma': 0.007843740045110225, 'epsilon': 0.34572793046022293}. Best is trial 345 with value: 0.13438257115663557.
[I 2024-12-03 18:47:40,696] Trial 599 finished with value: 0.9886235345456252 and parameters: {'kernel': 'poly', 'C': 0.16041107463637927, 'gamma': 0.01288956934395745, 'epsilon': 0.1118186854412809}. Best is trial 345 with value: 0.13438257115663557.
[I 2024-12-03 18:47:44,058] Trial 591 finished with value: 0.13691952710996047 and parameters: {'kernel': 'linear', 'C': 12.151373351265288, 'gamma': 0.01462128606038232, 'epsilon': 0.04510907303466986}. Best is trial 345 with value: 0.13438257115663557.
[I 2024-12-03 18:47:44,387] Trial 508 finished with value: 0.1365017072527695 and parameters: {'kernel': 'linear', 'C': 98.30550405982154, 'gamma': 0.0009625877009057506, 'epsilon': 0.043409051868007836}. Best is trial 345 with value: 0.13438257115663557.
[I 2024-12-03 18:47:46,242] Trial 602 finished with value: 0.2877392578588833 and parameters: {'kernel': 'linear', 'C': 7.952242848698565, 'gamma': 0.00021576250130811566, 'epsilon': 0.4419192664635644}. Best is trial 345 with value: 0.13438257115663557.
[I 2024-12-03 18:47:46,698] Trial 548 finished with value: 0.13610602575195455 and parameters: {'kernel': 'linear', 'C': 87.01506584475887, 'gamma': 0.1085497420016982, 'epsilon': 0.052306871724347136}. Best is trial 345 with value: 0.13438257115663557.
[I 2024-12-03 18:47:47,040] Trial 601 finished with value: 0.16404150438404858 and parameters: {'kernel': 'linear', 'C': 14.575078581849573, 'gamma': 0.004389403058191063, 'epsilon': 0.1803564436480416}. Best is trial 345 with value: 0.13438257115663557.
[I 2024-12-03 18:47:47,502] Trial 563 finished with value: 0.13520281657278738 and parameters: {'kernel': 'linear', 'C': 93.90592655229588, 'gamma': 0.015498142966933621, 'epsilon': 0.05652248240412137}. Best is trial 345 with value: 0.13438257115663557.
[I 2024-12-03 18:47:47,503] Trial 600 finished with value: 0.13581254284121488 and parameters: {'kernel': 'linear', 'C': 8.398443092724387, 'gamma': 0.0006812811306881573, 'epsilon': 0.05059724788669863}. Best is trial 345 with value: 0.13438257115663557.
[I 2024-12-03 18:47:48,823] Trial 606 finished with value: 0.47919992237772396 and parameters: {'kernel': 'linear', 'C': 0.0010715366960149671, 'gamma': 0.16709259732467582, 'epsilon': 0.27710313353268634}. Best is trial 345 with value: 0.13438257115663557.
[I 2024-12-03 18:47:48,959] Trial 607 finished with value: 29.78286065461287 and parameters: {'kernel': 'sigmoid', 'C': 3.9254374300521717, 'gamma': 0.012882508340165487, 'epsilon': 0.8508838450957816}. Best is trial 345 with value: 0.13438257115663557.
[I 2024-12-03 18:47:49,256] Trial 605 finished with value: 0.13998465659890516 and parameters: {'kernel': 'linear', 'C': 2.7001243959708736, 'gamma': 0.004888841556600153, 'epsilon': 0.07299536757236115}. Best is trial 345 with value: 0.13438257115663557.
[I 2024-12-03 18:47:50,026] Trial 582 finished with value: 0.13698380997302456 and parameters: {'kernel': 'linear', 'C': 17.32308039603845, 'gamma': 0.002201776756229089, 'epsilon': 0.02305556337166391}. Best is trial 345 with value: 0.13438257115663557.
[I 2024-12-03 18:47:51,107] Trial 611 finished with value: 0.9533937281866891 and parameters: {'kernel': 'poly', 'C': 52.66739662323388, 'gamma': 0.0008229834950247367, 'epsilon': 0.10593219750969966}. Best is trial 345 with value: 0.13438257115663557.
[I 2024-12-03 18:47:52,023] Trial 610 finished with value: 0.14091984643931887 and parameters: {'kernel': 'linear', 'C': 2.276449059381942, 'gamma': 0.027169633560660076, 'epsilon': 0.07170063110782973}. Best is trial 345 with value: 0.13438257115663557.
[I 2024-12-03 18:47:52,168] Trial 612 finished with value: 0.41852488662499937 and parameters: {'kernel': 'rbf', 'C': 2.4285401680004135, 'gamma': 0.03692816238714039, 'epsilon': 0.08151096316564165}. Best is trial 345 with value: 0.13438257115663557.
[I 2024-12-03 18:47:52,223] Trial 585 finished with value: 0.13564646337947459 and parameters: {'kernel': 'linear', 'C': 19.988889606650307, 'gamma': 0.008806138651421474, 'epsilon': 0.027699048816404646}. Best is trial 345 with value: 0.13438257115663557.
[I 2024-12-03 18:47:53,090] Trial 604 finished with value: 0.17285091994053378 and parameters: {'kernel': 'linear', 'C': 66.85685799229842, 'gamma': 0.024614877426954663, 'epsilon': 0.18963134914186977}. Best is trial 345 with value: 0.13438257115663557.
[I 2024-12-03 18:47:53,593] Trial 603 finished with value: 0.1403571245831414 and parameters: {'kernel': 'linear', 'C': 32.48829212505857, 'gamma': 0.010198178434758778, 'epsilon': 0.09008889984691067}. Best is trial 345 with value: 0.13438257115663557.
[I 2024-12-03 18:47:54,682] Trial 616 finished with value: 0.3878236934377592 and parameters: {'kernel': 'poly', 'C': 0.8465909049985365, 'gamma': 0.041351335367852626, 'epsilon': 0.008166028296682894}. Best is trial 345 with value: 0.13438257115663557.
[I 2024-12-03 18:47:55,858] Trial 618 finished with value: 1.2407517643792456 and parameters: {'kernel': 'sigmoid', 'C': 0.007101036589549665, 'gamma': 0.010589397873382483, 'epsilon': 0.0010479111382611162}. Best is trial 345 with value: 0.13438257115663557.
[I 2024-12-03 18:47:56,939] Trial 619 finished with value: 0.7562684969318683 and parameters: {'kernel': 'poly', 'C': 8.305872208876545, 'gamma': 0.0011348791926721617, 'epsilon': 0.03713466021308407}. Best is trial 345 with value: 0.13438257115663557.
[I 2024-12-03 18:47:58,105] Trial 620 finished with value: 97.86155397083779 and parameters: {'kernel': 'sigmoid', 'C': 19.73785088904655, 'gamma': 0.00903114404698915, 'epsilon': 0.02272889847870576}. Best is trial 345 with value: 0.13438257115663557.
[I 2024-12-03 18:47:58,505] Trial 551 finished with value: 0.13566872186193366 and parameters: {'kernel': 'linear', 'C': 83.60078084674396, 'gamma': 0.013118274019210984, 'epsilon': 0.06736284280887245}. Best is trial 345 with value: 0.13438257115663557.
[I 2024-12-03 18:47:58,785] Trial 577 finished with value: 0.1414418520850079 and parameters: {'kernel': 'linear', 'C': 99.18312080011721, 'gamma': 0.0003062458039534121, 'epsilon': 0.09237198536323833}. Best is trial 345 with value: 0.13438257115663557.
[I 2024-12-03 18:48:02,197] Trial 581 finished with value: 0.1353007093807055 and parameters: {'kernel': 'linear', 'C': 54.48125347749708, 'gamma': 0.00013001047070824743, 'epsilon': 0.05991182764554587}. Best is trial 345 with value: 0.13438257115663557.
[I 2024-12-03 18:48:04,883] Trial 576 finished with value: 0.13791231882022223 and parameters: {'kernel': 'linear', 'C': 99.0676975957423, 'gamma': 0.00023117297543947396, 'epsilon': 0.07834538651799784}. Best is trial 345 with value: 0.13438257115663557.
[I 2024-12-03 18:48:05,537] Trial 608 finished with value: 0.1354585096949024 and parameters: {'kernel': 'linear', 'C': 20.509003362585574, 'gamma': 0.00037226933516225873, 'epsilon': 0.03183232692067553}. Best is trial 345 with value: 0.13438257115663557.
[I 2024-12-03 18:48:05,643] Trial 623 finished with value: 0.14602290400478932 and parameters: {'kernel': 'linear', 'C': 25.368185730072376, 'gamma': 0.0012494926804125486, 'epsilon': 0.1294845083709541}. Best is trial 345 with value: 0.13438257115663557.
[I 2024-12-03 18:48:06,088] Trial 625 finished with value: 0.30774074801624685 and parameters: {'kernel': 'linear', 'C': 0.01510986088812909, 'gamma': 0.005383523206503002, 'epsilon': 0.0013525732647206097}. Best is trial 345 with value: 0.13438257115663557.
[I 2024-12-03 18:48:06,120] Trial 614 finished with value: 0.13846720898275466 and parameters: {'kernel': 'linear', 'C': 6.611622020576813, 'gamma': 0.01971772264019007, 'epsilon': 0.010043547123172429}. Best is trial 345 with value: 0.13438257115663557.
[I 2024-12-03 18:48:07,103] Trial 547 finished with value: 0.1352904233594496 and parameters: {'kernel': 'linear', 'C': 94.5909443576138, 'gamma': 0.09183572756838629, 'epsilon': 0.028720342366546123}. Best is trial 345 with value: 0.13438257115663557.
[I 2024-12-03 18:48:07,715] Trial 578 finished with value: 0.13732020657534816 and parameters: {'kernel': 'linear', 'C': 36.361919580059514, 'gamma': 0.004537942497243159, 'epsilon': 0.01813177413623145}. Best is trial 345 with value: 0.13438257115663557.
[I 2024-12-03 18:48:07,989] Trial 629 finished with value: 0.4118802794455588 and parameters: {'kernel': 'rbf', 'C': 9.550712137258072, 'gamma': 0.00010326090332819641, 'epsilon': 0.07419912052989615}. Best is trial 345 with value: 0.13438257115663557.
[I 2024-12-03 18:48:08,062] Trial 627 finished with value: 0.14730961740172016 and parameters: {'kernel': 'linear', 'C': 4.327701144038255, 'gamma': 0.05069351738481008, 'epsilon': 0.0966932056256619}. Best is trial 345 with value: 0.13438257115663557.
[I 2024-12-03 18:48:08,553] Trial 630 finished with value: 1.129173203212991 and parameters: {'kernel': 'rbf', 'C': 0.01228520110137067, 'gamma': 0.021717467932049272, 'epsilon': 0.2995996743241764}. Best is trial 345 with value: 0.13438257115663557.
[I 2024-12-03 18:48:09,235] Trial 574 finished with value: 0.13515286506561408 and parameters: {'kernel': 'linear', 'C': 97.01011563835796, 'gamma': 0.003890720092805532, 'epsilon': 0.05481052607777499}. Best is trial 345 with value: 0.13438257115663557.
[I 2024-12-03 18:48:09,828] Trial 628 finished with value: 0.19635828926989604 and parameters: {'kernel': 'linear', 'C': 99.98710738752241, 'gamma': 0.010179537996961549, 'epsilon': 0.24144227354579714}. Best is trial 345 with value: 0.13438257115663557.
[I 2024-12-03 18:48:10,113] Trial 613 finished with value: 0.13540357501353914 and parameters: {'kernel': 'linear', 'C': 13.74593221509825, 'gamma': 0.015451012520622438, 'epsilon': 0.028753547986443258}. Best is trial 345 with value: 0.13438257115663557.
[I 2024-12-03 18:48:10,683] Trial 621 finished with value: 0.14057861569671437 and parameters: {'kernel': 'linear', 'C': 38.782092725256774, 'gamma': 0.01669107085346143, 'epsilon': 0.09029119499282905}. Best is trial 345 with value: 0.13438257115663557.
[I 2024-12-03 18:48:10,694] Trial 617 finished with value: 0.13671110421165814 and parameters: {'kernel': 'linear', 'C': 10.577834673453198, 'gamma': 0.0007674911678937826, 'epsilon': 0.02392779278417587}. Best is trial 345 with value: 0.13438257115663557.
[I 2024-12-03 18:48:10,894] Trial 622 finished with value: 0.13514499962359 and parameters: {'kernel': 'linear', 'C': 15.100508690355156, 'gamma': 0.0019565750873961484, 'epsilon': 0.06108024354847404}. Best is trial 345 with value: 0.13438257115663557.
[I 2024-12-03 18:48:11,249] Trial 632 finished with value: 0.14336693972513315 and parameters: {'kernel': 'linear', 'C': 9.366725315311779, 'gamma': 0.00010277257922859056, 'epsilon': 0.11278299362530392}. Best is trial 345 with value: 0.13438257115663557.
[I 2024-12-03 18:48:11,312] Trial 634 finished with value: 0.1435842900906723 and parameters: {'kernel': 'linear', 'C': 0.8202821442446282, 'gamma': 0.0003075314493005822, 'epsilon': 0.02585826151869539}. Best is trial 345 with value: 0.13438257115663557.
[I 2024-12-03 18:48:11,501] Trial 631 finished with value: 0.13845497765246392 and parameters: {'kernel': 'linear', 'C': 1.489997778741595, 'gamma': 0.025980637179003903, 'epsilon': 0.023205760940437782}. Best is trial 345 with value: 0.13438257115663557.
[I 2024-12-03 18:48:11,730] Trial 636 finished with value: 2.5436231676779126 and parameters: {'kernel': 'sigmoid', 'C': 0.4300977723673939, 'gamma': 0.010610933520139934, 'epsilon': 0.07020819535955837}. Best is trial 345 with value: 0.13438257115663557.
[I 2024-12-03 18:48:12,436] Trial 559 finished with value: 0.1376949710527069 and parameters: {'kernel': 'linear', 'C': 54.2030918798768, 'gamma': 0.00010353598282213278, 'epsilon': 0.01823165870693593}. Best is trial 345 with value: 0.13438257115663557.
[I 2024-12-03 18:48:12,438] Trial 624 finished with value: 0.13598376533407497 and parameters: {'kernel': 'linear', 'C': 11.25807969412554, 'gamma': 0.015078315114863008, 'epsilon': 0.05510302927977956}. Best is trial 345 with value: 0.13438257115663557.
[I 2024-12-03 18:48:13,747] Trial 583 finished with value: 0.1372286109279953 and parameters: {'kernel': 'linear', 'C': 84.43838460168398, 'gamma': 0.0001604440267496648, 'epsilon': 0.047539673966029934}. Best is trial 345 with value: 0.13438257115663557.
[I 2024-12-03 18:48:14,714] Trial 641 finished with value: 0.16729031647072995 and parameters: {'kernel': 'linear', 'C': 2.3416887652622673, 'gamma': 0.009344582129288664, 'epsilon': 0.14267780497203214}. Best is trial 345 with value: 0.13438257115663557.
[I 2024-12-03 18:48:14,715] Trial 640 finished with value: 0.16238170433750457 and parameters: {'kernel': 'linear', 'C': 1.4732264141431495, 'gamma': 0.001437800432737569, 'epsilon': 0.12358444289387596}. Best is trial 345 with value: 0.13438257115663557.
[I 2024-12-03 18:48:15,738] Trial 555 finished with value: 0.13501231377740966 and parameters: {'kernel': 'linear', 'C': 86.40205851645558, 'gamma': 0.005456927672724739, 'epsilon': 0.06167248224204362}. Best is trial 345 with value: 0.13438257115663557.
[I 2024-12-03 18:48:18,776] Trial 562 finished with value: 0.1368301764368838 and parameters: {'kernel': 'linear', 'C': 83.83581035801711, 'gamma': 0.012192814741659657, 'epsilon': 0.023285606849379772}. Best is trial 345 with value: 0.13438257115663557.
[I 2024-12-03 18:48:19,372] Trial 593 finished with value: 0.1352572573835426 and parameters: {'kernel': 'linear', 'C': 59.983383983352795, 'gamma': 0.0020720879543695216, 'epsilon': 0.028804101682355632}. Best is trial 345 with value: 0.13438257115663557.
[I 2024-12-03 18:48:19,794] Trial 507 finished with value: 0.13503948060149704 and parameters: {'kernel': 'linear', 'C': 83.91956691546234, 'gamma': 0.0005513532459633612, 'epsilon': 0.029475909988765724}. Best is trial 345 with value: 0.13438257115663557.
[I 2024-12-03 18:48:20,086] Trial 633 finished with value: 0.13515596448918765 and parameters: {'kernel': 'linear', 'C': 18.130086578137615, 'gamma': 0.0103003394769018, 'epsilon': 0.05420674638986442}. Best is trial 345 with value: 0.13438257115663557.
[I 2024-12-03 18:48:20,481] Trial 646 finished with value: 0.13787125252209578 and parameters: {'kernel': 'linear', 'C': 19.498887962148896, 'gamma': 0.03750516373716703, 'epsilon': 0.08149512291730554}. Best is trial 345 with value: 0.13438257115663557.
[I 2024-12-03 18:48:20,614] Trial 652 finished with value: 0.5592609050022256 and parameters: {'kernel': 'sigmoid', 'C': 6.6905595659053505, 'gamma': 0.0014617964616650823, 'epsilon': 0.005463623977594403}. Best is trial 345 with value: 0.13438257115663557.
[I 2024-12-03 18:48:20,864] Trial 645 finished with value: 0.13612718102958737 and parameters: {'kernel': 'linear', 'C': 5.159308392682182, 'gamma': 0.006358763644702363, 'epsilon': 0.029670561128138487}. Best is trial 345 with value: 0.13438257115663557.
[I 2024-12-03 18:48:21,429] Trial 647 finished with value: 0.13689693478612305 and parameters: {'kernel': 'linear', 'C': 11.762932080380692, 'gamma': 0.002843899049060207, 'epsilon': 0.07605962112107555}. Best is trial 345 with value: 0.13438257115663557.
[I 2024-12-03 18:48:22,772] Trial 642 finished with value: 0.13871730305933183 and parameters: {'kernel': 'linear', 'C': 6.0003852974844705, 'gamma': 0.0353105365604548, 'epsilon': 0.017246371688391382}. Best is trial 345 with value: 0.13438257115663557.
[I 2024-12-03 18:48:23,222] Trial 651 finished with value: 0.1679448213666009 and parameters: {'kernel': 'linear', 'C': 73.34626241024475, 'gamma': 0.00170545605505294, 'epsilon': 0.18012324264090857}. Best is trial 345 with value: 0.13438257115663557.
[I 2024-12-03 18:48:24,130] Trial 523 finished with value: 0.1357291632718254 and parameters: {'kernel': 'linear', 'C': 85.35695055438943, 'gamma': 0.007840710817448304, 'epsilon': 0.03515532691015894}. Best is trial 345 with value: 0.13438257115663557.
[I 2024-12-03 18:48:24,147] Trial 643 finished with value: 0.1407534054314258 and parameters: {'kernel': 'linear', 'C': 60.64988802669864, 'gamma': 0.0009665623388206304, 'epsilon': 0.10967389445798376}. Best is trial 345 with value: 0.13438257115663557.
[I 2024-12-03 18:48:24,713] Trial 660 finished with value: 1.4071029501314922 and parameters: {'kernel': 'sigmoid', 'C': 0.017163045699753746, 'gamma': 0.8437145141736118, 'epsilon': 0.05523999003497676}. Best is trial 345 with value: 0.13438257115663557.
[I 2024-12-03 18:48:26,188] Trial 663 finished with value: 1.2006144022704943 and parameters: {'kernel': 'sigmoid', 'C': 0.45808535931584615, 'gamma': 0.006107880405876505, 'epsilon': 0.005718483769693289}. Best is trial 345 with value: 0.13438257115663557.
[I 2024-12-03 18:48:26,334] Trial 650 finished with value: 0.13642380776630747 and parameters: {'kernel': 'linear', 'C': 12.74419052384981, 'gamma': 0.003124365936586845, 'epsilon': 0.043176697138942725}. Best is trial 345 with value: 0.13438257115663557.
[I 2024-12-03 18:48:29,952] Trial 592 finished with value: 0.13554161342344145 and parameters: {'kernel': 'linear', 'C': 49.77130925252519, 'gamma': 0.0018582308350051325, 'epsilon': 0.027554927593376105}. Best is trial 345 with value: 0.13438257115663557.
[I 2024-12-03 18:48:32,220] Trial 662 finished with value: 0.13673095900912963 and parameters: {'kernel': 'linear', 'C': 6.705407091011783, 'gamma': 0.00022535697493514294, 'epsilon': 0.0472063615765848}. Best is trial 345 with value: 0.13438257115663557.
[I 2024-12-03 18:48:34,312] Trial 664 finished with value: 0.1501363039630352 and parameters: {'kernel': 'linear', 'C': 90.68181947837309, 'gamma': 0.0004937480009307117, 'epsilon': 0.14447778713220072}. Best is trial 345 with value: 0.13438257115663557.
[I 2024-12-03 18:48:36,913] Trial 639 finished with value: 0.13571136877590215 and parameters: {'kernel': 'linear', 'C': 19.535931005954996, 'gamma': 0.00041581562442798023, 'epsilon': 0.02678352818145185}. Best is trial 345 with value: 0.13438257115663557.
[I 2024-12-03 18:48:37,692] Trial 666 finished with value: 0.14632752291361725 and parameters: {'kernel': 'linear', 'C': 48.88131484134435, 'gamma': 0.0030771395341234833, 'epsilon': 0.1242624293095937}. Best is trial 345 with value: 0.13438257115663557.
[I 2024-12-03 18:48:37,984] Trial 669 finished with value: 0.3612650123004363 and parameters: {'kernel': 'sigmoid', 'C': 82.02873870701185, 'gamma': 0.000529756093604351, 'epsilon': 0.04165606154530803}. Best is trial 345 with value: 0.13438257115663557.
[I 2024-12-03 18:48:38,273] Trial 655 finished with value: 0.13793354052255385 and parameters: {'kernel': 'linear', 'C': 12.8654388679683, 'gamma': 0.0007235422207610813, 'epsilon': 0.013972553540241088}. Best is trial 345 with value: 0.13438257115663557.
[I 2024-12-03 18:48:39,077] Trial 670 finished with value: 1367.7268978156942 and parameters: {'kernel': 'sigmoid', 'C': 90.68304048230752, 'gamma': 0.08230589467830787, 'epsilon': 0.010370253946144017}. Best is trial 345 with value: 0.13438257115663557.
[I 2024-12-03 18:48:39,135] Trial 671 finished with value: 1.1349276925302612 and parameters: {'kernel': 'rbf', 'C': 0.42177657388366496, 'gamma': 0.671590958293969, 'epsilon': 0.6065642568342935}. Best is trial 345 with value: 0.13438257115663557.
[I 2024-12-03 18:48:39,682] Trial 672 finished with value: 0.4434821453934251 and parameters: {'kernel': 'linear', 'C': 0.0012642434212318413, 'gamma': 0.0015282560789647822, 'epsilon': 0.024686661631558096}. Best is trial 345 with value: 0.13438257115663557.
[I 2024-12-03 18:48:40,730] Trial 584 finished with value: 0.13821132509084424 and parameters: {'kernel': 'linear', 'C': 62.39792065224984, 'gamma': 0.0005723603591318207, 'epsilon': 0.010060961662046208}. Best is trial 345 with value: 0.13438257115663557.
[I 2024-12-03 18:48:43,638] Trial 667 finished with value: 0.13521477343623603 and parameters: {'kernel': 'linear', 'C': 14.240575821839524, 'gamma': 0.00021792068294487418, 'epsilon': 0.05995822283812359}. Best is trial 345 with value: 0.13438257115663557.
[I 2024-12-03 18:48:44,600] Trial 615 finished with value: 0.13550913108999077 and parameters: {'kernel': 'linear', 'C': 51.52626907642374, 'gamma': 0.008931388461851446, 'epsilon': 0.027904404215821296}. Best is trial 345 with value: 0.13438257115663557.
[I 2024-12-03 18:48:44,718] Trial 657 finished with value: 0.13514024849613848 and parameters: {'kernel': 'linear', 'C': 29.595023320956383, 'gamma': 0.0008846522417750205, 'epsilon': 0.03216781823788474}. Best is trial 345 with value: 0.13438257115663557.
[I 2024-12-03 18:48:46,660] Trial 678 finished with value: 0.14221723583572532 and parameters: {'kernel': 'linear', 'C': 7.031362678072352, 'gamma': 0.008270170043195099, 'epsilon': 0.09157168758894907}. Best is trial 345 with value: 0.13438257115663557.
[I 2024-12-03 18:48:48,931] Trial 673 finished with value: 0.13587560434561471 and parameters: {'kernel': 'linear', 'C': 6.7709361406664, 'gamma': 0.0016502244006619104, 'epsilon': 0.033533159506638446}. Best is trial 345 with value: 0.13438257115663557.
