[I 2024-12-04 12:49:14,664] Trial 998 finished with value: 0.280136849549847 and parameters: {'n_estimators': 1415, 'learning_rate': 0.09134807840062846, 'max_depth': 7, 'min_samples_split': 4, 'min_samples_leaf': 2, 'subsample': 0.8428452780426308, 'max_features': 'sqrt'}. Best is trial 621 with value: 0.2256726988932517.
[I 2024-12-04 12:49:18,512] Trial 1006 finished with value: 0.28724249616150793 and parameters: {'n_estimators': 1194, 'learning_rate': 0.09895107448298301, 'max_depth': 6, 'min_samples_split': 6, 'min_samples_leaf': 2, 'subsample': 0.7349324100258446, 'max_features': 'sqrt'}. Best is trial 621 with value: 0.2256726988932517.
[I 2024-12-04 12:49:20,697] Trial 1021 finished with value: 0.29035223773761654 and parameters: {'n_estimators': 670, 'learning_rate': 0.0598771254883502, 'max_depth': 7, 'min_samples_split': 5, 'min_samples_leaf': 1, 'subsample': 0.6926766029758443, 'max_features': 'sqrt'}. Best is trial 621 with value: 0.2256726988932517.
[I 2024-12-04 12:49:20,734] Trial 1003 finished with value: 0.25140134224935656 and parameters: {'n_estimators': 1346, 'learning_rate': 0.09890113874056257, 'max_depth': 4, 'min_samples_split': 2, 'min_samples_leaf': 1, 'subsample': 0.6652006758218648, 'max_features': 'sqrt'}. Best is trial 621 with value: 0.2256726988932517.
[I 2024-12-04 12:49:22,527] Trial 997 finished with value: 0.496986721277331 and parameters: {'n_estimators': 1487, 'learning_rate': 0.025476255638299063, 'max_depth': 8, 'min_samples_split': 15, 'min_samples_leaf': 10, 'subsample': 0.6309249418353498, 'max_features': None}. Best is trial 621 with value: 0.2256726988932517.
[I 2024-12-04 12:49:24,450] Trial 999 finished with value: 0.34101822070769877 and parameters: {'n_estimators': 1488, 'learning_rate': 0.07044646423399378, 'max_depth': 9, 'min_samples_split': 5, 'min_samples_leaf': 3, 'subsample': 0.8411358926495194, 'max_features': 'sqrt'}. Best is trial 621 with value: 0.2256726988932517.
[I 2024-12-04 12:49:26,095] Trial 1000 finished with value: 0.2596198282140485 and parameters: {'n_estimators': 1492, 'learning_rate': 0.07825836469734924, 'max_depth': 7, 'min_samples_split': 4, 'min_samples_leaf': 1, 'subsample': 0.8144163882647759, 'max_features': 'sqrt'}. Best is trial 621 with value: 0.2256726988932517.
[I 2024-12-04 12:49:26,538] Trial 1008 finished with value: 0.2698322233484698 and parameters: {'n_estimators': 1247, 'learning_rate': 0.08516644108880471, 'max_depth': 8, 'min_samples_split': 6, 'min_samples_leaf': 1, 'subsample': 0.8074792766564608, 'max_features': 'sqrt'}. Best is trial 621 with value: 0.2256726988932517.
[I 2024-12-04 12:49:28,294] Trial 1025 finished with value: 0.4701818822344036 and parameters: {'n_estimators': 569, 'learning_rate': 0.0201516993857666, 'max_depth': 7, 'min_samples_split': 20, 'min_samples_leaf': 7, 'subsample': 0.9305577078081795, 'max_features': 'sqrt'}. Best is trial 621 with value: 0.2256726988932517.
[I 2024-12-04 12:49:30,875] Trial 1024 finished with value: 0.24507664342968802 and parameters: {'n_estimators': 661, 'learning_rate': 0.0962342603060981, 'max_depth': 9, 'min_samples_split': 3, 'min_samples_leaf': 1, 'subsample': 0.6549363595253039, 'max_features': 'sqrt'}. Best is trial 621 with value: 0.2256726988932517.
[I 2024-12-04 12:49:32,209] Trial 1014 finished with value: 0.5164843358561094 and parameters: {'n_estimators': 1136, 'learning_rate': 0.02007906679990442, 'max_depth': 7, 'min_samples_split': 8, 'min_samples_leaf': 10, 'subsample': 0.8964844635119789, 'max_features': 'sqrt'}. Best is trial 621 with value: 0.2256726988932517.
[I 2024-12-04 12:49:37,861] Trial 1007 finished with value: 0.2544837175761631 and parameters: {'n_estimators': 1420, 'learning_rate': 0.09699889267600388, 'max_depth': 9, 'min_samples_split': 2, 'min_samples_leaf': 1, 'subsample': 0.7585803376539246, 'max_features': 'sqrt'}. Best is trial 621 with value: 0.2256726988932517.
[I 2024-12-04 12:49:39,752] Trial 1010 finished with value: 0.2555815230587075 and parameters: {'n_estimators': 1331, 'learning_rate': 0.053297857234750015, 'max_depth': 12, 'min_samples_split': 5, 'min_samples_leaf': 1, 'subsample': 0.6015367047278466, 'max_features': 'sqrt'}. Best is trial 621 with value: 0.2256726988932517.
[I 2024-12-04 12:49:41,377] Trial 1015 finished with value: 0.248571532786761 and parameters: {'n_estimators': 1163, 'learning_rate': 0.07337928787478783, 'max_depth': 8, 'min_samples_split': 10, 'min_samples_leaf': 1, 'subsample': 0.8156224856673946, 'max_features': 'sqrt'}. Best is trial 621 with value: 0.2256726988932517.
[I 2024-12-04 12:49:43,614] Trial 1012 finished with value: 0.3490415013801238 and parameters: {'n_estimators': 1418, 'learning_rate': 0.04980974920432292, 'max_depth': 7, 'min_samples_split': 5, 'min_samples_leaf': 3, 'subsample': 0.6339781870833335, 'max_features': 'sqrt'}. Best is trial 621 with value: 0.2256726988932517.
[I 2024-12-04 12:49:44,569] Trial 1030 finished with value: 0.9881913900635874 and parameters: {'n_estimators': 775, 'learning_rate': 0.019475020285203037, 'max_depth': 8, 'min_samples_split': 19, 'min_samples_leaf': 8, 'subsample': 0.770943011993252, 'max_features': 'log2'}. Best is trial 621 with value: 0.2256726988932517.
[I 2024-12-04 12:49:47,166] Trial 1011 finished with value: 0.40103471408280866 and parameters: {'n_estimators': 1396, 'learning_rate': 0.09278808739915101, 'max_depth': 4, 'min_samples_split': 4, 'min_samples_leaf': 2, 'subsample': 0.7340755781929404, 'max_features': None}. Best is trial 621 with value: 0.2256726988932517.
[I 2024-12-04 12:49:50,839] Trial 1023 finished with value: 0.24097962402372972 and parameters: {'n_estimators': 1120, 'learning_rate': 0.09811719605678103, 'max_depth': 5, 'min_samples_split': 2, 'min_samples_leaf': 1, 'subsample': 0.7322224919934662, 'max_features': 'sqrt'}. Best is trial 621 with value: 0.2256726988932517.
[I 2024-12-04 12:49:57,054] Trial 1019 finished with value: 0.226376809041277 and parameters: {'n_estimators': 1278, 'learning_rate': 0.09064758802733175, 'max_depth': 8, 'min_samples_split': 4, 'min_samples_leaf': 1, 'subsample': 0.8045662144629384, 'max_features': 'sqrt'}. Best is trial 621 with value: 0.2256726988932517.
[I 2024-12-04 12:49:58,322] Trial 1029 finished with value: 0.4335032392317008 and parameters: {'n_estimators': 929, 'learning_rate': 0.08187090681305738, 'max_depth': 6, 'min_samples_split': 17, 'min_samples_leaf': 7, 'subsample': 0.8564611850068842, 'max_features': None}. Best is trial 621 with value: 0.2256726988932517.
[I 2024-12-04 12:50:01,146] Trial 1016 finished with value: 0.3014289622025638 and parameters: {'n_estimators': 1494, 'learning_rate': 0.06715293066877095, 'max_depth': 8, 'min_samples_split': 5, 'min_samples_leaf': 2, 'subsample': 0.905266376382377, 'max_features': 'sqrt'}. Best is trial 621 with value: 0.2256726988932517.
[I 2024-12-04 12:50:01,232] Trial 1027 finished with value: 0.29357003836302914 and parameters: {'n_estimators': 1137, 'learning_rate': 0.08099886507633906, 'max_depth': 7, 'min_samples_split': 3, 'min_samples_leaf': 2, 'subsample': 0.8614225772949503, 'max_features': 'log2'}. Best is trial 621 with value: 0.2256726988932517.
[I 2024-12-04 12:50:01,251] Trial 1052 finished with value: 1.0418794481018718 and parameters: {'n_estimators': 111, 'learning_rate': 0.08882255023251265, 'max_depth': 9, 'min_samples_split': 5, 'min_samples_leaf': 7, 'subsample': 0.6990434543402974, 'max_features': 'log2'}. Best is trial 621 with value: 0.2256726988932517.
[I 2024-12-04 12:50:03,971] Trial 1032 finished with value: 0.2374029655017001 and parameters: {'n_estimators': 1036, 'learning_rate': 0.06992764442316371, 'max_depth': 6, 'min_samples_split': 2, 'min_samples_leaf': 1, 'subsample': 0.8904594183851874, 'max_features': 'sqrt'}. Best is trial 621 with value: 0.2256726988932517.
[I 2024-12-04 12:50:05,908] Trial 1022 finished with value: 0.3547799627388338 and parameters: {'n_estimators': 1294, 'learning_rate': 0.06145287690476737, 'max_depth': 8, 'min_samples_split': 2, 'min_samples_leaf': 3, 'subsample': 0.7852291921433672, 'max_features': 'sqrt'}. Best is trial 621 with value: 0.2256726988932517.
[I 2024-12-04 12:50:10,666] Trial 1028 finished with value: 0.25458907670056075 and parameters: {'n_estimators': 1258, 'learning_rate': 0.0954260210796794, 'max_depth': 8, 'min_samples_split': 5, 'min_samples_leaf': 1, 'subsample': 0.9474285220920791, 'max_features': 'sqrt'}. Best is trial 621 with value: 0.2256726988932517.
[I 2024-12-04 12:50:13,037] Trial 1037 finished with value: 0.27550036323552574 and parameters: {'n_estimators': 896, 'learning_rate': 0.09519986986141041, 'max_depth': 6, 'min_samples_split': 3, 'min_samples_leaf': 1, 'subsample': 0.9448733531837311, 'max_features': 'log2'}. Best is trial 621 with value: 0.2256726988932517.
[I 2024-12-04 12:50:14,961] Trial 1020 finished with value: 0.3637747683331799 and parameters: {'n_estimators': 1433, 'learning_rate': 0.0640405463755909, 'max_depth': 7, 'min_samples_split': 6, 'min_samples_leaf': 3, 'subsample': 0.782378972393845, 'max_features': 'sqrt'}. Best is trial 621 with value: 0.2256726988932517.
[I 2024-12-04 12:50:18,006] Trial 1026 finished with value: 0.25415483944339096 and parameters: {'n_estimators': 1357, 'learning_rate': 0.09652902714827727, 'max_depth': 8, 'min_samples_split': 2, 'min_samples_leaf': 1, 'subsample': 0.822960172781787, 'max_features': 'sqrt'}. Best is trial 621 with value: 0.2256726988932517.
[I 2024-12-04 12:50:23,238] Trial 1031 finished with value: 0.2613989880396679 and parameters: {'n_estimators': 1401, 'learning_rate': 0.06465578391681379, 'max_depth': 6, 'min_samples_split': 3, 'min_samples_leaf': 1, 'subsample': 0.8410109752122195, 'max_features': 'log2'}. Best is trial 621 with value: 0.2256726988932517.
[I 2024-12-04 12:50:25,882] Trial 1050 finished with value: 0.43290491795418157 and parameters: {'n_estimators': 576, 'learning_rate': 0.010562078884230552, 'max_depth': 12, 'min_samples_split': 4, 'min_samples_leaf': 4, 'subsample': 0.695264484071321, 'max_features': None}. Best is trial 621 with value: 0.2256726988932517.
[I 2024-12-04 12:50:29,313] Trial 1036 finished with value: 0.25866465109990977 and parameters: {'n_estimators': 1185, 'learning_rate': 0.06108764147145735, 'max_depth': 10, 'min_samples_split': 8, 'min_samples_leaf': 1, 'subsample': 0.8571269464544338, 'max_features': 'sqrt'}. Best is trial 621 with value: 0.2256726988932517.
[I 2024-12-04 12:50:32,616] Trial 1040 finished with value: 0.3129534627242924 and parameters: {'n_estimators': 1082, 'learning_rate': 0.037915867208320506, 'max_depth': 12, 'min_samples_split': 5, 'min_samples_leaf': 2, 'subsample': 0.7594790908962857, 'max_features': 'sqrt'}. Best is trial 621 with value: 0.2256726988932517.
[I 2024-12-04 12:50:33,968] Trial 1065 finished with value: 0.3750908668987532 and parameters: {'n_estimators': 206, 'learning_rate': 0.056886638900729494, 'max_depth': 11, 'min_samples_split': 9, 'min_samples_leaf': 3, 'subsample': 0.8431913204593953, 'max_features': 'sqrt'}. Best is trial 621 with value: 0.2256726988932517.
[I 2024-12-04 12:50:35,574] Trial 1033 finished with value: 0.23710759294987685 and parameters: {'n_estimators': 1431, 'learning_rate': 0.05833863331724764, 'max_depth': 12, 'min_samples_split': 3, 'min_samples_leaf': 1, 'subsample': 0.754091999788098, 'max_features': 'sqrt'}. Best is trial 621 with value: 0.2256726988932517.
[I 2024-12-04 12:50:37,828] Trial 1046 finished with value: 0.48946016515653773 and parameters: {'n_estimators': 918, 'learning_rate': 0.09452851353931582, 'max_depth': 12, 'min_samples_split': 9, 'min_samples_leaf': 10, 'subsample': 0.7139001594597458, 'max_features': 'sqrt'}. Best is trial 621 with value: 0.2256726988932517.
[I 2024-12-04 12:50:39,055] Trial 1053 finished with value: 0.29364708760573527 and parameters: {'n_estimators': 713, 'learning_rate': 0.0911052081350908, 'max_depth': 6, 'min_samples_split': 2, 'min_samples_leaf': 2, 'subsample': 0.7599286044622647, 'max_features': 'sqrt'}. Best is trial 621 with value: 0.2256726988932517.
[I 2024-12-04 12:50:39,404] Trial 1034 finished with value: 0.3594347915392809 and parameters: {'n_estimators': 1414, 'learning_rate': 0.06322496824515336, 'max_depth': 11, 'min_samples_split': 5, 'min_samples_leaf': 3, 'subsample': 0.6833446913010489, 'max_features': 'sqrt'}. Best is trial 621 with value: 0.2256726988932517.
[I 2024-12-04 12:50:42,193] Trial 1035 finished with value: 0.2587698381612293 and parameters: {'n_estimators': 1374, 'learning_rate': 0.03814959230613837, 'max_depth': 10, 'min_samples_split': 2, 'min_samples_leaf': 1, 'subsample': 0.6007732393452874, 'max_features': 'sqrt'}. Best is trial 621 with value: 0.2256726988932517.
[I 2024-12-04 12:50:43,232] Trial 1043 finished with value: 0.2945319273678959 and parameters: {'n_estimators': 1062, 'learning_rate': 0.06171068454995311, 'max_depth': 7, 'min_samples_split': 10, 'min_samples_leaf': 1, 'subsample': 0.9900684529137282, 'max_features': 'log2'}. Best is trial 621 with value: 0.2256726988932517.
[I 2024-12-04 12:50:44,769] Trial 1038 finished with value: 0.29825059835936396 and parameters: {'n_estimators': 1313, 'learning_rate': 0.04022688692978029, 'max_depth': 6, 'min_samples_split': 20, 'min_samples_leaf': 2, 'subsample': 0.7992369106211088, 'max_features': 'sqrt'}. Best is trial 621 with value: 0.2256726988932517.
[I 2024-12-04 12:50:46,768] Trial 1048 finished with value: 0.24224824522393476 and parameters: {'n_estimators': 967, 'learning_rate': 0.0424062063281102, 'max_depth': 12, 'min_samples_split': 2, 'min_samples_leaf': 1, 'subsample': 0.607923152642633, 'max_features': 'sqrt'}. Best is trial 621 with value: 0.2256726988932517.
[I 2024-12-04 12:50:47,911] Trial 1039 finished with value: 0.3965327841991991 and parameters: {'n_estimators': 1215, 'learning_rate': 0.09254273725467937, 'max_depth': 7, 'min_samples_split': 8, 'min_samples_leaf': 3, 'subsample': 0.7827406557612734, 'max_features': None}. Best is trial 621 with value: 0.2256726988932517.
[I 2024-12-04 12:50:47,937] Trial 1041 finished with value: 0.2429886938720251 and parameters: {'n_estimators': 1247, 'learning_rate': 0.07544206473189184, 'max_depth': 10, 'min_samples_split': 4, 'min_samples_leaf': 1, 'subsample': 0.8569817713730096, 'max_features': 'sqrt'}. Best is trial 621 with value: 0.2256726988932517.
[I 2024-12-04 12:50:53,489] Trial 1042 finished with value: 0.251688046959065 and parameters: {'n_estimators': 1284, 'learning_rate': 0.04805330338979444, 'max_depth': 12, 'min_samples_split': 11, 'min_samples_leaf': 1, 'subsample': 0.7792781610770932, 'max_features': 'sqrt'}. Best is trial 621 with value: 0.2256726988932517.
[I 2024-12-04 12:50:59,800] Trial 1049 finished with value: 0.24275640755952707 and parameters: {'n_estimators': 1187, 'learning_rate': 0.08411942531071158, 'max_depth': 11, 'min_samples_split': 5, 'min_samples_leaf': 1, 'subsample': 0.6019556216362183, 'max_features': 'sqrt'}. Best is trial 621 with value: 0.2256726988932517.
[I 2024-12-04 12:51:02,007] Trial 1051 finished with value: 0.23990830351530917 and parameters: {'n_estimators': 1198, 'learning_rate': 0.05658431235043062, 'max_depth': 8, 'min_samples_split': 5, 'min_samples_leaf': 1, 'subsample': 0.8849293679504819, 'max_features': 'sqrt'}. Best is trial 621 with value: 0.2256726988932517.
[I 2024-12-04 12:51:02,031] Trial 1045 finished with value: 0.26326001082421246 and parameters: {'n_estimators': 1381, 'learning_rate': 0.0626699205975793, 'max_depth': 8, 'min_samples_split': 5, 'min_samples_leaf': 1, 'subsample': 0.7857854227288952, 'max_features': 'log2'}. Best is trial 621 with value: 0.2256726988932517.
[I 2024-12-04 12:51:03,985] Trial 1055 finished with value: 0.24796085760709077 and parameters: {'n_estimators': 1040, 'learning_rate': 0.08477527392786222, 'max_depth': 8, 'min_samples_split': 6, 'min_samples_leaf': 1, 'subsample': 0.8219268473426399, 'max_features': 'sqrt'}. Best is trial 621 with value: 0.2256726988932517.
[I 2024-12-04 12:51:06,097] Trial 1044 finished with value: 0.249623323075609 and parameters: {'n_estimators': 1482, 'learning_rate': 0.04836034584178836, 'max_depth': 7, 'min_samples_split': 8, 'min_samples_leaf': 1, 'subsample': 0.6980574015845583, 'max_features': 'sqrt'}. Best is trial 621 with value: 0.2256726988932517.
[I 2024-12-04 12:51:08,190] Trial 1068 finished with value: 0.42384661626565473 and parameters: {'n_estimators': 589, 'learning_rate': 0.020929222817177923, 'max_depth': 10, 'min_samples_split': 18, 'min_samples_leaf': 5, 'subsample': 0.7320554537540028, 'max_features': 'sqrt'}. Best is trial 621 with value: 0.2256726988932517.
[I 2024-12-04 12:51:10,295] Trial 1070 finished with value: 0.4741020912646489 and parameters: {'n_estimators': 515, 'learning_rate': 0.08275561352021946, 'max_depth': 7, 'min_samples_split': 18, 'min_samples_leaf': 6, 'subsample': 0.8933291377697489, 'max_features': 'log2'}. Best is trial 621 with value: 0.2256726988932517.
[I 2024-12-04 12:51:10,314] Trial 1062 finished with value: 0.43015085364917754 and parameters: {'n_estimators': 868, 'learning_rate': 0.04338131044662685, 'max_depth': 4, 'min_samples_split': 9, 'min_samples_leaf': 7, 'subsample': 0.7020891195373052, 'max_features': None}. Best is trial 621 with value: 0.2256726988932517.
[I 2024-12-04 12:51:11,177] Trial 1047 finished with value: 0.23247381824664562 and parameters: {'n_estimators': 1454, 'learning_rate': 0.08319410416633231, 'max_depth': 6, 'min_samples_split': 2, 'min_samples_leaf': 1, 'subsample': 0.7056026525708745, 'max_features': 'sqrt'}. Best is trial 621 with value: 0.2256726988932517.
[I 2024-12-04 12:51:13,762] Trial 1056 finished with value: 0.355150512756154 and parameters: {'n_estimators': 1169, 'learning_rate': 0.08167147286157427, 'max_depth': 8, 'min_samples_split': 3, 'min_samples_leaf': 3, 'subsample': 0.7415411156112265, 'max_features': 'sqrt'}. Best is trial 621 with value: 0.2256726988932517.
[I 2024-12-04 12:51:19,701] Trial 1063 finished with value: 0.35122083916410907 and parameters: {'n_estimators': 1017, 'learning_rate': 0.07143273102189285, 'max_depth': 9, 'min_samples_split': 4, 'min_samples_leaf': 3, 'subsample': 0.8630056064804651, 'max_features': 'sqrt'}. Best is trial 621 with value: 0.2256726988932517.
[I 2024-12-04 12:51:19,818] Trial 1054 finished with value: 0.2447072922850013 and parameters: {'n_estimators': 1403, 'learning_rate': 0.09763498690468587, 'max_depth': 8, 'min_samples_split': 8, 'min_samples_leaf': 1, 'subsample': 0.8162279251805583, 'max_features': 'sqrt'}. Best is trial 621 with value: 0.2256726988932517.
[I 2024-12-04 12:51:23,194] Trial 1057 finished with value: 0.24305410532400273 and parameters: {'n_estimators': 1256, 'learning_rate': 0.061214377249145274, 'max_depth': 8, 'min_samples_split': 7, 'min_samples_leaf': 1, 'subsample': 0.8061771455947845, 'max_features': 'sqrt'}. Best is trial 621 with value: 0.2256726988932517.
[I 2024-12-04 12:51:27,336] Trial 1058 finished with value: 0.23164607624294833 and parameters: {'n_estimators': 1284, 'learning_rate': 0.06328814322324666, 'max_depth': 11, 'min_samples_split': 4, 'min_samples_leaf': 1, 'subsample': 0.669933664142079, 'max_features': 'sqrt'}. Best is trial 621 with value: 0.2256726988932517.
[I 2024-12-04 12:51:27,424] Trial 1061 finished with value: 0.25828883518471013 and parameters: {'n_estimators': 1247, 'learning_rate': 0.0933686099137581, 'max_depth': 7, 'min_samples_split': 2, 'min_samples_leaf': 1, 'subsample': 0.8191711641205934, 'max_features': 'sqrt'}. Best is trial 621 with value: 0.2256726988932517.
[I 2024-12-04 12:51:32,793] Trial 1059 finished with value: 0.2321760737743313 and parameters: {'n_estimators': 1409, 'learning_rate': 0.07466149832184191, 'max_depth': 8, 'min_samples_split': 3, 'min_samples_leaf': 1, 'subsample': 0.8814967728218921, 'max_features': 'sqrt'}. Best is trial 621 with value: 0.2256726988932517.
[I 2024-12-04 12:51:34,369] Trial 1060 finished with value: 0.40761442931577474 and parameters: {'n_estimators': 1260, 'learning_rate': 0.011464927681141632, 'max_depth': 10, 'min_samples_split': 20, 'min_samples_leaf': 3, 'subsample': 0.7044351547229966, 'max_features': None}. Best is trial 621 with value: 0.2256726988932517.
[I 2024-12-04 12:51:36,383] Trial 1064 finished with value: 0.2672401717187233 and parameters: {'n_estimators': 1273, 'learning_rate': 0.09812317591947331, 'max_depth': 7, 'min_samples_split': 5, 'min_samples_leaf': 1, 'subsample': 0.7236879842595352, 'max_features': 'sqrt'}. Best is trial 621 with value: 0.2256726988932517.
[I 2024-12-04 12:51:44,202] Trial 1069 finished with value: 0.2657201844475589 and parameters: {'n_estimators': 1142, 'learning_rate': 0.06065742922537457, 'max_depth': 10, 'min_samples_split': 2, 'min_samples_leaf': 1, 'subsample': 0.724880035196852, 'max_features': 'log2'}. Best is trial 621 with value: 0.2256726988932517.
[I 2024-12-04 12:51:46,338] Trial 1066 finished with value: 0.25468942140051654 and parameters: {'n_estimators': 1363, 'learning_rate': 0.09813732668007719, 'max_depth': 6, 'min_samples_split': 6, 'min_samples_leaf': 1, 'subsample': 0.7185462959642495, 'max_features': 'log2'}. Best is trial 621 with value: 0.2256726988932517.
[I 2024-12-04 12:51:53,378] Trial 1071 finished with value: 0.31637101518970534 and parameters: {'n_estimators': 1140, 'learning_rate': 0.07414484762922076, 'max_depth': 7, 'min_samples_split': 4, 'min_samples_leaf': 1, 'subsample': 0.7622761813225503, 'max_features': None}. Best is trial 621 with value: 0.2256726988932517.
[I 2024-12-04 12:51:54,708] Trial 1078 finished with value: 0.2942028727687437 and parameters: {'n_estimators': 953, 'learning_rate': 0.09954161551054619, 'max_depth': 6, 'min_samples_split': 2, 'min_samples_leaf': 2, 'subsample': 0.9444043665250439, 'max_features': 'sqrt'}. Best is trial 621 with value: 0.2256726988932517.
