[I 2024-12-03 19:07:39,492] Trial 1597 finished with value: 0.13651773725292593 and parameters: {'kernel': 'linear', 'C': 89.74009406259827, 'gamma': 0.016384860737820892, 'epsilon': 0.07086882453822738}. Best is trial 345 with value: 0.13438257115663557.
[I 2024-12-03 19:07:39,974] Trial 1574 finished with value: 0.13703232475616328 and parameters: {'kernel': 'linear', 'C': 98.44726010468061, 'gamma': 0.004176822883483632, 'epsilon': 0.044835989812925615}. Best is trial 345 with value: 0.13438257115663557.
[I 2024-12-03 19:07:41,228] Trial 1613 finished with value: 0.13533216563892272 and parameters: {'kernel': 'linear', 'C': 17.902558990272357, 'gamma': 0.0033970684917286873, 'epsilon': 0.029600861760860426}. Best is trial 345 with value: 0.13438257115663557.
[I 2024-12-03 19:07:41,443] Trial 1595 finished with value: 0.13749720899536427 and parameters: {'kernel': 'linear', 'C': 22.379731510787774, 'gamma': 0.008582887997524538, 'epsilon': 0.019532408985634315}. Best is trial 345 with value: 0.13438257115663557.
[I 2024-12-03 19:07:42,115] Trial 1592 finished with value: 0.1379554749458139 and parameters: {'kernel': 'linear', 'C': 28.355710736932352, 'gamma': 0.0024137452760354737, 'epsilon': 0.01712165439922326}. Best is trial 345 with value: 0.13438257115663557.
[I 2024-12-03 19:07:43,890] Trial 1623 finished with value: 0.13880772757067394 and parameters: {'kernel': 'linear', 'C': 1.9015394570406454, 'gamma': 0.01851848897734195, 'epsilon': 0.006844731772449195}. Best is trial 345 with value: 0.13438257115663557.
[I 2024-12-03 19:07:48,840] Trial 1541 finished with value: 0.13815520241512205 and parameters: {'kernel': 'linear', 'C': 92.68635043623405, 'gamma': 0.0011202926489697687, 'epsilon': 0.010592129794479392}. Best is trial 345 with value: 0.13438257115663557.
[I 2024-12-03 19:07:48,881] Trial 1620 finished with value: 0.1383715468114864 and parameters: {'kernel': 'linear', 'C': 6.9145690331262015, 'gamma': 0.001092366345765814, 'epsilon': 0.01777967811004307}. Best is trial 345 with value: 0.13438257115663557.
[I 2024-12-03 19:07:49,869] Trial 1626 finished with value: 0.14883833659947435 and parameters: {'kernel': 'linear', 'C': 60.403079413547715, 'gamma': 0.019030052803216204, 'epsilon': 0.139250901399253}. Best is trial 345 with value: 0.13438257115663557.
[I 2024-12-03 19:07:50,942] Trial 1629 finished with value: 0.16626671633397383 and parameters: {'kernel': 'linear', 'C': 0.4801920027185695, 'gamma': 0.0006562936313958526, 'epsilon': 0.0866678960266733}. Best is trial 345 with value: 0.13438257115663557.
[I 2024-12-03 19:07:52,776] Trial 1621 finished with value: 0.13565790254232016 and parameters: {'kernel': 'linear', 'C': 18.557974751699366, 'gamma': 0.007495437897405668, 'epsilon': 0.03456954932083339}. Best is trial 345 with value: 0.13438257115663557.
[I 2024-12-03 19:07:54,422] Trial 1627 finished with value: 0.16526521640252023 and parameters: {'kernel': 'linear', 'C': 97.35168003718861, 'gamma': 0.007743330645843913, 'epsilon': 0.1754711426461927}. Best is trial 345 with value: 0.13438257115663557.
[I 2024-12-03 19:07:55,694] Trial 1622 finished with value: 0.13678240435272127 and parameters: {'kernel': 'linear', 'C': 25.465921480360517, 'gamma': 0.001169087625390738, 'epsilon': 0.049768307984814346}. Best is trial 345 with value: 0.13438257115663557.
[I 2024-12-03 19:07:56,358] Trial 1632 finished with value: 0.1387048569340894 and parameters: {'kernel': 'linear', 'C': 12.046818860304008, 'gamma': 0.0032039850377336937, 'epsilon': 0.08189794677539475}. Best is trial 345 with value: 0.13438257115663557.
[I 2024-12-03 19:07:56,848] Trial 1635 finished with value: 0.4067111202543614 and parameters: {'kernel': 'poly', 'C': 1.725313561234965, 'gamma': 0.044154481580004054, 'epsilon': 0.3924612190311836}. Best is trial 345 with value: 0.13438257115663557.
[I 2024-12-03 19:07:56,849] Trial 1615 finished with value: 0.13534597620329802 and parameters: {'kernel': 'linear', 'C': 30.81082399422435, 'gamma': 0.021099897009869938, 'epsilon': 0.02845965521922117}. Best is trial 345 with value: 0.13438257115663557.
[I 2024-12-03 19:07:58,665] Trial 1638 finished with value: 1.357531259650028 and parameters: {'kernel': 'rbf', 'C': 0.005781819151403756, 'gamma': 0.0001379202396654963, 'epsilon': 0.01588179588935189}. Best is trial 345 with value: 0.13438257115663557.
[I 2024-12-03 19:08:00,120] Trial 1639 finished with value: 3.8926587223630977 and parameters: {'kernel': 'sigmoid', 'C': 5.477479738977568, 'gamma': 0.0034503451048570957, 'epsilon': 0.10129643556603897}. Best is trial 345 with value: 0.13438257115663557.
[I 2024-12-03 19:08:01,253] Trial 1599 finished with value: 0.13557449455049908 and parameters: {'kernel': 'linear', 'C': 32.7386471150686, 'gamma': 0.03149158846336173, 'epsilon': 0.037034554980836}. Best is trial 345 with value: 0.13438257115663557.
[I 2024-12-03 19:08:01,710] Trial 1637 finished with value: 0.1451940314178896 and parameters: {'kernel': 'linear', 'C': 15.123660467332698, 'gamma': 0.00609657712742753, 'epsilon': 0.12204046554713305}. Best is trial 345 with value: 0.13438257115663557.
[I 2024-12-03 19:08:03,082] Trial 1642 finished with value: 0.4273271740438269 and parameters: {'kernel': 'linear', 'C': 0.0015916738205180715, 'gamma': 0.4335009043548313, 'epsilon': 0.0014835595013124527}. Best is trial 345 with value: 0.13438257115663557.
[I 2024-12-03 19:08:03,894] Trial 1616 finished with value: 0.1373360784694782 and parameters: {'kernel': 'linear', 'C': 99.56152323109848, 'gamma': 0.007378443287924596, 'epsilon': 0.07621575095746083}. Best is trial 345 with value: 0.13438257115663557.
[I 2024-12-03 19:08:04,840] Trial 1628 finished with value: 0.13585727238512063 and parameters: {'kernel': 'linear', 'C': 15.705219401085078, 'gamma': 0.014551919734003254, 'epsilon': 0.03495860204047761}. Best is trial 345 with value: 0.13438257115663557.
[I 2024-12-03 19:08:04,876] Trial 1636 finished with value: 0.1379243389575566 and parameters: {'kernel': 'linear', 'C': 4.276347314841743, 'gamma': 0.010277493522687685, 'epsilon': 0.01756797744417463}. Best is trial 345 with value: 0.13438257115663557.
[I 2024-12-03 19:08:09,046] Trial 1644 finished with value: 0.1409348146230309 and parameters: {'kernel': 'linear', 'C': 21.15070504567186, 'gamma': 0.0013329537040383274, 'epsilon': 0.09143938134088016}. Best is trial 345 with value: 0.13438257115663557.
[I 2024-12-03 19:08:18,682] Trial 1551 finished with value: 0.13567997134063706 and parameters: {'kernel': 'linear', 'C': 94.50339772649374, 'gamma': 0.0014340993462675824, 'epsilon': 0.027030990746289504}. Best is trial 345 with value: 0.13438257115663557.
[I 2024-12-03 19:08:19,460] Trial 1646 finished with value: 0.1362421760741122 and parameters: {'kernel': 'linear', 'C': 24.834515514090818, 'gamma': 0.028362782010022923, 'epsilon': 0.07284858155465461}. Best is trial 345 with value: 0.13438257115663557.
[I 2024-12-03 19:08:20,897] Trial 1649 finished with value: 1.361418061826928 and parameters: {'kernel': 'poly', 'C': 0.0010510128842166854, 'gamma': 0.0015776976402183105, 'epsilon': 0.005655615980841045}. Best is trial 345 with value: 0.13438257115663557.
[I 2024-12-03 19:08:22,728] Trial 1650 finished with value: 0.3722022710833643 and parameters: {'kernel': 'poly', 'C': 47.588666812950265, 'gamma': 0.0121693700097368, 'epsilon': 0.020997043326740284}. Best is trial 345 with value: 0.13438257115663557.
[I 2024-12-03 19:08:23,678] Trial 1601 finished with value: 0.13693921315193688 and parameters: {'kernel': 'linear', 'C': 92.3386979765232, 'gamma': 0.001890585121262077, 'epsilon': 0.044666511653143955}. Best is trial 345 with value: 0.13438257115663557.
[I 2024-12-03 19:08:25,771] Trial 1648 finished with value: 0.13740931748503674 and parameters: {'kernel': 'linear', 'C': 4.8395130539356925, 'gamma': 0.0029567243644579525, 'epsilon': 0.020689632874694757}. Best is trial 345 with value: 0.13438257115663557.
[I 2024-12-03 19:08:25,913] Trial 1624 finished with value: 0.13809890387699295 and parameters: {'kernel': 'linear', 'C': 29.36637941004694, 'gamma': 0.0319280455965639, 'epsilon': 0.011633286871646588}. Best is trial 345 with value: 0.13438257115663557.
[I 2024-12-03 19:08:30,864] Trial 1582 finished with value: 0.1379640027243682 and parameters: {'kernel': 'linear', 'C': 76.58089430886228, 'gamma': 0.0027268629586853052, 'epsilon': 0.004875582078072384}. Best is trial 345 with value: 0.13438257115663557.
[I 2024-12-03 19:08:31,989] Trial 1630 finished with value: 0.13617486272139093 and parameters: {'kernel': 'linear', 'C': 21.08439985152192, 'gamma': 0.003343042036405571, 'epsilon': 0.02497235293748349}. Best is trial 345 with value: 0.13438257115663557.
[I 2024-12-03 19:08:32,507] Trial 1651 finished with value: 0.13641355413870906 and parameters: {'kernel': 'linear', 'C': 16.55366600184265, 'gamma': 0.011756810397823293, 'epsilon': 0.043257387825118}. Best is trial 345 with value: 0.13438257115663557.
[I 2024-12-03 19:08:36,108] Trial 1588 finished with value: 0.13564411532263593 and parameters: {'kernel': 'linear', 'C': 99.68952824344053, 'gamma': 0.0015452891939993372, 'epsilon': 0.0534007014664494}. Best is trial 345 with value: 0.13438257115663557.
[I 2024-12-03 19:08:37,061] Trial 1658 finished with value: 0.3901355884353546 and parameters: {'kernel': 'rbf', 'C': 15.545751181405688, 'gamma': 0.0036118125701584385, 'epsilon': 0.875446356047532}. Best is trial 345 with value: 0.13438257115663557.
[I 2024-12-03 19:08:42,316] Trial 1653 finished with value: 0.1351984349475479 and parameters: {'kernel': 'linear', 'C': 22.937875824702935, 'gamma': 0.0007001422914930888, 'epsilon': 0.040759630428741554}. Best is trial 345 with value: 0.13438257115663557.
[I 2024-12-03 19:08:43,484] Trial 1610 finished with value: 0.1351477547170976 and parameters: {'kernel': 'linear', 'C': 93.39241941814518, 'gamma': 0.004621773353356325, 'epsilon': 0.038839445907735234}. Best is trial 345 with value: 0.13438257115663557.
[I 2024-12-03 19:08:43,996] Trial 1654 finished with value: 0.1355394323483026 and parameters: {'kernel': 'linear', 'C': 17.022930392655642, 'gamma': 0.002886939457217595, 'epsilon': 0.02787548474036016}. Best is trial 345 with value: 0.13438257115663557.
[I 2024-12-03 19:08:45,196] Trial 1660 finished with value: 0.1432820424635052 and parameters: {'kernel': 'linear', 'C': 12.361837442424745, 'gamma': 0.00726993606671079, 'epsilon': 0.11494550376143052}. Best is trial 345 with value: 0.13438257115663557.
[I 2024-12-03 19:08:45,198] Trial 1662 finished with value: 1.090127755374219 and parameters: {'kernel': 'poly', 'C': 4.035633688166131, 'gamma': 0.0023302630514060903, 'epsilon': 0.05516316231771623}. Best is trial 345 with value: 0.13438257115663557.
[I 2024-12-03 19:08:46,604] Trial 1634 finished with value: 0.13808885087058412 and parameters: {'kernel': 'linear', 'C': 33.81753570737568, 'gamma': 0.0071009821137317155, 'epsilon': 0.007392096112079379}. Best is trial 345 with value: 0.13438257115663557.
[I 2024-12-03 19:08:46,641] Trial 1663 finished with value: 0.2202666707212457 and parameters: {'kernel': 'linear', 'C': 4.5291281568154185, 'gamma': 0.0009333043850912086, 'epsilon': 0.28827064556578974}. Best is trial 345 with value: 0.13438257115663557.
[I 2024-12-03 19:08:47,802] Trial 1661 finished with value: 0.13637606839266014 and parameters: {'kernel': 'linear', 'C': 5.136495562396317, 'gamma': 0.004900475087392355, 'epsilon': 0.04545100445627954}. Best is trial 345 with value: 0.13438257115663557.
[I 2024-12-03 19:08:47,805] Trial 1664 finished with value: 0.19302944136872588 and parameters: {'kernel': 'linear', 'C': 35.221831078455224, 'gamma': 0.0937319298502682, 'epsilon': 0.2448990833970406}. Best is trial 345 with value: 0.13438257115663557.
[I 2024-12-03 19:08:48,909] Trial 1666 finished with value: 0.16958195587025876 and parameters: {'kernel': 'linear', 'C': 0.2811539984551851, 'gamma': 0.004439242935604419, 'epsilon': 0.01002867575836503}. Best is trial 345 with value: 0.13438257115663557.
[I 2024-12-03 19:08:49,038] Trial 1605 finished with value: 0.13594669352370697 and parameters: {'kernel': 'linear', 'C': 95.81101435180815, 'gamma': 0.01062951469642986, 'epsilon': 0.02521439563627997}. Best is trial 345 with value: 0.13438257115663557.
[I 2024-12-03 19:08:49,413] Trial 1667 finished with value: 7.561367082037943 and parameters: {'kernel': 'sigmoid', 'C': 89.65233263042984, 'gamma': 0.001494592980312472, 'epsilon': 0.040165453798849886}. Best is trial 345 with value: 0.13438257115663557.
[I 2024-12-03 19:08:49,861] Trial 1600 finished with value: 0.13809330675598397 and parameters: {'kernel': 'linear', 'C': 92.35851647132458, 'gamma': 0.0013664131658057857, 'epsilon': 0.010136058375899542}. Best is trial 345 with value: 0.13438257115663557.
[I 2024-12-03 19:08:51,157] Trial 1611 finished with value: 0.13508869137307844 and parameters: {'kernel': 'linear', 'C': 94.3563297149962, 'gamma': 0.001334799021114525, 'epsilon': 0.03970653939151392}. Best is trial 345 with value: 0.13438257115663557.
[I 2024-12-03 19:08:51,936] Trial 1670 finished with value: 0.15842293726151946 and parameters: {'kernel': 'linear', 'C': 0.4256337125768114, 'gamma': 0.00030002217365909274, 'epsilon': 0.0014816553481244814}. Best is trial 345 with value: 0.13438257115663557.
[I 2024-12-03 19:08:51,937] Trial 1672 finished with value: 0.18070629693638893 and parameters: {'kernel': 'rbf', 'C': 13.273244237316284, 'gamma': 0.004406214994172864, 'epsilon': 0.03333233956530723}. Best is trial 345 with value: 0.13438257115663557.
[I 2024-12-03 19:08:53,216] Trial 1655 finished with value: 0.13575540219486273 and parameters: {'kernel': 'linear', 'C': 24.43047711885783, 'gamma': 0.0009444409229514826, 'epsilon': 0.026937818719924084}. Best is trial 345 with value: 0.13438257115663557.
[I 2024-12-03 19:08:53,778] Trial 1674 finished with value: 1.1169767829297668 and parameters: {'kernel': 'rbf', 'C': 0.1587686375960769, 'gamma': 0.0003131241430197891, 'epsilon': 0.0016672313748830082}. Best is trial 345 with value: 0.13438257115663557.
[I 2024-12-03 19:08:53,780] Trial 1675 finished with value: 1.1651397805667314 and parameters: {'kernel': 'sigmoid', 'C': 0.5108897329294517, 'gamma': 0.00014863123627260663, 'epsilon': 0.0026222291750021788}. Best is trial 345 with value: 0.13438257115663557.
[I 2024-12-03 19:08:58,396] Trial 1657 finished with value: 0.13562416645943984 and parameters: {'kernel': 'linear', 'C': 19.8321587787797, 'gamma': 0.016391629651233246, 'epsilon': 0.03739171187201033}. Best is trial 345 with value: 0.13438257115663557.
[I 2024-12-03 19:08:58,398] Trial 1589 finished with value: 0.13809324040839596 and parameters: {'kernel': 'linear', 'C': 79.63017378398587, 'gamma': 0.0010214701903469487, 'epsilon': 0.010068130116130992}. Best is trial 345 with value: 0.13438257115663557.
[I 2024-12-03 19:08:59,944] Trial 1679 finished with value: 1.1234170288451504 and parameters: {'kernel': 'rbf', 'C': 0.04394869670012555, 'gamma': 0.0013218250632445131, 'epsilon': 0.03165596701955327}. Best is trial 345 with value: 0.13438257115663557.
[I 2024-12-03 19:08:59,983] Trial 1680 finished with value: 11.138227511684574 and parameters: {'kernel': 'sigmoid', 'C': 2.7483113083152073, 'gamma': 0.008008238836986434, 'epsilon': 0.015003372567245854}. Best is trial 345 with value: 0.13438257115663557.
[I 2024-12-03 19:09:01,247] Trial 1677 finished with value: 0.14484457119237504 and parameters: {'kernel': 'linear', 'C': 30.40547382352431, 'gamma': 0.011528883287026018, 'epsilon': 0.12075828188736625}. Best is trial 345 with value: 0.13438257115663557.
[I 2024-12-03 19:09:01,249] Trial 1668 finished with value: 0.138375401047552 and parameters: {'kernel': 'linear', 'C': 12.803165221458283, 'gamma': 0.0065981739932808965, 'epsilon': 0.010455047888431027}. Best is trial 345 with value: 0.13438257115663557.
[I 2024-12-03 19:09:02,513] Trial 1673 finished with value: 0.1361719436929431 and parameters: {'kernel': 'linear', 'C': 13.84270363315633, 'gamma': 0.0008040903048855054, 'epsilon': 0.05426805993421736}. Best is trial 345 with value: 0.13438257115663557.
[I 2024-12-03 19:09:03,853] Trial 1681 finished with value: 0.18781755722751356 and parameters: {'kernel': 'linear', 'C': 34.71516263861878, 'gamma': 0.0008165648365387223, 'epsilon': 0.22284054029431333}. Best is trial 345 with value: 0.13438257115663557.
[I 2024-12-03 19:09:05,240] Trial 1686 finished with value: 0.15662518035862721 and parameters: {'kernel': 'rbf', 'C': 97.93159189547347, 'gamma': 0.003541963003937865, 'epsilon': 0.0815376827662577}. Best is trial 345 with value: 0.13438257115663557.
[I 2024-12-03 19:09:06,267] Trial 1684 finished with value: 0.13808785345880403 and parameters: {'kernel': 'linear', 'C': 2.3128379651216338, 'gamma': 0.0023519748470229953, 'epsilon': 0.01161847442041441}. Best is trial 345 with value: 0.13438257115663557.
[I 2024-12-03 19:09:06,793] Trial 1640 finished with value: 0.13665916361333774 and parameters: {'kernel': 'linear', 'C': 98.09053371058711, 'gamma': 0.010106622420783612, 'epsilon': 0.04386219403973759}. Best is trial 345 with value: 0.13438257115663557.
[I 2024-12-03 19:09:07,638] Trial 1688 finished with value: 6.336851929010155 and parameters: {'kernel': 'sigmoid', 'C': 0.37206273592310535, 'gamma': 0.07080745972901117, 'epsilon': 0.007967842406513487}. Best is trial 345 with value: 0.13438257115663557.
[I 2024-12-03 19:09:08,455] Trial 1689 finished with value: 1.320643216887544 and parameters: {'kernel': 'poly', 'C': 0.006784110937692729, 'gamma': 0.00396308621382785, 'epsilon': 0.03414263926235376}. Best is trial 345 with value: 0.13438257115663557.
[I 2024-12-03 19:09:10,189] Trial 1625 finished with value: 0.13721575742976394 and parameters: {'kernel': 'linear', 'C': 93.18184249484136, 'gamma': 0.001843544028802923, 'epsilon': 0.018822282456079985}. Best is trial 345 with value: 0.13438257115663557.
[I 2024-12-03 19:09:10,341] Trial 1669 finished with value: 0.1378328598999729 and parameters: {'kernel': 'linear', 'C': 20.80519084580471, 'gamma': 0.019042844987986633, 'epsilon': 0.013510053442485825}. Best is trial 345 with value: 0.13438257115663557.
[I 2024-12-03 19:09:11,124] Trial 1678 finished with value: 0.13508684535880064 and parameters: {'kernel': 'linear', 'C': 24.95723459627838, 'gamma': 0.0041651501314613325, 'epsilon': 0.06306238197078552}. Best is trial 345 with value: 0.13438257115663557.
[I 2024-12-03 19:09:11,548] Trial 1676 finished with value: 0.13808990678280064 and parameters: {'kernel': 'linear', 'C': 61.69871009914434, 'gamma': 0.0862631090817904, 'epsilon': 0.07979901778320714}. Best is trial 345 with value: 0.13438257115663557.
[I 2024-12-03 19:09:11,748] Trial 1693 finished with value: 0.7283296098204838 and parameters: {'kernel': 'poly', 'C': 45.72708891724713, 'gamma': 0.000590917461889839, 'epsilon': 0.8018836414133226}. Best is trial 345 with value: 0.13438257115663557.
[I 2024-12-03 19:09:16,639] Trial 1692 finished with value: 0.1350222302628699 and parameters: {'kernel': 'linear', 'C': 14.69012953854869, 'gamma': 0.004378306289487129, 'epsilon': 0.06337780560447288}. Best is trial 345 with value: 0.13438257115663557.
[I 2024-12-03 19:09:19,521] Trial 929 finished with value: 0.3476197659459467 and parameters: {'kernel': 'poly', 'C': 9.495226301349945, 'gamma': 0.25906167778373773, 'epsilon': 0.09003852911534367}. Best is trial 345 with value: 0.13438257115663557.
[I 2024-12-03 19:09:21,363] Trial 1647 finished with value: 0.1351142798027247 and parameters: {'kernel': 'linear', 'C': 90.31203153418608, 'gamma': 0.002762650605765413, 'epsilon': 0.06438094820193131}. Best is trial 345 with value: 0.13438257115663557.
[I 2024-12-03 19:09:22,087] Trial 1683 finished with value: 0.13538921177579596 and parameters: {'kernel': 'linear', 'C': 21.260838839268203, 'gamma': 0.023107428050473305, 'epsilon': 0.03207911607184989}. Best is trial 345 with value: 0.13438257115663557.
[I 2024-12-03 19:09:22,945] Trial 1685 finished with value: 0.13557080425447504 and parameters: {'kernel': 'linear', 'C': 18.517940408510643, 'gamma': 0.0013383270685180671, 'epsilon': 0.028114032810828585}. Best is trial 345 with value: 0.13438257115663557.
[I 2024-12-03 19:09:23,771] Trial 1682 finished with value: 0.1365225883274952 and parameters: {'kernel': 'linear', 'C': 21.31571544809744, 'gamma': 0.004804884992158334, 'epsilon': 0.02629758222630023}. Best is trial 345 with value: 0.13438257115663557.
[I 2024-12-03 19:09:24,741] Trial 1701 finished with value: 0.14823064633637187 and parameters: {'kernel': 'linear', 'C': 4.697672199162697, 'gamma': 0.011521726807465639, 'epsilon': 0.11163806276688999}. Best is trial 345 with value: 0.13438257115663557.
[I 2024-12-03 19:09:25,007] Trial 1696 finished with value: 0.13854444113003322 and parameters: {'kernel': 'linear', 'C': 10.960646669136066, 'gamma': 0.058501721226354254, 'epsilon': 0.016674582248296918}. Best is trial 345 with value: 0.13438257115663557.
[I 2024-12-03 19:09:25,404] Trial 1702 finished with value: 0.3854014933906461 and parameters: {'kernel': 'poly', 'C': 24.01590895080399, 'gamma': 0.009443238732745989, 'epsilon': 0.05843577639780623}. Best is trial 345 with value: 0.13438257115663557.
[I 2024-12-03 19:09:26,563] Trial 1694 finished with value: 0.1358639069663409 and parameters: {'kernel': 'linear', 'C': 23.73837106114943, 'gamma': 0.02511589638767275, 'epsilon': 0.0685259101413214}. Best is trial 345 with value: 0.13438257115663557.
[I 2024-12-03 19:09:26,615] Trial 1687 finished with value: 0.13854531749415996 and parameters: {'kernel': 'linear', 'C': 14.039376800749544, 'gamma': 0.0013507019596989828, 'epsilon': 0.011670524529453165}. Best is trial 345 with value: 0.13438257115663557.
