[I 2024-12-04 12:48:44,567] Trial 1746 finished with value: 0.3747233646354974 and parameters: {'n_estimators': 737, 'learning_rate': 0.08157811370758951, 'max_depth': 6, 'min_samples_split': 3, 'min_samples_leaf': 1, 'subsample': 0.6133432589260391, 'max_features': None}. Best is trial 1454 with value: 0.30763307678022894.
[I 2024-12-04 12:48:44,991] Trial 1748 finished with value: 0.34251343029375847 and parameters: {'n_estimators': 605, 'learning_rate': 0.09218744919446903, 'max_depth': 6, 'min_samples_split': 4, 'min_samples_leaf': 2, 'subsample': 0.7090567886219573, 'max_features': None}. Best is trial 1454 with value: 0.30763307678022894.
[I 2024-12-04 12:48:45,925] Trial 1735 finished with value: 0.321217872052028 and parameters: {'n_estimators': 1308, 'learning_rate': 0.05748057412433084, 'max_depth': 6, 'min_samples_split': 5, 'min_samples_leaf': 2, 'subsample': 0.7412828786646458, 'max_features': None}. Best is trial 1454 with value: 0.30763307678022894.
[I 2024-12-04 12:48:47,600] Trial 1754 finished with value: 0.3377254726274509 and parameters: {'n_estimators': 598, 'learning_rate': 0.07825745350218087, 'max_depth': 6, 'min_samples_split': 2, 'min_samples_leaf': 2, 'subsample': 0.6799392271923246, 'max_features': None}. Best is trial 1454 with value: 0.30763307678022894.
[I 2024-12-04 12:48:47,601] Trial 1752 finished with value: 0.7171068840250746 and parameters: {'n_estimators': 671, 'learning_rate': 0.04735752947509304, 'max_depth': 11, 'min_samples_split': 2, 'min_samples_leaf': 10, 'subsample': 0.9424156457334477, 'max_features': 'log2'}. Best is trial 1454 with value: 0.30763307678022894.
[I 2024-12-04 12:48:47,605] Trial 1737 finished with value: 0.3363991498085873 and parameters: {'n_estimators': 1262, 'learning_rate': 0.057938968930905485, 'max_depth': 8, 'min_samples_split': 2, 'min_samples_leaf': 2, 'subsample': 0.7242453076271623, 'max_features': None}. Best is trial 1454 with value: 0.30763307678022894.
[I 2024-12-04 12:48:49,713] Trial 1743 finished with value: 0.3907228600974943 and parameters: {'n_estimators': 974, 'learning_rate': 0.05762253086133557, 'max_depth': 5, 'min_samples_split': 6, 'min_samples_leaf': 1, 'subsample': 0.7365057651365259, 'max_features': None}. Best is trial 1454 with value: 0.30763307678022894.
[I 2024-12-04 12:48:50,700] Trial 1755 finished with value: 0.3395384140923928 and parameters: {'n_estimators': 563, 'learning_rate': 0.05725584670379007, 'max_depth': 8, 'min_samples_split': 4, 'min_samples_leaf': 2, 'subsample': 0.7302052458510154, 'max_features': None}. Best is trial 1454 with value: 0.30763307678022894.
[I 2024-12-04 12:48:52,661] Trial 1736 finished with value: 0.38513755620828616 and parameters: {'n_estimators': 1397, 'learning_rate': 0.0964729816066664, 'max_depth': 6, 'min_samples_split': 2, 'min_samples_leaf': 6, 'subsample': 0.9475689384654038, 'max_features': None}. Best is trial 1454 with value: 0.30763307678022894.
[I 2024-12-04 12:48:53,615] Trial 1770 finished with value: 0.8537702957601121 and parameters: {'n_estimators': 222, 'learning_rate': 0.025534994400763567, 'max_depth': 7, 'min_samples_split': 7, 'min_samples_leaf': 3, 'subsample': 0.6563343605193293, 'max_features': 'log2'}. Best is trial 1454 with value: 0.30763307678022894.
[I 2024-12-04 12:48:53,620] Trial 1759 finished with value: 0.4504206546295033 and parameters: {'n_estimators': 544, 'learning_rate': 0.010863132989631515, 'max_depth': 6, 'min_samples_split': 3, 'min_samples_leaf': 5, 'subsample': 0.9626708151850616, 'max_features': None}. Best is trial 1454 with value: 0.30763307678022894.
[I 2024-12-04 12:48:55,102] Trial 1760 finished with value: 0.3794213616410446 and parameters: {'n_estimators': 516, 'learning_rate': 0.08332503228350821, 'max_depth': 10, 'min_samples_split': 2, 'min_samples_leaf': 1, 'subsample': 0.619740797552115, 'max_features': None}. Best is trial 1454 with value: 0.30763307678022894.
[I 2024-12-04 12:48:55,115] Trial 1753 finished with value: 0.3270234527160683 and parameters: {'n_estimators': 788, 'learning_rate': 0.08207807987969555, 'max_depth': 7, 'min_samples_split': 4, 'min_samples_leaf': 2, 'subsample': 0.740060535060774, 'max_features': None}. Best is trial 1454 with value: 0.30763307678022894.
[I 2024-12-04 12:48:55,318] Trial 1749 finished with value: 0.37309229128396787 and parameters: {'n_estimators': 934, 'learning_rate': 0.09817849556509711, 'max_depth': 8, 'min_samples_split': 3, 'min_samples_leaf': 1, 'subsample': 0.6412150301152946, 'max_features': None}. Best is trial 1454 with value: 0.30763307678022894.
[I 2024-12-04 12:48:58,272] Trial 1750 finished with value: 0.6182933725094508 and parameters: {'n_estimators': 1221, 'learning_rate': 0.02228452549377908, 'max_depth': 8, 'min_samples_split': 11, 'min_samples_leaf': 10, 'subsample': 0.6488190052962671, 'max_features': 'sqrt'}. Best is trial 1454 with value: 0.30763307678022894.
[I 2024-12-04 12:48:58,487] Trial 1763 finished with value: 0.32422761037838005 and parameters: {'n_estimators': 591, 'learning_rate': 0.06823118196862794, 'max_depth': 8, 'min_samples_split': 3, 'min_samples_leaf': 2, 'subsample': 0.6829957546303043, 'max_features': None}. Best is trial 1454 with value: 0.30763307678022894.
[I 2024-12-04 12:48:58,488] Trial 1747 finished with value: 0.37840011083632535 and parameters: {'n_estimators': 1055, 'learning_rate': 0.09467912565819507, 'max_depth': 8, 'min_samples_split': 2, 'min_samples_leaf': 1, 'subsample': 0.8401495502018207, 'max_features': None}. Best is trial 1454 with value: 0.30763307678022894.
[I 2024-12-04 12:49:01,714] Trial 1751 finished with value: 0.3950593931433113 and parameters: {'n_estimators': 1040, 'learning_rate': 0.09701945150428835, 'max_depth': 7, 'min_samples_split': 6, 'min_samples_leaf': 3, 'subsample': 0.6655869058578118, 'max_features': None}. Best is trial 1454 with value: 0.30763307678022894.
[I 2024-12-04 12:49:02,270] Trial 1757 finished with value: 0.3982394369471165 and parameters: {'n_estimators': 928, 'learning_rate': 0.07388788463854014, 'max_depth': 7, 'min_samples_split': 2, 'min_samples_leaf': 1, 'subsample': 0.673750612780493, 'max_features': None}. Best is trial 1454 with value: 0.30763307678022894.
[I 2024-12-04 12:49:02,503] Trial 1766 finished with value: 0.38825604666227836 and parameters: {'n_estimators': 517, 'learning_rate': 0.09063539675626, 'max_depth': 9, 'min_samples_split': 3, 'min_samples_leaf': 3, 'subsample': 0.7133665450335674, 'max_features': None}. Best is trial 1454 with value: 0.30763307678022894.
[I 2024-12-04 12:49:02,955] Trial 1756 finished with value: 0.42058903144756293 and parameters: {'n_estimators': 999, 'learning_rate': 0.04895563936417824, 'max_depth': 3, 'min_samples_split': 2, 'min_samples_leaf': 3, 'subsample': 0.6877258000705627, 'max_features': None}. Best is trial 1454 with value: 0.30763307678022894.
[I 2024-12-04 12:49:03,490] Trial 1761 finished with value: 0.39418337312865936 and parameters: {'n_estimators': 893, 'learning_rate': 0.08672257561158522, 'max_depth': 6, 'min_samples_split': 10, 'min_samples_leaf': 2, 'subsample': 0.6528480645711257, 'max_features': 'sqrt'}. Best is trial 1454 with value: 0.30763307678022894.
[I 2024-12-04 12:49:05,041] Trial 1765 finished with value: 0.37282512535093393 and parameters: {'n_estimators': 702, 'learning_rate': 0.09832307776339107, 'max_depth': 8, 'min_samples_split': 5, 'min_samples_leaf': 3, 'subsample': 0.7012810988607571, 'max_features': None}. Best is trial 1454 with value: 0.30763307678022894.
[I 2024-12-04 12:49:12,069] Trial 1781 finished with value: 0.5493530254909134 and parameters: {'n_estimators': 461, 'learning_rate': 0.012626978943358515, 'max_depth': 7, 'min_samples_split': 17, 'min_samples_leaf': 1, 'subsample': 0.9794882582363258, 'max_features': 'sqrt'}. Best is trial 1454 with value: 0.30763307678022894.
[I 2024-12-04 12:49:12,276] Trial 1767 finished with value: 0.4011772785704427 and parameters: {'n_estimators': 1016, 'learning_rate': 0.07506111258761522, 'max_depth': 8, 'min_samples_split': 2, 'min_samples_leaf': 1, 'subsample': 0.7783556460194858, 'max_features': 'sqrt'}. Best is trial 1454 with value: 0.30763307678022894.
[I 2024-12-04 12:49:14,383] Trial 1768 finished with value: 0.3837516877890934 and parameters: {'n_estimators': 921, 'learning_rate': 0.09968321284658335, 'max_depth': 7, 'min_samples_split': 2, 'min_samples_leaf': 3, 'subsample': 0.639764862915168, 'max_features': None}. Best is trial 1454 with value: 0.30763307678022894.
[I 2024-12-04 12:49:16,113] Trial 1773 finished with value: 0.31768574866459587 and parameters: {'n_estimators': 789, 'learning_rate': 0.06769396862268277, 'max_depth': 7, 'min_samples_split': 2, 'min_samples_leaf': 2, 'subsample': 0.6894904626430666, 'max_features': None}. Best is trial 1454 with value: 0.30763307678022894.
[I 2024-12-04 12:49:18,131] Trial 1774 finished with value: 0.3905779107218575 and parameters: {'n_estimators': 773, 'learning_rate': 0.07502625302412726, 'max_depth': 9, 'min_samples_split': 2, 'min_samples_leaf': 3, 'subsample': 0.7369687339424815, 'max_features': None}. Best is trial 1454 with value: 0.30763307678022894.
[I 2024-12-04 12:49:18,141] Trial 1775 finished with value: 0.39877201690523995 and parameters: {'n_estimators': 741, 'learning_rate': 0.09016567474760563, 'max_depth': 7, 'min_samples_split': 2, 'min_samples_leaf': 1, 'subsample': 0.6333882645338362, 'max_features': None}. Best is trial 1454 with value: 0.30763307678022894.
[I 2024-12-04 12:49:18,143] Trial 1780 finished with value: 0.6815702058492672 and parameters: {'n_estimators': 726, 'learning_rate': 0.023924584145304077, 'max_depth': 9, 'min_samples_split': 11, 'min_samples_leaf': 6, 'subsample': 0.9604602571331975, 'max_features': 'log2'}. Best is trial 1454 with value: 0.30763307678022894.
[I 2024-12-04 12:49:19,089] Trial 1785 finished with value: 0.44664635214699777 and parameters: {'n_estimators': 540, 'learning_rate': 0.05096545145629945, 'max_depth': 6, 'min_samples_split': 2, 'min_samples_leaf': 5, 'subsample': 0.6650587993576299, 'max_features': 'sqrt'}. Best is trial 1454 with value: 0.30763307678022894.
[I 2024-12-04 12:49:19,482] Trial 1779 finished with value: 0.4982356771401082 and parameters: {'n_estimators': 839, 'learning_rate': 0.04889997660914139, 'max_depth': 6, 'min_samples_split': 2, 'min_samples_leaf': 3, 'subsample': 0.6655237129457583, 'max_features': 'log2'}. Best is trial 1454 with value: 0.30763307678022894.
[I 2024-12-04 12:49:21,062] Trial 1769 finished with value: 0.3467947128199061 and parameters: {'n_estimators': 979, 'learning_rate': 0.06971214069894467, 'max_depth': 7, 'min_samples_split': 8, 'min_samples_leaf': 2, 'subsample': 0.7320635554667322, 'max_features': None}. Best is trial 1454 with value: 0.30763307678022894.
[I 2024-12-04 12:49:22,142] Trial 1771 finished with value: 0.37142096975677247 and parameters: {'n_estimators': 1041, 'learning_rate': 0.051291752014240424, 'max_depth': 6, 'min_samples_split': 2, 'min_samples_leaf': 4, 'subsample': 0.8020287838635681, 'max_features': None}. Best is trial 1454 with value: 0.30763307678022894.
[I 2024-12-04 12:49:22,391] Trial 1758 finished with value: 0.3220462289330665 and parameters: {'n_estimators': 1442, 'learning_rate': 0.08988803297637314, 'max_depth': 6, 'min_samples_split': 2, 'min_samples_leaf': 2, 'subsample': 0.6019630202143246, 'max_features': None}. Best is trial 1454 with value: 0.30763307678022894.
[I 2024-12-04 12:49:23,665] Trial 1772 finished with value: 0.5865640170748329 and parameters: {'n_estimators': 1194, 'learning_rate': 0.08357191698069179, 'max_depth': 12, 'min_samples_split': 13, 'min_samples_leaf': 9, 'subsample': 0.6508329490098832, 'max_features': 'sqrt'}. Best is trial 1454 with value: 0.30763307678022894.
[I 2024-12-04 12:49:24,743] Trial 1777 finished with value: 0.3659749968027915 and parameters: {'n_estimators': 817, 'learning_rate': 0.059388244981709255, 'max_depth': 7, 'min_samples_split': 2, 'min_samples_leaf': 1, 'subsample': 0.8241767259638486, 'max_features': None}. Best is trial 1454 with value: 0.30763307678022894.
[I 2024-12-04 12:49:24,789] Trial 1764 finished with value: 0.3732924713959561 and parameters: {'n_estimators': 1247, 'learning_rate': 0.04682023031307422, 'max_depth': 7, 'min_samples_split': 7, 'min_samples_leaf': 4, 'subsample': 0.6236680254116773, 'max_features': None}. Best is trial 1454 with value: 0.30763307678022894.
[I 2024-12-04 12:49:28,482] Trial 1782 finished with value: 0.6063716119356584 and parameters: {'n_estimators': 982, 'learning_rate': 0.012316239672110919, 'max_depth': 4, 'min_samples_split': 15, 'min_samples_leaf': 6, 'subsample': 0.6755571865003813, 'max_features': 'sqrt'}. Best is trial 1454 with value: 0.30763307678022894.
[I 2024-12-04 12:49:29,268] Trial 1762 finished with value: 0.4185020860397536 and parameters: {'n_estimators': 1469, 'learning_rate': 0.08746819225210128, 'max_depth': 8, 'min_samples_split': 2, 'min_samples_leaf': 1, 'subsample': 0.858484999488931, 'max_features': None}. Best is trial 1454 with value: 0.30763307678022894.
[I 2024-12-04 12:49:29,273] Trial 1790 finished with value: 0.46361352345514134 and parameters: {'n_estimators': 743, 'learning_rate': 0.09843160303788885, 'max_depth': 7, 'min_samples_split': 4, 'min_samples_leaf': 3, 'subsample': 0.7411491635174238, 'max_features': 'log2'}. Best is trial 1454 with value: 0.30763307678022894.
[I 2024-12-04 12:49:30,395] Trial 1776 finished with value: 0.39031426837991795 and parameters: {'n_estimators': 1067, 'learning_rate': 0.0698896862242428, 'max_depth': 9, 'min_samples_split': 2, 'min_samples_leaf': 3, 'subsample': 0.8042028320159367, 'max_features': None}. Best is trial 1454 with value: 0.30763307678022894.
[I 2024-12-04 12:49:30,395] Trial 1789 finished with value: 0.339655594910188 and parameters: {'n_estimators': 583, 'learning_rate': 0.09948307882463064, 'max_depth': 7, 'min_samples_split': 5, 'min_samples_leaf': 2, 'subsample': 0.6584398101584787, 'max_features': None}. Best is trial 1454 with value: 0.30763307678022894.
[I 2024-12-04 12:49:31,149] Trial 1784 finished with value: 0.3172152867866541 and parameters: {'n_estimators': 857, 'learning_rate': 0.09875684562745975, 'max_depth': 7, 'min_samples_split': 3, 'min_samples_leaf': 2, 'subsample': 0.6914394065651579, 'max_features': None}. Best is trial 1454 with value: 0.30763307678022894.
[I 2024-12-04 12:49:31,273] Trial 1778 finished with value: 0.3305784784306373 and parameters: {'n_estimators': 1052, 'learning_rate': 0.05514957922964054, 'max_depth': 7, 'min_samples_split': 2, 'min_samples_leaf': 2, 'subsample': 0.6997096717342883, 'max_features': None}. Best is trial 1454 with value: 0.30763307678022894.
[I 2024-12-04 12:49:32,977] Trial 1798 finished with value: 0.3587754751459129 and parameters: {'n_estimators': 528, 'learning_rate': 0.08549249734362324, 'max_depth': 4, 'min_samples_split': 2, 'min_samples_leaf': 2, 'subsample': 0.7474891607675861, 'max_features': None}. Best is trial 1454 with value: 0.30763307678022894.
[I 2024-12-04 12:49:37,330] Trial 1802 finished with value: 0.5349638676635756 and parameters: {'n_estimators': 478, 'learning_rate': 0.03158991439529751, 'max_depth': 6, 'min_samples_split': 19, 'min_samples_leaf': 1, 'subsample': 0.9850424680165532, 'max_features': 'log2'}. Best is trial 1454 with value: 0.30763307678022894.
[I 2024-12-04 12:49:37,340] Trial 1792 finished with value: 0.444104340759648 and parameters: {'n_estimators': 940, 'learning_rate': 0.08064857939288549, 'max_depth': 5, 'min_samples_split': 4, 'min_samples_leaf': 1, 'subsample': 0.7816414784314509, 'max_features': 'log2'}. Best is trial 1454 with value: 0.30763307678022894.
[I 2024-12-04 12:49:38,603] Trial 1786 finished with value: 0.3764787136040294 and parameters: {'n_estimators': 1030, 'learning_rate': 0.06006116550456668, 'max_depth': 6, 'min_samples_split': 5, 'min_samples_leaf': 4, 'subsample': 0.7105345574284647, 'max_features': None}. Best is trial 1454 with value: 0.30763307678022894.
[I 2024-12-04 12:49:39,551] Trial 1801 finished with value: 0.35313320760639133 and parameters: {'n_estimators': 487, 'learning_rate': 0.03955983383460839, 'max_depth': 7, 'min_samples_split': 2, 'min_samples_leaf': 2, 'subsample': 0.7002536928132829, 'max_features': None}. Best is trial 1454 with value: 0.30763307678022894.
[I 2024-12-04 12:49:39,963] Trial 1797 finished with value: 0.5380092289664675 and parameters: {'n_estimators': 741, 'learning_rate': 0.09142582262717452, 'max_depth': 5, 'min_samples_split': 10, 'min_samples_leaf': 9, 'subsample': 0.904827094703399, 'max_features': None}. Best is trial 1454 with value: 0.30763307678022894.
[I 2024-12-04 12:49:40,358] Trial 1799 finished with value: 0.36541499939293687 and parameters: {'n_estimators': 698, 'learning_rate': 0.0980938742709282, 'max_depth': 6, 'min_samples_split': 2, 'min_samples_leaf': 4, 'subsample': 0.6705301420321793, 'max_features': None}. Best is trial 1454 with value: 0.30763307678022894.
[I 2024-12-04 12:49:44,066] Trial 1783 finished with value: 0.39376107363649576 and parameters: {'n_estimators': 1179, 'learning_rate': 0.07890430234432913, 'max_depth': 6, 'min_samples_split': 6, 'min_samples_leaf': 3, 'subsample': 0.6816443915330739, 'max_features': None}. Best is trial 1454 with value: 0.30763307678022894.
[I 2024-12-04 12:49:44,298] Trial 1795 finished with value: 0.32145393621650514 and parameters: {'n_estimators': 929, 'learning_rate': 0.09591809309743776, 'max_depth': 6, 'min_samples_split': 6, 'min_samples_leaf': 2, 'subsample': 0.7978186290537921, 'max_features': None}. Best is trial 1454 with value: 0.30763307678022894.
[I 2024-12-04 12:49:45,467] Trial 1787 finished with value: 0.3840242037295767 and parameters: {'n_estimators': 1145, 'learning_rate': 0.07124438035518973, 'max_depth': 6, 'min_samples_split': 5, 'min_samples_leaf': 3, 'subsample': 0.7606431072080337, 'max_features': None}. Best is trial 1454 with value: 0.30763307678022894.
[I 2024-12-04 12:49:45,904] Trial 1800 finished with value: 0.3279915547652927 and parameters: {'n_estimators': 778, 'learning_rate': 0.0673411091394961, 'max_depth': 8, 'min_samples_split': 6, 'min_samples_leaf': 2, 'subsample': 0.7322086889967154, 'max_features': None}. Best is trial 1454 with value: 0.30763307678022894.
[I 2024-12-04 12:49:50,756] Trial 1806 finished with value: 0.3885730692880081 and parameters: {'n_estimators': 725, 'learning_rate': 0.04369948884195221, 'max_depth': 7, 'min_samples_split': 2, 'min_samples_leaf': 3, 'subsample': 0.7030460144027945, 'max_features': None}. Best is trial 1454 with value: 0.30763307678022894.
[I 2024-12-04 12:49:50,815] Trial 1793 finished with value: 0.39638807350778105 and parameters: {'n_estimators': 1241, 'learning_rate': 0.08691500961633115, 'max_depth': 5, 'min_samples_split': 2, 'min_samples_leaf': 3, 'subsample': 0.6511502632825258, 'max_features': None}. Best is trial 1454 with value: 0.30763307678022894.
[I 2024-12-04 12:49:52,706] Trial 1794 finished with value: 0.3809786604557531 and parameters: {'n_estimators': 1226, 'learning_rate': 0.059089786737770655, 'max_depth': 6, 'min_samples_split': 2, 'min_samples_leaf': 1, 'subsample': 0.6173095459102865, 'max_features': None}. Best is trial 1454 with value: 0.30763307678022894.
[I 2024-12-04 12:49:52,803] Trial 1791 finished with value: 0.3915539555390405 and parameters: {'n_estimators': 1203, 'learning_rate': 0.09848340840849619, 'max_depth': 7, 'min_samples_split': 2, 'min_samples_leaf': 3, 'subsample': 0.6861623575944255, 'max_features': None}. Best is trial 1454 with value: 0.30763307678022894.
[I 2024-12-04 12:49:53,687] Trial 1810 finished with value: 0.3840942648344858 and parameters: {'n_estimators': 657, 'learning_rate': 0.08602063547672817, 'max_depth': 5, 'min_samples_split': 2, 'min_samples_leaf': 1, 'subsample': 0.844271133575507, 'max_features': None}. Best is trial 1454 with value: 0.30763307678022894.
[I 2024-12-04 12:49:54,186] Trial 1796 finished with value: 0.36613043081197333 and parameters: {'n_estimators': 1204, 'learning_rate': 0.044662733188298824, 'max_depth': 6, 'min_samples_split': 13, 'min_samples_leaf': 2, 'subsample': 0.7358814338917115, 'max_features': None}. Best is trial 1454 with value: 0.30763307678022894.
[I 2024-12-04 12:49:56,842] Trial 1813 finished with value: 0.3921990405552708 and parameters: {'n_estimators': 525, 'learning_rate': 0.050962460279576426, 'max_depth': 5, 'min_samples_split': 3, 'min_samples_leaf': 4, 'subsample': 0.7113166919572124, 'max_features': None}. Best is trial 1454 with value: 0.30763307678022894.
[I 2024-12-04 12:49:57,211] Trial 1788 finished with value: 0.32116664142842555 and parameters: {'n_estimators': 1492, 'learning_rate': 0.07920326419469215, 'max_depth': 6, 'min_samples_split': 7, 'min_samples_leaf': 2, 'subsample': 0.6607906901104903, 'max_features': None}. Best is trial 1454 with value: 0.30763307678022894.
[I 2024-12-04 12:49:58,183] Trial 1803 finished with value: 0.38317160715533755 and parameters: {'n_estimators': 952, 'learning_rate': 0.0554885748408399, 'max_depth': 7, 'min_samples_split': 5, 'min_samples_leaf': 4, 'subsample': 0.697046158368815, 'max_features': None}. Best is trial 1454 with value: 0.30763307678022894.
[I 2024-12-04 12:49:58,385] Trial 1816 finished with value: 0.3339535422603536 and parameters: {'n_estimators': 625, 'learning_rate': 0.06603980230476819, 'max_depth': 8, 'min_samples_split': 2, 'min_samples_leaf': 2, 'subsample': 0.6294079972946653, 'max_features': None}. Best is trial 1454 with value: 0.30763307678022894.
[I 2024-12-04 12:49:59,088] Trial 1817 finished with value: 0.3984011793543549 and parameters: {'n_estimators': 552, 'learning_rate': 0.07703429352976009, 'max_depth': 6, 'min_samples_split': 6, 'min_samples_leaf': 1, 'subsample': 0.7413283393879404, 'max_features': None}. Best is trial 1454 with value: 0.30763307678022894.
