[I 2024-12-04 20:41:04,381] Trial 1894 finished with value: 1.0624161172646942 and parameters: {'kernel_type': 'Matern', 'length_scale': 0.039251940809573595, 'noise_level': 0.04647579894609733, 'constant_value': 77522.0871473738, 'nu': 0.5}. Best is trial 881 with value: 0.35916990930150405.
[I 2024-12-04 20:41:08,152] Trial 1893 finished with value: 0.35921119372396354 and parameters: {'kernel_type': 'Matern', 'length_scale': 0.09480207911619404, 'noise_level': 0.0188400895673478, 'constant_value': 740.6428986024405, 'nu': 0.5}. Best is trial 881 with value: 0.35916990930150405.
[I 2024-12-04 20:41:09,291] Trial 1895 finished with value: 0.3592103493317951 and parameters: {'kernel_type': 'Matern', 'length_scale': 104.1380237409735, 'noise_level': 0.016035024415334935, 'constant_value': 79569.93623337259, 'nu': 0.5}. Best is trial 881 with value: 0.35916990930150405.
[I 2024-12-04 20:41:11,281] Trial 1896 finished with value: 0.3592111759772969 and parameters: {'kernel_type': 'Matern', 'length_scale': 0.16531487241168769, 'noise_level': 0.024673370999207227, 'constant_value': 81.08476501167658, 'nu': 0.5}. Best is trial 881 with value: 0.35916990930150405.
[I 2024-12-04 20:41:13,088] Trial 1897 finished with value: 0.3592101057906686 and parameters: {'kernel_type': 'Matern', 'length_scale': 4.230126678344191, 'noise_level': 0.018705662618772333, 'constant_value': 567.5154220375414, 'nu': 0.5}. Best is trial 881 with value: 0.35916990930150405.
[I 2024-12-04 20:41:15,064] Trial 1898 finished with value: 0.3592112478100197 and parameters: {'kernel_type': 'Matern', 'length_scale': 0.2661827661742199, 'noise_level': 0.7806016855219805, 'constant_value': 559.004378295837, 'nu': 0.5}. Best is trial 881 with value: 0.35916990930150405.
[I 2024-12-04 20:41:16,321] Trial 1899 finished with value: 0.35921124096040347 and parameters: {'kernel_type': 'Matern', 'length_scale': 115.89527194788954, 'noise_level': 0.00402581356478424, 'constant_value': 13786.016125998254, 'nu': 0.5}. Best is trial 881 with value: 0.35916990930150405.
[I 2024-12-04 20:41:18,691] Trial 1900 finished with value: 0.4286837354703713 and parameters: {'kernel_type': 'RBF', 'length_scale': 22.06727077014054, 'noise_level': 0.5866392198684436, 'constant_value': 136.98237463379837, 'nu': 0.5}. Best is trial 881 with value: 0.35916990930150405.
[I 2024-12-04 20:41:20,457] Trial 1901 finished with value: 0.3592112801748906 and parameters: {'kernel_type': 'Matern', 'length_scale': 5.19833808800985, 'noise_level': 0.0027621762176418493, 'constant_value': 3113.1387485099867, 'nu': 0.5}. Best is trial 881 with value: 0.35916990930150405.
[I 2024-12-04 20:41:21,880] Trial 1902 finished with value: 0.35921047236757764 and parameters: {'kernel_type': 'Matern', 'length_scale': 1454.0306382450415, 'noise_level': 0.4655019562197886, 'constant_value': 1404.9425003366887, 'nu': 0.5}. Best is trial 881 with value: 0.35916990930150405.
[I 2024-12-04 20:41:25,709] Trial 1903 finished with value: 1.0624161172628355 and parameters: {'kernel_type': 'Matern', 'length_scale': 0.062368507111010094, 'noise_level': 1.212150335092698e-07, 'constant_value': 9.682489261351133e-07, 'nu': 2.5}. Best is trial 881 with value: 0.35916990930150405.
[I 2024-12-04 20:41:26,854] Trial 1904 finished with value: 0.3592111817961722 and parameters: {'kernel_type': 'Matern', 'length_scale': 2.341034005216734, 'noise_level': 0.013186771334781393, 'constant_value': 1382.158148888603, 'nu': 0.5}. Best is trial 881 with value: 0.35916990930150405.
[I 2024-12-04 20:41:27,423] Trial 1905 finished with value: 0.35921122440406167 and parameters: {'kernel_type': 'Matern', 'length_scale': 83.39970855138142, 'noise_level': 0.10349169955504955, 'constant_value': 448.81156318812253, 'nu': 0.5}. Best is trial 881 with value: 0.35916990930150405.
[I 2024-12-04 20:41:32,354] Trial 1906 finished with value: 0.3592112666035015 and parameters: {'kernel_type': 'Matern', 'length_scale': 745.0131410743711, 'noise_level': 0.008508512677860713, 'constant_value': 92387.88872999906, 'nu': 0.5}. Best is trial 881 with value: 0.35916990930150405.
[I 2024-12-04 20:41:32,355] Trial 1907 finished with value: 0.3592112208058477 and parameters: {'kernel_type': 'Matern', 'length_scale': 4.15186463784214, 'noise_level': 0.09732989196318438, 'constant_value': 94.78946566529663, 'nu': 0.5}. Best is trial 881 with value: 0.35916990930150405.
[I 2024-12-04 20:41:33,278] Trial 1908 finished with value: 0.35921111871383804 and parameters: {'kernel_type': 'Matern', 'length_scale': 57.90891126195839, 'noise_level': 0.01834677806100616, 'constant_value': 2014.1715220338713, 'nu': 0.5}. Best is trial 881 with value: 0.35916990930150405.
[I 2024-12-04 20:41:37,461] Trial 1910 finished with value: 0.35921101590287313 and parameters: {'kernel_type': 'Matern', 'length_scale': 27.63748478582343, 'noise_level': 0.926761452427728, 'constant_value': 22.871173739334242, 'nu': 0.5}. Best is trial 881 with value: 0.35916990930150405.
[I 2024-12-04 20:41:38,148] Trial 1911 finished with value: 0.35920952371409676 and parameters: {'kernel_type': 'Matern', 'length_scale': 0.5718021807866445, 'noise_level': 0.06648248475170697, 'constant_value': 1871.4985353006373, 'nu': 0.5}. Best is trial 881 with value: 0.35916990930150405.
[I 2024-12-04 20:41:39,400] Trial 1909 finished with value: 0.42868348534102496 and parameters: {'kernel_type': 'RBF', 'length_scale': 636.7575639134682, 'noise_level': 0.06618705927014194, 'constant_value': 10364.218403762527, 'nu': 0.5}. Best is trial 881 with value: 0.35916990930150405.
[I 2024-12-04 20:41:41,372] Trial 1912 finished with value: 1.0624151311816035 and parameters: {'kernel_type': 'Matern', 'length_scale': 0.07519291528698671, 'noise_level': 0.06932574511459863, 'constant_value': 2369.805117736626, 'nu': 0.5}. Best is trial 881 with value: 0.35916990930150405.
[I 2024-12-04 20:41:43,458] Trial 1913 finished with value: 0.3592113227975789 and parameters: {'kernel_type': 'Matern', 'length_scale': 13.929741574667437, 'noise_level': 0.027334602009786317, 'constant_value': 2278.6512764507074, 'nu': 0.5}. Best is trial 881 with value: 0.35916990930150405.
[I 2024-12-04 20:41:45,461] Trial 1914 finished with value: 0.3592112940388447 and parameters: {'kernel_type': 'Matern', 'length_scale': 63973.886155822656, 'noise_level': 0.17731656196656065, 'constant_value': 204.89371519451626, 'nu': 0.5}. Best is trial 881 with value: 0.35916990930150405.
[I 2024-12-04 20:41:46,424] Trial 1915 finished with value: 0.35921105756518795 and parameters: {'kernel_type': 'Matern', 'length_scale': 4.736332873137132, 'noise_level': 0.002007903280297503, 'constant_value': 3072.9192455437687, 'nu': 0.5}. Best is trial 881 with value: 0.35916990930150405.
[I 2024-12-04 20:41:49,104] Trial 1916 finished with value: 0.35921123141974226 and parameters: {'kernel_type': 'Matern', 'length_scale': 2.389147426672702, 'noise_level': 0.022754615245865115, 'constant_value': 99.60717474934813, 'nu': 0.5}. Best is trial 881 with value: 0.35916990930150405.
[I 2024-12-04 20:41:51,361] Trial 1917 finished with value: 0.35921122934840055 and parameters: {'kernel_type': 'Matern', 'length_scale': 0.42257063953181934, 'noise_level': 0.0006617849964740669, 'constant_value': 64243.64668264895, 'nu': 0.5}. Best is trial 881 with value: 0.35916990930150405.
[I 2024-12-04 20:41:52,747] Trial 1918 finished with value: 1.062416117268798 and parameters: {'kernel_type': 'RBF', 'length_scale': 404.06187191006296, 'noise_level': 6.41346275666731e-06, 'constant_value': 10.733456273850761, 'nu': 1.5}. Best is trial 881 with value: 0.35916990930150405.
[I 2024-12-04 20:41:55,888] Trial 1919 finished with value: 1.0624161169966087 and parameters: {'kernel_type': 'Matern', 'length_scale': 11892.79384795018, 'noise_level': 0.03702898473295535, 'constant_value': 1085.1214879763327, 'nu': 2.5}. Best is trial 881 with value: 0.35916990930150405.
[I 2024-12-04 20:41:57,929] Trial 1920 finished with value: 0.3592112317134439 and parameters: {'kernel_type': 'Matern', 'length_scale': 1684.0289748017171, 'noise_level': 0.009305601416932801, 'constant_value': 4160.40111383019, 'nu': 0.5}. Best is trial 881 with value: 0.35916990930150405.
[I 2024-12-04 20:41:58,749] Trial 1921 finished with value: 0.35921120331504897 and parameters: {'kernel_type': 'Matern', 'length_scale': 0.6581894011226177, 'noise_level': 0.029687933174190075, 'constant_value': 51.1921619705411, 'nu': 0.5}. Best is trial 881 with value: 0.35916990930150405.
[I 2024-12-04 20:41:59,658] Trial 1922 finished with value: 0.35921096216667175 and parameters: {'kernel_type': 'Matern', 'length_scale': 4.479689547608443, 'noise_level': 0.10263056796208994, 'constant_value': 2576.8872486499536, 'nu': 0.5}. Best is trial 881 with value: 0.35916990930150405.
[I 2024-12-04 20:42:03,281] Trial 1924 finished with value: 0.35921050470855725 and parameters: {'kernel_type': 'Matern', 'length_scale': 7.851767636480422, 'noise_level': 0.020872658427564087, 'constant_value': 1322.1007904044193, 'nu': 0.5}. Best is trial 881 with value: 0.35916990930150405.
[I 2024-12-04 20:42:04,077] Trial 1923 finished with value: 0.428683380467194 and parameters: {'kernel_type': 'RBF', 'length_scale': 144.60120220263906, 'noise_level': 0.9031734847913491, 'constant_value': 46505.089997582734, 'nu': 0.5}. Best is trial 881 with value: 0.35916990930150405.
[I 2024-12-04 20:42:04,706] Trial 1925 finished with value: 0.35921110372748005 and parameters: {'kernel_type': 'Matern', 'length_scale': 2.7660773219334724, 'noise_level': 0.9686993186798758, 'constant_value': 101.99096235746757, 'nu': 0.5}. Best is trial 881 with value: 0.35916990930150405.
[I 2024-12-04 20:42:09,445] Trial 1926 finished with value: 1.0624161172779933 and parameters: {'kernel_type': 'RBF', 'length_scale': 41.98472259300766, 'noise_level': 0.000132145329708712, 'constant_value': 23025.110576557454, 'nu': 0.5}. Best is trial 881 with value: 0.35916990930150405.
[I 2024-12-04 20:42:11,072] Trial 1927 finished with value: 0.4226873196902922 and parameters: {'kernel_type': 'Matern', 'length_scale': 33.24989802057884, 'noise_level': 0.030966631065436043, 'constant_value': 602.7723755979199, 'nu': 1.5}. Best is trial 881 with value: 0.35916990930150405.
[I 2024-12-04 20:42:12,876] Trial 1928 finished with value: 1.0624161176417244 and parameters: {'kernel_type': 'RBF', 'length_scale': 8919.265492076289, 'noise_level': 0.002561672446514171, 'constant_value': 765.8545461307348, 'nu': 0.5}. Best is trial 881 with value: 0.35916990930150405.
[I 2024-12-04 20:42:15,681] Trial 1929 finished with value: 0.3592112430860491 and parameters: {'kernel_type': 'Matern', 'length_scale': 3036.1334765953766, 'noise_level': 0.013569664599293449, 'constant_value': 603.5851210664408, 'nu': 0.5}. Best is trial 881 with value: 0.35916990930150405.
[I 2024-12-04 20:42:16,816] Trial 1930 finished with value: 0.3592112250722998 and parameters: {'kernel_type': 'Matern', 'length_scale': 498.24981531380604, 'noise_level': 0.7588089126868085, 'constant_value': 6502.8378878646145, 'nu': 0.5}. Best is trial 881 with value: 0.35916990930150405.
[I 2024-12-04 20:42:18,206] Trial 1931 finished with value: 0.3592112089563205 and parameters: {'kernel_type': 'Matern', 'length_scale': 57.1912974782067, 'noise_level': 0.015583635360128929, 'constant_value': 1218.4349532984666, 'nu': 0.5}. Best is trial 881 with value: 0.35916990930150405.
[I 2024-12-04 20:42:20,840] Trial 1932 finished with value: 0.359211299084809 and parameters: {'kernel_type': 'Matern', 'length_scale': 4.201936683821695, 'noise_level': 0.8834878050740959, 'constant_value': 43.90512563187862, 'nu': 0.5}. Best is trial 881 with value: 0.35916990930150405.
[I 2024-12-04 20:42:21,693] Trial 1933 finished with value: 0.35921023592887763 and parameters: {'kernel_type': 'Matern', 'length_scale': 3.6446792402065435, 'noise_level': 0.0022787136029187934, 'constant_value': 1166.8336320761948, 'nu': 0.5}. Best is trial 881 with value: 0.35916990930150405.
[I 2024-12-04 20:42:23,422] Trial 1934 finished with value: 0.3592111994192359 and parameters: {'kernel_type': 'Matern', 'length_scale': 309.02975591080883, 'noise_level': 0.003450357862729787, 'constant_value': 1358.1230677612175, 'nu': 0.5}. Best is trial 881 with value: 0.35916990930150405.
[I 2024-12-04 20:42:26,126] Trial 1935 finished with value: 0.35921128566283245 and parameters: {'kernel_type': 'Matern', 'length_scale': 16.558870411381605, 'noise_level': 0.783395665657165, 'constant_value': 726.5580158953085, 'nu': 0.5}. Best is trial 881 with value: 0.35916990930150405.
[I 2024-12-04 20:42:26,133] Trial 1937 finished with value: 1.091656704854996 and parameters: {'kernel_type': 'Matern', 'length_scale': 1.3409930446542806, 'noise_level': 0.0053619889454595655, 'constant_value': 1633.1000436703962, 'nu': 0.5}. Best is trial 881 with value: 0.35916990930150405.
[I 2024-12-04 20:42:29,664] Trial 1936 finished with value: 0.3592114473418229 and parameters: {'kernel_type': 'Matern', 'length_scale': 0.10413051365066765, 'noise_level': 0.0020344672121859995, 'constant_value': 681.4739331746848, 'nu': 0.5}. Best is trial 881 with value: 0.35916990930150405.
[I 2024-12-04 20:42:31,407] Trial 1939 finished with value: 0.35921223978080496 and parameters: {'kernel_type': 'Matern', 'length_scale': 0.7694610106357296, 'noise_level': 0.016894313672075664, 'constant_value': 67.328404983736, 'nu': 0.5}. Best is trial 881 with value: 0.35916990930150405.
[I 2024-12-04 20:42:32,198] Trial 1938 finished with value: 0.35921124130827864 and parameters: {'kernel_type': 'Matern', 'length_scale': 81.60284326031649, 'noise_level': 0.052119494418534376, 'constant_value': 1735.1281819586463, 'nu': 0.5}. Best is trial 881 with value: 0.35916990930150405.
[I 2024-12-04 20:42:34,518] Trial 1941 finished with value: 1.0916558493884547 and parameters: {'kernel_type': 'RBF', 'length_scale': 0.00020060134971837412, 'noise_level': 6.179813216806847e-07, 'constant_value': 29688.630244063792, 'nu': 0.5}. Best is trial 881 with value: 0.35916990930150405.
[I 2024-12-04 20:42:35,220] Trial 1940 finished with value: 0.35921130075808183 and parameters: {'kernel_type': 'Matern', 'length_scale': 157.0850349727175, 'noise_level': 0.00114723130372776, 'constant_value': 7885.414202334302, 'nu': 0.5}. Best is trial 881 with value: 0.35916990930150405.
[I 2024-12-04 20:42:36,752] Trial 1942 finished with value: 0.3592111400837702 and parameters: {'kernel_type': 'Matern', 'length_scale': 2.089610661574847, 'noise_level': 0.7473547870633628, 'constant_value': 2.154124251788864, 'nu': 0.5}. Best is trial 881 with value: 0.35916990930150405.
[I 2024-12-04 20:42:41,158] Trial 1943 finished with value: 1.0624161171961646 and parameters: {'kernel_type': 'Matern', 'length_scale': 8.916453012367506e-05, 'noise_level': 1.0513595206472616e-10, 'constant_value': 0.7839160750189154, 'nu': 0.5}. Best is trial 881 with value: 0.35916990930150405.
[I 2024-12-04 20:42:41,163] Trial 1944 finished with value: 0.3592113100617241 and parameters: {'kernel_type': 'Matern', 'length_scale': 54.000426760496225, 'noise_level': 0.011020832865246617, 'constant_value': 2033.4279828871413, 'nu': 0.5}. Best is trial 881 with value: 0.35916990930150405.
[I 2024-12-04 20:42:41,914] Trial 1945 finished with value: 0.35921117311055 and parameters: {'kernel_type': 'Matern', 'length_scale': 4.083849402611606, 'noise_level': 0.9780878368596364, 'constant_value': 284.9901199009362, 'nu': 0.5}. Best is trial 881 with value: 0.35916990930150405.
[I 2024-12-04 20:42:46,557] Trial 1948 finished with value: 0.35920952541088014 and parameters: {'kernel_type': 'Matern', 'length_scale': 5.753058556653966, 'noise_level': 0.07371503665896545, 'constant_value': 647.1727083850523, 'nu': 0.5}. Best is trial 881 with value: 0.35916990930150405.
[I 2024-12-04 20:42:46,658] Trial 1946 finished with value: 0.35921117560828153 and parameters: {'kernel_type': 'Matern', 'length_scale': 0.333455531729757, 'noise_level': 0.06443776226356161, 'constant_value': 41598.81839889534, 'nu': 0.5}. Best is trial 881 with value: 0.35916990930150405.
[I 2024-12-04 20:42:48,013] Trial 1947 finished with value: 0.3592113021168646 and parameters: {'kernel_type': 'Matern', 'length_scale': 1.7839715637721791, 'noise_level': 0.04403544748573541, 'constant_value': 13368.90719562332, 'nu': 0.5}. Best is trial 881 with value: 0.35916990930150405.
[I 2024-12-04 20:42:50,729] Trial 1949 finished with value: 1.0624160924197101 and parameters: {'kernel_type': 'Matern', 'length_scale': 0.058837470907483445, 'noise_level': 0.020102072505295856, 'constant_value': 29.954432256161986, 'nu': 0.5}. Best is trial 881 with value: 0.35916990930150405.
[I 2024-12-04 20:42:51,625] Trial 1950 finished with value: 0.3592113491111733 and parameters: {'kernel_type': 'Matern', 'length_scale': 4.597427159067616, 'noise_level': 0.026762699228430744, 'constant_value': 31.51854018714351, 'nu': 0.5}. Best is trial 881 with value: 0.35916990930150405.
[I 2024-12-04 20:42:53,799] Trial 1951 finished with value: 0.3592112340337161 and parameters: {'kernel_type': 'Matern', 'length_scale': 63.03472094989951, 'noise_level': 0.978390654022789, 'constant_value': 7.694151884071168, 'nu': 0.5}. Best is trial 881 with value: 0.35916990930150405.
[I 2024-12-04 20:42:56,270] Trial 1952 finished with value: 0.3592115255990382 and parameters: {'kernel_type': 'Matern', 'length_scale': 3.225352800687216, 'noise_level': 0.9491761129964619, 'constant_value': 789.0121962722072, 'nu': 0.5}. Best is trial 881 with value: 0.35916990930150405.
[I 2024-12-04 20:42:57,078] Trial 1953 finished with value: 0.3592112660380046 and parameters: {'kernel_type': 'Matern', 'length_scale': 7.2350411915820985, 'noise_level': 0.05537225313049213, 'constant_value': 148.79101326220137, 'nu': 0.5}. Best is trial 881 with value: 0.35916990930150405.
[I 2024-12-04 20:42:58,934] Trial 1954 finished with value: 0.3592112294465125 and parameters: {'kernel_type': 'Matern', 'length_scale': 0.7558696143870198, 'noise_level': 0.05133063839899072, 'constant_value': 2178.6288418003883, 'nu': 0.5}. Best is trial 881 with value: 0.35916990930150405.
[I 2024-12-04 20:43:01,836] Trial 1955 finished with value: 0.35921124119164594 and parameters: {'kernel_type': 'Matern', 'length_scale': 1.2225157825998492, 'noise_level': 0.007433877870094857, 'constant_value': 46.49383712182905, 'nu': 0.5}. Best is trial 881 with value: 0.35916990930150405.
[I 2024-12-04 20:43:03,093] Trial 1956 finished with value: 0.3592112103588784 and parameters: {'kernel_type': 'Matern', 'length_scale': 0.2818150875645399, 'noise_level': 0.027258791381727827, 'constant_value': 569.3894666846056, 'nu': 0.5}. Best is trial 881 with value: 0.35916990930150405.
[I 2024-12-04 20:43:04,464] Trial 1957 finished with value: 0.3592101077496284 and parameters: {'kernel_type': 'Matern', 'length_scale': 6.970033362242028, 'noise_level': 0.012022449871223865, 'constant_value': 93.61295528277883, 'nu': 0.5}. Best is trial 881 with value: 0.35916990930150405.
[I 2024-12-04 20:43:07,041] Trial 1958 finished with value: 0.35921116429077654 and parameters: {'kernel_type': 'Matern', 'length_scale': 17.07492617011009, 'noise_level': 0.14740209964465245, 'constant_value': 46.3078807663531, 'nu': 0.5}. Best is trial 881 with value: 0.35916990930150405.
[I 2024-12-04 20:43:09,085] Trial 1959 finished with value: 0.3592111167328191 and parameters: {'kernel_type': 'Matern', 'length_scale': 1.0670814053603805, 'noise_level': 0.04044260133059222, 'constant_value': 72.1595113651708, 'nu': 0.5}. Best is trial 881 with value: 0.35916990930150405.
[I 2024-12-04 20:43:11,120] Trial 1960 finished with value: 0.42268977575454303 and parameters: {'kernel_type': 'Matern', 'length_scale': 20.418047984268213, 'noise_level': 0.9037715085581366, 'constant_value': 6877.011509795798, 'nu': 1.5}. Best is trial 881 with value: 0.35916990930150405.
[I 2024-12-04 20:43:12,825] Trial 1961 finished with value: 0.4226894158860397 and parameters: {'kernel_type': 'Matern', 'length_scale': 2.4920631530932016, 'noise_level': 0.0017784952975919764, 'constant_value': 1047.5253086875919, 'nu': 1.5}. Best is trial 881 with value: 0.35916990930150405.
[I 2024-12-04 20:43:14,110] Trial 1962 finished with value: 0.41956600297385127 and parameters: {'kernel_type': 'Matern', 'length_scale': 26.312244791936163, 'noise_level': 0.017644003292750173, 'constant_value': 621.354418078659, 'nu': 2.5}. Best is trial 881 with value: 0.35916990930150405.
[I 2024-12-04 20:43:16,812] Trial 1963 finished with value: 0.3592107561681143 and parameters: {'kernel_type': 'Matern', 'length_scale': 2.7499910833380623, 'noise_level': 0.027181249096092527, 'constant_value': 306.5047449646099, 'nu': 0.5}. Best is trial 881 with value: 0.35916990930150405.
[I 2024-12-04 20:43:18,186] Trial 1964 finished with value: 0.3592113501486706 and parameters: {'kernel_type': 'Matern', 'length_scale': 14.22752592679778, 'noise_level': 0.517400747657559, 'constant_value': 0.20125775275545985, 'nu': 0.5}. Best is trial 881 with value: 0.35916990930150405.
[I 2024-12-04 20:43:18,772] Trial 1965 finished with value: 0.35921131583151655 and parameters: {'kernel_type': 'Matern', 'length_scale': 106.94554016259953, 'noise_level': 0.9087479113776434, 'constant_value': 187.1948245423111, 'nu': 0.5}. Best is trial 881 with value: 0.35916990930150405.
[I 2024-12-04 20:43:21,792] Trial 1966 finished with value: 0.3592108011804364 and parameters: {'kernel_type': 'Matern', 'length_scale': 8.871338891533554, 'noise_level': 0.15887589238257774, 'constant_value': 350.53342155277784, 'nu': 0.5}. Best is trial 881 with value: 0.35916990930150405.
