[I 2024-12-03 18:39:33,227] A new study created in RDB with name: Omega_svr
/zhome/b1/0/88900/miniconda3/envs/critprops/lib/python3.9/site-packages/optuna/_experimental.py:31: ExperimentalWarning: Argument ``multivariate`` is an experimental feature. The interface can change in the future.
  warnings.warn(
/zhome/b1/0/88900/miniconda3/envs/critprops/lib/python3.9/site-packages/optuna/_experimental.py:31: ExperimentalWarning: Argument ``constant_liar`` is an experimental feature. The interface can change in the future.
  warnings.warn(
/zhome/b1/0/88900/miniconda3/envs/critprops/lib/python3.9/site-packages/optuna/_experimental.py:31: ExperimentalWarning: Argument ``multivariate`` is an experimental feature. The interface can change in the future.
  warnings.warn(
/zhome/b1/0/88900/miniconda3/envs/critprops/lib/python3.9/site-packages/optuna/_experimental.py:31: ExperimentalWarning: Argument ``constant_liar`` is an experimental feature. The interface can change in the future.
  warnings.warn(
[I 2024-12-03 18:39:36,336] Trial 1 finished with value: 1.3489946148716996 and parameters: {'kernel': 'sigmoid', 'C': 0.0015114577171688164, 'gamma': 0.0013638351330428772, 'epsilon': 0.27200161912714327}. Best is trial 21 with value: 0.6547456098122687.
[I 2024-12-03 18:39:36,535] Trial 3 finished with value: 0.8939973560480321 and parameters: {'kernel': 'linear', 'C': 0.001846659437813257, 'gamma': 0.00955469716299169, 'epsilon': 0.04193291659514399}. Best is trial 21 with value: 0.6547456098122687.
[I 2024-12-03 18:39:36,539] Trial 9 finished with value: 0.7623325994550152 and parameters: {'kernel': 'sigmoid', 'C': 28.844246778293705, 'gamma': 0.0010516616325209204, 'epsilon': 0.001480969997412584}. Best is trial 21 with value: 0.6547456098122687.
[I 2024-12-03 18:39:36,705] Trial 11 finished with value: 0.8060604863921386 and parameters: {'kernel': 'rbf', 'C': 0.4936497788465681, 'gamma': 0.12970405397434281, 'epsilon': 0.0063007400811165275}. Best is trial 21 with value: 0.6547456098122687.
[I 2024-12-03 18:39:36,769] Trial 12 finished with value: 0.7804809158137469 and parameters: {'kernel': 'rbf', 'C': 17.049539534304387, 'gamma': 0.0003371907234788137, 'epsilon': 0.009169433351913083}. Best is trial 21 with value: 0.6547456098122687.
[I 2024-12-03 18:39:36,819] Trial 21 finished with value: 0.6547456098122687 and parameters: {'kernel': 'linear', 'C': 29.86129482307707, 'gamma': 0.0007640935797050535, 'epsilon': 0.7123317794513959}. Best is trial 21 with value: 0.6547456098122687.
[I 2024-12-03 18:39:36,916] Trial 6 finished with value: 0.9045743529165214 and parameters: {'kernel': 'linear', 'C': 0.0014177235480428271, 'gamma': 0.015318929331270444, 'epsilon': 0.2644099760208063}. Best is trial 13 with value: 0.5604480412005258.
/zhome/b1/0/88900/miniconda3/envs/critprops/lib/python3.9/site-packages/optuna/_experimental.py:31: ExperimentalWarning: Argument ``multivariate`` is an experimental feature. The interface can change in the future.
  warnings.warn(
/zhome/b1/0/88900/miniconda3/envs/critprops/lib/python3.9/site-packages/optuna/_experimental.py:31: ExperimentalWarning: Argument ``constant_liar`` is an experimental feature. The interface can change in the future.
  warnings.warn(
[I 2024-12-03 18:39:37,110] Trial 5 finished with value: 0.7636564125583092 and parameters: {'kernel': 'linear', 'C': 0.021031332448437846, 'gamma': 0.38865288699124795, 'epsilon': 0.009564849303760375}. Best is trial 13 with value: 0.5604480412005258.
/zhome/b1/0/88900/miniconda3/envs/critprops/lib/python3.9/site-packages/optuna/_experimental.py:31: ExperimentalWarning: Argument ``multivariate`` is an experimental feature. The interface can change in the future.
  warnings.warn(
/zhome/b1/0/88900/miniconda3/envs/critprops/lib/python3.9/site-packages/optuna/_experimental.py:31: ExperimentalWarning: Argument ``constant_liar`` is an experimental feature. The interface can change in the future.
  warnings.warn(
[I 2024-12-03 18:39:37,319] Trial 16 finished with value: 0.6931045798221404 and parameters: {'kernel': 'linear', 'C': 0.05622107398951957, 'gamma': 0.0002081308014188444, 'epsilon': 0.06328102032768035}. Best is trial 13 with value: 0.5604480412005258.
[I 2024-12-03 18:39:37,530] Trial 2 finished with value: 1.339479071947635 and parameters: {'kernel': 'rbf', 'C': 0.00371503461608937, 'gamma': 0.055454713625100495, 'epsilon': 0.012324935964331903}. Best is trial 13 with value: 0.5604480412005258.
[I 2024-12-03 18:39:37,531] Trial 13 finished with value: 0.5604480412005258 and parameters: {'kernel': 'linear', 'C': 2.3763506112754995, 'gamma': 0.037320288559963236, 'epsilon': 0.04707774375750191}. Best is trial 13 with value: 0.5604480412005258.
[I 2024-12-03 18:39:37,762] Trial 8 finished with value: 1.0466792381092993 and parameters: {'kernel': 'sigmoid', 'C': 3.8378009345250903, 'gamma': 0.005076713046691498, 'epsilon': 0.0042682245458946465}. Best is trial 13 with value: 0.5604480412005258.
[I 2024-12-03 18:39:38,142] Trial 23 finished with value: 1.2866680628384055 and parameters: {'kernel': 'sigmoid', 'C': 0.007084998972238656, 'gamma': 0.010672118510715258, 'epsilon': 0.5599886363261745}. Best is trial 4 with value: 0.5578280755971914.
/zhome/b1/0/88900/miniconda3/envs/critprops/lib/python3.9/site-packages/optuna/_experimental.py:31: ExperimentalWarning: Argument ``multivariate`` is an experimental feature. The interface can change in the future.
  warnings.warn(
/zhome/b1/0/88900/miniconda3/envs/critprops/lib/python3.9/site-packages/optuna/_experimental.py:31: ExperimentalWarning: Argument ``constant_liar`` is an experimental feature. The interface can change in the future.
  warnings.warn(
/zhome/b1/0/88900/miniconda3/envs/critprops/lib/python3.9/site-packages/optuna/_experimental.py:31: ExperimentalWarning: Argument ``multivariate`` is an experimental feature. The interface can change in the future.
  warnings.warn(
/zhome/b1/0/88900/miniconda3/envs/critprops/lib/python3.9/site-packages/optuna/_experimental.py:31: ExperimentalWarning: Argument ``constant_liar`` is an experimental feature. The interface can change in the future.
  warnings.warn(
[I 2024-12-03 18:39:38,727] Trial 4 finished with value: 0.5578280755971914 and parameters: {'kernel': 'linear', 'C': 12.577012187202575, 'gamma': 0.025791434140914143, 'epsilon': 0.019289713295603018}. Best is trial 4 with value: 0.5578280755971914.
/zhome/b1/0/88900/miniconda3/envs/critprops/lib/python3.9/site-packages/optuna/_experimental.py:31: ExperimentalWarning: Argument ``multivariate`` is an experimental feature. The interface can change in the future.
  warnings.warn(
/zhome/b1/0/88900/miniconda3/envs/critprops/lib/python3.9/site-packages/optuna/_experimental.py:31: ExperimentalWarning: Argument ``constant_liar`` is an experimental feature. The interface can change in the future.
  warnings.warn(
[I 2024-12-03 18:39:38,819] Trial 0 finished with value: 0.7609859274552176 and parameters: {'kernel': 'rbf', 'C': 96.50939429643779, 'gamma': 0.0001463291663695993, 'epsilon': 0.028690034842484332}. Best is trial 4 with value: 0.5578280755971914.
/zhome/b1/0/88900/miniconda3/envs/critprops/lib/python3.9/site-packages/optuna/_experimental.py:31: ExperimentalWarning: Argument ``multivariate`` is an experimental feature. The interface can change in the future.
  warnings.warn(
/zhome/b1/0/88900/miniconda3/envs/critprops/lib/python3.9/site-packages/optuna/_experimental.py:31: ExperimentalWarning: Argument ``constant_liar`` is an experimental feature. The interface can change in the future.
  warnings.warn(
[I 2024-12-03 18:39:39,464] Trial 22 finished with value: 1.2510422948575834 and parameters: {'kernel': 'rbf', 'C': 0.015212531479055595, 'gamma': 0.06308132515187272, 'epsilon': 0.19181431643181163}. Best is trial 26 with value: 0.5502981341646253.
[I 2024-12-03 18:39:39,829] Trial 26 finished with value: 0.5502981341646253 and parameters: {'kernel': 'linear', 'C': 15.897778336635161, 'gamma': 0.0019300509479595691, 'epsilon': 0.001236382561330791}. Best is trial 26 with value: 0.5502981341646253.
/zhome/b1/0/88900/miniconda3/envs/critprops/lib/python3.9/site-packages/optuna/_experimental.py:31: ExperimentalWarning: Argument ``multivariate`` is an experimental feature. The interface can change in the future.
  warnings.warn(
/zhome/b1/0/88900/miniconda3/envs/critprops/lib/python3.9/site-packages/optuna/_experimental.py:31: ExperimentalWarning: Argument ``constant_liar`` is an experimental feature. The interface can change in the future.
  warnings.warn(
[I 2024-12-03 18:39:40,302] Trial 14 finished with value: 0.7080842679373814 and parameters: {'kernel': 'rbf', 'C': 17.369843774046885, 'gamma': 0.4716888644580901, 'epsilon': 0.008489363681523213}. Best is trial 26 with value: 0.5502981341646253.
[I 2024-12-03 18:39:40,322] Trial 10 finished with value: 1.099701958487017 and parameters: {'kernel': 'poly', 'C': 0.2226970277995689, 'gamma': 0.00832540195865654, 'epsilon': 0.04783326508713485}. Best is trial 26 with value: 0.5502981341646253.
[I 2024-12-03 18:39:40,408] Trial 18 finished with value: 0.5692492013902115 and parameters: {'kernel': 'linear', 'C': 20.73352564200116, 'gamma': 0.17136014525242668, 'epsilon': 0.10164060617723557}. Best is trial 26 with value: 0.5502981341646253.
/zhome/b1/0/88900/miniconda3/envs/critprops/lib/python3.9/site-packages/optuna/_experimental.py:31: ExperimentalWarning: Argument ``multivariate`` is an experimental feature. The interface can change in the future.
  warnings.warn(
/zhome/b1/0/88900/miniconda3/envs/critprops/lib/python3.9/site-packages/optuna/_experimental.py:31: ExperimentalWarning: Argument ``constant_liar`` is an experimental feature. The interface can change in the future.
  warnings.warn(
/zhome/b1/0/88900/miniconda3/envs/critprops/lib/python3.9/site-packages/optuna/_experimental.py:31: ExperimentalWarning: Argument ``multivariate`` is an experimental feature. The interface can change in the future.
  warnings.warn(
/zhome/b1/0/88900/miniconda3/envs/critprops/lib/python3.9/site-packages/optuna/_experimental.py:31: ExperimentalWarning: Argument ``constant_liar`` is an experimental feature. The interface can change in the future.
  warnings.warn(
[I 2024-12-03 18:39:41,094] Trial 20 finished with value: 0.5772792819560597 and parameters: {'kernel': 'linear', 'C': 1.8028168533580515, 'gamma': 0.0011815210245605264, 'epsilon': 0.0011511888333604848}. Best is trial 26 with value: 0.5502981341646253.
/zhome/b1/0/88900/miniconda3/envs/critprops/lib/python3.9/site-packages/optuna/_experimental.py:31: ExperimentalWarning: Argument ``multivariate`` is an experimental feature. The interface can change in the future.
  warnings.warn(
/zhome/b1/0/88900/miniconda3/envs/critprops/lib/python3.9/site-packages/optuna/_experimental.py:31: ExperimentalWarning: Argument ``constant_liar`` is an experimental feature. The interface can change in the future.
  warnings.warn(
/zhome/b1/0/88900/miniconda3/envs/critprops/lib/python3.9/site-packages/optuna/_experimental.py:31: ExperimentalWarning: Argument ``multivariate`` is an experimental feature. The interface can change in the future.
  warnings.warn(
/zhome/b1/0/88900/miniconda3/envs/critprops/lib/python3.9/site-packages/optuna/_experimental.py:31: ExperimentalWarning: Argument ``constant_liar`` is an experimental feature. The interface can change in the future.
  warnings.warn(
/zhome/b1/0/88900/miniconda3/envs/critprops/lib/python3.9/site-packages/optuna/_experimental.py:31: ExperimentalWarning: Argument ``multivariate`` is an experimental feature. The interface can change in the future.
  warnings.warn(
/zhome/b1/0/88900/miniconda3/envs/critprops/lib/python3.9/site-packages/optuna/_experimental.py:31: ExperimentalWarning: Argument ``constant_liar`` is an experimental feature. The interface can change in the future.
  warnings.warn(
[I 2024-12-03 18:39:41,508] Trial 24 finished with value: 0.8374599508780249 and parameters: {'kernel': 'linear', 'C': 0.0030758309819520053, 'gamma': 0.004422534633091416, 'epsilon': 0.0027989904451295984}. Best is trial 26 with value: 0.5502981341646253.
/zhome/b1/0/88900/miniconda3/envs/critprops/lib/python3.9/site-packages/optuna/_experimental.py:31: ExperimentalWarning: Argument ``multivariate`` is an experimental feature. The interface can change in the future.
  warnings.warn(
/zhome/b1/0/88900/miniconda3/envs/critprops/lib/python3.9/site-packages/optuna/_experimental.py:31: ExperimentalWarning: Argument ``constant_liar`` is an experimental feature. The interface can change in the future.
  warnings.warn(
[I 2024-12-03 18:39:41,821] Trial 15 finished with value: 0.5553224440334448 and parameters: {'kernel': 'linear', 'C': 7.15960283722634, 'gamma': 0.02606390706396908, 'epsilon': 0.002182414359343866}. Best is trial 26 with value: 0.5502981341646253.
[I 2024-12-03 18:39:41,847] Trial 7 finished with value: 0.5993751396645661 and parameters: {'kernel': 'linear', 'C': 21.899040489325333, 'gamma': 0.2063492496641266, 'epsilon': 0.19996551189722198}. Best is trial 26 with value: 0.5502981341646253.
[I 2024-12-03 18:39:42,091] Trial 25 finished with value: 0.5624312149801667 and parameters: {'kernel': 'linear', 'C': 4.792770266723059, 'gamma': 0.0004292196277104441, 'epsilon': 0.0012076109974368963}. Best is trial 26 with value: 0.5502981341646253.
/zhome/b1/0/88900/miniconda3/envs/critprops/lib/python3.9/site-packages/optuna/_experimental.py:31: ExperimentalWarning: Argument ``multivariate`` is an experimental feature. The interface can change in the future.
  warnings.warn(
/zhome/b1/0/88900/miniconda3/envs/critprops/lib/python3.9/site-packages/optuna/_experimental.py:31: ExperimentalWarning: Argument ``constant_liar`` is an experimental feature. The interface can change in the future.
  warnings.warn(
/zhome/b1/0/88900/miniconda3/envs/critprops/lib/python3.9/site-packages/optuna/_experimental.py:31: ExperimentalWarning: Argument ``multivariate`` is an experimental feature. The interface can change in the future.
  warnings.warn(
/zhome/b1/0/88900/miniconda3/envs/critprops/lib/python3.9/site-packages/optuna/_experimental.py:31: ExperimentalWarning: Argument ``constant_liar`` is an experimental feature. The interface can change in the future.
  warnings.warn(
/zhome/b1/0/88900/miniconda3/envs/critprops/lib/python3.9/site-packages/optuna/_experimental.py:31: ExperimentalWarning: Argument ``multivariate`` is an experimental feature. The interface can change in the future.
  warnings.warn(
/zhome/b1/0/88900/miniconda3/envs/critprops/lib/python3.9/site-packages/optuna/_experimental.py:31: ExperimentalWarning: Argument ``constant_liar`` is an experimental feature. The interface can change in the future.
  warnings.warn(
[I 2024-12-03 18:39:43,296] Trial 29 finished with value: 0.9827307674014517 and parameters: {'kernel': 'poly', 'C': 88.14919418113689, 'gamma': 0.006328230379862513, 'epsilon': 0.003034519413564598}. Best is trial 32 with value: 0.5498278731111856.
/zhome/b1/0/88900/miniconda3/envs/critprops/lib/python3.9/site-packages/optuna/_experimental.py:31: ExperimentalWarning: Argument ``multivariate`` is an experimental feature. The interface can change in the future.
  warnings.warn(
/zhome/b1/0/88900/miniconda3/envs/critprops/lib/python3.9/site-packages/optuna/_experimental.py:31: ExperimentalWarning: Argument ``constant_liar`` is an experimental feature. The interface can change in the future.
  warnings.warn(
[I 2024-12-03 18:39:43,457] Trial 33 finished with value: 0.5659587470856938 and parameters: {'kernel': 'linear', 'C': 3.395215787725763, 'gamma': 0.03386885156373291, 'epsilon': 0.02205889625695169}. Best is trial 32 with value: 0.5498278731111856.
[I 2024-12-03 18:39:43,459] Trial 37 finished with value: 1.1021079997047585 and parameters: {'kernel': 'poly', 'C': 12.438371755574309, 'gamma': 0.002485154291258358, 'epsilon': 0.0029126894369560065}. Best is trial 32 with value: 0.5498278731111856.
[I 2024-12-03 18:39:43,460] Trial 28 finished with value: 0.8506038826202574 and parameters: {'kernel': 'rbf', 'C': 0.5286037678386902, 'gamma': 0.0029010678439301677, 'epsilon': 0.0018702677359550615}. Best is trial 32 with value: 0.5498278731111856.
[I 2024-12-03 18:39:43,746] Trial 30 finished with value: 0.8028824875401365 and parameters: {'kernel': 'poly', 'C': 0.005658372118676021, 'gamma': 0.592447073594708, 'epsilon': 0.0010804372646476394}. Best is trial 32 with value: 0.5498278731111856.
[I 2024-12-03 18:39:43,762] Trial 32 finished with value: 0.5498278731111856 and parameters: {'kernel': 'linear', 'C': 28.004550332772954, 'gamma': 0.044684584221487654, 'epsilon': 0.0014326993338370884}. Best is trial 32 with value: 0.5498278731111856.
[I 2024-12-03 18:39:43,763] Trial 17 finished with value: 0.5526879699408519 and parameters: {'kernel': 'linear', 'C': 12.80132438417401, 'gamma': 0.04796696000735092, 'epsilon': 0.0021708180700028314}. Best is trial 32 with value: 0.5498278731111856.
[I 2024-12-03 18:39:43,773] Trial 42 finished with value: 0.7701805693875501 and parameters: {'kernel': 'rbf', 'C': 1.4363665365942448, 'gamma': 0.008552130405574504, 'epsilon': 0.0028813657386812176}. Best is trial 32 with value: 0.5498278731111856.
[I 2024-12-03 18:39:44,023] Trial 45 finished with value: 0.5978012774254129 and parameters: {'kernel': 'linear', 'C': 0.29148837340595846, 'gamma': 0.014068446822383205, 'epsilon': 0.004352743055844881}. Best is trial 32 with value: 0.5498278731111856.
[I 2024-12-03 18:39:44,079] Trial 39 finished with value: 0.6225669554950926 and parameters: {'kernel': 'linear', 'C': 0.10650037627403712, 'gamma': 0.1161130064417807, 'epsilon': 0.0010513768856445988}. Best is trial 32 with value: 0.5498278731111856.
[I 2024-12-03 18:39:44,156] Trial 35 finished with value: 0.5728613599570568 and parameters: {'kernel': 'linear', 'C': 2.659221428195696, 'gamma': 0.8261651886888983, 'epsilon': 0.0031191408064969277}. Best is trial 32 with value: 0.5498278731111856.
[I 2024-12-03 18:39:44,213] Trial 36 finished with value: 0.5851463022588052 and parameters: {'kernel': 'linear', 'C': 0.6609133392945588, 'gamma': 0.001222260061055715, 'epsilon': 0.01955394246659982}. Best is trial 32 with value: 0.5498278731111856.
[I 2024-12-03 18:39:44,270] Trial 41 finished with value: 1.1110961000622874 and parameters: {'kernel': 'poly', 'C': 23.836425429676474, 'gamma': 0.00247524820919942, 'epsilon': 0.038592346533937734}. Best is trial 32 with value: 0.5498278731111856.
[I 2024-12-03 18:39:44,909] Trial 27 finished with value: 196.32563731605268 and parameters: {'kernel': 'sigmoid', 'C': 24.04439951680055, 'gamma': 0.08620024442922257, 'epsilon': 0.015810783914880857}. Best is trial 32 with value: 0.5498278731111856.
[I 2024-12-03 18:39:44,914] Trial 34 finished with value: 158.1057958301245 and parameters: {'kernel': 'sigmoid', 'C': 24.015466354110753, 'gamma': 0.04599737375136819, 'epsilon': 0.0013721645104354252}. Best is trial 32 with value: 0.5498278731111856.
[I 2024-12-03 18:39:45,433] Trial 38 finished with value: 0.5532491943160034 and parameters: {'kernel': 'linear', 'C': 46.897538192229405, 'gamma': 0.0041092355932468684, 'epsilon': 0.011437945126273946}. Best is trial 32 with value: 0.5498278731111856.
[I 2024-12-03 18:39:47,030] Trial 43 finished with value: 0.5554771290697279 and parameters: {'kernel': 'linear', 'C': 7.635044370779306, 'gamma': 0.1184132300373335, 'epsilon': 0.0012213464395154573}. Best is trial 32 with value: 0.5498278731111856.
[I 2024-12-03 18:39:47,087] Trial 31 finished with value: 0.5507884433146235 and parameters: {'kernel': 'linear', 'C': 17.285352349831875, 'gamma': 0.00382450444154739, 'epsilon': 0.0028382434359151116}. Best is trial 32 with value: 0.5498278731111856.
[I 2024-12-03 18:39:47,607] Trial 40 finished with value: 0.5593232011681669 and parameters: {'kernel': 'linear', 'C': 8.529731598664632, 'gamma': 0.0019694628428802113, 'epsilon': 0.02188146884141382}. Best is trial 32 with value: 0.5498278731111856.
[I 2024-12-03 18:39:47,607] Trial 52 finished with value: 0.8289168307518859 and parameters: {'kernel': 'sigmoid', 'C': 8.013101325760548, 'gamma': 0.0004842023359348923, 'epsilon': 0.04707950680805795}. Best is trial 32 with value: 0.5498278731111856.
[I 2024-12-03 18:39:47,947] Trial 50 finished with value: 0.5539469854711979 and parameters: {'kernel': 'linear', 'C': 9.190973383586725, 'gamma': 0.007125131757309846, 'epsilon': 0.0018606692585333897}. Best is trial 58 with value: 0.4679277933792091.
[I 2024-12-03 18:39:48,198] Trial 47 finished with value: 0.5503797153233829 and parameters: {'kernel': 'linear', 'C': 50.20982989554512, 'gamma': 0.04260697211633483, 'epsilon': 0.0030590957045228593}. Best is trial 58 with value: 0.4679277933792091.
[I 2024-12-03 18:39:48,199] Trial 51 finished with value: 0.6024520900757708 and parameters: {'kernel': 'rbf', 'C': 17.70463292997955, 'gamma': 0.10426293432634631, 'epsilon': 0.0015384786231597127}. Best is trial 58 with value: 0.4679277933792091.
[I 2024-12-03 18:39:48,205] Trial 58 finished with value: 0.4679277933792091 and parameters: {'kernel': 'rbf', 'C': 92.86656070625796, 'gamma': 0.012732589558618163, 'epsilon': 0.0012188806716655687}. Best is trial 58 with value: 0.4679277933792091.
[I 2024-12-03 18:39:48,402] Trial 53 finished with value: 0.5157815345604592 and parameters: {'kernel': 'rbf', 'C': 72.61225129575573, 'gamma': 0.005698331192616043, 'epsilon': 0.002014452920565245}. Best is trial 58 with value: 0.4679277933792091.
[I 2024-12-03 18:39:49,111] Trial 68 finished with value: 112.82751704776192 and parameters: {'kernel': 'sigmoid', 'C': 36.95924080765936, 'gamma': 0.016884711775738, 'epsilon': 0.43986821201023196}. Best is trial 58 with value: 0.4679277933792091.
