[I 2024-12-04 15:36:51,712] Trial 2013 finished with value: 0.7380913413593607 and parameters: {'n_estimators': 221, 'max_depth': 20, 'min_samples_split': 26, 'min_samples_leaf': 1, 'max_features': 'sqrt', 'bootstrap': True, 'criterion': 'absolute_error'}. Best is trial 1025 with value: 0.41844370194907604.
[I 2024-12-04 15:36:53,646] Trial 2006 finished with value: 0.6414092549373535 and parameters: {'n_estimators': 918, 'max_depth': 21, 'min_samples_split': 33, 'min_samples_leaf': 4, 'max_features': None, 'bootstrap': False, 'criterion': 'squared_error'}. Best is trial 1025 with value: 0.41844370194907604.
[I 2024-12-04 15:36:56,086] Trial 1986 finished with value: 0.4610355454259548 and parameters: {'n_estimators': 681, 'max_depth': 31, 'min_samples_split': 2, 'min_samples_leaf': 2, 'max_features': None, 'bootstrap': True, 'criterion': 'absolute_error'}. Best is trial 1025 with value: 0.41844370194907604.
[I 2024-12-04 15:36:56,139] Trial 2004 finished with value: 0.4203863638102061 and parameters: {'n_estimators': 823, 'max_depth': 38, 'min_samples_split': 2, 'min_samples_leaf': 1, 'max_features': None, 'bootstrap': True, 'criterion': 'squared_error'}. Best is trial 1025 with value: 0.41844370194907604.
[I 2024-12-04 15:37:06,850] Trial 2010 finished with value: 0.4199304479144387 and parameters: {'n_estimators': 773, 'max_depth': 38, 'min_samples_split': 2, 'min_samples_leaf': 1, 'max_features': None, 'bootstrap': True, 'criterion': 'squared_error'}. Best is trial 1025 with value: 0.41844370194907604.
[I 2024-12-04 15:37:15,785] Trial 2023 finished with value: 0.5518871143517161 and parameters: {'n_estimators': 698, 'max_depth': 28, 'min_samples_split': 18, 'min_samples_leaf': 1, 'max_features': None, 'bootstrap': False, 'criterion': 'squared_error'}. Best is trial 1025 with value: 0.41844370194907604.
[I 2024-12-04 15:37:15,787] Trial 2024 finished with value: 0.9564446138331684 and parameters: {'n_estimators': 357, 'max_depth': 5, 'min_samples_split': 39, 'min_samples_leaf': 1, 'max_features': 'sqrt', 'bootstrap': False, 'criterion': 'absolute_error'}. Best is trial 1025 with value: 0.41844370194907604.
[I 2024-12-04 15:37:15,917] Trial 2032 finished with value: 1.0480797770155184 and parameters: {'n_estimators': 361, 'max_depth': 50, 'min_samples_split': 9, 'min_samples_leaf': 6, 'max_features': 'log2', 'bootstrap': False, 'criterion': 'squared_error'}. Best is trial 1025 with value: 0.41844370194907604.
[I 2024-12-04 15:37:18,227] Trial 2012 finished with value: 0.4239094532239326 and parameters: {'n_estimators': 875, 'max_depth': 37, 'min_samples_split': 3, 'min_samples_leaf': 1, 'max_features': None, 'bootstrap': True, 'criterion': 'squared_error'}. Best is trial 1025 with value: 0.41844370194907604.
[I 2024-12-04 15:37:21,353] Trial 2011 finished with value: 0.4314222395610669 and parameters: {'n_estimators': 831, 'max_depth': 44, 'min_samples_split': 4, 'min_samples_leaf': 1, 'max_features': None, 'bootstrap': True, 'criterion': 'squared_error'}. Best is trial 1025 with value: 0.41844370194907604.
[I 2024-12-04 15:37:21,772] Trial 2014 finished with value: 0.4194823115908986 and parameters: {'n_estimators': 830, 'max_depth': 41, 'min_samples_split': 2, 'min_samples_leaf': 1, 'max_features': None, 'bootstrap': True, 'criterion': 'squared_error'}. Best is trial 1025 with value: 0.41844370194907604.
[I 2024-12-04 15:37:21,780] Trial 2015 finished with value: 0.4652853504021068 and parameters: {'n_estimators': 833, 'max_depth': 47, 'min_samples_split': 2, 'min_samples_leaf': 2, 'max_features': None, 'bootstrap': True, 'criterion': 'squared_error'}. Best is trial 1025 with value: 0.41844370194907604.
[I 2024-12-04 15:37:23,526] Trial 2017 finished with value: 0.46554647628195023 and parameters: {'n_estimators': 805, 'max_depth': 34, 'min_samples_split': 3, 'min_samples_leaf': 2, 'max_features': None, 'bootstrap': True, 'criterion': 'squared_error'}. Best is trial 1025 with value: 0.41844370194907604.
[I 2024-12-04 15:37:26,882] Trial 2018 finished with value: 0.4217262587455299 and parameters: {'n_estimators': 796, 'max_depth': 44, 'min_samples_split': 2, 'min_samples_leaf': 1, 'max_features': None, 'bootstrap': True, 'criterion': 'squared_error'}. Best is trial 1025 with value: 0.41844370194907604.
[I 2024-12-04 15:37:27,184] Trial 2016 finished with value: 0.41955363906773274 and parameters: {'n_estimators': 824, 'max_depth': 41, 'min_samples_split': 2, 'min_samples_leaf': 1, 'max_features': None, 'bootstrap': True, 'criterion': 'squared_error'}. Best is trial 1025 with value: 0.41844370194907604.
[I 2024-12-04 15:37:27,896] Trial 2026 finished with value: 0.6493785599310117 and parameters: {'n_estimators': 489, 'max_depth': 13, 'min_samples_split': 29, 'min_samples_leaf': 6, 'max_features': None, 'bootstrap': True, 'criterion': 'absolute_error'}. Best is trial 1025 with value: 0.41844370194907604.
[I 2024-12-04 15:37:28,113] Trial 2019 finished with value: 0.46510393695896407 and parameters: {'n_estimators': 855, 'max_depth': 43, 'min_samples_split': 4, 'min_samples_leaf': 2, 'max_features': None, 'bootstrap': True, 'criterion': 'squared_error'}. Best is trial 1025 with value: 0.41844370194907604.
[I 2024-12-04 15:37:30,391] Trial 2029 finished with value: 1.0525461537416596 and parameters: {'n_estimators': 857, 'max_depth': 24, 'min_samples_split': 18, 'min_samples_leaf': 7, 'max_features': 'log2', 'bootstrap': True, 'criterion': 'absolute_error'}. Best is trial 1025 with value: 0.41844370194907604.
[I 2024-12-04 15:37:30,722] Trial 2020 finished with value: 0.4242155099471366 and parameters: {'n_estimators': 838, 'max_depth': 42, 'min_samples_split': 3, 'min_samples_leaf': 1, 'max_features': None, 'bootstrap': True, 'criterion': 'squared_error'}. Best is trial 1025 with value: 0.41844370194907604.
[I 2024-12-04 15:37:33,409] Trial 2021 finished with value: 0.4245248518462065 and parameters: {'n_estimators': 833, 'max_depth': 49, 'min_samples_split': 3, 'min_samples_leaf': 1, 'max_features': None, 'bootstrap': True, 'criterion': 'squared_error'}. Best is trial 1025 with value: 0.41844370194907604.
[I 2024-12-04 15:37:38,359] Trial 2025 finished with value: 0.4242222551865438 and parameters: {'n_estimators': 858, 'max_depth': 36, 'min_samples_split': 3, 'min_samples_leaf': 1, 'max_features': None, 'bootstrap': True, 'criterion': 'squared_error'}. Best is trial 1025 with value: 0.41844370194907604.
[I 2024-12-04 15:37:38,402] Trial 2030 finished with value: 0.49839191142678835 and parameters: {'n_estimators': 853, 'max_depth': 43, 'min_samples_split': 2, 'min_samples_leaf': 1, 'max_features': 'sqrt', 'bootstrap': True, 'criterion': 'squared_error'}. Best is trial 1025 with value: 0.41844370194907604.
[I 2024-12-04 15:37:41,255] Trial 2031 finished with value: 0.43136900229688063 and parameters: {'n_estimators': 749, 'max_depth': 37, 'min_samples_split': 4, 'min_samples_leaf': 1, 'max_features': None, 'bootstrap': True, 'criterion': 'squared_error'}. Best is trial 1025 with value: 0.41844370194907604.
[I 2024-12-04 15:37:44,829] Trial 1980 finished with value: 0.5589260873078342 and parameters: {'n_estimators': 673, 'max_depth': 34, 'min_samples_split': 4, 'min_samples_leaf': 1, 'max_features': None, 'bootstrap': False, 'criterion': 'absolute_error'}. Best is trial 1025 with value: 0.41844370194907604.
[I 2024-12-04 15:37:48,838] Trial 2022 finished with value: 0.4208588042788122 and parameters: {'n_estimators': 821, 'max_depth': 36, 'min_samples_split': 2, 'min_samples_leaf': 1, 'max_features': None, 'bootstrap': True, 'criterion': 'squared_error'}. Best is trial 1025 with value: 0.41844370194907604.
[I 2024-12-04 15:37:51,117] Trial 2005 finished with value: 0.43595639251518636 and parameters: {'n_estimators': 534, 'max_depth': 46, 'min_samples_split': 5, 'min_samples_leaf': 1, 'max_features': None, 'bootstrap': True, 'criterion': 'absolute_error'}. Best is trial 1025 with value: 0.41844370194907604.
[I 2024-12-04 15:37:55,203] Trial 2037 finished with value: 0.5099937875552255 and parameters: {'n_estimators': 872, 'max_depth': 39, 'min_samples_split': 3, 'min_samples_leaf': 1, 'max_features': None, 'bootstrap': False, 'criterion': 'squared_error'}. Best is trial 1025 with value: 0.41844370194907604.
[I 2024-12-04 15:37:55,692] Trial 2033 finished with value: 0.4652776156875583 and parameters: {'n_estimators': 841, 'max_depth': 43, 'min_samples_split': 3, 'min_samples_leaf': 2, 'max_features': None, 'bootstrap': True, 'criterion': 'squared_error'}. Best is trial 1025 with value: 0.41844370194907604.
[I 2024-12-04 15:37:57,023] Trial 2027 finished with value: 0.46470361740993993 and parameters: {'n_estimators': 886, 'max_depth': 30, 'min_samples_split': 2, 'min_samples_leaf': 2, 'max_features': None, 'bootstrap': True, 'criterion': 'squared_error'}. Best is trial 1025 with value: 0.41844370194907604.
[I 2024-12-04 15:37:58,037] Trial 2036 finished with value: 0.46547269982616407 and parameters: {'n_estimators': 831, 'max_depth': 42, 'min_samples_split': 2, 'min_samples_leaf': 2, 'max_features': None, 'bootstrap': True, 'criterion': 'squared_error'}. Best is trial 1025 with value: 0.41844370194907604.
[I 2024-12-04 15:37:58,462] Trial 2034 finished with value: 0.4194050124507572 and parameters: {'n_estimators': 827, 'max_depth': 41, 'min_samples_split': 2, 'min_samples_leaf': 1, 'max_features': None, 'bootstrap': True, 'criterion': 'squared_error'}. Best is trial 1025 with value: 0.41844370194907604.
[I 2024-12-04 15:37:59,225] Trial 2045 finished with value: 0.6059490339117863 and parameters: {'n_estimators': 676, 'max_depth': 32, 'min_samples_split': 2, 'min_samples_leaf': 2, 'max_features': None, 'bootstrap': False, 'criterion': 'squared_error'}. Best is trial 1025 with value: 0.41844370194907604.
[I 2024-12-04 15:37:59,227] Trial 2028 finished with value: 0.42105908327247016 and parameters: {'n_estimators': 843, 'max_depth': 33, 'min_samples_split': 2, 'min_samples_leaf': 1, 'max_features': None, 'bootstrap': True, 'criterion': 'squared_error'}. Best is trial 1025 with value: 0.41844370194907604.
[I 2024-12-04 15:38:01,786] Trial 2047 finished with value: 0.6333695323914252 and parameters: {'n_estimators': 845, 'max_depth': 43, 'min_samples_split': 4, 'min_samples_leaf': 2, 'max_features': 'sqrt', 'bootstrap': False, 'criterion': 'squared_error'}. Best is trial 1025 with value: 0.41844370194907604.
[I 2024-12-04 15:38:12,056] Trial 2038 finished with value: 0.4210612067695027 and parameters: {'n_estimators': 835, 'max_depth': 44, 'min_samples_split': 2, 'min_samples_leaf': 1, 'max_features': None, 'bootstrap': True, 'criterion': 'squared_error'}. Best is trial 1025 with value: 0.41844370194907604.
[I 2024-12-04 15:38:12,524] Trial 2042 finished with value: 0.42284984408107135 and parameters: {'n_estimators': 672, 'max_depth': 44, 'min_samples_split': 2, 'min_samples_leaf': 1, 'max_features': None, 'bootstrap': True, 'criterion': 'squared_error'}. Best is trial 1025 with value: 0.41844370194907604.
[I 2024-12-04 15:38:14,155] Trial 2050 finished with value: 0.5112495766004557 and parameters: {'n_estimators': 600, 'max_depth': 28, 'min_samples_split': 11, 'min_samples_leaf': 3, 'max_features': None, 'bootstrap': True, 'criterion': 'squared_error'}. Best is trial 1025 with value: 0.41844370194907604.
[I 2024-12-04 15:38:14,781] Trial 2046 finished with value: 0.4320774645547753 and parameters: {'n_estimators': 800, 'max_depth': 36, 'min_samples_split': 4, 'min_samples_leaf': 1, 'max_features': None, 'bootstrap': True, 'criterion': 'squared_error'}. Best is trial 1025 with value: 0.41844370194907604.
[I 2024-12-04 15:38:14,951] Trial 2040 finished with value: 0.42146663770998255 and parameters: {'n_estimators': 820, 'max_depth': 34, 'min_samples_split': 2, 'min_samples_leaf': 1, 'max_features': None, 'bootstrap': True, 'criterion': 'squared_error'}. Best is trial 1025 with value: 0.41844370194907604.
[I 2024-12-04 15:38:16,153] Trial 2039 finished with value: 0.41925809742165315 and parameters: {'n_estimators': 862, 'max_depth': 41, 'min_samples_split': 2, 'min_samples_leaf': 1, 'max_features': None, 'bootstrap': True, 'criterion': 'squared_error'}. Best is trial 1025 with value: 0.41844370194907604.
[I 2024-12-04 15:38:16,579] Trial 2044 finished with value: 0.4213702988891913 and parameters: {'n_estimators': 673, 'max_depth': 48, 'min_samples_split': 2, 'min_samples_leaf': 1, 'max_features': None, 'bootstrap': True, 'criterion': 'squared_error'}. Best is trial 1025 with value: 0.41844370194907604.
[I 2024-12-04 15:38:17,751] Trial 2041 finished with value: 0.4206188000596647 and parameters: {'n_estimators': 856, 'max_depth': 36, 'min_samples_split': 2, 'min_samples_leaf': 1, 'max_features': None, 'bootstrap': True, 'criterion': 'squared_error'}. Best is trial 1025 with value: 0.41844370194907604.
[I 2024-12-04 15:38:18,824] Trial 2055 finished with value: 1.0001605312485027 and parameters: {'n_estimators': 341, 'max_depth': 20, 'min_samples_split': 2, 'min_samples_leaf': 8, 'max_features': 'sqrt', 'bootstrap': True, 'criterion': 'squared_error'}. Best is trial 1025 with value: 0.41844370194907604.
[I 2024-12-04 15:38:21,410] Trial 2059 finished with value: 1.0563031507850786 and parameters: {'n_estimators': 495, 'max_depth': 12, 'min_samples_split': 10, 'min_samples_leaf': 14, 'max_features': 'log2', 'bootstrap': False, 'criterion': 'absolute_error'}. Best is trial 1025 with value: 0.41844370194907604.
[I 2024-12-04 15:38:25,341] Trial 2049 finished with value: 0.6169022634534848 and parameters: {'n_estimators': 770, 'max_depth': 42, 'min_samples_split': 2, 'min_samples_leaf': 1, 'max_features': 'log2', 'bootstrap': True, 'criterion': 'squared_error'}. Best is trial 1025 with value: 0.41844370194907604.
[I 2024-12-04 15:38:25,344] Trial 2043 finished with value: 0.4655442464747726 and parameters: {'n_estimators': 831, 'max_depth': 36, 'min_samples_split': 3, 'min_samples_leaf': 2, 'max_features': None, 'bootstrap': True, 'criterion': 'squared_error'}. Best is trial 1025 with value: 0.41844370194907604.
[I 2024-12-04 15:38:25,652] Trial 2053 finished with value: 0.426285824404766 and parameters: {'n_estimators': 653, 'max_depth': 33, 'min_samples_split': 3, 'min_samples_leaf': 1, 'max_features': None, 'bootstrap': True, 'criterion': 'squared_error'}. Best is trial 1025 with value: 0.41844370194907604.
[I 2024-12-04 15:38:25,663] Trial 2054 finished with value: 0.4647589928016351 and parameters: {'n_estimators': 609, 'max_depth': 40, 'min_samples_split': 2, 'min_samples_leaf': 2, 'max_features': None, 'bootstrap': True, 'criterion': 'squared_error'}. Best is trial 1025 with value: 0.41844370194907604.
[I 2024-12-04 15:38:25,663] Trial 2008 finished with value: 0.4275954053665929 and parameters: {'n_estimators': 822, 'max_depth': 42, 'min_samples_split': 3, 'min_samples_leaf': 1, 'max_features': None, 'bootstrap': True, 'criterion': 'absolute_error'}. Best is trial 1025 with value: 0.41844370194907604.
[I 2024-12-04 15:38:25,691] Trial 1991 finished with value: 0.5528765033326056 and parameters: {'n_estimators': 854, 'max_depth': 46, 'min_samples_split': 2, 'min_samples_leaf': 1, 'max_features': None, 'bootstrap': False, 'criterion': 'absolute_error'}. Best is trial 1025 with value: 0.41844370194907604.
[I 2024-12-04 15:38:31,641] Trial 2048 finished with value: 0.4211451778435302 and parameters: {'n_estimators': 863, 'max_depth': 42, 'min_samples_split': 2, 'min_samples_leaf': 1, 'max_features': None, 'bootstrap': True, 'criterion': 'squared_error'}. Best is trial 1025 with value: 0.41844370194907604.
[I 2024-12-04 15:38:33,077] Trial 2069 finished with value: 1.0547240344957107 and parameters: {'n_estimators': 456, 'max_depth': 6, 'min_samples_split': 2, 'min_samples_leaf': 7, 'max_features': 'log2', 'bootstrap': False, 'criterion': 'squared_error'}. Best is trial 1025 with value: 0.41844370194907604.
[I 2024-12-04 15:38:33,467] Trial 2068 finished with value: 0.8930476735579083 and parameters: {'n_estimators': 922, 'max_depth': 34, 'min_samples_split': 14, 'min_samples_leaf': 2, 'max_features': 'log2', 'bootstrap': False, 'criterion': 'squared_error'}. Best is trial 1025 with value: 0.41844370194907604.
[I 2024-12-04 15:38:34,477] Trial 2066 finished with value: 0.6584280528745841 and parameters: {'n_estimators': 245, 'max_depth': 7, 'min_samples_split': 4, 'min_samples_leaf': 6, 'max_features': None, 'bootstrap': True, 'criterion': 'absolute_error'}. Best is trial 1025 with value: 0.41844370194907604.
[I 2024-12-04 15:38:34,921] Trial 2052 finished with value: 0.42125295233050447 and parameters: {'n_estimators': 838, 'max_depth': 45, 'min_samples_split': 2, 'min_samples_leaf': 1, 'max_features': None, 'bootstrap': True, 'criterion': 'squared_error'}. Best is trial 1025 with value: 0.41844370194907604.
[I 2024-12-04 15:38:36,187] Trial 2057 finished with value: 0.4213136604289829 and parameters: {'n_estimators': 837, 'max_depth': 42, 'min_samples_split': 2, 'min_samples_leaf': 1, 'max_features': None, 'bootstrap': True, 'criterion': 'squared_error'}. Best is trial 1025 with value: 0.41844370194907604.
[I 2024-12-04 15:38:36,191] Trial 2056 finished with value: 0.42086672669545055 and parameters: {'n_estimators': 655, 'max_depth': 39, 'min_samples_split': 2, 'min_samples_leaf': 1, 'max_features': None, 'bootstrap': True, 'criterion': 'squared_error'}. Best is trial 1025 with value: 0.41844370194907604.
[I 2024-12-04 15:38:40,249] Trial 2060 finished with value: 0.46529416531759255 and parameters: {'n_estimators': 839, 'max_depth': 37, 'min_samples_split': 2, 'min_samples_leaf': 2, 'max_features': None, 'bootstrap': True, 'criterion': 'squared_error'}. Best is trial 1025 with value: 0.41844370194907604.
[I 2024-12-04 15:38:40,287] Trial 2067 finished with value: 0.4649190565295429 and parameters: {'n_estimators': 672, 'max_depth': 43, 'min_samples_split': 4, 'min_samples_leaf': 2, 'max_features': None, 'bootstrap': True, 'criterion': 'squared_error'}. Best is trial 1025 with value: 0.41844370194907604.
[I 2024-12-04 15:38:40,830] Trial 2062 finished with value: 0.4316388971905855 and parameters: {'n_estimators': 862, 'max_depth': 36, 'min_samples_split': 4, 'min_samples_leaf': 1, 'max_features': None, 'bootstrap': True, 'criterion': 'squared_error'}. Best is trial 1025 with value: 0.41844370194907604.
[I 2024-12-04 15:38:41,457] Trial 2058 finished with value: 0.4214164032961143 and parameters: {'n_estimators': 819, 'max_depth': 34, 'min_samples_split': 2, 'min_samples_leaf': 1, 'max_features': None, 'bootstrap': True, 'criterion': 'squared_error'}. Best is trial 1025 with value: 0.41844370194907604.
[I 2024-12-04 15:38:42,325] Trial 2063 finished with value: 0.4646507777291851 and parameters: {'n_estimators': 725, 'max_depth': 42, 'min_samples_split': 2, 'min_samples_leaf': 2, 'max_features': None, 'bootstrap': True, 'criterion': 'squared_error'}. Best is trial 1025 with value: 0.41844370194907604.
[I 2024-12-04 15:38:47,336] Trial 2070 finished with value: 0.9599557357377911 and parameters: {'n_estimators': 733, 'max_depth': 49, 'min_samples_split': 4, 'min_samples_leaf': 2, 'max_features': 'log2', 'bootstrap': True, 'criterion': 'squared_error'}. Best is trial 1025 with value: 0.41844370194907604.
[I 2024-12-04 15:38:47,376] Trial 2061 finished with value: 0.4317847520007694 and parameters: {'n_estimators': 728, 'max_depth': 43, 'min_samples_split': 4, 'min_samples_leaf': 1, 'max_features': None, 'bootstrap': True, 'criterion': 'squared_error'}. Best is trial 1025 with value: 0.41844370194907604.
[I 2024-12-04 15:38:50,078] Trial 2064 finished with value: 0.6602651236415317 and parameters: {'n_estimators': 606, 'max_depth': 27, 'min_samples_split': 2, 'min_samples_leaf': 8, 'max_features': None, 'bootstrap': True, 'criterion': 'absolute_error'}. Best is trial 1025 with value: 0.41844370194907604.
[I 2024-12-04 15:38:53,534] Trial 2072 finished with value: 0.42126917574143313 and parameters: {'n_estimators': 682, 'max_depth': 37, 'min_samples_split': 2, 'min_samples_leaf': 1, 'max_features': None, 'bootstrap': True, 'criterion': 'squared_error'}. Best is trial 1025 with value: 0.41844370194907604.
[I 2024-12-04 15:38:54,683] Trial 2065 finished with value: 0.42057590341210693 and parameters: {'n_estimators': 852, 'max_depth': 36, 'min_samples_split': 2, 'min_samples_leaf': 1, 'max_features': None, 'bootstrap': True, 'criterion': 'squared_error'}. Best is trial 1025 with value: 0.41844370194907604.
[I 2024-12-04 15:38:57,108] Trial 2080 finished with value: 0.7284224966341892 and parameters: {'n_estimators': 186, 'max_depth': 26, 'min_samples_split': 11, 'min_samples_leaf': 15, 'max_features': None, 'bootstrap': False, 'criterion': 'absolute_error'}. Best is trial 1025 with value: 0.41844370194907604.
[I 2024-12-04 15:39:00,638] Trial 2077 finished with value: 0.4222697178680023 and parameters: {'n_estimators': 753, 'max_depth': 49, 'min_samples_split': 2, 'min_samples_leaf': 1, 'max_features': None, 'bootstrap': True, 'criterion': 'squared_error'}. Best is trial 1025 with value: 0.41844370194907604.
[I 2024-12-04 15:39:01,189] Trial 2051 finished with value: 0.7272746905701625 and parameters: {'n_estimators': 977, 'max_depth': 6, 'min_samples_split': 8, 'min_samples_leaf': 5, 'max_features': None, 'bootstrap': False, 'criterion': 'absolute_error'}. Best is trial 1025 with value: 0.41844370194907604.
[I 2024-12-04 15:39:02,463] Trial 2074 finished with value: 0.421829378325246 and parameters: {'n_estimators': 676, 'max_depth': 37, 'min_samples_split': 2, 'min_samples_leaf': 1, 'max_features': None, 'bootstrap': True, 'criterion': 'squared_error'}. Best is trial 1025 with value: 0.41844370194907604.
