[I 2024-12-03 18:51:59,530] Trial 1307 finished with value: 0.8206599777385011 and parameters: {'kernel': 'rbf', 'C': 0.07047520449947897, 'gamma': 0.0023988752563430748, 'epsilon': 0.13926719075327113}. Best is trial 88 with value: 0.3542875001421725.
[I 2024-12-03 18:52:00,813] Trial 1309 finished with value: 18.736250132840492 and parameters: {'kernel': 'sigmoid', 'C': 0.7518400678300922, 'gamma': 0.2978859413127136, 'epsilon': 0.7157683345933962}. Best is trial 88 with value: 0.3542875001421725.
[I 2024-12-03 18:52:00,963] Trial 1308 finished with value: 0.4013512407485783 and parameters: {'kernel': 'rbf', 'C': 23.173469795327154, 'gamma': 0.010219294607825186, 'epsilon': 0.029802746770282752}. Best is trial 88 with value: 0.3542875001421725.
[I 2024-12-03 18:52:02,097] Trial 1310 finished with value: 0.46361602091536425 and parameters: {'kernel': 'rbf', 'C': 7.378264769024948, 'gamma': 0.10008753486796121, 'epsilon': 0.050882559140603634}. Best is trial 88 with value: 0.3542875001421725.
[I 2024-12-03 18:52:03,490] Trial 1311 finished with value: 1.1378835722520575 and parameters: {'kernel': 'poly', 'C': 0.0012956243887031222, 'gamma': 0.012747621428970799, 'epsilon': 0.009261030963694303}. Best is trial 88 with value: 0.3542875001421725.
[I 2024-12-03 18:52:04,001] Trial 1312 finished with value: 0.4046650164975911 and parameters: {'kernel': 'rbf', 'C': 20.900478839012777, 'gamma': 0.08839023022428064, 'epsilon': 0.06163900567887074}. Best is trial 88 with value: 0.3542875001421725.
[I 2024-12-03 18:52:04,313] Trial 1306 finished with value: 2.893154269364359 and parameters: {'kernel': 'poly', 'C': 41.56107733003321, 'gamma': 0.013877106155001293, 'epsilon': 0.3091104691201134}. Best is trial 88 with value: 0.3542875001421725.
[I 2024-12-03 18:52:06,578] Trial 1313 finished with value: 0.37067402102195374 and parameters: {'kernel': 'rbf', 'C': 77.89740143724428, 'gamma': 0.040172726155646724, 'epsilon': 0.03489444827003352}. Best is trial 88 with value: 0.3542875001421725.
[I 2024-12-03 18:52:06,579] Trial 1314 finished with value: 0.39409660808377484 and parameters: {'kernel': 'rbf', 'C': 27.205272535137865, 'gamma': 0.042663495261677425, 'epsilon': 0.04639185610485568}. Best is trial 88 with value: 0.3542875001421725.
[I 2024-12-03 18:52:06,972] Trial 1230 finished with value: 0.8032856858713091 and parameters: {'kernel': 'linear', 'C': 53.50934879263242, 'gamma': 0.046432656596890685, 'epsilon': 0.0620006490740073}. Best is trial 88 with value: 0.3542875001421725.
[I 2024-12-03 18:52:07,927] Trial 1315 finished with value: 0.3903830481409043 and parameters: {'kernel': 'rbf', 'C': 74.99431610063326, 'gamma': 0.09093320314847593, 'epsilon': 0.04043487931958255}. Best is trial 88 with value: 0.3542875001421725.
[I 2024-12-03 18:52:09,075] Trial 1316 finished with value: 0.4136354238270991 and parameters: {'kernel': 'rbf', 'C': 81.09086912734422, 'gamma': 0.011933087807720172, 'epsilon': 0.036612768579046065}. Best is trial 88 with value: 0.3542875001421725.
[I 2024-12-03 18:52:09,641] Trial 1317 finished with value: 0.41515049422339967 and parameters: {'kernel': 'rbf', 'C': 17.831437682196928, 'gamma': 0.0952014673695693, 'epsilon': 0.11689209826348687}. Best is trial 88 with value: 0.3542875001421725.
[I 2024-12-03 18:52:10,039] Trial 1318 finished with value: 0.3702299865989145 and parameters: {'kernel': 'rbf', 'C': 95.22817734142392, 'gamma': 0.021364646236126387, 'epsilon': 0.07470922197925456}. Best is trial 88 with value: 0.3542875001421725.
[I 2024-12-03 18:52:11,164] Trial 1319 finished with value: 0.3669524853502537 and parameters: {'kernel': 'rbf', 'C': 73.9408073233952, 'gamma': 0.0660456911958396, 'epsilon': 0.07662175265311963}. Best is trial 88 with value: 0.3542875001421725.
[I 2024-12-03 18:52:12,052] Trial 1320 finished with value: 0.3866484416793777 and parameters: {'kernel': 'rbf', 'C': 87.6427365967212, 'gamma': 0.0843431804560947, 'epsilon': 0.1056171302533892}. Best is trial 88 with value: 0.3542875001421725.
[I 2024-12-03 18:52:13,239] Trial 1322 finished with value: 0.407519545990825 and parameters: {'kernel': 'rbf', 'C': 91.3895397556033, 'gamma': 0.1022531247327713, 'epsilon': 0.15643790133947355}. Best is trial 88 with value: 0.3542875001421725.
[I 2024-12-03 18:52:14,625] Trial 1323 finished with value: 0.418048360561555 and parameters: {'kernel': 'rbf', 'C': 21.362424747067237, 'gamma': 0.015705611060777978, 'epsilon': 0.057590470889862945}. Best is trial 88 with value: 0.3542875001421725.
[I 2024-12-03 18:52:14,905] Trial 1324 finished with value: 1.013856606045406 and parameters: {'kernel': 'rbf', 'C': 0.026939020681365732, 'gamma': 0.00044736091511151066, 'epsilon': 0.0010509032982380156}. Best is trial 88 with value: 0.3542875001421725.
[I 2024-12-03 18:52:15,608] Trial 1325 finished with value: 0.5252166088714394 and parameters: {'kernel': 'rbf', 'C': 90.05019890561594, 'gamma': 0.22157777314979019, 'epsilon': 0.07008767677484284}. Best is trial 88 with value: 0.3542875001421725.
[I 2024-12-03 18:52:16,230] Trial 1326 finished with value: 0.42229697376294345 and parameters: {'kernel': 'rbf', 'C': 86.64403687751876, 'gamma': 0.12709161344310893, 'epsilon': 0.05433692722183243}. Best is trial 88 with value: 0.3542875001421725.
[I 2024-12-03 18:52:17,096] Trial 1327 finished with value: 0.6141552370934703 and parameters: {'kernel': 'rbf', 'C': 97.68110173195583, 'gamma': 0.3250164750112845, 'epsilon': 0.17773574902710454}. Best is trial 88 with value: 0.3542875001421725.
[I 2024-12-03 18:52:17,356] Trial 1328 finished with value: 0.4189620082448712 and parameters: {'kernel': 'rbf', 'C': 20.56861124506725, 'gamma': 0.10375888982460006, 'epsilon': 0.13719404924865372}. Best is trial 88 with value: 0.3542875001421725.
[I 2024-12-03 18:52:17,856] Trial 1329 finished with value: 0.9548059479310727 and parameters: {'kernel': 'rbf', 'C': 0.37037826144397246, 'gamma': 0.00017874590770495765, 'epsilon': 0.9730480749638223}. Best is trial 88 with value: 0.3542875001421725.
[I 2024-12-03 18:52:18,928] Trial 1330 finished with value: 1404.967986616243 and parameters: {'kernel': 'sigmoid', 'C': 65.48119774787037, 'gamma': 0.04056961894062621, 'epsilon': 0.08107702646900322}. Best is trial 88 with value: 0.3542875001421725.
[I 2024-12-03 18:52:19,627] Trial 1331 finished with value: 1.0539170807931082 and parameters: {'kernel': 'poly', 'C': 1.2923746395736486, 'gamma': 0.00026945194891587505, 'epsilon': 0.015912753510579785}. Best is trial 88 with value: 0.3542875001421725.
[I 2024-12-03 18:52:20,000] Trial 1332 finished with value: 0.4163626071689252 and parameters: {'kernel': 'rbf', 'C': 16.280716751495902, 'gamma': 0.04661355882941282, 'epsilon': 0.10164302610823368}. Best is trial 88 with value: 0.3542875001421725.
[I 2024-12-03 18:52:20,628] Trial 1333 finished with value: 0.42825201736821744 and parameters: {'kernel': 'rbf', 'C': 26.849646641272702, 'gamma': 0.01337940006336397, 'epsilon': 0.10477124716416232}. Best is trial 88 with value: 0.3542875001421725.
[I 2024-12-03 18:52:21,934] Trial 1334 finished with value: 0.8495976077677067 and parameters: {'kernel': 'linear', 'C': 0.043448170010100845, 'gamma': 0.38233545310727124, 'epsilon': 0.0470299844094193}. Best is trial 88 with value: 0.3542875001421725.
[I 2024-12-03 18:52:22,171] Trial 1335 finished with value: 0.39590762518562234 and parameters: {'kernel': 'rbf', 'C': 96.56841980430615, 'gamma': 0.09339993749058784, 'epsilon': 0.15630452786151888}. Best is trial 88 with value: 0.3542875001421725.
[I 2024-12-03 18:52:22,354] Trial 1336 finished with value: 0.4671868396968132 and parameters: {'kernel': 'rbf', 'C': 26.288959660455006, 'gamma': 0.01607001590637712, 'epsilon': 0.559201639043295}. Best is trial 88 with value: 0.3542875001421725.
[I 2024-12-03 18:52:25,405] Trial 1338 finished with value: 0.36284010377062725 and parameters: {'kernel': 'rbf', 'C': 90.49222653400562, 'gamma': 0.03545436073124071, 'epsilon': 0.13177788541704497}. Best is trial 88 with value: 0.3542875001421725.
[I 2024-12-03 18:52:26,159] Trial 1339 finished with value: 0.47489784664618395 and parameters: {'kernel': 'rbf', 'C': 2.486014175325185, 'gamma': 0.034813230476395014, 'epsilon': 0.01446978264212382}. Best is trial 88 with value: 0.3542875001421725.
[I 2024-12-03 18:52:26,162] Trial 1340 finished with value: 0.39594090724700715 and parameters: {'kernel': 'rbf', 'C': 25.409081937024617, 'gamma': 0.0874548742277799, 'epsilon': 0.09331727145939302}. Best is trial 88 with value: 0.3542875001421725.
[I 2024-12-03 18:52:27,912] Trial 1341 finished with value: 0.40948656626121843 and parameters: {'kernel': 'rbf', 'C': 19.775417327308123, 'gamma': 0.04643069833445061, 'epsilon': 0.05295340351892443}. Best is trial 88 with value: 0.3542875001421725.
[I 2024-12-03 18:52:27,941] Trial 1343 finished with value: 0.3914827414395527 and parameters: {'kernel': 'rbf', 'C': 92.20959986483201, 'gamma': 0.0366843422788594, 'epsilon': 0.40290260103515374}. Best is trial 88 with value: 0.3542875001421725.
[I 2024-12-03 18:52:28,325] Trial 1291 finished with value: 0.7388777328860391 and parameters: {'kernel': 'linear', 'C': 74.58795719073272, 'gamma': 0.04637571967785693, 'epsilon': 0.2420953068544372}. Best is trial 88 with value: 0.3542875001421725.
[I 2024-12-03 18:52:28,932] Trial 1342 finished with value: 0.36322587641909937 and parameters: {'kernel': 'rbf', 'C': 94.6059287095101, 'gamma': 0.03570221188999756, 'epsilon': 0.10362841692454618}. Best is trial 88 with value: 0.3542875001421725.
[I 2024-12-03 18:52:30,778] Trial 1345 finished with value: 71.17539117584988 and parameters: {'kernel': 'sigmoid', 'C': 1.9522944424808053, 'gamma': 0.6890247353214511, 'epsilon': 0.0033750818879777537}. Best is trial 88 with value: 0.3542875001421725.
[I 2024-12-03 18:52:30,779] Trial 1346 finished with value: 0.42870184670263706 and parameters: {'kernel': 'rbf', 'C': 16.047993850931555, 'gamma': 0.018018118131192782, 'epsilon': 0.23837315701671008}. Best is trial 88 with value: 0.3542875001421725.
[I 2024-12-03 18:52:30,856] Trial 1344 finished with value: 0.36775886121754575 and parameters: {'kernel': 'rbf', 'C': 96.8097112550592, 'gamma': 0.026356909735642326, 'epsilon': 0.07502739390533386}. Best is trial 88 with value: 0.3542875001421725.
[I 2024-12-03 18:52:31,267] Trial 1347 finished with value: 0.46908344741886693 and parameters: {'kernel': 'rbf', 'C': 17.277601632051013, 'gamma': 0.050972505022431176, 'epsilon': 0.5299370254813793}. Best is trial 88 with value: 0.3542875001421725.
[I 2024-12-03 18:52:33,373] Trial 1348 finished with value: 0.4376977145450166 and parameters: {'kernel': 'rbf', 'C': 13.246211172745342, 'gamma': 0.01975331376066366, 'epsilon': 0.1067114378367901}. Best is trial 88 with value: 0.3542875001421725.
[I 2024-12-03 18:52:34,155] Trial 1351 finished with value: 0.5214048398557755 and parameters: {'kernel': 'rbf', 'C': 21.16063044819935, 'gamma': 0.14408234156278357, 'epsilon': 0.33326112656978324}. Best is trial 88 with value: 0.3542875001421725.
[I 2024-12-03 18:52:35,541] Trial 1352 finished with value: 0.5436048999383118 and parameters: {'kernel': 'rbf', 'C': 2.99954886418805, 'gamma': 0.17861827099408126, 'epsilon': 0.09933284137993051}. Best is trial 88 with value: 0.3542875001421725.
[I 2024-12-03 18:52:36,823] Trial 1353 finished with value: 0.3663862928094058 and parameters: {'kernel': 'rbf', 'C': 96.22573545625718, 'gamma': 0.03206085174687046, 'epsilon': 0.10535473959047106}. Best is trial 88 with value: 0.3542875001421725.
[I 2024-12-03 18:52:38,112] Trial 1354 finished with value: 0.3751833627455026 and parameters: {'kernel': 'rbf', 'C': 89.98897892374718, 'gamma': 0.06829933209880772, 'epsilon': 0.0750334374553408}. Best is trial 88 with value: 0.3542875001421725.
[I 2024-12-03 18:52:39,251] Trial 1349 finished with value: 2.419578486819576 and parameters: {'kernel': 'poly', 'C': 31.148599589612143, 'gamma': 0.012422364779893526, 'epsilon': 0.07977814595003334}. Best is trial 88 with value: 0.3542875001421725.
[I 2024-12-03 18:52:40,269] Trial 1356 finished with value: 0.3648726356447785 and parameters: {'kernel': 'rbf', 'C': 91.10589438771176, 'gamma': 0.03783731697402378, 'epsilon': 0.2939213001595733}. Best is trial 88 with value: 0.3542875001421725.
[I 2024-12-03 18:52:40,392] Trial 1288 finished with value: 0.8024036494172664 and parameters: {'kernel': 'linear', 'C': 60.39511435996124, 'gamma': 0.3806633862687975, 'epsilon': 0.005212402735872116}. Best is trial 88 with value: 0.3542875001421725.
[I 2024-12-03 18:52:40,622] Trial 1357 finished with value: 0.8862728680462297 and parameters: {'kernel': 'rbf', 'C': 29.282726666983265, 'gamma': 0.42822507350951167, 'epsilon': 0.9822159000195534}. Best is trial 88 with value: 0.3542875001421725.
[I 2024-12-03 18:52:42,277] Trial 1358 finished with value: 0.41892044286814206 and parameters: {'kernel': 'rbf', 'C': 18.784168742107372, 'gamma': 0.027704642094600662, 'epsilon': 0.11524016437628931}. Best is trial 88 with value: 0.3542875001421725.
[I 2024-12-03 18:52:42,279] Trial 1359 finished with value: 0.4045130313539486 and parameters: {'kernel': 'rbf', 'C': 21.563160241476453, 'gamma': 0.07932404383274674, 'epsilon': 0.20127889294409768}. Best is trial 88 with value: 0.3542875001421725.
[I 2024-12-03 18:52:43,521] Trial 1360 finished with value: 0.4248151569106585 and parameters: {'kernel': 'rbf', 'C': 87.97724097191283, 'gamma': 0.005561868595462348, 'epsilon': 0.1048273787776425}. Best is trial 88 with value: 0.3542875001421725.
[I 2024-12-03 18:52:44,830] Trial 1361 finished with value: 0.43818360864094424 and parameters: {'kernel': 'rbf', 'C': 22.782118289160262, 'gamma': 0.12188511386412075, 'epsilon': 0.12742976171334713}. Best is trial 88 with value: 0.3542875001421725.
[I 2024-12-03 18:52:45,535] Trial 1362 finished with value: 0.3758206451875027 and parameters: {'kernel': 'rbf', 'C': 89.63466243458446, 'gamma': 0.0200247102776753, 'epsilon': 0.04375297161713163}. Best is trial 88 with value: 0.3542875001421725.
[I 2024-12-03 18:52:46,723] Trial 1364 finished with value: 0.37174751130039074 and parameters: {'kernel': 'rbf', 'C': 99.2207497466209, 'gamma': 0.03649527901524197, 'epsilon': 0.32239506725075434}. Best is trial 88 with value: 0.3542875001421725.
[I 2024-12-03 18:52:46,876] Trial 1363 finished with value: 0.3990858163522139 and parameters: {'kernel': 'rbf', 'C': 94.74018699054925, 'gamma': 0.09870174706794145, 'epsilon': 0.023641178377913828}. Best is trial 88 with value: 0.3542875001421725.
[I 2024-12-03 18:52:47,423] Trial 1365 finished with value: 0.9533910806775526 and parameters: {'kernel': 'sigmoid', 'C': 51.73649446072695, 'gamma': 0.0001373958299768859, 'epsilon': 0.14664255896313086}. Best is trial 88 with value: 0.3542875001421725.
[I 2024-12-03 18:52:48,529] Trial 1366 finished with value: 0.41572196399291284 and parameters: {'kernel': 'rbf', 'C': 17.280473468385207, 'gamma': 0.025976566655731764, 'epsilon': 0.3926270416144886}. Best is trial 88 with value: 0.3542875001421725.
[I 2024-12-03 18:52:49,240] Trial 1367 finished with value: 0.42490796169091544 and parameters: {'kernel': 'rbf', 'C': 22.40092316862152, 'gamma': 0.014058280640566627, 'epsilon': 0.2387928270032706}. Best is trial 88 with value: 0.3542875001421725.
[I 2024-12-03 18:52:50,387] Trial 1368 finished with value: 0.4111389442487214 and parameters: {'kernel': 'rbf', 'C': 21.797161166305305, 'gamma': 0.10321659793343904, 'epsilon': 0.06440200695160692}. Best is trial 88 with value: 0.3542875001421725.
[I 2024-12-03 18:52:50,654] Trial 1369 finished with value: 0.6672042210172158 and parameters: {'kernel': 'rbf', 'C': 91.01386852442744, 'gamma': 0.2778715111758689, 'epsilon': 0.47492541810824157}. Best is trial 88 with value: 0.3542875001421725.
[I 2024-12-03 18:52:51,946] Trial 1370 finished with value: 0.39464197732903494 and parameters: {'kernel': 'rbf', 'C': 21.430928176737464, 'gamma': 0.006985781931345898, 'epsilon': 0.06572762964577965}. Best is trial 88 with value: 0.3542875001421725.
[I 2024-12-03 18:52:53,020] Trial 1372 finished with value: 150.80084479465975 and parameters: {'kernel': 'sigmoid', 'C': 9.508285590094099, 'gamma': 0.01666734766049904, 'epsilon': 0.41987432211508}. Best is trial 88 with value: 0.3542875001421725.
[I 2024-12-03 18:52:54,120] Trial 1373 finished with value: 291.41269510644145 and parameters: {'kernel': 'sigmoid', 'C': 18.134497453612877, 'gamma': 0.017096714016796632, 'epsilon': 0.13382403847073135}. Best is trial 88 with value: 0.3542875001421725.
[I 2024-12-03 18:52:55,191] Trial 1374 finished with value: 0.6751313856514616 and parameters: {'kernel': 'rbf', 'C': 16.022822231809457, 'gamma': 0.49653491080172185, 'epsilon': 0.07664830273518371}. Best is trial 88 with value: 0.3542875001421725.
[I 2024-12-03 18:52:56,323] Trial 1375 finished with value: 0.4330956933689835 and parameters: {'kernel': 'rbf', 'C': 87.67943492419843, 'gamma': 0.1136912312592836, 'epsilon': 0.19028612360667943}. Best is trial 88 with value: 0.3542875001421725.
[I 2024-12-03 18:52:57,371] Trial 1376 finished with value: 0.5190718530143752 and parameters: {'kernel': 'rbf', 'C': 95.89210774677323, 'gamma': 0.2126803189567121, 'epsilon': 0.08161861202785001}. Best is trial 88 with value: 0.3542875001421725.
[I 2024-12-03 18:52:58,939] Trial 1377 finished with value: 0.4187868745479902 and parameters: {'kernel': 'rbf', 'C': 87.45656599106597, 'gamma': 0.00963270063040602, 'epsilon': 0.07099447954296513}. Best is trial 88 with value: 0.3542875001421725.
[I 2024-12-03 18:53:00,054] Trial 1378 finished with value: 0.4102855773218983 and parameters: {'kernel': 'rbf', 'C': 24.47866930587219, 'gamma': 0.032052665175784145, 'epsilon': 0.0864364539030491}. Best is trial 88 with value: 0.3542875001421725.
[I 2024-12-03 18:53:01,136] Trial 1379 finished with value: 0.39117308366151665 and parameters: {'kernel': 'rbf', 'C': 87.49679763552395, 'gamma': 0.009952687798926363, 'epsilon': 0.26456055886945135}. Best is trial 88 with value: 0.3542875001421725.
[I 2024-12-03 18:53:02,126] Trial 1380 finished with value: 0.4104835908723923 and parameters: {'kernel': 'rbf', 'C': 21.329421173073154, 'gamma': 0.020115291188305948, 'epsilon': 0.1905923749712247}. Best is trial 88 with value: 0.3542875001421725.
[I 2024-12-03 18:53:02,359] Trial 1269 finished with value: 9.541674298514854 and parameters: {'kernel': 'poly', 'C': 11.553053441139408, 'gamma': 0.41372032502565675, 'epsilon': 0.5938669580279429}. Best is trial 88 with value: 0.3542875001421725.
[I 2024-12-03 18:53:03,763] Trial 1381 finished with value: 0.39660328785122145 and parameters: {'kernel': 'rbf', 'C': 93.90701138565481, 'gamma': 0.09790076973902648, 'epsilon': 0.05329558499443186}. Best is trial 88 with value: 0.3542875001421725.
[I 2024-12-03 18:53:04,108] Trial 1382 finished with value: 0.4075607431326033 and parameters: {'kernel': 'rbf', 'C': 24.973864222109796, 'gamma': 0.08235150022091053, 'epsilon': 0.21987847751997203}. Best is trial 88 with value: 0.3542875001421725.
[I 2024-12-03 18:53:06,074] Trial 1383 finished with value: 0.9243123167966528 and parameters: {'kernel': 'rbf', 'C': 0.040765474103559865, 'gamma': 0.30490952150370276, 'epsilon': 0.0036343512216759468}. Best is trial 88 with value: 0.3542875001421725.
[I 2024-12-03 18:53:07,250] Trial 1384 finished with value: 0.44367024410228156 and parameters: {'kernel': 'rbf', 'C': 4.3794539962133205, 'gamma': 0.026751911881237853, 'epsilon': 0.05761356388063128}. Best is trial 88 with value: 0.3542875001421725.
[I 2024-12-03 18:53:07,584] Trial 1385 finished with value: 0.4039628516050958 and parameters: {'kernel': 'rbf', 'C': 94.00951475971, 'gamma': 0.10889530123229998, 'epsilon': 0.08638086552465192}. Best is trial 88 with value: 0.3542875001421725.
[I 2024-12-03 18:53:08,027] Trial 1386 finished with value: 0.46556651714593655 and parameters: {'kernel': 'rbf', 'C': 4.220861441459207, 'gamma': 0.0433766831371763, 'epsilon': 0.24424958297927238}. Best is trial 88 with value: 0.3542875001421725.
[I 2024-12-03 18:53:09,593] Trial 1387 finished with value: 0.3566863779653638 and parameters: {'kernel': 'rbf', 'C': 83.02628558258863, 'gamma': 0.04243656407983722, 'epsilon': 0.16728122928531378}. Best is trial 88 with value: 0.3542875001421725.
[I 2024-12-03 18:53:09,624] Trial 1388 finished with value: 0.3862210580862552 and parameters: {'kernel': 'rbf', 'C': 24.043976557636913, 'gamma': 0.05253585274065092, 'epsilon': 0.16363927739356846}. Best is trial 88 with value: 0.3542875001421725.
[I 2024-12-03 18:53:09,956] Trial 1389 finished with value: 4.252687984472839 and parameters: {'kernel': 'sigmoid', 'C': 16.97479859116407, 'gamma': 0.0007692564815733684, 'epsilon': 0.8283950442032362}. Best is trial 88 with value: 0.3542875001421725.
[I 2024-12-03 18:53:12,274] Trial 1390 finished with value: 0.3961994065819097 and parameters: {'kernel': 'rbf', 'C': 25.64320871671313, 'gamma': 0.08597797635265404, 'epsilon': 0.04002142383698509}. Best is trial 88 with value: 0.3542875001421725.
[I 2024-12-03 18:53:12,304] Trial 1391 finished with value: 0.4143009582598386 and parameters: {'kernel': 'rbf', 'C': 15.809067832722551, 'gamma': 0.06226878010669577, 'epsilon': 0.04567415534277936}. Best is trial 88 with value: 0.3542875001421725.
[I 2024-12-03 18:53:13,145] Trial 1392 finished with value: 0.3668189863170629 and parameters: {'kernel': 'rbf', 'C': 93.48617993468267, 'gamma': 0.026112217447224827, 'epsilon': 0.08278204763486224}. Best is trial 88 with value: 0.3542875001421725.
[I 2024-12-03 18:53:14,700] Trial 1394 finished with value: 0.38667041643008393 and parameters: {'kernel': 'rbf', 'C': 28.377611926928783, 'gamma': 0.0753705822592249, 'epsilon': 0.1124551504680044}. Best is trial 88 with value: 0.3542875001421725.
