[I 2024-12-04 15:40:52,032] Trial 2139 finished with value: 0.4194069351167404 and parameters: {'n_estimators': 873, 'max_depth': 39, 'min_samples_split': 2, 'min_samples_leaf': 1, 'max_features': None, 'bootstrap': True, 'criterion': 'squared_error'}. Best is trial 1025 with value: 0.41844370194907604.
[I 2024-12-04 15:40:52,209] Trial 2148 finished with value: 0.42084896313773185 and parameters: {'n_estimators': 847, 'max_depth': 37, 'min_samples_split': 2, 'min_samples_leaf': 1, 'max_features': None, 'bootstrap': True, 'criterion': 'squared_error'}. Best is trial 1025 with value: 0.41844370194907604.
[I 2024-12-04 15:40:53,556] Trial 2153 finished with value: 0.7465234785430327 and parameters: {'n_estimators': 121, 'max_depth': 48, 'min_samples_split': 4, 'min_samples_leaf': 3, 'max_features': 'sqrt', 'bootstrap': False, 'criterion': 'absolute_error'}. Best is trial 1025 with value: 0.41844370194907604.
[I 2024-12-04 15:40:55,031] Trial 2144 finished with value: 0.4652175996353272 and parameters: {'n_estimators': 913, 'max_depth': 41, 'min_samples_split': 3, 'min_samples_leaf': 2, 'max_features': None, 'bootstrap': True, 'criterion': 'squared_error'}. Best is trial 1025 with value: 0.41844370194907604.
[I 2024-12-04 15:40:57,207] Trial 2146 finished with value: 0.4651595198325899 and parameters: {'n_estimators': 914, 'max_depth': 27, 'min_samples_split': 3, 'min_samples_leaf': 2, 'max_features': None, 'bootstrap': True, 'criterion': 'squared_error'}. Best is trial 1025 with value: 0.41844370194907604.
[I 2024-12-04 15:40:57,923] Trial 2145 finished with value: 0.4326004620701242 and parameters: {'n_estimators': 832, 'max_depth': 32, 'min_samples_split': 4, 'min_samples_leaf': 1, 'max_features': None, 'bootstrap': True, 'criterion': 'squared_error'}. Best is trial 1025 with value: 0.41844370194907604.
[I 2024-12-04 15:40:57,931] Trial 2147 finished with value: 0.4193857946873301 and parameters: {'n_estimators': 868, 'max_depth': 39, 'min_samples_split': 2, 'min_samples_leaf': 1, 'max_features': None, 'bootstrap': True, 'criterion': 'squared_error'}. Best is trial 1025 with value: 0.41844370194907604.
[I 2024-12-04 15:40:58,051] Trial 2160 finished with value: 1.0186866978053002 and parameters: {'n_estimators': 171, 'max_depth': 47, 'min_samples_split': 29, 'min_samples_leaf': 9, 'max_features': 'sqrt', 'bootstrap': True, 'criterion': 'absolute_error'}. Best is trial 1025 with value: 0.41844370194907604.
[I 2024-12-04 15:40:58,905] Trial 2135 finished with value: 0.4648070355432705 and parameters: {'n_estimators': 860, 'max_depth': 34, 'min_samples_split': 2, 'min_samples_leaf': 2, 'max_features': None, 'bootstrap': True, 'criterion': 'squared_error'}. Best is trial 1025 with value: 0.41844370194907604.
[I 2024-12-04 15:41:12,855] Trial 2155 finished with value: 0.4194754030089685 and parameters: {'n_estimators': 893, 'max_depth': 39, 'min_samples_split': 2, 'min_samples_leaf': 1, 'max_features': None, 'bootstrap': True, 'criterion': 'squared_error'}. Best is trial 1025 with value: 0.41844370194907604.
[I 2024-12-04 15:41:17,121] Trial 2156 finished with value: 0.42316647203432495 and parameters: {'n_estimators': 862, 'max_depth': 40, 'min_samples_split': 3, 'min_samples_leaf': 1, 'max_features': None, 'bootstrap': True, 'criterion': 'squared_error'}. Best is trial 1025 with value: 0.41844370194907604.
[I 2024-12-04 15:41:17,184] Trial 2167 finished with value: 0.5358444847739537 and parameters: {'n_estimators': 407, 'max_depth': 15, 'min_samples_split': 35, 'min_samples_leaf': 2, 'max_features': None, 'bootstrap': True, 'criterion': 'squared_error'}. Best is trial 1025 with value: 0.41844370194907604.
[I 2024-12-04 15:41:17,209] Trial 2154 finished with value: 0.4316775868684617 and parameters: {'n_estimators': 877, 'max_depth': 38, 'min_samples_split': 4, 'min_samples_leaf': 1, 'max_features': None, 'bootstrap': True, 'criterion': 'squared_error'}. Best is trial 1025 with value: 0.41844370194907604.
[I 2024-12-04 15:41:17,991] Trial 2164 finished with value: 0.5269327552308962 and parameters: {'n_estimators': 855, 'max_depth': 39, 'min_samples_split': 4, 'min_samples_leaf': 1, 'max_features': 'sqrt', 'bootstrap': True, 'criterion': 'squared_error'}. Best is trial 1025 with value: 0.41844370194907604.
[I 2024-12-04 15:41:19,927] Trial 2162 finished with value: 0.5240446017432592 and parameters: {'n_estimators': 843, 'max_depth': 30, 'min_samples_split': 2, 'min_samples_leaf': 1, 'max_features': None, 'bootstrap': False, 'criterion': 'squared_error'}. Best is trial 1025 with value: 0.41844370194907604.
[I 2024-12-04 15:41:21,455] Trial 2158 finished with value: 0.42108001014141216 and parameters: {'n_estimators': 874, 'max_depth': 45, 'min_samples_split': 2, 'min_samples_leaf': 1, 'max_features': None, 'bootstrap': True, 'criterion': 'squared_error'}. Best is trial 1025 with value: 0.41844370194907604.
[I 2024-12-04 15:41:22,686] Trial 2157 finished with value: 0.4214141861600183 and parameters: {'n_estimators': 857, 'max_depth': 46, 'min_samples_split': 2, 'min_samples_leaf': 1, 'max_features': None, 'bootstrap': True, 'criterion': 'squared_error'}. Best is trial 1025 with value: 0.41844370194907604.
[I 2024-12-04 15:41:24,356] Trial 2165 finished with value: 0.6512767638147613 and parameters: {'n_estimators': 897, 'max_depth': 39, 'min_samples_split': 4, 'min_samples_leaf': 1, 'max_features': 'log2', 'bootstrap': True, 'criterion': 'squared_error'}. Best is trial 1025 with value: 0.41844370194907604.
[I 2024-12-04 15:41:26,934] Trial 2159 finished with value: 0.41894300065328416 and parameters: {'n_estimators': 869, 'max_depth': 40, 'min_samples_split': 2, 'min_samples_leaf': 1, 'max_features': None, 'bootstrap': True, 'criterion': 'squared_error'}. Best is trial 1025 with value: 0.41844370194907604.
[I 2024-12-04 15:41:27,378] Trial 2163 finished with value: 0.4653909586888925 and parameters: {'n_estimators': 835, 'max_depth': 33, 'min_samples_split': 4, 'min_samples_leaf': 2, 'max_features': None, 'bootstrap': True, 'criterion': 'squared_error'}. Best is trial 1025 with value: 0.41844370194907604.
[I 2024-12-04 15:41:27,434] Trial 2176 finished with value: 0.6909833227980006 and parameters: {'n_estimators': 487, 'max_depth': 21, 'min_samples_split': 6, 'min_samples_leaf': 2, 'max_features': 'sqrt', 'bootstrap': False, 'criterion': 'squared_error'}. Best is trial 1025 with value: 0.41844370194907604.
[I 2024-12-04 15:41:28,461] Trial 2161 finished with value: 0.41867287310652196 and parameters: {'n_estimators': 861, 'max_depth': 40, 'min_samples_split': 2, 'min_samples_leaf': 1, 'max_features': None, 'bootstrap': True, 'criterion': 'squared_error'}. Best is trial 1025 with value: 0.41844370194907604.
[I 2024-12-04 15:41:36,117] Trial 2166 finished with value: 0.4203565170317678 and parameters: {'n_estimators': 851, 'max_depth': 43, 'min_samples_split': 2, 'min_samples_leaf': 1, 'max_features': None, 'bootstrap': True, 'criterion': 'squared_error'}. Best is trial 1025 with value: 0.41844370194907604.
[I 2024-12-04 15:41:36,142] Trial 2171 finished with value: 0.42131185728694204 and parameters: {'n_estimators': 878, 'max_depth': 34, 'min_samples_split': 2, 'min_samples_leaf': 1, 'max_features': None, 'bootstrap': True, 'criterion': 'squared_error'}. Best is trial 1025 with value: 0.41844370194907604.
[I 2024-12-04 15:41:40,620] Trial 2169 finished with value: 0.4651621384946632 and parameters: {'n_estimators': 843, 'max_depth': 48, 'min_samples_split': 3, 'min_samples_leaf': 2, 'max_features': None, 'bootstrap': True, 'criterion': 'squared_error'}. Best is trial 1025 with value: 0.41844370194907604.
[I 2024-12-04 15:41:45,510] Trial 2179 finished with value: 0.464546224898235 and parameters: {'n_estimators': 875, 'max_depth': 46, 'min_samples_split': 2, 'min_samples_leaf': 2, 'max_features': None, 'bootstrap': True, 'criterion': 'squared_error'}. Best is trial 1025 with value: 0.41844370194907604.
[I 2024-12-04 15:41:46,412] Trial 2168 finished with value: 0.4316405507706574 and parameters: {'n_estimators': 868, 'max_depth': 42, 'min_samples_split': 4, 'min_samples_leaf': 1, 'max_features': None, 'bootstrap': True, 'criterion': 'squared_error'}. Best is trial 1025 with value: 0.41844370194907604.
[I 2024-12-04 15:41:47,434] Trial 2177 finished with value: 0.4212181302795304 and parameters: {'n_estimators': 908, 'max_depth': 42, 'min_samples_split': 2, 'min_samples_leaf': 1, 'max_features': None, 'bootstrap': True, 'criterion': 'squared_error'}. Best is trial 1025 with value: 0.41844370194907604.
[I 2024-12-04 15:41:49,831] Trial 2173 finished with value: 0.42023995970538447 and parameters: {'n_estimators': 873, 'max_depth': 38, 'min_samples_split': 2, 'min_samples_leaf': 1, 'max_features': None, 'bootstrap': True, 'criterion': 'squared_error'}. Best is trial 1025 with value: 0.41844370194907604.
[I 2024-12-04 15:41:50,617] Trial 2174 finished with value: 0.4187736082726376 and parameters: {'n_estimators': 864, 'max_depth': 40, 'min_samples_split': 2, 'min_samples_leaf': 1, 'max_features': None, 'bootstrap': True, 'criterion': 'squared_error'}. Best is trial 1025 with value: 0.41844370194907604.
[I 2024-12-04 15:41:50,963] Trial 2175 finished with value: 0.4205279365527693 and parameters: {'n_estimators': 879, 'max_depth': 43, 'min_samples_split': 2, 'min_samples_leaf': 1, 'max_features': None, 'bootstrap': True, 'criterion': 'squared_error'}. Best is trial 1025 with value: 0.41844370194907604.
[I 2024-12-04 15:41:50,976] Trial 2170 finished with value: 0.4212371158632757 and parameters: {'n_estimators': 869, 'max_depth': 42, 'min_samples_split': 2, 'min_samples_leaf': 1, 'max_features': None, 'bootstrap': True, 'criterion': 'squared_error'}. Best is trial 1025 with value: 0.41844370194907604.
[I 2024-12-04 15:41:51,229] Trial 2181 finished with value: 0.42532199029236406 and parameters: {'n_estimators': 720, 'max_depth': 33, 'min_samples_split': 3, 'min_samples_leaf': 1, 'max_features': None, 'bootstrap': True, 'criterion': 'squared_error'}. Best is trial 1025 with value: 0.41844370194907604.
[I 2024-12-04 15:41:51,230] Trial 2190 finished with value: 1.0535682879217612 and parameters: {'n_estimators': 881, 'max_depth': 31, 'min_samples_split': 4, 'min_samples_leaf': 11, 'max_features': 'log2', 'bootstrap': False, 'criterion': 'absolute_error'}. Best is trial 1025 with value: 0.41844370194907604.
[I 2024-12-04 15:41:51,659] Trial 2185 finished with value: 0.6303797141599425 and parameters: {'n_estimators': 850, 'max_depth': 40, 'min_samples_split': 2, 'min_samples_leaf': 1, 'max_features': 'log2', 'bootstrap': True, 'criterion': 'squared_error'}. Best is trial 1025 with value: 0.41844370194907604.
[I 2024-12-04 15:41:53,222] Trial 2182 finished with value: 0.46569944358697746 and parameters: {'n_estimators': 957, 'max_depth': 35, 'min_samples_split': 4, 'min_samples_leaf': 2, 'max_features': None, 'bootstrap': True, 'criterion': 'squared_error'}. Best is trial 1025 with value: 0.41844370194907604.
[I 2024-12-04 15:41:53,719] Trial 2180 finished with value: 0.42036056131489674 and parameters: {'n_estimators': 807, 'max_depth': 31, 'min_samples_split': 2, 'min_samples_leaf': 1, 'max_features': None, 'bootstrap': True, 'criterion': 'squared_error'}. Best is trial 1025 with value: 0.41844370194907604.
[I 2024-12-04 15:41:53,940] Trial 2178 finished with value: 0.4653187983773676 and parameters: {'n_estimators': 837, 'max_depth': 42, 'min_samples_split': 2, 'min_samples_leaf': 2, 'max_features': None, 'bootstrap': True, 'criterion': 'squared_error'}. Best is trial 1025 with value: 0.41844370194907604.
[I 2024-12-04 15:41:55,249] Trial 2184 finished with value: 0.42455220678688615 and parameters: {'n_estimators': 828, 'max_depth': 34, 'min_samples_split': 3, 'min_samples_leaf': 1, 'max_features': None, 'bootstrap': True, 'criterion': 'squared_error'}. Best is trial 1025 with value: 0.41844370194907604.
[I 2024-12-04 15:41:58,377] Trial 2188 finished with value: 0.9636747269602662 and parameters: {'n_estimators': 760, 'max_depth': 6, 'min_samples_split': 9, 'min_samples_leaf': 8, 'max_features': 'sqrt', 'bootstrap': False, 'criterion': 'squared_error'}. Best is trial 1025 with value: 0.41844370194907604.
[I 2024-12-04 15:41:58,896] Trial 2186 finished with value: 0.4202473652719331 and parameters: {'n_estimators': 889, 'max_depth': 38, 'min_samples_split': 2, 'min_samples_leaf': 1, 'max_features': None, 'bootstrap': True, 'criterion': 'squared_error'}. Best is trial 1025 with value: 0.41844370194907604.
[I 2024-12-04 15:41:59,074] Trial 2183 finished with value: 0.4647181226880907 and parameters: {'n_estimators': 864, 'max_depth': 38, 'min_samples_split': 4, 'min_samples_leaf': 2, 'max_features': None, 'bootstrap': True, 'criterion': 'squared_error'}. Best is trial 1025 with value: 0.41844370194907604.
[I 2024-12-04 15:42:00,885] Trial 2193 finished with value: 0.721523658044196 and parameters: {'n_estimators': 801, 'max_depth': 24, 'min_samples_split': 2, 'min_samples_leaf': 2, 'max_features': 'sqrt', 'bootstrap': True, 'criterion': 'squared_error'}. Best is trial 1025 with value: 0.41844370194907604.
[I 2024-12-04 15:42:04,372] Trial 2191 finished with value: 0.42449472179434056 and parameters: {'n_estimators': 896, 'max_depth': 46, 'min_samples_split': 3, 'min_samples_leaf': 1, 'max_features': None, 'bootstrap': True, 'criterion': 'squared_error'}. Best is trial 1025 with value: 0.41844370194907604.
[I 2024-12-04 15:42:05,286] Trial 2194 finished with value: 0.6987713840215352 and parameters: {'n_estimators': 982, 'max_depth': 34, 'min_samples_split': 2, 'min_samples_leaf': 2, 'max_features': 'sqrt', 'bootstrap': True, 'criterion': 'squared_error'}. Best is trial 1025 with value: 0.41844370194907604.
[I 2024-12-04 15:42:07,201] Trial 2189 finished with value: 0.419244116644287 and parameters: {'n_estimators': 895, 'max_depth': 40, 'min_samples_split': 2, 'min_samples_leaf': 1, 'max_features': None, 'bootstrap': True, 'criterion': 'squared_error'}. Best is trial 1025 with value: 0.41844370194907604.
[I 2024-12-04 15:42:14,441] Trial 2195 finished with value: 0.4213045342619352 and parameters: {'n_estimators': 894, 'max_depth': 34, 'min_samples_split': 2, 'min_samples_leaf': 1, 'max_features': None, 'bootstrap': True, 'criterion': 'squared_error'}. Best is trial 1025 with value: 0.41844370194907604.
[I 2024-12-04 15:42:14,513] Trial 2198 finished with value: 0.4321593188135479 and parameters: {'n_estimators': 882, 'max_depth': 36, 'min_samples_split': 4, 'min_samples_leaf': 1, 'max_features': None, 'bootstrap': True, 'criterion': 'squared_error'}. Best is trial 1025 with value: 0.41844370194907604.
[I 2024-12-04 15:42:14,970] Trial 2187 finished with value: 0.46468804900478117 and parameters: {'n_estimators': 892, 'max_depth': 43, 'min_samples_split': 2, 'min_samples_leaf': 2, 'max_features': None, 'bootstrap': True, 'criterion': 'squared_error'}. Best is trial 1025 with value: 0.41844370194907604.
[I 2024-12-04 15:42:19,711] Trial 2199 finished with value: 0.5035380810478772 and parameters: {'n_estimators': 877, 'max_depth': 41, 'min_samples_split': 2, 'min_samples_leaf': 1, 'max_features': 'sqrt', 'bootstrap': True, 'criterion': 'squared_error'}. Best is trial 1025 with value: 0.41844370194907604.
[I 2024-12-04 15:42:25,223] Trial 2192 finished with value: 0.4207636498900949 and parameters: {'n_estimators': 871, 'max_depth': 37, 'min_samples_split': 2, 'min_samples_leaf': 1, 'max_features': None, 'bootstrap': True, 'criterion': 'squared_error'}. Best is trial 1025 with value: 0.41844370194907604.
[I 2024-12-04 15:42:27,543] Trial 2197 finished with value: 0.4651292409748787 and parameters: {'n_estimators': 904, 'max_depth': 32, 'min_samples_split': 2, 'min_samples_leaf': 2, 'max_features': None, 'bootstrap': True, 'criterion': 'squared_error'}. Best is trial 1025 with value: 0.41844370194907604.
[I 2024-12-04 15:42:28,217] Trial 2200 finished with value: 0.4215563017437167 and parameters: {'n_estimators': 842, 'max_depth': 46, 'min_samples_split': 2, 'min_samples_leaf': 1, 'max_features': None, 'bootstrap': True, 'criterion': 'squared_error'}. Best is trial 1025 with value: 0.41844370194907604.
[I 2024-12-04 15:42:28,219] Trial 2152 finished with value: 0.4308090412607356 and parameters: {'n_estimators': 824, 'max_depth': 35, 'min_samples_split': 2, 'min_samples_leaf': 1, 'max_features': None, 'bootstrap': True, 'criterion': 'absolute_error'}. Best is trial 1025 with value: 0.41844370194907604.
[I 2024-12-04 15:42:34,348] Trial 2202 finished with value: 0.46528933034691977 and parameters: {'n_estimators': 776, 'max_depth': 33, 'min_samples_split': 2, 'min_samples_leaf': 2, 'max_features': None, 'bootstrap': True, 'criterion': 'squared_error'}. Best is trial 1025 with value: 0.41844370194907604.
[I 2024-12-04 15:42:35,621] Trial 2204 finished with value: 0.4649170056831893 and parameters: {'n_estimators': 859, 'max_depth': 36, 'min_samples_split': 2, 'min_samples_leaf': 2, 'max_features': None, 'bootstrap': True, 'criterion': 'squared_error'}. Best is trial 1025 with value: 0.41844370194907604.
[I 2024-12-04 15:42:38,397] Trial 2215 finished with value: 0.9261056209846377 and parameters: {'n_estimators': 261, 'max_depth': 24, 'min_samples_split': 19, 'min_samples_leaf': 2, 'max_features': 'log2', 'bootstrap': False, 'criterion': 'absolute_error'}. Best is trial 1025 with value: 0.41844370194907604.
[I 2024-12-04 15:42:38,410] Trial 2201 finished with value: 0.4205090073885384 and parameters: {'n_estimators': 897, 'max_depth': 43, 'min_samples_split': 2, 'min_samples_leaf': 1, 'max_features': None, 'bootstrap': True, 'criterion': 'squared_error'}. Best is trial 1025 with value: 0.41844370194907604.
[I 2024-12-04 15:42:41,909] Trial 2203 finished with value: 0.4207351787181568 and parameters: {'n_estimators': 845, 'max_depth': 37, 'min_samples_split': 2, 'min_samples_leaf': 1, 'max_features': None, 'bootstrap': True, 'criterion': 'squared_error'}. Best is trial 1025 with value: 0.41844370194907604.
[I 2024-12-04 15:42:42,873] Trial 2209 finished with value: 0.42443295715033885 and parameters: {'n_estimators': 867, 'max_depth': 49, 'min_samples_split': 3, 'min_samples_leaf': 1, 'max_features': None, 'bootstrap': True, 'criterion': 'squared_error'}. Best is trial 1025 with value: 0.41844370194907604.
[I 2024-12-04 15:42:47,048] Trial 2207 finished with value: 0.6931449925935702 and parameters: {'n_estimators': 990, 'max_depth': 43, 'min_samples_split': 15, 'min_samples_leaf': 1, 'max_features': 'log2', 'bootstrap': False, 'criterion': 'absolute_error'}. Best is trial 1025 with value: 0.41844370194907604.
[I 2024-12-04 15:42:48,287] Trial 2206 finished with value: 0.42374247573898777 and parameters: {'n_estimators': 823, 'max_depth': 40, 'min_samples_split': 3, 'min_samples_leaf': 1, 'max_features': None, 'bootstrap': True, 'criterion': 'squared_error'}. Best is trial 1025 with value: 0.41844370194907604.
[I 2024-12-04 15:42:48,716] Trial 2214 finished with value: 0.42064210845204103 and parameters: {'n_estimators': 842, 'max_depth': 37, 'min_samples_split': 2, 'min_samples_leaf': 1, 'max_features': None, 'bootstrap': True, 'criterion': 'squared_error'}. Best is trial 1025 with value: 0.41844370194907604.
[I 2024-12-04 15:42:49,842] Trial 2219 finished with value: 0.6032795508010477 and parameters: {'n_estimators': 820, 'max_depth': 30, 'min_samples_split': 3, 'min_samples_leaf': 2, 'max_features': None, 'bootstrap': False, 'criterion': 'squared_error'}. Best is trial 1025 with value: 0.41844370194907604.
[I 2024-12-04 15:42:52,174] Trial 2212 finished with value: 0.43206364937739994 and parameters: {'n_estimators': 825, 'max_depth': 36, 'min_samples_split': 4, 'min_samples_leaf': 1, 'max_features': None, 'bootstrap': True, 'criterion': 'squared_error'}. Best is trial 1025 with value: 0.41844370194907604.
[I 2024-12-04 15:42:52,826] Trial 2208 finished with value: 0.42040260865905305 and parameters: {'n_estimators': 891, 'max_depth': 48, 'min_samples_split': 2, 'min_samples_leaf': 1, 'max_features': None, 'bootstrap': True, 'criterion': 'squared_error'}. Best is trial 1025 with value: 0.41844370194907604.
[I 2024-12-04 15:42:52,843] Trial 2205 finished with value: 0.4647557406526642 and parameters: {'n_estimators': 894, 'max_depth': 40, 'min_samples_split': 3, 'min_samples_leaf': 2, 'max_features': None, 'bootstrap': True, 'criterion': 'squared_error'}. Best is trial 1025 with value: 0.41844370194907604.
[I 2024-12-04 15:42:53,771] Trial 2210 finished with value: 0.4304613560587748 and parameters: {'n_estimators': 866, 'max_depth': 45, 'min_samples_split': 4, 'min_samples_leaf': 1, 'max_features': None, 'bootstrap': True, 'criterion': 'squared_error'}. Best is trial 1025 with value: 0.41844370194907604.
[I 2024-12-04 15:42:53,783] Trial 2217 finished with value: 0.46543094360448234 and parameters: {'n_estimators': 813, 'max_depth': 41, 'min_samples_split': 4, 'min_samples_leaf': 2, 'max_features': None, 'bootstrap': True, 'criterion': 'squared_error'}. Best is trial 1025 with value: 0.41844370194907604.
[I 2024-12-04 15:42:55,362] Trial 2213 finished with value: 0.4207351787181568 and parameters: {'n_estimators': 845, 'max_depth': 37, 'min_samples_split': 2, 'min_samples_leaf': 1, 'max_features': None, 'bootstrap': True, 'criterion': 'squared_error'}. Best is trial 1025 with value: 0.41844370194907604.
[I 2024-12-04 15:42:56,283] Trial 2216 finished with value: 0.4218402856896842 and parameters: {'n_estimators': 744, 'max_depth': 35, 'min_samples_split': 2, 'min_samples_leaf': 1, 'max_features': None, 'bootstrap': True, 'criterion': 'squared_error'}. Best is trial 1025 with value: 0.41844370194907604.
