[I 2024-12-04 12:37:13,660] Trial 1215 finished with value: 0.6159164560384915 and parameters: {'n_estimators': 645, 'learning_rate': 0.010109769109081984, 'max_depth': 5, 'min_samples_split': 8, 'min_samples_leaf': 1, 'subsample': 0.6429007470971866, 'max_features': 'sqrt'}. Best is trial 989 with value: 0.3092662874814911.
[I 2024-12-04 12:37:14,412] Trial 1203 finished with value: 0.38821612152846474 and parameters: {'n_estimators': 1127, 'learning_rate': 0.07974339034982342, 'max_depth': 6, 'min_samples_split': 5, 'min_samples_leaf': 3, 'subsample': 0.6644638527027996, 'max_features': None}. Best is trial 989 with value: 0.3092662874814911.
[I 2024-12-04 12:37:16,484] Trial 1210 finished with value: 0.32828995395813215 and parameters: {'n_estimators': 889, 'learning_rate': 0.09880523007856534, 'max_depth': 6, 'min_samples_split': 3, 'min_samples_leaf': 2, 'subsample': 0.7344984706919324, 'max_features': None}. Best is trial 989 with value: 0.3092662874814911.
[I 2024-12-04 12:37:16,844] Trial 1209 finished with value: 0.3813118584271389 and parameters: {'n_estimators': 907, 'learning_rate': 0.09442817605252833, 'max_depth': 6, 'min_samples_split': 3, 'min_samples_leaf': 1, 'subsample': 0.6633027277910205, 'max_features': None}. Best is trial 989 with value: 0.3092662874814911.
[I 2024-12-04 12:37:17,880] Trial 1221 finished with value: 0.4591108039780816 and parameters: {'n_estimators': 551, 'learning_rate': 0.05404246109638918, 'max_depth': 4, 'min_samples_split': 4, 'min_samples_leaf': 4, 'subsample': 0.7436015802208665, 'max_features': 'sqrt'}. Best is trial 989 with value: 0.3092662874814911.
[I 2024-12-04 12:37:18,451] Trial 1201 finished with value: 0.423908878216693 and parameters: {'n_estimators': 1476, 'learning_rate': 0.09462163387781435, 'max_depth': 7, 'min_samples_split': 2, 'min_samples_leaf': 6, 'subsample': 0.6664685868129568, 'max_features': 'sqrt'}. Best is trial 989 with value: 0.3092662874814911.
[I 2024-12-04 12:37:21,993] Trial 1204 finished with value: 0.36692708048069617 and parameters: {'n_estimators': 1489, 'learning_rate': 0.08443371535349023, 'max_depth': 6, 'min_samples_split': 3, 'min_samples_leaf': 2, 'subsample': 0.6172738316106221, 'max_features': 'sqrt'}. Best is trial 989 with value: 0.3092662874814911.
[I 2024-12-04 12:37:23,447] Trial 1207 finished with value: 0.33726911150322453 and parameters: {'n_estimators': 1190, 'learning_rate': 0.09293478212327873, 'max_depth': 7, 'min_samples_split': 2, 'min_samples_leaf': 2, 'subsample': 0.6525619056248821, 'max_features': None}. Best is trial 989 with value: 0.3092662874814911.
[I 2024-12-04 12:37:24,958] Trial 1225 finished with value: 0.32813110925132616 and parameters: {'n_estimators': 517, 'learning_rate': 0.07539974425769849, 'max_depth': 7, 'min_samples_split': 4, 'min_samples_leaf': 2, 'subsample': 0.6085236216240665, 'max_features': None}. Best is trial 989 with value: 0.3092662874814911.
[I 2024-12-04 12:37:26,725] Trial 1213 finished with value: 0.33987065332248645 and parameters: {'n_estimators': 1065, 'learning_rate': 0.07515707826343226, 'max_depth': 5, 'min_samples_split': 2, 'min_samples_leaf': 2, 'subsample': 0.7116064404263545, 'max_features': None}. Best is trial 989 with value: 0.3092662874814911.
[I 2024-12-04 12:37:28,653] Trial 1211 finished with value: 0.7695441145352956 and parameters: {'n_estimators': 1379, 'learning_rate': 0.010387198197952124, 'max_depth': 8, 'min_samples_split': 7, 'min_samples_leaf': 7, 'subsample': 0.7874166359698812, 'max_features': 'log2'}. Best is trial 989 with value: 0.3092662874814911.
[I 2024-12-04 12:37:29,747] Trial 1239 finished with value: 0.46940491746871904 and parameters: {'n_estimators': 203, 'learning_rate': 0.0633296592462064, 'max_depth': 9, 'min_samples_split': 16, 'min_samples_leaf': 5, 'subsample': 0.9419281792060061, 'max_features': 'sqrt'}. Best is trial 989 with value: 0.3092662874814911.
[I 2024-12-04 12:37:32,314] Trial 1231 finished with value: 0.5723336684851904 and parameters: {'n_estimators': 542, 'learning_rate': 0.05954657804225059, 'max_depth': 11, 'min_samples_split': 17, 'min_samples_leaf': 10, 'subsample': 0.6606490593651697, 'max_features': None}. Best is trial 989 with value: 0.3092662874814911.
[I 2024-12-04 12:37:33,883] Trial 1244 finished with value: 0.43918469957502965 and parameters: {'n_estimators': 185, 'learning_rate': 0.02677843002799761, 'max_depth': 10, 'min_samples_split': 20, 'min_samples_leaf': 7, 'subsample': 0.9476925035824595, 'max_features': None}. Best is trial 989 with value: 0.3092662874814911.
[I 2024-12-04 12:37:35,420] Trial 1218 finished with value: 0.32886525456141097 and parameters: {'n_estimators': 1128, 'learning_rate': 0.05407271811138742, 'max_depth': 6, 'min_samples_split': 6, 'min_samples_leaf': 2, 'subsample': 0.7133453535351569, 'max_features': None}. Best is trial 989 with value: 0.3092662874814911.
[I 2024-12-04 12:37:35,428] Trial 1248 finished with value: 0.8321409751627618 and parameters: {'n_estimators': 111, 'learning_rate': 0.023021086867233857, 'max_depth': 6, 'min_samples_split': 4, 'min_samples_leaf': 6, 'subsample': 0.8290530402447458, 'max_features': 'sqrt'}. Best is trial 989 with value: 0.3092662874814911.
[I 2024-12-04 12:37:36,382] Trial 1241 finished with value: 0.530629137184316 and parameters: {'n_estimators': 373, 'learning_rate': 0.09966255225231394, 'max_depth': 4, 'min_samples_split': 2, 'min_samples_leaf': 3, 'subsample': 0.6832014717780533, 'max_features': 'log2'}. Best is trial 989 with value: 0.3092662874814911.
[I 2024-12-04 12:37:39,748] Trial 1212 finished with value: 0.38305960677337375 and parameters: {'n_estimators': 1489, 'learning_rate': 0.08977554162910463, 'max_depth': 6, 'min_samples_split': 6, 'min_samples_leaf': 1, 'subsample': 0.7014180316582649, 'max_features': None}. Best is trial 989 with value: 0.3092662874814911.
[I 2024-12-04 12:37:40,346] Trial 1214 finished with value: 0.36412631678862234 and parameters: {'n_estimators': 1484, 'learning_rate': 0.09895643552848915, 'max_depth': 7, 'min_samples_split': 5, 'min_samples_leaf': 1, 'subsample': 0.6186681963095955, 'max_features': None}. Best is trial 989 with value: 0.3092662874814911.
[I 2024-12-04 12:37:40,968] Trial 1226 finished with value: 0.3716514681849366 and parameters: {'n_estimators': 952, 'learning_rate': 0.05827175091177291, 'max_depth': 6, 'min_samples_split': 3, 'min_samples_leaf': 4, 'subsample': 0.6384735803323521, 'max_features': None}. Best is trial 989 with value: 0.3092662874814911.
[I 2024-12-04 12:37:43,191] Trial 1229 finished with value: 0.3958069780516502 and parameters: {'n_estimators': 902, 'learning_rate': 0.011083348478070475, 'max_depth': 10, 'min_samples_split': 18, 'min_samples_leaf': 1, 'subsample': 0.7571659495993981, 'max_features': None}. Best is trial 989 with value: 0.3092662874814911.
[I 2024-12-04 12:37:43,891] Trial 1220 finished with value: 0.4156243863100928 and parameters: {'n_estimators': 1367, 'learning_rate': 0.09866437514799276, 'max_depth': 8, 'min_samples_split': 2, 'min_samples_leaf': 1, 'subsample': 0.7059094750720281, 'max_features': None}. Best is trial 989 with value: 0.3092662874814911.
[I 2024-12-04 12:37:44,633] Trial 1222 finished with value: 0.40257989702442837 and parameters: {'n_estimators': 1195, 'learning_rate': 0.05784929064591166, 'max_depth': 5, 'min_samples_split': 3, 'min_samples_leaf': 1, 'subsample': 0.7395441673749426, 'max_features': None}. Best is trial 989 with value: 0.3092662874814911.
[I 2024-12-04 12:37:45,519] Trial 1228 finished with value: 0.37038246303067723 and parameters: {'n_estimators': 883, 'learning_rate': 0.063834941193231, 'max_depth': 6, 'min_samples_split': 2, 'min_samples_leaf': 4, 'subsample': 0.8682845979656303, 'max_features': None}. Best is trial 989 with value: 0.3092662874814911.
[I 2024-12-04 12:37:47,986] Trial 1235 finished with value: 0.39510256126436993 and parameters: {'n_estimators': 805, 'learning_rate': 0.09143443841078201, 'max_depth': 6, 'min_samples_split': 2, 'min_samples_leaf': 3, 'subsample': 0.6292633193401348, 'max_features': None}. Best is trial 989 with value: 0.3092662874814911.
[I 2024-12-04 12:37:48,834] Trial 1224 finished with value: 0.3302451338047086 and parameters: {'n_estimators': 1243, 'learning_rate': 0.09034962126989271, 'max_depth': 7, 'min_samples_split': 8, 'min_samples_leaf': 2, 'subsample': 0.6474360437287667, 'max_features': None}. Best is trial 989 with value: 0.3092662874814911.
[I 2024-12-04 12:37:48,936] Trial 1217 finished with value: 0.32611802814963325 and parameters: {'n_estimators': 1464, 'learning_rate': 0.0784398051981307, 'max_depth': 6, 'min_samples_split': 2, 'min_samples_leaf': 2, 'subsample': 0.7417105318907292, 'max_features': None}. Best is trial 989 with value: 0.3092662874814911.
[I 2024-12-04 12:37:49,040] Trial 1227 finished with value: 0.3897178900965518 and parameters: {'n_estimators': 1176, 'learning_rate': 0.09184577572290765, 'max_depth': 6, 'min_samples_split': 2, 'min_samples_leaf': 3, 'subsample': 0.6720594919461472, 'max_features': None}. Best is trial 989 with value: 0.3092662874814911.
[I 2024-12-04 12:37:49,323] Trial 1254 finished with value: 0.5959978769246576 and parameters: {'n_estimators': 300, 'learning_rate': 0.09426157434545127, 'max_depth': 8, 'min_samples_split': 20, 'min_samples_leaf': 8, 'subsample': 0.6287447017340381, 'max_features': 'sqrt'}. Best is trial 989 with value: 0.3092662874814911.
[I 2024-12-04 12:37:50,413] Trial 1219 finished with value: 0.3723566017363521 and parameters: {'n_estimators': 1403, 'learning_rate': 0.06875807352026668, 'max_depth': 5, 'min_samples_split': 5, 'min_samples_leaf': 4, 'subsample': 0.7156729883815759, 'max_features': None}. Best is trial 989 with value: 0.3092662874814911.
[I 2024-12-04 12:37:51,414] Trial 1238 finished with value: 0.4229700123383879 and parameters: {'n_estimators': 943, 'learning_rate': 0.06996966722410598, 'max_depth': 6, 'min_samples_split': 4, 'min_samples_leaf': 2, 'subsample': 0.6517818961094044, 'max_features': 'log2'}. Best is trial 989 with value: 0.3092662874814911.
[I 2024-12-04 12:37:52,174] Trial 1223 finished with value: 0.3230150291851665 and parameters: {'n_estimators': 1447, 'learning_rate': 0.071796419290742, 'max_depth': 6, 'min_samples_split': 2, 'min_samples_leaf': 2, 'subsample': 0.6585481125455502, 'max_features': None}. Best is trial 989 with value: 0.3092662874814911.
[I 2024-12-04 12:37:54,317] Trial 1247 finished with value: 0.3431881203642296 and parameters: {'n_estimators': 647, 'learning_rate': 0.09819315538939018, 'max_depth': 7, 'min_samples_split': 4, 'min_samples_leaf': 2, 'subsample': 0.650169587773674, 'max_features': None}. Best is trial 989 with value: 0.3092662874814911.
[I 2024-12-04 12:37:54,351] Trial 1260 finished with value: 0.957333833416641 and parameters: {'n_estimators': 137, 'learning_rate': 0.026418262520016857, 'max_depth': 3, 'min_samples_split': 20, 'min_samples_leaf': 5, 'subsample': 0.6722176503759143, 'max_features': 'log2'}. Best is trial 989 with value: 0.3092662874814911.
[I 2024-12-04 12:37:58,095] Trial 1230 finished with value: 0.35231635642391024 and parameters: {'n_estimators': 1381, 'learning_rate': 0.048546985021804545, 'max_depth': 4, 'min_samples_split': 3, 'min_samples_leaf': 2, 'subsample': 0.6059276426904794, 'max_features': None}. Best is trial 989 with value: 0.3092662874814911.
[I 2024-12-04 12:37:58,263] Trial 1232 finished with value: 0.3596057413094001 and parameters: {'n_estimators': 1183, 'learning_rate': 0.0559222903974101, 'max_depth': 5, 'min_samples_split': 2, 'min_samples_leaf': 1, 'subsample': 0.6690607458621031, 'max_features': None}. Best is trial 989 with value: 0.3092662874814911.
[I 2024-12-04 12:37:58,826] Trial 1236 finished with value: 0.39575690094335847 and parameters: {'n_estimators': 1126, 'learning_rate': 0.09030641875629368, 'max_depth': 7, 'min_samples_split': 2, 'min_samples_leaf': 3, 'subsample': 0.762046837362232, 'max_features': None}. Best is trial 989 with value: 0.3092662874814911.
[I 2024-12-04 12:37:59,061] Trial 1242 finished with value: 0.3681645836337832 and parameters: {'n_estimators': 921, 'learning_rate': 0.09610695604902478, 'max_depth': 7, 'min_samples_split': 4, 'min_samples_leaf': 4, 'subsample': 0.6915691023441308, 'max_features': None}. Best is trial 989 with value: 0.3092662874814911.
[I 2024-12-04 12:37:59,939] Trial 1245 finished with value: 0.4033603963081576 and parameters: {'n_estimators': 1010, 'learning_rate': 0.04888933699363873, 'max_depth': 6, 'min_samples_split': 2, 'min_samples_leaf': 2, 'subsample': 0.6996653522715715, 'max_features': 'sqrt'}. Best is trial 989 with value: 0.3092662874814911.
[I 2024-12-04 12:38:04,881] Trial 1237 finished with value: 0.3165247352118119 and parameters: {'n_estimators': 1252, 'learning_rate': 0.09367613424053968, 'max_depth': 6, 'min_samples_split': 3, 'min_samples_leaf': 2, 'subsample': 0.694677437835328, 'max_features': None}. Best is trial 989 with value: 0.3092662874814911.
[I 2024-12-04 12:38:06,321] Trial 1243 finished with value: 0.41847486270335443 and parameters: {'n_estimators': 1262, 'learning_rate': 0.09030766415421397, 'max_depth': 3, 'min_samples_split': 12, 'min_samples_leaf': 6, 'subsample': 0.9010131443241935, 'max_features': None}. Best is trial 989 with value: 0.3092662874814911.
[I 2024-12-04 12:38:06,338] Trial 1233 finished with value: 0.3275651497097916 and parameters: {'n_estimators': 1436, 'learning_rate': 0.06317212283421789, 'max_depth': 8, 'min_samples_split': 2, 'min_samples_leaf': 2, 'subsample': 0.6922728862802825, 'max_features': None}. Best is trial 989 with value: 0.3092662874814911.
[I 2024-12-04 12:38:06,352] Trial 1249 finished with value: 0.39422772907114845 and parameters: {'n_estimators': 956, 'learning_rate': 0.06944565653412864, 'max_depth': 8, 'min_samples_split': 3, 'min_samples_leaf': 3, 'subsample': 0.6404348898638721, 'max_features': None}. Best is trial 989 with value: 0.3092662874814911.
[I 2024-12-04 12:38:07,369] Trial 1234 finished with value: 0.3875143190067465 and parameters: {'n_estimators': 1400, 'learning_rate': 0.07121412684416631, 'max_depth': 6, 'min_samples_split': 2, 'min_samples_leaf': 3, 'subsample': 0.6660205938846734, 'max_features': None}. Best is trial 989 with value: 0.3092662874814911.
[I 2024-12-04 12:38:08,468] Trial 1271 finished with value: 0.705979042748533 and parameters: {'n_estimators': 170, 'learning_rate': 0.010406591640119494, 'max_depth': 3, 'min_samples_split': 6, 'min_samples_leaf': 10, 'subsample': 0.8602567812597285, 'max_features': None}. Best is trial 989 with value: 0.3092662874814911.
[I 2024-12-04 12:38:10,951] Trial 1246 finished with value: 0.3148991794793547 and parameters: {'n_estimators': 1216, 'learning_rate': 0.046344880537234845, 'max_depth': 7, 'min_samples_split': 2, 'min_samples_leaf': 2, 'subsample': 0.619162189593583, 'max_features': None}. Best is trial 989 with value: 0.3092662874814911.
[I 2024-12-04 12:38:11,168] Trial 1240 finished with value: 0.33160720996242765 and parameters: {'n_estimators': 1372, 'learning_rate': 0.09941936659322947, 'max_depth': 7, 'min_samples_split': 2, 'min_samples_leaf': 2, 'subsample': 0.7142702211571208, 'max_features': None}. Best is trial 989 with value: 0.3092662874814911.
[I 2024-12-04 12:38:16,014] Trial 1280 finished with value: 1.0272698204305941 and parameters: {'n_estimators': 149, 'learning_rate': 0.027667249170982625, 'max_depth': 10, 'min_samples_split': 6, 'min_samples_leaf': 8, 'subsample': 0.8117018246028689, 'max_features': 'log2'}. Best is trial 989 with value: 0.3092662874814911.
[I 2024-12-04 12:38:17,355] Trial 1276 finished with value: 0.5608609220855423 and parameters: {'n_estimators': 340, 'learning_rate': 0.03532590210222433, 'max_depth': 5, 'min_samples_split': 18, 'min_samples_leaf': 9, 'subsample': 0.7812007979020611, 'max_features': None}. Best is trial 989 with value: 0.3092662874814911.
[I 2024-12-04 12:38:21,061] Trial 1256 finished with value: 0.3247512483538508 and parameters: {'n_estimators': 1090, 'learning_rate': 0.05959517843642944, 'max_depth': 7, 'min_samples_split': 6, 'min_samples_leaf': 2, 'subsample': 0.7466134285523636, 'max_features': None}. Best is trial 989 with value: 0.3092662874814911.
[I 2024-12-04 12:38:21,518] Trial 1251 finished with value: 0.32852122590028376 and parameters: {'n_estimators': 1383, 'learning_rate': 0.08757064089930765, 'max_depth': 4, 'min_samples_split': 2, 'min_samples_leaf': 2, 'subsample': 0.7645018057332571, 'max_features': None}. Best is trial 989 with value: 0.3092662874814911.
[I 2024-12-04 12:38:22,133] Trial 1253 finished with value: 0.31919012187810164 and parameters: {'n_estimators': 1276, 'learning_rate': 0.09821096609220743, 'max_depth': 7, 'min_samples_split': 6, 'min_samples_leaf': 2, 'subsample': 0.6627290034809933, 'max_features': None}. Best is trial 989 with value: 0.3092662874814911.
[I 2024-12-04 12:38:22,922] Trial 1255 finished with value: 0.3975167967038851 and parameters: {'n_estimators': 1228, 'learning_rate': 0.07156098861024233, 'max_depth': 4, 'min_samples_split': 6, 'min_samples_leaf': 1, 'subsample': 0.7097300709470143, 'max_features': None}. Best is trial 989 with value: 0.3092662874814911.
[I 2024-12-04 12:38:23,814] Trial 1250 finished with value: 0.3738796221864824 and parameters: {'n_estimators': 1449, 'learning_rate': 0.0843464814560078, 'max_depth': 6, 'min_samples_split': 2, 'min_samples_leaf': 4, 'subsample': 0.6795972752333121, 'max_features': None}. Best is trial 989 with value: 0.3092662874814911.
[I 2024-12-04 12:38:25,292] Trial 1262 finished with value: 0.33593197562919747 and parameters: {'n_estimators': 969, 'learning_rate': 0.08449548845214756, 'max_depth': 7, 'min_samples_split': 4, 'min_samples_leaf': 2, 'subsample': 0.6255225734256573, 'max_features': None}. Best is trial 989 with value: 0.3092662874814911.
[I 2024-12-04 12:38:26,187] Trial 1252 finished with value: 0.3166272738351495 and parameters: {'n_estimators': 1408, 'learning_rate': 0.07807164016174853, 'max_depth': 6, 'min_samples_split': 2, 'min_samples_leaf': 2, 'subsample': 0.6954954826538029, 'max_features': None}. Best is trial 989 with value: 0.3092662874814911.
[I 2024-12-04 12:38:26,190] Trial 1268 finished with value: 0.4407971891727467 and parameters: {'n_estimators': 864, 'learning_rate': 0.09483505394740742, 'max_depth': 7, 'min_samples_split': 2, 'min_samples_leaf': 2, 'subsample': 0.8400434303624534, 'max_features': 'log2'}. Best is trial 989 with value: 0.3092662874814911.
[I 2024-12-04 12:38:26,203] Trial 1275 finished with value: 0.4192240373813062 and parameters: {'n_estimators': 713, 'learning_rate': 0.043377676743702645, 'max_depth': 9, 'min_samples_split': 9, 'min_samples_leaf': 3, 'subsample': 0.7790965759989489, 'max_features': 'sqrt'}. Best is trial 989 with value: 0.3092662874814911.
[I 2024-12-04 12:38:30,807] Trial 1258 finished with value: 0.4041206492038598 and parameters: {'n_estimators': 1295, 'learning_rate': 0.05403539565664495, 'max_depth': 5, 'min_samples_split': 9, 'min_samples_leaf': 1, 'subsample': 0.9810712433261826, 'max_features': None}. Best is trial 989 with value: 0.3092662874814911.
[I 2024-12-04 12:38:31,066] Trial 1257 finished with value: 0.3718547666480079 and parameters: {'n_estimators': 1363, 'learning_rate': 0.05580306173458024, 'max_depth': 6, 'min_samples_split': 4, 'min_samples_leaf': 4, 'subsample': 0.6150521823111079, 'max_features': None}. Best is trial 989 with value: 0.3092662874814911.
[I 2024-12-04 12:38:31,213] Trial 1261 finished with value: 0.4058951956378419 and parameters: {'n_estimators': 1196, 'learning_rate': 0.08074005665926302, 'max_depth': 7, 'min_samples_split': 4, 'min_samples_leaf': 7, 'subsample': 0.7600490043314297, 'max_features': None}. Best is trial 989 with value: 0.3092662874814911.
[I 2024-12-04 12:38:32,297] Trial 1266 finished with value: 0.3532937269845915 and parameters: {'n_estimators': 928, 'learning_rate': 0.061335838177692295, 'max_depth': 5, 'min_samples_split': 8, 'min_samples_leaf': 2, 'subsample': 0.7220268329169007, 'max_features': None}. Best is trial 989 with value: 0.3092662874814911.
[I 2024-12-04 12:38:33,533] Trial 1267 finished with value: 0.39096103064573345 and parameters: {'n_estimators': 1021, 'learning_rate': 0.07208754028673428, 'max_depth': 6, 'min_samples_split': 2, 'min_samples_leaf': 3, 'subsample': 0.804051390970722, 'max_features': None}. Best is trial 989 with value: 0.3092662874814911.
[I 2024-12-04 12:38:35,466] Trial 1259 finished with value: 0.38490070593032577 and parameters: {'n_estimators': 1378, 'learning_rate': 0.09377342757325399, 'max_depth': 7, 'min_samples_split': 2, 'min_samples_leaf': 1, 'subsample': 0.6257794556663152, 'max_features': None}. Best is trial 989 with value: 0.3092662874814911.
[I 2024-12-04 12:38:37,928] Trial 1270 finished with value: 0.40162763852281447 and parameters: {'n_estimators': 1083, 'learning_rate': 0.06344995051195704, 'max_depth': 6, 'min_samples_split': 2, 'min_samples_leaf': 3, 'subsample': 0.6845973147463358, 'max_features': None}. Best is trial 989 with value: 0.3092662874814911.
[I 2024-12-04 12:38:39,277] Trial 1273 finished with value: 0.3275886460065005 and parameters: {'n_estimators': 968, 'learning_rate': 0.0973037880615042, 'max_depth': 7, 'min_samples_split': 4, 'min_samples_leaf': 2, 'subsample': 0.6956048592930595, 'max_features': None}. Best is trial 989 with value: 0.3092662874814911.
[I 2024-12-04 12:38:40,615] Trial 1272 finished with value: 0.3301779170886809 and parameters: {'n_estimators': 1055, 'learning_rate': 0.09813004918835518, 'max_depth': 6, 'min_samples_split': 5, 'min_samples_leaf': 2, 'subsample': 0.6283051546040765, 'max_features': None}. Best is trial 989 with value: 0.3092662874814911.
