[I 2024-12-04 12:35:51,610] Trial 1140 finished with value: 0.33099318559438196 and parameters: {'n_estimators': 755, 'learning_rate': 0.09821719389330659, 'max_depth': 8, 'min_samples_split': 3, 'min_samples_leaf': 2, 'subsample': 0.6391435242207683, 'max_features': None}. Best is trial 989 with value: 0.3092662874814911.
[I 2024-12-04 12:35:52,998] Trial 1135 finished with value: 0.38145244783098153 and parameters: {'n_estimators': 1196, 'learning_rate': 0.08317428825812936, 'max_depth': 4, 'min_samples_split': 2, 'min_samples_leaf': 1, 'subsample': 0.6015914271114158, 'max_features': 'sqrt'}. Best is trial 989 with value: 0.3092662874814911.
[I 2024-12-04 12:35:53,907] Trial 1144 finished with value: 0.3645378579962678 and parameters: {'n_estimators': 774, 'learning_rate': 0.08020378206720447, 'max_depth': 5, 'min_samples_split': 2, 'min_samples_leaf': 1, 'subsample': 0.6301385471163099, 'max_features': None}. Best is trial 989 with value: 0.3092662874814911.
[I 2024-12-04 12:35:53,909] Trial 1133 finished with value: 0.3939494423344222 and parameters: {'n_estimators': 1149, 'learning_rate': 0.094807594936998, 'max_depth': 6, 'min_samples_split': 3, 'min_samples_leaf': 3, 'subsample': 0.7332316557108742, 'max_features': None}. Best is trial 989 with value: 0.3092662874814911.
[I 2024-12-04 12:35:55,401] Trial 1145 finished with value: 0.44529191070166546 and parameters: {'n_estimators': 862, 'learning_rate': 0.06214857695517188, 'max_depth': 4, 'min_samples_split': 2, 'min_samples_leaf': 1, 'subsample': 0.6750920825067152, 'max_features': 'log2'}. Best is trial 989 with value: 0.3092662874814911.
[I 2024-12-04 12:35:58,282] Trial 1151 finished with value: 0.33420303608911744 and parameters: {'n_estimators': 652, 'learning_rate': 0.0913833206748368, 'max_depth': 7, 'min_samples_split': 2, 'min_samples_leaf': 2, 'subsample': 0.6467205213207327, 'max_features': None}. Best is trial 989 with value: 0.3092662874814911.
[I 2024-12-04 12:35:59,580] Trial 1142 finished with value: 0.43089407414504055 and parameters: {'n_estimators': 1059, 'learning_rate': 0.03570653272851669, 'max_depth': 3, 'min_samples_split': 5, 'min_samples_leaf': 1, 'subsample': 0.9773009194832866, 'max_features': None}. Best is trial 989 with value: 0.3092662874814911.
[I 2024-12-04 12:35:59,586] Trial 1136 finished with value: 0.3896977708607903 and parameters: {'n_estimators': 1140, 'learning_rate': 0.09723384121880627, 'max_depth': 7, 'min_samples_split': 2, 'min_samples_leaf': 3, 'subsample': 0.7460673955824628, 'max_features': None}. Best is trial 989 with value: 0.3092662874814911.
[I 2024-12-04 12:36:00,077] Trial 1131 finished with value: 0.3227000003707309 and parameters: {'n_estimators': 1452, 'learning_rate': 0.07560288998492076, 'max_depth': 6, 'min_samples_split': 3, 'min_samples_leaf': 2, 'subsample': 0.6342524607002948, 'max_features': None}. Best is trial 989 with value: 0.3092662874814911.
[I 2024-12-04 12:36:00,666] Trial 1157 finished with value: 0.40357105822784833 and parameters: {'n_estimators': 570, 'learning_rate': 0.07509259856109468, 'max_depth': 6, 'min_samples_split': 4, 'min_samples_leaf': 3, 'subsample': 0.7241505211974195, 'max_features': None}. Best is trial 989 with value: 0.3092662874814911.
[I 2024-12-04 12:36:00,668] Trial 1155 finished with value: 0.38753308006938747 and parameters: {'n_estimators': 631, 'learning_rate': 0.08734020472332903, 'max_depth': 6, 'min_samples_split': 9, 'min_samples_leaf': 1, 'subsample': 0.7106384827890132, 'max_features': None}. Best is trial 989 with value: 0.3092662874814911.
[I 2024-12-04 12:36:03,377] Trial 1150 finished with value: 0.3979193485179713 and parameters: {'n_estimators': 847, 'learning_rate': 0.08968324326777384, 'max_depth': 6, 'min_samples_split': 2, 'min_samples_leaf': 3, 'subsample': 0.6813676611882461, 'max_features': None}. Best is trial 989 with value: 0.3092662874814911.
[I 2024-12-04 12:36:03,377] Trial 1153 finished with value: 0.37302880071271755 and parameters: {'n_estimators': 729, 'learning_rate': 0.09967537079056549, 'max_depth': 7, 'min_samples_split': 3, 'min_samples_leaf': 4, 'subsample': 0.6137100997945454, 'max_features': None}. Best is trial 989 with value: 0.3092662874814911.
[I 2024-12-04 12:36:05,259] Trial 1152 finished with value: 0.3338455669059691 and parameters: {'n_estimators': 806, 'learning_rate': 0.08809069361473147, 'max_depth': 5, 'min_samples_split': 2, 'min_samples_leaf': 2, 'subsample': 0.7016339825771678, 'max_features': None}. Best is trial 989 with value: 0.3092662874814911.
[I 2024-12-04 12:36:08,263] Trial 1132 finished with value: 0.40443235938154204 and parameters: {'n_estimators': 1483, 'learning_rate': 0.09768114871994381, 'max_depth': 8, 'min_samples_split': 2, 'min_samples_leaf': 3, 'subsample': 0.7010733725916576, 'max_features': None}. Best is trial 989 with value: 0.3092662874814911.
[I 2024-12-04 12:36:08,274] Trial 1137 finished with value: 0.3947847094812897 and parameters: {'n_estimators': 1448, 'learning_rate': 0.05264598102139428, 'max_depth': 5, 'min_samples_split': 6, 'min_samples_leaf': 3, 'subsample': 0.6694932867042531, 'max_features': None}. Best is trial 989 with value: 0.3092662874814911.
[I 2024-12-04 12:36:09,735] Trial 1146 finished with value: 0.3835214846915513 and parameters: {'n_estimators': 1144, 'learning_rate': 0.07652856037832934, 'max_depth': 7, 'min_samples_split': 2, 'min_samples_leaf': 3, 'subsample': 0.6962871567472816, 'max_features': None}. Best is trial 989 with value: 0.3092662874814911.
[I 2024-12-04 12:36:10,067] Trial 1156 finished with value: 0.36762989102843124 and parameters: {'n_estimators': 1011, 'learning_rate': 0.09961768043007135, 'max_depth': 10, 'min_samples_split': 4, 'min_samples_leaf': 2, 'subsample': 0.6724827703450693, 'max_features': 'sqrt'}. Best is trial 989 with value: 0.3092662874814911.
[I 2024-12-04 12:36:10,636] Trial 1148 finished with value: 0.41201617022168985 and parameters: {'n_estimators': 1048, 'learning_rate': 0.02045500091764569, 'max_depth': 6, 'min_samples_split': 2, 'min_samples_leaf': 7, 'subsample': 0.8978058668172256, 'max_features': None}. Best is trial 989 with value: 0.3092662874814911.
[I 2024-12-04 12:36:15,326] Trial 1160 finished with value: 0.32387331537344016 and parameters: {'n_estimators': 942, 'learning_rate': 0.0810528193930304, 'max_depth': 6, 'min_samples_split': 5, 'min_samples_leaf': 2, 'subsample': 0.713668814954556, 'max_features': None}. Best is trial 989 with value: 0.3092662874814911.
[I 2024-12-04 12:36:16,887] Trial 1154 finished with value: 0.40049348095478426 and parameters: {'n_estimators': 1116, 'learning_rate': 0.04400194112189504, 'max_depth': 9, 'min_samples_split': 15, 'min_samples_leaf': 7, 'subsample': 0.7532678784348907, 'max_features': None}. Best is trial 989 with value: 0.3092662874814911.
[I 2024-12-04 12:36:18,188] Trial 1163 finished with value: 0.37426434772081235 and parameters: {'n_estimators': 950, 'learning_rate': 0.06118444204872853, 'max_depth': 3, 'min_samples_split': 3, 'min_samples_leaf': 2, 'subsample': 0.8097338886353084, 'max_features': None}. Best is trial 989 with value: 0.3092662874814911.
[I 2024-12-04 12:36:20,031] Trial 1168 finished with value: 0.6516058434087285 and parameters: {'n_estimators': 856, 'learning_rate': 0.02031764515872095, 'max_depth': 3, 'min_samples_split': 2, 'min_samples_leaf': 2, 'subsample': 0.8766126655111888, 'max_features': 'log2'}. Best is trial 989 with value: 0.3092662874814911.
[I 2024-12-04 12:36:20,067] Trial 1162 finished with value: 0.3901815235906925 and parameters: {'n_estimators': 1047, 'learning_rate': 0.09288156141245899, 'max_depth': 4, 'min_samples_split': 2, 'min_samples_leaf': 1, 'subsample': 0.7120257261981494, 'max_features': None}. Best is trial 989 with value: 0.3092662874814911.
[I 2024-12-04 12:36:21,333] Trial 1173 finished with value: 0.3753356462755607 and parameters: {'n_estimators': 628, 'learning_rate': 0.06653513098042857, 'max_depth': 7, 'min_samples_split': 2, 'min_samples_leaf': 4, 'subsample': 0.6261807104289739, 'max_features': None}. Best is trial 989 with value: 0.3092662874814911.
[I 2024-12-04 12:36:23,450] Trial 1158 finished with value: 0.3365426199388881 and parameters: {'n_estimators': 1226, 'learning_rate': 0.0792306218435813, 'max_depth': 6, 'min_samples_split': 2, 'min_samples_leaf': 2, 'subsample': 0.6081467489149607, 'max_features': None}. Best is trial 989 with value: 0.3092662874814911.
[I 2024-12-04 12:36:25,911] Trial 1161 finished with value: 0.4279121454356017 and parameters: {'n_estimators': 1347, 'learning_rate': 0.040842398494015095, 'max_depth': 7, 'min_samples_split': 20, 'min_samples_leaf': 5, 'subsample': 0.9619757092838322, 'max_features': 'sqrt'}. Best is trial 989 with value: 0.3092662874814911.
[I 2024-12-04 12:36:26,707] Trial 1166 finished with value: 0.3910313199202613 and parameters: {'n_estimators': 1009, 'learning_rate': 0.09492095495761006, 'max_depth': 5, 'min_samples_split': 4, 'min_samples_leaf': 3, 'subsample': 0.7121264520885551, 'max_features': None}. Best is trial 989 with value: 0.3092662874814911.
[I 2024-12-04 12:36:28,934] Trial 1170 finished with value: 0.40268122475791 and parameters: {'n_estimators': 925, 'learning_rate': 0.07443468734884139, 'max_depth': 5, 'min_samples_split': 6, 'min_samples_leaf': 3, 'subsample': 0.7743287925149156, 'max_features': None}. Best is trial 989 with value: 0.3092662874814911.
[I 2024-12-04 12:36:31,177] Trial 1183 finished with value: 0.4637411036551728 and parameters: {'n_estimators': 704, 'learning_rate': 0.027687173932869527, 'max_depth': 4, 'min_samples_split': 14, 'min_samples_leaf': 2, 'subsample': 0.8095726411111615, 'max_features': 'sqrt'}. Best is trial 989 with value: 0.3092662874814911.
[I 2024-12-04 12:36:33,876] Trial 1196 finished with value: 0.6147853763627528 and parameters: {'n_estimators': 297, 'learning_rate': 0.09009471763773304, 'max_depth': 3, 'min_samples_split': 18, 'min_samples_leaf': 4, 'subsample': 0.7202181594945019, 'max_features': 'log2'}. Best is trial 989 with value: 0.3092662874814911.
[I 2024-12-04 12:36:34,711] Trial 1190 finished with value: 0.4220603002136149 and parameters: {'n_estimators': 506, 'learning_rate': 0.08413250765703954, 'max_depth': 4, 'min_samples_split': 20, 'min_samples_leaf': 7, 'subsample': 0.9181694292391703, 'max_features': None}. Best is trial 989 with value: 0.3092662874814911.
[I 2024-12-04 12:36:35,800] Trial 1164 finished with value: 0.37173164787585083 and parameters: {'n_estimators': 1410, 'learning_rate': 0.09140757766908753, 'max_depth': 8, 'min_samples_split': 3, 'min_samples_leaf': 5, 'subsample': 0.6186556358844028, 'max_features': None}. Best is trial 989 with value: 0.3092662874814911.
[I 2024-12-04 12:36:38,021] Trial 1169 finished with value: 0.3309082168226618 and parameters: {'n_estimators': 1237, 'learning_rate': 0.0944864478274645, 'max_depth': 4, 'min_samples_split': 2, 'min_samples_leaf': 2, 'subsample': 0.6553734623397458, 'max_features': None}. Best is trial 989 with value: 0.3092662874814911.
[I 2024-12-04 12:36:38,776] Trial 1165 finished with value: 0.40779281084539604 and parameters: {'n_estimators': 1418, 'learning_rate': 0.03711180233957628, 'max_depth': 6, 'min_samples_split': 20, 'min_samples_leaf': 1, 'subsample': 0.7821981063037711, 'max_features': None}. Best is trial 989 with value: 0.3092662874814911.
[I 2024-12-04 12:36:39,494] Trial 1171 finished with value: 0.4022713137757289 and parameters: {'n_estimators': 1295, 'learning_rate': 0.08765982022643919, 'max_depth': 4, 'min_samples_split': 2, 'min_samples_leaf': 3, 'subsample': 0.6984386679965598, 'max_features': None}. Best is trial 989 with value: 0.3092662874814911.
[I 2024-12-04 12:36:39,540] Trial 1174 finished with value: 0.38361273983835725 and parameters: {'n_estimators': 1132, 'learning_rate': 0.09378561771851016, 'max_depth': 9, 'min_samples_split': 2, 'min_samples_leaf': 4, 'subsample': 0.7495733731464359, 'max_features': None}. Best is trial 989 with value: 0.3092662874814911.
[I 2024-12-04 12:36:40,447] Trial 1175 finished with value: 0.3952778771676147 and parameters: {'n_estimators': 1151, 'learning_rate': 0.09384423668815571, 'max_depth': 5, 'min_samples_split': 3, 'min_samples_leaf': 3, 'subsample': 0.7482915999875102, 'max_features': None}. Best is trial 989 with value: 0.3092662874814911.
[I 2024-12-04 12:36:41,164] Trial 1172 finished with value: 0.3607808471589821 and parameters: {'n_estimators': 1240, 'learning_rate': 0.07581469106919539, 'max_depth': 6, 'min_samples_split': 2, 'min_samples_leaf': 1, 'subsample': 0.6938411663273291, 'max_features': None}. Best is trial 989 with value: 0.3092662874814911.
[I 2024-12-04 12:36:41,184] Trial 1189 finished with value: 0.4761986527068893 and parameters: {'n_estimators': 845, 'learning_rate': 0.07815739578446222, 'max_depth': 7, 'min_samples_split': 2, 'min_samples_leaf': 4, 'subsample': 0.7421450298055889, 'max_features': 'log2'}. Best is trial 989 with value: 0.3092662874814911.
[I 2024-12-04 12:36:42,213] Trial 1176 finished with value: 0.32356059769227824 and parameters: {'n_estimators': 1138, 'learning_rate': 0.07017307469986175, 'max_depth': 7, 'min_samples_split': 2, 'min_samples_leaf': 2, 'subsample': 0.6496880982919427, 'max_features': None}. Best is trial 989 with value: 0.3092662874814911.
[I 2024-12-04 12:36:42,459] Trial 1187 finished with value: 0.33204308958185563 and parameters: {'n_estimators': 717, 'learning_rate': 0.08139948840184023, 'max_depth': 7, 'min_samples_split': 6, 'min_samples_leaf': 2, 'subsample': 0.7430951636394922, 'max_features': None}. Best is trial 989 with value: 0.3092662874814911.
[I 2024-12-04 12:36:42,601] Trial 1192 finished with value: 0.4063063770997989 and parameters: {'n_estimators': 602, 'learning_rate': 0.08872468619067761, 'max_depth': 8, 'min_samples_split': 2, 'min_samples_leaf': 1, 'subsample': 0.6964241989553916, 'max_features': None}. Best is trial 989 with value: 0.3092662874814911.
[I 2024-12-04 12:36:44,068] Trial 1167 finished with value: 0.38808818579865223 and parameters: {'n_estimators': 1478, 'learning_rate': 0.09476758700730573, 'max_depth': 6, 'min_samples_split': 2, 'min_samples_leaf': 3, 'subsample': 0.6168691753832718, 'max_features': None}. Best is trial 989 with value: 0.3092662874814911.
[I 2024-12-04 12:36:47,551] Trial 1184 finished with value: 0.40284868589298634 and parameters: {'n_estimators': 1014, 'learning_rate': 0.016801692836534085, 'max_depth': 5, 'min_samples_split': 12, 'min_samples_leaf': 5, 'subsample': 0.6031988082125443, 'max_features': None}. Best is trial 989 with value: 0.3092662874814911.
[I 2024-12-04 12:36:48,655] Trial 1178 finished with value: 0.31580391463903557 and parameters: {'n_estimators': 1251, 'learning_rate': 0.0870848815317674, 'max_depth': 6, 'min_samples_split': 2, 'min_samples_leaf': 2, 'subsample': 0.6912351215807854, 'max_features': None}. Best is trial 989 with value: 0.3092662874814911.
[I 2024-12-04 12:36:49,757] Trial 1179 finished with value: 0.38877561934911925 and parameters: {'n_estimators': 1251, 'learning_rate': 0.09281668278462453, 'max_depth': 8, 'min_samples_split': 2, 'min_samples_leaf': 3, 'subsample': 0.6069123954125286, 'max_features': None}. Best is trial 989 with value: 0.3092662874814911.
[I 2024-12-04 12:36:50,479] Trial 1181 finished with value: 0.3813931574665269 and parameters: {'n_estimators': 1187, 'learning_rate': 0.06814937563288485, 'max_depth': 8, 'min_samples_split': 2, 'min_samples_leaf': 1, 'subsample': 0.7332427123698839, 'max_features': None}. Best is trial 989 with value: 0.3092662874814911.
[I 2024-12-04 12:36:51,239] Trial 1206 finished with value: 0.8734928149918842 and parameters: {'n_estimators': 132, 'learning_rate': 0.07955575439179911, 'max_depth': 10, 'min_samples_split': 20, 'min_samples_leaf': 10, 'subsample': 0.7292094405154613, 'max_features': 'log2'}. Best is trial 989 with value: 0.3092662874814911.
[I 2024-12-04 12:36:52,699] Trial 1182 finished with value: 0.35549539487211085 and parameters: {'n_estimators': 1358, 'learning_rate': 0.09227896395551283, 'max_depth': 9, 'min_samples_split': 7, 'min_samples_leaf': 1, 'subsample': 0.6008078095556434, 'max_features': 'sqrt'}. Best is trial 989 with value: 0.3092662874814911.
[I 2024-12-04 12:36:54,078] Trial 1177 finished with value: 0.32942330390581703 and parameters: {'n_estimators': 1360, 'learning_rate': 0.09916804691783736, 'max_depth': 6, 'min_samples_split': 3, 'min_samples_leaf': 2, 'subsample': 0.6854358730303559, 'max_features': None}. Best is trial 989 with value: 0.3092662874814911.
[I 2024-12-04 12:36:54,255] Trial 1188 finished with value: 0.39186867987725554 and parameters: {'n_estimators': 1175, 'learning_rate': 0.06042604602427218, 'max_depth': 5, 'min_samples_split': 3, 'min_samples_leaf': 3, 'subsample': 0.6639543880144833, 'max_features': None}. Best is trial 989 with value: 0.3092662874814911.
[I 2024-12-04 12:36:55,399] Trial 1180 finished with value: 0.37072708118935876 and parameters: {'n_estimators': 1431, 'learning_rate': 0.06821197801929262, 'max_depth': 7, 'min_samples_split': 2, 'min_samples_leaf': 1, 'subsample': 0.6228834168584391, 'max_features': None}. Best is trial 989 with value: 0.3092662874814911.
[I 2024-12-04 12:36:58,948] Trial 1205 finished with value: 0.3970883267122742 and parameters: {'n_estimators': 355, 'learning_rate': 0.09289525463320185, 'max_depth': 6, 'min_samples_split': 3, 'min_samples_leaf': 1, 'subsample': 0.7228269550834174, 'max_features': None}. Best is trial 989 with value: 0.3092662874814911.
[I 2024-12-04 12:36:59,290] Trial 1191 finished with value: 0.4260443536395506 and parameters: {'n_estimators': 1272, 'learning_rate': 0.097845160028417, 'max_depth': 5, 'min_samples_split': 3, 'min_samples_leaf': 3, 'subsample': 0.712069105764601, 'max_features': 'sqrt'}. Best is trial 989 with value: 0.3092662874814911.
[I 2024-12-04 12:36:59,398] Trial 1195 finished with value: 0.39743860765531724 and parameters: {'n_estimators': 993, 'learning_rate': 0.08502019417022276, 'max_depth': 7, 'min_samples_split': 2, 'min_samples_leaf': 1, 'subsample': 0.7283708013760546, 'max_features': None}. Best is trial 989 with value: 0.3092662874814911.
[I 2024-12-04 12:37:00,834] Trial 1186 finished with value: 0.3804330674995683 and parameters: {'n_estimators': 1347, 'learning_rate': 0.08378411522514152, 'max_depth': 7, 'min_samples_split': 2, 'min_samples_leaf': 1, 'subsample': 0.6979828171821592, 'max_features': None}. Best is trial 989 with value: 0.3092662874814911.
[I 2024-12-04 12:37:02,209] Trial 1198 finished with value: 0.3380802982608637 and parameters: {'n_estimators': 1001, 'learning_rate': 0.05357714850682332, 'max_depth': 5, 'min_samples_split': 3, 'min_samples_leaf': 2, 'subsample': 0.7358693771930933, 'max_features': None}. Best is trial 989 with value: 0.3092662874814911.
[I 2024-12-04 12:37:02,626] Trial 1185 finished with value: 0.32505308240842884 and parameters: {'n_estimators': 1447, 'learning_rate': 0.07864022674569997, 'max_depth': 6, 'min_samples_split': 4, 'min_samples_leaf': 2, 'subsample': 0.6467826539526961, 'max_features': None}. Best is trial 989 with value: 0.3092662874814911.
[I 2024-12-04 12:37:03,600] Trial 1200 finished with value: 0.32661013107671777 and parameters: {'n_estimators': 908, 'learning_rate': 0.09788593749535288, 'max_depth': 7, 'min_samples_split': 5, 'min_samples_leaf': 2, 'subsample': 0.7123185148018651, 'max_features': None}. Best is trial 989 with value: 0.3092662874814911.
[I 2024-12-04 12:37:04,668] Trial 1193 finished with value: 0.45833235559373303 and parameters: {'n_estimators': 1394, 'learning_rate': 0.09489512185414048, 'max_depth': 6, 'min_samples_split': 3, 'min_samples_leaf': 3, 'subsample': 0.6269017522598275, 'max_features': 'log2'}. Best is trial 989 with value: 0.3092662874814911.
[I 2024-12-04 12:37:07,738] Trial 1199 finished with value: 0.7220476105213551 and parameters: {'n_estimators': 1183, 'learning_rate': 0.012192264921230295, 'max_depth': 12, 'min_samples_split': 17, 'min_samples_leaf': 6, 'subsample': 0.9859221747104816, 'max_features': 'log2'}. Best is trial 989 with value: 0.3092662874814911.
[I 2024-12-04 12:37:09,896] Trial 1208 finished with value: 0.40538900379877696 and parameters: {'n_estimators': 645, 'learning_rate': 0.08912949371213388, 'max_depth': 6, 'min_samples_split': 2, 'min_samples_leaf': 2, 'subsample': 0.6483041460173561, 'max_features': 'sqrt'}. Best is trial 989 with value: 0.3092662874814911.
[I 2024-12-04 12:37:10,713] Trial 1216 finished with value: 0.7445634727085845 and parameters: {'n_estimators': 265, 'learning_rate': 0.010220513688302516, 'max_depth': 8, 'min_samples_split': 16, 'min_samples_leaf': 5, 'subsample': 0.9907316683622784, 'max_features': 'sqrt'}. Best is trial 989 with value: 0.3092662874814911.
[I 2024-12-04 12:37:11,471] Trial 1197 finished with value: 0.5513428591298667 and parameters: {'n_estimators': 1300, 'learning_rate': 0.02934734088259901, 'max_depth': 6, 'min_samples_split': 19, 'min_samples_leaf': 10, 'subsample': 0.9855214464942584, 'max_features': None}. Best is trial 989 with value: 0.3092662874814911.
[I 2024-12-04 12:37:12,253] Trial 1194 finished with value: 0.3338200711939974 and parameters: {'n_estimators': 1453, 'learning_rate': 0.07389299656667736, 'max_depth': 5, 'min_samples_split': 2, 'min_samples_leaf': 2, 'subsample': 0.6532058804913423, 'max_features': None}. Best is trial 989 with value: 0.3092662874814911.
[I 2024-12-04 12:37:13,519] Trial 1202 finished with value: 0.447767684457517 and parameters: {'n_estimators': 1265, 'learning_rate': 0.07399801959055156, 'max_depth': 5, 'min_samples_split': 2, 'min_samples_leaf': 4, 'subsample': 0.7144757139994639, 'max_features': 'log2'}. Best is trial 989 with value: 0.3092662874814911.
