[I 2024-12-04 15:22:28,791] Trial 1626 finished with value: 0.13435439333394952 and parameters: {'kernel_type': 'Matern', 'length_scale': 66.89234269035782, 'noise_level': 0.05871158832574009, 'constant_value': 941.1391666881179, 'nu': 1.5}. Best is trial 1456 with value: 0.13435337537029549.
[I 2024-12-04 15:22:28,841] Trial 1635 finished with value: 0.1343543814542788 and parameters: {'kernel_type': 'Matern', 'length_scale': 65.64161704956507, 'noise_level': 0.2995903704296868, 'constant_value': 3.77287439543455, 'nu': 1.5}. Best is trial 1456 with value: 0.13435337537029549.
[I 2024-12-04 15:22:30,620] Trial 1629 finished with value: 0.1343543940117454 and parameters: {'kernel_type': 'Matern', 'length_scale': 340.95631597231596, 'noise_level': 0.006597790378149943, 'constant_value': 97798.79557899034, 'nu': 1.5}. Best is trial 1456 with value: 0.13435337537029549.
[I 2024-12-04 15:22:30,715] Trial 1636 finished with value: 0.1343543785554176 and parameters: {'kernel_type': 'Matern', 'length_scale': 27.146342235481676, 'noise_level': 0.0104236774027883, 'constant_value': 2334.2739444134018, 'nu': 1.5}. Best is trial 1456 with value: 0.13435337537029549.
[I 2024-12-04 15:22:32,765] Trial 1644 finished with value: 0.13435440066796656 and parameters: {'kernel_type': 'Matern', 'length_scale': 3.77855260348958, 'noise_level': 0.13472412574289092, 'constant_value': 76141.48818376398, 'nu': 1.5}. Best is trial 1456 with value: 0.13435337537029549.
[I 2024-12-04 15:22:33,710] Trial 1645 finished with value: 0.13435439965473522 and parameters: {'kernel_type': 'Matern', 'length_scale': 0.9967427728771073, 'noise_level': 0.004405963876482581, 'constant_value': 61790.08171319714, 'nu': 1.5}. Best is trial 1456 with value: 0.13435337537029549.
[I 2024-12-04 15:22:34,403] Trial 1637 finished with value: 0.13435440556038183 and parameters: {'kernel_type': 'Matern', 'length_scale': 3597.264462374748, 'noise_level': 0.015625278848678894, 'constant_value': 1747.237755269843, 'nu': 1.5}. Best is trial 1456 with value: 0.13435337537029549.
[I 2024-12-04 15:22:34,795] Trial 1638 finished with value: 0.1343543999664395 and parameters: {'kernel_type': 'Matern', 'length_scale': 9.742565546028954, 'noise_level': 9.547457515107908e-08, 'constant_value': 32.64837928392075, 'nu': 1.5}. Best is trial 1456 with value: 0.13435337537029549.
[I 2024-12-04 15:22:36,075] Trial 1646 finished with value: 0.1343546802396767 and parameters: {'kernel_type': 'Matern', 'length_scale': 187.66080914356013, 'noise_level': 0.031069237816510078, 'constant_value': 366.9540025199938, 'nu': 1.5}. Best is trial 1456 with value: 0.13435337537029549.
[I 2024-12-04 15:22:38,565] Trial 1647 finished with value: 0.13435442337029205 and parameters: {'kernel_type': 'Matern', 'length_scale': 7160.956532028604, 'noise_level': 0.7732405617732966, 'constant_value': 700.4979052363897, 'nu': 1.5}. Best is trial 1456 with value: 0.13435337537029549.
[I 2024-12-04 15:22:40,339] Trial 1640 finished with value: 0.134354612839075 and parameters: {'kernel_type': 'Matern', 'length_scale': 2.154109327698652, 'noise_level': 0.0007701258001726674, 'constant_value': 1129.6581043893307, 'nu': 1.5}. Best is trial 1456 with value: 0.13435337537029549.
[I 2024-12-04 15:22:43,298] Trial 1639 finished with value: 0.13435439704253888 and parameters: {'kernel_type': 'Matern', 'length_scale': 4.483609927040307, 'noise_level': 0.1635785651104057, 'constant_value': 1.1067178821909858e-06, 'nu': 1.5}. Best is trial 1456 with value: 0.13435337537029549.
[I 2024-12-04 15:22:43,659] Trial 1642 finished with value: 0.13435436516808155 and parameters: {'kernel_type': 'Matern', 'length_scale': 0.7201970625556698, 'noise_level': 0.927616802590263, 'constant_value': 14302.966259707797, 'nu': 1.5}. Best is trial 1456 with value: 0.13435337537029549.
[I 2024-12-04 15:22:43,785] Trial 1648 finished with value: 0.13435439994941367 and parameters: {'kernel_type': 'Matern', 'length_scale': 1.0644220889019402, 'noise_level': 0.0045837321007244506, 'constant_value': 80324.02460213249, 'nu': 1.5}. Best is trial 1456 with value: 0.13435337537029549.
[I 2024-12-04 15:22:44,119] Trial 1641 finished with value: 0.1343544487470269 and parameters: {'kernel_type': 'Matern', 'length_scale': 33.119219848113985, 'noise_level': 0.48555483967468505, 'constant_value': 29.3946323796404, 'nu': 1.5}. Best is trial 1456 with value: 0.13435337537029549.
[I 2024-12-04 15:22:46,045] Trial 1643 finished with value: 0.17251040400455986 and parameters: {'kernel_type': 'Matern', 'length_scale': 88.85742829472173, 'noise_level': 0.0006570102519754103, 'constant_value': 74478.66916178973, 'nu': 0.5}. Best is trial 1456 with value: 0.13435337537029549.
[I 2024-12-04 15:22:47,549] Trial 1657 finished with value: 0.13435439684913494 and parameters: {'kernel_type': 'Matern', 'length_scale': 228.3214644506746, 'noise_level': 0.01936850462304507, 'constant_value': 89845.43997435879, 'nu': 1.5}. Best is trial 1456 with value: 0.13435337537029549.
[I 2024-12-04 15:22:48,372] Trial 1655 finished with value: 0.17251040608206164 and parameters: {'kernel_type': 'Matern', 'length_scale': 7.193203166807297, 'noise_level': 0.005681462239177119, 'constant_value': 691.0381343762853, 'nu': 0.5}. Best is trial 1456 with value: 0.13435337537029549.
[I 2024-12-04 15:22:48,884] Trial 1660 finished with value: 1.2693635028570915 and parameters: {'kernel_type': 'Matern', 'length_scale': 0.04450777299003593, 'noise_level': 9.516809455314112e-07, 'constant_value': 0.8407555770038957, 'nu': 1.5}. Best is trial 1456 with value: 0.13435337537029549.
[I 2024-12-04 15:22:48,923] Trial 1651 finished with value: 0.14859826603012713 and parameters: {'kernel_type': 'Matern', 'length_scale': 35214.59785549693, 'noise_level': 0.1767098023711007, 'constant_value': 471.2718653674102, 'nu': 2.5}. Best is trial 1456 with value: 0.13435337537029549.
[I 2024-12-04 15:22:49,856] Trial 1650 finished with value: 0.1725104000556303 and parameters: {'kernel_type': 'Matern', 'length_scale': 11.183607398242692, 'noise_level': 0.0016679877790868277, 'constant_value': 416.86043547756026, 'nu': 0.5}. Best is trial 1456 with value: 0.13435337537029549.
[I 2024-12-04 15:22:50,756] Trial 1658 finished with value: 0.13435424291536463 and parameters: {'kernel_type': 'Matern', 'length_scale': 16.25254471963302, 'noise_level': 0.03949642193803639, 'constant_value': 424.9766264237857, 'nu': 1.5}. Best is trial 1456 with value: 0.13435337537029549.
[I 2024-12-04 15:22:50,757] Trial 1652 finished with value: 0.13435421867980746 and parameters: {'kernel_type': 'Matern', 'length_scale': 3.6981685075793758, 'noise_level': 0.0003781958402403774, 'constant_value': 2705.2892182861615, 'nu': 1.5}. Best is trial 1456 with value: 0.13435337537029549.
[I 2024-12-04 15:22:51,998] Trial 1654 finished with value: 1.2693635028550239 and parameters: {'kernel_type': 'RBF', 'length_scale': 0.07287215296770232, 'noise_level': 0.031769482789169926, 'constant_value': 1841.0870956893857, 'nu': 0.5}. Best is trial 1456 with value: 0.13435337537029549.
[I 2024-12-04 15:22:54,142] Trial 1653 finished with value: 0.13435452882841337 and parameters: {'kernel_type': 'Matern', 'length_scale': 1816.683466326347, 'noise_level': 0.7484433902669538, 'constant_value': 58114.376264524966, 'nu': 1.5}. Best is trial 1456 with value: 0.13435337537029549.
[I 2024-12-04 15:22:54,814] Trial 1649 finished with value: 0.13435435380281907 and parameters: {'kernel_type': 'Matern', 'length_scale': 0.29373187233980985, 'noise_level': 2.5347149181946138e-08, 'constant_value': 0.23513585460000835, 'nu': 1.5}. Best is trial 1456 with value: 0.13435337537029549.
[I 2024-12-04 15:22:55,363] Trial 1666 finished with value: 1.2693635028569283 and parameters: {'kernel_type': 'Matern', 'length_scale': 1.0472431597580775e-05, 'noise_level': 0.002946897707574984, 'constant_value': 1.472377503592078, 'nu': 1.5}. Best is trial 1456 with value: 0.13435337537029549.
[I 2024-12-04 15:22:55,371] Trial 1659 finished with value: 1.3007739235930103 and parameters: {'kernel_type': 'Matern', 'length_scale': 2.0482077319344966e-05, 'noise_level': 6.560804454342878e-07, 'constant_value': 94569.03590410088, 'nu': 0.5}. Best is trial 1456 with value: 0.13435337537029549.
[I 2024-12-04 15:22:55,403] Trial 1664 finished with value: 0.13435439804284902 and parameters: {'kernel_type': 'Matern', 'length_scale': 54.173932416807006, 'noise_level': 0.010285676635117928, 'constant_value': 938.325823926039, 'nu': 1.5}. Best is trial 1456 with value: 0.13435337537029549.
[I 2024-12-04 15:22:55,414] Trial 1661 finished with value: 0.13435455969803387 and parameters: {'kernel_type': 'Matern', 'length_scale': 21.097376746752737, 'noise_level': 0.00459098912610292, 'constant_value': 82351.12768126474, 'nu': 1.5}. Best is trial 1456 with value: 0.13435337537029549.
[I 2024-12-04 15:22:58,695] Trial 1656 finished with value: 0.1343543898692352 and parameters: {'kernel_type': 'Matern', 'length_scale': 8.520213213568145, 'noise_level': 0.0021576106267537495, 'constant_value': 1692.2445833707159, 'nu': 1.5}. Best is trial 1456 with value: 0.13435337537029549.
[I 2024-12-04 15:23:01,502] Trial 1663 finished with value: 0.13435443294106209 and parameters: {'kernel_type': 'Matern', 'length_scale': 66.5818274955318, 'noise_level': 0.9476246616089633, 'constant_value': 3896.6262950745645, 'nu': 1.5}. Best is trial 1456 with value: 0.13435337537029549.
[I 2024-12-04 15:23:01,529] Trial 1667 finished with value: 0.13435436337660522 and parameters: {'kernel_type': 'Matern', 'length_scale': 9.24889802604885, 'noise_level': 0.0003484756903543265, 'constant_value': 87863.02055401259, 'nu': 1.5}. Best is trial 1456 with value: 0.13435337537029549.
[I 2024-12-04 15:23:01,924] Trial 1669 finished with value: 1.2693623718902662 and parameters: {'kernel_type': 'Matern', 'length_scale': 0.12225579971309984, 'noise_level': 0.0016885528061078498, 'constant_value': 0.2650698096503859, 'nu': 2.5}. Best is trial 1456 with value: 0.13435337537029549.
[I 2024-12-04 15:23:02,252] Trial 1662 finished with value: 0.13435476270427182 and parameters: {'kernel_type': 'Matern', 'length_scale': 98.59722240329823, 'noise_level': 0.026984636273080887, 'constant_value': 7.811638488228235, 'nu': 1.5}. Best is trial 1456 with value: 0.13435337537029549.
[I 2024-12-04 15:23:03,019] Trial 1665 finished with value: 0.1343543735301695 and parameters: {'kernel_type': 'Matern', 'length_scale': 82.71810123861427, 'noise_level': 0.016746390958211486, 'constant_value': 792.1627464018093, 'nu': 1.5}. Best is trial 1456 with value: 0.13435337537029549.
[I 2024-12-04 15:23:04,022] Trial 1673 finished with value: 1.2693635028570467 and parameters: {'kernel_type': 'RBF', 'length_scale': 222.97881115067702, 'noise_level': 1.4084350162340627e-08, 'constant_value': 0.00010035666756857824, 'nu': 2.5}. Best is trial 1456 with value: 0.13435337537029549.
[I 2024-12-04 15:23:05,350] Trial 1677 finished with value: 0.13435457479978072 and parameters: {'kernel_type': 'Matern', 'length_scale': 2076.8355701317646, 'noise_level': 0.002937433485692807, 'constant_value': 94783.5974320262, 'nu': 1.5}. Best is trial 1456 with value: 0.13435337537029549.
[I 2024-12-04 15:23:05,886] Trial 1670 finished with value: 0.1343540365956285 and parameters: {'kernel_type': 'Matern', 'length_scale': 68.04749414444326, 'noise_level': 0.05481021506568102, 'constant_value': 1064.1426360995222, 'nu': 1.5}. Best is trial 1456 with value: 0.13435337537029549.
[I 2024-12-04 15:23:06,429] Trial 1672 finished with value: 0.13435439448244393 and parameters: {'kernel_type': 'Matern', 'length_scale': 15.749110321561936, 'noise_level': 0.040797857361056365, 'constant_value': 892.4815847122206, 'nu': 1.5}. Best is trial 1456 with value: 0.13435337537029549.
[I 2024-12-04 15:23:06,804] Trial 1671 finished with value: 1.3007745979422107 and parameters: {'kernel_type': 'Matern', 'length_scale': 38093.64091691435, 'noise_level': 0.18432701956199787, 'constant_value': 0.09775056891381992, 'nu': 2.5}. Best is trial 1456 with value: 0.13435337537029549.
[I 2024-12-04 15:23:07,168] Trial 1674 finished with value: 1.2693635028553782 and parameters: {'kernel_type': 'Matern', 'length_scale': 563.1171327466382, 'noise_level': 0.005427842049306668, 'constant_value': 1.8370510043239785, 'nu': 1.5}. Best is trial 1456 with value: 0.13435337537029549.
[I 2024-12-04 15:23:07,394] Trial 1678 finished with value: 0.13435436096354625 and parameters: {'kernel_type': 'Matern', 'length_scale': 38.48854484865935, 'noise_level': 0.009709842789101628, 'constant_value': 82397.48125633344, 'nu': 1.5}. Best is trial 1456 with value: 0.13435337537029549.
[I 2024-12-04 15:23:07,602] Trial 1668 finished with value: 0.13435443334551478 and parameters: {'kernel_type': 'Matern', 'length_scale': 3.2719042556442828, 'noise_level': 0.09275929462217623, 'constant_value': 74419.63098146413, 'nu': 1.5}. Best is trial 1456 with value: 0.13435337537029549.
[I 2024-12-04 15:23:07,788] Trial 1683 finished with value: 1.2693635028569976 and parameters: {'kernel_type': 'Matern', 'length_scale': 0.004971429689293656, 'noise_level': 5.3447378077849697e-08, 'constant_value': 0.006054442084897272, 'nu': 2.5}. Best is trial 1456 with value: 0.13435337537029549.
[I 2024-12-04 15:23:10,045] Trial 1676 finished with value: 0.13435432783743534 and parameters: {'kernel_type': 'Matern', 'length_scale': 411.68488636063057, 'noise_level': 0.0005589293400125783, 'constant_value': 1401.9526020212993, 'nu': 1.5}. Best is trial 1456 with value: 0.13435337537029549.
[I 2024-12-04 15:23:15,067] Trial 1684 finished with value: 0.15167298372471125 and parameters: {'kernel_type': 'RBF', 'length_scale': 3.959316552802635, 'noise_level': 0.023787494520719137, 'constant_value': 78175.48171931684, 'nu': 1.5}. Best is trial 1456 with value: 0.13435337537029549.
[I 2024-12-04 15:23:16,162] Trial 1690 finished with value: 0.1343544100499786 and parameters: {'kernel_type': 'Matern', 'length_scale': 5.459365453536789, 'noise_level': 0.7521035523261954, 'constant_value': 4.8528862427467265, 'nu': 1.5}. Best is trial 1456 with value: 0.13435337537029549.
[I 2024-12-04 15:23:16,824] Trial 1675 finished with value: 0.13435435199931575 and parameters: {'kernel_type': 'Matern', 'length_scale': 5982.827350644563, 'noise_level': 0.8489989609772117, 'constant_value': 224.7020182088556, 'nu': 1.5}. Best is trial 1456 with value: 0.13435337537029549.
[I 2024-12-04 15:23:18,252] Trial 1680 finished with value: 0.1343543832030475 and parameters: {'kernel_type': 'Matern', 'length_scale': 1734.2617324263665, 'noise_level': 0.7495578366933925, 'constant_value': 984.6492004908314, 'nu': 1.5}. Best is trial 1456 with value: 0.13435337537029549.
[I 2024-12-04 15:23:19,162] Trial 1685 finished with value: 0.13435445004812 and parameters: {'kernel_type': 'Matern', 'length_scale': 0.35176661508860424, 'noise_level': 6.369681686847986e-05, 'constant_value': 58196.27907666514, 'nu': 1.5}. Best is trial 1456 with value: 0.13435337537029549.
[I 2024-12-04 15:23:19,168] Trial 1681 finished with value: 0.13435440497764237 and parameters: {'kernel_type': 'Matern', 'length_scale': 21.975270603619805, 'noise_level': 0.06580248087132645, 'constant_value': 1041.388589012068, 'nu': 1.5}. Best is trial 1456 with value: 0.13435337537029549.
[I 2024-12-04 15:23:19,364] Trial 1689 finished with value: 0.13435390220094615 and parameters: {'kernel_type': 'Matern', 'length_scale': 5.064863582142836, 'noise_level': 0.020826323512478286, 'constant_value': 6034.277454342767, 'nu': 1.5}. Best is trial 1456 with value: 0.13435337537029549.
[I 2024-12-04 15:23:20,099] Trial 1679 finished with value: 0.1343543394686812 and parameters: {'kernel_type': 'Matern', 'length_scale': 987.8891891375686, 'noise_level': 0.0417030854293629, 'constant_value': 571.9316662358729, 'nu': 1.5}. Best is trial 1456 with value: 0.13435337537029549.
[I 2024-12-04 15:23:21,304] Trial 1682 finished with value: 0.13435436290673333 and parameters: {'kernel_type': 'Matern', 'length_scale': 1875.1611450992248, 'noise_level': 0.019941588023967786, 'constant_value': 45.517167629400575, 'nu': 1.5}. Best is trial 1456 with value: 0.13435337537029549.
[I 2024-12-04 15:23:22,737] Trial 1692 finished with value: 0.13435447900472697 and parameters: {'kernel_type': 'Matern', 'length_scale': 52.28614385288931, 'noise_level': 0.6864727570134503, 'constant_value': 368.24622388052234, 'nu': 1.5}. Best is trial 1456 with value: 0.13435337537029549.
[I 2024-12-04 15:23:23,655] Trial 1696 finished with value: 0.13435441533479328 and parameters: {'kernel_type': 'Matern', 'length_scale': 103.13182714807934, 'noise_level': 0.015539424144175704, 'constant_value': 664.4897464610026, 'nu': 1.5}. Best is trial 1456 with value: 0.13435337537029549.
[I 2024-12-04 15:23:25,898] Trial 1693 finished with value: 0.14859826821655553 and parameters: {'kernel_type': 'Matern', 'length_scale': 307.97113598908993, 'noise_level': 0.18912142261798612, 'constant_value': 41.935733074439916, 'nu': 2.5}. Best is trial 1456 with value: 0.13435337537029549.
[I 2024-12-04 15:23:27,703] Trial 1702 finished with value: 1.3007739235927263 and parameters: {'kernel_type': 'Matern', 'length_scale': 0.0050710096767757834, 'noise_level': 2.431040218183666e-07, 'constant_value': 144.90719735713418, 'nu': 1.5}. Best is trial 1456 with value: 0.13435337537029549.
[I 2024-12-04 15:23:27,706] Trial 1694 finished with value: 0.1343543923017444 and parameters: {'kernel_type': 'Matern', 'length_scale': 22.497042956008336, 'noise_level': 0.04797354854845789, 'constant_value': 50.8694563960084, 'nu': 1.5}. Best is trial 1456 with value: 0.13435337537029549.
[I 2024-12-04 15:23:28,287] Trial 1698 finished with value: 0.13435443318106188 and parameters: {'kernel_type': 'Matern', 'length_scale': 1373.96772869203, 'noise_level': 0.8455416915429931, 'constant_value': 3875.5028412535194, 'nu': 1.5}. Best is trial 1456 with value: 0.13435337537029549.
[I 2024-12-04 15:23:30,950] Trial 1691 finished with value: 0.13435424086665781 and parameters: {'kernel_type': 'Matern', 'length_scale': 12.399719003139333, 'noise_level': 0.5780212996816264, 'constant_value': 22.590358838844693, 'nu': 1.5}. Best is trial 1456 with value: 0.13435337537029549.
[I 2024-12-04 15:23:33,510] Trial 1700 finished with value: 0.13435440113094158 and parameters: {'kernel_type': 'Matern', 'length_scale': 145.47880101221327, 'noise_level': 0.02946529811165298, 'constant_value': 7.109663784225028, 'nu': 1.5}. Best is trial 1456 with value: 0.13435337537029549.
[I 2024-12-04 15:23:35,353] Trial 1687 finished with value: 0.1516729732793762 and parameters: {'kernel_type': 'RBF', 'length_scale': 0.21373734361780303, 'noise_level': 1.1547367517689335e-06, 'constant_value': 5.275231930511955, 'nu': 1.5}. Best is trial 1456 with value: 0.13435337537029549.
[I 2024-12-04 15:23:36,946] Trial 1688 finished with value: 0.14859822250386678 and parameters: {'kernel_type': 'Matern', 'length_scale': 2399.5906027773854, 'noise_level': 0.8191360625792398, 'constant_value': 96765.56958335523, 'nu': 2.5}. Best is trial 1456 with value: 0.13435337537029549.
[I 2024-12-04 15:23:37,805] Trial 1699 finished with value: 0.13435439057936258 and parameters: {'kernel_type': 'Matern', 'length_scale': 44.46013056101577, 'noise_level': 0.010985489213972842, 'constant_value': 25.034828685334947, 'nu': 1.5}. Best is trial 1456 with value: 0.13435337537029549.
[I 2024-12-04 15:23:38,077] Trial 1701 finished with value: 0.13435440056935055 and parameters: {'kernel_type': 'Matern', 'length_scale': 19.812264851412788, 'noise_level': 0.07990659865770244, 'constant_value': 583.4059627212555, 'nu': 1.5}. Best is trial 1456 with value: 0.13435337537029549.
[I 2024-12-04 15:23:40,101] Trial 1705 finished with value: 0.1343543882915115 and parameters: {'kernel_type': 'Matern', 'length_scale': 7122.418340337566, 'noise_level': 0.03240703117438989, 'constant_value': 2133.1908418606563, 'nu': 1.5}. Best is trial 1456 with value: 0.13435337537029549.
[I 2024-12-04 15:23:40,356] Trial 1686 finished with value: 0.14859822914149937 and parameters: {'kernel_type': 'Matern', 'length_scale': 12.287070270769684, 'noise_level': 0.013084990701283893, 'constant_value': 614.9045369871542, 'nu': 2.5}. Best is trial 1456 with value: 0.13435337537029549.
[I 2024-12-04 15:23:40,814] Trial 1697 finished with value: 0.13435440338530108 and parameters: {'kernel_type': 'Matern', 'length_scale': 301.4121594832207, 'noise_level': 0.04312329461659012, 'constant_value': 2242.9311405353524, 'nu': 1.5}. Best is trial 1456 with value: 0.13435337537029549.
[I 2024-12-04 15:23:41,704] Trial 1695 finished with value: 1.2693635028569534 and parameters: {'kernel_type': 'Matern', 'length_scale': 61441.14076144226, 'noise_level': 0.0032289630642183416, 'constant_value': 5.878514641487247, 'nu': 1.5}. Best is trial 1456 with value: 0.13435337537029549.
[I 2024-12-04 15:23:42,656] Trial 1704 finished with value: 0.13435445821673533 and parameters: {'kernel_type': 'Matern', 'length_scale': 41.45207466848696, 'noise_level': 0.9829247959169332, 'constant_value': 16.54773697959741, 'nu': 1.5}. Best is trial 1456 with value: 0.13435337537029549.
[I 2024-12-04 15:23:43,332] Trial 1706 finished with value: 0.13435440294701767 and parameters: {'kernel_type': 'Matern', 'length_scale': 16.339366620009944, 'noise_level': 0.9683011583661904, 'constant_value': 557.9884092587463, 'nu': 1.5}. Best is trial 1456 with value: 0.13435337537029549.
[I 2024-12-04 15:23:44,480] Trial 1711 finished with value: 0.1343543675262884 and parameters: {'kernel_type': 'Matern', 'length_scale': 172.22704616546432, 'noise_level': 0.06270119394813425, 'constant_value': 20.741978932638176, 'nu': 1.5}. Best is trial 1456 with value: 0.13435337537029549.
