[I 2024-12-04 12:02:54,207] Trial 499 finished with value: 0.5429497556535523 and parameters: {'n_estimators': 909, 'max_depth': 13, 'min_samples_split': 5, 'min_samples_leaf': 2, 'max_features': None, 'bootstrap': True, 'criterion': 'squared_error'}. Best is trial 306 with value: 0.5054021215392881.
[I 2024-12-04 12:02:54,443] Trial 509 finished with value: 0.5612760895601743 and parameters: {'n_estimators': 342, 'max_depth': 40, 'min_samples_split': 24, 'min_samples_leaf': 2, 'max_features': None, 'bootstrap': True, 'criterion': 'squared_error'}. Best is trial 306 with value: 0.5054021215392881.
[I 2024-12-04 12:02:54,713] Trial 497 finished with value: 0.5451315802900911 and parameters: {'n_estimators': 926, 'max_depth': 14, 'min_samples_split': 6, 'min_samples_leaf': 2, 'max_features': None, 'bootstrap': True, 'criterion': 'squared_error'}. Best is trial 306 with value: 0.5054021215392881.
[I 2024-12-04 12:02:54,714] Trial 517 finished with value: 0.9547195110329981 and parameters: {'n_estimators': 292, 'max_depth': 17, 'min_samples_split': 16, 'min_samples_leaf': 1, 'max_features': 'log2', 'bootstrap': False, 'criterion': 'squared_error'}. Best is trial 306 with value: 0.5054021215392881.
[I 2024-12-04 12:02:54,779] Trial 511 finished with value: 0.5560342874106287 and parameters: {'n_estimators': 102, 'max_depth': 14, 'min_samples_split': 5, 'min_samples_leaf': 2, 'max_features': None, 'bootstrap': True, 'criterion': 'absolute_error'}. Best is trial 306 with value: 0.5054021215392881.
[I 2024-12-04 12:02:54,951] Trial 507 finished with value: 0.5162896839648758 and parameters: {'n_estimators': 133, 'max_depth': 28, 'min_samples_split': 4, 'min_samples_leaf': 1, 'max_features': None, 'bootstrap': True, 'criterion': 'absolute_error'}. Best is trial 306 with value: 0.5054021215392881.
[I 2024-12-04 12:02:54,962] Trial 516 finished with value: 1.2568034900226297 and parameters: {'n_estimators': 282, 'max_depth': 38, 'min_samples_split': 2, 'min_samples_leaf': 13, 'max_features': 'log2', 'bootstrap': True, 'criterion': 'squared_error'}. Best is trial 306 with value: 0.5054021215392881.
[I 2024-12-04 12:02:55,991] Trial 502 finished with value: 0.5125320765565738 and parameters: {'n_estimators': 989, 'max_depth': 18, 'min_samples_split': 6, 'min_samples_leaf': 1, 'max_features': None, 'bootstrap': True, 'criterion': 'squared_error'}. Best is trial 306 with value: 0.5054021215392881.
[I 2024-12-04 12:02:56,321] Trial 518 finished with value: 1.2033386249653242 and parameters: {'n_estimators': 439, 'max_depth': 46, 'min_samples_split': 46, 'min_samples_leaf': 8, 'max_features': 'sqrt', 'bootstrap': True, 'criterion': 'squared_error'}. Best is trial 306 with value: 0.5054021215392881.
[I 2024-12-04 12:02:57,389] Trial 512 finished with value: 0.5154368258690057 and parameters: {'n_estimators': 108, 'max_depth': 11, 'min_samples_split': 6, 'min_samples_leaf': 1, 'max_features': None, 'bootstrap': True, 'criterion': 'absolute_error'}. Best is trial 306 with value: 0.5054021215392881.
[I 2024-12-04 12:02:59,883] Trial 506 finished with value: 0.5257213650749448 and parameters: {'n_estimators': 202, 'max_depth': 36, 'min_samples_split': 3, 'min_samples_leaf': 1, 'max_features': None, 'bootstrap': True, 'criterion': 'absolute_error'}. Best is trial 306 with value: 0.5054021215392881.
[I 2024-12-04 12:02:59,887] Trial 510 finished with value: 0.5118578053801783 and parameters: {'n_estimators': 126, 'max_depth': 14, 'min_samples_split': 6, 'min_samples_leaf': 1, 'max_features': None, 'bootstrap': True, 'criterion': 'absolute_error'}. Best is trial 306 with value: 0.5054021215392881.
[I 2024-12-04 12:03:00,532] Trial 521 finished with value: 1.3596823512077525 and parameters: {'n_estimators': 642, 'max_depth': 27, 'min_samples_split': 16, 'min_samples_leaf': 10, 'max_features': 'log2', 'bootstrap': True, 'criterion': 'absolute_error'}. Best is trial 306 with value: 0.5054021215392881.
[I 2024-12-04 12:03:01,335] Trial 522 finished with value: 0.5541474692827183 and parameters: {'n_estimators': 123, 'max_depth': 19, 'min_samples_split': 3, 'min_samples_leaf': 2, 'max_features': None, 'bootstrap': True, 'criterion': 'absolute_error'}. Best is trial 306 with value: 0.5054021215392881.
[I 2024-12-04 12:03:02,311] Trial 519 finished with value: 0.517878927316995 and parameters: {'n_estimators': 118, 'max_depth': 18, 'min_samples_split': 3, 'min_samples_leaf': 1, 'max_features': None, 'bootstrap': True, 'criterion': 'absolute_error'}. Best is trial 306 with value: 0.5054021215392881.
[I 2024-12-04 12:03:03,494] Trial 524 finished with value: 1.1182262600502781 and parameters: {'n_estimators': 870, 'max_depth': 29, 'min_samples_split': 8, 'min_samples_leaf': 7, 'max_features': 'sqrt', 'bootstrap': False, 'criterion': 'squared_error'}. Best is trial 306 with value: 0.5054021215392881.
[I 2024-12-04 12:03:03,756] Trial 523 finished with value: 0.5828725643276513 and parameters: {'n_estimators': 188, 'max_depth': 30, 'min_samples_split': 8, 'min_samples_leaf': 1, 'max_features': None, 'bootstrap': False, 'criterion': 'squared_error'}. Best is trial 306 with value: 0.5054021215392881.
[I 2024-12-04 12:03:04,778] Trial 527 finished with value: 1.0193693255309306 and parameters: {'n_estimators': 752, 'max_depth': 14, 'min_samples_split': 6, 'min_samples_leaf': 1, 'max_features': 'log2', 'bootstrap': True, 'criterion': 'squared_error'}. Best is trial 306 with value: 0.5054021215392881.
[I 2024-12-04 12:03:04,875] Trial 514 finished with value: 0.6250791390728148 and parameters: {'n_estimators': 261, 'max_depth': 35, 'min_samples_split': 5, 'min_samples_leaf': 1, 'max_features': 'sqrt', 'bootstrap': False, 'criterion': 'absolute_error'}. Best is trial 306 with value: 0.5054021215392881.
[I 2024-12-04 12:03:05,415] Trial 520 finished with value: 0.5109966194392651 and parameters: {'n_estimators': 121, 'max_depth': 23, 'min_samples_split': 6, 'min_samples_leaf': 1, 'max_features': None, 'bootstrap': True, 'criterion': 'absolute_error'}. Best is trial 306 with value: 0.5054021215392881.
[I 2024-12-04 12:03:07,509] Trial 532 finished with value: 1.3364264181811656 and parameters: {'n_estimators': 264, 'max_depth': 10, 'min_samples_split': 47, 'min_samples_leaf': 3, 'max_features': 'log2', 'bootstrap': True, 'criterion': 'absolute_error'}. Best is trial 306 with value: 0.5054021215392881.
[I 2024-12-04 12:03:09,044] Trial 508 finished with value: 0.5166446036311061 and parameters: {'n_estimators': 323, 'max_depth': 19, 'min_samples_split': 2, 'min_samples_leaf': 1, 'max_features': None, 'bootstrap': True, 'criterion': 'absolute_error'}. Best is trial 306 with value: 0.5054021215392881.
[I 2024-12-04 12:03:10,987] Trial 529 finished with value: 0.8629208270809992 and parameters: {'n_estimators': 400, 'max_depth': 42, 'min_samples_split': 26, 'min_samples_leaf': 2, 'max_features': 'sqrt', 'bootstrap': False, 'criterion': 'absolute_error'}. Best is trial 306 with value: 0.5054021215392881.
[I 2024-12-04 12:03:11,382] Trial 536 finished with value: 0.5086237435041229 and parameters: {'n_estimators': 100, 'max_depth': 20, 'min_samples_split': 5, 'min_samples_leaf': 1, 'max_features': None, 'bootstrap': True, 'criterion': 'absolute_error'}. Best is trial 306 with value: 0.5054021215392881.
[I 2024-12-04 12:03:11,610] Trial 515 finished with value: 0.5236697476247253 and parameters: {'n_estimators': 274, 'max_depth': 20, 'min_samples_split': 8, 'min_samples_leaf': 1, 'max_features': None, 'bootstrap': True, 'criterion': 'absolute_error'}. Best is trial 306 with value: 0.5054021215392881.
[I 2024-12-04 12:03:11,881] Trial 526 finished with value: 0.5129967352083592 and parameters: {'n_estimators': 973, 'max_depth': 18, 'min_samples_split': 4, 'min_samples_leaf': 1, 'max_features': None, 'bootstrap': True, 'criterion': 'squared_error'}. Best is trial 306 with value: 0.5054021215392881.
[I 2024-12-04 12:03:12,195] Trial 538 finished with value: 0.510902153937382 and parameters: {'n_estimators': 111, 'max_depth': 13, 'min_samples_split': 4, 'min_samples_leaf': 1, 'max_features': None, 'bootstrap': True, 'criterion': 'absolute_error'}. Best is trial 306 with value: 0.5054021215392881.
[I 2024-12-04 12:03:13,175] Trial 528 finished with value: 0.512017142012315 and parameters: {'n_estimators': 103, 'max_depth': 12, 'min_samples_split': 4, 'min_samples_leaf': 1, 'max_features': None, 'bootstrap': True, 'criterion': 'absolute_error'}. Best is trial 306 with value: 0.5054021215392881.
[I 2024-12-04 12:03:13,227] Trial 537 finished with value: 0.5185265739661963 and parameters: {'n_estimators': 110, 'max_depth': 20, 'min_samples_split': 3, 'min_samples_leaf': 1, 'max_features': None, 'bootstrap': True, 'criterion': 'absolute_error'}. Best is trial 306 with value: 0.5054021215392881.
[I 2024-12-04 12:03:14,664] Trial 541 finished with value: 0.5242101464095854 and parameters: {'n_estimators': 150, 'max_depth': 22, 'min_samples_split': 4, 'min_samples_leaf': 1, 'max_features': None, 'bootstrap': True, 'criterion': 'squared_error'}. Best is trial 306 with value: 0.5054021215392881.
[I 2024-12-04 12:03:14,687] Trial 542 finished with value: 0.8686795764870004 and parameters: {'n_estimators': 305, 'max_depth': 6, 'min_samples_split': 3, 'min_samples_leaf': 11, 'max_features': None, 'bootstrap': True, 'criterion': 'absolute_error'}. Best is trial 306 with value: 0.5054021215392881.
[I 2024-12-04 12:03:15,037] Trial 535 finished with value: 0.5516524392429148 and parameters: {'n_estimators': 754, 'max_depth': 44, 'min_samples_split': 21, 'min_samples_leaf': 2, 'max_features': None, 'bootstrap': True, 'criterion': 'squared_error'}. Best is trial 306 with value: 0.5054021215392881.
[I 2024-12-04 12:03:15,873] Trial 543 finished with value: 0.5198644565072508 and parameters: {'n_estimators': 116, 'max_depth': 31, 'min_samples_split': 7, 'min_samples_leaf': 1, 'max_features': None, 'bootstrap': True, 'criterion': 'absolute_error'}. Best is trial 306 with value: 0.5054021215392881.
[I 2024-12-04 12:03:16,032] Trial 546 finished with value: 0.5287162686072141 and parameters: {'n_estimators': 110, 'max_depth': 26, 'min_samples_split': 3, 'min_samples_leaf': 1, 'max_features': None, 'bootstrap': True, 'criterion': 'squared_error'}. Best is trial 306 with value: 0.5054021215392881.
[I 2024-12-04 12:03:17,249] Trial 547 finished with value: 1.2314497543357172 and parameters: {'n_estimators': 726, 'max_depth': 32, 'min_samples_split': 9, 'min_samples_leaf': 10, 'max_features': 'log2', 'bootstrap': False, 'criterion': 'squared_error'}. Best is trial 306 with value: 0.5054021215392881.
[I 2024-12-04 12:03:17,690] Trial 525 finished with value: 0.5192343686096235 and parameters: {'n_estimators': 258, 'max_depth': 19, 'min_samples_split': 3, 'min_samples_leaf': 1, 'max_features': None, 'bootstrap': True, 'criterion': 'absolute_error'}. Best is trial 306 with value: 0.5054021215392881.
[I 2024-12-04 12:03:18,445] Trial 540 finished with value: 0.6528672712778029 and parameters: {'n_estimators': 504, 'max_depth': 46, 'min_samples_split': 2, 'min_samples_leaf': 5, 'max_features': None, 'bootstrap': False, 'criterion': 'squared_error'}. Best is trial 306 with value: 0.5054021215392881.
[I 2024-12-04 12:03:18,452] Trial 549 finished with value: 1.1795965553995824 and parameters: {'n_estimators': 722, 'max_depth': 33, 'min_samples_split': 2, 'min_samples_leaf': 3, 'max_features': 'log2', 'bootstrap': False, 'criterion': 'squared_error'}. Best is trial 306 with value: 0.5054021215392881.
[I 2024-12-04 12:03:20,506] Trial 533 finished with value: 0.5210442362507887 and parameters: {'n_estimators': 106, 'max_depth': 24, 'min_samples_split': 7, 'min_samples_leaf': 1, 'max_features': None, 'bootstrap': True, 'criterion': 'absolute_error'}. Best is trial 306 with value: 0.5054021215392881.
[I 2024-12-04 12:03:21,537] Trial 551 finished with value: 1.2144321078509153 and parameters: {'n_estimators': 979, 'max_depth': 44, 'min_samples_split': 3, 'min_samples_leaf': 3, 'max_features': 'log2', 'bootstrap': True, 'criterion': 'squared_error'}. Best is trial 306 with value: 0.5054021215392881.
[I 2024-12-04 12:03:21,592] Trial 552 finished with value: 0.7233647546735668 and parameters: {'n_estimators': 199, 'max_depth': 28, 'min_samples_split': 8, 'min_samples_leaf': 1, 'max_features': 'sqrt', 'bootstrap': True, 'criterion': 'squared_error'}. Best is trial 306 with value: 0.5054021215392881.
[I 2024-12-04 12:03:24,754] Trial 534 finished with value: 0.5259636140301902 and parameters: {'n_estimators': 237, 'max_depth': 10, 'min_samples_split': 3, 'min_samples_leaf': 1, 'max_features': None, 'bootstrap': True, 'criterion': 'absolute_error'}. Best is trial 306 with value: 0.5054021215392881.
[I 2024-12-04 12:03:25,313] Trial 548 finished with value: 0.5069080851405027 and parameters: {'n_estimators': 132, 'max_depth': 18, 'min_samples_split': 4, 'min_samples_leaf': 1, 'max_features': None, 'bootstrap': True, 'criterion': 'absolute_error'}. Best is trial 306 with value: 0.5054021215392881.
[I 2024-12-04 12:03:27,865] Trial 544 finished with value: 0.5185137662960091 and parameters: {'n_estimators': 233, 'max_depth': 20, 'min_samples_split': 6, 'min_samples_leaf': 1, 'max_features': None, 'bootstrap': True, 'criterion': 'absolute_error'}. Best is trial 306 with value: 0.5054021215392881.
[I 2024-12-04 12:03:27,872] Trial 530 finished with value: 0.5152157102433135 and parameters: {'n_estimators': 290, 'max_depth': 22, 'min_samples_split': 5, 'min_samples_leaf': 1, 'max_features': None, 'bootstrap': True, 'criterion': 'absolute_error'}. Best is trial 306 with value: 0.5054021215392881.
[I 2024-12-04 12:03:27,873] Trial 553 finished with value: 0.5565309832532451 and parameters: {'n_estimators': 145, 'max_depth': 23, 'min_samples_split': 5, 'min_samples_leaf': 2, 'max_features': None, 'bootstrap': True, 'criterion': 'absolute_error'}. Best is trial 306 with value: 0.5054021215392881.
[I 2024-12-04 12:03:27,876] Trial 556 finished with value: 0.5101201911415658 and parameters: {'n_estimators': 107, 'max_depth': 21, 'min_samples_split': 5, 'min_samples_leaf': 1, 'max_features': None, 'bootstrap': True, 'criterion': 'absolute_error'}. Best is trial 306 with value: 0.5054021215392881.
[I 2024-12-04 12:03:27,997] Trial 531 finished with value: 0.6396351260025698 and parameters: {'n_estimators': 978, 'max_depth': 38, 'min_samples_split': 6, 'min_samples_leaf': 6, 'max_features': None, 'bootstrap': True, 'criterion': 'absolute_error'}. Best is trial 306 with value: 0.5054021215392881.
[I 2024-12-04 12:03:28,089] Trial 558 finished with value: 0.5191687930934796 and parameters: {'n_estimators': 105, 'max_depth': 27, 'min_samples_split': 3, 'min_samples_leaf': 1, 'max_features': None, 'bootstrap': True, 'criterion': 'absolute_error'}. Best is trial 306 with value: 0.5054021215392881.
[I 2024-12-04 12:03:28,729] Trial 539 finished with value: 0.7207357601211275 and parameters: {'n_estimators': 627, 'max_depth': 36, 'min_samples_split': 19, 'min_samples_leaf': 1, 'max_features': 'sqrt', 'bootstrap': True, 'criterion': 'absolute_error'}. Best is trial 306 with value: 0.5054021215392881.
[I 2024-12-04 12:03:28,729] Trial 554 finished with value: 0.5253081697969448 and parameters: {'n_estimators': 104, 'max_depth': 20, 'min_samples_split': 10, 'min_samples_leaf': 1, 'max_features': None, 'bootstrap': True, 'criterion': 'absolute_error'}. Best is trial 306 with value: 0.5054021215392881.
[I 2024-12-04 12:03:30,021] Trial 550 finished with value: 0.5172280800635971 and parameters: {'n_estimators': 133, 'max_depth': 27, 'min_samples_split': 5, 'min_samples_leaf': 1, 'max_features': None, 'bootstrap': True, 'criterion': 'absolute_error'}. Best is trial 306 with value: 0.5054021215392881.
[I 2024-12-04 12:03:30,263] Trial 557 finished with value: 1.2900470964701343 and parameters: {'n_estimators': 551, 'max_depth': 13, 'min_samples_split': 30, 'min_samples_leaf': 6, 'max_features': 'sqrt', 'bootstrap': True, 'criterion': 'absolute_error'}. Best is trial 306 with value: 0.5054021215392881.
[I 2024-12-04 12:03:30,289] Trial 561 finished with value: 1.3443950411337866 and parameters: {'n_estimators': 177, 'max_depth': 36, 'min_samples_split': 35, 'min_samples_leaf': 5, 'max_features': 'log2', 'bootstrap': False, 'criterion': 'absolute_error'}. Best is trial 306 with value: 0.5054021215392881.
[I 2024-12-04 12:03:31,448] Trial 562 finished with value: 0.522359977775837 and parameters: {'n_estimators': 105, 'max_depth': 25, 'min_samples_split': 8, 'min_samples_leaf': 1, 'max_features': None, 'bootstrap': True, 'criterion': 'absolute_error'}. Best is trial 306 with value: 0.5054021215392881.
[I 2024-12-04 12:03:31,464] Trial 563 finished with value: 1.0106925828454938 and parameters: {'n_estimators': 135, 'max_depth': 20, 'min_samples_split': 3, 'min_samples_leaf': 1, 'max_features': 'log2', 'bootstrap': True, 'criterion': 'absolute_error'}. Best is trial 306 with value: 0.5054021215392881.
[I 2024-12-04 12:03:31,465] Trial 564 finished with value: 0.5146437004907923 and parameters: {'n_estimators': 105, 'max_depth': 22, 'min_samples_split': 4, 'min_samples_leaf': 1, 'max_features': None, 'bootstrap': True, 'criterion': 'absolute_error'}. Best is trial 306 with value: 0.5054021215392881.
[I 2024-12-04 12:03:31,816] Trial 555 finished with value: 0.9925394137584166 and parameters: {'n_estimators': 983, 'max_depth': 15, 'min_samples_split': 2, 'min_samples_leaf': 1, 'max_features': 'log2', 'bootstrap': True, 'criterion': 'squared_error'}. Best is trial 306 with value: 0.5054021215392881.
[I 2024-12-04 12:03:34,654] Trial 545 finished with value: 0.5109155611013655 and parameters: {'n_estimators': 332, 'max_depth': 18, 'min_samples_split': 4, 'min_samples_leaf': 1, 'max_features': None, 'bootstrap': True, 'criterion': 'absolute_error'}. Best is trial 306 with value: 0.5054021215392881.
[I 2024-12-04 12:03:35,381] Trial 565 finished with value: 0.6071018465728266 and parameters: {'n_estimators': 867, 'max_depth': 13, 'min_samples_split': 2, 'min_samples_leaf': 3, 'max_features': None, 'bootstrap': False, 'criterion': 'squared_error'}. Best is trial 306 with value: 0.5054021215392881.
[I 2024-12-04 12:03:36,628] Trial 569 finished with value: 0.5387957409786943 and parameters: {'n_estimators': 140, 'max_depth': 7, 'min_samples_split': 5, 'min_samples_leaf': 1, 'max_features': None, 'bootstrap': True, 'criterion': 'squared_error'}. Best is trial 306 with value: 0.5054021215392881.
[I 2024-12-04 12:03:37,221] Trial 578 finished with value: 1.3150321820915536 and parameters: {'n_estimators': 101, 'max_depth': 6, 'min_samples_split': 3, 'min_samples_leaf': 2, 'max_features': 'log2', 'bootstrap': True, 'criterion': 'absolute_error'}. Best is trial 306 with value: 0.5054021215392881.
[I 2024-12-04 12:03:38,176] Trial 573 finished with value: 0.5546008712701967 and parameters: {'n_estimators': 105, 'max_depth': 21, 'min_samples_split': 2, 'min_samples_leaf': 2, 'max_features': None, 'bootstrap': True, 'criterion': 'absolute_error'}. Best is trial 306 with value: 0.5054021215392881.
[I 2024-12-04 12:03:40,025] Trial 567 finished with value: 0.5213397365504308 and parameters: {'n_estimators': 114, 'max_depth': 18, 'min_samples_split': 9, 'min_samples_leaf': 1, 'max_features': None, 'bootstrap': True, 'criterion': 'absolute_error'}. Best is trial 306 with value: 0.5054021215392881.
[I 2024-12-04 12:03:40,541] Trial 572 finished with value: 0.5186481451282446 and parameters: {'n_estimators': 104, 'max_depth': 19, 'min_samples_split': 3, 'min_samples_leaf': 1, 'max_features': None, 'bootstrap': True, 'criterion': 'absolute_error'}. Best is trial 306 with value: 0.5054021215392881.
[I 2024-12-04 12:03:42,165] Trial 579 finished with value: 1.224643669421476 and parameters: {'n_estimators': 794, 'max_depth': 14, 'min_samples_split': 25, 'min_samples_leaf': 8, 'max_features': 'log2', 'bootstrap': False, 'criterion': 'squared_error'}. Best is trial 306 with value: 0.5054021215392881.
[I 2024-12-04 12:03:42,916] Trial 559 finished with value: 0.5168436096720793 and parameters: {'n_estimators': 245, 'max_depth': 15, 'min_samples_split': 5, 'min_samples_leaf': 1, 'max_features': None, 'bootstrap': True, 'criterion': 'absolute_error'}. Best is trial 306 with value: 0.5054021215392881.
[I 2024-12-04 12:03:42,941] Trial 560 finished with value: 0.5309817623756258 and parameters: {'n_estimators': 126, 'max_depth': 26, 'min_samples_split': 10, 'min_samples_leaf': 1, 'max_features': None, 'bootstrap': False, 'criterion': 'absolute_error'}. Best is trial 306 with value: 0.5054021215392881.
[I 2024-12-04 12:03:46,162] Trial 576 finished with value: 0.5588784625055918 and parameters: {'n_estimators': 178, 'max_depth': 17, 'min_samples_split': 6, 'min_samples_leaf': 2, 'max_features': None, 'bootstrap': True, 'criterion': 'absolute_error'}. Best is trial 306 with value: 0.5054021215392881.
[I 2024-12-04 12:03:48,691] Trial 568 finished with value: 0.5167059004958271 and parameters: {'n_estimators': 258, 'max_depth': 16, 'min_samples_split': 5, 'min_samples_leaf': 1, 'max_features': None, 'bootstrap': True, 'criterion': 'absolute_error'}. Best is trial 306 with value: 0.5054021215392881.
[I 2024-12-04 12:03:50,117] Trial 566 finished with value: 0.5555048429126208 and parameters: {'n_estimators': 213, 'max_depth': 14, 'min_samples_split': 7, 'min_samples_leaf': 2, 'max_features': None, 'bootstrap': True, 'criterion': 'absolute_error'}. Best is trial 306 with value: 0.5054021215392881.
[I 2024-12-04 12:03:50,449] Trial 574 finished with value: 0.5574804592097446 and parameters: {'n_estimators': 272, 'max_depth': 21, 'min_samples_split': 3, 'min_samples_leaf': 2, 'max_features': None, 'bootstrap': True, 'criterion': 'absolute_error'}. Best is trial 306 with value: 0.5054021215392881.
