[I 2024-12-04 12:44:07,826] Trial 801 finished with value: 0.2240648218273184 and parameters: {'n_estimators': 1127, 'learning_rate': 0.05889764578291244, 'max_depth': 10, 'min_samples_split': 17, 'min_samples_leaf': 1, 'subsample': 0.601310827486433, 'max_features': 'sqrt'}. Best is trial 784 with value: 0.199214954455861.
[I 2024-12-04 12:44:12,204] Trial 795 finished with value: 0.22698769709257163 and parameters: {'n_estimators': 1389, 'learning_rate': 0.0882221495111503, 'max_depth': 12, 'min_samples_split': 18, 'min_samples_leaf': 1, 'subsample': 0.6761812890014472, 'max_features': 'sqrt'}. Best is trial 784 with value: 0.199214954455861.
[I 2024-12-04 12:44:12,206] Trial 793 finished with value: 0.2574353554767314 and parameters: {'n_estimators': 1479, 'learning_rate': 0.09521828343128452, 'max_depth': 10, 'min_samples_split': 17, 'min_samples_leaf': 4, 'subsample': 0.7048441642560233, 'max_features': 'sqrt'}. Best is trial 784 with value: 0.199214954455861.
[I 2024-12-04 12:44:15,757] Trial 807 finished with value: 0.259481504333493 and parameters: {'n_estimators': 859, 'learning_rate': 0.06004785231663111, 'max_depth': 12, 'min_samples_split': 20, 'min_samples_leaf': 3, 'subsample': 0.6234521649401226, 'max_features': 'sqrt'}. Best is trial 784 with value: 0.199214954455861.
[I 2024-12-04 12:44:17,207] Trial 813 finished with value: 0.30536373490993274 and parameters: {'n_estimators': 650, 'learning_rate': 0.03041180150264182, 'max_depth': 5, 'min_samples_split': 12, 'min_samples_leaf': 1, 'subsample': 0.6909642218242747, 'max_features': None}. Best is trial 784 with value: 0.199214954455861.
[I 2024-12-04 12:44:17,214] Trial 823 finished with value: 0.39240465688360365 and parameters: {'n_estimators': 363, 'learning_rate': 0.036910957257487435, 'max_depth': 6, 'min_samples_split': 7, 'min_samples_leaf': 5, 'subsample': 0.7504056718769612, 'max_features': 'sqrt'}. Best is trial 784 with value: 0.199214954455861.
[I 2024-12-04 12:44:20,000] Trial 797 finished with value: 0.2624765108620341 and parameters: {'n_estimators': 1279, 'learning_rate': 0.06971345525223564, 'max_depth': 11, 'min_samples_split': 12, 'min_samples_leaf': 1, 'subsample': 0.6779654664134078, 'max_features': None}. Best is trial 784 with value: 0.199214954455861.
[I 2024-12-04 12:44:20,544] Trial 796 finished with value: 0.24140712511427917 and parameters: {'n_estimators': 1487, 'learning_rate': 0.06458688916765981, 'max_depth': 12, 'min_samples_split': 19, 'min_samples_leaf': 2, 'subsample': 0.6915239167132216, 'max_features': 'sqrt'}. Best is trial 784 with value: 0.199214954455861.
[I 2024-12-04 12:44:20,877] Trial 799 finished with value: 0.21064557537880974 and parameters: {'n_estimators': 1426, 'learning_rate': 0.090926799011421, 'max_depth': 11, 'min_samples_split': 14, 'min_samples_leaf': 1, 'subsample': 0.6788012049921319, 'max_features': 'sqrt'}. Best is trial 784 with value: 0.199214954455861.
[I 2024-12-04 12:44:24,865] Trial 825 finished with value: 0.39567539834159804 and parameters: {'n_estimators': 383, 'learning_rate': 0.0427107208959618, 'max_depth': 7, 'min_samples_split': 20, 'min_samples_leaf': 1, 'subsample': 0.6210435269860768, 'max_features': 'log2'}. Best is trial 784 with value: 0.199214954455861.
[I 2024-12-04 12:44:27,448] Trial 810 finished with value: 0.2206984676395918 and parameters: {'n_estimators': 1012, 'learning_rate': 0.08906015798375193, 'max_depth': 9, 'min_samples_split': 20, 'min_samples_leaf': 1, 'subsample': 0.6056910934165238, 'max_features': 'sqrt'}. Best is trial 784 with value: 0.199214954455861.
[I 2024-12-04 12:44:28,465] Trial 808 finished with value: 0.26044584503370477 and parameters: {'n_estimators': 1125, 'learning_rate': 0.08711897000344397, 'max_depth': 12, 'min_samples_split': 19, 'min_samples_leaf': 2, 'subsample': 0.6140416374428215, 'max_features': 'log2'}. Best is trial 784 with value: 0.199214954455861.
[I 2024-12-04 12:44:32,906] Trial 812 finished with value: 0.23082555235927277 and parameters: {'n_estimators': 996, 'learning_rate': 0.07896327404919412, 'max_depth': 12, 'min_samples_split': 19, 'min_samples_leaf': 1, 'subsample': 0.6661911209817398, 'max_features': 'sqrt'}. Best is trial 784 with value: 0.199214954455861.
[I 2024-12-04 12:44:42,471] Trial 811 finished with value: 0.21504307257820815 and parameters: {'n_estimators': 1289, 'learning_rate': 0.09689044739386214, 'max_depth': 12, 'min_samples_split': 17, 'min_samples_leaf': 1, 'subsample': 0.7217534760106703, 'max_features': 'sqrt'}. Best is trial 784 with value: 0.199214954455861.
[I 2024-12-04 12:44:44,731] Trial 806 finished with value: 0.2168713268712857 and parameters: {'n_estimators': 1499, 'learning_rate': 0.0975500620339898, 'max_depth': 10, 'min_samples_split': 13, 'min_samples_leaf': 1, 'subsample': 0.6489742885711993, 'max_features': 'sqrt'}. Best is trial 784 with value: 0.199214954455861.
[I 2024-12-04 12:44:46,793] Trial 815 finished with value: 0.25515378363652136 and parameters: {'n_estimators': 1132, 'learning_rate': 0.082597703524944, 'max_depth': 11, 'min_samples_split': 15, 'min_samples_leaf': 3, 'subsample': 0.6697571869115411, 'max_features': 'sqrt'}. Best is trial 784 with value: 0.199214954455861.
[I 2024-12-04 12:44:49,028] Trial 809 finished with value: 0.22281492296011005 and parameters: {'n_estimators': 1437, 'learning_rate': 0.061558055574255775, 'max_depth': 12, 'min_samples_split': 13, 'min_samples_leaf': 1, 'subsample': 0.6465730942921032, 'max_features': 'sqrt'}. Best is trial 784 with value: 0.199214954455861.
[I 2024-12-04 12:44:51,204] Trial 829 finished with value: 0.47857278092227284 and parameters: {'n_estimators': 753, 'learning_rate': 0.09099054361852894, 'max_depth': 4, 'min_samples_split': 2, 'min_samples_leaf': 10, 'subsample': 0.7975006847136646, 'max_features': 'log2'}. Best is trial 784 with value: 0.199214954455861.
[I 2024-12-04 12:44:52,689] Trial 819 finished with value: 0.21666079486785142 and parameters: {'n_estimators': 1087, 'learning_rate': 0.09620601565793918, 'max_depth': 12, 'min_samples_split': 13, 'min_samples_leaf': 1, 'subsample': 0.6322183308739131, 'max_features': 'sqrt'}. Best is trial 784 with value: 0.199214954455861.
[I 2024-12-04 12:44:52,970] Trial 816 finished with value: 0.23906086450893885 and parameters: {'n_estimators': 1175, 'learning_rate': 0.09517988249934933, 'max_depth': 12, 'min_samples_split': 13, 'min_samples_leaf': 4, 'subsample': 0.7265273002492364, 'max_features': 'sqrt'}. Best is trial 784 with value: 0.199214954455861.
[I 2024-12-04 12:44:53,715] Trial 844 finished with value: 0.7677957525841304 and parameters: {'n_estimators': 244, 'learning_rate': 0.027738774005329182, 'max_depth': 11, 'min_samples_split': 18, 'min_samples_leaf': 9, 'subsample': 0.9861317184728542, 'max_features': 'log2'}. Best is trial 784 with value: 0.199214954455861.
[I 2024-12-04 12:44:54,135] Trial 820 finished with value: 0.2078292007437869 and parameters: {'n_estimators': 1139, 'learning_rate': 0.08759825674314119, 'max_depth': 12, 'min_samples_split': 18, 'min_samples_leaf': 1, 'subsample': 0.6701458126136557, 'max_features': 'sqrt'}. Best is trial 784 with value: 0.199214954455861.
[I 2024-12-04 12:44:55,908] Trial 818 finished with value: 0.21896200788429138 and parameters: {'n_estimators': 1170, 'learning_rate': 0.09342911708056151, 'max_depth': 12, 'min_samples_split': 13, 'min_samples_leaf': 1, 'subsample': 0.6651569196238184, 'max_features': 'sqrt'}. Best is trial 784 with value: 0.199214954455861.
[I 2024-12-04 12:44:56,923] Trial 826 finished with value: 0.3504256233599993 and parameters: {'n_estimators': 816, 'learning_rate': 0.02029791219688886, 'max_depth': 8, 'min_samples_split': 17, 'min_samples_leaf': 7, 'subsample': 0.9256066317005118, 'max_features': None}. Best is trial 784 with value: 0.199214954455861.
[I 2024-12-04 12:45:03,358] Trial 814 finished with value: 0.40825288669490634 and parameters: {'n_estimators': 1399, 'learning_rate': 0.023296052406862697, 'max_depth': 4, 'min_samples_split': 16, 'min_samples_leaf': 7, 'subsample': 0.6227820396714188, 'max_features': 'sqrt'}. Best is trial 784 with value: 0.199214954455861.
[I 2024-12-04 12:45:06,528] Trial 828 finished with value: 0.24049049824219512 and parameters: {'n_estimators': 1059, 'learning_rate': 0.06625971937274534, 'max_depth': 12, 'min_samples_split': 15, 'min_samples_leaf': 3, 'subsample': 0.6513769238406745, 'max_features': 'sqrt'}. Best is trial 784 with value: 0.199214954455861.
[I 2024-12-04 12:45:08,145] Trial 831 finished with value: 0.24590362337702712 and parameters: {'n_estimators': 910, 'learning_rate': 0.09229838559690808, 'max_depth': 12, 'min_samples_split': 18, 'min_samples_leaf': 3, 'subsample': 0.6144866975280021, 'max_features': 'sqrt'}. Best is trial 784 with value: 0.199214954455861.
[I 2024-12-04 12:45:09,087] Trial 830 finished with value: 0.24332793665295796 and parameters: {'n_estimators': 1043, 'learning_rate': 0.07551268651826522, 'max_depth': 10, 'min_samples_split': 17, 'min_samples_leaf': 1, 'subsample': 0.6225135567978938, 'max_features': 'sqrt'}. Best is trial 784 with value: 0.199214954455861.
[I 2024-12-04 12:45:13,557] Trial 821 finished with value: 0.2712643182788049 and parameters: {'n_estimators': 1244, 'learning_rate': 0.04445481083720957, 'max_depth': 11, 'min_samples_split': 18, 'min_samples_leaf': 2, 'subsample': 0.6956629314154986, 'max_features': None}. Best is trial 784 with value: 0.199214954455861.
[I 2024-12-04 12:45:13,670] Trial 832 finished with value: 0.27529636442237093 and parameters: {'n_estimators': 1041, 'learning_rate': 0.06008531233226245, 'max_depth': 11, 'min_samples_split': 10, 'min_samples_leaf': 4, 'subsample': 0.6008601347697492, 'max_features': 'sqrt'}. Best is trial 784 with value: 0.199214954455861.
[I 2024-12-04 12:45:15,291] Trial 822 finished with value: 0.22137208629819305 and parameters: {'n_estimators': 1370, 'learning_rate': 0.09767176413021648, 'max_depth': 12, 'min_samples_split': 20, 'min_samples_leaf': 1, 'subsample': 0.6211959961559396, 'max_features': 'sqrt'}. Best is trial 784 with value: 0.199214954455861.
[I 2024-12-04 12:45:15,678] Trial 827 finished with value: 0.2309413488304512 and parameters: {'n_estimators': 1206, 'learning_rate': 0.07280250679821959, 'max_depth': 11, 'min_samples_split': 17, 'min_samples_leaf': 2, 'subsample': 0.6057992332285201, 'max_features': 'sqrt'}. Best is trial 784 with value: 0.199214954455861.
[I 2024-12-04 12:45:17,079] Trial 824 finished with value: 0.2739469796093102 and parameters: {'n_estimators': 1377, 'learning_rate': 0.028098844928729765, 'max_depth': 12, 'min_samples_split': 18, 'min_samples_leaf': 1, 'subsample': 0.6614839927124658, 'max_features': 'log2'}. Best is trial 784 with value: 0.199214954455861.
[I 2024-12-04 12:45:17,448] Trial 840 finished with value: 0.4321299364265676 and parameters: {'n_estimators': 739, 'learning_rate': 0.0671073872464499, 'max_depth': 5, 'min_samples_split': 11, 'min_samples_leaf': 10, 'subsample': 0.7288194500323031, 'max_features': 'sqrt'}. Best is trial 784 with value: 0.199214954455861.
[I 2024-12-04 12:45:23,978] Trial 835 finished with value: 0.23771433293180394 and parameters: {'n_estimators': 1099, 'learning_rate': 0.08744007050978714, 'max_depth': 11, 'min_samples_split': 16, 'min_samples_leaf': 1, 'subsample': 0.639425166647307, 'max_features': 'sqrt'}. Best is trial 784 with value: 0.199214954455861.
[I 2024-12-04 12:45:24,560] Trial 833 finished with value: 0.22881458229320487 and parameters: {'n_estimators': 1206, 'learning_rate': 0.07479897447618479, 'max_depth': 11, 'min_samples_split': 17, 'min_samples_leaf': 1, 'subsample': 0.6502175737307991, 'max_features': 'sqrt'}. Best is trial 784 with value: 0.199214954455861.
[I 2024-12-04 12:45:27,999] Trial 845 finished with value: 0.2450895463565204 and parameters: {'n_estimators': 750, 'learning_rate': 0.08045777487196676, 'max_depth': 11, 'min_samples_split': 18, 'min_samples_leaf': 1, 'subsample': 0.6039788965686901, 'max_features': None}. Best is trial 784 with value: 0.199214954455861.
[I 2024-12-04 12:45:28,359] Trial 838 finished with value: 0.23893945023919186 and parameters: {'n_estimators': 1033, 'learning_rate': 0.06486297993457239, 'max_depth': 12, 'min_samples_split': 16, 'min_samples_leaf': 2, 'subsample': 0.6010959212500682, 'max_features': 'sqrt'}. Best is trial 784 with value: 0.199214954455861.
[I 2024-12-04 12:45:32,022] Trial 836 finished with value: 0.24580260827898195 and parameters: {'n_estimators': 1121, 'learning_rate': 0.09558702332595667, 'max_depth': 11, 'min_samples_split': 18, 'min_samples_leaf': 1, 'subsample': 0.6228693791117612, 'max_features': 'sqrt'}. Best is trial 784 with value: 0.199214954455861.
[I 2024-12-04 12:45:36,853] Trial 834 finished with value: 0.5201667671736 and parameters: {'n_estimators': 1359, 'learning_rate': 0.018926599561561407, 'max_depth': 10, 'min_samples_split': 2, 'min_samples_leaf': 9, 'subsample': 0.9203612244098499, 'max_features': 'log2'}. Best is trial 784 with value: 0.199214954455861.
[I 2024-12-04 12:45:39,147] Trial 866 finished with value: 0.7349187658076346 and parameters: {'n_estimators': 186, 'learning_rate': 0.06356963305197462, 'max_depth': 7, 'min_samples_split': 14, 'min_samples_leaf': 10, 'subsample': 0.825973083145258, 'max_features': 'log2'}. Best is trial 784 with value: 0.199214954455861.
[I 2024-12-04 12:45:40,062] Trial 842 finished with value: 0.29692118154577885 and parameters: {'n_estimators': 964, 'learning_rate': 0.08681266051199589, 'max_depth': 10, 'min_samples_split': 10, 'min_samples_leaf': 2, 'subsample': 0.6081425917165693, 'max_features': None}. Best is trial 784 with value: 0.199214954455861.
[I 2024-12-04 12:45:41,453] Trial 841 finished with value: 0.24868516693485254 and parameters: {'n_estimators': 1180, 'learning_rate': 0.09038245838215538, 'max_depth': 10, 'min_samples_split': 13, 'min_samples_leaf': 2, 'subsample': 0.6502921283355513, 'max_features': 'sqrt'}. Best is trial 784 with value: 0.199214954455861.
[I 2024-12-04 12:45:43,328] Trial 837 finished with value: 0.20714045882491525 and parameters: {'n_estimators': 1318, 'learning_rate': 0.09218891480501205, 'max_depth': 12, 'min_samples_split': 12, 'min_samples_leaf': 1, 'subsample': 0.6756423795422121, 'max_features': 'sqrt'}. Best is trial 784 with value: 0.199214954455861.
[I 2024-12-04 12:45:44,657] Trial 870 finished with value: 0.9326938624171918 and parameters: {'n_estimators': 104, 'learning_rate': 0.014056287441030872, 'max_depth': 9, 'min_samples_split': 7, 'min_samples_leaf': 8, 'subsample': 0.6779952185129641, 'max_features': 'log2'}. Best is trial 784 with value: 0.199214954455861.
[I 2024-12-04 12:45:45,430] Trial 839 finished with value: 0.21173958575927018 and parameters: {'n_estimators': 1288, 'learning_rate': 0.09842976484373908, 'max_depth': 12, 'min_samples_split': 11, 'min_samples_leaf': 1, 'subsample': 0.6060593207911992, 'max_features': 'sqrt'}. Best is trial 784 with value: 0.199214954455861.
[I 2024-12-04 12:45:52,110] Trial 843 finished with value: 0.21330216947345754 and parameters: {'n_estimators': 1188, 'learning_rate': 0.09841666510432287, 'max_depth': 11, 'min_samples_split': 16, 'min_samples_leaf': 1, 'subsample': 0.6477988308176756, 'max_features': 'sqrt'}. Best is trial 784 with value: 0.199214954455861.
[I 2024-12-04 12:45:55,006] Trial 847 finished with value: 0.44137982540108067 and parameters: {'n_estimators': 1156, 'learning_rate': 0.013828172004741407, 'max_depth': 5, 'min_samples_split': 5, 'min_samples_leaf': 1, 'subsample': 0.9442849198015798, 'max_features': 'log2'}. Best is trial 784 with value: 0.199214954455861.
[I 2024-12-04 12:45:56,183] Trial 846 finished with value: 0.25399188744131107 and parameters: {'n_estimators': 1199, 'learning_rate': 0.07929772109255306, 'max_depth': 12, 'min_samples_split': 11, 'min_samples_leaf': 1, 'subsample': 0.6217984783909163, 'max_features': 'log2'}. Best is trial 784 with value: 0.199214954455861.
[I 2024-12-04 12:45:59,892] Trial 848 finished with value: 0.25895708945340523 and parameters: {'n_estimators': 1170, 'learning_rate': 0.08790132206393443, 'max_depth': 12, 'min_samples_split': 14, 'min_samples_leaf': 3, 'subsample': 0.6410435673880766, 'max_features': 'sqrt'}. Best is trial 784 with value: 0.199214954455861.
[I 2024-12-04 12:46:03,100] Trial 852 finished with value: 0.2412031240334012 and parameters: {'n_estimators': 972, 'learning_rate': 0.03403344599761296, 'max_depth': 12, 'min_samples_split': 16, 'min_samples_leaf': 1, 'subsample': 0.6796038390856883, 'max_features': 'sqrt'}. Best is trial 784 with value: 0.199214954455861.
[I 2024-12-04 12:46:04,400] Trial 869 finished with value: 0.6015973752590043 and parameters: {'n_estimators': 478, 'learning_rate': 0.014944921341354894, 'max_depth': 8, 'min_samples_split': 5, 'min_samples_leaf': 5, 'subsample': 0.9865169944243365, 'max_features': 'log2'}. Best is trial 784 with value: 0.199214954455861.
[I 2024-12-04 12:46:07,689] Trial 853 finished with value: 0.23432260262152607 and parameters: {'n_estimators': 1094, 'learning_rate': 0.06979553040924052, 'max_depth': 12, 'min_samples_split': 18, 'min_samples_leaf': 1, 'subsample': 0.6588135307472162, 'max_features': 'sqrt'}. Best is trial 784 with value: 0.199214954455861.
[I 2024-12-04 12:46:08,710] Trial 850 finished with value: 0.2280073418650149 and parameters: {'n_estimators': 1212, 'learning_rate': 0.06121540972267451, 'max_depth': 10, 'min_samples_split': 14, 'min_samples_leaf': 1, 'subsample': 0.6414900427940767, 'max_features': 'sqrt'}. Best is trial 784 with value: 0.199214954455861.
[I 2024-12-04 12:46:13,506] Trial 854 finished with value: 0.25310582913467733 and parameters: {'n_estimators': 1151, 'learning_rate': 0.06502409915331185, 'max_depth': 12, 'min_samples_split': 18, 'min_samples_leaf': 3, 'subsample': 0.6781744639566528, 'max_features': 'sqrt'}. Best is trial 784 with value: 0.199214954455861.
[I 2024-12-04 12:46:19,808] Trial 849 finished with value: 0.2774519176960615 and parameters: {'n_estimators': 1464, 'learning_rate': 0.023534214751649362, 'max_depth': 8, 'min_samples_split': 2, 'min_samples_leaf': 4, 'subsample': 0.9227842965830708, 'max_features': 'sqrt'}. Best is trial 784 with value: 0.199214954455861.
[I 2024-12-04 12:46:21,487] Trial 856 finished with value: 0.5849703018479449 and parameters: {'n_estimators': 1257, 'learning_rate': 0.023733740041023476, 'max_depth': 10, 'min_samples_split': 3, 'min_samples_leaf': 10, 'subsample': 0.6476063912425982, 'max_features': 'log2'}. Best is trial 784 with value: 0.199214954455861.
[I 2024-12-04 12:46:22,371] Trial 857 finished with value: 0.21833054085229264 and parameters: {'n_estimators': 1193, 'learning_rate': 0.07983169300515999, 'max_depth': 12, 'min_samples_split': 18, 'min_samples_leaf': 1, 'subsample': 0.7027117803553987, 'max_features': 'sqrt'}. Best is trial 784 with value: 0.199214954455861.
[I 2024-12-04 12:46:23,917] Trial 851 finished with value: 0.39361457675781025 and parameters: {'n_estimators': 1210, 'learning_rate': 0.014370383848140482, 'max_depth': 12, 'min_samples_split': 5, 'min_samples_leaf': 10, 'subsample': 0.6445325875839858, 'max_features': None}. Best is trial 784 with value: 0.199214954455861.
[I 2024-12-04 12:46:29,746] Trial 859 finished with value: 0.24679735542539974 and parameters: {'n_estimators': 1224, 'learning_rate': 0.08992228775800426, 'max_depth': 10, 'min_samples_split': 9, 'min_samples_leaf': 2, 'subsample': 0.6998622157418966, 'max_features': 'sqrt'}. Best is trial 784 with value: 0.199214954455861.
[I 2024-12-04 12:46:32,410] Trial 863 finished with value: 0.24874385912041871 and parameters: {'n_estimators': 1123, 'learning_rate': 0.038289016018070776, 'max_depth': 12, 'min_samples_split': 19, 'min_samples_leaf': 1, 'subsample': 0.7556288628586444, 'max_features': 'sqrt'}. Best is trial 784 with value: 0.199214954455861.
[I 2024-12-04 12:46:37,202] Trial 855 finished with value: 0.23601743243259213 and parameters: {'n_estimators': 1478, 'learning_rate': 0.06110558152327697, 'max_depth': 9, 'min_samples_split': 19, 'min_samples_leaf': 1, 'subsample': 0.6491031477562437, 'max_features': 'sqrt'}. Best is trial 784 with value: 0.199214954455861.
[I 2024-12-04 12:46:37,231] Trial 864 finished with value: 0.2449119484698744 and parameters: {'n_estimators': 1189, 'learning_rate': 0.09716950901657188, 'max_depth': 12, 'min_samples_split': 14, 'min_samples_leaf': 3, 'subsample': 0.6843465283368382, 'max_features': 'sqrt'}. Best is trial 784 with value: 0.199214954455861.
[I 2024-12-04 12:46:38,220] Trial 867 finished with value: 0.2512635202897515 and parameters: {'n_estimators': 1097, 'learning_rate': 0.07093487425249366, 'max_depth': 11, 'min_samples_split': 15, 'min_samples_leaf': 1, 'subsample': 0.7109210541845009, 'max_features': 'log2'}. Best is trial 784 with value: 0.199214954455861.
[I 2024-12-04 12:46:42,430] Trial 858 finished with value: 0.23032162136801382 and parameters: {'n_estimators': 1475, 'learning_rate': 0.08593287814176463, 'max_depth': 10, 'min_samples_split': 16, 'min_samples_leaf': 1, 'subsample': 0.6108157119546835, 'max_features': 'sqrt'}. Best is trial 784 with value: 0.199214954455861.
[I 2024-12-04 12:46:45,469] Trial 860 finished with value: 0.25174863104272804 and parameters: {'n_estimators': 1489, 'learning_rate': 0.08296575598070323, 'max_depth': 11, 'min_samples_split': 13, 'min_samples_leaf': 4, 'subsample': 0.6682601597149331, 'max_features': 'sqrt'}. Best is trial 784 with value: 0.199214954455861.
[I 2024-12-04 12:46:48,304] Trial 868 finished with value: 0.24759707075555273 and parameters: {'n_estimators': 1253, 'learning_rate': 0.09757393218938747, 'max_depth': 11, 'min_samples_split': 15, 'min_samples_leaf': 1, 'subsample': 0.6840620998496476, 'max_features': 'sqrt'}. Best is trial 784 with value: 0.199214954455861.
