[I 2024-12-04 20:30:30,860] Trial 1156 finished with value: 0.9981857838901799 and parameters: {'kernel_type': 'Matern', 'length_scale': 0.0002874004982433717, 'noise_level': 6.21510981139656e-05, 'constant_value': 2.4137559512272717e-06, 'nu': 2.5}. Best is trial 959 with value: 0.1375110730946576.
[I 2024-12-04 20:30:31,945] Trial 1155 finished with value: 0.1446988177452006 and parameters: {'kernel_type': 'Matern', 'length_scale': 2.9913708834395014, 'noise_level': 0.501551913549601, 'constant_value': 5.392095326796228, 'nu': 2.5}. Best is trial 959 with value: 0.1375110730946576.
[I 2024-12-04 20:30:39,011] Trial 1158 finished with value: 0.14249571428733201 and parameters: {'kernel_type': 'Matern', 'length_scale': 4.070854384680481, 'noise_level': 0.031797684787027984, 'constant_value': 2.9929468834876354, 'nu': 1.5}. Best is trial 959 with value: 0.1375110730946576.
[I 2024-12-04 20:30:39,015] Trial 1157 finished with value: 0.1424952112519125 and parameters: {'kernel_type': 'Matern', 'length_scale': 0.6004260890340698, 'noise_level': 0.06539524684868676, 'constant_value': 6.962883429516665, 'nu': 1.5}. Best is trial 959 with value: 0.1375110730946576.
[I 2024-12-04 20:30:42,201] Trial 1159 finished with value: 0.14249506396568218 and parameters: {'kernel_type': 'Matern', 'length_scale': 0.5762972654596669, 'noise_level': 0.0029325871844029525, 'constant_value': 0.01075960774462634, 'nu': 1.5}. Best is trial 959 with value: 0.1375110730946576.
[I 2024-12-04 20:30:47,180] Trial 1160 finished with value: 0.14249489079454894 and parameters: {'kernel_type': 'Matern', 'length_scale': 0.4251167126911058, 'noise_level': 0.3656993299266375, 'constant_value': 4.8575028088773236, 'nu': 1.5}. Best is trial 959 with value: 0.1375110730946576.
[I 2024-12-04 20:30:49,202] Trial 1161 finished with value: 0.19720002717929963 and parameters: {'kernel_type': 'Matern', 'length_scale': 38.74936198712772, 'noise_level': 3.1543883396696254e-05, 'constant_value': 0.6839695444605989, 'nu': 0.5}. Best is trial 959 with value: 0.1375110730946576.
[I 2024-12-04 20:30:51,809] Trial 1162 finished with value: 0.986468682010701 and parameters: {'kernel_type': 'Matern', 'length_scale': 382.59599236517784, 'noise_level': 0.006937132050220963, 'constant_value': 6.697452932791597, 'nu': 1.5}. Best is trial 959 with value: 0.1375110730946576.
[I 2024-12-04 20:30:52,452] Trial 1163 finished with value: 0.9864686819641025 and parameters: {'kernel_type': 'Matern', 'length_scale': 0.0002377445567697708, 'noise_level': 0.626978661524198, 'constant_value': 66975.64251249403, 'nu': 1.5}. Best is trial 959 with value: 0.1375110730946576.
[I 2024-12-04 20:30:59,041] Trial 1165 finished with value: 0.14249505172875032 and parameters: {'kernel_type': 'Matern', 'length_scale': 11.157258910834754, 'noise_level': 0.000572406595317061, 'constant_value': 26.717510335970278, 'nu': 1.5}. Best is trial 959 with value: 0.1375110730946576.
[I 2024-12-04 20:30:59,665] Trial 1164 finished with value: 0.1424952047256041 and parameters: {'kernel_type': 'Matern', 'length_scale': 5.011133341377228, 'noise_level': 0.004519469207211185, 'constant_value': 0.3982393250454474, 'nu': 1.5}. Best is trial 959 with value: 0.1375110730946576.
[I 2024-12-04 20:31:01,604] Trial 1166 finished with value: 0.14249503315905113 and parameters: {'kernel_type': 'Matern', 'length_scale': 0.6959438221703435, 'noise_level': 0.9222355971201323, 'constant_value': 0.6174274840845578, 'nu': 1.5}. Best is trial 959 with value: 0.1375110730946576.
[I 2024-12-04 20:31:08,772] Trial 1169 finished with value: 0.14249504575724173 and parameters: {'kernel_type': 'Matern', 'length_scale': 33.05306124016681, 'noise_level': 0.9467775157059216, 'constant_value': 0.33038442932157364, 'nu': 1.5}. Best is trial 959 with value: 0.1375110730946576.
[I 2024-12-04 20:31:09,504] Trial 1168 finished with value: 0.14249508170984646 and parameters: {'kernel_type': 'Matern', 'length_scale': 0.1860996414987794, 'noise_level': 0.0012316481450683407, 'constant_value': 170.96994945156078, 'nu': 1.5}. Best is trial 959 with value: 0.1375110730946576.
[I 2024-12-04 20:31:13,510] Trial 1171 finished with value: 0.9864686753675191 and parameters: {'kernel_type': 'Matern', 'length_scale': 0.08198512567073316, 'noise_level': 0.0011863564585012744, 'constant_value': 0.5382287807177109, 'nu': 1.5}. Best is trial 959 with value: 0.1375110730946576.
[I 2024-12-04 20:31:15,951] Trial 1170 finished with value: 0.9864686821989581 and parameters: {'kernel_type': 'Matern', 'length_scale': 156.08110440401282, 'noise_level': 2.8434670284590315e-10, 'constant_value': 0.06674455575187795, 'nu': 1.5}. Best is trial 959 with value: 0.1375110730946576.
[I 2024-12-04 20:31:17,085] Trial 1167 finished with value: 0.9864686819222764 and parameters: {'kernel_type': 'Matern', 'length_scale': 10745.643286973325, 'noise_level': 0.03078330126957331, 'constant_value': 146.15945999081325, 'nu': 1.5}. Best is trial 959 with value: 0.1375110730946576.
[I 2024-12-04 20:31:23,006] Trial 1173 finished with value: 0.14249514868968075 and parameters: {'kernel_type': 'Matern', 'length_scale': 65.50794081636515, 'noise_level': 0.0913730330658393, 'constant_value': 9.809139701274958, 'nu': 1.5}. Best is trial 959 with value: 0.1375110730946576.
[I 2024-12-04 20:31:24,917] Trial 1174 finished with value: 0.9864686819127058 and parameters: {'kernel_type': 'Matern', 'length_scale': 255.40099421759774, 'noise_level': 0.007806872778606407, 'constant_value': 11.57255953707511, 'nu': 1.5}. Best is trial 959 with value: 0.1375110730946576.
[I 2024-12-04 20:31:25,633] Trial 1172 finished with value: 0.14249491411791257 and parameters: {'kernel_type': 'Matern', 'length_scale': 2.2257053334909798, 'noise_level': 0.09334484552746114, 'constant_value': 18.693829926376896, 'nu': 1.5}. Best is trial 959 with value: 0.1375110730946576.
[I 2024-12-04 20:31:29,802] Trial 1175 finished with value: 0.9864686819432842 and parameters: {'kernel_type': 'Matern', 'length_scale': 134.9843213754799, 'noise_level': 2.980602520581513e-06, 'constant_value': 3.0879496772569492, 'nu': 1.5}. Best is trial 959 with value: 0.1375110730946576.
[I 2024-12-04 20:31:31,086] Trial 1176 finished with value: 0.14249505303803256 and parameters: {'kernel_type': 'Matern', 'length_scale': 3.086710623046904, 'noise_level': 0.005478620664376685, 'constant_value': 2.265629710356209, 'nu': 1.5}. Best is trial 959 with value: 0.1375110730946576.
[I 2024-12-04 20:31:37,744] Trial 1178 finished with value: 0.14249513782786077 and parameters: {'kernel_type': 'Matern', 'length_scale': 0.26626426966727046, 'noise_level': 0.910752542487084, 'constant_value': 163.47060853066588, 'nu': 1.5}. Best is trial 959 with value: 0.1375110730946576.
[I 2024-12-04 20:31:38,802] Trial 1177 finished with value: 0.14249506386086305 and parameters: {'kernel_type': 'Matern', 'length_scale': 0.189449930307172, 'noise_level': 0.8173709309037074, 'constant_value': 3101.5169708579756, 'nu': 1.5}. Best is trial 959 with value: 0.1375110730946576.
[I 2024-12-04 20:31:39,803] Trial 1179 finished with value: 0.1424950671154492 and parameters: {'kernel_type': 'Matern', 'length_scale': 12.833734671208527, 'noise_level': 0.8459892727379682, 'constant_value': 132.1775102605612, 'nu': 1.5}. Best is trial 959 with value: 0.1375110730946576.
[I 2024-12-04 20:31:45,113] Trial 1181 finished with value: 0.9864686819220995 and parameters: {'kernel_type': 'Matern', 'length_scale': 60.58367543739165, 'noise_level': 0.002046937053785118, 'constant_value': 7.802754293348534, 'nu': 1.5}. Best is trial 959 with value: 0.1375110730946576.
[I 2024-12-04 20:31:45,116] Trial 1180 finished with value: 0.14249503265908037 and parameters: {'kernel_type': 'Matern', 'length_scale': 1.5471613596789942, 'noise_level': 0.02208786281056678, 'constant_value': 6.942077494474201, 'nu': 1.5}. Best is trial 959 with value: 0.1375110730946576.
[I 2024-12-04 20:31:47,622] Trial 1182 finished with value: 0.142495063018618 and parameters: {'kernel_type': 'Matern', 'length_scale': 5.745656167575407, 'noise_level': 0.06547752514728516, 'constant_value': 147.87046603232164, 'nu': 1.5}. Best is trial 959 with value: 0.1375110730946576.
[I 2024-12-04 20:31:52,005] Trial 1185 finished with value: 0.986468681904459 and parameters: {'kernel_type': 'Matern', 'length_scale': 0.007378226511209412, 'noise_level': 0.011805518570740473, 'constant_value': 238.88603078259572, 'nu': 1.5}. Best is trial 959 with value: 0.1375110730946576.
[I 2024-12-04 20:31:54,031] Trial 1183 finished with value: 0.14249505739867666 and parameters: {'kernel_type': 'Matern', 'length_scale': 14.96349477790311, 'noise_level': 0.9637631259016396, 'constant_value': 2.704659588572897, 'nu': 1.5}. Best is trial 959 with value: 0.1375110730946576.
[I 2024-12-04 20:31:54,310] Trial 1184 finished with value: 0.9982168822900641 and parameters: {'kernel_type': 'Matern', 'length_scale': 2.554910909112251, 'noise_level': 0.034439026845085936, 'constant_value': 0.00013019653411081426, 'nu': 2.5}. Best is trial 959 with value: 0.1375110730946576.
[I 2024-12-04 20:31:59,010] Trial 1186 finished with value: 0.14249506225240996 and parameters: {'kernel_type': 'Matern', 'length_scale': 2199.573879172053, 'noise_level': 0.03650908140829755, 'constant_value': 234.03216364623455, 'nu': 1.5}. Best is trial 959 with value: 0.1375110730946576.
[I 2024-12-04 20:32:02,439] Trial 1187 finished with value: 0.9864686819198958 and parameters: {'kernel_type': 'Matern', 'length_scale': 197.3588490247104, 'noise_level': 0.029854790026790604, 'constant_value': 0.561345577641842, 'nu': 1.5}. Best is trial 959 with value: 0.1375110730946576.
[I 2024-12-04 20:32:07,823] Trial 1189 finished with value: 0.1424950815043832 and parameters: {'kernel_type': 'Matern', 'length_scale': 1.6093024247776229, 'noise_level': 0.7940020742155184, 'constant_value': 97.85891889570581, 'nu': 1.5}. Best is trial 959 with value: 0.1375110730946576.
[I 2024-12-04 20:32:08,602] Trial 1190 finished with value: 0.14249470670153658 and parameters: {'kernel_type': 'Matern', 'length_scale': 14.852864189564338, 'noise_level': 0.0013448413198156298, 'constant_value': 187.90650236634647, 'nu': 1.5}. Best is trial 959 with value: 0.1375110730946576.
[I 2024-12-04 20:32:08,743] Trial 1188 finished with value: 0.1446988998662872 and parameters: {'kernel_type': 'Matern', 'length_scale': 0.5468042616899513, 'noise_level': 1.0085532604602596e-07, 'constant_value': 6.851474625502705e-05, 'nu': 2.5}. Best is trial 959 with value: 0.1375110730946576.
[I 2024-12-04 20:32:15,206] Trial 1191 finished with value: 0.9982167338039388 and parameters: {'kernel_type': 'Matern', 'length_scale': 0.017519937260525333, 'noise_level': 5.412409977977116e-10, 'constant_value': 1103.5537960743734, 'nu': 0.5}. Best is trial 959 with value: 0.1375110730946576.
[I 2024-12-04 20:32:16,712] Trial 1192 finished with value: 0.14249508984898165 and parameters: {'kernel_type': 'Matern', 'length_scale': 37.89074876738615, 'noise_level': 0.01477566225624235, 'constant_value': 343.40864576346047, 'nu': 1.5}. Best is trial 959 with value: 0.1375110730946576.
[I 2024-12-04 20:32:20,441] Trial 1193 finished with value: 0.14469876470017848 and parameters: {'kernel_type': 'Matern', 'length_scale': 66.78462508434609, 'noise_level': 0.30283698921816443, 'constant_value': 1.2104954826792875, 'nu': 2.5}. Best is trial 959 with value: 0.1375110730946576.
[I 2024-12-04 20:32:23,789] Trial 1194 finished with value: 0.14249506972235593 and parameters: {'kernel_type': 'Matern', 'length_scale': 784.6014532796545, 'noise_level': 0.7542129456007217, 'constant_value': 29.821166289733178, 'nu': 1.5}. Best is trial 959 with value: 0.1375110730946576.
[I 2024-12-04 20:32:24,185] Trial 1195 finished with value: 0.14249509599224008 and parameters: {'kernel_type': 'Matern', 'length_scale': 56.618743214940224, 'noise_level': 0.025742464406370975, 'constant_value': 6.048572233282285, 'nu': 1.5}. Best is trial 959 with value: 0.1375110730946576.
[I 2024-12-04 20:32:26,698] Trial 1196 finished with value: 0.19720003115044218 and parameters: {'kernel_type': 'Matern', 'length_scale': 25.221004815395276, 'noise_level': 0.03505946353635401, 'constant_value': 3.542626580936819, 'nu': 0.5}. Best is trial 959 with value: 0.1375110730946576.
[I 2024-12-04 20:32:32,531] Trial 1197 finished with value: 0.14771037756225888 and parameters: {'kernel_type': 'RBF', 'length_scale': 97.87310865446123, 'noise_level': 0.4548814077469933, 'constant_value': 1.2386736954245878, 'nu': 1.5}. Best is trial 959 with value: 0.1375110730946576.
[I 2024-12-04 20:32:34,221] Trial 1198 finished with value: 0.14249504489336512 and parameters: {'kernel_type': 'Matern', 'length_scale': 11.499689335055477, 'noise_level': 0.05413770085662342, 'constant_value': 0.014034698404041042, 'nu': 1.5}. Best is trial 959 with value: 0.1375110730946576.
[I 2024-12-04 20:32:34,222] Trial 1199 finished with value: 0.14249508799220453 and parameters: {'kernel_type': 'Matern', 'length_scale': 0.5392580193749655, 'noise_level': 0.05394386428755471, 'constant_value': 1247.3075970883383, 'nu': 1.5}. Best is trial 959 with value: 0.1375110730946576.
[I 2024-12-04 20:32:40,339] Trial 1200 finished with value: 0.14249505975067128 and parameters: {'kernel_type': 'Matern', 'length_scale': 233.03619976411883, 'noise_level': 0.0005559199795348474, 'constant_value': 1104.14611484014, 'nu': 1.5}. Best is trial 959 with value: 0.1375110730946576.
[I 2024-12-04 20:32:40,868] Trial 1201 finished with value: 0.1424946181775311 and parameters: {'kernel_type': 'Matern', 'length_scale': 2.576140492165398, 'noise_level': 0.007946443367185686, 'constant_value': 36.359460997912755, 'nu': 1.5}. Best is trial 959 with value: 0.1375110730946576.
[I 2024-12-04 20:32:46,131] Trial 1202 finished with value: 0.14771037079056756 and parameters: {'kernel_type': 'RBF', 'length_scale': 2.3069634488786734, 'noise_level': 0.000830689545497341, 'constant_value': 0.00040903423889697193, 'nu': 1.5}. Best is trial 959 with value: 0.1375110730946576.
[I 2024-12-04 20:32:47,340] Trial 1204 finished with value: 0.14771036766452067 and parameters: {'kernel_type': 'RBF', 'length_scale': 22.870235374471665, 'noise_level': 0.002108223094089709, 'constant_value': 6546.9692925734735, 'nu': 1.5}. Best is trial 959 with value: 0.1375110730946576.
[I 2024-12-04 20:32:47,428] Trial 1203 finished with value: 0.14771055208830988 and parameters: {'kernel_type': 'RBF', 'length_scale': 3221.1268273257174, 'noise_level': 0.06382024144200653, 'constant_value': 62.47670195700828, 'nu': 1.5}. Best is trial 959 with value: 0.1375110730946576.
[I 2024-12-04 20:32:54,539] Trial 1206 finished with value: 0.14249493455196727 and parameters: {'kernel_type': 'Matern', 'length_scale': 1.5258816759100096, 'noise_level': 0.000353873032064793, 'constant_value': 1.1303875850374254, 'nu': 1.5}. Best is trial 959 with value: 0.1375110730946576.
[I 2024-12-04 20:32:55,413] Trial 1207 finished with value: 0.142495132470086 and parameters: {'kernel_type': 'Matern', 'length_scale': 200.60471376428447, 'noise_level': 0.869391711315125, 'constant_value': 65.40259460843278, 'nu': 1.5}. Best is trial 959 with value: 0.1375110730946576.
[I 2024-12-04 20:32:56,310] Trial 1205 finished with value: 0.14249507801515132 and parameters: {'kernel_type': 'Matern', 'length_scale': 0.24123134741822552, 'noise_level': 0.9071682105686035, 'constant_value': 32.580310035799656, 'nu': 1.5}. Best is trial 959 with value: 0.1375110730946576.
[I 2024-12-04 20:33:00,843] Trial 1208 finished with value: 0.19720002943686415 and parameters: {'kernel_type': 'Matern', 'length_scale': 77.94707115916776, 'noise_level': 0.6556446425234215, 'constant_value': 1003.7047024014414, 'nu': 0.5}. Best is trial 959 with value: 0.1375110730946576.
[I 2024-12-04 20:33:02,165] Trial 1210 finished with value: 0.14249501694941796 and parameters: {'kernel_type': 'Matern', 'length_scale': 655.6569453076402, 'noise_level': 0.038798911877946894, 'constant_value': 1199.4257681197428, 'nu': 1.5}. Best is trial 959 with value: 0.1375110730946576.
[I 2024-12-04 20:33:02,464] Trial 1209 finished with value: 0.1424950652610073 and parameters: {'kernel_type': 'Matern', 'length_scale': 45.96495075762586, 'noise_level': 0.1090255378626834, 'constant_value': 16.968035955164126, 'nu': 1.5}. Best is trial 959 with value: 0.1375110730946576.
[I 2024-12-04 20:33:08,995] Trial 1212 finished with value: 0.9864686819258188 and parameters: {'kernel_type': 'RBF', 'length_scale': 0.0002348178958453682, 'noise_level': 4.327352812206131e-09, 'constant_value': 0.051953010609555525, 'nu': 1.5}. Best is trial 959 with value: 0.1375110730946576.
[I 2024-12-04 20:33:09,090] Trial 1211 finished with value: 0.14771024692662238 and parameters: {'kernel_type': 'RBF', 'length_scale': 0.5133429528682676, 'noise_level': 0.923745309673244, 'constant_value': 14.935736964935154, 'nu': 2.5}. Best is trial 959 with value: 0.1375110730946576.
[I 2024-12-04 20:33:10,339] Trial 1213 finished with value: 0.14249507057391214 and parameters: {'kernel_type': 'Matern', 'length_scale': 2.4215202317767046, 'noise_level': 0.007052443809462296, 'constant_value': 4255.405120121223, 'nu': 1.5}. Best is trial 959 with value: 0.1375110730946576.
[I 2024-12-04 20:33:16,147] Trial 1216 finished with value: 0.14249486169393727 and parameters: {'kernel_type': 'Matern', 'length_scale': 154.5112685724771, 'noise_level': 0.03775576042325116, 'constant_value': 44.11432475199943, 'nu': 1.5}. Best is trial 959 with value: 0.1375110730946576.
[I 2024-12-04 20:33:17,039] Trial 1214 finished with value: 0.14249506327268904 and parameters: {'kernel_type': 'Matern', 'length_scale': 0.3102931879863866, 'noise_level': 0.015291228515509996, 'constant_value': 0.35519698537519867, 'nu': 1.5}. Best is trial 959 with value: 0.1375110730946576.
[I 2024-12-04 20:33:19,269] Trial 1215 finished with value: 0.14249513871549654 and parameters: {'kernel_type': 'Matern', 'length_scale': 0.9445403851901794, 'noise_level': 0.9792862433278365, 'constant_value': 26.171172369705253, 'nu': 1.5}. Best is trial 959 with value: 0.1375110730946576.
[I 2024-12-04 20:33:21,997] Trial 1217 finished with value: 0.1446988772409765 and parameters: {'kernel_type': 'Matern', 'length_scale': 571.7608375147737, 'noise_level': 0.022721979058822606, 'constant_value': 2547.1648001505855, 'nu': 2.5}. Best is trial 959 with value: 0.1375110730946576.
[I 2024-12-04 20:33:25,564] Trial 1219 finished with value: 0.9864686819217804 and parameters: {'kernel_type': 'Matern', 'length_scale': 41.481268401837895, 'noise_level': 0.00036037245111951904, 'constant_value': 0.15050905224243114, 'nu': 1.5}. Best is trial 959 with value: 0.1375110730946576.
[I 2024-12-04 20:33:27,225] Trial 1218 finished with value: 0.14249538644087842 and parameters: {'kernel_type': 'Matern', 'length_scale': 2.2418954995772773, 'noise_level': 0.0005119161075953198, 'constant_value': 654.4148148072634, 'nu': 1.5}. Best is trial 959 with value: 0.1375110730946576.
[I 2024-12-04 20:33:27,324] Trial 1220 finished with value: 0.14249510159217 and parameters: {'kernel_type': 'Matern', 'length_scale': 239.28190353399626, 'noise_level': 0.017506778501308114, 'constant_value': 1530.2552998348642, 'nu': 1.5}. Best is trial 959 with value: 0.1375110730946576.
[I 2024-12-04 20:33:33,493] Trial 1222 finished with value: 0.9864686819228347 and parameters: {'kernel_type': 'Matern', 'length_scale': 0.031961213385669665, 'noise_level': 0.026217211152232283, 'constant_value': 44202.82198164134, 'nu': 1.5}. Best is trial 959 with value: 0.1375110730946576.
[I 2024-12-04 20:33:33,558] Trial 1221 finished with value: 0.14249508061368463 and parameters: {'kernel_type': 'Matern', 'length_scale': 11.41571030703902, 'noise_level': 0.03257708012609886, 'constant_value': 1138.9791878158128, 'nu': 1.5}. Best is trial 959 with value: 0.1375110730946576.
[I 2024-12-04 20:33:37,612] Trial 1223 finished with value: 0.14249540159380134 and parameters: {'kernel_type': 'Matern', 'length_scale': 1.0808048396482284, 'noise_level': 0.050296984485120766, 'constant_value': 104.30836561364539, 'nu': 1.5}. Best is trial 959 with value: 0.1375110730946576.
[I 2024-12-04 20:33:40,874] Trial 1224 finished with value: 0.1424949827357282 and parameters: {'kernel_type': 'Matern', 'length_scale': 29.597280568292504, 'noise_level': 0.4362047657719514, 'constant_value': 63.54500161833409, 'nu': 1.5}. Best is trial 959 with value: 0.1375110730946576.
[I 2024-12-04 20:33:45,129] Trial 1225 finished with value: 0.9864686819186779 and parameters: {'kernel_type': 'Matern', 'length_scale': 198.97848568636692, 'noise_level': 0.02392122893388902, 'constant_value': 0.019398129696188697, 'nu': 1.5}. Best is trial 959 with value: 0.1375110730946576.
[I 2024-12-04 20:33:45,298] Trial 1226 finished with value: 0.1424950465475041 and parameters: {'kernel_type': 'Matern', 'length_scale': 1.3744293178248932, 'noise_level': 0.10327096689113323, 'constant_value': 0.9429244877473422, 'nu': 1.5}. Best is trial 959 with value: 0.1375110730946576.
[I 2024-12-04 20:33:49,060] Trial 1227 finished with value: 0.1424950631792999 and parameters: {'kernel_type': 'Matern', 'length_scale': 17.30320312665757, 'noise_level': 0.0810668907363366, 'constant_value': 17.02282722720741, 'nu': 1.5}. Best is trial 959 with value: 0.1375110730946576.
[I 2024-12-04 20:33:53,306] Trial 1229 finished with value: 0.9864686819220194 and parameters: {'kernel_type': 'Matern', 'length_scale': 1116.3095504767894, 'noise_level': 0.04685033271088751, 'constant_value': 2.4168210258542535, 'nu': 1.5}. Best is trial 959 with value: 0.1375110730946576.
