[I 2024-12-04 20:47:46,958] Trial 1527 finished with value: 0.14249522689626812 and parameters: {'kernel_type': 'Matern', 'length_scale': 4818.615477503522, 'noise_level': 0.8399579472747944, 'constant_value': 9.857269159561309, 'nu': 1.5}. Best is trial 959 with value: 0.1375110730946576.
[I 2024-12-04 20:47:47,417] Trial 1525 finished with value: 0.14249506354080638 and parameters: {'kernel_type': 'Matern', 'length_scale': 0.19909935601076578, 'noise_level': 0.7975391103704953, 'constant_value': 398.3607685257097, 'nu': 1.5}. Best is trial 959 with value: 0.1375110730946576.
[I 2024-12-04 20:47:50,096] Trial 1528 finished with value: 0.1424950635147176 and parameters: {'kernel_type': 'Matern', 'length_scale': 978.7839675587913, 'noise_level': 0.028300440627477948, 'constant_value': 34496.828458289674, 'nu': 1.5}. Best is trial 959 with value: 0.1375110730946576.
[I 2024-12-04 20:47:53,430] Trial 1530 finished with value: 0.14249506743388698 and parameters: {'kernel_type': 'Matern', 'length_scale': 26.020698209120294, 'noise_level': 0.0637517941990539, 'constant_value': 210.60678855946506, 'nu': 1.5}. Best is trial 959 with value: 0.1375110730946576.
[I 2024-12-04 20:47:53,865] Trial 1529 finished with value: 0.1424950907420385 and parameters: {'kernel_type': 'Matern', 'length_scale': 1.563671952841464, 'noise_level': 0.026119480111468595, 'constant_value': 977.9098877280433, 'nu': 1.5}. Best is trial 959 with value: 0.1375110730946576.
[I 2024-12-04 20:47:58,019] Trial 1531 finished with value: 0.14249506161426467 and parameters: {'kernel_type': 'Matern', 'length_scale': 13.979956683244733, 'noise_level': 0.8585729072356972, 'constant_value': 0.05992884254836403, 'nu': 1.5}. Best is trial 959 with value: 0.1375110730946576.
[I 2024-12-04 20:47:58,902] Trial 1532 finished with value: 0.14249499614190805 and parameters: {'kernel_type': 'Matern', 'length_scale': 48.869323611323445, 'noise_level': 0.04198444423457566, 'constant_value': 3028.441468619314, 'nu': 1.5}. Best is trial 959 with value: 0.1375110730946576.
[I 2024-12-04 20:48:01,495] Trial 1533 finished with value: 0.14249503563849103 and parameters: {'kernel_type': 'Matern', 'length_scale': 0.9378113597178093, 'noise_level': 0.004969571296139281, 'constant_value': 1616.2464249074628, 'nu': 1.5}. Best is trial 959 with value: 0.1375110730946576.
[I 2024-12-04 20:48:02,637] Trial 1534 finished with value: 0.9982148875488779 and parameters: {'kernel_type': 'Matern', 'length_scale': 0.2958126692973043, 'noise_level': 1.1118464980807067e-10, 'constant_value': 279.03554188097934, 'nu': 1.5}. Best is trial 959 with value: 0.1375110730946576.
[I 2024-12-04 20:48:06,213] Trial 1535 finished with value: 0.14249525617689676 and parameters: {'kernel_type': 'Matern', 'length_scale': 122.29376361952062, 'noise_level': 0.03748708864650093, 'constant_value': 18.13903387049294, 'nu': 1.5}. Best is trial 959 with value: 0.1375110730946576.
[I 2024-12-04 20:48:07,516] Trial 1536 finished with value: 0.9864686819115368 and parameters: {'kernel_type': 'RBF', 'length_scale': 0.00022521830610845245, 'noise_level': 0.6805090591079164, 'constant_value': 22.13894966365702, 'nu': 1.5}. Best is trial 959 with value: 0.1375110730946576.
[I 2024-12-04 20:48:13,581] Trial 1537 finished with value: 0.14771035784321238 and parameters: {'kernel_type': 'RBF', 'length_scale': 0.43609910163825305, 'noise_level': 0.021234431738267077, 'constant_value': 0.011803266538916213, 'nu': 2.5}. Best is trial 959 with value: 0.1375110730946576.
[I 2024-12-04 20:48:13,925] Trial 1539 finished with value: 0.14249402900266156 and parameters: {'kernel_type': 'Matern', 'length_scale': 2.9035615684663654, 'noise_level': 0.0013282946107280153, 'constant_value': 43897.54867977783, 'nu': 1.5}. Best is trial 959 with value: 0.1375110730946576.
[I 2024-12-04 20:48:16,169] Trial 1538 finished with value: 0.1424950584687268 and parameters: {'kernel_type': 'Matern', 'length_scale': 0.5392286273909875, 'noise_level': 0.8468671135082534, 'constant_value': 1668.6768115042755, 'nu': 1.5}. Best is trial 959 with value: 0.1375110730946576.
[I 2024-12-04 20:48:23,713] Trial 1540 finished with value: 0.9982167338039931 and parameters: {'kernel_type': 'Matern', 'length_scale': 0.02102815296117104, 'noise_level': 6.6271878709564595e-06, 'constant_value': 216.196569477252, 'nu': 1.5}. Best is trial 959 with value: 0.1375110730946576.
[I 2024-12-04 20:48:24,606] Trial 1542 finished with value: 0.9982171094940401 and parameters: {'kernel_type': 'Matern', 'length_scale': 4.635461473159377, 'noise_level': 0.002347149280538016, 'constant_value': 4052.83797181182, 'nu': 1.5}. Best is trial 959 with value: 0.1375110730946576.
[I 2024-12-04 20:48:30,242] Trial 1544 finished with value: 0.142495035623811 and parameters: {'kernel_type': 'Matern', 'length_scale': 60.37739216915176, 'noise_level': 0.007178945095305514, 'constant_value': 7269.644066194873, 'nu': 1.5}. Best is trial 959 with value: 0.1375110730946576.
[I 2024-12-04 20:48:31,030] Trial 1543 finished with value: 0.9864686819007056 and parameters: {'kernel_type': 'RBF', 'length_scale': 0.0015893171857501234, 'noise_level': 3.9846745652004e-08, 'constant_value': 2.2115052012746297e-07, 'nu': 0.5}. Best is trial 959 with value: 0.1375110730946576.
[I 2024-12-04 20:48:32,897] Trial 1541 finished with value: 0.1424947049709333 and parameters: {'kernel_type': 'Matern', 'length_scale': 0.33317017765489093, 'noise_level': 0.013628423117477464, 'constant_value': 0.2900703662458066, 'nu': 1.5}. Best is trial 959 with value: 0.1375110730946576.
[I 2024-12-04 20:48:33,842] Trial 1545 finished with value: 0.9982171093997111 and parameters: {'kernel_type': 'Matern', 'length_scale': 3.9572117637734556, 'noise_level': 1.4383524318673993e-05, 'constant_value': 12675.042101699992, 'nu': 1.5}. Best is trial 959 with value: 0.1375110730946576.
[I 2024-12-04 20:48:37,505] Trial 1548 finished with value: 0.9982167337468547 and parameters: {'kernel_type': 'Matern', 'length_scale': 0.12132049308734813, 'noise_level': 0.0002931161666228305, 'constant_value': 57152.89680951839, 'nu': 1.5}. Best is trial 959 with value: 0.1375110730946576.
[I 2024-12-04 20:48:38,589] Trial 1546 finished with value: 0.14249522204210469 and parameters: {'kernel_type': 'Matern', 'length_scale': 237.20207824947443, 'noise_level': 0.0007353530497556473, 'constant_value': 9070.264380545002, 'nu': 1.5}. Best is trial 959 with value: 0.1375110730946576.
[I 2024-12-04 20:48:39,748] Trial 1547 finished with value: 0.14249499728958415 and parameters: {'kernel_type': 'Matern', 'length_scale': 11.12723719618764, 'noise_level': 0.027443543327726472, 'constant_value': 5.059896648909329, 'nu': 1.5}. Best is trial 959 with value: 0.1375110730946576.
[I 2024-12-04 20:48:47,310] Trial 1549 finished with value: 0.9864685739601282 and parameters: {'kernel_type': 'Matern', 'length_scale': 0.09499235804234421, 'noise_level': 0.00038643583383361443, 'constant_value': 27734.82306591776, 'nu': 1.5}. Best is trial 959 with value: 0.1375110730946576.
[I 2024-12-04 20:48:47,827] Trial 1550 finished with value: 0.1424950638894992 and parameters: {'kernel_type': 'Matern', 'length_scale': 2.2949396145791576, 'noise_level': 0.0003332316778433117, 'constant_value': 247.03392747990742, 'nu': 1.5}. Best is trial 959 with value: 0.1375110730946576.
[I 2024-12-04 20:48:48,359] Trial 1551 finished with value: 0.14249510027506365 and parameters: {'kernel_type': 'Matern', 'length_scale': 58.417352951386476, 'noise_level': 4.497098403171256e-05, 'constant_value': 871.3630427759699, 'nu': 1.5}. Best is trial 959 with value: 0.1375110730946576.
[I 2024-12-04 20:48:52,136] Trial 1552 finished with value: 0.98646868192269 and parameters: {'kernel_type': 'Matern', 'length_scale': 690.4710392498896, 'noise_level': 6.246849376628382e-07, 'constant_value': 1683.818795873097, 'nu': 1.5}. Best is trial 959 with value: 0.1375110730946576.
[I 2024-12-04 20:48:55,780] Trial 1554 finished with value: 0.1424948709600307 and parameters: {'kernel_type': 'Matern', 'length_scale': 11.064970481644421, 'noise_level': 0.0005281837675682079, 'constant_value': 3118.7313779209303, 'nu': 1.5}. Best is trial 959 with value: 0.1375110730946576.
[I 2024-12-04 20:48:56,190] Trial 1553 finished with value: 0.14249506135317788 and parameters: {'kernel_type': 'Matern', 'length_scale': 50.84623320124738, 'noise_level': 6.720946879147326e-05, 'constant_value': 13665.329154995543, 'nu': 1.5}. Best is trial 959 with value: 0.1375110730946576.
[I 2024-12-04 20:49:03,800] Trial 1555 finished with value: 0.1424950616729944 and parameters: {'kernel_type': 'Matern', 'length_scale': 11.611386430113727, 'noise_level': 8.992274601040564e-05, 'constant_value': 11488.624827182319, 'nu': 1.5}. Best is trial 959 with value: 0.1375110730946576.
[I 2024-12-04 20:49:13,490] Trial 1557 finished with value: 0.14249506169189946 and parameters: {'kernel_type': 'Matern', 'length_scale': 1.3967377215507577, 'noise_level': 0.00028732422050355177, 'constant_value': 41300.18880779879, 'nu': 1.5}. Best is trial 959 with value: 0.1375110730946576.
[I 2024-12-04 20:49:20,605] Trial 1558 finished with value: 0.1477103518357205 and parameters: {'kernel_type': 'RBF', 'length_scale': 1.9336914010920585, 'noise_level': 0.013231571790897586, 'constant_value': 99282.12071712759, 'nu': 1.5}. Best is trial 959 with value: 0.1375110730946576.
[I 2024-12-04 20:49:20,606] Trial 1556 finished with value: 0.9864686819314863 and parameters: {'kernel_type': 'Matern', 'length_scale': 0.021727448575320166, 'noise_level': 0.74069214133398, 'constant_value': 0.003928880894602264, 'nu': 1.5}. Best is trial 959 with value: 0.1375110730946576.
[I 2024-12-04 20:49:25,750] Trial 1559 finished with value: 0.14249506526086347 and parameters: {'kernel_type': 'Matern', 'length_scale': 5.053984120989498, 'noise_level': 0.0004538381429574682, 'constant_value': 1753.095588610534, 'nu': 1.5}. Best is trial 959 with value: 0.1375110730946576.
[I 2024-12-04 20:49:26,638] Trial 1560 finished with value: 0.9864679163356063 and parameters: {'kernel_type': 'Matern', 'length_scale': 0.10709677314650727, 'noise_level': 0.0016457581559220858, 'constant_value': 53659.78660763763, 'nu': 1.5}. Best is trial 959 with value: 0.1375110730946576.
[I 2024-12-04 20:49:29,743] Trial 1561 finished with value: 0.14249504766987078 and parameters: {'kernel_type': 'Matern', 'length_scale': 28.248759446260916, 'noise_level': 0.7051013090630528, 'constant_value': 0.10869209532470551, 'nu': 1.5}. Best is trial 959 with value: 0.1375110730946576.
[I 2024-12-04 20:49:30,192] Trial 1563 finished with value: 0.9982167251934628 and parameters: {'kernel_type': 'RBF', 'length_scale': 0.0010625313847232075, 'noise_level': 0.14421021860665864, 'constant_value': 1.6629654090514107e-07, 'nu': 0.5}. Best is trial 959 with value: 0.1375110730946576.
[I 2024-12-04 20:49:33,826] Trial 1562 finished with value: 0.9864686819365078 and parameters: {'kernel_type': 'Matern', 'length_scale': 0.06056660521030954, 'noise_level': 0.9847607018636526, 'constant_value': 0.10265091923804208, 'nu': 1.5}. Best is trial 959 with value: 0.1375110730946576.
[I 2024-12-04 20:49:34,704] Trial 1564 finished with value: 0.9982167338029482 and parameters: {'kernel_type': 'Matern', 'length_scale': 0.09280535946237847, 'noise_level': 5.201715631346201e-06, 'constant_value': 39385.36873921958, 'nu': 1.5}. Best is trial 959 with value: 0.1375110730946576.
[I 2024-12-04 20:49:37,422] Trial 1565 finished with value: 0.14249488261322824 and parameters: {'kernel_type': 'Matern', 'length_scale': 1.4331025290404253, 'noise_level': 0.0009535910080083095, 'constant_value': 31737.299418167317, 'nu': 1.5}. Best is trial 959 with value: 0.1375110730946576.
[I 2024-12-04 20:49:38,288] Trial 1566 finished with value: 0.9982154095648849 and parameters: {'kernel_type': 'RBF', 'length_scale': 0.291427850305171, 'noise_level': 0.8199454274720323, 'constant_value': 4.3643156205041844e-05, 'nu': 1.5}. Best is trial 959 with value: 0.1375110730946576.
[I 2024-12-04 20:49:42,734] Trial 1567 finished with value: 0.1424951310222741 and parameters: {'kernel_type': 'Matern', 'length_scale': 17.76909399580377, 'noise_level': 0.06051383085270525, 'constant_value': 7.070936962544259, 'nu': 1.5}. Best is trial 959 with value: 0.1375110730946576.
[I 2024-12-04 20:49:43,781] Trial 1569 finished with value: 0.9864686683807777 and parameters: {'kernel_type': 'Matern', 'length_scale': 0.084875274724431, 'noise_level': 0.0033195522038278785, 'constant_value': 108.69118964650784, 'nu': 1.5}. Best is trial 959 with value: 0.1375110730946576.
[I 2024-12-04 20:49:54,373] Trial 1568 finished with value: 0.9864686819513337 and parameters: {'kernel_type': 'Matern', 'length_scale': 65326.31660469223, 'noise_level': 0.0486387267620914, 'constant_value': 325.11589043866434, 'nu': 2.5}. Best is trial 959 with value: 0.1375110730946576.
[I 2024-12-04 20:49:57,470] Trial 1570 finished with value: 0.142495096272578 and parameters: {'kernel_type': 'Matern', 'length_scale': 65.0381534263384, 'noise_level': 0.00036692725040886754, 'constant_value': 38212.09780227097, 'nu': 1.5}. Best is trial 959 with value: 0.1375110730946576.
[I 2024-12-04 20:50:07,712] Trial 1571 finished with value: 0.9864686819189626 and parameters: {'kernel_type': 'Matern', 'length_scale': 0.012209761899083927, 'noise_level': 0.0017626979428957282, 'constant_value': 9.500269957007302e-06, 'nu': 0.5}. Best is trial 959 with value: 0.1375110730946576.
[I 2024-12-04 20:50:10,879] Trial 1572 finished with value: 0.1424945796153417 and parameters: {'kernel_type': 'Matern', 'length_scale': 3.0006187708000214, 'noise_level': 0.003196617222731721, 'constant_value': 20149.720866894462, 'nu': 1.5}. Best is trial 959 with value: 0.1375110730946576.
[I 2024-12-04 20:50:13,242] Trial 1573 finished with value: 0.1477096294387887 and parameters: {'kernel_type': 'RBF', 'length_scale': 8653.462826668732, 'noise_level': 0.20464102140181661, 'constant_value': 9.09861178668376, 'nu': 2.5}. Best is trial 959 with value: 0.1375110730946576.
[I 2024-12-04 20:50:15,726] Trial 1574 finished with value: 0.1477103397190436 and parameters: {'kernel_type': 'RBF', 'length_scale': 7.380311288523161, 'noise_level': 0.0007807228488585316, 'constant_value': 9.66218187234377, 'nu': 0.5}. Best is trial 959 with value: 0.1375110730946576.
[I 2024-12-04 20:50:19,913] Trial 1575 finished with value: 0.14249509738440436 and parameters: {'kernel_type': 'Matern', 'length_scale': 3.155557646341156, 'noise_level': 0.00020761566052402816, 'constant_value': 49410.8264612938, 'nu': 1.5}. Best is trial 959 with value: 0.1375110730946576.
[I 2024-12-04 20:50:23,029] Trial 1576 finished with value: 0.14249507399168093 and parameters: {'kernel_type': 'Matern', 'length_scale': 19.278174088173273, 'noise_level': 0.08326329729201332, 'constant_value': 4.5721145779308, 'nu': 1.5}. Best is trial 959 with value: 0.1375110730946576.
[I 2024-12-04 20:50:25,246] Trial 1577 finished with value: 0.9864686819290722 and parameters: {'kernel_type': 'Matern', 'length_scale': 69394.15706902539, 'noise_level': 0.0022652200333152044, 'constant_value': 3497.675410523358, 'nu': 1.5}. Best is trial 959 with value: 0.1375110730946576.
[I 2024-12-04 20:50:29,037] Trial 1578 finished with value: 0.13788909061691138 and parameters: {'kernel_type': 'Matern', 'length_scale': 296.15772406683885, 'noise_level': 0.9395995452933867, 'constant_value': 3.60976529753892, 'nu': 1.5}. Best is trial 959 with value: 0.1375110730946576.
[I 2024-12-04 20:50:29,938] Trial 1579 finished with value: 0.1424950632071293 and parameters: {'kernel_type': 'Matern', 'length_scale': 5.564033065551738, 'noise_level': 0.9837220508651429, 'constant_value': 0.10874559374460151, 'nu': 1.5}. Best is trial 959 with value: 0.1375110730946576.
[I 2024-12-04 20:50:32,809] Trial 1580 finished with value: 0.14249506900114406 and parameters: {'kernel_type': 'Matern', 'length_scale': 1.7649988805829597, 'noise_level': 0.025263537032417672, 'constant_value': 12.272576919139704, 'nu': 1.5}. Best is trial 959 with value: 0.1375110730946576.
[I 2024-12-04 20:50:38,432] Trial 1581 finished with value: 0.1424950200534051 and parameters: {'kernel_type': 'Matern', 'length_scale': 953.6180544619956, 'noise_level': 0.7728383794739262, 'constant_value': 8.44537171041648, 'nu': 1.5}. Best is trial 959 with value: 0.1375110730946576.
[I 2024-12-04 20:50:38,798] Trial 1582 finished with value: 0.9864686819435393 and parameters: {'kernel_type': 'Matern', 'length_scale': 426.87868311310194, 'noise_level': 0.042677755094959226, 'constant_value': 0.5519472621539289, 'nu': 1.5}. Best is trial 959 with value: 0.1375110730946576.
[I 2024-12-04 20:50:41,261] Trial 1583 finished with value: 0.1424949752347479 and parameters: {'kernel_type': 'Matern', 'length_scale': 25299.06267277407, 'noise_level': 0.08330965578950214, 'constant_value': 7.233375776661709, 'nu': 1.5}. Best is trial 959 with value: 0.1375110730946576.
[I 2024-12-04 20:50:46,036] Trial 1585 finished with value: 0.14770929715093767 and parameters: {'kernel_type': 'RBF', 'length_scale': 1.3884845999993631, 'noise_level': 0.9638863157372836, 'constant_value': 0.4399637663494823, 'nu': 1.5}. Best is trial 959 with value: 0.1375110730946576.
[I 2024-12-04 20:50:49,111] Trial 1584 finished with value: 0.9864686819972243 and parameters: {'kernel_type': 'Matern', 'length_scale': 490.7685317544741, 'noise_level': 0.02417709793206724, 'constant_value': 2.717024666816623, 'nu': 1.5}. Best is trial 959 with value: 0.1375110730946576.
[I 2024-12-04 20:50:51,394] Trial 1586 finished with value: 0.9864686815362096 and parameters: {'kernel_type': 'Matern', 'length_scale': 25.182443134399563, 'noise_level': 0.06293950111256648, 'constant_value': 9.142782229318582e-05, 'nu': 1.5}. Best is trial 959 with value: 0.1375110730946576.
[I 2024-12-04 20:50:56,670] Trial 1587 finished with value: 0.1424947673887934 and parameters: {'kernel_type': 'Matern', 'length_scale': 9652.236452279845, 'noise_level': 0.6905423468592532, 'constant_value': 22.908642205902414, 'nu': 1.5}. Best is trial 959 with value: 0.1375110730946576.
[I 2024-12-04 20:51:00,568] Trial 1588 finished with value: 0.14249506333764525 and parameters: {'kernel_type': 'Matern', 'length_scale': 1491.0530688866236, 'noise_level': 0.205700919073775, 'constant_value': 0.10884096360368772, 'nu': 1.5}. Best is trial 959 with value: 0.1375110730946576.
[I 2024-12-04 20:51:00,670] Trial 1589 finished with value: 0.14249506245823323 and parameters: {'kernel_type': 'Matern', 'length_scale': 794.462369203161, 'noise_level': 0.7666660939191019, 'constant_value': 1.323815561437173, 'nu': 1.5}. Best is trial 959 with value: 0.1375110730946576.
[I 2024-12-04 20:51:03,896] Trial 1590 finished with value: 0.19720000191992326 and parameters: {'kernel_type': 'Matern', 'length_scale': 45.04580351615997, 'noise_level': 0.23154261393042752, 'constant_value': 0.02791825106334564, 'nu': 0.5}. Best is trial 959 with value: 0.1375110730946576.
[I 2024-12-04 20:51:05,411] Trial 1591 finished with value: 0.9982167338039367 and parameters: {'kernel_type': 'RBF', 'length_scale': 0.0009547297351006295, 'noise_level': 8.185390944085729e-06, 'constant_value': 1152.495976647604, 'nu': 1.5}. Best is trial 959 with value: 0.1375110730946576.
[I 2024-12-04 20:51:09,904] Trial 1592 finished with value: 0.14249514925528575 and parameters: {'kernel_type': 'Matern', 'length_scale': 108.81939227589574, 'noise_level': 0.7204683747656538, 'constant_value': 2.2984446870900546, 'nu': 1.5}. Best is trial 959 with value: 0.1375110730946576.
[I 2024-12-04 20:51:09,907] Trial 1593 finished with value: 0.9864686818347903 and parameters: {'kernel_type': 'Matern', 'length_scale': 6.628553852541924e-05, 'noise_level': 0.5558581289390133, 'constant_value': 23.634828678063762, 'nu': 1.5}. Best is trial 959 with value: 0.1375110730946576.
[I 2024-12-04 20:51:14,269] Trial 1594 finished with value: 0.1424950625361208 and parameters: {'kernel_type': 'Matern', 'length_scale': 272.60324590248337, 'noise_level': 0.6288370620422271, 'constant_value': 0.7476917681188409, 'nu': 1.5}. Best is trial 959 with value: 0.1375110730946576.
[I 2024-12-04 20:51:15,213] Trial 1595 finished with value: 0.9864686819209265 and parameters: {'kernel_type': 'Matern', 'length_scale': 0.005492905962178138, 'noise_level': 0.00842790641873475, 'constant_value': 47.40994549597387, 'nu': 2.5}. Best is trial 959 with value: 0.1375110730946576.
[I 2024-12-04 20:51:19,250] Trial 1596 finished with value: 0.14249506086878505 and parameters: {'kernel_type': 'Matern', 'length_scale': 2191.379694674323, 'noise_level': 0.7242798149492458, 'constant_value': 10.063282570974726, 'nu': 1.5}. Best is trial 959 with value: 0.1375110730946576.
[I 2024-12-04 20:51:19,997] Trial 1597 finished with value: 0.1477104533228748 and parameters: {'kernel_type': 'RBF', 'length_scale': 42.02141940330474, 'noise_level': 0.1518778423322043, 'constant_value': 194.44759543280514, 'nu': 1.5}. Best is trial 959 with value: 0.1375110730946576.
[I 2024-12-04 20:51:25,190] Trial 1599 finished with value: 0.14469885891765796 and parameters: {'kernel_type': 'Matern', 'length_scale': 2.394469745640096, 'noise_level': 0.0006295334077585599, 'constant_value': 30932.35330971334, 'nu': 2.5}. Best is trial 959 with value: 0.1375110730946576.
[I 2024-12-04 20:51:26,055] Trial 1598 finished with value: 0.9864686819132175 and parameters: {'kernel_type': 'RBF', 'length_scale': 0.025433094014780416, 'noise_level': 5.6631871996583e-07, 'constant_value': 0.5648973715333403, 'nu': 1.5}. Best is trial 959 with value: 0.1375110730946576.
[I 2024-12-04 20:51:27,424] Trial 1600 finished with value: 0.14249506683234986 and parameters: {'kernel_type': 'Matern', 'length_scale': 2.2537054176462026, 'noise_level': 0.6111041339186741, 'constant_value': 0.7833474231234987, 'nu': 1.5}. Best is trial 959 with value: 0.1375110730946576.
