[I 2024-12-04 12:05:38,790] Trial 880 finished with value: 0.4896430175521311 and parameters: {'n_estimators': 162, 'max_depth': 35, 'min_samples_split': 5, 'min_samples_leaf': 1, 'max_features': 'log2', 'bootstrap': False, 'criterion': 'squared_error'}. Best is trial 341 with value: 0.2909369124469028.
[I 2024-12-04 12:05:38,936] Trial 872 finished with value: 0.31181550641975325 and parameters: {'n_estimators': 222, 'max_depth': 41, 'min_samples_split': 2, 'min_samples_leaf': 1, 'max_features': 'sqrt', 'bootstrap': False, 'criterion': 'squared_error'}. Best is trial 341 with value: 0.2909369124469028.
[I 2024-12-04 12:05:41,076] Trial 863 finished with value: 0.3877622720053569 and parameters: {'n_estimators': 350, 'max_depth': 48, 'min_samples_split': 2, 'min_samples_leaf': 1, 'max_features': None, 'bootstrap': False, 'criterion': 'squared_error'}. Best is trial 341 with value: 0.2909369124469028.
[I 2024-12-04 12:05:41,608] Trial 871 finished with value: 0.3153813590791225 and parameters: {'n_estimators': 251, 'max_depth': 42, 'min_samples_split': 5, 'min_samples_leaf': 1, 'max_features': 'sqrt', 'bootstrap': False, 'criterion': 'squared_error'}. Best is trial 341 with value: 0.2909369124469028.
[I 2024-12-04 12:05:42,657] Trial 861 finished with value: 0.3156747939559756 and parameters: {'n_estimators': 775, 'max_depth': 50, 'min_samples_split': 3, 'min_samples_leaf': 1, 'max_features': 'sqrt', 'bootstrap': True, 'criterion': 'squared_error'}. Best is trial 341 with value: 0.2909369124469028.
[I 2024-12-04 12:05:45,299] Trial 878 finished with value: 0.4444469127819456 and parameters: {'n_estimators': 420, 'max_depth': 41, 'min_samples_split': 4, 'min_samples_leaf': 2, 'max_features': 'sqrt', 'bootstrap': False, 'criterion': 'squared_error'}. Best is trial 341 with value: 0.2909369124469028.
[I 2024-12-04 12:05:47,530] Trial 849 finished with value: 0.4694030521712005 and parameters: {'n_estimators': 597, 'max_depth': 29, 'min_samples_split': 32, 'min_samples_leaf': 1, 'max_features': 'sqrt', 'bootstrap': True, 'criterion': 'absolute_error'}. Best is trial 341 with value: 0.2909369124469028.
[I 2024-12-04 12:05:47,785] Trial 877 finished with value: 0.31389458519187 and parameters: {'n_estimators': 360, 'max_depth': 40, 'min_samples_split': 4, 'min_samples_leaf': 1, 'max_features': 'sqrt', 'bootstrap': False, 'criterion': 'squared_error'}. Best is trial 341 with value: 0.2909369124469028.
[I 2024-12-04 12:05:49,575] Trial 868 finished with value: 0.30214184575516284 and parameters: {'n_estimators': 257, 'max_depth': 42, 'min_samples_split': 3, 'min_samples_leaf': 1, 'max_features': 'sqrt', 'bootstrap': False, 'criterion': 'squared_error'}. Best is trial 341 with value: 0.2909369124469028.
[I 2024-12-04 12:05:49,658] Trial 884 finished with value: 0.4139407273746046 and parameters: {'n_estimators': 404, 'max_depth': 43, 'min_samples_split': 2, 'min_samples_leaf': 1, 'max_features': 'log2', 'bootstrap': False, 'criterion': 'squared_error'}. Best is trial 341 with value: 0.2909369124469028.
[I 2024-12-04 12:05:49,790] Trial 881 finished with value: 0.3042281600495413 and parameters: {'n_estimators': 332, 'max_depth': 44, 'min_samples_split': 2, 'min_samples_leaf': 1, 'max_features': 'sqrt', 'bootstrap': False, 'criterion': 'squared_error'}. Best is trial 341 with value: 0.2909369124469028.
[I 2024-12-04 12:05:50,418] Trial 876 finished with value: 0.292187674379594 and parameters: {'n_estimators': 457, 'max_depth': 49, 'min_samples_split': 3, 'min_samples_leaf': 1, 'max_features': 'sqrt', 'bootstrap': False, 'criterion': 'squared_error'}. Best is trial 341 with value: 0.2909369124469028.
[I 2024-12-04 12:05:51,076] Trial 879 finished with value: 0.2944153029787467 and parameters: {'n_estimators': 410, 'max_depth': 50, 'min_samples_split': 3, 'min_samples_leaf': 1, 'max_features': 'sqrt', 'bootstrap': False, 'criterion': 'squared_error'}. Best is trial 341 with value: 0.2909369124469028.
[I 2024-12-04 12:05:52,316] Trial 882 finished with value: 0.3051703565249799 and parameters: {'n_estimators': 231, 'max_depth': 50, 'min_samples_split': 3, 'min_samples_leaf': 1, 'max_features': 'sqrt', 'bootstrap': False, 'criterion': 'absolute_error'}. Best is trial 341 with value: 0.2909369124469028.
[I 2024-12-04 12:05:52,650] Trial 885 finished with value: 0.2983774079276065 and parameters: {'n_estimators': 216, 'max_depth': 50, 'min_samples_split': 2, 'min_samples_leaf': 1, 'max_features': 'sqrt', 'bootstrap': False, 'criterion': 'squared_error'}. Best is trial 341 with value: 0.2909369124469028.
[I 2024-12-04 12:05:53,615] Trial 886 finished with value: 0.2982128247407617 and parameters: {'n_estimators': 350, 'max_depth': 50, 'min_samples_split': 2, 'min_samples_leaf': 1, 'max_features': 'sqrt', 'bootstrap': False, 'criterion': 'squared_error'}. Best is trial 341 with value: 0.2909369124469028.
[I 2024-12-04 12:05:53,839] Trial 890 finished with value: 0.4414759734706017 and parameters: {'n_estimators': 361, 'max_depth': 50, 'min_samples_split': 3, 'min_samples_leaf': 2, 'max_features': 'sqrt', 'bootstrap': False, 'criterion': 'squared_error'}. Best is trial 341 with value: 0.2909369124469028.
[I 2024-12-04 12:05:53,843] Trial 883 finished with value: 0.29522481854521576 and parameters: {'n_estimators': 249, 'max_depth': 50, 'min_samples_split': 3, 'min_samples_leaf': 1, 'max_features': 'sqrt', 'bootstrap': False, 'criterion': 'squared_error'}. Best is trial 341 with value: 0.2909369124469028.
[I 2024-12-04 12:05:56,242] Trial 887 finished with value: 0.4179467133783855 and parameters: {'n_estimators': 462, 'max_depth': 46, 'min_samples_split': 7, 'min_samples_leaf': 1, 'max_features': 'log2', 'bootstrap': False, 'criterion': 'squared_error'}. Best is trial 341 with value: 0.2909369124469028.
[I 2024-12-04 12:05:56,576] Trial 749 finished with value: 0.3333576831084158 and parameters: {'n_estimators': 643, 'max_depth': 38, 'min_samples_split': 4, 'min_samples_leaf': 1, 'max_features': None, 'bootstrap': True, 'criterion': 'absolute_error'}. Best is trial 341 with value: 0.2909369124469028.
[I 2024-12-04 12:05:56,745] Trial 873 finished with value: 0.472237409933477 and parameters: {'n_estimators': 454, 'max_depth': 50, 'min_samples_split': 28, 'min_samples_leaf': 2, 'max_features': 'sqrt', 'bootstrap': False, 'criterion': 'absolute_error'}. Best is trial 341 with value: 0.2909369124469028.
[I 2024-12-04 12:05:57,378] Trial 892 finished with value: 0.37347026048380316 and parameters: {'n_estimators': 201, 'max_depth': 38, 'min_samples_split': 11, 'min_samples_leaf': 3, 'max_features': None, 'bootstrap': True, 'criterion': 'squared_error'}. Best is trial 341 with value: 0.2909369124469028.
[I 2024-12-04 12:05:57,528] Trial 893 finished with value: 0.34827431488659527 and parameters: {'n_estimators': 480, 'max_depth': 35, 'min_samples_split': 7, 'min_samples_leaf': 1, 'max_features': 'sqrt', 'bootstrap': False, 'criterion': 'squared_error'}. Best is trial 341 with value: 0.2909369124469028.
[I 2024-12-04 12:05:58,848] Trial 888 finished with value: 0.32304865980220593 and parameters: {'n_estimators': 642, 'max_depth': 38, 'min_samples_split': 4, 'min_samples_leaf': 1, 'max_features': 'sqrt', 'bootstrap': False, 'criterion': 'squared_error'}. Best is trial 341 with value: 0.2909369124469028.
[I 2024-12-04 12:05:59,308] Trial 889 finished with value: 0.2966476778268573 and parameters: {'n_estimators': 417, 'max_depth': 46, 'min_samples_split': 3, 'min_samples_leaf': 1, 'max_features': 'sqrt', 'bootstrap': False, 'criterion': 'squared_error'}. Best is trial 341 with value: 0.2909369124469028.
[I 2024-12-04 12:05:59,465] Trial 866 finished with value: 0.353367202697752 and parameters: {'n_estimators': 616, 'max_depth': 47, 'min_samples_split': 6, 'min_samples_leaf': 1, 'max_features': 'sqrt', 'bootstrap': True, 'criterion': 'absolute_error'}. Best is trial 341 with value: 0.2909369124469028.
[I 2024-12-04 12:05:59,598] Trial 891 finished with value: 0.3668867289547918 and parameters: {'n_estimators': 120, 'max_depth': 42, 'min_samples_split': 10, 'min_samples_leaf': 1, 'max_features': 'sqrt', 'bootstrap': True, 'criterion': 'squared_error'}. Best is trial 341 with value: 0.2909369124469028.
[I 2024-12-04 12:06:00,198] Trial 897 finished with value: 0.30139006807868063 and parameters: {'n_estimators': 510, 'max_depth': 46, 'min_samples_split': 2, 'min_samples_leaf': 1, 'max_features': 'sqrt', 'bootstrap': False, 'criterion': 'squared_error'}. Best is trial 341 with value: 0.2909369124469028.
[I 2024-12-04 12:06:00,489] Trial 874 finished with value: 0.5139646866831447 and parameters: {'n_estimators': 535, 'max_depth': 5, 'min_samples_split': 10, 'min_samples_leaf': 9, 'max_features': None, 'bootstrap': True, 'criterion': 'absolute_error'}. Best is trial 341 with value: 0.2909369124469028.
[I 2024-12-04 12:06:00,831] Trial 894 finished with value: 0.30268456570182517 and parameters: {'n_estimators': 520, 'max_depth': 42, 'min_samples_split': 3, 'min_samples_leaf': 1, 'max_features': 'sqrt', 'bootstrap': False, 'criterion': 'squared_error'}. Best is trial 341 with value: 0.2909369124469028.
[I 2024-12-04 12:06:00,929] Trial 899 finished with value: 0.30396592578924136 and parameters: {'n_estimators': 326, 'max_depth': 50, 'min_samples_split': 5, 'min_samples_leaf': 1, 'max_features': 'sqrt', 'bootstrap': False, 'criterion': 'squared_error'}. Best is trial 341 with value: 0.2909369124469028.
[I 2024-12-04 12:06:01,082] Trial 896 finished with value: 0.440732357726947 and parameters: {'n_estimators': 533, 'max_depth': 49, 'min_samples_split': 2, 'min_samples_leaf': 2, 'max_features': 'sqrt', 'bootstrap': False, 'criterion': 'squared_error'}. Best is trial 341 with value: 0.2909369124469028.
[I 2024-12-04 12:06:02,669] Trial 898 finished with value: 0.29435934130103597 and parameters: {'n_estimators': 408, 'max_depth': 48, 'min_samples_split': 3, 'min_samples_leaf': 1, 'max_features': 'sqrt', 'bootstrap': False, 'criterion': 'squared_error'}. Best is trial 341 with value: 0.2909369124469028.
[I 2024-12-04 12:06:03,521] Trial 895 finished with value: 0.29174290488778015 and parameters: {'n_estimators': 527, 'max_depth': 49, 'min_samples_split': 3, 'min_samples_leaf': 1, 'max_features': 'sqrt', 'bootstrap': False, 'criterion': 'squared_error'}. Best is trial 341 with value: 0.2909369124469028.
[I 2024-12-04 12:06:03,965] Trial 900 finished with value: 0.3076046927262251 and parameters: {'n_estimators': 480, 'max_depth': 48, 'min_samples_split': 5, 'min_samples_leaf': 1, 'max_features': 'sqrt', 'bootstrap': False, 'criterion': 'squared_error'}. Best is trial 341 with value: 0.2909369124469028.
[I 2024-12-04 12:06:04,224] Trial 903 finished with value: 0.3095042622542504 and parameters: {'n_estimators': 395, 'max_depth': 42, 'min_samples_split': 4, 'min_samples_leaf': 1, 'max_features': 'sqrt', 'bootstrap': False, 'criterion': 'squared_error'}. Best is trial 341 with value: 0.2909369124469028.
[I 2024-12-04 12:06:06,176] Trial 902 finished with value: 0.6307162142872057 and parameters: {'n_estimators': 187, 'max_depth': 12, 'min_samples_split': 3, 'min_samples_leaf': 2, 'max_features': 'sqrt', 'bootstrap': False, 'criterion': 'squared_error'}. Best is trial 341 with value: 0.2909369124469028.
[I 2024-12-04 12:06:07,532] Trial 901 finished with value: 0.29461322806862755 and parameters: {'n_estimators': 426, 'max_depth': 50, 'min_samples_split': 3, 'min_samples_leaf': 1, 'max_features': 'sqrt', 'bootstrap': False, 'criterion': 'squared_error'}. Best is trial 341 with value: 0.2909369124469028.
[I 2024-12-04 12:06:08,978] Trial 909 finished with value: 0.4410491590699145 and parameters: {'n_estimators': 370, 'max_depth': 50, 'min_samples_split': 4, 'min_samples_leaf': 2, 'max_features': 'sqrt', 'bootstrap': False, 'criterion': 'squared_error'}. Best is trial 341 with value: 0.2909369124469028.
[I 2024-12-04 12:06:09,508] Trial 906 finished with value: 0.38694990295925835 and parameters: {'n_estimators': 234, 'max_depth': 41, 'min_samples_split': 6, 'min_samples_leaf': 1, 'max_features': None, 'bootstrap': False, 'criterion': 'squared_error'}. Best is trial 341 with value: 0.2909369124469028.
[I 2024-12-04 12:06:13,706] Trial 910 finished with value: 0.44301126529395635 and parameters: {'n_estimators': 412, 'max_depth': 42, 'min_samples_split': 2, 'min_samples_leaf': 2, 'max_features': 'sqrt', 'bootstrap': False, 'criterion': 'squared_error'}. Best is trial 341 with value: 0.2909369124469028.
[I 2024-12-04 12:06:14,369] Trial 907 finished with value: 0.30004496544202075 and parameters: {'n_estimators': 717, 'max_depth': 44, 'min_samples_split': 3, 'min_samples_leaf': 1, 'max_features': 'sqrt', 'bootstrap': False, 'criterion': 'squared_error'}. Best is trial 341 with value: 0.2909369124469028.
[I 2024-12-04 12:06:17,217] Trial 913 finished with value: 0.5534534332681077 and parameters: {'n_estimators': 469, 'max_depth': 30, 'min_samples_split': 20, 'min_samples_leaf': 1, 'max_features': 'log2', 'bootstrap': False, 'criterion': 'squared_error'}. Best is trial 341 with value: 0.2909369124469028.
[I 2024-12-04 12:06:18,696] Trial 911 finished with value: 0.3106070050255522 and parameters: {'n_estimators': 466, 'max_depth': 42, 'min_samples_split': 4, 'min_samples_leaf': 1, 'max_features': 'sqrt', 'bootstrap': False, 'criterion': 'squared_error'}. Best is trial 341 with value: 0.2909369124469028.
[I 2024-12-04 12:06:21,515] Trial 912 finished with value: 0.8695407422038653 and parameters: {'n_estimators': 459, 'max_depth': 8, 'min_samples_split': 3, 'min_samples_leaf': 10, 'max_features': 'sqrt', 'bootstrap': True, 'criterion': 'squared_error'}. Best is trial 341 with value: 0.2909369124469028.
[I 2024-12-04 12:06:22,189] Trial 915 finished with value: 0.8697258172628267 and parameters: {'n_estimators': 481, 'max_depth': 46, 'min_samples_split': 3, 'min_samples_leaf': 3, 'max_features': 'log2', 'bootstrap': True, 'criterion': 'absolute_error'}. Best is trial 341 with value: 0.2909369124469028.
[I 2024-12-04 12:06:23,080] Trial 815 finished with value: 0.47453177228707094 and parameters: {'n_estimators': 534, 'max_depth': 13, 'min_samples_split': 33, 'min_samples_leaf': 2, 'max_features': None, 'bootstrap': False, 'criterion': 'absolute_error'}. Best is trial 341 with value: 0.2909369124469028.
[I 2024-12-04 12:06:24,576] Trial 858 finished with value: 0.5171216074994638 and parameters: {'n_estimators': 930, 'max_depth': 24, 'min_samples_split': 6, 'min_samples_leaf': 10, 'max_features': None, 'bootstrap': False, 'criterion': 'absolute_error'}. Best is trial 341 with value: 0.2909369124469028.
[I 2024-12-04 12:06:25,483] Trial 875 finished with value: 0.44697781797766917 and parameters: {'n_estimators': 445, 'max_depth': 7, 'min_samples_split': 19, 'min_samples_leaf': 1, 'max_features': None, 'bootstrap': True, 'criterion': 'absolute_error'}. Best is trial 341 with value: 0.2909369124469028.
[I 2024-12-04 12:06:25,762] Trial 920 finished with value: 0.31345686203854517 and parameters: {'n_estimators': 605, 'max_depth': 47, 'min_samples_split': 6, 'min_samples_leaf': 1, 'max_features': 'sqrt', 'bootstrap': False, 'criterion': 'squared_error'}. Best is trial 341 with value: 0.2909369124469028.
[I 2024-12-04 12:06:25,852] Trial 918 finished with value: 0.8943295062012353 and parameters: {'n_estimators': 697, 'max_depth': 47, 'min_samples_split': 5, 'min_samples_leaf': 5, 'max_features': 'log2', 'bootstrap': False, 'criterion': 'absolute_error'}. Best is trial 341 with value: 0.2909369124469028.
[I 2024-12-04 12:06:25,887] Trial 917 finished with value: 0.2966475701897655 and parameters: {'n_estimators': 510, 'max_depth': 48, 'min_samples_split': 2, 'min_samples_leaf': 1, 'max_features': 'sqrt', 'bootstrap': False, 'criterion': 'squared_error'}. Best is trial 341 with value: 0.2909369124469028.
[I 2024-12-04 12:06:26,176] Trial 908 finished with value: 0.2947850370224552 and parameters: {'n_estimators': 834, 'max_depth': 48, 'min_samples_split': 3, 'min_samples_leaf': 1, 'max_features': 'sqrt', 'bootstrap': False, 'criterion': 'squared_error'}. Best is trial 341 with value: 0.2909369124469028.
[I 2024-12-04 12:06:27,667] Trial 925 finished with value: 0.4403490207286439 and parameters: {'n_estimators': 550, 'max_depth': 50, 'min_samples_split': 2, 'min_samples_leaf': 2, 'max_features': 'sqrt', 'bootstrap': False, 'criterion': 'squared_error'}. Best is trial 341 with value: 0.2909369124469028.
[I 2024-12-04 12:06:27,737] Trial 922 finished with value: 0.29413520013509387 and parameters: {'n_estimators': 457, 'max_depth': 50, 'min_samples_split': 3, 'min_samples_leaf': 1, 'max_features': 'sqrt', 'bootstrap': False, 'criterion': 'squared_error'}. Best is trial 341 with value: 0.2909369124469028.
[I 2024-12-04 12:06:28,159] Trial 916 finished with value: 0.418097833232468 and parameters: {'n_estimators': 517, 'max_depth': 27, 'min_samples_split': 29, 'min_samples_leaf': 1, 'max_features': None, 'bootstrap': False, 'criterion': 'squared_error'}. Best is trial 341 with value: 0.2909369124469028.
[I 2024-12-04 12:06:28,428] Trial 904 finished with value: 0.3045251722116994 and parameters: {'n_estimators': 518, 'max_depth': 50, 'min_samples_split': 3, 'min_samples_leaf': 1, 'max_features': 'sqrt', 'bootstrap': False, 'criterion': 'absolute_error'}. Best is trial 341 with value: 0.2909369124469028.
[I 2024-12-04 12:06:28,607] Trial 914 finished with value: 0.294136868784312 and parameters: {'n_estimators': 391, 'max_depth': 50, 'min_samples_split': 3, 'min_samples_leaf': 1, 'max_features': 'sqrt', 'bootstrap': False, 'criterion': 'squared_error'}. Best is trial 341 with value: 0.2909369124469028.
[I 2024-12-04 12:06:29,861] Trial 928 finished with value: 0.293456974811569 and parameters: {'n_estimators': 512, 'max_depth': 50, 'min_samples_split': 3, 'min_samples_leaf': 1, 'max_features': 'sqrt', 'bootstrap': False, 'criterion': 'squared_error'}. Best is trial 341 with value: 0.2909369124469028.
[I 2024-12-04 12:06:30,755] Trial 927 finished with value: 0.4809742347164196 and parameters: {'n_estimators': 659, 'max_depth': 41, 'min_samples_split': 4, 'min_samples_leaf': 2, 'max_features': 'sqrt', 'bootstrap': True, 'criterion': 'squared_error'}. Best is trial 341 with value: 0.2909369124469028.
[I 2024-12-04 12:06:30,890] Trial 923 finished with value: 0.3054516354056144 and parameters: {'n_estimators': 552, 'max_depth': 46, 'min_samples_split': 4, 'min_samples_leaf': 1, 'max_features': 'sqrt', 'bootstrap': False, 'criterion': 'squared_error'}. Best is trial 341 with value: 0.2909369124469028.
[I 2024-12-04 12:06:31,120] Trial 932 finished with value: 0.31586681150561396 and parameters: {'n_estimators': 103, 'max_depth': 45, 'min_samples_split': 5, 'min_samples_leaf': 1, 'max_features': 'sqrt', 'bootstrap': False, 'criterion': 'squared_error'}. Best is trial 341 with value: 0.2909369124469028.
[I 2024-12-04 12:06:31,525] Trial 933 finished with value: 0.3015117846619122 and parameters: {'n_estimators': 703, 'max_depth': 50, 'min_samples_split': 4, 'min_samples_leaf': 1, 'max_features': 'sqrt', 'bootstrap': False, 'criterion': 'squared_error'}. Best is trial 341 with value: 0.2909369124469028.
[I 2024-12-04 12:06:31,799] Trial 934 finished with value: 0.4425200037727291 and parameters: {'n_estimators': 254, 'max_depth': 50, 'min_samples_split': 2, 'min_samples_leaf': 2, 'max_features': 'sqrt', 'bootstrap': False, 'criterion': 'squared_error'}. Best is trial 341 with value: 0.2909369124469028.
[I 2024-12-04 12:06:32,117] Trial 931 finished with value: 0.2986478490309949 and parameters: {'n_estimators': 577, 'max_depth': 45, 'min_samples_split': 3, 'min_samples_leaf': 1, 'max_features': 'sqrt', 'bootstrap': False, 'criterion': 'squared_error'}. Best is trial 341 with value: 0.2909369124469028.
[I 2024-12-04 12:06:32,150] Trial 926 finished with value: 0.41323176350637725 and parameters: {'n_estimators': 693, 'max_depth': 28, 'min_samples_split': 44, 'min_samples_leaf': 3, 'max_features': None, 'bootstrap': True, 'criterion': 'squared_error'}. Best is trial 341 with value: 0.2909369124469028.
[I 2024-12-04 12:06:32,383] Trial 924 finished with value: 0.44430112070236916 and parameters: {'n_estimators': 646, 'max_depth': 44, 'min_samples_split': 3, 'min_samples_leaf': 2, 'max_features': 'sqrt', 'bootstrap': False, 'criterion': 'squared_error'}. Best is trial 341 with value: 0.2909369124469028.
[I 2024-12-04 12:06:33,541] Trial 938 finished with value: 0.3130228254593421 and parameters: {'n_estimators': 286, 'max_depth': 41, 'min_samples_split': 4, 'min_samples_leaf': 1, 'max_features': 'sqrt', 'bootstrap': False, 'criterion': 'squared_error'}. Best is trial 341 with value: 0.2909369124469028.
[I 2024-12-04 12:06:33,903] Trial 935 finished with value: 0.31054696678026883 and parameters: {'n_estimators': 217, 'max_depth': 41, 'min_samples_split': 2, 'min_samples_leaf': 1, 'max_features': 'sqrt', 'bootstrap': False, 'criterion': 'squared_error'}. Best is trial 341 with value: 0.2909369124469028.
[I 2024-12-04 12:06:34,025] Trial 930 finished with value: 0.29588154917603116 and parameters: {'n_estimators': 485, 'max_depth': 49, 'min_samples_split': 2, 'min_samples_leaf': 1, 'max_features': 'sqrt', 'bootstrap': False, 'criterion': 'squared_error'}. Best is trial 341 with value: 0.2909369124469028.
[I 2024-12-04 12:06:35,865] Trial 929 finished with value: 0.9538856394615155 and parameters: {'n_estimators': 928, 'max_depth': 6, 'min_samples_split': 48, 'min_samples_leaf': 7, 'max_features': 'log2', 'bootstrap': True, 'criterion': 'absolute_error'}. Best is trial 341 with value: 0.2909369124469028.
[I 2024-12-04 12:06:36,712] Trial 939 finished with value: 0.5294052883693396 and parameters: {'n_estimators': 379, 'max_depth': 37, 'min_samples_split': 2, 'min_samples_leaf': 12, 'max_features': None, 'bootstrap': True, 'criterion': 'squared_error'}. Best is trial 341 with value: 0.2909369124469028.
