[I 2024-12-04 12:26:28,464] Trial 2160 finished with value: 0.5455293988830534 and parameters: {'n_estimators': 130, 'max_depth': 16, 'min_samples_split': 11, 'min_samples_leaf': 2, 'max_features': None, 'bootstrap': True, 'criterion': 'absolute_error'}. Best is trial 1749 with value: 0.502720715661024.
[I 2024-12-04 12:26:30,118] Trial 2151 finished with value: 1.0896494342614083 and parameters: {'n_estimators': 542, 'max_depth': 7, 'min_samples_split': 28, 'min_samples_leaf': 1, 'max_features': 'sqrt', 'bootstrap': False, 'criterion': 'absolute_error'}. Best is trial 1749 with value: 0.502720715661024.
[I 2024-12-04 12:26:30,897] Trial 2173 finished with value: 0.5583238176730598 and parameters: {'n_estimators': 105, 'max_depth': 19, 'min_samples_split': 6, 'min_samples_leaf': 2, 'max_features': None, 'bootstrap': True, 'criterion': 'absolute_error'}. Best is trial 1749 with value: 0.502720715661024.
[I 2024-12-04 12:26:33,287] Trial 2171 finished with value: 0.5162686186807676 and parameters: {'n_estimators': 106, 'max_depth': 17, 'min_samples_split': 3, 'min_samples_leaf': 1, 'max_features': None, 'bootstrap': True, 'criterion': 'absolute_error'}. Best is trial 1749 with value: 0.502720715661024.
[I 2024-12-04 12:26:35,101] Trial 2169 finished with value: 1.3172623394392047 and parameters: {'n_estimators': 927, 'max_depth': 5, 'min_samples_split': 16, 'min_samples_leaf': 3, 'max_features': 'log2', 'bootstrap': False, 'criterion': 'absolute_error'}. Best is trial 1749 with value: 0.502720715661024.
[I 2024-12-04 12:26:36,250] Trial 2163 finished with value: 0.5178531603471808 and parameters: {'n_estimators': 245, 'max_depth': 18, 'min_samples_split': 3, 'min_samples_leaf': 1, 'max_features': None, 'bootstrap': True, 'criterion': 'absolute_error'}. Best is trial 1749 with value: 0.502720715661024.
[I 2024-12-04 12:26:41,322] Trial 2161 finished with value: 0.519841625076711 and parameters: {'n_estimators': 241, 'max_depth': 25, 'min_samples_split': 6, 'min_samples_leaf': 1, 'max_features': None, 'bootstrap': True, 'criterion': 'absolute_error'}. Best is trial 1749 with value: 0.502720715661024.
[I 2024-12-04 12:26:43,766] Trial 2174 finished with value: 0.5342951183740184 and parameters: {'n_estimators': 104, 'max_depth': 24, 'min_samples_split': 13, 'min_samples_leaf': 1, 'max_features': None, 'bootstrap': True, 'criterion': 'absolute_error'}. Best is trial 1749 with value: 0.502720715661024.
[I 2024-12-04 12:26:47,127] Trial 2178 finished with value: 0.5404158292995934 and parameters: {'n_estimators': 112, 'max_depth': 6, 'min_samples_split': 5, 'min_samples_leaf': 1, 'max_features': None, 'bootstrap': True, 'criterion': 'absolute_error'}. Best is trial 1749 with value: 0.502720715661024.
[I 2024-12-04 12:26:47,317] Trial 2176 finished with value: 0.5565600051249707 and parameters: {'n_estimators': 103, 'max_depth': 15, 'min_samples_split': 4, 'min_samples_leaf': 2, 'max_features': None, 'bootstrap': True, 'criterion': 'absolute_error'}. Best is trial 1749 with value: 0.502720715661024.
[I 2024-12-04 12:26:47,531] Trial 2175 finished with value: 0.5125565048715093 and parameters: {'n_estimators': 101, 'max_depth': 26, 'min_samples_split': 3, 'min_samples_leaf': 1, 'max_features': None, 'bootstrap': True, 'criterion': 'absolute_error'}. Best is trial 1749 with value: 0.502720715661024.
[I 2024-12-04 12:26:48,124] Trial 2177 finished with value: 0.6686567146261991 and parameters: {'n_estimators': 271, 'max_depth': 49, 'min_samples_split': 3, 'min_samples_leaf': 11, 'max_features': None, 'bootstrap': False, 'criterion': 'absolute_error'}. Best is trial 1749 with value: 0.502720715661024.
[I 2024-12-04 12:26:48,181] Trial 2159 finished with value: 0.5254510909654313 and parameters: {'n_estimators': 256, 'max_depth': 17, 'min_samples_split': 8, 'min_samples_leaf': 1, 'max_features': None, 'bootstrap': True, 'criterion': 'absolute_error'}. Best is trial 1749 with value: 0.502720715661024.
[I 2024-12-04 12:26:48,921] Trial 2167 finished with value: 0.5208548922888558 and parameters: {'n_estimators': 238, 'max_depth': 22, 'min_samples_split': 6, 'min_samples_leaf': 1, 'max_features': None, 'bootstrap': True, 'criterion': 'absolute_error'}. Best is trial 1749 with value: 0.502720715661024.
[I 2024-12-04 12:26:48,935] Trial 2170 finished with value: 0.5270185420676451 and parameters: {'n_estimators': 238, 'max_depth': 20, 'min_samples_split': 7, 'min_samples_leaf': 1, 'max_features': None, 'bootstrap': True, 'criterion': 'absolute_error'}. Best is trial 1749 with value: 0.502720715661024.
[I 2024-12-04 12:26:49,125] Trial 2186 finished with value: 0.516837335843594 and parameters: {'n_estimators': 105, 'max_depth': 10, 'min_samples_split': 4, 'min_samples_leaf': 1, 'max_features': None, 'bootstrap': True, 'criterion': 'absolute_error'}. Best is trial 1749 with value: 0.502720715661024.
[I 2024-12-04 12:26:49,139] Trial 2168 finished with value: 0.518090037630933 and parameters: {'n_estimators': 222, 'max_depth': 19, 'min_samples_split': 3, 'min_samples_leaf': 1, 'max_features': None, 'bootstrap': True, 'criterion': 'absolute_error'}. Best is trial 1749 with value: 0.502720715661024.
[I 2024-12-04 12:26:49,568] Trial 2180 finished with value: 0.5190982297885497 and parameters: {'n_estimators': 101, 'max_depth': 8, 'min_samples_split': 6, 'min_samples_leaf': 1, 'max_features': None, 'bootstrap': True, 'criterion': 'absolute_error'}. Best is trial 1749 with value: 0.502720715661024.
[I 2024-12-04 12:26:49,706] Trial 2187 finished with value: 1.0936538281199677 and parameters: {'n_estimators': 438, 'max_depth': 26, 'min_samples_split': 2, 'min_samples_leaf': 2, 'max_features': 'log2', 'bootstrap': False, 'criterion': 'squared_error'}. Best is trial 1749 with value: 0.502720715661024.
[I 2024-12-04 12:26:49,715] Trial 2156 finished with value: 0.512952049764885 and parameters: {'n_estimators': 458, 'max_depth': 16, 'min_samples_split': 5, 'min_samples_leaf': 1, 'max_features': None, 'bootstrap': True, 'criterion': 'absolute_error'}. Best is trial 1749 with value: 0.502720715661024.
[I 2024-12-04 12:26:50,081] Trial 2189 finished with value: 1.087175482403364 and parameters: {'n_estimators': 260, 'max_depth': 8, 'min_samples_split': 2, 'min_samples_leaf': 1, 'max_features': 'log2', 'bootstrap': False, 'criterion': 'squared_error'}. Best is trial 1749 with value: 0.502720715661024.
[I 2024-12-04 12:26:51,389] Trial 2193 finished with value: 1.1521534726549556 and parameters: {'n_estimators': 148, 'max_depth': 12, 'min_samples_split': 5, 'min_samples_leaf': 1, 'max_features': 'log2', 'bootstrap': True, 'criterion': 'absolute_error'}. Best is trial 1749 with value: 0.502720715661024.
[I 2024-12-04 12:26:51,991] Trial 2185 finished with value: 0.5163440697035149 and parameters: {'n_estimators': 106, 'max_depth': 19, 'min_samples_split': 7, 'min_samples_leaf': 1, 'max_features': None, 'bootstrap': True, 'criterion': 'absolute_error'}. Best is trial 1749 with value: 0.502720715661024.
[I 2024-12-04 12:26:52,057] Trial 2166 finished with value: 0.5142311862109669 and parameters: {'n_estimators': 282, 'max_depth': 16, 'min_samples_split': 6, 'min_samples_leaf': 1, 'max_features': None, 'bootstrap': True, 'criterion': 'absolute_error'}. Best is trial 1749 with value: 0.502720715661024.
[I 2024-12-04 12:26:52,079] Trial 2188 finished with value: 0.553050986523649 and parameters: {'n_estimators': 108, 'max_depth': 19, 'min_samples_split': 3, 'min_samples_leaf': 2, 'max_features': None, 'bootstrap': True, 'criterion': 'absolute_error'}. Best is trial 1749 with value: 0.502720715661024.
[I 2024-12-04 12:26:52,130] Trial 2181 finished with value: 0.5200124460590312 and parameters: {'n_estimators': 104, 'max_depth': 13, 'min_samples_split': 7, 'min_samples_leaf': 1, 'max_features': None, 'bootstrap': True, 'criterion': 'absolute_error'}. Best is trial 1749 with value: 0.502720715661024.
[I 2024-12-04 12:26:52,911] Trial 2184 finished with value: 0.5291618131019755 and parameters: {'n_estimators': 104, 'max_depth': 15, 'min_samples_split': 11, 'min_samples_leaf': 1, 'max_features': None, 'bootstrap': True, 'criterion': 'absolute_error'}. Best is trial 1749 with value: 0.502720715661024.
[I 2024-12-04 12:26:54,004] Trial 2165 finished with value: 0.518419062171282 and parameters: {'n_estimators': 270, 'max_depth': 21, 'min_samples_split': 3, 'min_samples_leaf': 1, 'max_features': None, 'bootstrap': True, 'criterion': 'absolute_error'}. Best is trial 1749 with value: 0.502720715661024.
[I 2024-12-04 12:26:55,154] Trial 2192 finished with value: 1.3359318750371545 and parameters: {'n_estimators': 568, 'max_depth': 10, 'min_samples_split': 2, 'min_samples_leaf': 5, 'max_features': 'log2', 'bootstrap': False, 'criterion': 'absolute_error'}. Best is trial 1749 with value: 0.502720715661024.
[I 2024-12-04 12:26:55,583] Trial 2191 finished with value: 0.5259693142069748 and parameters: {'n_estimators': 102, 'max_depth': 23, 'min_samples_split': 6, 'min_samples_leaf': 1, 'max_features': None, 'bootstrap': True, 'criterion': 'squared_error'}. Best is trial 1749 with value: 0.502720715661024.
[I 2024-12-04 12:26:56,761] Trial 2179 finished with value: 0.5571195595178264 and parameters: {'n_estimators': 274, 'max_depth': 24, 'min_samples_split': 4, 'min_samples_leaf': 2, 'max_features': None, 'bootstrap': True, 'criterion': 'absolute_error'}. Best is trial 1749 with value: 0.502720715661024.
[I 2024-12-04 12:26:57,555] Trial 2195 finished with value: 1.2202628251327199 and parameters: {'n_estimators': 976, 'max_depth': 26, 'min_samples_split': 5, 'min_samples_leaf': 4, 'max_features': 'sqrt', 'bootstrap': True, 'criterion': 'absolute_error'}. Best is trial 1749 with value: 0.502720715661024.
[I 2024-12-04 12:26:57,750] Trial 2194 finished with value: 0.5051882006729784 and parameters: {'n_estimators': 102, 'max_depth': 19, 'min_samples_split': 5, 'min_samples_leaf': 1, 'max_features': None, 'bootstrap': True, 'criterion': 'absolute_error'}. Best is trial 1749 with value: 0.502720715661024.
[I 2024-12-04 12:26:58,041] Trial 2182 finished with value: 0.522586500635816 and parameters: {'n_estimators': 277, 'max_depth': 9, 'min_samples_split': 3, 'min_samples_leaf': 1, 'max_features': None, 'bootstrap': True, 'criterion': 'absolute_error'}. Best is trial 1749 with value: 0.502720715661024.
[I 2024-12-04 12:26:58,098] Trial 2196 finished with value: 1.3320622440348928 and parameters: {'n_estimators': 553, 'max_depth': 46, 'min_samples_split': 4, 'min_samples_leaf': 10, 'max_features': 'sqrt', 'bootstrap': True, 'criterion': 'absolute_error'}. Best is trial 1749 with value: 0.502720715661024.
[I 2024-12-04 12:26:59,681] Trial 2190 finished with value: 0.5131295130695674 and parameters: {'n_estimators': 102, 'max_depth': 28, 'min_samples_split': 6, 'min_samples_leaf': 1, 'max_features': None, 'bootstrap': True, 'criterion': 'absolute_error'}. Best is trial 1749 with value: 0.502720715661024.
[I 2024-12-04 12:27:01,025] Trial 2197 finished with value: 0.5191041102827204 and parameters: {'n_estimators': 102, 'max_depth': 12, 'min_samples_split': 3, 'min_samples_leaf': 1, 'max_features': None, 'bootstrap': True, 'criterion': 'absolute_error'}. Best is trial 1749 with value: 0.502720715661024.
[I 2024-12-04 12:27:04,795] Trial 2202 finished with value: 1.325074935218207 and parameters: {'n_estimators': 453, 'max_depth': 28, 'min_samples_split': 15, 'min_samples_leaf': 3, 'max_features': 'log2', 'bootstrap': True, 'criterion': 'absolute_error'}. Best is trial 1749 with value: 0.502720715661024.
[I 2024-12-04 12:27:04,838] Trial 2200 finished with value: 0.5113542953310699 and parameters: {'n_estimators': 104, 'max_depth': 25, 'min_samples_split': 4, 'min_samples_leaf': 1, 'max_features': None, 'bootstrap': True, 'criterion': 'absolute_error'}. Best is trial 1749 with value: 0.502720715661024.
[I 2024-12-04 12:27:06,642] Trial 2203 finished with value: 0.5096912190655872 and parameters: {'n_estimators': 106, 'max_depth': 25, 'min_samples_split': 5, 'min_samples_leaf': 1, 'max_features': None, 'bootstrap': True, 'criterion': 'absolute_error'}. Best is trial 1749 with value: 0.502720715661024.
[I 2024-12-04 12:27:08,299] Trial 2201 finished with value: 1.150611759886648 and parameters: {'n_estimators': 342, 'max_depth': 50, 'min_samples_split': 3, 'min_samples_leaf': 5, 'max_features': 'sqrt', 'bootstrap': True, 'criterion': 'squared_error'}. Best is trial 1749 with value: 0.502720715661024.
[I 2024-12-04 12:27:08,669] Trial 2211 finished with value: 1.2546106120847287 and parameters: {'n_estimators': 232, 'max_depth': 46, 'min_samples_split': 45, 'min_samples_leaf': 12, 'max_features': 'log2', 'bootstrap': True, 'criterion': 'squared_error'}. Best is trial 1749 with value: 0.502720715661024.
[I 2024-12-04 12:27:09,070] Trial 2212 finished with value: 0.5580371105020998 and parameters: {'n_estimators': 102, 'max_depth': 14, 'min_samples_split': 4, 'min_samples_leaf': 2, 'max_features': None, 'bootstrap': True, 'criterion': 'absolute_error'}. Best is trial 1749 with value: 0.502720715661024.
[I 2024-12-04 12:27:09,178] Trial 2199 finished with value: 0.5104955181856795 and parameters: {'n_estimators': 112, 'max_depth': 22, 'min_samples_split': 5, 'min_samples_leaf': 1, 'max_features': None, 'bootstrap': True, 'criterion': 'absolute_error'}. Best is trial 1749 with value: 0.502720715661024.
[I 2024-12-04 12:27:10,851] Trial 2207 finished with value: 0.6796110530815807 and parameters: {'n_estimators': 113, 'max_depth': 32, 'min_samples_split': 4, 'min_samples_leaf': 1, 'max_features': 'sqrt', 'bootstrap': True, 'criterion': 'absolute_error'}. Best is trial 1749 with value: 0.502720715661024.
[I 2024-12-04 12:27:11,891] Trial 2216 finished with value: 0.5093291654595964 and parameters: {'n_estimators': 100, 'max_depth': 20, 'min_samples_split': 4, 'min_samples_leaf': 1, 'max_features': None, 'bootstrap': True, 'criterion': 'absolute_error'}. Best is trial 1749 with value: 0.502720715661024.
[I 2024-12-04 12:27:12,695] Trial 2206 finished with value: 0.774715938394048 and parameters: {'n_estimators': 633, 'max_depth': 23, 'min_samples_split': 22, 'min_samples_leaf': 1, 'max_features': 'sqrt', 'bootstrap': True, 'criterion': 'squared_error'}. Best is trial 1749 with value: 0.502720715661024.
[I 2024-12-04 12:27:13,261] Trial 2183 finished with value: 0.6226036276391982 and parameters: {'n_estimators': 557, 'max_depth': 44, 'min_samples_split': 21, 'min_samples_leaf': 3, 'max_features': None, 'bootstrap': False, 'criterion': 'absolute_error'}. Best is trial 1749 with value: 0.502720715661024.
[I 2024-12-04 12:27:13,263] Trial 2205 finished with value: 0.5145456776493268 and parameters: {'n_estimators': 100, 'max_depth': 17, 'min_samples_split': 3, 'min_samples_leaf': 1, 'max_features': None, 'bootstrap': True, 'criterion': 'absolute_error'}. Best is trial 1749 with value: 0.502720715661024.
[I 2024-12-04 12:27:13,414] Trial 2215 finished with value: 0.6411799003160746 and parameters: {'n_estimators': 451, 'max_depth': 40, 'min_samples_split': 42, 'min_samples_leaf': 1, 'max_features': 'sqrt', 'bootstrap': False, 'criterion': 'squared_error'}. Best is trial 1749 with value: 0.502720715661024.
[I 2024-12-04 12:27:17,253] Trial 2198 finished with value: 0.5149752118370639 and parameters: {'n_estimators': 250, 'max_depth': 20, 'min_samples_split': 5, 'min_samples_leaf': 1, 'max_features': None, 'bootstrap': True, 'criterion': 'absolute_error'}. Best is trial 1749 with value: 0.502720715661024.
[I 2024-12-04 12:27:20,075] Trial 2221 finished with value: 0.5138346948088809 and parameters: {'n_estimators': 103, 'max_depth': 14, 'min_samples_split': 4, 'min_samples_leaf': 1, 'max_features': None, 'bootstrap': True, 'criterion': 'absolute_error'}. Best is trial 1749 with value: 0.502720715661024.
[I 2024-12-04 12:27:20,681] Trial 2217 finished with value: 0.520969629327119 and parameters: {'n_estimators': 104, 'max_depth': 27, 'min_samples_split': 9, 'min_samples_leaf': 1, 'max_features': None, 'bootstrap': True, 'criterion': 'absolute_error'}. Best is trial 1749 with value: 0.502720715661024.
[I 2024-12-04 12:27:20,795] Trial 2220 finished with value: 0.8155127634727327 and parameters: {'n_estimators': 314, 'max_depth': 47, 'min_samples_split': 37, 'min_samples_leaf': 1, 'max_features': 'log2', 'bootstrap': True, 'criterion': 'squared_error'}. Best is trial 1749 with value: 0.502720715661024.
[I 2024-12-04 12:27:21,203] Trial 2208 finished with value: 0.5171586959833597 and parameters: {'n_estimators': 223, 'max_depth': 15, 'min_samples_split': 3, 'min_samples_leaf': 1, 'max_features': None, 'bootstrap': True, 'criterion': 'absolute_error'}. Best is trial 1749 with value: 0.502720715661024.
[I 2024-12-04 12:27:21,330] Trial 2213 finished with value: 0.5623341443458475 and parameters: {'n_estimators': 239, 'max_depth': 17, 'min_samples_split': 8, 'min_samples_leaf': 2, 'max_features': None, 'bootstrap': True, 'criterion': 'absolute_error'}. Best is trial 1749 with value: 0.502720715661024.
[I 2024-12-04 12:27:22,171] Trial 2224 finished with value: 0.5162064219755069 and parameters: {'n_estimators': 106, 'max_depth': 21, 'min_samples_split': 3, 'min_samples_leaf': 1, 'max_features': None, 'bootstrap': True, 'criterion': 'absolute_error'}. Best is trial 1749 with value: 0.502720715661024.
[I 2024-12-04 12:27:22,674] Trial 2218 finished with value: 0.570280034403651 and parameters: {'n_estimators': 101, 'max_depth': 17, 'min_samples_split': 4, 'min_samples_leaf': 1, 'max_features': None, 'bootstrap': False, 'criterion': 'absolute_error'}. Best is trial 1749 with value: 0.502720715661024.
[I 2024-12-04 12:27:23,906] Trial 2226 finished with value: 0.5244816477335249 and parameters: {'n_estimators': 101, 'max_depth': 8, 'min_samples_split': 3, 'min_samples_leaf': 1, 'max_features': None, 'bootstrap': True, 'criterion': 'absolute_error'}. Best is trial 1749 with value: 0.502720715661024.
[I 2024-12-04 12:27:25,626] Trial 2222 finished with value: 0.5128702553308517 and parameters: {'n_estimators': 105, 'max_depth': 14, 'min_samples_split': 3, 'min_samples_leaf': 1, 'max_features': None, 'bootstrap': True, 'criterion': 'absolute_error'}. Best is trial 1749 with value: 0.502720715661024.
[I 2024-12-04 12:27:25,949] Trial 2210 finished with value: 0.5551609017016225 and parameters: {'n_estimators': 270, 'max_depth': 22, 'min_samples_split': 3, 'min_samples_leaf': 2, 'max_features': None, 'bootstrap': True, 'criterion': 'absolute_error'}. Best is trial 1749 with value: 0.502720715661024.
[I 2024-12-04 12:27:26,087] Trial 2204 finished with value: 0.576449424435141 and parameters: {'n_estimators': 283, 'max_depth': 18, 'min_samples_split': 4, 'min_samples_leaf': 1, 'max_features': None, 'bootstrap': False, 'criterion': 'absolute_error'}. Best is trial 1749 with value: 0.502720715661024.
[I 2024-12-04 12:27:27,619] Trial 2233 finished with value: 0.5534610832134808 and parameters: {'n_estimators': 100, 'max_depth': 13, 'min_samples_split': 7, 'min_samples_leaf': 2, 'max_features': None, 'bootstrap': True, 'criterion': 'absolute_error'}. Best is trial 1749 with value: 0.502720715661024.
[I 2024-12-04 12:27:28,269] Trial 2228 finished with value: 0.9368524643155046 and parameters: {'n_estimators': 319, 'max_depth': 13, 'min_samples_split': 4, 'min_samples_leaf': 1, 'max_features': 'sqrt', 'bootstrap': True, 'criterion': 'absolute_error'}. Best is trial 1749 with value: 0.502720715661024.
[I 2024-12-04 12:27:28,796] Trial 2225 finished with value: 0.5538517159451767 and parameters: {'n_estimators': 117, 'max_depth': 12, 'min_samples_split': 3, 'min_samples_leaf': 2, 'max_features': None, 'bootstrap': True, 'criterion': 'absolute_error'}. Best is trial 1749 with value: 0.502720715661024.
[I 2024-12-04 12:27:28,802] Trial 2223 finished with value: 0.506068614609914 and parameters: {'n_estimators': 107, 'max_depth': 19, 'min_samples_split': 4, 'min_samples_leaf': 1, 'max_features': None, 'bootstrap': True, 'criterion': 'absolute_error'}. Best is trial 1749 with value: 0.502720715661024.
[I 2024-12-04 12:27:29,300] Trial 2227 finished with value: 0.5065438829011432 and parameters: {'n_estimators': 104, 'max_depth': 17, 'min_samples_split': 5, 'min_samples_leaf': 1, 'max_features': None, 'bootstrap': True, 'criterion': 'absolute_error'}. Best is trial 1749 with value: 0.502720715661024.
[I 2024-12-04 12:27:29,953] Trial 2236 finished with value: 0.8495045123614448 and parameters: {'n_estimators': 620, 'max_depth': 37, 'min_samples_split': 44, 'min_samples_leaf': 1, 'max_features': 'log2', 'bootstrap': True, 'criterion': 'squared_error'}. Best is trial 1749 with value: 0.502720715661024.
[I 2024-12-04 12:27:29,985] Trial 2231 finished with value: 0.505626062830932 and parameters: {'n_estimators': 101, 'max_depth': 11, 'min_samples_split': 4, 'min_samples_leaf': 1, 'max_features': None, 'bootstrap': True, 'criterion': 'absolute_error'}. Best is trial 1749 with value: 0.502720715661024.
[I 2024-12-04 12:27:31,123] Trial 2230 finished with value: 0.5592817434087376 and parameters: {'n_estimators': 116, 'max_depth': 21, 'min_samples_split': 7, 'min_samples_leaf': 2, 'max_features': None, 'bootstrap': True, 'criterion': 'absolute_error'}. Best is trial 1749 with value: 0.502720715661024.
[I 2024-12-04 12:27:31,535] Trial 2234 finished with value: 1.148312347015971 and parameters: {'n_estimators': 364, 'max_depth': 5, 'min_samples_split': 21, 'min_samples_leaf': 1, 'max_features': 'log2', 'bootstrap': False, 'criterion': 'squared_error'}. Best is trial 1749 with value: 0.502720715661024.
[I 2024-12-04 12:27:33,857] Trial 2219 finished with value: 0.5162210640779679 and parameters: {'n_estimators': 265, 'max_depth': 18, 'min_samples_split': 3, 'min_samples_leaf': 1, 'max_features': None, 'bootstrap': True, 'criterion': 'absolute_error'}. Best is trial 1749 with value: 0.502720715661024.
