[I 2024-12-04 15:01:18,882] Trial 644 finished with value: 0.42171351449437383 and parameters: {'n_estimators': 632, 'max_depth': 36, 'min_samples_split': 2, 'min_samples_leaf': 1, 'max_features': None, 'bootstrap': True, 'criterion': 'squared_error'}. Best is trial 590 with value: 0.4185444504443197.
[I 2024-12-04 15:01:22,571] Trial 648 finished with value: 0.4237792944544166 and parameters: {'n_estimators': 785, 'max_depth': 40, 'min_samples_split': 3, 'min_samples_leaf': 1, 'max_features': None, 'bootstrap': True, 'criterion': 'squared_error'}. Best is trial 590 with value: 0.4185444504443197.
[I 2024-12-04 15:01:23,975] Trial 649 finished with value: 0.6422422236873881 and parameters: {'n_estimators': 985, 'max_depth': 38, 'min_samples_split': 2, 'min_samples_leaf': 1, 'max_features': 'log2', 'bootstrap': True, 'criterion': 'squared_error'}. Best is trial 590 with value: 0.4185444504443197.
[I 2024-12-04 15:01:40,804] Trial 654 finished with value: 0.41995805192528224 and parameters: {'n_estimators': 951, 'max_depth': 38, 'min_samples_split': 2, 'min_samples_leaf': 1, 'max_features': None, 'bootstrap': True, 'criterion': 'squared_error'}. Best is trial 590 with value: 0.4185444504443197.
[I 2024-12-04 15:01:43,895] Trial 665 finished with value: 1.0217041458045157 and parameters: {'n_estimators': 981, 'max_depth': 9, 'min_samples_split': 4, 'min_samples_leaf': 11, 'max_features': 'sqrt', 'bootstrap': True, 'criterion': 'squared_error'}. Best is trial 590 with value: 0.4185444504443197.
[I 2024-12-04 15:01:43,947] Trial 650 finished with value: 0.42022680580982447 and parameters: {'n_estimators': 1000, 'max_depth': 44, 'min_samples_split': 2, 'min_samples_leaf': 1, 'max_features': None, 'bootstrap': True, 'criterion': 'squared_error'}. Best is trial 590 with value: 0.4185444504443197.
[I 2024-12-04 15:01:44,458] Trial 655 finished with value: 0.42483675550840033 and parameters: {'n_estimators': 965, 'max_depth': 32, 'min_samples_split': 3, 'min_samples_leaf': 1, 'max_features': None, 'bootstrap': True, 'criterion': 'squared_error'}. Best is trial 590 with value: 0.4185444504443197.
[I 2024-12-04 15:01:45,165] Trial 673 finished with value: 1.0520171155039895 and parameters: {'n_estimators': 106, 'max_depth': 22, 'min_samples_split': 8, 'min_samples_leaf': 11, 'max_features': 'log2', 'bootstrap': False, 'criterion': 'absolute_error'}. Best is trial 590 with value: 0.4185444504443197.
[I 2024-12-04 15:01:45,966] Trial 659 finished with value: 0.4652563354614378 and parameters: {'n_estimators': 933, 'max_depth': 34, 'min_samples_split': 2, 'min_samples_leaf': 2, 'max_features': None, 'bootstrap': True, 'criterion': 'squared_error'}. Best is trial 590 with value: 0.4185444504443197.
[I 2024-12-04 15:01:48,515] Trial 664 finished with value: 1.0452380034230417 and parameters: {'n_estimators': 800, 'max_depth': 47, 'min_samples_split': 12, 'min_samples_leaf': 4, 'max_features': 'log2', 'bootstrap': True, 'criterion': 'squared_error'}. Best is trial 590 with value: 0.4185444504443197.
[I 2024-12-04 15:01:48,569] Trial 653 finished with value: 0.420577099468786 and parameters: {'n_estimators': 975, 'max_depth': 33, 'min_samples_split': 2, 'min_samples_leaf': 1, 'max_features': None, 'bootstrap': True, 'criterion': 'squared_error'}. Best is trial 590 with value: 0.4185444504443197.
[I 2024-12-04 15:01:48,743] Trial 612 finished with value: 0.4325468297503396 and parameters: {'n_estimators': 785, 'max_depth': 38, 'min_samples_split': 4, 'min_samples_leaf': 1, 'max_features': None, 'bootstrap': True, 'criterion': 'absolute_error'}. Best is trial 590 with value: 0.4185444504443197.
[I 2024-12-04 15:01:48,792] Trial 658 finished with value: 0.42460465972443556 and parameters: {'n_estimators': 963, 'max_depth': 43, 'min_samples_split': 3, 'min_samples_leaf': 1, 'max_features': None, 'bootstrap': True, 'criterion': 'squared_error'}. Best is trial 590 with value: 0.4185444504443197.
[I 2024-12-04 15:01:52,712] Trial 656 finished with value: 0.4314441078023419 and parameters: {'n_estimators': 998, 'max_depth': 40, 'min_samples_split': 4, 'min_samples_leaf': 1, 'max_features': None, 'bootstrap': True, 'criterion': 'squared_error'}. Best is trial 590 with value: 0.4185444504443197.
[I 2024-12-04 15:01:55,036] Trial 660 finished with value: 0.4209676452479049 and parameters: {'n_estimators': 942, 'max_depth': 34, 'min_samples_split': 2, 'min_samples_leaf': 1, 'max_features': None, 'bootstrap': True, 'criterion': 'squared_error'}. Best is trial 590 with value: 0.4185444504443197.
[I 2024-12-04 15:01:56,682] Trial 676 finished with value: 1.0088210614590893 and parameters: {'n_estimators': 187, 'max_depth': 20, 'min_samples_split': 4, 'min_samples_leaf': 14, 'max_features': 'sqrt', 'bootstrap': False, 'criterion': 'absolute_error'}. Best is trial 590 with value: 0.4185444504443197.
[I 2024-12-04 15:01:56,691] Trial 662 finished with value: 0.4201110367911322 and parameters: {'n_estimators': 892, 'max_depth': 38, 'min_samples_split': 2, 'min_samples_leaf': 1, 'max_features': None, 'bootstrap': True, 'criterion': 'squared_error'}. Best is trial 590 with value: 0.4185444504443197.
[I 2024-12-04 15:02:01,952] Trial 661 finished with value: 0.4225668773411771 and parameters: {'n_estimators': 992, 'max_depth': 28, 'min_samples_split': 2, 'min_samples_leaf': 1, 'max_features': None, 'bootstrap': True, 'criterion': 'squared_error'}. Best is trial 590 with value: 0.4185444504443197.
[I 2024-12-04 15:02:03,069] Trial 667 finished with value: 0.42425697591498407 and parameters: {'n_estimators': 989, 'max_depth': 36, 'min_samples_split': 3, 'min_samples_leaf': 1, 'max_features': None, 'bootstrap': True, 'criterion': 'squared_error'}. Best is trial 590 with value: 0.4185444504443197.
[I 2024-12-04 15:02:04,437] Trial 680 finished with value: 0.915398098545124 and parameters: {'n_estimators': 673, 'max_depth': 36, 'min_samples_split': 10, 'min_samples_leaf': 2, 'max_features': 'log2', 'bootstrap': False, 'criterion': 'absolute_error'}. Best is trial 590 with value: 0.4185444504443197.
[I 2024-12-04 15:02:05,329] Trial 677 finished with value: 0.4655755686176856 and parameters: {'n_estimators': 972, 'max_depth': 37, 'min_samples_split': 2, 'min_samples_leaf': 2, 'max_features': None, 'bootstrap': True, 'criterion': 'squared_error'}. Best is trial 590 with value: 0.4185444504443197.
[I 2024-12-04 15:02:05,334] Trial 671 finished with value: 0.4237035785283547 and parameters: {'n_estimators': 945, 'max_depth': 41, 'min_samples_split': 3, 'min_samples_leaf': 1, 'max_features': None, 'bootstrap': True, 'criterion': 'squared_error'}. Best is trial 590 with value: 0.4185444504443197.
[I 2024-12-04 15:02:05,370] Trial 675 finished with value: 0.41993099333582823 and parameters: {'n_estimators': 671, 'max_depth': 41, 'min_samples_split': 2, 'min_samples_leaf': 1, 'max_features': None, 'bootstrap': True, 'criterion': 'squared_error'}. Best is trial 590 with value: 0.4185444504443197.
[I 2024-12-04 15:02:05,379] Trial 663 finished with value: 0.4194147650957888 and parameters: {'n_estimators': 942, 'max_depth': 39, 'min_samples_split': 2, 'min_samples_leaf': 1, 'max_features': None, 'bootstrap': True, 'criterion': 'squared_error'}. Best is trial 590 with value: 0.4185444504443197.
[I 2024-12-04 15:02:05,895] Trial 669 finished with value: 0.4651207680916594 and parameters: {'n_estimators': 911, 'max_depth': 43, 'min_samples_split': 2, 'min_samples_leaf': 2, 'max_features': None, 'bootstrap': True, 'criterion': 'squared_error'}. Best is trial 590 with value: 0.4185444504443197.
[I 2024-12-04 15:02:06,507] Trial 666 finished with value: 0.42069705592253476 and parameters: {'n_estimators': 1000, 'max_depth': 36, 'min_samples_split': 2, 'min_samples_leaf': 1, 'max_features': None, 'bootstrap': True, 'criterion': 'squared_error'}. Best is trial 590 with value: 0.4185444504443197.
[I 2024-12-04 15:02:06,805] Trial 670 finished with value: 0.419564130254875 and parameters: {'n_estimators': 627, 'max_depth': 41, 'min_samples_split': 2, 'min_samples_leaf': 1, 'max_features': None, 'bootstrap': True, 'criterion': 'squared_error'}. Best is trial 590 with value: 0.4185444504443197.
[I 2024-12-04 15:02:06,965] Trial 681 finished with value: 0.6077320155381216 and parameters: {'n_estimators': 574, 'max_depth': 44, 'min_samples_split': 2, 'min_samples_leaf': 1, 'max_features': 'log2', 'bootstrap': True, 'criterion': 'squared_error'}. Best is trial 590 with value: 0.4185444504443197.
[I 2024-12-04 15:02:08,090] Trial 668 finished with value: 0.41951627772634126 and parameters: {'n_estimators': 900, 'max_depth': 41, 'min_samples_split': 2, 'min_samples_leaf': 1, 'max_features': None, 'bootstrap': True, 'criterion': 'squared_error'}. Best is trial 590 with value: 0.4185444504443197.
[I 2024-12-04 15:02:08,656] Trial 672 finished with value: 0.4212760107569096 and parameters: {'n_estimators': 971, 'max_depth': 42, 'min_samples_split': 2, 'min_samples_leaf': 1, 'max_features': None, 'bootstrap': True, 'criterion': 'squared_error'}. Best is trial 590 with value: 0.4185444504443197.
[I 2024-12-04 15:02:09,172] Trial 684 finished with value: 1.0213312722581105 and parameters: {'n_estimators': 328, 'max_depth': 11, 'min_samples_split': 13, 'min_samples_leaf': 10, 'max_features': 'sqrt', 'bootstrap': True, 'criterion': 'squared_error'}. Best is trial 590 with value: 0.4185444504443197.
[I 2024-12-04 15:02:10,167] Trial 683 finished with value: 0.8165629889618011 and parameters: {'n_estimators': 482, 'max_depth': 22, 'min_samples_split': 7, 'min_samples_leaf': 3, 'max_features': 'sqrt', 'bootstrap': True, 'criterion': 'absolute_error'}. Best is trial 590 with value: 0.4185444504443197.
[I 2024-12-04 15:02:10,169] Trial 678 finished with value: 0.4228252314642513 and parameters: {'n_estimators': 741, 'max_depth': 29, 'min_samples_split': 2, 'min_samples_leaf': 1, 'max_features': None, 'bootstrap': True, 'criterion': 'squared_error'}. Best is trial 590 with value: 0.4185444504443197.
[I 2024-12-04 15:02:12,457] Trial 679 finished with value: 0.4206023442698138 and parameters: {'n_estimators': 980, 'max_depth': 45, 'min_samples_split': 2, 'min_samples_leaf': 1, 'max_features': None, 'bootstrap': True, 'criterion': 'squared_error'}. Best is trial 590 with value: 0.4185444504443197.
[I 2024-12-04 15:02:12,475] Trial 674 finished with value: 0.5245000598969302 and parameters: {'n_estimators': 829, 'max_depth': 37, 'min_samples_split': 2, 'min_samples_leaf': 1, 'max_features': 'sqrt', 'bootstrap': True, 'criterion': 'squared_error'}. Best is trial 590 with value: 0.4185444504443197.
[I 2024-12-04 15:02:13,748] Trial 687 finished with value: 0.46540938540445814 and parameters: {'n_estimators': 822, 'max_depth': 41, 'min_samples_split': 4, 'min_samples_leaf': 2, 'max_features': None, 'bootstrap': True, 'criterion': 'squared_error'}. Best is trial 590 with value: 0.4185444504443197.
[I 2024-12-04 15:02:15,272] Trial 688 finished with value: 0.887080717431413 and parameters: {'n_estimators': 209, 'max_depth': 9, 'min_samples_split': 36, 'min_samples_leaf': 2, 'max_features': 'sqrt', 'bootstrap': True, 'criterion': 'squared_error'}. Best is trial 590 with value: 0.4185444504443197.
[I 2024-12-04 15:02:18,116] Trial 685 finished with value: 0.4320154219672309 and parameters: {'n_estimators': 821, 'max_depth': 42, 'min_samples_split': 4, 'min_samples_leaf': 1, 'max_features': None, 'bootstrap': True, 'criterion': 'squared_error'}. Best is trial 590 with value: 0.4185444504443197.
[I 2024-12-04 15:02:19,091] Trial 689 finished with value: 0.46454307584382903 and parameters: {'n_estimators': 709, 'max_depth': 34, 'min_samples_split': 3, 'min_samples_leaf': 2, 'max_features': None, 'bootstrap': True, 'criterion': 'squared_error'}. Best is trial 590 with value: 0.4185444504443197.
[I 2024-12-04 15:02:20,084] Trial 682 finished with value: 0.5440961781582799 and parameters: {'n_estimators': 665, 'max_depth': 41, 'min_samples_split': 2, 'min_samples_leaf': 1, 'max_features': 'sqrt', 'bootstrap': True, 'criterion': 'absolute_error'}. Best is trial 590 with value: 0.4185444504443197.
[I 2024-12-04 15:02:28,640] Trial 693 finished with value: 0.4198086327563149 and parameters: {'n_estimators': 758, 'max_depth': 39, 'min_samples_split': 2, 'min_samples_leaf': 1, 'max_features': None, 'bootstrap': True, 'criterion': 'squared_error'}. Best is trial 590 with value: 0.4185444504443197.
[I 2024-12-04 15:02:28,935] Trial 711 finished with value: 0.7032259450705538 and parameters: {'n_estimators': 101, 'max_depth': 32, 'min_samples_split': 6, 'min_samples_leaf': 14, 'max_features': None, 'bootstrap': True, 'criterion': 'absolute_error'}. Best is trial 590 with value: 0.4185444504443197.
[I 2024-12-04 15:02:36,816] Trial 695 finished with value: 0.4329065088141649 and parameters: {'n_estimators': 670, 'max_depth': 31, 'min_samples_split': 4, 'min_samples_leaf': 1, 'max_features': None, 'bootstrap': True, 'criterion': 'squared_error'}. Best is trial 590 with value: 0.4185444504443197.
[I 2024-12-04 15:02:36,828] Trial 697 finished with value: 0.6327851348260792 and parameters: {'n_estimators': 751, 'max_depth': 48, 'min_samples_split': 14, 'min_samples_leaf': 1, 'max_features': 'log2', 'bootstrap': False, 'criterion': 'squared_error'}. Best is trial 590 with value: 0.4185444504443197.
[I 2024-12-04 15:02:36,947] Trial 692 finished with value: 0.6870790870126592 and parameters: {'n_estimators': 926, 'max_depth': 46, 'min_samples_split': 3, 'min_samples_leaf': 12, 'max_features': None, 'bootstrap': True, 'criterion': 'squared_error'}. Best is trial 590 with value: 0.4185444504443197.
[I 2024-12-04 15:02:40,518] Trial 703 finished with value: 0.6930176401901481 and parameters: {'n_estimators': 602, 'max_depth': 50, 'min_samples_split': 3, 'min_samples_leaf': 2, 'max_features': 'sqrt', 'bootstrap': True, 'criterion': 'squared_error'}. Best is trial 590 with value: 0.4185444504443197.
[I 2024-12-04 15:02:43,433] Trial 701 finished with value: 0.464582775825297 and parameters: {'n_estimators': 710, 'max_depth': 36, 'min_samples_split': 2, 'min_samples_leaf': 2, 'max_features': None, 'bootstrap': True, 'criterion': 'squared_error'}. Best is trial 590 with value: 0.4185444504443197.
[I 2024-12-04 15:02:43,503] Trial 698 finished with value: 0.421725055424598 and parameters: {'n_estimators': 731, 'max_depth': 45, 'min_samples_split': 2, 'min_samples_leaf': 1, 'max_features': None, 'bootstrap': True, 'criterion': 'squared_error'}. Best is trial 590 with value: 0.4185444504443197.
[I 2024-12-04 15:02:46,658] Trial 706 finished with value: 0.5226663139148756 and parameters: {'n_estimators': 780, 'max_depth': 35, 'min_samples_split': 2, 'min_samples_leaf': 1, 'max_features': None, 'bootstrap': False, 'criterion': 'squared_error'}. Best is trial 590 with value: 0.4185444504443197.
[I 2024-12-04 15:02:47,034] Trial 691 finished with value: 0.4200079087608986 and parameters: {'n_estimators': 985, 'max_depth': 44, 'min_samples_split': 2, 'min_samples_leaf': 1, 'max_features': None, 'bootstrap': True, 'criterion': 'squared_error'}. Best is trial 590 with value: 0.4185444504443197.
[I 2024-12-04 15:02:51,620] Trial 707 finished with value: 0.42654275153195553 and parameters: {'n_estimators': 555, 'max_depth': 41, 'min_samples_split': 3, 'min_samples_leaf': 1, 'max_features': None, 'bootstrap': True, 'criterion': 'squared_error'}. Best is trial 590 with value: 0.4185444504443197.
[I 2024-12-04 15:02:51,645] Trial 704 finished with value: 0.6335112993107906 and parameters: {'n_estimators': 988, 'max_depth': 48, 'min_samples_split': 6, 'min_samples_leaf': 4, 'max_features': None, 'bootstrap': False, 'criterion': 'squared_error'}. Best is trial 590 with value: 0.4185444504443197.
[I 2024-12-04 15:02:53,673] Trial 708 finished with value: 0.5807113316046024 and parameters: {'n_estimators': 512, 'max_depth': 47, 'min_samples_split': 2, 'min_samples_leaf': 1, 'max_features': 'log2', 'bootstrap': False, 'criterion': 'squared_error'}. Best is trial 590 with value: 0.4185444504443197.
[I 2024-12-04 15:02:56,514] Trial 696 finished with value: 0.4207711754434781 and parameters: {'n_estimators': 979, 'max_depth': 37, 'min_samples_split': 2, 'min_samples_leaf': 1, 'max_features': None, 'bootstrap': True, 'criterion': 'squared_error'}. Best is trial 590 with value: 0.4185444504443197.
[I 2024-12-04 15:02:57,144] Trial 705 finished with value: 0.4208476097110128 and parameters: {'n_estimators': 763, 'max_depth': 34, 'min_samples_split': 2, 'min_samples_leaf': 1, 'max_features': None, 'bootstrap': True, 'criterion': 'squared_error'}. Best is trial 590 with value: 0.4185444504443197.
[I 2024-12-04 15:03:00,190] Trial 702 finished with value: 0.4221218349908789 and parameters: {'n_estimators': 733, 'max_depth': 35, 'min_samples_split': 2, 'min_samples_leaf': 1, 'max_features': None, 'bootstrap': True, 'criterion': 'squared_error'}. Best is trial 590 with value: 0.4185444504443197.
[I 2024-12-04 15:03:03,173] Trial 699 finished with value: 0.4313357574834415 and parameters: {'n_estimators': 792, 'max_depth': 39, 'min_samples_split': 4, 'min_samples_leaf': 1, 'max_features': None, 'bootstrap': True, 'criterion': 'squared_error'}. Best is trial 590 with value: 0.4185444504443197.
[I 2024-12-04 15:03:03,999] Trial 694 finished with value: 0.4192984471436665 and parameters: {'n_estimators': 991, 'max_depth': 40, 'min_samples_split': 2, 'min_samples_leaf': 1, 'max_features': None, 'bootstrap': True, 'criterion': 'squared_error'}. Best is trial 590 with value: 0.4185444504443197.
[I 2024-12-04 15:03:07,896] Trial 710 finished with value: 0.6690338299288063 and parameters: {'n_estimators': 166, 'max_depth': 6, 'min_samples_split': 48, 'min_samples_leaf': 1, 'max_features': None, 'bootstrap': True, 'criterion': 'absolute_error'}. Best is trial 590 with value: 0.4185444504443197.
[I 2024-12-04 15:03:08,799] Trial 719 finished with value: 0.9926912633140518 and parameters: {'n_estimators': 897, 'max_depth': 28, 'min_samples_split': 3, 'min_samples_leaf': 12, 'max_features': 'sqrt', 'bootstrap': False, 'criterion': 'absolute_error'}. Best is trial 590 with value: 0.4185444504443197.
[I 2024-12-04 15:03:10,451] Trial 714 finished with value: 0.421725055424598 and parameters: {'n_estimators': 731, 'max_depth': 45, 'min_samples_split': 2, 'min_samples_leaf': 1, 'max_features': None, 'bootstrap': True, 'criterion': 'squared_error'}. Best is trial 590 with value: 0.4185444504443197.
[I 2024-12-04 15:03:10,829] Trial 709 finished with value: 0.4646842044219633 and parameters: {'n_estimators': 706, 'max_depth': 47, 'min_samples_split': 2, 'min_samples_leaf': 2, 'max_features': None, 'bootstrap': True, 'criterion': 'squared_error'}. Best is trial 590 with value: 0.4185444504443197.
[I 2024-12-04 15:03:11,405] Trial 712 finished with value: 0.46563645812223303 and parameters: {'n_estimators': 965, 'max_depth': 40, 'min_samples_split': 3, 'min_samples_leaf': 2, 'max_features': None, 'bootstrap': True, 'criterion': 'squared_error'}. Best is trial 590 with value: 0.4185444504443197.
[I 2024-12-04 15:03:11,483] Trial 713 finished with value: 0.4203861705044165 and parameters: {'n_estimators': 727, 'max_depth': 38, 'min_samples_split': 2, 'min_samples_leaf': 1, 'max_features': None, 'bootstrap': True, 'criterion': 'squared_error'}. Best is trial 590 with value: 0.4185444504443197.
[I 2024-12-04 15:03:14,058] Trial 717 finished with value: 0.9594480202952379 and parameters: {'n_estimators': 911, 'max_depth': 36, 'min_samples_split': 3, 'min_samples_leaf': 2, 'max_features': 'log2', 'bootstrap': True, 'criterion': 'absolute_error'}. Best is trial 590 with value: 0.4185444504443197.
[I 2024-12-04 15:03:14,081] Trial 722 finished with value: 0.9824115315859464 and parameters: {'n_estimators': 804, 'max_depth': 13, 'min_samples_split': 38, 'min_samples_leaf': 2, 'max_features': 'log2', 'bootstrap': True, 'criterion': 'squared_error'}. Best is trial 590 with value: 0.4185444504443197.
[I 2024-12-04 15:03:15,032] Trial 724 finished with value: 1.0280850892940088 and parameters: {'n_estimators': 459, 'max_depth': 43, 'min_samples_split': 8, 'min_samples_leaf': 13, 'max_features': 'sqrt', 'bootstrap': True, 'criterion': 'absolute_error'}. Best is trial 590 with value: 0.4185444504443197.
[I 2024-12-04 15:03:20,868] Trial 716 finished with value: 0.42091833910782156 and parameters: {'n_estimators': 788, 'max_depth': 43, 'min_samples_split': 2, 'min_samples_leaf': 1, 'max_features': None, 'bootstrap': True, 'criterion': 'squared_error'}. Best is trial 590 with value: 0.4185444504443197.
[I 2024-12-04 15:03:20,944] Trial 720 finished with value: 0.43162469024886757 and parameters: {'n_estimators': 747, 'max_depth': 42, 'min_samples_split': 4, 'min_samples_leaf': 1, 'max_features': None, 'bootstrap': True, 'criterion': 'squared_error'}. Best is trial 590 with value: 0.4185444504443197.
[I 2024-12-04 15:03:22,120] Trial 725 finished with value: 0.6406105392703128 and parameters: {'n_estimators': 612, 'max_depth': 14, 'min_samples_split': 8, 'min_samples_leaf': 7, 'max_features': None, 'bootstrap': True, 'criterion': 'squared_error'}. Best is trial 590 with value: 0.4185444504443197.
[I 2024-12-04 15:03:23,023] Trial 730 finished with value: 0.8638130424922275 and parameters: {'n_estimators': 249, 'max_depth': 17, 'min_samples_split': 4, 'min_samples_leaf': 1, 'max_features': 'log2', 'bootstrap': True, 'criterion': 'absolute_error'}. Best is trial 590 with value: 0.4185444504443197.
[I 2024-12-04 15:03:23,232] Trial 657 finished with value: 0.42802492251143764 and parameters: {'n_estimators': 981, 'max_depth': 43, 'min_samples_split': 2, 'min_samples_leaf': 1, 'max_features': None, 'bootstrap': True, 'criterion': 'absolute_error'}. Best is trial 590 with value: 0.4185444504443197.
