[I 2024-12-04 12:01:58,633] Trial 513 finished with value: 0.29501312480262976 and parameters: {'n_estimators': 228, 'max_depth': 50, 'min_samples_split': 3, 'min_samples_leaf': 1, 'max_features': 'sqrt', 'bootstrap': False, 'criterion': 'squared_error'}. Best is trial 341 with value: 0.2909369124469028.
[I 2024-12-04 12:01:58,672] Trial 504 finished with value: 0.3130228254593421 and parameters: {'n_estimators': 286, 'max_depth': 41, 'min_samples_split': 4, 'min_samples_leaf': 1, 'max_features': 'sqrt', 'bootstrap': False, 'criterion': 'squared_error'}. Best is trial 341 with value: 0.2909369124469028.
[I 2024-12-04 12:01:58,673] Trial 517 finished with value: 0.3045624666937618 and parameters: {'n_estimators': 231, 'max_depth': 50, 'min_samples_split': 5, 'min_samples_leaf': 1, 'max_features': 'sqrt', 'bootstrap': False, 'criterion': 'squared_error'}. Best is trial 341 with value: 0.2909369124469028.
[I 2024-12-04 12:02:00,280] Trial 518 finished with value: 0.32000949139604945 and parameters: {'n_estimators': 112, 'max_depth': 39, 'min_samples_split': 4, 'min_samples_leaf': 1, 'max_features': 'sqrt', 'bootstrap': False, 'criterion': 'squared_error'}. Best is trial 341 with value: 0.2909369124469028.
[I 2024-12-04 12:02:00,523] Trial 506 finished with value: 0.44400312834883116 and parameters: {'n_estimators': 109, 'max_depth': 40, 'min_samples_split': 3, 'min_samples_leaf': 2, 'max_features': 'sqrt', 'bootstrap': False, 'criterion': 'squared_error'}. Best is trial 341 with value: 0.2909369124469028.
[I 2024-12-04 12:02:00,537] Trial 509 finished with value: 0.3852343355225243 and parameters: {'n_estimators': 416, 'max_depth': 50, 'min_samples_split': 5, 'min_samples_leaf': 1, 'max_features': None, 'bootstrap': False, 'criterion': 'squared_error'}. Best is trial 341 with value: 0.2909369124469028.
[I 2024-12-04 12:02:01,572] Trial 510 finished with value: 0.4444006090965879 and parameters: {'n_estimators': 298, 'max_depth': 47, 'min_samples_split': 2, 'min_samples_leaf': 2, 'max_features': 'sqrt', 'bootstrap': False, 'criterion': 'squared_error'}. Best is trial 341 with value: 0.2909369124469028.
[I 2024-12-04 12:02:01,576] Trial 508 finished with value: 0.293460116066781 and parameters: {'n_estimators': 272, 'max_depth': 49, 'min_samples_split': 3, 'min_samples_leaf': 1, 'max_features': 'sqrt', 'bootstrap': False, 'criterion': 'squared_error'}. Best is trial 341 with value: 0.2909369124469028.
[I 2024-12-04 12:02:01,916] Trial 515 finished with value: 0.3025382866752864 and parameters: {'n_estimators': 239, 'max_depth': 42, 'min_samples_split': 3, 'min_samples_leaf': 1, 'max_features': 'sqrt', 'bootstrap': False, 'criterion': 'squared_error'}. Best is trial 341 with value: 0.2909369124469028.
[I 2024-12-04 12:02:02,849] Trial 516 finished with value: 0.2994097018730617 and parameters: {'n_estimators': 276, 'max_depth': 50, 'min_samples_split': 2, 'min_samples_leaf': 1, 'max_features': 'sqrt', 'bootstrap': False, 'criterion': 'squared_error'}. Best is trial 341 with value: 0.2909369124469028.
[I 2024-12-04 12:02:03,337] Trial 514 finished with value: 0.9698502238378355 and parameters: {'n_estimators': 273, 'max_depth': 28, 'min_samples_split': 6, 'min_samples_leaf': 14, 'max_features': 'log2', 'bootstrap': True, 'criterion': 'squared_error'}. Best is trial 341 with value: 0.2909369124469028.
[I 2024-12-04 12:02:03,608] Trial 522 finished with value: 0.2925200020924061 and parameters: {'n_estimators': 257, 'max_depth': 48, 'min_samples_split': 3, 'min_samples_leaf': 1, 'max_features': 'sqrt', 'bootstrap': False, 'criterion': 'squared_error'}. Best is trial 341 with value: 0.2909369124469028.
[I 2024-12-04 12:02:04,039] Trial 521 finished with value: 0.5087787527337565 and parameters: {'n_estimators': 668, 'max_depth': 22, 'min_samples_split': 45, 'min_samples_leaf': 1, 'max_features': 'sqrt', 'bootstrap': True, 'criterion': 'squared_error'}. Best is trial 341 with value: 0.2909369124469028.
[I 2024-12-04 12:02:04,129] Trial 519 finished with value: 0.31661339133263666 and parameters: {'n_estimators': 224, 'max_depth': 48, 'min_samples_split': 3, 'min_samples_leaf': 1, 'max_features': 'sqrt', 'bootstrap': True, 'criterion': 'squared_error'}. Best is trial 341 with value: 0.2909369124469028.
[I 2024-12-04 12:02:04,387] Trial 524 finished with value: 0.29551495469226113 and parameters: {'n_estimators': 243, 'max_depth': 50, 'min_samples_split': 3, 'min_samples_leaf': 1, 'max_features': 'sqrt', 'bootstrap': False, 'criterion': 'squared_error'}. Best is trial 341 with value: 0.2909369124469028.
[I 2024-12-04 12:02:04,451] Trial 523 finished with value: 0.30682551609519026 and parameters: {'n_estimators': 274, 'max_depth': 44, 'min_samples_split': 4, 'min_samples_leaf': 1, 'max_features': 'sqrt', 'bootstrap': False, 'criterion': 'squared_error'}. Best is trial 341 with value: 0.2909369124469028.
[I 2024-12-04 12:02:04,455] Trial 512 finished with value: 0.31953277098023547 and parameters: {'n_estimators': 345, 'max_depth': 46, 'min_samples_split': 2, 'min_samples_leaf': 1, 'max_features': 'sqrt', 'bootstrap': True, 'criterion': 'squared_error'}. Best is trial 341 with value: 0.2909369124469028.
[I 2024-12-04 12:02:04,496] Trial 496 finished with value: 0.7699856127691063 and parameters: {'n_estimators': 946, 'max_depth': 6, 'min_samples_split': 20, 'min_samples_leaf': 2, 'max_features': 'sqrt', 'bootstrap': False, 'criterion': 'absolute_error'}. Best is trial 341 with value: 0.2909369124469028.
[I 2024-12-04 12:02:05,232] Trial 520 finished with value: 0.2954845098985723 and parameters: {'n_estimators': 233, 'max_depth': 49, 'min_samples_split': 2, 'min_samples_leaf': 1, 'max_features': 'sqrt', 'bootstrap': False, 'criterion': 'squared_error'}. Best is trial 341 with value: 0.2909369124469028.
[I 2024-12-04 12:02:05,299] Trial 475 finished with value: 0.4684866931324997 and parameters: {'n_estimators': 956, 'max_depth': 49, 'min_samples_split': 20, 'min_samples_leaf': 1, 'max_features': 'log2', 'bootstrap': False, 'criterion': 'absolute_error'}. Best is trial 341 with value: 0.2909369124469028.
[I 2024-12-04 12:02:05,809] Trial 525 finished with value: 0.2978301807484449 and parameters: {'n_estimators': 310, 'max_depth': 50, 'min_samples_split': 2, 'min_samples_leaf': 1, 'max_features': 'sqrt', 'bootstrap': False, 'criterion': 'squared_error'}. Best is trial 341 with value: 0.2909369124469028.
[I 2024-12-04 12:02:06,163] Trial 529 finished with value: 0.3064890588122148 and parameters: {'n_estimators': 392, 'max_depth': 44, 'min_samples_split': 4, 'min_samples_leaf': 1, 'max_features': 'sqrt', 'bootstrap': False, 'criterion': 'squared_error'}. Best is trial 341 with value: 0.2909369124469028.
[I 2024-12-04 12:02:09,610] Trial 531 finished with value: 0.44295805175566744 and parameters: {'n_estimators': 253, 'max_depth': 50, 'min_samples_split': 3, 'min_samples_leaf': 2, 'max_features': 'sqrt', 'bootstrap': False, 'criterion': 'squared_error'}. Best is trial 341 with value: 0.2909369124469028.
[I 2024-12-04 12:02:09,815] Trial 528 finished with value: 0.3092525211360563 and parameters: {'n_estimators': 368, 'max_depth': 42, 'min_samples_split': 4, 'min_samples_leaf': 1, 'max_features': 'sqrt', 'bootstrap': False, 'criterion': 'squared_error'}. Best is trial 341 with value: 0.2909369124469028.
[I 2024-12-04 12:02:12,950] Trial 539 finished with value: 0.30969711429536 and parameters: {'n_estimators': 122, 'max_depth': 50, 'min_samples_split': 6, 'min_samples_leaf': 1, 'max_features': 'sqrt', 'bootstrap': False, 'criterion': 'squared_error'}. Best is trial 341 with value: 0.2909369124469028.
[I 2024-12-04 12:02:13,296] Trial 527 finished with value: 0.3875134368671569 and parameters: {'n_estimators': 154, 'max_depth': 49, 'min_samples_split': 2, 'min_samples_leaf': 1, 'max_features': None, 'bootstrap': False, 'criterion': 'squared_error'}. Best is trial 341 with value: 0.2909369124469028.
[I 2024-12-04 12:02:15,212] Trial 533 finished with value: 0.2927765409837784 and parameters: {'n_estimators': 208, 'max_depth': 49, 'min_samples_split': 3, 'min_samples_leaf': 1, 'max_features': 'sqrt', 'bootstrap': False, 'criterion': 'squared_error'}. Best is trial 341 with value: 0.2909369124469028.
[I 2024-12-04 12:02:17,631] Trial 546 finished with value: 0.7102900547460409 and parameters: {'n_estimators': 543, 'max_depth': 15, 'min_samples_split': 14, 'min_samples_leaf': 1, 'max_features': 'log2', 'bootstrap': False, 'criterion': 'squared_error'}. Best is trial 341 with value: 0.2909369124469028.
[I 2024-12-04 12:02:17,934] Trial 530 finished with value: 0.30694766351215086 and parameters: {'n_estimators': 300, 'max_depth': 40, 'min_samples_split': 3, 'min_samples_leaf': 1, 'max_features': 'sqrt', 'bootstrap': False, 'criterion': 'squared_error'}. Best is trial 341 with value: 0.2909369124469028.
[I 2024-12-04 12:02:18,077] Trial 537 finished with value: 0.2969085457274613 and parameters: {'n_estimators': 123, 'max_depth': 50, 'min_samples_split': 3, 'min_samples_leaf': 1, 'max_features': 'sqrt', 'bootstrap': False, 'criterion': 'squared_error'}. Best is trial 341 with value: 0.2909369124469028.
[I 2024-12-04 12:02:18,078] Trial 540 finished with value: 0.30076477770033966 and parameters: {'n_estimators': 243, 'max_depth': 43, 'min_samples_split': 3, 'min_samples_leaf': 1, 'max_features': 'sqrt', 'bootstrap': False, 'criterion': 'squared_error'}. Best is trial 341 with value: 0.2909369124469028.
[I 2024-12-04 12:02:19,257] Trial 538 finished with value: 0.3030208526121872 and parameters: {'n_estimators': 100, 'max_depth': 44, 'min_samples_split': 3, 'min_samples_leaf': 1, 'max_features': 'sqrt', 'bootstrap': False, 'criterion': 'squared_error'}. Best is trial 341 with value: 0.2909369124469028.
[I 2024-12-04 12:02:19,761] Trial 535 finished with value: 0.2940500264670243 and parameters: {'n_estimators': 137, 'max_depth': 50, 'min_samples_split': 3, 'min_samples_leaf': 1, 'max_features': 'sqrt', 'bootstrap': False, 'criterion': 'squared_error'}. Best is trial 341 with value: 0.2909369124469028.
[I 2024-12-04 12:02:20,357] Trial 536 finished with value: 0.3114861756197129 and parameters: {'n_estimators': 110, 'max_depth': 45, 'min_samples_split': 2, 'min_samples_leaf': 1, 'max_features': 'sqrt', 'bootstrap': False, 'criterion': 'absolute_error'}. Best is trial 341 with value: 0.2909369124469028.
[I 2024-12-04 12:02:21,063] Trial 534 finished with value: 0.30303561264675083 and parameters: {'n_estimators': 241, 'max_depth': 49, 'min_samples_split': 4, 'min_samples_leaf': 1, 'max_features': 'sqrt', 'bootstrap': False, 'criterion': 'squared_error'}. Best is trial 341 with value: 0.2909369124469028.
[I 2024-12-04 12:02:21,787] Trial 541 finished with value: 0.9004729721460197 and parameters: {'n_estimators': 936, 'max_depth': 17, 'min_samples_split': 48, 'min_samples_leaf': 13, 'max_features': 'sqrt', 'bootstrap': True, 'criterion': 'absolute_error'}. Best is trial 341 with value: 0.2909369124469028.
[I 2024-12-04 12:02:21,884] Trial 532 finished with value: 0.31150606913095974 and parameters: {'n_estimators': 187, 'max_depth': 45, 'min_samples_split': 2, 'min_samples_leaf': 1, 'max_features': 'sqrt', 'bootstrap': False, 'criterion': 'absolute_error'}. Best is trial 341 with value: 0.2909369124469028.
[I 2024-12-04 12:02:22,917] Trial 544 finished with value: 0.8308198022002106 and parameters: {'n_estimators': 827, 'max_depth': 8, 'min_samples_split': 48, 'min_samples_leaf': 1, 'max_features': 'log2', 'bootstrap': True, 'criterion': 'absolute_error'}. Best is trial 341 with value: 0.2909369124469028.
[I 2024-12-04 12:02:23,189] Trial 545 finished with value: 0.44250172057572296 and parameters: {'n_estimators': 237, 'max_depth': 50, 'min_samples_split': 2, 'min_samples_leaf': 2, 'max_features': 'sqrt', 'bootstrap': False, 'criterion': 'squared_error'}. Best is trial 341 with value: 0.2909369124469028.
[I 2024-12-04 12:02:23,485] Trial 390 finished with value: 0.38120441004180916 and parameters: {'n_estimators': 802, 'max_depth': 25, 'min_samples_split': 25, 'min_samples_leaf': 1, 'max_features': None, 'bootstrap': True, 'criterion': 'absolute_error'}. Best is trial 341 with value: 0.2909369124469028.
[I 2024-12-04 12:02:23,778] Trial 543 finished with value: 0.9635536752548801 and parameters: {'n_estimators': 846, 'max_depth': 17, 'min_samples_split': 9, 'min_samples_leaf': 10, 'max_features': 'log2', 'bootstrap': True, 'criterion': 'absolute_error'}. Best is trial 341 with value: 0.2909369124469028.
[I 2024-12-04 12:02:24,042] Trial 556 finished with value: 0.30550355875258545 and parameters: {'n_estimators': 257, 'max_depth': 43, 'min_samples_split': 2, 'min_samples_leaf': 1, 'max_features': 'sqrt', 'bootstrap': False, 'criterion': 'squared_error'}. Best is trial 341 with value: 0.2909369124469028.
[I 2024-12-04 12:02:24,086] Trial 547 finished with value: 0.3118758424541172 and parameters: {'n_estimators': 234, 'max_depth': 40, 'min_samples_split': 2, 'min_samples_leaf': 1, 'max_features': 'sqrt', 'bootstrap': False, 'criterion': 'squared_error'}. Best is trial 341 with value: 0.2909369124469028.
[I 2024-12-04 12:02:24,112] Trial 555 finished with value: 0.4479385898478112 and parameters: {'n_estimators': 122, 'max_depth': 44, 'min_samples_split': 4, 'min_samples_leaf': 2, 'max_features': 'sqrt', 'bootstrap': False, 'criterion': 'squared_error'}. Best is trial 341 with value: 0.2909369124469028.
[I 2024-12-04 12:02:24,407] Trial 554 finished with value: 0.31683093443247645 and parameters: {'n_estimators': 129, 'max_depth': 42, 'min_samples_split': 5, 'min_samples_leaf': 1, 'max_features': 'sqrt', 'bootstrap': False, 'criterion': 'squared_error'}. Best is trial 341 with value: 0.2909369124469028.
[I 2024-12-04 12:02:25,495] Trial 557 finished with value: 0.2989826954695336 and parameters: {'n_estimators': 126, 'max_depth': 50, 'min_samples_split': 2, 'min_samples_leaf': 1, 'max_features': 'sqrt', 'bootstrap': False, 'criterion': 'squared_error'}. Best is trial 341 with value: 0.2909369124469028.
[I 2024-12-04 12:02:25,636] Trial 548 finished with value: 0.29159740482407764 and parameters: {'n_estimators': 209, 'max_depth': 48, 'min_samples_split': 3, 'min_samples_leaf': 1, 'max_features': 'sqrt', 'bootstrap': False, 'criterion': 'squared_error'}. Best is trial 341 with value: 0.2909369124469028.
[I 2024-12-04 12:02:25,971] Trial 553 finished with value: 0.29504827319071614 and parameters: {'n_estimators': 348, 'max_depth': 50, 'min_samples_split': 3, 'min_samples_leaf': 1, 'max_features': 'sqrt', 'bootstrap': False, 'criterion': 'squared_error'}. Best is trial 341 with value: 0.2909369124469028.
[I 2024-12-04 12:02:26,866] Trial 552 finished with value: 0.30665902870049344 and parameters: {'n_estimators': 122, 'max_depth': 41, 'min_samples_split': 3, 'min_samples_leaf': 1, 'max_features': 'sqrt', 'bootstrap': False, 'criterion': 'squared_error'}. Best is trial 341 with value: 0.2909369124469028.
[I 2024-12-04 12:02:31,757] Trial 566 finished with value: 0.4446937788735189 and parameters: {'n_estimators': 158, 'max_depth': 50, 'min_samples_split': 3, 'min_samples_leaf': 2, 'max_features': 'sqrt', 'bootstrap': False, 'criterion': 'squared_error'}. Best is trial 341 with value: 0.2909369124469028.
[I 2024-12-04 12:02:31,879] Trial 565 finished with value: 0.3073035347880342 and parameters: {'n_estimators': 244, 'max_depth': 45, 'min_samples_split': 4, 'min_samples_leaf': 1, 'max_features': 'sqrt', 'bootstrap': False, 'criterion': 'squared_error'}. Best is trial 341 with value: 0.2909369124469028.
[I 2024-12-04 12:02:32,442] Trial 559 finished with value: 0.30436951795452744 and parameters: {'n_estimators': 218, 'max_depth': 50, 'min_samples_split': 5, 'min_samples_leaf': 1, 'max_features': 'sqrt', 'bootstrap': False, 'criterion': 'squared_error'}. Best is trial 341 with value: 0.2909369124469028.
[I 2024-12-04 12:02:32,538] Trial 562 finished with value: 0.44066858414418003 and parameters: {'n_estimators': 226, 'max_depth': 49, 'min_samples_split': 3, 'min_samples_leaf': 2, 'max_features': 'sqrt', 'bootstrap': False, 'criterion': 'squared_error'}. Best is trial 341 with value: 0.2909369124469028.
[I 2024-12-04 12:02:32,598] Trial 550 finished with value: 0.2974728575395881 and parameters: {'n_estimators': 134, 'max_depth': 48, 'min_samples_split': 4, 'min_samples_leaf': 1, 'max_features': 'sqrt', 'bootstrap': False, 'criterion': 'squared_error'}. Best is trial 341 with value: 0.2909369124469028.
[I 2024-12-04 12:02:33,242] Trial 571 finished with value: 0.4464091588622256 and parameters: {'n_estimators': 102, 'max_depth': 48, 'min_samples_split': 3, 'min_samples_leaf': 2, 'max_features': 'sqrt', 'bootstrap': False, 'criterion': 'squared_error'}. Best is trial 341 with value: 0.2909369124469028.
[I 2024-12-04 12:02:33,342] Trial 542 finished with value: 0.3836066186540903 and parameters: {'n_estimators': 393, 'max_depth': 28, 'min_samples_split': 3, 'min_samples_leaf': 1, 'max_features': 'sqrt', 'bootstrap': False, 'criterion': 'absolute_error'}. Best is trial 341 with value: 0.2909369124469028.
[I 2024-12-04 12:02:33,459] Trial 564 finished with value: 0.2951309461142552 and parameters: {'n_estimators': 130, 'max_depth': 50, 'min_samples_split': 3, 'min_samples_leaf': 1, 'max_features': 'sqrt', 'bootstrap': False, 'criterion': 'squared_error'}. Best is trial 341 with value: 0.2909369124469028.
[I 2024-12-04 12:02:33,640] Trial 526 finished with value: 0.4288012647690223 and parameters: {'n_estimators': 665, 'max_depth': 27, 'min_samples_split': 7, 'min_samples_leaf': 5, 'max_features': None, 'bootstrap': True, 'criterion': 'absolute_error'}. Best is trial 341 with value: 0.2909369124469028.
[I 2024-12-04 12:02:35,038] Trial 572 finished with value: 0.32901665351520104 and parameters: {'n_estimators': 204, 'max_depth': 49, 'min_samples_split': 5, 'min_samples_leaf': 1, 'max_features': 'sqrt', 'bootstrap': True, 'criterion': 'squared_error'}. Best is trial 341 with value: 0.2909369124469028.
[I 2024-12-04 12:02:35,663] Trial 551 finished with value: 0.5467419364285616 and parameters: {'n_estimators': 390, 'max_depth': 21, 'min_samples_split': 10, 'min_samples_leaf': 2, 'max_features': 'sqrt', 'bootstrap': True, 'criterion': 'absolute_error'}. Best is trial 341 with value: 0.2909369124469028.
[I 2024-12-04 12:02:36,328] Trial 570 finished with value: 0.2956826243200467 and parameters: {'n_estimators': 254, 'max_depth': 46, 'min_samples_split': 3, 'min_samples_leaf': 1, 'max_features': 'sqrt', 'bootstrap': False, 'criterion': 'squared_error'}. Best is trial 341 with value: 0.2909369124469028.
[I 2024-12-04 12:02:36,601] Trial 578 finished with value: 0.29343546185783426 and parameters: {'n_estimators': 178, 'max_depth': 50, 'min_samples_split': 3, 'min_samples_leaf': 1, 'max_features': 'sqrt', 'bootstrap': False, 'criterion': 'squared_error'}. Best is trial 341 with value: 0.2909369124469028.
[I 2024-12-04 12:02:37,043] Trial 568 finished with value: 0.316227949537302 and parameters: {'n_estimators': 294, 'max_depth': 42, 'min_samples_split': 5, 'min_samples_leaf': 1, 'max_features': 'sqrt', 'bootstrap': False, 'criterion': 'squared_error'}. Best is trial 341 with value: 0.2909369124469028.
[I 2024-12-04 12:02:37,084] Trial 560 finished with value: 0.4295099082579555 and parameters: {'n_estimators': 857, 'max_depth': 43, 'min_samples_split': 40, 'min_samples_leaf': 2, 'max_features': None, 'bootstrap': False, 'criterion': 'squared_error'}. Best is trial 341 with value: 0.2909369124469028.
[I 2024-12-04 12:02:37,570] Trial 563 finished with value: 0.3012055612476459 and parameters: {'n_estimators': 218, 'max_depth': 42, 'min_samples_split': 3, 'min_samples_leaf': 1, 'max_features': 'sqrt', 'bootstrap': False, 'criterion': 'squared_error'}. Best is trial 341 with value: 0.2909369124469028.
[I 2024-12-04 12:02:37,691] Trial 558 finished with value: 0.30101842630322895 and parameters: {'n_estimators': 286, 'max_depth': 43, 'min_samples_split': 3, 'min_samples_leaf': 1, 'max_features': 'sqrt', 'bootstrap': False, 'criterion': 'squared_error'}. Best is trial 341 with value: 0.2909369124469028.
[I 2024-12-04 12:02:38,185] Trial 581 finished with value: 0.2942137341434494 and parameters: {'n_estimators': 210, 'max_depth': 50, 'min_samples_split': 3, 'min_samples_leaf': 1, 'max_features': 'sqrt', 'bootstrap': False, 'criterion': 'squared_error'}. Best is trial 341 with value: 0.2909369124469028.
[I 2024-12-04 12:02:38,725] Trial 576 finished with value: 0.445346564810754 and parameters: {'n_estimators': 321, 'max_depth': 40, 'min_samples_split': 2, 'min_samples_leaf': 2, 'max_features': 'sqrt', 'bootstrap': False, 'criterion': 'squared_error'}. Best is trial 341 with value: 0.2909369124469028.
[I 2024-12-04 12:02:38,859] Trial 579 finished with value: 0.3259848630925022 and parameters: {'n_estimators': 702, 'max_depth': 39, 'min_samples_split': 5, 'min_samples_leaf': 1, 'max_features': 'sqrt', 'bootstrap': False, 'criterion': 'squared_error'}. Best is trial 341 with value: 0.2909369124469028.
[I 2024-12-04 12:02:38,897] Trial 569 finished with value: 0.3083097228917205 and parameters: {'n_estimators': 246, 'max_depth': 50, 'min_samples_split': 6, 'min_samples_leaf': 1, 'max_features': 'sqrt', 'bootstrap': False, 'criterion': 'squared_error'}. Best is trial 341 with value: 0.2909369124469028.
[I 2024-12-04 12:02:39,218] Trial 561 finished with value: 0.5419804866131824 and parameters: {'n_estimators': 382, 'max_depth': 40, 'min_samples_split': 46, 'min_samples_leaf': 1, 'max_features': 'log2', 'bootstrap': True, 'criterion': 'absolute_error'}. Best is trial 341 with value: 0.2909369124469028.
[I 2024-12-04 12:02:39,220] Trial 549 finished with value: 0.4575902042587305 and parameters: {'n_estimators': 331, 'max_depth': 49, 'min_samples_split': 4, 'min_samples_leaf': 2, 'max_features': 'sqrt', 'bootstrap': False, 'criterion': 'absolute_error'}. Best is trial 341 with value: 0.2909369124469028.
