[I 2024-12-04 12:04:11,532] Trial 724 finished with value: 0.30062134325316886 and parameters: {'n_estimators': 302, 'max_depth': 43, 'min_samples_split': 3, 'min_samples_leaf': 1, 'max_features': 'sqrt', 'bootstrap': False, 'criterion': 'squared_error'}. Best is trial 341 with value: 0.2909369124469028.
[I 2024-12-04 12:04:11,804] Trial 721 finished with value: 0.3247764298412089 and parameters: {'n_estimators': 128, 'max_depth': 42, 'min_samples_split': 7, 'min_samples_leaf': 1, 'max_features': 'sqrt', 'bootstrap': False, 'criterion': 'squared_error'}. Best is trial 341 with value: 0.2909369124469028.
[I 2024-12-04 12:04:14,147] Trial 670 finished with value: 0.5141179938064506 and parameters: {'n_estimators': 968, 'max_depth': 40, 'min_samples_split': 2, 'min_samples_leaf': 3, 'max_features': 'sqrt', 'bootstrap': False, 'criterion': 'absolute_error'}. Best is trial 341 with value: 0.2909369124469028.
[I 2024-12-04 12:04:14,291] Trial 728 finished with value: 0.38052974687390384 and parameters: {'n_estimators': 179, 'max_depth': 45, 'min_samples_split': 3, 'min_samples_leaf': 1, 'max_features': None, 'bootstrap': False, 'criterion': 'squared_error'}. Best is trial 341 with value: 0.2909369124469028.
[I 2024-12-04 12:04:14,576] Trial 740 finished with value: 0.4438911862877345 and parameters: {'n_estimators': 111, 'max_depth': 43, 'min_samples_split': 2, 'min_samples_leaf': 2, 'max_features': 'sqrt', 'bootstrap': False, 'criterion': 'squared_error'}. Best is trial 341 with value: 0.2909369124469028.
[I 2024-12-04 12:04:14,830] Trial 739 finished with value: 0.2977210557253272 and parameters: {'n_estimators': 138, 'max_depth': 50, 'min_samples_split': 2, 'min_samples_leaf': 1, 'max_features': 'sqrt', 'bootstrap': False, 'criterion': 'squared_error'}. Best is trial 341 with value: 0.2909369124469028.
[I 2024-12-04 12:04:15,389] Trial 731 finished with value: 0.4415604582217733 and parameters: {'n_estimators': 133, 'max_depth': 42, 'min_samples_split': 5, 'min_samples_leaf': 1, 'max_features': 'log2', 'bootstrap': False, 'criterion': 'absolute_error'}. Best is trial 341 with value: 0.2909369124469028.
[I 2024-12-04 12:04:15,396] Trial 734 finished with value: 0.6447937925753149 and parameters: {'n_estimators': 110, 'max_depth': 12, 'min_samples_split': 28, 'min_samples_leaf': 1, 'max_features': 'sqrt', 'bootstrap': True, 'criterion': 'squared_error'}. Best is trial 341 with value: 0.2909369124469028.
[I 2024-12-04 12:04:15,692] Trial 725 finished with value: 0.30555181645850793 and parameters: {'n_estimators': 256, 'max_depth': 43, 'min_samples_split': 2, 'min_samples_leaf': 1, 'max_features': 'sqrt', 'bootstrap': False, 'criterion': 'squared_error'}. Best is trial 341 with value: 0.2909369124469028.
[I 2024-12-04 12:04:15,850] Trial 729 finished with value: 0.3013112024775005 and parameters: {'n_estimators': 230, 'max_depth': 44, 'min_samples_split': 3, 'min_samples_leaf': 1, 'max_features': 'sqrt', 'bootstrap': False, 'criterion': 'squared_error'}. Best is trial 341 with value: 0.2909369124469028.
[I 2024-12-04 12:04:16,692] Trial 737 finished with value: 0.3004587825043531 and parameters: {'n_estimators': 186, 'max_depth': 50, 'min_samples_split': 4, 'min_samples_leaf': 1, 'max_features': 'sqrt', 'bootstrap': False, 'criterion': 'squared_error'}. Best is trial 341 with value: 0.2909369124469028.
[I 2024-12-04 12:04:16,920] Trial 730 finished with value: 0.4803986461355074 and parameters: {'n_estimators': 267, 'max_depth': 35, 'min_samples_split': 3, 'min_samples_leaf': 2, 'max_features': 'sqrt', 'bootstrap': True, 'criterion': 'squared_error'}. Best is trial 341 with value: 0.2909369124469028.
[I 2024-12-04 12:04:17,070] Trial 735 finished with value: 0.7328999324985681 and parameters: {'n_estimators': 382, 'max_depth': 28, 'min_samples_split': 2, 'min_samples_leaf': 5, 'max_features': 'sqrt', 'bootstrap': True, 'criterion': 'squared_error'}. Best is trial 341 with value: 0.2909369124469028.
[I 2024-12-04 12:04:17,437] Trial 736 finished with value: 0.3172511480977255 and parameters: {'n_estimators': 109, 'max_depth': 49, 'min_samples_split': 2, 'min_samples_leaf': 1, 'max_features': 'sqrt', 'bootstrap': True, 'criterion': 'squared_error'}. Best is trial 341 with value: 0.2909369124469028.
[I 2024-12-04 12:04:17,859] Trial 733 finished with value: 0.2974636182170114 and parameters: {'n_estimators': 100, 'max_depth': 49, 'min_samples_split': 3, 'min_samples_leaf': 1, 'max_features': 'sqrt', 'bootstrap': False, 'criterion': 'squared_error'}. Best is trial 341 with value: 0.2909369124469028.
[I 2024-12-04 12:04:18,814] Trial 738 finished with value: 0.4419741099657591 and parameters: {'n_estimators': 227, 'max_depth': 50, 'min_samples_split': 4, 'min_samples_leaf': 2, 'max_features': 'sqrt', 'bootstrap': False, 'criterion': 'squared_error'}. Best is trial 341 with value: 0.2909369124469028.
[I 2024-12-04 12:04:19,280] Trial 704 finished with value: 0.5239941503501273 and parameters: {'n_estimators': 924, 'max_depth': 5, 'min_samples_split': 25, 'min_samples_leaf': 10, 'max_features': None, 'bootstrap': True, 'criterion': 'absolute_error'}. Best is trial 341 with value: 0.2909369124469028.
[I 2024-12-04 12:04:19,514] Trial 743 finished with value: 0.2995825872028414 and parameters: {'n_estimators': 182, 'max_depth': 50, 'min_samples_split': 4, 'min_samples_leaf': 1, 'max_features': 'sqrt', 'bootstrap': False, 'criterion': 'squared_error'}. Best is trial 341 with value: 0.2909369124469028.
[I 2024-12-04 12:04:19,822] Trial 748 finished with value: 0.30526857113815997 and parameters: {'n_estimators': 130, 'max_depth': 41, 'min_samples_split': 3, 'min_samples_leaf': 1, 'max_features': 'sqrt', 'bootstrap': False, 'criterion': 'squared_error'}. Best is trial 341 with value: 0.2909369124469028.
[I 2024-12-04 12:04:19,829] Trial 720 finished with value: 0.3253105861080104 and parameters: {'n_estimators': 291, 'max_depth': 39, 'min_samples_split': 2, 'min_samples_leaf': 1, 'max_features': 'sqrt', 'bootstrap': False, 'criterion': 'absolute_error'}. Best is trial 341 with value: 0.2909369124469028.
[I 2024-12-04 12:04:19,832] Trial 745 finished with value: 0.4413002389980788 and parameters: {'n_estimators': 385, 'max_depth': 50, 'min_samples_split': 3, 'min_samples_leaf': 2, 'max_features': 'sqrt', 'bootstrap': False, 'criterion': 'squared_error'}. Best is trial 341 with value: 0.2909369124469028.
[I 2024-12-04 12:04:21,030] Trial 732 finished with value: 0.8073461650373613 and parameters: {'n_estimators': 519, 'max_depth': 9, 'min_samples_split': 2, 'min_samples_leaf': 1, 'max_features': 'log2', 'bootstrap': True, 'criterion': 'absolute_error'}. Best is trial 341 with value: 0.2909369124469028.
[I 2024-12-04 12:04:21,468] Trial 741 finished with value: 0.3048144953165622 and parameters: {'n_estimators': 268, 'max_depth': 44, 'min_samples_split': 2, 'min_samples_leaf': 1, 'max_features': 'sqrt', 'bootstrap': False, 'criterion': 'squared_error'}. Best is trial 341 with value: 0.2909369124469028.
[I 2024-12-04 12:04:21,686] Trial 742 finished with value: 0.30309543020965535 and parameters: {'n_estimators': 253, 'max_depth': 49, 'min_samples_split': 4, 'min_samples_leaf': 1, 'max_features': 'sqrt', 'bootstrap': False, 'criterion': 'squared_error'}. Best is trial 341 with value: 0.2909369124469028.
[I 2024-12-04 12:04:21,721] Trial 726 finished with value: 0.4102223892983931 and parameters: {'n_estimators': 319, 'max_depth': 46, 'min_samples_split': 4, 'min_samples_leaf': 1, 'max_features': 'log2', 'bootstrap': False, 'criterion': 'absolute_error'}. Best is trial 341 with value: 0.2909369124469028.
[I 2024-12-04 12:04:23,384] Trial 750 finished with value: 0.2996469942014034 and parameters: {'n_estimators': 321, 'max_depth': 50, 'min_samples_split': 4, 'min_samples_leaf': 1, 'max_features': 'sqrt', 'bootstrap': False, 'criterion': 'squared_error'}. Best is trial 341 with value: 0.2909369124469028.
[I 2024-12-04 12:04:24,652] Trial 747 finished with value: 0.3969770695877197 and parameters: {'n_estimators': 266, 'max_depth': 48, 'min_samples_split': 4, 'min_samples_leaf': 1, 'max_features': 'log2', 'bootstrap': False, 'criterion': 'squared_error'}. Best is trial 341 with value: 0.2909369124469028.
[I 2024-12-04 12:04:25,617] Trial 744 finished with value: 0.8573884585609706 and parameters: {'n_estimators': 798, 'max_depth': 8, 'min_samples_split': 2, 'min_samples_leaf': 9, 'max_features': 'sqrt', 'bootstrap': True, 'criterion': 'absolute_error'}. Best is trial 341 with value: 0.2909369124469028.
[I 2024-12-04 12:04:26,031] Trial 757 finished with value: 0.4162632892052474 and parameters: {'n_estimators': 131, 'max_depth': 40, 'min_samples_split': 2, 'min_samples_leaf': 2, 'max_features': None, 'bootstrap': False, 'criterion': 'squared_error'}. Best is trial 341 with value: 0.2909369124469028.
[I 2024-12-04 12:04:26,477] Trial 751 finished with value: 0.29482918991088086 and parameters: {'n_estimators': 311, 'max_depth': 50, 'min_samples_split': 3, 'min_samples_leaf': 1, 'max_features': 'sqrt', 'bootstrap': False, 'criterion': 'squared_error'}. Best is trial 341 with value: 0.2909369124469028.
[I 2024-12-04 12:04:27,093] Trial 752 finished with value: 0.30121725842091246 and parameters: {'n_estimators': 365, 'max_depth': 43, 'min_samples_split': 3, 'min_samples_leaf': 1, 'max_features': 'sqrt', 'bootstrap': False, 'criterion': 'squared_error'}. Best is trial 341 with value: 0.2909369124469028.
[I 2024-12-04 12:04:28,387] Trial 746 finished with value: 0.4834069581735312 and parameters: {'n_estimators': 361, 'max_depth': 50, 'min_samples_split': 7, 'min_samples_leaf': 2, 'max_features': 'sqrt', 'bootstrap': True, 'criterion': 'squared_error'}. Best is trial 341 with value: 0.2909369124469028.
[I 2024-12-04 12:04:29,798] Trial 753 finished with value: 0.3054852271066144 and parameters: {'n_estimators': 723, 'max_depth': 46, 'min_samples_split': 4, 'min_samples_leaf': 1, 'max_features': 'sqrt', 'bootstrap': False, 'criterion': 'squared_error'}. Best is trial 341 with value: 0.2909369124469028.
[I 2024-12-04 12:04:29,968] Trial 754 finished with value: 0.2943892240462421 and parameters: {'n_estimators': 279, 'max_depth': 50, 'min_samples_split': 3, 'min_samples_leaf': 1, 'max_features': 'sqrt', 'bootstrap': False, 'criterion': 'squared_error'}. Best is trial 341 with value: 0.2909369124469028.
[I 2024-12-04 12:04:29,975] Trial 755 finished with value: 0.2993313547906067 and parameters: {'n_estimators': 222, 'max_depth': 50, 'min_samples_split': 2, 'min_samples_leaf': 1, 'max_features': 'sqrt', 'bootstrap': False, 'criterion': 'squared_error'}. Best is trial 341 with value: 0.2909369124469028.
[I 2024-12-04 12:04:30,440] Trial 756 finished with value: 0.44285924128057613 and parameters: {'n_estimators': 345, 'max_depth': 50, 'min_samples_split': 2, 'min_samples_leaf': 2, 'max_features': 'sqrt', 'bootstrap': False, 'criterion': 'squared_error'}. Best is trial 341 with value: 0.2909369124469028.
[I 2024-12-04 12:04:31,260] Trial 770 finished with value: 0.29991231005542135 and parameters: {'n_estimators': 190, 'max_depth': 50, 'min_samples_split': 4, 'min_samples_leaf': 1, 'max_features': 'sqrt', 'bootstrap': False, 'criterion': 'squared_error'}. Best is trial 341 with value: 0.2909369124469028.
[I 2024-12-04 12:04:31,437] Trial 761 finished with value: 0.2951309461142552 and parameters: {'n_estimators': 130, 'max_depth': 50, 'min_samples_split': 3, 'min_samples_leaf': 1, 'max_features': 'sqrt', 'bootstrap': False, 'criterion': 'squared_error'}. Best is trial 341 with value: 0.2909369124469028.
[I 2024-12-04 12:04:31,981] Trial 759 finished with value: 0.31128633524723864 and parameters: {'n_estimators': 100, 'max_depth': 39, 'min_samples_split': 3, 'min_samples_leaf': 1, 'max_features': 'sqrt', 'bootstrap': False, 'criterion': 'squared_error'}. Best is trial 341 with value: 0.2909369124469028.
[I 2024-12-04 12:04:31,982] Trial 760 finished with value: 0.4458760311408536 and parameters: {'n_estimators': 295, 'max_depth': 44, 'min_samples_split': 5, 'min_samples_leaf': 2, 'max_features': 'sqrt', 'bootstrap': False, 'criterion': 'squared_error'}. Best is trial 341 with value: 0.2909369124469028.
[I 2024-12-04 12:04:32,322] Trial 762 finished with value: 0.4446186457121586 and parameters: {'n_estimators': 219, 'max_depth': 43, 'min_samples_split': 4, 'min_samples_leaf': 2, 'max_features': 'sqrt', 'bootstrap': False, 'criterion': 'squared_error'}. Best is trial 341 with value: 0.2909369124469028.
[I 2024-12-04 12:04:32,768] Trial 763 finished with value: 0.4469437391170909 and parameters: {'n_estimators': 272, 'max_depth': 23, 'min_samples_split': 2, 'min_samples_leaf': 7, 'max_features': None, 'bootstrap': False, 'criterion': 'squared_error'}. Best is trial 341 with value: 0.2909369124469028.
[I 2024-12-04 12:04:32,842] Trial 767 finished with value: 0.3195086239272022 and parameters: {'n_estimators': 100, 'max_depth': 42, 'min_samples_split': 6, 'min_samples_leaf': 1, 'max_features': 'sqrt', 'bootstrap': False, 'criterion': 'squared_error'}. Best is trial 341 with value: 0.2909369124469028.
[I 2024-12-04 12:04:34,652] Trial 771 finished with value: 0.3034491377544164 and parameters: {'n_estimators': 138, 'max_depth': 43, 'min_samples_split': 2, 'min_samples_leaf': 1, 'max_features': 'sqrt', 'bootstrap': False, 'criterion': 'squared_error'}. Best is trial 341 with value: 0.2909369124469028.
[I 2024-12-04 12:04:35,382] Trial 769 finished with value: 0.30972783429585465 and parameters: {'n_estimators': 283, 'max_depth': 42, 'min_samples_split': 4, 'min_samples_leaf': 1, 'max_features': 'sqrt', 'bootstrap': False, 'criterion': 'squared_error'}. Best is trial 341 with value: 0.2909369124469028.
[I 2024-12-04 12:04:36,241] Trial 764 finished with value: 0.3120996405040376 and parameters: {'n_estimators': 117, 'max_depth': 50, 'min_samples_split': 4, 'min_samples_leaf': 1, 'max_features': 'sqrt', 'bootstrap': False, 'criterion': 'absolute_error'}. Best is trial 341 with value: 0.2909369124469028.
[I 2024-12-04 12:04:36,859] Trial 772 finished with value: 0.4450714150679626 and parameters: {'n_estimators': 241, 'max_depth': 43, 'min_samples_split': 2, 'min_samples_leaf': 2, 'max_features': 'sqrt', 'bootstrap': False, 'criterion': 'squared_error'}. Best is trial 341 with value: 0.2909369124469028.
[I 2024-12-04 12:04:37,066] Trial 766 finished with value: 0.30286079130398874 and parameters: {'n_estimators': 303, 'max_depth': 42, 'min_samples_split': 3, 'min_samples_leaf': 1, 'max_features': 'sqrt', 'bootstrap': False, 'criterion': 'squared_error'}. Best is trial 341 with value: 0.2909369124469028.
[I 2024-12-04 12:04:37,664] Trial 687 finished with value: 0.4513858401630105 and parameters: {'n_estimators': 620, 'max_depth': 22, 'min_samples_split': 6, 'min_samples_leaf': 5, 'max_features': None, 'bootstrap': False, 'criterion': 'absolute_error'}. Best is trial 341 with value: 0.2909369124469028.
[I 2024-12-04 12:04:38,071] Trial 773 finished with value: 0.3062893436396824 and parameters: {'n_estimators': 281, 'max_depth': 43, 'min_samples_split': 4, 'min_samples_leaf': 1, 'max_features': 'sqrt', 'bootstrap': False, 'criterion': 'squared_error'}. Best is trial 341 with value: 0.2909369124469028.
[I 2024-12-04 12:04:38,927] Trial 684 finished with value: 0.3634211241165238 and parameters: {'n_estimators': 410, 'max_depth': 20, 'min_samples_split': 8, 'min_samples_leaf': 1, 'max_features': None, 'bootstrap': True, 'criterion': 'absolute_error'}. Best is trial 341 with value: 0.2909369124469028.
[I 2024-12-04 12:04:40,079] Trial 777 finished with value: 0.5681313665579397 and parameters: {'n_estimators': 861, 'max_depth': 40, 'min_samples_split': 17, 'min_samples_leaf': 3, 'max_features': 'sqrt', 'bootstrap': True, 'criterion': 'squared_error'}. Best is trial 341 with value: 0.2909369124469028.
[I 2024-12-04 12:04:40,096] Trial 765 finished with value: 0.2978466451929449 and parameters: {'n_estimators': 110, 'max_depth': 49, 'min_samples_split': 3, 'min_samples_leaf': 1, 'max_features': 'sqrt', 'bootstrap': False, 'criterion': 'squared_error'}. Best is trial 341 with value: 0.2909369124469028.
[I 2024-12-04 12:04:40,459] Trial 776 finished with value: 0.44379880315301573 and parameters: {'n_estimators': 583, 'max_depth': 41, 'min_samples_split': 4, 'min_samples_leaf': 2, 'max_features': 'sqrt', 'bootstrap': False, 'criterion': 'squared_error'}. Best is trial 341 with value: 0.2909369124469028.
[I 2024-12-04 12:04:40,535] Trial 774 finished with value: 0.3054534187339801 and parameters: {'n_estimators': 137, 'max_depth': 49, 'min_samples_split': 4, 'min_samples_leaf': 1, 'max_features': 'sqrt', 'bootstrap': False, 'criterion': 'squared_error'}. Best is trial 341 with value: 0.2909369124469028.
[I 2024-12-04 12:04:41,018] Trial 758 finished with value: 0.7834815834097657 and parameters: {'n_estimators': 974, 'max_depth': 35, 'min_samples_split': 6, 'min_samples_leaf': 6, 'max_features': 'sqrt', 'bootstrap': True, 'criterion': 'absolute_error'}. Best is trial 341 with value: 0.2909369124469028.
[I 2024-12-04 12:04:41,977] Trial 782 finished with value: 0.3041326244209879 and parameters: {'n_estimators': 303, 'max_depth': 44, 'min_samples_split': 2, 'min_samples_leaf': 1, 'max_features': 'sqrt', 'bootstrap': False, 'criterion': 'squared_error'}. Best is trial 341 with value: 0.2909369124469028.
[I 2024-12-04 12:04:42,020] Trial 778 finished with value: 0.4278558597867551 and parameters: {'n_estimators': 813, 'max_depth': 42, 'min_samples_split': 4, 'min_samples_leaf': 1, 'max_features': 'log2', 'bootstrap': False, 'criterion': 'squared_error'}. Best is trial 341 with value: 0.2909369124469028.
[I 2024-12-04 12:04:42,652] Trial 783 finished with value: 0.44472064776892656 and parameters: {'n_estimators': 289, 'max_depth': 43, 'min_samples_split': 3, 'min_samples_leaf': 2, 'max_features': 'sqrt', 'bootstrap': False, 'criterion': 'squared_error'}. Best is trial 341 with value: 0.2909369124469028.
[I 2024-12-04 12:04:42,860] Trial 786 finished with value: 0.8508456090761228 and parameters: {'n_estimators': 599, 'max_depth': 45, 'min_samples_split': 20, 'min_samples_leaf': 14, 'max_features': 'sqrt', 'bootstrap': False, 'criterion': 'squared_error'}. Best is trial 341 with value: 0.2909369124469028.
[I 2024-12-04 12:04:43,400] Trial 784 finished with value: 0.299508007822551 and parameters: {'n_estimators': 244, 'max_depth': 50, 'min_samples_split': 2, 'min_samples_leaf': 1, 'max_features': 'sqrt', 'bootstrap': False, 'criterion': 'squared_error'}. Best is trial 341 with value: 0.2909369124469028.
[I 2024-12-04 12:04:44,008] Trial 781 finished with value: 0.3781151813374139 and parameters: {'n_estimators': 163, 'max_depth': 50, 'min_samples_split': 3, 'min_samples_leaf': 1, 'max_features': 'log2', 'bootstrap': False, 'criterion': 'squared_error'}. Best is trial 341 with value: 0.2909369124469028.
[I 2024-12-04 12:04:44,170] Trial 780 finished with value: 0.7957577422185219 and parameters: {'n_estimators': 939, 'max_depth': 48, 'min_samples_split': 2, 'min_samples_leaf': 3, 'max_features': 'log2', 'bootstrap': False, 'criterion': 'squared_error'}. Best is trial 341 with value: 0.2909369124469028.
[I 2024-12-04 12:04:45,249] Trial 768 finished with value: 0.6462038082987889 and parameters: {'n_estimators': 789, 'max_depth': 16, 'min_samples_split': 8, 'min_samples_leaf': 5, 'max_features': 'sqrt', 'bootstrap': False, 'criterion': 'absolute_error'}. Best is trial 341 with value: 0.2909369124469028.
[I 2024-12-04 12:04:48,254] Trial 785 finished with value: 0.31441455682262476 and parameters: {'n_estimators': 320, 'max_depth': 50, 'min_samples_split': 7, 'min_samples_leaf': 1, 'max_features': 'sqrt', 'bootstrap': False, 'criterion': 'squared_error'}. Best is trial 341 with value: 0.2909369124469028.
[I 2024-12-04 12:04:49,188] Trial 795 finished with value: 0.4438023372693443 and parameters: {'n_estimators': 310, 'max_depth': 50, 'min_samples_split': 4, 'min_samples_leaf': 2, 'max_features': 'sqrt', 'bootstrap': False, 'criterion': 'squared_error'}. Best is trial 341 with value: 0.2909369124469028.
[I 2024-12-04 12:04:49,469] Trial 792 finished with value: 0.50041847770629 and parameters: {'n_estimators': 683, 'max_depth': 7, 'min_samples_split': 10, 'min_samples_leaf': 1, 'max_features': None, 'bootstrap': False, 'criterion': 'squared_error'}. Best is trial 341 with value: 0.2909369124469028.
[I 2024-12-04 12:04:49,708] Trial 794 finished with value: 0.4433284817157537 and parameters: {'n_estimators': 316, 'max_depth': 50, 'min_samples_split': 3, 'min_samples_leaf': 2, 'max_features': 'sqrt', 'bootstrap': False, 'criterion': 'squared_error'}. Best is trial 341 with value: 0.2909369124469028.
[I 2024-12-04 12:04:49,737] Trial 789 finished with value: 0.31704077937950886 and parameters: {'n_estimators': 354, 'max_depth': 49, 'min_samples_split': 3, 'min_samples_leaf': 1, 'max_features': 'sqrt', 'bootstrap': True, 'criterion': 'squared_error'}. Best is trial 341 with value: 0.2909369124469028.
[I 2024-12-04 12:04:50,422] Trial 779 finished with value: 0.4669548901713919 and parameters: {'n_estimators': 315, 'max_depth': 38, 'min_samples_split': 5, 'min_samples_leaf': 2, 'max_features': 'sqrt', 'bootstrap': False, 'criterion': 'absolute_error'}. Best is trial 341 with value: 0.2909369124469028.
[I 2024-12-04 12:04:50,797] Trial 793 finished with value: 0.30076744740825284 and parameters: {'n_estimators': 290, 'max_depth': 43, 'min_samples_split': 3, 'min_samples_leaf': 1, 'max_features': 'sqrt', 'bootstrap': False, 'criterion': 'squared_error'}. Best is trial 341 with value: 0.2909369124469028.
[I 2024-12-04 12:04:50,798] Trial 791 finished with value: 0.29572542510142313 and parameters: {'n_estimators': 312, 'max_depth': 46, 'min_samples_split': 3, 'min_samples_leaf': 1, 'max_features': 'sqrt', 'bootstrap': False, 'criterion': 'squared_error'}. Best is trial 341 with value: 0.2909369124469028.
