[I 2024-12-04 12:22:15,283] Trial 1876 finished with value: 0.7642541437492997 and parameters: {'n_estimators': 543, 'max_depth': 36, 'min_samples_split': 8, 'min_samples_leaf': 1, 'max_features': 'log2', 'bootstrap': False, 'criterion': 'squared_error'}. Best is trial 1749 with value: 0.502720715661024.
[I 2024-12-04 12:22:15,527] Trial 1878 finished with value: 0.7051488613613435 and parameters: {'n_estimators': 243, 'max_depth': 26, 'min_samples_split': 31, 'min_samples_leaf': 13, 'max_features': None, 'bootstrap': False, 'criterion': 'squared_error'}. Best is trial 1749 with value: 0.502720715661024.
[I 2024-12-04 12:22:15,733] Trial 1880 finished with value: 1.2365214984453448 and parameters: {'n_estimators': 786, 'max_depth': 45, 'min_samples_split': 2, 'min_samples_leaf': 7, 'max_features': 'log2', 'bootstrap': True, 'criterion': 'squared_error'}. Best is trial 1749 with value: 0.502720715661024.
[I 2024-12-04 12:22:16,543] Trial 1877 finished with value: 0.514845395630907 and parameters: {'n_estimators': 107, 'max_depth': 15, 'min_samples_split': 2, 'min_samples_leaf': 1, 'max_features': None, 'bootstrap': True, 'criterion': 'absolute_error'}. Best is trial 1749 with value: 0.502720715661024.
[I 2024-12-04 12:22:17,696] Trial 1865 finished with value: 0.5223250596427422 and parameters: {'n_estimators': 260, 'max_depth': 20, 'min_samples_split': 3, 'min_samples_leaf': 1, 'max_features': None, 'bootstrap': True, 'criterion': 'absolute_error'}. Best is trial 1749 with value: 0.502720715661024.
[I 2024-12-04 12:22:18,294] Trial 1879 finished with value: 0.5254950279038404 and parameters: {'n_estimators': 235, 'max_depth': 24, 'min_samples_split': 4, 'min_samples_leaf': 1, 'max_features': None, 'bootstrap': True, 'criterion': 'squared_error'}. Best is trial 1749 with value: 0.502720715661024.
[I 2024-12-04 12:22:18,817] Trial 1881 finished with value: 0.5550257186001093 and parameters: {'n_estimators': 110, 'max_depth': 23, 'min_samples_split': 3, 'min_samples_leaf': 2, 'max_features': None, 'bootstrap': True, 'criterion': 'absolute_error'}. Best is trial 1749 with value: 0.502720715661024.
[I 2024-12-04 12:22:19,393] Trial 1885 finished with value: 0.8393628118209431 and parameters: {'n_estimators': 950, 'max_depth': 30, 'min_samples_split': 48, 'min_samples_leaf': 1, 'max_features': 'log2', 'bootstrap': False, 'criterion': 'squared_error'}. Best is trial 1749 with value: 0.502720715661024.
[I 2024-12-04 12:22:20,000] Trial 1891 finished with value: 1.147374372134411 and parameters: {'n_estimators': 105, 'max_depth': 8, 'min_samples_split': 7, 'min_samples_leaf': 2, 'max_features': 'sqrt', 'bootstrap': True, 'criterion': 'absolute_error'}. Best is trial 1749 with value: 0.502720715661024.
[I 2024-12-04 12:22:20,097] Trial 1869 finished with value: 0.5261272098569849 and parameters: {'n_estimators': 236, 'max_depth': 23, 'min_samples_split': 3, 'min_samples_leaf': 1, 'max_features': None, 'bootstrap': True, 'criterion': 'absolute_error'}. Best is trial 1749 with value: 0.502720715661024.
[I 2024-12-04 12:22:21,052] Trial 1861 finished with value: 0.5595515317844703 and parameters: {'n_estimators': 467, 'max_depth': 15, 'min_samples_split': 6, 'min_samples_leaf': 2, 'max_features': None, 'bootstrap': True, 'criterion': 'absolute_error'}. Best is trial 1749 with value: 0.502720715661024.
[I 2024-12-04 12:22:21,056] Trial 1867 finished with value: 0.5204777261541819 and parameters: {'n_estimators': 257, 'max_depth': 26, 'min_samples_split': 5, 'min_samples_leaf': 1, 'max_features': None, 'bootstrap': True, 'criterion': 'absolute_error'}. Best is trial 1749 with value: 0.502720715661024.
[I 2024-12-04 12:22:21,359] Trial 1884 finished with value: 0.5136514303809601 and parameters: {'n_estimators': 104, 'max_depth': 22, 'min_samples_split': 3, 'min_samples_leaf': 1, 'max_features': None, 'bootstrap': True, 'criterion': 'absolute_error'}. Best is trial 1749 with value: 0.502720715661024.
[I 2024-12-04 12:22:22,056] Trial 1874 finished with value: 0.5641338315222958 and parameters: {'n_estimators': 159, 'max_depth': 16, 'min_samples_split': 3, 'min_samples_leaf': 1, 'max_features': None, 'bootstrap': False, 'criterion': 'absolute_error'}. Best is trial 1749 with value: 0.502720715661024.
[I 2024-12-04 12:22:22,267] Trial 1890 finished with value: 0.5125436462381847 and parameters: {'n_estimators': 118, 'max_depth': 16, 'min_samples_split': 5, 'min_samples_leaf': 1, 'max_features': None, 'bootstrap': True, 'criterion': 'squared_error'}. Best is trial 1749 with value: 0.502720715661024.
[I 2024-12-04 12:22:22,334] Trial 1889 finished with value: 0.9411163820080855 and parameters: {'n_estimators': 132, 'max_depth': 12, 'min_samples_split': 9, 'min_samples_leaf': 1, 'max_features': 'sqrt', 'bootstrap': False, 'criterion': 'absolute_error'}. Best is trial 1749 with value: 0.502720715661024.
[I 2024-12-04 12:22:23,277] Trial 1886 finished with value: 1.0144727050347269 and parameters: {'n_estimators': 428, 'max_depth': 20, 'min_samples_split': 5, 'min_samples_leaf': 1, 'max_features': 'log2', 'bootstrap': True, 'criterion': 'absolute_error'}. Best is trial 1749 with value: 0.502720715661024.
[I 2024-12-04 12:22:24,403] Trial 1883 finished with value: 0.5185348758063046 and parameters: {'n_estimators': 103, 'max_depth': 20, 'min_samples_split': 3, 'min_samples_leaf': 1, 'max_features': None, 'bootstrap': True, 'criterion': 'absolute_error'}. Best is trial 1749 with value: 0.502720715661024.
[I 2024-12-04 12:22:26,248] Trial 1893 finished with value: 0.555689151682884 and parameters: {'n_estimators': 101, 'max_depth': 21, 'min_samples_split': 7, 'min_samples_leaf': 2, 'max_features': None, 'bootstrap': True, 'criterion': 'absolute_error'}. Best is trial 1749 with value: 0.502720715661024.
[I 2024-12-04 12:22:28,657] Trial 1892 finished with value: 1.331890895290918 and parameters: {'n_estimators': 968, 'max_depth': 22, 'min_samples_split': 3, 'min_samples_leaf': 4, 'max_features': 'log2', 'bootstrap': True, 'criterion': 'absolute_error'}. Best is trial 1749 with value: 0.502720715661024.
[I 2024-12-04 12:22:30,007] Trial 1887 finished with value: 0.5587644856948247 and parameters: {'n_estimators': 121, 'max_depth': 22, 'min_samples_split': 4, 'min_samples_leaf': 1, 'max_features': None, 'bootstrap': False, 'criterion': 'absolute_error'}. Best is trial 1749 with value: 0.502720715661024.
[I 2024-12-04 12:22:31,579] Trial 1898 finished with value: 0.5547002121354319 and parameters: {'n_estimators': 104, 'max_depth': 18, 'min_samples_split': 4, 'min_samples_leaf': 2, 'max_features': None, 'bootstrap': True, 'criterion': 'absolute_error'}. Best is trial 1749 with value: 0.502720715661024.
[I 2024-12-04 12:22:31,886] Trial 1899 finished with value: 0.6806757288794909 and parameters: {'n_estimators': 966, 'max_depth': 27, 'min_samples_split': 9, 'min_samples_leaf': 7, 'max_features': None, 'bootstrap': False, 'criterion': 'squared_error'}. Best is trial 1749 with value: 0.502720715661024.
[I 2024-12-04 12:22:34,620] Trial 1896 finished with value: 0.5043048340394243 and parameters: {'n_estimators': 102, 'max_depth': 16, 'min_samples_split': 4, 'min_samples_leaf': 1, 'max_features': None, 'bootstrap': True, 'criterion': 'absolute_error'}. Best is trial 1749 with value: 0.502720715661024.
[I 2024-12-04 12:22:34,739] Trial 1901 finished with value: 0.5256417497588162 and parameters: {'n_estimators': 111, 'max_depth': 20, 'min_samples_split': 7, 'min_samples_leaf': 1, 'max_features': None, 'bootstrap': True, 'criterion': 'absolute_error'}. Best is trial 1749 with value: 0.502720715661024.
[I 2024-12-04 12:22:35,608] Trial 1894 finished with value: 0.558477462784065 and parameters: {'n_estimators': 263, 'max_depth': 15, 'min_samples_split': 7, 'min_samples_leaf': 2, 'max_features': None, 'bootstrap': True, 'criterion': 'absolute_error'}. Best is trial 1749 with value: 0.502720715661024.
[I 2024-12-04 12:22:36,088] Trial 1904 finished with value: 0.5924188920474155 and parameters: {'n_estimators': 186, 'max_depth': 46, 'min_samples_split': 9, 'min_samples_leaf': 1, 'max_features': None, 'bootstrap': False, 'criterion': 'squared_error'}. Best is trial 1749 with value: 0.502720715661024.
[I 2024-12-04 12:22:36,467] Trial 1907 finished with value: 0.5105161362181976 and parameters: {'n_estimators': 109, 'max_depth': 20, 'min_samples_split': 4, 'min_samples_leaf': 1, 'max_features': None, 'bootstrap': True, 'criterion': 'absolute_error'}. Best is trial 1749 with value: 0.502720715661024.
[I 2024-12-04 12:22:36,469] Trial 1895 finished with value: 0.5146359750451713 and parameters: {'n_estimators': 114, 'max_depth': 17, 'min_samples_split': 6, 'min_samples_leaf': 1, 'max_features': None, 'bootstrap': True, 'criterion': 'absolute_error'}. Best is trial 1749 with value: 0.502720715661024.
[I 2024-12-04 12:22:36,470] Trial 1900 finished with value: 0.5556624497035704 and parameters: {'n_estimators': 123, 'max_depth': 21, 'min_samples_split': 2, 'min_samples_leaf': 2, 'max_features': None, 'bootstrap': True, 'criterion': 'absolute_error'}. Best is trial 1749 with value: 0.502720715661024.
[I 2024-12-04 12:22:36,815] Trial 1888 finished with value: 0.5149058099718904 and parameters: {'n_estimators': 252, 'max_depth': 16, 'min_samples_split': 4, 'min_samples_leaf': 1, 'max_features': None, 'bootstrap': True, 'criterion': 'absolute_error'}. Best is trial 1749 with value: 0.502720715661024.
[I 2024-12-04 12:22:37,087] Trial 1905 finished with value: 0.549429655770731 and parameters: {'n_estimators': 181, 'max_depth': 17, 'min_samples_split': 2, 'min_samples_leaf': 2, 'max_features': None, 'bootstrap': True, 'criterion': 'squared_error'}. Best is trial 1749 with value: 0.502720715661024.
[I 2024-12-04 12:22:37,537] Trial 1902 finished with value: 0.5173365513964129 and parameters: {'n_estimators': 109, 'max_depth': 11, 'min_samples_split': 3, 'min_samples_leaf': 1, 'max_features': None, 'bootstrap': True, 'criterion': 'absolute_error'}. Best is trial 1749 with value: 0.502720715661024.
[I 2024-12-04 12:22:38,557] Trial 1903 finished with value: 0.5111203043120573 and parameters: {'n_estimators': 105, 'max_depth': 25, 'min_samples_split': 4, 'min_samples_leaf': 1, 'max_features': None, 'bootstrap': True, 'criterion': 'absolute_error'}. Best is trial 1749 with value: 0.502720715661024.
[I 2024-12-04 12:22:39,571] Trial 1908 finished with value: 0.5104917036299205 and parameters: {'n_estimators': 114, 'max_depth': 20, 'min_samples_split': 4, 'min_samples_leaf': 1, 'max_features': None, 'bootstrap': True, 'criterion': 'absolute_error'}. Best is trial 1749 with value: 0.502720715661024.
[I 2024-12-04 12:22:40,163] Trial 1909 finished with value: 1.2209090510576814 and parameters: {'n_estimators': 654, 'max_depth': 22, 'min_samples_split': 2, 'min_samples_leaf': 3, 'max_features': 'log2', 'bootstrap': True, 'criterion': 'squared_error'}. Best is trial 1749 with value: 0.502720715661024.
[I 2024-12-04 12:22:40,357] Trial 1897 finished with value: 0.5159973800083546 and parameters: {'n_estimators': 256, 'max_depth': 20, 'min_samples_split': 5, 'min_samples_leaf': 1, 'max_features': None, 'bootstrap': True, 'criterion': 'absolute_error'}. Best is trial 1749 with value: 0.502720715661024.
[I 2024-12-04 12:22:42,038] Trial 1916 finished with value: 1.053564801370297 and parameters: {'n_estimators': 286, 'max_depth': 18, 'min_samples_split': 49, 'min_samples_leaf': 5, 'max_features': 'sqrt', 'bootstrap': False, 'criterion': 'squared_error'}. Best is trial 1749 with value: 0.502720715661024.
[I 2024-12-04 12:22:42,317] Trial 1918 finished with value: 1.0859220516987806 and parameters: {'n_estimators': 478, 'max_depth': 10, 'min_samples_split': 4, 'min_samples_leaf': 1, 'max_features': 'log2', 'bootstrap': True, 'criterion': 'squared_error'}. Best is trial 1749 with value: 0.502720715661024.
[I 2024-12-04 12:22:43,222] Trial 1912 finished with value: 0.5104651037958033 and parameters: {'n_estimators': 109, 'max_depth': 22, 'min_samples_split': 5, 'min_samples_leaf': 1, 'max_features': None, 'bootstrap': True, 'criterion': 'absolute_error'}. Best is trial 1749 with value: 0.502720715661024.
[I 2024-12-04 12:22:43,664] Trial 1914 finished with value: 0.5558220701608049 and parameters: {'n_estimators': 112, 'max_depth': 24, 'min_samples_split': 3, 'min_samples_leaf': 2, 'max_features': None, 'bootstrap': True, 'criterion': 'absolute_error'}. Best is trial 1749 with value: 0.502720715661024.
[I 2024-12-04 12:22:44,079] Trial 1913 finished with value: 0.5085544378841078 and parameters: {'n_estimators': 101, 'max_depth': 23, 'min_samples_split': 4, 'min_samples_leaf': 1, 'max_features': None, 'bootstrap': True, 'criterion': 'absolute_error'}. Best is trial 1749 with value: 0.502720715661024.
[I 2024-12-04 12:22:45,775] Trial 1911 finished with value: 0.5126681329043457 and parameters: {'n_estimators': 108, 'max_depth': 17, 'min_samples_split': 4, 'min_samples_leaf': 1, 'max_features': None, 'bootstrap': True, 'criterion': 'absolute_error'}. Best is trial 1749 with value: 0.502720715661024.
[I 2024-12-04 12:22:45,775] Trial 1906 finished with value: 0.5183448406120096 and parameters: {'n_estimators': 258, 'max_depth': 15, 'min_samples_split': 3, 'min_samples_leaf': 1, 'max_features': None, 'bootstrap': True, 'criterion': 'absolute_error'}. Best is trial 1749 with value: 0.502720715661024.
[I 2024-12-04 12:22:46,868] Trial 1920 finished with value: 0.5160369256537153 and parameters: {'n_estimators': 103, 'max_depth': 14, 'min_samples_split': 7, 'min_samples_leaf': 1, 'max_features': None, 'bootstrap': True, 'criterion': 'absolute_error'}. Best is trial 1749 with value: 0.502720715661024.
[I 2024-12-04 12:22:47,399] Trial 1910 finished with value: 0.5209103841236093 and parameters: {'n_estimators': 240, 'max_depth': 11, 'min_samples_split': 2, 'min_samples_leaf': 1, 'max_features': None, 'bootstrap': True, 'criterion': 'absolute_error'}. Best is trial 1749 with value: 0.502720715661024.
[I 2024-12-04 12:22:50,285] Trial 1923 finished with value: 0.7365816970786071 and parameters: {'n_estimators': 770, 'max_depth': 33, 'min_samples_split': 2, 'min_samples_leaf': 1, 'max_features': 'log2', 'bootstrap': False, 'criterion': 'squared_error'}. Best is trial 1749 with value: 0.502720715661024.
[I 2024-12-04 12:22:52,951] Trial 1935 finished with value: 0.9633589927179362 and parameters: {'n_estimators': 113, 'max_depth': 22, 'min_samples_split': 2, 'min_samples_leaf': 1, 'max_features': 'log2', 'bootstrap': True, 'criterion': 'absolute_error'}. Best is trial 1749 with value: 0.502720715661024.
[I 2024-12-04 12:22:53,167] Trial 1919 finished with value: 0.5619766006993799 and parameters: {'n_estimators': 261, 'max_depth': 20, 'min_samples_split': 4, 'min_samples_leaf': 2, 'max_features': None, 'bootstrap': True, 'criterion': 'absolute_error'}. Best is trial 1749 with value: 0.502720715661024.
[I 2024-12-04 12:22:53,194] Trial 1924 finished with value: 0.5608715396311845 and parameters: {'n_estimators': 107, 'max_depth': 18, 'min_samples_split': 8, 'min_samples_leaf': 2, 'max_features': None, 'bootstrap': True, 'criterion': 'absolute_error'}. Best is trial 1749 with value: 0.502720715661024.
[I 2024-12-04 12:22:53,599] Trial 1917 finished with value: 0.5559497452255103 and parameters: {'n_estimators': 263, 'max_depth': 11, 'min_samples_split': 5, 'min_samples_leaf': 2, 'max_features': None, 'bootstrap': True, 'criterion': 'absolute_error'}. Best is trial 1749 with value: 0.502720715661024.
[I 2024-12-04 12:22:58,737] Trial 1915 finished with value: 0.5588737573392455 and parameters: {'n_estimators': 235, 'max_depth': 23, 'min_samples_split': 7, 'min_samples_leaf': 2, 'max_features': None, 'bootstrap': True, 'criterion': 'absolute_error'}. Best is trial 1749 with value: 0.502720715661024.
[I 2024-12-04 12:22:58,764] Trial 1922 finished with value: 0.5176777331073575 and parameters: {'n_estimators': 248, 'max_depth': 15, 'min_samples_split': 6, 'min_samples_leaf': 1, 'max_features': None, 'bootstrap': True, 'criterion': 'absolute_error'}. Best is trial 1749 with value: 0.502720715661024.
[I 2024-12-04 12:22:59,346] Trial 1921 finished with value: 0.5168975389599368 and parameters: {'n_estimators': 226, 'max_depth': 16, 'min_samples_split': 5, 'min_samples_leaf': 1, 'max_features': None, 'bootstrap': True, 'criterion': 'absolute_error'}. Best is trial 1749 with value: 0.502720715661024.
[I 2024-12-04 12:22:59,394] Trial 1936 finished with value: 0.5120212051165653 and parameters: {'n_estimators': 103, 'max_depth': 12, 'min_samples_split': 6, 'min_samples_leaf': 1, 'max_features': None, 'bootstrap': True, 'criterion': 'absolute_error'}. Best is trial 1749 with value: 0.502720715661024.
[I 2024-12-04 12:23:03,384] Trial 1929 finished with value: 0.5266362180695444 and parameters: {'n_estimators': 100, 'max_depth': 23, 'min_samples_split': 3, 'min_samples_leaf': 1, 'max_features': None, 'bootstrap': True, 'criterion': 'absolute_error'}. Best is trial 1749 with value: 0.502720715661024.
[I 2024-12-04 12:23:04,797] Trial 1926 finished with value: 0.5185019387602493 and parameters: {'n_estimators': 234, 'max_depth': 27, 'min_samples_split': 4, 'min_samples_leaf': 1, 'max_features': None, 'bootstrap': True, 'criterion': 'absolute_error'}. Best is trial 1749 with value: 0.502720715661024.
[I 2024-12-04 12:23:05,390] Trial 1925 finished with value: 0.732135754207598 and parameters: {'n_estimators': 491, 'max_depth': 10, 'min_samples_split': 48, 'min_samples_leaf': 5, 'max_features': None, 'bootstrap': True, 'criterion': 'absolute_error'}. Best is trial 1749 with value: 0.502720715661024.
[I 2024-12-04 12:23:05,586] Trial 1939 finished with value: 0.5538011839738233 and parameters: {'n_estimators': 113, 'max_depth': 15, 'min_samples_split': 4, 'min_samples_leaf': 2, 'max_features': None, 'bootstrap': True, 'criterion': 'absolute_error'}. Best is trial 1749 with value: 0.502720715661024.
[I 2024-12-04 12:23:06,762] Trial 1934 finished with value: 0.5571125025242807 and parameters: {'n_estimators': 113, 'max_depth': 17, 'min_samples_split': 4, 'min_samples_leaf': 2, 'max_features': None, 'bootstrap': True, 'criterion': 'absolute_error'}. Best is trial 1749 with value: 0.502720715661024.
[I 2024-12-04 12:23:06,897] Trial 1932 finished with value: 0.5590787256967278 and parameters: {'n_estimators': 244, 'max_depth': 24, 'min_samples_split': 4, 'min_samples_leaf': 2, 'max_features': None, 'bootstrap': True, 'criterion': 'absolute_error'}. Best is trial 1749 with value: 0.502720715661024.
[I 2024-12-04 12:23:07,505] Trial 1942 finished with value: 0.5597886119824448 and parameters: {'n_estimators': 102, 'max_depth': 26, 'min_samples_split': 5, 'min_samples_leaf': 2, 'max_features': None, 'bootstrap': True, 'criterion': 'absolute_error'}. Best is trial 1749 with value: 0.502720715661024.
[I 2024-12-04 12:23:07,914] Trial 1947 finished with value: 0.5466901443986423 and parameters: {'n_estimators': 437, 'max_depth': 47, 'min_samples_split': 2, 'min_samples_leaf': 1, 'max_features': 'sqrt', 'bootstrap': False, 'criterion': 'squared_error'}. Best is trial 1749 with value: 0.502720715661024.
[I 2024-12-04 12:23:07,937] Trial 1943 finished with value: 0.5143647365406863 and parameters: {'n_estimators': 109, 'max_depth': 9, 'min_samples_split': 4, 'min_samples_leaf': 1, 'max_features': None, 'bootstrap': True, 'criterion': 'absolute_error'}. Best is trial 1749 with value: 0.502720715661024.
[I 2024-12-04 12:23:08,638] Trial 1933 finished with value: 0.5169752812844512 and parameters: {'n_estimators': 233, 'max_depth': 23, 'min_samples_split': 4, 'min_samples_leaf': 1, 'max_features': None, 'bootstrap': True, 'criterion': 'absolute_error'}. Best is trial 1749 with value: 0.502720715661024.
[I 2024-12-04 12:23:10,379] Trial 1928 finished with value: 0.5164077930170826 and parameters: {'n_estimators': 263, 'max_depth': 18, 'min_samples_split': 5, 'min_samples_leaf': 1, 'max_features': None, 'bootstrap': True, 'criterion': 'absolute_error'}. Best is trial 1749 with value: 0.502720715661024.
[I 2024-12-04 12:23:10,666] Trial 1950 finished with value: 1.050052062730137 and parameters: {'n_estimators': 400, 'max_depth': 50, 'min_samples_split': 2, 'min_samples_leaf': 5, 'max_features': 'sqrt', 'bootstrap': False, 'criterion': 'squared_error'}. Best is trial 1749 with value: 0.502720715661024.
[I 2024-12-04 12:23:10,926] Trial 1930 finished with value: 0.5167268434525046 and parameters: {'n_estimators': 226, 'max_depth': 14, 'min_samples_split': 5, 'min_samples_leaf': 1, 'max_features': None, 'bootstrap': True, 'criterion': 'absolute_error'}. Best is trial 1749 with value: 0.502720715661024.
[I 2024-12-04 12:23:11,052] Trial 1937 finished with value: 0.5241358381597888 and parameters: {'n_estimators': 243, 'max_depth': 17, 'min_samples_split': 8, 'min_samples_leaf': 1, 'max_features': None, 'bootstrap': True, 'criterion': 'absolute_error'}. Best is trial 1749 with value: 0.502720715661024.
[I 2024-12-04 12:23:11,565] Trial 1941 finished with value: 0.8166480925020063 and parameters: {'n_estimators': 174, 'max_depth': 19, 'min_samples_split': 5, 'min_samples_leaf': 1, 'max_features': 'sqrt', 'bootstrap': True, 'criterion': 'absolute_error'}. Best is trial 1749 with value: 0.502720715661024.
[I 2024-12-04 12:23:13,201] Trial 1940 finished with value: 0.5081901890132947 and parameters: {'n_estimators': 106, 'max_depth': 18, 'min_samples_split': 5, 'min_samples_leaf': 1, 'max_features': None, 'bootstrap': True, 'criterion': 'absolute_error'}. Best is trial 1749 with value: 0.502720715661024.
[I 2024-12-04 12:23:13,203] Trial 1931 finished with value: 0.5208218771251105 and parameters: {'n_estimators': 252, 'max_depth': 26, 'min_samples_split': 6, 'min_samples_leaf': 1, 'max_features': None, 'bootstrap': True, 'criterion': 'absolute_error'}. Best is trial 1749 with value: 0.502720715661024.
