[I 2024-12-04 11:52:33,827] Trial 134 finished with value: 0.506419555163107 and parameters: {'max_depth': 33, 'min_samples_split': 5, 'min_samples_leaf': 1, 'max_features': 'sqrt', 'criterion': 'squared_error', 'splitter': 'best'}. Best is trial 91 with value: 0.43250115503666103.
[I 2024-12-04 11:52:34,297] Trial 162 finished with value: 0.9982171095081254 and parameters: {'max_depth': 1, 'min_samples_split': 4, 'min_samples_leaf': 9, 'max_features': 'log2', 'criterion': 'squared_error', 'splitter': 'best'}. Best is trial 91 with value: 0.43250115503666103.
[I 2024-12-04 11:52:34,962] Trial 163 finished with value: 0.6014044554271846 and parameters: {'max_depth': 30, 'min_samples_split': 3, 'min_samples_leaf': 1, 'max_features': 'sqrt', 'criterion': 'squared_error', 'splitter': 'random'}. Best is trial 91 with value: 0.43250115503666103.
[I 2024-12-04 11:52:35,261] Trial 160 finished with value: 0.483263059820054 and parameters: {'max_depth': 35, 'min_samples_split': 5, 'min_samples_leaf': 1, 'max_features': 'sqrt', 'criterion': 'squared_error', 'splitter': 'best'}. Best is trial 91 with value: 0.43250115503666103.
[I 2024-12-04 11:52:35,263] Trial 161 finished with value: 0.7489968695951765 and parameters: {'max_depth': 28, 'min_samples_split': 16, 'min_samples_leaf': 1, 'max_features': 'log2', 'criterion': 'absolute_error', 'splitter': 'random'}. Best is trial 91 with value: 0.43250115503666103.
[I 2024-12-04 11:52:35,579] Trial 153 finished with value: 0.5170399151403982 and parameters: {'max_depth': 34, 'min_samples_split': 2, 'min_samples_leaf': 1, 'max_features': 'sqrt', 'criterion': 'squared_error', 'splitter': 'best'}. Best is trial 91 with value: 0.43250115503666103.
[I 2024-12-04 11:52:36,355] Trial 158 finished with value: 0.4872130677761166 and parameters: {'max_depth': 29, 'min_samples_split': 7, 'min_samples_leaf': 1, 'max_features': 'sqrt', 'criterion': 'squared_error', 'splitter': 'best'}. Best is trial 91 with value: 0.43250115503666103.
[I 2024-12-04 11:52:37,100] Trial 148 finished with value: 0.546632318887433 and parameters: {'max_depth': 34, 'min_samples_split': 6, 'min_samples_leaf': 2, 'max_features': 'sqrt', 'criterion': 'friedman_mse', 'splitter': 'best'}. Best is trial 91 with value: 0.43250115503666103.
[I 2024-12-04 11:52:37,270] Trial 168 finished with value: 0.4712799264758423 and parameters: {'max_depth': 34, 'min_samples_split': 8, 'min_samples_leaf': 1, 'max_features': 'sqrt', 'criterion': 'squared_error', 'splitter': 'best'}. Best is trial 91 with value: 0.43250115503666103.
[I 2024-12-04 11:52:37,988] Trial 176 finished with value: 0.464037521734687 and parameters: {'max_depth': 32, 'min_samples_split': 7, 'min_samples_leaf': 1, 'max_features': 'sqrt', 'criterion': 'squared_error', 'splitter': 'best'}. Best is trial 91 with value: 0.43250115503666103.
[I 2024-12-04 11:52:38,727] Trial 169 finished with value: 0.4731246660157492 and parameters: {'max_depth': 33, 'min_samples_split': 9, 'min_samples_leaf': 1, 'max_features': 'sqrt', 'criterion': 'squared_error', 'splitter': 'best'}. Best is trial 91 with value: 0.43250115503666103.
[I 2024-12-04 11:52:38,897] Trial 157 finished with value: 0.5273419897492498 and parameters: {'max_depth': 35, 'min_samples_split': 15, 'min_samples_leaf': 1, 'max_features': 'sqrt', 'criterion': 'friedman_mse', 'splitter': 'best'}. Best is trial 91 with value: 0.43250115503666103.
[I 2024-12-04 11:52:39,533] Trial 173 finished with value: 0.6013237460643723 and parameters: {'max_depth': 33, 'min_samples_split': 6, 'min_samples_leaf': 3, 'max_features': 'sqrt', 'criterion': 'squared_error', 'splitter': 'best'}. Best is trial 91 with value: 0.43250115503666103.
[I 2024-12-04 11:52:39,912] Trial 164 finished with value: 0.9982171095081254 and parameters: {'max_depth': 35, 'min_samples_split': 9, 'min_samples_leaf': 5, 'max_features': 'log2', 'criterion': 'squared_error', 'splitter': 'best'}. Best is trial 91 with value: 0.43250115503666103.
[I 2024-12-04 11:52:40,164] Trial 171 finished with value: 0.7038807163439966 and parameters: {'max_depth': 33, 'min_samples_split': 11, 'min_samples_leaf': 2, 'max_features': 'sqrt', 'criterion': 'absolute_error', 'splitter': 'best'}. Best is trial 91 with value: 0.43250115503666103.
[I 2024-12-04 11:52:40,174] Trial 172 finished with value: 0.47495142754566344 and parameters: {'max_depth': 35, 'min_samples_split': 11, 'min_samples_leaf': 1, 'max_features': 'sqrt', 'criterion': 'friedman_mse', 'splitter': 'best'}. Best is trial 91 with value: 0.43250115503666103.
[I 2024-12-04 11:52:40,527] Trial 155 finished with value: 0.8525202284160492 and parameters: {'max_depth': 31, 'min_samples_split': 8, 'min_samples_leaf': 4, 'max_features': 'sqrt', 'criterion': 'squared_error', 'splitter': 'random'}. Best is trial 91 with value: 0.43250115503666103.
[I 2024-12-04 11:52:40,672] Trial 182 finished with value: 0.5299853024018957 and parameters: {'max_depth': 33, 'min_samples_split': 6, 'min_samples_leaf': 1, 'max_features': 'sqrt', 'criterion': 'squared_error', 'splitter': 'best'}. Best is trial 91 with value: 0.43250115503666103.
[I 2024-12-04 11:52:41,007] Trial 166 finished with value: 0.9044357650518715 and parameters: {'max_depth': 8, 'min_samples_split': 10, 'min_samples_leaf': 2, 'max_features': 'log2', 'criterion': 'squared_error', 'splitter': 'random'}. Best is trial 91 with value: 0.43250115503666103.
[I 2024-12-04 11:52:41,173] Trial 174 finished with value: 0.5299853024018957 and parameters: {'max_depth': 33, 'min_samples_split': 6, 'min_samples_leaf': 1, 'max_features': 'sqrt', 'criterion': 'squared_error', 'splitter': 'best'}. Best is trial 91 with value: 0.43250115503666103.
[I 2024-12-04 11:52:41,336] Trial 178 finished with value: 0.6013237460643723 and parameters: {'max_depth': 32, 'min_samples_split': 6, 'min_samples_leaf': 3, 'max_features': 'sqrt', 'criterion': 'squared_error', 'splitter': 'best'}. Best is trial 91 with value: 0.43250115503666103.
[I 2024-12-04 11:52:41,496] Trial 165 finished with value: 0.5664357556243753 and parameters: {'max_depth': 24, 'min_samples_split': 7, 'min_samples_leaf': 1, 'max_features': 'sqrt', 'criterion': 'squared_error', 'splitter': 'best'}. Best is trial 91 with value: 0.43250115503666103.
[I 2024-12-04 11:52:41,509] Trial 175 finished with value: 0.7921957921338103 and parameters: {'max_depth': 18, 'min_samples_split': 17, 'min_samples_leaf': 8, 'max_features': 'sqrt', 'criterion': 'absolute_error', 'splitter': 'best'}. Best is trial 91 with value: 0.43250115503666103.
[I 2024-12-04 11:52:41,637] Trial 180 finished with value: 0.5045494824944808 and parameters: {'max_depth': 35, 'min_samples_split': 7, 'min_samples_leaf': 1, 'max_features': 'sqrt', 'criterion': 'squared_error', 'splitter': 'best'}. Best is trial 91 with value: 0.43250115503666103.
[I 2024-12-04 11:52:41,737] Trial 167 finished with value: 0.5929068548910315 and parameters: {'max_depth': 33, 'min_samples_split': 10, 'min_samples_leaf': 1, 'max_features': 'sqrt', 'criterion': 'squared_error', 'splitter': 'random'}. Best is trial 91 with value: 0.43250115503666103.
[I 2024-12-04 11:52:41,756] Trial 170 finished with value: 0.8494009321968274 and parameters: {'max_depth': 31, 'min_samples_split': 13, 'min_samples_leaf': 4, 'max_features': 'sqrt', 'criterion': 'friedman_mse', 'splitter': 'random'}. Best is trial 91 with value: 0.43250115503666103.
[I 2024-12-04 11:52:42,253] Trial 181 finished with value: 0.5034437178251039 and parameters: {'max_depth': 35, 'min_samples_split': 9, 'min_samples_leaf': 1, 'max_features': 'sqrt', 'criterion': 'squared_error', 'splitter': 'best'}. Best is trial 91 with value: 0.43250115503666103.
[I 2024-12-04 11:52:42,936] Trial 179 finished with value: 0.4750683632054112 and parameters: {'max_depth': 35, 'min_samples_split': 4, 'min_samples_leaf': 1, 'max_features': 'sqrt', 'criterion': 'friedman_mse', 'splitter': 'best'}. Best is trial 91 with value: 0.43250115503666103.
[I 2024-12-04 11:52:43,252] Trial 186 finished with value: 0.9625697643485591 and parameters: {'max_depth': 21, 'min_samples_split': 3, 'min_samples_leaf': 6, 'max_features': 'log2', 'criterion': 'absolute_error', 'splitter': 'random'}. Best is trial 91 with value: 0.43250115503666103.
[I 2024-12-04 11:52:43,266] Trial 177 finished with value: 0.4615785299849214 and parameters: {'max_depth': 35, 'min_samples_split': 10, 'min_samples_leaf': 1, 'max_features': 'sqrt', 'criterion': 'squared_error', 'splitter': 'best'}. Best is trial 91 with value: 0.43250115503666103.
[I 2024-12-04 11:52:43,527] Trial 184 finished with value: 0.5000738669670973 and parameters: {'max_depth': 26, 'min_samples_split': 9, 'min_samples_leaf': 1, 'max_features': 'sqrt', 'criterion': 'squared_error', 'splitter': 'best'}. Best is trial 91 with value: 0.43250115503666103.
[I 2024-12-04 11:52:45,504] Trial 183 finished with value: 0.5772047078966299 and parameters: {'max_depth': 29, 'min_samples_split': 2, 'min_samples_leaf': 2, 'max_features': 'sqrt', 'criterion': 'friedman_mse', 'splitter': 'best'}. Best is trial 91 with value: 0.43250115503666103.
[I 2024-12-04 11:52:47,088] Trial 185 finished with value: 0.9579692540752652 and parameters: {'max_depth': 4, 'min_samples_split': 9, 'min_samples_leaf': 4, 'max_features': 'sqrt', 'criterion': 'friedman_mse', 'splitter': 'best'}. Best is trial 91 with value: 0.43250115503666103.
[I 2024-12-04 11:52:47,111] Trial 193 finished with value: 0.9984670529576771 and parameters: {'max_depth': 29, 'min_samples_split': 19, 'min_samples_leaf': 10, 'max_features': 'log2', 'criterion': 'absolute_error', 'splitter': 'random'}. Best is trial 91 with value: 0.43250115503666103.
[I 2024-12-04 11:52:47,699] Trial 198 finished with value: 0.45634040793959746 and parameters: {'max_depth': 35, 'min_samples_split': 3, 'min_samples_leaf': 1, 'max_features': 'sqrt', 'criterion': 'squared_error', 'splitter': 'best'}. Best is trial 91 with value: 0.43250115503666103.
[I 2024-12-04 11:52:47,725] Trial 196 finished with value: 0.4700162024116575 and parameters: {'max_depth': 33, 'min_samples_split': 7, 'min_samples_leaf': 1, 'max_features': 'sqrt', 'criterion': 'squared_error', 'splitter': 'best'}. Best is trial 91 with value: 0.43250115503666103.
[I 2024-12-04 11:52:48,117] Trial 190 finished with value: 0.5459840798044118 and parameters: {'max_depth': 34, 'min_samples_split': 11, 'min_samples_leaf': 2, 'max_features': 'sqrt', 'criterion': 'squared_error', 'splitter': 'best'}. Best is trial 91 with value: 0.43250115503666103.
[I 2024-12-04 11:52:48,145] Trial 194 finished with value: 0.470890902031306 and parameters: {'max_depth': 30, 'min_samples_split': 7, 'min_samples_leaf': 1, 'max_features': 'sqrt', 'criterion': 'squared_error', 'splitter': 'best'}. Best is trial 91 with value: 0.43250115503666103.
[I 2024-12-04 11:52:48,146] Trial 200 finished with value: 0.4560512309740644 and parameters: {'max_depth': 33, 'min_samples_split': 3, 'min_samples_leaf': 1, 'max_features': 'sqrt', 'criterion': 'squared_error', 'splitter': 'best'}. Best is trial 91 with value: 0.43250115503666103.
[I 2024-12-04 11:52:48,295] Trial 199 finished with value: 0.492644424246246 and parameters: {'max_depth': 33, 'min_samples_split': 2, 'min_samples_leaf': 1, 'max_features': 'sqrt', 'criterion': 'squared_error', 'splitter': 'best'}. Best is trial 91 with value: 0.43250115503666103.
[I 2024-12-04 11:52:48,690] Trial 188 finished with value: 0.47495142754566344 and parameters: {'max_depth': 35, 'min_samples_split': 11, 'min_samples_leaf': 1, 'max_features': 'sqrt', 'criterion': 'squared_error', 'splitter': 'best'}. Best is trial 91 with value: 0.43250115503666103.
[I 2024-12-04 11:52:49,256] Trial 195 finished with value: 0.492644424246246 and parameters: {'max_depth': 33, 'min_samples_split': 2, 'min_samples_leaf': 1, 'max_features': 'sqrt', 'criterion': 'squared_error', 'splitter': 'best'}. Best is trial 91 with value: 0.43250115503666103.
[I 2024-12-04 11:52:49,527] Trial 205 finished with value: 0.5688991559099111 and parameters: {'max_depth': 32, 'min_samples_split': 3, 'min_samples_leaf': 1, 'max_features': 'log2', 'criterion': 'squared_error', 'splitter': 'best'}. Best is trial 91 with value: 0.43250115503666103.
[I 2024-12-04 11:52:49,596] Trial 189 finished with value: 0.7334680586122932 and parameters: {'max_depth': 13, 'min_samples_split': 17, 'min_samples_leaf': 6, 'max_features': 'sqrt', 'criterion': 'squared_error', 'splitter': 'best'}. Best is trial 91 with value: 0.43250115503666103.
[I 2024-12-04 11:52:49,753] Trial 191 finished with value: 0.998127234894583 and parameters: {'max_depth': 25, 'min_samples_split': 4, 'min_samples_leaf': 10, 'max_features': 'log2', 'criterion': 'friedman_mse', 'splitter': 'random'}. Best is trial 91 with value: 0.43250115503666103.
[I 2024-12-04 11:52:49,858] Trial 213 finished with value: 0.998127234894583 and parameters: {'max_depth': 10, 'min_samples_split': 18, 'min_samples_leaf': 8, 'max_features': 'log2', 'criterion': 'friedman_mse', 'splitter': 'random'}. Best is trial 91 with value: 0.43250115503666103.
[I 2024-12-04 11:52:50,295] Trial 201 finished with value: 0.4750683632054112 and parameters: {'max_depth': 35, 'min_samples_split': 4, 'min_samples_leaf': 1, 'max_features': 'sqrt', 'criterion': 'squared_error', 'splitter': 'best'}. Best is trial 91 with value: 0.43250115503666103.
[I 2024-12-04 11:52:51,292] Trial 197 finished with value: 0.5111102367501217 and parameters: {'max_depth': 35, 'min_samples_split': 4, 'min_samples_leaf': 1, 'max_features': 'log2', 'criterion': 'squared_error', 'splitter': 'best'}. Best is trial 91 with value: 0.43250115503666103.
[I 2024-12-04 11:52:51,398] Trial 187 finished with value: 0.5999071242431092 and parameters: {'max_depth': 25, 'min_samples_split': 4, 'min_samples_leaf': 1, 'max_features': 'sqrt', 'criterion': 'squared_error', 'splitter': 'best'}. Best is trial 91 with value: 0.43250115503666103.
[I 2024-12-04 11:52:51,431] Trial 192 finished with value: 0.5727242695313016 and parameters: {'max_depth': 32, 'min_samples_split': 2, 'min_samples_leaf': 2, 'max_features': 'sqrt', 'criterion': 'squared_error', 'splitter': 'best'}. Best is trial 91 with value: 0.43250115503666103.
[I 2024-12-04 11:52:51,499] Trial 206 finished with value: 0.459568650403539 and parameters: {'max_depth': 31, 'min_samples_split': 5, 'min_samples_leaf': 1, 'max_features': 'sqrt', 'criterion': 'squared_error', 'splitter': 'best'}. Best is trial 91 with value: 0.43250115503666103.
[I 2024-12-04 11:52:51,777] Trial 211 finished with value: 0.7577301902051179 and parameters: {'max_depth': 33, 'min_samples_split': 6, 'min_samples_leaf': 1, 'max_features': 'log2', 'criterion': 'absolute_error', 'splitter': 'random'}. Best is trial 91 with value: 0.43250115503666103.
[I 2024-12-04 11:52:51,778] Trial 202 finished with value: 0.6956034395868106 and parameters: {'max_depth': 26, 'min_samples_split': 7, 'min_samples_leaf': 9, 'max_features': 'sqrt', 'criterion': 'squared_error', 'splitter': 'best'}. Best is trial 91 with value: 0.43250115503666103.
[I 2024-12-04 11:52:51,780] Trial 203 finished with value: 0.6048873507559933 and parameters: {'max_depth': 33, 'min_samples_split': 9, 'min_samples_leaf': 1, 'max_features': 'sqrt', 'criterion': 'friedman_mse', 'splitter': 'random'}. Best is trial 91 with value: 0.43250115503666103.
[I 2024-12-04 11:52:52,768] Trial 216 finished with value: 0.46146960364298867 and parameters: {'max_depth': 31, 'min_samples_split': 6, 'min_samples_leaf': 1, 'max_features': 'sqrt', 'criterion': 'squared_error', 'splitter': 'best'}. Best is trial 91 with value: 0.43250115503666103.
[I 2024-12-04 11:52:53,279] Trial 215 finished with value: 0.45634040793959746 and parameters: {'max_depth': 35, 'min_samples_split': 3, 'min_samples_leaf': 1, 'max_features': 'sqrt', 'criterion': 'squared_error', 'splitter': 'best'}. Best is trial 91 with value: 0.43250115503666103.
[I 2024-12-04 11:52:53,354] Trial 217 finished with value: 0.5649253465052697 and parameters: {'max_depth': 35, 'min_samples_split': 6, 'min_samples_leaf': 2, 'max_features': 'sqrt', 'criterion': 'squared_error', 'splitter': 'best'}. Best is trial 91 with value: 0.43250115503666103.
[I 2024-12-04 11:52:53,784] Trial 212 finished with value: 0.470890902031306 and parameters: {'max_depth': 30, 'min_samples_split': 7, 'min_samples_leaf': 1, 'max_features': 'sqrt', 'criterion': 'squared_error', 'splitter': 'best'}. Best is trial 91 with value: 0.43250115503666103.
[I 2024-12-04 11:52:54,348] Trial 210 finished with value: 0.5283544720716186 and parameters: {'max_depth': 30, 'min_samples_split': 7, 'min_samples_leaf': 2, 'max_features': 'sqrt', 'criterion': 'squared_error', 'splitter': 'best'}. Best is trial 91 with value: 0.43250115503666103.
[I 2024-12-04 11:52:56,238] Trial 221 finished with value: 0.45634040793959746 and parameters: {'max_depth': 35, 'min_samples_split': 3, 'min_samples_leaf': 1, 'max_features': 'sqrt', 'criterion': 'squared_error', 'splitter': 'best'}. Best is trial 91 with value: 0.43250115503666103.
[I 2024-12-04 11:52:56,806] Trial 214 finished with value: 0.49087984857266276 and parameters: {'max_depth': 29, 'min_samples_split': 5, 'min_samples_leaf': 1, 'max_features': 'sqrt', 'criterion': 'squared_error', 'splitter': 'best'}. Best is trial 91 with value: 0.43250115503666103.
[I 2024-12-04 11:52:57,080] Trial 208 finished with value: 0.5288382873929215 and parameters: {'max_depth': 29, 'min_samples_split': 4, 'min_samples_leaf': 1, 'max_features': 'sqrt', 'criterion': 'squared_error', 'splitter': 'best'}. Best is trial 91 with value: 0.43250115503666103.
[I 2024-12-04 11:52:57,180] Trial 209 finished with value: 0.6047916810830398 and parameters: {'max_depth': 27, 'min_samples_split': 5, 'min_samples_leaf': 2, 'max_features': 'sqrt', 'criterion': 'squared_error', 'splitter': 'best'}. Best is trial 91 with value: 0.43250115503666103.
[I 2024-12-04 11:52:57,329] Trial 222 finished with value: 0.5630541891252331 and parameters: {'max_depth': 26, 'min_samples_split': 5, 'min_samples_leaf': 1, 'max_features': 'sqrt', 'criterion': 'squared_error', 'splitter': 'best'}. Best is trial 91 with value: 0.43250115503666103.
[I 2024-12-04 11:52:58,166] Trial 219 finished with value: 0.44745815576766074 and parameters: {'max_depth': 32, 'min_samples_split': 4, 'min_samples_leaf': 1, 'max_features': 'sqrt', 'criterion': 'squared_error', 'splitter': 'best'}. Best is trial 91 with value: 0.43250115503666103.
[I 2024-12-04 11:52:58,369] Trial 204 finished with value: 0.45634040793959746 and parameters: {'max_depth': 35, 'min_samples_split': 3, 'min_samples_leaf': 1, 'max_features': 'sqrt', 'criterion': 'squared_error', 'splitter': 'best'}. Best is trial 91 with value: 0.43250115503666103.
[I 2024-12-04 11:52:58,647] Trial 228 finished with value: 0.47380166885251596 and parameters: {'max_depth': 31, 'min_samples_split': 4, 'min_samples_leaf': 1, 'max_features': 'sqrt', 'criterion': 'squared_error', 'splitter': 'best'}. Best is trial 91 with value: 0.43250115503666103.
[I 2024-12-04 11:52:58,771] Trial 207 finished with value: 0.6179100165884478 and parameters: {'max_depth': 26, 'min_samples_split': 4, 'min_samples_leaf': 1, 'max_features': 'sqrt', 'criterion': 'absolute_error', 'splitter': 'best'}. Best is trial 91 with value: 0.43250115503666103.
[I 2024-12-04 11:52:59,302] Trial 230 finished with value: 0.46648192070200095 and parameters: {'max_depth': 34, 'min_samples_split': 5, 'min_samples_leaf': 1, 'max_features': 'sqrt', 'criterion': 'squared_error', 'splitter': 'best'}. Best is trial 91 with value: 0.43250115503666103.
[I 2024-12-04 11:53:00,049] Trial 225 finished with value: 0.9982171095081254 and parameters: {'max_depth': 5, 'min_samples_split': 9, 'min_samples_leaf': 5, 'max_features': 'log2', 'criterion': 'squared_error', 'splitter': 'best'}. Best is trial 91 with value: 0.43250115503666103.
[I 2024-12-04 11:53:00,461] Trial 226 finished with value: 0.6013237460643723 and parameters: {'max_depth': 35, 'min_samples_split': 2, 'min_samples_leaf': 3, 'max_features': 'sqrt', 'criterion': 'squared_error', 'splitter': 'best'}. Best is trial 91 with value: 0.43250115503666103.
[I 2024-12-04 11:53:00,751] Trial 232 finished with value: 0.45634040793959746 and parameters: {'max_depth': 35, 'min_samples_split': 3, 'min_samples_leaf': 1, 'max_features': 'sqrt', 'criterion': 'squared_error', 'splitter': 'best'}. Best is trial 91 with value: 0.43250115503666103.
[I 2024-12-04 11:53:00,943] Trial 223 finished with value: 0.46648192070200095 and parameters: {'max_depth': 34, 'min_samples_split': 5, 'min_samples_leaf': 1, 'max_features': 'sqrt', 'criterion': 'squared_error', 'splitter': 'best'}. Best is trial 91 with value: 0.43250115503666103.
[I 2024-12-04 11:53:01,020] Trial 237 finished with value: 0.4608356013331615 and parameters: {'max_depth': 34, 'min_samples_split': 4, 'min_samples_leaf': 1, 'max_features': 'sqrt', 'criterion': 'squared_error', 'splitter': 'best'}. Best is trial 91 with value: 0.43250115503666103.
[I 2024-12-04 11:53:01,553] Trial 240 finished with value: 0.5109654269115765 and parameters: {'max_depth': 35, 'min_samples_split': 2, 'min_samples_leaf': 1, 'max_features': 'sqrt', 'criterion': 'squared_error', 'splitter': 'best'}. Best is trial 91 with value: 0.43250115503666103.
[I 2024-12-04 11:53:01,667] Trial 227 finished with value: 0.5109654269115765 and parameters: {'max_depth': 35, 'min_samples_split': 2, 'min_samples_leaf': 1, 'max_features': 'sqrt', 'criterion': 'squared_error', 'splitter': 'best'}. Best is trial 91 with value: 0.43250115503666103.
[I 2024-12-04 11:53:02,133] Trial 224 finished with value: 0.46648192070200095 and parameters: {'max_depth': 34, 'min_samples_split': 5, 'min_samples_leaf': 1, 'max_features': 'sqrt', 'criterion': 'squared_error', 'splitter': 'best'}. Best is trial 91 with value: 0.43250115503666103.
