[I 2024-12-04 12:56:57,852] Trial 1129 finished with value: 0.30168644848488574 and parameters: {'n_estimators': 1350, 'learning_rate': 0.032836119063245, 'max_depth': 7, 'min_samples_split': 15, 'min_samples_leaf': 5, 'subsample': 0.6532006935253933, 'max_features': None}. Best is trial 784 with value: 0.199214954455861.
[I 2024-12-04 12:57:01,323] Trial 1135 finished with value: 0.3528739128964823 and parameters: {'n_estimators': 1326, 'learning_rate': 0.01374562463879045, 'max_depth': 6, 'min_samples_split': 9, 'min_samples_leaf': 7, 'subsample': 0.9500584948602472, 'max_features': None}. Best is trial 784 with value: 0.199214954455861.
[I 2024-12-04 12:57:02,686] Trial 1138 finished with value: 0.2566540172353035 and parameters: {'n_estimators': 1352, 'learning_rate': 0.08270996715896439, 'max_depth': 8, 'min_samples_split': 20, 'min_samples_leaf': 3, 'subsample': 0.6649094342887379, 'max_features': 'sqrt'}. Best is trial 784 with value: 0.199214954455861.
[I 2024-12-04 12:57:02,774] Trial 1144 finished with value: 0.21980542819935878 and parameters: {'n_estimators': 1142, 'learning_rate': 0.06838960167737515, 'max_depth': 11, 'min_samples_split': 20, 'min_samples_leaf': 1, 'subsample': 0.715311963167981, 'max_features': 'sqrt'}. Best is trial 784 with value: 0.199214954455861.
[I 2024-12-04 12:57:03,121] Trial 1133 finished with value: 0.23017966243090493 and parameters: {'n_estimators': 1490, 'learning_rate': 0.08302959585722104, 'max_depth': 10, 'min_samples_split': 8, 'min_samples_leaf': 1, 'subsample': 0.7278706016400386, 'max_features': 'sqrt'}. Best is trial 784 with value: 0.199214954455861.
[I 2024-12-04 12:57:04,898] Trial 1142 finished with value: 0.2414157312825132 and parameters: {'n_estimators': 1231, 'learning_rate': 0.094275177299562, 'max_depth': 9, 'min_samples_split': 17, 'min_samples_leaf': 2, 'subsample': 0.6508276770416596, 'max_features': 'sqrt'}. Best is trial 784 with value: 0.199214954455861.
[I 2024-12-04 12:57:06,604] Trial 1160 finished with value: 0.42665176308614816 and parameters: {'n_estimators': 473, 'learning_rate': 0.06650256925421938, 'max_depth': 9, 'min_samples_split': 13, 'min_samples_leaf': 10, 'subsample': 0.8020987054316596, 'max_features': 'sqrt'}. Best is trial 784 with value: 0.199214954455861.
[I 2024-12-04 12:57:07,936] Trial 1145 finished with value: 0.22016954501707925 and parameters: {'n_estimators': 1184, 'learning_rate': 0.09879261774034533, 'max_depth': 10, 'min_samples_split': 18, 'min_samples_leaf': 1, 'subsample': 0.6264223120735074, 'max_features': 'sqrt'}. Best is trial 1137 with value: 0.19687116000636118.
[I 2024-12-04 12:57:08,504] Trial 1137 finished with value: 0.19687116000636118 and parameters: {'n_estimators': 1464, 'learning_rate': 0.09683136253993, 'max_depth': 11, 'min_samples_split': 17, 'min_samples_leaf': 1, 'subsample': 0.6006798013369627, 'max_features': 'sqrt'}. Best is trial 1137 with value: 0.19687116000636118.
[I 2024-12-04 12:57:10,827] Trial 1139 finished with value: 0.23418776769468821 and parameters: {'n_estimators': 1422, 'learning_rate': 0.07248666885387453, 'max_depth': 10, 'min_samples_split': 16, 'min_samples_leaf': 2, 'subsample': 0.669469002878117, 'max_features': 'sqrt'}. Best is trial 1137 with value: 0.19687116000636118.
[I 2024-12-04 12:57:13,384] Trial 1161 finished with value: 0.37077131345717224 and parameters: {'n_estimators': 440, 'learning_rate': 0.03220003983180057, 'max_depth': 12, 'min_samples_split': 15, 'min_samples_leaf': 9, 'subsample': 0.8236728991982273, 'max_features': None}. Best is trial 1137 with value: 0.19687116000636118.
[I 2024-12-04 12:57:15,608] Trial 1148 finished with value: 0.21803193562074513 and parameters: {'n_estimators': 1213, 'learning_rate': 0.08834199055572348, 'max_depth': 10, 'min_samples_split': 16, 'min_samples_leaf': 1, 'subsample': 0.7064308459029595, 'max_features': 'sqrt'}. Best is trial 1137 with value: 0.19687116000636118.
[I 2024-12-04 12:57:19,445] Trial 1168 finished with value: 0.5042956503400626 and parameters: {'n_estimators': 312, 'learning_rate': 0.010858663495493448, 'max_depth': 8, 'min_samples_split': 11, 'min_samples_leaf': 1, 'subsample': 0.9886678509412447, 'max_features': 'sqrt'}. Best is trial 1137 with value: 0.19687116000636118.
[I 2024-12-04 12:57:23,274] Trial 1146 finished with value: 0.2438418150151007 and parameters: {'n_estimators': 1458, 'learning_rate': 0.07607324186310048, 'max_depth': 9, 'min_samples_split': 20, 'min_samples_leaf': 2, 'subsample': 0.6694770156175457, 'max_features': 'sqrt'}. Best is trial 1137 with value: 0.19687116000636118.
[I 2024-12-04 12:57:25,315] Trial 1143 finished with value: 0.28438559359821136 and parameters: {'n_estimators': 1491, 'learning_rate': 0.044930849033962036, 'max_depth': 5, 'min_samples_split': 6, 'min_samples_leaf': 3, 'subsample': 0.7562496044076813, 'max_features': None}. Best is trial 1137 with value: 0.19687116000636118.
[I 2024-12-04 12:57:28,233] Trial 1147 finished with value: 0.2508475764727742 and parameters: {'n_estimators': 1478, 'learning_rate': 0.09783908854462056, 'max_depth': 11, 'min_samples_split': 19, 'min_samples_leaf': 3, 'subsample': 0.6088193442612579, 'max_features': 'sqrt'}. Best is trial 1137 with value: 0.19687116000636118.
[I 2024-12-04 12:57:30,112] Trial 1149 finished with value: 0.2206820901076889 and parameters: {'n_estimators': 1403, 'learning_rate': 0.08650344570535934, 'max_depth': 9, 'min_samples_split': 20, 'min_samples_leaf': 1, 'subsample': 0.6616594983521014, 'max_features': 'sqrt'}. Best is trial 1137 with value: 0.19687116000636118.
[I 2024-12-04 12:57:31,441] Trial 1153 finished with value: 0.2108364392607834 and parameters: {'n_estimators': 1194, 'learning_rate': 0.09678799763421961, 'max_depth': 10, 'min_samples_split': 18, 'min_samples_leaf': 1, 'subsample': 0.6631689364628844, 'max_features': 'sqrt'}. Best is trial 1137 with value: 0.19687116000636118.
[I 2024-12-04 12:57:33,498] Trial 1154 finished with value: 0.22294157258090747 and parameters: {'n_estimators': 1252, 'learning_rate': 0.06695664444904684, 'max_depth': 12, 'min_samples_split': 20, 'min_samples_leaf': 2, 'subsample': 0.7665744591110868, 'max_features': 'sqrt'}. Best is trial 1137 with value: 0.19687116000636118.
[I 2024-12-04 12:57:37,658] Trial 1150 finished with value: 0.29408557021077897 and parameters: {'n_estimators': 1320, 'learning_rate': 0.09035402487090402, 'max_depth': 11, 'min_samples_split': 18, 'min_samples_leaf': 4, 'subsample': 0.7224479301094572, 'max_features': None}. Best is trial 1137 with value: 0.19687116000636118.
[I 2024-12-04 12:57:39,682] Trial 1151 finished with value: 0.2015836945853605 and parameters: {'n_estimators': 1499, 'learning_rate': 0.09767370001922292, 'max_depth': 12, 'min_samples_split': 19, 'min_samples_leaf': 1, 'subsample': 0.6028300135462028, 'max_features': 'sqrt'}. Best is trial 1137 with value: 0.19687116000636118.
[I 2024-12-04 12:57:42,112] Trial 1152 finished with value: 0.23689817483025868 and parameters: {'n_estimators': 1462, 'learning_rate': 0.08590483722665633, 'max_depth': 9, 'min_samples_split': 15, 'min_samples_leaf': 1, 'subsample': 0.6878591177133329, 'max_features': 'sqrt'}. Best is trial 1137 with value: 0.19687116000636118.
[I 2024-12-04 12:57:42,270] Trial 1155 finished with value: 0.21671106046990252 and parameters: {'n_estimators': 1372, 'learning_rate': 0.09827928161392141, 'max_depth': 10, 'min_samples_split': 17, 'min_samples_leaf': 1, 'subsample': 0.677255545248703, 'max_features': 'sqrt'}. Best is trial 1137 with value: 0.19687116000636118.
[I 2024-12-04 12:57:45,390] Trial 1156 finished with value: 0.2479488559133068 and parameters: {'n_estimators': 1407, 'learning_rate': 0.09403520453390596, 'max_depth': 10, 'min_samples_split': 20, 'min_samples_leaf': 2, 'subsample': 0.6599195188888172, 'max_features': 'sqrt'}. Best is trial 1137 with value: 0.19687116000636118.
[I 2024-12-04 12:57:48,533] Trial 1159 finished with value: 0.19962849389766538 and parameters: {'n_estimators': 1298, 'learning_rate': 0.08488005117262176, 'max_depth': 12, 'min_samples_split': 19, 'min_samples_leaf': 1, 'subsample': 0.6765421244053546, 'max_features': 'sqrt'}. Best is trial 1137 with value: 0.19687116000636118.
[I 2024-12-04 12:57:49,682] Trial 1158 finished with value: 0.2190007022418953 and parameters: {'n_estimators': 1336, 'learning_rate': 0.0974396729082303, 'max_depth': 12, 'min_samples_split': 18, 'min_samples_leaf': 1, 'subsample': 0.680478832492468, 'max_features': 'sqrt'}. Best is trial 1137 with value: 0.19687116000636118.
[I 2024-12-04 12:57:54,622] Trial 1157 finished with value: 0.2935599475018107 and parameters: {'n_estimators': 1323, 'learning_rate': 0.07942617888782504, 'max_depth': 9, 'min_samples_split': 9, 'min_samples_leaf': 4, 'subsample': 0.7134795484078686, 'max_features': None}. Best is trial 1137 with value: 0.19687116000636118.
[I 2024-12-04 12:58:01,051] Trial 1166 finished with value: 0.23207995607698567 and parameters: {'n_estimators': 1277, 'learning_rate': 0.09185193114588959, 'max_depth': 10, 'min_samples_split': 20, 'min_samples_leaf': 2, 'subsample': 0.6804715496411844, 'max_features': 'sqrt'}. Best is trial 1137 with value: 0.19687116000636118.
[I 2024-12-04 12:58:03,999] Trial 1191 finished with value: 0.37826583612527 and parameters: {'n_estimators': 210, 'learning_rate': 0.08601740982535658, 'max_depth': 7, 'min_samples_split': 2, 'min_samples_leaf': 8, 'subsample': 0.6632090290772696, 'max_features': None}. Best is trial 1137 with value: 0.19687116000636118.
[I 2024-12-04 12:58:07,153] Trial 1162 finished with value: 0.2170878710152242 and parameters: {'n_estimators': 1497, 'learning_rate': 0.06204896438211621, 'max_depth': 11, 'min_samples_split': 17, 'min_samples_leaf': 1, 'subsample': 0.7293248587639689, 'max_features': 'sqrt'}. Best is trial 1137 with value: 0.19687116000636118.
[I 2024-12-04 12:58:07,744] Trial 1172 finished with value: 0.2625649232005674 and parameters: {'n_estimators': 905, 'learning_rate': 0.04405720308904793, 'max_depth': 10, 'min_samples_split': 10, 'min_samples_leaf': 3, 'subsample': 0.8138994626149236, 'max_features': 'sqrt'}. Best is trial 1137 with value: 0.19687116000636118.
[I 2024-12-04 12:58:08,478] Trial 1163 finished with value: 0.21944125348458288 and parameters: {'n_estimators': 1474, 'learning_rate': 0.05894723129497254, 'max_depth': 11, 'min_samples_split': 19, 'min_samples_leaf': 1, 'subsample': 0.7844243143664539, 'max_features': 'sqrt'}. Best is trial 1137 with value: 0.19687116000636118.
[I 2024-12-04 12:58:10,589] Trial 1171 finished with value: 0.3509602103199762 and parameters: {'n_estimators': 884, 'learning_rate': 0.013080102373484089, 'max_depth': 5, 'min_samples_split': 20, 'min_samples_leaf': 5, 'subsample': 0.87811293498213, 'max_features': None}. Best is trial 1137 with value: 0.19687116000636118.
[I 2024-12-04 12:58:13,007] Trial 1164 finished with value: 0.22147335650122743 and parameters: {'n_estimators': 1485, 'learning_rate': 0.09497386905061522, 'max_depth': 10, 'min_samples_split': 19, 'min_samples_leaf': 1, 'subsample': 0.6806755229508382, 'max_features': 'sqrt'}. Best is trial 1137 with value: 0.19687116000636118.
[I 2024-12-04 12:58:14,610] Trial 1165 finished with value: 0.24877544332721024 and parameters: {'n_estimators': 1467, 'learning_rate': 0.07658318567742169, 'max_depth': 11, 'min_samples_split': 18, 'min_samples_leaf': 3, 'subsample': 0.7330037767488202, 'max_features': 'sqrt'}. Best is trial 1137 with value: 0.19687116000636118.
[I 2024-12-04 12:58:17,313] Trial 1192 finished with value: 0.8286726386247761 and parameters: {'n_estimators': 402, 'learning_rate': 0.01012447878172543, 'max_depth': 12, 'min_samples_split': 16, 'min_samples_leaf': 9, 'subsample': 0.9912297972576127, 'max_features': 'log2'}. Best is trial 1137 with value: 0.19687116000636118.
[I 2024-12-04 12:58:19,296] Trial 1167 finished with value: 0.44032038501376813 and parameters: {'n_estimators': 1358, 'learning_rate': 0.011555868519769677, 'max_depth': 11, 'min_samples_split': 17, 'min_samples_leaf': 4, 'subsample': 0.8080516475567433, 'max_features': 'log2'}. Best is trial 1137 with value: 0.19687116000636118.
[I 2024-12-04 12:58:20,514] Trial 1169 finished with value: 0.2369239784244129 and parameters: {'n_estimators': 1265, 'learning_rate': 0.07988883451308518, 'max_depth': 11, 'min_samples_split': 20, 'min_samples_leaf': 1, 'subsample': 0.7478402380616677, 'max_features': 'sqrt'}. Best is trial 1137 with value: 0.19687116000636118.
[I 2024-12-04 12:58:25,633] Trial 1183 finished with value: 0.2506230193665891 and parameters: {'n_estimators': 853, 'learning_rate': 0.09941604094729094, 'max_depth': 9, 'min_samples_split': 20, 'min_samples_leaf': 2, 'subsample': 0.7417964532690141, 'max_features': 'sqrt'}. Best is trial 1137 with value: 0.19687116000636118.
[I 2024-12-04 12:58:25,697] Trial 1177 finished with value: 0.47522179887519783 and parameters: {'n_estimators': 1048, 'learning_rate': 0.016553163694542166, 'max_depth': 12, 'min_samples_split': 14, 'min_samples_leaf': 4, 'subsample': 0.6092781146521181, 'max_features': 'log2'}. Best is trial 1137 with value: 0.19687116000636118.
[I 2024-12-04 12:58:28,447] Trial 1176 finished with value: 0.2298296421846697 and parameters: {'n_estimators': 1138, 'learning_rate': 0.08642269450507035, 'max_depth': 9, 'min_samples_split': 20, 'min_samples_leaf': 1, 'subsample': 0.6358149068446044, 'max_features': 'sqrt'}. Best is trial 1137 with value: 0.19687116000636118.
[I 2024-12-04 12:58:33,418] Trial 1194 finished with value: 0.3846488180251644 and parameters: {'n_estimators': 570, 'learning_rate': 0.030208029562092942, 'max_depth': 6, 'min_samples_split': 12, 'min_samples_leaf': 9, 'subsample': 0.7922493523113779, 'max_features': None}. Best is trial 1137 with value: 0.19687116000636118.
[I 2024-12-04 12:58:34,314] Trial 1170 finished with value: 0.22986282514545228 and parameters: {'n_estimators': 1365, 'learning_rate': 0.09467399267933005, 'max_depth': 11, 'min_samples_split': 19, 'min_samples_leaf': 1, 'subsample': 0.6854749889015611, 'max_features': 'sqrt'}. Best is trial 1137 with value: 0.19687116000636118.
[I 2024-12-04 12:58:37,643] Trial 1188 finished with value: 0.29343518169422306 and parameters: {'n_estimators': 841, 'learning_rate': 0.03987166588911807, 'max_depth': 4, 'min_samples_split': 5, 'min_samples_leaf': 3, 'subsample': 0.8091995430420416, 'max_features': None}. Best is trial 1137 with value: 0.19687116000636118.
[I 2024-12-04 12:58:37,683] Trial 1174 finished with value: 0.2538248432880767 and parameters: {'n_estimators': 1354, 'learning_rate': 0.06729057959133329, 'max_depth': 9, 'min_samples_split': 20, 'min_samples_leaf': 3, 'subsample': 0.6057502297150168, 'max_features': 'sqrt'}. Best is trial 1137 with value: 0.19687116000636118.
[I 2024-12-04 12:58:39,231] Trial 1179 finished with value: 0.2296251849820743 and parameters: {'n_estimators': 1212, 'learning_rate': 0.09427252434386593, 'max_depth': 11, 'min_samples_split': 19, 'min_samples_leaf': 1, 'subsample': 0.7353336716569603, 'max_features': 'sqrt'}. Best is trial 1137 with value: 0.19687116000636118.
[I 2024-12-04 12:58:41,205] Trial 1181 finished with value: 0.24692907070333445 and parameters: {'n_estimators': 1188, 'learning_rate': 0.09230113860533443, 'max_depth': 10, 'min_samples_split': 17, 'min_samples_leaf': 1, 'subsample': 0.6923257931023995, 'max_features': 'log2'}. Best is trial 1137 with value: 0.19687116000636118.
[I 2024-12-04 12:58:42,794] Trial 1173 finished with value: 0.2544236573260244 and parameters: {'n_estimators': 1461, 'learning_rate': 0.08483888073754241, 'max_depth': 11, 'min_samples_split': 20, 'min_samples_leaf': 2, 'subsample': 0.7155925747962146, 'max_features': 'log2'}. Best is trial 1137 with value: 0.19687116000636118.
[I 2024-12-04 12:58:43,071] Trial 1184 finished with value: 0.2316932120829975 and parameters: {'n_estimators': 1100, 'learning_rate': 0.061863883580284655, 'max_depth': 10, 'min_samples_split': 18, 'min_samples_leaf': 1, 'subsample': 0.6402491487984687, 'max_features': 'sqrt'}. Best is trial 1137 with value: 0.19687116000636118.
[I 2024-12-04 12:58:43,083] Trial 1182 finished with value: 0.3768680496940718 and parameters: {'n_estimators': 1072, 'learning_rate': 0.02439637113733018, 'max_depth': 7, 'min_samples_split': 5, 'min_samples_leaf': 9, 'subsample': 0.7875951730769484, 'max_features': None}. Best is trial 1137 with value: 0.19687116000636118.
[I 2024-12-04 12:58:45,198] Trial 1175 finished with value: 0.23159090558839127 and parameters: {'n_estimators': 1440, 'learning_rate': 0.09714501759385746, 'max_depth': 10, 'min_samples_split': 18, 'min_samples_leaf': 2, 'subsample': 0.6725527019638999, 'max_features': 'sqrt'}. Best is trial 1137 with value: 0.19687116000636118.
[I 2024-12-04 12:58:48,157] Trial 1178 finished with value: 0.25897223296329874 and parameters: {'n_estimators': 1413, 'learning_rate': 0.08910570339316606, 'max_depth': 10, 'min_samples_split': 20, 'min_samples_leaf': 3, 'subsample': 0.6132428123874687, 'max_features': 'sqrt'}. Best is trial 1137 with value: 0.19687116000636118.
[I 2024-12-04 12:58:51,588] Trial 1196 finished with value: 0.31466051914674653 and parameters: {'n_estimators': 679, 'learning_rate': 0.033716533320748955, 'max_depth': 4, 'min_samples_split': 19, 'min_samples_leaf': 2, 'subsample': 0.759026424673038, 'max_features': None}. Best is trial 1137 with value: 0.19687116000636118.
[I 2024-12-04 12:58:54,268] Trial 1185 finished with value: 0.2403290111951502 and parameters: {'n_estimators': 1308, 'learning_rate': 0.09874734759588467, 'max_depth': 10, 'min_samples_split': 18, 'min_samples_leaf': 2, 'subsample': 0.6435290623320145, 'max_features': 'sqrt'}. Best is trial 1137 with value: 0.19687116000636118.
[I 2024-12-04 12:58:54,720] Trial 1187 finished with value: 0.2234420702762367 and parameters: {'n_estimators': 1231, 'learning_rate': 0.09849604148797693, 'max_depth': 11, 'min_samples_split': 18, 'min_samples_leaf': 1, 'subsample': 0.6298156470846217, 'max_features': 'sqrt'}. Best is trial 1137 with value: 0.19687116000636118.
[I 2024-12-04 12:58:57,230] Trial 1180 finished with value: 0.22796263628706262 and parameters: {'n_estimators': 1485, 'learning_rate': 0.09686837525881764, 'max_depth': 11, 'min_samples_split': 19, 'min_samples_leaf': 1, 'subsample': 0.745295069535357, 'max_features': 'sqrt'}. Best is trial 1137 with value: 0.19687116000636118.
[I 2024-12-04 12:59:01,275] Trial 1186 finished with value: 0.19908630122023702 and parameters: {'n_estimators': 1356, 'learning_rate': 0.09681935948091079, 'max_depth': 12, 'min_samples_split': 20, 'min_samples_leaf': 1, 'subsample': 0.717879105292434, 'max_features': 'sqrt'}. Best is trial 1137 with value: 0.19687116000636118.
[I 2024-12-04 12:59:03,136] Trial 1189 finished with value: 0.2821400828634458 and parameters: {'n_estimators': 1204, 'learning_rate': 0.04680563547006339, 'max_depth': 4, 'min_samples_split': 19, 'min_samples_leaf': 2, 'subsample': 0.6986496667180493, 'max_features': None}. Best is trial 1137 with value: 0.19687116000636118.
[I 2024-12-04 12:59:09,393] Trial 1207 finished with value: 0.48262152471331266 and parameters: {'n_estimators': 680, 'learning_rate': 0.04121022046191573, 'max_depth': 9, 'min_samples_split': 10, 'min_samples_leaf': 7, 'subsample': 0.7116494203800725, 'max_features': 'log2'}. Best is trial 1137 with value: 0.19687116000636118.
[I 2024-12-04 12:59:09,530] Trial 1190 finished with value: 0.2333320374695072 and parameters: {'n_estimators': 1405, 'learning_rate': 0.07973159293798787, 'max_depth': 10, 'min_samples_split': 16, 'min_samples_leaf': 2, 'subsample': 0.606795701612258, 'max_features': 'sqrt'}. Best is trial 1137 with value: 0.19687116000636118.
[I 2024-12-04 12:59:11,473] Trial 1198 finished with value: 0.23787050623803221 and parameters: {'n_estimators': 977, 'learning_rate': 0.08843413167916843, 'max_depth': 9, 'min_samples_split': 18, 'min_samples_leaf': 1, 'subsample': 0.6697526103037662, 'max_features': 'sqrt'}. Best is trial 1137 with value: 0.19687116000636118.
[I 2024-12-04 12:59:17,855] Trial 1193 finished with value: 0.2301439883198015 and parameters: {'n_estimators': 1446, 'learning_rate': 0.09295391293353068, 'max_depth': 12, 'min_samples_split': 18, 'min_samples_leaf': 2, 'subsample': 0.613006394652937, 'max_features': 'sqrt'}. Best is trial 1137 with value: 0.19687116000636118.
[I 2024-12-04 12:59:21,314] Trial 1195 finished with value: 0.21301053041233975 and parameters: {'n_estimators': 1330, 'learning_rate': 0.09069826427578784, 'max_depth': 12, 'min_samples_split': 20, 'min_samples_leaf': 1, 'subsample': 0.6569486873014728, 'max_features': 'sqrt'}. Best is trial 1137 with value: 0.19687116000636118.
[I 2024-12-04 12:59:35,390] Trial 1225 finished with value: 0.38559263871241256 and parameters: {'n_estimators': 400, 'learning_rate': 0.05518316286691673, 'max_depth': 4, 'min_samples_split': 3, 'min_samples_leaf': 9, 'subsample': 0.9706883680705083, 'max_features': None}. Best is trial 1137 with value: 0.19687116000636118.
[I 2024-12-04 12:59:37,344] Trial 1206 finished with value: 0.24207380574056386 and parameters: {'n_estimators': 1149, 'learning_rate': 0.09522588184756858, 'max_depth': 11, 'min_samples_split': 19, 'min_samples_leaf': 3, 'subsample': 0.661947536732352, 'max_features': 'sqrt'}. Best is trial 1137 with value: 0.19687116000636118.
[I 2024-12-04 12:59:39,152] Trial 1197 finished with value: 0.2477056037316557 and parameters: {'n_estimators': 1446, 'learning_rate': 0.09999934647389572, 'max_depth': 11, 'min_samples_split': 20, 'min_samples_leaf': 3, 'subsample': 0.6931369503985724, 'max_features': 'sqrt'}. Best is trial 1137 with value: 0.19687116000636118.
