[I 2024-12-04 15:21:13,487] Trial 1545 finished with value: 0.13435441742631507 and parameters: {'kernel_type': 'Matern', 'length_scale': 0.2781016265536268, 'noise_level': 0.028749944614631904, 'constant_value': 57699.361359583236, 'nu': 1.5}. Best is trial 1456 with value: 0.13435337537029549.
[I 2024-12-04 15:21:16,026] Trial 1554 finished with value: 0.1343545805613836 and parameters: {'kernel_type': 'Matern', 'length_scale': 2.4708455224744106, 'noise_level': 0.009679389689943878, 'constant_value': 91833.22278233166, 'nu': 1.5}. Best is trial 1456 with value: 0.13435337537029549.
[I 2024-12-04 15:21:16,605] Trial 1560 finished with value: 1.269363502857071 and parameters: {'kernel_type': 'Matern', 'length_scale': 0.05052090600221951, 'noise_level': 7.910735579071902e-05, 'constant_value': 79.47876512581905, 'nu': 1.5}. Best is trial 1456 with value: 0.13435337537029549.
[I 2024-12-04 15:21:16,609] Trial 1552 finished with value: 0.13435438902393784 and parameters: {'kernel_type': 'Matern', 'length_scale': 3.7939791781849217, 'noise_level': 0.849410575149369, 'constant_value': 1591.5143216893105, 'nu': 1.5}. Best is trial 1456 with value: 0.13435337537029549.
[I 2024-12-04 15:21:18,975] Trial 1556 finished with value: 0.13435454820176326 and parameters: {'kernel_type': 'Matern', 'length_scale': 28.250492533008465, 'noise_level': 0.05613507266650983, 'constant_value': 8.827285097262134, 'nu': 1.5}. Best is trial 1456 with value: 0.13435337537029549.
[I 2024-12-04 15:21:19,154] Trial 1561 finished with value: 0.13435410129155467 and parameters: {'kernel_type': 'Matern', 'length_scale': 45.700938561368154, 'noise_level': 0.07654106026153021, 'constant_value': 67911.75773250332, 'nu': 1.5}. Best is trial 1456 with value: 0.13435337537029549.
[I 2024-12-04 15:21:21,995] Trial 1566 finished with value: 0.1343544142113844 and parameters: {'kernel_type': 'Matern', 'length_scale': 2.0680501125032227, 'noise_level': 0.0006802651846708032, 'constant_value': 951.720123105413, 'nu': 1.5}. Best is trial 1456 with value: 0.13435337537029549.
[I 2024-12-04 15:21:25,025] Trial 1567 finished with value: 0.13435417686345133 and parameters: {'kernel_type': 'Matern', 'length_scale': 37.69041859622858, 'noise_level': 0.0348811483714402, 'constant_value': 83775.52989221578, 'nu': 1.5}. Best is trial 1456 with value: 0.13435337537029549.
[I 2024-12-04 15:21:25,028] Trial 1574 finished with value: 0.13435441212222 and parameters: {'kernel_type': 'Matern', 'length_scale': 174.6118803077376, 'noise_level': 0.011782639823110846, 'constant_value': 84542.1792230613, 'nu': 1.5}. Best is trial 1456 with value: 0.13435337537029549.
[I 2024-12-04 15:21:26,728] Trial 1573 finished with value: 0.13435439994799414 and parameters: {'kernel_type': 'Matern', 'length_scale': 1.8124948108559262, 'noise_level': 0.028432018038860196, 'constant_value': 2570.9273545777937, 'nu': 1.5}. Best is trial 1456 with value: 0.13435337537029549.
[I 2024-12-04 15:21:28,604] Trial 1565 finished with value: 0.13435443012311696 and parameters: {'kernel_type': 'Matern', 'length_scale': 470.46263718015, 'noise_level': 0.0030313831413129304, 'constant_value': 2067.4956395587687, 'nu': 1.5}. Best is trial 1456 with value: 0.13435337537029549.
[I 2024-12-04 15:21:28,605] Trial 1576 finished with value: 1.2693635028567263 and parameters: {'kernel_type': 'Matern', 'length_scale': 0.007772434299443677, 'noise_level': 0.0403048349446968, 'constant_value': 313.32679468561855, 'nu': 1.5}. Best is trial 1456 with value: 0.13435337537029549.
[I 2024-12-04 15:21:28,621] Trial 1568 finished with value: 0.13435440303239166 and parameters: {'kernel_type': 'Matern', 'length_scale': 817.0154564203823, 'noise_level': 0.8799132399621653, 'constant_value': 97.08329210490469, 'nu': 1.5}. Best is trial 1456 with value: 0.13435337537029549.
[I 2024-12-04 15:21:29,821] Trial 1580 finished with value: 0.13435439980890945 and parameters: {'kernel_type': 'Matern', 'length_scale': 88.8231656859163, 'noise_level': 0.002216569766990947, 'constant_value': 92881.5897966805, 'nu': 1.5}. Best is trial 1456 with value: 0.13435337537029549.
[I 2024-12-04 15:21:30,302] Trial 1570 finished with value: 0.13435399045063265 and parameters: {'kernel_type': 'Matern', 'length_scale': 23.59051023553335, 'noise_level': 0.0035490759118098655, 'constant_value': 951.5645166185633, 'nu': 1.5}. Best is trial 1456 with value: 0.13435337537029549.
[I 2024-12-04 15:21:31,139] Trial 1581 finished with value: 1.2693635028569707 and parameters: {'kernel_type': 'Matern', 'length_scale': 128.97005116416122, 'noise_level': 0.0005613292214259181, 'constant_value': 2.720610147763394, 'nu': 1.5}. Best is trial 1456 with value: 0.13435337537029549.
[I 2024-12-04 15:21:32,193] Trial 1582 finished with value: 0.13435443906295363 and parameters: {'kernel_type': 'Matern', 'length_scale': 4.476733390245472, 'noise_level': 0.8867581610311801, 'constant_value': 934.4339605923604, 'nu': 1.5}. Best is trial 1456 with value: 0.13435337537029549.
[I 2024-12-04 15:21:32,760] Trial 1575 finished with value: 0.1343544018445961 and parameters: {'kernel_type': 'Matern', 'length_scale': 0.16856419905319392, 'noise_level': 0.09206288603497688, 'constant_value': 0.14775212503925136, 'nu': 1.5}. Best is trial 1456 with value: 0.13435337537029549.
[I 2024-12-04 15:21:34,614] Trial 1579 finished with value: 1.269363502857142 and parameters: {'kernel_type': 'Matern', 'length_scale': 9.85299136419678, 'noise_level': 1.7380509146735685e-09, 'constant_value': 0.24504265580908433, 'nu': 1.5}. Best is trial 1456 with value: 0.13435337537029549.
[I 2024-12-04 15:21:34,692] Trial 1571 finished with value: 0.14859826903938736 and parameters: {'kernel_type': 'Matern', 'length_scale': 17.776986167984706, 'noise_level': 7.540553794975412e-05, 'constant_value': 770.8056274886335, 'nu': 2.5}. Best is trial 1456 with value: 0.13435337537029549.
[I 2024-12-04 15:21:37,584] Trial 1586 finished with value: 0.15167297233462415 and parameters: {'kernel_type': 'RBF', 'length_scale': 18.55880427703329, 'noise_level': 0.005082589100993506, 'constant_value': 62695.17608227608, 'nu': 1.5}. Best is trial 1456 with value: 0.13435337537029549.
[I 2024-12-04 15:21:37,826] Trial 1569 finished with value: 0.13435441167503032 and parameters: {'kernel_type': 'Matern', 'length_scale': 1.3172355178681332, 'noise_level': 0.010912070306909199, 'constant_value': 89924.6925633157, 'nu': 1.5}. Best is trial 1456 with value: 0.13435337537029549.
[I 2024-12-04 15:21:38,501] Trial 1577 finished with value: 0.13435440917779734 and parameters: {'kernel_type': 'Matern', 'length_scale': 37.688491931808635, 'noise_level': 0.013402172401388102, 'constant_value': 1665.4335352713483, 'nu': 1.5}. Best is trial 1456 with value: 0.13435337537029549.
[I 2024-12-04 15:21:41,925] Trial 1591 finished with value: 0.13435439676609492 and parameters: {'kernel_type': 'Matern', 'length_scale': 694.1400135069299, 'noise_level': 0.03420300107973328, 'constant_value': 89207.04802947065, 'nu': 1.5}. Best is trial 1456 with value: 0.13435337537029549.
[I 2024-12-04 15:21:42,438] Trial 1578 finished with value: 0.1343543961536456 and parameters: {'kernel_type': 'Matern', 'length_scale': 2.1312157216538816, 'noise_level': 0.06496464358303673, 'constant_value': 6.083818254168412, 'nu': 1.5}. Best is trial 1456 with value: 0.13435337537029549.
[I 2024-12-04 15:21:42,818] Trial 1584 finished with value: 0.13435436984977875 and parameters: {'kernel_type': 'Matern', 'length_scale': 3.9192134053982786, 'noise_level': 6.428954545570493e-05, 'constant_value': 447.28313539940655, 'nu': 1.5}. Best is trial 1456 with value: 0.13435337537029549.
[I 2024-12-04 15:21:44,606] Trial 1587 finished with value: 0.13435439309419758 and parameters: {'kernel_type': 'Matern', 'length_scale': 6.0320559929216335, 'noise_level': 0.00011197201786882196, 'constant_value': 3976.8861219349483, 'nu': 1.5}. Best is trial 1456 with value: 0.13435337537029549.
[I 2024-12-04 15:21:45,131] Trial 1589 finished with value: 1.2693635028667374 and parameters: {'kernel_type': 'Matern', 'length_scale': 80.6910327909785, 'noise_level': 2.2112603103362836e-06, 'constant_value': 0.14531551547132981, 'nu': 1.5}. Best is trial 1456 with value: 0.13435337537029549.
[I 2024-12-04 15:21:46,223] Trial 1594 finished with value: 0.13435438409675657 and parameters: {'kernel_type': 'Matern', 'length_scale': 6.072197254852655, 'noise_level': 2.1967323597847342e-05, 'constant_value': 95.38246934634024, 'nu': 1.5}. Best is trial 1456 with value: 0.13435337537029549.
[I 2024-12-04 15:21:47,008] Trial 1583 finished with value: 0.1343544900127143 and parameters: {'kernel_type': 'Matern', 'length_scale': 0.19291742928967834, 'noise_level': 0.009062709533837063, 'constant_value': 51.775409594580495, 'nu': 1.5}. Best is trial 1456 with value: 0.13435337537029549.
[I 2024-12-04 15:21:47,316] Trial 1588 finished with value: 1.2693635028567707 and parameters: {'kernel_type': 'RBF', 'length_scale': 0.020783477224769174, 'noise_level': 0.0006486204589799574, 'constant_value': 1.8915951499336204e-06, 'nu': 1.5}. Best is trial 1456 with value: 0.13435337537029549.
[I 2024-12-04 15:21:48,947] Trial 1592 finished with value: 0.1343547548646119 and parameters: {'kernel_type': 'Matern', 'length_scale': 27.625004897694634, 'noise_level': 0.012369649329738145, 'constant_value': 91328.51705861281, 'nu': 1.5}. Best is trial 1456 with value: 0.13435337537029549.
[I 2024-12-04 15:21:49,155] Trial 1597 finished with value: 0.13435440818062236 and parameters: {'kernel_type': 'Matern', 'length_scale': 154.45174469245248, 'noise_level': 0.0006691775101588914, 'constant_value': 8497.405062744157, 'nu': 1.5}. Best is trial 1456 with value: 0.13435337537029549.
[I 2024-12-04 15:21:49,322] Trial 1585 finished with value: 0.13435439842934335 and parameters: {'kernel_type': 'Matern', 'length_scale': 121.78855982602433, 'noise_level': 0.0008670693551086558, 'constant_value': 47.67073615924779, 'nu': 1.5}. Best is trial 1456 with value: 0.13435337537029549.
[I 2024-12-04 15:21:49,324] Trial 1593 finished with value: 0.1343543535186012 and parameters: {'kernel_type': 'Matern', 'length_scale': 53.7567003940104, 'noise_level': 0.00809282171225816, 'constant_value': 88371.37809597047, 'nu': 1.5}. Best is trial 1456 with value: 0.13435337537029549.
[I 2024-12-04 15:21:49,505] Trial 1572 finished with value: 0.1343538008060248 and parameters: {'kernel_type': 'Matern', 'length_scale': 62.071964063945344, 'noise_level': 0.044784550957117676, 'constant_value': 175.1376599045905, 'nu': 1.5}. Best is trial 1456 with value: 0.13435337537029549.
[I 2024-12-04 15:21:52,478] Trial 1596 finished with value: 0.1485982680372729 and parameters: {'kernel_type': 'Matern', 'length_scale': 17.89235632598351, 'noise_level': 0.0009273847024072431, 'constant_value': 70608.62587271875, 'nu': 2.5}. Best is trial 1456 with value: 0.13435337537029549.
[I 2024-12-04 15:21:53,293] Trial 1606 finished with value: 0.13435439907204502 and parameters: {'kernel_type': 'Matern', 'length_scale': 1218.5713794965227, 'noise_level': 0.11654969636734626, 'constant_value': 0.45928113322993114, 'nu': 1.5}. Best is trial 1456 with value: 0.13435337537029549.
[I 2024-12-04 15:21:54,125] Trial 1604 finished with value: 0.13435468318544855 and parameters: {'kernel_type': 'Matern', 'length_scale': 485.5886583097802, 'noise_level': 0.3391471580249305, 'constant_value': 2.5976728987551607, 'nu': 1.5}. Best is trial 1456 with value: 0.13435337537029549.
[I 2024-12-04 15:21:54,567] Trial 1600 finished with value: 1.2693635028569645 and parameters: {'kernel_type': 'Matern', 'length_scale': 1392.1452734960105, 'noise_level': 0.0018679679463036731, 'constant_value': 537.8087935949219, 'nu': 1.5}. Best is trial 1456 with value: 0.13435337537029549.
[I 2024-12-04 15:21:55,115] Trial 1590 finished with value: 1.2693635028497692 and parameters: {'kernel_type': 'Matern', 'length_scale': 0.039264774112042024, 'noise_level': 1.33240237572774e-08, 'constant_value': 31.34148007853399, 'nu': 0.5}. Best is trial 1456 with value: 0.13435337537029549.
[I 2024-12-04 15:21:57,507] Trial 1595 finished with value: 0.13435463549844345 and parameters: {'kernel_type': 'Matern', 'length_scale': 71.71879396114296, 'noise_level': 0.000580382268652925, 'constant_value': 87.07395338573156, 'nu': 1.5}. Best is trial 1456 with value: 0.13435337537029549.
[I 2024-12-04 15:21:58,214] Trial 1605 finished with value: 0.15167296000732933 and parameters: {'kernel_type': 'RBF', 'length_scale': 35.8898475147965, 'noise_level': 0.0010438912144895582, 'constant_value': 27.82082634209382, 'nu': 1.5}. Best is trial 1456 with value: 0.13435337537029549.
[I 2024-12-04 15:22:01,891] Trial 1607 finished with value: 0.13435439584532302 and parameters: {'kernel_type': 'Matern', 'length_scale': 1322.2336888510506, 'noise_level': 0.020508745710706693, 'constant_value': 80.35811712933547, 'nu': 1.5}. Best is trial 1456 with value: 0.13435337537029549.
[I 2024-12-04 15:22:02,109] Trial 1609 finished with value: 0.13435439223416354 and parameters: {'kernel_type': 'Matern', 'length_scale': 350.3186720270561, 'noise_level': 0.012112741196125596, 'constant_value': 687.26849186358, 'nu': 1.5}. Best is trial 1456 with value: 0.13435337537029549.
[I 2024-12-04 15:22:04,470] Trial 1602 finished with value: 0.13435439639568916 and parameters: {'kernel_type': 'Matern', 'length_scale': 516.2297675127709, 'noise_level': 0.07299566258555883, 'constant_value': 490.85689922058714, 'nu': 1.5}. Best is trial 1456 with value: 0.13435337537029549.
[I 2024-12-04 15:22:05,062] Trial 1601 finished with value: 0.13435439930576157 and parameters: {'kernel_type': 'Matern', 'length_scale': 315.60969786396157, 'noise_level': 0.010278065179999005, 'constant_value': 415.3943916206876, 'nu': 1.5}. Best is trial 1456 with value: 0.13435337537029549.
[I 2024-12-04 15:22:05,085] Trial 1611 finished with value: 0.13435436051483 and parameters: {'kernel_type': 'Matern', 'length_scale': 101.86139016359668, 'noise_level': 0.004439536346257095, 'constant_value': 170.3470962412189, 'nu': 1.5}. Best is trial 1456 with value: 0.13435337537029549.
[I 2024-12-04 15:22:05,118] Trial 1598 finished with value: 0.1343541370774638 and parameters: {'kernel_type': 'Matern', 'length_scale': 545.5795371392965, 'noise_level': 0.014746411387177116, 'constant_value': 148.9500074881731, 'nu': 1.5}. Best is trial 1456 with value: 0.13435337537029549.
[I 2024-12-04 15:22:05,702] Trial 1608 finished with value: 0.13435439836423546 and parameters: {'kernel_type': 'Matern', 'length_scale': 191.89587297314137, 'noise_level': 0.7201196007614787, 'constant_value': 91.702580441604, 'nu': 1.5}. Best is trial 1456 with value: 0.13435337537029549.
[I 2024-12-04 15:22:05,745] Trial 1603 finished with value: 0.1343542218808674 and parameters: {'kernel_type': 'Matern', 'length_scale': 48.99646908505578, 'noise_level': 0.004940732135678886, 'constant_value': 1881.5953893101803, 'nu': 1.5}. Best is trial 1456 with value: 0.13435337537029549.
[I 2024-12-04 15:22:06,436] Trial 1599 finished with value: 0.13435424958467704 and parameters: {'kernel_type': 'Matern', 'length_scale': 33.97433228940125, 'noise_level': 0.5254827066790535, 'constant_value': 298.3189486531187, 'nu': 1.5}. Best is trial 1456 with value: 0.13435337537029549.
[I 2024-12-04 15:22:07,866] Trial 1612 finished with value: 0.13435446459035658 and parameters: {'kernel_type': 'Matern', 'length_scale': 598.4492610139093, 'noise_level': 0.00042301992618243387, 'constant_value': 1590.4997727712057, 'nu': 1.5}. Best is trial 1456 with value: 0.13435337537029549.
[I 2024-12-04 15:22:11,484] Trial 1618 finished with value: 0.13435433261314403 and parameters: {'kernel_type': 'Matern', 'length_scale': 50.1770840656199, 'noise_level': 0.0005782270251724813, 'constant_value': 1552.0169751899446, 'nu': 1.5}. Best is trial 1456 with value: 0.13435337537029549.
[I 2024-12-04 15:22:11,866] Trial 1614 finished with value: 0.13435439767771926 and parameters: {'kernel_type': 'Matern', 'length_scale': 89.85382210724097, 'noise_level': 0.003148182226717872, 'constant_value': 3.2986654826154402, 'nu': 1.5}. Best is trial 1456 with value: 0.13435337537029549.
[I 2024-12-04 15:22:12,373] Trial 1610 finished with value: 0.13435431145003615 and parameters: {'kernel_type': 'Matern', 'length_scale': 256.2618797858431, 'noise_level': 2.0888682975560836e-06, 'constant_value': 2320.4023489014953, 'nu': 1.5}. Best is trial 1456 with value: 0.13435337537029549.
[I 2024-12-04 15:22:12,431] Trial 1615 finished with value: 0.13435467076391341 and parameters: {'kernel_type': 'Matern', 'length_scale': 25.93531673390297, 'noise_level': 0.005262746092635926, 'constant_value': 542.6222435289187, 'nu': 1.5}. Best is trial 1456 with value: 0.13435337537029549.
[I 2024-12-04 15:22:14,505] Trial 1617 finished with value: 1.2693635028569938 and parameters: {'kernel_type': 'RBF', 'length_scale': 4.0568722222430917e-05, 'noise_level': 0.39176504636581344, 'constant_value': 0.00713788286810925, 'nu': 2.5}. Best is trial 1456 with value: 0.13435337537029549.
[I 2024-12-04 15:22:15,272] Trial 1627 finished with value: 0.1343544671725434 and parameters: {'kernel_type': 'Matern', 'length_scale': 150.8884258487052, 'noise_level': 0.9679664843091951, 'constant_value': 29913.613194198133, 'nu': 1.5}. Best is trial 1456 with value: 0.13435337537029549.
[I 2024-12-04 15:22:16,907] Trial 1624 finished with value: 0.13435437622910845 and parameters: {'kernel_type': 'Matern', 'length_scale': 25.899448831702426, 'noise_level': 0.9992660457937013, 'constant_value': 55447.88134029928, 'nu': 1.5}. Best is trial 1456 with value: 0.13435337537029549.
[I 2024-12-04 15:22:17,441] Trial 1616 finished with value: 0.13435437175848822 and parameters: {'kernel_type': 'Matern', 'length_scale': 0.13712716061665375, 'noise_level': 1.2569851896582477e-10, 'constant_value': 2.268161474943216e-07, 'nu': 1.5}. Best is trial 1456 with value: 0.13435337537029549.
[I 2024-12-04 15:22:17,803] Trial 1620 finished with value: 1.2693635028605021 and parameters: {'kernel_type': 'RBF', 'length_scale': 33.19713350036366, 'noise_level': 1.5237511510041758e-05, 'constant_value': 43676.69813714152, 'nu': 1.5}. Best is trial 1456 with value: 0.13435337537029549.
[I 2024-12-04 15:22:18,884] Trial 1613 finished with value: 0.17251040848222263 and parameters: {'kernel_type': 'Matern', 'length_scale': 4248.7946097205395, 'noise_level': 0.0011722308484546536, 'constant_value': 10.2206369513479, 'nu': 0.5}. Best is trial 1456 with value: 0.13435337537029549.
[I 2024-12-04 15:22:18,888] Trial 1628 finished with value: 0.13435443257802665 and parameters: {'kernel_type': 'Matern', 'length_scale': 4900.20465952357, 'noise_level': 0.023278503846024607, 'constant_value': 702.1631971287295, 'nu': 1.5}. Best is trial 1456 with value: 0.13435337537029549.
[I 2024-12-04 15:22:18,953] Trial 1623 finished with value: 0.13435439986708556 and parameters: {'kernel_type': 'Matern', 'length_scale': 41.742314734648865, 'noise_level': 0.0041988040847716485, 'constant_value': 153.85337738278662, 'nu': 1.5}. Best is trial 1456 with value: 0.13435337537029549.
[I 2024-12-04 15:22:21,173] Trial 1621 finished with value: 1.269363054676773 and parameters: {'kernel_type': 'Matern', 'length_scale': 0.10040743393875792, 'noise_level': 5.078091830419838e-05, 'constant_value': 0.016712173528955297, 'nu': 1.5}. Best is trial 1456 with value: 0.13435337537029549.
[I 2024-12-04 15:22:21,191] Trial 1622 finished with value: 0.13435440090571318 and parameters: {'kernel_type': 'Matern', 'length_scale': 38.263296683466265, 'noise_level': 0.005388619439509994, 'constant_value': 88.70151889987463, 'nu': 1.5}. Best is trial 1456 with value: 0.13435337537029549.
[I 2024-12-04 15:22:22,493] Trial 1625 finished with value: 1.2693635028560781 and parameters: {'kernel_type': 'RBF', 'length_scale': 0.026271160191377773, 'noise_level': 2.5951914058669535e-09, 'constant_value': 35.02714249217599, 'nu': 1.5}. Best is trial 1456 with value: 0.13435337537029549.
[I 2024-12-04 15:22:24,909] Trial 1631 finished with value: 0.13435439932639387 and parameters: {'kernel_type': 'Matern', 'length_scale': 57.91583692855798, 'noise_level': 0.02354155534938308, 'constant_value': 0.15784447090845735, 'nu': 1.5}. Best is trial 1456 with value: 0.13435337537029549.
[I 2024-12-04 15:22:25,113] Trial 1619 finished with value: 0.13435435097530218 and parameters: {'kernel_type': 'Matern', 'length_scale': 150.58695480558944, 'noise_level': 0.5133185870893038, 'constant_value': 94866.86920154182, 'nu': 1.5}. Best is trial 1456 with value: 0.13435337537029549.
[I 2024-12-04 15:22:25,774] Trial 1633 finished with value: 0.1343543781852921 and parameters: {'kernel_type': 'Matern', 'length_scale': 80.0408106613814, 'noise_level': 0.022551409576097945, 'constant_value': 393.193940651556, 'nu': 1.5}. Best is trial 1456 with value: 0.13435337537029549.
[I 2024-12-04 15:22:25,816] Trial 1630 finished with value: 0.13435441924141947 and parameters: {'kernel_type': 'Matern', 'length_scale': 181.42620036840927, 'noise_level': 0.019100581863332432, 'constant_value': 79615.83432163621, 'nu': 1.5}. Best is trial 1456 with value: 0.13435337537029549.
[I 2024-12-04 15:22:26,411] Trial 1632 finished with value: 0.13435440404222623 and parameters: {'kernel_type': 'Matern', 'length_scale': 156.45357271756995, 'noise_level': 8.059866810229933e-05, 'constant_value': 1218.5815519030762, 'nu': 1.5}. Best is trial 1456 with value: 0.13435337537029549.
[I 2024-12-04 15:22:27,594] Trial 1634 finished with value: 0.13435440311211908 and parameters: {'kernel_type': 'Matern', 'length_scale': 1.4533901783035246, 'noise_level': 0.0005792519383710891, 'constant_value': 60536.59679373137, 'nu': 1.5}. Best is trial 1456 with value: 0.13435337537029549.
