[I 2024-12-04 13:17:54,886] Trial 1675 finished with value: 0.24736060950054192 and parameters: {'n_estimators': 1202, 'learning_rate': 0.08050595593493241, 'max_depth': 7, 'min_samples_split': 6, 'min_samples_leaf': 1, 'subsample': 0.8854344692166698, 'max_features': 'sqrt'}. Best is trial 1389 with value: 0.22332552856343169.
[I 2024-12-04 13:17:55,457] Trial 1668 finished with value: 0.23531798950844052 and parameters: {'n_estimators': 1486, 'learning_rate': 0.055098035924816664, 'max_depth': 10, 'min_samples_split': 2, 'min_samples_leaf': 1, 'subsample': 0.7520568339270152, 'max_features': 'sqrt'}. Best is trial 1389 with value: 0.22332552856343169.
[I 2024-12-04 13:18:00,739] Trial 1669 finished with value: 0.2552375339295551 and parameters: {'n_estimators': 1430, 'learning_rate': 0.05825166892360713, 'max_depth': 9, 'min_samples_split': 5, 'min_samples_leaf': 1, 'subsample': 0.6579741747468478, 'max_features': 'sqrt'}. Best is trial 1389 with value: 0.22332552856343169.
[I 2024-12-04 13:18:03,220] Trial 1672 finished with value: 0.24010290974807003 and parameters: {'n_estimators': 1366, 'learning_rate': 0.0570645266417104, 'max_depth': 10, 'min_samples_split': 4, 'min_samples_leaf': 1, 'subsample': 0.6616710607485538, 'max_features': 'sqrt'}. Best is trial 1389 with value: 0.22332552856343169.
[I 2024-12-04 13:18:05,131] Trial 1671 finished with value: 0.2892086754564559 and parameters: {'n_estimators': 1470, 'learning_rate': 0.07241228073486261, 'max_depth': 6, 'min_samples_split': 2, 'min_samples_leaf': 2, 'subsample': 0.7446858711959506, 'max_features': 'sqrt'}. Best is trial 1389 with value: 0.22332552856343169.
[I 2024-12-04 13:18:06,319] Trial 1676 finished with value: 0.24714125145398996 and parameters: {'n_estimators': 1283, 'learning_rate': 0.05964294810609995, 'max_depth': 12, 'min_samples_split': 10, 'min_samples_leaf': 1, 'subsample': 0.6529910175634763, 'max_features': 'sqrt'}. Best is trial 1389 with value: 0.22332552856343169.
[I 2024-12-04 13:18:07,394] Trial 1688 finished with value: 0.3571017047299826 and parameters: {'n_estimators': 490, 'learning_rate': 0.02574533030140279, 'max_depth': 12, 'min_samples_split': 13, 'min_samples_leaf': 1, 'subsample': 0.8144671867816297, 'max_features': None}. Best is trial 1389 with value: 0.22332552856343169.
[I 2024-12-04 13:18:07,399] Trial 1673 finished with value: 0.2578644430109535 and parameters: {'n_estimators': 1419, 'learning_rate': 0.09417664349531968, 'max_depth': 6, 'min_samples_split': 9, 'min_samples_leaf': 1, 'subsample': 0.810173398235307, 'max_features': 'sqrt'}. Best is trial 1389 with value: 0.22332552856343169.
[I 2024-12-04 13:18:18,831] Trial 1678 finished with value: 0.2824324923301971 and parameters: {'n_estimators': 1462, 'learning_rate': 0.06507392465054973, 'max_depth': 11, 'min_samples_split': 2, 'min_samples_leaf': 2, 'subsample': 0.6472223487007471, 'max_features': 'sqrt'}. Best is trial 1389 with value: 0.22332552856343169.
[I 2024-12-04 13:18:20,376] Trial 1686 finished with value: 0.4606052989002197 and parameters: {'n_estimators': 705, 'learning_rate': 0.02053726989064574, 'max_depth': 9, 'min_samples_split': 16, 'min_samples_leaf': 8, 'subsample': 0.6574951837335188, 'max_features': None}. Best is trial 1389 with value: 0.22332552856343169.
[I 2024-12-04 13:18:23,822] Trial 1689 finished with value: 0.46179893204022054 and parameters: {'n_estimators': 762, 'learning_rate': 0.01631637389351589, 'max_depth': 5, 'min_samples_split': 15, 'min_samples_leaf': 3, 'subsample': 0.8517715926026898, 'max_features': 'sqrt'}. Best is trial 1389 with value: 0.22332552856343169.
[I 2024-12-04 13:18:26,456] Trial 1681 finished with value: 0.2835920368012346 and parameters: {'n_estimators': 1277, 'learning_rate': 0.06763123363762241, 'max_depth': 8, 'min_samples_split': 4, 'min_samples_leaf': 2, 'subsample': 0.9574593976747052, 'max_features': 'log2'}. Best is trial 1389 with value: 0.22332552856343169.
[I 2024-12-04 13:18:30,915] Trial 1679 finished with value: 0.2400233305392744 and parameters: {'n_estimators': 1499, 'learning_rate': 0.06711281132169959, 'max_depth': 6, 'min_samples_split': 2, 'min_samples_leaf': 1, 'subsample': 0.7752718784601412, 'max_features': 'sqrt'}. Best is trial 1389 with value: 0.22332552856343169.
[I 2024-12-04 13:18:32,376] Trial 1680 finished with value: 0.24944004647539092 and parameters: {'n_estimators': 1477, 'learning_rate': 0.06567712393994492, 'max_depth': 8, 'min_samples_split': 2, 'min_samples_leaf': 1, 'subsample': 0.653654104133624, 'max_features': 'sqrt'}. Best is trial 1389 with value: 0.22332552856343169.
[I 2024-12-04 13:18:36,242] Trial 1685 finished with value: 0.23857753120056224 and parameters: {'n_estimators': 1165, 'learning_rate': 0.05497541494169558, 'max_depth': 9, 'min_samples_split': 3, 'min_samples_leaf': 1, 'subsample': 0.7013100063356574, 'max_features': 'sqrt'}. Best is trial 1389 with value: 0.22332552856343169.
[I 2024-12-04 13:18:37,867] Trial 1705 finished with value: 0.45923573849725463 and parameters: {'n_estimators': 386, 'learning_rate': 0.011624086936107171, 'max_depth': 8, 'min_samples_split': 8, 'min_samples_leaf': 7, 'subsample': 0.7978324513149962, 'max_features': None}. Best is trial 1389 with value: 0.22332552856343169.
[I 2024-12-04 13:18:39,492] Trial 1684 finished with value: 0.2578473913302926 and parameters: {'n_estimators': 1208, 'learning_rate': 0.051321738355883044, 'max_depth': 6, 'min_samples_split': 6, 'min_samples_leaf': 1, 'subsample': 0.7337921979256921, 'max_features': 'sqrt'}. Best is trial 1389 with value: 0.22332552856343169.
[I 2024-12-04 13:18:41,417] Trial 1683 finished with value: 0.47923636105436485 and parameters: {'n_estimators': 1216, 'learning_rate': 0.019279526257033025, 'max_depth': 9, 'min_samples_split': 2, 'min_samples_leaf': 9, 'subsample': 0.8208159076406086, 'max_features': None}. Best is trial 1389 with value: 0.22332552856343169.
[I 2024-12-04 13:18:42,854] Trial 1697 finished with value: 0.31020140013120884 and parameters: {'n_estimators': 775, 'learning_rate': 0.09570184386505666, 'max_depth': 8, 'min_samples_split': 2, 'min_samples_leaf': 2, 'subsample': 0.8750543710954692, 'max_features': 'sqrt'}. Best is trial 1389 with value: 0.22332552856343169.
[I 2024-12-04 13:18:48,919] Trial 1682 finished with value: 0.345949923428607 and parameters: {'n_estimators': 1485, 'learning_rate': 0.051570632797009706, 'max_depth': 9, 'min_samples_split': 3, 'min_samples_leaf': 3, 'subsample': 0.6019004691411333, 'max_features': 'sqrt'}. Best is trial 1389 with value: 0.22332552856343169.
[I 2024-12-04 13:18:51,367] Trial 1687 finished with value: 0.36258481662282693 and parameters: {'n_estimators': 1251, 'learning_rate': 0.059906332685945175, 'max_depth': 8, 'min_samples_split': 9, 'min_samples_leaf': 3, 'subsample': 0.8310244155052047, 'max_features': 'sqrt'}. Best is trial 1389 with value: 0.22332552856343169.
[I 2024-12-04 13:18:51,516] Trial 1693 finished with value: 0.2921985496938479 and parameters: {'n_estimators': 1008, 'learning_rate': 0.07686504341183954, 'max_depth': 7, 'min_samples_split': 2, 'min_samples_leaf': 2, 'subsample': 0.838511663361894, 'max_features': 'sqrt'}. Best is trial 1389 with value: 0.22332552856343169.
[I 2024-12-04 13:18:53,406] Trial 1691 finished with value: 0.4049313409806491 and parameters: {'n_estimators': 1162, 'learning_rate': 0.036657874847923884, 'max_depth': 5, 'min_samples_split': 3, 'min_samples_leaf': 1, 'subsample': 0.8562200879666282, 'max_features': 'log2'}. Best is trial 1389 with value: 0.22332552856343169.
[I 2024-12-04 13:19:01,086] Trial 1694 finished with value: 0.24715035139243305 and parameters: {'n_estimators': 1188, 'learning_rate': 0.05208422201187168, 'max_depth': 7, 'min_samples_split': 2, 'min_samples_leaf': 1, 'subsample': 0.6912362642233021, 'max_features': 'sqrt'}. Best is trial 1389 with value: 0.22332552856343169.
[I 2024-12-04 13:19:03,505] Trial 1719 finished with value: 0.4034122920814506 and parameters: {'n_estimators': 232, 'learning_rate': 0.0973677191804077, 'max_depth': 3, 'min_samples_split': 8, 'min_samples_leaf': 3, 'subsample': 0.7805575008148984, 'max_features': None}. Best is trial 1389 with value: 0.22332552856343169.
[I 2024-12-04 13:19:10,586] Trial 1692 finished with value: 0.2397659795928923 and parameters: {'n_estimators': 1376, 'learning_rate': 0.04405670832182766, 'max_depth': 11, 'min_samples_split': 3, 'min_samples_leaf': 1, 'subsample': 0.6155659323310014, 'max_features': 'sqrt'}. Best is trial 1389 with value: 0.22332552856343169.
[I 2024-12-04 13:19:11,751] Trial 1696 finished with value: 0.2891939061384769 and parameters: {'n_estimators': 1281, 'learning_rate': 0.06856098124246561, 'max_depth': 8, 'min_samples_split': 8, 'min_samples_leaf': 2, 'subsample': 0.6115987712326619, 'max_features': 'sqrt'}. Best is trial 1389 with value: 0.22332552856343169.
[I 2024-12-04 13:19:12,996] Trial 1707 finished with value: 0.3325376853322565 and parameters: {'n_estimators': 799, 'learning_rate': 0.06919756450382117, 'max_depth': 6, 'min_samples_split': 8, 'min_samples_leaf': 1, 'subsample': 0.985672086453971, 'max_features': None}. Best is trial 1389 with value: 0.22332552856343169.
[I 2024-12-04 13:19:16,596] Trial 1695 finished with value: 0.2633007460642942 and parameters: {'n_estimators': 1332, 'learning_rate': 0.0786923864974142, 'max_depth': 10, 'min_samples_split': 6, 'min_samples_leaf': 1, 'subsample': 0.8091663342514754, 'max_features': 'log2'}. Best is trial 1389 with value: 0.22332552856343169.
[I 2024-12-04 13:19:20,593] Trial 1725 finished with value: 1.181106079365503 and parameters: {'n_estimators': 272, 'learning_rate': 0.01119678376965902, 'max_depth': 3, 'min_samples_split': 8, 'min_samples_leaf': 5, 'subsample': 0.9019720611461569, 'max_features': 'log2'}. Best is trial 1389 with value: 0.22332552856343169.
[I 2024-12-04 13:19:22,722] Trial 1690 finished with value: 0.33482780798370576 and parameters: {'n_estimators': 1413, 'learning_rate': 0.032516895365104256, 'max_depth': 12, 'min_samples_split': 20, 'min_samples_leaf': 2, 'subsample': 0.6573415042888883, 'max_features': None}. Best is trial 1389 with value: 0.22332552856343169.
[I 2024-12-04 13:19:23,313] Trial 1699 finished with value: 0.27515348816632634 and parameters: {'n_estimators': 1320, 'learning_rate': 0.06295505994351408, 'max_depth': 10, 'min_samples_split': 2, 'min_samples_leaf': 2, 'subsample': 0.6988523212830823, 'max_features': 'sqrt'}. Best is trial 1389 with value: 0.22332552856343169.
[I 2024-12-04 13:19:28,959] Trial 1700 finished with value: 0.2495733867985431 and parameters: {'n_estimators': 1349, 'learning_rate': 0.07168576882819314, 'max_depth': 5, 'min_samples_split': 4, 'min_samples_leaf': 1, 'subsample': 0.6835884596685116, 'max_features': 'sqrt'}. Best is trial 1389 with value: 0.22332552856343169.
[I 2024-12-04 13:19:30,777] Trial 1702 finished with value: 0.34045330908508586 and parameters: {'n_estimators': 1234, 'learning_rate': 0.0559025087751736, 'max_depth': 7, 'min_samples_split': 4, 'min_samples_leaf': 3, 'subsample': 0.8213949700037605, 'max_features': 'sqrt'}. Best is trial 1389 with value: 0.22332552856343169.
[I 2024-12-04 13:19:31,815] Trial 1698 finished with value: 0.39187299717463714 and parameters: {'n_estimators': 1422, 'learning_rate': 0.04202192228135845, 'max_depth': 3, 'min_samples_split': 3, 'min_samples_leaf': 3, 'subsample': 0.7606364482042093, 'max_features': None}. Best is trial 1389 with value: 0.22332552856343169.
[I 2024-12-04 13:19:34,414] Trial 1703 finished with value: 0.23303932537872013 and parameters: {'n_estimators': 1296, 'learning_rate': 0.05309286106112766, 'max_depth': 9, 'min_samples_split': 2, 'min_samples_leaf': 1, 'subsample': 0.6833036394645814, 'max_features': 'sqrt'}. Best is trial 1389 with value: 0.22332552856343169.
[I 2024-12-04 13:19:34,904] Trial 1729 finished with value: 1.0578237527104974 and parameters: {'n_estimators': 194, 'learning_rate': 0.017106884345527304, 'max_depth': 7, 'min_samples_split': 19, 'min_samples_leaf': 1, 'subsample': 0.9758450619367122, 'max_features': 'log2'}. Best is trial 1389 with value: 0.22332552856343169.
[I 2024-12-04 13:19:37,013] Trial 1701 finished with value: 0.25330333523629045 and parameters: {'n_estimators': 1400, 'learning_rate': 0.07222895342498971, 'max_depth': 6, 'min_samples_split': 3, 'min_samples_leaf': 1, 'subsample': 0.6862617110175802, 'max_features': 'log2'}. Best is trial 1389 with value: 0.22332552856343169.
[I 2024-12-04 13:19:38,926] Trial 1704 finished with value: 0.24341805285755713 and parameters: {'n_estimators': 1328, 'learning_rate': 0.06465355298701722, 'max_depth': 10, 'min_samples_split': 3, 'min_samples_leaf': 1, 'subsample': 0.6479439172777812, 'max_features': 'sqrt'}. Best is trial 1389 with value: 0.22332552856343169.
[I 2024-12-04 13:19:43,457] Trial 1709 finished with value: 0.4408135285051658 and parameters: {'n_estimators': 1118, 'learning_rate': 0.022117336266073154, 'max_depth': 8, 'min_samples_split': 9, 'min_samples_leaf': 5, 'subsample': 0.8665264357890603, 'max_features': None}. Best is trial 1389 with value: 0.22332552856343169.
[I 2024-12-04 13:19:46,252] Trial 1731 finished with value: 0.5128093104305896 and parameters: {'n_estimators': 289, 'learning_rate': 0.08800899642533418, 'max_depth': 7, 'min_samples_split': 18, 'min_samples_leaf': 3, 'subsample': 0.9876729678480614, 'max_features': 'log2'}. Best is trial 1389 with value: 0.22332552856343169.
[I 2024-12-04 13:19:47,144] Trial 1714 finished with value: 0.2564423590216041 and parameters: {'n_estimators': 1063, 'learning_rate': 0.06543078897928827, 'max_depth': 9, 'min_samples_split': 10, 'min_samples_leaf': 1, 'subsample': 0.873835676131447, 'max_features': 'sqrt'}. Best is trial 1389 with value: 0.22332552856343169.
[I 2024-12-04 13:19:49,853] Trial 1711 finished with value: 0.25103166932817317 and parameters: {'n_estimators': 1177, 'learning_rate': 0.056968107846062425, 'max_depth': 5, 'min_samples_split': 2, 'min_samples_leaf': 1, 'subsample': 0.6111950866608881, 'max_features': 'sqrt'}. Best is trial 1389 with value: 0.22332552856343169.
[I 2024-12-04 13:19:52,597] Trial 1715 finished with value: 0.2637077228062598 and parameters: {'n_estimators': 1078, 'learning_rate': 0.08370121686194604, 'max_depth': 7, 'min_samples_split': 4, 'min_samples_leaf': 1, 'subsample': 0.9342733122835132, 'max_features': 'sqrt'}. Best is trial 1389 with value: 0.22332552856343169.
[I 2024-12-04 13:19:55,286] Trial 1706 finished with value: 0.23619715340357783 and parameters: {'n_estimators': 1433, 'learning_rate': 0.06432583716972497, 'max_depth': 7, 'min_samples_split': 2, 'min_samples_leaf': 1, 'subsample': 0.8042235657078358, 'max_features': 'sqrt'}. Best is trial 1389 with value: 0.22332552856343169.
[I 2024-12-04 13:19:59,261] Trial 1712 finished with value: 0.46321912394140174 and parameters: {'n_estimators': 1357, 'learning_rate': 0.05198126394336931, 'max_depth': 5, 'min_samples_split': 20, 'min_samples_leaf': 10, 'subsample': 0.968823726938525, 'max_features': 'sqrt'}. Best is trial 1389 with value: 0.22332552856343169.
[I 2024-12-04 13:20:00,139] Trial 1710 finished with value: 0.35760485509023787 and parameters: {'n_estimators': 1441, 'learning_rate': 0.0956953566334584, 'max_depth': 7, 'min_samples_split': 8, 'min_samples_leaf': 3, 'subsample': 0.8032803947465228, 'max_features': 'sqrt'}. Best is trial 1389 with value: 0.22332552856343169.
[I 2024-12-04 13:20:00,976] Trial 1708 finished with value: 0.2655422973920722 and parameters: {'n_estimators': 1496, 'learning_rate': 0.08347472681885895, 'max_depth': 6, 'min_samples_split': 3, 'min_samples_leaf': 1, 'subsample': 0.6580357783301563, 'max_features': 'sqrt'}. Best is trial 1389 with value: 0.22332552856343169.
[I 2024-12-04 13:20:04,725] Trial 1717 finished with value: 0.2635486404729799 and parameters: {'n_estimators': 1168, 'learning_rate': 0.07509469772385284, 'max_depth': 12, 'min_samples_split': 5, 'min_samples_leaf': 1, 'subsample': 0.6093521464707194, 'max_features': 'sqrt'}. Best is trial 1389 with value: 0.22332552856343169.
[I 2024-12-04 13:20:04,727] Trial 1730 finished with value: 0.5047279891814984 and parameters: {'n_estimators': 564, 'learning_rate': 0.014560312003729354, 'max_depth': 4, 'min_samples_split': 2, 'min_samples_leaf': 10, 'subsample': 0.6970928947173435, 'max_features': None}. Best is trial 1389 with value: 0.22332552856343169.
[I 2024-12-04 13:20:09,517] Trial 1713 finished with value: 0.24427303808114256 and parameters: {'n_estimators': 1437, 'learning_rate': 0.07860304635812032, 'max_depth': 10, 'min_samples_split': 3, 'min_samples_leaf': 1, 'subsample': 0.661308477493965, 'max_features': 'sqrt'}. Best is trial 1389 with value: 0.22332552856343169.
[I 2024-12-04 13:20:15,091] Trial 1718 finished with value: 0.2398068851422542 and parameters: {'n_estimators': 1267, 'learning_rate': 0.09792279385209539, 'max_depth': 9, 'min_samples_split': 4, 'min_samples_leaf': 1, 'subsample': 0.8277102756758193, 'max_features': 'sqrt'}. Best is trial 1389 with value: 0.22332552856343169.
[I 2024-12-04 13:20:15,096] Trial 1722 finished with value: 0.35472309066488106 and parameters: {'n_estimators': 1137, 'learning_rate': 0.06708981092011461, 'max_depth': 5, 'min_samples_split': 2, 'min_samples_leaf': 3, 'subsample': 0.8449921764980324, 'max_features': 'sqrt'}. Best is trial 1389 with value: 0.22332552856343169.
[I 2024-12-04 13:20:18,441] Trial 1716 finished with value: 0.2518916449743067 and parameters: {'n_estimators': 1441, 'learning_rate': 0.05087071306880706, 'max_depth': 9, 'min_samples_split': 6, 'min_samples_leaf': 1, 'subsample': 0.6497549232210289, 'max_features': 'sqrt'}. Best is trial 1389 with value: 0.22332552856343169.
[I 2024-12-04 13:20:20,204] Trial 1732 finished with value: 0.24381789735732953 and parameters: {'n_estimators': 779, 'learning_rate': 0.060181743777468724, 'max_depth': 9, 'min_samples_split': 7, 'min_samples_leaf': 1, 'subsample': 0.8359909281685611, 'max_features': 'sqrt'}. Best is trial 1389 with value: 0.22332552856343169.
[I 2024-12-04 13:20:21,988] Trial 1727 finished with value: 0.36125607124921205 and parameters: {'n_estimators': 1039, 'learning_rate': 0.08326980897300547, 'max_depth': 9, 'min_samples_split': 7, 'min_samples_leaf': 3, 'subsample': 0.8578690548301388, 'max_features': 'sqrt'}. Best is trial 1389 with value: 0.22332552856343169.
[I 2024-12-04 13:20:24,082] Trial 1740 finished with value: 0.444917337037387 and parameters: {'n_estimators': 436, 'learning_rate': 0.011703276178840292, 'max_depth': 12, 'min_samples_split': 5, 'min_samples_leaf': 3, 'subsample': 0.8451035289738138, 'max_features': None}. Best is trial 1389 with value: 0.22332552856343169.
[I 2024-12-04 13:20:27,620] Trial 1721 finished with value: 0.24518910317799755 and parameters: {'n_estimators': 1391, 'learning_rate': 0.08370360102503382, 'max_depth': 8, 'min_samples_split': 2, 'min_samples_leaf': 1, 'subsample': 0.8556080897600324, 'max_features': 'sqrt'}. Best is trial 1389 with value: 0.22332552856343169.
[I 2024-12-04 13:20:30,127] Trial 1720 finished with value: 0.275138821202277 and parameters: {'n_estimators': 1450, 'learning_rate': 0.09539520350499905, 'max_depth': 6, 'min_samples_split': 2, 'min_samples_leaf': 1, 'subsample': 0.7639456524081256, 'max_features': 'sqrt'}. Best is trial 1389 with value: 0.22332552856343169.
[I 2024-12-04 13:20:30,195] Trial 1724 finished with value: 0.35234401414874233 and parameters: {'n_estimators': 1139, 'learning_rate': 0.07502088223818766, 'max_depth': 10, 'min_samples_split': 3, 'min_samples_leaf': 1, 'subsample': 0.6441599707114701, 'max_features': None}. Best is trial 1389 with value: 0.22332552856343169.
[I 2024-12-04 13:20:32,401] Trial 1728 finished with value: 0.34722223870580654 and parameters: {'n_estimators': 1095, 'learning_rate': 0.09892154021509125, 'max_depth': 8, 'min_samples_split': 2, 'min_samples_leaf': 3, 'subsample': 0.7519899813685766, 'max_features': 'sqrt'}. Best is trial 1389 with value: 0.22332552856343169.
[I 2024-12-04 13:20:39,378] Trial 1723 finished with value: 0.36451846495060675 and parameters: {'n_estimators': 1463, 'learning_rate': 0.06772837954294503, 'max_depth': 9, 'min_samples_split': 2, 'min_samples_leaf': 3, 'subsample': 0.7162789173529949, 'max_features': 'sqrt'}. Best is trial 1389 with value: 0.22332552856343169.
[I 2024-12-04 13:20:39,416] Trial 1739 finished with value: 0.3451336960171909 and parameters: {'n_estimators': 825, 'learning_rate': 0.07859575722596296, 'max_depth': 7, 'min_samples_split': 2, 'min_samples_leaf': 3, 'subsample': 0.6485585250546013, 'max_features': 'sqrt'}. Best is trial 1389 with value: 0.22332552856343169.
[I 2024-12-04 13:20:44,081] Trial 1737 finished with value: 0.34654183099296815 and parameters: {'n_estimators': 972, 'learning_rate': 0.08671694222511331, 'max_depth': 8, 'min_samples_split': 7, 'min_samples_leaf': 3, 'subsample': 0.9964060904817349, 'max_features': 'sqrt'}. Best is trial 1389 with value: 0.22332552856343169.
[I 2024-12-04 13:20:46,299] Trial 1726 finished with value: 0.2552954762120143 and parameters: {'n_estimators': 1472, 'learning_rate': 0.04394093453943995, 'max_depth': 11, 'min_samples_split': 3, 'min_samples_leaf': 1, 'subsample': 0.6365539943005407, 'max_features': 'sqrt'}. Best is trial 1389 with value: 0.22332552856343169.
[I 2024-12-04 13:20:47,502] Trial 1735 finished with value: 0.22653766906243247 and parameters: {'n_estimators': 1080, 'learning_rate': 0.09986963953959087, 'max_depth': 8, 'min_samples_split': 5, 'min_samples_leaf': 1, 'subsample': 0.9076932003193207, 'max_features': 'sqrt'}. Best is trial 1389 with value: 0.22332552856343169.
