[I 2024-12-04 12:17:24,603] Trial 1720 finished with value: 0.3006765010035756 and parameters: {'n_estimators': 326, 'max_depth': 43, 'min_samples_split': 3, 'min_samples_leaf': 1, 'max_features': 'sqrt', 'bootstrap': False, 'criterion': 'squared_error'}. Best is trial 341 with value: 0.2909369124469028.
[I 2024-12-04 12:17:24,889] Trial 1719 finished with value: 0.3058024178196746 and parameters: {'n_estimators': 391, 'max_depth': 50, 'min_samples_split': 6, 'min_samples_leaf': 1, 'max_features': 'sqrt', 'bootstrap': False, 'criterion': 'squared_error'}. Best is trial 341 with value: 0.2909369124469028.
[I 2024-12-04 12:17:25,650] Trial 1723 finished with value: 0.29491993371268815 and parameters: {'n_estimators': 230, 'max_depth': 50, 'min_samples_split': 3, 'min_samples_leaf': 1, 'max_features': 'sqrt', 'bootstrap': False, 'criterion': 'squared_error'}. Best is trial 341 with value: 0.2909369124469028.
[I 2024-12-04 12:17:25,745] Trial 1724 finished with value: 0.30121828665108225 and parameters: {'n_estimators': 147, 'max_depth': 50, 'min_samples_split': 5, 'min_samples_leaf': 1, 'max_features': 'sqrt', 'bootstrap': False, 'criterion': 'squared_error'}. Best is trial 341 with value: 0.2909369124469028.
[I 2024-12-04 12:17:26,299] Trial 1722 finished with value: 0.3047831738921891 and parameters: {'n_estimators': 521, 'max_depth': 41, 'min_samples_split': 3, 'min_samples_leaf': 1, 'max_features': 'sqrt', 'bootstrap': False, 'criterion': 'squared_error'}. Best is trial 341 with value: 0.2909369124469028.
[I 2024-12-04 12:17:26,704] Trial 1727 finished with value: 0.3292265863534848 and parameters: {'n_estimators': 341, 'max_depth': 43, 'min_samples_split': 4, 'min_samples_leaf': 1, 'max_features': 'sqrt', 'bootstrap': True, 'criterion': 'squared_error'}. Best is trial 341 with value: 0.2909369124469028.
[I 2024-12-04 12:17:27,860] Trial 1735 finished with value: 0.3273672625776881 and parameters: {'n_estimators': 255, 'max_depth': 35, 'min_samples_split': 3, 'min_samples_leaf': 1, 'max_features': 'sqrt', 'bootstrap': False, 'criterion': 'squared_error'}. Best is trial 341 with value: 0.2909369124469028.
[I 2024-12-04 12:17:27,865] Trial 1717 finished with value: 0.44375005665093703 and parameters: {'n_estimators': 300, 'max_depth': 50, 'min_samples_split': 3, 'min_samples_leaf': 2, 'max_features': 'sqrt', 'bootstrap': False, 'criterion': 'squared_error'}. Best is trial 341 with value: 0.2909369124469028.
[I 2024-12-04 12:17:27,944] Trial 1733 finished with value: 0.29973941385880354 and parameters: {'n_estimators': 246, 'max_depth': 50, 'min_samples_split': 2, 'min_samples_leaf': 1, 'max_features': 'sqrt', 'bootstrap': False, 'criterion': 'squared_error'}. Best is trial 341 with value: 0.2909369124469028.
[I 2024-12-04 12:17:28,672] Trial 1725 finished with value: 0.29379027099419774 and parameters: {'n_estimators': 531, 'max_depth': 50, 'min_samples_split': 3, 'min_samples_leaf': 1, 'max_features': 'sqrt', 'bootstrap': False, 'criterion': 'squared_error'}. Best is trial 341 with value: 0.2909369124469028.
[I 2024-12-04 12:17:28,673] Trial 1728 finished with value: 0.3134379401481239 and parameters: {'n_estimators': 254, 'max_depth': 41, 'min_samples_split': 4, 'min_samples_leaf': 1, 'max_features': 'sqrt', 'bootstrap': False, 'criterion': 'squared_error'}. Best is trial 341 with value: 0.2909369124469028.
[I 2024-12-04 12:17:29,350] Trial 1716 finished with value: 0.38642958718533427 and parameters: {'n_estimators': 655, 'max_depth': 38, 'min_samples_split': 2, 'min_samples_leaf': 1, 'max_features': None, 'bootstrap': False, 'criterion': 'squared_error'}. Best is trial 341 with value: 0.2909369124469028.
[I 2024-12-04 12:17:29,357] Trial 1736 finished with value: 0.4419463789140574 and parameters: {'n_estimators': 109, 'max_depth': 50, 'min_samples_split': 2, 'min_samples_leaf': 2, 'max_features': 'sqrt', 'bootstrap': False, 'criterion': 'squared_error'}. Best is trial 341 with value: 0.2909369124469028.
[I 2024-12-04 12:17:29,755] Trial 1726 finished with value: 0.4456593181816413 and parameters: {'n_estimators': 278, 'max_depth': 40, 'min_samples_split': 3, 'min_samples_leaf': 2, 'max_features': 'sqrt', 'bootstrap': False, 'criterion': 'squared_error'}. Best is trial 341 with value: 0.2909369124469028.
[I 2024-12-04 12:17:33,218] Trial 1739 finished with value: 0.765827456463902 and parameters: {'n_estimators': 437, 'max_depth': 49, 'min_samples_split': 6, 'min_samples_leaf': 8, 'max_features': 'sqrt', 'bootstrap': False, 'criterion': 'squared_error'}. Best is trial 341 with value: 0.2909369124469028.
[I 2024-12-04 12:17:33,273] Trial 1731 finished with value: 0.29354567319758446 and parameters: {'n_estimators': 507, 'max_depth': 50, 'min_samples_split': 3, 'min_samples_leaf': 1, 'max_features': 'sqrt', 'bootstrap': False, 'criterion': 'squared_error'}. Best is trial 341 with value: 0.2909369124469028.
[I 2024-12-04 12:17:33,275] Trial 1729 finished with value: 0.3004798301399668 and parameters: {'n_estimators': 104, 'max_depth': 45, 'min_samples_split': 3, 'min_samples_leaf': 1, 'max_features': 'sqrt', 'bootstrap': False, 'criterion': 'squared_error'}. Best is trial 341 with value: 0.2909369124469028.
[I 2024-12-04 12:17:36,325] Trial 1738 finished with value: 0.30591763804159083 and parameters: {'n_estimators': 226, 'max_depth': 43, 'min_samples_split': 2, 'min_samples_leaf': 1, 'max_features': 'sqrt', 'bootstrap': False, 'criterion': 'squared_error'}. Best is trial 341 with value: 0.2909369124469028.
[I 2024-12-04 12:17:36,553] Trial 1732 finished with value: 0.29870190459025875 and parameters: {'n_estimators': 760, 'max_depth': 50, 'min_samples_split': 2, 'min_samples_leaf': 1, 'max_features': 'sqrt', 'bootstrap': False, 'criterion': 'squared_error'}. Best is trial 341 with value: 0.2909369124469028.
[I 2024-12-04 12:17:36,914] Trial 1741 finished with value: 0.310072307604982 and parameters: {'n_estimators': 673, 'max_depth': 42, 'min_samples_split': 2, 'min_samples_leaf': 1, 'max_features': 'sqrt', 'bootstrap': False, 'criterion': 'squared_error'}. Best is trial 341 with value: 0.2909369124469028.
[I 2024-12-04 12:17:37,065] Trial 1730 finished with value: 0.33786534097225535 and parameters: {'n_estimators': 159, 'max_depth': 39, 'min_samples_split': 3, 'min_samples_leaf': 1, 'max_features': 'sqrt', 'bootstrap': True, 'criterion': 'squared_error'}. Best is trial 341 with value: 0.2909369124469028.
[I 2024-12-04 12:17:37,067] Trial 1734 finished with value: 0.3889657766648655 and parameters: {'n_estimators': 293, 'max_depth': 48, 'min_samples_split': 3, 'min_samples_leaf': 1, 'max_features': 'log2', 'bootstrap': False, 'criterion': 'squared_error'}. Best is trial 341 with value: 0.2909369124469028.
[I 2024-12-04 12:17:37,070] Trial 1744 finished with value: 0.29524134881108494 and parameters: {'n_estimators': 107, 'max_depth': 49, 'min_samples_split': 2, 'min_samples_leaf': 1, 'max_features': 'sqrt', 'bootstrap': False, 'criterion': 'squared_error'}. Best is trial 341 with value: 0.2909369124469028.
[I 2024-12-04 12:17:38,063] Trial 1742 finished with value: 0.30335989020723453 and parameters: {'n_estimators': 373, 'max_depth': 50, 'min_samples_split': 5, 'min_samples_leaf': 1, 'max_features': 'sqrt', 'bootstrap': False, 'criterion': 'squared_error'}. Best is trial 341 with value: 0.2909369124469028.
[I 2024-12-04 12:17:39,701] Trial 1743 finished with value: 0.30003860353643713 and parameters: {'n_estimators': 387, 'max_depth': 50, 'min_samples_split': 4, 'min_samples_leaf': 1, 'max_features': 'sqrt', 'bootstrap': False, 'criterion': 'squared_error'}. Best is trial 341 with value: 0.2909369124469028.
[I 2024-12-04 12:17:40,864] Trial 1748 finished with value: 0.2980096530956597 and parameters: {'n_estimators': 391, 'max_depth': 50, 'min_samples_split': 2, 'min_samples_leaf': 1, 'max_features': 'sqrt', 'bootstrap': False, 'criterion': 'squared_error'}. Best is trial 341 with value: 0.2909369124469028.
[I 2024-12-04 12:17:41,721] Trial 1737 finished with value: 0.4133614061446591 and parameters: {'n_estimators': 821, 'max_depth': 15, 'min_samples_split': 4, 'min_samples_leaf': 4, 'max_features': None, 'bootstrap': False, 'criterion': 'squared_error'}. Best is trial 341 with value: 0.2909369124469028.
[I 2024-12-04 12:17:42,784] Trial 1752 finished with value: 0.31100547898909525 and parameters: {'n_estimators': 457, 'max_depth': 42, 'min_samples_split': 4, 'min_samples_leaf': 1, 'max_features': 'sqrt', 'bootstrap': False, 'criterion': 'squared_error'}. Best is trial 341 with value: 0.2909369124469028.
[I 2024-12-04 12:17:43,684] Trial 1750 finished with value: 0.4426550133271811 and parameters: {'n_estimators': 527, 'max_depth': 42, 'min_samples_split': 3, 'min_samples_leaf': 2, 'max_features': 'sqrt', 'bootstrap': False, 'criterion': 'squared_error'}. Best is trial 341 with value: 0.2909369124469028.
[I 2024-12-04 12:17:44,795] Trial 1745 finished with value: 0.38061652702769966 and parameters: {'n_estimators': 614, 'max_depth': 49, 'min_samples_split': 3, 'min_samples_leaf': 1, 'max_features': None, 'bootstrap': False, 'criterion': 'squared_error'}. Best is trial 341 with value: 0.2909369124469028.
[I 2024-12-04 12:17:46,090] Trial 1756 finished with value: 0.29527161598233126 and parameters: {'n_estimators': 245, 'max_depth': 50, 'min_samples_split': 3, 'min_samples_leaf': 1, 'max_features': 'sqrt', 'bootstrap': False, 'criterion': 'squared_error'}. Best is trial 341 with value: 0.2909369124469028.
[I 2024-12-04 12:17:47,587] Trial 1751 finished with value: 0.7505167584406154 and parameters: {'n_estimators': 135, 'max_depth': 40, 'min_samples_split': 25, 'min_samples_leaf': 5, 'max_features': 'sqrt', 'bootstrap': True, 'criterion': 'squared_error'}. Best is trial 341 with value: 0.2909369124469028.
[I 2024-12-04 12:17:48,356] Trial 1753 finished with value: 0.3055464255948676 and parameters: {'n_estimators': 205, 'max_depth': 43, 'min_samples_split': 4, 'min_samples_leaf': 1, 'max_features': 'sqrt', 'bootstrap': False, 'criterion': 'squared_error'}. Best is trial 341 with value: 0.2909369124469028.
[I 2024-12-04 12:17:48,422] Trial 1740 finished with value: 0.29401211189604554 and parameters: {'n_estimators': 585, 'max_depth': 50, 'min_samples_split': 3, 'min_samples_leaf': 1, 'max_features': 'sqrt', 'bootstrap': False, 'criterion': 'squared_error'}. Best is trial 341 with value: 0.2909369124469028.
[I 2024-12-04 12:17:48,501] Trial 1757 finished with value: 0.6971258316437468 and parameters: {'n_estimators': 470, 'max_depth': 50, 'min_samples_split': 4, 'min_samples_leaf': 2, 'max_features': 'log2', 'bootstrap': False, 'criterion': 'squared_error'}. Best is trial 341 with value: 0.2909369124469028.
[I 2024-12-04 12:17:48,567] Trial 1762 finished with value: 0.30952961934194223 and parameters: {'n_estimators': 242, 'max_depth': 42, 'min_samples_split': 4, 'min_samples_leaf': 1, 'max_features': 'sqrt', 'bootstrap': False, 'criterion': 'squared_error'}. Best is trial 341 with value: 0.2909369124469028.
[I 2024-12-04 12:17:48,999] Trial 1747 finished with value: 0.42521610367317586 and parameters: {'n_estimators': 838, 'max_depth': 19, 'min_samples_split': 16, 'min_samples_leaf': 2, 'max_features': None, 'bootstrap': False, 'criterion': 'squared_error'}. Best is trial 341 with value: 0.2909369124469028.
[I 2024-12-04 12:17:49,539] Trial 1758 finished with value: 0.4420782941315451 and parameters: {'n_estimators': 293, 'max_depth': 49, 'min_samples_split': 4, 'min_samples_leaf': 2, 'max_features': 'sqrt', 'bootstrap': False, 'criterion': 'squared_error'}. Best is trial 341 with value: 0.2909369124469028.
[I 2024-12-04 12:17:50,640] Trial 1765 finished with value: 0.3014906144468835 and parameters: {'n_estimators': 384, 'max_depth': 43, 'min_samples_split': 3, 'min_samples_leaf': 1, 'max_features': 'sqrt', 'bootstrap': False, 'criterion': 'squared_error'}. Best is trial 341 with value: 0.2909369124469028.
[I 2024-12-04 12:17:50,935] Trial 1759 finished with value: 0.44119256913446586 and parameters: {'n_estimators': 417, 'max_depth': 50, 'min_samples_split': 2, 'min_samples_leaf': 2, 'max_features': 'sqrt', 'bootstrap': False, 'criterion': 'squared_error'}. Best is trial 341 with value: 0.2909369124469028.
[I 2024-12-04 12:17:51,809] Trial 1771 finished with value: 0.30765748248803204 and parameters: {'n_estimators': 102, 'max_depth': 44, 'min_samples_split': 4, 'min_samples_leaf': 1, 'max_features': 'sqrt', 'bootstrap': False, 'criterion': 'squared_error'}. Best is trial 341 with value: 0.2909369124469028.
[I 2024-12-04 12:17:52,060] Trial 1772 finished with value: 0.31155037540009517 and parameters: {'n_estimators': 112, 'max_depth': 44, 'min_samples_split': 5, 'min_samples_leaf': 1, 'max_features': 'sqrt', 'bootstrap': False, 'criterion': 'squared_error'}. Best is trial 341 with value: 0.2909369124469028.
[I 2024-12-04 12:17:53,298] Trial 1754 finished with value: 0.2953826537301686 and parameters: {'n_estimators': 247, 'max_depth': 50, 'min_samples_split': 3, 'min_samples_leaf': 1, 'max_features': 'sqrt', 'bootstrap': False, 'criterion': 'squared_error'}. Best is trial 341 with value: 0.2909369124469028.
[I 2024-12-04 12:17:53,323] Trial 1764 finished with value: 0.4431803470105718 and parameters: {'n_estimators': 569, 'max_depth': 41, 'min_samples_split': 6, 'min_samples_leaf': 2, 'max_features': 'sqrt', 'bootstrap': False, 'criterion': 'squared_error'}. Best is trial 341 with value: 0.2909369124469028.
[I 2024-12-04 12:17:53,496] Trial 1761 finished with value: 0.30433897090740153 and parameters: {'n_estimators': 476, 'max_depth': 41, 'min_samples_split': 3, 'min_samples_leaf': 1, 'max_features': 'sqrt', 'bootstrap': False, 'criterion': 'squared_error'}. Best is trial 341 with value: 0.2909369124469028.
[I 2024-12-04 12:17:55,732] Trial 1769 finished with value: 0.45241272163270013 and parameters: {'n_estimators': 233, 'max_depth': 36, 'min_samples_split': 4, 'min_samples_leaf': 2, 'max_features': 'sqrt', 'bootstrap': False, 'criterion': 'squared_error'}. Best is trial 341 with value: 0.2909369124469028.
[I 2024-12-04 12:17:56,739] Trial 1766 finished with value: 0.37639260521360307 and parameters: {'n_estimators': 450, 'max_depth': 50, 'min_samples_split': 2, 'min_samples_leaf': 1, 'max_features': 'log2', 'bootstrap': False, 'criterion': 'squared_error'}. Best is trial 341 with value: 0.2909369124469028.
[I 2024-12-04 12:17:58,115] Trial 1755 finished with value: 0.39473714404023813 and parameters: {'n_estimators': 221, 'max_depth': 34, 'min_samples_split': 7, 'min_samples_leaf': 1, 'max_features': 'sqrt', 'bootstrap': True, 'criterion': 'absolute_error'}. Best is trial 341 with value: 0.2909369124469028.
[I 2024-12-04 12:17:58,685] Trial 1774 finished with value: 0.4466549833818607 and parameters: {'n_estimators': 246, 'max_depth': 40, 'min_samples_split': 2, 'min_samples_leaf': 2, 'max_features': 'sqrt', 'bootstrap': False, 'criterion': 'squared_error'}. Best is trial 341 with value: 0.2909369124469028.
[I 2024-12-04 12:17:58,750] Trial 1773 finished with value: 0.4473514011401591 and parameters: {'n_estimators': 256, 'max_depth': 42, 'min_samples_split': 5, 'min_samples_leaf': 2, 'max_features': 'sqrt', 'bootstrap': False, 'criterion': 'squared_error'}. Best is trial 341 with value: 0.2909369124469028.
[I 2024-12-04 12:18:00,905] Trial 1770 finished with value: 0.297097335511083 and parameters: {'n_estimators': 102, 'max_depth': 49, 'min_samples_split': 3, 'min_samples_leaf': 1, 'max_features': 'sqrt', 'bootstrap': False, 'criterion': 'squared_error'}. Best is trial 341 with value: 0.2909369124469028.
[I 2024-12-04 12:18:04,780] Trial 1768 finished with value: 0.4442653940212276 and parameters: {'n_estimators': 644, 'max_depth': 42, 'min_samples_split': 3, 'min_samples_leaf': 2, 'max_features': 'sqrt', 'bootstrap': False, 'criterion': 'squared_error'}. Best is trial 341 with value: 0.2909369124469028.
[I 2024-12-04 12:18:09,651] Trial 1746 finished with value: 0.4704932178041415 and parameters: {'n_estimators': 358, 'max_depth': 20, 'min_samples_split': 47, 'min_samples_leaf': 6, 'max_features': None, 'bootstrap': False, 'criterion': 'absolute_error'}. Best is trial 341 with value: 0.2909369124469028.
[I 2024-12-04 12:18:10,128] Trial 1783 finished with value: 0.3808950036044746 and parameters: {'n_estimators': 241, 'max_depth': 50, 'min_samples_split': 3, 'min_samples_leaf': 1, 'max_features': None, 'bootstrap': False, 'criterion': 'squared_error'}. Best is trial 341 with value: 0.2909369124469028.
[I 2024-12-04 12:18:12,595] Trial 1780 finished with value: 0.4400209341148352 and parameters: {'n_estimators': 174, 'max_depth': 29, 'min_samples_split': 37, 'min_samples_leaf': 7, 'max_features': None, 'bootstrap': False, 'criterion': 'squared_error'}. Best is trial 341 with value: 0.2909369124469028.
[I 2024-12-04 12:18:14,546] Trial 1784 finished with value: 0.441893517669906 and parameters: {'n_estimators': 273, 'max_depth': 49, 'min_samples_split': 3, 'min_samples_leaf': 2, 'max_features': 'sqrt', 'bootstrap': False, 'criterion': 'squared_error'}. Best is trial 341 with value: 0.2909369124469028.
[I 2024-12-04 12:18:14,945] Trial 1776 finished with value: 0.29439636857422 and parameters: {'n_estimators': 695, 'max_depth': 50, 'min_samples_split': 3, 'min_samples_leaf': 1, 'max_features': 'sqrt', 'bootstrap': False, 'criterion': 'squared_error'}. Best is trial 341 with value: 0.2909369124469028.
[I 2024-12-04 12:18:15,224] Trial 1778 finished with value: 0.31887147170191965 and parameters: {'n_estimators': 619, 'max_depth': 41, 'min_samples_split': 5, 'min_samples_leaf': 1, 'max_features': 'sqrt', 'bootstrap': False, 'criterion': 'squared_error'}. Best is trial 341 with value: 0.2909369124469028.
[I 2024-12-04 12:18:15,293] Trial 1785 finished with value: 0.2942137341434494 and parameters: {'n_estimators': 210, 'max_depth': 50, 'min_samples_split': 3, 'min_samples_leaf': 1, 'max_features': 'sqrt', 'bootstrap': False, 'criterion': 'squared_error'}. Best is trial 341 with value: 0.2909369124469028.
[I 2024-12-04 12:18:15,380] Trial 1788 finished with value: 0.3106443385960697 and parameters: {'n_estimators': 203, 'max_depth': 40, 'min_samples_split': 2, 'min_samples_leaf': 1, 'max_features': 'sqrt', 'bootstrap': False, 'criterion': 'squared_error'}. Best is trial 341 with value: 0.2909369124469028.
[I 2024-12-04 12:18:15,385] Trial 1779 finished with value: 0.29812321184497353 and parameters: {'n_estimators': 473, 'max_depth': 50, 'min_samples_split': 2, 'min_samples_leaf': 1, 'max_features': 'sqrt', 'bootstrap': False, 'criterion': 'squared_error'}. Best is trial 341 with value: 0.2909369124469028.
[I 2024-12-04 12:18:15,390] Trial 1791 finished with value: 0.30012867972160223 and parameters: {'n_estimators': 380, 'max_depth': 50, 'min_samples_split': 4, 'min_samples_leaf': 1, 'max_features': 'sqrt', 'bootstrap': False, 'criterion': 'squared_error'}. Best is trial 341 with value: 0.2909369124469028.
[I 2024-12-04 12:18:15,597] Trial 1787 finished with value: 0.3146731962089738 and parameters: {'n_estimators': 606, 'max_depth': 43, 'min_samples_split': 5, 'min_samples_leaf': 1, 'max_features': 'sqrt', 'bootstrap': False, 'criterion': 'squared_error'}. Best is trial 341 with value: 0.2909369124469028.
[I 2024-12-04 12:18:15,882] Trial 1789 finished with value: 0.44222354200031216 and parameters: {'n_estimators': 699, 'max_depth': 49, 'min_samples_split': 3, 'min_samples_leaf': 2, 'max_features': 'sqrt', 'bootstrap': False, 'criterion': 'squared_error'}. Best is trial 341 with value: 0.2909369124469028.
[I 2024-12-04 12:18:16,673] Trial 1786 finished with value: 0.30503973264959156 and parameters: {'n_estimators': 359, 'max_depth': 41, 'min_samples_split': 3, 'min_samples_leaf': 1, 'max_features': 'sqrt', 'bootstrap': False, 'criterion': 'squared_error'}. Best is trial 341 with value: 0.2909369124469028.
[I 2024-12-04 12:18:16,862] Trial 1790 finished with value: 0.4433359062521368 and parameters: {'n_estimators': 210, 'max_depth': 50, 'min_samples_split': 3, 'min_samples_leaf': 2, 'max_features': 'sqrt', 'bootstrap': False, 'criterion': 'squared_error'}. Best is trial 341 with value: 0.2909369124469028.
[I 2024-12-04 12:18:16,913] Trial 1760 finished with value: 0.5208293583976129 and parameters: {'n_estimators': 951, 'max_depth': 33, 'min_samples_split': 11, 'min_samples_leaf': 3, 'max_features': 'sqrt', 'bootstrap': False, 'criterion': 'absolute_error'}. Best is trial 341 with value: 0.2909369124469028.
[I 2024-12-04 12:18:17,065] Trial 1781 finished with value: 0.3014515238260526 and parameters: {'n_estimators': 337, 'max_depth': 43, 'min_samples_split': 3, 'min_samples_leaf': 1, 'max_features': 'sqrt', 'bootstrap': False, 'criterion': 'squared_error'}. Best is trial 341 with value: 0.2909369124469028.
[I 2024-12-04 12:18:17,450] Trial 1749 finished with value: 0.4481385297989915 and parameters: {'n_estimators': 421, 'max_depth': 50, 'min_samples_split': 2, 'min_samples_leaf': 6, 'max_features': None, 'bootstrap': False, 'criterion': 'absolute_error'}. Best is trial 341 with value: 0.2909369124469028.
[I 2024-12-04 12:18:18,052] Trial 1793 finished with value: 0.2988490578536965 and parameters: {'n_estimators': 287, 'max_depth': 50, 'min_samples_split': 2, 'min_samples_leaf': 1, 'max_features': 'sqrt', 'bootstrap': False, 'criterion': 'squared_error'}. Best is trial 341 with value: 0.2909369124469028.
[I 2024-12-04 12:18:18,153] Trial 1792 finished with value: 0.3287867371885573 and parameters: {'n_estimators': 359, 'max_depth': 42, 'min_samples_split': 8, 'min_samples_leaf': 1, 'max_features': 'sqrt', 'bootstrap': False, 'criterion': 'squared_error'}. Best is trial 341 with value: 0.2909369124469028.
