[I 2024-12-04 12:43:50,476] Trial 870 finished with value: 0.24965164873583814 and parameters: {'n_estimators': 1071, 'learning_rate': 0.0927759390729672, 'max_depth': 7, 'min_samples_split': 3, 'min_samples_leaf': 1, 'subsample': 0.7254233761217714, 'max_features': 'log2'}. Best is trial 621 with value: 0.2256726988932517.
[I 2024-12-04 12:43:52,225] Trial 864 finished with value: 0.4483671225977885 and parameters: {'n_estimators': 1421, 'learning_rate': 0.06814281241522151, 'max_depth': 9, 'min_samples_split': 18, 'min_samples_leaf': 8, 'subsample': 0.6468046586596554, 'max_features': 'sqrt'}. Best is trial 621 with value: 0.2256726988932517.
[I 2024-12-04 12:43:54,775] Trial 893 finished with value: 1.0788751483019299 and parameters: {'n_estimators': 177, 'learning_rate': 0.013776186586598752, 'max_depth': 7, 'min_samples_split': 6, 'min_samples_leaf': 1, 'subsample': 0.6940634607845356, 'max_features': 'log2'}. Best is trial 621 with value: 0.2256726988932517.
[I 2024-12-04 12:43:56,723] Trial 877 finished with value: 0.38877260050300033 and parameters: {'n_estimators': 945, 'learning_rate': 0.07676370078740104, 'max_depth': 11, 'min_samples_split': 5, 'min_samples_leaf': 4, 'subsample': 0.6634262833408656, 'max_features': 'log2'}. Best is trial 621 with value: 0.2256726988932517.
[I 2024-12-04 12:44:00,041] Trial 865 finished with value: 0.2829701463720912 and parameters: {'n_estimators': 1406, 'learning_rate': 0.0990686092695471, 'max_depth': 4, 'min_samples_split': 2, 'min_samples_leaf': 2, 'subsample': 0.778131402828926, 'max_features': 'sqrt'}. Best is trial 621 with value: 0.2256726988932517.
[I 2024-12-04 12:44:01,569] Trial 881 finished with value: 0.46516062735645813 and parameters: {'n_estimators': 761, 'learning_rate': 0.08869883916127608, 'max_depth': 4, 'min_samples_split': 10, 'min_samples_leaf': 9, 'subsample': 0.8536214349514614, 'max_features': None}. Best is trial 621 with value: 0.2256726988932517.
[I 2024-12-04 12:44:02,930] Trial 869 finished with value: 0.23708600633260743 and parameters: {'n_estimators': 1360, 'learning_rate': 0.09534795690485137, 'max_depth': 6, 'min_samples_split': 4, 'min_samples_leaf': 1, 'subsample': 0.850724553950759, 'max_features': 'sqrt'}. Best is trial 621 with value: 0.2256726988932517.
[I 2024-12-04 12:44:03,000] Trial 867 finished with value: 0.3727935528029092 and parameters: {'n_estimators': 1475, 'learning_rate': 0.08485694047672909, 'max_depth': 7, 'min_samples_split': 12, 'min_samples_leaf': 4, 'subsample': 0.6459073620627296, 'max_features': 'sqrt'}. Best is trial 621 with value: 0.2256726988932517.
[I 2024-12-04 12:44:09,986] Trial 871 finished with value: 0.289722359888296 and parameters: {'n_estimators': 1397, 'learning_rate': 0.053213865103178715, 'max_depth': 7, 'min_samples_split': 7, 'min_samples_leaf': 2, 'subsample': 0.6811454449343992, 'max_features': 'sqrt'}. Best is trial 621 with value: 0.2256726988932517.
[I 2024-12-04 12:44:10,450] Trial 872 finished with value: 0.24729203972669622 and parameters: {'n_estimators': 1331, 'learning_rate': 0.08415036525150756, 'max_depth': 6, 'min_samples_split': 2, 'min_samples_leaf': 1, 'subsample': 0.6932308704810661, 'max_features': 'sqrt'}. Best is trial 621 with value: 0.2256726988932517.
[I 2024-12-04 12:44:12,905] Trial 874 finished with value: 0.24388551257981356 and parameters: {'n_estimators': 1302, 'learning_rate': 0.05789537226097542, 'max_depth': 10, 'min_samples_split': 6, 'min_samples_leaf': 1, 'subsample': 0.7358646729971023, 'max_features': 'sqrt'}. Best is trial 621 with value: 0.2256726988932517.
[I 2024-12-04 12:44:13,935] Trial 883 finished with value: 0.262566593807973 and parameters: {'n_estimators': 960, 'learning_rate': 0.04411349550506225, 'max_depth': 10, 'min_samples_split': 5, 'min_samples_leaf': 1, 'subsample': 0.6906926647884668, 'max_features': 'sqrt'}. Best is trial 621 with value: 0.2256726988932517.
[I 2024-12-04 12:44:16,581] Trial 879 finished with value: 0.3527883974988994 and parameters: {'n_estimators': 1173, 'learning_rate': 0.07132856265308027, 'max_depth': 12, 'min_samples_split': 7, 'min_samples_leaf': 3, 'subsample': 0.8005734035456411, 'max_features': 'log2'}. Best is trial 621 with value: 0.2256726988932517.
[I 2024-12-04 12:44:18,145] Trial 880 finished with value: 0.29313912315821133 and parameters: {'n_estimators': 1159, 'learning_rate': 0.06341389923559064, 'max_depth': 12, 'min_samples_split': 5, 'min_samples_leaf': 2, 'subsample': 0.688218330356426, 'max_features': 'sqrt'}. Best is trial 621 with value: 0.2256726988932517.
[I 2024-12-04 12:44:23,640] Trial 902 finished with value: 0.4578721237865322 and parameters: {'n_estimators': 404, 'learning_rate': 0.06438409152240658, 'max_depth': 12, 'min_samples_split': 9, 'min_samples_leaf': 8, 'subsample': 0.7664281399243056, 'max_features': 'sqrt'}. Best is trial 621 with value: 0.2256726988932517.
[I 2024-12-04 12:44:25,586] Trial 884 finished with value: 0.2834044906467915 and parameters: {'n_estimators': 1056, 'learning_rate': 0.05411083496238543, 'max_depth': 12, 'min_samples_split': 8, 'min_samples_leaf': 1, 'subsample': 0.6876025126772107, 'max_features': 'sqrt'}. Best is trial 621 with value: 0.2256726988932517.
[I 2024-12-04 12:44:27,376] Trial 892 finished with value: 0.3964550260299711 and parameters: {'n_estimators': 843, 'learning_rate': 0.08517281017739216, 'max_depth': 4, 'min_samples_split': 2, 'min_samples_leaf': 3, 'subsample': 0.6704657211171245, 'max_features': 'log2'}. Best is trial 621 with value: 0.2256726988932517.
[I 2024-12-04 12:44:30,323] Trial 889 finished with value: 0.25298496665218 and parameters: {'n_estimators': 957, 'learning_rate': 0.09831277147814986, 'max_depth': 6, 'min_samples_split': 4, 'min_samples_leaf': 1, 'subsample': 0.9107050265358922, 'max_features': 'sqrt'}. Best is trial 621 with value: 0.2256726988932517.
[I 2024-12-04 12:44:30,416] Trial 886 finished with value: 0.24997376678222202 and parameters: {'n_estimators': 1067, 'learning_rate': 0.06257996914237265, 'max_depth': 11, 'min_samples_split': 2, 'min_samples_leaf': 1, 'subsample': 0.7764831135274869, 'max_features': 'sqrt'}. Best is trial 621 with value: 0.2256726988932517.
[I 2024-12-04 12:44:35,866] Trial 888 finished with value: 0.2600888117155975 and parameters: {'n_estimators': 1099, 'learning_rate': 0.0496266008840948, 'max_depth': 6, 'min_samples_split': 8, 'min_samples_leaf': 1, 'subsample': 0.8184702666603116, 'max_features': 'sqrt'}. Best is trial 621 with value: 0.2256726988932517.
[I 2024-12-04 12:44:37,773] Trial 894 finished with value: 0.36878856455456066 and parameters: {'n_estimators': 937, 'learning_rate': 0.08361732510052228, 'max_depth': 6, 'min_samples_split': 5, 'min_samples_leaf': 4, 'subsample': 0.8191804569420567, 'max_features': 'sqrt'}. Best is trial 621 with value: 0.2256726988932517.
[I 2024-12-04 12:44:45,389] Trial 887 finished with value: 0.2542574162785988 and parameters: {'n_estimators': 1313, 'learning_rate': 0.05247935746139593, 'max_depth': 10, 'min_samples_split': 3, 'min_samples_leaf': 1, 'subsample': 0.7854267296983641, 'max_features': 'sqrt'}. Best is trial 621 with value: 0.2256726988932517.
[I 2024-12-04 12:44:47,573] Trial 922 finished with value: 0.466358292660769 and parameters: {'n_estimators': 117, 'learning_rate': 0.08743722492087456, 'max_depth': 3, 'min_samples_split': 19, 'min_samples_leaf': 9, 'subsample': 0.7347091687194311, 'max_features': None}. Best is trial 621 with value: 0.2256726988932517.
[I 2024-12-04 12:44:50,554] Trial 885 finished with value: 0.30726462838688046 and parameters: {'n_estimators': 1471, 'learning_rate': 0.05801100535571355, 'max_depth': 8, 'min_samples_split': 10, 'min_samples_leaf': 2, 'subsample': 0.8071416553358728, 'max_features': 'sqrt'}. Best is trial 621 with value: 0.2256726988932517.
[I 2024-12-04 12:44:52,998] Trial 890 finished with value: 0.23494240183531 and parameters: {'n_estimators': 1295, 'learning_rate': 0.09809840673763438, 'max_depth': 5, 'min_samples_split': 2, 'min_samples_leaf': 1, 'subsample': 0.6794838962624192, 'max_features': 'sqrt'}. Best is trial 621 with value: 0.2256726988932517.
[I 2024-12-04 12:44:55,929] Trial 920 finished with value: 0.8573647468873848 and parameters: {'n_estimators': 305, 'learning_rate': 0.024461622567876186, 'max_depth': 8, 'min_samples_split': 18, 'min_samples_leaf': 10, 'subsample': 0.6737016071650632, 'max_features': 'sqrt'}. Best is trial 621 with value: 0.2256726988932517.
[I 2024-12-04 12:44:56,883] Trial 898 finished with value: 0.2479214197697294 and parameters: {'n_estimators': 1089, 'learning_rate': 0.09653501824695752, 'max_depth': 11, 'min_samples_split': 6, 'min_samples_leaf': 1, 'subsample': 0.6575113163609726, 'max_features': 'sqrt'}. Best is trial 621 with value: 0.2256726988932517.
[I 2024-12-04 12:45:01,613] Trial 891 finished with value: 0.24431103413771876 and parameters: {'n_estimators': 1451, 'learning_rate': 0.049619808202457386, 'max_depth': 9, 'min_samples_split': 3, 'min_samples_leaf': 1, 'subsample': 0.7982815390408187, 'max_features': 'sqrt'}. Best is trial 621 with value: 0.2256726988932517.
[I 2024-12-04 12:45:04,591] Trial 900 finished with value: 0.2922036151836959 and parameters: {'n_estimators': 1127, 'learning_rate': 0.04711114483500082, 'max_depth': 8, 'min_samples_split': 9, 'min_samples_leaf': 1, 'subsample': 0.8421609044376256, 'max_features': 'log2'}. Best is trial 621 with value: 0.2256726988932517.
[I 2024-12-04 12:45:05,967] Trial 896 finished with value: 0.2490338578557665 and parameters: {'n_estimators': 1287, 'learning_rate': 0.045167889034232085, 'max_depth': 12, 'min_samples_split': 4, 'min_samples_leaf': 1, 'subsample': 0.6240633525383789, 'max_features': 'log2'}. Best is trial 621 with value: 0.2256726988932517.
[I 2024-12-04 12:45:07,606] Trial 904 finished with value: 0.241749676406936 and parameters: {'n_estimators': 1034, 'learning_rate': 0.08205128594511532, 'max_depth': 8, 'min_samples_split': 9, 'min_samples_leaf': 1, 'subsample': 0.7907362336259585, 'max_features': 'sqrt'}. Best is trial 621 with value: 0.2256726988932517.
[I 2024-12-04 12:45:09,354] Trial 895 finished with value: 0.25610320280764515 and parameters: {'n_estimators': 1344, 'learning_rate': 0.04922571175188188, 'max_depth': 11, 'min_samples_split': 6, 'min_samples_leaf': 1, 'subsample': 0.6530385728372472, 'max_features': 'sqrt'}. Best is trial 621 with value: 0.2256726988932517.
[I 2024-12-04 12:45:13,302] Trial 924 finished with value: 0.40401273311526725 and parameters: {'n_estimators': 372, 'learning_rate': 0.016856427711462372, 'max_depth': 4, 'min_samples_split': 18, 'min_samples_leaf': 1, 'subsample': 0.9866468434543487, 'max_features': None}. Best is trial 621 with value: 0.2256726988932517.
[I 2024-12-04 12:45:15,796] Trial 897 finished with value: 0.3510644955508795 and parameters: {'n_estimators': 1420, 'learning_rate': 0.04592326214447072, 'max_depth': 8, 'min_samples_split': 2, 'min_samples_leaf': 3, 'subsample': 0.7088359240858194, 'max_features': 'sqrt'}. Best is trial 621 with value: 0.2256726988932517.
[I 2024-12-04 12:45:18,346] Trial 899 finished with value: 0.26774601903735173 and parameters: {'n_estimators': 1362, 'learning_rate': 0.09407706463404915, 'max_depth': 7, 'min_samples_split': 2, 'min_samples_leaf': 1, 'subsample': 0.6331484904762371, 'max_features': 'log2'}. Best is trial 621 with value: 0.2256726988932517.
[I 2024-12-04 12:45:18,457] Trial 903 finished with value: 0.2500324779522872 and parameters: {'n_estimators': 1254, 'learning_rate': 0.08660381283501878, 'max_depth': 6, 'min_samples_split': 6, 'min_samples_leaf': 1, 'subsample': 0.940472482909861, 'max_features': 'sqrt'}. Best is trial 621 with value: 0.2256726988932517.
[I 2024-12-04 12:45:23,804] Trial 919 finished with value: 0.6274696060795224 and parameters: {'n_estimators': 811, 'learning_rate': 0.014550509649461264, 'max_depth': 5, 'min_samples_split': 4, 'min_samples_leaf': 9, 'subsample': 0.9686310140186097, 'max_features': 'sqrt'}. Best is trial 621 with value: 0.2256726988932517.
[I 2024-12-04 12:45:25,157] Trial 901 finished with value: 0.24215813601648312 and parameters: {'n_estimators': 1382, 'learning_rate': 0.06531514595621699, 'max_depth': 9, 'min_samples_split': 4, 'min_samples_leaf': 1, 'subsample': 0.7086704835436178, 'max_features': 'sqrt'}. Best is trial 621 with value: 0.2256726988932517.
[I 2024-12-04 12:45:26,443] Trial 909 finished with value: 0.3669257310355065 and parameters: {'n_estimators': 1197, 'learning_rate': 0.09258861827223917, 'max_depth': 5, 'min_samples_split': 6, 'min_samples_leaf': 4, 'subsample': 0.6769887204006205, 'max_features': 'sqrt'}. Best is trial 621 with value: 0.2256726988932517.
[I 2024-12-04 12:45:28,164] Trial 908 finished with value: 0.2728769260030257 and parameters: {'n_estimators': 1174, 'learning_rate': 0.08204133325682944, 'max_depth': 7, 'min_samples_split': 5, 'min_samples_leaf': 1, 'subsample': 0.8467001372554249, 'max_features': 'sqrt'}. Best is trial 621 with value: 0.2256726988932517.
[I 2024-12-04 12:45:28,541] Trial 915 finished with value: 0.2443913927885556 and parameters: {'n_estimators': 994, 'learning_rate': 0.048080503888501325, 'max_depth': 8, 'min_samples_split': 5, 'min_samples_leaf': 1, 'subsample': 0.901029119860269, 'max_features': 'sqrt'}. Best is trial 621 with value: 0.2256726988932517.
[I 2024-12-04 12:45:31,619] Trial 905 finished with value: 0.2894834920348246 and parameters: {'n_estimators': 1347, 'learning_rate': 0.09175030149251452, 'max_depth': 3, 'min_samples_split': 4, 'min_samples_leaf': 1, 'subsample': 0.8349750605850293, 'max_features': 'log2'}. Best is trial 621 with value: 0.2256726988932517.
[I 2024-12-04 12:45:35,611] Trial 906 finished with value: 0.281330280250319 and parameters: {'n_estimators': 1437, 'learning_rate': 0.023918578844805877, 'max_depth': 5, 'min_samples_split': 3, 'min_samples_leaf': 1, 'subsample': 0.6076224684734047, 'max_features': 'sqrt'}. Best is trial 621 with value: 0.2256726988932517.
[I 2024-12-04 12:45:36,062] Trial 926 finished with value: 0.3256160301634338 and parameters: {'n_estimators': 636, 'learning_rate': 0.09720572107452922, 'max_depth': 9, 'min_samples_split': 2, 'min_samples_leaf': 2, 'subsample': 0.8635356253308878, 'max_features': 'sqrt'}. Best is trial 621 with value: 0.2256726988932517.
[I 2024-12-04 12:45:39,920] Trial 923 finished with value: 0.3601669370521069 and parameters: {'n_estimators': 919, 'learning_rate': 0.09697997063309235, 'max_depth': 8, 'min_samples_split': 3, 'min_samples_leaf': 3, 'subsample': 0.8383949500367178, 'max_features': 'sqrt'}. Best is trial 621 with value: 0.2256726988932517.
[I 2024-12-04 12:45:41,510] Trial 910 finished with value: 0.23048504102857542 and parameters: {'n_estimators': 1371, 'learning_rate': 0.07290614988536105, 'max_depth': 7, 'min_samples_split': 6, 'min_samples_leaf': 1, 'subsample': 0.81948858833612, 'max_features': 'sqrt'}. Best is trial 621 with value: 0.2256726988932517.
[I 2024-12-04 12:45:44,111] Trial 907 finished with value: 0.3503675446385973 and parameters: {'n_estimators': 1489, 'learning_rate': 0.050267899601933425, 'max_depth': 11, 'min_samples_split': 3, 'min_samples_leaf': 3, 'subsample': 0.6066895277265416, 'max_features': 'sqrt'}. Best is trial 621 with value: 0.2256726988932517.
[I 2024-12-04 12:45:44,127] Trial 914 finished with value: 0.23881735765231074 and parameters: {'n_estimators': 1235, 'learning_rate': 0.0766186152893824, 'max_depth': 6, 'min_samples_split': 5, 'min_samples_leaf': 1, 'subsample': 0.8721339518132191, 'max_features': 'sqrt'}. Best is trial 621 with value: 0.2256726988932517.
[I 2024-12-04 12:45:49,301] Trial 913 finished with value: 0.23403120690862977 and parameters: {'n_estimators': 1382, 'learning_rate': 0.09940444306150131, 'max_depth': 8, 'min_samples_split': 3, 'min_samples_leaf': 1, 'subsample': 0.7944105270568631, 'max_features': 'sqrt'}. Best is trial 621 with value: 0.2256726988932517.
[I 2024-12-04 12:45:49,785] Trial 912 finished with value: 0.25622346233327914 and parameters: {'n_estimators': 1445, 'learning_rate': 0.09164536771098813, 'max_depth': 3, 'min_samples_split': 5, 'min_samples_leaf': 1, 'subsample': 0.8628875812927526, 'max_features': 'sqrt'}. Best is trial 621 with value: 0.2256726988932517.
[I 2024-12-04 12:45:51,041] Trial 933 finished with value: 0.5758376125710729 and parameters: {'n_estimators': 584, 'learning_rate': 0.04118155765870973, 'max_depth': 5, 'min_samples_split': 11, 'min_samples_leaf': 4, 'subsample': 0.8414380723107046, 'max_features': 'log2'}. Best is trial 621 with value: 0.2256726988932517.
[I 2024-12-04 12:45:52,235] Trial 916 finished with value: 0.23815197075867545 and parameters: {'n_estimators': 1365, 'learning_rate': 0.07848159481027507, 'max_depth': 5, 'min_samples_split': 6, 'min_samples_leaf': 1, 'subsample': 0.8631167557324239, 'max_features': 'sqrt'}. Best is trial 621 with value: 0.2256726988932517.
[I 2024-12-04 12:45:55,844] Trial 929 finished with value: 0.3755177589274191 and parameters: {'n_estimators': 895, 'learning_rate': 0.07709809144493121, 'max_depth': 8, 'min_samples_split': 3, 'min_samples_leaf': 5, 'subsample': 0.6619243347356497, 'max_features': 'sqrt'}. Best is trial 621 with value: 0.2256726988932517.
[I 2024-12-04 12:46:00,287] Trial 921 finished with value: 0.2474890482254168 and parameters: {'n_estimators': 1330, 'learning_rate': 0.04849562449621026, 'max_depth': 10, 'min_samples_split': 2, 'min_samples_leaf': 1, 'subsample': 0.7255636982286382, 'max_features': 'sqrt'}. Best is trial 621 with value: 0.2256726988932517.
[I 2024-12-04 12:46:00,529] Trial 911 finished with value: 0.3224472972279842 and parameters: {'n_estimators': 1443, 'learning_rate': 0.04145737621998974, 'max_depth': 11, 'min_samples_split': 8, 'min_samples_leaf': 2, 'subsample': 0.6063790051249549, 'max_features': None}. Best is trial 621 with value: 0.2256726988932517.
[I 2024-12-04 12:46:02,374] Trial 925 finished with value: 0.25047208236504687 and parameters: {'n_estimators': 1139, 'learning_rate': 0.09880837065552885, 'max_depth': 6, 'min_samples_split': 2, 'min_samples_leaf': 1, 'subsample': 0.739192753065182, 'max_features': 'sqrt'}. Best is trial 621 with value: 0.2256726988932517.
[I 2024-12-04 12:46:02,379] Trial 917 finished with value: 0.2386716636921815 and parameters: {'n_estimators': 1496, 'learning_rate': 0.07351408306282015, 'max_depth': 7, 'min_samples_split': 2, 'min_samples_leaf': 1, 'subsample': 0.73353002494667, 'max_features': 'sqrt'}. Best is trial 621 with value: 0.2256726988932517.
[I 2024-12-04 12:46:03,154] Trial 918 finished with value: 0.2923804714294718 and parameters: {'n_estimators': 1481, 'learning_rate': 0.06654230742428999, 'max_depth': 7, 'min_samples_split': 2, 'min_samples_leaf': 2, 'subsample': 0.8651881010671724, 'max_features': 'sqrt'}. Best is trial 621 with value: 0.2256726988932517.
[I 2024-12-04 12:46:13,375] Trial 930 finished with value: 0.35754595939581596 and parameters: {'n_estimators': 1166, 'learning_rate': 0.08262943661730503, 'max_depth': 5, 'min_samples_split': 2, 'min_samples_leaf': 3, 'subsample': 0.66456525708366, 'max_features': 'sqrt'}. Best is trial 621 with value: 0.2256726988932517.
[I 2024-12-04 12:46:15,471] Trial 927 finished with value: 0.28741722251649304 and parameters: {'n_estimators': 1333, 'learning_rate': 0.09235685056485636, 'max_depth': 6, 'min_samples_split': 2, 'min_samples_leaf': 2, 'subsample': 0.8618954546553076, 'max_features': 'sqrt'}. Best is trial 621 with value: 0.2256726988932517.
[I 2024-12-04 12:46:17,032] Trial 936 finished with value: 0.29627007102825614 and parameters: {'n_estimators': 966, 'learning_rate': 0.09964058107854998, 'max_depth': 5, 'min_samples_split': 4, 'min_samples_leaf': 2, 'subsample': 0.7322157730605313, 'max_features': 'sqrt'}. Best is trial 621 with value: 0.2256726988932517.
[I 2024-12-04 12:46:18,355] Trial 934 finished with value: 0.7735252133145116 and parameters: {'n_estimators': 1108, 'learning_rate': 0.013645906944565722, 'max_depth': 5, 'min_samples_split': 20, 'min_samples_leaf': 6, 'subsample': 0.978937554232228, 'max_features': 'log2'}. Best is trial 621 with value: 0.2256726988932517.
[I 2024-12-04 12:46:19,446] Trial 937 finished with value: 0.24057786735393985 and parameters: {'n_estimators': 939, 'learning_rate': 0.07735730653772188, 'max_depth': 7, 'min_samples_split': 2, 'min_samples_leaf': 1, 'subsample': 0.6413480797714457, 'max_features': 'sqrt'}. Best is trial 621 with value: 0.2256726988932517.
[I 2024-12-04 12:46:20,284] Trial 960 finished with value: 0.539153917860997 and parameters: {'n_estimators': 136, 'learning_rate': 0.05841193259250261, 'max_depth': 6, 'min_samples_split': 19, 'min_samples_leaf': 10, 'subsample': 0.60213860935653, 'max_features': None}. Best is trial 621 with value: 0.2256726988932517.
[I 2024-12-04 12:46:28,475] Trial 928 finished with value: 0.29135626287551925 and parameters: {'n_estimators': 1489, 'learning_rate': 0.0793889622688648, 'max_depth': 5, 'min_samples_split': 2, 'min_samples_leaf': 2, 'subsample': 0.628140263405494, 'max_features': 'sqrt'}. Best is trial 621 with value: 0.2256726988932517.
[I 2024-12-04 12:46:32,048] Trial 935 finished with value: 0.2586758815792311 and parameters: {'n_estimators': 1284, 'learning_rate': 0.060930514869616884, 'max_depth': 5, 'min_samples_split': 6, 'min_samples_leaf': 1, 'subsample': 0.6890601481026599, 'max_features': 'sqrt'}. Best is trial 621 with value: 0.2256726988932517.
[I 2024-12-04 12:46:35,827] Trial 939 finished with value: 0.2815967242609883 and parameters: {'n_estimators': 1163, 'learning_rate': 0.0931330666870243, 'max_depth': 6, 'min_samples_split': 4, 'min_samples_leaf': 2, 'subsample': 0.8120635651708697, 'max_features': 'sqrt'}. Best is trial 621 with value: 0.2256726988932517.
