[I 2024-12-03 18:46:55,641] Trial 1369 finished with value: 0.4986512254079029 and parameters: {'kernel': 'rbf', 'C': 21.508503261667162, 'gamma': 0.013706983440195358, 'epsilon': 0.04959208449258659}. Best is trial 1119 with value: 0.4485361816812923.
[I 2024-12-03 18:46:55,658] Trial 1349 finished with value: 0.6277225701149817 and parameters: {'kernel': 'rbf', 'C': 6.66521222219967, 'gamma': 0.005121522464603298, 'epsilon': 0.5567378013318593}. Best is trial 1119 with value: 0.4485361816812923.
[I 2024-12-03 18:46:55,710] Trial 1364 finished with value: 12.108346468102368 and parameters: {'kernel': 'sigmoid', 'C': 18.59405850087225, 'gamma': 0.007276338590197242, 'epsilon': 0.10745120502749829}. Best is trial 1119 with value: 0.4485361816812923.
[I 2024-12-03 18:46:55,719] Trial 1361 finished with value: 0.5076298687160755 and parameters: {'kernel': 'rbf', 'C': 96.39848887844457, 'gamma': 0.0042875817627036315, 'epsilon': 0.07299403281212717}. Best is trial 1119 with value: 0.4485361816812923.
[I 2024-12-03 18:46:55,914] Trial 1366 finished with value: 0.6042957439887017 and parameters: {'kernel': 'rbf', 'C': 3.8342836779255376, 'gamma': 0.17927517442860175, 'epsilon': 0.03921021696634069}. Best is trial 1119 with value: 0.4485361816812923.
[I 2024-12-03 18:46:55,958] Trial 1356 finished with value: 11.44486089314858 and parameters: {'kernel': 'sigmoid', 'C': 77.7584749334302, 'gamma': 0.003881962410049747, 'epsilon': 0.0759149778788869}. Best is trial 1119 with value: 0.4485361816812923.
[I 2024-12-03 18:46:55,959] Trial 1354 finished with value: 0.5665390952008423 and parameters: {'kernel': 'rbf', 'C': 80.17196397507935, 'gamma': 0.0022877735917352718, 'epsilon': 0.4196808767417757}. Best is trial 1119 with value: 0.4485361816812923.
[I 2024-12-03 18:46:56,371] Trial 1350 finished with value: 0.625755066031458 and parameters: {'kernel': 'rbf', 'C': 98.93894166050221, 'gamma': 0.0836318836485479, 'epsilon': 0.045270808051949406}. Best is trial 1119 with value: 0.4485361816812923.
[I 2024-12-03 18:46:56,632] Trial 1326 finished with value: 0.5792309503369221 and parameters: {'kernel': 'linear', 'C': 91.83549077377825, 'gamma': 0.0417768891087974, 'epsilon': 0.13142368000455867}. Best is trial 1119 with value: 0.4485361816812923.
[I 2024-12-03 18:46:56,931] Trial 1373 finished with value: 1.365525509190699 and parameters: {'kernel': 'sigmoid', 'C': 0.003119121619981679, 'gamma': 0.0027836150772090795, 'epsilon': 0.18420585585637428}. Best is trial 1119 with value: 0.4485361816812923.
[I 2024-12-03 18:46:57,040] Trial 1353 finished with value: 0.4647891280860838 and parameters: {'kernel': 'rbf', 'C': 89.85443732287085, 'gamma': 0.01028561900622259, 'epsilon': 0.045133736489025994}. Best is trial 1119 with value: 0.4485361816812923.
[I 2024-12-03 18:46:57,326] Trial 1363 finished with value: 0.49336240424563704 and parameters: {'kernel': 'rbf', 'C': 16.333744833723774, 'gamma': 0.01809676927141147, 'epsilon': 0.10162918902111055}. Best is trial 1119 with value: 0.4485361816812923.
[I 2024-12-03 18:46:57,328] Trial 1368 finished with value: 1.3722766207950954 and parameters: {'kernel': 'sigmoid', 'C': 0.011025193331233274, 'gamma': 0.00017233539715618866, 'epsilon': 0.008300528825253495}. Best is trial 1119 with value: 0.4485361816812923.
[I 2024-12-03 18:46:57,545] Trial 1357 finished with value: 0.8845278557436447 and parameters: {'kernel': 'poly', 'C': 91.23736333729822, 'gamma': 0.009475495866312982, 'epsilon': 0.14653176064827161}. Best is trial 1119 with value: 0.4485361816812923.
[I 2024-12-03 18:46:58,215] Trial 1372 finished with value: 0.720387743758261 and parameters: {'kernel': 'rbf', 'C': 2.7600288006525124, 'gamma': 0.007889798509446929, 'epsilon': 0.0536229738028949}. Best is trial 1119 with value: 0.4485361816812923.
[I 2024-12-03 18:46:59,029] Trial 1376 finished with value: 0.5071142533754425 and parameters: {'kernel': 'rbf', 'C': 90.97456397271725, 'gamma': 0.02829899827333913, 'epsilon': 0.050044929821431}. Best is trial 1119 with value: 0.4485361816812923.
[I 2024-12-03 18:46:59,110] Trial 1374 finished with value: 0.488680112668973 and parameters: {'kernel': 'rbf', 'C': 98.90010599681845, 'gamma': 0.006533920415338205, 'epsilon': 0.09923282470896243}. Best is trial 1119 with value: 0.4485361816812923.
[I 2024-12-03 18:47:00,201] Trial 1375 finished with value: 0.5402016650933384 and parameters: {'kernel': 'rbf', 'C': 88.61701208069255, 'gamma': 0.002547413543527712, 'epsilon': 0.203373338418164}. Best is trial 1119 with value: 0.4485361816812923.
[I 2024-12-03 18:47:00,481] Trial 1365 finished with value: 0.46766394463054006 and parameters: {'kernel': 'rbf', 'C': 18.250945025941785, 'gamma': 0.023209638234458676, 'epsilon': 0.045489515981378646}. Best is trial 1119 with value: 0.4485361816812923.
[I 2024-12-03 18:47:00,700] Trial 1377 finished with value: 0.7700110465668625 and parameters: {'kernel': 'poly', 'C': 54.086972329403515, 'gamma': 0.06715304949791984, 'epsilon': 0.08306216940682148}. Best is trial 1119 with value: 0.4485361816812923.
[I 2024-12-03 18:47:01,074] Trial 1367 finished with value: 0.5203927792638962 and parameters: {'kernel': 'rbf', 'C': 18.144898343444204, 'gamma': 0.013809779176127886, 'epsilon': 0.22013744643588365}. Best is trial 1119 with value: 0.4485361816812923.
[I 2024-12-03 18:47:01,540] Trial 1371 finished with value: 0.5405480135651813 and parameters: {'kernel': 'rbf', 'C': 21.20968220159667, 'gamma': 0.05780770535248802, 'epsilon': 0.1951836213331275}. Best is trial 1119 with value: 0.4485361816812923.
[I 2024-12-03 18:47:01,651] Trial 1379 finished with value: 0.7987326969915551 and parameters: {'kernel': 'poly', 'C': 0.00517480765879378, 'gamma': 0.3703988659638062, 'epsilon': 0.01460265850883783}. Best is trial 1119 with value: 0.4485361816812923.
[I 2024-12-03 18:47:02,078] Trial 1370 finished with value: 0.4570970270723476 and parameters: {'kernel': 'rbf', 'C': 93.4823967047124, 'gamma': 0.015490192935367738, 'epsilon': 0.03516415170972705}. Best is trial 1119 with value: 0.4485361816812923.
[I 2024-12-03 18:47:03,464] Trial 1389 finished with value: 281.2857905401609 and parameters: {'kernel': 'sigmoid', 'C': 18.89943230441427, 'gamma': 0.3156982379280282, 'epsilon': 0.986881973722811}. Best is trial 1119 with value: 0.4485361816812923.
[I 2024-12-03 18:47:03,493] Trial 1384 finished with value: 0.6088223596062815 and parameters: {'kernel': 'rbf', 'C': 98.21815347964147, 'gamma': 0.09949646942590812, 'epsilon': 0.07721777816162982}. Best is trial 1119 with value: 0.4485361816812923.
[I 2024-12-03 18:47:03,702] Trial 1391 finished with value: 1.1130080734663068 and parameters: {'kernel': 'poly', 'C': 19.09410207643183, 'gamma': 0.003198267615580879, 'epsilon': 0.03682554697654239}. Best is trial 1119 with value: 0.4485361816812923.
[I 2024-12-03 18:47:03,704] Trial 1382 finished with value: 0.7848362339369049 and parameters: {'kernel': 'poly', 'C': 96.27877372095507, 'gamma': 0.014933067661209328, 'epsilon': 0.06783005371876265}. Best is trial 1119 with value: 0.4485361816812923.
[I 2024-12-03 18:47:06,032] Trial 1378 finished with value: 0.46894661192404613 and parameters: {'kernel': 'rbf', 'C': 98.61868027072383, 'gamma': 0.016281295696200675, 'epsilon': 0.10664521053364587}. Best is trial 1119 with value: 0.4485361816812923.
[I 2024-12-03 18:47:06,037] Trial 1388 finished with value: 0.9122534708289943 and parameters: {'kernel': 'sigmoid', 'C': 1.063799390129169, 'gamma': 0.00137887539086871, 'epsilon': 0.008844084225966522}. Best is trial 1119 with value: 0.4485361816812923.
[I 2024-12-03 18:47:06,626] Trial 1386 finished with value: 0.7664980351991416 and parameters: {'kernel': 'rbf', 'C': 22.836617468962785, 'gamma': 0.00047755548618293186, 'epsilon': 0.04463875580004352}. Best is trial 1119 with value: 0.4485361816812923.
[I 2024-12-03 18:47:06,627] Trial 1394 finished with value: 1.1024800185568266 and parameters: {'kernel': 'poly', 'C': 80.20609502952233, 'gamma': 0.0014355561172073614, 'epsilon': 0.1481635181585381}. Best is trial 1119 with value: 0.4485361816812923.
[I 2024-12-03 18:47:06,837] Trial 1392 finished with value: 0.45666565806731035 and parameters: {'kernel': 'rbf', 'C': 93.6525422588384, 'gamma': 0.017238387423034515, 'epsilon': 0.041860331800556067}. Best is trial 1119 with value: 0.4485361816812923.
[I 2024-12-03 18:47:07,566] Trial 1381 finished with value: 0.48674198689103254 and parameters: {'kernel': 'rbf', 'C': 99.46119654044487, 'gamma': 0.009646451676814622, 'epsilon': 0.20091542357826045}. Best is trial 1119 with value: 0.4485361816812923.
[I 2024-12-03 18:47:08,152] Trial 1387 finished with value: 1.0978547692426996 and parameters: {'kernel': 'poly', 'C': 90.02785488856863, 'gamma': 0.0027183113909227128, 'epsilon': 0.0028646543321528997}. Best is trial 1119 with value: 0.4485361816812923.
[I 2024-12-03 18:47:08,675] Trial 1380 finished with value: 0.6040673562827299 and parameters: {'kernel': 'rbf', 'C': 75.2136655181042, 'gamma': 0.05047801967321119, 'epsilon': 0.007481151449258122}. Best is trial 1119 with value: 0.4485361816812923.
[I 2024-12-03 18:47:10,242] Trial 1390 finished with value: 0.5479351021697317 and parameters: {'kernel': 'rbf', 'C': 19.450086608973933, 'gamma': 0.0071625199615603955, 'epsilon': 0.0644649184613845}. Best is trial 1119 with value: 0.4485361816812923.
[I 2024-12-03 18:47:11,030] Trial 1399 finished with value: 0.47391243733950617 and parameters: {'kernel': 'rbf', 'C': 21.73985657088935, 'gamma': 0.020015929072803144, 'epsilon': 0.08473919598564851}. Best is trial 1119 with value: 0.4485361816812923.
[I 2024-12-03 18:47:11,619] Trial 1393 finished with value: 0.5202932623912332 and parameters: {'kernel': 'rbf', 'C': 27.7319956065825, 'gamma': 0.009267683685447867, 'epsilon': 0.10037874748318835}. Best is trial 1119 with value: 0.4485361816812923.
[I 2024-12-03 18:47:12,541] Trial 1404 finished with value: 0.7049212335682138 and parameters: {'kernel': 'sigmoid', 'C': 44.813024144425945, 'gamma': 0.0013053173675563968, 'epsilon': 0.00684080087686711}. Best is trial 1119 with value: 0.4485361816812923.
[I 2024-12-03 18:47:12,793] Trial 1398 finished with value: 0.5186568287554009 and parameters: {'kernel': 'rbf', 'C': 20.77068434443639, 'gamma': 0.011103138215026462, 'epsilon': 0.05633662348820702}. Best is trial 1119 with value: 0.4485361816812923.
[I 2024-12-03 18:47:13,114] Trial 1395 finished with value: 0.4489099317187804 and parameters: {'kernel': 'rbf', 'C': 92.28377217797299, 'gamma': 0.012359558615364731, 'epsilon': 0.07848992801353005}. Best is trial 1119 with value: 0.4485361816812923.
[I 2024-12-03 18:47:13,252] Trial 1397 finished with value: 0.5981916301856166 and parameters: {'kernel': 'rbf', 'C': 13.740061619378775, 'gamma': 0.004409670668711319, 'epsilon': 0.030930026089501277}. Best is trial 1119 with value: 0.4485361816812923.
[I 2024-12-03 18:47:13,380] Trial 1385 finished with value: 0.5719123907646597 and parameters: {'kernel': 'rbf', 'C': 97.48830716144383, 'gamma': 0.03596544295667622, 'epsilon': 0.3995551423980744}. Best is trial 1119 with value: 0.4485361816812923.
[I 2024-12-03 18:47:14,003] Trial 1402 finished with value: 0.6045390424689652 and parameters: {'kernel': 'rbf', 'C': 22.56425986237309, 'gamma': 0.0026786025005044287, 'epsilon': 0.08556193114886397}. Best is trial 1119 with value: 0.4485361816812923.
[I 2024-12-03 18:47:14,427] Trial 1400 finished with value: 487.65911557884107 and parameters: {'kernel': 'sigmoid', 'C': 98.53089909155604, 'gamma': 0.027848925607107285, 'epsilon': 0.037956959147995954}. Best is trial 1119 with value: 0.4485361816812923.
[I 2024-12-03 18:47:15,231] Trial 1396 finished with value: 0.5867219410111308 and parameters: {'kernel': 'rbf', 'C': 92.14965684081189, 'gamma': 0.0013334148664696616, 'epsilon': 0.022879666782559472}. Best is trial 1119 with value: 0.4485361816812923.
[I 2024-12-03 18:47:15,438] Trial 1408 finished with value: 0.5556373871593263 and parameters: {'kernel': 'rbf', 'C': 21.5601440610496, 'gamma': 0.0061983156556818615, 'epsilon': 0.20822020247979267}. Best is trial 1119 with value: 0.4485361816812923.
[I 2024-12-03 18:47:15,967] Trial 1401 finished with value: 0.46971854670907476 and parameters: {'kernel': 'rbf', 'C': 23.093816139987535, 'gamma': 0.033296494151268036, 'epsilon': 0.01804290408044898}. Best is trial 1119 with value: 0.4485361816812923.
[I 2024-12-03 18:47:16,260] Trial 1406 finished with value: 0.4495601326355285 and parameters: {'kernel': 'rbf', 'C': 99.56948403832646, 'gamma': 0.015207733123122708, 'epsilon': 0.06658214601643868}. Best is trial 1119 with value: 0.4485361816812923.
[I 2024-12-03 18:47:16,266] Trial 1383 finished with value: 0.5936510436508096 and parameters: {'kernel': 'rbf', 'C': 26.5612573835095, 'gamma': 0.0025269568289303748, 'epsilon': 0.09028185851303785}. Best is trial 1119 with value: 0.4485361816812923.
[I 2024-12-03 18:47:16,616] Trial 1405 finished with value: 0.497163332751169 and parameters: {'kernel': 'rbf', 'C': 97.32757059994479, 'gamma': 0.005737251644428322, 'epsilon': 0.10292948842073303}. Best is trial 1119 with value: 0.4485361816812923.
[I 2024-12-03 18:47:16,663] Trial 1412 finished with value: 0.5629321991099564 and parameters: {'kernel': 'linear', 'C': 2.5182129065350445, 'gamma': 0.010327535857996766, 'epsilon': 0.08826002657209314}. Best is trial 1119 with value: 0.4485361816812923.
[I 2024-12-03 18:47:17,333] Trial 1403 finished with value: 0.4638754234259853 and parameters: {'kernel': 'rbf', 'C': 23.15128869357969, 'gamma': 0.02831331946193633, 'epsilon': 0.028404739559707463}. Best is trial 1119 with value: 0.4485361816812923.
[I 2024-12-03 18:47:17,559] Trial 1410 finished with value: 0.7755115393349994 and parameters: {'kernel': 'rbf', 'C': 3.0967370881581444, 'gamma': 0.0021596931363894465, 'epsilon': 0.10769727733877849}. Best is trial 1119 with value: 0.4485361816812923.
[I 2024-12-03 18:47:17,607] Trial 1407 finished with value: 1.3691675717355127 and parameters: {'kernel': 'sigmoid', 'C': 0.025619706823724442, 'gamma': 0.00022737292671811432, 'epsilon': 0.0011321399620217746}. Best is trial 1119 with value: 0.4485361816812923.
[I 2024-12-03 18:47:17,681] Trial 1414 finished with value: 0.5136402782568062 and parameters: {'kernel': 'rbf', 'C': 98.85189825401055, 'gamma': 0.004138097271384596, 'epsilon': 0.040285084623325036}. Best is trial 1119 with value: 0.4485361816812923.
[I 2024-12-03 18:47:18,000] Trial 1420 finished with value: 0.5592758335345368 and parameters: {'kernel': 'rbf', 'C': 86.98847557159502, 'gamma': 0.03612745658725237, 'epsilon': 0.08607791661579761}. Best is trial 1119 with value: 0.4485361816812923.
[I 2024-12-03 18:47:18,234] Trial 1409 finished with value: 0.4792204875033451 and parameters: {'kernel': 'rbf', 'C': 20.756029641845842, 'gamma': 0.03698125325045011, 'epsilon': 0.05922725333620008}. Best is trial 1119 with value: 0.4485361816812923.
[I 2024-12-03 18:47:19,592] Trial 1411 finished with value: 0.5341742824779359 and parameters: {'kernel': 'rbf', 'C': 98.01103213511213, 'gamma': 0.0035742841392270427, 'epsilon': 0.014433086058518904}. Best is trial 1119 with value: 0.4485361816812923.
[I 2024-12-03 18:47:19,830] Trial 1417 finished with value: 0.5542375013260991 and parameters: {'kernel': 'rbf', 'C': 96.42536430227496, 'gamma': 0.03323950189912108, 'epsilon': 0.0642953696552777}. Best is trial 1119 with value: 0.4485361816812923.
[I 2024-12-03 18:47:20,695] Trial 1415 finished with value: 0.6060783510912272 and parameters: {'kernel': 'linear', 'C': 64.5363014397115, 'gamma': 0.013327540492857599, 'epsilon': 0.21681078321846856}. Best is trial 1119 with value: 0.4485361816812923.
[I 2024-12-03 18:47:21,567] Trial 1424 finished with value: 0.47985366931898166 and parameters: {'kernel': 'rbf', 'C': 24.651806169418975, 'gamma': 0.016209153999715772, 'epsilon': 0.07237005450559487}. Best is trial 1119 with value: 0.4485361816812923.
[I 2024-12-03 18:47:22,007] Trial 1413 finished with value: 0.5397390141711976 and parameters: {'kernel': 'rbf', 'C': 26.74686441907815, 'gamma': 0.053979069012019126, 'epsilon': 0.09567196738360134}. Best is trial 1119 with value: 0.4485361816812923.
[I 2024-12-03 18:47:22,435] Trial 1419 finished with value: 0.5354630270719533 and parameters: {'kernel': 'rbf', 'C': 25.344371346526227, 'gamma': 0.007811787005618494, 'epsilon': 0.12526563070459085}. Best is trial 1119 with value: 0.4485361816812923.
[I 2024-12-03 18:47:22,857] Trial 1418 finished with value: 0.5254366708944809 and parameters: {'kernel': 'rbf', 'C': 20.214510534179546, 'gamma': 0.01025246933286509, 'epsilon': 0.08661135048259998}. Best is trial 1119 with value: 0.4485361816812923.
[I 2024-12-03 18:47:23,319] Trial 1416 finished with value: 0.47098285192494627 and parameters: {'kernel': 'rbf', 'C': 95.0380829938396, 'gamma': 0.008724108761015644, 'epsilon': 0.049167768796845174}. Best is trial 1119 with value: 0.4485361816812923.
[I 2024-12-03 18:47:24,152] Trial 1422 finished with value: 0.4788170741821164 and parameters: {'kernel': 'rbf', 'C': 21.520626673854128, 'gamma': 0.020559183980145713, 'epsilon': 0.19023976521450178}. Best is trial 1119 with value: 0.4485361816812923.
[I 2024-12-03 18:47:24,370] Trial 1433 finished with value: 0.579964408467153 and parameters: {'kernel': 'rbf', 'C': 23.19349318729867, 'gamma': 0.0036396001332224762, 'epsilon': 0.05987994154755213}. Best is trial 1119 with value: 0.4485361816812923.
[I 2024-12-03 18:47:24,638] Trial 1434 finished with value: 0.48966556641579545 and parameters: {'kernel': 'rbf', 'C': 97.29895961813335, 'gamma': 0.006494498832093226, 'epsilon': 0.1017645361653591}. Best is trial 1119 with value: 0.4485361816812923.
[I 2024-12-03 18:47:24,823] Trial 1427 finished with value: 0.5218070419967108 and parameters: {'kernel': 'rbf', 'C': 25.055102197848026, 'gamma': 0.03478801868646092, 'epsilon': 0.3050869207646901}. Best is trial 1119 with value: 0.4485361816812923.
[I 2024-12-03 18:47:25,266] Trial 1425 finished with value: 0.4505567726280084 and parameters: {'kernel': 'rbf', 'C': 93.67580587190889, 'gamma': 0.015238398631925235, 'epsilon': 0.07341013942584768}. Best is trial 1119 with value: 0.4485361816812923.
[I 2024-12-03 18:47:25,427] Trial 1426 finished with value: 0.4708601217805198 and parameters: {'kernel': 'rbf', 'C': 94.32186858915227, 'gamma': 0.009609973919727883, 'epsilon': 0.0132997789723259}. Best is trial 1119 with value: 0.4485361816812923.
[I 2024-12-03 18:47:25,584] Trial 1421 finished with value: 0.4595412470468927 and parameters: {'kernel': 'rbf', 'C': 96.14876441506064, 'gamma': 0.009716168792287105, 'epsilon': 0.07967492075682145}. Best is trial 1119 with value: 0.4485361816812923.
[I 2024-12-03 18:47:25,795] Trial 1435 finished with value: 0.6340661867528185 and parameters: {'kernel': 'rbf', 'C': 98.010083140649, 'gamma': 0.04791590179410482, 'epsilon': 0.17071212595377072}. Best is trial 1119 with value: 0.4485361816812923.
[I 2024-12-03 18:47:26,060] Trial 1437 finished with value: 0.5470422459249213 and parameters: {'kernel': 'rbf', 'C': 3.8364682303288276, 'gamma': 0.036227317725249245, 'epsilon': 0.07244273473504387}. Best is trial 1119 with value: 0.4485361816812923.
[I 2024-12-03 18:47:26,353] Trial 1423 finished with value: 0.566009299760716 and parameters: {'kernel': 'rbf', 'C': 90.7774787752379, 'gamma': 0.004490814185951345, 'epsilon': 0.28407439592620554}. Best is trial 1119 with value: 0.4485361816812923.
[I 2024-12-03 18:47:26,949] Trial 1429 finished with value: 1.336976029254733 and parameters: {'kernel': 'poly', 'C': 0.011659655720628123, 'gamma': 0.007185290038927274, 'epsilon': 0.16741337361022343}. Best is trial 1119 with value: 0.4485361816812923.
[I 2024-12-03 18:47:27,045] Trial 1439 finished with value: 0.4845744341130995 and parameters: {'kernel': 'rbf', 'C': 83.49851909906052, 'gamma': 0.02482828982262008, 'epsilon': 0.06999812425298443}. Best is trial 1119 with value: 0.4485361816812923.
[I 2024-12-03 18:47:27,234] Trial 1428 finished with value: 0.5415674637586289 and parameters: {'kernel': 'rbf', 'C': 96.40292144960448, 'gamma': 0.0034529548901891475, 'epsilon': 0.12769869521723087}. Best is trial 1119 with value: 0.4485361816812923.
[I 2024-12-03 18:47:27,575] Trial 1442 finished with value: 0.6498219682005535 and parameters: {'kernel': 'rbf', 'C': 78.52877880206069, 'gamma': 0.059978147821287915, 'epsilon': 0.07587690314944441}. Best is trial 1119 with value: 0.4485361816812923.
[I 2024-12-03 18:47:27,860] Trial 1431 finished with value: 0.6064434858251861 and parameters: {'kernel': 'linear', 'C': 0.35170258005964683, 'gamma': 0.005311394063166337, 'epsilon': 0.010060557959772624}. Best is trial 1119 with value: 0.4485361816812923.
[I 2024-12-03 18:47:28,905] Trial 1440 finished with value: 0.4917893634348748 and parameters: {'kernel': 'rbf', 'C': 19.33719117938896, 'gamma': 0.038716016877374075, 'epsilon': 0.1321207584257656}. Best is trial 1119 with value: 0.4485361816812923.
[I 2024-12-03 18:47:28,906] Trial 1446 finished with value: 0.6722269198077946 and parameters: {'kernel': 'rbf', 'C': 13.806419268764952, 'gamma': 0.34821055058562655, 'epsilon': 0.17410216959964483}. Best is trial 1119 with value: 0.4485361816812923.
[I 2024-12-03 18:47:29,112] Trial 1430 finished with value: 0.4755741141399707 and parameters: {'kernel': 'rbf', 'C': 28.740500896380674, 'gamma': 0.015859808984687942, 'epsilon': 0.17063431311164295}. Best is trial 1119 with value: 0.4485361816812923.
[I 2024-12-03 18:47:29,518] Trial 1436 finished with value: 0.5693801691002763 and parameters: {'kernel': 'linear', 'C': 81.36334589079453, 'gamma': 0.07136589177975249, 'epsilon': 0.057858226334100545}. Best is trial 1119 with value: 0.4485361816812923.
