[I 2024-12-04 20:44:04,805] Trial 1451 finished with value: 0.14249520054362086 and parameters: {'kernel_type': 'Matern', 'length_scale': 1.0417302200221323, 'noise_level': 0.8072090003222014, 'constant_value': 5.664029618832462, 'nu': 1.5}. Best is trial 959 with value: 0.1375110730946576.
[I 2024-12-04 20:44:12,656] Trial 1454 finished with value: 0.14249506571218007 and parameters: {'kernel_type': 'Matern', 'length_scale': 0.22659775453587166, 'noise_level': 0.04915342369848881, 'constant_value': 0.1348917493620834, 'nu': 1.5}. Best is trial 959 with value: 0.1375110730946576.
[I 2024-12-04 20:44:13,178] Trial 1450 finished with value: 0.14249502252050905 and parameters: {'kernel_type': 'Matern', 'length_scale': 710.0930479978199, 'noise_level': 0.370728149183163, 'constant_value': 0.012847257079762208, 'nu': 1.5}. Best is trial 959 with value: 0.1375110730946576.
[I 2024-12-04 20:44:13,628] Trial 1453 finished with value: 0.14249496825865737 and parameters: {'kernel_type': 'Matern', 'length_scale': 42.71432441177623, 'noise_level': 0.7974105931174112, 'constant_value': 0.5396319925655099, 'nu': 1.5}. Best is trial 959 with value: 0.1375110730946576.
[I 2024-12-04 20:44:17,043] Trial 1456 finished with value: 0.9864686819336617 and parameters: {'kernel_type': 'RBF', 'length_scale': 1.2351182796679456e-05, 'noise_level': 0.00015575926061889997, 'constant_value': 1.3907201141430403, 'nu': 0.5}. Best is trial 959 with value: 0.1375110730946576.
[I 2024-12-04 20:44:20,618] Trial 1455 finished with value: 0.14469904292928087 and parameters: {'kernel_type': 'Matern', 'length_scale': 8.81413774826224, 'noise_level': 0.889493317837274, 'constant_value': 0.0965251797201922, 'nu': 2.5}. Best is trial 959 with value: 0.1375110730946576.
[I 2024-12-04 20:44:20,713] Trial 1457 finished with value: 0.14249506433207404 and parameters: {'kernel_type': 'Matern', 'length_scale': 11.930241942164646, 'noise_level': 0.800184167524305, 'constant_value': 4.255330456150463, 'nu': 1.5}. Best is trial 959 with value: 0.1375110730946576.
[I 2024-12-04 20:44:26,181] Trial 1458 finished with value: 0.1477103359960391 and parameters: {'kernel_type': 'RBF', 'length_scale': 2.3797808966970737, 'noise_level': 0.30864966417162776, 'constant_value': 2.8420387129769824, 'nu': 1.5}. Best is trial 959 with value: 0.1375110730946576.
[I 2024-12-04 20:44:27,939] Trial 1460 finished with value: 0.9864686819161943 and parameters: {'kernel_type': 'Matern', 'length_scale': 0.06407843190019671, 'noise_level': 0.7919158878137135, 'constant_value': 12.493842071528066, 'nu': 1.5}. Best is trial 959 with value: 0.1375110730946576.
[I 2024-12-04 20:44:29,227] Trial 1459 finished with value: 0.9864686821805425 and parameters: {'kernel_type': 'Matern', 'length_scale': 0.0394344397900058, 'noise_level': 4.779618664364972e-10, 'constant_value': 9.829053319316797e-05, 'nu': 1.5}. Best is trial 959 with value: 0.1375110730946576.
[I 2024-12-04 20:44:34,182] Trial 1461 finished with value: 0.9864686818445154 and parameters: {'kernel_type': 'Matern', 'length_scale': 0.044688116257626184, 'noise_level': 0.803734178057908, 'constant_value': 1142.9031087061096, 'nu': 1.5}. Best is trial 959 with value: 0.1375110730946576.
[I 2024-12-04 20:44:35,431] Trial 1462 finished with value: 0.9864686818743669 and parameters: {'kernel_type': 'Matern', 'length_scale': 0.029469234035271883, 'noise_level': 0.015205768347633836, 'constant_value': 2.3496760708776443, 'nu': 1.5}. Best is trial 959 with value: 0.1375110730946576.
[I 2024-12-04 20:44:40,504] Trial 1463 finished with value: 0.14249506030263506 and parameters: {'kernel_type': 'Matern', 'length_scale': 0.96082757763371, 'noise_level': 0.8771204876938611, 'constant_value': 134.97660711212956, 'nu': 1.5}. Best is trial 959 with value: 0.1375110730946576.
[I 2024-12-04 20:44:43,041] Trial 1464 finished with value: 0.1424950119322577 and parameters: {'kernel_type': 'Matern', 'length_scale': 25.35097550866434, 'noise_level': 0.9893192576585237, 'constant_value': 31.835659338951043, 'nu': 1.5}. Best is trial 959 with value: 0.1375110730946576.
[I 2024-12-04 20:44:43,140] Trial 1465 finished with value: 0.14249507163889902 and parameters: {'kernel_type': 'Matern', 'length_scale': 106.60100875158216, 'noise_level': 0.7643188545643053, 'constant_value': 3.104423293753257, 'nu': 1.5}. Best is trial 959 with value: 0.1375110730946576.
[I 2024-12-04 20:44:52,638] Trial 1467 finished with value: 0.14249550028882418 and parameters: {'kernel_type': 'Matern', 'length_scale': 0.64500668880264, 'noise_level': 0.06033327793079123, 'constant_value': 2.809432478773014, 'nu': 1.5}. Best is trial 959 with value: 0.1375110730946576.
[I 2024-12-04 20:44:52,739] Trial 1468 finished with value: 0.1424949476337156 and parameters: {'kernel_type': 'Matern', 'length_scale': 0.6836716472817981, 'noise_level': 0.03247732688035651, 'constant_value': 5267.794443771106, 'nu': 1.5}. Best is trial 959 with value: 0.1375110730946576.
[I 2024-12-04 20:44:53,550] Trial 1466 finished with value: 0.14249507771384343 and parameters: {'kernel_type': 'Matern', 'length_scale': 29.858438103944994, 'noise_level': 0.6069905273639709, 'constant_value': 0.0022931022091729094, 'nu': 1.5}. Best is trial 959 with value: 0.1375110730946576.
[I 2024-12-04 20:44:58,612] Trial 1469 finished with value: 0.1424948491964234 and parameters: {'kernel_type': 'Matern', 'length_scale': 48.07033569244071, 'noise_level': 0.6689452963652873, 'constant_value': 1077.3319105867686, 'nu': 1.5}. Best is trial 959 with value: 0.1375110730946576.
[I 2024-12-04 20:44:59,728] Trial 1470 finished with value: 0.19720010075164723 and parameters: {'kernel_type': 'Matern', 'length_scale': 2.0905382770370187, 'noise_level': 0.0325671597379698, 'constant_value': 50.25212081155294, 'nu': 0.5}. Best is trial 959 with value: 0.1375110730946576.
[I 2024-12-04 20:45:01,633] Trial 1471 finished with value: 0.14249506406953302 and parameters: {'kernel_type': 'Matern', 'length_scale': 1.9271549901857215, 'noise_level': 0.8818303779418143, 'constant_value': 10.023531873061353, 'nu': 1.5}. Best is trial 959 with value: 0.1375110730946576.
[I 2024-12-04 20:45:07,008] Trial 1472 finished with value: 0.14249508119742826 and parameters: {'kernel_type': 'Matern', 'length_scale': 98.72464836665408, 'noise_level': 0.8930791552062998, 'constant_value': 0.6768820899256437, 'nu': 1.5}. Best is trial 959 with value: 0.1375110730946576.
[I 2024-12-04 20:45:08,929] Trial 1474 finished with value: 0.14249504501571664 and parameters: {'kernel_type': 'Matern', 'length_scale': 0.34845091999389366, 'noise_level': 0.03598320177983243, 'constant_value': 81131.42433612807, 'nu': 1.5}. Best is trial 959 with value: 0.1375110730946576.
[I 2024-12-04 20:45:09,995] Trial 1473 finished with value: 0.9864686818909694 and parameters: {'kernel_type': 'RBF', 'length_scale': 2120.1204132828475, 'noise_level': 1.7830344536548265e-05, 'constant_value': 0.0005458339192474055, 'nu': 2.5}. Best is trial 959 with value: 0.1375110730946576.
[I 2024-12-04 20:45:12,825] Trial 1475 finished with value: 0.9864686819238506 and parameters: {'kernel_type': 'Matern', 'length_scale': 0.006157873337456031, 'noise_level': 0.01360966932677671, 'constant_value': 420.3622843362382, 'nu': 1.5}. Best is trial 959 with value: 0.1375110730946576.
[I 2024-12-04 20:45:19,018] Trial 1477 finished with value: 0.986468681934816 and parameters: {'kernel_type': 'Matern', 'length_scale': 0.013230607233177635, 'noise_level': 0.005861454498732714, 'constant_value': 0.5499088512694676, 'nu': 1.5}. Best is trial 959 with value: 0.1375110730946576.
[I 2024-12-04 20:45:21,407] Trial 1476 finished with value: 0.14249466749087628 and parameters: {'kernel_type': 'Matern', 'length_scale': 2.6321818293024624, 'noise_level': 0.4720309010282279, 'constant_value': 1741.8640431445028, 'nu': 1.5}. Best is trial 959 with value: 0.1375110730946576.
[I 2024-12-04 20:45:24,502] Trial 1479 finished with value: 0.14249506796150593 and parameters: {'kernel_type': 'Matern', 'length_scale': 103.66399792735695, 'noise_level': 0.019380018154308214, 'constant_value': 98329.42012543148, 'nu': 1.5}. Best is trial 959 with value: 0.1375110730946576.
[I 2024-12-04 20:45:24,504] Trial 1478 finished with value: 0.14469900070724462 and parameters: {'kernel_type': 'Matern', 'length_scale': 0.9000649041679151, 'noise_level': 0.7386707358317998, 'constant_value': 28.88866924196403, 'nu': 2.5}. Best is trial 959 with value: 0.1375110730946576.
[I 2024-12-04 20:45:28,464] Trial 1480 finished with value: 0.19720003398889768 and parameters: {'kernel_type': 'Matern', 'length_scale': 0.5144431856668138, 'noise_level': 0.9325752095443129, 'constant_value': 1.2313431841381792, 'nu': 0.5}. Best is trial 959 with value: 0.1375110730946576.
[I 2024-12-04 20:45:32,003] Trial 1481 finished with value: 0.14249506308536286 and parameters: {'kernel_type': 'Matern', 'length_scale': 1.2304769496192745, 'noise_level': 0.8028910688672626, 'constant_value': 2182.705546026701, 'nu': 1.5}. Best is trial 959 with value: 0.1375110730946576.
[I 2024-12-04 20:45:32,621] Trial 1482 finished with value: 0.14249506128848674 and parameters: {'kernel_type': 'Matern', 'length_scale': 0.6501883273572806, 'noise_level': 0.03425509667942031, 'constant_value': 12.373498822352959, 'nu': 1.5}. Best is trial 959 with value: 0.1375110730946576.
[I 2024-12-04 20:45:37,461] Trial 1483 finished with value: 0.14249507288628957 and parameters: {'kernel_type': 'Matern', 'length_scale': 5.808308656047946, 'noise_level': 0.7084849779575737, 'constant_value': 0.03757968090411717, 'nu': 1.5}. Best is trial 959 with value: 0.1375110730946576.
[I 2024-12-04 20:45:38,831] Trial 1484 finished with value: 0.9864686819230242 and parameters: {'kernel_type': 'RBF', 'length_scale': 100.857498315015, 'noise_level': 3.672934676292877e-10, 'constant_value': 75155.24008808381, 'nu': 1.5}. Best is trial 959 with value: 0.1375110730946576.
[I 2024-12-04 20:45:41,098] Trial 1485 finished with value: 0.14249502909398018 and parameters: {'kernel_type': 'Matern', 'length_scale': 1.9499676200914782, 'noise_level': 0.8577416001177253, 'constant_value': 0.003630175147698764, 'nu': 1.5}. Best is trial 959 with value: 0.1375110730946576.
[I 2024-12-04 20:45:46,208] Trial 1486 finished with value: 0.14249506157815087 and parameters: {'kernel_type': 'Matern', 'length_scale': 0.3126301826854376, 'noise_level': 0.03206856315991631, 'constant_value': 2.15694597361328, 'nu': 1.5}. Best is trial 959 with value: 0.1375110730946576.
[I 2024-12-04 20:45:46,509] Trial 1487 finished with value: 0.1424950705958337 and parameters: {'kernel_type': 'Matern', 'length_scale': 17.518992785680435, 'noise_level': 0.9674855821296144, 'constant_value': 20.553780275314757, 'nu': 1.5}. Best is trial 959 with value: 0.1375110730946576.
[I 2024-12-04 20:45:51,088] Trial 1488 finished with value: 0.1424950602219057 and parameters: {'kernel_type': 'Matern', 'length_scale': 1.755475106972448, 'noise_level': 0.6598870087936852, 'constant_value': 0.42239074092759704, 'nu': 1.5}. Best is trial 959 with value: 0.1375110730946576.
[I 2024-12-04 20:45:55,598] Trial 1490 finished with value: 0.9864686808722214 and parameters: {'kernel_type': 'RBF', 'length_scale': 0.15850288224819342, 'noise_level': 0.003472347961089564, 'constant_value': 0.3448681689939923, 'nu': 1.5}. Best is trial 959 with value: 0.1375110730946576.
[I 2024-12-04 20:45:59,002] Trial 1491 finished with value: 0.9864686819185214 and parameters: {'kernel_type': 'Matern', 'length_scale': 0.03969417310891365, 'noise_level': 0.01711738260877042, 'constant_value': 5370.180116777815, 'nu': 1.5}. Best is trial 959 with value: 0.1375110730946576.
[I 2024-12-04 20:45:59,530] Trial 1489 finished with value: 0.9864686819228675 and parameters: {'kernel_type': 'Matern', 'length_scale': 71359.02899559327, 'noise_level': 0.009446522296198395, 'constant_value': 10.947437642047806, 'nu': 0.5}. Best is trial 959 with value: 0.1375110730946576.
[I 2024-12-04 20:46:08,571] Trial 1493 finished with value: 0.1378481985294398 and parameters: {'kernel_type': 'Matern', 'length_scale': 1.0679725598380467, 'noise_level': 0.05126423983111075, 'constant_value': 71.6812038707843, 'nu': 1.5}. Best is trial 959 with value: 0.1375110730946576.
[I 2024-12-04 20:46:08,636] Trial 1492 finished with value: 0.986468680278297 and parameters: {'kernel_type': 'Matern', 'length_scale': 0.11472207263739878, 'noise_level': 0.006273274724392442, 'constant_value': 0.0013373280178061429, 'nu': 1.5}. Best is trial 959 with value: 0.1375110730946576.
[I 2024-12-04 20:46:10,089] Trial 1494 finished with value: 0.14249511178676627 and parameters: {'kernel_type': 'Matern', 'length_scale': 0.18318044698614117, 'noise_level': 0.572957233912238, 'constant_value': 79298.82060291199, 'nu': 1.5}. Best is trial 959 with value: 0.1375110730946576.
[I 2024-12-04 20:46:13,492] Trial 1496 finished with value: 0.9864686010607465 and parameters: {'kernel_type': 'Matern', 'length_scale': 0.09346909904046131, 'noise_level': 0.05784969505571089, 'constant_value': 2750.0495274215086, 'nu': 1.5}. Best is trial 959 with value: 0.1375110730946576.
[I 2024-12-04 20:46:17,095] Trial 1495 finished with value: 0.9864686819007056 and parameters: {'kernel_type': 'Matern', 'length_scale': 0.003965740095237476, 'noise_level': 5.695187651828611e-07, 'constant_value': 2.952606354363177e-07, 'nu': 0.5}. Best is trial 959 with value: 0.1375110730946576.
[I 2024-12-04 20:46:18,965] Trial 1497 finished with value: 0.14249507739695585 and parameters: {'kernel_type': 'Matern', 'length_scale': 1.8756606568436114, 'noise_level': 0.01763585110418184, 'constant_value': 2081.5520038816953, 'nu': 1.5}. Best is trial 959 with value: 0.1375110730946576.
[I 2024-12-04 20:46:26,821] Trial 1500 finished with value: 0.9864686820087329 and parameters: {'kernel_type': 'Matern', 'length_scale': 0.03055336936475789, 'noise_level': 0.0007354230320342146, 'constant_value': 1724.1423500134608, 'nu': 1.5}. Best is trial 959 with value: 0.1375110730946576.
[I 2024-12-04 20:46:26,922] Trial 1498 finished with value: 0.14249503027861052 and parameters: {'kernel_type': 'Matern', 'length_scale': 0.14261639485930058, 'noise_level': 0.02724723717347575, 'constant_value': 57.83430408075893, 'nu': 1.5}. Best is trial 959 with value: 0.1375110730946576.
[I 2024-12-04 20:46:33,558] Trial 1499 finished with value: 0.9864686819221431 and parameters: {'kernel_type': 'RBF', 'length_scale': 67613.79973364214, 'noise_level': 2.453208830432353e-06, 'constant_value': 6.513332915404925e-06, 'nu': 2.5}. Best is trial 959 with value: 0.1375110730946576.
[I 2024-12-04 20:46:33,709] Trial 1501 finished with value: 0.14249506331634465 and parameters: {'kernel_type': 'Matern', 'length_scale': 0.3560628231497725, 'noise_level': 0.08680806444716076, 'constant_value': 699.6907179083988, 'nu': 1.5}. Best is trial 959 with value: 0.1375110730946576.
[I 2024-12-04 20:46:39,682] Trial 1502 finished with value: 0.9864686819226001 and parameters: {'kernel_type': 'Matern', 'length_scale': 1.7315790025559958e-05, 'noise_level': 0.0018319167659908433, 'constant_value': 0.00020787060660574944, 'nu': 2.5}. Best is trial 959 with value: 0.1375110730946576.
[I 2024-12-04 20:46:39,687] Trial 1504 finished with value: 0.14249507054500887 and parameters: {'kernel_type': 'Matern', 'length_scale': 12800.643058477224, 'noise_level': 0.9993025953024333, 'constant_value': 388.1380489851757, 'nu': 1.5}. Best is trial 959 with value: 0.1375110730946576.
[I 2024-12-04 20:46:41,352] Trial 1503 finished with value: 0.14249501490584252 and parameters: {'kernel_type': 'Matern', 'length_scale': 1.5700041901675215, 'noise_level': 0.07460325514585073, 'constant_value': 84.2951238660824, 'nu': 1.5}. Best is trial 959 with value: 0.1375110730946576.
[I 2024-12-04 20:46:52,208] Trial 1507 finished with value: 0.9864686819061005 and parameters: {'kernel_type': 'Matern', 'length_scale': 0.01515048665229418, 'noise_level': 0.5218265135412762, 'constant_value': 236.48550376497073, 'nu': 1.5}. Best is trial 959 with value: 0.1375110730946576.
[I 2024-12-04 20:46:52,296] Trial 1505 finished with value: 0.14249495436878737 and parameters: {'kernel_type': 'Matern', 'length_scale': 14.85436912261324, 'noise_level': 0.9829184272346783, 'constant_value': 12679.5827374748, 'nu': 1.5}. Best is trial 959 with value: 0.1375110730946576.
[I 2024-12-04 20:46:52,451] Trial 1506 finished with value: 0.1424954263904382 and parameters: {'kernel_type': 'Matern', 'length_scale': 4.619217325010026, 'noise_level': 0.7888875496197266, 'constant_value': 67592.56193787088, 'nu': 1.5}. Best is trial 959 with value: 0.1375110730946576.
[I 2024-12-04 20:46:59,874] Trial 1509 finished with value: 0.14249506259072792 and parameters: {'kernel_type': 'Matern', 'length_scale': 1.9546665505523215, 'noise_level': 0.07545973055455432, 'constant_value': 48.11216916210341, 'nu': 1.5}. Best is trial 959 with value: 0.1375110730946576.
[I 2024-12-04 20:47:00,390] Trial 1508 finished with value: 0.1424950627844538 and parameters: {'kernel_type': 'Matern', 'length_scale': 9.987981979477974, 'noise_level': 0.9110045508296586, 'constant_value': 1.781200719137752, 'nu': 1.5}. Best is trial 959 with value: 0.1375110730946576.
[I 2024-12-04 20:47:01,174] Trial 1510 finished with value: 0.14249506321340277 and parameters: {'kernel_type': 'Matern', 'length_scale': 4.0530007114392985, 'noise_level': 0.03312036644846186, 'constant_value': 30.519295060293356, 'nu': 1.5}. Best is trial 959 with value: 0.1375110730946576.
[I 2024-12-04 20:47:05,233] Trial 1511 finished with value: 0.1446986782484221 and parameters: {'kernel_type': 'Matern', 'length_scale': 31.453189311083143, 'noise_level': 0.5422237393596241, 'constant_value': 42373.467007843465, 'nu': 2.5}. Best is trial 959 with value: 0.1375110730946576.
[I 2024-12-04 20:47:07,716] Trial 1513 finished with value: 0.1424950637848521 and parameters: {'kernel_type': 'Matern', 'length_scale': 351.62993939378987, 'noise_level': 0.761979122726763, 'constant_value': 248.45758633174785, 'nu': 1.5}. Best is trial 959 with value: 0.1375110730946576.
[I 2024-12-04 20:47:10,747] Trial 1512 finished with value: 0.9864686818799921 and parameters: {'kernel_type': 'Matern', 'length_scale': 4768.954567053566, 'noise_level': 0.0028100914332346034, 'constant_value': 1.1787285021887486e-05, 'nu': 0.5}. Best is trial 959 with value: 0.1375110730946576.
[I 2024-12-04 20:47:13,633] Trial 1514 finished with value: 0.14249505755441233 and parameters: {'kernel_type': 'Matern', 'length_scale': 3.6508536680537693, 'noise_level': 0.0933307849943208, 'constant_value': 514.8418204227033, 'nu': 1.5}. Best is trial 959 with value: 0.1375110730946576.
[I 2024-12-04 20:47:14,395] Trial 1515 finished with value: 0.19720001412658827 and parameters: {'kernel_type': 'Matern', 'length_scale': 50.307406062976646, 'noise_level': 0.4239771279715018, 'constant_value': 6.990678784631075, 'nu': 0.5}. Best is trial 959 with value: 0.1375110730946576.
[I 2024-12-04 20:47:20,237] Trial 1516 finished with value: 0.14469881440122762 and parameters: {'kernel_type': 'Matern', 'length_scale': 109.21818433760238, 'noise_level': 0.015249089936602607, 'constant_value': 23.68608073917977, 'nu': 2.5}. Best is trial 959 with value: 0.1375110730946576.
[I 2024-12-04 20:47:20,684] Trial 1518 finished with value: 0.9864686819228176 and parameters: {'kernel_type': 'Matern', 'length_scale': 0.03667485752281446, 'noise_level': 0.10393871966546767, 'constant_value': 12.742748017109326, 'nu': 1.5}. Best is trial 959 with value: 0.1375110730946576.
[I 2024-12-04 20:47:20,977] Trial 1517 finished with value: 0.9982169682615386 and parameters: {'kernel_type': 'RBF', 'length_scale': 720.1843568280389, 'noise_level': 0.5535957129049678, 'constant_value': 0.0021438893815860895, 'nu': 0.5}. Best is trial 959 with value: 0.1375110730946576.
[I 2024-12-04 20:47:25,945] Trial 1520 finished with value: 0.1424952417208153 and parameters: {'kernel_type': 'Matern', 'length_scale': 50.45357718911361, 'noise_level': 0.04681261706960142, 'constant_value': 3433.352432571354, 'nu': 1.5}. Best is trial 959 with value: 0.1375110730946576.
[I 2024-12-04 20:47:27,579] Trial 1519 finished with value: 0.14249508828790855 and parameters: {'kernel_type': 'Matern', 'length_scale': 0.5897691968636484, 'noise_level': 0.6571615864240915, 'constant_value': 37.293342918571014, 'nu': 1.5}. Best is trial 959 with value: 0.1375110730946576.
[I 2024-12-04 20:47:28,429] Trial 1521 finished with value: 0.1424950670186265 and parameters: {'kernel_type': 'Matern', 'length_scale': 15.844554681111818, 'noise_level': 0.8803434947778066, 'constant_value': 72.71909152527583, 'nu': 1.5}. Best is trial 959 with value: 0.1375110730946576.
[I 2024-12-04 20:47:36,440] Trial 1524 finished with value: 0.14249507746107132 and parameters: {'kernel_type': 'Matern', 'length_scale': 2.593387607879167, 'noise_level': 0.028669546807471614, 'constant_value': 162.8563563366748, 'nu': 1.5}. Best is trial 959 with value: 0.1375110730946576.
[I 2024-12-04 20:47:36,551] Trial 1523 finished with value: 0.14249501831695538 and parameters: {'kernel_type': 'Matern', 'length_scale': 123.83690666407213, 'noise_level': 0.7081526640904057, 'constant_value': 3.5822160258131137, 'nu': 1.5}. Best is trial 959 with value: 0.1375110730946576.
[I 2024-12-04 20:47:38,697] Trial 1522 finished with value: 0.14249507009347573 and parameters: {'kernel_type': 'Matern', 'length_scale': 0.12301206233018049, 'noise_level': 0.055161911584287404, 'constant_value': 964.4841285474782, 'nu': 1.5}. Best is trial 959 with value: 0.1375110730946576.
[I 2024-12-04 20:47:43,937] Trial 1526 finished with value: 0.1424950645440951 and parameters: {'kernel_type': 'Matern', 'length_scale': 1.560019203447269, 'noise_level': 0.9960091890919477, 'constant_value': 9.729439880893803, 'nu': 1.5}. Best is trial 959 with value: 0.1375110730946576.
