[I 2024-12-04 12:58:27,450] Trial 2206 finished with value: 0.37054281685022333 and parameters: {'n_estimators': 1389, 'learning_rate': 0.09011200057285743, 'max_depth': 6, 'min_samples_split': 2, 'min_samples_leaf': 1, 'subsample': 0.7117972521109838, 'max_features': None}. Best is trial 1454 with value: 0.30763307678022894.
[I 2024-12-04 12:58:29,180] Trial 2211 finished with value: 0.32893229702002946 and parameters: {'n_estimators': 1252, 'learning_rate': 0.073442309920099, 'max_depth': 6, 'min_samples_split': 3, 'min_samples_leaf': 2, 'subsample': 0.7264148537719671, 'max_features': None}. Best is trial 1454 with value: 0.30763307678022894.
[I 2024-12-04 12:58:29,780] Trial 2218 finished with value: 0.3919960005676464 and parameters: {'n_estimators': 989, 'learning_rate': 0.04182332397703958, 'max_depth': 8, 'min_samples_split': 2, 'min_samples_leaf': 3, 'subsample': 0.6537974669455843, 'max_features': None}. Best is trial 1454 with value: 0.30763307678022894.
[I 2024-12-04 12:58:30,270] Trial 2209 finished with value: 0.3217238636172273 and parameters: {'n_estimators': 1293, 'learning_rate': 0.06802712293911305, 'max_depth': 7, 'min_samples_split': 2, 'min_samples_leaf': 2, 'subsample': 0.7771579885288862, 'max_features': None}. Best is trial 1454 with value: 0.30763307678022894.
[I 2024-12-04 12:58:31,402] Trial 2208 finished with value: 0.387650161666954 and parameters: {'n_estimators': 1372, 'learning_rate': 0.06124775335441326, 'max_depth': 8, 'min_samples_split': 2, 'min_samples_leaf': 3, 'subsample': 0.7536331340282252, 'max_features': None}. Best is trial 1454 with value: 0.30763307678022894.
[I 2024-12-04 12:58:32,301] Trial 2219 finished with value: 0.3732816734630975 and parameters: {'n_estimators': 1032, 'learning_rate': 0.07071681955570608, 'max_depth': 7, 'min_samples_split': 3, 'min_samples_leaf': 1, 'subsample': 0.7091321089048928, 'max_features': None}. Best is trial 1454 with value: 0.30763307678022894.
[I 2024-12-04 12:58:34,404] Trial 2217 finished with value: 0.561280937329686 and parameters: {'n_estimators': 1223, 'learning_rate': 0.04437724342561817, 'max_depth': 4, 'min_samples_split': 16, 'min_samples_leaf': 10, 'subsample': 0.6387894835022729, 'max_features': None}. Best is trial 1454 with value: 0.30763307678022894.
[I 2024-12-04 12:58:35,799] Trial 2213 finished with value: 0.36810025446704653 and parameters: {'n_estimators': 1421, 'learning_rate': 0.07644552147249768, 'max_depth': 5, 'min_samples_split': 2, 'min_samples_leaf': 4, 'subsample': 0.6726910403005173, 'max_features': None}. Best is trial 1454 with value: 0.30763307678022894.
[I 2024-12-04 12:58:38,073] Trial 2220 finished with value: 0.39724471447868054 and parameters: {'n_estimators': 1148, 'learning_rate': 0.05364664858493305, 'max_depth': 6, 'min_samples_split': 2, 'min_samples_leaf': 3, 'subsample': 0.6875299537975815, 'max_features': None}. Best is trial 1454 with value: 0.30763307678022894.
[I 2024-12-04 12:58:38,168] Trial 2221 finished with value: 0.3921067858237686 and parameters: {'n_estimators': 1058, 'learning_rate': 0.059672925018102965, 'max_depth': 8, 'min_samples_split': 2, 'min_samples_leaf': 3, 'subsample': 0.746048634006469, 'max_features': None}. Best is trial 1454 with value: 0.30763307678022894.
[I 2024-12-04 12:58:39,276] Trial 2215 finished with value: 0.40205051182329155 and parameters: {'n_estimators': 1381, 'learning_rate': 0.0978679976963352, 'max_depth': 4, 'min_samples_split': 2, 'min_samples_leaf': 3, 'subsample': 0.8942551533166051, 'max_features': None}. Best is trial 1454 with value: 0.30763307678022894.
[I 2024-12-04 12:58:40,692] Trial 2225 finished with value: 0.44432773990462837 and parameters: {'n_estimators': 1215, 'learning_rate': 0.06772008218123289, 'max_depth': 3, 'min_samples_split': 2, 'min_samples_leaf': 2, 'subsample': 0.7101280153195451, 'max_features': 'log2'}. Best is trial 1454 with value: 0.30763307678022894.
[I 2024-12-04 12:58:42,049] Trial 2214 finished with value: 0.3217207948443369 and parameters: {'n_estimators': 1482, 'learning_rate': 0.07607288157969737, 'max_depth': 7, 'min_samples_split': 4, 'min_samples_leaf': 2, 'subsample': 0.7331641288965373, 'max_features': None}. Best is trial 1454 with value: 0.30763307678022894.
[I 2024-12-04 12:58:47,495] Trial 2237 finished with value: 0.34785357898509206 and parameters: {'n_estimators': 792, 'learning_rate': 0.027991116661517806, 'max_depth': 7, 'min_samples_split': 6, 'min_samples_leaf': 2, 'subsample': 0.7648432341793724, 'max_features': None}. Best is trial 1454 with value: 0.30763307678022894.
[I 2024-12-04 12:58:47,888] Trial 2247 finished with value: 0.8176091911792427 and parameters: {'n_estimators': 406, 'learning_rate': 0.04282493613286368, 'max_depth': 12, 'min_samples_split': 2, 'min_samples_leaf': 9, 'subsample': 0.6514806555078102, 'max_features': 'log2'}. Best is trial 1454 with value: 0.30763307678022894.
[I 2024-12-04 12:58:51,383] Trial 2224 finished with value: 0.4059685867786314 and parameters: {'n_estimators': 1365, 'learning_rate': 0.06627199388815516, 'max_depth': 5, 'min_samples_split': 2, 'min_samples_leaf': 1, 'subsample': 0.8167904208872495, 'max_features': None}. Best is trial 1454 with value: 0.30763307678022894.
[I 2024-12-04 12:58:52,016] Trial 2227 finished with value: 0.4077155038974694 and parameters: {'n_estimators': 1388, 'learning_rate': 0.05451408575002182, 'max_depth': 4, 'min_samples_split': 2, 'min_samples_leaf': 3, 'subsample': 0.7363774945259783, 'max_features': None}. Best is trial 1454 with value: 0.30763307678022894.
[I 2024-12-04 12:58:52,955] Trial 2222 finished with value: 0.3306950123380903 and parameters: {'n_estimators': 1479, 'learning_rate': 0.037366607284608194, 'max_depth': 8, 'min_samples_split': 2, 'min_samples_leaf': 2, 'subsample': 0.674326857946388, 'max_features': None}. Best is trial 1454 with value: 0.30763307678022894.
[I 2024-12-04 12:58:52,957] Trial 2223 finished with value: 0.39624545899458685 and parameters: {'n_estimators': 1477, 'learning_rate': 0.04938813901484533, 'max_depth': 5, 'min_samples_split': 4, 'min_samples_leaf': 1, 'subsample': 0.6927247163860663, 'max_features': None}. Best is trial 1454 with value: 0.30763307678022894.
[I 2024-12-04 12:58:54,579] Trial 2226 finished with value: 0.387295940136008 and parameters: {'n_estimators': 1365, 'learning_rate': 0.058432153991326036, 'max_depth': 7, 'min_samples_split': 2, 'min_samples_leaf': 1, 'subsample': 0.8122606800015654, 'max_features': None}. Best is trial 1454 with value: 0.30763307678022894.
[I 2024-12-04 12:58:57,429] Trial 2228 finished with value: 0.38330725086269446 and parameters: {'n_estimators': 1421, 'learning_rate': 0.08717241366227499, 'max_depth': 6, 'min_samples_split': 6, 'min_samples_leaf': 6, 'subsample': 0.6993486045654037, 'max_features': None}. Best is trial 1454 with value: 0.30763307678022894.
[I 2024-12-04 12:58:59,968] Trial 2236 finished with value: 0.4479800285076426 and parameters: {'n_estimators': 1398, 'learning_rate': 0.031146622486761765, 'max_depth': 8, 'min_samples_split': 2, 'min_samples_leaf': 1, 'subsample': 0.6462755616535465, 'max_features': 'log2'}. Best is trial 1454 with value: 0.30763307678022894.
[I 2024-12-04 12:59:00,525] Trial 2233 finished with value: 0.4077218317799505 and parameters: {'n_estimators': 1418, 'learning_rate': 0.058668612468418854, 'max_depth': 4, 'min_samples_split': 3, 'min_samples_leaf': 3, 'subsample': 0.8024266527680041, 'max_features': None}. Best is trial 1454 with value: 0.30763307678022894.
[I 2024-12-04 12:59:01,149] Trial 2241 finished with value: 0.4994516385181085 and parameters: {'n_estimators': 1183, 'learning_rate': 0.0563964328917096, 'max_depth': 3, 'min_samples_split': 20, 'min_samples_leaf': 3, 'subsample': 0.6366900642090961, 'max_features': 'log2'}. Best is trial 1454 with value: 0.30763307678022894.
[I 2024-12-04 12:59:01,150] Trial 2248 finished with value: 0.38095797293093087 and parameters: {'n_estimators': 673, 'learning_rate': 0.09850125217866522, 'max_depth': 7, 'min_samples_split': 2, 'min_samples_leaf': 3, 'subsample': 0.7185747591141024, 'max_features': None}. Best is trial 1454 with value: 0.30763307678022894.
[I 2024-12-04 12:59:01,806] Trial 2229 finished with value: 0.32820170095749895 and parameters: {'n_estimators': 1462, 'learning_rate': 0.06682356565976409, 'max_depth': 8, 'min_samples_split': 2, 'min_samples_leaf': 2, 'subsample': 0.7039380259846468, 'max_features': None}. Best is trial 1454 with value: 0.30763307678022894.
[I 2024-12-04 12:59:02,766] Trial 2231 finished with value: 0.31751996158386686 and parameters: {'n_estimators': 1490, 'learning_rate': 0.06426733884419526, 'max_depth': 5, 'min_samples_split': 2, 'min_samples_leaf': 2, 'subsample': 0.9187257107541904, 'max_features': None}. Best is trial 1454 with value: 0.30763307678022894.
[I 2024-12-04 12:59:04,332] Trial 2232 finished with value: 0.32302912982770243 and parameters: {'n_estimators': 1473, 'learning_rate': 0.06243563243760225, 'max_depth': 8, 'min_samples_split': 2, 'min_samples_leaf': 2, 'subsample': 0.6631502738397395, 'max_features': None}. Best is trial 1454 with value: 0.30763307678022894.
[I 2024-12-04 12:59:05,015] Trial 2240 finished with value: 0.3330484026510836 and parameters: {'n_estimators': 1120, 'learning_rate': 0.04480164845090926, 'max_depth': 7, 'min_samples_split': 5, 'min_samples_leaf': 2, 'subsample': 0.6724413965864158, 'max_features': None}. Best is trial 1454 with value: 0.30763307678022894.
[I 2024-12-04 12:59:05,377] Trial 2235 finished with value: 0.3558391782500764 and parameters: {'n_estimators': 1411, 'learning_rate': 0.03451935828730668, 'max_depth': 4, 'min_samples_split': 5, 'min_samples_leaf': 2, 'subsample': 0.8742484847523416, 'max_features': None}. Best is trial 1454 with value: 0.30763307678022894.
[I 2024-12-04 12:59:08,476] Trial 2251 finished with value: 0.39225913929003825 and parameters: {'n_estimators': 796, 'learning_rate': 0.09812354878207952, 'max_depth': 5, 'min_samples_split': 4, 'min_samples_leaf': 1, 'subsample': 0.7595797549568851, 'max_features': None}. Best is trial 1454 with value: 0.30763307678022894.
[I 2024-12-04 12:59:08,609] Trial 2234 finished with value: 0.32185000498296945 and parameters: {'n_estimators': 1489, 'learning_rate': 0.04992674751489474, 'max_depth': 7, 'min_samples_split': 5, 'min_samples_leaf': 2, 'subsample': 0.8680514324896283, 'max_features': None}. Best is trial 1454 with value: 0.30763307678022894.
[I 2024-12-04 12:59:09,919] Trial 2243 finished with value: 0.6082445934003015 and parameters: {'n_estimators': 1325, 'learning_rate': 0.012303629409818872, 'max_depth': 8, 'min_samples_split': 2, 'min_samples_leaf': 3, 'subsample': 0.6674160582424874, 'max_features': 'log2'}. Best is trial 1454 with value: 0.30763307678022894.
[I 2024-12-04 12:59:12,566] Trial 2249 finished with value: 0.37601211127079387 and parameters: {'n_estimators': 951, 'learning_rate': 0.06838953006216568, 'max_depth': 6, 'min_samples_split': 3, 'min_samples_leaf': 1, 'subsample': 0.7050848210166393, 'max_features': None}. Best is trial 1454 with value: 0.30763307678022894.
[I 2024-12-04 12:59:13,337] Trial 2238 finished with value: 0.37425843258397445 and parameters: {'n_estimators': 1492, 'learning_rate': 0.057262233062898536, 'max_depth': 6, 'min_samples_split': 7, 'min_samples_leaf': 3, 'subsample': 0.7614490270384412, 'max_features': None}. Best is trial 1454 with value: 0.30763307678022894.
[I 2024-12-04 12:59:14,792] Trial 2253 finished with value: 0.5114566099783311 and parameters: {'n_estimators': 1015, 'learning_rate': 0.010142000328418763, 'max_depth': 7, 'min_samples_split': 7, 'min_samples_leaf': 4, 'subsample': 0.7194054918041719, 'max_features': 'sqrt'}. Best is trial 1454 with value: 0.30763307678022894.
[I 2024-12-04 12:59:14,793] Trial 2239 finished with value: 0.3844684056274961 and parameters: {'n_estimators': 1369, 'learning_rate': 0.07277177298237031, 'max_depth': 7, 'min_samples_split': 3, 'min_samples_leaf': 1, 'subsample': 0.7759451589532793, 'max_features': None}. Best is trial 1454 with value: 0.30763307678022894.
[I 2024-12-04 12:59:18,725] Trial 2254 finished with value: 0.3823499342844295 and parameters: {'n_estimators': 940, 'learning_rate': 0.03820137516309865, 'max_depth': 9, 'min_samples_split': 2, 'min_samples_leaf': 1, 'subsample': 0.6644185800329088, 'max_features': None}. Best is trial 1454 with value: 0.30763307678022894.
[I 2024-12-04 12:59:19,774] Trial 2242 finished with value: 0.3584630209960556 and parameters: {'n_estimators': 1394, 'learning_rate': 0.08128016988102248, 'max_depth': 9, 'min_samples_split': 2, 'min_samples_leaf': 2, 'subsample': 0.8100561347500776, 'max_features': None}. Best is trial 1454 with value: 0.30763307678022894.
[I 2024-12-04 12:59:20,182] Trial 2245 finished with value: 0.36883951939954085 and parameters: {'n_estimators': 1256, 'learning_rate': 0.04533176344273657, 'max_depth': 7, 'min_samples_split': 2, 'min_samples_leaf': 4, 'subsample': 0.8472612562665831, 'max_features': None}. Best is trial 1454 with value: 0.30763307678022894.
[I 2024-12-04 12:59:22,487] Trial 2255 finished with value: 0.4058128776357467 and parameters: {'n_estimators': 1121, 'learning_rate': 0.01898022975122518, 'max_depth': 5, 'min_samples_split': 2, 'min_samples_leaf': 3, 'subsample': 0.600793600428874, 'max_features': None}. Best is trial 1454 with value: 0.30763307678022894.
[I 2024-12-04 12:59:22,902] Trial 2277 finished with value: 0.8431687524652435 and parameters: {'n_estimators': 177, 'learning_rate': 0.07995422906381733, 'max_depth': 9, 'min_samples_split': 4, 'min_samples_leaf': 9, 'subsample': 0.7150931267109062, 'max_features': 'log2'}. Best is trial 1454 with value: 0.30763307678022894.
[I 2024-12-04 12:59:25,040] Trial 2244 finished with value: 0.39609866236598107 and parameters: {'n_estimators': 1446, 'learning_rate': 0.04882502391534809, 'max_depth': 6, 'min_samples_split': 2, 'min_samples_leaf': 1, 'subsample': 0.7774453871928954, 'max_features': None}. Best is trial 1454 with value: 0.30763307678022894.
[I 2024-12-04 12:59:25,453] Trial 2256 finished with value: 0.40315908165535247 and parameters: {'n_estimators': 980, 'learning_rate': 0.06717813993656072, 'max_depth': 6, 'min_samples_split': 4, 'min_samples_leaf': 1, 'subsample': 0.7633508627613871, 'max_features': None}. Best is trial 1454 with value: 0.30763307678022894.
[I 2024-12-04 12:59:26,945] Trial 2246 finished with value: 0.33622182925053257 and parameters: {'n_estimators': 1491, 'learning_rate': 0.08053013116701024, 'max_depth': 5, 'min_samples_split': 3, 'min_samples_leaf': 2, 'subsample': 0.7715467146911542, 'max_features': None}. Best is trial 1454 with value: 0.30763307678022894.
[I 2024-12-04 12:59:29,377] Trial 2250 finished with value: 0.3269953958986256 and parameters: {'n_estimators': 1363, 'learning_rate': 0.06672522482761573, 'max_depth': 6, 'min_samples_split': 4, 'min_samples_leaf': 2, 'subsample': 0.8654066650407246, 'max_features': None}. Best is trial 1454 with value: 0.30763307678022894.
[I 2024-12-04 12:59:30,017] Trial 2259 finished with value: 0.3353955351853999 and parameters: {'n_estimators': 962, 'learning_rate': 0.09261608206822483, 'max_depth': 6, 'min_samples_split': 2, 'min_samples_leaf': 2, 'subsample': 0.6042372031049384, 'max_features': None}. Best is trial 1454 with value: 0.30763307678022894.
[I 2024-12-04 12:59:31,182] Trial 2260 finished with value: 0.3743819824580279 and parameters: {'n_estimators': 889, 'learning_rate': 0.06504972851791514, 'max_depth': 9, 'min_samples_split': 2, 'min_samples_leaf': 1, 'subsample': 0.7628656848624112, 'max_features': None}. Best is trial 1454 with value: 0.30763307678022894.
[I 2024-12-04 12:59:33,567] Trial 2271 finished with value: 0.5232256669129873 and parameters: {'n_estimators': 714, 'learning_rate': 0.021716203611950657, 'max_depth': 6, 'min_samples_split': 3, 'min_samples_leaf': 7, 'subsample': 0.8222657474449173, 'max_features': 'sqrt'}. Best is trial 1454 with value: 0.30763307678022894.
[I 2024-12-04 12:59:34,620] Trial 2252 finished with value: 0.36626731966961756 and parameters: {'n_estimators': 1449, 'learning_rate': 0.06985611266717372, 'max_depth': 6, 'min_samples_split': 2, 'min_samples_leaf': 4, 'subsample': 0.8548256491722226, 'max_features': None}. Best is trial 1454 with value: 0.30763307678022894.
[I 2024-12-04 12:59:35,780] Trial 2274 finished with value: 0.42646463087494196 and parameters: {'n_estimators': 582, 'learning_rate': 0.038935321770532515, 'max_depth': 7, 'min_samples_split': 16, 'min_samples_leaf': 8, 'subsample': 0.9478116928045753, 'max_features': None}. Best is trial 1454 with value: 0.30763307678022894.
[I 2024-12-04 12:59:37,660] Trial 2257 finished with value: 0.3875607757480466 and parameters: {'n_estimators': 1307, 'learning_rate': 0.05790494190531802, 'max_depth': 6, 'min_samples_split': 3, 'min_samples_leaf': 3, 'subsample': 0.7243760534231624, 'max_features': None}. Best is trial 1454 with value: 0.30763307678022894.
[I 2024-12-04 12:59:40,579] Trial 2264 finished with value: 0.37783896143182666 and parameters: {'n_estimators': 1024, 'learning_rate': 0.029916686846005913, 'max_depth': 8, 'min_samples_split': 3, 'min_samples_leaf': 1, 'subsample': 0.7065635852182559, 'max_features': None}. Best is trial 1454 with value: 0.30763307678022894.
[I 2024-12-04 12:59:43,889] Trial 2293 finished with value: 0.7564658482069067 and parameters: {'n_estimators': 203, 'learning_rate': 0.03771826406617809, 'max_depth': 3, 'min_samples_split': 16, 'min_samples_leaf': 7, 'subsample': 0.6326379123465504, 'max_features': 'sqrt'}. Best is trial 1454 with value: 0.30763307678022894.
[I 2024-12-04 12:59:45,184] Trial 2262 finished with value: 0.3357123916653415 and parameters: {'n_estimators': 1294, 'learning_rate': 0.07996501327407035, 'max_depth': 6, 'min_samples_split': 2, 'min_samples_leaf': 2, 'subsample': 0.8098153637361927, 'max_features': None}. Best is trial 1454 with value: 0.30763307678022894.
[I 2024-12-04 12:59:45,196] Trial 2275 finished with value: 0.7804066248476935 and parameters: {'n_estimators': 1025, 'learning_rate': 0.02129883787316387, 'max_depth': 10, 'min_samples_split': 17, 'min_samples_leaf': 9, 'subsample': 0.8908409946393596, 'max_features': 'log2'}. Best is trial 1454 with value: 0.30763307678022894.
[I 2024-12-04 12:59:48,131] Trial 2258 finished with value: 0.3170105432149741 and parameters: {'n_estimators': 1486, 'learning_rate': 0.07281597777961572, 'max_depth': 6, 'min_samples_split': 2, 'min_samples_leaf': 2, 'subsample': 0.8352036625629606, 'max_features': None}. Best is trial 1454 with value: 0.30763307678022894.
[I 2024-12-04 12:59:50,626] Trial 2261 finished with value: 0.317057364793321 and parameters: {'n_estimators': 1496, 'learning_rate': 0.0654868380512313, 'max_depth': 5, 'min_samples_split': 4, 'min_samples_leaf': 2, 'subsample': 0.7799360317358105, 'max_features': None}. Best is trial 1454 with value: 0.30763307678022894.
[I 2024-12-04 12:59:50,627] Trial 2263 finished with value: 0.3392662240142832 and parameters: {'n_estimators': 1431, 'learning_rate': 0.07323894888989996, 'max_depth': 8, 'min_samples_split': 3, 'min_samples_leaf': 2, 'subsample': 0.6054018438666792, 'max_features': None}. Best is trial 1454 with value: 0.30763307678022894.
[I 2024-12-04 12:59:52,056] Trial 2267 finished with value: 0.395184371306078 and parameters: {'n_estimators': 1236, 'learning_rate': 0.06385507596550875, 'max_depth': 5, 'min_samples_split': 3, 'min_samples_leaf': 3, 'subsample': 0.9119659315563167, 'max_features': None}. Best is trial 1454 with value: 0.30763307678022894.
[I 2024-12-04 12:59:53,923] Trial 2268 finished with value: 0.43991383094615105 and parameters: {'n_estimators': 1348, 'learning_rate': 0.044195119951370876, 'max_depth': 3, 'min_samples_split': 5, 'min_samples_leaf': 3, 'subsample': 0.9571477443382244, 'max_features': None}. Best is trial 1454 with value: 0.30763307678022894.
[I 2024-12-04 12:59:54,450] Trial 2265 finished with value: 0.41188119751326624 and parameters: {'n_estimators': 1415, 'learning_rate': 0.05740255685548406, 'max_depth': 4, 'min_samples_split': 2, 'min_samples_leaf': 3, 'subsample': 0.9609326000940841, 'max_features': None}. Best is trial 1454 with value: 0.30763307678022894.
[I 2024-12-04 12:59:59,838] Trial 2266 finished with value: 0.3825015275094172 and parameters: {'n_estimators': 1409, 'learning_rate': 0.05159263414317196, 'max_depth': 7, 'min_samples_split': 4, 'min_samples_leaf': 3, 'subsample': 0.9233834833744885, 'max_features': None}. Best is trial 1454 with value: 0.30763307678022894.
[I 2024-12-04 12:59:59,871] Trial 2272 finished with value: 0.40645174533197925 and parameters: {'n_estimators': 1428, 'learning_rate': 0.07564004192030961, 'max_depth': 4, 'min_samples_split': 5, 'min_samples_leaf': 1, 'subsample': 0.9890847278756408, 'max_features': None}. Best is trial 1454 with value: 0.30763307678022894.
[I 2024-12-04 12:59:59,876] Trial 2269 finished with value: 0.3231877852175971 and parameters: {'n_estimators': 1421, 'learning_rate': 0.059080585917746745, 'max_depth': 6, 'min_samples_split': 2, 'min_samples_leaf': 2, 'subsample': 0.9360091583778006, 'max_features': None}. Best is trial 1454 with value: 0.30763307678022894.
[I 2024-12-04 13:00:02,829] Trial 2285 finished with value: 0.6041035636678078 and parameters: {'n_estimators': 1186, 'learning_rate': 0.01421179079275888, 'max_depth': 11, 'min_samples_split': 10, 'min_samples_leaf': 9, 'subsample': 0.8728970162544523, 'max_features': 'sqrt'}. Best is trial 1454 with value: 0.30763307678022894.
[I 2024-12-04 13:00:03,608] Trial 2280 finished with value: 0.412638667413749 and parameters: {'n_estimators': 1299, 'learning_rate': 0.07612548660359535, 'max_depth': 3, 'min_samples_split': 5, 'min_samples_leaf': 5, 'subsample': 0.9085416738797664, 'max_features': None}. Best is trial 1454 with value: 0.30763307678022894.
