[I 2024-12-04 13:23:46,100] Trial 1811 finished with value: 0.24123435299633192 and parameters: {'n_estimators': 738, 'learning_rate': 0.08188898009548783, 'max_depth': 6, 'min_samples_split': 3, 'min_samples_leaf': 1, 'subsample': 0.912056711850525, 'max_features': 'sqrt'}. Best is trial 1389 with value: 0.22332552856343169.
[I 2024-12-04 13:23:46,140] Trial 1793 finished with value: 0.2494976836310629 and parameters: {'n_estimators': 1348, 'learning_rate': 0.04522981556883267, 'max_depth': 8, 'min_samples_split': 4, 'min_samples_leaf': 1, 'subsample': 0.8492371579144709, 'max_features': 'sqrt'}. Best is trial 1389 with value: 0.22332552856343169.
[I 2024-12-04 13:23:46,609] Trial 1818 finished with value: 0.44099958517534404 and parameters: {'n_estimators': 385, 'learning_rate': 0.013611143901619589, 'max_depth': 5, 'min_samples_split': 15, 'min_samples_leaf': 4, 'subsample': 0.6647251682495224, 'max_features': None}. Best is trial 1389 with value: 0.22332552856343169.
[I 2024-12-04 13:23:47,988] Trial 1795 finished with value: 0.26322932442727054 and parameters: {'n_estimators': 1265, 'learning_rate': 0.07953375518807224, 'max_depth': 7, 'min_samples_split': 14, 'min_samples_leaf': 1, 'subsample': 0.6058860634650367, 'max_features': 'sqrt'}. Best is trial 1389 with value: 0.22332552856343169.
[I 2024-12-04 13:23:49,130] Trial 1813 finished with value: 0.27776556234962885 and parameters: {'n_estimators': 715, 'learning_rate': 0.05824056397285145, 'max_depth': 8, 'min_samples_split': 2, 'min_samples_leaf': 1, 'subsample': 0.9327957573133271, 'max_features': 'sqrt'}. Best is trial 1389 with value: 0.22332552856343169.
[I 2024-12-04 13:23:49,144] Trial 1797 finished with value: 0.29751442077105067 and parameters: {'n_estimators': 1160, 'learning_rate': 0.042468174674785836, 'max_depth': 8, 'min_samples_split': 12, 'min_samples_leaf': 1, 'subsample': 0.7250969611040028, 'max_features': 'log2'}. Best is trial 1389 with value: 0.22332552856343169.
[I 2024-12-04 13:23:51,816] Trial 1800 finished with value: 0.28648850334475406 and parameters: {'n_estimators': 1040, 'learning_rate': 0.07955343246046645, 'max_depth': 9, 'min_samples_split': 6, 'min_samples_leaf': 2, 'subsample': 0.7960800168160392, 'max_features': 'sqrt'}. Best is trial 1389 with value: 0.22332552856343169.
[I 2024-12-04 13:23:51,947] Trial 1807 finished with value: 0.28850349749066095 and parameters: {'n_estimators': 897, 'learning_rate': 0.083467707020716, 'max_depth': 8, 'min_samples_split': 4, 'min_samples_leaf': 2, 'subsample': 0.8910878320258336, 'max_features': 'sqrt'}. Best is trial 1389 with value: 0.22332552856343169.
[I 2024-12-04 13:23:52,157] Trial 1794 finished with value: 0.4244122672181415 and parameters: {'n_estimators': 1270, 'learning_rate': 0.021720816622231652, 'max_depth': 6, 'min_samples_split': 2, 'min_samples_leaf': 5, 'subsample': 0.830186925352927, 'max_features': None}. Best is trial 1389 with value: 0.22332552856343169.
[I 2024-12-04 13:23:56,424] Trial 1806 finished with value: 0.3118339051734182 and parameters: {'n_estimators': 1072, 'learning_rate': 0.0986980990412339, 'max_depth': 4, 'min_samples_split': 12, 'min_samples_leaf': 1, 'subsample': 0.760746280530122, 'max_features': 'log2'}. Best is trial 1389 with value: 0.22332552856343169.
[I 2024-12-04 13:24:05,274] Trial 1815 finished with value: 0.2542752522380869 and parameters: {'n_estimators': 857, 'learning_rate': 0.08712808030493091, 'max_depth': 8, 'min_samples_split': 7, 'min_samples_leaf': 1, 'subsample': 0.833731138774271, 'max_features': 'sqrt'}. Best is trial 1389 with value: 0.22332552856343169.
[I 2024-12-04 13:24:08,956] Trial 1821 finished with value: 0.3544882330356281 and parameters: {'n_estimators': 694, 'learning_rate': 0.09530978664838537, 'max_depth': 6, 'min_samples_split': 3, 'min_samples_leaf': 3, 'subsample': 0.8704448886346379, 'max_features': 'sqrt'}. Best is trial 1389 with value: 0.22332552856343169.
[I 2024-12-04 13:24:09,324] Trial 1817 finished with value: 0.242206678327348 and parameters: {'n_estimators': 838, 'learning_rate': 0.09955503412144309, 'max_depth': 10, 'min_samples_split': 3, 'min_samples_leaf': 1, 'subsample': 0.9176321931596124, 'max_features': 'sqrt'}. Best is trial 1389 with value: 0.22332552856343169.
[I 2024-12-04 13:24:09,488] Trial 1819 finished with value: 0.28566679146919893 and parameters: {'n_estimators': 796, 'learning_rate': 0.07926328757808086, 'max_depth': 7, 'min_samples_split': 3, 'min_samples_leaf': 2, 'subsample': 0.8369003817377947, 'max_features': 'sqrt'}. Best is trial 1389 with value: 0.22332552856343169.
[I 2024-12-04 13:24:10,293] Trial 1798 finished with value: 0.28144744284344236 and parameters: {'n_estimators': 1401, 'learning_rate': 0.07357258343582923, 'max_depth': 7, 'min_samples_split': 5, 'min_samples_leaf': 1, 'subsample': 0.8916337730350546, 'max_features': 'sqrt'}. Best is trial 1389 with value: 0.22332552856343169.
[I 2024-12-04 13:24:10,305] Trial 1823 finished with value: 0.4238178381609397 and parameters: {'n_estimators': 694, 'learning_rate': 0.06732225438252645, 'max_depth': 4, 'min_samples_split': 10, 'min_samples_leaf': 1, 'subsample': 0.8822659752002349, 'max_features': 'log2'}. Best is trial 1389 with value: 0.22332552856343169.
[I 2024-12-04 13:24:13,547] Trial 1837 finished with value: 1.1679005778713714 and parameters: {'n_estimators': 103, 'learning_rate': 0.07192500042687523, 'max_depth': 3, 'min_samples_split': 12, 'min_samples_leaf': 9, 'subsample': 0.8081073130199431, 'max_features': 'log2'}. Best is trial 1389 with value: 0.22332552856343169.
[I 2024-12-04 13:24:18,908] Trial 1827 finished with value: 0.2950120391513814 and parameters: {'n_estimators': 719, 'learning_rate': 0.09486166257555237, 'max_depth': 6, 'min_samples_split': 6, 'min_samples_leaf': 2, 'subsample': 0.8944645049222784, 'max_features': 'sqrt'}. Best is trial 1389 with value: 0.22332552856343169.
[I 2024-12-04 13:24:20,201] Trial 1808 finished with value: 0.6509073188550694 and parameters: {'n_estimators': 1460, 'learning_rate': 0.026067904456511158, 'max_depth': 6, 'min_samples_split': 15, 'min_samples_leaf': 8, 'subsample': 0.964207274842012, 'max_features': 'log2'}. Best is trial 1389 with value: 0.22332552856343169.
[I 2024-12-04 13:24:20,230] Trial 1816 finished with value: 0.2953490887472297 and parameters: {'n_estimators': 1128, 'learning_rate': 0.09517911083541618, 'max_depth': 6, 'min_samples_split': 7, 'min_samples_leaf': 2, 'subsample': 0.9250460731088697, 'max_features': 'sqrt'}. Best is trial 1389 with value: 0.22332552856343169.
[I 2024-12-04 13:24:22,281] Trial 1829 finished with value: 0.28555781010967607 and parameters: {'n_estimators': 663, 'learning_rate': 0.08337610176213535, 'max_depth': 9, 'min_samples_split': 2, 'min_samples_leaf': 1, 'subsample': 0.8942203139291136, 'max_features': 'sqrt'}. Best is trial 1389 with value: 0.22332552856343169.
[I 2024-12-04 13:24:33,787] Trial 1828 finished with value: 0.2620853073027176 and parameters: {'n_estimators': 906, 'learning_rate': 0.09357628221775124, 'max_depth': 9, 'min_samples_split': 6, 'min_samples_leaf': 1, 'subsample': 0.9257142691438621, 'max_features': 'sqrt'}. Best is trial 1389 with value: 0.22332552856343169.
[I 2024-12-04 13:24:35,265] Trial 1822 finished with value: 0.25392740347444737 and parameters: {'n_estimators': 1128, 'learning_rate': 0.07538092134464701, 'max_depth': 7, 'min_samples_split': 6, 'min_samples_leaf': 1, 'subsample': 0.9434068470159007, 'max_features': 'sqrt'}. Best is trial 1389 with value: 0.22332552856343169.
[I 2024-12-04 13:24:35,322] Trial 1820 finished with value: 0.2355029434887487 and parameters: {'n_estimators': 1215, 'learning_rate': 0.08983649814459425, 'max_depth': 8, 'min_samples_split': 6, 'min_samples_leaf': 1, 'subsample': 0.8575802542475797, 'max_features': 'sqrt'}. Best is trial 1389 with value: 0.22332552856343169.
[I 2024-12-04 13:24:36,773] Trial 1834 finished with value: 0.2424229424586112 and parameters: {'n_estimators': 755, 'learning_rate': 0.09584231309383198, 'max_depth': 6, 'min_samples_split': 2, 'min_samples_leaf': 1, 'subsample': 0.8497060853042602, 'max_features': 'sqrt'}. Best is trial 1389 with value: 0.22332552856343169.
[I 2024-12-04 13:24:36,799] Trial 1814 finished with value: 0.2411812792169001 and parameters: {'n_estimators': 1497, 'learning_rate': 0.052749609185756156, 'max_depth': 9, 'min_samples_split': 5, 'min_samples_leaf': 1, 'subsample': 0.9340793785949045, 'max_features': 'sqrt'}. Best is trial 1389 with value: 0.22332552856343169.
[I 2024-12-04 13:24:36,813] Trial 1825 finished with value: 0.2376323219767223 and parameters: {'n_estimators': 1067, 'learning_rate': 0.08858828670439116, 'max_depth': 7, 'min_samples_split': 4, 'min_samples_leaf': 1, 'subsample': 0.8567672196961417, 'max_features': 'sqrt'}. Best is trial 1389 with value: 0.22332552856343169.
[I 2024-12-04 13:24:37,142] Trial 1832 finished with value: 0.33530896174545183 and parameters: {'n_estimators': 786, 'learning_rate': 0.030091978163552555, 'max_depth': 12, 'min_samples_split': 16, 'min_samples_leaf': 1, 'subsample': 0.8726577522334809, 'max_features': 'log2'}. Best is trial 1389 with value: 0.22332552856343169.
[I 2024-12-04 13:24:44,901] Trial 1831 finished with value: 0.2764452420733245 and parameters: {'n_estimators': 944, 'learning_rate': 0.09543257560071311, 'max_depth': 9, 'min_samples_split': 2, 'min_samples_leaf': 1, 'subsample': 0.8279773241848386, 'max_features': 'sqrt'}. Best is trial 1389 with value: 0.22332552856343169.
[I 2024-12-04 13:24:49,752] Trial 1833 finished with value: 0.2588468039148341 and parameters: {'n_estimators': 1026, 'learning_rate': 0.09862718033695354, 'max_depth': 10, 'min_samples_split': 6, 'min_samples_leaf': 1, 'subsample': 0.8884025615982496, 'max_features': 'log2'}. Best is trial 1389 with value: 0.22332552856343169.
[I 2024-12-04 13:24:52,048] Trial 1830 finished with value: 0.2751689831923526 and parameters: {'n_estimators': 1204, 'learning_rate': 0.08497832583165553, 'max_depth': 6, 'min_samples_split': 3, 'min_samples_leaf': 1, 'subsample': 0.8872976731725165, 'max_features': 'sqrt'}. Best is trial 1389 with value: 0.22332552856343169.
[I 2024-12-04 13:24:54,373] Trial 1835 finished with value: 0.2974458081345638 and parameters: {'n_estimators': 935, 'learning_rate': 0.09938382757467418, 'max_depth': 9, 'min_samples_split': 8, 'min_samples_leaf': 2, 'subsample': 0.6119712037391171, 'max_features': 'log2'}. Best is trial 1389 with value: 0.22332552856343169.
[I 2024-12-04 13:24:56,909] Trial 1824 finished with value: 0.2695509750268796 and parameters: {'n_estimators': 1454, 'learning_rate': 0.09902873457167444, 'max_depth': 7, 'min_samples_split': 6, 'min_samples_leaf': 1, 'subsample': 0.8423636101378095, 'max_features': 'sqrt'}. Best is trial 1389 with value: 0.22332552856343169.
[I 2024-12-04 13:24:58,518] Trial 1843 finished with value: 0.25301872665690095 and parameters: {'n_estimators': 786, 'learning_rate': 0.06643158178643438, 'max_depth': 7, 'min_samples_split': 4, 'min_samples_leaf': 1, 'subsample': 0.8803329511116997, 'max_features': 'sqrt'}. Best is trial 1389 with value: 0.22332552856343169.
[I 2024-12-04 13:25:08,427] Trial 1826 finished with value: 0.319614361338609 and parameters: {'n_estimators': 1478, 'learning_rate': 0.07455333694829495, 'max_depth': 10, 'min_samples_split': 4, 'min_samples_leaf': 1, 'subsample': 0.6439555226488586, 'max_features': None}. Best is trial 1389 with value: 0.22332552856343169.
[I 2024-12-04 13:25:12,493] Trial 1857 finished with value: 0.8031266192283912 and parameters: {'n_estimators': 418, 'learning_rate': 0.012004742372681078, 'max_depth': 11, 'min_samples_split': 9, 'min_samples_leaf': 9, 'subsample': 0.8975674687528178, 'max_features': 'sqrt'}. Best is trial 1389 with value: 0.22332552856343169.
[I 2024-12-04 13:25:13,040] Trial 1846 finished with value: 0.2448569747473691 and parameters: {'n_estimators': 860, 'learning_rate': 0.09711914537920054, 'max_depth': 8, 'min_samples_split': 6, 'min_samples_leaf': 1, 'subsample': 0.8965663456305208, 'max_features': 'sqrt'}. Best is trial 1389 with value: 0.22332552856343169.
[I 2024-12-04 13:25:19,057] Trial 1838 finished with value: 0.34821432783865736 and parameters: {'n_estimators': 1313, 'learning_rate': 0.09921342514375482, 'max_depth': 11, 'min_samples_split': 8, 'min_samples_leaf': 4, 'subsample': 0.6779738070152693, 'max_features': 'log2'}. Best is trial 1389 with value: 0.22332552856343169.
[I 2024-12-04 13:25:19,065] Trial 1836 finished with value: 0.24872323266797564 and parameters: {'n_estimators': 1223, 'learning_rate': 0.07183804917567424, 'max_depth': 9, 'min_samples_split': 4, 'min_samples_leaf': 1, 'subsample': 0.9201828153365019, 'max_features': 'sqrt'}. Best is trial 1389 with value: 0.22332552856343169.
[I 2024-12-04 13:25:22,740] Trial 1844 finished with value: 0.3404120244041122 and parameters: {'n_estimators': 1125, 'learning_rate': 0.06525379028469819, 'max_depth': 8, 'min_samples_split': 7, 'min_samples_leaf': 3, 'subsample': 0.8421938512364732, 'max_features': 'sqrt'}. Best is trial 1389 with value: 0.22332552856343169.
[I 2024-12-04 13:25:26,798] Trial 1864 finished with value: 0.7599701242257397 and parameters: {'n_estimators': 370, 'learning_rate': 0.039259913991106704, 'max_depth': 12, 'min_samples_split': 20, 'min_samples_leaf': 4, 'subsample': 0.9315611715395811, 'max_features': 'log2'}. Best is trial 1389 with value: 0.22332552856343169.
[I 2024-12-04 13:25:28,601] Trial 1863 finished with value: 0.933830104758491 and parameters: {'n_estimators': 466, 'learning_rate': 0.020454558448461384, 'max_depth': 4, 'min_samples_split': 14, 'min_samples_leaf': 4, 'subsample': 0.9601681013290212, 'max_features': 'log2'}. Best is trial 1389 with value: 0.22332552856343169.
[I 2024-12-04 13:25:28,665] Trial 1840 finished with value: 0.44504413309738405 and parameters: {'n_estimators': 1220, 'learning_rate': 0.039991931685616516, 'max_depth': 6, 'min_samples_split': 5, 'min_samples_leaf': 2, 'subsample': 0.9327476030909598, 'max_features': None}. Best is trial 1389 with value: 0.22332552856343169.
[I 2024-12-04 13:25:34,718] Trial 1841 finished with value: 0.47240512018149966 and parameters: {'n_estimators': 1218, 'learning_rate': 0.042120822422899745, 'max_depth': 3, 'min_samples_split': 5, 'min_samples_leaf': 1, 'subsample': 0.7614446696139751, 'max_features': 'log2'}. Best is trial 1389 with value: 0.22332552856343169.
[I 2024-12-04 13:25:36,879] Trial 1842 finished with value: 0.34536825930467135 and parameters: {'n_estimators': 1423, 'learning_rate': 0.06568529144743553, 'max_depth': 6, 'min_samples_split': 5, 'min_samples_leaf': 3, 'subsample': 0.8621006720089981, 'max_features': 'sqrt'}. Best is trial 1389 with value: 0.22332552856343169.
[I 2024-12-04 13:25:40,634] Trial 1839 finished with value: 0.24564355212246175 and parameters: {'n_estimators': 1443, 'learning_rate': 0.09911639000363397, 'max_depth': 8, 'min_samples_split': 3, 'min_samples_leaf': 1, 'subsample': 0.8319943272024571, 'max_features': 'sqrt'}. Best is trial 1389 with value: 0.22332552856343169.
[I 2024-12-04 13:25:42,366] Trial 1845 finished with value: 0.46202616785781714 and parameters: {'n_estimators': 1302, 'learning_rate': 0.056530865596500196, 'max_depth': 3, 'min_samples_split': 12, 'min_samples_leaf': 10, 'subsample': 0.9248695815782139, 'max_features': 'sqrt'}. Best is trial 1389 with value: 0.22332552856343169.
[I 2024-12-04 13:25:43,294] Trial 1855 finished with value: 0.24223330067775128 and parameters: {'n_estimators': 901, 'learning_rate': 0.06649794927285767, 'max_depth': 7, 'min_samples_split': 2, 'min_samples_leaf': 1, 'subsample': 0.921666209033396, 'max_features': 'sqrt'}. Best is trial 1389 with value: 0.22332552856343169.
[I 2024-12-04 13:25:46,343] Trial 1847 finished with value: 0.4145931540523246 and parameters: {'n_estimators': 1179, 'learning_rate': 0.016553827725611318, 'max_depth': 12, 'min_samples_split': 12, 'min_samples_leaf': 6, 'subsample': 0.6126843547711118, 'max_features': None}. Best is trial 1389 with value: 0.22332552856343169.
[I 2024-12-04 13:25:50,324] Trial 1865 finished with value: 0.2759912689865982 and parameters: {'n_estimators': 701, 'learning_rate': 0.09821512636437779, 'max_depth': 7, 'min_samples_split': 4, 'min_samples_leaf': 2, 'subsample': 0.9081692032941276, 'max_features': 'sqrt'}. Best is trial 1389 with value: 0.22332552856343169.
[I 2024-12-04 13:25:50,737] Trial 1850 finished with value: 0.25002466703977405 and parameters: {'n_estimators': 1248, 'learning_rate': 0.047270995325911516, 'max_depth': 6, 'min_samples_split': 6, 'min_samples_leaf': 1, 'subsample': 0.8877249548950937, 'max_features': 'sqrt'}. Best is trial 1389 with value: 0.22332552856343169.
[I 2024-12-04 13:25:52,168] Trial 1849 finished with value: 0.2695160681799191 and parameters: {'n_estimators': 1204, 'learning_rate': 0.0672053580733433, 'max_depth': 8, 'min_samples_split': 8, 'min_samples_leaf': 1, 'subsample': 0.7803553337934948, 'max_features': 'sqrt'}. Best is trial 1389 with value: 0.22332552856343169.
[I 2024-12-04 13:25:58,360] Trial 1867 finished with value: 0.2537845701430901 and parameters: {'n_estimators': 760, 'learning_rate': 0.06949134432098936, 'max_depth': 7, 'min_samples_split': 3, 'min_samples_leaf': 1, 'subsample': 0.8247471882593506, 'max_features': 'sqrt'}. Best is trial 1389 with value: 0.22332552856343169.
[I 2024-12-04 13:25:58,531] Trial 1858 finished with value: 0.2603566316027881 and parameters: {'n_estimators': 1008, 'learning_rate': 0.057580826723683635, 'max_depth': 12, 'min_samples_split': 8, 'min_samples_leaf': 1, 'subsample': 0.6158984100417455, 'max_features': 'sqrt'}. Best is trial 1389 with value: 0.22332552856343169.
[I 2024-12-04 13:26:05,071] Trial 1856 finished with value: 0.46887151537821403 and parameters: {'n_estimators': 1127, 'learning_rate': 0.0867816435865013, 'max_depth': 9, 'min_samples_split': 2, 'min_samples_leaf': 2, 'subsample': 0.855534357234254, 'max_features': None}. Best is trial 1389 with value: 0.22332552856343169.
[I 2024-12-04 13:26:06,914] Trial 1854 finished with value: 0.45773232480516374 and parameters: {'n_estimators': 1398, 'learning_rate': 0.018302465782649168, 'max_depth': 12, 'min_samples_split': 11, 'min_samples_leaf': 8, 'subsample': 0.7595353990005976, 'max_features': 'sqrt'}. Best is trial 1389 with value: 0.22332552856343169.
[I 2024-12-04 13:26:09,580] Trial 1848 finished with value: 0.34833016290943963 and parameters: {'n_estimators': 1500, 'learning_rate': 0.08571909394106107, 'max_depth': 7, 'min_samples_split': 3, 'min_samples_leaf': 3, 'subsample': 0.87258392188592, 'max_features': 'sqrt'}. Best is trial 1389 with value: 0.22332552856343169.
[I 2024-12-04 13:26:10,597] Trial 1852 finished with value: 0.26020433112213326 and parameters: {'n_estimators': 1367, 'learning_rate': 0.0962637713506334, 'max_depth': 11, 'min_samples_split': 3, 'min_samples_leaf': 1, 'subsample': 0.7972398696070561, 'max_features': 'sqrt'}. Best is trial 1389 with value: 0.22332552856343169.
[I 2024-12-04 13:26:10,708] Trial 1853 finished with value: 0.2563049465040583 and parameters: {'n_estimators': 1407, 'learning_rate': 0.09442966306117932, 'max_depth': 9, 'min_samples_split': 2, 'min_samples_leaf': 1, 'subsample': 0.9222788583417213, 'max_features': 'sqrt'}. Best is trial 1389 with value: 0.22332552856343169.
[I 2024-12-04 13:26:14,005] Trial 1860 finished with value: 0.3599823897712828 and parameters: {'n_estimators': 1151, 'learning_rate': 0.09256112644492778, 'max_depth': 8, 'min_samples_split': 7, 'min_samples_leaf': 3, 'subsample': 0.8721756923344143, 'max_features': 'sqrt'}. Best is trial 1389 with value: 0.22332552856343169.
[I 2024-12-04 13:26:16,172] Trial 1861 finished with value: 0.25844053185429033 and parameters: {'n_estimators': 1256, 'learning_rate': 0.0844353385803797, 'max_depth': 8, 'min_samples_split': 6, 'min_samples_leaf': 1, 'subsample': 0.7688258460458368, 'max_features': 'sqrt'}. Best is trial 1389 with value: 0.22332552856343169.
[I 2024-12-04 13:26:16,182] Trial 1859 finished with value: 0.3250600076043516 and parameters: {'n_estimators': 1129, 'learning_rate': 0.09286399922894378, 'max_depth': 8, 'min_samples_split': 5, 'min_samples_leaf': 1, 'subsample': 0.8064631573890075, 'max_features': None}. Best is trial 1389 with value: 0.22332552856343169.
[I 2024-12-04 13:26:20,030] Trial 1880 finished with value: 0.3874193437102012 and parameters: {'n_estimators': 428, 'learning_rate': 0.017075146696999194, 'max_depth': 4, 'min_samples_split': 3, 'min_samples_leaf': 1, 'subsample': 0.946873265538326, 'max_features': None}. Best is trial 1389 with value: 0.22332552856343169.
[I 2024-12-04 13:26:20,503] Trial 1851 finished with value: 0.42620168125448316 and parameters: {'n_estimators': 1481, 'learning_rate': 0.013706028337486112, 'max_depth': 12, 'min_samples_split': 12, 'min_samples_leaf': 5, 'subsample': 0.7567670259361415, 'max_features': None}. Best is trial 1389 with value: 0.22332552856343169.
[I 2024-12-04 13:26:22,641] Trial 1862 finished with value: 0.36602142307466373 and parameters: {'n_estimators': 1283, 'learning_rate': 0.09433637520110244, 'max_depth': 5, 'min_samples_split': 2, 'min_samples_leaf': 4, 'subsample': 0.7558596360803648, 'max_features': 'log2'}. Best is trial 1389 with value: 0.22332552856343169.
[I 2024-12-04 13:26:27,919] Trial 1891 finished with value: 1.143001401971347 and parameters: {'n_estimators': 130, 'learning_rate': 0.03576660094233299, 'max_depth': 5, 'min_samples_split': 15, 'min_samples_leaf': 10, 'subsample': 0.9232935441097371, 'max_features': 'log2'}. Best is trial 1389 with value: 0.22332552856343169.
