[I 2024-12-04 21:19:47,469] Trial 2198 finished with value: 0.14249507307529624 and parameters: {'kernel_type': 'Matern', 'length_scale': 0.12922169103570694, 'noise_level': 0.038372366183121814, 'constant_value': 8.396301252267866, 'nu': 1.5}. Best is trial 959 with value: 0.1375110730946576.
[I 2024-12-04 21:19:53,368] Trial 2202 finished with value: 0.14249501347345572 and parameters: {'kernel_type': 'Matern', 'length_scale': 8.995126480971166, 'noise_level': 0.024519366031059846, 'constant_value': 115.02214882154696, 'nu': 1.5}. Best is trial 959 with value: 0.1375110730946576.
[I 2024-12-04 21:19:54,438] Trial 2201 finished with value: 0.14249529887224455 and parameters: {'kernel_type': 'Matern', 'length_scale': 32.64810524118011, 'noise_level': 0.02752725229798637, 'constant_value': 107.07332095120142, 'nu': 1.5}. Best is trial 959 with value: 0.1375110730946576.
[I 2024-12-04 21:19:55,237] Trial 2203 finished with value: 0.1446988185328607 and parameters: {'kernel_type': 'Matern', 'length_scale': 225.0836601077558, 'noise_level': 0.21291709808295667, 'constant_value': 0.8239376968183534, 'nu': 2.5}. Best is trial 959 with value: 0.1375110730946576.
[I 2024-12-04 21:19:58,977] Trial 2205 finished with value: 0.9864686433922161 and parameters: {'kernel_type': 'Matern', 'length_scale': 0.08969704753980594, 'noise_level': 0.8944402023362451, 'constant_value': 2318.3359632568627, 'nu': 1.5}. Best is trial 959 with value: 0.1375110730946576.
[I 2024-12-04 21:20:00,375] Trial 2206 finished with value: 0.9982171004558085 and parameters: {'kernel_type': 'Matern', 'length_scale': 5880.478491507692, 'noise_level': 0.921175782199054, 'constant_value': 0.08992897750266578, 'nu': 1.5}. Best is trial 959 with value: 0.1375110730946576.
[I 2024-12-04 21:20:02,390] Trial 2204 finished with value: 0.1424949995504835 and parameters: {'kernel_type': 'Matern', 'length_scale': 475.2902279513079, 'noise_level': 0.8386249869146659, 'constant_value': 0.7574850590724949, 'nu': 1.5}. Best is trial 959 with value: 0.1375110730946576.
[I 2024-12-04 21:20:07,477] Trial 2208 finished with value: 0.14249506419611982 and parameters: {'kernel_type': 'Matern', 'length_scale': 3.251078526962065, 'noise_level': 0.03234899183199472, 'constant_value': 1.390684032757395, 'nu': 1.5}. Best is trial 959 with value: 0.1375110730946576.
[I 2024-12-04 21:20:09,954] Trial 2209 finished with value: 0.14469881846377353 and parameters: {'kernel_type': 'Matern', 'length_scale': 0.32624118142524344, 'noise_level': 0.10881651553951763, 'constant_value': 7590.986665957378, 'nu': 2.5}. Best is trial 959 with value: 0.1375110730946576.
[I 2024-12-04 21:20:10,508] Trial 2207 finished with value: 0.14249372148403755 and parameters: {'kernel_type': 'Matern', 'length_scale': 7.134608261304625, 'noise_level': 0.038576472840149874, 'constant_value': 0.08385983811982642, 'nu': 1.5}. Best is trial 959 with value: 0.1375110730946576.
[I 2024-12-04 21:20:14,487] Trial 2210 finished with value: 0.14249504017273684 and parameters: {'kernel_type': 'Matern', 'length_scale': 51.2520072547525, 'noise_level': 0.028356190622104534, 'constant_value': 0.715513041998392, 'nu': 1.5}. Best is trial 959 with value: 0.1375110730946576.
[I 2024-12-04 21:20:17,780] Trial 2212 finished with value: 0.14249518458336607 and parameters: {'kernel_type': 'Matern', 'length_scale': 0.31363937951935644, 'noise_level': 0.04081630309031376, 'constant_value': 1610.0379785815376, 'nu': 1.5}. Best is trial 959 with value: 0.1375110730946576.
[I 2024-12-04 21:20:23,032] Trial 2214 finished with value: 0.14249486515385154 and parameters: {'kernel_type': 'Matern', 'length_scale': 219.3301434885075, 'noise_level': 0.07288810235588904, 'constant_value': 49.503734053815954, 'nu': 1.5}. Best is trial 959 with value: 0.1375110730946576.
[I 2024-12-04 21:20:23,119] Trial 2211 finished with value: 0.14249471181685783 and parameters: {'kernel_type': 'Matern', 'length_scale': 12.515715223811208, 'noise_level': 0.8960386504297445, 'constant_value': 146.07287186829893, 'nu': 1.5}. Best is trial 959 with value: 0.1375110730946576.
[I 2024-12-04 21:20:23,213] Trial 2213 finished with value: 0.13769079504010187 and parameters: {'kernel_type': 'Matern', 'length_scale': 3.762440653875393, 'noise_level': 0.9908009542902892, 'constant_value': 553.0336155611942, 'nu': 1.5}. Best is trial 959 with value: 0.1375110730946576.
[I 2024-12-04 21:20:29,421] Trial 2216 finished with value: 0.14249501611348805 and parameters: {'kernel_type': 'Matern', 'length_scale': 0.37798216248300687, 'noise_level': 0.1571502501393984, 'constant_value': 12920.629586631274, 'nu': 1.5}. Best is trial 959 with value: 0.1375110730946576.
[I 2024-12-04 21:20:29,771] Trial 2215 finished with value: 0.14249507337033498 and parameters: {'kernel_type': 'Matern', 'length_scale': 0.4217301549175152, 'noise_level': 0.0332524994978454, 'constant_value': 46544.775950674615, 'nu': 1.5}. Best is trial 959 with value: 0.1375110730946576.
[I 2024-12-04 21:20:31,989] Trial 2217 finished with value: 0.13860899253539274 and parameters: {'kernel_type': 'Matern', 'length_scale': 3.858053638957221, 'noise_level': 0.21999573593550226, 'constant_value': 721.3691187006663, 'nu': 1.5}. Best is trial 959 with value: 0.1375110730946576.
[I 2024-12-04 21:20:35,924] Trial 2219 finished with value: 0.14249506107778862 and parameters: {'kernel_type': 'Matern', 'length_scale': 5.742790768068666, 'noise_level': 0.6349434139726048, 'constant_value': 25591.72415867485, 'nu': 1.5}. Best is trial 959 with value: 0.1375110730946576.
[I 2024-12-04 21:20:36,097] Trial 2218 finished with value: 0.14249510146733746 and parameters: {'kernel_type': 'Matern', 'length_scale': 3.8950506898225776, 'noise_level': 0.7452376961353683, 'constant_value': 113.07124667833493, 'nu': 1.5}. Best is trial 959 with value: 0.1375110730946576.
[I 2024-12-04 21:20:41,170] Trial 2221 finished with value: 0.19720002051561625 and parameters: {'kernel_type': 'Matern', 'length_scale': 29.003969230949405, 'noise_level': 0.2271972413399929, 'constant_value': 11347.194631483717, 'nu': 0.5}. Best is trial 959 with value: 0.1375110730946576.
[I 2024-12-04 21:20:43,377] Trial 2222 finished with value: 0.14249506888482963 and parameters: {'kernel_type': 'Matern', 'length_scale': 246.31550234458138, 'noise_level': 0.9030897524572681, 'constant_value': 380.4184882621593, 'nu': 1.5}. Best is trial 959 with value: 0.1375110730946576.
[I 2024-12-04 21:20:44,487] Trial 2220 finished with value: 0.14249509421337872 and parameters: {'kernel_type': 'Matern', 'length_scale': 0.15041883040306053, 'noise_level': 0.769173020445894, 'constant_value': 18708.352670607153, 'nu': 1.5}. Best is trial 959 with value: 0.1375110730946576.
[I 2024-12-04 21:20:49,301] Trial 2224 finished with value: 0.14249501808805218 and parameters: {'kernel_type': 'Matern', 'length_scale': 33.62667830239342, 'noise_level': 0.25810183615246135, 'constant_value': 1542.8268104512074, 'nu': 1.5}. Best is trial 959 with value: 0.1375110730946576.
[I 2024-12-04 21:20:51,030] Trial 2225 finished with value: 0.14249507935706363 and parameters: {'kernel_type': 'Matern', 'length_scale': 5.721297417835307, 'noise_level': 0.03129715096937013, 'constant_value': 203.99418344617857, 'nu': 1.5}. Best is trial 959 with value: 0.1375110730946576.
[I 2024-12-04 21:20:53,622] Trial 2223 finished with value: 0.14249509933701682 and parameters: {'kernel_type': 'Matern', 'length_scale': 1.464103736323893, 'noise_level': 0.12351735256273648, 'constant_value': 903.4053451725243, 'nu': 1.5}. Best is trial 959 with value: 0.1375110730946576.
[I 2024-12-04 21:20:55,514] Trial 2226 finished with value: 0.1971999296591518 and parameters: {'kernel_type': 'Matern', 'length_scale': 1.9310109878567139, 'noise_level': 0.8248815290598122, 'constant_value': 18.2107600248069, 'nu': 0.5}. Best is trial 959 with value: 0.1375110730946576.
[I 2024-12-04 21:20:58,324] Trial 2227 finished with value: 0.14249482083415196 and parameters: {'kernel_type': 'Matern', 'length_scale': 5.4301435924297525, 'noise_level': 0.8736967421071762, 'constant_value': 285.27219652482034, 'nu': 1.5}. Best is trial 959 with value: 0.1375110730946576.
[I 2024-12-04 21:21:02,200] Trial 2228 finished with value: 0.14249506928499742 and parameters: {'kernel_type': 'Matern', 'length_scale': 10.02783487691094, 'noise_level': 0.08110769069242453, 'constant_value': 319.83299387053637, 'nu': 1.5}. Best is trial 959 with value: 0.1375110730946576.
[I 2024-12-04 21:21:02,305] Trial 2229 finished with value: 0.14249517735341913 and parameters: {'kernel_type': 'Matern', 'length_scale': 8.249317521221421, 'noise_level': 0.10840197317907485, 'constant_value': 5394.510930775236, 'nu': 1.5}. Best is trial 959 with value: 0.1375110730946576.
[I 2024-12-04 21:21:07,949] Trial 2230 finished with value: 0.9864686819258531 and parameters: {'kernel_type': 'Matern', 'length_scale': 67217.24499603696, 'noise_level': 3.866814208096959e-07, 'constant_value': 2.343996147129284, 'nu': 2.5}. Best is trial 959 with value: 0.1375110730946576.
[I 2024-12-04 21:21:09,107] Trial 2231 finished with value: 0.14249497003790149 and parameters: {'kernel_type': 'Matern', 'length_scale': 3.5744818956083884, 'noise_level': 0.7521613216165138, 'constant_value': 1177.1059167024048, 'nu': 1.5}. Best is trial 959 with value: 0.1375110730946576.
[I 2024-12-04 21:21:12,445] Trial 2232 finished with value: 0.1384282179402027 and parameters: {'kernel_type': 'Matern', 'length_scale': 0.32758820352349255, 'noise_level': 0.049868097480077506, 'constant_value': 102.29196696931974, 'nu': 1.5}. Best is trial 959 with value: 0.1375110730946576.
[I 2024-12-04 21:21:13,778] Trial 2234 finished with value: 0.9864686819290265 and parameters: {'kernel_type': 'RBF', 'length_scale': 1.314089749367097e-05, 'noise_level': 0.0816328570762605, 'constant_value': 59015.111916700385, 'nu': 1.5}. Best is trial 959 with value: 0.1375110730946576.
[I 2024-12-04 21:21:15,423] Trial 2233 finished with value: 0.14249508418608617 and parameters: {'kernel_type': 'Matern', 'length_scale': 2.5688090205026928, 'noise_level': 0.7436155606569346, 'constant_value': 6247.808875762736, 'nu': 1.5}. Best is trial 959 with value: 0.1375110730946576.
[I 2024-12-04 21:21:18,507] Trial 2235 finished with value: 0.14249494358108553 and parameters: {'kernel_type': 'Matern', 'length_scale': 109.3408700487867, 'noise_level': 0.5878127271202939, 'constant_value': 1022.6851228149641, 'nu': 1.5}. Best is trial 959 with value: 0.1375110730946576.
[I 2024-12-04 21:21:18,513] Trial 2236 finished with value: 0.14469871127503847 and parameters: {'kernel_type': 'Matern', 'length_scale': 7.833524723783552, 'noise_level': 0.06753416181445045, 'constant_value': 153.34670384894767, 'nu': 2.5}. Best is trial 959 with value: 0.1375110730946576.
[I 2024-12-04 21:21:22,944] Trial 2237 finished with value: 0.1424950767882807 and parameters: {'kernel_type': 'Matern', 'length_scale': 227.08015350404867, 'noise_level': 0.0569992070853628, 'constant_value': 28.786081698510728, 'nu': 1.5}. Best is trial 959 with value: 0.1375110730946576.
[I 2024-12-04 21:21:24,744] Trial 2238 finished with value: 0.1424950627266732 and parameters: {'kernel_type': 'Matern', 'length_scale': 23.770165786576463, 'noise_level': 0.026231059764889934, 'constant_value': 816.7325078585912, 'nu': 1.5}. Best is trial 959 with value: 0.1375110730946576.
[I 2024-12-04 21:21:26,079] Trial 2239 finished with value: 0.1972000307953986 and parameters: {'kernel_type': 'Matern', 'length_scale': 187.2101927756704, 'noise_level': 0.7843666270600754, 'constant_value': 0.051863251184856456, 'nu': 0.5}. Best is trial 959 with value: 0.1375110730946576.
[I 2024-12-04 21:21:30,628] Trial 2242 finished with value: 0.9864684668685864 and parameters: {'kernel_type': 'Matern', 'length_scale': 0.09896842911347785, 'noise_level': 0.035632586151290814, 'constant_value': 1391.497193589191, 'nu': 1.5}. Best is trial 959 with value: 0.1375110730946576.
[I 2024-12-04 21:21:33,165] Trial 2241 finished with value: 0.986468682051874 and parameters: {'kernel_type': 'Matern', 'length_scale': 1237.2173498496543, 'noise_level': 0.014980254268130974, 'constant_value': 4.449404572404432, 'nu': 1.5}. Best is trial 959 with value: 0.1375110730946576.
[I 2024-12-04 21:21:33,997] Trial 2240 finished with value: 0.14249508930455151 and parameters: {'kernel_type': 'Matern', 'length_scale': 12.904267166304923, 'noise_level': 0.06687578734440287, 'constant_value': 306.58848692419406, 'nu': 1.5}. Best is trial 959 with value: 0.1375110730946576.
[I 2024-12-04 21:21:38,596] Trial 2243 finished with value: 0.986468681922024 and parameters: {'kernel_type': 'Matern', 'length_scale': 5.177408418761204, 'noise_level': 1.734315045663847e-10, 'constant_value': 1.6358668955728095e-07, 'nu': 0.5}. Best is trial 959 with value: 0.1375110730946576.
[I 2024-12-04 21:21:41,529] Trial 2244 finished with value: 0.1424951164605292 and parameters: {'kernel_type': 'Matern', 'length_scale': 0.5416599197728456, 'noise_level': 0.555362047257263, 'constant_value': 216.8981665696777, 'nu': 1.5}. Best is trial 959 with value: 0.1375110730946576.
[I 2024-12-04 21:21:43,478] Trial 2246 finished with value: 0.14771027346369675 and parameters: {'kernel_type': 'RBF', 'length_scale': 137.85033105668018, 'noise_level': 0.3588582645789696, 'constant_value': 44.20834564238991, 'nu': 1.5}. Best is trial 959 with value: 0.1375110730946576.
[I 2024-12-04 21:21:45,101] Trial 2245 finished with value: 0.142494995269163 and parameters: {'kernel_type': 'Matern', 'length_scale': 0.1558218157644303, 'noise_level': 0.8611973336532885, 'constant_value': 349.7284973940933, 'nu': 1.5}. Best is trial 959 with value: 0.1375110730946576.
[I 2024-12-04 21:21:49,540] Trial 2247 finished with value: 0.14249506664497558 and parameters: {'kernel_type': 'Matern', 'length_scale': 51.26068825822835, 'noise_level': 0.8604530621127308, 'constant_value': 63.50988638450218, 'nu': 1.5}. Best is trial 959 with value: 0.1375110730946576.
[I 2024-12-04 21:21:50,422] Trial 2248 finished with value: 0.14249506354889854 and parameters: {'kernel_type': 'Matern', 'length_scale': 10.859478418125148, 'noise_level': 0.01880891934450757, 'constant_value': 63.679678066052915, 'nu': 1.5}. Best is trial 959 with value: 0.1375110730946576.
[I 2024-12-04 21:21:51,865] Trial 2249 finished with value: 0.1424950258403373 and parameters: {'kernel_type': 'Matern', 'length_scale': 308.48653319240645, 'noise_level': 0.7515915361112642, 'constant_value': 714.0195919907968, 'nu': 1.5}. Best is trial 959 with value: 0.1375110730946576.
[I 2024-12-04 21:21:55,948] Trial 2250 finished with value: 0.19720030262554233 and parameters: {'kernel_type': 'Matern', 'length_scale': 4120.48950157501, 'noise_level': 0.8161270816287562, 'constant_value': 416.03367243565356, 'nu': 0.5}. Best is trial 959 with value: 0.1375110730946576.
[I 2024-12-04 21:21:56,740] Trial 2251 finished with value: 0.14771037878204604 and parameters: {'kernel_type': 'RBF', 'length_scale': 9.699390231520137, 'noise_level': 0.0058076802988005286, 'constant_value': 12.587156102428965, 'nu': 2.5}. Best is trial 959 with value: 0.1375110730946576.
[I 2024-12-04 21:22:00,386] Trial 2252 finished with value: 0.142495062933956 and parameters: {'kernel_type': 'Matern', 'length_scale': 159.36400333738933, 'noise_level': 0.9892931521012935, 'constant_value': 16.27130202838955, 'nu': 1.5}. Best is trial 959 with value: 0.1375110730946576.
[I 2024-12-04 21:22:03,654] Trial 2254 finished with value: 0.1424950059955735 and parameters: {'kernel_type': 'Matern', 'length_scale': 219.5034957119033, 'noise_level': 0.7926311586668685, 'constant_value': 3511.1189518435813, 'nu': 1.5}. Best is trial 959 with value: 0.1375110730946576.
[I 2024-12-04 21:22:08,391] Trial 2255 finished with value: 0.998217098262073 and parameters: {'kernel_type': 'RBF', 'length_scale': 3.4321956722783984, 'noise_level': 0.0192518786589386, 'constant_value': 6.276418934038548e-07, 'nu': 1.5}. Best is trial 959 with value: 0.1375110730946576.
[I 2024-12-04 21:22:09,611] Trial 2253 finished with value: 0.9864686819481716 and parameters: {'kernel_type': 'Matern', 'length_scale': 3.2632638485594706e-05, 'noise_level': 0.013629557052933335, 'constant_value': 7.730536547775131e-06, 'nu': 0.5}. Best is trial 959 with value: 0.1375110730946576.
[I 2024-12-04 21:22:14,383] Trial 2257 finished with value: 0.9864686819279815 and parameters: {'kernel_type': 'Matern', 'length_scale': 0.03281067358957811, 'noise_level': 0.8868812353234415, 'constant_value': 253.28348698979656, 'nu': 1.5}. Best is trial 959 with value: 0.1375110730946576.
[I 2024-12-04 21:22:17,378] Trial 2258 finished with value: 0.19720002811097564 and parameters: {'kernel_type': 'Matern', 'length_scale': 11.327809243977605, 'noise_level': 0.0011117362620014196, 'constant_value': 12.437230646436763, 'nu': 0.5}. Best is trial 959 with value: 0.1375110730946576.
[I 2024-12-04 21:22:17,838] Trial 2256 finished with value: 0.14249498667621885 and parameters: {'kernel_type': 'Matern', 'length_scale': 0.14162792688099762, 'noise_level': 0.0011425975580819066, 'constant_value': 35.5196439158235, 'nu': 1.5}. Best is trial 959 with value: 0.1375110730946576.
[I 2024-12-04 21:22:21,928] Trial 2259 finished with value: 0.14249529360740068 and parameters: {'kernel_type': 'Matern', 'length_scale': 2.0562786594420235, 'noise_level': 0.9793205873474146, 'constant_value': 1671.4059569127187, 'nu': 1.5}. Best is trial 959 with value: 0.1375110730946576.
[I 2024-12-04 21:22:22,656] Trial 2260 finished with value: 0.9864686818739108 and parameters: {'kernel_type': 'RBF', 'length_scale': 0.06694694818934536, 'noise_level': 0.5604849759712716, 'constant_value': 43.43238992155532, 'nu': 1.5}. Best is trial 959 with value: 0.1375110730946576.
[I 2024-12-04 21:22:25,851] Trial 2261 finished with value: 0.14249494640608942 and parameters: {'kernel_type': 'Matern', 'length_scale': 0.401418490959023, 'noise_level': 0.9320579876957313, 'constant_value': 15836.47313319089, 'nu': 1.5}. Best is trial 959 with value: 0.1375110730946576.
[I 2024-12-04 21:22:30,184] Trial 2262 finished with value: 0.14249506451540014 and parameters: {'kernel_type': 'Matern', 'length_scale': 42.603330404997706, 'noise_level': 0.0397306486469835, 'constant_value': 8.194414746293754, 'nu': 1.5}. Best is trial 959 with value: 0.1375110730946576.
[I 2024-12-04 21:22:32,755] Trial 2263 finished with value: 0.1424951575244576 and parameters: {'kernel_type': 'Matern', 'length_scale': 2156.0848862660305, 'noise_level': 0.7563222371147174, 'constant_value': 3.189872175132335, 'nu': 1.5}. Best is trial 959 with value: 0.1375110730946576.
[I 2024-12-04 21:22:33,624] Trial 2264 finished with value: 0.986468681886583 and parameters: {'kernel_type': 'Matern', 'length_scale': 1716.0952152762572, 'noise_level': 0.016387857024951092, 'constant_value': 46.7594182833008, 'nu': 1.5}. Best is trial 959 with value: 0.1375110730946576.
[I 2024-12-04 21:22:37,913] Trial 2265 finished with value: 0.1424950658859485 and parameters: {'kernel_type': 'Matern', 'length_scale': 73.33368483970943, 'noise_level': 0.036670638135803776, 'constant_value': 0.6256023254325607, 'nu': 1.5}. Best is trial 959 with value: 0.1375110730946576.
[I 2024-12-04 21:22:40,931] Trial 2266 finished with value: 0.142495097102548 and parameters: {'kernel_type': 'Matern', 'length_scale': 16.62575785913386, 'noise_level': 0.8675208266678441, 'constant_value': 137.21755607944704, 'nu': 1.5}. Best is trial 959 with value: 0.1375110730946576.
[I 2024-12-04 21:22:42,855] Trial 2267 finished with value: 0.14249515598041698 and parameters: {'kernel_type': 'Matern', 'length_scale': 1.5199345723945883, 'noise_level': 0.04370224575253222, 'constant_value': 22.226682327257684, 'nu': 1.5}. Best is trial 959 with value: 0.1375110730946576.
[I 2024-12-04 21:22:43,187] Trial 2268 finished with value: 0.9864686819049513 and parameters: {'kernel_type': 'Matern', 'length_scale': 0.030363019986262237, 'noise_level': 0.24537501322047747, 'constant_value': 5309.652600385382, 'nu': 0.5}. Best is trial 959 with value: 0.1375110730946576.
[I 2024-12-04 21:22:47,851] Trial 2269 finished with value: 0.14249505953823635 and parameters: {'kernel_type': 'Matern', 'length_scale': 11.57347014228024, 'noise_level': 0.0017081738011356686, 'constant_value': 10.949781447171539, 'nu': 1.5}. Best is trial 959 with value: 0.1375110730946576.
[I 2024-12-04 21:22:47,934] Trial 2271 finished with value: 0.9864686819235162 and parameters: {'kernel_type': 'Matern', 'length_scale': 0.0014080435678331539, 'noise_level': 0.01656927174647608, 'constant_value': 6121.923928585336, 'nu': 1.5}. Best is trial 959 with value: 0.1375110730946576.
[I 2024-12-04 21:22:54,550] Trial 2270 finished with value: 0.14249494169006321 and parameters: {'kernel_type': 'Matern', 'length_scale': 101.21236714627742, 'noise_level': 0.03969117930570726, 'constant_value': 140.43650581672057, 'nu': 1.5}. Best is trial 959 with value: 0.1375110730946576.
[I 2024-12-04 21:22:56,474] Trial 2273 finished with value: 0.9864686819193658 and parameters: {'kernel_type': 'Matern', 'length_scale': 1030.8777676772645, 'noise_level': 0.025694177908075173, 'constant_value': 0.035973706544332684, 'nu': 1.5}. Best is trial 959 with value: 0.1375110730946576.
[I 2024-12-04 21:22:57,638] Trial 2272 finished with value: 0.14249557566572132 and parameters: {'kernel_type': 'Matern', 'length_scale': 0.24679685509582727, 'noise_level': 0.8435213734439769, 'constant_value': 193.01896506045904, 'nu': 1.5}. Best is trial 959 with value: 0.1375110730946576.
[I 2024-12-04 21:23:03,144] Trial 2275 finished with value: 0.14249502055539678 and parameters: {'kernel_type': 'Matern', 'length_scale': 76.93413465513275, 'noise_level': 0.9822696715094085, 'constant_value': 4255.448468526933, 'nu': 1.5}. Best is trial 959 with value: 0.1375110730946576.
