[I 2024-12-04 20:35:07,941] Trial 2390 finished with value: 1.1907212370083426 and parameters: {'n_estimators': 672, 'max_depth': 15, 'min_samples_split': 2, 'min_samples_leaf': 11, 'max_features': 'sqrt', 'bootstrap': False, 'criterion': 'squared_error'}. Best is trial 1631 with value: 0.32128932742921457.
[I 2024-12-04 20:35:09,822] Trial 2392 finished with value: 0.5097985986384967 and parameters: {'n_estimators': 286, 'max_depth': 50, 'min_samples_split': 2, 'min_samples_leaf': 1, 'max_features': 'log2', 'bootstrap': False, 'criterion': 'squared_error'}. Best is trial 1631 with value: 0.32128932742921457.
[I 2024-12-04 20:35:10,472] Trial 2391 finished with value: 0.5373549484476299 and parameters: {'n_estimators': 372, 'max_depth': 40, 'min_samples_split': 4, 'min_samples_leaf': 2, 'max_features': None, 'bootstrap': False, 'criterion': 'squared_error'}. Best is trial 1631 with value: 0.32128932742921457.
[I 2024-12-04 20:35:10,765] Trial 2393 finished with value: 0.3226231527741188 and parameters: {'n_estimators': 407, 'max_depth': 50, 'min_samples_split': 2, 'min_samples_leaf': 1, 'max_features': 'sqrt', 'bootstrap': False, 'criterion': 'squared_error'}. Best is trial 1631 with value: 0.32128932742921457.
[I 2024-12-04 20:35:12,327] Trial 2394 finished with value: 1.2455666685661104 and parameters: {'n_estimators': 283, 'max_depth': 47, 'min_samples_split': 10, 'min_samples_leaf': 2, 'max_features': 'log2', 'bootstrap': True, 'criterion': 'absolute_error'}. Best is trial 1631 with value: 0.32128932742921457.
[I 2024-12-04 20:35:12,612] Trial 2395 finished with value: 0.6944832461916848 and parameters: {'n_estimators': 439, 'max_depth': 42, 'min_samples_split': 2, 'min_samples_leaf': 2, 'max_features': 'sqrt', 'bootstrap': False, 'criterion': 'squared_error'}. Best is trial 1631 with value: 0.32128932742921457.
[I 2024-12-04 20:35:12,768] Trial 2396 finished with value: 1.228981710535508 and parameters: {'n_estimators': 554, 'max_depth': 29, 'min_samples_split': 7, 'min_samples_leaf': 13, 'max_features': 'sqrt', 'bootstrap': True, 'criterion': 'squared_error'}. Best is trial 1631 with value: 0.32128932742921457.
[I 2024-12-04 20:35:14,283] Trial 2397 finished with value: 0.6694172780958675 and parameters: {'n_estimators': 361, 'max_depth': 50, 'min_samples_split': 2, 'min_samples_leaf': 2, 'max_features': 'sqrt', 'bootstrap': False, 'criterion': 'squared_error'}. Best is trial 1631 with value: 0.32128932742921457.
[I 2024-12-04 20:35:14,611] Trial 2399 finished with value: 0.6797073490375742 and parameters: {'n_estimators': 319, 'max_depth': 41, 'min_samples_split': 3, 'min_samples_leaf': 2, 'max_features': 'sqrt', 'bootstrap': False, 'criterion': 'squared_error'}. Best is trial 1631 with value: 0.32128932742921457.
[I 2024-12-04 20:35:15,384] Trial 2398 finished with value: 0.34469636675244075 and parameters: {'n_estimators': 306, 'max_depth': 43, 'min_samples_split': 2, 'min_samples_leaf': 1, 'max_features': 'sqrt', 'bootstrap': False, 'criterion': 'squared_error'}. Best is trial 1631 with value: 0.32128932742921457.
[I 2024-12-04 20:35:16,459] Trial 2400 finished with value: 0.6914186741956331 and parameters: {'n_estimators': 444, 'max_depth': 50, 'min_samples_split': 2, 'min_samples_leaf': 2, 'max_features': 'sqrt', 'bootstrap': False, 'criterion': 'squared_error'}. Best is trial 1631 with value: 0.32128932742921457.
[I 2024-12-04 20:35:17,420] Trial 2401 finished with value: 1.211725253759598 and parameters: {'n_estimators': 867, 'max_depth': 32, 'min_samples_split': 36, 'min_samples_leaf': 10, 'max_features': 'sqrt', 'bootstrap': True, 'criterion': 'squared_error'}. Best is trial 1631 with value: 0.32128932742921457.
[I 2024-12-04 20:35:18,977] Trial 2402 finished with value: 0.4088320977987263 and parameters: {'n_estimators': 588, 'max_depth': 49, 'min_samples_split': 3, 'min_samples_leaf': 1, 'max_features': 'sqrt', 'bootstrap': True, 'criterion': 'squared_error'}. Best is trial 1631 with value: 0.32128932742921457.
[I 2024-12-04 20:35:19,496] Trial 2404 finished with value: 0.38601177540697396 and parameters: {'n_estimators': 354, 'max_depth': 50, 'min_samples_split': 4, 'min_samples_leaf': 1, 'max_features': 'sqrt', 'bootstrap': False, 'criterion': 'squared_error'}. Best is trial 1631 with value: 0.32128932742921457.
[I 2024-12-04 20:35:19,923] Trial 2403 finished with value: 0.32470043509365365 and parameters: {'n_estimators': 434, 'max_depth': 50, 'min_samples_split': 2, 'min_samples_leaf': 1, 'max_features': 'sqrt', 'bootstrap': False, 'criterion': 'squared_error'}. Best is trial 1631 with value: 0.32128932742921457.
[I 2024-12-04 20:35:21,413] Trial 2405 finished with value: 0.4222696844008122 and parameters: {'n_estimators': 458, 'max_depth': 41, 'min_samples_split': 4, 'min_samples_leaf': 1, 'max_features': 'sqrt', 'bootstrap': False, 'criterion': 'squared_error'}. Best is trial 1631 with value: 0.32128932742921457.
[I 2024-12-04 20:35:21,495] Trial 2407 finished with value: 0.795551539032219 and parameters: {'n_estimators': 350, 'max_depth': 49, 'min_samples_split': 2, 'min_samples_leaf': 2, 'max_features': 'sqrt', 'bootstrap': True, 'criterion': 'squared_error'}. Best is trial 1631 with value: 0.32128932742921457.
[I 2024-12-04 20:35:24,097] Trial 2408 finished with value: 0.35142872072873427 and parameters: {'n_estimators': 431, 'max_depth': 43, 'min_samples_split': 2, 'min_samples_leaf': 1, 'max_features': 'sqrt', 'bootstrap': False, 'criterion': 'squared_error'}. Best is trial 1631 with value: 0.32128932742921457.
[I 2024-12-04 20:35:25,130] Trial 2409 finished with value: 1.3043378768304885 and parameters: {'n_estimators': 895, 'max_depth': 10, 'min_samples_split': 2, 'min_samples_leaf': 4, 'max_features': 'log2', 'bootstrap': False, 'criterion': 'absolute_error'}. Best is trial 1631 with value: 0.32128932742921457.
[I 2024-12-04 20:35:26,190] Trial 2410 finished with value: 0.35953997415923294 and parameters: {'n_estimators': 383, 'max_depth': 50, 'min_samples_split': 3, 'min_samples_leaf': 1, 'max_features': 'sqrt', 'bootstrap': False, 'criterion': 'squared_error'}. Best is trial 1631 with value: 0.32128932742921457.
[I 2024-12-04 20:35:27,418] Trial 2411 finished with value: 0.32382732250479473 and parameters: {'n_estimators': 358, 'max_depth': 50, 'min_samples_split': 2, 'min_samples_leaf': 1, 'max_features': 'sqrt', 'bootstrap': False, 'criterion': 'squared_error'}. Best is trial 1631 with value: 0.32128932742921457.
[I 2024-12-04 20:35:28,236] Trial 2406 finished with value: 0.39706513165477153 and parameters: {'n_estimators': 310, 'max_depth': 42, 'min_samples_split': 2, 'min_samples_leaf': 1, 'max_features': 'sqrt', 'bootstrap': False, 'criterion': 'absolute_error'}. Best is trial 1631 with value: 0.32128932742921457.
[I 2024-12-04 20:35:28,817] Trial 2412 finished with value: 0.41610924516085845 and parameters: {'n_estimators': 473, 'max_depth': 35, 'min_samples_split': 2, 'min_samples_leaf': 1, 'max_features': 'sqrt', 'bootstrap': False, 'criterion': 'squared_error'}. Best is trial 1631 with value: 0.32128932742921457.
[I 2024-12-04 20:35:29,937] Trial 2413 finished with value: 0.39187656558777983 and parameters: {'n_estimators': 473, 'max_depth': 50, 'min_samples_split': 4, 'min_samples_leaf': 1, 'max_features': 'sqrt', 'bootstrap': False, 'criterion': 'squared_error'}. Best is trial 1631 with value: 0.32128932742921457.
[I 2024-12-04 20:35:30,607] Trial 2414 finished with value: 0.4186810160231323 and parameters: {'n_estimators': 465, 'max_depth': 42, 'min_samples_split': 4, 'min_samples_leaf': 1, 'max_features': 'sqrt', 'bootstrap': False, 'criterion': 'squared_error'}. Best is trial 1631 with value: 0.32128932742921457.
[I 2024-12-04 20:35:31,858] Trial 2415 finished with value: 0.32303015618779657 and parameters: {'n_estimators': 368, 'max_depth': 50, 'min_samples_split': 2, 'min_samples_leaf': 1, 'max_features': 'sqrt', 'bootstrap': False, 'criterion': 'squared_error'}. Best is trial 1631 with value: 0.32128932742921457.
[I 2024-12-04 20:35:32,043] Trial 2416 finished with value: 1.281744099392488 and parameters: {'n_estimators': 657, 'max_depth': 48, 'min_samples_split': 14, 'min_samples_leaf': 12, 'max_features': 'log2', 'bootstrap': True, 'criterion': 'squared_error'}. Best is trial 1631 with value: 0.32128932742921457.
[I 2024-12-04 20:35:33,526] Trial 2419 finished with value: 0.6765820558899209 and parameters: {'n_estimators': 268, 'max_depth': 42, 'min_samples_split': 3, 'min_samples_leaf': 2, 'max_features': 'sqrt', 'bootstrap': False, 'criterion': 'squared_error'}. Best is trial 1631 with value: 0.32128932742921457.
[I 2024-12-04 20:35:34,068] Trial 2418 finished with value: 0.6196342083589508 and parameters: {'n_estimators': 500, 'max_depth': 42, 'min_samples_split': 3, 'min_samples_leaf': 1, 'max_features': 'log2', 'bootstrap': False, 'criterion': 'squared_error'}. Best is trial 1631 with value: 0.32128932742921457.
[I 2024-12-04 20:35:34,933] Trial 2417 finished with value: 0.32789474722313194 and parameters: {'n_estimators': 552, 'max_depth': 50, 'min_samples_split': 2, 'min_samples_leaf': 1, 'max_features': 'sqrt', 'bootstrap': False, 'criterion': 'squared_error'}. Best is trial 1631 with value: 0.32128932742921457.
[I 2024-12-04 20:35:36,504] Trial 2422 finished with value: 0.6735719856257513 and parameters: {'n_estimators': 366, 'max_depth': 50, 'min_samples_split': 2, 'min_samples_leaf': 2, 'max_features': 'sqrt', 'bootstrap': False, 'criterion': 'squared_error'}. Best is trial 1631 with value: 0.32128932742921457.
[I 2024-12-04 20:35:36,588] Trial 2420 finished with value: 1.2896003981149335 and parameters: {'n_estimators': 886, 'max_depth': 42, 'min_samples_split': 6, 'min_samples_leaf': 9, 'max_features': 'sqrt', 'bootstrap': True, 'criterion': 'absolute_error'}. Best is trial 1631 with value: 0.32128932742921457.
[I 2024-12-04 20:35:36,594] Trial 2421 finished with value: 0.34676759241948407 and parameters: {'n_estimators': 313, 'max_depth': 42, 'min_samples_split': 2, 'min_samples_leaf': 1, 'max_features': 'sqrt', 'bootstrap': False, 'criterion': 'squared_error'}. Best is trial 1631 with value: 0.32128932742921457.
[I 2024-12-04 20:35:38,741] Trial 2423 finished with value: 0.3556407081906021 and parameters: {'n_estimators': 312, 'max_depth': 50, 'min_samples_split': 3, 'min_samples_leaf': 1, 'max_features': 'sqrt', 'bootstrap': False, 'criterion': 'squared_error'}. Best is trial 1631 with value: 0.32128932742921457.
[I 2024-12-04 20:35:39,757] Trial 2425 finished with value: 0.3492130048765678 and parameters: {'n_estimators': 409, 'max_depth': 44, 'min_samples_split': 2, 'min_samples_leaf': 1, 'max_features': 'sqrt', 'bootstrap': False, 'criterion': 'squared_error'}. Best is trial 1631 with value: 0.32128932742921457.
[I 2024-12-04 20:35:39,968] Trial 2424 finished with value: 0.3569237363171638 and parameters: {'n_estimators': 468, 'max_depth': 42, 'min_samples_split': 2, 'min_samples_leaf': 1, 'max_features': 'sqrt', 'bootstrap': False, 'criterion': 'squared_error'}. Best is trial 1631 with value: 0.32128932742921457.
[I 2024-12-04 20:35:40,669] Trial 2426 finished with value: 0.6778799807540871 and parameters: {'n_estimators': 385, 'max_depth': 50, 'min_samples_split': 3, 'min_samples_leaf': 2, 'max_features': 'sqrt', 'bootstrap': False, 'criterion': 'squared_error'}. Best is trial 1631 with value: 0.32128932742921457.
[I 2024-12-04 20:35:41,961] Trial 2429 finished with value: 0.6489133824270209 and parameters: {'n_estimators': 107, 'max_depth': 45, 'min_samples_split': 11, 'min_samples_leaf': 10, 'max_features': None, 'bootstrap': True, 'criterion': 'squared_error'}. Best is trial 1631 with value: 0.32128932742921457.
[I 2024-12-04 20:35:42,367] Trial 2427 finished with value: 0.43325868649429194 and parameters: {'n_estimators': 442, 'max_depth': 38, 'min_samples_split': 2, 'min_samples_leaf': 1, 'max_features': 'sqrt', 'bootstrap': True, 'criterion': 'squared_error'}. Best is trial 1631 with value: 0.32128932742921457.
[I 2024-12-04 20:35:43,196] Trial 2428 finished with value: 0.32339470343049653 and parameters: {'n_estimators': 411, 'max_depth': 50, 'min_samples_split': 2, 'min_samples_leaf': 1, 'max_features': 'sqrt', 'bootstrap': False, 'criterion': 'squared_error'}. Best is trial 1631 with value: 0.32128932742921457.
[I 2024-12-04 20:35:44,570] Trial 2430 finished with value: 0.8116968850185005 and parameters: {'n_estimators': 967, 'max_depth': 21, 'min_samples_split': 50, 'min_samples_leaf': 1, 'max_features': 'sqrt', 'bootstrap': False, 'criterion': 'squared_error'}. Best is trial 1631 with value: 0.32128932742921457.
[I 2024-12-04 20:35:44,571] Trial 2432 finished with value: 0.6718412441473364 and parameters: {'n_estimators': 305, 'max_depth': 43, 'min_samples_split': 2, 'min_samples_leaf': 2, 'max_features': 'sqrt', 'bootstrap': False, 'criterion': 'squared_error'}. Best is trial 1631 with value: 0.32128932742921457.
[I 2024-12-04 20:35:44,637] Trial 2431 finished with value: 0.34624328097993073 and parameters: {'n_estimators': 264, 'max_depth': 42, 'min_samples_split': 2, 'min_samples_leaf': 1, 'max_features': 'sqrt', 'bootstrap': False, 'criterion': 'squared_error'}. Best is trial 1631 with value: 0.32128932742921457.
[I 2024-12-04 20:35:47,501] Trial 2433 finished with value: 0.3466867921548987 and parameters: {'n_estimators': 340, 'max_depth': 43, 'min_samples_split': 2, 'min_samples_leaf': 1, 'max_features': 'sqrt', 'bootstrap': False, 'criterion': 'squared_error'}. Best is trial 1631 with value: 0.32128932742921457.
[I 2024-12-04 20:35:47,592] Trial 2435 finished with value: 0.3233400304361499 and parameters: {'n_estimators': 418, 'max_depth': 50, 'min_samples_split': 2, 'min_samples_leaf': 1, 'max_features': 'sqrt', 'bootstrap': False, 'criterion': 'squared_error'}. Best is trial 1631 with value: 0.32128932742921457.
[I 2024-12-04 20:35:48,572] Trial 2434 finished with value: 0.5219805703062164 and parameters: {'n_estimators': 463, 'max_depth': 12, 'min_samples_split': 10, 'min_samples_leaf': 1, 'max_features': None, 'bootstrap': False, 'criterion': 'squared_error'}. Best is trial 1631 with value: 0.32128932742921457.
[I 2024-12-04 20:35:50,253] Trial 2437 finished with value: 0.3474900369314833 and parameters: {'n_estimators': 317, 'max_depth': 44, 'min_samples_split': 2, 'min_samples_leaf': 1, 'max_features': 'sqrt', 'bootstrap': False, 'criterion': 'squared_error'}. Best is trial 1631 with value: 0.32128932742921457.
[I 2024-12-04 20:35:50,255] Trial 2436 finished with value: 0.7253022081521201 and parameters: {'n_estimators': 765, 'max_depth': 29, 'min_samples_split': 21, 'min_samples_leaf': 1, 'max_features': 'sqrt', 'bootstrap': True, 'criterion': 'squared_error'}. Best is trial 1631 with value: 0.32128932742921457.
[I 2024-12-04 20:35:51,053] Trial 2438 finished with value: 0.6772119388623624 and parameters: {'n_estimators': 620, 'max_depth': 44, 'min_samples_split': 2, 'min_samples_leaf': 2, 'max_features': 'sqrt', 'bootstrap': False, 'criterion': 'squared_error'}. Best is trial 1631 with value: 0.32128932742921457.
[I 2024-12-04 20:35:52,638] Trial 2441 finished with value: 1.217729203509987 and parameters: {'n_estimators': 276, 'max_depth': 7, 'min_samples_split': 2, 'min_samples_leaf': 11, 'max_features': 'sqrt', 'bootstrap': True, 'criterion': 'squared_error'}. Best is trial 1631 with value: 0.32128932742921457.
[I 2024-12-04 20:35:52,717] Trial 2439 finished with value: 0.4090579022892968 and parameters: {'n_estimators': 433, 'max_depth': 50, 'min_samples_split': 3, 'min_samples_leaf': 1, 'max_features': 'sqrt', 'bootstrap': True, 'criterion': 'squared_error'}. Best is trial 1631 with value: 0.32128932742921457.
[I 2024-12-04 20:35:54,296] Trial 2440 finished with value: 0.32465690250997753 and parameters: {'n_estimators': 427, 'max_depth': 50, 'min_samples_split': 2, 'min_samples_leaf': 1, 'max_features': 'sqrt', 'bootstrap': False, 'criterion': 'squared_error'}. Best is trial 1631 with value: 0.32128932742921457.
[I 2024-12-04 20:35:55,280] Trial 2442 finished with value: 0.3251328347291972 and parameters: {'n_estimators': 270, 'max_depth': 50, 'min_samples_split': 2, 'min_samples_leaf': 1, 'max_features': 'sqrt', 'bootstrap': False, 'criterion': 'squared_error'}. Best is trial 1631 with value: 0.32128932742921457.
[I 2024-12-04 20:35:55,485] Trial 2443 finished with value: 0.6932900125007704 and parameters: {'n_estimators': 450, 'max_depth': 44, 'min_samples_split': 4, 'min_samples_leaf': 2, 'max_features': 'sqrt', 'bootstrap': False, 'criterion': 'squared_error'}. Best is trial 1631 with value: 0.32128932742921457.
[I 2024-12-04 20:35:56,582] Trial 2444 finished with value: 0.6849035222681658 and parameters: {'n_estimators': 522, 'max_depth': 50, 'min_samples_split': 4, 'min_samples_leaf': 2, 'max_features': 'sqrt', 'bootstrap': False, 'criterion': 'squared_error'}. Best is trial 1631 with value: 0.32128932742921457.
[I 2024-12-04 20:35:57,867] Trial 2445 finished with value: 0.35936020786185474 and parameters: {'n_estimators': 380, 'max_depth': 50, 'min_samples_split': 3, 'min_samples_leaf': 1, 'max_features': 'sqrt', 'bootstrap': False, 'criterion': 'squared_error'}. Best is trial 1631 with value: 0.32128932742921457.
[I 2024-12-04 20:35:57,956] Trial 2446 finished with value: 0.38679146158068806 and parameters: {'n_estimators': 365, 'max_depth': 50, 'min_samples_split': 4, 'min_samples_leaf': 1, 'max_features': 'sqrt', 'bootstrap': False, 'criterion': 'squared_error'}. Best is trial 1631 with value: 0.32128932742921457.
[I 2024-12-04 20:36:00,032] Trial 2449 finished with value: 0.3249743659709739 and parameters: {'n_estimators': 263, 'max_depth': 50, 'min_samples_split': 2, 'min_samples_leaf': 1, 'max_features': 'sqrt', 'bootstrap': False, 'criterion': 'squared_error'}. Best is trial 1631 with value: 0.32128932742921457.
[I 2024-12-04 20:36:01,595] Trial 2447 finished with value: 0.5502421080342276 and parameters: {'n_estimators': 933, 'max_depth': 9, 'min_samples_split': 6, 'min_samples_leaf': 3, 'max_features': None, 'bootstrap': False, 'criterion': 'squared_error'}. Best is trial 1631 with value: 0.32128932742921457.
[I 2024-12-04 20:36:02,898] Trial 2450 finished with value: 0.3271222478468777 and parameters: {'n_estimators': 510, 'max_depth': 50, 'min_samples_split': 2, 'min_samples_leaf': 1, 'max_features': 'sqrt', 'bootstrap': False, 'criterion': 'squared_error'}. Best is trial 1631 with value: 0.32128932742921457.
[I 2024-12-04 20:36:03,209] Trial 2451 finished with value: 0.40967077325394086 and parameters: {'n_estimators': 335, 'max_depth': 41, 'min_samples_split': 4, 'min_samples_leaf': 1, 'max_features': 'sqrt', 'bootstrap': False, 'criterion': 'squared_error'}. Best is trial 1631 with value: 0.32128932742921457.
[I 2024-12-04 20:36:03,349] Trial 2448 finished with value: 0.8867090008130841 and parameters: {'n_estimators': 299, 'max_depth': 47, 'min_samples_split': 2, 'min_samples_leaf': 2, 'max_features': 'sqrt', 'bootstrap': False, 'criterion': 'absolute_error'}. Best is trial 1631 with value: 0.32128932742921457.
[I 2024-12-04 20:36:05,048] Trial 2452 finished with value: 0.3967614685558273 and parameters: {'n_estimators': 283, 'max_depth': 43, 'min_samples_split': 3, 'min_samples_leaf': 1, 'max_features': 'sqrt', 'bootstrap': False, 'criterion': 'squared_error'}. Best is trial 1631 with value: 0.32128932742921457.
[I 2024-12-04 20:36:05,517] Trial 2454 finished with value: 0.6865940123233657 and parameters: {'n_estimators': 510, 'max_depth': 44, 'min_samples_split': 2, 'min_samples_leaf': 2, 'max_features': 'sqrt', 'bootstrap': False, 'criterion': 'squared_error'}. Best is trial 1631 with value: 0.32128932742921457.
[I 2024-12-04 20:36:06,707] Trial 2455 finished with value: 0.6799576016069897 and parameters: {'n_estimators': 382, 'max_depth': 44, 'min_samples_split': 2, 'min_samples_leaf': 2, 'max_features': 'sqrt', 'bootstrap': False, 'criterion': 'squared_error'}. Best is trial 1631 with value: 0.32128932742921457.
[I 2024-12-04 20:36:08,545] Trial 2457 finished with value: 0.32431641896818875 and parameters: {'n_estimators': 291, 'max_depth': 50, 'min_samples_split': 2, 'min_samples_leaf': 1, 'max_features': 'sqrt', 'bootstrap': False, 'criterion': 'squared_error'}. Best is trial 1631 with value: 0.32128932742921457.
[I 2024-12-04 20:36:08,634] Trial 2456 finished with value: 0.5345196338895495 and parameters: {'n_estimators': 427, 'max_depth': 32, 'min_samples_split': 10, 'min_samples_leaf': 3, 'max_features': None, 'bootstrap': False, 'criterion': 'squared_error'}. Best is trial 1631 with value: 0.32128932742921457.
[I 2024-12-04 20:36:10,880] Trial 2459 finished with value: 0.3460819607468724 and parameters: {'n_estimators': 319, 'max_depth': 41, 'min_samples_split': 2, 'min_samples_leaf': 1, 'max_features': 'sqrt', 'bootstrap': False, 'criterion': 'squared_error'}. Best is trial 1631 with value: 0.32128932742921457.
[I 2024-12-04 20:36:10,991] Trial 2458 finished with value: 0.3654301252253353 and parameters: {'n_estimators': 537, 'max_depth': 50, 'min_samples_split': 3, 'min_samples_leaf': 1, 'max_features': 'sqrt', 'bootstrap': False, 'criterion': 'squared_error'}. Best is trial 1631 with value: 0.32128932742921457.
[I 2024-12-04 20:36:12,544] Trial 2460 finished with value: 0.6575480985947254 and parameters: {'n_estimators': 287, 'max_depth': 50, 'min_samples_split': 3, 'min_samples_leaf': 2, 'max_features': 'sqrt', 'bootstrap': False, 'criterion': 'squared_error'}. Best is trial 1631 with value: 0.32128932742921457.
[I 2024-12-04 20:36:12,666] Trial 2461 finished with value: 0.6763152520333431 and parameters: {'n_estimators': 379, 'max_depth': 50, 'min_samples_split': 4, 'min_samples_leaf': 2, 'max_features': 'sqrt', 'bootstrap': False, 'criterion': 'squared_error'}. Best is trial 1631 with value: 0.32128932742921457.
