[I 2024-12-04 12:24:17,640] Trial 2018 finished with value: 0.5219804754881674 and parameters: {'n_estimators': 213, 'max_depth': 8, 'min_samples_split': 4, 'min_samples_leaf': 1, 'max_features': None, 'bootstrap': True, 'criterion': 'absolute_error'}. Best is trial 1749 with value: 0.502720715661024.
[I 2024-12-04 12:24:18,382] Trial 2013 finished with value: 0.5162850061456972 and parameters: {'n_estimators': 274, 'max_depth': 17, 'min_samples_split': 3, 'min_samples_leaf': 1, 'max_features': None, 'bootstrap': True, 'criterion': 'absolute_error'}. Best is trial 1749 with value: 0.502720715661024.
[I 2024-12-04 12:24:18,948] Trial 2022 finished with value: 0.5603292405436611 and parameters: {'n_estimators': 217, 'max_depth': 7, 'min_samples_split': 4, 'min_samples_leaf': 2, 'max_features': None, 'bootstrap': True, 'criterion': 'absolute_error'}. Best is trial 1749 with value: 0.502720715661024.
[I 2024-12-04 12:24:22,232] Trial 2012 finished with value: 0.5322005202639739 and parameters: {'n_estimators': 191, 'max_depth': 7, 'min_samples_split': 5, 'min_samples_leaf': 1, 'max_features': None, 'bootstrap': True, 'criterion': 'absolute_error'}. Best is trial 1749 with value: 0.502720715661024.
[I 2024-12-04 12:24:23,925] Trial 2015 finished with value: 0.5576914797940054 and parameters: {'n_estimators': 306, 'max_depth': 5, 'min_samples_split': 4, 'min_samples_leaf': 1, 'max_features': None, 'bootstrap': True, 'criterion': 'absolute_error'}. Best is trial 1749 with value: 0.502720715661024.
[I 2024-12-04 12:24:24,792] Trial 2029 finished with value: 0.5512697796277469 and parameters: {'n_estimators': 114, 'max_depth': 10, 'min_samples_split': 3, 'min_samples_leaf': 2, 'max_features': None, 'bootstrap': True, 'criterion': 'absolute_error'}. Best is trial 1749 with value: 0.502720715661024.
[I 2024-12-04 12:24:25,539] Trial 2031 finished with value: 0.5118291559631741 and parameters: {'n_estimators': 109, 'max_depth': 14, 'min_samples_split': 6, 'min_samples_leaf': 1, 'max_features': None, 'bootstrap': True, 'criterion': 'absolute_error'}. Best is trial 1749 with value: 0.502720715661024.
[I 2024-12-04 12:24:25,542] Trial 2025 finished with value: 0.5530629791983069 and parameters: {'n_estimators': 158, 'max_depth': 13, 'min_samples_split': 5, 'min_samples_leaf': 2, 'max_features': None, 'bootstrap': True, 'criterion': 'absolute_error'}. Best is trial 1749 with value: 0.502720715661024.
[I 2024-12-04 12:24:25,542] Trial 2028 finished with value: 0.5247739384157146 and parameters: {'n_estimators': 112, 'max_depth': 12, 'min_samples_split': 9, 'min_samples_leaf': 1, 'max_features': None, 'bootstrap': True, 'criterion': 'absolute_error'}. Best is trial 1749 with value: 0.502720715661024.
[I 2024-12-04 12:24:26,619] Trial 2023 finished with value: 0.5239954160761633 and parameters: {'n_estimators': 278, 'max_depth': 10, 'min_samples_split': 7, 'min_samples_leaf': 1, 'max_features': None, 'bootstrap': True, 'criterion': 'absolute_error'}. Best is trial 1749 with value: 0.502720715661024.
[I 2024-12-04 12:24:27,103] Trial 2033 finished with value: 0.510902153937382 and parameters: {'n_estimators': 111, 'max_depth': 13, 'min_samples_split': 4, 'min_samples_leaf': 1, 'max_features': None, 'bootstrap': True, 'criterion': 'absolute_error'}. Best is trial 1749 with value: 0.502720715661024.
[I 2024-12-04 12:24:27,672] Trial 2024 finished with value: 0.5546222278556484 and parameters: {'n_estimators': 269, 'max_depth': 9, 'min_samples_split': 6, 'min_samples_leaf': 2, 'max_features': None, 'bootstrap': True, 'criterion': 'absolute_error'}. Best is trial 1749 with value: 0.502720715661024.
[I 2024-12-04 12:24:27,703] Trial 2032 finished with value: 0.5083850302639467 and parameters: {'n_estimators': 103, 'max_depth': 18, 'min_samples_split': 5, 'min_samples_leaf': 1, 'max_features': None, 'bootstrap': True, 'criterion': 'absolute_error'}. Best is trial 1749 with value: 0.502720715661024.
[I 2024-12-04 12:24:27,766] Trial 2027 finished with value: 0.5452698048444543 and parameters: {'n_estimators': 129, 'max_depth': 11, 'min_samples_split': 6, 'min_samples_leaf': 1, 'max_features': None, 'bootstrap': False, 'criterion': 'absolute_error'}. Best is trial 1749 with value: 0.502720715661024.
[I 2024-12-04 12:24:27,870] Trial 2005 finished with value: 0.5619530708071138 and parameters: {'n_estimators': 477, 'max_depth': 20, 'min_samples_split': 3, 'min_samples_leaf': 2, 'max_features': None, 'bootstrap': True, 'criterion': 'absolute_error'}. Best is trial 1749 with value: 0.502720715661024.
[I 2024-12-04 12:24:29,023] Trial 2038 finished with value: 0.9746415706847223 and parameters: {'n_estimators': 123, 'max_depth': 13, 'min_samples_split': 3, 'min_samples_leaf': 1, 'max_features': 'sqrt', 'bootstrap': True, 'criterion': 'absolute_error'}. Best is trial 1749 with value: 0.502720715661024.
[I 2024-12-04 12:24:29,266] Trial 2036 finished with value: 0.5646978487023134 and parameters: {'n_estimators': 114, 'max_depth': 6, 'min_samples_split': 4, 'min_samples_leaf': 2, 'max_features': None, 'bootstrap': True, 'criterion': 'absolute_error'}. Best is trial 1749 with value: 0.502720715661024.
[I 2024-12-04 12:24:29,599] Trial 2035 finished with value: 0.5352591399472445 and parameters: {'n_estimators': 120, 'max_depth': 6, 'min_samples_split': 4, 'min_samples_leaf': 1, 'max_features': None, 'bootstrap': True, 'criterion': 'absolute_error'}. Best is trial 1749 with value: 0.502720715661024.
[I 2024-12-04 12:24:30,854] Trial 2034 finished with value: 0.5694474612524583 and parameters: {'n_estimators': 117, 'max_depth': 15, 'min_samples_split': 3, 'min_samples_leaf': 1, 'max_features': None, 'bootstrap': False, 'criterion': 'absolute_error'}. Best is trial 1749 with value: 0.502720715661024.
[I 2024-12-04 12:24:31,294] Trial 2041 finished with value: 0.5564134987918827 and parameters: {'n_estimators': 105, 'max_depth': 14, 'min_samples_split': 5, 'min_samples_leaf': 2, 'max_features': None, 'bootstrap': True, 'criterion': 'absolute_error'}. Best is trial 1749 with value: 0.502720715661024.
[I 2024-12-04 12:24:31,304] Trial 2030 finished with value: 0.5276773990063676 and parameters: {'n_estimators': 208, 'max_depth': 13, 'min_samples_split': 9, 'min_samples_leaf': 1, 'max_features': None, 'bootstrap': True, 'criterion': 'absolute_error'}. Best is trial 1749 with value: 0.502720715661024.
[I 2024-12-04 12:24:31,311] Trial 2046 finished with value: 0.5408911703157316 and parameters: {'n_estimators': 105, 'max_depth': 7, 'min_samples_split': 6, 'min_samples_leaf': 1, 'max_features': None, 'bootstrap': True, 'criterion': 'squared_error'}. Best is trial 1749 with value: 0.502720715661024.
[I 2024-12-04 12:24:33,404] Trial 2026 finished with value: 0.517772277320739 and parameters: {'n_estimators': 222, 'max_depth': 14, 'min_samples_split': 4, 'min_samples_leaf': 1, 'max_features': None, 'bootstrap': True, 'criterion': 'absolute_error'}. Best is trial 1749 with value: 0.502720715661024.
[I 2024-12-04 12:24:34,512] Trial 2006 finished with value: 0.6437936370274056 and parameters: {'n_estimators': 559, 'max_depth': 16, 'min_samples_split': 27, 'min_samples_leaf': 1, 'max_features': None, 'bootstrap': True, 'criterion': 'absolute_error'}. Best is trial 1749 with value: 0.502720715661024.
[I 2024-12-04 12:24:35,697] Trial 2049 finished with value: 0.5580135969494184 and parameters: {'n_estimators': 107, 'max_depth': 20, 'min_samples_split': 5, 'min_samples_leaf': 2, 'max_features': None, 'bootstrap': True, 'criterion': 'absolute_error'}. Best is trial 1749 with value: 0.502720715661024.
[I 2024-12-04 12:24:35,701] Trial 2042 finished with value: 0.5574712880012549 and parameters: {'n_estimators': 119, 'max_depth': 17, 'min_samples_split': 4, 'min_samples_leaf': 2, 'max_features': None, 'bootstrap': True, 'criterion': 'absolute_error'}. Best is trial 1749 with value: 0.502720715661024.
[I 2024-12-04 12:24:36,006] Trial 2047 finished with value: 0.5182381078599709 and parameters: {'n_estimators': 113, 'max_depth': 12, 'min_samples_split': 8, 'min_samples_leaf': 1, 'max_features': None, 'bootstrap': True, 'criterion': 'absolute_error'}. Best is trial 1749 with value: 0.502720715661024.
[I 2024-12-04 12:24:36,161] Trial 2048 finished with value: 0.5214953097865966 and parameters: {'n_estimators': 132, 'max_depth': 23, 'min_samples_split': 5, 'min_samples_leaf': 1, 'max_features': None, 'bootstrap': True, 'criterion': 'squared_error'}. Best is trial 1749 with value: 0.502720715661024.
[I 2024-12-04 12:24:37,057] Trial 2040 finished with value: 0.5116706674320327 and parameters: {'n_estimators': 108, 'max_depth': 13, 'min_samples_split': 3, 'min_samples_leaf': 1, 'max_features': None, 'bootstrap': True, 'criterion': 'absolute_error'}. Best is trial 1749 with value: 0.502720715661024.
[I 2024-12-04 12:24:38,535] Trial 2058 finished with value: 1.2429420059341754 and parameters: {'n_estimators': 299, 'max_depth': 32, 'min_samples_split': 6, 'min_samples_leaf': 13, 'max_features': 'sqrt', 'bootstrap': True, 'criterion': 'squared_error'}. Best is trial 1749 with value: 0.502720715661024.
[I 2024-12-04 12:24:39,708] Trial 2043 finished with value: 0.5181892538535555 and parameters: {'n_estimators': 103, 'max_depth': 10, 'min_samples_split': 5, 'min_samples_leaf': 1, 'max_features': None, 'bootstrap': True, 'criterion': 'absolute_error'}. Best is trial 1749 with value: 0.502720715661024.
[I 2024-12-04 12:24:41,292] Trial 2044 finished with value: 0.5539737379824131 and parameters: {'n_estimators': 103, 'max_depth': 8, 'min_samples_split': 8, 'min_samples_leaf': 2, 'max_features': None, 'bootstrap': True, 'criterion': 'absolute_error'}. Best is trial 1749 with value: 0.502720715661024.
[I 2024-12-04 12:24:41,447] Trial 2052 finished with value: 0.5258223294655865 and parameters: {'n_estimators': 101, 'max_depth': 24, 'min_samples_split': 3, 'min_samples_leaf': 1, 'max_features': None, 'bootstrap': True, 'criterion': 'absolute_error'}. Best is trial 1749 with value: 0.502720715661024.
[I 2024-12-04 12:24:42,293] Trial 2037 finished with value: 0.5172145459500096 and parameters: {'n_estimators': 244, 'max_depth': 16, 'min_samples_split': 3, 'min_samples_leaf': 1, 'max_features': None, 'bootstrap': True, 'criterion': 'absolute_error'}. Best is trial 1749 with value: 0.502720715661024.
[I 2024-12-04 12:24:43,342] Trial 2039 finished with value: 0.5135784032570327 and parameters: {'n_estimators': 279, 'max_depth': 15, 'min_samples_split': 3, 'min_samples_leaf': 1, 'max_features': None, 'bootstrap': True, 'criterion': 'absolute_error'}. Best is trial 1749 with value: 0.502720715661024.
[I 2024-12-04 12:24:43,892] Trial 2050 finished with value: 0.6327287189346883 and parameters: {'n_estimators': 198, 'max_depth': 23, 'min_samples_split': 18, 'min_samples_leaf': 6, 'max_features': None, 'bootstrap': False, 'criterion': 'absolute_error'}. Best is trial 1749 with value: 0.502720715661024.
[I 2024-12-04 12:24:50,185] Trial 2060 finished with value: 1.0287470308056748 and parameters: {'n_estimators': 378, 'max_depth': 10, 'min_samples_split': 9, 'min_samples_leaf': 1, 'max_features': 'sqrt', 'bootstrap': True, 'criterion': 'absolute_error'}. Best is trial 1749 with value: 0.502720715661024.
[I 2024-12-04 12:24:51,334] Trial 2066 finished with value: 0.5133001728747371 and parameters: {'n_estimators': 109, 'max_depth': 14, 'min_samples_split': 4, 'min_samples_leaf': 1, 'max_features': None, 'bootstrap': True, 'criterion': 'absolute_error'}. Best is trial 1749 with value: 0.502720715661024.
[I 2024-12-04 12:24:52,539] Trial 2063 finished with value: 0.5110262538383167 and parameters: {'n_estimators': 114, 'max_depth': 22, 'min_samples_split': 5, 'min_samples_leaf': 1, 'max_features': None, 'bootstrap': True, 'criterion': 'absolute_error'}. Best is trial 1749 with value: 0.502720715661024.
[I 2024-12-04 12:24:53,149] Trial 2054 finished with value: 0.5146120700089014 and parameters: {'n_estimators': 235, 'max_depth': 13, 'min_samples_split': 3, 'min_samples_leaf': 1, 'max_features': None, 'bootstrap': True, 'criterion': 'absolute_error'}. Best is trial 1749 with value: 0.502720715661024.
[I 2024-12-04 12:24:53,627] Trial 2055 finished with value: 0.5201215453019236 and parameters: {'n_estimators': 103, 'max_depth': 19, 'min_samples_split': 3, 'min_samples_leaf': 1, 'max_features': None, 'bootstrap': True, 'criterion': 'absolute_error'}. Best is trial 1749 with value: 0.502720715661024.
[I 2024-12-04 12:24:53,875] Trial 2045 finished with value: 0.5169324233730915 and parameters: {'n_estimators': 260, 'max_depth': 18, 'min_samples_split': 5, 'min_samples_leaf': 1, 'max_features': None, 'bootstrap': True, 'criterion': 'absolute_error'}. Best is trial 1749 with value: 0.502720715661024.
[I 2024-12-04 12:24:53,990] Trial 2065 finished with value: 0.5352713300885962 and parameters: {'n_estimators': 107, 'max_depth': 16, 'min_samples_split': 9, 'min_samples_leaf': 1, 'max_features': None, 'bootstrap': False, 'criterion': 'absolute_error'}. Best is trial 1749 with value: 0.502720715661024.
[I 2024-12-04 12:24:54,094] Trial 2074 finished with value: 1.2361339693590456 and parameters: {'n_estimators': 773, 'max_depth': 21, 'min_samples_split': 36, 'min_samples_leaf': 7, 'max_features': 'log2', 'bootstrap': True, 'criterion': 'squared_error'}. Best is trial 1749 with value: 0.502720715661024.
[I 2024-12-04 12:24:54,201] Trial 2070 finished with value: 0.5064491143404805 and parameters: {'n_estimators': 106, 'max_depth': 19, 'min_samples_split': 5, 'min_samples_leaf': 1, 'max_features': None, 'bootstrap': True, 'criterion': 'absolute_error'}. Best is trial 1749 with value: 0.502720715661024.
[I 2024-12-04 12:24:56,315] Trial 2064 finished with value: 0.5119175977398553 and parameters: {'n_estimators': 106, 'max_depth': 12, 'min_samples_split': 4, 'min_samples_leaf': 1, 'max_features': None, 'bootstrap': True, 'criterion': 'absolute_error'}. Best is trial 1749 with value: 0.502720715661024.
[I 2024-12-04 12:24:58,957] Trial 2068 finished with value: 0.5573151951172077 and parameters: {'n_estimators': 113, 'max_depth': 27, 'min_samples_split': 3, 'min_samples_leaf': 2, 'max_features': None, 'bootstrap': True, 'criterion': 'absolute_error'}. Best is trial 1749 with value: 0.502720715661024.
[I 2024-12-04 12:24:58,958] Trial 2071 finished with value: 0.5120523119174016 and parameters: {'n_estimators': 120, 'max_depth': 14, 'min_samples_split': 4, 'min_samples_leaf': 1, 'max_features': None, 'bootstrap': True, 'criterion': 'absolute_error'}. Best is trial 1749 with value: 0.502720715661024.
[I 2024-12-04 12:25:00,905] Trial 2056 finished with value: 0.556330101275929 and parameters: {'n_estimators': 220, 'max_depth': 19, 'min_samples_split': 3, 'min_samples_leaf': 2, 'max_features': None, 'bootstrap': True, 'criterion': 'absolute_error'}. Best is trial 1749 with value: 0.502720715661024.
[I 2024-12-04 12:25:04,804] Trial 2057 finished with value: 0.5268049141509773 and parameters: {'n_estimators': 284, 'max_depth': 16, 'min_samples_split': 9, 'min_samples_leaf': 1, 'max_features': None, 'bootstrap': True, 'criterion': 'absolute_error'}. Best is trial 1749 with value: 0.502720715661024.
[I 2024-12-04 12:25:06,639] Trial 2069 finished with value: 0.7167808243102345 and parameters: {'n_estimators': 891, 'max_depth': 38, 'min_samples_split': 2, 'min_samples_leaf': 8, 'max_features': None, 'bootstrap': False, 'criterion': 'squared_error'}. Best is trial 1749 with value: 0.502720715661024.
[I 2024-12-04 12:25:07,439] Trial 2081 finished with value: 1.0004759205410385 and parameters: {'n_estimators': 101, 'max_depth': 23, 'min_samples_split': 4, 'min_samples_leaf': 1, 'max_features': 'log2', 'bootstrap': True, 'criterion': 'absolute_error'}. Best is trial 1749 with value: 0.502720715661024.
[I 2024-12-04 12:25:07,906] Trial 2053 finished with value: 0.5279143870481241 and parameters: {'n_estimators': 329, 'max_depth': 21, 'min_samples_split': 9, 'min_samples_leaf': 1, 'max_features': None, 'bootstrap': True, 'criterion': 'absolute_error'}. Best is trial 1749 with value: 0.502720715661024.
[I 2024-12-04 12:25:07,909] Trial 2077 finished with value: 0.5126681329043457 and parameters: {'n_estimators': 108, 'max_depth': 17, 'min_samples_split': 4, 'min_samples_leaf': 1, 'max_features': None, 'bootstrap': True, 'criterion': 'absolute_error'}. Best is trial 1749 with value: 0.502720715661024.
[I 2024-12-04 12:25:09,709] Trial 2062 finished with value: 0.5181635039653093 and parameters: {'n_estimators': 200, 'max_depth': 14, 'min_samples_split': 4, 'min_samples_leaf': 1, 'max_features': None, 'bootstrap': True, 'criterion': 'absolute_error'}. Best is trial 1749 with value: 0.502720715661024.
[I 2024-12-04 12:25:10,266] Trial 2078 finished with value: 0.5528567551838773 and parameters: {'n_estimators': 133, 'max_depth': 12, 'min_samples_split': 4, 'min_samples_leaf': 2, 'max_features': None, 'bootstrap': True, 'criterion': 'absolute_error'}. Best is trial 1749 with value: 0.502720715661024.
[I 2024-12-04 12:25:11,156] Trial 2079 finished with value: 0.5574017943194315 and parameters: {'n_estimators': 105, 'max_depth': 16, 'min_samples_split': 4, 'min_samples_leaf': 2, 'max_features': None, 'bootstrap': True, 'criterion': 'absolute_error'}. Best is trial 1749 with value: 0.502720715661024.
[I 2024-12-04 12:25:11,245] Trial 2082 finished with value: 0.5269813848722984 and parameters: {'n_estimators': 100, 'max_depth': 24, 'min_samples_split': 3, 'min_samples_leaf': 1, 'max_features': None, 'bootstrap': True, 'criterion': 'absolute_error'}. Best is trial 1749 with value: 0.502720715661024.
[I 2024-12-04 12:25:11,353] Trial 2059 finished with value: 0.5615955240778085 and parameters: {'n_estimators': 256, 'max_depth': 26, 'min_samples_split': 5, 'min_samples_leaf': 2, 'max_features': None, 'bootstrap': True, 'criterion': 'absolute_error'}. Best is trial 1749 with value: 0.502720715661024.
[I 2024-12-04 12:25:11,743] Trial 2061 finished with value: 0.528888341262031 and parameters: {'n_estimators': 408, 'max_depth': 16, 'min_samples_split': 10, 'min_samples_leaf': 1, 'max_features': None, 'bootstrap': True, 'criterion': 'absolute_error'}. Best is trial 1749 with value: 0.502720715661024.
[I 2024-12-04 12:25:11,948] Trial 2073 finished with value: 0.510135421088157 and parameters: {'n_estimators': 224, 'max_depth': 19, 'min_samples_split': 4, 'min_samples_leaf': 1, 'max_features': None, 'bootstrap': True, 'criterion': 'absolute_error'}. Best is trial 1749 with value: 0.502720715661024.
[I 2024-12-04 12:25:12,134] Trial 2089 finished with value: 1.2192303977489918 and parameters: {'n_estimators': 363, 'max_depth': 11, 'min_samples_split': 10, 'min_samples_leaf': 3, 'max_features': 'log2', 'bootstrap': True, 'criterion': 'squared_error'}. Best is trial 1749 with value: 0.502720715661024.
[I 2024-12-04 12:25:12,584] Trial 2076 finished with value: 0.6150957130965379 and parameters: {'n_estimators': 961, 'max_depth': 27, 'min_samples_split': 4, 'min_samples_leaf': 3, 'max_features': None, 'bootstrap': False, 'criterion': 'squared_error'}. Best is trial 1749 with value: 0.502720715661024.
[I 2024-12-04 12:25:12,763] Trial 2084 finished with value: 1.3171259306490763 and parameters: {'n_estimators': 943, 'max_depth': 49, 'min_samples_split': 3, 'min_samples_leaf': 11, 'max_features': 'sqrt', 'bootstrap': False, 'criterion': 'absolute_error'}. Best is trial 1749 with value: 0.502720715661024.
[I 2024-12-04 12:25:14,164] Trial 2067 finished with value: 0.5107566944825894 and parameters: {'n_estimators': 110, 'max_depth': 15, 'min_samples_split': 5, 'min_samples_leaf': 1, 'max_features': None, 'bootstrap': True, 'criterion': 'absolute_error'}. Best is trial 1749 with value: 0.502720715661024.
[I 2024-12-04 12:25:16,942] Trial 2087 finished with value: 0.5202488389428864 and parameters: {'n_estimators': 104, 'max_depth': 9, 'min_samples_split': 3, 'min_samples_leaf': 1, 'max_features': None, 'bootstrap': True, 'criterion': 'absolute_error'}. Best is trial 1749 with value: 0.502720715661024.
[I 2024-12-04 12:25:21,015] Trial 2088 finished with value: 0.5150008505101907 and parameters: {'n_estimators': 105, 'max_depth': 16, 'min_samples_split': 3, 'min_samples_leaf': 1, 'max_features': None, 'bootstrap': True, 'criterion': 'absolute_error'}. Best is trial 1749 with value: 0.502720715661024.
[I 2024-12-04 12:25:21,489] Trial 2080 finished with value: 0.5579144911162235 and parameters: {'n_estimators': 105, 'max_depth': 14, 'min_samples_split': 4, 'min_samples_leaf': 2, 'max_features': None, 'bootstrap': True, 'criterion': 'absolute_error'}. Best is trial 1749 with value: 0.502720715661024.
[I 2024-12-04 12:25:21,496] Trial 2075 finished with value: 0.5124976087311547 and parameters: {'n_estimators': 267, 'max_depth': 13, 'min_samples_split': 3, 'min_samples_leaf': 1, 'max_features': None, 'bootstrap': True, 'criterion': 'absolute_error'}. Best is trial 1749 with value: 0.502720715661024.
[I 2024-12-04 12:25:22,236] Trial 2085 finished with value: 0.5250322216838574 and parameters: {'n_estimators': 106, 'max_depth': 22, 'min_samples_split': 9, 'min_samples_leaf': 1, 'max_features': None, 'bootstrap': True, 'criterion': 'absolute_error'}. Best is trial 1749 with value: 0.502720715661024.
[I 2024-12-04 12:25:22,603] Trial 2083 finished with value: 0.5277414360401267 and parameters: {'n_estimators': 225, 'max_depth': 18, 'min_samples_split': 12, 'min_samples_leaf': 1, 'max_features': None, 'bootstrap': True, 'criterion': 'absolute_error'}. Best is trial 1749 with value: 0.502720715661024.
[I 2024-12-04 12:25:22,615] Trial 2051 finished with value: 0.519206104059107 and parameters: {'n_estimators': 479, 'max_depth': 28, 'min_samples_split': 6, 'min_samples_leaf': 1, 'max_features': None, 'bootstrap': True, 'criterion': 'absolute_error'}. Best is trial 1749 with value: 0.502720715661024.
