[I 2024-12-04 15:16:59,869] Trial 2101 finished with value: 0.4883034801625861 and parameters: {'kernel_type': 'Matern', 'length_scale': 1823.0006958494632, 'noise_level': 0.8230741757835043, 'constant_value': 31.69819412742766, 'nu': 0.5}. Best is trial 386 with value: 0.4872991004520934.
[I 2024-12-04 15:16:59,872] Trial 2100 finished with value: 0.48829191259662613 and parameters: {'kernel_type': 'Matern', 'length_scale': 88.5034062035081, 'noise_level': 0.009394614162746456, 'constant_value': 642.7243522620396, 'nu': 0.5}. Best is trial 386 with value: 0.4872991004520934.
[I 2024-12-04 15:17:00,160] Trial 2105 finished with value: 0.48830335855397 and parameters: {'kernel_type': 'Matern', 'length_scale': 1508.5308183024167, 'noise_level': 0.7665139171811167, 'constant_value': 0.01675753068316683, 'nu': 0.5}. Best is trial 386 with value: 0.4872991004520934.
[I 2024-12-04 15:17:00,295] Trial 2109 finished with value: 0.4883034029622255 and parameters: {'kernel_type': 'Matern', 'length_scale': 30.325609909710025, 'noise_level': 0.051627565567838464, 'constant_value': 95.63540240505499, 'nu': 0.5}. Best is trial 386 with value: 0.4872991004520934.
[I 2024-12-04 15:17:00,631] Trial 2106 finished with value: 1.2614541405730824 and parameters: {'kernel_type': 'RBF', 'length_scale': 0.38801017213290556, 'noise_level': 0.44994977036626826, 'constant_value': 7.085781706044903e-07, 'nu': 1.5}. Best is trial 386 with value: 0.4872991004520934.
[I 2024-12-04 15:17:01,458] Trial 2108 finished with value: 0.4883034188375766 and parameters: {'kernel_type': 'Matern', 'length_scale': 4810.506742932296, 'noise_level': 0.03700504398026276, 'constant_value': 1279.2589883602127, 'nu': 0.5}. Best is trial 386 with value: 0.4872991004520934.
[I 2024-12-04 15:17:01,497] Trial 2097 finished with value: 0.4883034670381027 and parameters: {'kernel_type': 'Matern', 'length_scale': 86311.86420393137, 'noise_level': 0.6558883287265475, 'constant_value': 302.6854290896515, 'nu': 0.5}. Best is trial 386 with value: 0.4872991004520934.
[I 2024-12-04 15:17:01,645] Trial 2091 finished with value: 1.2401112325971673 and parameters: {'kernel_type': 'Matern', 'length_scale': 612.6042644981886, 'noise_level': 3.149529628364586e-06, 'constant_value': 1.2883736121856902e-06, 'nu': 2.5}. Best is trial 386 with value: 0.4872991004520934.
[I 2024-12-04 15:17:03,160] Trial 2115 finished with value: 1.2614547953941473 and parameters: {'kernel_type': 'Matern', 'length_scale': 7.51861054823822, 'noise_level': 0.029542491903752525, 'constant_value': 110.75928216426546, 'nu': 0.5}. Best is trial 386 with value: 0.4872991004520934.
[I 2024-12-04 15:17:03,161] Trial 2113 finished with value: 0.4883034212631719 and parameters: {'kernel_type': 'Matern', 'length_scale': 8877.151048904216, 'noise_level': 0.9705458836887826, 'constant_value': 223.8918538647071, 'nu': 0.5}. Best is trial 386 with value: 0.4872991004520934.
[I 2024-12-04 15:17:03,682] Trial 2110 finished with value: 1.2614547932747067 and parameters: {'kernel_type': 'Matern', 'length_scale': 94.75906402922139, 'noise_level': 0.00016122774345957164, 'constant_value': 98874.00472674202, 'nu': 0.5}. Best is trial 386 with value: 0.4872991004520934.
[I 2024-12-04 15:17:03,690] Trial 2102 finished with value: 0.4883034291289203 and parameters: {'kernel_type': 'Matern', 'length_scale': 79815.11301429807, 'noise_level': 0.8465373463938247, 'constant_value': 10363.9019379404, 'nu': 0.5}. Best is trial 386 with value: 0.4872991004520934.
[I 2024-12-04 15:17:03,735] Trial 2119 finished with value: 1.2614547953941473 and parameters: {'kernel_type': 'Matern', 'length_scale': 270.81883157141283, 'noise_level': 0.025861672033726565, 'constant_value': 5572.231415019772, 'nu': 0.5}. Best is trial 386 with value: 0.4872991004520934.
[I 2024-12-04 15:17:03,790] Trial 2104 finished with value: 0.48830342700674334 and parameters: {'kernel_type': 'Matern', 'length_scale': 1628.4013481765069, 'noise_level': 0.981708742386145, 'constant_value': 1052.6624734792183, 'nu': 0.5}. Best is trial 386 with value: 0.4872991004520934.
[I 2024-12-04 15:17:05,532] Trial 2117 finished with value: 0.48830342266087856 and parameters: {'kernel_type': 'Matern', 'length_scale': 679.8521204155603, 'noise_level': 0.0018727310811013406, 'constant_value': 564.6215121972057, 'nu': 0.5}. Best is trial 386 with value: 0.4872991004520934.
[I 2024-12-04 15:17:06,331] Trial 2121 finished with value: 1.2401112309089002 and parameters: {'kernel_type': 'RBF', 'length_scale': 0.08765610838437551, 'noise_level': 0.017876004947301925, 'constant_value': 0.0671301739234797, 'nu': 2.5}. Best is trial 386 with value: 0.4872991004520934.
[I 2024-12-04 15:17:06,340] Trial 2114 finished with value: 0.48830354893509176 and parameters: {'kernel_type': 'Matern', 'length_scale': 29.473962767154838, 'noise_level': 0.004474953835017994, 'constant_value': 30.025577432143738, 'nu': 0.5}. Best is trial 386 with value: 0.4872991004520934.
[I 2024-12-04 15:17:09,032] Trial 2111 finished with value: 0.48830336419974857 and parameters: {'kernel_type': 'Matern', 'length_scale': 18.538935026270543, 'noise_level': 0.0007615863758056036, 'constant_value': 43.487111936388516, 'nu': 0.5}. Best is trial 386 with value: 0.4872991004520934.
[I 2024-12-04 15:17:10,106] Trial 2116 finished with value: 0.48830346673576974 and parameters: {'kernel_type': 'Matern', 'length_scale': 9.83994636494343, 'noise_level': 0.013985868054087363, 'constant_value': 3520.191435059195, 'nu': 0.5}. Best is trial 386 with value: 0.4872991004520934.
[I 2024-12-04 15:17:10,226] Trial 2124 finished with value: 0.488303418615035 and parameters: {'kernel_type': 'Matern', 'length_scale': 145.26796804396912, 'noise_level': 0.01638517493922782, 'constant_value': 2157.328736987375, 'nu': 0.5}. Best is trial 386 with value: 0.4872991004520934.
[I 2024-12-04 15:17:10,770] Trial 2127 finished with value: 0.48830339397459716 and parameters: {'kernel_type': 'Matern', 'length_scale': 82.59665917675436, 'noise_level': 0.003754233371287242, 'constant_value': 53.23929989463622, 'nu': 0.5}. Best is trial 386 with value: 0.4872991004520934.
[I 2024-12-04 15:17:11,200] Trial 2120 finished with value: 0.4883034068845432 and parameters: {'kernel_type': 'Matern', 'length_scale': 2.002654188914222, 'noise_level': 0.012916202835515691, 'constant_value': 4879.036147833042, 'nu': 0.5}. Best is trial 386 with value: 0.4872991004520934.
[I 2024-12-04 15:17:12,034] Trial 2118 finished with value: 1.2401112299364896 and parameters: {'kernel_type': 'Matern', 'length_scale': 640.2359415018559, 'noise_level': 0.00038948178162274055, 'constant_value': 226.95356917896567, 'nu': 1.5}. Best is trial 386 with value: 0.4872991004520934.
[I 2024-12-04 15:17:12,386] Trial 2122 finished with value: 0.48830341795955035 and parameters: {'kernel_type': 'Matern', 'length_scale': 414.63636743734656, 'noise_level': 0.0005738627314963682, 'constant_value': 147.72818895221792, 'nu': 0.5}. Best is trial 386 with value: 0.4872991004520934.
[I 2024-12-04 15:17:14,686] Trial 2125 finished with value: 0.4883031426169042 and parameters: {'kernel_type': 'Matern', 'length_scale': 101.40209782002913, 'noise_level': 0.00039128901022767517, 'constant_value': 2088.0545047333867, 'nu': 0.5}. Best is trial 386 with value: 0.4872991004520934.
[I 2024-12-04 15:17:15,843] Trial 2128 finished with value: 1.261454795394147 and parameters: {'kernel_type': 'Matern', 'length_scale': 67.58237831224746, 'noise_level': 0.04117042915992133, 'constant_value': 3851.4359613288034, 'nu': 0.5}. Best is trial 386 with value: 0.4872991004520934.
[I 2024-12-04 15:17:16,340] Trial 2126 finished with value: 0.4883034211814833 and parameters: {'kernel_type': 'Matern', 'length_scale': 49.939430222250536, 'noise_level': 0.0028979865065958048, 'constant_value': 300.2444999894739, 'nu': 0.5}. Best is trial 386 with value: 0.4872991004520934.
[I 2024-12-04 15:17:16,375] Trial 2112 finished with value: 0.4883034203934713 and parameters: {'kernel_type': 'Matern', 'length_scale': 18.148941072024847, 'noise_level': 0.00018999297123277692, 'constant_value': 220.92128141986126, 'nu': 0.5}. Best is trial 386 with value: 0.4872991004520934.
[I 2024-12-04 15:17:18,922] Trial 2129 finished with value: 1.2401112313488543 and parameters: {'kernel_type': 'Matern', 'length_scale': 3247.512653041203, 'noise_level': 0.00023505686536872666, 'constant_value': 40.287073284216056, 'nu': 0.5}. Best is trial 386 with value: 0.4872991004520934.
[I 2024-12-04 15:17:19,297] Trial 2130 finished with value: 0.4883034181619271 and parameters: {'kernel_type': 'Matern', 'length_scale': 937.8303858197334, 'noise_level': 0.0011441830179234203, 'constant_value': 986.3979956173821, 'nu': 0.5}. Best is trial 386 with value: 0.4872991004520934.
[I 2024-12-04 15:17:19,405] Trial 2132 finished with value: 0.4883034463915692 and parameters: {'kernel_type': 'Matern', 'length_scale': 44.08487799537356, 'noise_level': 0.014418466909759616, 'constant_value': 1327.5852132630832, 'nu': 0.5}. Best is trial 386 with value: 0.4872991004520934.
[I 2024-12-04 15:17:19,736] Trial 2140 finished with value: 1.2401112318364795 and parameters: {'kernel_type': 'Matern', 'length_scale': 2394.9027976751468, 'noise_level': 0.00030020389523056267, 'constant_value': 10.489787121853933, 'nu': 0.5}. Best is trial 386 with value: 0.4872991004520934.
[I 2024-12-04 15:17:20,068] Trial 2137 finished with value: 0.4883034962047249 and parameters: {'kernel_type': 'Matern', 'length_scale': 43.95593357826068, 'noise_level': 0.8773735595011262, 'constant_value': 787.1783139045765, 'nu': 0.5}. Best is trial 386 with value: 0.4872991004520934.
[I 2024-12-04 15:17:20,168] Trial 2123 finished with value: 0.4883034176275452 and parameters: {'kernel_type': 'Matern', 'length_scale': 4.76144864880039, 'noise_level': 0.052259361999292264, 'constant_value': 647.0898892054837, 'nu': 0.5}. Best is trial 386 with value: 0.4872991004520934.
[I 2024-12-04 15:17:21,340] Trial 2135 finished with value: 0.48830341876199507 and parameters: {'kernel_type': 'Matern', 'length_scale': 3418.2571152647374, 'noise_level': 0.0006454957251011023, 'constant_value': 1138.3830473666558, 'nu': 0.5}. Best is trial 386 with value: 0.4872991004520934.
[I 2024-12-04 15:17:21,344] Trial 2143 finished with value: 1.240111233756927 and parameters: {'kernel_type': 'Matern', 'length_scale': 24629.711527652904, 'noise_level': 2.181004906190168e-08, 'constant_value': 20.144351414763914, 'nu': 0.5}. Best is trial 386 with value: 0.4872991004520934.
[I 2024-12-04 15:17:21,632] Trial 2133 finished with value: 0.48830337546482405 and parameters: {'kernel_type': 'Matern', 'length_scale': 20.68548105080877, 'noise_level': 0.7685220083840156, 'constant_value': 1345.0684953449565, 'nu': 0.5}. Best is trial 386 with value: 0.4872991004520934.
[I 2024-12-04 15:17:22,191] Trial 2141 finished with value: 0.4883034109941482 and parameters: {'kernel_type': 'Matern', 'length_scale': 3056.351298975381, 'noise_level': 0.011695961436176823, 'constant_value': 86546.22044157394, 'nu': 0.5}. Best is trial 386 with value: 0.4872991004520934.
[I 2024-12-04 15:17:23,118] Trial 2136 finished with value: 0.48830342198671467 and parameters: {'kernel_type': 'Matern', 'length_scale': 0.7356892450084817, 'noise_level': 0.005096036989121678, 'constant_value': 72315.81048114508, 'nu': 0.5}. Best is trial 386 with value: 0.4872991004520934.
[I 2024-12-04 15:17:24,302] Trial 2147 finished with value: 0.48830341505622715 and parameters: {'kernel_type': 'Matern', 'length_scale': 1170.5704039931784, 'noise_level': 0.0126189436984234, 'constant_value': 5552.521496042743, 'nu': 0.5}. Best is trial 386 with value: 0.4872991004520934.
[I 2024-12-04 15:17:24,595] Trial 2146 finished with value: 0.4883034245668347 and parameters: {'kernel_type': 'Matern', 'length_scale': 90316.28497556163, 'noise_level': 0.004265816226336593, 'constant_value': 96116.77256240792, 'nu': 0.5}. Best is trial 386 with value: 0.4872991004520934.
[I 2024-12-04 15:17:25,539] Trial 2134 finished with value: 0.488303419167934 and parameters: {'kernel_type': 'Matern', 'length_scale': 433.1740556802792, 'noise_level': 0.051911360287644294, 'constant_value': 1826.3809090808138, 'nu': 0.5}. Best is trial 386 with value: 0.4872991004520934.
[I 2024-12-04 15:17:25,540] Trial 2138 finished with value: 1.2614547953941473 and parameters: {'kernel_type': 'Matern', 'length_scale': 12.38292552013907, 'noise_level': 0.03634575899295456, 'constant_value': 73824.14732869617, 'nu': 0.5}. Best is trial 386 with value: 0.4872991004520934.
[I 2024-12-04 15:17:25,948] Trial 2151 finished with value: 0.4883034868696918 and parameters: {'kernel_type': 'Matern', 'length_scale': 123.61679392698643, 'noise_level': 0.0576859642606016, 'constant_value': 17.2796244580079, 'nu': 0.5}. Best is trial 386 with value: 0.4872991004520934.
[I 2024-12-04 15:17:25,955] Trial 2142 finished with value: 1.2401112325207602 and parameters: {'kernel_type': 'Matern', 'length_scale': 160.05726229958287, 'noise_level': 0.00012041638998974431, 'constant_value': 320.16274853406094, 'nu': 2.5}. Best is trial 386 with value: 0.4872991004520934.
[I 2024-12-04 15:17:26,501] Trial 2145 finished with value: 0.48830338562676245 and parameters: {'kernel_type': 'Matern', 'length_scale': 73.93569676088596, 'noise_level': 0.004931471835441424, 'constant_value': 34.63877577085061, 'nu': 0.5}. Best is trial 386 with value: 0.4872991004520934.
[I 2024-12-04 15:17:27,517] Trial 2131 finished with value: 1.2614547953941473 and parameters: {'kernel_type': 'Matern', 'length_scale': 1400.1005832820663, 'noise_level': 0.020213454916439434, 'constant_value': 96685.36429344698, 'nu': 0.5}. Best is trial 386 with value: 0.4872991004520934.
[I 2024-12-04 15:17:29,059] Trial 2139 finished with value: 0.6443853144960316 and parameters: {'kernel_type': 'RBF', 'length_scale': 1676.1360536730342, 'noise_level': 0.6919711722577232, 'constant_value': 3044.002313762829, 'nu': 0.5}. Best is trial 386 with value: 0.4872991004520934.
[I 2024-12-04 15:17:34,185] Trial 2156 finished with value: 0.48830340454244914 and parameters: {'kernel_type': 'Matern', 'length_scale': 15.561275396397063, 'noise_level': 0.0007745400879523763, 'constant_value': 1369.9899573773746, 'nu': 0.5}. Best is trial 386 with value: 0.4872991004520934.
[I 2024-12-04 15:17:34,301] Trial 2148 finished with value: 0.48830283130417534 and parameters: {'kernel_type': 'Matern', 'length_scale': 70.26868281511318, 'noise_level': 0.0515792090381139, 'constant_value': 1270.082928011368, 'nu': 0.5}. Best is trial 386 with value: 0.4872991004520934.
[I 2024-12-04 15:17:34,381] Trial 2144 finished with value: 0.5663939949696224 and parameters: {'kernel_type': 'Matern', 'length_scale': 88.65213162424199, 'noise_level': 0.012720526179459167, 'constant_value': 1578.4932688187173, 'nu': 2.5}. Best is trial 386 with value: 0.4872991004520934.
[I 2024-12-04 15:17:35,211] Trial 2152 finished with value: 0.4883034285567294 and parameters: {'kernel_type': 'Matern', 'length_scale': 120.68039457557015, 'noise_level': 0.020408024486576186, 'constant_value': 57.640094415326, 'nu': 0.5}. Best is trial 386 with value: 0.4872991004520934.
[I 2024-12-04 15:17:36,837] Trial 2157 finished with value: 0.5663937155227831 and parameters: {'kernel_type': 'Matern', 'length_scale': 41.62530246276621, 'noise_level': 0.0002762578172493875, 'constant_value': 53831.47041624002, 'nu': 2.5}. Best is trial 386 with value: 0.4872991004520934.
[I 2024-12-04 15:17:36,852] Trial 2159 finished with value: 1.2614543702027754 and parameters: {'kernel_type': 'Matern', 'length_scale': 8.515358649734898e-05, 'noise_level': 8.624514527809992e-08, 'constant_value': 42.930235706055406, 'nu': 0.5}. Best is trial 386 with value: 0.4872991004520934.
[I 2024-12-04 15:17:37,228] Trial 2154 finished with value: 0.4883034188801616 and parameters: {'kernel_type': 'Matern', 'length_scale': 67788.02992941126, 'noise_level': 0.25283942248329366, 'constant_value': 66179.75095153532, 'nu': 0.5}. Best is trial 386 with value: 0.4872991004520934.
[I 2024-12-04 15:17:37,416] Trial 2153 finished with value: 1.261454795394147 and parameters: {'kernel_type': 'Matern', 'length_scale': 888.4926485853307, 'noise_level': 0.03010587206944085, 'constant_value': 59971.936303692244, 'nu': 0.5}. Best is trial 386 with value: 0.4872991004520934.
[I 2024-12-04 15:17:37,421] Trial 2150 finished with value: 0.48830341845197 and parameters: {'kernel_type': 'Matern', 'length_scale': 339.96439429226206, 'noise_level': 0.038403160375554565, 'constant_value': 672.4417192625178, 'nu': 0.5}. Best is trial 386 with value: 0.4872991004520934.
[I 2024-12-04 15:17:37,426] Trial 2149 finished with value: 0.488303424969489 and parameters: {'kernel_type': 'Matern', 'length_scale': 3046.129000018273, 'noise_level': 0.923871380043002, 'constant_value': 26127.254927574693, 'nu': 0.5}. Best is trial 386 with value: 0.4872991004520934.
[I 2024-12-04 15:17:38,155] Trial 2155 finished with value: 0.48830341487916723 and parameters: {'kernel_type': 'Matern', 'length_scale': 1205.675162181385, 'noise_level': 0.9944966628355725, 'constant_value': 57844.92435269992, 'nu': 0.5}. Best is trial 386 with value: 0.4872991004520934.
[I 2024-12-04 15:17:39,535] Trial 2161 finished with value: 0.4883034698229791 and parameters: {'kernel_type': 'Matern', 'length_scale': 232.30270434111344, 'noise_level': 0.9812422227115478, 'constant_value': 50.17186543386223, 'nu': 0.5}. Best is trial 386 with value: 0.4872991004520934.
[I 2024-12-04 15:17:39,536] Trial 2160 finished with value: 0.4883033788205569 and parameters: {'kernel_type': 'Matern', 'length_scale': 224.53206928713757, 'noise_level': 0.03356875457674098, 'constant_value': 0.6615338844260172, 'nu': 0.5}. Best is trial 386 with value: 0.4872991004520934.
[I 2024-12-04 15:17:39,948] Trial 2165 finished with value: 0.4883034218535379 and parameters: {'kernel_type': 'Matern', 'length_scale': 20.224394919581115, 'noise_level': 0.7900644952290578, 'constant_value': 12.492502815357687, 'nu': 0.5}. Best is trial 386 with value: 0.4872991004520934.
[I 2024-12-04 15:17:40,439] Trial 2163 finished with value: 0.4883034170667084 and parameters: {'kernel_type': 'Matern', 'length_scale': 13429.830702067085, 'noise_level': 0.019640352273301714, 'constant_value': 93265.4651652877, 'nu': 0.5}. Best is trial 386 with value: 0.4872991004520934.
[I 2024-12-04 15:17:41,770] Trial 2166 finished with value: 0.4883030304614271 and parameters: {'kernel_type': 'Matern', 'length_scale': 41812.881049045754, 'noise_level': 0.9514955056661111, 'constant_value': 78682.39645294, 'nu': 0.5}. Best is trial 386 with value: 0.4872991004520934.
[I 2024-12-04 15:17:41,788] Trial 2158 finished with value: 0.4883034191181301 and parameters: {'kernel_type': 'Matern', 'length_scale': 6057.002438577168, 'noise_level': 0.09113573148935737, 'constant_value': 93200.26674807242, 'nu': 0.5}. Best is trial 386 with value: 0.4872991004520934.
[I 2024-12-04 15:17:42,037] Trial 2176 finished with value: 1.261454795394147 and parameters: {'kernel_type': 'Matern', 'length_scale': 15.894705055265462, 'noise_level': 0.03961751334898988, 'constant_value': 49821.606913438125, 'nu': 0.5}. Best is trial 386 with value: 0.4872991004520934.
[I 2024-12-04 15:17:43,352] Trial 2169 finished with value: 0.4883034176959471 and parameters: {'kernel_type': 'Matern', 'length_scale': 2039.2260131892083, 'noise_level': 0.036783503718488667, 'constant_value': 878.7518772069153, 'nu': 0.5}. Best is trial 386 with value: 0.4872991004520934.
[I 2024-12-04 15:17:44,214] Trial 2164 finished with value: 0.4883034169945387 and parameters: {'kernel_type': 'Matern', 'length_scale': 4572.08508849291, 'noise_level': 0.0016276223433561601, 'constant_value': 1051.1671117893293, 'nu': 0.5}. Best is trial 386 with value: 0.4872991004520934.
[I 2024-12-04 15:17:44,307] Trial 2168 finished with value: 0.48830341568084207 and parameters: {'kernel_type': 'Matern', 'length_scale': 54.474786758294776, 'noise_level': 0.005167403918320581, 'constant_value': 2013.3668720774458, 'nu': 0.5}. Best is trial 386 with value: 0.4872991004520934.
[I 2024-12-04 15:17:44,310] Trial 2178 finished with value: 1.2401112327237926 and parameters: {'kernel_type': 'RBF', 'length_scale': 27714.38156186159, 'noise_level': 0.0006782906424954417, 'constant_value': 59683.47439541351, 'nu': 0.5}. Best is trial 386 with value: 0.4872991004520934.
[I 2024-12-04 15:17:45,089] Trial 2174 finished with value: 0.4883034194007545 and parameters: {'kernel_type': 'Matern', 'length_scale': 50341.90492167651, 'noise_level': 0.8902564471736625, 'constant_value': 47710.8944184376, 'nu': 0.5}. Best is trial 386 with value: 0.4872991004520934.
[I 2024-12-04 15:17:46,021] Trial 2171 finished with value: 1.2614547953941473 and parameters: {'kernel_type': 'Matern', 'length_scale': 2901.8016019469655, 'noise_level': 0.026183039598743893, 'constant_value': 8279.987324577884, 'nu': 0.5}. Best is trial 386 with value: 0.4872991004520934.
[I 2024-12-04 15:17:46,328] Trial 2175 finished with value: 0.4883034173217534 and parameters: {'kernel_type': 'Matern', 'length_scale': 73.0078854469113, 'noise_level': 0.8707444025473352, 'constant_value': 48365.51252769113, 'nu': 0.5}. Best is trial 386 with value: 0.4872991004520934.
[I 2024-12-04 15:17:46,441] Trial 2162 finished with value: 1.2401112326739752 and parameters: {'kernel_type': 'Matern', 'length_scale': 43552.93415051723, 'noise_level': 0.04546027772730592, 'constant_value': 95093.12613956198, 'nu': 1.5}. Best is trial 386 with value: 0.4872991004520934.
[I 2024-12-04 15:17:47,137] Trial 2172 finished with value: 1.240111232577623 and parameters: {'kernel_type': 'RBF', 'length_scale': 9.867933193367015e-05, 'noise_level': 4.878376182792453e-06, 'constant_value': 0.0010106931262161846, 'nu': 2.5}. Best is trial 386 with value: 0.4872991004520934.
