[I 2024-12-04 12:19:06,745] Trial 1653 finished with value: 0.5137486196757385 and parameters: {'n_estimators': 118, 'max_depth': 12, 'min_samples_split': 4, 'min_samples_leaf': 1, 'max_features': None, 'bootstrap': True, 'criterion': 'absolute_error'}. Best is trial 744 with value: 0.5032383725751689.
[I 2024-12-04 12:19:07,036] Trial 1663 finished with value: 1.2266772226537523 and parameters: {'n_estimators': 183, 'max_depth': 47, 'min_samples_split': 50, 'min_samples_leaf': 3, 'max_features': 'log2', 'bootstrap': True, 'criterion': 'squared_error'}. Best is trial 744 with value: 0.5032383725751689.
[I 2024-12-04 12:19:07,126] Trial 1658 finished with value: 1.1807546555382809 and parameters: {'n_estimators': 281, 'max_depth': 10, 'min_samples_split': 4, 'min_samples_leaf': 1, 'max_features': 'log2', 'bootstrap': True, 'criterion': 'absolute_error'}. Best is trial 744 with value: 0.5032383725751689.
[I 2024-12-04 12:19:09,166] Trial 1646 finished with value: 0.5177938905318442 and parameters: {'n_estimators': 236, 'max_depth': 11, 'min_samples_split': 4, 'min_samples_leaf': 1, 'max_features': None, 'bootstrap': True, 'criterion': 'absolute_error'}. Best is trial 744 with value: 0.5032383725751689.
[I 2024-12-04 12:19:09,436] Trial 1659 finished with value: 0.5513825858264774 and parameters: {'n_estimators': 157, 'max_depth': 10, 'min_samples_split': 6, 'min_samples_leaf': 2, 'max_features': None, 'bootstrap': True, 'criterion': 'absolute_error'}. Best is trial 744 with value: 0.5032383725751689.
[I 2024-12-04 12:19:10,326] Trial 1665 finished with value: 0.5089606507122737 and parameters: {'n_estimators': 101, 'max_depth': 20, 'min_samples_split': 4, 'min_samples_leaf': 1, 'max_features': None, 'bootstrap': True, 'criterion': 'absolute_error'}. Best is trial 744 with value: 0.5032383725751689.
[I 2024-12-04 12:19:11,510] Trial 1668 finished with value: 1.2655338827126277 and parameters: {'n_estimators': 433, 'max_depth': 16, 'min_samples_split': 12, 'min_samples_leaf': 5, 'max_features': 'sqrt', 'bootstrap': True, 'criterion': 'absolute_error'}. Best is trial 744 with value: 0.5032383725751689.
[I 2024-12-04 12:19:11,999] Trial 1662 finished with value: 0.526674433861831 and parameters: {'n_estimators': 346, 'max_depth': 10, 'min_samples_split': 4, 'min_samples_leaf': 1, 'max_features': None, 'bootstrap': True, 'criterion': 'squared_error'}. Best is trial 744 with value: 0.5032383725751689.
[I 2024-12-04 12:19:12,244] Trial 1624 finished with value: 0.572498442557272 and parameters: {'n_estimators': 595, 'max_depth': 5, 'min_samples_split': 5, 'min_samples_leaf': 1, 'max_features': None, 'bootstrap': False, 'criterion': 'absolute_error'}. Best is trial 744 with value: 0.5032383725751689.
[I 2024-12-04 12:19:12,812] Trial 1677 finished with value: 0.5341860743858621 and parameters: {'n_estimators': 103, 'max_depth': 17, 'min_samples_split': 3, 'min_samples_leaf': 1, 'max_features': None, 'bootstrap': True, 'criterion': 'squared_error'}. Best is trial 744 with value: 0.5032383725751689.
[I 2024-12-04 12:19:13,661] Trial 1666 finished with value: 0.506093559793775 and parameters: {'n_estimators': 111, 'max_depth': 19, 'min_samples_split': 4, 'min_samples_leaf': 1, 'max_features': None, 'bootstrap': True, 'criterion': 'absolute_error'}. Best is trial 744 with value: 0.5032383725751689.
[I 2024-12-04 12:19:13,703] Trial 1675 finished with value: 1.143824604167553 and parameters: {'n_estimators': 127, 'max_depth': 12, 'min_samples_split': 3, 'min_samples_leaf': 1, 'max_features': 'log2', 'bootstrap': True, 'criterion': 'absolute_error'}. Best is trial 744 with value: 0.5032383725751689.
[I 2024-12-04 12:19:13,931] Trial 1670 finished with value: 0.5204187265616788 and parameters: {'n_estimators': 108, 'max_depth': 9, 'min_samples_split': 3, 'min_samples_leaf': 1, 'max_features': None, 'bootstrap': True, 'criterion': 'absolute_error'}. Best is trial 744 with value: 0.5032383725751689.
[I 2024-12-04 12:19:17,075] Trial 1664 finished with value: 0.5173508634200236 and parameters: {'n_estimators': 117, 'max_depth': 19, 'min_samples_split': 7, 'min_samples_leaf': 1, 'max_features': None, 'bootstrap': True, 'criterion': 'absolute_error'}. Best is trial 744 with value: 0.5032383725751689.
[I 2024-12-04 12:19:17,144] Trial 1672 finished with value: 0.5559966713451505 and parameters: {'n_estimators': 129, 'max_depth': 17, 'min_samples_split': 4, 'min_samples_leaf': 2, 'max_features': None, 'bootstrap': True, 'criterion': 'absolute_error'}. Best is trial 744 with value: 0.5032383725751689.
[I 2024-12-04 12:19:17,902] Trial 1671 finished with value: 0.5609521332766525 and parameters: {'n_estimators': 118, 'max_depth': 10, 'min_samples_split': 8, 'min_samples_leaf': 2, 'max_features': None, 'bootstrap': True, 'criterion': 'absolute_error'}. Best is trial 744 with value: 0.5032383725751689.
[I 2024-12-04 12:19:18,275] Trial 1673 finished with value: 0.5162163497797051 and parameters: {'n_estimators': 101, 'max_depth': 10, 'min_samples_split': 4, 'min_samples_leaf': 1, 'max_features': None, 'bootstrap': True, 'criterion': 'absolute_error'}. Best is trial 744 with value: 0.5032383725751689.
[I 2024-12-04 12:19:18,994] Trial 1678 finished with value: 0.5599510428229632 and parameters: {'n_estimators': 112, 'max_depth': 21, 'min_samples_split': 7, 'min_samples_leaf': 2, 'max_features': None, 'bootstrap': True, 'criterion': 'absolute_error'}. Best is trial 744 with value: 0.5032383725751689.
[I 2024-12-04 12:19:19,378] Trial 1661 finished with value: 0.5141636795621949 and parameters: {'n_estimators': 234, 'max_depth': 16, 'min_samples_split': 4, 'min_samples_leaf': 1, 'max_features': None, 'bootstrap': True, 'criterion': 'absolute_error'}. Best is trial 744 with value: 0.5032383725751689.
[I 2024-12-04 12:19:19,815] Trial 1674 finished with value: 0.5477328247673847 and parameters: {'n_estimators': 109, 'max_depth': 11, 'min_samples_split': 3, 'min_samples_leaf': 2, 'max_features': None, 'bootstrap': True, 'criterion': 'absolute_error'}. Best is trial 744 with value: 0.5032383725751689.
[I 2024-12-04 12:19:19,853] Trial 1679 finished with value: 0.5097140044895734 and parameters: {'n_estimators': 102, 'max_depth': 14, 'min_samples_split': 6, 'min_samples_leaf': 1, 'max_features': None, 'bootstrap': True, 'criterion': 'absolute_error'}. Best is trial 744 with value: 0.5032383725751689.
[I 2024-12-04 12:19:19,961] Trial 1667 finished with value: 0.5452395663086473 and parameters: {'n_estimators': 125, 'max_depth': 19, 'min_samples_split': 6, 'min_samples_leaf': 1, 'max_features': None, 'bootstrap': False, 'criterion': 'absolute_error'}. Best is trial 744 with value: 0.5032383725751689.
[I 2024-12-04 12:19:20,514] Trial 1683 finished with value: 0.5565914469711299 and parameters: {'n_estimators': 115, 'max_depth': 24, 'min_samples_split': 4, 'min_samples_leaf': 2, 'max_features': None, 'bootstrap': True, 'criterion': 'absolute_error'}. Best is trial 744 with value: 0.5032383725751689.
[I 2024-12-04 12:19:20,963] Trial 1684 finished with value: 0.9122637279255336 and parameters: {'n_estimators': 104, 'max_depth': 15, 'min_samples_split': 6, 'min_samples_leaf': 1, 'max_features': 'sqrt', 'bootstrap': True, 'criterion': 'absolute_error'}. Best is trial 744 with value: 0.5032383725751689.
[I 2024-12-04 12:19:21,861] Trial 1669 finished with value: 1.1439764283430538 and parameters: {'n_estimators': 988, 'max_depth': 19, 'min_samples_split': 40, 'min_samples_leaf': 4, 'max_features': 'sqrt', 'bootstrap': False, 'criterion': 'absolute_error'}. Best is trial 744 with value: 0.5032383725751689.
[I 2024-12-04 12:19:22,395] Trial 1680 finished with value: 0.5156400644569118 and parameters: {'n_estimators': 102, 'max_depth': 13, 'min_samples_split': 6, 'min_samples_leaf': 1, 'max_features': None, 'bootstrap': True, 'criterion': 'absolute_error'}. Best is trial 744 with value: 0.5032383725751689.
[I 2024-12-04 12:19:23,542] Trial 1682 finished with value: 1.3432778112658434 and parameters: {'n_estimators': 594, 'max_depth': 13, 'min_samples_split': 5, 'min_samples_leaf': 8, 'max_features': 'log2', 'bootstrap': False, 'criterion': 'absolute_error'}. Best is trial 744 with value: 0.5032383725751689.
[I 2024-12-04 12:19:24,882] Trial 1685 finished with value: 1.0131181678960834 and parameters: {'n_estimators': 471, 'max_depth': 23, 'min_samples_split': 33, 'min_samples_leaf': 1, 'max_features': 'log2', 'bootstrap': False, 'criterion': 'absolute_error'}. Best is trial 744 with value: 0.5032383725751689.
[I 2024-12-04 12:19:25,606] Trial 1689 finished with value: 0.5121366009967707 and parameters: {'n_estimators': 108, 'max_depth': 20, 'min_samples_split': 2, 'min_samples_leaf': 1, 'max_features': None, 'bootstrap': True, 'criterion': 'absolute_error'}. Best is trial 744 with value: 0.5032383725751689.
[I 2024-12-04 12:19:27,210] Trial 1690 finished with value: 0.7051488613613425 and parameters: {'n_estimators': 389, 'max_depth': 43, 'min_samples_split': 8, 'min_samples_leaf': 13, 'max_features': None, 'bootstrap': False, 'criterion': 'squared_error'}. Best is trial 744 with value: 0.5032383725751689.
[I 2024-12-04 12:19:27,843] Trial 1692 finished with value: 1.3673764554831618 and parameters: {'n_estimators': 848, 'max_depth': 50, 'min_samples_split': 2, 'min_samples_leaf': 13, 'max_features': 'log2', 'bootstrap': True, 'criterion': 'absolute_error'}. Best is trial 744 with value: 0.5032383725751689.
[I 2024-12-04 12:19:28,113] Trial 1688 finished with value: 0.5091998033526012 and parameters: {'n_estimators': 101, 'max_depth': 16, 'min_samples_split': 2, 'min_samples_leaf': 1, 'max_features': None, 'bootstrap': True, 'criterion': 'absolute_error'}. Best is trial 744 with value: 0.5032383725751689.
[I 2024-12-04 12:19:28,122] Trial 1686 finished with value: 0.5153019085392898 and parameters: {'n_estimators': 113, 'max_depth': 22, 'min_samples_split': 4, 'min_samples_leaf': 1, 'max_features': None, 'bootstrap': True, 'criterion': 'absolute_error'}. Best is trial 744 with value: 0.5032383725751689.
[I 2024-12-04 12:19:28,169] Trial 1687 finished with value: 1.333551415125334 and parameters: {'n_estimators': 736, 'max_depth': 6, 'min_samples_split': 6, 'min_samples_leaf': 10, 'max_features': 'sqrt', 'bootstrap': True, 'criterion': 'absolute_error'}. Best is trial 744 with value: 0.5032383725751689.
[I 2024-12-04 12:19:31,086] Trial 1676 finished with value: 0.5211814502253361 and parameters: {'n_estimators': 223, 'max_depth': 26, 'min_samples_split': 3, 'min_samples_leaf': 1, 'max_features': None, 'bootstrap': True, 'criterion': 'absolute_error'}. Best is trial 744 with value: 0.5032383725751689.
[I 2024-12-04 12:19:31,297] Trial 1693 finished with value: 0.5124997858647643 and parameters: {'n_estimators': 105, 'max_depth': 13, 'min_samples_split': 3, 'min_samples_leaf': 1, 'max_features': None, 'bootstrap': True, 'criterion': 'absolute_error'}. Best is trial 744 with value: 0.5032383725751689.
[I 2024-12-04 12:19:31,432] Trial 1696 finished with value: 0.5146021481514743 and parameters: {'n_estimators': 107, 'max_depth': 22, 'min_samples_split': 4, 'min_samples_leaf': 1, 'max_features': None, 'bootstrap': True, 'criterion': 'absolute_error'}. Best is trial 744 with value: 0.5032383725751689.
[I 2024-12-04 12:19:32,003] Trial 1701 finished with value: 0.6395251015105912 and parameters: {'n_estimators': 145, 'max_depth': 15, 'min_samples_split': 4, 'min_samples_leaf': 6, 'max_features': None, 'bootstrap': True, 'criterion': 'absolute_error'}. Best is trial 744 with value: 0.5032383725751689.
[I 2024-12-04 12:19:33,131] Trial 1695 finished with value: 0.5568234211271348 and parameters: {'n_estimators': 210, 'max_depth': 20, 'min_samples_split': 2, 'min_samples_leaf': 2, 'max_features': None, 'bootstrap': True, 'criterion': 'absolute_error'}. Best is trial 744 with value: 0.5032383725751689.
[I 2024-12-04 12:19:33,662] Trial 1697 finished with value: 0.548145435950479 and parameters: {'n_estimators': 106, 'max_depth': 11, 'min_samples_split': 4, 'min_samples_leaf': 2, 'max_features': None, 'bootstrap': True, 'criterion': 'absolute_error'}. Best is trial 744 with value: 0.5032383725751689.
[I 2024-12-04 12:19:34,818] Trial 1694 finished with value: 0.5546862082787544 and parameters: {'n_estimators': 125, 'max_depth': 23, 'min_samples_split': 3, 'min_samples_leaf': 2, 'max_features': None, 'bootstrap': True, 'criterion': 'absolute_error'}. Best is trial 744 with value: 0.5032383725751689.
[I 2024-12-04 12:19:34,887] Trial 1711 finished with value: 0.5352376355587172 and parameters: {'n_estimators': 103, 'max_depth': 18, 'min_samples_split': 8, 'min_samples_leaf': 1, 'max_features': None, 'bootstrap': True, 'criterion': 'squared_error'}. Best is trial 744 with value: 0.5032383725751689.
[I 2024-12-04 12:19:35,174] Trial 1681 finished with value: 0.5223250596427422 and parameters: {'n_estimators': 260, 'max_depth': 20, 'min_samples_split': 3, 'min_samples_leaf': 1, 'max_features': None, 'bootstrap': True, 'criterion': 'absolute_error'}. Best is trial 744 with value: 0.5032383725751689.
[I 2024-12-04 12:19:37,704] Trial 1714 finished with value: 1.3281525859146968 and parameters: {'n_estimators': 348, 'max_depth': 5, 'min_samples_split': 19, 'min_samples_leaf': 14, 'max_features': 'sqrt', 'bootstrap': False, 'criterion': 'absolute_error'}. Best is trial 744 with value: 0.5032383725751689.
[I 2024-12-04 12:19:41,521] Trial 1691 finished with value: 0.5250461866630168 and parameters: {'n_estimators': 175, 'max_depth': 27, 'min_samples_split': 3, 'min_samples_leaf': 1, 'max_features': None, 'bootstrap': True, 'criterion': 'absolute_error'}. Best is trial 744 with value: 0.5032383725751689.
[I 2024-12-04 12:19:41,705] Trial 1704 finished with value: 0.5141834990677235 and parameters: {'n_estimators': 111, 'max_depth': 21, 'min_samples_split': 4, 'min_samples_leaf': 1, 'max_features': None, 'bootstrap': True, 'criterion': 'absolute_error'}. Best is trial 744 with value: 0.5032383725751689.
[I 2024-12-04 12:19:41,978] Trial 1710 finished with value: 1.1390985514637844 and parameters: {'n_estimators': 751, 'max_depth': 22, 'min_samples_split': 2, 'min_samples_leaf': 4, 'max_features': 'sqrt', 'bootstrap': False, 'criterion': 'absolute_error'}. Best is trial 744 with value: 0.5032383725751689.
[I 2024-12-04 12:19:43,938] Trial 1700 finished with value: 0.510905433991622 and parameters: {'n_estimators': 111, 'max_depth': 20, 'min_samples_split': 4, 'min_samples_leaf': 1, 'max_features': None, 'bootstrap': True, 'criterion': 'absolute_error'}. Best is trial 744 with value: 0.5032383725751689.
[I 2024-12-04 12:19:44,083] Trial 1723 finished with value: 1.347176387414269 and parameters: {'n_estimators': 150, 'max_depth': 6, 'min_samples_split': 33, 'min_samples_leaf': 8, 'max_features': 'log2', 'bootstrap': False, 'criterion': 'absolute_error'}. Best is trial 744 with value: 0.5032383725751689.
[I 2024-12-04 12:19:44,540] Trial 1705 finished with value: 0.5561969962785595 and parameters: {'n_estimators': 108, 'max_depth': 14, 'min_samples_split': 5, 'min_samples_leaf': 2, 'max_features': None, 'bootstrap': True, 'criterion': 'absolute_error'}. Best is trial 744 with value: 0.5032383725751689.
[I 2024-12-04 12:19:44,643] Trial 1702 finished with value: 1.2160320105900033 and parameters: {'n_estimators': 312, 'max_depth': 42, 'min_samples_split': 2, 'min_samples_leaf': 2, 'max_features': 'log2', 'bootstrap': False, 'criterion': 'absolute_error'}. Best is trial 744 with value: 0.5032383725751689.
[I 2024-12-04 12:19:45,040] Trial 1698 finished with value: 0.762483587156389 and parameters: {'n_estimators': 585, 'max_depth': 23, 'min_samples_split': 8, 'min_samples_leaf': 1, 'max_features': 'sqrt', 'bootstrap': True, 'criterion': 'absolute_error'}. Best is trial 744 with value: 0.5032383725751689.
[I 2024-12-04 12:19:46,809] Trial 1709 finished with value: 0.5101502341989821 and parameters: {'n_estimators': 106, 'max_depth': 23, 'min_samples_split': 4, 'min_samples_leaf': 1, 'max_features': None, 'bootstrap': True, 'criterion': 'absolute_error'}. Best is trial 744 with value: 0.5032383725751689.
[I 2024-12-04 12:19:46,994] Trial 1718 finished with value: 1.1340226036089645 and parameters: {'n_estimators': 102, 'max_depth': 15, 'min_samples_split': 7, 'min_samples_leaf': 1, 'max_features': 'log2', 'bootstrap': True, 'criterion': 'absolute_error'}. Best is trial 744 with value: 0.5032383725751689.
[I 2024-12-04 12:19:47,013] Trial 1719 finished with value: 1.369164697171036 and parameters: {'n_estimators': 582, 'max_depth': 26, 'min_samples_split': 5, 'min_samples_leaf': 13, 'max_features': 'log2', 'bootstrap': True, 'criterion': 'absolute_error'}. Best is trial 744 with value: 0.5032383725751689.
[I 2024-12-04 12:19:47,123] Trial 1699 finished with value: 0.5574563682581511 and parameters: {'n_estimators': 255, 'max_depth': 16, 'min_samples_split': 4, 'min_samples_leaf': 2, 'max_features': None, 'bootstrap': True, 'criterion': 'absolute_error'}. Best is trial 744 with value: 0.5032383725751689.
[I 2024-12-04 12:19:47,823] Trial 1708 finished with value: 0.5137127339633514 and parameters: {'n_estimators': 102, 'max_depth': 17, 'min_samples_split': 4, 'min_samples_leaf': 1, 'max_features': None, 'bootstrap': True, 'criterion': 'absolute_error'}. Best is trial 744 with value: 0.5032383725751689.
[I 2024-12-04 12:19:49,423] Trial 1706 finished with value: 0.523529946751727 and parameters: {'n_estimators': 244, 'max_depth': 21, 'min_samples_split': 7, 'min_samples_leaf': 1, 'max_features': None, 'bootstrap': True, 'criterion': 'absolute_error'}. Best is trial 744 with value: 0.5032383725751689.
[I 2024-12-04 12:19:51,503] Trial 1713 finished with value: 0.720033135714347 and parameters: {'n_estimators': 441, 'max_depth': 21, 'min_samples_split': 2, 'min_samples_leaf': 1, 'max_features': 'sqrt', 'bootstrap': False, 'criterion': 'absolute_error'}. Best is trial 744 with value: 0.5032383725751689.
[I 2024-12-04 12:19:52,261] Trial 1721 finished with value: 0.5589455794885956 and parameters: {'n_estimators': 109, 'max_depth': 19, 'min_samples_split': 5, 'min_samples_leaf': 2, 'max_features': None, 'bootstrap': True, 'criterion': 'absolute_error'}. Best is trial 744 with value: 0.5032383725751689.
[I 2024-12-04 12:19:52,780] Trial 1725 finished with value: 1.0036023724674805 and parameters: {'n_estimators': 273, 'max_depth': 12, 'min_samples_split': 22, 'min_samples_leaf': 2, 'max_features': 'sqrt', 'bootstrap': False, 'criterion': 'absolute_error'}. Best is trial 744 with value: 0.5032383725751689.
[I 2024-12-04 12:19:54,636] Trial 1717 finished with value: 0.5115128247497281 and parameters: {'n_estimators': 100, 'max_depth': 14, 'min_samples_split': 3, 'min_samples_leaf': 1, 'max_features': None, 'bootstrap': True, 'criterion': 'absolute_error'}. Best is trial 744 with value: 0.5032383725751689.
[I 2024-12-04 12:19:54,637] Trial 1730 finished with value: 0.55748230045627 and parameters: {'n_estimators': 107, 'max_depth': 20, 'min_samples_split': 4, 'min_samples_leaf': 2, 'max_features': None, 'bootstrap': True, 'criterion': 'absolute_error'}. Best is trial 744 with value: 0.5032383725751689.
[I 2024-12-04 12:19:58,505] Trial 1712 finished with value: 0.5170375842817746 and parameters: {'n_estimators': 304, 'max_depth': 25, 'min_samples_split': 5, 'min_samples_leaf': 1, 'max_features': None, 'bootstrap': True, 'criterion': 'absolute_error'}. Best is trial 744 with value: 0.5032383725751689.
[I 2024-12-04 12:19:59,047] Trial 1703 finished with value: 0.5172729270000171 and parameters: {'n_estimators': 272, 'max_depth': 19, 'min_samples_split': 2, 'min_samples_leaf': 1, 'max_features': None, 'bootstrap': True, 'criterion': 'absolute_error'}. Best is trial 744 with value: 0.5032383725751689.
[I 2024-12-04 12:19:59,571] Trial 1707 finished with value: 0.5256368940595695 and parameters: {'n_estimators': 226, 'max_depth': 23, 'min_samples_split': 7, 'min_samples_leaf': 1, 'max_features': None, 'bootstrap': True, 'criterion': 'absolute_error'}. Best is trial 744 with value: 0.5032383725751689.
[I 2024-12-04 12:19:59,951] Trial 1715 finished with value: 0.5188321348397607 and parameters: {'n_estimators': 252, 'max_depth': 19, 'min_samples_split': 3, 'min_samples_leaf': 1, 'max_features': None, 'bootstrap': True, 'criterion': 'absolute_error'}. Best is trial 744 with value: 0.5032383725751689.
[I 2024-12-04 12:20:00,068] Trial 1729 finished with value: 0.7233316336347874 and parameters: {'n_estimators': 920, 'max_depth': 30, 'min_samples_split': 30, 'min_samples_leaf': 15, 'max_features': None, 'bootstrap': False, 'criterion': 'squared_error'}. Best is trial 744 with value: 0.5032383725751689.
[I 2024-12-04 12:20:02,255] Trial 1731 finished with value: 0.5185348758063046 and parameters: {'n_estimators': 103, 'max_depth': 20, 'min_samples_split': 3, 'min_samples_leaf': 1, 'max_features': None, 'bootstrap': True, 'criterion': 'absolute_error'}. Best is trial 744 with value: 0.5032383725751689.
[I 2024-12-04 12:20:02,748] Trial 1737 finished with value: 0.9995458230101127 and parameters: {'n_estimators': 148, 'max_depth': 20, 'min_samples_split': 8, 'min_samples_leaf': 2, 'max_features': 'sqrt', 'bootstrap': True, 'criterion': 'absolute_error'}. Best is trial 744 with value: 0.5032383725751689.
[I 2024-12-04 12:20:07,862] Trial 1738 finished with value: 0.5107451738914641 and parameters: {'n_estimators': 102, 'max_depth': 16, 'min_samples_split': 5, 'min_samples_leaf': 1, 'max_features': None, 'bootstrap': True, 'criterion': 'absolute_error'}. Best is trial 744 with value: 0.5032383725751689.
[I 2024-12-04 12:20:07,898] Trial 1741 finished with value: 0.6079176126777484 and parameters: {'n_estimators': 214, 'max_depth': 33, 'min_samples_split': 46, 'min_samples_leaf': 4, 'max_features': None, 'bootstrap': True, 'criterion': 'squared_error'}. Best is trial 744 with value: 0.5032383725751689.
