[I 2024-12-04 12:25:24,521] Trial 2098 finished with value: 1.352381311903049 and parameters: {'n_estimators': 723, 'max_depth': 31, 'min_samples_split': 2, 'min_samples_leaf': 8, 'max_features': 'log2', 'bootstrap': True, 'criterion': 'absolute_error'}. Best is trial 1749 with value: 0.502720715661024.
[I 2024-12-04 12:25:24,690] Trial 2072 finished with value: 0.8370839750388905 and parameters: {'n_estimators': 751, 'max_depth': 47, 'min_samples_split': 41, 'min_samples_leaf': 5, 'max_features': None, 'bootstrap': False, 'criterion': 'absolute_error'}. Best is trial 1749 with value: 0.502720715661024.
[I 2024-12-04 12:25:25,481] Trial 2090 finished with value: 1.0637345766275628 and parameters: {'n_estimators': 991, 'max_depth': 8, 'min_samples_split': 7, 'min_samples_leaf': 3, 'max_features': 'sqrt', 'bootstrap': True, 'criterion': 'squared_error'}. Best is trial 1749 with value: 0.502720715661024.
[I 2024-12-04 12:25:26,006] Trial 2097 finished with value: 0.5110104239375618 and parameters: {'n_estimators': 108, 'max_depth': 14, 'min_samples_split': 6, 'min_samples_leaf': 1, 'max_features': None, 'bootstrap': True, 'criterion': 'absolute_error'}. Best is trial 1749 with value: 0.502720715661024.
[I 2024-12-04 12:25:26,087] Trial 2095 finished with value: 0.5149091884290169 and parameters: {'n_estimators': 103, 'max_depth': 18, 'min_samples_split': 2, 'min_samples_leaf': 1, 'max_features': None, 'bootstrap': True, 'criterion': 'absolute_error'}. Best is trial 1749 with value: 0.502720715661024.
[I 2024-12-04 12:25:28,240] Trial 2100 finished with value: 0.7117933930226653 and parameters: {'n_estimators': 182, 'max_depth': 31, 'min_samples_split': 15, 'min_samples_leaf': 10, 'max_features': None, 'bootstrap': True, 'criterion': 'squared_error'}. Best is trial 1749 with value: 0.502720715661024.
[I 2024-12-04 12:25:29,552] Trial 2086 finished with value: 0.5631163841597966 and parameters: {'n_estimators': 236, 'max_depth': 23, 'min_samples_split': 6, 'min_samples_leaf': 2, 'max_features': None, 'bootstrap': True, 'criterion': 'absolute_error'}. Best is trial 1749 with value: 0.502720715661024.
[I 2024-12-04 12:25:33,991] Trial 2104 finished with value: 0.5227489790904738 and parameters: {'n_estimators': 113, 'max_depth': 8, 'min_samples_split': 6, 'min_samples_leaf': 1, 'max_features': None, 'bootstrap': True, 'criterion': 'absolute_error'}. Best is trial 1749 with value: 0.502720715661024.
[I 2024-12-04 12:25:34,977] Trial 2103 finished with value: 0.5981890696699191 and parameters: {'n_estimators': 529, 'max_depth': 45, 'min_samples_split': 7, 'min_samples_leaf': 1, 'max_features': 'sqrt', 'bootstrap': False, 'criterion': 'squared_error'}. Best is trial 1749 with value: 0.502720715661024.
[I 2024-12-04 12:25:37,037] Trial 2093 finished with value: 0.5308191715058788 and parameters: {'n_estimators': 279, 'max_depth': 36, 'min_samples_split': 10, 'min_samples_leaf': 1, 'max_features': None, 'bootstrap': True, 'criterion': 'absolute_error'}. Best is trial 1749 with value: 0.502720715661024.
[I 2024-12-04 12:25:38,790] Trial 2112 finished with value: 0.8839392119431143 and parameters: {'n_estimators': 298, 'max_depth': 37, 'min_samples_split': 28, 'min_samples_leaf': 3, 'max_features': 'sqrt', 'bootstrap': False, 'criterion': 'squared_error'}. Best is trial 1749 with value: 0.502720715661024.
[I 2024-12-04 12:25:39,105] Trial 2096 finished with value: 0.5560374826808687 and parameters: {'n_estimators': 292, 'max_depth': 13, 'min_samples_split': 8, 'min_samples_leaf': 2, 'max_features': None, 'bootstrap': True, 'criterion': 'absolute_error'}. Best is trial 1749 with value: 0.502720715661024.
[I 2024-12-04 12:25:39,667] Trial 2092 finished with value: 0.5178367980437862 and parameters: {'n_estimators': 265, 'max_depth': 24, 'min_samples_split': 5, 'min_samples_leaf': 1, 'max_features': None, 'bootstrap': True, 'criterion': 'absolute_error'}. Best is trial 1749 with value: 0.502720715661024.
[I 2024-12-04 12:25:39,678] Trial 2101 finished with value: 0.5145026148388683 and parameters: {'n_estimators': 101, 'max_depth': 14, 'min_samples_split': 7, 'min_samples_leaf': 1, 'max_features': None, 'bootstrap': True, 'criterion': 'absolute_error'}. Best is trial 1749 with value: 0.502720715661024.
[I 2024-12-04 12:25:40,217] Trial 2111 finished with value: 0.508867220311531 and parameters: {'n_estimators': 113, 'max_depth': 18, 'min_samples_split': 5, 'min_samples_leaf': 1, 'max_features': None, 'bootstrap': True, 'criterion': 'absolute_error'}. Best is trial 1749 with value: 0.502720715661024.
[I 2024-12-04 12:25:41,580] Trial 2094 finished with value: 0.5193355849551202 and parameters: {'n_estimators': 239, 'max_depth': 14, 'min_samples_split': 4, 'min_samples_leaf': 1, 'max_features': None, 'bootstrap': True, 'criterion': 'absolute_error'}. Best is trial 1749 with value: 0.502720715661024.
[I 2024-12-04 12:25:43,438] Trial 2107 finished with value: 0.5539762997395559 and parameters: {'n_estimators': 109, 'max_depth': 21, 'min_samples_split': 4, 'min_samples_leaf': 2, 'max_features': None, 'bootstrap': True, 'criterion': 'absolute_error'}. Best is trial 1749 with value: 0.502720715661024.
[I 2024-12-04 12:25:44,120] Trial 2108 finished with value: 0.5086237435041229 and parameters: {'n_estimators': 100, 'max_depth': 20, 'min_samples_split': 5, 'min_samples_leaf': 1, 'max_features': None, 'bootstrap': True, 'criterion': 'absolute_error'}. Best is trial 1749 with value: 0.502720715661024.
[I 2024-12-04 12:25:45,397] Trial 2118 finished with value: 1.1839625606350757 and parameters: {'n_estimators': 592, 'max_depth': 28, 'min_samples_split': 19, 'min_samples_leaf': 3, 'max_features': 'log2', 'bootstrap': False, 'criterion': 'squared_error'}. Best is trial 1749 with value: 0.502720715661024.
[I 2024-12-04 12:25:45,517] Trial 2124 finished with value: 1.2301174572099274 and parameters: {'n_estimators': 401, 'max_depth': 33, 'min_samples_split': 4, 'min_samples_leaf': 9, 'max_features': 'log2', 'bootstrap': False, 'criterion': 'squared_error'}. Best is trial 1749 with value: 0.502720715661024.
[I 2024-12-04 12:25:45,552] Trial 2121 finished with value: 0.5230463559330931 and parameters: {'n_estimators': 117, 'max_depth': 17, 'min_samples_split': 2, 'min_samples_leaf': 1, 'max_features': None, 'bootstrap': True, 'criterion': 'squared_error'}. Best is trial 1749 with value: 0.502720715661024.
[I 2024-12-04 12:25:46,865] Trial 2102 finished with value: 0.5184575402666458 and parameters: {'n_estimators': 260, 'max_depth': 18, 'min_samples_split': 6, 'min_samples_leaf': 1, 'max_features': None, 'bootstrap': True, 'criterion': 'absolute_error'}. Best is trial 1749 with value: 0.502720715661024.
[I 2024-12-04 12:25:47,051] Trial 2099 finished with value: 0.5296826845424372 and parameters: {'n_estimators': 262, 'max_depth': 21, 'min_samples_split': 8, 'min_samples_leaf': 1, 'max_features': None, 'bootstrap': True, 'criterion': 'absolute_error'}. Best is trial 1749 with value: 0.502720715661024.
[I 2024-12-04 12:25:47,709] Trial 2119 finished with value: 0.7069645566498407 and parameters: {'n_estimators': 101, 'max_depth': 25, 'min_samples_split': 5, 'min_samples_leaf': 1, 'max_features': 'sqrt', 'bootstrap': False, 'criterion': 'absolute_error'}. Best is trial 1749 with value: 0.502720715661024.
[I 2024-12-04 12:25:49,122] Trial 2105 finished with value: 0.5216849808131374 and parameters: {'n_estimators': 247, 'max_depth': 21, 'min_samples_split': 2, 'min_samples_leaf': 1, 'max_features': None, 'bootstrap': True, 'criterion': 'absolute_error'}. Best is trial 1749 with value: 0.502720715661024.
[I 2024-12-04 12:25:49,175] Trial 2106 finished with value: 0.5178381702920497 and parameters: {'n_estimators': 238, 'max_depth': 21, 'min_samples_split': 5, 'min_samples_leaf': 1, 'max_features': None, 'bootstrap': True, 'criterion': 'absolute_error'}. Best is trial 1749 with value: 0.502720715661024.
[I 2024-12-04 12:25:50,612] Trial 2110 finished with value: 1.0022642736687177 and parameters: {'n_estimators': 672, 'max_depth': 19, 'min_samples_split': 2, 'min_samples_leaf': 1, 'max_features': 'log2', 'bootstrap': True, 'criterion': 'absolute_error'}. Best is trial 1749 with value: 0.502720715661024.
[I 2024-12-04 12:25:50,615] Trial 2109 finished with value: 0.5572185758740109 and parameters: {'n_estimators': 279, 'max_depth': 18, 'min_samples_split': 7, 'min_samples_leaf': 2, 'max_features': None, 'bootstrap': True, 'criterion': 'absolute_error'}. Best is trial 1749 with value: 0.502720715661024.
[I 2024-12-04 12:25:51,402] Trial 2113 finished with value: 0.5557808367434376 and parameters: {'n_estimators': 232, 'max_depth': 15, 'min_samples_split': 2, 'min_samples_leaf': 2, 'max_features': None, 'bootstrap': True, 'criterion': 'absolute_error'}. Best is trial 1749 with value: 0.502720715661024.
[I 2024-12-04 12:25:58,961] Trial 2120 finished with value: 0.5555131342897682 and parameters: {'n_estimators': 274, 'max_depth': 16, 'min_samples_split': 4, 'min_samples_leaf': 2, 'max_features': None, 'bootstrap': True, 'criterion': 'absolute_error'}. Best is trial 1749 with value: 0.502720715661024.
[I 2024-12-04 12:25:59,594] Trial 2122 finished with value: 0.5973856433238725 and parameters: {'n_estimators': 747, 'max_depth': 13, 'min_samples_split': 19, 'min_samples_leaf': 1, 'max_features': None, 'bootstrap': False, 'criterion': 'squared_error'}. Best is trial 1749 with value: 0.502720715661024.
[I 2024-12-04 12:26:02,688] Trial 2126 finished with value: 0.5579678837975832 and parameters: {'n_estimators': 103, 'max_depth': 22, 'min_samples_split': 4, 'min_samples_leaf': 1, 'max_features': None, 'bootstrap': False, 'criterion': 'absolute_error'}. Best is trial 1749 with value: 0.502720715661024.
[I 2024-12-04 12:26:02,701] Trial 2128 finished with value: 0.6247604749298787 and parameters: {'n_estimators': 100, 'max_depth': 14, 'min_samples_split': 2, 'min_samples_leaf': 2, 'max_features': None, 'bootstrap': False, 'criterion': 'absolute_error'}. Best is trial 1749 with value: 0.502720715661024.
[I 2024-12-04 12:26:02,768] Trial 2125 finished with value: 0.5107775578979667 and parameters: {'n_estimators': 102, 'max_depth': 22, 'min_samples_split': 5, 'min_samples_leaf': 1, 'max_features': None, 'bootstrap': True, 'criterion': 'absolute_error'}. Best is trial 1749 with value: 0.502720715661024.
[I 2024-12-04 12:26:03,984] Trial 2114 finished with value: 0.5243485206544336 and parameters: {'n_estimators': 260, 'max_depth': 30, 'min_samples_split': 6, 'min_samples_leaf': 1, 'max_features': None, 'bootstrap': True, 'criterion': 'absolute_error'}. Best is trial 1749 with value: 0.502720715661024.
[I 2024-12-04 12:26:04,262] Trial 2134 finished with value: 0.5114223840286527 and parameters: {'n_estimators': 107, 'max_depth': 14, 'min_samples_split': 6, 'min_samples_leaf': 1, 'max_features': None, 'bootstrap': True, 'criterion': 'absolute_error'}. Best is trial 1749 with value: 0.502720715661024.
[I 2024-12-04 12:26:04,628] Trial 2127 finished with value: 0.5110511755583368 and parameters: {'n_estimators': 117, 'max_depth': 20, 'min_samples_split': 5, 'min_samples_leaf': 1, 'max_features': None, 'bootstrap': True, 'criterion': 'absolute_error'}. Best is trial 1749 with value: 0.502720715661024.
[I 2024-12-04 12:26:05,140] Trial 2132 finished with value: 0.51274648203097 and parameters: {'n_estimators': 122, 'max_depth': 33, 'min_samples_split': 5, 'min_samples_leaf': 1, 'max_features': None, 'bootstrap': True, 'criterion': 'absolute_error'}. Best is trial 1749 with value: 0.502720715661024.
[I 2024-12-04 12:26:05,675] Trial 2116 finished with value: 0.5231327254539796 and parameters: {'n_estimators': 256, 'max_depth': 24, 'min_samples_split': 2, 'min_samples_leaf': 1, 'max_features': None, 'bootstrap': True, 'criterion': 'absolute_error'}. Best is trial 1749 with value: 0.502720715661024.
[I 2024-12-04 12:26:06,218] Trial 2117 finished with value: 0.5173248746592379 and parameters: {'n_estimators': 234, 'max_depth': 17, 'min_samples_split': 5, 'min_samples_leaf': 1, 'max_features': None, 'bootstrap': True, 'criterion': 'absolute_error'}. Best is trial 1749 with value: 0.502720715661024.
[I 2024-12-04 12:26:06,586] Trial 2129 finished with value: 1.045372261689969 and parameters: {'n_estimators': 334, 'max_depth': 31, 'min_samples_split': 5, 'min_samples_leaf': 3, 'max_features': 'sqrt', 'bootstrap': True, 'criterion': 'squared_error'}. Best is trial 1749 with value: 0.502720715661024.
[I 2024-12-04 12:26:06,893] Trial 2140 finished with value: 0.6637504446453595 and parameters: {'n_estimators': 524, 'max_depth': 8, 'min_samples_split': 10, 'min_samples_leaf': 8, 'max_features': None, 'bootstrap': True, 'criterion': 'squared_error'}. Best is trial 1749 with value: 0.502720715661024.
[I 2024-12-04 12:26:07,070] Trial 2115 finished with value: 0.5163158536086299 and parameters: {'n_estimators': 273, 'max_depth': 17, 'min_samples_split': 3, 'min_samples_leaf': 1, 'max_features': None, 'bootstrap': True, 'criterion': 'absolute_error'}. Best is trial 1749 with value: 0.502720715661024.
[I 2024-12-04 12:26:08,214] Trial 2139 finished with value: 0.5574268175865089 and parameters: {'n_estimators': 109, 'max_depth': 20, 'min_samples_split': 2, 'min_samples_leaf': 2, 'max_features': None, 'bootstrap': True, 'criterion': 'absolute_error'}. Best is trial 1749 with value: 0.502720715661024.
[I 2024-12-04 12:26:08,215] Trial 2136 finished with value: 0.5239223941530177 and parameters: {'n_estimators': 122, 'max_depth': 7, 'min_samples_split': 4, 'min_samples_leaf': 1, 'max_features': None, 'bootstrap': True, 'criterion': 'absolute_error'}. Best is trial 1749 with value: 0.502720715661024.
[I 2024-12-04 12:26:08,495] Trial 2133 finished with value: 0.5552812919581159 and parameters: {'n_estimators': 241, 'max_depth': 13, 'min_samples_split': 3, 'min_samples_leaf': 2, 'max_features': None, 'bootstrap': True, 'criterion': 'absolute_error'}. Best is trial 1749 with value: 0.502720715661024.
[I 2024-12-04 12:26:09,981] Trial 2123 finished with value: 0.518167182182442 and parameters: {'n_estimators': 253, 'max_depth': 14, 'min_samples_split': 3, 'min_samples_leaf': 1, 'max_features': None, 'bootstrap': True, 'criterion': 'absolute_error'}. Best is trial 1749 with value: 0.502720715661024.
[I 2024-12-04 12:26:10,042] Trial 2138 finished with value: 0.5073326101716571 and parameters: {'n_estimators': 109, 'max_depth': 14, 'min_samples_split': 5, 'min_samples_leaf': 1, 'max_features': None, 'bootstrap': True, 'criterion': 'absolute_error'}. Best is trial 1749 with value: 0.502720715661024.
[I 2024-12-04 12:26:10,572] Trial 2130 finished with value: 0.5561278161605107 and parameters: {'n_estimators': 110, 'max_depth': 26, 'min_samples_split': 4, 'min_samples_leaf': 2, 'max_features': None, 'bootstrap': True, 'criterion': 'absolute_error'}. Best is trial 1749 with value: 0.502720715661024.
[I 2024-12-04 12:26:11,432] Trial 2135 finished with value: 0.855549606820489 and parameters: {'n_estimators': 483, 'max_depth': 36, 'min_samples_split': 7, 'min_samples_leaf': 1, 'max_features': 'log2', 'bootstrap': True, 'criterion': 'absolute_error'}. Best is trial 1749 with value: 0.502720715661024.
[I 2024-12-04 12:26:11,836] Trial 2141 finished with value: 1.2933547928299352 and parameters: {'n_estimators': 242, 'max_depth': 16, 'min_samples_split': 8, 'min_samples_leaf': 2, 'max_features': 'log2', 'bootstrap': True, 'criterion': 'absolute_error'}. Best is trial 1749 with value: 0.502720715661024.
[I 2024-12-04 12:26:11,996] Trial 2131 finished with value: 0.5227400886556255 and parameters: {'n_estimators': 264, 'max_depth': 10, 'min_samples_split': 5, 'min_samples_leaf': 1, 'max_features': None, 'bootstrap': True, 'criterion': 'absolute_error'}. Best is trial 1749 with value: 0.502720715661024.
[I 2024-12-04 12:26:12,754] Trial 2150 finished with value: 1.290339272810805 and parameters: {'n_estimators': 106, 'max_depth': 25, 'min_samples_split': 6, 'min_samples_leaf': 2, 'max_features': 'log2', 'bootstrap': True, 'criterion': 'absolute_error'}. Best is trial 1749 with value: 0.502720715661024.
[I 2024-12-04 12:26:12,766] Trial 2143 finished with value: 0.5070923385919925 and parameters: {'n_estimators': 102, 'max_depth': 17, 'min_samples_split': 5, 'min_samples_leaf': 1, 'max_features': None, 'bootstrap': True, 'criterion': 'absolute_error'}. Best is trial 1749 with value: 0.502720715661024.
[I 2024-12-04 12:26:15,782] Trial 2148 finished with value: 0.5155661277149866 and parameters: {'n_estimators': 108, 'max_depth': 22, 'min_samples_split': 2, 'min_samples_leaf': 1, 'max_features': None, 'bootstrap': True, 'criterion': 'absolute_error'}. Best is trial 1749 with value: 0.502720715661024.
[I 2024-12-04 12:26:17,526] Trial 2144 finished with value: 0.5133571641553826 and parameters: {'n_estimators': 103, 'max_depth': 17, 'min_samples_split': 4, 'min_samples_leaf': 1, 'max_features': None, 'bootstrap': True, 'criterion': 'absolute_error'}. Best is trial 1749 with value: 0.502720715661024.
[I 2024-12-04 12:26:18,017] Trial 2146 finished with value: 0.5548200336534305 and parameters: {'n_estimators': 102, 'max_depth': 21, 'min_samples_split': 4, 'min_samples_leaf': 2, 'max_features': None, 'bootstrap': True, 'criterion': 'absolute_error'}. Best is trial 1749 with value: 0.502720715661024.
[I 2024-12-04 12:26:19,089] Trial 2147 finished with value: 0.5148765208337084 and parameters: {'n_estimators': 106, 'max_depth': 15, 'min_samples_split': 3, 'min_samples_leaf': 1, 'max_features': None, 'bootstrap': True, 'criterion': 'absolute_error'}. Best is trial 1749 with value: 0.502720715661024.
[I 2024-12-04 12:26:23,286] Trial 2154 finished with value: 0.5557351091467347 and parameters: {'n_estimators': 100, 'max_depth': 17, 'min_samples_split': 4, 'min_samples_leaf': 2, 'max_features': None, 'bootstrap': True, 'criterion': 'absolute_error'}. Best is trial 1749 with value: 0.502720715661024.
[I 2024-12-04 12:26:24,095] Trial 2164 finished with value: 1.343652247821017 and parameters: {'n_estimators': 148, 'max_depth': 25, 'min_samples_split': 4, 'min_samples_leaf': 6, 'max_features': 'log2', 'bootstrap': False, 'criterion': 'absolute_error'}. Best is trial 1749 with value: 0.502720715661024.
[I 2024-12-04 12:26:24,586] Trial 2157 finished with value: 0.5136142164332202 and parameters: {'n_estimators': 100, 'max_depth': 15, 'min_samples_split': 4, 'min_samples_leaf': 1, 'max_features': None, 'bootstrap': True, 'criterion': 'absolute_error'}. Best is trial 1749 with value: 0.502720715661024.
[I 2024-12-04 12:26:24,593] Trial 2137 finished with value: 0.7174016544027366 and parameters: {'n_estimators': 884, 'max_depth': 27, 'min_samples_split': 9, 'min_samples_leaf': 8, 'max_features': None, 'bootstrap': True, 'criterion': 'absolute_error'}. Best is trial 1749 with value: 0.502720715661024.
[I 2024-12-04 12:26:24,611] Trial 2142 finished with value: 0.5229791896763871 and parameters: {'n_estimators': 284, 'max_depth': 23, 'min_samples_split': 3, 'min_samples_leaf': 1, 'max_features': None, 'bootstrap': True, 'criterion': 'absolute_error'}. Best is trial 1749 with value: 0.502720715661024.
[I 2024-12-04 12:26:24,931] Trial 2152 finished with value: 0.5153895220250094 and parameters: {'n_estimators': 103, 'max_depth': 16, 'min_samples_split': 3, 'min_samples_leaf': 1, 'max_features': None, 'bootstrap': True, 'criterion': 'absolute_error'}. Best is trial 1749 with value: 0.502720715661024.
[I 2024-12-04 12:26:25,336] Trial 2091 finished with value: 0.5677885751504422 and parameters: {'n_estimators': 698, 'max_depth': 18, 'min_samples_split': 2, 'min_samples_leaf': 1, 'max_features': None, 'bootstrap': False, 'criterion': 'absolute_error'}. Best is trial 1749 with value: 0.502720715661024.
[I 2024-12-04 12:26:25,910] Trial 2155 finished with value: 0.514794367117072 and parameters: {'n_estimators': 101, 'max_depth': 29, 'min_samples_split': 3, 'min_samples_leaf': 1, 'max_features': None, 'bootstrap': True, 'criterion': 'absolute_error'}. Best is trial 1749 with value: 0.502720715661024.
[I 2024-12-04 12:26:25,915] Trial 2149 finished with value: 0.7978571866747965 and parameters: {'n_estimators': 100, 'max_depth': 21, 'min_samples_split': 8, 'min_samples_leaf': 1, 'max_features': 'sqrt', 'bootstrap': True, 'criterion': 'absolute_error'}. Best is trial 1749 with value: 0.502720715661024.
[I 2024-12-04 12:26:26,408] Trial 2158 finished with value: 0.5135487273292441 and parameters: {'n_estimators': 100, 'max_depth': 19, 'min_samples_split': 2, 'min_samples_leaf': 1, 'max_features': None, 'bootstrap': True, 'criterion': 'absolute_error'}. Best is trial 1749 with value: 0.502720715661024.
[I 2024-12-04 12:26:26,807] Trial 2145 finished with value: 0.6629793325212542 and parameters: {'n_estimators': 800, 'max_depth': 47, 'min_samples_split': 2, 'min_samples_leaf': 9, 'max_features': None, 'bootstrap': False, 'criterion': 'absolute_error'}. Best is trial 1749 with value: 0.502720715661024.
[I 2024-12-04 12:26:27,708] Trial 2162 finished with value: 1.1800819630354809 and parameters: {'n_estimators': 976, 'max_depth': 36, 'min_samples_split': 14, 'min_samples_leaf': 2, 'max_features': 'log2', 'bootstrap': True, 'criterion': 'squared_error'}. Best is trial 1749 with value: 0.502720715661024.
[I 2024-12-04 12:26:28,404] Trial 2153 finished with value: 1.2207036974559589 and parameters: {'n_estimators': 456, 'max_depth': 30, 'min_samples_split': 40, 'min_samples_leaf': 10, 'max_features': 'sqrt', 'bootstrap': True, 'criterion': 'squared_error'}. Best is trial 1749 with value: 0.502720715661024.
[I 2024-12-04 12:26:28,411] Trial 2172 finished with value: 1.1744897289403762 and parameters: {'n_estimators': 131, 'max_depth': 6, 'min_samples_split': 5, 'min_samples_leaf': 1, 'max_features': 'sqrt', 'bootstrap': True, 'criterion': 'absolute_error'}. Best is trial 1749 with value: 0.502720715661024.
