[I 2024-12-03 19:20:46,114] Trial 2090 finished with value: 0.381484034788955 and parameters: {'kernel': 'rbf', 'C': 94.74713182396677, 'gamma': 0.017805936009685896, 'epsilon': 0.050942422102191035}. Best is trial 88 with value: 0.3542875001421725.
[I 2024-12-03 19:20:48,535] Trial 2092 finished with value: 0.5902707337267659 and parameters: {'kernel': 'rbf', 'C': 18.852586365650005, 'gamma': 0.3257146508939826, 'epsilon': 0.020573770919080272}. Best is trial 88 with value: 0.3542875001421725.
[I 2024-12-03 19:20:48,690] Trial 2093 finished with value: 0.437476084121665 and parameters: {'kernel': 'rbf', 'C': 19.925995774295195, 'gamma': 0.015586219968866126, 'epsilon': 0.12111097996816404}. Best is trial 88 with value: 0.3542875001421725.
[I 2024-12-03 19:20:50,198] Trial 2094 finished with value: 0.3626208060371572 and parameters: {'kernel': 'rbf', 'C': 98.89419981838756, 'gamma': 0.05669797917040488, 'epsilon': 0.14994241980999143}. Best is trial 88 with value: 0.3542875001421725.
[I 2024-12-03 19:20:51,677] Trial 2096 finished with value: 0.40093762987996145 and parameters: {'kernel': 'rbf', 'C': 23.031699158656476, 'gamma': 0.006062450081646377, 'epsilon': 0.13773995796975724}. Best is trial 88 with value: 0.3542875001421725.
[I 2024-12-03 19:20:51,994] Trial 1669 finished with value: 1.586945029488192 and parameters: {'kernel': 'poly', 'C': 21.06696096632802, 'gamma': 0.0441794456620175, 'epsilon': 0.06445672228996012}. Best is trial 88 with value: 0.3542875001421725.
[I 2024-12-03 19:20:52,364] Trial 2095 finished with value: 0.382598887805365 and parameters: {'kernel': 'rbf', 'C': 93.21421695564882, 'gamma': 0.057313279901083536, 'epsilon': 0.018596992514679174}. Best is trial 88 with value: 0.3542875001421725.
[I 2024-12-03 19:20:53,407] Trial 2097 finished with value: 0.3822022186364162 and parameters: {'kernel': 'rbf', 'C': 29.530776111475166, 'gamma': 0.05428666983875131, 'epsilon': 0.07537730520243976}. Best is trial 88 with value: 0.3542875001421725.
[I 2024-12-03 19:20:54,406] Trial 2098 finished with value: 0.6747709669760488 and parameters: {'kernel': 'rbf', 'C': 0.12183378635694916, 'gamma': 0.06946618774371938, 'epsilon': 0.12063886167043694}. Best is trial 88 with value: 0.3542875001421725.
[I 2024-12-03 19:20:54,723] Trial 2099 finished with value: 0.4299589041252087 and parameters: {'kernel': 'rbf', 'C': 30.739355456927846, 'gamma': 0.011356116652194988, 'epsilon': 0.14010755376463285}. Best is trial 88 with value: 0.3542875001421725.
[I 2024-12-03 19:20:55,434] Trial 2100 finished with value: 0.45848797137720443 and parameters: {'kernel': 'rbf', 'C': 16.175255345353666, 'gamma': 0.13630611555487154, 'epsilon': 0.12212521094784315}. Best is trial 88 with value: 0.3542875001421725.
[I 2024-12-03 19:20:56,776] Trial 2101 finished with value: 0.369803982649112 and parameters: {'kernel': 'rbf', 'C': 91.36400978779953, 'gamma': 0.030659082177832336, 'epsilon': 0.04699518445207042}. Best is trial 88 with value: 0.3542875001421725.
[I 2024-12-03 19:20:57,426] Trial 2103 finished with value: 0.38563581166003696 and parameters: {'kernel': 'rbf', 'C': 23.950492152454956, 'gamma': 0.051503895615313884, 'epsilon': 0.14599490261082532}. Best is trial 88 with value: 0.3542875001421725.
[I 2024-12-03 19:20:58,324] Trial 2102 finished with value: 0.799949987765445 and parameters: {'kernel': 'linear', 'C': 1.0119307107175985, 'gamma': 0.0006703433716098383, 'epsilon': 0.006606589827998843}. Best is trial 88 with value: 0.3542875001421725.
[I 2024-12-03 19:20:58,643] Trial 2104 finished with value: 0.3963824535114577 and parameters: {'kernel': 'rbf', 'C': 23.206210293331182, 'gamma': 0.07296074880125285, 'epsilon': 0.15616642998187216}. Best is trial 88 with value: 0.3542875001421725.
[I 2024-12-03 19:20:59,343] Trial 2105 finished with value: 373.71787019174906 and parameters: {'kernel': 'sigmoid', 'C': 18.143124870449586, 'gamma': 0.0791771884262237, 'epsilon': 0.13866215060044826}. Best is trial 88 with value: 0.3542875001421725.
[I 2024-12-03 19:21:00,333] Trial 2106 finished with value: 0.5449952269391559 and parameters: {'kernel': 'rbf', 'C': 16.238577443287312, 'gamma': 0.24683256605193624, 'epsilon': 0.06354768522765808}. Best is trial 88 with value: 0.3542875001421725.
[I 2024-12-03 19:21:01,057] Trial 2107 finished with value: 48.22446926800312 and parameters: {'kernel': 'sigmoid', 'C': 6.620084284353843, 'gamma': 0.005400805942624646, 'epsilon': 0.0020529125059811325}. Best is trial 88 with value: 0.3542875001421725.
[I 2024-12-03 19:21:01,868] Trial 2108 finished with value: 0.3768012584273082 and parameters: {'kernel': 'rbf', 'C': 98.78143968475125, 'gamma': 0.06457568677629326, 'epsilon': 0.05899331758619538}. Best is trial 88 with value: 0.3542875001421725.
[I 2024-12-03 19:21:02,800] Trial 2109 finished with value: 0.38163611712788714 and parameters: {'kernel': 'rbf', 'C': 99.16502122537239, 'gamma': 0.06538415890948557, 'epsilon': 0.04052183844138386}. Best is trial 88 with value: 0.3542875001421725.
[I 2024-12-03 19:21:02,801] Trial 2110 finished with value: 0.5602018463710641 and parameters: {'kernel': 'rbf', 'C': 96.32466323591913, 'gamma': 0.09395769619279827, 'epsilon': 0.5902611903912846}. Best is trial 88 with value: 0.3542875001421725.
[I 2024-12-03 19:21:04,340] Trial 2111 finished with value: 0.36942095193051183 and parameters: {'kernel': 'rbf', 'C': 95.25117496307242, 'gamma': 0.021093419496151553, 'epsilon': 0.12229904370276887}. Best is trial 88 with value: 0.3542875001421725.
[I 2024-12-03 19:21:04,548] Trial 2113 finished with value: 0.41764542692289464 and parameters: {'kernel': 'rbf', 'C': 96.40886230318193, 'gamma': 0.0537186601837303, 'epsilon': 0.42056092384265037}. Best is trial 88 with value: 0.3542875001421725.
[I 2024-12-03 19:21:04,922] Trial 2112 finished with value: 0.3890062158774691 and parameters: {'kernel': 'rbf', 'C': 27.469574350927132, 'gamma': 0.06697391398417459, 'epsilon': 0.1712659135085574}. Best is trial 88 with value: 0.3542875001421725.
[I 2024-12-03 19:21:07,345] Trial 2116 finished with value: 0.40302195978480804 and parameters: {'kernel': 'rbf', 'C': 19.090908222675544, 'gamma': 0.03267157587243175, 'epsilon': 0.20480301643530474}. Best is trial 88 with value: 0.3542875001421725.
[I 2024-12-03 19:21:07,347] Trial 2115 finished with value: 0.43326619869373123 and parameters: {'kernel': 'rbf', 'C': 13.799497610601899, 'gamma': 0.04000114326755527, 'epsilon': 0.05461939220147296}. Best is trial 88 with value: 0.3542875001421725.
[I 2024-12-03 19:21:09,472] Trial 2118 finished with value: 0.5803375615181356 and parameters: {'kernel': 'rbf', 'C': 90.76300860764036, 'gamma': 0.29807440622164955, 'epsilon': 0.0696292165449447}. Best is trial 88 with value: 0.3542875001421725.
[I 2024-12-03 19:21:09,870] Trial 2117 finished with value: 0.4113468045355214 and parameters: {'kernel': 'rbf', 'C': 23.66904269995354, 'gamma': 0.012694994816098164, 'epsilon': 0.023672839959135154}. Best is trial 88 with value: 0.3542875001421725.
[I 2024-12-03 19:21:11,048] Trial 2119 finished with value: 0.44971134371269 and parameters: {'kernel': 'rbf', 'C': 28.55473742361545, 'gamma': 0.10275085877859563, 'epsilon': 0.2763941394648604}. Best is trial 88 with value: 0.3542875001421725.
[I 2024-12-03 19:21:11,680] Trial 2120 finished with value: 0.40230137397249616 and parameters: {'kernel': 'rbf', 'C': 96.23635792403317, 'gamma': 0.0881601188700819, 'epsilon': 0.2086883044509935}. Best is trial 88 with value: 0.3542875001421725.
[I 2024-12-03 19:21:12,827] Trial 2121 finished with value: 0.41720094101023114 and parameters: {'kernel': 'rbf', 'C': 99.52803260770017, 'gamma': 0.009466368550632112, 'epsilon': 0.12484238519761318}. Best is trial 88 with value: 0.3542875001421725.
[I 2024-12-03 19:21:13,425] Trial 2122 finished with value: 1.6685375250427616 and parameters: {'kernel': 'poly', 'C': 1.9818498870298138, 'gamma': 0.011440270384881844, 'epsilon': 0.7871935437312167}. Best is trial 88 with value: 0.3542875001421725.
[I 2024-12-03 19:21:14,768] Trial 2124 finished with value: 0.6640418410267621 and parameters: {'kernel': 'rbf', 'C': 11.829990362671634, 'gamma': 0.02234103043566408, 'epsilon': 0.996076620763866}. Best is trial 88 with value: 0.3542875001421725.
[I 2024-12-03 19:21:15,360] Trial 2123 finished with value: 0.366276259233847 and parameters: {'kernel': 'rbf', 'C': 98.26782018415433, 'gamma': 0.023391344587670643, 'epsilon': 0.053722065177002565}. Best is trial 88 with value: 0.3542875001421725.
[I 2024-12-03 19:21:16,813] Trial 2126 finished with value: 0.4170381209922826 and parameters: {'kernel': 'rbf', 'C': 99.9319953527683, 'gamma': 0.06270543786544769, 'epsilon': 0.38097939409352105}. Best is trial 88 with value: 0.3542875001421725.
[I 2024-12-03 19:21:18,527] Trial 2127 finished with value: 0.3926055448919973 and parameters: {'kernel': 'rbf', 'C': 24.119768115072834, 'gamma': 0.05335044190276515, 'epsilon': 0.0395378767692677}. Best is trial 88 with value: 0.3542875001421725.
[I 2024-12-03 19:21:19,962] Trial 2128 finished with value: 0.40240675388223285 and parameters: {'kernel': 'rbf', 'C': 97.4861012089598, 'gamma': 0.012901776216968149, 'epsilon': 0.12350848785045612}. Best is trial 88 with value: 0.3542875001421725.
[I 2024-12-03 19:21:21,264] Trial 2129 finished with value: 0.9006765773614074 and parameters: {'kernel': 'linear', 'C': 0.0012377852540198396, 'gamma': 0.0020732004537497547, 'epsilon': 0.005680478231462358}. Best is trial 88 with value: 0.3542875001421725.
[I 2024-12-03 19:21:21,673] Trial 2114 finished with value: 1.790510153692217 and parameters: {'kernel': 'poly', 'C': 0.03142843314318132, 'gamma': 0.15927068688542736, 'epsilon': 0.03411061774292121}. Best is trial 88 with value: 0.3542875001421725.
[I 2024-12-03 19:21:23,460] Trial 2131 finished with value: 0.35589014459226487 and parameters: {'kernel': 'rbf', 'C': 93.244003096994, 'gamma': 0.043969214917046966, 'epsilon': 0.09620433311291524}. Best is trial 88 with value: 0.3542875001421725.
[I 2024-12-03 19:21:24,039] Trial 2130 finished with value: 0.38180606732070327 and parameters: {'kernel': 'rbf', 'C': 42.7874965886898, 'gamma': 0.041429712792204205, 'epsilon': 0.0020110008318371033}. Best is trial 88 with value: 0.3542875001421725.
[I 2024-12-03 19:21:25,052] Trial 2132 finished with value: 0.3554189443341725 and parameters: {'kernel': 'rbf', 'C': 97.8289659061196, 'gamma': 0.04753090656457639, 'epsilon': 0.10167960191361804}. Best is trial 88 with value: 0.3542875001421725.
[I 2024-12-03 19:21:25,884] Trial 2133 finished with value: 0.40028574335191924 and parameters: {'kernel': 'rbf', 'C': 22.23128143245944, 'gamma': 0.008009504116567014, 'epsilon': 0.05790164752644837}. Best is trial 88 with value: 0.3542875001421725.
[I 2024-12-03 19:21:27,044] Trial 2134 finished with value: 0.3831838105799752 and parameters: {'kernel': 'rbf', 'C': 32.53989214652639, 'gamma': 0.04680064391616956, 'epsilon': 0.02518233485889138}. Best is trial 88 with value: 0.3542875001421725.
[I 2024-12-03 19:21:27,623] Trial 2135 finished with value: 0.45399826856391784 and parameters: {'kernel': 'rbf', 'C': 4.931342236004204, 'gamma': 0.0283005100701907, 'epsilon': 0.10791046814987637}. Best is trial 88 with value: 0.3542875001421725.
[I 2024-12-03 19:21:29,376] Trial 2136 finished with value: 0.40431963423052036 and parameters: {'kernel': 'rbf', 'C': 22.141567101775397, 'gamma': 0.04221978876083145, 'epsilon': 0.07301197234425051}. Best is trial 88 with value: 0.3542875001421725.
[I 2024-12-03 19:21:29,614] Trial 2137 finished with value: 0.42514153132399324 and parameters: {'kernel': 'rbf', 'C': 30.424103075712928, 'gamma': 0.015190678985611836, 'epsilon': 0.1339131105734966}. Best is trial 88 with value: 0.3542875001421725.
[I 2024-12-03 19:21:31,484] Trial 2138 finished with value: 0.3759496183086681 and parameters: {'kernel': 'rbf', 'C': 99.37007597370646, 'gamma': 0.058930763664385204, 'epsilon': 0.05665884949348341}. Best is trial 88 with value: 0.3542875001421725.
[I 2024-12-03 19:21:32,140] Trial 2139 finished with value: 0.41219120408338245 and parameters: {'kernel': 'rbf', 'C': 21.46886926923528, 'gamma': 0.032301731002757614, 'epsilon': 0.11221734484312917}. Best is trial 88 with value: 0.3542875001421725.
[I 2024-12-03 19:21:34,342] Trial 2141 finished with value: 0.3645578249952494 and parameters: {'kernel': 'rbf', 'C': 92.03332238883037, 'gamma': 0.037256780728687655, 'epsilon': 0.06791788430417336}. Best is trial 88 with value: 0.3542875001421725.
[I 2024-12-03 19:21:35,728] Trial 2142 finished with value: 0.39731182266401355 and parameters: {'kernel': 'rbf', 'C': 98.17263537101104, 'gamma': 0.011856490909078017, 'epsilon': 0.15912450270841635}. Best is trial 88 with value: 0.3542875001421725.
[I 2024-12-03 19:22:01,203] Trial 1264 finished with value: 4.541360993732637 and parameters: {'kernel': 'poly', 'C': 37.03272753516754, 'gamma': 0.09171557161110061, 'epsilon': 0.05292787741762059}. Best is trial 88 with value: 0.3542875001421725.
[I 2024-12-03 19:22:02,746] Trial 2144 finished with value: 0.4085820486549834 and parameters: {'kernel': 'rbf', 'C': 96.75696915933206, 'gamma': 0.11458692763676147, 'epsilon': 0.04776500766111154}. Best is trial 88 with value: 0.3542875001421725.
[I 2024-12-03 19:22:03,953] Trial 2145 finished with value: 0.4208161973871684 and parameters: {'kernel': 'rbf', 'C': 16.35304601421141, 'gamma': 0.024691807210089046, 'epsilon': 0.12327476564443299}. Best is trial 88 with value: 0.3542875001421725.
[I 2024-12-03 19:22:05,634] Trial 2146 finished with value: 0.3666690260836299 and parameters: {'kernel': 'rbf', 'C': 95.57261308029473, 'gamma': 0.024756692568478532, 'epsilon': 0.08384497286371213}. Best is trial 88 with value: 0.3542875001421725.
[I 2024-12-03 19:22:06,970] Trial 2147 finished with value: 0.5387378679133342 and parameters: {'kernel': 'rbf', 'C': 95.1587932988612, 'gamma': 0.21693458206642804, 'epsilon': 0.1622711805943251}. Best is trial 88 with value: 0.3542875001421725.
[I 2024-12-03 19:22:08,481] Trial 2148 finished with value: 0.42586238219398365 and parameters: {'kernel': 'rbf', 'C': 19.991613110925776, 'gamma': 0.021730495995006014, 'epsilon': 0.05774573039980499}. Best is trial 88 with value: 0.3542875001421725.
[I 2024-12-03 19:22:10,034] Trial 2149 finished with value: 0.4311663712210623 and parameters: {'kernel': 'rbf', 'C': 97.56224395923012, 'gamma': 0.12962033319605176, 'epsilon': 0.10370886557050815}. Best is trial 88 with value: 0.3542875001421725.
[I 2024-12-03 19:22:12,654] Trial 2150 finished with value: 0.36361285082092715 and parameters: {'kernel': 'rbf', 'C': 93.57475858058277, 'gamma': 0.024398864878356245, 'epsilon': 0.022052373634233156}. Best is trial 88 with value: 0.3542875001421725.
[I 2024-12-03 19:22:14,350] Trial 2151 finished with value: 0.43130639855710906 and parameters: {'kernel': 'rbf', 'C': 95.00470662266852, 'gamma': 0.004084485074099955, 'epsilon': 0.11653490401684621}. Best is trial 88 with value: 0.3542875001421725.
[I 2024-12-03 19:22:15,858] Trial 2152 finished with value: 0.8205145130599525 and parameters: {'kernel': 'sigmoid', 'C': 0.054635231102186516, 'gamma': 0.008555446724159914, 'epsilon': 0.009163504560601797}. Best is trial 88 with value: 0.3542875001421725.
[I 2024-12-03 19:22:17,483] Trial 2153 finished with value: 0.3861287802489173 and parameters: {'kernel': 'rbf', 'C': 97.02593195351592, 'gamma': 0.08086668685903532, 'epsilon': 0.10148803119787857}. Best is trial 88 with value: 0.3542875001421725.
[I 2024-12-03 19:22:18,691] Trial 2154 finished with value: 0.35716011333199776 and parameters: {'kernel': 'rbf', 'C': 98.80390475348408, 'gamma': 0.03950374654157387, 'epsilon': 0.22784012168548945}. Best is trial 88 with value: 0.3542875001421725.
[I 2024-12-03 19:22:20,363] Trial 2155 finished with value: 0.5196692081487916 and parameters: {'kernel': 'rbf', 'C': 3.796033759662546, 'gamma': 0.1475314887541011, 'epsilon': 0.03249465603188513}. Best is trial 88 with value: 0.3542875001421725.
[I 2024-12-03 19:22:21,636] Trial 2156 finished with value: 0.3569077371314463 and parameters: {'kernel': 'rbf', 'C': 95.19727502151612, 'gamma': 0.04992280514163834, 'epsilon': 0.10618791033383136}. Best is trial 88 with value: 0.3542875001421725.
[I 2024-12-03 19:22:22,807] Trial 2157 finished with value: 0.4481856741863467 and parameters: {'kernel': 'rbf', 'C': 20.952233989273843, 'gamma': 0.13388407530584417, 'epsilon': 0.09488619353556377}. Best is trial 88 with value: 0.3542875001421725.
[I 2024-12-03 19:22:24,042] Trial 2158 finished with value: 3027.8703946375617 and parameters: {'kernel': 'sigmoid', 'C': 85.89883543347247, 'gamma': 0.6278887891855681, 'epsilon': 0.3161672766291534}. Best is trial 88 with value: 0.3542875001421725.
[I 2024-12-03 19:22:26,010] Trial 2159 finished with value: 0.41053867346475015 and parameters: {'kernel': 'rbf', 'C': 17.202681530688896, 'gamma': 0.06536180024682849, 'epsilon': 0.022073135753980642}. Best is trial 88 with value: 0.3542875001421725.
[I 2024-12-03 19:22:27,321] Trial 2160 finished with value: 0.4221312402631822 and parameters: {'kernel': 'rbf', 'C': 23.498464565556365, 'gamma': 0.026275939532624602, 'epsilon': 0.057120558389391445}. Best is trial 88 with value: 0.3542875001421725.
[I 2024-12-03 19:22:28,677] Trial 2161 finished with value: 0.5338341089664118 and parameters: {'kernel': 'rbf', 'C': 76.60839496794661, 'gamma': 0.23920056813126214, 'epsilon': 0.015496416458136214}. Best is trial 88 with value: 0.3542875001421725.
[I 2024-12-03 19:22:30,026] Trial 2162 finished with value: 1.092704636617148 and parameters: {'kernel': 'rbf', 'C': 0.0010697130175840053, 'gamma': 0.0025561028317181655, 'epsilon': 0.9036299511559713}. Best is trial 88 with value: 0.3542875001421725.
[I 2024-12-03 19:22:31,496] Trial 2163 finished with value: 0.36699376952810253 and parameters: {'kernel': 'rbf', 'C': 97.05773601148333, 'gamma': 0.029381807091747692, 'epsilon': 0.1920737794532333}. Best is trial 88 with value: 0.3542875001421725.
[I 2024-12-03 19:22:33,122] Trial 2164 finished with value: 0.36596745677484216 and parameters: {'kernel': 'rbf', 'C': 95.06538309700281, 'gamma': 0.02490243832632318, 'epsilon': 0.04752892208303511}. Best is trial 88 with value: 0.3542875001421725.
[I 2024-12-03 19:22:33,556] Trial 2085 finished with value: 0.7899204656093742 and parameters: {'kernel': 'linear', 'C': 80.8014426975695, 'gamma': 0.04305787232080485, 'epsilon': 0.09273000265149674}. Best is trial 88 with value: 0.3542875001421725.
[I 2024-12-03 19:22:34,598] Trial 2165 finished with value: 0.3758583012309627 and parameters: {'kernel': 'rbf', 'C': 92.9456867437488, 'gamma': 0.014131353396145522, 'epsilon': 0.283514997595798}. Best is trial 88 with value: 0.3542875001421725.
[I 2024-12-03 19:22:34,599] Trial 2125 finished with value: 0.7970238561969532 and parameters: {'kernel': 'linear', 'C': 81.39252833257919, 'gamma': 0.4424361887958408, 'epsilon': 0.021011254826467898}. Best is trial 88 with value: 0.3542875001421725.
[I 2024-12-03 19:22:35,184] Trial 2166 finished with value: 0.41858324560468557 and parameters: {'kernel': 'rbf', 'C': 19.336504319134384, 'gamma': 0.03368134822915185, 'epsilon': 0.0828310167675053}. Best is trial 88 with value: 0.3542875001421725.
[I 2024-12-03 19:22:36,189] Trial 2167 finished with value: 0.40436595505869255 and parameters: {'kernel': 'rbf', 'C': 16.39656483304785, 'gamma': 0.043165193703097945, 'epsilon': 0.2670820462243079}. Best is trial 88 with value: 0.3542875001421725.
[I 2024-12-03 19:22:36,896] Trial 2168 finished with value: 0.4503626245347783 and parameters: {'kernel': 'rbf', 'C': 22.435404438956436, 'gamma': 0.13991107010252862, 'epsilon': 0.060656889855420386}. Best is trial 88 with value: 0.3542875001421725.
[I 2024-12-03 19:22:37,827] Trial 2169 finished with value: 0.40141592926999947 and parameters: {'kernel': 'rbf', 'C': 92.98096328079423, 'gamma': 0.004996364385748693, 'epsilon': 0.06013545889299629}. Best is trial 88 with value: 0.3542875001421725.
[I 2024-12-03 19:22:38,671] Trial 2170 finished with value: 0.3651799339492154 and parameters: {'kernel': 'rbf', 'C': 95.45495617635042, 'gamma': 0.038454194341389435, 'epsilon': 0.05509952074393743}. Best is trial 88 with value: 0.3542875001421725.
[I 2024-12-03 19:22:38,717] Trial 2171 finished with value: 0.4024647162032433 and parameters: {'kernel': 'rbf', 'C': 24.34775382016903, 'gamma': 0.02860653457606011, 'epsilon': 0.1584621126193423}. Best is trial 88 with value: 0.3542875001421725.
[I 2024-12-03 19:22:39,936] Trial 2172 finished with value: 0.4042263538239748 and parameters: {'kernel': 'rbf', 'C': 95.52630206559574, 'gamma': 0.012650502369118766, 'epsilon': 0.11431752949439544}. Best is trial 88 with value: 0.3542875001421725.
[I 2024-12-03 19:22:41,281] Trial 2173 finished with value: 0.3603783703684661 and parameters: {'kernel': 'rbf', 'C': 97.23831562859058, 'gamma': 0.03963071872548696, 'epsilon': 0.08300190654079351}. Best is trial 88 with value: 0.3542875001421725.
[I 2024-12-03 19:22:41,902] Trial 2175 finished with value: 1580.1246101714883 and parameters: {'kernel': 'sigmoid', 'C': 92.22491208036664, 'gamma': 0.020327581942658712, 'epsilon': 0.29307676476894096}. Best is trial 88 with value: 0.3542875001421725.
[I 2024-12-03 19:22:42,985] Trial 2176 finished with value: 0.39745733029626806 and parameters: {'kernel': 'rbf', 'C': 19.77183704052239, 'gamma': 0.0574728812848543, 'epsilon': 0.19411800747643027}. Best is trial 88 with value: 0.3542875001421725.
[I 2024-12-03 19:22:43,947] Trial 2177 finished with value: 0.39640833007685866 and parameters: {'kernel': 'rbf', 'C': 21.468988660170123, 'gamma': 0.06821405256150187, 'epsilon': 0.11862734141603704}. Best is trial 88 with value: 0.3542875001421725.
