[I 2024-12-04 14:45:12,429] A new study created in RDB with name: Omega_gb
[I 2024-12-04 14:45:20,493] Trial 0 finished with value: 0.565963130503485 and parameters: {'n_estimators': 330, 'learning_rate': 0.014756609500857871, 'max_depth': 5, 'min_samples_split': 9, 'min_samples_leaf': 4, 'subsample': 0.7969137284790369, 'max_features': None}. Best is trial 0 with value: 0.565963130503485.
[I 2024-12-04 14:45:22,468] Trial 8 finished with value: 0.9167098998275712 and parameters: {'n_estimators': 182, 'learning_rate': 0.017568561848946507, 'max_depth': 5, 'min_samples_split': 10, 'min_samples_leaf': 5, 'subsample': 0.695774306709388, 'max_features': 'sqrt'}. Best is trial 0 with value: 0.565963130503485.
[I 2024-12-04 14:45:24,710] Trial 6 finished with value: 0.6991948462290117 and parameters: {'n_estimators': 631, 'learning_rate': 0.052893940399749866, 'max_depth': 4, 'min_samples_split': 8, 'min_samples_leaf': 6, 'subsample': 0.8319483310605094, 'max_features': 'sqrt'}. Best is trial 0 with value: 0.565963130503485.
[I 2024-12-04 14:45:28,587] Trial 1 finished with value: 0.8328894486215321 and parameters: {'n_estimators': 1029, 'learning_rate': 0.02077638952807603, 'max_depth': 3, 'min_samples_split': 12, 'min_samples_leaf': 5, 'subsample': 0.7331343019804384, 'max_features': 'log2'}. Best is trial 0 with value: 0.565963130503485.
[I 2024-12-04 14:45:34,324] Trial 12 finished with value: 0.6637950903278996 and parameters: {'n_estimators': 262, 'learning_rate': 0.09918323674109807, 'max_depth': 10, 'min_samples_split': 5, 'min_samples_leaf': 8, 'subsample': 0.8148844972441791, 'max_features': None}. Best is trial 0 with value: 0.565963130503485.
[I 2024-12-04 14:45:35,654] Trial 16 finished with value: 0.7421197342981484 and parameters: {'n_estimators': 304, 'learning_rate': 0.06526014573196635, 'max_depth': 6, 'min_samples_split': 9, 'min_samples_leaf': 9, 'subsample': 0.6512795491209381, 'max_features': None}. Best is trial 0 with value: 0.565963130503485.
[I 2024-12-04 14:45:36,306] Trial 15 finished with value: 0.7597916722166438 and parameters: {'n_estimators': 861, 'learning_rate': 0.05295662557112345, 'max_depth': 9, 'min_samples_split': 4, 'min_samples_leaf': 10, 'subsample': 0.6975367318382157, 'max_features': None}. Best is trial 0 with value: 0.565963130503485.
[I 2024-12-04 14:45:38,974] Trial 2 finished with value: 0.5878410810654582 and parameters: {'n_estimators': 574, 'learning_rate': 0.019515267818970786, 'max_depth': 3, 'min_samples_split': 18, 'min_samples_leaf': 5, 'subsample': 0.6071164683734976, 'max_features': None}. Best is trial 0 with value: 0.565963130503485.
[I 2024-12-04 14:45:40,505] Trial 21 finished with value: 0.7313610742436527 and parameters: {'n_estimators': 642, 'learning_rate': 0.059231697720961145, 'max_depth': 8, 'min_samples_split': 2, 'min_samples_leaf': 6, 'subsample': 0.6958186185055142, 'max_features': 'sqrt'}. Best is trial 0 with value: 0.565963130503485.
[I 2024-12-04 14:45:41,723] Trial 23 finished with value: 0.5681581114820838 and parameters: {'n_estimators': 393, 'learning_rate': 0.04465291941542574, 'max_depth': 4, 'min_samples_split': 9, 'min_samples_leaf': 5, 'subsample': 0.950036901118428, 'max_features': None}. Best is trial 0 with value: 0.565963130503485.
[I 2024-12-04 14:45:44,802] Trial 9 finished with value: 0.6611121110996029 and parameters: {'n_estimators': 576, 'learning_rate': 0.024888861819300345, 'max_depth': 4, 'min_samples_split': 2, 'min_samples_leaf': 2, 'subsample': 0.7546992751436432, 'max_features': 'sqrt'}. Best is trial 0 with value: 0.565963130503485.
[I 2024-12-04 14:45:47,568] Trial 13 finished with value: 0.5697422058782795 and parameters: {'n_estimators': 439, 'learning_rate': 0.08294872395024734, 'max_depth': 3, 'min_samples_split': 9, 'min_samples_leaf': 5, 'subsample': 0.8684525068070612, 'max_features': None}. Best is trial 0 with value: 0.565963130503485.
[I 2024-12-04 14:45:48,431] Trial 31 finished with value: 0.806355017599967 and parameters: {'n_estimators': 428, 'learning_rate': 0.011581302728910768, 'max_depth': 11, 'min_samples_split': 10, 'min_samples_leaf': 6, 'subsample': 0.876102389284017, 'max_features': 'sqrt'}. Best is trial 0 with value: 0.565963130503485.
[I 2024-12-04 14:45:50,766] Trial 30 finished with value: 0.6424872859921466 and parameters: {'n_estimators': 491, 'learning_rate': 0.01743327457932674, 'max_depth': 6, 'min_samples_split': 20, 'min_samples_leaf': 2, 'subsample': 0.9184674407174528, 'max_features': 'sqrt'}. Best is trial 0 with value: 0.565963130503485.
[I 2024-12-04 14:45:52,596] Trial 42 finished with value: 0.581011417910417 and parameters: {'n_estimators': 111, 'learning_rate': 0.021461893275076423, 'max_depth': 5, 'min_samples_split': 9, 'min_samples_leaf': 3, 'subsample': 0.8012945142650598, 'max_features': None}. Best is trial 0 with value: 0.565963130503485.
[I 2024-12-04 14:45:56,064] Trial 40 finished with value: 0.5587688268574955 and parameters: {'n_estimators': 264, 'learning_rate': 0.016051622644740547, 'max_depth': 10, 'min_samples_split': 14, 'min_samples_leaf': 5, 'subsample': 0.652618634941478, 'max_features': None}. Best is trial 40 with value: 0.5587688268574955.
[I 2024-12-04 14:45:56,134] Trial 43 finished with value: 1.1628373798162075 and parameters: {'n_estimators': 124, 'learning_rate': 0.026111332765161394, 'max_depth': 7, 'min_samples_split': 5, 'min_samples_leaf': 7, 'subsample': 0.9639879192102199, 'max_features': 'log2'}. Best is trial 40 with value: 0.5587688268574955.
[I 2024-12-04 14:45:57,605] Trial 10 finished with value: 0.6502924747838318 and parameters: {'n_estimators': 805, 'learning_rate': 0.09642842034464594, 'max_depth': 10, 'min_samples_split': 9, 'min_samples_leaf': 5, 'subsample': 0.895724797125041, 'max_features': 'sqrt'}. Best is trial 40 with value: 0.5587688268574955.
[I 2024-12-04 14:45:59,362] Trial 24 finished with value: 0.8187303159186547 and parameters: {'n_estimators': 805, 'learning_rate': 0.09655545706379114, 'max_depth': 8, 'min_samples_split': 9, 'min_samples_leaf': 9, 'subsample': 0.876737469070674, 'max_features': 'sqrt'}. Best is trial 40 with value: 0.5587688268574955.
[I 2024-12-04 14:45:59,677] Trial 17 finished with value: 0.7007549306522506 and parameters: {'n_estimators': 798, 'learning_rate': 0.07774109057535646, 'max_depth': 3, 'min_samples_split': 8, 'min_samples_leaf': 8, 'subsample': 0.6527106497411833, 'max_features': None}. Best is trial 40 with value: 0.5587688268574955.
[I 2024-12-04 14:46:00,138] Trial 14 finished with value: 0.6252057404768434 and parameters: {'n_estimators': 915, 'learning_rate': 0.0469521226139649, 'max_depth': 12, 'min_samples_split': 14, 'min_samples_leaf': 4, 'subsample': 0.7396137222961953, 'max_features': 'sqrt'}. Best is trial 40 with value: 0.5587688268574955.
[I 2024-12-04 14:46:00,274] Trial 27 finished with value: 0.8689483593432384 and parameters: {'n_estimators': 866, 'learning_rate': 0.01738303570937104, 'max_depth': 11, 'min_samples_split': 2, 'min_samples_leaf': 5, 'subsample': 0.7462828329828223, 'max_features': 'log2'}. Best is trial 40 with value: 0.5587688268574955.
[I 2024-12-04 14:46:00,316] Trial 4 finished with value: 0.6610144378867634 and parameters: {'n_estimators': 1013, 'learning_rate': 0.05493643014429516, 'max_depth': 4, 'min_samples_split': 16, 'min_samples_leaf': 8, 'subsample': 0.9105098909956446, 'max_features': None}. Best is trial 40 with value: 0.5587688268574955.
[I 2024-12-04 14:46:03,459] Trial 11 finished with value: 0.6456997772514619 and parameters: {'n_estimators': 1100, 'learning_rate': 0.03055500124066852, 'max_depth': 4, 'min_samples_split': 16, 'min_samples_leaf': 2, 'subsample': 0.912075448454468, 'max_features': None}. Best is trial 40 with value: 0.5587688268574955.
[I 2024-12-04 14:46:04,757] Trial 5 finished with value: 0.628172266496865 and parameters: {'n_estimators': 893, 'learning_rate': 0.01559803321597911, 'max_depth': 12, 'min_samples_split': 19, 'min_samples_leaf': 2, 'subsample': 0.706340338840155, 'max_features': 'sqrt'}. Best is trial 40 with value: 0.5587688268574955.
[I 2024-12-04 14:46:06,034] Trial 18 finished with value: 0.6421234914045448 and parameters: {'n_estimators': 894, 'learning_rate': 0.026365682894862755, 'max_depth': 4, 'min_samples_split': 2, 'min_samples_leaf': 8, 'subsample': 0.8913413326473174, 'max_features': None}. Best is trial 40 with value: 0.5587688268574955.
[I 2024-12-04 14:46:06,156] Trial 22 finished with value: 0.6141804554761364 and parameters: {'n_estimators': 895, 'learning_rate': 0.01866396199516272, 'max_depth': 4, 'min_samples_split': 5, 'min_samples_leaf': 4, 'subsample': 0.8349028608599599, 'max_features': 'sqrt'}. Best is trial 40 with value: 0.5587688268574955.
[I 2024-12-04 14:46:06,211] Trial 19 finished with value: 0.8044903546582364 and parameters: {'n_estimators': 792, 'learning_rate': 0.01582024929597953, 'max_depth': 12, 'min_samples_split': 20, 'min_samples_leaf': 3, 'subsample': 0.7721857276291001, 'max_features': 'log2'}. Best is trial 40 with value: 0.5587688268574955.
[I 2024-12-04 14:46:09,644] Trial 28 finished with value: 0.6992590040429018 and parameters: {'n_estimators': 819, 'learning_rate': 0.07574803804213052, 'max_depth': 6, 'min_samples_split': 17, 'min_samples_leaf': 7, 'subsample': 0.8928492620435957, 'max_features': 'log2'}. Best is trial 40 with value: 0.5587688268574955.
[I 2024-12-04 14:46:10,167] Trial 41 finished with value: 0.5667506702862927 and parameters: {'n_estimators': 492, 'learning_rate': 0.010015777367648512, 'max_depth': 3, 'min_samples_split': 6, 'min_samples_leaf': 4, 'subsample': 0.9174236178249356, 'max_features': None}. Best is trial 40 with value: 0.5587688268574955.
[I 2024-12-04 14:46:10,335] Trial 44 finished with value: 0.6171694707427919 and parameters: {'n_estimators': 368, 'learning_rate': 0.01847311811322249, 'max_depth': 3, 'min_samples_split': 18, 'min_samples_leaf': 7, 'subsample': 0.8840768382075378, 'max_features': None}. Best is trial 40 with value: 0.5587688268574955.
[I 2024-12-04 14:46:10,492] Trial 34 finished with value: 0.7351847883875452 and parameters: {'n_estimators': 837, 'learning_rate': 0.017804701925032394, 'max_depth': 5, 'min_samples_split': 11, 'min_samples_leaf': 2, 'subsample': 0.9155572849854993, 'max_features': 'log2'}. Best is trial 40 with value: 0.5587688268574955.
[I 2024-12-04 14:46:11,456] Trial 26 finished with value: 0.818697063600134 and parameters: {'n_estimators': 836, 'learning_rate': 0.06679740156305033, 'max_depth': 4, 'min_samples_split': 19, 'min_samples_leaf': 10, 'subsample': 0.7532311825920847, 'max_features': 'log2'}. Best is trial 40 with value: 0.5587688268574955.
[I 2024-12-04 14:46:13,491] Trial 52 finished with value: 1.0762770730049787 and parameters: {'n_estimators': 120, 'learning_rate': 0.02533996527358971, 'max_depth': 12, 'min_samples_split': 9, 'min_samples_leaf': 3, 'subsample': 0.7340553262028188, 'max_features': 'log2'}. Best is trial 40 with value: 0.5587688268574955.
[I 2024-12-04 14:46:15,135] Trial 7 finished with value: 0.6288477679648866 and parameters: {'n_estimators': 1254, 'learning_rate': 0.010728219775089922, 'max_depth': 7, 'min_samples_split': 12, 'min_samples_leaf': 4, 'subsample': 0.7394692486294284, 'max_features': 'sqrt'}. Best is trial 40 with value: 0.5587688268574955.
[I 2024-12-04 14:46:15,667] Trial 29 finished with value: 0.6716485403403368 and parameters: {'n_estimators': 978, 'learning_rate': 0.040335843627946955, 'max_depth': 8, 'min_samples_split': 6, 'min_samples_leaf': 2, 'subsample': 0.7993333541195802, 'max_features': 'log2'}. Best is trial 40 with value: 0.5587688268574955.
[I 2024-12-04 14:46:17,593] Trial 33 finished with value: 1.002352865472266 and parameters: {'n_estimators': 960, 'learning_rate': 0.01182041543590432, 'max_depth': 7, 'min_samples_split': 15, 'min_samples_leaf': 8, 'subsample': 0.9051315003212973, 'max_features': 'log2'}. Best is trial 40 with value: 0.5587688268574955.
[I 2024-12-04 14:46:17,994] Trial 50 finished with value: 0.7775388409688269 and parameters: {'n_estimators': 250, 'learning_rate': 0.024277584038869007, 'max_depth': 12, 'min_samples_split': 14, 'min_samples_leaf': 5, 'subsample': 0.6587044564116828, 'max_features': 'sqrt'}. Best is trial 32 with value: 0.525288982270326.
[I 2024-12-04 14:46:18,400] Trial 32 finished with value: 0.525288982270326 and parameters: {'n_estimators': 953, 'learning_rate': 0.07071145631718131, 'max_depth': 10, 'min_samples_split': 20, 'min_samples_leaf': 1, 'subsample': 0.7497279198207009, 'max_features': None}. Best is trial 32 with value: 0.525288982270326.
[I 2024-12-04 14:46:18,451] Trial 53 finished with value: 0.6143699678603086 and parameters: {'n_estimators': 186, 'learning_rate': 0.011848471834694799, 'max_depth': 5, 'min_samples_split': 7, 'min_samples_leaf': 8, 'subsample': 0.8072637292176238, 'max_features': None}. Best is trial 32 with value: 0.525288982270326.
[I 2024-12-04 14:46:18,760] Trial 25 finished with value: 0.7855628457149413 and parameters: {'n_estimators': 1237, 'learning_rate': 0.03648970653486399, 'max_depth': 9, 'min_samples_split': 4, 'min_samples_leaf': 10, 'subsample': 0.9173124582084098, 'max_features': 'log2'}. Best is trial 32 with value: 0.525288982270326.
[I 2024-12-04 14:46:19,329] Trial 51 finished with value: 0.6285758499092803 and parameters: {'n_estimators': 254, 'learning_rate': 0.06756519064882775, 'max_depth': 6, 'min_samples_split': 4, 'min_samples_leaf': 4, 'subsample': 0.991870793975534, 'max_features': None}. Best is trial 32 with value: 0.525288982270326.
[I 2024-12-04 14:46:19,352] Trial 56 finished with value: 0.7144685809071112 and parameters: {'n_estimators': 180, 'learning_rate': 0.05865919410452542, 'max_depth': 5, 'min_samples_split': 13, 'min_samples_leaf': 7, 'subsample': 0.9760213081268303, 'max_features': 'sqrt'}. Best is trial 32 with value: 0.525288982270326.
[I 2024-12-04 14:46:19,532] Trial 39 finished with value: 0.6673219805093522 and parameters: {'n_estimators': 837, 'learning_rate': 0.03017969736325871, 'max_depth': 4, 'min_samples_split': 12, 'min_samples_leaf': 6, 'subsample': 0.9146297360786078, 'max_features': 'sqrt'}. Best is trial 32 with value: 0.525288982270326.
[I 2024-12-04 14:46:19,547] Trial 49 finished with value: 0.6099715312221757 and parameters: {'n_estimators': 265, 'learning_rate': 0.04024609361092527, 'max_depth': 5, 'min_samples_split': 13, 'min_samples_leaf': 3, 'subsample': 0.9394677826561761, 'max_features': None}. Best is trial 32 with value: 0.525288982270326.
[I 2024-12-04 14:46:22,257] Trial 35 finished with value: 0.6470612534738976 and parameters: {'n_estimators': 1086, 'learning_rate': 0.07829033922626977, 'max_depth': 10, 'min_samples_split': 11, 'min_samples_leaf': 3, 'subsample': 0.6802123483348628, 'max_features': 'log2'}. Best is trial 32 with value: 0.525288982270326.
[I 2024-12-04 14:46:22,603] Trial 47 finished with value: 0.5755345751700583 and parameters: {'n_estimators': 458, 'learning_rate': 0.01738541547862413, 'max_depth': 10, 'min_samples_split': 14, 'min_samples_leaf': 4, 'subsample': 0.7422473951170122, 'max_features': None}. Best is trial 32 with value: 0.525288982270326.
[I 2024-12-04 14:46:25,750] Trial 63 finished with value: 1.1424410329200498 and parameters: {'n_estimators': 223, 'learning_rate': 0.01295381156789512, 'max_depth': 3, 'min_samples_split': 4, 'min_samples_leaf': 6, 'subsample': 0.890181385872597, 'max_features': 'log2'}. Best is trial 32 with value: 0.525288982270326.
[I 2024-12-04 14:46:26,458] Trial 45 finished with value: 0.601196029253304 and parameters: {'n_estimators': 729, 'learning_rate': 0.03285614500084814, 'max_depth': 3, 'min_samples_split': 7, 'min_samples_leaf': 4, 'subsample': 0.9789509103679981, 'max_features': None}. Best is trial 32 with value: 0.525288982270326.
[I 2024-12-04 14:46:26,611] Trial 20 finished with value: 0.6501225294412435 and parameters: {'n_estimators': 1354, 'learning_rate': 0.02655454991878595, 'max_depth': 8, 'min_samples_split': 8, 'min_samples_leaf': 3, 'subsample': 0.6782774849313165, 'max_features': 'log2'}. Best is trial 32 with value: 0.525288982270326.
[I 2024-12-04 14:46:27,003] Trial 54 finished with value: 0.6419080934166405 and parameters: {'n_estimators': 405, 'learning_rate': 0.015474216178899679, 'max_depth': 11, 'min_samples_split': 13, 'min_samples_leaf': 7, 'subsample': 0.602677637120048, 'max_features': None}. Best is trial 32 with value: 0.525288982270326.
[I 2024-12-04 14:46:28,736] Trial 48 finished with value: 1.0943210491300577 and parameters: {'n_estimators': 675, 'learning_rate': 0.012013763814467024, 'max_depth': 8, 'min_samples_split': 13, 'min_samples_leaf': 6, 'subsample': 0.6085570852972536, 'max_features': 'log2'}. Best is trial 32 with value: 0.525288982270326.
[I 2024-12-04 14:46:28,965] Trial 60 finished with value: 0.9122968194285612 and parameters: {'n_estimators': 306, 'learning_rate': 0.021092159786924615, 'max_depth': 4, 'min_samples_split': 14, 'min_samples_leaf': 2, 'subsample': 0.6794778578923012, 'max_features': 'log2'}. Best is trial 32 with value: 0.525288982270326.
[I 2024-12-04 14:46:28,967] Trial 3 finished with value: 0.8810091025052081 and parameters: {'n_estimators': 1480, 'learning_rate': 0.017348385734686066, 'max_depth': 9, 'min_samples_split': 15, 'min_samples_leaf': 8, 'subsample': 0.8971668887129964, 'max_features': 'log2'}. Best is trial 32 with value: 0.525288982270326.
[I 2024-12-04 14:46:29,399] Trial 46 finished with value: 0.5704752490880474 and parameters: {'n_estimators': 879, 'learning_rate': 0.016671764374177094, 'max_depth': 6, 'min_samples_split': 5, 'min_samples_leaf': 4, 'subsample': 0.7185106651023122, 'max_features': None}. Best is trial 32 with value: 0.525288982270326.
[I 2024-12-04 14:46:29,627] Trial 38 finished with value: 0.6480511538835516 and parameters: {'n_estimators': 1291, 'learning_rate': 0.03886564140801274, 'max_depth': 5, 'min_samples_split': 10, 'min_samples_leaf': 3, 'subsample': 0.8917847549547937, 'max_features': 'sqrt'}. Best is trial 32 with value: 0.525288982270326.
[I 2024-12-04 14:46:29,978] Trial 62 finished with value: 0.6374327505442401 and parameters: {'n_estimators': 212, 'learning_rate': 0.05153050623116189, 'max_depth': 6, 'min_samples_split': 8, 'min_samples_leaf': 8, 'subsample': 0.8505590237064341, 'max_features': None}. Best is trial 32 with value: 0.525288982270326.
[I 2024-12-04 14:46:31,456] Trial 36 finished with value: 0.9942413786608153 and parameters: {'n_estimators': 1273, 'learning_rate': 0.01088161234051946, 'max_depth': 11, 'min_samples_split': 9, 'min_samples_leaf': 8, 'subsample': 0.8388102208892226, 'max_features': 'log2'}. Best is trial 32 with value: 0.525288982270326.
[I 2024-12-04 14:46:32,943] Trial 55 finished with value: 0.6056885465399322 and parameters: {'n_estimators': 474, 'learning_rate': 0.015338062261359182, 'max_depth': 3, 'min_samples_split': 3, 'min_samples_leaf': 2, 'subsample': 0.9865619171431346, 'max_features': None}. Best is trial 32 with value: 0.525288982270326.
[I 2024-12-04 14:46:33,221] Trial 59 finished with value: 0.5738519412397813 and parameters: {'n_estimators': 630, 'learning_rate': 0.014115100492811132, 'max_depth': 4, 'min_samples_split': 5, 'min_samples_leaf': 4, 'subsample': 0.8502665526161773, 'max_features': None}. Best is trial 32 with value: 0.525288982270326.
[I 2024-12-04 14:46:33,737] Trial 57 finished with value: 0.5826042695637305 and parameters: {'n_estimators': 757, 'learning_rate': 0.013302398211125544, 'max_depth': 6, 'min_samples_split': 10, 'min_samples_leaf': 4, 'subsample': 0.864784897517915, 'max_features': None}. Best is trial 32 with value: 0.525288982270326.
[I 2024-12-04 14:46:34,173] Trial 71 finished with value: 0.6467606534235156 and parameters: {'n_estimators': 120, 'learning_rate': 0.010331241247681108, 'max_depth': 9, 'min_samples_split': 14, 'min_samples_leaf': 3, 'subsample': 0.6811600558808418, 'max_features': None}. Best is trial 32 with value: 0.525288982270326.
[I 2024-12-04 14:46:36,506] Trial 70 finished with value: 0.5719712567282871 and parameters: {'n_estimators': 315, 'learning_rate': 0.09653606861016652, 'max_depth': 3, 'min_samples_split': 10, 'min_samples_leaf': 4, 'subsample': 0.7767558571762985, 'max_features': None}. Best is trial 32 with value: 0.525288982270326.
[I 2024-12-04 14:46:37,685] Trial 72 finished with value: 0.8642651888415027 and parameters: {'n_estimators': 285, 'learning_rate': 0.05917368661557747, 'max_depth': 3, 'min_samples_split': 11, 'min_samples_leaf': 6, 'subsample': 0.914993171824775, 'max_features': 'log2'}. Best is trial 32 with value: 0.525288982270326.
[I 2024-12-04 14:46:37,984] Trial 58 finished with value: 0.9486822379795752 and parameters: {'n_estimators': 306, 'learning_rate': 0.010843932519855406, 'max_depth': 3, 'min_samples_split': 8, 'min_samples_leaf': 6, 'subsample': 0.9124645383279606, 'max_features': 'sqrt'}. Best is trial 32 with value: 0.525288982270326.
[I 2024-12-04 14:46:38,278] Trial 68 finished with value: 0.6551955126362565 and parameters: {'n_estimators': 872, 'learning_rate': 0.044691333469886144, 'max_depth': 10, 'min_samples_split': 20, 'min_samples_leaf': 2, 'subsample': 0.8192327344110873, 'max_features': 'log2'}. Best is trial 32 with value: 0.525288982270326.
[I 2024-12-04 14:46:39,507] Trial 67 finished with value: 0.6381768865020252 and parameters: {'n_estimators': 453, 'learning_rate': 0.08405067413646365, 'max_depth': 4, 'min_samples_split': 7, 'min_samples_leaf': 3, 'subsample': 0.8505752637626721, 'max_features': None}. Best is trial 32 with value: 0.525288982270326.
[I 2024-12-04 14:46:39,546] Trial 61 finished with value: 0.6601271273715148 and parameters: {'n_estimators': 719, 'learning_rate': 0.06173402543444132, 'max_depth': 7, 'min_samples_split': 15, 'min_samples_leaf': 3, 'subsample': 0.766937031759385, 'max_features': None}. Best is trial 32 with value: 0.525288982270326.
