[I 2024-12-04 12:00:31,652] Trial 1394 finished with value: 0.47344856982335537 and parameters: {'max_depth': 35, 'min_samples_split': 12, 'min_samples_leaf': 1, 'max_features': 'sqrt', 'criterion': 'friedman_mse', 'splitter': 'best'}. Best is trial 458 with value: 0.430928156546456.
[I 2024-12-04 12:00:31,752] Trial 1396 finished with value: 0.9625340596516944 and parameters: {'max_depth': 25, 'min_samples_split': 19, 'min_samples_leaf': 4, 'max_features': 'log2', 'criterion': 'squared_error', 'splitter': 'random'}. Best is trial 458 with value: 0.430928156546456.
[I 2024-12-04 12:00:31,779] Trial 1395 finished with value: 0.5197286109722704 and parameters: {'max_depth': 35, 'min_samples_split': 12, 'min_samples_leaf': 1, 'max_features': 'log2', 'criterion': 'friedman_mse', 'splitter': 'best'}. Best is trial 458 with value: 0.430928156546456.
[I 2024-12-04 12:00:32,069] Trial 1382 finished with value: 0.5976936021795094 and parameters: {'max_depth': 29, 'min_samples_split': 9, 'min_samples_leaf': 2, 'max_features': 'sqrt', 'criterion': 'friedman_mse', 'splitter': 'best'}. Best is trial 458 with value: 0.430928156546456.
[I 2024-12-04 12:00:32,395] Trial 1397 finished with value: 0.5319670614340929 and parameters: {'max_depth': 29, 'min_samples_split': 15, 'min_samples_leaf': 1, 'max_features': 'sqrt', 'criterion': 'friedman_mse', 'splitter': 'best'}. Best is trial 458 with value: 0.430928156546456.
[I 2024-12-04 12:00:32,568] Trial 1369 finished with value: 0.534484133498963 and parameters: {'max_depth': 29, 'min_samples_split': 16, 'min_samples_leaf': 1, 'max_features': 'sqrt', 'criterion': 'friedman_mse', 'splitter': 'best'}. Best is trial 458 with value: 0.430928156546456.
[I 2024-12-04 12:00:32,654] Trial 1389 finished with value: 0.430928156546456 and parameters: {'max_depth': 35, 'min_samples_split': 13, 'min_samples_leaf': 1, 'max_features': 'sqrt', 'criterion': 'friedman_mse', 'splitter': 'best'}. Best is trial 458 with value: 0.430928156546456.
[I 2024-12-04 12:00:33,721] Trial 1392 finished with value: 0.6050765209250252 and parameters: {'max_depth': 30, 'min_samples_split': 13, 'min_samples_leaf': 1, 'max_features': 'sqrt', 'criterion': 'friedman_mse', 'splitter': 'random'}. Best is trial 458 with value: 0.430928156546456.
[I 2024-12-04 12:00:33,889] Trial 1398 finished with value: 0.5178071867440288 and parameters: {'max_depth': 30, 'min_samples_split': 12, 'min_samples_leaf': 1, 'max_features': 'sqrt', 'criterion': 'friedman_mse', 'splitter': 'best'}. Best is trial 458 with value: 0.430928156546456.
[I 2024-12-04 12:00:34,986] Trial 1390 finished with value: 0.5260707068792781 and parameters: {'max_depth': 30, 'min_samples_split': 10, 'min_samples_leaf': 1, 'max_features': 'sqrt', 'criterion': 'friedman_mse', 'splitter': 'best'}. Best is trial 458 with value: 0.430928156546456.
[I 2024-12-04 12:00:34,993] Trial 1391 finished with value: 0.9562140653544567 and parameters: {'max_depth': 4, 'min_samples_split': 17, 'min_samples_leaf': 8, 'max_features': 'sqrt', 'criterion': 'squared_error', 'splitter': 'best'}. Best is trial 458 with value: 0.430928156546456.
[I 2024-12-04 12:00:35,252] Trial 1399 finished with value: 0.47344856982335537 and parameters: {'max_depth': 35, 'min_samples_split': 12, 'min_samples_leaf': 1, 'max_features': 'sqrt', 'criterion': 'friedman_mse', 'splitter': 'best'}. Best is trial 458 with value: 0.430928156546456.
[I 2024-12-04 12:00:37,186] Trial 1388 finished with value: 0.48363356796891666 and parameters: {'max_depth': 30, 'min_samples_split': 14, 'min_samples_leaf': 1, 'max_features': 'sqrt', 'criterion': 'friedman_mse', 'splitter': 'best'}. Best is trial 458 with value: 0.430928156546456.
[I 2024-12-04 12:00:37,352] Trial 1393 finished with value: 0.5459840798044118 and parameters: {'max_depth': 35, 'min_samples_split': 13, 'min_samples_leaf': 2, 'max_features': 'sqrt', 'criterion': 'friedman_mse', 'splitter': 'best'}. Best is trial 458 with value: 0.430928156546456.
[I 2024-12-04 12:00:37,419] Trial 1407 finished with value: 0.5273419897492498 and parameters: {'max_depth': 35, 'min_samples_split': 15, 'min_samples_leaf': 1, 'max_features': 'sqrt', 'criterion': 'friedman_mse', 'splitter': 'best'}. Best is trial 458 with value: 0.430928156546456.
[I 2024-12-04 12:00:37,561] Trial 1405 finished with value: 0.47344856982335537 and parameters: {'max_depth': 35, 'min_samples_split': 12, 'min_samples_leaf': 1, 'max_features': 'sqrt', 'criterion': 'friedman_mse', 'splitter': 'best'}. Best is trial 458 with value: 0.430928156546456.
[I 2024-12-04 12:00:37,833] Trial 1411 finished with value: 0.584022525745178 and parameters: {'max_depth': 29, 'min_samples_split': 11, 'min_samples_leaf': 3, 'max_features': 'sqrt', 'criterion': 'friedman_mse', 'splitter': 'best'}. Best is trial 458 with value: 0.430928156546456.
[I 2024-12-04 12:00:38,291] Trial 1409 finished with value: 0.5641364352696134 and parameters: {'max_depth': 35, 'min_samples_split': 16, 'min_samples_leaf': 2, 'max_features': 'sqrt', 'criterion': 'friedman_mse', 'splitter': 'best'}. Best is trial 458 with value: 0.430928156546456.
[I 2024-12-04 12:00:38,509] Trial 1404 finished with value: 0.4713924065212343 and parameters: {'max_depth': 30, 'min_samples_split': 13, 'min_samples_leaf': 1, 'max_features': 'sqrt', 'criterion': 'friedman_mse', 'splitter': 'best'}. Best is trial 458 with value: 0.430928156546456.
[I 2024-12-04 12:00:39,170] Trial 1403 finished with value: 0.584022525745178 and parameters: {'max_depth': 30, 'min_samples_split': 11, 'min_samples_leaf': 3, 'max_features': 'sqrt', 'criterion': 'friedman_mse', 'splitter': 'best'}. Best is trial 458 with value: 0.430928156546456.
[I 2024-12-04 12:00:39,181] Trial 1412 finished with value: 0.5034437178251039 and parameters: {'max_depth': 35, 'min_samples_split': 9, 'min_samples_leaf': 1, 'max_features': 'sqrt', 'criterion': 'friedman_mse', 'splitter': 'best'}. Best is trial 458 with value: 0.430928156546456.
[I 2024-12-04 12:00:40,555] Trial 1400 finished with value: 0.48720407820762895 and parameters: {'max_depth': 29, 'min_samples_split': 12, 'min_samples_leaf': 1, 'max_features': 'sqrt', 'criterion': 'friedman_mse', 'splitter': 'best'}. Best is trial 458 with value: 0.430928156546456.
[I 2024-12-04 12:00:40,609] Trial 1408 finished with value: 0.8979508421408559 and parameters: {'max_depth': 10, 'min_samples_split': 18, 'min_samples_leaf': 2, 'max_features': 'log2', 'criterion': 'friedman_mse', 'splitter': 'random'}. Best is trial 458 with value: 0.430928156546456.
[I 2024-12-04 12:00:40,754] Trial 1417 finished with value: 0.9982171095081254 and parameters: {'max_depth': 35, 'min_samples_split': 17, 'min_samples_leaf': 7, 'max_features': 'log2', 'criterion': 'friedman_mse', 'splitter': 'best'}. Best is trial 458 with value: 0.430928156546456.
[I 2024-12-04 12:00:41,677] Trial 1401 finished with value: 0.5220174125349513 and parameters: {'max_depth': 35, 'min_samples_split': 10, 'min_samples_leaf': 2, 'max_features': 'sqrt', 'criterion': 'friedman_mse', 'splitter': 'best'}. Best is trial 458 with value: 0.430928156546456.
[I 2024-12-04 12:00:41,678] Trial 1410 finished with value: 0.5932604510569024 and parameters: {'max_depth': 35, 'min_samples_split': 9, 'min_samples_leaf': 3, 'max_features': 'sqrt', 'criterion': 'friedman_mse', 'splitter': 'best'}. Best is trial 458 with value: 0.430928156546456.
[I 2024-12-04 12:00:41,955] Trial 1402 finished with value: 0.584300197786044 and parameters: {'max_depth': 35, 'min_samples_split': 13, 'min_samples_leaf': 3, 'max_features': 'sqrt', 'criterion': 'friedman_mse', 'splitter': 'best'}. Best is trial 458 with value: 0.430928156546456.
[I 2024-12-04 12:00:42,153] Trial 1421 finished with value: 0.4399442512678781 and parameters: {'max_depth': 35, 'min_samples_split': 14, 'min_samples_leaf': 1, 'max_features': 'sqrt', 'criterion': 'friedman_mse', 'splitter': 'best'}. Best is trial 458 with value: 0.430928156546456.
[I 2024-12-04 12:00:42,646] Trial 1416 finished with value: 0.9618554461006263 and parameters: {'max_depth': 17, 'min_samples_split': 11, 'min_samples_leaf': 7, 'max_features': 'log2', 'criterion': 'squared_error', 'splitter': 'random'}. Best is trial 458 with value: 0.430928156546456.
[I 2024-12-04 12:00:43,775] Trial 1414 finished with value: 0.4399442512678781 and parameters: {'max_depth': 35, 'min_samples_split': 14, 'min_samples_leaf': 1, 'max_features': 'sqrt', 'criterion': 'friedman_mse', 'splitter': 'best'}. Best is trial 458 with value: 0.430928156546456.
[I 2024-12-04 12:00:44,314] Trial 1419 finished with value: 0.4914699729644116 and parameters: {'max_depth': 30, 'min_samples_split': 16, 'min_samples_leaf': 1, 'max_features': 'sqrt', 'criterion': 'friedman_mse', 'splitter': 'best'}. Best is trial 458 with value: 0.430928156546456.
[I 2024-12-04 12:00:44,985] Trial 1424 finished with value: 0.584300197786044 and parameters: {'max_depth': 30, 'min_samples_split': 12, 'min_samples_leaf': 3, 'max_features': 'sqrt', 'criterion': 'friedman_mse', 'splitter': 'best'}. Best is trial 458 with value: 0.430928156546456.
[I 2024-12-04 12:00:45,093] Trial 1406 finished with value: 0.47344856982335537 and parameters: {'max_depth': 35, 'min_samples_split': 12, 'min_samples_leaf': 1, 'max_features': 'sqrt', 'criterion': 'friedman_mse', 'splitter': 'best'}. Best is trial 458 with value: 0.430928156546456.
[I 2024-12-04 12:00:45,282] Trial 1420 finished with value: 0.4399442512678781 and parameters: {'max_depth': 35, 'min_samples_split': 14, 'min_samples_leaf': 1, 'max_features': 'sqrt', 'criterion': 'friedman_mse', 'splitter': 'best'}. Best is trial 458 with value: 0.430928156546456.
[I 2024-12-04 12:00:45,305] Trial 1418 finished with value: 0.47495142754566344 and parameters: {'max_depth': 35, 'min_samples_split': 11, 'min_samples_leaf': 1, 'max_features': 'sqrt', 'criterion': 'friedman_mse', 'splitter': 'best'}. Best is trial 458 with value: 0.430928156546456.
[I 2024-12-04 12:00:46,393] Trial 1426 finished with value: 0.5527998308929675 and parameters: {'max_depth': 30, 'min_samples_split': 16, 'min_samples_leaf': 2, 'max_features': 'sqrt', 'criterion': 'friedman_mse', 'splitter': 'best'}. Best is trial 458 with value: 0.430928156546456.
[I 2024-12-04 12:00:46,867] Trial 1431 finished with value: 0.9628338127028668 and parameters: {'max_depth': 2, 'min_samples_split': 12, 'min_samples_leaf': 1, 'max_features': 'log2', 'criterion': 'absolute_error', 'splitter': 'random'}. Best is trial 458 with value: 0.430928156546456.
[I 2024-12-04 12:00:46,920] Trial 1430 finished with value: 0.584300197786044 and parameters: {'max_depth': 35, 'min_samples_split': 15, 'min_samples_leaf': 3, 'max_features': 'sqrt', 'criterion': 'friedman_mse', 'splitter': 'best'}. Best is trial 458 with value: 0.430928156546456.
[I 2024-12-04 12:00:47,246] Trial 1432 finished with value: 0.584300197786044 and parameters: {'max_depth': 35, 'min_samples_split': 12, 'min_samples_leaf': 3, 'max_features': 'sqrt', 'criterion': 'friedman_mse', 'splitter': 'best'}. Best is trial 458 with value: 0.430928156546456.
[I 2024-12-04 12:00:47,395] Trial 1423 finished with value: 0.530471704746649 and parameters: {'max_depth': 35, 'min_samples_split': 13, 'min_samples_leaf': 1, 'max_features': 'sqrt', 'criterion': 'absolute_error', 'splitter': 'best'}. Best is trial 458 with value: 0.430928156546456.
[I 2024-12-04 12:00:47,416] Trial 1428 finished with value: 0.6313531529708941 and parameters: {'max_depth': 22, 'min_samples_split': 11, 'min_samples_leaf': 1, 'max_features': 'sqrt', 'criterion': 'friedman_mse', 'splitter': 'best'}. Best is trial 458 with value: 0.430928156546456.
[I 2024-12-04 12:00:47,425] Trial 1434 finished with value: 0.5273419897492498 and parameters: {'max_depth': 35, 'min_samples_split': 15, 'min_samples_leaf': 1, 'max_features': 'sqrt', 'criterion': 'friedman_mse', 'splitter': 'best'}. Best is trial 458 with value: 0.430928156546456.
[I 2024-12-04 12:00:48,835] Trial 1413 finished with value: 0.4713924065212343 and parameters: {'max_depth': 30, 'min_samples_split': 13, 'min_samples_leaf': 1, 'max_features': 'sqrt', 'criterion': 'friedman_mse', 'splitter': 'best'}. Best is trial 458 with value: 0.430928156546456.
[I 2024-12-04 12:00:49,168] Trial 1415 finished with value: 0.9625068790481612 and parameters: {'max_depth': 26, 'min_samples_split': 10, 'min_samples_leaf': 5, 'max_features': 'log2', 'criterion': 'friedman_mse', 'splitter': 'random'}. Best is trial 458 with value: 0.430928156546456.
[I 2024-12-04 12:00:49,315] Trial 1422 finished with value: 0.5028340388552847 and parameters: {'max_depth': 35, 'min_samples_split': 14, 'min_samples_leaf': 2, 'max_features': 'sqrt', 'criterion': 'friedman_mse', 'splitter': 'best'}. Best is trial 458 with value: 0.430928156546456.
[I 2024-12-04 12:00:49,324] Trial 1437 finished with value: 0.5178071867440288 and parameters: {'max_depth': 30, 'min_samples_split': 12, 'min_samples_leaf': 1, 'max_features': 'sqrt', 'criterion': 'friedman_mse', 'splitter': 'best'}. Best is trial 458 with value: 0.430928156546456.
[I 2024-12-04 12:00:49,347] Trial 1433 finished with value: 0.48720407820762895 and parameters: {'max_depth': 29, 'min_samples_split': 12, 'min_samples_leaf': 1, 'max_features': 'sqrt', 'criterion': 'friedman_mse', 'splitter': 'best'}. Best is trial 458 with value: 0.430928156546456.
[I 2024-12-04 12:00:50,848] Trial 1442 finished with value: 0.5174479861928553 and parameters: {'max_depth': 29, 'min_samples_split': 10, 'min_samples_leaf': 1, 'max_features': 'sqrt', 'criterion': 'friedman_mse', 'splitter': 'best'}. Best is trial 458 with value: 0.430928156546456.
[I 2024-12-04 12:00:51,808] Trial 1435 finished with value: 0.5844704977157483 and parameters: {'max_depth': 35, 'min_samples_split': 13, 'min_samples_leaf': 1, 'max_features': 'sqrt', 'criterion': 'friedman_mse', 'splitter': 'random'}. Best is trial 458 with value: 0.430928156546456.
[I 2024-12-04 12:00:51,815] Trial 1436 finished with value: 0.5273419897492498 and parameters: {'max_depth': 35, 'min_samples_split': 15, 'min_samples_leaf': 1, 'max_features': 'sqrt', 'criterion': 'friedman_mse', 'splitter': 'best'}. Best is trial 458 with value: 0.430928156546456.
[I 2024-12-04 12:00:52,504] Trial 1427 finished with value: 0.9030273344024288 and parameters: {'max_depth': 23, 'min_samples_split': 14, 'min_samples_leaf': 5, 'max_features': 'sqrt', 'criterion': 'absolute_error', 'splitter': 'random'}. Best is trial 458 with value: 0.430928156546456.
[I 2024-12-04 12:00:53,607] Trial 1425 finished with value: 0.4615785299849214 and parameters: {'max_depth': 35, 'min_samples_split': 10, 'min_samples_leaf': 1, 'max_features': 'sqrt', 'criterion': 'friedman_mse', 'splitter': 'best'}. Best is trial 458 with value: 0.430928156546456.
[I 2024-12-04 12:00:53,639] Trial 1443 finished with value: 0.584022525745178 and parameters: {'max_depth': 35, 'min_samples_split': 11, 'min_samples_leaf': 3, 'max_features': 'sqrt', 'criterion': 'friedman_mse', 'splitter': 'best'}. Best is trial 458 with value: 0.430928156546456.
[I 2024-12-04 12:00:53,720] Trial 1445 finished with value: 0.8126198544662872 and parameters: {'max_depth': 7, 'min_samples_split': 15, 'min_samples_leaf': 2, 'max_features': 'sqrt', 'criterion': 'squared_error', 'splitter': 'random'}. Best is trial 458 with value: 0.430928156546456.
[I 2024-12-04 12:00:53,722] Trial 1429 finished with value: 0.430928156546456 and parameters: {'max_depth': 35, 'min_samples_split': 13, 'min_samples_leaf': 1, 'max_features': 'sqrt', 'criterion': 'friedman_mse', 'splitter': 'best'}. Best is trial 458 with value: 0.430928156546456.
[I 2024-12-04 12:00:54,342] Trial 1446 finished with value: 0.5126617559181795 and parameters: {'max_depth': 29, 'min_samples_split': 17, 'min_samples_leaf': 1, 'max_features': 'sqrt', 'criterion': 'friedman_mse', 'splitter': 'best'}. Best is trial 458 with value: 0.430928156546456.
[I 2024-12-04 12:00:55,182] Trial 1451 finished with value: 0.5220453594633404 and parameters: {'max_depth': 29, 'min_samples_split': 14, 'min_samples_leaf': 1, 'max_features': 'sqrt', 'criterion': 'friedman_mse', 'splitter': 'best'}. Best is trial 458 with value: 0.430928156546456.
[I 2024-12-04 12:00:55,519] Trial 1444 finished with value: 0.48720407820762895 and parameters: {'max_depth': 29, 'min_samples_split': 12, 'min_samples_leaf': 1, 'max_features': 'sqrt', 'criterion': 'friedman_mse', 'splitter': 'best'}. Best is trial 458 with value: 0.430928156546456.
[I 2024-12-04 12:00:55,809] Trial 1447 finished with value: 0.5459840798044118 and parameters: {'max_depth': 35, 'min_samples_split': 11, 'min_samples_leaf': 2, 'max_features': 'sqrt', 'criterion': 'friedman_mse', 'splitter': 'best'}. Best is trial 458 with value: 0.430928156546456.
[I 2024-12-04 12:00:55,880] Trial 1438 finished with value: 0.584300197786044 and parameters: {'max_depth': 30, 'min_samples_split': 14, 'min_samples_leaf': 3, 'max_features': 'sqrt', 'criterion': 'friedman_mse', 'splitter': 'best'}. Best is trial 458 with value: 0.430928156546456.
[I 2024-12-04 12:00:56,025] Trial 1440 finished with value: 0.47344856982335537 and parameters: {'max_depth': 35, 'min_samples_split': 12, 'min_samples_leaf': 1, 'max_features': 'sqrt', 'criterion': 'friedman_mse', 'splitter': 'best'}. Best is trial 458 with value: 0.430928156546456.
[I 2024-12-04 12:00:56,428] Trial 1455 finished with value: 0.6123058195588575 and parameters: {'max_depth': 35, 'min_samples_split': 11, 'min_samples_leaf': 4, 'max_features': 'sqrt', 'criterion': 'squared_error', 'splitter': 'best'}. Best is trial 458 with value: 0.430928156546456.
[I 2024-12-04 12:00:56,456] Trial 1449 finished with value: 0.5641364352696134 and parameters: {'max_depth': 35, 'min_samples_split': 16, 'min_samples_leaf': 2, 'max_features': 'sqrt', 'criterion': 'friedman_mse', 'splitter': 'best'}. Best is trial 458 with value: 0.430928156546456.
[I 2024-12-04 12:00:56,460] Trial 1439 finished with value: 0.8558428381311738 and parameters: {'max_depth': 35, 'min_samples_split': 13, 'min_samples_leaf': 3, 'max_features': 'log2', 'criterion': 'friedman_mse', 'splitter': 'best'}. Best is trial 458 with value: 0.430928156546456.
[I 2024-12-04 12:00:56,462] Trial 1450 finished with value: 0.510418322463182 and parameters: {'max_depth': 28, 'min_samples_split': 11, 'min_samples_leaf': 1, 'max_features': 'sqrt', 'criterion': 'squared_error', 'splitter': 'best'}. Best is trial 458 with value: 0.430928156546456.
[I 2024-12-04 12:00:57,098] Trial 1452 finished with value: 0.5641364352696134 and parameters: {'max_depth': 35, 'min_samples_split': 16, 'min_samples_leaf': 2, 'max_features': 'sqrt', 'criterion': 'friedman_mse', 'splitter': 'best'}. Best is trial 458 with value: 0.430928156546456.
[I 2024-12-04 12:00:57,851] Trial 1458 finished with value: 0.5642137493706284 and parameters: {'max_depth': 35, 'min_samples_split': 16, 'min_samples_leaf': 1, 'max_features': 'sqrt', 'criterion': 'absolute_error', 'splitter': 'best'}. Best is trial 458 with value: 0.430928156546456.
[I 2024-12-04 12:00:57,991] Trial 1456 finished with value: 0.5459840798044118 and parameters: {'max_depth': 35, 'min_samples_split': 13, 'min_samples_leaf': 2, 'max_features': 'sqrt', 'criterion': 'friedman_mse', 'splitter': 'best'}. Best is trial 458 with value: 0.430928156546456.
[I 2024-12-04 12:01:00,077] Trial 1457 finished with value: 0.47344856982335537 and parameters: {'max_depth': 35, 'min_samples_split': 12, 'min_samples_leaf': 1, 'max_features': 'sqrt', 'criterion': 'friedman_mse', 'splitter': 'best'}. Best is trial 458 with value: 0.430928156546456.
[I 2024-12-04 12:01:01,223] Trial 1459 finished with value: 0.606184641299422 and parameters: {'max_depth': 29, 'min_samples_split': 13, 'min_samples_leaf': 2, 'max_features': 'sqrt', 'criterion': 'friedman_mse', 'splitter': 'best'}. Best is trial 458 with value: 0.430928156546456.
[I 2024-12-04 12:01:01,224] Trial 1461 finished with value: 0.4399442512678781 and parameters: {'max_depth': 35, 'min_samples_split': 14, 'min_samples_leaf': 1, 'max_features': 'sqrt', 'criterion': 'friedman_mse', 'splitter': 'best'}. Best is trial 458 with value: 0.430928156546456.
[I 2024-12-04 12:01:01,302] Trial 1463 finished with value: 0.48363356796891666 and parameters: {'max_depth': 30, 'min_samples_split': 14, 'min_samples_leaf': 1, 'max_features': 'sqrt', 'criterion': 'friedman_mse', 'splitter': 'best'}. Best is trial 458 with value: 0.430928156546456.
[I 2024-12-04 12:01:02,272] Trial 1453 finished with value: 0.5802981225397039 and parameters: {'max_depth': 28, 'min_samples_split': 14, 'min_samples_leaf': 1, 'max_features': 'sqrt', 'criterion': 'friedman_mse', 'splitter': 'best'}. Best is trial 458 with value: 0.430928156546456.
[I 2024-12-04 12:01:02,517] Trial 1454 finished with value: 0.430928156546456 and parameters: {'max_depth': 35, 'min_samples_split': 13, 'min_samples_leaf': 1, 'max_features': 'sqrt', 'criterion': 'friedman_mse', 'splitter': 'best'}. Best is trial 458 with value: 0.430928156546456.
[I 2024-12-04 12:01:02,549] Trial 1441 finished with value: 0.47344856982335537 and parameters: {'max_depth': 35, 'min_samples_split': 12, 'min_samples_leaf': 1, 'max_features': 'sqrt', 'criterion': 'friedman_mse', 'splitter': 'best'}. Best is trial 458 with value: 0.430928156546456.
[I 2024-12-04 12:01:02,852] Trial 1464 finished with value: 0.5034437178251039 and parameters: {'max_depth': 35, 'min_samples_split': 9, 'min_samples_leaf': 1, 'max_features': 'sqrt', 'criterion': 'friedman_mse', 'splitter': 'best'}. Best is trial 458 with value: 0.430928156546456.
[I 2024-12-04 12:01:03,529] Trial 1473 finished with value: 0.584300197786044 and parameters: {'max_depth': 35, 'min_samples_split': 13, 'min_samples_leaf': 3, 'max_features': 'sqrt', 'criterion': 'friedman_mse', 'splitter': 'best'}. Best is trial 458 with value: 0.430928156546456.
