[I 2024-12-04 15:27:50,961] Trial 2330 finished with value: 0.5028405999029285 and parameters: {'n_estimators': 1188, 'learning_rate': 0.06073444257462675, 'max_depth': 12, 'min_samples_split': 20, 'min_samples_leaf': 1, 'subsample': 0.9174739630095031, 'max_features': None}. Best is trial 2282 with value: 0.45359136528270205.
[I 2024-12-04 15:27:52,489] Trial 2359 finished with value: 0.5683880126122737 and parameters: {'n_estimators': 513, 'learning_rate': 0.010573673889767807, 'max_depth': 7, 'min_samples_split': 7, 'min_samples_leaf': 3, 'subsample': 0.7400726027457392, 'max_features': None}. Best is trial 2282 with value: 0.45359136528270205.
[I 2024-12-04 15:27:54,494] Trial 2360 finished with value: 0.5984259034937536 and parameters: {'n_estimators': 540, 'learning_rate': 0.02733461501553979, 'max_depth': 11, 'min_samples_split': 7, 'min_samples_leaf': 6, 'subsample': 0.7287699794246922, 'max_features': None}. Best is trial 2282 with value: 0.45359136528270205.
[I 2024-12-04 15:27:55,663] Trial 2336 finished with value: 0.4885410793280515 and parameters: {'n_estimators': 964, 'learning_rate': 0.0717358841252895, 'max_depth': 10, 'min_samples_split': 20, 'min_samples_leaf': 1, 'subsample': 0.9858872577604492, 'max_features': None}. Best is trial 2282 with value: 0.45359136528270205.
[I 2024-12-04 15:27:55,720] Trial 2331 finished with value: 0.47207649723163303 and parameters: {'n_estimators': 1056, 'learning_rate': 0.0657561253232517, 'max_depth': 12, 'min_samples_split': 20, 'min_samples_leaf': 1, 'subsample': 0.9650152386534074, 'max_features': None}. Best is trial 2282 with value: 0.45359136528270205.
[I 2024-12-04 15:27:58,829] Trial 2340 finished with value: 0.7628872031965263 and parameters: {'n_estimators': 1091, 'learning_rate': 0.05458021485481408, 'max_depth': 10, 'min_samples_split': 14, 'min_samples_leaf': 10, 'subsample': 0.8639080766552696, 'max_features': None}. Best is trial 2282 with value: 0.45359136528270205.
[I 2024-12-04 15:27:58,888] Trial 2334 finished with value: 0.4873321716441425 and parameters: {'n_estimators': 1206, 'learning_rate': 0.09505866277015208, 'max_depth': 11, 'min_samples_split': 20, 'min_samples_leaf': 1, 'subsample': 0.9872155164652167, 'max_features': None}. Best is trial 2282 with value: 0.45359136528270205.
[I 2024-12-04 15:27:59,625] Trial 2335 finished with value: 0.5035498589841395 and parameters: {'n_estimators': 1236, 'learning_rate': 0.05550525544945331, 'max_depth': 9, 'min_samples_split': 20, 'min_samples_leaf': 1, 'subsample': 0.9973214357733498, 'max_features': None}. Best is trial 2282 with value: 0.45359136528270205.
[I 2024-12-04 15:28:00,369] Trial 2357 finished with value: 0.6394082190906006 and parameters: {'n_estimators': 749, 'learning_rate': 0.06883899145897833, 'max_depth': 12, 'min_samples_split': 20, 'min_samples_leaf': 3, 'subsample': 0.9554955634476248, 'max_features': None}. Best is trial 2282 with value: 0.45359136528270205.
[I 2024-12-04 15:28:00,472] Trial 2345 finished with value: 0.4853717052858169 and parameters: {'n_estimators': 978, 'learning_rate': 0.07516894972064687, 'max_depth': 10, 'min_samples_split': 18, 'min_samples_leaf': 1, 'subsample': 0.9332875764338637, 'max_features': None}. Best is trial 2282 with value: 0.45359136528270205.
[I 2024-12-04 15:28:01,402] Trial 2342 finished with value: 0.5462357994101766 and parameters: {'n_estimators': 1274, 'learning_rate': 0.0534460285468088, 'max_depth': 12, 'min_samples_split': 16, 'min_samples_leaf': 1, 'subsample': 0.9609254971795478, 'max_features': 'log2'}. Best is trial 2282 with value: 0.45359136528270205.
[I 2024-12-04 15:28:01,492] Trial 2333 finished with value: 0.47378672173202774 and parameters: {'n_estimators': 1146, 'learning_rate': 0.0845776970517709, 'max_depth': 12, 'min_samples_split': 19, 'min_samples_leaf': 1, 'subsample': 0.9965124216104142, 'max_features': None}. Best is trial 2282 with value: 0.45359136528270205.
[I 2024-12-04 15:28:02,278] Trial 2343 finished with value: 0.510502750346605 and parameters: {'n_estimators': 957, 'learning_rate': 0.05176290365793796, 'max_depth': 11, 'min_samples_split': 14, 'min_samples_leaf': 1, 'subsample': 0.9996255025186446, 'max_features': None}. Best is trial 2282 with value: 0.45359136528270205.
[I 2024-12-04 15:28:05,314] Trial 2339 finished with value: 0.4964604505807938 and parameters: {'n_estimators': 1223, 'learning_rate': 0.07002979672355669, 'max_depth': 12, 'min_samples_split': 20, 'min_samples_leaf': 1, 'subsample': 0.9390462564909455, 'max_features': None}. Best is trial 2282 with value: 0.45359136528270205.
[I 2024-12-04 15:28:05,333] Trial 2344 finished with value: 0.6557519380002732 and parameters: {'n_estimators': 1128, 'learning_rate': 0.06362853356705427, 'max_depth': 12, 'min_samples_split': 16, 'min_samples_leaf': 3, 'subsample': 0.9575677626454002, 'max_features': None}. Best is trial 2282 with value: 0.45359136528270205.
[I 2024-12-04 15:28:05,709] Trial 2352 finished with value: 0.4807645870945974 and parameters: {'n_estimators': 933, 'learning_rate': 0.06542931255761904, 'max_depth': 12, 'min_samples_split': 19, 'min_samples_leaf': 1, 'subsample': 0.9968208165039962, 'max_features': None}. Best is trial 2282 with value: 0.45359136528270205.
[I 2024-12-04 15:28:06,631] Trial 2332 finished with value: 0.47666846432050025 and parameters: {'n_estimators': 1330, 'learning_rate': 0.08108166238864527, 'max_depth': 12, 'min_samples_split': 18, 'min_samples_leaf': 1, 'subsample': 0.9928102732161482, 'max_features': None}. Best is trial 2282 with value: 0.45359136528270205.
[I 2024-12-04 15:28:08,036] Trial 2341 finished with value: 0.7300936192619862 and parameters: {'n_estimators': 1497, 'learning_rate': 0.09266275755030563, 'max_depth': 3, 'min_samples_split': 8, 'min_samples_leaf': 6, 'subsample': 0.6130214635075449, 'max_features': 'sqrt'}. Best is trial 2282 with value: 0.45359136528270205.
[I 2024-12-04 15:28:08,223] Trial 2367 finished with value: 0.9562974135590523 and parameters: {'n_estimators': 473, 'learning_rate': 0.02338662903744631, 'max_depth': 6, 'min_samples_split': 18, 'min_samples_leaf': 6, 'subsample': 0.8293851547826283, 'max_features': 'log2'}. Best is trial 2282 with value: 0.45359136528270205.
[I 2024-12-04 15:28:08,823] Trial 2347 finished with value: 0.4791187711125199 and parameters: {'n_estimators': 1064, 'learning_rate': 0.06488112729930316, 'max_depth': 12, 'min_samples_split': 20, 'min_samples_leaf': 1, 'subsample': 0.927810809852286, 'max_features': None}. Best is trial 2282 with value: 0.45359136528270205.
[I 2024-12-04 15:28:10,214] Trial 2356 finished with value: 0.4621619904099911 and parameters: {'n_estimators': 954, 'learning_rate': 0.08396162156393171, 'max_depth': 12, 'min_samples_split': 20, 'min_samples_leaf': 1, 'subsample': 0.9965463253046053, 'max_features': None}. Best is trial 2282 with value: 0.45359136528270205.
[I 2024-12-04 15:28:10,217] Trial 2348 finished with value: 0.4766451348550524 and parameters: {'n_estimators': 1120, 'learning_rate': 0.0656559227329996, 'max_depth': 11, 'min_samples_split': 20, 'min_samples_leaf': 1, 'subsample': 0.9970891579468386, 'max_features': None}. Best is trial 2282 with value: 0.45359136528270205.
[I 2024-12-04 15:28:11,839] Trial 2358 finished with value: 0.6707886827901522 and parameters: {'n_estimators': 1313, 'learning_rate': 0.013526896993336241, 'max_depth': 7, 'min_samples_split': 17, 'min_samples_leaf': 5, 'subsample': 0.7160349756609051, 'max_features': 'sqrt'}. Best is trial 2282 with value: 0.45359136528270205.
[I 2024-12-04 15:28:13,413] Trial 2349 finished with value: 0.6806941150551155 and parameters: {'n_estimators': 1168, 'learning_rate': 0.0675471541061528, 'max_depth': 12, 'min_samples_split': 18, 'min_samples_leaf': 3, 'subsample': 0.957554298492656, 'max_features': None}. Best is trial 2282 with value: 0.45359136528270205.
[I 2024-12-04 15:28:14,652] Trial 2354 finished with value: 0.6370649568523415 and parameters: {'n_estimators': 1120, 'learning_rate': 0.045940713997096365, 'max_depth': 10, 'min_samples_split': 20, 'min_samples_leaf': 2, 'subsample': 0.998003373258758, 'max_features': None}. Best is trial 2282 with value: 0.45359136528270205.
[I 2024-12-04 15:28:14,835] Trial 2381 finished with value: 1.1554283699726304 and parameters: {'n_estimators': 152, 'learning_rate': 0.012341806293582612, 'max_depth': 3, 'min_samples_split': 5, 'min_samples_leaf': 8, 'subsample': 0.7810106698690079, 'max_features': 'sqrt'}. Best is trial 2282 with value: 0.45359136528270205.
[I 2024-12-04 15:28:16,266] Trial 2366 finished with value: 0.6313080627292795 and parameters: {'n_estimators': 609, 'learning_rate': 0.09318328209803564, 'max_depth': 12, 'min_samples_split': 20, 'min_samples_leaf': 2, 'subsample': 0.9212078671885979, 'max_features': None}. Best is trial 2282 with value: 0.45359136528270205.
[I 2024-12-04 15:28:16,704] Trial 2346 finished with value: 0.6441863699535798 and parameters: {'n_estimators': 1303, 'learning_rate': 0.07450007637342057, 'max_depth': 11, 'min_samples_split': 20, 'min_samples_leaf': 3, 'subsample': 0.994149372018825, 'max_features': None}. Best is trial 2282 with value: 0.45359136528270205.
[I 2024-12-04 15:28:18,028] Trial 2355 finished with value: 0.46521209873770364 and parameters: {'n_estimators': 1191, 'learning_rate': 0.06303133228027741, 'max_depth': 12, 'min_samples_split': 20, 'min_samples_leaf': 1, 'subsample': 0.9917713582890232, 'max_features': None}. Best is trial 2282 with value: 0.45359136528270205.
[I 2024-12-04 15:28:20,416] Trial 2353 finished with value: 0.47968169547384243 and parameters: {'n_estimators': 1262, 'learning_rate': 0.07288703920615887, 'max_depth': 11, 'min_samples_split': 20, 'min_samples_leaf': 1, 'subsample': 0.916842271591317, 'max_features': None}. Best is trial 2282 with value: 0.45359136528270205.
[I 2024-12-04 15:28:23,172] Trial 2388 finished with value: 0.8568033293984411 and parameters: {'n_estimators': 255, 'learning_rate': 0.032814471864077044, 'max_depth': 12, 'min_samples_split': 12, 'min_samples_leaf': 10, 'subsample': 0.967888557310073, 'max_features': 'sqrt'}. Best is trial 2282 with value: 0.45359136528270205.
[I 2024-12-04 15:28:23,769] Trial 2376 finished with value: 0.5352355975244469 and parameters: {'n_estimators': 551, 'learning_rate': 0.030094184658875468, 'max_depth': 11, 'min_samples_split': 3, 'min_samples_leaf': 1, 'subsample': 0.7908054934667429, 'max_features': 'sqrt'}. Best is trial 2282 with value: 0.45359136528270205.
[I 2024-12-04 15:28:24,514] Trial 2361 finished with value: 0.4752099242459676 and parameters: {'n_estimators': 1147, 'learning_rate': 0.04691469071017143, 'max_depth': 12, 'min_samples_split': 20, 'min_samples_leaf': 1, 'subsample': 0.9998007700848471, 'max_features': None}. Best is trial 2282 with value: 0.45359136528270205.
[I 2024-12-04 15:28:25,732] Trial 2364 finished with value: 0.498369533444638 and parameters: {'n_estimators': 1021, 'learning_rate': 0.09568889937496228, 'max_depth': 11, 'min_samples_split': 20, 'min_samples_leaf': 1, 'subsample': 0.9160657163274756, 'max_features': None}. Best is trial 2282 with value: 0.45359136528270205.
[I 2024-12-04 15:28:26,247] Trial 2368 finished with value: 0.5099248219313612 and parameters: {'n_estimators': 756, 'learning_rate': 0.09375535782879858, 'max_depth': 11, 'min_samples_split': 16, 'min_samples_leaf': 1, 'subsample': 0.9133886916548462, 'max_features': None}. Best is trial 2282 with value: 0.45359136528270205.
[I 2024-12-04 15:28:28,028] Trial 2362 finished with value: 0.48445263598198224 and parameters: {'n_estimators': 1223, 'learning_rate': 0.054261654782214876, 'max_depth': 12, 'min_samples_split': 20, 'min_samples_leaf': 1, 'subsample': 0.9601388630224234, 'max_features': None}. Best is trial 2282 with value: 0.45359136528270205.
[I 2024-12-04 15:28:28,075] Trial 2365 finished with value: 0.6443553240586432 and parameters: {'n_estimators': 1001, 'learning_rate': 0.09801484363458916, 'max_depth': 11, 'min_samples_split': 17, 'min_samples_leaf': 3, 'subsample': 0.9959727409505741, 'max_features': None}. Best is trial 2282 with value: 0.45359136528270205.
[I 2024-12-04 15:28:29,119] Trial 2363 finished with value: 0.5097024259942711 and parameters: {'n_estimators': 1215, 'learning_rate': 0.05986218677722019, 'max_depth': 12, 'min_samples_split': 16, 'min_samples_leaf': 1, 'subsample': 0.9825969606358178, 'max_features': None}. Best is trial 2282 with value: 0.45359136528270205.
[I 2024-12-04 15:28:32,178] Trial 2375 finished with value: 0.5052902765908566 and parameters: {'n_estimators': 721, 'learning_rate': 0.06708063427083696, 'max_depth': 10, 'min_samples_split': 18, 'min_samples_leaf': 1, 'subsample': 0.9388613118002735, 'max_features': None}. Best is trial 2282 with value: 0.45359136528270205.
[I 2024-12-04 15:28:32,251] Trial 2371 finished with value: 0.4834944121773679 and parameters: {'n_estimators': 777, 'learning_rate': 0.05821366574908013, 'max_depth': 12, 'min_samples_split': 20, 'min_samples_leaf': 1, 'subsample': 0.9245403403733611, 'max_features': None}. Best is trial 2282 with value: 0.45359136528270205.
[I 2024-12-04 15:28:33,681] Trial 2369 finished with value: 0.6281663666891454 and parameters: {'n_estimators': 948, 'learning_rate': 0.0649031484341851, 'max_depth': 10, 'min_samples_split': 19, 'min_samples_leaf': 3, 'subsample': 0.9977858005473158, 'max_features': None}. Best is trial 2282 with value: 0.45359136528270205.
[I 2024-12-04 15:28:35,283] Trial 2378 finished with value: 0.5310782586029751 and parameters: {'n_estimators': 899, 'learning_rate': 0.04938027918210261, 'max_depth': 10, 'min_samples_split': 20, 'min_samples_leaf': 1, 'subsample': 0.9832718766264577, 'max_features': 'sqrt'}. Best is trial 2282 with value: 0.45359136528270205.
[I 2024-12-04 15:28:35,291] Trial 2377 finished with value: 0.49134214762310874 and parameters: {'n_estimators': 725, 'learning_rate': 0.0714682676800888, 'max_depth': 12, 'min_samples_split': 17, 'min_samples_leaf': 1, 'subsample': 0.9913884740274257, 'max_features': None}. Best is trial 2282 with value: 0.45359136528270205.
[I 2024-12-04 15:28:35,854] Trial 2379 finished with value: 0.6523383216256576 and parameters: {'n_estimators': 732, 'learning_rate': 0.08132642344319847, 'max_depth': 12, 'min_samples_split': 16, 'min_samples_leaf': 3, 'subsample': 0.9365821496197582, 'max_features': None}. Best is trial 2282 with value: 0.45359136528270205.
[I 2024-12-04 15:28:36,249] Trial 2374 finished with value: 0.4823644415599568 and parameters: {'n_estimators': 791, 'learning_rate': 0.08092788800004079, 'max_depth': 12, 'min_samples_split': 19, 'min_samples_leaf': 1, 'subsample': 0.9997050443884812, 'max_features': None}. Best is trial 2282 with value: 0.45359136528270205.
[I 2024-12-04 15:28:38,289] Trial 2393 finished with value: 0.4636190232937119 and parameters: {'n_estimators': 466, 'learning_rate': 0.09841552117659336, 'max_depth': 12, 'min_samples_split': 20, 'min_samples_leaf': 1, 'subsample': 0.9722510370880021, 'max_features': None}. Best is trial 2282 with value: 0.45359136528270205.
[I 2024-12-04 15:28:38,793] Trial 2386 finished with value: 0.49577568925604365 and parameters: {'n_estimators': 598, 'learning_rate': 0.061604910298792066, 'max_depth': 10, 'min_samples_split': 20, 'min_samples_leaf': 1, 'subsample': 0.9671269091983657, 'max_features': None}. Best is trial 2282 with value: 0.45359136528270205.
[I 2024-12-04 15:28:41,170] Trial 2373 finished with value: 0.49844070892100784 and parameters: {'n_estimators': 954, 'learning_rate': 0.0936964127931641, 'max_depth': 12, 'min_samples_split': 16, 'min_samples_leaf': 1, 'subsample': 0.9238451356641251, 'max_features': None}. Best is trial 2282 with value: 0.45359136528270205.
[I 2024-12-04 15:28:43,065] Trial 2370 finished with value: 0.4711669049920478 and parameters: {'n_estimators': 1153, 'learning_rate': 0.07638463804629746, 'max_depth': 12, 'min_samples_split': 20, 'min_samples_leaf': 1, 'subsample': 0.9986334708150743, 'max_features': None}. Best is trial 2282 with value: 0.45359136528270205.
[I 2024-12-04 15:28:46,368] Trial 2372 finished with value: 0.48315583701424225 and parameters: {'n_estimators': 1160, 'learning_rate': 0.07723123040237645, 'max_depth': 12, 'min_samples_split': 17, 'min_samples_leaf': 1, 'subsample': 0.9263407072414782, 'max_features': None}. Best is trial 2282 with value: 0.45359136528270205.
[I 2024-12-04 15:28:46,725] Trial 2383 finished with value: 0.6492840016081184 and parameters: {'n_estimators': 947, 'learning_rate': 0.06858352203998959, 'max_depth': 12, 'min_samples_split': 16, 'min_samples_leaf': 3, 'subsample': 0.9884038598357134, 'max_features': None}. Best is trial 2282 with value: 0.45359136528270205.
[I 2024-12-04 15:28:47,163] Trial 2385 finished with value: 0.48074755818028225 and parameters: {'n_estimators': 890, 'learning_rate': 0.06803447851151484, 'max_depth': 12, 'min_samples_split': 20, 'min_samples_leaf': 1, 'subsample': 0.9465162387074411, 'max_features': None}. Best is trial 2282 with value: 0.45359136528270205.
[I 2024-12-04 15:28:48,988] Trial 2389 finished with value: 0.4745734902559291 and parameters: {'n_estimators': 856, 'learning_rate': 0.08538250725132818, 'max_depth': 10, 'min_samples_split': 20, 'min_samples_leaf': 1, 'subsample': 0.9927704269921469, 'max_features': None}. Best is trial 2282 with value: 0.45359136528270205.
[I 2024-12-04 15:28:50,112] Trial 2390 finished with value: 0.7411188259772982 and parameters: {'n_estimators': 1146, 'learning_rate': 0.0460341162881962, 'max_depth': 11, 'min_samples_split': 18, 'min_samples_leaf': 6, 'subsample': 0.6915171414064643, 'max_features': 'sqrt'}. Best is trial 2282 with value: 0.45359136528270205.
[I 2024-12-04 15:28:50,999] Trial 2392 finished with value: 0.4761145253492711 and parameters: {'n_estimators': 808, 'learning_rate': 0.07360071726515, 'max_depth': 12, 'min_samples_split': 19, 'min_samples_leaf': 1, 'subsample': 0.9989364584196387, 'max_features': None}. Best is trial 2282 with value: 0.45359136528270205.
[I 2024-12-04 15:28:54,141] Trial 2394 finished with value: 0.6223739707135927 and parameters: {'n_estimators': 938, 'learning_rate': 0.09838365539227373, 'max_depth': 12, 'min_samples_split': 20, 'min_samples_leaf': 2, 'subsample': 0.9502310726440583, 'max_features': None}. Best is trial 2282 with value: 0.45359136528270205.
[I 2024-12-04 15:28:54,649] Trial 2387 finished with value: 0.64672940539936 and parameters: {'n_estimators': 1104, 'learning_rate': 0.08139579385169621, 'max_depth': 12, 'min_samples_split': 19, 'min_samples_leaf': 3, 'subsample': 0.9931676930539769, 'max_features': None}. Best is trial 2282 with value: 0.45359136528270205.
[I 2024-12-04 15:28:54,652] Trial 2403 finished with value: 0.7273069798653697 and parameters: {'n_estimators': 813, 'learning_rate': 0.09366507686935563, 'max_depth': 10, 'min_samples_split': 9, 'min_samples_leaf': 7, 'subsample': 0.7883511607760274, 'max_features': 'sqrt'}. Best is trial 2282 with value: 0.45359136528270205.
[I 2024-12-04 15:28:56,330] Trial 2380 finished with value: 0.637526289900283 and parameters: {'n_estimators': 1210, 'learning_rate': 0.07840074955764964, 'max_depth': 12, 'min_samples_split': 20, 'min_samples_leaf': 2, 'subsample': 0.9868397898916214, 'max_features': None}. Best is trial 2282 with value: 0.45359136528270205.
[I 2024-12-04 15:28:58,326] Trial 2384 finished with value: 0.6327912051940802 and parameters: {'n_estimators': 1214, 'learning_rate': 0.06360516385484916, 'max_depth': 12, 'min_samples_split': 20, 'min_samples_leaf': 2, 'subsample': 0.9845496411675977, 'max_features': None}. Best is trial 2282 with value: 0.45359136528270205.
[I 2024-12-04 15:28:58,808] Trial 2391 finished with value: 0.49597365309799396 and parameters: {'n_estimators': 1065, 'learning_rate': 0.08519887271835452, 'max_depth': 12, 'min_samples_split': 17, 'min_samples_leaf': 1, 'subsample': 0.9960620723264975, 'max_features': None}. Best is trial 2282 with value: 0.45359136528270205.
[I 2024-12-04 15:28:59,654] Trial 2382 finished with value: 0.656355816534037 and parameters: {'n_estimators': 1321, 'learning_rate': 0.07335632026823719, 'max_depth': 12, 'min_samples_split': 20, 'min_samples_leaf': 3, 'subsample': 0.9829607441574838, 'max_features': None}. Best is trial 2282 with value: 0.45359136528270205.
[I 2024-12-04 15:29:00,832] Trial 2400 finished with value: 0.6233603429845735 and parameters: {'n_estimators': 880, 'learning_rate': 0.04110217295149875, 'max_depth': 12, 'min_samples_split': 20, 'min_samples_leaf': 3, 'subsample': 0.95221080751769, 'max_features': None}. Best is trial 2282 with value: 0.45359136528270205.
[I 2024-12-04 15:29:03,036] Trial 2397 finished with value: 0.6099961303491588 and parameters: {'n_estimators': 998, 'learning_rate': 0.03288961068431181, 'max_depth': 12, 'min_samples_split': 18, 'min_samples_leaf': 3, 'subsample': 0.987452481024601, 'max_features': None}. Best is trial 2282 with value: 0.45359136528270205.
[I 2024-12-04 15:29:03,925] Trial 2402 finished with value: 0.4724625600025266 and parameters: {'n_estimators': 907, 'learning_rate': 0.06632900730134807, 'max_depth': 12, 'min_samples_split': 20, 'min_samples_leaf': 1, 'subsample': 0.9672087871584485, 'max_features': None}. Best is trial 2282 with value: 0.45359136528270205.
[I 2024-12-04 15:29:04,402] Trial 2398 finished with value: 0.5142908810278415 and parameters: {'n_estimators': 985, 'learning_rate': 0.09588721668602679, 'max_depth': 12, 'min_samples_split': 16, 'min_samples_leaf': 1, 'subsample': 0.9960323551674967, 'max_features': None}. Best is trial 2282 with value: 0.45359136528270205.
