[I 2024-12-04 12:51:56,989] Trial 1067 finished with value: 0.2423660855855002 and parameters: {'n_estimators': 1500, 'learning_rate': 0.07485784981214054, 'max_depth': 7, 'min_samples_split': 10, 'min_samples_leaf': 1, 'subsample': 0.8372477886421946, 'max_features': 'sqrt'}. Best is trial 621 with value: 0.2256726988932517.
[I 2024-12-04 12:52:01,041] Trial 1101 finished with value: 1.0526699975839373 and parameters: {'n_estimators': 213, 'learning_rate': 0.0181182483741192, 'max_depth': 8, 'min_samples_split': 2, 'min_samples_leaf': 3, 'subsample': 0.8915337031077026, 'max_features': 'log2'}. Best is trial 621 with value: 0.2256726988932517.
[I 2024-12-04 12:52:06,936] Trial 1074 finished with value: 0.35384281275150864 and parameters: {'n_estimators': 1367, 'learning_rate': 0.08310251026156257, 'max_depth': 8, 'min_samples_split': 5, 'min_samples_leaf': 3, 'subsample': 0.802125458005562, 'max_features': 'sqrt'}. Best is trial 621 with value: 0.2256726988932517.
[I 2024-12-04 12:52:10,389] Trial 1072 finished with value: 0.25506469525400494 and parameters: {'n_estimators': 1439, 'learning_rate': 0.0736782587158376, 'max_depth': 11, 'min_samples_split': 2, 'min_samples_leaf': 1, 'subsample': 0.6300613329226648, 'max_features': 'sqrt'}. Best is trial 621 with value: 0.2256726988932517.
[I 2024-12-04 12:52:13,891] Trial 1076 finished with value: 0.28059934715937757 and parameters: {'n_estimators': 1340, 'learning_rate': 0.08043570689474196, 'max_depth': 10, 'min_samples_split': 5, 'min_samples_leaf': 1, 'subsample': 0.828922159689636, 'max_features': 'sqrt'}. Best is trial 621 with value: 0.2256726988932517.
[I 2024-12-04 12:52:14,799] Trial 1075 finished with value: 0.29987714244259633 and parameters: {'n_estimators': 1402, 'learning_rate': 0.04385371471534778, 'max_depth': 6, 'min_samples_split': 4, 'min_samples_leaf': 2, 'subsample': 0.6014497564024478, 'max_features': 'sqrt'}. Best is trial 621 with value: 0.2256726988932517.
[I 2024-12-04 12:52:15,809] Trial 1073 finished with value: 0.23172516254558803 and parameters: {'n_estimators': 1494, 'learning_rate': 0.05118831086000932, 'max_depth': 8, 'min_samples_split': 3, 'min_samples_leaf': 1, 'subsample': 0.6416300959244281, 'max_features': 'sqrt'}. Best is trial 621 with value: 0.2256726988932517.
[I 2024-12-04 12:52:17,795] Trial 1092 finished with value: 0.36633323062205164 and parameters: {'n_estimators': 933, 'learning_rate': 0.06648614798722062, 'max_depth': 5, 'min_samples_split': 9, 'min_samples_leaf': 4, 'subsample': 0.9993993321744145, 'max_features': 'sqrt'}. Best is trial 621 with value: 0.2256726988932517.
[I 2024-12-04 12:52:18,217] Trial 1094 finished with value: 0.3579725144549091 and parameters: {'n_estimators': 874, 'learning_rate': 0.09627971432032519, 'max_depth': 3, 'min_samples_split': 15, 'min_samples_leaf': 4, 'subsample': 0.6729250323232521, 'max_features': 'sqrt'}. Best is trial 621 with value: 0.2256726988932517.
[I 2024-12-04 12:52:19,405] Trial 1087 finished with value: 0.4484719308279011 and parameters: {'n_estimators': 1076, 'learning_rate': 0.06669232329713498, 'max_depth': 6, 'min_samples_split': 7, 'min_samples_leaf': 9, 'subsample': 0.8539344905450142, 'max_features': 'sqrt'}. Best is trial 621 with value: 0.2256726988932517.
[I 2024-12-04 12:52:19,693] Trial 1079 finished with value: 0.2936106529837183 and parameters: {'n_estimators': 1390, 'learning_rate': 0.056933459240445745, 'max_depth': 6, 'min_samples_split': 5, 'min_samples_leaf': 2, 'subsample': 0.7966144673172784, 'max_features': 'sqrt'}. Best is trial 621 with value: 0.2256726988932517.
[I 2024-12-04 12:52:21,492] Trial 1082 finished with value: 0.2704161801946343 and parameters: {'n_estimators': 1292, 'learning_rate': 0.09273301115170643, 'max_depth': 8, 'min_samples_split': 8, 'min_samples_leaf': 1, 'subsample': 0.8727017678945859, 'max_features': 'sqrt'}. Best is trial 621 with value: 0.2256726988932517.
[I 2024-12-04 12:52:24,365] Trial 1083 finished with value: 0.28727405591741634 and parameters: {'n_estimators': 1282, 'learning_rate': 0.0963633186274127, 'max_depth': 8, 'min_samples_split': 6, 'min_samples_leaf': 1, 'subsample': 0.8350194529788999, 'max_features': 'sqrt'}. Best is trial 621 with value: 0.2256726988932517.
[I 2024-12-04 12:52:28,297] Trial 1088 finished with value: 0.2949368074308954 and parameters: {'n_estimators': 1182, 'learning_rate': 0.08911508170592446, 'max_depth': 7, 'min_samples_split': 2, 'min_samples_leaf': 2, 'subsample': 0.7445970156452513, 'max_features': 'sqrt'}. Best is trial 621 with value: 0.2256726988932517.
[I 2024-12-04 12:52:31,322] Trial 1081 finished with value: 0.2839946060489914 and parameters: {'n_estimators': 1495, 'learning_rate': 0.036911388857887015, 'max_depth': 8, 'min_samples_split': 7, 'min_samples_leaf': 2, 'subsample': 0.6102092000631293, 'max_features': 'sqrt'}. Best is trial 621 with value: 0.2256726988932517.
[I 2024-12-04 12:52:31,437] Trial 1089 finished with value: 0.2482436455491435 and parameters: {'n_estimators': 1248, 'learning_rate': 0.079589442375637, 'max_depth': 6, 'min_samples_split': 6, 'min_samples_leaf': 1, 'subsample': 0.7538514830646657, 'max_features': 'sqrt'}. Best is trial 621 with value: 0.2256726988932517.
[I 2024-12-04 12:52:33,085] Trial 1080 finished with value: 0.3532186031615905 and parameters: {'n_estimators': 1399, 'learning_rate': 0.04335896708202717, 'max_depth': 12, 'min_samples_split': 2, 'min_samples_leaf': 1, 'subsample': 0.6918426741966303, 'max_features': None}. Best is trial 621 with value: 0.2256726988932517.
[I 2024-12-04 12:52:33,090] Trial 1090 finished with value: 0.24945916733662657 and parameters: {'n_estimators': 1217, 'learning_rate': 0.08348496509962806, 'max_depth': 9, 'min_samples_split': 6, 'min_samples_leaf': 1, 'subsample': 0.69844752324507, 'max_features': 'sqrt'}. Best is trial 621 with value: 0.2256726988932517.
[I 2024-12-04 12:52:33,435] Trial 1077 finished with value: 0.4156372229634766 and parameters: {'n_estimators': 1402, 'learning_rate': 0.04385834847228425, 'max_depth': 11, 'min_samples_split': 5, 'min_samples_leaf': 3, 'subsample': 0.7093514742002341, 'max_features': None}. Best is trial 621 with value: 0.2256726988932517.
[I 2024-12-04 12:52:34,081] Trial 1085 finished with value: 0.6157850823693027 and parameters: {'n_estimators': 1448, 'learning_rate': 0.010450340477075907, 'max_depth': 5, 'min_samples_split': 10, 'min_samples_leaf': 10, 'subsample': 0.8205529770600449, 'max_features': 'sqrt'}. Best is trial 621 with value: 0.2256726988932517.
[I 2024-12-04 12:52:35,218] Trial 1084 finished with value: 0.3707238260986268 and parameters: {'n_estimators': 1500, 'learning_rate': 0.04918855344926753, 'max_depth': 7, 'min_samples_split': 9, 'min_samples_leaf': 4, 'subsample': 0.8462650638557397, 'max_features': 'log2'}. Best is trial 621 with value: 0.2256726988932517.
[I 2024-12-04 12:52:36,997] Trial 1086 finished with value: 0.35028300432865184 and parameters: {'n_estimators': 1430, 'learning_rate': 0.04612748915416924, 'max_depth': 10, 'min_samples_split': 2, 'min_samples_leaf': 3, 'subsample': 0.6858779292362265, 'max_features': 'sqrt'}. Best is trial 621 with value: 0.2256726988932517.
[I 2024-12-04 12:52:39,259] Trial 1091 finished with value: 0.35267951764747624 and parameters: {'n_estimators': 1177, 'learning_rate': 0.09080027470920636, 'max_depth': 11, 'min_samples_split': 7, 'min_samples_leaf': 1, 'subsample': 0.850574691045712, 'max_features': None}. Best is trial 621 with value: 0.2256726988932517.
[I 2024-12-04 12:52:45,900] Trial 1096 finished with value: 0.2475393481677169 and parameters: {'n_estimators': 1278, 'learning_rate': 0.07586174023870494, 'max_depth': 6, 'min_samples_split': 3, 'min_samples_leaf': 1, 'subsample': 0.6860073807614973, 'max_features': 'sqrt'}. Best is trial 621 with value: 0.2256726988932517.
[I 2024-12-04 12:52:45,905] Trial 1093 finished with value: 0.2793994391655142 and parameters: {'n_estimators': 1380, 'learning_rate': 0.04940836860768329, 'max_depth': 6, 'min_samples_split': 2, 'min_samples_leaf': 1, 'subsample': 0.7734370020505279, 'max_features': 'sqrt'}. Best is trial 621 with value: 0.2256726988932517.
[I 2024-12-04 12:52:50,284] Trial 1099 finished with value: 0.4482784090438771 and parameters: {'n_estimators': 1165, 'learning_rate': 0.011709542744080283, 'max_depth': 5, 'min_samples_split': 13, 'min_samples_leaf': 7, 'subsample': 0.6086275643692098, 'max_features': None}. Best is trial 621 with value: 0.2256726988932517.
[I 2024-12-04 12:52:50,783] Trial 1095 finished with value: 0.23971961547455603 and parameters: {'n_estimators': 1353, 'learning_rate': 0.08505866536680011, 'max_depth': 7, 'min_samples_split': 2, 'min_samples_leaf': 1, 'subsample': 0.6663266756274937, 'max_features': 'sqrt'}. Best is trial 621 with value: 0.2256726988932517.
[I 2024-12-04 12:52:57,806] Trial 1097 finished with value: 0.28354839779038093 and parameters: {'n_estimators': 1477, 'learning_rate': 0.055614199444514414, 'max_depth': 8, 'min_samples_split': 4, 'min_samples_leaf': 2, 'subsample': 0.9802918524569031, 'max_features': 'sqrt'}. Best is trial 621 with value: 0.2256726988932517.
[I 2024-12-04 12:52:57,839] Trial 1124 finished with value: 1.1499820178700662 and parameters: {'n_estimators': 106, 'learning_rate': 0.04107138165151346, 'max_depth': 4, 'min_samples_split': 20, 'min_samples_leaf': 8, 'subsample': 0.8272413937385649, 'max_features': 'log2'}. Best is trial 621 with value: 0.2256726988932517.
[I 2024-12-04 12:52:58,877] Trial 1106 finished with value: 0.6569142398665077 and parameters: {'n_estimators': 877, 'learning_rate': 0.013760124495624382, 'max_depth': 7, 'min_samples_split': 18, 'min_samples_leaf': 8, 'subsample': 0.6208815346093389, 'max_features': 'sqrt'}. Best is trial 621 with value: 0.2256726988932517.
[I 2024-12-04 12:52:58,973] Trial 1098 finished with value: 0.4124780362103061 and parameters: {'n_estimators': 1360, 'learning_rate': 0.014826341282546842, 'max_depth': 4, 'min_samples_split': 7, 'min_samples_leaf': 6, 'subsample': 0.7101464309442337, 'max_features': None}. Best is trial 621 with value: 0.2256726988932517.
[I 2024-12-04 12:52:59,346] Trial 1100 finished with value: 0.24293161582854902 and parameters: {'n_estimators': 1271, 'learning_rate': 0.06623823582498807, 'max_depth': 8, 'min_samples_split': 3, 'min_samples_leaf': 1, 'subsample': 0.934824141665787, 'max_features': 'sqrt'}. Best is trial 621 with value: 0.2256726988932517.
[I 2024-12-04 12:52:59,353] Trial 1102 finished with value: 0.9883149034088005 and parameters: {'n_estimators': 1124, 'learning_rate': 0.019430740415836877, 'max_depth': 3, 'min_samples_split': 15, 'min_samples_leaf': 10, 'subsample': 0.7450470364711692, 'max_features': 'log2'}. Best is trial 621 with value: 0.2256726988932517.
[I 2024-12-04 12:53:11,284] Trial 1104 finished with value: 0.36064654761254383 and parameters: {'n_estimators': 1245, 'learning_rate': 0.05682592147861536, 'max_depth': 7, 'min_samples_split': 6, 'min_samples_leaf': 3, 'subsample': 0.8242742306069668, 'max_features': 'sqrt'}. Best is trial 621 with value: 0.2256726988932517.
[I 2024-12-04 12:53:11,806] Trial 1105 finished with value: 0.2864787872472625 and parameters: {'n_estimators': 1213, 'learning_rate': 0.05351541965527456, 'max_depth': 8, 'min_samples_split': 2, 'min_samples_leaf': 2, 'subsample': 0.8240811563535015, 'max_features': 'sqrt'}. Best is trial 621 with value: 0.2256726988932517.
[I 2024-12-04 12:53:19,550] Trial 1103 finished with value: 0.37818497135470436 and parameters: {'n_estimators': 1453, 'learning_rate': 0.09351261775178202, 'max_depth': 9, 'min_samples_split': 2, 'min_samples_leaf': 4, 'subsample': 0.9301217651392972, 'max_features': 'sqrt'}. Best is trial 621 with value: 0.2256726988932517.
[I 2024-12-04 12:53:24,320] Trial 1112 finished with value: 0.43126078947345936 and parameters: {'n_estimators': 1035, 'learning_rate': 0.07300928577966806, 'max_depth': 10, 'min_samples_split': 16, 'min_samples_leaf': 5, 'subsample': 0.6462077966298349, 'max_features': 'log2'}. Best is trial 621 with value: 0.2256726988932517.
[I 2024-12-04 12:53:25,148] Trial 1108 finished with value: 0.26693729781669195 and parameters: {'n_estimators': 1207, 'learning_rate': 0.05438396317998674, 'max_depth': 10, 'min_samples_split': 3, 'min_samples_leaf': 1, 'subsample': 0.8447918336312389, 'max_features': 'log2'}. Best is trial 621 with value: 0.2256726988932517.
[I 2024-12-04 12:53:26,312] Trial 1107 finished with value: 0.2886298520087954 and parameters: {'n_estimators': 1313, 'learning_rate': 0.09384107700945861, 'max_depth': 8, 'min_samples_split': 9, 'min_samples_leaf': 2, 'subsample': 0.796435704900611, 'max_features': 'log2'}. Best is trial 621 with value: 0.2256726988932517.
[I 2024-12-04 12:53:26,730] Trial 1111 finished with value: 0.4198954055094187 and parameters: {'n_estimators': 1112, 'learning_rate': 0.040614583445596715, 'max_depth': 7, 'min_samples_split': 20, 'min_samples_leaf': 3, 'subsample': 0.8293918685321666, 'max_features': 'log2'}. Best is trial 621 with value: 0.2256726988932517.
[I 2024-12-04 12:53:37,530] Trial 1141 finished with value: 1.0232914420864117 and parameters: {'n_estimators': 108, 'learning_rate': 0.04899659461285168, 'max_depth': 11, 'min_samples_split': 17, 'min_samples_leaf': 8, 'subsample': 0.9909705349736398, 'max_features': 'log2'}. Best is trial 621 with value: 0.2256726988932517.
[I 2024-12-04 12:53:43,832] Trial 1109 finished with value: 0.23648523347563583 and parameters: {'n_estimators': 1472, 'learning_rate': 0.09687043972837976, 'max_depth': 8, 'min_samples_split': 4, 'min_samples_leaf': 1, 'subsample': 0.6640166761163236, 'max_features': 'sqrt'}. Best is trial 621 with value: 0.2256726988932517.
[I 2024-12-04 12:53:47,824] Trial 1118 finished with value: 0.29150944422528646 and parameters: {'n_estimators': 1059, 'learning_rate': 0.06981923878236032, 'max_depth': 9, 'min_samples_split': 3, 'min_samples_leaf': 2, 'subsample': 0.9076830653474811, 'max_features': 'sqrt'}. Best is trial 621 with value: 0.2256726988932517.
[I 2024-12-04 12:53:50,076] Trial 1110 finished with value: 0.24739187817094044 and parameters: {'n_estimators': 1468, 'learning_rate': 0.045610119060810916, 'max_depth': 8, 'min_samples_split': 6, 'min_samples_leaf': 1, 'subsample': 0.60978507751382, 'max_features': 'sqrt'}. Best is trial 621 with value: 0.2256726988932517.
[I 2024-12-04 12:53:51,613] Trial 1115 finished with value: 0.23968907388836835 and parameters: {'n_estimators': 1352, 'learning_rate': 0.06779965196380913, 'max_depth': 7, 'min_samples_split': 3, 'min_samples_leaf': 1, 'subsample': 0.627145434388338, 'max_features': 'sqrt'}. Best is trial 621 with value: 0.2256726988932517.
[I 2024-12-04 12:53:52,474] Trial 1113 finished with value: 0.2626775848029378 and parameters: {'n_estimators': 1405, 'learning_rate': 0.09184023811378277, 'max_depth': 9, 'min_samples_split': 2, 'min_samples_leaf': 1, 'subsample': 0.8881399559742794, 'max_features': 'log2'}. Best is trial 621 with value: 0.2256726988932517.
[I 2024-12-04 12:53:53,302] Trial 1117 finished with value: 0.3546143169990354 and parameters: {'n_estimators': 1298, 'learning_rate': 0.047972942067251084, 'max_depth': 8, 'min_samples_split': 2, 'min_samples_leaf': 3, 'subsample': 0.6626757122384248, 'max_features': 'sqrt'}. Best is trial 621 with value: 0.2256726988932517.
[I 2024-12-04 12:53:53,326] Trial 1114 finished with value: 0.24458197049715183 and parameters: {'n_estimators': 1462, 'learning_rate': 0.07099708841278969, 'max_depth': 10, 'min_samples_split': 5, 'min_samples_leaf': 1, 'subsample': 0.9566974760744084, 'max_features': 'sqrt'}. Best is trial 621 with value: 0.2256726988932517.
[I 2024-12-04 12:53:56,319] Trial 1116 finished with value: 0.2560921148439355 and parameters: {'n_estimators': 1414, 'learning_rate': 0.0785773760202968, 'max_depth': 7, 'min_samples_split': 2, 'min_samples_leaf': 1, 'subsample': 0.7457921711958234, 'max_features': 'sqrt'}. Best is trial 621 with value: 0.2256726988932517.
[I 2024-12-04 12:54:09,600] Trial 1122 finished with value: 0.24849926368336644 and parameters: {'n_estimators': 1335, 'learning_rate': 0.08832290965695136, 'max_depth': 9, 'min_samples_split': 3, 'min_samples_leaf': 1, 'subsample': 0.872935279108019, 'max_features': 'sqrt'}. Best is trial 621 with value: 0.2256726988932517.
[I 2024-12-04 12:54:10,139] Trial 1121 finished with value: 0.4860444937077076 and parameters: {'n_estimators': 1394, 'learning_rate': 0.026533859951782354, 'max_depth': 3, 'min_samples_split': 16, 'min_samples_leaf': 10, 'subsample': 0.6855003182930861, 'max_features': None}. Best is trial 621 with value: 0.2256726988932517.
[I 2024-12-04 12:54:11,684] Trial 1120 finished with value: 0.25667708348777857 and parameters: {'n_estimators': 1466, 'learning_rate': 0.04549007877364264, 'max_depth': 7, 'min_samples_split': 4, 'min_samples_leaf': 1, 'subsample': 0.6584079918962022, 'max_features': 'sqrt'}. Best is trial 621 with value: 0.2256726988932517.
[I 2024-12-04 12:54:16,336] Trial 1119 finished with value: 0.30346159717145355 and parameters: {'n_estimators': 1482, 'learning_rate': 0.043455080236290786, 'max_depth': 11, 'min_samples_split': 10, 'min_samples_leaf': 2, 'subsample': 0.7077193496188774, 'max_features': 'log2'}. Best is trial 621 with value: 0.2256726988932517.
[I 2024-12-04 12:54:18,000] Trial 1126 finished with value: 0.35744323503247366 and parameters: {'n_estimators': 1444, 'learning_rate': 0.07091635493126894, 'max_depth': 5, 'min_samples_split': 5, 'min_samples_leaf': 3, 'subsample': 0.6693385065677323, 'max_features': 'sqrt'}. Best is trial 621 with value: 0.2256726988932517.
[I 2024-12-04 12:54:18,787] Trial 1145 finished with value: 0.6962432869683679 and parameters: {'n_estimators': 530, 'learning_rate': 0.07681677072690204, 'max_depth': 4, 'min_samples_split': 2, 'min_samples_leaf': 7, 'subsample': 0.6017903468451486, 'max_features': 'log2'}. Best is trial 621 with value: 0.2256726988932517.
[I 2024-12-04 12:54:19,710] Trial 1125 finished with value: 0.2720531325202942 and parameters: {'n_estimators': 1401, 'learning_rate': 0.0632243449043719, 'max_depth': 8, 'min_samples_split': 2, 'min_samples_leaf': 1, 'subsample': 0.6448602980646788, 'max_features': 'sqrt'}. Best is trial 621 with value: 0.2256726988932517.
[I 2024-12-04 12:54:20,947] Trial 1123 finished with value: 0.2450229490943756 and parameters: {'n_estimators': 1476, 'learning_rate': 0.07938068427637918, 'max_depth': 6, 'min_samples_split': 6, 'min_samples_leaf': 1, 'subsample': 0.6591329762818089, 'max_features': 'sqrt'}. Best is trial 621 with value: 0.2256726988932517.
[I 2024-12-04 12:54:21,768] Trial 1130 finished with value: 0.24963211109000066 and parameters: {'n_estimators': 1321, 'learning_rate': 0.06306561540383152, 'max_depth': 9, 'min_samples_split': 3, 'min_samples_leaf': 1, 'subsample': 0.8916191014471502, 'max_features': 'sqrt'}. Best is trial 621 with value: 0.2256726988932517.
[I 2024-12-04 12:54:21,789] Trial 1127 finished with value: 0.2833639067154577 and parameters: {'n_estimators': 1408, 'learning_rate': 0.09040981711835476, 'max_depth': 7, 'min_samples_split': 4, 'min_samples_leaf': 1, 'subsample': 0.7522506399403747, 'max_features': 'sqrt'}. Best is trial 621 with value: 0.2256726988932517.
[I 2024-12-04 12:54:21,801] Trial 1137 finished with value: 0.24500870686081164 and parameters: {'n_estimators': 1103, 'learning_rate': 0.0952630311927669, 'max_depth': 7, 'min_samples_split': 3, 'min_samples_leaf': 1, 'subsample': 0.9300397029966906, 'max_features': 'sqrt'}. Best is trial 621 with value: 0.2256726988932517.
[I 2024-12-04 12:54:27,848] Trial 1128 finished with value: 0.4201687549469893 and parameters: {'n_estimators': 1385, 'learning_rate': 0.07934174112412909, 'max_depth': 5, 'min_samples_split': 2, 'min_samples_leaf': 2, 'subsample': 0.9553200007810365, 'max_features': None}. Best is trial 621 with value: 0.2256726988932517.
[I 2024-12-04 12:54:31,488] Trial 1131 finished with value: 0.5707521821126935 and parameters: {'n_estimators': 1299, 'learning_rate': 0.01385753782890607, 'max_depth': 12, 'min_samples_split': 2, 'min_samples_leaf': 10, 'subsample': 0.768073156499907, 'max_features': 'sqrt'}. Best is trial 621 with value: 0.2256726988932517.
[I 2024-12-04 12:54:33,240] Trial 1133 finished with value: 0.24211892368993204 and parameters: {'n_estimators': 1388, 'learning_rate': 0.06818549612353841, 'max_depth': 7, 'min_samples_split': 6, 'min_samples_leaf': 1, 'subsample': 0.8980221951798986, 'max_features': 'sqrt'}. Best is trial 621 with value: 0.2256726988932517.
[I 2024-12-04 12:54:33,249] Trial 1142 finished with value: 0.4921783436734577 and parameters: {'n_estimators': 1046, 'learning_rate': 0.021702189061447955, 'max_depth': 10, 'min_samples_split': 15, 'min_samples_leaf': 10, 'subsample': 0.9271800255958383, 'max_features': 'sqrt'}. Best is trial 621 with value: 0.2256726988932517.
[I 2024-12-04 12:54:35,876] Trial 1134 finished with value: 0.2477218775886039 and parameters: {'n_estimators': 1424, 'learning_rate': 0.07662388285091418, 'max_depth': 6, 'min_samples_split': 2, 'min_samples_leaf': 1, 'subsample': 0.8818175299554852, 'max_features': 'sqrt'}. Best is trial 621 with value: 0.2256726988932517.
[I 2024-12-04 12:54:35,948] Trial 1132 finished with value: 0.30930311563195 and parameters: {'n_estimators': 1477, 'learning_rate': 0.09177358707044064, 'max_depth': 9, 'min_samples_split': 5, 'min_samples_leaf': 2, 'subsample': 0.7983371327908605, 'max_features': 'sqrt'}. Best is trial 621 with value: 0.2256726988932517.
[I 2024-12-04 12:54:37,067] Trial 1129 finished with value: 0.3606941445584091 and parameters: {'n_estimators': 1397, 'learning_rate': 0.06752275909944536, 'max_depth': 9, 'min_samples_split': 2, 'min_samples_leaf': 1, 'subsample': 0.7724943276568388, 'max_features': None}. Best is trial 621 with value: 0.2256726988932517.
