[I 2024-12-04 20:33:53,325] Trial 1228 finished with value: 0.14249507725346924 and parameters: {'kernel_type': 'Matern', 'length_scale': 5.57716367482795, 'noise_level': 0.7802125972334323, 'constant_value': 74.15986699489984, 'nu': 1.5}. Best is trial 959 with value: 0.1375110730946576.
[I 2024-12-04 20:33:57,588] Trial 1230 finished with value: 0.9864686819218254 and parameters: {'kernel_type': 'Matern', 'length_scale': 1314.2231433463753, 'noise_level': 0.00014638907447163488, 'constant_value': 5.984587232396997, 'nu': 1.5}. Best is trial 959 with value: 0.1375110730946576.
[I 2024-12-04 20:33:59,222] Trial 1231 finished with value: 0.14249494899349516 and parameters: {'kernel_type': 'Matern', 'length_scale': 369.284723065105, 'noise_level': 0.015509625576310875, 'constant_value': 96615.45195947986, 'nu': 1.5}. Best is trial 959 with value: 0.1375110730946576.
[I 2024-12-04 20:34:01,613] Trial 1232 finished with value: 0.1424950621316851 and parameters: {'kernel_type': 'Matern', 'length_scale': 16.51358833752423, 'noise_level': 0.8552071475246211, 'constant_value': 167.95887952547596, 'nu': 1.5}. Best is trial 959 with value: 0.1375110730946576.
[I 2024-12-04 20:34:04,162] Trial 1234 finished with value: 0.98646868195055 and parameters: {'kernel_type': 'Matern', 'length_scale': 0.05588410954718722, 'noise_level': 0.0649275213017374, 'constant_value': 41.96349607389394, 'nu': 1.5}. Best is trial 959 with value: 0.1375110730946576.
[I 2024-12-04 20:34:07,187] Trial 1233 finished with value: 0.1424950805797802 and parameters: {'kernel_type': 'Matern', 'length_scale': 5.909626410446834, 'noise_level': 0.5507935773165734, 'constant_value': 0.10198603472807427, 'nu': 1.5}. Best is trial 959 with value: 0.1375110730946576.
[I 2024-12-04 20:34:09,473] Trial 1235 finished with value: 0.1424950528114904 and parameters: {'kernel_type': 'Matern', 'length_scale': 5.8838008818216085, 'noise_level': 0.0030088768432645786, 'constant_value': 9.463586232728973, 'nu': 1.5}. Best is trial 959 with value: 0.1375110730946576.
[I 2024-12-04 20:34:10,428] Trial 1236 finished with value: 0.1424950495557297 and parameters: {'kernel_type': 'Matern', 'length_scale': 31.714274508672048, 'noise_level': 0.06869155070631494, 'constant_value': 538.5153016689223, 'nu': 1.5}. Best is trial 959 with value: 0.1375110730946576.
[I 2024-12-04 20:34:13,736] Trial 1237 finished with value: 0.14249506168851936 and parameters: {'kernel_type': 'Matern', 'length_scale': 89.5880334261447, 'noise_level': 0.024979460426172186, 'constant_value': 0.40835640392458705, 'nu': 1.5}. Best is trial 959 with value: 0.1375110730946576.
[I 2024-12-04 20:34:16,598] Trial 1238 finished with value: 0.14249511398737572 and parameters: {'kernel_type': 'Matern', 'length_scale': 121.98305896678646, 'noise_level': 0.7995289012633074, 'constant_value': 2.666675185105614, 'nu': 1.5}. Best is trial 959 with value: 0.1375110730946576.
[I 2024-12-04 20:34:17,916] Trial 1239 finished with value: 0.14249510446527286 and parameters: {'kernel_type': 'Matern', 'length_scale': 0.4571156543379775, 'noise_level': 0.7682101124399128, 'constant_value': 2382.552322115129, 'nu': 1.5}. Best is trial 959 with value: 0.1375110730946576.
[I 2024-12-04 20:34:22,395] Trial 1241 finished with value: 0.14249502913291628 and parameters: {'kernel_type': 'Matern', 'length_scale': 1007.3386393443761, 'noise_level': 0.8440018375668231, 'constant_value': 297.9960894351881, 'nu': 1.5}. Best is trial 959 with value: 0.1375110730946576.
[I 2024-12-04 20:34:22,502] Trial 1240 finished with value: 0.14249497661999486 and parameters: {'kernel_type': 'Matern', 'length_scale': 2.230450881089695, 'noise_level': 0.03960880243264484, 'constant_value': 158.83777600462838, 'nu': 1.5}. Best is trial 959 with value: 0.1375110730946576.
[I 2024-12-04 20:34:24,739] Trial 1242 finished with value: 0.1424955120865721 and parameters: {'kernel_type': 'Matern', 'length_scale': 2.8291272173572155, 'noise_level': 0.012307576331103267, 'constant_value': 2.093264343992924, 'nu': 1.5}. Best is trial 959 with value: 0.1375110730946576.
[I 2024-12-04 20:34:30,036] Trial 1244 finished with value: 0.14249505849197217 and parameters: {'kernel_type': 'Matern', 'length_scale': 4.844350566635215, 'noise_level': 0.02796816446542921, 'constant_value': 5251.382377489646, 'nu': 1.5}. Best is trial 959 with value: 0.1375110730946576.
[I 2024-12-04 20:34:30,460] Trial 1243 finished with value: 0.14249505437032575 and parameters: {'kernel_type': 'Matern', 'length_scale': 26.855071030690816, 'noise_level': 0.7614993126296989, 'constant_value': 1333.0822856824407, 'nu': 1.5}. Best is trial 959 with value: 0.1375110730946576.
[I 2024-12-04 20:34:30,953] Trial 1245 finished with value: 0.14249519333308674 and parameters: {'kernel_type': 'Matern', 'length_scale': 47.44900268369848, 'noise_level': 0.03776976604474424, 'constant_value': 12020.739543053784, 'nu': 1.5}. Best is trial 959 with value: 0.1375110730946576.
[I 2024-12-04 20:34:36,352] Trial 1247 finished with value: 0.9864686819208123 and parameters: {'kernel_type': 'Matern', 'length_scale': 104.61142409642466, 'noise_level': 0.0035940968239617874, 'constant_value': 19.286332295273482, 'nu': 1.5}. Best is trial 959 with value: 0.1375110730946576.
[I 2024-12-04 20:34:36,682] Trial 1246 finished with value: 0.9864686819226935 and parameters: {'kernel_type': 'Matern', 'length_scale': 1575.1488575916258, 'noise_level': 0.0020069148518413044, 'constant_value': 353.18348622479, 'nu': 1.5}. Best is trial 959 with value: 0.1375110730946576.
[I 2024-12-04 20:34:43,631] Trial 1250 finished with value: 0.986468681905659 and parameters: {'kernel_type': 'Matern', 'length_scale': 0.00037934810174957345, 'noise_level': 0.25145668891698436, 'constant_value': 0.09768857820028083, 'nu': 0.5}. Best is trial 959 with value: 0.1375110730946576.
[I 2024-12-04 20:34:43,719] Trial 1249 finished with value: 0.1424950633675921 and parameters: {'kernel_type': 'Matern', 'length_scale': 8.197268684959285, 'noise_level': 0.9628123488274694, 'constant_value': 2.8741462495583145, 'nu': 1.5}. Best is trial 959 with value: 0.1375110730946576.
[I 2024-12-04 20:34:44,693] Trial 1248 finished with value: 0.19720003362305094 and parameters: {'kernel_type': 'Matern', 'length_scale': 0.685882248735959, 'noise_level': 0.3856081767651704, 'constant_value': 9.525850321499172e-05, 'nu': 0.5}. Best is trial 959 with value: 0.1375110730946576.
[I 2024-12-04 20:34:48,265] Trial 1251 finished with value: 0.9864686819308509 and parameters: {'kernel_type': 'Matern', 'length_scale': 0.002079453732389993, 'noise_level': 0.21430486306962765, 'constant_value': 669.5666591405738, 'nu': 1.5}. Best is trial 959 with value: 0.1375110730946576.
[I 2024-12-04 20:34:51,499] Trial 1253 finished with value: 0.14771037829574307 and parameters: {'kernel_type': 'RBF', 'length_scale': 0.7783751500368035, 'noise_level': 0.039724995527738324, 'constant_value': 18.190391283514717, 'nu': 1.5}. Best is trial 959 with value: 0.1375110730946576.
[I 2024-12-04 20:34:51,851] Trial 1252 finished with value: 0.14249505150433034 and parameters: {'kernel_type': 'Matern', 'length_scale': 1.745621384347316, 'noise_level': 0.002293975560081342, 'constant_value': 41.32058945523231, 'nu': 1.5}. Best is trial 959 with value: 0.1375110730946576.
[I 2024-12-04 20:34:55,074] Trial 1254 finished with value: 0.14249506244650065 and parameters: {'kernel_type': 'Matern', 'length_scale': 5.212426905371302, 'noise_level': 0.08554009766219264, 'constant_value': 5365.514014791334, 'nu': 1.5}. Best is trial 959 with value: 0.1375110730946576.
[I 2024-12-04 20:34:57,279] Trial 1256 finished with value: 0.9864686819076626 and parameters: {'kernel_type': 'Matern', 'length_scale': 0.040391607327391166, 'noise_level': 0.04646382265323877, 'constant_value': 2.1126841879207063, 'nu': 1.5}. Best is trial 959 with value: 0.1375110730946576.
[I 2024-12-04 20:35:00,591] Trial 1255 finished with value: 0.14249503586815088 and parameters: {'kernel_type': 'Matern', 'length_scale': 2.7120435640809966, 'noise_level': 0.9770902704230432, 'constant_value': 123.0187044229855, 'nu': 1.5}. Best is trial 959 with value: 0.1375110730946576.
[I 2024-12-04 20:35:03,405] Trial 1257 finished with value: 0.14249507337312659 and parameters: {'kernel_type': 'Matern', 'length_scale': 74.83120396890294, 'noise_level': 0.04057322992072481, 'constant_value': 3.6158776692439125, 'nu': 1.5}. Best is trial 959 with value: 0.1375110730946576.
[I 2024-12-04 20:35:07,588] Trial 1258 finished with value: 0.1424951247190685 and parameters: {'kernel_type': 'Matern', 'length_scale': 3.082570948026977, 'noise_level': 0.15271479732480336, 'constant_value': 0.007110765322060323, 'nu': 1.5}. Best is trial 959 with value: 0.1375110730946576.
[I 2024-12-04 20:35:10,191] Trial 1260 finished with value: 0.9864686823650262 and parameters: {'kernel_type': 'Matern', 'length_scale': 2073.975631909426, 'noise_level': 0.00403933352715182, 'constant_value': 2676.4902288155345, 'nu': 1.5}. Best is trial 959 with value: 0.1375110730946576.
[I 2024-12-04 20:35:12,253] Trial 1259 finished with value: 0.14249505826817718 and parameters: {'kernel_type': 'Matern', 'length_scale': 0.12311790247092143, 'noise_level': 0.0181930216697324, 'constant_value': 14234.743811819515, 'nu': 1.5}. Best is trial 959 with value: 0.1375110730946576.
[I 2024-12-04 20:35:17,018] Trial 1261 finished with value: 0.14249475416484894 and parameters: {'kernel_type': 'Matern', 'length_scale': 9.014728320509995, 'noise_level': 0.7597937576948927, 'constant_value': 3117.2824671089284, 'nu': 1.5}. Best is trial 959 with value: 0.1375110730946576.
[I 2024-12-04 20:35:21,907] Trial 1263 finished with value: 0.14249505909858873 and parameters: {'kernel_type': 'Matern', 'length_scale': 0.29439276889007115, 'noise_level': 0.7183071225169861, 'constant_value': 3086.9082323655452, 'nu': 1.5}. Best is trial 959 with value: 0.1375110730946576.
[I 2024-12-04 20:35:21,977] Trial 1262 finished with value: 0.9923687887938811 and parameters: {'kernel_type': 'Matern', 'length_scale': 27109.959758099518, 'noise_level': 8.844460607148465e-06, 'constant_value': 2.8631014481496557e-07, 'nu': 1.5}. Best is trial 959 with value: 0.1375110730946576.
[I 2024-12-04 20:35:26,141] Trial 1265 finished with value: 0.9982171094940401 and parameters: {'kernel_type': 'Matern', 'length_scale': 2.3593447664978324, 'noise_level': 0.0023712481678726085, 'constant_value': 300.0791489053879, 'nu': 1.5}. Best is trial 959 with value: 0.1375110730946576.
[I 2024-12-04 20:35:26,713] Trial 1264 finished with value: 0.1376793406616218 and parameters: {'kernel_type': 'Matern', 'length_scale': 18.356557556150857, 'noise_level': 0.040649756139970974, 'constant_value': 31.526079748015444, 'nu': 1.5}. Best is trial 959 with value: 0.1375110730946576.
[I 2024-12-04 20:35:30,200] Trial 1266 finished with value: 0.9864686819212989 and parameters: {'kernel_type': 'Matern', 'length_scale': 0.04429774683909501, 'noise_level': 0.940406413775378, 'constant_value': 0.5812441629379373, 'nu': 1.5}. Best is trial 959 with value: 0.1375110730946576.
[I 2024-12-04 20:35:35,275] Trial 1267 finished with value: 0.14249506471856316 and parameters: {'kernel_type': 'Matern', 'length_scale': 25.0064594076681, 'noise_level': 0.005252836574248822, 'constant_value': 5.95242514335263, 'nu': 1.5}. Best is trial 959 with value: 0.1375110730946576.
[I 2024-12-04 20:35:35,622] Trial 1268 finished with value: 0.14249503787498125 and parameters: {'kernel_type': 'Matern', 'length_scale': 208.32393259520933, 'noise_level': 0.042664742296883905, 'constant_value': 0.793929121603887, 'nu': 1.5}. Best is trial 959 with value: 0.1375110730946576.
[I 2024-12-04 20:35:39,041] Trial 1269 finished with value: 0.9864686819215267 and parameters: {'kernel_type': 'Matern', 'length_scale': 2469.7560212621643, 'noise_level': 0.024719886567254448, 'constant_value': 4.426051931066651, 'nu': 1.5}. Best is trial 959 with value: 0.1375110730946576.
[I 2024-12-04 20:35:41,976] Trial 1270 finished with value: 0.14771033784366897 and parameters: {'kernel_type': 'RBF', 'length_scale': 0.4578806150993609, 'noise_level': 0.3845769195365528, 'constant_value': 0.11608753747063962, 'nu': 0.5}. Best is trial 959 with value: 0.1375110730946576.
[I 2024-12-04 20:35:42,173] Trial 1271 finished with value: 0.14249505909783586 and parameters: {'kernel_type': 'Matern', 'length_scale': 1.7776591579118382, 'noise_level': 0.0253726472247289, 'constant_value': 3.280951231269547, 'nu': 1.5}. Best is trial 959 with value: 0.1375110730946576.
[I 2024-12-04 20:35:46,048] Trial 1272 finished with value: 0.9864686819226113 and parameters: {'kernel_type': 'Matern', 'length_scale': 84.96413796538947, 'noise_level': 0.00031070147463784187, 'constant_value': 28.108323370850915, 'nu': 1.5}. Best is trial 959 with value: 0.1375110730946576.
[I 2024-12-04 20:35:48,783] Trial 1274 finished with value: 0.986468681914772 and parameters: {'kernel_type': 'RBF', 'length_scale': 5.676779076037911, 'noise_level': 1.1508612745543714e-06, 'constant_value': 0.0012244056101015182, 'nu': 1.5}. Best is trial 959 with value: 0.1375110730946576.
[I 2024-12-04 20:35:48,788] Trial 1273 finished with value: 0.9864686819235253 and parameters: {'kernel_type': 'Matern', 'length_scale': 194.63200450159331, 'noise_level': 0.0002717875772916207, 'constant_value': 53.150203217799955, 'nu': 2.5}. Best is trial 959 with value: 0.1375110730946576.
[I 2024-12-04 20:35:56,860] Trial 1276 finished with value: 0.14249493850758713 and parameters: {'kernel_type': 'Matern', 'length_scale': 2.9787839012002792, 'noise_level': 0.018205159396740705, 'constant_value': 2.6808762378227233, 'nu': 1.5}. Best is trial 959 with value: 0.1375110730946576.
[I 2024-12-04 20:35:57,242] Trial 1277 finished with value: 0.14249508660326082 and parameters: {'kernel_type': 'Matern', 'length_scale': 22.550665221122497, 'noise_level': 0.04798571681844422, 'constant_value': 7.705717139011455, 'nu': 1.5}. Best is trial 959 with value: 0.1375110730946576.
[I 2024-12-04 20:35:57,792] Trial 1275 finished with value: 0.14249512374215154 and parameters: {'kernel_type': 'Matern', 'length_scale': 0.21091138546030364, 'noise_level': 0.0007593625383679404, 'constant_value': 2.9534443471616516, 'nu': 1.5}. Best is trial 959 with value: 0.1375110730946576.
[I 2024-12-04 20:36:04,067] Trial 1279 finished with value: 0.9864686818462988 and parameters: {'kernel_type': 'Matern', 'length_scale': 0.06718316919979427, 'noise_level': 4.262633486519928e-07, 'constant_value': 0.021304328579121706, 'nu': 1.5}. Best is trial 959 with value: 0.1375110730946576.
[I 2024-12-04 20:36:06,270] Trial 1280 finished with value: 0.9864686819221076 and parameters: {'kernel_type': 'Matern', 'length_scale': 0.053000037291998446, 'noise_level': 0.4578206882333069, 'constant_value': 0.2886799263412234, 'nu': 2.5}. Best is trial 959 with value: 0.1375110730946576.
[I 2024-12-04 20:36:06,804] Trial 1278 finished with value: 0.1424950528191997 and parameters: {'kernel_type': 'Matern', 'length_scale': 53.35881943712026, 'noise_level': 0.0036153260428481156, 'constant_value': 31.981674589442523, 'nu': 1.5}. Best is trial 959 with value: 0.1375110730946576.
[I 2024-12-04 20:36:11,420] Trial 1283 finished with value: 0.9982167173849106 and parameters: {'kernel_type': 'Matern', 'length_scale': 0.23061877747353635, 'noise_level': 7.821211116715644e-07, 'constant_value': 960.4738035373815, 'nu': 2.5}. Best is trial 959 with value: 0.1375110730946576.
[I 2024-12-04 20:36:11,946] Trial 1282 finished with value: 0.14249531136376783 and parameters: {'kernel_type': 'Matern', 'length_scale': 256.55943647764144, 'noise_level': 0.03553646271427293, 'constant_value': 37.66680089792879, 'nu': 1.5}. Best is trial 959 with value: 0.1375110730946576.
[I 2024-12-04 20:36:13,858] Trial 1281 finished with value: 0.1424950812361686 and parameters: {'kernel_type': 'Matern', 'length_scale': 0.9493518592053538, 'noise_level': 0.031247882381306005, 'constant_value': 6.553362823272033, 'nu': 1.5}. Best is trial 959 with value: 0.1375110730946576.
[I 2024-12-04 20:36:17,641] Trial 1285 finished with value: 0.1972000390044955 and parameters: {'kernel_type': 'Matern', 'length_scale': 117.65845565536559, 'noise_level': 0.05378140433708199, 'constant_value': 1.3021301981287083, 'nu': 0.5}. Best is trial 959 with value: 0.1375110730946576.
[I 2024-12-04 20:36:19,371] Trial 1284 finished with value: 0.14249532480935673 and parameters: {'kernel_type': 'Matern', 'length_scale': 1.547861921908749, 'noise_level': 0.03892184705709544, 'constant_value': 0.07344363060936121, 'nu': 1.5}. Best is trial 959 with value: 0.1375110730946576.
[I 2024-12-04 20:36:21,730] Trial 1286 finished with value: 0.1424950620271699 and parameters: {'kernel_type': 'Matern', 'length_scale': 56.770108661376426, 'noise_level': 0.0007683183636079747, 'constant_value': 195.13613173935394, 'nu': 1.5}. Best is trial 959 with value: 0.1375110730946576.
[I 2024-12-04 20:36:26,909] Trial 1288 finished with value: 0.14249506199497275 and parameters: {'kernel_type': 'Matern', 'length_scale': 5.136000627992336, 'noise_level': 0.0398410924496972, 'constant_value': 13.71095601451448, 'nu': 1.5}. Best is trial 959 with value: 0.1375110730946576.
[I 2024-12-04 20:36:27,328] Trial 1287 finished with value: 0.19720001074910548 and parameters: {'kernel_type': 'Matern', 'length_scale': 0.6114627722814444, 'noise_level': 4.6541602488708814e-08, 'constant_value': 2.5196732526222693e-07, 'nu': 0.5}. Best is trial 959 with value: 0.1375110730946576.
[I 2024-12-04 20:36:30,252] Trial 1289 finished with value: 0.14249508870752028 and parameters: {'kernel_type': 'Matern', 'length_scale': 170.8540256939084, 'noise_level': 0.14092679511309125, 'constant_value': 2.8006095175342183, 'nu': 1.5}. Best is trial 959 with value: 0.1375110730946576.
[I 2024-12-04 20:36:32,391] Trial 1291 finished with value: 0.9982167338038285 and parameters: {'kernel_type': 'RBF', 'length_scale': 0.0013336859776072105, 'noise_level': 7.971683851763806e-07, 'constant_value': 2175.7935740147136, 'nu': 2.5}. Best is trial 959 with value: 0.1375110730946576.
[I 2024-12-04 20:36:32,685] Trial 1290 finished with value: 0.986468681923573 and parameters: {'kernel_type': 'Matern', 'length_scale': 5.665996845898545, 'noise_level': 0.0018483995142837596, 'constant_value': 0.07620095072625185, 'nu': 1.5}. Best is trial 959 with value: 0.1375110730946576.
[I 2024-12-04 20:36:38,718] Trial 1293 finished with value: 0.1446988225016349 and parameters: {'kernel_type': 'Matern', 'length_scale': 2.1312517613010984, 'noise_level': 0.06471231461748891, 'constant_value': 6297.60495289679, 'nu': 2.5}. Best is trial 959 with value: 0.1375110730946576.
[I 2024-12-04 20:36:40,136] Trial 1294 finished with value: 0.986468681925708 and parameters: {'kernel_type': 'Matern', 'length_scale': 111.36986673524042, 'noise_level': 0.00280160113215246, 'constant_value': 41.04031870936945, 'nu': 1.5}. Best is trial 959 with value: 0.1375110730946576.
[I 2024-12-04 20:36:42,432] Trial 1292 finished with value: 0.14249470933696035 and parameters: {'kernel_type': 'Matern', 'length_scale': 0.2134204780568296, 'noise_level': 0.008131921166032846, 'constant_value': 39.84429381449447, 'nu': 1.5}. Best is trial 959 with value: 0.1375110730946576.
[I 2024-12-04 20:36:45,973] Trial 1296 finished with value: 0.142495063357256 and parameters: {'kernel_type': 'Matern', 'length_scale': 335.5903890954717, 'noise_level': 0.029122879023377363, 'constant_value': 260.10192668575803, 'nu': 1.5}. Best is trial 959 with value: 0.1375110730946576.
[I 2024-12-04 20:36:47,174] Trial 1295 finished with value: 0.9864686819229717 and parameters: {'kernel_type': 'RBF', 'length_scale': 75.82357109750762, 'noise_level': 0.0040696080337104465, 'constant_value': 0.11243279147479013, 'nu': 1.5}. Best is trial 959 with value: 0.1375110730946576.
[I 2024-12-04 20:36:49,940] Trial 1297 finished with value: 0.14249504799218685 and parameters: {'kernel_type': 'Matern', 'length_scale': 1.813079424852038, 'noise_level': 0.6150509053158953, 'constant_value': 0.07144017148657707, 'nu': 1.5}. Best is trial 959 with value: 0.1375110730946576.
[I 2024-12-04 20:36:55,397] Trial 1298 finished with value: 0.14249509536959237 and parameters: {'kernel_type': 'Matern', 'length_scale': 26.926674284582656, 'noise_level': 0.14258921545374065, 'constant_value': 11.167658047420739, 'nu': 1.5}. Best is trial 959 with value: 0.1375110730946576.
[I 2024-12-04 20:36:59,237] Trial 1300 finished with value: 0.1424950701671083 and parameters: {'kernel_type': 'Matern', 'length_scale': 10.825373452939717, 'noise_level': 0.01566919923710621, 'constant_value': 27.641968516942942, 'nu': 1.5}. Best is trial 959 with value: 0.1375110730946576.
[I 2024-12-04 20:37:01,201] Trial 1299 finished with value: 0.14249506393744898 and parameters: {'kernel_type': 'Matern', 'length_scale': 7.827013738457051, 'noise_level': 0.0004067779457210312, 'constant_value': 0.35521352548309476, 'nu': 1.5}. Best is trial 959 with value: 0.1375110730946576.
[I 2024-12-04 20:37:06,393] Trial 1302 finished with value: 0.9864686819023825 and parameters: {'kernel_type': 'Matern', 'length_scale': 0.03198703368404723, 'noise_level': 0.0054856841687665955, 'constant_value': 0.018529722098188237, 'nu': 1.5}. Best is trial 959 with value: 0.1375110730946576.
[I 2024-12-04 20:37:06,969] Trial 1301 finished with value: 0.9864686819220444 and parameters: {'kernel_type': 'Matern', 'length_scale': 43725.18365737665, 'noise_level': 0.01386731700407937, 'constant_value': 8.058934753109012, 'nu': 1.5}. Best is trial 959 with value: 0.1375110730946576.
