[I 2024-12-03 18:50:38,298] Trial 1219 finished with value: 407.9684309789717 and parameters: {'kernel': 'sigmoid', 'C': 20.252304562435285, 'gamma': 0.11426579922323574, 'epsilon': 0.27372484160654215}. Best is trial 88 with value: 0.3542875001421725.
[I 2024-12-03 18:50:38,557] Trial 900 finished with value: 4.50870532328742 and parameters: {'kernel': 'poly', 'C': 20.809762683392933, 'gamma': 0.10512312218916287, 'epsilon': 0.24839878255437509}. Best is trial 88 with value: 0.3542875001421725.
[I 2024-12-03 18:50:38,964] Trial 1222 finished with value: 0.4120684956659688 and parameters: {'kernel': 'rbf', 'C': 16.594387075271513, 'gamma': 0.029974843232136724, 'epsilon': 0.35165891704049324}. Best is trial 88 with value: 0.3542875001421725.
[I 2024-12-03 18:50:39,072] Trial 1221 finished with value: 0.37033594869605196 and parameters: {'kernel': 'rbf', 'C': 98.81096186221164, 'gamma': 0.06189996435051919, 'epsilon': 0.08977747059302259}. Best is trial 88 with value: 0.3542875001421725.
[I 2024-12-03 18:50:40,545] Trial 1177 finished with value: 1.1066788919144317 and parameters: {'kernel': 'poly', 'C': 65.37584647315471, 'gamma': 0.036660262723703485, 'epsilon': 0.2174286330019542}. Best is trial 88 with value: 0.3542875001421725.
[I 2024-12-03 18:50:40,545] Trial 1223 finished with value: 0.3695002846176113 and parameters: {'kernel': 'rbf', 'C': 99.11660585591858, 'gamma': 0.02066713341940376, 'epsilon': 0.12319523099329224}. Best is trial 88 with value: 0.3542875001421725.
[I 2024-12-03 18:50:40,743] Trial 1225 finished with value: 0.37556292447239326 and parameters: {'kernel': 'rbf', 'C': 98.41666388155518, 'gamma': 0.024218179202778748, 'epsilon': 0.4073252103605769}. Best is trial 88 with value: 0.3542875001421725.
[I 2024-12-03 18:50:41,573] Trial 1226 finished with value: 0.3730484469751046 and parameters: {'kernel': 'rbf', 'C': 95.38791855465566, 'gamma': 0.014175391685795194, 'epsilon': 0.36243455662412455}. Best is trial 88 with value: 0.3542875001421725.
[I 2024-12-03 18:50:41,681] Trial 1224 finished with value: 0.39340927367159956 and parameters: {'kernel': 'rbf', 'C': 94.11054027341626, 'gamma': 0.01555467056460367, 'epsilon': 0.055040959813713826}. Best is trial 88 with value: 0.3542875001421725.
[I 2024-12-03 18:50:42,818] Trial 1227 finished with value: 0.6323951899609639 and parameters: {'kernel': 'rbf', 'C': 15.375914195794657, 'gamma': 0.32333320563917944, 'epsilon': 0.2651081739476917}. Best is trial 88 with value: 0.3542875001421725.
[I 2024-12-03 18:50:43,764] Trial 1228 finished with value: 0.362754886744884 and parameters: {'kernel': 'rbf', 'C': 85.12574891092599, 'gamma': 0.059498048793083264, 'epsilon': 0.11255392989642479}. Best is trial 88 with value: 0.3542875001421725.
[I 2024-12-03 18:50:43,993] Trial 1229 finished with value: 0.3550571444081223 and parameters: {'kernel': 'rbf', 'C': 96.20647426507381, 'gamma': 0.04268252019968973, 'epsilon': 0.1615235369965996}. Best is trial 88 with value: 0.3542875001421725.
[I 2024-12-03 18:50:44,775] Trial 1231 finished with value: 1157.9344320565674 and parameters: {'kernel': 'sigmoid', 'C': 82.84097677695782, 'gamma': 0.013637782398553386, 'epsilon': 0.23256949571837468}. Best is trial 88 with value: 0.3542875001421725.
[I 2024-12-03 18:50:45,779] Trial 1232 finished with value: 0.48497441810662806 and parameters: {'kernel': 'rbf', 'C': 29.85308861905867, 'gamma': 0.18017354003152358, 'epsilon': 0.06880574450698533}. Best is trial 88 with value: 0.3542875001421725.
[I 2024-12-03 18:50:46,057] Trial 1233 finished with value: 0.45657115862592584 and parameters: {'kernel': 'rbf', 'C': 3.085164987645629, 'gamma': 0.01489010118239357, 'epsilon': 0.07808580502142154}. Best is trial 88 with value: 0.3542875001421725.
[I 2024-12-03 18:50:47,120] Trial 1234 finished with value: 0.4263412652124004 and parameters: {'kernel': 'rbf', 'C': 13.569109606972724, 'gamma': 0.05740736832927933, 'epsilon': 0.05168226241241747}. Best is trial 88 with value: 0.3542875001421725.
[I 2024-12-03 18:50:47,122] Trial 1235 finished with value: 0.41935650386238266 and parameters: {'kernel': 'rbf', 'C': 21.0994102755467, 'gamma': 0.028698247262892138, 'epsilon': 0.07815586462797645}. Best is trial 88 with value: 0.3542875001421725.
[I 2024-12-03 18:50:47,871] Trial 1236 finished with value: 0.393964859139304 and parameters: {'kernel': 'rbf', 'C': 21.82605135374009, 'gamma': 0.04692962137179554, 'epsilon': 0.13235501475184674}. Best is trial 88 with value: 0.3542875001421725.
[I 2024-12-03 18:50:48,004] Trial 1237 finished with value: 0.40323021772815193 and parameters: {'kernel': 'rbf', 'C': 19.440838515305543, 'gamma': 0.049412094491854505, 'epsilon': 0.09371709983543744}. Best is trial 88 with value: 0.3542875001421725.
[I 2024-12-03 18:50:49,008] Trial 1238 finished with value: 0.5440573167452478 and parameters: {'kernel': 'rbf', 'C': 4.6135126804572915, 'gamma': 0.2257237803451326, 'epsilon': 0.08884610936996312}. Best is trial 88 with value: 0.3542875001421725.
[I 2024-12-03 18:50:49,100] Trial 1239 finished with value: 0.4989075590259577 and parameters: {'kernel': 'rbf', 'C': 90.03512767196548, 'gamma': 0.18064222992970058, 'epsilon': 0.13716536671829346}. Best is trial 88 with value: 0.3542875001421725.
[I 2024-12-03 18:50:50,116] Trial 1240 finished with value: 1.8827372588248292 and parameters: {'kernel': 'poly', 'C': 0.02207107902203112, 'gamma': 0.03751520894572754, 'epsilon': 0.01674219652232232}. Best is trial 88 with value: 0.3542875001421725.
[I 2024-12-03 18:50:50,492] Trial 1241 finished with value: 1411.5802175989008 and parameters: {'kernel': 'sigmoid', 'C': 76.74759323624711, 'gamma': 0.18781433176691328, 'epsilon': 0.18627441630644154}. Best is trial 88 with value: 0.3542875001421725.
[I 2024-12-03 18:50:51,361] Trial 1243 finished with value: 0.4954598707589656 and parameters: {'kernel': 'rbf', 'C': 35.76716096379837, 'gamma': 0.000609489272874406, 'epsilon': 0.08378424658242112}. Best is trial 88 with value: 0.3542875001421725.
[I 2024-12-03 18:50:52,458] Trial 1244 finished with value: 1600.3611056734994 and parameters: {'kernel': 'sigmoid', 'C': 91.17728820703499, 'gamma': 0.022093571185217074, 'epsilon': 0.06374021895528738}. Best is trial 88 with value: 0.3542875001421725.
[I 2024-12-03 18:50:53,052] Trial 1245 finished with value: 0.3747495894727862 and parameters: {'kernel': 'rbf', 'C': 97.34169991223361, 'gamma': 0.05713796752855749, 'epsilon': 0.05961532808065018}. Best is trial 88 with value: 0.3542875001421725.
[I 2024-12-03 18:50:53,269] Trial 1242 finished with value: 0.371529897814329 and parameters: {'kernel': 'rbf', 'C': 99.2301745106748, 'gamma': 0.03257049957142861, 'epsilon': 0.022085939588264308}. Best is trial 88 with value: 0.3542875001421725.
[I 2024-12-03 18:50:53,597] Trial 1246 finished with value: 0.6822292914464577 and parameters: {'kernel': 'rbf', 'C': 77.41927061767986, 'gamma': 0.5399396547901746, 'epsilon': 0.005033267830634585}. Best is trial 88 with value: 0.3542875001421725.
[I 2024-12-03 18:50:55,153] Trial 1248 finished with value: 0.5297657425813048 and parameters: {'kernel': 'rbf', 'C': 91.10788642496605, 'gamma': 0.22999586788885779, 'epsilon': 0.0490088090182659}. Best is trial 88 with value: 0.3542875001421725.
[I 2024-12-03 18:50:56,080] Trial 1249 finished with value: 0.3652493164528911 and parameters: {'kernel': 'rbf', 'C': 85.17048677683574, 'gamma': 0.029119824796070063, 'epsilon': 0.10137126052936961}. Best is trial 88 with value: 0.3542875001421725.
[I 2024-12-03 18:50:56,117] Trial 1250 finished with value: 0.41323722405718744 and parameters: {'kernel': 'rbf', 'C': 87.46029533482053, 'gamma': 0.10110878244610165, 'epsilon': 0.18407876727059838}. Best is trial 88 with value: 0.3542875001421725.
[I 2024-12-03 18:50:57,759] Trial 1252 finished with value: 0.5046504251018361 and parameters: {'kernel': 'rbf', 'C': 15.29156969578383, 'gamma': 0.1706734673934986, 'epsilon': 0.16923666276353558}. Best is trial 88 with value: 0.3542875001421725.
[I 2024-12-03 18:50:58,561] Trial 1251 finished with value: 0.4037332696976335 and parameters: {'kernel': 'rbf', 'C': 32.10388458061042, 'gamma': 0.025698221255537584, 'epsilon': 0.11525975609361191}. Best is trial 88 with value: 0.3542875001421725.
[I 2024-12-03 18:50:58,563] Trial 1253 finished with value: 0.3986342700385368 and parameters: {'kernel': 'rbf', 'C': 90.60188872749414, 'gamma': 0.1031707388957414, 'epsilon': 0.08296174420100157}. Best is trial 88 with value: 0.3542875001421725.
[I 2024-12-03 18:50:59,854] Trial 1254 finished with value: 0.3680454799017854 and parameters: {'kernel': 'rbf', 'C': 93.11717570505161, 'gamma': 0.032994208031178515, 'epsilon': 0.068883012351615}. Best is trial 88 with value: 0.3542875001421725.
[I 2024-12-03 18:51:00,401] Trial 1256 finished with value: 0.43480798096449647 and parameters: {'kernel': 'rbf', 'C': 17.32407822289772, 'gamma': 0.011645491999034072, 'epsilon': 0.19220023866346897}. Best is trial 88 with value: 0.3542875001421725.
[I 2024-12-03 18:51:00,402] Trial 1255 finished with value: 0.42277893667558286 and parameters: {'kernel': 'rbf', 'C': 19.83691776486101, 'gamma': 0.0060473525680684774, 'epsilon': 0.20223256194443534}. Best is trial 88 with value: 0.3542875001421725.
[I 2024-12-03 18:51:01,315] Trial 1257 finished with value: 0.4115818335082766 and parameters: {'kernel': 'rbf', 'C': 16.00530688096773, 'gamma': 0.03126867804195771, 'epsilon': 0.22632877515121932}. Best is trial 88 with value: 0.3542875001421725.
[I 2024-12-03 18:51:02,389] Trial 1258 finished with value: 0.390156042759166 and parameters: {'kernel': 'rbf', 'C': 26.880598753230988, 'gamma': 0.05562642592127155, 'epsilon': 0.21075425981609067}. Best is trial 88 with value: 0.3542875001421725.
[I 2024-12-03 18:51:02,395] Trial 1259 finished with value: 0.3875367002665202 and parameters: {'kernel': 'rbf', 'C': 29.40746443989224, 'gamma': 0.06322215965503375, 'epsilon': 0.2067179721053618}. Best is trial 88 with value: 0.3542875001421725.
[I 2024-12-03 18:51:03,436] Trial 1260 finished with value: 0.4223704289338572 and parameters: {'kernel': 'rbf', 'C': 21.921782050375494, 'gamma': 0.0035435612357013722, 'epsilon': 0.08520995039906616}. Best is trial 88 with value: 0.3542875001421725.
[I 2024-12-03 18:51:04,055] Trial 1261 finished with value: 0.5908730346594977 and parameters: {'kernel': 'rbf', 'C': 13.458978802353373, 'gamma': 0.09593982448031835, 'epsilon': 0.6272962635146635}. Best is trial 88 with value: 0.3542875001421725.
[I 2024-12-03 18:51:04,449] Trial 1262 finished with value: 0.39773908938916774 and parameters: {'kernel': 'rbf', 'C': 91.31830687741626, 'gamma': 0.012114720848150257, 'epsilon': 0.15417171222181875}. Best is trial 88 with value: 0.3542875001421725.
[I 2024-12-03 18:51:04,958] Trial 1263 finished with value: 0.46015065496307805 and parameters: {'kernel': 'rbf', 'C': 97.59140254606179, 'gamma': 0.08271794389378963, 'epsilon': 0.40499522766271534}. Best is trial 88 with value: 0.3542875001421725.
[I 2024-12-03 18:51:06,783] Trial 1265 finished with value: 0.3683437444091207 and parameters: {'kernel': 'rbf', 'C': 85.31510307245128, 'gamma': 0.023315191776285073, 'epsilon': 0.10461732730780537}. Best is trial 88 with value: 0.3542875001421725.
[I 2024-12-03 18:51:06,933] Trial 1266 finished with value: 0.38772719842320863 and parameters: {'kernel': 'rbf', 'C': 99.61898742496373, 'gamma': 0.08697542272322917, 'epsilon': 0.10576436358975275}. Best is trial 88 with value: 0.3542875001421725.
[I 2024-12-03 18:51:07,719] Trial 1247 finished with value: 0.7927366274639128 and parameters: {'kernel': 'linear', 'C': 10.316055933304963, 'gamma': 0.000542613718831196, 'epsilon': 0.01982695039110757}. Best is trial 88 with value: 0.3542875001421725.
[I 2024-12-03 18:51:08,914] Trial 1267 finished with value: 0.4243864236555071 and parameters: {'kernel': 'rbf', 'C': 89.1879625595344, 'gamma': 0.00823981725112017, 'epsilon': 0.0920446769129079}. Best is trial 88 with value: 0.3542875001421725.
[I 2024-12-03 18:51:11,255] Trial 1270 finished with value: 0.3953987245576348 and parameters: {'kernel': 'rbf', 'C': 26.57954714923542, 'gamma': 0.08305089021673977, 'epsilon': 0.02153234524908886}. Best is trial 88 with value: 0.3542875001421725.
[I 2024-12-03 18:51:12,526] Trial 1159 finished with value: 0.7557528703375468 and parameters: {'kernel': 'linear', 'C': 93.93223254287444, 'gamma': 0.01008779628464692, 'epsilon': 0.20124420676181773}. Best is trial 88 with value: 0.3542875001421725.
[I 2024-12-03 18:51:13,800] Trial 1271 finished with value: 0.42782846215610554 and parameters: {'kernel': 'rbf', 'C': 13.3927482864827, 'gamma': 0.043027106292147, 'epsilon': 0.09441196603102628}. Best is trial 88 with value: 0.3542875001421725.
[I 2024-12-03 18:51:15,026] Trial 1272 finished with value: 0.4277223685473075 and parameters: {'kernel': 'rbf', 'C': 16.200951088444175, 'gamma': 0.027091737077942334, 'epsilon': 0.06316546750067016}. Best is trial 88 with value: 0.3542875001421725.
[I 2024-12-03 18:51:15,608] Trial 1273 finished with value: 0.6055664479006762 and parameters: {'kernel': 'rbf', 'C': 25.32937396405277, 'gamma': 0.32576346283195906, 'epsilon': 0.13195729821817406}. Best is trial 88 with value: 0.3542875001421725.
[I 2024-12-03 18:51:16,648] Trial 1274 finished with value: 0.40069604314530477 and parameters: {'kernel': 'rbf', 'C': 24.146459700550093, 'gamma': 0.027401804892422027, 'epsilon': 0.1824879486785282}. Best is trial 88 with value: 0.3542875001421725.
[I 2024-12-03 18:51:17,712] Trial 1275 finished with value: 0.36623659581236 and parameters: {'kernel': 'rbf', 'C': 82.58251760282545, 'gamma': 0.024462916209521082, 'epsilon': 0.12164564805965503}. Best is trial 88 with value: 0.3542875001421725.
[I 2024-12-03 18:51:18,656] Trial 1276 finished with value: 0.4175461487486109 and parameters: {'kernel': 'rbf', 'C': 20.996010743735802, 'gamma': 0.10879737775297015, 'epsilon': 0.0902736922857168}. Best is trial 88 with value: 0.3542875001421725.
[I 2024-12-03 18:51:19,514] Trial 1277 finished with value: 0.39152770641098167 and parameters: {'kernel': 'rbf', 'C': 88.98521139733246, 'gamma': 0.0917176695814949, 'epsilon': 0.13687202296263057}. Best is trial 88 with value: 0.3542875001421725.
[I 2024-12-03 18:51:20,597] Trial 1278 finished with value: 0.4827767274800093 and parameters: {'kernel': 'rbf', 'C': 94.52145909436703, 'gamma': 0.18291087611110418, 'epsilon': 0.026694110823876436}. Best is trial 88 with value: 0.3542875001421725.
[I 2024-12-03 18:51:21,178] Trial 1279 finished with value: 0.4412170065516729 and parameters: {'kernel': 'rbf', 'C': 98.52209976932663, 'gamma': 0.12085825904880707, 'epsilon': 0.18499143415185543}. Best is trial 88 with value: 0.3542875001421725.
[I 2024-12-03 18:51:22,081] Trial 1280 finished with value: 0.36073202519646697 and parameters: {'kernel': 'rbf', 'C': 94.60352547779611, 'gamma': 0.0335523122018481, 'epsilon': 0.22979827272604847}. Best is trial 88 with value: 0.3542875001421725.
[I 2024-12-03 18:51:22,478] Trial 1281 finished with value: 0.6142265646586167 and parameters: {'kernel': 'rbf', 'C': 18.335577085679613, 'gamma': 0.23585959036684775, 'epsilon': 0.38738495075590684}. Best is trial 88 with value: 0.3542875001421725.
[I 2024-12-03 18:51:23,951] Trial 1282 finished with value: 0.4020245340259069 and parameters: {'kernel': 'rbf', 'C': 20.329942855698253, 'gamma': 0.0746092879279909, 'epsilon': 0.033872932244993624}. Best is trial 88 with value: 0.3542875001421725.
[I 2024-12-03 18:51:24,122] Trial 1283 finished with value: 0.47975614196005745 and parameters: {'kernel': 'rbf', 'C': 95.77368285588085, 'gamma': 0.17300195008495048, 'epsilon': 0.08527300605868116}. Best is trial 88 with value: 0.3542875001421725.
[I 2024-12-03 18:51:25,628] Trial 1285 finished with value: 0.4003173085220552 and parameters: {'kernel': 'rbf', 'C': 18.58791904163599, 'gamma': 0.05241048164120162, 'epsilon': 0.2125306577057816}. Best is trial 88 with value: 0.3542875001421725.
[I 2024-12-03 18:51:26,163] Trial 1284 finished with value: 0.364080389881744 and parameters: {'kernel': 'rbf', 'C': 93.56792482634506, 'gamma': 0.03787561933487338, 'epsilon': 0.06602395718648883}. Best is trial 88 with value: 0.3542875001421725.
[I 2024-12-03 18:51:28,346] Trial 1287 finished with value: 0.3617524841291779 and parameters: {'kernel': 'rbf', 'C': 88.53927506184566, 'gamma': 0.03724121529192286, 'epsilon': 0.11891555989373435}. Best is trial 88 with value: 0.3542875001421725.
[I 2024-12-03 18:51:38,404] Trial 897 finished with value: 1.6228300391961221 and parameters: {'kernel': 'poly', 'C': 78.60681283705962, 'gamma': 0.027986242990241113, 'epsilon': 0.11687201906605038}. Best is trial 88 with value: 0.3542875001421725.
[I 2024-12-03 18:51:39,325] Trial 600 finished with value: 1.464018203656147 and parameters: {'kernel': 'poly', 'C': 5.479141387408791, 'gamma': 0.06935545642708735, 'epsilon': 0.0037523481426519094}. Best is trial 88 with value: 0.3542875001421725.
[I 2024-12-03 18:51:40,285] Trial 1289 finished with value: 0.3597559499504463 and parameters: {'kernel': 'rbf', 'C': 94.90959150399766, 'gamma': 0.038556879679707466, 'epsilon': 0.11428006132525129}. Best is trial 88 with value: 0.3542875001421725.
[I 2024-12-03 18:51:41,120] Trial 1290 finished with value: 0.3622218241338616 and parameters: {'kernel': 'rbf', 'C': 92.95707739110382, 'gamma': 0.05413554221054589, 'epsilon': 0.18029896577557564}. Best is trial 88 with value: 0.3542875001421725.
[I 2024-12-03 18:51:42,533] Trial 1292 finished with value: 0.4605122336836909 and parameters: {'kernel': 'rbf', 'C': 3.9574448448780135, 'gamma': 0.01109457591102316, 'epsilon': 0.22564885861754144}. Best is trial 88 with value: 0.3542875001421725.
[I 2024-12-03 18:51:44,724] Trial 1293 finished with value: 0.4321897955087077 and parameters: {'kernel': 'rbf', 'C': 23.3286320726704, 'gamma': 0.018177955502541077, 'epsilon': 0.027515705625253784}. Best is trial 88 with value: 0.3542875001421725.
[I 2024-12-03 18:51:46,941] Trial 1294 finished with value: 0.3820336385617884 and parameters: {'kernel': 'rbf', 'C': 89.96293756970795, 'gamma': 0.01247800512157081, 'epsilon': 0.2821442939568195}. Best is trial 88 with value: 0.3542875001421725.
[I 2024-12-03 18:51:48,140] Trial 1295 finished with value: 0.45159810542220696 and parameters: {'kernel': 'rbf', 'C': 5.015556950993986, 'gamma': 0.04487833096996281, 'epsilon': 0.14348846703779047}. Best is trial 88 with value: 0.3542875001421725.
[I 2024-12-03 18:51:49,532] Trial 1296 finished with value: 0.6613160562772756 and parameters: {'kernel': 'rbf', 'C': 80.72615267018423, 'gamma': 0.39927698599677025, 'epsilon': 0.22993095939745548}. Best is trial 88 with value: 0.3542875001421725.
[I 2024-12-03 18:51:51,373] Trial 1297 finished with value: 0.395637148795694 and parameters: {'kernel': 'rbf', 'C': 96.59622570683936, 'gamma': 0.014613529586593456, 'epsilon': 0.11624573946984267}. Best is trial 88 with value: 0.3542875001421725.
[I 2024-12-03 18:51:51,883] Trial 1214 finished with value: 1.4492350840663586 and parameters: {'kernel': 'poly', 'C': 2.5106069879233757, 'gamma': 0.08686416586866594, 'epsilon': 0.14465279521603241}. Best is trial 88 with value: 0.3542875001421725.
[I 2024-12-03 18:51:52,941] Trial 1286 finished with value: 0.9921689296298976 and parameters: {'kernel': 'poly', 'C': 10.922589262592522, 'gamma': 0.06727464226787588, 'epsilon': 0.26215018439262217}. Best is trial 88 with value: 0.3542875001421725.
[I 2024-12-03 18:51:53,196] Trial 1298 finished with value: 0.40999748458176144 and parameters: {'kernel': 'rbf', 'C': 94.20122855405934, 'gamma': 0.002566956722711801, 'epsilon': 0.07134348738038523}. Best is trial 88 with value: 0.3542875001421725.
[I 2024-12-03 18:51:53,765] Trial 1299 finished with value: 0.4196319320852943 and parameters: {'kernel': 'rbf', 'C': 23.776941428454723, 'gamma': 0.01847046729640812, 'epsilon': 0.09838762871185333}. Best is trial 88 with value: 0.3542875001421725.
[I 2024-12-03 18:51:54,653] Trial 1300 finished with value: 0.4000159864061024 and parameters: {'kernel': 'rbf', 'C': 19.375265039753344, 'gamma': 0.05411096711988538, 'epsilon': 0.22462047811480979}. Best is trial 88 with value: 0.3542875001421725.
[I 2024-12-03 18:51:55,637] Trial 1302 finished with value: 0.48910792066415665 and parameters: {'kernel': 'rbf', 'C': 19.928244760539297, 'gamma': 0.12354894402790592, 'epsilon': 0.30413876760757586}. Best is trial 88 with value: 0.3542875001421725.
[I 2024-12-03 18:51:55,638] Trial 1301 finished with value: 0.42026086199764845 and parameters: {'kernel': 'rbf', 'C': 17.802425902184417, 'gamma': 0.030275758927954737, 'epsilon': 0.10469023726820398}. Best is trial 88 with value: 0.3542875001421725.
[I 2024-12-03 18:51:56,077] Trial 1268 finished with value: 0.7711636275410922 and parameters: {'kernel': 'linear', 'C': 28.039221024824915, 'gamma': 0.034444693854924525, 'epsilon': 0.17587058400940608}. Best is trial 88 with value: 0.3542875001421725.
[I 2024-12-03 18:51:56,809] Trial 1303 finished with value: 0.3688191101369226 and parameters: {'kernel': 'rbf', 'C': 97.20188753972408, 'gamma': 0.02769797108053705, 'epsilon': 0.16891646197167806}. Best is trial 88 with value: 0.3542875001421725.
[I 2024-12-03 18:51:57,512] Trial 1304 finished with value: 1.0359662144181798 and parameters: {'kernel': 'sigmoid', 'C': 0.002904651367364154, 'gamma': 0.09270884773681609, 'epsilon': 0.023525717069269585}. Best is trial 88 with value: 0.3542875001421725.
[I 2024-12-03 18:51:58,298] Trial 1305 finished with value: 0.35466837134529494 and parameters: {'kernel': 'rbf', 'C': 97.54062925194066, 'gamma': 0.04361591598661133, 'epsilon': 0.10852418727800969}. Best is trial 88 with value: 0.3542875001421725.
