[I 2024-12-04 20:07:07,322] Trial 631 finished with value: 0.14249507074147158 and parameters: {'kernel_type': 'Matern', 'length_scale': 1.8991981199614334, 'noise_level': 0.07795347808793185, 'constant_value': 420.2647340176476, 'nu': 1.5}. Best is trial 616 with value: 0.1375127577189955.
[I 2024-12-04 20:07:10,142] Trial 633 finished with value: 0.9864686819227239 and parameters: {'kernel_type': 'Matern', 'length_scale': 0.03556330794791689, 'noise_level': 0.0001746824400948206, 'constant_value': 10.634542542043048, 'nu': 1.5}. Best is trial 616 with value: 0.1375127577189955.
[I 2024-12-04 20:07:11,073] Trial 632 finished with value: 0.142495054845721 and parameters: {'kernel_type': 'Matern', 'length_scale': 7.418873923971388, 'noise_level': 0.3547436077316789, 'constant_value': 146.75195434601184, 'nu': 1.5}. Best is trial 616 with value: 0.1375127577189955.
[I 2024-12-04 20:07:16,574] Trial 636 finished with value: 0.14249518223230645 and parameters: {'kernel_type': 'Matern', 'length_scale': 68.7729362120124, 'noise_level': 0.9460010738304077, 'constant_value': 997.6038992921673, 'nu': 1.5}. Best is trial 616 with value: 0.1375127577189955.
[I 2024-12-04 20:07:16,651] Trial 634 finished with value: 0.14249494679398875 and parameters: {'kernel_type': 'Matern', 'length_scale': 3.7568151572538597, 'noise_level': 0.7897458198497224, 'constant_value': 0.3746323211271986, 'nu': 1.5}. Best is trial 616 with value: 0.1375127577189955.
[I 2024-12-04 20:07:17,349] Trial 635 finished with value: 0.1424949585475845 and parameters: {'kernel_type': 'Matern', 'length_scale': 1.8556399993214403, 'noise_level': 0.022712668065730107, 'constant_value': 1665.562745751192, 'nu': 1.5}. Best is trial 616 with value: 0.1375127577189955.
[I 2024-12-04 20:07:24,249] Trial 637 finished with value: 0.1424950575998868 and parameters: {'kernel_type': 'Matern', 'length_scale': 2.535246177169164, 'noise_level': 0.7248046887829539, 'constant_value': 206.12240237093306, 'nu': 1.5}. Best is trial 616 with value: 0.1375127577189955.
[I 2024-12-04 20:07:24,777] Trial 639 finished with value: 0.1424950629703879 and parameters: {'kernel_type': 'Matern', 'length_scale': 2.6333977490772575, 'noise_level': 0.0009853943629736398, 'constant_value': 0.18927169753470696, 'nu': 1.5}. Best is trial 616 with value: 0.1375127577189955.
[I 2024-12-04 20:07:25,862] Trial 638 finished with value: 0.14249506203891002 and parameters: {'kernel_type': 'Matern', 'length_scale': 7.237333998452939, 'noise_level': 0.05153430994557923, 'constant_value': 86.98457651689948, 'nu': 1.5}. Best is trial 616 with value: 0.1375127577189955.
[I 2024-12-04 20:07:30,504] Trial 640 finished with value: 0.9864686822069068 and parameters: {'kernel_type': 'RBF', 'length_scale': 0.01408898887735453, 'noise_level': 7.69482056853256e-10, 'constant_value': 0.00011800952649985722, 'nu': 1.5}. Best is trial 616 with value: 0.1375127577189955.
[I 2024-12-04 20:07:33,445] Trial 641 finished with value: 0.1424950230072297 and parameters: {'kernel_type': 'Matern', 'length_scale': 1.3419916181392326, 'noise_level': 0.6690056960124672, 'constant_value': 10.53790121716361, 'nu': 1.5}. Best is trial 616 with value: 0.1375127577189955.
[I 2024-12-04 20:07:34,856] Trial 643 finished with value: 0.9864686819228323 and parameters: {'kernel_type': 'Matern', 'length_scale': 0.005801970768588837, 'noise_level': 0.09210233366773452, 'constant_value': 95.07063033174803, 'nu': 1.5}. Best is trial 616 with value: 0.1375127577189955.
[I 2024-12-04 20:07:36,703] Trial 642 finished with value: 0.9864686819230947 and parameters: {'kernel_type': 'Matern', 'length_scale': 102.6576459712507, 'noise_level': 0.008415277289288486, 'constant_value': 1.1817926445411966, 'nu': 1.5}. Best is trial 616 with value: 0.1375127577189955.
[I 2024-12-04 20:07:39,818] Trial 644 finished with value: 0.19720003513991866 and parameters: {'kernel_type': 'Matern', 'length_scale': 16.666035758541167, 'noise_level': 0.4269212150204143, 'constant_value': 6.00939941880074, 'nu': 0.5}. Best is trial 616 with value: 0.1375127577189955.
[I 2024-12-04 20:07:42,485] Trial 645 finished with value: 0.14249532276925608 and parameters: {'kernel_type': 'Matern', 'length_scale': 3.4220207758600805, 'noise_level': 0.05793673387796223, 'constant_value': 564.3552809882415, 'nu': 1.5}. Best is trial 616 with value: 0.1375127577189955.
[I 2024-12-04 20:07:44,962] Trial 646 finished with value: 0.1424949015437418 and parameters: {'kernel_type': 'Matern', 'length_scale': 5.3379480014419585, 'noise_level': 0.7747654095893457, 'constant_value': 2161.9516225353022, 'nu': 1.5}. Best is trial 616 with value: 0.1375127577189955.
[I 2024-12-04 20:07:46,997] Trial 647 finished with value: 0.14249507691144453 and parameters: {'kernel_type': 'Matern', 'length_scale': 34.01978803477324, 'noise_level': 0.9148863440716821, 'constant_value': 4389.213666531678, 'nu': 1.5}. Best is trial 616 with value: 0.1375127577189955.
[I 2024-12-04 20:07:51,114] Trial 649 finished with value: 0.14249488719490694 and parameters: {'kernel_type': 'Matern', 'length_scale': 31.894639673814392, 'noise_level': 0.7912959252072438, 'constant_value': 99631.12539169831, 'nu': 1.5}. Best is trial 616 with value: 0.1375127577189955.
[I 2024-12-04 20:07:51,213] Trial 648 finished with value: 0.9864686819240589 and parameters: {'kernel_type': 'Matern', 'length_scale': 63.62262237731638, 'noise_level': 0.036419332197300563, 'constant_value': 0.03245966612862642, 'nu': 1.5}. Best is trial 616 with value: 0.1375127577189955.
[I 2024-12-04 20:07:55,339] Trial 650 finished with value: 0.14249506069179374 and parameters: {'kernel_type': 'Matern', 'length_scale': 15.102299172886191, 'noise_level': 0.012228603522766031, 'constant_value': 41.51248158976942, 'nu': 1.5}. Best is trial 616 with value: 0.1375127577189955.
[I 2024-12-04 20:07:58,635] Trial 652 finished with value: 0.1446988235419434 and parameters: {'kernel_type': 'Matern', 'length_scale': 1.9197913536367406, 'noise_level': 0.17906138966050314, 'constant_value': 4.48660282191435, 'nu': 2.5}. Best is trial 616 with value: 0.1375127577189955.
[I 2024-12-04 20:07:59,585] Trial 651 finished with value: 0.14249506310379023 and parameters: {'kernel_type': 'Matern', 'length_scale': 80.68839831709205, 'noise_level': 0.532746652808212, 'constant_value': 0.14225327373596905, 'nu': 1.5}. Best is trial 616 with value: 0.1375127577189955.
[I 2024-12-04 20:08:01,748] Trial 653 finished with value: 0.14771017325990402 and parameters: {'kernel_type': 'RBF', 'length_scale': 69.86185201224119, 'noise_level': 0.6745383525272177, 'constant_value': 4.054313097475177, 'nu': 0.5}. Best is trial 616 with value: 0.1375127577189955.
[I 2024-12-04 20:08:03,927] Trial 654 finished with value: 0.9864686818215951 and parameters: {'kernel_type': 'Matern', 'length_scale': 0.06749097291459616, 'noise_level': 0.005451791721948052, 'constant_value': 0.04530244230588252, 'nu': 1.5}. Best is trial 616 with value: 0.1375127577189955.
[I 2024-12-04 20:08:06,976] Trial 655 finished with value: 0.19720004193122356 and parameters: {'kernel_type': 'Matern', 'length_scale': 0.43271679877885333, 'noise_level': 0.05665770746318078, 'constant_value': 41335.560073784996, 'nu': 0.5}. Best is trial 616 with value: 0.1375127577189955.
[I 2024-12-04 20:08:07,680] Trial 656 finished with value: 0.1424950247561253 and parameters: {'kernel_type': 'Matern', 'length_scale': 866.0671870261602, 'noise_level': 0.5626443381042509, 'constant_value': 56258.18973425189, 'nu': 1.5}. Best is trial 616 with value: 0.1375127577189955.
[I 2024-12-04 20:08:11,235] Trial 657 finished with value: 0.14249506317129873 and parameters: {'kernel_type': 'Matern', 'length_scale': 14.590834919105745, 'noise_level': 0.004206074429281505, 'constant_value': 16.469002900262584, 'nu': 1.5}. Best is trial 616 with value: 0.1375127577189955.
[I 2024-12-04 20:08:13,060] Trial 658 finished with value: 0.1424950568551863 and parameters: {'kernel_type': 'Matern', 'length_scale': 8.295335519784155, 'noise_level': 0.698020551156501, 'constant_value': 75481.15096825601, 'nu': 1.5}. Best is trial 616 with value: 0.1375127577189955.
[I 2024-12-04 20:08:15,922] Trial 659 finished with value: 0.14249510996879078 and parameters: {'kernel_type': 'Matern', 'length_scale': 1.563237153558008, 'noise_level': 0.015495942762509237, 'constant_value': 1938.768902185734, 'nu': 1.5}. Best is trial 616 with value: 0.1375127577189955.
[I 2024-12-04 20:08:20,381] Trial 662 finished with value: 0.9864686819214297 and parameters: {'kernel_type': 'Matern', 'length_scale': 0.054227354555401855, 'noise_level': 0.03638118377022523, 'constant_value': 247.44035969738573, 'nu': 1.5}. Best is trial 616 with value: 0.1375127577189955.
[I 2024-12-04 20:08:21,773] Trial 661 finished with value: 0.1424952325851488 and parameters: {'kernel_type': 'Matern', 'length_scale': 1.7340599420310057, 'noise_level': 0.011565354865972986, 'constant_value': 2.014458988933543, 'nu': 1.5}. Best is trial 616 with value: 0.1375127577189955.
[I 2024-12-04 20:08:23,983] Trial 660 finished with value: 0.9864686820810601 and parameters: {'kernel_type': 'Matern', 'length_scale': 597.0987815789347, 'noise_level': 4.4335349652872214e-10, 'constant_value': 5.7711002174217603e-05, 'nu': 2.5}. Best is trial 616 with value: 0.1375127577189955.
[I 2024-12-04 20:08:27,823] Trial 663 finished with value: 0.9864686819215982 and parameters: {'kernel_type': 'RBF', 'length_scale': 3.07535263902388e-05, 'noise_level': 1.2561497908901644e-06, 'constant_value': 0.10561389948037601, 'nu': 0.5}. Best is trial 616 with value: 0.1375127577189955.
[I 2024-12-04 20:08:29,389] Trial 664 finished with value: 0.14249504259606519 and parameters: {'kernel_type': 'Matern', 'length_scale': 28.026372238189655, 'noise_level': 0.01991968305627298, 'constant_value': 14.22750346453915, 'nu': 1.5}. Best is trial 616 with value: 0.1375127577189955.
[I 2024-12-04 20:08:34,195] Trial 667 finished with value: 0.1446988824549445 and parameters: {'kernel_type': 'Matern', 'length_scale': 0.8716445028678528, 'noise_level': 0.8662850806654061, 'constant_value': 37471.65249603182, 'nu': 2.5}. Best is trial 616 with value: 0.1375127577189955.
[I 2024-12-04 20:08:35,365] Trial 666 finished with value: 0.14249491515955576 and parameters: {'kernel_type': 'Matern', 'length_scale': 72.14859600551934, 'noise_level': 0.046782204404793824, 'constant_value': 1.525242019259685, 'nu': 1.5}. Best is trial 616 with value: 0.1375127577189955.
[I 2024-12-04 20:08:36,074] Trial 665 finished with value: 0.14249496188138755 and parameters: {'kernel_type': 'Matern', 'length_scale': 0.1289528133648523, 'noise_level': 0.8489387425186661, 'constant_value': 269.10301277057897, 'nu': 1.5}. Best is trial 616 with value: 0.1375127577189955.
[I 2024-12-04 20:08:40,711] Trial 670 finished with value: 0.9864686819200943 and parameters: {'kernel_type': 'Matern', 'length_scale': 0.00010246138675520763, 'noise_level': 0.01307672791184769, 'constant_value': 83444.62155347085, 'nu': 2.5}. Best is trial 616 with value: 0.1375127577189955.
[I 2024-12-04 20:08:41,099] Trial 669 finished with value: 0.1971999790848246 and parameters: {'kernel_type': 'Matern', 'length_scale': 6.697026050119616, 'noise_level': 0.019203520269938934, 'constant_value': 375.6761908210728, 'nu': 0.5}. Best is trial 616 with value: 0.1375127577189955.
[I 2024-12-04 20:08:46,066] Trial 668 finished with value: 0.14249449266667316 and parameters: {'kernel_type': 'Matern', 'length_scale': 83.19202097155774, 'noise_level': 0.036023322497698865, 'constant_value': 250.53760744959942, 'nu': 1.5}. Best is trial 616 with value: 0.1375127577189955.
[I 2024-12-04 20:08:47,284] Trial 671 finished with value: 0.14249503049112203 and parameters: {'kernel_type': 'Matern', 'length_scale': 2289.156482016513, 'noise_level': 0.722342291215458, 'constant_value': 93466.54112233414, 'nu': 1.5}. Best is trial 616 with value: 0.1375127577189955.
[I 2024-12-04 20:08:49,086] Trial 672 finished with value: 0.14771024416647313 and parameters: {'kernel_type': 'RBF', 'length_scale': 47.3546592522318, 'noise_level': 0.16884443318436457, 'constant_value': 1.0604009430518837, 'nu': 1.5}. Best is trial 616 with value: 0.1375127577189955.
[I 2024-12-04 20:08:52,955] Trial 674 finished with value: 0.14249534705793665 and parameters: {'kernel_type': 'Matern', 'length_scale': 62.544740918160855, 'noise_level': 0.03486782911559782, 'constant_value': 156.0611479263898, 'nu': 1.5}. Best is trial 616 with value: 0.1375127577189955.
[I 2024-12-04 20:08:56,011] Trial 675 finished with value: 0.9864686819309197 and parameters: {'kernel_type': 'Matern', 'length_scale': 11180.817613997957, 'noise_level': 0.0008360419618925982, 'constant_value': 89040.63215983758, 'nu': 2.5}. Best is trial 616 with value: 0.1375127577189955.
[I 2024-12-04 20:08:56,404] Trial 673 finished with value: 0.9864686820134444 and parameters: {'kernel_type': 'Matern', 'length_scale': 717.1519944282846, 'noise_level': 0.025023477275251577, 'constant_value': 4.957540722512594, 'nu': 1.5}. Best is trial 616 with value: 0.1375127577189955.
[I 2024-12-04 20:09:00,321] Trial 676 finished with value: 0.14249537608763083 and parameters: {'kernel_type': 'Matern', 'length_scale': 14.043112195320965, 'noise_level': 0.17373241154172858, 'constant_value': 6.17218243697278, 'nu': 1.5}. Best is trial 616 with value: 0.1375127577189955.
[I 2024-12-04 20:09:04,044] Trial 677 finished with value: 0.1424951068386143 and parameters: {'kernel_type': 'Matern', 'length_scale': 110.90589063712932, 'noise_level': 0.012892833873491152, 'constant_value': 11.985920159518054, 'nu': 1.5}. Best is trial 616 with value: 0.1375127577189955.
[I 2024-12-04 20:09:04,792] Trial 678 finished with value: 0.142495068655176 and parameters: {'kernel_type': 'Matern', 'length_scale': 2.014399242617134, 'noise_level': 0.0003079797197765116, 'constant_value': 118.70861581992528, 'nu': 1.5}. Best is trial 616 with value: 0.1375127577189955.
[I 2024-12-04 20:09:09,851] Trial 679 finished with value: 0.1424949220828193 and parameters: {'kernel_type': 'Matern', 'length_scale': 9.68294936418247, 'noise_level': 0.004582920403379015, 'constant_value': 1206.3311231577522, 'nu': 1.5}. Best is trial 616 with value: 0.1375127577189955.
[I 2024-12-04 20:09:11,184] Trial 680 finished with value: 0.14249526925523492 and parameters: {'kernel_type': 'Matern', 'length_scale': 0.25693911040655476, 'noise_level': 0.01021615437244665, 'constant_value': 0.22735174467449515, 'nu': 1.5}. Best is trial 616 with value: 0.1375127577189955.
[I 2024-12-04 20:09:14,298] Trial 681 finished with value: 0.13793834019527504 and parameters: {'kernel_type': 'Matern', 'length_scale': 35.57417022226537, 'noise_level': 0.23360062057118397, 'constant_value': 50.229055293067695, 'nu': 1.5}. Best is trial 616 with value: 0.1375127577189955.
[I 2024-12-04 20:09:16,934] Trial 682 finished with value: 0.9864686819226443 and parameters: {'kernel_type': 'RBF', 'length_scale': 165.59899992028258, 'noise_level': 0.0003968315561359303, 'constant_value': 354.11742458663997, 'nu': 1.5}. Best is trial 616 with value: 0.1375127577189955.
[I 2024-12-04 20:09:19,384] Trial 683 finished with value: 0.9864686819264257 and parameters: {'kernel_type': 'RBF', 'length_scale': 11483.57606424037, 'noise_level': 2.3448621085387542e-09, 'constant_value': 1029.950560366716, 'nu': 0.5}. Best is trial 616 with value: 0.1375127577189955.
[I 2024-12-04 20:09:21,014] Trial 684 finished with value: 0.142495072625463 and parameters: {'kernel_type': 'Matern', 'length_scale': 22.151867154942288, 'noise_level': 0.9064569963855206, 'constant_value': 1.8301219423317494, 'nu': 1.5}. Best is trial 616 with value: 0.1375127577189955.
[I 2024-12-04 20:09:24,579] Trial 685 finished with value: 0.1424950629206493 and parameters: {'kernel_type': 'Matern', 'length_scale': 5.886494616228179, 'noise_level': 0.06810171708312789, 'constant_value': 2.462200772310181, 'nu': 1.5}. Best is trial 616 with value: 0.1375127577189955.
[I 2024-12-04 20:09:28,187] Trial 686 finished with value: 0.9864686819228671 and parameters: {'kernel_type': 'RBF', 'length_scale': 2.293176382957171e-05, 'noise_level': 0.0035737799775504425, 'constant_value': 0.002638175496034545, 'nu': 1.5}. Best is trial 616 with value: 0.1375127577189955.
[I 2024-12-04 20:09:28,208] Trial 687 finished with value: 0.14249500306970317 and parameters: {'kernel_type': 'Matern', 'length_scale': 1.0470294857528777, 'noise_level': 0.015185246050812149, 'constant_value': 42.93767332456354, 'nu': 1.5}. Best is trial 616 with value: 0.1375127577189955.
[I 2024-12-04 20:09:31,531] Trial 688 finished with value: 0.1446988101002357 and parameters: {'kernel_type': 'Matern', 'length_scale': 11.263259458330568, 'noise_level': 0.001983902362386404, 'constant_value': 118.08288589554697, 'nu': 2.5}. Best is trial 616 with value: 0.1375127577189955.
[I 2024-12-04 20:09:36,008] Trial 690 finished with value: 0.14249506771696496 and parameters: {'kernel_type': 'Matern', 'length_scale': 46.40263146902776, 'noise_level': 0.1434651515807442, 'constant_value': 26.991974751161532, 'nu': 1.5}. Best is trial 616 with value: 0.1375127577189955.
[I 2024-12-04 20:09:36,823] Trial 689 finished with value: 0.9864686818188749 and parameters: {'kernel_type': 'Matern', 'length_scale': 7068.209660093206, 'noise_level': 0.00012222273513428866, 'constant_value': 0.43119296825657893, 'nu': 1.5}. Best is trial 616 with value: 0.1375127577189955.
[I 2024-12-04 20:09:39,862] Trial 691 finished with value: 0.1424950693456937 and parameters: {'kernel_type': 'Matern', 'length_scale': 2.0313838846849896, 'noise_level': 0.04299350938465772, 'constant_value': 67.4019689391954, 'nu': 1.5}. Best is trial 616 with value: 0.1375127577189955.
[I 2024-12-04 20:09:39,868] Trial 692 finished with value: 0.9864686819309075 and parameters: {'kernel_type': 'RBF', 'length_scale': 0.02875199239875605, 'noise_level': 0.017071500022243755, 'constant_value': 2.0958219748321905, 'nu': 1.5}. Best is trial 616 with value: 0.1375127577189955.
[I 2024-12-04 20:09:44,076] Trial 693 finished with value: 0.9864686819007056 and parameters: {'kernel_type': 'RBF', 'length_scale': 0.00012905169989455492, 'noise_level': 1.2210545855751527e-10, 'constant_value': 1.2443721506389132e-06, 'nu': 0.5}. Best is trial 616 with value: 0.1375127577189955.
[I 2024-12-04 20:09:46,243] Trial 694 finished with value: 0.9864686810243583 and parameters: {'kernel_type': 'Matern', 'length_scale': 45.96056362635747, 'noise_level': 0.0001733997092178515, 'constant_value': 9.733475488749878, 'nu': 1.5}. Best is trial 616 with value: 0.1375127577189955.
[I 2024-12-04 20:09:52,645] Trial 696 finished with value: 0.9864686819981442 and parameters: {'kernel_type': 'RBF', 'length_scale': 0.09123966541958207, 'noise_level': 3.9068619203334995e-05, 'constant_value': 133.5421063758474, 'nu': 2.5}. Best is trial 616 with value: 0.1375127577189955.
[I 2024-12-04 20:09:52,945] Trial 695 finished with value: 0.14249462008401562 and parameters: {'kernel_type': 'Matern', 'length_scale': 2330.2218717599567, 'noise_level': 0.778770893898883, 'constant_value': 0.4673191623314512, 'nu': 1.5}. Best is trial 616 with value: 0.1375127577189955.
[I 2024-12-04 20:09:58,933] Trial 697 finished with value: 0.14249506632266132 and parameters: {'kernel_type': 'Matern', 'length_scale': 8.461119446492827, 'noise_level': 0.16881039022325253, 'constant_value': 124.35673612779561, 'nu': 1.5}. Best is trial 616 with value: 0.1375127577189955.
[I 2024-12-04 20:10:02,148] Trial 699 finished with value: 0.9982167338037766 and parameters: {'kernel_type': 'RBF', 'length_scale': 0.13160123817717811, 'noise_level': 2.2694828678657158e-08, 'constant_value': 6912.912817158353, 'nu': 2.5}. Best is trial 616 with value: 0.1375127577189955.
[I 2024-12-04 20:10:04,635] Trial 698 finished with value: 0.14249506451866312 and parameters: {'kernel_type': 'Matern', 'length_scale': 0.4501346365728872, 'noise_level': 0.6155275089023573, 'constant_value': 33.10051480589415, 'nu': 1.5}. Best is trial 616 with value: 0.1375127577189955.
[I 2024-12-04 20:10:07,015] Trial 701 finished with value: 0.9864686819508445 and parameters: {'kernel_type': 'RBF', 'length_scale': 0.0032745835089520543, 'noise_level': 0.8022989273354807, 'constant_value': 16430.184621208307, 'nu': 1.5}. Best is trial 616 with value: 0.1375127577189955.
[I 2024-12-04 20:10:10,818] Trial 700 finished with value: 0.1424950167476904 and parameters: {'kernel_type': 'Matern', 'length_scale': 1399.5608354152685, 'noise_level': 0.21234039473279956, 'constant_value': 0.5728320431453902, 'nu': 1.5}. Best is trial 616 with value: 0.1375127577189955.
[I 2024-12-04 20:10:14,535] Trial 703 finished with value: 0.14249501223156802 and parameters: {'kernel_type': 'Matern', 'length_scale': 2960.5274839745525, 'noise_level': 0.10419259564413326, 'constant_value': 0.2461546208280884, 'nu': 1.5}. Best is trial 616 with value: 0.1375127577189955.
[I 2024-12-04 20:10:14,561] Trial 702 finished with value: 0.1477103637863932 and parameters: {'kernel_type': 'RBF', 'length_scale': 0.36996521452911907, 'noise_level': 3.211513475433535e-07, 'constant_value': 0.019653880341344278, 'nu': 2.5}. Best is trial 616 with value: 0.1375127577189955.
[I 2024-12-04 20:10:23,034] Trial 704 finished with value: 0.14249506309567755 and parameters: {'kernel_type': 'Matern', 'length_scale': 1661.2455186563052, 'noise_level': 0.9225329479509673, 'constant_value': 5.824003194190396, 'nu': 1.5}. Best is trial 616 with value: 0.1375127577189955.
[I 2024-12-04 20:10:25,508] Trial 705 finished with value: 0.9864686819210431 and parameters: {'kernel_type': 'Matern', 'length_scale': 0.011207600215358424, 'noise_level': 0.7445636647697939, 'constant_value': 0.8485361531216666, 'nu': 1.5}. Best is trial 616 with value: 0.1375127577189955.
