[I 2024-12-04 15:15:51,288] Trial 1258 finished with value: 0.13435436342511037 and parameters: {'kernel_type': 'Matern', 'length_scale': 126.10334540212926, 'noise_level': 0.054058089196269234, 'constant_value': 84304.83971985675, 'nu': 1.5}. Best is trial 750 with value: 0.13435342446039877.
[I 2024-12-04 15:15:52,272] Trial 1268 finished with value: 0.13435438503915487 and parameters: {'kernel_type': 'Matern', 'length_scale': 7.384497577701179, 'noise_level': 0.0023355502858651003, 'constant_value': 70539.30253605227, 'nu': 1.5}. Best is trial 750 with value: 0.13435342446039877.
[I 2024-12-04 15:15:55,000] Trial 1265 finished with value: 0.1343543983020338 and parameters: {'kernel_type': 'Matern', 'length_scale': 55.89068658278357, 'noise_level': 0.2208809805617505, 'constant_value': 89620.76134755697, 'nu': 1.5}. Best is trial 750 with value: 0.13435342446039877.
[I 2024-12-04 15:15:58,306] Trial 1273 finished with value: 0.1343544110471285 and parameters: {'kernel_type': 'Matern', 'length_scale': 1389.7200281979226, 'noise_level': 0.9857465900711867, 'constant_value': 35803.25965620198, 'nu': 1.5}. Best is trial 750 with value: 0.13435342446039877.
[I 2024-12-04 15:16:00,795] Trial 1263 finished with value: 0.13435440582294025 and parameters: {'kernel_type': 'Matern', 'length_scale': 4.51391864185463, 'noise_level': 0.001453321269418913, 'constant_value': 51875.16187775133, 'nu': 1.5}. Best is trial 750 with value: 0.13435342446039877.
[I 2024-12-04 15:16:01,884] Trial 1277 finished with value: 0.13435440827876885 and parameters: {'kernel_type': 'Matern', 'length_scale': 6.956177178542716, 'noise_level': 0.6079889182242963, 'constant_value': 3323.617593414608, 'nu': 1.5}. Best is trial 750 with value: 0.13435342446039877.
[I 2024-12-04 15:16:01,888] Trial 1269 finished with value: 1.2693635028569672 and parameters: {'kernel_type': 'Matern', 'length_scale': 2532.575640696926, 'noise_level': 1.2041405286157834e-10, 'constant_value': 2690.881199142931, 'nu': 2.5}. Best is trial 750 with value: 0.13435342446039877.
[I 2024-12-04 15:16:01,964] Trial 1275 finished with value: 0.134354401906142 and parameters: {'kernel_type': 'Matern', 'length_scale': 1.7489575000593942, 'noise_level': 0.09920211018105055, 'constant_value': 76332.59093850215, 'nu': 1.5}. Best is trial 750 with value: 0.13435342446039877.
[I 2024-12-04 15:16:02,514] Trial 1272 finished with value: 0.1343544280292229 and parameters: {'kernel_type': 'Matern', 'length_scale': 64.84325877092114, 'noise_level': 0.10769942393146822, 'constant_value': 130.1045151999141, 'nu': 1.5}. Best is trial 750 with value: 0.13435342446039877.
[I 2024-12-04 15:16:07,682] Trial 1271 finished with value: 0.13435438516729245 and parameters: {'kernel_type': 'Matern', 'length_scale': 182.37834679771854, 'noise_level': 0.01290420775847535, 'constant_value': 93530.42214707888, 'nu': 1.5}. Best is trial 750 with value: 0.13435342446039877.
[I 2024-12-04 15:16:07,703] Trial 1270 finished with value: 0.13435442223930355 and parameters: {'kernel_type': 'Matern', 'length_scale': 7.61499991164309, 'noise_level': 0.7460373484041684, 'constant_value': 141.93239254060526, 'nu': 1.5}. Best is trial 750 with value: 0.13435342446039877.
[I 2024-12-04 15:16:08,416] Trial 1280 finished with value: 0.13435439150488032 and parameters: {'kernel_type': 'Matern', 'length_scale': 12.555215764724997, 'noise_level': 0.08245589331700995, 'constant_value': 48.754272496200095, 'nu': 1.5}. Best is trial 750 with value: 0.13435342446039877.
[I 2024-12-04 15:16:09,380] Trial 1261 finished with value: 0.17251040368373152 and parameters: {'kernel_type': 'Matern', 'length_scale': 0.20276820155398953, 'noise_level': 0.005247058714747395, 'constant_value': 48491.12375041593, 'nu': 0.5}. Best is trial 750 with value: 0.13435342446039877.
[I 2024-12-04 15:16:09,682] Trial 1267 finished with value: 0.1343544005172263 and parameters: {'kernel_type': 'Matern', 'length_scale': 0.2911371467835284, 'noise_level': 0.8039300674774404, 'constant_value': 1717.3345054950942, 'nu': 1.5}. Best is trial 750 with value: 0.13435342446039877.
[I 2024-12-04 15:16:10,182] Trial 1278 finished with value: 0.13435439783133937 and parameters: {'kernel_type': 'Matern', 'length_scale': 0.2686949395748322, 'noise_level': 0.008333734773123113, 'constant_value': 40485.47414295513, 'nu': 1.5}. Best is trial 750 with value: 0.13435342446039877.
[I 2024-12-04 15:16:10,663] Trial 1274 finished with value: 0.1343544010113962 and parameters: {'kernel_type': 'Matern', 'length_scale': 10.77468748872307, 'noise_level': 0.02618778283595055, 'constant_value': 3726.059837076609, 'nu': 1.5}. Best is trial 750 with value: 0.13435342446039877.
[I 2024-12-04 15:16:13,677] Trial 1284 finished with value: 1.2693634850134794 and parameters: {'kernel_type': 'Matern', 'length_scale': 0.09790370443044166, 'noise_level': 0.19186905303783985, 'constant_value': 59297.47891228327, 'nu': 2.5}. Best is trial 750 with value: 0.13435342446039877.
[I 2024-12-04 15:16:13,745] Trial 1286 finished with value: 0.13435439990403303 and parameters: {'kernel_type': 'Matern', 'length_scale': 51.37870509091778, 'noise_level': 0.09175655652878698, 'constant_value': 33.44945273416761, 'nu': 1.5}. Best is trial 750 with value: 0.13435342446039877.
[I 2024-12-04 15:16:14,616] Trial 1288 finished with value: 0.13435440061781626 and parameters: {'kernel_type': 'Matern', 'length_scale': 4.482601409785683, 'noise_level': 0.044815151716750344, 'constant_value': 53487.721537794525, 'nu': 1.5}. Best is trial 750 with value: 0.13435342446039877.
[I 2024-12-04 15:16:18,631] Trial 1281 finished with value: 0.13435445676283633 and parameters: {'kernel_type': 'Matern', 'length_scale': 8.00790375116611, 'noise_level': 0.029583290593540267, 'constant_value': 1597.7434880804765, 'nu': 1.5}. Best is trial 750 with value: 0.13435342446039877.
[I 2024-12-04 15:16:19,619] Trial 1289 finished with value: 0.13435440947132862 and parameters: {'kernel_type': 'Matern', 'length_scale': 3.3840068844623707, 'noise_level': 0.010343612361740591, 'constant_value': 90819.86995703577, 'nu': 1.5}. Best is trial 750 with value: 0.13435342446039877.
[I 2024-12-04 15:16:20,483] Trial 1276 finished with value: 0.1343544283205747 and parameters: {'kernel_type': 'Matern', 'length_scale': 94.30343661121685, 'noise_level': 0.06532827387788556, 'constant_value': 989.0543650120236, 'nu': 1.5}. Best is trial 750 with value: 0.13435342446039877.
[I 2024-12-04 15:16:20,553] Trial 1282 finished with value: 0.1343543998381153 and parameters: {'kernel_type': 'Matern', 'length_scale': 17.01834553810265, 'noise_level': 0.016732911480779718, 'constant_value': 66168.89899211095, 'nu': 1.5}. Best is trial 750 with value: 0.13435342446039877.
[I 2024-12-04 15:16:20,809] Trial 1279 finished with value: 0.13435428743465808 and parameters: {'kernel_type': 'Matern', 'length_scale': 0.4608089112522506, 'noise_level': 0.38472773066785343, 'constant_value': 87507.66025918337, 'nu': 1.5}. Best is trial 750 with value: 0.13435342446039877.
[I 2024-12-04 15:16:20,866] Trial 1293 finished with value: 0.13435440583605826 and parameters: {'kernel_type': 'Matern', 'length_scale': 37.68124951211966, 'noise_level': 0.7403297350943843, 'constant_value': 1620.9438220217323, 'nu': 1.5}. Best is trial 750 with value: 0.13435342446039877.
[I 2024-12-04 15:16:22,231] Trial 1296 finished with value: 0.13435445644448865 and parameters: {'kernel_type': 'Matern', 'length_scale': 68.0454562204069, 'noise_level': 0.034646880480665845, 'constant_value': 1928.38590388144, 'nu': 1.5}. Best is trial 750 with value: 0.13435342446039877.
[I 2024-12-04 15:16:22,945] Trial 1285 finished with value: 0.13435439920510298 and parameters: {'kernel_type': 'Matern', 'length_scale': 23.56849394405925, 'noise_level': 0.013343367513915233, 'constant_value': 80717.53857358036, 'nu': 1.5}. Best is trial 750 with value: 0.13435342446039877.
[I 2024-12-04 15:16:22,946] Trial 1290 finished with value: 0.13435436641731913 and parameters: {'kernel_type': 'Matern', 'length_scale': 44.22320842227462, 'noise_level': 0.008771827916923085, 'constant_value': 1276.136649727771, 'nu': 1.5}. Best is trial 750 with value: 0.13435342446039877.
[I 2024-12-04 15:16:22,954] Trial 1287 finished with value: 1.2693635028569608 and parameters: {'kernel_type': 'RBF', 'length_scale': 0.01717624830565318, 'noise_level': 0.014936125913450825, 'constant_value': 20808.932737927888, 'nu': 2.5}. Best is trial 750 with value: 0.13435342446039877.
[I 2024-12-04 15:16:23,425] Trial 1295 finished with value: 1.2693635028571135 and parameters: {'kernel_type': 'RBF', 'length_scale': 0.0947541008006071, 'noise_level': 0.20397619301694017, 'constant_value': 3528.77161692792, 'nu': 1.5}. Best is trial 750 with value: 0.13435342446039877.
[I 2024-12-04 15:16:24,603] Trial 1283 finished with value: 0.15167299029254602 and parameters: {'kernel_type': 'RBF', 'length_scale': 29.00107820699874, 'noise_level': 0.009870335877113872, 'constant_value': 1534.7150467964907, 'nu': 1.5}. Best is trial 750 with value: 0.13435342446039877.
[I 2024-12-04 15:16:26,402] Trial 1297 finished with value: 0.14859826929015899 and parameters: {'kernel_type': 'Matern', 'length_scale': 2.9638420256604414, 'noise_level': 0.0685398580300048, 'constant_value': 56.59193709445023, 'nu': 2.5}. Best is trial 750 with value: 0.13435342446039877.
[I 2024-12-04 15:16:28,019] Trial 1291 finished with value: 0.13435439929748824 and parameters: {'kernel_type': 'Matern', 'length_scale': 31.870716904540203, 'noise_level': 0.04726349816645427, 'constant_value': 1920.9798898562383, 'nu': 1.5}. Best is trial 750 with value: 0.13435342446039877.
[I 2024-12-04 15:16:30,752] Trial 1294 finished with value: 0.13435439595005114 and parameters: {'kernel_type': 'Matern', 'length_scale': 46.474727729959234, 'noise_level': 0.04422017562780213, 'constant_value': 94784.746504274, 'nu': 1.5}. Best is trial 750 with value: 0.13435342446039877.
[I 2024-12-04 15:16:31,591] Trial 1303 finished with value: 0.1343543946506445 and parameters: {'kernel_type': 'Matern', 'length_scale': 4.14346180422741, 'noise_level': 0.923761794094474, 'constant_value': 1825.8426169991144, 'nu': 1.5}. Best is trial 750 with value: 0.13435342446039877.
[I 2024-12-04 15:16:31,771] Trial 1292 finished with value: 0.1343544037746188 and parameters: {'kernel_type': 'Matern', 'length_scale': 130.40208425350866, 'noise_level': 0.010687343171561529, 'constant_value': 96493.15860594355, 'nu': 1.5}. Best is trial 750 with value: 0.13435342446039877.
[I 2024-12-04 15:16:32,035] Trial 1302 finished with value: 0.13435435155931713 and parameters: {'kernel_type': 'Matern', 'length_scale': 2.236457015478037, 'noise_level': 0.0652126744536074, 'constant_value': 73554.62200866287, 'nu': 1.5}. Best is trial 750 with value: 0.13435342446039877.
[I 2024-12-04 15:16:32,572] Trial 1311 finished with value: 1.300774597964237 and parameters: {'kernel_type': 'RBF', 'length_scale': 53055.902121948886, 'noise_level': 0.21421788468457764, 'constant_value': 1.3730705724721347e-07, 'nu': 0.5}. Best is trial 750 with value: 0.13435342446039877.
[I 2024-12-04 15:16:33,086] Trial 1304 finished with value: 1.2693635028571109 and parameters: {'kernel_type': 'Matern', 'length_scale': 0.004996826882545067, 'noise_level': 0.9745073911259579, 'constant_value': 463.8102586602464, 'nu': 1.5}. Best is trial 750 with value: 0.13435342446039877.
[I 2024-12-04 15:16:34,875] Trial 1301 finished with value: 1.2693635028568278 and parameters: {'kernel_type': 'Matern', 'length_scale': 0.0014770789571462695, 'noise_level': 0.001466936300153139, 'constant_value': 1471.1752992901609, 'nu': 2.5}. Best is trial 750 with value: 0.13435342446039877.
[I 2024-12-04 15:16:36,307] Trial 1305 finished with value: 0.17251038425636037 and parameters: {'kernel_type': 'Matern', 'length_scale': 3.1502489854499496, 'noise_level': 0.09546291685277704, 'constant_value': 106.09702522538001, 'nu': 0.5}. Best is trial 750 with value: 0.13435342446039877.
[I 2024-12-04 15:16:37,578] Trial 1300 finished with value: 0.13435441782944937 and parameters: {'kernel_type': 'Matern', 'length_scale': 0.33007226218011637, 'noise_level': 0.026194414574559816, 'constant_value': 97502.9485369046, 'nu': 1.5}. Best is trial 750 with value: 0.13435342446039877.
[I 2024-12-04 15:16:41,251] Trial 1310 finished with value: 0.17251039271777102 and parameters: {'kernel_type': 'Matern', 'length_scale': 50.3444188082522, 'noise_level': 0.05819072476139227, 'constant_value': 3355.1411587983835, 'nu': 0.5}. Best is trial 750 with value: 0.13435342446039877.
[I 2024-12-04 15:16:41,305] Trial 1306 finished with value: 0.13435429240533014 and parameters: {'kernel_type': 'Matern', 'length_scale': 14.81966158654801, 'noise_level': 0.027550587344333622, 'constant_value': 972.4389638607688, 'nu': 1.5}. Best is trial 750 with value: 0.13435342446039877.
[I 2024-12-04 15:16:42,750] Trial 1309 finished with value: 0.13435437756495264 and parameters: {'kernel_type': 'Matern', 'length_scale': 0.4910227310073213, 'noise_level': 2.3041615439138953e-08, 'constant_value': 2.1370825590347517, 'nu': 1.5}. Best is trial 750 with value: 0.13435342446039877.
[I 2024-12-04 15:16:44,395] Trial 1298 finished with value: 0.13435435924164937 and parameters: {'kernel_type': 'Matern', 'length_scale': 14.192997500456137, 'noise_level': 0.7689544161007392, 'constant_value': 413.7676018866616, 'nu': 1.5}. Best is trial 750 with value: 0.13435342446039877.
[I 2024-12-04 15:16:44,423] Trial 1307 finished with value: 1.2693635028569885 and parameters: {'kernel_type': 'RBF', 'length_scale': 1.0518399236807554e-05, 'noise_level': 0.14764795877016895, 'constant_value': 0.0059883443109575545, 'nu': 1.5}. Best is trial 750 with value: 0.13435342446039877.
[I 2024-12-04 15:16:45,152] Trial 1312 finished with value: 0.13435432430220706 and parameters: {'kernel_type': 'Matern', 'length_scale': 0.24143201953586294, 'noise_level': 0.01395564412059152, 'constant_value': 364.1288080796406, 'nu': 1.5}. Best is trial 750 with value: 0.13435342446039877.
[I 2024-12-04 15:16:46,085] Trial 1318 finished with value: 0.1343543896540535 and parameters: {'kernel_type': 'Matern', 'length_scale': 110.18367473115677, 'noise_level': 0.7207240353795827, 'constant_value': 1.404262152818888, 'nu': 1.5}. Best is trial 750 with value: 0.13435342446039877.
[I 2024-12-04 15:16:46,996] Trial 1299 finished with value: 0.15167313498273338 and parameters: {'kernel_type': 'RBF', 'length_scale': 621.2548958697381, 'noise_level': 0.31777600299358955, 'constant_value': 0.03991650300511433, 'nu': 0.5}. Best is trial 750 with value: 0.13435342446039877.
[I 2024-12-04 15:16:48,959] Trial 1322 finished with value: 0.13435440547299354 and parameters: {'kernel_type': 'Matern', 'length_scale': 21.724181520332344, 'noise_level': 0.5821949153817162, 'constant_value': 0.08135306794060317, 'nu': 1.5}. Best is trial 750 with value: 0.13435342446039877.
[I 2024-12-04 15:16:49,817] Trial 1321 finished with value: 0.13435440902638163 and parameters: {'kernel_type': 'Matern', 'length_scale': 1.563202040316592, 'noise_level': 0.05590506939580431, 'constant_value': 944.554004792885, 'nu': 1.5}. Best is trial 750 with value: 0.13435342446039877.
[I 2024-12-04 15:16:49,825] Trial 1323 finished with value: 0.1343543466424564 and parameters: {'kernel_type': 'Matern', 'length_scale': 5.270274163595206, 'noise_level': 0.014707798920127767, 'constant_value': 98589.1486725498, 'nu': 1.5}. Best is trial 750 with value: 0.13435342446039877.
[I 2024-12-04 15:16:49,959] Trial 1314 finished with value: 0.1343543979648399 and parameters: {'kernel_type': 'Matern', 'length_scale': 109.44216471833586, 'noise_level': 0.0024290373579936016, 'constant_value': 501.428548929987, 'nu': 1.5}. Best is trial 750 with value: 0.13435342446039877.
[I 2024-12-04 15:16:50,250] Trial 1313 finished with value: 0.13435442712794643 and parameters: {'kernel_type': 'Matern', 'length_scale': 7.4984196059381985, 'noise_level': 0.00679752795665636, 'constant_value': 211.88612110661373, 'nu': 1.5}. Best is trial 750 with value: 0.13435342446039877.
[I 2024-12-04 15:16:50,866] Trial 1326 finished with value: 1.2693635028538361 and parameters: {'kernel_type': 'Matern', 'length_scale': 8.561767173485989e-05, 'noise_level': 2.7093560008685675e-10, 'constant_value': 0.08351302099279156, 'nu': 2.5}. Best is trial 750 with value: 0.13435342446039877.
[I 2024-12-04 15:16:50,900] Trial 1317 finished with value: 0.13435443370871894 and parameters: {'kernel_type': 'Matern', 'length_scale': 3.9073367089685207, 'noise_level': 0.04504718784902523, 'constant_value': 96870.88058548555, 'nu': 1.5}. Best is trial 750 with value: 0.13435342446039877.
[I 2024-12-04 15:16:51,954] Trial 1325 finished with value: 0.13435439996048915 and parameters: {'kernel_type': 'Matern', 'length_scale': 6.63756624663317, 'noise_level': 0.7695266935918196, 'constant_value': 85932.4083242799, 'nu': 1.5}. Best is trial 750 with value: 0.13435342446039877.
[I 2024-12-04 15:16:52,307] Trial 1319 finished with value: 1.2693635028554229 and parameters: {'kernel_type': 'Matern', 'length_scale': 0.03786880615896535, 'noise_level': 0.0636524379319006, 'constant_value': 1073.3133156026774, 'nu': 1.5}. Best is trial 750 with value: 0.13435342446039877.
[I 2024-12-04 15:16:53,308] Trial 1316 finished with value: 0.13435439385526257 and parameters: {'kernel_type': 'Matern', 'length_scale': 38.07470209632658, 'noise_level': 0.0728638568712508, 'constant_value': 2094.6905081245923, 'nu': 1.5}. Best is trial 750 with value: 0.13435342446039877.
[I 2024-12-04 15:16:53,882] Trial 1308 finished with value: 0.13435440572880405 and parameters: {'kernel_type': 'Matern', 'length_scale': 0.43140084198828926, 'noise_level': 0.9917567904167175, 'constant_value': 16.56464237510992, 'nu': 1.5}. Best is trial 750 with value: 0.13435342446039877.
[I 2024-12-04 15:16:54,321] Trial 1320 finished with value: 1.2984755061428856 and parameters: {'kernel_type': 'Matern', 'length_scale': 0.08433348132430347, 'noise_level': 0.002439698418971998, 'constant_value': 57317.13461229883, 'nu': 1.5}. Best is trial 750 with value: 0.13435342446039877.
[I 2024-12-04 15:16:54,415] Trial 1330 finished with value: 1.3007745973081029 and parameters: {'kernel_type': 'Matern', 'length_scale': 8287.02271000977, 'noise_level': 0.8764686092137773, 'constant_value': 7.201711025347306e-07, 'nu': 2.5}. Best is trial 750 with value: 0.13435342446039877.
[I 2024-12-04 15:16:55,795] Trial 1333 finished with value: 1.3007745978868217 and parameters: {'kernel_type': 'RBF', 'length_scale': 33327.29380147476, 'noise_level': 0.00010527166234853793, 'constant_value': 3.5545964824063623e-06, 'nu': 1.5}. Best is trial 750 with value: 0.13435342446039877.
[I 2024-12-04 15:16:56,615] Trial 1331 finished with value: 0.1343545230818755 and parameters: {'kernel_type': 'Matern', 'length_scale': 323.8279052881707, 'noise_level': 0.005444318447792288, 'constant_value': 759.5791171858092, 'nu': 1.5}. Best is trial 750 with value: 0.13435342446039877.
[I 2024-12-04 15:16:57,105] Trial 1315 finished with value: 0.13435444249578915 and parameters: {'kernel_type': 'Matern', 'length_scale': 28.97790761499879, 'noise_level': 0.03041303708227164, 'constant_value': 83.3903844298745, 'nu': 1.5}. Best is trial 750 with value: 0.13435342446039877.
[I 2024-12-04 15:16:57,513] Trial 1324 finished with value: 0.13435439871306407 and parameters: {'kernel_type': 'Matern', 'length_scale': 69.29373352701354, 'noise_level': 0.052150856682432724, 'constant_value': 2785.9470168895114, 'nu': 1.5}. Best is trial 750 with value: 0.13435342446039877.
[I 2024-12-04 15:16:58,406] Trial 1329 finished with value: 0.17251040027303005 and parameters: {'kernel_type': 'Matern', 'length_scale': 76.21303344379147, 'noise_level': 0.0004450074184910132, 'constant_value': 732.216363659383, 'nu': 0.5}. Best is trial 750 with value: 0.13435342446039877.
[I 2024-12-04 15:16:59,165] Trial 1327 finished with value: 0.13435390923061008 and parameters: {'kernel_type': 'Matern', 'length_scale': 37.883674641863735, 'noise_level': 0.01156569355264493, 'constant_value': 1727.309461193427, 'nu': 1.5}. Best is trial 750 with value: 0.13435342446039877.
[I 2024-12-04 15:17:01,731] Trial 1335 finished with value: 0.13435440205084367 and parameters: {'kernel_type': 'Matern', 'length_scale': 5.43065996742134, 'noise_level': 0.0030480545625601488, 'constant_value': 1991.6276605949095, 'nu': 1.5}. Best is trial 750 with value: 0.13435342446039877.
[I 2024-12-04 15:17:01,738] Trial 1332 finished with value: 0.13435440485570943 and parameters: {'kernel_type': 'Matern', 'length_scale': 73.09465228995755, 'noise_level': 0.022998661192158414, 'constant_value': 20.31388132236561, 'nu': 1.5}. Best is trial 750 with value: 0.13435342446039877.
[I 2024-12-04 15:17:02,608] Trial 1337 finished with value: 0.13435440453169803 and parameters: {'kernel_type': 'Matern', 'length_scale': 53.79383410753228, 'noise_level': 0.0262066660201162, 'constant_value': 2338.088861027065, 'nu': 1.5}. Best is trial 750 with value: 0.13435342446039877.
[I 2024-12-04 15:17:05,851] Trial 1328 finished with value: 0.15167297432255375 and parameters: {'kernel_type': 'RBF', 'length_scale': 39.28079651828178, 'noise_level': 0.11149872385062877, 'constant_value': 1.7403955958615172, 'nu': 1.5}. Best is trial 750 with value: 0.13435342446039877.
[I 2024-12-04 15:17:07,995] Trial 1339 finished with value: 0.14859827174606285 and parameters: {'kernel_type': 'Matern', 'length_scale': 22.317461909919473, 'noise_level': 0.2228953936410361, 'constant_value': 40625.45864548562, 'nu': 2.5}. Best is trial 750 with value: 0.13435342446039877.
