[I 2024-12-04 13:48:21,405] Trial 2383 finished with value: 0.22180510556077437 and parameters: {'n_estimators': 1468, 'learning_rate': 0.09390718438472372, 'max_depth': 12, 'min_samples_split': 15, 'min_samples_leaf': 1, 'subsample': 0.774570828290694, 'max_features': 'sqrt'}. Best is trial 1137 with value: 0.19687116000636118.
[I 2024-12-04 13:48:26,933] Trial 2389 finished with value: 0.29540833997393334 and parameters: {'n_estimators': 1203, 'learning_rate': 0.023474508167678546, 'max_depth': 5, 'min_samples_split': 13, 'min_samples_leaf': 1, 'subsample': 0.7915950432189666, 'max_features': None}. Best is trial 1137 with value: 0.19687116000636118.
[I 2024-12-04 13:48:26,950] Trial 2397 finished with value: 0.4098442774448411 and parameters: {'n_estimators': 973, 'learning_rate': 0.06646209603671473, 'max_depth': 4, 'min_samples_split': 12, 'min_samples_leaf': 9, 'subsample': 0.8535139063931723, 'max_features': 'sqrt'}. Best is trial 1137 with value: 0.19687116000636118.
[I 2024-12-04 13:48:32,939] Trial 2414 finished with value: 0.5579502418885819 and parameters: {'n_estimators': 328, 'learning_rate': 0.01524621988388352, 'max_depth': 8, 'min_samples_split': 9, 'min_samples_leaf': 10, 'subsample': 0.9678640111361781, 'max_features': 'sqrt'}. Best is trial 1137 with value: 0.19687116000636118.
[I 2024-12-04 13:48:33,871] Trial 2398 finished with value: 0.2666224118963049 and parameters: {'n_estimators': 819, 'learning_rate': 0.05728923001540138, 'max_depth': 10, 'min_samples_split': 20, 'min_samples_leaf': 3, 'subsample': 0.6468549547184052, 'max_features': None}. Best is trial 1137 with value: 0.19687116000636118.
[I 2024-12-04 13:48:35,491] Trial 2387 finished with value: 0.2323890851237014 and parameters: {'n_estimators': 1478, 'learning_rate': 0.05024510353745988, 'max_depth': 9, 'min_samples_split': 16, 'min_samples_leaf': 1, 'subsample': 0.6021891868312479, 'max_features': 'sqrt'}. Best is trial 1137 with value: 0.19687116000636118.
[I 2024-12-04 13:48:35,503] Trial 2392 finished with value: 0.2348706754577868 and parameters: {'n_estimators': 1378, 'learning_rate': 0.09580045940619081, 'max_depth': 12, 'min_samples_split': 16, 'min_samples_leaf': 2, 'subsample': 0.7018013424323628, 'max_features': 'sqrt'}. Best is trial 1137 with value: 0.19687116000636118.
[I 2024-12-04 13:48:38,106] Trial 2388 finished with value: 0.21963235433153713 and parameters: {'n_estimators': 1468, 'learning_rate': 0.0900234163842898, 'max_depth': 11, 'min_samples_split': 20, 'min_samples_leaf': 1, 'subsample': 0.7560635310545336, 'max_features': 'sqrt'}. Best is trial 1137 with value: 0.19687116000636118.
[I 2024-12-04 13:48:38,110] Trial 2390 finished with value: 0.21881061150145487 and parameters: {'n_estimators': 1298, 'learning_rate': 0.09621636980312458, 'max_depth': 11, 'min_samples_split': 19, 'min_samples_leaf': 1, 'subsample': 0.6029673387746258, 'max_features': 'sqrt'}. Best is trial 1137 with value: 0.19687116000636118.
[I 2024-12-04 13:48:45,202] Trial 2408 finished with value: 0.6643096161777527 and parameters: {'n_estimators': 732, 'learning_rate': 0.017358649583371046, 'max_depth': 5, 'min_samples_split': 9, 'min_samples_leaf': 8, 'subsample': 0.7908109302184573, 'max_features': 'log2'}. Best is trial 1137 with value: 0.19687116000636118.
[I 2024-12-04 13:48:48,164] Trial 2393 finished with value: 0.2511471038890288 and parameters: {'n_estimators': 1475, 'learning_rate': 0.09651130418771292, 'max_depth': 12, 'min_samples_split': 20, 'min_samples_leaf': 2, 'subsample': 0.8337805761370916, 'max_features': 'sqrt'}. Best is trial 1137 with value: 0.19687116000636118.
[I 2024-12-04 13:48:49,820] Trial 2395 finished with value: 0.2626808096043061 and parameters: {'n_estimators': 1426, 'learning_rate': 0.08193610033054032, 'max_depth': 8, 'min_samples_split': 19, 'min_samples_leaf': 3, 'subsample': 0.7459639264812125, 'max_features': 'sqrt'}. Best is trial 1137 with value: 0.19687116000636118.
[I 2024-12-04 13:48:51,482] Trial 2402 finished with value: 0.24365350768758243 and parameters: {'n_estimators': 1228, 'learning_rate': 0.08583150365375684, 'max_depth': 12, 'min_samples_split': 20, 'min_samples_leaf': 3, 'subsample': 0.6107350491362533, 'max_features': 'sqrt'}. Best is trial 1137 with value: 0.19687116000636118.
[I 2024-12-04 13:48:54,280] Trial 2399 finished with value: 0.23397909802826078 and parameters: {'n_estimators': 1353, 'learning_rate': 0.09609043659670358, 'max_depth': 12, 'min_samples_split': 16, 'min_samples_leaf': 2, 'subsample': 0.6912566885147176, 'max_features': 'sqrt'}. Best is trial 1137 with value: 0.19687116000636118.
[I 2024-12-04 13:48:54,744] Trial 2416 finished with value: 0.2941588803544367 and parameters: {'n_estimators': 514, 'learning_rate': 0.035757676080002, 'max_depth': 12, 'min_samples_split': 2, 'min_samples_leaf': 2, 'subsample': 0.6939876462556696, 'max_features': None}. Best is trial 1137 with value: 0.19687116000636118.
[I 2024-12-04 13:48:56,512] Trial 2396 finished with value: 0.22149846181597205 and parameters: {'n_estimators': 1376, 'learning_rate': 0.09750530854661868, 'max_depth': 11, 'min_samples_split': 17, 'min_samples_leaf': 1, 'subsample': 0.7688240138990957, 'max_features': 'sqrt'}. Best is trial 1137 with value: 0.19687116000636118.
[I 2024-12-04 13:49:00,447] Trial 2400 finished with value: 0.22066206416502232 and parameters: {'n_estimators': 1381, 'learning_rate': 0.08520003971169493, 'max_depth': 12, 'min_samples_split': 20, 'min_samples_leaf': 1, 'subsample': 0.8073279513225271, 'max_features': 'sqrt'}. Best is trial 1137 with value: 0.19687116000636118.
[I 2024-12-04 13:49:02,456] Trial 2401 finished with value: 0.21775574692277372 and parameters: {'n_estimators': 1431, 'learning_rate': 0.09763756094059425, 'max_depth': 12, 'min_samples_split': 19, 'min_samples_leaf': 1, 'subsample': 0.6116142355210404, 'max_features': 'sqrt'}. Best is trial 1137 with value: 0.19687116000636118.
[I 2024-12-04 13:49:03,363] Trial 2412 finished with value: 0.37013766062041115 and parameters: {'n_estimators': 849, 'learning_rate': 0.01901648188497244, 'max_depth': 8, 'min_samples_split': 11, 'min_samples_leaf': 1, 'subsample': 0.7871817590167145, 'max_features': 'log2'}. Best is trial 1137 with value: 0.19687116000636118.
[I 2024-12-04 13:49:03,402] Trial 2404 finished with value: 0.23986213991104144 and parameters: {'n_estimators': 1334, 'learning_rate': 0.09988160753489936, 'max_depth': 12, 'min_samples_split': 19, 'min_samples_leaf': 3, 'subsample': 0.692907940594584, 'max_features': 'sqrt'}. Best is trial 1137 with value: 0.19687116000636118.
[I 2024-12-04 13:49:04,539] Trial 2405 finished with value: 0.3501966152285591 and parameters: {'n_estimators': 1326, 'learning_rate': 0.05875927980986531, 'max_depth': 3, 'min_samples_split': 6, 'min_samples_leaf': 6, 'subsample': 0.9636361783135349, 'max_features': 'sqrt'}. Best is trial 1137 with value: 0.19687116000636118.
[I 2024-12-04 13:49:08,860] Trial 2415 finished with value: 0.6621668611363744 and parameters: {'n_estimators': 894, 'learning_rate': 0.014206620529008182, 'max_depth': 12, 'min_samples_split': 20, 'min_samples_leaf': 10, 'subsample': 0.9738150661186464, 'max_features': 'log2'}. Best is trial 1137 with value: 0.19687116000636118.
[I 2024-12-04 13:49:14,132] Trial 2423 finished with value: 0.3314836598217459 and parameters: {'n_estimators': 670, 'learning_rate': 0.06253694280891584, 'max_depth': 5, 'min_samples_split': 9, 'min_samples_leaf': 1, 'subsample': 0.6917342921060821, 'max_features': 'log2'}. Best is trial 1137 with value: 0.19687116000636118.
[I 2024-12-04 13:49:15,601] Trial 2407 finished with value: 0.22678923622757763 and parameters: {'n_estimators': 1453, 'learning_rate': 0.0880435165465116, 'max_depth': 12, 'min_samples_split': 15, 'min_samples_leaf': 1, 'subsample': 0.7061056978594229, 'max_features': 'log2'}. Best is trial 1137 with value: 0.19687116000636118.
[I 2024-12-04 13:49:21,105] Trial 2431 finished with value: 0.3349323670734573 and parameters: {'n_estimators': 504, 'learning_rate': 0.03617236770670586, 'max_depth': 6, 'min_samples_split': 12, 'min_samples_leaf': 4, 'subsample': 0.9231565244588327, 'max_features': 'sqrt'}. Best is trial 1137 with value: 0.19687116000636118.
[I 2024-12-04 13:49:22,243] Trial 2410 finished with value: 0.23222730989481888 and parameters: {'n_estimators': 1284, 'learning_rate': 0.09058110993608108, 'max_depth': 12, 'min_samples_split': 20, 'min_samples_leaf': 1, 'subsample': 0.6276309440089193, 'max_features': 'log2'}. Best is trial 1137 with value: 0.19687116000636118.
[I 2024-12-04 13:49:23,457] Trial 2411 finished with value: 0.24483126808627065 and parameters: {'n_estimators': 1262, 'learning_rate': 0.07983284600603804, 'max_depth': 10, 'min_samples_split': 18, 'min_samples_leaf': 2, 'subsample': 0.6015832865059287, 'max_features': 'sqrt'}. Best is trial 1137 with value: 0.19687116000636118.
[I 2024-12-04 13:49:25,218] Trial 2424 finished with value: 0.33848655824552065 and parameters: {'n_estimators': 835, 'learning_rate': 0.020505277656392422, 'max_depth': 9, 'min_samples_split': 12, 'min_samples_leaf': 5, 'subsample': 0.7339758992628217, 'max_features': 'sqrt'}. Best is trial 1137 with value: 0.19687116000636118.
[I 2024-12-04 13:49:30,599] Trial 2409 finished with value: 0.23817684124315863 and parameters: {'n_estimators': 1434, 'learning_rate': 0.0987663004189197, 'max_depth': 10, 'min_samples_split': 20, 'min_samples_leaf': 2, 'subsample': 0.7615853804545838, 'max_features': 'sqrt'}. Best is trial 1137 with value: 0.19687116000636118.
[I 2024-12-04 13:49:32,265] Trial 2444 finished with value: 0.6743592703672951 and parameters: {'n_estimators': 172, 'learning_rate': 0.062435143262905786, 'max_depth': 11, 'min_samples_split': 8, 'min_samples_leaf': 8, 'subsample': 0.9510139087013673, 'max_features': 'log2'}. Best is trial 1137 with value: 0.19687116000636118.
[I 2024-12-04 13:49:38,481] Trial 2413 finished with value: 0.3758438609943916 and parameters: {'n_estimators': 1430, 'learning_rate': 0.031629308514149225, 'max_depth': 10, 'min_samples_split': 20, 'min_samples_leaf': 8, 'subsample': 0.8669549204287185, 'max_features': 'sqrt'}. Best is trial 1137 with value: 0.19687116000636118.
[I 2024-12-04 13:49:42,300] Trial 2417 finished with value: 0.25869188601892623 and parameters: {'n_estimators': 1313, 'learning_rate': 0.09577546048631716, 'max_depth': 12, 'min_samples_split': 18, 'min_samples_leaf': 2, 'subsample': 0.7365449716839882, 'max_features': 'sqrt'}. Best is trial 1137 with value: 0.19687116000636118.
[I 2024-12-04 13:49:44,712] Trial 2450 finished with value: 0.9483639876734513 and parameters: {'n_estimators': 149, 'learning_rate': 0.010744252121148498, 'max_depth': 3, 'min_samples_split': 7, 'min_samples_leaf': 8, 'subsample': 0.6375768076483792, 'max_features': 'log2'}. Best is trial 1137 with value: 0.19687116000636118.
[I 2024-12-04 13:49:54,018] Trial 2436 finished with value: 0.41259169841514487 and parameters: {'n_estimators': 832, 'learning_rate': 0.07047451943457873, 'max_depth': 7, 'min_samples_split': 4, 'min_samples_leaf': 9, 'subsample': 0.6591943008812579, 'max_features': 'sqrt'}. Best is trial 1137 with value: 0.19687116000636118.
[I 2024-12-04 13:49:56,196] Trial 2418 finished with value: 0.22237946609429418 and parameters: {'n_estimators': 1487, 'learning_rate': 0.09155204754684483, 'max_depth': 11, 'min_samples_split': 20, 'min_samples_leaf': 1, 'subsample': 0.6865036544725909, 'max_features': 'sqrt'}. Best is trial 1137 with value: 0.19687116000636118.
[I 2024-12-04 13:49:58,890] Trial 2429 finished with value: 0.2578413099854535 and parameters: {'n_estimators': 1155, 'learning_rate': 0.07307263901024796, 'max_depth': 8, 'min_samples_split': 12, 'min_samples_leaf': 4, 'subsample': 0.6080608524987008, 'max_features': 'sqrt'}. Best is trial 1137 with value: 0.19687116000636118.
[I 2024-12-04 13:50:00,526] Trial 2420 finished with value: 0.2507829606112904 and parameters: {'n_estimators': 1491, 'learning_rate': 0.0858333058927307, 'max_depth': 12, 'min_samples_split': 18, 'min_samples_leaf': 2, 'subsample': 0.7854818716691948, 'max_features': 'sqrt'}. Best is trial 1137 with value: 0.19687116000636118.
[I 2024-12-04 13:50:01,603] Trial 2421 finished with value: 0.22661172554027495 and parameters: {'n_estimators': 1486, 'learning_rate': 0.07840301824085383, 'max_depth': 12, 'min_samples_split': 20, 'min_samples_leaf': 1, 'subsample': 0.7148138703192507, 'max_features': 'sqrt'}. Best is trial 1137 with value: 0.19687116000636118.
[I 2024-12-04 13:50:03,047] Trial 2422 finished with value: 0.24167596978167002 and parameters: {'n_estimators': 1490, 'learning_rate': 0.09809845004120024, 'max_depth': 10, 'min_samples_split': 14, 'min_samples_leaf': 2, 'subsample': 0.7024534846471953, 'max_features': 'sqrt'}. Best is trial 1137 with value: 0.19687116000636118.
[I 2024-12-04 13:50:04,303] Trial 2419 finished with value: 0.2868452095189975 and parameters: {'n_estimators': 1400, 'learning_rate': 0.011085056577098924, 'max_depth': 10, 'min_samples_split': 19, 'min_samples_leaf': 2, 'subsample': 0.7877972510281968, 'max_features': None}. Best is trial 1137 with value: 0.19687116000636118.
[I 2024-12-04 13:50:04,664] Trial 2428 finished with value: 0.22689016473326898 and parameters: {'n_estimators': 1270, 'learning_rate': 0.09900000165186584, 'max_depth': 9, 'min_samples_split': 20, 'min_samples_leaf': 1, 'subsample': 0.6317881575508392, 'max_features': 'sqrt'}. Best is trial 1137 with value: 0.19687116000636118.
[I 2024-12-04 13:50:11,416] Trial 2425 finished with value: 0.24666244061832682 and parameters: {'n_estimators': 1480, 'learning_rate': 0.09910979056690367, 'max_depth': 10, 'min_samples_split': 18, 'min_samples_leaf': 3, 'subsample': 0.6738434230036985, 'max_features': 'sqrt'}. Best is trial 1137 with value: 0.19687116000636118.
[I 2024-12-04 13:50:13,571] Trial 2427 finished with value: 0.20367045843090548 and parameters: {'n_estimators': 1401, 'learning_rate': 0.08888602638457559, 'max_depth': 12, 'min_samples_split': 16, 'min_samples_leaf': 1, 'subsample': 0.6097008860680493, 'max_features': 'sqrt'}. Best is trial 1137 with value: 0.19687116000636118.
[I 2024-12-04 13:50:15,425] Trial 2432 finished with value: 0.2110737490690285 and parameters: {'n_estimators': 1308, 'learning_rate': 0.09607230876176912, 'max_depth': 10, 'min_samples_split': 16, 'min_samples_leaf': 1, 'subsample': 0.7149125132472561, 'max_features': 'sqrt'}. Best is trial 1137 with value: 0.19687116000636118.
[I 2024-12-04 13:50:19,717] Trial 2426 finished with value: 0.27979925004828476 and parameters: {'n_estimators': 1440, 'learning_rate': 0.03543216609152161, 'max_depth': 8, 'min_samples_split': 20, 'min_samples_leaf': 2, 'subsample': 0.6707791910212819, 'max_features': None}. Best is trial 1137 with value: 0.19687116000636118.
[I 2024-12-04 13:50:21,814] Trial 2430 finished with value: 0.21903319412060615 and parameters: {'n_estimators': 1470, 'learning_rate': 0.06690272730210352, 'max_depth': 12, 'min_samples_split': 17, 'min_samples_leaf': 1, 'subsample': 0.6940752002504165, 'max_features': 'sqrt'}. Best is trial 1137 with value: 0.19687116000636118.
[I 2024-12-04 13:50:25,740] Trial 2433 finished with value: 0.21042252319281932 and parameters: {'n_estimators': 1438, 'learning_rate': 0.06333049046592103, 'max_depth': 12, 'min_samples_split': 19, 'min_samples_leaf': 1, 'subsample': 0.6051061241683677, 'max_features': 'sqrt'}. Best is trial 1137 with value: 0.19687116000636118.
[I 2024-12-04 13:50:29,801] Trial 2434 finished with value: 0.24821386479909757 and parameters: {'n_estimators': 1447, 'learning_rate': 0.09932550891249986, 'max_depth': 12, 'min_samples_split': 20, 'min_samples_leaf': 3, 'subsample': 0.7678364174907517, 'max_features': 'sqrt'}. Best is trial 1137 with value: 0.19687116000636118.
[I 2024-12-04 13:50:29,902] Trial 2441 finished with value: 0.2413448630751981 and parameters: {'n_estimators': 1165, 'learning_rate': 0.09964150970066923, 'max_depth': 7, 'min_samples_split': 20, 'min_samples_leaf': 1, 'subsample': 0.693114001313469, 'max_features': 'sqrt'}. Best is trial 1137 with value: 0.19687116000636118.
[I 2024-12-04 13:50:37,026] Trial 2435 finished with value: 0.20962139462221455 and parameters: {'n_estimators': 1486, 'learning_rate': 0.08457668115747985, 'max_depth': 12, 'min_samples_split': 17, 'min_samples_leaf': 1, 'subsample': 0.6979992224913056, 'max_features': 'sqrt'}. Best is trial 1137 with value: 0.19687116000636118.
[I 2024-12-04 13:50:37,149] Trial 2468 finished with value: 0.8279052860516138 and parameters: {'n_estimators': 130, 'learning_rate': 0.018099316107069476, 'max_depth': 7, 'min_samples_split': 13, 'min_samples_leaf': 6, 'subsample': 0.9644560841722756, 'max_features': 'log2'}. Best is trial 1137 with value: 0.19687116000636118.
[I 2024-12-04 13:50:38,726] Trial 2442 finished with value: 0.22631664089254314 and parameters: {'n_estimators': 1301, 'learning_rate': 0.09868493143407941, 'max_depth': 7, 'min_samples_split': 19, 'min_samples_leaf': 1, 'subsample': 0.6903099929021597, 'max_features': 'sqrt'}. Best is trial 1137 with value: 0.19687116000636118.
[I 2024-12-04 13:50:40,525] Trial 2437 finished with value: 0.2059570105879231 and parameters: {'n_estimators': 1483, 'learning_rate': 0.09853891235659516, 'max_depth': 10, 'min_samples_split': 17, 'min_samples_leaf': 1, 'subsample': 0.6242736576300795, 'max_features': 'sqrt'}. Best is trial 1137 with value: 0.19687116000636118.
[I 2024-12-04 13:50:41,984] Trial 2443 finished with value: 0.2200003791210345 and parameters: {'n_estimators': 1244, 'learning_rate': 0.09903000147702326, 'max_depth': 11, 'min_samples_split': 18, 'min_samples_leaf': 1, 'subsample': 0.7738697736664043, 'max_features': 'sqrt'}. Best is trial 1137 with value: 0.19687116000636118.
[I 2024-12-04 13:50:45,600] Trial 2438 finished with value: 0.3094591372880269 and parameters: {'n_estimators': 1498, 'learning_rate': 0.0764789772955141, 'max_depth': 9, 'min_samples_split': 2, 'min_samples_leaf': 6, 'subsample': 0.9271530987560863, 'max_features': 'sqrt'}. Best is trial 1137 with value: 0.19687116000636118.
[I 2024-12-04 13:50:48,442] Trial 2439 finished with value: 0.21053569584902118 and parameters: {'n_estimators': 1438, 'learning_rate': 0.09732287543720695, 'max_depth': 11, 'min_samples_split': 14, 'min_samples_leaf': 1, 'subsample': 0.6057440483228529, 'max_features': 'sqrt'}. Best is trial 1137 with value: 0.19687116000636118.
[I 2024-12-04 13:50:48,461] Trial 2440 finished with value: 0.24688225231903138 and parameters: {'n_estimators': 1450, 'learning_rate': 0.09974574536978616, 'max_depth': 10, 'min_samples_split': 20, 'min_samples_leaf': 3, 'subsample': 0.6536389082322995, 'max_features': 'sqrt'}. Best is trial 1137 with value: 0.19687116000636118.
[I 2024-12-04 13:50:54,779] Trial 2446 finished with value: 0.2163811136978894 and parameters: {'n_estimators': 1360, 'learning_rate': 0.0965644318857255, 'max_depth': 12, 'min_samples_split': 15, 'min_samples_leaf': 1, 'subsample': 0.7437099497322603, 'max_features': 'sqrt'}. Best is trial 1137 with value: 0.19687116000636118.
[I 2024-12-04 13:50:57,267] Trial 2451 finished with value: 0.21325662327777578 and parameters: {'n_estimators': 1248, 'learning_rate': 0.09393867925083213, 'max_depth': 9, 'min_samples_split': 13, 'min_samples_leaf': 1, 'subsample': 0.6696666571494647, 'max_features': 'sqrt'}. Best is trial 1137 with value: 0.19687116000636118.
[I 2024-12-04 13:50:57,421] Trial 2445 finished with value: 0.2122838645589603 and parameters: {'n_estimators': 1480, 'learning_rate': 0.09060854024261189, 'max_depth': 12, 'min_samples_split': 17, 'min_samples_leaf': 1, 'subsample': 0.6743016727442755, 'max_features': 'sqrt'}. Best is trial 1137 with value: 0.19687116000636118.
[I 2024-12-04 13:51:03,443] Trial 2447 finished with value: 0.22389495623906097 and parameters: {'n_estimators': 1479, 'learning_rate': 0.06937483665581048, 'max_depth': 10, 'min_samples_split': 16, 'min_samples_leaf': 1, 'subsample': 0.6020355406996187, 'max_features': 'sqrt'}. Best is trial 1137 with value: 0.19687116000636118.
[I 2024-12-04 13:51:03,447] Trial 2448 finished with value: 0.23183595743855895 and parameters: {'n_estimators': 1463, 'learning_rate': 0.06912331544702517, 'max_depth': 8, 'min_samples_split': 16, 'min_samples_leaf': 1, 'subsample': 0.722737697851283, 'max_features': 'sqrt'}. Best is trial 1137 with value: 0.19687116000636118.
[I 2024-12-04 13:51:05,845] Trial 2466 finished with value: 0.5404719751660356 and parameters: {'n_estimators': 654, 'learning_rate': 0.010985811483004742, 'max_depth': 10, 'min_samples_split': 11, 'min_samples_leaf': 9, 'subsample': 0.6549632185045197, 'max_features': 'sqrt'}. Best is trial 1137 with value: 0.19687116000636118.
[I 2024-12-04 13:51:08,149] Trial 2449 finished with value: 0.2313844191584431 and parameters: {'n_estimators': 1481, 'learning_rate': 0.06227281732077607, 'max_depth': 10, 'min_samples_split': 15, 'min_samples_leaf': 1, 'subsample': 0.7438586008658972, 'max_features': 'sqrt'}. Best is trial 1137 with value: 0.19687116000636118.
[I 2024-12-04 13:51:14,139] Trial 2452 finished with value: 0.20650884967887662 and parameters: {'n_estimators': 1442, 'learning_rate': 0.09454340918199344, 'max_depth': 11, 'min_samples_split': 20, 'min_samples_leaf': 1, 'subsample': 0.6150764507005343, 'max_features': 'sqrt'}. Best is trial 1137 with value: 0.19687116000636118.
[I 2024-12-04 13:51:16,488] Trial 2459 finished with value: 0.2473884191122432 and parameters: {'n_estimators': 1032, 'learning_rate': 0.09639556957242984, 'max_depth': 11, 'min_samples_split': 20, 'min_samples_leaf': 3, 'subsample': 0.620196036221659, 'max_features': 'sqrt'}. Best is trial 1137 with value: 0.19687116000636118.
