[I 2024-12-04 21:12:55,998] Trial 2050 finished with value: 0.14249505677345092 and parameters: {'kernel_type': 'Matern', 'length_scale': 2.9454615772776456, 'noise_level': 0.9216871779228023, 'constant_value': 57.03225606810162, 'nu': 1.5}. Best is trial 959 with value: 0.1375110730946576.
[I 2024-12-04 21:13:00,395] Trial 2051 finished with value: 0.9864686819208189 and parameters: {'kernel_type': 'Matern', 'length_scale': 51.1823765512018, 'noise_level': 0.019303976475374785, 'constant_value': 0.07784889062623059, 'nu': 1.5}. Best is trial 959 with value: 0.1375110730946576.
[I 2024-12-04 21:13:02,996] Trial 2052 finished with value: 0.9864686819584737 and parameters: {'kernel_type': 'Matern', 'length_scale': 2767.5540019940645, 'noise_level': 0.013375815242651747, 'constant_value': 0.36086698257431815, 'nu': 1.5}. Best is trial 959 with value: 0.1375110730946576.
[I 2024-12-04 21:13:03,286] Trial 2053 finished with value: 0.9864686819255971 and parameters: {'kernel_type': 'Matern', 'length_scale': 3924.4292791311586, 'noise_level': 0.04019320799892586, 'constant_value': 26.240731613671375, 'nu': 1.5}. Best is trial 959 with value: 0.1375110730946576.
[I 2024-12-04 21:13:10,210] Trial 2056 finished with value: 0.1424950803915254 and parameters: {'kernel_type': 'Matern', 'length_scale': 151.56368261651764, 'noise_level': 0.963731663360099, 'constant_value': 2.0574901141189605, 'nu': 1.5}. Best is trial 959 with value: 0.1375110730946576.
[I 2024-12-04 21:13:10,504] Trial 2054 finished with value: 0.14249551843633448 and parameters: {'kernel_type': 'Matern', 'length_scale': 0.1289538585369772, 'noise_level': 0.9401849894715343, 'constant_value': 14892.353390507247, 'nu': 1.5}. Best is trial 959 with value: 0.1375110730946576.
[I 2024-12-04 21:13:10,833] Trial 2055 finished with value: 0.1424950442068208 and parameters: {'kernel_type': 'Matern', 'length_scale': 0.49871719474747195, 'noise_level': 0.851552580067768, 'constant_value': 8.09494272591159, 'nu': 1.5}. Best is trial 959 with value: 0.1375110730946576.
[I 2024-12-04 21:13:13,874] Trial 2057 finished with value: 0.9864686818378688 and parameters: {'kernel_type': 'Matern', 'length_scale': 0.0036815406968966754, 'noise_level': 0.015385440633429911, 'constant_value': 213.09709276171162, 'nu': 1.5}. Best is trial 959 with value: 0.1375110730946576.
[I 2024-12-04 21:13:18,542] Trial 2058 finished with value: 0.14249517498977785 and parameters: {'kernel_type': 'Matern', 'length_scale': 1.1039983111068958, 'noise_level': 0.024376028068005807, 'constant_value': 37.35730836979011, 'nu': 1.5}. Best is trial 959 with value: 0.1375110730946576.
[I 2024-12-04 21:13:18,649] Trial 2059 finished with value: 0.9864686819225272 and parameters: {'kernel_type': 'Matern', 'length_scale': 58.072065203048815, 'noise_level': 0.017654772333186082, 'constant_value': 0.2828033346839608, 'nu': 1.5}. Best is trial 959 with value: 0.1375110730946576.
[I 2024-12-04 21:13:19,662] Trial 2060 finished with value: 0.1446988574688739 and parameters: {'kernel_type': 'Matern', 'length_scale': 3.3003662045797872, 'noise_level': 0.7623859220513249, 'constant_value': 486.60246127654614, 'nu': 2.5}. Best is trial 959 with value: 0.1375110730946576.
[I 2024-12-04 21:13:26,152] Trial 2061 finished with value: 0.14249506336675746 and parameters: {'kernel_type': 'Matern', 'length_scale': 422.4548182747458, 'noise_level': 0.8315505206618676, 'constant_value': 27.469171600749835, 'nu': 1.5}. Best is trial 959 with value: 0.1375110730946576.
[I 2024-12-04 21:13:26,975] Trial 2063 finished with value: 0.9864686819367272 and parameters: {'kernel_type': 'RBF', 'length_scale': 13.559022312531816, 'noise_level': 2.1233114404800993e-05, 'constant_value': 2.5183138668001535, 'nu': 2.5}. Best is trial 959 with value: 0.1375110730946576.
[I 2024-12-04 21:13:31,795] Trial 2062 finished with value: 0.14249504632482096 and parameters: {'kernel_type': 'Matern', 'length_scale': 5.165719124034494, 'noise_level': 0.9116845198028655, 'constant_value': 1046.403604113645, 'nu': 1.5}. Best is trial 959 with value: 0.1375110730946576.
[I 2024-12-04 21:13:31,807] Trial 2064 finished with value: 0.9982171087489948 and parameters: {'kernel_type': 'Matern', 'length_scale': 19421.18953202408, 'noise_level': 0.54619874099986, 'constant_value': 0.7214788054104807, 'nu': 1.5}. Best is trial 959 with value: 0.1375110730946576.
[I 2024-12-04 21:13:32,884] Trial 2065 finished with value: 0.14249506194156009 and parameters: {'kernel_type': 'Matern', 'length_scale': 264.87251162837293, 'noise_level': 0.7710517936825285, 'constant_value': 230.34053888428355, 'nu': 1.5}. Best is trial 959 with value: 0.1375110730946576.
[I 2024-12-04 21:13:37,870] Trial 2067 finished with value: 0.14249490454377592 and parameters: {'kernel_type': 'Matern', 'length_scale': 0.9897373789490443, 'noise_level': 0.8782628318002413, 'constant_value': 0.015475295421254085, 'nu': 1.5}. Best is trial 959 with value: 0.1375110730946576.
[I 2024-12-04 21:13:38,309] Trial 2066 finished with value: 0.19720004881778516 and parameters: {'kernel_type': 'Matern', 'length_scale': 40.52147601696976, 'noise_level': 0.11892013784476847, 'constant_value': 0.0006112572068235878, 'nu': 0.5}. Best is trial 959 with value: 0.1375110730946576.
[I 2024-12-04 21:13:38,700] Trial 2068 finished with value: 0.14249477093833854 and parameters: {'kernel_type': 'Matern', 'length_scale': 60.271691229575346, 'noise_level': 0.07045964169985708, 'constant_value': 83.13672543799522, 'nu': 1.5}. Best is trial 959 with value: 0.1375110730946576.
[I 2024-12-04 21:13:45,126] Trial 2071 finished with value: 0.14249506286071756 and parameters: {'kernel_type': 'Matern', 'length_scale': 4.3092511206612825, 'noise_level': 0.036728918113214465, 'constant_value': 12.805978358203191, 'nu': 1.5}. Best is trial 959 with value: 0.1375110730946576.
[I 2024-12-04 21:13:45,286] Trial 2070 finished with value: 0.1424950617964966 and parameters: {'kernel_type': 'Matern', 'length_scale': 4.2282407774178825, 'noise_level': 0.05024845247735394, 'constant_value': 219.40090191265395, 'nu': 1.5}. Best is trial 959 with value: 0.1375110730946576.
[I 2024-12-04 21:13:46,804] Trial 2069 finished with value: 0.14249506221637603 and parameters: {'kernel_type': 'Matern', 'length_scale': 67.58944204465632, 'noise_level': 0.898513909342316, 'constant_value': 0.26467929082594166, 'nu': 1.5}. Best is trial 959 with value: 0.1375110730946576.
[I 2024-12-04 21:13:52,336] Trial 2072 finished with value: 0.14249506672173992 and parameters: {'kernel_type': 'Matern', 'length_scale': 0.33353010504265146, 'noise_level': 0.9288141124783141, 'constant_value': 4750.09336039116, 'nu': 1.5}. Best is trial 959 with value: 0.1375110730946576.
[I 2024-12-04 21:13:53,092] Trial 2073 finished with value: 0.14249504240943486 and parameters: {'kernel_type': 'Matern', 'length_scale': 960.1633728157722, 'noise_level': 0.9791591158463538, 'constant_value': 5.790821000439225, 'nu': 1.5}. Best is trial 959 with value: 0.1375110730946576.
[I 2024-12-04 21:13:53,863] Trial 2074 finished with value: 0.14249503107243633 and parameters: {'kernel_type': 'Matern', 'length_scale': 18.172824453022795, 'noise_level': 0.03250413741959389, 'constant_value': 0.8792880590789894, 'nu': 1.5}. Best is trial 959 with value: 0.1375110730946576.
[I 2024-12-04 21:13:58,542] Trial 2075 finished with value: 0.1972000278262157 and parameters: {'kernel_type': 'Matern', 'length_scale': 24.604295876794303, 'noise_level': 0.7441319838105613, 'constant_value': 69.46737257587856, 'nu': 0.5}. Best is trial 959 with value: 0.1375110730946576.
[I 2024-12-04 21:14:04,808] Trial 2078 finished with value: 0.9864686819667267 and parameters: {'kernel_type': 'Matern', 'length_scale': 0.04270968439441146, 'noise_level': 0.9855783931442218, 'constant_value': 1.6395609350696367, 'nu': 1.5}. Best is trial 959 with value: 0.1375110730946576.
[I 2024-12-04 21:14:05,168] Trial 2076 finished with value: 0.9864686819186216 and parameters: {'kernel_type': 'Matern', 'length_scale': 408.43807056793526, 'noise_level': 0.01849381186498581, 'constant_value': 6.515293304779936, 'nu': 1.5}. Best is trial 959 with value: 0.1375110730946576.
[I 2024-12-04 21:14:10,698] Trial 2077 finished with value: 0.1424948757843155 and parameters: {'kernel_type': 'Matern', 'length_scale': 39.437103570998495, 'noise_level': 0.022348694874544453, 'constant_value': 0.550810645179765, 'nu': 1.5}. Best is trial 959 with value: 0.1375110730946576.
[I 2024-12-04 21:14:11,085] Trial 2080 finished with value: 0.14469885608138136 and parameters: {'kernel_type': 'Matern', 'length_scale': 23.395582370748187, 'noise_level': 0.008475871987172598, 'constant_value': 449.1545442053452, 'nu': 2.5}. Best is trial 959 with value: 0.1375110730946576.
[I 2024-12-04 21:14:16,925] Trial 2079 finished with value: 0.14771047153415268 and parameters: {'kernel_type': 'RBF', 'length_scale': 0.23363194690248115, 'noise_level': 0.04624473221872138, 'constant_value': 3.3339120556694866, 'nu': 1.5}. Best is trial 959 with value: 0.1375110730946576.
[I 2024-12-04 21:14:18,159] Trial 2082 finished with value: 0.14249487604116962 and parameters: {'kernel_type': 'Matern', 'length_scale': 143.88712144810088, 'noise_level': 0.026163019496762474, 'constant_value': 72.65974673403989, 'nu': 1.5}. Best is trial 959 with value: 0.1375110730946576.
[I 2024-12-04 21:14:18,718] Trial 2081 finished with value: 0.14249506552927838 and parameters: {'kernel_type': 'Matern', 'length_scale': 0.8366387652657197, 'noise_level': 0.8028981304168162, 'constant_value': 2.9951889789131254, 'nu': 1.5}. Best is trial 959 with value: 0.1375110730946576.
[I 2024-12-04 21:14:24,937] Trial 2083 finished with value: 0.1424950717509988 and parameters: {'kernel_type': 'Matern', 'length_scale': 2.729172107579634, 'noise_level': 0.9110443049068558, 'constant_value': 1.5335208532198459, 'nu': 1.5}. Best is trial 959 with value: 0.1375110730946576.
[I 2024-12-04 21:14:25,046] Trial 2085 finished with value: 0.1446988128545475 and parameters: {'kernel_type': 'Matern', 'length_scale': 3.3065100333046447, 'noise_level': 0.3082810418429859, 'constant_value': 0.5373894169299012, 'nu': 2.5}. Best is trial 959 with value: 0.1375110730946576.
[I 2024-12-04 21:14:31,170] Trial 2084 finished with value: 0.9864686819227225 and parameters: {'kernel_type': 'Matern', 'length_scale': 142.8089804911545, 'noise_level': 0.010296675299746769, 'constant_value': 0.003196654451484803, 'nu': 1.5}. Best is trial 959 with value: 0.1375110730946576.
[I 2024-12-04 21:14:32,990] Trial 2086 finished with value: 0.14469880043300007 and parameters: {'kernel_type': 'Matern', 'length_scale': 1.0031133098416425, 'noise_level': 0.2235899122754912, 'constant_value': 0.0045579366732708924, 'nu': 2.5}. Best is trial 959 with value: 0.1375110730946576.
[I 2024-12-04 21:14:33,097] Trial 2087 finished with value: 0.14249498969876565 and parameters: {'kernel_type': 'Matern', 'length_scale': 0.19352673939022008, 'noise_level': 0.9810441493623203, 'constant_value': 223.28603432444567, 'nu': 1.5}. Best is trial 959 with value: 0.1375110730946576.
[I 2024-12-04 21:14:37,630] Trial 2088 finished with value: 0.14249502187847454 and parameters: {'kernel_type': 'Matern', 'length_scale': 6.856972131811401, 'noise_level': 0.949257928940055, 'constant_value': 5989.884558444167, 'nu': 1.5}. Best is trial 959 with value: 0.1375110730946576.
[I 2024-12-04 21:14:39,418] Trial 2089 finished with value: 0.14249505083840533 and parameters: {'kernel_type': 'Matern', 'length_scale': 10.208439589291366, 'noise_level': 0.9519057467916978, 'constant_value': 1.0125222144395702, 'nu': 1.5}. Best is trial 959 with value: 0.1375110730946576.
[I 2024-12-04 21:14:41,131] Trial 2090 finished with value: 0.1424952005143121 and parameters: {'kernel_type': 'Matern', 'length_scale': 2.473092879767726, 'noise_level': 0.930880833780771, 'constant_value': 0.5461836738484691, 'nu': 1.5}. Best is trial 959 with value: 0.1375110730946576.
[I 2024-12-04 21:14:48,047] Trial 2093 finished with value: 0.14249506816313934 and parameters: {'kernel_type': 'Matern', 'length_scale': 34.05919794715173, 'noise_level': 0.9259795054108155, 'constant_value': 5.259682396038687, 'nu': 1.5}. Best is trial 959 with value: 0.1375110730946576.
[I 2024-12-04 21:14:48,870] Trial 2091 finished with value: 0.14249505086707473 and parameters: {'kernel_type': 'Matern', 'length_scale': 2.3197999489219865, 'noise_level': 0.08485410283948804, 'constant_value': 6.257648196434202e-05, 'nu': 1.5}. Best is trial 959 with value: 0.1375110730946576.
[I 2024-12-04 21:14:50,626] Trial 2092 finished with value: 0.9864686819517313 and parameters: {'kernel_type': 'Matern', 'length_scale': 116.75521290979422, 'noise_level': 0.012360021555214085, 'constant_value': 0.6163493966885271, 'nu': 1.5}. Best is trial 959 with value: 0.1375110730946576.
[I 2024-12-04 21:14:54,595] Trial 2094 finished with value: 0.14249508288620136 and parameters: {'kernel_type': 'Matern', 'length_scale': 3.0705631416042336, 'noise_level': 0.8708743720904114, 'constant_value': 130.4331724089637, 'nu': 1.5}. Best is trial 959 with value: 0.1375110730946576.
[I 2024-12-04 21:14:58,510] Trial 2095 finished with value: 0.992634379198748 and parameters: {'kernel_type': 'RBF', 'length_scale': 838.7899795890648, 'noise_level': 0.0072552254983824244, 'constant_value': 0.03997873071013859, 'nu': 1.5}. Best is trial 959 with value: 0.1375110730946576.
[I 2024-12-04 21:15:00,476] Trial 2096 finished with value: 0.14249473797081508 and parameters: {'kernel_type': 'Matern', 'length_scale': 0.8235263487952751, 'noise_level': 0.029903631959684276, 'constant_value': 110.72196627789336, 'nu': 1.5}. Best is trial 959 with value: 0.1375110730946576.
[I 2024-12-04 21:15:01,310] Trial 2097 finished with value: 0.142495212250925 and parameters: {'kernel_type': 'Matern', 'length_scale': 111.19531244382782, 'noise_level': 0.7896581779714112, 'constant_value': 189.03082557283668, 'nu': 1.5}. Best is trial 959 with value: 0.1375110730946576.
[I 2024-12-04 21:15:06,675] Trial 2100 finished with value: 0.9864686819202737 and parameters: {'kernel_type': 'Matern', 'length_scale': 0.04164874686324122, 'noise_level': 0.027780166331397047, 'constant_value': 1228.0618260702927, 'nu': 1.5}. Best is trial 959 with value: 0.1375110730946576.
[I 2024-12-04 21:15:07,035] Trial 2098 finished with value: 0.14249506036527967 and parameters: {'kernel_type': 'Matern', 'length_scale': 18.610810855630525, 'noise_level': 0.9952230949718152, 'constant_value': 1245.764468995933, 'nu': 1.5}. Best is trial 959 with value: 0.1375110730946576.
[I 2024-12-04 21:15:10,545] Trial 2099 finished with value: 0.14249506053872302 and parameters: {'kernel_type': 'Matern', 'length_scale': 802.1257790513781, 'noise_level': 0.9409892534702867, 'constant_value': 17.160990598171114, 'nu': 1.5}. Best is trial 959 with value: 0.1375110730946576.
[I 2024-12-04 21:15:11,641] Trial 2102 finished with value: 0.9982171054676893 and parameters: {'kernel_type': 'RBF', 'length_scale': 0.5945674559969932, 'noise_level': 2.1389234735541115e-06, 'constant_value': 3350.583791977773, 'nu': 1.5}. Best is trial 959 with value: 0.1375110730946576.
[I 2024-12-04 21:15:14,368] Trial 2101 finished with value: 0.14249506409196594 and parameters: {'kernel_type': 'Matern', 'length_scale': 58.91843836107857, 'noise_level': 0.9600323491536696, 'constant_value': 0.0043433186130822235, 'nu': 1.5}. Best is trial 959 with value: 0.1375110730946576.
[I 2024-12-04 21:15:14,697] Trial 2103 finished with value: 0.9864686819533504 and parameters: {'kernel_type': 'Matern', 'length_scale': 0.0001791587637320811, 'noise_level': 0.024516806020618048, 'constant_value': 667.8669226700882, 'nu': 1.5}. Best is trial 959 with value: 0.1375110730946576.
[I 2024-12-04 21:15:18,362] Trial 2104 finished with value: 0.14249510834043888 and parameters: {'kernel_type': 'Matern', 'length_scale': 75.22288310420146, 'noise_level': 0.04237303431921809, 'constant_value': 55.43917445517889, 'nu': 1.5}. Best is trial 959 with value: 0.1375110730946576.
[I 2024-12-04 21:15:18,807] Trial 2105 finished with value: 0.9982171094709893 and parameters: {'kernel_type': 'RBF', 'length_scale': 2.0072526890883045, 'noise_level': 1.4984750976182543e-08, 'constant_value': 22404.314487915504, 'nu': 0.5}. Best is trial 959 with value: 0.1375110730946576.
[I 2024-12-04 21:15:24,547] Trial 2106 finished with value: 0.9864686819359668 and parameters: {'kernel_type': 'Matern', 'length_scale': 40222.78810786573, 'noise_level': 5.759685944408664e-05, 'constant_value': 0.0010453770339038959, 'nu': 0.5}. Best is trial 959 with value: 0.1375110730946576.
[I 2024-12-04 21:15:26,858] Trial 2107 finished with value: 0.1424948463196217 and parameters: {'kernel_type': 'Matern', 'length_scale': 2.1020360078391596, 'noise_level': 0.036801441487158006, 'constant_value': 41.58261766102287, 'nu': 1.5}. Best is trial 959 with value: 0.1375110730946576.
[I 2024-12-04 21:15:30,351] Trial 2108 finished with value: 0.986468681919681 and parameters: {'kernel_type': 'Matern', 'length_scale': 200.8808673594097, 'noise_level': 0.9825501681400842, 'constant_value': 0.005402235127049202, 'nu': 1.5}. Best is trial 959 with value: 0.1375110730946576.
[I 2024-12-04 21:15:33,149] Trial 2109 finished with value: 0.1424945879167635 and parameters: {'kernel_type': 'Matern', 'length_scale': 1.6276835095175168, 'noise_level': 0.8905610016761236, 'constant_value': 4.826963621181149, 'nu': 1.5}. Best is trial 959 with value: 0.1375110730946576.
[I 2024-12-04 21:15:35,497] Trial 2110 finished with value: 0.9864686819147895 and parameters: {'kernel_type': 'Matern', 'length_scale': 138.41886493557388, 'noise_level': 0.012063502547492614, 'constant_value': 0.03397734742823411, 'nu': 0.5}. Best is trial 959 with value: 0.1375110730946576.
[I 2024-12-04 21:15:37,655] Trial 2111 finished with value: 0.14249505334652027 and parameters: {'kernel_type': 'Matern', 'length_scale': 1.7569277695340153, 'noise_level': 0.9962233329158592, 'constant_value': 228.78624302374223, 'nu': 1.5}. Best is trial 959 with value: 0.1375110730946576.
[I 2024-12-04 21:15:45,837] Trial 2113 finished with value: 0.14249506840766873 and parameters: {'kernel_type': 'Matern', 'length_scale': 45.76678739893166, 'noise_level': 0.027406105900179587, 'constant_value': 1.6689036511494462, 'nu': 1.5}. Best is trial 959 with value: 0.1375110730946576.
[I 2024-12-04 21:15:47,049] Trial 2114 finished with value: 0.14249499925028505 and parameters: {'kernel_type': 'Matern', 'length_scale': 35.530514415461624, 'noise_level': 0.025457033286207433, 'constant_value': 12.524509681347643, 'nu': 1.5}. Best is trial 959 with value: 0.1375110730946576.
[I 2024-12-04 21:15:50,708] Trial 2112 finished with value: 0.14249521534096754 and parameters: {'kernel_type': 'Matern', 'length_scale': 5972.543886751894, 'noise_level': 0.5772511000168021, 'constant_value': 0.6097488892610887, 'nu': 1.5}. Best is trial 959 with value: 0.1375110730946576.
[I 2024-12-04 21:15:57,135] Trial 2116 finished with value: 0.9864686819597052 and parameters: {'kernel_type': 'RBF', 'length_scale': 126.98361688067989, 'noise_level': 1.262849994178642e-08, 'constant_value': 0.003554079056197628, 'nu': 0.5}. Best is trial 959 with value: 0.1375110730946576.
[I 2024-12-04 21:16:00,144] Trial 2117 finished with value: 0.9864686820216729 and parameters: {'kernel_type': 'Matern', 'length_scale': 13.604641470877848, 'noise_level': 0.013685700070024455, 'constant_value': 0.056897389655118966, 'nu': 1.5}. Best is trial 959 with value: 0.1375110730946576.
[I 2024-12-04 21:16:03,945] Trial 2115 finished with value: 0.14249479091364758 and parameters: {'kernel_type': 'Matern', 'length_scale': 29.132938321396573, 'noise_level': 0.7100684413933707, 'constant_value': 90.15143719782175, 'nu': 1.5}. Best is trial 959 with value: 0.1375110730946576.
[I 2024-12-04 21:16:03,949] Trial 2118 finished with value: 0.1477101418494488 and parameters: {'kernel_type': 'RBF', 'length_scale': 9.541942932764858, 'noise_level': 0.02125464364066449, 'constant_value': 11.973066430291468, 'nu': 1.5}. Best is trial 959 with value: 0.1375110730946576.
[I 2024-12-04 21:16:08,857] Trial 2121 finished with value: 0.9864686819455951 and parameters: {'kernel_type': 'Matern', 'length_scale': 0.0010986600299055644, 'noise_level': 4.2637097823604864e-08, 'constant_value': 0.0003931304141872622, 'nu': 2.5}. Best is trial 959 with value: 0.1375110730946576.
[I 2024-12-04 21:16:09,460] Trial 2119 finished with value: 0.1424949576533114 and parameters: {'kernel_type': 'Matern', 'length_scale': 0.23900970583276532, 'noise_level': 0.023909848314519977, 'constant_value': 46.84014446645775, 'nu': 1.5}. Best is trial 959 with value: 0.1375110730946576.
[I 2024-12-04 21:16:13,643] Trial 2123 finished with value: 0.9864677015215921 and parameters: {'kernel_type': 'Matern', 'length_scale': 0.10889224044548655, 'noise_level': 0.027291327969023466, 'constant_value': 419.8690435886775, 'nu': 1.5}. Best is trial 959 with value: 0.1375110730946576.
[I 2024-12-04 21:16:13,817] Trial 2122 finished with value: 0.14249507661546382 and parameters: {'kernel_type': 'Matern', 'length_scale': 355.670849020216, 'noise_level': 0.030732295444469516, 'constant_value': 109.41776432805158, 'nu': 1.5}. Best is trial 959 with value: 0.1375110730946576.
[I 2024-12-04 21:16:16,226] Trial 2120 finished with value: 0.1477102887765839 and parameters: {'kernel_type': 'RBF', 'length_scale': 641.3854632463858, 'noise_level': 0.976929151519914, 'constant_value': 0.3811830840530708, 'nu': 1.5}. Best is trial 959 with value: 0.1375110730946576.
[I 2024-12-04 21:16:20,228] Trial 2124 finished with value: 0.1446988117338433 and parameters: {'kernel_type': 'Matern', 'length_scale': 2200.9049963183206, 'noise_level': 0.5777364378210913, 'constant_value': 142.02807608182897, 'nu': 2.5}. Best is trial 959 with value: 0.1375110730946576.
