[I 2024-12-03 19:03:47,802] Trial 1449 finished with value: 0.13701189030251074 and parameters: {'kernel': 'linear', 'C': 3.322482261097491, 'gamma': 0.004333567684481009, 'epsilon': 0.022553081111403438}. Best is trial 345 with value: 0.13438257115663557.
[I 2024-12-03 19:03:50,232] Trial 1355 finished with value: 0.1387250662941415 and parameters: {'kernel': 'linear', 'C': 92.856301507508, 'gamma': 0.007398588221363162, 'epsilon': 0.012049131361076706}. Best is trial 345 with value: 0.13438257115663557.
[I 2024-12-03 19:03:52,072] Trial 1434 finished with value: 0.13531755662064604 and parameters: {'kernel': 'linear', 'C': 28.31249296648474, 'gamma': 0.006047955916144757, 'epsilon': 0.031057174994335014}. Best is trial 345 with value: 0.13438257115663557.
[I 2024-12-03 19:03:53,215] Trial 1453 finished with value: 0.1360994160485956 and parameters: {'kernel': 'linear', 'C': 4.3184316445796975, 'gamma': 0.0006505130695318488, 'epsilon': 0.03778366959346616}. Best is trial 345 with value: 0.13438257115663557.
[I 2024-12-03 19:03:58,153] Trial 1448 finished with value: 0.13721929697176088 and parameters: {'kernel': 'linear', 'C': 18.787454776939487, 'gamma': 0.01312115950972056, 'epsilon': 0.04794669464890819}. Best is trial 345 with value: 0.13438257115663557.
[I 2024-12-03 19:03:58,938] Trial 1405 finished with value: 0.13791635101813682 and parameters: {'kernel': 'linear', 'C': 99.7787112916481, 'gamma': 0.00043388179727617786, 'epsilon': 0.008939996311233041}. Best is trial 345 with value: 0.13438257115663557.
[I 2024-12-03 19:04:03,227] Trial 1451 finished with value: 0.13513873480516686 and parameters: {'kernel': 'linear', 'C': 25.187632547857437, 'gamma': 0.007476076667851667, 'epsilon': 0.05654986911361105}. Best is trial 345 with value: 0.13438257115663557.
[I 2024-12-03 19:04:04,107] Trial 1403 finished with value: 0.13519449963992952 and parameters: {'kernel': 'linear', 'C': 88.33874764086887, 'gamma': 0.0028813520871215077, 'epsilon': 0.04073858731165731}. Best is trial 345 with value: 0.13438257115663557.
[I 2024-12-03 19:04:04,276] Trial 1455 finished with value: 0.13841765690894112 and parameters: {'kernel': 'linear', 'C': 12.892814264787171, 'gamma': 0.011275907507206744, 'epsilon': 0.017389274794223628}. Best is trial 345 with value: 0.13438257115663557.
[I 2024-12-03 19:04:05,764] Trial 1377 finished with value: 0.1374988778677818 and parameters: {'kernel': 'linear', 'C': 82.92571292465718, 'gamma': 0.003644826885296064, 'epsilon': 0.020334847631725272}. Best is trial 345 with value: 0.13438257115663557.
[I 2024-12-03 19:04:08,926] Trial 1454 finished with value: 0.14378322230947388 and parameters: {'kernel': 'linear', 'C': 97.35781247353049, 'gamma': 0.001296554017359034, 'epsilon': 0.1181249915202586}. Best is trial 345 with value: 0.13438257115663557.
[I 2024-12-03 19:04:10,176] Trial 1463 finished with value: 1.3557492996477465 and parameters: {'kernel': 'sigmoid', 'C': 0.0016479158014216348, 'gamma': 0.8523221914514081, 'epsilon': 0.02478189065570124}. Best is trial 345 with value: 0.13438257115663557.
[I 2024-12-03 19:04:11,575] Trial 1418 finished with value: 0.13511904022743898 and parameters: {'kernel': 'linear', 'C': 82.82887873747418, 'gamma': 0.0011146839754801931, 'epsilon': 0.03279070196512511}. Best is trial 345 with value: 0.13438257115663557.
[I 2024-12-03 19:04:14,766] Trial 1397 finished with value: 0.13786467151498646 and parameters: {'kernel': 'linear', 'C': 93.11136805588937, 'gamma': 0.003449230196887098, 'epsilon': 0.014418041851089023}. Best is trial 345 with value: 0.13438257115663557.
[I 2024-12-03 19:04:15,878] Trial 1450 finished with value: 0.137753015154002 and parameters: {'kernel': 'linear', 'C': 24.133357747966226, 'gamma': 0.017955173408031443, 'epsilon': 0.013444233503352419}. Best is trial 345 with value: 0.13438257115663557.
[I 2024-12-03 19:04:17,635] Trial 1465 finished with value: 0.13792534112619417 and parameters: {'kernel': 'linear', 'C': 23.57984430786511, 'gamma': 0.004562717394401681, 'epsilon': 0.0796685409024281}. Best is trial 345 with value: 0.13438257115663557.
[I 2024-12-03 19:04:20,610] Trial 1373 finished with value: 0.1391139497367449 and parameters: {'kernel': 'linear', 'C': 96.62312097492767, 'gamma': 0.024327838734338452, 'epsilon': 0.01131135030463007}. Best is trial 345 with value: 0.13438257115663557.
[I 2024-12-03 19:04:21,134] Trial 1456 finished with value: 0.13683639448698104 and parameters: {'kernel': 'linear', 'C': 26.566948584004507, 'gamma': 0.00041529723841912924, 'epsilon': 0.023657251073993166}. Best is trial 345 with value: 0.13438257115663557.
[I 2024-12-03 19:04:21,703] Trial 1469 finished with value: 1.3206293471959605 and parameters: {'kernel': 'sigmoid', 'C': 0.00425789571557268, 'gamma': 0.00014086387342001198, 'epsilon': 0.715761219322884}. Best is trial 345 with value: 0.13438257115663557.
[I 2024-12-03 19:04:25,369] Trial 1466 finished with value: 0.1352214350776542 and parameters: {'kernel': 'linear', 'C': 20.457277729381012, 'gamma': 0.0006813483420847517, 'epsilon': 0.05837481280957501}. Best is trial 345 with value: 0.13438257115663557.
[I 2024-12-03 19:04:25,418] Trial 1436 finished with value: 0.1350919440158966 and parameters: {'kernel': 'linear', 'C': 99.46028800855159, 'gamma': 0.005451546245843968, 'epsilon': 0.06306181546371278}. Best is trial 345 with value: 0.13438257115663557.
[I 2024-12-03 19:04:26,948] Trial 1460 finished with value: 0.13745747133574257 and parameters: {'kernel': 'linear', 'C': 22.435109318804262, 'gamma': 0.0036245218271582346, 'epsilon': 0.022672858730747043}. Best is trial 345 with value: 0.13438257115663557.
[I 2024-12-03 19:04:27,641] Trial 1471 finished with value: 0.13790101858265377 and parameters: {'kernel': 'linear', 'C': 2.725636513774398, 'gamma': 0.0004091749670232533, 'epsilon': 0.01330694605315608}. Best is trial 345 with value: 0.13438257115663557.
[I 2024-12-03 19:04:28,841] Trial 1475 finished with value: 6.679252426293273 and parameters: {'kernel': 'sigmoid', 'C': 69.15478642179703, 'gamma': 0.0015878109297378577, 'epsilon': 0.17002069487071655}. Best is trial 345 with value: 0.13438257115663557.
[I 2024-12-03 19:04:30,788] Trial 1459 finished with value: 0.1379374805358516 and parameters: {'kernel': 'linear', 'C': 16.156449864013045, 'gamma': 0.007947682199065456, 'epsilon': 0.016159463038399494}. Best is trial 345 with value: 0.13438257115663557.
[I 2024-12-03 19:04:30,790] Trial 1464 finished with value: 0.1353878515282342 and parameters: {'kernel': 'linear', 'C': 25.49412044521837, 'gamma': 0.011031719580969589, 'epsilon': 0.032403501162813715}. Best is trial 345 with value: 0.13438257115663557.
[I 2024-12-03 19:04:32,303] Trial 1478 finished with value: 0.837361496315343 and parameters: {'kernel': 'poly', 'C': 18.627365531627895, 'gamma': 0.004286950618939271, 'epsilon': 0.017433196901845735}. Best is trial 345 with value: 0.13438257115663557.
[I 2024-12-03 19:04:32,305] Trial 1428 finished with value: 0.13765810471662238 and parameters: {'kernel': 'linear', 'C': 93.14483676753727, 'gamma': 0.026647307107619523, 'epsilon': 0.02050726681624602}. Best is trial 345 with value: 0.13438257115663557.
[I 2024-12-03 19:04:33,519] Trial 1476 finished with value: 0.13704046967681086 and parameters: {'kernel': 'linear', 'C': 2.80310473458172, 'gamma': 0.003457177709562165, 'epsilon': 0.031191761445444634}. Best is trial 345 with value: 0.13438257115663557.
[I 2024-12-03 19:04:33,630] Trial 1477 finished with value: 0.14213305189880962 and parameters: {'kernel': 'linear', 'C': 2.384821757850997, 'gamma': 0.009442567789997929, 'epsilon': 0.0747179310227163}. Best is trial 345 with value: 0.13438257115663557.
[I 2024-12-03 19:04:34,577] Trial 1470 finished with value: 0.13510913396059604 and parameters: {'kernel': 'linear', 'C': 20.043763148256076, 'gamma': 0.019310259584595656, 'epsilon': 0.05723558478945848}. Best is trial 345 with value: 0.13438257115663557.
[I 2024-12-03 19:04:35,275] Trial 1479 finished with value: 0.1649851879632445 and parameters: {'kernel': 'linear', 'C': 13.317649160295767, 'gamma': 0.009098913783624032, 'epsilon': 0.1831551713053887}. Best is trial 345 with value: 0.13438257115663557.
[I 2024-12-03 19:04:36,421] Trial 1483 finished with value: 0.5141767121589746 and parameters: {'kernel': 'poly', 'C': 0.5122099799611785, 'gamma': 0.5247143251255016, 'epsilon': 0.8729765840540743}. Best is trial 345 with value: 0.13438257115663557.
[I 2024-12-03 19:04:38,807] Trial 1452 finished with value: 0.1352966080090174 and parameters: {'kernel': 'linear', 'C': 81.6085220904722, 'gamma': 0.005513581257791084, 'epsilon': 0.06011382521978161}. Best is trial 345 with value: 0.13438257115663557.
[I 2024-12-03 19:04:43,101] Trial 1480 finished with value: 0.13635833246558818 and parameters: {'kernel': 'linear', 'C': 17.0919764806153, 'gamma': 0.0011012483212516743, 'epsilon': 0.050714331673649186}. Best is trial 345 with value: 0.13438257115663557.
[I 2024-12-03 19:04:43,580] Trial 1422 finished with value: 0.13606602014630875 and parameters: {'kernel': 'linear', 'C': 84.77567203045624, 'gamma': 0.00841768017239356, 'epsilon': 0.024467958757459676}. Best is trial 345 with value: 0.13438257115663557.
[I 2024-12-03 19:04:44,694] Trial 1488 finished with value: 1.0895126376785202 and parameters: {'kernel': 'poly', 'C': 8.318213221490133, 'gamma': 0.00205610014219065, 'epsilon': 0.0012807112571448685}. Best is trial 345 with value: 0.13438257115663557.
[I 2024-12-03 19:04:52,450] Trial 1487 finished with value: 0.13547883064807434 and parameters: {'kernel': 'linear', 'C': 14.5098356279174, 'gamma': 0.004197762115492532, 'epsilon': 0.03141620493016687}. Best is trial 345 with value: 0.13438257115663557.
[I 2024-12-03 19:04:53,944] Trial 1490 finished with value: 0.3582973358803645 and parameters: {'kernel': 'poly', 'C': 56.618205013835635, 'gamma': 0.013717989508954344, 'epsilon': 0.05990850135367386}. Best is trial 345 with value: 0.13438257115663557.
[I 2024-12-03 19:04:57,132] Trial 1432 finished with value: 0.13670032249579375 and parameters: {'kernel': 'linear', 'C': 88.58011209101991, 'gamma': 0.003726991696899772, 'epsilon': 0.023120852571503578}. Best is trial 345 with value: 0.13438257115663557.
[I 2024-12-03 19:04:57,176] Trial 1412 finished with value: 0.13742405926324355 and parameters: {'kernel': 'linear', 'C': 95.9604959251277, 'gamma': 0.00843293409033388, 'epsilon': 0.02060851226817114}. Best is trial 345 with value: 0.13438257115663557.
[I 2024-12-03 19:04:59,246] Trial 1492 finished with value: 0.15337580506032047 and parameters: {'kernel': 'rbf', 'C': 80.42420590678462, 'gamma': 0.003816597391963799, 'epsilon': 0.019076844228088207}. Best is trial 345 with value: 0.13438257115663557.
[I 2024-12-03 19:05:03,443] Trial 1425 finished with value: 0.13799439427081078 and parameters: {'kernel': 'linear', 'C': 97.2639030070831, 'gamma': 0.014729586467173117, 'epsilon': 0.0060798058202618495}. Best is trial 345 with value: 0.13438257115663557.
[I 2024-12-03 19:05:05,560] Trial 1442 finished with value: 0.1347574595893177 and parameters: {'kernel': 'linear', 'C': 72.98855941787413, 'gamma': 0.0007135385871702583, 'epsilon': 0.031359503349998666}. Best is trial 345 with value: 0.13438257115663557.
[I 2024-12-03 19:05:05,598] Trial 1484 finished with value: 0.1385241276820576 and parameters: {'kernel': 'linear', 'C': 24.54068437614103, 'gamma': 0.010608573753345379, 'epsilon': 0.012179261408907313}. Best is trial 345 with value: 0.13438257115663557.
[I 2024-12-03 19:05:06,631] Trial 1482 finished with value: 0.13795161471345746 and parameters: {'kernel': 'linear', 'C': 20.822035071430818, 'gamma': 0.0017270450260284567, 'epsilon': 0.015057194437192764}. Best is trial 345 with value: 0.13438257115663557.
[I 2024-12-03 19:05:07,335] Trial 1495 finished with value: 0.14035209455851963 and parameters: {'kernel': 'linear', 'C': 12.241479440097114, 'gamma': 0.005257029830166246, 'epsilon': 0.08715926093578466}. Best is trial 345 with value: 0.13438257115663557.
[I 2024-12-03 19:05:07,407] Trial 1497 finished with value: 0.36885440685410353 and parameters: {'kernel': 'poly', 'C': 0.01981208879825724, 'gamma': 0.2721898591222822, 'epsilon': 0.2349839141094086}. Best is trial 345 with value: 0.13438257115663557.
[I 2024-12-03 19:05:09,278] Trial 1499 finished with value: 1.285294281635917 and parameters: {'kernel': 'rbf', 'C': 0.0012177308756786286, 'gamma': 0.06681686715797767, 'epsilon': 0.9755794045579965}. Best is trial 345 with value: 0.13438257115663557.
[I 2024-12-03 19:05:09,424] Trial 1473 finished with value: 0.13794520380338465 and parameters: {'kernel': 'linear', 'C': 78.90256410892299, 'gamma': 0.014216265732316035, 'epsilon': 0.07869481107019755}. Best is trial 345 with value: 0.13438257115663557.
[I 2024-12-03 19:05:10,513] Trial 1486 finished with value: 0.13717083562844068 and parameters: {'kernel': 'linear', 'C': 99.46115741591038, 'gamma': 0.007888211493612908, 'epsilon': 0.047880236248707846}. Best is trial 345 with value: 0.13438257115663557.
[I 2024-12-03 19:05:14,679] Trial 1429 finished with value: 0.1383259680279873 and parameters: {'kernel': 'linear', 'C': 92.39482996755811, 'gamma': 0.003700470703279263, 'epsilon': 0.012250584527305841}. Best is trial 345 with value: 0.13438257115663557.
[I 2024-12-03 19:05:15,744] Trial 1411 finished with value: 0.13798023499018577 and parameters: {'kernel': 'linear', 'C': 98.56585304345526, 'gamma': 0.005009659713628814, 'epsilon': 0.014548015905172315}. Best is trial 345 with value: 0.13438257115663557.
[I 2024-12-03 19:05:15,876] Trial 1500 finished with value: 0.14180331642690427 and parameters: {'kernel': 'linear', 'C': 40.794908976524006, 'gamma': 0.001211105405337146, 'epsilon': 0.09260349494884274}. Best is trial 345 with value: 0.13438257115663557.
[I 2024-12-03 19:05:15,994] Trial 1504 finished with value: 1.3578909203527518 and parameters: {'kernel': 'rbf', 'C': 0.0020409440265440277, 'gamma': 0.00040822612911336977, 'epsilon': 0.0041246180995220105}. Best is trial 345 with value: 0.13438257115663557.
[I 2024-12-03 19:05:17,624] Trial 1462 finished with value: 0.1352865397330495 and parameters: {'kernel': 'linear', 'C': 87.91696793235815, 'gamma': 0.011740052891050168, 'epsilon': 0.033448805617593134}. Best is trial 345 with value: 0.13438257115663557.
[I 2024-12-03 19:05:17,774] Trial 1468 finished with value: 0.13535400237558226 and parameters: {'kernel': 'linear', 'C': 85.07944808422373, 'gamma': 0.004090449278118766, 'epsilon': 0.05851913953244043}. Best is trial 345 with value: 0.13438257115663557.
[I 2024-12-03 19:05:18,584] Trial 1445 finished with value: 0.13646447198990402 and parameters: {'kernel': 'linear', 'C': 95.18193500158492, 'gamma': 0.0362934291232352, 'epsilon': 0.02326133140229425}. Best is trial 345 with value: 0.13438257115663557.
[I 2024-12-03 19:05:19,873] Trial 1510 finished with value: 1.0823696996978962 and parameters: {'kernel': 'poly', 'C': 18.98927108168936, 'gamma': 0.0018845364559587018, 'epsilon': 0.0542665334552727}. Best is trial 345 with value: 0.13438257115663557.
[I 2024-12-03 19:05:25,861] Trial 1461 finished with value: 0.13516487687127493 and parameters: {'kernel': 'linear', 'C': 98.79431261737487, 'gamma': 0.0028804665289224977, 'epsilon': 0.040249426636604975}. Best is trial 345 with value: 0.13438257115663557.
[I 2024-12-03 19:05:27,790] Trial 1505 finished with value: 0.13841599179070585 and parameters: {'kernel': 'linear', 'C': 6.8878175139384314, 'gamma': 0.0003034695293119397, 'epsilon': 0.011059628141964394}. Best is trial 345 with value: 0.13438257115663557.
[I 2024-12-03 19:05:29,525] Trial 1509 finished with value: 0.13532534720193162 and parameters: {'kernel': 'linear', 'C': 14.384471637811576, 'gamma': 0.0014529626652657899, 'epsilon': 0.02953436116636602}. Best is trial 345 with value: 0.13438257115663557.
[I 2024-12-03 19:05:30,456] Trial 1467 finished with value: 0.13657519691068729 and parameters: {'kernel': 'linear', 'C': 85.3551535488351, 'gamma': 0.006272729689823246, 'epsilon': 0.02324766493276673}. Best is trial 345 with value: 0.13438257115663557.
[I 2024-12-03 19:05:35,741] Trial 1458 finished with value: 0.1351576247172804 and parameters: {'kernel': 'linear', 'C': 95.65563489947824, 'gamma': 0.03473275569667779, 'epsilon': 0.040185279168453866}. Best is trial 345 with value: 0.13438257115663557.
[I 2024-12-03 19:05:36,791] Trial 1491 finished with value: 0.13805143417048304 and parameters: {'kernel': 'linear', 'C': 29.395297274948152, 'gamma': 0.07436533101107722, 'epsilon': 0.0066952263811116295}. Best is trial 345 with value: 0.13438257115663557.
[I 2024-12-03 19:05:40,530] Trial 1507 finished with value: 0.13735016073885417 and parameters: {'kernel': 'linear', 'C': 16.474942349535578, 'gamma': 0.00044536871604084876, 'epsilon': 0.021589550998570572}. Best is trial 345 with value: 0.13438257115663557.
[I 2024-12-03 19:05:41,503] Trial 1501 finished with value: 0.13573776716968605 and parameters: {'kernel': 'linear', 'C': 30.858520819929232, 'gamma': 0.0004706032644147477, 'epsilon': 0.026662519151545272}. Best is trial 345 with value: 0.13438257115663557.
[I 2024-12-03 19:05:46,470] Trial 1506 finished with value: 0.1367239533803052 and parameters: {'kernel': 'linear', 'C': 66.18317940000622, 'gamma': 0.0005110249182472416, 'epsilon': 0.04946260538497247}. Best is trial 345 with value: 0.13438257115663557.
[I 2024-12-03 19:05:47,581] Trial 1503 finished with value: 0.13479129444862073 and parameters: {'kernel': 'linear', 'C': 43.231298276990344, 'gamma': 0.0011164681133513622, 'epsilon': 0.03047806926027725}. Best is trial 345 with value: 0.13438257115663557.
[I 2024-12-03 19:05:47,583] Trial 1489 finished with value: 0.13814752070207414 and parameters: {'kernel': 'linear', 'C': 56.27041362350587, 'gamma': 0.00012394034207495656, 'epsilon': 0.010329773061258112}. Best is trial 345 with value: 0.13438257115663557.
[I 2024-12-03 19:05:49,589] Trial 1517 finished with value: 0.13672472711426695 and parameters: {'kernel': 'linear', 'C': 20.60102546124169, 'gamma': 0.002269573663968708, 'epsilon': 0.05008312548523594}. Best is trial 345 with value: 0.13438257115663557.
[I 2024-12-03 19:05:52,435] Trial 1512 finished with value: 0.13786358148705968 and parameters: {'kernel': 'linear', 'C': 18.084401383612146, 'gamma': 0.0018343353733909441, 'epsilon': 0.015662627219733032}. Best is trial 345 with value: 0.13438257115663557.
[I 2024-12-03 19:05:52,476] Trial 1502 finished with value: 0.13779609842179139 and parameters: {'kernel': 'linear', 'C': 29.427477292201633, 'gamma': 0.0016959087024643951, 'epsilon': 0.014174564972621774}. Best is trial 345 with value: 0.13438257115663557.
[I 2024-12-03 19:05:54,058] Trial 1511 finished with value: 0.13788987751080248 and parameters: {'kernel': 'linear', 'C': 22.71767752588664, 'gamma': 0.0007766850499625913, 'epsilon': 0.005586350031236712}. Best is trial 345 with value: 0.13438257115663557.
[I 2024-12-03 19:05:54,135] Trial 1508 finished with value: 0.13529388953876026 and parameters: {'kernel': 'linear', 'C': 54.15421759050089, 'gamma': 0.00032023447615012017, 'epsilon': 0.0584231182590008}. Best is trial 345 with value: 0.13438257115663557.
[I 2024-12-03 19:05:57,657] Trial 1522 finished with value: 0.135795338449011 and parameters: {'kernel': 'linear', 'C': 10.107141631688561, 'gamma': 0.0009190746202961965, 'epsilon': 0.033988369031717335}. Best is trial 345 with value: 0.13438257115663557.
[I 2024-12-03 19:05:57,958] Trial 1521 finished with value: 0.13733426317023578 and parameters: {'kernel': 'linear', 'C': 10.951522108667616, 'gamma': 0.0005296213005825174, 'epsilon': 0.02060546150033427}. Best is trial 345 with value: 0.13438257115663557.
[I 2024-12-03 19:05:59,644] Trial 1528 finished with value: 0.14446281634076266 and parameters: {'kernel': 'linear', 'C': 8.780275459006845, 'gamma': 0.0006362905839532665, 'epsilon': 0.11753960673220919}. Best is trial 345 with value: 0.13438257115663557.
[I 2024-12-03 19:06:01,792] Trial 1481 finished with value: 0.13511820420145712 and parameters: {'kernel': 'linear', 'C': 96.62156773233404, 'gamma': 0.012130022718976155, 'epsilon': 0.04038636005697698}. Best is trial 345 with value: 0.13438257115663557.
[I 2024-12-03 19:06:02,792] Trial 1527 finished with value: 0.13835814149629716 and parameters: {'kernel': 'linear', 'C': 4.072648907252291, 'gamma': 0.0011207869095604941, 'epsilon': 0.009350376986542421}. Best is trial 345 with value: 0.13438257115663557.
[I 2024-12-03 19:06:02,798] Trial 1496 finished with value: 0.1355886387545057 and parameters: {'kernel': 'linear', 'C': 45.45609396617347, 'gamma': 0.0009220672846466031, 'epsilon': 0.02755235652359944}. Best is trial 345 with value: 0.13438257115663557.
[I 2024-12-03 19:06:04,499] Trial 1533 finished with value: 49.38451081893451 and parameters: {'kernel': 'sigmoid', 'C': 16.100503421321864, 'gamma': 0.006667693697319365, 'epsilon': 0.05728828705445298}. Best is trial 345 with value: 0.13438257115663557.
[I 2024-12-03 19:06:06,836] Trial 1524 finished with value: 0.1367028446295939 and parameters: {'kernel': 'linear', 'C': 16.75348633678772, 'gamma': 0.0018240204787873704, 'epsilon': 0.050121714295995067}. Best is trial 345 with value: 0.13438257115663557.
[I 2024-12-03 19:06:07,294] Trial 1513 finished with value: 0.1350817854110083 and parameters: {'kernel': 'linear', 'C': 60.97576287420207, 'gamma': 0.0005911985442984163, 'epsilon': 0.05525027049332859}. Best is trial 345 with value: 0.13438257115663557.
[I 2024-12-03 19:06:08,855] Trial 1534 finished with value: 0.1813169131045735 and parameters: {'kernel': 'linear', 'C': 34.4231685211975, 'gamma': 0.0021391736384668673, 'epsilon': 0.20755430776274175}. Best is trial 345 with value: 0.13438257115663557.
