[I 2024-12-04 12:54:40,460] Trial 1135 finished with value: 0.31016852827320496 and parameters: {'n_estimators': 1471, 'learning_rate': 0.048678496862930055, 'max_depth': 8, 'min_samples_split': 3, 'min_samples_leaf': 2, 'subsample': 0.6423337168012515, 'max_features': 'log2'}. Best is trial 621 with value: 0.2256726988932517.
[I 2024-12-04 12:54:41,922] Trial 1148 finished with value: 0.2821446256141386 and parameters: {'n_estimators': 733, 'learning_rate': 0.09542590688776316, 'max_depth': 6, 'min_samples_split': 5, 'min_samples_leaf': 1, 'subsample': 0.9989248239324159, 'max_features': 'sqrt'}. Best is trial 621 with value: 0.2256726988932517.
[I 2024-12-04 12:54:43,875] Trial 1139 finished with value: 0.36471286486440146 and parameters: {'n_estimators': 1285, 'learning_rate': 0.09640314467378135, 'max_depth': 9, 'min_samples_split': 5, 'min_samples_leaf': 4, 'subsample': 0.8287371753027566, 'max_features': 'sqrt'}. Best is trial 621 with value: 0.2256726988932517.
[I 2024-12-04 12:54:44,821] Trial 1146 finished with value: 0.545155978093216 and parameters: {'n_estimators': 882, 'learning_rate': 0.042897757042280306, 'max_depth': 3, 'min_samples_split': 15, 'min_samples_leaf': 4, 'subsample': 0.7631897131050156, 'max_features': 'log2'}. Best is trial 621 with value: 0.2256726988932517.
[I 2024-12-04 12:54:46,333] Trial 1162 finished with value: 1.2370414210392953 and parameters: {'n_estimators': 202, 'learning_rate': 0.0131016669647197, 'max_depth': 7, 'min_samples_split': 12, 'min_samples_leaf': 9, 'subsample': 0.6414270694805861, 'max_features': 'log2'}. Best is trial 621 with value: 0.2256726988932517.
[I 2024-12-04 12:54:46,337] Trial 1138 finished with value: 0.4034529804505823 and parameters: {'n_estimators': 1450, 'learning_rate': 0.059797972159313456, 'max_depth': 4, 'min_samples_split': 14, 'min_samples_leaf': 5, 'subsample': 0.7165603218429131, 'max_features': None}. Best is trial 621 with value: 0.2256726988932517.
[I 2024-12-04 12:54:46,659] Trial 1136 finished with value: 0.252583539037855 and parameters: {'n_estimators': 1476, 'learning_rate': 0.08157053561122297, 'max_depth': 6, 'min_samples_split': 2, 'min_samples_leaf': 1, 'subsample': 0.8278515016140832, 'max_features': 'sqrt'}. Best is trial 621 with value: 0.2256726988932517.
[I 2024-12-04 12:54:52,434] Trial 1160 finished with value: 0.7613427091645083 and parameters: {'n_estimators': 236, 'learning_rate': 0.01451351562898046, 'max_depth': 8, 'min_samples_split': 9, 'min_samples_leaf': 5, 'subsample': 0.966657632193276, 'max_features': 'sqrt'}. Best is trial 621 with value: 0.2256726988932517.
[I 2024-12-04 12:54:52,828] Trial 1140 finished with value: 0.2350810010185125 and parameters: {'n_estimators': 1464, 'learning_rate': 0.09371332495638943, 'max_depth': 8, 'min_samples_split': 3, 'min_samples_leaf': 1, 'subsample': 0.9601209203476672, 'max_features': 'sqrt'}. Best is trial 621 with value: 0.2256726988932517.
[I 2024-12-04 12:54:57,082] Trial 1143 finished with value: 0.2536734108865816 and parameters: {'n_estimators': 1446, 'learning_rate': 0.049870756633446346, 'max_depth': 8, 'min_samples_split': 7, 'min_samples_leaf': 1, 'subsample': 0.8201028424194758, 'max_features': 'sqrt'}. Best is trial 621 with value: 0.2256726988932517.
[I 2024-12-04 12:54:57,405] Trial 1144 finished with value: 0.34795495543871163 and parameters: {'n_estimators': 1318, 'learning_rate': 0.0627662471930819, 'max_depth': 9, 'min_samples_split': 5, 'min_samples_leaf': 3, 'subsample': 0.6834892484429935, 'max_features': 'sqrt'}. Best is trial 621 with value: 0.2256726988932517.
[I 2024-12-04 12:55:09,236] Trial 1171 finished with value: 0.8249272512239885 and parameters: {'n_estimators': 324, 'learning_rate': 0.014719020372197026, 'max_depth': 4, 'min_samples_split': 16, 'min_samples_leaf': 5, 'subsample': 0.9123342264372442, 'max_features': 'sqrt'}. Best is trial 621 with value: 0.2256726988932517.
[I 2024-12-04 12:55:10,975] Trial 1155 finished with value: 0.408155726319665 and parameters: {'n_estimators': 1006, 'learning_rate': 0.010363140552509167, 'max_depth': 12, 'min_samples_split': 14, 'min_samples_leaf': 5, 'subsample': 0.8973641955740841, 'max_features': 'sqrt'}. Best is trial 621 with value: 0.2256726988932517.
[I 2024-12-04 12:55:12,748] Trial 1150 finished with value: 0.2741234598678655 and parameters: {'n_estimators': 1256, 'learning_rate': 0.057828178231083285, 'max_depth': 9, 'min_samples_split': 8, 'min_samples_leaf': 1, 'subsample': 0.6669670066819261, 'max_features': 'sqrt'}. Best is trial 621 with value: 0.2256726988932517.
[I 2024-12-04 12:55:15,945] Trial 1149 finished with value: 0.25991053452710217 and parameters: {'n_estimators': 1343, 'learning_rate': 0.06986246814704908, 'max_depth': 8, 'min_samples_split': 4, 'min_samples_leaf': 1, 'subsample': 0.8465824278920638, 'max_features': 'sqrt'}. Best is trial 621 with value: 0.2256726988932517.
[I 2024-12-04 12:55:15,974] Trial 1151 finished with value: 0.370940236076587 and parameters: {'n_estimators': 1340, 'learning_rate': 0.03443671824612623, 'max_depth': 3, 'min_samples_split': 14, 'min_samples_leaf': 4, 'subsample': 0.7696654504291334, 'max_features': 'sqrt'}. Best is trial 621 with value: 0.2256726988932517.
[I 2024-12-04 12:55:17,840] Trial 1147 finished with value: 0.24326238288011443 and parameters: {'n_estimators': 1466, 'learning_rate': 0.057850001714431144, 'max_depth': 8, 'min_samples_split': 2, 'min_samples_leaf': 1, 'subsample': 0.6109081419105957, 'max_features': 'sqrt'}. Best is trial 621 with value: 0.2256726988932517.
[I 2024-12-04 12:55:22,191] Trial 1159 finished with value: 0.2814458228269865 and parameters: {'n_estimators': 913, 'learning_rate': 0.09159260991084639, 'max_depth': 7, 'min_samples_split': 4, 'min_samples_leaf': 1, 'subsample': 0.852250644207063, 'max_features': 'sqrt'}. Best is trial 621 with value: 0.2256726988932517.
[I 2024-12-04 12:55:24,418] Trial 1176 finished with value: 0.4161932560581297 and parameters: {'n_estimators': 330, 'learning_rate': 0.07361858540341684, 'max_depth': 5, 'min_samples_split': 3, 'min_samples_leaf': 6, 'subsample': 0.7075284713771, 'max_features': None}. Best is trial 621 with value: 0.2256726988932517.
[I 2024-12-04 12:55:26,288] Trial 1152 finished with value: 0.45305937974318344 and parameters: {'n_estimators': 1375, 'learning_rate': 0.0444971130506367, 'max_depth': 6, 'min_samples_split': 19, 'min_samples_leaf': 8, 'subsample': 0.7785159129661743, 'max_features': None}. Best is trial 621 with value: 0.2256726988932517.
[I 2024-12-04 12:55:26,300] Trial 1174 finished with value: 0.5180545801933738 and parameters: {'n_estimators': 413, 'learning_rate': 0.045996519144504484, 'max_depth': 11, 'min_samples_split': 15, 'min_samples_leaf': 10, 'subsample': 0.9947989517025047, 'max_features': 'sqrt'}. Best is trial 621 with value: 0.2256726988932517.
[I 2024-12-04 12:55:30,809] Trial 1161 finished with value: 0.30450505212783774 and parameters: {'n_estimators': 1087, 'learning_rate': 0.0786378909922335, 'max_depth': 10, 'min_samples_split': 3, 'min_samples_leaf': 1, 'subsample': 0.9986069235698496, 'max_features': 'sqrt'}. Best is trial 621 with value: 0.2256726988932517.
[I 2024-12-04 12:55:31,481] Trial 1163 finished with value: 0.2695288287471527 and parameters: {'n_estimators': 989, 'learning_rate': 0.058338190116259014, 'max_depth': 11, 'min_samples_split': 5, 'min_samples_leaf': 1, 'subsample': 0.6491272659104075, 'max_features': 'sqrt'}. Best is trial 621 with value: 0.2256726988932517.
[I 2024-12-04 12:55:32,637] Trial 1180 finished with value: 0.6886150316766588 and parameters: {'n_estimators': 388, 'learning_rate': 0.013412763560240556, 'max_depth': 5, 'min_samples_split': 4, 'min_samples_leaf': 4, 'subsample': 0.9093859152339854, 'max_features': 'sqrt'}. Best is trial 621 with value: 0.2256726988932517.
[I 2024-12-04 12:55:34,444] Trial 1153 finished with value: 0.34915097533280126 and parameters: {'n_estimators': 1403, 'learning_rate': 0.06387944025703442, 'max_depth': 6, 'min_samples_split': 2, 'min_samples_leaf': 3, 'subsample': 0.6956328630936328, 'max_features': 'sqrt'}. Best is trial 621 with value: 0.2256726988932517.
[I 2024-12-04 12:55:37,639] Trial 1156 finished with value: 0.23091503134414737 and parameters: {'n_estimators': 1352, 'learning_rate': 0.08587361115415866, 'max_depth': 8, 'min_samples_split': 3, 'min_samples_leaf': 1, 'subsample': 0.856663328185504, 'max_features': 'sqrt'}. Best is trial 621 with value: 0.2256726988932517.
[I 2024-12-04 12:55:41,568] Trial 1154 finished with value: 0.23994764705004207 and parameters: {'n_estimators': 1498, 'learning_rate': 0.07544761744027306, 'max_depth': 5, 'min_samples_split': 2, 'min_samples_leaf': 1, 'subsample': 0.6629662914930384, 'max_features': 'sqrt'}. Best is trial 621 with value: 0.2256726988932517.
[I 2024-12-04 12:55:43,586] Trial 1192 finished with value: 1.2298759003811175 and parameters: {'n_estimators': 122, 'learning_rate': 0.019761240523406047, 'max_depth': 12, 'min_samples_split': 14, 'min_samples_leaf': 9, 'subsample': 0.9831106901202271, 'max_features': 'log2'}. Best is trial 621 with value: 0.2256726988932517.
[I 2024-12-04 12:55:46,306] Trial 1168 finished with value: 0.34138864974643224 and parameters: {'n_estimators': 883, 'learning_rate': 0.026259554937235585, 'max_depth': 5, 'min_samples_split': 10, 'min_samples_leaf': 1, 'subsample': 0.8866814127162674, 'max_features': None}. Best is trial 621 with value: 0.2256726988932517.
[I 2024-12-04 12:55:48,690] Trial 1157 finished with value: 0.228453070731051 and parameters: {'n_estimators': 1447, 'learning_rate': 0.09634164657824627, 'max_depth': 7, 'min_samples_split': 6, 'min_samples_leaf': 1, 'subsample': 0.7557979784357237, 'max_features': 'sqrt'}. Best is trial 621 with value: 0.2256726988932517.
[I 2024-12-04 12:55:51,019] Trial 1158 finished with value: 0.3367022735650536 and parameters: {'n_estimators': 1309, 'learning_rate': 0.012353098414251867, 'max_depth': 12, 'min_samples_split': 14, 'min_samples_leaf': 2, 'subsample': 0.6019799737273477, 'max_features': None}. Best is trial 621 with value: 0.2256726988932517.
[I 2024-12-04 12:55:58,091] Trial 1170 finished with value: 0.349922505729688 and parameters: {'n_estimators': 1092, 'learning_rate': 0.06704337413894314, 'max_depth': 7, 'min_samples_split': 2, 'min_samples_leaf': 3, 'subsample': 0.9057884603939386, 'max_features': 'sqrt'}. Best is trial 621 with value: 0.2256726988932517.
[I 2024-12-04 12:56:00,329] Trial 1165 finished with value: 0.42770292048995395 and parameters: {'n_estimators': 1363, 'learning_rate': 0.029731724350672395, 'max_depth': 5, 'min_samples_split': 7, 'min_samples_leaf': 2, 'subsample': 0.6096180121535012, 'max_features': 'log2'}. Best is trial 621 with value: 0.2256726988932517.
[I 2024-12-04 12:56:02,645] Trial 1164 finished with value: 0.34867075419385657 and parameters: {'n_estimators': 1454, 'learning_rate': 0.0868845376736694, 'max_depth': 5, 'min_samples_split': 2, 'min_samples_leaf': 3, 'subsample': 0.7216556008281038, 'max_features': 'sqrt'}. Best is trial 621 with value: 0.2256726988932517.
[I 2024-12-04 12:56:06,897] Trial 1169 finished with value: 0.39329973559930476 and parameters: {'n_estimators': 1298, 'learning_rate': 0.013514747293810572, 'max_depth': 5, 'min_samples_split': 13, 'min_samples_leaf': 2, 'subsample': 0.9029035664155085, 'max_features': 'sqrt'}. Best is trial 621 with value: 0.2256726988932517.
[I 2024-12-04 12:56:08,246] Trial 1167 finished with value: 0.24996732884344275 and parameters: {'n_estimators': 1400, 'learning_rate': 0.06684138751450794, 'max_depth': 8, 'min_samples_split': 5, 'min_samples_leaf': 1, 'subsample': 0.8111283614779602, 'max_features': 'sqrt'}. Best is trial 621 with value: 0.2256726988932517.
[I 2024-12-04 12:56:11,221] Trial 1166 finished with value: 0.24771145739735215 and parameters: {'n_estimators': 1455, 'learning_rate': 0.06952333062084891, 'max_depth': 8, 'min_samples_split': 7, 'min_samples_leaf': 1, 'subsample': 0.6601160576309777, 'max_features': 'sqrt'}. Best is trial 621 with value: 0.2256726988932517.
[I 2024-12-04 12:56:11,313] Trial 1175 finished with value: 0.5623481523644633 and parameters: {'n_estimators': 1153, 'learning_rate': 0.06559825372638456, 'max_depth': 4, 'min_samples_split': 2, 'min_samples_leaf': 10, 'subsample': 0.9024789723999002, 'max_features': 'log2'}. Best is trial 621 with value: 0.2256726988932517.
[I 2024-12-04 12:56:14,706] Trial 1202 finished with value: 0.9095052482783134 and parameters: {'n_estimators': 206, 'learning_rate': 0.055380632118853614, 'max_depth': 4, 'min_samples_split': 14, 'min_samples_leaf': 4, 'subsample': 0.6216112906338955, 'max_features': 'log2'}. Best is trial 621 with value: 0.2256726988932517.
[I 2024-12-04 12:56:14,815] Trial 1200 finished with value: 0.5280474605118074 and parameters: {'n_estimators': 364, 'learning_rate': 0.0465010728425076, 'max_depth': 3, 'min_samples_split': 16, 'min_samples_leaf': 1, 'subsample': 0.8515742353262314, 'max_features': 'sqrt'}. Best is trial 621 with value: 0.2256726988932517.
[I 2024-12-04 12:56:19,373] Trial 1193 finished with value: 0.7673890901724283 and parameters: {'n_estimators': 662, 'learning_rate': 0.026085845410845163, 'max_depth': 4, 'min_samples_split': 2, 'min_samples_leaf': 6, 'subsample': 0.8459920196937426, 'max_features': 'log2'}. Best is trial 621 with value: 0.2256726988932517.
[I 2024-12-04 12:56:26,764] Trial 1177 finished with value: 0.2554385114837058 and parameters: {'n_estimators': 1355, 'learning_rate': 0.06936563288216424, 'max_depth': 9, 'min_samples_split': 5, 'min_samples_leaf': 1, 'subsample': 0.9166220169065599, 'max_features': 'sqrt'}. Best is trial 621 with value: 0.2256726988932517.
[I 2024-12-04 12:56:27,777] Trial 1173 finished with value: 0.2556488912274704 and parameters: {'n_estimators': 1473, 'learning_rate': 0.058083979520686585, 'max_depth': 10, 'min_samples_split': 8, 'min_samples_leaf': 1, 'subsample': 0.6240867516551494, 'max_features': 'log2'}. Best is trial 621 with value: 0.2256726988932517.
[I 2024-12-04 12:56:27,795] Trial 1181 finished with value: 0.4443543562007033 and parameters: {'n_estimators': 1181, 'learning_rate': 0.07791585488132127, 'max_depth': 7, 'min_samples_split': 2, 'min_samples_leaf': 8, 'subsample': 0.8694928929858629, 'max_features': None}. Best is trial 621 with value: 0.2256726988932517.
[I 2024-12-04 12:56:29,660] Trial 1179 finished with value: 0.495129229225525 and parameters: {'n_estimators': 1315, 'learning_rate': 0.023486150119606405, 'max_depth': 5, 'min_samples_split': 14, 'min_samples_leaf': 3, 'subsample': 0.7944376243222669, 'max_features': 'log2'}. Best is trial 621 with value: 0.2256726988932517.
[I 2024-12-04 12:56:31,886] Trial 1178 finished with value: 0.35133251643158747 and parameters: {'n_estimators': 1392, 'learning_rate': 0.08877354644563666, 'max_depth': 6, 'min_samples_split': 9, 'min_samples_leaf': 3, 'subsample': 0.9503122329849919, 'max_features': 'sqrt'}. Best is trial 621 with value: 0.2256726988932517.
[I 2024-12-04 12:56:32,314] Trial 1182 finished with value: 0.25301891357943423 and parameters: {'n_estimators': 1229, 'learning_rate': 0.06852416448613602, 'max_depth': 8, 'min_samples_split': 4, 'min_samples_leaf': 1, 'subsample': 0.7281231245190808, 'max_features': 'sqrt'}. Best is trial 621 with value: 0.2256726988932517.
[I 2024-12-04 12:56:36,178] Trial 1187 finished with value: 0.24295158373582137 and parameters: {'n_estimators': 1139, 'learning_rate': 0.04083647692110768, 'max_depth': 7, 'min_samples_split': 2, 'min_samples_leaf': 1, 'subsample': 0.6294863543569137, 'max_features': 'sqrt'}. Best is trial 621 with value: 0.2256726988932517.
[I 2024-12-04 12:56:36,182] Trial 1184 finished with value: 0.24502663212789086 and parameters: {'n_estimators': 1271, 'learning_rate': 0.09847996792339589, 'max_depth': 7, 'min_samples_split': 7, 'min_samples_leaf': 1, 'subsample': 0.9377075337885028, 'max_features': 'sqrt'}. Best is trial 621 with value: 0.2256726988932517.
[I 2024-12-04 12:56:36,619] Trial 1172 finished with value: 0.263845342140559 and parameters: {'n_estimators': 1466, 'learning_rate': 0.0604159403803069, 'max_depth': 8, 'min_samples_split': 2, 'min_samples_leaf': 1, 'subsample': 0.8816961257450396, 'max_features': 'sqrt'}. Best is trial 621 with value: 0.2256726988932517.
[I 2024-12-04 12:56:40,576] Trial 1185 finished with value: 0.3492321590939198 and parameters: {'n_estimators': 1299, 'learning_rate': 0.08562686680300097, 'max_depth': 9, 'min_samples_split': 4, 'min_samples_leaf': 3, 'subsample': 0.9356617693336906, 'max_features': 'sqrt'}. Best is trial 621 with value: 0.2256726988932517.
[I 2024-12-04 12:56:42,196] Trial 1189 finished with value: 0.25236104584972796 and parameters: {'n_estimators': 1191, 'learning_rate': 0.06106987854416043, 'max_depth': 8, 'min_samples_split': 5, 'min_samples_leaf': 1, 'subsample': 0.7919815722478716, 'max_features': 'sqrt'}. Best is trial 621 with value: 0.2256726988932517.
[I 2024-12-04 12:56:47,737] Trial 1191 finished with value: 0.3511270412350718 and parameters: {'n_estimators': 1238, 'learning_rate': 0.06683015483246234, 'max_depth': 7, 'min_samples_split': 5, 'min_samples_leaf': 3, 'subsample': 0.9345221844837955, 'max_features': 'sqrt'}. Best is trial 621 with value: 0.2256726988932517.
[I 2024-12-04 12:56:48,303] Trial 1195 finished with value: 0.2912561895621593 and parameters: {'n_estimators': 1075, 'learning_rate': 0.09703753082337249, 'max_depth': 9, 'min_samples_split': 9, 'min_samples_leaf': 2, 'subsample': 0.6957576990588293, 'max_features': 'sqrt'}. Best is trial 621 with value: 0.2256726988932517.
[I 2024-12-04 12:56:49,885] Trial 1183 finished with value: 0.23552387789741833 and parameters: {'n_estimators': 1480, 'learning_rate': 0.07717247126890764, 'max_depth': 8, 'min_samples_split': 3, 'min_samples_leaf': 1, 'subsample': 0.8874913269992032, 'max_features': 'sqrt'}. Best is trial 621 with value: 0.2256726988932517.
[I 2024-12-04 12:56:50,930] Trial 1196 finished with value: 0.25282120595551333 and parameters: {'n_estimators': 1065, 'learning_rate': 0.06746646538753728, 'max_depth': 9, 'min_samples_split': 2, 'min_samples_leaf': 1, 'subsample': 0.8482494255280195, 'max_features': 'sqrt'}. Best is trial 621 with value: 0.2256726988932517.
[I 2024-12-04 12:56:51,144] Trial 1188 finished with value: 0.30591741016501656 and parameters: {'n_estimators': 1405, 'learning_rate': 0.08955478050982135, 'max_depth': 9, 'min_samples_split': 5, 'min_samples_leaf': 2, 'subsample': 0.9511076917824092, 'max_features': 'sqrt'}. Best is trial 621 with value: 0.2256726988932517.
[I 2024-12-04 12:56:52,995] Trial 1186 finished with value: 0.3420218333182741 and parameters: {'n_estimators': 1461, 'learning_rate': 0.09112124060071956, 'max_depth': 8, 'min_samples_split': 6, 'min_samples_leaf': 3, 'subsample': 0.9540095491833878, 'max_features': 'sqrt'}. Best is trial 621 with value: 0.2256726988932517.
[I 2024-12-04 12:56:56,902] Trial 1198 finished with value: 0.4232088089129323 and parameters: {'n_estimators': 973, 'learning_rate': 0.04962521804252703, 'max_depth': 9, 'min_samples_split': 8, 'min_samples_leaf': 4, 'subsample': 0.700811085936158, 'max_features': None}. Best is trial 621 with value: 0.2256726988932517.
[I 2024-12-04 12:56:57,839] Trial 1199 finished with value: 0.26335642609398524 and parameters: {'n_estimators': 1109, 'learning_rate': 0.07697967340993692, 'max_depth': 9, 'min_samples_split': 5, 'min_samples_leaf': 1, 'subsample': 0.8427121935538481, 'max_features': 'sqrt'}. Best is trial 621 with value: 0.2256726988932517.
[I 2024-12-04 12:56:58,601] Trial 1190 finished with value: 0.23924862124592247 and parameters: {'n_estimators': 1436, 'learning_rate': 0.09080627788593369, 'max_depth': 7, 'min_samples_split': 3, 'min_samples_leaf': 1, 'subsample': 0.926575545905389, 'max_features': 'sqrt'}. Best is trial 621 with value: 0.2256726988932517.
[I 2024-12-04 12:57:01,901] Trial 1197 finished with value: 0.34655916877684767 and parameters: {'n_estimators': 1220, 'learning_rate': 0.08079248133213451, 'max_depth': 9, 'min_samples_split': 7, 'min_samples_leaf': 3, 'subsample': 0.767391363153765, 'max_features': 'sqrt'}. Best is trial 621 with value: 0.2256726988932517.
[I 2024-12-04 12:57:05,920] Trial 1212 finished with value: 0.4108684951126226 and parameters: {'n_estimators': 558, 'learning_rate': 0.023183498267854836, 'max_depth': 3, 'min_samples_split': 2, 'min_samples_leaf': 2, 'subsample': 0.7777542714298676, 'max_features': None}. Best is trial 621 with value: 0.2256726988932517.
[I 2024-12-04 12:57:09,313] Trial 1194 finished with value: 0.32789741102320497 and parameters: {'n_estimators': 1357, 'learning_rate': 0.06688398794161658, 'max_depth': 7, 'min_samples_split': 7, 'min_samples_leaf': 2, 'subsample': 0.8826401530778726, 'max_features': None}. Best is trial 621 with value: 0.2256726988932517.
[I 2024-12-04 12:57:15,384] Trial 1201 finished with value: 0.25672123861252233 and parameters: {'n_estimators': 1390, 'learning_rate': 0.07258951844352873, 'max_depth': 7, 'min_samples_split': 11, 'min_samples_leaf': 1, 'subsample': 0.7272615460540977, 'max_features': 'sqrt'}. Best is trial 621 with value: 0.2256726988932517.
[I 2024-12-04 12:57:19,658] Trial 1204 finished with value: 0.3570296499273598 and parameters: {'n_estimators': 1268, 'learning_rate': 0.0972538890974741, 'max_depth': 8, 'min_samples_split': 2, 'min_samples_leaf': 3, 'subsample': 0.8606688443695143, 'max_features': 'sqrt'}. Best is trial 621 with value: 0.2256726988932517.
[I 2024-12-04 12:57:20,919] Trial 1228 finished with value: 1.108985315488228 and parameters: {'n_estimators': 247, 'learning_rate': 0.02086225241221066, 'max_depth': 8, 'min_samples_split': 16, 'min_samples_leaf': 6, 'subsample': 0.7084436763362392, 'max_features': 'log2'}. Best is trial 621 with value: 0.2256726988932517.
