[I 2024-12-04 12:38:51,919] Trial 749 finished with value: 0.31650864871473317 and parameters: {'n_estimators': 656, 'learning_rate': 0.08797175486213926, 'max_depth': 6, 'min_samples_split': 3, 'min_samples_leaf': 2, 'subsample': 0.9283400833911303, 'max_features': 'sqrt'}. Best is trial 621 with value: 0.2256726988932517.
[I 2024-12-04 12:38:52,226] Trial 734 finished with value: 0.2401284642659627 and parameters: {'n_estimators': 1124, 'learning_rate': 0.08094851362264434, 'max_depth': 6, 'min_samples_split': 3, 'min_samples_leaf': 1, 'subsample': 0.7445966144914891, 'max_features': 'sqrt'}. Best is trial 621 with value: 0.2256726988932517.
[I 2024-12-04 12:38:54,705] Trial 741 finished with value: 0.2460187404805894 and parameters: {'n_estimators': 971, 'learning_rate': 0.07484623528327558, 'max_depth': 8, 'min_samples_split': 6, 'min_samples_leaf': 1, 'subsample': 0.9011288706641735, 'max_features': 'sqrt'}. Best is trial 621 with value: 0.2256726988932517.
[I 2024-12-04 12:38:56,985] Trial 743 finished with value: 0.3438566189470067 and parameters: {'n_estimators': 840, 'learning_rate': 0.0956505173289299, 'max_depth': 8, 'min_samples_split': 2, 'min_samples_leaf': 3, 'subsample': 0.9195113128921752, 'max_features': 'sqrt'}. Best is trial 621 with value: 0.2256726988932517.
[I 2024-12-04 12:38:57,044] Trial 759 finished with value: 0.49655623497550616 and parameters: {'n_estimators': 265, 'learning_rate': 0.036075437594815844, 'max_depth': 5, 'min_samples_split': 14, 'min_samples_leaf': 10, 'subsample': 0.9830098829721099, 'max_features': None}. Best is trial 621 with value: 0.2256726988932517.
[I 2024-12-04 12:39:02,854] Trial 747 finished with value: 0.24698444321920873 and parameters: {'n_estimators': 839, 'learning_rate': 0.06184213606111031, 'max_depth': 8, 'min_samples_split': 2, 'min_samples_leaf': 1, 'subsample': 0.7382784526494626, 'max_features': 'sqrt'}. Best is trial 621 with value: 0.2256726988932517.
[I 2024-12-04 12:39:02,896] Trial 735 finished with value: 0.22747961648106488 and parameters: {'n_estimators': 1300, 'learning_rate': 0.07059115363124562, 'max_depth': 12, 'min_samples_split': 5, 'min_samples_leaf': 1, 'subsample': 0.6759672470956266, 'max_features': 'sqrt'}. Best is trial 621 with value: 0.2256726988932517.
[I 2024-12-04 12:39:05,212] Trial 740 finished with value: 0.3573617038987138 and parameters: {'n_estimators': 1179, 'learning_rate': 0.08028652167568162, 'max_depth': 6, 'min_samples_split': 4, 'min_samples_leaf': 3, 'subsample': 0.9488963975712574, 'max_features': 'log2'}. Best is trial 621 with value: 0.2256726988932517.
[I 2024-12-04 12:39:08,380] Trial 745 finished with value: 0.26239741838540953 and parameters: {'n_estimators': 997, 'learning_rate': 0.09628796999954804, 'max_depth': 9, 'min_samples_split': 3, 'min_samples_leaf': 1, 'subsample': 0.9083559972447718, 'max_features': 'log2'}. Best is trial 621 with value: 0.2256726988932517.
[I 2024-12-04 12:39:08,738] Trial 737 finished with value: 0.24109803844054933 and parameters: {'n_estimators': 1307, 'learning_rate': 0.09014929594067121, 'max_depth': 8, 'min_samples_split': 7, 'min_samples_leaf': 1, 'subsample': 0.7928108437283217, 'max_features': 'sqrt'}. Best is trial 621 with value: 0.2256726988932517.
[I 2024-12-04 12:39:12,474] Trial 739 finished with value: 0.3831091639875616 and parameters: {'n_estimators': 1403, 'learning_rate': 0.06154483930935483, 'max_depth': 3, 'min_samples_split': 13, 'min_samples_leaf': 6, 'subsample': 0.9408916594230894, 'max_features': 'sqrt'}. Best is trial 621 with value: 0.2256726988932517.
[I 2024-12-04 12:39:12,500] Trial 742 finished with value: 0.3548375903458684 and parameters: {'n_estimators': 1257, 'learning_rate': 0.08877202115769811, 'max_depth': 7, 'min_samples_split': 2, 'min_samples_leaf': 3, 'subsample': 0.8542639247095433, 'max_features': 'sqrt'}. Best is trial 621 with value: 0.2256726988932517.
[I 2024-12-04 12:39:15,431] Trial 756 finished with value: 0.24422727635003555 and parameters: {'n_estimators': 808, 'learning_rate': 0.06650241540066061, 'max_depth': 8, 'min_samples_split': 3, 'min_samples_leaf': 1, 'subsample': 0.9116729495832195, 'max_features': 'sqrt'}. Best is trial 621 with value: 0.2256726988932517.
[I 2024-12-04 12:39:16,845] Trial 754 finished with value: 0.2686976942327035 and parameters: {'n_estimators': 945, 'learning_rate': 0.09769837953818197, 'max_depth': 6, 'min_samples_split': 7, 'min_samples_leaf': 1, 'subsample': 0.8560360600025715, 'max_features': 'sqrt'}. Best is trial 621 with value: 0.2256726988932517.
[I 2024-12-04 12:39:18,469] Trial 748 finished with value: 0.3521197420466645 and parameters: {'n_estimators': 1149, 'learning_rate': 0.03372180343151874, 'max_depth': 12, 'min_samples_split': 7, 'min_samples_leaf': 3, 'subsample': 0.6100762093703568, 'max_features': 'sqrt'}. Best is trial 621 with value: 0.2256726988932517.
[I 2024-12-04 12:39:23,551] Trial 744 finished with value: 0.42692407459139187 and parameters: {'n_estimators': 1290, 'learning_rate': 0.06365556897177593, 'max_depth': 3, 'min_samples_split': 2, 'min_samples_leaf': 7, 'subsample': 0.9723376329835179, 'max_features': None}. Best is trial 621 with value: 0.2256726988932517.
[I 2024-12-04 12:39:24,438] Trial 746 finished with value: 0.24363262978067712 and parameters: {'n_estimators': 1251, 'learning_rate': 0.054712834599439625, 'max_depth': 12, 'min_samples_split': 2, 'min_samples_leaf': 1, 'subsample': 0.626139371363507, 'max_features': 'sqrt'}. Best is trial 621 with value: 0.2256726988932517.
[I 2024-12-04 12:39:25,357] Trial 752 finished with value: 0.36188151666910046 and parameters: {'n_estimators': 1169, 'learning_rate': 0.07848560453674536, 'max_depth': 8, 'min_samples_split': 4, 'min_samples_leaf': 4, 'subsample': 0.9705427805448097, 'max_features': 'sqrt'}. Best is trial 621 with value: 0.2256726988932517.
[I 2024-12-04 12:39:31,501] Trial 774 finished with value: 1.0033797534552609 and parameters: {'n_estimators': 389, 'learning_rate': 0.024432163871506627, 'max_depth': 7, 'min_samples_split': 17, 'min_samples_leaf': 7, 'subsample': 0.9389251916024959, 'max_features': 'log2'}. Best is trial 621 with value: 0.2256726988932517.
[I 2024-12-04 12:39:32,258] Trial 779 finished with value: 0.534065900694498 and parameters: {'n_estimators': 222, 'learning_rate': 0.029451801589470222, 'max_depth': 10, 'min_samples_split': 5, 'min_samples_leaf': 10, 'subsample': 0.611983602678159, 'max_features': None}. Best is trial 621 with value: 0.2256726988932517.
[I 2024-12-04 12:39:35,950] Trial 761 finished with value: 0.2992014509293398 and parameters: {'n_estimators': 876, 'learning_rate': 0.09268656690948777, 'max_depth': 8, 'min_samples_split': 2, 'min_samples_leaf': 1, 'subsample': 0.9490677110231711, 'max_features': 'sqrt'}. Best is trial 621 with value: 0.2256726988932517.
[I 2024-12-04 12:39:38,525] Trial 753 finished with value: 0.2925962995457528 and parameters: {'n_estimators': 1368, 'learning_rate': 0.05170150904748259, 'max_depth': 12, 'min_samples_split': 6, 'min_samples_leaf': 2, 'subsample': 0.6720343301479283, 'max_features': 'sqrt'}. Best is trial 621 with value: 0.2256726988932517.
[I 2024-12-04 12:39:38,677] Trial 757 finished with value: 0.2639923048512551 and parameters: {'n_estimators': 1176, 'learning_rate': 0.09736987583824763, 'max_depth': 9, 'min_samples_split': 2, 'min_samples_leaf': 1, 'subsample': 0.901124242550515, 'max_features': 'sqrt'}. Best is trial 621 with value: 0.2256726988932517.
[I 2024-12-04 12:39:41,698] Trial 750 finished with value: 0.2406976206663879 and parameters: {'n_estimators': 1498, 'learning_rate': 0.029682295207012047, 'max_depth': 8, 'min_samples_split': 2, 'min_samples_leaf': 1, 'subsample': 0.6453751982748043, 'max_features': 'sqrt'}. Best is trial 621 with value: 0.2256726988932517.
[I 2024-12-04 12:39:45,492] Trial 765 finished with value: 0.23945144844400348 and parameters: {'n_estimators': 954, 'learning_rate': 0.09694834338911062, 'max_depth': 5, 'min_samples_split': 2, 'min_samples_leaf': 1, 'subsample': 0.6920879089200416, 'max_features': 'sqrt'}. Best is trial 621 with value: 0.2256726988932517.
[I 2024-12-04 12:39:45,496] Trial 770 finished with value: 0.26115856895733547 and parameters: {'n_estimators': 766, 'learning_rate': 0.04965542381785185, 'max_depth': 8, 'min_samples_split': 2, 'min_samples_leaf': 1, 'subsample': 0.7639058293068096, 'max_features': 'sqrt'}. Best is trial 621 with value: 0.2256726988932517.
[I 2024-12-04 12:39:49,618] Trial 755 finished with value: 0.2891898010822209 and parameters: {'n_estimators': 1450, 'learning_rate': 0.044355965782297654, 'max_depth': 11, 'min_samples_split': 6, 'min_samples_leaf': 2, 'subsample': 0.722112984794729, 'max_features': 'sqrt'}. Best is trial 621 with value: 0.2256726988932517.
[I 2024-12-04 12:39:51,733] Trial 751 finished with value: 0.4047928323978799 and parameters: {'n_estimators': 1467, 'learning_rate': 0.05205862655317348, 'max_depth': 10, 'min_samples_split': 2, 'min_samples_leaf': 3, 'subsample': 0.815948554238977, 'max_features': None}. Best is trial 621 with value: 0.2256726988932517.
[I 2024-12-04 12:39:59,723] Trial 762 finished with value: 0.2580123998700863 and parameters: {'n_estimators': 1288, 'learning_rate': 0.03337814042137743, 'max_depth': 12, 'min_samples_split': 6, 'min_samples_leaf': 1, 'subsample': 0.6221107038152328, 'max_features': 'sqrt'}. Best is trial 621 with value: 0.2256726988932517.
[I 2024-12-04 12:40:03,144] Trial 767 finished with value: 0.24214486457148612 and parameters: {'n_estimators': 1196, 'learning_rate': 0.08756238458255827, 'max_depth': 8, 'min_samples_split': 6, 'min_samples_leaf': 1, 'subsample': 0.9767657834266216, 'max_features': 'sqrt'}. Best is trial 621 with value: 0.2256726988932517.
[I 2024-12-04 12:40:04,734] Trial 776 finished with value: 0.2510299778489727 and parameters: {'n_estimators': 932, 'learning_rate': 0.09640164473020081, 'max_depth': 6, 'min_samples_split': 7, 'min_samples_leaf': 1, 'subsample': 0.9265221810030512, 'max_features': 'sqrt'}. Best is trial 621 with value: 0.2256726988932517.
[I 2024-12-04 12:40:05,437] Trial 781 finished with value: 1.0355793402887936 and parameters: {'n_estimators': 778, 'learning_rate': 0.0192010795826071, 'max_depth': 10, 'min_samples_split': 16, 'min_samples_leaf': 9, 'subsample': 0.6024734016157911, 'max_features': 'log2'}. Best is trial 621 with value: 0.2256726988932517.
[I 2024-12-04 12:40:06,944] Trial 766 finished with value: 0.25654152524701246 and parameters: {'n_estimators': 1290, 'learning_rate': 0.046583759689495734, 'max_depth': 10, 'min_samples_split': 4, 'min_samples_leaf': 1, 'subsample': 0.7230974448409612, 'max_features': 'sqrt'}. Best is trial 621 with value: 0.2256726988932517.
[I 2024-12-04 12:40:06,946] Trial 763 finished with value: 0.25892713400346457 and parameters: {'n_estimators': 1365, 'learning_rate': 0.041076973059892274, 'max_depth': 12, 'min_samples_split': 2, 'min_samples_leaf': 1, 'subsample': 0.7183317262320744, 'max_features': 'sqrt'}. Best is trial 621 with value: 0.2256726988932517.
[I 2024-12-04 12:40:12,771] Trial 768 finished with value: 0.3743010244481001 and parameters: {'n_estimators': 1238, 'learning_rate': 0.07021377246201092, 'max_depth': 12, 'min_samples_split': 8, 'min_samples_leaf': 3, 'subsample': 0.6464666163922409, 'max_features': 'sqrt'}. Best is trial 621 with value: 0.2256726988932517.
[I 2024-12-04 12:40:15,098] Trial 771 finished with value: 0.3092669270259336 and parameters: {'n_estimators': 1158, 'learning_rate': 0.0441545248854894, 'max_depth': 5, 'min_samples_split': 15, 'min_samples_leaf': 1, 'subsample': 0.8050879062256978, 'max_features': None}. Best is trial 621 with value: 0.2256726988932517.
[I 2024-12-04 12:40:15,107] Trial 782 finished with value: 0.4736566268211566 and parameters: {'n_estimators': 835, 'learning_rate': 0.042414254128434234, 'max_depth': 11, 'min_samples_split': 16, 'min_samples_leaf': 10, 'subsample': 0.6972254336597941, 'max_features': None}. Best is trial 621 with value: 0.2256726988932517.
[I 2024-12-04 12:40:15,150] Trial 772 finished with value: 0.2836275827181328 and parameters: {'n_estimators': 1215, 'learning_rate': 0.09901522584891241, 'max_depth': 6, 'min_samples_split': 2, 'min_samples_leaf': 2, 'subsample': 0.9271504115769604, 'max_features': 'sqrt'}. Best is trial 621 with value: 0.2256726988932517.
[I 2024-12-04 12:40:17,543] Trial 760 finished with value: 0.32214193053746487 and parameters: {'n_estimators': 1495, 'learning_rate': 0.04997096871634425, 'max_depth': 9, 'min_samples_split': 3, 'min_samples_leaf': 1, 'subsample': 0.6130683852708898, 'max_features': None}. Best is trial 621 with value: 0.2256726988932517.
[I 2024-12-04 12:40:18,631] Trial 775 finished with value: 0.2879950823392419 and parameters: {'n_estimators': 1150, 'learning_rate': 0.07905266324861256, 'max_depth': 12, 'min_samples_split': 3, 'min_samples_leaf': 2, 'subsample': 0.6127927766545733, 'max_features': 'sqrt'}. Best is trial 621 with value: 0.2256726988932517.
[I 2024-12-04 12:40:19,453] Trial 764 finished with value: 0.2493247107987928 and parameters: {'n_estimators': 1483, 'learning_rate': 0.0487277161517052, 'max_depth': 11, 'min_samples_split': 5, 'min_samples_leaf': 1, 'subsample': 0.6545896270569891, 'max_features': 'sqrt'}. Best is trial 621 with value: 0.2256726988932517.
[I 2024-12-04 12:40:20,983] Trial 769 finished with value: 0.4438162117158835 and parameters: {'n_estimators': 1250, 'learning_rate': 0.016217107965852726, 'max_depth': 8, 'min_samples_split': 14, 'min_samples_leaf': 6, 'subsample': 0.9437861972838859, 'max_features': None}. Best is trial 621 with value: 0.2256726988932517.
[I 2024-12-04 12:40:22,808] Trial 785 finished with value: 0.28960378120149793 and parameters: {'n_estimators': 906, 'learning_rate': 0.074614589973057, 'max_depth': 6, 'min_samples_split': 3, 'min_samples_leaf': 2, 'subsample': 0.899341244148195, 'max_features': 'sqrt'}. Best is trial 621 with value: 0.2256726988932517.
[I 2024-12-04 12:40:24,251] Trial 786 finished with value: 0.27732548538986923 and parameters: {'n_estimators': 895, 'learning_rate': 0.09692826656396744, 'max_depth': 8, 'min_samples_split': 2, 'min_samples_leaf': 1, 'subsample': 0.8943741607260033, 'max_features': 'sqrt'}. Best is trial 621 with value: 0.2256726988932517.
[I 2024-12-04 12:40:24,583] Trial 777 finished with value: 0.2507823474084827 and parameters: {'n_estimators': 1198, 'learning_rate': 0.06321956968394575, 'max_depth': 11, 'min_samples_split': 5, 'min_samples_leaf': 1, 'subsample': 0.7169980691944573, 'max_features': 'sqrt'}. Best is trial 621 with value: 0.2256726988932517.
[I 2024-12-04 12:40:28,415] Trial 780 finished with value: 0.2910218745063149 and parameters: {'n_estimators': 1184, 'learning_rate': 0.04548152459838936, 'max_depth': 11, 'min_samples_split': 5, 'min_samples_leaf': 2, 'subsample': 0.6373514049779693, 'max_features': 'sqrt'}. Best is trial 621 with value: 0.2256726988932517.
[I 2024-12-04 12:40:30,321] Trial 778 finished with value: 0.241319457575852 and parameters: {'n_estimators': 1219, 'learning_rate': 0.053872554885581465, 'max_depth': 12, 'min_samples_split': 5, 'min_samples_leaf': 1, 'subsample': 0.7719067607641659, 'max_features': 'sqrt'}. Best is trial 621 with value: 0.2256726988932517.
[I 2024-12-04 12:40:32,339] Trial 784 finished with value: 0.34088546774962125 and parameters: {'n_estimators': 1112, 'learning_rate': 0.09533154544395814, 'max_depth': 4, 'min_samples_split': 2, 'min_samples_leaf': 3, 'subsample': 0.7996717196015933, 'max_features': 'sqrt'}. Best is trial 621 with value: 0.2256726988932517.
[I 2024-12-04 12:40:32,412] Trial 773 finished with value: 0.4059532227474902 and parameters: {'n_estimators': 1435, 'learning_rate': 0.030589565687221917, 'max_depth': 3, 'min_samples_split': 17, 'min_samples_leaf': 5, 'subsample': 0.9041993198953808, 'max_features': None}. Best is trial 621 with value: 0.2256726988932517.
[I 2024-12-04 12:40:35,730] Trial 789 finished with value: 0.5756619025459122 and parameters: {'n_estimators': 1015, 'learning_rate': 0.08811327013572745, 'max_depth': 5, 'min_samples_split': 2, 'min_samples_leaf': 10, 'subsample': 0.7333308734174474, 'max_features': 'log2'}. Best is trial 621 with value: 0.2256726988932517.
[I 2024-12-04 12:40:35,734] Trial 792 finished with value: 0.4859159123725449 and parameters: {'n_estimators': 758, 'learning_rate': 0.01169409640776683, 'max_depth': 10, 'min_samples_split': 20, 'min_samples_leaf': 10, 'subsample': 0.864162912763114, 'max_features': None}. Best is trial 621 with value: 0.2256726988932517.
[I 2024-12-04 12:40:40,702] Trial 783 finished with value: 0.2595165939107486 and parameters: {'n_estimators': 1307, 'learning_rate': 0.05742207424869192, 'max_depth': 12, 'min_samples_split': 7, 'min_samples_leaf': 1, 'subsample': 0.6364784414058146, 'max_features': 'sqrt'}. Best is trial 621 with value: 0.2256726988932517.
[I 2024-12-04 12:40:43,383] Trial 793 finished with value: 0.3394361644020484 and parameters: {'n_estimators': 848, 'learning_rate': 0.04266674056536394, 'max_depth': 6, 'min_samples_split': 3, 'min_samples_leaf': 1, 'subsample': 0.804237754030857, 'max_features': None}. Best is trial 621 with value: 0.2256726988932517.
[I 2024-12-04 12:40:45,163] Trial 787 finished with value: 0.2733209398921854 and parameters: {'n_estimators': 1212, 'learning_rate': 0.07703227942444338, 'max_depth': 3, 'min_samples_split': 3, 'min_samples_leaf': 1, 'subsample': 0.7003195430004098, 'max_features': 'sqrt'}. Best is trial 621 with value: 0.2256726988932517.
[I 2024-12-04 12:40:45,393] Trial 794 finished with value: 0.2660107385133515 and parameters: {'n_estimators': 1001, 'learning_rate': 0.09582203897861832, 'max_depth': 6, 'min_samples_split': 3, 'min_samples_leaf': 1, 'subsample': 0.9209973256446277, 'max_features': 'sqrt'}. Best is trial 621 with value: 0.2256726988932517.
[I 2024-12-04 12:40:49,517] Trial 796 finished with value: 0.48271565185400656 and parameters: {'n_estimators': 933, 'learning_rate': 0.09576000527606561, 'max_depth': 7, 'min_samples_split': 5, 'min_samples_leaf': 10, 'subsample': 0.7240866615592043, 'max_features': None}. Best is trial 621 with value: 0.2256726988932517.
[I 2024-12-04 12:40:51,085] Trial 802 finished with value: 0.42383818806980766 and parameters: {'n_estimators': 574, 'learning_rate': 0.08932639607749772, 'max_depth': 8, 'min_samples_split': 2, 'min_samples_leaf': 2, 'subsample': 0.7712065965734731, 'max_features': None}. Best is trial 621 with value: 0.2256726988932517.
[I 2024-12-04 12:40:51,525] Trial 790 finished with value: 0.5031170449346042 and parameters: {'n_estimators': 1200, 'learning_rate': 0.013911453338233922, 'max_depth': 3, 'min_samples_split': 19, 'min_samples_leaf': 2, 'subsample': 0.6222158791529395, 'max_features': 'sqrt'}. Best is trial 621 with value: 0.2256726988932517.
[I 2024-12-04 12:40:52,171] Trial 806 finished with value: 0.9262216586014851 and parameters: {'n_estimators': 542, 'learning_rate': 0.02276710286735755, 'max_depth': 11, 'min_samples_split': 6, 'min_samples_leaf': 6, 'subsample': 0.669564247598726, 'max_features': 'log2'}. Best is trial 621 with value: 0.2256726988932517.
[I 2024-12-04 12:40:54,618] Trial 788 finished with value: 0.24995013875214822 and parameters: {'n_estimators': 1365, 'learning_rate': 0.072296213236245, 'max_depth': 5, 'min_samples_split': 3, 'min_samples_leaf': 1, 'subsample': 0.7633686863415465, 'max_features': 'sqrt'}. Best is trial 621 with value: 0.2256726988932517.
[I 2024-12-04 12:40:57,359] Trial 803 finished with value: 0.2654637536177304 and parameters: {'n_estimators': 760, 'learning_rate': 0.0991150572051748, 'max_depth': 6, 'min_samples_split': 7, 'min_samples_leaf': 1, 'subsample': 0.7065832481687625, 'max_features': 'sqrt'}. Best is trial 621 with value: 0.2256726988932517.
[I 2024-12-04 12:41:04,881] Trial 791 finished with value: 0.7189777740188147 and parameters: {'n_estimators': 1490, 'learning_rate': 0.020215374998336692, 'max_depth': 11, 'min_samples_split': 19, 'min_samples_leaf': 9, 'subsample': 0.9000540878903234, 'max_features': 'log2'}. Best is trial 621 with value: 0.2256726988932517.
[I 2024-12-04 12:41:06,291] Trial 814 finished with value: 0.8799038883693534 and parameters: {'n_estimators': 479, 'learning_rate': 0.03195449903132125, 'max_depth': 3, 'min_samples_split': 20, 'min_samples_leaf': 7, 'subsample': 0.9801947932602784, 'max_features': 'log2'}. Best is trial 621 with value: 0.2256726988932517.
[I 2024-12-04 12:41:09,380] Trial 797 finished with value: 0.2854384514435044 and parameters: {'n_estimators': 1243, 'learning_rate': 0.08187911023155034, 'max_depth': 10, 'min_samples_split': 7, 'min_samples_leaf': 2, 'subsample': 0.8554857269296477, 'max_features': 'sqrt'}. Best is trial 621 with value: 0.2256726988932517.
[I 2024-12-04 12:41:13,876] Trial 795 finished with value: 0.28561572529799883 and parameters: {'n_estimators': 1491, 'learning_rate': 0.07407068381115542, 'max_depth': 12, 'min_samples_split': 3, 'min_samples_leaf': 2, 'subsample': 0.7067649711826924, 'max_features': 'sqrt'}. Best is trial 621 with value: 0.2256726988932517.
[I 2024-12-04 12:41:14,458] Trial 798 finished with value: 0.24138872362265373 and parameters: {'n_estimators': 1249, 'learning_rate': 0.07496176226092481, 'max_depth': 12, 'min_samples_split': 7, 'min_samples_leaf': 1, 'subsample': 0.6447552616382541, 'max_features': 'sqrt'}. Best is trial 621 with value: 0.2256726988932517.
[I 2024-12-04 12:41:15,466] Trial 800 finished with value: 0.3814021368912157 and parameters: {'n_estimators': 1175, 'learning_rate': 0.04416224710635159, 'max_depth': 9, 'min_samples_split': 5, 'min_samples_leaf': 5, 'subsample': 0.7266977056510461, 'max_features': 'sqrt'}. Best is trial 621 with value: 0.2256726988932517.
