[I 2024-12-04 13:29:07,027] Trial 1927 finished with value: 0.21998447869804286 and parameters: {'n_estimators': 1395, 'learning_rate': 0.09889689329388837, 'max_depth': 10, 'min_samples_split': 20, 'min_samples_leaf': 1, 'subsample': 0.6000053767035672, 'max_features': 'sqrt'}. Best is trial 1137 with value: 0.19687116000636118.
[I 2024-12-04 13:29:13,097] Trial 1928 finished with value: 0.22365933588444364 and parameters: {'n_estimators': 1395, 'learning_rate': 0.05775666327158245, 'max_depth': 11, 'min_samples_split': 20, 'min_samples_leaf': 1, 'subsample': 0.6857480492629207, 'max_features': 'sqrt'}. Best is trial 1137 with value: 0.19687116000636118.
[I 2024-12-04 13:29:13,995] Trial 1922 finished with value: 0.26858689810641934 and parameters: {'n_estimators': 1498, 'learning_rate': 0.0702875544483524, 'max_depth': 12, 'min_samples_split': 13, 'min_samples_leaf': 1, 'subsample': 0.7281185842439322, 'max_features': None}. Best is trial 1137 with value: 0.19687116000636118.
[I 2024-12-04 13:29:17,487] Trial 1954 finished with value: 0.4000962950910811 and parameters: {'n_estimators': 352, 'learning_rate': 0.010438633344981945, 'max_depth': 9, 'min_samples_split': 17, 'min_samples_leaf': 7, 'subsample': 0.6177921925437285, 'max_features': None}. Best is trial 1137 with value: 0.19687116000636118.
[I 2024-12-04 13:29:19,143] Trial 1929 finished with value: 0.2347460640070848 and parameters: {'n_estimators': 1427, 'learning_rate': 0.09975415929059973, 'max_depth': 12, 'min_samples_split': 19, 'min_samples_leaf': 2, 'subsample': 0.6774512557069818, 'max_features': 'sqrt'}. Best is trial 1137 with value: 0.19687116000636118.
[I 2024-12-04 13:29:20,334] Trial 1948 finished with value: 0.42457224988180026 and parameters: {'n_estimators': 651, 'learning_rate': 0.018792802338206887, 'max_depth': 4, 'min_samples_split': 20, 'min_samples_leaf': 4, 'subsample': 0.9368952763753782, 'max_features': 'sqrt'}. Best is trial 1137 with value: 0.19687116000636118.
[I 2024-12-04 13:29:22,795] Trial 1930 finished with value: 0.2291897751958423 and parameters: {'n_estimators': 1454, 'learning_rate': 0.07050216503674886, 'max_depth': 9, 'min_samples_split': 20, 'min_samples_leaf': 1, 'subsample': 0.6129284052969868, 'max_features': 'sqrt'}. Best is trial 1137 with value: 0.19687116000636118.
[I 2024-12-04 13:29:23,259] Trial 1931 finished with value: 0.35947151915675 and parameters: {'n_estimators': 1245, 'learning_rate': 0.031025980544348287, 'max_depth': 12, 'min_samples_split': 13, 'min_samples_leaf': 9, 'subsample': 0.8256771194721568, 'max_features': None}. Best is trial 1137 with value: 0.19687116000636118.
[I 2024-12-04 13:29:24,831] Trial 1932 finished with value: 0.23135321064725456 and parameters: {'n_estimators': 1407, 'learning_rate': 0.06758157314549226, 'max_depth': 8, 'min_samples_split': 20, 'min_samples_leaf': 1, 'subsample': 0.6087376684209876, 'max_features': 'sqrt'}. Best is trial 1137 with value: 0.19687116000636118.
[I 2024-12-04 13:29:31,084] Trial 1935 finished with value: 0.25710382538406173 and parameters: {'n_estimators': 1402, 'learning_rate': 0.0732132033230259, 'max_depth': 6, 'min_samples_split': 18, 'min_samples_leaf': 2, 'subsample': 0.6360780678691972, 'max_features': 'sqrt'}. Best is trial 1137 with value: 0.19687116000636118.
[I 2024-12-04 13:29:31,246] Trial 1934 finished with value: 0.21773398810911396 and parameters: {'n_estimators': 1428, 'learning_rate': 0.09222157307625184, 'max_depth': 9, 'min_samples_split': 18, 'min_samples_leaf': 1, 'subsample': 0.6206022879803953, 'max_features': 'sqrt'}. Best is trial 1137 with value: 0.19687116000636118.
[I 2024-12-04 13:29:34,618] Trial 1958 finished with value: 0.32907145123223097 and parameters: {'n_estimators': 530, 'learning_rate': 0.08869535449429444, 'max_depth': 11, 'min_samples_split': 13, 'min_samples_leaf': 7, 'subsample': 0.8834372034077167, 'max_features': 'sqrt'}. Best is trial 1137 with value: 0.19687116000636118.
[I 2024-12-04 13:29:36,213] Trial 1936 finished with value: 0.21705773726533062 and parameters: {'n_estimators': 1449, 'learning_rate': 0.061799122840809254, 'max_depth': 12, 'min_samples_split': 18, 'min_samples_leaf': 1, 'subsample': 0.6125784202548565, 'max_features': 'sqrt'}. Best is trial 1137 with value: 0.19687116000636118.
[I 2024-12-04 13:29:39,458] Trial 1937 finished with value: 0.2223258984389806 and parameters: {'n_estimators': 1487, 'learning_rate': 0.05111701836658279, 'max_depth': 12, 'min_samples_split': 20, 'min_samples_leaf': 1, 'subsample': 0.6076554929112303, 'max_features': 'sqrt'}. Best is trial 1137 with value: 0.19687116000636118.
[I 2024-12-04 13:29:45,559] Trial 1943 finished with value: 0.4501632409138645 and parameters: {'n_estimators': 1208, 'learning_rate': 0.023131227987591683, 'max_depth': 12, 'min_samples_split': 9, 'min_samples_leaf': 7, 'subsample': 0.9066228401043698, 'max_features': 'log2'}. Best is trial 1137 with value: 0.19687116000636118.
[I 2024-12-04 13:29:47,968] Trial 1953 finished with value: 0.4171189200073789 and parameters: {'n_estimators': 905, 'learning_rate': 0.03289526177922387, 'max_depth': 6, 'min_samples_split': 8, 'min_samples_leaf': 6, 'subsample': 0.9586591511818949, 'max_features': 'log2'}. Best is trial 1137 with value: 0.19687116000636118.
[I 2024-12-04 13:29:49,600] Trial 1938 finished with value: 0.20736700781026865 and parameters: {'n_estimators': 1494, 'learning_rate': 0.07671236127486918, 'max_depth': 12, 'min_samples_split': 18, 'min_samples_leaf': 1, 'subsample': 0.7120646746232144, 'max_features': 'sqrt'}. Best is trial 1137 with value: 0.19687116000636118.
[I 2024-12-04 13:29:50,366] Trial 1940 finished with value: 0.23153904643661258 and parameters: {'n_estimators': 1389, 'learning_rate': 0.07140357167228312, 'max_depth': 8, 'min_samples_split': 20, 'min_samples_leaf': 1, 'subsample': 0.6949159746998191, 'max_features': 'sqrt'}. Best is trial 1137 with value: 0.19687116000636118.
[I 2024-12-04 13:29:53,689] Trial 1939 finished with value: 0.2344669568165682 and parameters: {'n_estimators': 1459, 'learning_rate': 0.050220294207562494, 'max_depth': 8, 'min_samples_split': 17, 'min_samples_leaf': 1, 'subsample': 0.6076369566025768, 'max_features': 'sqrt'}. Best is trial 1137 with value: 0.19687116000636118.
[I 2024-12-04 13:29:56,072] Trial 1944 finished with value: 0.22193916476080577 and parameters: {'n_estimators': 1282, 'learning_rate': 0.07151483407032154, 'max_depth': 10, 'min_samples_split': 15, 'min_samples_leaf': 1, 'subsample': 0.6025025905322473, 'max_features': 'sqrt'}. Best is trial 1137 with value: 0.19687116000636118.
[I 2024-12-04 13:29:59,277] Trial 1941 finished with value: 0.21684835639151429 and parameters: {'n_estimators': 1477, 'learning_rate': 0.06468867616464409, 'max_depth': 12, 'min_samples_split': 17, 'min_samples_leaf': 1, 'subsample': 0.6249335668424115, 'max_features': 'sqrt'}. Best is trial 1137 with value: 0.19687116000636118.
[I 2024-12-04 13:29:59,385] Trial 1965 finished with value: 0.37871589392201827 and parameters: {'n_estimators': 437, 'learning_rate': 0.012298997905757881, 'max_depth': 6, 'min_samples_split': 20, 'min_samples_leaf': 5, 'subsample': 0.7062636137909639, 'max_features': None}. Best is trial 1137 with value: 0.19687116000636118.
[I 2024-12-04 13:30:01,648] Trial 1950 finished with value: 0.2111070133026092 and parameters: {'n_estimators': 1197, 'learning_rate': 0.09962744667531369, 'max_depth': 12, 'min_samples_split': 19, 'min_samples_leaf': 1, 'subsample': 0.6736002474787604, 'max_features': 'sqrt'}. Best is trial 1137 with value: 0.19687116000636118.
[I 2024-12-04 13:30:01,657] Trial 1949 finished with value: 0.251133120870485 and parameters: {'n_estimators': 1241, 'learning_rate': 0.05917491613474009, 'max_depth': 10, 'min_samples_split': 17, 'min_samples_leaf': 3, 'subsample': 0.6498299709280585, 'max_features': 'sqrt'}. Best is trial 1137 with value: 0.19687116000636118.
[I 2024-12-04 13:30:04,986] Trial 1961 finished with value: 0.3748376039325163 and parameters: {'n_estimators': 745, 'learning_rate': 0.026751930621751584, 'max_depth': 12, 'min_samples_split': 8, 'min_samples_leaf': 3, 'subsample': 0.7441563424304382, 'max_features': 'log2'}. Best is trial 1137 with value: 0.19687116000636118.
[I 2024-12-04 13:30:05,878] Trial 1945 finished with value: 0.23319681418754498 and parameters: {'n_estimators': 1359, 'learning_rate': 0.08896951959002534, 'max_depth': 7, 'min_samples_split': 16, 'min_samples_leaf': 1, 'subsample': 0.6658471813582671, 'max_features': 'sqrt'}. Best is trial 1137 with value: 0.19687116000636118.
[I 2024-12-04 13:30:07,207] Trial 1947 finished with value: 0.25752480850633036 and parameters: {'n_estimators': 1329, 'learning_rate': 0.09208963118817623, 'max_depth': 7, 'min_samples_split': 20, 'min_samples_leaf': 3, 'subsample': 0.631089218942725, 'max_features': 'sqrt'}. Best is trial 1137 with value: 0.19687116000636118.
[I 2024-12-04 13:30:09,252] Trial 1956 finished with value: 0.26197503100955793 and parameters: {'n_estimators': 1129, 'learning_rate': 0.03157962261347615, 'max_depth': 12, 'min_samples_split': 19, 'min_samples_leaf': 3, 'subsample': 0.6875627735653572, 'max_features': 'sqrt'}. Best is trial 1137 with value: 0.19687116000636118.
[I 2024-12-04 13:30:09,888] Trial 1955 finished with value: 0.3039392170691404 and parameters: {'n_estimators': 1125, 'learning_rate': 0.01974527002665736, 'max_depth': 9, 'min_samples_split': 12, 'min_samples_leaf': 4, 'subsample': 0.6228515783052202, 'max_features': 'sqrt'}. Best is trial 1137 with value: 0.19687116000636118.
[I 2024-12-04 13:30:15,890] Trial 1964 finished with value: 0.2998666842712817 and parameters: {'n_estimators': 696, 'learning_rate': 0.03217228691620056, 'max_depth': 5, 'min_samples_split': 5, 'min_samples_leaf': 4, 'subsample': 0.9331476594190427, 'max_features': None}. Best is trial 1137 with value: 0.19687116000636118.
[I 2024-12-04 13:30:15,902] Trial 1946 finished with value: 0.25961377737376334 and parameters: {'n_estimators': 1488, 'learning_rate': 0.0972528240759293, 'max_depth': 9, 'min_samples_split': 19, 'min_samples_leaf': 3, 'subsample': 0.6621460574579108, 'max_features': 'sqrt'}. Best is trial 1137 with value: 0.19687116000636118.
[I 2024-12-04 13:30:17,924] Trial 1975 finished with value: 0.33342140429808065 and parameters: {'n_estimators': 335, 'learning_rate': 0.02164109304340748, 'max_depth': 7, 'min_samples_split': 9, 'min_samples_leaf': 1, 'subsample': 0.9207068460747341, 'max_features': None}. Best is trial 1137 with value: 0.19687116000636118.
[I 2024-12-04 13:30:18,318] Trial 1952 finished with value: 0.24547414955026975 and parameters: {'n_estimators': 1447, 'learning_rate': 0.09341852796341601, 'max_depth': 8, 'min_samples_split': 20, 'min_samples_leaf': 2, 'subsample': 0.6394653409707922, 'max_features': 'sqrt'}. Best is trial 1137 with value: 0.19687116000636118.
[I 2024-12-04 13:30:21,596] Trial 1951 finished with value: 0.2656542477041723 and parameters: {'n_estimators': 1458, 'learning_rate': 0.04165317288208812, 'max_depth': 7, 'min_samples_split': 20, 'min_samples_leaf': 2, 'subsample': 0.6583758078634986, 'max_features': 'sqrt'}. Best is trial 1137 with value: 0.19687116000636118.
[I 2024-12-04 13:30:22,772] Trial 1957 finished with value: 0.2142762672786113 and parameters: {'n_estimators': 1297, 'learning_rate': 0.07244955348432171, 'max_depth': 12, 'min_samples_split': 15, 'min_samples_leaf': 1, 'subsample': 0.6504344354493861, 'max_features': 'sqrt'}. Best is trial 1137 with value: 0.19687116000636118.
[I 2024-12-04 13:30:25,542] Trial 1985 finished with value: 0.5853107830547795 and parameters: {'n_estimators': 104, 'learning_rate': 0.02605592670672443, 'max_depth': 9, 'min_samples_split': 17, 'min_samples_leaf': 6, 'subsample': 0.9295610148292822, 'max_features': 'sqrt'}. Best is trial 1137 with value: 0.19687116000636118.
[I 2024-12-04 13:30:28,459] Trial 1983 finished with value: 0.4984730158399103 and parameters: {'n_estimators': 289, 'learning_rate': 0.03132562902651018, 'max_depth': 3, 'min_samples_split': 11, 'min_samples_leaf': 5, 'subsample': 0.8120815205230861, 'max_features': 'sqrt'}. Best is trial 1137 with value: 0.19687116000636118.
[I 2024-12-04 13:30:30,129] Trial 1982 finished with value: 0.7196672692399408 and parameters: {'n_estimators': 316, 'learning_rate': 0.04634109190120218, 'max_depth': 10, 'min_samples_split': 11, 'min_samples_leaf': 10, 'subsample': 0.7430685350167564, 'max_features': 'log2'}. Best is trial 1137 with value: 0.19687116000636118.
[I 2024-12-04 13:30:32,689] Trial 1974 finished with value: 0.4653321244480489 and parameters: {'n_estimators': 693, 'learning_rate': 0.0681404719708338, 'max_depth': 3, 'min_samples_split': 5, 'min_samples_leaf': 6, 'subsample': 0.7861922900228879, 'max_features': 'log2'}. Best is trial 1137 with value: 0.19687116000636118.
[I 2024-12-04 13:30:33,629] Trial 1967 finished with value: 0.25225795545827207 and parameters: {'n_estimators': 990, 'learning_rate': 0.07076096825807263, 'max_depth': 10, 'min_samples_split': 16, 'min_samples_leaf': 3, 'subsample': 0.6085867821061205, 'max_features': 'sqrt'}. Best is trial 1137 with value: 0.19687116000636118.
[I 2024-12-04 13:30:36,250] Trial 1959 finished with value: 0.23718423496916974 and parameters: {'n_estimators': 1488, 'learning_rate': 0.08047883815157855, 'max_depth': 11, 'min_samples_split': 20, 'min_samples_leaf': 3, 'subsample': 0.6802970029049105, 'max_features': 'sqrt'}. Best is trial 1137 with value: 0.19687116000636118.
[I 2024-12-04 13:30:39,412] Trial 1966 finished with value: 0.5265825322792217 and parameters: {'n_estimators': 1135, 'learning_rate': 0.011389943374501943, 'max_depth': 7, 'min_samples_split': 16, 'min_samples_leaf': 5, 'subsample': 0.8234600164363646, 'max_features': 'log2'}. Best is trial 1137 with value: 0.19687116000636118.
[I 2024-12-04 13:30:40,994] Trial 1960 finished with value: 0.2311005983567322 and parameters: {'n_estimators': 1482, 'learning_rate': 0.08758101552770918, 'max_depth': 10, 'min_samples_split': 17, 'min_samples_leaf': 2, 'subsample': 0.6118614209738436, 'max_features': 'sqrt'}. Best is trial 1137 with value: 0.19687116000636118.
[I 2024-12-04 13:30:41,363] Trial 1963 finished with value: 0.22862247266446278 and parameters: {'n_estimators': 1289, 'learning_rate': 0.06362235436562742, 'max_depth': 12, 'min_samples_split': 17, 'min_samples_leaf': 1, 'subsample': 0.6001640784878106, 'max_features': 'sqrt'}. Best is trial 1137 with value: 0.19687116000636118.
[I 2024-12-04 13:30:48,443] Trial 1962 finished with value: 0.21726175257621141 and parameters: {'n_estimators': 1460, 'learning_rate': 0.07041823038059364, 'max_depth': 11, 'min_samples_split': 19, 'min_samples_leaf': 1, 'subsample': 0.6010873960843376, 'max_features': 'sqrt'}. Best is trial 1137 with value: 0.19687116000636118.
[I 2024-12-04 13:30:54,080] Trial 1977 finished with value: 0.3375431522178196 and parameters: {'n_estimators': 878, 'learning_rate': 0.03936451444926855, 'max_depth': 11, 'min_samples_split': 19, 'min_samples_leaf': 7, 'subsample': 0.6421674739478787, 'max_features': None}. Best is trial 1137 with value: 0.19687116000636118.
[I 2024-12-04 13:30:57,974] Trial 1979 finished with value: 0.27188266126787575 and parameters: {'n_estimators': 927, 'learning_rate': 0.08781896138113235, 'max_depth': 3, 'min_samples_split': 16, 'min_samples_leaf': 3, 'subsample': 0.817613000956795, 'max_features': None}. Best is trial 1137 with value: 0.19687116000636118.
[I 2024-12-04 13:30:59,575] Trial 1980 finished with value: 0.2532640739999666 and parameters: {'n_estimators': 945, 'learning_rate': 0.06276545924543304, 'max_depth': 12, 'min_samples_split': 17, 'min_samples_leaf': 3, 'subsample': 0.6981664764870765, 'max_features': 'sqrt'}. Best is trial 1137 with value: 0.19687116000636118.
[I 2024-12-04 13:31:02,158] Trial 1978 finished with value: 0.2556640176149693 and parameters: {'n_estimators': 1068, 'learning_rate': 0.09665544606435478, 'max_depth': 12, 'min_samples_split': 19, 'min_samples_leaf': 3, 'subsample': 0.600516713524941, 'max_features': 'sqrt'}. Best is trial 1137 with value: 0.19687116000636118.
[I 2024-12-04 13:31:02,258] Trial 1968 finished with value: 0.22367879517473843 and parameters: {'n_estimators': 1477, 'learning_rate': 0.08452071481487955, 'max_depth': 10, 'min_samples_split': 20, 'min_samples_leaf': 1, 'subsample': 0.6368347687875837, 'max_features': 'sqrt'}. Best is trial 1137 with value: 0.19687116000636118.
[I 2024-12-04 13:31:06,771] Trial 1972 finished with value: 0.2830584730274614 and parameters: {'n_estimators': 1440, 'learning_rate': 0.07999814114017348, 'max_depth': 9, 'min_samples_split': 15, 'min_samples_leaf': 3, 'subsample': 0.6020772424209874, 'max_features': 'log2'}. Best is trial 1137 with value: 0.19687116000636118.
[I 2024-12-04 13:31:06,904] Trial 1969 finished with value: 0.2385764258397421 and parameters: {'n_estimators': 1475, 'learning_rate': 0.09943900666658696, 'max_depth': 9, 'min_samples_split': 17, 'min_samples_leaf': 1, 'subsample': 0.666587061815272, 'max_features': 'sqrt'}. Best is trial 1137 with value: 0.19687116000636118.
[I 2024-12-04 13:31:08,444] Trial 1970 finished with value: 0.22371886051343673 and parameters: {'n_estimators': 1495, 'learning_rate': 0.06824872973909066, 'max_depth': 10, 'min_samples_split': 18, 'min_samples_leaf': 1, 'subsample': 0.6578595982224846, 'max_features': 'sqrt'}. Best is trial 1137 with value: 0.19687116000636118.
[I 2024-12-04 13:31:11,814] Trial 1971 finished with value: 0.25189723337311026 and parameters: {'n_estimators': 1485, 'learning_rate': 0.05006235805010933, 'max_depth': 12, 'min_samples_split': 14, 'min_samples_leaf': 3, 'subsample': 0.6759599083447114, 'max_features': 'sqrt'}. Best is trial 1137 with value: 0.19687116000636118.
[I 2024-12-04 13:31:13,979] Trial 1976 finished with value: 0.25179565351079336 and parameters: {'n_estimators': 1298, 'learning_rate': 0.0999240799302829, 'max_depth': 12, 'min_samples_split': 14, 'min_samples_leaf': 3, 'subsample': 0.6111851657263759, 'max_features': 'sqrt'}. Best is trial 1137 with value: 0.19687116000636118.
[I 2024-12-04 13:31:17,263] Trial 1993 finished with value: 0.3807644154402508 and parameters: {'n_estimators': 655, 'learning_rate': 0.010068605065426823, 'max_depth': 6, 'min_samples_split': 9, 'min_samples_leaf': 7, 'subsample': 0.7711759399672097, 'max_features': None}. Best is trial 1137 with value: 0.19687116000636118.
[I 2024-12-04 13:31:19,074] Trial 1973 finished with value: 0.25323978220225496 and parameters: {'n_estimators': 1402, 'learning_rate': 0.05169897462901583, 'max_depth': 11, 'min_samples_split': 19, 'min_samples_leaf': 1, 'subsample': 0.7158430266839263, 'max_features': None}. Best is trial 1137 with value: 0.19687116000636118.
[I 2024-12-04 13:31:24,820] Trial 1986 finished with value: 0.2584293330450645 and parameters: {'n_estimators': 1187, 'learning_rate': 0.07053627233614192, 'max_depth': 10, 'min_samples_split': 19, 'min_samples_leaf': 3, 'subsample': 0.612698548337324, 'max_features': 'sqrt'}. Best is trial 1137 with value: 0.19687116000636118.
[I 2024-12-04 13:31:26,898] Trial 1992 finished with value: 0.2363658196360431 and parameters: {'n_estimators': 979, 'learning_rate': 0.06648246443812, 'max_depth': 12, 'min_samples_split': 20, 'min_samples_leaf': 1, 'subsample': 0.6729720696233528, 'max_features': 'sqrt'}. Best is trial 1137 with value: 0.19687116000636118.
[I 2024-12-04 13:31:28,688] Trial 1991 finished with value: 0.2508862569363242 and parameters: {'n_estimators': 1048, 'learning_rate': 0.05978371695616391, 'max_depth': 10, 'min_samples_split': 20, 'min_samples_leaf': 2, 'subsample': 0.6740677304992608, 'max_features': 'sqrt'}. Best is trial 1137 with value: 0.19687116000636118.
[I 2024-12-04 13:31:31,092] Trial 1981 finished with value: 0.2185476522792262 and parameters: {'n_estimators': 1438, 'learning_rate': 0.06589500742399686, 'max_depth': 9, 'min_samples_split': 20, 'min_samples_leaf': 1, 'subsample': 0.6782187425464694, 'max_features': 'sqrt'}. Best is trial 1137 with value: 0.19687116000636118.
[I 2024-12-04 13:31:32,907] Trial 1988 finished with value: 0.22227518712520083 and parameters: {'n_estimators': 1199, 'learning_rate': 0.06744913564856464, 'max_depth': 12, 'min_samples_split': 16, 'min_samples_leaf': 1, 'subsample': 0.6078097709474543, 'max_features': 'sqrt'}. Best is trial 1137 with value: 0.19687116000636118.
[I 2024-12-04 13:31:34,548] Trial 1990 finished with value: 0.4579708239390586 and parameters: {'n_estimators': 1149, 'learning_rate': 0.01605904779166942, 'max_depth': 4, 'min_samples_split': 17, 'min_samples_leaf': 10, 'subsample': 0.9529115347326033, 'max_features': 'sqrt'}. Best is trial 1137 with value: 0.19687116000636118.
[I 2024-12-04 13:31:42,569] Trial 1987 finished with value: 0.25458488827486964 and parameters: {'n_estimators': 1438, 'learning_rate': 0.0769384613580122, 'max_depth': 10, 'min_samples_split': 15, 'min_samples_leaf': 2, 'subsample': 0.6023646826282448, 'max_features': 'sqrt'}. Best is trial 1137 with value: 0.19687116000636118.
[I 2024-12-04 13:31:44,112] Trial 1984 finished with value: 0.22250832229527856 and parameters: {'n_estimators': 1493, 'learning_rate': 0.08567428267179127, 'max_depth': 12, 'min_samples_split': 13, 'min_samples_leaf': 1, 'subsample': 0.6043213984145179, 'max_features': 'sqrt'}. Best is trial 1137 with value: 0.19687116000636118.
[I 2024-12-04 13:31:46,542] Trial 1998 finished with value: 0.4255320779851369 and parameters: {'n_estimators': 1087, 'learning_rate': 0.0628746509514036, 'max_depth': 3, 'min_samples_split': 19, 'min_samples_leaf': 10, 'subsample': 0.980292486663339, 'max_features': 'sqrt'}. Best is trial 1137 with value: 0.19687116000636118.
