[I 2024-12-03 19:06:08,914] Trial 1536 finished with value: 0.14271095961404184 and parameters: {'kernel': 'rbf', 'C': 67.77454305749002, 'gamma': 0.002295377498251504, 'epsilon': 0.00386469950068856}. Best is trial 345 with value: 0.13438257115663557.
[I 2024-12-03 19:06:10,653] Trial 1537 finished with value: 0.16110712808577962 and parameters: {'kernel': 'rbf', 'C': 84.52105251936527, 'gamma': 0.000914887132984038, 'epsilon': 0.017435701214047254}. Best is trial 345 with value: 0.13438257115663557.
[I 2024-12-03 19:06:12,268] Trial 1443 finished with value: 0.13816821697881904 and parameters: {'kernel': 'linear', 'C': 94.95937940318284, 'gamma': 0.0015335732178291704, 'epsilon': 0.015696534202997985}. Best is trial 345 with value: 0.13438257115663557.
[I 2024-12-03 19:06:13,047] Trial 1519 finished with value: 0.13579023924756775 and parameters: {'kernel': 'linear', 'C': 35.068023362271475, 'gamma': 0.0002616111584528157, 'epsilon': 0.041569886692112916}. Best is trial 345 with value: 0.13438257115663557.
[I 2024-12-03 19:06:13,670] Trial 1540 finished with value: 1.26416174341055 and parameters: {'kernel': 'poly', 'C': 11.55736032176117, 'gamma': 0.0004495609869281366, 'epsilon': 0.052691119025880924}. Best is trial 345 with value: 0.13438257115663557.
[I 2024-12-03 19:06:14,253] Trial 1457 finished with value: 0.13553431810292293 and parameters: {'kernel': 'linear', 'C': 98.6664280024319, 'gamma': 0.0016397924324546057, 'epsilon': 0.02761809097099846}. Best is trial 345 with value: 0.13438257115663557.
[I 2024-12-03 19:06:14,733] Trial 1530 finished with value: 0.13577107035514865 and parameters: {'kernel': 'linear', 'C': 15.247122567854072, 'gamma': 0.0015929200722354917, 'epsilon': 0.02745490915650726}. Best is trial 345 with value: 0.13438257115663557.
[I 2024-12-03 19:06:15,085] Trial 1526 finished with value: 0.1363106452669581 and parameters: {'kernel': 'linear', 'C': 18.70923385903606, 'gamma': 0.0010693782484778851, 'epsilon': 0.024827606290228}. Best is trial 345 with value: 0.13438257115663557.
[I 2024-12-03 19:06:16,471] Trial 1485 finished with value: 0.13586525290588855 and parameters: {'kernel': 'linear', 'C': 87.70299208226277, 'gamma': 0.009879562467992807, 'epsilon': 0.041941058909808496}. Best is trial 345 with value: 0.13438257115663557.
[I 2024-12-03 19:06:18,624] Trial 1532 finished with value: 0.1356335859498533 and parameters: {'kernel': 'linear', 'C': 17.633639857762336, 'gamma': 0.0005760184176964137, 'epsilon': 0.05276881216924089}. Best is trial 345 with value: 0.13438257115663557.
[I 2024-12-03 19:06:19,495] Trial 1514 finished with value: 0.1377074580982282 and parameters: {'kernel': 'linear', 'C': 37.77968492026325, 'gamma': 0.00029748623600151614, 'epsilon': 0.013881745494532775}. Best is trial 345 with value: 0.13438257115663557.
[I 2024-12-03 19:06:19,530] Trial 1543 finished with value: 0.13639904293790478 and parameters: {'kernel': 'linear', 'C': 11.674934766730043, 'gamma': 0.0006581370791734181, 'epsilon': 0.07282712376846916}. Best is trial 345 with value: 0.13438257115663557.
[I 2024-12-03 19:06:20,929] Trial 1529 finished with value: 0.1371063945438822 and parameters: {'kernel': 'linear', 'C': 45.80629866694145, 'gamma': 0.0006193799570403813, 'epsilon': 0.048470347089893936}. Best is trial 345 with value: 0.13438257115663557.
[I 2024-12-03 19:06:21,568] Trial 1472 finished with value: 0.13590006589741632 and parameters: {'kernel': 'linear', 'C': 88.72474757917396, 'gamma': 0.02839365645210055, 'epsilon': 0.02572564205165094}. Best is trial 345 with value: 0.13438257115663557.
[I 2024-12-03 19:06:22,012] Trial 1498 finished with value: 0.1356691933490883 and parameters: {'kernel': 'linear', 'C': 57.43418863219024, 'gamma': 0.000453882178209216, 'epsilon': 0.027084520533480264}. Best is trial 345 with value: 0.13438257115663557.
[I 2024-12-03 19:06:22,638] Trial 1546 finished with value: 0.13471351151383734 and parameters: {'kernel': 'linear', 'C': 9.898528438492235, 'gamma': 0.0014893401906575785, 'epsilon': 0.06360762797652231}. Best is trial 345 with value: 0.13438257115663557.
[I 2024-12-03 19:06:24,729] Trial 1553 finished with value: 1.3319701716761385 and parameters: {'kernel': 'sigmoid', 'C': 0.10240370941788077, 'gamma': 0.00010659572409499628, 'epsilon': 0.029118152818357317}. Best is trial 345 with value: 0.13438257115663557.
[I 2024-12-03 19:06:25,357] Trial 1542 finished with value: 0.13696389738071757 and parameters: {'kernel': 'linear', 'C': 6.9837758829370005, 'gamma': 0.001264479332531732, 'epsilon': 0.02489243775522521}. Best is trial 345 with value: 0.13438257115663557.
[I 2024-12-03 19:06:26,806] Trial 1552 finished with value: 0.14141868949255293 and parameters: {'kernel': 'linear', 'C': 13.840008339210767, 'gamma': 0.0018445516555461391, 'epsilon': 0.10086195753754605}. Best is trial 345 with value: 0.13438257115663557.
[I 2024-12-03 19:06:26,809] Trial 1555 finished with value: 0.17976270581955794 and parameters: {'kernel': 'linear', 'C': 3.046740923059455, 'gamma': 0.0023055268846072403, 'epsilon': 0.18353918821543883}. Best is trial 345 with value: 0.13438257115663557.
[I 2024-12-03 19:06:27,808] Trial 1538 finished with value: 0.14405972089045074 and parameters: {'kernel': 'linear', 'C': 80.72581768950681, 'gamma': 0.000603692010101557, 'epsilon': 0.11859336018606308}. Best is trial 345 with value: 0.13438257115663557.
[I 2024-12-03 19:06:28,135] Trial 1557 finished with value: 0.6897259693319202 and parameters: {'kernel': 'rbf', 'C': 0.6530557819093854, 'gamma': 0.06870876742153607, 'epsilon': 0.5493698994018916}. Best is trial 345 with value: 0.13438257115663557.
[I 2024-12-03 19:06:28,968] Trial 1556 finished with value: 0.15310191075429644 and parameters: {'kernel': 'linear', 'C': 1.9414691942115632, 'gamma': 0.0020026521261742613, 'epsilon': 0.10443872653926467}. Best is trial 345 with value: 0.13438257115663557.
[I 2024-12-03 19:06:30,361] Trial 1560 finished with value: 0.43696856575878124 and parameters: {'kernel': 'linear', 'C': 0.001403553435633474, 'gamma': 0.5223168873262003, 'epsilon': 0.07391772482032392}. Best is trial 345 with value: 0.13438257115663557.
[I 2024-12-03 19:06:30,401] Trial 1558 finished with value: 0.14110162433317475 and parameters: {'kernel': 'linear', 'C': 14.849010805155025, 'gamma': 0.0017227057452403524, 'epsilon': 0.10758197101041231}. Best is trial 345 with value: 0.13438257115663557.
[I 2024-12-03 19:06:31,051] Trial 1559 finished with value: 0.13878498932829872 and parameters: {'kernel': 'linear', 'C': 2.2564730304347784, 'gamma': 0.002797967995583699, 'epsilon': 0.0630550682005714}. Best is trial 345 with value: 0.13438257115663557.
[I 2024-12-03 19:06:31,975] Trial 1554 finished with value: 0.13708799018158796 and parameters: {'kernel': 'linear', 'C': 5.291431572909964, 'gamma': 0.00432082999247238, 'epsilon': 0.02340478855558121}. Best is trial 345 with value: 0.13438257115663557.
[I 2024-12-03 19:06:32,017] Trial 1561 finished with value: 1.3097469750898638 and parameters: {'kernel': 'poly', 'C': 0.011549935434697034, 'gamma': 0.0006204161998791384, 'epsilon': 0.8302317171197827}. Best is trial 345 with value: 0.13438257115663557.
[I 2024-12-03 19:06:32,872] Trial 1493 finished with value: 0.1378790257015066 and parameters: {'kernel': 'linear', 'C': 89.33722251911801, 'gamma': 0.023479358675811385, 'epsilon': 0.012829789234620153}. Best is trial 345 with value: 0.13438257115663557.
[I 2024-12-03 19:06:33,688] Trial 1531 finished with value: 0.13508473549423322 and parameters: {'kernel': 'linear', 'C': 58.95482444518268, 'gamma': 0.0011654877299140218, 'epsilon': 0.05632517741684393}. Best is trial 345 with value: 0.13438257115663557.
[I 2024-12-03 19:06:34,714] Trial 1566 finished with value: 1.1728587139078022 and parameters: {'kernel': 'sigmoid', 'C': 45.44763136336395, 'gamma': 0.0010307060666566966, 'epsilon': 0.018324083849606824}. Best is trial 345 with value: 0.13438257115663557.
[I 2024-12-03 19:06:34,770] Trial 1564 finished with value: 0.14166626738769575 and parameters: {'kernel': 'linear', 'C': 3.1645115107881687, 'gamma': 0.001585985755631124, 'epsilon': 0.07648154698013972}. Best is trial 345 with value: 0.13438257115663557.
[I 2024-12-03 19:06:35,996] Trial 1565 finished with value: 0.14154647533228112 and parameters: {'kernel': 'linear', 'C': 6.2199644001990935, 'gamma': 0.0023217037170767665, 'epsilon': 0.08325167058261361}. Best is trial 345 with value: 0.13438257115663557.
[I 2024-12-03 19:06:38,600] Trial 1474 finished with value: 0.13777307368180658 and parameters: {'kernel': 'linear', 'C': 98.74224665442314, 'gamma': 0.004142906890680781, 'epsilon': 0.013719556428119482}. Best is trial 345 with value: 0.13438257115663557.
[I 2024-12-03 19:06:39,251] Trial 1569 finished with value: 0.137183688621609 and parameters: {'kernel': 'linear', 'C': 2.4478932559890723, 'gamma': 0.001053368703573571, 'epsilon': 0.029488469672667262}. Best is trial 345 with value: 0.13438257115663557.
[I 2024-12-03 19:06:40,345] Trial 1568 finished with value: 0.1359472638533214 and parameters: {'kernel': 'linear', 'C': 4.976086872973997, 'gamma': 0.0014218698516019156, 'epsilon': 0.04338070305371889}. Best is trial 345 with value: 0.13438257115663557.
[I 2024-12-03 19:06:41,510] Trial 1573 finished with value: 0.21956331559051567 and parameters: {'kernel': 'rbf', 'C': 12.176643564347309, 'gamma': 0.0018378706898885342, 'epsilon': 0.08466666313648462}. Best is trial 345 with value: 0.13438257115663557.
[I 2024-12-03 19:06:41,514] Trial 1518 finished with value: 0.13762936602984577 and parameters: {'kernel': 'linear', 'C': 72.45795260170739, 'gamma': 0.00031034888534029517, 'epsilon': 0.02050056203201184}. Best is trial 345 with value: 0.13438257115663557.
[I 2024-12-03 19:06:42,982] Trial 1575 finished with value: 22.582381451311356 and parameters: {'kernel': 'sigmoid', 'C': 53.546419877578295, 'gamma': 0.0026819516655522033, 'epsilon': 0.060374719820127286}. Best is trial 345 with value: 0.13438257115663557.
[I 2024-12-03 19:06:44,862] Trial 1544 finished with value: 0.13786307878840656 and parameters: {'kernel': 'linear', 'C': 20.856134540282667, 'gamma': 0.001002050716824382, 'epsilon': 0.015473325358958191}. Best is trial 345 with value: 0.13438257115663557.
[I 2024-12-03 19:06:44,901] Trial 1570 finished with value: 0.1394545740893292 and parameters: {'kernel': 'linear', 'C': 25.017575643239145, 'gamma': 0.003868809600400186, 'epsilon': 0.08553262436429832}. Best is trial 345 with value: 0.13438257115663557.
[I 2024-12-03 19:06:46,213] Trial 1547 finished with value: 0.136108617970356 and parameters: {'kernel': 'linear', 'C': 44.82649388721916, 'gamma': 0.0021186237999544933, 'epsilon': 0.05127232001278671}. Best is trial 345 with value: 0.13438257115663557.
[I 2024-12-03 19:06:48,297] Trial 1545 finished with value: 0.13818839064631727 and parameters: {'kernel': 'linear', 'C': 25.6625762562554, 'gamma': 0.0021423149082756185, 'epsilon': 0.008138959141989621}. Best is trial 345 with value: 0.13438257115663557.
[I 2024-12-03 19:06:48,985] Trial 1567 finished with value: 0.1407583209212581 and parameters: {'kernel': 'linear', 'C': 60.78687856376382, 'gamma': 0.002600456303761776, 'epsilon': 0.1097237833924139}. Best is trial 345 with value: 0.13438257115663557.
[I 2024-12-03 19:06:50,308] Trial 1581 finished with value: 389.4480271334484 and parameters: {'kernel': 'sigmoid', 'C': 24.506020039217553, 'gamma': 0.10539516215959566, 'epsilon': 0.022811379566473968}. Best is trial 345 with value: 0.13438257115663557.
[I 2024-12-03 19:06:50,670] Trial 1577 finished with value: 0.13630201325816815 and parameters: {'kernel': 'linear', 'C': 22.03525616821472, 'gamma': 0.0051342176314207585, 'epsilon': 0.07335959005519015}. Best is trial 345 with value: 0.13438257115663557.
[I 2024-12-03 19:06:51,119] Trial 1515 finished with value: 0.13586714498248478 and parameters: {'kernel': 'linear', 'C': 77.06055128235714, 'gamma': 0.0011666548131947167, 'epsilon': 0.036049392712375936}. Best is trial 345 with value: 0.13438257115663557.
[I 2024-12-03 19:06:55,197] Trial 1580 finished with value: 0.13537439229416112 and parameters: {'kernel': 'linear', 'C': 15.98163834826778, 'gamma': 0.008884253895422996, 'epsilon': 0.06590296104020027}. Best is trial 345 with value: 0.13438257115663557.
[I 2024-12-03 19:06:58,197] Trial 1572 finished with value: 0.1356717689950159 and parameters: {'kernel': 'linear', 'C': 12.260091235186989, 'gamma': 0.00632927234454112, 'epsilon': 0.037034636147847716}. Best is trial 345 with value: 0.13438257115663557.
[I 2024-12-03 19:06:58,233] Trial 1571 finished with value: 0.13832993716406083 and parameters: {'kernel': 'linear', 'C': 15.007299344617456, 'gamma': 0.0045751546866689705, 'epsilon': 0.010300954157214519}. Best is trial 345 with value: 0.13438257115663557.
[I 2024-12-03 19:07:00,674] Trial 1583 finished with value: 0.1650337173790121 and parameters: {'kernel': 'linear', 'C': 82.07443005717079, 'gamma': 0.0051119487030026264, 'epsilon': 0.17505122683866786}. Best is trial 345 with value: 0.13438257115663557.
[I 2024-12-03 19:07:01,532] Trial 1563 finished with value: 0.13543790859834293 and parameters: {'kernel': 'linear', 'C': 22.08085544157927, 'gamma': 0.0033492497058463344, 'epsilon': 0.02830281153492662}. Best is trial 345 with value: 0.13438257115663557.
[I 2024-12-03 19:07:02,976] Trial 1585 finished with value: 0.13539540305839637 and parameters: {'kernel': 'linear', 'C': 10.160687502969191, 'gamma': 0.0025766617087343243, 'epsilon': 0.04149972646436328}. Best is trial 345 with value: 0.13438257115663557.
[I 2024-12-03 19:07:04,088] Trial 1576 finished with value: 0.13580469858494748 and parameters: {'kernel': 'linear', 'C': 13.034394533881509, 'gamma': 0.0009291872123481493, 'epsilon': 0.0575798246751299}. Best is trial 345 with value: 0.13438257115663557.
[I 2024-12-03 19:07:04,123] Trial 1550 finished with value: 0.13734611504171612 and parameters: {'kernel': 'linear', 'C': 97.06148740540377, 'gamma': 0.0004325492284867663, 'epsilon': 0.0756998642679013}. Best is trial 345 with value: 0.13438257115663557.
[I 2024-12-03 19:07:05,470] Trial 1579 finished with value: 0.13801103981039156 and parameters: {'kernel': 'linear', 'C': 18.93407424233414, 'gamma': 0.004588030931425809, 'epsilon': 0.016042998340563865}. Best is trial 345 with value: 0.13438257115663557.
[I 2024-12-03 19:07:05,519] Trial 1590 finished with value: 1.3580902783863378 and parameters: {'kernel': 'poly', 'C': 0.0010718311561461798, 'gamma': 0.0004784112564901068, 'epsilon': 0.24867363808032994}. Best is trial 345 with value: 0.13438257115663557.
[I 2024-12-03 19:07:06,276] Trial 1516 finished with value: 0.13536214448131478 and parameters: {'kernel': 'linear', 'C': 90.05946074308058, 'gamma': 0.0010653332574113287, 'epsilon': 0.028263791151710446}. Best is trial 345 with value: 0.13438257115663557.
[I 2024-12-03 19:07:08,119] Trial 1594 finished with value: 0.27371236890990935 and parameters: {'kernel': 'rbf', 'C': 8.221701773204227, 'gamma': 0.0010978858469990775, 'epsilon': 0.03734697465634077}. Best is trial 345 with value: 0.13438257115663557.
[I 2024-12-03 19:07:09,502] Trial 1587 finished with value: 0.13530372442931557 and parameters: {'kernel': 'linear', 'C': 20.339804628744492, 'gamma': 0.0022496706529568054, 'epsilon': 0.05976797447818845}. Best is trial 345 with value: 0.13438257115663557.
[I 2024-12-03 19:07:09,705] Trial 1584 finished with value: 0.1349223234820567 and parameters: {'kernel': 'linear', 'C': 18.324884092962986, 'gamma': 0.003023754829113297, 'epsilon': 0.03881962461944993}. Best is trial 345 with value: 0.13438257115663557.
[I 2024-12-03 19:07:11,032] Trial 1494 finished with value: 0.13807355900108226 and parameters: {'kernel': 'linear', 'C': 96.21960211395515, 'gamma': 0.0008951208548749833, 'epsilon': 0.014938035449736035}. Best is trial 345 with value: 0.13438257115663557.
[I 2024-12-03 19:07:11,069] Trial 1598 finished with value: 0.3468950926221667 and parameters: {'kernel': 'linear', 'C': 0.10138586722058132, 'gamma': 0.05898953305547578, 'epsilon': 0.5980025822012122}. Best is trial 345 with value: 0.13438257115663557.
[I 2024-12-03 19:07:11,071] Trial 1539 finished with value: 0.13615862226738126 and parameters: {'kernel': 'linear', 'C': 84.75214617921955, 'gamma': 0.0008882880248682378, 'epsilon': 0.052148208462815836}. Best is trial 345 with value: 0.13438257115663557.
[I 2024-12-03 19:07:12,548] Trial 1562 finished with value: 0.13633617455856686 and parameters: {'kernel': 'linear', 'C': 80.84466502047705, 'gamma': 0.0021915445206174768, 'epsilon': 0.04304941086042697}. Best is trial 345 with value: 0.13438257115663557.
[I 2024-12-03 19:07:14,843] Trial 1578 finished with value: 0.1443582614290969 and parameters: {'kernel': 'linear', 'C': 93.6588201610874, 'gamma': 0.0014000952859747123, 'epsilon': 0.11970078027559088}. Best is trial 345 with value: 0.13438257115663557.
[I 2024-12-03 19:07:15,311] Trial 1520 finished with value: 0.1375016243260234 and parameters: {'kernel': 'linear', 'C': 90.55946359147539, 'gamma': 0.005470085533774041, 'epsilon': 0.02112695909279658}. Best is trial 345 with value: 0.13438257115663557.
[I 2024-12-03 19:07:16,221] Trial 1603 finished with value: 35.280993605947636 and parameters: {'kernel': 'sigmoid', 'C': 14.841196959227878, 'gamma': 0.005793522306980989, 'epsilon': 0.007942971109946314}. Best is trial 345 with value: 0.13438257115663557.
[I 2024-12-03 19:07:17,324] Trial 1604 finished with value: 0.14750182406329823 and parameters: {'kernel': 'linear', 'C': 4.7147171106718115, 'gamma': 0.0007480702297082755, 'epsilon': 0.09914151173970452}. Best is trial 345 with value: 0.13438257115663557.
[I 2024-12-03 19:07:19,389] Trial 1525 finished with value: 0.13823235106418724 and parameters: {'kernel': 'linear', 'C': 90.97830466724862, 'gamma': 0.00030740383270266055, 'epsilon': 0.01657724820584702}. Best is trial 345 with value: 0.13438257115663557.
[I 2024-12-03 19:07:20,117] Trial 1602 finished with value: 0.1359643287822552 and parameters: {'kernel': 'linear', 'C': 4.378351938024582, 'gamma': 0.001255162111746629, 'epsilon': 0.040199489053496545}. Best is trial 345 with value: 0.13438257115663557.
[I 2024-12-03 19:07:22,632] Trial 1593 finished with value: 0.13625347548621655 and parameters: {'kernel': 'linear', 'C': 17.937330185269005, 'gamma': 0.007856504960608163, 'epsilon': 0.07010485124709313}. Best is trial 345 with value: 0.13438257115663557.
[I 2024-12-03 19:07:23,319] Trial 1607 finished with value: 0.13489134340058556 and parameters: {'kernel': 'linear', 'C': 4.242311197484919, 'gamma': 0.006354170426275975, 'epsilon': 0.0508619417939985}. Best is trial 345 with value: 0.13438257115663557.
[I 2024-12-03 19:07:24,390] Trial 1586 finished with value: 0.13511991635943585 and parameters: {'kernel': 'linear', 'C': 26.90291115703522, 'gamma': 0.0026273371867344213, 'epsilon': 0.03121415904587458}. Best is trial 345 with value: 0.13438257115663557.
[I 2024-12-03 19:07:24,708] Trial 1609 finished with value: 0.1759248736713273 and parameters: {'kernel': 'linear', 'C': 14.451489595841648, 'gamma': 0.0029194855332793507, 'epsilon': 0.20114161632848152}. Best is trial 345 with value: 0.13438257115663557.
[I 2024-12-03 19:07:26,504] Trial 1591 finished with value: 0.13812792171715665 and parameters: {'kernel': 'linear', 'C': 17.745635131308692, 'gamma': 0.021103143346283038, 'epsilon': 0.01648804635448285}. Best is trial 345 with value: 0.13438257115663557.
[I 2024-12-03 19:07:27,439] Trial 1608 finished with value: 0.13894387131107602 and parameters: {'kernel': 'linear', 'C': 21.346154754596448, 'gamma': 0.024818328397028525, 'epsilon': 0.08446663292924578}. Best is trial 345 with value: 0.13438257115663557.
[I 2024-12-03 19:07:29,767] Trial 1612 finished with value: 0.14024122563229374 and parameters: {'kernel': 'linear', 'C': 15.373632957582235, 'gamma': 0.001265786260283829, 'epsilon': 0.09167979516044297}. Best is trial 345 with value: 0.13438257115663557.
[I 2024-12-03 19:07:29,972] Trial 1535 finished with value: 0.1363506325989825 and parameters: {'kernel': 'linear', 'C': 68.67093140985114, 'gamma': 0.00033170159791007583, 'epsilon': 0.023587367738635644}. Best is trial 345 with value: 0.13438257115663557.
[I 2024-12-03 19:07:32,641] Trial 1548 finished with value: 0.1353831553978383 and parameters: {'kernel': 'linear', 'C': 98.12962102616024, 'gamma': 0.0035920010467765597, 'epsilon': 0.028500348819396722}. Best is trial 345 with value: 0.13438257115663557.
[I 2024-12-03 19:07:32,951] Trial 1606 finished with value: 0.13526450839478718 and parameters: {'kernel': 'linear', 'C': 18.072213489637498, 'gamma': 0.013955835893714357, 'epsilon': 0.02965080801599469}. Best is trial 345 with value: 0.13438257115663557.
[I 2024-12-03 19:07:34,325] Trial 1617 finished with value: 0.18978495194176878 and parameters: {'kernel': 'rbf', 'C': 89.40588745538541, 'gamma': 0.01934104656691171, 'epsilon': 0.0581451611735922}. Best is trial 345 with value: 0.13438257115663557.
[I 2024-12-03 19:07:35,626] Trial 1619 finished with value: 0.9981905476326353 and parameters: {'kernel': 'poly', 'C': 62.27327474904298, 'gamma': 0.0008005613827517477, 'epsilon': 0.04109902801756827}. Best is trial 345 with value: 0.13438257115663557.
[I 2024-12-03 19:07:35,629] Trial 1596 finished with value: 0.13554763950921841 and parameters: {'kernel': 'linear', 'C': 24.39166218516097, 'gamma': 0.002645421918844346, 'epsilon': 0.028070555296004718}. Best is trial 345 with value: 0.13438257115663557.
[I 2024-12-03 19:07:37,799] Trial 1523 finished with value: 0.13679207717070796 and parameters: {'kernel': 'linear', 'C': 96.83339622354814, 'gamma': 0.0013568006510800638, 'epsilon': 0.023058949171138158}. Best is trial 345 with value: 0.13438257115663557.
