[I 2024-12-04 15:33:07,884] Trial 1862 finished with value: 0.46529590671742516 and parameters: {'n_estimators': 833, 'max_depth': 38, 'min_samples_split': 2, 'min_samples_leaf': 2, 'max_features': None, 'bootstrap': True, 'criterion': 'squared_error'}. Best is trial 1025 with value: 0.41844370194907604.
[I 2024-12-04 15:33:12,104] Trial 1867 finished with value: 0.9583270221481033 and parameters: {'n_estimators': 988, 'max_depth': 35, 'min_samples_split': 36, 'min_samples_leaf': 6, 'max_features': 'sqrt', 'bootstrap': True, 'criterion': 'squared_error'}. Best is trial 1025 with value: 0.41844370194907604.
[I 2024-12-04 15:33:12,228] Trial 1854 finished with value: 0.6163405269654986 and parameters: {'n_estimators': 921, 'max_depth': 27, 'min_samples_split': 2, 'min_samples_leaf': 1, 'max_features': 'sqrt', 'bootstrap': True, 'criterion': 'absolute_error'}. Best is trial 1025 with value: 0.41844370194907604.
[I 2024-12-04 15:33:15,038] Trial 1864 finished with value: 0.4206637449713791 and parameters: {'n_estimators': 720, 'max_depth': 43, 'min_samples_split': 2, 'min_samples_leaf': 1, 'max_features': None, 'bootstrap': True, 'criterion': 'squared_error'}. Best is trial 1025 with value: 0.41844370194907604.
[I 2024-12-04 15:33:26,446] Trial 1876 finished with value: 0.515533852300018 and parameters: {'n_estimators': 691, 'max_depth': 39, 'min_samples_split': 4, 'min_samples_leaf': 1, 'max_features': None, 'bootstrap': False, 'criterion': 'squared_error'}. Best is trial 1025 with value: 0.41844370194907604.
[I 2024-12-04 15:33:29,837] Trial 1866 finished with value: 0.41892339221055624 and parameters: {'n_estimators': 805, 'max_depth': 40, 'min_samples_split': 2, 'min_samples_leaf': 1, 'max_features': None, 'bootstrap': True, 'criterion': 'squared_error'}. Best is trial 1025 with value: 0.41844370194907604.
[I 2024-12-04 15:33:30,462] Trial 1870 finished with value: 0.42047807905122786 and parameters: {'n_estimators': 768, 'max_depth': 31, 'min_samples_split': 2, 'min_samples_leaf': 1, 'max_features': None, 'bootstrap': True, 'criterion': 'squared_error'}. Best is trial 1025 with value: 0.41844370194907604.
[I 2024-12-04 15:33:30,867] Trial 1865 finished with value: 0.4215261773894791 and parameters: {'n_estimators': 754, 'max_depth': 45, 'min_samples_split': 2, 'min_samples_leaf': 1, 'max_features': None, 'bootstrap': True, 'criterion': 'squared_error'}. Best is trial 1025 with value: 0.41844370194907604.
[I 2024-12-04 15:33:31,909] Trial 1869 finished with value: 0.419061412872446 and parameters: {'n_estimators': 713, 'max_depth': 41, 'min_samples_split': 2, 'min_samples_leaf': 1, 'max_features': None, 'bootstrap': True, 'criterion': 'squared_error'}. Best is trial 1025 with value: 0.41844370194907604.
[I 2024-12-04 15:33:32,335] Trial 1868 finished with value: 0.42137711488472024 and parameters: {'n_estimators': 700, 'max_depth': 34, 'min_samples_split': 2, 'min_samples_leaf': 1, 'max_features': None, 'bootstrap': True, 'criterion': 'squared_error'}. Best is trial 1025 with value: 0.41844370194907604.
[I 2024-12-04 15:33:32,350] Trial 1880 finished with value: 0.4649357899510318 and parameters: {'n_estimators': 665, 'max_depth': 43, 'min_samples_split': 2, 'min_samples_leaf': 2, 'max_features': None, 'bootstrap': True, 'criterion': 'squared_error'}. Best is trial 1025 with value: 0.41844370194907604.
[I 2024-12-04 15:33:32,932] Trial 1873 finished with value: 0.4203263854911365 and parameters: {'n_estimators': 710, 'max_depth': 36, 'min_samples_split': 2, 'min_samples_leaf': 1, 'max_features': None, 'bootstrap': True, 'criterion': 'squared_error'}. Best is trial 1025 with value: 0.41844370194907604.
[I 2024-12-04 15:33:37,905] Trial 1877 finished with value: 0.4257964504196581 and parameters: {'n_estimators': 674, 'max_depth': 50, 'min_samples_split': 3, 'min_samples_leaf': 1, 'max_features': None, 'bootstrap': True, 'criterion': 'squared_error'}. Best is trial 1025 with value: 0.41844370194907604.
[I 2024-12-04 15:33:40,905] Trial 1791 finished with value: 0.6209473467493435 and parameters: {'n_estimators': 967, 'max_depth': 39, 'min_samples_split': 43, 'min_samples_leaf': 1, 'max_features': None, 'bootstrap': False, 'criterion': 'absolute_error'}. Best is trial 1025 with value: 0.41844370194907604.
[I 2024-12-04 15:33:42,966] Trial 1879 finished with value: 0.4194817039507987 and parameters: {'n_estimators': 800, 'max_depth': 41, 'min_samples_split': 2, 'min_samples_leaf': 1, 'max_features': None, 'bootstrap': True, 'criterion': 'squared_error'}. Best is trial 1025 with value: 0.41844370194907604.
[I 2024-12-04 15:33:43,843] Trial 1871 finished with value: 0.42403159783582417 and parameters: {'n_estimators': 774, 'max_depth': 47, 'min_samples_split': 3, 'min_samples_leaf': 1, 'max_features': None, 'bootstrap': True, 'criterion': 'squared_error'}. Best is trial 1025 with value: 0.41844370194907604.
[I 2024-12-04 15:33:44,020] Trial 1874 finished with value: 0.4220596720625098 and parameters: {'n_estimators': 819, 'max_depth': 50, 'min_samples_split': 2, 'min_samples_leaf': 1, 'max_features': None, 'bootstrap': True, 'criterion': 'squared_error'}. Best is trial 1025 with value: 0.41844370194907604.
[I 2024-12-04 15:33:45,587] Trial 1872 finished with value: 0.4208030093048638 and parameters: {'n_estimators': 653, 'max_depth': 39, 'min_samples_split': 2, 'min_samples_leaf': 1, 'max_features': None, 'bootstrap': True, 'criterion': 'squared_error'}. Best is trial 1025 with value: 0.41844370194907604.
[I 2024-12-04 15:33:46,761] Trial 1885 finished with value: 0.4649646802971045 and parameters: {'n_estimators': 764, 'max_depth': 40, 'min_samples_split': 4, 'min_samples_leaf': 2, 'max_features': None, 'bootstrap': True, 'criterion': 'squared_error'}. Best is trial 1025 with value: 0.41844370194907604.
[I 2024-12-04 15:33:47,575] Trial 1875 finished with value: 0.43164361389958467 and parameters: {'n_estimators': 826, 'max_depth': 35, 'min_samples_split': 4, 'min_samples_leaf': 1, 'max_features': None, 'bootstrap': True, 'criterion': 'squared_error'}. Best is trial 1025 with value: 0.41844370194907604.
[I 2024-12-04 15:33:47,979] Trial 1886 finished with value: 0.4656823030097955 and parameters: {'n_estimators': 788, 'max_depth': 39, 'min_samples_split': 2, 'min_samples_leaf': 2, 'max_features': None, 'bootstrap': True, 'criterion': 'squared_error'}. Best is trial 1025 with value: 0.41844370194907604.
[I 2024-12-04 15:33:50,735] Trial 1881 finished with value: 0.4194758718933529 and parameters: {'n_estimators': 775, 'max_depth': 39, 'min_samples_split': 2, 'min_samples_leaf': 1, 'max_features': None, 'bootstrap': True, 'criterion': 'squared_error'}. Best is trial 1025 with value: 0.41844370194907604.
[I 2024-12-04 15:33:52,472] Trial 1888 finished with value: 0.6327231014176707 and parameters: {'n_estimators': 645, 'max_depth': 32, 'min_samples_split': 2, 'min_samples_leaf': 5, 'max_features': None, 'bootstrap': False, 'criterion': 'squared_error'}. Best is trial 1025 with value: 0.41844370194907604.
[I 2024-12-04 15:33:52,779] Trial 1889 finished with value: 0.42461543219335096 and parameters: {'n_estimators': 695, 'max_depth': 37, 'min_samples_split': 3, 'min_samples_leaf': 1, 'max_features': None, 'bootstrap': True, 'criterion': 'squared_error'}. Best is trial 1025 with value: 0.41844370194907604.
[I 2024-12-04 15:33:53,541] Trial 1878 finished with value: 0.7123252134661345 and parameters: {'n_estimators': 941, 'max_depth': 43, 'min_samples_split': 14, 'min_samples_leaf': 1, 'max_features': 'log2', 'bootstrap': True, 'criterion': 'absolute_error'}. Best is trial 1025 with value: 0.41844370194907604.
[I 2024-12-04 15:33:55,641] Trial 1882 finished with value: 0.4204374086892438 and parameters: {'n_estimators': 682, 'max_depth': 39, 'min_samples_split': 2, 'min_samples_leaf': 1, 'max_features': None, 'bootstrap': True, 'criterion': 'squared_error'}. Best is trial 1025 with value: 0.41844370194907604.
[I 2024-12-04 15:33:57,017] Trial 1896 finished with value: 0.42414132276991623 and parameters: {'n_estimators': 559, 'max_depth': 49, 'min_samples_split': 2, 'min_samples_leaf': 1, 'max_features': None, 'bootstrap': True, 'criterion': 'squared_error'}. Best is trial 1025 with value: 0.41844370194907604.
[I 2024-12-04 15:33:58,883] Trial 1887 finished with value: 0.4310034690562632 and parameters: {'n_estimators': 754, 'max_depth': 39, 'min_samples_split': 4, 'min_samples_leaf': 1, 'max_features': None, 'bootstrap': True, 'criterion': 'squared_error'}. Best is trial 1025 with value: 0.41844370194907604.
[I 2024-12-04 15:34:01,003] Trial 1897 finished with value: 1.0343699243587892 and parameters: {'n_estimators': 527, 'max_depth': 12, 'min_samples_split': 8, 'min_samples_leaf': 4, 'max_features': 'log2', 'bootstrap': True, 'criterion': 'absolute_error'}. Best is trial 1025 with value: 0.41844370194907604.
[I 2024-12-04 15:34:01,128] Trial 1891 finished with value: 0.418787369126777 and parameters: {'n_estimators': 770, 'max_depth': 40, 'min_samples_split': 2, 'min_samples_leaf': 1, 'max_features': None, 'bootstrap': True, 'criterion': 'squared_error'}. Best is trial 1025 with value: 0.41844370194907604.
[I 2024-12-04 15:34:02,121] Trial 1898 finished with value: 0.6133727065382023 and parameters: {'n_estimators': 558, 'max_depth': 39, 'min_samples_split': 3, 'min_samples_leaf': 2, 'max_features': None, 'bootstrap': False, 'criterion': 'squared_error'}. Best is trial 1025 with value: 0.41844370194907604.
[I 2024-12-04 15:34:03,615] Trial 1895 finished with value: 0.46459657894899115 and parameters: {'n_estimators': 651, 'max_depth': 33, 'min_samples_split': 2, 'min_samples_leaf': 2, 'max_features': None, 'bootstrap': True, 'criterion': 'squared_error'}. Best is trial 1025 with value: 0.41844370194907604.
[I 2024-12-04 15:34:03,779] Trial 1890 finished with value: 0.4648434696506085 and parameters: {'n_estimators': 736, 'max_depth': 43, 'min_samples_split': 2, 'min_samples_leaf': 2, 'max_features': None, 'bootstrap': True, 'criterion': 'squared_error'}. Best is trial 1025 with value: 0.41844370194907604.
[I 2024-12-04 15:34:07,492] Trial 1893 finished with value: 0.5338067785413377 and parameters: {'n_estimators': 862, 'max_depth': 34, 'min_samples_split': 2, 'min_samples_leaf': 1, 'max_features': 'sqrt', 'bootstrap': True, 'criterion': 'squared_error'}. Best is trial 1025 with value: 0.41844370194907604.
[I 2024-12-04 15:34:10,234] Trial 1907 finished with value: 0.9149459909453446 and parameters: {'n_estimators': 184, 'max_depth': 14, 'min_samples_split': 19, 'min_samples_leaf': 4, 'max_features': 'sqrt', 'bootstrap': True, 'criterion': 'absolute_error'}. Best is trial 1025 with value: 0.41844370194907604.
[I 2024-12-04 15:34:10,239] Trial 1892 finished with value: 0.41938650980874287 and parameters: {'n_estimators': 777, 'max_depth': 39, 'min_samples_split': 2, 'min_samples_leaf': 1, 'max_features': None, 'bootstrap': True, 'criterion': 'squared_error'}. Best is trial 1025 with value: 0.41844370194907604.
[I 2024-12-04 15:34:10,737] Trial 1894 finished with value: 0.42126676655383527 and parameters: {'n_estimators': 816, 'max_depth': 34, 'min_samples_split': 2, 'min_samples_leaf': 1, 'max_features': None, 'bootstrap': True, 'criterion': 'squared_error'}. Best is trial 1025 with value: 0.41844370194907604.
[I 2024-12-04 15:34:12,057] Trial 1904 finished with value: 0.46621627664108 and parameters: {'n_estimators': 505, 'max_depth': 34, 'min_samples_split': 3, 'min_samples_leaf': 2, 'max_features': None, 'bootstrap': True, 'criterion': 'squared_error'}. Best is trial 1025 with value: 0.41844370194907604.
[I 2024-12-04 15:34:12,063] Trial 1901 finished with value: 0.5037491403235598 and parameters: {'n_estimators': 628, 'max_depth': 42, 'min_samples_split': 2, 'min_samples_leaf': 1, 'max_features': 'sqrt', 'bootstrap': True, 'criterion': 'squared_error'}. Best is trial 1025 with value: 0.41844370194907604.
[I 2024-12-04 15:34:13,345] Trial 1902 finished with value: 0.6432832683010609 and parameters: {'n_estimators': 696, 'max_depth': 38, 'min_samples_split': 3, 'min_samples_leaf': 1, 'max_features': 'log2', 'bootstrap': True, 'criterion': 'squared_error'}. Best is trial 1025 with value: 0.41844370194907604.
[I 2024-12-04 15:34:13,790] Trial 1903 finished with value: 0.43137964598760214 and parameters: {'n_estimators': 731, 'max_depth': 41, 'min_samples_split': 4, 'min_samples_leaf': 1, 'max_features': None, 'bootstrap': True, 'criterion': 'squared_error'}. Best is trial 1025 with value: 0.41844370194907604.
[I 2024-12-04 15:34:18,018] Trial 1899 finished with value: 0.42152005637468704 and parameters: {'n_estimators': 824, 'max_depth': 42, 'min_samples_split': 2, 'min_samples_leaf': 1, 'max_features': None, 'bootstrap': True, 'criterion': 'squared_error'}. Best is trial 1025 with value: 0.41844370194907604.
[I 2024-12-04 15:34:18,024] Trial 1900 finished with value: 0.4212928062028264 and parameters: {'n_estimators': 810, 'max_depth': 42, 'min_samples_split': 2, 'min_samples_leaf': 1, 'max_features': None, 'bootstrap': True, 'criterion': 'squared_error'}. Best is trial 1025 with value: 0.41844370194907604.
[I 2024-12-04 15:34:19,721] Trial 1905 finished with value: 1.0281253784158522 and parameters: {'n_estimators': 874, 'max_depth': 8, 'min_samples_split': 3, 'min_samples_leaf': 3, 'max_features': 'log2', 'bootstrap': True, 'criterion': 'squared_error'}. Best is trial 1025 with value: 0.41844370194907604.
[I 2024-12-04 15:34:23,026] Trial 1906 finished with value: 0.42633288778272943 and parameters: {'n_estimators': 587, 'max_depth': 37, 'min_samples_split': 3, 'min_samples_leaf': 1, 'max_features': None, 'bootstrap': True, 'criterion': 'squared_error'}. Best is trial 1025 with value: 0.41844370194907604.
[I 2024-12-04 15:34:23,649] Trial 1912 finished with value: 0.426705426827976 and parameters: {'n_estimators': 630, 'max_depth': 35, 'min_samples_split': 3, 'min_samples_leaf': 1, 'max_features': None, 'bootstrap': True, 'criterion': 'squared_error'}. Best is trial 1025 with value: 0.41844370194907604.
[I 2024-12-04 15:34:24,843] Trial 1883 finished with value: 0.42959393923062245 and parameters: {'n_estimators': 547, 'max_depth': 37, 'min_samples_split': 2, 'min_samples_leaf': 1, 'max_features': None, 'bootstrap': True, 'criterion': 'absolute_error'}. Best is trial 1025 with value: 0.41844370194907604.
[I 2024-12-04 15:34:25,243] Trial 1910 finished with value: 0.4334869416678963 and parameters: {'n_estimators': 840, 'max_depth': 30, 'min_samples_split': 4, 'min_samples_leaf': 1, 'max_features': None, 'bootstrap': True, 'criterion': 'squared_error'}. Best is trial 1025 with value: 0.41844370194907604.
[I 2024-12-04 15:34:25,244] Trial 1909 finished with value: 0.4233181709484922 and parameters: {'n_estimators': 534, 'max_depth': 38, 'min_samples_split': 2, 'min_samples_leaf': 1, 'max_features': None, 'bootstrap': True, 'criterion': 'squared_error'}. Best is trial 1025 with value: 0.41844370194907604.
[I 2024-12-04 15:34:25,537] Trial 1914 finished with value: 0.4206889988754063 and parameters: {'n_estimators': 616, 'max_depth': 38, 'min_samples_split': 2, 'min_samples_leaf': 1, 'max_features': None, 'bootstrap': True, 'criterion': 'squared_error'}. Best is trial 1025 with value: 0.41844370194907604.
[I 2024-12-04 15:34:25,761] Trial 1911 finished with value: 0.42220831006221005 and parameters: {'n_estimators': 687, 'max_depth': 42, 'min_samples_split': 2, 'min_samples_leaf': 1, 'max_features': None, 'bootstrap': True, 'criterion': 'squared_error'}. Best is trial 1025 with value: 0.41844370194907604.
[I 2024-12-04 15:34:25,983] Trial 1913 finished with value: 0.4217363162507063 and parameters: {'n_estimators': 668, 'max_depth': 37, 'min_samples_split': 2, 'min_samples_leaf': 1, 'max_features': None, 'bootstrap': True, 'criterion': 'squared_error'}. Best is trial 1025 with value: 0.41844370194907604.
[I 2024-12-04 15:34:26,557] Trial 1908 finished with value: 0.4217203830821175 and parameters: {'n_estimators': 789, 'max_depth': 34, 'min_samples_split': 2, 'min_samples_leaf': 1, 'max_features': None, 'bootstrap': True, 'criterion': 'squared_error'}. Best is trial 1025 with value: 0.41844370194907604.
[I 2024-12-04 15:34:28,832] Trial 1916 finished with value: 0.4226406694557722 and parameters: {'n_estimators': 543, 'max_depth': 37, 'min_samples_split': 2, 'min_samples_leaf': 1, 'max_features': None, 'bootstrap': True, 'criterion': 'squared_error'}. Best is trial 1025 with value: 0.41844370194907604.
[I 2024-12-04 15:34:28,841] Trial 1915 finished with value: 0.4648251446298695 and parameters: {'n_estimators': 679, 'max_depth': 46, 'min_samples_split': 2, 'min_samples_leaf': 2, 'max_features': None, 'bootstrap': True, 'criterion': 'squared_error'}. Best is trial 1025 with value: 0.41844370194907604.
[I 2024-12-04 15:34:36,854] Trial 1917 finished with value: 0.8928560692374715 and parameters: {'n_estimators': 574, 'max_depth': 20, 'min_samples_split': 25, 'min_samples_leaf': 4, 'max_features': 'sqrt', 'bootstrap': True, 'criterion': 'absolute_error'}. Best is trial 1025 with value: 0.41844370194907604.
[I 2024-12-04 15:34:39,485] Trial 1929 finished with value: 0.8891996610527924 and parameters: {'n_estimators': 290, 'max_depth': 13, 'min_samples_split': 2, 'min_samples_leaf': 1, 'max_features': 'log2', 'bootstrap': True, 'criterion': 'squared_error'}. Best is trial 1025 with value: 0.41844370194907604.
[I 2024-12-04 15:34:40,881] Trial 1919 finished with value: 0.4220018360260404 and parameters: {'n_estimators': 736, 'max_depth': 46, 'min_samples_split': 2, 'min_samples_leaf': 1, 'max_features': None, 'bootstrap': True, 'criterion': 'squared_error'}. Best is trial 1025 with value: 0.41844370194907604.
[I 2024-12-04 15:34:41,035] Trial 1921 finished with value: 0.6803972361352307 and parameters: {'n_estimators': 871, 'max_depth': 38, 'min_samples_split': 7, 'min_samples_leaf': 1, 'max_features': 'log2', 'bootstrap': True, 'criterion': 'squared_error'}. Best is trial 1025 with value: 0.41844370194907604.
[I 2024-12-04 15:34:41,692] Trial 1918 finished with value: 0.4654786481871481 and parameters: {'n_estimators': 809, 'max_depth': 32, 'min_samples_split': 2, 'min_samples_leaf': 2, 'max_features': None, 'bootstrap': True, 'criterion': 'squared_error'}. Best is trial 1025 with value: 0.41844370194907604.
[I 2024-12-04 15:34:43,745] Trial 1923 finished with value: 0.4646600178561014 and parameters: {'n_estimators': 729, 'max_depth': 39, 'min_samples_split': 3, 'min_samples_leaf': 2, 'max_features': None, 'bootstrap': True, 'criterion': 'squared_error'}. Best is trial 1025 with value: 0.41844370194907604.
[I 2024-12-04 15:34:43,938] Trial 1922 finished with value: 0.4648455434485095 and parameters: {'n_estimators': 640, 'max_depth': 44, 'min_samples_split': 4, 'min_samples_leaf': 2, 'max_features': None, 'bootstrap': True, 'criterion': 'squared_error'}. Best is trial 1025 with value: 0.41844370194907604.
[I 2024-12-04 15:34:45,727] Trial 1924 finished with value: 0.4306193179673288 and parameters: {'n_estimators': 710, 'max_depth': 39, 'min_samples_split': 4, 'min_samples_leaf': 1, 'max_features': None, 'bootstrap': True, 'criterion': 'squared_error'}. Best is trial 1025 with value: 0.41844370194907604.
[I 2024-12-04 15:34:46,716] Trial 1920 finished with value: 0.42164594057715515 and parameters: {'n_estimators': 748, 'max_depth': 42, 'min_samples_split': 2, 'min_samples_leaf': 1, 'max_features': None, 'bootstrap': True, 'criterion': 'squared_error'}. Best is trial 1025 with value: 0.41844370194907604.
[I 2024-12-04 15:34:48,464] Trial 1925 finished with value: 0.42271855648366685 and parameters: {'n_estimators': 694, 'max_depth': 46, 'min_samples_split': 2, 'min_samples_leaf': 1, 'max_features': None, 'bootstrap': True, 'criterion': 'squared_error'}. Best is trial 1025 with value: 0.41844370194907604.
[I 2024-12-04 15:34:48,528] Trial 1935 finished with value: 0.5816798959628402 and parameters: {'n_estimators': 501, 'max_depth': 43, 'min_samples_split': 21, 'min_samples_leaf': 1, 'max_features': 'sqrt', 'bootstrap': True, 'criterion': 'squared_error'}. Best is trial 1025 with value: 0.41844370194907604.
[I 2024-12-04 15:34:50,143] Trial 1927 finished with value: 0.4216042112464808 and parameters: {'n_estimators': 681, 'max_depth': 43, 'min_samples_split': 2, 'min_samples_leaf': 1, 'max_features': None, 'bootstrap': True, 'criterion': 'squared_error'}. Best is trial 1025 with value: 0.41844370194907604.
[I 2024-12-04 15:34:50,501] Trial 1931 finished with value: 0.4198378365652792 and parameters: {'n_estimators': 757, 'max_depth': 39, 'min_samples_split': 2, 'min_samples_leaf': 1, 'max_features': None, 'bootstrap': True, 'criterion': 'squared_error'}. Best is trial 1025 with value: 0.41844370194907604.
[I 2024-12-04 15:34:54,570] Trial 1928 finished with value: 0.43226600305602175 and parameters: {'n_estimators': 639, 'max_depth': 43, 'min_samples_split': 4, 'min_samples_leaf': 1, 'max_features': None, 'bootstrap': True, 'criterion': 'squared_error'}. Best is trial 1025 with value: 0.41844370194907604.
[I 2024-12-04 15:34:56,240] Trial 1945 finished with value: 1.0608148147231529 and parameters: {'n_estimators': 288, 'max_depth': 7, 'min_samples_split': 16, 'min_samples_leaf': 14, 'max_features': 'log2', 'bootstrap': True, 'criterion': 'absolute_error'}. Best is trial 1025 with value: 0.41844370194907604.
[I 2024-12-04 15:34:56,939] Trial 1933 finished with value: 0.4212107477852557 and parameters: {'n_estimators': 714, 'max_depth': 32, 'min_samples_split': 2, 'min_samples_leaf': 1, 'max_features': None, 'bootstrap': True, 'criterion': 'squared_error'}. Best is trial 1025 with value: 0.41844370194907604.
