[I 2024-12-04 11:53:14,104] Trial 311 finished with value: 0.5346482740235124 and parameters: {'max_depth': 34, 'min_samples_split': 2, 'min_samples_leaf': 1, 'max_features': 'log2', 'criterion': 'squared_error', 'splitter': 'best'}. Best is trial 309 with value: 0.46729638362398634.
[I 2024-12-04 11:53:14,106] Trial 296 finished with value: 1.0706801294307473 and parameters: {'max_depth': 26, 'min_samples_split': 3, 'min_samples_leaf': 1, 'max_features': 'sqrt', 'criterion': 'absolute_error', 'splitter': 'best'}. Best is trial 309 with value: 0.46729638362398634.
[I 2024-12-04 11:53:14,148] Trial 317 finished with value: 1.3225455615026942 and parameters: {'max_depth': 1, 'min_samples_split': 9, 'min_samples_leaf': 10, 'max_features': 'sqrt', 'criterion': 'squared_error', 'splitter': 'best'}. Best is trial 309 with value: 0.46729638362398634.
[I 2024-12-04 11:53:14,172] Trial 308 finished with value: 0.5861904649615429 and parameters: {'max_depth': 28, 'min_samples_split': 5, 'min_samples_leaf': 1, 'max_features': 'sqrt', 'criterion': 'absolute_error', 'splitter': 'best'}. Best is trial 309 with value: 0.46729638362398634.
[I 2024-12-04 11:53:14,710] Trial 318 finished with value: 1.0235080961846112 and parameters: {'max_depth': 25, 'min_samples_split': 2, 'min_samples_leaf': 1, 'max_features': 'sqrt', 'criterion': 'absolute_error', 'splitter': 'best'}. Best is trial 309 with value: 0.46729638362398634.
[I 2024-12-04 11:53:15,690] Trial 322 finished with value: 1.2580127977476545 and parameters: {'max_depth': 30, 'min_samples_split': 18, 'min_samples_leaf': 5, 'max_features': 'sqrt', 'criterion': 'squared_error', 'splitter': 'random'}. Best is trial 309 with value: 0.46729638362398634.
[I 2024-12-04 11:53:15,942] Trial 314 finished with value: 0.6370124313821706 and parameters: {'max_depth': 31, 'min_samples_split': 5, 'min_samples_leaf': 1, 'max_features': 'log2', 'criterion': 'squared_error', 'splitter': 'best'}. Best is trial 309 with value: 0.46729638362398634.
[I 2024-12-04 11:53:15,944] Trial 313 finished with value: 0.7183579950329348 and parameters: {'max_depth': 34, 'min_samples_split': 6, 'min_samples_leaf': 1, 'max_features': 'log2', 'criterion': 'squared_error', 'splitter': 'best'}. Best is trial 309 with value: 0.46729638362398634.
[I 2024-12-04 11:53:16,559] Trial 312 finished with value: 0.8666968382247049 and parameters: {'max_depth': 31, 'min_samples_split': 2, 'min_samples_leaf': 3, 'max_features': 'sqrt', 'criterion': 'absolute_error', 'splitter': 'best'}. Best is trial 309 with value: 0.46729638362398634.
[I 2024-12-04 11:53:16,572] Trial 321 finished with value: 0.5346482740235124 and parameters: {'max_depth': 34, 'min_samples_split': 2, 'min_samples_leaf': 1, 'max_features': 'log2', 'criterion': 'squared_error', 'splitter': 'best'}. Best is trial 309 with value: 0.46729638362398634.
[I 2024-12-04 11:53:17,372] Trial 325 finished with value: 0.924799806170231 and parameters: {'max_depth': 31, 'min_samples_split': 2, 'min_samples_leaf': 3, 'max_features': 'log2', 'criterion': 'squared_error', 'splitter': 'best'}. Best is trial 309 with value: 0.46729638362398634.
[I 2024-12-04 11:53:17,957] Trial 326 finished with value: 1.3014693347727373 and parameters: {'max_depth': 30, 'min_samples_split': 9, 'min_samples_leaf': 7, 'max_features': 'log2', 'criterion': 'friedman_mse', 'splitter': 'random'}. Best is trial 309 with value: 0.46729638362398634.
[I 2024-12-04 11:53:18,512] Trial 315 finished with value: 0.5583963367356682 and parameters: {'max_depth': 32, 'min_samples_split': 2, 'min_samples_leaf': 1, 'max_features': 'log2', 'criterion': 'squared_error', 'splitter': 'best'}. Best is trial 309 with value: 0.46729638362398634.
[I 2024-12-04 11:53:19,370] Trial 324 finished with value: 1.298283307656757 and parameters: {'max_depth': 14, 'min_samples_split': 19, 'min_samples_leaf': 5, 'max_features': 'log2', 'criterion': 'squared_error', 'splitter': 'random'}. Best is trial 309 with value: 0.46729638362398634.
[I 2024-12-04 11:53:19,585] Trial 333 finished with value: 0.5855175778219047 and parameters: {'max_depth': 35, 'min_samples_split': 3, 'min_samples_leaf': 1, 'max_features': 'log2', 'criterion': 'squared_error', 'splitter': 'best'}. Best is trial 309 with value: 0.46729638362398634.
[I 2024-12-04 11:53:19,902] Trial 336 finished with value: 0.5954307148355462 and parameters: {'max_depth': 30, 'min_samples_split': 2, 'min_samples_leaf': 1, 'max_features': 'log2', 'criterion': 'squared_error', 'splitter': 'best'}. Best is trial 309 with value: 0.46729638362398634.
[I 2024-12-04 11:53:20,287] Trial 328 finished with value: 0.5172303731839445 and parameters: {'max_depth': 33, 'min_samples_split': 2, 'min_samples_leaf': 1, 'max_features': 'log2', 'criterion': 'squared_error', 'splitter': 'best'}. Best is trial 309 with value: 0.46729638362398634.
[I 2024-12-04 11:53:20,326] Trial 332 finished with value: 0.924799806170231 and parameters: {'max_depth': 31, 'min_samples_split': 2, 'min_samples_leaf': 3, 'max_features': 'log2', 'criterion': 'squared_error', 'splitter': 'best'}. Best is trial 309 with value: 0.46729638362398634.
[I 2024-12-04 11:53:20,499] Trial 327 finished with value: 0.5346482740235124 and parameters: {'max_depth': 34, 'min_samples_split': 2, 'min_samples_leaf': 1, 'max_features': 'log2', 'criterion': 'squared_error', 'splitter': 'best'}. Best is trial 309 with value: 0.46729638362398634.
[I 2024-12-04 11:53:20,613] Trial 320 finished with value: 0.48023816165717975 and parameters: {'max_depth': 33, 'min_samples_split': 2, 'min_samples_leaf': 1, 'max_features': 'sqrt', 'criterion': 'absolute_error', 'splitter': 'best'}. Best is trial 309 with value: 0.46729638362398634.
[I 2024-12-04 11:53:20,614] Trial 304 finished with value: 1.3007745979739842 and parameters: {'max_depth': 21, 'min_samples_split': 19, 'min_samples_leaf': 9, 'max_features': 'log2', 'criterion': 'squared_error', 'splitter': 'best'}. Best is trial 309 with value: 0.46729638362398634.
[I 2024-12-04 11:53:20,912] Trial 319 finished with value: 1.3629276849850611 and parameters: {'max_depth': 25, 'min_samples_split': 14, 'min_samples_leaf': 9, 'max_features': 'log2', 'criterion': 'absolute_error', 'splitter': 'random'}. Best is trial 309 with value: 0.46729638362398634.
[I 2024-12-04 11:53:20,924] Trial 316 finished with value: 0.5954307148355462 and parameters: {'max_depth': 30, 'min_samples_split': 2, 'min_samples_leaf': 1, 'max_features': 'log2', 'criterion': 'squared_error', 'splitter': 'best'}. Best is trial 309 with value: 0.46729638362398634.
[I 2024-12-04 11:53:21,489] Trial 335 finished with value: 1.3014693347727373 and parameters: {'max_depth': 30, 'min_samples_split': 19, 'min_samples_leaf': 8, 'max_features': 'log2', 'criterion': 'squared_error', 'splitter': 'random'}. Best is trial 309 with value: 0.46729638362398634.
[I 2024-12-04 11:53:21,645] Trial 342 finished with value: 0.924799806170231 and parameters: {'max_depth': 29, 'min_samples_split': 6, 'min_samples_leaf': 3, 'max_features': 'log2', 'criterion': 'squared_error', 'splitter': 'best'}. Best is trial 309 with value: 0.46729638362398634.
[I 2024-12-04 11:53:21,881] Trial 344 finished with value: 0.5209986636170143 and parameters: {'max_depth': 29, 'min_samples_split': 2, 'min_samples_leaf': 1, 'max_features': 'sqrt', 'criterion': 'absolute_error', 'splitter': 'best'}. Best is trial 309 with value: 0.46729638362398634.
[I 2024-12-04 11:53:22,066] Trial 338 finished with value: 1.0894525583560912 and parameters: {'max_depth': 35, 'min_samples_split': 4, 'min_samples_leaf': 2, 'max_features': 'sqrt', 'criterion': 'absolute_error', 'splitter': 'best'}. Best is trial 309 with value: 0.46729638362398634.
[I 2024-12-04 11:53:22,150] Trial 337 finished with value: 1.2140881287125183 and parameters: {'max_depth': 34, 'min_samples_split': 3, 'min_samples_leaf': 1, 'max_features': 'log2', 'criterion': 'squared_error', 'splitter': 'random'}. Best is trial 309 with value: 0.46729638362398634.
[I 2024-12-04 11:53:22,324] Trial 329 finished with value: 1.3007745979739842 and parameters: {'max_depth': 34, 'min_samples_split': 5, 'min_samples_leaf': 10, 'max_features': 'log2', 'criterion': 'squared_error', 'splitter': 'best'}. Best is trial 309 with value: 0.46729638362398634.
[I 2024-12-04 11:53:22,325] Trial 331 finished with value: 1.292655019777175 and parameters: {'max_depth': 30, 'min_samples_split': 2, 'min_samples_leaf': 3, 'max_features': 'log2', 'criterion': 'squared_error', 'splitter': 'random'}. Best is trial 309 with value: 0.46729638362398634.
[I 2024-12-04 11:53:22,498] Trial 323 finished with value: 0.5266640698896663 and parameters: {'max_depth': 32, 'min_samples_split': 2, 'min_samples_leaf': 1, 'max_features': 'sqrt', 'criterion': 'absolute_error', 'splitter': 'best'}. Best is trial 309 with value: 0.46729638362398634.
[I 2024-12-04 11:53:24,148] Trial 340 finished with value: 0.5266640698896663 and parameters: {'max_depth': 32, 'min_samples_split': 2, 'min_samples_leaf': 1, 'max_features': 'sqrt', 'criterion': 'absolute_error', 'splitter': 'best'}. Best is trial 309 with value: 0.46729638362398634.
[I 2024-12-04 11:53:24,342] Trial 334 finished with value: 1.3629276849850611 and parameters: {'max_depth': 35, 'min_samples_split': 2, 'min_samples_leaf': 7, 'max_features': 'log2', 'criterion': 'absolute_error', 'splitter': 'random'}. Best is trial 309 with value: 0.46729638362398634.
[I 2024-12-04 11:53:24,763] Trial 330 finished with value: 0.5578480825684508 and parameters: {'max_depth': 33, 'min_samples_split': 4, 'min_samples_leaf': 1, 'max_features': 'sqrt', 'criterion': 'absolute_error', 'splitter': 'best'}. Best is trial 309 with value: 0.46729638362398634.
[I 2024-12-04 11:53:24,972] Trial 350 finished with value: 1.009355341748503 and parameters: {'max_depth': 26, 'min_samples_split': 5, 'min_samples_leaf': 2, 'max_features': 'log2', 'criterion': 'absolute_error', 'splitter': 'best'}. Best is trial 309 with value: 0.46729638362398634.
[I 2024-12-04 11:53:26,044] Trial 349 finished with value: 0.8651082340897873 and parameters: {'max_depth': 30, 'min_samples_split': 5, 'min_samples_leaf': 4, 'max_features': 'sqrt', 'criterion': 'absolute_error', 'splitter': 'best'}. Best is trial 309 with value: 0.46729638362398634.
[I 2024-12-04 11:53:26,914] Trial 347 finished with value: 1.1057752596098773 and parameters: {'max_depth': 25, 'min_samples_split': 4, 'min_samples_leaf': 2, 'max_features': 'sqrt', 'criterion': 'absolute_error', 'splitter': 'best'}. Best is trial 309 with value: 0.46729638362398634.
[I 2024-12-04 11:53:27,232] Trial 348 finished with value: 0.7946959960558615 and parameters: {'max_depth': 35, 'min_samples_split': 7, 'min_samples_leaf': 3, 'max_features': 'log2', 'criterion': 'absolute_error', 'splitter': 'best'}. Best is trial 309 with value: 0.46729638362398634.
[I 2024-12-04 11:53:27,237] Trial 341 finished with value: 1.36280343027112 and parameters: {'max_depth': 2, 'min_samples_split': 4, 'min_samples_leaf': 9, 'max_features': 'log2', 'criterion': 'absolute_error', 'splitter': 'best'}. Best is trial 309 with value: 0.46729638362398634.
[I 2024-12-04 11:53:27,332] Trial 346 finished with value: 1.1261704700030433 and parameters: {'max_depth': 26, 'min_samples_split': 2, 'min_samples_leaf': 2, 'max_features': 'sqrt', 'criterion': 'absolute_error', 'splitter': 'best'}. Best is trial 309 with value: 0.46729638362398634.
[I 2024-12-04 11:53:27,828] Trial 357 finished with value: 0.8349931923994113 and parameters: {'max_depth': 26, 'min_samples_split': 7, 'min_samples_leaf': 1, 'max_features': 'log2', 'criterion': 'squared_error', 'splitter': 'best'}. Best is trial 309 with value: 0.46729638362398634.
[I 2024-12-04 11:53:28,680] Trial 343 finished with value: 0.5199874414829739 and parameters: {'max_depth': 29, 'min_samples_split': 2, 'min_samples_leaf': 1, 'max_features': 'sqrt', 'criterion': 'friedman_mse', 'splitter': 'best'}. Best is trial 309 with value: 0.46729638362398634.
[I 2024-12-04 11:53:29,046] Trial 367 finished with value: 1.3309341156480161 and parameters: {'max_depth': 22, 'min_samples_split': 20, 'min_samples_leaf': 1, 'max_features': 'log2', 'criterion': 'absolute_error', 'splitter': 'random'}. Best is trial 309 with value: 0.46729638362398634.
[I 2024-12-04 11:53:29,117] Trial 352 finished with value: 0.7257538832775959 and parameters: {'max_depth': 32, 'min_samples_split': 12, 'min_samples_leaf': 2, 'max_features': 'sqrt', 'criterion': 'friedman_mse', 'splitter': 'best'}. Best is trial 309 with value: 0.46729638362398634.
[I 2024-12-04 11:53:29,341] Trial 351 finished with value: 0.98660199832419 and parameters: {'max_depth': 33, 'min_samples_split': 8, 'min_samples_leaf': 2, 'max_features': 'sqrt', 'criterion': 'absolute_error', 'splitter': 'random'}. Best is trial 309 with value: 0.46729638362398634.
[I 2024-12-04 11:53:29,818] Trial 364 finished with value: 0.7462665810095562 and parameters: {'max_depth': 6, 'min_samples_split': 17, 'min_samples_leaf': 1, 'max_features': 'log2', 'criterion': 'squared_error', 'splitter': 'best'}. Best is trial 309 with value: 0.46729638362398634.
[I 2024-12-04 11:53:30,035] Trial 365 finished with value: 0.5676896406579539 and parameters: {'max_depth': 25, 'min_samples_split': 2, 'min_samples_leaf': 1, 'max_features': 'sqrt', 'criterion': 'squared_error', 'splitter': 'best'}. Best is trial 309 with value: 0.46729638362398634.
[I 2024-12-04 11:53:30,159] Trial 339 finished with value: 0.7020576081703146 and parameters: {'max_depth': 29, 'min_samples_split': 6, 'min_samples_leaf': 1, 'max_features': 'log2', 'criterion': 'squared_error', 'splitter': 'best'}. Best is trial 309 with value: 0.46729638362398634.
[I 2024-12-04 11:53:30,627] Trial 345 finished with value: 1.3105279435582882 and parameters: {'max_depth': 24, 'min_samples_split': 11, 'min_samples_leaf': 8, 'max_features': 'sqrt', 'criterion': 'squared_error', 'splitter': 'best'}. Best is trial 309 with value: 0.46729638362398634.
[I 2024-12-04 11:53:30,923] Trial 361 finished with value: 0.924799806170231 and parameters: {'max_depth': 29, 'min_samples_split': 2, 'min_samples_leaf': 3, 'max_features': 'log2', 'criterion': 'squared_error', 'splitter': 'best'}. Best is trial 309 with value: 0.46729638362398634.
[I 2024-12-04 11:53:31,100] Trial 353 finished with value: 0.7460452081147885 and parameters: {'max_depth': 25, 'min_samples_split': 4, 'min_samples_leaf': 1, 'max_features': 'log2', 'criterion': 'absolute_error', 'splitter': 'best'}. Best is trial 309 with value: 0.46729638362398634.
[I 2024-12-04 11:53:31,272] Trial 366 finished with value: 0.7169847047063859 and parameters: {'max_depth': 31, 'min_samples_split': 3, 'min_samples_leaf': 2, 'max_features': 'sqrt', 'criterion': 'absolute_error', 'splitter': 'best'}. Best is trial 309 with value: 0.46729638362398634.
[I 2024-12-04 11:53:31,577] Trial 354 finished with value: 1.009355341748503 and parameters: {'max_depth': 25, 'min_samples_split': 2, 'min_samples_leaf': 2, 'max_features': 'log2', 'criterion': 'absolute_error', 'splitter': 'best'}. Best is trial 309 with value: 0.46729638362398634.
[I 2024-12-04 11:53:31,989] Trial 356 finished with value: 1.1408779699500264 and parameters: {'max_depth': 33, 'min_samples_split': 2, 'min_samples_leaf': 2, 'max_features': 'sqrt', 'criterion': 'absolute_error', 'splitter': 'best'}. Best is trial 309 with value: 0.46729638362398634.
[I 2024-12-04 11:53:32,298] Trial 360 finished with value: 1.104095677292521 and parameters: {'max_depth': 27, 'min_samples_split': 18, 'min_samples_leaf': 2, 'max_features': 'sqrt', 'criterion': 'squared_error', 'splitter': 'best'}. Best is trial 309 with value: 0.46729638362398634.
[I 2024-12-04 11:53:32,470] Trial 371 finished with value: 0.5680194359354153 and parameters: {'max_depth': 34, 'min_samples_split': 2, 'min_samples_leaf': 1, 'max_features': 'sqrt', 'criterion': 'absolute_error', 'splitter': 'best'}. Best is trial 309 with value: 0.46729638362398634.
[I 2024-12-04 11:53:32,522] Trial 355 finished with value: 1.1330191979137698 and parameters: {'max_depth': 26, 'min_samples_split': 5, 'min_samples_leaf': 2, 'max_features': 'sqrt', 'criterion': 'friedman_mse', 'splitter': 'best'}. Best is trial 309 with value: 0.46729638362398634.
[I 2024-12-04 11:53:32,811] Trial 358 finished with value: 0.574555629772596 and parameters: {'max_depth': 23, 'min_samples_split': 2, 'min_samples_leaf': 1, 'max_features': 'sqrt', 'criterion': 'friedman_mse', 'splitter': 'best'}. Best is trial 309 with value: 0.46729638362398634.
[I 2024-12-04 11:53:32,818] Trial 370 finished with value: 1.2707508278377346 and parameters: {'max_depth': 32, 'min_samples_split': 2, 'min_samples_leaf': 3, 'max_features': 'sqrt', 'criterion': 'friedman_mse', 'splitter': 'best'}. Best is trial 309 with value: 0.46729638362398634.
[I 2024-12-04 11:53:33,164] Trial 372 finished with value: 1.3130149982826922 and parameters: {'max_depth': 35, 'min_samples_split': 8, 'min_samples_leaf': 10, 'max_features': 'sqrt', 'criterion': 'squared_error', 'splitter': 'random'}. Best is trial 309 with value: 0.46729638362398634.
[I 2024-12-04 11:53:33,306] Trial 363 finished with value: 0.46729638362398634 and parameters: {'max_depth': 31, 'min_samples_split': 2, 'min_samples_leaf': 1, 'max_features': 'sqrt', 'criterion': 'absolute_error', 'splitter': 'best'}. Best is trial 309 with value: 0.46729638362398634.
[I 2024-12-04 11:53:34,290] Trial 378 finished with value: 0.5777419995377217 and parameters: {'max_depth': 27, 'min_samples_split': 3, 'min_samples_leaf': 1, 'max_features': 'sqrt', 'criterion': 'absolute_error', 'splitter': 'best'}. Best is trial 309 with value: 0.46729638362398634.
[I 2024-12-04 11:53:34,937] Trial 369 finished with value: 0.6938890537780812 and parameters: {'max_depth': 29, 'min_samples_split': 4, 'min_samples_leaf': 1, 'max_features': 'log2', 'criterion': 'squared_error', 'splitter': 'best'}. Best is trial 309 with value: 0.46729638362398634.
[I 2024-12-04 11:53:34,941] Trial 368 finished with value: 1.3604321503216543 and parameters: {'max_depth': 9, 'min_samples_split': 16, 'min_samples_leaf': 6, 'max_features': 'log2', 'criterion': 'absolute_error', 'splitter': 'random'}. Best is trial 309 with value: 0.46729638362398634.
[I 2024-12-04 11:53:34,943] Trial 380 finished with value: 1.3400153874729748 and parameters: {'max_depth': 6, 'min_samples_split': 18, 'min_samples_leaf': 10, 'max_features': 'sqrt', 'criterion': 'absolute_error', 'splitter': 'best'}. Best is trial 309 with value: 0.46729638362398634.
[I 2024-12-04 11:53:36,403] Trial 373 finished with value: 1.313638180307319 and parameters: {'max_depth': 2, 'min_samples_split': 2, 'min_samples_leaf': 1, 'max_features': 'sqrt', 'criterion': 'friedman_mse', 'splitter': 'random'}. Best is trial 309 with value: 0.46729638362398634.
[I 2024-12-04 11:53:36,404] Trial 362 finished with value: 0.8623498966620103 and parameters: {'max_depth': 32, 'min_samples_split': 7, 'min_samples_leaf': 1, 'max_features': 'log2', 'criterion': 'absolute_error', 'splitter': 'best'}. Best is trial 309 with value: 0.46729638362398634.
[I 2024-12-04 11:53:37,356] Trial 387 finished with value: 1.2228981981106881 and parameters: {'max_depth': 21, 'min_samples_split': 3, 'min_samples_leaf': 1, 'max_features': 'sqrt', 'criterion': 'absolute_error', 'splitter': 'random'}. Best is trial 309 with value: 0.46729638362398634.
[I 2024-12-04 11:53:37,384] Trial 376 finished with value: 1.1261154552845143 and parameters: {'max_depth': 27, 'min_samples_split': 4, 'min_samples_leaf': 2, 'max_features': 'sqrt', 'criterion': 'friedman_mse', 'splitter': 'best'}. Best is trial 309 with value: 0.46729638362398634.
[I 2024-12-04 11:53:37,713] Trial 374 finished with value: 0.7065903988721992 and parameters: {'max_depth': 30, 'min_samples_split': 4, 'min_samples_leaf': 1, 'max_features': 'sqrt', 'criterion': 'absolute_error', 'splitter': 'best'}. Best is trial 309 with value: 0.46729638362398634.
[I 2024-12-04 11:53:37,850] Trial 381 finished with value: 0.6293710176454519 and parameters: {'max_depth': 29, 'min_samples_split': 6, 'min_samples_leaf': 1, 'max_features': 'sqrt', 'criterion': 'absolute_error', 'splitter': 'best'}. Best is trial 309 with value: 0.46729638362398634.
[I 2024-12-04 11:53:38,054] Trial 382 finished with value: 1.295915900333568 and parameters: {'max_depth': 3, 'min_samples_split': 2, 'min_samples_leaf': 1, 'max_features': 'log2', 'criterion': 'squared_error', 'splitter': 'random'}. Best is trial 309 with value: 0.46729638362398634.
[I 2024-12-04 11:53:38,180] Trial 377 finished with value: 0.5209986636170143 and parameters: {'max_depth': 29, 'min_samples_split': 2, 'min_samples_leaf': 1, 'max_features': 'sqrt', 'criterion': 'absolute_error', 'splitter': 'best'}. Best is trial 309 with value: 0.46729638362398634.
[I 2024-12-04 11:53:38,225] Trial 385 finished with value: 0.669404207355305 and parameters: {'max_depth': 28, 'min_samples_split': 4, 'min_samples_leaf': 1, 'max_features': 'sqrt', 'criterion': 'friedman_mse', 'splitter': 'best'}. Best is trial 309 with value: 0.46729638362398634.
[I 2024-12-04 11:53:38,619] Trial 379 finished with value: 0.5676194226646921 and parameters: {'max_depth': 33, 'min_samples_split': 2, 'min_samples_leaf': 1, 'max_features': 'sqrt', 'criterion': 'squared_error', 'splitter': 'best'}. Best is trial 309 with value: 0.46729638362398634.
[I 2024-12-04 11:53:39,046] Trial 384 finished with value: 1.3300659268395663 and parameters: {'max_depth': 8, 'min_samples_split': 18, 'min_samples_leaf': 4, 'max_features': 'sqrt', 'criterion': 'absolute_error', 'splitter': 'best'}. Best is trial 309 with value: 0.46729638362398634.
[I 2024-12-04 11:53:39,203] Trial 359 finished with value: 0.46729638362398634 and parameters: {'max_depth': 31, 'min_samples_split': 2, 'min_samples_leaf': 1, 'max_features': 'sqrt', 'criterion': 'absolute_error', 'splitter': 'best'}. Best is trial 309 with value: 0.46729638362398634.
