[I 2024-12-03 19:09:29,676] Trial 1703 finished with value: 0.1368798600762667 and parameters: {'kernel': 'linear', 'C': 3.214727471737079, 'gamma': 0.009055331521780178, 'epsilon': 0.02302664642120818}. Best is trial 345 with value: 0.13438257115663557.
[I 2024-12-03 19:09:29,909] Trial 1704 finished with value: 0.13600868827963958 and parameters: {'kernel': 'linear', 'C': 3.6362125850610316, 'gamma': 0.0019588058978559568, 'epsilon': 0.05555329049559182}. Best is trial 345 with value: 0.13438257115663557.
[I 2024-12-03 19:09:31,190] Trial 1700 finished with value: 0.13707685085953905 and parameters: {'kernel': 'linear', 'C': 20.48068668209379, 'gamma': 0.01289477292883786, 'epsilon': 0.04861013167086821}. Best is trial 345 with value: 0.13438257115663557.
[I 2024-12-03 19:09:31,231] Trial 1656 finished with value: 0.13724700767491202 and parameters: {'kernel': 'linear', 'C': 97.11255414855366, 'gamma': 0.010601701595491059, 'epsilon': 0.04780982060588773}. Best is trial 345 with value: 0.13438257115663557.
[I 2024-12-03 19:09:31,524] Trial 1618 finished with value: 0.13776171809326668 and parameters: {'kernel': 'linear', 'C': 95.8961504858855, 'gamma': 0.6199255081480004, 'epsilon': 0.002433211274223639}. Best is trial 345 with value: 0.13438257115663557.
[I 2024-12-03 19:09:33,557] Trial 1707 finished with value: 0.14607184378865082 and parameters: {'kernel': 'linear', 'C': 29.186189130219173, 'gamma': 0.002831688484442226, 'epsilon': 0.12912977247908344}. Best is trial 345 with value: 0.13438257115663557.
[I 2024-12-03 19:09:35,650] Trial 730 finished with value: 0.3199257828510886 and parameters: {'kernel': 'poly', 'C': 0.6121855345145965, 'gamma': 0.4138946459100677, 'epsilon': 0.0026515242436376055}. Best is trial 345 with value: 0.13438257115663557.
[I 2024-12-03 19:09:35,933] Trial 1706 finished with value: 0.13971943907323853 and parameters: {'kernel': 'linear', 'C': 25.272270814359473, 'gamma': 0.0061666302507785015, 'epsilon': 0.08700131799802047}. Best is trial 345 with value: 0.13438257115663557.
[I 2024-12-03 19:09:36,011] Trial 1665 finished with value: 0.13528745511252718 and parameters: {'kernel': 'linear', 'C': 84.38831459581652, 'gamma': 0.0027327713754275312, 'epsilon': 0.059945165846318114}. Best is trial 345 with value: 0.13438257115663557.
[I 2024-12-03 19:09:37,679] Trial 1715 finished with value: 1.057467532752886 and parameters: {'kernel': 'poly', 'C': 26.18188685370901, 'gamma': 0.001907157376229277, 'epsilon': 0.01944857853103313}. Best is trial 345 with value: 0.13438257115663557.
[I 2024-12-03 19:09:38,077] Trial 1614 finished with value: 0.13825672005045095 and parameters: {'kernel': 'linear', 'C': 97.19776109583142, 'gamma': 0.0027096966372987495, 'epsilon': 0.010220656439358447}. Best is trial 345 with value: 0.13438257115663557.
[I 2024-12-03 19:09:40,518] Trial 1710 finished with value: 0.14120349389372072 and parameters: {'kernel': 'linear', 'C': 21.889435437553132, 'gamma': 0.0006980571856456808, 'epsilon': 0.09791506480488912}. Best is trial 345 with value: 0.13438257115663557.
[I 2024-12-03 19:09:42,123] Trial 1631 finished with value: 0.13726219157590833 and parameters: {'kernel': 'linear', 'C': 88.79412051116043, 'gamma': 0.006576357923988674, 'epsilon': 0.019287738756330913}. Best is trial 345 with value: 0.13438257115663557.
[I 2024-12-03 19:09:45,543] Trial 1716 finished with value: 0.13689995310784406 and parameters: {'kernel': 'linear', 'C': 13.166447447378683, 'gamma': 0.005984876771546975, 'epsilon': 0.04929050610958997}. Best is trial 345 with value: 0.13438257115663557.
[I 2024-12-03 19:09:46,946] Trial 1633 finished with value: 0.13752497655344184 and parameters: {'kernel': 'linear', 'C': 95.90475968478866, 'gamma': 0.05005246019085772, 'epsilon': 0.020132687637608726}. Best is trial 345 with value: 0.13438257115663557.
[I 2024-12-03 19:09:47,530] Trial 1708 finished with value: 0.13638292691791154 and parameters: {'kernel': 'linear', 'C': 18.413375296803853, 'gamma': 0.004788477798530988, 'epsilon': 0.02549887126980837}. Best is trial 345 with value: 0.13438257115663557.
[I 2024-12-03 19:09:47,966] Trial 1714 finished with value: 0.1353308913225219 and parameters: {'kernel': 'linear', 'C': 12.79222155171119, 'gamma': 0.0008984602569063148, 'epsilon': 0.028986250910964538}. Best is trial 345 with value: 0.13438257115663557.
[I 2024-12-03 19:09:49,060] Trial 1719 finished with value: 0.13610175142584963 and parameters: {'kernel': 'linear', 'C': 5.981569596908711, 'gamma': 0.018658685785923994, 'epsilon': 0.029889614077354694}. Best is trial 345 with value: 0.13438257115663557.
[I 2024-12-03 19:09:50,383] Trial 1725 finished with value: 0.409939618041089 and parameters: {'kernel': 'rbf', 'C': 3.4329453865908706, 'gamma': 0.00027120785605110314, 'epsilon': 0.046988672691348}. Best is trial 345 with value: 0.13438257115663557.
[I 2024-12-03 19:09:50,602] Trial 1645 finished with value: 0.1383297933868622 and parameters: {'kernel': 'linear', 'C': 84.84552586754549, 'gamma': 0.009325649693191466, 'epsilon': 0.015753677792172717}. Best is trial 345 with value: 0.13438257115663557.
[I 2024-12-03 19:09:54,190] Trial 1695 finished with value: 0.13781920762637187 and parameters: {'kernel': 'linear', 'C': 25.88837027929163, 'gamma': 0.0039957330550809324, 'epsilon': 0.015855714287586573}. Best is trial 345 with value: 0.13438257115663557.
[I 2024-12-03 19:10:00,094] Trial 1728 finished with value: 0.13625145678850004 and parameters: {'kernel': 'linear', 'C': 6.291494060558099, 'gamma': 0.0014379135052807876, 'epsilon': 0.04444724981177619}. Best is trial 345 with value: 0.13438257115663557.
[I 2024-12-03 19:10:01,512] Trial 1713 finished with value: 0.1382228390923715 and parameters: {'kernel': 'linear', 'C': 18.508168676679595, 'gamma': 0.008204822271494105, 'epsilon': 0.00923414600257574}. Best is trial 345 with value: 0.13438257115663557.
[I 2024-12-03 19:10:02,233] Trial 1724 finished with value: 0.13491682944118907 and parameters: {'kernel': 'linear', 'C': 18.9598602599465, 'gamma': 0.004996526057895533, 'epsilon': 0.06267790705890634}. Best is trial 345 with value: 0.13438257115663557.
[I 2024-12-03 19:10:05,834] Trial 1726 finished with value: 0.1377938620776357 and parameters: {'kernel': 'linear', 'C': 91.97190039840902, 'gamma': 0.001745354608965019, 'epsilon': 0.07774541917440562}. Best is trial 345 with value: 0.13438257115663557.
[I 2024-12-03 19:10:06,612] Trial 1652 finished with value: 0.1356800829036193 and parameters: {'kernel': 'linear', 'C': 99.19782436561208, 'gamma': 0.008412479714432045, 'epsilon': 0.03481516867192913}. Best is trial 345 with value: 0.13438257115663557.
[I 2024-12-03 19:10:07,700] Trial 1721 finished with value: 0.13678207559405964 and parameters: {'kernel': 'linear', 'C': 21.629527023689096, 'gamma': 0.0031769356720627185, 'epsilon': 0.023463435749399016}. Best is trial 345 with value: 0.13438257115663557.
[I 2024-12-03 19:10:08,223] Trial 1709 finished with value: 0.13499136684315438 and parameters: {'kernel': 'linear', 'C': 90.10142940997417, 'gamma': 0.04187739149756488, 'epsilon': 0.05615186569545571}. Best is trial 345 with value: 0.13438257115663557.
[I 2024-12-03 19:10:09,503] Trial 1659 finished with value: 0.13755667577652353 and parameters: {'kernel': 'linear', 'C': 97.9927873765511, 'gamma': 0.007511610808326568, 'epsilon': 0.02115764215318944}. Best is trial 345 with value: 0.13438257115663557.
[I 2024-12-03 19:10:09,646] Trial 1735 finished with value: 611.3527698159484 and parameters: {'kernel': 'sigmoid', 'C': 96.6568922504353, 'gamma': 0.010906196079440857, 'epsilon': 0.08144429590756354}. Best is trial 345 with value: 0.13438257115663557.
[I 2024-12-03 19:10:10,704] Trial 1734 finished with value: 0.1466670132700163 and parameters: {'kernel': 'linear', 'C': 20.4603388182807, 'gamma': 0.031447439635256896, 'epsilon': 0.13389532359334538}. Best is trial 345 with value: 0.13438257115663557.
[I 2024-12-03 19:10:11,871] Trial 1737 finished with value: 1.2859672675100466 and parameters: {'kernel': 'sigmoid', 'C': 0.020801096740782857, 'gamma': 0.05350658784441256, 'epsilon': 0.12748949621324415}. Best is trial 345 with value: 0.13438257115663557.
[I 2024-12-03 19:10:11,872] Trial 1697 finished with value: 0.1371221118478543 and parameters: {'kernel': 'linear', 'C': 96.81579414746938, 'gamma': 0.0022877307417178525, 'epsilon': 0.04842478347247944}. Best is trial 345 with value: 0.13438257115663557.
[I 2024-12-03 19:10:12,535] Trial 1643 finished with value: 0.13474490577652878 and parameters: {'kernel': 'linear', 'C': 98.24550755461962, 'gamma': 0.0788438033924199, 'epsilon': 0.031506389870363194}. Best is trial 345 with value: 0.13438257115663557.
[I 2024-12-03 19:10:12,957] Trial 1641 finished with value: 0.1378329180078371 and parameters: {'kernel': 'linear', 'C': 97.71157781508924, 'gamma': 0.0016976758311628068, 'epsilon': 0.01824879834552459}. Best is trial 345 with value: 0.13438257115663557.
[I 2024-12-03 19:10:13,216] Trial 1738 finished with value: 0.444313072591537 and parameters: {'kernel': 'sigmoid', 'C': 2.739953634169331, 'gamma': 0.0004751287293262008, 'epsilon': 0.010813654713541503}. Best is trial 345 with value: 0.13438257115663557.
[I 2024-12-03 19:10:14,730] Trial 1741 finished with value: 0.4568871252548755 and parameters: {'kernel': 'rbf', 'C': 32.016332775087555, 'gamma': 0.037635005201850105, 'epsilon': 0.496009043507987}. Best is trial 345 with value: 0.13438257115663557.
[I 2024-12-03 19:10:16,306] Trial 1720 finished with value: 0.1373031129696601 and parameters: {'kernel': 'linear', 'C': 97.93071499719973, 'gamma': 0.0006047204827410519, 'epsilon': 0.075879171322344}. Best is trial 345 with value: 0.13438257115663557.
[I 2024-12-03 19:10:17,872] Trial 1733 finished with value: 0.13777854733457784 and parameters: {'kernel': 'linear', 'C': 5.786795391926892, 'gamma': 0.03992689925784308, 'epsilon': 0.0010615123753193497}. Best is trial 345 with value: 0.13438257115663557.
[I 2024-12-03 19:10:17,914] Trial 1731 finished with value: 0.13523741307824602 and parameters: {'kernel': 'linear', 'C': 20.252917516008978, 'gamma': 0.040152062523735654, 'epsilon': 0.037915894926272516}. Best is trial 345 with value: 0.13438257115663557.
[I 2024-12-03 19:10:20,034] Trial 1671 finished with value: 0.13546656724921738 and parameters: {'kernel': 'linear', 'C': 99.21397072087154, 'gamma': 0.007233802141359709, 'epsilon': 0.03355689356956434}. Best is trial 345 with value: 0.13438257115663557.
[I 2024-12-03 19:10:23,137] Trial 1727 finished with value: 0.13781662402851289 and parameters: {'kernel': 'linear', 'C': 26.39408431804395, 'gamma': 0.030843428864644702, 'epsilon': 0.01320514312422414}. Best is trial 345 with value: 0.13438257115663557.
[I 2024-12-03 19:10:24,182] Trial 1749 finished with value: 0.9771152271570159 and parameters: {'kernel': 'rbf', 'C': 0.20912815759669723, 'gamma': 0.00043261822126576413, 'epsilon': 0.15527609205309895}. Best is trial 345 with value: 0.13438257115663557.
[I 2024-12-03 19:10:26,010] Trial 1748 finished with value: 0.13718356348215255 and parameters: {'kernel': 'linear', 'C': 5.819252425686996, 'gamma': 0.14676704169656066, 'epsilon': 0.0221502042989487}. Best is trial 345 with value: 0.13438257115663557.
[I 2024-12-03 19:10:28,777] Trial 1740 finished with value: 0.14089992246669722 and parameters: {'kernel': 'linear', 'C': 55.17262031989514, 'gamma': 0.10149818176286982, 'epsilon': 0.09145530083251052}. Best is trial 345 with value: 0.13438257115663557.
[I 2024-12-03 19:10:29,115] Trial 1750 finished with value: 0.1363042466506715 and parameters: {'kernel': 'linear', 'C': 22.94212282075354, 'gamma': 0.18400445582254188, 'epsilon': 0.07333539551129896}. Best is trial 345 with value: 0.13438257115663557.
[I 2024-12-03 19:10:30,720] Trial 1691 finished with value: 0.1360632285883394 and parameters: {'kernel': 'linear', 'C': 96.27669331622327, 'gamma': 0.0020651832348471334, 'epsilon': 0.042087990299014055}. Best is trial 345 with value: 0.13438257115663557.
[I 2024-12-03 19:10:30,851] Trial 1730 finished with value: 0.1380788544747094 and parameters: {'kernel': 'linear', 'C': 94.7325217255289, 'gamma': 0.0033984937607516395, 'epsilon': 0.07908912304273333}. Best is trial 345 with value: 0.13438257115663557.
[I 2024-12-03 19:10:32,146] Trial 1732 finished with value: 0.13819615085416517 and parameters: {'kernel': 'linear', 'C': 23.646189610599418, 'gamma': 0.00347437171575762, 'epsilon': 0.010846168091467524}. Best is trial 345 with value: 0.13438257115663557.
[I 2024-12-03 19:10:32,186] Trial 1754 finished with value: 0.9224326092996273 and parameters: {'kernel': 'rbf', 'C': 0.03466551890806444, 'gamma': 0.006024924971857552, 'epsilon': 0.009990510501801378}. Best is trial 345 with value: 0.13438257115663557.
[I 2024-12-03 19:10:34,486] Trial 1690 finished with value: 0.13563284639214523 and parameters: {'kernel': 'linear', 'C': 95.60052091112401, 'gamma': 0.02652125891064612, 'epsilon': 0.026729793544619327}. Best is trial 345 with value: 0.13438257115663557.
[I 2024-12-03 19:10:37,844] Trial 1742 finished with value: 0.14169349192440783 and parameters: {'kernel': 'linear', 'C': 62.44259891339273, 'gamma': 0.06997468092709089, 'epsilon': 0.11479152999134411}. Best is trial 345 with value: 0.13438257115663557.
[I 2024-12-03 19:10:38,272] Trial 1743 finished with value: 0.14004760253112997 and parameters: {'kernel': 'linear', 'C': 88.00022708173074, 'gamma': 0.03018288119290603, 'epsilon': 0.09801847169522397}. Best is trial 345 with value: 0.13438257115663557.
[I 2024-12-03 19:10:39,445] Trial 1760 finished with value: 0.7743355144888686 and parameters: {'kernel': 'poly', 'C': 0.001228459028765532, 'gamma': 0.02541200853700333, 'epsilon': 0.7304926657278137}. Best is trial 345 with value: 0.13438257115663557.
[I 2024-12-03 19:10:40,892] Trial 1745 finished with value: 0.13496370960402274 and parameters: {'kernel': 'linear', 'C': 33.40727730930748, 'gamma': 0.2728913957454518, 'epsilon': 0.03279517339415138}. Best is trial 345 with value: 0.13438257115663557.
[I 2024-12-03 19:10:43,418] Trial 1712 finished with value: 0.13659821708282063 and parameters: {'kernel': 'linear', 'C': 83.02029981399639, 'gamma': 0.0006390440600498405, 'epsilon': 0.043711196737201995}. Best is trial 345 with value: 0.13438257115663557.
[I 2024-12-03 19:10:43,462] Trial 1698 finished with value: 0.13557629328942578 and parameters: {'kernel': 'linear', 'C': 98.3867078652659, 'gamma': 0.0010202857651412194, 'epsilon': 0.027634296978672878}. Best is trial 345 with value: 0.13438257115663557.
[I 2024-12-03 19:10:44,937] Trial 1763 finished with value: 76.93480653836943 and parameters: {'kernel': 'sigmoid', 'C': 12.061676875009312, 'gamma': 0.010953778228901045, 'epsilon': 0.02486748549166295}. Best is trial 345 with value: 0.13438257115663557.
[I 2024-12-03 19:10:45,417] Trial 1705 finished with value: 0.1352898720973452 and parameters: {'kernel': 'linear', 'C': 97.00367068000294, 'gamma': 0.01386357207640049, 'epsilon': 0.057913025305308195}. Best is trial 345 with value: 0.13438257115663557.
[I 2024-12-03 19:10:48,824] Trial 1758 finished with value: 0.13650358046704106 and parameters: {'kernel': 'linear', 'C': 18.447502164686764, 'gamma': 0.04136837900787454, 'epsilon': 0.04348797313094893}. Best is trial 345 with value: 0.13438257115663557.
[I 2024-12-03 19:10:49,541] Trial 1752 finished with value: 0.13780098737284247 and parameters: {'kernel': 'linear', 'C': 22.17370157547063, 'gamma': 0.02001510259467734, 'epsilon': 0.018497590673638504}. Best is trial 345 with value: 0.13438257115663557.
[I 2024-12-03 19:10:57,588] Trial 1755 finished with value: 0.13497893693436763 and parameters: {'kernel': 'linear', 'C': 25.382642583504005, 'gamma': 0.031165573277044754, 'epsilon': 0.040490853183463175}. Best is trial 345 with value: 0.13438257115663557.
[I 2024-12-03 19:10:58,894] Trial 1769 finished with value: 0.3334657732700868 and parameters: {'kernel': 'sigmoid', 'C': 36.62675322019478, 'gamma': 0.00025652656152564036, 'epsilon': 0.0023881066965950716}. Best is trial 345 with value: 0.13438257115663557.
[I 2024-12-03 19:11:00,822] Trial 1761 finished with value: 0.137837909593554 and parameters: {'kernel': 'linear', 'C': 23.713794253807148, 'gamma': 0.025885502768150395, 'epsilon': 0.02076146054986433}. Best is trial 345 with value: 0.13438257115663557.
[I 2024-12-03 19:11:00,976] Trial 1770 finished with value: 0.20108732168734564 and parameters: {'kernel': 'linear', 'C': 26.19209030160844, 'gamma': 0.013473852215424255, 'epsilon': 0.2572226954421467}. Best is trial 345 with value: 0.13438257115663557.
[I 2024-12-03 19:11:08,634] Trial 1744 finished with value: 0.1350293399753385 and parameters: {'kernel': 'linear', 'C': 61.551056288958584, 'gamma': 0.9746256004093105, 'epsilon': 0.06183709083828863}. Best is trial 345 with value: 0.13438257115663557.
[I 2024-12-03 19:11:09,975] Trial 1717 finished with value: 0.13742202031096243 and parameters: {'kernel': 'linear', 'C': 97.65286601897942, 'gamma': 0.0016655954984329225, 'epsilon': 0.019463570662001727}. Best is trial 345 with value: 0.13438257115663557.
[I 2024-12-03 19:11:11,656] Trial 1764 finished with value: 0.13548390481588657 and parameters: {'kernel': 'linear', 'C': 39.301344520919855, 'gamma': 0.15814540044730518, 'epsilon': 0.05393018292680107}. Best is trial 345 with value: 0.13438257115663557.
[I 2024-12-03 19:11:12,009] Trial 1739 finished with value: 0.13631723594653797 and parameters: {'kernel': 'linear', 'C': 64.07161945187174, 'gamma': 0.01606654658747598, 'epsilon': 0.02376655522352036}. Best is trial 345 with value: 0.13438257115663557.
[I 2024-12-03 19:11:12,238] Trial 1746 finished with value: 0.1383081321081333 and parameters: {'kernel': 'linear', 'C': 51.526686176742565, 'gamma': 0.17078512249500988, 'epsilon': 0.009822153991949181}. Best is trial 345 with value: 0.13438257115663557.
[I 2024-12-03 19:11:13,434] Trial 1776 finished with value: 0.6418256210959756 and parameters: {'kernel': 'rbf', 'C': 8.03291270388188, 'gamma': 0.2593737530554856, 'epsilon': 0.02356480607300811}. Best is trial 345 with value: 0.13438257115663557.
[I 2024-12-03 19:11:14,173] Trial 1768 finished with value: 0.13600905352494588 and parameters: {'kernel': 'linear', 'C': 34.53806849789321, 'gamma': 0.010039903067585112, 'epsilon': 0.06899889101567772}. Best is trial 345 with value: 0.13438257115663557.
[I 2024-12-03 19:11:14,758] Trial 1778 finished with value: 857.9010170696645 and parameters: {'kernel': 'sigmoid', 'C': 54.81682644900849, 'gamma': 0.0950017660220437, 'epsilon': 0.03861163915919004}. Best is trial 345 with value: 0.13438257115663557.
[I 2024-12-03 19:11:16,218] Trial 1549 finished with value: 0.31734495918040395 and parameters: {'kernel': 'poly', 'C': 0.03423708368427834, 'gamma': 0.7567291536842181, 'epsilon': 0.001174111776885076}. Best is trial 345 with value: 0.13438257115663557.
[I 2024-12-03 19:11:18,545] Trial 1753 finished with value: 0.13646500107840412 and parameters: {'kernel': 'linear', 'C': 98.80291854520779, 'gamma': 0.058528529173136695, 'epsilon': 0.05097569637897855}. Best is trial 345 with value: 0.13438257115663557.
[I 2024-12-03 19:11:19,288] Trial 1780 finished with value: 0.1367046467442382 and parameters: {'kernel': 'linear', 'C': 13.35247523391852, 'gamma': 0.014412342445556803, 'epsilon': 0.07619763914187992}. Best is trial 345 with value: 0.13438257115663557.
[I 2024-12-03 19:11:20,250] Trial 1767 finished with value: 0.13811078580906896 and parameters: {'kernel': 'linear', 'C': 24.848023542217263, 'gamma': 0.04971661686432728, 'epsilon': 0.008787299321378892}. Best is trial 345 with value: 0.13438257115663557.
[I 2024-12-03 19:11:21,278] Trial 1762 finished with value: 0.13715342279111564 and parameters: {'kernel': 'linear', 'C': 63.20392586583186, 'gamma': 0.17364093277093282, 'epsilon': 0.048211015100672557}. Best is trial 345 with value: 0.13438257115663557.
[I 2024-12-03 19:11:21,449] Trial 1783 finished with value: 0.29324474279576246 and parameters: {'kernel': 'rbf', 'C': 61.151362126004926, 'gamma': 0.04563568328917013, 'epsilon': 0.023753219240783167}. Best is trial 345 with value: 0.13438257115663557.
[I 2024-12-03 19:11:21,799] Trial 1784 finished with value: 1.358578710065559 and parameters: {'kernel': 'sigmoid', 'C': 0.0032310371695604876, 'gamma': 0.00044529802779552793, 'epsilon': 0.0601032451232879}. Best is trial 345 with value: 0.13438257115663557.
[I 2024-12-03 19:11:23,029] Trial 1773 finished with value: 0.13516702758292576 and parameters: {'kernel': 'linear', 'C': 18.147949577264107, 'gamma': 0.06502805407797914, 'epsilon': 0.05515307819223088}. Best is trial 345 with value: 0.13438257115663557.
[I 2024-12-03 19:11:24,436] Trial 1782 finished with value: 0.34158036330830427 and parameters: {'kernel': 'poly', 'C': 21.279464778515294, 'gamma': 0.0326882578374484, 'epsilon': 0.01611426456768279}. Best is trial 345 with value: 0.13438257115663557.
[I 2024-12-03 19:11:27,477] Trial 1779 finished with value: 0.13554708887502848 and parameters: {'kernel': 'linear', 'C': 16.995128782679824, 'gamma': 0.003278775308085489, 'epsilon': 0.034452516334342126}. Best is trial 345 with value: 0.13438257115663557.
[I 2024-12-03 19:11:28,314] Trial 1790 finished with value: 0.4572429103964053 and parameters: {'kernel': 'linear', 'C': 0.009390488070394745, 'gamma': 0.8922092679821668, 'epsilon': 0.8152903501749265}. Best is trial 345 with value: 0.13438257115663557.
[I 2024-12-03 19:11:30,472] Trial 1699 finished with value: 0.13609390332631016 and parameters: {'kernel': 'linear', 'C': 88.76635040533944, 'gamma': 0.0034845697771465865, 'epsilon': 0.024761394755433916}. Best is trial 345 with value: 0.13438257115663557.
[I 2024-12-03 19:11:31,512] Trial 1775 finished with value: 0.13558935831833874 and parameters: {'kernel': 'linear', 'C': 21.615578465923498, 'gamma': 0.007294109308157994, 'epsilon': 0.02758191194646117}. Best is trial 345 with value: 0.13438257115663557.
