[I 2024-12-04 12:15:22,273] Trial 1580 finished with value: 0.29398654606413854 and parameters: {'n_estimators': 654, 'max_depth': 50, 'min_samples_split': 3, 'min_samples_leaf': 1, 'max_features': 'sqrt', 'bootstrap': False, 'criterion': 'squared_error'}. Best is trial 341 with value: 0.2909369124469028.
[I 2024-12-04 12:15:22,385] Trial 1582 finished with value: 0.2998852506420434 and parameters: {'n_estimators': 480, 'max_depth': 50, 'min_samples_split': 4, 'min_samples_leaf': 1, 'max_features': 'sqrt', 'bootstrap': False, 'criterion': 'squared_error'}. Best is trial 341 with value: 0.2909369124469028.
[I 2024-12-04 12:15:24,175] Trial 1573 finished with value: 0.2985159998280107 and parameters: {'n_estimators': 537, 'max_depth': 45, 'min_samples_split': 3, 'min_samples_leaf': 1, 'max_features': 'sqrt', 'bootstrap': False, 'criterion': 'squared_error'}. Best is trial 341 with value: 0.2909369124469028.
[I 2024-12-04 12:15:25,013] Trial 1575 finished with value: 0.2987939472856464 and parameters: {'n_estimators': 597, 'max_depth': 50, 'min_samples_split': 2, 'min_samples_leaf': 1, 'max_features': 'sqrt', 'bootstrap': False, 'criterion': 'squared_error'}. Best is trial 341 with value: 0.2909369124469028.
[I 2024-12-04 12:15:25,383] Trial 1584 finished with value: 0.307733066817527 and parameters: {'n_estimators': 676, 'max_depth': 43, 'min_samples_split': 4, 'min_samples_leaf': 1, 'max_features': 'sqrt', 'bootstrap': False, 'criterion': 'squared_error'}. Best is trial 341 with value: 0.2909369124469028.
[I 2024-12-04 12:15:25,861] Trial 1590 finished with value: 0.5420146666621913 and parameters: {'n_estimators': 636, 'max_depth': 18, 'min_samples_split': 7, 'min_samples_leaf': 2, 'max_features': 'sqrt', 'bootstrap': False, 'criterion': 'squared_error'}. Best is trial 341 with value: 0.2909369124469028.
[I 2024-12-04 12:15:26,520] Trial 1577 finished with value: 0.3049198893237509 and parameters: {'n_estimators': 450, 'max_depth': 44, 'min_samples_split': 2, 'min_samples_leaf': 1, 'max_features': 'sqrt', 'bootstrap': False, 'criterion': 'squared_error'}. Best is trial 341 with value: 0.2909369124469028.
[I 2024-12-04 12:15:28,820] Trial 1595 finished with value: 0.4403027876396702 and parameters: {'n_estimators': 546, 'max_depth': 50, 'min_samples_split': 4, 'min_samples_leaf': 2, 'max_features': 'sqrt', 'bootstrap': False, 'criterion': 'squared_error'}. Best is trial 341 with value: 0.2909369124469028.
[I 2024-12-04 12:15:29,288] Trial 1581 finished with value: 0.30027381206739373 and parameters: {'n_estimators': 431, 'max_depth': 44, 'min_samples_split': 3, 'min_samples_leaf': 1, 'max_features': 'sqrt', 'bootstrap': False, 'criterion': 'squared_error'}. Best is trial 341 with value: 0.2909369124469028.
[I 2024-12-04 12:15:31,866] Trial 1588 finished with value: 0.4445728908479367 and parameters: {'n_estimators': 692, 'max_depth': 44, 'min_samples_split': 4, 'min_samples_leaf': 2, 'max_features': 'sqrt', 'bootstrap': False, 'criterion': 'squared_error'}. Best is trial 341 with value: 0.2909369124469028.
[I 2024-12-04 12:15:32,350] Trial 1585 finished with value: 0.4456378428617051 and parameters: {'n_estimators': 542, 'max_depth': 38, 'min_samples_split': 6, 'min_samples_leaf': 2, 'max_features': 'sqrt', 'bootstrap': False, 'criterion': 'squared_error'}. Best is trial 341 with value: 0.2909369124469028.
[I 2024-12-04 12:15:32,779] Trial 1598 finished with value: 0.2944672442461747 and parameters: {'n_estimators': 429, 'max_depth': 50, 'min_samples_split': 3, 'min_samples_leaf': 1, 'max_features': 'sqrt', 'bootstrap': False, 'criterion': 'squared_error'}. Best is trial 341 with value: 0.2909369124469028.
[I 2024-12-04 12:15:33,811] Trial 1594 finished with value: 0.3214006618516292 and parameters: {'n_estimators': 576, 'max_depth': 38, 'min_samples_split': 4, 'min_samples_leaf': 1, 'max_features': 'sqrt', 'bootstrap': False, 'criterion': 'squared_error'}. Best is trial 341 with value: 0.2909369124469028.
[I 2024-12-04 12:15:34,028] Trial 1589 finished with value: 0.4414953759972851 and parameters: {'n_estimators': 470, 'max_depth': 19, 'min_samples_split': 7, 'min_samples_leaf': 1, 'max_features': None, 'bootstrap': False, 'criterion': 'squared_error'}. Best is trial 341 with value: 0.2909369124469028.
[I 2024-12-04 12:15:34,268] Trial 1586 finished with value: 0.8507020105182956 and parameters: {'n_estimators': 456, 'max_depth': 10, 'min_samples_split': 3, 'min_samples_leaf': 14, 'max_features': 'sqrt', 'bootstrap': False, 'criterion': 'squared_error'}. Best is trial 341 with value: 0.2909369124469028.
[I 2024-12-04 12:15:34,852] Trial 1592 finished with value: 0.3124811484483805 and parameters: {'n_estimators': 643, 'max_depth': 50, 'min_samples_split': 7, 'min_samples_leaf': 1, 'max_features': 'sqrt', 'bootstrap': False, 'criterion': 'squared_error'}. Best is trial 341 with value: 0.2909369124469028.
[I 2024-12-04 12:15:37,319] Trial 1600 finished with value: 0.4435471421445015 and parameters: {'n_estimators': 433, 'max_depth': 43, 'min_samples_split': 2, 'min_samples_leaf': 2, 'max_features': 'sqrt', 'bootstrap': False, 'criterion': 'squared_error'}. Best is trial 341 with value: 0.2909369124469028.
[I 2024-12-04 12:15:37,882] Trial 1593 finished with value: 0.3005368713127771 and parameters: {'n_estimators': 607, 'max_depth': 50, 'min_samples_split': 4, 'min_samples_leaf': 1, 'max_features': 'sqrt', 'bootstrap': False, 'criterion': 'squared_error'}. Best is trial 341 with value: 0.2909369124469028.
[I 2024-12-04 12:15:37,978] Trial 1587 finished with value: 0.2943140586990195 and parameters: {'n_estimators': 682, 'max_depth': 50, 'min_samples_split': 3, 'min_samples_leaf': 1, 'max_features': 'sqrt', 'bootstrap': False, 'criterion': 'squared_error'}. Best is trial 341 with value: 0.2909369124469028.
[I 2024-12-04 12:15:38,731] Trial 1601 finished with value: 0.9704348778248085 and parameters: {'n_estimators': 522, 'max_depth': 42, 'min_samples_split': 3, 'min_samples_leaf': 15, 'max_features': 'log2', 'bootstrap': True, 'criterion': 'absolute_error'}. Best is trial 341 with value: 0.2909369124469028.
[I 2024-12-04 12:15:39,197] Trial 1596 finished with value: 0.2966268919746952 and parameters: {'n_estimators': 517, 'max_depth': 48, 'min_samples_split': 2, 'min_samples_leaf': 1, 'max_features': 'sqrt', 'bootstrap': False, 'criterion': 'squared_error'}. Best is trial 341 with value: 0.2909369124469028.
[I 2024-12-04 12:15:40,621] Trial 1568 finished with value: 0.3041437743435527 and parameters: {'n_estimators': 675, 'max_depth': 50, 'min_samples_split': 3, 'min_samples_leaf': 1, 'max_features': 'sqrt', 'bootstrap': False, 'criterion': 'absolute_error'}. Best is trial 341 with value: 0.2909369124469028.
[I 2024-12-04 12:15:42,779] Trial 1583 finished with value: 0.38568833330078717 and parameters: {'n_estimators': 823, 'max_depth': 48, 'min_samples_split': 5, 'min_samples_leaf': 1, 'max_features': None, 'bootstrap': False, 'criterion': 'squared_error'}. Best is trial 341 with value: 0.2909369124469028.
[I 2024-12-04 12:15:42,780] Trial 1597 finished with value: 0.44420586618192626 and parameters: {'n_estimators': 527, 'max_depth': 19, 'min_samples_split': 29, 'min_samples_leaf': 7, 'max_features': None, 'bootstrap': False, 'criterion': 'squared_error'}. Best is trial 341 with value: 0.2909369124469028.
[I 2024-12-04 12:15:42,823] Trial 1599 finished with value: 0.32896744803025435 and parameters: {'n_estimators': 632, 'max_depth': 48, 'min_samples_split': 5, 'min_samples_leaf': 1, 'max_features': 'sqrt', 'bootstrap': True, 'criterion': 'squared_error'}. Best is trial 341 with value: 0.2909369124469028.
[I 2024-12-04 12:15:43,616] Trial 1607 finished with value: 0.3141401792678395 and parameters: {'n_estimators': 420, 'max_depth': 41, 'min_samples_split': 4, 'min_samples_leaf': 1, 'max_features': 'sqrt', 'bootstrap': False, 'criterion': 'squared_error'}. Best is trial 341 with value: 0.2909369124469028.
[I 2024-12-04 12:15:44,432] Trial 1604 finished with value: 0.4393223951220612 and parameters: {'n_estimators': 562, 'max_depth': 49, 'min_samples_split': 5, 'min_samples_leaf': 2, 'max_features': 'sqrt', 'bootstrap': False, 'criterion': 'squared_error'}. Best is trial 341 with value: 0.2909369124469028.
[I 2024-12-04 12:15:45,128] Trial 1605 finished with value: 0.4453137456979249 and parameters: {'n_estimators': 423, 'max_depth': 40, 'min_samples_split': 3, 'min_samples_leaf': 2, 'max_features': 'sqrt', 'bootstrap': False, 'criterion': 'squared_error'}. Best is trial 341 with value: 0.2909369124469028.
[I 2024-12-04 12:15:45,857] Trial 1612 finished with value: 0.3182727938499546 and parameters: {'n_estimators': 284, 'max_depth': 43, 'min_samples_split': 6, 'min_samples_leaf': 1, 'max_features': 'sqrt', 'bootstrap': False, 'criterion': 'squared_error'}. Best is trial 341 with value: 0.2909369124469028.
[I 2024-12-04 12:15:46,024] Trial 1602 finished with value: 0.44108547418813215 and parameters: {'n_estimators': 643, 'max_depth': 50, 'min_samples_split': 4, 'min_samples_leaf': 2, 'max_features': 'sqrt', 'bootstrap': False, 'criterion': 'squared_error'}. Best is trial 341 with value: 0.2909369124469028.
[I 2024-12-04 12:15:46,429] Trial 1608 finished with value: 0.3142198302992969 and parameters: {'n_estimators': 779, 'max_depth': 41, 'min_samples_split': 4, 'min_samples_leaf': 1, 'max_features': 'sqrt', 'bootstrap': False, 'criterion': 'squared_error'}. Best is trial 341 with value: 0.2909369124469028.
[I 2024-12-04 12:15:46,511] Trial 1614 finished with value: 0.3906420845170933 and parameters: {'n_estimators': 375, 'max_depth': 47, 'min_samples_split': 3, 'min_samples_leaf': 1, 'max_features': 'log2', 'bootstrap': False, 'criterion': 'squared_error'}. Best is trial 341 with value: 0.2909369124469028.
[I 2024-12-04 12:15:49,890] Trial 1615 finished with value: 0.31904590557467377 and parameters: {'n_estimators': 452, 'max_depth': 45, 'min_samples_split': 7, 'min_samples_leaf': 1, 'max_features': 'sqrt', 'bootstrap': False, 'criterion': 'squared_error'}. Best is trial 341 with value: 0.2909369124469028.
[I 2024-12-04 12:15:51,127] Trial 1610 finished with value: 0.29665377635883267 and parameters: {'n_estimators': 558, 'max_depth': 46, 'min_samples_split': 3, 'min_samples_leaf': 1, 'max_features': 'sqrt', 'bootstrap': False, 'criterion': 'squared_error'}. Best is trial 341 with value: 0.2909369124469028.
[I 2024-12-04 12:15:51,168] Trial 1606 finished with value: 0.38725124441779846 and parameters: {'n_estimators': 387, 'max_depth': 42, 'min_samples_split': 6, 'min_samples_leaf': 1, 'max_features': None, 'bootstrap': False, 'criterion': 'squared_error'}. Best is trial 341 with value: 0.2909369124469028.
[I 2024-12-04 12:15:53,928] Trial 1618 finished with value: 0.29782904197822 and parameters: {'n_estimators': 369, 'max_depth': 50, 'min_samples_split': 2, 'min_samples_leaf': 1, 'max_features': 'sqrt', 'bootstrap': False, 'criterion': 'squared_error'}. Best is trial 341 with value: 0.2909369124469028.
[I 2024-12-04 12:15:58,610] Trial 1613 finished with value: 0.29331821128413194 and parameters: {'n_estimators': 800, 'max_depth': 50, 'min_samples_split': 3, 'min_samples_leaf': 1, 'max_features': 'sqrt', 'bootstrap': False, 'criterion': 'squared_error'}. Best is trial 341 with value: 0.2909369124469028.
[I 2024-12-04 12:16:00,449] Trial 1627 finished with value: 0.44635824014737446 and parameters: {'n_estimators': 271, 'max_depth': 43, 'min_samples_split': 5, 'min_samples_leaf': 2, 'max_features': 'sqrt', 'bootstrap': False, 'criterion': 'squared_error'}. Best is trial 341 with value: 0.2909369124469028.
[I 2024-12-04 12:16:01,078] Trial 1611 finished with value: 0.7697216297784334 and parameters: {'n_estimators': 578, 'max_depth': 7, 'min_samples_split': 2, 'min_samples_leaf': 6, 'max_features': 'sqrt', 'bootstrap': False, 'criterion': 'absolute_error'}. Best is trial 341 with value: 0.2909369124469028.
[I 2024-12-04 12:16:02,027] Trial 1619 finished with value: 0.3029357702051775 and parameters: {'n_estimators': 305, 'max_depth': 42, 'min_samples_split': 3, 'min_samples_leaf': 1, 'max_features': 'sqrt', 'bootstrap': False, 'criterion': 'squared_error'}. Best is trial 341 with value: 0.2909369124469028.
[I 2024-12-04 12:16:02,905] Trial 1623 finished with value: 0.30052228858006563 and parameters: {'n_estimators': 352, 'max_depth': 44, 'min_samples_split': 3, 'min_samples_leaf': 1, 'max_features': 'sqrt', 'bootstrap': False, 'criterion': 'squared_error'}. Best is trial 341 with value: 0.2909369124469028.
[I 2024-12-04 12:16:03,587] Trial 1621 finished with value: 0.2964236438478806 and parameters: {'n_estimators': 564, 'max_depth': 48, 'min_samples_split': 2, 'min_samples_leaf': 1, 'max_features': 'sqrt', 'bootstrap': False, 'criterion': 'squared_error'}. Best is trial 341 with value: 0.2909369124469028.
[I 2024-12-04 12:16:03,630] Trial 1617 finished with value: 0.2995797396469379 and parameters: {'n_estimators': 560, 'max_depth': 44, 'min_samples_split': 3, 'min_samples_leaf': 1, 'max_features': 'sqrt', 'bootstrap': False, 'criterion': 'squared_error'}. Best is trial 341 with value: 0.2909369124469028.
[I 2024-12-04 12:16:04,079] Trial 1622 finished with value: 0.2942142652366252 and parameters: {'n_estimators': 441, 'max_depth': 50, 'min_samples_split': 3, 'min_samples_leaf': 1, 'max_features': 'sqrt', 'bootstrap': False, 'criterion': 'squared_error'}. Best is trial 341 with value: 0.2909369124469028.
[I 2024-12-04 12:16:05,031] Trial 1591 finished with value: 0.38250607423237526 and parameters: {'n_estimators': 749, 'max_depth': 47, 'min_samples_split': 21, 'min_samples_leaf': 1, 'max_features': 'sqrt', 'bootstrap': False, 'criterion': 'absolute_error'}. Best is trial 341 with value: 0.2909369124469028.
[I 2024-12-04 12:16:05,072] Trial 1629 finished with value: 0.33781869208164 and parameters: {'n_estimators': 261, 'max_depth': 33, 'min_samples_split': 3, 'min_samples_leaf': 1, 'max_features': 'sqrt', 'bootstrap': False, 'criterion': 'squared_error'}. Best is trial 341 with value: 0.2909369124469028.
[I 2024-12-04 12:16:05,283] Trial 1625 finished with value: 0.44055464590162846 and parameters: {'n_estimators': 568, 'max_depth': 50, 'min_samples_split': 2, 'min_samples_leaf': 2, 'max_features': 'sqrt', 'bootstrap': False, 'criterion': 'squared_error'}. Best is trial 341 with value: 0.2909369124469028.
[I 2024-12-04 12:16:07,744] Trial 1609 finished with value: 0.45896697780847334 and parameters: {'n_estimators': 678, 'max_depth': 44, 'min_samples_split': 2, 'min_samples_leaf': 2, 'max_features': 'sqrt', 'bootstrap': False, 'criterion': 'absolute_error'}. Best is trial 341 with value: 0.2909369124469028.
[I 2024-12-04 12:16:08,308] Trial 1628 finished with value: 0.95331946699512 and parameters: {'n_estimators': 539, 'max_depth': 9, 'min_samples_split': 38, 'min_samples_leaf': 8, 'max_features': 'log2', 'bootstrap': True, 'criterion': 'squared_error'}. Best is trial 341 with value: 0.2909369124469028.
[I 2024-12-04 12:16:12,527] Trial 1631 finished with value: 0.43925458545339396 and parameters: {'n_estimators': 133, 'max_depth': 35, 'min_samples_split': 20, 'min_samples_leaf': 4, 'max_features': None, 'bootstrap': False, 'criterion': 'absolute_error'}. Best is trial 341 with value: 0.2909369124469028.
[I 2024-12-04 12:16:12,827] Trial 1626 finished with value: 0.31771890029522276 and parameters: {'n_estimators': 573, 'max_depth': 42, 'min_samples_split': 5, 'min_samples_leaf': 1, 'max_features': 'sqrt', 'bootstrap': False, 'criterion': 'squared_error'}. Best is trial 341 with value: 0.2909369124469028.
[I 2024-12-04 12:16:13,180] Trial 1638 finished with value: 0.30646884408718095 and parameters: {'n_estimators': 182, 'max_depth': 42, 'min_samples_split': 2, 'min_samples_leaf': 1, 'max_features': 'sqrt', 'bootstrap': False, 'criterion': 'squared_error'}. Best is trial 341 with value: 0.2909369124469028.
[I 2024-12-04 12:16:13,183] Trial 1637 finished with value: 0.45042470316526084 and parameters: {'n_estimators': 166, 'max_depth': 40, 'min_samples_split': 7, 'min_samples_leaf': 2, 'max_features': 'sqrt', 'bootstrap': False, 'criterion': 'squared_error'}. Best is trial 341 with value: 0.2909369124469028.
[I 2024-12-04 12:16:13,183] Trial 1640 finished with value: 0.3060424986745313 and parameters: {'n_estimators': 207, 'max_depth': 42, 'min_samples_split': 2, 'min_samples_leaf': 1, 'max_features': 'sqrt', 'bootstrap': False, 'criterion': 'squared_error'}. Best is trial 341 with value: 0.2909369124469028.
[I 2024-12-04 12:16:15,144] Trial 1636 finished with value: 0.3129756075096841 and parameters: {'n_estimators': 291, 'max_depth': 45, 'min_samples_split': 5, 'min_samples_leaf': 1, 'max_features': 'sqrt', 'bootstrap': False, 'criterion': 'squared_error'}. Best is trial 341 with value: 0.2909369124469028.
[I 2024-12-04 12:16:15,554] Trial 1632 finished with value: 0.4429957645285686 and parameters: {'n_estimators': 423, 'max_depth': 43, 'min_samples_split': 3, 'min_samples_leaf': 2, 'max_features': 'sqrt', 'bootstrap': False, 'criterion': 'squared_error'}. Best is trial 341 with value: 0.2909369124469028.
[I 2024-12-04 12:16:16,953] Trial 1633 finished with value: 0.2985033753357112 and parameters: {'n_estimators': 612, 'max_depth': 50, 'min_samples_split': 2, 'min_samples_leaf': 1, 'max_features': 'sqrt', 'bootstrap': False, 'criterion': 'squared_error'}. Best is trial 341 with value: 0.2909369124469028.
[I 2024-12-04 12:16:18,172] Trial 1639 finished with value: 0.4406797545358947 and parameters: {'n_estimators': 397, 'max_depth': 49, 'min_samples_split': 3, 'min_samples_leaf': 2, 'max_features': 'sqrt', 'bootstrap': False, 'criterion': 'squared_error'}. Best is trial 341 with value: 0.2909369124469028.
[I 2024-12-04 12:16:18,173] Trial 1635 finished with value: 0.2983454590155714 and parameters: {'n_estimators': 550, 'max_depth': 50, 'min_samples_split': 2, 'min_samples_leaf': 1, 'max_features': 'sqrt', 'bootstrap': False, 'criterion': 'squared_error'}. Best is trial 341 with value: 0.2909369124469028.
[I 2024-12-04 12:16:18,359] Trial 1641 finished with value: 0.3025893463418304 and parameters: {'n_estimators': 317, 'max_depth': 42, 'min_samples_split': 3, 'min_samples_leaf': 1, 'max_features': 'sqrt', 'bootstrap': False, 'criterion': 'squared_error'}. Best is trial 341 with value: 0.2909369124469028.
[I 2024-12-04 12:16:18,587] Trial 1642 finished with value: 0.4437044802763735 and parameters: {'n_estimators': 309, 'max_depth': 50, 'min_samples_split': 2, 'min_samples_leaf': 2, 'max_features': 'sqrt', 'bootstrap': False, 'criterion': 'squared_error'}. Best is trial 341 with value: 0.2909369124469028.
[I 2024-12-04 12:16:19,020] Trial 1624 finished with value: 0.4571772132645958 and parameters: {'n_estimators': 515, 'max_depth': 43, 'min_samples_split': 4, 'min_samples_leaf': 2, 'max_features': 'sqrt', 'bootstrap': False, 'criterion': 'absolute_error'}. Best is trial 341 with value: 0.2909369124469028.
[I 2024-12-04 12:16:19,760] Trial 1630 finished with value: 0.5044917796404506 and parameters: {'n_estimators': 704, 'max_depth': 33, 'min_samples_split': 3, 'min_samples_leaf': 11, 'max_features': None, 'bootstrap': False, 'criterion': 'squared_error'}. Best is trial 341 with value: 0.2909369124469028.
[I 2024-12-04 12:16:20,101] Trial 1643 finished with value: 0.30646147981346855 and parameters: {'n_estimators': 384, 'max_depth': 44, 'min_samples_split': 4, 'min_samples_leaf': 1, 'max_features': 'sqrt', 'bootstrap': False, 'criterion': 'squared_error'}. Best is trial 341 with value: 0.2909369124469028.
[I 2024-12-04 12:16:20,759] Trial 1620 finished with value: 0.316911936977418 and parameters: {'n_estimators': 490, 'max_depth': 42, 'min_samples_split': 2, 'min_samples_leaf': 1, 'max_features': 'sqrt', 'bootstrap': False, 'criterion': 'absolute_error'}. Best is trial 341 with value: 0.2909369124469028.
[I 2024-12-04 12:16:21,209] Trial 1647 finished with value: 0.44592902203547896 and parameters: {'n_estimators': 278, 'max_depth': 41, 'min_samples_split': 2, 'min_samples_leaf': 2, 'max_features': 'sqrt', 'bootstrap': False, 'criterion': 'squared_error'}. Best is trial 341 with value: 0.2909369124469028.
[I 2024-12-04 12:16:21,705] Trial 1645 finished with value: 0.30466519728508795 and parameters: {'n_estimators': 503, 'max_depth': 41, 'min_samples_split': 3, 'min_samples_leaf': 1, 'max_features': 'sqrt', 'bootstrap': False, 'criterion': 'squared_error'}. Best is trial 341 with value: 0.2909369124469028.
[I 2024-12-04 12:16:22,556] Trial 1650 finished with value: 0.30611055176871665 and parameters: {'n_estimators': 473, 'max_depth': 50, 'min_samples_split': 6, 'min_samples_leaf': 1, 'max_features': 'sqrt', 'bootstrap': False, 'criterion': 'squared_error'}. Best is trial 341 with value: 0.2909369124469028.
[I 2024-12-04 12:16:22,557] Trial 1646 finished with value: 0.44232216142899744 and parameters: {'n_estimators': 288, 'max_depth': 50, 'min_samples_split': 7, 'min_samples_leaf': 2, 'max_features': 'sqrt', 'bootstrap': False, 'criterion': 'squared_error'}. Best is trial 341 with value: 0.2909369124469028.
[I 2024-12-04 12:16:24,568] Trial 1655 finished with value: 0.30699887340443427 and parameters: {'n_estimators': 263, 'max_depth': 44, 'min_samples_split': 4, 'min_samples_leaf': 1, 'max_features': 'sqrt', 'bootstrap': False, 'criterion': 'squared_error'}. Best is trial 341 with value: 0.2909369124469028.
[I 2024-12-04 12:16:25,265] Trial 1651 finished with value: 0.31212523175046475 and parameters: {'n_estimators': 505, 'max_depth': 44, 'min_samples_split': 5, 'min_samples_leaf': 1, 'max_features': 'sqrt', 'bootstrap': False, 'criterion': 'squared_error'}. Best is trial 341 with value: 0.2909369124469028.
