[I 2024-12-04 12:21:04,508] Trial 1801 finished with value: 0.5131473144575561 and parameters: {'n_estimators': 101, 'max_depth': 26, 'min_samples_split': 4, 'min_samples_leaf': 1, 'max_features': None, 'bootstrap': True, 'criterion': 'absolute_error'}. Best is trial 1749 with value: 0.502720715661024.
[I 2024-12-04 12:21:05,127] Trial 1792 finished with value: 0.5167365569124996 and parameters: {'n_estimators': 249, 'max_depth': 14, 'min_samples_split': 6, 'min_samples_leaf': 1, 'max_features': None, 'bootstrap': True, 'criterion': 'absolute_error'}. Best is trial 1749 with value: 0.502720715661024.
[I 2024-12-04 12:21:05,916] Trial 1805 finished with value: 0.6484412370829289 and parameters: {'n_estimators': 642, 'max_depth': 30, 'min_samples_split': 14, 'min_samples_leaf': 10, 'max_features': None, 'bootstrap': False, 'criterion': 'squared_error'}. Best is trial 1749 with value: 0.502720715661024.
[I 2024-12-04 12:21:06,725] Trial 1799 finished with value: 0.5581640844649322 and parameters: {'n_estimators': 252, 'max_depth': 19, 'min_samples_split': 4, 'min_samples_leaf': 2, 'max_features': None, 'bootstrap': True, 'criterion': 'absolute_error'}. Best is trial 1749 with value: 0.502720715661024.
[I 2024-12-04 12:21:06,833] Trial 1797 finished with value: 0.5588914254807812 and parameters: {'n_estimators': 277, 'max_depth': 17, 'min_samples_split': 3, 'min_samples_leaf': 2, 'max_features': None, 'bootstrap': True, 'criterion': 'absolute_error'}. Best is trial 1749 with value: 0.502720715661024.
[I 2024-12-04 12:21:07,655] Trial 1808 finished with value: 0.5105596616638134 and parameters: {'n_estimators': 103, 'max_depth': 13, 'min_samples_split': 4, 'min_samples_leaf': 1, 'max_features': None, 'bootstrap': True, 'criterion': 'absolute_error'}. Best is trial 1749 with value: 0.502720715661024.
[I 2024-12-04 12:21:08,680] Trial 1812 finished with value: 0.5307988018629131 and parameters: {'n_estimators': 101, 'max_depth': 7, 'min_samples_split': 2, 'min_samples_leaf': 1, 'max_features': None, 'bootstrap': True, 'criterion': 'absolute_error'}. Best is trial 1749 with value: 0.502720715661024.
[I 2024-12-04 12:21:08,817] Trial 1796 finished with value: 0.5165915955493531 and parameters: {'n_estimators': 272, 'max_depth': 19, 'min_samples_split': 6, 'min_samples_leaf': 1, 'max_features': None, 'bootstrap': True, 'criterion': 'absolute_error'}. Best is trial 1749 with value: 0.502720715661024.
[I 2024-12-04 12:21:10,157] Trial 1794 finished with value: 0.5206993666689916 and parameters: {'n_estimators': 257, 'max_depth': 27, 'min_samples_split': 5, 'min_samples_leaf': 1, 'max_features': None, 'bootstrap': True, 'criterion': 'absolute_error'}. Best is trial 1749 with value: 0.502720715661024.
[I 2024-12-04 12:21:10,536] Trial 1814 finished with value: 0.5524868821068637 and parameters: {'n_estimators': 102, 'max_depth': 8, 'min_samples_split': 3, 'min_samples_leaf': 2, 'max_features': None, 'bootstrap': True, 'criterion': 'absolute_error'}. Best is trial 1749 with value: 0.502720715661024.
[I 2024-12-04 12:21:14,214] Trial 1811 finished with value: 1.0181627328844345 and parameters: {'n_estimators': 176, 'max_depth': 20, 'min_samples_split': 9, 'min_samples_leaf': 1, 'max_features': 'log2', 'bootstrap': False, 'criterion': 'absolute_error'}. Best is trial 1749 with value: 0.502720715661024.
[I 2024-12-04 12:21:14,462] Trial 1817 finished with value: 0.5135487273292441 and parameters: {'n_estimators': 100, 'max_depth': 19, 'min_samples_split': 2, 'min_samples_leaf': 1, 'max_features': None, 'bootstrap': True, 'criterion': 'absolute_error'}. Best is trial 1749 with value: 0.502720715661024.
[I 2024-12-04 12:21:17,300] Trial 1820 finished with value: 0.5163230849756595 and parameters: {'n_estimators': 108, 'max_depth': 18, 'min_samples_split': 3, 'min_samples_leaf': 1, 'max_features': None, 'bootstrap': True, 'criterion': 'absolute_error'}. Best is trial 1749 with value: 0.502720715661024.
[I 2024-12-04 12:21:17,308] Trial 1818 finished with value: 0.5582226226837664 and parameters: {'n_estimators': 120, 'max_depth': 26, 'min_samples_split': 6, 'min_samples_leaf': 2, 'max_features': None, 'bootstrap': True, 'criterion': 'absolute_error'}. Best is trial 1749 with value: 0.502720715661024.
[I 2024-12-04 12:21:18,927] Trial 1823 finished with value: 0.551366175858482 and parameters: {'n_estimators': 319, 'max_depth': 31, 'min_samples_split': 6, 'min_samples_leaf': 2, 'max_features': None, 'bootstrap': True, 'criterion': 'squared_error'}. Best is trial 1749 with value: 0.502720715661024.
[I 2024-12-04 12:21:18,927] Trial 1819 finished with value: 0.5556076385110483 and parameters: {'n_estimators': 111, 'max_depth': 18, 'min_samples_split': 4, 'min_samples_leaf': 2, 'max_features': None, 'bootstrap': True, 'criterion': 'absolute_error'}. Best is trial 1749 with value: 0.502720715661024.
[I 2024-12-04 12:21:19,400] Trial 1822 finished with value: 0.5128459370847996 and parameters: {'n_estimators': 105, 'max_depth': 20, 'min_samples_split': 6, 'min_samples_leaf': 1, 'max_features': None, 'bootstrap': True, 'criterion': 'absolute_error'}. Best is trial 1749 with value: 0.502720715661024.
[I 2024-12-04 12:21:22,325] Trial 1816 finished with value: 0.5195634752404085 and parameters: {'n_estimators': 233, 'max_depth': 17, 'min_samples_split': 2, 'min_samples_leaf': 1, 'max_features': None, 'bootstrap': True, 'criterion': 'absolute_error'}. Best is trial 1749 with value: 0.502720715661024.
[I 2024-12-04 12:21:23,124] Trial 1826 finished with value: 0.5232748267872137 and parameters: {'n_estimators': 103, 'max_depth': 20, 'min_samples_split': 7, 'min_samples_leaf': 1, 'max_features': None, 'bootstrap': True, 'criterion': 'absolute_error'}. Best is trial 1749 with value: 0.502720715661024.
[I 2024-12-04 12:21:23,477] Trial 1825 finished with value: 0.7964981821156897 and parameters: {'n_estimators': 272, 'max_depth': 20, 'min_samples_split': 4, 'min_samples_leaf': 1, 'max_features': 'sqrt', 'bootstrap': True, 'criterion': 'absolute_error'}. Best is trial 1749 with value: 0.502720715661024.
[I 2024-12-04 12:21:23,995] Trial 1815 finished with value: 0.7367998305646348 and parameters: {'n_estimators': 625, 'max_depth': 22, 'min_samples_split': 2, 'min_samples_leaf': 1, 'max_features': 'sqrt', 'bootstrap': True, 'criterion': 'absolute_error'}. Best is trial 1749 with value: 0.502720715661024.
[I 2024-12-04 12:21:25,043] Trial 1821 finished with value: 0.5156609376565285 and parameters: {'n_estimators': 104, 'max_depth': 24, 'min_samples_split': 6, 'min_samples_leaf': 1, 'max_features': None, 'bootstrap': True, 'criterion': 'absolute_error'}. Best is trial 1749 with value: 0.502720715661024.
[I 2024-12-04 12:21:26,290] Trial 1834 finished with value: 0.5310738311529257 and parameters: {'n_estimators': 240, 'max_depth': 10, 'min_samples_split': 7, 'min_samples_leaf': 1, 'max_features': None, 'bootstrap': True, 'criterion': 'squared_error'}. Best is trial 1749 with value: 0.502720715661024.
[I 2024-12-04 12:21:27,638] Trial 1838 finished with value: 1.045173294268096 and parameters: {'n_estimators': 105, 'max_depth': 19, 'min_samples_split': 5, 'min_samples_leaf': 1, 'max_features': 'log2', 'bootstrap': True, 'criterion': 'absolute_error'}. Best is trial 1749 with value: 0.502720715661024.
[I 2024-12-04 12:21:27,652] Trial 1806 finished with value: 0.5191505843119343 and parameters: {'n_estimators': 306, 'max_depth': 22, 'min_samples_split': 4, 'min_samples_leaf': 1, 'max_features': None, 'bootstrap': True, 'criterion': 'absolute_error'}. Best is trial 1749 with value: 0.502720715661024.
[I 2024-12-04 12:21:29,925] Trial 1807 finished with value: 0.5283466210855635 and parameters: {'n_estimators': 448, 'max_depth': 7, 'min_samples_split': 5, 'min_samples_leaf': 1, 'max_features': None, 'bootstrap': True, 'criterion': 'absolute_error'}. Best is trial 1749 with value: 0.502720715661024.
[I 2024-12-04 12:21:30,239] Trial 1828 finished with value: 0.5047771565906473 and parameters: {'n_estimators': 100, 'max_depth': 18, 'min_samples_split': 4, 'min_samples_leaf': 1, 'max_features': None, 'bootstrap': True, 'criterion': 'absolute_error'}. Best is trial 1749 with value: 0.502720715661024.
[I 2024-12-04 12:21:31,703] Trial 1813 finished with value: 0.5144650741308816 and parameters: {'n_estimators': 273, 'max_depth': 18, 'min_samples_split': 3, 'min_samples_leaf': 1, 'max_features': None, 'bootstrap': True, 'criterion': 'absolute_error'}. Best is trial 1749 with value: 0.502720715661024.
[I 2024-12-04 12:21:34,336] Trial 1829 finished with value: 0.5101722944451027 and parameters: {'n_estimators': 111, 'max_depth': 15, 'min_samples_split': 5, 'min_samples_leaf': 1, 'max_features': None, 'bootstrap': True, 'criterion': 'absolute_error'}. Best is trial 1749 with value: 0.502720715661024.
[I 2024-12-04 12:21:38,234] Trial 1835 finished with value: 0.510272341819282 and parameters: {'n_estimators': 107, 'max_depth': 16, 'min_samples_split': 5, 'min_samples_leaf': 1, 'max_features': None, 'bootstrap': True, 'criterion': 'absolute_error'}. Best is trial 1749 with value: 0.502720715661024.
[I 2024-12-04 12:21:38,546] Trial 1827 finished with value: 0.5187532734746148 and parameters: {'n_estimators': 249, 'max_depth': 17, 'min_samples_split': 6, 'min_samples_leaf': 1, 'max_features': None, 'bootstrap': True, 'criterion': 'absolute_error'}. Best is trial 1749 with value: 0.502720715661024.
[I 2024-12-04 12:21:38,851] Trial 1836 finished with value: 0.5186790706548097 and parameters: {'n_estimators': 102, 'max_depth': 20, 'min_samples_split': 3, 'min_samples_leaf': 1, 'max_features': None, 'bootstrap': True, 'criterion': 'absolute_error'}. Best is trial 1749 with value: 0.502720715661024.
[I 2024-12-04 12:21:38,884] Trial 1847 finished with value: 1.353896854593556 and parameters: {'n_estimators': 986, 'max_depth': 44, 'min_samples_split': 7, 'min_samples_leaf': 14, 'max_features': 'log2', 'bootstrap': False, 'criterion': 'absolute_error'}. Best is trial 1749 with value: 0.502720715661024.
[I 2024-12-04 12:21:39,664] Trial 1832 finished with value: 0.559095264105374 and parameters: {'n_estimators': 286, 'max_depth': 28, 'min_samples_split': 3, 'min_samples_leaf': 2, 'max_features': None, 'bootstrap': True, 'criterion': 'absolute_error'}. Best is trial 1749 with value: 0.502720715661024.
[I 2024-12-04 12:21:40,405] Trial 1840 finished with value: 0.5122776361129882 and parameters: {'n_estimators': 105, 'max_depth': 29, 'min_samples_split': 4, 'min_samples_leaf': 1, 'max_features': None, 'bootstrap': True, 'criterion': 'absolute_error'}. Best is trial 1749 with value: 0.502720715661024.
[I 2024-12-04 12:21:40,510] Trial 1842 finished with value: 1.213968773844114 and parameters: {'n_estimators': 575, 'max_depth': 8, 'min_samples_split': 6, 'min_samples_leaf': 1, 'max_features': 'log2', 'bootstrap': False, 'criterion': 'absolute_error'}. Best is trial 1749 with value: 0.502720715661024.
[I 2024-12-04 12:21:41,103] Trial 1839 finished with value: 0.5136711344418808 and parameters: {'n_estimators': 100, 'max_depth': 16, 'min_samples_split': 3, 'min_samples_leaf': 1, 'max_features': None, 'bootstrap': True, 'criterion': 'absolute_error'}. Best is trial 1749 with value: 0.502720715661024.
[I 2024-12-04 12:21:41,216] Trial 1824 finished with value: 0.5140930639844294 and parameters: {'n_estimators': 255, 'max_depth': 18, 'min_samples_split': 4, 'min_samples_leaf': 1, 'max_features': None, 'bootstrap': True, 'criterion': 'absolute_error'}. Best is trial 1749 with value: 0.502720715661024.
[I 2024-12-04 12:21:41,722] Trial 1837 finished with value: 1.3266335135645673 and parameters: {'n_estimators': 672, 'max_depth': 28, 'min_samples_split': 24, 'min_samples_leaf': 9, 'max_features': 'sqrt', 'bootstrap': True, 'criterion': 'absolute_error'}. Best is trial 1749 with value: 0.502720715661024.
[I 2024-12-04 12:21:41,929] Trial 1831 finished with value: 0.5383805808317675 and parameters: {'n_estimators': 251, 'max_depth': 7, 'min_samples_split': 7, 'min_samples_leaf': 1, 'max_features': None, 'bootstrap': False, 'criterion': 'absolute_error'}. Best is trial 1749 with value: 0.502720715661024.
[I 2024-12-04 12:21:43,325] Trial 1830 finished with value: 0.5175691987400247 and parameters: {'n_estimators': 250, 'max_depth': 21, 'min_samples_split': 5, 'min_samples_leaf': 1, 'max_features': None, 'bootstrap': True, 'criterion': 'absolute_error'}. Best is trial 1749 with value: 0.502720715661024.
[I 2024-12-04 12:21:44,028] Trial 1848 finished with value: 0.5509775324091074 and parameters: {'n_estimators': 348, 'max_depth': 50, 'min_samples_split': 5, 'min_samples_leaf': 3, 'max_features': None, 'bootstrap': True, 'criterion': 'squared_error'}. Best is trial 1749 with value: 0.502720715661024.
[I 2024-12-04 12:21:44,091] Trial 1843 finished with value: 0.506068614609914 and parameters: {'n_estimators': 107, 'max_depth': 19, 'min_samples_split': 4, 'min_samples_leaf': 1, 'max_features': None, 'bootstrap': True, 'criterion': 'absolute_error'}. Best is trial 1749 with value: 0.502720715661024.
[I 2024-12-04 12:21:44,105] Trial 1849 finished with value: 0.5533749249861893 and parameters: {'n_estimators': 116, 'max_depth': 15, 'min_samples_split': 4, 'min_samples_leaf': 2, 'max_features': None, 'bootstrap': True, 'criterion': 'absolute_error'}. Best is trial 1749 with value: 0.502720715661024.
[I 2024-12-04 12:21:45,300] Trial 1833 finished with value: 0.5277954854166763 and parameters: {'n_estimators': 250, 'max_depth': 8, 'min_samples_split': 6, 'min_samples_leaf': 1, 'max_features': None, 'bootstrap': True, 'criterion': 'absolute_error'}. Best is trial 1749 with value: 0.502720715661024.
[I 2024-12-04 12:21:45,803] Trial 1844 finished with value: 0.5537920319568388 and parameters: {'n_estimators': 106, 'max_depth': 22, 'min_samples_split': 4, 'min_samples_leaf': 2, 'max_features': None, 'bootstrap': True, 'criterion': 'absolute_error'}. Best is trial 1749 with value: 0.502720715661024.
[I 2024-12-04 12:21:45,804] Trial 1851 finished with value: 0.5559103718484498 and parameters: {'n_estimators': 104, 'max_depth': 14, 'min_samples_split': 5, 'min_samples_leaf': 2, 'max_features': None, 'bootstrap': True, 'criterion': 'absolute_error'}. Best is trial 1749 with value: 0.502720715661024.
[I 2024-12-04 12:21:49,958] Trial 1852 finished with value: 0.5142199421747577 and parameters: {'n_estimators': 101, 'max_depth': 17, 'min_samples_split': 3, 'min_samples_leaf': 1, 'max_features': None, 'bootstrap': True, 'criterion': 'absolute_error'}. Best is trial 1749 with value: 0.502720715661024.
[I 2024-12-04 12:21:50,991] Trial 1841 finished with value: 0.5539467163075242 and parameters: {'n_estimators': 352, 'max_depth': 33, 'min_samples_split': 10, 'min_samples_leaf': 2, 'max_features': None, 'bootstrap': True, 'criterion': 'absolute_error'}. Best is trial 1749 with value: 0.502720715661024.
[I 2024-12-04 12:21:51,631] Trial 1846 finished with value: 0.5101003693123464 and parameters: {'n_estimators': 108, 'max_depth': 13, 'min_samples_split': 4, 'min_samples_leaf': 1, 'max_features': None, 'bootstrap': True, 'criterion': 'absolute_error'}. Best is trial 1749 with value: 0.502720715661024.
[I 2024-12-04 12:21:51,693] Trial 1857 finished with value: 0.5086782176110866 and parameters: {'n_estimators': 101, 'max_depth': 13, 'min_samples_split': 4, 'min_samples_leaf': 1, 'max_features': None, 'bootstrap': True, 'criterion': 'absolute_error'}. Best is trial 1749 with value: 0.502720715661024.
[I 2024-12-04 12:21:54,787] Trial 1859 finished with value: 1.1151885429716966 and parameters: {'n_estimators': 274, 'max_depth': 14, 'min_samples_split': 2, 'min_samples_leaf': 1, 'max_features': 'log2', 'bootstrap': True, 'criterion': 'absolute_error'}. Best is trial 1749 with value: 0.502720715661024.
[I 2024-12-04 12:21:57,905] Trial 1858 finished with value: 0.5579144911162235 and parameters: {'n_estimators': 105, 'max_depth': 14, 'min_samples_split': 2, 'min_samples_leaf': 2, 'max_features': None, 'bootstrap': True, 'criterion': 'absolute_error'}. Best is trial 1749 with value: 0.502720715661024.
[I 2024-12-04 12:22:01,248] Trial 1864 finished with value: 0.5145638430575739 and parameters: {'n_estimators': 101, 'max_depth': 28, 'min_samples_split': 3, 'min_samples_leaf': 1, 'max_features': None, 'bootstrap': True, 'criterion': 'absolute_error'}. Best is trial 1749 with value: 0.502720715661024.
[I 2024-12-04 12:22:02,259] Trial 1855 finished with value: 0.5122163378906135 and parameters: {'n_estimators': 111, 'max_depth': 25, 'min_samples_split': 4, 'min_samples_leaf': 1, 'max_features': None, 'bootstrap': True, 'criterion': 'absolute_error'}. Best is trial 1749 with value: 0.502720715661024.
[I 2024-12-04 12:22:02,546] Trial 1856 finished with value: 0.5567251252855423 and parameters: {'n_estimators': 218, 'max_depth': 24, 'min_samples_split': 2, 'min_samples_leaf': 2, 'max_features': None, 'bootstrap': True, 'criterion': 'absolute_error'}. Best is trial 1749 with value: 0.502720715661024.
[I 2024-12-04 12:22:02,866] Trial 1850 finished with value: 0.5119982992391989 and parameters: {'n_estimators': 287, 'max_depth': 13, 'min_samples_split': 3, 'min_samples_leaf': 1, 'max_features': None, 'bootstrap': True, 'criterion': 'absolute_error'}. Best is trial 1749 with value: 0.502720715661024.
[I 2024-12-04 12:22:04,572] Trial 1853 finished with value: 0.520952766637141 and parameters: {'n_estimators': 241, 'max_depth': 22, 'min_samples_split': 3, 'min_samples_leaf': 1, 'max_features': None, 'bootstrap': True, 'criterion': 'absolute_error'}. Best is trial 1749 with value: 0.502720715661024.
[I 2024-12-04 12:22:05,097] Trial 1845 finished with value: 0.5152141986987864 and parameters: {'n_estimators': 286, 'max_depth': 14, 'min_samples_split': 4, 'min_samples_leaf': 1, 'max_features': None, 'bootstrap': True, 'criterion': 'absolute_error'}. Best is trial 1749 with value: 0.502720715661024.
[I 2024-12-04 12:22:05,319] Trial 1810 finished with value: 0.5335598684492001 and parameters: {'n_estimators': 636, 'max_depth': 20, 'min_samples_split': 9, 'min_samples_leaf': 1, 'max_features': None, 'bootstrap': False, 'criterion': 'absolute_error'}. Best is trial 1749 with value: 0.502720715661024.
[I 2024-12-04 12:22:05,415] Trial 1854 finished with value: 0.5201182729678937 and parameters: {'n_estimators': 244, 'max_depth': 21, 'min_samples_split': 3, 'min_samples_leaf': 1, 'max_features': None, 'bootstrap': True, 'criterion': 'absolute_error'}. Best is trial 1749 with value: 0.502720715661024.
[I 2024-12-04 12:22:08,975] Trial 1860 finished with value: 0.5232255473352415 and parameters: {'n_estimators': 118, 'max_depth': 24, 'min_samples_split': 2, 'min_samples_leaf': 1, 'max_features': None, 'bootstrap': True, 'criterion': 'absolute_error'}. Best is trial 1749 with value: 0.502720715661024.
[I 2024-12-04 12:22:11,363] Trial 1862 finished with value: 0.517310689922272 and parameters: {'n_estimators': 265, 'max_depth': 23, 'min_samples_split': 4, 'min_samples_leaf': 1, 'max_features': None, 'bootstrap': True, 'criterion': 'absolute_error'}. Best is trial 1749 with value: 0.502720715661024.
[I 2024-12-04 12:22:11,364] Trial 1872 finished with value: 0.5138975790880402 and parameters: {'n_estimators': 110, 'max_depth': 26, 'min_samples_split': 5, 'min_samples_leaf': 1, 'max_features': None, 'bootstrap': True, 'criterion': 'absolute_error'}. Best is trial 1749 with value: 0.502720715661024.
[I 2024-12-04 12:22:11,375] Trial 1882 finished with value: 1.106646404600322 and parameters: {'n_estimators': 100, 'max_depth': 16, 'min_samples_split': 4, 'min_samples_leaf': 1, 'max_features': 'log2', 'bootstrap': True, 'criterion': 'absolute_error'}. Best is trial 1749 with value: 0.502720715661024.
[I 2024-12-04 12:22:11,564] Trial 1873 finished with value: 0.5615111381464536 and parameters: {'n_estimators': 119, 'max_depth': 26, 'min_samples_split': 9, 'min_samples_leaf': 2, 'max_features': None, 'bootstrap': True, 'criterion': 'absolute_error'}. Best is trial 1749 with value: 0.502720715661024.
[I 2024-12-04 12:22:11,655] Trial 1868 finished with value: 0.8872167951349641 and parameters: {'n_estimators': 493, 'max_depth': 25, 'min_samples_split': 3, 'min_samples_leaf': 1, 'max_features': 'log2', 'bootstrap': False, 'criterion': 'absolute_error'}. Best is trial 1749 with value: 0.502720715661024.
[I 2024-12-04 12:22:11,773] Trial 1866 finished with value: 0.5859246367782392 and parameters: {'n_estimators': 356, 'max_depth': 49, 'min_samples_split': 5, 'min_samples_leaf': 1, 'max_features': 'sqrt', 'bootstrap': False, 'criterion': 'absolute_error'}. Best is trial 1749 with value: 0.502720715661024.
[I 2024-12-04 12:22:12,445] Trial 1871 finished with value: 0.5887058271185084 and parameters: {'n_estimators': 370, 'max_depth': 50, 'min_samples_split': 15, 'min_samples_leaf': 4, 'max_features': None, 'bootstrap': True, 'criterion': 'absolute_error'}. Best is trial 1749 with value: 0.502720715661024.
[I 2024-12-04 12:22:14,212] Trial 1863 finished with value: 0.5189221944993122 and parameters: {'n_estimators': 247, 'max_depth': 15, 'min_samples_split': 2, 'min_samples_leaf': 1, 'max_features': None, 'bootstrap': True, 'criterion': 'absolute_error'}. Best is trial 1749 with value: 0.502720715661024.
[I 2024-12-04 12:22:14,222] Trial 1870 finished with value: 0.5181046662455945 and parameters: {'n_estimators': 124, 'max_depth': 21, 'min_samples_split': 3, 'min_samples_leaf': 1, 'max_features': None, 'bootstrap': True, 'criterion': 'absolute_error'}. Best is trial 1749 with value: 0.502720715661024.
[I 2024-12-04 12:22:14,548] Trial 1875 finished with value: 0.5101798245935135 and parameters: {'n_estimators': 105, 'max_depth': 20, 'min_samples_split': 4, 'min_samples_leaf': 1, 'max_features': None, 'bootstrap': True, 'criterion': 'absolute_error'}. Best is trial 1749 with value: 0.502720715661024.
