[I 2024-12-04 12:01:07,199] Trial 1545 finished with value: 0.8101385948198155 and parameters: {'max_depth': 29, 'min_samples_split': 2, 'min_samples_leaf': 3, 'max_features': 'sqrt', 'criterion': 'squared_error', 'splitter': 'best'}. Best is trial 838 with value: 0.5900375110830633.
[I 2024-12-04 12:01:07,635] Trial 1553 finished with value: 0.8209492412990053 and parameters: {'max_depth': 30, 'min_samples_split': 7, 'min_samples_leaf': 2, 'max_features': 'sqrt', 'criterion': 'squared_error', 'splitter': 'best'}. Best is trial 838 with value: 0.5900375110830633.
[I 2024-12-04 12:01:07,900] Trial 1550 finished with value: 0.8101385948198155 and parameters: {'max_depth': 30, 'min_samples_split': 5, 'min_samples_leaf': 3, 'max_features': 'sqrt', 'criterion': 'squared_error', 'splitter': 'best'}. Best is trial 838 with value: 0.5900375110830633.
[I 2024-12-04 12:01:08,134] Trial 1551 finished with value: 0.8026800003976337 and parameters: {'max_depth': 18, 'min_samples_split': 8, 'min_samples_leaf': 1, 'max_features': 'sqrt', 'criterion': 'squared_error', 'splitter': 'best'}. Best is trial 838 with value: 0.5900375110830633.
[I 2024-12-04 12:01:08,137] Trial 1552 finished with value: 0.7030091902207406 and parameters: {'max_depth': 35, 'min_samples_split': 7, 'min_samples_leaf': 1, 'max_features': 'sqrt', 'criterion': 'squared_error', 'splitter': 'best'}. Best is trial 838 with value: 0.5900375110830633.
[I 2024-12-04 12:01:08,168] Trial 1542 finished with value: 0.6361563548204678 and parameters: {'max_depth': 30, 'min_samples_split': 4, 'min_samples_leaf': 1, 'max_features': 'sqrt', 'criterion': 'squared_error', 'splitter': 'best'}. Best is trial 838 with value: 0.5900375110830633.
[I 2024-12-04 12:01:08,329] Trial 1543 finished with value: 1.0816149376799358 and parameters: {'max_depth': 16, 'min_samples_split': 8, 'min_samples_leaf': 8, 'max_features': 'sqrt', 'criterion': 'squared_error', 'splitter': 'random'}. Best is trial 838 with value: 0.5900375110830633.
[I 2024-12-04 12:01:08,419] Trial 1548 finished with value: 0.6548912683909761 and parameters: {'max_depth': 29, 'min_samples_split': 5, 'min_samples_leaf': 1, 'max_features': 'sqrt', 'criterion': 'squared_error', 'splitter': 'best'}. Best is trial 838 with value: 0.5900375110830633.
[I 2024-12-04 12:01:08,657] Trial 1557 finished with value: 0.8948705414188449 and parameters: {'max_depth': 31, 'min_samples_split': 4, 'min_samples_leaf': 3, 'max_features': 'sqrt', 'criterion': 'squared_error', 'splitter': 'random'}. Best is trial 838 with value: 0.5900375110830633.
[I 2024-12-04 12:01:09,901] Trial 1547 finished with value: 0.6361563548204678 and parameters: {'max_depth': 30, 'min_samples_split': 4, 'min_samples_leaf': 1, 'max_features': 'sqrt', 'criterion': 'squared_error', 'splitter': 'best'}. Best is trial 838 with value: 0.5900375110830633.
[I 2024-12-04 12:01:10,466] Trial 1544 finished with value: 0.713722108439527 and parameters: {'max_depth': 35, 'min_samples_split': 3, 'min_samples_leaf': 1, 'max_features': 'sqrt', 'criterion': 'squared_error', 'splitter': 'best'}. Best is trial 838 with value: 0.5900375110830633.
[I 2024-12-04 12:01:11,272] Trial 1534 finished with value: 1.075383350593605 and parameters: {'max_depth': 3, 'min_samples_split': 11, 'min_samples_leaf': 5, 'max_features': 'sqrt', 'criterion': 'absolute_error', 'splitter': 'random'}. Best is trial 838 with value: 0.5900375110830633.
[I 2024-12-04 12:01:11,354] Trial 1558 finished with value: 0.7987748637010382 and parameters: {'max_depth': 35, 'min_samples_split': 7, 'min_samples_leaf': 3, 'max_features': 'sqrt', 'criterion': 'squared_error', 'splitter': 'best'}. Best is trial 838 with value: 0.5900375110830633.
[I 2024-12-04 12:01:11,461] Trial 1556 finished with value: 0.9866115321868226 and parameters: {'max_depth': 34, 'min_samples_split': 3, 'min_samples_leaf': 1, 'max_features': 'log2', 'criterion': 'friedman_mse', 'splitter': 'random'}. Best is trial 838 with value: 0.5900375110830633.
[I 2024-12-04 12:01:11,710] Trial 1562 finished with value: 1.075383350593605 and parameters: {'max_depth': 24, 'min_samples_split': 13, 'min_samples_leaf': 7, 'max_features': 'sqrt', 'criterion': 'absolute_error', 'splitter': 'random'}. Best is trial 838 with value: 0.5900375110830633.
[I 2024-12-04 12:01:11,928] Trial 1554 finished with value: 0.59023342761678 and parameters: {'max_depth': 35, 'min_samples_split': 4, 'min_samples_leaf': 1, 'max_features': 'sqrt', 'criterion': 'squared_error', 'splitter': 'best'}. Best is trial 838 with value: 0.5900375110830633.
[I 2024-12-04 12:01:12,014] Trial 1561 finished with value: 0.59023342761678 and parameters: {'max_depth': 35, 'min_samples_split': 4, 'min_samples_leaf': 1, 'max_features': 'sqrt', 'criterion': 'squared_error', 'splitter': 'best'}. Best is trial 838 with value: 0.5900375110830633.
[I 2024-12-04 12:01:12,402] Trial 1555 finished with value: 1.0740768482351102 and parameters: {'max_depth': 3, 'min_samples_split': 19, 'min_samples_leaf': 10, 'max_features': 'log2', 'criterion': 'absolute_error', 'splitter': 'best'}. Best is trial 838 with value: 0.5900375110830633.
[I 2024-12-04 12:01:12,768] Trial 1549 finished with value: 0.8101385948198155 and parameters: {'max_depth': 35, 'min_samples_split': 3, 'min_samples_leaf': 3, 'max_features': 'sqrt', 'criterion': 'squared_error', 'splitter': 'best'}. Best is trial 838 with value: 0.5900375110830633.
[I 2024-12-04 12:01:12,950] Trial 1546 finished with value: 1.091656728529238 and parameters: {'max_depth': 21, 'min_samples_split': 12, 'min_samples_leaf': 10, 'max_features': 'log2', 'criterion': 'friedman_mse', 'splitter': 'best'}. Best is trial 838 with value: 0.5900375110830633.
[I 2024-12-04 12:01:13,302] Trial 1560 finished with value: 0.658104097326617 and parameters: {'max_depth': 29, 'min_samples_split': 8, 'min_samples_leaf': 1, 'max_features': 'sqrt', 'criterion': 'squared_error', 'splitter': 'best'}. Best is trial 838 with value: 0.5900375110830633.
[I 2024-12-04 12:01:13,513] Trial 1563 finished with value: 0.8241861685151659 and parameters: {'max_depth': 19, 'min_samples_split': 2, 'min_samples_leaf': 2, 'max_features': 'sqrt', 'criterion': 'friedman_mse', 'splitter': 'best'}. Best is trial 838 with value: 0.5900375110830633.
[I 2024-12-04 12:01:13,604] Trial 1536 finished with value: 1.091656728529238 and parameters: {'max_depth': 35, 'min_samples_split': 12, 'min_samples_leaf': 7, 'max_features': 'log2', 'criterion': 'friedman_mse', 'splitter': 'best'}. Best is trial 838 with value: 0.5900375110830633.
[I 2024-12-04 12:01:14,053] Trial 1569 finished with value: 0.8606038828695697 and parameters: {'max_depth': 30, 'min_samples_split': 3, 'min_samples_leaf': 2, 'max_features': 'log2', 'criterion': 'squared_error', 'splitter': 'best'}. Best is trial 838 with value: 0.5900375110830633.
[I 2024-12-04 12:01:16,139] Trial 1559 finished with value: 0.8480437596285535 and parameters: {'max_depth': 12, 'min_samples_split': 19, 'min_samples_leaf': 2, 'max_features': 'sqrt', 'criterion': 'squared_error', 'splitter': 'random'}. Best is trial 838 with value: 0.5900375110830633.
[I 2024-12-04 12:01:16,837] Trial 1573 finished with value: 0.8241861685151659 and parameters: {'max_depth': 30, 'min_samples_split': 4, 'min_samples_leaf': 2, 'max_features': 'sqrt', 'criterion': 'squared_error', 'splitter': 'best'}. Best is trial 838 with value: 0.5900375110830633.
[I 2024-12-04 12:01:17,206] Trial 1564 finished with value: 0.8101385948198155 and parameters: {'max_depth': 35, 'min_samples_split': 4, 'min_samples_leaf': 3, 'max_features': 'sqrt', 'criterion': 'squared_error', 'splitter': 'best'}. Best is trial 838 with value: 0.5900375110830633.
[I 2024-12-04 12:01:17,386] Trial 1568 finished with value: 0.7044023234155515 and parameters: {'max_depth': 35, 'min_samples_split': 2, 'min_samples_leaf': 1, 'max_features': 'sqrt', 'criterion': 'squared_error', 'splitter': 'best'}. Best is trial 838 with value: 0.5900375110830633.
[I 2024-12-04 12:01:18,200] Trial 1567 finished with value: 0.6296640809588671 and parameters: {'max_depth': 30, 'min_samples_split': 3, 'min_samples_leaf': 1, 'max_features': 'sqrt', 'criterion': 'squared_error', 'splitter': 'best'}. Best is trial 838 with value: 0.5900375110830633.
[I 2024-12-04 12:01:18,787] Trial 1577 finished with value: 0.800890776213093 and parameters: {'max_depth': 30, 'min_samples_split': 5, 'min_samples_leaf': 1, 'max_features': 'sqrt', 'criterion': 'squared_error', 'splitter': 'random'}. Best is trial 838 with value: 0.5900375110830633.
[I 2024-12-04 12:01:19,049] Trial 1570 finished with value: 0.7291342883560936 and parameters: {'max_depth': 35, 'min_samples_split': 5, 'min_samples_leaf': 1, 'max_features': 'sqrt', 'criterion': 'squared_error', 'splitter': 'best'}. Best is trial 838 with value: 0.5900375110830633.
[I 2024-12-04 12:01:19,452] Trial 1582 finished with value: 0.8101385948198155 and parameters: {'max_depth': 35, 'min_samples_split': 4, 'min_samples_leaf': 3, 'max_features': 'sqrt', 'criterion': 'squared_error', 'splitter': 'best'}. Best is trial 838 with value: 0.5900375110830633.
[I 2024-12-04 12:01:19,612] Trial 1579 finished with value: 0.8300015320785108 and parameters: {'max_depth': 35, 'min_samples_split': 5, 'min_samples_leaf': 2, 'max_features': 'sqrt', 'criterion': 'squared_error', 'splitter': 'best'}. Best is trial 838 with value: 0.5900375110830633.
[I 2024-12-04 12:01:19,751] Trial 1566 finished with value: 0.8209492412990053 and parameters: {'max_depth': 35, 'min_samples_split': 7, 'min_samples_leaf': 2, 'max_features': 'sqrt', 'criterion': 'squared_error', 'splitter': 'best'}. Best is trial 838 with value: 0.5900375110830633.
[I 2024-12-04 12:01:20,342] Trial 1575 finished with value: 0.6595568366176189 and parameters: {'max_depth': 35, 'min_samples_split': 8, 'min_samples_leaf': 1, 'max_features': 'sqrt', 'criterion': 'squared_error', 'splitter': 'best'}. Best is trial 838 with value: 0.5900375110830633.
[I 2024-12-04 12:01:21,576] Trial 1581 finished with value: 0.8300015320785108 and parameters: {'max_depth': 35, 'min_samples_split': 5, 'min_samples_leaf': 2, 'max_features': 'sqrt', 'criterion': 'squared_error', 'splitter': 'best'}. Best is trial 838 with value: 0.5900375110830633.
[I 2024-12-04 12:01:22,680] Trial 1572 finished with value: 1.0844620460096857 and parameters: {'max_depth': 28, 'min_samples_split': 11, 'min_samples_leaf': 5, 'max_features': 'log2', 'criterion': 'squared_error', 'splitter': 'best'}. Best is trial 838 with value: 0.5900375110830633.
[I 2024-12-04 12:01:22,695] Trial 1574 finished with value: 0.7044023234155515 and parameters: {'max_depth': 35, 'min_samples_split': 2, 'min_samples_leaf': 1, 'max_features': 'sqrt', 'criterion': 'squared_error', 'splitter': 'best'}. Best is trial 838 with value: 0.5900375110830633.
[I 2024-12-04 12:01:22,729] Trial 1565 finished with value: 0.8013933461665897 and parameters: {'max_depth': 35, 'min_samples_split': 3, 'min_samples_leaf': 2, 'max_features': 'sqrt', 'criterion': 'absolute_error', 'splitter': 'best'}. Best is trial 838 with value: 0.5900375110830633.
[I 2024-12-04 12:01:22,751] Trial 1586 finished with value: 0.6481536807148809 and parameters: {'max_depth': 29, 'min_samples_split': 4, 'min_samples_leaf': 1, 'max_features': 'sqrt', 'criterion': 'squared_error', 'splitter': 'best'}. Best is trial 838 with value: 0.5900375110830633.
[I 2024-12-04 12:01:22,934] Trial 1584 finished with value: 0.8620278667746158 and parameters: {'max_depth': 13, 'min_samples_split': 19, 'min_samples_leaf': 4, 'max_features': 'sqrt', 'criterion': 'friedman_mse', 'splitter': 'best'}. Best is trial 838 with value: 0.5900375110830633.
[I 2024-12-04 12:01:23,124] Trial 1595 finished with value: 1.0723691757310794 and parameters: {'max_depth': 17, 'min_samples_split': 16, 'min_samples_leaf': 1, 'max_features': 'log2', 'criterion': 'absolute_error', 'splitter': 'random'}. Best is trial 838 with value: 0.5900375110830633.
[I 2024-12-04 12:01:23,125] Trial 1585 finished with value: 1.0816149376799358 and parameters: {'max_depth': 25, 'min_samples_split': 18, 'min_samples_leaf': 10, 'max_features': 'sqrt', 'criterion': 'squared_error', 'splitter': 'random'}. Best is trial 838 with value: 0.5900375110830633.
[I 2024-12-04 12:01:23,681] Trial 1583 finished with value: 0.8101385948198155 and parameters: {'max_depth': 30, 'min_samples_split': 2, 'min_samples_leaf': 3, 'max_features': 'sqrt', 'criterion': 'squared_error', 'splitter': 'best'}. Best is trial 838 with value: 0.5900375110830633.
[I 2024-12-04 12:01:24,337] Trial 1578 finished with value: 0.7044023234155515 and parameters: {'max_depth': 35, 'min_samples_split': 2, 'min_samples_leaf': 1, 'max_features': 'sqrt', 'criterion': 'squared_error', 'splitter': 'best'}. Best is trial 838 with value: 0.5900375110830633.
[I 2024-12-04 12:01:24,412] Trial 1576 finished with value: 0.7231530055805183 and parameters: {'max_depth': 30, 'min_samples_split': 2, 'min_samples_leaf': 1, 'max_features': 'sqrt', 'criterion': 'squared_error', 'splitter': 'best'}. Best is trial 838 with value: 0.5900375110830633.
[I 2024-12-04 12:01:25,481] Trial 1587 finished with value: 0.8300015320785108 and parameters: {'max_depth': 35, 'min_samples_split': 5, 'min_samples_leaf': 2, 'max_features': 'sqrt', 'criterion': 'squared_error', 'splitter': 'best'}. Best is trial 838 with value: 0.5900375110830633.
[I 2024-12-04 12:01:25,707] Trial 1590 finished with value: 0.8101385948198155 and parameters: {'max_depth': 35, 'min_samples_split': 4, 'min_samples_leaf': 3, 'max_features': 'sqrt', 'criterion': 'friedman_mse', 'splitter': 'best'}. Best is trial 838 with value: 0.5900375110830633.
[I 2024-12-04 12:01:25,801] Trial 1592 finished with value: 0.654896954121415 and parameters: {'max_depth': 27, 'min_samples_split': 6, 'min_samples_leaf': 1, 'max_features': 'log2', 'criterion': 'squared_error', 'splitter': 'best'}. Best is trial 838 with value: 0.5900375110830633.
[I 2024-12-04 12:01:26,135] Trial 1589 finished with value: 0.6930885951707311 and parameters: {'max_depth': 28, 'min_samples_split': 8, 'min_samples_leaf': 1, 'max_features': 'sqrt', 'criterion': 'squared_error', 'splitter': 'best'}. Best is trial 838 with value: 0.5900375110830633.
[I 2024-12-04 12:01:27,574] Trial 1580 finished with value: 0.6671320020529113 and parameters: {'max_depth': 30, 'min_samples_split': 6, 'min_samples_leaf': 1, 'max_features': 'sqrt', 'criterion': 'squared_error', 'splitter': 'best'}. Best is trial 838 with value: 0.5900375110830633.
[I 2024-12-04 12:01:28,002] Trial 1600 finished with value: 0.7291342883560936 and parameters: {'max_depth': 35, 'min_samples_split': 5, 'min_samples_leaf': 1, 'max_features': 'sqrt', 'criterion': 'squared_error', 'splitter': 'best'}. Best is trial 838 with value: 0.5900375110830633.
[I 2024-12-04 12:01:28,125] Trial 1594 finished with value: 0.8101385948198155 and parameters: {'max_depth': 28, 'min_samples_split': 5, 'min_samples_leaf': 3, 'max_features': 'sqrt', 'criterion': 'squared_error', 'splitter': 'best'}. Best is trial 838 with value: 0.5900375110830633.
[I 2024-12-04 12:01:28,161] Trial 1601 finished with value: 0.6361563548204678 and parameters: {'max_depth': 30, 'min_samples_split': 4, 'min_samples_leaf': 1, 'max_features': 'sqrt', 'criterion': 'squared_error', 'splitter': 'best'}. Best is trial 838 with value: 0.5900375110830633.
[I 2024-12-04 12:01:28,411] Trial 1598 finished with value: 0.7135166658905429 and parameters: {'max_depth': 29, 'min_samples_split': 6, 'min_samples_leaf': 1, 'max_features': 'sqrt', 'criterion': 'squared_error', 'splitter': 'best'}. Best is trial 838 with value: 0.5900375110830633.
[I 2024-12-04 12:01:28,776] Trial 1596 finished with value: 0.59023342761678 and parameters: {'max_depth': 35, 'min_samples_split': 4, 'min_samples_leaf': 1, 'max_features': 'sqrt', 'criterion': 'squared_error', 'splitter': 'best'}. Best is trial 838 with value: 0.5900375110830633.
[I 2024-12-04 12:01:28,808] Trial 1588 finished with value: 0.7231530055805183 and parameters: {'max_depth': 30, 'min_samples_split': 2, 'min_samples_leaf': 1, 'max_features': 'sqrt', 'criterion': 'squared_error', 'splitter': 'best'}. Best is trial 838 with value: 0.5900375110830633.
[I 2024-12-04 12:01:28,945] Trial 1571 finished with value: 0.7030091902207406 and parameters: {'max_depth': 35, 'min_samples_split': 7, 'min_samples_leaf': 1, 'max_features': 'sqrt', 'criterion': 'squared_error', 'splitter': 'best'}. Best is trial 838 with value: 0.5900375110830633.
[I 2024-12-04 12:01:29,130] Trial 1599 finished with value: 0.8101385948198155 and parameters: {'max_depth': 35, 'min_samples_split': 4, 'min_samples_leaf': 3, 'max_features': 'sqrt', 'criterion': 'squared_error', 'splitter': 'best'}. Best is trial 838 with value: 0.5900375110830633.
[I 2024-12-04 12:01:30,797] Trial 1604 finished with value: 1.092723027538113 and parameters: {'max_depth': 8, 'min_samples_split': 16, 'min_samples_leaf': 8, 'max_features': 'log2', 'criterion': 'squared_error', 'splitter': 'random'}. Best is trial 838 with value: 0.5900375110830633.
[I 2024-12-04 12:01:31,299] Trial 1597 finished with value: 0.59023342761678 and parameters: {'max_depth': 35, 'min_samples_split': 4, 'min_samples_leaf': 1, 'max_features': 'sqrt', 'criterion': 'friedman_mse', 'splitter': 'best'}. Best is trial 838 with value: 0.5900375110830633.
[I 2024-12-04 12:01:32,115] Trial 1593 finished with value: 0.7291342883560936 and parameters: {'max_depth': 35, 'min_samples_split': 5, 'min_samples_leaf': 1, 'max_features': 'sqrt', 'criterion': 'squared_error', 'splitter': 'best'}. Best is trial 838 with value: 0.5900375110830633.
[I 2024-12-04 12:01:32,938] Trial 1608 finished with value: 0.7291342883560936 and parameters: {'max_depth': 35, 'min_samples_split': 5, 'min_samples_leaf': 1, 'max_features': 'sqrt', 'criterion': 'squared_error', 'splitter': 'best'}. Best is trial 838 with value: 0.5900375110830633.
[I 2024-12-04 12:01:33,107] Trial 1606 finished with value: 0.59023342761678 and parameters: {'max_depth': 35, 'min_samples_split': 4, 'min_samples_leaf': 1, 'max_features': 'sqrt', 'criterion': 'squared_error', 'splitter': 'best'}. Best is trial 838 with value: 0.5900375110830633.
[I 2024-12-04 12:01:33,289] Trial 1602 finished with value: 0.676636829282285 and parameters: {'max_depth': 35, 'min_samples_split': 6, 'min_samples_leaf': 1, 'max_features': 'sqrt', 'criterion': 'squared_error', 'splitter': 'best'}. Best is trial 838 with value: 0.5900375110830633.
[I 2024-12-04 12:01:33,475] Trial 1610 finished with value: 0.8101385948198155 and parameters: {'max_depth': 35, 'min_samples_split': 3, 'min_samples_leaf': 3, 'max_features': 'sqrt', 'criterion': 'squared_error', 'splitter': 'best'}. Best is trial 838 with value: 0.5900375110830633.
[I 2024-12-04 12:01:33,478] Trial 1591 finished with value: 0.8654084504690305 and parameters: {'max_depth': 15, 'min_samples_split': 19, 'min_samples_leaf': 9, 'max_features': 'sqrt', 'criterion': 'squared_error', 'splitter': 'best'}. Best is trial 838 with value: 0.5900375110830633.
[I 2024-12-04 12:01:34,180] Trial 1605 finished with value: 1.0909840109486761 and parameters: {'max_depth': 35, 'min_samples_split': 7, 'min_samples_leaf': 7, 'max_features': 'log2', 'criterion': 'friedman_mse', 'splitter': 'random'}. Best is trial 838 with value: 0.5900375110830633.
[I 2024-12-04 12:01:34,691] Trial 1609 finished with value: 0.7664942790387401 and parameters: {'max_depth': 30, 'min_samples_split': 4, 'min_samples_leaf': 1, 'max_features': 'log2', 'criterion': 'squared_error', 'splitter': 'best'}. Best is trial 838 with value: 0.5900375110830633.
[I 2024-12-04 12:01:34,822] Trial 1613 finished with value: 0.8101385948198155 and parameters: {'max_depth': 29, 'min_samples_split': 4, 'min_samples_leaf': 3, 'max_features': 'sqrt', 'criterion': 'squared_error', 'splitter': 'best'}. Best is trial 838 with value: 0.5900375110830633.
[I 2024-12-04 12:01:35,296] Trial 1603 finished with value: 0.7231530055805183 and parameters: {'max_depth': 30, 'min_samples_split': 2, 'min_samples_leaf': 1, 'max_features': 'sqrt', 'criterion': 'squared_error', 'splitter': 'best'}. Best is trial 838 with value: 0.5900375110830633.
[I 2024-12-04 12:01:35,564] Trial 1615 finished with value: 0.7135166658905429 and parameters: {'max_depth': 29, 'min_samples_split': 6, 'min_samples_leaf': 1, 'max_features': 'sqrt', 'criterion': 'squared_error', 'splitter': 'best'}. Best is trial 838 with value: 0.5900375110830633.
[I 2024-12-04 12:01:35,855] Trial 1616 finished with value: 0.59023342761678 and parameters: {'max_depth': 35, 'min_samples_split': 4, 'min_samples_leaf': 1, 'max_features': 'sqrt', 'criterion': 'squared_error', 'splitter': 'best'}. Best is trial 838 with value: 0.5900375110830633.
[I 2024-12-04 12:01:35,915] Trial 1607 finished with value: 0.8241861685151659 and parameters: {'max_depth': 35, 'min_samples_split': 2, 'min_samples_leaf': 2, 'max_features': 'sqrt', 'criterion': 'squared_error', 'splitter': 'best'}. Best is trial 838 with value: 0.5900375110830633.
[I 2024-12-04 12:01:37,355] Trial 1619 finished with value: 0.81109550174734 and parameters: {'max_depth': 33, 'min_samples_split': 2, 'min_samples_leaf': 1, 'max_features': 'sqrt', 'criterion': 'squared_error', 'splitter': 'random'}. Best is trial 838 with value: 0.5900375110830633.
[I 2024-12-04 12:01:38,356] Trial 1628 finished with value: 0.8101385948198155 and parameters: {'max_depth': 30, 'min_samples_split': 4, 'min_samples_leaf': 3, 'max_features': 'sqrt', 'criterion': 'squared_error', 'splitter': 'best'}. Best is trial 838 with value: 0.5900375110830633.
[I 2024-12-04 12:01:38,545] Trial 1622 finished with value: 0.59023342761678 and parameters: {'max_depth': 35, 'min_samples_split': 4, 'min_samples_leaf': 1, 'max_features': 'sqrt', 'criterion': 'squared_error', 'splitter': 'best'}. Best is trial 838 with value: 0.5900375110830633.
