[I 2024-12-03 19:15:47,744] Trial 1830 finished with value: 0.45813469182351835 and parameters: {'kernel': 'rbf', 'C': 19.11695187711276, 'gamma': 0.14107210940631562, 'epsilon': 0.09878430210073892}. Best is trial 88 with value: 0.3542875001421725.
[I 2024-12-03 19:15:48,331] Trial 1831 finished with value: 0.927920882013572 and parameters: {'kernel': 'rbf', 'C': 0.08754778388041365, 'gamma': 0.4294771030509296, 'epsilon': 0.37377755573072347}. Best is trial 88 with value: 0.3542875001421725.
[I 2024-12-03 19:15:49,535] Trial 1832 finished with value: 0.3558129230058685 and parameters: {'kernel': 'rbf', 'C': 95.36318906419547, 'gamma': 0.04482563785095738, 'epsilon': 0.09172640969141924}. Best is trial 88 with value: 0.3542875001421725.
[I 2024-12-03 19:15:52,117] Trial 1834 finished with value: 0.37888172264332204 and parameters: {'kernel': 'rbf', 'C': 92.91544606914931, 'gamma': 0.01918862327365468, 'epsilon': 0.029950494321938203}. Best is trial 88 with value: 0.3542875001421725.
[I 2024-12-03 19:15:52,153] Trial 1703 finished with value: 1.0686173496640772 and parameters: {'kernel': 'poly', 'C': 0.005465240020951411, 'gamma': 0.5582241235016148, 'epsilon': 0.0024987727826781196}. Best is trial 88 with value: 0.3542875001421725.
[I 2024-12-03 19:15:54,176] Trial 1835 finished with value: 0.5380760206666471 and parameters: {'kernel': 'rbf', 'C': 96.36744251766562, 'gamma': 0.2324491192638076, 'epsilon': 0.09262764289232157}. Best is trial 88 with value: 0.3542875001421725.
[I 2024-12-03 19:15:54,421] Trial 1836 finished with value: 0.40364048181312456 and parameters: {'kernel': 'rbf', 'C': 95.28985792209917, 'gamma': 0.10860444412330035, 'epsilon': 0.08404745516391267}. Best is trial 88 with value: 0.3542875001421725.
[I 2024-12-03 19:15:56,108] Trial 1838 finished with value: 0.9565261774107695 and parameters: {'kernel': 'sigmoid', 'C': 0.7628086614903793, 'gamma': 0.00016818188779817262, 'epsilon': 0.9568381576895394}. Best is trial 88 with value: 0.3542875001421725.
[I 2024-12-03 19:15:56,164] Trial 1837 finished with value: 2432.59675294245 and parameters: {'kernel': 'sigmoid', 'C': 87.56029501654199, 'gamma': 0.4563936426778077, 'epsilon': 0.0031162371262993143}. Best is trial 88 with value: 0.3542875001421725.
[I 2024-12-03 19:15:59,007] Trial 1839 finished with value: 0.39926918348162527 and parameters: {'kernel': 'rbf', 'C': 23.370477662697397, 'gamma': 0.01088668817617361, 'epsilon': 0.06406287087492703}. Best is trial 88 with value: 0.3542875001421725.
[I 2024-12-03 19:15:59,642] Trial 1840 finished with value: 0.3828323709075089 and parameters: {'kernel': 'rbf', 'C': 91.643316389342, 'gamma': 0.01768124270400488, 'epsilon': 0.07502841422350345}. Best is trial 88 with value: 0.3542875001421725.
[I 2024-12-03 19:16:00,756] Trial 1841 finished with value: 0.4521215468931163 and parameters: {'kernel': 'rbf', 'C': 29.91806034895364, 'gamma': 0.09225651525597016, 'epsilon': 0.3295907951159783}. Best is trial 88 with value: 0.3542875001421725.
[I 2024-12-03 19:16:02,010] Trial 1842 finished with value: 0.4102396104745022 and parameters: {'kernel': 'rbf', 'C': 17.81640774648528, 'gamma': 0.08139123602130657, 'epsilon': 0.02492713770373581}. Best is trial 88 with value: 0.3542875001421725.
[I 2024-12-03 19:16:02,637] Trial 1843 finished with value: 0.3767662025798294 and parameters: {'kernel': 'rbf', 'C': 96.56954418079529, 'gamma': 0.015399145131487971, 'epsilon': 0.17811149903749}. Best is trial 88 with value: 0.3542875001421725.
[I 2024-12-03 19:16:03,770] Trial 1844 finished with value: 0.4399156599720685 and parameters: {'kernel': 'rbf', 'C': 15.245266003128243, 'gamma': 0.009250220465003038, 'epsilon': 0.3045830688820408}. Best is trial 88 with value: 0.3542875001421725.
[I 2024-12-03 19:16:04,712] Trial 1845 finished with value: 0.8985627264918697 and parameters: {'kernel': 'linear', 'C': 0.0012702914433673357, 'gamma': 0.03595418797944704, 'epsilon': 0.0017729736709154525}. Best is trial 88 with value: 0.3542875001421725.
[I 2024-12-03 19:16:05,676] Trial 1846 finished with value: 0.37302662483719556 and parameters: {'kernel': 'rbf', 'C': 98.22784518318747, 'gamma': 0.01784771847390976, 'epsilon': 0.18724662085600388}. Best is trial 88 with value: 0.3542875001421725.
[I 2024-12-03 19:16:06,803] Trial 1847 finished with value: 0.41037794048570925 and parameters: {'kernel': 'rbf', 'C': 22.36335163578908, 'gamma': 0.03935097130470932, 'epsilon': 0.05061609331008357}. Best is trial 88 with value: 0.3542875001421725.
[I 2024-12-03 19:16:07,414] Trial 1848 finished with value: 0.5089341403965584 and parameters: {'kernel': 'rbf', 'C': 95.19448274837441, 'gamma': 0.16183327686588567, 'epsilon': 0.23945069412085002}. Best is trial 88 with value: 0.3542875001421725.
[I 2024-12-03 19:16:08,773] Trial 1849 finished with value: 0.3665327392835006 and parameters: {'kernel': 'rbf', 'C': 91.65512948497823, 'gamma': 0.02989003275162435, 'epsilon': 0.1060281363832993}. Best is trial 88 with value: 0.3542875001421725.
[I 2024-12-03 19:16:09,782] Trial 1850 finished with value: 0.4553847540211046 and parameters: {'kernel': 'rbf', 'C': 92.16557536523646, 'gamma': 0.1569002151866984, 'epsilon': 0.041022803006936094}. Best is trial 88 with value: 0.3542875001421725.
[I 2024-12-03 19:16:10,932] Trial 1851 finished with value: 0.3651199680264343 and parameters: {'kernel': 'rbf', 'C': 89.91641384182658, 'gamma': 0.05473958585868559, 'epsilon': 0.06344434963375024}. Best is trial 88 with value: 0.3542875001421725.
[I 2024-12-03 19:16:11,195] Trial 1852 finished with value: 0.4373849002199829 and parameters: {'kernel': 'rbf', 'C': 99.95571838988299, 'gamma': 0.019208343353900693, 'epsilon': 0.6143658903254728}. Best is trial 88 with value: 0.3542875001421725.
[I 2024-12-03 19:16:13,001] Trial 1853 finished with value: 0.42219037414203137 and parameters: {'kernel': 'rbf', 'C': 22.175170741182257, 'gamma': 0.019108418112362885, 'epsilon': 0.07829715590214746}. Best is trial 88 with value: 0.3542875001421725.
[I 2024-12-03 19:16:13,130] Trial 1854 finished with value: 0.422239373209459 and parameters: {'kernel': 'rbf', 'C': 18.568962249661347, 'gamma': 0.0201498391347101, 'epsilon': 0.15465786978653587}. Best is trial 88 with value: 0.3542875001421725.
[I 2024-12-03 19:16:14,835] Trial 1855 finished with value: 0.38659302424806813 and parameters: {'kernel': 'rbf', 'C': 23.550319075048034, 'gamma': 0.049861706548429516, 'epsilon': 0.16695833492724732}. Best is trial 88 with value: 0.3542875001421725.
[I 2024-12-03 19:16:14,868] Trial 1856 finished with value: 0.4677108246530531 and parameters: {'kernel': 'rbf', 'C': 90.38677668687178, 'gamma': 0.07271374228520419, 'epsilon': 0.4647549960584883}. Best is trial 88 with value: 0.3542875001421725.
[I 2024-12-03 19:16:16,496] Trial 1857 finished with value: 0.40370135163285814 and parameters: {'kernel': 'rbf', 'C': 24.92906422483261, 'gamma': 0.0075535568342363895, 'epsilon': 0.034158721494713475}. Best is trial 88 with value: 0.3542875001421725.
[I 2024-12-03 19:16:17,618] Trial 1859 finished with value: 0.4048468687247709 and parameters: {'kernel': 'rbf', 'C': 19.552593327700375, 'gamma': 0.049381534142747735, 'epsilon': 0.07677114965481303}. Best is trial 88 with value: 0.3542875001421725.
[I 2024-12-03 19:16:17,778] Trial 1858 finished with value: 0.7969651685474644 and parameters: {'kernel': 'linear', 'C': 0.6568960016044927, 'gamma': 0.3541367014000235, 'epsilon': 0.0020689843690001384}. Best is trial 88 with value: 0.3542875001421725.
[I 2024-12-03 19:16:19,149] Trial 1860 finished with value: 0.39471959814522267 and parameters: {'kernel': 'rbf', 'C': 26.178390853723545, 'gamma': 0.08728197184324804, 'epsilon': 0.1379826770049216}. Best is trial 88 with value: 0.3542875001421725.
[I 2024-12-03 19:16:20,315] Trial 1861 finished with value: 32.19118674864178 and parameters: {'kernel': 'sigmoid', 'C': 1.553516777205263, 'gamma': 0.09704226325807744, 'epsilon': 0.2904516622841327}. Best is trial 88 with value: 0.3542875001421725.
[I 2024-12-03 19:16:20,964] Trial 1862 finished with value: 0.46288809574932704 and parameters: {'kernel': 'rbf', 'C': 20.20593699648442, 'gamma': 0.12131495038787654, 'epsilon': 0.22201400335539764}. Best is trial 88 with value: 0.3542875001421725.
[I 2024-12-03 19:16:23,025] Trial 1863 finished with value: 0.43280027333526533 and parameters: {'kernel': 'rbf', 'C': 96.73325244113188, 'gamma': 0.12983380163771352, 'epsilon': 0.11076817992088693}. Best is trial 88 with value: 0.3542875001421725.
[I 2024-12-03 19:16:25,003] Trial 1865 finished with value: 0.4116958030314774 and parameters: {'kernel': 'rbf', 'C': 19.265999900934286, 'gamma': 0.03376611991475735, 'epsilon': 0.1346283425422388}. Best is trial 88 with value: 0.3542875001421725.
[I 2024-12-03 19:16:26,123] Trial 1864 finished with value: 0.37480072888675203 and parameters: {'kernel': 'rbf', 'C': 94.85555263879621, 'gamma': 0.020172590363443342, 'epsilon': 0.02561017524259822}. Best is trial 88 with value: 0.3542875001421725.
[I 2024-12-03 19:16:26,305] Trial 1798 finished with value: 0.7389436070576555 and parameters: {'kernel': 'poly', 'C': 87.75034198756342, 'gamma': 0.017289154310365117, 'epsilon': 0.02712178153844951}. Best is trial 88 with value: 0.3542875001421725.
[I 2024-12-03 19:16:27,499] Trial 1866 finished with value: 0.3814578739874516 and parameters: {'kernel': 'rbf', 'C': 91.41475102593765, 'gamma': 0.01829488477384469, 'epsilon': 0.10317234857897019}. Best is trial 88 with value: 0.3542875001421725.
[I 2024-12-03 19:16:28,302] Trial 1867 finished with value: 961.9701152788745 and parameters: {'kernel': 'sigmoid', 'C': 73.12384962193896, 'gamma': 0.012304908370988259, 'epsilon': 0.05060084244477177}. Best is trial 88 with value: 0.3542875001421725.
[I 2024-12-03 19:16:29,010] Trial 1868 finished with value: 0.3977001063959832 and parameters: {'kernel': 'rbf', 'C': 22.85738490048504, 'gamma': 0.07235679287416236, 'epsilon': 0.04497060433310887}. Best is trial 88 with value: 0.3542875001421725.
[I 2024-12-03 19:16:29,011] Trial 1869 finished with value: 0.4214400958104995 and parameters: {'kernel': 'rbf', 'C': 93.91666464171333, 'gamma': 0.04808499209273198, 'epsilon': 0.46215783768937163}. Best is trial 88 with value: 0.3542875001421725.
[I 2024-12-03 19:16:30,015] Trial 1870 finished with value: 0.40805922105444736 and parameters: {'kernel': 'rbf', 'C': 17.893655031845963, 'gamma': 0.048207170994238484, 'epsilon': 0.3049904110870522}. Best is trial 88 with value: 0.3542875001421725.
[I 2024-12-03 19:16:31,461] Trial 1871 finished with value: 0.5868422416792594 and parameters: {'kernel': 'rbf', 'C': 22.655127891894736, 'gamma': 0.27270839888375353, 'epsilon': 0.19285908433707186}. Best is trial 88 with value: 0.3542875001421725.
[I 2024-12-03 19:16:31,535] Trial 1872 finished with value: 0.3912583092313163 and parameters: {'kernel': 'rbf', 'C': 26.53019303957983, 'gamma': 0.037301608239214454, 'epsilon': 0.3128088069790482}. Best is trial 88 with value: 0.3542875001421725.
[I 2024-12-03 19:16:33,307] Trial 1874 finished with value: 0.40174860020732595 and parameters: {'kernel': 'rbf', 'C': 18.351106988363135, 'gamma': 0.0069301341934389716, 'epsilon': 0.14049340433215762}. Best is trial 88 with value: 0.3542875001421725.
[I 2024-12-03 19:16:33,805] Trial 1875 finished with value: 0.42317759466551036 and parameters: {'kernel': 'rbf', 'C': 99.32659275868322, 'gamma': 0.12972615103790838, 'epsilon': 0.0314377488147677}. Best is trial 88 with value: 0.3542875001421725.
[I 2024-12-03 19:16:35,455] Trial 1876 finished with value: 0.3874188590632714 and parameters: {'kernel': 'rbf', 'C': 97.35572571313719, 'gamma': 0.07557881965227622, 'epsilon': 0.042028698804718746}. Best is trial 88 with value: 0.3542875001421725.
[I 2024-12-03 19:16:35,482] Trial 1877 finished with value: 0.4701520652268908 and parameters: {'kernel': 'rbf', 'C': 93.38453389152353, 'gamma': 0.10754521480887021, 'epsilon': 0.3261174958271192}. Best is trial 88 with value: 0.3542875001421725.
[I 2024-12-03 19:16:38,206] Trial 1878 finished with value: 0.3664698075035523 and parameters: {'kernel': 'rbf', 'C': 87.24769725215073, 'gamma': 0.027212555409383228, 'epsilon': 0.06735666632749167}. Best is trial 88 with value: 0.3542875001421725.
[I 2024-12-03 19:16:38,234] Trial 1879 finished with value: 0.36663466198510275 and parameters: {'kernel': 'rbf', 'C': 99.93860611842466, 'gamma': 0.024008162708335418, 'epsilon': 0.08885526731999936}. Best is trial 88 with value: 0.3542875001421725.
[I 2024-12-03 19:16:40,868] Trial 419 finished with value: 1.7834279097178816 and parameters: {'kernel': 'poly', 'C': 95.4783173053725, 'gamma': 0.0314792305751867, 'epsilon': 0.057028521447524405}. Best is trial 88 with value: 0.3542875001421725.
[I 2024-12-03 19:16:40,894] Trial 1881 finished with value: 0.3901577225385493 and parameters: {'kernel': 'rbf', 'C': 90.75778389861551, 'gamma': 0.01630146134126123, 'epsilon': 0.07370128592967189}. Best is trial 88 with value: 0.3542875001421725.
[I 2024-12-03 19:16:43,157] Trial 1882 finished with value: 0.3905809074424443 and parameters: {'kernel': 'rbf', 'C': 24.727135379354113, 'gamma': 0.06486444499487248, 'epsilon': 0.1530812108633709}. Best is trial 88 with value: 0.3542875001421725.
[I 2024-12-03 19:16:43,188] Trial 1883 finished with value: 0.9067638063440486 and parameters: {'kernel': 'rbf', 'C': 2.814115629990517, 'gamma': 0.8449836935945964, 'epsilon': 0.6699281701384827}. Best is trial 88 with value: 0.3542875001421725.
[I 2024-12-03 19:16:45,298] Trial 1884 finished with value: 0.36522541080652127 and parameters: {'kernel': 'rbf', 'C': 96.5984179573526, 'gamma': 0.05945517693169411, 'epsilon': 0.15170294469067078}. Best is trial 88 with value: 0.3542875001421725.
[I 2024-12-03 19:16:45,541] Trial 1885 finished with value: 0.5302804941210313 and parameters: {'kernel': 'rbf', 'C': 99.95150127852142, 'gamma': 0.2245377109249659, 'epsilon': 0.08572563080582708}. Best is trial 88 with value: 0.3542875001421725.
[I 2024-12-03 19:16:46,836] Trial 1886 finished with value: 0.41448245106406806 and parameters: {'kernel': 'rbf', 'C': 98.15557426417018, 'gamma': 0.08519060720440601, 'epsilon': 0.26878467386620447}. Best is trial 88 with value: 0.3542875001421725.
[I 2024-12-03 19:16:47,750] Trial 1887 finished with value: 0.4196040641315558 and parameters: {'kernel': 'rbf', 'C': 89.58375714118003, 'gamma': 0.009551037466060917, 'epsilon': 0.10568440683392806}. Best is trial 88 with value: 0.3542875001421725.
[I 2024-12-03 19:16:48,671] Trial 1888 finished with value: 0.36337208581280633 and parameters: {'kernel': 'rbf', 'C': 96.10198252461875, 'gamma': 0.034543040386007744, 'epsilon': 0.11265819645002295}. Best is trial 88 with value: 0.3542875001421725.
[I 2024-12-03 19:16:49,262] Trial 1889 finished with value: 0.3616400768229857 and parameters: {'kernel': 'rbf', 'C': 97.55070155912368, 'gamma': 0.04984841312242154, 'epsilon': 0.19664489338189403}. Best is trial 88 with value: 0.3542875001421725.
[I 2024-12-03 19:16:50,390] Trial 1890 finished with value: 0.4642498069391399 and parameters: {'kernel': 'rbf', 'C': 4.477935849408054, 'gamma': 0.029204910588173597, 'epsilon': 0.13174717635458813}. Best is trial 88 with value: 0.3542875001421725.
[I 2024-12-03 19:16:52,051] Trial 1891 finished with value: 0.370928167066783 and parameters: {'kernel': 'rbf', 'C': 93.85343342758074, 'gamma': 0.0340315380901369, 'epsilon': 0.04578276501662156}. Best is trial 88 with value: 0.3542875001421725.
[I 2024-12-03 19:16:52,084] Trial 1892 finished with value: 1.0720735590626795 and parameters: {'kernel': 'sigmoid', 'C': 0.0012625561241974904, 'gamma': 0.00035336629487951895, 'epsilon': 0.010486063206573476}. Best is trial 88 with value: 0.3542875001421725.
[I 2024-12-03 19:16:53,664] Trial 1893 finished with value: 0.4375203353877203 and parameters: {'kernel': 'rbf', 'C': 30.34694928086596, 'gamma': 0.005728658022919912, 'epsilon': 0.37580623267051416}. Best is trial 88 with value: 0.3542875001421725.
[I 2024-12-03 19:16:55,203] Trial 1895 finished with value: 0.44102505225650074 and parameters: {'kernel': 'rbf', 'C': 13.879981456486526, 'gamma': 0.02343268164455396, 'epsilon': 0.02728172928182643}. Best is trial 88 with value: 0.3542875001421725.
[I 2024-12-03 19:16:56,263] Trial 1894 finished with value: 0.7719095100329717 and parameters: {'kernel': 'linear', 'C': 2.4151145910014984, 'gamma': 0.05223566438682071, 'epsilon': 0.17739720315157007}. Best is trial 88 with value: 0.3542875001421725.
[I 2024-12-03 19:16:57,900] Trial 1897 finished with value: 0.41000799363760193 and parameters: {'kernel': 'rbf', 'C': 92.52249111456698, 'gamma': 0.008375065786472256, 'epsilon': 0.2117405336754497}. Best is trial 88 with value: 0.3542875001421725.
[I 2024-12-03 19:16:59,357] Trial 1898 finished with value: 0.40272034846377763 and parameters: {'kernel': 'rbf', 'C': 24.287227629918334, 'gamma': 0.01878019140500196, 'epsilon': 0.2504892260243858}. Best is trial 88 with value: 0.3542875001421725.
[I 2024-12-03 19:17:01,010] Trial 1899 finished with value: 0.5918481848936341 and parameters: {'kernel': 'rbf', 'C': 22.127344934517897, 'gamma': 0.316084079618395, 'epsilon': 0.07787323524292324}. Best is trial 88 with value: 0.3542875001421725.
[I 2024-12-03 19:17:02,488] Trial 1900 finished with value: 0.3684193884347244 and parameters: {'kernel': 'rbf', 'C': 98.92265887310579, 'gamma': 0.05727772339002475, 'epsilon': 0.0830586260714924}. Best is trial 88 with value: 0.3542875001421725.
[I 2024-12-03 19:17:10,870] Trial 1901 finished with value: 1.7399030413513938 and parameters: {'kernel': 'poly', 'C': 96.3685751540336, 'gamma': 0.013879846038327082, 'epsilon': 0.15093159298697684}. Best is trial 88 with value: 0.3542875001421725.
[I 2024-12-03 19:17:13,508] Trial 1902 finished with value: 0.46147865126470133 and parameters: {'kernel': 'rbf', 'C': 24.413473428046654, 'gamma': 0.15044904317594787, 'epsilon': 0.08981513337189728}. Best is trial 88 with value: 0.3542875001421725.
[I 2024-12-03 19:17:15,362] Trial 1903 finished with value: 0.3664184723448016 and parameters: {'kernel': 'rbf', 'C': 90.70658572691987, 'gamma': 0.03242964279424119, 'epsilon': 0.1002351197203242}. Best is trial 88 with value: 0.3542875001421725.
[I 2024-12-03 19:17:16,924] Trial 1904 finished with value: 0.40880330335517734 and parameters: {'kernel': 'rbf', 'C': 18.940232432934465, 'gamma': 0.08736810670616015, 'epsilon': 0.0873069074496818}. Best is trial 88 with value: 0.3542875001421725.
[I 2024-12-03 19:17:18,382] Trial 1905 finished with value: 0.3565235903059932 and parameters: {'kernel': 'rbf', 'C': 96.34643615421919, 'gamma': 0.039603362633804574, 'epsilon': 0.17127492115532786}. Best is trial 88 with value: 0.3542875001421725.
[I 2024-12-03 19:17:19,686] Trial 1906 finished with value: 0.4800068126055152 and parameters: {'kernel': 'rbf', 'C': 4.571661223134169, 'gamma': 0.07693479201765684, 'epsilon': 0.25262483287019405}. Best is trial 88 with value: 0.3542875001421725.
[I 2024-12-03 19:17:21,170] Trial 1907 finished with value: 1.0867208230448198 and parameters: {'kernel': 'poly', 'C': 0.011256872536030488, 'gamma': 0.0022146141079348717, 'epsilon': 0.0052740916193550575}. Best is trial 88 with value: 0.3542875001421725.
[I 2024-12-03 19:17:22,709] Trial 1908 finished with value: 0.41672603860835566 and parameters: {'kernel': 'rbf', 'C': 23.253982717592223, 'gamma': 0.02369706103052743, 'epsilon': 0.09687877059831664}. Best is trial 88 with value: 0.3542875001421725.
[I 2024-12-03 19:17:24,209] Trial 1909 finished with value: 0.39366600255590084 and parameters: {'kernel': 'rbf', 'C': 16.879571083008297, 'gamma': 0.007568947752244693, 'epsilon': 0.07985938011291188}. Best is trial 88 with value: 0.3542875001421725.
[I 2024-12-03 19:17:26,007] Trial 1910 finished with value: 0.42005173630094633 and parameters: {'kernel': 'rbf', 'C': 96.83072286619239, 'gamma': 0.008863065386116248, 'epsilon': 0.07895253108145985}. Best is trial 88 with value: 0.3542875001421725.
[I 2024-12-03 19:17:27,766] Trial 1911 finished with value: 0.39634663565338274 and parameters: {'kernel': 'rbf', 'C': 23.864446538153548, 'gamma': 0.07232146584826889, 'epsilon': 0.040173806569153}. Best is trial 88 with value: 0.3542875001421725.
[I 2024-12-03 19:17:29,089] Trial 1912 finished with value: 0.4178339471477505 and parameters: {'kernel': 'rbf', 'C': 24.323932663040015, 'gamma': 0.018618455669702362, 'epsilon': 0.11155026921379}. Best is trial 88 with value: 0.3542875001421725.
[I 2024-12-03 19:17:30,605] Trial 1913 finished with value: 0.35808803867517547 and parameters: {'kernel': 'rbf', 'C': 93.12038962289861, 'gamma': 0.0493695784357181, 'epsilon': 0.07610453771928795}. Best is trial 88 with value: 0.3542875001421725.
[I 2024-12-03 19:17:31,001] Trial 1833 finished with value: 0.8036687542894765 and parameters: {'kernel': 'linear', 'C': 73.57805907934474, 'gamma': 0.0010047903868800477, 'epsilon': 0.039743656993207775}. Best is trial 88 with value: 0.3542875001421725.
[I 2024-12-03 19:17:32,012] Trial 1914 finished with value: 0.39154049073568536 and parameters: {'kernel': 'rbf', 'C': 31.38938379150522, 'gamma': 0.025486397145421568, 'epsilon': 0.21526812464360068}. Best is trial 88 with value: 0.3542875001421725.
[I 2024-12-03 19:17:33,321] Trial 1916 finished with value: 0.3733956734147698 and parameters: {'kernel': 'rbf', 'C': 91.11625533411821, 'gamma': 0.06855179717870323, 'epsilon': 0.15183764649940198}. Best is trial 88 with value: 0.3542875001421725.
[I 2024-12-03 19:17:34,847] Trial 1917 finished with value: 0.3575939405362944 and parameters: {'kernel': 'rbf', 'C': 97.85496410044152, 'gamma': 0.043831037605517334, 'epsilon': 0.08144033328942656}. Best is trial 88 with value: 0.3542875001421725.
