[I 2024-12-04 13:37:17,790] Trial 2127 finished with value: 0.22181419370903543 and parameters: {'n_estimators': 1313, 'learning_rate': 0.06544406042431604, 'max_depth': 10, 'min_samples_split': 20, 'min_samples_leaf': 1, 'subsample': 0.6564473931260635, 'max_features': 'sqrt'}. Best is trial 1137 with value: 0.19687116000636118.
[I 2024-12-04 13:37:19,695] Trial 2128 finished with value: 0.22883349917084966 and parameters: {'n_estimators': 1220, 'learning_rate': 0.08663387562776834, 'max_depth': 12, 'min_samples_split': 19, 'min_samples_leaf': 1, 'subsample': 0.6004941253921334, 'max_features': 'sqrt'}. Best is trial 1137 with value: 0.19687116000636118.
[I 2024-12-04 13:37:24,319] Trial 2126 finished with value: 0.2304985666562892 and parameters: {'n_estimators': 1448, 'learning_rate': 0.09161457106329125, 'max_depth': 12, 'min_samples_split': 17, 'min_samples_leaf': 1, 'subsample': 0.6487981425374542, 'max_features': 'sqrt'}. Best is trial 1137 with value: 0.19687116000636118.
[I 2024-12-04 13:37:26,120] Trial 2124 finished with value: 0.39605245618606844 and parameters: {'n_estimators': 1440, 'learning_rate': 0.013988162028421259, 'max_depth': 5, 'min_samples_split': 19, 'min_samples_leaf': 10, 'subsample': 0.7538813913508942, 'max_features': None}. Best is trial 1137 with value: 0.19687116000636118.
[I 2024-12-04 13:37:37,055] Trial 2134 finished with value: 0.21199772431931402 and parameters: {'n_estimators': 1294, 'learning_rate': 0.09998141920657773, 'max_depth': 11, 'min_samples_split': 20, 'min_samples_leaf': 1, 'subsample': 0.6001991163145711, 'max_features': 'sqrt'}. Best is trial 1137 with value: 0.19687116000636118.
[I 2024-12-04 13:37:38,147] Trial 2129 finished with value: 0.21715328175759896 and parameters: {'n_estimators': 1500, 'learning_rate': 0.09511849915538015, 'max_depth': 10, 'min_samples_split': 16, 'min_samples_leaf': 1, 'subsample': 0.658558320193022, 'max_features': 'sqrt'}. Best is trial 1137 with value: 0.19687116000636118.
[I 2024-12-04 13:37:38,156] Trial 2132 finished with value: 0.21446149732065073 and parameters: {'n_estimators': 1345, 'learning_rate': 0.09555882953711088, 'max_depth': 12, 'min_samples_split': 16, 'min_samples_leaf': 1, 'subsample': 0.6664642852419279, 'max_features': 'sqrt'}. Best is trial 1137 with value: 0.19687116000636118.
[I 2024-12-04 13:37:39,279] Trial 2130 finished with value: 0.22202114127424055 and parameters: {'n_estimators': 1465, 'learning_rate': 0.05308303830696765, 'max_depth': 10, 'min_samples_split': 18, 'min_samples_leaf': 1, 'subsample': 0.6023737570289204, 'max_features': 'sqrt'}. Best is trial 1137 with value: 0.19687116000636118.
[I 2024-12-04 13:37:40,365] Trial 2156 finished with value: 0.4025344934272675 and parameters: {'n_estimators': 327, 'learning_rate': 0.09341630079957215, 'max_depth': 8, 'min_samples_split': 19, 'min_samples_leaf': 4, 'subsample': 0.6018532512080759, 'max_features': 'log2'}. Best is trial 1137 with value: 0.19687116000636118.
[I 2024-12-04 13:37:42,503] Trial 2131 finished with value: 0.25310975255784335 and parameters: {'n_estimators': 1486, 'learning_rate': 0.09448937309999597, 'max_depth': 12, 'min_samples_split': 16, 'min_samples_leaf': 4, 'subsample': 0.6511603941223132, 'max_features': 'sqrt'}. Best is trial 1137 with value: 0.19687116000636118.
[I 2024-12-04 13:37:45,803] Trial 2141 finished with value: 0.2725902840108288 and parameters: {'n_estimators': 967, 'learning_rate': 0.047719189099060075, 'max_depth': 12, 'min_samples_split': 15, 'min_samples_leaf': 2, 'subsample': 0.6121890745686094, 'max_features': None}. Best is trial 1137 with value: 0.19687116000636118.
[I 2024-12-04 13:37:46,841] Trial 2144 finished with value: 0.2642810134231021 and parameters: {'n_estimators': 974, 'learning_rate': 0.09496603787889679, 'max_depth': 11, 'min_samples_split': 19, 'min_samples_leaf': 4, 'subsample': 0.7417905092328683, 'max_features': 'sqrt'}. Best is trial 1137 with value: 0.19687116000636118.
[I 2024-12-04 13:37:46,847] Trial 2133 finished with value: 0.20715720548394176 and parameters: {'n_estimators': 1476, 'learning_rate': 0.0931753549905098, 'max_depth': 11, 'min_samples_split': 17, 'min_samples_leaf': 1, 'subsample': 0.6313692380491622, 'max_features': 'sqrt'}. Best is trial 1137 with value: 0.19687116000636118.
[I 2024-12-04 13:37:50,448] Trial 2136 finished with value: 0.24485295326744144 and parameters: {'n_estimators': 1337, 'learning_rate': 0.08325177447821133, 'max_depth': 12, 'min_samples_split': 17, 'min_samples_leaf': 3, 'subsample': 0.6669316601571434, 'max_features': 'sqrt'}. Best is trial 1137 with value: 0.19687116000636118.
[I 2024-12-04 13:37:51,078] Trial 2137 finished with value: 0.20690076107437072 and parameters: {'n_estimators': 1356, 'learning_rate': 0.08748383089317209, 'max_depth': 12, 'min_samples_split': 20, 'min_samples_leaf': 1, 'subsample': 0.6014544657942746, 'max_features': 'sqrt'}. Best is trial 1137 with value: 0.19687116000636118.
[I 2024-12-04 13:37:53,040] Trial 2135 finished with value: 0.24293170041751191 and parameters: {'n_estimators': 1480, 'learning_rate': 0.07513220560232381, 'max_depth': 12, 'min_samples_split': 18, 'min_samples_leaf': 3, 'subsample': 0.6550178134876159, 'max_features': 'sqrt'}. Best is trial 1137 with value: 0.19687116000636118.
[I 2024-12-04 13:37:56,552] Trial 2138 finished with value: 0.24617714059512197 and parameters: {'n_estimators': 1496, 'learning_rate': 0.07680959224022912, 'max_depth': 12, 'min_samples_split': 14, 'min_samples_leaf': 3, 'subsample': 0.7030535544065031, 'max_features': 'sqrt'}. Best is trial 1137 with value: 0.19687116000636118.
[I 2024-12-04 13:37:58,778] Trial 2154 finished with value: 0.3860482811024671 and parameters: {'n_estimators': 607, 'learning_rate': 0.015643542472903487, 'max_depth': 6, 'min_samples_split': 19, 'min_samples_leaf': 9, 'subsample': 0.9240849877044339, 'max_features': None}. Best is trial 1137 with value: 0.19687116000636118.
[I 2024-12-04 13:38:00,462] Trial 2140 finished with value: 0.22946322561891977 and parameters: {'n_estimators': 1393, 'learning_rate': 0.09704908155932812, 'max_depth': 12, 'min_samples_split': 14, 'min_samples_leaf': 2, 'subsample': 0.604680929480213, 'max_features': 'sqrt'}. Best is trial 1137 with value: 0.19687116000636118.
[I 2024-12-04 13:38:03,778] Trial 2145 finished with value: 0.26138013382607533 and parameters: {'n_estimators': 1245, 'learning_rate': 0.08805435491062699, 'max_depth': 10, 'min_samples_split': 17, 'min_samples_leaf': 3, 'subsample': 0.6638046277231665, 'max_features': 'sqrt'}. Best is trial 1137 with value: 0.19687116000636118.
[I 2024-12-04 13:38:03,843] Trial 2139 finished with value: 0.2201892452193087 and parameters: {'n_estimators': 1498, 'learning_rate': 0.06211472701577488, 'max_depth': 10, 'min_samples_split': 15, 'min_samples_leaf': 1, 'subsample': 0.632184530053457, 'max_features': 'sqrt'}. Best is trial 1137 with value: 0.19687116000636118.
[I 2024-12-04 13:38:03,852] Trial 2146 finished with value: 0.2285237680405539 and parameters: {'n_estimators': 1178, 'learning_rate': 0.06645144500599595, 'max_depth': 10, 'min_samples_split': 17, 'min_samples_leaf': 1, 'subsample': 0.7576086363225857, 'max_features': 'sqrt'}. Best is trial 1137 with value: 0.19687116000636118.
[I 2024-12-04 13:38:06,366] Trial 2143 finished with value: 0.22453350216264023 and parameters: {'n_estimators': 1380, 'learning_rate': 0.0984144327093978, 'max_depth': 12, 'min_samples_split': 20, 'min_samples_leaf': 1, 'subsample': 0.684831544362917, 'max_features': 'sqrt'}. Best is trial 1137 with value: 0.19687116000636118.
[I 2024-12-04 13:38:06,369] Trial 2149 finished with value: 0.23276759553912535 and parameters: {'n_estimators': 1160, 'learning_rate': 0.09125437120778561, 'max_depth': 11, 'min_samples_split': 20, 'min_samples_leaf': 2, 'subsample': 0.7428080785935735, 'max_features': 'sqrt'}. Best is trial 1137 with value: 0.19687116000636118.
[I 2024-12-04 13:38:10,053] Trial 2142 finished with value: 0.24864397223070075 and parameters: {'n_estimators': 1453, 'learning_rate': 0.06787060903674975, 'max_depth': 11, 'min_samples_split': 18, 'min_samples_leaf': 1, 'subsample': 0.6093504167018118, 'max_features': 'log2'}. Best is trial 1137 with value: 0.19687116000636118.
[I 2024-12-04 13:38:10,935] Trial 2148 finished with value: 0.20680491569175705 and parameters: {'n_estimators': 1307, 'learning_rate': 0.09349032431749232, 'max_depth': 12, 'min_samples_split': 15, 'min_samples_leaf': 1, 'subsample': 0.6797133450444384, 'max_features': 'sqrt'}. Best is trial 1137 with value: 0.19687116000636118.
[I 2024-12-04 13:38:11,612] Trial 2166 finished with value: 0.2863885742824682 and parameters: {'n_estimators': 293, 'learning_rate': 0.058608702044885025, 'max_depth': 11, 'min_samples_split': 17, 'min_samples_leaf': 2, 'subsample': 0.884011705406057, 'max_features': None}. Best is trial 1137 with value: 0.19687116000636118.
[I 2024-12-04 13:38:20,330] Trial 2147 finished with value: 0.22866918103548603 and parameters: {'n_estimators': 1476, 'learning_rate': 0.06988816954722227, 'max_depth': 12, 'min_samples_split': 17, 'min_samples_leaf': 1, 'subsample': 0.663194466301277, 'max_features': 'sqrt'}. Best is trial 1137 with value: 0.19687116000636118.
[I 2024-12-04 13:38:21,579] Trial 2172 finished with value: 0.28302452299936304 and parameters: {'n_estimators': 241, 'learning_rate': 0.0995573228045386, 'max_depth': 10, 'min_samples_split': 4, 'min_samples_leaf': 1, 'subsample': 0.8929677926159072, 'max_features': None}. Best is trial 1137 with value: 0.19687116000636118.
[I 2024-12-04 13:38:25,365] Trial 2155 finished with value: 0.25753659582537974 and parameters: {'n_estimators': 1188, 'learning_rate': 0.09833334131553599, 'max_depth': 11, 'min_samples_split': 19, 'min_samples_leaf': 2, 'subsample': 0.6164512015669067, 'max_features': 'log2'}. Best is trial 1137 with value: 0.19687116000636118.
[I 2024-12-04 13:38:27,875] Trial 2177 finished with value: 0.6823339390910899 and parameters: {'n_estimators': 187, 'learning_rate': 0.01437963787158842, 'max_depth': 6, 'min_samples_split': 10, 'min_samples_leaf': 9, 'subsample': 0.8533085863730804, 'max_features': 'sqrt'}. Best is trial 1137 with value: 0.19687116000636118.
[I 2024-12-04 13:38:28,502] Trial 2167 finished with value: 0.3696501967570404 and parameters: {'n_estimators': 514, 'learning_rate': 0.09793856979929207, 'max_depth': 6, 'min_samples_split': 12, 'min_samples_leaf': 8, 'subsample': 0.9940755792743594, 'max_features': None}. Best is trial 1137 with value: 0.19687116000636118.
[I 2024-12-04 13:38:29,257] Trial 2152 finished with value: 0.22003047921098806 and parameters: {'n_estimators': 1391, 'learning_rate': 0.09898004079613631, 'max_depth': 10, 'min_samples_split': 16, 'min_samples_leaf': 1, 'subsample': 0.6323635346967736, 'max_features': 'sqrt'}. Best is trial 1137 with value: 0.19687116000636118.
[I 2024-12-04 13:38:35,151] Trial 2151 finished with value: 0.2096249619155583 and parameters: {'n_estimators': 1489, 'learning_rate': 0.0960439353269593, 'max_depth': 12, 'min_samples_split': 18, 'min_samples_leaf': 1, 'subsample': 0.7131721182308246, 'max_features': 'sqrt'}. Best is trial 1137 with value: 0.19687116000636118.
[I 2024-12-04 13:38:37,114] Trial 2160 finished with value: 0.2138556648936493 and parameters: {'n_estimators': 1198, 'learning_rate': 0.09163461851315637, 'max_depth': 12, 'min_samples_split': 20, 'min_samples_leaf': 1, 'subsample': 0.6837662089860357, 'max_features': 'sqrt'}. Best is trial 1137 with value: 0.19687116000636118.
[I 2024-12-04 13:38:39,406] Trial 2184 finished with value: 0.4589572246375508 and parameters: {'n_estimators': 165, 'learning_rate': 0.022811416005711686, 'max_depth': 11, 'min_samples_split': 12, 'min_samples_leaf': 4, 'subsample': 0.8828770622169252, 'max_features': 'sqrt'}. Best is trial 1137 with value: 0.19687116000636118.
[I 2024-12-04 13:38:41,473] Trial 2153 finished with value: 0.23678085406480145 and parameters: {'n_estimators': 1490, 'learning_rate': 0.09428128216522202, 'max_depth': 12, 'min_samples_split': 19, 'min_samples_leaf': 1, 'subsample': 0.656347462715708, 'max_features': 'sqrt'}. Best is trial 1137 with value: 0.19687116000636118.
[I 2024-12-04 13:38:43,012] Trial 2161 finished with value: 0.21894865211615552 and parameters: {'n_estimators': 1262, 'learning_rate': 0.0916710126327329, 'max_depth': 10, 'min_samples_split': 20, 'min_samples_leaf': 1, 'subsample': 0.6814162155629961, 'max_features': 'sqrt'}. Best is trial 1137 with value: 0.19687116000636118.
[I 2024-12-04 13:38:46,005] Trial 2169 finished with value: 0.3602963759438256 and parameters: {'n_estimators': 763, 'learning_rate': 0.0473631956174739, 'max_depth': 9, 'min_samples_split': 5, 'min_samples_leaf': 8, 'subsample': 0.6672573642800842, 'max_features': None}. Best is trial 1137 with value: 0.19687116000636118.
[I 2024-12-04 13:38:47,095] Trial 2158 finished with value: 0.2064595717168975 and parameters: {'n_estimators': 1447, 'learning_rate': 0.07577633767601305, 'max_depth': 10, 'min_samples_split': 15, 'min_samples_leaf': 1, 'subsample': 0.6055816239118396, 'max_features': 'sqrt'}. Best is trial 1137 with value: 0.19687116000636118.
[I 2024-12-04 13:38:47,489] Trial 2159 finished with value: 0.23288089341631024 and parameters: {'n_estimators': 1422, 'learning_rate': 0.09783066630628356, 'max_depth': 11, 'min_samples_split': 20, 'min_samples_leaf': 2, 'subsample': 0.7211576691167249, 'max_features': 'sqrt'}. Best is trial 1137 with value: 0.19687116000636118.
[I 2024-12-04 13:38:49,345] Trial 2157 finished with value: 0.2392920613817097 and parameters: {'n_estimators': 1500, 'learning_rate': 0.09977031655134679, 'max_depth': 9, 'min_samples_split': 18, 'min_samples_leaf': 1, 'subsample': 0.611199734479701, 'max_features': 'sqrt'}. Best is trial 1137 with value: 0.19687116000636118.
[I 2024-12-04 13:38:54,328] Trial 2162 finished with value: 0.2222214880380058 and parameters: {'n_estimators': 1206, 'learning_rate': 0.09721018835500898, 'max_depth': 12, 'min_samples_split': 20, 'min_samples_leaf': 1, 'subsample': 0.685267134851508, 'max_features': 'sqrt'}. Best is trial 1137 with value: 0.19687116000636118.
[I 2024-12-04 13:38:54,330] Trial 2179 finished with value: 0.3895246694744648 and parameters: {'n_estimators': 562, 'learning_rate': 0.08221273561324703, 'max_depth': 3, 'min_samples_split': 18, 'min_samples_leaf': 1, 'subsample': 0.7729263536281001, 'max_features': 'log2'}. Best is trial 1137 with value: 0.19687116000636118.
[I 2024-12-04 13:38:57,589] Trial 2163 finished with value: 0.2459918751398853 and parameters: {'n_estimators': 1239, 'learning_rate': 0.09165875994901876, 'max_depth': 10, 'min_samples_split': 16, 'min_samples_leaf': 3, 'subsample': 0.680935932972146, 'max_features': 'sqrt'}. Best is trial 1137 with value: 0.19687116000636118.
[I 2024-12-04 13:38:57,591] Trial 2165 finished with value: 0.26384782727910255 and parameters: {'n_estimators': 1161, 'learning_rate': 0.062263439908804, 'max_depth': 10, 'min_samples_split': 13, 'min_samples_leaf': 1, 'subsample': 0.6440505359490745, 'max_features': 'log2'}. Best is trial 1137 with value: 0.19687116000636118.
[I 2024-12-04 13:39:01,241] Trial 2192 finished with value: 0.6707731632113347 and parameters: {'n_estimators': 274, 'learning_rate': 0.04778249810878453, 'max_depth': 4, 'min_samples_split': 12, 'min_samples_leaf': 6, 'subsample': 0.6339760216937914, 'max_features': 'log2'}. Best is trial 1137 with value: 0.19687116000636118.
[I 2024-12-04 13:39:04,373] Trial 2170 finished with value: 0.3336847574626663 and parameters: {'n_estimators': 1021, 'learning_rate': 0.04614637523209751, 'max_depth': 3, 'min_samples_split': 2, 'min_samples_leaf': 4, 'subsample': 0.6024001900161505, 'max_features': 'sqrt'}. Best is trial 1137 with value: 0.19687116000636118.
[I 2024-12-04 13:39:04,386] Trial 2164 finished with value: 0.21709822951971464 and parameters: {'n_estimators': 1290, 'learning_rate': 0.07527110502965648, 'max_depth': 10, 'min_samples_split': 16, 'min_samples_leaf': 1, 'subsample': 0.6775438052153142, 'max_features': 'sqrt'}. Best is trial 1137 with value: 0.19687116000636118.
[I 2024-12-04 13:39:15,088] Trial 2168 finished with value: 0.23853576600507398 and parameters: {'n_estimators': 1332, 'learning_rate': 0.09263230838595572, 'max_depth': 11, 'min_samples_split': 17, 'min_samples_leaf': 2, 'subsample': 0.6000157766217686, 'max_features': 'sqrt'}. Best is trial 1137 with value: 0.19687116000636118.
[I 2024-12-04 13:39:17,421] Trial 2174 finished with value: 0.22027613517430492 and parameters: {'n_estimators': 1166, 'learning_rate': 0.09876570183850614, 'max_depth': 10, 'min_samples_split': 20, 'min_samples_leaf': 1, 'subsample': 0.6787415769647697, 'max_features': 'sqrt'}. Best is trial 1137 with value: 0.19687116000636118.
[I 2024-12-04 13:39:20,399] Trial 2175 finished with value: 0.25252304745286364 and parameters: {'n_estimators': 1156, 'learning_rate': 0.09831693655506997, 'max_depth': 10, 'min_samples_split': 15, 'min_samples_leaf': 1, 'subsample': 0.6456577264641856, 'max_features': 'log2'}. Best is trial 1137 with value: 0.19687116000636118.
[I 2024-12-04 13:39:26,929] Trial 2171 finished with value: 0.2599089928892549 and parameters: {'n_estimators': 1462, 'learning_rate': 0.0634479775738038, 'max_depth': 10, 'min_samples_split': 18, 'min_samples_leaf': 3, 'subsample': 0.6219838980962992, 'max_features': 'sqrt'}. Best is trial 1137 with value: 0.19687116000636118.
[I 2024-12-04 13:39:27,890] Trial 2207 finished with value: 0.6620170024447476 and parameters: {'n_estimators': 141, 'learning_rate': 0.031189913590489268, 'max_depth': 3, 'min_samples_split': 13, 'min_samples_leaf': 3, 'subsample': 0.6842063283470491, 'max_features': 'sqrt'}. Best is trial 1137 with value: 0.19687116000636118.
[I 2024-12-04 13:39:29,406] Trial 2178 finished with value: 0.24568414028348204 and parameters: {'n_estimators': 1115, 'learning_rate': 0.09555969384469243, 'max_depth': 12, 'min_samples_split': 16, 'min_samples_leaf': 2, 'subsample': 0.7119111996123516, 'max_features': 'sqrt'}. Best is trial 1137 with value: 0.19687116000636118.
[I 2024-12-04 13:39:33,340] Trial 2173 finished with value: 0.24694296044154077 and parameters: {'n_estimators': 1488, 'learning_rate': 0.07266354008052546, 'max_depth': 12, 'min_samples_split': 15, 'min_samples_leaf': 3, 'subsample': 0.609849215812573, 'max_features': 'sqrt'}. Best is trial 1137 with value: 0.19687116000636118.
[I 2024-12-04 13:39:35,199] Trial 2185 finished with value: 0.2295968479525083 and parameters: {'n_estimators': 1042, 'learning_rate': 0.09840114041518344, 'max_depth': 12, 'min_samples_split': 16, 'min_samples_leaf': 1, 'subsample': 0.6963788774215137, 'max_features': 'log2'}. Best is trial 1137 with value: 0.19687116000636118.
[I 2024-12-04 13:39:35,286] Trial 2176 finished with value: 0.22089425388630937 and parameters: {'n_estimators': 1355, 'learning_rate': 0.09836308390203091, 'max_depth': 12, 'min_samples_split': 17, 'min_samples_leaf': 1, 'subsample': 0.6575408180967596, 'max_features': 'sqrt'}. Best is trial 1137 with value: 0.19687116000636118.
[I 2024-12-04 13:39:39,983] Trial 2186 finished with value: 0.23604441435963217 and parameters: {'n_estimators': 1141, 'learning_rate': 0.06313675570216899, 'max_depth': 10, 'min_samples_split': 17, 'min_samples_leaf': 1, 'subsample': 0.6298599760616674, 'max_features': 'sqrt'}. Best is trial 1137 with value: 0.19687116000636118.
[I 2024-12-04 13:39:44,677] Trial 2206 finished with value: 0.43655856095905493 and parameters: {'n_estimators': 506, 'learning_rate': 0.014432958647148482, 'max_depth': 3, 'min_samples_split': 20, 'min_samples_leaf': 9, 'subsample': 0.7988186561203465, 'max_features': None}. Best is trial 1137 with value: 0.19687116000636118.
[I 2024-12-04 13:39:46,089] Trial 2187 finished with value: 0.21616054451725972 and parameters: {'n_estimators': 1149, 'learning_rate': 0.07733408546134013, 'max_depth': 10, 'min_samples_split': 15, 'min_samples_leaf': 1, 'subsample': 0.6634018194756653, 'max_features': 'sqrt'}. Best is trial 1137 with value: 0.19687116000636118.
[I 2024-12-04 13:39:50,436] Trial 2181 finished with value: 0.24188628826412706 and parameters: {'n_estimators': 1469, 'learning_rate': 0.09277641892980477, 'max_depth': 10, 'min_samples_split': 20, 'min_samples_leaf': 2, 'subsample': 0.6005599310863846, 'max_features': 'sqrt'}. Best is trial 1137 with value: 0.19687116000636118.
[I 2024-12-04 13:39:54,622] Trial 2183 finished with value: 0.22630817361967526 and parameters: {'n_estimators': 1470, 'learning_rate': 0.09572776025063869, 'max_depth': 10, 'min_samples_split': 16, 'min_samples_leaf': 1, 'subsample': 0.6791692870883398, 'max_features': 'sqrt'}. Best is trial 1137 with value: 0.19687116000636118.
[I 2024-12-04 13:39:55,571] Trial 2182 finished with value: 0.2286590898773856 and parameters: {'n_estimators': 1493, 'learning_rate': 0.05882134098459318, 'max_depth': 10, 'min_samples_split': 20, 'min_samples_leaf': 1, 'subsample': 0.6108089813810804, 'max_features': 'sqrt'}. Best is trial 1137 with value: 0.19687116000636118.
[I 2024-12-04 13:39:56,561] Trial 2190 finished with value: 0.2387887510177906 and parameters: {'n_estimators': 1252, 'learning_rate': 0.09997372911278458, 'max_depth': 11, 'min_samples_split': 16, 'min_samples_leaf': 2, 'subsample': 0.6979220705786247, 'max_features': 'sqrt'}. Best is trial 1137 with value: 0.19687116000636118.
[I 2024-12-04 13:40:00,109] Trial 2198 finished with value: 0.23775019163568478 and parameters: {'n_estimators': 1029, 'learning_rate': 0.08537836210721964, 'max_depth': 12, 'min_samples_split': 20, 'min_samples_leaf': 1, 'subsample': 0.7224806527957707, 'max_features': 'log2'}. Best is trial 1137 with value: 0.19687116000636118.
