[I 2024-12-04 12:17:52,037] Trial 201 finished with value: 0.343433998139309 and parameters: {'n_estimators': 592, 'learning_rate': 0.05004893051116482, 'max_depth': 12, 'min_samples_split': 16, 'min_samples_leaf': 2, 'subsample': 0.7003033236028336, 'max_features': None}. Best is trial 75 with value: 0.3356123167576939.
[I 2024-12-04 12:17:52,093] Trial 210 finished with value: 0.5729271656064469 and parameters: {'n_estimators': 292, 'learning_rate': 0.01084393567614144, 'max_depth': 10, 'min_samples_split': 6, 'min_samples_leaf': 8, 'subsample': 0.6427389041469515, 'max_features': None}. Best is trial 75 with value: 0.3356123167576939.
[I 2024-12-04 12:17:52,218] Trial 209 finished with value: 0.4625186552155834 and parameters: {'n_estimators': 163, 'learning_rate': 0.0674563591189964, 'max_depth': 11, 'min_samples_split': 20, 'min_samples_leaf': 3, 'subsample': 0.8639124085430747, 'max_features': 'sqrt'}. Best is trial 75 with value: 0.3356123167576939.
[I 2024-12-04 12:17:53,025] Trial 197 finished with value: 0.38818719630526394 and parameters: {'n_estimators': 755, 'learning_rate': 0.05108678122836409, 'max_depth': 10, 'min_samples_split': 5, 'min_samples_leaf': 3, 'subsample': 0.9452513345463496, 'max_features': None}. Best is trial 75 with value: 0.3356123167576939.
[I 2024-12-04 12:17:53,029] Trial 212 finished with value: 0.3718630362379646 and parameters: {'n_estimators': 352, 'learning_rate': 0.05044457962798969, 'max_depth': 11, 'min_samples_split': 20, 'min_samples_leaf': 4, 'subsample': 0.8992989230199565, 'max_features': None}. Best is trial 75 with value: 0.3356123167576939.
[I 2024-12-04 12:17:53,051] Trial 222 finished with value: 0.48810960194855146 and parameters: {'n_estimators': 290, 'learning_rate': 0.09308757973233499, 'max_depth': 11, 'min_samples_split': 19, 'min_samples_leaf': 3, 'subsample': 0.930368273707108, 'max_features': 'log2'}. Best is trial 75 with value: 0.3356123167576939.
[I 2024-12-04 12:17:54,019] Trial 225 finished with value: 0.9238062725728364 and parameters: {'n_estimators': 127, 'learning_rate': 0.034831771488541524, 'max_depth': 3, 'min_samples_split': 5, 'min_samples_leaf': 2, 'subsample': 0.8225703409131065, 'max_features': 'log2'}. Best is trial 75 with value: 0.3356123167576939.
[I 2024-12-04 12:17:54,879] Trial 205 finished with value: 0.37914246731903095 and parameters: {'n_estimators': 503, 'learning_rate': 0.05750894784072729, 'max_depth': 9, 'min_samples_split': 20, 'min_samples_leaf': 3, 'subsample': 0.8771762723695984, 'max_features': None}. Best is trial 75 with value: 0.3356123167576939.
[I 2024-12-04 12:17:55,341] Trial 199 finished with value: 0.43335756789934726 and parameters: {'n_estimators': 690, 'learning_rate': 0.01700517988754384, 'max_depth': 11, 'min_samples_split': 2, 'min_samples_leaf': 1, 'subsample': 0.966617963977882, 'max_features': None}. Best is trial 75 with value: 0.3356123167576939.
[I 2024-12-04 12:17:56,702] Trial 203 finished with value: 0.40175062978115283 and parameters: {'n_estimators': 1296, 'learning_rate': 0.05096875622242191, 'max_depth': 9, 'min_samples_split': 12, 'min_samples_leaf': 1, 'subsample': 0.6195506934515865, 'max_features': 'log2'}. Best is trial 75 with value: 0.3356123167576939.
[I 2024-12-04 12:17:56,911] Trial 207 finished with value: 0.3708418807954592 and parameters: {'n_estimators': 313, 'learning_rate': 0.0503384388945608, 'max_depth': 9, 'min_samples_split': 9, 'min_samples_leaf': 2, 'subsample': 0.8603612040681142, 'max_features': None}. Best is trial 75 with value: 0.3356123167576939.
[I 2024-12-04 12:17:59,657] Trial 218 finished with value: 0.3938184846545768 and parameters: {'n_estimators': 399, 'learning_rate': 0.038135125179730764, 'max_depth': 10, 'min_samples_split': 7, 'min_samples_leaf': 3, 'subsample': 0.8793626239627035, 'max_features': None}. Best is trial 75 with value: 0.3356123167576939.
[I 2024-12-04 12:18:00,042] Trial 206 finished with value: 0.39783034422579977 and parameters: {'n_estimators': 774, 'learning_rate': 0.052318639138587746, 'max_depth': 9, 'min_samples_split': 12, 'min_samples_leaf': 1, 'subsample': 0.6554760581114074, 'max_features': None}. Best is trial 75 with value: 0.3356123167576939.
[I 2024-12-04 12:18:01,343] Trial 208 finished with value: 0.40535979266814515 and parameters: {'n_estimators': 862, 'learning_rate': 0.09601805809688022, 'max_depth': 9, 'min_samples_split': 18, 'min_samples_leaf': 7, 'subsample': 0.7143415916105199, 'max_features': None}. Best is trial 75 with value: 0.3356123167576939.
[I 2024-12-04 12:18:01,347] Trial 217 finished with value: 0.44619705809852284 and parameters: {'n_estimators': 433, 'learning_rate': 0.05211549536631245, 'max_depth': 8, 'min_samples_split': 3, 'min_samples_leaf': 1, 'subsample': 0.9663413917873241, 'max_features': None}. Best is trial 75 with value: 0.3356123167576939.
[I 2024-12-04 12:18:02,647] Trial 230 finished with value: 0.36577050164834135 and parameters: {'n_estimators': 209, 'learning_rate': 0.09411270162536442, 'max_depth': 12, 'min_samples_split': 13, 'min_samples_leaf': 2, 'subsample': 0.7189497812872314, 'max_features': None}. Best is trial 75 with value: 0.3356123167576939.
[I 2024-12-04 12:18:02,666] Trial 214 finished with value: 0.40619495322137295 and parameters: {'n_estimators': 524, 'learning_rate': 0.05741263258955295, 'max_depth': 7, 'min_samples_split': 6, 'min_samples_leaf': 1, 'subsample': 0.8922963556878791, 'max_features': None}. Best is trial 75 with value: 0.3356123167576939.
[I 2024-12-04 12:18:02,681] Trial 213 finished with value: 0.38355861757931975 and parameters: {'n_estimators': 521, 'learning_rate': 0.0628716906823017, 'max_depth': 7, 'min_samples_split': 3, 'min_samples_leaf': 1, 'subsample': 0.6396050260396053, 'max_features': None}. Best is trial 75 with value: 0.3356123167576939.
[I 2024-12-04 12:18:02,881] Trial 221 finished with value: 0.45142350916718893 and parameters: {'n_estimators': 638, 'learning_rate': 0.03691240253629552, 'max_depth': 5, 'min_samples_split': 5, 'min_samples_leaf': 1, 'subsample': 0.9094579445721369, 'max_features': None}. Best is trial 75 with value: 0.3356123167576939.
[I 2024-12-04 12:18:02,884] Trial 232 finished with value: 0.38232646181966123 and parameters: {'n_estimators': 129, 'learning_rate': 0.06555460665751327, 'max_depth': 11, 'min_samples_split': 17, 'min_samples_leaf': 2, 'subsample': 0.9397031485082189, 'max_features': None}. Best is trial 75 with value: 0.3356123167576939.
[I 2024-12-04 12:18:04,212] Trial 238 finished with value: 0.38821954283788507 and parameters: {'n_estimators': 123, 'learning_rate': 0.05051328280396467, 'max_depth': 12, 'min_samples_split': 8, 'min_samples_leaf': 4, 'subsample': 0.7420215150615601, 'max_features': None}. Best is trial 75 with value: 0.3356123167576939.
[I 2024-12-04 12:18:04,396] Trial 211 finished with value: 0.3521356428127962 and parameters: {'n_estimators': 919, 'learning_rate': 0.026843272707111593, 'max_depth': 12, 'min_samples_split': 10, 'min_samples_leaf': 2, 'subsample': 0.6503847872208087, 'max_features': None}. Best is trial 75 with value: 0.3356123167576939.
[I 2024-12-04 12:18:06,797] Trial 224 finished with value: 0.3537579509427412 and parameters: {'n_estimators': 479, 'learning_rate': 0.04102059573028657, 'max_depth': 9, 'min_samples_split': 15, 'min_samples_leaf': 2, 'subsample': 0.7238484800375597, 'max_features': None}. Best is trial 75 with value: 0.3356123167576939.
[I 2024-12-04 12:18:06,807] Trial 216 finished with value: 0.40249682874213083 and parameters: {'n_estimators': 629, 'learning_rate': 0.046054910486261515, 'max_depth': 8, 'min_samples_split': 10, 'min_samples_leaf': 1, 'subsample': 0.9332367247574971, 'max_features': None}. Best is trial 75 with value: 0.3356123167576939.
[I 2024-12-04 12:18:07,606] Trial 228 finished with value: 0.3684201065075952 and parameters: {'n_estimators': 433, 'learning_rate': 0.05968677627041496, 'max_depth': 10, 'min_samples_split': 14, 'min_samples_leaf': 1, 'subsample': 0.6371592061434859, 'max_features': None}. Best is trial 75 with value: 0.3356123167576939.
[I 2024-12-04 12:18:07,733] Trial 227 finished with value: 0.4445364193867363 and parameters: {'n_estimators': 708, 'learning_rate': 0.056964534124668155, 'max_depth': 9, 'min_samples_split': 2, 'min_samples_leaf': 1, 'subsample': 0.7670992729177141, 'max_features': 'log2'}. Best is trial 75 with value: 0.3356123167576939.
[I 2024-12-04 12:18:08,251] Trial 215 finished with value: 0.373154644352975 and parameters: {'n_estimators': 767, 'learning_rate': 0.09625067108725643, 'max_depth': 11, 'min_samples_split': 15, 'min_samples_leaf': 5, 'subsample': 0.6184119799360022, 'max_features': None}. Best is trial 75 with value: 0.3356123167576939.
[I 2024-12-04 12:18:08,251] Trial 233 finished with value: 0.4121066964161253 and parameters: {'n_estimators': 371, 'learning_rate': 0.0423174185902101, 'max_depth': 10, 'min_samples_split': 3, 'min_samples_leaf': 1, 'subsample': 0.7333981414883535, 'max_features': None}. Best is trial 75 with value: 0.3356123167576939.
[I 2024-12-04 12:18:08,437] Trial 226 finished with value: 0.3618952225772722 and parameters: {'n_estimators': 492, 'learning_rate': 0.03306938895288535, 'max_depth': 11, 'min_samples_split': 3, 'min_samples_leaf': 2, 'subsample': 0.8919333543493148, 'max_features': None}. Best is trial 75 with value: 0.3356123167576939.
[I 2024-12-04 12:18:09,108] Trial 241 finished with value: 0.3755991757878361 and parameters: {'n_estimators': 249, 'learning_rate': 0.09685336910146793, 'max_depth': 11, 'min_samples_split': 20, 'min_samples_leaf': 3, 'subsample': 0.8953641949106469, 'max_features': None}. Best is trial 75 with value: 0.3356123167576939.
[I 2024-12-04 12:18:09,234] Trial 220 finished with value: 0.5852934070239464 and parameters: {'n_estimators': 1125, 'learning_rate': 0.023080526941578187, 'max_depth': 11, 'min_samples_split': 3, 'min_samples_leaf': 9, 'subsample': 0.9090195140409052, 'max_features': 'sqrt'}. Best is trial 75 with value: 0.3356123167576939.
[I 2024-12-04 12:18:09,797] Trial 219 finished with value: 0.3446501201226679 and parameters: {'n_estimators': 783, 'learning_rate': 0.0932867465116465, 'max_depth': 11, 'min_samples_split': 17, 'min_samples_leaf': 2, 'subsample': 0.7416707887975449, 'max_features': None}. Best is trial 75 with value: 0.3356123167576939.
[I 2024-12-04 12:18:09,974] Trial 229 finished with value: 0.3706893071179701 and parameters: {'n_estimators': 602, 'learning_rate': 0.04489654648720022, 'max_depth': 12, 'min_samples_split': 15, 'min_samples_leaf': 1, 'subsample': 0.7044736270024429, 'max_features': None}. Best is trial 75 with value: 0.3356123167576939.
[I 2024-12-04 12:18:15,158] Trial 231 finished with value: 0.4048804964509938 and parameters: {'n_estimators': 645, 'learning_rate': 0.027613348971231872, 'max_depth': 9, 'min_samples_split': 10, 'min_samples_leaf': 1, 'subsample': 0.8498253076052555, 'max_features': None}. Best is trial 75 with value: 0.3356123167576939.
[I 2024-12-04 12:18:15,163] Trial 242 finished with value: 0.3774128456799982 and parameters: {'n_estimators': 446, 'learning_rate': 0.09840008425899406, 'max_depth': 11, 'min_samples_split': 15, 'min_samples_leaf': 5, 'subsample': 0.6025443087012614, 'max_features': None}. Best is trial 75 with value: 0.3356123167576939.
[I 2024-12-04 12:18:15,311] Trial 234 finished with value: 0.3784624617898334 and parameters: {'n_estimators': 711, 'learning_rate': 0.0356112499877505, 'max_depth': 8, 'min_samples_split': 4, 'min_samples_leaf': 4, 'subsample': 0.7294863839168751, 'max_features': None}. Best is trial 75 with value: 0.3356123167576939.
[I 2024-12-04 12:18:15,988] Trial 244 finished with value: 0.6179508393044494 and parameters: {'n_estimators': 600, 'learning_rate': 0.02017730618196695, 'max_depth': 6, 'min_samples_split': 10, 'min_samples_leaf': 8, 'subsample': 0.8072379832913392, 'max_features': 'sqrt'}. Best is trial 75 with value: 0.3356123167576939.
[I 2024-12-04 12:18:17,034] Trial 235 finished with value: 0.3402742007508455 and parameters: {'n_estimators': 555, 'learning_rate': 0.03979016973109503, 'max_depth': 8, 'min_samples_split': 3, 'min_samples_leaf': 2, 'subsample': 0.814908266152201, 'max_features': None}. Best is trial 75 with value: 0.3356123167576939.
[I 2024-12-04 12:18:17,049] Trial 249 finished with value: 0.4810359923138524 and parameters: {'n_estimators': 176, 'learning_rate': 0.01250651066204914, 'max_depth': 11, 'min_samples_split': 5, 'min_samples_leaf': 4, 'subsample': 0.9511317130311577, 'max_features': None}. Best is trial 75 with value: 0.3356123167576939.
[I 2024-12-04 12:18:17,141] Trial 223 finished with value: 0.3944131750475829 and parameters: {'n_estimators': 957, 'learning_rate': 0.08128060407049749, 'max_depth': 10, 'min_samples_split': 9, 'min_samples_leaf': 6, 'subsample': 0.7539032252376408, 'max_features': None}. Best is trial 75 with value: 0.3356123167576939.
[I 2024-12-04 12:18:17,467] Trial 240 finished with value: 0.41478974089501935 and parameters: {'n_estimators': 559, 'learning_rate': 0.027067426819350763, 'max_depth': 9, 'min_samples_split': 2, 'min_samples_leaf': 1, 'subsample': 0.8466140497929888, 'max_features': None}. Best is trial 75 with value: 0.3356123167576939.
[I 2024-12-04 12:18:17,976] Trial 239 finished with value: 0.36263901112670854 and parameters: {'n_estimators': 585, 'learning_rate': 0.08731821703625926, 'max_depth': 12, 'min_samples_split': 20, 'min_samples_leaf': 3, 'subsample': 0.6941080637003831, 'max_features': None}. Best is trial 75 with value: 0.3356123167576939.
[I 2024-12-04 12:18:21,175] Trial 245 finished with value: 0.3761555790264501 and parameters: {'n_estimators': 537, 'learning_rate': 0.06034506173817834, 'max_depth': 12, 'min_samples_split': 19, 'min_samples_leaf': 5, 'subsample': 0.6145563207066564, 'max_features': None}. Best is trial 75 with value: 0.3356123167576939.
[I 2024-12-04 12:18:22,191] Trial 247 finished with value: 0.3691831338401366 and parameters: {'n_estimators': 548, 'learning_rate': 0.03045856203209805, 'max_depth': 11, 'min_samples_split': 18, 'min_samples_leaf': 4, 'subsample': 0.7559426938495136, 'max_features': None}. Best is trial 75 with value: 0.3356123167576939.
[I 2024-12-04 12:18:22,303] Trial 243 finished with value: 0.3941838216894191 and parameters: {'n_estimators': 705, 'learning_rate': 0.03819102477520068, 'max_depth': 9, 'min_samples_split': 7, 'min_samples_leaf': 3, 'subsample': 0.8569742464057535, 'max_features': None}. Best is trial 75 with value: 0.3356123167576939.
[I 2024-12-04 12:18:22,304] Trial 251 finished with value: 0.38400714413121984 and parameters: {'n_estimators': 467, 'learning_rate': 0.042368115473644476, 'max_depth': 7, 'min_samples_split': 8, 'min_samples_leaf': 4, 'subsample': 0.971238754276681, 'max_features': None}. Best is trial 75 with value: 0.3356123167576939.
[I 2024-12-04 12:18:22,695] Trial 262 finished with value: 0.3910740805660151 and parameters: {'n_estimators': 175, 'learning_rate': 0.03134206264794708, 'max_depth': 11, 'min_samples_split': 3, 'min_samples_leaf': 2, 'subsample': 0.8357384013253476, 'max_features': None}. Best is trial 75 with value: 0.3356123167576939.
[I 2024-12-04 12:18:22,804] Trial 236 finished with value: 0.377301360836427 and parameters: {'n_estimators': 1160, 'learning_rate': 0.09598230584274417, 'max_depth': 11, 'min_samples_split': 15, 'min_samples_leaf': 2, 'subsample': 0.7700734537833787, 'max_features': 'log2'}. Best is trial 75 with value: 0.3356123167576939.
[I 2024-12-04 12:18:24,945] Trial 253 finished with value: 0.38498925208695234 and parameters: {'n_estimators': 529, 'learning_rate': 0.034670494037296044, 'max_depth': 9, 'min_samples_split': 15, 'min_samples_leaf': 1, 'subsample': 0.7410052679841537, 'max_features': None}. Best is trial 75 with value: 0.3356123167576939.
[I 2024-12-04 12:18:25,335] Trial 267 finished with value: 0.42966159442262003 and parameters: {'n_estimators': 107, 'learning_rate': 0.035131059162717984, 'max_depth': 10, 'min_samples_split': 20, 'min_samples_leaf': 2, 'subsample': 0.7343781752423136, 'max_features': None}. Best is trial 75 with value: 0.3356123167576939.
[I 2024-12-04 12:18:25,338] Trial 248 finished with value: 0.34158024286997135 and parameters: {'n_estimators': 709, 'learning_rate': 0.03433663772870042, 'max_depth': 12, 'min_samples_split': 10, 'min_samples_leaf': 2, 'subsample': 0.6536905784279182, 'max_features': None}. Best is trial 75 with value: 0.3356123167576939.
[I 2024-12-04 12:18:25,907] Trial 252 finished with value: 0.49847921014669316 and parameters: {'n_estimators': 725, 'learning_rate': 0.052835623288492686, 'max_depth': 10, 'min_samples_split': 3, 'min_samples_leaf': 4, 'subsample': 0.9527774371478421, 'max_features': 'log2'}. Best is trial 75 with value: 0.3356123167576939.
[I 2024-12-04 12:18:27,151] Trial 268 finished with value: 0.8351773761277412 and parameters: {'n_estimators': 266, 'learning_rate': 0.03916289994985871, 'max_depth': 7, 'min_samples_split': 10, 'min_samples_leaf': 8, 'subsample': 0.95263794677468, 'max_features': 'log2'}. Best is trial 75 with value: 0.3356123167576939.
[I 2024-12-04 12:18:27,787] Trial 256 finished with value: 0.42382489330804607 and parameters: {'n_estimators': 480, 'learning_rate': 0.01929035417691908, 'max_depth': 12, 'min_samples_split': 3, 'min_samples_leaf': 1, 'subsample': 0.8774385626458081, 'max_features': 'sqrt'}. Best is trial 75 with value: 0.3356123167576939.
[I 2024-12-04 12:18:28,170] Trial 259 finished with value: 0.41078476702030425 and parameters: {'n_estimators': 549, 'learning_rate': 0.02904538763760802, 'max_depth': 12, 'min_samples_split': 20, 'min_samples_leaf': 1, 'subsample': 0.6477815190364751, 'max_features': 'sqrt'}. Best is trial 75 with value: 0.3356123167576939.
[I 2024-12-04 12:18:29,323] Trial 250 finished with value: 0.3711507060930489 and parameters: {'n_estimators': 812, 'learning_rate': 0.01974983599643202, 'max_depth': 10, 'min_samples_split': 8, 'min_samples_leaf': 3, 'subsample': 0.6454256071380811, 'max_features': None}. Best is trial 75 with value: 0.3356123167576939.
[I 2024-12-04 12:18:29,451] Trial 237 finished with value: 0.33598547916338833 and parameters: {'n_estimators': 1058, 'learning_rate': 0.05534178070514366, 'max_depth': 9, 'min_samples_split': 7, 'min_samples_leaf': 2, 'subsample': 0.8369940396023511, 'max_features': None}. Best is trial 75 with value: 0.3356123167576939.
[I 2024-12-04 12:18:32,010] Trial 263 finished with value: 0.39631825946364224 and parameters: {'n_estimators': 480, 'learning_rate': 0.037383601980409784, 'max_depth': 11, 'min_samples_split': 7, 'min_samples_leaf': 1, 'subsample': 0.8361366732820245, 'max_features': None}. Best is trial 75 with value: 0.3356123167576939.
[I 2024-12-04 12:18:32,201] Trial 264 finished with value: 0.3917458716523413 and parameters: {'n_estimators': 498, 'learning_rate': 0.02054758904753595, 'max_depth': 10, 'min_samples_split': 4, 'min_samples_leaf': 5, 'subsample': 0.9157724614167118, 'max_features': None}. Best is trial 75 with value: 0.3356123167576939.
[I 2024-12-04 12:18:32,206] Trial 265 finished with value: 0.37371809486491864 and parameters: {'n_estimators': 430, 'learning_rate': 0.03629456009895016, 'max_depth': 6, 'min_samples_split': 3, 'min_samples_leaf': 2, 'subsample': 0.7648082052268296, 'max_features': None}. Best is trial 75 with value: 0.3356123167576939.
[I 2024-12-04 12:18:32,322] Trial 270 finished with value: 0.44695176431404926 and parameters: {'n_estimators': 459, 'learning_rate': 0.04148217642571636, 'max_depth': 8, 'min_samples_split': 3, 'min_samples_leaf': 3, 'subsample': 0.7608386989584957, 'max_features': 'sqrt'}. Best is trial 75 with value: 0.3356123167576939.
[I 2024-12-04 12:18:33,158] Trial 261 finished with value: 0.35810622155188765 and parameters: {'n_estimators': 637, 'learning_rate': 0.040230359792526205, 'max_depth': 11, 'min_samples_split': 5, 'min_samples_leaf': 2, 'subsample': 0.9073881947728684, 'max_features': None}. Best is trial 75 with value: 0.3356123167576939.
[I 2024-12-04 12:18:33,256] Trial 272 finished with value: 0.6164289750908014 and parameters: {'n_estimators': 449, 'learning_rate': 0.02191282935821408, 'max_depth': 11, 'min_samples_split': 2, 'min_samples_leaf': 3, 'subsample': 0.8526411374180523, 'max_features': 'log2'}. Best is trial 75 with value: 0.3356123167576939.
[I 2024-12-04 12:18:34,106] Trial 246 finished with value: 0.36266573707966365 and parameters: {'n_estimators': 1070, 'learning_rate': 0.027367843313165, 'max_depth': 12, 'min_samples_split': 14, 'min_samples_leaf': 3, 'subsample': 0.6365101978860758, 'max_features': None}. Best is trial 75 with value: 0.3356123167576939.
[I 2024-12-04 12:18:35,164] Trial 284 finished with value: 1.0331303424609595 and parameters: {'n_estimators': 106, 'learning_rate': 0.014819096067558487, 'max_depth': 10, 'min_samples_split': 14, 'min_samples_leaf': 5, 'subsample': 0.6441509783645281, 'max_features': 'log2'}. Best is trial 75 with value: 0.3356123167576939.
[I 2024-12-04 12:18:38,868] Trial 269 finished with value: 0.374538290822302 and parameters: {'n_estimators': 437, 'learning_rate': 0.056740587553671104, 'max_depth': 11, 'min_samples_split': 20, 'min_samples_leaf': 1, 'subsample': 0.8561129003997249, 'max_features': None}. Best is trial 75 with value: 0.3356123167576939.
[I 2024-12-04 12:18:40,724] Trial 257 finished with value: 0.3707650206155119 and parameters: {'n_estimators': 898, 'learning_rate': 0.07110142468958285, 'max_depth': 11, 'min_samples_split': 15, 'min_samples_leaf': 3, 'subsample': 0.7777284044294843, 'max_features': None}. Best is trial 75 with value: 0.3356123167576939.
