[I 2024-12-04 12:25:04,262] Trial 598 finished with value: 0.48125383739689265 and parameters: {'n_estimators': 1459, 'learning_rate': 0.04034283120183308, 'max_depth': 6, 'min_samples_split': 4, 'min_samples_leaf': 3, 'subsample': 0.7750164579463172, 'max_features': 'log2'}. Best is trial 428 with value: 0.31740361133065975.
[I 2024-12-04 12:25:04,813] Trial 604 finished with value: 0.3264577799667386 and parameters: {'n_estimators': 1128, 'learning_rate': 0.03853186390108047, 'max_depth': 8, 'min_samples_split': 4, 'min_samples_leaf': 2, 'subsample': 0.6252747827022875, 'max_features': None}. Best is trial 428 with value: 0.31740361133065975.
[I 2024-12-04 12:25:05,282] Trial 623 finished with value: 0.8643513652479117 and parameters: {'n_estimators': 497, 'learning_rate': 0.027197518485930435, 'max_depth': 7, 'min_samples_split': 4, 'min_samples_leaf': 10, 'subsample': 0.87812645896059, 'max_features': 'log2'}. Best is trial 428 with value: 0.31740361133065975.
[I 2024-12-04 12:25:06,751] Trial 609 finished with value: 0.3609161589407 and parameters: {'n_estimators': 1062, 'learning_rate': 0.047311085885646684, 'max_depth': 6, 'min_samples_split': 8, 'min_samples_leaf': 2, 'subsample': 0.8970490561582684, 'max_features': None}. Best is trial 428 with value: 0.31740361133065975.
[I 2024-12-04 12:25:09,559] Trial 597 finished with value: 0.39107270228432334 and parameters: {'n_estimators': 1477, 'learning_rate': 0.08047365638533537, 'max_depth': 7, 'min_samples_split': 7, 'min_samples_leaf': 1, 'subsample': 0.7897433074518015, 'max_features': None}. Best is trial 428 with value: 0.31740361133065975.
[I 2024-12-04 12:25:10,279] Trial 614 finished with value: 0.4578153889904633 and parameters: {'n_estimators': 1162, 'learning_rate': 0.032299083217403865, 'max_depth': 4, 'min_samples_split': 2, 'min_samples_leaf': 6, 'subsample': 0.9327099577413922, 'max_features': 'sqrt'}. Best is trial 428 with value: 0.31740361133065975.
[I 2024-12-04 12:25:11,078] Trial 621 finished with value: 0.5815487126454594 and parameters: {'n_estimators': 778, 'learning_rate': 0.054619945468714654, 'max_depth': 12, 'min_samples_split': 18, 'min_samples_leaf': 9, 'subsample': 0.9094265947416881, 'max_features': 'sqrt'}. Best is trial 428 with value: 0.31740361133065975.
[I 2024-12-04 12:25:12,217] Trial 630 finished with value: 0.45367558210931036 and parameters: {'n_estimators': 413, 'learning_rate': 0.03832971303655025, 'max_depth': 3, 'min_samples_split': 18, 'min_samples_leaf': 6, 'subsample': 0.7047338877883134, 'max_features': None}. Best is trial 428 with value: 0.31740361133065975.
[I 2024-12-04 12:25:12,222] Trial 602 finished with value: 0.35038040658378 and parameters: {'n_estimators': 1382, 'learning_rate': 0.05670281461606699, 'max_depth': 10, 'min_samples_split': 9, 'min_samples_leaf': 2, 'subsample': 0.6376347685159647, 'max_features': None}. Best is trial 428 with value: 0.31740361133065975.
[I 2024-12-04 12:25:13,089] Trial 612 finished with value: 0.4037133222102047 and parameters: {'n_estimators': 1124, 'learning_rate': 0.0728628862553211, 'max_depth': 5, 'min_samples_split': 5, 'min_samples_leaf': 1, 'subsample': 0.8943309954293418, 'max_features': None}. Best is trial 428 with value: 0.31740361133065975.
[I 2024-12-04 12:25:13,206] Trial 607 finished with value: 0.3803580561967851 and parameters: {'n_estimators': 1237, 'learning_rate': 0.06380975019563302, 'max_depth': 6, 'min_samples_split': 3, 'min_samples_leaf': 3, 'subsample': 0.9492589520634799, 'max_features': None}. Best is trial 428 with value: 0.31740361133065975.
[I 2024-12-04 12:25:13,975] Trial 606 finished with value: 0.38726456174288415 and parameters: {'n_estimators': 1377, 'learning_rate': 0.05469614023521221, 'max_depth': 5, 'min_samples_split': 5, 'min_samples_leaf': 5, 'subsample': 0.7485099763290234, 'max_features': None}. Best is trial 428 with value: 0.31740361133065975.
[I 2024-12-04 12:25:14,252] Trial 620 finished with value: 0.3281279793411102 and parameters: {'n_estimators': 989, 'learning_rate': 0.09453021337991051, 'max_depth': 5, 'min_samples_split': 3, 'min_samples_leaf': 2, 'subsample': 0.9626241832111241, 'max_features': None}. Best is trial 428 with value: 0.31740361133065975.
[I 2024-12-04 12:25:14,931] Trial 613 finished with value: 0.43029001805708444 and parameters: {'n_estimators': 1314, 'learning_rate': 0.058495891272281185, 'max_depth': 5, 'min_samples_split': 2, 'min_samples_leaf': 3, 'subsample': 0.7306077702880106, 'max_features': 'sqrt'}. Best is trial 428 with value: 0.31740361133065975.
[I 2024-12-04 12:25:15,937] Trial 617 finished with value: 0.38609429694867065 and parameters: {'n_estimators': 1062, 'learning_rate': 0.06300182309801751, 'max_depth': 9, 'min_samples_split': 5, 'min_samples_leaf': 3, 'subsample': 0.6722189432785378, 'max_features': None}. Best is trial 428 with value: 0.31740361133065975.
[I 2024-12-04 12:25:18,507] Trial 611 finished with value: 0.42025281744013987 and parameters: {'n_estimators': 1498, 'learning_rate': 0.08014391850158831, 'max_depth': 5, 'min_samples_split': 8, 'min_samples_leaf': 5, 'subsample': 0.6805917786884434, 'max_features': 'sqrt'}. Best is trial 428 with value: 0.31740361133065975.
[I 2024-12-04 12:25:19,807] Trial 633 finished with value: 0.9810672548485192 and parameters: {'n_estimators': 561, 'learning_rate': 0.011477970125659407, 'max_depth': 7, 'min_samples_split': 14, 'min_samples_leaf': 10, 'subsample': 0.6455495064986796, 'max_features': 'log2'}. Best is trial 428 with value: 0.31740361133065975.
[I 2024-12-04 12:25:19,946] Trial 605 finished with value: 0.37432884012288314 and parameters: {'n_estimators': 1471, 'learning_rate': 0.07070196906415531, 'max_depth': 10, 'min_samples_split': 6, 'min_samples_leaf': 1, 'subsample': 0.6350748721684534, 'max_features': None}. Best is trial 428 with value: 0.31740361133065975.
[I 2024-12-04 12:25:21,011] Trial 627 finished with value: 0.41342119605199495 and parameters: {'n_estimators': 841, 'learning_rate': 0.09326875437217384, 'max_depth': 5, 'min_samples_split': 5, 'min_samples_leaf': 2, 'subsample': 0.7180443255830364, 'max_features': 'log2'}. Best is trial 428 with value: 0.31740361133065975.
[I 2024-12-04 12:25:21,020] Trial 608 finished with value: 0.3280690063456055 and parameters: {'n_estimators': 1421, 'learning_rate': 0.04017756765669469, 'max_depth': 7, 'min_samples_split': 3, 'min_samples_leaf': 2, 'subsample': 0.6724181143507224, 'max_features': None}. Best is trial 428 with value: 0.31740361133065975.
[I 2024-12-04 12:25:21,249] Trial 610 finished with value: 0.40306937897103584 and parameters: {'n_estimators': 1470, 'learning_rate': 0.0442036516337344, 'max_depth': 5, 'min_samples_split': 2, 'min_samples_leaf': 3, 'subsample': 0.7657934844829686, 'max_features': None}. Best is trial 428 with value: 0.31740361133065975.
[I 2024-12-04 12:25:23,864] Trial 618 finished with value: 0.3768387409502338 and parameters: {'n_estimators': 1272, 'learning_rate': 0.06814767959942657, 'max_depth': 6, 'min_samples_split': 3, 'min_samples_leaf': 1, 'subsample': 0.711784104899677, 'max_features': None}. Best is trial 428 with value: 0.31740361133065975.
[I 2024-12-04 12:25:26,706] Trial 626 finished with value: 0.3260946057377089 and parameters: {'n_estimators': 955, 'learning_rate': 0.047036964422521484, 'max_depth': 8, 'min_samples_split': 8, 'min_samples_leaf': 2, 'subsample': 0.6296242733514816, 'max_features': None}. Best is trial 428 with value: 0.31740361133065975.
[I 2024-12-04 12:25:28,057] Trial 629 finished with value: 0.39065753620968624 and parameters: {'n_estimators': 903, 'learning_rate': 0.07615669458852159, 'max_depth': 6, 'min_samples_split': 8, 'min_samples_leaf': 1, 'subsample': 0.8116372653226785, 'max_features': None}. Best is trial 428 with value: 0.31740361133065975.
[I 2024-12-04 12:25:28,131] Trial 615 finished with value: 0.3963899176713353 and parameters: {'n_estimators': 1461, 'learning_rate': 0.042726027784756114, 'max_depth': 7, 'min_samples_split': 3, 'min_samples_leaf': 3, 'subsample': 0.7983094639945906, 'max_features': None}. Best is trial 428 with value: 0.31740361133065975.
[I 2024-12-04 12:25:30,562] Trial 622 finished with value: 0.3249329919225154 and parameters: {'n_estimators': 1266, 'learning_rate': 0.08974713200774836, 'max_depth': 7, 'min_samples_split': 6, 'min_samples_leaf': 2, 'subsample': 0.7058167169111528, 'max_features': None}. Best is trial 428 with value: 0.31740361133065975.
[I 2024-12-04 12:25:31,618] Trial 639 finished with value: 0.616821618813438 and parameters: {'n_estimators': 712, 'learning_rate': 0.018959542034892255, 'max_depth': 10, 'min_samples_split': 3, 'min_samples_leaf': 8, 'subsample': 0.7157528922252318, 'max_features': 'sqrt'}. Best is trial 428 with value: 0.31740361133065975.
[I 2024-12-04 12:25:32,474] Trial 632 finished with value: 0.4247601737773101 and parameters: {'n_estimators': 961, 'learning_rate': 0.09919087840416006, 'max_depth': 5, 'min_samples_split': 2, 'min_samples_leaf': 1, 'subsample': 0.8170166724901284, 'max_features': None}. Best is trial 428 with value: 0.31740361133065975.
[I 2024-12-04 12:25:38,109] Trial 634 finished with value: 0.404131112690253 and parameters: {'n_estimators': 1271, 'learning_rate': 0.09731871978463029, 'max_depth': 6, 'min_samples_split': 7, 'min_samples_leaf': 1, 'subsample': 0.863641164248732, 'max_features': 'log2'}. Best is trial 428 with value: 0.31740361133065975.
[I 2024-12-04 12:25:38,160] Trial 638 finished with value: 0.34057488625469545 and parameters: {'n_estimators': 887, 'learning_rate': 0.05759558286737509, 'max_depth': 10, 'min_samples_split': 3, 'min_samples_leaf': 2, 'subsample': 0.6735216135956739, 'max_features': None}. Best is trial 428 with value: 0.31740361133065975.
[I 2024-12-04 12:25:38,656] Trial 624 finished with value: 0.38418285316204825 and parameters: {'n_estimators': 1476, 'learning_rate': 0.05638421585766108, 'max_depth': 6, 'min_samples_split': 2, 'min_samples_leaf': 3, 'subsample': 0.6104144016812788, 'max_features': None}. Best is trial 428 with value: 0.31740361133065975.
[I 2024-12-04 12:25:41,447] Trial 647 finished with value: 0.3315210748125134 and parameters: {'n_estimators': 638, 'learning_rate': 0.08587715738777506, 'max_depth': 6, 'min_samples_split': 4, 'min_samples_leaf': 2, 'subsample': 0.9831616774650288, 'max_features': None}. Best is trial 428 with value: 0.31740361133065975.
[I 2024-12-04 12:25:43,082] Trial 645 finished with value: 0.42995281162486965 and parameters: {'n_estimators': 698, 'learning_rate': 0.07848485387719424, 'max_depth': 5, 'min_samples_split': 4, 'min_samples_leaf': 1, 'subsample': 0.9920944072391016, 'max_features': None}. Best is trial 428 with value: 0.31740361133065975.
[I 2024-12-04 12:25:43,903] Trial 625 finished with value: 0.3915561877162707 and parameters: {'n_estimators': 1496, 'learning_rate': 0.06366130496496089, 'max_depth': 8, 'min_samples_split': 2, 'min_samples_leaf': 1, 'subsample': 0.7824535243607047, 'max_features': None}. Best is trial 428 with value: 0.31740361133065975.
[I 2024-12-04 12:25:44,320] Trial 631 finished with value: 0.3981890965378966 and parameters: {'n_estimators': 1328, 'learning_rate': 0.07199653995998606, 'max_depth': 7, 'min_samples_split': 2, 'min_samples_leaf': 1, 'subsample': 0.7916642850001221, 'max_features': None}. Best is trial 428 with value: 0.31740361133065975.
[I 2024-12-04 12:25:45,288] Trial 636 finished with value: 0.3939791879953723 and parameters: {'n_estimators': 1124, 'learning_rate': 0.029867330315010494, 'max_depth': 7, 'min_samples_split': 2, 'min_samples_leaf': 3, 'subsample': 0.668487762782919, 'max_features': None}. Best is trial 428 with value: 0.31740361133065975.
[I 2024-12-04 12:25:46,268] Trial 628 finished with value: 0.33328483715133933 and parameters: {'n_estimators': 1500, 'learning_rate': 0.08850276152935843, 'max_depth': 7, 'min_samples_split': 5, 'min_samples_leaf': 2, 'subsample': 0.6633572410565881, 'max_features': None}. Best is trial 428 with value: 0.31740361133065975.
[I 2024-12-04 12:25:47,373] Trial 637 finished with value: 0.32729341580005344 and parameters: {'n_estimators': 1153, 'learning_rate': 0.033448710502231076, 'max_depth': 9, 'min_samples_split': 4, 'min_samples_leaf': 2, 'subsample': 0.624525074721067, 'max_features': None}. Best is trial 428 with value: 0.31740361133065975.
[I 2024-12-04 12:25:47,827] Trial 650 finished with value: 0.6302207991326114 and parameters: {'n_estimators': 726, 'learning_rate': 0.09824991191877158, 'max_depth': 3, 'min_samples_split': 17, 'min_samples_leaf': 8, 'subsample': 0.8146774293633017, 'max_features': 'log2'}. Best is trial 428 with value: 0.31740361133065975.
[I 2024-12-04 12:25:51,052] Trial 635 finished with value: 0.359493725198622 and parameters: {'n_estimators': 1391, 'learning_rate': 0.0657741852835915, 'max_depth': 3, 'min_samples_split': 3, 'min_samples_leaf': 2, 'subsample': 0.8288877788260305, 'max_features': None}. Best is trial 428 with value: 0.31740361133065975.
[I 2024-12-04 12:25:52,419] Trial 640 finished with value: 0.4545581224511899 and parameters: {'n_estimators': 1362, 'learning_rate': 0.017669914960451123, 'max_depth': 7, 'min_samples_split': 10, 'min_samples_leaf': 5, 'subsample': 0.8961812511115117, 'max_features': 'sqrt'}. Best is trial 428 with value: 0.31740361133065975.
[I 2024-12-04 12:25:52,824] Trial 642 finished with value: 0.5510987458165286 and parameters: {'n_estimators': 1266, 'learning_rate': 0.06178142927806538, 'max_depth': 3, 'min_samples_split': 2, 'min_samples_leaf': 8, 'subsample': 0.8630769392899789, 'max_features': 'log2'}. Best is trial 428 with value: 0.31740361133065975.
[I 2024-12-04 12:25:55,635] Trial 653 finished with value: 0.3478142171455273 and parameters: {'n_estimators': 822, 'learning_rate': 0.04028355311587134, 'max_depth': 8, 'min_samples_split': 13, 'min_samples_leaf': 2, 'subsample': 0.6068199628523605, 'max_features': None}. Best is trial 428 with value: 0.31740361133065975.
[I 2024-12-04 12:25:56,187] Trial 646 finished with value: 0.8806314088871856 and parameters: {'n_estimators': 1206, 'learning_rate': 0.011377466792459406, 'max_depth': 10, 'min_samples_split': 13, 'min_samples_leaf': 9, 'subsample': 0.6869154022652496, 'max_features': 'log2'}. Best is trial 428 with value: 0.31740361133065975.
[I 2024-12-04 12:25:56,719] Trial 643 finished with value: 0.3829833516259034 and parameters: {'n_estimators': 1190, 'learning_rate': 0.03744834573521413, 'max_depth': 7, 'min_samples_split': 4, 'min_samples_leaf': 3, 'subsample': 0.6111011217722156, 'max_features': None}. Best is trial 428 with value: 0.31740361133065975.
[I 2024-12-04 12:25:56,968] Trial 641 finished with value: 0.4127888459692435 and parameters: {'n_estimators': 1457, 'learning_rate': 0.04468549179173579, 'max_depth': 9, 'min_samples_split': 2, 'min_samples_leaf': 3, 'subsample': 0.8497802955023369, 'max_features': 'sqrt'}. Best is trial 428 with value: 0.31740361133065975.
[I 2024-12-04 12:26:00,094] Trial 657 finished with value: 0.43944855202625177 and parameters: {'n_estimators': 931, 'learning_rate': 0.06942006540166458, 'max_depth': 3, 'min_samples_split': 6, 'min_samples_leaf': 3, 'subsample': 0.9816292509599149, 'max_features': None}. Best is trial 428 with value: 0.31740361133065975.
[I 2024-12-04 12:26:00,169] Trial 651 finished with value: 0.4614634592100294 and parameters: {'n_estimators': 1154, 'learning_rate': 0.023917285818523627, 'max_depth': 9, 'min_samples_split': 3, 'min_samples_leaf': 2, 'subsample': 0.6775536511954199, 'max_features': 'log2'}. Best is trial 428 with value: 0.31740361133065975.
[I 2024-12-04 12:26:02,591] Trial 649 finished with value: 0.33061045000390854 and parameters: {'n_estimators': 1188, 'learning_rate': 0.05221937171387292, 'max_depth': 6, 'min_samples_split': 5, 'min_samples_leaf': 2, 'subsample': 0.6713062877264774, 'max_features': None}. Best is trial 428 with value: 0.31740361133065975.
[I 2024-12-04 12:26:06,858] Trial 644 finished with value: 0.3797752669699885 and parameters: {'n_estimators': 1387, 'learning_rate': 0.08542797574435179, 'max_depth': 7, 'min_samples_split': 6, 'min_samples_leaf': 3, 'subsample': 0.9260996086374461, 'max_features': None}. Best is trial 428 with value: 0.31740361133065975.
[I 2024-12-04 12:26:07,998] Trial 648 finished with value: 0.33705599560947863 and parameters: {'n_estimators': 1382, 'learning_rate': 0.03289999245531069, 'max_depth': 8, 'min_samples_split': 7, 'min_samples_leaf': 2, 'subsample': 0.6539110365844342, 'max_features': None}. Best is trial 428 with value: 0.31740361133065975.
[I 2024-12-04 12:26:10,095] Trial 654 finished with value: 0.4432179981009153 and parameters: {'n_estimators': 1490, 'learning_rate': 0.08607755237589314, 'max_depth': 6, 'min_samples_split': 10, 'min_samples_leaf': 3, 'subsample': 0.7028568802037302, 'max_features': 'log2'}. Best is trial 428 with value: 0.31740361133065975.
[I 2024-12-04 12:26:11,182] Trial 655 finished with value: 0.4122195453743811 and parameters: {'n_estimators': 1487, 'learning_rate': 0.06862271280554519, 'max_depth': 8, 'min_samples_split': 2, 'min_samples_leaf': 2, 'subsample': 0.7458643693995299, 'max_features': 'log2'}. Best is trial 428 with value: 0.31740361133065975.
[I 2024-12-04 12:26:12,919] Trial 652 finished with value: 0.3419067378991589 and parameters: {'n_estimators': 1484, 'learning_rate': 0.054193793133912045, 'max_depth': 4, 'min_samples_split': 2, 'min_samples_leaf': 2, 'subsample': 0.7065279633568173, 'max_features': None}. Best is trial 428 with value: 0.31740361133065975.
[I 2024-12-04 12:26:15,054] Trial 669 finished with value: 0.4405316235285347 and parameters: {'n_estimators': 972, 'learning_rate': 0.08068411063334968, 'max_depth': 6, 'min_samples_split': 2, 'min_samples_leaf': 2, 'subsample': 0.9534692138076225, 'max_features': 'log2'}. Best is trial 428 with value: 0.31740361133065975.
[I 2024-12-04 12:26:15,358] Trial 668 finished with value: 0.38670406521987416 and parameters: {'n_estimators': 860, 'learning_rate': 0.044510194482746436, 'max_depth': 8, 'min_samples_split': 6, 'min_samples_leaf': 3, 'subsample': 0.6202489780970234, 'max_features': None}. Best is trial 428 with value: 0.31740361133065975.
[I 2024-12-04 12:26:15,725] Trial 656 finished with value: 0.553414446252173 and parameters: {'n_estimators': 1335, 'learning_rate': 0.04776710269253729, 'max_depth': 11, 'min_samples_split': 16, 'min_samples_leaf': 10, 'subsample': 0.8571470926788626, 'max_features': None}. Best is trial 428 with value: 0.31740361133065975.
[I 2024-12-04 12:26:16,688] Trial 663 finished with value: 0.341765128605463 and parameters: {'n_estimators': 1082, 'learning_rate': 0.07637320768939017, 'max_depth': 4, 'min_samples_split': 4, 'min_samples_leaf': 2, 'subsample': 0.9361800962633052, 'max_features': None}. Best is trial 428 with value: 0.31740361133065975.
[I 2024-12-04 12:26:17,502] Trial 660 finished with value: 0.3339624470879013 and parameters: {'n_estimators': 1345, 'learning_rate': 0.08961079883073858, 'max_depth': 5, 'min_samples_split': 7, 'min_samples_leaf': 2, 'subsample': 0.7086189285783667, 'max_features': None}. Best is trial 428 with value: 0.31740361133065975.
[I 2024-12-04 12:26:17,723] Trial 661 finished with value: 0.3914459544215131 and parameters: {'n_estimators': 1494, 'learning_rate': 0.04118743033356035, 'max_depth': 8, 'min_samples_split': 12, 'min_samples_leaf': 1, 'subsample': 0.7973426465151142, 'max_features': 'log2'}. Best is trial 428 with value: 0.31740361133065975.
[I 2024-12-04 12:26:18,529] Trial 667 finished with value: 0.3888788166743022 and parameters: {'n_estimators': 1016, 'learning_rate': 0.08957222503580349, 'max_depth': 5, 'min_samples_split': 3, 'min_samples_leaf': 5, 'subsample': 0.6733569936677503, 'max_features': None}. Best is trial 428 with value: 0.31740361133065975.
[I 2024-12-04 12:26:18,865] Trial 662 finished with value: 0.41748616370713776 and parameters: {'n_estimators': 1296, 'learning_rate': 0.08815894227273482, 'max_depth': 5, 'min_samples_split': 2, 'min_samples_leaf': 1, 'subsample': 0.9747388570518727, 'max_features': None}. Best is trial 428 with value: 0.31740361133065975.
[I 2024-12-04 12:26:19,490] Trial 665 finished with value: 0.38225715182738573 and parameters: {'n_estimators': 1102, 'learning_rate': 0.09062888971846389, 'max_depth': 6, 'min_samples_split': 6, 'min_samples_leaf': 3, 'subsample': 0.9523560545275468, 'max_features': None}. Best is trial 428 with value: 0.31740361133065975.
[I 2024-12-04 12:26:19,668] Trial 683 finished with value: 0.5543705810086276 and parameters: {'n_estimators': 432, 'learning_rate': 0.03319252776261877, 'max_depth': 10, 'min_samples_split': 4, 'min_samples_leaf': 9, 'subsample': 0.7696751707072893, 'max_features': None}. Best is trial 428 with value: 0.31740361133065975.
[I 2024-12-04 12:26:20,910] Trial 659 finished with value: 0.32845455229295323 and parameters: {'n_estimators': 1473, 'learning_rate': 0.05912369570650087, 'max_depth': 8, 'min_samples_split': 9, 'min_samples_leaf': 2, 'subsample': 0.6074798079805528, 'max_features': None}. Best is trial 428 with value: 0.31740361133065975.
[I 2024-12-04 12:26:20,963] Trial 664 finished with value: 0.4030959001237138 and parameters: {'n_estimators': 1075, 'learning_rate': 0.09391007950840803, 'max_depth': 7, 'min_samples_split': 5, 'min_samples_leaf': 1, 'subsample': 0.9302350818725506, 'max_features': None}. Best is trial 428 with value: 0.31740361133065975.
[I 2024-12-04 12:26:22,113] Trial 666 finished with value: 0.3926805279433853 and parameters: {'n_estimators': 1115, 'learning_rate': 0.041608863197329496, 'max_depth': 8, 'min_samples_split': 6, 'min_samples_leaf': 1, 'subsample': 0.6799755354984216, 'max_features': None}. Best is trial 428 with value: 0.31740361133065975.
