[I 2024-12-04 15:46:40,861] Trial 2368 finished with value: 1.0129073316329424 and parameters: {'n_estimators': 601, 'max_depth': 6, 'min_samples_split': 6, 'min_samples_leaf': 8, 'max_features': 'sqrt', 'bootstrap': True, 'criterion': 'squared_error'}. Best is trial 1025 with value: 0.41844370194907604.
[I 2024-12-04 15:46:40,920] Trial 2365 finished with value: 0.7025055369399333 and parameters: {'n_estimators': 756, 'max_depth': 32, 'min_samples_split': 4, 'min_samples_leaf': 2, 'max_features': 'sqrt', 'bootstrap': True, 'criterion': 'squared_error'}. Best is trial 1025 with value: 0.41844370194907604.
[I 2024-12-04 15:46:43,370] Trial 2360 finished with value: 0.4653197577076136 and parameters: {'n_estimators': 817, 'max_depth': 34, 'min_samples_split': 2, 'min_samples_leaf': 2, 'max_features': None, 'bootstrap': True, 'criterion': 'squared_error'}. Best is trial 1025 with value: 0.41844370194907604.
[I 2024-12-04 15:46:44,211] Trial 2362 finished with value: 0.46541116696643137 and parameters: {'n_estimators': 811, 'max_depth': 32, 'min_samples_split': 4, 'min_samples_leaf': 2, 'max_features': None, 'bootstrap': True, 'criterion': 'squared_error'}. Best is trial 1025 with value: 0.41844370194907604.
[I 2024-12-04 15:46:49,082] Trial 2359 finished with value: 0.4240590685026478 and parameters: {'n_estimators': 793, 'max_depth': 37, 'min_samples_split': 3, 'min_samples_leaf': 1, 'max_features': None, 'bootstrap': True, 'criterion': 'squared_error'}. Best is trial 1025 with value: 0.41844370194907604.
[I 2024-12-04 15:46:52,795] Trial 2361 finished with value: 0.509512044393071 and parameters: {'n_estimators': 964, 'max_depth': 34, 'min_samples_split': 4, 'min_samples_leaf': 1, 'max_features': None, 'bootstrap': False, 'criterion': 'squared_error'}. Best is trial 1025 with value: 0.41844370194907604.
[I 2024-12-04 15:46:53,531] Trial 2363 finished with value: 0.43917511618525595 and parameters: {'n_estimators': 877, 'max_depth': 42, 'min_samples_split': 8, 'min_samples_leaf': 1, 'max_features': None, 'bootstrap': True, 'criterion': 'squared_error'}. Best is trial 1025 with value: 0.41844370194907604.
[I 2024-12-04 15:46:59,730] Trial 2370 finished with value: 0.42105924591900035 and parameters: {'n_estimators': 826, 'max_depth': 32, 'min_samples_split': 2, 'min_samples_leaf': 1, 'max_features': None, 'bootstrap': True, 'criterion': 'squared_error'}. Best is trial 1025 with value: 0.41844370194907604.
[I 2024-12-04 15:47:01,343] Trial 2367 finished with value: 0.4192826152423805 and parameters: {'n_estimators': 778, 'max_depth': 41, 'min_samples_split': 2, 'min_samples_leaf': 1, 'max_features': None, 'bootstrap': True, 'criterion': 'squared_error'}. Best is trial 1025 with value: 0.41844370194907604.
[I 2024-12-04 15:47:01,411] Trial 2381 finished with value: 1.05045961719407 and parameters: {'n_estimators': 249, 'max_depth': 7, 'min_samples_split': 2, 'min_samples_leaf': 6, 'max_features': 'log2', 'bootstrap': True, 'criterion': 'absolute_error'}. Best is trial 1025 with value: 0.41844370194907604.
[I 2024-12-04 15:47:01,503] Trial 2377 finished with value: 0.9603314329379691 and parameters: {'n_estimators': 474, 'max_depth': 26, 'min_samples_split': 7, 'min_samples_leaf': 2, 'max_features': 'log2', 'bootstrap': True, 'criterion': 'absolute_error'}. Best is trial 1025 with value: 0.41844370194907604.
[I 2024-12-04 15:47:06,616] Trial 2388 finished with value: 0.974223324851029 and parameters: {'n_estimators': 323, 'max_depth': 47, 'min_samples_split': 2, 'min_samples_leaf': 3, 'max_features': 'log2', 'bootstrap': False, 'criterion': 'squared_error'}. Best is trial 1025 with value: 0.41844370194907604.
[I 2024-12-04 15:47:07,579] Trial 2335 finished with value: 0.4329935603144344 and parameters: {'n_estimators': 624, 'max_depth': 35, 'min_samples_split': 2, 'min_samples_leaf': 1, 'max_features': None, 'bootstrap': True, 'criterion': 'absolute_error'}. Best is trial 1025 with value: 0.41844370194907604.
[I 2024-12-04 15:47:07,847] Trial 2373 finished with value: 0.7032628926221808 and parameters: {'n_estimators': 580, 'max_depth': 12, 'min_samples_split': 5, 'min_samples_leaf': 15, 'max_features': None, 'bootstrap': True, 'criterion': 'absolute_error'}. Best is trial 1025 with value: 0.41844370194907604.
[I 2024-12-04 15:47:11,574] Trial 2366 finished with value: 0.47256984820938663 and parameters: {'n_estimators': 415, 'max_depth': 22, 'min_samples_split': 8, 'min_samples_leaf': 2, 'max_features': None, 'bootstrap': True, 'criterion': 'absolute_error'}. Best is trial 1025 with value: 0.41844370194907604.
[I 2024-12-04 15:47:12,028] Trial 2375 finished with value: 0.46465118195948296 and parameters: {'n_estimators': 724, 'max_depth': 37, 'min_samples_split': 2, 'min_samples_leaf': 2, 'max_features': None, 'bootstrap': True, 'criterion': 'squared_error'}. Best is trial 1025 with value: 0.41844370194907604.
[I 2024-12-04 15:47:13,722] Trial 2380 finished with value: 0.4653594860103645 and parameters: {'n_estimators': 771, 'max_depth': 39, 'min_samples_split': 4, 'min_samples_leaf': 2, 'max_features': None, 'bootstrap': True, 'criterion': 'squared_error'}. Best is trial 1025 with value: 0.41844370194907604.
[I 2024-12-04 15:47:14,638] Trial 2376 finished with value: 0.43033331111638806 and parameters: {'n_estimators': 840, 'max_depth': 45, 'min_samples_split': 4, 'min_samples_leaf': 1, 'max_features': None, 'bootstrap': True, 'criterion': 'squared_error'}. Best is trial 1025 with value: 0.41844370194907604.
[I 2024-12-04 15:47:15,374] Trial 2350 finished with value: 0.4606644425285828 and parameters: {'n_estimators': 767, 'max_depth': 36, 'min_samples_split': 2, 'min_samples_leaf': 2, 'max_features': None, 'bootstrap': True, 'criterion': 'absolute_error'}. Best is trial 1025 with value: 0.41844370194907604.
[I 2024-12-04 15:47:15,404] Trial 2379 finished with value: 0.42072101705636045 and parameters: {'n_estimators': 584, 'max_depth': 41, 'min_samples_split': 2, 'min_samples_leaf': 1, 'max_features': None, 'bootstrap': True, 'criterion': 'squared_error'}. Best is trial 1025 with value: 0.41844370194907604.
[I 2024-12-04 15:47:15,870] Trial 2374 finished with value: 0.4238379129898836 and parameters: {'n_estimators': 825, 'max_depth': 45, 'min_samples_split': 3, 'min_samples_leaf': 1, 'max_features': None, 'bootstrap': True, 'criterion': 'squared_error'}. Best is trial 1025 with value: 0.41844370194907604.
[I 2024-12-04 15:47:16,399] Trial 2386 finished with value: 0.5106692292767346 and parameters: {'n_estimators': 765, 'max_depth': 45, 'min_samples_split': 3, 'min_samples_leaf': 1, 'max_features': None, 'bootstrap': False, 'criterion': 'squared_error'}. Best is trial 1025 with value: 0.41844370194907604.
[I 2024-12-04 15:47:16,747] Trial 2372 finished with value: 0.4317998657157018 and parameters: {'n_estimators': 820, 'max_depth': 44, 'min_samples_split': 4, 'min_samples_leaf': 1, 'max_features': None, 'bootstrap': True, 'criterion': 'squared_error'}. Best is trial 1025 with value: 0.41844370194907604.
[I 2024-12-04 15:47:18,142] Trial 2371 finished with value: 0.42163664278303725 and parameters: {'n_estimators': 804, 'max_depth': 42, 'min_samples_split': 2, 'min_samples_leaf': 1, 'max_features': None, 'bootstrap': True, 'criterion': 'squared_error'}. Best is trial 1025 with value: 0.41844370194907604.
[I 2024-12-04 15:47:20,728] Trial 2378 finished with value: 0.4193631827937477 and parameters: {'n_estimators': 772, 'max_depth': 41, 'min_samples_split': 2, 'min_samples_leaf': 1, 'max_features': None, 'bootstrap': True, 'criterion': 'squared_error'}. Best is trial 1025 with value: 0.41844370194907604.
[I 2024-12-04 15:47:20,932] Trial 2387 finished with value: 0.423886325725633 and parameters: {'n_estimators': 573, 'max_depth': 35, 'min_samples_split': 2, 'min_samples_leaf': 1, 'max_features': None, 'bootstrap': True, 'criterion': 'squared_error'}. Best is trial 1025 with value: 0.41844370194907604.
[I 2024-12-04 15:47:22,094] Trial 2382 finished with value: 0.42134608097075027 and parameters: {'n_estimators': 773, 'max_depth': 35, 'min_samples_split': 2, 'min_samples_leaf': 1, 'max_features': None, 'bootstrap': True, 'criterion': 'squared_error'}. Best is trial 1025 with value: 0.41844370194907604.
[I 2024-12-04 15:47:22,743] Trial 2383 finished with value: 0.4214294938985623 and parameters: {'n_estimators': 595, 'max_depth': 31, 'min_samples_split': 2, 'min_samples_leaf': 1, 'max_features': None, 'bootstrap': True, 'criterion': 'squared_error'}. Best is trial 1025 with value: 0.41844370194907604.
[I 2024-12-04 15:47:24,340] Trial 2385 finished with value: 0.4206465416816983 and parameters: {'n_estimators': 883, 'max_depth': 48, 'min_samples_split': 2, 'min_samples_leaf': 1, 'max_features': None, 'bootstrap': True, 'criterion': 'squared_error'}. Best is trial 1025 with value: 0.41844370194907604.
[I 2024-12-04 15:47:25,159] Trial 2393 finished with value: 0.4323443043149317 and parameters: {'n_estimators': 689, 'max_depth': 36, 'min_samples_split': 4, 'min_samples_leaf': 1, 'max_features': None, 'bootstrap': True, 'criterion': 'squared_error'}. Best is trial 1025 with value: 0.41844370194907604.
[I 2024-12-04 15:47:25,999] Trial 2392 finished with value: 0.43193043100816925 and parameters: {'n_estimators': 685, 'max_depth': 40, 'min_samples_split': 4, 'min_samples_leaf': 1, 'max_features': None, 'bootstrap': True, 'criterion': 'squared_error'}. Best is trial 1025 with value: 0.41844370194907604.
[I 2024-12-04 15:47:27,921] Trial 2389 finished with value: 0.42080901382211555 and parameters: {'n_estimators': 886, 'max_depth': 36, 'min_samples_split': 2, 'min_samples_leaf': 1, 'max_features': None, 'bootstrap': True, 'criterion': 'squared_error'}. Best is trial 1025 with value: 0.41844370194907604.
[I 2024-12-04 15:47:28,341] Trial 2390 finished with value: 0.4203263854911365 and parameters: {'n_estimators': 710, 'max_depth': 36, 'min_samples_split': 2, 'min_samples_leaf': 1, 'max_features': None, 'bootstrap': True, 'criterion': 'squared_error'}. Best is trial 1025 with value: 0.41844370194907604.
[I 2024-12-04 15:47:32,860] Trial 2395 finished with value: 0.4214264961297093 and parameters: {'n_estimators': 778, 'max_depth': 42, 'min_samples_split': 2, 'min_samples_leaf': 1, 'max_features': None, 'bootstrap': True, 'criterion': 'squared_error'}. Best is trial 1025 with value: 0.41844370194907604.
[I 2024-12-04 15:47:34,188] Trial 2391 finished with value: 0.464911603500544 and parameters: {'n_estimators': 743, 'max_depth': 41, 'min_samples_split': 2, 'min_samples_leaf': 2, 'max_features': None, 'bootstrap': True, 'criterion': 'squared_error'}. Best is trial 1025 with value: 0.41844370194907604.
[I 2024-12-04 15:47:35,431] Trial 2394 finished with value: 0.4646422411901477 and parameters: {'n_estimators': 726, 'max_depth': 44, 'min_samples_split': 2, 'min_samples_leaf': 2, 'max_features': None, 'bootstrap': True, 'criterion': 'squared_error'}. Best is trial 1025 with value: 0.41844370194907604.
[I 2024-12-04 15:47:40,327] Trial 2402 finished with value: 0.9567868655598976 and parameters: {'n_estimators': 971, 'max_depth': 26, 'min_samples_split': 2, 'min_samples_leaf': 2, 'max_features': 'log2', 'bootstrap': True, 'criterion': 'squared_error'}. Best is trial 1025 with value: 0.41844370194907604.
[I 2024-12-04 15:47:41,196] Trial 2399 finished with value: 0.46520206312388146 and parameters: {'n_estimators': 914, 'max_depth': 45, 'min_samples_split': 4, 'min_samples_leaf': 2, 'max_features': None, 'bootstrap': True, 'criterion': 'squared_error'}. Best is trial 1025 with value: 0.41844370194907604.
[I 2024-12-04 15:47:41,197] Trial 2357 finished with value: 0.4285441044867661 and parameters: {'n_estimators': 678, 'max_depth': 42, 'min_samples_split': 2, 'min_samples_leaf': 1, 'max_features': None, 'bootstrap': True, 'criterion': 'absolute_error'}. Best is trial 1025 with value: 0.41844370194907604.
[I 2024-12-04 15:47:43,302] Trial 2396 finished with value: 0.4239915505240825 and parameters: {'n_estimators': 821, 'max_depth': 37, 'min_samples_split': 3, 'min_samples_leaf': 1, 'max_features': None, 'bootstrap': True, 'criterion': 'squared_error'}. Best is trial 1025 with value: 0.41844370194907604.
[I 2024-12-04 15:47:45,250] Trial 2397 finished with value: 0.42125832403733465 and parameters: {'n_estimators': 904, 'max_depth': 33, 'min_samples_split': 2, 'min_samples_leaf': 1, 'max_features': None, 'bootstrap': True, 'criterion': 'squared_error'}. Best is trial 1025 with value: 0.41844370194907604.
[I 2024-12-04 15:47:45,773] Trial 2400 finished with value: 0.46487118120489274 and parameters: {'n_estimators': 899, 'max_depth': 35, 'min_samples_split': 2, 'min_samples_leaf': 2, 'max_features': None, 'bootstrap': True, 'criterion': 'squared_error'}. Best is trial 1025 with value: 0.41844370194907604.
[I 2024-12-04 15:47:45,900] Trial 2398 finished with value: 0.42111633888501854 and parameters: {'n_estimators': 862, 'max_depth': 42, 'min_samples_split': 2, 'min_samples_leaf': 1, 'max_features': None, 'bootstrap': True, 'criterion': 'squared_error'}. Best is trial 1025 with value: 0.41844370194907604.
[I 2024-12-04 15:47:47,751] Trial 2406 finished with value: 0.5083584144169769 and parameters: {'n_estimators': 657, 'max_depth': 31, 'min_samples_split': 4, 'min_samples_leaf': 1, 'max_features': None, 'bootstrap': False, 'criterion': 'squared_error'}. Best is trial 1025 with value: 0.41844370194907604.
[I 2024-12-04 15:47:48,913] Trial 2408 finished with value: 0.5328406164283748 and parameters: {'n_estimators': 934, 'max_depth': 41, 'min_samples_split': 11, 'min_samples_leaf': 1, 'max_features': 'sqrt', 'bootstrap': False, 'criterion': 'squared_error'}. Best is trial 1025 with value: 0.41844370194907604.
[I 2024-12-04 15:47:52,625] Trial 2401 finished with value: 0.42231767042356955 and parameters: {'n_estimators': 736, 'max_depth': 50, 'min_samples_split': 2, 'min_samples_leaf': 1, 'max_features': None, 'bootstrap': True, 'criterion': 'squared_error'}. Best is trial 1025 with value: 0.41844370194907604.
[I 2024-12-04 15:47:55,081] Trial 2404 finished with value: 0.4193470730880397 and parameters: {'n_estimators': 700, 'max_depth': 41, 'min_samples_split': 2, 'min_samples_leaf': 1, 'max_features': None, 'bootstrap': True, 'criterion': 'squared_error'}. Best is trial 1025 with value: 0.41844370194907604.
[I 2024-12-04 15:47:55,614] Trial 2407 finished with value: 0.4211713474327039 and parameters: {'n_estimators': 750, 'max_depth': 34, 'min_samples_split': 2, 'min_samples_leaf': 1, 'max_features': None, 'bootstrap': True, 'criterion': 'squared_error'}. Best is trial 1025 with value: 0.41844370194907604.
[I 2024-12-04 15:47:57,284] Trial 2418 finished with value: 0.7113106439471704 and parameters: {'n_estimators': 828, 'max_depth': 8, 'min_samples_split': 5, 'min_samples_leaf': 1, 'max_features': None, 'bootstrap': False, 'criterion': 'squared_error'}. Best is trial 1025 with value: 0.41844370194907604.
[I 2024-12-04 15:47:58,944] Trial 2403 finished with value: 0.4312864540536815 and parameters: {'n_estimators': 746, 'max_depth': 37, 'min_samples_split': 4, 'min_samples_leaf': 1, 'max_features': None, 'bootstrap': True, 'criterion': 'squared_error'}. Best is trial 1025 with value: 0.41844370194907604.
[I 2024-12-04 15:48:00,138] Trial 2424 finished with value: 0.6327236305405806 and parameters: {'n_estimators': 274, 'max_depth': 28, 'min_samples_split': 5, 'min_samples_leaf': 5, 'max_features': None, 'bootstrap': False, 'criterion': 'squared_error'}. Best is trial 1025 with value: 0.41844370194907604.
[I 2024-12-04 15:48:01,207] Trial 2420 finished with value: 1.054582685332931 and parameters: {'n_estimators': 989, 'max_depth': 28, 'min_samples_split': 50, 'min_samples_leaf': 5, 'max_features': 'log2', 'bootstrap': True, 'criterion': 'squared_error'}. Best is trial 1025 with value: 0.41844370194907604.
[I 2024-12-04 15:48:01,982] Trial 2417 finished with value: 0.4349041171224461 and parameters: {'n_estimators': 521, 'max_depth': 43, 'min_samples_split': 4, 'min_samples_leaf': 1, 'max_features': None, 'bootstrap': True, 'criterion': 'squared_error'}. Best is trial 1025 with value: 0.41844370194907604.
[I 2024-12-04 15:48:05,148] Trial 2405 finished with value: 0.4209038666205427 and parameters: {'n_estimators': 792, 'max_depth': 43, 'min_samples_split': 2, 'min_samples_leaf': 1, 'max_features': None, 'bootstrap': True, 'criterion': 'squared_error'}. Best is trial 1025 with value: 0.41844370194907604.
[I 2024-12-04 15:48:07,257] Trial 2414 finished with value: 0.41884681167658167 and parameters: {'n_estimators': 843, 'max_depth': 40, 'min_samples_split': 2, 'min_samples_leaf': 1, 'max_features': None, 'bootstrap': True, 'criterion': 'squared_error'}. Best is trial 1025 with value: 0.41844370194907604.
[I 2024-12-04 15:48:08,333] Trial 2423 finished with value: 0.9912521826521717 and parameters: {'n_estimators': 499, 'max_depth': 31, 'min_samples_split': 6, 'min_samples_leaf': 11, 'max_features': 'sqrt', 'bootstrap': False, 'criterion': 'absolute_error'}. Best is trial 1025 with value: 0.41844370194907604.
[I 2024-12-04 15:48:08,509] Trial 2411 finished with value: 0.46434810001761356 and parameters: {'n_estimators': 716, 'max_depth': 35, 'min_samples_split': 2, 'min_samples_leaf': 2, 'max_features': None, 'bootstrap': True, 'criterion': 'squared_error'}. Best is trial 1025 with value: 0.41844370194907604.
[I 2024-12-04 15:48:08,525] Trial 2419 finished with value: 0.46513400192609705 and parameters: {'n_estimators': 855, 'max_depth': 39, 'min_samples_split': 2, 'min_samples_leaf': 2, 'max_features': None, 'bootstrap': True, 'criterion': 'squared_error'}. Best is trial 1025 with value: 0.41844370194907604.
[I 2024-12-04 15:48:08,607] Trial 2409 finished with value: 0.4241234155335048 and parameters: {'n_estimators': 858, 'max_depth': 34, 'min_samples_split': 3, 'min_samples_leaf': 1, 'max_features': None, 'bootstrap': True, 'criterion': 'squared_error'}. Best is trial 1025 with value: 0.41844370194907604.
[I 2024-12-04 15:48:09,517] Trial 2415 finished with value: 0.4193352492305619 and parameters: {'n_estimators': 765, 'max_depth': 39, 'min_samples_split': 2, 'min_samples_leaf': 1, 'max_features': None, 'bootstrap': True, 'criterion': 'squared_error'}. Best is trial 1025 with value: 0.41844370194907604.
[I 2024-12-04 15:48:11,977] Trial 2428 finished with value: 0.744453002683791 and parameters: {'n_estimators': 114, 'max_depth': 16, 'min_samples_split': 5, 'min_samples_leaf': 1, 'max_features': 'sqrt', 'bootstrap': False, 'criterion': 'absolute_error'}. Best is trial 1025 with value: 0.41844370194907604.
[I 2024-12-04 15:48:12,040] Trial 2421 finished with value: 0.4221150723051277 and parameters: {'n_estimators': 689, 'max_depth': 42, 'min_samples_split': 2, 'min_samples_leaf': 1, 'max_features': None, 'bootstrap': True, 'criterion': 'squared_error'}. Best is trial 1025 with value: 0.41844370194907604.
[I 2024-12-04 15:48:14,254] Trial 2427 finished with value: 1.0604289268167046 and parameters: {'n_estimators': 306, 'max_depth': 35, 'min_samples_split': 2, 'min_samples_leaf': 15, 'max_features': 'log2', 'bootstrap': True, 'criterion': 'absolute_error'}. Best is trial 1025 with value: 0.41844370194907604.
[I 2024-12-04 15:48:16,752] Trial 2416 finished with value: 0.43173759201441947 and parameters: {'n_estimators': 916, 'max_depth': 35, 'min_samples_split': 4, 'min_samples_leaf': 1, 'max_features': None, 'bootstrap': True, 'criterion': 'squared_error'}. Best is trial 1025 with value: 0.41844370194907604.
[I 2024-12-04 15:48:16,777] Trial 2413 finished with value: 0.42085048705037587 and parameters: {'n_estimators': 929, 'max_depth': 46, 'min_samples_split': 2, 'min_samples_leaf': 1, 'max_features': None, 'bootstrap': True, 'criterion': 'squared_error'}. Best is trial 1025 with value: 0.41844370194907604.
[I 2024-12-04 15:48:16,906] Trial 2422 finished with value: 0.4642766628678469 and parameters: {'n_estimators': 718, 'max_depth': 39, 'min_samples_split': 4, 'min_samples_leaf': 2, 'max_features': None, 'bootstrap': True, 'criterion': 'squared_error'}. Best is trial 1025 with value: 0.41844370194907604.
[I 2024-12-04 15:48:16,954] Trial 2435 finished with value: 0.7158533646458597 and parameters: {'n_estimators': 351, 'max_depth': 28, 'min_samples_split': 3, 'min_samples_leaf': 1, 'max_features': 'log2', 'bootstrap': False, 'criterion': 'squared_error'}. Best is trial 1025 with value: 0.41844370194907604.
[I 2024-12-04 15:48:19,670] Trial 2412 finished with value: 0.431650076118761 and parameters: {'n_estimators': 895, 'max_depth': 50, 'min_samples_split': 4, 'min_samples_leaf': 1, 'max_features': None, 'bootstrap': True, 'criterion': 'squared_error'}. Best is trial 1025 with value: 0.41844370194907604.
[I 2024-12-04 15:48:27,015] Trial 2432 finished with value: 0.4309842970087291 and parameters: {'n_estimators': 698, 'max_depth': 45, 'min_samples_split': 4, 'min_samples_leaf': 1, 'max_features': None, 'bootstrap': True, 'criterion': 'squared_error'}. Best is trial 1025 with value: 0.41844370194907604.
[I 2024-12-04 15:48:28,616] Trial 2431 finished with value: 0.4255306610940063 and parameters: {'n_estimators': 664, 'max_depth': 42, 'min_samples_split': 3, 'min_samples_leaf': 1, 'max_features': None, 'bootstrap': True, 'criterion': 'squared_error'}. Best is trial 1025 with value: 0.41844370194907604.
[I 2024-12-04 15:48:28,947] Trial 2426 finished with value: 0.46485071170844394 and parameters: {'n_estimators': 858, 'max_depth': 45, 'min_samples_split': 2, 'min_samples_leaf': 2, 'max_features': None, 'bootstrap': True, 'criterion': 'squared_error'}. Best is trial 1025 with value: 0.41844370194907604.
