[I 2024-12-04 12:07:34,683] Trial 867 finished with value: 0.5250525248795598 and parameters: {'n_estimators': 105, 'max_depth': 13, 'min_samples_split': 4, 'min_samples_leaf': 1, 'max_features': None, 'bootstrap': True, 'criterion': 'squared_error'}. Best is trial 744 with value: 0.5032383725751689.
[I 2024-12-04 12:07:37,476] Trial 866 finished with value: 0.552597661280722 and parameters: {'n_estimators': 131, 'max_depth': 15, 'min_samples_split': 6, 'min_samples_leaf': 2, 'max_features': None, 'bootstrap': True, 'criterion': 'absolute_error'}. Best is trial 744 with value: 0.5032383725751689.
[I 2024-12-04 12:07:38,431] Trial 868 finished with value: 0.6484412370829296 and parameters: {'n_estimators': 809, 'max_depth': 49, 'min_samples_split': 10, 'min_samples_leaf': 10, 'max_features': None, 'bootstrap': False, 'criterion': 'squared_error'}. Best is trial 744 with value: 0.5032383725751689.
[I 2024-12-04 12:07:39,397] Trial 869 finished with value: 0.5223025964565724 and parameters: {'n_estimators': 112, 'max_depth': 22, 'min_samples_split': 8, 'min_samples_leaf': 1, 'max_features': None, 'bootstrap': True, 'criterion': 'absolute_error'}. Best is trial 744 with value: 0.5032383725751689.
[I 2024-12-04 12:07:39,785] Trial 863 finished with value: 1.0177466032435452 and parameters: {'n_estimators': 846, 'max_depth': 42, 'min_samples_split': 2, 'min_samples_leaf': 3, 'max_features': 'sqrt', 'bootstrap': False, 'criterion': 'absolute_error'}. Best is trial 744 with value: 0.5032383725751689.
[I 2024-12-04 12:07:41,538] Trial 854 finished with value: 0.514102167355596 and parameters: {'n_estimators': 208, 'max_depth': 18, 'min_samples_split': 6, 'min_samples_leaf': 1, 'max_features': None, 'bootstrap': True, 'criterion': 'absolute_error'}. Best is trial 744 with value: 0.5032383725751689.
[I 2024-12-04 12:07:41,641] Trial 870 finished with value: 0.5538806373280434 and parameters: {'n_estimators': 116, 'max_depth': 21, 'min_samples_split': 4, 'min_samples_leaf': 2, 'max_features': None, 'bootstrap': True, 'criterion': 'absolute_error'}. Best is trial 744 with value: 0.5032383725751689.
[I 2024-12-04 12:07:44,331] Trial 871 finished with value: 1.2359881149643606 and parameters: {'n_estimators': 260, 'max_depth': 7, 'min_samples_split': 8, 'min_samples_leaf': 1, 'max_features': 'log2', 'bootstrap': True, 'criterion': 'absolute_error'}. Best is trial 744 with value: 0.5032383725751689.
[I 2024-12-04 12:07:46,419] Trial 873 finished with value: 0.6180178155860794 and parameters: {'n_estimators': 889, 'max_depth': 43, 'min_samples_split': 35, 'min_samples_leaf': 2, 'max_features': None, 'bootstrap': False, 'criterion': 'squared_error'}. Best is trial 744 with value: 0.5032383725751689.
[I 2024-12-04 12:07:47,572] Trial 878 finished with value: 0.511634817641666 and parameters: {'n_estimators': 133, 'max_depth': 15, 'min_samples_split': 5, 'min_samples_leaf': 1, 'max_features': None, 'bootstrap': True, 'criterion': 'absolute_error'}. Best is trial 744 with value: 0.5032383725751689.
[I 2024-12-04 12:07:48,025] Trial 872 finished with value: 1.210743061339906 and parameters: {'n_estimators': 894, 'max_depth': 43, 'min_samples_split': 33, 'min_samples_leaf': 5, 'max_features': 'log2', 'bootstrap': False, 'criterion': 'squared_error'}. Best is trial 744 with value: 0.5032383725751689.
[I 2024-12-04 12:07:49,811] Trial 875 finished with value: 0.5200330341102922 and parameters: {'n_estimators': 141, 'max_depth': 16, 'min_samples_split': 7, 'min_samples_leaf': 1, 'max_features': None, 'bootstrap': True, 'criterion': 'absolute_error'}. Best is trial 744 with value: 0.5032383725751689.
[I 2024-12-04 12:07:51,168] Trial 876 finished with value: 0.5116202831826913 and parameters: {'n_estimators': 102, 'max_depth': 17, 'min_samples_split': 6, 'min_samples_leaf': 1, 'max_features': None, 'bootstrap': True, 'criterion': 'absolute_error'}. Best is trial 744 with value: 0.5032383725751689.
[I 2024-12-04 12:07:51,799] Trial 883 finished with value: 0.5220992237893403 and parameters: {'n_estimators': 113, 'max_depth': 13, 'min_samples_split': 7, 'min_samples_leaf': 1, 'max_features': None, 'bootstrap': True, 'criterion': 'absolute_error'}. Best is trial 744 with value: 0.5032383725751689.
[I 2024-12-04 12:07:53,019] Trial 884 finished with value: 0.5109427564445972 and parameters: {'n_estimators': 124, 'max_depth': 20, 'min_samples_split': 4, 'min_samples_leaf': 1, 'max_features': None, 'bootstrap': True, 'criterion': 'absolute_error'}. Best is trial 744 with value: 0.5032383725751689.
[I 2024-12-04 12:07:53,765] Trial 888 finished with value: 0.5198586905684678 and parameters: {'n_estimators': 103, 'max_depth': 16, 'min_samples_split': 7, 'min_samples_leaf': 1, 'max_features': None, 'bootstrap': True, 'criterion': 'absolute_error'}. Best is trial 744 with value: 0.5032383725751689.
[I 2024-12-04 12:07:54,804] Trial 877 finished with value: 0.5098167907679072 and parameters: {'n_estimators': 104, 'max_depth': 22, 'min_samples_split': 5, 'min_samples_leaf': 1, 'max_features': None, 'bootstrap': True, 'criterion': 'absolute_error'}. Best is trial 744 with value: 0.5032383725751689.
[I 2024-12-04 12:07:57,036] Trial 874 finished with value: 0.5598873158055568 and parameters: {'n_estimators': 257, 'max_depth': 23, 'min_samples_split': 2, 'min_samples_leaf': 2, 'max_features': None, 'bootstrap': True, 'criterion': 'absolute_error'}. Best is trial 744 with value: 0.5032383725751689.
[I 2024-12-04 12:07:57,191] Trial 887 finished with value: 0.5071676524769215 and parameters: {'n_estimators': 102, 'max_depth': 11, 'min_samples_split': 4, 'min_samples_leaf': 1, 'max_features': None, 'bootstrap': True, 'criterion': 'absolute_error'}. Best is trial 744 with value: 0.5032383725751689.
[I 2024-12-04 12:07:58,107] Trial 895 finished with value: 0.5131833075644436 and parameters: {'n_estimators': 115, 'max_depth': 17, 'min_samples_split': 4, 'min_samples_leaf': 1, 'max_features': None, 'bootstrap': True, 'criterion': 'absolute_error'}. Best is trial 744 with value: 0.5032383725751689.
[I 2024-12-04 12:07:58,288] Trial 882 finished with value: 0.5580371105020998 and parameters: {'n_estimators': 102, 'max_depth': 14, 'min_samples_split': 3, 'min_samples_leaf': 2, 'max_features': None, 'bootstrap': True, 'criterion': 'absolute_error'}. Best is trial 744 with value: 0.5032383725751689.
[I 2024-12-04 12:07:58,650] Trial 886 finished with value: 0.5227819021885742 and parameters: {'n_estimators': 100, 'max_depth': 20, 'min_samples_split': 7, 'min_samples_leaf': 1, 'max_features': None, 'bootstrap': True, 'criterion': 'absolute_error'}. Best is trial 744 with value: 0.5032383725751689.
[I 2024-12-04 12:07:59,193] Trial 897 finished with value: 0.6824026587693657 and parameters: {'n_estimators': 204, 'max_depth': 39, 'min_samples_split': 12, 'min_samples_leaf': 6, 'max_features': None, 'bootstrap': False, 'criterion': 'squared_error'}. Best is trial 744 with value: 0.5032383725751689.
[I 2024-12-04 12:07:59,261] Trial 893 finished with value: 0.7233316336347875 and parameters: {'n_estimators': 728, 'max_depth': 25, 'min_samples_split': 4, 'min_samples_leaf': 15, 'max_features': None, 'bootstrap': False, 'criterion': 'squared_error'}. Best is trial 744 with value: 0.5032383725751689.
[I 2024-12-04 12:07:59,977] Trial 903 finished with value: 1.199008709202966 and parameters: {'n_estimators': 380, 'max_depth': 43, 'min_samples_split': 28, 'min_samples_leaf': 4, 'max_features': 'log2', 'bootstrap': False, 'criterion': 'squared_error'}. Best is trial 744 with value: 0.5032383725751689.
[I 2024-12-04 12:08:01,938] Trial 896 finished with value: 0.5136142164332202 and parameters: {'n_estimators': 100, 'max_depth': 15, 'min_samples_split': 4, 'min_samples_leaf': 1, 'max_features': None, 'bootstrap': True, 'criterion': 'absolute_error'}. Best is trial 744 with value: 0.5032383725751689.
[I 2024-12-04 12:08:03,078] Trial 880 finished with value: 0.5604894526939845 and parameters: {'n_estimators': 295, 'max_depth': 23, 'min_samples_split': 8, 'min_samples_leaf': 2, 'max_features': None, 'bootstrap': True, 'criterion': 'absolute_error'}. Best is trial 744 with value: 0.5032383725751689.
[I 2024-12-04 12:08:03,220] Trial 890 finished with value: 0.554967353452912 and parameters: {'n_estimators': 287, 'max_depth': 16, 'min_samples_split': 7, 'min_samples_leaf': 2, 'max_features': None, 'bootstrap': True, 'criterion': 'absolute_error'}. Best is trial 744 with value: 0.5032383725751689.
[I 2024-12-04 12:08:03,613] Trial 889 finished with value: 0.8710149927050561 and parameters: {'n_estimators': 879, 'max_depth': 41, 'min_samples_split': 14, 'min_samples_leaf': 15, 'max_features': None, 'bootstrap': False, 'criterion': 'absolute_error'}. Best is trial 744 with value: 0.5032383725751689.
[I 2024-12-04 12:08:04,167] Trial 898 finished with value: 0.5907610495184177 and parameters: {'n_estimators': 101, 'max_depth': 12, 'min_samples_split': 8, 'min_samples_leaf': 2, 'max_features': None, 'bootstrap': False, 'criterion': 'absolute_error'}. Best is trial 744 with value: 0.5032383725751689.
[I 2024-12-04 12:08:07,022] Trial 879 finished with value: 0.5181007669468642 and parameters: {'n_estimators': 259, 'max_depth': 18, 'min_samples_split': 6, 'min_samples_leaf': 1, 'max_features': None, 'bootstrap': True, 'criterion': 'absolute_error'}. Best is trial 744 with value: 0.5032383725751689.
[I 2024-12-04 12:08:08,309] Trial 905 finished with value: 0.5101003693123464 and parameters: {'n_estimators': 108, 'max_depth': 13, 'min_samples_split': 4, 'min_samples_leaf': 1, 'max_features': None, 'bootstrap': True, 'criterion': 'absolute_error'}. Best is trial 744 with value: 0.5032383725751689.
[I 2024-12-04 12:08:08,491] Trial 894 finished with value: 0.819315822993005 and parameters: {'n_estimators': 105, 'max_depth': 40, 'min_samples_split': 40, 'min_samples_leaf': 1, 'max_features': None, 'bootstrap': False, 'criterion': 'absolute_error'}. Best is trial 744 with value: 0.5032383725751689.
[I 2024-12-04 12:08:09,538] Trial 901 finished with value: 0.5218764822954672 and parameters: {'n_estimators': 122, 'max_depth': 9, 'min_samples_split': 3, 'min_samples_leaf': 1, 'max_features': None, 'bootstrap': True, 'criterion': 'absolute_error'}. Best is trial 744 with value: 0.5032383725751689.
[I 2024-12-04 12:08:10,024] Trial 904 finished with value: 0.55401566298637 and parameters: {'n_estimators': 101, 'max_depth': 15, 'min_samples_split': 5, 'min_samples_leaf': 2, 'max_features': None, 'bootstrap': True, 'criterion': 'absolute_error'}. Best is trial 744 with value: 0.5032383725751689.
[I 2024-12-04 12:08:11,571] Trial 900 finished with value: 0.5614648381342751 and parameters: {'n_estimators': 217, 'max_depth': 5, 'min_samples_split': 6, 'min_samples_leaf': 1, 'max_features': None, 'bootstrap': True, 'criterion': 'absolute_error'}. Best is trial 744 with value: 0.5032383725751689.
[I 2024-12-04 12:08:11,979] Trial 891 finished with value: 0.51740196822217 and parameters: {'n_estimators': 258, 'max_depth': 20, 'min_samples_split': 4, 'min_samples_leaf': 1, 'max_features': None, 'bootstrap': True, 'criterion': 'absolute_error'}. Best is trial 744 with value: 0.5032383725751689.
[I 2024-12-04 12:08:13,189] Trial 881 finished with value: 0.5337786996056436 and parameters: {'n_estimators': 206, 'max_depth': 15, 'min_samples_split': 12, 'min_samples_leaf': 1, 'max_features': None, 'bootstrap': False, 'criterion': 'absolute_error'}. Best is trial 744 with value: 0.5032383725751689.
[I 2024-12-04 12:08:14,915] Trial 907 finished with value: 0.5139095611532085 and parameters: {'n_estimators': 122, 'max_depth': 14, 'min_samples_split': 3, 'min_samples_leaf': 1, 'max_features': None, 'bootstrap': True, 'criterion': 'absolute_error'}. Best is trial 744 with value: 0.5032383725751689.
[I 2024-12-04 12:08:15,591] Trial 892 finished with value: 0.5598312274543725 and parameters: {'n_estimators': 259, 'max_depth': 23, 'min_samples_split': 3, 'min_samples_leaf': 2, 'max_features': None, 'bootstrap': True, 'criterion': 'absolute_error'}. Best is trial 744 with value: 0.5032383725751689.
[I 2024-12-04 12:08:16,239] Trial 914 finished with value: 0.8618984179971053 and parameters: {'n_estimators': 156, 'max_depth': 29, 'min_samples_split': 5, 'min_samples_leaf': 1, 'max_features': 'log2', 'bootstrap': False, 'criterion': 'absolute_error'}. Best is trial 744 with value: 0.5032383725751689.
[I 2024-12-04 12:08:16,269] Trial 899 finished with value: 0.5215418913231321 and parameters: {'n_estimators': 230, 'max_depth': 20, 'min_samples_split': 3, 'min_samples_leaf': 1, 'max_features': None, 'bootstrap': True, 'criterion': 'absolute_error'}. Best is trial 744 with value: 0.5032383725751689.
[I 2024-12-04 12:08:16,637] Trial 908 finished with value: 0.506093559793775 and parameters: {'n_estimators': 111, 'max_depth': 19, 'min_samples_split': 4, 'min_samples_leaf': 1, 'max_features': None, 'bootstrap': True, 'criterion': 'absolute_error'}. Best is trial 744 with value: 0.5032383725751689.
[I 2024-12-04 12:08:17,013] Trial 918 finished with value: 0.8610320682482574 and parameters: {'n_estimators': 307, 'max_depth': 15, 'min_samples_split': 6, 'min_samples_leaf': 1, 'max_features': 'sqrt', 'bootstrap': True, 'criterion': 'squared_error'}. Best is trial 744 with value: 0.5032383725751689.
[I 2024-12-04 12:08:17,479] Trial 909 finished with value: 0.5538810719310776 and parameters: {'n_estimators': 102, 'max_depth': 16, 'min_samples_split': 6, 'min_samples_leaf': 2, 'max_features': None, 'bootstrap': True, 'criterion': 'absolute_error'}. Best is trial 744 with value: 0.5032383725751689.
[I 2024-12-04 12:08:17,484] Trial 902 finished with value: 0.5314027537805768 and parameters: {'n_estimators': 245, 'max_depth': 7, 'min_samples_split': 3, 'min_samples_leaf': 1, 'max_features': None, 'bootstrap': True, 'criterion': 'absolute_error'}. Best is trial 744 with value: 0.5032383725751689.
[I 2024-12-04 12:08:17,829] Trial 885 finished with value: 0.5182208537498617 and parameters: {'n_estimators': 363, 'max_depth': 25, 'min_samples_split': 2, 'min_samples_leaf': 1, 'max_features': None, 'bootstrap': True, 'criterion': 'absolute_error'}. Best is trial 744 with value: 0.5032383725751689.
[I 2024-12-04 12:08:17,879] Trial 912 finished with value: 0.515226928981308 and parameters: {'n_estimators': 128, 'max_depth': 8, 'min_samples_split': 4, 'min_samples_leaf': 1, 'max_features': None, 'bootstrap': True, 'criterion': 'absolute_error'}. Best is trial 744 with value: 0.5032383725751689.
[I 2024-12-04 12:08:17,897] Trial 910 finished with value: 0.5161687127697169 and parameters: {'n_estimators': 101, 'max_depth': 20, 'min_samples_split': 3, 'min_samples_leaf': 1, 'max_features': None, 'bootstrap': True, 'criterion': 'absolute_error'}. Best is trial 744 with value: 0.5032383725751689.
[I 2024-12-04 12:08:18,140] Trial 915 finished with value: 0.5396796994574495 and parameters: {'n_estimators': 111, 'max_depth': 6, 'min_samples_split': 5, 'min_samples_leaf': 1, 'max_features': None, 'bootstrap': True, 'criterion': 'absolute_error'}. Best is trial 744 with value: 0.5032383725751689.
[I 2024-12-04 12:08:20,366] Trial 917 finished with value: 0.9302709927064876 and parameters: {'n_estimators': 400, 'max_depth': 47, 'min_samples_split': 2, 'min_samples_leaf': 12, 'max_features': None, 'bootstrap': True, 'criterion': 'absolute_error'}. Best is trial 744 with value: 0.5032383725751689.
[I 2024-12-04 12:08:21,564] Trial 906 finished with value: 0.5226484324139892 and parameters: {'n_estimators': 266, 'max_depth': 10, 'min_samples_split': 6, 'min_samples_leaf': 1, 'max_features': None, 'bootstrap': True, 'criterion': 'absolute_error'}. Best is trial 744 with value: 0.5032383725751689.
[I 2024-12-04 12:08:21,699] Trial 925 finished with value: 0.5276412670631248 and parameters: {'n_estimators': 129, 'max_depth': 19, 'min_samples_split': 3, 'min_samples_leaf': 1, 'max_features': None, 'bootstrap': True, 'criterion': 'squared_error'}. Best is trial 744 with value: 0.5032383725751689.
[I 2024-12-04 12:08:22,561] Trial 929 finished with value: 1.1666770006847793 and parameters: {'n_estimators': 152, 'max_depth': 11, 'min_samples_split': 4, 'min_samples_leaf': 1, 'max_features': 'log2', 'bootstrap': True, 'criterion': 'absolute_error'}. Best is trial 744 with value: 0.5032383725751689.
[I 2024-12-04 12:08:23,567] Trial 919 finished with value: 0.9589416108088705 and parameters: {'n_estimators': 570, 'max_depth': 39, 'min_samples_split': 7, 'min_samples_leaf': 2, 'max_features': 'sqrt', 'bootstrap': True, 'criterion': 'absolute_error'}. Best is trial 744 with value: 0.5032383725751689.
[I 2024-12-04 12:08:24,782] Trial 913 finished with value: 0.6035450611402456 and parameters: {'n_estimators': 543, 'max_depth': 36, 'min_samples_split': 3, 'min_samples_leaf': 1, 'max_features': None, 'bootstrap': False, 'criterion': 'squared_error'}. Best is trial 744 with value: 0.5032383725751689.
[I 2024-12-04 12:08:26,287] Trial 921 finished with value: 0.9767750494054751 and parameters: {'n_estimators': 285, 'max_depth': 24, 'min_samples_split': 7, 'min_samples_leaf': 1, 'max_features': 'log2', 'bootstrap': True, 'criterion': 'absolute_error'}. Best is trial 744 with value: 0.5032383725751689.
[I 2024-12-04 12:08:26,471] Trial 920 finished with value: 0.5253043798032119 and parameters: {'n_estimators': 106, 'max_depth': 7, 'min_samples_split': 5, 'min_samples_leaf': 1, 'max_features': None, 'bootstrap': True, 'criterion': 'absolute_error'}. Best is trial 744 with value: 0.5032383725751689.
[I 2024-12-04 12:08:27,940] Trial 926 finished with value: 0.5522229913211054 and parameters: {'n_estimators': 196, 'max_depth': 12, 'min_samples_split': 16, 'min_samples_leaf': 2, 'max_features': None, 'bootstrap': True, 'criterion': 'absolute_error'}. Best is trial 744 with value: 0.5032383725751689.
[I 2024-12-04 12:08:29,074] Trial 927 finished with value: 0.5062426933481373 and parameters: {'n_estimators': 101, 'max_depth': 12, 'min_samples_split': 2, 'min_samples_leaf': 1, 'max_features': None, 'bootstrap': True, 'criterion': 'absolute_error'}. Best is trial 744 with value: 0.5032383725751689.
[I 2024-12-04 12:08:29,465] Trial 916 finished with value: 0.5162549646073269 and parameters: {'n_estimators': 266, 'max_depth': 15, 'min_samples_split': 4, 'min_samples_leaf': 1, 'max_features': None, 'bootstrap': True, 'criterion': 'absolute_error'}. Best is trial 744 with value: 0.5032383725751689.
[I 2024-12-04 12:08:29,564] Trial 930 finished with value: 0.5444338307499527 and parameters: {'n_estimators': 102, 'max_depth': 7, 'min_samples_split': 11, 'min_samples_leaf': 1, 'max_features': None, 'bootstrap': True, 'criterion': 'absolute_error'}. Best is trial 744 with value: 0.5032383725751689.
[I 2024-12-04 12:08:30,607] Trial 922 finished with value: 0.5554516310444744 and parameters: {'n_estimators': 243, 'max_depth': 15, 'min_samples_split': 3, 'min_samples_leaf': 2, 'max_features': None, 'bootstrap': True, 'criterion': 'absolute_error'}. Best is trial 744 with value: 0.5032383725751689.
[I 2024-12-04 12:08:30,735] Trial 911 finished with value: 0.5155562006891206 and parameters: {'n_estimators': 296, 'max_depth': 18, 'min_samples_split': 2, 'min_samples_leaf': 1, 'max_features': None, 'bootstrap': True, 'criterion': 'absolute_error'}. Best is trial 744 with value: 0.5032383725751689.
[I 2024-12-04 12:08:34,082] Trial 933 finished with value: 0.5153943562622322 and parameters: {'n_estimators': 118, 'max_depth': 15, 'min_samples_split': 3, 'min_samples_leaf': 1, 'max_features': None, 'bootstrap': True, 'criterion': 'absolute_error'}. Best is trial 744 with value: 0.5032383725751689.
[I 2024-12-04 12:08:35,327] Trial 928 finished with value: 0.5538465166432643 and parameters: {'n_estimators': 109, 'max_depth': 23, 'min_samples_split': 3, 'min_samples_leaf': 2, 'max_features': None, 'bootstrap': True, 'criterion': 'absolute_error'}. Best is trial 744 with value: 0.5032383725751689.
[I 2024-12-04 12:08:35,731] Trial 931 finished with value: 0.5165354116750582 and parameters: {'n_estimators': 126, 'max_depth': 13, 'min_samples_split': 6, 'min_samples_leaf': 1, 'max_features': None, 'bootstrap': True, 'criterion': 'absolute_error'}. Best is trial 744 with value: 0.5032383725751689.
[I 2024-12-04 12:08:37,469] Trial 947 finished with value: 1.1933343344247902 and parameters: {'n_estimators': 451, 'max_depth': 7, 'min_samples_split': 2, 'min_samples_leaf': 11, 'max_features': 'sqrt', 'bootstrap': False, 'criterion': 'squared_error'}. Best is trial 744 with value: 0.5032383725751689.
[I 2024-12-04 12:08:37,747] Trial 936 finished with value: 0.5098287755354934 and parameters: {'n_estimators': 103, 'max_depth': 15, 'min_samples_split': 5, 'min_samples_leaf': 1, 'max_features': None, 'bootstrap': True, 'criterion': 'absolute_error'}. Best is trial 744 with value: 0.5032383725751689.
[I 2024-12-04 12:08:37,754] Trial 943 finished with value: 0.5132377288724576 and parameters: {'n_estimators': 100, 'max_depth': 9, 'min_samples_split': 4, 'min_samples_leaf': 1, 'max_features': None, 'bootstrap': True, 'criterion': 'absolute_error'}. Best is trial 744 with value: 0.5032383725751689.
[I 2024-12-04 12:08:38,886] Trial 932 finished with value: 0.8285590304726946 and parameters: {'n_estimators': 352, 'max_depth': 17, 'min_samples_split': 4, 'min_samples_leaf': 1, 'max_features': 'sqrt', 'bootstrap': True, 'criterion': 'absolute_error'}. Best is trial 744 with value: 0.5032383725751689.
[I 2024-12-04 12:08:41,376] Trial 938 finished with value: 0.5109103103221134 and parameters: {'n_estimators': 106, 'max_depth': 16, 'min_samples_split': 5, 'min_samples_leaf': 1, 'max_features': None, 'bootstrap': True, 'criterion': 'absolute_error'}. Best is trial 744 with value: 0.5032383725751689.
