[I 2024-12-04 11:53:29,652] Trial 311 finished with value: 0.5562264204948102 and parameters: {'max_depth': 34, 'min_samples_split': 2, 'min_samples_leaf': 1, 'max_features': 'log2', 'criterion': 'squared_error', 'splitter': 'best'}. Best is trial 91 with value: 0.43250115503666103.
[I 2024-12-04 11:53:30,124] Trial 320 finished with value: 0.9986705309945677 and parameters: {'max_depth': 29, 'min_samples_split': 3, 'min_samples_leaf': 5, 'max_features': 'log2', 'criterion': 'absolute_error', 'splitter': 'best'}. Best is trial 91 with value: 0.43250115503666103.
[I 2024-12-04 11:53:30,265] Trial 312 finished with value: 0.4750683632054112 and parameters: {'max_depth': 35, 'min_samples_split': 4, 'min_samples_leaf': 1, 'max_features': 'sqrt', 'criterion': 'squared_error', 'splitter': 'best'}. Best is trial 91 with value: 0.43250115503666103.
[I 2024-12-04 11:53:30,269] Trial 310 finished with value: 0.8220187975312053 and parameters: {'max_depth': 24, 'min_samples_split': 6, 'min_samples_leaf': 1, 'max_features': 'log2', 'criterion': 'squared_error', 'splitter': 'random'}. Best is trial 91 with value: 0.43250115503666103.
[I 2024-12-04 11:53:30,423] Trial 321 finished with value: 0.9672606808904554 and parameters: {'max_depth': 24, 'min_samples_split': 5, 'min_samples_leaf': 8, 'max_features': 'sqrt', 'criterion': 'absolute_error', 'splitter': 'random'}. Best is trial 91 with value: 0.43250115503666103.
[I 2024-12-04 11:53:30,827] Trial 314 finished with value: 0.523782642691413 and parameters: {'max_depth': 28, 'min_samples_split': 3, 'min_samples_leaf': 1, 'max_features': 'sqrt', 'criterion': 'squared_error', 'splitter': 'best'}. Best is trial 91 with value: 0.43250115503666103.
[I 2024-12-04 11:53:30,828] Trial 315 finished with value: 0.9848618092291146 and parameters: {'max_depth': 8, 'min_samples_split': 18, 'min_samples_leaf': 4, 'max_features': 'log2', 'criterion': 'absolute_error', 'splitter': 'best'}. Best is trial 91 with value: 0.43250115503666103.
[I 2024-12-04 11:53:30,830] Trial 316 finished with value: 0.5523976355951831 and parameters: {'max_depth': 31, 'min_samples_split': 2, 'min_samples_leaf': 1, 'max_features': 'sqrt', 'criterion': 'squared_error', 'splitter': 'best'}. Best is trial 91 with value: 0.43250115503666103.
[I 2024-12-04 11:53:31,022] Trial 304 finished with value: 0.5256990931023814 and parameters: {'max_depth': 28, 'min_samples_split': 4, 'min_samples_leaf': 1, 'max_features': 'sqrt', 'criterion': 'squared_error', 'splitter': 'best'}. Best is trial 91 with value: 0.43250115503666103.
[I 2024-12-04 11:53:31,154] Trial 308 finished with value: 0.998127234894583 and parameters: {'max_depth': 4, 'min_samples_split': 9, 'min_samples_leaf': 10, 'max_features': 'log2', 'criterion': 'friedman_mse', 'splitter': 'random'}. Best is trial 91 with value: 0.43250115503666103.
[I 2024-12-04 11:53:31,187] Trial 319 finished with value: 0.5109654269115765 and parameters: {'max_depth': 35, 'min_samples_split': 2, 'min_samples_leaf': 1, 'max_features': 'sqrt', 'criterion': 'squared_error', 'splitter': 'best'}. Best is trial 91 with value: 0.43250115503666103.
[I 2024-12-04 11:53:31,741] Trial 318 finished with value: 0.6013237460643723 and parameters: {'max_depth': 35, 'min_samples_split': 5, 'min_samples_leaf': 3, 'max_features': 'sqrt', 'criterion': 'squared_error', 'splitter': 'best'}. Best is trial 91 with value: 0.43250115503666103.
[I 2024-12-04 11:53:32,354] Trial 317 finished with value: 0.9597516113963797 and parameters: {'max_depth': 33, 'min_samples_split': 16, 'min_samples_leaf': 7, 'max_features': 'sqrt', 'criterion': 'squared_error', 'splitter': 'random'}. Best is trial 91 with value: 0.43250115503666103.
[I 2024-12-04 11:53:33,262] Trial 325 finished with value: 0.998127234894583 and parameters: {'max_depth': 17, 'min_samples_split': 4, 'min_samples_leaf': 8, 'max_features': 'log2', 'criterion': 'squared_error', 'splitter': 'random'}. Best is trial 91 with value: 0.43250115503666103.
[I 2024-12-04 11:53:33,269] Trial 313 finished with value: 0.5440633341537283 and parameters: {'max_depth': 29, 'min_samples_split': 2, 'min_samples_leaf': 1, 'max_features': 'sqrt', 'criterion': 'squared_error', 'splitter': 'best'}. Best is trial 91 with value: 0.43250115503666103.
[I 2024-12-04 11:53:35,429] Trial 322 finished with value: 0.5578950272468415 and parameters: {'max_depth': 34, 'min_samples_split': 3, 'min_samples_leaf': 1, 'max_features': 'sqrt', 'criterion': 'squared_error', 'splitter': 'random'}. Best is trial 91 with value: 0.43250115503666103.
[I 2024-12-04 11:53:35,430] Trial 327 finished with value: 0.4750683632054112 and parameters: {'max_depth': 35, 'min_samples_split': 4, 'min_samples_leaf': 1, 'max_features': 'sqrt', 'criterion': 'squared_error', 'splitter': 'best'}. Best is trial 91 with value: 0.43250115503666103.
[I 2024-12-04 11:53:36,299] Trial 323 finished with value: 0.8950106185763959 and parameters: {'max_depth': 32, 'min_samples_split': 4, 'min_samples_leaf': 3, 'max_features': 'log2', 'criterion': 'squared_error', 'splitter': 'random'}. Best is trial 91 with value: 0.43250115503666103.
[I 2024-12-04 11:53:36,667] Trial 328 finished with value: 0.43250115503666103 and parameters: {'max_depth': 34, 'min_samples_split': 3, 'min_samples_leaf': 1, 'max_features': 'sqrt', 'criterion': 'squared_error', 'splitter': 'best'}. Best is trial 91 with value: 0.43250115503666103.
[I 2024-12-04 11:53:36,832] Trial 334 finished with value: 0.5523976355951831 and parameters: {'max_depth': 31, 'min_samples_split': 2, 'min_samples_leaf': 1, 'max_features': 'sqrt', 'criterion': 'friedman_mse', 'splitter': 'best'}. Best is trial 91 with value: 0.43250115503666103.
[I 2024-12-04 11:53:36,868] Trial 337 finished with value: 0.492644424246246 and parameters: {'max_depth': 33, 'min_samples_split': 2, 'min_samples_leaf': 1, 'max_features': 'sqrt', 'criterion': 'squared_error', 'splitter': 'best'}. Best is trial 91 with value: 0.43250115503666103.
[I 2024-12-04 11:53:36,966] Trial 332 finished with value: 0.4560512309740644 and parameters: {'max_depth': 33, 'min_samples_split': 3, 'min_samples_leaf': 1, 'max_features': 'sqrt', 'criterion': 'friedman_mse', 'splitter': 'best'}. Best is trial 91 with value: 0.43250115503666103.
[I 2024-12-04 11:53:37,573] Trial 336 finished with value: 0.9539582374479727 and parameters: {'max_depth': 3, 'min_samples_split': 12, 'min_samples_leaf': 4, 'max_features': 'sqrt', 'criterion': 'absolute_error', 'splitter': 'random'}. Best is trial 91 with value: 0.43250115503666103.
[I 2024-12-04 11:53:37,671] Trial 326 finished with value: 0.483263059820054 and parameters: {'max_depth': 35, 'min_samples_split': 5, 'min_samples_leaf': 1, 'max_features': 'sqrt', 'criterion': 'friedman_mse', 'splitter': 'best'}. Best is trial 91 with value: 0.43250115503666103.
[I 2024-12-04 11:53:38,473] Trial 338 finished with value: 0.4750683632054112 and parameters: {'max_depth': 35, 'min_samples_split': 4, 'min_samples_leaf': 1, 'max_features': 'sqrt', 'criterion': 'squared_error', 'splitter': 'best'}. Best is trial 91 with value: 0.43250115503666103.
[I 2024-12-04 11:53:39,499] Trial 329 finished with value: 0.6013237460643723 and parameters: {'max_depth': 34, 'min_samples_split': 4, 'min_samples_leaf': 3, 'max_features': 'sqrt', 'criterion': 'friedman_mse', 'splitter': 'best'}. Best is trial 91 with value: 0.43250115503666103.
[I 2024-12-04 11:53:39,525] Trial 345 finished with value: 0.6013237460643723 and parameters: {'max_depth': 27, 'min_samples_split': 5, 'min_samples_leaf': 3, 'max_features': 'sqrt', 'criterion': 'squared_error', 'splitter': 'best'}. Best is trial 91 with value: 0.43250115503666103.
[I 2024-12-04 11:53:39,542] Trial 340 finished with value: 0.9986705309945677 and parameters: {'max_depth': 22, 'min_samples_split': 8, 'min_samples_leaf': 9, 'max_features': 'log2', 'criterion': 'absolute_error', 'splitter': 'best'}. Best is trial 91 with value: 0.43250115503666103.
[I 2024-12-04 11:53:40,022] Trial 347 finished with value: 0.6013237460643723 and parameters: {'max_depth': 27, 'min_samples_split': 5, 'min_samples_leaf': 3, 'max_features': 'sqrt', 'criterion': 'squared_error', 'splitter': 'best'}. Best is trial 91 with value: 0.43250115503666103.
[I 2024-12-04 11:53:40,061] Trial 333 finished with value: 0.5471455063493378 and parameters: {'max_depth': 30, 'min_samples_split': 18, 'min_samples_leaf': 1, 'max_features': 'sqrt', 'criterion': 'friedman_mse', 'splitter': 'best'}. Best is trial 91 with value: 0.43250115503666103.
[I 2024-12-04 11:53:40,071] Trial 331 finished with value: 0.6989255253793009 and parameters: {'max_depth': 34, 'min_samples_split': 6, 'min_samples_leaf': 9, 'max_features': 'sqrt', 'criterion': 'absolute_error', 'splitter': 'best'}. Best is trial 91 with value: 0.43250115503666103.
[I 2024-12-04 11:53:40,447] Trial 342 finished with value: 0.5141868723608642 and parameters: {'max_depth': 35, 'min_samples_split': 2, 'min_samples_leaf': 1, 'max_features': 'log2', 'criterion': 'absolute_error', 'splitter': 'best'}. Best is trial 91 with value: 0.43250115503666103.
[I 2024-12-04 11:53:41,121] Trial 335 finished with value: 0.5170399151403982 and parameters: {'max_depth': 34, 'min_samples_split': 2, 'min_samples_leaf': 1, 'max_features': 'sqrt', 'criterion': 'friedman_mse', 'splitter': 'best'}. Best is trial 91 with value: 0.43250115503666103.
[I 2024-12-04 11:53:41,126] Trial 324 finished with value: 0.43250115503666103 and parameters: {'max_depth': 34, 'min_samples_split': 3, 'min_samples_leaf': 1, 'max_features': 'sqrt', 'criterion': 'squared_error', 'splitter': 'best'}. Best is trial 91 with value: 0.43250115503666103.
[I 2024-12-04 11:53:41,128] Trial 348 finished with value: 0.6013237460643723 and parameters: {'max_depth': 28, 'min_samples_split': 5, 'min_samples_leaf': 3, 'max_features': 'sqrt', 'criterion': 'squared_error', 'splitter': 'best'}. Best is trial 91 with value: 0.43250115503666103.
[I 2024-12-04 11:53:41,248] Trial 330 finished with value: 0.5345817934142266 and parameters: {'max_depth': 35, 'min_samples_split': 4, 'min_samples_leaf': 2, 'max_features': 'sqrt', 'criterion': 'friedman_mse', 'splitter': 'best'}. Best is trial 91 with value: 0.43250115503666103.
[I 2024-12-04 11:53:41,249] Trial 339 finished with value: 0.6013237460643723 and parameters: {'max_depth': 35, 'min_samples_split': 2, 'min_samples_leaf': 3, 'max_features': 'sqrt', 'criterion': 'squared_error', 'splitter': 'best'}. Best is trial 91 with value: 0.43250115503666103.
[I 2024-12-04 11:53:41,274] Trial 341 finished with value: 0.45634040793959746 and parameters: {'max_depth': 35, 'min_samples_split': 3, 'min_samples_leaf': 1, 'max_features': 'sqrt', 'criterion': 'squared_error', 'splitter': 'best'}. Best is trial 91 with value: 0.43250115503666103.
[I 2024-12-04 11:53:41,649] Trial 350 finished with value: 0.6013237460643723 and parameters: {'max_depth': 24, 'min_samples_split': 5, 'min_samples_leaf': 3, 'max_features': 'sqrt', 'criterion': 'friedman_mse', 'splitter': 'best'}. Best is trial 91 with value: 0.43250115503666103.
[I 2024-12-04 11:53:42,147] Trial 344 finished with value: 0.45634040793959746 and parameters: {'max_depth': 35, 'min_samples_split': 3, 'min_samples_leaf': 1, 'max_features': 'sqrt', 'criterion': 'squared_error', 'splitter': 'best'}. Best is trial 91 with value: 0.43250115503666103.
[I 2024-12-04 11:53:42,812] Trial 343 finished with value: 0.5170399151403982 and parameters: {'max_depth': 34, 'min_samples_split': 2, 'min_samples_leaf': 1, 'max_features': 'sqrt', 'criterion': 'squared_error', 'splitter': 'best'}. Best is trial 91 with value: 0.43250115503666103.
[I 2024-12-04 11:53:42,819] Trial 352 finished with value: 0.45634040793959746 and parameters: {'max_depth': 35, 'min_samples_split': 3, 'min_samples_leaf': 1, 'max_features': 'sqrt', 'criterion': 'squared_error', 'splitter': 'best'}. Best is trial 91 with value: 0.43250115503666103.
[I 2024-12-04 11:53:42,970] Trial 349 finished with value: 0.5345817934142266 and parameters: {'max_depth': 35, 'min_samples_split': 2, 'min_samples_leaf': 2, 'max_features': 'sqrt', 'criterion': 'squared_error', 'splitter': 'best'}. Best is trial 91 with value: 0.43250115503666103.
[I 2024-12-04 11:53:42,979] Trial 351 finished with value: 0.7048293397341441 and parameters: {'max_depth': 28, 'min_samples_split': 3, 'min_samples_leaf': 2, 'max_features': 'sqrt', 'criterion': 'friedman_mse', 'splitter': 'random'}. Best is trial 91 with value: 0.43250115503666103.
[I 2024-12-04 11:53:43,735] Trial 355 finished with value: 0.560733148846327 and parameters: {'max_depth': 28, 'min_samples_split': 2, 'min_samples_leaf': 1, 'max_features': 'sqrt', 'criterion': 'squared_error', 'splitter': 'best'}. Best is trial 91 with value: 0.43250115503666103.
[I 2024-12-04 11:53:44,188] Trial 354 finished with value: 0.45634040793959746 and parameters: {'max_depth': 35, 'min_samples_split': 3, 'min_samples_leaf': 1, 'max_features': 'sqrt', 'criterion': 'squared_error', 'splitter': 'best'}. Best is trial 91 with value: 0.43250115503666103.
[I 2024-12-04 11:53:45,391] Trial 346 finished with value: 0.5224339518340543 and parameters: {'max_depth': 28, 'min_samples_split': 7, 'min_samples_leaf': 1, 'max_features': 'sqrt', 'criterion': 'friedman_mse', 'splitter': 'best'}. Best is trial 91 with value: 0.43250115503666103.
[I 2024-12-04 11:53:45,603] Trial 363 finished with value: 0.483263059820054 and parameters: {'max_depth': 35, 'min_samples_split': 5, 'min_samples_leaf': 1, 'max_features': 'sqrt', 'criterion': 'squared_error', 'splitter': 'best'}. Best is trial 91 with value: 0.43250115503666103.
[I 2024-12-04 11:53:45,984] Trial 359 finished with value: 0.5109654269115765 and parameters: {'max_depth': 35, 'min_samples_split': 2, 'min_samples_leaf': 1, 'max_features': 'sqrt', 'criterion': 'squared_error', 'splitter': 'best'}. Best is trial 91 with value: 0.43250115503666103.
[I 2024-12-04 11:53:46,100] Trial 353 finished with value: 0.6013237460643723 and parameters: {'max_depth': 35, 'min_samples_split': 5, 'min_samples_leaf': 3, 'max_features': 'sqrt', 'criterion': 'squared_error', 'splitter': 'best'}. Best is trial 91 with value: 0.43250115503666103.
[I 2024-12-04 11:53:46,669] Trial 357 finished with value: 0.9984670529576771 and parameters: {'max_depth': 7, 'min_samples_split': 19, 'min_samples_leaf': 9, 'max_features': 'log2', 'criterion': 'absolute_error', 'splitter': 'random'}. Best is trial 91 with value: 0.43250115503666103.
[I 2024-12-04 11:53:46,966] Trial 356 finished with value: 0.4750683632054112 and parameters: {'max_depth': 35, 'min_samples_split': 4, 'min_samples_leaf': 1, 'max_features': 'sqrt', 'criterion': 'squared_error', 'splitter': 'best'}. Best is trial 91 with value: 0.43250115503666103.
[I 2024-12-04 11:53:46,991] Trial 361 finished with value: 0.852683232997416 and parameters: {'max_depth': 34, 'min_samples_split': 6, 'min_samples_leaf': 2, 'max_features': 'log2', 'criterion': 'squared_error', 'splitter': 'best'}. Best is trial 91 with value: 0.43250115503666103.
[I 2024-12-04 11:53:47,943] Trial 366 finished with value: 0.5630541891252331 and parameters: {'max_depth': 26, 'min_samples_split': 5, 'min_samples_leaf': 1, 'max_features': 'sqrt', 'criterion': 'squared_error', 'splitter': 'best'}. Best is trial 91 with value: 0.43250115503666103.
[I 2024-12-04 11:53:48,551] Trial 358 finished with value: 0.6954244089851592 and parameters: {'max_depth': 35, 'min_samples_split': 19, 'min_samples_leaf': 2, 'max_features': 'sqrt', 'criterion': 'friedman_mse', 'splitter': 'random'}. Best is trial 91 with value: 0.43250115503666103.
[I 2024-12-04 11:53:49,403] Trial 377 finished with value: 0.5863762311045088 and parameters: {'max_depth': 27, 'min_samples_split': 2, 'min_samples_leaf': 2, 'max_features': 'sqrt', 'criterion': 'squared_error', 'splitter': 'best'}. Best is trial 91 with value: 0.43250115503666103.
[I 2024-12-04 11:53:49,592] Trial 364 finished with value: 0.6013237460643723 and parameters: {'max_depth': 35, 'min_samples_split': 5, 'min_samples_leaf': 3, 'max_features': 'sqrt', 'criterion': 'squared_error', 'splitter': 'best'}. Best is trial 91 with value: 0.43250115503666103.
[I 2024-12-04 11:53:49,644] Trial 367 finished with value: 0.5253463055827569 and parameters: {'max_depth': 30, 'min_samples_split': 4, 'min_samples_leaf': 1, 'max_features': 'sqrt', 'criterion': 'squared_error', 'splitter': 'best'}. Best is trial 91 with value: 0.43250115503666103.
[I 2024-12-04 11:53:49,708] Trial 360 finished with value: 0.4560512309740644 and parameters: {'max_depth': 33, 'min_samples_split': 3, 'min_samples_leaf': 1, 'max_features': 'sqrt', 'criterion': 'friedman_mse', 'splitter': 'best'}. Best is trial 91 with value: 0.43250115503666103.
[I 2024-12-04 11:53:50,153] Trial 372 finished with value: 0.5109654269115765 and parameters: {'max_depth': 35, 'min_samples_split': 2, 'min_samples_leaf': 1, 'max_features': 'sqrt', 'criterion': 'squared_error', 'splitter': 'best'}. Best is trial 91 with value: 0.43250115503666103.
[I 2024-12-04 11:53:50,375] Trial 365 finished with value: 0.7012522635528762 and parameters: {'max_depth': 35, 'min_samples_split': 2, 'min_samples_leaf': 3, 'max_features': 'sqrt', 'criterion': 'squared_error', 'splitter': 'random'}. Best is trial 91 with value: 0.43250115503666103.
[I 2024-12-04 11:53:50,774] Trial 376 finished with value: 0.4750683632054112 and parameters: {'max_depth': 35, 'min_samples_split': 4, 'min_samples_leaf': 1, 'max_features': 'sqrt', 'criterion': 'squared_error', 'splitter': 'best'}. Best is trial 91 with value: 0.43250115503666103.
[I 2024-12-04 11:53:50,975] Trial 362 finished with value: 0.5109654269115765 and parameters: {'max_depth': 35, 'min_samples_split': 2, 'min_samples_leaf': 1, 'max_features': 'sqrt', 'criterion': 'squared_error', 'splitter': 'best'}. Best is trial 91 with value: 0.43250115503666103.
[I 2024-12-04 11:53:51,525] Trial 380 finished with value: 0.49400130203858805 and parameters: {'max_depth': 31, 'min_samples_split': 3, 'min_samples_leaf': 1, 'max_features': 'sqrt', 'criterion': 'friedman_mse', 'splitter': 'best'}. Best is trial 91 with value: 0.43250115503666103.
[I 2024-12-04 11:53:51,692] Trial 373 finished with value: 0.4888124090738055 and parameters: {'max_depth': 30, 'min_samples_split': 3, 'min_samples_leaf': 1, 'max_features': 'sqrt', 'criterion': 'squared_error', 'splitter': 'best'}. Best is trial 91 with value: 0.43250115503666103.
[I 2024-12-04 11:53:52,063] Trial 371 finished with value: 0.9597516113963797 and parameters: {'max_depth': 26, 'min_samples_split': 15, 'min_samples_leaf': 10, 'max_features': 'sqrt', 'criterion': 'friedman_mse', 'splitter': 'random'}. Best is trial 91 with value: 0.43250115503666103.
[I 2024-12-04 11:53:52,088] Trial 379 finished with value: 0.5232127948652044 and parameters: {'max_depth': 27, 'min_samples_split': 4, 'min_samples_leaf': 1, 'max_features': 'sqrt', 'criterion': 'friedman_mse', 'splitter': 'best'}. Best is trial 91 with value: 0.43250115503666103.
[I 2024-12-04 11:53:52,229] Trial 386 finished with value: 0.4899680550638981 and parameters: {'max_depth': 32, 'min_samples_split': 2, 'min_samples_leaf': 1, 'max_features': 'sqrt', 'criterion': 'friedman_mse', 'splitter': 'best'}. Best is trial 91 with value: 0.43250115503666103.
[I 2024-12-04 11:53:53,524] Trial 370 finished with value: 0.4956835384456977 and parameters: {'max_depth': 30, 'min_samples_split': 2, 'min_samples_leaf': 1, 'max_features': 'sqrt', 'criterion': 'squared_error', 'splitter': 'best'}. Best is trial 91 with value: 0.43250115503666103.
[I 2024-12-04 11:53:53,769] Trial 375 finished with value: 0.5243141632358264 and parameters: {'max_depth': 33, 'min_samples_split': 16, 'min_samples_leaf': 1, 'max_features': 'sqrt', 'criterion': 'friedman_mse', 'splitter': 'best'}. Best is trial 91 with value: 0.43250115503666103.
[I 2024-12-04 11:53:53,800] Trial 369 finished with value: 0.5713486057319509 and parameters: {'max_depth': 33, 'min_samples_split': 3, 'min_samples_leaf': 2, 'max_features': 'sqrt', 'criterion': 'friedman_mse', 'splitter': 'best'}. Best is trial 91 with value: 0.43250115503666103.
[I 2024-12-04 11:53:54,107] Trial 387 finished with value: 0.5111102367501217 and parameters: {'max_depth': 35, 'min_samples_split': 4, 'min_samples_leaf': 1, 'max_features': 'log2', 'criterion': 'friedman_mse', 'splitter': 'best'}. Best is trial 91 with value: 0.43250115503666103.
[I 2024-12-04 11:53:54,272] Trial 383 finished with value: 0.4899680550638981 and parameters: {'max_depth': 32, 'min_samples_split': 2, 'min_samples_leaf': 1, 'max_features': 'sqrt', 'criterion': 'friedman_mse', 'splitter': 'best'}. Best is trial 91 with value: 0.43250115503666103.
[I 2024-12-04 11:53:54,638] Trial 378 finished with value: 0.47380166885251596 and parameters: {'max_depth': 31, 'min_samples_split': 4, 'min_samples_leaf': 1, 'max_features': 'sqrt', 'criterion': 'friedman_mse', 'splitter': 'best'}. Best is trial 91 with value: 0.43250115503666103.
[I 2024-12-04 11:53:55,300] Trial 382 finished with value: 0.804624757140486 and parameters: {'max_depth': 10, 'min_samples_split': 5, 'min_samples_leaf': 1, 'max_features': 'sqrt', 'criterion': 'friedman_mse', 'splitter': 'best'}. Best is trial 91 with value: 0.43250115503666103.
[I 2024-12-04 11:53:55,388] Trial 374 finished with value: 0.6956034395868106 and parameters: {'max_depth': 28, 'min_samples_split': 6, 'min_samples_leaf': 10, 'max_features': 'sqrt', 'criterion': 'friedman_mse', 'splitter': 'best'}. Best is trial 91 with value: 0.43250115503666103.
[I 2024-12-04 11:53:55,612] Trial 381 finished with value: 0.4699278115690271 and parameters: {'max_depth': 30, 'min_samples_split': 5, 'min_samples_leaf': 1, 'max_features': 'sqrt', 'criterion': 'squared_error', 'splitter': 'best'}. Best is trial 91 with value: 0.43250115503666103.
