[I 2024-12-04 11:51:38,749] A new study created in RDB with name: Omega_dt
[I 2024-12-04 11:51:42,496] Trial 4 finished with value: 1.377061356234688 and parameters: {'max_depth': 21, 'min_samples_split': 18, 'min_samples_leaf': 3, 'max_features': 'log2', 'criterion': 'absolute_error', 'splitter': 'random'}. Best is trial 4 with value: 1.377061356234688.
[I 2024-12-04 11:51:43,861] Trial 5 finished with value: 0.954720278877658 and parameters: {'max_depth': 28, 'min_samples_split': 10, 'min_samples_leaf': 1, 'max_features': 'sqrt', 'criterion': 'squared_error', 'splitter': 'random'}. Best is trial 5 with value: 0.954720278877658.
[I 2024-12-04 11:51:43,912] Trial 23 finished with value: 1.0651561940117558 and parameters: {'max_depth': 9, 'min_samples_split': 15, 'min_samples_leaf': 5, 'max_features': 'sqrt', 'criterion': 'squared_error', 'splitter': 'best'}. Best is trial 5 with value: 0.954720278877658.
[I 2024-12-04 11:51:44,172] Trial 14 finished with value: 1.259809444253076 and parameters: {'max_depth': 31, 'min_samples_split': 4, 'min_samples_leaf': 8, 'max_features': 'sqrt', 'criterion': 'squared_error', 'splitter': 'random'}. Best is trial 5 with value: 0.954720278877658.
[I 2024-12-04 11:51:44,498] Trial 9 finished with value: 1.261454797635251 and parameters: {'max_depth': 26, 'min_samples_split': 7, 'min_samples_leaf': 5, 'max_features': 'log2', 'criterion': 'squared_error', 'splitter': 'best'}. Best is trial 5 with value: 0.954720278877658.
[I 2024-12-04 11:51:44,744] Trial 1 finished with value: 1.259809444253076 and parameters: {'max_depth': 15, 'min_samples_split': 20, 'min_samples_leaf': 7, 'max_features': 'sqrt', 'criterion': 'squared_error', 'splitter': 'random'}. Best is trial 5 with value: 0.954720278877658.
[I 2024-12-04 11:51:44,773] Trial 12 finished with value: 1.261454797635251 and parameters: {'max_depth': 15, 'min_samples_split': 15, 'min_samples_leaf': 7, 'max_features': 'log2', 'criterion': 'friedman_mse', 'splitter': 'random'}. Best is trial 5 with value: 0.954720278877658.
[I 2024-12-04 11:51:44,968] Trial 11 finished with value: 1.261454797635251 and parameters: {'max_depth': 11, 'min_samples_split': 14, 'min_samples_leaf': 10, 'max_features': 'log2', 'criterion': 'squared_error', 'splitter': 'random'}. Best is trial 5 with value: 0.954720278877658.
[I 2024-12-04 11:51:44,979] Trial 8 finished with value: 1.085029928131974 and parameters: {'max_depth': 32, 'min_samples_split': 18, 'min_samples_leaf': 7, 'max_features': 'sqrt', 'criterion': 'friedman_mse', 'splitter': 'best'}. Best is trial 5 with value: 0.954720278877658.
[I 2024-12-04 11:51:45,018] Trial 19 finished with value: 1.3737845361400185 and parameters: {'max_depth': 4, 'min_samples_split': 19, 'min_samples_leaf': 9, 'max_features': 'log2', 'criterion': 'absolute_error', 'splitter': 'best'}. Best is trial 5 with value: 0.954720278877658.
[I 2024-12-04 11:51:45,738] Trial 10 finished with value: 1.261454797635251 and parameters: {'max_depth': 1, 'min_samples_split': 19, 'min_samples_leaf': 7, 'max_features': 'log2', 'criterion': 'friedman_mse', 'splitter': 'best'}. Best is trial 5 with value: 0.954720278877658.
[I 2024-12-04 11:51:45,840] Trial 0 finished with value: 1.0651561940117558 and parameters: {'max_depth': 31, 'min_samples_split': 2, 'min_samples_leaf': 5, 'max_features': 'sqrt', 'criterion': 'squared_error', 'splitter': 'best'}. Best is trial 5 with value: 0.954720278877658.
[I 2024-12-04 11:51:46,060] Trial 25 finished with value: 1.1414220758396278 and parameters: {'max_depth': 12, 'min_samples_split': 5, 'min_samples_leaf': 2, 'max_features': 'sqrt', 'criterion': 'friedman_mse', 'splitter': 'random'}. Best is trial 5 with value: 0.954720278877658.
[I 2024-12-04 11:51:46,165] Trial 27 finished with value: 1.0855266432011492 and parameters: {'max_depth': 11, 'min_samples_split': 2, 'min_samples_leaf': 8, 'max_features': 'sqrt', 'criterion': 'squared_error', 'splitter': 'best'}. Best is trial 5 with value: 0.954720278877658.
[I 2024-12-04 11:51:46,685] Trial 7 finished with value: 1.064454954307853 and parameters: {'max_depth': 29, 'min_samples_split': 10, 'min_samples_leaf': 4, 'max_features': 'sqrt', 'criterion': 'absolute_error', 'splitter': 'best'}. Best is trial 5 with value: 0.954720278877658.
[I 2024-12-04 11:51:46,689] Trial 2 finished with value: 1.1670440043462913 and parameters: {'max_depth': 15, 'min_samples_split': 15, 'min_samples_leaf': 2, 'max_features': 'sqrt', 'criterion': 'absolute_error', 'splitter': 'random'}. Best is trial 5 with value: 0.954720278877658.
[I 2024-12-04 11:51:46,738] Trial 16 finished with value: 1.108159217523687 and parameters: {'max_depth': 3, 'min_samples_split': 16, 'min_samples_leaf': 2, 'max_features': 'log2', 'criterion': 'absolute_error', 'splitter': 'best'}. Best is trial 5 with value: 0.954720278877658.
[I 2024-12-04 11:51:47,017] Trial 26 finished with value: 1.2588692823571848 and parameters: {'max_depth': 1, 'min_samples_split': 20, 'min_samples_leaf': 1, 'max_features': 'sqrt', 'criterion': 'friedman_mse', 'splitter': 'best'}. Best is trial 15 with value: 0.5931811383733339.
[I 2024-12-04 11:51:47,021] Trial 17 finished with value: 1.259809444253076 and parameters: {'max_depth': 8, 'min_samples_split': 16, 'min_samples_leaf': 8, 'max_features': 'sqrt', 'criterion': 'friedman_mse', 'splitter': 'random'}. Best is trial 15 with value: 0.5931811383733339.
[I 2024-12-04 11:51:47,633] Trial 31 finished with value: 1.2388346947472622 and parameters: {'max_depth': 35, 'min_samples_split': 9, 'min_samples_leaf': 3, 'max_features': 'sqrt', 'criterion': 'squared_error', 'splitter': 'random'}. Best is trial 15 with value: 0.5931811383733339.
[I 2024-12-04 11:51:47,639] Trial 15 finished with value: 0.5931811383733339 and parameters: {'max_depth': 26, 'min_samples_split': 12, 'min_samples_leaf': 2, 'max_features': 'sqrt', 'criterion': 'squared_error', 'splitter': 'best'}. Best is trial 15 with value: 0.5931811383733339.
[I 2024-12-04 11:51:47,640] Trial 22 finished with value: 1.3737845361400185 and parameters: {'max_depth': 10, 'min_samples_split': 3, 'min_samples_leaf': 4, 'max_features': 'log2', 'criterion': 'absolute_error', 'splitter': 'random'}. Best is trial 15 with value: 0.5931811383733339.
[I 2024-12-04 11:51:47,642] Trial 28 finished with value: 1.4094873558287564 and parameters: {'max_depth': 18, 'min_samples_split': 11, 'min_samples_leaf': 9, 'max_features': 'sqrt', 'criterion': 'absolute_error', 'splitter': 'best'}. Best is trial 15 with value: 0.5931811383733339.
[I 2024-12-04 11:51:48,011] Trial 3 finished with value: 0.9424778759919019 and parameters: {'max_depth': 4, 'min_samples_split': 4, 'min_samples_leaf': 3, 'max_features': 'log2', 'criterion': 'friedman_mse', 'splitter': 'best'}. Best is trial 15 with value: 0.5931811383733339.
[I 2024-12-04 11:51:48,012] Trial 30 finished with value: 1.3737845361400185 and parameters: {'max_depth': 5, 'min_samples_split': 8, 'min_samples_leaf': 4, 'max_features': 'log2', 'criterion': 'absolute_error', 'splitter': 'random'}. Best is trial 15 with value: 0.5931811383733339.
[I 2024-12-04 11:51:48,691] Trial 6 finished with value: 1.261454797635251 and parameters: {'max_depth': 30, 'min_samples_split': 14, 'min_samples_leaf': 10, 'max_features': 'log2', 'criterion': 'squared_error', 'splitter': 'best'}. Best is trial 15 with value: 0.5931811383733339.
[I 2024-12-04 11:51:49,056] Trial 24 finished with value: 1.0707565500894376 and parameters: {'max_depth': 6, 'min_samples_split': 20, 'min_samples_leaf': 6, 'max_features': 'sqrt', 'criterion': 'squared_error', 'splitter': 'best'}. Best is trial 15 with value: 0.5931811383733339.
[I 2024-12-04 11:51:49,060] Trial 29 finished with value: 1.2632608007779964 and parameters: {'max_depth': 1, 'min_samples_split': 9, 'min_samples_leaf': 2, 'max_features': 'log2', 'criterion': 'friedman_mse', 'splitter': 'best'}. Best is trial 15 with value: 0.5931811383733339.
[I 2024-12-04 11:51:49,733] Trial 18 finished with value: 1.4094873558287564 and parameters: {'max_depth': 35, 'min_samples_split': 17, 'min_samples_leaf': 10, 'max_features': 'sqrt', 'criterion': 'absolute_error', 'splitter': 'best'}. Best is trial 15 with value: 0.5931811383733339.
[I 2024-12-04 11:51:50,245] Trial 13 finished with value: 0.7702123716874185 and parameters: {'max_depth': 29, 'min_samples_split': 14, 'min_samples_leaf': 1, 'max_features': 'log2', 'criterion': 'squared_error', 'splitter': 'best'}. Best is trial 36 with value: 0.5714557580864863.
[I 2024-12-04 11:51:50,922] Trial 36 finished with value: 0.5714557580864863 and parameters: {'max_depth': 21, 'min_samples_split': 10, 'min_samples_leaf': 2, 'max_features': 'sqrt', 'criterion': 'squared_error', 'splitter': 'best'}. Best is trial 36 with value: 0.5714557580864863.
[I 2024-12-04 11:51:50,953] Trial 21 finished with value: 1.261454797635251 and parameters: {'max_depth': 4, 'min_samples_split': 3, 'min_samples_leaf': 7, 'max_features': 'log2', 'criterion': 'friedman_mse', 'splitter': 'best'}. Best is trial 36 with value: 0.5714557580864863.
[I 2024-12-04 11:51:51,886] Trial 35 finished with value: 0.6464247632862057 and parameters: {'max_depth': 28, 'min_samples_split': 9, 'min_samples_leaf': 1, 'max_features': 'sqrt', 'criterion': 'friedman_mse', 'splitter': 'best'}. Best is trial 36 with value: 0.5714557580864863.
[I 2024-12-04 11:51:51,945] Trial 34 finished with value: 0.7710450186010483 and parameters: {'max_depth': 31, 'min_samples_split': 19, 'min_samples_leaf': 1, 'max_features': 'log2', 'criterion': 'squared_error', 'splitter': 'best'}. Best is trial 36 with value: 0.5714557580864863.
[I 2024-12-04 11:51:53,159] Trial 37 finished with value: 0.5993536123214039 and parameters: {'max_depth': 24, 'min_samples_split': 14, 'min_samples_leaf': 1, 'max_features': 'sqrt', 'criterion': 'friedman_mse', 'splitter': 'best'}. Best is trial 36 with value: 0.5714557580864863.
[I 2024-12-04 11:51:53,518] Trial 20 finished with value: 1.0651561940117558 and parameters: {'max_depth': 14, 'min_samples_split': 14, 'min_samples_leaf': 5, 'max_features': 'sqrt', 'criterion': 'squared_error', 'splitter': 'best'}. Best is trial 36 with value: 0.5714557580864863.
[I 2024-12-04 11:51:53,753] Trial 51 finished with value: 0.6203812549134927 and parameters: {'max_depth': 28, 'min_samples_split': 3, 'min_samples_leaf': 1, 'max_features': 'sqrt', 'criterion': 'friedman_mse', 'splitter': 'best'}. Best is trial 36 with value: 0.5714557580864863.
[I 2024-12-04 11:51:53,954] Trial 33 finished with value: 0.6477715545324221 and parameters: {'max_depth': 21, 'min_samples_split': 8, 'min_samples_leaf': 1, 'max_features': 'sqrt', 'criterion': 'squared_error', 'splitter': 'best'}. Best is trial 36 with value: 0.5714557580864863.
[I 2024-12-04 11:51:54,377] Trial 43 finished with value: 0.635479882798338 and parameters: {'max_depth': 30, 'min_samples_split': 4, 'min_samples_leaf': 1, 'max_features': 'sqrt', 'criterion': 'friedman_mse', 'splitter': 'best'}. Best is trial 36 with value: 0.5714557580864863.
[I 2024-12-04 11:51:54,982] Trial 44 finished with value: 0.8229064641197833 and parameters: {'max_depth': 25, 'min_samples_split': 12, 'min_samples_leaf': 1, 'max_features': 'log2', 'criterion': 'squared_error', 'splitter': 'best'}. Best is trial 36 with value: 0.5714557580864863.
[I 2024-12-04 11:51:55,261] Trial 32 finished with value: 0.9424778759919019 and parameters: {'max_depth': 28, 'min_samples_split': 5, 'min_samples_leaf': 3, 'max_features': 'log2', 'criterion': 'friedman_mse', 'splitter': 'best'}. Best is trial 36 with value: 0.5714557580864863.
[I 2024-12-04 11:51:55,849] Trial 49 finished with value: 1.259809444253076 and parameters: {'max_depth': 21, 'min_samples_split': 13, 'min_samples_leaf': 4, 'max_features': 'sqrt', 'criterion': 'friedman_mse', 'splitter': 'random'}. Best is trial 41 with value: 0.5638995247461974.
[I 2024-12-04 11:51:56,018] Trial 47 finished with value: 0.5764982667487542 and parameters: {'max_depth': 21, 'min_samples_split': 18, 'min_samples_leaf': 1, 'max_features': 'sqrt', 'criterion': 'friedman_mse', 'splitter': 'best'}. Best is trial 41 with value: 0.5638995247461974.
[I 2024-12-04 11:51:56,019] Trial 52 finished with value: 1.0651561940117558 and parameters: {'max_depth': 16, 'min_samples_split': 20, 'min_samples_leaf': 4, 'max_features': 'sqrt', 'criterion': 'friedman_mse', 'splitter': 'best'}. Best is trial 41 with value: 0.5638995247461974.
[I 2024-12-04 11:51:57,174] Trial 56 finished with value: 0.9493176373576206 and parameters: {'max_depth': 19, 'min_samples_split': 20, 'min_samples_leaf': 1, 'max_features': 'sqrt', 'criterion': 'squared_error', 'splitter': 'random'}. Best is trial 41 with value: 0.5638995247461974.
[I 2024-12-04 11:51:57,180] Trial 39 finished with value: 1.0651561940117558 and parameters: {'max_depth': 28, 'min_samples_split': 15, 'min_samples_leaf': 4, 'max_features': 'sqrt', 'criterion': 'squared_error', 'splitter': 'best'}. Best is trial 41 with value: 0.5638995247461974.
[I 2024-12-04 11:51:57,727] Trial 58 finished with value: 1.2388346947472622 and parameters: {'max_depth': 15, 'min_samples_split': 11, 'min_samples_leaf': 3, 'max_features': 'sqrt', 'criterion': 'squared_error', 'splitter': 'random'}. Best is trial 41 with value: 0.5638995247461974.
[I 2024-12-04 11:51:57,835] Trial 41 finished with value: 0.5638995247461974 and parameters: {'max_depth': 29, 'min_samples_split': 19, 'min_samples_leaf': 1, 'max_features': 'sqrt', 'criterion': 'friedman_mse', 'splitter': 'best'}. Best is trial 45 with value: 0.5614145525970277.
[I 2024-12-04 11:51:57,912] Trial 59 finished with value: 0.5823455371770782 and parameters: {'max_depth': 22, 'min_samples_split': 20, 'min_samples_leaf': 1, 'max_features': 'sqrt', 'criterion': 'friedman_mse', 'splitter': 'best'}. Best is trial 45 with value: 0.5614145525970277.
[I 2024-12-04 11:51:58,395] Trial 46 finished with value: 1.0084230034700212 and parameters: {'max_depth': 15, 'min_samples_split': 13, 'min_samples_leaf': 2, 'max_features': 'sqrt', 'criterion': 'absolute_error', 'splitter': 'best'}. Best is trial 45 with value: 0.5614145525970277.
[I 2024-12-04 11:51:58,427] Trial 38 finished with value: 1.0746652081803512 and parameters: {'max_depth': 17, 'min_samples_split': 17, 'min_samples_leaf': 3, 'max_features': 'sqrt', 'criterion': 'friedman_mse', 'splitter': 'best'}. Best is trial 45 with value: 0.5614145525970277.
[I 2024-12-04 11:51:58,452] Trial 45 finished with value: 0.5614145525970277 and parameters: {'max_depth': 32, 'min_samples_split': 16, 'min_samples_leaf': 1, 'max_features': 'sqrt', 'criterion': 'squared_error', 'splitter': 'best'}. Best is trial 45 with value: 0.5614145525970277.
[I 2024-12-04 11:51:58,708] Trial 53 finished with value: 0.6366870857247696 and parameters: {'max_depth': 29, 'min_samples_split': 16, 'min_samples_leaf': 2, 'max_features': 'sqrt', 'criterion': 'friedman_mse', 'splitter': 'best'}. Best is trial 45 with value: 0.5614145525970277.
[I 2024-12-04 11:51:59,200] Trial 55 finished with value: 0.6388392912241687 and parameters: {'max_depth': 17, 'min_samples_split': 13, 'min_samples_leaf': 1, 'max_features': 'sqrt', 'criterion': 'friedman_mse', 'splitter': 'best'}. Best is trial 45 with value: 0.5614145525970277.
[I 2024-12-04 11:51:59,477] Trial 54 finished with value: 0.6194020471611092 and parameters: {'max_depth': 29, 'min_samples_split': 2, 'min_samples_leaf': 1, 'max_features': 'sqrt', 'criterion': 'friedman_mse', 'splitter': 'random'}. Best is trial 45 with value: 0.5614145525970277.
[I 2024-12-04 11:51:59,574] Trial 64 finished with value: 1.064454954307853 and parameters: {'max_depth': 25, 'min_samples_split': 17, 'min_samples_leaf': 4, 'max_features': 'sqrt', 'criterion': 'absolute_error', 'splitter': 'best'}. Best is trial 45 with value: 0.5614145525970277.
[I 2024-12-04 11:51:59,590] Trial 50 finished with value: 0.9424778759919019 and parameters: {'max_depth': 20, 'min_samples_split': 16, 'min_samples_leaf': 2, 'max_features': 'log2', 'criterion': 'friedman_mse', 'splitter': 'best'}. Best is trial 45 with value: 0.5614145525970277.
[I 2024-12-04 11:52:00,047] Trial 40 finished with value: 0.9596659829097772 and parameters: {'max_depth': 24, 'min_samples_split': 5, 'min_samples_leaf': 1, 'max_features': 'sqrt', 'criterion': 'friedman_mse', 'splitter': 'random'}. Best is trial 45 with value: 0.5614145525970277.
[I 2024-12-04 11:52:00,178] Trial 48 finished with value: 0.8240540453073948 and parameters: {'max_depth': 33, 'min_samples_split': 19, 'min_samples_leaf': 1, 'max_features': 'sqrt', 'criterion': 'friedman_mse', 'splitter': 'random'}. Best is trial 45 with value: 0.5614145525970277.
[I 2024-12-04 11:52:00,484] Trial 60 finished with value: 0.6062520417811941 and parameters: {'max_depth': 30, 'min_samples_split': 14, 'min_samples_leaf': 1, 'max_features': 'sqrt', 'criterion': 'squared_error', 'splitter': 'best'}. Best is trial 45 with value: 0.5614145525970277.
[I 2024-12-04 11:52:01,111] Trial 42 finished with value: 1.0746652081803512 and parameters: {'max_depth': 29, 'min_samples_split': 20, 'min_samples_leaf': 3, 'max_features': 'sqrt', 'criterion': 'friedman_mse', 'splitter': 'best'}. Best is trial 45 with value: 0.5614145525970277.
[I 2024-12-04 11:52:01,254] Trial 57 finished with value: 0.7712377021886665 and parameters: {'max_depth': 26, 'min_samples_split': 20, 'min_samples_leaf': 1, 'max_features': 'log2', 'criterion': 'friedman_mse', 'splitter': 'best'}. Best is trial 45 with value: 0.5614145525970277.
[I 2024-12-04 11:52:01,295] Trial 63 finished with value: 0.9942801996010789 and parameters: {'max_depth': 30, 'min_samples_split': 20, 'min_samples_leaf': 1, 'max_features': 'sqrt', 'criterion': 'absolute_error', 'splitter': 'best'}. Best is trial 45 with value: 0.5614145525970277.
[I 2024-12-04 11:52:01,559] Trial 61 finished with value: 0.5743856205068374 and parameters: {'max_depth': 27, 'min_samples_split': 17, 'min_samples_leaf': 1, 'max_features': 'sqrt', 'criterion': 'friedman_mse', 'splitter': 'best'}. Best is trial 45 with value: 0.5614145525970277.
[I 2024-12-04 11:52:02,674] Trial 65 finished with value: 1.0651561940117558 and parameters: {'max_depth': 22, 'min_samples_split': 7, 'min_samples_leaf': 5, 'max_features': 'sqrt', 'criterion': 'squared_error', 'splitter': 'best'}. Best is trial 45 with value: 0.5614145525970277.
[I 2024-12-04 11:52:02,769] Trial 69 finished with value: 0.5764982667487542 and parameters: {'max_depth': 21, 'min_samples_split': 18, 'min_samples_leaf': 1, 'max_features': 'sqrt', 'criterion': 'friedman_mse', 'splitter': 'best'}. Best is trial 45 with value: 0.5614145525970277.
[I 2024-12-04 11:52:03,048] Trial 62 finished with value: 0.5720131029894097 and parameters: {'max_depth': 26, 'min_samples_split': 15, 'min_samples_leaf': 1, 'max_features': 'sqrt', 'criterion': 'squared_error', 'splitter': 'best'}. Best is trial 45 with value: 0.5614145525970277.
[I 2024-12-04 11:52:03,837] Trial 74 finished with value: 0.5856781341418308 and parameters: {'max_depth': 23, 'min_samples_split': 20, 'min_samples_leaf': 1, 'max_features': 'sqrt', 'criterion': 'squared_error', 'splitter': 'best'}. Best is trial 45 with value: 0.5614145525970277.
[I 2024-12-04 11:52:04,484] Trial 71 finished with value: 1.4221560177793797 and parameters: {'max_depth': 3, 'min_samples_split': 4, 'min_samples_leaf': 1, 'max_features': 'sqrt', 'criterion': 'absolute_error', 'splitter': 'best'}. Best is trial 45 with value: 0.5614145525970277.
[I 2024-12-04 11:52:04,990] Trial 67 finished with value: 0.5945975836542683 and parameters: {'max_depth': 27, 'min_samples_split': 20, 'min_samples_leaf': 2, 'max_features': 'sqrt', 'criterion': 'squared_error', 'splitter': 'best'}. Best is trial 45 with value: 0.5614145525970277.
[I 2024-12-04 11:52:05,509] Trial 68 finished with value: 1.0773272630241892 and parameters: {'max_depth': 7, 'min_samples_split': 5, 'min_samples_leaf': 4, 'max_features': 'sqrt', 'criterion': 'absolute_error', 'splitter': 'best'}. Best is trial 45 with value: 0.5614145525970277.
[I 2024-12-04 11:52:05,915] Trial 72 finished with value: 0.5839147361488086 and parameters: {'max_depth': 33, 'min_samples_split': 18, 'min_samples_leaf': 1, 'max_features': 'sqrt', 'criterion': 'friedman_mse', 'splitter': 'best'}. Best is trial 45 with value: 0.5614145525970277.
[I 2024-12-04 11:52:05,935] Trial 73 finished with value: 0.5845101435585719 and parameters: {'max_depth': 33, 'min_samples_split': 17, 'min_samples_leaf': 1, 'max_features': 'sqrt', 'criterion': 'squared_error', 'splitter': 'best'}. Best is trial 45 with value: 0.5614145525970277.
[I 2024-12-04 11:52:06,401] Trial 70 finished with value: 1.3737845361400185 and parameters: {'max_depth': 1, 'min_samples_split': 6, 'min_samples_leaf': 9, 'max_features': 'log2', 'criterion': 'absolute_error', 'splitter': 'random'}. Best is trial 45 with value: 0.5614145525970277.
[I 2024-12-04 11:52:06,728] Trial 78 finished with value: 0.5836321509919492 and parameters: {'max_depth': 24, 'min_samples_split': 20, 'min_samples_leaf': 1, 'max_features': 'sqrt', 'criterion': 'friedman_mse', 'splitter': 'best'}. Best is trial 45 with value: 0.5614145525970277.
[I 2024-12-04 11:52:06,855] Trial 66 finished with value: 1.259809444253076 and parameters: {'max_depth': 33, 'min_samples_split': 16, 'min_samples_leaf': 4, 'max_features': 'sqrt', 'criterion': 'squared_error', 'splitter': 'random'}. Best is trial 45 with value: 0.5614145525970277.
[I 2024-12-04 11:52:09,122] Trial 80 finished with value: 0.7013521374911867 and parameters: {'max_depth': 12, 'min_samples_split': 19, 'min_samples_leaf': 1, 'max_features': 'sqrt', 'criterion': 'friedman_mse', 'splitter': 'best'}. Best is trial 45 with value: 0.5614145525970277.
