[I 2024-12-04 12:40:04,127] Trial 1337 finished with value: 0.367883290282142 and parameters: {'n_estimators': 1448, 'learning_rate': 0.06301869910037858, 'max_depth': 8, 'min_samples_split': 2, 'min_samples_leaf': 4, 'subsample': 0.6407749579422103, 'max_features': None}. Best is trial 989 with value: 0.3092662874814911.
[I 2024-12-04 12:40:05,610] Trial 1340 finished with value: 0.37185343947211913 and parameters: {'n_estimators': 1058, 'learning_rate': 0.04481188740554959, 'max_depth': 6, 'min_samples_split': 2, 'min_samples_leaf': 4, 'subsample': 0.6796730324112473, 'max_features': None}. Best is trial 989 with value: 0.3092662874814911.
[I 2024-12-04 12:40:08,079] Trial 1354 finished with value: 0.38751837308111675 and parameters: {'n_estimators': 465, 'learning_rate': 0.09506946327808029, 'max_depth': 5, 'min_samples_split': 3, 'min_samples_leaf': 4, 'subsample': 0.6330118139427326, 'max_features': None}. Best is trial 989 with value: 0.3092662874814911.
[I 2024-12-04 12:40:08,487] Trial 1334 finished with value: 0.39884764703964176 and parameters: {'n_estimators': 1478, 'learning_rate': 0.0850133181266534, 'max_depth': 4, 'min_samples_split': 2, 'min_samples_leaf': 3, 'subsample': 0.7259330675458351, 'max_features': None}. Best is trial 989 with value: 0.3092662874814911.
[I 2024-12-04 12:40:14,739] Trial 1342 finished with value: 0.3737093083680365 and parameters: {'n_estimators': 1428, 'learning_rate': 0.0626632391100808, 'max_depth': 5, 'min_samples_split': 4, 'min_samples_leaf': 1, 'subsample': 0.660734377286364, 'max_features': None}. Best is trial 989 with value: 0.3092662874814911.
[I 2024-12-04 12:40:16,102] Trial 1343 finished with value: 0.5537242668992592 and parameters: {'n_estimators': 1016, 'learning_rate': 0.014649335406887254, 'max_depth': 12, 'min_samples_split': 4, 'min_samples_leaf': 9, 'subsample': 0.875900572362045, 'max_features': None}. Best is trial 989 with value: 0.3092662874814911.
[I 2024-12-04 12:40:17,243] Trial 1341 finished with value: 0.39715404612098393 and parameters: {'n_estimators': 1393, 'learning_rate': 0.09750948024816251, 'max_depth': 5, 'min_samples_split': 2, 'min_samples_leaf': 3, 'subsample': 0.7315488114728551, 'max_features': None}. Best is trial 989 with value: 0.3092662874814911.
[I 2024-12-04 12:40:18,883] Trial 1352 finished with value: 0.37318362811048145 and parameters: {'n_estimators': 946, 'learning_rate': 0.09995348893300278, 'max_depth': 7, 'min_samples_split': 7, 'min_samples_leaf': 3, 'subsample': 0.6631010432143977, 'max_features': None}. Best is trial 989 with value: 0.3092662874814911.
[I 2024-12-04 12:40:19,865] Trial 1349 finished with value: 0.33312534726407983 and parameters: {'n_estimators': 1328, 'learning_rate': 0.0733892862974416, 'max_depth': 5, 'min_samples_split': 2, 'min_samples_leaf': 2, 'subsample': 0.6949500744001882, 'max_features': None}. Best is trial 989 with value: 0.3092662874814911.
[I 2024-12-04 12:40:19,870] Trial 1346 finished with value: 0.4165675738308173 and parameters: {'n_estimators': 975, 'learning_rate': 0.02379182001065651, 'max_depth': 4, 'min_samples_split': 18, 'min_samples_leaf': 1, 'subsample': 0.6422834974529084, 'max_features': None}. Best is trial 989 with value: 0.3092662874814911.
[I 2024-12-04 12:40:23,291] Trial 1347 finished with value: 0.32752120145033126 and parameters: {'n_estimators': 1260, 'learning_rate': 0.041952818626047404, 'max_depth': 7, 'min_samples_split': 2, 'min_samples_leaf': 2, 'subsample': 0.6056246492536715, 'max_features': None}. Best is trial 989 with value: 0.3092662874814911.
[I 2024-12-04 12:40:24,298] Trial 1351 finished with value: 0.32792640652211097 and parameters: {'n_estimators': 1132, 'learning_rate': 0.04353371141020189, 'max_depth': 7, 'min_samples_split': 2, 'min_samples_leaf': 2, 'subsample': 0.6801885141289739, 'max_features': None}. Best is trial 989 with value: 0.3092662874814911.
[I 2024-12-04 12:40:24,299] Trial 1350 finished with value: 0.3547847962682801 and parameters: {'n_estimators': 1343, 'learning_rate': 0.08460658483527368, 'max_depth': 8, 'min_samples_split': 5, 'min_samples_leaf': 2, 'subsample': 0.7575649092443296, 'max_features': 'sqrt'}. Best is trial 989 with value: 0.3092662874814911.
[I 2024-12-04 12:40:27,053] Trial 1373 finished with value: 0.34326645389662946 and parameters: {'n_estimators': 396, 'learning_rate': 0.0923755389532667, 'max_depth': 7, 'min_samples_split': 3, 'min_samples_leaf': 2, 'subsample': 0.6536323597719246, 'max_features': None}. Best is trial 989 with value: 0.3092662874814911.
[I 2024-12-04 12:40:29,631] Trial 1364 finished with value: 0.4134883269365609 and parameters: {'n_estimators': 809, 'learning_rate': 0.031372273308879074, 'max_depth': 3, 'min_samples_split': 15, 'min_samples_leaf': 2, 'subsample': 0.875041815410156, 'max_features': None}. Best is trial 989 with value: 0.3092662874814911.
[I 2024-12-04 12:40:31,190] Trial 1345 finished with value: 0.37785896323887574 and parameters: {'n_estimators': 1439, 'learning_rate': 0.045641227457325434, 'max_depth': 7, 'min_samples_split': 2, 'min_samples_leaf': 1, 'subsample': 0.6790609777489036, 'max_features': None}. Best is trial 989 with value: 0.3092662874814911.
[I 2024-12-04 12:40:32,199] Trial 1359 finished with value: 0.4382884578747717 and parameters: {'n_estimators': 1172, 'learning_rate': 0.04099368219744692, 'max_depth': 7, 'min_samples_split': 3, 'min_samples_leaf': 2, 'subsample': 0.744370864656325, 'max_features': 'log2'}. Best is trial 989 with value: 0.3092662874814911.
[I 2024-12-04 12:40:34,873] Trial 1365 finished with value: 0.5893204621399105 and parameters: {'n_estimators': 934, 'learning_rate': 0.09220755536002434, 'max_depth': 4, 'min_samples_split': 5, 'min_samples_leaf': 10, 'subsample': 0.7334231431025173, 'max_features': 'sqrt'}. Best is trial 989 with value: 0.3092662874814911.
[I 2024-12-04 12:40:35,777] Trial 1374 finished with value: 0.3895332006036533 and parameters: {'n_estimators': 663, 'learning_rate': 0.08509845498560803, 'max_depth': 5, 'min_samples_split': 6, 'min_samples_leaf': 1, 'subsample': 0.6142265196481158, 'max_features': None}. Best is trial 989 with value: 0.3092662874814911.
[I 2024-12-04 12:40:37,211] Trial 1360 finished with value: 0.4073131955293423 and parameters: {'n_estimators': 1226, 'learning_rate': 0.0841657738908061, 'max_depth': 4, 'min_samples_split': 7, 'min_samples_leaf': 2, 'subsample': 0.6453126397992703, 'max_features': 'log2'}. Best is trial 989 with value: 0.3092662874814911.
[I 2024-12-04 12:40:37,565] Trial 1370 finished with value: 0.34265427833261825 and parameters: {'n_estimators': 815, 'learning_rate': 0.0728850382496606, 'max_depth': 8, 'min_samples_split': 3, 'min_samples_leaf': 2, 'subsample': 0.6028948651292345, 'max_features': None}. Best is trial 989 with value: 0.3092662874814911.
[I 2024-12-04 12:40:38,761] Trial 1361 finished with value: 0.545112868146704 and parameters: {'n_estimators': 1263, 'learning_rate': 0.01462685192662047, 'max_depth': 5, 'min_samples_split': 11, 'min_samples_leaf': 1, 'subsample': 0.8323173590028713, 'max_features': 'log2'}. Best is trial 989 with value: 0.3092662874814911.
[I 2024-12-04 12:40:39,965] Trial 1355 finished with value: 0.37340511201313115 and parameters: {'n_estimators': 1355, 'learning_rate': 0.0664374149506287, 'max_depth': 5, 'min_samples_split': 2, 'min_samples_leaf': 1, 'subsample': 0.6853524634417048, 'max_features': None}. Best is trial 989 with value: 0.3092662874814911.
[I 2024-12-04 12:40:41,070] Trial 1356 finished with value: 0.4032593646836075 and parameters: {'n_estimators': 1362, 'learning_rate': 0.09473929191659983, 'max_depth': 4, 'min_samples_split': 2, 'min_samples_leaf': 3, 'subsample': 0.654922116902934, 'max_features': None}. Best is trial 989 with value: 0.3092662874814911.
[I 2024-12-04 12:40:41,931] Trial 1353 finished with value: 0.3796324588883414 and parameters: {'n_estimators': 1401, 'learning_rate': 0.09785685600659014, 'max_depth': 3, 'min_samples_split': 3, 'min_samples_leaf': 1, 'subsample': 0.6699677031357072, 'max_features': None}. Best is trial 989 with value: 0.3092662874814911.
[I 2024-12-04 12:40:43,850] Trial 1363 finished with value: 0.3896116967760936 and parameters: {'n_estimators': 1215, 'learning_rate': 0.07281646779983046, 'max_depth': 5, 'min_samples_split': 6, 'min_samples_leaf': 3, 'subsample': 0.6855782681344009, 'max_features': None}. Best is trial 989 with value: 0.3092662874814911.
[I 2024-12-04 12:40:45,189] Trial 1357 finished with value: 0.3446732897217798 and parameters: {'n_estimators': 1479, 'learning_rate': 0.09856547761089814, 'max_depth': 9, 'min_samples_split': 2, 'min_samples_leaf': 2, 'subsample': 0.6482440894689283, 'max_features': 'sqrt'}. Best is trial 989 with value: 0.3092662874814911.
[I 2024-12-04 12:40:45,229] Trial 1362 finished with value: 0.38350929623535324 and parameters: {'n_estimators': 1134, 'learning_rate': 0.06532790176864778, 'max_depth': 6, 'min_samples_split': 8, 'min_samples_leaf': 1, 'subsample': 0.7211829475594719, 'max_features': None}. Best is trial 989 with value: 0.3092662874814911.
[I 2024-12-04 12:40:46,129] Trial 1366 finished with value: 0.39482364573284445 and parameters: {'n_estimators': 1263, 'learning_rate': 0.06835479215525303, 'max_depth': 6, 'min_samples_split': 4, 'min_samples_leaf': 1, 'subsample': 0.6817477889915677, 'max_features': 'log2'}. Best is trial 989 with value: 0.3092662874814911.
[I 2024-12-04 12:40:46,133] Trial 1381 finished with value: 0.6733264264665885 and parameters: {'n_estimators': 703, 'learning_rate': 0.011605743230185244, 'max_depth': 6, 'min_samples_split': 6, 'min_samples_leaf': 7, 'subsample': 0.6585255643779293, 'max_features': 'sqrt'}. Best is trial 989 with value: 0.3092662874814911.
[I 2024-12-04 12:40:47,797] Trial 1385 finished with value: 0.8704262689562402 and parameters: {'n_estimators': 596, 'learning_rate': 0.02587273067539816, 'max_depth': 3, 'min_samples_split': 14, 'min_samples_leaf': 8, 'subsample': 0.7015875074247342, 'max_features': 'log2'}. Best is trial 989 with value: 0.3092662874814911.
[I 2024-12-04 12:40:49,586] Trial 1377 finished with value: 0.3339980167635766 and parameters: {'n_estimators': 830, 'learning_rate': 0.06077242039078325, 'max_depth': 6, 'min_samples_split': 5, 'min_samples_leaf': 2, 'subsample': 0.6882476412546857, 'max_features': None}. Best is trial 989 with value: 0.3092662874814911.
[I 2024-12-04 12:40:49,889] Trial 1386 finished with value: 0.5507771730605467 and parameters: {'n_estimators': 516, 'learning_rate': 0.010766430395050446, 'max_depth': 10, 'min_samples_split': 13, 'min_samples_leaf': 3, 'subsample': 0.6774700713748839, 'max_features': 'sqrt'}. Best is trial 989 with value: 0.3092662874814911.
[I 2024-12-04 12:40:50,165] Trial 1358 finished with value: 0.3914657622969326 and parameters: {'n_estimators': 1446, 'learning_rate': 0.09686135753007188, 'max_depth': 7, 'min_samples_split': 7, 'min_samples_leaf': 3, 'subsample': 0.6485673233037019, 'max_features': None}. Best is trial 989 with value: 0.3092662874814911.
[I 2024-12-04 12:40:51,897] Trial 1371 finished with value: 0.3908986756592055 and parameters: {'n_estimators': 1157, 'learning_rate': 0.055219460808412814, 'max_depth': 8, 'min_samples_split': 5, 'min_samples_leaf': 3, 'subsample': 0.6049491167338628, 'max_features': None}. Best is trial 989 with value: 0.3092662874814911.
[I 2024-12-04 12:40:52,130] Trial 1372 finished with value: 0.4094895136950752 and parameters: {'n_estimators': 1104, 'learning_rate': 0.04916228693701826, 'max_depth': 5, 'min_samples_split': 6, 'min_samples_leaf': 3, 'subsample': 0.8892403068285237, 'max_features': None}. Best is trial 989 with value: 0.3092662874814911.
[I 2024-12-04 12:40:53,282] Trial 1367 finished with value: 0.39047446053761486 and parameters: {'n_estimators': 1295, 'learning_rate': 0.06612844596758317, 'max_depth': 6, 'min_samples_split': 2, 'min_samples_leaf': 3, 'subsample': 0.6007899258566642, 'max_features': None}. Best is trial 989 with value: 0.3092662874814911.
[I 2024-12-04 12:40:53,508] Trial 1390 finished with value: 0.41592220633558885 and parameters: {'n_estimators': 400, 'learning_rate': 0.0906883106554293, 'max_depth': 7, 'min_samples_split': 2, 'min_samples_leaf': 2, 'subsample': 0.7449335427224785, 'max_features': 'sqrt'}. Best is trial 989 with value: 0.3092662874814911.
[I 2024-12-04 12:40:56,115] Trial 1368 finished with value: 0.3978536847461002 and parameters: {'n_estimators': 1319, 'learning_rate': 0.028709505486627325, 'max_depth': 5, 'min_samples_split': 3, 'min_samples_leaf': 3, 'subsample': 0.6413548922695158, 'max_features': None}. Best is trial 989 with value: 0.3092662874814911.
[I 2024-12-04 12:40:56,861] Trial 1376 finished with value: 0.37304110592126033 and parameters: {'n_estimators': 1032, 'learning_rate': 0.03416480483671427, 'max_depth': 8, 'min_samples_split': 7, 'min_samples_leaf': 4, 'subsample': 0.7644428732164048, 'max_features': None}. Best is trial 989 with value: 0.3092662874814911.
[I 2024-12-04 12:41:00,594] Trial 1369 finished with value: 0.3201390006218647 and parameters: {'n_estimators': 1443, 'learning_rate': 0.09393724121280041, 'max_depth': 6, 'min_samples_split': 4, 'min_samples_leaf': 2, 'subsample': 0.7248144858162808, 'max_features': None}. Best is trial 989 with value: 0.3092662874814911.
[I 2024-12-04 12:41:01,554] Trial 1384 finished with value: 0.3290323387085837 and parameters: {'n_estimators': 966, 'learning_rate': 0.09746596344337442, 'max_depth': 8, 'min_samples_split': 2, 'min_samples_leaf': 2, 'subsample': 0.6159345323707921, 'max_features': None}. Best is trial 989 with value: 0.3092662874814911.
[I 2024-12-04 12:41:03,344] Trial 1375 finished with value: 0.33412876740244246 and parameters: {'n_estimators': 1407, 'learning_rate': 0.06344948878705282, 'max_depth': 8, 'min_samples_split': 5, 'min_samples_leaf': 2, 'subsample': 0.666080707255473, 'max_features': None}. Best is trial 989 with value: 0.3092662874814911.
[I 2024-12-04 12:41:05,078] Trial 1380 finished with value: 0.3726543151295685 and parameters: {'n_estimators': 1207, 'learning_rate': 0.09885987198070845, 'max_depth': 8, 'min_samples_split': 7, 'min_samples_leaf': 1, 'subsample': 0.6076877597711989, 'max_features': None}. Best is trial 989 with value: 0.3092662874814911.
[I 2024-12-04 12:41:05,332] Trial 1389 finished with value: 0.5121058956533541 and parameters: {'n_estimators': 906, 'learning_rate': 0.029581095777699323, 'max_depth': 11, 'min_samples_split': 14, 'min_samples_leaf': 3, 'subsample': 0.8611149224290957, 'max_features': 'log2'}. Best is trial 989 with value: 0.3092662874814911.
[I 2024-12-04 12:41:05,565] Trial 1379 finished with value: 0.3417443247252963 and parameters: {'n_estimators': 1235, 'learning_rate': 0.0889920134333087, 'max_depth': 6, 'min_samples_split': 2, 'min_samples_leaf': 2, 'subsample': 0.6860464852030792, 'max_features': None}. Best is trial 989 with value: 0.3092662874814911.
[I 2024-12-04 12:41:09,083] Trial 1383 finished with value: 0.38862251129787456 and parameters: {'n_estimators': 1226, 'learning_rate': 0.06140539207522204, 'max_depth': 5, 'min_samples_split': 7, 'min_samples_leaf': 5, 'subsample': 0.9622185476535773, 'max_features': None}. Best is trial 989 with value: 0.3092662874814911.
[I 2024-12-04 12:41:10,365] Trial 1378 finished with value: 0.3607521394501464 and parameters: {'n_estimators': 1414, 'learning_rate': 0.08264021109608144, 'max_depth': 10, 'min_samples_split': 2, 'min_samples_leaf': 1, 'subsample': 0.609956237266618, 'max_features': None}. Best is trial 989 with value: 0.3092662874814911.
[I 2024-12-04 12:41:12,115] Trial 1397 finished with value: 0.5204481089260131 and parameters: {'n_estimators': 835, 'learning_rate': 0.017403637684063066, 'max_depth': 5, 'min_samples_split': 19, 'min_samples_leaf': 6, 'subsample': 0.9385844009602033, 'max_features': 'sqrt'}. Best is trial 989 with value: 0.3092662874814911.
[I 2024-12-04 12:41:14,855] Trial 1395 finished with value: 0.38660785721322966 and parameters: {'n_estimators': 931, 'learning_rate': 0.0539105050998964, 'max_depth': 4, 'min_samples_split': 3, 'min_samples_leaf': 1, 'subsample': 0.6058730840937573, 'max_features': None}. Best is trial 989 with value: 0.3092662874814911.
[I 2024-12-04 12:41:15,597] Trial 1382 finished with value: 0.40122906210245535 and parameters: {'n_estimators': 1487, 'learning_rate': 0.06084306761429618, 'max_depth': 5, 'min_samples_split': 5, 'min_samples_leaf': 3, 'subsample': 0.7112340387974204, 'max_features': None}. Best is trial 989 with value: 0.3092662874814911.
[I 2024-12-04 12:41:18,709] Trial 1401 finished with value: 0.37504589496202 and parameters: {'n_estimators': 784, 'learning_rate': 0.08682949085856052, 'max_depth': 6, 'min_samples_split': 5, 'min_samples_leaf': 4, 'subsample': 0.7360238493501294, 'max_features': None}. Best is trial 989 with value: 0.3092662874814911.
[I 2024-12-04 12:41:19,233] Trial 1388 finished with value: 0.36833547831083074 and parameters: {'n_estimators': 1263, 'learning_rate': 0.09910091382507939, 'max_depth': 7, 'min_samples_split': 4, 'min_samples_leaf': 1, 'subsample': 0.721377213032166, 'max_features': None}. Best is trial 989 with value: 0.3092662874814911.
[I 2024-12-04 12:41:19,791] Trial 1391 finished with value: 0.46017006150920775 and parameters: {'n_estimators': 1323, 'learning_rate': 0.024717770880264833, 'max_depth': 4, 'min_samples_split': 12, 'min_samples_leaf': 4, 'subsample': 0.9815865005528227, 'max_features': 'sqrt'}. Best is trial 989 with value: 0.3092662874814911.
[I 2024-12-04 12:41:21,430] Trial 1410 finished with value: 0.38376584894208493 and parameters: {'n_estimators': 449, 'learning_rate': 0.09224824893920255, 'max_depth': 9, 'min_samples_split': 3, 'min_samples_leaf': 4, 'subsample': 0.6181018073843532, 'max_features': None}. Best is trial 989 with value: 0.3092662874814911.
[I 2024-12-04 12:41:21,533] Trial 1387 finished with value: 0.3714336595987337 and parameters: {'n_estimators': 1415, 'learning_rate': 0.07811610884763646, 'max_depth': 5, 'min_samples_split': 2, 'min_samples_leaf': 1, 'subsample': 0.6223238814446945, 'max_features': None}. Best is trial 989 with value: 0.3092662874814911.
[I 2024-12-04 12:41:21,542] Trial 1414 finished with value: 0.44757979655376945 and parameters: {'n_estimators': 407, 'learning_rate': 0.05894487878044861, 'max_depth': 8, 'min_samples_split': 7, 'min_samples_leaf': 1, 'subsample': 0.7893612435886693, 'max_features': 'log2'}. Best is trial 989 with value: 0.3092662874814911.
[I 2024-12-04 12:41:24,182] Trial 1393 finished with value: 0.38689789574914796 and parameters: {'n_estimators': 1157, 'learning_rate': 0.06178652737315388, 'max_depth': 7, 'min_samples_split': 5, 'min_samples_leaf': 3, 'subsample': 0.6536389328655571, 'max_features': None}. Best is trial 989 with value: 0.3092662874814911.
[I 2024-12-04 12:41:26,241] Trial 1392 finished with value: 0.43489446584383656 and parameters: {'n_estimators': 1486, 'learning_rate': 0.08413352190296336, 'max_depth': 9, 'min_samples_split': 6, 'min_samples_leaf': 4, 'subsample': 0.7019273895774054, 'max_features': 'log2'}. Best is trial 989 with value: 0.3092662874814911.
[I 2024-12-04 12:41:28,007] Trial 1415 finished with value: 0.5473368084004586 and parameters: {'n_estimators': 440, 'learning_rate': 0.03525145298104262, 'max_depth': 8, 'min_samples_split': 9, 'min_samples_leaf': 9, 'subsample': 0.963377136373187, 'max_features': None}. Best is trial 989 with value: 0.3092662874814911.
[I 2024-12-04 12:41:29,890] Trial 1394 finished with value: 0.34400350435015314 and parameters: {'n_estimators': 1226, 'learning_rate': 0.053463564967115615, 'max_depth': 9, 'min_samples_split': 5, 'min_samples_leaf': 2, 'subsample': 0.9572689234374453, 'max_features': None}. Best is trial 989 with value: 0.3092662874814911.
[I 2024-12-04 12:41:29,902] Trial 1403 finished with value: 0.42246706652860394 and parameters: {'n_estimators': 1042, 'learning_rate': 0.08330563761821233, 'max_depth': 3, 'min_samples_split': 6, 'min_samples_leaf': 3, 'subsample': 0.617773999341259, 'max_features': None}. Best is trial 989 with value: 0.3092662874814911.
[I 2024-12-04 12:41:31,394] Trial 1399 finished with value: 0.39087582253862974 and parameters: {'n_estimators': 1353, 'learning_rate': 0.09456858833112451, 'max_depth': 7, 'min_samples_split': 8, 'min_samples_leaf': 1, 'subsample': 0.7108466036431144, 'max_features': 'sqrt'}. Best is trial 989 with value: 0.3092662874814911.
[I 2024-12-04 12:41:33,088] Trial 1422 finished with value: 0.9358238467746562 and parameters: {'n_estimators': 448, 'learning_rate': 0.018169596775781977, 'max_depth': 9, 'min_samples_split': 14, 'min_samples_leaf': 9, 'subsample': 0.8215654509062814, 'max_features': 'log2'}. Best is trial 989 with value: 0.3092662874814911.
[I 2024-12-04 12:41:33,198] Trial 1404 finished with value: 0.4744700081892647 and parameters: {'n_estimators': 998, 'learning_rate': 0.07114597655889003, 'max_depth': 9, 'min_samples_split': 5, 'min_samples_leaf': 4, 'subsample': 0.6145873877603374, 'max_features': 'log2'}. Best is trial 989 with value: 0.3092662874814911.
[I 2024-12-04 12:41:35,707] Trial 1418 finished with value: 0.42490245966911916 and parameters: {'n_estimators': 590, 'learning_rate': 0.07503293870461138, 'max_depth': 3, 'min_samples_split': 5, 'min_samples_leaf': 6, 'subsample': 0.9026827680783716, 'max_features': None}. Best is trial 989 with value: 0.3092662874814911.
[I 2024-12-04 12:41:35,714] Trial 1408 finished with value: 0.41772460183217713 and parameters: {'n_estimators': 1022, 'learning_rate': 0.09589181986219612, 'max_depth': 6, 'min_samples_split': 2, 'min_samples_leaf': 1, 'subsample': 0.6716146997939044, 'max_features': 'log2'}. Best is trial 989 with value: 0.3092662874814911.
