[I 2024-12-04 11:54:44,473] A new study created in RDB with name: Omega_rf
[I 2024-12-04 11:54:52,178] Trial 0 finished with value: 1.227171515142673 and parameters: {'n_estimators': 242, 'max_depth': 42, 'min_samples_split': 44, 'min_samples_leaf': 3, 'max_features': 'log2', 'bootstrap': True, 'criterion': 'squared_error'}. Best is trial 10 with value: 1.195707985231363.
[I 2024-12-04 11:54:53,397] Trial 5 finished with value: 1.216075826175686 and parameters: {'n_estimators': 456, 'max_depth': 49, 'min_samples_split': 14, 'min_samples_leaf': 6, 'max_features': 'log2', 'bootstrap': False, 'criterion': 'squared_error'}. Best is trial 4 with value: 0.6318353995839678.
[I 2024-12-04 11:54:55,662] Trial 1 finished with value: 1.3501456343263616 and parameters: {'n_estimators': 187, 'max_depth': 19, 'min_samples_split': 35, 'min_samples_leaf': 5, 'max_features': 'log2', 'bootstrap': True, 'criterion': 'absolute_error'}. Best is trial 4 with value: 0.6318353995839678.
[I 2024-12-04 11:54:55,747] Trial 4 finished with value: 0.6318353995839678 and parameters: {'n_estimators': 551, 'max_depth': 12, 'min_samples_split': 15, 'min_samples_leaf': 2, 'max_features': None, 'bootstrap': False, 'criterion': 'squared_error'}. Best is trial 4 with value: 0.6318353995839678.
[I 2024-12-04 11:54:55,998] Trial 6 finished with value: 0.778913758772352 and parameters: {'n_estimators': 887, 'max_depth': 34, 'min_samples_split': 17, 'min_samples_leaf': 1, 'max_features': 'log2', 'bootstrap': False, 'criterion': 'squared_error'}. Best is trial 4 with value: 0.6318353995839678.
[I 2024-12-04 11:54:57,206] Trial 10 finished with value: 1.195707985231363 and parameters: {'n_estimators': 595, 'max_depth': 39, 'min_samples_split': 7, 'min_samples_leaf': 12, 'max_features': 'sqrt', 'bootstrap': False, 'criterion': 'squared_error'}. Best is trial 4 with value: 0.6318353995839678.
[I 2024-12-04 11:54:59,219] Trial 3 finished with value: 1.3555288238527679 and parameters: {'n_estimators': 181, 'max_depth': 37, 'min_samples_split': 15, 'min_samples_leaf': 14, 'max_features': 'log2', 'bootstrap': False, 'criterion': 'absolute_error'}. Best is trial 4 with value: 0.6318353995839678.
[I 2024-12-04 11:55:01,054] Trial 12 finished with value: 1.0127860022489634 and parameters: {'n_estimators': 984, 'max_depth': 24, 'min_samples_split': 10, 'min_samples_leaf': 14, 'max_features': None, 'bootstrap': True, 'criterion': 'absolute_error'}. Best is trial 7 with value: 0.6082786072289872.
[I 2024-12-04 11:55:01,447] Trial 16 finished with value: 0.8692865724017166 and parameters: {'n_estimators': 379, 'max_depth': 8, 'min_samples_split': 5, 'min_samples_leaf': 15, 'max_features': None, 'bootstrap': False, 'criterion': 'absolute_error'}. Best is trial 7 with value: 0.6082786072289872.
[I 2024-12-04 11:55:01,936] Trial 23 finished with value: 0.8620803108614498 and parameters: {'n_estimators': 357, 'max_depth': 21, 'min_samples_split': 2, 'min_samples_leaf': 1, 'max_features': 'log2', 'bootstrap': False, 'criterion': 'squared_error'}. Best is trial 7 with value: 0.6082786072289872.
[I 2024-12-04 11:55:01,939] Trial 11 finished with value: 0.9026955128579545 and parameters: {'n_estimators': 408, 'max_depth': 45, 'min_samples_split': 27, 'min_samples_leaf': 2, 'max_features': 'sqrt', 'bootstrap': True, 'criterion': 'squared_error'}. Best is trial 7 with value: 0.6082786072289872.
[I 2024-12-04 11:55:02,310] Trial 26 finished with value: 0.6507790524756528 and parameters: {'n_estimators': 459, 'max_depth': 34, 'min_samples_split': 24, 'min_samples_leaf': 1, 'max_features': 'sqrt', 'bootstrap': False, 'criterion': 'squared_error'}. Best is trial 7 with value: 0.6082786072289872.
[I 2024-12-04 11:55:02,607] Trial 20 finished with value: 1.0445792672995482 and parameters: {'n_estimators': 266, 'max_depth': 16, 'min_samples_split': 2, 'min_samples_leaf': 1, 'max_features': 'log2', 'bootstrap': False, 'criterion': 'absolute_error'}. Best is trial 7 with value: 0.6082786072289872.
[I 2024-12-04 11:55:02,698] Trial 14 finished with value: 1.1037168765844994 and parameters: {'n_estimators': 551, 'max_depth': 34, 'min_samples_split': 23, 'min_samples_leaf': 2, 'max_features': 'log2', 'bootstrap': False, 'criterion': 'squared_error'}. Best is trial 7 with value: 0.6082786072289872.
[I 2024-12-04 11:55:04,400] Trial 7 finished with value: 0.6082786072289872 and parameters: {'n_estimators': 420, 'max_depth': 29, 'min_samples_split': 2, 'min_samples_leaf': 1, 'max_features': None, 'bootstrap': False, 'criterion': 'squared_error'}. Best is trial 7 with value: 0.6082786072289872.
[I 2024-12-04 11:55:04,516] Trial 24 finished with value: 1.2183589200074627 and parameters: {'n_estimators': 916, 'max_depth': 5, 'min_samples_split': 14, 'min_samples_leaf': 3, 'max_features': 'log2', 'bootstrap': True, 'criterion': 'squared_error'}. Best is trial 7 with value: 0.6082786072289872.
[I 2024-12-04 11:55:04,673] Trial 18 finished with value: 1.3324038306762578 and parameters: {'n_estimators': 532, 'max_depth': 37, 'min_samples_split': 2, 'min_samples_leaf': 4, 'max_features': 'log2', 'bootstrap': True, 'criterion': 'absolute_error'}. Best is trial 21 with value: 0.5141602040594817.
[I 2024-12-04 11:55:05,567] Trial 13 finished with value: 1.0208380246675242 and parameters: {'n_estimators': 592, 'max_depth': 9, 'min_samples_split': 3, 'min_samples_leaf': 4, 'max_features': 'sqrt', 'bootstrap': False, 'criterion': 'squared_error'}. Best is trial 21 with value: 0.5141602040594817.
[I 2024-12-04 11:55:06,079] Trial 28 finished with value: 1.3317324961544827 and parameters: {'n_estimators': 380, 'max_depth': 49, 'min_samples_split': 27, 'min_samples_leaf': 4, 'max_features': 'log2', 'bootstrap': True, 'criterion': 'absolute_error'}. Best is trial 21 with value: 0.5141602040594817.
[I 2024-12-04 11:55:06,118] Trial 2 finished with value: 1.3343717825367574 and parameters: {'n_estimators': 677, 'max_depth': 19, 'min_samples_split': 10, 'min_samples_leaf': 4, 'max_features': 'log2', 'bootstrap': True, 'criterion': 'absolute_error'}. Best is trial 21 with value: 0.5141602040594817.
[I 2024-12-04 11:55:06,655] Trial 17 finished with value: 1.1056277595082196 and parameters: {'n_estimators': 700, 'max_depth': 27, 'min_samples_split': 8, 'min_samples_leaf': 2, 'max_features': 'log2', 'bootstrap': False, 'criterion': 'squared_error'}. Best is trial 21 with value: 0.5141602040594817.
[I 2024-12-04 11:55:06,803] Trial 27 finished with value: 1.3534679439631345 and parameters: {'n_estimators': 867, 'max_depth': 49, 'min_samples_split': 3, 'min_samples_leaf': 8, 'max_features': 'log2', 'bootstrap': True, 'criterion': 'absolute_error'}. Best is trial 21 with value: 0.5141602040594817.
[I 2024-12-04 11:55:07,039] Trial 21 finished with value: 0.5141602040594817 and parameters: {'n_estimators': 101, 'max_depth': 37, 'min_samples_split': 5, 'min_samples_leaf': 1, 'max_features': None, 'bootstrap': True, 'criterion': 'absolute_error'}. Best is trial 21 with value: 0.5141602040594817.
[I 2024-12-04 11:55:07,188] Trial 8 finished with value: 0.7837767937565985 and parameters: {'n_estimators': 768, 'max_depth': 50, 'min_samples_split': 24, 'min_samples_leaf': 1, 'max_features': 'log2', 'bootstrap': False, 'criterion': 'absolute_error'}. Best is trial 21 with value: 0.5141602040594817.
[I 2024-12-04 11:55:07,202] Trial 22 finished with value: 1.3426534764919225 and parameters: {'n_estimators': 209, 'max_depth': 11, 'min_samples_split': 42, 'min_samples_leaf': 6, 'max_features': 'log2', 'bootstrap': False, 'criterion': 'absolute_error'}. Best is trial 21 with value: 0.5141602040594817.
[I 2024-12-04 11:55:07,616] Trial 25 finished with value: 0.6261454358897566 and parameters: {'n_estimators': 284, 'max_depth': 46, 'min_samples_split': 3, 'min_samples_leaf': 1, 'max_features': 'sqrt', 'bootstrap': True, 'criterion': 'absolute_error'}. Best is trial 21 with value: 0.5141602040594817.
[I 2024-12-04 11:55:09,397] Trial 19 finished with value: 1.0485456447539085 and parameters: {'n_estimators': 846, 'max_depth': 42, 'min_samples_split': 31, 'min_samples_leaf': 3, 'max_features': 'sqrt', 'bootstrap': True, 'criterion': 'squared_error'}. Best is trial 21 with value: 0.5141602040594817.
[I 2024-12-04 11:55:10,200] Trial 9 finished with value: 0.6816515331217111 and parameters: {'n_estimators': 843, 'max_depth': 30, 'min_samples_split': 35, 'min_samples_leaf': 1, 'max_features': 'sqrt', 'bootstrap': False, 'criterion': 'squared_error'}. Best is trial 21 with value: 0.5141602040594817.
[I 2024-12-04 11:55:10,959] Trial 30 finished with value: 0.6010638914411445 and parameters: {'n_estimators': 182, 'max_depth': 45, 'min_samples_split': 2, 'min_samples_leaf': 1, 'max_features': 'sqrt', 'bootstrap': True, 'criterion': 'absolute_error'}. Best is trial 21 with value: 0.5141602040594817.
[I 2024-12-04 11:55:11,597] Trial 37 finished with value: 0.6387452833556527 and parameters: {'n_estimators': 398, 'max_depth': 34, 'min_samples_split': 2, 'min_samples_leaf': 2, 'max_features': None, 'bootstrap': False, 'criterion': 'squared_error'}. Best is trial 21 with value: 0.5141602040594817.
[I 2024-12-04 11:55:13,743] Trial 31 finished with value: 0.6392654365383772 and parameters: {'n_estimators': 525, 'max_depth': 37, 'min_samples_split': 4, 'min_samples_leaf': 1, 'max_features': 'sqrt', 'bootstrap': True, 'criterion': 'squared_error'}. Best is trial 21 with value: 0.5141602040594817.
[I 2024-12-04 11:55:14,177] Trial 33 finished with value: 0.5618239298624486 and parameters: {'n_estimators': 122, 'max_depth': 33, 'min_samples_split': 4, 'min_samples_leaf': 2, 'max_features': None, 'bootstrap': True, 'criterion': 'absolute_error'}. Best is trial 21 with value: 0.5141602040594817.
[I 2024-12-04 11:55:14,835] Trial 36 finished with value: 0.5252722126777031 and parameters: {'n_estimators': 279, 'max_depth': 22, 'min_samples_split': 2, 'min_samples_leaf': 1, 'max_features': None, 'bootstrap': True, 'criterion': 'squared_error'}. Best is trial 21 with value: 0.5141602040594817.
[I 2024-12-04 11:55:14,851] Trial 42 finished with value: 0.6782704615003435 and parameters: {'n_estimators': 181, 'max_depth': 46, 'min_samples_split': 3, 'min_samples_leaf': 1, 'max_features': 'log2', 'bootstrap': False, 'criterion': 'absolute_error'}. Best is trial 21 with value: 0.5141602040594817.
[I 2024-12-04 11:55:16,445] Trial 48 finished with value: 0.6811328692533318 and parameters: {'n_estimators': 188, 'max_depth': 49, 'min_samples_split': 3, 'min_samples_leaf': 1, 'max_features': 'log2', 'bootstrap': True, 'criterion': 'squared_error'}. Best is trial 21 with value: 0.5141602040594817.
[I 2024-12-04 11:55:16,757] Trial 29 finished with value: 0.840100122086331 and parameters: {'n_estimators': 961, 'max_depth': 41, 'min_samples_split': 27, 'min_samples_leaf': 1, 'max_features': 'log2', 'bootstrap': False, 'criterion': 'absolute_error'}. Best is trial 21 with value: 0.5141602040594817.
[I 2024-12-04 11:55:17,352] Trial 43 finished with value: 1.0239996336617914 and parameters: {'n_estimators': 314, 'max_depth': 45, 'min_samples_split': 2, 'min_samples_leaf': 3, 'max_features': 'sqrt', 'bootstrap': False, 'criterion': 'absolute_error'}. Best is trial 21 with value: 0.5141602040594817.
[I 2024-12-04 11:55:19,450] Trial 38 finished with value: 1.0643857785682314 and parameters: {'n_estimators': 156, 'max_depth': 41, 'min_samples_split': 3, 'min_samples_leaf': 3, 'max_features': 'sqrt', 'bootstrap': True, 'criterion': 'squared_error'}. Best is trial 21 with value: 0.5141602040594817.
[I 2024-12-04 11:55:20,266] Trial 41 finished with value: 0.552041341426251 and parameters: {'n_estimators': 123, 'max_depth': 41, 'min_samples_split': 4, 'min_samples_leaf': 2, 'max_features': None, 'bootstrap': True, 'criterion': 'squared_error'}. Best is trial 21 with value: 0.5141602040594817.
[I 2024-12-04 11:55:20,268] Trial 39 finished with value: 0.9207246059709349 and parameters: {'n_estimators': 105, 'max_depth': 32, 'min_samples_split': 12, 'min_samples_leaf': 1, 'max_features': 'log2', 'bootstrap': True, 'criterion': 'absolute_error'}. Best is trial 21 with value: 0.5141602040594817.
[I 2024-12-04 11:55:20,721] Trial 35 finished with value: 0.5306217589765302 and parameters: {'n_estimators': 115, 'max_depth': 45, 'min_samples_split': 12, 'min_samples_leaf': 1, 'max_features': None, 'bootstrap': True, 'criterion': 'absolute_error'}. Best is trial 21 with value: 0.5141602040594817.
[I 2024-12-04 11:55:20,893] Trial 54 finished with value: 0.9190391439517831 and parameters: {'n_estimators': 149, 'max_depth': 30, 'min_samples_split': 6, 'min_samples_leaf': 1, 'max_features': 'log2', 'bootstrap': True, 'criterion': 'absolute_error'}. Best is trial 21 with value: 0.5141602040594817.
[I 2024-12-04 11:55:20,894] Trial 15 finished with value: 0.6634856303488155 and parameters: {'n_estimators': 850, 'max_depth': 47, 'min_samples_split': 31, 'min_samples_leaf': 5, 'max_features': None, 'bootstrap': False, 'criterion': 'absolute_error'}. Best is trial 21 with value: 0.5141602040594817.
[I 2024-12-04 11:55:21,457] Trial 56 finished with value: 0.5273369964737273 and parameters: {'n_estimators': 164, 'max_depth': 14, 'min_samples_split': 2, 'min_samples_leaf': 1, 'max_features': None, 'bootstrap': True, 'criterion': 'squared_error'}. Best is trial 21 with value: 0.5141602040594817.
[I 2024-12-04 11:55:21,531] Trial 44 finished with value: 0.571153373496405 and parameters: {'n_estimators': 224, 'max_depth': 30, 'min_samples_split': 3, 'min_samples_leaf': 3, 'max_features': None, 'bootstrap': True, 'criterion': 'absolute_error'}. Best is trial 21 with value: 0.5141602040594817.
[I 2024-12-04 11:55:21,628] Trial 46 finished with value: 0.9868618901820414 and parameters: {'n_estimators': 142, 'max_depth': 39, 'min_samples_split': 2, 'min_samples_leaf': 2, 'max_features': 'sqrt', 'bootstrap': True, 'criterion': 'absolute_error'}. Best is trial 21 with value: 0.5141602040594817.
[I 2024-12-04 11:55:21,781] Trial 52 finished with value: 0.5281709483609056 and parameters: {'n_estimators': 239, 'max_depth': 21, 'min_samples_split': 3, 'min_samples_leaf': 1, 'max_features': None, 'bootstrap': True, 'criterion': 'squared_error'}. Best is trial 21 with value: 0.5141602040594817.
[I 2024-12-04 11:55:21,883] Trial 55 finished with value: 1.053841421686731 and parameters: {'n_estimators': 195, 'max_depth': 7, 'min_samples_split': 5, 'min_samples_leaf': 1, 'max_features': 'sqrt', 'bootstrap': True, 'criterion': 'squared_error'}. Best is trial 21 with value: 0.5141602040594817.
[I 2024-12-04 11:55:22,407] Trial 47 finished with value: 1.1444139116867316 and parameters: {'n_estimators': 141, 'max_depth': 34, 'min_samples_split': 3, 'min_samples_leaf': 3, 'max_features': 'sqrt', 'bootstrap': True, 'criterion': 'absolute_error'}. Best is trial 21 with value: 0.5141602040594817.
[I 2024-12-04 11:55:23,004] Trial 50 finished with value: 0.6139135170695595 and parameters: {'n_estimators': 143, 'max_depth': 36, 'min_samples_split': 3, 'min_samples_leaf': 1, 'max_features': 'sqrt', 'bootstrap': False, 'criterion': 'squared_error'}. Best is trial 21 with value: 0.5141602040594817.
[I 2024-12-04 11:55:23,766] Trial 51 finished with value: 0.5207059403740923 and parameters: {'n_estimators': 373, 'max_depth': 24, 'min_samples_split': 4, 'min_samples_leaf': 1, 'max_features': None, 'bootstrap': True, 'criterion': 'squared_error'}. Best is trial 21 with value: 0.5141602040594817.
[I 2024-12-04 11:55:24,441] Trial 60 finished with value: 0.5611460385369823 and parameters: {'n_estimators': 104, 'max_depth': 44, 'min_samples_split': 9, 'min_samples_leaf': 3, 'max_features': None, 'bootstrap': True, 'criterion': 'squared_error'}. Best is trial 21 with value: 0.5141602040594817.
[I 2024-12-04 11:55:24,835] Trial 62 finished with value: 0.5658162159068286 and parameters: {'n_estimators': 169, 'max_depth': 5, 'min_samples_split': 2, 'min_samples_leaf': 1, 'max_features': None, 'bootstrap': True, 'criterion': 'squared_error'}. Best is trial 21 with value: 0.5141602040594817.
[I 2024-12-04 11:55:25,040] Trial 53 finished with value: 0.5230368805596429 and parameters: {'n_estimators': 373, 'max_depth': 25, 'min_samples_split': 3, 'min_samples_leaf': 1, 'max_features': None, 'bootstrap': True, 'criterion': 'squared_error'}. Best is trial 21 with value: 0.5141602040594817.
[I 2024-12-04 11:55:25,041] Trial 40 finished with value: 0.5686666175401869 and parameters: {'n_estimators': 279, 'max_depth': 25, 'min_samples_split': 5, 'min_samples_leaf': 3, 'max_features': None, 'bootstrap': True, 'criterion': 'absolute_error'}. Best is trial 21 with value: 0.5141602040594817.
[I 2024-12-04 11:55:25,654] Trial 57 finished with value: 0.5548298510852724 and parameters: {'n_estimators': 199, 'max_depth': 45, 'min_samples_split': 7, 'min_samples_leaf': 2, 'max_features': None, 'bootstrap': True, 'criterion': 'squared_error'}. Best is trial 21 with value: 0.5141602040594817.
[I 2024-12-04 11:55:25,844] Trial 32 finished with value: 0.6446645794192825 and parameters: {'n_estimators': 125, 'max_depth': 45, 'min_samples_split': 4, 'min_samples_leaf': 2, 'max_features': None, 'bootstrap': False, 'criterion': 'absolute_error'}. Best is trial 21 with value: 0.5141602040594817.
[I 2024-12-04 11:55:27,162] Trial 58 finished with value: 0.8623373615206551 and parameters: {'n_estimators': 646, 'max_depth': 24, 'min_samples_split': 2, 'min_samples_leaf': 1, 'max_features': 'log2', 'bootstrap': True, 'criterion': 'squared_error'}. Best is trial 21 with value: 0.5141602040594817.
[I 2024-12-04 11:55:27,239] Trial 61 finished with value: 0.530514731842933 and parameters: {'n_estimators': 345, 'max_depth': 22, 'min_samples_split': 11, 'min_samples_leaf': 1, 'max_features': None, 'bootstrap': True, 'criterion': 'squared_error'}. Best is trial 21 with value: 0.5141602040594817.
[I 2024-12-04 11:55:27,321] Trial 49 finished with value: 0.5184939055889719 and parameters: {'n_estimators': 137, 'max_depth': 34, 'min_samples_split': 4, 'min_samples_leaf': 1, 'max_features': None, 'bootstrap': True, 'criterion': 'absolute_error'}. Best is trial 21 with value: 0.5141602040594817.
[I 2024-12-04 11:55:27,842] Trial 63 finished with value: 1.1827434607387923 and parameters: {'n_estimators': 216, 'max_depth': 18, 'min_samples_split': 2, 'min_samples_leaf': 2, 'max_features': 'log2', 'bootstrap': True, 'criterion': 'squared_error'}. Best is trial 21 with value: 0.5141602040594817.
[I 2024-12-04 11:55:28,377] Trial 73 finished with value: 0.6952285228166565 and parameters: {'n_estimators': 179, 'max_depth': 24, 'min_samples_split': 2, 'min_samples_leaf': 1, 'max_features': 'sqrt', 'bootstrap': True, 'criterion': 'squared_error'}. Best is trial 21 with value: 0.5141602040594817.
[I 2024-12-04 11:55:28,626] Trial 65 finished with value: 0.5867435324694082 and parameters: {'n_estimators': 171, 'max_depth': 18, 'min_samples_split': 4, 'min_samples_leaf': 1, 'max_features': None, 'bootstrap': False, 'criterion': 'squared_error'}. Best is trial 21 with value: 0.5141602040594817.
[I 2024-12-04 11:55:28,979] Trial 64 finished with value: 0.5225234341461673 and parameters: {'n_estimators': 371, 'max_depth': 27, 'min_samples_split': 3, 'min_samples_leaf': 1, 'max_features': None, 'bootstrap': True, 'criterion': 'squared_error'}. Best is trial 21 with value: 0.5141602040594817.
[I 2024-12-04 11:55:29,725] Trial 66 finished with value: 0.5263633852110615 and parameters: {'n_estimators': 128, 'max_depth': 22, 'min_samples_split': 2, 'min_samples_leaf': 1, 'max_features': None, 'bootstrap': True, 'criterion': 'squared_error'}. Best is trial 21 with value: 0.5141602040594817.
[I 2024-12-04 11:55:29,788] Trial 68 finished with value: 0.5539484163576321 and parameters: {'n_estimators': 242, 'max_depth': 22, 'min_samples_split': 3, 'min_samples_leaf': 2, 'max_features': None, 'bootstrap': True, 'criterion': 'squared_error'}. Best is trial 21 with value: 0.5141602040594817.
[I 2024-12-04 11:55:36,388] Trial 69 finished with value: 0.5337179979648777 and parameters: {'n_estimators': 105, 'max_depth': 30, 'min_samples_split': 2, 'min_samples_leaf': 1, 'max_features': None, 'bootstrap': True, 'criterion': 'squared_error'}. Best is trial 21 with value: 0.5141602040594817.
[I 2024-12-04 11:55:40,320] Trial 70 finished with value: 0.5215430574741653 and parameters: {'n_estimators': 399, 'max_depth': 18, 'min_samples_split': 3, 'min_samples_leaf': 1, 'max_features': None, 'bootstrap': True, 'criterion': 'squared_error'}. Best is trial 21 with value: 0.5141602040594817.
[I 2024-12-04 11:55:40,551] Trial 76 finished with value: 0.8491470448706614 and parameters: {'n_estimators': 355, 'max_depth': 29, 'min_samples_split': 4, 'min_samples_leaf': 1, 'max_features': 'log2', 'bootstrap': True, 'criterion': 'squared_error'}. Best is trial 21 with value: 0.5141602040594817.
[I 2024-12-04 11:55:40,849] Trial 74 finished with value: 0.8263779237237534 and parameters: {'n_estimators': 493, 'max_depth': 17, 'min_samples_split': 4, 'min_samples_leaf': 1, 'max_features': 'sqrt', 'bootstrap': True, 'criterion': 'absolute_error'}. Best is trial 21 with value: 0.5141602040594817.
[I 2024-12-04 11:55:41,337] Trial 75 finished with value: 0.5324304578126934 and parameters: {'n_estimators': 115, 'max_depth': 38, 'min_samples_split': 2, 'min_samples_leaf': 1, 'max_features': None, 'bootstrap': True, 'criterion': 'absolute_error'}. Best is trial 21 with value: 0.5141602040594817.
[I 2024-12-04 11:55:43,482] Trial 78 finished with value: 0.5279524146820586 and parameters: {'n_estimators': 355, 'max_depth': 30, 'min_samples_split': 2, 'min_samples_leaf': 1, 'max_features': None, 'bootstrap': True, 'criterion': 'squared_error'}. Best is trial 82 with value: 0.5120884726134413.
