[I 2024-12-04 15:19:32,986] Trial 2331 finished with value: 0.48830341874026756 and parameters: {'kernel_type': 'Matern', 'length_scale': 1820.2946784884784, 'noise_level': 0.845011673602904, 'constant_value': 2503.7786460375078, 'nu': 0.5}. Best is trial 386 with value: 0.4872991004520934.
[I 2024-12-04 15:19:33,315] Trial 2315 finished with value: 0.4883034184492288 and parameters: {'kernel_type': 'Matern', 'length_scale': 96362.52643857268, 'noise_level': 0.36218275842189074, 'constant_value': 80047.28855865158, 'nu': 0.5}. Best is trial 386 with value: 0.4872991004520934.
[I 2024-12-04 15:19:34,384] Trial 2322 finished with value: 0.4883034102390354 and parameters: {'kernel_type': 'Matern', 'length_scale': 2843.8996273673197, 'noise_level': 0.9218121390487085, 'constant_value': 806.577601992846, 'nu': 0.5}. Best is trial 386 with value: 0.4872991004520934.
[I 2024-12-04 15:19:34,956] Trial 2332 finished with value: 0.4883034312554364 and parameters: {'kernel_type': 'Matern', 'length_scale': 39.45480286376496, 'noise_level': 0.0063905022431058455, 'constant_value': 2673.7440201860563, 'nu': 0.5}. Best is trial 386 with value: 0.4872991004520934.
[I 2024-12-04 15:19:35,531] Trial 2318 finished with value: 0.48830333081457955 and parameters: {'kernel_type': 'Matern', 'length_scale': 1.376909096439714, 'noise_level': 0.9271580459814914, 'constant_value': 65856.4450748974, 'nu': 0.5}. Best is trial 386 with value: 0.4872991004520934.
[I 2024-12-04 15:19:36,073] Trial 2333 finished with value: 0.4883035233858832 and parameters: {'kernel_type': 'Matern', 'length_scale': 360.89091738524377, 'noise_level': 0.9066411267013058, 'constant_value': 12.720487367074753, 'nu': 0.5}. Best is trial 386 with value: 0.4872991004520934.
[I 2024-12-04 15:19:36,345] Trial 2329 finished with value: 0.48830342182523095 and parameters: {'kernel_type': 'Matern', 'length_scale': 43.31875504842881, 'noise_level': 0.9082153976711647, 'constant_value': 1280.8147508750646, 'nu': 0.5}. Best is trial 386 with value: 0.4872991004520934.
[I 2024-12-04 15:19:37,119] Trial 2336 finished with value: 1.2401112320681071 and parameters: {'kernel_type': 'Matern', 'length_scale': 86885.03154453442, 'noise_level': 0.014553706313502245, 'constant_value': 239.11133225700556, 'nu': 0.5}. Best is trial 386 with value: 0.4872991004520934.
[I 2024-12-04 15:19:37,473] Trial 2334 finished with value: 0.488303417096189 and parameters: {'kernel_type': 'Matern', 'length_scale': 196.64297828082985, 'noise_level': 0.5832805680809696, 'constant_value': 66859.05734760473, 'nu': 0.5}. Best is trial 386 with value: 0.4872991004520934.
[I 2024-12-04 15:19:39,441] Trial 2335 finished with value: 0.48830345919573004 and parameters: {'kernel_type': 'Matern', 'length_scale': 3967.9286862108634, 'noise_level': 0.0011026863580122957, 'constant_value': 153.8897718306172, 'nu': 0.5}. Best is trial 386 with value: 0.4872991004520934.
[I 2024-12-04 15:19:39,980] Trial 2343 finished with value: 0.48830342061084087 and parameters: {'kernel_type': 'Matern', 'length_scale': 1065.0071974799293, 'noise_level': 0.016623026737206996, 'constant_value': 86962.1918811903, 'nu': 0.5}. Best is trial 386 with value: 0.4872991004520934.
[I 2024-12-04 15:19:40,136] Trial 2342 finished with value: 1.2614547953941468 and parameters: {'kernel_type': 'Matern', 'length_scale': 38.62016877354735, 'noise_level': 0.03279107386064716, 'constant_value': 369.191339624123, 'nu': 0.5}. Best is trial 386 with value: 0.4872991004520934.
[I 2024-12-04 15:19:40,474] Trial 2330 finished with value: 0.48830341882799216 and parameters: {'kernel_type': 'Matern', 'length_scale': 83816.14300299875, 'noise_level': 0.9015890748557976, 'constant_value': 42237.23936739236, 'nu': 0.5}. Best is trial 386 with value: 0.4872991004520934.
[I 2024-12-04 15:19:41,070] Trial 2324 finished with value: 1.2401112326299797 and parameters: {'kernel_type': 'Matern', 'length_scale': 36523.524143116956, 'noise_level': 1.1153798054314942e-09, 'constant_value': 6.8685227963412e-05, 'nu': 0.5}. Best is trial 386 with value: 0.4872991004520934.
[I 2024-12-04 15:19:41,459] Trial 2345 finished with value: 1.2614547953941475 and parameters: {'kernel_type': 'Matern', 'length_scale': 92.46658282073932, 'noise_level': 0.020634532872796516, 'constant_value': 90008.10033747203, 'nu': 0.5}. Best is trial 386 with value: 0.4872991004520934.
[I 2024-12-04 15:19:41,462] Trial 2337 finished with value: 1.240111233725384 and parameters: {'kernel_type': 'Matern', 'length_scale': 86591.59287537374, 'noise_level': 0.031872724862680585, 'constant_value': 16.297247567335063, 'nu': 0.5}. Best is trial 386 with value: 0.4872991004520934.
[I 2024-12-04 15:19:42,271] Trial 2341 finished with value: 0.488303420077687 and parameters: {'kernel_type': 'Matern', 'length_scale': 3536.4360054857475, 'noise_level': 0.9883733464779496, 'constant_value': 51.284808159291345, 'nu': 0.5}. Best is trial 386 with value: 0.4872991004520934.
[I 2024-12-04 15:19:43,310] Trial 2340 finished with value: 1.2614547303168766 and parameters: {'kernel_type': 'Matern', 'length_scale': 4031.676016120272, 'noise_level': 0.08800799127305202, 'constant_value': 0.0013187560612895714, 'nu': 0.5}. Best is trial 386 with value: 0.4872991004520934.
[I 2024-12-04 15:19:43,319] Trial 2346 finished with value: 0.4883034187371981 and parameters: {'kernel_type': 'Matern', 'length_scale': 5489.37456771051, 'noise_level': 0.0014646012515566052, 'constant_value': 741.7399147890928, 'nu': 0.5}. Best is trial 386 with value: 0.4872991004520934.
[I 2024-12-04 15:19:44,482] Trial 2339 finished with value: 0.5663937881798697 and parameters: {'kernel_type': 'Matern', 'length_scale': 80072.97580625123, 'noise_level': 0.2757943434901513, 'constant_value': 75551.43787936438, 'nu': 2.5}. Best is trial 386 with value: 0.4872991004520934.
[I 2024-12-04 15:19:44,499] Trial 2338 finished with value: 0.48830342078128164 and parameters: {'kernel_type': 'Matern', 'length_scale': 86456.372078288, 'noise_level': 0.03128284209879497, 'constant_value': 381.50507119485684, 'nu': 0.5}. Best is trial 386 with value: 0.4872991004520934.
[I 2024-12-04 15:19:44,852] Trial 2344 finished with value: 0.48830341878473027 and parameters: {'kernel_type': 'Matern', 'length_scale': 89645.01071773139, 'noise_level': 0.6342570365812772, 'constant_value': 2741.2195647430485, 'nu': 0.5}. Best is trial 386 with value: 0.4872991004520934.
[I 2024-12-04 15:19:45,870] Trial 2351 finished with value: 1.2401112305225743 and parameters: {'kernel_type': 'Matern', 'length_scale': 2718.5881002019346, 'noise_level': 0.009748365173605897, 'constant_value': 8.890544129709424, 'nu': 0.5}. Best is trial 386 with value: 0.4872991004520934.
[I 2024-12-04 15:19:47,127] Trial 2355 finished with value: 0.4883034156040536 and parameters: {'kernel_type': 'Matern', 'length_scale': 96370.47579367884, 'noise_level': 0.014365852181303257, 'constant_value': 1294.709324415165, 'nu': 0.5}. Best is trial 386 with value: 0.4872991004520934.
[I 2024-12-04 15:19:47,517] Trial 2348 finished with value: 0.48830342017001294 and parameters: {'kernel_type': 'Matern', 'length_scale': 6280.515718005062, 'noise_level': 0.04586975258810146, 'constant_value': 4590.652319570695, 'nu': 0.5}. Best is trial 386 with value: 0.4872991004520934.
[I 2024-12-04 15:19:48,296] Trial 2354 finished with value: 0.4883033144942268 and parameters: {'kernel_type': 'Matern', 'length_scale': 243.24587338678663, 'noise_level': 0.012399556019397483, 'constant_value': 89.02907355231923, 'nu': 0.5}. Best is trial 386 with value: 0.4872991004520934.
[I 2024-12-04 15:19:49,454] Trial 2349 finished with value: 0.4883034187519876 and parameters: {'kernel_type': 'Matern', 'length_scale': 154.02703629208557, 'noise_level': 0.6847447480272366, 'constant_value': 0.0040594904852287944, 'nu': 0.5}. Best is trial 386 with value: 0.4872991004520934.
[I 2024-12-04 15:19:50,273] Trial 2356 finished with value: 0.4883037551811655 and parameters: {'kernel_type': 'Matern', 'length_scale': 59413.78766420229, 'noise_level': 0.990140263359101, 'constant_value': 7818.837619826797, 'nu': 0.5}. Best is trial 386 with value: 0.4872991004520934.
[I 2024-12-04 15:19:51,560] Trial 2357 finished with value: 1.2614547515070194 and parameters: {'kernel_type': 'Matern', 'length_scale': 8.4266853323185, 'noise_level': 4.90411301758547e-06, 'constant_value': 153.37055724520835, 'nu': 0.5}. Best is trial 386 with value: 0.4872991004520934.
[I 2024-12-04 15:19:53,169] Trial 2359 finished with value: 0.4883037440924065 and parameters: {'kernel_type': 'Matern', 'length_scale': 165.25663778360985, 'noise_level': 0.047215151370783616, 'constant_value': 3654.00370313684, 'nu': 0.5}. Best is trial 386 with value: 0.4872991004520934.
[I 2024-12-04 15:19:53,226] Trial 2353 finished with value: 0.4883034187650496 and parameters: {'kernel_type': 'Matern', 'length_scale': 2551.750807844058, 'noise_level': 0.05987474787517069, 'constant_value': 704.8304676591848, 'nu': 0.5}. Best is trial 386 with value: 0.4872991004520934.
[I 2024-12-04 15:19:54,338] Trial 2350 finished with value: 0.6443853733518622 and parameters: {'kernel_type': 'RBF', 'length_scale': 6406.424495665989, 'noise_level': 0.5898044111803525, 'constant_value': 33476.17222033644, 'nu': 1.5}. Best is trial 386 with value: 0.4872991004520934.
[I 2024-12-04 15:19:54,448] Trial 2347 finished with value: 0.4883034183401046 and parameters: {'kernel_type': 'Matern', 'length_scale': 5113.54025820862, 'noise_level': 0.029762940442671658, 'constant_value': 8640.364642989869, 'nu': 0.5}. Best is trial 386 with value: 0.4872991004520934.
[I 2024-12-04 15:19:55,589] Trial 2352 finished with value: 0.48830341756292334 and parameters: {'kernel_type': 'Matern', 'length_scale': 1807.0910572269588, 'noise_level': 0.01677532845182186, 'constant_value': 74927.99986301079, 'nu': 0.5}. Best is trial 386 with value: 0.4872991004520934.
[I 2024-12-04 15:19:56,209] Trial 2364 finished with value: 0.48830351942644706 and parameters: {'kernel_type': 'Matern', 'length_scale': 214.93369535667998, 'noise_level': 0.9901109067452907, 'constant_value': 5609.541049699653, 'nu': 0.5}. Best is trial 386 with value: 0.4872991004520934.
[I 2024-12-04 15:19:56,334] Trial 2366 finished with value: 0.4883034229529921 and parameters: {'kernel_type': 'Matern', 'length_scale': 44995.319201721024, 'noise_level': 0.9393795567794426, 'constant_value': 939.0260241049574, 'nu': 0.5}. Best is trial 386 with value: 0.4872991004520934.
[I 2024-12-04 15:19:56,795] Trial 2362 finished with value: 1.2401112329319672 and parameters: {'kernel_type': 'RBF', 'length_scale': 0.0015408321996054927, 'noise_level': 0.0017854673478769258, 'constant_value': 928.5464374207435, 'nu': 0.5}. Best is trial 386 with value: 0.4872991004520934.
[I 2024-12-04 15:19:58,216] Trial 2365 finished with value: 1.2401112325770323 and parameters: {'kernel_type': 'Matern', 'length_scale': 1747.0302398115589, 'noise_level': 0.012219392196376123, 'constant_value': 3667.8777848629074, 'nu': 1.5}. Best is trial 386 with value: 0.4872991004520934.
[I 2024-12-04 15:19:59,275] Trial 2360 finished with value: 0.4883033814628371 and parameters: {'kernel_type': 'Matern', 'length_scale': 750.4320054050694, 'noise_level': 0.0626843771481046, 'constant_value': 79703.3571944782, 'nu': 0.5}. Best is trial 386 with value: 0.4872991004520934.
[I 2024-12-04 15:19:59,718] Trial 2361 finished with value: 1.2401112325978385 and parameters: {'kernel_type': 'Matern', 'length_scale': 99739.16305772714, 'noise_level': 0.007110630401583884, 'constant_value': 7.066781659772058, 'nu': 0.5}. Best is trial 386 with value: 0.4872991004520934.
[I 2024-12-04 15:19:59,898] Trial 2369 finished with value: 0.4883034182948985 and parameters: {'kernel_type': 'Matern', 'length_scale': 25.17025784878141, 'noise_level': 0.04272808038877579, 'constant_value': 46.337938502194156, 'nu': 0.5}. Best is trial 386 with value: 0.4872991004520934.
[I 2024-12-04 15:20:00,092] Trial 2363 finished with value: 0.48830341160236496 and parameters: {'kernel_type': 'Matern', 'length_scale': 2877.5400386467113, 'noise_level': 0.0007991760977970915, 'constant_value': 57764.3046683769, 'nu': 0.5}. Best is trial 386 with value: 0.4872991004520934.
[I 2024-12-04 15:20:00,524] Trial 2368 finished with value: 0.48830341186093634 and parameters: {'kernel_type': 'Matern', 'length_scale': 68132.58703740279, 'noise_level': 0.9271790676312434, 'constant_value': 2110.3259021528056, 'nu': 0.5}. Best is trial 386 with value: 0.4872991004520934.
[I 2024-12-04 15:20:01,577] Trial 2367 finished with value: 0.6250941830243504 and parameters: {'kernel_type': 'RBF', 'length_scale': 1.9917078854210237, 'noise_level': 0.15305886507138622, 'constant_value': 7.761693128056281e-05, 'nu': 0.5}. Best is trial 386 with value: 0.4872991004520934.
[I 2024-12-04 15:20:02,848] Trial 2370 finished with value: 0.4883034187416657 and parameters: {'kernel_type': 'Matern', 'length_scale': 4183.750591112247, 'noise_level': 0.00036004497362716577, 'constant_value': 96416.8580457154, 'nu': 0.5}. Best is trial 386 with value: 0.4872991004520934.
[I 2024-12-04 15:20:03,633] Trial 2372 finished with value: 0.4883034190430929 and parameters: {'kernel_type': 'Matern', 'length_scale': 2170.6677895539087, 'noise_level': 0.8194541650781826, 'constant_value': 12348.781226228592, 'nu': 0.5}. Best is trial 386 with value: 0.4872991004520934.
[I 2024-12-04 15:20:03,864] Trial 2373 finished with value: 0.48830341888473616 and parameters: {'kernel_type': 'Matern', 'length_scale': 79286.15941794433, 'noise_level': 0.7516349938210863, 'constant_value': 42407.61369191182, 'nu': 0.5}. Best is trial 386 with value: 0.4872991004520934.
[I 2024-12-04 15:20:04,543] Trial 2380 finished with value: 0.488303424115369 and parameters: {'kernel_type': 'Matern', 'length_scale': 3243.474692741326, 'noise_level': 0.08486939323248481, 'constant_value': 16.330685549205725, 'nu': 0.5}. Best is trial 386 with value: 0.4872991004520934.
[I 2024-12-04 15:20:04,852] Trial 2377 finished with value: 1.2401112325735262 and parameters: {'kernel_type': 'Matern', 'length_scale': 98603.81818312447, 'noise_level': 0.0001795148111946431, 'constant_value': 2691.3734570050533, 'nu': 0.5}. Best is trial 386 with value: 0.4872991004520934.
[I 2024-12-04 15:20:05,856] Trial 2383 finished with value: 0.6443846703022993 and parameters: {'kernel_type': 'RBF', 'length_scale': 0.41152519486818395, 'noise_level': 0.2097272394999986, 'constant_value': 0.21386272682594862, 'nu': 1.5}. Best is trial 386 with value: 0.4872991004520934.
[I 2024-12-04 15:20:06,381] Trial 2376 finished with value: 0.48830336071551855 and parameters: {'kernel_type': 'Matern', 'length_scale': 109.61650128197158, 'noise_level': 0.0007134227091371626, 'constant_value': 601.5135755497325, 'nu': 0.5}. Best is trial 386 with value: 0.4872991004520934.
[I 2024-12-04 15:20:06,388] Trial 2358 finished with value: 1.2401112325792216 and parameters: {'kernel_type': 'Matern', 'length_scale': 337.9192083448757, 'noise_level': 6.698522239459361e-06, 'constant_value': 1.7244859273338462, 'nu': 2.5}. Best is trial 386 with value: 0.4872991004520934.
[I 2024-12-04 15:20:07,818] Trial 2381 finished with value: 0.48830343136408744 and parameters: {'kernel_type': 'Matern', 'length_scale': 120.68918664954809, 'noise_level': 0.8891960137925324, 'constant_value': 4872.004608172646, 'nu': 0.5}. Best is trial 386 with value: 0.4872991004520934.
[I 2024-12-04 15:20:08,349] Trial 2374 finished with value: 0.48830343314812935 and parameters: {'kernel_type': 'Matern', 'length_scale': 5830.181546000596, 'noise_level': 0.025481265652605, 'constant_value': 1237.0857930480975, 'nu': 0.5}. Best is trial 386 with value: 0.4872991004520934.
[I 2024-12-04 15:20:08,354] Trial 2378 finished with value: 1.2614547953941473 and parameters: {'kernel_type': 'Matern', 'length_scale': 1061.4918395998675, 'noise_level': 0.04045632054943579, 'constant_value': 81584.78901871624, 'nu': 0.5}. Best is trial 386 with value: 0.4872991004520934.
[I 2024-12-04 15:20:08,475] Trial 2382 finished with value: 0.4883034189527236 and parameters: {'kernel_type': 'Matern', 'length_scale': 2607.3726117124543, 'noise_level': 0.9811095059187548, 'constant_value': 56303.16916885081, 'nu': 0.5}. Best is trial 386 with value: 0.4872991004520934.
[I 2024-12-04 15:20:09,334] Trial 2371 finished with value: 1.261454797612658 and parameters: {'kernel_type': 'Matern', 'length_scale': 947.7240768009721, 'noise_level': 0.13901567134617113, 'constant_value': 2.7878951616866775e-05, 'nu': 2.5}. Best is trial 386 with value: 0.4872991004520934.
[I 2024-12-04 15:20:10,485] Trial 2384 finished with value: 1.261454795394147 and parameters: {'kernel_type': 'Matern', 'length_scale': 35.731885189119055, 'noise_level': 0.024574259196949992, 'constant_value': 828.0614024535575, 'nu': 0.5}. Best is trial 386 with value: 0.4872991004520934.
[I 2024-12-04 15:20:11,974] Trial 2375 finished with value: 0.4883033714900911 and parameters: {'kernel_type': 'Matern', 'length_scale': 1185.0320842511474, 'noise_level': 0.04126881007707841, 'constant_value': 5.052937141034523, 'nu': 0.5}. Best is trial 386 with value: 0.4872991004520934.
[I 2024-12-04 15:20:12,343] Trial 2379 finished with value: 0.5866903930126112 and parameters: {'kernel_type': 'RBF', 'length_scale': 39030.14704418755, 'noise_level': 0.5025431911207936, 'constant_value': 1652.9371240725086, 'nu': 0.5}. Best is trial 386 with value: 0.4872991004520934.
[I 2024-12-04 15:20:12,528] Trial 2390 finished with value: 0.5273054197510659 and parameters: {'kernel_type': 'Matern', 'length_scale': 41.1731272007404, 'noise_level': 0.1561034362332931, 'constant_value': 45929.38571301629, 'nu': 1.5}. Best is trial 386 with value: 0.4872991004520934.
[I 2024-12-04 15:20:12,532] Trial 2386 finished with value: 0.4883034150819629 and parameters: {'kernel_type': 'Matern', 'length_scale': 28.375154941701542, 'noise_level': 0.002397522297082622, 'constant_value': 99491.80982722231, 'nu': 0.5}. Best is trial 386 with value: 0.4872991004520934.
[I 2024-12-04 15:20:13,428] Trial 2392 finished with value: 0.48830344685842864 and parameters: {'kernel_type': 'Matern', 'length_scale': 108.07871575815406, 'noise_level': 0.7640609893546931, 'constant_value': 3.0151079751337138, 'nu': 0.5}. Best is trial 386 with value: 0.4872991004520934.
[I 2024-12-04 15:20:14,674] Trial 2395 finished with value: 1.2614543702027727 and parameters: {'kernel_type': 'RBF', 'length_scale': 0.0011485736597600703, 'noise_level': 2.545318739137741e-10, 'constant_value': 14.400242365666493, 'nu': 0.5}. Best is trial 386 with value: 0.4872991004520934.
[I 2024-12-04 15:20:15,130] Trial 2385 finished with value: 0.48830346407757286 and parameters: {'kernel_type': 'Matern', 'length_scale': 2300.182528817855, 'noise_level': 0.49223336745075247, 'constant_value': 96902.15343599977, 'nu': 0.5}. Best is trial 386 with value: 0.4872991004520934.
[I 2024-12-04 15:20:18,364] Trial 2397 finished with value: 0.4883034317187224 and parameters: {'kernel_type': 'Matern', 'length_scale': 1763.2964270169675, 'noise_level': 0.07226832571901662, 'constant_value': 31.519977568198296, 'nu': 0.5}. Best is trial 386 with value: 0.4872991004520934.
[I 2024-12-04 15:20:18,402] Trial 2388 finished with value: 0.48830342245002173 and parameters: {'kernel_type': 'Matern', 'length_scale': 88766.85475654573, 'noise_level': 0.10745661202648259, 'constant_value': 333.5216246325149, 'nu': 0.5}. Best is trial 386 with value: 0.4872991004520934.
[I 2024-12-04 15:20:19,051] Trial 2391 finished with value: 1.240111167329364 and parameters: {'kernel_type': 'Matern', 'length_scale': 0.0625010924886503, 'noise_level': 0.0024431244846194983, 'constant_value': 1364.4214478970594, 'nu': 0.5}. Best is trial 386 with value: 0.4872991004520934.
[I 2024-12-04 15:20:19,060] Trial 2400 finished with value: 0.48830331404251104 and parameters: {'kernel_type': 'Matern', 'length_scale': 94419.91024145039, 'noise_level': 0.027424603759979377, 'constant_value': 4443.618563669084, 'nu': 0.5}. Best is trial 386 with value: 0.4872991004520934.
[I 2024-12-04 15:20:19,346] Trial 2394 finished with value: 0.48830341645011516 and parameters: {'kernel_type': 'Matern', 'length_scale': 84610.466062676, 'noise_level': 0.7619143959944685, 'constant_value': 835.9387183172464, 'nu': 0.5}. Best is trial 386 with value: 0.4872991004520934.
[I 2024-12-04 15:20:20,144] Trial 2399 finished with value: 0.4883034189718597 and parameters: {'kernel_type': 'Matern', 'length_scale': 3934.224322118519, 'noise_level': 0.8694087549202195, 'constant_value': 64829.24228265809, 'nu': 0.5}. Best is trial 386 with value: 0.4872991004520934.
[I 2024-12-04 15:20:20,166] Trial 2387 finished with value: 0.48830339152538704 and parameters: {'kernel_type': 'Matern', 'length_scale': 2868.097167484628, 'noise_level': 0.8630768034463135, 'constant_value': 58162.36705220204, 'nu': 0.5}. Best is trial 386 with value: 0.4872991004520934.
[I 2024-12-04 15:20:20,707] Trial 2389 finished with value: 1.2401112323709935 and parameters: {'kernel_type': 'Matern', 'length_scale': 5523.349594177747, 'noise_level': 0.03077133051079827, 'constant_value': 10.148706316489484, 'nu': 0.5}. Best is trial 386 with value: 0.4872991004520934.
[I 2024-12-04 15:20:20,854] Trial 2404 finished with value: 0.6443858921243052 and parameters: {'kernel_type': 'RBF', 'length_scale': 17.48451571940427, 'noise_level': 0.6869627149817455, 'constant_value': 1.047497467847216, 'nu': 0.5}. Best is trial 386 with value: 0.4872991004520934.
[I 2024-12-04 15:20:21,165] Trial 2402 finished with value: 0.48830342848441505 and parameters: {'kernel_type': 'Matern', 'length_scale': 77972.85660917242, 'noise_level': 0.6702967625739332, 'constant_value': 80000.52480089273, 'nu': 0.5}. Best is trial 386 with value: 0.4872991004520934.
