[I 2024-12-04 11:57:01,621] Trial 151 finished with value: 0.5232380691510622 and parameters: {'n_estimators': 126, 'max_depth': 16, 'min_samples_split': 8, 'min_samples_leaf': 1, 'max_features': None, 'bootstrap': True, 'criterion': 'absolute_error'}. Best is trial 117 with value: 0.5091146052010797.
[I 2024-12-04 11:57:02,575] Trial 144 finished with value: 0.5153924769615064 and parameters: {'n_estimators': 847, 'max_depth': 27, 'min_samples_split': 6, 'min_samples_leaf': 1, 'max_features': None, 'bootstrap': True, 'criterion': 'squared_error'}. Best is trial 117 with value: 0.5091146052010797.
[I 2024-12-04 11:57:03,237] Trial 137 finished with value: 0.5140483536311865 and parameters: {'n_estimators': 907, 'max_depth': 18, 'min_samples_split': 4, 'min_samples_leaf': 1, 'max_features': None, 'bootstrap': True, 'criterion': 'squared_error'}. Best is trial 117 with value: 0.5091146052010797.
[I 2024-12-04 11:57:03,576] Trial 146 finished with value: 0.8172398285310852 and parameters: {'n_estimators': 878, 'max_depth': 31, 'min_samples_split': 5, 'min_samples_leaf': 1, 'max_features': 'log2', 'bootstrap': True, 'criterion': 'squared_error'}. Best is trial 117 with value: 0.5091146052010797.
[I 2024-12-04 11:57:10,382] Trial 163 finished with value: 1.1347715748045037 and parameters: {'n_estimators': 215, 'max_depth': 49, 'min_samples_split': 14, 'min_samples_leaf': 7, 'max_features': 'sqrt', 'bootstrap': False, 'criterion': 'squared_error'}. Best is trial 117 with value: 0.5091146052010797.
[I 2024-12-04 11:57:11,583] Trial 158 finished with value: 0.5414128210998645 and parameters: {'n_estimators': 106, 'max_depth': 12, 'min_samples_split': 8, 'min_samples_leaf': 1, 'max_features': None, 'bootstrap': False, 'criterion': 'absolute_error'}. Best is trial 117 with value: 0.5091146052010797.
[I 2024-12-04 11:57:12,061] Trial 148 finished with value: 0.8446812308078512 and parameters: {'n_estimators': 605, 'max_depth': 33, 'min_samples_split': 3, 'min_samples_leaf': 1, 'max_features': 'log2', 'bootstrap': True, 'criterion': 'absolute_error'}. Best is trial 117 with value: 0.5091146052010797.
[I 2024-12-04 11:57:13,605] Trial 152 finished with value: 0.5202473652101246 and parameters: {'n_estimators': 171, 'max_depth': 17, 'min_samples_split': 3, 'min_samples_leaf': 1, 'max_features': None, 'bootstrap': True, 'criterion': 'absolute_error'}. Best is trial 117 with value: 0.5091146052010797.
[I 2024-12-04 11:57:22,682] Trial 160 finished with value: 0.5510070311351887 and parameters: {'n_estimators': 700, 'max_depth': 22, 'min_samples_split': 4, 'min_samples_leaf': 2, 'max_features': None, 'bootstrap': True, 'criterion': 'squared_error'}. Best is trial 117 with value: 0.5091146052010797.
[I 2024-12-04 11:57:24,127] Trial 159 finished with value: 0.5180895430530479 and parameters: {'n_estimators': 260, 'max_depth': 21, 'min_samples_split': 5, 'min_samples_leaf': 1, 'max_features': None, 'bootstrap': True, 'criterion': 'absolute_error'}. Best is trial 117 with value: 0.5091146052010797.
[I 2024-12-04 11:57:24,148] Trial 164 finished with value: 1.3529606163397792 and parameters: {'n_estimators': 990, 'max_depth': 10, 'min_samples_split': 6, 'min_samples_leaf': 12, 'max_features': 'log2', 'bootstrap': False, 'criterion': 'absolute_error'}. Best is trial 117 with value: 0.5091146052010797.
[I 2024-12-04 11:57:28,195] Trial 167 finished with value: 0.5225477500413832 and parameters: {'n_estimators': 830, 'max_depth': 12, 'min_samples_split': 3, 'min_samples_leaf': 1, 'max_features': None, 'bootstrap': True, 'criterion': 'squared_error'}. Best is trial 117 with value: 0.5091146052010797.
[I 2024-12-04 11:57:29,251] Trial 155 finished with value: 0.5165683880043338 and parameters: {'n_estimators': 401, 'max_depth': 22, 'min_samples_split': 5, 'min_samples_leaf': 1, 'max_features': None, 'bootstrap': True, 'criterion': 'absolute_error'}. Best is trial 117 with value: 0.5091146052010797.
[I 2024-12-04 11:57:29,253] Trial 166 finished with value: 0.5172612736206619 and parameters: {'n_estimators': 806, 'max_depth': 25, 'min_samples_split': 4, 'min_samples_leaf': 1, 'max_features': None, 'bootstrap': True, 'criterion': 'squared_error'}. Best is trial 117 with value: 0.5091146052010797.
[I 2024-12-04 11:57:29,811] Trial 143 finished with value: 0.6363127939197994 and parameters: {'n_estimators': 702, 'max_depth': 40, 'min_samples_split': 3, 'min_samples_leaf': 3, 'max_features': None, 'bootstrap': False, 'criterion': 'absolute_error'}. Best is trial 117 with value: 0.5091146052010797.
[I 2024-12-04 11:57:29,818] Trial 147 finished with value: 0.5652819481862108 and parameters: {'n_estimators': 653, 'max_depth': 36, 'min_samples_split': 4, 'min_samples_leaf': 2, 'max_features': None, 'bootstrap': True, 'criterion': 'absolute_error'}. Best is trial 117 with value: 0.5091146052010797.
[I 2024-12-04 11:57:29,957] Trial 165 finished with value: 0.509630186978547 and parameters: {'n_estimators': 945, 'max_depth': 19, 'min_samples_split': 5, 'min_samples_leaf': 1, 'max_features': None, 'bootstrap': True, 'criterion': 'squared_error'}. Best is trial 117 with value: 0.5091146052010797.
[I 2024-12-04 11:57:31,296] Trial 161 finished with value: 0.5233497472896145 and parameters: {'n_estimators': 927, 'max_depth': 34, 'min_samples_split': 3, 'min_samples_leaf': 1, 'max_features': None, 'bootstrap': True, 'criterion': 'squared_error'}. Best is trial 170 with value: 0.5079262681451786.
[I 2024-12-04 11:57:31,878] Trial 168 finished with value: 1.2510813548169526 and parameters: {'n_estimators': 765, 'max_depth': 21, 'min_samples_split': 15, 'min_samples_leaf': 12, 'max_features': 'log2', 'bootstrap': True, 'criterion': 'squared_error'}. Best is trial 170 with value: 0.5079262681451786.
[I 2024-12-04 11:57:32,797] Trial 170 finished with value: 0.5079262681451786 and parameters: {'n_estimators': 109, 'max_depth': 17, 'min_samples_split': 5, 'min_samples_leaf': 1, 'max_features': None, 'bootstrap': True, 'criterion': 'absolute_error'}. Best is trial 170 with value: 0.5079262681451786.
[I 2024-12-04 11:57:32,806] Trial 179 finished with value: 0.6213381820908981 and parameters: {'n_estimators': 329, 'max_depth': 12, 'min_samples_split': 29, 'min_samples_leaf': 4, 'max_features': None, 'bootstrap': False, 'criterion': 'squared_error'}. Best is trial 170 with value: 0.5079262681451786.
[I 2024-12-04 11:57:34,375] Trial 162 finished with value: 0.5204392551045669 and parameters: {'n_estimators': 882, 'max_depth': 14, 'min_samples_split': 3, 'min_samples_leaf': 1, 'max_features': None, 'bootstrap': True, 'criterion': 'squared_error'}. Best is trial 170 with value: 0.5079262681451786.
[I 2024-12-04 11:57:34,392] Trial 150 finished with value: 0.5252620199695669 and parameters: {'n_estimators': 456, 'max_depth': 22, 'min_samples_split': 8, 'min_samples_leaf': 1, 'max_features': None, 'bootstrap': True, 'criterion': 'absolute_error'}. Best is trial 170 with value: 0.5079262681451786.
[I 2024-12-04 11:57:36,115] Trial 149 finished with value: 0.5637908883420659 and parameters: {'n_estimators': 719, 'max_depth': 46, 'min_samples_split': 2, 'min_samples_leaf': 2, 'max_features': None, 'bootstrap': True, 'criterion': 'absolute_error'}. Best is trial 170 with value: 0.5079262681451786.
[I 2024-12-04 11:57:36,257] Trial 157 finished with value: 0.5125598475050632 and parameters: {'n_estimators': 761, 'max_depth': 26, 'min_samples_split': 5, 'min_samples_leaf': 1, 'max_features': None, 'bootstrap': True, 'criterion': 'squared_error'}. Best is trial 170 with value: 0.5079262681451786.
[I 2024-12-04 11:57:36,317] Trial 169 finished with value: 0.5533654987661035 and parameters: {'n_estimators': 838, 'max_depth': 29, 'min_samples_split': 7, 'min_samples_leaf': 2, 'max_features': None, 'bootstrap': True, 'criterion': 'squared_error'}. Best is trial 170 with value: 0.5079262681451786.
[I 2024-12-04 11:57:36,375] Trial 176 finished with value: 1.0553760815864701 and parameters: {'n_estimators': 688, 'max_depth': 11, 'min_samples_split': 49, 'min_samples_leaf': 1, 'max_features': 'log2', 'bootstrap': False, 'criterion': 'squared_error'}. Best is trial 170 with value: 0.5079262681451786.
[I 2024-12-04 11:57:36,853] Trial 136 finished with value: 0.5145728865572372 and parameters: {'n_estimators': 850, 'max_depth': 13, 'min_samples_split': 5, 'min_samples_leaf': 1, 'max_features': None, 'bootstrap': True, 'criterion': 'absolute_error'}. Best is trial 170 with value: 0.5079262681451786.
[I 2024-12-04 11:57:37,662] Trial 173 finished with value: 0.6920815195172343 and parameters: {'n_estimators': 842, 'max_depth': 23, 'min_samples_split': 4, 'min_samples_leaf': 1, 'max_features': 'sqrt', 'bootstrap': False, 'criterion': 'squared_error'}. Best is trial 170 with value: 0.5079262681451786.
[I 2024-12-04 11:57:37,664] Trial 182 finished with value: 1.3633850346059422 and parameters: {'n_estimators': 461, 'max_depth': 22, 'min_samples_split': 2, 'min_samples_leaf': 11, 'max_features': 'log2', 'bootstrap': True, 'criterion': 'absolute_error'}. Best is trial 170 with value: 0.5079262681451786.
[I 2024-12-04 11:57:37,750] Trial 175 finished with value: 1.3019972561228834 and parameters: {'n_estimators': 890, 'max_depth': 21, 'min_samples_split': 12, 'min_samples_leaf': 3, 'max_features': 'log2', 'bootstrap': False, 'criterion': 'absolute_error'}. Best is trial 170 with value: 0.5079262681451786.
[I 2024-12-04 11:57:37,832] Trial 177 finished with value: 0.5872812963987265 and parameters: {'n_estimators': 657, 'max_depth': 25, 'min_samples_split': 14, 'min_samples_leaf': 1, 'max_features': None, 'bootstrap': False, 'criterion': 'squared_error'}. Best is trial 170 with value: 0.5079262681451786.
[I 2024-12-04 11:57:38,420] Trial 181 finished with value: 0.9228084284785525 and parameters: {'n_estimators': 866, 'max_depth': 16, 'min_samples_split': 4, 'min_samples_leaf': 2, 'max_features': 'sqrt', 'bootstrap': True, 'criterion': 'squared_error'}. Best is trial 170 with value: 0.5079262681451786.
[I 2024-12-04 11:57:39,285] Trial 180 finished with value: 0.9795917722268676 and parameters: {'n_estimators': 979, 'max_depth': 10, 'min_samples_split': 2, 'min_samples_leaf': 2, 'max_features': 'sqrt', 'bootstrap': True, 'criterion': 'squared_error'}. Best is trial 170 with value: 0.5079262681451786.
[I 2024-12-04 11:57:40,031] Trial 178 finished with value: 0.519489321745347 and parameters: {'n_estimators': 138, 'max_depth': 21, 'min_samples_split': 3, 'min_samples_leaf': 1, 'max_features': None, 'bootstrap': True, 'criterion': 'absolute_error'}. Best is trial 170 with value: 0.5079262681451786.
[I 2024-12-04 11:57:40,318] Trial 174 finished with value: 0.5217118036024634 and parameters: {'n_estimators': 905, 'max_depth': 22, 'min_samples_split': 7, 'min_samples_leaf': 1, 'max_features': None, 'bootstrap': True, 'criterion': 'squared_error'}. Best is trial 170 with value: 0.5079262681451786.
[I 2024-12-04 11:57:40,640] Trial 171 finished with value: 0.5212136596920053 and parameters: {'n_estimators': 733, 'max_depth': 27, 'min_samples_split': 2, 'min_samples_leaf': 1, 'max_features': None, 'bootstrap': True, 'criterion': 'squared_error'}. Best is trial 170 with value: 0.5079262681451786.
[I 2024-12-04 11:57:42,007] Trial 183 finished with value: 0.5168527689767549 and parameters: {'n_estimators': 673, 'max_depth': 30, 'min_samples_split': 5, 'min_samples_leaf': 1, 'max_features': None, 'bootstrap': True, 'criterion': 'squared_error'}. Best is trial 170 with value: 0.5079262681451786.
[I 2024-12-04 11:57:53,659] Trial 195 finished with value: 1.2359156007974954 and parameters: {'n_estimators': 125, 'max_depth': 10, 'min_samples_split': 4, 'min_samples_leaf': 4, 'max_features': 'sqrt', 'bootstrap': True, 'criterion': 'absolute_error'}. Best is trial 170 with value: 0.5079262681451786.
[I 2024-12-04 11:57:59,089] Trial 192 finished with value: 0.5593392045138235 and parameters: {'n_estimators': 120, 'max_depth': 20, 'min_samples_split': 5, 'min_samples_leaf': 2, 'max_features': None, 'bootstrap': True, 'criterion': 'absolute_error'}. Best is trial 170 with value: 0.5079262681451786.
[I 2024-12-04 11:57:59,682] Trial 196 finished with value: 1.3661085411785872 and parameters: {'n_estimators': 991, 'max_depth': 28, 'min_samples_split': 2, 'min_samples_leaf': 13, 'max_features': 'log2', 'bootstrap': True, 'criterion': 'absolute_error'}. Best is trial 170 with value: 0.5079262681451786.
[I 2024-12-04 11:58:00,097] Trial 199 finished with value: 1.1178743370716415 and parameters: {'n_estimators': 502, 'max_depth': 29, 'min_samples_split': 41, 'min_samples_leaf': 7, 'max_features': 'sqrt', 'bootstrap': False, 'criterion': 'squared_error'}. Best is trial 170 with value: 0.5079262681451786.
[I 2024-12-04 11:58:01,358] Trial 186 finished with value: 0.5171173372471979 and parameters: {'n_estimators': 229, 'max_depth': 18, 'min_samples_split': 6, 'min_samples_leaf': 1, 'max_features': None, 'bootstrap': True, 'criterion': 'absolute_error'}. Best is trial 170 with value: 0.5079262681451786.
[I 2024-12-04 11:58:01,400] Trial 191 finished with value: 0.5106039236575781 and parameters: {'n_estimators': 102, 'max_depth': 13, 'min_samples_split': 4, 'min_samples_leaf': 1, 'max_features': None, 'bootstrap': True, 'criterion': 'absolute_error'}. Best is trial 170 with value: 0.5079262681451786.
[I 2024-12-04 11:58:05,714] Trial 205 finished with value: 1.2927912923197837 and parameters: {'n_estimators': 879, 'max_depth': 5, 'min_samples_split': 4, 'min_samples_leaf': 2, 'max_features': 'log2', 'bootstrap': False, 'criterion': 'absolute_error'}. Best is trial 170 with value: 0.5079262681451786.
[I 2024-12-04 11:58:05,813] Trial 193 finished with value: 0.5135351922250259 and parameters: {'n_estimators': 890, 'max_depth': 20, 'min_samples_split': 6, 'min_samples_leaf': 1, 'max_features': None, 'bootstrap': True, 'criterion': 'squared_error'}. Best is trial 170 with value: 0.5079262681451786.
[I 2024-12-04 11:58:05,883] Trial 187 finished with value: 0.7122862937861492 and parameters: {'n_estimators': 850, 'max_depth': 26, 'min_samples_split': 4, 'min_samples_leaf': 1, 'max_features': 'sqrt', 'bootstrap': True, 'criterion': 'absolute_error'}. Best is trial 170 with value: 0.5079262681451786.
[I 2024-12-04 11:58:08,214] Trial 206 finished with value: 1.251778622724659 and parameters: {'n_estimators': 553, 'max_depth': 10, 'min_samples_split': 18, 'min_samples_leaf': 7, 'max_features': 'sqrt', 'bootstrap': False, 'criterion': 'absolute_error'}. Best is trial 170 with value: 0.5079262681451786.
[I 2024-12-04 11:58:09,061] Trial 189 finished with value: 0.5148328554418754 and parameters: {'n_estimators': 752, 'max_depth': 14, 'min_samples_split': 6, 'min_samples_leaf': 1, 'max_features': None, 'bootstrap': True, 'criterion': 'squared_error'}. Best is trial 170 with value: 0.5079262681451786.
[I 2024-12-04 11:58:09,325] Trial 202 finished with value: 0.5158444872324763 and parameters: {'n_estimators': 199, 'max_depth': 16, 'min_samples_split': 5, 'min_samples_leaf': 1, 'max_features': None, 'bootstrap': True, 'criterion': 'absolute_error'}. Best is trial 170 with value: 0.5079262681451786.
[I 2024-12-04 11:58:09,882] Trial 198 finished with value: 0.5230997832308076 and parameters: {'n_estimators': 869, 'max_depth': 27, 'min_samples_split': 7, 'min_samples_leaf': 1, 'max_features': None, 'bootstrap': True, 'criterion': 'squared_error'}. Best is trial 170 with value: 0.5079262681451786.
[I 2024-12-04 11:58:09,997] Trial 129 finished with value: 0.5296474075896246 and parameters: {'n_estimators': 971, 'max_depth': 31, 'min_samples_split': 8, 'min_samples_leaf': 1, 'max_features': None, 'bootstrap': False, 'criterion': 'absolute_error'}. Best is trial 170 with value: 0.5079262681451786.
[I 2024-12-04 11:58:10,036] Trial 197 finished with value: 1.3566212645711804 and parameters: {'n_estimators': 683, 'max_depth': 29, 'min_samples_split': 29, 'min_samples_leaf': 15, 'max_features': 'log2', 'bootstrap': False, 'criterion': 'absolute_error'}. Best is trial 170 with value: 0.5079262681451786.
[I 2024-12-04 11:58:11,067] Trial 210 finished with value: 1.296978318892875 and parameters: {'n_estimators': 434, 'max_depth': 43, 'min_samples_split': 6, 'min_samples_leaf': 3, 'max_features': 'log2', 'bootstrap': False, 'criterion': 'absolute_error'}. Best is trial 170 with value: 0.5079262681451786.
[I 2024-12-04 11:58:15,320] Trial 200 finished with value: 0.9404546261128911 and parameters: {'n_estimators': 978, 'max_depth': 20, 'min_samples_split': 8, 'min_samples_leaf': 1, 'max_features': 'log2', 'bootstrap': True, 'criterion': 'squared_error'}. Best is trial 170 with value: 0.5079262681451786.
[I 2024-12-04 11:58:17,792] Trial 188 finished with value: 0.5161902117217246 and parameters: {'n_estimators': 997, 'max_depth': 25, 'min_samples_split': 4, 'min_samples_leaf': 1, 'max_features': None, 'bootstrap': True, 'criterion': 'squared_error'}. Best is trial 170 with value: 0.5079262681451786.
[I 2024-12-04 11:58:19,390] Trial 216 finished with value: 1.1248391993773144 and parameters: {'n_estimators': 206, 'max_depth': 7, 'min_samples_split': 9, 'min_samples_leaf': 1, 'max_features': 'sqrt', 'bootstrap': True, 'criterion': 'absolute_error'}. Best is trial 170 with value: 0.5079262681451786.
[I 2024-12-04 11:58:19,538] Trial 208 finished with value: 1.1741670568379297 and parameters: {'n_estimators': 772, 'max_depth': 10, 'min_samples_split': 7, 'min_samples_leaf': 1, 'max_features': 'log2', 'bootstrap': True, 'criterion': 'absolute_error'}. Best is trial 170 with value: 0.5079262681451786.
[I 2024-12-04 11:58:19,753] Trial 203 finished with value: 0.543732003581429 and parameters: {'n_estimators': 977, 'max_depth': 14, 'min_samples_split': 5, 'min_samples_leaf': 2, 'max_features': None, 'bootstrap': True, 'criterion': 'squared_error'}. Best is trial 170 with value: 0.5079262681451786.
[I 2024-12-04 11:58:19,769] Trial 201 finished with value: 0.577716798229642 and parameters: {'n_estimators': 967, 'max_depth': 29, 'min_samples_split': 9, 'min_samples_leaf': 1, 'max_features': None, 'bootstrap': False, 'criterion': 'squared_error'}. Best is trial 170 with value: 0.5079262681451786.
[I 2024-12-04 11:58:19,976] Trial 213 finished with value: 0.5276665181747002 and parameters: {'n_estimators': 606, 'max_depth': 19, 'min_samples_split': 8, 'min_samples_leaf': 1, 'max_features': None, 'bootstrap': True, 'criterion': 'squared_error'}. Best is trial 170 with value: 0.5079262681451786.
[I 2024-12-04 11:58:20,118] Trial 190 finished with value: 0.5912976064614466 and parameters: {'n_estimators': 863, 'max_depth': 13, 'min_samples_split': 4, 'min_samples_leaf': 4, 'max_features': None, 'bootstrap': True, 'criterion': 'absolute_error'}. Best is trial 170 with value: 0.5079262681451786.
[I 2024-12-04 11:58:26,140] Trial 212 finished with value: 0.5156418146438041 and parameters: {'n_estimators': 654, 'max_depth': 20, 'min_samples_split': 4, 'min_samples_leaf': 1, 'max_features': None, 'bootstrap': True, 'criterion': 'squared_error'}. Best is trial 170 with value: 0.5079262681451786.
[I 2024-12-04 11:58:26,792] Trial 221 finished with value: 1.179099411365282 and parameters: {'n_estimators': 721, 'max_depth': 21, 'min_samples_split': 4, 'min_samples_leaf': 2, 'max_features': 'log2', 'bootstrap': True, 'criterion': 'squared_error'}. Best is trial 170 with value: 0.5079262681451786.
[I 2024-12-04 11:58:27,031] Trial 218 finished with value: 1.232473231365618 and parameters: {'n_estimators': 179, 'max_depth': 24, 'min_samples_split': 14, 'min_samples_leaf': 6, 'max_features': 'sqrt', 'bootstrap': False, 'criterion': 'absolute_error'}. Best is trial 170 with value: 0.5079262681451786.
[I 2024-12-04 11:58:27,700] Trial 194 finished with value: 0.714550218906208 and parameters: {'n_estimators': 962, 'max_depth': 17, 'min_samples_split': 37, 'min_samples_leaf': 4, 'max_features': None, 'bootstrap': False, 'criterion': 'absolute_error'}. Best is trial 170 with value: 0.5079262681451786.
[I 2024-12-04 11:58:30,396] Trial 172 finished with value: 0.5216550900370039 and parameters: {'n_estimators': 806, 'max_depth': 12, 'min_samples_split': 7, 'min_samples_leaf': 1, 'max_features': None, 'bootstrap': True, 'criterion': 'absolute_error'}. Best is trial 170 with value: 0.5079262681451786.
[I 2024-12-04 11:58:30,446] Trial 207 finished with value: 0.513452873025048 and parameters: {'n_estimators': 809, 'max_depth': 20, 'min_samples_split': 6, 'min_samples_leaf': 1, 'max_features': None, 'bootstrap': True, 'criterion': 'squared_error'}. Best is trial 170 with value: 0.5079262681451786.
[I 2024-12-04 11:58:30,462] Trial 215 finished with value: 1.2168093146998464 and parameters: {'n_estimators': 243, 'max_depth': 29, 'min_samples_split': 6, 'min_samples_leaf': 5, 'max_features': 'log2', 'bootstrap': False, 'criterion': 'squared_error'}. Best is trial 170 with value: 0.5079262681451786.
[I 2024-12-04 11:58:30,778] Trial 222 finished with value: 0.5090553335137658 and parameters: {'n_estimators': 100, 'max_depth': 13, 'min_samples_split': 4, 'min_samples_leaf': 1, 'max_features': None, 'bootstrap': True, 'criterion': 'absolute_error'}. Best is trial 170 with value: 0.5079262681451786.
[I 2024-12-04 11:58:31,184] Trial 217 finished with value: 0.5329365196679289 and parameters: {'n_estimators': 259, 'max_depth': 7, 'min_samples_split': 2, 'min_samples_leaf': 1, 'max_features': None, 'bootstrap': True, 'criterion': 'absolute_error'}. Best is trial 170 with value: 0.5079262681451786.
[I 2024-12-04 11:58:31,804] Trial 226 finished with value: 1.2177403388838832 and parameters: {'n_estimators': 408, 'max_depth': 23, 'min_samples_split': 6, 'min_samples_leaf': 15, 'max_features': 'sqrt', 'bootstrap': False, 'criterion': 'squared_error'}. Best is trial 170 with value: 0.5079262681451786.
