[I 2024-12-04 15:07:58,328] Trial 1287 finished with value: 0.611042177176228 and parameters: {'n_estimators': 707, 'learning_rate': 0.02571475033725876, 'max_depth': 11, 'min_samples_split': 13, 'min_samples_leaf': 3, 'subsample': 0.607868559042159, 'max_features': None}. Best is trial 603 with value: 0.45955205541891275.
[I 2024-12-04 15:08:01,974] Trial 1257 finished with value: 0.47104914503457557 and parameters: {'n_estimators': 1406, 'learning_rate': 0.06443786635736706, 'max_depth': 12, 'min_samples_split': 20, 'min_samples_leaf': 1, 'subsample': 0.9577352042524007, 'max_features': None}. Best is trial 603 with value: 0.45955205541891275.
[I 2024-12-04 15:08:02,789] Trial 1275 finished with value: 0.622683875765384 and parameters: {'n_estimators': 956, 'learning_rate': 0.08972505619782069, 'max_depth': 11, 'min_samples_split': 20, 'min_samples_leaf': 2, 'subsample': 0.9999432483644182, 'max_features': None}. Best is trial 603 with value: 0.45955205541891275.
[I 2024-12-04 15:08:03,762] Trial 1268 finished with value: 0.46512773231284255 and parameters: {'n_estimators': 1184, 'learning_rate': 0.07634082493320539, 'max_depth': 12, 'min_samples_split': 20, 'min_samples_leaf': 1, 'subsample': 0.9836272023404113, 'max_features': None}. Best is trial 603 with value: 0.45955205541891275.
[I 2024-12-04 15:08:03,817] Trial 1297 finished with value: 0.6570934657777076 and parameters: {'n_estimators': 387, 'learning_rate': 0.07646845564757465, 'max_depth': 3, 'min_samples_split': 19, 'min_samples_leaf': 1, 'subsample': 0.8816866507222471, 'max_features': 'log2'}. Best is trial 603 with value: 0.45955205541891275.
[I 2024-12-04 15:08:05,627] Trial 1286 finished with value: 0.49422661710276694 and parameters: {'n_estimators': 876, 'learning_rate': 0.08992685924206889, 'max_depth': 10, 'min_samples_split': 20, 'min_samples_leaf': 1, 'subsample': 0.9882476712290067, 'max_features': None}. Best is trial 603 with value: 0.45955205541891275.
[I 2024-12-04 15:08:08,523] Trial 1291 finished with value: 0.4740173795535286 and parameters: {'n_estimators': 842, 'learning_rate': 0.08828870694144801, 'max_depth': 11, 'min_samples_split': 20, 'min_samples_leaf': 1, 'subsample': 0.9963346424692223, 'max_features': None}. Best is trial 603 with value: 0.45955205541891275.
[I 2024-12-04 15:08:09,678] Trial 1269 finished with value: 0.5353661592858616 and parameters: {'n_estimators': 1408, 'learning_rate': 0.05095695729886114, 'max_depth': 10, 'min_samples_split': 12, 'min_samples_leaf': 1, 'subsample': 0.9856861363219424, 'max_features': None}. Best is trial 603 with value: 0.45955205541891275.
[I 2024-12-04 15:08:10,154] Trial 1280 finished with value: 0.46137227787602064 and parameters: {'n_estimators': 1093, 'learning_rate': 0.09830604993292516, 'max_depth': 12, 'min_samples_split': 18, 'min_samples_leaf': 1, 'subsample': 0.9966503742907294, 'max_features': None}. Best is trial 603 with value: 0.45955205541891275.
[I 2024-12-04 15:08:10,510] Trial 1276 finished with value: 0.6290348391434671 and parameters: {'n_estimators': 1293, 'learning_rate': 0.022726017495184863, 'max_depth': 12, 'min_samples_split': 18, 'min_samples_leaf': 3, 'subsample': 0.8389341594378368, 'max_features': None}. Best is trial 603 with value: 0.45955205541891275.
[I 2024-12-04 15:08:11,096] Trial 1273 finished with value: 0.4700852087697367 and parameters: {'n_estimators': 1259, 'learning_rate': 0.06440619169073401, 'max_depth': 12, 'min_samples_split': 20, 'min_samples_leaf': 1, 'subsample': 0.989308163958304, 'max_features': None}. Best is trial 603 with value: 0.45955205541891275.
[I 2024-12-04 15:08:11,396] Trial 1311 finished with value: 0.6666951151379252 and parameters: {'n_estimators': 155, 'learning_rate': 0.07576150796158747, 'max_depth': 5, 'min_samples_split': 5, 'min_samples_leaf': 3, 'subsample': 0.6547862552531318, 'max_features': 'sqrt'}. Best is trial 603 with value: 0.45955205541891275.
[I 2024-12-04 15:08:13,126] Trial 1271 finished with value: 0.4787760563227796 and parameters: {'n_estimators': 1348, 'learning_rate': 0.046340845403361114, 'max_depth': 12, 'min_samples_split': 19, 'min_samples_leaf': 1, 'subsample': 0.9446688248003035, 'max_features': None}. Best is trial 603 with value: 0.45955205541891275.
[I 2024-12-04 15:08:13,523] Trial 1279 finished with value: 0.48102299403239573 and parameters: {'n_estimators': 1229, 'learning_rate': 0.05194542468146609, 'max_depth': 11, 'min_samples_split': 20, 'min_samples_leaf': 1, 'subsample': 0.9925997344543457, 'max_features': None}. Best is trial 603 with value: 0.45955205541891275.
[I 2024-12-04 15:08:14,662] Trial 1281 finished with value: 0.5902989731706967 and parameters: {'n_estimators': 1471, 'learning_rate': 0.04917445427748356, 'max_depth': 11, 'min_samples_split': 19, 'min_samples_leaf': 5, 'subsample': 0.6283888315061374, 'max_features': None}. Best is trial 603 with value: 0.45955205541891275.
[I 2024-12-04 15:08:15,062] Trial 1294 finished with value: 0.4842439929921442 and parameters: {'n_estimators': 763, 'learning_rate': 0.07721820592862602, 'max_depth': 12, 'min_samples_split': 17, 'min_samples_leaf': 1, 'subsample': 0.9982905476387876, 'max_features': None}. Best is trial 603 with value: 0.45955205541891275.
[I 2024-12-04 15:08:16,062] Trial 1284 finished with value: 0.6249526605449494 and parameters: {'n_estimators': 1181, 'learning_rate': 0.07214008794948441, 'max_depth': 12, 'min_samples_split': 17, 'min_samples_leaf': 2, 'subsample': 0.9933377898088436, 'max_features': None}. Best is trial 603 with value: 0.45955205541891275.
[I 2024-12-04 15:08:16,286] Trial 1289 finished with value: 0.5808770404403163 and parameters: {'n_estimators': 1107, 'learning_rate': 0.01253317433649784, 'max_depth': 9, 'min_samples_split': 2, 'min_samples_leaf': 1, 'subsample': 0.9941780338611055, 'max_features': None}. Best is trial 603 with value: 0.45955205541891275.
[I 2024-12-04 15:08:19,143] Trial 1290 finished with value: 0.47758030840783444 and parameters: {'n_estimators': 1201, 'learning_rate': 0.06310905903504335, 'max_depth': 10, 'min_samples_split': 20, 'min_samples_leaf': 1, 'subsample': 0.9527219494177024, 'max_features': None}. Best is trial 603 with value: 0.45955205541891275.
[I 2024-12-04 15:08:19,318] Trial 1274 finished with value: 0.6635829018806011 and parameters: {'n_estimators': 1452, 'learning_rate': 0.05776718366016184, 'max_depth': 12, 'min_samples_split': 20, 'min_samples_leaf': 3, 'subsample': 0.9237782865944776, 'max_features': None}. Best is trial 603 with value: 0.45955205541891275.
[I 2024-12-04 15:08:21,194] Trial 1301 finished with value: 0.7716665901040792 and parameters: {'n_estimators': 722, 'learning_rate': 0.02528227287692876, 'max_depth': 9, 'min_samples_split': 12, 'min_samples_leaf': 10, 'subsample': 0.6260682527521921, 'max_features': None}. Best is trial 603 with value: 0.45955205541891275.
[I 2024-12-04 15:08:21,755] Trial 1277 finished with value: 0.6363546119232697 and parameters: {'n_estimators': 1456, 'learning_rate': 0.0486568694257949, 'max_depth': 12, 'min_samples_split': 19, 'min_samples_leaf': 3, 'subsample': 0.9986193136833502, 'max_features': None}. Best is trial 603 with value: 0.45955205541891275.
[I 2024-12-04 15:08:22,868] Trial 1295 finished with value: 0.47656645548892607 and parameters: {'n_estimators': 880, 'learning_rate': 0.08235919397608321, 'max_depth': 12, 'min_samples_split': 19, 'min_samples_leaf': 1, 'subsample': 0.9180443920136497, 'max_features': None}. Best is trial 603 with value: 0.45955205541891275.
[I 2024-12-04 15:08:22,960] Trial 1296 finished with value: 0.6462096939907872 and parameters: {'n_estimators': 1116, 'learning_rate': 0.06797092944767742, 'max_depth': 6, 'min_samples_split': 3, 'min_samples_leaf': 4, 'subsample': 0.6013757801518582, 'max_features': 'sqrt'}. Best is trial 603 with value: 0.45955205541891275.
[I 2024-12-04 15:08:23,053] Trial 1321 finished with value: 0.9501074359299785 and parameters: {'n_estimators': 123, 'learning_rate': 0.029178418081568104, 'max_depth': 3, 'min_samples_split': 18, 'min_samples_leaf': 5, 'subsample': 0.8246870025763766, 'max_features': 'sqrt'}. Best is trial 603 with value: 0.45955205541891275.
[I 2024-12-04 15:08:26,746] Trial 1299 finished with value: 0.6967296695274243 and parameters: {'n_estimators': 1118, 'learning_rate': 0.08602358441501776, 'max_depth': 12, 'min_samples_split': 18, 'min_samples_leaf': 3, 'subsample': 0.9242323469010525, 'max_features': 'sqrt'}. Best is trial 603 with value: 0.45955205541891275.
[I 2024-12-04 15:08:27,902] Trial 1306 finished with value: 0.515688380603225 and parameters: {'n_estimators': 833, 'learning_rate': 0.07122467475355825, 'max_depth': 10, 'min_samples_split': 16, 'min_samples_leaf': 1, 'subsample': 0.9370073054448862, 'max_features': None}. Best is trial 603 with value: 0.45955205541891275.
[I 2024-12-04 15:08:27,958] Trial 1307 finished with value: 0.5594592570541657 and parameters: {'n_estimators': 832, 'learning_rate': 0.05740315879170093, 'max_depth': 3, 'min_samples_split': 10, 'min_samples_leaf': 1, 'subsample': 0.7287934055961308, 'max_features': None}. Best is trial 603 with value: 0.45955205541891275.
[I 2024-12-04 15:08:31,709] Trial 1292 finished with value: 0.6144676396455561 and parameters: {'n_estimators': 1493, 'learning_rate': 0.010589551311292434, 'max_depth': 6, 'min_samples_split': 10, 'min_samples_leaf': 4, 'subsample': 0.9955889906013213, 'max_features': None}. Best is trial 603 with value: 0.45955205541891275.
[I 2024-12-04 15:08:31,726] Trial 1302 finished with value: 0.5054494849587279 and parameters: {'n_estimators': 1283, 'learning_rate': 0.029461345887273057, 'max_depth': 11, 'min_samples_split': 14, 'min_samples_leaf': 1, 'subsample': 0.9823674124918442, 'max_features': 'sqrt'}. Best is trial 603 with value: 0.45955205541891275.
[I 2024-12-04 15:08:32,564] Trial 1300 finished with value: 0.7111698925703116 and parameters: {'n_estimators': 1121, 'learning_rate': 0.03833083750398286, 'max_depth': 10, 'min_samples_split': 10, 'min_samples_leaf': 2, 'subsample': 0.9027620137012161, 'max_features': None}. Best is trial 603 with value: 0.45955205541891275.
[I 2024-12-04 15:08:34,400] Trial 1293 finished with value: 0.6106092315872269 and parameters: {'n_estimators': 1393, 'learning_rate': 0.03813930020949589, 'max_depth': 12, 'min_samples_split': 20, 'min_samples_leaf': 2, 'subsample': 0.9275430570785108, 'max_features': None}. Best is trial 603 with value: 0.45955205541891275.
[I 2024-12-04 15:08:35,660] Trial 1328 finished with value: 0.9848214552129525 and parameters: {'n_estimators': 347, 'learning_rate': 0.04189134618847385, 'max_depth': 4, 'min_samples_split': 11, 'min_samples_leaf': 6, 'subsample': 0.7016415089026237, 'max_features': 'log2'}. Best is trial 603 with value: 0.45955205541891275.
[I 2024-12-04 15:08:36,349] Trial 1304 finished with value: 0.6578290222410512 and parameters: {'n_estimators': 1117, 'learning_rate': 0.09019677324669925, 'max_depth': 12, 'min_samples_split': 20, 'min_samples_leaf': 3, 'subsample': 0.9418274739345713, 'max_features': None}. Best is trial 603 with value: 0.45955205541891275.
[I 2024-12-04 15:08:37,114] Trial 1298 finished with value: 0.6403988354428847 and parameters: {'n_estimators': 1252, 'learning_rate': 0.09682670776628172, 'max_depth': 9, 'min_samples_split': 19, 'min_samples_leaf': 3, 'subsample': 0.9926086449959542, 'max_features': None}. Best is trial 603 with value: 0.45955205541891275.
[I 2024-12-04 15:08:40,772] Trial 1308 finished with value: 0.4622925384796704 and parameters: {'n_estimators': 1060, 'learning_rate': 0.0740648511148447, 'max_depth': 12, 'min_samples_split': 20, 'min_samples_leaf': 1, 'subsample': 0.9925019557648195, 'max_features': None}. Best is trial 603 with value: 0.45955205541891275.
[I 2024-12-04 15:08:41,042] Trial 1303 finished with value: 0.49836767969109086 and parameters: {'n_estimators': 1290, 'learning_rate': 0.060470315099933405, 'max_depth': 12, 'min_samples_split': 17, 'min_samples_leaf': 1, 'subsample': 0.9172720139138717, 'max_features': None}. Best is trial 603 with value: 0.45955205541891275.
[I 2024-12-04 15:08:41,894] Trial 1310 finished with value: 0.5059790556232374 and parameters: {'n_estimators': 1094, 'learning_rate': 0.07655793994462157, 'max_depth': 10, 'min_samples_split': 16, 'min_samples_leaf': 1, 'subsample': 0.9424385422142783, 'max_features': None}. Best is trial 603 with value: 0.45955205541891275.
[I 2024-12-04 15:08:42,007] Trial 1339 finished with value: 0.8005889282965566 and parameters: {'n_estimators': 148, 'learning_rate': 0.07176683950838933, 'max_depth': 4, 'min_samples_split': 11, 'min_samples_leaf': 8, 'subsample': 0.815727489584338, 'max_features': 'sqrt'}. Best is trial 603 with value: 0.45955205541891275.
[I 2024-12-04 15:08:44,258] Trial 1333 finished with value: 0.6677455071805057 and parameters: {'n_estimators': 530, 'learning_rate': 0.08281630444865327, 'max_depth': 5, 'min_samples_split': 12, 'min_samples_leaf': 2, 'subsample': 0.9933281170229813, 'max_features': 'log2'}. Best is trial 603 with value: 0.45955205541891275.
[I 2024-12-04 15:08:46,725] Trial 1318 finished with value: 0.637329910175638 and parameters: {'n_estimators': 890, 'learning_rate': 0.09787754272151002, 'max_depth': 12, 'min_samples_split': 18, 'min_samples_leaf': 2, 'subsample': 0.9149470240111676, 'max_features': None}. Best is trial 603 with value: 0.45955205541891275.
[I 2024-12-04 15:08:47,986] Trial 1314 finished with value: 0.5617069442268793 and parameters: {'n_estimators': 1187, 'learning_rate': 0.019360721652703403, 'max_depth': 4, 'min_samples_split': 14, 'min_samples_leaf': 5, 'subsample': 0.8530708033343444, 'max_features': None}. Best is trial 603 with value: 0.45955205541891275.
[I 2024-12-04 15:08:48,402] Trial 1305 finished with value: 0.4637675856160259 and parameters: {'n_estimators': 1452, 'learning_rate': 0.050478898838789366, 'max_depth': 12, 'min_samples_split': 19, 'min_samples_leaf': 1, 'subsample': 0.9955407024855304, 'max_features': None}. Best is trial 603 with value: 0.45955205541891275.
[I 2024-12-04 15:08:49,523] Trial 1312 finished with value: 0.6559205057683566 and parameters: {'n_estimators': 1202, 'learning_rate': 0.0946608479383064, 'max_depth': 12, 'min_samples_split': 16, 'min_samples_leaf': 3, 'subsample': 0.9552439279618239, 'max_features': None}. Best is trial 603 with value: 0.45955205541891275.
[I 2024-12-04 15:08:51,096] Trial 1313 finished with value: 0.6831424471201609 and parameters: {'n_estimators': 1362, 'learning_rate': 0.05026615869560403, 'max_depth': 3, 'min_samples_split': 20, 'min_samples_leaf': 7, 'subsample': 0.8127186324950337, 'max_features': None}. Best is trial 603 with value: 0.45955205541891275.
[I 2024-12-04 15:08:51,926] Trial 1317 finished with value: 0.500615881067678 and parameters: {'n_estimators': 1111, 'learning_rate': 0.0989826811071433, 'max_depth': 10, 'min_samples_split': 16, 'min_samples_leaf': 1, 'subsample': 0.9540443237687132, 'max_features': None}. Best is trial 603 with value: 0.45955205541891275.
[I 2024-12-04 15:08:53,336] Trial 1330 finished with value: 0.5894047558655293 and parameters: {'n_estimators': 1034, 'learning_rate': 0.03310554109830425, 'max_depth': 10, 'min_samples_split': 17, 'min_samples_leaf': 1, 'subsample': 0.9849895575804241, 'max_features': 'log2'}. Best is trial 603 with value: 0.45955205541891275.
[I 2024-12-04 15:08:54,440] Trial 1315 finished with value: 0.47609673423469145 and parameters: {'n_estimators': 1162, 'learning_rate': 0.07316925188191095, 'max_depth': 12, 'min_samples_split': 17, 'min_samples_leaf': 1, 'subsample': 0.9732736338700277, 'max_features': None}. Best is trial 603 with value: 0.45955205541891275.
[I 2024-12-04 15:08:55,558] Trial 1316 finished with value: 0.6409033444851637 and parameters: {'n_estimators': 1206, 'learning_rate': 0.060928069479487805, 'max_depth': 12, 'min_samples_split': 18, 'min_samples_leaf': 3, 'subsample': 0.9967163294398301, 'max_features': None}. Best is trial 603 with value: 0.45955205541891275.
[I 2024-12-04 15:08:56,681] Trial 1309 finished with value: 0.6539258153106647 and parameters: {'n_estimators': 1484, 'learning_rate': 0.062005359557645856, 'max_depth': 12, 'min_samples_split': 17, 'min_samples_leaf': 3, 'subsample': 0.994497969612563, 'max_features': None}. Best is trial 603 with value: 0.45955205541891275.
[I 2024-12-04 15:08:57,232] Trial 1324 finished with value: 0.48439391279178645 and parameters: {'n_estimators': 1029, 'learning_rate': 0.07812583726651937, 'max_depth': 12, 'min_samples_split': 19, 'min_samples_leaf': 1, 'subsample': 0.9287756613655248, 'max_features': None}. Best is trial 603 with value: 0.45955205541891275.
[I 2024-12-04 15:08:59,283] Trial 1319 finished with value: 0.4778572885245825 and parameters: {'n_estimators': 1232, 'learning_rate': 0.06132116879025068, 'max_depth': 12, 'min_samples_split': 20, 'min_samples_leaf': 1, 'subsample': 0.8882177360284572, 'max_features': None}. Best is trial 603 with value: 0.45955205541891275.
[I 2024-12-04 15:09:00,344] Trial 1322 finished with value: 0.4800833618415405 and parameters: {'n_estimators': 1159, 'learning_rate': 0.08701118633838019, 'max_depth': 12, 'min_samples_split': 19, 'min_samples_leaf': 1, 'subsample': 0.9626785465705225, 'max_features': None}. Best is trial 603 with value: 0.45955205541891275.
[I 2024-12-04 15:09:00,416] Trial 1323 finished with value: 0.48109113734794895 and parameters: {'n_estimators': 1169, 'learning_rate': 0.07797172656958469, 'max_depth': 12, 'min_samples_split': 20, 'min_samples_leaf': 1, 'subsample': 0.9529346919912716, 'max_features': None}. Best is trial 603 with value: 0.45955205541891275.
[I 2024-12-04 15:09:02,981] Trial 1325 finished with value: 0.6403009561513243 and parameters: {'n_estimators': 1162, 'learning_rate': 0.07778556328626508, 'max_depth': 12, 'min_samples_split': 15, 'min_samples_leaf': 2, 'subsample': 0.9977218618624764, 'max_features': None}. Best is trial 603 with value: 0.45955205541891275.
[I 2024-12-04 15:09:03,049] Trial 1329 finished with value: 0.6526675682346226 and parameters: {'n_estimators': 1111, 'learning_rate': 0.09501673659427919, 'max_depth': 12, 'min_samples_split': 18, 'min_samples_leaf': 3, 'subsample': 0.9963970505654868, 'max_features': None}. Best is trial 603 with value: 0.45955205541891275.
[I 2024-12-04 15:09:04,620] Trial 1337 finished with value: 0.9654914679020474 and parameters: {'n_estimators': 1009, 'learning_rate': 0.024410401060597803, 'max_depth': 12, 'min_samples_split': 6, 'min_samples_leaf': 10, 'subsample': 0.6417153415761673, 'max_features': 'log2'}. Best is trial 603 with value: 0.45955205541891275.
[I 2024-12-04 15:09:06,202] Trial 1326 finished with value: 0.641286971482012 and parameters: {'n_estimators': 1238, 'learning_rate': 0.0700790383614763, 'max_depth': 12, 'min_samples_split': 19, 'min_samples_leaf': 3, 'subsample': 0.9999744780772859, 'max_features': None}. Best is trial 603 with value: 0.45955205541891275.
[I 2024-12-04 15:09:06,547] Trial 1320 finished with value: 0.4769562960391372 and parameters: {'n_estimators': 1320, 'learning_rate': 0.09694651213071388, 'max_depth': 12, 'min_samples_split': 17, 'min_samples_leaf': 1, 'subsample': 0.9391066832384489, 'max_features': None}. Best is trial 603 with value: 0.45955205541891275.
[I 2024-12-04 15:09:07,084] Trial 1336 finished with value: 0.5279429819199802 and parameters: {'n_estimators': 1098, 'learning_rate': 0.07899768480081809, 'max_depth': 10, 'min_samples_split': 14, 'min_samples_leaf': 1, 'subsample': 0.9869201962305343, 'max_features': 'log2'}. Best is trial 603 with value: 0.45955205541891275.
[I 2024-12-04 15:09:07,951] Trial 1346 finished with value: 0.6843824718074121 and parameters: {'n_estimators': 591, 'learning_rate': 0.010407091255303631, 'max_depth': 3, 'min_samples_split': 13, 'min_samples_leaf': 9, 'subsample': 0.8390991423991236, 'max_features': None}. Best is trial 603 with value: 0.45955205541891275.
[I 2024-12-04 15:09:09,820] Trial 1332 finished with value: 0.6397210440765548 and parameters: {'n_estimators': 1419, 'learning_rate': 0.04770274240991295, 'max_depth': 3, 'min_samples_split': 16, 'min_samples_leaf': 4, 'subsample': 0.8236681383500016, 'max_features': 'sqrt'}. Best is trial 603 with value: 0.45955205541891275.
[I 2024-12-04 15:09:09,837] Trial 1331 finished with value: 0.5545861011524487 and parameters: {'n_estimators': 1467, 'learning_rate': 0.032077379362930515, 'max_depth': 12, 'min_samples_split': 20, 'min_samples_leaf': 1, 'subsample': 0.9856773250028334, 'max_features': 'log2'}. Best is trial 603 with value: 0.45955205541891275.
[I 2024-12-04 15:09:11,018] Trial 1344 finished with value: 0.6877725853939879 and parameters: {'n_estimators': 865, 'learning_rate': 0.05250679894910276, 'max_depth': 11, 'min_samples_split': 10, 'min_samples_leaf': 5, 'subsample': 0.8095132675351084, 'max_features': 'log2'}. Best is trial 603 with value: 0.45955205541891275.
[I 2024-12-04 15:09:11,729] Trial 1335 finished with value: 0.48801030310773463 and parameters: {'n_estimators': 1044, 'learning_rate': 0.09308767265505379, 'max_depth': 12, 'min_samples_split': 18, 'min_samples_leaf': 1, 'subsample': 0.9997594166173821, 'max_features': None}. Best is trial 603 with value: 0.45955205541891275.
[I 2024-12-04 15:09:15,025] Trial 1327 finished with value: 0.519850451302693 and parameters: {'n_estimators': 1478, 'learning_rate': 0.02930983595275433, 'max_depth': 10, 'min_samples_split': 16, 'min_samples_leaf': 1, 'subsample': 0.9024398715272582, 'max_features': None}. Best is trial 603 with value: 0.45955205541891275.
[I 2024-12-04 15:09:15,598] Trial 1350 finished with value: 0.8199115134689378 and parameters: {'n_estimators': 745, 'learning_rate': 0.08587778147972586, 'max_depth': 9, 'min_samples_split': 3, 'min_samples_leaf': 9, 'subsample': 0.8157321468519027, 'max_features': 'sqrt'}. Best is trial 603 with value: 0.45955205541891275.
