[I 2024-12-03 19:26:16,675] Trial 2353 finished with value: 0.537735703230227 and parameters: {'kernel': 'rbf', 'C': 23.661548288149802, 'gamma': 0.22810856881813468, 'epsilon': 0.11122901829285058}. Best is trial 88 with value: 0.3542875001421725.
[I 2024-12-03 19:26:18,711] Trial 2354 finished with value: 0.38812492618000277 and parameters: {'kernel': 'rbf', 'C': 99.19754649650727, 'gamma': 0.06878153115024334, 'epsilon': 0.026323930054005837}. Best is trial 88 with value: 0.3542875001421725.
[I 2024-12-03 19:26:20,086] Trial 2355 finished with value: 269.5172024211172 and parameters: {'kernel': 'sigmoid', 'C': 13.892148660373483, 'gamma': 0.14482457907983404, 'epsilon': 0.053061816826270605}. Best is trial 88 with value: 0.3542875001421725.
[I 2024-12-03 19:26:21,810] Trial 2356 finished with value: 0.40450657412216195 and parameters: {'kernel': 'rbf', 'C': 96.65828853524786, 'gamma': 0.012941668352333164, 'epsilon': 0.0610426995568257}. Best is trial 88 with value: 0.3542875001421725.
[I 2024-12-03 19:26:23,439] Trial 2357 finished with value: 0.43595740379774417 and parameters: {'kernel': 'rbf', 'C': 15.349771005063289, 'gamma': 0.03279688948272994, 'epsilon': 0.024899512134811428}. Best is trial 88 with value: 0.3542875001421725.
[I 2024-12-03 19:26:25,165] Trial 2358 finished with value: 0.36987560554931426 and parameters: {'kernel': 'rbf', 'C': 98.34736506212685, 'gamma': 0.05621736990310364, 'epsilon': 0.07660613731590059}. Best is trial 88 with value: 0.3542875001421725.
[I 2024-12-03 19:26:26,975] Trial 2359 finished with value: 0.3806879639836888 and parameters: {'kernel': 'rbf', 'C': 31.467236702472327, 'gamma': 0.04926422778084774, 'epsilon': 0.050432171649585925}. Best is trial 88 with value: 0.3542875001421725.
[I 2024-12-03 19:26:28,420] Trial 2360 finished with value: 0.36595458075970044 and parameters: {'kernel': 'rbf', 'C': 92.49926981245152, 'gamma': 0.029815239083315778, 'epsilon': 0.11532662333376685}. Best is trial 88 with value: 0.3542875001421725.
[I 2024-12-03 19:26:29,812] Trial 2361 finished with value: 0.3717502860009665 and parameters: {'kernel': 'rbf', 'C': 98.6878303614755, 'gamma': 0.06301440269371773, 'epsilon': 0.12300212309657453}. Best is trial 88 with value: 0.3542875001421725.
[I 2024-12-03 19:26:31,644] Trial 2362 finished with value: 0.5429605799528077 and parameters: {'kernel': 'rbf', 'C': 83.35656676741867, 'gamma': 0.24460439740338064, 'epsilon': 0.06105274221262809}. Best is trial 88 with value: 0.3542875001421725.
[I 2024-12-03 19:26:33,833] Trial 2363 finished with value: 0.4326422102006695 and parameters: {'kernel': 'rbf', 'C': 11.176428318161006, 'gamma': 0.07323619949492259, 'epsilon': 0.07613222992953739}. Best is trial 88 with value: 0.3542875001421725.
[I 2024-12-03 19:26:35,210] Trial 2364 finished with value: 0.4354337197580157 and parameters: {'kernel': 'rbf', 'C': 24.799327251109602, 'gamma': 0.12434613441930151, 'epsilon': 0.10052238016906714}. Best is trial 88 with value: 0.3542875001421725.
[I 2024-12-03 19:26:36,624] Trial 2365 finished with value: 0.41554406941733585 and parameters: {'kernel': 'rbf', 'C': 20.474023070675912, 'gamma': 0.10762118421494891, 'epsilon': 0.07167806753553038}. Best is trial 88 with value: 0.3542875001421725.
[I 2024-12-03 19:26:38,108] Trial 2366 finished with value: 0.45719672676543116 and parameters: {'kernel': 'rbf', 'C': 25.280727051058783, 'gamma': 0.15060070781479884, 'epsilon': 0.042264054155509836}. Best is trial 88 with value: 0.3542875001421725.
[I 2024-12-03 19:26:39,377] Trial 2367 finished with value: 0.4535639220466779 and parameters: {'kernel': 'rbf', 'C': 4.234620435632305, 'gamma': 0.020740807315813348, 'epsilon': 0.11699473696322314}. Best is trial 88 with value: 0.3542875001421725.
[I 2024-12-03 19:26:40,540] Trial 2368 finished with value: 0.4390188005044936 and parameters: {'kernel': 'rbf', 'C': 95.61575870904913, 'gamma': 0.009942297654639373, 'epsilon': 0.5102632057203743}. Best is trial 88 with value: 0.3542875001421725.
[I 2024-12-03 19:26:41,125] Trial 2330 finished with value: 2.378466709963236 and parameters: {'kernel': 'poly', 'C': 0.06832214155685527, 'gamma': 0.7415192993078404, 'epsilon': 0.5008623324658356}. Best is trial 88 with value: 0.3542875001421725.
[I 2024-12-03 19:26:42,246] Trial 2369 finished with value: 0.36204979838573514 and parameters: {'kernel': 'rbf', 'C': 97.5420646206894, 'gamma': 0.05210893433954283, 'epsilon': 0.10797457627123606}. Best is trial 88 with value: 0.3542875001421725.
[I 2024-12-03 19:26:43,262] Trial 2370 finished with value: 0.3700989753471503 and parameters: {'kernel': 'rbf', 'C': 96.30392788531113, 'gamma': 0.020854069190846054, 'epsilon': 0.0942391141119299}. Best is trial 88 with value: 0.3542875001421725.
[I 2024-12-03 19:26:44,158] Trial 2371 finished with value: 248.78748316813622 and parameters: {'kernel': 'sigmoid', 'C': 11.552680824534558, 'gamma': 0.04988150928409294, 'epsilon': 0.2536237104882448}. Best is trial 88 with value: 0.3542875001421725.
[I 2024-12-03 19:26:45,150] Trial 2372 finished with value: 0.378959869090204 and parameters: {'kernel': 'rbf', 'C': 98.0259153635645, 'gamma': 0.0694656089899861, 'epsilon': 0.0861209403323107}. Best is trial 88 with value: 0.3542875001421725.
[I 2024-12-03 19:26:46,053] Trial 2373 finished with value: 0.3682237572824597 and parameters: {'kernel': 'rbf', 'C': 95.8914151394859, 'gamma': 0.022714645577406344, 'epsilon': 0.14435500992923664}. Best is trial 88 with value: 0.3542875001421725.
[I 2024-12-03 19:26:47,072] Trial 2374 finished with value: 0.42327048827703806 and parameters: {'kernel': 'rbf', 'C': 23.344625736259434, 'gamma': 0.01611713364347971, 'epsilon': 0.03155752858116888}. Best is trial 88 with value: 0.3542875001421725.
[I 2024-12-03 19:26:47,702] Trial 2375 finished with value: 0.4055482972270012 and parameters: {'kernel': 'rbf', 'C': 97.6911203024574, 'gamma': 0.08812882123297285, 'epsilon': 0.22087958015539585}. Best is trial 88 with value: 0.3542875001421725.
[I 2024-12-03 19:26:48,767] Trial 2376 finished with value: 0.8409007881362716 and parameters: {'kernel': 'linear', 'C': 0.020037794161190954, 'gamma': 0.783895158818416, 'epsilon': 0.13592231884598985}. Best is trial 88 with value: 0.3542875001421725.
[I 2024-12-03 19:26:49,684] Trial 2377 finished with value: 0.3963206218927633 and parameters: {'kernel': 'rbf', 'C': 19.20447025066654, 'gamma': 0.05914366207420533, 'epsilon': 0.1320296615587809}. Best is trial 88 with value: 0.3542875001421725.
[I 2024-12-03 19:26:50,718] Trial 2378 finished with value: 0.5305605636014374 and parameters: {'kernel': 'rbf', 'C': 0.96664660378845, 'gamma': 0.058253848451883174, 'epsilon': 0.004276271293872578}. Best is trial 88 with value: 0.3542875001421725.
[I 2024-12-03 19:26:51,347] Trial 2379 finished with value: 0.42729514257911066 and parameters: {'kernel': 'rbf', 'C': 93.61038370030221, 'gamma': 0.11680176412376476, 'epsilon': 0.15667115182837973}. Best is trial 88 with value: 0.3542875001421725.
[I 2024-12-03 19:26:52,466] Trial 2380 finished with value: 1.0722118408787276 and parameters: {'kernel': 'sigmoid', 'C': 0.0016527915099007278, 'gamma': 0.0004361509792391071, 'epsilon': 0.05000525108586781}. Best is trial 88 with value: 0.3542875001421725.
[I 2024-12-03 19:26:53,949] Trial 2381 finished with value: 0.44957705444470947 and parameters: {'kernel': 'rbf', 'C': 99.27278171626216, 'gamma': 0.15109147396660805, 'epsilon': 0.04875650688949412}. Best is trial 88 with value: 0.3542875001421725.
[I 2024-12-03 19:26:54,871] Trial 2382 finished with value: 0.3906025005470731 and parameters: {'kernel': 'rbf', 'C': 19.036970243125467, 'gamma': 0.00980097300694126, 'epsilon': 0.08138138174756548}. Best is trial 88 with value: 0.3542875001421725.
[I 2024-12-03 19:26:56,126] Trial 2383 finished with value: 0.41438831101291435 and parameters: {'kernel': 'rbf', 'C': 30.16876345888913, 'gamma': 0.029328474588985246, 'epsilon': 0.03056514773557432}. Best is trial 88 with value: 0.3542875001421725.
[I 2024-12-03 19:26:59,155] Trial 2385 finished with value: 0.37078539813566824 and parameters: {'kernel': 'rbf', 'C': 98.24131824312988, 'gamma': 0.04262607364386127, 'epsilon': 0.019771285565483333}. Best is trial 88 with value: 0.3542875001421725.
[I 2024-12-03 19:27:00,533] Trial 2386 finished with value: 0.5807895087723837 and parameters: {'kernel': 'rbf', 'C': 98.0297623427107, 'gamma': 0.2692341462856456, 'epsilon': 0.17636916086161225}. Best is trial 88 with value: 0.3542875001421725.
[I 2024-12-03 19:27:15,874] Trial 2342 finished with value: 0.8001234507971242 and parameters: {'kernel': 'linear', 'C': 73.54333439500255, 'gamma': 0.031761323303978906, 'epsilon': 0.0733168069488397}. Best is trial 88 with value: 0.3542875001421725.
[I 2024-12-03 19:27:17,176] Trial 2388 finished with value: 0.3729743205723735 and parameters: {'kernel': 'rbf', 'C': 98.99462796836472, 'gamma': 0.05479340162614639, 'epsilon': 0.2469218141947365}. Best is trial 88 with value: 0.3542875001421725.
[I 2024-12-03 19:27:18,717] Trial 2389 finished with value: 0.42192015541457184 and parameters: {'kernel': 'rbf', 'C': 15.93327591966335, 'gamma': 0.05001484662363555, 'epsilon': 0.0425922852594732}. Best is trial 88 with value: 0.3542875001421725.
[I 2024-12-03 19:27:20,012] Trial 2390 finished with value: 0.39606077245131005 and parameters: {'kernel': 'rbf', 'C': 19.258317848065374, 'gamma': 0.061101295941520924, 'epsilon': 0.1334221289988054}. Best is trial 88 with value: 0.3542875001421725.
[I 2024-12-03 19:27:21,474] Trial 2391 finished with value: 0.4218290267069874 and parameters: {'kernel': 'rbf', 'C': 27.00657301954722, 'gamma': 0.016892618595013197, 'epsilon': 0.07154752769095422}. Best is trial 88 with value: 0.3542875001421725.
[I 2024-12-03 19:28:16,475] Trial 2312 finished with value: 2.016089711466985 and parameters: {'kernel': 'poly', 'C': 18.37950858032394, 'gamma': 0.05230659958419088, 'epsilon': 0.1142426696974486}. Best is trial 88 with value: 0.3542875001421725.
[I 2024-12-03 19:28:18,326] Trial 2393 finished with value: 0.5830907988634714 and parameters: {'kernel': 'rbf', 'C': 71.57142343109514, 'gamma': 0.00018903269744950316, 'epsilon': 0.0023686505223674058}. Best is trial 88 with value: 0.3542875001421725.
[I 2024-12-03 19:28:21,108] Trial 2394 finished with value: 0.40663354765047993 and parameters: {'kernel': 'rbf', 'C': 99.15746846777888, 'gamma': 0.012674167745804812, 'epsilon': 0.018892764360449857}. Best is trial 88 with value: 0.3542875001421725.
[I 2024-12-03 19:28:22,565] Trial 2395 finished with value: 0.46043310960051687 and parameters: {'kernel': 'rbf', 'C': 98.98779473995006, 'gamma': 0.1478367785955361, 'epsilon': 0.13082207207384816}. Best is trial 88 with value: 0.3542875001421725.
[I 2024-12-03 19:28:24,280] Trial 2396 finished with value: 0.4251393329090616 and parameters: {'kernel': 'rbf', 'C': 95.19972751840767, 'gamma': 0.008492339169424627, 'epsilon': 0.10164423825018545}. Best is trial 88 with value: 0.3542875001421725.
[I 2024-12-03 19:29:51,219] Trial 2397 finished with value: 0.7954082838899348 and parameters: {'kernel': 'linear', 'C': 61.99317652592831, 'gamma': 0.7401542573752284, 'epsilon': 0.0016416830512461745}. Best is trial 88 with value: 0.3542875001421725.
[I 2024-12-03 19:29:53,411] Trial 2398 finished with value: 0.38050709279874967 and parameters: {'kernel': 'rbf', 'C': 97.14958960666254, 'gamma': 0.0653036690714564, 'epsilon': 0.041674578861071496}. Best is trial 88 with value: 0.3542875001421725.
[I 2024-12-03 19:29:54,553] Trial 2387 finished with value: 0.8050370013988524 and parameters: {'kernel': 'linear', 'C': 98.88444664525198, 'gamma': 0.023344332577147985, 'epsilon': 0.03841108299823792}. Best is trial 88 with value: 0.3542875001421725.
[I 2024-12-03 19:29:54,977] Trial 2399 finished with value: 0.4482188891548074 and parameters: {'kernel': 'rbf', 'C': 4.454652612853962, 'gamma': 0.020881693944451114, 'epsilon': 0.0760174984985075}. Best is trial 88 with value: 0.3542875001421725.
[I 2024-12-03 19:29:56,085] Trial 2400 finished with value: 0.47110980268118735 and parameters: {'kernel': 'rbf', 'C': 5.1570361769209665, 'gamma': 0.07333475792971555, 'epsilon': 0.23797525520759877}. Best is trial 88 with value: 0.3542875001421725.
[I 2024-12-03 19:29:56,683] Trial 2401 finished with value: 0.411846718160088 and parameters: {'kernel': 'rbf', 'C': 29.390087988939438, 'gamma': 0.01455611484287706, 'epsilon': 0.232938947141845}. Best is trial 88 with value: 0.3542875001421725.
[I 2024-12-03 19:29:57,982] Trial 2403 finished with value: 0.5945674074067014 and parameters: {'kernel': 'rbf', 'C': 3.6353796537190104, 'gamma': 0.1894048038983252, 'epsilon': 0.41329173773322286}. Best is trial 88 with value: 0.3542875001421725.
[I 2024-12-03 19:29:59,433] Trial 2404 finished with value: 0.5875387385096378 and parameters: {'kernel': 'rbf', 'C': 96.31591749659422, 'gamma': 0.3149955501867622, 'epsilon': 0.050429683542485164}. Best is trial 88 with value: 0.3542875001421725.
[I 2024-12-03 19:30:01,120] Trial 2405 finished with value: 0.4020707840580378 and parameters: {'kernel': 'rbf', 'C': 92.90175385546837, 'gamma': 0.004878413594639484, 'epsilon': 0.06670952709390718}. Best is trial 88 with value: 0.3542875001421725.
[I 2024-12-03 19:30:13,457] Trial 2402 finished with value: 0.7716896335351819 and parameters: {'kernel': 'linear', 'C': 26.021881710262974, 'gamma': 0.14970071753904787, 'epsilon': 0.1481266873586714}. Best is trial 88 with value: 0.3542875001421725.
[I 2024-12-03 19:30:14,812] Trial 2407 finished with value: 0.39495454689389503 and parameters: {'kernel': 'rbf', 'C': 21.732198005165277, 'gamma': 0.04996292281947193, 'epsilon': 0.10167603222421802}. Best is trial 88 with value: 0.3542875001421725.
[I 2024-12-03 19:30:16,396] Trial 2408 finished with value: 0.904996540326712 and parameters: {'kernel': 'sigmoid', 'C': 0.5079592359203838, 'gamma': 0.0002009496948354005, 'epsilon': 0.009047043240593742}. Best is trial 88 with value: 0.3542875001421725.
[I 2024-12-03 19:30:18,323] Trial 2409 finished with value: 0.42214814965546393 and parameters: {'kernel': 'rbf', 'C': 23.876305467002794, 'gamma': 0.11479480611615399, 'epsilon': 0.08568717057670414}. Best is trial 88 with value: 0.3542875001421725.
[I 2024-12-03 19:30:19,646] Trial 2410 finished with value: 1.233601117479537 and parameters: {'kernel': 'poly', 'C': 97.77518532044084, 'gamma': 0.0008215012598683083, 'epsilon': 0.028893244938576146}. Best is trial 88 with value: 0.3542875001421725.
[I 2024-12-03 19:32:00,037] Trial 2411 finished with value: 0.8020610725255098 and parameters: {'kernel': 'linear', 'C': 95.27808608521141, 'gamma': 0.09725616944542403, 'epsilon': 0.027616767132386432}. Best is trial 88 with value: 0.3542875001421725.
[I 2024-12-03 19:32:01,230] Trial 2412 finished with value: 0.3947724702635058 and parameters: {'kernel': 'rbf', 'C': 22.057675010760608, 'gamma': 0.04775372578438434, 'epsilon': 0.2512908135029369}. Best is trial 88 with value: 0.3542875001421725.
[I 2024-12-03 19:32:02,667] Trial 2413 finished with value: 0.4211488909354682 and parameters: {'kernel': 'rbf', 'C': 19.187734069298074, 'gamma': 0.027931860190128648, 'epsilon': 0.083546300399974}. Best is trial 88 with value: 0.3542875001421725.
[I 2024-12-03 19:32:04,065] Trial 2414 finished with value: 1166.9080868348312 and parameters: {'kernel': 'sigmoid', 'C': 57.001449576822175, 'gamma': 0.08312449962711514, 'epsilon': 0.02912695891248776}. Best is trial 88 with value: 0.3542875001421725.
[I 2024-12-03 19:32:05,253] Trial 2415 finished with value: 0.511176306904527 and parameters: {'kernel': 'rbf', 'C': 95.51029243296921, 'gamma': 0.1288901245326012, 'epsilon': 0.3541969825797366}. Best is trial 88 with value: 0.3542875001421725.
[I 2024-12-03 19:32:06,850] Trial 2416 finished with value: 0.42299876448167806 and parameters: {'kernel': 'rbf', 'C': 22.380902353610697, 'gamma': 0.02850041094201772, 'epsilon': 0.054845280529053894}. Best is trial 88 with value: 0.3542875001421725.
[I 2024-12-03 19:32:08,298] Trial 2417 finished with value: 1848.4257793987074 and parameters: {'kernel': 'sigmoid', 'C': 96.20027994775775, 'gamma': 0.03125052623258474, 'epsilon': 0.09822544410230236}. Best is trial 88 with value: 0.3542875001421725.
[I 2024-12-03 19:32:09,678] Trial 2418 finished with value: 0.6284129555582064 and parameters: {'kernel': 'rbf', 'C': 7.926128624826444, 'gamma': 0.37997267550053404, 'epsilon': 0.10043308594876568}. Best is trial 88 with value: 0.3542875001421725.
[I 2024-12-03 19:32:11,374] Trial 2419 finished with value: 1.060092120392808 and parameters: {'kernel': 'rbf', 'C': 0.004408280637078161, 'gamma': 0.0006146940234935769, 'epsilon': 0.008438303735584525}. Best is trial 88 with value: 0.3542875001421725.
[I 2024-12-03 19:32:12,536] Trial 2420 finished with value: 0.8490081367525992 and parameters: {'kernel': 'rbf', 'C': 19.678604544861965, 'gamma': 0.6810266411398149, 'epsilon': 0.5967411302393467}. Best is trial 88 with value: 0.3542875001421725.
[I 2024-12-03 19:32:14,404] Trial 2421 finished with value: 0.366608370128971 and parameters: {'kernel': 'rbf', 'C': 97.14299337495059, 'gamma': 0.024878561344859627, 'epsilon': 0.07156482580173305}. Best is trial 88 with value: 0.3542875001421725.
[I 2024-12-03 19:32:15,766] Trial 2422 finished with value: 0.38686980325892784 and parameters: {'kernel': 'rbf', 'C': 23.850383246520664, 'gamma': 0.05428850304918409, 'epsilon': 0.12415054174682975}. Best is trial 88 with value: 0.3542875001421725.
[I 2024-12-03 19:32:17,270] Trial 2423 finished with value: 1.0024826491782688 and parameters: {'kernel': 'sigmoid', 'C': 0.0037383139485910348, 'gamma': 0.028794633485461598, 'epsilon': 0.001790421836484922}. Best is trial 88 with value: 0.3542875001421725.
[I 2024-12-03 19:32:18,570] Trial 2424 finished with value: 0.3965302392231632 and parameters: {'kernel': 'rbf', 'C': 95.77773956450304, 'gamma': 0.010612762531390428, 'epsilon': 0.21755088935146738}. Best is trial 88 with value: 0.3542875001421725.
[I 2024-12-03 19:32:21,105] Trial 2425 finished with value: 0.4100472164986447 and parameters: {'kernel': 'rbf', 'C': 99.37699560035217, 'gamma': 0.01198398141639748, 'epsilon': 0.025232015821311092}. Best is trial 88 with value: 0.3542875001421725.
[I 2024-12-03 19:32:22,387] Trial 2426 finished with value: 0.5099386917630907 and parameters: {'kernel': 'rbf', 'C': 97.00408330489766, 'gamma': 0.18767875274843773, 'epsilon': 0.15331725450683886}. Best is trial 88 with value: 0.3542875001421725.
[I 2024-12-03 19:32:23,678] Trial 2427 finished with value: 0.3578795052127758 and parameters: {'kernel': 'rbf', 'C': 99.91863482342151, 'gamma': 0.04368505693808913, 'epsilon': 0.2017328532470823}. Best is trial 88 with value: 0.3542875001421725.
[I 2024-12-03 19:32:42,346] Trial 2428 finished with value: 0.8043951240766554 and parameters: {'kernel': 'linear', 'C': 22.770096339106612, 'gamma': 0.008355556359189317, 'epsilon': 0.06845408840709838}. Best is trial 88 with value: 0.3542875001421725.
[I 2024-12-03 19:32:43,424] Trial 2429 finished with value: 0.49496680552302097 and parameters: {'kernel': 'rbf', 'C': 25.069098227548494, 'gamma': 0.057714563789369254, 'epsilon': 0.567246690168366}. Best is trial 88 with value: 0.3542875001421725.
[I 2024-12-03 19:32:44,567] Trial 2430 finished with value: 0.4071763169656223 and parameters: {'kernel': 'rbf', 'C': 27.94513393503753, 'gamma': 0.01537956657249068, 'epsilon': 0.3162653775287819}. Best is trial 88 with value: 0.3542875001421725.
[I 2024-12-03 19:32:45,865] Trial 2431 finished with value: 0.4178099798010506 and parameters: {'kernel': 'rbf', 'C': 95.12319882160196, 'gamma': 0.0010315166625355075, 'epsilon': 0.13298293714633597}. Best is trial 88 with value: 0.3542875001421725.
[I 2024-12-03 19:32:47,487] Trial 2432 finished with value: 0.36739396750532344 and parameters: {'kernel': 'rbf', 'C': 95.41959206332483, 'gamma': 0.02612986065580195, 'epsilon': 0.079666247949487}. Best is trial 88 with value: 0.3542875001421725.
[I 2024-12-03 19:32:48,817] Trial 2433 finished with value: 0.9094915131758514 and parameters: {'kernel': 'sigmoid', 'C': 6.659395807153016, 'gamma': 0.00010606841742788317, 'epsilon': 0.001814803924422551}. Best is trial 88 with value: 0.3542875001421725.
[I 2024-12-03 19:32:50,143] Trial 2434 finished with value: 0.40773918208087373 and parameters: {'kernel': 'rbf', 'C': 16.135720425232996, 'gamma': 0.06532649930900337, 'epsilon': 0.10096212150099762}. Best is trial 88 with value: 0.3542875001421725.
[I 2024-12-03 19:32:51,300] Trial 2435 finished with value: 0.4889054271741364 and parameters: {'kernel': 'rbf', 'C': 12.353519318866349, 'gamma': 0.001976222089917245, 'epsilon': 0.24008520106288747}. Best is trial 88 with value: 0.3542875001421725.
[I 2024-12-03 19:32:53,097] Trial 2436 finished with value: 0.42073076212675753 and parameters: {'kernel': 'rbf', 'C': 28.775269953200464, 'gamma': 0.014552245867382152, 'epsilon': 0.17518591326759927}. Best is trial 88 with value: 0.3542875001421725.
[I 2024-12-03 19:32:54,362] Trial 2437 finished with value: 0.487403531482002 and parameters: {'kernel': 'rbf', 'C': 22.44013551506914, 'gamma': 0.1513986286862437, 'epsilon': 0.20294631033098154}. Best is trial 88 with value: 0.3542875001421725.
[I 2024-12-03 19:32:55,708] Trial 2438 finished with value: 0.47022704609187715 and parameters: {'kernel': 'rbf', 'C': 30.996635143255897, 'gamma': 0.16596165289868223, 'epsilon': 0.07505475283551563}. Best is trial 88 with value: 0.3542875001421725.
[I 2024-12-03 19:32:57,168] Trial 2439 finished with value: 0.39627049835326206 and parameters: {'kernel': 'rbf', 'C': 88.80916784878751, 'gamma': 0.0995879938193995, 'epsilon': 0.07796617636797985}. Best is trial 88 with value: 0.3542875001421725.
