[I 2024-12-04 13:31:48,375] Trial 2015 finished with value: 0.361422068015251 and parameters: {'n_estimators': 413, 'learning_rate': 0.012553534359291857, 'max_depth': 9, 'min_samples_split': 2, 'min_samples_leaf': 5, 'subsample': 0.9503669374287993, 'max_features': None}. Best is trial 1137 with value: 0.19687116000636118.
[I 2024-12-04 13:31:48,693] Trial 2006 finished with value: 0.3194429966950312 and parameters: {'n_estimators': 792, 'learning_rate': 0.012347653847181287, 'max_depth': 10, 'min_samples_split': 10, 'min_samples_leaf': 2, 'subsample': 0.7497827619692068, 'max_features': 'sqrt'}. Best is trial 1137 with value: 0.19687116000636118.
[I 2024-12-04 13:31:52,714] Trial 2001 finished with value: 0.3589953593990657 and parameters: {'n_estimators': 918, 'learning_rate': 0.09449837295490657, 'max_depth': 9, 'min_samples_split': 13, 'min_samples_leaf': 9, 'subsample': 0.9554034942523787, 'max_features': None}. Best is trial 1137 with value: 0.19687116000636118.
[I 2024-12-04 13:31:56,129] Trial 1989 finished with value: 0.25617013419215245 and parameters: {'n_estimators': 1487, 'learning_rate': 0.06311073384850537, 'max_depth': 9, 'min_samples_split': 19, 'min_samples_leaf': 1, 'subsample': 0.6052218768011683, 'max_features': 'log2'}. Best is trial 1137 with value: 0.19687116000636118.
[I 2024-12-04 13:31:58,917] Trial 1996 finished with value: 0.23165816616556084 and parameters: {'n_estimators': 1348, 'learning_rate': 0.06285693397114989, 'max_depth': 9, 'min_samples_split': 20, 'min_samples_leaf': 1, 'subsample': 0.6148547979953902, 'max_features': 'sqrt'}. Best is trial 1137 with value: 0.19687116000636118.
[I 2024-12-04 13:32:01,219] Trial 1997 finished with value: 0.22769998021469356 and parameters: {'n_estimators': 1360, 'learning_rate': 0.0656533944197367, 'max_depth': 12, 'min_samples_split': 15, 'min_samples_leaf': 1, 'subsample': 0.6044422938839392, 'max_features': 'sqrt'}. Best is trial 1137 with value: 0.19687116000636118.
[I 2024-12-04 13:32:01,339] Trial 1995 finished with value: 0.230919888960305 and parameters: {'n_estimators': 1439, 'learning_rate': 0.08888338857172054, 'max_depth': 9, 'min_samples_split': 20, 'min_samples_leaf': 1, 'subsample': 0.7092768838962357, 'max_features': 'sqrt'}. Best is trial 1137 with value: 0.19687116000636118.
[I 2024-12-04 13:32:03,307] Trial 2003 finished with value: 0.2610302363131487 and parameters: {'n_estimators': 1235, 'learning_rate': 0.0655508447930871, 'max_depth': 11, 'min_samples_split': 16, 'min_samples_leaf': 3, 'subsample': 0.6516233339185391, 'max_features': 'sqrt'}. Best is trial 1137 with value: 0.19687116000636118.
[I 2024-12-04 13:32:03,612] Trial 1994 finished with value: 0.2116824961916934 and parameters: {'n_estimators': 1497, 'learning_rate': 0.07170639780134722, 'max_depth': 12, 'min_samples_split': 20, 'min_samples_leaf': 1, 'subsample': 0.6105496759785021, 'max_features': 'sqrt'}. Best is trial 1137 with value: 0.19687116000636118.
[I 2024-12-04 13:32:08,656] Trial 2004 finished with value: 0.23576044750855651 and parameters: {'n_estimators': 1254, 'learning_rate': 0.09910801488091472, 'max_depth': 12, 'min_samples_split': 14, 'min_samples_leaf': 1, 'subsample': 0.6810667444296229, 'max_features': 'sqrt'}. Best is trial 1137 with value: 0.19687116000636118.
[I 2024-12-04 13:32:11,746] Trial 2007 finished with value: 0.2608798122112854 and parameters: {'n_estimators': 1118, 'learning_rate': 0.09796286859085855, 'max_depth': 9, 'min_samples_split': 17, 'min_samples_leaf': 3, 'subsample': 0.6102600755508872, 'max_features': 'sqrt'}. Best is trial 1137 with value: 0.19687116000636118.
[I 2024-12-04 13:32:12,770] Trial 1999 finished with value: 0.2246726403562541 and parameters: {'n_estimators': 1456, 'learning_rate': 0.05877732045435111, 'max_depth': 12, 'min_samples_split': 16, 'min_samples_leaf': 1, 'subsample': 0.7077617983026778, 'max_features': 'sqrt'}. Best is trial 1137 with value: 0.19687116000636118.
[I 2024-12-04 13:32:14,195] Trial 2020 finished with value: 0.3398248796912067 and parameters: {'n_estimators': 611, 'learning_rate': 0.02687117754911956, 'max_depth': 12, 'min_samples_split': 12, 'min_samples_leaf': 5, 'subsample': 0.6090628905037028, 'max_features': 'sqrt'}. Best is trial 1137 with value: 0.19687116000636118.
[I 2024-12-04 13:32:14,444] Trial 2000 finished with value: 0.25580491034018477 and parameters: {'n_estimators': 1463, 'learning_rate': 0.09868107728218883, 'max_depth': 8, 'min_samples_split': 17, 'min_samples_leaf': 3, 'subsample': 0.6636612083269413, 'max_features': 'sqrt'}. Best is trial 1137 with value: 0.19687116000636118.
[I 2024-12-04 13:32:16,491] Trial 2002 finished with value: 0.24502714461456626 and parameters: {'n_estimators': 1448, 'learning_rate': 0.09852290279854814, 'max_depth': 8, 'min_samples_split': 20, 'min_samples_leaf': 2, 'subsample': 0.6112104543440123, 'max_features': 'sqrt'}. Best is trial 1137 with value: 0.19687116000636118.
[I 2024-12-04 13:32:18,268] Trial 2005 finished with value: 0.45941070553610724 and parameters: {'n_estimators': 1348, 'learning_rate': 0.010629579327991107, 'max_depth': 9, 'min_samples_split': 13, 'min_samples_leaf': 3, 'subsample': 0.6030746027835368, 'max_features': 'log2'}. Best is trial 1137 with value: 0.19687116000636118.
[I 2024-12-04 13:32:25,067] Trial 2018 finished with value: 0.3209687854028107 and parameters: {'n_estimators': 885, 'learning_rate': 0.0946519848943734, 'max_depth': 9, 'min_samples_split': 13, 'min_samples_leaf': 6, 'subsample': 0.9937494863823719, 'max_features': 'sqrt'}. Best is trial 1137 with value: 0.19687116000636118.
[I 2024-12-04 13:32:26,951] Trial 2017 finished with value: 0.3634410620147348 and parameters: {'n_estimators': 990, 'learning_rate': 0.0812722864102398, 'max_depth': 9, 'min_samples_split': 2, 'min_samples_leaf': 7, 'subsample': 0.999832602209625, 'max_features': 'log2'}. Best is trial 1137 with value: 0.19687116000636118.
[I 2024-12-04 13:32:30,437] Trial 2013 finished with value: 0.2210658574075306 and parameters: {'n_estimators': 1203, 'learning_rate': 0.07278383720942364, 'max_depth': 12, 'min_samples_split': 20, 'min_samples_leaf': 1, 'subsample': 0.6815641827155428, 'max_features': 'sqrt'}. Best is trial 1137 with value: 0.19687116000636118.
[I 2024-12-04 13:32:30,989] Trial 2008 finished with value: 0.3702585488196989 and parameters: {'n_estimators': 1203, 'learning_rate': 0.0966853463202767, 'max_depth': 12, 'min_samples_split': 17, 'min_samples_leaf': 9, 'subsample': 0.8147990320962178, 'max_features': None}. Best is trial 1137 with value: 0.19687116000636118.
[I 2024-12-04 13:32:34,728] Trial 2014 finished with value: 0.24263548100573262 and parameters: {'n_estimators': 1234, 'learning_rate': 0.09848652690541468, 'max_depth': 12, 'min_samples_split': 17, 'min_samples_leaf': 2, 'subsample': 0.634268645325364, 'max_features': 'sqrt'}. Best is trial 1137 with value: 0.19687116000636118.
[I 2024-12-04 13:32:37,136] Trial 2009 finished with value: 0.24933937588617677 and parameters: {'n_estimators': 1452, 'learning_rate': 0.05924625428354135, 'max_depth': 10, 'min_samples_split': 16, 'min_samples_leaf': 3, 'subsample': 0.6770679827734514, 'max_features': 'sqrt'}. Best is trial 1137 with value: 0.19687116000636118.
[I 2024-12-04 13:32:39,101] Trial 2016 finished with value: 0.2156359976038224 and parameters: {'n_estimators': 1247, 'learning_rate': 0.09538273419586413, 'max_depth': 12, 'min_samples_split': 19, 'min_samples_leaf': 1, 'subsample': 0.7485170981146303, 'max_features': 'sqrt'}. Best is trial 1137 with value: 0.19687116000636118.
[I 2024-12-04 13:32:41,763] Trial 2037 finished with value: 0.7896797665491758 and parameters: {'n_estimators': 346, 'learning_rate': 0.014691588522424725, 'max_depth': 3, 'min_samples_split': 11, 'min_samples_leaf': 6, 'subsample': 0.9697177185000856, 'max_features': 'log2'}. Best is trial 1137 with value: 0.19687116000636118.
[I 2024-12-04 13:32:45,257] Trial 2011 finished with value: 0.24237503302264982 and parameters: {'n_estimators': 1497, 'learning_rate': 0.09624545587575108, 'max_depth': 11, 'min_samples_split': 17, 'min_samples_leaf': 2, 'subsample': 0.6171688561836285, 'max_features': 'sqrt'}. Best is trial 1137 with value: 0.19687116000636118.
[I 2024-12-04 13:32:46,393] Trial 2010 finished with value: 0.21952556509501467 and parameters: {'n_estimators': 1489, 'learning_rate': 0.08873572595068652, 'max_depth': 12, 'min_samples_split': 18, 'min_samples_leaf': 1, 'subsample': 0.6094334681826289, 'max_features': 'sqrt'}. Best is trial 1137 with value: 0.19687116000636118.
[I 2024-12-04 13:32:46,397] Trial 2043 finished with value: 0.6372844172317499 and parameters: {'n_estimators': 223, 'learning_rate': 0.01245761651429699, 'max_depth': 5, 'min_samples_split': 10, 'min_samples_leaf': 5, 'subsample': 0.9179288139604729, 'max_features': 'sqrt'}. Best is trial 1137 with value: 0.19687116000636118.
[I 2024-12-04 13:32:54,337] Trial 2023 finished with value: 0.24634574410718713 and parameters: {'n_estimators': 1081, 'learning_rate': 0.09889805659869455, 'max_depth': 7, 'min_samples_split': 19, 'min_samples_leaf': 1, 'subsample': 0.6009324218571033, 'max_features': 'sqrt'}. Best is trial 1137 with value: 0.19687116000636118.
[I 2024-12-04 13:32:56,851] Trial 2012 finished with value: 0.25349799816843166 and parameters: {'n_estimators': 1467, 'learning_rate': 0.07399200846198105, 'max_depth': 11, 'min_samples_split': 18, 'min_samples_leaf': 1, 'subsample': 0.6521193110194293, 'max_features': None}. Best is trial 1137 with value: 0.19687116000636118.
[I 2024-12-04 13:32:58,393] Trial 2019 finished with value: 0.2106314431810397 and parameters: {'n_estimators': 1373, 'learning_rate': 0.097883674070469, 'max_depth': 9, 'min_samples_split': 14, 'min_samples_leaf': 1, 'subsample': 0.6092688787043903, 'max_features': 'sqrt'}. Best is trial 1137 with value: 0.19687116000636118.
[I 2024-12-04 13:32:59,680] Trial 2025 finished with value: 0.2195632653800247 and parameters: {'n_estimators': 1049, 'learning_rate': 0.09790205451556028, 'max_depth': 11, 'min_samples_split': 16, 'min_samples_leaf': 1, 'subsample': 0.6558672530817216, 'max_features': 'sqrt'}. Best is trial 1137 with value: 0.19687116000636118.
[I 2024-12-04 13:33:04,667] Trial 2022 finished with value: 0.23152534100053848 and parameters: {'n_estimators': 1379, 'learning_rate': 0.09434045674972705, 'max_depth': 12, 'min_samples_split': 15, 'min_samples_leaf': 1, 'subsample': 0.6019684518200537, 'max_features': 'sqrt'}. Best is trial 1137 with value: 0.19687116000636118.
[I 2024-12-04 13:33:07,985] Trial 2026 finished with value: 0.3817483525885143 and parameters: {'n_estimators': 1169, 'learning_rate': 0.0956261389502853, 'max_depth': 12, 'min_samples_split': 2, 'min_samples_leaf': 7, 'subsample': 0.7430214088202354, 'max_features': 'log2'}. Best is trial 1137 with value: 0.19687116000636118.
[I 2024-12-04 13:33:10,712] Trial 2021 finished with value: 0.2079033990279541 and parameters: {'n_estimators': 1500, 'learning_rate': 0.06243601059812279, 'max_depth': 11, 'min_samples_split': 18, 'min_samples_leaf': 1, 'subsample': 0.60240318013071, 'max_features': 'sqrt'}. Best is trial 1137 with value: 0.19687116000636118.
[I 2024-12-04 13:33:13,827] Trial 2027 finished with value: 0.3855346418343763 and parameters: {'n_estimators': 1281, 'learning_rate': 0.03508986872329985, 'max_depth': 12, 'min_samples_split': 18, 'min_samples_leaf': 6, 'subsample': 0.8997391338247335, 'max_features': 'log2'}. Best is trial 1137 with value: 0.19687116000636118.
[I 2024-12-04 13:33:19,261] Trial 2024 finished with value: 0.23206132795014264 and parameters: {'n_estimators': 1465, 'learning_rate': 0.05794885055041355, 'max_depth': 11, 'min_samples_split': 13, 'min_samples_leaf': 2, 'subsample': 0.6124631655680433, 'max_features': 'sqrt'}. Best is trial 1137 with value: 0.19687116000636118.
[I 2024-12-04 13:33:21,321] Trial 2047 finished with value: 0.40955859019868496 and parameters: {'n_estimators': 672, 'learning_rate': 0.046156105587810185, 'max_depth': 9, 'min_samples_split': 9, 'min_samples_leaf': 10, 'subsample': 0.9665643074909509, 'max_features': 'sqrt'}. Best is trial 1137 with value: 0.19687116000636118.
[I 2024-12-04 13:33:24,246] Trial 2034 finished with value: 0.23996484950005162 and parameters: {'n_estimators': 1175, 'learning_rate': 0.09634736533288972, 'max_depth': 12, 'min_samples_split': 20, 'min_samples_leaf': 2, 'subsample': 0.704842196086778, 'max_features': 'sqrt'}. Best is trial 1137 with value: 0.19687116000636118.
[I 2024-12-04 13:33:26,259] Trial 2040 finished with value: 0.3865949361851674 and parameters: {'n_estimators': 1012, 'learning_rate': 0.04096563027175437, 'max_depth': 12, 'min_samples_split': 4, 'min_samples_leaf': 8, 'subsample': 0.7820893983169093, 'max_features': 'sqrt'}. Best is trial 1137 with value: 0.19687116000636118.
[I 2024-12-04 13:33:28,320] Trial 2051 finished with value: 0.3969969972825521 and parameters: {'n_estimators': 621, 'learning_rate': 0.04276187688839816, 'max_depth': 6, 'min_samples_split': 8, 'min_samples_leaf': 7, 'subsample': 0.6402066736958264, 'max_features': 'sqrt'}. Best is trial 1137 with value: 0.19687116000636118.
[I 2024-12-04 13:33:29,577] Trial 2028 finished with value: 0.22208295621177235 and parameters: {'n_estimators': 1488, 'learning_rate': 0.06656217282522285, 'max_depth': 12, 'min_samples_split': 20, 'min_samples_leaf': 1, 'subsample': 0.6920822357003196, 'max_features': 'sqrt'}. Best is trial 1137 with value: 0.19687116000636118.
[I 2024-12-04 13:33:32,111] Trial 2029 finished with value: 0.21889334749067582 and parameters: {'n_estimators': 1496, 'learning_rate': 0.0704072821595483, 'max_depth': 10, 'min_samples_split': 19, 'min_samples_leaf': 1, 'subsample': 0.7002773669640167, 'max_features': 'sqrt'}. Best is trial 1137 with value: 0.19687116000636118.
[I 2024-12-04 13:33:33,601] Trial 2030 finished with value: 0.25020930358272925 and parameters: {'n_estimators': 1486, 'learning_rate': 0.06576266227947429, 'max_depth': 10, 'min_samples_split': 18, 'min_samples_leaf': 3, 'subsample': 0.6797885164915084, 'max_features': 'sqrt'}. Best is trial 1137 with value: 0.19687116000636118.
[I 2024-12-04 13:33:34,681] Trial 2032 finished with value: 0.338876182916751 and parameters: {'n_estimators': 1264, 'learning_rate': 0.033457075440667707, 'max_depth': 6, 'min_samples_split': 3, 'min_samples_leaf': 6, 'subsample': 0.9271153895190685, 'max_features': None}. Best is trial 1137 with value: 0.19687116000636118.
[I 2024-12-04 13:33:36,331] Trial 2042 finished with value: 0.21661507782481107 and parameters: {'n_estimators': 1104, 'learning_rate': 0.0962449200925773, 'max_depth': 12, 'min_samples_split': 18, 'min_samples_leaf': 1, 'subsample': 0.6018455464305342, 'max_features': 'sqrt'}. Best is trial 1137 with value: 0.19687116000636118.
[I 2024-12-04 13:33:38,329] Trial 2031 finished with value: 0.22892854220119496 and parameters: {'n_estimators': 1491, 'learning_rate': 0.03773755039182265, 'max_depth': 12, 'min_samples_split': 18, 'min_samples_leaf': 1, 'subsample': 0.7074350312696385, 'max_features': 'sqrt'}. Best is trial 1137 with value: 0.19687116000636118.
[I 2024-12-04 13:33:40,758] Trial 2033 finished with value: 0.2243534999872954 and parameters: {'n_estimators': 1491, 'learning_rate': 0.0657854530454173, 'max_depth': 10, 'min_samples_split': 17, 'min_samples_leaf': 1, 'subsample': 0.6870164270089499, 'max_features': 'sqrt'}. Best is trial 1137 with value: 0.19687116000636118.
[I 2024-12-04 13:33:42,635] Trial 2039 finished with value: 0.2257071694179541 and parameters: {'n_estimators': 1243, 'learning_rate': 0.09855872867263604, 'max_depth': 12, 'min_samples_split': 18, 'min_samples_leaf': 1, 'subsample': 0.6582415245901783, 'max_features': 'sqrt'}. Best is trial 1137 with value: 0.19687116000636118.
[I 2024-12-04 13:33:44,379] Trial 2054 finished with value: 0.29402798545449776 and parameters: {'n_estimators': 645, 'learning_rate': 0.09504855590276934, 'max_depth': 10, 'min_samples_split': 2, 'min_samples_leaf': 1, 'subsample': 0.6997089086417362, 'max_features': None}. Best is trial 1137 with value: 0.19687116000636118.
[I 2024-12-04 13:33:44,751] Trial 2046 finished with value: 0.3745456604856837 and parameters: {'n_estimators': 1124, 'learning_rate': 0.023680564063036084, 'max_depth': 3, 'min_samples_split': 13, 'min_samples_leaf': 4, 'subsample': 0.606343144170928, 'max_features': 'sqrt'}. Best is trial 1137 with value: 0.19687116000636118.
[I 2024-12-04 13:33:45,623] Trial 2035 finished with value: 0.2358219381760745 and parameters: {'n_estimators': 1487, 'learning_rate': 0.07100827630908386, 'max_depth': 12, 'min_samples_split': 18, 'min_samples_leaf': 2, 'subsample': 0.6738599178821362, 'max_features': 'sqrt'}. Best is trial 1137 with value: 0.19687116000636118.
[I 2024-12-04 13:33:46,793] Trial 2041 finished with value: 0.24433475094849244 and parameters: {'n_estimators': 1298, 'learning_rate': 0.09475727379100592, 'max_depth': 12, 'min_samples_split': 20, 'min_samples_leaf': 3, 'subsample': 0.7613321720130704, 'max_features': 'sqrt'}. Best is trial 1137 with value: 0.19687116000636118.
[I 2024-12-04 13:33:51,733] Trial 2044 finished with value: 0.23443186039183325 and parameters: {'n_estimators': 1231, 'learning_rate': 0.07472013613379748, 'max_depth': 11, 'min_samples_split': 20, 'min_samples_leaf': 1, 'subsample': 0.6613986116441843, 'max_features': 'sqrt'}. Best is trial 1137 with value: 0.19687116000636118.
[I 2024-12-04 13:33:52,282] Trial 2036 finished with value: 0.21057709465021765 and parameters: {'n_estimators': 1499, 'learning_rate': 0.07821798121150704, 'max_depth': 10, 'min_samples_split': 16, 'min_samples_leaf': 1, 'subsample': 0.6484643452383625, 'max_features': 'sqrt'}. Best is trial 1137 with value: 0.19687116000636118.
[I 2024-12-04 13:33:53,964] Trial 2038 finished with value: 0.21578870497515343 and parameters: {'n_estimators': 1471, 'learning_rate': 0.055617329897528454, 'max_depth': 11, 'min_samples_split': 16, 'min_samples_leaf': 1, 'subsample': 0.6007544502861085, 'max_features': 'sqrt'}. Best is trial 1137 with value: 0.19687116000636118.
[I 2024-12-04 13:33:53,969] Trial 2057 finished with value: 0.289459860114888 and parameters: {'n_estimators': 697, 'learning_rate': 0.028229084148577166, 'max_depth': 11, 'min_samples_split': 9, 'min_samples_leaf': 3, 'subsample': 0.7632482426957059, 'max_features': None}. Best is trial 1137 with value: 0.19687116000636118.
[I 2024-12-04 13:33:54,995] Trial 2048 finished with value: 0.2236432266609628 and parameters: {'n_estimators': 1197, 'learning_rate': 0.09877683708447527, 'max_depth': 12, 'min_samples_split': 15, 'min_samples_leaf': 1, 'subsample': 0.7591116965197414, 'max_features': 'sqrt'}. Best is trial 1137 with value: 0.19687116000636118.
[I 2024-12-04 13:34:00,092] Trial 2045 finished with value: 0.33621051799171275 and parameters: {'n_estimators': 1437, 'learning_rate': 0.013907503166963915, 'max_depth': 5, 'min_samples_split': 2, 'min_samples_leaf': 1, 'subsample': 0.6657198396133388, 'max_features': 'sqrt'}. Best is trial 1137 with value: 0.19687116000636118.
[I 2024-12-04 13:34:01,131] Trial 2049 finished with value: 0.29106606693445974 and parameters: {'n_estimators': 1338, 'learning_rate': 0.04483471426652058, 'max_depth': 4, 'min_samples_split': 6, 'min_samples_leaf': 3, 'subsample': 0.7265638358097554, 'max_features': 'sqrt'}. Best is trial 1137 with value: 0.19687116000636118.
[I 2024-12-04 13:34:08,214] Trial 2061 finished with value: 0.21369670569442137 and parameters: {'n_estimators': 859, 'learning_rate': 0.09023830991301532, 'max_depth': 12, 'min_samples_split': 15, 'min_samples_leaf': 1, 'subsample': 0.6084147991721574, 'max_features': 'sqrt'}. Best is trial 1137 with value: 0.19687116000636118.
[I 2024-12-04 13:34:13,208] Trial 2073 finished with value: 0.3795675374794732 and parameters: {'n_estimators': 382, 'learning_rate': 0.04425058496110509, 'max_depth': 10, 'min_samples_split': 2, 'min_samples_leaf': 10, 'subsample': 0.9316490861341931, 'max_features': None}. Best is trial 1137 with value: 0.19687116000636118.
[I 2024-12-04 13:34:14,415] Trial 2052 finished with value: 0.21912115777232274 and parameters: {'n_estimators': 1475, 'learning_rate': 0.08546826432593752, 'max_depth': 12, 'min_samples_split': 14, 'min_samples_leaf': 1, 'subsample': 0.706078063746993, 'max_features': 'sqrt'}. Best is trial 1137 with value: 0.19687116000636118.
[I 2024-12-04 13:34:17,809] Trial 2053 finished with value: 0.20804416292212405 and parameters: {'n_estimators': 1465, 'learning_rate': 0.0972902485514014, 'max_depth': 11, 'min_samples_split': 20, 'min_samples_leaf': 1, 'subsample': 0.6469542736349976, 'max_features': 'sqrt'}. Best is trial 1137 with value: 0.19687116000636118.
[I 2024-12-04 13:34:19,190] Trial 2050 finished with value: 0.28349555855221276 and parameters: {'n_estimators': 1440, 'learning_rate': 0.07178369258473534, 'max_depth': 10, 'min_samples_split': 20, 'min_samples_leaf': 4, 'subsample': 0.6598653919980302, 'max_features': None}. Best is trial 1137 with value: 0.19687116000636118.
[I 2024-12-04 13:34:20,237] Trial 2058 finished with value: 0.225761217274069 and parameters: {'n_estimators': 1260, 'learning_rate': 0.09000954256907304, 'max_depth': 12, 'min_samples_split': 15, 'min_samples_leaf': 1, 'subsample': 0.6578964500835198, 'max_features': 'sqrt'}. Best is trial 1137 with value: 0.19687116000636118.
[I 2024-12-04 13:34:20,595] Trial 2056 finished with value: 0.2943298399641671 and parameters: {'n_estimators': 1246, 'learning_rate': 0.08436831346757322, 'max_depth': 11, 'min_samples_split': 15, 'min_samples_leaf': 2, 'subsample': 0.6087888021273516, 'max_features': None}. Best is trial 1137 with value: 0.19687116000636118.
