[I 2024-12-04 15:14:23,340] Trial 1604 finished with value: 0.4793882382740913 and parameters: {'n_estimators': 965, 'learning_rate': 0.08439380239756332, 'max_depth': 10, 'min_samples_split': 17, 'min_samples_leaf': 1, 'subsample': 0.9132146676009671, 'max_features': None}. Best is trial 1435 with value: 0.45467030752684195.
[I 2024-12-04 15:14:24,821] Trial 1595 finished with value: 0.6379974729272841 and parameters: {'n_estimators': 1295, 'learning_rate': 0.05510433228254661, 'max_depth': 11, 'min_samples_split': 20, 'min_samples_leaf': 2, 'subsample': 0.9864387772850259, 'max_features': None}. Best is trial 1435 with value: 0.45467030752684195.
[I 2024-12-04 15:14:25,353] Trial 1620 finished with value: 0.6141437631503442 and parameters: {'n_estimators': 705, 'learning_rate': 0.07320754133926889, 'max_depth': 11, 'min_samples_split': 20, 'min_samples_leaf': 2, 'subsample': 0.9782701487018431, 'max_features': 'sqrt'}. Best is trial 1435 with value: 0.45467030752684195.
[I 2024-12-04 15:14:27,866] Trial 1608 finished with value: 0.5421881373922074 and parameters: {'n_estimators': 1218, 'learning_rate': 0.03921876084848172, 'max_depth': 3, 'min_samples_split': 11, 'min_samples_leaf': 1, 'subsample': 0.8357575632150851, 'max_features': None}. Best is trial 1435 with value: 0.45467030752684195.
[I 2024-12-04 15:14:27,984] Trial 1609 finished with value: 0.5047191285160574 and parameters: {'n_estimators': 993, 'learning_rate': 0.08585364793973307, 'max_depth': 11, 'min_samples_split': 17, 'min_samples_leaf': 1, 'subsample': 0.9365039153012236, 'max_features': None}. Best is trial 1435 with value: 0.45467030752684195.
[I 2024-12-04 15:14:29,144] Trial 1596 finished with value: 0.483978334260412 and parameters: {'n_estimators': 1328, 'learning_rate': 0.03750916747671639, 'max_depth': 11, 'min_samples_split': 20, 'min_samples_leaf': 1, 'subsample': 0.9995196299661815, 'max_features': None}. Best is trial 1435 with value: 0.45467030752684195.
[I 2024-12-04 15:14:29,616] Trial 1610 finished with value: 0.4825265104194857 and parameters: {'n_estimators': 968, 'learning_rate': 0.055694578173493485, 'max_depth': 12, 'min_samples_split': 20, 'min_samples_leaf': 1, 'subsample': 0.9939617116250726, 'max_features': None}. Best is trial 1435 with value: 0.45467030752684195.
[I 2024-12-04 15:14:29,729] Trial 1613 finished with value: 0.4643895362673492 and parameters: {'n_estimators': 917, 'learning_rate': 0.08873570982149012, 'max_depth': 12, 'min_samples_split': 20, 'min_samples_leaf': 1, 'subsample': 0.9673634978105154, 'max_features': None}. Best is trial 1435 with value: 0.45467030752684195.
[I 2024-12-04 15:14:29,867] Trial 1602 finished with value: 0.4807564908933921 and parameters: {'n_estimators': 1171, 'learning_rate': 0.08731745188231173, 'max_depth': 10, 'min_samples_split': 17, 'min_samples_leaf': 1, 'subsample': 0.9967098614130494, 'max_features': None}. Best is trial 1435 with value: 0.45467030752684195.
[I 2024-12-04 15:14:32,586] Trial 1597 finished with value: 0.49836343045160253 and parameters: {'n_estimators': 1445, 'learning_rate': 0.0495342754692096, 'max_depth': 10, 'min_samples_split': 18, 'min_samples_leaf': 1, 'subsample': 0.9191875430595996, 'max_features': None}. Best is trial 1435 with value: 0.45467030752684195.
[I 2024-12-04 15:14:32,963] Trial 1616 finished with value: 0.6588154279007999 and parameters: {'n_estimators': 963, 'learning_rate': 0.08853471825374812, 'max_depth': 12, 'min_samples_split': 16, 'min_samples_leaf': 2, 'subsample': 0.9876287394688923, 'max_features': None}. Best is trial 1435 with value: 0.45467030752684195.
[I 2024-12-04 15:14:33,545] Trial 1615 finished with value: 0.503939376621606 and parameters: {'n_estimators': 957, 'learning_rate': 0.0919036947838991, 'max_depth': 12, 'min_samples_split': 16, 'min_samples_leaf': 1, 'subsample': 0.9934672344215619, 'max_features': None}. Best is trial 1435 with value: 0.45467030752684195.
[I 2024-12-04 15:14:37,482] Trial 1622 finished with value: 0.6134399557537932 and parameters: {'n_estimators': 1010, 'learning_rate': 0.036614283528164496, 'max_depth': 8, 'min_samples_split': 5, 'min_samples_leaf': 4, 'subsample': 0.9859210530874607, 'max_features': 'sqrt'}. Best is trial 1435 with value: 0.45467030752684195.
[I 2024-12-04 15:14:37,740] Trial 1619 finished with value: 0.6263901291514026 and parameters: {'n_estimators': 1271, 'learning_rate': 0.048502235458355906, 'max_depth': 6, 'min_samples_split': 12, 'min_samples_leaf': 3, 'subsample': 0.6411010170629389, 'max_features': 'log2'}. Best is trial 1435 with value: 0.45467030752684195.
[I 2024-12-04 15:14:40,502] Trial 1618 finished with value: 0.48661975985940653 and parameters: {'n_estimators': 1136, 'learning_rate': 0.0946834346473681, 'max_depth': 10, 'min_samples_split': 17, 'min_samples_leaf': 1, 'subsample': 0.9258739263004828, 'max_features': None}. Best is trial 1435 with value: 0.45467030752684195.
[I 2024-12-04 15:14:40,931] Trial 1617 finished with value: 0.6564098523826024 and parameters: {'n_estimators': 1166, 'learning_rate': 0.07391306748475936, 'max_depth': 11, 'min_samples_split': 20, 'min_samples_leaf': 2, 'subsample': 0.9979812862526614, 'max_features': None}. Best is trial 1435 with value: 0.45467030752684195.
[I 2024-12-04 15:14:43,048] Trial 1625 finished with value: 0.6267393302387864 and parameters: {'n_estimators': 843, 'learning_rate': 0.08218359384225064, 'max_depth': 11, 'min_samples_split': 18, 'min_samples_leaf': 2, 'subsample': 0.9993694468244845, 'max_features': None}. Best is trial 1435 with value: 0.45467030752684195.
[I 2024-12-04 15:14:43,098] Trial 1629 finished with value: 0.6349634390579383 and parameters: {'n_estimators': 787, 'learning_rate': 0.08728858729060716, 'max_depth': 6, 'min_samples_split': 6, 'min_samples_leaf': 4, 'subsample': 0.8330891592256624, 'max_features': None}. Best is trial 1435 with value: 0.45467030752684195.
[I 2024-12-04 15:14:44,155] Trial 1621 finished with value: 0.4796157652144308 and parameters: {'n_estimators': 1010, 'learning_rate': 0.09327964402850053, 'max_depth': 12, 'min_samples_split': 19, 'min_samples_leaf': 1, 'subsample': 0.9998046738030045, 'max_features': None}. Best is trial 1435 with value: 0.45467030752684195.
[I 2024-12-04 15:14:45,830] Trial 1646 finished with value: 0.7462043049043607 and parameters: {'n_estimators': 361, 'learning_rate': 0.01352281153842011, 'max_depth': 6, 'min_samples_split': 13, 'min_samples_leaf': 3, 'subsample': 0.8018110311054664, 'max_features': 'sqrt'}. Best is trial 1435 with value: 0.45467030752684195.
[I 2024-12-04 15:14:47,939] Trial 1624 finished with value: 0.6499675610052283 and parameters: {'n_estimators': 974, 'learning_rate': 0.09363896680326429, 'max_depth': 12, 'min_samples_split': 16, 'min_samples_leaf': 2, 'subsample': 0.9998407689420515, 'max_features': None}. Best is trial 1435 with value: 0.45467030752684195.
[I 2024-12-04 15:14:49,839] Trial 1630 finished with value: 0.475072164362406 and parameters: {'n_estimators': 857, 'learning_rate': 0.08664864144121687, 'max_depth': 12, 'min_samples_split': 19, 'min_samples_leaf': 1, 'subsample': 0.9398106019308435, 'max_features': None}. Best is trial 1435 with value: 0.45467030752684195.
[I 2024-12-04 15:14:50,407] Trial 1633 finished with value: 0.48980034459867194 and parameters: {'n_estimators': 802, 'learning_rate': 0.07784734521359005, 'max_depth': 11, 'min_samples_split': 17, 'min_samples_leaf': 1, 'subsample': 0.9957921869108027, 'max_features': None}. Best is trial 1435 with value: 0.45467030752684195.
[I 2024-12-04 15:14:51,177] Trial 1635 finished with value: 0.6984450429095819 and parameters: {'n_estimators': 906, 'learning_rate': 0.0993096162619805, 'max_depth': 11, 'min_samples_split': 7, 'min_samples_leaf': 2, 'subsample': 0.7246895085070163, 'max_features': 'log2'}. Best is trial 1435 with value: 0.45467030752684195.
[I 2024-12-04 15:14:52,026] Trial 1623 finished with value: 0.46986475812426876 and parameters: {'n_estimators': 1140, 'learning_rate': 0.08933992840237173, 'max_depth': 12, 'min_samples_split': 20, 'min_samples_leaf': 1, 'subsample': 0.9080094955780779, 'max_features': None}. Best is trial 1435 with value: 0.45467030752684195.
[I 2024-12-04 15:14:52,051] Trial 1634 finished with value: 0.6117859136062721 and parameters: {'n_estimators': 746, 'learning_rate': 0.0869451291420392, 'max_depth': 12, 'min_samples_split': 19, 'min_samples_leaf': 2, 'subsample': 0.9860730067033223, 'max_features': None}. Best is trial 1435 with value: 0.45467030752684195.
[I 2024-12-04 15:14:54,314] Trial 1627 finished with value: 0.6904811592879251 and parameters: {'n_estimators': 1108, 'learning_rate': 0.09775149146249926, 'max_depth': 11, 'min_samples_split': 15, 'min_samples_leaf': 3, 'subsample': 0.9208085412304575, 'max_features': None}. Best is trial 1435 with value: 0.45467030752684195.
[I 2024-12-04 15:14:55,781] Trial 1626 finished with value: 0.7020112644060976 and parameters: {'n_estimators': 1436, 'learning_rate': 0.020863691273289048, 'max_depth': 12, 'min_samples_split': 20, 'min_samples_leaf': 6, 'subsample': 0.8738289022955043, 'max_features': 'sqrt'}. Best is trial 1435 with value: 0.45467030752684195.
[I 2024-12-04 15:14:55,996] Trial 1632 finished with value: 0.4732999096088949 and parameters: {'n_estimators': 952, 'learning_rate': 0.06509507946775189, 'max_depth': 11, 'min_samples_split': 20, 'min_samples_leaf': 1, 'subsample': 0.9962968007637646, 'max_features': None}. Best is trial 1435 with value: 0.45467030752684195.
[I 2024-12-04 15:14:58,390] Trial 1644 finished with value: 0.500015654168593 and parameters: {'n_estimators': 702, 'learning_rate': 0.08584736515268714, 'max_depth': 12, 'min_samples_split': 18, 'min_samples_leaf': 1, 'subsample': 0.9988922932480896, 'max_features': None}. Best is trial 1435 with value: 0.45467030752684195.
[I 2024-12-04 15:15:00,137] Trial 1657 finished with value: 0.6251529801294484 and parameters: {'n_estimators': 386, 'learning_rate': 0.06922930987272552, 'max_depth': 5, 'min_samples_split': 5, 'min_samples_leaf': 1, 'subsample': 0.7671172224736474, 'max_features': 'log2'}. Best is trial 1435 with value: 0.45467030752684195.
[I 2024-12-04 15:15:00,317] Trial 1641 finished with value: 0.4761055365845293 and parameters: {'n_estimators': 809, 'learning_rate': 0.09516275039480415, 'max_depth': 10, 'min_samples_split': 20, 'min_samples_leaf': 1, 'subsample': 0.9579768161073303, 'max_features': None}. Best is trial 1435 with value: 0.45467030752684195.
[I 2024-12-04 15:15:00,807] Trial 1628 finished with value: 0.6541514796888749 and parameters: {'n_estimators': 1202, 'learning_rate': 0.09921316895652556, 'max_depth': 12, 'min_samples_split': 15, 'min_samples_leaf': 2, 'subsample': 0.9832095444904834, 'max_features': None}. Best is trial 1435 with value: 0.45467030752684195.
[I 2024-12-04 15:15:00,809] Trial 1639 finished with value: 0.4769593780667196 and parameters: {'n_estimators': 876, 'learning_rate': 0.0940674293053968, 'max_depth': 11, 'min_samples_split': 19, 'min_samples_leaf': 1, 'subsample': 0.9409273236341958, 'max_features': None}. Best is trial 1435 with value: 0.45467030752684195.
[I 2024-12-04 15:15:02,193] Trial 1640 finished with value: 0.47812303986600435 and parameters: {'n_estimators': 886, 'learning_rate': 0.0821949491472415, 'max_depth': 12, 'min_samples_split': 18, 'min_samples_leaf': 1, 'subsample': 0.9878346838840615, 'max_features': None}. Best is trial 1435 with value: 0.45467030752684195.
[I 2024-12-04 15:15:02,342] Trial 1649 finished with value: 0.6558449163427694 and parameters: {'n_estimators': 877, 'learning_rate': 0.08201118428453313, 'max_depth': 12, 'min_samples_split': 20, 'min_samples_leaf': 3, 'subsample': 0.8843155232313626, 'max_features': 'log2'}. Best is trial 1435 with value: 0.45467030752684195.
[I 2024-12-04 15:15:02,344] Trial 1637 finished with value: 0.4802257955471307 and parameters: {'n_estimators': 983, 'learning_rate': 0.0656906321939077, 'max_depth': 12, 'min_samples_split': 18, 'min_samples_leaf': 1, 'subsample': 0.9945779359626915, 'max_features': None}. Best is trial 1435 with value: 0.45467030752684195.
[I 2024-12-04 15:15:03,597] Trial 1642 finished with value: 0.6698386608159977 and parameters: {'n_estimators': 981, 'learning_rate': 0.09912589622065687, 'max_depth': 12, 'min_samples_split': 15, 'min_samples_leaf': 3, 'subsample': 0.9865796993295731, 'max_features': 'sqrt'}. Best is trial 1435 with value: 0.45467030752684195.
[I 2024-12-04 15:15:04,158] Trial 1643 finished with value: 0.47259970199808393 and parameters: {'n_estimators': 810, 'learning_rate': 0.09472193022077124, 'max_depth': 10, 'min_samples_split': 20, 'min_samples_leaf': 1, 'subsample': 0.9410433253790256, 'max_features': None}. Best is trial 1435 with value: 0.45467030752684195.
[I 2024-12-04 15:15:05,163] Trial 1656 finished with value: 0.559480984231174 and parameters: {'n_estimators': 606, 'learning_rate': 0.06493779630228153, 'max_depth': 12, 'min_samples_split': 20, 'min_samples_leaf': 1, 'subsample': 0.950612091590551, 'max_features': 'sqrt'}. Best is trial 1435 with value: 0.45467030752684195.
[I 2024-12-04 15:15:05,781] Trial 1647 finished with value: 0.6447314579705867 and parameters: {'n_estimators': 815, 'learning_rate': 0.09108827398327475, 'max_depth': 11, 'min_samples_split': 20, 'min_samples_leaf': 3, 'subsample': 0.9922143942792446, 'max_features': None}. Best is trial 1435 with value: 0.45467030752684195.
[I 2024-12-04 15:15:06,853] Trial 1636 finished with value: 0.6055237397370961 and parameters: {'n_estimators': 1141, 'learning_rate': 0.09138895852189095, 'max_depth': 12, 'min_samples_split': 20, 'min_samples_leaf': 2, 'subsample': 0.9795747125182717, 'max_features': None}. Best is trial 1435 with value: 0.45467030752684195.
[I 2024-12-04 15:15:07,074] Trial 1645 finished with value: 0.4838069775086534 and parameters: {'n_estimators': 905, 'learning_rate': 0.09100984017878205, 'max_depth': 11, 'min_samples_split': 20, 'min_samples_leaf': 1, 'subsample': 0.9519303517168354, 'max_features': None}. Best is trial 1435 with value: 0.45467030752684195.
[I 2024-12-04 15:15:07,948] Trial 1631 finished with value: 0.6335750449742121 and parameters: {'n_estimators': 1428, 'learning_rate': 0.025910921304494097, 'max_depth': 10, 'min_samples_split': 20, 'min_samples_leaf': 3, 'subsample': 0.8875047859159971, 'max_features': None}. Best is trial 1435 with value: 0.45467030752684195.
[I 2024-12-04 15:15:07,950] Trial 1654 finished with value: 0.7062274983566125 and parameters: {'n_estimators': 765, 'learning_rate': 0.034949632277516504, 'max_depth': 7, 'min_samples_split': 6, 'min_samples_leaf': 4, 'subsample': 0.7595559348946052, 'max_features': 'log2'}. Best is trial 1435 with value: 0.45467030752684195.
[I 2024-12-04 15:15:10,166] Trial 1638 finished with value: 0.6838522723014628 and parameters: {'n_estimators': 1457, 'learning_rate': 0.013757304429255615, 'max_depth': 3, 'min_samples_split': 12, 'min_samples_leaf': 6, 'subsample': 0.8223481041861772, 'max_features': 'sqrt'}. Best is trial 1435 with value: 0.45467030752684195.
[I 2024-12-04 15:15:14,322] Trial 1651 finished with value: 0.46297911633068567 and parameters: {'n_estimators': 955, 'learning_rate': 0.0848251513630297, 'max_depth': 11, 'min_samples_split': 20, 'min_samples_leaf': 1, 'subsample': 0.9855171176118624, 'max_features': None}. Best is trial 1435 with value: 0.45467030752684195.
[I 2024-12-04 15:15:14,506] Trial 1652 finished with value: 0.4606480020050273 and parameters: {'n_estimators': 832, 'learning_rate': 0.07449163263622462, 'max_depth': 12, 'min_samples_split': 20, 'min_samples_leaf': 1, 'subsample': 0.9654015208267057, 'max_features': None}. Best is trial 1435 with value: 0.45467030752684195.
[I 2024-12-04 15:15:15,967] Trial 1650 finished with value: 0.47824459085049403 and parameters: {'n_estimators': 1072, 'learning_rate': 0.07767563299620397, 'max_depth': 12, 'min_samples_split': 20, 'min_samples_leaf': 1, 'subsample': 0.9142658772911147, 'max_features': None}. Best is trial 1435 with value: 0.45467030752684195.
[I 2024-12-04 15:15:15,975] Trial 1672 finished with value: 0.998116233039958 and parameters: {'n_estimators': 188, 'learning_rate': 0.09142999463258188, 'max_depth': 3, 'min_samples_split': 11, 'min_samples_leaf': 8, 'subsample': 0.6036347769843378, 'max_features': 'log2'}. Best is trial 1435 with value: 0.45467030752684195.
[I 2024-12-04 15:15:16,217] Trial 1669 finished with value: 0.9688515132046979 and parameters: {'n_estimators': 413, 'learning_rate': 0.018713544655010426, 'max_depth': 10, 'min_samples_split': 3, 'min_samples_leaf': 5, 'subsample': 0.9454875403975992, 'max_features': 'log2'}. Best is trial 1435 with value: 0.45467030752684195.
[I 2024-12-04 15:15:16,219] Trial 1648 finished with value: 0.7673197265718442 and parameters: {'n_estimators': 1437, 'learning_rate': 0.03319437011739285, 'max_depth': 12, 'min_samples_split': 8, 'min_samples_leaf': 7, 'subsample': 0.6341422875394794, 'max_features': 'log2'}. Best is trial 1435 with value: 0.45467030752684195.
[I 2024-12-04 15:15:17,056] Trial 1653 finished with value: 0.7079047203783226 and parameters: {'n_estimators': 1232, 'learning_rate': 0.010653055365876464, 'max_depth': 4, 'min_samples_split': 4, 'min_samples_leaf': 7, 'subsample': 0.8454612938803148, 'max_features': 'sqrt'}. Best is trial 1435 with value: 0.45467030752684195.
[I 2024-12-04 15:15:17,311] Trial 1659 finished with value: 0.6283258263475502 and parameters: {'n_estimators': 697, 'learning_rate': 0.09256413836346009, 'max_depth': 12, 'min_samples_split': 20, 'min_samples_leaf': 2, 'subsample': 0.9813976149720406, 'max_features': None}. Best is trial 1435 with value: 0.45467030752684195.
[I 2024-12-04 15:15:18,190] Trial 1658 finished with value: 0.6674884297647562 and parameters: {'n_estimators': 859, 'learning_rate': 0.08970104718836082, 'max_depth': 11, 'min_samples_split': 18, 'min_samples_leaf': 3, 'subsample': 0.8929718732681184, 'max_features': None}. Best is trial 1435 with value: 0.45467030752684195.
[I 2024-12-04 15:15:20,835] Trial 1671 finished with value: 0.7049409988865275 and parameters: {'n_estimators': 477, 'learning_rate': 0.05838007973502742, 'max_depth': 9, 'min_samples_split': 16, 'min_samples_leaf': 7, 'subsample': 0.8605191486247695, 'max_features': 'sqrt'}. Best is trial 1435 with value: 0.45467030752684195.
[I 2024-12-04 15:15:22,207] Trial 1665 finished with value: 0.545796051491612 and parameters: {'n_estimators': 650, 'learning_rate': 0.013328392678568106, 'max_depth': 6, 'min_samples_split': 3, 'min_samples_leaf': 1, 'subsample': 0.9722002478000692, 'max_features': None}. Best is trial 1435 with value: 0.45467030752684195.
[I 2024-12-04 15:15:23,085] Trial 1664 finished with value: 0.5548485477790477 and parameters: {'n_estimators': 882, 'learning_rate': 0.09966272489728721, 'max_depth': 12, 'min_samples_split': 18, 'min_samples_leaf': 1, 'subsample': 0.9720130459469852, 'max_features': 'sqrt'}. Best is trial 1435 with value: 0.45467030752684195.
[I 2024-12-04 15:15:26,043] Trial 1655 finished with value: 0.6654897931486721 and parameters: {'n_estimators': 1488, 'learning_rate': 0.0257468099808242, 'max_depth': 10, 'min_samples_split': 18, 'min_samples_leaf': 2, 'subsample': 0.8813505344491689, 'max_features': 'sqrt'}. Best is trial 1435 with value: 0.45467030752684195.
[I 2024-12-04 15:15:27,501] Trial 1660 finished with value: 0.49230515037342454 and parameters: {'n_estimators': 1003, 'learning_rate': 0.06557906982945083, 'max_depth': 12, 'min_samples_split': 17, 'min_samples_leaf': 1, 'subsample': 0.9882691613820739, 'max_features': None}. Best is trial 1435 with value: 0.45467030752684195.
[I 2024-12-04 15:15:29,291] Trial 1663 finished with value: 0.6379709407704767 and parameters: {'n_estimators': 1016, 'learning_rate': 0.08423471379814265, 'max_depth': 11, 'min_samples_split': 20, 'min_samples_leaf': 4, 'subsample': 0.9838460324286818, 'max_features': None}. Best is trial 1435 with value: 0.45467030752684195.
[I 2024-12-04 15:15:31,143] Trial 1680 finished with value: 0.7936239245383504 and parameters: {'n_estimators': 599, 'learning_rate': 0.03890998049942365, 'max_depth': 12, 'min_samples_split': 18, 'min_samples_leaf': 8, 'subsample': 0.9869052888344716, 'max_features': 'log2'}. Best is trial 1435 with value: 0.45467030752684195.
[I 2024-12-04 15:15:31,194] Trial 1678 finished with value: 0.6161747770416689 and parameters: {'n_estimators': 603, 'learning_rate': 0.027350913209321735, 'max_depth': 6, 'min_samples_split': 8, 'min_samples_leaf': 3, 'subsample': 0.7325527262511565, 'max_features': None}. Best is trial 1435 with value: 0.45467030752684195.
[I 2024-12-04 15:15:32,114] Trial 1661 finished with value: 0.4757249413816172 and parameters: {'n_estimators': 1131, 'learning_rate': 0.08163310105391093, 'max_depth': 12, 'min_samples_split': 20, 'min_samples_leaf': 1, 'subsample': 0.9688859679393178, 'max_features': None}. Best is trial 1435 with value: 0.45467030752684195.
[I 2024-12-04 15:15:33,821] Trial 1662 finished with value: 0.4975142874627091 and parameters: {'n_estimators': 1143, 'learning_rate': 0.09211124962126137, 'max_depth': 11, 'min_samples_split': 17, 'min_samples_leaf': 1, 'subsample': 0.9984280699725429, 'max_features': None}. Best is trial 1435 with value: 0.45467030752684195.
[I 2024-12-04 15:15:34,161] Trial 1676 finished with value: 0.5518843845709724 and parameters: {'n_estimators': 836, 'learning_rate': 0.08305365069805408, 'max_depth': 12, 'min_samples_split': 18, 'min_samples_leaf': 1, 'subsample': 0.9812918503148021, 'max_features': 'log2'}. Best is trial 1435 with value: 0.45467030752684195.
