[I 2024-12-03 18:51:29,827] Trial 836 finished with value: 0.13843377169836762 and parameters: {'kernel': 'linear', 'C': 12.593917728737559, 'gamma': 0.06222855883806196, 'epsilon': 0.011158758344742791}. Best is trial 345 with value: 0.13438257115663557.
[I 2024-12-03 18:51:31,636] Trial 850 finished with value: 0.13634818435915852 and parameters: {'kernel': 'linear', 'C': 4.182713276653835, 'gamma': 0.022272170495069885, 'epsilon': 0.0447780138188681}. Best is trial 345 with value: 0.13438257115663557.
[I 2024-12-03 18:51:34,597] Trial 812 finished with value: 0.13490822275064734 and parameters: {'kernel': 'linear', 'C': 77.3761647735877, 'gamma': 0.002235254152504339, 'epsilon': 0.06213945557285474}. Best is trial 345 with value: 0.13438257115663557.
[I 2024-12-03 18:51:35,338] Trial 852 finished with value: 0.1365196575379014 and parameters: {'kernel': 'linear', 'C': 8.445567425227244, 'gamma': 0.005287436829228318, 'epsilon': 0.05309241559707174}. Best is trial 345 with value: 0.13438257115663557.
[I 2024-12-03 18:51:35,723] Trial 844 finished with value: 0.13821431496959585 and parameters: {'kernel': 'linear', 'C': 7.289515418381588, 'gamma': 0.003954658988959864, 'epsilon': 0.01317084910996843}. Best is trial 345 with value: 0.13438257115663557.
[I 2024-12-03 18:51:36,459] Trial 857 finished with value: 1.3603289794908435 and parameters: {'kernel': 'poly', 'C': 0.27732416398563947, 'gamma': 0.00011213861134207672, 'epsilon': 0.0100271599938756}. Best is trial 345 with value: 0.13438257115663557.
[I 2024-12-03 18:51:36,518] Trial 856 finished with value: 0.14762395305949583 and parameters: {'kernel': 'linear', 'C': 3.2248966706581585, 'gamma': 0.0005709520263915936, 'epsilon': 0.09147967240079251}. Best is trial 345 with value: 0.13438257115663557.
[I 2024-12-03 18:51:38,596] Trial 859 finished with value: 0.1912791924851839 and parameters: {'kernel': 'linear', 'C': 18.96568493652756, 'gamma': 0.002953764766458073, 'epsilon': 0.2423174271972372}. Best is trial 345 with value: 0.13438257115663557.
[I 2024-12-03 18:51:39,021] Trial 855 finished with value: 0.13719863182584938 and parameters: {'kernel': 'linear', 'C': 9.124421608204637, 'gamma': 0.017992948121665547, 'epsilon': 0.047672203003925766}. Best is trial 345 with value: 0.13438257115663557.
[I 2024-12-03 18:51:39,781] Trial 861 finished with value: 1.0461919318500157 and parameters: {'kernel': 'poly', 'C': 58.993261579907426, 'gamma': 0.0015768984632500305, 'epsilon': 0.01931657015921911}. Best is trial 345 with value: 0.13438257115663557.
[I 2024-12-03 18:51:40,977] Trial 863 finished with value: 1.339194056770142 and parameters: {'kernel': 'rbf', 'C': 0.0016244580100917018, 'gamma': 0.004948972319487921, 'epsilon': 0.078345560470675}. Best is trial 345 with value: 0.13438257115663557.
[I 2024-12-03 18:51:41,089] Trial 823 finished with value: 0.13533207930913882 and parameters: {'kernel': 'linear', 'C': 82.62959404813498, 'gamma': 0.014546538550977428, 'epsilon': 0.05868939649495501}. Best is trial 345 with value: 0.13438257115663557.
[I 2024-12-03 18:51:42,566] Trial 854 finished with value: 0.13577210511237975 and parameters: {'kernel': 'linear', 'C': 11.712061893220602, 'gamma': 0.004114574830515739, 'epsilon': 0.036032373864145706}. Best is trial 345 with value: 0.13438257115663557.
[I 2024-12-03 18:51:43,212] Trial 865 finished with value: 0.9058541107034532 and parameters: {'kernel': 'sigmoid', 'C': 0.9328556355489701, 'gamma': 0.00021076319732502472, 'epsilon': 0.025586717439715353}. Best is trial 345 with value: 0.13438257115663557.
[I 2024-12-03 18:51:43,899] Trial 835 finished with value: 0.1374710632140368 and parameters: {'kernel': 'linear', 'C': 82.1660070659554, 'gamma': 0.007359123129509872, 'epsilon': 0.07690856995772063}. Best is trial 345 with value: 0.13438257115663557.
[I 2024-12-03 18:51:45,874] Trial 866 finished with value: 0.18980885512837828 and parameters: {'kernel': 'linear', 'C': 88.55924475486914, 'gamma': 0.0025459395258440546, 'epsilon': 0.22405798766111454}. Best is trial 345 with value: 0.13438257115663557.
[I 2024-12-03 18:51:49,560] Trial 860 finished with value: 0.13820077338358558 and parameters: {'kernel': 'linear', 'C': 11.66832760403101, 'gamma': 0.0012118543531800473, 'epsilon': 0.011518463272232002}. Best is trial 345 with value: 0.13438257115663557.
[I 2024-12-03 18:51:50,490] Trial 838 finished with value: 0.13558456466247304 and parameters: {'kernel': 'linear', 'C': 23.024592987875913, 'gamma': 0.009195763399523993, 'epsilon': 0.037364433599728096}. Best is trial 345 with value: 0.13438257115663557.
[I 2024-12-03 18:51:51,879] Trial 798 finished with value: 0.13785310217736013 and parameters: {'kernel': 'linear', 'C': 75.55673480246256, 'gamma': 0.034577861634565936, 'epsilon': 0.0036464081881550747}. Best is trial 345 with value: 0.13438257115663557.
[I 2024-12-03 18:51:54,696] Trial 870 finished with value: 0.1360033749791688 and parameters: {'kernel': 'linear', 'C': 7.368893711922853, 'gamma': 0.00015532870374745464, 'epsilon': 0.05549271887150113}. Best is trial 345 with value: 0.13438257115663557.
[I 2024-12-03 18:51:55,111] Trial 871 finished with value: 0.14504044095329918 and parameters: {'kernel': 'linear', 'C': 16.575874615458996, 'gamma': 0.012127572213112312, 'epsilon': 0.12152615316336227}. Best is trial 345 with value: 0.13438257115663557.
[I 2024-12-03 18:51:56,001] Trial 858 finished with value: 0.13814726927072166 and parameters: {'kernel': 'linear', 'C': 19.21242188653726, 'gamma': 0.01220847547782755, 'epsilon': 0.008769377818886787}. Best is trial 345 with value: 0.13438257115663557.
[I 2024-12-03 18:51:56,251] Trial 874 finished with value: 1.3005509656555978 and parameters: {'kernel': 'poly', 'C': 8.29649977150118, 'gamma': 0.0004035280850346346, 'epsilon': 0.35416184586606864}. Best is trial 345 with value: 0.13438257115663557.
[I 2024-12-03 18:51:56,427] Trial 778 finished with value: 0.13566732401788736 and parameters: {'kernel': 'linear', 'C': 98.55706922504118, 'gamma': 0.0007798388170895504, 'epsilon': 0.03699738033764571}. Best is trial 345 with value: 0.13438257115663557.
[I 2024-12-03 18:51:57,183] Trial 862 finished with value: 0.141339583420142 and parameters: {'kernel': 'linear', 'C': 87.38929159459414, 'gamma': 0.0027538014651696486, 'epsilon': 0.09190569800342734}. Best is trial 345 with value: 0.13438257115663557.
[I 2024-12-03 18:51:57,800] Trial 793 finished with value: 0.1364140000218492 and parameters: {'kernel': 'linear', 'C': 86.06176775992779, 'gamma': 0.001094986286016076, 'epsilon': 0.02344336860172049}. Best is trial 345 with value: 0.13438257115663557.
[I 2024-12-03 18:51:58,260] Trial 827 finished with value: 0.135243058479669 and parameters: {'kernel': 'linear', 'C': 74.88561900123324, 'gamma': 0.010768841345177768, 'epsilon': 0.056887757519977024}. Best is trial 345 with value: 0.13438257115663557.
[I 2024-12-03 18:51:58,839] Trial 878 finished with value: 0.16490367644060608 and parameters: {'kernel': 'linear', 'C': 1.1387218590390347, 'gamma': 0.008194331565134475, 'epsilon': 0.12825284532041428}. Best is trial 345 with value: 0.13438257115663557.
[I 2024-12-03 18:51:58,840] Trial 776 finished with value: 0.13723283086495475 and parameters: {'kernel': 'linear', 'C': 97.48937357464497, 'gamma': 0.025208735912929, 'epsilon': 0.022189794601201088}. Best is trial 345 with value: 0.13438257115663557.
[I 2024-12-03 18:52:00,134] Trial 881 finished with value: 0.4666359627977287 and parameters: {'kernel': 'poly', 'C': 0.06629678504986657, 'gamma': 0.05552265533227636, 'epsilon': 0.5862498704356687}. Best is trial 345 with value: 0.13438257115663557.
[I 2024-12-03 18:52:00,136] Trial 837 finished with value: 0.13682699274470045 and parameters: {'kernel': 'linear', 'C': 92.35721972112697, 'gamma': 0.005210284038289192, 'epsilon': 0.07228339296724559}. Best is trial 345 with value: 0.13438257115663557.
[I 2024-12-03 18:52:01,176] Trial 879 finished with value: 0.14643111150724736 and parameters: {'kernel': 'linear', 'C': 16.004082871727146, 'gamma': 0.02108420847950771, 'epsilon': 0.12681351923704207}. Best is trial 345 with value: 0.13438257115663557.
[I 2024-12-03 18:52:01,672] Trial 883 finished with value: 0.9650784703170399 and parameters: {'kernel': 'rbf', 'C': 0.8049723836703733, 'gamma': 0.44803537798724336, 'epsilon': 0.0019273297484786636}. Best is trial 345 with value: 0.13438257115663557.
[I 2024-12-03 18:52:03,018] Trial 880 finished with value: 0.34487867105767633 and parameters: {'kernel': 'poly', 'C': 0.9944245359039702, 'gamma': 0.07423477830778291, 'epsilon': 0.06201994441307759}. Best is trial 345 with value: 0.13438257115663557.
[I 2024-12-03 18:52:03,635] Trial 886 finished with value: 0.21632153848248842 and parameters: {'kernel': 'linear', 'C': 0.09864201117735683, 'gamma': 0.2357851327028151, 'epsilon': 0.002479934470190324}. Best is trial 345 with value: 0.13438257115663557.
[I 2024-12-03 18:52:03,790] Trial 864 finished with value: 0.13486694003524596 and parameters: {'kernel': 'linear', 'C': 24.752966416658968, 'gamma': 0.02480265804192245, 'epsilon': 0.03956250805672011}. Best is trial 345 with value: 0.13438257115663557.
[I 2024-12-03 18:52:05,055] Trial 873 finished with value: 0.1353841982607758 and parameters: {'kernel': 'linear', 'C': 17.846616396175616, 'gamma': 0.0010325950992063169, 'epsilon': 0.05367364133741067}. Best is trial 345 with value: 0.13438257115663557.
[I 2024-12-03 18:52:05,132] Trial 885 finished with value: 0.13477779423469927 and parameters: {'kernel': 'linear', 'C': 8.02780490706818, 'gamma': 0.06439039965033527, 'epsilon': 0.06276212605115974}. Best is trial 345 with value: 0.13438257115663557.
[I 2024-12-03 18:52:05,983] Trial 888 finished with value: 790.5505759721937 and parameters: {'kernel': 'sigmoid', 'C': 60.36612573054446, 'gamma': 0.023882351250377732, 'epsilon': 0.04797039889158285}. Best is trial 345 with value: 0.13438257115663557.
[I 2024-12-03 18:52:07,238] Trial 887 finished with value: 0.13694501408209364 and parameters: {'kernel': 'linear', 'C': 2.429292181694655, 'gamma': 0.0006401287470625749, 'epsilon': 0.038507499846411955}. Best is trial 345 with value: 0.13438257115663557.
[I 2024-12-03 18:52:07,626] Trial 890 finished with value: 0.15162197715637107 and parameters: {'kernel': 'linear', 'C': 1.8613945904480285, 'gamma': 0.021742269132079738, 'epsilon': 0.097695945907794}. Best is trial 345 with value: 0.13438257115663557.
[I 2024-12-03 18:52:08,064] Trial 892 finished with value: 64.2650314073688 and parameters: {'kernel': 'sigmoid', 'C': 4.024751882669162, 'gamma': 0.10117889099517746, 'epsilon': 0.028382882108134794}. Best is trial 345 with value: 0.13438257115663557.
[I 2024-12-03 18:52:09,235] Trial 893 finished with value: 0.3515702762170705 and parameters: {'kernel': 'rbf', 'C': 5.034561121877797, 'gamma': 0.040661188605283394, 'epsilon': 0.011580363332213314}. Best is trial 345 with value: 0.13438257115663557.
[I 2024-12-03 18:52:09,301] Trial 891 finished with value: 0.13557900444538476 and parameters: {'kernel': 'linear', 'C': 3.8789334543877283, 'gamma': 0.18341378122495203, 'epsilon': 0.050056240163875665}. Best is trial 345 with value: 0.13438257115663557.
[I 2024-12-03 18:52:09,893] Trial 895 finished with value: 0.26345978229670525 and parameters: {'kernel': 'linear', 'C': 0.036400403222789174, 'gamma': 0.0006848842718756941, 'epsilon': 0.03918546914462188}. Best is trial 345 with value: 0.13438257115663557.
[I 2024-12-03 18:52:10,997] Trial 894 finished with value: 0.1446793267499192 and parameters: {'kernel': 'linear', 'C': 8.294351701928466, 'gamma': 0.02627221770522212, 'epsilon': 0.11871526536668103}. Best is trial 345 with value: 0.13438257115663557.
[I 2024-12-03 18:52:11,286] Trial 877 finished with value: 0.13731182332186206 and parameters: {'kernel': 'linear', 'C': 10.73284526238013, 'gamma': 0.010059037548301683, 'epsilon': 0.022979942935093124}. Best is trial 345 with value: 0.13438257115663557.
[I 2024-12-03 18:52:12,150] Trial 897 finished with value: 0.1462908634606527 and parameters: {'kernel': 'linear', 'C': 0.6670709198609408, 'gamma': 0.020284482833752154, 'epsilon': 0.03473326953123377}. Best is trial 345 with value: 0.13438257115663557.
[I 2024-12-03 18:52:12,155] Trial 898 finished with value: 0.25979164384885406 and parameters: {'kernel': 'linear', 'C': 1.357843503515286, 'gamma': 0.08931283788941333, 'epsilon': 0.3540784861944557}. Best is trial 345 with value: 0.13438257115663557.
[I 2024-12-03 18:52:12,721] Trial 804 finished with value: 0.13567869634917232 and parameters: {'kernel': 'linear', 'C': 90.96264433306166, 'gamma': 0.01907629304941942, 'epsilon': 0.02718115991165226}. Best is trial 345 with value: 0.13438257115663557.
[I 2024-12-03 18:52:13,520] Trial 899 finished with value: 0.14484937238774792 and parameters: {'kernel': 'linear', 'C': 5.234937067337057, 'gamma': 0.00012063100645774996, 'epsilon': 0.1087099453637519}. Best is trial 345 with value: 0.13438257115663557.
[I 2024-12-03 18:52:13,521] Trial 872 finished with value: 0.1380385052487522 and parameters: {'kernel': 'linear', 'C': 21.76412254991166, 'gamma': 0.05446023969380586, 'epsilon': 0.016774848087653667}. Best is trial 345 with value: 0.13438257115663557.
[I 2024-12-03 18:52:14,501] Trial 900 finished with value: 0.23276642442182738 and parameters: {'kernel': 'linear', 'C': 13.255485972607595, 'gamma': 0.13394353188975722, 'epsilon': 0.33207811913923363}. Best is trial 345 with value: 0.13438257115663557.
[I 2024-12-03 18:52:14,855] Trial 821 finished with value: 0.13521680727298813 and parameters: {'kernel': 'linear', 'C': 87.89613731879112, 'gamma': 0.007263813747887823, 'epsilon': 0.0330933821311376}. Best is trial 345 with value: 0.13438257115663557.
[I 2024-12-03 18:52:15,635] Trial 876 finished with value: 0.13697606544750923 and parameters: {'kernel': 'linear', 'C': 18.55810893123094, 'gamma': 0.012222773273400149, 'epsilon': 0.02281746358246722}. Best is trial 345 with value: 0.13438257115663557.
[I 2024-12-03 18:52:15,637] Trial 792 finished with value: 0.13782554065737296 and parameters: {'kernel': 'linear', 'C': 87.890334448435, 'gamma': 0.00091205450893035, 'epsilon': 0.018242129238665833}. Best is trial 345 with value: 0.13438257115663557.
[I 2024-12-03 18:52:15,678] Trial 875 finished with value: 0.1375453156143894 and parameters: {'kernel': 'linear', 'C': 15.692657695208675, 'gamma': 0.0016522999330272578, 'epsilon': 0.021236262417287297}. Best is trial 345 with value: 0.13438257115663557.
[I 2024-12-03 18:52:16,119] Trial 904 finished with value: 0.150633076310163 and parameters: {'kernel': 'rbf', 'C': 96.54694346706357, 'gamma': 0.0032252884538379184, 'epsilon': 0.0706126798992274}. Best is trial 345 with value: 0.13438257115663557.
[I 2024-12-03 18:52:17,058] Trial 906 finished with value: 0.14927185437158616 and parameters: {'kernel': 'linear', 'C': 4.074095887666503, 'gamma': 0.048832586715537446, 'epsilon': 0.10335830051267353}. Best is trial 345 with value: 0.13438257115663557.
[I 2024-12-03 18:52:17,220] Trial 896 finished with value: 0.13690839402546334 and parameters: {'kernel': 'linear', 'C': 9.970862658567254, 'gamma': 0.12550094812171558, 'epsilon': 0.04902315670304516}. Best is trial 345 with value: 0.13438257115663557.
[I 2024-12-03 18:52:17,836] Trial 908 finished with value: 0.46845712076495677 and parameters: {'kernel': 'sigmoid', 'C': 18.843417057300226, 'gamma': 0.000975364467666376, 'epsilon': 0.1044450340957299}. Best is trial 345 with value: 0.13438257115663557.
[I 2024-12-03 18:52:17,846] Trial 884 finished with value: 0.13542020934366153 and parameters: {'kernel': 'linear', 'C': 30.134924481106083, 'gamma': 0.0013596458578984717, 'epsilon': 0.02837569336739211}. Best is trial 345 with value: 0.13438257115663557.
[I 2024-12-03 18:52:17,979] Trial 909 finished with value: 1.3302827272688584 and parameters: {'kernel': 'rbf', 'C': 0.0019119850715772334, 'gamma': 0.0065657055139157145, 'epsilon': 0.006213804368654421}. Best is trial 345 with value: 0.13438257115663557.
[I 2024-12-03 18:52:19,274] Trial 905 finished with value: 0.14310114665493545 and parameters: {'kernel': 'linear', 'C': 12.96434996122845, 'gamma': 0.08883919343955252, 'epsilon': 0.11518153120503323}. Best is trial 345 with value: 0.13438257115663557.
[I 2024-12-03 18:52:19,715] Trial 911 finished with value: 0.5351152749357815 and parameters: {'kernel': 'poly', 'C': 8.180564206788391, 'gamma': 0.26472753500585183, 'epsilon': 0.802224206684712}. Best is trial 345 with value: 0.13438257115663557.
[I 2024-12-03 18:52:20,096] Trial 912 finished with value: 0.3153809484477731 and parameters: {'kernel': 'linear', 'C': 0.012760069445039041, 'gamma': 0.00010192684134553466, 'epsilon': 0.001604853838554552}. Best is trial 345 with value: 0.13438257115663557.
[I 2024-12-03 18:52:20,510] Trial 824 finished with value: 0.13776164670656452 and parameters: {'kernel': 'linear', 'C': 59.187334820527546, 'gamma': 0.023723777541433365, 'epsilon': 0.01785666432359383}. Best is trial 345 with value: 0.13438257115663557.
[I 2024-12-03 18:52:22,112] Trial 907 finished with value: 0.13612898609820306 and parameters: {'kernel': 'linear', 'C': 6.798516638136108, 'gamma': 0.057261407782049356, 'epsilon': 0.030699280720315598}. Best is trial 345 with value: 0.13438257115663557.
[I 2024-12-03 18:52:22,116] Trial 917 finished with value: 0.4462152183282818 and parameters: {'kernel': 'poly', 'C': 12.443404687089936, 'gamma': 0.008194795269864998, 'epsilon': 0.13078808605001238}. Best is trial 345 with value: 0.13438257115663557.
[I 2024-12-03 18:52:22,117] Trial 822 finished with value: 0.1382077230217724 and parameters: {'kernel': 'linear', 'C': 75.77485936447168, 'gamma': 0.006777668918206783, 'epsilon': 0.015604966530165925}. Best is trial 345 with value: 0.13438257115663557.
[I 2024-12-03 18:52:22,119] Trial 913 finished with value: 0.14113511714496377 and parameters: {'kernel': 'linear', 'C': 11.310073237549332, 'gamma': 0.0003402330569641847, 'epsilon': 0.09143443046848432}. Best is trial 345 with value: 0.13438257115663557.
[I 2024-12-03 18:52:22,252] Trial 853 finished with value: 0.13502020436918027 and parameters: {'kernel': 'linear', 'C': 94.0737644966247, 'gamma': 0.0025109712762296592, 'epsilon': 0.06252470828954154}. Best is trial 345 with value: 0.13438257115663557.
[I 2024-12-03 18:52:22,964] Trial 889 finished with value: 0.13566798702960176 and parameters: {'kernel': 'linear', 'C': 24.201166014046816, 'gamma': 0.018306545349135388, 'epsilon': 0.03380478548269132}. Best is trial 345 with value: 0.13438257115663557.
[I 2024-12-03 18:52:24,627] Trial 920 finished with value: 0.16239120541475138 and parameters: {'kernel': 'linear', 'C': 25.472408483546726, 'gamma': 0.0011528008159803894, 'epsilon': 0.1717097122590362}. Best is trial 345 with value: 0.13438257115663557.
[I 2024-12-03 18:52:24,710] Trial 915 finished with value: 0.13924394763497805 and parameters: {'kernel': 'linear', 'C': 11.711067975533203, 'gamma': 0.0024285057511735856, 'epsilon': 0.08387390405431006}. Best is trial 345 with value: 0.13438257115663557.
[I 2024-12-03 18:52:25,118] Trial 919 finished with value: 0.14187262230803221 and parameters: {'kernel': 'linear', 'C': 1.1428774834935775, 'gamma': 0.10986548759938566, 'epsilon': 0.05754266697783959}. Best is trial 345 with value: 0.13438257115663557.
[I 2024-12-03 18:52:25,401] Trial 924 finished with value: 0.8264668114958267 and parameters: {'kernel': 'rbf', 'C': 0.9064933628935419, 'gamma': 0.2494844129271668, 'epsilon': 0.12282288587547462}. Best is trial 345 with value: 0.13438257115663557.
[I 2024-12-03 18:52:25,776] Trial 901 finished with value: 0.13569204464168952 and parameters: {'kernel': 'linear', 'C': 8.555400110341541, 'gamma': 0.04193956670998571, 'epsilon': 0.027864668285449506}. Best is trial 345 with value: 0.13438257115663557.
[I 2024-12-03 18:52:25,983] Trial 910 finished with value: 0.13592300537354576 and parameters: {'kernel': 'linear', 'C': 10.235281366217398, 'gamma': 0.00013345639387224448, 'epsilon': 0.05651602484242672}. Best is trial 345 with value: 0.13438257115663557.
[I 2024-12-03 18:52:26,705] Trial 903 finished with value: 0.13701284137588268 and parameters: {'kernel': 'linear', 'C': 18.680389641959835, 'gamma': 0.10778696054508573, 'epsilon': 0.04592013414912013}. Best is trial 345 with value: 0.13438257115663557.
[I 2024-12-03 18:52:27,082] Trial 923 finished with value: 0.14910230606214867 and parameters: {'kernel': 'linear', 'C': 25.79266115334497, 'gamma': 0.0062153393009858095, 'epsilon': 0.14128714505302642}. Best is trial 345 with value: 0.13438257115663557.
[I 2024-12-03 18:52:28,398] Trial 845 finished with value: 0.13542233533890635 and parameters: {'kernel': 'linear', 'C': 89.5097041618959, 'gamma': 0.0035924938188456918, 'epsilon': 0.028584290257125538}. Best is trial 345 with value: 0.13438257115663557.
[I 2024-12-03 18:52:28,734] Trial 931 finished with value: 0.39282232952701873 and parameters: {'kernel': 'linear', 'C': 0.003186506244632531, 'gamma': 0.0001302623579357417, 'epsilon': 0.09162154393104271}. Best is trial 345 with value: 0.13438257115663557.
[I 2024-12-03 18:52:30,444] Trial 902 finished with value: 0.13561241490712053 and parameters: {'kernel': 'linear', 'C': 20.780087442273015, 'gamma': 0.04533926282546456, 'epsilon': 0.03714792171172876}. Best is trial 345 with value: 0.13438257115663557.
[I 2024-12-03 18:52:30,577] Trial 925 finished with value: 0.16322999932865914 and parameters: {'kernel': 'linear', 'C': 85.40599187582043, 'gamma': 0.008101037352883563, 'epsilon': 0.17163316890327993}. Best is trial 345 with value: 0.13438257115663557.
[I 2024-12-03 18:52:31,418] Trial 930 finished with value: 0.13548293212534407 and parameters: {'kernel': 'linear', 'C': 4.820379982216386, 'gamma': 0.042040821010633486, 'epsilon': 0.05395751907050997}. Best is trial 345 with value: 0.13438257115663557.
