[I 2024-12-04 00:12:46,112] Trial 854 finished with value: 0.25606852856925455 and parameters: {'kernel': 'rbf', 'C': 11.218207875244062, 'gamma': 0.005700308434695853, 'epsilon': 0.0010293553866715386}. Best is trial 448 with value: 0.13989258940934515.
[I 2024-12-04 00:12:48,136] Trial 859 finished with value: 0.7101079059366413 and parameters: {'kernel': 'poly', 'C': 98.13638368542516, 'gamma': 0.0036288697536196158, 'epsilon': 0.0027981680468324305}. Best is trial 448 with value: 0.13989258940934515.
[I 2024-12-04 00:12:48,136] Trial 860 finished with value: 1133.8860237779909 and parameters: {'kernel': 'sigmoid', 'C': 59.6654372185979, 'gamma': 0.02092482070697896, 'epsilon': 0.001385182677382391}. Best is trial 448 with value: 0.13989258940934515.
[I 2024-12-04 00:12:48,311] Trial 853 finished with value: 0.1573034059048444 and parameters: {'kernel': 'rbf', 'C': 99.15482281790237, 'gamma': 0.012920182130439509, 'epsilon': 0.0015424274358833518}. Best is trial 448 with value: 0.13989258940934515.
[I 2024-12-04 00:12:49,661] Trial 858 finished with value: 0.17918963677083394 and parameters: {'kernel': 'rbf', 'C': 98.84613702968282, 'gamma': 0.003180137926726547, 'epsilon': 0.0030175717846525492}. Best is trial 448 with value: 0.13989258940934515.
[I 2024-12-04 00:12:49,863] Trial 857 finished with value: 0.1427014278564636 and parameters: {'kernel': 'rbf', 'C': 92.14310824916392, 'gamma': 0.010394286459680263, 'epsilon': 0.0010101625196041533}. Best is trial 448 with value: 0.13989258940934515.
[I 2024-12-04 00:12:49,865] Trial 862 finished with value: 0.15772137487132262 and parameters: {'kernel': 'rbf', 'C': 13.820577147088965, 'gamma': 0.020954428399675932, 'epsilon': 0.001036054109577291}. Best is trial 448 with value: 0.13989258940934515.
[I 2024-12-04 00:12:50,058] Trial 861 finished with value: 0.15385674529756352 and parameters: {'kernel': 'rbf', 'C': 19.424942282844466, 'gamma': 0.026590515018201623, 'epsilon': 0.003113403427354466}. Best is trial 448 with value: 0.13989258940934515.
[I 2024-12-04 00:12:50,292] Trial 856 finished with value: 0.16519934305946604 and parameters: {'kernel': 'rbf', 'C': 98.27046244365346, 'gamma': 0.015067341954466677, 'epsilon': 0.0018148031852010659}. Best is trial 448 with value: 0.13989258940934515.
[I 2024-12-04 00:12:51,082] Trial 863 finished with value: 0.2784287650223798 and parameters: {'kernel': 'rbf', 'C': 24.489191569428808, 'gamma': 0.001667991185210476, 'epsilon': 0.0011238386697401093}. Best is trial 448 with value: 0.13989258940934515.
[I 2024-12-04 00:12:51,749] Trial 868 finished with value: 0.48963870815550736 and parameters: {'kernel': 'linear', 'C': 0.017606642242697666, 'gamma': 0.0036576901822994515, 'epsilon': 0.5239214989514895}. Best is trial 448 with value: 0.13989258940934515.
[I 2024-12-04 00:12:52,219] Trial 864 finished with value: 0.14013380178388068 and parameters: {'kernel': 'rbf', 'C': 97.22363697077894, 'gamma': 0.009129276722711886, 'epsilon': 0.0024595906491958314}. Best is trial 448 with value: 0.13989258940934515.
[I 2024-12-04 00:12:52,770] Trial 865 finished with value: 0.17770774509869672 and parameters: {'kernel': 'rbf', 'C': 19.124502720169904, 'gamma': 0.03686934268900478, 'epsilon': 0.001036966002443296}. Best is trial 448 with value: 0.13989258940934515.
[I 2024-12-04 00:12:53,560] Trial 870 finished with value: 0.9699659016678505 and parameters: {'kernel': 'sigmoid', 'C': 0.001011542322174289, 'gamma': 0.07463335464522153, 'epsilon': 0.025544791708540623}. Best is trial 448 with value: 0.13989258940934515.
[I 2024-12-04 00:12:53,561] Trial 867 finished with value: 0.19075773578514263 and parameters: {'kernel': 'rbf', 'C': 97.34139454030847, 'gamma': 0.002799415319426376, 'epsilon': 0.0017616033086146933}. Best is trial 448 with value: 0.13989258940934515.
[I 2024-12-04 00:12:54,347] Trial 866 finished with value: 0.15927362947823823 and parameters: {'kernel': 'rbf', 'C': 89.6016542979399, 'gamma': 0.004629329904686498, 'epsilon': 0.001045201853836802}. Best is trial 448 with value: 0.13989258940934515.
[I 2024-12-04 00:12:54,507] Trial 550 finished with value: 0.3523077004960988 and parameters: {'kernel': 'linear', 'C': 72.26828948734769, 'gamma': 0.0006266793381644466, 'epsilon': 0.0012725660065776884}. Best is trial 448 with value: 0.13989258940934515.
[I 2024-12-04 00:12:55,081] Trial 872 finished with value: 0.252047081370945 and parameters: {'kernel': 'rbf', 'C': 15.22218203743112, 'gamma': 0.00478601911969219, 'epsilon': 0.0025691897467513287}. Best is trial 448 with value: 0.13989258940934515.
[I 2024-12-04 00:12:55,226] Trial 874 finished with value: 0.2398842212183207 and parameters: {'kernel': 'rbf', 'C': 13.713889280921022, 'gamma': 0.006648160225147672, 'epsilon': 0.0011210002644111848}. Best is trial 448 with value: 0.13989258940934515.
[I 2024-12-04 00:12:55,235] Trial 873 finished with value: 0.9844203698386919 and parameters: {'kernel': 'rbf', 'C': 0.0011449817345522996, 'gamma': 0.0033471009415845456, 'epsilon': 0.0450068094164793}. Best is trial 448 with value: 0.13989258940934515.
[I 2024-12-04 00:12:56,684] Trial 871 finished with value: 0.14031916359981522 and parameters: {'kernel': 'rbf', 'C': 90.03160400682678, 'gamma': 0.009168907008204509, 'epsilon': 0.0031352656668869085}. Best is trial 448 with value: 0.13989258940934515.
[I 2024-12-04 00:12:57,104] Trial 875 finished with value: 0.16147194653784816 and parameters: {'kernel': 'rbf', 'C': 96.82294208492273, 'gamma': 0.0041786796197190645, 'epsilon': 0.001574199684461862}. Best is trial 448 with value: 0.13989258940934515.
[I 2024-12-04 00:12:59,883] Trial 883 finished with value: 0.26139793329751176 and parameters: {'kernel': 'rbf', 'C': 17.780879853746335, 'gamma': 0.0033012258824814105, 'epsilon': 0.0025339000795685834}. Best is trial 448 with value: 0.13989258940934515.
[I 2024-12-04 00:12:59,931] Trial 881 finished with value: 0.1914842433691701 and parameters: {'kernel': 'rbf', 'C': 96.34129713563402, 'gamma': 0.0027948139236760572, 'epsilon': 0.001279482518187991}. Best is trial 448 with value: 0.13989258940934515.
[I 2024-12-04 00:13:00,914] Trial 383 finished with value: 0.35289374241035765 and parameters: {'kernel': 'linear', 'C': 97.16143189391697, 'gamma': 0.01911391882625352, 'epsilon': 0.00928469066463862}. Best is trial 448 with value: 0.13989258940934515.
[I 2024-12-04 00:13:01,609] Trial 880 finished with value: 0.14213660598712632 and parameters: {'kernel': 'rbf', 'C': 89.3034178479646, 'gamma': 0.006967572719131277, 'epsilon': 0.001101856042063691}. Best is trial 448 with value: 0.13989258940934515.
[I 2024-12-04 00:13:01,673] Trial 879 finished with value: 0.14050280053959557 and parameters: {'kernel': 'rbf', 'C': 87.63318412448304, 'gamma': 0.00836407368581201, 'epsilon': 0.0010809724747929403}. Best is trial 448 with value: 0.13989258940934515.
[I 2024-12-04 00:13:02,765] Trial 885 finished with value: 0.21078031479370263 and parameters: {'kernel': 'rbf', 'C': 16.62299016271783, 'gamma': 0.008470853335218026, 'epsilon': 0.002262513816203119}. Best is trial 448 with value: 0.13989258940934515.
[I 2024-12-04 00:13:04,319] Trial 878 finished with value: 0.18733423518996278 and parameters: {'kernel': 'rbf', 'C': 98.89915956918666, 'gamma': 0.03307056738068614, 'epsilon': 0.0014538851358049765}. Best is trial 448 with value: 0.13989258940934515.
[I 2024-12-04 00:13:05,395] Trial 884 finished with value: 0.1562120989621604 and parameters: {'kernel': 'rbf', 'C': 99.77418906743931, 'gamma': 0.012712303021143472, 'epsilon': 0.003147017802459428}. Best is trial 448 with value: 0.13989258940934515.
[I 2024-12-04 00:13:06,195] Trial 890 finished with value: 215.78678883083623 and parameters: {'kernel': 'sigmoid', 'C': 72.04797556383991, 'gamma': 0.0026456926399080834, 'epsilon': 0.0010682684516023974}. Best is trial 448 with value: 0.13989258940934515.
[I 2024-12-04 00:13:07,121] Trial 891 finished with value: 0.6335573524412933 and parameters: {'kernel': 'linear', 'C': 0.0011519349079281058, 'gamma': 0.0011345178740356445, 'epsilon': 0.00405506582110464}. Best is trial 448 with value: 0.13989258940934515.
[I 2024-12-04 00:13:07,167] Trial 882 finished with value: 0.20195952268896133 and parameters: {'kernel': 'rbf', 'C': 97.40454649786649, 'gamma': 0.044746134901556545, 'epsilon': 0.0037601220292441864}. Best is trial 448 with value: 0.13989258940934515.
[I 2024-12-04 00:13:07,178] Trial 887 finished with value: 0.14787336372880724 and parameters: {'kernel': 'rbf', 'C': 56.25167224979023, 'gamma': 0.013494837942355798, 'epsilon': 0.0010906873963870776}. Best is trial 448 with value: 0.13989258940934515.
[I 2024-12-04 00:13:07,434] Trial 886 finished with value: 0.17537584523328895 and parameters: {'kernel': 'rbf', 'C': 50.43613632828301, 'gamma': 0.027019090841181696, 'epsilon': 0.001081509025857772}. Best is trial 448 with value: 0.13989258940934515.
[I 2024-12-04 00:13:09,837] Trial 889 finished with value: 0.33908845636126966 and parameters: {'kernel': 'linear', 'C': 0.9327791648036311, 'gamma': 0.026745680643773063, 'epsilon': 0.00800326801623567}. Best is trial 448 with value: 0.13989258940934515.
[I 2024-12-04 00:13:10,335] Trial 892 finished with value: 0.17519465979939086 and parameters: {'kernel': 'rbf', 'C': 34.83885946959655, 'gamma': 0.03030844894032127, 'epsilon': 0.001010119229001478}. Best is trial 448 with value: 0.13989258940934515.
[I 2024-12-04 00:13:10,747] Trial 888 finished with value: 0.1728215516672239 and parameters: {'kernel': 'rbf', 'C': 99.44534017686208, 'gamma': 0.021446041814053875, 'epsilon': 0.0018026541413667405}. Best is trial 448 with value: 0.13989258940934515.
[I 2024-12-04 00:13:11,458] Trial 895 finished with value: 0.17976326400638562 and parameters: {'kernel': 'rbf', 'C': 93.1330730728598, 'gamma': 0.0032829512379572794, 'epsilon': 0.0014770923215441166}. Best is trial 448 with value: 0.13989258940934515.
[I 2024-12-04 00:13:12,114] Trial 897 finished with value: 0.2625692287546924 and parameters: {'kernel': 'rbf', 'C': 6.482500414696318, 'gamma': 0.007868486902112467, 'epsilon': 0.0010497448288549597}. Best is trial 448 with value: 0.13989258940934515.
[I 2024-12-04 00:13:12,566] Trial 893 finished with value: 0.14129781645634062 and parameters: {'kernel': 'rbf', 'C': 78.46406469428194, 'gamma': 0.007960102303915306, 'epsilon': 0.0011987193703567097}. Best is trial 448 with value: 0.13989258940934515.
[I 2024-12-04 00:13:12,596] Trial 894 finished with value: 0.14974285442714533 and parameters: {'kernel': 'rbf', 'C': 90.60415352404853, 'gamma': 0.005767331237559516, 'epsilon': 0.0024809982143044725}. Best is trial 448 with value: 0.13989258940934515.
[I 2024-12-04 00:13:12,884] Trial 898 finished with value: 0.23177955707546705 and parameters: {'kernel': 'rbf', 'C': 98.18919971536748, 'gamma': 0.0013005177368593654, 'epsilon': 0.003063978055796513}. Best is trial 448 with value: 0.13989258940934515.
[I 2024-12-04 00:13:13,034] Trial 899 finished with value: 0.31870272154317597 and parameters: {'kernel': 'rbf', 'C': 12.62225008472155, 'gamma': 0.0016577350082826003, 'epsilon': 0.0019195596191402735}. Best is trial 448 with value: 0.13989258940934515.
[I 2024-12-04 00:13:13,504] Trial 896 finished with value: 0.14342155264661732 and parameters: {'kernel': 'rbf', 'C': 73.63960812638162, 'gamma': 0.010448317941158069, 'epsilon': 0.0010793612385140165}. Best is trial 448 with value: 0.13989258940934515.
[I 2024-12-04 00:13:13,741] Trial 900 finished with value: 0.2720060960060465 and parameters: {'kernel': 'rbf', 'C': 15.585192223813822, 'gamma': 0.0028875640076256722, 'epsilon': 0.0011906017817653897}. Best is trial 448 with value: 0.13989258940934515.
[I 2024-12-04 00:13:14,649] Trial 901 finished with value: 0.37100839659775103 and parameters: {'kernel': 'rbf', 'C': 10.780609089563272, 'gamma': 0.0010681216670461434, 'epsilon': 0.0010518141777585428}. Best is trial 448 with value: 0.13989258940934515.
[I 2024-12-04 00:13:15,397] Trial 903 finished with value: 0.19914235320379406 and parameters: {'kernel': 'rbf', 'C': 9.473745542744695, 'gamma': 0.014733018390162025, 'epsilon': 0.002699642681564655}. Best is trial 448 with value: 0.13989258940934515.
[I 2024-12-04 00:13:16,787] Trial 904 finished with value: 0.2202539983002065 and parameters: {'kernel': 'rbf', 'C': 19.701628445611796, 'gamma': 0.006596942191860617, 'epsilon': 0.0032591960063345538}. Best is trial 448 with value: 0.13989258940934515.
[I 2024-12-04 00:13:17,196] Trial 907 finished with value: 0.26014536708973474 and parameters: {'kernel': 'rbf', 'C': 17.63763257879267, 'gamma': 0.0034295156108460553, 'epsilon': 0.0025412802477321372}. Best is trial 448 with value: 0.13989258940934515.
[I 2024-12-04 00:13:17,225] Trial 384 finished with value: 0.35254739056110246 and parameters: {'kernel': 'linear', 'C': 99.18369005575974, 'gamma': 0.007535035581395405, 'epsilon': 0.0017818475707725965}. Best is trial 448 with value: 0.13989258940934515.
[I 2024-12-04 00:13:18,181] Trial 908 finished with value: 0.2515737022217626 and parameters: {'kernel': 'rbf', 'C': 16.12089559090337, 'gamma': 0.004606717472457048, 'epsilon': 0.0027282283396033195}. Best is trial 448 with value: 0.13989258940934515.
[I 2024-12-04 00:13:18,430] Trial 902 finished with value: 0.14917636809377025 and parameters: {'kernel': 'rbf', 'C': 91.17738948235493, 'gamma': 0.01179165425080639, 'epsilon': 0.00128853128304886}. Best is trial 448 with value: 0.13989258940934515.
[I 2024-12-04 00:13:19,598] Trial 906 finished with value: 0.14810163536947127 and parameters: {'kernel': 'rbf', 'C': 99.18590453971808, 'gamma': 0.005734081690858066, 'epsilon': 0.0024198024026750448}. Best is trial 448 with value: 0.13989258940934515.
[I 2024-12-04 00:13:19,968] Trial 909 finished with value: 0.1562660521891723 and parameters: {'kernel': 'rbf', 'C': 94.14514413051953, 'gamma': 0.004749032630489925, 'epsilon': 0.0010468104606213657}. Best is trial 448 with value: 0.13989258940934515.
[I 2024-12-04 00:13:20,414] Trial 905 finished with value: 0.1636361308628267 and parameters: {'kernel': 'rbf', 'C': 93.99924152342719, 'gamma': 0.01492750221202079, 'epsilon': 0.0010234722523223727}. Best is trial 448 with value: 0.13989258940934515.
[I 2024-12-04 00:13:21,564] Trial 911 finished with value: 0.21463138537704124 and parameters: {'kernel': 'rbf', 'C': 18.12683246309908, 'gamma': 0.007546093739772089, 'epsilon': 0.0010591235467721897}. Best is trial 448 with value: 0.13989258940934515.
[I 2024-12-04 00:13:21,713] Trial 912 finished with value: 0.18811775792790117 and parameters: {'kernel': 'rbf', 'C': 12.674646737588388, 'gamma': 0.047261876932231064, 'epsilon': 0.002819519942133186}. Best is trial 448 with value: 0.13989258940934515.
[I 2024-12-04 00:13:22,016] Trial 916 finished with value: 313.69625462504735 and parameters: {'kernel': 'sigmoid', 'C': 20.600724986900545, 'gamma': 0.013068406713550309, 'epsilon': 0.0046760294050596524}. Best is trial 448 with value: 0.13989258940934515.
[I 2024-12-04 00:13:22,130] Trial 914 finished with value: 0.1662303675481131 and parameters: {'kernel': 'rbf', 'C': 19.412269085379858, 'gamma': 0.013092605730754174, 'epsilon': 0.0028676294907216235}. Best is trial 448 with value: 0.13989258940934515.
[I 2024-12-04 00:13:24,027] Trial 913 finished with value: 0.16284319465232952 and parameters: {'kernel': 'rbf', 'C': 85.83722289648794, 'gamma': 0.01544562862818699, 'epsilon': 0.0010385709508584202}. Best is trial 448 with value: 0.13989258940934515.
[I 2024-12-04 00:13:24,240] Trial 917 finished with value: 0.18953381533932367 and parameters: {'kernel': 'rbf', 'C': 96.59733220188618, 'gamma': 0.002844568715015855, 'epsilon': 0.005401897089804044}. Best is trial 448 with value: 0.13989258940934515.
[I 2024-12-04 00:13:24,241] Trial 918 finished with value: 0.2685120677130287 and parameters: {'kernel': 'rbf', 'C': 1.1875687235101346, 'gamma': 0.07871929074583012, 'epsilon': 0.003193135878888309}. Best is trial 448 with value: 0.13989258940934515.
[I 2024-12-04 00:13:25,849] Trial 920 finished with value: 0.22281093094935636 and parameters: {'kernel': 'rbf', 'C': 97.22062797913, 'gamma': 0.0015873823441367731, 'epsilon': 0.001097420931109255}. Best is trial 448 with value: 0.13989258940934515.
[I 2024-12-04 00:13:26,312] Trial 919 finished with value: 0.16115203675088244 and parameters: {'kernel': 'rbf', 'C': 97.6079230395295, 'gamma': 0.004162790137747939, 'epsilon': 0.002593225836125528}. Best is trial 448 with value: 0.13989258940934515.
[I 2024-12-04 00:13:26,645] Trial 924 finished with value: 379.5134108277941 and parameters: {'kernel': 'sigmoid', 'C': 16.600321749423372, 'gamma': 0.04108756463486407, 'epsilon': 0.0010707027908588545}. Best is trial 448 with value: 0.13989258940934515.
[I 2024-12-04 00:13:26,897] Trial 923 finished with value: 0.21953532082181298 and parameters: {'kernel': 'rbf', 'C': 16.07200124959025, 'gamma': 0.007859525147277217, 'epsilon': 0.0021896068504025203}. Best is trial 448 with value: 0.13989258940934515.
[I 2024-12-04 00:13:26,898] Trial 922 finished with value: 0.20969443858164546 and parameters: {'kernel': 'rbf', 'C': 27.8860202097155, 'gamma': 0.0056389212452796576, 'epsilon': 0.0010183676358577745}. Best is trial 448 with value: 0.13989258940934515.
[I 2024-12-04 00:13:27,230] Trial 921 finished with value: 0.15873087239112182 and parameters: {'kernel': 'rbf', 'C': 28.95320673042452, 'gamma': 0.025074721160920358, 'epsilon': 0.0033990225759644075}. Best is trial 448 with value: 0.13989258940934515.
[I 2024-12-04 00:13:27,308] Trial 915 finished with value: 0.15869870791996285 and parameters: {'kernel': 'rbf', 'C': 96.22994552159851, 'gamma': 0.013418339024056704, 'epsilon': 0.001839207183242739}. Best is trial 448 with value: 0.13989258940934515.
[I 2024-12-04 00:13:29,689] Trial 929 finished with value: 1.0606296019419261 and parameters: {'kernel': 'sigmoid', 'C': 0.33914842186476035, 'gamma': 0.0040806874150527495, 'epsilon': 0.014585323829049706}. Best is trial 448 with value: 0.13989258940934515.
[I 2024-12-04 00:13:30,048] Trial 926 finished with value: 0.14770018602226118 and parameters: {'kernel': 'rbf', 'C': 23.538586728930508, 'gamma': 0.018373384073381984, 'epsilon': 0.0030249916187969537}. Best is trial 448 with value: 0.13989258940934515.
[I 2024-12-04 00:13:30,219] Trial 925 finished with value: 0.21581631985076802 and parameters: {'kernel': 'rbf', 'C': 92.08042358373542, 'gamma': 0.06601593096338283, 'epsilon': 0.0033406161150652384}. Best is trial 448 with value: 0.13989258940934515.
[I 2024-12-04 00:13:30,665] Trial 928 finished with value: 797.0827792604555 and parameters: {'kernel': 'sigmoid', 'C': 77.09201782193357, 'gamma': 0.0074799343446271, 'epsilon': 0.0017281360721077227}. Best is trial 448 with value: 0.13989258940934515.
[I 2024-12-04 00:13:32,420] Trial 932 finished with value: 0.9537080508115338 and parameters: {'kernel': 'poly', 'C': 0.2234861943497041, 'gamma': 0.002051645347288914, 'epsilon': 0.7723828025820166}. Best is trial 448 with value: 0.13989258940934515.
[I 2024-12-04 00:13:32,766] Trial 933 finished with value: 0.16950427281551497 and parameters: {'kernel': 'rbf', 'C': 17.59819879231251, 'gamma': 0.013487182626765317, 'epsilon': 0.002942496618128631}. Best is trial 448 with value: 0.13989258940934515.
[I 2024-12-04 00:13:33,948] Trial 934 finished with value: 0.25309062193946524 and parameters: {'kernel': 'rbf', 'C': 12.377056905706306, 'gamma': 0.00560859083578721, 'epsilon': 0.0010237088847904585}. Best is trial 448 with value: 0.13989258940934515.
[I 2024-12-04 00:13:34,538] Trial 931 finished with value: 0.1431863993318002 and parameters: {'kernel': 'rbf', 'C': 98.19197467747459, 'gamma': 0.010584644042768881, 'epsilon': 0.0015410818788906284}. Best is trial 448 with value: 0.13989258940934515.
[I 2024-12-04 00:13:35,219] Trial 930 finished with value: 0.16773562624164456 and parameters: {'kernel': 'rbf', 'C': 89.75373502900109, 'gamma': 0.01809926615382172, 'epsilon': 0.0033488245499159798}. Best is trial 448 with value: 0.13989258940934515.
[I 2024-12-04 00:13:35,738] Trial 935 finished with value: 0.1819033890472709 and parameters: {'kernel': 'rbf', 'C': 93.20078018268006, 'gamma': 0.0032048113750661415, 'epsilon': 0.0010981920453335013}. Best is trial 448 with value: 0.13989258940934515.
[I 2024-12-04 00:13:36,789] Trial 927 finished with value: 0.18000235207340107 and parameters: {'kernel': 'rbf', 'C': 97.62175996933296, 'gamma': 0.02629736351029987, 'epsilon': 0.0010999079335543371}. Best is trial 448 with value: 0.13989258940934515.
[I 2024-12-04 00:13:37,120] Trial 938 finished with value: 0.1551494644680376 and parameters: {'kernel': 'rbf', 'C': 16.983947748088845, 'gamma': 0.01820253733688468, 'epsilon': 0.001037652493016813}. Best is trial 448 with value: 0.13989258940934515.
[I 2024-12-04 00:13:37,846] Trial 939 finished with value: 0.20390525447103444 and parameters: {'kernel': 'rbf', 'C': 22.75145464643821, 'gamma': 0.007197219366563196, 'epsilon': 0.003999567121231619}. Best is trial 448 with value: 0.13989258940934515.
[I 2024-12-04 00:13:38,332] Trial 937 finished with value: 0.14476766202560587 and parameters: {'kernel': 'rbf', 'C': 98.831356263372, 'gamma': 0.010767876949393644, 'epsilon': 0.0011762499956801085}. Best is trial 448 with value: 0.13989258940934515.
[I 2024-12-04 00:13:40,125] Trial 944 finished with value: 0.2780289774883836 and parameters: {'kernel': 'rbf', 'C': 16.584435518699774, 'gamma': 0.0023229533096003506, 'epsilon': 0.0032675627549740853}. Best is trial 448 with value: 0.13989258940934515.
[I 2024-12-04 00:13:40,715] Trial 910 finished with value: 0.328475534257229 and parameters: {'kernel': 'linear', 'C': 27.53965774948552, 'gamma': 0.05117741772888018, 'epsilon': 0.2817498314535303}. Best is trial 448 with value: 0.13989258940934515.
