[I 2024-12-04 12:46:48,340] Trial 861 finished with value: 0.21075016856694193 and parameters: {'n_estimators': 1471, 'learning_rate': 0.08407647196762669, 'max_depth': 10, 'min_samples_split': 20, 'min_samples_leaf': 1, 'subsample': 0.6410099885960858, 'max_features': 'sqrt'}. Best is trial 784 with value: 0.199214954455861.
[I 2024-12-04 12:46:49,260] Trial 862 finished with value: 0.23018004056416025 and parameters: {'n_estimators': 1434, 'learning_rate': 0.04237428869124161, 'max_depth': 12, 'min_samples_split': 20, 'min_samples_leaf': 1, 'subsample': 0.6560249087590506, 'max_features': 'sqrt'}. Best is trial 784 with value: 0.199214954455861.
[I 2024-12-04 12:46:49,633] Trial 886 finished with value: 0.38517640275728565 and parameters: {'n_estimators': 573, 'learning_rate': 0.04560139584657753, 'max_depth': 8, 'min_samples_split': 11, 'min_samples_leaf': 9, 'subsample': 0.6065375697286087, 'max_features': None}. Best is trial 784 with value: 0.199214954455861.
[I 2024-12-04 12:46:54,003] Trial 871 finished with value: 0.2297163943776478 and parameters: {'n_estimators': 1228, 'learning_rate': 0.07058048674299511, 'max_depth': 12, 'min_samples_split': 15, 'min_samples_leaf': 2, 'subsample': 0.681371210123915, 'max_features': 'sqrt'}. Best is trial 784 with value: 0.199214954455861.
[I 2024-12-04 12:46:56,267] Trial 865 finished with value: 0.21754770853621605 and parameters: {'n_estimators': 1461, 'learning_rate': 0.06573270195851035, 'max_depth': 11, 'min_samples_split': 12, 'min_samples_leaf': 1, 'subsample': 0.6237504651263098, 'max_features': 'sqrt'}. Best is trial 784 with value: 0.199214954455861.
[I 2024-12-04 12:46:57,872] Trial 873 finished with value: 0.21606252186568195 and parameters: {'n_estimators': 1189, 'learning_rate': 0.07842362798092467, 'max_depth': 12, 'min_samples_split': 19, 'min_samples_leaf': 1, 'subsample': 0.6082372900000651, 'max_features': 'sqrt'}. Best is trial 784 with value: 0.199214954455861.
[I 2024-12-04 12:47:02,838] Trial 879 finished with value: 0.5049777205290763 and parameters: {'n_estimators': 1124, 'learning_rate': 0.013114631591974363, 'max_depth': 12, 'min_samples_split': 10, 'min_samples_leaf': 5, 'subsample': 0.8001386155190054, 'max_features': 'log2'}. Best is trial 784 with value: 0.199214954455861.
[I 2024-12-04 12:47:03,822] Trial 875 finished with value: 0.24452222807842927 and parameters: {'n_estimators': 1195, 'learning_rate': 0.05842083539569364, 'max_depth': 12, 'min_samples_split': 9, 'min_samples_leaf': 2, 'subsample': 0.6386736562114838, 'max_features': 'sqrt'}. Best is trial 784 with value: 0.199214954455861.
[I 2024-12-04 12:47:07,132] Trial 880 finished with value: 0.2315736212613491 and parameters: {'n_estimators': 1119, 'learning_rate': 0.07206017959709718, 'max_depth': 11, 'min_samples_split': 11, 'min_samples_leaf': 1, 'subsample': 0.600521806883283, 'max_features': 'sqrt'}. Best is trial 784 with value: 0.199214954455861.
[I 2024-12-04 12:47:08,691] Trial 872 finished with value: 0.29147841933748075 and parameters: {'n_estimators': 1450, 'learning_rate': 0.06325062671237582, 'max_depth': 12, 'min_samples_split': 15, 'min_samples_leaf': 3, 'subsample': 0.7253503329940589, 'max_features': 'log2'}. Best is trial 784 with value: 0.199214954455861.
[I 2024-12-04 12:47:08,693] Trial 881 finished with value: 0.599429843145133 and parameters: {'n_estimators': 1136, 'learning_rate': 0.014458193805927876, 'max_depth': 3, 'min_samples_split': 8, 'min_samples_leaf': 7, 'subsample': 0.859627365057687, 'max_features': 'log2'}. Best is trial 784 with value: 0.199214954455861.
[I 2024-12-04 12:47:11,203] Trial 882 finished with value: 0.22593873024965996 and parameters: {'n_estimators': 1113, 'learning_rate': 0.0942478352623015, 'max_depth': 11, 'min_samples_split': 9, 'min_samples_leaf': 1, 'subsample': 0.7402873033741881, 'max_features': 'sqrt'}. Best is trial 784 with value: 0.199214954455861.
[I 2024-12-04 12:47:11,487] Trial 877 finished with value: 0.23412363024572938 and parameters: {'n_estimators': 1263, 'learning_rate': 0.09969104372905592, 'max_depth': 11, 'min_samples_split': 11, 'min_samples_leaf': 1, 'subsample': 0.6540453305572383, 'max_features': 'sqrt'}. Best is trial 784 with value: 0.199214954455861.
[I 2024-12-04 12:47:13,034] Trial 876 finished with value: 0.2310990504098318 and parameters: {'n_estimators': 1297, 'learning_rate': 0.08560394196987747, 'max_depth': 12, 'min_samples_split': 8, 'min_samples_leaf': 2, 'subsample': 0.6098182438571271, 'max_features': 'sqrt'}. Best is trial 784 with value: 0.199214954455861.
[I 2024-12-04 12:47:13,395] Trial 883 finished with value: 0.2230217584189619 and parameters: {'n_estimators': 1096, 'learning_rate': 0.08230446496881207, 'max_depth': 12, 'min_samples_split': 11, 'min_samples_leaf': 1, 'subsample': 0.6022094129266795, 'max_features': 'sqrt'}. Best is trial 784 with value: 0.199214954455861.
[I 2024-12-04 12:47:16,264] Trial 874 finished with value: 0.28407327413028205 and parameters: {'n_estimators': 1293, 'learning_rate': 0.050457701674791126, 'max_depth': 12, 'min_samples_split': 12, 'min_samples_leaf': 3, 'subsample': 0.6509374762573342, 'max_features': None}. Best is trial 784 with value: 0.199214954455861.
[I 2024-12-04 12:47:23,775] Trial 878 finished with value: 0.24873288902848564 and parameters: {'n_estimators': 1497, 'learning_rate': 0.06976561232928799, 'max_depth': 11, 'min_samples_split': 15, 'min_samples_leaf': 3, 'subsample': 0.6330169067008744, 'max_features': 'sqrt'}. Best is trial 784 with value: 0.199214954455861.
[I 2024-12-04 12:47:27,384] Trial 885 finished with value: 0.22253359094684894 and parameters: {'n_estimators': 1278, 'learning_rate': 0.09827821658305079, 'max_depth': 12, 'min_samples_split': 20, 'min_samples_leaf': 1, 'subsample': 0.6190317653710167, 'max_features': 'sqrt'}. Best is trial 784 with value: 0.199214954455861.
[I 2024-12-04 12:47:30,224] Trial 893 finished with value: 0.2122160316066128 and parameters: {'n_estimators': 924, 'learning_rate': 0.09885781087253266, 'max_depth': 12, 'min_samples_split': 19, 'min_samples_leaf': 1, 'subsample': 0.7245111291851789, 'max_features': 'sqrt'}. Best is trial 784 with value: 0.199214954455861.
[I 2024-12-04 12:47:34,469] Trial 900 finished with value: 0.3691382272518918 and parameters: {'n_estimators': 646, 'learning_rate': 0.034421909784240354, 'max_depth': 8, 'min_samples_split': 10, 'min_samples_leaf': 3, 'subsample': 0.8432737982948664, 'max_features': 'log2'}. Best is trial 784 with value: 0.199214954455861.
[I 2024-12-04 12:47:35,791] Trial 887 finished with value: 0.22125446525488007 and parameters: {'n_estimators': 1341, 'learning_rate': 0.06124192130181683, 'max_depth': 11, 'min_samples_split': 12, 'min_samples_leaf': 1, 'subsample': 0.7028321499138278, 'max_features': 'sqrt'}. Best is trial 784 with value: 0.199214954455861.
[I 2024-12-04 12:47:37,506] Trial 915 finished with value: 0.6169890606948936 and parameters: {'n_estimators': 188, 'learning_rate': 0.025583803416815945, 'max_depth': 12, 'min_samples_split': 20, 'min_samples_leaf': 9, 'subsample': 0.630393969597745, 'max_features': 'sqrt'}. Best is trial 784 with value: 0.199214954455861.
[I 2024-12-04 12:47:37,516] Trial 884 finished with value: 0.2242765945561576 and parameters: {'n_estimators': 1487, 'learning_rate': 0.0903735675347199, 'max_depth': 11, 'min_samples_split': 13, 'min_samples_leaf': 1, 'subsample': 0.6120555205753612, 'max_features': 'sqrt'}. Best is trial 784 with value: 0.199214954455861.
[I 2024-12-04 12:47:39,547] Trial 895 finished with value: 0.4326111346498035 and parameters: {'n_estimators': 940, 'learning_rate': 0.029167364166437074, 'max_depth': 9, 'min_samples_split': 4, 'min_samples_leaf': 6, 'subsample': 0.8197408229176756, 'max_features': 'log2'}. Best is trial 784 with value: 0.199214954455861.
[I 2024-12-04 12:47:42,162] Trial 890 finished with value: 0.25880462925944625 and parameters: {'n_estimators': 1238, 'learning_rate': 0.09440794147892524, 'max_depth': 11, 'min_samples_split': 14, 'min_samples_leaf': 3, 'subsample': 0.6043111225995587, 'max_features': 'sqrt'}. Best is trial 784 with value: 0.199214954455861.
[I 2024-12-04 12:47:43,871] Trial 891 finished with value: 0.21505208123549632 and parameters: {'n_estimators': 1242, 'learning_rate': 0.07412016817937778, 'max_depth': 12, 'min_samples_split': 20, 'min_samples_leaf': 1, 'subsample': 0.6863618394647971, 'max_features': 'sqrt'}. Best is trial 784 with value: 0.199214954455861.
[I 2024-12-04 12:47:48,520] Trial 892 finished with value: 0.22284880464141593 and parameters: {'n_estimators': 1285, 'learning_rate': 0.0614379201438167, 'max_depth': 12, 'min_samples_split': 13, 'min_samples_leaf': 1, 'subsample': 0.6727825336585491, 'max_features': 'sqrt'}. Best is trial 784 with value: 0.199214954455861.
[I 2024-12-04 12:47:50,925] Trial 888 finished with value: 0.25036243614822795 and parameters: {'n_estimators': 1312, 'learning_rate': 0.09695565126817843, 'max_depth': 12, 'min_samples_split': 19, 'min_samples_leaf': 1, 'subsample': 0.659345858399673, 'max_features': None}. Best is trial 784 with value: 0.199214954455861.
[I 2024-12-04 12:47:51,565] Trial 920 finished with value: 0.4664841652270033 and parameters: {'n_estimators': 148, 'learning_rate': 0.011565651583421113, 'max_depth': 6, 'min_samples_split': 16, 'min_samples_leaf': 4, 'subsample': 0.8870295819572498, 'max_features': None}. Best is trial 784 with value: 0.199214954455861.
[I 2024-12-04 12:47:53,433] Trial 889 finished with value: 0.2599286317914257 and parameters: {'n_estimators': 1474, 'learning_rate': 0.06557553681187278, 'max_depth': 11, 'min_samples_split': 17, 'min_samples_leaf': 4, 'subsample': 0.6073616568850629, 'max_features': 'sqrt'}. Best is trial 784 with value: 0.199214954455861.
[I 2024-12-04 12:48:08,215] Trial 898 finished with value: 0.25202367919061824 and parameters: {'n_estimators': 1403, 'learning_rate': 0.08690079880270318, 'max_depth': 12, 'min_samples_split': 9, 'min_samples_leaf': 4, 'subsample': 0.6817337505374231, 'max_features': 'sqrt'}. Best is trial 784 with value: 0.199214954455861.
[I 2024-12-04 12:48:10,233] Trial 896 finished with value: 0.23986180105445137 and parameters: {'n_estimators': 1488, 'learning_rate': 0.05815483288755762, 'max_depth': 12, 'min_samples_split': 19, 'min_samples_leaf': 3, 'subsample': 0.6096672918085433, 'max_features': 'sqrt'}. Best is trial 784 with value: 0.199214954455861.
[I 2024-12-04 12:48:10,268] Trial 897 finished with value: 0.21825025304888804 and parameters: {'n_estimators': 1461, 'learning_rate': 0.06570617764555131, 'max_depth': 12, 'min_samples_split': 15, 'min_samples_leaf': 1, 'subsample': 0.6943811560206252, 'max_features': 'sqrt'}. Best is trial 784 with value: 0.199214954455861.
[I 2024-12-04 12:48:12,200] Trial 902 finished with value: 0.25872018316307893 and parameters: {'n_estimators': 1333, 'learning_rate': 0.06488974327221578, 'max_depth': 9, 'min_samples_split': 10, 'min_samples_leaf': 1, 'subsample': 0.6339377652064693, 'max_features': 'log2'}. Best is trial 784 with value: 0.199214954455861.
[I 2024-12-04 12:48:13,348] Trial 901 finished with value: 0.209514954006498 and parameters: {'n_estimators': 1315, 'learning_rate': 0.09846554787087733, 'max_depth': 10, 'min_samples_split': 19, 'min_samples_leaf': 1, 'subsample': 0.625979412251752, 'max_features': 'sqrt'}. Best is trial 784 with value: 0.199214954455861.
[I 2024-12-04 12:48:14,760] Trial 907 finished with value: 0.33438237453214326 and parameters: {'n_estimators': 1164, 'learning_rate': 0.03267192156990609, 'max_depth': 6, 'min_samples_split': 13, 'min_samples_leaf': 1, 'subsample': 0.6587160787550996, 'max_features': 'log2'}. Best is trial 784 with value: 0.199214954455861.
[I 2024-12-04 12:48:15,902] Trial 905 finished with value: 0.24017984000842213 and parameters: {'n_estimators': 1239, 'learning_rate': 0.09267833077720629, 'max_depth': 12, 'min_samples_split': 18, 'min_samples_leaf': 3, 'subsample': 0.7000059096289389, 'max_features': 'sqrt'}. Best is trial 784 with value: 0.199214954455861.
[I 2024-12-04 12:48:16,166] Trial 894 finished with value: 0.2677794871564989 and parameters: {'n_estimators': 1412, 'learning_rate': 0.08429722049178902, 'max_depth': 12, 'min_samples_split': 8, 'min_samples_leaf': 1, 'subsample': 0.6510666631469397, 'max_features': None}. Best is trial 784 with value: 0.199214954455861.
[I 2024-12-04 12:48:16,754] Trial 899 finished with value: 0.2233906518466138 and parameters: {'n_estimators': 1406, 'learning_rate': 0.08407565728176072, 'max_depth': 12, 'min_samples_split': 9, 'min_samples_leaf': 1, 'subsample': 0.638474097738193, 'max_features': 'sqrt'}. Best is trial 784 with value: 0.199214954455861.
[I 2024-12-04 12:48:18,929] Trial 903 finished with value: 0.23567444112827246 and parameters: {'n_estimators': 1363, 'learning_rate': 0.05243992322650403, 'max_depth': 10, 'min_samples_split': 20, 'min_samples_leaf': 1, 'subsample': 0.678402392143784, 'max_features': 'sqrt'}. Best is trial 784 with value: 0.199214954455861.
[I 2024-12-04 12:48:19,251] Trial 904 finished with value: 0.2374286765533534 and parameters: {'n_estimators': 1369, 'learning_rate': 0.07569684380680089, 'max_depth': 9, 'min_samples_split': 19, 'min_samples_leaf': 1, 'subsample': 0.6230937864784449, 'max_features': 'sqrt'}. Best is trial 784 with value: 0.199214954455861.
[I 2024-12-04 12:48:22,526] Trial 916 finished with value: 0.33448373036062184 and parameters: {'n_estimators': 873, 'learning_rate': 0.015952980730002588, 'max_depth': 12, 'min_samples_split': 15, 'min_samples_leaf': 6, 'subsample': 0.751751480734071, 'max_features': None}. Best is trial 784 with value: 0.199214954455861.
[I 2024-12-04 12:48:22,983] Trial 912 finished with value: 0.24047474692171356 and parameters: {'n_estimators': 1048, 'learning_rate': 0.0975106473148084, 'max_depth': 12, 'min_samples_split': 13, 'min_samples_leaf': 1, 'subsample': 0.8431447046630866, 'max_features': 'log2'}. Best is trial 784 with value: 0.199214954455861.
[I 2024-12-04 12:48:22,997] Trial 928 finished with value: 0.3509682285948015 and parameters: {'n_estimators': 432, 'learning_rate': 0.040732332865940656, 'max_depth': 5, 'min_samples_split': 10, 'min_samples_leaf': 6, 'subsample': 0.896464096404374, 'max_features': None}. Best is trial 784 with value: 0.199214954455861.
[I 2024-12-04 12:48:25,146] Trial 926 finished with value: 0.23871499063413806 and parameters: {'n_estimators': 589, 'learning_rate': 0.09060608076725697, 'max_depth': 11, 'min_samples_split': 19, 'min_samples_leaf': 2, 'subsample': 0.6885441984709355, 'max_features': 'sqrt'}. Best is trial 784 with value: 0.199214954455861.
[I 2024-12-04 12:48:25,164] Trial 917 finished with value: 0.40400206951396295 and parameters: {'n_estimators': 976, 'learning_rate': 0.02164483338694587, 'max_depth': 3, 'min_samples_split': 9, 'min_samples_leaf': 6, 'subsample': 0.8234652269053049, 'max_features': 'sqrt'}. Best is trial 784 with value: 0.199214954455861.
[I 2024-12-04 12:48:25,596] Trial 929 finished with value: 0.3062844145548414 and parameters: {'n_estimators': 464, 'learning_rate': 0.027834292525558264, 'max_depth': 9, 'min_samples_split': 19, 'min_samples_leaf': 1, 'subsample': 0.9855381143530566, 'max_features': None}. Best is trial 784 with value: 0.199214954455861.
[I 2024-12-04 12:48:26,326] Trial 918 finished with value: 0.23258469382076202 and parameters: {'n_estimators': 971, 'learning_rate': 0.08420834675685544, 'max_depth': 12, 'min_samples_split': 17, 'min_samples_leaf': 2, 'subsample': 0.7556754568586856, 'max_features': 'sqrt'}. Best is trial 784 with value: 0.199214954455861.
[I 2024-12-04 12:48:26,823] Trial 908 finished with value: 0.2625911546154539 and parameters: {'n_estimators': 1359, 'learning_rate': 0.08011449538047809, 'max_depth': 8, 'min_samples_split': 20, 'min_samples_leaf': 4, 'subsample': 0.6691234906400829, 'max_features': 'sqrt'}. Best is trial 784 with value: 0.199214954455861.
[I 2024-12-04 12:48:26,842] Trial 923 finished with value: 0.22757861296563767 and parameters: {'n_estimators': 685, 'learning_rate': 0.09052205187302927, 'max_depth': 11, 'min_samples_split': 16, 'min_samples_leaf': 1, 'subsample': 0.7689202421771651, 'max_features': 'sqrt'}. Best is trial 784 with value: 0.199214954455861.
[I 2024-12-04 12:48:27,573] Trial 910 finished with value: 0.46120157671356765 and parameters: {'n_estimators': 1311, 'learning_rate': 0.03402255918640214, 'max_depth': 8, 'min_samples_split': 12, 'min_samples_leaf': 7, 'subsample': 0.6774670276379678, 'max_features': 'log2'}. Best is trial 784 with value: 0.199214954455861.
[I 2024-12-04 12:48:27,581] Trial 906 finished with value: 0.21791952213423507 and parameters: {'n_estimators': 1432, 'learning_rate': 0.07995648091602921, 'max_depth': 10, 'min_samples_split': 19, 'min_samples_leaf': 1, 'subsample': 0.6107600489788159, 'max_features': 'sqrt'}. Best is trial 784 with value: 0.199214954455861.
[I 2024-12-04 12:48:30,329] Trial 924 finished with value: 0.2547187720374335 and parameters: {'n_estimators': 691, 'learning_rate': 0.056048976380835336, 'max_depth': 12, 'min_samples_split': 19, 'min_samples_leaf': 1, 'subsample': 0.6424210821182103, 'max_features': 'sqrt'}. Best is trial 784 with value: 0.199214954455861.
[I 2024-12-04 12:48:31,945] Trial 913 finished with value: 0.25124627072560596 and parameters: {'n_estimators': 1277, 'learning_rate': 0.098945013012148, 'max_depth': 12, 'min_samples_split': 10, 'min_samples_leaf': 3, 'subsample': 0.6349712594570702, 'max_features': 'sqrt'}. Best is trial 784 with value: 0.199214954455861.
[I 2024-12-04 12:48:33,109] Trial 925 finished with value: 0.2590950965521575 and parameters: {'n_estimators': 838, 'learning_rate': 0.052738477002616364, 'max_depth': 11, 'min_samples_split': 19, 'min_samples_leaf': 2, 'subsample': 0.7385911505268303, 'max_features': 'sqrt'}. Best is trial 784 with value: 0.199214954455861.
[I 2024-12-04 12:48:37,973] Trial 919 finished with value: 0.2267203017059931 and parameters: {'n_estimators': 1184, 'learning_rate': 0.05764502505879443, 'max_depth': 12, 'min_samples_split': 18, 'min_samples_leaf': 1, 'subsample': 0.7097268931855714, 'max_features': 'sqrt'}. Best is trial 784 with value: 0.199214954455861.
[I 2024-12-04 12:48:39,556] Trial 914 finished with value: 0.23368572715052846 and parameters: {'n_estimators': 1484, 'learning_rate': 0.09881552631718114, 'max_depth': 12, 'min_samples_split': 10, 'min_samples_leaf': 1, 'subsample': 0.6723991748844671, 'max_features': 'sqrt'}. Best is trial 784 with value: 0.199214954455861.
[I 2024-12-04 12:48:40,672] Trial 909 finished with value: 0.23425936672338962 and parameters: {'n_estimators': 1497, 'learning_rate': 0.08129424563143463, 'max_depth': 10, 'min_samples_split': 20, 'min_samples_leaf': 1, 'subsample': 0.7217164193631939, 'max_features': 'sqrt'}. Best is trial 784 with value: 0.199214954455861.
[I 2024-12-04 12:48:41,902] Trial 921 finished with value: 0.23222813446088392 and parameters: {'n_estimators': 1058, 'learning_rate': 0.07634106140051862, 'max_depth': 12, 'min_samples_split': 19, 'min_samples_leaf': 1, 'subsample': 0.7345154998170869, 'max_features': 'sqrt'}. Best is trial 784 with value: 0.199214954455861.
[I 2024-12-04 12:48:42,349] Trial 911 finished with value: 0.23635970190989958 and parameters: {'n_estimators': 1488, 'learning_rate': 0.04590422300891772, 'max_depth': 9, 'min_samples_split': 20, 'min_samples_leaf': 1, 'subsample': 0.6268307278847655, 'max_features': 'sqrt'}. Best is trial 784 with value: 0.199214954455861.
[I 2024-12-04 12:48:48,275] Trial 930 finished with value: 0.23153896966791446 and parameters: {'n_estimators': 924, 'learning_rate': 0.06748937305685543, 'max_depth': 12, 'min_samples_split': 20, 'min_samples_leaf': 1, 'subsample': 0.7892901830218211, 'max_features': 'sqrt'}. Best is trial 784 with value: 0.199214954455861.
[I 2024-12-04 12:48:49,286] Trial 922 finished with value: 0.22542817859279154 and parameters: {'n_estimators': 1449, 'learning_rate': 0.04672815279193346, 'max_depth': 12, 'min_samples_split': 16, 'min_samples_leaf': 1, 'subsample': 0.6017581276087748, 'max_features': 'sqrt'}. Best is trial 784 with value: 0.199214954455861.
[I 2024-12-04 12:48:51,390] Trial 946 finished with value: 0.4188959494536924 and parameters: {'n_estimators': 166, 'learning_rate': 0.05680206680886618, 'max_depth': 5, 'min_samples_split': 8, 'min_samples_leaf': 10, 'subsample': 0.6047997124333184, 'max_features': None}. Best is trial 784 with value: 0.199214954455861.
[I 2024-12-04 12:48:57,405] Trial 931 finished with value: 0.20841910947620748 and parameters: {'n_estimators': 1103, 'learning_rate': 0.09224090598841783, 'max_depth': 12, 'min_samples_split': 18, 'min_samples_leaf': 1, 'subsample': 0.7520717303624619, 'max_features': 'sqrt'}. Best is trial 784 with value: 0.199214954455861.
[I 2024-12-04 12:49:00,987] Trial 943 finished with value: 0.2946062581963514 and parameters: {'n_estimators': 420, 'learning_rate': 0.09546810304939181, 'max_depth': 11, 'min_samples_split': 18, 'min_samples_leaf': 2, 'subsample': 0.7277339053979067, 'max_features': 'log2'}. Best is trial 784 with value: 0.199214954455861.
[I 2024-12-04 12:49:02,840] Trial 927 finished with value: 0.26522999324315555 and parameters: {'n_estimators': 1431, 'learning_rate': 0.04768692969738771, 'max_depth': 9, 'min_samples_split': 14, 'min_samples_leaf': 1, 'subsample': 0.6359189619481738, 'max_features': None}. Best is trial 784 with value: 0.199214954455861.
[I 2024-12-04 12:49:04,657] Trial 932 finished with value: 0.25428783773511143 and parameters: {'n_estimators': 1071, 'learning_rate': 0.06368679632362412, 'max_depth': 12, 'min_samples_split': 16, 'min_samples_leaf': 1, 'subsample': 0.6977263761436935, 'max_features': None}. Best is trial 784 with value: 0.199214954455861.
