[I 2024-12-04 11:53:55,915] Trial 394 finished with value: 0.4700162024116575 and parameters: {'max_depth': 33, 'min_samples_split': 7, 'min_samples_leaf': 1, 'max_features': 'sqrt', 'criterion': 'friedman_mse', 'splitter': 'best'}. Best is trial 91 with value: 0.43250115503666103.
[I 2024-12-04 11:53:56,111] Trial 384 finished with value: 0.5649253465052697 and parameters: {'max_depth': 35, 'min_samples_split': 6, 'min_samples_leaf': 2, 'max_features': 'sqrt', 'criterion': 'squared_error', 'splitter': 'best'}. Best is trial 91 with value: 0.43250115503666103.
[I 2024-12-04 11:53:56,382] Trial 391 finished with value: 0.827055535513728 and parameters: {'max_depth': 7, 'min_samples_split': 20, 'min_samples_leaf': 2, 'max_features': 'sqrt', 'criterion': 'absolute_error', 'splitter': 'best'}. Best is trial 91 with value: 0.43250115503666103.
[I 2024-12-04 11:53:56,607] Trial 393 finished with value: 0.5170399151403982 and parameters: {'max_depth': 34, 'min_samples_split': 2, 'min_samples_leaf': 1, 'max_features': 'sqrt', 'criterion': 'squared_error', 'splitter': 'best'}. Best is trial 91 with value: 0.43250115503666103.
[I 2024-12-04 11:53:56,774] Trial 368 finished with value: 0.6013237460643723 and parameters: {'max_depth': 35, 'min_samples_split': 2, 'min_samples_leaf': 3, 'max_features': 'sqrt', 'criterion': 'squared_error', 'splitter': 'best'}. Best is trial 91 with value: 0.43250115503666103.
[I 2024-12-04 11:53:56,889] Trial 390 finished with value: 0.6013237460643723 and parameters: {'max_depth': 35, 'min_samples_split': 3, 'min_samples_leaf': 3, 'max_features': 'sqrt', 'criterion': 'squared_error', 'splitter': 'best'}. Best is trial 91 with value: 0.43250115503666103.
[I 2024-12-04 11:53:57,010] Trial 392 finished with value: 0.9429407543048474 and parameters: {'max_depth': 5, 'min_samples_split': 2, 'min_samples_leaf': 2, 'max_features': 'log2', 'criterion': 'friedman_mse', 'splitter': 'random'}. Best is trial 91 with value: 0.43250115503666103.
[I 2024-12-04 11:53:57,762] Trial 385 finished with value: 0.9605953430737175 and parameters: {'max_depth': 3, 'min_samples_split': 8, 'min_samples_leaf': 1, 'max_features': 'sqrt', 'criterion': 'absolute_error', 'splitter': 'best'}. Best is trial 91 with value: 0.43250115503666103.
[I 2024-12-04 11:53:58,787] Trial 403 finished with value: 0.6167429661942662 and parameters: {'max_depth': 31, 'min_samples_split': 2, 'min_samples_leaf': 1, 'max_features': 'sqrt', 'criterion': 'absolute_error', 'splitter': 'best'}. Best is trial 91 with value: 0.43250115503666103.
[I 2024-12-04 11:53:59,223] Trial 396 finished with value: 0.7437006126672107 and parameters: {'max_depth': 18, 'min_samples_split': 12, 'min_samples_leaf': 3, 'max_features': 'sqrt', 'criterion': 'squared_error', 'splitter': 'random'}. Best is trial 91 with value: 0.43250115503666103.
[I 2024-12-04 11:53:59,994] Trial 399 finished with value: 0.5440633341537283 and parameters: {'max_depth': 29, 'min_samples_split': 2, 'min_samples_leaf': 1, 'max_features': 'sqrt', 'criterion': 'squared_error', 'splitter': 'best'}. Best is trial 91 with value: 0.43250115503666103.
[I 2024-12-04 11:54:00,267] Trial 400 finished with value: 0.5109654269115765 and parameters: {'max_depth': 35, 'min_samples_split': 2, 'min_samples_leaf': 1, 'max_features': 'sqrt', 'criterion': 'squared_error', 'splitter': 'best'}. Best is trial 91 with value: 0.43250115503666103.
[I 2024-12-04 11:54:00,650] Trial 389 finished with value: 0.5109654269115765 and parameters: {'max_depth': 35, 'min_samples_split': 2, 'min_samples_leaf': 1, 'max_features': 'sqrt', 'criterion': 'friedman_mse', 'splitter': 'best'}. Best is trial 91 with value: 0.43250115503666103.
[I 2024-12-04 11:54:00,913] Trial 406 finished with value: 0.4750683632054112 and parameters: {'max_depth': 35, 'min_samples_split': 4, 'min_samples_leaf': 1, 'max_features': 'sqrt', 'criterion': 'squared_error', 'splitter': 'best'}. Best is trial 91 with value: 0.43250115503666103.
[I 2024-12-04 11:54:00,915] Trial 402 finished with value: 0.7473008035501081 and parameters: {'max_depth': 18, 'min_samples_split': 13, 'min_samples_leaf': 3, 'max_features': 'sqrt', 'criterion': 'friedman_mse', 'splitter': 'random'}. Best is trial 91 with value: 0.43250115503666103.
[I 2024-12-04 11:54:01,968] Trial 398 finished with value: 0.9754392182102364 and parameters: {'max_depth': 2, 'min_samples_split': 5, 'min_samples_leaf': 7, 'max_features': 'sqrt', 'criterion': 'absolute_error', 'splitter': 'random'}. Best is trial 91 with value: 0.43250115503666103.
[I 2024-12-04 11:54:01,974] Trial 413 finished with value: 0.4399442512678781 and parameters: {'max_depth': 35, 'min_samples_split': 14, 'min_samples_leaf': 1, 'max_features': 'sqrt', 'criterion': 'friedman_mse', 'splitter': 'best'}. Best is trial 91 with value: 0.43250115503666103.
[I 2024-12-04 11:54:02,108] Trial 395 finished with value: 0.49648306955196436 and parameters: {'max_depth': 35, 'min_samples_split': 6, 'min_samples_leaf': 1, 'max_features': 'sqrt', 'criterion': 'squared_error', 'splitter': 'best'}. Best is trial 91 with value: 0.43250115503666103.
[I 2024-12-04 11:54:02,459] Trial 411 finished with value: 0.9982171095081254 and parameters: {'max_depth': 10, 'min_samples_split': 20, 'min_samples_leaf': 7, 'max_features': 'log2', 'criterion': 'squared_error', 'splitter': 'best'}. Best is trial 91 with value: 0.43250115503666103.
[I 2024-12-04 11:54:03,090] Trial 401 finished with value: 0.6013237460643723 and parameters: {'max_depth': 29, 'min_samples_split': 4, 'min_samples_leaf': 3, 'max_features': 'sqrt', 'criterion': 'squared_error', 'splitter': 'best'}. Best is trial 91 with value: 0.43250115503666103.
[I 2024-12-04 11:54:03,297] Trial 397 finished with value: 0.9618554461006263 and parameters: {'max_depth': 6, 'min_samples_split': 9, 'min_samples_leaf': 6, 'max_features': 'log2', 'criterion': 'friedman_mse', 'splitter': 'random'}. Best is trial 91 with value: 0.43250115503666103.
[I 2024-12-04 11:54:03,764] Trial 405 finished with value: 0.5457671470124494 and parameters: {'max_depth': 31, 'min_samples_split': 13, 'min_samples_leaf': 2, 'max_features': 'sqrt', 'criterion': 'friedman_mse', 'splitter': 'best'}. Best is trial 91 with value: 0.43250115503666103.
[I 2024-12-04 11:54:04,558] Trial 408 finished with value: 0.48535381353880397 and parameters: {'max_depth': 27, 'min_samples_split': 5, 'min_samples_leaf': 1, 'max_features': 'sqrt', 'criterion': 'squared_error', 'splitter': 'best'}. Best is trial 91 with value: 0.43250115503666103.
[I 2024-12-04 11:54:04,779] Trial 388 finished with value: 0.4950101456568504 and parameters: {'max_depth': 34, 'min_samples_split': 15, 'min_samples_leaf': 1, 'max_features': 'sqrt', 'criterion': 'friedman_mse', 'splitter': 'best'}. Best is trial 91 with value: 0.43250115503666103.
[I 2024-12-04 11:54:04,892] Trial 410 finished with value: 0.6049450594243974 and parameters: {'max_depth': 24, 'min_samples_split': 14, 'min_samples_leaf': 1, 'max_features': 'sqrt', 'criterion': 'friedman_mse', 'splitter': 'best'}. Best is trial 91 with value: 0.43250115503666103.
[I 2024-12-04 11:54:04,920] Trial 417 finished with value: 0.8308936882246339 and parameters: {'max_depth': 30, 'min_samples_split': 16, 'min_samples_leaf': 2, 'max_features': 'sqrt', 'criterion': 'absolute_error', 'splitter': 'random'}. Best is trial 91 with value: 0.43250115503666103.
[I 2024-12-04 11:54:04,964] Trial 414 finished with value: 0.5047685324329324 and parameters: {'max_depth': 32, 'min_samples_split': 15, 'min_samples_leaf': 1, 'max_features': 'sqrt', 'criterion': 'friedman_mse', 'splitter': 'best'}. Best is trial 91 with value: 0.43250115503666103.
[I 2024-12-04 11:54:05,244] Trial 416 finished with value: 0.49087984857266276 and parameters: {'max_depth': 29, 'min_samples_split': 5, 'min_samples_leaf': 1, 'max_features': 'sqrt', 'criterion': 'squared_error', 'splitter': 'best'}. Best is trial 91 with value: 0.43250115503666103.
[I 2024-12-04 11:54:05,842] Trial 422 finished with value: 0.6123076563860378 and parameters: {'max_depth': 28, 'min_samples_split': 2, 'min_samples_leaf': 1, 'max_features': 'log2', 'criterion': 'squared_error', 'splitter': 'best'}. Best is trial 91 with value: 0.43250115503666103.
[I 2024-12-04 11:54:05,898] Trial 412 finished with value: 0.48363356796891666 and parameters: {'max_depth': 30, 'min_samples_split': 14, 'min_samples_leaf': 1, 'max_features': 'sqrt', 'criterion': 'friedman_mse', 'splitter': 'best'}. Best is trial 91 with value: 0.43250115503666103.
[I 2024-12-04 11:54:06,041] Trial 409 finished with value: 0.584300197786044 and parameters: {'max_depth': 32, 'min_samples_split': 13, 'min_samples_leaf': 3, 'max_features': 'sqrt', 'criterion': 'friedman_mse', 'splitter': 'best'}. Best is trial 91 with value: 0.43250115503666103.
[I 2024-12-04 11:54:06,287] Trial 404 finished with value: 0.6013237460643723 and parameters: {'max_depth': 30, 'min_samples_split': 3, 'min_samples_leaf': 3, 'max_features': 'sqrt', 'criterion': 'squared_error', 'splitter': 'best'}. Best is trial 91 with value: 0.43250115503666103.
[I 2024-12-04 11:54:06,639] Trial 415 finished with value: 0.4856187310523648 and parameters: {'max_depth': 34, 'min_samples_split': 13, 'min_samples_leaf': 1, 'max_features': 'sqrt', 'criterion': 'friedman_mse', 'splitter': 'best'}. Best is trial 91 with value: 0.43250115503666103.
[I 2024-12-04 11:54:07,152] Trial 407 finished with value: 0.5440633341537283 and parameters: {'max_depth': 29, 'min_samples_split': 2, 'min_samples_leaf': 1, 'max_features': 'sqrt', 'criterion': 'squared_error', 'splitter': 'best'}. Best is trial 91 with value: 0.43250115503666103.
[I 2024-12-04 11:54:07,547] Trial 418 finished with value: 0.5109654269115765 and parameters: {'max_depth': 35, 'min_samples_split': 2, 'min_samples_leaf': 1, 'max_features': 'sqrt', 'criterion': 'squared_error', 'splitter': 'best'}. Best is trial 91 with value: 0.43250115503666103.
[I 2024-12-04 11:54:08,765] Trial 426 finished with value: 0.5273419897492498 and parameters: {'max_depth': 35, 'min_samples_split': 15, 'min_samples_leaf': 1, 'max_features': 'sqrt', 'criterion': 'friedman_mse', 'splitter': 'best'}. Best is trial 91 with value: 0.43250115503666103.
[I 2024-12-04 11:54:09,924] Trial 420 finished with value: 0.9704502028300459 and parameters: {'max_depth': 1, 'min_samples_split': 2, 'min_samples_leaf': 1, 'max_features': 'sqrt', 'criterion': 'squared_error', 'splitter': 'random'}. Best is trial 91 with value: 0.43250115503666103.
[I 2024-12-04 11:54:10,040] Trial 428 finished with value: 0.49087984857266276 and parameters: {'max_depth': 29, 'min_samples_split': 5, 'min_samples_leaf': 1, 'max_features': 'sqrt', 'criterion': 'squared_error', 'splitter': 'best'}. Best is trial 91 with value: 0.43250115503666103.
[I 2024-12-04 11:54:10,067] Trial 421 finished with value: 0.5670026275085702 and parameters: {'max_depth': 35, 'min_samples_split': 5, 'min_samples_leaf': 1, 'max_features': 'sqrt', 'criterion': 'squared_error', 'splitter': 'random'}. Best is trial 91 with value: 0.43250115503666103.
[I 2024-12-04 11:54:10,211] Trial 431 finished with value: 0.5109654269115765 and parameters: {'max_depth': 35, 'min_samples_split': 2, 'min_samples_leaf': 1, 'max_features': 'sqrt', 'criterion': 'squared_error', 'splitter': 'best'}. Best is trial 91 with value: 0.43250115503666103.
[I 2024-12-04 11:54:10,675] Trial 434 finished with value: 0.5028882069058996 and parameters: {'max_depth': 34, 'min_samples_split': 6, 'min_samples_leaf': 1, 'max_features': 'sqrt', 'criterion': 'squared_error', 'splitter': 'best'}. Best is trial 91 with value: 0.43250115503666103.
[I 2024-12-04 11:54:10,792] Trial 424 finished with value: 0.8634733030395862 and parameters: {'max_depth': 14, 'min_samples_split': 11, 'min_samples_leaf': 1, 'max_features': 'log2', 'criterion': 'absolute_error', 'splitter': 'best'}. Best is trial 91 with value: 0.43250115503666103.
[I 2024-12-04 11:54:10,795] Trial 430 finished with value: 0.483263059820054 and parameters: {'max_depth': 35, 'min_samples_split': 5, 'min_samples_leaf': 1, 'max_features': 'sqrt', 'criterion': 'friedman_mse', 'splitter': 'best'}. Best is trial 91 with value: 0.43250115503666103.
[I 2024-12-04 11:54:11,673] Trial 429 finished with value: 0.9704502028300459 and parameters: {'max_depth': 1, 'min_samples_split': 7, 'min_samples_leaf': 5, 'max_features': 'sqrt', 'criterion': 'squared_error', 'splitter': 'random'}. Best is trial 91 with value: 0.43250115503666103.
[I 2024-12-04 11:54:11,703] Trial 419 finished with value: 0.523349344704195 and parameters: {'max_depth': 34, 'min_samples_split': 5, 'min_samples_leaf': 2, 'max_features': 'sqrt', 'criterion': 'friedman_mse', 'splitter': 'best'}. Best is trial 91 with value: 0.43250115503666103.
[I 2024-12-04 11:54:11,707] Trial 425 finished with value: 0.5520365748377991 and parameters: {'max_depth': 24, 'min_samples_split': 3, 'min_samples_leaf': 1, 'max_features': 'sqrt', 'criterion': 'friedman_mse', 'splitter': 'best'}. Best is trial 91 with value: 0.43250115503666103.
[I 2024-12-04 11:54:11,927] Trial 433 finished with value: 0.483263059820054 and parameters: {'max_depth': 35, 'min_samples_split': 5, 'min_samples_leaf': 1, 'max_features': 'sqrt', 'criterion': 'squared_error', 'splitter': 'best'}. Best is trial 91 with value: 0.43250115503666103.
[I 2024-12-04 11:54:11,949] Trial 439 finished with value: 0.987838078137701 and parameters: {'max_depth': 23, 'min_samples_split': 20, 'min_samples_leaf': 4, 'max_features': 'log2', 'criterion': 'absolute_error', 'splitter': 'best'}. Best is trial 91 with value: 0.43250115503666103.
[I 2024-12-04 11:54:12,078] Trial 432 finished with value: 0.6122970500864531 and parameters: {'max_depth': 29, 'min_samples_split': 2, 'min_samples_leaf': 4, 'max_features': 'sqrt', 'criterion': 'friedman_mse', 'splitter': 'best'}. Best is trial 91 with value: 0.43250115503666103.
[I 2024-12-04 11:54:12,848] Trial 427 finished with value: 0.6013237460643723 and parameters: {'max_depth': 30, 'min_samples_split': 2, 'min_samples_leaf': 3, 'max_features': 'sqrt', 'criterion': 'squared_error', 'splitter': 'best'}. Best is trial 91 with value: 0.43250115503666103.
[I 2024-12-04 11:54:13,244] Trial 438 finished with value: 0.6013237460643723 and parameters: {'max_depth': 35, 'min_samples_split': 6, 'min_samples_leaf': 3, 'max_features': 'sqrt', 'criterion': 'squared_error', 'splitter': 'best'}. Best is trial 91 with value: 0.43250115503666103.
[I 2024-12-04 11:54:13,608] Trial 440 finished with value: 0.45634040793959746 and parameters: {'max_depth': 35, 'min_samples_split': 3, 'min_samples_leaf': 1, 'max_features': 'sqrt', 'criterion': 'squared_error', 'splitter': 'best'}. Best is trial 91 with value: 0.43250115503666103.
[I 2024-12-04 11:54:14,340] Trial 442 finished with value: 0.6009888625152126 and parameters: {'max_depth': 32, 'min_samples_split': 6, 'min_samples_leaf': 1, 'max_features': 'sqrt', 'criterion': 'absolute_error', 'splitter': 'best'}. Best is trial 91 with value: 0.43250115503666103.
[I 2024-12-04 11:54:14,345] Trial 423 finished with value: 0.9871790775333498 and parameters: {'max_depth': 35, 'min_samples_split': 3, 'min_samples_leaf': 4, 'max_features': 'log2', 'criterion': 'squared_error', 'splitter': 'best'}. Best is trial 91 with value: 0.43250115503666103.
[I 2024-12-04 11:54:14,597] Trial 444 finished with value: 0.6013237460643723 and parameters: {'max_depth': 35, 'min_samples_split': 2, 'min_samples_leaf': 3, 'max_features': 'sqrt', 'criterion': 'squared_error', 'splitter': 'best'}. Best is trial 91 with value: 0.43250115503666103.
[I 2024-12-04 11:54:14,785] Trial 436 finished with value: 0.5523976355951831 and parameters: {'max_depth': 31, 'min_samples_split': 2, 'min_samples_leaf': 1, 'max_features': 'sqrt', 'criterion': 'squared_error', 'splitter': 'best'}. Best is trial 91 with value: 0.43250115503666103.
[I 2024-12-04 11:54:15,499] Trial 447 finished with value: 0.8027588232771664 and parameters: {'max_depth': 31, 'min_samples_split': 18, 'min_samples_leaf': 1, 'max_features': 'log2', 'criterion': 'squared_error', 'splitter': 'random'}. Best is trial 91 with value: 0.43250115503666103.
[I 2024-12-04 11:54:15,501] Trial 449 finished with value: 0.5028882069058996 and parameters: {'max_depth': 34, 'min_samples_split': 6, 'min_samples_leaf': 1, 'max_features': 'sqrt', 'criterion': 'squared_error', 'splitter': 'best'}. Best is trial 91 with value: 0.43250115503666103.
[I 2024-12-04 11:54:15,505] Trial 443 finished with value: 0.49087984857266276 and parameters: {'max_depth': 29, 'min_samples_split': 5, 'min_samples_leaf': 1, 'max_features': 'sqrt', 'criterion': 'squared_error', 'splitter': 'best'}. Best is trial 91 with value: 0.43250115503666103.
[I 2024-12-04 11:54:16,128] Trial 437 finished with value: 0.9597516113963797 and parameters: {'max_depth': 12, 'min_samples_split': 5, 'min_samples_leaf': 10, 'max_features': 'sqrt', 'criterion': 'squared_error', 'splitter': 'random'}. Best is trial 91 with value: 0.43250115503666103.
[I 2024-12-04 11:54:16,312] Trial 435 finished with value: 0.6013237460643723 and parameters: {'max_depth': 35, 'min_samples_split': 5, 'min_samples_leaf': 3, 'max_features': 'sqrt', 'criterion': 'squared_error', 'splitter': 'best'}. Best is trial 91 with value: 0.43250115503666103.
[I 2024-12-04 11:54:17,261] Trial 451 finished with value: 0.6956034395868106 and parameters: {'max_depth': 34, 'min_samples_split': 13, 'min_samples_leaf': 9, 'max_features': 'sqrt', 'criterion': 'friedman_mse', 'splitter': 'best'}. Best is trial 91 with value: 0.43250115503666103.
[I 2024-12-04 11:54:17,302] Trial 445 finished with value: 0.9982171095081254 and parameters: {'max_depth': 25, 'min_samples_split': 8, 'min_samples_leaf': 7, 'max_features': 'log2', 'criterion': 'friedman_mse', 'splitter': 'best'}. Best is trial 91 with value: 0.43250115503666103.
[I 2024-12-04 11:54:17,514] Trial 441 finished with value: 0.8738432508068664 and parameters: {'max_depth': 13, 'min_samples_split': 17, 'min_samples_leaf': 1, 'max_features': 'log2', 'criterion': 'absolute_error', 'splitter': 'random'}. Best is trial 91 with value: 0.43250115503666103.
[I 2024-12-04 11:54:17,760] Trial 453 finished with value: 0.5523976355951831 and parameters: {'max_depth': 31, 'min_samples_split': 2, 'min_samples_leaf': 1, 'max_features': 'sqrt', 'criterion': 'squared_error', 'splitter': 'best'}. Best is trial 91 with value: 0.43250115503666103.
[I 2024-12-04 11:54:18,020] Trial 448 finished with value: 0.571585137447043 and parameters: {'max_depth': 35, 'min_samples_split': 5, 'min_samples_leaf': 2, 'max_features': 'sqrt', 'criterion': 'squared_error', 'splitter': 'best'}. Best is trial 91 with value: 0.43250115503666103.
[I 2024-12-04 11:54:18,835] Trial 455 finished with value: 0.5109654269115765 and parameters: {'max_depth': 35, 'min_samples_split': 2, 'min_samples_leaf': 1, 'max_features': 'sqrt', 'criterion': 'squared_error', 'splitter': 'best'}. Best is trial 91 with value: 0.43250115503666103.
[I 2024-12-04 11:54:19,477] Trial 459 finished with value: 0.508257038100682 and parameters: {'max_depth': 32, 'min_samples_split': 5, 'min_samples_leaf': 1, 'max_features': 'sqrt', 'criterion': 'friedman_mse', 'splitter': 'best'}. Best is trial 91 with value: 0.43250115503666103.
[I 2024-12-04 11:54:19,480] Trial 460 finished with value: 0.6013237460643723 and parameters: {'max_depth': 35, 'min_samples_split': 2, 'min_samples_leaf': 3, 'max_features': 'sqrt', 'criterion': 'friedman_mse', 'splitter': 'best'}. Best is trial 91 with value: 0.43250115503666103.
[I 2024-12-04 11:54:20,125] Trial 463 finished with value: 0.584300197786044 and parameters: {'max_depth': 34, 'min_samples_split': 14, 'min_samples_leaf': 3, 'max_features': 'sqrt', 'criterion': 'friedman_mse', 'splitter': 'best'}. Best is trial 91 with value: 0.43250115503666103.
[I 2024-12-04 11:54:20,544] Trial 450 finished with value: 0.6013237460643723 and parameters: {'max_depth': 34, 'min_samples_split': 2, 'min_samples_leaf': 3, 'max_features': 'sqrt', 'criterion': 'squared_error', 'splitter': 'best'}. Best is trial 91 with value: 0.43250115503666103.
[I 2024-12-04 11:54:20,593] Trial 462 finished with value: 0.5288382873929215 and parameters: {'max_depth': 29, 'min_samples_split': 4, 'min_samples_leaf': 1, 'max_features': 'sqrt', 'criterion': 'squared_error', 'splitter': 'best'}. Best is trial 91 with value: 0.43250115503666103.
[I 2024-12-04 11:54:20,632] Trial 446 finished with value: 0.5345817934142266 and parameters: {'max_depth': 35, 'min_samples_split': 2, 'min_samples_leaf': 2, 'max_features': 'sqrt', 'criterion': 'friedman_mse', 'splitter': 'best'}. Best is trial 91 with value: 0.43250115503666103.
[I 2024-12-04 11:54:20,946] Trial 464 finished with value: 0.483263059820054 and parameters: {'max_depth': 35, 'min_samples_split': 5, 'min_samples_leaf': 1, 'max_features': 'sqrt', 'criterion': 'squared_error', 'splitter': 'best'}. Best is trial 91 with value: 0.43250115503666103.
[I 2024-12-04 11:54:21,178] Trial 452 finished with value: 0.6964974123782682 and parameters: {'max_depth': 34, 'min_samples_split': 3, 'min_samples_leaf': 2, 'max_features': 'sqrt', 'criterion': 'friedman_mse', 'splitter': 'random'}. Best is trial 91 with value: 0.43250115503666103.
[I 2024-12-04 11:54:21,244] Trial 457 finished with value: 0.483263059820054 and parameters: {'max_depth': 35, 'min_samples_split': 5, 'min_samples_leaf': 1, 'max_features': 'sqrt', 'criterion': 'squared_error', 'splitter': 'best'}. Best is trial 91 with value: 0.43250115503666103.
[I 2024-12-04 11:54:21,571] Trial 466 finished with value: 0.5109654269115765 and parameters: {'max_depth': 35, 'min_samples_split': 2, 'min_samples_leaf': 1, 'max_features': 'sqrt', 'criterion': 'squared_error', 'splitter': 'best'}. Best is trial 91 with value: 0.43250115503666103.
