[I 2024-12-04 12:13:04,237] Trial 1213 finished with value: 0.515023593520583 and parameters: {'n_estimators': 268, 'max_depth': 17, 'min_samples_split': 4, 'min_samples_leaf': 1, 'max_features': None, 'bootstrap': True, 'criterion': 'absolute_error'}. Best is trial 744 with value: 0.5032383725751689.
[I 2024-12-04 12:13:05,395] Trial 1226 finished with value: 0.5187493782142348 and parameters: {'n_estimators': 107, 'max_depth': 25, 'min_samples_split': 3, 'min_samples_leaf': 1, 'max_features': None, 'bootstrap': True, 'criterion': 'absolute_error'}. Best is trial 744 with value: 0.5032383725751689.
[I 2024-12-04 12:13:05,498] Trial 1219 finished with value: 0.5506678404538823 and parameters: {'n_estimators': 320, 'max_depth': 9, 'min_samples_split': 2, 'min_samples_leaf': 2, 'max_features': None, 'bootstrap': True, 'criterion': 'absolute_error'}. Best is trial 744 with value: 0.5032383725751689.
[I 2024-12-04 12:13:07,647] Trial 1233 finished with value: 0.5552015354719951 and parameters: {'n_estimators': 102, 'max_depth': 18, 'min_samples_split': 3, 'min_samples_leaf': 2, 'max_features': None, 'bootstrap': True, 'criterion': 'absolute_error'}. Best is trial 744 with value: 0.5032383725751689.
[I 2024-12-04 12:13:11,943] Trial 1231 finished with value: 0.5173447375761578 and parameters: {'n_estimators': 104, 'max_depth': 18, 'min_samples_split': 3, 'min_samples_leaf': 1, 'max_features': None, 'bootstrap': True, 'criterion': 'absolute_error'}. Best is trial 744 with value: 0.5032383725751689.
[I 2024-12-04 12:13:12,136] Trial 1243 finished with value: 1.2929127749881828 and parameters: {'n_estimators': 219, 'max_depth': 19, 'min_samples_split': 3, 'min_samples_leaf': 2, 'max_features': 'log2', 'bootstrap': True, 'criterion': 'absolute_error'}. Best is trial 744 with value: 0.5032383725751689.
[I 2024-12-04 12:13:12,138] Trial 1237 finished with value: 0.5146196598388686 and parameters: {'n_estimators': 104, 'max_depth': 17, 'min_samples_split': 2, 'min_samples_leaf': 1, 'max_features': None, 'bootstrap': True, 'criterion': 'absolute_error'}. Best is trial 744 with value: 0.5032383725751689.
[I 2024-12-04 12:13:12,270] Trial 1242 finished with value: 0.891243572159832 and parameters: {'n_estimators': 996, 'max_depth': 43, 'min_samples_split': 17, 'min_samples_leaf': 2, 'max_features': 'sqrt', 'bootstrap': True, 'criterion': 'squared_error'}. Best is trial 744 with value: 0.5032383725751689.
[I 2024-12-04 12:13:14,511] Trial 1229 finished with value: 0.5582219175921137 and parameters: {'n_estimators': 229, 'max_depth': 23, 'min_samples_split': 3, 'min_samples_leaf': 2, 'max_features': None, 'bootstrap': True, 'criterion': 'absolute_error'}. Best is trial 744 with value: 0.5032383725751689.
[I 2024-12-04 12:13:14,547] Trial 1241 finished with value: 0.5162838081732131 and parameters: {'n_estimators': 100, 'max_depth': 10, 'min_samples_split': 4, 'min_samples_leaf': 1, 'max_features': None, 'bootstrap': True, 'criterion': 'absolute_error'}. Best is trial 744 with value: 0.5032383725751689.
[I 2024-12-04 12:13:15,144] Trial 1234 finished with value: 0.5282876479678337 and parameters: {'n_estimators': 102, 'max_depth': 24, 'min_samples_split': 3, 'min_samples_leaf': 1, 'max_features': None, 'bootstrap': True, 'criterion': 'absolute_error'}. Best is trial 744 with value: 0.5032383725751689.
[I 2024-12-04 12:13:15,168] Trial 1224 finished with value: 0.6170744736913816 and parameters: {'n_estimators': 551, 'max_depth': 15, 'min_samples_split': 6, 'min_samples_leaf': 5, 'max_features': None, 'bootstrap': True, 'criterion': 'absolute_error'}. Best is trial 744 with value: 0.5032383725751689.
[I 2024-12-04 12:13:16,169] Trial 1225 finished with value: 0.5208556481636029 and parameters: {'n_estimators': 287, 'max_depth': 15, 'min_samples_split': 7, 'min_samples_leaf': 1, 'max_features': None, 'bootstrap': True, 'criterion': 'absolute_error'}. Best is trial 744 with value: 0.5032383725751689.
[I 2024-12-04 12:13:17,088] Trial 1245 finished with value: 0.5066351746778262 and parameters: {'n_estimators': 124, 'max_depth': 18, 'min_samples_split': 4, 'min_samples_leaf': 1, 'max_features': None, 'bootstrap': True, 'criterion': 'absolute_error'}. Best is trial 744 with value: 0.5032383725751689.
[I 2024-12-04 12:13:17,124] Trial 1236 finished with value: 0.5261881198274717 and parameters: {'n_estimators': 111, 'max_depth': 25, 'min_samples_split': 7, 'min_samples_leaf': 1, 'max_features': None, 'bootstrap': True, 'criterion': 'absolute_error'}. Best is trial 744 with value: 0.5032383725751689.
[I 2024-12-04 12:13:18,088] Trial 1230 finished with value: 0.5175414526484821 and parameters: {'n_estimators': 242, 'max_depth': 23, 'min_samples_split': 4, 'min_samples_leaf': 1, 'max_features': None, 'bootstrap': True, 'criterion': 'absolute_error'}. Best is trial 744 with value: 0.5032383725751689.
[I 2024-12-04 12:13:20,407] Trial 1232 finished with value: 0.5171184095438216 and parameters: {'n_estimators': 242, 'max_depth': 18, 'min_samples_split': 2, 'min_samples_leaf': 1, 'max_features': None, 'bootstrap': True, 'criterion': 'absolute_error'}. Best is trial 744 with value: 0.5032383725751689.
[I 2024-12-04 12:13:22,722] Trial 1247 finished with value: 0.5136142164332202 and parameters: {'n_estimators': 100, 'max_depth': 15, 'min_samples_split': 4, 'min_samples_leaf': 1, 'max_features': None, 'bootstrap': True, 'criterion': 'absolute_error'}. Best is trial 744 with value: 0.5032383725751689.
[I 2024-12-04 12:13:22,918] Trial 1244 finished with value: 0.5127770574087823 and parameters: {'n_estimators': 127, 'max_depth': 21, 'min_samples_split': 5, 'min_samples_leaf': 1, 'max_features': None, 'bootstrap': True, 'criterion': 'absolute_error'}. Best is trial 744 with value: 0.5032383725751689.
[I 2024-12-04 12:13:22,935] Trial 1240 finished with value: 0.5955828408970208 and parameters: {'n_estimators': 251, 'max_depth': 50, 'min_samples_split': 3, 'min_samples_leaf': 1, 'max_features': None, 'bootstrap': False, 'criterion': 'squared_error'}. Best is trial 744 with value: 0.5032383725751689.
[I 2024-12-04 12:13:24,485] Trial 1254 finished with value: 1.0279228809220715 and parameters: {'n_estimators': 223, 'max_depth': 18, 'min_samples_split': 4, 'min_samples_leaf': 1, 'max_features': 'log2', 'bootstrap': False, 'criterion': 'absolute_error'}. Best is trial 744 with value: 0.5032383725751689.
[I 2024-12-04 12:13:24,975] Trial 1239 finished with value: 0.5574942965715632 and parameters: {'n_estimators': 301, 'max_depth': 26, 'min_samples_split': 6, 'min_samples_leaf': 2, 'max_features': None, 'bootstrap': True, 'criterion': 'absolute_error'}. Best is trial 744 with value: 0.5032383725751689.
[I 2024-12-04 12:13:25,207] Trial 1249 finished with value: 0.5596032116429027 and parameters: {'n_estimators': 112, 'max_depth': 26, 'min_samples_split': 5, 'min_samples_leaf': 2, 'max_features': None, 'bootstrap': True, 'criterion': 'absolute_error'}. Best is trial 744 with value: 0.5032383725751689.
[I 2024-12-04 12:13:25,213] Trial 1248 finished with value: 0.5189216469664802 and parameters: {'n_estimators': 372, 'max_depth': 22, 'min_samples_split': 4, 'min_samples_leaf': 1, 'max_features': None, 'bootstrap': True, 'criterion': 'squared_error'}. Best is trial 744 with value: 0.5032383725751689.
[I 2024-12-04 12:13:25,308] Trial 1238 finished with value: 0.5200727924960279 and parameters: {'n_estimators': 243, 'max_depth': 22, 'min_samples_split': 6, 'min_samples_leaf': 1, 'max_features': None, 'bootstrap': True, 'criterion': 'absolute_error'}. Best is trial 744 with value: 0.5032383725751689.
[I 2024-12-04 12:13:26,599] Trial 1259 finished with value: 0.7741683928523305 and parameters: {'n_estimators': 143, 'max_depth': 49, 'min_samples_split': 20, 'min_samples_leaf': 1, 'max_features': 'log2', 'bootstrap': False, 'criterion': 'absolute_error'}. Best is trial 744 with value: 0.5032383725751689.
[I 2024-12-04 12:13:26,727] Trial 1257 finished with value: 0.511696664592772 and parameters: {'n_estimators': 106, 'max_depth': 25, 'min_samples_split': 4, 'min_samples_leaf': 1, 'max_features': None, 'bootstrap': True, 'criterion': 'absolute_error'}. Best is trial 744 with value: 0.5032383725751689.
[I 2024-12-04 12:13:26,926] Trial 1253 finished with value: 0.5139987791453094 and parameters: {'n_estimators': 105, 'max_depth': 21, 'min_samples_split': 6, 'min_samples_leaf': 1, 'max_features': None, 'bootstrap': True, 'criterion': 'absolute_error'}. Best is trial 744 with value: 0.5032383725751689.
[I 2024-12-04 12:13:27,322] Trial 1250 finished with value: 0.5226640928933326 and parameters: {'n_estimators': 101, 'max_depth': 23, 'min_samples_split': 7, 'min_samples_leaf': 1, 'max_features': None, 'bootstrap': True, 'criterion': 'absolute_error'}. Best is trial 744 with value: 0.5032383725751689.
[I 2024-12-04 12:13:28,199] Trial 1260 finished with value: 0.5195427456295986 and parameters: {'n_estimators': 126, 'max_depth': 28, 'min_samples_split': 5, 'min_samples_leaf': 1, 'max_features': None, 'bootstrap': True, 'criterion': 'squared_error'}. Best is trial 744 with value: 0.5032383725751689.
[I 2024-12-04 12:13:28,707] Trial 1258 finished with value: 0.559381610672547 and parameters: {'n_estimators': 100, 'max_depth': 24, 'min_samples_split': 7, 'min_samples_leaf': 2, 'max_features': None, 'bootstrap': True, 'criterion': 'absolute_error'}. Best is trial 744 with value: 0.5032383725751689.
[I 2024-12-04 12:13:29,868] Trial 1267 finished with value: 1.2153646487777574 and parameters: {'n_estimators': 114, 'max_depth': 5, 'min_samples_split': 2, 'min_samples_leaf': 2, 'max_features': 'sqrt', 'bootstrap': True, 'criterion': 'absolute_error'}. Best is trial 744 with value: 0.5032383725751689.
[I 2024-12-04 12:13:30,644] Trial 1263 finished with value: 1.1162733715036857 and parameters: {'n_estimators': 613, 'max_depth': 23, 'min_samples_split': 11, 'min_samples_leaf': 4, 'max_features': 'sqrt', 'bootstrap': True, 'criterion': 'squared_error'}. Best is trial 744 with value: 0.5032383725751689.
[I 2024-12-04 12:13:32,192] Trial 1255 finished with value: 0.558955765730319 and parameters: {'n_estimators': 225, 'max_depth': 20, 'min_samples_split': 4, 'min_samples_leaf': 2, 'max_features': None, 'bootstrap': True, 'criterion': 'absolute_error'}. Best is trial 744 with value: 0.5032383725751689.
[I 2024-12-04 12:13:33,230] Trial 1256 finished with value: 0.7176909336045828 and parameters: {'n_estimators': 639, 'max_depth': 41, 'min_samples_split': 2, 'min_samples_leaf': 10, 'max_features': None, 'bootstrap': True, 'criterion': 'squared_error'}. Best is trial 744 with value: 0.5032383725751689.
[I 2024-12-04 12:13:37,133] Trial 1273 finished with value: 1.1927643810415465 and parameters: {'n_estimators': 262, 'max_depth': 50, 'min_samples_split': 49, 'min_samples_leaf': 5, 'max_features': 'sqrt', 'bootstrap': False, 'criterion': 'absolute_error'}. Best is trial 744 with value: 0.5032383725751689.
[I 2024-12-04 12:13:37,133] Trial 1262 finished with value: 0.5186373321707702 and parameters: {'n_estimators': 120, 'max_depth': 20, 'min_samples_split': 3, 'min_samples_leaf': 1, 'max_features': None, 'bootstrap': True, 'criterion': 'absolute_error'}. Best is trial 744 with value: 0.5032383725751689.
[I 2024-12-04 12:13:37,252] Trial 1251 finished with value: 0.5176118208350275 and parameters: {'n_estimators': 247, 'max_depth': 16, 'min_samples_split': 3, 'min_samples_leaf': 1, 'max_features': None, 'bootstrap': True, 'criterion': 'absolute_error'}. Best is trial 744 with value: 0.5032383725751689.
[I 2024-12-04 12:13:43,144] Trial 1252 finished with value: 0.7638607839764922 and parameters: {'n_estimators': 965, 'max_depth': 44, 'min_samples_split': 16, 'min_samples_leaf': 9, 'max_features': None, 'bootstrap': True, 'criterion': 'absolute_error'}. Best is trial 744 with value: 0.5032383725751689.
[I 2024-12-04 12:13:43,213] Trial 1270 finished with value: 0.5093291654595964 and parameters: {'n_estimators': 100, 'max_depth': 20, 'min_samples_split': 4, 'min_samples_leaf': 1, 'max_features': None, 'bootstrap': True, 'criterion': 'absolute_error'}. Best is trial 744 with value: 0.5032383725751689.
[I 2024-12-04 12:13:44,705] Trial 1272 finished with value: 0.5548864176089879 and parameters: {'n_estimators': 100, 'max_depth': 24, 'min_samples_split': 3, 'min_samples_leaf': 2, 'max_features': None, 'bootstrap': True, 'criterion': 'absolute_error'}. Best is trial 744 with value: 0.5032383725751689.
[I 2024-12-04 12:13:44,809] Trial 1275 finished with value: 0.5583300573748631 and parameters: {'n_estimators': 119, 'max_depth': 20, 'min_samples_split': 5, 'min_samples_leaf': 2, 'max_features': None, 'bootstrap': True, 'criterion': 'absolute_error'}. Best is trial 744 with value: 0.5032383725751689.
[I 2024-12-04 12:13:46,551] Trial 1274 finished with value: 0.5232748267872137 and parameters: {'n_estimators': 103, 'max_depth': 20, 'min_samples_split': 7, 'min_samples_leaf': 1, 'max_features': None, 'bootstrap': True, 'criterion': 'absolute_error'}. Best is trial 744 with value: 0.5032383725751689.
[I 2024-12-04 12:13:46,645] Trial 1277 finished with value: 1.0569557589077612 and parameters: {'n_estimators': 195, 'max_depth': 17, 'min_samples_split': 4, 'min_samples_leaf': 1, 'max_features': 'log2', 'bootstrap': True, 'criterion': 'absolute_error'}. Best is trial 744 with value: 0.5032383725751689.
[I 2024-12-04 12:13:47,380] Trial 1246 finished with value: 0.5934496884316227 and parameters: {'n_estimators': 986, 'max_depth': 44, 'min_samples_split': 5, 'min_samples_leaf': 1, 'max_features': 'sqrt', 'bootstrap': False, 'criterion': 'absolute_error'}. Best is trial 744 with value: 0.5032383725751689.
[I 2024-12-04 12:13:47,703] Trial 1280 finished with value: 0.5099701712747646 and parameters: {'n_estimators': 107, 'max_depth': 18, 'min_samples_split': 6, 'min_samples_leaf': 1, 'max_features': None, 'bootstrap': True, 'criterion': 'absolute_error'}. Best is trial 744 with value: 0.5032383725751689.
[I 2024-12-04 12:13:47,708] Trial 1271 finished with value: 0.5648661175356119 and parameters: {'n_estimators': 122, 'max_depth': 20, 'min_samples_split': 4, 'min_samples_leaf': 1, 'max_features': None, 'bootstrap': False, 'criterion': 'absolute_error'}. Best is trial 744 with value: 0.5032383725751689.
[I 2024-12-04 12:13:48,346] Trial 1278 finished with value: 1.2435118109957213 and parameters: {'n_estimators': 904, 'max_depth': 47, 'min_samples_split': 30, 'min_samples_leaf': 9, 'max_features': 'log2', 'bootstrap': True, 'criterion': 'squared_error'}. Best is trial 744 with value: 0.5032383725751689.
[I 2024-12-04 12:13:49,156] Trial 1282 finished with value: 0.5114650580243058 and parameters: {'n_estimators': 113, 'max_depth': 21, 'min_samples_split': 5, 'min_samples_leaf': 1, 'max_features': None, 'bootstrap': True, 'criterion': 'absolute_error'}. Best is trial 744 with value: 0.5032383725751689.
[I 2024-12-04 12:13:49,260] Trial 1286 finished with value: 1.2186399264473307 and parameters: {'n_estimators': 649, 'max_depth': 6, 'min_samples_split': 31, 'min_samples_leaf': 15, 'max_features': 'sqrt', 'bootstrap': False, 'criterion': 'squared_error'}. Best is trial 744 with value: 0.5032383725751689.
[I 2024-12-04 12:13:49,353] Trial 1266 finished with value: 0.5214605789003242 and parameters: {'n_estimators': 252, 'max_depth': 22, 'min_samples_split': 4, 'min_samples_leaf': 1, 'max_features': None, 'bootstrap': True, 'criterion': 'absolute_error'}. Best is trial 744 with value: 0.5032383725751689.
[I 2024-12-04 12:13:49,672] Trial 1235 finished with value: 0.5326900592115992 and parameters: {'n_estimators': 336, 'max_depth': 32, 'min_samples_split': 10, 'min_samples_leaf': 1, 'max_features': None, 'bootstrap': False, 'criterion': 'absolute_error'}. Best is trial 744 with value: 0.5032383725751689.
[I 2024-12-04 12:13:50,970] Trial 1276 finished with value: 0.511197311481193 and parameters: {'n_estimators': 117, 'max_depth': 12, 'min_samples_split': 2, 'min_samples_leaf': 1, 'max_features': None, 'bootstrap': True, 'criterion': 'absolute_error'}. Best is trial 744 with value: 0.5032383725751689.
[I 2024-12-04 12:13:51,247] Trial 1264 finished with value: 0.5165713423791357 and parameters: {'n_estimators': 270, 'max_depth': 17, 'min_samples_split': 3, 'min_samples_leaf': 1, 'max_features': None, 'bootstrap': True, 'criterion': 'absolute_error'}. Best is trial 744 with value: 0.5032383725751689.
[I 2024-12-04 12:13:51,776] Trial 1279 finished with value: 0.5131473144575561 and parameters: {'n_estimators': 101, 'max_depth': 26, 'min_samples_split': 4, 'min_samples_leaf': 1, 'max_features': None, 'bootstrap': True, 'criterion': 'absolute_error'}. Best is trial 744 with value: 0.5032383725751689.
[I 2024-12-04 12:13:52,534] Trial 1261 finished with value: 0.5204594001277032 and parameters: {'n_estimators': 292, 'max_depth': 22, 'min_samples_split': 4, 'min_samples_leaf': 1, 'max_features': None, 'bootstrap': True, 'criterion': 'absolute_error'}. Best is trial 744 with value: 0.5032383725751689.
[I 2024-12-04 12:13:53,110] Trial 1268 finished with value: 0.5216457355937227 and parameters: {'n_estimators': 249, 'max_depth': 18, 'min_samples_split': 7, 'min_samples_leaf': 1, 'max_features': None, 'bootstrap': True, 'criterion': 'absolute_error'}. Best is trial 744 with value: 0.5032383725751689.
[I 2024-12-04 12:13:53,498] Trial 1284 finished with value: 0.5180245761144885 and parameters: {'n_estimators': 135, 'max_depth': 18, 'min_samples_split': 3, 'min_samples_leaf': 1, 'max_features': None, 'bootstrap': True, 'criterion': 'absolute_error'}. Best is trial 744 with value: 0.5032383725751689.
[I 2024-12-04 12:13:54,457] Trial 1265 finished with value: 0.5211275257612785 and parameters: {'n_estimators': 281, 'max_depth': 29, 'min_samples_split': 2, 'min_samples_leaf': 1, 'max_features': None, 'bootstrap': True, 'criterion': 'absolute_error'}. Best is trial 744 with value: 0.5032383725751689.
[I 2024-12-04 12:13:54,460] Trial 1281 finished with value: 0.5659919064669517 and parameters: {'n_estimators': 516, 'max_depth': 28, 'min_samples_split': 31, 'min_samples_leaf': 1, 'max_features': None, 'bootstrap': True, 'criterion': 'squared_error'}. Best is trial 744 with value: 0.5032383725751689.
[I 2024-12-04 12:13:54,461] Trial 1287 finished with value: 0.5201382194799259 and parameters: {'n_estimators': 108, 'max_depth': 18, 'min_samples_split': 6, 'min_samples_leaf': 1, 'max_features': None, 'bootstrap': True, 'criterion': 'squared_error'}. Best is trial 744 with value: 0.5032383725751689.
[I 2024-12-04 12:13:54,473] Trial 1288 finished with value: 0.5041955874758516 and parameters: {'n_estimators': 108, 'max_depth': 16, 'min_samples_split': 4, 'min_samples_leaf': 1, 'max_features': None, 'bootstrap': True, 'criterion': 'absolute_error'}. Best is trial 744 with value: 0.5032383725751689.
[I 2024-12-04 12:13:54,866] Trial 1283 finished with value: 1.1896886940770641 and parameters: {'n_estimators': 781, 'max_depth': 49, 'min_samples_split': 6, 'min_samples_leaf': 11, 'max_features': 'sqrt', 'bootstrap': False, 'criterion': 'squared_error'}. Best is trial 744 with value: 0.5032383725751689.
[I 2024-12-04 12:13:55,900] Trial 1269 finished with value: 0.5205446576388962 and parameters: {'n_estimators': 193, 'max_depth': 22, 'min_samples_split': 3, 'min_samples_leaf': 1, 'max_features': None, 'bootstrap': True, 'criterion': 'absolute_error'}. Best is trial 744 with value: 0.5032383725751689.
[I 2024-12-04 12:13:57,503] Trial 1285 finished with value: 0.7739919123913825 and parameters: {'n_estimators': 690, 'max_depth': 38, 'min_samples_split': 8, 'min_samples_leaf': 1, 'max_features': 'log2', 'bootstrap': True, 'criterion': 'squared_error'}. Best is trial 744 with value: 0.5032383725751689.
[I 2024-12-04 12:13:57,891] Trial 1299 finished with value: 0.659196061930342 and parameters: {'n_estimators': 432, 'max_depth': 29, 'min_samples_split': 6, 'min_samples_leaf': 8, 'max_features': None, 'bootstrap': True, 'criterion': 'squared_error'}. Best is trial 744 with value: 0.5032383725751689.
[I 2024-12-04 12:13:58,696] Trial 1301 finished with value: 1.05890924566889 and parameters: {'n_estimators': 592, 'max_depth': 10, 'min_samples_split': 3, 'min_samples_leaf': 1, 'max_features': 'log2', 'bootstrap': False, 'criterion': 'squared_error'}. Best is trial 744 with value: 0.5032383725751689.
[I 2024-12-04 12:13:58,795] Trial 1293 finished with value: 0.7367084721271883 and parameters: {'n_estimators': 136, 'max_depth': 27, 'min_samples_split': 6, 'min_samples_leaf': 1, 'max_features': 'sqrt', 'bootstrap': True, 'criterion': 'absolute_error'}. Best is trial 744 with value: 0.5032383725751689.
[I 2024-12-04 12:14:00,088] Trial 1304 finished with value: 0.8644962635068096 and parameters: {'n_estimators': 527, 'max_depth': 39, 'min_samples_split': 6, 'min_samples_leaf': 3, 'max_features': 'sqrt', 'bootstrap': False, 'criterion': 'squared_error'}. Best is trial 744 with value: 0.5032383725751689.
[I 2024-12-04 12:14:05,165] Trial 1297 finished with value: 0.5134308738256826 and parameters: {'n_estimators': 108, 'max_depth': 19, 'min_samples_split': 2, 'min_samples_leaf': 1, 'max_features': None, 'bootstrap': True, 'criterion': 'absolute_error'}. Best is trial 744 with value: 0.5032383725751689.
[I 2024-12-04 12:14:05,166] Trial 1294 finished with value: 0.5164487359900849 and parameters: {'n_estimators': 116, 'max_depth': 21, 'min_samples_split': 3, 'min_samples_leaf': 1, 'max_features': None, 'bootstrap': True, 'criterion': 'absolute_error'}. Best is trial 744 with value: 0.5032383725751689.
[I 2024-12-04 12:14:05,606] Trial 1296 finished with value: 0.5314496299526387 and parameters: {'n_estimators': 696, 'max_depth': 45, 'min_samples_split': 7, 'min_samples_leaf': 1, 'max_features': None, 'bootstrap': True, 'criterion': 'squared_error'}. Best is trial 744 with value: 0.5032383725751689.
