[I 2024-12-04 12:20:07,916] Trial 1726 finished with value: 0.559386919189465 and parameters: {'n_estimators': 268, 'max_depth': 20, 'min_samples_split': 5, 'min_samples_leaf': 2, 'max_features': None, 'bootstrap': True, 'criterion': 'absolute_error'}. Best is trial 744 with value: 0.5032383725751689.
[I 2024-12-04 12:20:08,012] Trial 1722 finished with value: 0.5179440275714209 and parameters: {'n_estimators': 255, 'max_depth': 17, 'min_samples_split': 5, 'min_samples_leaf': 1, 'max_features': None, 'bootstrap': True, 'criterion': 'absolute_error'}. Best is trial 744 with value: 0.5032383725751689.
[I 2024-12-04 12:20:08,408] Trial 1716 finished with value: 0.6154786059117905 and parameters: {'n_estimators': 331, 'max_depth': 20, 'min_samples_split': 5, 'min_samples_leaf': 2, 'max_features': None, 'bootstrap': False, 'criterion': 'absolute_error'}. Best is trial 744 with value: 0.5032383725751689.
[I 2024-12-04 12:20:10,245] Trial 1727 finished with value: 0.5762567814594189 and parameters: {'n_estimators': 139, 'max_depth': 19, 'min_samples_split': 3, 'min_samples_leaf': 1, 'max_features': None, 'bootstrap': False, 'criterion': 'absolute_error'}. Best is trial 744 with value: 0.5032383725751689.
[I 2024-12-04 12:20:10,958] Trial 1724 finished with value: 0.5173558472223574 and parameters: {'n_estimators': 242, 'max_depth': 21, 'min_samples_split': 5, 'min_samples_leaf': 1, 'max_features': None, 'bootstrap': True, 'criterion': 'absolute_error'}. Best is trial 744 with value: 0.5032383725751689.
[I 2024-12-04 12:20:11,268] Trial 1733 finished with value: 0.5778138809716581 and parameters: {'n_estimators': 421, 'max_depth': 6, 'min_samples_split': 32, 'min_samples_leaf': 1, 'max_features': None, 'bootstrap': True, 'criterion': 'squared_error'}. Best is trial 744 with value: 0.5032383725751689.
[I 2024-12-04 12:20:13,456] Trial 1740 finished with value: 0.515404520409388 and parameters: {'n_estimators': 114, 'max_depth': 25, 'min_samples_split': 6, 'min_samples_leaf': 1, 'max_features': None, 'bootstrap': True, 'criterion': 'absolute_error'}. Best is trial 744 with value: 0.5032383725751689.
[I 2024-12-04 12:20:13,542] Trial 1720 finished with value: 0.520486664339071 and parameters: {'n_estimators': 273, 'max_depth': 16, 'min_samples_split': 7, 'min_samples_leaf': 1, 'max_features': None, 'bootstrap': True, 'criterion': 'absolute_error'}. Best is trial 744 with value: 0.5032383725751689.
[I 2024-12-04 12:20:13,977] Trial 1735 finished with value: 0.5270579657243373 and parameters: {'n_estimators': 103, 'max_depth': 22, 'min_samples_split': 11, 'min_samples_leaf': 1, 'max_features': None, 'bootstrap': True, 'criterion': 'absolute_error'}. Best is trial 744 with value: 0.5032383725751689.
[I 2024-12-04 12:20:13,978] Trial 1745 finished with value: 0.5101003693123464 and parameters: {'n_estimators': 108, 'max_depth': 13, 'min_samples_split': 4, 'min_samples_leaf': 1, 'max_features': None, 'bootstrap': True, 'criterion': 'absolute_error'}. Best is trial 744 with value: 0.5032383725751689.
[I 2024-12-04 12:20:15,281] Trial 1748 finished with value: 0.5183854980992739 and parameters: {'n_estimators': 101, 'max_depth': 16, 'min_samples_split': 7, 'min_samples_leaf': 1, 'max_features': None, 'bootstrap': True, 'criterion': 'absolute_error'}. Best is trial 744 with value: 0.5032383725751689.
[I 2024-12-04 12:20:15,369] Trial 1739 finished with value: 0.5165770012202684 and parameters: {'n_estimators': 102, 'max_depth': 17, 'min_samples_split': 3, 'min_samples_leaf': 1, 'max_features': None, 'bootstrap': True, 'criterion': 'absolute_error'}. Best is trial 744 with value: 0.5032383725751689.
[I 2024-12-04 12:20:16,067] Trial 1728 finished with value: 0.5166171371010329 and parameters: {'n_estimators': 242, 'max_depth': 14, 'min_samples_split': 5, 'min_samples_leaf': 1, 'max_features': None, 'bootstrap': True, 'criterion': 'absolute_error'}. Best is trial 744 with value: 0.5032383725751689.
[I 2024-12-04 12:20:16,209] Trial 1751 finished with value: 0.9267038644122587 and parameters: {'n_estimators': 122, 'max_depth': 29, 'min_samples_split': 6, 'min_samples_leaf': 1, 'max_features': 'log2', 'bootstrap': True, 'criterion': 'absolute_error'}. Best is trial 744 with value: 0.5032383725751689.
[I 2024-12-04 12:20:16,316] Trial 1736 finished with value: 0.5584489748998225 and parameters: {'n_estimators': 285, 'max_depth': 24, 'min_samples_split': 4, 'min_samples_leaf': 2, 'max_features': None, 'bootstrap': True, 'criterion': 'absolute_error'}. Best is trial 744 with value: 0.5032383725751689.
[I 2024-12-04 12:20:16,877] Trial 1732 finished with value: 0.5614210764793801 and parameters: {'n_estimators': 267, 'max_depth': 5, 'min_samples_split': 3, 'min_samples_leaf': 1, 'max_features': None, 'bootstrap': True, 'criterion': 'absolute_error'}. Best is trial 744 with value: 0.5032383725751689.
[I 2024-12-04 12:20:17,218] Trial 1734 finished with value: 0.5212269625075105 and parameters: {'n_estimators': 248, 'max_depth': 22, 'min_samples_split': 3, 'min_samples_leaf': 1, 'max_features': None, 'bootstrap': True, 'criterion': 'absolute_error'}. Best is trial 744 with value: 0.5032383725751689.
[I 2024-12-04 12:20:17,219] Trial 1747 finished with value: 0.512436712800411 and parameters: {'n_estimators': 104, 'max_depth': 17, 'min_samples_split': 4, 'min_samples_leaf': 1, 'max_features': None, 'bootstrap': True, 'criterion': 'absolute_error'}. Best is trial 744 with value: 0.5032383725751689.
[I 2024-12-04 12:20:20,165] Trial 1746 finished with value: 0.5142310628433107 and parameters: {'n_estimators': 105, 'max_depth': 26, 'min_samples_split': 3, 'min_samples_leaf': 1, 'max_features': None, 'bootstrap': True, 'criterion': 'absolute_error'}. Best is trial 1749 with value: 0.502720715661024.
[I 2024-12-04 12:20:20,206] Trial 1742 finished with value: 0.5203457670121548 and parameters: {'n_estimators': 116, 'max_depth': 29, 'min_samples_split': 2, 'min_samples_leaf': 1, 'max_features': None, 'bootstrap': True, 'criterion': 'absolute_error'}. Best is trial 1749 with value: 0.502720715661024.
[I 2024-12-04 12:20:20,743] Trial 1753 finished with value: 0.5366177753141937 and parameters: {'n_estimators': 103, 'max_depth': 6, 'min_samples_split': 4, 'min_samples_leaf': 1, 'max_features': None, 'bootstrap': True, 'criterion': 'absolute_error'}. Best is trial 1749 with value: 0.502720715661024.
[I 2024-12-04 12:20:21,237] Trial 1750 finished with value: 1.1495734067700911 and parameters: {'n_estimators': 786, 'max_depth': 8, 'min_samples_split': 4, 'min_samples_leaf': 5, 'max_features': 'sqrt', 'bootstrap': True, 'criterion': 'squared_error'}. Best is trial 1749 with value: 0.502720715661024.
[I 2024-12-04 12:20:22,314] Trial 1757 finished with value: 1.2282627572281382 and parameters: {'n_estimators': 382, 'max_depth': 28, 'min_samples_split': 4, 'min_samples_leaf': 5, 'max_features': 'log2', 'bootstrap': True, 'criterion': 'squared_error'}. Best is trial 1749 with value: 0.502720715661024.
[I 2024-12-04 12:20:22,462] Trial 1749 finished with value: 0.502720715661024 and parameters: {'n_estimators': 101, 'max_depth': 16, 'min_samples_split': 4, 'min_samples_leaf': 1, 'max_features': None, 'bootstrap': True, 'criterion': 'absolute_error'}. Best is trial 1749 with value: 0.502720715661024.
[I 2024-12-04 12:20:22,512] Trial 1743 finished with value: 0.5872195179421842 and parameters: {'n_estimators': 948, 'max_depth': 47, 'min_samples_split': 14, 'min_samples_leaf': 1, 'max_features': None, 'bootstrap': False, 'criterion': 'squared_error'}. Best is trial 1749 with value: 0.502720715661024.
[I 2024-12-04 12:20:24,044] Trial 1761 finished with value: 0.78098314776862 and parameters: {'n_estimators': 104, 'max_depth': 21, 'min_samples_split': 3, 'min_samples_leaf': 1, 'max_features': 'sqrt', 'bootstrap': True, 'criterion': 'absolute_error'}. Best is trial 1749 with value: 0.502720715661024.
[I 2024-12-04 12:20:24,698] Trial 1752 finished with value: 0.5269813848722984 and parameters: {'n_estimators': 100, 'max_depth': 24, 'min_samples_split': 3, 'min_samples_leaf': 1, 'max_features': None, 'bootstrap': True, 'criterion': 'absolute_error'}. Best is trial 1749 with value: 0.502720715661024.
[I 2024-12-04 12:20:25,028] Trial 1756 finished with value: 0.510380672804359 and parameters: {'n_estimators': 107, 'max_depth': 23, 'min_samples_split': 6, 'min_samples_leaf': 1, 'max_features': None, 'bootstrap': True, 'criterion': 'absolute_error'}. Best is trial 1749 with value: 0.502720715661024.
[I 2024-12-04 12:20:25,637] Trial 1744 finished with value: 0.517638021923827 and parameters: {'n_estimators': 241, 'max_depth': 16, 'min_samples_split': 2, 'min_samples_leaf': 1, 'max_features': None, 'bootstrap': True, 'criterion': 'absolute_error'}. Best is trial 1749 with value: 0.502720715661024.
[I 2024-12-04 12:20:25,866] Trial 1764 finished with value: 0.6356213485788208 and parameters: {'n_estimators': 173, 'max_depth': 22, 'min_samples_split': 5, 'min_samples_leaf': 2, 'max_features': None, 'bootstrap': False, 'criterion': 'squared_error'}. Best is trial 1749 with value: 0.502720715661024.
[I 2024-12-04 12:20:26,801] Trial 1758 finished with value: 1.3478733471666793 and parameters: {'n_estimators': 430, 'max_depth': 27, 'min_samples_split': 22, 'min_samples_leaf': 10, 'max_features': 'log2', 'bootstrap': False, 'criterion': 'absolute_error'}. Best is trial 1749 with value: 0.502720715661024.
[I 2024-12-04 12:20:29,414] Trial 1755 finished with value: 0.5539883529954459 and parameters: {'n_estimators': 983, 'max_depth': 44, 'min_samples_split': 7, 'min_samples_leaf': 2, 'max_features': None, 'bootstrap': True, 'criterion': 'squared_error'}. Best is trial 1749 with value: 0.502720715661024.
[I 2024-12-04 12:20:29,523] Trial 1759 finished with value: 0.5564732593637055 and parameters: {'n_estimators': 178, 'max_depth': 15, 'min_samples_split': 2, 'min_samples_leaf': 2, 'max_features': None, 'bootstrap': True, 'criterion': 'absolute_error'}. Best is trial 1749 with value: 0.502720715661024.
[I 2024-12-04 12:20:30,167] Trial 1766 finished with value: 0.5104606462079334 and parameters: {'n_estimators': 106, 'max_depth': 13, 'min_samples_split': 4, 'min_samples_leaf': 1, 'max_features': None, 'bootstrap': True, 'criterion': 'absolute_error'}. Best is trial 1749 with value: 0.502720715661024.
[I 2024-12-04 12:20:30,727] Trial 1774 finished with value: 0.6506844277556861 and parameters: {'n_estimators': 346, 'max_depth': 31, 'min_samples_split': 3, 'min_samples_leaf': 1, 'max_features': 'sqrt', 'bootstrap': True, 'criterion': 'squared_error'}. Best is trial 1749 with value: 0.502720715661024.
[I 2024-12-04 12:20:31,236] Trial 1763 finished with value: 1.1865259776506245 and parameters: {'n_estimators': 955, 'max_depth': 10, 'min_samples_split': 33, 'min_samples_leaf': 1, 'max_features': 'log2', 'bootstrap': False, 'criterion': 'absolute_error'}. Best is trial 1749 with value: 0.502720715661024.
[I 2024-12-04 12:20:31,815] Trial 1768 finished with value: 0.5212095488150716 and parameters: {'n_estimators': 114, 'max_depth': 10, 'min_samples_split': 2, 'min_samples_leaf': 1, 'max_features': None, 'bootstrap': True, 'criterion': 'absolute_error'}. Best is trial 1749 with value: 0.502720715661024.
[I 2024-12-04 12:20:32,718] Trial 1770 finished with value: 0.5585981388429702 and parameters: {'n_estimators': 122, 'max_depth': 17, 'min_samples_split': 3, 'min_samples_leaf': 2, 'max_features': None, 'bootstrap': True, 'criterion': 'absolute_error'}. Best is trial 1749 with value: 0.502720715661024.
[I 2024-12-04 12:20:36,007] Trial 1769 finished with value: 0.508931450750559 and parameters: {'n_estimators': 103, 'max_depth': 13, 'min_samples_split': 5, 'min_samples_leaf': 1, 'max_features': None, 'bootstrap': True, 'criterion': 'absolute_error'}. Best is trial 1749 with value: 0.502720715661024.
[I 2024-12-04 12:20:38,310] Trial 1773 finished with value: 0.5608910533423617 and parameters: {'n_estimators': 106, 'max_depth': 17, 'min_samples_split': 8, 'min_samples_leaf': 2, 'max_features': None, 'bootstrap': True, 'criterion': 'absolute_error'}. Best is trial 1749 with value: 0.502720715661024.
[I 2024-12-04 12:20:40,028] Trial 1771 finished with value: 0.5554049455918552 and parameters: {'n_estimators': 116, 'max_depth': 16, 'min_samples_split': 3, 'min_samples_leaf': 2, 'max_features': None, 'bootstrap': True, 'criterion': 'absolute_error'}. Best is trial 1749 with value: 0.502720715661024.
[I 2024-12-04 12:20:41,572] Trial 1760 finished with value: 0.5132970340082066 and parameters: {'n_estimators': 282, 'max_depth': 18, 'min_samples_split': 5, 'min_samples_leaf': 1, 'max_features': None, 'bootstrap': True, 'criterion': 'absolute_error'}. Best is trial 1749 with value: 0.502720715661024.
[I 2024-12-04 12:20:42,012] Trial 1772 finished with value: 0.5086307508811018 and parameters: {'n_estimators': 107, 'max_depth': 12, 'min_samples_split': 2, 'min_samples_leaf': 1, 'max_features': None, 'bootstrap': True, 'criterion': 'absolute_error'}. Best is trial 1749 with value: 0.502720715661024.
[I 2024-12-04 12:20:44,258] Trial 1781 finished with value: 0.513321198429843 and parameters: {'n_estimators': 100, 'max_depth': 21, 'min_samples_split': 4, 'min_samples_leaf': 1, 'max_features': None, 'bootstrap': True, 'criterion': 'absolute_error'}. Best is trial 1749 with value: 0.502720715661024.
[I 2024-12-04 12:20:44,277] Trial 1765 finished with value: 0.5181996309516388 and parameters: {'n_estimators': 220, 'max_depth': 15, 'min_samples_split': 3, 'min_samples_leaf': 1, 'max_features': None, 'bootstrap': True, 'criterion': 'absolute_error'}. Best is trial 1749 with value: 0.502720715661024.
[I 2024-12-04 12:20:44,372] Trial 1762 finished with value: 0.5153183440012136 and parameters: {'n_estimators': 289, 'max_depth': 14, 'min_samples_split': 4, 'min_samples_leaf': 1, 'max_features': None, 'bootstrap': True, 'criterion': 'absolute_error'}. Best is trial 1749 with value: 0.502720715661024.
[I 2024-12-04 12:20:45,980] Trial 1782 finished with value: 0.5524719429330784 and parameters: {'n_estimators': 101, 'max_depth': 13, 'min_samples_split': 6, 'min_samples_leaf': 2, 'max_features': None, 'bootstrap': True, 'criterion': 'absolute_error'}. Best is trial 1749 with value: 0.502720715661024.
[I 2024-12-04 12:20:46,048] Trial 1779 finished with value: 0.5148783878633206 and parameters: {'n_estimators': 103, 'max_depth': 15, 'min_samples_split': 3, 'min_samples_leaf': 1, 'max_features': None, 'bootstrap': True, 'criterion': 'absolute_error'}. Best is trial 1749 with value: 0.502720715661024.
[I 2024-12-04 12:20:46,050] Trial 1785 finished with value: 0.612299279707009 and parameters: {'n_estimators': 112, 'max_depth': 22, 'min_samples_split': 2, 'min_samples_leaf': 2, 'max_features': None, 'bootstrap': False, 'criterion': 'absolute_error'}. Best is trial 1749 with value: 0.502720715661024.
[I 2024-12-04 12:20:48,392] Trial 1780 finished with value: 0.5142763458818598 and parameters: {'n_estimators': 110, 'max_depth': 21, 'min_samples_split': 4, 'min_samples_leaf': 1, 'max_features': None, 'bootstrap': True, 'criterion': 'absolute_error'}. Best is trial 1749 with value: 0.502720715661024.
[I 2024-12-04 12:20:49,026] Trial 1775 finished with value: 0.5389099110779816 and parameters: {'n_estimators': 231, 'max_depth': 7, 'min_samples_split': 22, 'min_samples_leaf': 2, 'max_features': None, 'bootstrap': False, 'criterion': 'absolute_error'}. Best is trial 1749 with value: 0.502720715661024.
[I 2024-12-04 12:20:49,162] Trial 1783 finished with value: 0.5175709544655602 and parameters: {'n_estimators': 110, 'max_depth': 18, 'min_samples_split': 3, 'min_samples_leaf': 1, 'max_features': None, 'bootstrap': True, 'criterion': 'absolute_error'}. Best is trial 1749 with value: 0.502720715661024.
[I 2024-12-04 12:20:49,414] Trial 1789 finished with value: 0.5210416030097066 and parameters: {'n_estimators': 104, 'max_depth': 10, 'min_samples_split': 7, 'min_samples_leaf': 1, 'max_features': None, 'bootstrap': True, 'criterion': 'absolute_error'}. Best is trial 1749 with value: 0.502720715661024.
[I 2024-12-04 12:20:49,826] Trial 1787 finished with value: 0.5158078937133479 and parameters: {'n_estimators': 102, 'max_depth': 14, 'min_samples_split': 7, 'min_samples_leaf': 1, 'max_features': None, 'bootstrap': True, 'criterion': 'absolute_error'}. Best is trial 1749 with value: 0.502720715661024.
[I 2024-12-04 12:20:50,864] Trial 1793 finished with value: 0.5396807928364615 and parameters: {'n_estimators': 101, 'max_depth': 6, 'min_samples_split': 5, 'min_samples_leaf': 1, 'max_features': None, 'bootstrap': True, 'criterion': 'absolute_error'}. Best is trial 1749 with value: 0.502720715661024.
[I 2024-12-04 12:20:50,956] Trial 1788 finished with value: 0.616579624555836 and parameters: {'n_estimators': 419, 'max_depth': 31, 'min_samples_split': 42, 'min_samples_leaf': 2, 'max_features': None, 'bootstrap': False, 'criterion': 'squared_error'}. Best is trial 1749 with value: 0.502720715661024.
[I 2024-12-04 12:20:50,999] Trial 1754 finished with value: 0.5182076032341696 and parameters: {'n_estimators': 456, 'max_depth': 20, 'min_samples_split': 3, 'min_samples_leaf': 1, 'max_features': None, 'bootstrap': True, 'criterion': 'absolute_error'}. Best is trial 1749 with value: 0.502720715661024.
[I 2024-12-04 12:20:51,789] Trial 1790 finished with value: 0.5491965862631255 and parameters: {'n_estimators': 138, 'max_depth': 17, 'min_samples_split': 5, 'min_samples_leaf': 2, 'max_features': None, 'bootstrap': True, 'criterion': 'squared_error'}. Best is trial 1749 with value: 0.502720715661024.
[I 2024-12-04 12:20:52,104] Trial 1767 finished with value: 0.5173507402447236 and parameters: {'n_estimators': 248, 'max_depth': 12, 'min_samples_split': 4, 'min_samples_leaf': 1, 'max_features': None, 'bootstrap': True, 'criterion': 'absolute_error'}. Best is trial 1749 with value: 0.502720715661024.
[I 2024-12-04 12:20:52,918] Trial 1795 finished with value: 0.5556802090584927 and parameters: {'n_estimators': 107, 'max_depth': 16, 'min_samples_split': 4, 'min_samples_leaf': 2, 'max_features': None, 'bootstrap': True, 'criterion': 'squared_error'}. Best is trial 1749 with value: 0.502720715661024.
[I 2024-12-04 12:20:53,563] Trial 1778 finished with value: 0.5561034855932455 and parameters: {'n_estimators': 293, 'max_depth': 12, 'min_samples_split': 4, 'min_samples_leaf': 2, 'max_features': None, 'bootstrap': True, 'criterion': 'absolute_error'}. Best is trial 1749 with value: 0.502720715661024.
[I 2024-12-04 12:20:55,637] Trial 1777 finished with value: 0.5182320462686505 and parameters: {'n_estimators': 257, 'max_depth': 15, 'min_samples_split': 3, 'min_samples_leaf': 1, 'max_features': None, 'bootstrap': True, 'criterion': 'absolute_error'}. Best is trial 1749 with value: 0.502720715661024.
[I 2024-12-04 12:20:57,559] Trial 1786 finished with value: 0.5543721283465616 and parameters: {'n_estimators': 113, 'max_depth': 22, 'min_samples_split': 3, 'min_samples_leaf': 2, 'max_features': None, 'bootstrap': True, 'criterion': 'absolute_error'}. Best is trial 1749 with value: 0.502720715661024.
[I 2024-12-04 12:20:58,471] Trial 1804 finished with value: 1.2834555467013462 and parameters: {'n_estimators': 137, 'max_depth': 19, 'min_samples_split': 5, 'min_samples_leaf': 2, 'max_features': 'log2', 'bootstrap': True, 'criterion': 'absolute_error'}. Best is trial 1749 with value: 0.502720715661024.
[I 2024-12-04 12:20:58,617] Trial 1784 finished with value: 0.5168261174926593 and parameters: {'n_estimators': 250, 'max_depth': 18, 'min_samples_split': 2, 'min_samples_leaf': 1, 'max_features': None, 'bootstrap': True, 'criterion': 'absolute_error'}. Best is trial 1749 with value: 0.502720715661024.
[I 2024-12-04 12:21:00,133] Trial 1798 finished with value: 0.5150175687537768 and parameters: {'n_estimators': 107, 'max_depth': 21, 'min_samples_split': 3, 'min_samples_leaf': 1, 'max_features': None, 'bootstrap': True, 'criterion': 'absolute_error'}. Best is trial 1749 with value: 0.502720715661024.
[I 2024-12-04 12:21:01,057] Trial 1776 finished with value: 0.5302349779832471 and parameters: {'n_estimators': 242, 'max_depth': 16, 'min_samples_split': 12, 'min_samples_leaf': 1, 'max_features': None, 'bootstrap': True, 'criterion': 'absolute_error'}. Best is trial 1749 with value: 0.502720715661024.
[I 2024-12-04 12:21:02,364] Trial 1800 finished with value: 0.5066892071558041 and parameters: {'n_estimators': 101, 'max_depth': 13, 'min_samples_split': 5, 'min_samples_leaf': 1, 'max_features': None, 'bootstrap': True, 'criterion': 'absolute_error'}. Best is trial 1749 with value: 0.502720715661024.
[I 2024-12-04 12:21:02,618] Trial 1803 finished with value: 1.044233873795868 and parameters: {'n_estimators': 337, 'max_depth': 37, 'min_samples_split': 16, 'min_samples_leaf': 3, 'max_features': 'sqrt', 'bootstrap': True, 'criterion': 'squared_error'}. Best is trial 1749 with value: 0.502720715661024.
[I 2024-12-04 12:21:03,409] Trial 1802 finished with value: 0.5337681571964344 and parameters: {'n_estimators': 121, 'max_depth': 32, 'min_samples_split': 2, 'min_samples_leaf': 1, 'max_features': None, 'bootstrap': True, 'criterion': 'squared_error'}. Best is trial 1749 with value: 0.502720715661024.
[I 2024-12-04 12:21:03,594] Trial 1791 finished with value: 0.5165648648560371 and parameters: {'n_estimators': 224, 'max_depth': 16, 'min_samples_split': 5, 'min_samples_leaf': 1, 'max_features': None, 'bootstrap': True, 'criterion': 'absolute_error'}. Best is trial 1749 with value: 0.502720715661024.
[I 2024-12-04 12:21:03,726] Trial 1809 finished with value: 1.1838943516447 and parameters: {'n_estimators': 184, 'max_depth': 44, 'min_samples_split': 6, 'min_samples_leaf': 3, 'max_features': 'log2', 'bootstrap': False, 'criterion': 'squared_error'}. Best is trial 1749 with value: 0.502720715661024.
