[I 2024-12-04 12:14:58,630] A new study created in RDB with name: Vc_gb
[I 2024-12-04 12:15:06,699] Trial 12 finished with value: 1.0084486023779113 and parameters: {'n_estimators': 289, 'learning_rate': 0.013979646703034617, 'max_depth': 12, 'min_samples_split': 5, 'min_samples_leaf': 10, 'subsample': 0.622091292357755, 'max_features': 'sqrt'}. Best is trial 12 with value: 1.0084486023779113.
[I 2024-12-04 12:15:10,962] Trial 0 finished with value: 0.5006438326692731 and parameters: {'n_estimators': 870, 'learning_rate': 0.0820480903599822, 'max_depth': 8, 'min_samples_split': 4, 'min_samples_leaf': 7, 'subsample': 0.8637088622183673, 'max_features': 'log2'}. Best is trial 0 with value: 0.5006438326692731.
[I 2024-12-04 12:15:14,466] Trial 13 finished with value: 0.48115246021194036 and parameters: {'n_estimators': 289, 'learning_rate': 0.010699812387432206, 'max_depth': 4, 'min_samples_split': 2, 'min_samples_leaf': 3, 'subsample': 0.7409781875834224, 'max_features': None}. Best is trial 13 with value: 0.48115246021194036.
[I 2024-12-04 12:15:15,350] Trial 26 finished with value: 0.5706834443733626 and parameters: {'n_estimators': 111, 'learning_rate': 0.012521879588574363, 'max_depth': 7, 'min_samples_split': 13, 'min_samples_leaf': 8, 'subsample': 0.9136398955404579, 'max_features': None}. Best is trial 13 with value: 0.48115246021194036.
[I 2024-12-04 12:15:17,740] Trial 14 finished with value: 0.4313400774182241 and parameters: {'n_estimators': 279, 'learning_rate': 0.051239890084234255, 'max_depth': 4, 'min_samples_split': 18, 'min_samples_leaf': 7, 'subsample': 0.6774580326290729, 'max_features': None}. Best is trial 14 with value: 0.4313400774182241.
[I 2024-12-04 12:15:18,341] Trial 4 finished with value: 0.8390305458791336 and parameters: {'n_estimators': 408, 'learning_rate': 0.014670836031057894, 'max_depth': 3, 'min_samples_split': 14, 'min_samples_leaf': 5, 'subsample': 0.6840661925642905, 'max_features': 'sqrt'}. Best is trial 14 with value: 0.4313400774182241.
[I 2024-12-04 12:15:19,819] Trial 11 finished with value: 0.7867206814440596 and parameters: {'n_estimators': 574, 'learning_rate': 0.013062089862049148, 'max_depth': 7, 'min_samples_split': 14, 'min_samples_leaf': 10, 'subsample': 0.7127740736331746, 'max_features': 'sqrt'}. Best is trial 14 with value: 0.4313400774182241.
[I 2024-12-04 12:15:19,914] Trial 17 finished with value: 0.6244497263762215 and parameters: {'n_estimators': 688, 'learning_rate': 0.09671521929214466, 'max_depth': 9, 'min_samples_split': 12, 'min_samples_leaf': 10, 'subsample': 0.6580814249989442, 'max_features': 'log2'}. Best is trial 14 with value: 0.4313400774182241.
[I 2024-12-04 12:15:21,845] Trial 1 finished with value: 0.4143273876729477 and parameters: {'n_estimators': 1020, 'learning_rate': 0.035270209771555705, 'max_depth': 4, 'min_samples_split': 2, 'min_samples_leaf': 5, 'subsample': 0.6764691907372337, 'max_features': None}. Best is trial 1 with value: 0.4143273876729477.
[I 2024-12-04 12:15:21,908] Trial 31 finished with value: 0.5890676820438725 and parameters: {'n_estimators': 298, 'learning_rate': 0.027262284754400592, 'max_depth': 12, 'min_samples_split': 8, 'min_samples_leaf': 7, 'subsample': 0.8173411803272375, 'max_features': 'sqrt'}. Best is trial 1 with value: 0.4143273876729477.
[I 2024-12-04 12:15:22,944] Trial 30 finished with value: 0.41350768505314617 and parameters: {'n_estimators': 297, 'learning_rate': 0.07887936822287067, 'max_depth': 10, 'min_samples_split': 16, 'min_samples_leaf': 3, 'subsample': 0.9119434521488622, 'max_features': None}. Best is trial 30 with value: 0.41350768505314617.
[I 2024-12-04 12:15:24,810] Trial 21 finished with value: 0.7486715096937328 and parameters: {'n_estimators': 640, 'learning_rate': 0.04873249888924332, 'max_depth': 9, 'min_samples_split': 13, 'min_samples_leaf': 7, 'subsample': 0.8764246355783112, 'max_features': 'log2'}. Best is trial 30 with value: 0.41350768505314617.
[I 2024-12-04 12:15:24,813] Trial 20 finished with value: 0.47313854006538353 and parameters: {'n_estimators': 602, 'learning_rate': 0.01633898363411396, 'max_depth': 8, 'min_samples_split': 13, 'min_samples_leaf': 6, 'subsample': 0.9690913027289965, 'max_features': 'sqrt'}. Best is trial 30 with value: 0.41350768505314617.
[I 2024-12-04 12:15:25,815] Trial 37 finished with value: 0.4354892558978618 and parameters: {'n_estimators': 122, 'learning_rate': 0.05664685672777176, 'max_depth': 4, 'min_samples_split': 5, 'min_samples_leaf': 5, 'subsample': 0.811473441585507, 'max_features': None}. Best is trial 30 with value: 0.41350768505314617.
[I 2024-12-04 12:15:29,408] Trial 2 finished with value: 0.7198235604784025 and parameters: {'n_estimators': 721, 'learning_rate': 0.049926853515904444, 'max_depth': 9, 'min_samples_split': 19, 'min_samples_leaf': 10, 'subsample': 0.8086504489651061, 'max_features': 'log2'}. Best is trial 30 with value: 0.41350768505314617.
[I 2024-12-04 12:15:30,369] Trial 35 finished with value: 0.44894722222223454 and parameters: {'n_estimators': 309, 'learning_rate': 0.02962556479617922, 'max_depth': 9, 'min_samples_split': 6, 'min_samples_leaf': 4, 'subsample': 0.911975677434802, 'max_features': None}. Best is trial 41 with value: 0.3651045771689226.
[I 2024-12-04 12:15:30,376] Trial 41 finished with value: 0.3651045771689226 and parameters: {'n_estimators': 102, 'learning_rate': 0.055900581900970865, 'max_depth': 11, 'min_samples_split': 19, 'min_samples_leaf': 2, 'subsample': 0.9798779529373006, 'max_features': None}. Best is trial 41 with value: 0.3651045771689226.
[I 2024-12-04 12:15:31,898] Trial 6 finished with value: 0.38895422724902434 and parameters: {'n_estimators': 692, 'learning_rate': 0.023141804467842187, 'max_depth': 7, 'min_samples_split': 19, 'min_samples_leaf': 4, 'subsample': 0.975371032907068, 'max_features': 'sqrt'}. Best is trial 41 with value: 0.3651045771689226.
[I 2024-12-04 12:15:32,129] Trial 9 finished with value: 0.9199347483969301 and parameters: {'n_estimators': 593, 'learning_rate': 0.012869617834353007, 'max_depth': 5, 'min_samples_split': 17, 'min_samples_leaf': 4, 'subsample': 0.905843166482774, 'max_features': 'log2'}. Best is trial 41 with value: 0.3651045771689226.
[I 2024-12-04 12:15:34,600] Trial 38 finished with value: 0.4002846331642053 and parameters: {'n_estimators': 305, 'learning_rate': 0.021162450524049463, 'max_depth': 11, 'min_samples_split': 10, 'min_samples_leaf': 1, 'subsample': 0.6182485132287525, 'max_features': 'sqrt'}. Best is trial 41 with value: 0.3651045771689226.
[I 2024-12-04 12:15:35,105] Trial 7 finished with value: 0.38813278430017883 and parameters: {'n_estimators': 1128, 'learning_rate': 0.017374546818570282, 'max_depth': 10, 'min_samples_split': 14, 'min_samples_leaf': 5, 'subsample': 0.8122042237753697, 'max_features': 'sqrt'}. Best is trial 41 with value: 0.3651045771689226.
[I 2024-12-04 12:15:36,694] Trial 40 finished with value: 0.3403672683256174 and parameters: {'n_estimators': 253, 'learning_rate': 0.09853033625895777, 'max_depth': 8, 'min_samples_split': 12, 'min_samples_leaf': 2, 'subsample': 0.789314004693435, 'max_features': None}. Best is trial 40 with value: 0.3403672683256174.
[I 2024-12-04 12:15:37,343] Trial 25 finished with value: 0.4039507883503367 and parameters: {'n_estimators': 741, 'learning_rate': 0.08473242621369034, 'max_depth': 11, 'min_samples_split': 5, 'min_samples_leaf': 7, 'subsample': 0.9535294781552758, 'max_features': 'sqrt'}. Best is trial 40 with value: 0.3403672683256174.
[I 2024-12-04 12:15:39,275] Trial 22 finished with value: 0.3604195717649274 and parameters: {'n_estimators': 726, 'learning_rate': 0.02862416233210993, 'max_depth': 12, 'min_samples_split': 14, 'min_samples_leaf': 3, 'subsample': 0.7421876076869278, 'max_features': 'sqrt'}. Best is trial 40 with value: 0.3403672683256174.
[I 2024-12-04 12:15:39,862] Trial 29 finished with value: 0.4489415559779395 and parameters: {'n_estimators': 836, 'learning_rate': 0.044996137968490446, 'max_depth': 7, 'min_samples_split': 2, 'min_samples_leaf': 8, 'subsample': 0.7341971921962136, 'max_features': None}. Best is trial 40 with value: 0.3403672683256174.
[I 2024-12-04 12:15:40,064] Trial 33 finished with value: 0.44555382012114664 and parameters: {'n_estimators': 654, 'learning_rate': 0.05345378726187639, 'max_depth': 9, 'min_samples_split': 3, 'min_samples_leaf': 8, 'subsample': 0.900119859401211, 'max_features': None}. Best is trial 40 with value: 0.3403672683256174.
[I 2024-12-04 12:15:41,182] Trial 18 finished with value: 0.48290566573408505 and parameters: {'n_estimators': 834, 'learning_rate': 0.03238040421016766, 'max_depth': 8, 'min_samples_split': 17, 'min_samples_leaf': 10, 'subsample': 0.8311193275810622, 'max_features': None}. Best is trial 40 with value: 0.3403672683256174.
[I 2024-12-04 12:15:44,314] Trial 5 finished with value: 0.4296567070239279 and parameters: {'n_estimators': 1125, 'learning_rate': 0.0691008344898442, 'max_depth': 3, 'min_samples_split': 19, 'min_samples_leaf': 8, 'subsample': 0.978083802022401, 'max_features': None}. Best is trial 40 with value: 0.3403672683256174.
[I 2024-12-04 12:15:44,772] Trial 24 finished with value: 0.5454043145311014 and parameters: {'n_estimators': 1002, 'learning_rate': 0.02417010051441724, 'max_depth': 5, 'min_samples_split': 6, 'min_samples_leaf': 10, 'subsample': 0.7524200515024724, 'max_features': 'sqrt'}. Best is trial 40 with value: 0.3403672683256174.
[I 2024-12-04 12:15:44,826] Trial 46 finished with value: 0.5102179523669841 and parameters: {'n_estimators': 323, 'learning_rate': 0.04374856160986838, 'max_depth': 12, 'min_samples_split': 14, 'min_samples_leaf': 2, 'subsample': 0.944886212628735, 'max_features': 'log2'}. Best is trial 40 with value: 0.3403672683256174.
[I 2024-12-04 12:15:45,079] Trial 48 finished with value: 0.45692207554760395 and parameters: {'n_estimators': 265, 'learning_rate': 0.02216732171615234, 'max_depth': 10, 'min_samples_split': 20, 'min_samples_leaf': 2, 'subsample': 0.9038626227933653, 'max_features': 'sqrt'}. Best is trial 40 with value: 0.3403672683256174.
[I 2024-12-04 12:15:46,877] Trial 45 finished with value: 0.3647557365068663 and parameters: {'n_estimators': 353, 'learning_rate': 0.07702662995428378, 'max_depth': 11, 'min_samples_split': 7, 'min_samples_leaf': 1, 'subsample': 0.9529865471502771, 'max_features': None}. Best is trial 16 with value: 0.24131607807430555.
[I 2024-12-04 12:15:47,543] Trial 43 finished with value: 0.4415128914683396 and parameters: {'n_estimators': 410, 'learning_rate': 0.05255688628972066, 'max_depth': 12, 'min_samples_split': 13, 'min_samples_leaf': 5, 'subsample': 0.8743632687100601, 'max_features': None}. Best is trial 16 with value: 0.24131607807430555.
[I 2024-12-04 12:15:48,032] Trial 16 finished with value: 0.24131607807430555 and parameters: {'n_estimators': 1417, 'learning_rate': 0.03219586705276714, 'max_depth': 9, 'min_samples_split': 3, 'min_samples_leaf': 1, 'subsample': 0.8718570734387718, 'max_features': 'sqrt'}. Best is trial 16 with value: 0.24131607807430555.
[I 2024-12-04 12:15:49,537] Trial 28 finished with value: 0.6057122465063539 and parameters: {'n_estimators': 1089, 'learning_rate': 0.09292864794016323, 'max_depth': 11, 'min_samples_split': 5, 'min_samples_leaf': 10, 'subsample': 0.6896326284789271, 'max_features': 'log2'}. Best is trial 16 with value: 0.24131607807430555.
[I 2024-12-04 12:15:49,592] Trial 51 finished with value: 0.3359401586301068 and parameters: {'n_estimators': 259, 'learning_rate': 0.08749097175340226, 'max_depth': 8, 'min_samples_split': 6, 'min_samples_leaf': 1, 'subsample': 0.7001098778309228, 'max_features': None}. Best is trial 16 with value: 0.24131607807430555.
[I 2024-12-04 12:15:49,593] Trial 10 finished with value: 0.405078036013822 and parameters: {'n_estimators': 1294, 'learning_rate': 0.0635228269082836, 'max_depth': 11, 'min_samples_split': 17, 'min_samples_leaf': 7, 'subsample': 0.9430016899383424, 'max_features': 'sqrt'}. Best is trial 16 with value: 0.24131607807430555.
[I 2024-12-04 12:15:51,151] Trial 19 finished with value: 0.48634779682767265 and parameters: {'n_estimators': 980, 'learning_rate': 0.012225285052086223, 'max_depth': 5, 'min_samples_split': 2, 'min_samples_leaf': 10, 'subsample': 0.7972145362119216, 'max_features': None}. Best is trial 16 with value: 0.24131607807430555.
[I 2024-12-04 12:15:52,173] Trial 23 finished with value: 0.42979144093833394 and parameters: {'n_estimators': 1092, 'learning_rate': 0.010791327514626808, 'max_depth': 3, 'min_samples_split': 2, 'min_samples_leaf': 5, 'subsample': 0.8750649588829185, 'max_features': None}. Best is trial 16 with value: 0.24131607807430555.
[I 2024-12-04 12:15:52,485] Trial 34 finished with value: 0.44146231046588424 and parameters: {'n_estimators': 879, 'learning_rate': 0.026258214201906722, 'max_depth': 11, 'min_samples_split': 5, 'min_samples_leaf': 3, 'subsample': 0.932439861832798, 'max_features': None}. Best is trial 16 with value: 0.24131607807430555.
[I 2024-12-04 12:15:53,315] Trial 57 finished with value: 0.38615775188157553 and parameters: {'n_estimators': 246, 'learning_rate': 0.06286160588694989, 'max_depth': 12, 'min_samples_split': 19, 'min_samples_leaf': 3, 'subsample': 0.8995313209165321, 'max_features': 'sqrt'}. Best is trial 16 with value: 0.24131607807430555.
[I 2024-12-04 12:15:53,694] Trial 32 finished with value: 0.417763255422605 and parameters: {'n_estimators': 1150, 'learning_rate': 0.05007591465115378, 'max_depth': 5, 'min_samples_split': 2, 'min_samples_leaf': 3, 'subsample': 0.9150667370798686, 'max_features': 'log2'}. Best is trial 16 with value: 0.24131607807430555.
[I 2024-12-04 12:15:53,822] Trial 55 finished with value: 0.36537900362129544 and parameters: {'n_estimators': 197, 'learning_rate': 0.07108998292951868, 'max_depth': 11, 'min_samples_split': 19, 'min_samples_leaf': 1, 'subsample': 0.974949161965563, 'max_features': None}. Best is trial 16 with value: 0.24131607807430555.
[I 2024-12-04 12:15:55,089] Trial 27 finished with value: 0.4529439596089825 and parameters: {'n_estimators': 1364, 'learning_rate': 0.06633159252883039, 'max_depth': 4, 'min_samples_split': 6, 'min_samples_leaf': 7, 'subsample': 0.9726288811658798, 'max_features': 'log2'}. Best is trial 16 with value: 0.24131607807430555.
[I 2024-12-04 12:15:55,398] Trial 53 finished with value: 0.38451163919634146 and parameters: {'n_estimators': 401, 'learning_rate': 0.08877418919250066, 'max_depth': 8, 'min_samples_split': 15, 'min_samples_leaf': 3, 'subsample': 0.6474713193038477, 'max_features': None}. Best is trial 16 with value: 0.24131607807430555.
[I 2024-12-04 12:15:55,426] Trial 56 finished with value: 0.35809937516920815 and parameters: {'n_estimators': 306, 'learning_rate': 0.030820806504622142, 'max_depth': 8, 'min_samples_split': 17, 'min_samples_leaf': 2, 'subsample': 0.9432282222375583, 'max_features': None}. Best is trial 16 with value: 0.24131607807430555.
[I 2024-12-04 12:15:56,283] Trial 36 finished with value: 0.4355237790088264 and parameters: {'n_estimators': 904, 'learning_rate': 0.06267915820114853, 'max_depth': 7, 'min_samples_split': 12, 'min_samples_leaf': 6, 'subsample': 0.8974260093242652, 'max_features': None}. Best is trial 16 with value: 0.24131607807430555.
[I 2024-12-04 12:15:56,338] Trial 54 finished with value: 0.32903365011749164 and parameters: {'n_estimators': 394, 'learning_rate': 0.0665278526953355, 'max_depth': 6, 'min_samples_split': 14, 'min_samples_leaf': 1, 'subsample': 0.8107596671622365, 'max_features': None}. Best is trial 16 with value: 0.24131607807430555.
[I 2024-12-04 12:15:56,801] Trial 47 finished with value: 0.4049239534525361 and parameters: {'n_estimators': 661, 'learning_rate': 0.024981966312415227, 'max_depth': 6, 'min_samples_split': 19, 'min_samples_leaf': 3, 'subsample': 0.995699380168133, 'max_features': 'sqrt'}. Best is trial 16 with value: 0.24131607807430555.
[I 2024-12-04 12:15:57,372] Trial 44 finished with value: 0.4103412710941305 and parameters: {'n_estimators': 857, 'learning_rate': 0.03724275151975003, 'max_depth': 3, 'min_samples_split': 3, 'min_samples_leaf': 5, 'subsample': 0.6195871651037542, 'max_features': None}. Best is trial 16 with value: 0.24131607807430555.
[I 2024-12-04 12:15:57,407] Trial 39 finished with value: 0.2964407899254633 and parameters: {'n_estimators': 1005, 'learning_rate': 0.0369017748563305, 'max_depth': 11, 'min_samples_split': 10, 'min_samples_leaf': 2, 'subsample': 0.6002361976338838, 'max_features': 'sqrt'}. Best is trial 16 with value: 0.24131607807430555.
[I 2024-12-04 12:15:58,654] Trial 15 finished with value: 0.4858081306258562 and parameters: {'n_estimators': 1498, 'learning_rate': 0.08647055979771313, 'max_depth': 5, 'min_samples_split': 6, 'min_samples_leaf': 9, 'subsample': 0.8108052152053298, 'max_features': 'log2'}. Best is trial 16 with value: 0.24131607807430555.
[I 2024-12-04 12:16:00,011] Trial 52 finished with value: 0.3874394977638531 and parameters: {'n_estimators': 645, 'learning_rate': 0.03642382388298866, 'max_depth': 9, 'min_samples_split': 19, 'min_samples_leaf': 4, 'subsample': 0.6746126736210893, 'max_features': 'sqrt'}. Best is trial 16 with value: 0.24131607807430555.
[I 2024-12-04 12:16:01,222] Trial 63 finished with value: 0.4427384588931294 and parameters: {'n_estimators': 199, 'learning_rate': 0.01920746653310887, 'max_depth': 8, 'min_samples_split': 15, 'min_samples_leaf': 3, 'subsample': 0.8540516734596095, 'max_features': None}. Best is trial 16 with value: 0.24131607807430555.
[I 2024-12-04 12:16:01,907] Trial 61 finished with value: 0.4429210923247901 and parameters: {'n_estimators': 232, 'learning_rate': 0.09526340944387808, 'max_depth': 11, 'min_samples_split': 6, 'min_samples_leaf': 3, 'subsample': 0.9621099418790607, 'max_features': None}. Best is trial 16 with value: 0.24131607807430555.
[I 2024-12-04 12:16:01,918] Trial 60 finished with value: 0.33911027330809873 and parameters: {'n_estimators': 419, 'learning_rate': 0.09266372768613247, 'max_depth': 8, 'min_samples_split': 4, 'min_samples_leaf': 1, 'subsample': 0.6841427865222708, 'max_features': None}. Best is trial 16 with value: 0.24131607807430555.
[I 2024-12-04 12:16:05,124] Trial 3 finished with value: 0.3354182410956494 and parameters: {'n_estimators': 1449, 'learning_rate': 0.024438294034594688, 'max_depth': 12, 'min_samples_split': 7, 'min_samples_leaf': 2, 'subsample': 0.6159299697333368, 'max_features': None}. Best is trial 16 with value: 0.24131607807430555.
[I 2024-12-04 12:16:05,210] Trial 8 finished with value: 0.4702824244619759 and parameters: {'n_estimators': 1488, 'learning_rate': 0.020683681543353094, 'max_depth': 4, 'min_samples_split': 8, 'min_samples_leaf': 9, 'subsample': 0.9223014012981433, 'max_features': None}. Best is trial 16 with value: 0.24131607807430555.
[I 2024-12-04 12:16:05,405] Trial 64 finished with value: 0.32628102841937384 and parameters: {'n_estimators': 350, 'learning_rate': 0.09188982060979595, 'max_depth': 5, 'min_samples_split': 16, 'min_samples_leaf': 2, 'subsample': 0.8804866758207278, 'max_features': None}. Best is trial 16 with value: 0.24131607807430555.
[I 2024-12-04 12:16:05,467] Trial 65 finished with value: 0.3533848974855434 and parameters: {'n_estimators': 107, 'learning_rate': 0.0688607585570126, 'max_depth': 9, 'min_samples_split': 11, 'min_samples_leaf': 1, 'subsample': 0.7590159865030038, 'max_features': None}. Best is trial 16 with value: 0.24131607807430555.
[I 2024-12-04 12:16:07,244] Trial 50 finished with value: 0.39674034746841413 and parameters: {'n_estimators': 1159, 'learning_rate': 0.011619327519943013, 'max_depth': 8, 'min_samples_split': 15, 'min_samples_leaf': 4, 'subsample': 0.777297544074109, 'max_features': 'sqrt'}. Best is trial 16 with value: 0.24131607807430555.
[I 2024-12-04 12:16:07,508] Trial 67 finished with value: 0.3211354938886273 and parameters: {'n_estimators': 236, 'learning_rate': 0.09070091435073853, 'max_depth': 7, 'min_samples_split': 8, 'min_samples_leaf': 1, 'subsample': 0.6719933786349852, 'max_features': 'sqrt'}. Best is trial 16 with value: 0.24131607807430555.
[I 2024-12-04 12:16:07,621] Trial 62 finished with value: 0.3642720951381548 and parameters: {'n_estimators': 613, 'learning_rate': 0.03627139581821031, 'max_depth': 12, 'min_samples_split': 11, 'min_samples_leaf': 3, 'subsample': 0.7477366902022514, 'max_features': 'sqrt'}. Best is trial 16 with value: 0.24131607807430555.
[I 2024-12-04 12:16:07,714] Trial 68 finished with value: 0.3448147957330892 and parameters: {'n_estimators': 235, 'learning_rate': 0.07689960366533939, 'max_depth': 8, 'min_samples_split': 11, 'min_samples_leaf': 2, 'subsample': 0.790262370226663, 'max_features': None}. Best is trial 16 with value: 0.24131607807430555.
[I 2024-12-04 12:16:08,614] Trial 58 finished with value: 0.2959126509117371 and parameters: {'n_estimators': 1205, 'learning_rate': 0.02837738583381793, 'max_depth': 9, 'min_samples_split': 3, 'min_samples_leaf': 2, 'subsample': 0.8266762749617975, 'max_features': 'sqrt'}. Best is trial 16 with value: 0.24131607807430555.
[I 2024-12-04 12:16:08,835] Trial 59 finished with value: 0.2671764025536204 and parameters: {'n_estimators': 1096, 'learning_rate': 0.02420984908985267, 'max_depth': 9, 'min_samples_split': 5, 'min_samples_leaf': 1, 'subsample': 0.9036429207241383, 'max_features': 'sqrt'}. Best is trial 16 with value: 0.24131607807430555.
[I 2024-12-04 12:16:09,579] Trial 49 finished with value: 0.5608962277082853 and parameters: {'n_estimators': 1196, 'learning_rate': 0.015771733879466586, 'max_depth': 11, 'min_samples_split': 12, 'min_samples_leaf': 3, 'subsample': 0.7913833111507588, 'max_features': 'log2'}. Best is trial 16 with value: 0.24131607807430555.
