[I 2024-12-04 11:57:06,042] Trial 132 finished with value: 0.3171917583005168 and parameters: {'n_estimators': 642, 'max_depth': 47, 'min_samples_split': 2, 'min_samples_leaf': 1, 'max_features': 'sqrt', 'bootstrap': True, 'criterion': 'squared_error'}. Best is trial 133 with value: 0.29356449467344287.
[I 2024-12-04 11:57:06,404] Trial 140 finished with value: 0.2986580025484221 and parameters: {'n_estimators': 607, 'max_depth': 50, 'min_samples_split': 2, 'min_samples_leaf': 1, 'max_features': 'sqrt', 'bootstrap': False, 'criterion': 'squared_error'}. Best is trial 133 with value: 0.29356449467344287.
[I 2024-12-04 11:57:09,527] Trial 156 finished with value: 0.442295015713773 and parameters: {'n_estimators': 256, 'max_depth': 50, 'min_samples_split': 4, 'min_samples_leaf': 2, 'max_features': 'sqrt', 'bootstrap': False, 'criterion': 'squared_error'}. Best is trial 133 with value: 0.29356449467344287.
[I 2024-12-04 11:57:09,577] Trial 148 finished with value: 0.2979590948150891 and parameters: {'n_estimators': 359, 'max_depth': 50, 'min_samples_split': 2, 'min_samples_leaf': 1, 'max_features': 'sqrt', 'bootstrap': False, 'criterion': 'squared_error'}. Best is trial 133 with value: 0.29356449467344287.
[I 2024-12-04 11:57:10,731] Trial 143 finished with value: 0.31660492488790964 and parameters: {'n_estimators': 389, 'max_depth': 49, 'min_samples_split': 2, 'min_samples_leaf': 1, 'max_features': 'sqrt', 'bootstrap': True, 'criterion': 'squared_error'}. Best is trial 133 with value: 0.29356449467344287.
[I 2024-12-04 11:57:14,244] Trial 162 finished with value: 0.29828455741892146 and parameters: {'n_estimators': 495, 'max_depth': 50, 'min_samples_split': 2, 'min_samples_leaf': 1, 'max_features': 'sqrt', 'bootstrap': False, 'criterion': 'squared_error'}. Best is trial 133 with value: 0.29356449467344287.
[I 2024-12-04 11:57:14,979] Trial 151 finished with value: 0.7821810430125359 and parameters: {'n_estimators': 884, 'max_depth': 20, 'min_samples_split': 9, 'min_samples_leaf': 6, 'max_features': 'sqrt', 'bootstrap': True, 'criterion': 'absolute_error'}. Best is trial 133 with value: 0.29356449467344287.
[I 2024-12-04 11:57:14,985] Trial 150 finished with value: 0.2966549636008956 and parameters: {'n_estimators': 807, 'max_depth': 49, 'min_samples_split': 2, 'min_samples_leaf': 1, 'max_features': 'sqrt', 'bootstrap': False, 'criterion': 'squared_error'}. Best is trial 133 with value: 0.29356449467344287.
[I 2024-12-04 11:57:16,673] Trial 153 finished with value: 0.29584479067365343 and parameters: {'n_estimators': 623, 'max_depth': 48, 'min_samples_split': 2, 'min_samples_leaf': 1, 'max_features': 'sqrt', 'bootstrap': False, 'criterion': 'squared_error'}. Best is trial 133 with value: 0.29356449467344287.
[I 2024-12-04 11:57:18,140] Trial 149 finished with value: 0.2947995039406126 and parameters: {'n_estimators': 192, 'max_depth': 49, 'min_samples_split': 2, 'min_samples_leaf': 1, 'max_features': 'sqrt', 'bootstrap': False, 'criterion': 'squared_error'}. Best is trial 133 with value: 0.29356449467344287.
[I 2024-12-04 11:57:18,590] Trial 163 finished with value: 0.29647833700164805 and parameters: {'n_estimators': 566, 'max_depth': 48, 'min_samples_split': 2, 'min_samples_leaf': 1, 'max_features': 'sqrt', 'bootstrap': False, 'criterion': 'squared_error'}. Best is trial 133 with value: 0.29356449467344287.
[I 2024-12-04 11:57:19,160] Trial 152 finished with value: 0.29417347816285944 and parameters: {'n_estimators': 387, 'max_depth': 50, 'min_samples_split': 3, 'min_samples_leaf': 1, 'max_features': 'sqrt', 'bootstrap': False, 'criterion': 'squared_error'}. Best is trial 133 with value: 0.29356449467344287.
[I 2024-12-04 11:57:19,237] Trial 154 finished with value: 0.29858410285697096 and parameters: {'n_estimators': 446, 'max_depth': 50, 'min_samples_split': 2, 'min_samples_leaf': 1, 'max_features': 'sqrt', 'bootstrap': False, 'criterion': 'squared_error'}. Best is trial 133 with value: 0.29356449467344287.
[I 2024-12-04 11:57:19,277] Trial 166 finished with value: 0.4418404638315442 and parameters: {'n_estimators': 543, 'max_depth': 45, 'min_samples_split': 2, 'min_samples_leaf': 2, 'max_features': 'sqrt', 'bootstrap': False, 'criterion': 'squared_error'}. Best is trial 133 with value: 0.29356449467344287.
[I 2024-12-04 11:57:19,281] Trial 164 finished with value: 0.2948889902150861 and parameters: {'n_estimators': 426, 'max_depth': 47, 'min_samples_split': 3, 'min_samples_leaf': 1, 'max_features': 'sqrt', 'bootstrap': False, 'criterion': 'squared_error'}. Best is trial 133 with value: 0.29356449467344287.
[I 2024-12-04 11:57:20,909] Trial 155 finished with value: 0.29632994497149945 and parameters: {'n_estimators': 545, 'max_depth': 49, 'min_samples_split': 2, 'min_samples_leaf': 1, 'max_features': 'sqrt', 'bootstrap': False, 'criterion': 'squared_error'}. Best is trial 133 with value: 0.29356449467344287.
[I 2024-12-04 11:57:23,040] Trial 158 finished with value: 0.298111616243548 and parameters: {'n_estimators': 504, 'max_depth': 50, 'min_samples_split': 2, 'min_samples_leaf': 1, 'max_features': 'sqrt', 'bootstrap': False, 'criterion': 'squared_error'}. Best is trial 133 with value: 0.29356449467344287.
[I 2024-12-04 11:57:25,283] Trial 159 finished with value: 0.3060175688301318 and parameters: {'n_estimators': 776, 'max_depth': 44, 'min_samples_split': 2, 'min_samples_leaf': 1, 'max_features': 'sqrt', 'bootstrap': False, 'criterion': 'squared_error'}. Best is trial 133 with value: 0.29356449467344287.
[I 2024-12-04 11:57:26,058] Trial 169 finished with value: 0.3006076035065806 and parameters: {'n_estimators': 726, 'max_depth': 47, 'min_samples_split': 2, 'min_samples_leaf': 1, 'max_features': 'sqrt', 'bootstrap': False, 'criterion': 'squared_error'}. Best is trial 133 with value: 0.29356449467344287.
[I 2024-12-04 11:57:26,718] Trial 167 finished with value: 0.2966592103044962 and parameters: {'n_estimators': 819, 'max_depth': 49, 'min_samples_split': 2, 'min_samples_leaf': 1, 'max_features': 'sqrt', 'bootstrap': False, 'criterion': 'squared_error'}. Best is trial 133 with value: 0.29356449467344287.
[I 2024-12-04 11:57:26,884] Trial 174 finished with value: 0.4020846452313623 and parameters: {'n_estimators': 270, 'max_depth': 49, 'min_samples_split': 4, 'min_samples_leaf': 1, 'max_features': 'log2', 'bootstrap': True, 'criterion': 'squared_error'}. Best is trial 133 with value: 0.29356449467344287.
[I 2024-12-04 11:57:28,143] Trial 160 finished with value: 0.2979945953386718 and parameters: {'n_estimators': 207, 'max_depth': 48, 'min_samples_split': 4, 'min_samples_leaf': 1, 'max_features': 'sqrt', 'bootstrap': False, 'criterion': 'squared_error'}. Best is trial 133 with value: 0.29356449467344287.
[I 2024-12-04 11:57:34,595] Trial 177 finished with value: 0.7429655896770492 and parameters: {'n_estimators': 212, 'max_depth': 49, 'min_samples_split': 5, 'min_samples_leaf': 5, 'max_features': 'sqrt', 'bootstrap': True, 'criterion': 'squared_error'}. Best is trial 133 with value: 0.29356449467344287.
[I 2024-12-04 11:57:34,661] Trial 176 finished with value: 0.796387843015393 and parameters: {'n_estimators': 184, 'max_depth': 38, 'min_samples_split': 46, 'min_samples_leaf': 6, 'max_features': 'sqrt', 'bootstrap': True, 'criterion': 'absolute_error'}. Best is trial 133 with value: 0.29356449467344287.
[I 2024-12-04 11:57:38,264] Trial 179 finished with value: 0.38430697836124217 and parameters: {'n_estimators': 315, 'max_depth': 50, 'min_samples_split': 4, 'min_samples_leaf': 1, 'max_features': None, 'bootstrap': False, 'criterion': 'squared_error'}. Best is trial 133 with value: 0.29356449467344287.
[I 2024-12-04 11:57:40,946] Trial 189 finished with value: 0.30996729407336815 and parameters: {'n_estimators': 129, 'max_depth': 49, 'min_samples_split': 6, 'min_samples_leaf': 1, 'max_features': 'sqrt', 'bootstrap': False, 'criterion': 'squared_error'}. Best is trial 133 with value: 0.29356449467344287.
[I 2024-12-04 11:57:40,954] Trial 175 finished with value: 0.8256759223610559 and parameters: {'n_estimators': 926, 'max_depth': 38, 'min_samples_split': 2, 'min_samples_leaf': 12, 'max_features': 'sqrt', 'bootstrap': False, 'criterion': 'squared_error'}. Best is trial 133 with value: 0.29356449467344287.
[I 2024-12-04 11:57:41,446] Trial 170 finished with value: 0.7849387797377066 and parameters: {'n_estimators': 194, 'max_depth': 10, 'min_samples_split': 2, 'min_samples_leaf': 1, 'max_features': 'log2', 'bootstrap': True, 'criterion': 'absolute_error'}. Best is trial 133 with value: 0.29356449467344287.
[I 2024-12-04 11:57:42,299] Trial 180 finished with value: 0.3031448962846813 and parameters: {'n_estimators': 623, 'max_depth': 45, 'min_samples_split': 2, 'min_samples_leaf': 1, 'max_features': 'sqrt', 'bootstrap': False, 'criterion': 'squared_error'}. Best is trial 133 with value: 0.29356449467344287.
[I 2024-12-04 11:57:42,656] Trial 173 finished with value: 0.29532689822078767 and parameters: {'n_estimators': 329, 'max_depth': 50, 'min_samples_split': 3, 'min_samples_leaf': 1, 'max_features': 'sqrt', 'bootstrap': False, 'criterion': 'squared_error'}. Best is trial 133 with value: 0.29356449467344287.
[I 2024-12-04 11:57:42,667] Trial 157 finished with value: 0.5678036320218812 and parameters: {'n_estimators': 683, 'max_depth': 14, 'min_samples_split': 2, 'min_samples_leaf': 1, 'max_features': 'sqrt', 'bootstrap': False, 'criterion': 'absolute_error'}. Best is trial 133 with value: 0.29356449467344287.
[I 2024-12-04 11:57:42,668] Trial 181 finished with value: 0.44270883344828155 and parameters: {'n_estimators': 800, 'max_depth': 49, 'min_samples_split': 3, 'min_samples_leaf': 2, 'max_features': 'sqrt', 'bootstrap': False, 'criterion': 'squared_error'}. Best is trial 133 with value: 0.29356449467344287.
[I 2024-12-04 11:57:43,028] Trial 165 finished with value: 0.4162742438735429 and parameters: {'n_estimators': 538, 'max_depth': 49, 'min_samples_split': 2, 'min_samples_leaf': 2, 'max_features': None, 'bootstrap': False, 'criterion': 'squared_error'}. Best is trial 133 with value: 0.29356449467344287.
[I 2024-12-04 11:57:47,425] Trial 185 finished with value: 0.4419045071643913 and parameters: {'n_estimators': 638, 'max_depth': 45, 'min_samples_split': 2, 'min_samples_leaf': 2, 'max_features': 'sqrt', 'bootstrap': False, 'criterion': 'squared_error'}. Best is trial 133 with value: 0.29356449467344287.
[I 2024-12-04 11:57:48,609] Trial 194 finished with value: 0.9669884912462637 and parameters: {'n_estimators': 123, 'max_depth': 14, 'min_samples_split': 2, 'min_samples_leaf': 11, 'max_features': 'log2', 'bootstrap': True, 'criterion': 'absolute_error'}. Best is trial 133 with value: 0.29356449467344287.
[I 2024-12-04 11:57:50,183] Trial 186 finished with value: 0.6737521464869118 and parameters: {'n_estimators': 419, 'max_depth': 11, 'min_samples_split': 4, 'min_samples_leaf': 4, 'max_features': 'sqrt', 'bootstrap': False, 'criterion': 'absolute_error'}. Best is trial 133 with value: 0.29356449467344287.
[I 2024-12-04 11:57:50,701] Trial 188 finished with value: 0.8428461345930258 and parameters: {'n_estimators': 728, 'max_depth': 23, 'min_samples_split': 16, 'min_samples_leaf': 13, 'max_features': 'sqrt', 'bootstrap': False, 'criterion': 'squared_error'}. Best is trial 133 with value: 0.29356449467344287.
[I 2024-12-04 11:57:52,696] Trial 172 finished with value: 0.848641186430231 and parameters: {'n_estimators': 904, 'max_depth': 9, 'min_samples_split': 2, 'min_samples_leaf': 2, 'max_features': 'log2', 'bootstrap': True, 'criterion': 'absolute_error'}. Best is trial 133 with value: 0.29356449467344287.
[I 2024-12-04 11:57:57,371] Trial 197 finished with value: 0.3168185295102011 and parameters: {'n_estimators': 132, 'max_depth': 50, 'min_samples_split': 2, 'min_samples_leaf': 1, 'max_features': 'sqrt', 'bootstrap': True, 'criterion': 'squared_error'}. Best is trial 133 with value: 0.29356449467344287.
[I 2024-12-04 11:57:57,417] Trial 184 finished with value: 0.3468683911740572 and parameters: {'n_estimators': 799, 'max_depth': 45, 'min_samples_split': 3, 'min_samples_leaf': 2, 'max_features': None, 'bootstrap': True, 'criterion': 'squared_error'}. Best is trial 133 with value: 0.29356449467344287.
[I 2024-12-04 11:57:58,878] Trial 195 finished with value: 0.29479910064627857 and parameters: {'n_estimators': 360, 'max_depth': 50, 'min_samples_split': 3, 'min_samples_leaf': 1, 'max_features': 'sqrt', 'bootstrap': False, 'criterion': 'squared_error'}. Best is trial 133 with value: 0.29356449467344287.
[I 2024-12-04 11:57:58,913] Trial 171 finished with value: 0.40960797257654247 and parameters: {'n_estimators': 644, 'max_depth': 47, 'min_samples_split': 4, 'min_samples_leaf': 1, 'max_features': 'log2', 'bootstrap': False, 'criterion': 'absolute_error'}. Best is trial 133 with value: 0.29356449467344287.
[I 2024-12-04 11:57:58,944] Trial 196 finished with value: 0.9404921788156269 and parameters: {'n_estimators': 305, 'max_depth': 36, 'min_samples_split': 35, 'min_samples_leaf': 9, 'max_features': 'log2', 'bootstrap': False, 'criterion': 'absolute_error'}. Best is trial 133 with value: 0.29356449467344287.
[I 2024-12-04 11:57:59,298] Trial 199 finished with value: 0.2999528412373254 and parameters: {'n_estimators': 352, 'max_depth': 50, 'min_samples_split': 4, 'min_samples_leaf': 1, 'max_features': 'sqrt', 'bootstrap': False, 'criterion': 'squared_error'}. Best is trial 133 with value: 0.29356449467344287.
[I 2024-12-04 11:57:59,584] Trial 183 finished with value: 0.2987563477999073 and parameters: {'n_estimators': 975, 'max_depth': 45, 'min_samples_split': 3, 'min_samples_leaf': 1, 'max_features': 'sqrt', 'bootstrap': False, 'criterion': 'squared_error'}. Best is trial 133 with value: 0.29356449467344287.
[I 2024-12-04 11:58:01,348] Trial 193 finished with value: 0.3172836144592297 and parameters: {'n_estimators': 210, 'max_depth': 50, 'min_samples_split': 5, 'min_samples_leaf': 1, 'max_features': 'sqrt', 'bootstrap': False, 'criterion': 'absolute_error'}. Best is trial 133 with value: 0.29356449467344287.
[I 2024-12-04 11:58:02,684] Trial 161 finished with value: 0.5292979775364348 and parameters: {'n_estimators': 904, 'max_depth': 28, 'min_samples_split': 25, 'min_samples_leaf': 15, 'max_features': None, 'bootstrap': False, 'criterion': 'absolute_error'}. Best is trial 133 with value: 0.29356449467344287.
[I 2024-12-04 11:58:02,858] Trial 190 finished with value: 0.44186132745036916 and parameters: {'n_estimators': 977, 'max_depth': 36, 'min_samples_split': 29, 'min_samples_leaf': 6, 'max_features': None, 'bootstrap': True, 'criterion': 'squared_error'}. Best is trial 133 with value: 0.29356449467344287.
[I 2024-12-04 11:58:03,211] Trial 18 finished with value: 0.46896822264958515 and parameters: {'n_estimators': 936, 'max_depth': 12, 'min_samples_split': 41, 'min_samples_leaf': 1, 'max_features': None, 'bootstrap': False, 'criterion': 'absolute_error'}. Best is trial 133 with value: 0.29356449467344287.
[I 2024-12-04 11:58:03,450] Trial 192 finished with value: 0.30110838552421026 and parameters: {'n_estimators': 692, 'max_depth': 47, 'min_samples_split': 2, 'min_samples_leaf': 1, 'max_features': 'sqrt', 'bootstrap': False, 'criterion': 'squared_error'}. Best is trial 133 with value: 0.29356449467344287.
[I 2024-12-04 11:58:04,208] Trial 205 finished with value: 0.9543766485308203 and parameters: {'n_estimators': 571, 'max_depth': 25, 'min_samples_split': 2, 'min_samples_leaf': 8, 'max_features': 'log2', 'bootstrap': True, 'criterion': 'squared_error'}. Best is trial 133 with value: 0.29356449467344287.
[I 2024-12-04 11:58:05,295] Trial 198 finished with value: 0.30635545389532787 and parameters: {'n_estimators': 786, 'max_depth': 44, 'min_samples_split': 2, 'min_samples_leaf': 1, 'max_features': 'sqrt', 'bootstrap': False, 'criterion': 'squared_error'}. Best is trial 133 with value: 0.29356449467344287.
[I 2024-12-04 11:58:05,472] Trial 187 finished with value: 0.31312911368022767 and parameters: {'n_estimators': 976, 'max_depth': 50, 'min_samples_split': 2, 'min_samples_leaf': 1, 'max_features': 'sqrt', 'bootstrap': True, 'criterion': 'squared_error'}. Best is trial 133 with value: 0.29356449467344287.
[I 2024-12-04 11:58:05,636] Trial 202 finished with value: 0.29608774025007933 and parameters: {'n_estimators': 348, 'max_depth': 49, 'min_samples_split': 2, 'min_samples_leaf': 1, 'max_features': 'sqrt', 'bootstrap': False, 'criterion': 'squared_error'}. Best is trial 133 with value: 0.29356449467344287.
[I 2024-12-04 11:58:06,581] Trial 178 finished with value: 0.3105107216391164 and parameters: {'n_estimators': 723, 'max_depth': 45, 'min_samples_split': 2, 'min_samples_leaf': 1, 'max_features': 'sqrt', 'bootstrap': False, 'criterion': 'absolute_error'}. Best is trial 133 with value: 0.29356449467344287.
[I 2024-12-04 11:58:07,693] Trial 203 finished with value: 0.7163107254003104 and parameters: {'n_estimators': 275, 'max_depth': 17, 'min_samples_split': 2, 'min_samples_leaf': 7, 'max_features': 'sqrt', 'bootstrap': False, 'criterion': 'squared_error'}. Best is trial 133 with value: 0.29356449467344287.
[I 2024-12-04 11:58:09,215] Trial 211 finished with value: 0.30332816144132724 and parameters: {'n_estimators': 306, 'max_depth': 49, 'min_samples_split': 4, 'min_samples_leaf': 1, 'max_features': 'sqrt', 'bootstrap': False, 'criterion': 'squared_error'}. Best is trial 133 with value: 0.29356449467344287.
[I 2024-12-04 11:58:09,392] Trial 182 finished with value: 0.5148982144945681 and parameters: {'n_estimators': 647, 'max_depth': 36, 'min_samples_split': 5, 'min_samples_leaf': 14, 'max_features': None, 'bootstrap': False, 'criterion': 'absolute_error'}. Best is trial 133 with value: 0.29356449467344287.
[I 2024-12-04 11:58:09,393] Trial 208 finished with value: 0.44142073440530855 and parameters: {'n_estimators': 677, 'max_depth': 50, 'min_samples_split': 2, 'min_samples_leaf': 2, 'max_features': 'sqrt', 'bootstrap': False, 'criterion': 'squared_error'}. Best is trial 133 with value: 0.29356449467344287.
[I 2024-12-04 11:58:09,670] Trial 212 finished with value: 0.2944228654322758 and parameters: {'n_estimators': 354, 'max_depth': 47, 'min_samples_split': 3, 'min_samples_leaf': 1, 'max_features': 'sqrt', 'bootstrap': False, 'criterion': 'squared_error'}. Best is trial 133 with value: 0.29356449467344287.
[I 2024-12-04 11:58:10,179] Trial 207 finished with value: 0.9712007195812975 and parameters: {'n_estimators': 962, 'max_depth': 28, 'min_samples_split': 3, 'min_samples_leaf': 14, 'max_features': 'log2', 'bootstrap': True, 'criterion': 'absolute_error'}. Best is trial 133 with value: 0.29356449467344287.
[I 2024-12-04 11:58:12,441] Trial 209 finished with value: 0.4447905363235941 and parameters: {'n_estimators': 304, 'max_depth': 42, 'min_samples_split': 2, 'min_samples_leaf': 2, 'max_features': 'sqrt', 'bootstrap': False, 'criterion': 'squared_error'}. Best is trial 133 with value: 0.29356449467344287.
[I 2024-12-04 11:58:12,714] Trial 191 finished with value: 0.3809066701820119 and parameters: {'n_estimators': 802, 'max_depth': 50, 'min_samples_split': 3, 'min_samples_leaf': 1, 'max_features': None, 'bootstrap': False, 'criterion': 'squared_error'}. Best is trial 133 with value: 0.29356449467344287.
[I 2024-12-04 11:58:14,783] Trial 216 finished with value: 0.3018924818437553 and parameters: {'n_estimators': 362, 'max_depth': 47, 'min_samples_split': 4, 'min_samples_leaf': 1, 'max_features': 'sqrt', 'bootstrap': False, 'criterion': 'squared_error'}. Best is trial 204 with value: 0.2923715058098161.
[I 2024-12-04 11:58:14,895] Trial 168 finished with value: 0.43127676784843766 and parameters: {'n_estimators': 400, 'max_depth': 39, 'min_samples_split': 3, 'min_samples_leaf': 3, 'max_features': None, 'bootstrap': False, 'criterion': 'absolute_error'}. Best is trial 204 with value: 0.2923715058098161.
[I 2024-12-04 11:58:15,027] Trial 222 finished with value: 0.2936431933006331 and parameters: {'n_estimators': 146, 'max_depth': 50, 'min_samples_split': 3, 'min_samples_leaf': 1, 'max_features': 'sqrt', 'bootstrap': False, 'criterion': 'squared_error'}. Best is trial 204 with value: 0.2923715058098161.
[I 2024-12-04 11:58:15,458] Trial 215 finished with value: 0.2945094943667113 and parameters: {'n_estimators': 373, 'max_depth': 50, 'min_samples_split': 3, 'min_samples_leaf': 1, 'max_features': 'sqrt', 'bootstrap': False, 'criterion': 'squared_error'}. Best is trial 204 with value: 0.2923715058098161.
[I 2024-12-04 11:58:16,646] Trial 223 finished with value: 0.4436445849127381 and parameters: {'n_estimators': 268, 'max_depth': 50, 'min_samples_split': 2, 'min_samples_leaf': 2, 'max_features': 'sqrt', 'bootstrap': False, 'criterion': 'squared_error'}. Best is trial 204 with value: 0.2923715058098161.
[I 2024-12-04 11:58:16,708] Trial 204 finished with value: 0.2923715058098161 and parameters: {'n_estimators': 673, 'max_depth': 49, 'min_samples_split': 3, 'min_samples_leaf': 1, 'max_features': 'sqrt', 'bootstrap': False, 'criterion': 'squared_error'}. Best is trial 204 with value: 0.2923715058098161.
[I 2024-12-04 11:58:16,714] Trial 221 finished with value: 0.31029421683770353 and parameters: {'n_estimators': 324, 'max_depth': 39, 'min_samples_split': 3, 'min_samples_leaf': 1, 'max_features': 'sqrt', 'bootstrap': False, 'criterion': 'squared_error'}. Best is trial 204 with value: 0.2923715058098161.
[I 2024-12-04 11:58:16,718] Trial 214 finished with value: 0.8184846930050761 and parameters: {'n_estimators': 100, 'max_depth': 26, 'min_samples_split': 5, 'min_samples_leaf': 13, 'max_features': 'sqrt', 'bootstrap': False, 'criterion': 'absolute_error'}. Best is trial 204 with value: 0.2923715058098161.
