[I 2024-12-04 12:33:35,104] Trial 530 finished with value: 0.24198501567943462 and parameters: {'n_estimators': 1488, 'learning_rate': 0.09477299261838358, 'max_depth': 11, 'min_samples_split': 15, 'min_samples_leaf': 2, 'subsample': 0.636109218867729, 'max_features': 'sqrt'}. Best is trial 509 with value: 0.20551759698042563.
[I 2024-12-04 12:33:39,373] Trial 532 finished with value: 0.31487081338552647 and parameters: {'n_estimators': 1260, 'learning_rate': 0.011901185669363165, 'max_depth': 6, 'min_samples_split': 10, 'min_samples_leaf': 1, 'subsample': 0.7483957530532637, 'max_features': None}. Best is trial 509 with value: 0.20551759698042563.
[I 2024-12-04 12:33:42,661] Trial 562 finished with value: 0.46918884108367753 and parameters: {'n_estimators': 373, 'learning_rate': 0.02811926910625355, 'max_depth': 7, 'min_samples_split': 7, 'min_samples_leaf': 9, 'subsample': 0.827461086045625, 'max_features': 'sqrt'}. Best is trial 509 with value: 0.20551759698042563.
[I 2024-12-04 12:33:42,812] Trial 533 finished with value: 0.23736829019083117 and parameters: {'n_estimators': 1442, 'learning_rate': 0.09205742377216469, 'max_depth': 11, 'min_samples_split': 14, 'min_samples_leaf': 1, 'subsample': 0.7447407118236441, 'max_features': 'sqrt'}. Best is trial 509 with value: 0.20551759698042563.
[I 2024-12-04 12:33:43,430] Trial 537 finished with value: 0.22231147746575258 and parameters: {'n_estimators': 1300, 'learning_rate': 0.07559432151253055, 'max_depth': 11, 'min_samples_split': 11, 'min_samples_leaf': 1, 'subsample': 0.7724507809074934, 'max_features': 'sqrt'}. Best is trial 509 with value: 0.20551759698042563.
[I 2024-12-04 12:33:45,832] Trial 539 finished with value: 0.3330771578093602 and parameters: {'n_estimators': 1127, 'learning_rate': 0.05830671724945165, 'max_depth': 12, 'min_samples_split': 16, 'min_samples_leaf': 6, 'subsample': 0.8169344642977265, 'max_features': None}. Best is trial 509 with value: 0.20551759698042563.
[I 2024-12-04 12:33:47,438] Trial 538 finished with value: 0.2432023675326194 and parameters: {'n_estimators': 1325, 'learning_rate': 0.09834358356824124, 'max_depth': 11, 'min_samples_split': 12, 'min_samples_leaf': 2, 'subsample': 0.841632043559806, 'max_features': 'sqrt'}. Best is trial 509 with value: 0.20551759698042563.
[I 2024-12-04 12:33:48,195] Trial 535 finished with value: 0.222812837166719 and parameters: {'n_estimators': 1415, 'learning_rate': 0.07454253731873361, 'max_depth': 12, 'min_samples_split': 13, 'min_samples_leaf': 1, 'subsample': 0.7917046095860027, 'max_features': 'sqrt'}. Best is trial 509 with value: 0.20551759698042563.
[I 2024-12-04 12:33:48,994] Trial 543 finished with value: 0.39112425093983716 and parameters: {'n_estimators': 1045, 'learning_rate': 0.018804217796384474, 'max_depth': 4, 'min_samples_split': 12, 'min_samples_leaf': 9, 'subsample': 0.8498959321984356, 'max_features': None}. Best is trial 509 with value: 0.20551759698042563.
[I 2024-12-04 12:33:49,036] Trial 534 finished with value: 0.24552547086161633 and parameters: {'n_estimators': 1457, 'learning_rate': 0.09138255754559724, 'max_depth': 10, 'min_samples_split': 8, 'min_samples_leaf': 2, 'subsample': 0.8418315475862401, 'max_features': 'sqrt'}. Best is trial 509 with value: 0.20551759698042563.
[I 2024-12-04 12:33:51,435] Trial 547 finished with value: 0.22552143331714064 and parameters: {'n_estimators': 1007, 'learning_rate': 0.0932880421695593, 'max_depth': 12, 'min_samples_split': 17, 'min_samples_leaf': 1, 'subsample': 0.6123492491052973, 'max_features': 'sqrt'}. Best is trial 509 with value: 0.20551759698042563.
[I 2024-12-04 12:33:51,559] Trial 536 finished with value: 0.23017365261956949 and parameters: {'n_estimators': 1462, 'learning_rate': 0.09805170669162105, 'max_depth': 12, 'min_samples_split': 15, 'min_samples_leaf': 1, 'subsample': 0.9216185916706264, 'max_features': 'sqrt'}. Best is trial 509 with value: 0.20551759698042563.
[I 2024-12-04 12:33:53,050] Trial 546 finished with value: 0.21378472393316275 and parameters: {'n_estimators': 1045, 'learning_rate': 0.09659130603527814, 'max_depth': 11, 'min_samples_split': 14, 'min_samples_leaf': 1, 'subsample': 0.7024576151987949, 'max_features': 'sqrt'}. Best is trial 509 with value: 0.20551759698042563.
[I 2024-12-04 12:33:55,070] Trial 560 finished with value: 0.3118228091116393 and parameters: {'n_estimators': 556, 'learning_rate': 0.03516236824554288, 'max_depth': 8, 'min_samples_split': 16, 'min_samples_leaf': 5, 'subsample': 0.6357797145964569, 'max_features': None}. Best is trial 509 with value: 0.20551759698042563.
[I 2024-12-04 12:33:55,569] Trial 544 finished with value: 0.23054310241269632 and parameters: {'n_estimators': 1247, 'learning_rate': 0.09463497886327729, 'max_depth': 9, 'min_samples_split': 17, 'min_samples_leaf': 1, 'subsample': 0.6115365865266115, 'max_features': 'sqrt'}. Best is trial 509 with value: 0.20551759698042563.
[I 2024-12-04 12:33:59,198] Trial 542 finished with value: 0.34197572873847437 and parameters: {'n_estimators': 1404, 'learning_rate': 0.049745160169652684, 'max_depth': 6, 'min_samples_split': 14, 'min_samples_leaf': 7, 'subsample': 0.763892439701587, 'max_features': 'sqrt'}. Best is trial 509 with value: 0.20551759698042563.
[I 2024-12-04 12:33:59,923] Trial 540 finished with value: 0.23864891386436135 and parameters: {'n_estimators': 1487, 'learning_rate': 0.09506957111295783, 'max_depth': 11, 'min_samples_split': 8, 'min_samples_leaf': 1, 'subsample': 0.8878267556616665, 'max_features': 'log2'}. Best is trial 509 with value: 0.20551759698042563.
[I 2024-12-04 12:34:00,476] Trial 541 finished with value: 0.2413043623577664 and parameters: {'n_estimators': 1470, 'learning_rate': 0.09971801606810271, 'max_depth': 12, 'min_samples_split': 11, 'min_samples_leaf': 2, 'subsample': 0.7499423027092984, 'max_features': 'sqrt'}. Best is trial 509 with value: 0.20551759698042563.
[I 2024-12-04 12:34:01,625] Trial 545 finished with value: 0.2249656827142603 and parameters: {'n_estimators': 1316, 'learning_rate': 0.09983785689154341, 'max_depth': 12, 'min_samples_split': 16, 'min_samples_leaf': 1, 'subsample': 0.8294503530240168, 'max_features': 'sqrt'}. Best is trial 509 with value: 0.20551759698042563.
[I 2024-12-04 12:34:10,786] Trial 549 finished with value: 0.2253500835338859 and parameters: {'n_estimators': 1424, 'learning_rate': 0.07177055014012511, 'max_depth': 10, 'min_samples_split': 13, 'min_samples_leaf': 1, 'subsample': 0.7697496171869624, 'max_features': 'sqrt'}. Best is trial 509 with value: 0.20551759698042563.
[I 2024-12-04 12:34:11,639] Trial 552 finished with value: 0.21230713656515826 and parameters: {'n_estimators': 1297, 'learning_rate': 0.07812113857284213, 'max_depth': 11, 'min_samples_split': 15, 'min_samples_leaf': 1, 'subsample': 0.6096347035942793, 'max_features': 'sqrt'}. Best is trial 509 with value: 0.20551759698042563.
[I 2024-12-04 12:34:11,757] Trial 548 finished with value: 0.21432785880852878 and parameters: {'n_estimators': 1478, 'learning_rate': 0.09896296956019701, 'max_depth': 11, 'min_samples_split': 15, 'min_samples_leaf': 1, 'subsample': 0.6055003933501868, 'max_features': 'sqrt'}. Best is trial 509 with value: 0.20551759698042563.
[I 2024-12-04 12:34:13,029] Trial 553 finished with value: 0.22656539674280424 and parameters: {'n_estimators': 1325, 'learning_rate': 0.04243688031016002, 'max_depth': 12, 'min_samples_split': 7, 'min_samples_leaf': 1, 'subsample': 0.7439336753641819, 'max_features': 'sqrt'}. Best is trial 509 with value: 0.20551759698042563.
[I 2024-12-04 12:34:15,810] Trial 559 finished with value: 0.22774756973770172 and parameters: {'n_estimators': 1176, 'learning_rate': 0.09165926471479914, 'max_depth': 11, 'min_samples_split': 12, 'min_samples_leaf': 1, 'subsample': 0.642042230186284, 'max_features': 'sqrt'}. Best is trial 509 with value: 0.20551759698042563.
[I 2024-12-04 12:34:17,999] Trial 558 finished with value: 0.24365644657684013 and parameters: {'n_estimators': 1264, 'learning_rate': 0.0951389601003942, 'max_depth': 12, 'min_samples_split': 19, 'min_samples_leaf': 3, 'subsample': 0.6236859284100084, 'max_features': 'sqrt'}. Best is trial 509 with value: 0.20551759698042563.
[I 2024-12-04 12:34:20,753] Trial 554 finished with value: 0.2121928579956902 and parameters: {'n_estimators': 1455, 'learning_rate': 0.0815556422589471, 'max_depth': 12, 'min_samples_split': 14, 'min_samples_leaf': 1, 'subsample': 0.7040687948351488, 'max_features': 'sqrt'}. Best is trial 509 with value: 0.20551759698042563.
[I 2024-12-04 12:34:23,534] Trial 555 finished with value: 0.21904482268275785 and parameters: {'n_estimators': 1485, 'learning_rate': 0.09840602226833706, 'max_depth': 10, 'min_samples_split': 12, 'min_samples_leaf': 1, 'subsample': 0.7495818690151727, 'max_features': 'sqrt'}. Best is trial 509 with value: 0.20551759698042563.
[I 2024-12-04 12:34:26,821] Trial 557 finished with value: 0.24614023872194715 and parameters: {'n_estimators': 1497, 'learning_rate': 0.09569483532351183, 'max_depth': 12, 'min_samples_split': 11, 'min_samples_leaf': 3, 'subsample': 0.6134035918773456, 'max_features': 'sqrt'}. Best is trial 509 with value: 0.20551759698042563.
[I 2024-12-04 12:34:28,406] Trial 561 finished with value: 0.2532542572151088 and parameters: {'n_estimators': 1352, 'learning_rate': 0.05271382978388022, 'max_depth': 10, 'min_samples_split': 16, 'min_samples_leaf': 3, 'subsample': 0.7282421486334258, 'max_features': 'sqrt'}. Best is trial 509 with value: 0.20551759698042563.
[I 2024-12-04 12:34:29,991] Trial 563 finished with value: 0.22431933312155714 and parameters: {'n_estimators': 1279, 'learning_rate': 0.08471925326543765, 'max_depth': 12, 'min_samples_split': 10, 'min_samples_leaf': 1, 'subsample': 0.6779568567742861, 'max_features': 'sqrt'}. Best is trial 509 with value: 0.20551759698042563.
[I 2024-12-04 12:34:31,019] Trial 578 finished with value: 0.5666253064815442 and parameters: {'n_estimators': 455, 'learning_rate': 0.01029644737158454, 'max_depth': 5, 'min_samples_split': 2, 'min_samples_leaf': 5, 'subsample': 0.6469652602250096, 'max_features': 'sqrt'}. Best is trial 509 with value: 0.20551759698042563.
[I 2024-12-04 12:34:33,866] Trial 564 finished with value: 0.3335931345784374 and parameters: {'n_estimators': 1117, 'learning_rate': 0.02682764785956787, 'max_depth': 9, 'min_samples_split': 13, 'min_samples_leaf': 6, 'subsample': 0.8163127331570548, 'max_features': None}. Best is trial 509 with value: 0.20551759698042563.
[I 2024-12-04 12:34:35,864] Trial 592 finished with value: 0.41466279263024924 and parameters: {'n_estimators': 148, 'learning_rate': 0.023935467956097838, 'max_depth': 9, 'min_samples_split': 8, 'min_samples_leaf': 10, 'subsample': 0.9459381906378794, 'max_features': None}. Best is trial 509 with value: 0.20551759698042563.
[I 2024-12-04 12:34:35,879] Trial 573 finished with value: 0.4142112701342408 and parameters: {'n_estimators': 691, 'learning_rate': 0.010868117507808148, 'max_depth': 3, 'min_samples_split': 18, 'min_samples_leaf': 3, 'subsample': 0.6923078068996615, 'max_features': None}. Best is trial 509 with value: 0.20551759698042563.
[I 2024-12-04 12:34:40,934] Trial 572 finished with value: 0.22714490688119093 and parameters: {'n_estimators': 940, 'learning_rate': 0.0986502896721906, 'max_depth': 11, 'min_samples_split': 16, 'min_samples_leaf': 2, 'subsample': 0.7063670043662419, 'max_features': 'sqrt'}. Best is trial 509 with value: 0.20551759698042563.
[I 2024-12-04 12:34:44,900] Trial 594 finished with value: 0.4569601341334574 and parameters: {'n_estimators': 234, 'learning_rate': 0.050916525621220295, 'max_depth': 9, 'min_samples_split': 20, 'min_samples_leaf': 10, 'subsample': 0.9667996754781314, 'max_features': 'sqrt'}. Best is trial 509 with value: 0.20551759698042563.
[I 2024-12-04 12:34:45,398] Trial 571 finished with value: 0.2171760873598187 and parameters: {'n_estimators': 1056, 'learning_rate': 0.09573340545878105, 'max_depth': 12, 'min_samples_split': 15, 'min_samples_leaf': 1, 'subsample': 0.660227764234193, 'max_features': 'sqrt'}. Best is trial 509 with value: 0.20551759698042563.
[I 2024-12-04 12:34:47,483] Trial 574 finished with value: 0.42333241862071447 and parameters: {'n_estimators': 1011, 'learning_rate': 0.08932305913874929, 'max_depth': 10, 'min_samples_split': 10, 'min_samples_leaf': 8, 'subsample': 0.7748632749773687, 'max_features': 'log2'}. Best is trial 509 with value: 0.20551759698042563.
[I 2024-12-04 12:34:51,434] Trial 566 finished with value: 0.22042684663018358 and parameters: {'n_estimators': 1477, 'learning_rate': 0.06613209477391763, 'max_depth': 11, 'min_samples_split': 11, 'min_samples_leaf': 1, 'subsample': 0.8494545831860196, 'max_features': 'sqrt'}. Best is trial 509 with value: 0.20551759698042563.
[I 2024-12-04 12:34:55,444] Trial 567 finished with value: 0.3608618307426885 and parameters: {'n_estimators': 1488, 'learning_rate': 0.018099735649972734, 'max_depth': 10, 'min_samples_split': 17, 'min_samples_leaf': 7, 'subsample': 0.7396289182603715, 'max_features': 'sqrt'}. Best is trial 509 with value: 0.20551759698042563.
[I 2024-12-04 12:34:57,991] Trial 581 finished with value: 0.2289301636108566 and parameters: {'n_estimators': 897, 'learning_rate': 0.08307900691501115, 'max_depth': 12, 'min_samples_split': 11, 'min_samples_leaf': 1, 'subsample': 0.6547524179419529, 'max_features': 'sqrt'}. Best is trial 509 with value: 0.20551759698042563.
[I 2024-12-04 12:34:59,970] Trial 565 finished with value: 0.30164811573329836 and parameters: {'n_estimators': 1441, 'learning_rate': 0.018545559172243604, 'max_depth': 11, 'min_samples_split': 17, 'min_samples_leaf': 5, 'subsample': 0.9139384582421255, 'max_features': None}. Best is trial 509 with value: 0.20551759698042563.
[I 2024-12-04 12:35:05,823] Trial 570 finished with value: 0.2241173025768314 and parameters: {'n_estimators': 1446, 'learning_rate': 0.09326708634280972, 'max_depth': 10, 'min_samples_split': 17, 'min_samples_leaf': 1, 'subsample': 0.8091330885856887, 'max_features': 'sqrt'}. Best is trial 509 with value: 0.20551759698042563.
[I 2024-12-04 12:35:07,885] Trial 585 finished with value: 0.28110746987417606 and parameters: {'n_estimators': 945, 'learning_rate': 0.08974779775222072, 'max_depth': 11, 'min_samples_split': 11, 'min_samples_leaf': 2, 'subsample': 0.6219301382591143, 'max_features': 'log2'}. Best is trial 509 with value: 0.20551759698042563.
[I 2024-12-04 12:35:10,171] Trial 569 finished with value: 0.3008834307193055 and parameters: {'n_estimators': 1433, 'learning_rate': 0.08507671164318865, 'max_depth': 9, 'min_samples_split': 10, 'min_samples_leaf': 2, 'subsample': 0.615224606797654, 'max_features': None}. Best is trial 509 with value: 0.20551759698042563.
[I 2024-12-04 12:35:11,190] Trial 568 finished with value: 0.3118740267604022 and parameters: {'n_estimators': 1404, 'learning_rate': 0.08511392676829603, 'max_depth': 12, 'min_samples_split': 15, 'min_samples_leaf': 2, 'subsample': 0.7720547821227812, 'max_features': None}. Best is trial 509 with value: 0.20551759698042563.
[I 2024-12-04 12:35:13,142] Trial 580 finished with value: 0.21736106182302856 and parameters: {'n_estimators': 1210, 'learning_rate': 0.0792489564167325, 'max_depth': 12, 'min_samples_split': 15, 'min_samples_leaf': 1, 'subsample': 0.6043284542651699, 'max_features': 'sqrt'}. Best is trial 509 with value: 0.20551759698042563.
[I 2024-12-04 12:35:17,074] Trial 579 finished with value: 0.22732118526393782 and parameters: {'n_estimators': 1323, 'learning_rate': 0.0928747190108522, 'max_depth': 9, 'min_samples_split': 11, 'min_samples_leaf': 1, 'subsample': 0.8628611872352843, 'max_features': 'sqrt'}. Best is trial 509 with value: 0.20551759698042563.
[I 2024-12-04 12:35:18,273] Trial 584 finished with value: 0.2489278478940802 and parameters: {'n_estimators': 1176, 'learning_rate': 0.09259319749499441, 'max_depth': 11, 'min_samples_split': 16, 'min_samples_leaf': 3, 'subsample': 0.6464512623082113, 'max_features': 'sqrt'}. Best is trial 509 with value: 0.20551759698042563.
[I 2024-12-04 12:35:20,308] Trial 576 finished with value: 0.22230776030867339 and parameters: {'n_estimators': 1305, 'learning_rate': 0.09827001981776157, 'max_depth': 12, 'min_samples_split': 12, 'min_samples_leaf': 1, 'subsample': 0.6538438618957275, 'max_features': 'sqrt'}. Best is trial 509 with value: 0.20551759698042563.
[I 2024-12-04 12:35:22,010] Trial 583 finished with value: 0.25539938281477514 and parameters: {'n_estimators': 1251, 'learning_rate': 0.056811130876980254, 'max_depth': 10, 'min_samples_split': 13, 'min_samples_leaf': 1, 'subsample': 0.7541341769926396, 'max_features': 'log2'}. Best is trial 509 with value: 0.20551759698042563.
[I 2024-12-04 12:35:22,748] Trial 575 finished with value: 0.218359572924926 and parameters: {'n_estimators': 1402, 'learning_rate': 0.09815081409662123, 'max_depth': 10, 'min_samples_split': 9, 'min_samples_leaf': 1, 'subsample': 0.8800032030194257, 'max_features': 'sqrt'}. Best is trial 509 with value: 0.20551759698042563.
[I 2024-12-04 12:35:24,299] Trial 586 finished with value: 0.25627274662490546 and parameters: {'n_estimators': 1171, 'learning_rate': 0.09152529537041164, 'max_depth': 10, 'min_samples_split': 15, 'min_samples_leaf': 3, 'subsample': 0.6031624122469935, 'max_features': 'sqrt'}. Best is trial 509 with value: 0.20551759698042563.
[I 2024-12-04 12:35:28,975] Trial 602 finished with value: 0.46720955205266407 and parameters: {'n_estimators': 638, 'learning_rate': 0.02973749540054478, 'max_depth': 6, 'min_samples_split': 14, 'min_samples_leaf': 9, 'subsample': 0.6101593043137266, 'max_features': 'sqrt'}. Best is trial 509 with value: 0.20551759698042563.
[I 2024-12-04 12:35:30,081] Trial 577 finished with value: 0.24528665634860938 and parameters: {'n_estimators': 1489, 'learning_rate': 0.09242025894251978, 'max_depth': 12, 'min_samples_split': 13, 'min_samples_leaf': 2, 'subsample': 0.8196985379325659, 'max_features': 'sqrt'}. Best is trial 509 with value: 0.20551759698042563.
[I 2024-12-04 12:35:31,980] Trial 588 finished with value: 0.2760488827499807 and parameters: {'n_estimators': 1093, 'learning_rate': 0.09602225234915827, 'max_depth': 12, 'min_samples_split': 20, 'min_samples_leaf': 3, 'subsample': 0.6187892163027211, 'max_features': None}. Best is trial 509 with value: 0.20551759698042563.
[I 2024-12-04 12:35:36,065] Trial 582 finished with value: 0.22848086254305303 and parameters: {'n_estimators': 1489, 'learning_rate': 0.099576419740154, 'max_depth': 12, 'min_samples_split': 17, 'min_samples_leaf': 1, 'subsample': 0.6697614958622146, 'max_features': 'sqrt'}. Best is trial 509 with value: 0.20551759698042563.
[I 2024-12-04 12:35:39,030] Trial 587 finished with value: 0.5565807854588013 and parameters: {'n_estimators': 1464, 'learning_rate': 0.013469128988664382, 'max_depth': 5, 'min_samples_split': 6, 'min_samples_leaf': 8, 'subsample': 0.9727128843610621, 'max_features': 'log2'}. Best is trial 509 with value: 0.20551759698042563.
[I 2024-12-04 12:35:41,155] Trial 589 finished with value: 0.24788347480023587 and parameters: {'n_estimators': 1383, 'learning_rate': 0.08658140922497955, 'max_depth': 10, 'min_samples_split': 16, 'min_samples_leaf': 3, 'subsample': 0.6103328974446803, 'max_features': 'sqrt'}. Best is trial 509 with value: 0.20551759698042563.
[I 2024-12-04 12:35:41,164] Trial 603 finished with value: 0.22467057046128555 and parameters: {'n_estimators': 831, 'learning_rate': 0.0855666235832373, 'max_depth': 12, 'min_samples_split': 13, 'min_samples_leaf': 1, 'subsample': 0.7037351935276369, 'max_features': 'sqrt'}. Best is trial 509 with value: 0.20551759698042563.
[I 2024-12-04 12:35:41,215] Trial 598 finished with value: 0.6039203504811562 and parameters: {'n_estimators': 1067, 'learning_rate': 0.019279939941805265, 'max_depth': 6, 'min_samples_split': 4, 'min_samples_leaf': 10, 'subsample': 0.8253215106847525, 'max_features': 'log2'}. Best is trial 509 with value: 0.20551759698042563.
[I 2024-12-04 12:35:46,046] Trial 609 finished with value: 0.24616344500543472 and parameters: {'n_estimators': 584, 'learning_rate': 0.08803497992191883, 'max_depth': 11, 'min_samples_split': 14, 'min_samples_leaf': 1, 'subsample': 0.6141061695179163, 'max_features': 'sqrt'}. Best is trial 509 with value: 0.20551759698042563.
[I 2024-12-04 12:35:48,486] Trial 590 finished with value: 0.23157523489845439 and parameters: {'n_estimators': 1466, 'learning_rate': 0.06579854906197743, 'max_depth': 11, 'min_samples_split': 15, 'min_samples_leaf': 2, 'subsample': 0.6753177508251504, 'max_features': 'sqrt'}. Best is trial 509 with value: 0.20551759698042563.
[I 2024-12-04 12:35:48,493] Trial 593 finished with value: 0.21772612038961273 and parameters: {'n_estimators': 1338, 'learning_rate': 0.08494535841907305, 'max_depth': 12, 'min_samples_split': 13, 'min_samples_leaf': 1, 'subsample': 0.6158448408403737, 'max_features': 'sqrt'}. Best is trial 509 with value: 0.20551759698042563.
[I 2024-12-04 12:35:49,156] Trial 591 finished with value: 0.23147649785171157 and parameters: {'n_estimators': 1429, 'learning_rate': 0.06294226363614266, 'max_depth': 12, 'min_samples_split': 11, 'min_samples_leaf': 1, 'subsample': 0.6350235510833251, 'max_features': 'sqrt'}. Best is trial 509 with value: 0.20551759698042563.
[I 2024-12-04 12:35:57,721] Trial 595 finished with value: 0.22918102775089738 and parameters: {'n_estimators': 1456, 'learning_rate': 0.09384969414631847, 'max_depth': 11, 'min_samples_split': 18, 'min_samples_leaf': 2, 'subsample': 0.6268391522650244, 'max_features': 'sqrt'}. Best is trial 509 with value: 0.20551759698042563.
