[I 2024-12-04 12:16:45,528] Trial 67 finished with value: 0.28771198602699805 and parameters: {'n_estimators': 574, 'learning_rate': 0.03600485723218419, 'max_depth': 12, 'min_samples_split': 12, 'min_samples_leaf': 4, 'subsample': 0.9608206515909806, 'max_features': None}. Best is trial 62 with value: 0.26362476135020013.
[I 2024-12-04 12:16:48,681] Trial 68 finished with value: 0.257957769940946 and parameters: {'n_estimators': 760, 'learning_rate': 0.0506923200006289, 'max_depth': 12, 'min_samples_split': 7, 'min_samples_leaf': 3, 'subsample': 0.8018612071124723, 'max_features': 'sqrt'}. Best is trial 68 with value: 0.257957769940946.
[I 2024-12-04 12:16:51,498] Trial 75 finished with value: 0.338116548042731 and parameters: {'n_estimators': 1049, 'learning_rate': 0.07169192843141284, 'max_depth': 8, 'min_samples_split': 20, 'min_samples_leaf': 7, 'subsample': 0.9998845077159437, 'max_features': 'sqrt'}. Best is trial 68 with value: 0.257957769940946.
[I 2024-12-04 12:16:52,867] Trial 71 finished with value: 0.2648233781779594 and parameters: {'n_estimators': 810, 'learning_rate': 0.09188034088346704, 'max_depth': 11, 'min_samples_split': 2, 'min_samples_leaf': 1, 'subsample': 0.9380831999012247, 'max_features': 'sqrt'}. Best is trial 65 with value: 0.24285800805495944.
[I 2024-12-04 12:16:53,597] Trial 65 finished with value: 0.24285800805495944 and parameters: {'n_estimators': 1336, 'learning_rate': 0.057173495654888086, 'max_depth': 11, 'min_samples_split': 10, 'min_samples_leaf': 1, 'subsample': 0.7373253373342459, 'max_features': 'log2'}. Best is trial 65 with value: 0.24285800805495944.
[I 2024-12-04 12:16:54,337] Trial 74 finished with value: 0.3350694826369314 and parameters: {'n_estimators': 691, 'learning_rate': 0.06613392730396311, 'max_depth': 6, 'min_samples_split': 12, 'min_samples_leaf': 6, 'subsample': 0.8750673682098421, 'max_features': 'sqrt'}. Best is trial 65 with value: 0.24285800805495944.
[I 2024-12-04 12:16:57,534] Trial 73 finished with value: 0.2702898830485462 and parameters: {'n_estimators': 502, 'learning_rate': 0.06932460020083506, 'max_depth': 12, 'min_samples_split': 19, 'min_samples_leaf': 4, 'subsample': 0.8242965678902715, 'max_features': 'sqrt'}. Best is trial 65 with value: 0.24285800805495944.
[I 2024-12-04 12:17:03,391] Trial 79 finished with value: 0.28407067199162694 and parameters: {'n_estimators': 479, 'learning_rate': 0.07462700514691431, 'max_depth': 6, 'min_samples_split': 19, 'min_samples_leaf': 2, 'subsample': 0.8255786243626039, 'max_features': 'sqrt'}. Best is trial 65 with value: 0.24285800805495944.
[I 2024-12-04 12:17:12,241] Trial 81 finished with value: 0.29372932220733 and parameters: {'n_estimators': 702, 'learning_rate': 0.06312625103086769, 'max_depth': 5, 'min_samples_split': 14, 'min_samples_leaf': 3, 'subsample': 0.9881549365939469, 'max_features': 'sqrt'}. Best is trial 65 with value: 0.24285800805495944.
[I 2024-12-04 12:17:14,236] Trial 84 finished with value: 0.27040092748257405 and parameters: {'n_estimators': 617, 'learning_rate': 0.051217689923932705, 'max_depth': 8, 'min_samples_split': 6, 'min_samples_leaf': 1, 'subsample': 0.8533787064639622, 'max_features': 'sqrt'}. Best is trial 65 with value: 0.24285800805495944.
[I 2024-12-04 12:17:14,262] Trial 78 finished with value: 0.3218297522580339 and parameters: {'n_estimators': 720, 'learning_rate': 0.06654274321263248, 'max_depth': 3, 'min_samples_split': 14, 'min_samples_leaf': 2, 'subsample': 0.9588080832395678, 'max_features': 'sqrt'}. Best is trial 65 with value: 0.24285800805495944.
[I 2024-12-04 12:17:14,684] Trial 82 finished with value: 0.2696167997080395 and parameters: {'n_estimators': 840, 'learning_rate': 0.08223520332778649, 'max_depth': 6, 'min_samples_split': 18, 'min_samples_leaf': 1, 'subsample': 0.8355092268522964, 'max_features': 'sqrt'}. Best is trial 65 with value: 0.24285800805495944.
[I 2024-12-04 12:17:15,514] Trial 99 finished with value: 0.27841393412607685 and parameters: {'n_estimators': 287, 'learning_rate': 0.06540829766652947, 'max_depth': 12, 'min_samples_split': 17, 'min_samples_leaf': 3, 'subsample': 0.7777737128672391, 'max_features': 'sqrt'}. Best is trial 65 with value: 0.24285800805495944.
[I 2024-12-04 12:17:16,941] Trial 80 finished with value: 0.2283890216431407 and parameters: {'n_estimators': 770, 'learning_rate': 0.09615675554460934, 'max_depth': 7, 'min_samples_split': 13, 'min_samples_leaf': 1, 'subsample': 0.9675930282167562, 'max_features': 'sqrt'}. Best is trial 80 with value: 0.2283890216431407.
[I 2024-12-04 12:17:21,914] Trial 89 finished with value: 0.340049729841972 and parameters: {'n_estimators': 654, 'learning_rate': 0.03785775040943892, 'max_depth': 8, 'min_samples_split': 19, 'min_samples_leaf': 6, 'subsample': 0.87387671997762, 'max_features': 'sqrt'}. Best is trial 80 with value: 0.2283890216431407.
[I 2024-12-04 12:17:22,048] Trial 94 finished with value: 0.273005390438454 and parameters: {'n_estimators': 385, 'learning_rate': 0.06776865964314718, 'max_depth': 12, 'min_samples_split': 17, 'min_samples_leaf': 4, 'subsample': 0.8839181920842297, 'max_features': 'sqrt'}. Best is trial 80 with value: 0.2283890216431407.
[I 2024-12-04 12:17:22,051] Trial 76 finished with value: 0.29358505048982264 and parameters: {'n_estimators': 1152, 'learning_rate': 0.02671050863338049, 'max_depth': 7, 'min_samples_split': 2, 'min_samples_leaf': 2, 'subsample': 0.6909743496899612, 'max_features': None}. Best is trial 80 with value: 0.2283890216431407.
[I 2024-12-04 12:17:22,706] Trial 87 finished with value: 0.27934173275426244 and parameters: {'n_estimators': 868, 'learning_rate': 0.02210994752128131, 'max_depth': 10, 'min_samples_split': 6, 'min_samples_leaf': 2, 'subsample': 0.6123816875676872, 'max_features': 'sqrt'}. Best is trial 80 with value: 0.2283890216431407.
[I 2024-12-04 12:17:23,413] Trial 77 finished with value: 0.27332538250336846 and parameters: {'n_estimators': 1009, 'learning_rate': 0.0729306257167005, 'max_depth': 3, 'min_samples_split': 12, 'min_samples_leaf': 1, 'subsample': 0.8933015043800419, 'max_features': None}. Best is trial 80 with value: 0.2283890216431407.
[I 2024-12-04 12:17:23,514] Trial 83 finished with value: 0.26632312345068365 and parameters: {'n_estimators': 720, 'learning_rate': 0.04516520199363506, 'max_depth': 12, 'min_samples_split': 7, 'min_samples_leaf': 3, 'subsample': 0.7790336957770875, 'max_features': 'sqrt'}. Best is trial 80 with value: 0.2283890216431407.
[I 2024-12-04 12:17:24,087] Trial 85 finished with value: 0.27632340626825785 and parameters: {'n_estimators': 810, 'learning_rate': 0.021059780350087716, 'max_depth': 12, 'min_samples_split': 9, 'min_samples_leaf': 2, 'subsample': 0.6647856057798492, 'max_features': 'sqrt'}. Best is trial 80 with value: 0.2283890216431407.
[I 2024-12-04 12:17:25,321] Trial 86 finished with value: 0.3606773628317619 and parameters: {'n_estimators': 779, 'learning_rate': 0.02824463259645653, 'max_depth': 11, 'min_samples_split': 2, 'min_samples_leaf': 3, 'subsample': 0.8386547364507861, 'max_features': 'log2'}. Best is trial 80 with value: 0.2283890216431407.
[I 2024-12-04 12:17:27,143] Trial 91 finished with value: 0.257547909720367 and parameters: {'n_estimators': 701, 'learning_rate': 0.09779224194535863, 'max_depth': 11, 'min_samples_split': 3, 'min_samples_leaf': 1, 'subsample': 0.9504459041987118, 'max_features': 'sqrt'}. Best is trial 80 with value: 0.2283890216431407.
[I 2024-12-04 12:17:31,114] Trial 90 finished with value: 0.26360632025094 and parameters: {'n_estimators': 832, 'learning_rate': 0.0868650579596729, 'max_depth': 11, 'min_samples_split': 3, 'min_samples_leaf': 3, 'subsample': 0.99444685514186, 'max_features': 'sqrt'}. Best is trial 80 with value: 0.2283890216431407.
[I 2024-12-04 12:17:32,010] Trial 93 finished with value: 0.27311023311579424 and parameters: {'n_estimators': 671, 'learning_rate': 0.06528926237117803, 'max_depth': 11, 'min_samples_split': 19, 'min_samples_leaf': 4, 'subsample': 0.8211479040314524, 'max_features': 'sqrt'}. Best is trial 80 with value: 0.2283890216431407.
[I 2024-12-04 12:17:32,509] Trial 92 finished with value: 0.2825682978833117 and parameters: {'n_estimators': 824, 'learning_rate': 0.08609075283868897, 'max_depth': 10, 'min_samples_split': 9, 'min_samples_leaf': 2, 'subsample': 0.875447413756701, 'max_features': 'log2'}. Best is trial 80 with value: 0.2283890216431407.
[I 2024-12-04 12:17:33,213] Trial 97 finished with value: 0.35058596751326493 and parameters: {'n_estimators': 607, 'learning_rate': 0.06436632291132953, 'max_depth': 12, 'min_samples_split': 20, 'min_samples_leaf': 4, 'subsample': 0.8279611605253182, 'max_features': 'log2'}. Best is trial 80 with value: 0.2283890216431407.
[I 2024-12-04 12:17:33,646] Trial 88 finished with value: 0.26040941379798477 and parameters: {'n_estimators': 956, 'learning_rate': 0.04299712282458805, 'max_depth': 11, 'min_samples_split': 3, 'min_samples_leaf': 1, 'subsample': 0.8017680101909904, 'max_features': 'sqrt'}. Best is trial 80 with value: 0.2283890216431407.
[I 2024-12-04 12:17:34,508] Trial 72 finished with value: 0.28601113699230096 and parameters: {'n_estimators': 1373, 'learning_rate': 0.037718492286146175, 'max_depth': 4, 'min_samples_split': 16, 'min_samples_leaf': 3, 'subsample': 0.9539184200839138, 'max_features': None}. Best is trial 80 with value: 0.2283890216431407.
[I 2024-12-04 12:17:35,884] Trial 104 finished with value: 0.28053028209254577 and parameters: {'n_estimators': 492, 'learning_rate': 0.03008387189108749, 'max_depth': 11, 'min_samples_split': 2, 'min_samples_leaf': 2, 'subsample': 0.9234420734215555, 'max_features': 'sqrt'}. Best is trial 80 with value: 0.2283890216431407.
[I 2024-12-04 12:17:35,910] Trial 69 finished with value: 0.27106745917031755 and parameters: {'n_estimators': 1417, 'learning_rate': 0.06538547327958869, 'max_depth': 5, 'min_samples_split': 15, 'min_samples_leaf': 2, 'subsample': 0.9722891333333579, 'max_features': None}. Best is trial 80 with value: 0.2283890216431407.
[I 2024-12-04 12:17:36,186] Trial 105 finished with value: 0.38635390958038623 and parameters: {'n_estimators': 564, 'learning_rate': 0.07423071616336004, 'max_depth': 6, 'min_samples_split': 17, 'min_samples_leaf': 5, 'subsample': 0.9808498689917434, 'max_features': 'log2'}. Best is trial 80 with value: 0.2283890216431407.
[I 2024-12-04 12:17:37,385] Trial 109 finished with value: 0.2856568755573313 and parameters: {'n_estimators': 326, 'learning_rate': 0.08946633480928123, 'max_depth': 12, 'min_samples_split': 17, 'min_samples_leaf': 5, 'subsample': 0.911480241386791, 'max_features': 'sqrt'}. Best is trial 80 with value: 0.2283890216431407.
[I 2024-12-04 12:17:44,554] Trial 111 finished with value: 0.38528235138489386 and parameters: {'n_estimators': 434, 'learning_rate': 0.051796371861157285, 'max_depth': 12, 'min_samples_split': 11, 'min_samples_leaf': 8, 'subsample': 0.9295607046622526, 'max_features': 'sqrt'}. Best is trial 80 with value: 0.2283890216431407.
[I 2024-12-04 12:17:46,786] Trial 95 finished with value: 0.30610828997769657 and parameters: {'n_estimators': 814, 'learning_rate': 0.08654514283776718, 'max_depth': 11, 'min_samples_split': 7, 'min_samples_leaf': 5, 'subsample': 0.7735491867761277, 'max_features': None}. Best is trial 80 with value: 0.2283890216431407.
[I 2024-12-04 12:17:46,789] Trial 103 finished with value: 0.27327572559961116 and parameters: {'n_estimators': 903, 'learning_rate': 0.0662626263608747, 'max_depth': 12, 'min_samples_split': 9, 'min_samples_leaf': 2, 'subsample': 0.6897002824266381, 'max_features': 'log2'}. Best is trial 80 with value: 0.2283890216431407.
[I 2024-12-04 12:17:47,733] Trial 110 finished with value: 0.2824807248409335 and parameters: {'n_estimators': 646, 'learning_rate': 0.051829143901931995, 'max_depth': 7, 'min_samples_split': 2, 'min_samples_leaf': 1, 'subsample': 0.9042597397926176, 'max_features': 'sqrt'}. Best is trial 80 with value: 0.2283890216431407.
[I 2024-12-04 12:17:49,664] Trial 114 finished with value: 0.25501208143517584 and parameters: {'n_estimators': 388, 'learning_rate': 0.07053092912010418, 'max_depth': 11, 'min_samples_split': 6, 'min_samples_leaf': 2, 'subsample': 0.9843927839804978, 'max_features': 'sqrt'}. Best is trial 80 with value: 0.2283890216431407.
[I 2024-12-04 12:17:52,028] Trial 108 finished with value: 0.2605943644831823 and parameters: {'n_estimators': 661, 'learning_rate': 0.06537137003679563, 'max_depth': 11, 'min_samples_split': 11, 'min_samples_leaf': 3, 'subsample': 0.8033163935688885, 'max_features': 'sqrt'}. Best is trial 80 with value: 0.2283890216431407.
[I 2024-12-04 12:17:54,931] Trial 98 finished with value: 0.2769234844704223 and parameters: {'n_estimators': 1215, 'learning_rate': 0.07178702347664499, 'max_depth': 8, 'min_samples_split': 7, 'min_samples_leaf': 1, 'subsample': 0.7468981911889112, 'max_features': 'log2'}. Best is trial 80 with value: 0.2283890216431407.
[I 2024-12-04 12:17:56,395] Trial 100 finished with value: 0.2518249727309052 and parameters: {'n_estimators': 1098, 'learning_rate': 0.09156282511873184, 'max_depth': 10, 'min_samples_split': 2, 'min_samples_leaf': 2, 'subsample': 0.9140438920903452, 'max_features': 'log2'}. Best is trial 80 with value: 0.2283890216431407.
[I 2024-12-04 12:17:57,891] Trial 96 finished with value: 0.2645903717176529 and parameters: {'n_estimators': 1231, 'learning_rate': 0.08246285161522919, 'max_depth': 12, 'min_samples_split': 13, 'min_samples_leaf': 2, 'subsample': 0.7933942662863931, 'max_features': 'log2'}. Best is trial 80 with value: 0.2283890216431407.
[I 2024-12-04 12:18:00,765] Trial 112 finished with value: 0.28819773351925543 and parameters: {'n_estimators': 896, 'learning_rate': 0.0481785128003763, 'max_depth': 11, 'min_samples_split': 8, 'min_samples_leaf': 5, 'subsample': 0.7450259726205939, 'max_features': 'sqrt'}. Best is trial 80 with value: 0.2283890216431407.
[I 2024-12-04 12:18:02,330] Trial 119 finished with value: 0.27978859248898397 and parameters: {'n_estimators': 546, 'learning_rate': 0.04177276388693897, 'max_depth': 11, 'min_samples_split': 4, 'min_samples_leaf': 3, 'subsample': 0.8161621519827854, 'max_features': 'sqrt'}. Best is trial 80 with value: 0.2283890216431407.
[I 2024-12-04 12:18:03,697] Trial 126 finished with value: 0.28448569960799286 and parameters: {'n_estimators': 205, 'learning_rate': 0.07069106871218925, 'max_depth': 11, 'min_samples_split': 5, 'min_samples_leaf': 2, 'subsample': 0.9761011175525979, 'max_features': 'sqrt'}. Best is trial 80 with value: 0.2283890216431407.
[I 2024-12-04 12:18:03,756] Trial 120 finished with value: 0.242303514321931 and parameters: {'n_estimators': 581, 'learning_rate': 0.08883058192642135, 'max_depth': 12, 'min_samples_split': 4, 'min_samples_leaf': 2, 'subsample': 0.7504065878019792, 'max_features': 'sqrt'}. Best is trial 80 with value: 0.2283890216431407.
[I 2024-12-04 12:18:04,897] Trial 113 finished with value: 0.26025286783436075 and parameters: {'n_estimators': 727, 'learning_rate': 0.09315474756340371, 'max_depth': 11, 'min_samples_split': 4, 'min_samples_leaf': 3, 'subsample': 0.9506979795293612, 'max_features': 'sqrt'}. Best is trial 80 with value: 0.2283890216431407.
[I 2024-12-04 12:18:06,435] Trial 107 finished with value: 0.24278583466663103 and parameters: {'n_estimators': 1209, 'learning_rate': 0.09241434836457059, 'max_depth': 5, 'min_samples_split': 15, 'min_samples_leaf': 1, 'subsample': 0.836454035639751, 'max_features': 'sqrt'}. Best is trial 101 with value: 0.22711647448686362.
[I 2024-12-04 12:18:06,810] Trial 101 finished with value: 0.22711647448686362 and parameters: {'n_estimators': 1340, 'learning_rate': 0.06859222648880603, 'max_depth': 9, 'min_samples_split': 12, 'min_samples_leaf': 1, 'subsample': 0.7988677683459409, 'max_features': 'sqrt'}. Best is trial 101 with value: 0.22711647448686362.
[I 2024-12-04 12:18:07,215] Trial 129 finished with value: 0.2640756319596534 and parameters: {'n_estimators': 249, 'learning_rate': 0.08217767228256549, 'max_depth': 12, 'min_samples_split': 2, 'min_samples_leaf': 2, 'subsample': 0.9264093485561474, 'max_features': 'sqrt'}. Best is trial 101 with value: 0.22711647448686362.
[I 2024-12-04 12:18:07,944] Trial 115 finished with value: 0.2573366258412094 and parameters: {'n_estimators': 797, 'learning_rate': 0.08445522746789487, 'max_depth': 11, 'min_samples_split': 2, 'min_samples_leaf': 4, 'subsample': 0.9041402620491331, 'max_features': 'sqrt'}. Best is trial 101 with value: 0.22711647448686362.
[I 2024-12-04 12:18:08,225] Trial 102 finished with value: 0.269844218806656 and parameters: {'n_estimators': 1370, 'learning_rate': 0.018813739179906024, 'max_depth': 9, 'min_samples_split': 2, 'min_samples_leaf': 1, 'subsample': 0.7242974020976509, 'max_features': 'sqrt'}. Best is trial 101 with value: 0.22711647448686362.
[I 2024-12-04 12:18:09,264] Trial 106 finished with value: 0.29835408252624257 and parameters: {'n_estimators': 1077, 'learning_rate': 0.05056954194309073, 'max_depth': 12, 'min_samples_split': 2, 'min_samples_leaf': 3, 'subsample': 0.8862970875694881, 'max_features': None}. Best is trial 101 with value: 0.22711647448686362.
[I 2024-12-04 12:18:15,237] Trial 116 finished with value: 0.2513818450594181 and parameters: {'n_estimators': 938, 'learning_rate': 0.09501083824355168, 'max_depth': 11, 'min_samples_split': 3, 'min_samples_leaf': 1, 'subsample': 0.9451923938662831, 'max_features': 'sqrt'}. Best is trial 101 with value: 0.22711647448686362.
[I 2024-12-04 12:18:17,045] Trial 118 finished with value: 0.2852785151949359 and parameters: {'n_estimators': 949, 'learning_rate': 0.06883269509879972, 'max_depth': 10, 'min_samples_split': 7, 'min_samples_leaf': 5, 'subsample': 0.9928269651178867, 'max_features': 'sqrt'}. Best is trial 101 with value: 0.22711647448686362.
[I 2024-12-04 12:18:19,400] Trial 127 finished with value: 0.3977078137105892 and parameters: {'n_estimators': 614, 'learning_rate': 0.018426212473832887, 'max_depth': 9, 'min_samples_split': 5, 'min_samples_leaf': 1, 'subsample': 0.6420114808143861, 'max_features': 'log2'}. Best is trial 101 with value: 0.22711647448686362.
[I 2024-12-04 12:18:21,861] Trial 144 finished with value: 0.27456662048926633 and parameters: {'n_estimators': 188, 'learning_rate': 0.08251704359439466, 'max_depth': 12, 'min_samples_split': 3, 'min_samples_leaf': 2, 'subsample': 0.7092343194667278, 'max_features': 'sqrt'}. Best is trial 101 with value: 0.22711647448686362.
[I 2024-12-04 12:18:23,975] Trial 124 finished with value: 0.27183751684939256 and parameters: {'n_estimators': 853, 'learning_rate': 0.04625765693161117, 'max_depth': 9, 'min_samples_split': 3, 'min_samples_leaf': 3, 'subsample': 0.6451576050455858, 'max_features': 'sqrt'}. Best is trial 101 with value: 0.22711647448686362.
[I 2024-12-04 12:18:24,823] Trial 130 finished with value: 0.2688318499538978 and parameters: {'n_estimators': 740, 'learning_rate': 0.08754469552695844, 'max_depth': 7, 'min_samples_split': 10, 'min_samples_leaf': 2, 'subsample': 0.9673087890405323, 'max_features': 'sqrt'}. Best is trial 101 with value: 0.22711647448686362.
[I 2024-12-04 12:18:28,239] Trial 131 finished with value: 0.3079976881193003 and parameters: {'n_estimators': 836, 'learning_rate': 0.03554880927429326, 'max_depth': 5, 'min_samples_split': 20, 'min_samples_leaf': 2, 'subsample': 0.7195162354909879, 'max_features': 'sqrt'}. Best is trial 101 with value: 0.22711647448686362.
[I 2024-12-04 12:18:31,158] Trial 139 finished with value: 0.28364019782158856 and parameters: {'n_estimators': 526, 'learning_rate': 0.07964321718754848, 'max_depth': 12, 'min_samples_split': 8, 'min_samples_leaf': 5, 'subsample': 0.8073286441134565, 'max_features': 'sqrt'}. Best is trial 101 with value: 0.22711647448686362.
[I 2024-12-04 12:18:31,374] Trial 133 finished with value: 0.24243937439182886 and parameters: {'n_estimators': 605, 'learning_rate': 0.09580884462279536, 'max_depth': 11, 'min_samples_split': 10, 'min_samples_leaf': 2, 'subsample': 0.8215626340169186, 'max_features': 'sqrt'}. Best is trial 101 with value: 0.22711647448686362.
[I 2024-12-04 12:18:31,378] Trial 123 finished with value: 0.31860180496256296 and parameters: {'n_estimators': 896, 'learning_rate': 0.07804866022583996, 'max_depth': 9, 'min_samples_split': 6, 'min_samples_leaf': 2, 'subsample': 0.9699386415217526, 'max_features': None}. Best is trial 101 with value: 0.22711647448686362.
[I 2024-12-04 12:18:33,312] Trial 125 finished with value: 0.2305208420948502 and parameters: {'n_estimators': 1143, 'learning_rate': 0.094033213106941, 'max_depth': 8, 'min_samples_split': 16, 'min_samples_leaf': 1, 'subsample': 0.9759726676002998, 'max_features': 'sqrt'}. Best is trial 101 with value: 0.22711647448686362.
[I 2024-12-04 12:18:36,718] Trial 121 finished with value: 0.24250383413090779 and parameters: {'n_estimators': 1180, 'learning_rate': 0.035042976778929966, 'max_depth': 12, 'min_samples_split': 5, 'min_samples_leaf': 1, 'subsample': 0.8420180141812944, 'max_features': 'sqrt'}. Best is trial 101 with value: 0.22711647448686362.
[I 2024-12-04 12:18:36,723] Trial 138 finished with value: 0.274755111815164 and parameters: {'n_estimators': 602, 'learning_rate': 0.09198967079195998, 'max_depth': 8, 'min_samples_split': 16, 'min_samples_leaf': 1, 'subsample': 0.9277369029151459, 'max_features': None}. Best is trial 101 with value: 0.22711647448686362.
[I 2024-12-04 12:18:39,162] Trial 122 finished with value: 0.25052398245403296 and parameters: {'n_estimators': 1202, 'learning_rate': 0.055642176611903627, 'max_depth': 11, 'min_samples_split': 2, 'min_samples_leaf': 1, 'subsample': 0.7522643090811231, 'max_features': 'sqrt'}. Best is trial 101 with value: 0.22711647448686362.
