[I 2024-12-04 12:00:55,477] Trial 1460 finished with value: 1.0746652081803512 and parameters: {'max_depth': 32, 'min_samples_split': 16, 'min_samples_leaf': 3, 'max_features': 'sqrt', 'criterion': 'friedman_mse', 'splitter': 'best'}. Best is trial 245 with value: 0.5517975516810654.
[I 2024-12-04 12:00:56,013] Trial 1456 finished with value: 0.6366870857247696 and parameters: {'max_depth': 29, 'min_samples_split': 17, 'min_samples_leaf': 2, 'max_features': 'sqrt', 'criterion': 'squared_error', 'splitter': 'best'}. Best is trial 245 with value: 0.5517975516810654.
[I 2024-12-04 12:00:56,682] Trial 1469 finished with value: 0.5875137637998102 and parameters: {'max_depth': 35, 'min_samples_split': 19, 'min_samples_leaf': 1, 'max_features': 'sqrt', 'criterion': 'friedman_mse', 'splitter': 'best'}. Best is trial 245 with value: 0.5517975516810654.
[I 2024-12-04 12:00:56,991] Trial 1457 finished with value: 1.0746652081803512 and parameters: {'max_depth': 30, 'min_samples_split': 16, 'min_samples_leaf': 3, 'max_features': 'sqrt', 'criterion': 'friedman_mse', 'splitter': 'best'}. Best is trial 245 with value: 0.5517975516810654.
[I 2024-12-04 12:00:59,980] Trial 1467 finished with value: 0.5924912260784201 and parameters: {'max_depth': 31, 'min_samples_split': 16, 'min_samples_leaf': 1, 'max_features': 'sqrt', 'criterion': 'friedman_mse', 'splitter': 'best'}. Best is trial 245 with value: 0.5517975516810654.
[I 2024-12-04 12:01:00,310] Trial 1464 finished with value: 0.6394091808456486 and parameters: {'max_depth': 26, 'min_samples_split': 11, 'min_samples_leaf': 1, 'max_features': 'sqrt', 'criterion': 'squared_error', 'splitter': 'best'}. Best is trial 245 with value: 0.5517975516810654.
[I 2024-12-04 12:01:00,583] Trial 1475 finished with value: 0.6241169559432111 and parameters: {'max_depth': 30, 'min_samples_split': 15, 'min_samples_leaf': 1, 'max_features': 'sqrt', 'criterion': 'friedman_mse', 'splitter': 'best'}. Best is trial 245 with value: 0.5517975516810654.
[I 2024-12-04 12:01:02,190] Trial 1478 finished with value: 0.5875137637998102 and parameters: {'max_depth': 35, 'min_samples_split': 18, 'min_samples_leaf': 1, 'max_features': 'sqrt', 'criterion': 'squared_error', 'splitter': 'best'}. Best is trial 245 with value: 0.5517975516810654.
[I 2024-12-04 12:01:02,560] Trial 1470 finished with value: 0.5932995079316209 and parameters: {'max_depth': 35, 'min_samples_split': 13, 'min_samples_leaf': 2, 'max_features': 'sqrt', 'criterion': 'squared_error', 'splitter': 'best'}. Best is trial 245 with value: 0.5517975516810654.
[I 2024-12-04 12:01:02,790] Trial 1474 finished with value: 0.5873016447093399 and parameters: {'max_depth': 25, 'min_samples_split': 17, 'min_samples_leaf': 1, 'max_features': 'sqrt', 'criterion': 'friedman_mse', 'splitter': 'best'}. Best is trial 245 with value: 0.5517975516810654.
[I 2024-12-04 12:01:03,470] Trial 1468 finished with value: 0.6062520417811941 and parameters: {'max_depth': 30, 'min_samples_split': 14, 'min_samples_leaf': 1, 'max_features': 'sqrt', 'criterion': 'squared_error', 'splitter': 'best'}. Best is trial 245 with value: 0.5517975516810654.
[I 2024-12-04 12:01:03,587] Trial 1484 finished with value: 1.0807998923483113 and parameters: {'max_depth': 15, 'min_samples_split': 7, 'min_samples_leaf': 3, 'max_features': 'sqrt', 'criterion': 'friedman_mse', 'splitter': 'best'}. Best is trial 245 with value: 0.5517975516810654.
[I 2024-12-04 12:01:04,061] Trial 1480 finished with value: 0.5715320714451931 and parameters: {'max_depth': 31, 'min_samples_split': 15, 'min_samples_leaf': 1, 'max_features': 'sqrt', 'criterion': 'squared_error', 'splitter': 'best'}. Best is trial 245 with value: 0.5517975516810654.
[I 2024-12-04 12:01:04,210] Trial 1473 finished with value: 0.6241169559432111 and parameters: {'max_depth': 30, 'min_samples_split': 16, 'min_samples_leaf': 1, 'max_features': 'sqrt', 'criterion': 'friedman_mse', 'splitter': 'best'}. Best is trial 245 with value: 0.5517975516810654.
[I 2024-12-04 12:01:04,245] Trial 1477 finished with value: 1.1614961793464713 and parameters: {'max_depth': 21, 'min_samples_split': 16, 'min_samples_leaf': 2, 'max_features': 'sqrt', 'criterion': 'absolute_error', 'splitter': 'random'}. Best is trial 245 with value: 0.5517975516810654.
[I 2024-12-04 12:01:04,516] Trial 1471 finished with value: 1.0746652081803512 and parameters: {'max_depth': 31, 'min_samples_split': 14, 'min_samples_leaf': 3, 'max_features': 'sqrt', 'criterion': 'friedman_mse', 'splitter': 'best'}. Best is trial 245 with value: 0.5517975516810654.
[I 2024-12-04 12:01:04,877] Trial 1482 finished with value: 0.6062520417811941 and parameters: {'max_depth': 30, 'min_samples_split': 14, 'min_samples_leaf': 1, 'max_features': 'sqrt', 'criterion': 'friedman_mse', 'splitter': 'best'}. Best is trial 245 with value: 0.5517975516810654.
[I 2024-12-04 12:01:05,159] Trial 1487 finished with value: 1.0746652081803512 and parameters: {'max_depth': 28, 'min_samples_split': 10, 'min_samples_leaf': 3, 'max_features': 'sqrt', 'criterion': 'squared_error', 'splitter': 'best'}. Best is trial 245 with value: 0.5517975516810654.
[I 2024-12-04 12:01:05,392] Trial 1472 finished with value: 0.5743856205068374 and parameters: {'max_depth': 27, 'min_samples_split': 17, 'min_samples_leaf': 1, 'max_features': 'sqrt', 'criterion': 'friedman_mse', 'splitter': 'best'}. Best is trial 245 with value: 0.5517975516810654.
[I 2024-12-04 12:01:05,393] Trial 1483 finished with value: 1.259809444253076 and parameters: {'max_depth': 33, 'min_samples_split': 17, 'min_samples_leaf': 5, 'max_features': 'sqrt', 'criterion': 'squared_error', 'splitter': 'random'}. Best is trial 245 with value: 0.5517975516810654.
[I 2024-12-04 12:01:05,652] Trial 1491 finished with value: 0.5619094132389268 and parameters: {'max_depth': 29, 'min_samples_split': 18, 'min_samples_leaf': 1, 'max_features': 'sqrt', 'criterion': 'squared_error', 'splitter': 'best'}. Best is trial 245 with value: 0.5517975516810654.
[I 2024-12-04 12:01:05,820] Trial 1488 finished with value: 0.5661894660889475 and parameters: {'max_depth': 30, 'min_samples_split': 18, 'min_samples_leaf': 1, 'max_features': 'sqrt', 'criterion': 'friedman_mse', 'splitter': 'best'}. Best is trial 245 with value: 0.5517975516810654.
[I 2024-12-04 12:01:06,069] Trial 1486 finished with value: 0.5945975836542683 and parameters: {'max_depth': 28, 'min_samples_split': 20, 'min_samples_leaf': 2, 'max_features': 'sqrt', 'criterion': 'friedman_mse', 'splitter': 'best'}. Best is trial 245 with value: 0.5517975516810654.
[I 2024-12-04 12:01:07,014] Trial 1485 finished with value: 0.7704271646664281 and parameters: {'max_depth': 27, 'min_samples_split': 15, 'min_samples_leaf': 1, 'max_features': 'log2', 'criterion': 'friedman_mse', 'splitter': 'best'}. Best is trial 245 with value: 0.5517975516810654.
[I 2024-12-04 12:01:07,018] Trial 1481 finished with value: 1.259809444253076 and parameters: {'max_depth': 13, 'min_samples_split': 16, 'min_samples_leaf': 10, 'max_features': 'sqrt', 'criterion': 'friedman_mse', 'splitter': 'random'}. Best is trial 245 with value: 0.5517975516810654.
[I 2024-12-04 12:01:07,249] Trial 1476 finished with value: 0.6062520417811941 and parameters: {'max_depth': 30, 'min_samples_split': 14, 'min_samples_leaf': 1, 'max_features': 'sqrt', 'criterion': 'friedman_mse', 'splitter': 'best'}. Best is trial 245 with value: 0.5517975516810654.
[I 2024-12-04 12:01:07,279] Trial 1479 finished with value: 0.5932995079316209 and parameters: {'max_depth': 31, 'min_samples_split': 14, 'min_samples_leaf': 2, 'max_features': 'sqrt', 'criterion': 'squared_error', 'splitter': 'best'}. Best is trial 245 with value: 0.5517975516810654.
[I 2024-12-04 12:01:07,730] Trial 1490 finished with value: 0.5775376465321826 and parameters: {'max_depth': 34, 'min_samples_split': 17, 'min_samples_leaf': 1, 'max_features': 'sqrt', 'criterion': 'friedman_mse', 'splitter': 'best'}. Best is trial 245 with value: 0.5517975516810654.
[I 2024-12-04 12:01:09,030] Trial 1493 finished with value: 1.0746652081803512 and parameters: {'max_depth': 23, 'min_samples_split': 11, 'min_samples_leaf': 3, 'max_features': 'sqrt', 'criterion': 'friedman_mse', 'splitter': 'best'}. Best is trial 245 with value: 0.5517975516810654.
[I 2024-12-04 12:01:09,264] Trial 1496 finished with value: 1.1249126480499743 and parameters: {'max_depth': 35, 'min_samples_split': 17, 'min_samples_leaf': 2, 'max_features': 'sqrt', 'criterion': 'squared_error', 'splitter': 'random'}. Best is trial 245 with value: 0.5517975516810654.
[I 2024-12-04 12:01:09,481] Trial 1494 finished with value: 0.5842114223571664 and parameters: {'max_depth': 19, 'min_samples_split': 15, 'min_samples_leaf': 1, 'max_features': 'sqrt', 'criterion': 'squared_error', 'splitter': 'best'}. Best is trial 245 with value: 0.5517975516810654.
[I 2024-12-04 12:01:09,677] Trial 1492 finished with value: 0.6295211052940508 and parameters: {'max_depth': 21, 'min_samples_split': 9, 'min_samples_leaf': 1, 'max_features': 'sqrt', 'criterion': 'friedman_mse', 'splitter': 'best'}. Best is trial 245 with value: 0.5517975516810654.
[I 2024-12-04 12:01:11,508] Trial 1499 finished with value: 0.5732162781181424 and parameters: {'max_depth': 23, 'min_samples_split': 13, 'min_samples_leaf': 1, 'max_features': 'sqrt', 'criterion': 'friedman_mse', 'splitter': 'best'}. Best is trial 245 with value: 0.5517975516810654.
[I 2024-12-04 12:01:11,709] Trial 1495 finished with value: 0.5938675410110703 and parameters: {'max_depth': 24, 'min_samples_split': 12, 'min_samples_leaf': 1, 'max_features': 'sqrt', 'criterion': 'friedman_mse', 'splitter': 'best'}. Best is trial 245 with value: 0.5517975516810654.
[I 2024-12-04 12:01:11,711] Trial 1504 finished with value: 0.5776326895503221 and parameters: {'max_depth': 26, 'min_samples_split': 18, 'min_samples_leaf': 1, 'max_features': 'sqrt', 'criterion': 'friedman_mse', 'splitter': 'best'}. Best is trial 245 with value: 0.5517975516810654.
[I 2024-12-04 12:01:11,725] Trial 1503 finished with value: 0.7710457213342164 and parameters: {'max_depth': 30, 'min_samples_split': 19, 'min_samples_leaf': 1, 'max_features': 'log2', 'criterion': 'friedman_mse', 'splitter': 'best'}. Best is trial 245 with value: 0.5517975516810654.
[I 2024-12-04 12:01:11,945] Trial 1498 finished with value: 0.5860869405927785 and parameters: {'max_depth': 35, 'min_samples_split': 16, 'min_samples_leaf': 1, 'max_features': 'sqrt', 'criterion': 'friedman_mse', 'splitter': 'best'}. Best is trial 245 with value: 0.5517975516810654.
[I 2024-12-04 12:01:11,948] Trial 1497 finished with value: 0.5840920196378592 and parameters: {'max_depth': 25, 'min_samples_split': 14, 'min_samples_leaf': 1, 'max_features': 'sqrt', 'criterion': 'squared_error', 'splitter': 'best'}. Best is trial 245 with value: 0.5517975516810654.
[I 2024-12-04 12:01:14,184] Trial 1502 finished with value: 0.6366870857247696 and parameters: {'max_depth': 35, 'min_samples_split': 15, 'min_samples_leaf': 2, 'max_features': 'sqrt', 'criterion': 'friedman_mse', 'splitter': 'best'}. Best is trial 245 with value: 0.5517975516810654.
[I 2024-12-04 12:01:14,187] Trial 1500 finished with value: 0.6006242848138452 and parameters: {'max_depth': 26, 'min_samples_split': 16, 'min_samples_leaf': 1, 'max_features': 'sqrt', 'criterion': 'friedman_mse', 'splitter': 'best'}. Best is trial 245 with value: 0.5517975516810654.
[I 2024-12-04 12:01:14,190] Trial 1489 finished with value: 1.0746652081803512 and parameters: {'max_depth': 33, 'min_samples_split': 15, 'min_samples_leaf': 3, 'max_features': 'sqrt', 'criterion': 'friedman_mse', 'splitter': 'best'}. Best is trial 245 with value: 0.5517975516810654.
[I 2024-12-04 12:01:14,518] Trial 1511 finished with value: 0.5517975516810654 and parameters: {'max_depth': 29, 'min_samples_split': 17, 'min_samples_leaf': 1, 'max_features': 'sqrt', 'criterion': 'squared_error', 'splitter': 'best'}. Best is trial 245 with value: 0.5517975516810654.
[I 2024-12-04 12:01:15,003] Trial 1508 finished with value: 1.261454797635251 and parameters: {'max_depth': 1, 'min_samples_split': 3, 'min_samples_leaf': 9, 'max_features': 'log2', 'criterion': 'squared_error', 'splitter': 'random'}. Best is trial 245 with value: 0.5517975516810654.
[I 2024-12-04 12:01:15,004] Trial 1509 finished with value: 0.6000285247016761 and parameters: {'max_depth': 29, 'min_samples_split': 15, 'min_samples_leaf': 1, 'max_features': 'sqrt', 'criterion': 'friedman_mse', 'splitter': 'best'}. Best is trial 245 with value: 0.5517975516810654.
[I 2024-12-04 12:01:15,171] Trial 1501 finished with value: 0.6366870857247696 and parameters: {'max_depth': 30, 'min_samples_split': 17, 'min_samples_leaf': 2, 'max_features': 'sqrt', 'criterion': 'squared_error', 'splitter': 'best'}. Best is trial 245 with value: 0.5517975516810654.
[I 2024-12-04 12:01:16,015] Trial 1515 finished with value: 0.6366870857247696 and parameters: {'max_depth': 35, 'min_samples_split': 15, 'min_samples_leaf': 2, 'max_features': 'sqrt', 'criterion': 'squared_error', 'splitter': 'best'}. Best is trial 245 with value: 0.5517975516810654.
[I 2024-12-04 12:01:16,090] Trial 1516 finished with value: 1.0746652081803512 and parameters: {'max_depth': 30, 'min_samples_split': 19, 'min_samples_leaf': 3, 'max_features': 'sqrt', 'criterion': 'squared_error', 'splitter': 'best'}. Best is trial 245 with value: 0.5517975516810654.
[I 2024-12-04 12:01:16,183] Trial 1507 finished with value: 0.6519289145190702 and parameters: {'max_depth': 29, 'min_samples_split': 9, 'min_samples_leaf': 1, 'max_features': 'sqrt', 'criterion': 'squared_error', 'splitter': 'best'}. Best is trial 245 with value: 0.5517975516810654.
[I 2024-12-04 12:01:16,303] Trial 1513 finished with value: 0.5638995247461974 and parameters: {'max_depth': 29, 'min_samples_split': 19, 'min_samples_leaf': 1, 'max_features': 'sqrt', 'criterion': 'friedman_mse', 'splitter': 'best'}. Best is trial 245 with value: 0.5517975516810654.
[I 2024-12-04 12:01:16,849] Trial 1505 finished with value: 0.5932995079316209 and parameters: {'max_depth': 27, 'min_samples_split': 14, 'min_samples_leaf': 2, 'max_features': 'sqrt', 'criterion': 'squared_error', 'splitter': 'best'}. Best is trial 245 with value: 0.5517975516810654.
[I 2024-12-04 12:01:17,261] Trial 1524 finished with value: 1.3737845361400185 and parameters: {'max_depth': 25, 'min_samples_split': 13, 'min_samples_leaf': 4, 'max_features': 'log2', 'criterion': 'absolute_error', 'splitter': 'random'}. Best is trial 245 with value: 0.5517975516810654.
[I 2024-12-04 12:01:19,315] Trial 1517 finished with value: 1.3737845361400185 and parameters: {'max_depth': 5, 'min_samples_split': 9, 'min_samples_leaf': 6, 'max_features': 'log2', 'criterion': 'absolute_error', 'splitter': 'random'}. Best is trial 245 with value: 0.5517975516810654.
[I 2024-12-04 12:01:19,718] Trial 1519 finished with value: 0.58427781353575 and parameters: {'max_depth': 24, 'min_samples_split': 17, 'min_samples_leaf': 1, 'max_features': 'sqrt', 'criterion': 'squared_error', 'splitter': 'best'}. Best is trial 245 with value: 0.5517975516810654.
[I 2024-12-04 12:01:19,735] Trial 1512 finished with value: 0.5883040364889727 and parameters: {'max_depth': 25, 'min_samples_split': 18, 'min_samples_leaf': 1, 'max_features': 'sqrt', 'criterion': 'squared_error', 'splitter': 'best'}. Best is trial 245 with value: 0.5517975516810654.
[I 2024-12-04 12:01:20,063] Trial 1518 finished with value: 0.5619094132389268 and parameters: {'max_depth': 29, 'min_samples_split': 18, 'min_samples_leaf': 1, 'max_features': 'sqrt', 'criterion': 'squared_error', 'splitter': 'best'}. Best is trial 245 with value: 0.5517975516810654.
[I 2024-12-04 12:01:20,546] Trial 1522 finished with value: 1.0746652081803512 and parameters: {'max_depth': 24, 'min_samples_split': 14, 'min_samples_leaf': 3, 'max_features': 'sqrt', 'criterion': 'squared_error', 'splitter': 'best'}. Best is trial 245 with value: 0.5517975516810654.
[I 2024-12-04 12:01:20,615] Trial 1526 finished with value: 0.593204960471941 and parameters: {'max_depth': 28, 'min_samples_split': 13, 'min_samples_leaf': 1, 'max_features': 'sqrt', 'criterion': 'squared_error', 'splitter': 'best'}. Best is trial 245 with value: 0.5517975516810654.
[I 2024-12-04 12:01:21,337] Trial 1506 finished with value: 0.5945975836542683 and parameters: {'max_depth': 28, 'min_samples_split': 18, 'min_samples_leaf': 2, 'max_features': 'sqrt', 'criterion': 'squared_error', 'splitter': 'best'}. Best is trial 245 with value: 0.5517975516810654.
[I 2024-12-04 12:01:21,882] Trial 1525 finished with value: 0.563179779570873 and parameters: {'max_depth': 29, 'min_samples_split': 20, 'min_samples_leaf': 1, 'max_features': 'sqrt', 'criterion': 'squared_error', 'splitter': 'best'}. Best is trial 245 with value: 0.5517975516810654.
[I 2024-12-04 12:01:22,727] Trial 1510 finished with value: 0.6366870857247696 and parameters: {'max_depth': 26, 'min_samples_split': 16, 'min_samples_leaf': 2, 'max_features': 'sqrt', 'criterion': 'squared_error', 'splitter': 'best'}. Best is trial 245 with value: 0.5517975516810654.
[I 2024-12-04 12:01:23,491] Trial 1521 finished with value: 1.0111269137542622 and parameters: {'max_depth': 4, 'min_samples_split': 13, 'min_samples_leaf': 1, 'max_features': 'log2', 'criterion': 'absolute_error', 'splitter': 'best'}. Best is trial 245 with value: 0.5517975516810654.
[I 2024-12-04 12:01:24,193] Trial 1529 finished with value: 1.4121432010694666 and parameters: {'max_depth': 17, 'min_samples_split': 4, 'min_samples_leaf': 3, 'max_features': 'sqrt', 'criterion': 'absolute_error', 'splitter': 'best'}. Best is trial 245 with value: 0.5517975516810654.
[I 2024-12-04 12:01:24,471] Trial 1534 finished with value: 0.5718668665680694 and parameters: {'max_depth': 32, 'min_samples_split': 18, 'min_samples_leaf': 1, 'max_features': 'sqrt', 'criterion': 'squared_error', 'splitter': 'best'}. Best is trial 245 with value: 0.5517975516810654.
[I 2024-12-04 12:01:25,018] Trial 1514 finished with value: 0.5836321509919492 and parameters: {'max_depth': 24, 'min_samples_split': 20, 'min_samples_leaf': 1, 'max_features': 'sqrt', 'criterion': 'squared_error', 'splitter': 'best'}. Best is trial 245 with value: 0.5517975516810654.
[I 2024-12-04 12:01:25,286] Trial 1531 finished with value: 0.5877723420587634 and parameters: {'max_depth': 25, 'min_samples_split': 15, 'min_samples_leaf': 1, 'max_features': 'sqrt', 'criterion': 'squared_error', 'splitter': 'best'}. Best is trial 245 with value: 0.5517975516810654.
[I 2024-12-04 12:01:26,086] Trial 1523 finished with value: 1.4094873558287564 and parameters: {'max_depth': 1, 'min_samples_split': 5, 'min_samples_leaf': 3, 'max_features': 'sqrt', 'criterion': 'absolute_error', 'splitter': 'best'}. Best is trial 245 with value: 0.5517975516810654.
[I 2024-12-04 12:01:26,693] Trial 1538 finished with value: 1.0746652081803512 and parameters: {'max_depth': 24, 'min_samples_split': 18, 'min_samples_leaf': 3, 'max_features': 'sqrt', 'criterion': 'squared_error', 'splitter': 'best'}. Best is trial 245 with value: 0.5517975516810654.
[I 2024-12-04 12:01:26,796] Trial 1530 finished with value: 0.5951824649333685 and parameters: {'max_depth': 30, 'min_samples_split': 17, 'min_samples_leaf': 1, 'max_features': 'sqrt', 'criterion': 'squared_error', 'splitter': 'best'}. Best is trial 245 with value: 0.5517975516810654.
[I 2024-12-04 12:01:26,798] Trial 1528 finished with value: 0.6702359303225683 and parameters: {'max_depth': 27, 'min_samples_split': 10, 'min_samples_leaf': 1, 'max_features': 'sqrt', 'criterion': 'squared_error', 'splitter': 'random'}. Best is trial 245 with value: 0.5517975516810654.
[I 2024-12-04 12:01:26,804] Trial 1541 finished with value: 0.6241169559432111 and parameters: {'max_depth': 30, 'min_samples_split': 16, 'min_samples_leaf': 1, 'max_features': 'sqrt', 'criterion': 'squared_error', 'splitter': 'best'}. Best is trial 245 with value: 0.5517975516810654.
[I 2024-12-04 12:01:27,120] Trial 1536 finished with value: 0.6033893981188482 and parameters: {'max_depth': 27, 'min_samples_split': 16, 'min_samples_leaf': 1, 'max_features': 'sqrt', 'criterion': 'squared_error', 'splitter': 'best'}. Best is trial 245 with value: 0.5517975516810654.
[I 2024-12-04 12:01:27,816] Trial 1537 finished with value: 0.6366870857247696 and parameters: {'max_depth': 31, 'min_samples_split': 16, 'min_samples_leaf': 2, 'max_features': 'sqrt', 'criterion': 'squared_error', 'splitter': 'best'}. Best is trial 245 with value: 0.5517975516810654.
[I 2024-12-04 12:01:28,661] Trial 1533 finished with value: 1.261454797635251 and parameters: {'max_depth': 27, 'min_samples_split': 15, 'min_samples_leaf': 5, 'max_features': 'log2', 'criterion': 'friedman_mse', 'splitter': 'random'}. Best is trial 245 with value: 0.5517975516810654.
[I 2024-12-04 12:01:28,913] Trial 1520 finished with value: 0.7189464163951782 and parameters: {'max_depth': 35, 'min_samples_split': 14, 'min_samples_leaf': 1, 'max_features': 'log2', 'criterion': 'squared_error', 'splitter': 'best'}. Best is trial 245 with value: 0.5517975516810654.
[I 2024-12-04 12:01:29,321] Trial 1539 finished with value: 1.0746652081803512 and parameters: {'max_depth': 29, 'min_samples_split': 14, 'min_samples_leaf': 3, 'max_features': 'sqrt', 'criterion': 'squared_error', 'splitter': 'best'}. Best is trial 245 with value: 0.5517975516810654.
[I 2024-12-04 12:01:29,331] Trial 1527 finished with value: 1.261454797635251 and parameters: {'max_depth': 10, 'min_samples_split': 20, 'min_samples_leaf': 9, 'max_features': 'log2', 'criterion': 'friedman_mse', 'splitter': 'random'}. Best is trial 245 with value: 0.5517975516810654.
[I 2024-12-04 12:01:29,614] Trial 1544 finished with value: 0.5585518916151627 and parameters: {'max_depth': 32, 'min_samples_split': 15, 'min_samples_leaf': 1, 'max_features': 'sqrt', 'criterion': 'squared_error', 'splitter': 'best'}. Best is trial 245 with value: 0.5517975516810654.
