[I 2024-12-04 20:36:13,165] Trial 2453 finished with value: 0.5646207950262959 and parameters: {'n_estimators': 294, 'max_depth': 34, 'min_samples_split': 6, 'min_samples_leaf': 8, 'max_features': None, 'bootstrap': False, 'criterion': 'absolute_error'}. Best is trial 1631 with value: 0.32128932742921457.
[I 2024-12-04 20:36:15,046] Trial 2464 finished with value: 0.407941191031536 and parameters: {'n_estimators': 307, 'max_depth': 43, 'min_samples_split': 4, 'min_samples_leaf': 1, 'max_features': 'sqrt', 'bootstrap': False, 'criterion': 'squared_error'}. Best is trial 1631 with value: 0.32128932742921457.
[I 2024-12-04 20:36:15,142] Trial 2463 finished with value: 0.34584004914995514 and parameters: {'n_estimators': 305, 'max_depth': 42, 'min_samples_split': 2, 'min_samples_leaf': 1, 'max_features': 'sqrt', 'bootstrap': False, 'criterion': 'squared_error'}. Best is trial 1631 with value: 0.32128932742921457.
[I 2024-12-04 20:36:16,083] Trial 2462 finished with value: 0.3290923379723173 and parameters: {'n_estimators': 476, 'max_depth': 50, 'min_samples_split': 2, 'min_samples_leaf': 1, 'max_features': 'sqrt', 'bootstrap': False, 'criterion': 'squared_error'}. Best is trial 1631 with value: 0.32128932742921457.
[I 2024-12-04 20:36:17,036] Trial 2465 finished with value: 0.38475682583194415 and parameters: {'n_estimators': 259, 'max_depth': 50, 'min_samples_split': 4, 'min_samples_leaf': 1, 'max_features': 'sqrt', 'bootstrap': False, 'criterion': 'squared_error'}. Best is trial 1631 with value: 0.32128932742921457.
[I 2024-12-04 20:36:18,039] Trial 2466 finished with value: 0.32393180183718623 and parameters: {'n_estimators': 319, 'max_depth': 50, 'min_samples_split': 2, 'min_samples_leaf': 1, 'max_features': 'sqrt', 'bootstrap': False, 'criterion': 'squared_error'}. Best is trial 1631 with value: 0.32128932742921457.
[I 2024-12-04 20:36:18,246] Trial 2467 finished with value: 0.5363349453345903 and parameters: {'n_estimators': 374, 'max_depth': 50, 'min_samples_split': 3, 'min_samples_leaf': 1, 'max_features': 'log2', 'bootstrap': False, 'criterion': 'squared_error'}. Best is trial 1631 with value: 0.32128932742921457.
[I 2024-12-04 20:36:20,339] Trial 2469 finished with value: 0.3224133091717219 and parameters: {'n_estimators': 370, 'max_depth': 50, 'min_samples_split': 2, 'min_samples_leaf': 1, 'max_features': 'sqrt', 'bootstrap': False, 'criterion': 'squared_error'}. Best is trial 1631 with value: 0.32128932742921457.
[I 2024-12-04 20:36:20,603] Trial 2470 finished with value: 0.3491623552509539 and parameters: {'n_estimators': 385, 'max_depth': 43, 'min_samples_split': 2, 'min_samples_leaf': 1, 'max_features': 'sqrt', 'bootstrap': False, 'criterion': 'squared_error'}. Best is trial 1631 with value: 0.32128932742921457.
[I 2024-12-04 20:36:22,148] Trial 2471 finished with value: 0.3560409848756068 and parameters: {'n_estimators': 291, 'max_depth': 50, 'min_samples_split': 3, 'min_samples_leaf': 1, 'max_features': 'sqrt', 'bootstrap': False, 'criterion': 'squared_error'}. Best is trial 1631 with value: 0.32128932742921457.
[I 2024-12-04 20:36:22,447] Trial 2468 finished with value: 0.43371943580384037 and parameters: {'n_estimators': 489, 'max_depth': 49, 'min_samples_split': 2, 'min_samples_leaf': 1, 'max_features': None, 'bootstrap': False, 'criterion': 'squared_error'}. Best is trial 1631 with value: 0.32128932742921457.
[I 2024-12-04 20:36:23,663] Trial 2472 finished with value: 0.3277270602792664 and parameters: {'n_estimators': 450, 'max_depth': 50, 'min_samples_split': 2, 'min_samples_leaf': 1, 'max_features': 'sqrt', 'bootstrap': False, 'criterion': 'squared_error'}. Best is trial 1631 with value: 0.32128932742921457.
[I 2024-12-04 20:36:24,699] Trial 2473 finished with value: 0.37429273472398805 and parameters: {'n_estimators': 437, 'max_depth': 50, 'min_samples_split': 2, 'min_samples_leaf': 1, 'max_features': 'sqrt', 'bootstrap': True, 'criterion': 'squared_error'}. Best is trial 1631 with value: 0.32128932742921457.
[I 2024-12-04 20:36:25,861] Trial 2475 finished with value: 0.3237071069356298 and parameters: {'n_estimators': 334, 'max_depth': 50, 'min_samples_split': 2, 'min_samples_leaf': 1, 'max_features': 'sqrt', 'bootstrap': False, 'criterion': 'squared_error'}. Best is trial 1631 with value: 0.32128932742921457.
[I 2024-12-04 20:36:27,036] Trial 2476 finished with value: 0.32257382998279355 and parameters: {'n_estimators': 346, 'max_depth': 50, 'min_samples_split': 2, 'min_samples_leaf': 1, 'max_features': 'sqrt', 'bootstrap': False, 'criterion': 'squared_error'}. Best is trial 1631 with value: 0.32128932742921457.
[I 2024-12-04 20:36:27,908] Trial 2477 finished with value: 0.34651951328094005 and parameters: {'n_estimators': 302, 'max_depth': 44, 'min_samples_split': 2, 'min_samples_leaf': 1, 'max_features': 'sqrt', 'bootstrap': False, 'criterion': 'squared_error'}. Best is trial 1631 with value: 0.32128932742921457.
[I 2024-12-04 20:36:29,088] Trial 2478 finished with value: 0.32563521502948495 and parameters: {'n_estimators': 274, 'max_depth': 50, 'min_samples_split': 2, 'min_samples_leaf': 1, 'max_features': 'sqrt', 'bootstrap': False, 'criterion': 'squared_error'}. Best is trial 1631 with value: 0.32128932742921457.
[I 2024-12-04 20:36:30,547] Trial 2479 finished with value: 0.39043272350374286 and parameters: {'n_estimators': 405, 'max_depth': 41, 'min_samples_split': 3, 'min_samples_leaf': 1, 'max_features': 'sqrt', 'bootstrap': False, 'criterion': 'squared_error'}. Best is trial 1631 with value: 0.32128932742921457.
[I 2024-12-04 20:36:30,794] Trial 2474 finished with value: 0.34724504971587195 and parameters: {'n_estimators': 293, 'max_depth': 49, 'min_samples_split': 2, 'min_samples_leaf': 1, 'max_features': 'sqrt', 'bootstrap': False, 'criterion': 'absolute_error'}. Best is trial 1631 with value: 0.32128932742921457.
[I 2024-12-04 20:36:32,534] Trial 2482 finished with value: 0.6805267371581852 and parameters: {'n_estimators': 388, 'max_depth': 44, 'min_samples_split': 2, 'min_samples_leaf': 2, 'max_features': 'sqrt', 'bootstrap': False, 'criterion': 'squared_error'}. Best is trial 1631 with value: 0.32128932742921457.
[I 2024-12-04 20:36:32,636] Trial 2480 finished with value: 0.803605451857421 and parameters: {'n_estimators': 463, 'max_depth': 19, 'min_samples_split': 39, 'min_samples_leaf': 1, 'max_features': None, 'bootstrap': False, 'criterion': 'squared_error'}. Best is trial 1631 with value: 0.32128932742921457.
[I 2024-12-04 20:36:33,968] Trial 2481 finished with value: 0.32744087065479793 and parameters: {'n_estimators': 506, 'max_depth': 50, 'min_samples_split': 2, 'min_samples_leaf': 1, 'max_features': 'sqrt', 'bootstrap': False, 'criterion': 'squared_error'}. Best is trial 1631 with value: 0.32128932742921457.
[I 2024-12-04 20:36:35,308] Trial 2485 finished with value: 0.6764259327907312 and parameters: {'n_estimators': 266, 'max_depth': 41, 'min_samples_split': 2, 'min_samples_leaf': 2, 'max_features': 'sqrt', 'bootstrap': False, 'criterion': 'squared_error'}. Best is trial 1631 with value: 0.32128932742921457.
[I 2024-12-04 20:36:35,316] Trial 2483 finished with value: 0.3481992946534262 and parameters: {'n_estimators': 395, 'max_depth': 43, 'min_samples_split': 2, 'min_samples_leaf': 1, 'max_features': 'sqrt', 'bootstrap': False, 'criterion': 'squared_error'}. Best is trial 1631 with value: 0.32128932742921457.
[I 2024-12-04 20:36:35,798] Trial 2484 finished with value: 0.3555300034756588 and parameters: {'n_estimators': 472, 'max_depth': 43, 'min_samples_split': 2, 'min_samples_leaf': 1, 'max_features': 'sqrt', 'bootstrap': False, 'criterion': 'squared_error'}. Best is trial 1631 with value: 0.32128932742921457.
[I 2024-12-04 20:36:37,321] Trial 2487 finished with value: 0.6735633074326278 and parameters: {'n_estimators': 311, 'max_depth': 43, 'min_samples_split': 2, 'min_samples_leaf': 2, 'max_features': 'sqrt', 'bootstrap': False, 'criterion': 'squared_error'}. Best is trial 1631 with value: 0.32128932742921457.
[I 2024-12-04 20:36:38,095] Trial 2488 finished with value: 0.6859140686988604 and parameters: {'n_estimators': 516, 'max_depth': 50, 'min_samples_split': 3, 'min_samples_leaf': 2, 'max_features': 'sqrt', 'bootstrap': False, 'criterion': 'squared_error'}. Best is trial 1631 with value: 0.32128932742921457.
[I 2024-12-04 20:36:38,232] Trial 2486 finished with value: 0.4145876611656617 and parameters: {'n_estimators': 509, 'max_depth': 43, 'min_samples_split': 4, 'min_samples_leaf': 1, 'max_features': 'sqrt', 'bootstrap': False, 'criterion': 'squared_error'}. Best is trial 1631 with value: 0.32128932742921457.
[I 2024-12-04 20:36:39,595] Trial 2489 finished with value: 0.6911229654097909 and parameters: {'n_estimators': 482, 'max_depth': 50, 'min_samples_split': 3, 'min_samples_leaf': 2, 'max_features': 'sqrt', 'bootstrap': False, 'criterion': 'squared_error'}. Best is trial 1631 with value: 0.32128932742921457.
[I 2024-12-04 20:36:40,652] Trial 2490 finished with value: 0.35940169017947393 and parameters: {'n_estimators': 388, 'max_depth': 50, 'min_samples_split': 3, 'min_samples_leaf': 1, 'max_features': 'sqrt', 'bootstrap': False, 'criterion': 'squared_error'}. Best is trial 1631 with value: 0.32128932742921457.
[I 2024-12-04 20:36:40,746] Trial 2491 finished with value: 0.3594301642287163 and parameters: {'n_estimators': 382, 'max_depth': 50, 'min_samples_split': 3, 'min_samples_leaf': 1, 'max_features': 'sqrt', 'bootstrap': False, 'criterion': 'squared_error'}. Best is trial 1631 with value: 0.32128932742921457.
[I 2024-12-04 20:36:41,943] Trial 2492 finished with value: 0.650264341818367 and parameters: {'n_estimators': 336, 'max_depth': 5, 'min_samples_split': 33, 'min_samples_leaf': 1, 'max_features': None, 'bootstrap': False, 'criterion': 'squared_error'}. Best is trial 1631 with value: 0.32128932742921457.
[I 2024-12-04 20:36:43,203] Trial 2493 finished with value: 1.0980237819279608 and parameters: {'n_estimators': 894, 'max_depth': 6, 'min_samples_split': 40, 'min_samples_leaf': 3, 'max_features': 'sqrt', 'bootstrap': True, 'criterion': 'squared_error'}. Best is trial 1631 with value: 0.32128932742921457.
[I 2024-12-04 20:36:43,409] Trial 2494 finished with value: 0.32393180183718623 and parameters: {'n_estimators': 319, 'max_depth': 50, 'min_samples_split': 2, 'min_samples_leaf': 1, 'max_features': 'sqrt', 'bootstrap': False, 'criterion': 'squared_error'}. Best is trial 1631 with value: 0.32128932742921457.
[I 2024-12-04 20:36:44,139] Trial 2495 finished with value: 0.34548119656713966 and parameters: {'n_estimators': 265, 'max_depth': 43, 'min_samples_split': 2, 'min_samples_leaf': 1, 'max_features': 'sqrt', 'bootstrap': False, 'criterion': 'squared_error'}. Best is trial 1631 with value: 0.32128932742921457.
[I 2024-12-04 20:36:44,651] Trial 2496 finished with value: 0.6672239771439993 and parameters: {'n_estimators': 235, 'max_depth': 50, 'min_samples_split': 2, 'min_samples_leaf': 2, 'max_features': 'sqrt', 'bootstrap': False, 'criterion': 'squared_error'}. Best is trial 1631 with value: 0.32128932742921457.
[I 2024-12-04 20:36:45,138] Trial 2497 finished with value: 1.292204853365792 and parameters: {'n_estimators': 123, 'max_depth': 33, 'min_samples_split': 2, 'min_samples_leaf': 14, 'max_features': 'sqrt', 'bootstrap': False, 'criterion': 'absolute_error'}. Best is trial 1631 with value: 0.32128932742921457.
[I 2024-12-04 20:36:46,484] Trial 2498 finished with value: 1.3368318534266213 and parameters: {'n_estimators': 707, 'max_depth': 33, 'min_samples_split': 50, 'min_samples_leaf': 8, 'max_features': 'log2', 'bootstrap': False, 'criterion': 'absolute_error'}. Best is trial 1631 with value: 0.32128932742921457.
[I 2024-12-04 20:36:46,580] Trial 2499 finished with value: 0.8915774472748564 and parameters: {'n_estimators': 732, 'max_depth': 27, 'min_samples_split': 11, 'min_samples_leaf': 1, 'max_features': 'log2', 'bootstrap': False, 'criterion': 'squared_error'}. Best is trial 1631 with value: 0.32128932742921457.
