[I 2024-12-04 14:55:59,867] Trial 161 finished with value: 1.2614547448129778 and parameters: {'kernel_type': 'Matern', 'length_scale': 5169.651738483212, 'noise_level': 0.9938002473503487, 'constant_value': 0.00549253232571424, 'nu': 0.5}. Best is trial 150 with value: 0.488301845184712.
[I 2024-12-04 14:55:59,968] Trial 152 finished with value: 1.240111231532144 and parameters: {'kernel_type': 'Matern', 'length_scale': 0.0018611915558072846, 'noise_level': 0.003916583308573703, 'constant_value': 74.91397960835921, 'nu': 0.5}. Best is trial 150 with value: 0.488301845184712.
[I 2024-12-04 14:56:00,025] Trial 142 finished with value: 0.48830341544836375 and parameters: {'kernel_type': 'Matern', 'length_scale': 27.321651586039764, 'noise_level': 0.11072496206945517, 'constant_value': 92.96295952460613, 'nu': 0.5}. Best is trial 150 with value: 0.488301845184712.
[I 2024-12-04 14:56:02,364] Trial 149 finished with value: 0.48830133927701114 and parameters: {'kernel_type': 'Matern', 'length_scale': 4564.200374325582, 'noise_level': 0.11530432222117136, 'constant_value': 48904.219624912745, 'nu': 0.5}. Best is trial 149 with value: 0.48830133927701114.
[I 2024-12-04 14:56:02,669] Trial 160 finished with value: 1.2401112327473653 and parameters: {'kernel_type': 'Matern', 'length_scale': 9993.231245187004, 'noise_level': 0.04254853822636922, 'constant_value': 4.5256104304753775, 'nu': 0.5}. Best is trial 149 with value: 0.48830133927701114.
[I 2024-12-04 14:56:02,862] Trial 162 finished with value: 0.48830340936747124 and parameters: {'kernel_type': 'Matern', 'length_scale': 0.2083927515941234, 'noise_level': 0.0021127189850856576, 'constant_value': 0.017069424683661762, 'nu': 0.5}. Best is trial 149 with value: 0.48830133927701114.
[I 2024-12-04 14:56:04,026] Trial 158 finished with value: 1.2401112325474826 and parameters: {'kernel_type': 'Matern', 'length_scale': 81.95052311250573, 'noise_level': 1.03067174411818e-05, 'constant_value': 0.5861404108618038, 'nu': 0.5}. Best is trial 149 with value: 0.48830133927701114.
[I 2024-12-04 14:56:04,971] Trial 159 finished with value: 0.48830336869536095 and parameters: {'kernel_type': 'Matern', 'length_scale': 1.030512970566344, 'noise_level': 0.0031160820325023724, 'constant_value': 5.020153755640573, 'nu': 0.5}. Best is trial 149 with value: 0.48830133927701114.
[I 2024-12-04 14:56:06,449] Trial 167 finished with value: 0.4883033565127018 and parameters: {'kernel_type': 'Matern', 'length_scale': 9116.623619063274, 'noise_level': 0.13458564867344916, 'constant_value': 89097.45320451068, 'nu': 0.5}. Best is trial 149 with value: 0.48830133927701114.
[I 2024-12-04 14:56:06,460] Trial 166 finished with value: 1.2614543702026095 and parameters: {'kernel_type': 'Matern', 'length_scale': 3.3940623237978224e-05, 'noise_level': 3.6587044753548023e-10, 'constant_value': 9028.31332673361, 'nu': 2.5}. Best is trial 149 with value: 0.48830133927701114.
[I 2024-12-04 14:56:06,837] Trial 157 finished with value: 0.48830340966313013 and parameters: {'kernel_type': 'Matern', 'length_scale': 14189.851684684227, 'noise_level': 0.3243778558851272, 'constant_value': 3209.8238607379794, 'nu': 0.5}. Best is trial 149 with value: 0.48830133927701114.
[I 2024-12-04 14:56:06,911] Trial 163 finished with value: 0.4883034225022974 and parameters: {'kernel_type': 'Matern', 'length_scale': 89.59023868629649, 'noise_level': 0.9618648347961298, 'constant_value': 17266.53415716483, 'nu': 0.5}. Best is trial 149 with value: 0.48830133927701114.
[I 2024-12-04 14:56:07,284] Trial 155 finished with value: 0.4883034213477269 and parameters: {'kernel_type': 'Matern', 'length_scale': 47443.45131365466, 'noise_level': 0.018428678428886614, 'constant_value': 556.6063734105114, 'nu': 0.5}. Best is trial 149 with value: 0.48830133927701114.
[I 2024-12-04 14:56:08,344] Trial 154 finished with value: 0.48830336887665204 and parameters: {'kernel_type': 'Matern', 'length_scale': 70722.54826873018, 'noise_level': 0.08250753306557675, 'constant_value': 4.080567143650653, 'nu': 0.5}. Best is trial 149 with value: 0.48830133927701114.
[I 2024-12-04 14:56:08,847] Trial 170 finished with value: 0.48830341810633976 and parameters: {'kernel_type': 'Matern', 'length_scale': 48507.22656357177, 'noise_level': 0.0314214659914837, 'constant_value': 32320.05424113077, 'nu': 0.5}. Best is trial 149 with value: 0.48830133927701114.
[I 2024-12-04 14:56:09,942] Trial 165 finished with value: 0.48830341579651654 and parameters: {'kernel_type': 'Matern', 'length_scale': 1.1399229939366855, 'noise_level': 0.004160028030010088, 'constant_value': 21.399212022635737, 'nu': 0.5}. Best is trial 149 with value: 0.48830133927701114.
[I 2024-12-04 14:56:10,857] Trial 169 finished with value: 0.4883034204551547 and parameters: {'kernel_type': 'Matern', 'length_scale': 52606.53599169016, 'noise_level': 0.09790891108003733, 'constant_value': 29690.78611186203, 'nu': 0.5}. Best is trial 149 with value: 0.48830133927701114.
[I 2024-12-04 14:56:10,877] Trial 156 finished with value: 1.2401112325992345 and parameters: {'kernel_type': 'Matern', 'length_scale': 6421.7822477689715, 'noise_level': 0.001883423420363722, 'constant_value': 3631.284917535832, 'nu': 2.5}. Best is trial 149 with value: 0.48830133927701114.
[I 2024-12-04 14:56:11,523] Trial 146 finished with value: 0.5273056001100183 and parameters: {'kernel_type': 'Matern', 'length_scale': 17.903742830492476, 'noise_level': 0.12023491085530043, 'constant_value': 2.7769504204396446e-05, 'nu': 1.5}. Best is trial 149 with value: 0.48830133927701114.
[I 2024-12-04 14:56:11,996] Trial 173 finished with value: 0.488303566085573 and parameters: {'kernel_type': 'Matern', 'length_scale': 5255.696208438035, 'noise_level': 0.05255099857556365, 'constant_value': 92660.65443067638, 'nu': 0.5}. Best is trial 149 with value: 0.48830133927701114.
[I 2024-12-04 14:56:13,904] Trial 177 finished with value: 0.4883034052989313 and parameters: {'kernel_type': 'Matern', 'length_scale': 1927.7543231955044, 'noise_level': 0.1316218532567979, 'constant_value': 28502.71487559284, 'nu': 0.5}. Best is trial 149 with value: 0.48830133927701114.
[I 2024-12-04 14:56:14,570] Trial 180 finished with value: 1.2401112325526276 and parameters: {'kernel_type': 'Matern', 'length_scale': 0.04301934241175388, 'noise_level': 0.009422536067335232, 'constant_value': 0.5111668308429894, 'nu': 0.5}. Best is trial 149 with value: 0.48830133927701114.
[I 2024-12-04 14:56:15,408] Trial 181 finished with value: 1.2401112323625885 and parameters: {'kernel_type': 'Matern', 'length_scale': 43278.23641021295, 'noise_level': 0.030827770051550112, 'constant_value': 0.9667442506910983, 'nu': 0.5}. Best is trial 149 with value: 0.48830133927701114.
[I 2024-12-04 14:56:15,419] Trial 175 finished with value: 0.4883034239486882 and parameters: {'kernel_type': 'Matern', 'length_scale': 10343.611433155194, 'noise_level': 0.14105383939347974, 'constant_value': 74519.64400585764, 'nu': 0.5}. Best is trial 149 with value: 0.48830133927701114.
[I 2024-12-04 14:56:16,100] Trial 176 finished with value: 1.240111231710048 and parameters: {'kernel_type': 'Matern', 'length_scale': 13983.695161971049, 'noise_level': 0.0055452136238170815, 'constant_value': 32.78668450908569, 'nu': 0.5}. Best is trial 149 with value: 0.48830133927701114.
[I 2024-12-04 14:56:16,895] Trial 183 finished with value: 0.4883035018357592 and parameters: {'kernel_type': 'Matern', 'length_scale': 3.1294122449283273, 'noise_level': 0.3695355634601168, 'constant_value': 7.708002083193116, 'nu': 0.5}. Best is trial 149 with value: 0.48830133927701114.
[I 2024-12-04 14:56:18,084] Trial 185 finished with value: 0.48830342898757295 and parameters: {'kernel_type': 'Matern', 'length_scale': 84810.34657304347, 'noise_level': 0.12170582555656073, 'constant_value': 44609.397019499025, 'nu': 0.5}. Best is trial 149 with value: 0.48830133927701114.
[I 2024-12-04 14:56:18,642] Trial 164 finished with value: 0.48830343842554425 and parameters: {'kernel_type': 'Matern', 'length_scale': 95832.70455914587, 'noise_level': 0.007886702231754233, 'constant_value': 0.00792159945507379, 'nu': 0.5}. Best is trial 149 with value: 0.48830133927701114.
[I 2024-12-04 14:56:19,364] Trial 168 finished with value: 0.4883034148677132 and parameters: {'kernel_type': 'Matern', 'length_scale': 10302.087803646527, 'noise_level': 0.015521231795388784, 'constant_value': 34162.056022305616, 'nu': 0.5}. Best is trial 149 with value: 0.48830133927701114.
[I 2024-12-04 14:56:19,964] Trial 178 finished with value: 1.2401112324321455 and parameters: {'kernel_type': 'Matern', 'length_scale': 82982.92979691745, 'noise_level': 0.018149132995447185, 'constant_value': 76.3634334794985, 'nu': 0.5}. Best is trial 149 with value: 0.48830133927701114.
[I 2024-12-04 14:56:21,152] Trial 172 finished with value: 0.48830352939988303 and parameters: {'kernel_type': 'Matern', 'length_scale': 71854.34101973599, 'noise_level': 0.4555794143831794, 'constant_value': 208.17460363523963, 'nu': 0.5}. Best is trial 149 with value: 0.48830133927701114.
[I 2024-12-04 14:56:21,867] Trial 189 finished with value: 0.4883034635200129 and parameters: {'kernel_type': 'Matern', 'length_scale': 151.85190076331796, 'noise_level': 0.0052719461413677894, 'constant_value': 3.538367981490188, 'nu': 0.5}. Best is trial 149 with value: 0.48830133927701114.
[I 2024-12-04 14:56:22,112] Trial 184 finished with value: 0.4883034205148665 and parameters: {'kernel_type': 'Matern', 'length_scale': 0.1622262298544479, 'noise_level': 0.6354038046256635, 'constant_value': 3129.215778020923, 'nu': 0.5}. Best is trial 149 with value: 0.48830133927701114.
[I 2024-12-04 14:56:22,283] Trial 171 finished with value: 1.240111247220908 and parameters: {'kernel_type': 'Matern', 'length_scale': 0.0002724766416369085, 'noise_level': 0.0013972724092734263, 'constant_value': 7.076611527834001e-07, 'nu': 2.5}. Best is trial 149 with value: 0.48830133927701114.
[I 2024-12-04 14:56:22,879] Trial 191 finished with value: 1.2614543701991259 and parameters: {'kernel_type': 'Matern', 'length_scale': 0.013787616411087705, 'noise_level': 0.014326754549332877, 'constant_value': 76103.76858869335, 'nu': 2.5}. Best is trial 149 with value: 0.48830133927701114.
[I 2024-12-04 14:56:25,271] Trial 187 finished with value: 0.48830341977011976 and parameters: {'kernel_type': 'Matern', 'length_scale': 283.05744974714895, 'noise_level': 0.0015530903311822488, 'constant_value': 37057.40909285806, 'nu': 0.5}. Best is trial 149 with value: 0.48830133927701114.
[I 2024-12-04 14:56:25,277] Trial 179 finished with value: 0.4883034277005238 and parameters: {'kernel_type': 'Matern', 'length_scale': 7.496898015708029, 'noise_level': 0.10289041987221889, 'constant_value': 0.0033160660223326695, 'nu': 0.5}. Best is trial 149 with value: 0.48830133927701114.
[I 2024-12-04 14:56:26,028] Trial 182 finished with value: 0.48830339873774314 and parameters: {'kernel_type': 'Matern', 'length_scale': 533.1513622783038, 'noise_level': 0.00785838387528714, 'constant_value': 5.933700667876683, 'nu': 0.5}. Best is trial 149 with value: 0.48830133927701114.
[I 2024-12-04 14:56:26,280] Trial 188 finished with value: 1.2401112325288326 and parameters: {'kernel_type': 'Matern', 'length_scale': 39.428623932205305, 'noise_level': 0.001133273687571605, 'constant_value': 1.0797233454082377e-05, 'nu': 0.5}. Best is trial 149 with value: 0.48830133927701114.
[I 2024-12-04 14:56:27,405] Trial 195 finished with value: 1.2614547442423198 and parameters: {'kernel_type': 'Matern', 'length_scale': 14.181609458749335, 'noise_level': 2.791852099713425e-05, 'constant_value': 10.719224406269728, 'nu': 0.5}. Best is trial 149 with value: 0.48830133927701114.
[I 2024-12-04 14:56:27,629] Trial 193 finished with value: 1.2401112324300203 and parameters: {'kernel_type': 'Matern', 'length_scale': 7.728390522887076, 'noise_level': 9.304985978973512e-05, 'constant_value': 1.046304102674409, 'nu': 0.5}. Best is trial 149 with value: 0.48830133927701114.
[I 2024-12-04 14:56:27,897] Trial 174 finished with value: 1.240111232581942 and parameters: {'kernel_type': 'Matern', 'length_scale': 20693.61954147474, 'noise_level': 2.133882902226049e-10, 'constant_value': 1.6869413182948577e-06, 'nu': 1.5}. Best is trial 149 with value: 0.48830133927701114.
[I 2024-12-04 14:56:29,361] Trial 194 finished with value: 1.2401107410040528 and parameters: {'kernel_type': 'Matern', 'length_scale': 2.329034799751474, 'noise_level': 0.0004612398559182348, 'constant_value': 0.14743466681034692, 'nu': 0.5}. Best is trial 149 with value: 0.48830133927701114.
[I 2024-12-04 14:56:29,397] Trial 199 finished with value: 0.6443853497740429 and parameters: {'kernel_type': 'RBF', 'length_scale': 14.491174568465002, 'noise_level': 0.13399613170525823, 'constant_value': 0.010970226516474607, 'nu': 0.5}. Best is trial 149 with value: 0.48830133927701114.
[I 2024-12-04 14:56:29,408] Trial 198 finished with value: 0.4883033516263092 and parameters: {'kernel_type': 'Matern', 'length_scale': 608.0490772948464, 'noise_level': 0.015751476923830603, 'constant_value': 383.46507242729683, 'nu': 0.5}. Best is trial 149 with value: 0.48830133927701114.
[I 2024-12-04 14:56:30,005] Trial 200 finished with value: 1.240111232622029 and parameters: {'kernel_type': 'RBF', 'length_scale': 0.0001625501618789177, 'noise_level': 1.0031659890881549e-08, 'constant_value': 3.3080075018749976e-05, 'nu': 0.5}. Best is trial 149 with value: 0.48830133927701114.
[I 2024-12-04 14:56:30,418] Trial 201 finished with value: 0.4883034191515499 and parameters: {'kernel_type': 'Matern', 'length_scale': 8791.299973110092, 'noise_level': 0.26828078051252313, 'constant_value': 5.850373175126033, 'nu': 0.5}. Best is trial 149 with value: 0.48830133927701114.
[I 2024-12-04 14:56:31,082] Trial 197 finished with value: 1.2401112325821648 and parameters: {'kernel_type': 'RBF', 'length_scale': 79913.9945899001, 'noise_level': 6.343194654860679e-06, 'constant_value': 1356.5851554241747, 'nu': 0.5}. Best is trial 149 with value: 0.48830133927701114.
[I 2024-12-04 14:56:31,188] Trial 192 finished with value: 1.2614547976352437 and parameters: {'kernel_type': 'Matern', 'length_scale': 48724.83862656006, 'noise_level': 0.21127726816135498, 'constant_value': 1.384617076766638, 'nu': 2.5}. Best is trial 149 with value: 0.48830133927701114.
[I 2024-12-04 14:56:31,193] Trial 210 finished with value: 1.2614543702025973 and parameters: {'kernel_type': 'RBF', 'length_scale': 0.0037257119466957062, 'noise_level': 1.1600279775246016e-08, 'constant_value': 14560.95183497072, 'nu': 1.5}. Best is trial 149 with value: 0.48830133927701114.
[I 2024-12-04 14:56:31,353] Trial 190 finished with value: 0.6216319939602203 and parameters: {'kernel_type': 'RBF', 'length_scale': 69006.51070490506, 'noise_level': 0.35308214548769273, 'constant_value': 5746.661599994702, 'nu': 1.5}. Best is trial 149 with value: 0.48830133927701114.
[I 2024-12-04 14:56:31,639] Trial 196 finished with value: 1.240111232138181 and parameters: {'kernel_type': 'Matern', 'length_scale': 395.9961188360388, 'noise_level': 0.000834055147604248, 'constant_value': 3.2283779135062107, 'nu': 0.5}. Best is trial 149 with value: 0.48830133927701114.
[I 2024-12-04 14:56:31,898] Trial 202 finished with value: 0.48830416178106495 and parameters: {'kernel_type': 'Matern', 'length_scale': 528.4993254659729, 'noise_level': 0.6171289625058508, 'constant_value': 241.29587389920067, 'nu': 0.5}. Best is trial 149 with value: 0.48830133927701114.
[I 2024-12-04 14:56:32,601] Trial 204 finished with value: 1.2401112388773958 and parameters: {'kernel_type': 'Matern', 'length_scale': 0.0699541354147403, 'noise_level': 2.330807506376213e-10, 'constant_value': 0.0023952269982497566, 'nu': 2.5}. Best is trial 149 with value: 0.48830133927701114.
[I 2024-12-04 14:56:32,818] Trial 186 finished with value: 0.4883034794350261 and parameters: {'kernel_type': 'Matern', 'length_scale': 69115.77173213674, 'noise_level': 0.5163657480737173, 'constant_value': 15.017127359164506, 'nu': 0.5}. Best is trial 149 with value: 0.48830133927701114.
[I 2024-12-04 14:56:33,017] Trial 203 finished with value: 1.261454795394147 and parameters: {'kernel_type': 'Matern', 'length_scale': 534.0571750007718, 'noise_level': 0.03029337948251414, 'constant_value': 2425.9181143578903, 'nu': 0.5}. Best is trial 149 with value: 0.48830133927701114.
[I 2024-12-04 14:56:33,559] Trial 205 finished with value: 0.48830343769045004 and parameters: {'kernel_type': 'Matern', 'length_scale': 124.5735402602056, 'noise_level': 0.015227399381783576, 'constant_value': 57.1623208702833, 'nu': 0.5}. Best is trial 149 with value: 0.48830133927701114.
[I 2024-12-04 14:56:34,989] Trial 208 finished with value: 0.48830339000338285 and parameters: {'kernel_type': 'Matern', 'length_scale': 469.27807779474665, 'noise_level': 0.01002577437214857, 'constant_value': 71.95588534085557, 'nu': 0.5}. Best is trial 149 with value: 0.48830133927701114.
[I 2024-12-04 14:56:35,532] Trial 212 finished with value: 0.48830323791310565 and parameters: {'kernel_type': 'Matern', 'length_scale': 9240.727653430415, 'noise_level': 0.3733820082733164, 'constant_value': 27493.011274089888, 'nu': 0.5}. Best is trial 149 with value: 0.48830133927701114.
[I 2024-12-04 14:56:36,144] Trial 206 finished with value: 1.2401112334485624 and parameters: {'kernel_type': 'Matern', 'length_scale': 81392.0017170664, 'noise_level': 1.9395389826284432e-05, 'constant_value': 6.900887508745103, 'nu': 0.5}. Best is trial 149 with value: 0.48830133927701114.
[I 2024-12-04 14:56:36,337] Trial 207 finished with value: 0.4883033164670739 and parameters: {'kernel_type': 'Matern', 'length_scale': 820.7173017908025, 'noise_level': 0.0025119150718098896, 'constant_value': 2724.5742717187195, 'nu': 0.5}. Best is trial 149 with value: 0.48830133927701114.
[I 2024-12-04 14:56:38,332] Trial 211 finished with value: 1.2401112332233633 and parameters: {'kernel_type': 'RBF', 'length_scale': 4.9257792523013605e-05, 'noise_level': 0.48548049431104395, 'constant_value': 0.009559865988221202, 'nu': 2.5}. Best is trial 149 with value: 0.48830133927701114.
[I 2024-12-04 14:56:38,958] Trial 217 finished with value: 0.4883034402629958 and parameters: {'kernel_type': 'Matern', 'length_scale': 204.90659116215093, 'noise_level': 0.0680378196635601, 'constant_value': 17.95949380886321, 'nu': 0.5}. Best is trial 149 with value: 0.48830133927701114.
[I 2024-12-04 14:56:39,929] Trial 214 finished with value: 1.261454797635241 and parameters: {'kernel_type': 'Matern', 'length_scale': 65620.66540743044, 'noise_level': 0.02823360825229811, 'constant_value': 4.107157765476334, 'nu': 1.5}. Best is trial 149 with value: 0.48830133927701114.
[I 2024-12-04 14:56:41,153] Trial 218 finished with value: 0.4883034184962018 and parameters: {'kernel_type': 'Matern', 'length_scale': 13330.134663662044, 'noise_level': 0.5210806171789043, 'constant_value': 4798.57193785334, 'nu': 0.5}. Best is trial 149 with value: 0.48830133927701114.
[I 2024-12-04 14:56:41,800] Trial 216 finished with value: 0.4883034003016285 and parameters: {'kernel_type': 'Matern', 'length_scale': 19.71377799393342, 'noise_level': 0.002774401119845159, 'constant_value': 103.59901387399562, 'nu': 0.5}. Best is trial 149 with value: 0.48830133927701114.
[I 2024-12-04 14:56:42,217] Trial 209 finished with value: 1.261454370202597 and parameters: {'kernel_type': 'RBF', 'length_scale': 0.004487988397161642, 'noise_level': 0.00010343103005356633, 'constant_value': 89.13419015090585, 'nu': 0.5}. Best is trial 149 with value: 0.48830133927701114.
[I 2024-12-04 14:56:42,831] Trial 220 finished with value: 1.2614547976352475 and parameters: {'kernel_type': 'RBF', 'length_scale': 55068.00888184511, 'noise_level': 0.002069428763252534, 'constant_value': 1.3799317502986126e-05, 'nu': 2.5}. Best is trial 149 with value: 0.48830133927701114.
[I 2024-12-04 14:56:43,483] Trial 222 finished with value: 1.261454794561399 and parameters: {'kernel_type': 'Matern', 'length_scale': 3715.591442446209, 'noise_level': 7.662496183755329e-05, 'constant_value': 80215.95828599515, 'nu': 0.5}. Best is trial 149 with value: 0.48830133927701114.
[I 2024-12-04 14:56:43,941] Trial 221 finished with value: 0.48830344825245653 and parameters: {'kernel_type': 'Matern', 'length_scale': 421.19228663292967, 'noise_level': 0.0030085399308348174, 'constant_value': 553.6655343818882, 'nu': 0.5}. Best is trial 149 with value: 0.48830133927701114.
[I 2024-12-04 14:56:43,943] Trial 226 finished with value: 0.4883034299176044 and parameters: {'kernel_type': 'Matern', 'length_scale': 2499.1005900115583, 'noise_level': 0.0024354024253257843, 'constant_value': 38.1267000224935, 'nu': 0.5}. Best is trial 149 with value: 0.48830133927701114.
[I 2024-12-04 14:56:44,321] Trial 231 finished with value: 0.48830341551773826 and parameters: {'kernel_type': 'Matern', 'length_scale': 79967.47341937876, 'noise_level': 0.7139642267919909, 'constant_value': 7706.428819998995, 'nu': 0.5}. Best is trial 149 with value: 0.48830133927701114.
[I 2024-12-04 14:56:44,557] Trial 219 finished with value: 0.48830345979048645 and parameters: {'kernel_type': 'Matern', 'length_scale': 40.99663530142228, 'noise_level': 0.12564511718658164, 'constant_value': 28947.030589534766, 'nu': 0.5}. Best is trial 149 with value: 0.48830133927701114.
[I 2024-12-04 14:56:44,662] Trial 213 finished with value: 0.48830341741654437 and parameters: {'kernel_type': 'Matern', 'length_scale': 474.0413017709775, 'noise_level': 0.00463709547417078, 'constant_value': 764.4950769847688, 'nu': 0.5}. Best is trial 149 with value: 0.48830133927701114.
[I 2024-12-04 14:56:45,899] Trial 227 finished with value: 0.4883035273776252 and parameters: {'kernel_type': 'Matern', 'length_scale': 502.12474470286384, 'noise_level': 0.2511035427225045, 'constant_value': 36597.36954627268, 'nu': 0.5}. Best is trial 149 with value: 0.48830133927701114.
