[I 2024-12-04 20:17:22,710] Trial 856 finished with value: 0.14249507828620947 and parameters: {'kernel_type': 'Matern', 'length_scale': 0.9966127535215942, 'noise_level': 0.0013825842885105979, 'constant_value': 39.5727417148789, 'nu': 1.5}. Best is trial 616 with value: 0.1375127577189955.
[I 2024-12-04 20:17:22,726] Trial 858 finished with value: 0.9864686819398296 and parameters: {'kernel_type': 'RBF', 'length_scale': 1.0359270345941262e-05, 'noise_level': 1.4061260653451951e-06, 'constant_value': 0.0023283345363661117, 'nu': 1.5}. Best is trial 616 with value: 0.1375127577189955.
[I 2024-12-04 20:17:23,400] Trial 857 finished with value: 0.14249510855053124 and parameters: {'kernel_type': 'Matern', 'length_scale': 23.298383633581647, 'noise_level': 0.0001726443474058888, 'constant_value': 8.823787695462986, 'nu': 1.5}. Best is trial 616 with value: 0.1375127577189955.
[I 2024-12-04 20:17:27,921] Trial 861 finished with value: 0.9982167338037906 and parameters: {'kernel_type': 'RBF', 'length_scale': 9.58927947982594e-05, 'noise_level': 1.0371725665635109e-10, 'constant_value': 4941.088990528072, 'nu': 1.5}. Best is trial 616 with value: 0.1375127577189955.
[I 2024-12-04 20:17:30,792] Trial 859 finished with value: 0.1424950018709024 and parameters: {'kernel_type': 'Matern', 'length_scale': 1.1093078556098432, 'noise_level': 0.06508139196000835, 'constant_value': 36.38341203623179, 'nu': 1.5}. Best is trial 616 with value: 0.1375127577189955.
[I 2024-12-04 20:17:31,407] Trial 860 finished with value: 0.9864686819214925 and parameters: {'kernel_type': 'Matern', 'length_scale': 79.83693743106741, 'noise_level': 0.00037476427179341994, 'constant_value': 0.058784437567595466, 'nu': 1.5}. Best is trial 616 with value: 0.1375127577189955.
[I 2024-12-04 20:17:33,252] Trial 862 finished with value: 0.9864686819599469 and parameters: {'kernel_type': 'RBF', 'length_scale': 0.008710368716338332, 'noise_level': 1.0267404662166272e-09, 'constant_value': 0.002948353536200277, 'nu': 0.5}. Best is trial 616 with value: 0.1375127577189955.
[I 2024-12-04 20:17:37,261] Trial 863 finished with value: 0.14249493024073992 and parameters: {'kernel_type': 'Matern', 'length_scale': 14.815595019513074, 'noise_level': 0.0035549089101299214, 'constant_value': 64.94739880993615, 'nu': 1.5}. Best is trial 616 with value: 0.1375127577189955.
[I 2024-12-04 20:17:38,370] Trial 864 finished with value: 0.1424949980689609 and parameters: {'kernel_type': 'Matern', 'length_scale': 4.410819340613287, 'noise_level': 0.01871635049941902, 'constant_value': 1.2695768124342741, 'nu': 1.5}. Best is trial 616 with value: 0.1375127577189955.
[I 2024-12-04 20:17:43,053] Trial 865 finished with value: 0.14249504154740142 and parameters: {'kernel_type': 'Matern', 'length_scale': 14.147439051690123, 'noise_level': 0.0006925902769342711, 'constant_value': 36.89656085423338, 'nu': 1.5}. Best is trial 616 with value: 0.1375127577189955.
[I 2024-12-04 20:17:44,415] Trial 866 finished with value: 0.14249505795107162 and parameters: {'kernel_type': 'Matern', 'length_scale': 10.281908006723688, 'noise_level': 0.0064716251336738, 'constant_value': 144.6358226388159, 'nu': 1.5}. Best is trial 616 with value: 0.1375127577189955.
[I 2024-12-04 20:17:45,047] Trial 867 finished with value: 0.1424952232121079 and parameters: {'kernel_type': 'Matern', 'length_scale': 3.410683488606377, 'noise_level': 0.13558466839766134, 'constant_value': 3195.117807230609, 'nu': 1.5}. Best is trial 616 with value: 0.1375127577189955.
[I 2024-12-04 20:17:48,608] Trial 868 finished with value: 0.9982170978187229 and parameters: {'kernel_type': 'RBF', 'length_scale': 3383.3650461748125, 'noise_level': 0.4335899075954704, 'constant_value': 0.11007268279688762, 'nu': 1.5}. Best is trial 616 with value: 0.1375127577189955.
[I 2024-12-04 20:17:50,547] Trial 870 finished with value: 0.14249494950147512 and parameters: {'kernel_type': 'Matern', 'length_scale': 40.25597426857335, 'noise_level': 0.02073389548895345, 'constant_value': 1064.040489286304, 'nu': 1.5}. Best is trial 616 with value: 0.1375127577189955.
[I 2024-12-04 20:17:52,751] Trial 869 finished with value: 0.14249499955603637 and parameters: {'kernel_type': 'Matern', 'length_scale': 28.18049168927529, 'noise_level': 0.002501728489992771, 'constant_value': 6.570842053783498, 'nu': 1.5}. Best is trial 616 with value: 0.1375127577189955.
[I 2024-12-04 20:17:58,000] Trial 871 finished with value: 0.14249526290802894 and parameters: {'kernel_type': 'Matern', 'length_scale': 0.27007440301430885, 'noise_level': 0.0658557549243628, 'constant_value': 1117.3288816123656, 'nu': 1.5}. Best is trial 616 with value: 0.1375127577189955.
[I 2024-12-04 20:17:58,082] Trial 872 finished with value: 0.1477104654713844 and parameters: {'kernel_type': 'RBF', 'length_scale': 0.4527535114510267, 'noise_level': 0.2725316896847212, 'constant_value': 1.438560775214957, 'nu': 1.5}. Best is trial 616 with value: 0.1375127577189955.
[I 2024-12-04 20:17:59,383] Trial 873 finished with value: 0.1424950573225701 and parameters: {'kernel_type': 'Matern', 'length_scale': 0.4070749695613636, 'noise_level': 0.8906604708927133, 'constant_value': 5088.136038086562, 'nu': 1.5}. Best is trial 616 with value: 0.1375127577189955.
[I 2024-12-04 20:18:03,186] Trial 875 finished with value: 0.9982170532699116 and parameters: {'kernel_type': 'Matern', 'length_scale': 10203.25090020844, 'noise_level': 1.0758649142604922e-09, 'constant_value': 5397.07485775567, 'nu': 0.5}. Best is trial 616 with value: 0.1375127577189955.
[I 2024-12-04 20:18:08,036] Trial 874 finished with value: 0.14249506935590622 and parameters: {'kernel_type': 'Matern', 'length_scale': 2.1697217370463933, 'noise_level': 0.06864446146772703, 'constant_value': 1.1486100014057832, 'nu': 1.5}. Best is trial 616 with value: 0.1375127577189955.
[I 2024-12-04 20:18:11,883] Trial 876 finished with value: 0.9864686817580535 and parameters: {'kernel_type': 'Matern', 'length_scale': 4.0842087134431475, 'noise_level': 1.6585570837451613e-09, 'constant_value': 1.6733571496282532e-07, 'nu': 2.5}. Best is trial 616 with value: 0.1375127577189955.
[I 2024-12-04 20:18:12,279] Trial 877 finished with value: 0.14249504235182453 and parameters: {'kernel_type': 'Matern', 'length_scale': 5.8401595516763605, 'noise_level': 0.09289211556465568, 'constant_value': 128.22772276579073, 'nu': 1.5}. Best is trial 616 with value: 0.1375127577189955.
[I 2024-12-04 20:18:19,714] Trial 879 finished with value: 0.14249507510065534 and parameters: {'kernel_type': 'Matern', 'length_scale': 0.29828656821029986, 'noise_level': 0.9914882139322255, 'constant_value': 53.64748318514593, 'nu': 1.5}. Best is trial 616 with value: 0.1375127577189955.
[I 2024-12-04 20:18:20,229] Trial 880 finished with value: 0.14249517514832452 and parameters: {'kernel_type': 'Matern', 'length_scale': 22.031329091932758, 'noise_level': 0.6649508207081856, 'constant_value': 319.92346743864584, 'nu': 1.5}. Best is trial 616 with value: 0.1375127577189955.
[I 2024-12-04 20:18:21,431] Trial 878 finished with value: 0.1424952852114649 and parameters: {'kernel_type': 'Matern', 'length_scale': 44.48190549762591, 'noise_level': 0.011630522312314403, 'constant_value': 2259.5567083058386, 'nu': 1.5}. Best is trial 616 with value: 0.1375127577189955.
[I 2024-12-04 20:18:26,174] Trial 881 finished with value: 0.9864686819178317 and parameters: {'kernel_type': 'Matern', 'length_scale': 3.28718150415687, 'noise_level': 0.004215679074578963, 'constant_value': 0.02370229636362737, 'nu': 1.5}. Best is trial 616 with value: 0.1375127577189955.
[I 2024-12-04 20:18:27,062] Trial 882 finished with value: 0.14249497306025907 and parameters: {'kernel_type': 'Matern', 'length_scale': 9.025192031899216, 'noise_level': 0.9980638063389807, 'constant_value': 0.5091560276769549, 'nu': 1.5}. Best is trial 616 with value: 0.1375127577189955.
[I 2024-12-04 20:18:29,607] Trial 883 finished with value: 0.9864686819602488 and parameters: {'kernel_type': 'Matern', 'length_scale': 98.82138674811172, 'noise_level': 0.00170101459122749, 'constant_value': 1.40988026551346, 'nu': 1.5}. Best is trial 616 with value: 0.1375127577189955.
[I 2024-12-04 20:18:33,345] Trial 884 finished with value: 0.14249506361562586 and parameters: {'kernel_type': 'Matern', 'length_scale': 1.0488513549802752, 'noise_level': 0.0022647142491081097, 'constant_value': 2.715794599501089, 'nu': 1.5}. Best is trial 616 with value: 0.1375127577189955.
[I 2024-12-04 20:18:33,739] Trial 885 finished with value: 0.14249504127555312 and parameters: {'kernel_type': 'Matern', 'length_scale': 47170.230735794976, 'noise_level': 0.6661155598157087, 'constant_value': 38919.18031869938, 'nu': 1.5}. Best is trial 616 with value: 0.1375127577189955.
[I 2024-12-04 20:18:36,917] Trial 886 finished with value: 0.14249506831231074 and parameters: {'kernel_type': 'Matern', 'length_scale': 7.378011632515997, 'noise_level': 0.04632204368284744, 'constant_value': 21.411073822078567, 'nu': 1.5}. Best is trial 616 with value: 0.1375127577189955.
[I 2024-12-04 20:18:38,759] Trial 887 finished with value: 0.14771038121823005 and parameters: {'kernel_type': 'RBF', 'length_scale': 3.669048979894083, 'noise_level': 0.71674869233697, 'constant_value': 49505.34883220899, 'nu': 1.5}. Best is trial 616 with value: 0.1375127577189955.
[I 2024-12-04 20:18:40,392] Trial 888 finished with value: 0.1424950728465606 and parameters: {'kernel_type': 'Matern', 'length_scale': 4.0695551284154154, 'noise_level': 0.009747643791973163, 'constant_value': 4614.21873486739, 'nu': 1.5}. Best is trial 616 with value: 0.1375127577189955.
[I 2024-12-04 20:18:43,731] Trial 889 finished with value: 0.14249506336586645 and parameters: {'kernel_type': 'Matern', 'length_scale': 58.326468962812164, 'noise_level': 0.00042569848579896054, 'constant_value': 5376.64823985796, 'nu': 1.5}. Best is trial 616 with value: 0.1375127577189955.
[I 2024-12-04 20:18:46,510] Trial 891 finished with value: 0.14249515703387153 and parameters: {'kernel_type': 'Matern', 'length_scale': 135.58264047960668, 'noise_level': 0.787087580254371, 'constant_value': 175.9472042672939, 'nu': 1.5}. Best is trial 616 with value: 0.1375127577189955.
[I 2024-12-04 20:18:47,377] Trial 890 finished with value: 0.14249507043812518 and parameters: {'kernel_type': 'Matern', 'length_scale': 0.9429289101446784, 'noise_level': 0.029449423224018775, 'constant_value': 9.00548061661924, 'nu': 1.5}. Best is trial 616 with value: 0.1375127577189955.
[I 2024-12-04 20:18:48,843] Trial 892 finished with value: 0.9981726259814527 and parameters: {'kernel_type': 'RBF', 'length_scale': 254.08251775118833, 'noise_level': 6.016989334568155e-10, 'constant_value': 1.3792890774375954e-06, 'nu': 1.5}. Best is trial 616 with value: 0.1375127577189955.
[I 2024-12-04 20:18:52,592] Trial 895 finished with value: 0.9982171094742178 and parameters: {'kernel_type': 'RBF', 'length_scale': 37217.26718191068, 'noise_level': 0.14838495806413066, 'constant_value': 4.7128434681777745e-07, 'nu': 0.5}. Best is trial 616 with value: 0.1375127577189955.
[I 2024-12-04 20:18:53,781] Trial 893 finished with value: 0.19720016634070156 and parameters: {'kernel_type': 'Matern', 'length_scale': 14.236998666949498, 'noise_level': 0.018127886139191033, 'constant_value': 86.37277853682232, 'nu': 0.5}. Best is trial 616 with value: 0.1375127577189955.
[I 2024-12-04 20:18:57,023] Trial 894 finished with value: 0.9864686819724791 and parameters: {'kernel_type': 'RBF', 'length_scale': 1213.3674786605677, 'noise_level': 1.9821781331812978e-08, 'constant_value': 0.3315454965121917, 'nu': 2.5}. Best is trial 616 with value: 0.1375127577189955.
[I 2024-12-04 20:18:59,760] Trial 897 finished with value: 0.14249508687832949 and parameters: {'kernel_type': 'Matern', 'length_scale': 255.62929483237275, 'noise_level': 0.015993110528213096, 'constant_value': 1166.8323620489587, 'nu': 1.5}. Best is trial 616 with value: 0.1375127577189955.
[I 2024-12-04 20:19:02,540] Trial 896 finished with value: 0.13819111624693137 and parameters: {'kernel_type': 'Matern', 'length_scale': 0.6738111445250995, 'noise_level': 0.8718894079931115, 'constant_value': 11740.178661849037, 'nu': 1.5}. Best is trial 616 with value: 0.1375127577189955.
[I 2024-12-04 20:19:08,537] Trial 898 finished with value: 0.1446988264005845 and parameters: {'kernel_type': 'Matern', 'length_scale': 0.1879911263163276, 'noise_level': 3.380491973873992e-05, 'constant_value': 1.5033117796468916, 'nu': 2.5}. Best is trial 616 with value: 0.1375127577189955.
[I 2024-12-04 20:19:09,362] Trial 899 finished with value: 0.1424950615028658 and parameters: {'kernel_type': 'Matern', 'length_scale': 10.295778177497166, 'noise_level': 0.7390454622491973, 'constant_value': 340.8359322954667, 'nu': 1.5}. Best is trial 616 with value: 0.1375127577189955.
[I 2024-12-04 20:19:14,591] Trial 902 finished with value: 0.986468681901171 and parameters: {'kernel_type': 'Matern', 'length_scale': 0.0639635459602656, 'noise_level': 0.9058686599079127, 'constant_value': 72186.67888446341, 'nu': 1.5}. Best is trial 616 with value: 0.1375127577189955.
[I 2024-12-04 20:19:15,303] Trial 900 finished with value: 0.9864686819214245 and parameters: {'kernel_type': 'RBF', 'length_scale': 70866.47334423994, 'noise_level': 0.00010875640869451198, 'constant_value': 1648.8936642223537, 'nu': 2.5}. Best is trial 616 with value: 0.1375127577189955.
[I 2024-12-04 20:19:20,592] Trial 904 finished with value: 0.9864686819230025 and parameters: {'kernel_type': 'Matern', 'length_scale': 0.050625826631783645, 'noise_level': 0.04206556278868459, 'constant_value': 478.1737188914592, 'nu': 1.5}. Best is trial 616 with value: 0.1375127577189955.
[I 2024-12-04 20:19:21,401] Trial 903 finished with value: 0.14249514228242288 and parameters: {'kernel_type': 'Matern', 'length_scale': 0.7645166852603752, 'noise_level': 0.702283541591509, 'constant_value': 49060.06060846386, 'nu': 1.5}. Best is trial 616 with value: 0.1375127577189955.
[I 2024-12-04 20:19:21,409] Trial 901 finished with value: 0.14249505240236515 and parameters: {'kernel_type': 'Matern', 'length_scale': 0.18470472897911766, 'noise_level': 0.056475113920253346, 'constant_value': 9505.977515291548, 'nu': 1.5}. Best is trial 616 with value: 0.1375127577189955.
[I 2024-12-04 20:19:31,724] Trial 905 finished with value: 0.9864686819337748 and parameters: {'kernel_type': 'Matern', 'length_scale': 0.0043193831902424, 'noise_level': 0.008011506266680169, 'constant_value': 73604.38168290643, 'nu': 1.5}. Best is trial 616 with value: 0.1375127577189955.
[I 2024-12-04 20:19:34,504] Trial 907 finished with value: 0.9864686817743009 and parameters: {'kernel_type': 'Matern', 'length_scale': 0.01852653762612086, 'noise_level': 0.7491945883164617, 'constant_value': 79536.7907622899, 'nu': 1.5}. Best is trial 616 with value: 0.1375127577189955.
[I 2024-12-04 20:19:38,630] Trial 908 finished with value: 0.9864683563131025 and parameters: {'kernel_type': 'Matern', 'length_scale': 0.10150656082619432, 'noise_level': 0.017336620248972215, 'constant_value': 1601.9921563180533, 'nu': 1.5}. Best is trial 616 with value: 0.1375127577189955.
[I 2024-12-04 20:19:38,637] Trial 906 finished with value: 0.14249504564361704 and parameters: {'kernel_type': 'Matern', 'length_scale': 2.8269072702779763, 'noise_level': 0.04080340432983812, 'constant_value': 84182.58004307709, 'nu': 1.5}. Best is trial 616 with value: 0.1375127577189955.
[I 2024-12-04 20:19:40,695] Trial 909 finished with value: 0.9864686817898054 and parameters: {'kernel_type': 'Matern', 'length_scale': 0.03849369436702724, 'noise_level': 0.9145148134373973, 'constant_value': 93.39228399687255, 'nu': 1.5}. Best is trial 616 with value: 0.1375127577189955.
[I 2024-12-04 20:19:43,231] Trial 911 finished with value: 0.9864668938107093 and parameters: {'kernel_type': 'Matern', 'length_scale': 0.12956572704936545, 'noise_level': 0.8042993441400995, 'constant_value': 225.56795287180216, 'nu': 2.5}. Best is trial 616 with value: 0.1375127577189955.
[I 2024-12-04 20:19:49,377] Trial 912 finished with value: 0.14249504940927 and parameters: {'kernel_type': 'Matern', 'length_scale': 0.2651501624755476, 'noise_level': 0.7539105626527632, 'constant_value': 1908.1757884249039, 'nu': 1.5}. Best is trial 616 with value: 0.1375127577189955.
[I 2024-12-04 20:19:50,216] Trial 913 finished with value: 0.1424950633866496 and parameters: {'kernel_type': 'Matern', 'length_scale': 1.6886078011040058, 'noise_level': 0.6154752832987493, 'constant_value': 7139.175803746685, 'nu': 1.5}. Best is trial 616 with value: 0.1375127577189955.
[I 2024-12-04 20:19:52,677] Trial 910 finished with value: 0.14249502553999346 and parameters: {'kernel_type': 'Matern', 'length_scale': 1.854068980207462, 'noise_level': 0.3308777287772747, 'constant_value': 963.5888913598671, 'nu': 1.5}. Best is trial 616 with value: 0.1375127577189955.
[I 2024-12-04 20:19:56,907] Trial 914 finished with value: 0.14249507201660516 and parameters: {'kernel_type': 'Matern', 'length_scale': 0.8906945652908664, 'noise_level': 0.8094763669548546, 'constant_value': 737.271386946933, 'nu': 1.5}. Best is trial 616 with value: 0.1375127577189955.
[I 2024-12-04 20:19:57,214] Trial 916 finished with value: 0.14771027375164172 and parameters: {'kernel_type': 'RBF', 'length_scale': 11.272077913109175, 'noise_level': 0.08184848905418853, 'constant_value': 342.51040086442555, 'nu': 1.5}. Best is trial 616 with value: 0.1375127577189955.
[I 2024-12-04 20:20:01,571] Trial 918 finished with value: 0.9864686819002104 and parameters: {'kernel_type': 'Matern', 'length_scale': 0.001272668620836915, 'noise_level': 0.03374425773593581, 'constant_value': 7251.800665839034, 'nu': 0.5}. Best is trial 616 with value: 0.1375127577189955.
[I 2024-12-04 20:20:02,271] Trial 915 finished with value: 0.1424951278231562 and parameters: {'kernel_type': 'Matern', 'length_scale': 14.894210302565869, 'noise_level': 0.01828270705749595, 'constant_value': 6.074712271296032, 'nu': 1.5}. Best is trial 616 with value: 0.1375127577189955.
[I 2024-12-04 20:20:07,244] Trial 917 finished with value: 0.9864686819195908 and parameters: {'kernel_type': 'Matern', 'length_scale': 65004.77936336429, 'noise_level': 3.9402201189691805e-05, 'constant_value': 1527.9694245166663, 'nu': 1.5}. Best is trial 616 with value: 0.1375127577189955.
[I 2024-12-04 20:20:09,476] Trial 919 finished with value: 0.14249506158404532 and parameters: {'kernel_type': 'Matern', 'length_scale': 0.3122778131929198, 'noise_level': 0.012963333805571865, 'constant_value': 136.8996358014639, 'nu': 1.5}. Best is trial 616 with value: 0.1375127577189955.
[I 2024-12-04 20:20:10,016] Trial 920 finished with value: 0.1424951124324658 and parameters: {'kernel_type': 'Matern', 'length_scale': 9.95074669436963, 'noise_level': 0.019988016310154625, 'constant_value': 1.7435987936137838, 'nu': 1.5}. Best is trial 616 with value: 0.1375127577189955.
[I 2024-12-04 20:20:13,606] Trial 921 finished with value: 0.14249509064769056 and parameters: {'kernel_type': 'Matern', 'length_scale': 1.378559599699187, 'noise_level': 0.016286957878719102, 'constant_value': 28793.104998451192, 'nu': 1.5}. Best is trial 616 with value: 0.1375127577189955.
[I 2024-12-04 20:20:15,384] Trial 923 finished with value: 0.9864686819224875 and parameters: {'kernel_type': 'Matern', 'length_scale': 4.1847424323119584e-05, 'noise_level': 4.738718647706443e-06, 'constant_value': 0.0014998324446704346, 'nu': 2.5}. Best is trial 616 with value: 0.1375127577189955.
[I 2024-12-04 20:20:15,785] Trial 922 finished with value: 0.14249506406097184 and parameters: {'kernel_type': 'Matern', 'length_scale': 27.833653574449112, 'noise_level': 0.6180445626500672, 'constant_value': 1781.4220284183805, 'nu': 1.5}. Best is trial 616 with value: 0.1375127577189955.
[I 2024-12-04 20:20:20,346] Trial 924 finished with value: 0.14249519743973954 and parameters: {'kernel_type': 'Matern', 'length_scale': 14.507521687478357, 'noise_level': 0.027920551298753402, 'constant_value': 272.33637729103805, 'nu': 1.5}. Best is trial 616 with value: 0.1375127577189955.
[I 2024-12-04 20:20:23,963] Trial 925 finished with value: 0.9864686819212699 and parameters: {'kernel_type': 'RBF', 'length_scale': 9926.031756514109, 'noise_level': 1.5530438271752635e-10, 'constant_value': 0.007720514822792625, 'nu': 0.5}. Best is trial 616 with value: 0.1375127577189955.
[I 2024-12-04 20:20:24,033] Trial 926 finished with value: 0.14249506398989786 and parameters: {'kernel_type': 'Matern', 'length_scale': 4.320003310849261, 'noise_level': 0.9332925596625633, 'constant_value': 4835.951939766437, 'nu': 1.5}. Best is trial 616 with value: 0.1375127577189955.
[I 2024-12-04 20:20:28,398] Trial 928 finished with value: 0.9864686819197989 and parameters: {'kernel_type': 'Matern', 'length_scale': 8.974068587108716e-05, 'noise_level': 0.0003362840300761893, 'constant_value': 291.55303659393314, 'nu': 1.5}. Best is trial 616 with value: 0.1375127577189955.
[I 2024-12-04 20:20:28,707] Trial 927 finished with value: 0.14249518041111894 and parameters: {'kernel_type': 'Matern', 'length_scale': 5.55098359204844, 'noise_level': 0.0007857861741016053, 'constant_value': 1288.0073916543186, 'nu': 1.5}. Best is trial 616 with value: 0.1375127577189955.
[I 2024-12-04 20:20:30,262] Trial 929 finished with value: 0.14249506109171176 and parameters: {'kernel_type': 'Matern', 'length_scale': 0.5045100791150248, 'noise_level': 0.38359972608988685, 'constant_value': 0.3635283894702821, 'nu': 1.5}. Best is trial 616 with value: 0.1375127577189955.
[I 2024-12-04 20:20:33,085] Trial 931 finished with value: 0.9864686819157876 and parameters: {'kernel_type': 'Matern', 'length_scale': 1.5982172959460604e-05, 'noise_level': 3.494986802526248e-05, 'constant_value': 4.359026323917699, 'nu': 0.5}. Best is trial 616 with value: 0.1375127577189955.
