[I 2024-12-04 13:15:39,693] Trial 1594 finished with value: 0.22578976118749153 and parameters: {'n_estimators': 1474, 'learning_rate': 0.08941489707679584, 'max_depth': 12, 'min_samples_split': 17, 'min_samples_leaf': 1, 'subsample': 0.6992836038313923, 'max_features': 'sqrt'}. Best is trial 1137 with value: 0.19687116000636118.
[I 2024-12-04 13:15:41,180] Trial 1617 finished with value: 0.3119804813263676 and parameters: {'n_estimators': 481, 'learning_rate': 0.054942948856386425, 'max_depth': 9, 'min_samples_split': 12, 'min_samples_leaf': 5, 'subsample': 0.9574937269161644, 'max_features': None}. Best is trial 1137 with value: 0.19687116000636118.
[I 2024-12-04 13:15:41,308] Trial 1595 finished with value: 0.22903966114293178 and parameters: {'n_estimators': 1459, 'learning_rate': 0.09699822862773194, 'max_depth': 11, 'min_samples_split': 17, 'min_samples_leaf': 1, 'subsample': 0.7803285736544295, 'max_features': 'sqrt'}. Best is trial 1137 with value: 0.19687116000636118.
[I 2024-12-04 13:15:42,507] Trial 1613 finished with value: 0.3827261271302175 and parameters: {'n_estimators': 694, 'learning_rate': 0.09292525958826113, 'max_depth': 5, 'min_samples_split': 20, 'min_samples_leaf': 5, 'subsample': 0.6389578114434785, 'max_features': 'log2'}. Best is trial 1137 with value: 0.19687116000636118.
[I 2024-12-04 13:15:42,540] Trial 1601 finished with value: 0.2326907752533796 and parameters: {'n_estimators': 1200, 'learning_rate': 0.05856911046924104, 'max_depth': 11, 'min_samples_split': 18, 'min_samples_leaf': 1, 'subsample': 0.6576024652253141, 'max_features': 'sqrt'}. Best is trial 1137 with value: 0.19687116000636118.
[I 2024-12-04 13:15:42,887] Trial 1597 finished with value: 0.2146323051290082 and parameters: {'n_estimators': 1442, 'learning_rate': 0.07306133178384838, 'max_depth': 10, 'min_samples_split': 15, 'min_samples_leaf': 1, 'subsample': 0.6301943852790268, 'max_features': 'sqrt'}. Best is trial 1137 with value: 0.19687116000636118.
[I 2024-12-04 13:15:49,562] Trial 1603 finished with value: 0.2141138056167088 and parameters: {'n_estimators': 1244, 'learning_rate': 0.06475291895482801, 'max_depth': 10, 'min_samples_split': 18, 'min_samples_leaf': 1, 'subsample': 0.6282165648543103, 'max_features': 'sqrt'}. Best is trial 1137 with value: 0.19687116000636118.
[I 2024-12-04 13:15:49,993] Trial 1608 finished with value: 0.23208232123162525 and parameters: {'n_estimators': 1154, 'learning_rate': 0.09918352872286068, 'max_depth': 12, 'min_samples_split': 20, 'min_samples_leaf': 1, 'subsample': 0.6660977648073042, 'max_features': 'sqrt'}. Best is trial 1137 with value: 0.19687116000636118.
[I 2024-12-04 13:15:51,404] Trial 1599 finished with value: 0.2546528136258651 and parameters: {'n_estimators': 1410, 'learning_rate': 0.09964003797174155, 'max_depth': 12, 'min_samples_split': 16, 'min_samples_leaf': 3, 'subsample': 0.7092123665746374, 'max_features': 'sqrt'}. Best is trial 1137 with value: 0.19687116000636118.
[I 2024-12-04 13:15:52,871] Trial 1596 finished with value: 0.35110591625515264 and parameters: {'n_estimators': 1391, 'learning_rate': 0.0695174198919711, 'max_depth': 8, 'min_samples_split': 10, 'min_samples_leaf': 7, 'subsample': 0.9641516929722425, 'max_features': None}. Best is trial 1137 with value: 0.19687116000636118.
[I 2024-12-04 13:15:53,148] Trial 1600 finished with value: 0.24777615827902977 and parameters: {'n_estimators': 1475, 'learning_rate': 0.06193981192525978, 'max_depth': 10, 'min_samples_split': 14, 'min_samples_leaf': 2, 'subsample': 0.6642241677120853, 'max_features': 'sqrt'}. Best is trial 1137 with value: 0.19687116000636118.
[I 2024-12-04 13:15:53,273] Trial 1604 finished with value: 0.40757330735030645 and parameters: {'n_estimators': 1355, 'learning_rate': 0.09153723531257665, 'max_depth': 12, 'min_samples_split': 7, 'min_samples_leaf': 10, 'subsample': 0.7126375910502779, 'max_features': 'sqrt'}. Best is trial 1137 with value: 0.19687116000636118.
[I 2024-12-04 13:16:04,260] Trial 1607 finished with value: 0.22455668479356766 and parameters: {'n_estimators': 1412, 'learning_rate': 0.05648587104250333, 'max_depth': 11, 'min_samples_split': 20, 'min_samples_leaf': 1, 'subsample': 0.7357562378728314, 'max_features': 'sqrt'}. Best is trial 1137 with value: 0.19687116000636118.
[I 2024-12-04 13:16:04,907] Trial 1606 finished with value: 0.22407054621898384 and parameters: {'n_estimators': 1473, 'learning_rate': 0.06023083211833949, 'max_depth': 10, 'min_samples_split': 13, 'min_samples_leaf': 1, 'subsample': 0.6689692079816956, 'max_features': 'sqrt'}. Best is trial 1137 with value: 0.19687116000636118.
[I 2024-12-04 13:16:04,933] Trial 1630 finished with value: 0.4050215525440157 and parameters: {'n_estimators': 298, 'learning_rate': 0.03382158297911216, 'max_depth': 12, 'min_samples_split': 2, 'min_samples_leaf': 7, 'subsample': 0.7991830228355764, 'max_features': 'sqrt'}. Best is trial 1137 with value: 0.19687116000636118.
[I 2024-12-04 13:16:06,637] Trial 1610 finished with value: 0.2256793122429997 and parameters: {'n_estimators': 1402, 'learning_rate': 0.09557524565242591, 'max_depth': 10, 'min_samples_split': 15, 'min_samples_leaf': 1, 'subsample': 0.6964762268532096, 'max_features': 'sqrt'}. Best is trial 1137 with value: 0.19687116000636118.
[I 2024-12-04 13:16:06,710] Trial 1605 finished with value: 0.2533037905398867 and parameters: {'n_estimators': 1407, 'learning_rate': 0.06560215293800598, 'max_depth': 12, 'min_samples_split': 16, 'min_samples_leaf': 1, 'subsample': 0.6042255947288871, 'max_features': None}. Best is trial 1137 with value: 0.19687116000636118.
[I 2024-12-04 13:16:07,795] Trial 1611 finished with value: 0.25791742203762386 and parameters: {'n_estimators': 1289, 'learning_rate': 0.08726278264016123, 'max_depth': 10, 'min_samples_split': 20, 'min_samples_leaf': 3, 'subsample': 0.742488820281538, 'max_features': 'sqrt'}. Best is trial 1137 with value: 0.19687116000636118.
[I 2024-12-04 13:16:10,418] Trial 1609 finished with value: 0.2963707455892407 and parameters: {'n_estimators': 1287, 'learning_rate': 0.03387511161275798, 'max_depth': 7, 'min_samples_split': 15, 'min_samples_leaf': 4, 'subsample': 0.9919199659713046, 'max_features': None}. Best is trial 1137 with value: 0.19687116000636118.
[I 2024-12-04 13:16:17,812] Trial 1612 finished with value: 0.23320186402560075 and parameters: {'n_estimators': 1450, 'learning_rate': 0.09859223832426249, 'max_depth': 11, 'min_samples_split': 15, 'min_samples_leaf': 1, 'subsample': 0.6510017292781806, 'max_features': 'log2'}. Best is trial 1137 with value: 0.19687116000636118.
[I 2024-12-04 13:16:21,817] Trial 1639 finished with value: 0.699575367554301 and parameters: {'n_estimators': 308, 'learning_rate': 0.01471273136335428, 'max_depth': 3, 'min_samples_split': 20, 'min_samples_leaf': 10, 'subsample': 0.7431682324955589, 'max_features': 'sqrt'}. Best is trial 1137 with value: 0.19687116000636118.
[I 2024-12-04 13:16:23,713] Trial 1618 finished with value: 0.23041734513226708 and parameters: {'n_estimators': 1347, 'learning_rate': 0.06539518222322042, 'max_depth': 12, 'min_samples_split': 18, 'min_samples_leaf': 1, 'subsample': 0.6793736379862386, 'max_features': 'sqrt'}. Best is trial 1137 with value: 0.19687116000636118.
[I 2024-12-04 13:16:25,298] Trial 1616 finished with value: 0.2502822883417291 and parameters: {'n_estimators': 1433, 'learning_rate': 0.08523699163508743, 'max_depth': 10, 'min_samples_split': 16, 'min_samples_leaf': 3, 'subsample': 0.6042400500722601, 'max_features': 'sqrt'}. Best is trial 1137 with value: 0.19687116000636118.
[I 2024-12-04 13:16:25,375] Trial 1614 finished with value: 0.23644417504890733 and parameters: {'n_estimators': 1495, 'learning_rate': 0.09369200833769, 'max_depth': 12, 'min_samples_split': 18, 'min_samples_leaf': 3, 'subsample': 0.6930624493645041, 'max_features': 'sqrt'}. Best is trial 1137 with value: 0.19687116000636118.
[I 2024-12-04 13:16:27,404] Trial 1620 finished with value: 0.2442335469926035 and parameters: {'n_estimators': 1283, 'learning_rate': 0.08917753675641583, 'max_depth': 7, 'min_samples_split': 19, 'min_samples_leaf': 1, 'subsample': 0.7576908504517128, 'max_features': 'sqrt'}. Best is trial 1137 with value: 0.19687116000636118.
[I 2024-12-04 13:16:27,504] Trial 1615 finished with value: 0.2465895693659594 and parameters: {'n_estimators': 1493, 'learning_rate': 0.09029079331845428, 'max_depth': 9, 'min_samples_split': 18, 'min_samples_leaf': 2, 'subsample': 0.6008553401748814, 'max_features': 'sqrt'}. Best is trial 1137 with value: 0.19687116000636118.
[I 2024-12-04 13:16:35,580] Trial 1624 finished with value: 0.24608624407735558 and parameters: {'n_estimators': 1239, 'learning_rate': 0.07729672075862035, 'max_depth': 10, 'min_samples_split': 16, 'min_samples_leaf': 3, 'subsample': 0.6630468502228745, 'max_features': 'sqrt'}. Best is trial 1137 with value: 0.19687116000636118.
[I 2024-12-04 13:16:36,668] Trial 1621 finished with value: 0.24436722363622865 and parameters: {'n_estimators': 1425, 'learning_rate': 0.06441021531525469, 'max_depth': 12, 'min_samples_split': 15, 'min_samples_leaf': 1, 'subsample': 0.6910410073927461, 'max_features': 'log2'}. Best is trial 1137 with value: 0.19687116000636118.
[I 2024-12-04 13:16:44,239] Trial 1623 finished with value: 0.25484669817104 and parameters: {'n_estimators': 1463, 'learning_rate': 0.06082466332588306, 'max_depth': 12, 'min_samples_split': 19, 'min_samples_leaf': 3, 'subsample': 0.7053620184907631, 'max_features': 'sqrt'}. Best is trial 1137 with value: 0.19687116000636118.
[I 2024-12-04 13:16:46,208] Trial 1626 finished with value: 0.22183059067794114 and parameters: {'n_estimators': 1243, 'learning_rate': 0.09656409227435071, 'max_depth': 10, 'min_samples_split': 17, 'min_samples_leaf': 1, 'subsample': 0.6614330919824415, 'max_features': 'sqrt'}. Best is trial 1137 with value: 0.19687116000636118.
[I 2024-12-04 13:16:51,813] Trial 1627 finished with value: 0.2043629523398056 and parameters: {'n_estimators': 1275, 'learning_rate': 0.08420043522629643, 'max_depth': 12, 'min_samples_split': 16, 'min_samples_leaf': 1, 'subsample': 0.6021456956626448, 'max_features': 'sqrt'}. Best is trial 1137 with value: 0.19687116000636118.
[I 2024-12-04 13:16:55,868] Trial 1625 finished with value: 0.20981807303041194 and parameters: {'n_estimators': 1454, 'learning_rate': 0.09898712929806136, 'max_depth': 10, 'min_samples_split': 17, 'min_samples_leaf': 1, 'subsample': 0.6754324073749648, 'max_features': 'sqrt'}. Best is trial 1137 with value: 0.19687116000636118.
[I 2024-12-04 13:16:57,036] Trial 1629 finished with value: 0.22498522879921443 and parameters: {'n_estimators': 1318, 'learning_rate': 0.09520306859455133, 'max_depth': 11, 'min_samples_split': 17, 'min_samples_leaf': 1, 'subsample': 0.6045444210759857, 'max_features': 'sqrt'}. Best is trial 1137 with value: 0.19687116000636118.
[I 2024-12-04 13:17:00,245] Trial 1641 finished with value: 0.6833242399041748 and parameters: {'n_estimators': 958, 'learning_rate': 0.010366562704491818, 'max_depth': 5, 'min_samples_split': 12, 'min_samples_leaf': 8, 'subsample': 0.7158534375071545, 'max_features': 'log2'}. Best is trial 1137 with value: 0.19687116000636118.
[I 2024-12-04 13:17:00,302] Trial 1628 finished with value: 0.23128293352637244 and parameters: {'n_estimators': 1429, 'learning_rate': 0.06183565644978503, 'max_depth': 8, 'min_samples_split': 14, 'min_samples_leaf': 1, 'subsample': 0.6126805659136829, 'max_features': 'sqrt'}. Best is trial 1137 with value: 0.19687116000636118.
[I 2024-12-04 13:17:05,586] Trial 1633 finished with value: 0.21832236796648954 and parameters: {'n_estimators': 1216, 'learning_rate': 0.058694252094267624, 'max_depth': 11, 'min_samples_split': 20, 'min_samples_leaf': 1, 'subsample': 0.6887705208917934, 'max_features': 'sqrt'}. Best is trial 1137 with value: 0.19687116000636118.
[I 2024-12-04 13:17:11,216] Trial 1631 finished with value: 0.25206204832012075 and parameters: {'n_estimators': 1450, 'learning_rate': 0.051172418044769276, 'max_depth': 12, 'min_samples_split': 16, 'min_samples_leaf': 3, 'subsample': 0.6005557726897118, 'max_features': 'sqrt'}. Best is trial 1137 with value: 0.19687116000636118.
[I 2024-12-04 13:17:17,564] Trial 1635 finished with value: 0.2172304212916638 and parameters: {'n_estimators': 1366, 'learning_rate': 0.08800708260993372, 'max_depth': 10, 'min_samples_split': 13, 'min_samples_leaf': 1, 'subsample': 0.6035184702701752, 'max_features': 'sqrt'}. Best is trial 1137 with value: 0.19687116000636118.
[I 2024-12-04 13:17:19,850] Trial 1642 finished with value: 0.23269512870790032 and parameters: {'n_estimators': 1219, 'learning_rate': 0.09880728955021263, 'max_depth': 10, 'min_samples_split': 20, 'min_samples_leaf': 1, 'subsample': 0.7656249998550195, 'max_features': 'sqrt'}. Best is trial 1137 with value: 0.19687116000636118.
[I 2024-12-04 13:17:19,862] Trial 1638 finished with value: 0.2101807194869465 and parameters: {'n_estimators': 1379, 'learning_rate': 0.09977196311060799, 'max_depth': 11, 'min_samples_split': 16, 'min_samples_leaf': 1, 'subsample': 0.6185651498028168, 'max_features': 'sqrt'}. Best is trial 1137 with value: 0.19687116000636118.
[I 2024-12-04 13:17:22,850] Trial 1661 finished with value: 0.4309167928867971 and parameters: {'n_estimators': 407, 'learning_rate': 0.049270279626262466, 'max_depth': 12, 'min_samples_split': 19, 'min_samples_leaf': 5, 'subsample': 0.9817498154345551, 'max_features': 'log2'}. Best is trial 1137 with value: 0.19687116000636118.
[I 2024-12-04 13:17:26,070] Trial 1636 finished with value: 0.23413751406681407 and parameters: {'n_estimators': 1498, 'learning_rate': 0.09545412657597892, 'max_depth': 11, 'min_samples_split': 17, 'min_samples_leaf': 1, 'subsample': 0.6142364879377551, 'max_features': 'log2'}. Best is trial 1137 with value: 0.19687116000636118.
[I 2024-12-04 13:17:26,122] Trial 1650 finished with value: 0.21555482839190215 and parameters: {'n_estimators': 1063, 'learning_rate': 0.08744093469141909, 'max_depth': 10, 'min_samples_split': 17, 'min_samples_leaf': 1, 'subsample': 0.6938160999079928, 'max_features': 'sqrt'}. Best is trial 1137 with value: 0.19687116000636118.
[I 2024-12-04 13:17:27,375] Trial 1643 finished with value: 0.2283743576337728 and parameters: {'n_estimators': 1278, 'learning_rate': 0.09985233576617683, 'max_depth': 12, 'min_samples_split': 16, 'min_samples_leaf': 1, 'subsample': 0.7122568972452686, 'max_features': 'sqrt'}. Best is trial 1137 with value: 0.19687116000636118.
[I 2024-12-04 13:17:28,600] Trial 1637 finished with value: 0.22550883326594065 and parameters: {'n_estimators': 1470, 'learning_rate': 0.08125483454901013, 'max_depth': 10, 'min_samples_split': 16, 'min_samples_leaf': 1, 'subsample': 0.6100181106200856, 'max_features': 'sqrt'}. Best is trial 1137 with value: 0.19687116000636118.
[I 2024-12-04 13:17:28,952] Trial 1632 finished with value: 0.3655230583991067 and parameters: {'n_estimators': 1495, 'learning_rate': 0.05519537395827881, 'max_depth': 11, 'min_samples_split': 18, 'min_samples_leaf': 8, 'subsample': 0.9477324685663568, 'max_features': None}. Best is trial 1137 with value: 0.19687116000636118.
[I 2024-12-04 13:17:31,254] Trial 1649 finished with value: 0.23392731929883978 and parameters: {'n_estimators': 1196, 'learning_rate': 0.0676288122103078, 'max_depth': 11, 'min_samples_split': 17, 'min_samples_leaf': 1, 'subsample': 0.6675241016793994, 'max_features': 'sqrt'}. Best is trial 1137 with value: 0.19687116000636118.
[I 2024-12-04 13:17:31,314] Trial 1634 finished with value: 0.28035208792794186 and parameters: {'n_estimators': 1489, 'learning_rate': 0.034080205357260904, 'max_depth': 11, 'min_samples_split': 17, 'min_samples_leaf': 3, 'subsample': 0.765755405465149, 'max_features': None}. Best is trial 1137 with value: 0.19687116000636118.
[I 2024-12-04 13:17:34,254] Trial 1640 finished with value: 0.37694081205861457 and parameters: {'n_estimators': 1476, 'learning_rate': 0.077787736994916, 'max_depth': 3, 'min_samples_split': 20, 'min_samples_leaf': 8, 'subsample': 0.7251697541249842, 'max_features': None}. Best is trial 1137 with value: 0.19687116000636118.
[I 2024-12-04 13:17:35,662] Trial 1648 finished with value: 0.34228682039770536 and parameters: {'n_estimators': 1312, 'learning_rate': 0.010307788984916414, 'max_depth': 7, 'min_samples_split': 5, 'min_samples_leaf': 4, 'subsample': 0.9954296449272655, 'max_features': 'sqrt'}. Best is trial 1137 with value: 0.19687116000636118.
[I 2024-12-04 13:17:43,554] Trial 1652 finished with value: 0.24488898046196753 and parameters: {'n_estimators': 1210, 'learning_rate': 0.09996403095412403, 'max_depth': 10, 'min_samples_split': 17, 'min_samples_leaf': 2, 'subsample': 0.7272727367563827, 'max_features': 'sqrt'}. Best is trial 1137 with value: 0.19687116000636118.
[I 2024-12-04 13:17:43,555] Trial 1645 finished with value: 0.22077241045896284 and parameters: {'n_estimators': 1472, 'learning_rate': 0.056898880464575856, 'max_depth': 11, 'min_samples_split': 20, 'min_samples_leaf': 1, 'subsample': 0.6690807123921235, 'max_features': 'sqrt'}. Best is trial 1137 with value: 0.19687116000636118.
[I 2024-12-04 13:17:43,570] Trial 1644 finished with value: 0.20700146663146102 and parameters: {'n_estimators': 1488, 'learning_rate': 0.09919915959520423, 'max_depth': 11, 'min_samples_split': 16, 'min_samples_leaf': 1, 'subsample': 0.6241610179372642, 'max_features': 'sqrt'}. Best is trial 1137 with value: 0.19687116000636118.
[I 2024-12-04 13:17:44,025] Trial 1646 finished with value: 0.24907947550457224 and parameters: {'n_estimators': 1456, 'learning_rate': 0.062471254730567465, 'max_depth': 9, 'min_samples_split': 17, 'min_samples_leaf': 3, 'subsample': 0.6832009144498259, 'max_features': 'sqrt'}. Best is trial 1137 with value: 0.19687116000636118.
[I 2024-12-04 13:17:44,063] Trial 1647 finished with value: 0.24441364913945146 and parameters: {'n_estimators': 1473, 'learning_rate': 0.09422350434730334, 'max_depth': 10, 'min_samples_split': 17, 'min_samples_leaf': 3, 'subsample': 0.6062034308339721, 'max_features': 'sqrt'}. Best is trial 1137 with value: 0.19687116000636118.
[I 2024-12-04 13:17:47,966] Trial 1651 finished with value: 0.24213071266468644 and parameters: {'n_estimators': 1366, 'learning_rate': 0.09302888946357556, 'max_depth': 12, 'min_samples_split': 16, 'min_samples_leaf': 3, 'subsample': 0.6006902988740128, 'max_features': 'sqrt'}. Best is trial 1137 with value: 0.19687116000636118.
[I 2024-12-04 13:17:51,100] Trial 1657 finished with value: 0.22452253462226351 and parameters: {'n_estimators': 1209, 'learning_rate': 0.07268518065770488, 'max_depth': 11, 'min_samples_split': 20, 'min_samples_leaf': 1, 'subsample': 0.6858932220107428, 'max_features': 'sqrt'}. Best is trial 1137 with value: 0.19687116000636118.
[I 2024-12-04 13:17:56,625] Trial 1662 finished with value: 0.2562215339698017 and parameters: {'n_estimators': 864, 'learning_rate': 0.09020364246561893, 'max_depth': 9, 'min_samples_split': 16, 'min_samples_leaf': 3, 'subsample': 0.7682804608310239, 'max_features': 'sqrt'}. Best is trial 1137 with value: 0.19687116000636118.
[I 2024-12-04 13:17:58,094] Trial 1660 finished with value: 0.2320946965723292 and parameters: {'n_estimators': 1003, 'learning_rate': 0.05291378619785756, 'max_depth': 12, 'min_samples_split': 13, 'min_samples_leaf': 1, 'subsample': 0.6092998909850695, 'max_features': 'sqrt'}. Best is trial 1137 with value: 0.19687116000636118.
[I 2024-12-04 13:17:59,816] Trial 1653 finished with value: 0.21812622045321262 and parameters: {'n_estimators': 1485, 'learning_rate': 0.09498927014141188, 'max_depth': 11, 'min_samples_split': 19, 'min_samples_leaf': 1, 'subsample': 0.6891136879752077, 'max_features': 'sqrt'}. Best is trial 1137 with value: 0.19687116000636118.
[I 2024-12-04 13:18:00,060] Trial 1655 finished with value: 0.20683863995113286 and parameters: {'n_estimators': 1473, 'learning_rate': 0.06346402908832827, 'max_depth': 12, 'min_samples_split': 14, 'min_samples_leaf': 1, 'subsample': 0.673350938738025, 'max_features': 'sqrt'}. Best is trial 1137 with value: 0.19687116000636118.
[I 2024-12-04 13:18:00,852] Trial 1654 finished with value: 0.24323596311201062 and parameters: {'n_estimators': 1285, 'learning_rate': 0.08936531934304304, 'max_depth': 10, 'min_samples_split': 20, 'min_samples_leaf': 1, 'subsample': 0.7335877089980725, 'max_features': None}. Best is trial 1137 with value: 0.19687116000636118.
[I 2024-12-04 13:18:04,007] Trial 1656 finished with value: 0.22104092872307146 and parameters: {'n_estimators': 1488, 'learning_rate': 0.0766586016158698, 'max_depth': 10, 'min_samples_split': 15, 'min_samples_leaf': 1, 'subsample': 0.666375544220309, 'max_features': 'sqrt'}. Best is trial 1137 with value: 0.19687116000636118.
[I 2024-12-04 13:18:06,491] Trial 1659 finished with value: 0.2527382456014041 and parameters: {'n_estimators': 1306, 'learning_rate': 0.061133213802797896, 'max_depth': 10, 'min_samples_split': 19, 'min_samples_leaf': 3, 'subsample': 0.6638731077913514, 'max_features': 'sqrt'}. Best is trial 1137 with value: 0.19687116000636118.
[I 2024-12-04 13:18:13,677] Trial 1658 finished with value: 0.22662141578988004 and parameters: {'n_estimators': 1455, 'learning_rate': 0.06613798569301775, 'max_depth': 12, 'min_samples_split': 19, 'min_samples_leaf': 1, 'subsample': 0.7883964087777336, 'max_features': 'sqrt'}. Best is trial 1137 with value: 0.19687116000636118.
[I 2024-12-04 13:18:16,866] Trial 1665 finished with value: 0.2513732335274595 and parameters: {'n_estimators': 1194, 'learning_rate': 0.08307830838726304, 'max_depth': 12, 'min_samples_split': 13, 'min_samples_leaf': 4, 'subsample': 0.6014580281088295, 'max_features': 'sqrt'}. Best is trial 1137 with value: 0.19687116000636118.
