[I 2024-12-04 11:54:21,995] Trial 469 finished with value: 0.8459484779449206 and parameters: {'max_depth': 31, 'min_samples_split': 14, 'min_samples_leaf': 2, 'max_features': 'log2', 'criterion': 'friedman_mse', 'splitter': 'best'}. Best is trial 91 with value: 0.43250115503666103.
[I 2024-12-04 11:54:22,246] Trial 467 finished with value: 0.9618984120968926 and parameters: {'max_depth': 2, 'min_samples_split': 12, 'min_samples_leaf': 2, 'max_features': 'log2', 'criterion': 'friedman_mse', 'splitter': 'random'}. Best is trial 91 with value: 0.43250115503666103.
[I 2024-12-04 11:54:23,482] Trial 472 finished with value: 0.4699278115690271 and parameters: {'max_depth': 30, 'min_samples_split': 5, 'min_samples_leaf': 1, 'max_features': 'sqrt', 'criterion': 'squared_error', 'splitter': 'best'}. Best is trial 458 with value: 0.430928156546456.
[I 2024-12-04 11:54:23,637] Trial 458 finished with value: 0.430928156546456 and parameters: {'max_depth': 35, 'min_samples_split': 13, 'min_samples_leaf': 1, 'max_features': 'sqrt', 'criterion': 'friedman_mse', 'splitter': 'best'}. Best is trial 458 with value: 0.430928156546456.
[I 2024-12-04 11:54:24,105] Trial 470 finished with value: 0.9982171095081254 and parameters: {'max_depth': 25, 'min_samples_split': 14, 'min_samples_leaf': 10, 'max_features': 'log2', 'criterion': 'friedman_mse', 'splitter': 'best'}. Best is trial 458 with value: 0.430928156546456.
[I 2024-12-04 11:54:24,260] Trial 471 finished with value: 0.483263059820054 and parameters: {'max_depth': 35, 'min_samples_split': 5, 'min_samples_leaf': 1, 'max_features': 'sqrt', 'criterion': 'squared_error', 'splitter': 'best'}. Best is trial 458 with value: 0.430928156546456.
[I 2024-12-04 11:54:24,551] Trial 461 finished with value: 0.7009935875261493 and parameters: {'max_depth': 24, 'min_samples_split': 12, 'min_samples_leaf': 6, 'max_features': 'sqrt', 'criterion': 'friedman_mse', 'splitter': 'best'}. Best is trial 458 with value: 0.430928156546456.
[I 2024-12-04 11:54:24,699] Trial 478 finished with value: 0.5523976355951831 and parameters: {'max_depth': 31, 'min_samples_split': 2, 'min_samples_leaf': 1, 'max_features': 'sqrt', 'criterion': 'squared_error', 'splitter': 'best'}. Best is trial 458 with value: 0.430928156546456.
[I 2024-12-04 11:54:25,172] Trial 477 finished with value: 0.5350791484042196 and parameters: {'max_depth': 30, 'min_samples_split': 2, 'min_samples_leaf': 2, 'max_features': 'sqrt', 'criterion': 'squared_error', 'splitter': 'best'}. Best is trial 458 with value: 0.430928156546456.
[I 2024-12-04 11:54:26,216] Trial 456 finished with value: 0.5670371176593827 and parameters: {'max_depth': 35, 'min_samples_split': 3, 'min_samples_leaf': 3, 'max_features': 'sqrt', 'criterion': 'absolute_error', 'splitter': 'best'}. Best is trial 458 with value: 0.430928156546456.
[I 2024-12-04 11:54:26,884] Trial 482 finished with value: 0.524743745773334 and parameters: {'max_depth': 31, 'min_samples_split': 11, 'min_samples_leaf': 1, 'max_features': 'sqrt', 'criterion': 'friedman_mse', 'splitter': 'best'}. Best is trial 458 with value: 0.430928156546456.
[I 2024-12-04 11:54:27,002] Trial 454 finished with value: 0.6177480673971966 and parameters: {'max_depth': 25, 'min_samples_split': 6, 'min_samples_leaf': 1, 'max_features': 'sqrt', 'criterion': 'squared_error', 'splitter': 'random'}. Best is trial 458 with value: 0.430928156546456.
[I 2024-12-04 11:54:27,208] Trial 475 finished with value: 0.5085190734000163 and parameters: {'max_depth': 33, 'min_samples_split': 11, 'min_samples_leaf': 1, 'max_features': 'sqrt', 'criterion': 'friedman_mse', 'splitter': 'best'}. Best is trial 458 with value: 0.430928156546456.
[I 2024-12-04 11:54:27,618] Trial 468 finished with value: 0.5344511259491019 and parameters: {'max_depth': 35, 'min_samples_split': 2, 'min_samples_leaf': 1, 'max_features': 'log2', 'criterion': 'squared_error', 'splitter': 'best'}. Best is trial 458 with value: 0.430928156546456.
[I 2024-12-04 11:54:27,907] Trial 473 finished with value: 0.5957003040263869 and parameters: {'max_depth': 33, 'min_samples_split': 13, 'min_samples_leaf': 1, 'max_features': 'sqrt', 'criterion': 'friedman_mse', 'splitter': 'random'}. Best is trial 458 with value: 0.430928156546456.
[I 2024-12-04 11:54:28,494] Trial 465 finished with value: 0.5220453594633404 and parameters: {'max_depth': 29, 'min_samples_split': 14, 'min_samples_leaf': 1, 'max_features': 'sqrt', 'criterion': 'friedman_mse', 'splitter': 'best'}. Best is trial 458 with value: 0.430928156546456.
[I 2024-12-04 11:54:28,658] Trial 474 finished with value: 0.5518702416384237 and parameters: {'max_depth': 27, 'min_samples_split': 2, 'min_samples_leaf': 1, 'max_features': 'sqrt', 'criterion': 'squared_error', 'splitter': 'best'}. Best is trial 458 with value: 0.430928156546456.
[I 2024-12-04 11:54:28,941] Trial 492 finished with value: 0.560733148846327 and parameters: {'max_depth': 28, 'min_samples_split': 2, 'min_samples_leaf': 1, 'max_features': 'sqrt', 'criterion': 'squared_error', 'splitter': 'best'}. Best is trial 458 with value: 0.430928156546456.
[I 2024-12-04 11:54:29,252] Trial 484 finished with value: 0.5028340388552847 and parameters: {'max_depth': 35, 'min_samples_split': 15, 'min_samples_leaf': 2, 'max_features': 'sqrt', 'criterion': 'friedman_mse', 'splitter': 'best'}. Best is trial 458 with value: 0.430928156546456.
[I 2024-12-04 11:54:30,940] Trial 476 finished with value: 0.8390007495129449 and parameters: {'max_depth': 23, 'min_samples_split': 3, 'min_samples_leaf': 3, 'max_features': 'sqrt', 'criterion': 'absolute_error', 'splitter': 'random'}. Best is trial 458 with value: 0.430928156546456.
[I 2024-12-04 11:54:31,120] Trial 480 finished with value: 0.584300197786044 and parameters: {'max_depth': 34, 'min_samples_split': 12, 'min_samples_leaf': 3, 'max_features': 'sqrt', 'criterion': 'friedman_mse', 'splitter': 'best'}. Best is trial 458 with value: 0.430928156546456.
[I 2024-12-04 11:54:32,208] Trial 488 finished with value: 0.9625340596516944 and parameters: {'max_depth': 17, 'min_samples_split': 12, 'min_samples_leaf': 4, 'max_features': 'log2', 'criterion': 'squared_error', 'splitter': 'random'}. Best is trial 458 with value: 0.430928156546456.
[I 2024-12-04 11:54:32,290] Trial 486 finished with value: 0.47344856982335537 and parameters: {'max_depth': 35, 'min_samples_split': 12, 'min_samples_leaf': 1, 'max_features': 'sqrt', 'criterion': 'friedman_mse', 'splitter': 'best'}. Best is trial 458 with value: 0.430928156546456.
[I 2024-12-04 11:54:32,297] Trial 490 finished with value: 0.9618554461006263 and parameters: {'max_depth': 35, 'min_samples_split': 2, 'min_samples_leaf': 6, 'max_features': 'log2', 'criterion': 'friedman_mse', 'splitter': 'random'}. Best is trial 458 with value: 0.430928156546456.
[I 2024-12-04 11:54:32,599] Trial 498 finished with value: 0.9625697643485591 and parameters: {'max_depth': 28, 'min_samples_split': 16, 'min_samples_leaf': 6, 'max_features': 'log2', 'criterion': 'absolute_error', 'splitter': 'random'}. Best is trial 458 with value: 0.430928156546456.
[I 2024-12-04 11:54:32,931] Trial 493 finished with value: 0.5659600314789553 and parameters: {'max_depth': 30, 'min_samples_split': 5, 'min_samples_leaf': 2, 'max_features': 'sqrt', 'criterion': 'squared_error', 'splitter': 'best'}. Best is trial 458 with value: 0.430928156546456.
[I 2024-12-04 11:54:33,078] Trial 491 finished with value: 0.6994009702832918 and parameters: {'max_depth': 24, 'min_samples_split': 20, 'min_samples_leaf': 5, 'max_features': 'sqrt', 'criterion': 'squared_error', 'splitter': 'best'}. Best is trial 458 with value: 0.430928156546456.
[I 2024-12-04 11:54:33,535] Trial 495 finished with value: 0.6675038697554831 and parameters: {'max_depth': 12, 'min_samples_split': 20, 'min_samples_leaf': 1, 'max_features': 'sqrt', 'criterion': 'squared_error', 'splitter': 'best'}. Best is trial 458 with value: 0.430928156546456.
[I 2024-12-04 11:54:33,642] Trial 483 finished with value: 0.998127234894583 and parameters: {'max_depth': 27, 'min_samples_split': 11, 'min_samples_leaf': 8, 'max_features': 'log2', 'criterion': 'friedman_mse', 'splitter': 'random'}. Best is trial 458 with value: 0.430928156546456.
[I 2024-12-04 11:54:33,753] Trial 499 finished with value: 0.49997941217750785 and parameters: {'max_depth': 34, 'min_samples_split': 14, 'min_samples_leaf': 1, 'max_features': 'sqrt', 'criterion': 'friedman_mse', 'splitter': 'best'}. Best is trial 458 with value: 0.430928156546456.
[I 2024-12-04 11:54:33,759] Trial 485 finished with value: 0.5432158552633877 and parameters: {'max_depth': 35, 'min_samples_split': 2, 'min_samples_leaf': 1, 'max_features': 'sqrt', 'criterion': 'absolute_error', 'splitter': 'best'}. Best is trial 458 with value: 0.430928156546456.
[I 2024-12-04 11:54:34,150] Trial 479 finished with value: 0.5028348840852795 and parameters: {'max_depth': 34, 'min_samples_split': 12, 'min_samples_leaf': 1, 'max_features': 'sqrt', 'criterion': 'friedman_mse', 'splitter': 'best'}. Best is trial 458 with value: 0.430928156546456.
[I 2024-12-04 11:54:34,476] Trial 497 finished with value: 0.6013237460643723 and parameters: {'max_depth': 34, 'min_samples_split': 2, 'min_samples_leaf': 3, 'max_features': 'sqrt', 'criterion': 'squared_error', 'splitter': 'best'}. Best is trial 458 with value: 0.430928156546456.
[I 2024-12-04 11:54:34,683] Trial 504 finished with value: 0.584300197786044 and parameters: {'max_depth': 35, 'min_samples_split': 16, 'min_samples_leaf': 3, 'max_features': 'sqrt', 'criterion': 'friedman_mse', 'splitter': 'best'}. Best is trial 458 with value: 0.430928156546456.
[I 2024-12-04 11:54:34,733] Trial 487 finished with value: 0.506419555163107 and parameters: {'max_depth': 33, 'min_samples_split': 5, 'min_samples_leaf': 1, 'max_features': 'sqrt', 'criterion': 'friedman_mse', 'splitter': 'best'}. Best is trial 458 with value: 0.430928156546456.
[I 2024-12-04 11:54:34,910] Trial 496 finished with value: 0.6013237460643723 and parameters: {'max_depth': 35, 'min_samples_split': 3, 'min_samples_leaf': 3, 'max_features': 'sqrt', 'criterion': 'squared_error', 'splitter': 'best'}. Best is trial 458 with value: 0.430928156546456.
[I 2024-12-04 11:54:34,912] Trial 481 finished with value: 0.45634040793959746 and parameters: {'max_depth': 35, 'min_samples_split': 3, 'min_samples_leaf': 1, 'max_features': 'sqrt', 'criterion': 'squared_error', 'splitter': 'best'}. Best is trial 458 with value: 0.430928156546456.
[I 2024-12-04 11:54:35,421] Trial 503 finished with value: 0.492644424246246 and parameters: {'max_depth': 33, 'min_samples_split': 2, 'min_samples_leaf': 1, 'max_features': 'sqrt', 'criterion': 'squared_error', 'splitter': 'best'}. Best is trial 458 with value: 0.430928156546456.
[I 2024-12-04 11:54:36,619] Trial 489 finished with value: 0.560733148846327 and parameters: {'max_depth': 28, 'min_samples_split': 2, 'min_samples_leaf': 1, 'max_features': 'sqrt', 'criterion': 'friedman_mse', 'splitter': 'best'}. Best is trial 458 with value: 0.430928156546456.
[I 2024-12-04 11:54:36,668] Trial 501 finished with value: 0.49648306955196436 and parameters: {'max_depth': 35, 'min_samples_split': 6, 'min_samples_leaf': 1, 'max_features': 'sqrt', 'criterion': 'squared_error', 'splitter': 'best'}. Best is trial 458 with value: 0.430928156546456.
[I 2024-12-04 11:54:37,011] Trial 494 finished with value: 0.5907950839883639 and parameters: {'max_depth': 25, 'min_samples_split': 2, 'min_samples_leaf': 3, 'max_features': 'sqrt', 'criterion': 'absolute_error', 'splitter': 'best'}. Best is trial 458 with value: 0.430928156546456.
[I 2024-12-04 11:54:38,141] Trial 500 finished with value: 0.483263059820054 and parameters: {'max_depth': 35, 'min_samples_split': 5, 'min_samples_leaf': 1, 'max_features': 'sqrt', 'criterion': 'squared_error', 'splitter': 'best'}. Best is trial 458 with value: 0.430928156546456.
[I 2024-12-04 11:54:38,524] Trial 510 finished with value: 0.4399442512678781 and parameters: {'max_depth': 35, 'min_samples_split': 14, 'min_samples_leaf': 1, 'max_features': 'sqrt', 'criterion': 'friedman_mse', 'splitter': 'best'}. Best is trial 458 with value: 0.430928156546456.
[I 2024-12-04 11:54:38,525] Trial 513 finished with value: 0.4888124090738055 and parameters: {'max_depth': 30, 'min_samples_split': 3, 'min_samples_leaf': 1, 'max_features': 'sqrt', 'criterion': 'friedman_mse', 'splitter': 'best'}. Best is trial 458 with value: 0.430928156546456.
[I 2024-12-04 11:54:38,530] Trial 506 finished with value: 0.5170399151403982 and parameters: {'max_depth': 34, 'min_samples_split': 2, 'min_samples_leaf': 1, 'max_features': 'sqrt', 'criterion': 'squared_error', 'splitter': 'best'}. Best is trial 458 with value: 0.430928156546456.
[I 2024-12-04 11:54:39,026] Trial 512 finished with value: 0.5305622884942148 and parameters: {'max_depth': 30, 'min_samples_split': 7, 'min_samples_leaf': 1, 'max_features': 'log2', 'criterion': 'squared_error', 'splitter': 'best'}. Best is trial 458 with value: 0.430928156546456.
[I 2024-12-04 11:54:39,321] Trial 502 finished with value: 0.49087984857266276 and parameters: {'max_depth': 29, 'min_samples_split': 5, 'min_samples_leaf': 1, 'max_features': 'sqrt', 'criterion': 'squared_error', 'splitter': 'best'}. Best is trial 458 with value: 0.430928156546456.
[I 2024-12-04 11:54:39,761] Trial 507 finished with value: 0.8625470286457716 and parameters: {'max_depth': 33, 'min_samples_split': 15, 'min_samples_leaf': 2, 'max_features': 'log2', 'criterion': 'absolute_error', 'splitter': 'best'}. Best is trial 458 with value: 0.430928156546456.
[I 2024-12-04 11:54:40,643] Trial 505 finished with value: 0.5810814934349687 and parameters: {'max_depth': 29, 'min_samples_split': 5, 'min_samples_leaf': 2, 'max_features': 'sqrt', 'criterion': 'squared_error', 'splitter': 'best'}. Best is trial 458 with value: 0.430928156546456.
[I 2024-12-04 11:54:40,871] Trial 514 finished with value: 0.5345817934142266 and parameters: {'max_depth': 35, 'min_samples_split': 2, 'min_samples_leaf': 2, 'max_features': 'sqrt', 'criterion': 'squared_error', 'splitter': 'best'}. Best is trial 458 with value: 0.430928156546456.
[I 2024-12-04 11:54:41,761] Trial 509 finished with value: 0.9629863742364516 and parameters: {'max_depth': 25, 'min_samples_split': 9, 'min_samples_leaf': 4, 'max_features': 'log2', 'criterion': 'absolute_error', 'splitter': 'random'}. Best is trial 458 with value: 0.430928156546456.
[I 2024-12-04 11:54:41,899] Trial 508 finished with value: 0.6014044554271846 and parameters: {'max_depth': 30, 'min_samples_split': 3, 'min_samples_leaf': 1, 'max_features': 'sqrt', 'criterion': 'squared_error', 'splitter': 'random'}. Best is trial 458 with value: 0.430928156546456.
[I 2024-12-04 11:54:41,944] Trial 518 finished with value: 0.9982171095081254 and parameters: {'max_depth': 14, 'min_samples_split': 18, 'min_samples_leaf': 7, 'max_features': 'log2', 'criterion': 'friedman_mse', 'splitter': 'best'}. Best is trial 458 with value: 0.430928156546456.
[I 2024-12-04 11:54:42,258] Trial 511 finished with value: 0.584300197786044 and parameters: {'max_depth': 34, 'min_samples_split': 12, 'min_samples_leaf': 3, 'max_features': 'sqrt', 'criterion': 'friedman_mse', 'splitter': 'best'}. Best is trial 458 with value: 0.430928156546456.
[I 2024-12-04 11:54:42,793] Trial 520 finished with value: 0.9625068790481612 and parameters: {'max_depth': 17, 'min_samples_split': 19, 'min_samples_leaf': 5, 'max_features': 'log2', 'criterion': 'friedman_mse', 'splitter': 'random'}. Best is trial 458 with value: 0.430928156546456.
[I 2024-12-04 11:54:43,030] Trial 521 finished with value: 0.49997941217750785 and parameters: {'max_depth': 34, 'min_samples_split': 14, 'min_samples_leaf': 1, 'max_features': 'sqrt', 'criterion': 'friedman_mse', 'splitter': 'best'}. Best is trial 458 with value: 0.430928156546456.
[I 2024-12-04 11:54:43,280] Trial 519 finished with value: 0.483263059820054 and parameters: {'max_depth': 35, 'min_samples_split': 5, 'min_samples_leaf': 1, 'max_features': 'sqrt', 'criterion': 'friedman_mse', 'splitter': 'best'}. Best is trial 458 with value: 0.430928156546456.
[I 2024-12-04 11:54:43,364] Trial 524 finished with value: 0.9982171095081254 and parameters: {'max_depth': 21, 'min_samples_split': 18, 'min_samples_leaf': 5, 'max_features': 'log2', 'criterion': 'squared_error', 'splitter': 'best'}. Best is trial 458 with value: 0.430928156546456.
[I 2024-12-04 11:54:43,651] Trial 531 finished with value: 0.47495142754566344 and parameters: {'max_depth': 35, 'min_samples_split': 11, 'min_samples_leaf': 1, 'max_features': 'sqrt', 'criterion': 'friedman_mse', 'splitter': 'best'}. Best is trial 458 with value: 0.430928156546456.
[I 2024-12-04 11:54:44,314] Trial 530 finished with value: 0.430928156546456 and parameters: {'max_depth': 35, 'min_samples_split': 13, 'min_samples_leaf': 1, 'max_features': 'sqrt', 'criterion': 'friedman_mse', 'splitter': 'best'}. Best is trial 458 with value: 0.430928156546456.
[I 2024-12-04 11:54:44,370] Trial 523 finished with value: 0.43250115503666103 and parameters: {'max_depth': 34, 'min_samples_split': 3, 'min_samples_leaf': 1, 'max_features': 'sqrt', 'criterion': 'friedman_mse', 'splitter': 'best'}. Best is trial 458 with value: 0.430928156546456.
[I 2024-12-04 11:54:44,602] Trial 525 finished with value: 0.998127234894583 and parameters: {'max_depth': 34, 'min_samples_split': 19, 'min_samples_leaf': 9, 'max_features': 'log2', 'criterion': 'friedman_mse', 'splitter': 'random'}. Best is trial 458 with value: 0.430928156546456.
[I 2024-12-04 11:54:46,001] Trial 517 finished with value: 0.4351924125434438 and parameters: {'max_depth': 32, 'min_samples_split': 16, 'min_samples_leaf': 1, 'max_features': 'sqrt', 'criterion': 'friedman_mse', 'splitter': 'best'}. Best is trial 458 with value: 0.430928156546456.
[I 2024-12-04 11:54:46,500] Trial 516 finished with value: 0.7844362007659383 and parameters: {'max_depth': 24, 'min_samples_split': 9, 'min_samples_leaf': 7, 'max_features': 'sqrt', 'criterion': 'absolute_error', 'splitter': 'best'}. Best is trial 458 with value: 0.430928156546456.
[I 2024-12-04 11:54:46,763] Trial 527 finished with value: 0.5547812815639669 and parameters: {'max_depth': 31, 'min_samples_split': 16, 'min_samples_leaf': 1, 'max_features': 'sqrt', 'criterion': 'friedman_mse', 'splitter': 'best'}. Best is trial 458 with value: 0.430928156546456.
[I 2024-12-04 11:54:47,535] Trial 526 finished with value: 0.4399442512678781 and parameters: {'max_depth': 35, 'min_samples_split': 14, 'min_samples_leaf': 1, 'max_features': 'sqrt', 'criterion': 'friedman_mse', 'splitter': 'best'}. Best is trial 458 with value: 0.430928156546456.
[I 2024-12-04 11:54:48,094] Trial 533 finished with value: 0.5666521790664091 and parameters: {'max_depth': 25, 'min_samples_split': 19, 'min_samples_leaf': 2, 'max_features': 'sqrt', 'criterion': 'friedman_mse', 'splitter': 'best'}. Best is trial 458 with value: 0.430928156546456.
[I 2024-12-04 11:54:48,639] Trial 522 finished with value: 0.5243141632358264 and parameters: {'max_depth': 33, 'min_samples_split': 16, 'min_samples_leaf': 1, 'max_features': 'sqrt', 'criterion': 'friedman_mse', 'splitter': 'best'}. Best is trial 458 with value: 0.430928156546456.
[I 2024-12-04 11:54:49,026] Trial 535 finished with value: 0.4950101456568504 and parameters: {'max_depth': 34, 'min_samples_split': 15, 'min_samples_leaf': 1, 'max_features': 'sqrt', 'criterion': 'friedman_mse', 'splitter': 'best'}. Best is trial 458 with value: 0.430928156546456.
[I 2024-12-04 11:54:49,032] Trial 537 finished with value: 0.5043817875504355 and parameters: {'max_depth': 31, 'min_samples_split': 19, 'min_samples_leaf': 1, 'max_features': 'sqrt', 'criterion': 'friedman_mse', 'splitter': 'best'}. Best is trial 458 with value: 0.430928156546456.
[I 2024-12-04 11:54:49,438] Trial 515 finished with value: 0.622946119078201 and parameters: {'max_depth': 25, 'min_samples_split': 13, 'min_samples_leaf': 1, 'max_features': 'sqrt', 'criterion': 'friedman_mse', 'splitter': 'best'}. Best is trial 458 with value: 0.430928156546456.
[I 2024-12-04 11:54:49,460] Trial 528 finished with value: 0.5641364352696134 and parameters: {'max_depth': 34, 'min_samples_split': 16, 'min_samples_leaf': 2, 'max_features': 'sqrt', 'criterion': 'friedman_mse', 'splitter': 'best'}. Best is trial 458 with value: 0.430928156546456.
[I 2024-12-04 11:54:49,498] Trial 536 finished with value: 0.584300197786044 and parameters: {'max_depth': 33, 'min_samples_split': 15, 'min_samples_leaf': 3, 'max_features': 'sqrt', 'criterion': 'squared_error', 'splitter': 'best'}. Best is trial 458 with value: 0.430928156546456.
[I 2024-12-04 11:54:49,738] Trial 538 finished with value: 0.5608187615253875 and parameters: {'max_depth': 33, 'min_samples_split': 16, 'min_samples_leaf': 3, 'max_features': 'sqrt', 'criterion': 'absolute_error', 'splitter': 'best'}. Best is trial 458 with value: 0.430928156546456.
[I 2024-12-04 11:54:49,739] Trial 543 finished with value: 0.5028340388552847 and parameters: {'max_depth': 35, 'min_samples_split': 15, 'min_samples_leaf': 2, 'max_features': 'sqrt', 'criterion': 'friedman_mse', 'splitter': 'best'}. Best is trial 458 with value: 0.430928156546456.
[I 2024-12-04 11:54:50,141] Trial 542 finished with value: 0.8705670964491867 and parameters: {'max_depth': 12, 'min_samples_split': 19, 'min_samples_leaf': 1, 'max_features': 'sqrt', 'criterion': 'absolute_error', 'splitter': 'random'}. Best is trial 458 with value: 0.430928156546456.
[I 2024-12-04 11:54:50,668] Trial 534 finished with value: 0.5596096322964931 and parameters: {'max_depth': 34, 'min_samples_split': 18, 'min_samples_leaf': 1, 'max_features': 'sqrt', 'criterion': 'friedman_mse', 'splitter': 'best'}. Best is trial 458 with value: 0.430928156546456.
