[I 2024-12-04 12:11:03,076] Trial 1222 finished with value: 0.29833224295459404 and parameters: {'n_estimators': 522, 'max_depth': 45, 'min_samples_split': 3, 'min_samples_leaf': 1, 'max_features': 'sqrt', 'bootstrap': False, 'criterion': 'squared_error'}. Best is trial 341 with value: 0.2909369124469028.
[I 2024-12-04 12:11:03,309] Trial 1227 finished with value: 0.3111030434297064 and parameters: {'n_estimators': 595, 'max_depth': 41, 'min_samples_split': 2, 'min_samples_leaf': 1, 'max_features': 'sqrt', 'bootstrap': False, 'criterion': 'squared_error'}. Best is trial 341 with value: 0.2909369124469028.
[I 2024-12-04 12:11:03,326] Trial 1205 finished with value: 0.3322967154878409 and parameters: {'n_estimators': 924, 'max_depth': 42, 'min_samples_split': 9, 'min_samples_leaf': 1, 'max_features': None, 'bootstrap': True, 'criterion': 'squared_error'}. Best is trial 341 with value: 0.2909369124469028.
[I 2024-12-04 12:11:03,579] Trial 1234 finished with value: 0.2928463659626629 and parameters: {'n_estimators': 413, 'max_depth': 49, 'min_samples_split': 3, 'min_samples_leaf': 1, 'max_features': 'sqrt', 'bootstrap': False, 'criterion': 'squared_error'}. Best is trial 341 with value: 0.2909369124469028.
[I 2024-12-04 12:11:03,676] Trial 1228 finished with value: 0.2940431400295529 and parameters: {'n_estimators': 563, 'max_depth': 50, 'min_samples_split': 3, 'min_samples_leaf': 1, 'max_features': 'sqrt', 'bootstrap': False, 'criterion': 'squared_error'}. Best is trial 341 with value: 0.2909369124469028.
[I 2024-12-04 12:11:03,870] Trial 1140 finished with value: 0.450450176996906 and parameters: {'n_estimators': 859, 'max_depth': 40, 'min_samples_split': 12, 'min_samples_leaf': 4, 'max_features': None, 'bootstrap': False, 'criterion': 'absolute_error'}. Best is trial 341 with value: 0.2909369124469028.
[I 2024-12-04 12:11:05,809] Trial 1229 finished with value: 0.30565160149326553 and parameters: {'n_estimators': 577, 'max_depth': 43, 'min_samples_split': 2, 'min_samples_leaf': 1, 'max_features': 'sqrt', 'bootstrap': False, 'criterion': 'squared_error'}. Best is trial 341 with value: 0.2909369124469028.
[I 2024-12-04 12:11:05,913] Trial 1233 finished with value: 0.3004854863252311 and parameters: {'n_estimators': 545, 'max_depth': 50, 'min_samples_split': 4, 'min_samples_leaf': 1, 'max_features': 'sqrt', 'bootstrap': False, 'criterion': 'squared_error'}. Best is trial 341 with value: 0.2909369124469028.
[I 2024-12-04 12:11:06,018] Trial 1231 finished with value: 0.44588667605079374 and parameters: {'n_estimators': 539, 'max_depth': 39, 'min_samples_split': 3, 'min_samples_leaf': 2, 'max_features': 'sqrt', 'bootstrap': False, 'criterion': 'squared_error'}. Best is trial 341 with value: 0.2909369124469028.
[I 2024-12-04 12:11:06,381] Trial 1235 finished with value: 0.45881392074625066 and parameters: {'n_estimators': 361, 'max_depth': 32, 'min_samples_split': 3, 'min_samples_leaf': 2, 'max_features': 'sqrt', 'bootstrap': False, 'criterion': 'squared_error'}. Best is trial 341 with value: 0.2909369124469028.
[I 2024-12-04 12:11:06,384] Trial 1226 finished with value: 0.2967266664481367 and parameters: {'n_estimators': 645, 'max_depth': 46, 'min_samples_split': 3, 'min_samples_leaf': 1, 'max_features': 'sqrt', 'bootstrap': False, 'criterion': 'squared_error'}. Best is trial 341 with value: 0.2909369124469028.
[I 2024-12-04 12:11:07,673] Trial 1211 finished with value: 0.5670292210491671 and parameters: {'n_estimators': 858, 'max_depth': 18, 'min_samples_split': 50, 'min_samples_leaf': 2, 'max_features': 'sqrt', 'bootstrap': False, 'criterion': 'absolute_error'}. Best is trial 341 with value: 0.2909369124469028.
[I 2024-12-04 12:11:08,039] Trial 1240 finished with value: 0.4440569916194406 and parameters: {'n_estimators': 409, 'max_depth': 41, 'min_samples_split': 2, 'min_samples_leaf': 2, 'max_features': 'sqrt', 'bootstrap': False, 'criterion': 'squared_error'}. Best is trial 341 with value: 0.2909369124469028.
[I 2024-12-04 12:11:08,111] Trial 1232 finished with value: 0.43460380223139766 and parameters: {'n_estimators': 511, 'max_depth': 41, 'min_samples_split': 4, 'min_samples_leaf': 1, 'max_features': 'log2', 'bootstrap': False, 'criterion': 'squared_error'}. Best is trial 341 with value: 0.2909369124469028.
[I 2024-12-04 12:11:08,683] Trial 1237 finished with value: 0.9563844800432627 and parameters: {'n_estimators': 557, 'max_depth': 13, 'min_samples_split': 4, 'min_samples_leaf': 13, 'max_features': 'log2', 'bootstrap': False, 'criterion': 'absolute_error'}. Best is trial 341 with value: 0.2909369124469028.
[I 2024-12-04 12:11:09,007] Trial 1242 finished with value: 0.32278045066938615 and parameters: {'n_estimators': 472, 'max_depth': 48, 'min_samples_split': 9, 'min_samples_leaf': 1, 'max_features': 'sqrt', 'bootstrap': False, 'criterion': 'squared_error'}. Best is trial 341 with value: 0.2909369124469028.
[I 2024-12-04 12:11:09,061] Trial 1236 finished with value: 0.29431317666437873 and parameters: {'n_estimators': 487, 'max_depth': 48, 'min_samples_split': 3, 'min_samples_leaf': 1, 'max_features': 'sqrt', 'bootstrap': False, 'criterion': 'squared_error'}. Best is trial 341 with value: 0.2909369124469028.
[I 2024-12-04 12:11:09,737] Trial 1241 finished with value: 0.4430342237131597 and parameters: {'n_estimators': 416, 'max_depth': 43, 'min_samples_split': 2, 'min_samples_leaf': 2, 'max_features': 'sqrt', 'bootstrap': False, 'criterion': 'squared_error'}. Best is trial 341 with value: 0.2909369124469028.
[I 2024-12-04 12:11:10,457] Trial 1221 finished with value: 0.31328413233173374 and parameters: {'n_estimators': 423, 'max_depth': 49, 'min_samples_split': 4, 'min_samples_leaf': 1, 'max_features': 'sqrt', 'bootstrap': False, 'criterion': 'absolute_error'}. Best is trial 341 with value: 0.2909369124469028.
[I 2024-12-04 12:11:12,413] Trial 1245 finished with value: 0.3301371802060865 and parameters: {'n_estimators': 446, 'max_depth': 38, 'min_samples_split': 5, 'min_samples_leaf': 1, 'max_features': 'sqrt', 'bootstrap': False, 'criterion': 'squared_error'}. Best is trial 341 with value: 0.2909369124469028.
[I 2024-12-04 12:11:14,829] Trial 1239 finished with value: 0.2983015335688095 and parameters: {'n_estimators': 522, 'max_depth': 50, 'min_samples_split': 2, 'min_samples_leaf': 1, 'max_features': 'sqrt', 'bootstrap': False, 'criterion': 'squared_error'}. Best is trial 341 with value: 0.2909369124469028.
[I 2024-12-04 12:11:15,629] Trial 1243 finished with value: 0.3076032734485185 and parameters: {'n_estimators': 849, 'max_depth': 48, 'min_samples_split': 5, 'min_samples_leaf': 1, 'max_features': 'sqrt', 'bootstrap': False, 'criterion': 'squared_error'}. Best is trial 341 with value: 0.2909369124469028.
[I 2024-12-04 12:11:16,999] Trial 1224 finished with value: 0.5081939730431463 and parameters: {'n_estimators': 587, 'max_depth': 19, 'min_samples_split': 14, 'min_samples_leaf': 1, 'max_features': 'sqrt', 'bootstrap': False, 'criterion': 'absolute_error'}. Best is trial 341 with value: 0.2909369124469028.
[I 2024-12-04 12:11:18,664] Trial 1247 finished with value: 0.29421708660268375 and parameters: {'n_estimators': 572, 'max_depth': 50, 'min_samples_split': 3, 'min_samples_leaf': 1, 'max_features': 'sqrt', 'bootstrap': False, 'criterion': 'squared_error'}. Best is trial 341 with value: 0.2909369124469028.
[I 2024-12-04 12:11:18,688] Trial 1244 finished with value: 0.6233713879159167 and parameters: {'n_estimators': 284, 'max_depth': 42, 'min_samples_split': 26, 'min_samples_leaf': 5, 'max_features': 'sqrt', 'bootstrap': False, 'criterion': 'absolute_error'}. Best is trial 341 with value: 0.2909369124469028.
[I 2024-12-04 12:11:18,822] Trial 1252 finished with value: 0.29992285621594317 and parameters: {'n_estimators': 481, 'max_depth': 50, 'min_samples_split': 4, 'min_samples_leaf': 1, 'max_features': 'sqrt', 'bootstrap': False, 'criterion': 'squared_error'}. Best is trial 341 with value: 0.2909369124469028.
[I 2024-12-04 12:11:19,306] Trial 1249 finished with value: 0.37717913399960057 and parameters: {'n_estimators': 681, 'max_depth': 50, 'min_samples_split': 3, 'min_samples_leaf': 1, 'max_features': 'log2', 'bootstrap': False, 'criterion': 'squared_error'}. Best is trial 341 with value: 0.2909369124469028.
[I 2024-12-04 12:11:19,755] Trial 1254 finished with value: 0.30342865943953534 and parameters: {'n_estimators': 378, 'max_depth': 50, 'min_samples_split': 5, 'min_samples_leaf': 1, 'max_features': 'sqrt', 'bootstrap': False, 'criterion': 'squared_error'}. Best is trial 341 with value: 0.2909369124469028.
[I 2024-12-04 12:11:21,080] Trial 1253 finished with value: 0.31518763107203285 and parameters: {'n_estimators': 409, 'max_depth': 50, 'min_samples_split': 8, 'min_samples_leaf': 1, 'max_features': 'sqrt', 'bootstrap': False, 'criterion': 'squared_error'}. Best is trial 341 with value: 0.2909369124469028.
[I 2024-12-04 12:11:22,768] Trial 1238 finished with value: 0.471473711892355 and parameters: {'n_estimators': 316, 'max_depth': 26, 'min_samples_split': 6, 'min_samples_leaf': 8, 'max_features': None, 'bootstrap': True, 'criterion': 'absolute_error'}. Best is trial 341 with value: 0.2909369124469028.
[I 2024-12-04 12:11:23,247] Trial 1256 finished with value: 0.8510219915658237 and parameters: {'n_estimators': 495, 'max_depth': 7, 'min_samples_split': 2, 'min_samples_leaf': 2, 'max_features': 'log2', 'bootstrap': False, 'criterion': 'squared_error'}. Best is trial 341 with value: 0.2909369124469028.
[I 2024-12-04 12:11:23,987] Trial 1248 finished with value: 0.4424101332803179 and parameters: {'n_estimators': 526, 'max_depth': 48, 'min_samples_split': 4, 'min_samples_leaf': 2, 'max_features': 'sqrt', 'bootstrap': False, 'criterion': 'squared_error'}. Best is trial 341 with value: 0.2909369124469028.
[I 2024-12-04 12:11:24,335] Trial 1261 finished with value: 0.36437260529429094 and parameters: {'n_estimators': 235, 'max_depth': 29, 'min_samples_split': 2, 'min_samples_leaf': 1, 'max_features': 'sqrt', 'bootstrap': False, 'criterion': 'squared_error'}. Best is trial 341 with value: 0.2909369124469028.
[I 2024-12-04 12:11:24,336] Trial 1250 finished with value: 0.7157284279707833 and parameters: {'n_estimators': 156, 'max_depth': 43, 'min_samples_split': 2, 'min_samples_leaf': 2, 'max_features': 'log2', 'bootstrap': False, 'criterion': 'absolute_error'}. Best is trial 341 with value: 0.2909369124469028.
[I 2024-12-04 12:11:25,746] Trial 1246 finished with value: 0.3364566954880718 and parameters: {'n_estimators': 630, 'max_depth': 44, 'min_samples_split': 5, 'min_samples_leaf': 1, 'max_features': 'sqrt', 'bootstrap': True, 'criterion': 'squared_error'}. Best is trial 341 with value: 0.2909369124469028.
[I 2024-12-04 12:11:25,747] Trial 1257 finished with value: 0.29875621036306765 and parameters: {'n_estimators': 430, 'max_depth': 50, 'min_samples_split': 2, 'min_samples_leaf': 1, 'max_features': 'sqrt', 'bootstrap': False, 'criterion': 'squared_error'}. Best is trial 341 with value: 0.2909369124469028.
[I 2024-12-04 12:11:27,525] Trial 1251 finished with value: 0.38614229766950486 and parameters: {'n_estimators': 763, 'max_depth': 50, 'min_samples_split': 4, 'min_samples_leaf': 3, 'max_features': None, 'bootstrap': False, 'criterion': 'squared_error'}. Best is trial 341 with value: 0.2909369124469028.
[I 2024-12-04 12:11:31,474] Trial 1260 finished with value: 0.2987915133091981 and parameters: {'n_estimators': 789, 'max_depth': 50, 'min_samples_split': 2, 'min_samples_leaf': 1, 'max_features': 'sqrt', 'bootstrap': False, 'criterion': 'squared_error'}. Best is trial 341 with value: 0.2909369124469028.
[I 2024-12-04 12:11:31,753] Trial 1263 finished with value: 0.8057981156821187 and parameters: {'n_estimators': 453, 'max_depth': 39, 'min_samples_split': 4, 'min_samples_leaf': 10, 'max_features': 'sqrt', 'bootstrap': False, 'criterion': 'absolute_error'}. Best is trial 341 with value: 0.2909369124469028.
[I 2024-12-04 12:11:32,048] Trial 1273 finished with value: 0.3139847375428834 and parameters: {'n_estimators': 365, 'max_depth': 40, 'min_samples_split': 4, 'min_samples_leaf': 1, 'max_features': 'sqrt', 'bootstrap': False, 'criterion': 'squared_error'}. Best is trial 341 with value: 0.2909369124469028.
[I 2024-12-04 12:11:32,462] Trial 1268 finished with value: 0.4413913497736658 and parameters: {'n_estimators': 384, 'max_depth': 50, 'min_samples_split': 3, 'min_samples_leaf': 2, 'max_features': 'sqrt', 'bootstrap': False, 'criterion': 'squared_error'}. Best is trial 341 with value: 0.2909369124469028.
[I 2024-12-04 12:11:32,976] Trial 1262 finished with value: 0.853629077672403 and parameters: {'n_estimators': 671, 'max_depth': 45, 'min_samples_split': 2, 'min_samples_leaf': 14, 'max_features': 'sqrt', 'bootstrap': False, 'criterion': 'absolute_error'}. Best is trial 341 with value: 0.2909369124469028.
[I 2024-12-04 12:11:34,251] Trial 1258 finished with value: 0.5381622889153447 and parameters: {'n_estimators': 432, 'max_depth': 6, 'min_samples_split': 2, 'min_samples_leaf': 12, 'max_features': None, 'bootstrap': False, 'criterion': 'absolute_error'}. Best is trial 341 with value: 0.2909369124469028.
[I 2024-12-04 12:11:34,413] Trial 1210 finished with value: 0.4622767515125063 and parameters: {'n_estimators': 998, 'max_depth': 6, 'min_samples_split': 3, 'min_samples_leaf': 4, 'max_features': None, 'bootstrap': True, 'criterion': 'absolute_error'}. Best is trial 341 with value: 0.2909369124469028.
[I 2024-12-04 12:11:34,536] Trial 1264 finished with value: 0.3002190213753413 and parameters: {'n_estimators': 378, 'max_depth': 50, 'min_samples_split': 4, 'min_samples_leaf': 1, 'max_features': 'sqrt', 'bootstrap': False, 'criterion': 'squared_error'}. Best is trial 341 with value: 0.2909369124469028.
[I 2024-12-04 12:11:35,094] Trial 1272 finished with value: 0.30663200510666955 and parameters: {'n_estimators': 223, 'max_depth': 42, 'min_samples_split': 2, 'min_samples_leaf': 1, 'max_features': 'sqrt', 'bootstrap': False, 'criterion': 'squared_error'}. Best is trial 341 with value: 0.2909369124469028.
[I 2024-12-04 12:11:35,110] Trial 1265 finished with value: 0.337285860965708 and parameters: {'n_estimators': 624, 'max_depth': 40, 'min_samples_split': 9, 'min_samples_leaf': 1, 'max_features': 'sqrt', 'bootstrap': False, 'criterion': 'squared_error'}. Best is trial 341 with value: 0.2909369124469028.
[I 2024-12-04 12:11:35,366] Trial 1259 finished with value: 0.30009771207807734 and parameters: {'n_estimators': 500, 'max_depth': 50, 'min_samples_split': 4, 'min_samples_leaf': 1, 'max_features': 'sqrt', 'bootstrap': False, 'criterion': 'squared_error'}. Best is trial 341 with value: 0.2909369124469028.
[I 2024-12-04 12:11:36,212] Trial 1276 finished with value: 0.30492684965113037 and parameters: {'n_estimators': 264, 'max_depth': 44, 'min_samples_split': 2, 'min_samples_leaf': 1, 'max_features': 'sqrt', 'bootstrap': False, 'criterion': 'squared_error'}. Best is trial 341 with value: 0.2909369124469028.
[I 2024-12-04 12:11:36,223] Trial 1271 finished with value: 0.2939505951341759 and parameters: {'n_estimators': 556, 'max_depth': 50, 'min_samples_split': 3, 'min_samples_leaf': 1, 'max_features': 'sqrt', 'bootstrap': False, 'criterion': 'squared_error'}. Best is trial 341 with value: 0.2909369124469028.
[I 2024-12-04 12:11:36,530] Trial 1266 finished with value: 0.8398553346458675 and parameters: {'n_estimators': 697, 'max_depth': 34, 'min_samples_split': 3, 'min_samples_leaf': 8, 'max_features': 'sqrt', 'bootstrap': True, 'criterion': 'absolute_error'}. Best is trial 341 with value: 0.2909369124469028.
[I 2024-12-04 12:11:36,970] Trial 1270 finished with value: 0.3161381560311736 and parameters: {'n_estimators': 711, 'max_depth': 40, 'min_samples_split': 4, 'min_samples_leaf': 1, 'max_features': 'sqrt', 'bootstrap': False, 'criterion': 'squared_error'}. Best is trial 341 with value: 0.2909369124469028.
[I 2024-12-04 12:11:37,064] Trial 1281 finished with value: 0.3061796461779963 and parameters: {'n_estimators': 296, 'max_depth': 44, 'min_samples_split': 4, 'min_samples_leaf': 1, 'max_features': 'sqrt', 'bootstrap': False, 'criterion': 'squared_error'}. Best is trial 341 with value: 0.2909369124469028.
[I 2024-12-04 12:11:37,098] Trial 1277 finished with value: 0.880192150941551 and parameters: {'n_estimators': 202, 'max_depth': 33, 'min_samples_split': 3, 'min_samples_leaf': 3, 'max_features': 'log2', 'bootstrap': True, 'criterion': 'absolute_error'}. Best is trial 341 with value: 0.2909369124469028.
[I 2024-12-04 12:11:37,297] Trial 1269 finished with value: 0.3112197548530708 and parameters: {'n_estimators': 390, 'max_depth': 41, 'min_samples_split': 2, 'min_samples_leaf': 1, 'max_features': 'sqrt', 'bootstrap': False, 'criterion': 'squared_error'}. Best is trial 341 with value: 0.2909369124469028.
[I 2024-12-04 12:11:37,541] Trial 1274 finished with value: 0.30124061735748464 and parameters: {'n_estimators': 205, 'max_depth': 42, 'min_samples_split': 3, 'min_samples_leaf': 1, 'max_features': 'sqrt', 'bootstrap': False, 'criterion': 'squared_error'}. Best is trial 341 with value: 0.2909369124469028.
[I 2024-12-04 12:11:37,601] Trial 1255 finished with value: 0.41549998128642274 and parameters: {'n_estimators': 251, 'max_depth': 22, 'min_samples_split': 42, 'min_samples_leaf': 2, 'max_features': None, 'bootstrap': True, 'criterion': 'absolute_error'}. Best is trial 341 with value: 0.2909369124469028.
[I 2024-12-04 12:11:38,048] Trial 1278 finished with value: 0.44143648218601894 and parameters: {'n_estimators': 235, 'max_depth': 49, 'min_samples_split': 3, 'min_samples_leaf': 2, 'max_features': 'sqrt', 'bootstrap': False, 'criterion': 'squared_error'}. Best is trial 341 with value: 0.2909369124469028.
[I 2024-12-04 12:11:40,647] Trial 1284 finished with value: 0.3236086655963617 and parameters: {'n_estimators': 164, 'max_depth': 44, 'min_samples_split': 9, 'min_samples_leaf': 1, 'max_features': 'sqrt', 'bootstrap': False, 'criterion': 'squared_error'}. Best is trial 341 with value: 0.2909369124469028.
[I 2024-12-04 12:11:40,652] Trial 1267 finished with value: 0.6228844260626807 and parameters: {'n_estimators': 762, 'max_depth': 44, 'min_samples_split': 4, 'min_samples_leaf': 5, 'max_features': 'sqrt', 'bootstrap': False, 'criterion': 'absolute_error'}. Best is trial 341 with value: 0.2909369124469028.
[I 2024-12-04 12:11:42,722] Trial 1288 finished with value: 0.4403866084760676 and parameters: {'n_estimators': 559, 'max_depth': 50, 'min_samples_split': 3, 'min_samples_leaf': 2, 'max_features': 'sqrt', 'bootstrap': False, 'criterion': 'squared_error'}. Best is trial 341 with value: 0.2909369124469028.
[I 2024-12-04 12:11:42,724] Trial 1283 finished with value: 0.29312383214185284 and parameters: {'n_estimators': 758, 'max_depth': 50, 'min_samples_split': 3, 'min_samples_leaf': 1, 'max_features': 'sqrt', 'bootstrap': False, 'criterion': 'squared_error'}. Best is trial 341 with value: 0.2909369124469028.
[I 2024-12-04 12:11:45,258] Trial 1279 finished with value: 0.3051092903418652 and parameters: {'n_estimators': 493, 'max_depth': 41, 'min_samples_split': 3, 'min_samples_leaf': 1, 'max_features': 'sqrt', 'bootstrap': False, 'criterion': 'squared_error'}. Best is trial 341 with value: 0.2909369124469028.
[I 2024-12-04 12:11:45,584] Trial 1287 finished with value: 0.3177522907102005 and parameters: {'n_estimators': 299, 'max_depth': 43, 'min_samples_split': 6, 'min_samples_leaf': 1, 'max_features': 'sqrt', 'bootstrap': False, 'criterion': 'squared_error'}. Best is trial 341 with value: 0.2909369124469028.
[I 2024-12-04 12:11:46,823] Trial 1286 finished with value: 0.38551778768245226 and parameters: {'n_estimators': 141, 'max_depth': 48, 'min_samples_split': 5, 'min_samples_leaf': 1, 'max_features': None, 'bootstrap': False, 'criterion': 'squared_error'}. Best is trial 341 with value: 0.2909369124469028.
[I 2024-12-04 12:11:47,557] Trial 1292 finished with value: 0.299729365969532 and parameters: {'n_estimators': 320, 'max_depth': 50, 'min_samples_split': 4, 'min_samples_leaf': 1, 'max_features': 'sqrt', 'bootstrap': False, 'criterion': 'squared_error'}. Best is trial 341 with value: 0.2909369124469028.
[I 2024-12-04 12:11:47,562] Trial 1290 finished with value: 0.4456246663542014 and parameters: {'n_estimators': 114, 'max_depth': 42, 'min_samples_split': 4, 'min_samples_leaf': 2, 'max_features': 'sqrt', 'bootstrap': False, 'criterion': 'squared_error'}. Best is trial 341 with value: 0.2909369124469028.
[I 2024-12-04 12:11:47,565] Trial 1297 finished with value: 0.34154061890802506 and parameters: {'n_estimators': 154, 'max_depth': 33, 'min_samples_split': 4, 'min_samples_leaf': 1, 'max_features': 'sqrt', 'bootstrap': False, 'criterion': 'squared_error'}. Best is trial 341 with value: 0.2909369124469028.
[I 2024-12-04 12:11:47,566] Trial 1280 finished with value: 0.44567566725606733 and parameters: {'n_estimators': 287, 'max_depth': 45, 'min_samples_split': 7, 'min_samples_leaf': 2, 'max_features': 'sqrt', 'bootstrap': False, 'criterion': 'squared_error'}. Best is trial 341 with value: 0.2909369124469028.
[I 2024-12-04 12:11:47,665] Trial 1296 finished with value: 0.4470098557996353 and parameters: {'n_estimators': 129, 'max_depth': 43, 'min_samples_split': 4, 'min_samples_leaf': 2, 'max_features': 'sqrt', 'bootstrap': False, 'criterion': 'squared_error'}. Best is trial 341 with value: 0.2909369124469028.
[I 2024-12-04 12:11:47,671] Trial 1291 finished with value: 0.30495403603058957 and parameters: {'n_estimators': 184, 'max_depth': 43, 'min_samples_split': 2, 'min_samples_leaf': 1, 'max_features': 'sqrt', 'bootstrap': False, 'criterion': 'squared_error'}. Best is trial 341 with value: 0.2909369124469028.
