[I 2024-12-04 15:18:40,656] Trial 2244 finished with value: 1.2401112324854364 and parameters: {'kernel_type': 'RBF', 'length_scale': 0.07884403507551636, 'noise_level': 0.4606153254212539, 'constant_value': 4594.63254430791, 'nu': 2.5}. Best is trial 386 with value: 0.4872991004520934.
[I 2024-12-04 15:18:41,507] Trial 2249 finished with value: 0.48830339883091656 and parameters: {'kernel_type': 'Matern', 'length_scale': 140.680114115951, 'noise_level': 0.24061692347911498, 'constant_value': 0.006215642514069708, 'nu': 0.5}. Best is trial 386 with value: 0.4872991004520934.
[I 2024-12-04 15:18:41,826] Trial 2247 finished with value: 0.48830401936546375 and parameters: {'kernel_type': 'Matern', 'length_scale': 4636.193061172908, 'noise_level': 0.10397495763761788, 'constant_value': 1675.6249309750528, 'nu': 0.5}. Best is trial 386 with value: 0.4872991004520934.
[I 2024-12-04 15:18:42,171] Trial 2245 finished with value: 0.5273054026349246 and parameters: {'kernel_type': 'Matern', 'length_scale': 508.95505110079876, 'noise_level': 0.991168978346258, 'constant_value': 474.45594552481947, 'nu': 1.5}. Best is trial 386 with value: 0.4872991004520934.
[I 2024-12-04 15:18:44,701] Trial 2262 finished with value: 0.48830346427561283 and parameters: {'kernel_type': 'Matern', 'length_scale': 75581.11318753198, 'noise_level': 0.9339187285207098, 'constant_value': 769.1953992573019, 'nu': 0.5}. Best is trial 386 with value: 0.4872991004520934.
[I 2024-12-04 15:18:44,713] Trial 2258 finished with value: 0.488303383078888 and parameters: {'kernel_type': 'Matern', 'length_scale': 121.07515321299336, 'noise_level': 0.9854911559737325, 'constant_value': 504.77416000163583, 'nu': 0.5}. Best is trial 386 with value: 0.4872991004520934.
[I 2024-12-04 15:18:45,659] Trial 2254 finished with value: 0.48830404105885633 and parameters: {'kernel_type': 'Matern', 'length_scale': 3508.978210014026, 'noise_level': 0.014987765574867763, 'constant_value': 81110.38647779821, 'nu': 0.5}. Best is trial 386 with value: 0.4872991004520934.
[I 2024-12-04 15:18:45,663] Trial 2255 finished with value: 1.261454370202633 and parameters: {'kernel_type': 'Matern', 'length_scale': 0.028109759201768177, 'noise_level': 1.2118274552158477e-07, 'constant_value': 3388.6021077192686, 'nu': 1.5}. Best is trial 386 with value: 0.4872991004520934.
[I 2024-12-04 15:18:46,180] Trial 2260 finished with value: 0.527305331937199 and parameters: {'kernel_type': 'Matern', 'length_scale': 254.2209555943088, 'noise_level': 0.006736867435688952, 'constant_value': 5615.4327506073505, 'nu': 1.5}. Best is trial 386 with value: 0.4872991004520934.
[I 2024-12-04 15:18:48,214] Trial 2266 finished with value: 1.240111232942069 and parameters: {'kernel_type': 'Matern', 'length_scale': 4475.261647843865, 'noise_level': 0.0020746670234612482, 'constant_value': 11.140751734822611, 'nu': 0.5}. Best is trial 386 with value: 0.4872991004520934.
[I 2024-12-04 15:18:48,215] Trial 2259 finished with value: 0.4883034170470135 and parameters: {'kernel_type': 'Matern', 'length_scale': 90958.84750552628, 'noise_level': 0.1826816397506577, 'constant_value': 86721.14265381072, 'nu': 0.5}. Best is trial 386 with value: 0.4872991004520934.
[I 2024-12-04 15:18:48,575] Trial 2261 finished with value: 0.48830335536177355 and parameters: {'kernel_type': 'Matern', 'length_scale': 54.92796736349045, 'noise_level': 0.8255869671316216, 'constant_value': 347.31913117100333, 'nu': 0.5}. Best is trial 386 with value: 0.4872991004520934.
[I 2024-12-04 15:18:48,946] Trial 2257 finished with value: 1.2401112325584067 and parameters: {'kernel_type': 'RBF', 'length_scale': 0.07237159833484262, 'noise_level': 6.700599069883387e-05, 'constant_value': 0.0002483498707547684, 'nu': 0.5}. Best is trial 386 with value: 0.4872991004520934.
[I 2024-12-04 15:18:50,789] Trial 2272 finished with value: 0.48830354223710504 and parameters: {'kernel_type': 'Matern', 'length_scale': 83.65256719144635, 'noise_level': 0.0011088557400297193, 'constant_value': 2652.2234725793296, 'nu': 0.5}. Best is trial 386 with value: 0.4872991004520934.
[I 2024-12-04 15:18:50,865] Trial 2256 finished with value: 0.4883034173118907 and parameters: {'kernel_type': 'Matern', 'length_scale': 40900.9858308669, 'noise_level': 0.8239445012895984, 'constant_value': 97450.91256040527, 'nu': 0.5}. Best is trial 386 with value: 0.4872991004520934.
[I 2024-12-04 15:18:50,941] Trial 2264 finished with value: 0.48830340962141533 and parameters: {'kernel_type': 'Matern', 'length_scale': 4781.666892677572, 'noise_level': 0.0003624000094997003, 'constant_value': 6239.144311773528, 'nu': 0.5}. Best is trial 386 with value: 0.4872991004520934.
[I 2024-12-04 15:18:51,218] Trial 2271 finished with value: 0.48830340392301064 and parameters: {'kernel_type': 'Matern', 'length_scale': 3121.46177621441, 'noise_level': 0.02763996363025461, 'constant_value': 53.566662787484255, 'nu': 0.5}. Best is trial 386 with value: 0.4872991004520934.
[I 2024-12-04 15:18:51,278] Trial 2269 finished with value: 1.240111232578768 and parameters: {'kernel_type': 'RBF', 'length_scale': 32568.23359032931, 'noise_level': 1.3053567917392989e-05, 'constant_value': 83.20844071612596, 'nu': 2.5}. Best is trial 386 with value: 0.4872991004520934.
[I 2024-12-04 15:18:51,513] Trial 2273 finished with value: 0.4883034174174563 and parameters: {'kernel_type': 'Matern', 'length_scale': 5737.11410616356, 'noise_level': 0.04719665883009874, 'constant_value': 1102.0454081554055, 'nu': 0.5}. Best is trial 386 with value: 0.4872991004520934.
[I 2024-12-04 15:18:51,658] Trial 2268 finished with value: 0.48830339083129354 and parameters: {'kernel_type': 'Matern', 'length_scale': 1007.3903320558994, 'noise_level': 0.9484845748474845, 'constant_value': 394.6394388039537, 'nu': 0.5}. Best is trial 386 with value: 0.4872991004520934.
[I 2024-12-04 15:18:51,913] Trial 2263 finished with value: 0.5663936123699359 and parameters: {'kernel_type': 'Matern', 'length_scale': 78899.37570070944, 'noise_level': 0.01729251950435418, 'constant_value': 85.6178510225492, 'nu': 2.5}. Best is trial 386 with value: 0.4872991004520934.
[I 2024-12-04 15:18:52,192] Trial 2270 finished with value: 1.2614547953941473 and parameters: {'kernel_type': 'Matern', 'length_scale': 2083.1618728147782, 'noise_level': 0.028821345648000634, 'constant_value': 44967.552120743894, 'nu': 0.5}. Best is trial 386 with value: 0.4872991004520934.
[I 2024-12-04 15:18:55,199] Trial 2276 finished with value: 0.4883034220404299 and parameters: {'kernel_type': 'Matern', 'length_scale': 2921.4870547067885, 'noise_level': 0.016081706853457462, 'constant_value': 8627.534601111161, 'nu': 0.5}. Best is trial 386 with value: 0.4872991004520934.
[I 2024-12-04 15:18:56,184] Trial 2267 finished with value: 1.261454797635249 and parameters: {'kernel_type': 'RBF', 'length_scale': 73337.15153224462, 'noise_level': 0.47636015719490515, 'constant_value': 70.6772849336448, 'nu': 2.5}. Best is trial 386 with value: 0.4872991004520934.
[I 2024-12-04 15:18:58,059] Trial 2279 finished with value: 0.5273054455922138 and parameters: {'kernel_type': 'Matern', 'length_scale': 4.939108322873167, 'noise_level': 0.018968636668466515, 'constant_value': 1030.713001908797, 'nu': 1.5}. Best is trial 386 with value: 0.4872991004520934.
[I 2024-12-04 15:18:58,338] Trial 2281 finished with value: 0.48830342223775614 and parameters: {'kernel_type': 'Matern', 'length_scale': 4616.748041088231, 'noise_level': 0.038696320720904766, 'constant_value': 23.313502893037775, 'nu': 0.5}. Best is trial 386 with value: 0.4872991004520934.
[I 2024-12-04 15:19:00,046] Trial 2284 finished with value: 0.4883034187752416 and parameters: {'kernel_type': 'Matern', 'length_scale': 110.08027053980001, 'noise_level': 0.0006553232178442771, 'constant_value': 14173.637130909918, 'nu': 0.5}. Best is trial 386 with value: 0.4872991004520934.
[I 2024-12-04 15:19:00,527] Trial 2277 finished with value: 0.4883034112580325 and parameters: {'kernel_type': 'Matern', 'length_scale': 2725.6077380207207, 'noise_level': 0.05153406092495371, 'constant_value': 373.2512174325669, 'nu': 0.5}. Best is trial 386 with value: 0.4872991004520934.
[I 2024-12-04 15:19:01,356] Trial 2282 finished with value: 1.2401112320587087 and parameters: {'kernel_type': 'Matern', 'length_scale': 73215.76747921, 'noise_level': 0.0008463343282252317, 'constant_value': 1.210750529821693, 'nu': 0.5}. Best is trial 386 with value: 0.4872991004520934.
[I 2024-12-04 15:19:03,055] Trial 2285 finished with value: 1.2401112323907595 and parameters: {'kernel_type': 'RBF', 'length_scale': 0.001477658286289533, 'noise_level': 7.296807407693289e-07, 'constant_value': 0.0014041137321435064, 'nu': 1.5}. Best is trial 386 with value: 0.4872991004520934.
[I 2024-12-04 15:19:03,393] Trial 2265 finished with value: 0.4883033777327122 and parameters: {'kernel_type': 'Matern', 'length_scale': 86243.76244491844, 'noise_level': 0.08997196490910994, 'constant_value': 2439.4317111748114, 'nu': 0.5}. Best is trial 386 with value: 0.4872991004520934.
[I 2024-12-04 15:19:04,116] Trial 2280 finished with value: 0.5663935711662695 and parameters: {'kernel_type': 'Matern', 'length_scale': 0.2583433641389353, 'noise_level': 5.986099678411803e-09, 'constant_value': 0.00011689182118699713, 'nu': 2.5}. Best is trial 386 with value: 0.4872991004520934.
[I 2024-12-04 15:19:04,128] Trial 2290 finished with value: 0.6443850045204171 and parameters: {'kernel_type': 'RBF', 'length_scale': 310.30531053275735, 'noise_level': 0.015432496759984983, 'constant_value': 16547.996810924316, 'nu': 0.5}. Best is trial 386 with value: 0.4872991004520934.
[I 2024-12-04 15:19:04,131] Trial 2292 finished with value: 0.48830341344497175 and parameters: {'kernel_type': 'Matern', 'length_scale': 1787.120884809728, 'noise_level': 0.7483213877861249, 'constant_value': 2256.309126419901, 'nu': 0.5}. Best is trial 386 with value: 0.4872991004520934.
[I 2024-12-04 15:19:04,688] Trial 2283 finished with value: 1.2614543702026548 and parameters: {'kernel_type': 'Matern', 'length_scale': 0.0002754645208086821, 'noise_level': 1.0274324502146796e-05, 'constant_value': 1092.499970025064, 'nu': 1.5}. Best is trial 386 with value: 0.4872991004520934.
[I 2024-12-04 15:19:06,298] Trial 2287 finished with value: 0.48830338756458924 and parameters: {'kernel_type': 'Matern', 'length_scale': 74768.05441448705, 'noise_level': 0.026184799091865094, 'constant_value': 749.097789192194, 'nu': 0.5}. Best is trial 386 with value: 0.4872991004520934.
[I 2024-12-04 15:19:06,526] Trial 2291 finished with value: 0.48830341921420767 and parameters: {'kernel_type': 'Matern', 'length_scale': 2431.8172808565414, 'noise_level': 0.8437103358990479, 'constant_value': 864.3198291060376, 'nu': 0.5}. Best is trial 386 with value: 0.4872991004520934.
[I 2024-12-04 15:19:06,810] Trial 2293 finished with value: 0.4883033097431566 and parameters: {'kernel_type': 'Matern', 'length_scale': 3.586148796369151, 'noise_level': 0.9874045779818656, 'constant_value': 944.2103376935642, 'nu': 0.5}. Best is trial 386 with value: 0.4872991004520934.
[I 2024-12-04 15:19:07,210] Trial 2274 finished with value: 0.48830341924721266 and parameters: {'kernel_type': 'Matern', 'length_scale': 2678.6226484887757, 'noise_level': 0.0689325818804518, 'constant_value': 2754.955263864981, 'nu': 0.5}. Best is trial 386 with value: 0.4872991004520934.
[I 2024-12-04 15:19:07,912] Trial 2289 finished with value: 0.4883034789371814 and parameters: {'kernel_type': 'Matern', 'length_scale': 85672.18001999236, 'noise_level': 0.9635274690519794, 'constant_value': 2273.082829828169, 'nu': 0.5}. Best is trial 386 with value: 0.4872991004520934.
[I 2024-12-04 15:19:07,920] Trial 2296 finished with value: 0.4883034182817802 and parameters: {'kernel_type': 'Matern', 'length_scale': 972.7907822172888, 'noise_level': 0.04742443181406971, 'constant_value': 79951.47465236379, 'nu': 0.5}. Best is trial 386 with value: 0.4872991004520934.
[I 2024-12-04 15:19:08,476] Trial 2275 finished with value: 0.4883031360916443 and parameters: {'kernel_type': 'Matern', 'length_scale': 9.647098557192814, 'noise_level': 0.03801681036914157, 'constant_value': 81.40662677905715, 'nu': 0.5}. Best is trial 386 with value: 0.4872991004520934.
[I 2024-12-04 15:19:08,686] Trial 2288 finished with value: 1.261454795394147 and parameters: {'kernel_type': 'Matern', 'length_scale': 9.53708959578333, 'noise_level': 0.03130137487437291, 'constant_value': 524.0380153760323, 'nu': 0.5}. Best is trial 386 with value: 0.4872991004520934.
[I 2024-12-04 15:19:09,863] Trial 2278 finished with value: 0.48830446666670774 and parameters: {'kernel_type': 'Matern', 'length_scale': 661.4988197318839, 'noise_level': 0.01750191098893307, 'constant_value': 98623.03913651872, 'nu': 0.5}. Best is trial 386 with value: 0.4872991004520934.
[I 2024-12-04 15:19:12,644] Trial 2303 finished with value: 0.488303597410078 and parameters: {'kernel_type': 'Matern', 'length_scale': 84452.65831300494, 'noise_level': 0.011412598773958523, 'constant_value': 5854.559476927384, 'nu': 0.5}. Best is trial 386 with value: 0.4872991004520934.
[I 2024-12-04 15:19:12,818] Trial 2298 finished with value: 0.6443852106033074 and parameters: {'kernel_type': 'RBF', 'length_scale': 3399.210054069095, 'noise_level': 0.0982268719685003, 'constant_value': 531.6625625201943, 'nu': 0.5}. Best is trial 386 with value: 0.4872991004520934.
[I 2024-12-04 15:19:12,954] Trial 2286 finished with value: 1.2401112324636336 and parameters: {'kernel_type': 'Matern', 'length_scale': 176.44349819198516, 'noise_level': 2.497417275267351e-08, 'constant_value': 1.5569858626071727e-07, 'nu': 1.5}. Best is trial 386 with value: 0.4872991004520934.
[I 2024-12-04 15:19:12,963] Trial 2301 finished with value: 1.2401112324498602 and parameters: {'kernel_type': 'Matern', 'length_scale': 81.49110056213524, 'noise_level': 2.2759081479498976e-06, 'constant_value': 0.05792091302454046, 'nu': 1.5}. Best is trial 386 with value: 0.4872991004520934.
[I 2024-12-04 15:19:12,971] Trial 2294 finished with value: 0.4883033894913265 and parameters: {'kernel_type': 'Matern', 'length_scale': 1481.4488294511236, 'noise_level': 0.0003524419151005925, 'constant_value': 4187.461714820648, 'nu': 0.5}. Best is trial 386 with value: 0.4872991004520934.
[I 2024-12-04 15:19:13,511] Trial 2295 finished with value: 0.4883034083282874 and parameters: {'kernel_type': 'Matern', 'length_scale': 59952.63723693304, 'noise_level': 0.012192008245545095, 'constant_value': 84078.39881842547, 'nu': 0.5}. Best is trial 386 with value: 0.4872991004520934.
[I 2024-12-04 15:19:13,713] Trial 2302 finished with value: 1.2401112327240262 and parameters: {'kernel_type': 'RBF', 'length_scale': 0.08168097340100981, 'noise_level': 1.7359648424492062e-08, 'constant_value': 0.001612251900648952, 'nu': 1.5}. Best is trial 386 with value: 0.4872991004520934.
[I 2024-12-04 15:19:13,716] Trial 2299 finished with value: 0.644385350741537 and parameters: {'kernel_type': 'RBF', 'length_scale': 17740.905050568836, 'noise_level': 0.41138658316615045, 'constant_value': 91685.21475959038, 'nu': 0.5}. Best is trial 386 with value: 0.4872991004520934.
[I 2024-12-04 15:19:15,638] Trial 2305 finished with value: 0.4883032654765845 and parameters: {'kernel_type': 'Matern', 'length_scale': 357.7614165094351, 'noise_level': 0.9720238212937218, 'constant_value': 2.1484953004738383, 'nu': 0.5}. Best is trial 386 with value: 0.4872991004520934.
[I 2024-12-04 15:19:17,565] Trial 2297 finished with value: 1.2401112325988932 and parameters: {'kernel_type': 'Matern', 'length_scale': 370.0132145395769, 'noise_level': 0.029897271367763514, 'constant_value': 0.23512488191990963, 'nu': 0.5}. Best is trial 386 with value: 0.4872991004520934.
[I 2024-12-04 15:19:18,616] Trial 2307 finished with value: 0.4883033938706521 and parameters: {'kernel_type': 'Matern', 'length_scale': 1446.5380574695523, 'noise_level': 0.12289103535822113, 'constant_value': 90941.2789520139, 'nu': 0.5}. Best is trial 386 with value: 0.4872991004520934.
[I 2024-12-04 15:19:18,781] Trial 2306 finished with value: 0.4883034415337638 and parameters: {'kernel_type': 'Matern', 'length_scale': 672.2683974432683, 'noise_level': 0.948250031330465, 'constant_value': 490.5884482571163, 'nu': 0.5}. Best is trial 386 with value: 0.4872991004520934.
[I 2024-12-04 15:19:18,946] Trial 2304 finished with value: 0.4883034236254574 and parameters: {'kernel_type': 'Matern', 'length_scale': 1388.2750014683256, 'noise_level': 0.0016195722459345, 'constant_value': 1612.6995741066794, 'nu': 0.5}. Best is trial 386 with value: 0.4872991004520934.
[I 2024-12-04 15:19:19,116] Trial 2308 finished with value: 0.48830337536847435 and parameters: {'kernel_type': 'Matern', 'length_scale': 1126.0488859143147, 'noise_level': 0.7335069949658021, 'constant_value': 4.003019594232879, 'nu': 0.5}. Best is trial 386 with value: 0.4872991004520934.
[I 2024-12-04 15:19:20,035] Trial 2300 finished with value: 1.240111232726296 and parameters: {'kernel_type': 'Matern', 'length_scale': 3890.3839109649316, 'noise_level': 0.013716893708374088, 'constant_value': 342.79179303426315, 'nu': 2.5}. Best is trial 386 with value: 0.4872991004520934.
[I 2024-12-04 15:19:20,581] Trial 2309 finished with value: 1.2401112325465282 and parameters: {'kernel_type': 'RBF', 'length_scale': 1.7159970084176104e-05, 'noise_level': 0.012214260973094667, 'constant_value': 2.556852846663162, 'nu': 2.5}. Best is trial 386 with value: 0.4872991004520934.
[I 2024-12-04 15:19:21,101] Trial 2321 finished with value: 0.48830342066150323 and parameters: {'kernel_type': 'Matern', 'length_scale': 2843.664907685671, 'noise_level': 0.041997116750019874, 'constant_value': 1210.8939659953764, 'nu': 0.5}. Best is trial 386 with value: 0.4872991004520934.
[I 2024-12-04 15:19:22,941] Trial 2311 finished with value: 0.48830302537194403 and parameters: {'kernel_type': 'Matern', 'length_scale': 4773.6229349877085, 'noise_level': 0.5772157745677498, 'constant_value': 96856.91892762417, 'nu': 0.5}. Best is trial 386 with value: 0.4872991004520934.
[I 2024-12-04 15:19:23,134] Trial 2314 finished with value: 0.4883033991178492 and parameters: {'kernel_type': 'Matern', 'length_scale': 1149.0279610367456, 'noise_level': 0.9903569505266634, 'constant_value': 719.3963935477778, 'nu': 0.5}. Best is trial 386 with value: 0.4872991004520934.
[I 2024-12-04 15:19:24,668] Trial 2312 finished with value: 0.48830340493785573 and parameters: {'kernel_type': 'Matern', 'length_scale': 2334.379687325624, 'noise_level': 0.053024013903954136, 'constant_value': 2096.8285835315587, 'nu': 0.5}. Best is trial 386 with value: 0.4872991004520934.
[I 2024-12-04 15:19:24,815] Trial 2319 finished with value: 0.4883034190081951 and parameters: {'kernel_type': 'Matern', 'length_scale': 98074.37317722965, 'noise_level': 0.424692862784975, 'constant_value': 57685.99543712374, 'nu': 0.5}. Best is trial 386 with value: 0.4872991004520934.
[I 2024-12-04 15:19:24,822] Trial 2316 finished with value: 0.48830341882676076 and parameters: {'kernel_type': 'Matern', 'length_scale': 77750.5563826806, 'noise_level': 0.01918786247906642, 'constant_value': 1946.6952254541927, 'nu': 0.5}. Best is trial 386 with value: 0.4872991004520934.
[I 2024-12-04 15:19:25,264] Trial 2320 finished with value: 1.2401112325690025 and parameters: {'kernel_type': 'RBF', 'length_scale': 37513.036693435955, 'noise_level': 3.800752343930768e-05, 'constant_value': 7.081626085411328, 'nu': 0.5}. Best is trial 386 with value: 0.4872991004520934.
[I 2024-12-04 15:19:26,002] Trial 2323 finished with value: 1.240111232500325 and parameters: {'kernel_type': 'Matern', 'length_scale': 0.0669394365009789, 'noise_level': 0.4396816113541799, 'constant_value': 2078.745653156625, 'nu': 1.5}. Best is trial 386 with value: 0.4872991004520934.
[I 2024-12-04 15:19:26,358] Trial 2310 finished with value: 1.2401112325623347 and parameters: {'kernel_type': 'Matern', 'length_scale': 94573.37271494855, 'noise_level': 0.015943527909495096, 'constant_value': 224.37784355360358, 'nu': 0.5}. Best is trial 386 with value: 0.4872991004520934.
[I 2024-12-04 15:19:26,686] Trial 2326 finished with value: 0.48830334108266327 and parameters: {'kernel_type': 'Matern', 'length_scale': 17.66315448453182, 'noise_level': 0.055408656629013765, 'constant_value': 7.898092805692061, 'nu': 0.5}. Best is trial 386 with value: 0.4872991004520934.
[I 2024-12-04 15:19:27,520] Trial 2317 finished with value: 0.48830339871098827 and parameters: {'kernel_type': 'Matern', 'length_scale': 1.2666375464701385, 'noise_level': 0.8858057446529173, 'constant_value': 25.771111852246705, 'nu': 0.5}. Best is trial 386 with value: 0.4872991004520934.
[I 2024-12-04 15:19:29,755] Trial 2328 finished with value: 0.4883034176821152 and parameters: {'kernel_type': 'Matern', 'length_scale': 1754.9600471422448, 'noise_level': 0.07237284171873164, 'constant_value': 5606.9365174320765, 'nu': 0.5}. Best is trial 386 with value: 0.4872991004520934.
[I 2024-12-04 15:19:30,007] Trial 2327 finished with value: 0.48830342501726304 and parameters: {'kernel_type': 'Matern', 'length_scale': 6140.746868611076, 'noise_level': 0.07712279188409599, 'constant_value': 81529.99287387622, 'nu': 0.5}. Best is trial 386 with value: 0.4872991004520934.
[I 2024-12-04 15:19:30,857] Trial 2325 finished with value: 1.2401112298453905 and parameters: {'kernel_type': 'Matern', 'length_scale': 3688.5185906250917, 'noise_level': 0.021689390100232596, 'constant_value': 0.7555668023834888, 'nu': 0.5}. Best is trial 386 with value: 0.4872991004520934.
[I 2024-12-04 15:19:32,613] Trial 2313 finished with value: 0.48830328714994425 and parameters: {'kernel_type': 'Matern', 'length_scale': 4.584451236132471, 'noise_level': 0.7347009354694626, 'constant_value': 13.07028482715535, 'nu': 0.5}. Best is trial 386 with value: 0.4872991004520934.
