[I 2024-12-04 15:02:58,740] Trial 825 finished with value: 0.48830344950790233 and parameters: {'kernel_type': 'Matern', 'length_scale': 47164.999085492054, 'noise_level': 0.07162338237571161, 'constant_value': 159.14868914793718, 'nu': 0.5}. Best is trial 386 with value: 0.4872991004520934.
[I 2024-12-04 15:02:59,013] Trial 830 finished with value: 0.4883034185498993 and parameters: {'kernel_type': 'Matern', 'length_scale': 4002.648499331198, 'noise_level': 0.5233053478770007, 'constant_value': 62298.963075845546, 'nu': 0.5}. Best is trial 386 with value: 0.4872991004520934.
[I 2024-12-04 15:02:59,015] Trial 810 finished with value: 1.2614543702020211 and parameters: {'kernel_type': 'Matern', 'length_scale': 0.09265210560329881, 'noise_level': 1.4278859312383773e-07, 'constant_value': 1.426791385045166, 'nu': 1.5}. Best is trial 386 with value: 0.4872991004520934.
[I 2024-12-04 15:02:59,973] Trial 821 finished with value: 0.4883034193528771 and parameters: {'kernel_type': 'Matern', 'length_scale': 5918.27882545835, 'noise_level': 0.5644914095065285, 'constant_value': 1342.9554728678208, 'nu': 0.5}. Best is trial 386 with value: 0.4872991004520934.
[I 2024-12-04 15:03:03,506] Trial 834 finished with value: 0.48830359151767 and parameters: {'kernel_type': 'Matern', 'length_scale': 12515.170592365386, 'noise_level': 0.6439540975883606, 'constant_value': 82852.12718678803, 'nu': 0.5}. Best is trial 386 with value: 0.4872991004520934.
[I 2024-12-04 15:03:03,910] Trial 829 finished with value: 0.4883034124069391 and parameters: {'kernel_type': 'Matern', 'length_scale': 108.00261081791324, 'noise_level': 0.780267353136299, 'constant_value': 10121.375326055491, 'nu': 0.5}. Best is trial 386 with value: 0.4872991004520934.
[I 2024-12-04 15:03:04,146] Trial 832 finished with value: 0.5273054034941018 and parameters: {'kernel_type': 'Matern', 'length_scale': 53.69338402933624, 'noise_level': 0.278507140188018, 'constant_value': 1336.6417278007575, 'nu': 1.5}. Best is trial 386 with value: 0.4872991004520934.
[I 2024-12-04 15:03:04,583] Trial 837 finished with value: 0.4883034169532692 and parameters: {'kernel_type': 'Matern', 'length_scale': 10409.588021513899, 'noise_level': 0.8527583637005793, 'constant_value': 50305.92349147658, 'nu': 0.5}. Best is trial 386 with value: 0.4872991004520934.
[I 2024-12-04 15:03:04,801] Trial 828 finished with value: 0.5273050625682529 and parameters: {'kernel_type': 'Matern', 'length_scale': 0.30519649057194365, 'noise_level': 1.6213224417553681e-06, 'constant_value': 2.3018179002287116e-07, 'nu': 1.5}. Best is trial 386 with value: 0.4872991004520934.
[I 2024-12-04 15:03:04,803] Trial 839 finished with value: 0.4883034097720918 and parameters: {'kernel_type': 'Matern', 'length_scale': 6467.908235926852, 'noise_level': 0.18711591693807736, 'constant_value': 1009.0976763460795, 'nu': 0.5}. Best is trial 386 with value: 0.4872991004520934.
[I 2024-12-04 15:03:05,148] Trial 835 finished with value: 0.4883034088324285 and parameters: {'kernel_type': 'Matern', 'length_scale': 5820.348302022889, 'noise_level': 0.5947075564391346, 'constant_value': 63.11883876928956, 'nu': 0.5}. Best is trial 386 with value: 0.4872991004520934.
[I 2024-12-04 15:03:06,222] Trial 838 finished with value: 0.48830341944823336 and parameters: {'kernel_type': 'Matern', 'length_scale': 699.6675627384489, 'noise_level': 0.521637207699815, 'constant_value': 3794.122998104258, 'nu': 0.5}. Best is trial 386 with value: 0.4872991004520934.
[I 2024-12-04 15:03:06,752] Trial 833 finished with value: 0.48830341798722443 and parameters: {'kernel_type': 'Matern', 'length_scale': 2211.0414383904067, 'noise_level': 0.6926560536218, 'constant_value': 8317.130852610808, 'nu': 0.5}. Best is trial 386 with value: 0.4872991004520934.
[I 2024-12-04 15:03:06,805] Trial 843 finished with value: 0.48830323203952225 and parameters: {'kernel_type': 'Matern', 'length_scale': 406.94328985585696, 'noise_level': 0.8405732903538717, 'constant_value': 8578.697676645139, 'nu': 0.5}. Best is trial 386 with value: 0.4872991004520934.
[I 2024-12-04 15:03:08,097] Trial 849 finished with value: 0.4883034188289776 and parameters: {'kernel_type': 'Matern', 'length_scale': 7540.5088583364095, 'noise_level': 0.04787913246901433, 'constant_value': 786.3157944691663, 'nu': 0.5}. Best is trial 386 with value: 0.4872991004520934.
[I 2024-12-04 15:03:08,655] Trial 840 finished with value: 0.4883034185712996 and parameters: {'kernel_type': 'Matern', 'length_scale': 144.48177354918735, 'noise_level': 0.7170255021075116, 'constant_value': 8689.45909572191, 'nu': 0.5}. Best is trial 386 with value: 0.4872991004520934.
[I 2024-12-04 15:03:09,451] Trial 831 finished with value: 0.4883034216726127 and parameters: {'kernel_type': 'Matern', 'length_scale': 510.33088421495415, 'noise_level': 0.8620469564048749, 'constant_value': 835.4908341431383, 'nu': 0.5}. Best is trial 386 with value: 0.4872991004520934.
[I 2024-12-04 15:03:09,585] Trial 844 finished with value: 0.48830341919544956 and parameters: {'kernel_type': 'Matern', 'length_scale': 3895.8055706503737, 'noise_level': 0.1350422184225479, 'constant_value': 1484.395142471238, 'nu': 0.5}. Best is trial 386 with value: 0.4872991004520934.
[I 2024-12-04 15:03:09,590] Trial 845 finished with value: 0.48830342137719585 and parameters: {'kernel_type': 'Matern', 'length_scale': 8.615087340254874, 'noise_level': 0.009633412378150122, 'constant_value': 4647.041807624818, 'nu': 0.5}. Best is trial 386 with value: 0.4872991004520934.
[I 2024-12-04 15:03:09,717] Trial 854 finished with value: 0.4883034257221408 and parameters: {'kernel_type': 'Matern', 'length_scale': 91.41159576265423, 'noise_level': 0.8312339638875131, 'constant_value': 54302.476950888675, 'nu': 0.5}. Best is trial 386 with value: 0.4872991004520934.
[I 2024-12-04 15:03:09,722] Trial 847 finished with value: 1.240111232625259 and parameters: {'kernel_type': 'Matern', 'length_scale': 0.0009209827952598447, 'noise_level': 4.5878905685206163e-10, 'constant_value': 5.6429819738419246e-05, 'nu': 0.5}. Best is trial 386 with value: 0.4872991004520934.
[I 2024-12-04 15:03:11,108] Trial 842 finished with value: 0.4883034195608443 and parameters: {'kernel_type': 'Matern', 'length_scale': 2537.6970573395784, 'noise_level': 0.689595401156669, 'constant_value': 1895.815690949806, 'nu': 0.5}. Best is trial 386 with value: 0.4872991004520934.
[I 2024-12-04 15:03:11,117] Trial 836 finished with value: 0.4883034159550458 and parameters: {'kernel_type': 'Matern', 'length_scale': 94920.1031849406, 'noise_level': 0.4487463271425064, 'constant_value': 4399.652166550269, 'nu': 0.5}. Best is trial 386 with value: 0.4872991004520934.
[I 2024-12-04 15:03:11,707] Trial 856 finished with value: 0.4883034161002782 and parameters: {'kernel_type': 'Matern', 'length_scale': 8795.86219198781, 'noise_level': 0.9822300626704612, 'constant_value': 1274.0244067109559, 'nu': 0.5}. Best is trial 386 with value: 0.4872991004520934.
[I 2024-12-04 15:03:13,758] Trial 850 finished with value: 0.4883034192267589 and parameters: {'kernel_type': 'Matern', 'length_scale': 17075.99617421758, 'noise_level': 0.019112978684085388, 'constant_value': 870.0674531380871, 'nu': 0.5}. Best is trial 386 with value: 0.4872991004520934.
[I 2024-12-04 15:03:13,761] Trial 851 finished with value: 0.4883034366893208 and parameters: {'kernel_type': 'Matern', 'length_scale': 20.04140425749275, 'noise_level': 0.8704856489170443, 'constant_value': 474.60889174377013, 'nu': 0.5}. Best is trial 386 with value: 0.4872991004520934.
[I 2024-12-04 15:03:14,647] Trial 852 finished with value: 1.2401112318515137 and parameters: {'kernel_type': 'Matern', 'length_scale': 85.6927025756274, 'noise_level': 2.3782756438158067e-09, 'constant_value': 1.8284284937293527, 'nu': 0.5}. Best is trial 386 with value: 0.4872991004520934.
[I 2024-12-04 15:03:16,942] Trial 848 finished with value: 0.48830454327930267 and parameters: {'kernel_type': 'Matern', 'length_scale': 41.69101401689236, 'noise_level': 0.3023597546825144, 'constant_value': 25746.554607970433, 'nu': 0.5}. Best is trial 386 with value: 0.4872991004520934.
[I 2024-12-04 15:03:17,407] Trial 855 finished with value: 0.4883034209181747 and parameters: {'kernel_type': 'Matern', 'length_scale': 300.8297369540196, 'noise_level': 0.19559297080971313, 'constant_value': 94600.76383547552, 'nu': 0.5}. Best is trial 386 with value: 0.4872991004520934.
[I 2024-12-04 15:03:17,720] Trial 841 finished with value: 0.48830341813162814 and parameters: {'kernel_type': 'Matern', 'length_scale': 1508.3751606196288, 'noise_level': 0.051352962708231975, 'constant_value': 79155.05400346115, 'nu': 0.5}. Best is trial 386 with value: 0.4872991004520934.
[I 2024-12-04 15:03:17,742] Trial 861 finished with value: 0.48830341594227206 and parameters: {'kernel_type': 'Matern', 'length_scale': 168.58870546362394, 'noise_level': 0.8619391250887581, 'constant_value': 22162.088908900347, 'nu': 0.5}. Best is trial 386 with value: 0.4872991004520934.
[I 2024-12-04 15:03:17,750] Trial 846 finished with value: 0.488303420427494 and parameters: {'kernel_type': 'Matern', 'length_scale': 3821.6725365302914, 'noise_level': 0.6560342603587106, 'constant_value': 9408.946624170738, 'nu': 0.5}. Best is trial 386 with value: 0.4872991004520934.
[I 2024-12-04 15:03:18,128] Trial 853 finished with value: 0.4883034886986537 and parameters: {'kernel_type': 'Matern', 'length_scale': 188.43166494720936, 'noise_level': 0.7156101572265421, 'constant_value': 491.36281128821247, 'nu': 0.5}. Best is trial 386 with value: 0.4872991004520934.
[I 2024-12-04 15:03:19,020] Trial 864 finished with value: 1.2401112318818248 and parameters: {'kernel_type': 'RBF', 'length_scale': 3.6497469082074936, 'noise_level': 3.724739488655588e-08, 'constant_value': 13.819202091793377, 'nu': 1.5}. Best is trial 386 with value: 0.4872991004520934.
[I 2024-12-04 15:03:19,086] Trial 859 finished with value: 0.48830338024709175 and parameters: {'kernel_type': 'Matern', 'length_scale': 922.7314701299399, 'noise_level': 0.00923401195254733, 'constant_value': 2029.8120748017013, 'nu': 0.5}. Best is trial 386 with value: 0.4872991004520934.
[I 2024-12-04 15:03:19,249] Trial 863 finished with value: 0.64438550660328 and parameters: {'kernel_type': 'RBF', 'length_scale': 114.70520797563084, 'noise_level': 0.030862538214098265, 'constant_value': 5046.191241841986, 'nu': 0.5}. Best is trial 386 with value: 0.4872991004520934.
[I 2024-12-04 15:03:19,486] Trial 858 finished with value: 0.4883033827051336 and parameters: {'kernel_type': 'Matern', 'length_scale': 77.70562641873956, 'noise_level': 0.7429754035353602, 'constant_value': 135.8499459533244, 'nu': 0.5}. Best is trial 386 with value: 0.4872991004520934.
[I 2024-12-04 15:03:21,994] Trial 857 finished with value: 1.2401112325660064 and parameters: {'kernel_type': 'Matern', 'length_scale': 99256.20707883542, 'noise_level': 7.735380906185786e-07, 'constant_value': 0.06866844069012892, 'nu': 1.5}. Best is trial 386 with value: 0.4872991004520934.
[I 2024-12-04 15:03:22,437] Trial 868 finished with value: 0.4883034188043058 and parameters: {'kernel_type': 'Matern', 'length_scale': 592.5558596697159, 'noise_level': 0.00531669015700855, 'constant_value': 8237.345692383571, 'nu': 0.5}. Best is trial 386 with value: 0.4872991004520934.
[I 2024-12-04 15:03:22,825] Trial 870 finished with value: 0.4883034099279335 and parameters: {'kernel_type': 'Matern', 'length_scale': 123.49426426385561, 'noise_level': 0.0036844972117097657, 'constant_value': 82316.38329310517, 'nu': 0.5}. Best is trial 386 with value: 0.4872991004520934.
[I 2024-12-04 15:03:23,523] Trial 867 finished with value: 0.4883044185048982 and parameters: {'kernel_type': 'Matern', 'length_scale': 903.314139395235, 'noise_level': 0.11627367619703553, 'constant_value': 81028.29685388463, 'nu': 0.5}. Best is trial 386 with value: 0.4872991004520934.
[I 2024-12-04 15:03:23,537] Trial 866 finished with value: 0.48830340612562706 and parameters: {'kernel_type': 'Matern', 'length_scale': 1119.5728479319373, 'noise_level': 0.4080759630379332, 'constant_value': 5890.273361139679, 'nu': 0.5}. Best is trial 386 with value: 0.4872991004520934.
[I 2024-12-04 15:03:24,328] Trial 865 finished with value: 0.48830341867723204 and parameters: {'kernel_type': 'Matern', 'length_scale': 663.6037882110937, 'noise_level': 0.8729583938983181, 'constant_value': 761.7693234811015, 'nu': 0.5}. Best is trial 386 with value: 0.4872991004520934.
[I 2024-12-04 15:03:25,067] Trial 862 finished with value: 0.4883034180376804 and parameters: {'kernel_type': 'Matern', 'length_scale': 3070.0176008273893, 'noise_level': 0.015371310535744656, 'constant_value': 555.7298180214093, 'nu': 0.5}. Best is trial 386 with value: 0.4872991004520934.
[I 2024-12-04 15:03:25,620] Trial 875 finished with value: 0.4883034370842824 and parameters: {'kernel_type': 'Matern', 'length_scale': 215.88978273683117, 'noise_level': 0.693070124645877, 'constant_value': 77.19817259201973, 'nu': 0.5}. Best is trial 386 with value: 0.4872991004520934.
[I 2024-12-04 15:03:26,151] Trial 874 finished with value: 1.2401112325952584 and parameters: {'kernel_type': 'Matern', 'length_scale': 1498.170514022892, 'noise_level': 7.520063964882763e-10, 'constant_value': 0.7144646966934587, 'nu': 1.5}. Best is trial 386 with value: 0.4872991004520934.
[I 2024-12-04 15:03:27,484] Trial 860 finished with value: 0.4883024935415551 and parameters: {'kernel_type': 'Matern', 'length_scale': 1847.0213970280938, 'noise_level': 0.7310557153761521, 'constant_value': 3713.768815450329, 'nu': 0.5}. Best is trial 386 with value: 0.4872991004520934.
[I 2024-12-04 15:03:28,343] Trial 879 finished with value: 0.5273057016165926 and parameters: {'kernel_type': 'Matern', 'length_scale': 512.9629486600508, 'noise_level': 0.3334738299664838, 'constant_value': 8002.783121598194, 'nu': 1.5}. Best is trial 386 with value: 0.4872991004520934.
[I 2024-12-04 15:03:28,346] Trial 880 finished with value: 1.26145304319949 and parameters: {'kernel_type': 'Matern', 'length_scale': 0.006910767206416261, 'noise_level': 0.019803299395942876, 'constant_value': 1.1218878328407117e-06, 'nu': 1.5}. Best is trial 386 with value: 0.4872991004520934.
[I 2024-12-04 15:03:28,347] Trial 871 finished with value: 1.2401112390254112 and parameters: {'kernel_type': 'RBF', 'length_scale': 0.0011572390738695396, 'noise_level': 2.941798981079468e-06, 'constant_value': 0.00012205603486140223, 'nu': 0.5}. Best is trial 386 with value: 0.4872991004520934.
[I 2024-12-04 15:03:30,041] Trial 873 finished with value: 0.488303423385156 and parameters: {'kernel_type': 'Matern', 'length_scale': 15786.590618263746, 'noise_level': 0.022968428946858674, 'constant_value': 1251.1035602019535, 'nu': 0.5}. Best is trial 386 with value: 0.4872991004520934.
[I 2024-12-04 15:03:31,417] Trial 869 finished with value: 1.2401112326253958 and parameters: {'kernel_type': 'RBF', 'length_scale': 68.99385911105104, 'noise_level': 3.452101997806176e-10, 'constant_value': 2.282840399187356e-07, 'nu': 0.5}. Best is trial 386 with value: 0.4872991004520934.
[I 2024-12-04 15:03:32,584] Trial 881 finished with value: 0.6443850840452506 and parameters: {'kernel_type': 'RBF', 'length_scale': 1397.4438249574614, 'noise_level': 0.01284774526426482, 'constant_value': 44707.27267108956, 'nu': 0.5}. Best is trial 386 with value: 0.4872991004520934.
[I 2024-12-04 15:03:32,710] Trial 872 finished with value: 0.4883033977476791 and parameters: {'kernel_type': 'Matern', 'length_scale': 111.01497789034981, 'noise_level': 0.011248427716877271, 'constant_value': 8740.268902210772, 'nu': 0.5}. Best is trial 386 with value: 0.4872991004520934.
[I 2024-12-04 15:03:33,463] Trial 885 finished with value: 0.6443854340497096 and parameters: {'kernel_type': 'RBF', 'length_scale': 6638.506767595341, 'noise_level': 0.9796900918096382, 'constant_value': 1145.7927419037649, 'nu': 0.5}. Best is trial 386 with value: 0.4872991004520934.
[I 2024-12-04 15:03:34,019] Trial 876 finished with value: 0.4883034181398133 and parameters: {'kernel_type': 'Matern', 'length_scale': 946.384656266995, 'noise_level': 0.018485773910756866, 'constant_value': 1246.0472155953912, 'nu': 0.5}. Best is trial 386 with value: 0.4872991004520934.
[I 2024-12-04 15:03:34,151] Trial 884 finished with value: 0.4883029317169939 and parameters: {'kernel_type': 'Matern', 'length_scale': 500.4529020926521, 'noise_level': 0.4920210305815899, 'constant_value': 686.5065847660695, 'nu': 0.5}. Best is trial 386 with value: 0.4872991004520934.
[I 2024-12-04 15:03:34,167] Trial 877 finished with value: 0.5663935590554876 and parameters: {'kernel_type': 'Matern', 'length_scale': 4844.307220917711, 'noise_level': 0.945158321263829, 'constant_value': 5388.10419884754, 'nu': 2.5}. Best is trial 386 with value: 0.4872991004520934.
[I 2024-12-04 15:03:35,153] Trial 878 finished with value: 0.48830341866563154 and parameters: {'kernel_type': 'Matern', 'length_scale': 42062.29999034942, 'noise_level': 0.47764593395890886, 'constant_value': 1516.0586696773278, 'nu': 0.5}. Best is trial 386 with value: 0.4872991004520934.
[I 2024-12-04 15:03:35,543] Trial 886 finished with value: 0.4883034077153018 and parameters: {'kernel_type': 'Matern', 'length_scale': 806.0530326789886, 'noise_level': 0.5197017819985086, 'constant_value': 71373.10571791907, 'nu': 0.5}. Best is trial 386 with value: 0.4872991004520934.
[I 2024-12-04 15:03:36,626] Trial 888 finished with value: 1.2401112318923682 and parameters: {'kernel_type': 'Matern', 'length_scale': 89233.94376667432, 'noise_level': 0.012127601785976874, 'constant_value': 2446.600397672865, 'nu': 2.5}. Best is trial 386 with value: 0.4872991004520934.
[I 2024-12-04 15:03:36,644] Trial 896 finished with value: 1.2614538608220565 and parameters: {'kernel_type': 'Matern', 'length_scale': 277.81864542250827, 'noise_level': 0.0329605868342402, 'constant_value': 4.842945647938826e-07, 'nu': 0.5}. Best is trial 386 with value: 0.4872991004520934.
[I 2024-12-04 15:03:36,646] Trial 894 finished with value: 0.48830341845817343 and parameters: {'kernel_type': 'Matern', 'length_scale': 35439.04325394971, 'noise_level': 0.667888536523418, 'constant_value': 70651.71552885533, 'nu': 0.5}. Best is trial 386 with value: 0.4872991004520934.
[I 2024-12-04 15:03:36,657] Trial 891 finished with value: 0.48830341861582827 and parameters: {'kernel_type': 'Matern', 'length_scale': 1665.7352082038929, 'noise_level': 0.847939259324342, 'constant_value': 11071.914174410871, 'nu': 0.5}. Best is trial 386 with value: 0.4872991004520934.
[I 2024-12-04 15:03:37,410] Trial 887 finished with value: 0.48830342496242546 and parameters: {'kernel_type': 'Matern', 'length_scale': 2058.9259026457084, 'noise_level': 0.9927354160863173, 'constant_value': 2323.5419973398766, 'nu': 0.5}. Best is trial 386 with value: 0.4872991004520934.
[I 2024-12-04 15:03:37,600] Trial 883 finished with value: 1.2614547976350685 and parameters: {'kernel_type': 'Matern', 'length_scale': 84600.72947061349, 'noise_level': 0.9691051632835052, 'constant_value': 951.5316260885488, 'nu': 1.5}. Best is trial 386 with value: 0.4872991004520934.
[I 2024-12-04 15:03:37,612] Trial 890 finished with value: 0.48830341601789207 and parameters: {'kernel_type': 'Matern', 'length_scale': 87697.22727140144, 'noise_level': 0.05556212475540136, 'constant_value': 120.94940398150912, 'nu': 0.5}. Best is trial 386 with value: 0.4872991004520934.
[I 2024-12-04 15:03:38,056] Trial 882 finished with value: 0.4883034696678201 and parameters: {'kernel_type': 'Matern', 'length_scale': 37517.5161607207, 'noise_level': 0.640938713830598, 'constant_value': 21032.579488586878, 'nu': 0.5}. Best is trial 386 with value: 0.4872991004520934.
[I 2024-12-04 15:03:40,180] Trial 892 finished with value: 1.2401112272406196 and parameters: {'kernel_type': 'Matern', 'length_scale': 1.4343193784011037e-05, 'noise_level': 6.024832400979134e-06, 'constant_value': 2.2001420867122763e-06, 'nu': 2.5}. Best is trial 386 with value: 0.4872991004520934.
[I 2024-12-04 15:03:40,587] Trial 889 finished with value: 0.48830347775050575 and parameters: {'kernel_type': 'Matern', 'length_scale': 6030.044884437933, 'noise_level': 0.8178344904512368, 'constant_value': 14.935793794357025, 'nu': 0.5}. Best is trial 386 with value: 0.4872991004520934.
[I 2024-12-04 15:03:40,631] Trial 903 finished with value: 1.2614547947518728 and parameters: {'kernel_type': 'Matern', 'length_scale': 1288.5773750838093, 'noise_level': 0.000128553486424127, 'constant_value': 78446.63869183694, 'nu': 0.5}. Best is trial 386 with value: 0.4872991004520934.
[I 2024-12-04 15:03:41,036] Trial 897 finished with value: 0.4883034161152268 and parameters: {'kernel_type': 'Matern', 'length_scale': 2788.4453886887172, 'noise_level': 0.6454202360692334, 'constant_value': 6.177196925017216, 'nu': 0.5}. Best is trial 386 with value: 0.4872991004520934.
[I 2024-12-04 15:03:41,475] Trial 902 finished with value: 0.4883034170620023 and parameters: {'kernel_type': 'Matern', 'length_scale': 3100.092626227115, 'noise_level': 0.4952312403311223, 'constant_value': 11.68834452072132, 'nu': 0.5}. Best is trial 386 with value: 0.4872991004520934.
[I 2024-12-04 15:03:41,792] Trial 900 finished with value: 0.4883034187009085 and parameters: {'kernel_type': 'Matern', 'length_scale': 2081.5640652259626, 'noise_level': 0.01527384539667985, 'constant_value': 589.8569377844212, 'nu': 0.5}. Best is trial 386 with value: 0.4872991004520934.
[I 2024-12-04 15:03:41,852] Trial 895 finished with value: 0.48830335890690246 and parameters: {'kernel_type': 'Matern', 'length_scale': 589.5194173184462, 'noise_level': 0.18288929450013153, 'constant_value': 83.23541926687903, 'nu': 0.5}. Best is trial 386 with value: 0.4872991004520934.
