[I 2024-12-04 14:57:16,300] Trial 730 finished with value: 0.4705231936899477 and parameters: {'n_estimators': 1131, 'learning_rate': 0.07584421267885111, 'max_depth': 12, 'min_samples_split': 18, 'min_samples_leaf': 1, 'subsample': 0.9822951970201876, 'max_features': None}. Best is trial 603 with value: 0.45955205541891275.
[I 2024-12-04 14:57:18,064] Trial 734 finished with value: 0.6371946545085425 and parameters: {'n_estimators': 1072, 'learning_rate': 0.05504428951302564, 'max_depth': 12, 'min_samples_split': 19, 'min_samples_leaf': 3, 'subsample': 0.9212239841292407, 'max_features': None}. Best is trial 603 with value: 0.45955205541891275.
[I 2024-12-04 14:57:18,675] Trial 741 finished with value: 0.5152158705711175 and parameters: {'n_estimators': 925, 'learning_rate': 0.08127235531468949, 'max_depth': 12, 'min_samples_split': 15, 'min_samples_leaf': 1, 'subsample': 0.930241384446624, 'max_features': None}. Best is trial 603 with value: 0.45955205541891275.
[I 2024-12-04 14:57:18,902] Trial 732 finished with value: 0.5975727003706832 and parameters: {'n_estimators': 1181, 'learning_rate': 0.08767032882351618, 'max_depth': 12, 'min_samples_split': 17, 'min_samples_leaf': 5, 'subsample': 0.9863907777008853, 'max_features': None}. Best is trial 603 with value: 0.45955205541891275.
[I 2024-12-04 14:57:19,150] Trial 739 finished with value: 0.49744208483242086 and parameters: {'n_estimators': 1097, 'learning_rate': 0.060025453789556954, 'max_depth': 12, 'min_samples_split': 16, 'min_samples_leaf': 1, 'subsample': 0.9294290854665515, 'max_features': None}. Best is trial 603 with value: 0.45955205541891275.
[I 2024-12-04 14:57:19,724] Trial 735 finished with value: 0.508969375609718 and parameters: {'n_estimators': 1178, 'learning_rate': 0.09992190808811417, 'max_depth': 10, 'min_samples_split': 15, 'min_samples_leaf': 1, 'subsample': 0.8442064587434764, 'max_features': None}. Best is trial 603 with value: 0.45955205541891275.
[I 2024-12-04 14:57:19,738] Trial 749 finished with value: 0.5790507372685956 and parameters: {'n_estimators': 700, 'learning_rate': 0.09220168726808278, 'max_depth': 11, 'min_samples_split': 18, 'min_samples_leaf': 1, 'subsample': 0.9998725090618701, 'max_features': 'log2'}. Best is trial 603 with value: 0.45955205541891275.
[I 2024-12-04 14:57:22,920] Trial 755 finished with value: 0.7583878367581217 and parameters: {'n_estimators': 574, 'learning_rate': 0.05360905654462338, 'max_depth': 4, 'min_samples_split': 12, 'min_samples_leaf': 8, 'subsample': 0.6607323337101503, 'max_features': 'sqrt'}. Best is trial 603 with value: 0.45955205541891275.
[I 2024-12-04 14:57:23,306] Trial 750 finished with value: 0.6297805456660017 and parameters: {'n_estimators': 569, 'learning_rate': 0.09992816129167888, 'max_depth': 11, 'min_samples_split': 20, 'min_samples_leaf': 2, 'subsample': 0.9121173644546678, 'max_features': None}. Best is trial 603 with value: 0.45955205541891275.
[I 2024-12-04 14:57:24,852] Trial 756 finished with value: 0.5787145013844782 and parameters: {'n_estimators': 196, 'learning_rate': 0.01065811373948599, 'max_depth': 12, 'min_samples_split': 9, 'min_samples_leaf': 3, 'subsample': 0.7305250001726317, 'max_features': None}. Best is trial 603 with value: 0.45955205541891275.
[I 2024-12-04 14:57:24,978] Trial 751 finished with value: 0.4919393675298447 and parameters: {'n_estimators': 743, 'learning_rate': 0.08681503522587046, 'max_depth': 11, 'min_samples_split': 19, 'min_samples_leaf': 1, 'subsample': 0.8509569656389662, 'max_features': None}. Best is trial 603 with value: 0.45955205541891275.
[I 2024-12-04 14:57:26,736] Trial 743 finished with value: 0.6371736928474491 and parameters: {'n_estimators': 1341, 'learning_rate': 0.08134805105397297, 'max_depth': 12, 'min_samples_split': 18, 'min_samples_leaf': 4, 'subsample': 0.9746727324947605, 'max_features': None}. Best is trial 603 with value: 0.45955205541891275.
[I 2024-12-04 14:57:29,490] Trial 744 finished with value: 0.5286109740094713 and parameters: {'n_estimators': 1404, 'learning_rate': 0.08884113768535921, 'max_depth': 11, 'min_samples_split': 14, 'min_samples_leaf': 1, 'subsample': 0.9292728721384651, 'max_features': None}. Best is trial 603 with value: 0.45955205541891275.
[I 2024-12-04 14:57:29,909] Trial 752 finished with value: 0.6432464144533321 and parameters: {'n_estimators': 925, 'learning_rate': 0.09836167851425522, 'max_depth': 11, 'min_samples_split': 19, 'min_samples_leaf': 2, 'subsample': 0.9839849802626544, 'max_features': None}. Best is trial 603 with value: 0.45955205541891275.
[I 2024-12-04 14:57:31,371] Trial 745 finished with value: 0.48323631495318875 and parameters: {'n_estimators': 1411, 'learning_rate': 0.06116274280474864, 'max_depth': 10, 'min_samples_split': 19, 'min_samples_leaf': 1, 'subsample': 0.9705241367594698, 'max_features': None}. Best is trial 603 with value: 0.45955205541891275.
[I 2024-12-04 14:57:31,535] Trial 754 finished with value: 0.4972252829822425 and parameters: {'n_estimators': 729, 'learning_rate': 0.09889656843475564, 'max_depth': 10, 'min_samples_split': 16, 'min_samples_leaf': 1, 'subsample': 0.8716877912358966, 'max_features': None}. Best is trial 603 with value: 0.45955205541891275.
[I 2024-12-04 14:57:33,744] Trial 746 finished with value: 0.6713047804120448 and parameters: {'n_estimators': 1465, 'learning_rate': 0.0694421029742818, 'max_depth': 11, 'min_samples_split': 15, 'min_samples_leaf': 2, 'subsample': 0.9541658215342698, 'max_features': None}. Best is trial 603 with value: 0.45955205541891275.
[I 2024-12-04 14:57:40,434] Trial 760 finished with value: 0.6867201163002296 and parameters: {'n_estimators': 875, 'learning_rate': 0.09965148851581454, 'max_depth': 8, 'min_samples_split': 7, 'min_samples_leaf': 7, 'subsample': 0.6252550497107359, 'max_features': None}. Best is trial 603 with value: 0.45955205541891275.
[I 2024-12-04 14:57:42,458] Trial 748 finished with value: 0.46917785303968806 and parameters: {'n_estimators': 1466, 'learning_rate': 0.08173421442845316, 'max_depth': 12, 'min_samples_split': 19, 'min_samples_leaf': 1, 'subsample': 0.9639063427019998, 'max_features': None}. Best is trial 603 with value: 0.45955205541891275.
[I 2024-12-04 14:57:44,217] Trial 757 finished with value: 0.654327733675647 and parameters: {'n_estimators': 1131, 'learning_rate': 0.08425523149516047, 'max_depth': 12, 'min_samples_split': 20, 'min_samples_leaf': 3, 'subsample': 0.9915683637210341, 'max_features': None}. Best is trial 603 with value: 0.45955205541891275.
[I 2024-12-04 14:57:44,656] Trial 766 finished with value: 0.696269159471271 and parameters: {'n_estimators': 884, 'learning_rate': 0.06805062714351899, 'max_depth': 9, 'min_samples_split': 20, 'min_samples_leaf': 7, 'subsample': 0.6336831614632821, 'max_features': None}. Best is trial 603 with value: 0.45955205541891275.
[I 2024-12-04 14:57:44,681] Trial 764 finished with value: 0.5501398394945911 and parameters: {'n_estimators': 906, 'learning_rate': 0.07898874236405, 'max_depth': 12, 'min_samples_split': 20, 'min_samples_leaf': 1, 'subsample': 0.9972711322842224, 'max_features': 'log2'}. Best is trial 603 with value: 0.45955205541891275.
[I 2024-12-04 14:57:47,010] Trial 762 finished with value: 0.4899470413775157 and parameters: {'n_estimators': 862, 'learning_rate': 0.0997086561997761, 'max_depth': 10, 'min_samples_split': 17, 'min_samples_leaf': 1, 'subsample': 0.8864842589654383, 'max_features': None}. Best is trial 603 with value: 0.45955205541891275.
[I 2024-12-04 14:57:47,720] Trial 753 finished with value: 0.6403374051686718 and parameters: {'n_estimators': 1406, 'learning_rate': 0.09264078198694022, 'max_depth': 12, 'min_samples_split': 20, 'min_samples_leaf': 2, 'subsample': 0.960185071279753, 'max_features': None}. Best is trial 603 with value: 0.45955205541891275.
[I 2024-12-04 14:57:48,407] Trial 777 finished with value: 0.4924697183200451 and parameters: {'n_estimators': 543, 'learning_rate': 0.08015099720471072, 'max_depth': 12, 'min_samples_split': 17, 'min_samples_leaf': 1, 'subsample': 0.9661633553492169, 'max_features': None}. Best is trial 603 with value: 0.45955205541891275.
[I 2024-12-04 14:57:49,212] Trial 770 finished with value: 0.6310993056932976 and parameters: {'n_estimators': 658, 'learning_rate': 0.08494396911196024, 'max_depth': 12, 'min_samples_split': 18, 'min_samples_leaf': 3, 'subsample': 0.9895736362460781, 'max_features': None}. Best is trial 603 with value: 0.45955205541891275.
[I 2024-12-04 14:57:50,043] Trial 783 finished with value: 0.6060804410405142 and parameters: {'n_estimators': 488, 'learning_rate': 0.09698293096712174, 'max_depth': 11, 'min_samples_split': 20, 'min_samples_leaf': 2, 'subsample': 0.9831417700881973, 'max_features': None}. Best is trial 603 with value: 0.45955205541891275.
[I 2024-12-04 14:57:51,014] Trial 758 finished with value: 0.46355664875929564 and parameters: {'n_estimators': 1285, 'learning_rate': 0.0961931516836736, 'max_depth': 10, 'min_samples_split': 18, 'min_samples_leaf': 1, 'subsample': 0.9825441073366399, 'max_features': None}. Best is trial 603 with value: 0.45955205541891275.
[I 2024-12-04 14:57:51,052] Trial 774 finished with value: 0.47764410491839454 and parameters: {'n_estimators': 663, 'learning_rate': 0.09360473278573146, 'max_depth': 11, 'min_samples_split': 19, 'min_samples_leaf': 1, 'subsample': 0.9828701197811007, 'max_features': None}. Best is trial 603 with value: 0.45955205541891275.
[I 2024-12-04 14:57:51,241] Trial 763 finished with value: 0.6488384461713854 and parameters: {'n_estimators': 1042, 'learning_rate': 0.010844794362390584, 'max_depth': 4, 'min_samples_split': 15, 'min_samples_leaf': 3, 'subsample': 0.7245192461748577, 'max_features': 'sqrt'}. Best is trial 603 with value: 0.45955205541891275.
[I 2024-12-04 14:57:52,915] Trial 782 finished with value: 0.623800299867117 and parameters: {'n_estimators': 509, 'learning_rate': 0.08713251005488694, 'max_depth': 12, 'min_samples_split': 20, 'min_samples_leaf': 3, 'subsample': 0.9965814116067196, 'max_features': None}. Best is trial 603 with value: 0.45955205541891275.
[I 2024-12-04 14:57:53,735] Trial 780 finished with value: 0.4810010992047813 and parameters: {'n_estimators': 593, 'learning_rate': 0.09230935926838137, 'max_depth': 12, 'min_samples_split': 19, 'min_samples_leaf': 1, 'subsample': 0.9628896808327726, 'max_features': None}. Best is trial 603 with value: 0.45955205541891275.
[I 2024-12-04 14:57:55,343] Trial 789 finished with value: 0.787025003727636 and parameters: {'n_estimators': 290, 'learning_rate': 0.07508708876213094, 'max_depth': 4, 'min_samples_split': 20, 'min_samples_leaf': 4, 'subsample': 0.711492211794653, 'max_features': 'log2'}. Best is trial 603 with value: 0.45955205541891275.
[I 2024-12-04 14:57:56,647] Trial 759 finished with value: 0.6886046681677824 and parameters: {'n_estimators': 1467, 'learning_rate': 0.07554158119794942, 'max_depth': 12, 'min_samples_split': 16, 'min_samples_leaf': 2, 'subsample': 0.9177991121016815, 'max_features': 'sqrt'}. Best is trial 603 with value: 0.45955205541891275.
[I 2024-12-04 14:57:56,671] Trial 761 finished with value: 0.6546454580118575 and parameters: {'n_estimators': 1399, 'learning_rate': 0.09316194005697943, 'max_depth': 9, 'min_samples_split': 17, 'min_samples_leaf': 2, 'subsample': 0.9892555298290365, 'max_features': 'sqrt'}. Best is trial 603 with value: 0.45955205541891275.
[I 2024-12-04 14:57:58,148] Trial 767 finished with value: 0.6456683679612156 and parameters: {'n_estimators': 1049, 'learning_rate': 0.07587973574973825, 'max_depth': 12, 'min_samples_split': 15, 'min_samples_leaf': 2, 'subsample': 0.9851816411755957, 'max_features': None}. Best is trial 603 with value: 0.45955205541891275.
[I 2024-12-04 14:57:59,377] Trial 768 finished with value: 0.6938376313914705 and parameters: {'n_estimators': 1238, 'learning_rate': 0.01900636684265523, 'max_depth': 9, 'min_samples_split': 3, 'min_samples_leaf': 3, 'subsample': 0.6194390410151139, 'max_features': 'log2'}. Best is trial 603 with value: 0.45955205541891275.
[I 2024-12-04 14:57:59,995] Trial 786 finished with value: 0.46848692100844497 and parameters: {'n_estimators': 686, 'learning_rate': 0.08245358453974472, 'max_depth': 12, 'min_samples_split': 20, 'min_samples_leaf': 1, 'subsample': 0.972400391253574, 'max_features': None}. Best is trial 603 with value: 0.45955205541891275.
[I 2024-12-04 14:58:01,308] Trial 778 finished with value: 0.482308321288985 and parameters: {'n_estimators': 861, 'learning_rate': 0.07203655081132476, 'max_depth': 11, 'min_samples_split': 20, 'min_samples_leaf': 1, 'subsample': 0.9986964891110449, 'max_features': None}. Best is trial 603 with value: 0.45955205541891275.
[I 2024-12-04 14:58:01,401] Trial 775 finished with value: 0.6362865250080206 and parameters: {'n_estimators': 939, 'learning_rate': 0.08896027683651272, 'max_depth': 12, 'min_samples_split': 18, 'min_samples_leaf': 2, 'subsample': 0.993532608872767, 'max_features': None}. Best is trial 603 with value: 0.45955205541891275.
[I 2024-12-04 14:58:01,825] Trial 771 finished with value: 0.49199074054564446 and parameters: {'n_estimators': 1022, 'learning_rate': 0.08219694367895347, 'max_depth': 12, 'min_samples_split': 19, 'min_samples_leaf': 1, 'subsample': 0.9236686387446464, 'max_features': None}. Best is trial 603 with value: 0.45955205541891275.
[I 2024-12-04 14:58:05,640] Trial 781 finished with value: 0.6313258744196072 and parameters: {'n_estimators': 1029, 'learning_rate': 0.07100396674143616, 'max_depth': 10, 'min_samples_split': 20, 'min_samples_leaf': 2, 'subsample': 0.9854822865429754, 'max_features': None}. Best is trial 603 with value: 0.45955205541891275.
[I 2024-12-04 14:58:06,343] Trial 799 finished with value: 0.6486885918917092 and parameters: {'n_estimators': 332, 'learning_rate': 0.0478845841198888, 'max_depth': 11, 'min_samples_split': 6, 'min_samples_leaf': 8, 'subsample': 0.8298355340656585, 'max_features': None}. Best is trial 603 with value: 0.45955205541891275.
[I 2024-12-04 14:58:06,360] Trial 765 finished with value: 0.47075772444530345 and parameters: {'n_estimators': 1355, 'learning_rate': 0.0935257550510307, 'max_depth': 11, 'min_samples_split': 20, 'min_samples_leaf': 1, 'subsample': 0.996584439706803, 'max_features': None}. Best is trial 603 with value: 0.45955205541891275.
[I 2024-12-04 14:58:06,365] Trial 784 finished with value: 0.5548856341172864 and parameters: {'n_estimators': 1149, 'learning_rate': 0.06910966449994177, 'max_depth': 11, 'min_samples_split': 20, 'min_samples_leaf': 1, 'subsample': 0.9631668650619091, 'max_features': 'sqrt'}. Best is trial 603 with value: 0.45955205541891275.
[I 2024-12-04 14:58:08,327] Trial 801 finished with value: 1.1789347717350256 and parameters: {'n_estimators': 366, 'learning_rate': 0.010071636636478136, 'max_depth': 3, 'min_samples_split': 7, 'min_samples_leaf': 7, 'subsample': 0.6104668469226943, 'max_features': 'log2'}. Best is trial 603 with value: 0.45955205541891275.
[I 2024-12-04 14:58:08,583] Trial 773 finished with value: 0.4716771301820142 and parameters: {'n_estimators': 1142, 'learning_rate': 0.07666711662706646, 'max_depth': 12, 'min_samples_split': 18, 'min_samples_leaf': 1, 'subsample': 0.9951340977250978, 'max_features': None}. Best is trial 603 with value: 0.45955205541891275.
[I 2024-12-04 14:58:09,183] Trial 772 finished with value: 0.5128440782643742 and parameters: {'n_estimators': 1179, 'learning_rate': 0.09733219529653138, 'max_depth': 11, 'min_samples_split': 16, 'min_samples_leaf': 1, 'subsample': 0.9929306454113633, 'max_features': None}. Best is trial 603 with value: 0.45955205541891275.
[I 2024-12-04 14:58:09,258] Trial 769 finished with value: 0.7333123532365856 and parameters: {'n_estimators': 1447, 'learning_rate': 0.010563064026846859, 'max_depth': 6, 'min_samples_split': 5, 'min_samples_leaf': 10, 'subsample': 0.700051085997776, 'max_features': None}. Best is trial 603 with value: 0.45955205541891275.
[I 2024-12-04 14:58:09,674] Trial 779 finished with value: 0.6124627557332222 and parameters: {'n_estimators': 1078, 'learning_rate': 0.08140913265881213, 'max_depth': 12, 'min_samples_split': 20, 'min_samples_leaf': 2, 'subsample': 0.9630924092910486, 'max_features': None}. Best is trial 603 with value: 0.45955205541891275.
[I 2024-12-04 14:58:09,912] Trial 785 finished with value: 0.48887711649085086 and parameters: {'n_estimators': 992, 'learning_rate': 0.08496726463929029, 'max_depth': 11, 'min_samples_split': 20, 'min_samples_leaf': 1, 'subsample': 0.8897324286567573, 'max_features': None}. Best is trial 603 with value: 0.45955205541891275.
[I 2024-12-04 14:58:09,917] Trial 809 finished with value: 0.6804519178218729 and parameters: {'n_estimators': 188, 'learning_rate': 0.09934911507312648, 'max_depth': 10, 'min_samples_split': 10, 'min_samples_leaf': 6, 'subsample': 0.8651525444255819, 'max_features': 'sqrt'}. Best is trial 603 with value: 0.45955205541891275.
[I 2024-12-04 14:58:09,973] Trial 810 finished with value: 0.6282429621336164 and parameters: {'n_estimators': 198, 'learning_rate': 0.03343072410341577, 'max_depth': 12, 'min_samples_split': 3, 'min_samples_leaf': 1, 'subsample': 0.948502070819381, 'max_features': 'log2'}. Best is trial 603 with value: 0.45955205541891275.
[I 2024-12-04 14:58:13,738] Trial 787 finished with value: 0.49275633739491626 and parameters: {'n_estimators': 920, 'learning_rate': 0.09955667978194681, 'max_depth': 11, 'min_samples_split': 18, 'min_samples_leaf': 1, 'subsample': 0.924846840878015, 'max_features': None}. Best is trial 603 with value: 0.45955205541891275.
[I 2024-12-04 14:58:13,984] Trial 788 finished with value: 0.47410995915999926 and parameters: {'n_estimators': 808, 'learning_rate': 0.08396664846904608, 'max_depth': 12, 'min_samples_split': 19, 'min_samples_leaf': 1, 'subsample': 0.9874656617276135, 'max_features': None}. Best is trial 603 with value: 0.45955205541891275.
[I 2024-12-04 14:58:14,019] Trial 793 finished with value: 0.5879501558350635 and parameters: {'n_estimators': 854, 'learning_rate': 0.09628215065137902, 'max_depth': 11, 'min_samples_split': 20, 'min_samples_leaf': 1, 'subsample': 0.8458945170746976, 'max_features': 'log2'}. Best is trial 603 with value: 0.45955205541891275.
[I 2024-12-04 14:58:14,211] Trial 776 finished with value: 0.6363821042419511 and parameters: {'n_estimators': 1356, 'learning_rate': 0.016553048247151925, 'max_depth': 12, 'min_samples_split': 8, 'min_samples_leaf': 2, 'subsample': 0.6068451058585009, 'max_features': None}. Best is trial 603 with value: 0.45955205541891275.
[I 2024-12-04 14:58:21,632] Trial 794 finished with value: 0.46295603355247184 and parameters: {'n_estimators': 916, 'learning_rate': 0.08304908695968825, 'max_depth': 12, 'min_samples_split': 20, 'min_samples_leaf': 1, 'subsample': 0.9938236248294151, 'max_features': None}. Best is trial 603 with value: 0.45955205541891275.
[I 2024-12-04 14:58:22,924] Trial 807 finished with value: 0.47395899777457734 and parameters: {'n_estimators': 672, 'learning_rate': 0.08161313933444793, 'max_depth': 12, 'min_samples_split': 19, 'min_samples_leaf': 1, 'subsample': 0.953914216784542, 'max_features': None}. Best is trial 603 with value: 0.45955205541891275.
[I 2024-12-04 14:58:27,002] Trial 790 finished with value: 0.6552058624885893 and parameters: {'n_estimators': 1266, 'learning_rate': 0.0925979228828317, 'max_depth': 11, 'min_samples_split': 18, 'min_samples_leaf': 2, 'subsample': 0.8896870446307599, 'max_features': None}. Best is trial 603 with value: 0.45955205541891275.
[I 2024-12-04 14:58:28,822] Trial 805 finished with value: 0.6384931933544274 and parameters: {'n_estimators': 1231, 'learning_rate': 0.05793711997256086, 'max_depth': 12, 'min_samples_split': 16, 'min_samples_leaf': 3, 'subsample': 0.8880092948412557, 'max_features': 'log2'}. Best is trial 603 with value: 0.45955205541891275.
[I 2024-12-04 14:58:29,274] Trial 798 finished with value: 0.4826213510529211 and parameters: {'n_estimators': 1075, 'learning_rate': 0.09677154592004816, 'max_depth': 9, 'min_samples_split': 19, 'min_samples_leaf': 1, 'subsample': 0.9821879572288006, 'max_features': None}. Best is trial 603 with value: 0.45955205541891275.
[I 2024-12-04 14:58:33,321] Trial 791 finished with value: 0.5306939987745637 and parameters: {'n_estimators': 1396, 'learning_rate': 0.07641533576949516, 'max_depth': 12, 'min_samples_split': 16, 'min_samples_leaf': 1, 'subsample': 0.9958307431838594, 'max_features': None}. Best is trial 603 with value: 0.45955205541891275.
[I 2024-12-04 14:58:33,648] Trial 792 finished with value: 0.6674577544066412 and parameters: {'n_estimators': 1416, 'learning_rate': 0.06367100682721229, 'max_depth': 11, 'min_samples_split': 20, 'min_samples_leaf': 2, 'subsample': 0.8972480736494738, 'max_features': None}. Best is trial 603 with value: 0.45955205541891275.
[I 2024-12-04 14:58:34,400] Trial 796 finished with value: 0.5106290527166096 and parameters: {'n_estimators': 1321, 'learning_rate': 0.07309268888718377, 'max_depth': 11, 'min_samples_split': 16, 'min_samples_leaf': 1, 'subsample': 0.9610721906549711, 'max_features': None}. Best is trial 603 with value: 0.45955205541891275.
[I 2024-12-04 14:58:35,544] Trial 797 finished with value: 0.6735750016029677 and parameters: {'n_estimators': 1389, 'learning_rate': 0.09668739210584941, 'max_depth': 9, 'min_samples_split': 20, 'min_samples_leaf': 3, 'subsample': 0.9133175284176238, 'max_features': None}. Best is trial 603 with value: 0.45955205541891275.
[I 2024-12-04 14:58:36,289] Trial 795 finished with value: 0.468175701376188 and parameters: {'n_estimators': 1354, 'learning_rate': 0.07278735788752874, 'max_depth': 12, 'min_samples_split': 18, 'min_samples_leaf': 1, 'subsample': 0.990575999721236, 'max_features': None}. Best is trial 603 with value: 0.45955205541891275.
