[I 2024-12-04 15:14:56,374] Trial 1150 finished with value: 1.0134408721751809 and parameters: {'n_estimators': 643, 'max_depth': 43, 'min_samples_split': 2, 'min_samples_leaf': 3, 'max_features': 'log2', 'bootstrap': True, 'criterion': 'absolute_error'}. Best is trial 1025 with value: 0.41844370194907604.
[I 2024-12-04 15:15:03,315] Trial 1147 finished with value: 0.7260802929261813 and parameters: {'n_estimators': 823, 'max_depth': 42, 'min_samples_split': 6, 'min_samples_leaf': 10, 'max_features': None, 'bootstrap': False, 'criterion': 'absolute_error'}. Best is trial 1025 with value: 0.41844370194907604.
[I 2024-12-04 15:15:03,942] Trial 1151 finished with value: 0.4312900709846939 and parameters: {'n_estimators': 940, 'max_depth': 35, 'min_samples_split': 4, 'min_samples_leaf': 1, 'max_features': None, 'bootstrap': True, 'criterion': 'squared_error'}. Best is trial 1025 with value: 0.41844370194907604.
[I 2024-12-04 15:15:12,927] Trial 1172 finished with value: 0.765857940682607 and parameters: {'n_estimators': 260, 'max_depth': 42, 'min_samples_split': 37, 'min_samples_leaf': 3, 'max_features': 'sqrt', 'bootstrap': False, 'criterion': 'absolute_error'}. Best is trial 1025 with value: 0.41844370194907604.
[I 2024-12-04 15:15:17,526] Trial 1153 finished with value: 0.42084018424974484 and parameters: {'n_estimators': 992, 'max_depth': 35, 'min_samples_split': 2, 'min_samples_leaf': 1, 'max_features': None, 'bootstrap': True, 'criterion': 'squared_error'}. Best is trial 1025 with value: 0.41844370194907604.
[I 2024-12-04 15:15:18,223] Trial 1158 finished with value: 0.4201745020250664 and parameters: {'n_estimators': 869, 'max_depth': 38, 'min_samples_split': 2, 'min_samples_leaf': 1, 'max_features': None, 'bootstrap': True, 'criterion': 'squared_error'}. Best is trial 1025 with value: 0.41844370194907604.
[I 2024-12-04 15:15:18,453] Trial 1156 finished with value: 0.42121123715752273 and parameters: {'n_estimators': 839, 'max_depth': 42, 'min_samples_split': 2, 'min_samples_leaf': 1, 'max_features': None, 'bootstrap': True, 'criterion': 'squared_error'}. Best is trial 1025 with value: 0.41844370194907604.
[I 2024-12-04 15:15:18,979] Trial 1164 finished with value: 0.5868982141566935 and parameters: {'n_estimators': 120, 'max_depth': 30, 'min_samples_split': 17, 'min_samples_leaf': 1, 'max_features': None, 'bootstrap': False, 'criterion': 'absolute_error'}. Best is trial 1025 with value: 0.41844370194907604.
[I 2024-12-04 15:15:22,553] Trial 1171 finished with value: 0.5799383253841387 and parameters: {'n_estimators': 981, 'max_depth': 47, 'min_samples_split': 2, 'min_samples_leaf': 1, 'max_features': 'log2', 'bootstrap': False, 'criterion': 'squared_error'}. Best is trial 1025 with value: 0.41844370194907604.
[I 2024-12-04 15:15:24,415] Trial 1157 finished with value: 0.4655235970294185 and parameters: {'n_estimators': 804, 'max_depth': 30, 'min_samples_split': 4, 'min_samples_leaf': 2, 'max_features': None, 'bootstrap': True, 'criterion': 'squared_error'}. Best is trial 1025 with value: 0.41844370194907604.
[I 2024-12-04 15:15:24,765] Trial 1163 finished with value: 0.46528543833877234 and parameters: {'n_estimators': 754, 'max_depth': 50, 'min_samples_split': 2, 'min_samples_leaf': 2, 'max_features': None, 'bootstrap': True, 'criterion': 'squared_error'}. Best is trial 1025 with value: 0.41844370194907604.
[I 2024-12-04 15:15:25,934] Trial 1168 finished with value: 0.4319280970309956 and parameters: {'n_estimators': 666, 'max_depth': 41, 'min_samples_split': 4, 'min_samples_leaf': 1, 'max_features': None, 'bootstrap': True, 'criterion': 'squared_error'}. Best is trial 1025 with value: 0.41844370194907604.
[I 2024-12-04 15:15:27,566] Trial 1179 finished with value: 0.6129554837298182 and parameters: {'n_estimators': 775, 'max_depth': 37, 'min_samples_split': 2, 'min_samples_leaf': 2, 'max_features': None, 'bootstrap': False, 'criterion': 'squared_error'}. Best is trial 1025 with value: 0.41844370194907604.
[I 2024-12-04 15:15:27,567] Trial 1118 finished with value: 0.42712546319860034 and parameters: {'n_estimators': 813, 'max_depth': 45, 'min_samples_split': 2, 'min_samples_leaf': 1, 'max_features': None, 'bootstrap': True, 'criterion': 'absolute_error'}. Best is trial 1025 with value: 0.41844370194907604.
[I 2024-12-04 15:15:27,829] Trial 1162 finished with value: 0.4221236730616941 and parameters: {'n_estimators': 665, 'max_depth': 42, 'min_samples_split': 2, 'min_samples_leaf': 1, 'max_features': None, 'bootstrap': True, 'criterion': 'squared_error'}. Best is trial 1025 with value: 0.41844370194907604.
[I 2024-12-04 15:15:29,137] Trial 1161 finished with value: 0.4313762332650758 and parameters: {'n_estimators': 840, 'max_depth': 42, 'min_samples_split': 4, 'min_samples_leaf': 1, 'max_features': None, 'bootstrap': True, 'criterion': 'squared_error'}. Best is trial 1025 with value: 0.41844370194907604.
[I 2024-12-04 15:15:30,150] Trial 1173 finished with value: 0.4238231722827509 and parameters: {'n_estimators': 568, 'max_depth': 35, 'min_samples_split': 2, 'min_samples_leaf': 1, 'max_features': None, 'bootstrap': True, 'criterion': 'squared_error'}. Best is trial 1025 with value: 0.41844370194907604.
[I 2024-12-04 15:15:30,560] Trial 1160 finished with value: 0.4652736082442124 and parameters: {'n_estimators': 999, 'max_depth': 42, 'min_samples_split': 2, 'min_samples_leaf': 2, 'max_features': None, 'bootstrap': True, 'criterion': 'squared_error'}. Best is trial 1025 with value: 0.41844370194907604.
[I 2024-12-04 15:15:31,149] Trial 1182 finished with value: 0.9897058807690307 and parameters: {'n_estimators': 550, 'max_depth': 47, 'min_samples_split': 7, 'min_samples_leaf': 11, 'max_features': 'sqrt', 'bootstrap': False, 'criterion': 'absolute_error'}. Best is trial 1025 with value: 0.41844370194907604.
[I 2024-12-04 15:15:34,960] Trial 1165 finished with value: 0.42158009647200095 and parameters: {'n_estimators': 856, 'max_depth': 46, 'min_samples_split': 2, 'min_samples_leaf': 1, 'max_features': None, 'bootstrap': True, 'criterion': 'squared_error'}. Best is trial 1025 with value: 0.41844370194907604.
[I 2024-12-04 15:15:35,741] Trial 1170 finished with value: 0.41969586319682295 and parameters: {'n_estimators': 688, 'max_depth': 41, 'min_samples_split': 2, 'min_samples_leaf': 1, 'max_features': None, 'bootstrap': True, 'criterion': 'squared_error'}. Best is trial 1025 with value: 0.41844370194907604.
[I 2024-12-04 15:15:36,403] Trial 1178 finished with value: 0.4266733903802489 and parameters: {'n_estimators': 689, 'max_depth': 31, 'min_samples_split': 3, 'min_samples_leaf': 1, 'max_features': None, 'bootstrap': True, 'criterion': 'squared_error'}. Best is trial 1025 with value: 0.41844370194907604.
[I 2024-12-04 15:15:37,722] Trial 1167 finished with value: 0.4208770448742799 and parameters: {'n_estimators': 825, 'max_depth': 37, 'min_samples_split': 2, 'min_samples_leaf': 1, 'max_features': None, 'bootstrap': True, 'criterion': 'squared_error'}. Best is trial 1025 with value: 0.41844370194907604.
[I 2024-12-04 15:15:38,530] Trial 1177 finished with value: 0.464854228182384 and parameters: {'n_estimators': 636, 'max_depth': 40, 'min_samples_split': 2, 'min_samples_leaf': 2, 'max_features': None, 'bootstrap': True, 'criterion': 'squared_error'}. Best is trial 1025 with value: 0.41844370194907604.
[I 2024-12-04 15:15:38,938] Trial 1166 finished with value: 0.42378226052723744 and parameters: {'n_estimators': 750, 'max_depth': 26, 'min_samples_split': 2, 'min_samples_leaf': 1, 'max_features': None, 'bootstrap': True, 'criterion': 'squared_error'}. Best is trial 1025 with value: 0.41844370194907604.
[I 2024-12-04 15:15:38,956] Trial 1176 finished with value: 0.4655453880966349 and parameters: {'n_estimators': 802, 'max_depth': 43, 'min_samples_split': 3, 'min_samples_leaf': 2, 'max_features': None, 'bootstrap': True, 'criterion': 'squared_error'}. Best is trial 1025 with value: 0.41844370194907604.
[I 2024-12-04 15:15:41,851] Trial 1175 finished with value: 0.4645979097096187 and parameters: {'n_estimators': 882, 'max_depth': 44, 'min_samples_split': 3, 'min_samples_leaf': 2, 'max_features': None, 'bootstrap': True, 'criterion': 'squared_error'}. Best is trial 1025 with value: 0.41844370194907604.
[I 2024-12-04 15:15:42,068] Trial 1194 finished with value: 0.8763530335949029 and parameters: {'n_estimators': 155, 'max_depth': 7, 'min_samples_split': 22, 'min_samples_leaf': 1, 'max_features': 'sqrt', 'bootstrap': False, 'criterion': 'squared_error'}. Best is trial 1025 with value: 0.41844370194907604.
[I 2024-12-04 15:15:42,358] Trial 1181 finished with value: 0.9566952172563643 and parameters: {'n_estimators': 988, 'max_depth': 45, 'min_samples_split': 3, 'min_samples_leaf': 2, 'max_features': 'log2', 'bootstrap': True, 'criterion': 'squared_error'}. Best is trial 1025 with value: 0.41844370194907604.
[I 2024-12-04 15:15:43,067] Trial 1169 finished with value: 0.41923932368419464 and parameters: {'n_estimators': 998, 'max_depth': 39, 'min_samples_split': 2, 'min_samples_leaf': 1, 'max_features': None, 'bootstrap': True, 'criterion': 'squared_error'}. Best is trial 1025 with value: 0.41844370194907604.
[I 2024-12-04 15:15:44,167] Trial 1180 finished with value: 0.4648373520055922 and parameters: {'n_estimators': 893, 'max_depth': 36, 'min_samples_split': 4, 'min_samples_leaf': 2, 'max_features': None, 'bootstrap': True, 'criterion': 'squared_error'}. Best is trial 1025 with value: 0.41844370194907604.
[I 2024-12-04 15:15:44,287] Trial 1184 finished with value: 0.5247454757565915 and parameters: {'n_estimators': 812, 'max_depth': 37, 'min_samples_split': 2, 'min_samples_leaf': 1, 'max_features': 'sqrt', 'bootstrap': True, 'criterion': 'squared_error'}. Best is trial 1025 with value: 0.41844370194907604.
[I 2024-12-04 15:15:46,467] Trial 1119 finished with value: 0.42992642133341125 and parameters: {'n_estimators': 961, 'max_depth': 39, 'min_samples_split': 2, 'min_samples_leaf': 1, 'max_features': None, 'bootstrap': True, 'criterion': 'absolute_error'}. Best is trial 1025 with value: 0.41844370194907604.
[I 2024-12-04 15:15:47,474] Trial 1185 finished with value: 0.4189135616555715 and parameters: {'n_estimators': 851, 'max_depth': 40, 'min_samples_split': 2, 'min_samples_leaf': 1, 'max_features': None, 'bootstrap': True, 'criterion': 'squared_error'}. Best is trial 1025 with value: 0.41844370194907604.
[I 2024-12-04 15:15:49,589] Trial 1183 finished with value: 0.4211989219639266 and parameters: {'n_estimators': 791, 'max_depth': 37, 'min_samples_split': 2, 'min_samples_leaf': 1, 'max_features': None, 'bootstrap': True, 'criterion': 'squared_error'}. Best is trial 1025 with value: 0.41844370194907604.
[I 2024-12-04 15:15:55,176] Trial 1186 finished with value: 0.42169710132095767 and parameters: {'n_estimators': 788, 'max_depth': 44, 'min_samples_split': 2, 'min_samples_leaf': 1, 'max_features': None, 'bootstrap': True, 'criterion': 'squared_error'}. Best is trial 1025 with value: 0.41844370194907604.
[I 2024-12-04 15:15:55,207] Trial 1174 finished with value: 0.4615567094813117 and parameters: {'n_estimators': 606, 'max_depth': 37, 'min_samples_split': 3, 'min_samples_leaf': 2, 'max_features': None, 'bootstrap': True, 'criterion': 'absolute_error'}. Best is trial 1025 with value: 0.41844370194907604.
[I 2024-12-04 15:15:56,322] Trial 1189 finished with value: 0.431963578344142 and parameters: {'n_estimators': 809, 'max_depth': 43, 'min_samples_split': 4, 'min_samples_leaf': 1, 'max_features': None, 'bootstrap': True, 'criterion': 'squared_error'}. Best is trial 1025 with value: 0.41844370194907604.
[I 2024-12-04 15:15:57,963] Trial 1188 finished with value: 0.4237186854725482 and parameters: {'n_estimators': 833, 'max_depth': 37, 'min_samples_split': 3, 'min_samples_leaf': 1, 'max_features': None, 'bootstrap': True, 'criterion': 'squared_error'}. Best is trial 1025 with value: 0.41844370194907604.
[I 2024-12-04 15:15:57,964] Trial 1196 finished with value: 0.6948411990771995 and parameters: {'n_estimators': 104, 'max_depth': 25, 'min_samples_split': 4, 'min_samples_leaf': 7, 'max_features': None, 'bootstrap': False, 'criterion': 'absolute_error'}. Best is trial 1025 with value: 0.41844370194907604.
[I 2024-12-04 15:16:00,810] Trial 1190 finished with value: 0.4252721164318757 and parameters: {'n_estimators': 817, 'max_depth': 33, 'min_samples_split': 3, 'min_samples_leaf': 1, 'max_features': None, 'bootstrap': True, 'criterion': 'squared_error'}. Best is trial 1025 with value: 0.41844370194907604.
[I 2024-12-04 15:16:00,900] Trial 1206 finished with value: 0.811136813235175 and parameters: {'n_estimators': 297, 'max_depth': 11, 'min_samples_split': 3, 'min_samples_leaf': 2, 'max_features': 'sqrt', 'bootstrap': False, 'criterion': 'squared_error'}. Best is trial 1025 with value: 0.41844370194907604.
[I 2024-12-04 15:16:04,299] Trial 1191 finished with value: 0.42341461343859 and parameters: {'n_estimators': 465, 'max_depth': 46, 'min_samples_split': 2, 'min_samples_leaf': 1, 'max_features': None, 'bootstrap': True, 'criterion': 'squared_error'}. Best is trial 1025 with value: 0.41844370194907604.
[I 2024-12-04 15:16:04,733] Trial 1192 finished with value: 0.46554153206200694 and parameters: {'n_estimators': 809, 'max_depth': 33, 'min_samples_split': 2, 'min_samples_leaf': 2, 'max_features': None, 'bootstrap': True, 'criterion': 'squared_error'}. Best is trial 1025 with value: 0.41844370194907604.
[I 2024-12-04 15:16:09,178] Trial 1201 finished with value: 0.5127863291770248 and parameters: {'n_estimators': 885, 'max_depth': 49, 'min_samples_split': 3, 'min_samples_leaf': 1, 'max_features': None, 'bootstrap': False, 'criterion': 'squared_error'}. Best is trial 1025 with value: 0.41844370194907604.
[I 2024-12-04 15:16:13,880] Trial 1210 finished with value: 1.0378641367778618 and parameters: {'n_estimators': 484, 'max_depth': 5, 'min_samples_split': 20, 'min_samples_leaf': 5, 'max_features': 'log2', 'bootstrap': False, 'criterion': 'absolute_error'}. Best is trial 1025 with value: 0.41844370194907604.
[I 2024-12-04 15:16:14,768] Trial 1187 finished with value: 0.425071281068197 and parameters: {'n_estimators': 664, 'max_depth': 47, 'min_samples_split': 3, 'min_samples_leaf': 1, 'max_features': None, 'bootstrap': True, 'criterion': 'squared_error'}. Best is trial 1025 with value: 0.41844370194907604.
[I 2024-12-04 15:16:15,415] Trial 1213 finished with value: 1.027574766431222 and parameters: {'n_estimators': 199, 'max_depth': 28, 'min_samples_split': 3, 'min_samples_leaf': 11, 'max_features': 'sqrt', 'bootstrap': True, 'criterion': 'absolute_error'}. Best is trial 1025 with value: 0.41844370194907604.
[I 2024-12-04 15:16:17,401] Trial 1214 finished with value: 1.048758789423756 and parameters: {'n_estimators': 291, 'max_depth': 7, 'min_samples_split': 3, 'min_samples_leaf': 9, 'max_features': 'log2', 'bootstrap': False, 'criterion': 'absolute_error'}. Best is trial 1025 with value: 0.41844370194907604.
[I 2024-12-04 15:16:17,944] Trial 1195 finished with value: 0.5282040974661559 and parameters: {'n_estimators': 1000, 'max_depth': 41, 'min_samples_split': 2, 'min_samples_leaf': 1, 'max_features': None, 'bootstrap': False, 'criterion': 'squared_error'}. Best is trial 1025 with value: 0.41844370194907604.
[I 2024-12-04 15:16:18,253] Trial 1193 finished with value: 0.42152152523340636 and parameters: {'n_estimators': 716, 'max_depth': 42, 'min_samples_split': 2, 'min_samples_leaf': 1, 'max_features': None, 'bootstrap': True, 'criterion': 'squared_error'}. Best is trial 1025 with value: 0.41844370194907604.
[I 2024-12-04 15:16:19,298] Trial 1217 finished with value: 1.0680183953564841 and parameters: {'n_estimators': 652, 'max_depth': 23, 'min_samples_split': 2, 'min_samples_leaf': 10, 'max_features': 'log2', 'bootstrap': False, 'criterion': 'squared_error'}. Best is trial 1025 with value: 0.41844370194907604.
[I 2024-12-04 15:16:23,150] Trial 1215 finished with value: 0.5603342992360424 and parameters: {'n_estimators': 585, 'max_depth': 28, 'min_samples_split': 6, 'min_samples_leaf': 1, 'max_features': None, 'bootstrap': False, 'criterion': 'squared_error'}. Best is trial 1025 with value: 0.41844370194907604.
[I 2024-12-04 15:16:23,462] Trial 1199 finished with value: 0.549531465808477 and parameters: {'n_estimators': 786, 'max_depth': 35, 'min_samples_split': 2, 'min_samples_leaf': 1, 'max_features': 'sqrt', 'bootstrap': False, 'criterion': 'absolute_error'}. Best is trial 1025 with value: 0.41844370194907604.
[I 2024-12-04 15:16:27,489] Trial 1204 finished with value: 0.4193886172300017 and parameters: {'n_estimators': 856, 'max_depth': 39, 'min_samples_split': 2, 'min_samples_leaf': 1, 'max_features': None, 'bootstrap': True, 'criterion': 'squared_error'}. Best is trial 1025 with value: 0.41844370194907604.
[I 2024-12-04 15:16:30,849] Trial 1205 finished with value: 0.4212298766908909 and parameters: {'n_estimators': 845, 'max_depth': 35, 'min_samples_split': 2, 'min_samples_leaf': 1, 'max_features': None, 'bootstrap': True, 'criterion': 'squared_error'}. Best is trial 1025 with value: 0.41844370194907604.
[I 2024-12-04 15:16:32,856] Trial 1198 finished with value: 0.4212052819605655 and parameters: {'n_estimators': 879, 'max_depth': 47, 'min_samples_split': 2, 'min_samples_leaf': 1, 'max_features': None, 'bootstrap': True, 'criterion': 'squared_error'}. Best is trial 1025 with value: 0.41844370194907604.
[I 2024-12-04 15:16:35,645] Trial 1209 finished with value: 0.4651142749839809 and parameters: {'n_estimators': 855, 'max_depth': 38, 'min_samples_split': 2, 'min_samples_leaf': 2, 'max_features': None, 'bootstrap': True, 'criterion': 'squared_error'}. Best is trial 1025 with value: 0.41844370194907604.
[I 2024-12-04 15:16:35,653] Trial 1203 finished with value: 0.42364910955426555 and parameters: {'n_estimators': 993, 'max_depth': 39, 'min_samples_split': 3, 'min_samples_leaf': 1, 'max_features': None, 'bootstrap': True, 'criterion': 'squared_error'}. Best is trial 1025 with value: 0.41844370194907604.
[I 2024-12-04 15:16:37,091] Trial 1208 finished with value: 0.420974946025466 and parameters: {'n_estimators': 819, 'max_depth': 43, 'min_samples_split': 2, 'min_samples_leaf': 1, 'max_features': None, 'bootstrap': True, 'criterion': 'squared_error'}. Best is trial 1025 with value: 0.41844370194907604.
[I 2024-12-04 15:16:38,461] Trial 1212 finished with value: 0.6962670351152945 and parameters: {'n_estimators': 930, 'max_depth': 44, 'min_samples_split': 2, 'min_samples_leaf': 2, 'max_features': 'sqrt', 'bootstrap': True, 'criterion': 'squared_error'}. Best is trial 1025 with value: 0.41844370194907604.
[I 2024-12-04 15:16:39,978] Trial 1200 finished with value: 0.42068858352701505 and parameters: {'n_estimators': 992, 'max_depth': 36, 'min_samples_split': 2, 'min_samples_leaf': 1, 'max_features': None, 'bootstrap': True, 'criterion': 'squared_error'}. Best is trial 1025 with value: 0.41844370194907604.
[I 2024-12-04 15:16:41,042] Trial 1207 finished with value: 0.4210982360399379 and parameters: {'n_estimators': 859, 'max_depth': 42, 'min_samples_split': 2, 'min_samples_leaf': 1, 'max_features': None, 'bootstrap': True, 'criterion': 'squared_error'}. Best is trial 1025 with value: 0.41844370194907604.
[I 2024-12-04 15:16:44,084] Trial 1224 finished with value: 1.0086992379894437 and parameters: {'n_estimators': 839, 'max_depth': 44, 'min_samples_split': 14, 'min_samples_leaf': 4, 'max_features': 'log2', 'bootstrap': False, 'criterion': 'absolute_error'}. Best is trial 1025 with value: 0.41844370194907604.
[I 2024-12-04 15:16:46,064] Trial 1211 finished with value: 0.43181546545750005 and parameters: {'n_estimators': 969, 'max_depth': 42, 'min_samples_split': 4, 'min_samples_leaf': 1, 'max_features': None, 'bootstrap': True, 'criterion': 'squared_error'}. Best is trial 1025 with value: 0.41844370194907604.
[I 2024-12-04 15:16:47,095] Trial 1202 finished with value: 0.5244001074790187 and parameters: {'n_estimators': 428, 'max_depth': 13, 'min_samples_split': 3, 'min_samples_leaf': 1, 'max_features': None, 'bootstrap': True, 'criterion': 'absolute_error'}. Best is trial 1025 with value: 0.41844370194907604.
[I 2024-12-04 15:16:48,967] Trial 1222 finished with value: 0.4648566577817491 and parameters: {'n_estimators': 900, 'max_depth': 41, 'min_samples_split': 2, 'min_samples_leaf': 2, 'max_features': None, 'bootstrap': True, 'criterion': 'squared_error'}. Best is trial 1025 with value: 0.41844370194907604.
[I 2024-12-04 15:16:49,597] Trial 1216 finished with value: 0.41926496411586256 and parameters: {'n_estimators': 883, 'max_depth': 40, 'min_samples_split': 2, 'min_samples_leaf': 1, 'max_features': None, 'bootstrap': True, 'criterion': 'squared_error'}. Best is trial 1025 with value: 0.41844370194907604.
[I 2024-12-04 15:16:49,628] Trial 1232 finished with value: 0.5857081368098076 and parameters: {'n_estimators': 517, 'max_depth': 14, 'min_samples_split': 14, 'min_samples_leaf': 1, 'max_features': None, 'bootstrap': False, 'criterion': 'squared_error'}. Best is trial 1025 with value: 0.41844370194907604.
[I 2024-12-04 15:16:51,276] Trial 1219 finished with value: 0.42039424769526407 and parameters: {'n_estimators': 771, 'max_depth': 31, 'min_samples_split': 2, 'min_samples_leaf': 1, 'max_features': None, 'bootstrap': True, 'criterion': 'squared_error'}. Best is trial 1025 with value: 0.41844370194907604.
[I 2024-12-04 15:16:52,252] Trial 1220 finished with value: 0.4211992242576256 and parameters: {'n_estimators': 842, 'max_depth': 42, 'min_samples_split': 2, 'min_samples_leaf': 1, 'max_features': None, 'bootstrap': True, 'criterion': 'squared_error'}. Best is trial 1025 with value: 0.41844370194907604.
