[I 2024-12-04 15:09:18,950] Trial 1334 finished with value: 0.642577440022226 and parameters: {'n_estimators': 1314, 'learning_rate': 0.0335262933825084, 'max_depth': 10, 'min_samples_split': 16, 'min_samples_leaf': 2, 'subsample': 0.991315042752361, 'max_features': None}. Best is trial 603 with value: 0.45955205541891275.
[I 2024-12-04 15:09:19,194] Trial 1341 finished with value: 0.6424172583067824 and parameters: {'n_estimators': 1034, 'learning_rate': 0.05388499307762711, 'max_depth': 10, 'min_samples_split': 17, 'min_samples_leaf': 2, 'subsample': 0.9922590002431525, 'max_features': None}. Best is trial 603 with value: 0.45955205541891275.
[I 2024-12-04 15:09:19,884] Trial 1338 finished with value: 0.46034230394978587 and parameters: {'n_estimators': 1225, 'learning_rate': 0.0551366708387292, 'max_depth': 12, 'min_samples_split': 20, 'min_samples_leaf': 1, 'subsample': 0.9860954116937191, 'max_features': None}. Best is trial 603 with value: 0.45955205541891275.
[I 2024-12-04 15:09:20,479] Trial 1352 finished with value: 0.7648227952092587 and parameters: {'n_estimators': 880, 'learning_rate': 0.08808006554236536, 'max_depth': 6, 'min_samples_split': 6, 'min_samples_leaf': 9, 'subsample': 0.7007064191409837, 'max_features': 'log2'}. Best is trial 603 with value: 0.45955205541891275.
[I 2024-12-04 15:09:22,165] Trial 1348 finished with value: 0.661117468866662 and parameters: {'n_estimators': 923, 'learning_rate': 0.09541383265673598, 'max_depth': 10, 'min_samples_split': 11, 'min_samples_leaf': 4, 'subsample': 0.9629374712211743, 'max_features': None}. Best is trial 603 with value: 0.45955205541891275.
[I 2024-12-04 15:09:22,188] Trial 1370 finished with value: 0.93646216931064 and parameters: {'n_estimators': 308, 'learning_rate': 0.04383139391044386, 'max_depth': 9, 'min_samples_split': 13, 'min_samples_leaf': 7, 'subsample': 0.8471965783621334, 'max_features': 'log2'}. Best is trial 603 with value: 0.45955205541891275.
[I 2024-12-04 15:09:24,601] Trial 1347 finished with value: 0.6311676915768283 and parameters: {'n_estimators': 980, 'learning_rate': 0.06737655214609514, 'max_depth': 12, 'min_samples_split': 20, 'min_samples_leaf': 3, 'subsample': 0.9964369914950024, 'max_features': None}. Best is trial 603 with value: 0.45955205541891275.
[I 2024-12-04 15:09:24,825] Trial 1345 finished with value: 0.6531675454564999 and parameters: {'n_estimators': 1110, 'learning_rate': 0.09293642245043846, 'max_depth': 11, 'min_samples_split': 20, 'min_samples_leaf': 2, 'subsample': 0.9906422796731187, 'max_features': None}. Best is trial 603 with value: 0.45955205541891275.
[I 2024-12-04 15:09:25,096] Trial 1343 finished with value: 0.48894908091787587 and parameters: {'n_estimators': 1140, 'learning_rate': 0.048791455213837355, 'max_depth': 10, 'min_samples_split': 20, 'min_samples_leaf': 1, 'subsample': 0.9998311218512399, 'max_features': None}. Best is trial 603 with value: 0.45955205541891275.
[I 2024-12-04 15:09:27,593] Trial 1354 finished with value: 0.620016357568095 and parameters: {'n_estimators': 980, 'learning_rate': 0.049535776147025694, 'max_depth': 11, 'min_samples_split': 17, 'min_samples_leaf': 2, 'subsample': 0.9990864601338878, 'max_features': 'sqrt'}. Best is trial 603 with value: 0.45955205541891275.
[I 2024-12-04 15:09:27,926] Trial 1351 finished with value: 0.6357058232593463 and parameters: {'n_estimators': 1147, 'learning_rate': 0.03538644453795715, 'max_depth': 8, 'min_samples_split': 20, 'min_samples_leaf': 4, 'subsample': 0.9220445605659665, 'max_features': 'log2'}. Best is trial 603 with value: 0.45955205541891275.
[I 2024-12-04 15:09:29,701] Trial 1340 finished with value: 0.5099765886912438 and parameters: {'n_estimators': 1483, 'learning_rate': 0.03494037741393359, 'max_depth': 11, 'min_samples_split': 15, 'min_samples_leaf': 1, 'subsample': 0.822269557896868, 'max_features': None}. Best is trial 603 with value: 0.45955205541891275.
[I 2024-12-04 15:09:31,537] Trial 1353 finished with value: 0.6312050637795802 and parameters: {'n_estimators': 1005, 'learning_rate': 0.09218935049763366, 'max_depth': 12, 'min_samples_split': 20, 'min_samples_leaf': 2, 'subsample': 0.9605170395717285, 'max_features': None}. Best is trial 603 with value: 0.45955205541891275.
[I 2024-12-04 15:09:31,588] Trial 1349 finished with value: 0.66478564400265 and parameters: {'n_estimators': 1361, 'learning_rate': 0.04417896869130298, 'max_depth': 8, 'min_samples_split': 18, 'min_samples_leaf': 3, 'subsample': 0.9819746453640416, 'max_features': 'sqrt'}. Best is trial 603 with value: 0.45955205541891275.
[I 2024-12-04 15:09:32,410] Trial 1342 finished with value: 0.4661519825696783 and parameters: {'n_estimators': 1389, 'learning_rate': 0.09276017099659441, 'max_depth': 12, 'min_samples_split': 19, 'min_samples_leaf': 1, 'subsample': 0.9905781411400745, 'max_features': None}. Best is trial 603 with value: 0.45955205541891275.
[I 2024-12-04 15:09:35,368] Trial 1371 finished with value: 0.560923289247317 and parameters: {'n_estimators': 584, 'learning_rate': 0.011490521149935087, 'max_depth': 12, 'min_samples_split': 4, 'min_samples_leaf': 4, 'subsample': 0.6969835073962392, 'max_features': None}. Best is trial 603 with value: 0.45955205541891275.
[I 2024-12-04 15:09:36,255] Trial 1365 finished with value: 0.6734649279200703 and parameters: {'n_estimators': 848, 'learning_rate': 0.06876557186763457, 'max_depth': 6, 'min_samples_split': 10, 'min_samples_leaf': 8, 'subsample': 0.8281890260535335, 'max_features': None}. Best is trial 603 with value: 0.45955205541891275.
[I 2024-12-04 15:09:38,703] Trial 1355 finished with value: 0.4808450396097171 and parameters: {'n_estimators': 1152, 'learning_rate': 0.05151313362090822, 'max_depth': 12, 'min_samples_split': 20, 'min_samples_leaf': 1, 'subsample': 0.9498893787325753, 'max_features': None}. Best is trial 603 with value: 0.45955205541891275.
[I 2024-12-04 15:09:39,504] Trial 1367 finished with value: 0.5865908282078718 and parameters: {'n_estimators': 919, 'learning_rate': 0.015762225049450563, 'max_depth': 7, 'min_samples_split': 12, 'min_samples_leaf': 5, 'subsample': 0.6326988455811904, 'max_features': None}. Best is trial 603 with value: 0.45955205541891275.
[I 2024-12-04 15:09:40,471] Trial 1357 finished with value: 0.6223879183062888 and parameters: {'n_estimators': 1125, 'learning_rate': 0.06037330045728322, 'max_depth': 12, 'min_samples_split': 18, 'min_samples_leaf': 2, 'subsample': 0.9989513346066965, 'max_features': None}. Best is trial 603 with value: 0.45955205541891275.
[I 2024-12-04 15:09:40,549] Trial 1382 finished with value: 0.5974454432259494 and parameters: {'n_estimators': 385, 'learning_rate': 0.05910028080798506, 'max_depth': 12, 'min_samples_split': 15, 'min_samples_leaf': 1, 'subsample': 0.976981218680416, 'max_features': 'log2'}. Best is trial 603 with value: 0.45955205541891275.
[I 2024-12-04 15:09:43,529] Trial 1361 finished with value: 0.4842320443666244 and parameters: {'n_estimators': 1094, 'learning_rate': 0.0772276150177963, 'max_depth': 12, 'min_samples_split': 20, 'min_samples_leaf': 1, 'subsample': 0.9764343099923641, 'max_features': None}. Best is trial 603 with value: 0.45955205541891275.
[I 2024-12-04 15:09:46,712] Trial 1364 finished with value: 0.5105025451760253 and parameters: {'n_estimators': 1102, 'learning_rate': 0.046351983203932266, 'max_depth': 12, 'min_samples_split': 15, 'min_samples_leaf': 1, 'subsample': 0.93591023200864, 'max_features': None}. Best is trial 603 with value: 0.45955205541891275.
[I 2024-12-04 15:09:46,714] Trial 1356 finished with value: 0.6464928678556138 and parameters: {'n_estimators': 1417, 'learning_rate': 0.037229766592322557, 'max_depth': 12, 'min_samples_split': 14, 'min_samples_leaf': 2, 'subsample': 0.9470272699209025, 'max_features': None}. Best is trial 603 with value: 0.45955205541891275.
[I 2024-12-04 15:09:47,592] Trial 1369 finished with value: 0.5554384228572937 and parameters: {'n_estimators': 1295, 'learning_rate': 0.04252801578316124, 'max_depth': 6, 'min_samples_split': 9, 'min_samples_leaf': 1, 'subsample': 0.7321724848622733, 'max_features': 'sqrt'}. Best is trial 603 with value: 0.45955205541891275.
[I 2024-12-04 15:09:47,593] Trial 1362 finished with value: 0.5836596382372654 and parameters: {'n_estimators': 1296, 'learning_rate': 0.021771522695702157, 'max_depth': 12, 'min_samples_split': 2, 'min_samples_leaf': 4, 'subsample': 0.774034584053042, 'max_features': None}. Best is trial 603 with value: 0.45955205541891275.
[I 2024-12-04 15:09:48,352] Trial 1359 finished with value: 0.4911325934393448 and parameters: {'n_estimators': 1367, 'learning_rate': 0.022171298742168274, 'max_depth': 12, 'min_samples_split': 20, 'min_samples_leaf': 1, 'subsample': 0.8601621112571539, 'max_features': None}. Best is trial 603 with value: 0.45955205541891275.
[I 2024-12-04 15:09:48,479] Trial 1360 finished with value: 0.47212864208808925 and parameters: {'n_estimators': 1261, 'learning_rate': 0.04208018323085353, 'max_depth': 12, 'min_samples_split': 19, 'min_samples_leaf': 1, 'subsample': 0.9976586580956788, 'max_features': None}. Best is trial 603 with value: 0.45955205541891275.
[I 2024-12-04 15:09:48,660] Trial 1388 finished with value: 0.6793078716884543 and parameters: {'n_estimators': 463, 'learning_rate': 0.043907281832981516, 'max_depth': 4, 'min_samples_split': 19, 'min_samples_leaf': 8, 'subsample': 0.9319738504046009, 'max_features': 'sqrt'}. Best is trial 603 with value: 0.45955205541891275.
[I 2024-12-04 15:09:49,780] Trial 1372 finished with value: 0.5278186479068229 and parameters: {'n_estimators': 1174, 'learning_rate': 0.09831595292991151, 'max_depth': 10, 'min_samples_split': 16, 'min_samples_leaf': 1, 'subsample': 0.9963303783812182, 'max_features': 'sqrt'}. Best is trial 603 with value: 0.45955205541891275.
[I 2024-12-04 15:09:50,207] Trial 1393 finished with value: 0.6412037262566103 and parameters: {'n_estimators': 174, 'learning_rate': 0.0281615402385169, 'max_depth': 10, 'min_samples_split': 20, 'min_samples_leaf': 7, 'subsample': 0.959266610383522, 'max_features': None}. Best is trial 603 with value: 0.45955205541891275.
[I 2024-12-04 15:09:52,454] Trial 1368 finished with value: 0.48936288455692617 and parameters: {'n_estimators': 1157, 'learning_rate': 0.09358215828061475, 'max_depth': 12, 'min_samples_split': 17, 'min_samples_leaf': 1, 'subsample': 0.9930280562131655, 'max_features': None}. Best is trial 603 with value: 0.45955205541891275.
[I 2024-12-04 15:09:54,494] Trial 1358 finished with value: 0.4901348332389987 and parameters: {'n_estimators': 1492, 'learning_rate': 0.03754941616289869, 'max_depth': 10, 'min_samples_split': 18, 'min_samples_leaf': 1, 'subsample': 0.988861522066072, 'max_features': None}. Best is trial 603 with value: 0.45955205541891275.
[I 2024-12-04 15:09:55,277] Trial 1377 finished with value: 0.5761390543081384 and parameters: {'n_estimators': 1101, 'learning_rate': 0.056049248554343775, 'max_depth': 12, 'min_samples_split': 20, 'min_samples_leaf': 1, 'subsample': 0.9821447166717441, 'max_features': 'log2'}. Best is trial 603 with value: 0.45955205541891275.
[I 2024-12-04 15:09:55,531] Trial 1363 finished with value: 0.47987665788605943 and parameters: {'n_estimators': 1418, 'learning_rate': 0.04404729195807211, 'max_depth': 11, 'min_samples_split': 20, 'min_samples_leaf': 1, 'subsample': 0.9653988044089873, 'max_features': None}. Best is trial 603 with value: 0.45955205541891275.
[I 2024-12-04 15:09:56,527] Trial 1376 finished with value: 0.6413786666123487 and parameters: {'n_estimators': 1044, 'learning_rate': 0.06363969934768793, 'max_depth': 10, 'min_samples_split': 19, 'min_samples_leaf': 3, 'subsample': 0.9530186080089915, 'max_features': None}. Best is trial 603 with value: 0.45955205541891275.
[I 2024-12-04 15:09:57,281] Trial 1373 finished with value: 0.4781556158392129 and parameters: {'n_estimators': 1071, 'learning_rate': 0.049961645156401224, 'max_depth': 12, 'min_samples_split': 20, 'min_samples_leaf': 1, 'subsample': 0.9953217115396092, 'max_features': None}. Best is trial 603 with value: 0.45955205541891275.
[I 2024-12-04 15:09:57,690] Trial 1366 finished with value: 0.6137597678583232 and parameters: {'n_estimators': 1409, 'learning_rate': 0.045363802517207945, 'max_depth': 12, 'min_samples_split': 17, 'min_samples_leaf': 2, 'subsample': 0.9985291799295991, 'max_features': None}. Best is trial 603 with value: 0.45955205541891275.
[I 2024-12-04 15:09:58,564] Trial 1375 finished with value: 0.6306290485569084 and parameters: {'n_estimators': 1413, 'learning_rate': 0.011305197676759348, 'max_depth': 10, 'min_samples_split': 17, 'min_samples_leaf': 3, 'subsample': 0.6896880492270957, 'max_features': 'sqrt'}. Best is trial 603 with value: 0.45955205541891275.
[I 2024-12-04 15:10:00,941] Trial 1374 finished with value: 0.4843937743426928 and parameters: {'n_estimators': 1169, 'learning_rate': 0.06127837462567459, 'max_depth': 11, 'min_samples_split': 20, 'min_samples_leaf': 1, 'subsample': 0.992710886378824, 'max_features': None}. Best is trial 603 with value: 0.45955205541891275.
[I 2024-12-04 15:10:01,459] Trial 1379 finished with value: 0.6175790202232034 and parameters: {'n_estimators': 1083, 'learning_rate': 0.04061887608402168, 'max_depth': 11, 'min_samples_split': 20, 'min_samples_leaf': 3, 'subsample': 0.9743812692891399, 'max_features': None}. Best is trial 603 with value: 0.45955205541891275.
[I 2024-12-04 15:10:01,754] Trial 1390 finished with value: 0.6385886074466671 and parameters: {'n_estimators': 797, 'learning_rate': 0.04575541132973153, 'max_depth': 10, 'min_samples_split': 4, 'min_samples_leaf': 3, 'subsample': 0.666440470419526, 'max_features': 'log2'}. Best is trial 603 with value: 0.45955205541891275.
[I 2024-12-04 15:10:02,411] Trial 1384 finished with value: 0.4823166990500435 and parameters: {'n_estimators': 972, 'learning_rate': 0.08746024976509548, 'max_depth': 11, 'min_samples_split': 20, 'min_samples_leaf': 1, 'subsample': 0.9965533817939525, 'max_features': None}. Best is trial 603 with value: 0.45955205541891275.
[I 2024-12-04 15:10:02,658] Trial 1383 finished with value: 0.501153721715332 and parameters: {'n_estimators': 1021, 'learning_rate': 0.04673870696179096, 'max_depth': 12, 'min_samples_split': 16, 'min_samples_leaf': 1, 'subsample': 0.9704964419568467, 'max_features': None}. Best is trial 603 with value: 0.45955205541891275.
[I 2024-12-04 15:10:03,003] Trial 1378 finished with value: 0.4747825457657146 and parameters: {'n_estimators': 1178, 'learning_rate': 0.05359475056084221, 'max_depth': 11, 'min_samples_split': 19, 'min_samples_leaf': 1, 'subsample': 0.9996723836292727, 'max_features': None}. Best is trial 603 with value: 0.45955205541891275.
[I 2024-12-04 15:10:05,744] Trial 1381 finished with value: 0.4788198601568532 and parameters: {'n_estimators': 1163, 'learning_rate': 0.04087420108434212, 'max_depth': 12, 'min_samples_split': 19, 'min_samples_leaf': 1, 'subsample': 0.998457539272695, 'max_features': None}. Best is trial 603 with value: 0.45955205541891275.
[I 2024-12-04 15:10:05,934] Trial 1380 finished with value: 0.7656533601575046 and parameters: {'n_estimators': 1393, 'learning_rate': 0.07134168655770885, 'max_depth': 10, 'min_samples_split': 19, 'min_samples_leaf': 10, 'subsample': 0.6434880152621916, 'max_features': None}. Best is trial 603 with value: 0.45955205541891275.
[I 2024-12-04 15:10:09,429] Trial 1405 finished with value: 0.848466035138975 and parameters: {'n_estimators': 351, 'learning_rate': 0.027220491475866634, 'max_depth': 5, 'min_samples_split': 8, 'min_samples_leaf': 7, 'subsample': 0.6199852096727614, 'max_features': 'sqrt'}. Best is trial 603 with value: 0.45955205541891275.
[I 2024-12-04 15:10:12,155] Trial 1386 finished with value: 0.4693866296871505 and parameters: {'n_estimators': 1209, 'learning_rate': 0.09603386962294605, 'max_depth': 12, 'min_samples_split': 18, 'min_samples_leaf': 1, 'subsample': 0.9822082721866019, 'max_features': None}. Best is trial 603 with value: 0.45955205541891275.
[I 2024-12-04 15:10:13,878] Trial 1387 finished with value: 0.47960098917067934 and parameters: {'n_estimators': 1249, 'learning_rate': 0.07100736058291406, 'max_depth': 12, 'min_samples_split': 17, 'min_samples_leaf': 1, 'subsample': 0.9483602428967963, 'max_features': None}. Best is trial 603 with value: 0.45955205541891275.
[I 2024-12-04 15:10:14,903] Trial 1414 finished with value: 0.8042322301435806 and parameters: {'n_estimators': 206, 'learning_rate': 0.02424582441967218, 'max_depth': 5, 'min_samples_split': 8, 'min_samples_leaf': 4, 'subsample': 0.7976178375684738, 'max_features': 'sqrt'}. Best is trial 603 with value: 0.45955205541891275.
[I 2024-12-04 15:10:16,326] Trial 1389 finished with value: 0.6231899739496278 and parameters: {'n_estimators': 1225, 'learning_rate': 0.0947361778752036, 'max_depth': 12, 'min_samples_split': 20, 'min_samples_leaf': 2, 'subsample': 0.9970473112517496, 'max_features': None}. Best is trial 603 with value: 0.45955205541891275.
[I 2024-12-04 15:10:16,843] Trial 1402 finished with value: 0.9619856860905982 and parameters: {'n_estimators': 839, 'learning_rate': 0.02516631849823588, 'max_depth': 3, 'min_samples_split': 11, 'min_samples_leaf': 10, 'subsample': 0.7918496239855916, 'max_features': 'log2'}. Best is trial 603 with value: 0.45955205541891275.
[I 2024-12-04 15:10:18,776] Trial 1385 finished with value: 0.630154023298557 and parameters: {'n_estimators': 1414, 'learning_rate': 0.03336940255809364, 'max_depth': 12, 'min_samples_split': 20, 'min_samples_leaf': 3, 'subsample': 0.9492460833907571, 'max_features': None}. Best is trial 603 with value: 0.45955205541891275.
[I 2024-12-04 15:10:20,670] Trial 1401 finished with value: 0.5618169563951843 and parameters: {'n_estimators': 1044, 'learning_rate': 0.09025549547839185, 'max_depth': 12, 'min_samples_split': 18, 'min_samples_leaf': 1, 'subsample': 0.901515086654082, 'max_features': 'log2'}. Best is trial 603 with value: 0.45955205541891275.
[I 2024-12-04 15:10:22,007] Trial 1404 finished with value: 0.6715931406726705 and parameters: {'n_estimators': 958, 'learning_rate': 0.02572049075397741, 'max_depth': 11, 'min_samples_split': 20, 'min_samples_leaf': 5, 'subsample': 0.7861675777133996, 'max_features': 'sqrt'}. Best is trial 603 with value: 0.45955205541891275.
[I 2024-12-04 15:10:23,815] Trial 1397 finished with value: 0.5351162857662841 and parameters: {'n_estimators': 950, 'learning_rate': 0.09697369060244493, 'max_depth': 11, 'min_samples_split': 15, 'min_samples_leaf': 1, 'subsample': 0.9959012634567115, 'max_features': None}. Best is trial 603 with value: 0.45955205541891275.
[I 2024-12-04 15:10:24,265] Trial 1392 finished with value: 0.537693422187896 and parameters: {'n_estimators': 1427, 'learning_rate': 0.07876491831736135, 'max_depth': 9, 'min_samples_split': 8, 'min_samples_leaf': 1, 'subsample': 0.6582779462660514, 'max_features': None}. Best is trial 603 with value: 0.45955205541891275.
[I 2024-12-04 15:10:25,353] Trial 1422 finished with value: 0.6108332308539791 and parameters: {'n_estimators': 376, 'learning_rate': 0.033658707021386104, 'max_depth': 8, 'min_samples_split': 16, 'min_samples_leaf': 4, 'subsample': 0.8426083627446498, 'max_features': 'sqrt'}. Best is trial 603 with value: 0.45955205541891275.
[I 2024-12-04 15:10:27,498] Trial 1394 finished with value: 0.48709409315651014 and parameters: {'n_estimators': 1322, 'learning_rate': 0.07929398891335858, 'max_depth': 12, 'min_samples_split': 20, 'min_samples_leaf': 1, 'subsample': 0.9474449727601059, 'max_features': None}. Best is trial 603 with value: 0.45955205541891275.
[I 2024-12-04 15:10:29,336] Trial 1391 finished with value: 0.6387057643540477 and parameters: {'n_estimators': 1494, 'learning_rate': 0.060206447485655845, 'max_depth': 11, 'min_samples_split': 18, 'min_samples_leaf': 2, 'subsample': 0.9928356352656509, 'max_features': None}. Best is trial 603 with value: 0.45955205541891275.
[I 2024-12-04 15:10:29,953] Trial 1408 finished with value: 0.8349616224322415 and parameters: {'n_estimators': 1106, 'learning_rate': 0.066706684033979, 'max_depth': 11, 'min_samples_split': 20, 'min_samples_leaf': 10, 'subsample': 0.9219868201581823, 'max_features': 'log2'}. Best is trial 603 with value: 0.45955205541891275.
[I 2024-12-04 15:10:32,512] Trial 1403 finished with value: 0.5179097372809187 and parameters: {'n_estimators': 1306, 'learning_rate': 0.06616479839094623, 'max_depth': 12, 'min_samples_split': 20, 'min_samples_leaf': 1, 'subsample': 0.9206818406261066, 'max_features': 'sqrt'}. Best is trial 603 with value: 0.45955205541891275.
[I 2024-12-04 15:10:32,808] Trial 1396 finished with value: 0.6317098109681122 and parameters: {'n_estimators': 1287, 'learning_rate': 0.04962427335700971, 'max_depth': 12, 'min_samples_split': 20, 'min_samples_leaf': 2, 'subsample': 0.9994393852509175, 'max_features': None}. Best is trial 603 with value: 0.45955205541891275.
[I 2024-12-04 15:10:35,562] Trial 1395 finished with value: 0.47794540990778234 and parameters: {'n_estimators': 1394, 'learning_rate': 0.09500439230563455, 'max_depth': 12, 'min_samples_split': 20, 'min_samples_leaf': 1, 'subsample': 0.9886452410953838, 'max_features': None}. Best is trial 603 with value: 0.45955205541891275.
[I 2024-12-04 15:10:36,028] Trial 1406 finished with value: 0.6305674428926608 and parameters: {'n_estimators': 1041, 'learning_rate': 0.06019277088278623, 'max_depth': 12, 'min_samples_split': 16, 'min_samples_leaf': 2, 'subsample': 0.9029588814622187, 'max_features': None}. Best is trial 603 with value: 0.45955205541891275.
[I 2024-12-04 15:10:36,130] Trial 1410 finished with value: 0.47936327300516246 and parameters: {'n_estimators': 1046, 'learning_rate': 0.05188717800162534, 'max_depth': 10, 'min_samples_split': 17, 'min_samples_leaf': 1, 'subsample': 0.9134411875891206, 'max_features': None}. Best is trial 603 with value: 0.45955205541891275.
