[I 2024-12-04 15:19:09,512] Trial 1875 finished with value: 0.49705856967884987 and parameters: {'n_estimators': 813, 'learning_rate': 0.05976103195076267, 'max_depth': 11, 'min_samples_split': 16, 'min_samples_leaf': 1, 'subsample': 0.9169037636246262, 'max_features': None}. Best is trial 1435 with value: 0.45467030752684195.
[I 2024-12-04 15:19:11,842] Trial 1893 finished with value: 0.5879414089303368 and parameters: {'n_estimators': 513, 'learning_rate': 0.08044858220205257, 'max_depth': 3, 'min_samples_split': 12, 'min_samples_leaf': 4, 'subsample': 0.6102742527285434, 'max_features': None}. Best is trial 1435 with value: 0.45467030752684195.
[I 2024-12-04 15:19:13,124] Trial 1886 finished with value: 0.6698485592914727 and parameters: {'n_estimators': 761, 'learning_rate': 0.07021181353613973, 'max_depth': 5, 'min_samples_split': 10, 'min_samples_leaf': 5, 'subsample': 0.7394059652524432, 'max_features': 'sqrt'}. Best is trial 1435 with value: 0.45467030752684195.
[I 2024-12-04 15:19:13,530] Trial 1869 finished with value: 0.9599510854435856 and parameters: {'n_estimators': 1338, 'learning_rate': 0.012672612860154212, 'max_depth': 4, 'min_samples_split': 14, 'min_samples_leaf': 10, 'subsample': 0.8254459012914237, 'max_features': 'log2'}. Best is trial 1435 with value: 0.45467030752684195.
[I 2024-12-04 15:19:14,129] Trial 1879 finished with value: 0.4868653622664422 and parameters: {'n_estimators': 775, 'learning_rate': 0.09493708352180046, 'max_depth': 12, 'min_samples_split': 20, 'min_samples_leaf': 1, 'subsample': 0.9311218127322779, 'max_features': None}. Best is trial 1435 with value: 0.45467030752684195.
[I 2024-12-04 15:19:14,941] Trial 1883 finished with value: 0.47016875174327694 and parameters: {'n_estimators': 700, 'learning_rate': 0.09718294241518355, 'max_depth': 11, 'min_samples_split': 18, 'min_samples_leaf': 1, 'subsample': 0.9866388783864203, 'max_features': None}. Best is trial 1435 with value: 0.45467030752684195.
[I 2024-12-04 15:19:15,921] Trial 1880 finished with value: 0.48162988354705266 and parameters: {'n_estimators': 774, 'learning_rate': 0.08837345685195051, 'max_depth': 10, 'min_samples_split': 20, 'min_samples_leaf': 1, 'subsample': 0.9896438816742816, 'max_features': None}. Best is trial 1435 with value: 0.45467030752684195.
[I 2024-12-04 15:19:17,236] Trial 1876 finished with value: 0.6232175990572958 and parameters: {'n_estimators': 984, 'learning_rate': 0.05478738602708882, 'max_depth': 12, 'min_samples_split': 20, 'min_samples_leaf': 3, 'subsample': 0.9920872988910917, 'max_features': None}. Best is trial 1435 with value: 0.45467030752684195.
[I 2024-12-04 15:19:17,499] Trial 1870 finished with value: 0.6368222538218677 and parameters: {'n_estimators': 1112, 'learning_rate': 0.0643043905909694, 'max_depth': 12, 'min_samples_split': 20, 'min_samples_leaf': 3, 'subsample': 0.9818583811152304, 'max_features': None}. Best is trial 1435 with value: 0.45467030752684195.
[I 2024-12-04 15:19:17,732] Trial 1891 finished with value: 0.5034032016152381 and parameters: {'n_estimators': 593, 'learning_rate': 0.05858217569597823, 'max_depth': 12, 'min_samples_split': 16, 'min_samples_leaf': 1, 'subsample': 0.951241801557924, 'max_features': None}. Best is trial 1435 with value: 0.45467030752684195.
[I 2024-12-04 15:19:17,872] Trial 1881 finished with value: 0.49096741226334345 and parameters: {'n_estimators': 768, 'learning_rate': 0.0510292999501697, 'max_depth': 10, 'min_samples_split': 20, 'min_samples_leaf': 1, 'subsample': 0.9896459424023639, 'max_features': None}. Best is trial 1435 with value: 0.45467030752684195.
[I 2024-12-04 15:19:18,406] Trial 1882 finished with value: 0.4832661302258399 and parameters: {'n_estimators': 810, 'learning_rate': 0.06767128257121481, 'max_depth': 10, 'min_samples_split': 20, 'min_samples_leaf': 1, 'subsample': 0.9940922057722213, 'max_features': None}. Best is trial 1435 with value: 0.45467030752684195.
[I 2024-12-04 15:19:19,403] Trial 1888 finished with value: 0.4824297923279174 and parameters: {'n_estimators': 716, 'learning_rate': 0.06710178079813937, 'max_depth': 12, 'min_samples_split': 18, 'min_samples_leaf': 1, 'subsample': 0.9173149796260729, 'max_features': None}. Best is trial 1435 with value: 0.45467030752684195.
[I 2024-12-04 15:19:22,074] Trial 1873 finished with value: 0.48144977761116403 and parameters: {'n_estimators': 1004, 'learning_rate': 0.0720671810591017, 'max_depth': 12, 'min_samples_split': 17, 'min_samples_leaf': 1, 'subsample': 0.9889323202928418, 'max_features': None}. Best is trial 1435 with value: 0.45467030752684195.
[I 2024-12-04 15:19:22,417] Trial 1872 finished with value: 0.4975334462181138 and parameters: {'n_estimators': 1135, 'learning_rate': 0.07431694385071401, 'max_depth': 12, 'min_samples_split': 17, 'min_samples_leaf': 1, 'subsample': 0.9983044341393549, 'max_features': None}. Best is trial 1435 with value: 0.45467030752684195.
[I 2024-12-04 15:19:23,351] Trial 1878 finished with value: 0.4708960617310981 and parameters: {'n_estimators': 1051, 'learning_rate': 0.05975967755936031, 'max_depth': 12, 'min_samples_split': 20, 'min_samples_leaf': 1, 'subsample': 0.9830308523470157, 'max_features': None}. Best is trial 1435 with value: 0.45467030752684195.
[I 2024-12-04 15:19:23,754] Trial 1887 finished with value: 0.6306396792321362 and parameters: {'n_estimators': 779, 'learning_rate': 0.055921518935127056, 'max_depth': 11, 'min_samples_split': 15, 'min_samples_leaf': 3, 'subsample': 0.9973865736652591, 'max_features': None}. Best is trial 1435 with value: 0.45467030752684195.
[I 2024-12-04 15:19:23,812] Trial 1868 finished with value: 0.5366107927743886 and parameters: {'n_estimators': 1266, 'learning_rate': 0.061876205819214006, 'max_depth': 10, 'min_samples_split': 14, 'min_samples_leaf': 1, 'subsample': 0.9448546076894753, 'max_features': None}. Best is trial 1435 with value: 0.45467030752684195.
[I 2024-12-04 15:19:23,881] Trial 1896 finished with value: 0.596027823618466 and parameters: {'n_estimators': 649, 'learning_rate': 0.09433572131246805, 'max_depth': 11, 'min_samples_split': 20, 'min_samples_leaf': 1, 'subsample': 0.9134028780690249, 'max_features': 'log2'}. Best is trial 1435 with value: 0.45467030752684195.
[I 2024-12-04 15:19:25,191] Trial 1899 finished with value: 0.6257579759472612 and parameters: {'n_estimators': 650, 'learning_rate': 0.05708139166405725, 'max_depth': 11, 'min_samples_split': 16, 'min_samples_leaf': 3, 'subsample': 0.6412277867496016, 'max_features': 'sqrt'}. Best is trial 1435 with value: 0.45467030752684195.
[I 2024-12-04 15:19:25,374] Trial 1890 finished with value: 0.6790575677157019 and parameters: {'n_estimators': 935, 'learning_rate': 0.07055730956618772, 'max_depth': 12, 'min_samples_split': 15, 'min_samples_leaf': 3, 'subsample': 0.9279626724090582, 'max_features': None}. Best is trial 1435 with value: 0.45467030752684195.
[I 2024-12-04 15:19:31,098] Trial 1897 finished with value: 0.6033752197748902 and parameters: {'n_estimators': 845, 'learning_rate': 0.09937313936891905, 'max_depth': 7, 'min_samples_split': 20, 'min_samples_leaf': 4, 'subsample': 0.9968504165480074, 'max_features': None}. Best is trial 1435 with value: 0.45467030752684195.
[I 2024-12-04 15:19:31,562] Trial 1905 finished with value: 0.8249349193779745 and parameters: {'n_estimators': 557, 'learning_rate': 0.011090077155382608, 'max_depth': 6, 'min_samples_split': 19, 'min_samples_leaf': 1, 'subsample': 0.7157879391629185, 'max_features': 'log2'}. Best is trial 1435 with value: 0.45467030752684195.
[I 2024-12-04 15:19:32,610] Trial 1884 finished with value: 0.505732054981916 and parameters: {'n_estimators': 1227, 'learning_rate': 0.07505752874699806, 'max_depth': 9, 'min_samples_split': 16, 'min_samples_leaf': 1, 'subsample': 0.9399831760839641, 'max_features': None}. Best is trial 1435 with value: 0.45467030752684195.
[I 2024-12-04 15:19:32,830] Trial 1877 finished with value: 0.6497184583419587 and parameters: {'n_estimators': 1351, 'learning_rate': 0.0960128175317846, 'max_depth': 10, 'min_samples_split': 19, 'min_samples_leaf': 3, 'subsample': 0.9999147735899832, 'max_features': None}. Best is trial 1435 with value: 0.45467030752684195.
[I 2024-12-04 15:19:33,034] Trial 1889 finished with value: 0.4681113835125716 and parameters: {'n_estimators': 1148, 'learning_rate': 0.08712693116790034, 'max_depth': 12, 'min_samples_split': 20, 'min_samples_leaf': 1, 'subsample': 0.9981425226515448, 'max_features': None}. Best is trial 1435 with value: 0.45467030752684195.
[I 2024-12-04 15:19:33,375] Trial 1892 finished with value: 0.4718164934607226 and parameters: {'n_estimators': 1098, 'learning_rate': 0.06343828278009582, 'max_depth': 12, 'min_samples_split': 20, 'min_samples_leaf': 1, 'subsample': 0.9146936336607463, 'max_features': None}. Best is trial 1435 with value: 0.45467030752684195.
[I 2024-12-04 15:19:36,816] Trial 1908 finished with value: 0.7101496670230529 and parameters: {'n_estimators': 658, 'learning_rate': 0.06257658041501213, 'max_depth': 8, 'min_samples_split': 6, 'min_samples_leaf': 6, 'subsample': 0.8905817268410285, 'max_features': 'log2'}. Best is trial 1435 with value: 0.45467030752684195.
[I 2024-12-04 15:19:38,810] Trial 1894 finished with value: 0.6588724601457701 and parameters: {'n_estimators': 1498, 'learning_rate': 0.087133681396927, 'max_depth': 11, 'min_samples_split': 20, 'min_samples_leaf': 5, 'subsample': 0.8628831450226825, 'max_features': 'sqrt'}. Best is trial 1435 with value: 0.45467030752684195.
[I 2024-12-04 15:19:40,512] Trial 1904 finished with value: 0.4755629491878234 and parameters: {'n_estimators': 773, 'learning_rate': 0.09595286553206245, 'max_depth': 11, 'min_samples_split': 20, 'min_samples_leaf': 1, 'subsample': 0.9861349587831809, 'max_features': None}. Best is trial 1435 with value: 0.45467030752684195.
[I 2024-12-04 15:19:40,696] Trial 1901 finished with value: 0.7957564849354579 and parameters: {'n_estimators': 1156, 'learning_rate': 0.03744777924888206, 'max_depth': 4, 'min_samples_split': 2, 'min_samples_leaf': 9, 'subsample': 0.7835992299004083, 'max_features': 'log2'}. Best is trial 1435 with value: 0.45467030752684195.
[I 2024-12-04 15:19:41,150] Trial 1895 finished with value: 0.495960411899638 and parameters: {'n_estimators': 1117, 'learning_rate': 0.09506521422154397, 'max_depth': 11, 'min_samples_split': 17, 'min_samples_leaf': 1, 'subsample': 0.9150666926382459, 'max_features': None}. Best is trial 1435 with value: 0.45467030752684195.
[I 2024-12-04 15:19:41,152] Trial 1926 finished with value: 0.5760267714993135 and parameters: {'n_estimators': 135, 'learning_rate': 0.021556352107853814, 'max_depth': 7, 'min_samples_split': 11, 'min_samples_leaf': 4, 'subsample': 0.9473861131369696, 'max_features': None}. Best is trial 1435 with value: 0.45467030752684195.
[I 2024-12-04 15:19:45,123] Trial 1902 finished with value: 0.49245354281191256 and parameters: {'n_estimators': 1013, 'learning_rate': 0.0974447724169289, 'max_depth': 12, 'min_samples_split': 20, 'min_samples_leaf': 1, 'subsample': 0.9301066825433817, 'max_features': None}. Best is trial 1435 with value: 0.45467030752684195.
[I 2024-12-04 15:19:45,127] Trial 1918 finished with value: 0.7217803337440948 and parameters: {'n_estimators': 512, 'learning_rate': 0.09314794302897213, 'max_depth': 9, 'min_samples_split': 5, 'min_samples_leaf': 5, 'subsample': 0.6476985261156266, 'max_features': 'sqrt'}. Best is trial 1435 with value: 0.45467030752684195.
[I 2024-12-04 15:19:46,024] Trial 1906 finished with value: 0.6244333769930839 and parameters: {'n_estimators': 849, 'learning_rate': 0.05928107469681668, 'max_depth': 12, 'min_samples_split': 17, 'min_samples_leaf': 2, 'subsample': 0.9889891639437364, 'max_features': None}. Best is trial 1435 with value: 0.45467030752684195.
[I 2024-12-04 15:19:46,901] Trial 1898 finished with value: 0.48457418965240284 and parameters: {'n_estimators': 1232, 'learning_rate': 0.07547682524003535, 'max_depth': 10, 'min_samples_split': 20, 'min_samples_leaf': 1, 'subsample': 0.9959666632271659, 'max_features': None}. Best is trial 1435 with value: 0.45467030752684195.
[I 2024-12-04 15:19:50,313] Trial 1900 finished with value: 0.6634274579678039 and parameters: {'n_estimators': 1234, 'learning_rate': 0.06667640536066942, 'max_depth': 12, 'min_samples_split': 20, 'min_samples_leaf': 3, 'subsample': 0.9384753191906101, 'max_features': None}. Best is trial 1435 with value: 0.45467030752684195.
[I 2024-12-04 15:19:50,766] Trial 1931 finished with value: 0.616957656108689 and parameters: {'n_estimators': 308, 'learning_rate': 0.031096017052737533, 'max_depth': 10, 'min_samples_split': 9, 'min_samples_leaf': 4, 'subsample': 0.9882195297892438, 'max_features': 'sqrt'}. Best is trial 1435 with value: 0.45467030752684195.
[I 2024-12-04 15:19:51,871] Trial 1917 finished with value: 0.7883491708624216 and parameters: {'n_estimators': 818, 'learning_rate': 0.021356625418071373, 'max_depth': 3, 'min_samples_split': 14, 'min_samples_leaf': 4, 'subsample': 0.8150924488320265, 'max_features': 'log2'}. Best is trial 1435 with value: 0.45467030752684195.
[I 2024-12-04 15:19:52,751] Trial 1903 finished with value: 0.5228507564654223 and parameters: {'n_estimators': 1161, 'learning_rate': 0.09866032509081472, 'max_depth': 11, 'min_samples_split': 12, 'min_samples_leaf': 1, 'subsample': 0.9918317971118654, 'max_features': None}. Best is trial 1435 with value: 0.45467030752684195.
[I 2024-12-04 15:19:55,203] Trial 1907 finished with value: 0.4851719846902834 and parameters: {'n_estimators': 1097, 'learning_rate': 0.09671225475319745, 'max_depth': 10, 'min_samples_split': 20, 'min_samples_leaf': 1, 'subsample': 0.9275584700779461, 'max_features': None}. Best is trial 1435 with value: 0.45467030752684195.
[I 2024-12-04 15:19:55,211] Trial 1910 finished with value: 0.6408218416217569 and parameters: {'n_estimators': 861, 'learning_rate': 0.09327688152202808, 'max_depth': 12, 'min_samples_split': 20, 'min_samples_leaf': 3, 'subsample': 0.9983068604442081, 'max_features': None}. Best is trial 1435 with value: 0.45467030752684195.
[I 2024-12-04 15:19:57,925] Trial 1922 finished with value: 0.5503132281779587 and parameters: {'n_estimators': 866, 'learning_rate': 0.053908328510093466, 'max_depth': 7, 'min_samples_split': 13, 'min_samples_leaf': 1, 'subsample': 0.7144352070828341, 'max_features': 'sqrt'}. Best is trial 1435 with value: 0.45467030752684195.
[I 2024-12-04 15:19:57,929] Trial 1911 finished with value: 0.4625077486204867 and parameters: {'n_estimators': 964, 'learning_rate': 0.084135464807073, 'max_depth': 12, 'min_samples_split': 19, 'min_samples_leaf': 1, 'subsample': 0.989209756149025, 'max_features': None}. Best is trial 1435 with value: 0.45467030752684195.
[I 2024-12-04 15:19:58,309] Trial 1912 finished with value: 0.47506465897633066 and parameters: {'n_estimators': 917, 'learning_rate': 0.09274557119111333, 'max_depth': 12, 'min_samples_split': 20, 'min_samples_leaf': 1, 'subsample': 0.9643887612609862, 'max_features': None}. Best is trial 1435 with value: 0.45467030752684195.
[I 2024-12-04 15:20:00,423] Trial 1923 finished with value: 0.5816926439284289 and parameters: {'n_estimators': 808, 'learning_rate': 0.010451441920999777, 'max_depth': 5, 'min_samples_split': 17, 'min_samples_leaf': 2, 'subsample': 0.9090291911337022, 'max_features': None}. Best is trial 1435 with value: 0.45467030752684195.
[I 2024-12-04 15:20:01,882] Trial 1944 finished with value: 0.6883002726427665 and parameters: {'n_estimators': 109, 'learning_rate': 0.07475835296251065, 'max_depth': 10, 'min_samples_split': 8, 'min_samples_leaf': 8, 'subsample': 0.6103267705613066, 'max_features': None}. Best is trial 1435 with value: 0.45467030752684195.
[I 2024-12-04 15:20:03,489] Trial 1915 finished with value: 0.47757991875916045 and parameters: {'n_estimators': 984, 'learning_rate': 0.09930664374810756, 'max_depth': 12, 'min_samples_split': 18, 'min_samples_leaf': 1, 'subsample': 0.970548613842773, 'max_features': None}. Best is trial 1435 with value: 0.45467030752684195.
[I 2024-12-04 15:20:03,697] Trial 1913 finished with value: 0.5013176315467943 and parameters: {'n_estimators': 1090, 'learning_rate': 0.06127570088515683, 'max_depth': 12, 'min_samples_split': 16, 'min_samples_leaf': 1, 'subsample': 0.9220115682978173, 'max_features': None}. Best is trial 1435 with value: 0.45467030752684195.
[I 2024-12-04 15:20:05,320] Trial 1909 finished with value: 0.4838326116443679 and parameters: {'n_estimators': 1212, 'learning_rate': 0.09569120991484753, 'max_depth': 12, 'min_samples_split': 17, 'min_samples_leaf': 1, 'subsample': 0.9513920957578336, 'max_features': None}. Best is trial 1435 with value: 0.45467030752684195.
[I 2024-12-04 15:20:06,666] Trial 1928 finished with value: 1.1011548082484646 and parameters: {'n_estimators': 932, 'learning_rate': 0.010034669586325356, 'max_depth': 11, 'min_samples_split': 8, 'min_samples_leaf': 10, 'subsample': 0.8274913860016438, 'max_features': 'log2'}. Best is trial 1435 with value: 0.45467030752684195.
[I 2024-12-04 15:20:07,028] Trial 1925 finished with value: 0.5355498078679368 and parameters: {'n_estimators': 1017, 'learning_rate': 0.08235268556273398, 'max_depth': 12, 'min_samples_split': 19, 'min_samples_leaf': 1, 'subsample': 0.974468498109052, 'max_features': 'sqrt'}. Best is trial 1435 with value: 0.45467030752684195.
[I 2024-12-04 15:20:07,948] Trial 1914 finished with value: 0.6493149492972387 and parameters: {'n_estimators': 1192, 'learning_rate': 0.07691431676526671, 'max_depth': 11, 'min_samples_split': 18, 'min_samples_leaf': 3, 'subsample': 0.9980138363977694, 'max_features': None}. Best is trial 1435 with value: 0.45467030752684195.
[I 2024-12-04 15:20:08,398] Trial 1929 finished with value: 0.4868201856191102 and parameters: {'n_estimators': 807, 'learning_rate': 0.09398448258097489, 'max_depth': 12, 'min_samples_split': 20, 'min_samples_leaf': 1, 'subsample': 0.9756698814012815, 'max_features': None}. Best is trial 1435 with value: 0.45467030752684195.
[I 2024-12-04 15:20:08,568] Trial 1916 finished with value: 0.642146288244507 and parameters: {'n_estimators': 966, 'learning_rate': 0.08217947523997442, 'max_depth': 10, 'min_samples_split': 18, 'min_samples_leaf': 3, 'subsample': 0.986244979725373, 'max_features': None}. Best is trial 1435 with value: 0.45467030752684195.
[I 2024-12-04 15:20:10,118] Trial 1919 finished with value: 0.6941881893253884 and parameters: {'n_estimators': 1217, 'learning_rate': 0.09663188709999512, 'max_depth': 3, 'min_samples_split': 2, 'min_samples_leaf': 2, 'subsample': 0.9808091516799263, 'max_features': 'sqrt'}. Best is trial 1435 with value: 0.45467030752684195.
[I 2024-12-04 15:20:10,227] Trial 1930 finished with value: 0.6790791779613877 and parameters: {'n_estimators': 981, 'learning_rate': 0.0859344243870456, 'max_depth': 11, 'min_samples_split': 3, 'min_samples_leaf': 6, 'subsample': 0.9973911518908667, 'max_features': 'sqrt'}. Best is trial 1435 with value: 0.45467030752684195.
[I 2024-12-04 15:20:10,872] Trial 1921 finished with value: 0.6311163029840562 and parameters: {'n_estimators': 1002, 'learning_rate': 0.054746567438906255, 'max_depth': 12, 'min_samples_split': 18, 'min_samples_leaf': 3, 'subsample': 0.9917573689107818, 'max_features': None}. Best is trial 1435 with value: 0.45467030752684195.
[I 2024-12-04 15:20:11,627] Trial 1939 finished with value: 0.537090043384877 and parameters: {'n_estimators': 617, 'learning_rate': 0.062176069840010235, 'max_depth': 12, 'min_samples_split': 18, 'min_samples_leaf': 1, 'subsample': 0.9963972757355148, 'max_features': 'sqrt'}. Best is trial 1435 with value: 0.45467030752684195.
[I 2024-12-04 15:20:12,022] Trial 1935 finished with value: 0.4711643915813009 and parameters: {'n_estimators': 644, 'learning_rate': 0.0641114345692834, 'max_depth': 12, 'min_samples_split': 20, 'min_samples_leaf': 1, 'subsample': 0.915992508885984, 'max_features': None}. Best is trial 1435 with value: 0.45467030752684195.
[I 2024-12-04 15:20:12,685] Trial 1924 finished with value: 0.6492392886960495 and parameters: {'n_estimators': 1014, 'learning_rate': 0.05675017964648758, 'max_depth': 12, 'min_samples_split': 20, 'min_samples_leaf': 2, 'subsample': 0.9046710732018178, 'max_features': None}. Best is trial 1435 with value: 0.45467030752684195.
[I 2024-12-04 15:20:13,432] Trial 1941 finished with value: 0.5685771132073848 and parameters: {'n_estimators': 590, 'learning_rate': 0.0850728633132146, 'max_depth': 10, 'min_samples_split': 20, 'min_samples_leaf': 1, 'subsample': 0.891760476781758, 'max_features': 'sqrt'}. Best is trial 1435 with value: 0.45467030752684195.
[I 2024-12-04 15:20:13,550] Trial 1940 finished with value: 0.6419245824753791 and parameters: {'n_estimators': 568, 'learning_rate': 0.09583528921564502, 'max_depth': 10, 'min_samples_split': 18, 'min_samples_leaf': 3, 'subsample': 0.9550544559899885, 'max_features': None}. Best is trial 1435 with value: 0.45467030752684195.
[I 2024-12-04 15:20:17,607] Trial 1920 finished with value: 0.4689843533910941 and parameters: {'n_estimators': 1199, 'learning_rate': 0.0906451816960373, 'max_depth': 12, 'min_samples_split': 19, 'min_samples_leaf': 1, 'subsample': 0.9980422303238414, 'max_features': None}. Best is trial 1435 with value: 0.45467030752684195.
[I 2024-12-04 15:20:17,650] Trial 1927 finished with value: 0.5760179375057228 and parameters: {'n_estimators': 1286, 'learning_rate': 0.0995752458186677, 'max_depth': 9, 'min_samples_split': 18, 'min_samples_leaf': 1, 'subsample': 0.9974658394829445, 'max_features': 'log2'}. Best is trial 1435 with value: 0.45467030752684195.
