[I 2024-12-03 18:40:12,029] Trial 146 finished with value: 76.93760392095069 and parameters: {'kernel': 'sigmoid', 'C': 97.3243142843615, 'gamma': 0.007622473074899652, 'epsilon': 0.024210052857686726}. Best is trial 110 with value: 0.4557306861243869.
[I 2024-12-03 18:40:12,606] Trial 136 finished with value: 0.4653047863369165 and parameters: {'kernel': 'rbf', 'C': 43.258730356047764, 'gamma': 0.02578384859638277, 'epsilon': 0.06909759337146976}. Best is trial 110 with value: 0.4557306861243869.
[I 2024-12-03 18:40:12,926] Trial 140 finished with value: 0.4645818075896871 and parameters: {'kernel': 'rbf', 'C': 73.09698749024922, 'gamma': 0.017526948174538433, 'epsilon': 0.005249050819987465}. Best is trial 110 with value: 0.4557306861243869.
[I 2024-12-03 18:40:13,445] Trial 137 finished with value: 0.48104026100829556 and parameters: {'kernel': 'rbf', 'C': 47.0127262652486, 'gamma': 0.03236517364269348, 'epsilon': 0.03786559517380574}. Best is trial 110 with value: 0.4557306861243869.
[I 2024-12-03 18:40:13,619] Trial 145 finished with value: 0.4623488819934902 and parameters: {'kernel': 'rbf', 'C': 97.4665808566176, 'gamma': 0.018190318667647032, 'epsilon': 0.0817136126551687}. Best is trial 110 with value: 0.4557306861243869.
[I 2024-12-03 18:40:13,718] Trial 153 finished with value: 0.45858276322920377 and parameters: {'kernel': 'rbf', 'C': 93.3436403556668, 'gamma': 0.014142171965656033, 'epsilon': 0.023998561362520612}. Best is trial 110 with value: 0.4557306861243869.
[I 2024-12-03 18:40:13,859] Trial 138 finished with value: 1.2947064471230092 and parameters: {'kernel': 'sigmoid', 'C': 0.4680096729792757, 'gamma': 0.00027484986117081947, 'epsilon': 0.0019607161818217594}. Best is trial 110 with value: 0.4557306861243869.
[I 2024-12-03 18:40:13,860] Trial 144 finished with value: 0.4682649748630142 and parameters: {'kernel': 'rbf', 'C': 85.20802322936397, 'gamma': 0.013934676660738983, 'epsilon': 0.001837920896110616}. Best is trial 110 with value: 0.4557306861243869.
[I 2024-12-03 18:40:14,483] Trial 148 finished with value: 0.6080105342848153 and parameters: {'kernel': 'rbf', 'C': 62.84338673699242, 'gamma': 0.09255874501305388, 'epsilon': 0.09860279221902284}. Best is trial 110 with value: 0.4557306861243869.
[I 2024-12-03 18:40:14,495] Trial 155 finished with value: 0.47224130816322135 and parameters: {'kernel': 'rbf', 'C': 92.72291089750829, 'gamma': 0.021382656187754357, 'epsilon': 0.03277510718161951}. Best is trial 110 with value: 0.4557306861243869.
[I 2024-12-03 18:40:14,600] Trial 160 finished with value: 0.8388462566341491 and parameters: {'kernel': 'rbf', 'C': 0.37911029354952996, 'gamma': 0.007994829692692027, 'epsilon': 0.06459017689039412}. Best is trial 110 with value: 0.4557306861243869.
[I 2024-12-03 18:40:14,604] Trial 152 finished with value: 0.4684628543117355 and parameters: {'kernel': 'rbf', 'C': 62.39772134910413, 'gamma': 0.011025263787105818, 'epsilon': 0.0486034061684294}. Best is trial 110 with value: 0.4557306861243869.
[I 2024-12-03 18:40:14,606] Trial 162 finished with value: 0.48058572431722635 and parameters: {'kernel': 'rbf', 'C': 84.09593295636536, 'gamma': 0.008080374754014154, 'epsilon': 0.03537638342229978}. Best is trial 110 with value: 0.4557306861243869.
[I 2024-12-03 18:40:14,850] Trial 147 finished with value: 0.5742286633516968 and parameters: {'kernel': 'linear', 'C': 73.53188063872082, 'gamma': 0.04655970040689541, 'epsilon': 0.07425556885466479}. Best is trial 110 with value: 0.4557306861243869.
[I 2024-12-03 18:40:15,037] Trial 151 finished with value: 0.5990534891871236 and parameters: {'kernel': 'rbf', 'C': 63.31382800599973, 'gamma': 0.015623991536054241, 'epsilon': 0.6286065626505913}. Best is trial 110 with value: 0.4557306861243869.
[I 2024-12-03 18:40:15,431] Trial 143 finished with value: 0.4619088282871754 and parameters: {'kernel': 'rbf', 'C': 60.80569441781433, 'gamma': 0.012552909714757738, 'epsilon': 0.0918764363465911}. Best is trial 110 with value: 0.4557306861243869.
[I 2024-12-03 18:40:15,803] Trial 150 finished with value: 0.686032542403508 and parameters: {'kernel': 'rbf', 'C': 6.356272090223366, 'gamma': 0.0047103018581012126, 'epsilon': 0.061154015737317255}. Best is trial 110 with value: 0.4557306861243869.
[I 2024-12-03 18:40:16,507] Trial 149 finished with value: 0.49458734938974935 and parameters: {'kernel': 'rbf', 'C': 90.51322076400884, 'gamma': 0.007948789826732873, 'epsilon': 0.18935997278143568}. Best is trial 110 with value: 0.4557306861243869.
[I 2024-12-03 18:40:17,421] Trial 159 finished with value: 0.5242986323512999 and parameters: {'kernel': 'rbf', 'C': 43.15204177123091, 'gamma': 0.03515983642895964, 'epsilon': 0.14558347270856545}. Best is trial 110 with value: 0.4557306861243869.
[I 2024-12-03 18:40:17,648] Trial 156 finished with value: 0.46224106612210997 and parameters: {'kernel': 'rbf', 'C': 80.09938577598581, 'gamma': 0.0212749826530017, 'epsilon': 0.05823983598228211}. Best is trial 110 with value: 0.4557306861243869.
[I 2024-12-03 18:40:17,681] Trial 157 finished with value: 1.3376157823588217 and parameters: {'kernel': 'sigmoid', 'C': 0.004082566369237003, 'gamma': 0.05602378728413132, 'epsilon': 0.0013306915046764473}. Best is trial 110 with value: 0.4557306861243869.
[I 2024-12-03 18:40:17,766] Trial 161 finished with value: 0.4801850811054218 and parameters: {'kernel': 'rbf', 'C': 62.07697932754729, 'gamma': 0.00901976175619721, 'epsilon': 0.05515031759582835}. Best is trial 110 with value: 0.4557306861243869.
[I 2024-12-03 18:40:18,690] Trial 166 finished with value: 0.4643507840442326 and parameters: {'kernel': 'rbf', 'C': 66.31133535597537, 'gamma': 0.012841152946868094, 'epsilon': 0.028315198554610163}. Best is trial 110 with value: 0.4557306861243869.
[I 2024-12-03 18:40:18,715] Trial 163 finished with value: 0.6222984480036217 and parameters: {'kernel': 'rbf', 'C': 97.84325312808049, 'gamma': 0.08296264013476208, 'epsilon': 0.07091435856632924}. Best is trial 110 with value: 0.4557306861243869.
[I 2024-12-03 18:40:18,727] Trial 165 finished with value: 0.4793393664726581 and parameters: {'kernel': 'rbf', 'C': 98.4454760618913, 'gamma': 0.00740390212884421, 'epsilon': 0.06831450619101384}. Best is trial 110 with value: 0.4557306861243869.
[I 2024-12-03 18:40:18,874] Trial 154 finished with value: 0.48682005826536545 and parameters: {'kernel': 'rbf', 'C': 23.384541785038927, 'gamma': 0.01492306642559587, 'epsilon': 0.040493431110372236}. Best is trial 110 with value: 0.4557306861243869.
[I 2024-12-03 18:40:18,951] Trial 170 finished with value: 0.5526582203406335 and parameters: {'kernel': 'rbf', 'C': 7.772364601446398, 'gamma': 0.012690253569678862, 'epsilon': 0.0726269052450224}. Best is trial 110 with value: 0.4557306861243869.
[I 2024-12-03 18:40:20,529] Trial 158 finished with value: 0.5067061342644312 and parameters: {'kernel': 'rbf', 'C': 28.989091284076014, 'gamma': 0.0459369167676452, 'epsilon': 0.045956026932321536}. Best is trial 110 with value: 0.4557306861243869.
[I 2024-12-03 18:40:21,116] Trial 186 finished with value: 0.4579014123514208 and parameters: {'kernel': 'rbf', 'C': 90.52076668161006, 'gamma': 0.012486906159360378, 'epsilon': 0.0439025701869123}. Best is trial 110 with value: 0.4557306861243869.
[I 2024-12-03 18:40:21,283] Trial 180 finished with value: 0.48121550726274126 and parameters: {'kernel': 'rbf', 'C': 60.07582892440573, 'gamma': 0.029778306259038167, 'epsilon': 0.03403695531599412}. Best is trial 110 with value: 0.4557306861243869.
[I 2024-12-03 18:40:21,286] Trial 184 finished with value: 0.6270162176184803 and parameters: {'kernel': 'rbf', 'C': 99.6081901351353, 'gamma': 0.049288745074226176, 'epsilon': 0.014928703115748674}. Best is trial 110 with value: 0.4557306861243869.
[I 2024-12-03 18:40:22,448] Trial 178 finished with value: 0.47903472260332136 and parameters: {'kernel': 'rbf', 'C': 41.22149061620522, 'gamma': 0.022152633515775, 'epsilon': 0.17714760581271735}. Best is trial 110 with value: 0.4557306861243869.
[I 2024-12-03 18:40:23,491] Trial 167 finished with value: 0.5927594015867861 and parameters: {'kernel': 'linear', 'C': 35.63096923560035, 'gamma': 0.0058816606496441565, 'epsilon': 0.1850506718730506}. Best is trial 110 with value: 0.4557306861243869.
[I 2024-12-03 18:40:23,596] Trial 177 finished with value: 0.5609281985434278 and parameters: {'kernel': 'rbf', 'C': 84.61984861546976, 'gamma': 0.03712755151443758, 'epsilon': 0.10441752523811199}. Best is trial 110 with value: 0.4557306861243869.
[I 2024-12-03 18:40:23,757] Trial 172 finished with value: 0.5180192212189026 and parameters: {'kernel': 'rbf', 'C': 56.85753336241557, 'gamma': 0.00613488363953371, 'epsilon': 0.015402854859488788}. Best is trial 110 with value: 0.4557306861243869.
[I 2024-12-03 18:40:23,845] Trial 168 finished with value: 0.6466643315404371 and parameters: {'kernel': 'rbf', 'C': 3.712838595793514, 'gamma': 0.29317013556400784, 'epsilon': 0.09234537866374827}. Best is trial 110 with value: 0.4557306861243869.
[I 2024-12-03 18:40:24,223] Trial 185 finished with value: 0.4962592239918566 and parameters: {'kernel': 'rbf', 'C': 83.59080821529193, 'gamma': 0.00659297189353644, 'epsilon': 0.01616448704137582}. Best is trial 110 with value: 0.4557306861243869.
[I 2024-12-03 18:40:24,525] Trial 164 finished with value: 0.49818247092780543 and parameters: {'kernel': 'rbf', 'C': 80.83929347605343, 'gamma': 0.005607634819410421, 'epsilon': 0.060486648300606585}. Best is trial 110 with value: 0.4557306861243869.
[I 2024-12-03 18:40:24,782] Trial 181 finished with value: 1.0101033063325382 and parameters: {'kernel': 'poly', 'C': 0.0012227177779378553, 'gamma': 0.21380164070490634, 'epsilon': 0.24488779745321923}. Best is trial 110 with value: 0.4557306861243869.
[I 2024-12-03 18:40:25,307] Trial 174 finished with value: 0.5271827367476355 and parameters: {'kernel': 'rbf', 'C': 95.8332701906847, 'gamma': 0.030608751213859645, 'epsilon': 0.02389594575971881}. Best is trial 110 with value: 0.4557306861243869.
[I 2024-12-03 18:40:25,321] Trial 169 finished with value: 1.1023473169613915 and parameters: {'kernel': 'poly', 'C': 85.75008970302449, 'gamma': 0.0025686856558461957, 'epsilon': 0.021034591078206943}. Best is trial 110 with value: 0.4557306861243869.
[I 2024-12-03 18:40:25,737] Trial 175 finished with value: 0.5112639839097485 and parameters: {'kernel': 'rbf', 'C': 18.688096585603, 'gamma': 0.014009520871716691, 'epsilon': 0.017898428958811063}. Best is trial 110 with value: 0.4557306861243869.
[I 2024-12-03 18:40:25,961] Trial 171 finished with value: 0.4712665603600114 and parameters: {'kernel': 'rbf', 'C': 81.57413208495058, 'gamma': 0.022480081087260486, 'epsilon': 0.030104177341857837}. Best is trial 110 with value: 0.4557306861243869.
[I 2024-12-03 18:40:26,219] Trial 182 finished with value: 0.510833946813491 and parameters: {'kernel': 'rbf', 'C': 12.836886497935017, 'gamma': 0.018615036254513332, 'epsilon': 0.08234692343275693}. Best is trial 110 with value: 0.4557306861243869.
[I 2024-12-03 18:40:26,247] Trial 183 finished with value: 0.5090304030760141 and parameters: {'kernel': 'rbf', 'C': 61.49310211086239, 'gamma': 0.006677268560871941, 'epsilon': 0.015374839749811053}. Best is trial 110 with value: 0.4557306861243869.
[I 2024-12-03 18:40:26,427] Trial 192 finished with value: 0.9127332947102532 and parameters: {'kernel': 'linear', 'C': 0.0014531927625135008, 'gamma': 0.0001818599787089645, 'epsilon': 0.014348595279314693}. Best is trial 110 with value: 0.4557306861243869.
[I 2024-12-03 18:40:26,490] Trial 191 finished with value: 0.5074806987622623 and parameters: {'kernel': 'rbf', 'C': 29.913509775997543, 'gamma': 0.010325380291570737, 'epsilon': 0.10999455483372049}. Best is trial 110 with value: 0.4557306861243869.
[I 2024-12-03 18:40:26,499] Trial 190 finished with value: 0.4834697745638698 and parameters: {'kernel': 'rbf', 'C': 85.19769842493339, 'gamma': 0.007311529438418806, 'epsilon': 0.050632682193913606}. Best is trial 110 with value: 0.4557306861243869.
[I 2024-12-03 18:40:26,922] Trial 173 finished with value: 0.4592999042494737 and parameters: {'kernel': 'rbf', 'C': 41.52982454938159, 'gamma': 0.016853626627534334, 'epsilon': 0.052163488136078205}. Best is trial 110 with value: 0.4557306861243869.
[I 2024-12-03 18:40:27,016] Trial 195 finished with value: 0.4756906300677837 and parameters: {'kernel': 'rbf', 'C': 19.08769422729356, 'gamma': 0.0380253577574641, 'epsilon': 0.022071275035412327}. Best is trial 110 with value: 0.4557306861243869.
[I 2024-12-03 18:40:27,220] Trial 189 finished with value: 0.47858697237679715 and parameters: {'kernel': 'rbf', 'C': 99.29817626569334, 'gamma': 0.02106743507226382, 'epsilon': 0.07944668504164147}. Best is trial 110 with value: 0.4557306861243869.
[I 2024-12-03 18:40:27,243] Trial 194 finished with value: 0.5876757114134663 and parameters: {'kernel': 'linear', 'C': 0.3990570034375983, 'gamma': 0.33304897615856327, 'epsilon': 0.12789084896270195}. Best is trial 110 with value: 0.4557306861243869.
[I 2024-12-03 18:40:27,484] Trial 188 finished with value: 149.0143616232491 and parameters: {'kernel': 'sigmoid', 'C': 76.66942157836955, 'gamma': 0.012346720847500391, 'epsilon': 0.1185204587741474}. Best is trial 110 with value: 0.4557306861243869.
[I 2024-12-03 18:40:27,619] Trial 176 finished with value: 0.4621985560661248 and parameters: {'kernel': 'rbf', 'C': 80.41438851178772, 'gamma': 0.011347096725862572, 'epsilon': 0.04309920373973104}. Best is trial 110 with value: 0.4557306861243869.
[I 2024-12-03 18:40:27,779] Trial 179 finished with value: 1.1015987667792373 and parameters: {'kernel': 'poly', 'C': 0.0018504638680005082, 'gamma': 0.044795559566113016, 'epsilon': 0.005322427765168212}. Best is trial 110 with value: 0.4557306861243869.
[I 2024-12-03 18:40:27,927] Trial 193 finished with value: 0.7008178293403601 and parameters: {'kernel': 'rbf', 'C': 10.280160166418653, 'gamma': 0.0024668696914929337, 'epsilon': 0.021156471116406228}. Best is trial 110 with value: 0.4557306861243869.
[I 2024-12-03 18:40:28,723] Trial 198 finished with value: 0.4637578720790102 and parameters: {'kernel': 'rbf', 'C': 36.25786471958733, 'gamma': 0.01623438620536991, 'epsilon': 0.04069101117361493}. Best is trial 110 with value: 0.4557306861243869.
[I 2024-12-03 18:40:29,035] Trial 197 finished with value: 0.4618874889404991 and parameters: {'kernel': 'rbf', 'C': 71.84438213564617, 'gamma': 0.012065147436892099, 'epsilon': 0.05145416689656625}. Best is trial 187 with value: 0.4545840116345304.
[I 2024-12-03 18:40:30,085] Trial 196 finished with value: 0.5671053723214166 and parameters: {'kernel': 'rbf', 'C': 8.989114344358835, 'gamma': 0.009079701840107673, 'epsilon': 0.03653853219860126}. Best is trial 187 with value: 0.4545840116345304.
[I 2024-12-03 18:40:30,426] Trial 187 finished with value: 0.4545840116345304 and parameters: {'kernel': 'rbf', 'C': 62.82379874784912, 'gamma': 0.014831267186559098, 'epsilon': 0.052179125210967105}. Best is trial 187 with value: 0.4545840116345304.
[I 2024-12-03 18:40:31,539] Trial 199 finished with value: 0.49194633542138566 and parameters: {'kernel': 'rbf', 'C': 82.53641573748386, 'gamma': 0.006986687352612921, 'epsilon': 0.02119791712824458}. Best is trial 207 with value: 0.45132257701358836.
[I 2024-12-03 18:40:31,691] Trial 201 finished with value: 0.5383264618385217 and parameters: {'kernel': 'rbf', 'C': 56.29000854038289, 'gamma': 0.03998768977000684, 'epsilon': 0.042844695393480445}. Best is trial 207 with value: 0.45132257701358836.
[I 2024-12-03 18:40:31,792] Trial 205 finished with value: 0.4901936898496734 and parameters: {'kernel': 'rbf', 'C': 71.28698673878498, 'gamma': 0.029513579184505714, 'epsilon': 0.04052432741859608}. Best is trial 207 with value: 0.45132257701358836.
[I 2024-12-03 18:40:31,990] Trial 200 finished with value: 0.557173068821308 and parameters: {'kernel': 'rbf', 'C': 55.91341122920249, 'gamma': 0.0030343232091781342, 'epsilon': 0.08003214723458692}. Best is trial 207 with value: 0.45132257701358836.
[I 2024-12-03 18:40:32,174] Trial 206 finished with value: 0.45143719614828726 and parameters: {'kernel': 'rbf', 'C': 72.49049882652706, 'gamma': 0.016631030586425944, 'epsilon': 0.0517227101397239}. Best is trial 207 with value: 0.45132257701358836.
[I 2024-12-03 18:40:32,247] Trial 202 finished with value: 0.9195037364149339 and parameters: {'kernel': 'poly', 'C': 71.30412685523017, 'gamma': 0.008913088395200103, 'epsilon': 0.09107532986590479}. Best is trial 207 with value: 0.45132257701358836.
[I 2024-12-03 18:40:32,534] Trial 204 finished with value: 0.5075242581681553 and parameters: {'kernel': 'rbf', 'C': 12.374109793089255, 'gamma': 0.018588594785869154, 'epsilon': 0.06326130156254936}. Best is trial 207 with value: 0.45132257701358836.
[I 2024-12-03 18:40:32,971] Trial 214 finished with value: 0.5057720569578795 and parameters: {'kernel': 'rbf', 'C': 7.927720255952291, 'gamma': 0.030428809360057103, 'epsilon': 0.039587057502787036}. Best is trial 207 with value: 0.45132257701358836.
[I 2024-12-03 18:40:33,481] Trial 207 finished with value: 0.45132257701358836 and parameters: {'kernel': 'rbf', 'C': 88.73627436455477, 'gamma': 0.01615432355647491, 'epsilon': 0.060774754382935836}. Best is trial 207 with value: 0.45132257701358836.
[I 2024-12-03 18:40:33,659] Trial 209 finished with value: 0.5106143321670056 and parameters: {'kernel': 'rbf', 'C': 96.18888859480693, 'gamma': 0.004209044049364251, 'epsilon': 0.06272708563904757}. Best is trial 207 with value: 0.45132257701358836.
[I 2024-12-03 18:40:34,486] Trial 227 finished with value: 0.5057064111139956 and parameters: {'kernel': 'rbf', 'C': 94.44271822444384, 'gamma': 0.024448864358440844, 'epsilon': 0.09175436150603485}. Best is trial 207 with value: 0.45132257701358836.
[I 2024-12-03 18:40:34,489] Trial 218 finished with value: 0.47182661911771084 and parameters: {'kernel': 'rbf', 'C': 79.22423005584828, 'gamma': 0.009284234701372436, 'epsilon': 0.04744045646591804}. Best is trial 207 with value: 0.45132257701358836.
[I 2024-12-03 18:40:34,969] Trial 203 finished with value: 0.453043666727426 and parameters: {'kernel': 'rbf', 'C': 64.80877007542331, 'gamma': 0.01792532562549509, 'epsilon': 0.049310797781205305}. Best is trial 207 with value: 0.45132257701358836.
[I 2024-12-03 18:40:34,979] Trial 210 finished with value: 0.5700810148794738 and parameters: {'kernel': 'linear', 'C': 31.391441717667984, 'gamma': 0.011879248729252358, 'epsilon': 0.056791875524313966}. Best is trial 207 with value: 0.45132257701358836.
[I 2024-12-03 18:40:35,306] Trial 224 finished with value: 0.4977611125341259 and parameters: {'kernel': 'rbf', 'C': 91.1794745085894, 'gamma': 0.005920583565782812, 'epsilon': 0.025616697079085902}. Best is trial 207 with value: 0.45132257701358836.
[I 2024-12-03 18:40:35,340] Trial 215 finished with value: 0.4602556805032027 and parameters: {'kernel': 'rbf', 'C': 81.50393839412767, 'gamma': 0.01026457711263045, 'epsilon': 0.1163571665523859}. Best is trial 207 with value: 0.45132257701358836.
[I 2024-12-03 18:40:35,614] Trial 208 finished with value: 0.45790427264398836 and parameters: {'kernel': 'rbf', 'C': 74.34470175061884, 'gamma': 0.011546779542584925, 'epsilon': 0.07682340492940742}. Best is trial 207 with value: 0.45132257701358836.
[I 2024-12-03 18:40:35,813] Trial 212 finished with value: 0.5116862405012095 and parameters: {'kernel': 'rbf', 'C': 86.76546078829352, 'gamma': 0.02965671557313853, 'epsilon': 0.046396391817565844}. Best is trial 207 with value: 0.45132257701358836.
[I 2024-12-03 18:40:36,167] Trial 222 finished with value: 0.4730038137419745 and parameters: {'kernel': 'rbf', 'C': 93.82715795957198, 'gamma': 0.00815717608584346, 'epsilon': 0.10335575710937114}. Best is trial 207 with value: 0.45132257701358836.
[I 2024-12-03 18:40:36,506] Trial 220 finished with value: 0.5351479323662476 and parameters: {'kernel': 'rbf', 'C': 22.712319782378405, 'gamma': 0.008513679395155484, 'epsilon': 0.12789721481101116}. Best is trial 207 with value: 0.45132257701358836.
[I 2024-12-03 18:40:36,905] Trial 223 finished with value: 0.45674940682333814 and parameters: {'kernel': 'rbf', 'C': 92.91655760190002, 'gamma': 0.012219503620931264, 'epsilon': 0.03294861018395481}. Best is trial 207 with value: 0.45132257701358836.
[I 2024-12-03 18:40:36,932] Trial 213 finished with value: 0.5039585478682848 and parameters: {'kernel': 'rbf', 'C': 9.892695858497953, 'gamma': 0.04743673065685267, 'epsilon': 0.1479503964323506}. Best is trial 207 with value: 0.45132257701358836.
[I 2024-12-03 18:40:36,966] Trial 217 finished with value: 1.3652090171507245 and parameters: {'kernel': 'poly', 'C': 0.05366187761378892, 'gamma': 0.0026446956078412017, 'epsilon': 0.002449407692391893}. Best is trial 207 with value: 0.45132257701358836.
[I 2024-12-03 18:40:37,439] Trial 231 finished with value: 1.07461586531758 and parameters: {'kernel': 'poly', 'C': 4.856469912801375, 'gamma': 0.008465875261473299, 'epsilon': 0.09483904809125686}. Best is trial 207 with value: 0.45132257701358836.
[I 2024-12-03 18:40:37,755] Trial 226 finished with value: 0.4843325093911538 and parameters: {'kernel': 'rbf', 'C': 71.69644007251289, 'gamma': 0.010608127162111807, 'epsilon': 0.20231915450925322}. Best is trial 207 with value: 0.45132257701358836.
[I 2024-12-03 18:40:37,870] Trial 211 finished with value: 0.4557696409543596 and parameters: {'kernel': 'rbf', 'C': 63.66802631773393, 'gamma': 0.01548362060685673, 'epsilon': 0.03527927483922985}. Best is trial 207 with value: 0.45132257701358836.
[I 2024-12-03 18:40:37,958] Trial 219 finished with value: 240.08212295222862 and parameters: {'kernel': 'sigmoid', 'C': 24.752889096696578, 'gamma': 0.1111608512648585, 'epsilon': 0.13812670129323018}. Best is trial 207 with value: 0.45132257701358836.
