[I 2024-12-04 20:01:38,297] Trial 611 finished with value: 0.32310904857962464 and parameters: {'n_estimators': 394, 'max_depth': 50, 'min_samples_split': 2, 'min_samples_leaf': 1, 'max_features': 'sqrt', 'bootstrap': False, 'criterion': 'squared_error'}. Best is trial 457 with value: 0.3223992246327795.
[I 2024-12-04 20:01:40,014] Trial 615 finished with value: 0.4112061072942955 and parameters: {'n_estimators': 417, 'max_depth': 42, 'min_samples_split': 4, 'min_samples_leaf': 1, 'max_features': 'sqrt', 'bootstrap': False, 'criterion': 'squared_error'}. Best is trial 457 with value: 0.3223992246327795.
[I 2024-12-04 20:01:40,139] Trial 614 finished with value: 0.34934420687237 and parameters: {'n_estimators': 380, 'max_depth': 44, 'min_samples_split': 2, 'min_samples_leaf': 1, 'max_features': 'sqrt', 'bootstrap': False, 'criterion': 'squared_error'}. Best is trial 457 with value: 0.3223992246327795.
[I 2024-12-04 20:01:42,629] Trial 616 finished with value: 0.3289152627848989 and parameters: {'n_estimators': 487, 'max_depth': 50, 'min_samples_split': 2, 'min_samples_leaf': 1, 'max_features': 'sqrt', 'bootstrap': False, 'criterion': 'squared_error'}. Best is trial 457 with value: 0.3223992246327795.
[I 2024-12-04 20:01:44,483] Trial 618 finished with value: 0.3229145969515213 and parameters: {'n_estimators': 349, 'max_depth': 50, 'min_samples_split': 2, 'min_samples_leaf': 1, 'max_features': 'sqrt', 'bootstrap': False, 'criterion': 'squared_error'}. Best is trial 457 with value: 0.3223992246327795.
[I 2024-12-04 20:01:45,760] Trial 619 finished with value: 0.6924644195631634 and parameters: {'n_estimators': 431, 'max_depth': 41, 'min_samples_split': 2, 'min_samples_leaf': 2, 'max_features': 'sqrt', 'bootstrap': False, 'criterion': 'squared_error'}. Best is trial 457 with value: 0.3223992246327795.
[I 2024-12-04 20:01:46,795] Trial 620 finished with value: 1.323288224670872 and parameters: {'n_estimators': 218, 'max_depth': 16, 'min_samples_split': 3, 'min_samples_leaf': 4, 'max_features': 'log2', 'bootstrap': True, 'criterion': 'absolute_error'}. Best is trial 457 with value: 0.3223992246327795.
[I 2024-12-04 20:01:48,782] Trial 621 finished with value: 0.3592714428306031 and parameters: {'n_estimators': 384, 'max_depth': 50, 'min_samples_split': 3, 'min_samples_leaf': 1, 'max_features': 'sqrt', 'bootstrap': False, 'criterion': 'squared_error'}. Best is trial 457 with value: 0.3223992246327795.
[I 2024-12-04 20:01:55,977] Trial 617 finished with value: 0.867398339641885 and parameters: {'n_estimators': 964, 'max_depth': 40, 'min_samples_split': 14, 'min_samples_leaf': 1, 'max_features': 'log2', 'bootstrap': False, 'criterion': 'absolute_error'}. Best is trial 457 with value: 0.3223992246327795.
[I 2024-12-04 20:01:57,842] Trial 623 finished with value: 0.3909228324602917 and parameters: {'n_estimators': 547, 'max_depth': 50, 'min_samples_split': 4, 'min_samples_leaf': 1, 'max_features': 'sqrt', 'bootstrap': False, 'criterion': 'squared_error'}. Best is trial 457 with value: 0.3223992246327795.
[I 2024-12-04 20:02:00,095] Trial 624 finished with value: 0.35544086257758056 and parameters: {'n_estimators': 504, 'max_depth': 42, 'min_samples_split': 2, 'min_samples_leaf': 1, 'max_features': 'sqrt', 'bootstrap': False, 'criterion': 'squared_error'}. Best is trial 457 with value: 0.3223992246327795.
[I 2024-12-04 20:02:02,059] Trial 625 finished with value: 0.3246034982388779 and parameters: {'n_estimators': 388, 'max_depth': 49, 'min_samples_split': 2, 'min_samples_leaf': 1, 'max_features': 'sqrt', 'bootstrap': False, 'criterion': 'squared_error'}. Best is trial 457 with value: 0.3223992246327795.
[I 2024-12-04 20:02:04,283] Trial 626 finished with value: 0.3280120332460482 and parameters: {'n_estimators': 444, 'max_depth': 50, 'min_samples_split': 2, 'min_samples_leaf': 1, 'max_features': 'sqrt', 'bootstrap': False, 'criterion': 'squared_error'}. Best is trial 457 with value: 0.3223992246327795.
[I 2024-12-04 20:02:05,623] Trial 627 finished with value: 0.6853951677128238 and parameters: {'n_estimators': 406, 'max_depth': 48, 'min_samples_split': 4, 'min_samples_leaf': 2, 'max_features': 'sqrt', 'bootstrap': False, 'criterion': 'squared_error'}. Best is trial 457 with value: 0.3223992246327795.
[I 2024-12-04 20:02:07,411] Trial 628 finished with value: 0.5198675699070285 and parameters: {'n_estimators': 363, 'max_depth': 49, 'min_samples_split': 2, 'min_samples_leaf': 1, 'max_features': 'log2', 'bootstrap': False, 'criterion': 'squared_error'}. Best is trial 457 with value: 0.3223992246327795.
[I 2024-12-04 20:02:08,039] Trial 622 finished with value: 0.7490037500115438 and parameters: {'n_estimators': 675, 'max_depth': 41, 'min_samples_split': 45, 'min_samples_leaf': 3, 'max_features': None, 'bootstrap': True, 'criterion': 'absolute_error'}. Best is trial 457 with value: 0.3223992246327795.
[I 2024-12-04 20:02:09,443] Trial 629 finished with value: 0.4155654557606543 and parameters: {'n_estimators': 293, 'max_depth': 46, 'min_samples_split': 3, 'min_samples_leaf': 1, 'max_features': 'sqrt', 'bootstrap': True, 'criterion': 'squared_error'}. Best is trial 457 with value: 0.3223992246327795.
[I 2024-12-04 20:02:10,741] Trial 630 finished with value: 0.8244976118845007 and parameters: {'n_estimators': 281, 'max_depth': 14, 'min_samples_split': 39, 'min_samples_leaf': 6, 'max_features': None, 'bootstrap': False, 'criterion': 'squared_error'}. Best is trial 457 with value: 0.3223992246327795.
[I 2024-12-04 20:02:11,792] Trial 631 finished with value: 0.32339780767094983 and parameters: {'n_estimators': 365, 'max_depth': 50, 'min_samples_split': 2, 'min_samples_leaf': 1, 'max_features': 'sqrt', 'bootstrap': False, 'criterion': 'squared_error'}. Best is trial 457 with value: 0.3223992246327795.
[I 2024-12-04 20:02:12,926] Trial 632 finished with value: 0.3235042880148085 and parameters: {'n_estimators': 388, 'max_depth': 50, 'min_samples_split': 2, 'min_samples_leaf': 1, 'max_features': 'sqrt', 'bootstrap': False, 'criterion': 'squared_error'}. Best is trial 457 with value: 0.3223992246327795.
[I 2024-12-04 20:02:14,849] Trial 633 finished with value: 0.4339465355878177 and parameters: {'n_estimators': 242, 'max_depth': 50, 'min_samples_split': 2, 'min_samples_leaf': 1, 'max_features': None, 'bootstrap': False, 'criterion': 'squared_error'}. Best is trial 457 with value: 0.3223992246327795.
[I 2024-12-04 20:02:15,690] Trial 634 finished with value: 0.3274312800271848 and parameters: {'n_estimators': 517, 'max_depth': 50, 'min_samples_split': 2, 'min_samples_leaf': 1, 'max_features': 'sqrt', 'bootstrap': False, 'criterion': 'squared_error'}. Best is trial 457 with value: 0.3223992246327795.
[I 2024-12-04 20:02:16,570] Trial 635 finished with value: 0.6906257238861914 and parameters: {'n_estimators': 505, 'max_depth': 42, 'min_samples_split': 2, 'min_samples_leaf': 2, 'max_features': 'sqrt', 'bootstrap': False, 'criterion': 'squared_error'}. Best is trial 457 with value: 0.3223992246327795.
[I 2024-12-04 20:02:17,916] Trial 637 finished with value: 0.6809999649712146 and parameters: {'n_estimators': 398, 'max_depth': 50, 'min_samples_split': 4, 'min_samples_leaf': 2, 'max_features': 'sqrt', 'bootstrap': False, 'criterion': 'squared_error'}. Best is trial 457 with value: 0.3223992246327795.
[I 2024-12-04 20:02:19,186] Trial 636 finished with value: 0.6513094710695723 and parameters: {'n_estimators': 241, 'max_depth': 49, 'min_samples_split': 3, 'min_samples_leaf': 1, 'max_features': 'log2', 'bootstrap': True, 'criterion': 'absolute_error'}. Best is trial 457 with value: 0.3223992246327795.
[I 2024-12-04 20:02:19,521] Trial 638 finished with value: 0.6831748175883336 and parameters: {'n_estimators': 400, 'max_depth': 50, 'min_samples_split': 2, 'min_samples_leaf': 2, 'max_features': 'sqrt', 'bootstrap': False, 'criterion': 'squared_error'}. Best is trial 457 with value: 0.3223992246327795.
[I 2024-12-04 20:02:21,182] Trial 639 finished with value: 0.3959843852111139 and parameters: {'n_estimators': 352, 'max_depth': 44, 'min_samples_split': 4, 'min_samples_leaf': 1, 'max_features': 'sqrt', 'bootstrap': False, 'criterion': 'squared_error'}. Best is trial 457 with value: 0.3223992246327795.
[I 2024-12-04 20:02:21,924] Trial 640 finished with value: 0.345943322251939 and parameters: {'n_estimators': 331, 'max_depth': 42, 'min_samples_split': 2, 'min_samples_leaf': 1, 'max_features': 'sqrt', 'bootstrap': False, 'criterion': 'squared_error'}. Best is trial 457 with value: 0.3223992246327795.
[I 2024-12-04 20:02:22,741] Trial 613 finished with value: 0.5769690795871388 and parameters: {'n_estimators': 567, 'max_depth': 50, 'min_samples_split': 31, 'min_samples_leaf': 2, 'max_features': None, 'bootstrap': False, 'criterion': 'absolute_error'}. Best is trial 457 with value: 0.3223992246327795.
[I 2024-12-04 20:02:23,814] Trial 641 finished with value: 0.3444999972990166 and parameters: {'n_estimators': 508, 'max_depth': 45, 'min_samples_split': 2, 'min_samples_leaf': 1, 'max_features': 'sqrt', 'bootstrap': False, 'criterion': 'squared_error'}. Best is trial 457 with value: 0.3223992246327795.
[I 2024-12-04 20:02:24,813] Trial 643 finished with value: 0.34904615837806097 and parameters: {'n_estimators': 385, 'max_depth': 42, 'min_samples_split': 2, 'min_samples_leaf': 1, 'max_features': 'sqrt', 'bootstrap': False, 'criterion': 'squared_error'}. Best is trial 457 with value: 0.3223992246327795.
[I 2024-12-04 20:02:25,469] Trial 642 finished with value: 1.1724239258030922 and parameters: {'n_estimators': 334, 'max_depth': 11, 'min_samples_split': 3, 'min_samples_leaf': 1, 'max_features': 'log2', 'bootstrap': False, 'criterion': 'absolute_error'}. Best is trial 457 with value: 0.3223992246327795.
[I 2024-12-04 20:02:26,503] Trial 645 finished with value: 0.3867960110013145 and parameters: {'n_estimators': 376, 'max_depth': 50, 'min_samples_split': 4, 'min_samples_leaf': 1, 'max_features': 'sqrt', 'bootstrap': False, 'criterion': 'squared_error'}. Best is trial 457 with value: 0.3223992246327795.
[I 2024-12-04 20:02:27,222] Trial 646 finished with value: 0.582166891328145 and parameters: {'n_estimators': 325, 'max_depth': 7, 'min_samples_split': 23, 'min_samples_leaf': 1, 'max_features': None, 'bootstrap': True, 'criterion': 'squared_error'}. Best is trial 457 with value: 0.3223992246327795.
[I 2024-12-04 20:02:27,914] Trial 644 finished with value: 0.42981971672288266 and parameters: {'n_estimators': 402, 'max_depth': 48, 'min_samples_split': 3, 'min_samples_leaf': 1, 'max_features': None, 'bootstrap': False, 'criterion': 'squared_error'}. Best is trial 457 with value: 0.3223992246327795.
[I 2024-12-04 20:02:28,960] Trial 648 finished with value: 0.3251328347291972 and parameters: {'n_estimators': 270, 'max_depth': 50, 'min_samples_split': 2, 'min_samples_leaf': 1, 'max_features': 'sqrt', 'bootstrap': False, 'criterion': 'squared_error'}. Best is trial 457 with value: 0.3223992246327795.
[I 2024-12-04 20:02:29,625] Trial 649 finished with value: 0.3984682982564384 and parameters: {'n_estimators': 353, 'max_depth': 43, 'min_samples_split': 3, 'min_samples_leaf': 1, 'max_features': 'sqrt', 'bootstrap': False, 'criterion': 'squared_error'}. Best is trial 457 with value: 0.3223992246327795.
[I 2024-12-04 20:02:30,331] Trial 650 finished with value: 0.6775453151089537 and parameters: {'n_estimators': 349, 'max_depth': 41, 'min_samples_split': 2, 'min_samples_leaf': 2, 'max_features': 'sqrt', 'bootstrap': False, 'criterion': 'squared_error'}. Best is trial 457 with value: 0.3223992246327795.
[I 2024-12-04 20:02:30,772] Trial 651 finished with value: 1.3483968768534604 and parameters: {'n_estimators': 253, 'max_depth': 46, 'min_samples_split': 4, 'min_samples_leaf': 13, 'max_features': 'log2', 'bootstrap': True, 'criterion': 'absolute_error'}. Best is trial 457 with value: 0.3223992246327795.
[I 2024-12-04 20:02:31,092] Trial 647 finished with value: 0.5409213970834537 and parameters: {'n_estimators': 594, 'max_depth': 49, 'min_samples_split': 5, 'min_samples_leaf': 2, 'max_features': None, 'bootstrap': False, 'criterion': 'squared_error'}. Best is trial 457 with value: 0.3223992246327795.
[I 2024-12-04 20:02:31,455] Trial 652 finished with value: 1.2738121179808446 and parameters: {'n_estimators': 251, 'max_depth': 22, 'min_samples_split': 4, 'min_samples_leaf': 11, 'max_features': 'log2', 'bootstrap': False, 'criterion': 'squared_error'}. Best is trial 457 with value: 0.3223992246327795.
[I 2024-12-04 20:02:33,218] Trial 653 finished with value: 0.32361613927664123 and parameters: {'n_estimators': 389, 'max_depth': 50, 'min_samples_split': 2, 'min_samples_leaf': 1, 'max_features': 'sqrt', 'bootstrap': False, 'criterion': 'squared_error'}. Best is trial 457 with value: 0.3223992246327795.
[I 2024-12-04 20:02:33,604] Trial 654 finished with value: 0.3333661176843189 and parameters: {'n_estimators': 394, 'max_depth': 48, 'min_samples_split': 2, 'min_samples_leaf': 1, 'max_features': 'sqrt', 'bootstrap': False, 'criterion': 'squared_error'}. Best is trial 457 with value: 0.3223992246327795.
[I 2024-12-04 20:02:33,925] Trial 655 finished with value: 0.3834564389983984 and parameters: {'n_estimators': 463, 'max_depth': 47, 'min_samples_split': 2, 'min_samples_leaf': 1, 'max_features': 'sqrt', 'bootstrap': True, 'criterion': 'squared_error'}. Best is trial 457 with value: 0.3223992246327795.
[I 2024-12-04 20:02:35,305] Trial 656 finished with value: 0.35575491018219607 and parameters: {'n_estimators': 321, 'max_depth': 50, 'min_samples_split': 3, 'min_samples_leaf': 1, 'max_features': 'sqrt', 'bootstrap': False, 'criterion': 'squared_error'}. Best is trial 457 with value: 0.3223992246327795.
[I 2024-12-04 20:02:35,371] Trial 657 finished with value: 0.6845543963997348 and parameters: {'n_estimators': 432, 'max_depth': 49, 'min_samples_split': 2, 'min_samples_leaf': 2, 'max_features': 'sqrt', 'bootstrap': False, 'criterion': 'squared_error'}. Best is trial 457 with value: 0.3223992246327795.
[I 2024-12-04 20:02:35,719] Trial 658 finished with value: 1.0934741214828356 and parameters: {'n_estimators': 828, 'max_depth': 38, 'min_samples_split': 17, 'min_samples_leaf': 2, 'max_features': 'log2', 'bootstrap': False, 'criterion': 'squared_error'}. Best is trial 457 with value: 0.3223992246327795.
[I 2024-12-04 20:02:37,781] Trial 660 finished with value: 0.48651813061257587 and parameters: {'n_estimators': 458, 'max_depth': 6, 'min_samples_split': 3, 'min_samples_leaf': 1, 'max_features': None, 'bootstrap': True, 'criterion': 'squared_error'}. Best is trial 457 with value: 0.3223992246327795.
[I 2024-12-04 20:02:38,490] Trial 659 finished with value: 0.49655369705139407 and parameters: {'n_estimators': 439, 'max_depth': 47, 'min_samples_split': 3, 'min_samples_leaf': 2, 'max_features': None, 'bootstrap': True, 'criterion': 'squared_error'}. Best is trial 457 with value: 0.3223992246327795.
[I 2024-12-04 20:02:41,053] Trial 663 finished with value: 0.32789474722313194 and parameters: {'n_estimators': 552, 'max_depth': 50, 'min_samples_split': 2, 'min_samples_leaf': 1, 'max_features': 'sqrt', 'bootstrap': False, 'criterion': 'squared_error'}. Best is trial 457 with value: 0.3223992246327795.
[I 2024-12-04 20:02:42,880] Trial 664 finished with value: 0.3223992246327795 and parameters: {'n_estimators': 344, 'max_depth': 50, 'min_samples_split': 2, 'min_samples_leaf': 1, 'max_features': 'sqrt', 'bootstrap': False, 'criterion': 'squared_error'}. Best is trial 457 with value: 0.3223992246327795.
[I 2024-12-04 20:02:44,395] Trial 665 finished with value: 0.34641728570352137 and parameters: {'n_estimators': 263, 'max_depth': 42, 'min_samples_split': 2, 'min_samples_leaf': 1, 'max_features': 'sqrt', 'bootstrap': False, 'criterion': 'squared_error'}. Best is trial 457 with value: 0.3223992246327795.
[I 2024-12-04 20:02:46,312] Trial 666 finished with value: 0.36057910078504685 and parameters: {'n_estimators': 398, 'max_depth': 40, 'min_samples_split': 2, 'min_samples_leaf': 1, 'max_features': 'sqrt', 'bootstrap': False, 'criterion': 'squared_error'}. Best is trial 457 with value: 0.3223992246327795.
[I 2024-12-04 20:02:46,952] Trial 662 finished with value: 0.8810732482798855 and parameters: {'n_estimators': 585, 'max_depth': 50, 'min_samples_split': 2, 'min_samples_leaf': 2, 'max_features': 'sqrt', 'bootstrap': False, 'criterion': 'absolute_error'}. Best is trial 457 with value: 0.3223992246327795.
[I 2024-12-04 20:02:47,626] Trial 667 finished with value: 0.6684163752584301 and parameters: {'n_estimators': 352, 'max_depth': 49, 'min_samples_split': 2, 'min_samples_leaf': 2, 'max_features': 'sqrt', 'bootstrap': False, 'criterion': 'squared_error'}. Best is trial 457 with value: 0.3223992246327795.
[I 2024-12-04 20:02:47,757] Trial 661 finished with value: 0.4028592892004243 and parameters: {'n_estimators': 472, 'max_depth': 40, 'min_samples_split': 3, 'min_samples_leaf': 1, 'max_features': 'sqrt', 'bootstrap': False, 'criterion': 'absolute_error'}. Best is trial 457 with value: 0.3223992246327795.
[I 2024-12-04 20:02:48,686] Trial 668 finished with value: 0.3227296072813751 and parameters: {'n_estimators': 223, 'max_depth': 50, 'min_samples_split': 2, 'min_samples_leaf': 1, 'max_features': 'sqrt', 'bootstrap': False, 'criterion': 'squared_error'}. Best is trial 457 with value: 0.3223992246327795.
[I 2024-12-04 20:02:49,646] Trial 669 finished with value: 0.33443446772883134 and parameters: {'n_estimators': 331, 'max_depth': 45, 'min_samples_split': 2, 'min_samples_leaf': 1, 'max_features': 'sqrt', 'bootstrap': False, 'criterion': 'squared_error'}. Best is trial 457 with value: 0.3223992246327795.
[I 2024-12-04 20:02:49,649] Trial 671 finished with value: 0.4049606735333415 and parameters: {'n_estimators': 162, 'max_depth': 44, 'min_samples_split': 4, 'min_samples_leaf': 1, 'max_features': 'sqrt', 'bootstrap': False, 'criterion': 'squared_error'}. Best is trial 457 with value: 0.3223992246327795.
[I 2024-12-04 20:02:49,820] Trial 670 finished with value: 0.32485742519439137 and parameters: {'n_estimators': 304, 'max_depth': 50, 'min_samples_split': 2, 'min_samples_leaf': 1, 'max_features': 'sqrt', 'bootstrap': False, 'criterion': 'squared_error'}. Best is trial 457 with value: 0.3223992246327795.
[I 2024-12-04 20:02:51,498] Trial 674 finished with value: 0.3831955912844492 and parameters: {'n_estimators': 184, 'max_depth': 47, 'min_samples_split': 3, 'min_samples_leaf': 1, 'max_features': 'sqrt', 'bootstrap': False, 'criterion': 'squared_error'}. Best is trial 457 with value: 0.3223992246327795.
[I 2024-12-04 20:02:51,632] Trial 672 finished with value: 0.33017059761364004 and parameters: {'n_estimators': 198, 'max_depth': 49, 'min_samples_split': 2, 'min_samples_leaf': 1, 'max_features': 'sqrt', 'bootstrap': False, 'criterion': 'squared_error'}. Best is trial 457 with value: 0.3223992246327795.
[I 2024-12-04 20:02:52,704] Trial 675 finished with value: 0.6554358605766072 and parameters: {'n_estimators': 202, 'max_depth': 50, 'min_samples_split': 4, 'min_samples_leaf': 2, 'max_features': 'sqrt', 'bootstrap': False, 'criterion': 'squared_error'}. Best is trial 457 with value: 0.3223992246327795.
[I 2024-12-04 20:02:53,139] Trial 676 finished with value: 1.1811381205432498 and parameters: {'n_estimators': 803, 'max_depth': 40, 'min_samples_split': 4, 'min_samples_leaf': 3, 'max_features': 'log2', 'bootstrap': False, 'criterion': 'squared_error'}. Best is trial 457 with value: 0.3223992246327795.
[I 2024-12-04 20:02:53,743] Trial 677 finished with value: 0.6545599450672615 and parameters: {'n_estimators': 191, 'max_depth': 50, 'min_samples_split': 2, 'min_samples_leaf': 2, 'max_features': 'sqrt', 'bootstrap': False, 'criterion': 'squared_error'}. Best is trial 457 with value: 0.3223992246327795.
[I 2024-12-04 20:02:54,908] Trial 678 finished with value: 0.3570656100187674 and parameters: {'n_estimators': 344, 'max_depth': 50, 'min_samples_split': 3, 'min_samples_leaf': 1, 'max_features': 'sqrt', 'bootstrap': False, 'criterion': 'squared_error'}. Best is trial 457 with value: 0.3223992246327795.
[I 2024-12-04 20:02:55,150] Trial 679 finished with value: 0.3745070527284873 and parameters: {'n_estimators': 208, 'max_depth': 50, 'min_samples_split': 2, 'min_samples_leaf': 1, 'max_features': 'sqrt', 'bootstrap': True, 'criterion': 'squared_error'}. Best is trial 457 with value: 0.3223992246327795.
[I 2024-12-04 20:02:56,544] Trial 681 finished with value: 0.37114312101440855 and parameters: {'n_estimators': 165, 'max_depth': 49, 'min_samples_split': 3, 'min_samples_leaf': 1, 'max_features': 'sqrt', 'bootstrap': False, 'criterion': 'squared_error'}. Best is trial 457 with value: 0.3223992246327795.
[I 2024-12-04 20:02:56,989] Trial 680 finished with value: 0.7066768340109006 and parameters: {'n_estimators': 788, 'max_depth': 49, 'min_samples_split': 10, 'min_samples_leaf': 1, 'max_features': 'log2', 'bootstrap': True, 'criterion': 'squared_error'}. Best is trial 457 with value: 0.3223992246327795.
[I 2024-12-04 20:02:58,098] Trial 682 finished with value: 0.3373768406965419 and parameters: {'n_estimators': 228, 'max_depth': 47, 'min_samples_split': 2, 'min_samples_leaf': 1, 'max_features': 'sqrt', 'bootstrap': False, 'criterion': 'squared_error'}. Best is trial 457 with value: 0.3223992246327795.
[I 2024-12-04 20:02:58,757] Trial 683 finished with value: 0.32353349303693907 and parameters: {'n_estimators': 258, 'max_depth': 50, 'min_samples_split': 2, 'min_samples_leaf': 1, 'max_features': 'sqrt', 'bootstrap': False, 'criterion': 'squared_error'}. Best is trial 457 with value: 0.3223992246327795.
[I 2024-12-04 20:03:00,254] Trial 685 finished with value: 0.347988854356834 and parameters: {'n_estimators': 267, 'max_depth': 42, 'min_samples_split': 2, 'min_samples_leaf': 1, 'max_features': 'sqrt', 'bootstrap': False, 'criterion': 'squared_error'}. Best is trial 457 with value: 0.3223992246327795.
