[I 2024-12-04 19:45:55,589] Trial 182 finished with value: 0.3592112653832147 and parameters: {'kernel_type': 'Matern', 'length_scale': 2.8817290650392757, 'noise_level': 0.008146994011616067, 'constant_value': 0.1300485020803684, 'nu': 0.5}. Best is trial 112 with value: 0.35921013248560313.
[I 2024-12-04 19:45:57,425] Trial 181 finished with value: 1.062416117228051 and parameters: {'kernel_type': 'Matern', 'length_scale': 51600.872641616545, 'noise_level': 1.1929828659926477e-08, 'constant_value': 75388.69066817885, 'nu': 2.5}. Best is trial 112 with value: 0.35921013248560313.
[I 2024-12-04 19:45:57,841] Trial 183 finished with value: 1.0624161172585467 and parameters: {'kernel_type': 'Matern', 'length_scale': 595.1455079597945, 'noise_level': 0.007461837014518658, 'constant_value': 0.07653693981607375, 'nu': 0.5}. Best is trial 112 with value: 0.35921013248560313.
[I 2024-12-04 19:46:00,690] Trial 184 finished with value: 0.35921125261605064 and parameters: {'kernel_type': 'Matern', 'length_scale': 26.1200330168855, 'noise_level': 0.1327003058567757, 'constant_value': 18.899769087701163, 'nu': 0.5}. Best is trial 112 with value: 0.35921013248560313.
[I 2024-12-04 19:46:01,262] Trial 186 finished with value: 1.0916558493887198 and parameters: {'kernel_type': 'Matern', 'length_scale': 7.846227808637716e-05, 'noise_level': 2.946914446645521e-07, 'constant_value': 6221.4286162930175, 'nu': 2.5}. Best is trial 112 with value: 0.35921013248560313.
[I 2024-12-04 19:46:08,902] Trial 187 finished with value: 0.3592112664760507 and parameters: {'kernel_type': 'Matern', 'length_scale': 2.452145384463181, 'noise_level': 0.3787552308324707, 'constant_value': 1.7946513659418064e-05, 'nu': 0.5}. Best is trial 112 with value: 0.35921013248560313.
[I 2024-12-04 19:46:11,351] Trial 185 finished with value: 1.0624161172145283 and parameters: {'kernel_type': 'Matern', 'length_scale': 828.1017086161505, 'noise_level': 0.009703054112945513, 'constant_value': 3.586527133644588e-05, 'nu': 0.5}. Best is trial 112 with value: 0.35921013248560313.
[I 2024-12-04 19:46:11,993] Trial 188 finished with value: 1.0624161172697637 and parameters: {'kernel_type': 'Matern', 'length_scale': 317.1836249279905, 'noise_level': 0.04828622995505556, 'constant_value': 0.006924252663789993, 'nu': 1.5}. Best is trial 112 with value: 0.35921013248560313.
[I 2024-12-04 19:46:14,240] Trial 191 finished with value: 1.091646165492225 and parameters: {'kernel_type': 'Matern', 'length_scale': 212.6363527063489, 'noise_level': 0.895531327184047, 'constant_value': 1.5923407073159149e-06, 'nu': 0.5}. Best is trial 112 with value: 0.35921013248560313.
[I 2024-12-04 19:46:17,609] Trial 189 finished with value: 0.42868350086682755 and parameters: {'kernel_type': 'RBF', 'length_scale': 15777.136832467104, 'noise_level': 0.7633747189064505, 'constant_value': 35.5135562295002, 'nu': 2.5}. Best is trial 112 with value: 0.35921013248560313.
[I 2024-12-04 19:46:22,528] Trial 193 finished with value: 0.35921183499912335 and parameters: {'kernel_type': 'Matern', 'length_scale': 2.5448689936347493, 'noise_level': 0.7494890906223013, 'constant_value': 0.018867441377101318, 'nu': 0.5}. Best is trial 112 with value: 0.35921013248560313.
[I 2024-12-04 19:46:23,101] Trial 192 finished with value: 0.3592112584472439 and parameters: {'kernel_type': 'Matern', 'length_scale': 4.110476559018874, 'noise_level': 0.0008398283811341411, 'constant_value': 0.03499377553387673, 'nu': 0.5}. Best is trial 112 with value: 0.35921013248560313.
[I 2024-12-04 19:46:24,392] Trial 190 finished with value: 0.35921122118004595 and parameters: {'kernel_type': 'Matern', 'length_scale': 876.8350160717662, 'noise_level': 0.390064338497197, 'constant_value': 0.0013886745014445095, 'nu': 0.5}. Best is trial 112 with value: 0.35921013248560313.
[I 2024-12-04 19:46:27,728] Trial 194 finished with value: 0.3592109069560118 and parameters: {'kernel_type': 'Matern', 'length_scale': 1107.1074108576793, 'noise_level': 0.6556377175076329, 'constant_value': 146.6883485252212, 'nu': 0.5}. Best is trial 112 with value: 0.35921013248560313.
[I 2024-12-04 19:46:29,046] Trial 196 finished with value: 0.35921213855100564 and parameters: {'kernel_type': 'Matern', 'length_scale': 1.0067004270449664, 'noise_level': 7.738199423693292e-05, 'constant_value': 235.66534020862534, 'nu': 0.5}. Best is trial 112 with value: 0.35921013248560313.
[I 2024-12-04 19:46:29,977] Trial 195 finished with value: 0.4286834796357125 and parameters: {'kernel_type': 'RBF', 'length_scale': 0.6830368914941242, 'noise_level': 0.13488548921687707, 'constant_value': 0.00035612305679715305, 'nu': 0.5}. Best is trial 112 with value: 0.35921013248560313.
[I 2024-12-04 19:46:33,192] Trial 197 finished with value: 0.35921124397409115 and parameters: {'kernel_type': 'Matern', 'length_scale': 2959.9406182816424, 'noise_level': 0.651253912131715, 'constant_value': 235.2874927671239, 'nu': 0.5}. Best is trial 112 with value: 0.35921013248560313.
[I 2024-12-04 19:46:34,391] Trial 199 finished with value: 0.3592098145876718 and parameters: {'kernel_type': 'Matern', 'length_scale': 96.39664194015103, 'noise_level': 0.19806156508614828, 'constant_value': 7.907045462819886, 'nu': 0.5}. Best is trial 199 with value: 0.3592098145876718.
[I 2024-12-04 19:46:37,840] Trial 198 finished with value: 0.35921140124712414 and parameters: {'kernel_type': 'Matern', 'length_scale': 68.82973268272157, 'noise_level': 0.16508054388105423, 'constant_value': 0.00017060663078481263, 'nu': 0.5}. Best is trial 199 with value: 0.3592098145876718.
[I 2024-12-04 19:46:39,958] Trial 200 finished with value: 1.0624161173731443 and parameters: {'kernel_type': 'Matern', 'length_scale': 136.10066071775054, 'noise_level': 0.0055523160277066805, 'constant_value': 0.04119208667003863, 'nu': 0.5}. Best is trial 199 with value: 0.3592098145876718.
[I 2024-12-04 19:46:40,003] Trial 201 finished with value: 0.35921174123188004 and parameters: {'kernel_type': 'Matern', 'length_scale': 975.5607484996694, 'noise_level': 0.3412762293626147, 'constant_value': 4.018545776385549, 'nu': 0.5}. Best is trial 199 with value: 0.3592098145876718.
[I 2024-12-04 19:46:43,201] Trial 202 finished with value: 0.35921122178043496 and parameters: {'kernel_type': 'Matern', 'length_scale': 3242.003404576063, 'noise_level': 0.774957111111661, 'constant_value': 183.06973005635257, 'nu': 0.5}. Best is trial 199 with value: 0.3592098145876718.
[I 2024-12-04 19:46:44,842] Trial 204 finished with value: 0.3592112825443582 and parameters: {'kernel_type': 'Matern', 'length_scale': 30.84455553346367, 'noise_level': 0.0010708136543738798, 'constant_value': 2.3544129285210427, 'nu': 0.5}. Best is trial 199 with value: 0.3592098145876718.
[I 2024-12-04 19:46:45,086] Trial 203 finished with value: 0.35921082028281504 and parameters: {'kernel_type': 'Matern', 'length_scale': 32.52898475827361, 'noise_level': 0.6105722570062869, 'constant_value': 99.46134732693898, 'nu': 0.5}. Best is trial 199 with value: 0.3592098145876718.
[I 2024-12-04 19:46:48,023] Trial 205 finished with value: 0.35921103594696785 and parameters: {'kernel_type': 'Matern', 'length_scale': 36.10213285954262, 'noise_level': 0.04182303402414661, 'constant_value': 23.789708517481213, 'nu': 0.5}. Best is trial 199 with value: 0.3592098145876718.
[I 2024-12-04 19:46:49,584] Trial 206 finished with value: 0.3592112524785869 and parameters: {'kernel_type': 'Matern', 'length_scale': 275.05035775847625, 'noise_level': 0.10577382102221702, 'constant_value': 398.8749004005777, 'nu': 0.5}. Best is trial 199 with value: 0.3592098145876718.
[I 2024-12-04 19:46:49,819] Trial 207 finished with value: 0.3592112891453683 and parameters: {'kernel_type': 'Matern', 'length_scale': 9.840012564096284, 'noise_level': 0.5308189207748004, 'constant_value': 13.805737558084322, 'nu': 0.5}. Best is trial 199 with value: 0.3592098145876718.
[I 2024-12-04 19:46:52,618] Trial 208 finished with value: 0.3592112753180218 and parameters: {'kernel_type': 'Matern', 'length_scale': 56.67986114501237, 'noise_level': 0.010509627552467421, 'constant_value': 2.8232921389179273, 'nu': 0.5}. Best is trial 199 with value: 0.3592098145876718.
[I 2024-12-04 19:46:53,554] Trial 209 finished with value: 0.428683512499666 and parameters: {'kernel_type': 'RBF', 'length_scale': 0.5314088241473405, 'noise_level': 6.911982560835416e-05, 'constant_value': 85.63037045318985, 'nu': 0.5}. Best is trial 199 with value: 0.3592098145876718.
[I 2024-12-04 19:46:56,457] Trial 210 finished with value: 1.0624161172715199 and parameters: {'kernel_type': 'Matern', 'length_scale': 359.2784144389908, 'noise_level': 0.0074683878370604695, 'constant_value': 12.107574675473865, 'nu': 2.5}. Best is trial 199 with value: 0.3592098145876718.
[I 2024-12-04 19:46:59,178] Trial 212 finished with value: 0.4286836473993797 and parameters: {'kernel_type': 'RBF', 'length_scale': 119.81894063904097, 'noise_level': 0.1637246273081095, 'constant_value': 33.08356218990858, 'nu': 0.5}. Best is trial 199 with value: 0.3592098145876718.
[I 2024-12-04 19:47:00,861] Trial 213 finished with value: 0.3592110449145645 and parameters: {'kernel_type': 'Matern', 'length_scale': 675.2008733725385, 'noise_level': 0.6697894986416912, 'constant_value': 11.493178182443263, 'nu': 0.5}. Best is trial 199 with value: 0.3592098145876718.
[I 2024-12-04 19:47:03,779] Trial 215 finished with value: 1.0916558493863155 and parameters: {'kernel_type': 'RBF', 'length_scale': 0.0008246606728485609, 'noise_level': 3.081628937019655e-05, 'constant_value': 121.6046396622713, 'nu': 1.5}. Best is trial 199 with value: 0.3592098145876718.
[I 2024-12-04 19:47:03,882] Trial 214 finished with value: 0.35921141963717823 and parameters: {'kernel_type': 'Matern', 'length_scale': 7.771424534803637, 'noise_level': 0.002108610465472784, 'constant_value': 15.114411718866773, 'nu': 0.5}. Best is trial 199 with value: 0.3592098145876718.
[I 2024-12-04 19:47:05,578] Trial 211 finished with value: 0.35921140311154276 and parameters: {'kernel_type': 'Matern', 'length_scale': 0.10544388007429571, 'noise_level': 2.107893256195944e-06, 'constant_value': 0.48889995731104, 'nu': 0.5}. Best is trial 199 with value: 0.3592098145876718.
[I 2024-12-04 19:47:08,002] Trial 216 finished with value: 0.3592112177897791 and parameters: {'kernel_type': 'Matern', 'length_scale': 74.35372886664608, 'noise_level': 0.4501248950576252, 'constant_value': 38.018193407876396, 'nu': 0.5}. Best is trial 199 with value: 0.3592098145876718.
[I 2024-12-04 19:47:09,581] Trial 218 finished with value: 0.35921121468544503 and parameters: {'kernel_type': 'Matern', 'length_scale': 123.22152997065378, 'noise_level': 0.05427146183774382, 'constant_value': 9.739894655482088, 'nu': 0.5}. Best is trial 199 with value: 0.3592098145876718.
[I 2024-12-04 19:47:09,629] Trial 217 finished with value: 0.35921117827225724 and parameters: {'kernel_type': 'Matern', 'length_scale': 1650.8982683140266, 'noise_level': 0.9753110648316955, 'constant_value': 0.4199504391005321, 'nu': 0.5}. Best is trial 199 with value: 0.3592098145876718.
[I 2024-12-04 19:47:11,050] Trial 219 finished with value: 1.0916558491589587 and parameters: {'kernel_type': 'Matern', 'length_scale': 0.09515109338825295, 'noise_level': 0.0061899071529694155, 'constant_value': 8.523436224998642, 'nu': 0.5}. Best is trial 199 with value: 0.3592098145876718.
[I 2024-12-04 19:47:15,514] Trial 220 finished with value: 0.35921068917647203 and parameters: {'kernel_type': 'Matern', 'length_scale': 90.63505502005907, 'noise_level': 0.11318921012512967, 'constant_value': 0.3664666444131372, 'nu': 0.5}. Best is trial 199 with value: 0.3592098145876718.
[I 2024-12-04 19:47:15,749] Trial 221 finished with value: 0.35921121821227786 and parameters: {'kernel_type': 'Matern', 'length_scale': 413.348964307551, 'noise_level': 0.426188454911918, 'constant_value': 134.23854555927974, 'nu': 0.5}. Best is trial 199 with value: 0.3592098145876718.
[I 2024-12-04 19:47:17,192] Trial 222 finished with value: 0.3592111851187196 and parameters: {'kernel_type': 'Matern', 'length_scale': 7797.629788859808, 'noise_level': 0.554980369197673, 'constant_value': 4.045267391578024, 'nu': 0.5}. Best is trial 199 with value: 0.3592098145876718.
[I 2024-12-04 19:47:22,067] Trial 224 finished with value: 1.062416117269486 and parameters: {'kernel_type': 'Matern', 'length_scale': 2.8391119802732656, 'noise_level': 1.173861775489549e-09, 'constant_value': 1.896214470725763e-05, 'nu': 2.5}. Best is trial 199 with value: 0.3592098145876718.
[I 2024-12-04 19:47:22,588] Trial 225 finished with value: 0.359211202966055 and parameters: {'kernel_type': 'Matern', 'length_scale': 23.629089456638653, 'noise_level': 0.3508801958263724, 'constant_value': 0.0645190983030418, 'nu': 0.5}. Best is trial 199 with value: 0.3592098145876718.
[I 2024-12-04 19:47:22,840] Trial 223 finished with value: 1.0624161179701732 and parameters: {'kernel_type': 'Matern', 'length_scale': 569.6311726094922, 'noise_level': 0.03920446995651725, 'constant_value': 0.045712472591972385, 'nu': 0.5}. Best is trial 199 with value: 0.3592098145876718.
[I 2024-12-04 19:47:25,718] Trial 227 finished with value: 1.0624161172687685 and parameters: {'kernel_type': 'RBF', 'length_scale': 0.0010289412000158862, 'noise_level': 0.019425608231050155, 'constant_value': 8.341350058076674, 'nu': 0.5}. Best is trial 199 with value: 0.3592098145876718.
[I 2024-12-04 19:47:27,316] Trial 228 finished with value: 0.35921041943827847 and parameters: {'kernel_type': 'Matern', 'length_scale': 72.60549169623647, 'noise_level': 0.13309887450656988, 'constant_value': 0.569568866849038, 'nu': 0.5}. Best is trial 199 with value: 0.3592098145876718.
[I 2024-12-04 19:47:27,889] Trial 229 finished with value: 1.0916567172902947 and parameters: {'kernel_type': 'RBF', 'length_scale': 1558.7151202778978, 'noise_level': 0.5097294314610038, 'constant_value': 3.2044813195063427e-07, 'nu': 0.5}. Best is trial 199 with value: 0.3592098145876718.
[I 2024-12-04 19:47:28,928] Trial 226 finished with value: 0.42268995094641987 and parameters: {'kernel_type': 'Matern', 'length_scale': 3583.879391296971, 'noise_level': 0.29443699876690177, 'constant_value': 114.22388343592971, 'nu': 1.5}. Best is trial 199 with value: 0.3592098145876718.
[I 2024-12-04 19:47:36,521] Trial 232 finished with value: 0.3592112656815161 and parameters: {'kernel_type': 'Matern', 'length_scale': 20.313644979194475, 'noise_level': 0.008222446170118433, 'constant_value': 0.15559080009553014, 'nu': 0.5}. Best is trial 199 with value: 0.3592098145876718.
[I 2024-12-04 19:47:36,555] Trial 230 finished with value: 1.0624161177062779 and parameters: {'kernel_type': 'Matern', 'length_scale': 0.00010964718367218329, 'noise_level': 1.58281128772976e-05, 'constant_value': 9.721185147758276e-07, 'nu': 2.5}. Best is trial 199 with value: 0.3592098145876718.
[I 2024-12-04 19:47:39,631] Trial 231 finished with value: 1.0624161172700675 and parameters: {'kernel_type': 'RBF', 'length_scale': 0.008919286091561339, 'noise_level': 0.00020013438964244426, 'constant_value': 4.37843199680185e-06, 'nu': 2.5}. Best is trial 199 with value: 0.3592098145876718.
[I 2024-12-04 19:47:41,727] Trial 233 finished with value: 1.062416091029961 and parameters: {'kernel_type': 'Matern', 'length_scale': 0.05913010911005835, 'noise_level': 0.38903327133811383, 'constant_value': 0.44657808891685546, 'nu': 0.5}. Best is trial 199 with value: 0.3592098145876718.
[I 2024-12-04 19:47:41,755] Trial 234 finished with value: 0.3592112448931697 and parameters: {'kernel_type': 'Matern', 'length_scale': 6.883299636270417, 'noise_level': 0.041221621738086654, 'constant_value': 0.7879575972492787, 'nu': 0.5}. Best is trial 199 with value: 0.3592098145876718.
[I 2024-12-04 19:47:44,499] Trial 235 finished with value: 0.35921185723135385 and parameters: {'kernel_type': 'Matern', 'length_scale': 3.325517424712444, 'noise_level': 0.0015478269249171355, 'constant_value': 218.86815242235673, 'nu': 0.5}. Best is trial 199 with value: 0.3592098145876718.
[I 2024-12-04 19:47:45,858] Trial 237 finished with value: 1.062416117773753 and parameters: {'kernel_type': 'Matern', 'length_scale': 2.4612873569904786e-05, 'noise_level': 2.647171433431035e-10, 'constant_value': 0.001994862987133922, 'nu': 0.5}. Best is trial 199 with value: 0.3592098145876718.
[I 2024-12-04 19:47:49,892] Trial 238 finished with value: 1.0916566601568884 and parameters: {'kernel_type': 'RBF', 'length_scale': 666.1697701931556, 'noise_level': 0.15470552398658824, 'constant_value': 0.00019469690420654767, 'nu': 1.5}. Best is trial 199 with value: 0.3592098145876718.
[I 2024-12-04 19:47:51,903] Trial 239 finished with value: 0.3592112185942605 and parameters: {'kernel_type': 'Matern', 'length_scale': 301.22213144997556, 'noise_level': 0.6910126790442381, 'constant_value': 0.07666976988055495, 'nu': 0.5}. Best is trial 199 with value: 0.3592098145876718.
[I 2024-12-04 19:47:52,180] Trial 236 finished with value: 1.0624161172561009 and parameters: {'kernel_type': 'RBF', 'length_scale': 39.17460949679137, 'noise_level': 4.0895907724031795e-10, 'constant_value': 1.2724161536348145e-07, 'nu': 2.5}. Best is trial 199 with value: 0.3592098145876718.
[I 2024-12-04 19:47:54,895] Trial 240 finished with value: 0.3592107496492219 and parameters: {'kernel_type': 'Matern', 'length_scale': 67.03611339976581, 'noise_level': 0.1566917240930258, 'constant_value': 2.1691914909055963, 'nu': 0.5}. Best is trial 199 with value: 0.3592098145876718.
[I 2024-12-04 19:47:56,525] Trial 241 finished with value: 0.3592113686266326 and parameters: {'kernel_type': 'Matern', 'length_scale': 106.5223770689761, 'noise_level': 0.9289537516196159, 'constant_value': 0.5912833216170169, 'nu': 0.5}. Best is trial 199 with value: 0.3592098145876718.
[I 2024-12-04 19:47:59,778] Trial 242 finished with value: 0.35921448265933886 and parameters: {'kernel_type': 'Matern', 'length_scale': 0.1217183953719566, 'noise_level': 0.0004665555604556674, 'constant_value': 1213.5280444114862, 'nu': 0.5}. Best is trial 199 with value: 0.3592098145876718.
[I 2024-12-04 19:48:00,912] Trial 244 finished with value: 0.35921112255399595 and parameters: {'kernel_type': 'Matern', 'length_scale': 63.4063486351518, 'noise_level': 0.01882822797162016, 'constant_value': 4.724938462126714, 'nu': 0.5}. Best is trial 199 with value: 0.3592098145876718.
[I 2024-12-04 19:48:02,219] Trial 243 finished with value: 1.0624161172694986 and parameters: {'kernel_type': 'Matern', 'length_scale': 42.472483903938645, 'noise_level': 0.0010087340863731758, 'constant_value': 0.0004953918000140713, 'nu': 0.5}. Best is trial 199 with value: 0.3592098145876718.
[I 2024-12-04 19:48:06,127] Trial 245 finished with value: 0.41956605831148874 and parameters: {'kernel_type': 'Matern', 'length_scale': 1.735695454211522, 'noise_level': 0.004359458050431554, 'constant_value': 2192.592674603344, 'nu': 2.5}. Best is trial 199 with value: 0.3592098145876718.
[I 2024-12-04 19:48:06,744] Trial 246 finished with value: 0.42868331688318273 and parameters: {'kernel_type': 'RBF', 'length_scale': 72.42995929064764, 'noise_level': 0.8183850171018539, 'constant_value': 0.04705795229784986, 'nu': 0.5}. Best is trial 199 with value: 0.3592098145876718.
[I 2024-12-04 19:48:07,421] Trial 247 finished with value: 0.35921124177183095 and parameters: {'kernel_type': 'Matern', 'length_scale': 269.7483806943919, 'noise_level': 0.009074090346628455, 'constant_value': 28.814171102891045, 'nu': 0.5}. Best is trial 199 with value: 0.3592098145876718.
[I 2024-12-04 19:48:11,780] Trial 249 finished with value: 1.0916558493884858 and parameters: {'kernel_type': 'RBF', 'length_scale': 0.09581934796275791, 'noise_level': 2.523332913667749e-07, 'constant_value': 24718.81934677811, 'nu': 2.5}. Best is trial 199 with value: 0.3592098145876718.
[I 2024-12-04 19:48:12,860] Trial 248 finished with value: 0.35921124451093417 and parameters: {'kernel_type': 'Matern', 'length_scale': 80.64960729876337, 'noise_level': 0.7357956077386488, 'constant_value': 503.500614058777, 'nu': 0.5}. Best is trial 199 with value: 0.3592098145876718.
[I 2024-12-04 19:48:14,861] Trial 250 finished with value: 1.062416117405851 and parameters: {'kernel_type': 'Matern', 'length_scale': 158.78392081463352, 'noise_level': 0.013999059653369495, 'constant_value': 0.19880786517542645, 'nu': 0.5}. Best is trial 199 with value: 0.3592098145876718.
[I 2024-12-04 19:48:17,824] Trial 252 finished with value: 0.3592112557386024 and parameters: {'kernel_type': 'Matern', 'length_scale': 95.64624656322165, 'noise_level': 0.03402799629034487, 'constant_value': 3.356117351761022, 'nu': 0.5}. Best is trial 199 with value: 0.3592098145876718.
[I 2024-12-04 19:48:17,967] Trial 251 finished with value: 0.35921116461948377 and parameters: {'kernel_type': 'Matern', 'length_scale': 17.71583231164715, 'noise_level': 0.5104588208520554, 'constant_value': 0.009229435264330687, 'nu': 0.5}. Best is trial 199 with value: 0.3592098145876718.
[I 2024-12-04 19:48:21,002] Trial 253 finished with value: 0.35921306843813766 and parameters: {'kernel_type': 'Matern', 'length_scale': 421.8468020959815, 'noise_level': 0.5548203068983566, 'constant_value': 0.06813879699661694, 'nu': 0.5}. Best is trial 199 with value: 0.3592098145876718.
[I 2024-12-04 19:48:21,442] Trial 255 finished with value: 1.0916551060378323 and parameters: {'kernel_type': 'Matern', 'length_scale': 0.8676927550900901, 'noise_level': 2.3795021252226685e-05, 'constant_value': 4.452491641325327, 'nu': 0.5}. Best is trial 199 with value: 0.3592098145876718.
[I 2024-12-04 19:48:21,709] Trial 254 finished with value: 1.0624161172681184 and parameters: {'kernel_type': 'Matern', 'length_scale': 2.2889458568715976e-05, 'noise_level': 6.382390090562383e-05, 'constant_value': 417.75221250851973, 'nu': 1.5}. Best is trial 199 with value: 0.3592098145876718.
