[I 2024-12-04 15:27:43,137] Trial 1652 finished with value: 0.465043751473935 and parameters: {'n_estimators': 667, 'max_depth': 39, 'min_samples_split': 2, 'min_samples_leaf': 2, 'max_features': None, 'bootstrap': True, 'criterion': 'squared_error'}. Best is trial 1025 with value: 0.41844370194907604.
[I 2024-12-04 15:27:44,696] Trial 1661 finished with value: 0.7016596629258328 and parameters: {'n_estimators': 361, 'max_depth': 11, 'min_samples_split': 12, 'min_samples_leaf': 6, 'max_features': None, 'bootstrap': False, 'criterion': 'squared_error'}. Best is trial 1025 with value: 0.41844370194907604.
[I 2024-12-04 15:27:47,368] Trial 1651 finished with value: 0.46522532228189695 and parameters: {'n_estimators': 768, 'max_depth': 42, 'min_samples_split': 4, 'min_samples_leaf': 2, 'max_features': None, 'bootstrap': True, 'criterion': 'squared_error'}. Best is trial 1025 with value: 0.41844370194907604.
[I 2024-12-04 15:27:47,542] Trial 1602 finished with value: 0.4260358982072359 and parameters: {'n_estimators': 690, 'max_depth': 50, 'min_samples_split': 3, 'min_samples_leaf': 1, 'max_features': None, 'bootstrap': True, 'criterion': 'absolute_error'}. Best is trial 1025 with value: 0.41844370194907604.
[I 2024-12-04 15:27:48,406] Trial 1646 finished with value: 0.4417936418400548 and parameters: {'n_estimators': 749, 'max_depth': 50, 'min_samples_split': 10, 'min_samples_leaf': 1, 'max_features': None, 'bootstrap': True, 'criterion': 'squared_error'}. Best is trial 1025 with value: 0.41844370194907604.
[I 2024-12-04 15:27:51,203] Trial 1650 finished with value: 0.4232005780505277 and parameters: {'n_estimators': 729, 'max_depth': 28, 'min_samples_split': 2, 'min_samples_leaf': 1, 'max_features': None, 'bootstrap': True, 'criterion': 'squared_error'}. Best is trial 1025 with value: 0.41844370194907604.
[I 2024-12-04 15:27:51,744] Trial 1655 finished with value: 0.4208359398737235 and parameters: {'n_estimators': 757, 'max_depth': 43, 'min_samples_split': 2, 'min_samples_leaf': 1, 'max_features': None, 'bootstrap': True, 'criterion': 'squared_error'}. Best is trial 1025 with value: 0.41844370194907604.
[I 2024-12-04 15:27:53,922] Trial 1664 finished with value: 0.6160989339475103 and parameters: {'n_estimators': 684, 'max_depth': 42, 'min_samples_split': 3, 'min_samples_leaf': 1, 'max_features': 'log2', 'bootstrap': False, 'criterion': 'squared_error'}. Best is trial 1025 with value: 0.41844370194907604.
[I 2024-12-04 15:27:54,755] Trial 1656 finished with value: 0.42276790053612023 and parameters: {'n_estimators': 827, 'max_depth': 29, 'min_samples_split': 2, 'min_samples_leaf': 1, 'max_features': None, 'bootstrap': True, 'criterion': 'squared_error'}. Best is trial 1025 with value: 0.41844370194907604.
[I 2024-12-04 15:27:54,962] Trial 1657 finished with value: 0.4648825410699563 and parameters: {'n_estimators': 741, 'max_depth': 48, 'min_samples_split': 2, 'min_samples_leaf': 2, 'max_features': None, 'bootstrap': True, 'criterion': 'squared_error'}. Best is trial 1025 with value: 0.41844370194907604.
[I 2024-12-04 15:27:55,970] Trial 1653 finished with value: 0.42061440279390505 and parameters: {'n_estimators': 769, 'max_depth': 43, 'min_samples_split': 2, 'min_samples_leaf': 1, 'max_features': None, 'bootstrap': True, 'criterion': 'squared_error'}. Best is trial 1025 with value: 0.41844370194907604.
[I 2024-12-04 15:27:56,849] Trial 1659 finished with value: 0.689682213968373 and parameters: {'n_estimators': 897, 'max_depth': 41, 'min_samples_split': 26, 'min_samples_leaf': 8, 'max_features': None, 'bootstrap': False, 'criterion': 'squared_error'}. Best is trial 1025 with value: 0.41844370194907604.
[I 2024-12-04 15:28:00,251] Trial 1669 finished with value: 0.9608314208454871 and parameters: {'n_estimators': 510, 'max_depth': 5, 'min_samples_split': 45, 'min_samples_leaf': 2, 'max_features': 'sqrt', 'bootstrap': True, 'criterion': 'absolute_error'}. Best is trial 1025 with value: 0.41844370194907604.
[I 2024-12-04 15:28:01,666] Trial 1666 finished with value: 0.41926130097474995 and parameters: {'n_estimators': 792, 'max_depth': 40, 'min_samples_split': 2, 'min_samples_leaf': 1, 'max_features': None, 'bootstrap': True, 'criterion': 'squared_error'}. Best is trial 1025 with value: 0.41844370194907604.
[I 2024-12-04 15:28:01,706] Trial 1597 finished with value: 0.43002923271676524 and parameters: {'n_estimators': 883, 'max_depth': 36, 'min_samples_split': 2, 'min_samples_leaf': 1, 'max_features': None, 'bootstrap': True, 'criterion': 'absolute_error'}. Best is trial 1025 with value: 0.41844370194907604.
[I 2024-12-04 15:28:01,988] Trial 1658 finished with value: 0.4312744779712587 and parameters: {'n_estimators': 760, 'max_depth': 49, 'min_samples_split': 4, 'min_samples_leaf': 1, 'max_features': None, 'bootstrap': True, 'criterion': 'squared_error'}. Best is trial 1025 with value: 0.41844370194907604.
[I 2024-12-04 15:28:03,711] Trial 1662 finished with value: 0.4250073540281691 and parameters: {'n_estimators': 740, 'max_depth': 43, 'min_samples_split': 3, 'min_samples_leaf': 1, 'max_features': None, 'bootstrap': True, 'criterion': 'squared_error'}. Best is trial 1025 with value: 0.41844370194907604.
[I 2024-12-04 15:28:06,196] Trial 1660 finished with value: 0.46475791220440477 and parameters: {'n_estimators': 865, 'max_depth': 40, 'min_samples_split': 3, 'min_samples_leaf': 2, 'max_features': None, 'bootstrap': True, 'criterion': 'squared_error'}. Best is trial 1025 with value: 0.41844370194907604.
[I 2024-12-04 15:28:07,395] Trial 1668 finished with value: 0.4316704347378321 and parameters: {'n_estimators': 757, 'max_depth': 35, 'min_samples_split': 4, 'min_samples_leaf': 1, 'max_features': None, 'bootstrap': True, 'criterion': 'squared_error'}. Best is trial 1025 with value: 0.41844370194907604.
[I 2024-12-04 15:28:08,526] Trial 1667 finished with value: 0.42142682576443224 and parameters: {'n_estimators': 685, 'max_depth': 37, 'min_samples_split': 2, 'min_samples_leaf': 1, 'max_features': None, 'bootstrap': True, 'criterion': 'squared_error'}. Best is trial 1025 with value: 0.41844370194907604.
[I 2024-12-04 15:28:12,483] Trial 1672 finished with value: 0.4255686990603585 and parameters: {'n_estimators': 519, 'max_depth': 44, 'min_samples_split': 2, 'min_samples_leaf': 1, 'max_features': None, 'bootstrap': True, 'criterion': 'squared_error'}. Best is trial 1025 with value: 0.41844370194907604.
[I 2024-12-04 15:28:15,552] Trial 1665 finished with value: 0.4210331822737419 and parameters: {'n_estimators': 845, 'max_depth': 34, 'min_samples_split': 2, 'min_samples_leaf': 1, 'max_features': None, 'bootstrap': True, 'criterion': 'squared_error'}. Best is trial 1025 with value: 0.41844370194907604.
[I 2024-12-04 15:28:18,027] Trial 1675 finished with value: 0.4648337218235501 and parameters: {'n_estimators': 692, 'max_depth': 37, 'min_samples_split': 2, 'min_samples_leaf': 2, 'max_features': None, 'bootstrap': True, 'criterion': 'squared_error'}. Best is trial 1025 with value: 0.41844370194907604.
[I 2024-12-04 15:28:18,716] Trial 1677 finished with value: 0.4652697896929576 and parameters: {'n_estimators': 758, 'max_depth': 39, 'min_samples_split': 2, 'min_samples_leaf': 2, 'max_features': None, 'bootstrap': True, 'criterion': 'squared_error'}. Best is trial 1025 with value: 0.41844370194907604.
[I 2024-12-04 15:28:18,871] Trial 1673 finished with value: 0.4211601751105702 and parameters: {'n_estimators': 855, 'max_depth': 42, 'min_samples_split': 2, 'min_samples_leaf': 1, 'max_features': None, 'bootstrap': True, 'criterion': 'squared_error'}. Best is trial 1025 with value: 0.41844370194907604.
[I 2024-12-04 15:28:19,622] Trial 1670 finished with value: 0.46544245232962517 and parameters: {'n_estimators': 823, 'max_depth': 34, 'min_samples_split': 2, 'min_samples_leaf': 2, 'max_features': None, 'bootstrap': True, 'criterion': 'squared_error'}. Best is trial 1025 with value: 0.41844370194907604.
[I 2024-12-04 15:28:20,472] Trial 1679 finished with value: 0.4209813204885499 and parameters: {'n_estimators': 721, 'max_depth': 34, 'min_samples_split': 2, 'min_samples_leaf': 1, 'max_features': None, 'bootstrap': True, 'criterion': 'squared_error'}. Best is trial 1025 with value: 0.41844370194907604.
[I 2024-12-04 15:28:22,106] Trial 1674 finished with value: 0.418787369126777 and parameters: {'n_estimators': 770, 'max_depth': 40, 'min_samples_split': 2, 'min_samples_leaf': 1, 'max_features': None, 'bootstrap': True, 'criterion': 'squared_error'}. Best is trial 1025 with value: 0.41844370194907604.
[I 2024-12-04 15:28:22,313] Trial 1676 finished with value: 0.4232587630794557 and parameters: {'n_estimators': 692, 'max_depth': 50, 'min_samples_split': 2, 'min_samples_leaf': 1, 'max_features': None, 'bootstrap': True, 'criterion': 'squared_error'}. Best is trial 1025 with value: 0.41844370194907604.
[I 2024-12-04 15:28:22,911] Trial 1671 finished with value: 0.42104137991161644 and parameters: {'n_estimators': 908, 'max_depth': 45, 'min_samples_split': 2, 'min_samples_leaf': 1, 'max_features': None, 'bootstrap': True, 'criterion': 'squared_error'}. Best is trial 1025 with value: 0.41844370194907604.
[I 2024-12-04 15:28:32,497] Trial 1678 finished with value: 0.42060215930098005 and parameters: {'n_estimators': 924, 'max_depth': 44, 'min_samples_split': 2, 'min_samples_leaf': 1, 'max_features': None, 'bootstrap': True, 'criterion': 'squared_error'}. Best is trial 1025 with value: 0.41844370194907604.
[I 2024-12-04 15:28:35,889] Trial 1687 finished with value: 0.4255905391131718 and parameters: {'n_estimators': 683, 'max_depth': 44, 'min_samples_split': 3, 'min_samples_leaf': 1, 'max_features': None, 'bootstrap': True, 'criterion': 'squared_error'}. Best is trial 1025 with value: 0.41844370194907604.
[I 2024-12-04 15:28:37,880] Trial 1683 finished with value: 0.4649752239677129 and parameters: {'n_estimators': 693, 'max_depth': 50, 'min_samples_split': 4, 'min_samples_leaf': 2, 'max_features': None, 'bootstrap': True, 'criterion': 'squared_error'}. Best is trial 1025 with value: 0.41844370194907604.
[I 2024-12-04 15:28:38,685] Trial 1686 finished with value: 0.4315190752800395 and parameters: {'n_estimators': 995, 'max_depth': 37, 'min_samples_split': 4, 'min_samples_leaf': 1, 'max_features': None, 'bootstrap': True, 'criterion': 'squared_error'}. Best is trial 1025 with value: 0.41844370194907604.
[I 2024-12-04 15:28:38,697] Trial 1680 finished with value: 0.4205507241053656 and parameters: {'n_estimators': 860, 'max_depth': 36, 'min_samples_split': 2, 'min_samples_leaf': 1, 'max_features': None, 'bootstrap': True, 'criterion': 'squared_error'}. Best is trial 1025 with value: 0.41844370194907604.
[I 2024-12-04 15:28:38,710] Trial 1688 finished with value: 0.685312487729878 and parameters: {'n_estimators': 989, 'max_depth': 32, 'min_samples_split': 2, 'min_samples_leaf': 1, 'max_features': 'log2', 'bootstrap': True, 'criterion': 'squared_error'}. Best is trial 1025 with value: 0.41844370194907604.
[I 2024-12-04 15:28:38,755] Trial 1684 finished with value: 0.41972342585532435 and parameters: {'n_estimators': 724, 'max_depth': 39, 'min_samples_split': 2, 'min_samples_leaf': 1, 'max_features': None, 'bootstrap': True, 'criterion': 'squared_error'}. Best is trial 1025 with value: 0.41844370194907604.
[I 2024-12-04 15:28:39,422] Trial 1682 finished with value: 0.4244995827798583 and parameters: {'n_estimators': 731, 'max_depth': 38, 'min_samples_split': 3, 'min_samples_leaf': 1, 'max_features': None, 'bootstrap': True, 'criterion': 'squared_error'}. Best is trial 1025 with value: 0.41844370194907604.
[I 2024-12-04 15:28:39,465] Trial 1690 finished with value: 0.6442618694277363 and parameters: {'n_estimators': 714, 'max_depth': 38, 'min_samples_split': 2, 'min_samples_leaf': 1, 'max_features': 'log2', 'bootstrap': True, 'criterion': 'squared_error'}. Best is trial 1025 with value: 0.41844370194907604.
[I 2024-12-04 15:28:39,783] Trial 1698 finished with value: 1.0658673793576414 and parameters: {'n_estimators': 758, 'max_depth': 18, 'min_samples_split': 41, 'min_samples_leaf': 10, 'max_features': 'log2', 'bootstrap': False, 'criterion': 'squared_error'}. Best is trial 1025 with value: 0.41844370194907604.
[I 2024-12-04 15:28:39,798] Trial 1685 finished with value: 0.4653917174760477 and parameters: {'n_estimators': 996, 'max_depth': 38, 'min_samples_split': 2, 'min_samples_leaf': 2, 'max_features': None, 'bootstrap': True, 'criterion': 'squared_error'}. Best is trial 1025 with value: 0.41844370194907604.
[I 2024-12-04 15:28:39,837] Trial 1701 finished with value: 0.6332667608923296 and parameters: {'n_estimators': 232, 'max_depth': 50, 'min_samples_split': 2, 'min_samples_leaf': 2, 'max_features': 'sqrt', 'bootstrap': False, 'criterion': 'squared_error'}. Best is trial 1025 with value: 0.41844370194907604.
[I 2024-12-04 15:28:41,345] Trial 1689 finished with value: 0.4212037752368104 and parameters: {'n_estimators': 765, 'max_depth': 42, 'min_samples_split': 2, 'min_samples_leaf': 1, 'max_features': None, 'bootstrap': True, 'criterion': 'squared_error'}. Best is trial 1025 with value: 0.41844370194907604.
[I 2024-12-04 15:28:41,363] Trial 1692 finished with value: 0.42125468606479916 and parameters: {'n_estimators': 845, 'max_depth': 45, 'min_samples_split': 2, 'min_samples_leaf': 1, 'max_features': None, 'bootstrap': True, 'criterion': 'squared_error'}. Best is trial 1025 with value: 0.41844370194907604.
[I 2024-12-04 15:28:41,369] Trial 1681 finished with value: 0.4206494745521756 and parameters: {'n_estimators': 993, 'max_depth': 36, 'min_samples_split': 2, 'min_samples_leaf': 1, 'max_features': None, 'bootstrap': True, 'criterion': 'squared_error'}. Best is trial 1025 with value: 0.41844370194907604.
[I 2024-12-04 15:28:42,576] Trial 1697 finished with value: 0.5319520510892644 and parameters: {'n_estimators': 694, 'max_depth': 35, 'min_samples_split': 2, 'min_samples_leaf': 1, 'max_features': 'sqrt', 'bootstrap': True, 'criterion': 'squared_error'}. Best is trial 1025 with value: 0.41844370194907604.
[I 2024-12-04 15:28:42,619] Trial 1695 finished with value: 0.4212262014120523 and parameters: {'n_estimators': 660, 'max_depth': 36, 'min_samples_split': 2, 'min_samples_leaf': 1, 'max_features': None, 'bootstrap': True, 'criterion': 'squared_error'}. Best is trial 1025 with value: 0.41844370194907604.
[I 2024-12-04 15:28:45,016] Trial 1699 finished with value: 0.42618252941706025 and parameters: {'n_estimators': 510, 'max_depth': 41, 'min_samples_split': 3, 'min_samples_leaf': 1, 'max_features': None, 'bootstrap': True, 'criterion': 'squared_error'}. Best is trial 1025 with value: 0.41844370194907604.
[I 2024-12-04 15:28:49,655] Trial 1694 finished with value: 0.4226743852904571 and parameters: {'n_estimators': 668, 'max_depth': 45, 'min_samples_split': 2, 'min_samples_leaf': 1, 'max_features': None, 'bootstrap': True, 'criterion': 'squared_error'}. Best is trial 1025 with value: 0.41844370194907604.
[I 2024-12-04 15:28:50,912] Trial 1704 finished with value: 0.661902260682711 and parameters: {'n_estimators': 267, 'max_depth': 43, 'min_samples_split': 8, 'min_samples_leaf': 8, 'max_features': None, 'bootstrap': True, 'criterion': 'absolute_error'}. Best is trial 1025 with value: 0.41844370194907604.
[I 2024-12-04 15:28:50,946] Trial 1696 finished with value: 0.4256842129632816 and parameters: {'n_estimators': 696, 'max_depth': 34, 'min_samples_split': 3, 'min_samples_leaf': 1, 'max_features': None, 'bootstrap': True, 'criterion': 'squared_error'}. Best is trial 1025 with value: 0.41844370194907604.
[I 2024-12-04 15:28:52,104] Trial 1709 finished with value: 0.9571933714799142 and parameters: {'n_estimators': 294, 'max_depth': 9, 'min_samples_split': 12, 'min_samples_leaf': 1, 'max_features': 'log2', 'bootstrap': False, 'criterion': 'absolute_error'}. Best is trial 1025 with value: 0.41844370194907604.
[I 2024-12-04 15:28:53,877] Trial 1702 finished with value: 0.4197126145399758 and parameters: {'n_estimators': 728, 'max_depth': 39, 'min_samples_split': 2, 'min_samples_leaf': 1, 'max_features': None, 'bootstrap': True, 'criterion': 'squared_error'}. Best is trial 1025 with value: 0.41844370194907604.
[I 2024-12-04 15:28:53,879] Trial 1706 finished with value: 0.9006320407343855 and parameters: {'n_estimators': 374, 'max_depth': 9, 'min_samples_split': 2, 'min_samples_leaf': 3, 'max_features': 'sqrt', 'bootstrap': True, 'criterion': 'absolute_error'}. Best is trial 1025 with value: 0.41844370194907604.
[I 2024-12-04 15:28:55,067] Trial 1693 finished with value: 0.42151818771758803 and parameters: {'n_estimators': 824, 'max_depth': 35, 'min_samples_split': 2, 'min_samples_leaf': 1, 'max_features': None, 'bootstrap': True, 'criterion': 'squared_error'}. Best is trial 1025 with value: 0.41844370194907604.
[I 2024-12-04 15:28:59,570] Trial 1708 finished with value: 0.4661068032577439 and parameters: {'n_estimators': 496, 'max_depth': 41, 'min_samples_split': 2, 'min_samples_leaf': 2, 'max_features': None, 'bootstrap': True, 'criterion': 'squared_error'}. Best is trial 1025 with value: 0.41844370194907604.
[I 2024-12-04 15:29:00,949] Trial 1703 finished with value: 0.4653391371353388 and parameters: {'n_estimators': 755, 'max_depth': 46, 'min_samples_split': 2, 'min_samples_leaf': 2, 'max_features': None, 'bootstrap': True, 'criterion': 'squared_error'}. Best is trial 1025 with value: 0.41844370194907604.
[I 2024-12-04 15:29:05,492] Trial 1700 finished with value: 0.43188707875274585 and parameters: {'n_estimators': 644, 'max_depth': 44, 'min_samples_split': 4, 'min_samples_leaf': 1, 'max_features': None, 'bootstrap': True, 'criterion': 'squared_error'}. Best is trial 1025 with value: 0.41844370194907604.
[I 2024-12-04 15:29:05,658] Trial 1705 finished with value: 0.4644697130431884 and parameters: {'n_estimators': 711, 'max_depth': 46, 'min_samples_split': 2, 'min_samples_leaf': 2, 'max_features': None, 'bootstrap': True, 'criterion': 'squared_error'}. Best is trial 1025 with value: 0.41844370194907604.
[I 2024-12-04 15:29:07,307] Trial 1711 finished with value: 0.522366165898238 and parameters: {'n_estimators': 739, 'max_depth': 33, 'min_samples_split': 2, 'min_samples_leaf': 1, 'max_features': None, 'bootstrap': False, 'criterion': 'squared_error'}. Best is trial 1025 with value: 0.41844370194907604.
[I 2024-12-04 15:29:07,675] Trial 1691 finished with value: 0.6548866781213858 and parameters: {'n_estimators': 911, 'max_depth': 38, 'min_samples_split': 24, 'min_samples_leaf': 7, 'max_features': None, 'bootstrap': True, 'criterion': 'absolute_error'}. Best is trial 1025 with value: 0.41844370194907604.
[I 2024-12-04 15:29:07,686] Trial 1723 finished with value: 1.063618521575941 and parameters: {'n_estimators': 304, 'max_depth': 9, 'min_samples_split': 6, 'min_samples_leaf': 8, 'max_features': 'log2', 'bootstrap': True, 'criterion': 'squared_error'}. Best is trial 1025 with value: 0.41844370194907604.
[I 2024-12-04 15:29:12,108] Trial 1707 finished with value: 0.4312503478503361 and parameters: {'n_estimators': 746, 'max_depth': 41, 'min_samples_split': 4, 'min_samples_leaf': 1, 'max_features': None, 'bootstrap': True, 'criterion': 'squared_error'}. Best is trial 1025 with value: 0.41844370194907604.
[I 2024-12-04 15:29:17,082] Trial 1717 finished with value: 0.7413335643122727 and parameters: {'n_estimators': 170, 'max_depth': 17, 'min_samples_split': 4, 'min_samples_leaf': 1, 'max_features': 'sqrt', 'bootstrap': True, 'criterion': 'absolute_error'}. Best is trial 1025 with value: 0.41844370194907604.
[I 2024-12-04 15:29:17,505] Trial 1715 finished with value: 0.41980388717821093 and parameters: {'n_estimators': 637, 'max_depth': 41, 'min_samples_split': 2, 'min_samples_leaf': 1, 'max_features': None, 'bootstrap': True, 'criterion': 'squared_error'}. Best is trial 1025 with value: 0.41844370194907604.
[I 2024-12-04 15:29:18,892] Trial 1663 finished with value: 0.4390610533632936 and parameters: {'n_estimators': 760, 'max_depth': 30, 'min_samples_split': 4, 'min_samples_leaf': 1, 'max_features': None, 'bootstrap': True, 'criterion': 'absolute_error'}. Best is trial 1025 with value: 0.41844370194907604.
[I 2024-12-04 15:29:19,429] Trial 1720 finished with value: 0.4211035539529295 and parameters: {'n_estimators': 778, 'max_depth': 34, 'min_samples_split': 2, 'min_samples_leaf': 1, 'max_features': None, 'bootstrap': True, 'criterion': 'squared_error'}. Best is trial 1025 with value: 0.41844370194907604.
[I 2024-12-04 15:29:19,516] Trial 1710 finished with value: 0.42369566128547176 and parameters: {'n_estimators': 726, 'max_depth': 40, 'min_samples_split': 3, 'min_samples_leaf': 1, 'max_features': None, 'bootstrap': True, 'criterion': 'squared_error'}. Best is trial 1025 with value: 0.41844370194907604.
[I 2024-12-04 15:29:19,821] Trial 1728 finished with value: 0.7258487925725098 and parameters: {'n_estimators': 182, 'max_depth': 39, 'min_samples_split': 2, 'min_samples_leaf': 2, 'max_features': 'sqrt', 'bootstrap': True, 'criterion': 'absolute_error'}. Best is trial 1025 with value: 0.41844370194907604.
[I 2024-12-04 15:29:20,210] Trial 1716 finished with value: 0.42254145400302306 and parameters: {'n_estimators': 690, 'max_depth': 45, 'min_samples_split': 2, 'min_samples_leaf': 1, 'max_features': None, 'bootstrap': True, 'criterion': 'squared_error'}. Best is trial 1025 with value: 0.41844370194907604.
[I 2024-12-04 15:29:20,816] Trial 1721 finished with value: 0.42105885526663506 and parameters: {'n_estimators': 690, 'max_depth': 31, 'min_samples_split': 2, 'min_samples_leaf': 1, 'max_features': None, 'bootstrap': True, 'criterion': 'squared_error'}. Best is trial 1025 with value: 0.41844370194907604.
