[I 2024-12-03 18:49:35,128] Trial 1133 finished with value: 0.810014008382239 and parameters: {'kernel': 'linear', 'C': 0.11841067881846434, 'gamma': 0.0001079506723323134, 'epsilon': 0.0023738091633058204}. Best is trial 88 with value: 0.3542875001421725.
[I 2024-12-03 18:49:35,892] Trial 1134 finished with value: 1660.6446436999622 and parameters: {'kernel': 'sigmoid', 'C': 77.43840915177927, 'gamma': 0.052837857796479364, 'epsilon': 0.1982971379208123}. Best is trial 88 with value: 0.3542875001421725.
[I 2024-12-03 18:49:37,063] Trial 1135 finished with value: 0.3709441037753156 and parameters: {'kernel': 'rbf', 'C': 90.52179035353728, 'gamma': 0.02310779089378945, 'epsilon': 0.3782346907148296}. Best is trial 88 with value: 0.3542875001421725.
[I 2024-12-03 18:49:38,146] Trial 1136 finished with value: 0.4200158329405979 and parameters: {'kernel': 'rbf', 'C': 21.81189946452095, 'gamma': 0.02637440279536391, 'epsilon': 0.07475061783531167}. Best is trial 88 with value: 0.3542875001421725.
[I 2024-12-03 18:49:38,974] Trial 1137 finished with value: 0.41559018304886153 and parameters: {'kernel': 'rbf', 'C': 20.41898675374407, 'gamma': 0.04077906183862268, 'epsilon': 0.04230831063437116}. Best is trial 88 with value: 0.3542875001421725.
[I 2024-12-03 18:49:39,939] Trial 1138 finished with value: 0.36657325471957386 and parameters: {'kernel': 'rbf', 'C': 98.13483430846391, 'gamma': 0.024380855394654576, 'epsilon': 0.08706910170027371}. Best is trial 88 with value: 0.3542875001421725.
[I 2024-12-03 18:49:40,331] Trial 1139 finished with value: 0.3985005146838711 and parameters: {'kernel': 'rbf', 'C': 18.96543449792296, 'gamma': 0.06090933021607634, 'epsilon': 0.1771542168167594}. Best is trial 88 with value: 0.3542875001421725.
[I 2024-12-03 18:49:41,467] Trial 1140 finished with value: 0.4146483807110761 and parameters: {'kernel': 'rbf', 'C': 99.59821319463133, 'gamma': 0.1187645467914544, 'epsilon': 0.08162000197404926}. Best is trial 88 with value: 0.3542875001421725.
[I 2024-12-03 18:49:41,962] Trial 1141 finished with value: 0.4519338581483206 and parameters: {'kernel': 'rbf', 'C': 97.98681433422165, 'gamma': 0.14359477563434034, 'epsilon': 0.118259369888824}. Best is trial 88 with value: 0.3542875001421725.
[I 2024-12-03 18:49:42,902] Trial 1142 finished with value: 0.7607067848677661 and parameters: {'kernel': 'rbf', 'C': 96.82568164874573, 'gamma': 0.6780037947686262, 'epsilon': 0.18642124830403928}. Best is trial 88 with value: 0.3542875001421725.
[I 2024-12-03 18:49:43,388] Trial 1143 finished with value: 0.3910276710741534 and parameters: {'kernel': 'rbf', 'C': 91.04805261415385, 'gamma': 0.07707895801159129, 'epsilon': 0.22402561400785592}. Best is trial 88 with value: 0.3542875001421725.
[I 2024-12-03 18:49:44,215] Trial 1144 finished with value: 0.45050603312661647 and parameters: {'kernel': 'rbf', 'C': 17.20935021539203, 'gamma': 0.068513969981161, 'epsilon': 0.40374343527022993}. Best is trial 88 with value: 0.3542875001421725.
[I 2024-12-03 18:49:45,183] Trial 1145 finished with value: 0.37827102505698507 and parameters: {'kernel': 'rbf', 'C': 98.66699343961797, 'gamma': 0.06678163411111036, 'epsilon': 0.06976387131039043}. Best is trial 88 with value: 0.3542875001421725.
[I 2024-12-03 18:49:45,876] Trial 1146 finished with value: 0.358320147061597 and parameters: {'kernel': 'rbf', 'C': 94.53016372158169, 'gamma': 0.050519540963209465, 'epsilon': 0.131610527918331}. Best is trial 88 with value: 0.3542875001421725.
[I 2024-12-03 18:49:45,963] Trial 1036 finished with value: 0.7863713061698402 and parameters: {'kernel': 'linear', 'C': 99.33092134278914, 'gamma': 0.07542877635143982, 'epsilon': 0.11970969104296679}. Best is trial 88 with value: 0.3542875001421725.
[I 2024-12-03 18:49:46,580] Trial 1147 finished with value: 0.42681641742966603 and parameters: {'kernel': 'rbf', 'C': 30.489130341363232, 'gamma': 0.008628563244168816, 'epsilon': 0.16526996795655724}. Best is trial 88 with value: 0.3542875001421725.
[I 2024-12-03 18:49:47,579] Trial 1148 finished with value: 0.5817748130149512 and parameters: {'kernel': 'rbf', 'C': 3.0756265968950762, 'gamma': 0.16402714733305512, 'epsilon': 0.4037743684015626}. Best is trial 88 with value: 0.3542875001421725.
[I 2024-12-03 18:49:47,659] Trial 1149 finished with value: 0.3606792889680774 and parameters: {'kernel': 'rbf', 'C': 92.94022533988458, 'gamma': 0.03512645125455584, 'epsilon': 0.19341820322779227}. Best is trial 88 with value: 0.3542875001421725.
[I 2024-12-03 18:49:47,919] Trial 1150 finished with value: 0.45479926510637353 and parameters: {'kernel': 'rbf', 'C': 21.901298301313478, 'gamma': 0.009885967622154384, 'epsilon': 0.4701513772108881}. Best is trial 88 with value: 0.3542875001421725.
[I 2024-12-03 18:49:49,343] Trial 1151 finished with value: 0.3927934704275958 and parameters: {'kernel': 'rbf', 'C': 98.66699712938892, 'gamma': 0.012088570124856845, 'epsilon': 0.19119057018343794}. Best is trial 88 with value: 0.3542875001421725.
[I 2024-12-03 18:49:49,399] Trial 1152 finished with value: 0.39276852684466707 and parameters: {'kernel': 'rbf', 'C': 19.33170472647241, 'gamma': 0.009489352180172439, 'epsilon': 0.07457109802894114}. Best is trial 88 with value: 0.3542875001421725.
[I 2024-12-03 18:49:50,058] Trial 1153 finished with value: 0.416655775130416 and parameters: {'kernel': 'rbf', 'C': 18.833387667034234, 'gamma': 0.026518192954469014, 'epsilon': 0.13481308678892884}. Best is trial 88 with value: 0.3542875001421725.
[I 2024-12-03 18:49:51,217] Trial 1154 finished with value: 3.083955664085364 and parameters: {'kernel': 'sigmoid', 'C': 0.2932247040652889, 'gamma': 0.011581315831885987, 'epsilon': 0.0021174039482695335}. Best is trial 88 with value: 0.3542875001421725.
[I 2024-12-03 18:49:51,539] Trial 1155 finished with value: 0.44283496039997 and parameters: {'kernel': 'rbf', 'C': 21.26596481379188, 'gamma': 0.1296824613674048, 'epsilon': 0.0950152509540522}. Best is trial 88 with value: 0.3542875001421725.
[I 2024-12-03 18:49:51,783] Trial 1079 finished with value: 0.7986783781145244 and parameters: {'kernel': 'linear', 'C': 55.006496232489475, 'gamma': 0.0882171273850456, 'epsilon': 0.02428919813004835}. Best is trial 88 with value: 0.3542875001421725.
[I 2024-12-03 18:49:51,784] Trial 1156 finished with value: 0.4061044015925472 and parameters: {'kernel': 'rbf', 'C': 16.77285242927984, 'gamma': 0.059017830392498846, 'epsilon': 0.21169069241637128}. Best is trial 88 with value: 0.3542875001421725.
[I 2024-12-03 18:49:52,642] Trial 628 finished with value: 2.48111348916003 and parameters: {'kernel': 'poly', 'C': 88.99980761407073, 'gamma': 0.04531687845341378, 'epsilon': 0.3056113229384608}. Best is trial 88 with value: 0.3542875001421725.
[I 2024-12-03 18:49:52,831] Trial 1157 finished with value: 0.5361503234322101 and parameters: {'kernel': 'rbf', 'C': 73.8382976843855, 'gamma': 0.13327325055247227, 'epsilon': 0.4053638790261826}. Best is trial 88 with value: 0.3542875001421725.
[I 2024-12-03 18:49:53,962] Trial 1158 finished with value: 0.47393453952768877 and parameters: {'kernel': 'rbf', 'C': 2.874212247431697, 'gamma': 0.02192933559759976, 'epsilon': 0.17826043198155164}. Best is trial 88 with value: 0.3542875001421725.
[I 2024-12-03 18:49:55,129] Trial 1161 finished with value: 0.5656793126540415 and parameters: {'kernel': 'rbf', 'C': 98.89312056935226, 'gamma': 0.1408611110770051, 'epsilon': 0.4604581782215059}. Best is trial 88 with value: 0.3542875001421725.
[I 2024-12-03 18:49:55,216] Trial 1160 finished with value: 0.3689588334844379 and parameters: {'kernel': 'rbf', 'C': 96.08862414401557, 'gamma': 0.0232428821290554, 'epsilon': 0.2259233727786634}. Best is trial 88 with value: 0.3542875001421725.
[I 2024-12-03 18:49:56,114] Trial 1162 finished with value: 0.3662556784777933 and parameters: {'kernel': 'rbf', 'C': 98.13814476987312, 'gamma': 0.03279963396951249, 'epsilon': 0.10162191572181198}. Best is trial 88 with value: 0.3542875001421725.
[I 2024-12-03 18:49:56,880] Trial 1163 finished with value: 0.4138406012023653 and parameters: {'kernel': 'rbf', 'C': 19.576380311909567, 'gamma': 0.043823786869249, 'epsilon': 0.045995111507651475}. Best is trial 88 with value: 0.3542875001421725.
[I 2024-12-03 18:49:58,007] Trial 1166 finished with value: 0.39876351658885545 and parameters: {'kernel': 'rbf', 'C': 21.153277440813216, 'gamma': 0.036460791981712086, 'epsilon': 0.16308697236105174}. Best is trial 88 with value: 0.3542875001421725.
[I 2024-12-03 18:49:58,007] Trial 1164 finished with value: 0.3603906213349801 and parameters: {'kernel': 'rbf', 'C': 97.01033452509552, 'gamma': 0.04026781709723999, 'epsilon': 0.07634301053140038}. Best is trial 88 with value: 0.3542875001421725.
[I 2024-12-03 18:49:59,085] Trial 1167 finished with value: 0.49068398369859906 and parameters: {'kernel': 'rbf', 'C': 21.780647102788482, 'gamma': 0.18213045790849125, 'epsilon': 0.07540902835559167}. Best is trial 88 with value: 0.3542875001421725.
[I 2024-12-03 18:50:00,004] Trial 1169 finished with value: 0.3750406689836041 and parameters: {'kernel': 'rbf', 'C': 93.73677776936366, 'gamma': 0.057176841187548934, 'epsilon': 0.2500843511975891}. Best is trial 88 with value: 0.3542875001421725.
[I 2024-12-03 18:50:00,121] Trial 1168 finished with value: 0.41027190302738703 and parameters: {'kernel': 'rbf', 'C': 16.90113499006183, 'gamma': 0.08077173176304707, 'epsilon': 0.08745713425029022}. Best is trial 88 with value: 0.3542875001421725.
[I 2024-12-03 18:50:00,923] Trial 1170 finished with value: 0.45190959905665634 and parameters: {'kernel': 'rbf', 'C': 19.840618774056587, 'gamma': 0.02389775111074848, 'epsilon': 0.5218469588817681}. Best is trial 88 with value: 0.3542875001421725.
[I 2024-12-03 18:50:01,589] Trial 1171 finished with value: 0.405988764591537 and parameters: {'kernel': 'rbf', 'C': 18.24523435576907, 'gamma': 0.04852271389846615, 'epsilon': 0.2918757757221745}. Best is trial 88 with value: 0.3542875001421725.
[I 2024-12-03 18:50:02,250] Trial 1172 finished with value: 0.3934250426231627 and parameters: {'kernel': 'rbf', 'C': 22.062622619028556, 'gamma': 0.056531816146623025, 'epsilon': 0.07237749274359191}. Best is trial 88 with value: 0.3542875001421725.
[I 2024-12-03 18:50:02,658] Trial 1173 finished with value: 0.41866027756061647 and parameters: {'kernel': 'rbf', 'C': 13.81499724903902, 'gamma': 0.016758643398887593, 'epsilon': 0.0881174921613614}. Best is trial 88 with value: 0.3542875001421725.
[I 2024-12-03 18:50:03,264] Trial 1174 finished with value: 0.39080055014176457 and parameters: {'kernel': 'rbf', 'C': 25.2848284341258, 'gamma': 0.031430115011492704, 'epsilon': 0.20995410902345155}. Best is trial 88 with value: 0.3542875001421725.
[I 2024-12-03 18:50:04,025] Trial 1175 finished with value: 0.4072367691554904 and parameters: {'kernel': 'rbf', 'C': 25.836013052236552, 'gamma': 0.011327200243410128, 'epsilon': 0.09401267960994672}. Best is trial 88 with value: 0.3542875001421725.
[I 2024-12-03 18:50:04,524] Trial 1176 finished with value: 0.3725603579122007 and parameters: {'kernel': 'rbf', 'C': 97.0217569291499, 'gamma': 0.01848413519056626, 'epsilon': 0.3215563060431646}. Best is trial 88 with value: 0.3542875001421725.
[I 2024-12-03 18:50:05,728] Trial 1178 finished with value: 0.3934250763607541 and parameters: {'kernel': 'rbf', 'C': 27.884190169498183, 'gamma': 0.05110596094049083, 'epsilon': 0.27369800440853553}. Best is trial 88 with value: 0.3542875001421725.
[I 2024-12-03 18:50:06,305] Trial 1179 finished with value: 0.5145135155037427 and parameters: {'kernel': 'rbf', 'C': 18.777721454970465, 'gamma': 0.17928786996673532, 'epsilon': 0.2013155717655459}. Best is trial 88 with value: 0.3542875001421725.
[I 2024-12-03 18:50:07,265] Trial 1180 finished with value: 0.43776456717870227 and parameters: {'kernel': 'rbf', 'C': 96.95676304990256, 'gamma': 0.0051136696811673365, 'epsilon': 0.2862668317583731}. Best is trial 88 with value: 0.3542875001421725.
[I 2024-12-03 18:50:08,082] Trial 1181 finished with value: 295.9359754758268 and parameters: {'kernel': 'sigmoid', 'C': 10.812231953288569, 'gamma': 0.4274924075265755, 'epsilon': 0.06990829457239693}. Best is trial 88 with value: 0.3542875001421725.
[I 2024-12-03 18:50:09,174] Trial 1182 finished with value: 0.44722274368780635 and parameters: {'kernel': 'rbf', 'C': 94.563971171327, 'gamma': 0.10682596013610685, 'epsilon': 0.2630088616217456}. Best is trial 88 with value: 0.3542875001421725.
[I 2024-12-03 18:50:10,750] Trial 1184 finished with value: 0.4439315231110847 and parameters: {'kernel': 'rbf', 'C': 24.52127457544514, 'gamma': 0.12859147155731668, 'epsilon': 0.12170288120929523}. Best is trial 88 with value: 0.3542875001421725.
[I 2024-12-03 18:50:10,783] Trial 1183 finished with value: 0.38341588477835525 and parameters: {'kernel': 'rbf', 'C': 84.13412441005566, 'gamma': 0.07686989028861031, 'epsilon': 0.04874796576057438}. Best is trial 88 with value: 0.3542875001421725.
[I 2024-12-03 18:50:12,185] Trial 1186 finished with value: 0.3736328533819419 and parameters: {'kernel': 'rbf', 'C': 97.7816205963273, 'gamma': 0.0156626694709572, 'epsilon': 0.2889277800765151}. Best is trial 88 with value: 0.3542875001421725.
[I 2024-12-03 18:50:12,958] Trial 1185 finished with value: 0.4191496487784514 and parameters: {'kernel': 'rbf', 'C': 26.387789773541762, 'gamma': 0.11563708729236188, 'epsilon': 0.014103650281690115}. Best is trial 88 with value: 0.3542875001421725.
[I 2024-12-03 18:50:13,400] Trial 1187 finished with value: 1.0290664024203398 and parameters: {'kernel': 'sigmoid', 'C': 0.0035940274352044433, 'gamma': 0.005653108976523669, 'epsilon': 0.005180640071069271}. Best is trial 88 with value: 0.3542875001421725.
[I 2024-12-03 18:50:14,209] Trial 1188 finished with value: 0.3778460390001014 and parameters: {'kernel': 'rbf', 'C': 74.10471445729793, 'gamma': 0.07759666043766181, 'epsilon': 0.10524651008106531}. Best is trial 88 with value: 0.3542875001421725.
[I 2024-12-03 18:50:14,857] Trial 1189 finished with value: 0.3825909353473919 and parameters: {'kernel': 'rbf', 'C': 27.146790817526806, 'gamma': 0.050734786615831445, 'epsilon': 0.10744654056824342}. Best is trial 88 with value: 0.3542875001421725.
[I 2024-12-03 18:50:15,316] Trial 1190 finished with value: 0.46726269665757647 and parameters: {'kernel': 'rbf', 'C': 81.4343443050348, 'gamma': 0.09031771459178768, 'epsilon': 0.39052851328423044}. Best is trial 88 with value: 0.3542875001421725.
[I 2024-12-03 18:50:16,122] Trial 1191 finished with value: 1.4053799128256983 and parameters: {'kernel': 'poly', 'C': 2.8849187114613373, 'gamma': 0.005522859452070895, 'epsilon': 0.004215570041180146}. Best is trial 88 with value: 0.3542875001421725.
[I 2024-12-03 18:50:16,912] Trial 1192 finished with value: 0.4321676733565753 and parameters: {'kernel': 'rbf', 'C': 17.12406321041797, 'gamma': 0.024922245327474, 'epsilon': 0.03809062324628776}. Best is trial 88 with value: 0.3542875001421725.
[I 2024-12-03 18:50:17,373] Trial 1193 finished with value: 0.720278446713752 and parameters: {'kernel': 'linear', 'C': 1.6944755973348298, 'gamma': 0.0006386423345279119, 'epsilon': 0.5297124592886044}. Best is trial 88 with value: 0.3542875001421725.
[I 2024-12-03 18:50:18,266] Trial 989 finished with value: 1.4474387114799812 and parameters: {'kernel': 'poly', 'C': 32.80037451654063, 'gamma': 0.03333901664807732, 'epsilon': 0.07056283640710143}. Best is trial 88 with value: 0.3542875001421725.
[I 2024-12-03 18:50:18,293] Trial 1194 finished with value: 0.38522236306242824 and parameters: {'kernel': 'rbf', 'C': 96.15191101552048, 'gamma': 0.016581181956261355, 'epsilon': 0.08868903914980135}. Best is trial 88 with value: 0.3542875001421725.
[I 2024-12-03 18:50:18,905] Trial 1165 finished with value: 0.7885763049271847 and parameters: {'kernel': 'linear', 'C': 13.840996255723304, 'gamma': 0.04145155064733407, 'epsilon': 0.09750749593456695}. Best is trial 88 with value: 0.3542875001421725.
[I 2024-12-03 18:50:19,432] Trial 1195 finished with value: 0.4152520468562936 and parameters: {'kernel': 'rbf', 'C': 91.20142757055243, 'gamma': 0.010601017104507095, 'epsilon': 0.03585149834678126}. Best is trial 88 with value: 0.3542875001421725.
[I 2024-12-03 18:50:20,249] Trial 1197 finished with value: 1.302081977202344 and parameters: {'kernel': 'poly', 'C': 0.030615967603453642, 'gamma': 0.02404281056807375, 'epsilon': 0.44653930985030665}. Best is trial 88 with value: 0.3542875001421725.
[I 2024-12-03 18:50:20,581] Trial 1196 finished with value: 0.4877169641043058 and parameters: {'kernel': 'rbf', 'C': 2.817847422120736, 'gamma': 0.0552701038097466, 'epsilon': 0.22683160951349773}. Best is trial 88 with value: 0.3542875001421725.
[I 2024-12-03 18:50:21,108] Trial 1198 finished with value: 0.906692924229873 and parameters: {'kernel': 'linear', 'C': 0.0015328322998157272, 'gamma': 0.05341559597481377, 'epsilon': 0.07466101874659183}. Best is trial 88 with value: 0.3542875001421725.
[I 2024-12-03 18:50:21,197] Trial 1199 finished with value: 0.37066541825874566 and parameters: {'kernel': 'rbf', 'C': 94.2681121919897, 'gamma': 0.04998103912294763, 'epsilon': 0.2661824357055394}. Best is trial 88 with value: 0.3542875001421725.
[I 2024-12-03 18:50:22,618] Trial 1200 finished with value: 0.3924927838470894 and parameters: {'kernel': 'rbf', 'C': 95.91864745933414, 'gamma': 0.08831762632396344, 'epsilon': 0.059581254968473225}. Best is trial 88 with value: 0.3542875001421725.
[I 2024-12-03 18:50:22,892] Trial 1201 finished with value: 1.0705487277998902 and parameters: {'kernel': 'rbf', 'C': 0.001839305752214382, 'gamma': 0.6838710973806479, 'epsilon': 0.0019383678221612062}. Best is trial 88 with value: 0.3542875001421725.
[I 2024-12-03 18:50:23,273] Trial 1202 finished with value: 0.496210591990506 and parameters: {'kernel': 'rbf', 'C': 89.280785466379, 'gamma': 0.052605658079418804, 'epsilon': 0.6258442346110346}. Best is trial 88 with value: 0.3542875001421725.
[I 2024-12-03 18:50:25,626] Trial 1205 finished with value: 0.4222521881576582 and parameters: {'kernel': 'rbf', 'C': 12.827232900749138, 'gamma': 0.031893043967264494, 'epsilon': 0.18283883053045275}. Best is trial 88 with value: 0.3542875001421725.
[I 2024-12-03 18:50:25,787] Trial 1206 finished with value: 0.46210643436532584 and parameters: {'kernel': 'rbf', 'C': 94.0650955998048, 'gamma': 0.13973255473311424, 'epsilon': 0.17377047518723535}. Best is trial 88 with value: 0.3542875001421725.
[I 2024-12-03 18:50:25,943] Trial 1204 finished with value: 0.36705935839419457 and parameters: {'kernel': 'rbf', 'C': 92.74673178884738, 'gamma': 0.038624155907218655, 'epsilon': 0.046933901182475285}. Best is trial 88 with value: 0.3542875001421725.
[I 2024-12-03 18:50:27,235] Trial 1207 finished with value: 0.4978268078625348 and parameters: {'kernel': 'rbf', 'C': 5.6446426767636835, 'gamma': 0.003758073560749509, 'epsilon': 0.3130516509547766}. Best is trial 88 with value: 0.3542875001421725.
[I 2024-12-03 18:50:28,099] Trial 1209 finished with value: 0.4166862332871155 and parameters: {'kernel': 'rbf', 'C': 16.44129708808019, 'gamma': 0.008476952910401066, 'epsilon': 0.1777322211629617}. Best is trial 88 with value: 0.3542875001421725.
[I 2024-12-03 18:50:28,689] Trial 1210 finished with value: 0.38362632316295875 and parameters: {'kernel': 'rbf', 'C': 89.09991130696521, 'gamma': 0.06910080569300711, 'epsilon': 0.23487041587542218}. Best is trial 88 with value: 0.3542875001421725.
[I 2024-12-03 18:50:29,791] Trial 1211 finished with value: 1.066366765338383 and parameters: {'kernel': 'rbf', 'C': 0.009428501417631328, 'gamma': 0.0001838705609631961, 'epsilon': 0.18469976720828366}. Best is trial 88 with value: 0.3542875001421725.
[I 2024-12-03 18:50:30,373] Trial 1212 finished with value: 0.38303799624990187 and parameters: {'kernel': 'rbf', 'C': 99.7955350084971, 'gamma': 0.07422679567433389, 'epsilon': 0.20102768413011401}. Best is trial 88 with value: 0.3542875001421725.
[I 2024-12-03 18:50:31,650] Trial 1213 finished with value: 0.6094707447913374 and parameters: {'kernel': 'rbf', 'C': 24.928072443174468, 'gamma': 0.35614245475525896, 'epsilon': 0.048829568400978}. Best is trial 88 with value: 0.3542875001421725.
[I 2024-12-03 18:50:32,959] Trial 1215 finished with value: 0.41150233788629575 and parameters: {'kernel': 'rbf', 'C': 94.98835773390425, 'gamma': 0.010337520943742075, 'epsilon': 0.12028501258093749}. Best is trial 88 with value: 0.3542875001421725.
[I 2024-12-03 18:50:34,273] Trial 1216 finished with value: 0.44346641097383044 and parameters: {'kernel': 'rbf', 'C': 19.20824589079971, 'gamma': 0.11851112526993828, 'epsilon': 0.15738212161296308}. Best is trial 88 with value: 0.3542875001421725.
[I 2024-12-03 18:50:35,600] Trial 1100 finished with value: 0.7947557525262275 and parameters: {'kernel': 'linear', 'C': 73.85326477369736, 'gamma': 0.011705593412430413, 'epsilon': 0.0763941294692425}. Best is trial 88 with value: 0.3542875001421725.
[I 2024-12-03 18:50:35,601] Trial 1203 finished with value: 0.7801032565008956 and parameters: {'kernel': 'linear', 'C': 8.779282232378655, 'gamma': 0.14521470688135454, 'epsilon': 0.17047906790749057}. Best is trial 88 with value: 0.3542875001421725.
[I 2024-12-03 18:50:35,603] Trial 1217 finished with value: 0.43697289233904774 and parameters: {'kernel': 'rbf', 'C': 24.203702586542207, 'gamma': 0.015711535194032216, 'epsilon': 0.11248702119391699}. Best is trial 88 with value: 0.3542875001421725.
[I 2024-12-03 18:50:37,320] Trial 1218 finished with value: 0.37051697369767406 and parameters: {'kernel': 'rbf', 'C': 99.78575884895852, 'gamma': 0.04279164203504433, 'epsilon': 0.29207663041895804}. Best is trial 88 with value: 0.3542875001421725.
[I 2024-12-03 18:50:37,474] Trial 1220 finished with value: 0.3874629528332444 and parameters: {'kernel': 'rbf', 'C': 25.02997048127678, 'gamma': 0.05094388803341228, 'epsilon': 0.08999105312242413}. Best is trial 88 with value: 0.3542875001421725.
