[I 2024-12-04 12:34:08,565] Trial 603 finished with value: 0.28596463823528506 and parameters: {'n_estimators': 1279, 'learning_rate': 0.04610372649266577, 'max_depth': 8, 'min_samples_split': 2, 'min_samples_leaf': 2, 'subsample': 0.8255339705428754, 'max_features': 'sqrt'}. Best is trial 360 with value: 0.2288165351387474.
[I 2024-12-04 12:34:08,716] Trial 617 finished with value: 0.2711931444354393 and parameters: {'n_estimators': 804, 'learning_rate': 0.09705115508845803, 'max_depth': 4, 'min_samples_split': 5, 'min_samples_leaf': 1, 'subsample': 0.6209377311037803, 'max_features': 'sqrt'}. Best is trial 360 with value: 0.2288165351387474.
[I 2024-12-04 12:34:09,871] Trial 610 finished with value: 0.24688007890633934 and parameters: {'n_estimators': 1048, 'learning_rate': 0.05029773305262238, 'max_depth': 8, 'min_samples_split': 2, 'min_samples_leaf': 1, 'subsample': 0.7298116691797624, 'max_features': 'sqrt'}. Best is trial 360 with value: 0.2288165351387474.
[I 2024-12-04 12:34:11,538] Trial 625 finished with value: 0.46671188938497166 and parameters: {'n_estimators': 298, 'learning_rate': 0.06649227721418437, 'max_depth': 11, 'min_samples_split': 6, 'min_samples_leaf': 9, 'subsample': 0.9219197698493798, 'max_features': 'sqrt'}. Best is trial 360 with value: 0.2288165351387474.
[I 2024-12-04 12:34:13,187] Trial 622 finished with value: 0.3811717627514131 and parameters: {'n_estimators': 455, 'learning_rate': 0.05193621072389232, 'max_depth': 6, 'min_samples_split': 2, 'min_samples_leaf': 4, 'subsample': 0.992430963603166, 'max_features': 'sqrt'}. Best is trial 360 with value: 0.2288165351387474.
[I 2024-12-04 12:34:14,446] Trial 626 finished with value: 0.7840621381842683 and parameters: {'n_estimators': 318, 'learning_rate': 0.06656463426510816, 'max_depth': 9, 'min_samples_split': 3, 'min_samples_leaf': 9, 'subsample': 0.8725891510346978, 'max_features': 'log2'}. Best is trial 360 with value: 0.2288165351387474.
[I 2024-12-04 12:34:14,768] Trial 601 finished with value: 0.35136343737799625 and parameters: {'n_estimators': 1479, 'learning_rate': 0.07871602857377537, 'max_depth': 7, 'min_samples_split': 2, 'min_samples_leaf': 3, 'subsample': 0.6194003073954026, 'max_features': 'sqrt'}. Best is trial 360 with value: 0.2288165351387474.
[I 2024-12-04 12:34:14,908] Trial 602 finished with value: 0.40206458558885794 and parameters: {'n_estimators': 1500, 'learning_rate': 0.04650417067032111, 'max_depth': 7, 'min_samples_split': 10, 'min_samples_leaf': 7, 'subsample': 0.8126516714724767, 'max_features': 'sqrt'}. Best is trial 360 with value: 0.2288165351387474.
[I 2024-12-04 12:34:16,665] Trial 612 finished with value: 0.23982726061393836 and parameters: {'n_estimators': 1042, 'learning_rate': 0.06477425480589277, 'max_depth': 6, 'min_samples_split': 4, 'min_samples_leaf': 1, 'subsample': 0.6170528390618643, 'max_features': 'sqrt'}. Best is trial 360 with value: 0.2288165351387474.
[I 2024-12-04 12:34:20,395] Trial 606 finished with value: 0.40378213630454596 and parameters: {'n_estimators': 1178, 'learning_rate': 0.08483040809759372, 'max_depth': 11, 'min_samples_split': 3, 'min_samples_leaf': 3, 'subsample': 0.7199543740395399, 'max_features': None}. Best is trial 360 with value: 0.2288165351387474.
[I 2024-12-04 12:34:22,061] Trial 604 finished with value: 0.3397590421307345 and parameters: {'n_estimators': 1437, 'learning_rate': 0.09669602047166283, 'max_depth': 6, 'min_samples_split': 3, 'min_samples_leaf': 3, 'subsample': 0.7182824792460398, 'max_features': 'sqrt'}. Best is trial 360 with value: 0.2288165351387474.
[I 2024-12-04 12:34:23,976] Trial 611 finished with value: 0.28159531141874317 and parameters: {'n_estimators': 1272, 'learning_rate': 0.09537361581253158, 'max_depth': 6, 'min_samples_split': 2, 'min_samples_leaf': 2, 'subsample': 0.65105348456257, 'max_features': 'sqrt'}. Best is trial 360 with value: 0.2288165351387474.
[I 2024-12-04 12:34:26,596] Trial 615 finished with value: 0.2637878925953001 and parameters: {'n_estimators': 1166, 'learning_rate': 0.06186268358963979, 'max_depth': 5, 'min_samples_split': 4, 'min_samples_leaf': 1, 'subsample': 0.7093053177517378, 'max_features': 'sqrt'}. Best is trial 360 with value: 0.2288165351387474.
[I 2024-12-04 12:34:28,527] Trial 608 finished with value: 0.4464594934697043 and parameters: {'n_estimators': 1394, 'learning_rate': 0.09938572847521333, 'max_depth': 5, 'min_samples_split': 4, 'min_samples_leaf': 8, 'subsample': 0.6516770285984256, 'max_features': 'sqrt'}. Best is trial 360 with value: 0.2288165351387474.
[I 2024-12-04 12:34:29,667] Trial 634 finished with value: 1.0424757396532671 and parameters: {'n_estimators': 364, 'learning_rate': 0.016508695973129636, 'max_depth': 5, 'min_samples_split': 13, 'min_samples_leaf': 5, 'subsample': 0.809458500018337, 'max_features': 'log2'}. Best is trial 360 with value: 0.2288165351387474.
[I 2024-12-04 12:34:32,472] Trial 613 finished with value: 0.6763748032882119 and parameters: {'n_estimators': 1377, 'learning_rate': 0.01440196740024724, 'max_depth': 6, 'min_samples_split': 7, 'min_samples_leaf': 5, 'subsample': 0.8567986439481737, 'max_features': 'log2'}. Best is trial 360 with value: 0.2288165351387474.
[I 2024-12-04 12:34:32,478] Trial 607 finished with value: 0.4053158319570863 and parameters: {'n_estimators': 1461, 'learning_rate': 0.0812325316373936, 'max_depth': 7, 'min_samples_split': 3, 'min_samples_leaf': 3, 'subsample': 0.6920796635091291, 'max_features': None}. Best is trial 360 with value: 0.2288165351387474.
[I 2024-12-04 12:34:35,055] Trial 609 finished with value: 0.47773018769518716 and parameters: {'n_estimators': 1416, 'learning_rate': 0.018706645872995555, 'max_depth': 12, 'min_samples_split': 12, 'min_samples_leaf': 10, 'subsample': 0.7177099253820407, 'max_features': None}. Best is trial 360 with value: 0.2288165351387474.
[I 2024-12-04 12:34:38,613] Trial 619 finished with value: 0.24268805215272696 and parameters: {'n_estimators': 1086, 'learning_rate': 0.06039242667145742, 'max_depth': 12, 'min_samples_split': 4, 'min_samples_leaf': 1, 'subsample': 0.6511430599899762, 'max_features': 'sqrt'}. Best is trial 360 with value: 0.2288165351387474.
[I 2024-12-04 12:34:41,497] Trial 616 finished with value: 0.37891219230752154 and parameters: {'n_estimators': 1291, 'learning_rate': 0.08370815185575775, 'max_depth': 12, 'min_samples_split': 3, 'min_samples_leaf': 2, 'subsample': 0.6281993865158417, 'max_features': None}. Best is trial 360 with value: 0.2288165351387474.
[I 2024-12-04 12:34:45,807] Trial 621 finished with value: 0.2256726988932517 and parameters: {'n_estimators': 1116, 'learning_rate': 0.09101889542927924, 'max_depth': 7, 'min_samples_split': 3, 'min_samples_leaf': 1, 'subsample': 0.9213321712819296, 'max_features': 'sqrt'}. Best is trial 621 with value: 0.2256726988932517.
[I 2024-12-04 12:34:46,724] Trial 624 finished with value: 0.22844957969389942 and parameters: {'n_estimators': 980, 'learning_rate': 0.09177627050423785, 'max_depth': 8, 'min_samples_split': 3, 'min_samples_leaf': 1, 'subsample': 0.6897704766587459, 'max_features': 'sqrt'}. Best is trial 621 with value: 0.2256726988932517.
[I 2024-12-04 12:34:47,603] Trial 618 finished with value: 0.2396496229929923 and parameters: {'n_estimators': 1249, 'learning_rate': 0.09786563275759276, 'max_depth': 7, 'min_samples_split': 4, 'min_samples_leaf': 1, 'subsample': 0.6169098550259756, 'max_features': 'sqrt'}. Best is trial 621 with value: 0.2256726988932517.
[I 2024-12-04 12:34:50,853] Trial 620 finished with value: 0.2751241501157305 and parameters: {'n_estimators': 1196, 'learning_rate': 0.07476579265032206, 'max_depth': 10, 'min_samples_split': 9, 'min_samples_leaf': 1, 'subsample': 0.6187636931550338, 'max_features': 'sqrt'}. Best is trial 621 with value: 0.2256726988932517.
[I 2024-12-04 12:34:55,071] Trial 635 finished with value: 0.7351358270287377 and parameters: {'n_estimators': 754, 'learning_rate': 0.019595284058786692, 'max_depth': 4, 'min_samples_split': 18, 'min_samples_leaf': 1, 'subsample': 0.7028823324212694, 'max_features': 'log2'}. Best is trial 621 with value: 0.2256726988932517.
[I 2024-12-04 12:34:55,105] Trial 631 finished with value: 0.4297198069526003 and parameters: {'n_estimators': 814, 'learning_rate': 0.019173440539173504, 'max_depth': 12, 'min_samples_split': 19, 'min_samples_leaf': 4, 'subsample': 0.8327820193101607, 'max_features': None}. Best is trial 621 with value: 0.2256726988932517.
[I 2024-12-04 12:35:01,780] Trial 652 finished with value: 1.088502840175044 and parameters: {'n_estimators': 272, 'learning_rate': 0.013602834173051649, 'max_depth': 10, 'min_samples_split': 7, 'min_samples_leaf': 4, 'subsample': 0.7655680601466911, 'max_features': 'log2'}. Best is trial 621 with value: 0.2256726988932517.
[I 2024-12-04 12:35:03,467] Trial 623 finished with value: 0.26346234505560107 and parameters: {'n_estimators': 1340, 'learning_rate': 0.040189517937636234, 'max_depth': 6, 'min_samples_split': 3, 'min_samples_leaf': 1, 'subsample': 0.7702320790752194, 'max_features': 'sqrt'}. Best is trial 621 with value: 0.2256726988932517.
[I 2024-12-04 12:35:05,572] Trial 627 finished with value: 0.44539542041246055 and parameters: {'n_estimators': 1083, 'learning_rate': 0.040603075664238944, 'max_depth': 9, 'min_samples_split': 6, 'min_samples_leaf': 7, 'subsample': 0.9441002429089644, 'max_features': None}. Best is trial 621 with value: 0.2256726988932517.
[I 2024-12-04 12:35:08,838] Trial 628 finished with value: 0.2467958572190802 and parameters: {'n_estimators': 1238, 'learning_rate': 0.08210871483055794, 'max_depth': 8, 'min_samples_split': 3, 'min_samples_leaf': 1, 'subsample': 0.801549325238995, 'max_features': 'sqrt'}. Best is trial 621 with value: 0.2256726988932517.
[I 2024-12-04 12:35:12,296] Trial 656 finished with value: 0.6259877565437307 and parameters: {'n_estimators': 274, 'learning_rate': 0.012567510871799473, 'max_depth': 9, 'min_samples_split': 11, 'min_samples_leaf': 2, 'subsample': 0.7811857646339726, 'max_features': 'sqrt'}. Best is trial 621 with value: 0.2256726988932517.
[I 2024-12-04 12:35:15,247] Trial 662 finished with value: 0.9730088790379124 and parameters: {'n_estimators': 118, 'learning_rate': 0.03995991984830199, 'max_depth': 5, 'min_samples_split': 14, 'min_samples_leaf': 2, 'subsample': 0.887517353830454, 'max_features': 'log2'}. Best is trial 621 with value: 0.2256726988932517.
[I 2024-12-04 12:35:16,956] Trial 630 finished with value: 0.23668238908692757 and parameters: {'n_estimators': 1254, 'learning_rate': 0.05203467499380303, 'max_depth': 10, 'min_samples_split': 5, 'min_samples_leaf': 1, 'subsample': 0.6866462807892725, 'max_features': 'sqrt'}. Best is trial 621 with value: 0.2256726988932517.
[I 2024-12-04 12:35:19,995] Trial 639 finished with value: 0.3617272485017062 and parameters: {'n_estimators': 1005, 'learning_rate': 0.05815463402690773, 'max_depth': 6, 'min_samples_split': 4, 'min_samples_leaf': 3, 'subsample': 0.6575722370181083, 'max_features': 'sqrt'}. Best is trial 621 with value: 0.2256726988932517.
[I 2024-12-04 12:35:23,028] Trial 638 finished with value: 0.35801710761067135 and parameters: {'n_estimators': 1112, 'learning_rate': 0.059148757199159366, 'max_depth': 6, 'min_samples_split': 3, 'min_samples_leaf': 4, 'subsample': 0.6131649131489477, 'max_features': 'sqrt'}. Best is trial 621 with value: 0.2256726988932517.
[I 2024-12-04 12:35:24,354] Trial 636 finished with value: 0.2879540450382927 and parameters: {'n_estimators': 1228, 'learning_rate': 0.08909128844462823, 'max_depth': 7, 'min_samples_split': 8, 'min_samples_leaf': 2, 'subsample': 0.8006762498282927, 'max_features': 'sqrt'}. Best is trial 621 with value: 0.2256726988932517.
[I 2024-12-04 12:35:25,921] Trial 633 finished with value: 0.3650317290409769 and parameters: {'n_estimators': 1358, 'learning_rate': 0.08928199573324073, 'max_depth': 6, 'min_samples_split': 9, 'min_samples_leaf': 4, 'subsample': 0.800575459226705, 'max_features': 'sqrt'}. Best is trial 621 with value: 0.2256726988932517.
[I 2024-12-04 12:35:27,600] Trial 641 finished with value: 0.31223758107072525 and parameters: {'n_estimators': 964, 'learning_rate': 0.08532972413913882, 'max_depth': 8, 'min_samples_split': 2, 'min_samples_leaf': 2, 'subsample': 0.6461262179673203, 'max_features': 'log2'}. Best is trial 621 with value: 0.2256726988932517.
[I 2024-12-04 12:35:28,613] Trial 640 finished with value: 0.24721429516194587 and parameters: {'n_estimators': 1079, 'learning_rate': 0.06879673120595314, 'max_depth': 6, 'min_samples_split': 3, 'min_samples_leaf': 1, 'subsample': 0.6791600423108055, 'max_features': 'sqrt'}. Best is trial 621 with value: 0.2256726988932517.
[I 2024-12-04 12:35:28,997] Trial 629 finished with value: 0.4129247667265546 and parameters: {'n_estimators': 1382, 'learning_rate': 0.048830604752436654, 'max_depth': 9, 'min_samples_split': 2, 'min_samples_leaf': 4, 'subsample': 0.6471860461759291, 'max_features': None}. Best is trial 621 with value: 0.2256726988932517.
[I 2024-12-04 12:35:31,872] Trial 637 finished with value: 0.3720809287525422 and parameters: {'n_estimators': 1238, 'learning_rate': 0.06792810386554247, 'max_depth': 11, 'min_samples_split': 5, 'min_samples_leaf': 4, 'subsample': 0.6095262568759959, 'max_features': 'sqrt'}. Best is trial 621 with value: 0.2256726988932517.
[I 2024-12-04 12:35:31,883] Trial 632 finished with value: 0.24308439436761245 and parameters: {'n_estimators': 1428, 'learning_rate': 0.07799386340188189, 'max_depth': 10, 'min_samples_split': 2, 'min_samples_leaf': 1, 'subsample': 0.6392250712959603, 'max_features': 'sqrt'}. Best is trial 621 with value: 0.2256726988932517.
[I 2024-12-04 12:35:33,481] Trial 667 finished with value: 0.49800448768101485 and parameters: {'n_estimators': 151, 'learning_rate': 0.09651272398872243, 'max_depth': 3, 'min_samples_split': 8, 'min_samples_leaf': 10, 'subsample': 0.7073231782816432, 'max_features': None}. Best is trial 621 with value: 0.2256726988932517.
[I 2024-12-04 12:35:35,720] Trial 647 finished with value: 0.2961006064292432 and parameters: {'n_estimators': 942, 'learning_rate': 0.07503349581837554, 'max_depth': 5, 'min_samples_split': 2, 'min_samples_leaf': 1, 'subsample': 0.6499136238096836, 'max_features': 'sqrt'}. Best is trial 621 with value: 0.2256726988932517.
[I 2024-12-04 12:35:39,696] Trial 651 finished with value: 0.2918677541295545 and parameters: {'n_estimators': 894, 'learning_rate': 0.051316166839869795, 'max_depth': 9, 'min_samples_split': 7, 'min_samples_leaf': 2, 'subsample': 0.7638698365579477, 'max_features': 'sqrt'}. Best is trial 621 with value: 0.2256726988932517.
[I 2024-12-04 12:35:42,710] Trial 642 finished with value: 0.24229413714641945 and parameters: {'n_estimators': 1315, 'learning_rate': 0.05206543618226801, 'max_depth': 7, 'min_samples_split': 5, 'min_samples_leaf': 1, 'subsample': 0.6201668926057038, 'max_features': 'sqrt'}. Best is trial 621 with value: 0.2256726988932517.
[I 2024-12-04 12:35:43,853] Trial 653 finished with value: 0.25797812206320575 and parameters: {'n_estimators': 870, 'learning_rate': 0.049721959643660836, 'max_depth': 6, 'min_samples_split': 2, 'min_samples_leaf': 1, 'subsample': 0.6200406286938036, 'max_features': 'sqrt'}. Best is trial 621 with value: 0.2256726988932517.
[I 2024-12-04 12:35:44,178] Trial 649 finished with value: 0.8642291176986425 and parameters: {'n_estimators': 999, 'learning_rate': 0.028034504494258573, 'max_depth': 8, 'min_samples_split': 10, 'min_samples_leaf': 9, 'subsample': 0.7853024858414384, 'max_features': 'log2'}. Best is trial 621 with value: 0.2256726988932517.
[I 2024-12-04 12:35:44,545] Trial 657 finished with value: 0.2542047573884823 and parameters: {'n_estimators': 758, 'learning_rate': 0.0663423665971303, 'max_depth': 9, 'min_samples_split': 2, 'min_samples_leaf': 1, 'subsample': 0.6712202537602606, 'max_features': 'sqrt'}. Best is trial 621 with value: 0.2256726988932517.
[I 2024-12-04 12:35:44,696] Trial 644 finished with value: 0.27172154233663703 and parameters: {'n_estimators': 1181, 'learning_rate': 0.06783959959279653, 'max_depth': 6, 'min_samples_split': 10, 'min_samples_leaf': 1, 'subsample': 0.7444863021020951, 'max_features': 'sqrt'}. Best is trial 621 with value: 0.2256726988932517.
[I 2024-12-04 12:35:45,736] Trial 646 finished with value: 0.35049334358948203 and parameters: {'n_estimators': 1166, 'learning_rate': 0.05033480379805558, 'max_depth': 9, 'min_samples_split': 3, 'min_samples_leaf': 3, 'subsample': 0.6264183763815265, 'max_features': 'sqrt'}. Best is trial 621 with value: 0.2256726988932517.
[I 2024-12-04 12:35:49,151] Trial 648 finished with value: 0.28369350911504254 and parameters: {'n_estimators': 1155, 'learning_rate': 0.0674866649247559, 'max_depth': 7, 'min_samples_split': 11, 'min_samples_leaf': 2, 'subsample': 0.8475635180718069, 'max_features': 'sqrt'}. Best is trial 621 with value: 0.2256726988932517.
[I 2024-12-04 12:35:49,925] Trial 650 finished with value: 0.2512623272890987 and parameters: {'n_estimators': 1066, 'learning_rate': 0.0622937480972182, 'max_depth': 12, 'min_samples_split': 6, 'min_samples_leaf': 1, 'subsample': 0.7710542235642559, 'max_features': 'sqrt'}. Best is trial 621 with value: 0.2256726988932517.
[I 2024-12-04 12:35:50,615] Trial 658 finished with value: 0.4851519763227524 and parameters: {'n_estimators': 905, 'learning_rate': 0.07858508099251324, 'max_depth': 9, 'min_samples_split': 16, 'min_samples_leaf': 10, 'subsample': 0.7382467802316407, 'max_features': 'sqrt'}. Best is trial 621 with value: 0.2256726988932517.
[I 2024-12-04 12:35:52,099] Trial 643 finished with value: 0.2936199406916114 and parameters: {'n_estimators': 1433, 'learning_rate': 0.07335348243498757, 'max_depth': 9, 'min_samples_split': 9, 'min_samples_leaf': 2, 'subsample': 0.7126988943057808, 'max_features': 'sqrt'}. Best is trial 621 with value: 0.2256726988932517.
[I 2024-12-04 12:35:53,143] Trial 654 finished with value: 0.25407980230080796 and parameters: {'n_estimators': 1055, 'learning_rate': 0.07548545749224793, 'max_depth': 5, 'min_samples_split': 6, 'min_samples_leaf': 1, 'subsample': 0.9720097467573855, 'max_features': 'sqrt'}. Best is trial 621 with value: 0.2256726988932517.
[I 2024-12-04 12:35:56,154] Trial 645 finished with value: 0.2777482398377353 and parameters: {'n_estimators': 1296, 'learning_rate': 0.0523001970105578, 'max_depth': 10, 'min_samples_split': 4, 'min_samples_leaf': 2, 'subsample': 0.6069676680402813, 'max_features': 'sqrt'}. Best is trial 621 with value: 0.2256726988932517.
[I 2024-12-04 12:35:58,211] Trial 659 finished with value: 0.29239738526374975 and parameters: {'n_estimators': 981, 'learning_rate': 0.09751955548900623, 'max_depth': 6, 'min_samples_split': 3, 'min_samples_leaf': 2, 'subsample': 0.6911687716488328, 'max_features': 'sqrt'}. Best is trial 621 with value: 0.2256726988932517.
[I 2024-12-04 12:36:01,800] Trial 655 finished with value: 0.2544075703171755 and parameters: {'n_estimators': 1122, 'learning_rate': 0.09191732011254547, 'max_depth': 8, 'min_samples_split': 6, 'min_samples_leaf': 1, 'subsample': 0.7188030047595061, 'max_features': 'sqrt'}. Best is trial 621 with value: 0.2256726988932517.
[I 2024-12-04 12:36:03,768] Trial 671 finished with value: 0.40277698915126636 and parameters: {'n_estimators': 543, 'learning_rate': 0.050240437829159844, 'max_depth': 4, 'min_samples_split': 20, 'min_samples_leaf': 1, 'subsample': 0.9817114574302876, 'max_features': 'sqrt'}. Best is trial 621 with value: 0.2256726988932517.
[I 2024-12-04 12:36:05,082] Trial 679 finished with value: 0.9010433712624546 and parameters: {'n_estimators': 118, 'learning_rate': 0.03565402184732627, 'max_depth': 4, 'min_samples_split': 8, 'min_samples_leaf': 9, 'subsample': 0.812038686896751, 'max_features': 'sqrt'}. Best is trial 621 with value: 0.2256726988932517.
[I 2024-12-04 12:36:09,531] Trial 666 finished with value: 0.2806015607544804 and parameters: {'n_estimators': 937, 'learning_rate': 0.0821730159143297, 'max_depth': 8, 'min_samples_split': 2, 'min_samples_leaf': 2, 'subsample': 0.7069275155772734, 'max_features': 'sqrt'}. Best is trial 621 with value: 0.2256726988932517.
[I 2024-12-04 12:36:10,902] Trial 673 finished with value: 0.46254046272398924 and parameters: {'n_estimators': 387, 'learning_rate': 0.0111503979151223, 'max_depth': 5, 'min_samples_split': 16, 'min_samples_leaf': 7, 'subsample': 0.8068935449252869, 'max_features': None}. Best is trial 621 with value: 0.2256726988932517.
[I 2024-12-04 12:36:10,908] Trial 660 finished with value: 0.30347620493848193 and parameters: {'n_estimators': 1260, 'learning_rate': 0.09119973237342098, 'max_depth': 8, 'min_samples_split': 7, 'min_samples_leaf': 2, 'subsample': 0.9180355217007569, 'max_features': 'sqrt'}. Best is trial 621 with value: 0.2256726988932517.
[I 2024-12-04 12:36:12,817] Trial 661 finished with value: 0.24959095016505106 and parameters: {'n_estimators': 1178, 'learning_rate': 0.04723688855447152, 'max_depth': 10, 'min_samples_split': 2, 'min_samples_leaf': 1, 'subsample': 0.7129200970933884, 'max_features': 'sqrt'}. Best is trial 621 with value: 0.2256726988932517.
[I 2024-12-04 12:36:17,353] Trial 665 finished with value: 0.2452131002162913 and parameters: {'n_estimators': 1104, 'learning_rate': 0.06822259821387616, 'max_depth': 9, 'min_samples_split': 6, 'min_samples_leaf': 1, 'subsample': 0.6728799060336118, 'max_features': 'sqrt'}. Best is trial 621 with value: 0.2256726988932517.
[I 2024-12-04 12:36:17,746] Trial 663 finished with value: 0.2938022290639928 and parameters: {'n_estimators': 1242, 'learning_rate': 0.07589599375424856, 'max_depth': 10, 'min_samples_split': 2, 'min_samples_leaf': 2, 'subsample': 0.7129149783489817, 'max_features': 'sqrt'}. Best is trial 621 with value: 0.2256726988932517.
