[I 2024-12-04 14:56:47,006] Trial 215 finished with value: 0.4883033930944006 and parameters: {'kernel_type': 'Matern', 'length_scale': 1020.2112217239412, 'noise_level': 0.38144371853716696, 'constant_value': 10109.696142655801, 'nu': 0.5}. Best is trial 149 with value: 0.48830133927701114.
[I 2024-12-04 14:56:47,039] Trial 229 finished with value: 0.48830354566184736 and parameters: {'kernel_type': 'Matern', 'length_scale': 10.905351723758983, 'noise_level': 0.5058150717008016, 'constant_value': 108.45328914578087, 'nu': 0.5}. Best is trial 149 with value: 0.48830133927701114.
[I 2024-12-04 14:56:47,297] Trial 223 finished with value: 0.48830347710659444 and parameters: {'kernel_type': 'Matern', 'length_scale': 3851.308431108635, 'noise_level': 0.0043386428615046465, 'constant_value': 486.1384074401418, 'nu': 0.5}. Best is trial 149 with value: 0.48830133927701114.
[I 2024-12-04 14:56:48,504] Trial 233 finished with value: 1.2401112324292212 and parameters: {'kernel_type': 'RBF', 'length_scale': 62235.42287107139, 'noise_level': 0.001337149981612433, 'constant_value': 15.079329603862002, 'nu': 0.5}. Best is trial 149 with value: 0.48830133927701114.
[I 2024-12-04 14:56:51,031] Trial 228 finished with value: 0.566393625900154 and parameters: {'kernel_type': 'Matern', 'length_scale': 88977.79938466461, 'noise_level': 0.4171841138015559, 'constant_value': 5236.6532147231255, 'nu': 2.5}. Best is trial 149 with value: 0.48830133927701114.
[I 2024-12-04 14:56:51,860] Trial 234 finished with value: 0.4883034704529011 and parameters: {'kernel_type': 'Matern', 'length_scale': 0.24954624779846132, 'noise_level': 0.0023613199502825325, 'constant_value': 27.503273690556632, 'nu': 0.5}. Best is trial 149 with value: 0.48830133927701114.
[I 2024-12-04 14:56:52,102] Trial 241 finished with value: 0.5663936657577144 and parameters: {'kernel_type': 'Matern', 'length_scale': 8.811644055311703, 'noise_level': 0.0024148605135835472, 'constant_value': 189.11582018253387, 'nu': 2.5}. Best is trial 149 with value: 0.48830133927701114.
[I 2024-12-04 14:56:52,107] Trial 230 finished with value: 1.2401112325769135 and parameters: {'kernel_type': 'Matern', 'length_scale': 60626.64908631287, 'noise_level': 0.03374285087976178, 'constant_value': 89.09031904100316, 'nu': 0.5}. Best is trial 149 with value: 0.48830133927701114.
[I 2024-12-04 14:56:52,478] Trial 235 finished with value: 0.644385361075531 and parameters: {'kernel_type': 'RBF', 'length_scale': 25.54835652904609, 'noise_level': 0.17765871715237988, 'constant_value': 0.0018137024592125796, 'nu': 2.5}. Best is trial 149 with value: 0.48830133927701114.
[I 2024-12-04 14:56:52,576] Trial 225 finished with value: 1.2401112321738406 and parameters: {'kernel_type': 'RBF', 'length_scale': 123.21403561270274, 'noise_level': 4.317440945932068e-08, 'constant_value': 1.4196241045365615e-07, 'nu': 1.5}. Best is trial 149 with value: 0.48830133927701114.
[I 2024-12-04 14:56:53,178] Trial 236 finished with value: 0.488303415784178 and parameters: {'kernel_type': 'Matern', 'length_scale': 360.7746898485743, 'noise_level': 0.2083714658223481, 'constant_value': 64872.03223724704, 'nu': 0.5}. Best is trial 149 with value: 0.48830133927701114.
[I 2024-12-04 14:56:54,687] Trial 232 finished with value: 0.48830283123437085 and parameters: {'kernel_type': 'Matern', 'length_scale': 0.7225941120251455, 'noise_level': 0.009555820608110563, 'constant_value': 0.30240805964664347, 'nu': 0.5}. Best is trial 149 with value: 0.48830133927701114.
[I 2024-12-04 14:56:55,281] Trial 224 finished with value: 0.48830358595506196 and parameters: {'kernel_type': 'Matern', 'length_scale': 381.75921499503767, 'noise_level': 0.01301033254423199, 'constant_value': 2065.505560070552, 'nu': 0.5}. Best is trial 149 with value: 0.48830133927701114.
[I 2024-12-04 14:56:55,688] Trial 242 finished with value: 0.48830341883683775 and parameters: {'kernel_type': 'Matern', 'length_scale': 167.300240894424, 'noise_level': 0.01768263429069912, 'constant_value': 25390.49820783801, 'nu': 0.5}. Best is trial 149 with value: 0.48830133927701114.
[I 2024-12-04 14:56:56,670] Trial 239 finished with value: 0.4883034066211668 and parameters: {'kernel_type': 'Matern', 'length_scale': 6357.9742610133935, 'noise_level': 0.38847361575602257, 'constant_value': 49237.32126552557, 'nu': 0.5}. Best is trial 149 with value: 0.48830133927701114.
[I 2024-12-04 14:56:57,202] Trial 237 finished with value: 1.261454797635245 and parameters: {'kernel_type': 'RBF', 'length_scale': 0.771292593186649, 'noise_level': 1.34619778996383e-06, 'constant_value': 7.083228972955944e-05, 'nu': 0.5}. Best is trial 149 with value: 0.48830133927701114.
[I 2024-12-04 14:56:57,226] Trial 245 finished with value: 0.4883034136504763 and parameters: {'kernel_type': 'Matern', 'length_scale': 77233.04397517735, 'noise_level': 0.0018938781379487313, 'constant_value': 3496.5856238888236, 'nu': 0.5}. Best is trial 149 with value: 0.48830133927701114.
[I 2024-12-04 14:56:57,247] Trial 252 finished with value: 1.240111096099503 and parameters: {'kernel_type': 'Matern', 'length_scale': 0.06553657406723092, 'noise_level': 0.0012324304546877424, 'constant_value': 0.14880105220898648, 'nu': 0.5}. Best is trial 149 with value: 0.48830133927701114.
[I 2024-12-04 14:56:58,151] Trial 243 finished with value: 1.2401112326243169 and parameters: {'kernel_type': 'RBF', 'length_scale': 14.639812958535964, 'noise_level': 1.7676008297067348e-06, 'constant_value': 26711.67458089523, 'nu': 2.5}. Best is trial 149 with value: 0.48830133927701114.
[I 2024-12-04 14:56:59,508] Trial 246 finished with value: 1.240111232651551 and parameters: {'kernel_type': 'Matern', 'length_scale': 121.17956495091526, 'noise_level': 0.030978471896763095, 'constant_value': 0.14085591308447032, 'nu': 1.5}. Best is trial 149 with value: 0.48830133927701114.
[I 2024-12-04 14:57:01,347] Trial 240 finished with value: 1.240111232593198 and parameters: {'kernel_type': 'Matern', 'length_scale': 4.023518345315139e-05, 'noise_level': 3.4187111069743426e-05, 'constant_value': 6.157427757375224e-06, 'nu': 0.5}. Best is trial 149 with value: 0.48830133927701114.
[I 2024-12-04 14:57:01,766] Trial 256 finished with value: 0.4883033554655505 and parameters: {'kernel_type': 'Matern', 'length_scale': 0.9483227427126516, 'noise_level': 0.002539187191003824, 'constant_value': 16.303695242250544, 'nu': 0.5}. Best is trial 149 with value: 0.48830133927701114.
[I 2024-12-04 14:57:02,234] Trial 244 finished with value: 0.4883034189763952 and parameters: {'kernel_type': 'Matern', 'length_scale': 1.798758929794569, 'noise_level': 0.0730213473209234, 'constant_value': 0.12991346755582814, 'nu': 0.5}. Best is trial 149 with value: 0.48830133927701114.
[I 2024-12-04 14:57:03,033] Trial 254 finished with value: 0.48830250212936277 and parameters: {'kernel_type': 'Matern', 'length_scale': 34093.683757737155, 'noise_level': 0.36683284199929866, 'constant_value': 83937.47754798722, 'nu': 0.5}. Best is trial 149 with value: 0.48830133927701114.
[I 2024-12-04 14:57:03,458] Trial 247 finished with value: 0.4883033094268868 and parameters: {'kernel_type': 'Matern', 'length_scale': 4.689170015883548, 'noise_level': 0.03923904640231738, 'constant_value': 1.1712688927252743, 'nu': 0.5}. Best is trial 149 with value: 0.48830133927701114.
[I 2024-12-04 14:57:06,071] Trial 249 finished with value: 1.2401112325807757 and parameters: {'kernel_type': 'Matern', 'length_scale': 3.2024545712069052, 'noise_level': 0.009681159918671512, 'constant_value': 0.033482647257888055, 'nu': 0.5}. Best is trial 149 with value: 0.48830133927701114.
[I 2024-12-04 14:57:07,028] Trial 251 finished with value: 1.261454793385454 and parameters: {'kernel_type': 'Matern', 'length_scale': 90850.35465043828, 'noise_level': 0.5392662897991595, 'constant_value': 0.24771550735373943, 'nu': 0.5}. Best is trial 149 with value: 0.48830133927701114.
[I 2024-12-04 14:57:07,119] Trial 260 finished with value: 0.6443856692286511 and parameters: {'kernel_type': 'RBF', 'length_scale': 5.916483849093835, 'noise_level': 0.0003678021832423191, 'constant_value': 2615.6859051269835, 'nu': 0.5}. Best is trial 149 with value: 0.48830133927701114.
[I 2024-12-04 14:57:07,487] Trial 248 finished with value: 1.2401112297579295 and parameters: {'kernel_type': 'Matern', 'length_scale': 0.054645333353561386, 'noise_level': 0.00020031702721245499, 'constant_value': 4.480638953901116, 'nu': 1.5}. Best is trial 149 with value: 0.48830133927701114.
[I 2024-12-04 14:57:08,035] Trial 253 finished with value: 0.48830333377322277 and parameters: {'kernel_type': 'Matern', 'length_scale': 3.525289130428908, 'noise_level': 0.0008866993167759834, 'constant_value': 11.707680239485198, 'nu': 0.5}. Best is trial 149 with value: 0.48830133927701114.
[I 2024-12-04 14:57:08,898] Trial 265 finished with value: 1.2614543701309122 and parameters: {'kernel_type': 'Matern', 'length_scale': 0.08801975453382319, 'noise_level': 4.76587153477548e-05, 'constant_value': 1326.4663447776404, 'nu': 0.5}. Best is trial 149 with value: 0.48830133927701114.
[I 2024-12-04 14:57:09,271] Trial 257 finished with value: 0.48830345334135344 and parameters: {'kernel_type': 'Matern', 'length_scale': 11.833104179268076, 'noise_level': 0.220351059184195, 'constant_value': 15.763419235673625, 'nu': 0.5}. Best is trial 149 with value: 0.48830133927701114.
[I 2024-12-04 14:57:09,428] Trial 258 finished with value: 0.4883035862531834 and parameters: {'kernel_type': 'Matern', 'length_scale': 2622.498342926988, 'noise_level': 0.8503077872365192, 'constant_value': 267.9035482548474, 'nu': 0.5}. Best is trial 149 with value: 0.48830133927701114.
[I 2024-12-04 14:57:09,624] Trial 255 finished with value: 0.5273053353490975 and parameters: {'kernel_type': 'Matern', 'length_scale': 151.35922149133137, 'noise_level': 0.8316147457831966, 'constant_value': 24010.065071983663, 'nu': 1.5}. Best is trial 149 with value: 0.48830133927701114.
[I 2024-12-04 14:57:12,503] Trial 261 finished with value: 0.4883034035672398 and parameters: {'kernel_type': 'Matern', 'length_scale': 15.74401413455937, 'noise_level': 0.0010435727547120398, 'constant_value': 1.0721992546095247, 'nu': 0.5}. Best is trial 149 with value: 0.48830133927701114.
[I 2024-12-04 14:57:13,021] Trial 262 finished with value: 0.4883034190734742 and parameters: {'kernel_type': 'Matern', 'length_scale': 0.5309521532370077, 'noise_level': 0.008652960347825315, 'constant_value': 0.18352655741879206, 'nu': 0.5}. Best is trial 149 with value: 0.48830133927701114.
[I 2024-12-04 14:57:13,135] Trial 250 finished with value: 1.2401112326074892 and parameters: {'kernel_type': 'RBF', 'length_scale': 4880.971877550366, 'noise_level': 3.842089293650086e-06, 'constant_value': 50530.50283129881, 'nu': 1.5}. Best is trial 149 with value: 0.48830133927701114.
[I 2024-12-04 14:57:13,633] Trial 263 finished with value: 0.48830342243485714 and parameters: {'kernel_type': 'Matern', 'length_scale': 0.8543665226432837, 'noise_level': 0.003497448737909777, 'constant_value': 1.7019685655464405, 'nu': 0.5}. Best is trial 149 with value: 0.48830133927701114.
[I 2024-12-04 14:57:14,183] Trial 268 finished with value: 0.48830341496409685 and parameters: {'kernel_type': 'Matern', 'length_scale': 10089.059930881456, 'noise_level': 0.3400043955816333, 'constant_value': 84117.77476962112, 'nu': 0.5}. Best is trial 149 with value: 0.48830133927701114.
[I 2024-12-04 14:57:14,357] Trial 238 finished with value: 1.240111232579729 and parameters: {'kernel_type': 'Matern', 'length_scale': 1010.0555372438447, 'noise_level': 0.006186568371685281, 'constant_value': 0.584735060218269, 'nu': 0.5}. Best is trial 149 with value: 0.48830133927701114.
[I 2024-12-04 14:57:14,577] Trial 259 finished with value: 0.4883031548325317 and parameters: {'kernel_type': 'Matern', 'length_scale': 11.383138971208735, 'noise_level': 0.12373406836862703, 'constant_value': 13.199329378868699, 'nu': 0.5}. Best is trial 149 with value: 0.48830133927701114.
[I 2024-12-04 14:57:14,632] Trial 274 finished with value: 0.4883034118115949 and parameters: {'kernel_type': 'Matern', 'length_scale': 0.8275571274543462, 'noise_level': 0.04246494228464171, 'constant_value': 1.3087033204558498, 'nu': 0.5}. Best is trial 149 with value: 0.48830133927701114.
[I 2024-12-04 14:57:15,196] Trial 273 finished with value: 0.48830340485990925 and parameters: {'kernel_type': 'Matern', 'length_scale': 21163.626444003945, 'noise_level': 0.05886550210774232, 'constant_value': 19856.07898049612, 'nu': 0.5}. Best is trial 149 with value: 0.48830133927701114.
[I 2024-12-04 14:57:16,100] Trial 267 finished with value: 0.48830342334238896 and parameters: {'kernel_type': 'Matern', 'length_scale': 0.43302937718225926, 'noise_level': 0.0003126303245310172, 'constant_value': 1222.293751177814, 'nu': 0.5}. Best is trial 149 with value: 0.48830133927701114.
[I 2024-12-04 14:57:16,298] Trial 264 finished with value: 0.4883034019393026 and parameters: {'kernel_type': 'Matern', 'length_scale': 38375.73072255622, 'noise_level': 0.06371027808731165, 'constant_value': 62378.78714083286, 'nu': 0.5}. Best is trial 149 with value: 0.48830133927701114.
[I 2024-12-04 14:57:16,998] Trial 275 finished with value: 0.6443853894035868 and parameters: {'kernel_type': 'RBF', 'length_scale': 0.6948015074574923, 'noise_level': 4.888869905112965e-10, 'constant_value': 0.0026204512928317963, 'nu': 1.5}. Best is trial 149 with value: 0.48830133927701114.
[I 2024-12-04 14:57:17,148] Trial 270 finished with value: 1.2614547953252624 and parameters: {'kernel_type': 'Matern', 'length_scale': 0.8251079693290195, 'noise_level': 0.029173926183902462, 'constant_value': 50.077707380031754, 'nu': 0.5}. Best is trial 149 with value: 0.48830133927701114.
[I 2024-12-04 14:57:17,937] Trial 269 finished with value: 0.48830349842194265 and parameters: {'kernel_type': 'Matern', 'length_scale': 0.32179796463035565, 'noise_level': 0.009770029947883615, 'constant_value': 1.501128491259396, 'nu': 0.5}. Best is trial 149 with value: 0.48830133927701114.
[I 2024-12-04 14:57:18,442] Trial 266 finished with value: 0.48830340982428894 and parameters: {'kernel_type': 'Matern', 'length_scale': 1.2832518410385991, 'noise_level': 0.015209188031587618, 'constant_value': 13.55816563880275, 'nu': 0.5}. Best is trial 149 with value: 0.48830133927701114.
[I 2024-12-04 14:57:20,451] Trial 280 finished with value: 0.4883033725270667 and parameters: {'kernel_type': 'Matern', 'length_scale': 3.950284679881404, 'noise_level': 0.0010055480907832201, 'constant_value': 10.59503073505984, 'nu': 0.5}. Best is trial 149 with value: 0.48830133927701114.
[I 2024-12-04 14:57:20,578] Trial 272 finished with value: 0.48830325497746613 and parameters: {'kernel_type': 'Matern', 'length_scale': 126.30276127551609, 'noise_level': 0.0023369012367124953, 'constant_value': 202.19380120010814, 'nu': 0.5}. Best is trial 149 with value: 0.48830133927701114.
[I 2024-12-04 14:57:20,848] Trial 277 finished with value: 0.4883034167006033 and parameters: {'kernel_type': 'Matern', 'length_scale': 14.399446423361361, 'noise_level': 0.003013758901628293, 'constant_value': 541.6963143964978, 'nu': 0.5}. Best is trial 149 with value: 0.48830133927701114.
[I 2024-12-04 14:57:20,995] Trial 271 finished with value: 0.4883034324835949 and parameters: {'kernel_type': 'Matern', 'length_scale': 50421.08328111527, 'noise_level': 0.38850392342708, 'constant_value': 78928.55151242226, 'nu': 0.5}. Best is trial 149 with value: 0.48830133927701114.
[I 2024-12-04 14:57:21,459] Trial 276 finished with value: 0.4883034012750225 and parameters: {'kernel_type': 'Matern', 'length_scale': 1.0950292118475928, 'noise_level': 0.00031695477058409343, 'constant_value': 150.71943788076084, 'nu': 0.5}. Best is trial 149 with value: 0.48830133927701114.
[I 2024-12-04 14:57:24,441] Trial 279 finished with value: 0.48830341586955184 and parameters: {'kernel_type': 'Matern', 'length_scale': 5.989788731846229, 'noise_level': 0.0007282453335437158, 'constant_value': 7.312169723174768, 'nu': 0.5}. Best is trial 149 with value: 0.48830133927701114.
[I 2024-12-04 14:57:25,088] Trial 283 finished with value: 1.2614543702026237 and parameters: {'kernel_type': 'RBF', 'length_scale': 0.0012477992342641586, 'noise_level': 4.903355311753759e-10, 'constant_value': 5069.168829784201, 'nu': 0.5}. Best is trial 149 with value: 0.48830133927701114.
[I 2024-12-04 14:57:26,520] Trial 286 finished with value: 0.48830340124446314 and parameters: {'kernel_type': 'Matern', 'length_scale': 0.5183713914877037, 'noise_level': 0.16339380620655994, 'constant_value': 5919.738288801545, 'nu': 0.5}. Best is trial 149 with value: 0.48830133927701114.
[I 2024-12-04 14:57:27,902] Trial 278 finished with value: 0.48830336539838015 and parameters: {'kernel_type': 'Matern', 'length_scale': 2.228546604651664, 'noise_level': 0.18087449895192, 'constant_value': 6768.094442419352, 'nu': 0.5}. Best is trial 149 with value: 0.48830133927701114.
[I 2024-12-04 14:57:29,225] Trial 281 finished with value: 0.4883034182023243 and parameters: {'kernel_type': 'Matern', 'length_scale': 41.16180297396295, 'noise_level': 0.0760556587361713, 'constant_value': 0.38385513183050424, 'nu': 0.5}. Best is trial 149 with value: 0.48830133927701114.
[I 2024-12-04 14:57:29,487] Trial 294 finished with value: 0.48830344076770327 and parameters: {'kernel_type': 'Matern', 'length_scale': 214.68032124886417, 'noise_level': 0.00022687734900721067, 'constant_value': 43.7344200466956, 'nu': 0.5}. Best is trial 149 with value: 0.48830133927701114.
[I 2024-12-04 14:57:30,109] Trial 298 finished with value: 1.2614547732486063 and parameters: {'kernel_type': 'Matern', 'length_scale': 20.203108032862882, 'noise_level': 6.489635177364218e-05, 'constant_value': 194.7511978616257, 'nu': 0.5}. Best is trial 149 with value: 0.48830133927701114.
[I 2024-12-04 14:57:30,839] Trial 289 finished with value: 0.4883033727528538 and parameters: {'kernel_type': 'Matern', 'length_scale': 2100.9714746618138, 'noise_level': 0.0006815598111009423, 'constant_value': 67716.01630369789, 'nu': 0.5}. Best is trial 149 with value: 0.48830133927701114.
[I 2024-12-04 14:57:30,853] Trial 291 finished with value: 1.2401112325935029 and parameters: {'kernel_type': 'Matern', 'length_scale': 0.0030638822862519392, 'noise_level': 0.3073375230652738, 'constant_value': 0.10213171939377168, 'nu': 0.5}. Best is trial 149 with value: 0.48830133927701114.
[I 2024-12-04 14:57:30,951] Trial 285 finished with value: 0.4883032679284808 and parameters: {'kernel_type': 'Matern', 'length_scale': 4.4042070476252055, 'noise_level': 0.0955036010721002, 'constant_value': 14287.46270713864, 'nu': 0.5}. Best is trial 149 with value: 0.48830133927701114.
[I 2024-12-04 14:57:31,619] Trial 284 finished with value: 0.48830342104689023 and parameters: {'kernel_type': 'Matern', 'length_scale': 12.558406277543865, 'noise_level': 0.0007151311053929498, 'constant_value': 0.4484639207025913, 'nu': 0.5}. Best is trial 149 with value: 0.48830133927701114.
[I 2024-12-04 14:57:32,487] Trial 293 finished with value: 0.6443853798618621 and parameters: {'kernel_type': 'RBF', 'length_scale': 0.5212488583755692, 'noise_level': 0.0004013651598797844, 'constant_value': 23.547608053258493, 'nu': 1.5}. Best is trial 149 with value: 0.48830133927701114.
[I 2024-12-04 14:57:32,500] Trial 287 finished with value: 0.488303388495512 and parameters: {'kernel_type': 'Matern', 'length_scale': 10.59016564676563, 'noise_level': 0.24866490524322182, 'constant_value': 1779.1052142584724, 'nu': 0.5}. Best is trial 149 with value: 0.48830133927701114.
[I 2024-12-04 14:57:32,530] Trial 296 finished with value: 0.48831723423052925 and parameters: {'kernel_type': 'Matern', 'length_scale': 87.05922642892763, 'noise_level': 0.7909092113813784, 'constant_value': 176.1582653283797, 'nu': 0.5}. Best is trial 149 with value: 0.48830133927701114.
[I 2024-12-04 14:57:32,535] Trial 290 finished with value: 0.4883032896217648 and parameters: {'kernel_type': 'Matern', 'length_scale': 97336.70557475636, 'noise_level': 0.021092184143665343, 'constant_value': 88244.27358868788, 'nu': 0.5}. Best is trial 149 with value: 0.48830133927701114.
[I 2024-12-04 14:57:33,126] Trial 288 finished with value: 1.2401112325786747 and parameters: {'kernel_type': 'Matern', 'length_scale': 0.012967667478395738, 'noise_level': 0.00030207931138945303, 'constant_value': 3.606831157438616, 'nu': 0.5}. Best is trial 149 with value: 0.48830133927701114.
[I 2024-12-04 14:57:33,829] Trial 299 finished with value: 0.56639370550691 and parameters: {'kernel_type': 'Matern', 'length_scale': 0.28637401620863845, 'noise_level': 0.24432453568398985, 'constant_value': 0.25516533405272246, 'nu': 2.5}. Best is trial 149 with value: 0.48830133927701114.
[I 2024-12-04 14:57:34,061] Trial 295 finished with value: 0.48830341855042925 and parameters: {'kernel_type': 'Matern', 'length_scale': 7598.640980396169, 'noise_level': 0.005888577583649063, 'constant_value': 968.5864180414321, 'nu': 0.5}. Best is trial 149 with value: 0.48830133927701114.
[I 2024-12-04 14:57:35,700] Trial 297 finished with value: 0.6443851352256522 and parameters: {'kernel_type': 'RBF', 'length_scale': 4285.73540320691, 'noise_level': 0.08116300559136111, 'constant_value': 451.62565319569853, 'nu': 0.5}. Best is trial 149 with value: 0.48830133927701114.
[I 2024-12-04 14:57:36,504] Trial 282 finished with value: 0.4883034089691042 and parameters: {'kernel_type': 'Matern', 'length_scale': 0.258509278899135, 'noise_level': 0.5297634692061763, 'constant_value': 0.09708517982133974, 'nu': 0.5}. Best is trial 149 with value: 0.48830133927701114.
[I 2024-12-04 14:57:36,898] Trial 292 finished with value: 0.4883034908222887 and parameters: {'kernel_type': 'Matern', 'length_scale': 2.598945149185719, 'noise_level': 0.6174588766928866, 'constant_value': 0.016605137459501505, 'nu': 0.5}. Best is trial 149 with value: 0.48830133927701114.
