[I 2024-12-04 00:08:22,129] Trial 511 finished with value: 0.20387441426968264 and parameters: {'kernel': 'rbf', 'C': 14.11643327094861, 'gamma': 0.010298316947095982, 'epsilon': 0.0030746547645861804}. Best is trial 448 with value: 0.13989258940934515.
[I 2024-12-04 00:08:22,401] Trial 512 finished with value: 0.1527509280152957 and parameters: {'kernel': 'rbf', 'C': 19.132490037194405, 'gamma': 0.017108412900335636, 'epsilon': 0.0028235264230690384}. Best is trial 448 with value: 0.13989258940934515.
[I 2024-12-04 00:08:22,453] Trial 506 finished with value: 0.15877344228615028 and parameters: {'kernel': 'rbf', 'C': 95.26514506142334, 'gamma': 0.013665196511929108, 'epsilon': 0.0026970135811399698}. Best is trial 448 with value: 0.13989258940934515.
[I 2024-12-04 00:08:22,994] Trial 509 finished with value: 0.6079415753213839 and parameters: {'kernel': 'poly', 'C': 61.26941943806203, 'gamma': 0.007496149600686097, 'epsilon': 0.003305082932929154}. Best is trial 448 with value: 0.13989258940934515.
[I 2024-12-04 00:08:22,994] Trial 513 finished with value: 0.2556077330340946 and parameters: {'kernel': 'rbf', 'C': 8.24622800028905, 'gamma': 0.007635485287188655, 'epsilon': 0.0028347075368191474}. Best is trial 448 with value: 0.13989258940934515.
[I 2024-12-04 00:08:23,428] Trial 516 finished with value: 0.5581643750532352 and parameters: {'kernel': 'rbf', 'C': 0.263723899117584, 'gamma': 0.0030667805712589567, 'epsilon': 0.01707042194535387}. Best is trial 448 with value: 0.13989258940934515.
[I 2024-12-04 00:08:24,161] Trial 514 finished with value: 0.28416874472507925 and parameters: {'kernel': 'rbf', 'C': 55.36614647773297, 'gamma': 0.0007579378785794418, 'epsilon': 0.0011044437198151364}. Best is trial 448 with value: 0.13989258940934515.
[I 2024-12-04 00:08:24,847] Trial 517 finished with value: 0.2180798047812603 and parameters: {'kernel': 'rbf', 'C': 21.28508635984622, 'gamma': 0.006407551276518628, 'epsilon': 0.003883052186739476}. Best is trial 448 with value: 0.13989258940934515.
[I 2024-12-04 00:08:24,947] Trial 502 finished with value: 0.18231727065114828 and parameters: {'kernel': 'rbf', 'C': 94.6077224212558, 'gamma': 0.029196443452586714, 'epsilon': 0.003801637591680168}. Best is trial 448 with value: 0.13989258940934515.
[I 2024-12-04 00:08:26,242] Trial 520 finished with value: 4.557305036102306 and parameters: {'kernel': 'sigmoid', 'C': 0.1995738317116828, 'gamma': 0.03225665037481355, 'epsilon': 0.0021274054214315457}. Best is trial 448 with value: 0.13989258940934515.
[I 2024-12-04 00:08:26,647] Trial 515 finished with value: 0.15944103323135153 and parameters: {'kernel': 'rbf', 'C': 88.70681747524524, 'gamma': 0.014040087940328277, 'epsilon': 0.0011743209350045406}. Best is trial 448 with value: 0.13989258940934515.
[I 2024-12-04 00:08:26,915] Trial 521 finished with value: 0.43211090194658086 and parameters: {'kernel': 'linear', 'C': 0.026336539279131474, 'gamma': 0.007598184719923162, 'epsilon': 0.0032190074715875493}. Best is trial 448 with value: 0.13989258940934515.
[I 2024-12-04 00:08:27,190] Trial 519 finished with value: 0.2024940030123068 and parameters: {'kernel': 'rbf', 'C': 91.81423671955832, 'gamma': 0.002408654246427203, 'epsilon': 0.0030403041234236443}. Best is trial 448 with value: 0.13989258940934515.
[I 2024-12-04 00:08:27,290] Trial 522 finished with value: 0.25531597963054786 and parameters: {'kernel': 'rbf', 'C': 99.47934045168752, 'gamma': 0.0007701231896101227, 'epsilon': 0.004360167763518817}. Best is trial 448 with value: 0.13989258940934515.
[I 2024-12-04 00:08:27,522] Trial 524 finished with value: 0.9978922378234589 and parameters: {'kernel': 'sigmoid', 'C': 0.0018371677961614718, 'gamma': 0.00012357591433269076, 'epsilon': 0.006068736228950917}. Best is trial 448 with value: 0.13989258940934515.
[I 2024-12-04 00:08:28,114] Trial 526 finished with value: 0.2696294676033935 and parameters: {'kernel': 'rbf', 'C': 10.341701803641469, 'gamma': 0.0044713300392525265, 'epsilon': 0.0013777976993151124}. Best is trial 448 with value: 0.13989258940934515.
[I 2024-12-04 00:08:28,587] Trial 518 finished with value: 0.15951436293186044 and parameters: {'kernel': 'rbf', 'C': 86.99652195800692, 'gamma': 0.01453773689288854, 'epsilon': 0.003143668452395053}. Best is trial 448 with value: 0.13989258940934515.
[I 2024-12-04 00:08:29,749] Trial 529 finished with value: 0.2110846874350457 and parameters: {'kernel': 'rbf', 'C': 22.965445214517132, 'gamma': 0.00652667152751357, 'epsilon': 0.0028235379133917282}. Best is trial 448 with value: 0.13989258940934515.
[I 2024-12-04 00:08:30,421] Trial 527 finished with value: 0.1625423493290306 and parameters: {'kernel': 'rbf', 'C': 88.80994461177684, 'gamma': 0.004328744475989634, 'epsilon': 0.0022917613926519875}. Best is trial 448 with value: 0.13989258940934515.
[I 2024-12-04 00:08:30,904] Trial 530 finished with value: 0.21264811711105736 and parameters: {'kernel': 'rbf', 'C': 87.42635396508577, 'gamma': 0.0021498318074952374, 'epsilon': 0.0012625268168519736}. Best is trial 448 with value: 0.13989258940934515.
[I 2024-12-04 00:08:31,083] Trial 523 finished with value: 0.15847701254169422 and parameters: {'kernel': 'rbf', 'C': 92.84583677165281, 'gamma': 0.01376797369305229, 'epsilon': 0.0031463819864054384}. Best is trial 448 with value: 0.13989258940934515.
[I 2024-12-04 00:08:31,133] Trial 534 finished with value: 0.32721062912341853 and parameters: {'kernel': 'linear', 'C': 0.4940683662914235, 'gamma': 0.00025686947400410377, 'epsilon': 0.33538168390323325}. Best is trial 448 with value: 0.13989258940934515.
[I 2024-12-04 00:08:32,163] Trial 533 finished with value: 0.15932307701543238 and parameters: {'kernel': 'rbf', 'C': 11.494502313373173, 'gamma': 0.02606266052404719, 'epsilon': 0.001001204541754525}. Best is trial 448 with value: 0.13989258940934515.
[I 2024-12-04 00:08:32,191] Trial 525 finished with value: 0.15361271215205385 and parameters: {'kernel': 'rbf', 'C': 96.39072790956445, 'gamma': 0.012374261199653996, 'epsilon': 0.005157134795693248}. Best is trial 448 with value: 0.13989258940934515.
[I 2024-12-04 00:08:32,232] Trial 532 finished with value: 0.15421888400213993 and parameters: {'kernel': 'rbf', 'C': 18.027445335562994, 'gamma': 0.017575110742627808, 'epsilon': 0.0011626410374102332}. Best is trial 448 with value: 0.13989258940934515.
[I 2024-12-04 00:08:32,444] Trial 531 finished with value: 0.1536740078797975 and parameters: {'kernel': 'rbf', 'C': 67.77309017256981, 'gamma': 0.006161674243384337, 'epsilon': 0.005175468593111177}. Best is trial 448 with value: 0.13989258940934515.
[I 2024-12-04 00:08:32,663] Trial 536 finished with value: 672.0319215106241 and parameters: {'kernel': 'sigmoid', 'C': 77.0172216149386, 'gamma': 0.006173963615511779, 'epsilon': 0.005840662406761589}. Best is trial 448 with value: 0.13989258940934515.
[I 2024-12-04 00:08:33,180] Trial 537 finished with value: 0.6548108623837956 and parameters: {'kernel': 'rbf', 'C': 0.19235384853837031, 'gamma': 0.3653163103770978, 'epsilon': 0.001035397278990398}. Best is trial 448 with value: 0.13989258940934515.
[I 2024-12-04 00:08:33,554] Trial 535 finished with value: 0.1665644219550525 and parameters: {'kernel': 'rbf', 'C': 81.82095689497325, 'gamma': 0.004280406392649733, 'epsilon': 0.004149701212500352}. Best is trial 448 with value: 0.13989258940934515.
[I 2024-12-04 00:08:35,145] Trial 538 finished with value: 0.15572572205872845 and parameters: {'kernel': 'rbf', 'C': 85.17770291120561, 'gamma': 0.005135666475774172, 'epsilon': 0.0011002991027343977}. Best is trial 448 with value: 0.13989258940934515.
[I 2024-12-04 00:08:35,375] Trial 528 finished with value: 0.16995817054258724 and parameters: {'kernel': 'rbf', 'C': 91.64540446142294, 'gamma': 0.017875423887452977, 'epsilon': 0.001043119789069889}. Best is trial 448 with value: 0.13989258940934515.
[I 2024-12-04 00:08:35,919] Trial 541 finished with value: 0.22769389855221286 and parameters: {'kernel': 'rbf', 'C': 14.187667949978213, 'gamma': 0.007794823249322382, 'epsilon': 0.00419749888689744}. Best is trial 448 with value: 0.13989258940934515.
[I 2024-12-04 00:08:36,178] Trial 540 finished with value: 0.27647898021239503 and parameters: {'kernel': 'rbf', 'C': 13.57672149482741, 'gamma': 0.002893583574342625, 'epsilon': 0.004271679767355728}. Best is trial 448 with value: 0.13989258940934515.
[I 2024-12-04 00:08:36,659] Trial 544 finished with value: 0.29013623359723417 and parameters: {'kernel': 'rbf', 'C': 13.123696819967542, 'gamma': 0.0023572820308101114, 'epsilon': 0.0010047411287519904}. Best is trial 448 with value: 0.13989258940934515.
[I 2024-12-04 00:08:37,181] Trial 539 finished with value: 0.14009938868715754 and parameters: {'kernel': 'rbf', 'C': 94.52702973648094, 'gamma': 0.008775017784588068, 'epsilon': 0.0010318049055388586}. Best is trial 448 with value: 0.13989258940934515.
[I 2024-12-04 00:08:37,648] Trial 543 finished with value: 0.2872644380211225 and parameters: {'kernel': 'rbf', 'C': 26.292992175798698, 'gamma': 0.1607331550787726, 'epsilon': 0.004708719291955885}. Best is trial 448 with value: 0.13989258940934515.
[I 2024-12-04 00:08:38,776] Trial 546 finished with value: 0.14829302203483313 and parameters: {'kernel': 'rbf', 'C': 28.682800093740884, 'gamma': 0.020263167875684603, 'epsilon': 0.005255634637628554}. Best is trial 448 with value: 0.13989258940934515.
[I 2024-12-04 00:08:39,645] Trial 549 finished with value: 0.17573810448797567 and parameters: {'kernel': 'rbf', 'C': 20.69068934881237, 'gamma': 0.01068395245138354, 'epsilon': 0.003543757421564781}. Best is trial 448 with value: 0.13989258940934515.
[I 2024-12-04 00:08:40,146] Trial 552 finished with value: 0.9634872511788963 and parameters: {'kernel': 'poly', 'C': 0.2043955124841642, 'gamma': 0.0013590314137398836, 'epsilon': 0.0771247480253575}. Best is trial 448 with value: 0.13989258940934515.
[I 2024-12-04 00:08:40,358] Trial 542 finished with value: 0.1613623462111374 and parameters: {'kernel': 'rbf', 'C': 97.90754769448125, 'gamma': 0.013941413720826759, 'epsilon': 0.0010868811474693551}. Best is trial 448 with value: 0.13989258940934515.
[I 2024-12-04 00:08:40,928] Trial 553 finished with value: 0.26952945387503646 and parameters: {'kernel': 'rbf', 'C': 14.411362155255512, 'gamma': 0.003335446050947876, 'epsilon': 0.0011996684181033535}. Best is trial 448 with value: 0.13989258940934515.
[I 2024-12-04 00:08:41,165] Trial 551 finished with value: 0.18661984800487572 and parameters: {'kernel': 'rbf', 'C': 76.25769949389844, 'gamma': 0.0034578777675487826, 'epsilon': 0.0012288806439693693}. Best is trial 448 with value: 0.13989258940934515.
[I 2024-12-04 00:08:43,340] Trial 548 finished with value: 0.18078207659422124 and parameters: {'kernel': 'rbf', 'C': 91.79084410605122, 'gamma': 0.028450526137508807, 'epsilon': 0.005857807553400313}. Best is trial 448 with value: 0.13989258940934515.
[I 2024-12-04 00:08:45,575] Trial 547 finished with value: 0.2037125334710872 and parameters: {'kernel': 'rbf', 'C': 91.49202480043701, 'gamma': 0.04740922286679841, 'epsilon': 0.0038127740091738285}. Best is trial 448 with value: 0.13989258940934515.
[I 2024-12-04 00:08:47,322] Trial 557 finished with value: 0.14832945287494304 and parameters: {'kernel': 'rbf', 'C': 58.580237746178284, 'gamma': 0.013608005264296098, 'epsilon': 0.0010451424172900675}. Best is trial 448 with value: 0.13989258940934515.
[I 2024-12-04 00:08:47,380] Trial 555 finished with value: 0.14167074694015483 and parameters: {'kernel': 'rbf', 'C': 94.66899528975871, 'gamma': 0.010277226587332386, 'epsilon': 0.002000533917099139}. Best is trial 448 with value: 0.13989258940934515.
[I 2024-12-04 00:08:47,784] Trial 556 finished with value: 0.1403041358143084 and parameters: {'kernel': 'rbf', 'C': 94.63814816510283, 'gamma': 0.008668754692312304, 'epsilon': 0.0015806555072492385}. Best is trial 448 with value: 0.13989258940934515.
[I 2024-12-04 00:08:48,726] Trial 560 finished with value: 0.14537002975738428 and parameters: {'kernel': 'rbf', 'C': 52.986395591571785, 'gamma': 0.008630068490456994, 'epsilon': 0.0010479580221511118}. Best is trial 448 with value: 0.13989258940934515.
[I 2024-12-04 00:08:48,986] Trial 561 finished with value: 0.2317856007784772 and parameters: {'kernel': 'rbf', 'C': 91.63368633301593, 'gamma': 0.0013775694650621246, 'epsilon': 0.00550389036709749}. Best is trial 448 with value: 0.13989258940934515.
[I 2024-12-04 00:08:49,616] Trial 559 finished with value: 0.15087879500868007 and parameters: {'kernel': 'rbf', 'C': 87.6683780600118, 'gamma': 0.01232540941288555, 'epsilon': 0.0031909179411054537}. Best is trial 448 with value: 0.13989258940934515.
[I 2024-12-04 00:08:50,872] Trial 500 finished with value: 0.32238541512801394 and parameters: {'kernel': 'linear', 'C': 20.24916690042466, 'gamma': 0.0009346115002565255, 'epsilon': 0.25996809474353566}. Best is trial 448 with value: 0.13989258940934515.
[I 2024-12-04 00:08:50,981] Trial 564 finished with value: 0.21874895782450454 and parameters: {'kernel': 'rbf', 'C': 9.516271340770045, 'gamma': 0.011962844121129286, 'epsilon': 0.0010558973748917898}. Best is trial 448 with value: 0.13989258940934515.
[I 2024-12-04 00:08:53,991] Trial 568 finished with value: 0.677281242977733 and parameters: {'kernel': 'poly', 'C': 97.88671953507523, 'gamma': 0.004435405874232327, 'epsilon': 0.0017380358197753812}. Best is trial 448 with value: 0.13989258940934515.
[I 2024-12-04 00:08:54,059] Trial 562 finished with value: 0.1693181808950481 and parameters: {'kernel': 'rbf', 'C': 87.26734896358715, 'gamma': 0.01945404167380257, 'epsilon': 0.002683697260099842}. Best is trial 448 with value: 0.13989258940934515.
[I 2024-12-04 00:08:54,188] Trial 569 finished with value: 0.1943415314870844 and parameters: {'kernel': 'rbf', 'C': 21.965215728897814, 'gamma': 0.008135329075460974, 'epsilon': 0.0010135349652042043}. Best is trial 448 with value: 0.13989258940934515.
[I 2024-12-04 00:08:54,369] Trial 567 finished with value: 0.17658336024435195 and parameters: {'kernel': 'rbf', 'C': 87.11930181681042, 'gamma': 0.0035927616933423326, 'epsilon': 0.002783917687774471}. Best is trial 448 with value: 0.13989258940934515.
[I 2024-12-04 00:08:54,654] Trial 563 finished with value: 0.18234003573387625 and parameters: {'kernel': 'rbf', 'C': 84.83505209339457, 'gamma': 0.029468197704920894, 'epsilon': 0.002130717718745486}. Best is trial 448 with value: 0.13989258940934515.
[I 2024-12-04 00:08:56,286] Trial 570 finished with value: 0.4929102378246337 and parameters: {'kernel': 'rbf', 'C': 0.28132413914023807, 'gamma': 0.16143659828562534, 'epsilon': 0.13342445827307442}. Best is trial 448 with value: 0.13989258940934515.
[I 2024-12-04 00:08:56,560] Trial 565 finished with value: 0.162417307276019 and parameters: {'kernel': 'rbf', 'C': 98.3189250109154, 'gamma': 0.014256208995745675, 'epsilon': 0.0020245608100437494}. Best is trial 448 with value: 0.13989258940934515.
[I 2024-12-04 00:08:57,839] Trial 575 finished with value: 0.9868799205070972 and parameters: {'kernel': 'poly', 'C': 7.419930614478099, 'gamma': 0.00011867320330224225, 'epsilon': 0.0014867827340080675}. Best is trial 448 with value: 0.13989258940934515.
[I 2024-12-04 00:08:58,605] Trial 566 finished with value: 0.21364696112737525 and parameters: {'kernel': 'rbf', 'C': 95.85272611196471, 'gamma': 0.0597040222621004, 'epsilon': 0.0011808244462234141}. Best is trial 448 with value: 0.13989258940934515.
[I 2024-12-04 00:08:59,513] Trial 571 finished with value: 0.14353939832698728 and parameters: {'kernel': 'rbf', 'C': 87.61398732512362, 'gamma': 0.0067680684678927605, 'epsilon': 0.0011850286513967543}. Best is trial 448 with value: 0.13989258940934515.
[I 2024-12-04 00:08:59,705] Trial 572 finished with value: 0.14062068207712178 and parameters: {'kernel': 'rbf', 'C': 94.19107283013142, 'gamma': 0.007354888464063141, 'epsilon': 0.0021298896409113837}. Best is trial 448 with value: 0.13989258940934515.
[I 2024-12-04 00:08:59,846] Trial 578 finished with value: 0.596547549387109 and parameters: {'kernel': 'rbf', 'C': 2.433007230264108, 'gamma': 0.0003887473801578657, 'epsilon': 0.5635602892829693}. Best is trial 448 with value: 0.13989258940934515.
[I 2024-12-04 00:09:00,964] Trial 573 finished with value: 0.1490839852505414 and parameters: {'kernel': 'rbf', 'C': 95.6815094676051, 'gamma': 0.011601404675347204, 'epsilon': 0.0032278504983656183}. Best is trial 448 with value: 0.13989258940934515.
[I 2024-12-04 00:09:02,544] Trial 580 finished with value: 0.17020687267919668 and parameters: {'kernel': 'rbf', 'C': 8.1533317473191, 'gamma': 0.032039713042936915, 'epsilon': 0.00230329411296872}. Best is trial 448 with value: 0.13989258940934515.
[I 2024-12-04 00:09:02,589] Trial 579 finished with value: 0.16052088810871132 and parameters: {'kernel': 'rbf', 'C': 11.912276294870708, 'gamma': 0.031095727456404366, 'epsilon': 0.003779344804405269}. Best is trial 448 with value: 0.13989258940934515.
[I 2024-12-04 00:09:02,857] Trial 581 finished with value: 0.21900531884640623 and parameters: {'kernel': 'rbf', 'C': 83.84079535987634, 'gamma': 0.00197643470366635, 'epsilon': 0.0023528975204924088}. Best is trial 448 with value: 0.13989258940934515.
[I 2024-12-04 00:09:04,982] Trial 583 finished with value: 0.9053569256281125 and parameters: {'kernel': 'rbf', 'C': 0.002989674985873879, 'gamma': 0.023899521737268777, 'epsilon': 0.04212228356262367}. Best is trial 448 with value: 0.13989258940934515.
[I 2024-12-04 00:09:07,726] Trial 586 finished with value: 0.2672995911885851 and parameters: {'kernel': 'rbf', 'C': 92.89039955945466, 'gamma': 0.0006417119696457828, 'epsilon': 0.0012701723194624079}. Best is trial 448 with value: 0.13989258940934515.
[I 2024-12-04 00:09:08,605] Trial 585 finished with value: 0.14543271387215964 and parameters: {'kernel': 'rbf', 'C': 94.90584803807315, 'gamma': 0.006192501060597277, 'epsilon': 0.0019185729503475727}. Best is trial 448 with value: 0.13989258940934515.
[I 2024-12-04 00:09:08,684] Trial 584 finished with value: 0.14270693593416603 and parameters: {'kernel': 'rbf', 'C': 71.93658934031632, 'gamma': 0.010056291262071488, 'epsilon': 0.0010035599452838159}. Best is trial 448 with value: 0.13989258940934515.
[I 2024-12-04 00:09:12,083] Trial 587 finished with value: 0.15795566608691497 and parameters: {'kernel': 'rbf', 'C': 88.00020671946633, 'gamma': 0.004785866543975651, 'epsilon': 0.002671107260965469}. Best is trial 448 with value: 0.13989258940934515.
[I 2024-12-04 00:09:12,910] Trial 589 finished with value: 0.19077228348127062 and parameters: {'kernel': 'rbf', 'C': 26.83289893898426, 'gamma': 0.007312226707169819, 'epsilon': 0.0010974209619691927}. Best is trial 448 with value: 0.13989258940934515.
[I 2024-12-04 00:09:13,089] Trial 588 finished with value: 0.15606928914806462 and parameters: {'kernel': 'rbf', 'C': 13.19270648925721, 'gamma': 0.023746691042367183, 'epsilon': 0.0010598062810150699}. Best is trial 448 with value: 0.13989258940934515.
[I 2024-12-04 00:09:15,411] Trial 591 finished with value: 0.26784521131788686 and parameters: {'kernel': 'rbf', 'C': 9.886448601536964, 'gamma': 0.004825060070436835, 'epsilon': 0.0031922463641096124}. Best is trial 448 with value: 0.13989258940934515.
[I 2024-12-04 00:09:18,936] Trial 590 finished with value: 0.14580597234095266 and parameters: {'kernel': 'rbf', 'C': 94.69017283239194, 'gamma': 0.011098657136456972, 'epsilon': 0.0021748029701205056}. Best is trial 448 with value: 0.13989258940934515.
[I 2024-12-04 00:09:19,839] Trial 592 finished with value: 0.14256434063707696 and parameters: {'kernel': 'rbf', 'C': 89.69808982611724, 'gamma': 0.010343735485216254, 'epsilon': 0.0010587306807068356}. Best is trial 448 with value: 0.13989258940934515.
[I 2024-12-04 00:09:21,016] Trial 594 finished with value: 0.46591155743882307 and parameters: {'kernel': 'linear', 'C': 0.016320038129197346, 'gamma': 0.06419343842930787, 'epsilon': 0.0011521142204666793}. Best is trial 448 with value: 0.13989258940934515.
[I 2024-12-04 00:09:21,551] Trial 476 finished with value: 0.3527904837007613 and parameters: {'kernel': 'linear', 'C': 17.5329704357512, 'gamma': 0.032886266598721126, 'epsilon': 0.0016955823482126282}. Best is trial 448 with value: 0.13989258940934515.
[I 2024-12-04 00:09:22,006] Trial 595 finished with value: 69.96752793063327 and parameters: {'kernel': 'sigmoid', 'C': 17.927546559949143, 'gamma': 0.0031677953413509516, 'epsilon': 0.0010017563906532748}. Best is trial 448 with value: 0.13989258940934515.
[I 2024-12-04 00:09:23,566] Trial 593 finished with value: 0.18370222973712236 and parameters: {'kernel': 'rbf', 'C': 72.45463069946229, 'gamma': 0.031647242597041984, 'epsilon': 0.001029577912294253}. Best is trial 448 with value: 0.13989258940934515.
[I 2024-12-04 00:09:24,322] Trial 596 finished with value: 0.1979619521929833 and parameters: {'kernel': 'rbf', 'C': 92.46072634412053, 'gamma': 0.002616476550986355, 'epsilon': 0.0013276876752902791}. Best is trial 448 with value: 0.13989258940934515.
[I 2024-12-04 00:09:25,413] Trial 599 finished with value: 0.9514557337140209 and parameters: {'kernel': 'rbf', 'C': 0.055696826956751835, 'gamma': 0.00013434356429416067, 'epsilon': 0.05659185957135105}. Best is trial 448 with value: 0.13989258940934515.
[I 2024-12-04 00:09:26,661] Trial 600 finished with value: 0.24858376983858507 and parameters: {'kernel': 'rbf', 'C': 9.557212703620277, 'gamma': 0.007824962036171949, 'epsilon': 0.001482409470538443}. Best is trial 448 with value: 0.13989258940934515.
[I 2024-12-04 00:09:28,264] Trial 598 finished with value: 0.16184835798873506 and parameters: {'kernel': 'rbf', 'C': 65.87106603248743, 'gamma': 0.017743534887856918, 'epsilon': 0.001047480517537923}. Best is trial 448 with value: 0.13989258940934515.
