[I 2024-12-04 12:20:03,519] Trial 208 finished with value: 0.2833700189860024 and parameters: {'n_estimators': 893, 'learning_rate': 0.019543536698457157, 'max_depth': 10, 'min_samples_split': 2, 'min_samples_leaf': 1, 'subsample': 0.6638808747374436, 'max_features': 'sqrt'}. Best is trial 16 with value: 0.24131607807430555.
[I 2024-12-04 12:20:07,307] Trial 196 finished with value: 0.3563068080707892 and parameters: {'n_estimators': 1382, 'learning_rate': 0.029095597011377258, 'max_depth': 9, 'min_samples_split': 4, 'min_samples_leaf': 3, 'subsample': 0.9935781258723322, 'max_features': 'sqrt'}. Best is trial 16 with value: 0.24131607807430555.
[I 2024-12-04 12:20:07,337] Trial 198 finished with value: 0.28564193730759646 and parameters: {'n_estimators': 1288, 'learning_rate': 0.03192946445850385, 'max_depth': 12, 'min_samples_split': 16, 'min_samples_leaf': 2, 'subsample': 0.6634402507815469, 'max_features': 'sqrt'}. Best is trial 16 with value: 0.24131607807430555.
[I 2024-12-04 12:20:08,282] Trial 215 finished with value: 0.3290512438526892 and parameters: {'n_estimators': 718, 'learning_rate': 0.053270377914929716, 'max_depth': 4, 'min_samples_split': 3, 'min_samples_leaf': 1, 'subsample': 0.6722709548325231, 'max_features': None}. Best is trial 16 with value: 0.24131607807430555.
[I 2024-12-04 12:20:11,173] Trial 202 finished with value: 0.3400004647895673 and parameters: {'n_estimators': 1280, 'learning_rate': 0.01793069263169859, 'max_depth': 5, 'min_samples_split': 3, 'min_samples_leaf': 1, 'subsample': 0.9198580045154293, 'max_features': 'sqrt'}. Best is trial 16 with value: 0.24131607807430555.
[I 2024-12-04 12:20:11,976] Trial 199 finished with value: 0.29202779057363415 and parameters: {'n_estimators': 1331, 'learning_rate': 0.019561253241182738, 'max_depth': 12, 'min_samples_split': 2, 'min_samples_leaf': 2, 'subsample': 0.8101850292621487, 'max_features': 'sqrt'}. Best is trial 16 with value: 0.24131607807430555.
[I 2024-12-04 12:20:13,128] Trial 218 finished with value: 0.33423085253268214 and parameters: {'n_estimators': 669, 'learning_rate': 0.03255720913858949, 'max_depth': 11, 'min_samples_split': 10, 'min_samples_leaf': 1, 'subsample': 0.6996241466575915, 'max_features': None}. Best is trial 16 with value: 0.24131607807430555.
[I 2024-12-04 12:20:15,140] Trial 205 finished with value: 0.2913084849058426 and parameters: {'n_estimators': 1251, 'learning_rate': 0.05174592514675545, 'max_depth': 12, 'min_samples_split': 9, 'min_samples_leaf': 1, 'subsample': 0.9336226809413308, 'max_features': 'sqrt'}. Best is trial 16 with value: 0.24131607807430555.
[I 2024-12-04 12:20:16,521] Trial 210 finished with value: 0.2697765833519332 and parameters: {'n_estimators': 1113, 'learning_rate': 0.023043157331071804, 'max_depth': 8, 'min_samples_split': 2, 'min_samples_leaf': 1, 'subsample': 0.8668232377840469, 'max_features': 'sqrt'}. Best is trial 16 with value: 0.24131607807430555.
[I 2024-12-04 12:20:17,848] Trial 207 finished with value: 0.27769518818462563 and parameters: {'n_estimators': 1202, 'learning_rate': 0.012831654571413352, 'max_depth': 10, 'min_samples_split': 2, 'min_samples_leaf': 1, 'subsample': 0.8461069727044562, 'max_features': 'sqrt'}. Best is trial 16 with value: 0.24131607807430555.
[I 2024-12-04 12:20:17,914] Trial 216 finished with value: 0.2710379987387035 and parameters: {'n_estimators': 882, 'learning_rate': 0.03879685961536253, 'max_depth': 10, 'min_samples_split': 5, 'min_samples_leaf': 1, 'subsample': 0.9048580940997766, 'max_features': 'sqrt'}. Best is trial 16 with value: 0.24131607807430555.
[I 2024-12-04 12:20:18,174] Trial 204 finished with value: 0.2673293058109563 and parameters: {'n_estimators': 1325, 'learning_rate': 0.037338592506368354, 'max_depth': 10, 'min_samples_split': 15, 'min_samples_leaf': 1, 'subsample': 0.7033932523100116, 'max_features': 'sqrt'}. Best is trial 16 with value: 0.24131607807430555.
[I 2024-12-04 12:20:18,639] Trial 200 finished with value: 0.2939563851296767 and parameters: {'n_estimators': 1485, 'learning_rate': 0.05341531690877567, 'max_depth': 12, 'min_samples_split': 3, 'min_samples_leaf': 2, 'subsample': 0.8453433314474121, 'max_features': 'sqrt'}. Best is trial 16 with value: 0.24131607807430555.
[I 2024-12-04 12:20:18,646] Trial 219 finished with value: 0.29069661728256413 and parameters: {'n_estimators': 774, 'learning_rate': 0.08058339399010418, 'max_depth': 8, 'min_samples_split': 6, 'min_samples_leaf': 2, 'subsample': 0.6112594159218686, 'max_features': 'sqrt'}. Best is trial 16 with value: 0.24131607807430555.
[I 2024-12-04 12:20:26,208] Trial 212 finished with value: 0.23718385215198057 and parameters: {'n_estimators': 1179, 'learning_rate': 0.041734918225528994, 'max_depth': 7, 'min_samples_split': 4, 'min_samples_leaf': 1, 'subsample': 0.8340725370621036, 'max_features': 'sqrt'}. Best is trial 212 with value: 0.23718385215198057.
[I 2024-12-04 12:20:27,617] Trial 217 finished with value: 0.2417578917346158 and parameters: {'n_estimators': 1084, 'learning_rate': 0.031137050802266916, 'max_depth': 10, 'min_samples_split': 5, 'min_samples_leaf': 1, 'subsample': 0.9208059163277267, 'max_features': 'sqrt'}. Best is trial 212 with value: 0.23718385215198057.
[I 2024-12-04 12:20:27,667] Trial 203 finished with value: 0.33199373659852954 and parameters: {'n_estimators': 1470, 'learning_rate': 0.036573588243877915, 'max_depth': 9, 'min_samples_split': 12, 'min_samples_leaf': 2, 'subsample': 0.7002849045102961, 'max_features': None}. Best is trial 212 with value: 0.23718385215198057.
[I 2024-12-04 12:20:33,943] Trial 213 finished with value: 0.27569135135954237 and parameters: {'n_estimators': 1392, 'learning_rate': 0.03488888085143178, 'max_depth': 9, 'min_samples_split': 2, 'min_samples_leaf': 1, 'subsample': 0.9148564736445619, 'max_features': 'sqrt'}. Best is trial 212 with value: 0.23718385215198057.
[I 2024-12-04 12:20:33,983] Trial 243 finished with value: 0.7282586089381715 and parameters: {'n_estimators': 162, 'learning_rate': 0.0518193334672136, 'max_depth': 3, 'min_samples_split': 4, 'min_samples_leaf': 7, 'subsample': 0.6507874108344051, 'max_features': 'sqrt'}. Best is trial 212 with value: 0.23718385215198057.
[I 2024-12-04 12:20:37,382] Trial 227 finished with value: 0.353195346679522 and parameters: {'n_estimators': 908, 'learning_rate': 0.07845601473335376, 'max_depth': 6, 'min_samples_split': 10, 'min_samples_leaf': 3, 'subsample': 0.6428770608751153, 'max_features': 'sqrt'}. Best is trial 212 with value: 0.23718385215198057.
[I 2024-12-04 12:20:38,982] Trial 214 finished with value: 0.25459859507979354 and parameters: {'n_estimators': 1466, 'learning_rate': 0.027142873994481145, 'max_depth': 7, 'min_samples_split': 4, 'min_samples_leaf': 1, 'subsample': 0.9289511887703117, 'max_features': 'sqrt'}. Best is trial 212 with value: 0.23718385215198057.
[I 2024-12-04 12:20:43,433] Trial 223 finished with value: 0.27200840906026885 and parameters: {'n_estimators': 1107, 'learning_rate': 0.033237451833331065, 'max_depth': 7, 'min_samples_split': 9, 'min_samples_leaf': 1, 'subsample': 0.684161582522034, 'max_features': 'sqrt'}. Best is trial 212 with value: 0.23718385215198057.
[I 2024-12-04 12:20:46,754] Trial 220 finished with value: 0.24791166982151452 and parameters: {'n_estimators': 1347, 'learning_rate': 0.038522820361384685, 'max_depth': 12, 'min_samples_split': 4, 'min_samples_leaf': 1, 'subsample': 0.9339963288724212, 'max_features': 'sqrt'}. Best is trial 212 with value: 0.23718385215198057.
[I 2024-12-04 12:20:50,708] Trial 222 finished with value: 0.2571693457361993 and parameters: {'n_estimators': 1406, 'learning_rate': 0.03584579176832693, 'max_depth': 12, 'min_samples_split': 12, 'min_samples_leaf': 1, 'subsample': 0.9770976014416166, 'max_features': 'log2'}. Best is trial 212 with value: 0.23718385215198057.
[I 2024-12-04 12:20:51,114] Trial 221 finished with value: 0.4344392878357829 and parameters: {'n_estimators': 1443, 'learning_rate': 0.019980392492574908, 'max_depth': 11, 'min_samples_split': 9, 'min_samples_leaf': 3, 'subsample': 0.911595952063849, 'max_features': 'log2'}. Best is trial 212 with value: 0.23718385215198057.
[I 2024-12-04 12:20:54,757] Trial 226 finished with value: 0.26415296434810753 and parameters: {'n_estimators': 1336, 'learning_rate': 0.025429913431785356, 'max_depth': 11, 'min_samples_split': 7, 'min_samples_leaf': 1, 'subsample': 0.7290536458984538, 'max_features': 'sqrt'}. Best is trial 212 with value: 0.23718385215198057.
[I 2024-12-04 12:20:56,806] Trial 237 finished with value: 0.41749587112930275 and parameters: {'n_estimators': 805, 'learning_rate': 0.08069500367369274, 'max_depth': 12, 'min_samples_split': 4, 'min_samples_leaf': 3, 'subsample': 0.8346336662484155, 'max_features': None}. Best is trial 212 with value: 0.23718385215198057.
[I 2024-12-04 12:20:58,880] Trial 230 finished with value: 0.31742072398383214 and parameters: {'n_estimators': 1249, 'learning_rate': 0.011735737108973028, 'max_depth': 9, 'min_samples_split': 10, 'min_samples_leaf': 1, 'subsample': 0.7382471087219142, 'max_features': 'sqrt'}. Best is trial 212 with value: 0.23718385215198057.
[I 2024-12-04 12:21:00,222] Trial 231 finished with value: 0.34542572314574627 and parameters: {'n_estimators': 1262, 'learning_rate': 0.08698179288599112, 'max_depth': 12, 'min_samples_split': 11, 'min_samples_leaf': 3, 'subsample': 0.940583274555548, 'max_features': 'log2'}. Best is trial 212 with value: 0.23718385215198057.
[I 2024-12-04 12:21:01,502] Trial 224 finished with value: 0.2674110005743603 and parameters: {'n_estimators': 1491, 'learning_rate': 0.028232798058969437, 'max_depth': 8, 'min_samples_split': 7, 'min_samples_leaf': 1, 'subsample': 0.7292980384700078, 'max_features': 'sqrt'}. Best is trial 212 with value: 0.23718385215198057.
[I 2024-12-04 12:21:01,803] Trial 253 finished with value: 0.37541077130355294 and parameters: {'n_estimators': 408, 'learning_rate': 0.024028728964142626, 'max_depth': 11, 'min_samples_split': 2, 'min_samples_leaf': 1, 'subsample': 0.8240955258698544, 'max_features': None}. Best is trial 212 with value: 0.23718385215198057.
[I 2024-12-04 12:21:03,376] Trial 225 finished with value: 0.3505001736963822 and parameters: {'n_estimators': 1375, 'learning_rate': 0.021006999647510415, 'max_depth': 11, 'min_samples_split': 12, 'min_samples_leaf': 2, 'subsample': 0.9554835671355181, 'max_features': None}. Best is trial 212 with value: 0.23718385215198057.
[I 2024-12-04 12:21:03,548] Trial 229 finished with value: 0.31380718847611966 and parameters: {'n_estimators': 1329, 'learning_rate': 0.04641497993210321, 'max_depth': 4, 'min_samples_split': 2, 'min_samples_leaf': 1, 'subsample': 0.6887557273721716, 'max_features': None}. Best is trial 212 with value: 0.23718385215198057.
[I 2024-12-04 12:21:04,801] Trial 228 finished with value: 0.26211710911806363 and parameters: {'n_estimators': 1490, 'learning_rate': 0.03359770873032125, 'max_depth': 11, 'min_samples_split': 6, 'min_samples_leaf': 1, 'subsample': 0.9848737449188857, 'max_features': 'sqrt'}. Best is trial 212 with value: 0.23718385215198057.
[I 2024-12-04 12:21:09,815] Trial 236 finished with value: 0.26452071185863596 and parameters: {'n_estimators': 1167, 'learning_rate': 0.026377103865179847, 'max_depth': 12, 'min_samples_split': 3, 'min_samples_leaf': 1, 'subsample': 0.9801155127140034, 'max_features': 'sqrt'}. Best is trial 212 with value: 0.23718385215198057.
[I 2024-12-04 12:21:09,858] Trial 249 finished with value: 0.3072556313081911 and parameters: {'n_estimators': 771, 'learning_rate': 0.0548147355191916, 'max_depth': 4, 'min_samples_split': 13, 'min_samples_leaf': 1, 'subsample': 0.7055881631522782, 'max_features': 'sqrt'}. Best is trial 212 with value: 0.23718385215198057.
[I 2024-12-04 12:21:10,325] Trial 233 finished with value: 0.2944691807868033 and parameters: {'n_estimators': 1293, 'learning_rate': 0.01975937020513638, 'max_depth': 9, 'min_samples_split': 17, 'min_samples_leaf': 1, 'subsample': 0.8387308255894842, 'max_features': 'sqrt'}. Best is trial 212 with value: 0.23718385215198057.
[I 2024-12-04 12:21:11,066] Trial 244 finished with value: 0.2687739286795794 and parameters: {'n_estimators': 926, 'learning_rate': 0.04499623617966256, 'max_depth': 10, 'min_samples_split': 2, 'min_samples_leaf': 1, 'subsample': 0.8552882208488071, 'max_features': 'sqrt'}. Best is trial 212 with value: 0.23718385215198057.
[I 2024-12-04 12:21:11,711] Trial 234 finished with value: 0.24472175585932354 and parameters: {'n_estimators': 1298, 'learning_rate': 0.04196495923871179, 'max_depth': 8, 'min_samples_split': 6, 'min_samples_leaf': 1, 'subsample': 0.8720848861530361, 'max_features': 'sqrt'}. Best is trial 212 with value: 0.23718385215198057.
[I 2024-12-04 12:21:11,717] Trial 240 finished with value: 0.27677807054557246 and parameters: {'n_estimators': 1027, 'learning_rate': 0.046570496411866565, 'max_depth': 8, 'min_samples_split': 15, 'min_samples_leaf': 1, 'subsample': 0.7090727157007295, 'max_features': 'sqrt'}. Best is trial 212 with value: 0.23718385215198057.
[I 2024-12-04 12:21:11,814] Trial 232 finished with value: 0.2735779085285545 and parameters: {'n_estimators': 1420, 'learning_rate': 0.020359276719581012, 'max_depth': 12, 'min_samples_split': 13, 'min_samples_leaf': 1, 'subsample': 0.697491166689106, 'max_features': 'sqrt'}. Best is trial 212 with value: 0.23718385215198057.
[I 2024-12-04 12:21:14,938] Trial 235 finished with value: 0.3506694859767939 and parameters: {'n_estimators': 1169, 'learning_rate': 0.04642416144764554, 'max_depth': 12, 'min_samples_split': 12, 'min_samples_leaf': 1, 'subsample': 0.9297992272721312, 'max_features': None}. Best is trial 212 with value: 0.23718385215198057.
[I 2024-12-04 12:21:20,844] Trial 239 finished with value: 0.3194566356191594 and parameters: {'n_estimators': 1350, 'learning_rate': 0.031496571882023185, 'max_depth': 9, 'min_samples_split': 10, 'min_samples_leaf': 1, 'subsample': 0.9587448620477049, 'max_features': 'log2'}. Best is trial 212 with value: 0.23718385215198057.
[I 2024-12-04 12:21:23,865] Trial 238 finished with value: 0.28876455962539843 and parameters: {'n_estimators': 1459, 'learning_rate': 0.08740519920163582, 'max_depth': 6, 'min_samples_split': 5, 'min_samples_leaf': 2, 'subsample': 0.9167119784308004, 'max_features': 'sqrt'}. Best is trial 212 with value: 0.23718385215198057.
[I 2024-12-04 12:21:23,919] Trial 241 finished with value: 0.26235637213690993 and parameters: {'n_estimators': 1362, 'learning_rate': 0.09384422016316132, 'max_depth': 3, 'min_samples_split': 3, 'min_samples_leaf': 1, 'subsample': 0.637663487429198, 'max_features': 'sqrt'}. Best is trial 212 with value: 0.23718385215198057.
[I 2024-12-04 12:21:28,556] Trial 246 finished with value: 0.2797682339914126 and parameters: {'n_estimators': 1277, 'learning_rate': 0.02565781419439736, 'max_depth': 8, 'min_samples_split': 3, 'min_samples_leaf': 1, 'subsample': 0.8858816553732761, 'max_features': 'sqrt'}. Best is trial 212 with value: 0.23718385215198057.
[I 2024-12-04 12:21:30,442] Trial 257 finished with value: 1.058625691042885 and parameters: {'n_estimators': 791, 'learning_rate': 0.011056657601216323, 'max_depth': 9, 'min_samples_split': 15, 'min_samples_leaf': 9, 'subsample': 0.9463730240734243, 'max_features': 'log2'}. Best is trial 212 with value: 0.23718385215198057.
[I 2024-12-04 12:21:30,454] Trial 248 finished with value: 0.3669389972068982 and parameters: {'n_estimators': 1250, 'learning_rate': 0.03687962779241178, 'max_depth': 12, 'min_samples_split': 7, 'min_samples_leaf': 4, 'subsample': 0.9127452946710379, 'max_features': 'sqrt'}. Best is trial 212 with value: 0.23718385215198057.
[I 2024-12-04 12:21:32,013] Trial 251 finished with value: 0.2712942228193564 and parameters: {'n_estimators': 1145, 'learning_rate': 0.03672010269077832, 'max_depth': 12, 'min_samples_split': 9, 'min_samples_leaf': 1, 'subsample': 0.9622979443117996, 'max_features': 'sqrt'}. Best is trial 212 with value: 0.23718385215198057.
[I 2024-12-04 12:21:32,017] Trial 242 finished with value: 0.2672655584159116 and parameters: {'n_estimators': 1348, 'learning_rate': 0.03708759545972497, 'max_depth': 9, 'min_samples_split': 14, 'min_samples_leaf': 1, 'subsample': 0.7781521284388838, 'max_features': 'sqrt'}. Best is trial 212 with value: 0.23718385215198057.
[I 2024-12-04 12:21:32,257] Trial 247 finished with value: 0.24863893764543105 and parameters: {'n_estimators': 1297, 'learning_rate': 0.029018738737970697, 'max_depth': 7, 'min_samples_split': 2, 'min_samples_leaf': 1, 'subsample': 0.7969561309448531, 'max_features': 'sqrt'}. Best is trial 212 with value: 0.23718385215198057.
[I 2024-12-04 12:21:37,609] Trial 245 finished with value: 0.3570390944182992 and parameters: {'n_estimators': 1465, 'learning_rate': 0.024158524798918748, 'max_depth': 9, 'min_samples_split': 2, 'min_samples_leaf': 3, 'subsample': 0.8236370693289005, 'max_features': 'sqrt'}. Best is trial 212 with value: 0.23718385215198057.
[I 2024-12-04 12:21:42,710] Trial 254 finished with value: 0.25209173211916763 and parameters: {'n_estimators': 1271, 'learning_rate': 0.06285469138391934, 'max_depth': 8, 'min_samples_split': 3, 'min_samples_leaf': 1, 'subsample': 0.800383308176404, 'max_features': 'sqrt'}. Best is trial 212 with value: 0.23718385215198057.
[I 2024-12-04 12:21:44,340] Trial 259 finished with value: 0.26997463291572155 and parameters: {'n_estimators': 1023, 'learning_rate': 0.04733049067807591, 'max_depth': 11, 'min_samples_split': 11, 'min_samples_leaf': 1, 'subsample': 0.9481442300242114, 'max_features': 'log2'}. Best is trial 212 with value: 0.23718385215198057.
[I 2024-12-04 12:21:45,585] Trial 252 finished with value: 0.36700707661374443 and parameters: {'n_estimators': 1440, 'learning_rate': 0.014716637103546957, 'max_depth': 12, 'min_samples_split': 2, 'min_samples_leaf': 3, 'subsample': 0.9203714354343405, 'max_features': 'sqrt'}. Best is trial 212 with value: 0.23718385215198057.
[I 2024-12-04 12:21:45,645] Trial 250 finished with value: 0.28973550610668747 and parameters: {'n_estimators': 1487, 'learning_rate': 0.04460637773266941, 'max_depth': 8, 'min_samples_split': 5, 'min_samples_leaf': 2, 'subsample': 0.8254193405416089, 'max_features': 'sqrt'}. Best is trial 212 with value: 0.23718385215198057.
[I 2024-12-04 12:21:49,055] Trial 274 finished with value: 0.2909206768611309 and parameters: {'n_estimators': 567, 'learning_rate': 0.03981961863818266, 'max_depth': 11, 'min_samples_split': 13, 'min_samples_leaf': 1, 'subsample': 0.654748022587962, 'max_features': 'sqrt'}. Best is trial 212 with value: 0.23718385215198057.
[I 2024-12-04 12:21:51,688] Trial 256 finished with value: 0.27917880235460646 and parameters: {'n_estimators': 1320, 'learning_rate': 0.027672242678830415, 'max_depth': 12, 'min_samples_split': 14, 'min_samples_leaf': 1, 'subsample': 0.9933982189385788, 'max_features': 'log2'}. Best is trial 212 with value: 0.23718385215198057.
[I 2024-12-04 12:21:52,933] Trial 275 finished with value: 0.2690558975353518 and parameters: {'n_estimators': 628, 'learning_rate': 0.04078324884810676, 'max_depth': 12, 'min_samples_split': 11, 'min_samples_leaf': 1, 'subsample': 0.6362377457235063, 'max_features': 'sqrt'}. Best is trial 212 with value: 0.23718385215198057.
[I 2024-12-04 12:21:55,546] Trial 260 finished with value: 0.4932398375156278 and parameters: {'n_estimators': 1239, 'learning_rate': 0.03281627508091786, 'max_depth': 11, 'min_samples_split': 11, 'min_samples_leaf': 6, 'subsample': 0.9958192819752194, 'max_features': 'log2'}. Best is trial 212 with value: 0.23718385215198057.
[I 2024-12-04 12:21:55,627] Trial 255 finished with value: 0.4156919226146384 and parameters: {'n_estimators': 1364, 'learning_rate': 0.03738503041554803, 'max_depth': 7, 'min_samples_split': 4, 'min_samples_leaf': 2, 'subsample': 0.7910124784152469, 'max_features': None}. Best is trial 212 with value: 0.23718385215198057.
[I 2024-12-04 12:21:56,806] Trial 265 finished with value: 0.2983014436756409 and parameters: {'n_estimators': 1033, 'learning_rate': 0.0246496584996758, 'max_depth': 11, 'min_samples_split': 2, 'min_samples_leaf': 2, 'subsample': 0.9696149448617906, 'max_features': 'sqrt'}. Best is trial 212 with value: 0.23718385215198057.
[I 2024-12-04 12:22:01,900] Trial 258 finished with value: 0.29536895239890726 and parameters: {'n_estimators': 1438, 'learning_rate': 0.030811817855278454, 'max_depth': 6, 'min_samples_split': 4, 'min_samples_leaf': 2, 'subsample': 0.8747489003814933, 'max_features': 'sqrt'}. Best is trial 212 with value: 0.23718385215198057.
[I 2024-12-04 12:22:04,277] Trial 267 finished with value: 0.29633748233234075 and parameters: {'n_estimators': 1033, 'learning_rate': 0.04066932170230591, 'max_depth': 6, 'min_samples_split': 12, 'min_samples_leaf': 2, 'subsample': 0.853993329805364, 'max_features': 'sqrt'}. Best is trial 212 with value: 0.23718385215198057.
[I 2024-12-04 12:22:08,047] Trial 261 finished with value: 0.3377258658883437 and parameters: {'n_estimators': 1439, 'learning_rate': 0.029122496873800665, 'max_depth': 12, 'min_samples_split': 11, 'min_samples_leaf': 2, 'subsample': 0.9900429862762381, 'max_features': 'log2'}. Best is trial 212 with value: 0.23718385215198057.
[I 2024-12-04 12:22:08,103] Trial 262 finished with value: 0.3519045087673122 and parameters: {'n_estimators': 1321, 'learning_rate': 0.0792336722179308, 'max_depth': 9, 'min_samples_split': 20, 'min_samples_leaf': 3, 'subsample': 0.6364268295678899, 'max_features': 'sqrt'}. Best is trial 212 with value: 0.23718385215198057.
[I 2024-12-04 12:22:10,007] Trial 283 finished with value: 0.48497781944799956 and parameters: {'n_estimators': 653, 'learning_rate': 0.013955589337648948, 'max_depth': 10, 'min_samples_split': 11, 'min_samples_leaf': 9, 'subsample': 0.6778794510213935, 'max_features': None}. Best is trial 212 with value: 0.23718385215198057.
