[I 2024-12-03 19:24:47,666] Trial 2473 finished with value: 0.17302546066849223 and parameters: {'kernel': 'rbf', 'C': 99.01071806239555, 'gamma': 0.01826650099270288, 'epsilon': 0.03756083386574835}. Best is trial 345 with value: 0.13438257115663557.
[I 2024-12-03 19:24:49,125] Trial 2413 finished with value: 0.1365180538681385 and parameters: {'kernel': 'linear', 'C': 89.01290801113961, 'gamma': 0.02685754428429305, 'epsilon': 0.023572296850072918}. Best is trial 345 with value: 0.13438257115663557.
[I 2024-12-03 19:24:49,970] Trial 2469 finished with value: 0.14405740927814373 and parameters: {'kernel': 'linear', 'C': 23.82034209171831, 'gamma': 0.005163513339843977, 'epsilon': 0.11817871171650102}. Best is trial 345 with value: 0.13438257115663557.
[I 2024-12-03 19:24:51,356] Trial 2460 finished with value: 0.13542174531849602 and parameters: {'kernel': 'linear', 'C': 21.70799531413206, 'gamma': 0.014746235538203459, 'epsilon': 0.03160418558560211}. Best is trial 345 with value: 0.13438257115663557.
[I 2024-12-03 19:24:51,416] Trial 2394 finished with value: 0.13829136536227482 and parameters: {'kernel': 'linear', 'C': 88.25634625040259, 'gamma': 0.002804978647318982, 'epsilon': 0.01652781759923948}. Best is trial 345 with value: 0.13438257115663557.
[I 2024-12-03 19:24:51,807] Trial 2467 finished with value: 0.13567557560932889 and parameters: {'kernel': 'linear', 'C': 8.99085210766893, 'gamma': 0.00782678371383852, 'epsilon': 0.03738287474264515}. Best is trial 345 with value: 0.13438257115663557.
[I 2024-12-03 19:24:53,591] Trial 2477 finished with value: 0.14070998609970148 and parameters: {'kernel': 'rbf', 'C': 92.38618077167838, 'gamma': 0.0015488577609144463, 'epsilon': 0.02884710409012047}. Best is trial 345 with value: 0.13438257115663557.
[I 2024-12-03 19:24:55,446] Trial 2472 finished with value: 0.3263878055342968 and parameters: {'kernel': 'poly', 'C': 83.41479799858419, 'gamma': 0.025769624293907212, 'epsilon': 0.03769600067024336}. Best is trial 345 with value: 0.13438257115663557.
[I 2024-12-03 19:24:56,312] Trial 2427 finished with value: 0.13809584943794292 and parameters: {'kernel': 'linear', 'C': 33.302290528161166, 'gamma': 0.0016841096725464498, 'epsilon': 0.0075108965106910055}. Best is trial 345 with value: 0.13438257115663557.
[I 2024-12-03 19:24:56,931] Trial 2429 finished with value: 0.13528131469702298 and parameters: {'kernel': 'linear', 'C': 97.48898754368312, 'gamma': 0.0015822681105294818, 'epsilon': 0.05975140876038428}. Best is trial 345 with value: 0.13438257115663557.
[I 2024-12-03 19:24:57,727] Trial 2482 finished with value: 47.42748665557969 and parameters: {'kernel': 'sigmoid', 'C': 74.01332485968405, 'gamma': 0.0031615246660530345, 'epsilon': 0.01388530797906651}. Best is trial 345 with value: 0.13438257115663557.
[I 2024-12-03 19:24:57,728] Trial 2468 finished with value: 0.13803245397349745 and parameters: {'kernel': 'linear', 'C': 10.669387228496907, 'gamma': 0.21008819150820726, 'epsilon': 0.013779675783817686}. Best is trial 345 with value: 0.13438257115663557.
[I 2024-12-03 19:25:02,778] Trial 2465 finished with value: 0.13632806771442196 and parameters: {'kernel': 'linear', 'C': 18.590490267851738, 'gamma': 0.00020579366164440247, 'epsilon': 0.02566563431105246}. Best is trial 345 with value: 0.13438257115663557.
[I 2024-12-03 19:25:04,527] Trial 2486 finished with value: 0.6899662019311446 and parameters: {'kernel': 'poly', 'C': 10.289575667767258, 'gamma': 0.006345966002250678, 'epsilon': 0.0069354031834330115}. Best is trial 345 with value: 0.13438257115663557.
[I 2024-12-03 19:25:07,387] Trial 2471 finished with value: 0.1355849764804185 and parameters: {'kernel': 'linear', 'C': 14.487259585763468, 'gamma': 0.002334268867337776, 'epsilon': 0.027929362945775464}. Best is trial 345 with value: 0.13438257115663557.
[I 2024-12-03 19:25:08,166] Trial 2474 finished with value: 0.13783743145966074 and parameters: {'kernel': 'linear', 'C': 27.00990315788355, 'gamma': 0.0011175809670020507, 'epsilon': 0.020863438622751203}. Best is trial 345 with value: 0.13438257115663557.
[I 2024-12-03 19:25:10,773] Trial 2475 finished with value: 0.13665175150270686 and parameters: {'kernel': 'linear', 'C': 32.622693447910564, 'gamma': 0.001345923745667574, 'epsilon': 0.0504146929028494}. Best is trial 345 with value: 0.13438257115663557.
[I 2024-12-03 19:25:12,857] Trial 2405 finished with value: 0.13783087259734889 and parameters: {'kernel': 'linear', 'C': 97.39851106411705, 'gamma': 0.007500923529542233, 'epsilon': 0.01319971008062178}. Best is trial 345 with value: 0.13438257115663557.
[I 2024-12-03 19:25:13,238] Trial 2483 finished with value: 0.13525559147985092 and parameters: {'kernel': 'linear', 'C': 20.60768806781873, 'gamma': 0.013885962774641583, 'epsilon': 0.059506725643433095}. Best is trial 345 with value: 0.13438257115663557.
[I 2024-12-03 19:25:13,415] Trial 2488 finished with value: 0.14295285518354703 and parameters: {'kernel': 'linear', 'C': 16.14959174214334, 'gamma': 0.0015248539985415245, 'epsilon': 0.11396465550431904}. Best is trial 345 with value: 0.13438257115663557.
[I 2024-12-03 19:25:13,738] Trial 2476 finished with value: 0.1355912878574748 and parameters: {'kernel': 'linear', 'C': 25.995279124337017, 'gamma': 0.0015114126177298755, 'epsilon': 0.03373054393924471}. Best is trial 345 with value: 0.13438257115663557.
[I 2024-12-03 19:25:17,107] Trial 2492 finished with value: 0.1432006150893594 and parameters: {'kernel': 'linear', 'C': 6.000755328400681, 'gamma': 0.0033129419266605346, 'epsilon': 0.10050078631131061}. Best is trial 345 with value: 0.13438257115663557.
[I 2024-12-03 19:25:18,435] Trial 2490 finished with value: 0.13797711155888365 and parameters: {'kernel': 'linear', 'C': 5.062952946262499, 'gamma': 0.0035124289320525195, 'epsilon': 0.016237959901196624}. Best is trial 345 with value: 0.13438257115663557.
[I 2024-12-03 19:25:18,435] Trial 2493 finished with value: 0.13761789630554472 and parameters: {'kernel': 'linear', 'C': 8.86064828344287, 'gamma': 0.01260096863654197, 'epsilon': 0.07558523739913973}. Best is trial 345 with value: 0.13438257115663557.
[I 2024-12-03 19:25:18,678] Trial 2484 finished with value: 0.13724944221436997 and parameters: {'kernel': 'linear', 'C': 18.359650652645694, 'gamma': 0.0005030021527471814, 'epsilon': 0.02199428760761834}. Best is trial 345 with value: 0.13438257115663557.
[I 2024-12-03 19:25:21,203] Trial 2496 finished with value: 0.14330407579781324 and parameters: {'kernel': 'linear', 'C': 0.7631791494219764, 'gamma': 0.002150590203014403, 'epsilon': 0.04067421744281742}. Best is trial 345 with value: 0.13438257115663557.
[I 2024-12-03 19:25:22,130] Trial 2497 finished with value: 0.16750197617187845 and parameters: {'kernel': 'linear', 'C': 15.359531952132956, 'gamma': 0.0008760203652700186, 'epsilon': 0.18579716011241634}. Best is trial 345 with value: 0.13438257115663557.
[I 2024-12-03 19:25:22,285] Trial 2442 finished with value: 0.1352565225000882 and parameters: {'kernel': 'linear', 'C': 97.14356897511446, 'gamma': 0.00817307017173539, 'epsilon': 0.05809865769784178}. Best is trial 345 with value: 0.13438257115663557.
[I 2024-12-03 19:25:24,801] Trial 2419 finished with value: 0.13580783210673258 and parameters: {'kernel': 'linear', 'C': 98.46104464783791, 'gamma': 0.016783080010671757, 'epsilon': 0.034731002729220466}. Best is trial 345 with value: 0.13438257115663557.
[I 2024-12-03 19:25:30,542] Trial 2494 finished with value: 0.13554096402754642 and parameters: {'kernel': 'linear', 'C': 19.86703207708846, 'gamma': 0.029547278670150254, 'epsilon': 0.03279420280294742}. Best is trial 345 with value: 0.13438257115663557.
[I 2024-12-03 19:25:31,382] Trial 2499 finished with value: 0.13700610576482794 and parameters: {'kernel': 'linear', 'C': 10.157322190671694, 'gamma': 0.004192962231965505, 'epsilon': 0.04846864652613354}. Best is trial 345 with value: 0.13438257115663557.
[I 2024-12-03 19:25:33,524] Trial 2417 finished with value: 0.13834199101871303 and parameters: {'kernel': 'linear', 'C': 98.83125490098372, 'gamma': 0.04709078422291184, 'epsilon': 0.01621391111893321}. Best is trial 345 with value: 0.13438257115663557.
[I 2024-12-03 19:25:33,808] Trial 2470 finished with value: 0.1379380850635445 and parameters: {'kernel': 'linear', 'C': 29.79364648511006, 'gamma': 0.005132196935215311, 'epsilon': 0.015040807249923507}. Best is trial 345 with value: 0.13438257115663557.
[I 2024-12-03 19:25:35,393] Trial 2457 finished with value: 0.13712035737796033 and parameters: {'kernel': 'linear', 'C': 94.65211290002846, 'gamma': 0.0001637465705108758, 'epsilon': 0.02293473954522682}. Best is trial 345 with value: 0.13438257115663557.
[I 2024-12-03 19:25:39,800] Trial 2498 finished with value: 0.13544881346625293 and parameters: {'kernel': 'linear', 'C': 18.896046197831637, 'gamma': 0.016813418718703406, 'epsilon': 0.032010066606466527}. Best is trial 345 with value: 0.13438257115663557.
[I 2024-12-03 19:25:40,160] Trial 2428 finished with value: 0.13734567118578364 and parameters: {'kernel': 'linear', 'C': 94.6221945803137, 'gamma': 0.0032637317315039236, 'epsilon': 0.02232320464733837}. Best is trial 345 with value: 0.13438257115663557.
[I 2024-12-03 19:25:44,480] Trial 2449 finished with value: 0.13548772670032774 and parameters: {'kernel': 'linear', 'C': 99.289095107744, 'gamma': 0.003217026659942511, 'epsilon': 0.04131260676414263}. Best is trial 345 with value: 0.13438257115663557.
[I 2024-12-03 19:25:45,330] Trial 2481 finished with value: 0.13658721494108736 and parameters: {'kernel': 'linear', 'C': 93.61700751378064, 'gamma': 0.006217293154562294, 'epsilon': 0.043663234359090565}. Best is trial 345 with value: 0.13438257115663557.
[I 2024-12-03 19:25:57,241] Trial 2462 finished with value: 0.1378523874130892 and parameters: {'kernel': 'linear', 'C': 97.03127730974803, 'gamma': 0.007502932940470651, 'epsilon': 0.00404403758748919}. Best is trial 345 with value: 0.13438257115663557.
[I 2024-12-03 19:26:00,233] Trial 2480 finished with value: 0.13753861827876934 and parameters: {'kernel': 'linear', 'C': 99.55988354934873, 'gamma': 0.01156545094875928, 'epsilon': 0.022002042265523228}. Best is trial 345 with value: 0.13438257115663557.
[I 2024-12-03 19:26:02,319] Trial 2495 finished with value: 0.1362654855481369 and parameters: {'kernel': 'linear', 'C': 94.75919148593388, 'gamma': 0.007318262885484264, 'epsilon': 0.051393433404434564}. Best is trial 345 with value: 0.13438257115663557.
[I 2024-12-03 19:26:04,884] Trial 2485 finished with value: 0.13533357155537695 and parameters: {'kernel': 'linear', 'C': 95.63089317347038, 'gamma': 0.05401746237238874, 'epsilon': 0.03337319803257837}. Best is trial 345 with value: 0.13438257115663557.
[I 2024-12-03 19:26:13,731] Trial 2478 finished with value: 0.13849018812380384 and parameters: {'kernel': 'linear', 'C': 93.6921801163485, 'gamma': 0.18370628056585867, 'epsilon': 0.017124581598657887}. Best is trial 345 with value: 0.13438257115663557.
[I 2024-12-03 19:26:21,957] Trial 2479 finished with value: 0.1347133085711367 and parameters: {'kernel': 'linear', 'C': 99.57026915649507, 'gamma': 0.001246947986514653, 'epsilon': 0.032071522612762075}. Best is trial 345 with value: 0.13438257115663557.
[I 2024-12-03 19:26:27,627] Trial 2446 finished with value: 0.13820382002339301 and parameters: {'kernel': 'linear', 'C': 94.07409537805917, 'gamma': 0.0017347642257528268, 'epsilon': 0.007247934205254316}. Best is trial 345 with value: 0.13438257115663557.
[I 2024-12-03 19:26:27,701] Trial 2491 finished with value: 0.1356294686828096 and parameters: {'kernel': 'linear', 'C': 99.97285959284544, 'gamma': 0.00031275252624923377, 'epsilon': 0.026458549769982756}. Best is trial 345 with value: 0.13438257115663557.
[I 2024-12-03 19:26:27,770] Trial 2489 finished with value: 0.1378638083055481 and parameters: {'kernel': 'linear', 'C': 97.35501997018996, 'gamma': 0.0035242889974343625, 'epsilon': 0.018385350434443472}. Best is trial 345 with value: 0.13438257115663557.
[I 2024-12-03 19:26:37,631] Trial 2487 finished with value: 0.13816473471792795 and parameters: {'kernel': 'linear', 'C': 89.52899029129154, 'gamma': 0.10253686463152398, 'epsilon': 0.0076300437092399675}. Best is trial 345 with value: 0.13438257115663557.
[I 2024-12-03 19:27:16,809] Trial 2146 finished with value: 0.33624888459024826 and parameters: {'kernel': 'poly', 'C': 14.300275678232698, 'gamma': 0.24029534773298297, 'epsilon': 0.05272773232671892}. Best is trial 345 with value: 0.13438257115663557.
[I 2024-12-03 19:31:57,813] Trial 2441 finished with value: 0.3137421751033347 and parameters: {'kernel': 'poly', 'C': 39.21494883738872, 'gamma': 0.07254474295117717, 'epsilon': 0.008022592358752745}. Best is trial 345 with value: 0.13438257115663557.
[I 2024-12-03 19:32:59,088] Trial 1836 finished with value: 0.3758873976859053 and parameters: {'kernel': 'poly', 'C': 8.3631046244312, 'gamma': 0.24085124144559397, 'epsilon': 0.005915954829949243}. Best is trial 345 with value: 0.13438257115663557.
[I 2024-12-03 19:35:17,602] Trial 112 finished with value: 11.676928842573538 and parameters: {'kernel': 'poly', 'C': 69.72518976653386, 'gamma': 0.7784603558613189, 'epsilon': 0.1608651308392273}. Best is trial 345 with value: 0.13438257115663557.
[I 2024-12-03 19:36:07,110] Trial 2248 finished with value: 0.6228937646181955 and parameters: {'kernel': 'poly', 'C': 86.03897520469164, 'gamma': 0.18026763497056816, 'epsilon': 0.03320547184886367}. Best is trial 345 with value: 0.13438257115663557.
[I 2024-12-03 19:37:25,521] Trial 1332 finished with value: 0.48838145491983587 and parameters: {'kernel': 'poly', 'C': 31.420176312194954, 'gamma': 0.2951453870281358, 'epsilon': 0.02057073576939873}. Best is trial 345 with value: 0.13438257115663557.
[I 2024-12-03 19:43:57,727] Trial 180 finished with value: 8.273570435747507 and parameters: {'kernel': 'poly', 'C': 13.76282311289558, 'gamma': 0.923267901410715, 'epsilon': 0.024367604572319013}. Best is trial 345 with value: 0.13438257115663557.
[I 2024-12-03 19:54:16,932] Trial 2299 finished with value: 36.6263399619405 and parameters: {'kernel': 'poly', 'C': 67.74195339318814, 'gamma': 0.8396705627602626, 'epsilon': 0.0676621234028974}. Best is trial 345 with value: 0.13438257115663557.
[I 2024-12-03 20:14:11,311] Trial 2380 finished with value: 49.06516456423235 and parameters: {'kernel': 'poly', 'C': 54.44876223687295, 'gamma': 0.938579198240255, 'epsilon': 0.014735314702170666}. Best is trial 345 with value: 0.13438257115663557.
[I 2024-12-03 20:31:48,426] Trial 1196 finished with value: 0.9202955761142875 and parameters: {'kernel': 'poly', 'C': 4.856407823041206, 'gamma': 0.7511984604278265, 'epsilon': 0.0015447579190402242}. Best is trial 345 with value: 0.13438257115663557.
