[I 2024-12-04 11:55:43,754] Trial 77 finished with value: 0.5271429822025053 and parameters: {'n_estimators': 566, 'max_depth': 35, 'min_samples_split': 3, 'min_samples_leaf': 1, 'max_features': None, 'bootstrap': True, 'criterion': 'squared_error'}. Best is trial 21 with value: 0.5141602040594817.
[I 2024-12-04 11:55:44,114] Trial 67 finished with value: 0.5323422620736896 and parameters: {'n_estimators': 113, 'max_depth': 30, 'min_samples_split': 11, 'min_samples_leaf': 1, 'max_features': None, 'bootstrap': True, 'criterion': 'absolute_error'}. Best is trial 82 with value: 0.5120884726134413.
[I 2024-12-04 11:55:45,653] Trial 82 finished with value: 0.5120884726134413 and parameters: {'n_estimators': 147, 'max_depth': 20, 'min_samples_split': 4, 'min_samples_leaf': 1, 'max_features': None, 'bootstrap': True, 'criterion': 'absolute_error'}. Best is trial 82 with value: 0.5120884726134413.
[I 2024-12-04 11:55:48,791] Trial 80 finished with value: 0.5836940821928038 and parameters: {'n_estimators': 537, 'max_depth': 19, 'min_samples_split': 4, 'min_samples_leaf': 1, 'max_features': None, 'bootstrap': False, 'criterion': 'squared_error'}. Best is trial 82 with value: 0.5120884726134413.
[I 2024-12-04 11:55:48,933] Trial 83 finished with value: 0.5131547148998773 and parameters: {'n_estimators': 504, 'max_depth': 16, 'min_samples_split': 6, 'min_samples_leaf': 1, 'max_features': None, 'bootstrap': True, 'criterion': 'squared_error'}. Best is trial 82 with value: 0.5120884726134413.
[I 2024-12-04 11:55:48,958] Trial 71 finished with value: 0.5153772838807216 and parameters: {'n_estimators': 225, 'max_depth': 17, 'min_samples_split': 4, 'min_samples_leaf': 1, 'max_features': None, 'bootstrap': True, 'criterion': 'absolute_error'}. Best is trial 82 with value: 0.5120884726134413.
[I 2024-12-04 11:55:49,048] Trial 34 finished with value: 0.5219785491031996 and parameters: {'n_estimators': 443, 'max_depth': 38, 'min_samples_split': 3, 'min_samples_leaf': 1, 'max_features': None, 'bootstrap': True, 'criterion': 'absolute_error'}. Best is trial 82 with value: 0.5120884726134413.
[I 2024-12-04 11:55:49,223] Trial 59 finished with value: 0.551589829355184 and parameters: {'n_estimators': 368, 'max_depth': 41, 'min_samples_split': 18, 'min_samples_leaf': 1, 'max_features': None, 'bootstrap': True, 'criterion': 'absolute_error'}. Best is trial 82 with value: 0.5120884726134413.
[I 2024-12-04 11:55:49,231] Trial 45 finished with value: 0.5268421842737664 and parameters: {'n_estimators': 311, 'max_depth': 24, 'min_samples_split': 8, 'min_samples_leaf': 1, 'max_features': None, 'bootstrap': False, 'criterion': 'absolute_error'}. Best is trial 82 with value: 0.5120884726134413.
[I 2024-12-04 11:55:49,263] Trial 89 finished with value: 1.2160079089588318 and parameters: {'n_estimators': 321, 'max_depth': 10, 'min_samples_split': 39, 'min_samples_leaf': 9, 'max_features': 'sqrt', 'bootstrap': True, 'criterion': 'squared_error'}. Best is trial 82 with value: 0.5120884726134413.
[I 2024-12-04 11:55:49,395] Trial 92 finished with value: 0.5571516020465934 and parameters: {'n_estimators': 393, 'max_depth': 31, 'min_samples_split': 7, 'min_samples_leaf': 2, 'max_features': None, 'bootstrap': True, 'criterion': 'squared_error'}. Best is trial 82 with value: 0.5120884726134413.
[I 2024-12-04 11:55:49,685] Trial 85 finished with value: 0.548067412958101 and parameters: {'n_estimators': 444, 'max_depth': 21, 'min_samples_split': 5, 'min_samples_leaf': 3, 'max_features': None, 'bootstrap': True, 'criterion': 'squared_error'}. Best is trial 82 with value: 0.5120884726134413.
[I 2024-12-04 11:55:49,792] Trial 81 finished with value: 0.5210144640552006 and parameters: {'n_estimators': 411, 'max_depth': 16, 'min_samples_split': 3, 'min_samples_leaf': 1, 'max_features': None, 'bootstrap': True, 'criterion': 'squared_error'}. Best is trial 82 with value: 0.5120884726134413.
[I 2024-12-04 11:55:49,827] Trial 88 finished with value: 0.5203169142412921 and parameters: {'n_estimators': 737, 'max_depth': 19, 'min_samples_split': 7, 'min_samples_leaf': 1, 'max_features': None, 'bootstrap': True, 'criterion': 'squared_error'}. Best is trial 82 with value: 0.5120884726134413.
[I 2024-12-04 11:55:49,944] Trial 94 finished with value: 1.3167185898642542 and parameters: {'n_estimators': 998, 'max_depth': 5, 'min_samples_split': 29, 'min_samples_leaf': 11, 'max_features': 'sqrt', 'bootstrap': False, 'criterion': 'absolute_error'}. Best is trial 82 with value: 0.5120884726134413.
[I 2024-12-04 11:55:50,023] Trial 96 finished with value: 0.8001392369259767 and parameters: {'n_estimators': 521, 'max_depth': 16, 'min_samples_split': 2, 'min_samples_leaf': 1, 'max_features': 'sqrt', 'bootstrap': True, 'criterion': 'squared_error'}. Best is trial 82 with value: 0.5120884726134413.
[I 2024-12-04 11:55:50,059] Trial 86 finished with value: 0.5191665550249724 and parameters: {'n_estimators': 123, 'max_depth': 44, 'min_samples_split': 4, 'min_samples_leaf': 1, 'max_features': None, 'bootstrap': True, 'criterion': 'absolute_error'}. Best is trial 82 with value: 0.5120884726134413.
[I 2024-12-04 11:55:50,111] Trial 79 finished with value: 0.5189596360475041 and parameters: {'n_estimators': 381, 'max_depth': 22, 'min_samples_split': 4, 'min_samples_leaf': 1, 'max_features': None, 'bootstrap': True, 'criterion': 'squared_error'}. Best is trial 82 with value: 0.5120884726134413.
[I 2024-12-04 11:55:50,136] Trial 91 finished with value: 0.8998573450948683 and parameters: {'n_estimators': 487, 'max_depth': 22, 'min_samples_split': 7, 'min_samples_leaf': 2, 'max_features': 'sqrt', 'bootstrap': True, 'criterion': 'squared_error'}. Best is trial 82 with value: 0.5120884726134413.
[I 2024-12-04 11:55:50,321] Trial 84 finished with value: 0.5217029657246963 and parameters: {'n_estimators': 576, 'max_depth': 19, 'min_samples_split': 2, 'min_samples_leaf': 1, 'max_features': None, 'bootstrap': True, 'criterion': 'squared_error'}. Best is trial 82 with value: 0.5120884726134413.
[I 2024-12-04 11:55:50,810] Trial 87 finished with value: 0.523016697107139 and parameters: {'n_estimators': 293, 'max_depth': 30, 'min_samples_split': 5, 'min_samples_leaf': 1, 'max_features': None, 'bootstrap': True, 'criterion': 'squared_error'}. Best is trial 82 with value: 0.5120884726134413.
[I 2024-12-04 11:55:51,460] Trial 72 finished with value: 0.5227820327830809 and parameters: {'n_estimators': 262, 'max_depth': 29, 'min_samples_split': 6, 'min_samples_leaf': 1, 'max_features': None, 'bootstrap': True, 'criterion': 'absolute_error'}. Best is trial 82 with value: 0.5120884726134413.
[I 2024-12-04 11:55:53,117] Trial 90 finished with value: 0.6341479447410898 and parameters: {'n_estimators': 733, 'max_depth': 50, 'min_samples_split': 15, 'min_samples_leaf': 7, 'max_features': None, 'bootstrap': True, 'criterion': 'squared_error'}. Best is trial 82 with value: 0.5120884726134413.
[I 2024-12-04 11:56:00,471] Trial 99 finished with value: 0.5418693146274557 and parameters: {'n_estimators': 515, 'max_depth': 8, 'min_samples_split': 9, 'min_samples_leaf': 1, 'max_features': None, 'bootstrap': True, 'criterion': 'squared_error'}. Best is trial 82 with value: 0.5120884726134413.
[I 2024-12-04 11:56:00,686] Trial 104 finished with value: 0.5425139936717535 and parameters: {'n_estimators': 948, 'max_depth': 7, 'min_samples_split': 11, 'min_samples_leaf': 1, 'max_features': None, 'bootstrap': True, 'criterion': 'squared_error'}. Best is trial 82 with value: 0.5120884726134413.
[I 2024-12-04 11:56:02,576] Trial 110 finished with value: 1.0716870093131003 and parameters: {'n_estimators': 206, 'max_depth': 17, 'min_samples_split': 3, 'min_samples_leaf': 1, 'max_features': 'log2', 'bootstrap': True, 'criterion': 'absolute_error'}. Best is trial 82 with value: 0.5120884726134413.
[I 2024-12-04 11:56:06,101] Trial 98 finished with value: 0.5151069194652836 and parameters: {'n_estimators': 835, 'max_depth': 25, 'min_samples_split': 6, 'min_samples_leaf': 1, 'max_features': None, 'bootstrap': True, 'criterion': 'squared_error'}. Best is trial 82 with value: 0.5120884726134413.
[I 2024-12-04 11:56:09,490] Trial 108 finished with value: 0.5616081732656641 and parameters: {'n_estimators': 102, 'max_depth': 46, 'min_samples_split': 4, 'min_samples_leaf': 2, 'max_features': None, 'bootstrap': True, 'criterion': 'absolute_error'}. Best is trial 82 with value: 0.5120884726134413.
[I 2024-12-04 11:56:10,929] Trial 101 finished with value: 1.2029471334488147 and parameters: {'n_estimators': 813, 'max_depth': 33, 'min_samples_split': 3, 'min_samples_leaf': 8, 'max_features': 'sqrt', 'bootstrap': True, 'criterion': 'squared_error'}. Best is trial 82 with value: 0.5120884726134413.
[I 2024-12-04 11:56:14,067] Trial 102 finished with value: 0.561657344372816 and parameters: {'n_estimators': 148, 'max_depth': 47, 'min_samples_split': 4, 'min_samples_leaf': 2, 'max_features': None, 'bootstrap': True, 'criterion': 'absolute_error'}. Best is trial 82 with value: 0.5120884726134413.
[I 2024-12-04 11:56:14,439] Trial 118 finished with value: 0.5132757876093108 and parameters: {'n_estimators': 126, 'max_depth': 45, 'min_samples_split': 5, 'min_samples_leaf': 1, 'max_features': None, 'bootstrap': True, 'criterion': 'absolute_error'}. Best is trial 82 with value: 0.5120884726134413.
[I 2024-12-04 11:56:14,446] Trial 100 finished with value: 0.5201633290899678 and parameters: {'n_estimators': 242, 'max_depth': 21, 'min_samples_split': 3, 'min_samples_leaf': 1, 'max_features': None, 'bootstrap': True, 'criterion': 'absolute_error'}. Best is trial 82 with value: 0.5120884726134413.
[I 2024-12-04 11:56:16,620] Trial 107 finished with value: 0.7761203041748254 and parameters: {'n_estimators': 197, 'max_depth': 44, 'min_samples_split': 3, 'min_samples_leaf': 1, 'max_features': 'log2', 'bootstrap': True, 'criterion': 'absolute_error'}. Best is trial 82 with value: 0.5120884726134413.
[I 2024-12-04 11:56:16,642] Trial 116 finished with value: 0.7962464170044652 and parameters: {'n_estimators': 153, 'max_depth': 21, 'min_samples_split': 4, 'min_samples_leaf': 1, 'max_features': 'sqrt', 'bootstrap': True, 'criterion': 'absolute_error'}. Best is trial 82 with value: 0.5120884726134413.
[I 2024-12-04 11:56:17,293] Trial 106 finished with value: 0.5167362527413888 and parameters: {'n_estimators': 162, 'max_depth': 15, 'min_samples_split': 6, 'min_samples_leaf': 1, 'max_features': None, 'bootstrap': True, 'criterion': 'absolute_error'}. Best is trial 82 with value: 0.5120884726134413.
[I 2024-12-04 11:56:18,070] Trial 119 finished with value: 0.522230465767777 and parameters: {'n_estimators': 592, 'max_depth': 17, 'min_samples_split': 7, 'min_samples_leaf': 1, 'max_features': None, 'bootstrap': True, 'criterion': 'squared_error'}. Best is trial 82 with value: 0.5120884726134413.
[I 2024-12-04 11:56:19,323] Trial 109 finished with value: 0.513103073292112 and parameters: {'n_estimators': 709, 'max_depth': 14, 'min_samples_split': 5, 'min_samples_leaf': 1, 'max_features': None, 'bootstrap': True, 'criterion': 'squared_error'}. Best is trial 82 with value: 0.5120884726134413.
[I 2024-12-04 11:56:21,780] Trial 120 finished with value: 0.9628367131479317 and parameters: {'n_estimators': 686, 'max_depth': 19, 'min_samples_split': 17, 'min_samples_leaf': 1, 'max_features': 'log2', 'bootstrap': True, 'criterion': 'squared_error'}. Best is trial 82 with value: 0.5120884726134413.
[I 2024-12-04 11:56:24,870] Trial 122 finished with value: 0.5192189860316329 and parameters: {'n_estimators': 162, 'max_depth': 31, 'min_samples_split': 4, 'min_samples_leaf': 1, 'max_features': None, 'bootstrap': True, 'criterion': 'absolute_error'}. Best is trial 82 with value: 0.5120884726134413.
[I 2024-12-04 11:56:26,000] Trial 115 finished with value: 0.5425792738918847 and parameters: {'n_estimators': 734, 'max_depth': 23, 'min_samples_split': 15, 'min_samples_leaf': 2, 'max_features': None, 'bootstrap': True, 'criterion': 'squared_error'}. Best is trial 82 with value: 0.5120884726134413.
[I 2024-12-04 11:56:30,150] Trial 117 finished with value: 0.5091146052010797 and parameters: {'n_estimators': 104, 'max_depth': 12, 'min_samples_split': 5, 'min_samples_leaf': 1, 'max_features': None, 'bootstrap': True, 'criterion': 'absolute_error'}. Best is trial 117 with value: 0.5091146052010797.
[I 2024-12-04 11:56:31,683] Trial 105 finished with value: 0.5342467126480673 and parameters: {'n_estimators': 402, 'max_depth': 9, 'min_samples_split': 11, 'min_samples_leaf': 1, 'max_features': None, 'bootstrap': True, 'criterion': 'absolute_error'}. Best is trial 117 with value: 0.5091146052010797.
[I 2024-12-04 11:56:32,229] Trial 113 finished with value: 0.5645233244647639 and parameters: {'n_estimators': 220, 'max_depth': 14, 'min_samples_split': 2, 'min_samples_leaf': 1, 'max_features': None, 'bootstrap': False, 'criterion': 'absolute_error'}. Best is trial 117 with value: 0.5091146052010797.
[I 2024-12-04 11:56:32,538] Trial 126 finished with value: 0.5493464454700346 and parameters: {'n_estimators': 874, 'max_depth': 24, 'min_samples_split': 3, 'min_samples_leaf': 3, 'max_features': None, 'bootstrap': True, 'criterion': 'squared_error'}. Best is trial 117 with value: 0.5091146052010797.
[I 2024-12-04 11:56:33,667] Trial 114 finished with value: 0.526898569354631 and parameters: {'n_estimators': 946, 'max_depth': 24, 'min_samples_split': 17, 'min_samples_leaf': 1, 'max_features': None, 'bootstrap': True, 'criterion': 'squared_error'}. Best is trial 117 with value: 0.5091146052010797.
[I 2024-12-04 11:56:33,703] Trial 95 finished with value: 0.522189533271692 and parameters: {'n_estimators': 457, 'max_depth': 38, 'min_samples_split': 3, 'min_samples_leaf': 1, 'max_features': None, 'bootstrap': True, 'criterion': 'absolute_error'}. Best is trial 117 with value: 0.5091146052010797.
[I 2024-12-04 11:56:35,647] Trial 124 finished with value: 0.5328206233121912 and parameters: {'n_estimators': 803, 'max_depth': 33, 'min_samples_split': 8, 'min_samples_leaf': 1, 'max_features': None, 'bootstrap': True, 'criterion': 'squared_error'}. Best is trial 117 with value: 0.5091146052010797.
[I 2024-12-04 11:56:35,680] Trial 103 finished with value: 0.5202790129433429 and parameters: {'n_estimators': 464, 'max_depth': 9, 'min_samples_split': 3, 'min_samples_leaf': 1, 'max_features': None, 'bootstrap': True, 'criterion': 'absolute_error'}. Best is trial 117 with value: 0.5091146052010797.
[I 2024-12-04 11:56:36,748] Trial 97 finished with value: 0.5176337770983074 and parameters: {'n_estimators': 507, 'max_depth': 34, 'min_samples_split': 4, 'min_samples_leaf': 1, 'max_features': None, 'bootstrap': True, 'criterion': 'absolute_error'}. Best is trial 117 with value: 0.5091146052010797.
[I 2024-12-04 11:56:36,990] Trial 111 finished with value: 0.5611770514350438 and parameters: {'n_estimators': 529, 'max_depth': 17, 'min_samples_split': 4, 'min_samples_leaf': 2, 'max_features': None, 'bootstrap': True, 'criterion': 'absolute_error'}. Best is trial 117 with value: 0.5091146052010797.
[I 2024-12-04 11:56:37,103] Trial 112 finished with value: 0.512984448816363 and parameters: {'n_estimators': 825, 'max_depth': 27, 'min_samples_split': 5, 'min_samples_leaf': 1, 'max_features': None, 'bootstrap': True, 'criterion': 'squared_error'}. Best is trial 117 with value: 0.5091146052010797.
[I 2024-12-04 11:56:37,142] Trial 127 finished with value: 0.5197552807665111 and parameters: {'n_estimators': 133, 'max_depth': 40, 'min_samples_split': 6, 'min_samples_leaf': 1, 'max_features': None, 'bootstrap': True, 'criterion': 'absolute_error'}. Best is trial 117 with value: 0.5091146052010797.
[I 2024-12-04 11:56:37,339] Trial 121 finished with value: 0.5142057153162947 and parameters: {'n_estimators': 849, 'max_depth': 21, 'min_samples_split': 4, 'min_samples_leaf': 1, 'max_features': None, 'bootstrap': True, 'criterion': 'squared_error'}. Best is trial 117 with value: 0.5091146052010797.
[I 2024-12-04 11:56:38,961] Trial 133 finished with value: 0.5454804777957186 and parameters: {'n_estimators': 100, 'max_depth': 12, 'min_samples_split': 6, 'min_samples_leaf': 2, 'max_features': None, 'bootstrap': True, 'criterion': 'absolute_error'}. Best is trial 117 with value: 0.5091146052010797.
[I 2024-12-04 11:56:39,195] Trial 134 finished with value: 1.0655211868646637 and parameters: {'n_estimators': 245, 'max_depth': 8, 'min_samples_split': 13, 'min_samples_leaf': 1, 'max_features': 'sqrt', 'bootstrap': False, 'criterion': 'absolute_error'}. Best is trial 117 with value: 0.5091146052010797.
[I 2024-12-04 11:56:39,210] Trial 130 finished with value: 0.7461557455515515 and parameters: {'n_estimators': 809, 'max_depth': 23, 'min_samples_split': 11, 'min_samples_leaf': 1, 'max_features': 'sqrt', 'bootstrap': True, 'criterion': 'squared_error'}. Best is trial 117 with value: 0.5091146052010797.
[I 2024-12-04 11:56:39,970] Trial 128 finished with value: 0.5266879863663333 and parameters: {'n_estimators': 201, 'max_depth': 41, 'min_samples_split': 7, 'min_samples_leaf': 1, 'max_features': None, 'bootstrap': True, 'criterion': 'absolute_error'}. Best is trial 117 with value: 0.5091146052010797.
[I 2024-12-04 11:56:46,006] Trial 123 finished with value: 0.5189467227552862 and parameters: {'n_estimators': 297, 'max_depth': 25, 'min_samples_split': 2, 'min_samples_leaf': 1, 'max_features': None, 'bootstrap': True, 'criterion': 'absolute_error'}. Best is trial 117 with value: 0.5091146052010797.
[I 2024-12-04 11:56:47,277] Trial 93 finished with value: 0.5183013615676332 and parameters: {'n_estimators': 601, 'max_depth': 37, 'min_samples_split': 4, 'min_samples_leaf': 1, 'max_features': None, 'bootstrap': True, 'criterion': 'absolute_error'}. Best is trial 117 with value: 0.5091146052010797.
[I 2024-12-04 11:56:47,933] Trial 139 finished with value: 0.5544290560828216 and parameters: {'n_estimators': 102, 'max_depth': 5, 'min_samples_split': 4, 'min_samples_leaf': 1, 'max_features': None, 'bootstrap': True, 'criterion': 'absolute_error'}. Best is trial 117 with value: 0.5091146052010797.
[I 2024-12-04 11:56:48,899] Trial 131 finished with value: 0.5106186215006874 and parameters: {'n_estimators': 145, 'max_depth': 18, 'min_samples_split': 6, 'min_samples_leaf': 1, 'max_features': None, 'bootstrap': True, 'criterion': 'absolute_error'}. Best is trial 117 with value: 0.5091146052010797.
[I 2024-12-04 11:56:49,402] Trial 132 finished with value: 0.5187605543461519 and parameters: {'n_estimators': 208, 'max_depth': 11, 'min_samples_split': 5, 'min_samples_leaf': 1, 'max_features': None, 'bootstrap': True, 'criterion': 'absolute_error'}. Best is trial 117 with value: 0.5091146052010797.
[I 2024-12-04 11:56:49,581] Trial 125 finished with value: 0.5171378078237695 and parameters: {'n_estimators': 306, 'max_depth': 21, 'min_samples_split': 4, 'min_samples_leaf': 1, 'max_features': None, 'bootstrap': True, 'criterion': 'absolute_error'}. Best is trial 117 with value: 0.5091146052010797.
[I 2024-12-04 11:56:51,748] Trial 138 finished with value: 0.602384829076417 and parameters: {'n_estimators': 852, 'max_depth': 13, 'min_samples_split': 6, 'min_samples_leaf': 2, 'max_features': None, 'bootstrap': False, 'criterion': 'squared_error'}. Best is trial 117 with value: 0.5091146052010797.
[I 2024-12-04 11:56:52,473] Trial 142 finished with value: 1.1723463337689513 and parameters: {'n_estimators': 864, 'max_depth': 5, 'min_samples_split': 4, 'min_samples_leaf': 1, 'max_features': 'log2', 'bootstrap': True, 'criterion': 'squared_error'}. Best is trial 117 with value: 0.5091146052010797.
[I 2024-12-04 11:56:54,492] Trial 135 finished with value: 0.5888260367284552 and parameters: {'n_estimators': 893, 'max_depth': 28, 'min_samples_split': 3, 'min_samples_leaf': 1, 'max_features': None, 'bootstrap': False, 'criterion': 'squared_error'}. Best is trial 117 with value: 0.5091146052010797.
[I 2024-12-04 11:56:56,986] Trial 140 finished with value: 0.5544372923734404 and parameters: {'n_estimators': 105, 'max_depth': 37, 'min_samples_split': 4, 'min_samples_leaf': 1, 'max_features': None, 'bootstrap': False, 'criterion': 'absolute_error'}. Best is trial 117 with value: 0.5091146052010797.
[I 2024-12-04 11:56:59,532] Trial 156 finished with value: 1.2951625104469304 and parameters: {'n_estimators': 319, 'max_depth': 10, 'min_samples_split': 12, 'min_samples_leaf': 2, 'max_features': 'log2', 'bootstrap': True, 'criterion': 'absolute_error'}. Best is trial 117 with value: 0.5091146052010797.
[I 2024-12-04 11:57:00,468] Trial 154 finished with value: 0.5248923957567325 and parameters: {'n_estimators': 135, 'max_depth': 20, 'min_samples_split': 10, 'min_samples_leaf': 1, 'max_features': None, 'bootstrap': True, 'criterion': 'absolute_error'}. Best is trial 117 with value: 0.5091146052010797.
[I 2024-12-04 11:57:00,470] Trial 141 finished with value: 0.5174248714020004 and parameters: {'n_estimators': 850, 'max_depth': 22, 'min_samples_split': 2, 'min_samples_leaf': 1, 'max_features': None, 'bootstrap': True, 'criterion': 'squared_error'}. Best is trial 117 with value: 0.5091146052010797.
[I 2024-12-04 11:57:00,941] Trial 153 finished with value: 1.1258468034142886 and parameters: {'n_estimators': 282, 'max_depth': 8, 'min_samples_split': 11, 'min_samples_leaf': 1, 'max_features': 'log2', 'bootstrap': True, 'criterion': 'squared_error'}. Best is trial 117 with value: 0.5091146052010797.
[I 2024-12-04 11:57:01,470] Trial 145 finished with value: 0.6204749826605691 and parameters: {'n_estimators': 930, 'max_depth': 32, 'min_samples_split': 2, 'min_samples_leaf': 1, 'max_features': 'sqrt', 'bootstrap': True, 'criterion': 'squared_error'}. Best is trial 117 with value: 0.5091146052010797.
