[I 2024-12-04 20:12:49,243] Trial 1005 finished with value: 0.3592113766950313 and parameters: {'kernel_type': 'Matern', 'length_scale': 4097.144817261424, 'noise_level': 0.57634027387095, 'constant_value': 50.41145275911077, 'nu': 0.5}. Best is trial 881 with value: 0.35916990930150405.
[I 2024-12-04 20:12:49,535] Trial 1004 finished with value: 1.0624161172629076 and parameters: {'kernel_type': 'RBF', 'length_scale': 0.002703967353519655, 'noise_level': 1.4128066333458868e-07, 'constant_value': 5.019694187125905e-06, 'nu': 1.5}. Best is trial 881 with value: 0.35916990930150405.
[I 2024-12-04 20:12:54,211] Trial 1007 finished with value: 0.35921133785645754 and parameters: {'kernel_type': 'Matern', 'length_scale': 696.16000690853, 'noise_level': 0.009257717909003987, 'constant_value': 21.347629780776888, 'nu': 0.5}. Best is trial 881 with value: 0.35916990930150405.
[I 2024-12-04 20:12:54,868] Trial 1009 finished with value: 0.35921124806202126 and parameters: {'kernel_type': 'Matern', 'length_scale': 1290.4774804540327, 'noise_level': 0.00046597780828716107, 'constant_value': 798.2827767903127, 'nu': 0.5}. Best is trial 881 with value: 0.35916990930150405.
[I 2024-12-04 20:12:55,789] Trial 1008 finished with value: 1.0624161172629076 and parameters: {'kernel_type': 'Matern', 'length_scale': 7.259363799548171e-05, 'noise_level': 1.3238471407880486e-06, 'constant_value': 1.817148874070336e-07, 'nu': 1.5}. Best is trial 881 with value: 0.35916990930150405.
[I 2024-12-04 20:13:00,018] Trial 1012 finished with value: 0.3592112138283001 and parameters: {'kernel_type': 'Matern', 'length_scale': 245.34159386266316, 'noise_level': 0.0536579515527385, 'constant_value': 8.610337596658573, 'nu': 0.5}. Best is trial 881 with value: 0.35916990930150405.
[I 2024-12-04 20:13:00,649] Trial 1011 finished with value: 0.35921122980769016 and parameters: {'kernel_type': 'Matern', 'length_scale': 27159.572544721806, 'noise_level': 0.0014635238751521229, 'constant_value': 1553.541959444283, 'nu': 0.5}. Best is trial 881 with value: 0.35916990930150405.
[I 2024-12-04 20:13:04,001] Trial 1010 finished with value: 1.0624161172894342 and parameters: {'kernel_type': 'RBF', 'length_scale': 51190.24430168236, 'noise_level': 1.6152701647425206e-10, 'constant_value': 54333.82490675776, 'nu': 0.5}. Best is trial 881 with value: 0.35916990930150405.
[I 2024-12-04 20:13:05,976] Trial 1014 finished with value: 1.091655849389964 and parameters: {'kernel_type': 'Matern', 'length_scale': 0.03433170387675438, 'noise_level': 2.6543499652623354e-10, 'constant_value': 19.562085914335995, 'nu': 2.5}. Best is trial 881 with value: 0.35916990930150405.
[I 2024-12-04 20:13:09,186] Trial 1013 finished with value: 0.41956600227281865 and parameters: {'kernel_type': 'Matern', 'length_scale': 2233.2448904609378, 'noise_level': 0.1347917958630515, 'constant_value': 22.261711741397548, 'nu': 2.5}. Best is trial 881 with value: 0.35916990930150405.
[I 2024-12-04 20:13:10,113] Trial 1015 finished with value: 0.3592104342503315 and parameters: {'kernel_type': 'Matern', 'length_scale': 152.5906294213192, 'noise_level': 0.0021033062637893954, 'constant_value': 12690.049222344112, 'nu': 0.5}. Best is trial 881 with value: 0.35916990930150405.
[I 2024-12-04 20:13:12,430] Trial 1016 finished with value: 0.4195658501671533 and parameters: {'kernel_type': 'Matern', 'length_scale': 0.9814419367973252, 'noise_level': 0.025961446833898994, 'constant_value': 1680.1357438975679, 'nu': 2.5}. Best is trial 881 with value: 0.35916990930150405.
[I 2024-12-04 20:13:14,572] Trial 1017 finished with value: 0.35921121584040727 and parameters: {'kernel_type': 'Matern', 'length_scale': 24.704692966195104, 'noise_level': 0.5890425369254658, 'constant_value': 5.178123805990293, 'nu': 0.5}. Best is trial 881 with value: 0.35916990930150405.
[I 2024-12-04 20:13:15,233] Trial 1018 finished with value: 0.3592112311228039 and parameters: {'kernel_type': 'Matern', 'length_scale': 749.8412269763216, 'noise_level': 0.0019275954728936687, 'constant_value': 3187.8786956224762, 'nu': 0.5}. Best is trial 881 with value: 0.35916990930150405.
[I 2024-12-04 20:13:19,400] Trial 1020 finished with value: 1.0916567048549883 and parameters: {'kernel_type': 'Matern', 'length_scale': 26.751541351907655, 'noise_level': 0.006178633967047422, 'constant_value': 2828.896738644622, 'nu': 0.5}. Best is trial 881 with value: 0.35916990930150405.
[I 2024-12-04 20:13:23,817] Trial 1019 finished with value: 0.3592112250031992 and parameters: {'kernel_type': 'Matern', 'length_scale': 4.734784536944479, 'noise_level': 0.009405693967641798, 'constant_value': 670.6544922167667, 'nu': 0.5}. Best is trial 881 with value: 0.35916990930150405.
[I 2024-12-04 20:13:23,897] Trial 1021 finished with value: 1.0624161070838032 and parameters: {'kernel_type': 'RBF', 'length_scale': 0.16733437555162003, 'noise_level': 0.0005104140379644234, 'constant_value': 2710.753408452035, 'nu': 0.5}. Best is trial 881 with value: 0.35916990930150405.
[I 2024-12-04 20:13:26,892] Trial 1022 finished with value: 0.3592115085380672 and parameters: {'kernel_type': 'Matern', 'length_scale': 57.164878992556126, 'noise_level': 8.555220211079354e-05, 'constant_value': 9298.859341091655, 'nu': 0.5}. Best is trial 881 with value: 0.35916990930150405.
[I 2024-12-04 20:13:29,151] Trial 1023 finished with value: 0.35921124218573697 and parameters: {'kernel_type': 'Matern', 'length_scale': 376.0463154811415, 'noise_level': 0.0023428119878580703, 'constant_value': 34889.047820158514, 'nu': 0.5}. Best is trial 881 with value: 0.35916990930150405.
[I 2024-12-04 20:13:29,385] Trial 1024 finished with value: 0.35921128165333605 and parameters: {'kernel_type': 'Matern', 'length_scale': 472.8695305051123, 'noise_level': 0.0033640955633129324, 'constant_value': 8164.359617638929, 'nu': 0.5}. Best is trial 881 with value: 0.35916990930150405.
[I 2024-12-04 20:13:34,260] Trial 1027 finished with value: 0.3592110836505302 and parameters: {'kernel_type': 'Matern', 'length_scale': 6.5220186628085814, 'noise_level': 7.577845905478903e-05, 'constant_value': 2876.3280045596894, 'nu': 0.5}. Best is trial 881 with value: 0.35916990930150405.
[I 2024-12-04 20:13:34,961] Trial 1026 finished with value: 0.3592112747681028 and parameters: {'kernel_type': 'Matern', 'length_scale': 572.9293419691265, 'noise_level': 6.174532200446548e-05, 'constant_value': 909.924366914459, 'nu': 0.5}. Best is trial 881 with value: 0.35916990930150405.
[I 2024-12-04 20:13:35,117] Trial 1025 finished with value: 0.42868335475081026 and parameters: {'kernel_type': 'RBF', 'length_scale': 57167.11528645218, 'noise_level': 0.004416376803987841, 'constant_value': 0.3048182792690979, 'nu': 0.5}. Best is trial 881 with value: 0.35916990930150405.
[I 2024-12-04 20:13:39,785] Trial 1028 finished with value: 0.359211236437726 and parameters: {'kernel_type': 'Matern', 'length_scale': 80.15956077920254, 'noise_level': 0.020129200851185487, 'constant_value': 7619.688041064917, 'nu': 0.5}. Best is trial 881 with value: 0.35916990930150405.
[I 2024-12-04 20:13:40,507] Trial 1030 finished with value: 0.35921133734697097 and parameters: {'kernel_type': 'Matern', 'length_scale': 88.78046281019067, 'noise_level': 0.0004994612619683217, 'constant_value': 59555.65026537295, 'nu': 0.5}. Best is trial 881 with value: 0.35916990930150405.
[I 2024-12-04 20:13:41,231] Trial 1029 finished with value: 0.3592114285736791 and parameters: {'kernel_type': 'Matern', 'length_scale': 10517.552061450258, 'noise_level': 0.002070151753872844, 'constant_value': 124.8450862654318, 'nu': 0.5}. Best is trial 881 with value: 0.35916990930150405.
[I 2024-12-04 20:13:46,062] Trial 1031 finished with value: 0.359210716342081 and parameters: {'kernel_type': 'Matern', 'length_scale': 688.9769896398229, 'noise_level': 8.820588901224358e-05, 'constant_value': 6.931442005151883, 'nu': 0.5}. Best is trial 881 with value: 0.35916990930150405.
[I 2024-12-04 20:13:46,572] Trial 1032 finished with value: 0.35921124857081005 and parameters: {'kernel_type': 'Matern', 'length_scale': 28.440679893206653, 'noise_level': 0.0077803753911722924, 'constant_value': 8937.042794875717, 'nu': 0.5}. Best is trial 881 with value: 0.35916990930150405.
[I 2024-12-04 20:13:47,110] Trial 1033 finished with value: 1.06241611728126 and parameters: {'kernel_type': 'Matern', 'length_scale': 37.58495402572342, 'noise_level': 3.1564953459022423e-06, 'constant_value': 1.2841433988300552, 'nu': 1.5}. Best is trial 881 with value: 0.35916990930150405.
[I 2024-12-04 20:13:49,709] Trial 1035 finished with value: 1.0916567275758855 and parameters: {'kernel_type': 'RBF', 'length_scale': 0.6064400169516213, 'noise_level': 5.925892068140865e-05, 'constant_value': 19246.272967375033, 'nu': 1.5}. Best is trial 881 with value: 0.35916990930150405.
[I 2024-12-04 20:13:51,287] Trial 1034 finished with value: 0.35921123631250457 and parameters: {'kernel_type': 'Matern', 'length_scale': 2659.033376060546, 'noise_level': 0.02029244445445509, 'constant_value': 938.8497752083127, 'nu': 0.5}. Best is trial 881 with value: 0.35916990930150405.
[I 2024-12-04 20:13:51,775] Trial 1036 finished with value: 0.35921042530301234 and parameters: {'kernel_type': 'Matern', 'length_scale': 1656.243607199223, 'noise_level': 0.10750446002548338, 'constant_value': 81.03932701458733, 'nu': 0.5}. Best is trial 881 with value: 0.35916990930150405.
[I 2024-12-04 20:13:56,662] Trial 1037 finished with value: 0.3592112361853798 and parameters: {'kernel_type': 'Matern', 'length_scale': 18.746107947397157, 'noise_level': 0.012524766427499164, 'constant_value': 20889.280968993295, 'nu': 0.5}. Best is trial 881 with value: 0.35916990930150405.
[I 2024-12-04 20:13:56,747] Trial 1038 finished with value: 0.4286836761598235 and parameters: {'kernel_type': 'RBF', 'length_scale': 394.61885622858443, 'noise_level': 0.016730779627832124, 'constant_value': 686.3346095733567, 'nu': 0.5}. Best is trial 881 with value: 0.35916990930150405.
[I 2024-12-04 20:14:01,555] Trial 1041 finished with value: 1.0624161178545743 and parameters: {'kernel_type': 'Matern', 'length_scale': 0.0022982881756362147, 'noise_level': 0.0005100079514938986, 'constant_value': 0.01373955174762094, 'nu': 1.5}. Best is trial 881 with value: 0.35916990930150405.
[I 2024-12-04 20:14:02,209] Trial 1040 finished with value: 0.35921124140480126 and parameters: {'kernel_type': 'Matern', 'length_scale': 540.3991240249784, 'noise_level': 0.10637347392493379, 'constant_value': 163.3245699118931, 'nu': 0.5}. Best is trial 881 with value: 0.35916990930150405.
[I 2024-12-04 20:14:03,974] Trial 1039 finished with value: 1.0624161172664408 and parameters: {'kernel_type': 'Matern', 'length_scale': 9301.402561916691, 'noise_level': 3.319474536570062e-05, 'constant_value': 1.0481914201060119e-06, 'nu': 1.5}. Best is trial 881 with value: 0.35916990930150405.
[I 2024-12-04 20:14:07,128] Trial 1042 finished with value: 0.3592112197590976 and parameters: {'kernel_type': 'Matern', 'length_scale': 20630.430431397876, 'noise_level': 0.02745471152459652, 'constant_value': 977.7341524745896, 'nu': 0.5}. Best is trial 881 with value: 0.35916990930150405.
[I 2024-12-04 20:14:07,377] Trial 1043 finished with value: 0.3592124738671451 and parameters: {'kernel_type': 'Matern', 'length_scale': 835.3445695031696, 'noise_level': 0.03619128444481708, 'constant_value': 556.0919759820124, 'nu': 0.5}. Best is trial 881 with value: 0.35916990930150405.
[I 2024-12-04 20:14:09,801] Trial 1044 finished with value: 1.0624161171858968 and parameters: {'kernel_type': 'Matern', 'length_scale': 35716.79349179758, 'noise_level': 0.024222140146573166, 'constant_value': 1.5411414127628595, 'nu': 0.5}. Best is trial 881 with value: 0.35916990930150405.
[I 2024-12-04 20:14:12,179] Trial 1045 finished with value: 0.35921171344973385 and parameters: {'kernel_type': 'Matern', 'length_scale': 11599.513021260065, 'noise_level': 0.07943015487093996, 'constant_value': 187.00257419315233, 'nu': 0.5}. Best is trial 881 with value: 0.35916990930150405.
[I 2024-12-04 20:14:14,759] Trial 1046 finished with value: 1.0624161172799915 and parameters: {'kernel_type': 'RBF', 'length_scale': 0.022337177414450234, 'noise_level': 0.0013843147222011372, 'constant_value': 1.7163420217162348e-05, 'nu': 0.5}. Best is trial 881 with value: 0.35916990930150405.
[I 2024-12-04 20:14:15,127] Trial 1047 finished with value: 0.359211241259063 and parameters: {'kernel_type': 'Matern', 'length_scale': 1106.168594830651, 'noise_level': 0.26352947522609954, 'constant_value': 820.4797910943317, 'nu': 0.5}. Best is trial 881 with value: 0.35916990930150405.
[I 2024-12-04 20:14:17,674] Trial 1048 finished with value: 0.3592212604443737 and parameters: {'kernel_type': 'Matern', 'length_scale': 196.46979354499686, 'noise_level': 0.18079758408501925, 'constant_value': 23191.189350367466, 'nu': 0.5}. Best is trial 881 with value: 0.35916990930150405.
[I 2024-12-04 20:14:18,071] Trial 1049 finished with value: 1.06241606898137 and parameters: {'kernel_type': 'Matern', 'length_scale': 0.06135194758400803, 'noise_level': 0.9886637395499466, 'constant_value': 188.25246420884963, 'nu': 0.5}. Best is trial 881 with value: 0.35916990930150405.
[I 2024-12-04 20:14:21,054] Trial 1050 finished with value: 0.35921123463055343 and parameters: {'kernel_type': 'Matern', 'length_scale': 33844.05845717888, 'noise_level': 0.4351884477617949, 'constant_value': 2332.564430914866, 'nu': 0.5}. Best is trial 881 with value: 0.35916990930150405.
[I 2024-12-04 20:14:23,880] Trial 1052 finished with value: 0.35920911891631435 and parameters: {'kernel_type': 'Matern', 'length_scale': 3.0555834669267776, 'noise_level': 0.008629935090062872, 'constant_value': 4915.997055380594, 'nu': 0.5}. Best is trial 881 with value: 0.35916990930150405.
[I 2024-12-04 20:14:25,009] Trial 1051 finished with value: 0.3592129229581308 and parameters: {'kernel_type': 'Matern', 'length_scale': 0.10507276729328041, 'noise_level': 0.0002399914265860391, 'constant_value': 495.31854649434746, 'nu': 0.5}. Best is trial 881 with value: 0.35916990930150405.
[I 2024-12-04 20:14:26,627] Trial 1053 finished with value: 0.35921081729294324 and parameters: {'kernel_type': 'Matern', 'length_scale': 1.024965744676645, 'noise_level': 0.009568202964329163, 'constant_value': 739.3265494730882, 'nu': 0.5}. Best is trial 881 with value: 0.35916990930150405.
[I 2024-12-04 20:14:29,129] Trial 1055 finished with value: 0.35921199737653414 and parameters: {'kernel_type': 'Matern', 'length_scale': 0.950971321104008, 'noise_level': 0.0017912245984670555, 'constant_value': 1129.3377257340253, 'nu': 0.5}. Best is trial 881 with value: 0.35916990930150405.
[I 2024-12-04 20:14:29,159] Trial 1054 finished with value: 0.41956608309709653 and parameters: {'kernel_type': 'Matern', 'length_scale': 0.24127560679727836, 'noise_level': 2.130668450805375e-06, 'constant_value': 0.5844417435606328, 'nu': 2.5}. Best is trial 881 with value: 0.35916990930150405.
[I 2024-12-04 20:14:31,580] Trial 1056 finished with value: 0.3592120239121685 and parameters: {'kernel_type': 'Matern', 'length_scale': 0.49010755747766954, 'noise_level': 0.03161607066529477, 'constant_value': 361.8523688417237, 'nu': 0.5}. Best is trial 881 with value: 0.35916990930150405.
[I 2024-12-04 20:14:32,965] Trial 1058 finished with value: 1.0916558493833755 and parameters: {'kernel_type': 'Matern', 'length_scale': 0.02763713333534272, 'noise_level': 7.918484092342578e-05, 'constant_value': 53661.90724043837, 'nu': 0.5}. Best is trial 881 with value: 0.35916990930150405.
[I 2024-12-04 20:14:36,433] Trial 1059 finished with value: 0.3592116258048658 and parameters: {'kernel_type': 'Matern', 'length_scale': 55.83451479887644, 'noise_level': 0.6831893014198331, 'constant_value': 461.2765919700233, 'nu': 0.5}. Best is trial 881 with value: 0.35916990930150405.
[I 2024-12-04 20:14:38,675] Trial 1060 finished with value: 0.35921165817005984 and parameters: {'kernel_type': 'Matern', 'length_scale': 0.3775299520156901, 'noise_level': 0.0022823523644932044, 'constant_value': 1515.9390340684677, 'nu': 0.5}. Best is trial 881 with value: 0.35916990930150405.
[I 2024-12-04 20:14:39,598] Trial 1057 finished with value: 0.3592112407965596 and parameters: {'kernel_type': 'Matern', 'length_scale': 0.36863315849443246, 'noise_level': 0.004056940068232292, 'constant_value': 65429.38325502803, 'nu': 0.5}. Best is trial 881 with value: 0.35916990930150405.
[I 2024-12-04 20:14:41,724] Trial 1061 finished with value: 0.3592113059794866 and parameters: {'kernel_type': 'Matern', 'length_scale': 2.6858810857587287, 'noise_level': 0.1631769446055685, 'constant_value': 5658.81395608876, 'nu': 0.5}. Best is trial 881 with value: 0.35916990930150405.
[I 2024-12-04 20:14:43,473] Trial 1062 finished with value: 0.3592112302215795 and parameters: {'kernel_type': 'Matern', 'length_scale': 145.06779107767886, 'noise_level': 0.00747740552457723, 'constant_value': 48.84162212399882, 'nu': 0.5}. Best is trial 881 with value: 0.35916990930150405.
[I 2024-12-04 20:14:44,558] Trial 1063 finished with value: 0.35921103738274124 and parameters: {'kernel_type': 'Matern', 'length_scale': 12.46486343012895, 'noise_level': 0.2674846948725836, 'constant_value': 189.02044407099774, 'nu': 0.5}. Best is trial 881 with value: 0.35916990930150405.
[I 2024-12-04 20:14:47,934] Trial 1064 finished with value: 0.3592112903935775 and parameters: {'kernel_type': 'Matern', 'length_scale': 302.8016236960733, 'noise_level': 0.0015830808399722135, 'constant_value': 7.192349653322752, 'nu': 0.5}. Best is trial 881 with value: 0.35916990930150405.
[I 2024-12-04 20:14:50,156] Trial 1066 finished with value: 1.0624161175535942 and parameters: {'kernel_type': 'Matern', 'length_scale': 0.017130331088990633, 'noise_level': 0.019028157915225215, 'constant_value': 516.8503472828543, 'nu': 0.5}. Best is trial 881 with value: 0.35916990930150405.
[I 2024-12-04 20:14:50,477] Trial 1065 finished with value: 0.3592115691851002 and parameters: {'kernel_type': 'Matern', 'length_scale': 4.78309695119319, 'noise_level': 0.09956254780865563, 'constant_value': 269.5980600659657, 'nu': 0.5}. Best is trial 881 with value: 0.35916990930150405.
[I 2024-12-04 20:14:55,701] Trial 1069 finished with value: 0.35921152715775867 and parameters: {'kernel_type': 'Matern', 'length_scale': 4.2303427566721545, 'noise_level': 0.019949986497440175, 'constant_value': 20914.452166551757, 'nu': 0.5}. Best is trial 881 with value: 0.35916990930150405.
[I 2024-12-04 20:14:56,549] Trial 1067 finished with value: 0.3592113267102972 and parameters: {'kernel_type': 'Matern', 'length_scale': 0.12288075759940584, 'noise_level': 0.00016092091422354696, 'constant_value': 25.58094961822076, 'nu': 0.5}. Best is trial 881 with value: 0.35916990930150405.
[I 2024-12-04 20:14:56,578] Trial 1068 finished with value: 0.35921115190887454 and parameters: {'kernel_type': 'Matern', 'length_scale': 7.612194793958553, 'noise_level': 0.009491448239622861, 'constant_value': 481.02438632927425, 'nu': 0.5}. Best is trial 881 with value: 0.35916990930150405.
[I 2024-12-04 20:15:00,994] Trial 1070 finished with value: 0.3592111776833711 and parameters: {'kernel_type': 'Matern', 'length_scale': 284.7467934582105, 'noise_level': 0.6843173276968825, 'constant_value': 2199.407733909496, 'nu': 0.5}. Best is trial 881 with value: 0.35916990930150405.
[I 2024-12-04 20:15:01,593] Trial 1071 finished with value: 0.3592109477187676 and parameters: {'kernel_type': 'Matern', 'length_scale': 378.57759312348327, 'noise_level': 0.041013886633599284, 'constant_value': 40.18485155604275, 'nu': 0.5}. Best is trial 881 with value: 0.35916990930150405.
[I 2024-12-04 20:15:02,220] Trial 1072 finished with value: 0.35921118380051076 and parameters: {'kernel_type': 'Matern', 'length_scale': 1167.05650147658, 'noise_level': 0.0017335653325367057, 'constant_value': 5.607056253847593, 'nu': 0.5}. Best is trial 881 with value: 0.35916990930150405.
[I 2024-12-04 20:15:04,657] Trial 1074 finished with value: 1.0916558492113404 and parameters: {'kernel_type': 'Matern', 'length_scale': 0.07558167167748711, 'noise_level': 0.007327898247493849, 'constant_value': 3031.9832958218726, 'nu': 0.5}. Best is trial 881 with value: 0.35916990930150405.
[I 2024-12-04 20:15:05,960] Trial 1073 finished with value: 1.0624161172772661 and parameters: {'kernel_type': 'Matern', 'length_scale': 793.0274740823174, 'noise_level': 2.7805338480250456e-05, 'constant_value': 0.009294218386955301, 'nu': 0.5}. Best is trial 881 with value: 0.35916990930150405.
[I 2024-12-04 20:15:07,870] Trial 1075 finished with value: 0.35921123058229487 and parameters: {'kernel_type': 'Matern', 'length_scale': 0.31633412982461584, 'noise_level': 0.5330472502780226, 'constant_value': 907.4921298303334, 'nu': 0.5}. Best is trial 881 with value: 0.35916990930150405.
[I 2024-12-04 20:15:10,164] Trial 1076 finished with value: 0.42868339939067335 and parameters: {'kernel_type': 'RBF', 'length_scale': 292.276202122957, 'noise_level': 0.015094017943212192, 'constant_value': 19815.134590605485, 'nu': 1.5}. Best is trial 881 with value: 0.35916990930150405.
[I 2024-12-04 20:15:10,798] Trial 1077 finished with value: 0.35921388091088025 and parameters: {'kernel_type': 'Matern', 'length_scale': 5.646739609215779, 'noise_level': 7.980899663584401e-05, 'constant_value': 2.851960524768764, 'nu': 0.5}. Best is trial 881 with value: 0.35916990930150405.
[I 2024-12-04 20:15:12,990] Trial 1078 finished with value: 0.3592107219545967 and parameters: {'kernel_type': 'Matern', 'length_scale': 520.075244185038, 'noise_level': 0.07024183002509268, 'constant_value': 2.0076675448033, 'nu': 0.5}. Best is trial 881 with value: 0.35916990930150405.
