[I 2024-12-04 14:55:55,528] Trial 438 finished with value: 0.4215473581189675 and parameters: {'n_estimators': 640, 'max_depth': 37, 'min_samples_split': 2, 'min_samples_leaf': 1, 'max_features': None, 'bootstrap': True, 'criterion': 'squared_error'}. Best is trial 223 with value: 0.4188398890260366.
[I 2024-12-04 14:55:55,843] Trial 435 finished with value: 0.42122530911686756 and parameters: {'n_estimators': 639, 'max_depth': 39, 'min_samples_split': 2, 'min_samples_leaf': 1, 'max_features': None, 'bootstrap': True, 'criterion': 'squared_error'}. Best is trial 223 with value: 0.4188398890260366.
[I 2024-12-04 14:55:58,061] Trial 437 finished with value: 0.46484217709846465 and parameters: {'n_estimators': 859, 'max_depth': 43, 'min_samples_split': 2, 'min_samples_leaf': 2, 'max_features': None, 'bootstrap': True, 'criterion': 'squared_error'}. Best is trial 223 with value: 0.4188398890260366.
[I 2024-12-04 14:56:04,628] Trial 427 finished with value: 0.42055901171602483 and parameters: {'n_estimators': 992, 'max_depth': 42, 'min_samples_split': 2, 'min_samples_leaf': 1, 'max_features': None, 'bootstrap': True, 'criterion': 'squared_error'}. Best is trial 223 with value: 0.4188398890260366.
[I 2024-12-04 14:56:06,457] Trial 436 finished with value: 0.42002478192563836 and parameters: {'n_estimators': 940, 'max_depth': 43, 'min_samples_split': 2, 'min_samples_leaf': 1, 'max_features': None, 'bootstrap': True, 'criterion': 'squared_error'}. Best is trial 223 with value: 0.4188398890260366.
[I 2024-12-04 14:56:08,085] Trial 449 finished with value: 1.0729728585885012 and parameters: {'n_estimators': 638, 'max_depth': 14, 'min_samples_split': 8, 'min_samples_leaf': 15, 'max_features': 'log2', 'bootstrap': False, 'criterion': 'squared_error'}. Best is trial 223 with value: 0.4188398890260366.
[I 2024-12-04 14:56:08,555] Trial 441 finished with value: 0.43161331444445844 and parameters: {'n_estimators': 873, 'max_depth': 44, 'min_samples_split': 4, 'min_samples_leaf': 1, 'max_features': None, 'bootstrap': True, 'criterion': 'squared_error'}. Best is trial 223 with value: 0.4188398890260366.
[I 2024-12-04 14:56:09,054] Trial 442 finished with value: 0.4642471502105668 and parameters: {'n_estimators': 718, 'max_depth': 43, 'min_samples_split': 2, 'min_samples_leaf': 2, 'max_features': None, 'bootstrap': True, 'criterion': 'squared_error'}. Best is trial 223 with value: 0.4188398890260366.
[I 2024-12-04 14:56:09,324] Trial 432 finished with value: 0.42499513627480706 and parameters: {'n_estimators': 827, 'max_depth': 33, 'min_samples_split': 3, 'min_samples_leaf': 1, 'max_features': None, 'bootstrap': True, 'criterion': 'squared_error'}. Best is trial 223 with value: 0.4188398890260366.
[I 2024-12-04 14:56:11,293] Trial 440 finished with value: 0.4213772487484575 and parameters: {'n_estimators': 780, 'max_depth': 44, 'min_samples_split': 2, 'min_samples_leaf': 1, 'max_features': None, 'bootstrap': True, 'criterion': 'squared_error'}. Best is trial 223 with value: 0.4188398890260366.
[I 2024-12-04 14:56:11,311] Trial 444 finished with value: 0.5431875581407184 and parameters: {'n_estimators': 876, 'max_depth': 35, 'min_samples_split': 4, 'min_samples_leaf': 1, 'max_features': 'sqrt', 'bootstrap': True, 'criterion': 'squared_error'}. Best is trial 223 with value: 0.4188398890260366.
[I 2024-12-04 14:56:14,139] Trial 453 finished with value: 0.9268407116634416 and parameters: {'n_estimators': 488, 'max_depth': 15, 'min_samples_split': 4, 'min_samples_leaf': 7, 'max_features': 'sqrt', 'bootstrap': False, 'criterion': 'absolute_error'}. Best is trial 223 with value: 0.4188398890260366.
[I 2024-12-04 14:56:19,566] Trial 455 finished with value: 0.6242521178274328 and parameters: {'n_estimators': 870, 'max_depth': 39, 'min_samples_split': 2, 'min_samples_leaf': 1, 'max_features': 'log2', 'bootstrap': False, 'criterion': 'squared_error'}. Best is trial 223 with value: 0.4188398890260366.
[I 2024-12-04 14:56:21,641] Trial 446 finished with value: 0.4197373474289544 and parameters: {'n_estimators': 672, 'max_depth': 40, 'min_samples_split': 2, 'min_samples_leaf': 1, 'max_features': None, 'bootstrap': True, 'criterion': 'squared_error'}. Best is trial 223 with value: 0.4188398890260366.
[I 2024-12-04 14:56:22,422] Trial 456 finished with value: 0.8715974475351934 and parameters: {'n_estimators': 975, 'max_depth': 33, 'min_samples_split': 16, 'min_samples_leaf': 6, 'max_features': 'sqrt', 'bootstrap': False, 'criterion': 'squared_error'}. Best is trial 223 with value: 0.4188398890260366.
[I 2024-12-04 14:56:25,857] Trial 445 finished with value: 0.42263108558497997 and parameters: {'n_estimators': 871, 'max_depth': 30, 'min_samples_split': 2, 'min_samples_leaf': 1, 'max_features': None, 'bootstrap': True, 'criterion': 'squared_error'}. Best is trial 223 with value: 0.4188398890260366.
[I 2024-12-04 14:56:27,638] Trial 448 finished with value: 0.4206170876535093 and parameters: {'n_estimators': 845, 'max_depth': 36, 'min_samples_split': 2, 'min_samples_leaf': 1, 'max_features': None, 'bootstrap': True, 'criterion': 'squared_error'}. Best is trial 223 with value: 0.4188398890260366.
[I 2024-12-04 14:56:31,516] Trial 466 finished with value: 0.9002262048648128 and parameters: {'n_estimators': 401, 'max_depth': 29, 'min_samples_split': 18, 'min_samples_leaf': 2, 'max_features': 'log2', 'bootstrap': False, 'criterion': 'squared_error'}. Best is trial 223 with value: 0.4188398890260366.
[I 2024-12-04 14:56:31,666] Trial 452 finished with value: 0.43241997244754055 and parameters: {'n_estimators': 671, 'max_depth': 43, 'min_samples_split': 4, 'min_samples_leaf': 1, 'max_features': None, 'bootstrap': True, 'criterion': 'squared_error'}. Best is trial 223 with value: 0.4188398890260366.
[I 2024-12-04 14:56:32,732] Trial 454 finished with value: 0.4656838770517556 and parameters: {'n_estimators': 946, 'max_depth': 37, 'min_samples_split': 2, 'min_samples_leaf': 2, 'max_features': None, 'bootstrap': True, 'criterion': 'squared_error'}. Best is trial 223 with value: 0.4188398890260366.
[I 2024-12-04 14:56:34,861] Trial 462 finished with value: 0.6191324096150345 and parameters: {'n_estimators': 811, 'max_depth': 29, 'min_samples_split': 38, 'min_samples_leaf': 1, 'max_features': 'sqrt', 'bootstrap': False, 'criterion': 'squared_error'}. Best is trial 223 with value: 0.4188398890260366.
[I 2024-12-04 14:56:36,223] Trial 450 finished with value: 0.4193326244953531 and parameters: {'n_estimators': 835, 'max_depth': 41, 'min_samples_split': 2, 'min_samples_leaf': 1, 'max_features': None, 'bootstrap': True, 'criterion': 'squared_error'}. Best is trial 223 with value: 0.4188398890260366.
[I 2024-12-04 14:56:37,318] Trial 457 finished with value: 0.9337024198249887 and parameters: {'n_estimators': 612, 'max_depth': 6, 'min_samples_split': 6, 'min_samples_leaf': 1, 'max_features': 'sqrt', 'bootstrap': True, 'criterion': 'absolute_error'}. Best is trial 223 with value: 0.4188398890260366.
[I 2024-12-04 14:56:37,944] Trial 468 finished with value: 0.8058621547206717 and parameters: {'n_estimators': 863, 'max_depth': 23, 'min_samples_split': 19, 'min_samples_leaf': 1, 'max_features': 'log2', 'bootstrap': False, 'criterion': 'squared_error'}. Best is trial 223 with value: 0.4188398890260366.
[I 2024-12-04 14:56:37,947] Trial 469 finished with value: 1.0512301618438988 and parameters: {'n_estimators': 775, 'max_depth': 20, 'min_samples_split': 2, 'min_samples_leaf': 9, 'max_features': 'log2', 'bootstrap': False, 'criterion': 'absolute_error'}. Best is trial 223 with value: 0.4188398890260366.
[I 2024-12-04 14:56:37,958] Trial 443 finished with value: 0.5874907270364377 and parameters: {'n_estimators': 649, 'max_depth': 9, 'min_samples_split': 5, 'min_samples_leaf': 3, 'max_features': None, 'bootstrap': True, 'criterion': 'absolute_error'}. Best is trial 223 with value: 0.4188398890260366.
[I 2024-12-04 14:56:38,312] Trial 451 finished with value: 0.42111072275132494 and parameters: {'n_estimators': 947, 'max_depth': 37, 'min_samples_split': 2, 'min_samples_leaf': 1, 'max_features': None, 'bootstrap': True, 'criterion': 'squared_error'}. Best is trial 223 with value: 0.4188398890260366.
[I 2024-12-04 14:56:38,973] Trial 467 finished with value: 1.0280552282275421 and parameters: {'n_estimators': 601, 'max_depth': 6, 'min_samples_split': 22, 'min_samples_leaf': 3, 'max_features': 'log2', 'bootstrap': True, 'criterion': 'absolute_error'}. Best is trial 223 with value: 0.4188398890260366.
[I 2024-12-04 14:56:44,049] Trial 463 finished with value: 0.4191573674417634 and parameters: {'n_estimators': 738, 'max_depth': 41, 'min_samples_split': 2, 'min_samples_leaf': 1, 'max_features': None, 'bootstrap': True, 'criterion': 'squared_error'}. Best is trial 223 with value: 0.4188398890260366.
[I 2024-12-04 14:56:45,624] Trial 459 finished with value: 0.46526879558448764 and parameters: {'n_estimators': 999, 'max_depth': 46, 'min_samples_split': 2, 'min_samples_leaf': 2, 'max_features': None, 'bootstrap': True, 'criterion': 'squared_error'}. Best is trial 223 with value: 0.4188398890260366.
[I 2024-12-04 14:56:45,939] Trial 460 finished with value: 0.42137095004635733 and parameters: {'n_estimators': 776, 'max_depth': 44, 'min_samples_split': 2, 'min_samples_leaf': 1, 'max_features': None, 'bootstrap': True, 'criterion': 'squared_error'}. Best is trial 223 with value: 0.4188398890260366.
[I 2024-12-04 14:56:47,771] Trial 402 finished with value: 0.4293944083487785 and parameters: {'n_estimators': 976, 'max_depth': 36, 'min_samples_split': 2, 'min_samples_leaf': 1, 'max_features': None, 'bootstrap': True, 'criterion': 'absolute_error'}. Best is trial 223 with value: 0.4188398890260366.
[I 2024-12-04 14:56:48,941] Trial 447 finished with value: 0.4661444396147935 and parameters: {'n_estimators': 666, 'max_depth': 46, 'min_samples_split': 7, 'min_samples_leaf': 2, 'max_features': None, 'bootstrap': True, 'criterion': 'absolute_error'}. Best is trial 223 with value: 0.4188398890260366.
[I 2024-12-04 14:56:49,852] Trial 458 finished with value: 0.4206935064185848 and parameters: {'n_estimators': 900, 'max_depth': 44, 'min_samples_split': 2, 'min_samples_leaf': 1, 'max_features': None, 'bootstrap': True, 'criterion': 'squared_error'}. Best is trial 223 with value: 0.4188398890260366.
[I 2024-12-04 14:56:53,720] Trial 471 finished with value: 0.5933496078716246 and parameters: {'n_estimators': 720, 'max_depth': 25, 'min_samples_split': 2, 'min_samples_leaf': 2, 'max_features': None, 'bootstrap': False, 'criterion': 'squared_error'}. Best is trial 223 with value: 0.4188398890260366.
[I 2024-12-04 14:56:53,734] Trial 476 finished with value: 0.915842463843004 and parameters: {'n_estimators': 873, 'max_depth': 6, 'min_samples_split': 6, 'min_samples_leaf': 2, 'max_features': 'sqrt', 'bootstrap': False, 'criterion': 'squared_error'}. Best is trial 223 with value: 0.4188398890260366.
[I 2024-12-04 14:56:54,133] Trial 461 finished with value: 0.4319018820839396 and parameters: {'n_estimators': 880, 'max_depth': 40, 'min_samples_split': 4, 'min_samples_leaf': 1, 'max_features': None, 'bootstrap': True, 'criterion': 'squared_error'}. Best is trial 223 with value: 0.4188398890260366.
[I 2024-12-04 14:56:55,473] Trial 464 finished with value: 0.42110800465941817 and parameters: {'n_estimators': 946, 'max_depth': 34, 'min_samples_split': 2, 'min_samples_leaf': 1, 'max_features': None, 'bootstrap': True, 'criterion': 'squared_error'}. Best is trial 223 with value: 0.4188398890260366.
[I 2024-12-04 14:56:55,507] Trial 465 finished with value: 0.420645530032024 and parameters: {'n_estimators': 977, 'max_depth': 45, 'min_samples_split': 2, 'min_samples_leaf': 1, 'max_features': None, 'bootstrap': True, 'criterion': 'squared_error'}. Best is trial 223 with value: 0.4188398890260366.
[I 2024-12-04 14:56:55,657] Trial 472 finished with value: 0.6041990613442244 and parameters: {'n_estimators': 805, 'max_depth': 45, 'min_samples_split': 2, 'min_samples_leaf': 1, 'max_features': 'log2', 'bootstrap': True, 'criterion': 'squared_error'}. Best is trial 223 with value: 0.4188398890260366.
[I 2024-12-04 14:56:56,405] Trial 409 finished with value: 0.425665670277347 and parameters: {'n_estimators': 950, 'max_depth': 50, 'min_samples_split': 3, 'min_samples_leaf': 1, 'max_features': None, 'bootstrap': True, 'criterion': 'absolute_error'}. Best is trial 223 with value: 0.4188398890260366.
[I 2024-12-04 14:56:59,075] Trial 489 finished with value: 1.0645119799835772 and parameters: {'n_estimators': 133, 'max_depth': 38, 'min_samples_split': 3, 'min_samples_leaf': 8, 'max_features': 'log2', 'bootstrap': True, 'criterion': 'squared_error'}. Best is trial 223 with value: 0.4188398890260366.
[I 2024-12-04 14:57:07,949] Trial 493 finished with value: 1.0675590302206697 and parameters: {'n_estimators': 402, 'max_depth': 27, 'min_samples_split': 18, 'min_samples_leaf': 9, 'max_features': 'log2', 'bootstrap': True, 'criterion': 'squared_error'}. Best is trial 223 with value: 0.4188398890260366.
[I 2024-12-04 14:57:11,460] Trial 470 finished with value: 0.4194743902509635 and parameters: {'n_estimators': 924, 'max_depth': 39, 'min_samples_split': 2, 'min_samples_leaf': 1, 'max_features': None, 'bootstrap': True, 'criterion': 'squared_error'}. Best is trial 223 with value: 0.4188398890260366.
[I 2024-12-04 14:57:13,836] Trial 477 finished with value: 0.4215332877498694 and parameters: {'n_estimators': 719, 'max_depth': 47, 'min_samples_split': 2, 'min_samples_leaf': 1, 'max_features': None, 'bootstrap': True, 'criterion': 'squared_error'}. Best is trial 223 with value: 0.4188398890260366.
[I 2024-12-04 14:57:14,090] Trial 494 finished with value: 0.7743786440861608 and parameters: {'n_estimators': 714, 'max_depth': 50, 'min_samples_split': 6, 'min_samples_leaf': 4, 'max_features': 'sqrt', 'bootstrap': False, 'criterion': 'squared_error'}. Best is trial 223 with value: 0.4188398890260366.
[I 2024-12-04 14:57:14,095] Trial 486 finished with value: 0.9985200446895796 and parameters: {'n_estimators': 391, 'max_depth': 13, 'min_samples_split': 48, 'min_samples_leaf': 8, 'max_features': 'sqrt', 'bootstrap': True, 'criterion': 'absolute_error'}. Best is trial 223 with value: 0.4188398890260366.
[I 2024-12-04 14:57:14,438] Trial 484 finished with value: 0.4643514311052429 and parameters: {'n_estimators': 625, 'max_depth': 44, 'min_samples_split': 2, 'min_samples_leaf': 2, 'max_features': None, 'bootstrap': True, 'criterion': 'squared_error'}. Best is trial 223 with value: 0.4188398890260366.
[I 2024-12-04 14:57:15,977] Trial 480 finished with value: 0.4649962091133953 and parameters: {'n_estimators': 666, 'max_depth': 31, 'min_samples_split': 3, 'min_samples_leaf': 2, 'max_features': None, 'bootstrap': True, 'criterion': 'squared_error'}. Best is trial 223 with value: 0.4188398890260366.
[I 2024-12-04 14:57:18,833] Trial 481 finished with value: 0.422440005313191 and parameters: {'n_estimators': 657, 'max_depth': 46, 'min_samples_split': 2, 'min_samples_leaf': 1, 'max_features': None, 'bootstrap': True, 'criterion': 'squared_error'}. Best is trial 223 with value: 0.4188398890260366.
[I 2024-12-04 14:57:18,910] Trial 487 finished with value: 0.7026671759292235 and parameters: {'n_estimators': 667, 'max_depth': 18, 'min_samples_split': 3, 'min_samples_leaf': 1, 'max_features': 'sqrt', 'bootstrap': False, 'criterion': 'absolute_error'}. Best is trial 223 with value: 0.4188398890260366.
[I 2024-12-04 14:57:19,042] Trial 475 finished with value: 0.7352713380425256 and parameters: {'n_estimators': 853, 'max_depth': 41, 'min_samples_split': 28, 'min_samples_leaf': 11, 'max_features': None, 'bootstrap': False, 'criterion': 'absolute_error'}. Best is trial 223 with value: 0.4188398890260366.
[I 2024-12-04 14:57:19,589] Trial 483 finished with value: 0.4643253661870054 and parameters: {'n_estimators': 715, 'max_depth': 34, 'min_samples_split': 2, 'min_samples_leaf': 2, 'max_features': None, 'bootstrap': True, 'criterion': 'squared_error'}. Best is trial 223 with value: 0.4188398890260366.
[I 2024-12-04 14:57:20,297] Trial 500 finished with value: 0.6416467133799543 and parameters: {'n_estimators': 324, 'max_depth': 24, 'min_samples_split': 28, 'min_samples_leaf': 1, 'max_features': 'sqrt', 'bootstrap': False, 'criterion': 'squared_error'}. Best is trial 223 with value: 0.4188398890260366.
[I 2024-12-04 14:57:22,936] Trial 488 finished with value: 0.4192067733014413 and parameters: {'n_estimators': 610, 'max_depth': 40, 'min_samples_split': 2, 'min_samples_leaf': 1, 'max_features': None, 'bootstrap': True, 'criterion': 'squared_error'}. Best is trial 223 with value: 0.4188398890260366.
[I 2024-12-04 14:57:26,625] Trial 485 finished with value: 0.4209680818764141 and parameters: {'n_estimators': 686, 'max_depth': 38, 'min_samples_split': 2, 'min_samples_leaf': 1, 'max_features': None, 'bootstrap': True, 'criterion': 'squared_error'}. Best is trial 223 with value: 0.4188398890260366.
[I 2024-12-04 14:57:28,503] Trial 490 finished with value: 0.4207196009688982 and parameters: {'n_estimators': 715, 'max_depth': 43, 'min_samples_split': 2, 'min_samples_leaf': 1, 'max_features': None, 'bootstrap': True, 'criterion': 'squared_error'}. Best is trial 223 with value: 0.4188398890260366.
[I 2024-12-04 14:57:32,091] Trial 510 finished with value: 0.9370510806991443 and parameters: {'n_estimators': 202, 'max_depth': 31, 'min_samples_split': 22, 'min_samples_leaf': 8, 'max_features': 'sqrt', 'bootstrap': False, 'criterion': 'squared_error'}. Best is trial 223 with value: 0.4188398890260366.
[I 2024-12-04 14:57:34,670] Trial 482 finished with value: 0.46529230006531724 and parameters: {'n_estimators': 937, 'max_depth': 45, 'min_samples_split': 5, 'min_samples_leaf': 2, 'max_features': None, 'bootstrap': True, 'criterion': 'squared_error'}. Best is trial 223 with value: 0.4188398890260366.
[I 2024-12-04 14:57:35,221] Trial 502 finished with value: 0.8252651224240901 and parameters: {'n_estimators': 217, 'max_depth': 23, 'min_samples_split': 29, 'min_samples_leaf': 1, 'max_features': 'log2', 'bootstrap': True, 'criterion': 'squared_error'}. Best is trial 223 with value: 0.4188398890260366.
[I 2024-12-04 14:57:37,312] Trial 506 finished with value: 0.9659118187299426 and parameters: {'n_estimators': 994, 'max_depth': 20, 'min_samples_split': 6, 'min_samples_leaf': 10, 'max_features': 'sqrt', 'bootstrap': False, 'criterion': 'squared_error'}. Best is trial 223 with value: 0.4188398890260366.
[I 2024-12-04 14:57:40,330] Trial 497 finished with value: 0.7032768363293178 and parameters: {'n_estimators': 536, 'max_depth': 35, 'min_samples_split': 2, 'min_samples_leaf': 1, 'max_features': 'log2', 'bootstrap': True, 'criterion': 'absolute_error'}. Best is trial 223 with value: 0.4188398890260366.
[I 2024-12-04 14:57:42,573] Trial 473 finished with value: 0.6863741307555445 and parameters: {'n_estimators': 800, 'max_depth': 28, 'min_samples_split': 34, 'min_samples_leaf': 4, 'max_features': None, 'bootstrap': False, 'criterion': 'absolute_error'}. Best is trial 223 with value: 0.4188398890260366.
[I 2024-12-04 14:57:42,636] Trial 496 finished with value: 0.43176209836131346 and parameters: {'n_estimators': 788, 'max_depth': 37, 'min_samples_split': 4, 'min_samples_leaf': 1, 'max_features': None, 'bootstrap': True, 'criterion': 'squared_error'}. Best is trial 223 with value: 0.4188398890260366.
[I 2024-12-04 14:57:43,989] Trial 492 finished with value: 0.41983749157292993 and parameters: {'n_estimators': 795, 'max_depth': 39, 'min_samples_split': 2, 'min_samples_leaf': 1, 'max_features': None, 'bootstrap': True, 'criterion': 'squared_error'}. Best is trial 223 with value: 0.4188398890260366.
[I 2024-12-04 14:57:45,279] Trial 509 finished with value: 0.6330984163865044 and parameters: {'n_estimators': 284, 'max_depth': 40, 'min_samples_split': 9, 'min_samples_leaf': 4, 'max_features': None, 'bootstrap': False, 'criterion': 'squared_error'}. Best is trial 223 with value: 0.4188398890260366.
[I 2024-12-04 14:57:46,762] Trial 491 finished with value: 0.42078675892278194 and parameters: {'n_estimators': 758, 'max_depth': 43, 'min_samples_split': 2, 'min_samples_leaf': 1, 'max_features': None, 'bootstrap': True, 'criterion': 'squared_error'}. Best is trial 223 with value: 0.4188398890260366.
[I 2024-12-04 14:57:47,205] Trial 495 finished with value: 0.5274696963810755 and parameters: {'n_estimators': 850, 'max_depth': 42, 'min_samples_split': 2, 'min_samples_leaf': 1, 'max_features': None, 'bootstrap': False, 'criterion': 'squared_error'}. Best is trial 223 with value: 0.4188398890260366.
[I 2024-12-04 14:57:49,778] Trial 504 finished with value: 0.9627755787171431 and parameters: {'n_estimators': 803, 'max_depth': 15, 'min_samples_split': 11, 'min_samples_leaf': 6, 'max_features': 'sqrt', 'bootstrap': True, 'criterion': 'absolute_error'}. Best is trial 223 with value: 0.4188398890260366.
[I 2024-12-04 14:57:50,977] Trial 503 finished with value: 0.46530763355687776 and parameters: {'n_estimators': 779, 'max_depth': 48, 'min_samples_split': 2, 'min_samples_leaf': 2, 'max_features': None, 'bootstrap': True, 'criterion': 'squared_error'}. Best is trial 223 with value: 0.4188398890260366.
[I 2024-12-04 14:57:51,258] Trial 501 finished with value: 1.0057621551702023 and parameters: {'n_estimators': 958, 'max_depth': 16, 'min_samples_split': 3, 'min_samples_leaf': 9, 'max_features': 'sqrt', 'bootstrap': True, 'criterion': 'absolute_error'}. Best is trial 223 with value: 0.4188398890260366.
[I 2024-12-04 14:57:51,785] Trial 511 finished with value: 1.029760279008254 and parameters: {'n_estimators': 931, 'max_depth': 40, 'min_samples_split': 4, 'min_samples_leaf': 5, 'max_features': 'log2', 'bootstrap': False, 'criterion': 'absolute_error'}. Best is trial 223 with value: 0.4188398890260366.
