[I 2024-12-04 19:57:10,313] Trial 407 finished with value: 0.14249506337352819 and parameters: {'kernel_type': 'Matern', 'length_scale': 9.219706438788092, 'noise_level': 0.006680704745998207, 'constant_value': 125.27271279761962, 'nu': 1.5}. Best is trial 254 with value: 0.13754915492432768.
[I 2024-12-04 19:57:10,951] Trial 406 finished with value: 0.14249507290248994 and parameters: {'kernel_type': 'Matern', 'length_scale': 2.2369011320708196, 'noise_level': 0.7681634492353511, 'constant_value': 154.11162580091897, 'nu': 1.5}. Best is trial 254 with value: 0.13754915492432768.
[I 2024-12-04 19:57:15,167] Trial 408 finished with value: 0.23893332271624404 and parameters: {'kernel_type': 'Matern', 'length_scale': 895.1527392980519, 'noise_level': 0.9831194629378307, 'constant_value': 0.045784213980610264, 'nu': 1.5}. Best is trial 254 with value: 0.13754915492432768.
[I 2024-12-04 19:57:15,940] Trial 409 finished with value: 0.14249503946390552 and parameters: {'kernel_type': 'Matern', 'length_scale': 28.48036374748721, 'noise_level': 0.029550222036213988, 'constant_value': 66.78038877652428, 'nu': 1.5}. Best is trial 254 with value: 0.13754915492432768.
[I 2024-12-04 19:57:18,979] Trial 410 finished with value: 0.1424957418064705 and parameters: {'kernel_type': 'Matern', 'length_scale': 432.1449304579398, 'noise_level': 0.6705133774285383, 'constant_value': 6.3804260188004305, 'nu': 1.5}. Best is trial 254 with value: 0.13754915492432768.
[I 2024-12-04 19:57:20,006] Trial 411 finished with value: 0.9982171059619364 and parameters: {'kernel_type': 'RBF', 'length_scale': 0.763490960133187, 'noise_level': 9.242049413105413e-10, 'constant_value': 696.657542774399, 'nu': 1.5}. Best is trial 254 with value: 0.13754915492432768.
[I 2024-12-04 19:57:25,016] Trial 412 finished with value: 0.14249503848818892 and parameters: {'kernel_type': 'Matern', 'length_scale': 0.3951316049190207, 'noise_level': 0.0034829749926036896, 'constant_value': 2.1785950425757115, 'nu': 1.5}. Best is trial 254 with value: 0.13754915492432768.
[I 2024-12-04 19:57:26,268] Trial 414 finished with value: 0.14249503170142683 and parameters: {'kernel_type': 'Matern', 'length_scale': 28.46310393464143, 'noise_level': 0.011727274700185395, 'constant_value': 102.83551598808474, 'nu': 1.5}. Best is trial 254 with value: 0.13754915492432768.
[I 2024-12-04 19:57:26,330] Trial 413 finished with value: 0.14249506374894158 and parameters: {'kernel_type': 'Matern', 'length_scale': 14.546543989773479, 'noise_level': 0.010680371051772634, 'constant_value': 5.195323499751436, 'nu': 1.5}. Best is trial 254 with value: 0.13754915492432768.
[I 2024-12-04 19:57:31,449] Trial 415 finished with value: 0.1477105322871765 and parameters: {'kernel_type': 'RBF', 'length_scale': 12.300568968676055, 'noise_level': 0.01309745992282514, 'constant_value': 4.125954642553674, 'nu': 1.5}. Best is trial 254 with value: 0.13754915492432768.
[I 2024-12-04 19:57:32,977] Trial 416 finished with value: 0.14249504264422055 and parameters: {'kernel_type': 'Matern', 'length_scale': 158.2061993446588, 'noise_level': 0.4936898886212543, 'constant_value': 151.3197595311003, 'nu': 1.5}. Best is trial 254 with value: 0.13754915492432768.
[I 2024-12-04 19:57:34,157] Trial 417 finished with value: 0.1424950917022302 and parameters: {'kernel_type': 'Matern', 'length_scale': 4.580578468671465, 'noise_level': 0.4267072360249293, 'constant_value': 4731.020651748632, 'nu': 1.5}. Best is trial 254 with value: 0.13754915492432768.
[I 2024-12-04 19:57:38,069] Trial 418 finished with value: 0.14249506215005323 and parameters: {'kernel_type': 'Matern', 'length_scale': 183.33201006503768, 'noise_level': 0.7862536073111648, 'constant_value': 152.45435633678048, 'nu': 1.5}. Best is trial 254 with value: 0.13754915492432768.
[I 2024-12-04 19:57:41,901] Trial 419 finished with value: 0.9864686819269879 and parameters: {'kernel_type': 'Matern', 'length_scale': 32.63378847429768, 'noise_level': 0.00668765607081963, 'constant_value': 0.06050499638486732, 'nu': 1.5}. Best is trial 254 with value: 0.13754915492432768.
[I 2024-12-04 19:57:43,479] Trial 420 finished with value: 0.14249505666370982 and parameters: {'kernel_type': 'Matern', 'length_scale': 0.26815937916665644, 'noise_level': 0.0400438161549634, 'constant_value': 16.744328757709, 'nu': 1.5}. Best is trial 254 with value: 0.13754915492432768.
[I 2024-12-04 19:57:45,459] Trial 421 finished with value: 0.14249531161496487 and parameters: {'kernel_type': 'Matern', 'length_scale': 3.547577172834032, 'noise_level': 0.33328771936562723, 'constant_value': 0.05786385203566379, 'nu': 1.5}. Best is trial 254 with value: 0.13754915492432768.
[I 2024-12-04 19:57:48,817] Trial 422 finished with value: 0.986468681922816 and parameters: {'kernel_type': 'Matern', 'length_scale': 1525.3746854340113, 'noise_level': 3.039177078624932e-10, 'constant_value': 0.0033656261165102893, 'nu': 0.5}. Best is trial 254 with value: 0.13754915492432768.
[I 2024-12-04 19:57:51,908] Trial 423 finished with value: 0.1424951249923779 and parameters: {'kernel_type': 'Matern', 'length_scale': 5.052471687430377, 'noise_level': 0.010535432442720972, 'constant_value': 66.35426727125119, 'nu': 1.5}. Best is trial 254 with value: 0.13754915492432768.
[I 2024-12-04 19:57:52,647] Trial 424 finished with value: 0.14249497814878562 and parameters: {'kernel_type': 'Matern', 'length_scale': 0.46952583549520743, 'noise_level': 0.5348017708214838, 'constant_value': 58814.763869201146, 'nu': 1.5}. Best is trial 254 with value: 0.13754915492432768.
[I 2024-12-04 19:57:54,559] Trial 425 finished with value: 0.14249509429069143 and parameters: {'kernel_type': 'Matern', 'length_scale': 82.98920673742961, 'noise_level': 0.1033177602428315, 'constant_value': 587.2165691519574, 'nu': 1.5}. Best is trial 254 with value: 0.13754915492432768.
[I 2024-12-04 19:57:59,766] Trial 427 finished with value: 0.14249475913961723 and parameters: {'kernel_type': 'Matern', 'length_scale': 177.58890315186864, 'noise_level': 0.9162324553982343, 'constant_value': 1905.6899847258283, 'nu': 1.5}. Best is trial 254 with value: 0.13754915492432768.
[I 2024-12-04 19:58:02,067] Trial 426 finished with value: 0.9864686819676838 and parameters: {'kernel_type': 'Matern', 'length_scale': 10272.378303158217, 'noise_level': 1.56064453925023e-10, 'constant_value': 6.124226837537695, 'nu': 1.5}. Best is trial 254 with value: 0.13754915492432768.
[I 2024-12-04 19:58:02,875] Trial 428 finished with value: 0.1446988184049483 and parameters: {'kernel_type': 'Matern', 'length_scale': 0.39980130460891095, 'noise_level': 0.02115144729332923, 'constant_value': 0.15510618476671453, 'nu': 2.5}. Best is trial 254 with value: 0.13754915492432768.
[I 2024-12-04 19:58:09,018] Trial 430 finished with value: 0.14249506300267642 and parameters: {'kernel_type': 'Matern', 'length_scale': 1.8879667808096208, 'noise_level': 0.520740453569945, 'constant_value': 426.4961120835719, 'nu': 1.5}. Best is trial 254 with value: 0.13754915492432768.
[I 2024-12-04 19:58:09,335] Trial 429 finished with value: 0.14249504282720724 and parameters: {'kernel_type': 'Matern', 'length_scale': 259.54568292994986, 'noise_level': 0.9165691462300622, 'constant_value': 249.56610614073037, 'nu': 1.5}. Best is trial 254 with value: 0.13754915492432768.
[I 2024-12-04 19:58:12,746] Trial 431 finished with value: 0.14249516284421862 and parameters: {'kernel_type': 'Matern', 'length_scale': 5609.143483053246, 'noise_level': 0.8166890752680998, 'constant_value': 58354.526753069855, 'nu': 1.5}. Best is trial 254 with value: 0.13754915492432768.
[I 2024-12-04 19:58:16,195] Trial 432 finished with value: 0.14249704241916253 and parameters: {'kernel_type': 'Matern', 'length_scale': 994.6488865002087, 'noise_level': 0.5971993014160678, 'constant_value': 126.44447632505805, 'nu': 1.5}. Best is trial 254 with value: 0.13754915492432768.
[I 2024-12-04 19:58:17,863] Trial 434 finished with value: 0.9864686819214832 and parameters: {'kernel_type': 'Matern', 'length_scale': 0.040653000443482065, 'noise_level': 7.450724055839764e-06, 'constant_value': 0.0013908117445503314, 'nu': 0.5}. Best is trial 254 with value: 0.13754915492432768.
[I 2024-12-04 19:58:18,268] Trial 433 finished with value: 0.1424950730238557 and parameters: {'kernel_type': 'Matern', 'length_scale': 71.42147989658936, 'noise_level': 0.9545111414364924, 'constant_value': 11.912861946020202, 'nu': 1.5}. Best is trial 254 with value: 0.13754915492432768.
[I 2024-12-04 19:58:23,950] Trial 437 finished with value: 0.9864686821335645 and parameters: {'kernel_type': 'Matern', 'length_scale': 0.005699248373641071, 'noise_level': 0.008800389087655866, 'constant_value': 30.423697442608045, 'nu': 1.5}. Best is trial 254 with value: 0.13754915492432768.
[I 2024-12-04 19:58:23,960] Trial 435 finished with value: 0.14771037410197038 and parameters: {'kernel_type': 'RBF', 'length_scale': 0.31874556213795846, 'noise_level': 0.006964066466807673, 'constant_value': 0.668954707768932, 'nu': 0.5}. Best is trial 254 with value: 0.13754915492432768.
[I 2024-12-04 19:58:25,311] Trial 436 finished with value: 0.14249506161441997 and parameters: {'kernel_type': 'Matern', 'length_scale': 9.43017449815284, 'noise_level': 0.020329130531414726, 'constant_value': 123.68544274605881, 'nu': 1.5}. Best is trial 254 with value: 0.13754915492432768.
[I 2024-12-04 19:58:29,496] Trial 438 finished with value: 0.9864686819174407 and parameters: {'kernel_type': 'RBF', 'length_scale': 0.010432644634176638, 'noise_level': 6.0986155615852854e-05, 'constant_value': 0.00018796709984993034, 'nu': 1.5}. Best is trial 254 with value: 0.13754915492432768.
[I 2024-12-04 19:58:31,047] Trial 439 finished with value: 0.14249500939934287 and parameters: {'kernel_type': 'Matern', 'length_scale': 7.4215367286809455, 'noise_level': 0.18917844564407835, 'constant_value': 805.9287523522673, 'nu': 1.5}. Best is trial 254 with value: 0.13754915492432768.
[I 2024-12-04 19:58:33,186] Trial 440 finished with value: 0.14249497437270672 and parameters: {'kernel_type': 'Matern', 'length_scale': 1.6078727785644005, 'noise_level': 0.08137360391555092, 'constant_value': 0.9400813652519628, 'nu': 1.5}. Best is trial 254 with value: 0.13754915492432768.
[I 2024-12-04 19:58:38,956] Trial 442 finished with value: 0.14249507435334074 and parameters: {'kernel_type': 'Matern', 'length_scale': 4.033252783439862, 'noise_level': 0.5320647821300868, 'constant_value': 90002.91995094037, 'nu': 1.5}. Best is trial 254 with value: 0.13754915492432768.
[I 2024-12-04 19:58:40,956] Trial 441 finished with value: 0.986468681922216 and parameters: {'kernel_type': 'Matern', 'length_scale': 2989.560280862537, 'noise_level': 0.004348745111729303, 'constant_value': 0.030949418661531905, 'nu': 1.5}. Best is trial 254 with value: 0.13754915492432768.
[I 2024-12-04 19:58:41,240] Trial 443 finished with value: 0.14249505851177297 and parameters: {'kernel_type': 'Matern', 'length_scale': 0.3101799298899337, 'noise_level': 0.002298369131764157, 'constant_value': 0.3132509413399484, 'nu': 1.5}. Best is trial 254 with value: 0.13754915492432768.
[I 2024-12-04 19:58:47,201] Trial 445 finished with value: 0.14771047596611644 and parameters: {'kernel_type': 'RBF', 'length_scale': 238.2877121204075, 'noise_level': 0.015572747907681036, 'constant_value': 67642.410937265, 'nu': 1.5}. Best is trial 254 with value: 0.13754915492432768.
[I 2024-12-04 19:58:47,570] Trial 444 finished with value: 0.14249529377959294 and parameters: {'kernel_type': 'Matern', 'length_scale': 35.61191831823832, 'noise_level': 0.031094076261850918, 'constant_value': 1.9120282966755628, 'nu': 1.5}. Best is trial 254 with value: 0.13754915492432768.
[I 2024-12-04 19:58:49,698] Trial 446 finished with value: 0.9864686819281266 and parameters: {'kernel_type': 'Matern', 'length_scale': 204.93900448958192, 'noise_level': 0.005033703177632357, 'constant_value': 0.3597155693659757, 'nu': 1.5}. Best is trial 254 with value: 0.13754915492432768.
[I 2024-12-04 19:58:54,259] Trial 449 finished with value: 0.9982171091775822 and parameters: {'kernel_type': 'RBF', 'length_scale': 3.481130409934658, 'noise_level': 1.572772325028633e-10, 'constant_value': 558.2384742707683, 'nu': 0.5}. Best is trial 254 with value: 0.13754915492432768.
[I 2024-12-04 19:58:55,802] Trial 447 finished with value: 0.9864686819224596 and parameters: {'kernel_type': 'RBF', 'length_scale': 211.01494021720862, 'noise_level': 3.826340930482601e-06, 'constant_value': 0.09723683034307282, 'nu': 1.5}. Best is trial 254 with value: 0.13754915492432768.
[I 2024-12-04 19:58:56,861] Trial 448 finished with value: 0.14249498566424054 and parameters: {'kernel_type': 'Matern', 'length_scale': 7.978083216838517, 'noise_level': 0.4902053201989004, 'constant_value': 1035.554393114751, 'nu': 1.5}. Best is trial 254 with value: 0.13754915492432768.
[I 2024-12-04 19:59:03,073] Trial 451 finished with value: 0.14249509791860485 and parameters: {'kernel_type': 'Matern', 'length_scale': 487.6416654232262, 'noise_level': 0.9175584874123528, 'constant_value': 3978.0962863985383, 'nu': 1.5}. Best is trial 254 with value: 0.13754915492432768.
[I 2024-12-04 19:59:04,477] Trial 452 finished with value: 0.14249505378253766 and parameters: {'kernel_type': 'Matern', 'length_scale': 25.583574598991767, 'noise_level': 0.5455537097423604, 'constant_value': 351.5073569442788, 'nu': 1.5}. Best is trial 254 with value: 0.13754915492432768.
[I 2024-12-04 19:59:08,627] Trial 450 finished with value: 0.1863423315970053 and parameters: {'kernel_type': 'RBF', 'length_scale': 0.8652016051525091, 'noise_level': 0.8530982871317437, 'constant_value': 1.3296495600772286e-06, 'nu': 2.5}. Best is trial 254 with value: 0.13754915492432768.
[I 2024-12-04 19:59:09,332] Trial 453 finished with value: 0.1424950802238367 and parameters: {'kernel_type': 'Matern', 'length_scale': 2954.1903550923525, 'noise_level': 0.9628886677875437, 'constant_value': 420.11229294589793, 'nu': 1.5}. Best is trial 254 with value: 0.13754915492432768.
[I 2024-12-04 19:59:12,932] Trial 454 finished with value: 0.9982171092783965 and parameters: {'kernel_type': 'Matern', 'length_scale': 84441.5946402201, 'noise_level': 0.000906907394099724, 'constant_value': 0.004852463431979078, 'nu': 2.5}. Best is trial 254 with value: 0.13754915492432768.
[I 2024-12-04 19:59:13,302] Trial 455 finished with value: 0.9982167338036638 and parameters: {'kernel_type': 'Matern', 'length_scale': 1.6071902296693185e-05, 'noise_level': 2.033090241466226e-06, 'constant_value': 72443.48106219075, 'nu': 0.5}. Best is trial 254 with value: 0.13754915492432768.
[I 2024-12-04 19:59:15,338] Trial 456 finished with value: 0.1424950633273129 and parameters: {'kernel_type': 'Matern', 'length_scale': 30.69474667592291, 'noise_level': 0.01076381382763692, 'constant_value': 184.38060770741345, 'nu': 1.5}. Best is trial 254 with value: 0.13754915492432768.
[I 2024-12-04 19:59:19,395] Trial 457 finished with value: 0.14771033356484695 and parameters: {'kernel_type': 'RBF', 'length_scale': 14.794676076344016, 'noise_level': 0.4092608623658215, 'constant_value': 24.094590096774176, 'nu': 1.5}. Best is trial 254 with value: 0.13754915492432768.
[I 2024-12-04 19:59:19,414] Trial 458 finished with value: 0.19720003472756564 and parameters: {'kernel_type': 'Matern', 'length_scale': 86.29792663676794, 'noise_level': 0.004318604572437427, 'constant_value': 59.97810885815214, 'nu': 0.5}. Best is trial 254 with value: 0.13754915492432768.
[I 2024-12-04 19:59:23,957] Trial 461 finished with value: 0.9982154763082945 and parameters: {'kernel_type': 'RBF', 'length_scale': 0.000270184076137216, 'noise_level': 0.026506493241166617, 'constant_value': 1.531826324556063e-07, 'nu': 2.5}. Best is trial 254 with value: 0.13754915492432768.
[I 2024-12-04 19:59:24,466] Trial 459 finished with value: 0.1424950633493516 and parameters: {'kernel_type': 'Matern', 'length_scale': 66.79451372224473, 'noise_level': 0.40267882753313305, 'constant_value': 0.41982277767359405, 'nu': 1.5}. Best is trial 254 with value: 0.13754915492432768.
[I 2024-12-04 19:59:25,811] Trial 460 finished with value: 0.14249510352137107 and parameters: {'kernel_type': 'Matern', 'length_scale': 20.230153182245488, 'noise_level': 0.028672792533002266, 'constant_value': 491.1301201681193, 'nu': 1.5}. Best is trial 254 with value: 0.13754915492432768.
[I 2024-12-04 19:59:29,243] Trial 463 finished with value: 0.9864686818525984 and parameters: {'kernel_type': 'Matern', 'length_scale': 0.06619694291017618, 'noise_level': 0.028794028269348775, 'constant_value': 900.2887556525202, 'nu': 1.5}. Best is trial 254 with value: 0.13754915492432768.
[I 2024-12-04 19:59:33,393] Trial 462 finished with value: 0.1424948627430922 and parameters: {'kernel_type': 'Matern', 'length_scale': 2.7007383848610518, 'noise_level': 0.028136253087133252, 'constant_value': 5.914195917246969, 'nu': 1.5}. Best is trial 254 with value: 0.13754915492432768.
[I 2024-12-04 19:59:33,984] Trial 464 finished with value: 0.142495010624153 and parameters: {'kernel_type': 'Matern', 'length_scale': 1.1399464185572616, 'noise_level': 5.566752825335547e-05, 'constant_value': 0.023025323815722448, 'nu': 1.5}. Best is trial 254 with value: 0.13754915492432768.
[I 2024-12-04 19:59:35,685] Trial 465 finished with value: 0.14249503703775812 and parameters: {'kernel_type': 'Matern', 'length_scale': 187.73814316019568, 'noise_level': 0.9895974520074022, 'constant_value': 4841.175508986247, 'nu': 1.5}. Best is trial 254 with value: 0.13754915492432768.
[I 2024-12-04 19:59:39,095] Trial 466 finished with value: 0.19720012516981705 and parameters: {'kernel_type': 'Matern', 'length_scale': 2.1821997383725997, 'noise_level': 0.06505077404949175, 'constant_value': 0.184771060014829, 'nu': 0.5}. Best is trial 254 with value: 0.13754915492432768.
[I 2024-12-04 19:59:41,169] Trial 468 finished with value: 0.14249486440810943 and parameters: {'kernel_type': 'Matern', 'length_scale': 19.757332713838853, 'noise_level': 0.4930313936191454, 'constant_value': 3140.3006284383696, 'nu': 1.5}. Best is trial 254 with value: 0.13754915492432768.
[I 2024-12-04 19:59:41,765] Trial 467 finished with value: 0.9982171055262062 and parameters: {'kernel_type': 'RBF', 'length_scale': 1.3982364929072038, 'noise_level': 0.001754647446938371, 'constant_value': 6.220201549445015e-07, 'nu': 0.5}. Best is trial 254 with value: 0.13754915492432768.
[I 2024-12-04 19:59:45,785] Trial 469 finished with value: 0.14249506476331195 and parameters: {'kernel_type': 'Matern', 'length_scale': 21.49618615731212, 'noise_level': 0.33165670152093873, 'constant_value': 1.7750178644818817, 'nu': 1.5}. Best is trial 254 with value: 0.13754915492432768.
[I 2024-12-04 19:59:48,492] Trial 470 finished with value: 0.9864686819225745 and parameters: {'kernel_type': 'RBF', 'length_scale': 0.0848386125753813, 'noise_level': 0.14769261798220976, 'constant_value': 0.0303250708787203, 'nu': 1.5}. Best is trial 254 with value: 0.13754915492432768.
[I 2024-12-04 19:59:51,514] Trial 471 finished with value: 0.1446987021318301 and parameters: {'kernel_type': 'Matern', 'length_scale': 0.7164392921738835, 'noise_level': 0.0033181071254910722, 'constant_value': 16.115825276920518, 'nu': 2.5}. Best is trial 254 with value: 0.13754915492432768.
[I 2024-12-04 19:59:55,095] Trial 472 finished with value: 0.9864686819260791 and parameters: {'kernel_type': 'Matern', 'length_scale': 1249.0118840704627, 'noise_level': 0.016152037646203713, 'constant_value': 7.873067844613526, 'nu': 1.5}. Best is trial 254 with value: 0.13754915492432768.
[I 2024-12-04 19:59:55,617] Trial 473 finished with value: 0.1424948665646775 and parameters: {'kernel_type': 'Matern', 'length_scale': 163.26005211174692, 'noise_level': 0.7714327480649745, 'constant_value': 27672.654649325257, 'nu': 1.5}. Best is trial 254 with value: 0.13754915492432768.
[I 2024-12-04 20:00:00,136] Trial 474 finished with value: 0.14249506379768803 and parameters: {'kernel_type': 'Matern', 'length_scale': 1.2055595848776643, 'noise_level': 0.9696487991490194, 'constant_value': 4.72618557744732, 'nu': 1.5}. Best is trial 254 with value: 0.13754915492432768.
[I 2024-12-04 20:00:02,317] Trial 476 finished with value: 0.14249504911913827 and parameters: {'kernel_type': 'Matern', 'length_scale': 0.5881259633201866, 'noise_level': 0.008926930729783254, 'constant_value': 365.6111912878122, 'nu': 1.5}. Best is trial 254 with value: 0.13754915492432768.
[I 2024-12-04 20:00:02,480] Trial 475 finished with value: 0.9982171094792109 and parameters: {'kernel_type': 'Matern', 'length_scale': 70895.02018186143, 'noise_level': 0.2213774783964403, 'constant_value': 0.4193980656547271, 'nu': 1.5}. Best is trial 254 with value: 0.13754915492432768.
[I 2024-12-04 20:00:08,216] Trial 479 finished with value: 0.9864686819236815 and parameters: {'kernel_type': 'Matern', 'length_scale': 0.0011279223709206043, 'noise_level': 0.027130965176971226, 'constant_value': 30.700623161002778, 'nu': 0.5}. Best is trial 254 with value: 0.13754915492432768.
[I 2024-12-04 20:00:08,686] Trial 477 finished with value: 0.14249504526483922 and parameters: {'kernel_type': 'Matern', 'length_scale': 144.69881485430355, 'noise_level': 0.8381069828399055, 'constant_value': 0.6568254346000401, 'nu': 1.5}. Best is trial 254 with value: 0.13754915492432768.
[I 2024-12-04 20:00:11,882] Trial 478 finished with value: 0.1424949047784931 and parameters: {'kernel_type': 'Matern', 'length_scale': 30.011211841477767, 'noise_level': 0.0027592120607671856, 'constant_value': 10.899896742063726, 'nu': 1.5}. Best is trial 254 with value: 0.13754915492432768.
[I 2024-12-04 20:00:23,717] Trial 482 finished with value: 0.9864686820515095 and parameters: {'kernel_type': 'Matern', 'length_scale': 0.014958988169248696, 'noise_level': 0.08392345390166141, 'constant_value': 51.02754145334313, 'nu': 1.5}. Best is trial 254 with value: 0.13754915492432768.
