[I 2024-12-03 18:47:40,287] Trial 955 finished with value: 1.0016551985967757 and parameters: {'kernel': 'sigmoid', 'C': 0.004217051357727745, 'gamma': 0.011854347721663811, 'epsilon': 0.021730337251513944}. Best is trial 88 with value: 0.3542875001421725.
[I 2024-12-03 18:47:41,374] Trial 956 finished with value: 110.94087437731989 and parameters: {'kernel': 'sigmoid', 'C': 6.570038508200616, 'gamma': 0.019451345381569566, 'epsilon': 0.005198186329102542}. Best is trial 88 with value: 0.3542875001421725.
[I 2024-12-03 18:47:41,784] Trial 957 finished with value: 0.36678852561172376 and parameters: {'kernel': 'rbf', 'C': 87.66792900941702, 'gamma': 0.03281145278447576, 'epsilon': 0.09068180010037438}. Best is trial 88 with value: 0.3542875001421725.
[I 2024-12-03 18:47:41,857] Trial 958 finished with value: 0.36604996734914835 and parameters: {'kernel': 'rbf', 'C': 91.3969322376203, 'gamma': 0.060431857867936395, 'epsilon': 0.12523682912063952}. Best is trial 88 with value: 0.3542875001421725.
[I 2024-12-03 18:47:42,031] Trial 953 finished with value: 0.36773115793402217 and parameters: {'kernel': 'rbf', 'C': 80.20076836193658, 'gamma': 0.031217219221079597, 'epsilon': 0.02057788319597785}. Best is trial 88 with value: 0.3542875001421725.
[I 2024-12-03 18:47:42,683] Trial 960 finished with value: 0.37902232669599945 and parameters: {'kernel': 'rbf', 'C': 98.85421363187201, 'gamma': 0.0748005224708804, 'epsilon': 0.14739559950982203}. Best is trial 88 with value: 0.3542875001421725.
[I 2024-12-03 18:47:43,058] Trial 959 finished with value: 0.364107475286877 and parameters: {'kernel': 'rbf', 'C': 84.17193541766179, 'gamma': 0.052518802516861675, 'epsilon': 0.04281419968765419}. Best is trial 88 with value: 0.3542875001421725.
[I 2024-12-03 18:47:43,519] Trial 961 finished with value: 0.38982903642896755 and parameters: {'kernel': 'rbf', 'C': 98.97142449754602, 'gamma': 0.015520603015581176, 'epsilon': 0.04531808476802278}. Best is trial 88 with value: 0.3542875001421725.
[I 2024-12-03 18:47:44,325] Trial 964 finished with value: 635.3677616727597 and parameters: {'kernel': 'sigmoid', 'C': 49.87719505525496, 'gamma': 0.011613802625672657, 'epsilon': 0.48180207809469944}. Best is trial 88 with value: 0.3542875001421725.
[I 2024-12-03 18:47:44,840] Trial 963 finished with value: 0.5548060961920843 and parameters: {'kernel': 'rbf', 'C': 2.3623300213244236, 'gamma': 0.16923800693331117, 'epsilon': 0.12227744930398127}. Best is trial 88 with value: 0.3542875001421725.
[I 2024-12-03 18:47:45,125] Trial 965 finished with value: 0.46207890203421537 and parameters: {'kernel': 'rbf', 'C': 25.83186659353617, 'gamma': 0.15526157302462298, 'epsilon': 0.05983948982327387}. Best is trial 88 with value: 0.3542875001421725.
[I 2024-12-03 18:47:45,639] Trial 966 finished with value: 0.40642067084877276 and parameters: {'kernel': 'rbf', 'C': 18.595998639093693, 'gamma': 0.05118543135920372, 'epsilon': 0.07911434844987489}. Best is trial 88 with value: 0.3542875001421725.
[I 2024-12-03 18:47:46,072] Trial 967 finished with value: 937.4087865840094 and parameters: {'kernel': 'sigmoid', 'C': 51.87537948439289, 'gamma': 0.023489902908333072, 'epsilon': 0.038533627927892646}. Best is trial 88 with value: 0.3542875001421725.
[I 2024-12-03 18:47:47,110] Trial 968 finished with value: 0.37358415125686684 and parameters: {'kernel': 'rbf', 'C': 86.02699167472451, 'gamma': 0.06741987257285238, 'epsilon': 0.061889075212580885}. Best is trial 88 with value: 0.3542875001421725.
[I 2024-12-03 18:47:47,116] Trial 969 finished with value: 0.5552250755647401 and parameters: {'kernel': 'rbf', 'C': 90.1815100579493, 'gamma': 0.2617255683339741, 'epsilon': 0.05904874892283593}. Best is trial 88 with value: 0.3542875001421725.
[I 2024-12-03 18:47:47,854] Trial 970 finished with value: 0.41634628354010883 and parameters: {'kernel': 'rbf', 'C': 97.86462925767715, 'gamma': 0.004115271540954848, 'epsilon': 0.09563547642543059}. Best is trial 88 with value: 0.3542875001421725.
[I 2024-12-03 18:47:47,855] Trial 971 finished with value: 1.0921843055701004 and parameters: {'kernel': 'sigmoid', 'C': 0.0016892668293363874, 'gamma': 0.00018697804320547945, 'epsilon': 0.7069325819473443}. Best is trial 88 with value: 0.3542875001421725.
[I 2024-12-03 18:47:48,339] Trial 972 finished with value: 0.4057023249429413 and parameters: {'kernel': 'rbf', 'C': 19.701801581322314, 'gamma': 0.04287607771900353, 'epsilon': 0.11610227667510774}. Best is trial 88 with value: 0.3542875001421725.
[I 2024-12-03 18:47:49,375] Trial 973 finished with value: 0.3589685670196676 and parameters: {'kernel': 'rbf', 'C': 99.84571344805889, 'gamma': 0.039747360530477914, 'epsilon': 0.09560307639553786}. Best is trial 88 with value: 0.3542875001421725.
[I 2024-12-03 18:47:49,375] Trial 962 finished with value: 0.799338919735101 and parameters: {'kernel': 'linear', 'C': 6.938389147315757, 'gamma': 0.16838971580622958, 'epsilon': 0.06645741225735666}. Best is trial 88 with value: 0.3542875001421725.
[I 2024-12-03 18:47:49,852] Trial 974 finished with value: 0.37719449950091444 and parameters: {'kernel': 'rbf', 'C': 33.63474910148777, 'gamma': 0.03524344657209755, 'epsilon': 0.17591519877481554}. Best is trial 88 with value: 0.3542875001421725.
[I 2024-12-03 18:47:50,399] Trial 977 finished with value: 0.36817012064261506 and parameters: {'kernel': 'rbf', 'C': 99.372619596022, 'gamma': 0.04885798618818901, 'epsilon': 0.24315818276376977}. Best is trial 88 with value: 0.3542875001421725.
[I 2024-12-03 18:47:50,667] Trial 975 finished with value: 1.0702967359969555 and parameters: {'kernel': 'rbf', 'C': 0.0056939152272068895, 'gamma': 0.0001045820836454166, 'epsilon': 0.0022204512230244214}. Best is trial 88 with value: 0.3542875001421725.
[I 2024-12-03 18:47:50,669] Trial 976 finished with value: 0.6215314344239065 and parameters: {'kernel': 'rbf', 'C': 56.24291203617343, 'gamma': 0.3524030718296258, 'epsilon': 0.14255192929231178}. Best is trial 88 with value: 0.3542875001421725.
[I 2024-12-03 18:47:51,909] Trial 978 finished with value: 0.4146735825385291 and parameters: {'kernel': 'rbf', 'C': 95.61423500560672, 'gamma': 0.11846389949559882, 'epsilon': 0.08608835628492699}. Best is trial 88 with value: 0.3542875001421725.
[I 2024-12-03 18:47:52,173] Trial 979 finished with value: 0.4510595384126428 and parameters: {'kernel': 'rbf', 'C': 27.726550154370848, 'gamma': 0.14169797292038935, 'epsilon': 0.09811352184481317}. Best is trial 88 with value: 0.3542875001421725.
[I 2024-12-03 18:47:52,822] Trial 980 finished with value: 0.4039703130742014 and parameters: {'kernel': 'rbf', 'C': 85.39177521870162, 'gamma': 0.014170393534995471, 'epsilon': 0.07158719771120242}. Best is trial 88 with value: 0.3542875001421725.
[I 2024-12-03 18:47:53,224] Trial 982 finished with value: 0.4177038809106007 and parameters: {'kernel': 'rbf', 'C': 17.621165213791713, 'gamma': 0.029499136784696886, 'epsilon': 0.13701650885886127}. Best is trial 88 with value: 0.3542875001421725.
[I 2024-12-03 18:47:53,339] Trial 983 finished with value: 0.43018542357056333 and parameters: {'kernel': 'rbf', 'C': 15.420205785159961, 'gamma': 0.02003885386023723, 'epsilon': 0.19548349333417586}. Best is trial 88 with value: 0.3542875001421725.
[I 2024-12-03 18:47:53,341] Trial 981 finished with value: 0.49612120969945334 and parameters: {'kernel': 'rbf', 'C': 95.65625088037001, 'gamma': 0.17359259153553586, 'epsilon': 0.15548247815539182}. Best is trial 88 with value: 0.3542875001421725.
[I 2024-12-03 18:47:54,460] Trial 985 finished with value: 0.44248176088029467 and parameters: {'kernel': 'rbf', 'C': 12.168700023312152, 'gamma': 0.07230318519326957, 'epsilon': 0.3409993573333573}. Best is trial 88 with value: 0.3542875001421725.
[I 2024-12-03 18:47:55,321] Trial 984 finished with value: 0.36876294416458444 and parameters: {'kernel': 'rbf', 'C': 96.41597554360787, 'gamma': 0.03384551010060163, 'epsilon': 0.05703951231080344}. Best is trial 88 with value: 0.3542875001421725.
[I 2024-12-03 18:47:55,529] Trial 986 finished with value: 0.37488958169722936 and parameters: {'kernel': 'rbf', 'C': 81.57841260899754, 'gamma': 0.019649600836735216, 'epsilon': 0.17487803751116823}. Best is trial 88 with value: 0.3542875001421725.
[I 2024-12-03 18:47:55,867] Trial 987 finished with value: 0.3619624934037181 and parameters: {'kernel': 'rbf', 'C': 84.19398906451926, 'gamma': 0.0371277441378112, 'epsilon': 0.1560683567769653}. Best is trial 88 with value: 0.3542875001421725.
[I 2024-12-03 18:47:57,074] Trial 988 finished with value: 0.784242118718585 and parameters: {'kernel': 'rbf', 'C': 0.03361768027047174, 'gamma': 0.017955389722841487, 'epsilon': 0.05431172335072748}. Best is trial 88 with value: 0.3542875001421725.
[I 2024-12-03 18:47:58,250] Trial 990 finished with value: 0.3562123882584053 and parameters: {'kernel': 'rbf', 'C': 97.45232957276625, 'gamma': 0.0457060135977623, 'epsilon': 0.1590768210642774}. Best is trial 88 with value: 0.3542875001421725.
[I 2024-12-03 18:47:58,665] Trial 991 finished with value: 1.1400387396629146 and parameters: {'kernel': 'poly', 'C': 0.08491839672776146, 'gamma': 0.0033779332823754655, 'epsilon': 0.012616179657428872}. Best is trial 88 with value: 0.3542875001421725.
[I 2024-12-03 18:47:59,043] Trial 833 finished with value: 0.7855067023727482 and parameters: {'kernel': 'linear', 'C': 85.01038273541687, 'gamma': 0.1138146726079428, 'epsilon': 0.11153866496397985}. Best is trial 88 with value: 0.3542875001421725.
[I 2024-12-03 18:47:59,563] Trial 993 finished with value: 348.05170585684414 and parameters: {'kernel': 'sigmoid', 'C': 16.27902671026438, 'gamma': 0.06146770277968008, 'epsilon': 0.3953409616121884}. Best is trial 88 with value: 0.3542875001421725.
[I 2024-12-03 18:47:59,913] Trial 992 finished with value: 0.40831067185865055 and parameters: {'kernel': 'rbf', 'C': 80.1051244266932, 'gamma': 0.006534105223805178, 'epsilon': 0.010240707308110008}. Best is trial 88 with value: 0.3542875001421725.
[I 2024-12-03 18:48:00,209] Trial 995 finished with value: 0.3598047822051418 and parameters: {'kernel': 'rbf', 'C': 99.27790782664614, 'gamma': 0.03707774506290728, 'epsilon': 0.13572748892635364}. Best is trial 88 with value: 0.3542875001421725.
[I 2024-12-03 18:48:00,410] Trial 996 finished with value: 0.44262295834031484 and parameters: {'kernel': 'rbf', 'C': 19.609649642112203, 'gamma': 0.06755215225787588, 'epsilon': 0.3876899832026328}. Best is trial 88 with value: 0.3542875001421725.
[I 2024-12-03 18:48:00,786] Trial 997 finished with value: 0.3765746609655955 and parameters: {'kernel': 'rbf', 'C': 99.12936287545865, 'gamma': 0.05022633263946857, 'epsilon': 0.29587005012318}. Best is trial 88 with value: 0.3542875001421725.
[I 2024-12-03 18:48:02,039] Trial 998 finished with value: 0.47174713666692103 and parameters: {'kernel': 'rbf', 'C': 90.96537010449534, 'gamma': 0.10497242191673944, 'epsilon': 0.3421436238518426}. Best is trial 88 with value: 0.3542875001421725.
[I 2024-12-03 18:48:02,051] Trial 999 finished with value: 0.4107860676554893 and parameters: {'kernel': 'rbf', 'C': 86.03833288814191, 'gamma': 0.009116717176331576, 'epsilon': 0.19893482405065827}. Best is trial 88 with value: 0.3542875001421725.
[I 2024-12-03 18:48:02,646] Trial 1000 finished with value: 0.5523266681270352 and parameters: {'kernel': 'rbf', 'C': 15.523634519913772, 'gamma': 0.16343653725889928, 'epsilon': 0.36352942404682426}. Best is trial 88 with value: 0.3542875001421725.
[I 2024-12-03 18:48:02,973] Trial 1002 finished with value: 0.40779919628160427 and parameters: {'kernel': 'rbf', 'C': 17.31864112342316, 'gamma': 0.006148981968634439, 'epsilon': 0.13500280239710433}. Best is trial 88 with value: 0.3542875001421725.
[I 2024-12-03 18:48:02,975] Trial 1001 finished with value: 0.3991902379114739 and parameters: {'kernel': 'rbf', 'C': 18.242385896231813, 'gamma': 0.06440184061673311, 'epsilon': 0.14478729339326354}. Best is trial 88 with value: 0.3542875001421725.
[I 2024-12-03 18:48:03,944] Trial 1003 finished with value: 0.4948474342082256 and parameters: {'kernel': 'rbf', 'C': 87.62315539783293, 'gamma': 0.177500109801047, 'epsilon': 0.13407917520957943}. Best is trial 88 with value: 0.3542875001421725.
[I 2024-12-03 18:48:04,276] Trial 1004 finished with value: 0.5404680575811887 and parameters: {'kernel': 'rbf', 'C': 92.27694310923968, 'gamma': 0.1732294795066888, 'epsilon': 0.3026951325361257}. Best is trial 88 with value: 0.3542875001421725.
[I 2024-12-03 18:48:05,236] Trial 1006 finished with value: 0.4339599803422471 and parameters: {'kernel': 'rbf', 'C': 22.102319917739926, 'gamma': 0.014817440552269549, 'epsilon': 0.38439251178267786}. Best is trial 88 with value: 0.3542875001421725.
[I 2024-12-03 18:48:05,237] Trial 1005 finished with value: 0.5063869542443044 and parameters: {'kernel': 'rbf', 'C': 2.1696793851183784, 'gamma': 0.07092239339884934, 'epsilon': 0.04030274723795935}. Best is trial 88 with value: 0.3542875001421725.
[I 2024-12-03 18:48:06,599] Trial 1008 finished with value: 0.8066312712571674 and parameters: {'kernel': 'rbf', 'C': 16.204689561403356, 'gamma': 0.8972427203021329, 'epsilon': 0.0725613650886354}. Best is trial 88 with value: 0.3542875001421725.
[I 2024-12-03 18:48:06,610] Trial 1009 finished with value: 0.5442120688428917 and parameters: {'kernel': 'rbf', 'C': 87.69017949072787, 'gamma': 0.01974897612109084, 'epsilon': 0.8476231225366185}. Best is trial 88 with value: 0.3542875001421725.
[I 2024-12-03 18:48:07,195] Trial 1010 finished with value: 0.41770957061881775 and parameters: {'kernel': 'rbf', 'C': 98.95721140655546, 'gamma': 0.00875752896185308, 'epsilon': 0.4202409955201248}. Best is trial 88 with value: 0.3542875001421725.
[I 2024-12-03 18:48:08,529] Trial 1013 finished with value: 0.47559675782033745 and parameters: {'kernel': 'rbf', 'C': 27.35094370254493, 'gamma': 0.14940716721498676, 'epsilon': 0.1794690380873588}. Best is trial 88 with value: 0.3542875001421725.
[I 2024-12-03 18:48:08,585] Trial 1011 finished with value: 0.36607018650828044 and parameters: {'kernel': 'rbf', 'C': 97.6456317927363, 'gamma': 0.04713432638535062, 'epsilon': 0.04038682352072902}. Best is trial 88 with value: 0.3542875001421725.
[I 2024-12-03 18:48:08,781] Trial 1012 finished with value: 196.41800751610305 and parameters: {'kernel': 'sigmoid', 'C': 10.154228312601889, 'gamma': 0.03212256453488938, 'epsilon': 0.15875770775343526}. Best is trial 88 with value: 0.3542875001421725.
[I 2024-12-03 18:48:09,581] Trial 1014 finished with value: 0.38427326022321395 and parameters: {'kernel': 'rbf', 'C': 27.197719233416297, 'gamma': 0.05304916504221545, 'epsilon': 0.16580737268734747}. Best is trial 88 with value: 0.3542875001421725.
[I 2024-12-03 18:48:10,473] Trial 1015 finished with value: 0.4032799965232639 and parameters: {'kernel': 'rbf', 'C': 99.84883337259632, 'gamma': 0.09206681215727515, 'epsilon': 0.19332544353920242}. Best is trial 88 with value: 0.3542875001421725.
[I 2024-12-03 18:48:10,704] Trial 994 finished with value: 0.75516722634877 and parameters: {'kernel': 'linear', 'C': 13.745271249543189, 'gamma': 0.028974516240184305, 'epsilon': 0.22670740539443557}. Best is trial 88 with value: 0.3542875001421725.
[I 2024-12-03 18:48:11,425] Trial 1016 finished with value: 0.8823313598977534 and parameters: {'kernel': 'linear', 'C': 0.005960973766347381, 'gamma': 0.0010098743699378425, 'epsilon': 0.01501557008204623}. Best is trial 88 with value: 0.3542875001421725.
[I 2024-12-03 18:48:11,551] Trial 1017 finished with value: 0.3609749390963733 and parameters: {'kernel': 'rbf', 'C': 99.21990119578851, 'gamma': 0.03314920254276462, 'epsilon': 0.2012299706944534}. Best is trial 88 with value: 0.3542875001421725.
[I 2024-12-03 18:48:12,088] Trial 1018 finished with value: 1.5301594336362259 and parameters: {'kernel': 'poly', 'C': 23.97760769298593, 'gamma': 0.0029856750714434325, 'epsilon': 0.02511981173313464}. Best is trial 88 with value: 0.3542875001421725.
[I 2024-12-03 18:48:12,733] Trial 1020 finished with value: 0.4316514331518481 and parameters: {'kernel': 'rbf', 'C': 21.174226000200466, 'gamma': 0.014960073855190147, 'epsilon': 0.11326743972849672}. Best is trial 88 with value: 0.3542875001421725.
[I 2024-12-03 18:48:13,734] Trial 1019 finished with value: 0.38587701446462536 and parameters: {'kernel': 'rbf', 'C': 92.18598468503056, 'gamma': 0.07303710029221913, 'epsilon': 0.039229009781981405}. Best is trial 88 with value: 0.3542875001421725.
[I 2024-12-03 18:48:13,995] Trial 1021 finished with value: 0.43319480833426904 and parameters: {'kernel': 'rbf', 'C': 19.570240419910423, 'gamma': 0.018293364698909367, 'epsilon': 0.13263442250994645}. Best is trial 88 with value: 0.3542875001421725.
[I 2024-12-03 18:48:15,010] Trial 1022 finished with value: 0.36465950529771823 and parameters: {'kernel': 'rbf', 'C': 91.3485129997678, 'gamma': 0.05968667249284055, 'epsilon': 0.10527078466420425}. Best is trial 88 with value: 0.3542875001421725.
[I 2024-12-03 18:48:15,093] Trial 1024 finished with value: 0.4310121509821005 and parameters: {'kernel': 'rbf', 'C': 13.16727868368748, 'gamma': 0.1046042586491849, 'epsilon': 0.04611689889461969}. Best is trial 88 with value: 0.3542875001421725.
[I 2024-12-03 18:48:15,544] Trial 1007 finished with value: 0.8040942433823206 and parameters: {'kernel': 'linear', 'C': 10.17356831313304, 'gamma': 0.018329024472054242, 'epsilon': 0.04787014208905926}. Best is trial 88 with value: 0.3542875001421725.
[I 2024-12-03 18:48:16,013] Trial 789 finished with value: 0.8027211770486293 and parameters: {'kernel': 'linear', 'C': 75.36758541710897, 'gamma': 0.03872682676793682, 'epsilon': 0.048684623702474214}. Best is trial 88 with value: 0.3542875001421725.
[I 2024-12-03 18:48:16,558] Trial 1026 finished with value: 0.8590231266540964 and parameters: {'kernel': 'linear', 'C': 0.03090827154267712, 'gamma': 0.9950914748615962, 'epsilon': 0.003772895394184723}. Best is trial 88 with value: 0.3542875001421725.
[I 2024-12-03 18:48:16,914] Trial 1027 finished with value: 0.5824566879586006 and parameters: {'kernel': 'rbf', 'C': 99.82069578355897, 'gamma': 0.3014443307545962, 'epsilon': 0.07041336716796559}. Best is trial 88 with value: 0.3542875001421725.
[I 2024-12-03 18:48:16,960] Trial 1025 finished with value: 0.4438320887388596 and parameters: {'kernel': 'rbf', 'C': 97.13386457885224, 'gamma': 0.1483424985611406, 'epsilon': 0.02492485754209036}. Best is trial 88 with value: 0.3542875001421725.
[I 2024-12-03 18:48:17,867] Trial 1028 finished with value: 0.3665401581816677 and parameters: {'kernel': 'rbf', 'C': 92.58973654026241, 'gamma': 0.025262658771429292, 'epsilon': 0.07048208321458392}. Best is trial 88 with value: 0.3542875001421725.
[I 2024-12-03 18:48:18,122] Trial 1030 finished with value: 0.48266087605723684 and parameters: {'kernel': 'rbf', 'C': 19.394381782867484, 'gamma': 0.027560152608785, 'epsilon': 0.6400057762314454}. Best is trial 88 with value: 0.3542875001421725.
[I 2024-12-03 18:48:19,266] Trial 1031 finished with value: 0.3581059231890939 and parameters: {'kernel': 'rbf', 'C': 99.9046184397389, 'gamma': 0.03680258700936944, 'epsilon': 0.25777589929401545}. Best is trial 88 with value: 0.3542875001421725.
[I 2024-12-03 18:48:19,878] Trial 1033 finished with value: 0.36152484345870084 and parameters: {'kernel': 'rbf', 'C': 96.27589088843406, 'gamma': 0.045595866559803605, 'epsilon': 0.23058876992353802}. Best is trial 88 with value: 0.3542875001421725.
[I 2024-12-03 18:48:19,991] Trial 1032 finished with value: 0.4105730245474326 and parameters: {'kernel': 'rbf', 'C': 98.45088892094799, 'gamma': 0.010754034194778456, 'epsilon': 0.061662888049180374}. Best is trial 88 with value: 0.3542875001421725.
[I 2024-12-03 18:48:20,341] Trial 1035 finished with value: 0.4289789856622854 and parameters: {'kernel': 'rbf', 'C': 18.19825373952791, 'gamma': 0.046369602133103135, 'epsilon': 0.4249519254235209}. Best is trial 88 with value: 0.3542875001421725.
[I 2024-12-03 18:48:20,826] Trial 1034 finished with value: 0.8468916301661391 and parameters: {'kernel': 'rbf', 'C': 14.330832836514455, 'gamma': 0.9541833760682559, 'epsilon': 0.23680164724458685}. Best is trial 88 with value: 0.3542875001421725.
[I 2024-12-03 18:48:22,261] Trial 1038 finished with value: 0.4884106849663103 and parameters: {'kernel': 'rbf', 'C': 3.029527549596332, 'gamma': 0.071143732241299, 'epsilon': 0.10248491994566569}. Best is trial 88 with value: 0.3542875001421725.
[I 2024-12-03 18:48:22,439] Trial 1037 finished with value: 0.4109852913742147 and parameters: {'kernel': 'rbf', 'C': 18.426993164943422, 'gamma': 0.09074923618323304, 'epsilon': 0.06771291505502246}. Best is trial 88 with value: 0.3542875001421725.
[I 2024-12-03 18:48:22,754] Trial 1040 finished with value: 0.9618286198933346 and parameters: {'kernel': 'sigmoid', 'C': 0.03403160432611317, 'gamma': 0.005244703131171238, 'epsilon': 0.986901322326087}. Best is trial 88 with value: 0.3542875001421725.
[I 2024-12-03 18:48:22,920] Trial 1039 finished with value: 1.0801962084395487 and parameters: {'kernel': 'poly', 'C': 0.013137927617465461, 'gamma': 0.00018567324073731278, 'epsilon': 0.5302810477204788}. Best is trial 88 with value: 0.3542875001421725.
[I 2024-12-03 18:48:24,382] Trial 1041 finished with value: 0.4136248479577508 and parameters: {'kernel': 'rbf', 'C': 14.236605068248828, 'gamma': 0.0697619866154903, 'epsilon': 0.1735912726781431}. Best is trial 88 with value: 0.3542875001421725.
[I 2024-12-03 18:48:25,334] Trial 1042 finished with value: 4.076577600797682 and parameters: {'kernel': 'sigmoid', 'C': 0.31287179059876097, 'gamma': 0.014319538262758422, 'epsilon': 0.010824507180026872}. Best is trial 88 with value: 0.3542875001421725.
[I 2024-12-03 18:48:25,347] Trial 1043 finished with value: 0.654574603754657 and parameters: {'kernel': 'rbf', 'C': 23.381803164754253, 'gamma': 0.09217295575412922, 'epsilon': 0.7609359955164581}. Best is trial 88 with value: 0.3542875001421725.
