[I 2024-12-03 18:39:49,197] Trial 65 finished with value: 1.3710240343172566 and parameters: {'kernel': 'sigmoid', 'C': 0.0011846730997207406, 'gamma': 0.001141515679928373, 'epsilon': 0.018315904902750216}. Best is trial 58 with value: 0.4679277933792091.
[I 2024-12-03 18:39:49,670] Trial 55 finished with value: 0.8529033565756993 and parameters: {'kernel': 'poly', 'C': 84.93744969492482, 'gamma': 0.07708472856020694, 'epsilon': 0.0011624047820820132}. Best is trial 58 with value: 0.4679277933792091.
[I 2024-12-03 18:39:49,756] Trial 56 finished with value: 0.49590006775493345 and parameters: {'kernel': 'rbf', 'C': 52.81267144141615, 'gamma': 0.008899387655450662, 'epsilon': 0.00594172465922358}. Best is trial 58 with value: 0.4679277933792091.
[I 2024-12-03 18:39:49,761] Trial 69 finished with value: 0.4809734970049018 and parameters: {'kernel': 'rbf', 'C': 95.06899119145743, 'gamma': 0.008404295047359234, 'epsilon': 0.0023223062089275273}. Best is trial 58 with value: 0.4679277933792091.
[I 2024-12-03 18:39:49,828] Trial 67 finished with value: 0.4685602443425585 and parameters: {'kernel': 'rbf', 'C': 42.14715935720995, 'gamma': 0.02189977748947128, 'epsilon': 0.002115581135972764}. Best is trial 58 with value: 0.4679277933792091.
[I 2024-12-03 18:39:49,972] Trial 48 finished with value: 0.5496455697470477 and parameters: {'kernel': 'linear', 'C': 33.883211656382706, 'gamma': 0.0060233130785259225, 'epsilon': 0.0010329017796913283}. Best is trial 58 with value: 0.4679277933792091.
[I 2024-12-03 18:39:50,588] Trial 64 finished with value: 0.6971555847913248 and parameters: {'kernel': 'rbf', 'C': 95.05557910046713, 'gamma': 0.00028403320619630775, 'epsilon': 0.0014593100923507873}. Best is trial 58 with value: 0.4679277933792091.
[I 2024-12-03 18:39:50,747] Trial 60 finished with value: 1.3725707917910566 and parameters: {'kernel': 'rbf', 'C': 0.002063347966385433, 'gamma': 0.0003788220810052951, 'epsilon': 0.0010176314719739987}. Best is trial 58 with value: 0.4679277933792091.
[I 2024-12-03 18:39:50,884] Trial 44 finished with value: 0.5499668340847729 and parameters: {'kernel': 'linear', 'C': 92.10642938478841, 'gamma': 0.0020169502779099056, 'epsilon': 0.002251255509273122}. Best is trial 58 with value: 0.4679277933792091.
[I 2024-12-03 18:39:50,963] Trial 49 finished with value: 0.5658959907756433 and parameters: {'kernel': 'rbf', 'C': 44.29226000899686, 'gamma': 0.004028609384972358, 'epsilon': 0.007028809244561372}. Best is trial 58 with value: 0.4679277933792091.
[I 2024-12-03 18:39:51,156] Trial 71 finished with value: 0.47785553840647105 and parameters: {'kernel': 'rbf', 'C': 48.107469368367255, 'gamma': 0.012331737808918455, 'epsilon': 0.002400532948128934}. Best is trial 58 with value: 0.4679277933792091.
[I 2024-12-03 18:39:52,105] Trial 57 finished with value: 0.5510506563108495 and parameters: {'kernel': 'linear', 'C': 38.69315912308295, 'gamma': 0.13645384690922716, 'epsilon': 0.004938965456532027}. Best is trial 58 with value: 0.4679277933792091.
[I 2024-12-03 18:39:52,141] Trial 62 finished with value: 0.524581271904993 and parameters: {'kernel': 'rbf', 'C': 47.11332253881758, 'gamma': 0.006394276112036949, 'epsilon': 0.008616445066755109}. Best is trial 58 with value: 0.4679277933792091.
[I 2024-12-03 18:39:52,144] Trial 63 finished with value: 0.4740045456319009 and parameters: {'kernel': 'rbf', 'C': 18.077621232897094, 'gamma': 0.03721006526754042, 'epsilon': 0.016797074390095715}. Best is trial 58 with value: 0.4679277933792091.
[I 2024-12-03 18:39:52,373] Trial 61 finished with value: 0.5810304389066923 and parameters: {'kernel': 'rbf', 'C': 31.5805367455174, 'gamma': 0.003116325015411856, 'epsilon': 0.0015266148678773606}. Best is trial 58 with value: 0.4679277933792091.
[I 2024-12-03 18:39:52,487] Trial 70 finished with value: 0.647100567093919 and parameters: {'kernel': 'rbf', 'C': 96.18550964869071, 'gamma': 0.05393350829270664, 'epsilon': 0.0016685266222569476}. Best is trial 58 with value: 0.4679277933792091.
[I 2024-12-03 18:39:53,244] Trial 46 finished with value: 0.5562109756115716 and parameters: {'kernel': 'linear', 'C': 98.41282402364304, 'gamma': 0.0008177168716809131, 'epsilon': 0.01830129059117873}. Best is trial 58 with value: 0.4679277933792091.
[I 2024-12-03 18:39:53,249] Trial 59 finished with value: 0.558590224335664 and parameters: {'kernel': 'linear', 'C': 69.92186203412693, 'gamma': 0.011825251591410285, 'epsilon': 0.023207722733352462}. Best is trial 58 with value: 0.4679277933792091.
[I 2024-12-03 18:39:53,343] Trial 76 finished with value: 0.4737484657005961 and parameters: {'kernel': 'rbf', 'C': 28.77306534931386, 'gamma': 0.017515083847777124, 'epsilon': 0.0022055281600070527}. Best is trial 58 with value: 0.4679277933792091.
[I 2024-12-03 18:39:53,413] Trial 66 finished with value: 0.542268811753863 and parameters: {'kernel': 'rbf', 'C': 50.73796451731983, 'gamma': 0.00490103533484411, 'epsilon': 0.001348642228494388}. Best is trial 58 with value: 0.4679277933792091.
[I 2024-12-03 18:39:53,542] Trial 73 finished with value: 0.47711453696994893 and parameters: {'kernel': 'rbf', 'C': 75.70131385930185, 'gamma': 0.025490973791613306, 'epsilon': 0.006024910897810667}. Best is trial 58 with value: 0.4679277933792091.
[I 2024-12-03 18:39:53,793] Trial 72 finished with value: 0.512756980543276 and parameters: {'kernel': 'rbf', 'C': 5.892905336322458, 'gamma': 0.04241722394511984, 'epsilon': 0.02742366760775322}. Best is trial 58 with value: 0.4679277933792091.
[I 2024-12-03 18:39:54,055] Trial 78 finished with value: 0.4777803095414759 and parameters: {'kernel': 'rbf', 'C': 52.29538527121423, 'gamma': 0.011849429840432307, 'epsilon': 0.0021034738224251694}. Best is trial 58 with value: 0.4679277933792091.
[I 2024-12-03 18:39:54,066] Trial 79 finished with value: 1.4309239819239805 and parameters: {'kernel': 'sigmoid', 'C': 0.20510666593479862, 'gamma': 0.0446189162447083, 'epsilon': 0.029548543810767193}. Best is trial 58 with value: 0.4679277933792091.
[I 2024-12-03 18:39:54,419] Trial 83 finished with value: 1.2469308480822114 and parameters: {'kernel': 'rbf', 'C': 0.0077835496831180255, 'gamma': 0.00015020102721897572, 'epsilon': 0.9065852831680303}. Best is trial 58 with value: 0.4679277933792091.
[I 2024-12-03 18:39:54,652] Trial 80 finished with value: 0.533599362164361 and parameters: {'kernel': 'rbf', 'C': 6.324974128389766, 'gamma': 0.02392987784192403, 'epsilon': 0.0430925242470616}. Best is trial 58 with value: 0.4679277933792091.
[I 2024-12-03 18:39:54,982] Trial 54 finished with value: 0.5502474694560092 and parameters: {'kernel': 'linear', 'C': 86.43695033135211, 'gamma': 0.03298239987153467, 'epsilon': 0.002656837173631805}. Best is trial 58 with value: 0.4679277933792091.
[I 2024-12-03 18:39:55,346] Trial 86 finished with value: 0.4804286980233241 and parameters: {'kernel': 'rbf', 'C': 19.45683949334891, 'gamma': 0.020771121951212074, 'epsilon': 0.0026199260758897475}. Best is trial 58 with value: 0.4679277933792091.
[I 2024-12-03 18:39:55,706] Trial 75 finished with value: 0.5302510219045542 and parameters: {'kernel': 'rbf', 'C': 4.599985077593106, 'gamma': 0.061311511897880075, 'epsilon': 0.02104052984220005}. Best is trial 58 with value: 0.4679277933792091.
[I 2024-12-03 18:39:55,720] Trial 88 finished with value: 0.8756301343658707 and parameters: {'kernel': 'poly', 'C': 2.71472749792264, 'gamma': 0.03528032807188645, 'epsilon': 0.011383454582648347}. Best is trial 58 with value: 0.4679277933792091.
[I 2024-12-03 18:39:56,057] Trial 74 finished with value: 0.6115792424923902 and parameters: {'kernel': 'rbf', 'C': 83.65709069633125, 'gamma': 0.11220283927936926, 'epsilon': 0.027351750452493356}. Best is trial 58 with value: 0.4679277933792091.
[I 2024-12-03 18:39:56,557] Trial 77 finished with value: 0.5277368178557396 and parameters: {'kernel': 'rbf', 'C': 73.97230181155405, 'gamma': 0.03541065523860123, 'epsilon': 0.0033232257437203257}. Best is trial 58 with value: 0.4679277933792091.
[I 2024-12-03 18:39:56,586] Trial 84 finished with value: 0.46870823179715787 and parameters: {'kernel': 'rbf', 'C': 38.957704553686774, 'gamma': 0.019791544376338444, 'epsilon': 0.006592835589063901}. Best is trial 58 with value: 0.4679277933792091.
[I 2024-12-03 18:39:57,186] Trial 87 finished with value: 0.47081035709921565 and parameters: {'kernel': 'rbf', 'C': 49.46449488950594, 'gamma': 0.01944150457174517, 'epsilon': 0.0010501321497745379}. Best is trial 58 with value: 0.4679277933792091.
[I 2024-12-03 18:39:57,315] Trial 90 finished with value: 0.6035838248455332 and parameters: {'kernel': 'rbf', 'C': 37.92713854194732, 'gamma': 0.07032939013584284, 'epsilon': 0.0072020348283715245}. Best is trial 58 with value: 0.4679277933792091.
[I 2024-12-03 18:39:57,475] Trial 81 finished with value: 0.5515478842028976 and parameters: {'kernel': 'rbf', 'C': 5.001455656169261, 'gamma': 0.024082020835531705, 'epsilon': 0.0030371457900107983}. Best is trial 58 with value: 0.4679277933792091.
[I 2024-12-03 18:39:57,476] Trial 82 finished with value: 0.47776247164781227 and parameters: {'kernel': 'rbf', 'C': 22.96476078649955, 'gamma': 0.019170657605914413, 'epsilon': 0.0013176793516230098}. Best is trial 58 with value: 0.4679277933792091.
[I 2024-12-03 18:39:57,830] Trial 85 finished with value: 52.45722197561963 and parameters: {'kernel': 'sigmoid', 'C': 18.884718125756024, 'gamma': 0.015696038410164436, 'epsilon': 0.0030601068182692704}. Best is trial 58 with value: 0.4679277933792091.
[I 2024-12-03 18:39:58,190] Trial 93 finished with value: 0.9051520635345182 and parameters: {'kernel': 'poly', 'C': 0.11250008770053327, 'gamma': 0.08022137768461278, 'epsilon': 0.5258313764397224}. Best is trial 102 with value: 0.467065643804122.
[I 2024-12-03 18:39:58,765] Trial 95 finished with value: 1.357692905778498 and parameters: {'kernel': 'sigmoid', 'C': 0.0014737032066808582, 'gamma': 0.09602514451961834, 'epsilon': 0.04345034884686737}. Best is trial 102 with value: 0.467065643804122.
[I 2024-12-03 18:39:59,610] Trial 89 finished with value: 0.4921815527147615 and parameters: {'kernel': 'rbf', 'C': 10.252617387194414, 'gamma': 0.0314993574077878, 'epsilon': 0.004905843940787691}. Best is trial 102 with value: 0.467065643804122.
[I 2024-12-03 18:39:59,740] Trial 92 finished with value: 0.4697965553399532 and parameters: {'kernel': 'rbf', 'C': 98.88252671388067, 'gamma': 0.010859601945082597, 'epsilon': 0.0011163144576244795}. Best is trial 102 with value: 0.467065643804122.
[I 2024-12-03 18:39:59,768] Trial 106 finished with value: 0.7964933018502712 and parameters: {'kernel': 'rbf', 'C': 4.4789040617153635, 'gamma': 0.000944079817833482, 'epsilon': 0.18415927007870078}. Best is trial 102 with value: 0.467065643804122.
[I 2024-12-03 18:39:59,769] Trial 105 finished with value: 0.4999383605102592 and parameters: {'kernel': 'rbf', 'C': 18.19451221486664, 'gamma': 0.05348553430393402, 'epsilon': 0.001003245884432968}. Best is trial 102 with value: 0.467065643804122.
[I 2024-12-03 18:39:59,789] Trial 100 finished with value: 0.6070512031916925 and parameters: {'kernel': 'rbf', 'C': 6.162672273639343, 'gamma': 0.008841784627650852, 'epsilon': 0.00156853920541718}. Best is trial 102 with value: 0.467065643804122.
[I 2024-12-03 18:39:59,978] Trial 97 finished with value: 0.580764577805189 and parameters: {'kernel': 'rbf', 'C': 67.09639171337875, 'gamma': 0.04672923972762785, 'epsilon': 0.0014814335531031105}. Best is trial 94 with value: 0.4653478382570669.
[I 2024-12-03 18:40:00,242] Trial 99 finished with value: 0.9820706735704408 and parameters: {'kernel': 'poly', 'C': 7.090804595780858, 'gamma': 0.013436539756367575, 'epsilon': 0.0014380515956857749}. Best is trial 94 with value: 0.4653478382570669.
[I 2024-12-03 18:40:00,440] Trial 94 finished with value: 0.4653478382570669 and parameters: {'kernel': 'rbf', 'C': 47.99666546777568, 'gamma': 0.024617753205603856, 'epsilon': 0.0098577167335345}. Best is trial 94 with value: 0.4653478382570669.
[I 2024-12-03 18:40:00,466] Trial 102 finished with value: 0.467065643804122 and parameters: {'kernel': 'rbf', 'C': 66.9470202179286, 'gamma': 0.018771552172397246, 'epsilon': 0.0011010051186481535}. Best is trial 94 with value: 0.4653478382570669.
[I 2024-12-03 18:40:00,717] Trial 91 finished with value: 1.3737824704204546 and parameters: {'kernel': 'poly', 'C': 0.02559928046096197, 'gamma': 0.00021019699557631364, 'epsilon': 0.008106576378164119}. Best is trial 94 with value: 0.4653478382570669.
[I 2024-12-03 18:40:00,873] Trial 96 finished with value: 0.4948507462048973 and parameters: {'kernel': 'rbf', 'C': 14.116887418613846, 'gamma': 0.022303453673933694, 'epsilon': 0.0011032936732485402}. Best is trial 94 with value: 0.4653478382570669.
[I 2024-12-03 18:40:01,700] Trial 108 finished with value: 1.3281118189500558 and parameters: {'kernel': 'poly', 'C': 0.0028295877167566117, 'gamma': 0.005654740533424484, 'epsilon': 0.3571159887005964}. Best is trial 107 with value: 0.46093250246896217.
[I 2024-12-03 18:40:01,956] Trial 103 finished with value: 0.7948829089901646 and parameters: {'kernel': 'poly', 'C': 75.33170909490559, 'gamma': 0.0355946093280524, 'epsilon': 0.006590515214254746}. Best is trial 107 with value: 0.46093250246896217.
[I 2024-12-03 18:40:02,344] Trial 101 finished with value: 0.5353810216378951 and parameters: {'kernel': 'rbf', 'C': 10.411958212838105, 'gamma': 0.016370400916869438, 'epsilon': 0.011525847141619538}. Best is trial 107 with value: 0.46093250246896217.
[I 2024-12-03 18:40:02,379] Trial 104 finished with value: 0.47838788971562796 and parameters: {'kernel': 'rbf', 'C': 17.8128424579886, 'gamma': 0.023291803762154804, 'epsilon': 0.0015835927465215043}. Best is trial 107 with value: 0.46093250246896217.
[I 2024-12-03 18:40:03,064] Trial 114 finished with value: 0.4804321722689761 and parameters: {'kernel': 'rbf', 'C': 51.69103426625367, 'gamma': 0.011097001331438663, 'epsilon': 0.010628061506297071}. Best is trial 107 with value: 0.46093250246896217.
[I 2024-12-03 18:40:03,163] Trial 113 finished with value: 6.639552367662316 and parameters: {'kernel': 'sigmoid', 'C': 56.72864559919569, 'gamma': 0.003633004713758544, 'epsilon': 0.001393573416314849}. Best is trial 107 with value: 0.46093250246896217.
[I 2024-12-03 18:40:03,200] Trial 107 finished with value: 0.46093250246896217 and parameters: {'kernel': 'rbf', 'C': 89.00235660154928, 'gamma': 0.015661470870489733, 'epsilon': 0.020870975547158124}. Best is trial 107 with value: 0.46093250246896217.
[I 2024-12-03 18:40:04,070] Trial 98 finished with value: 0.46098410010746405 and parameters: {'kernel': 'rbf', 'C': 48.19229849961403, 'gamma': 0.022040385305813252, 'epsilon': 0.016794920124987234}. Best is trial 107 with value: 0.46093250246896217.
[I 2024-12-03 18:40:04,892] Trial 110 finished with value: 0.4557306861243869 and parameters: {'kernel': 'rbf', 'C': 84.37182180378812, 'gamma': 0.01140358143424496, 'epsilon': 0.06328420632093948}. Best is trial 110 with value: 0.4557306861243869.
[I 2024-12-03 18:40:05,563] Trial 125 finished with value: 225.0186221710026 and parameters: {'kernel': 'sigmoid', 'C': 35.24918879574528, 'gamma': 0.04361490669435529, 'epsilon': 0.02872366759750208}. Best is trial 110 with value: 0.4557306861243869.
[I 2024-12-03 18:40:05,762] Trial 111 finished with value: 0.5919733748259274 and parameters: {'kernel': 'rbf', 'C': 18.350851063980077, 'gamma': 0.10056239604334588, 'epsilon': 0.3461226717659045}. Best is trial 110 with value: 0.4557306861243869.
[I 2024-12-03 18:40:05,803] Trial 115 finished with value: 0.5236307585466482 and parameters: {'kernel': 'rbf', 'C': 29.752330831744256, 'gamma': 0.008106005327703213, 'epsilon': 0.03531317336862352}. Best is trial 110 with value: 0.4557306861243869.
[I 2024-12-03 18:40:06,172] Trial 109 finished with value: 0.5005549799134099 and parameters: {'kernel': 'rbf', 'C': 59.14836836397843, 'gamma': 0.007081854642483011, 'epsilon': 0.10025542215648871}. Best is trial 110 with value: 0.4557306861243869.
[I 2024-12-03 18:40:06,178] Trial 118 finished with value: 0.5585523327714532 and parameters: {'kernel': 'rbf', 'C': 14.383585895580664, 'gamma': 0.0082485151788305, 'epsilon': 0.014900460677819501}. Best is trial 110 with value: 0.4557306861243869.
[I 2024-12-03 18:40:06,185] Trial 124 finished with value: 0.6621044944874696 and parameters: {'kernel': 'linear', 'C': 0.09746445646181655, 'gamma': 0.001157971351594679, 'epsilon': 0.9896792414684016}. Best is trial 110 with value: 0.4557306861243869.
[I 2024-12-03 18:40:06,979] Trial 119 finished with value: 0.8459262024449244 and parameters: {'kernel': 'linear', 'C': 0.002536750343991539, 'gamma': 0.924722651668373, 'epsilon': 0.17965319721191528}. Best is trial 110 with value: 0.4557306861243869.
[I 2024-12-03 18:40:07,035] Trial 129 finished with value: 0.6329375500266162 and parameters: {'kernel': 'rbf', 'C': 49.69111007350563, 'gamma': 0.07337510466824056, 'epsilon': 0.012573084422547023}. Best is trial 110 with value: 0.4557306861243869.
[I 2024-12-03 18:40:07,192] Trial 117 finished with value: 0.4825107136050959 and parameters: {'kernel': 'rbf', 'C': 43.97299581019926, 'gamma': 0.029331527828624738, 'epsilon': 0.08790004631567201}. Best is trial 110 with value: 0.4557306861243869.
[I 2024-12-03 18:40:07,193] Trial 131 finished with value: 1.3628311256923673 and parameters: {'kernel': 'sigmoid', 'C': 0.03925071227014962, 'gamma': 0.00037382044271794295, 'epsilon': 0.08905273734821767}. Best is trial 110 with value: 0.4557306861243869.
[I 2024-12-03 18:40:07,326] Trial 123 finished with value: 0.5779639178787502 and parameters: {'kernel': 'rbf', 'C': 59.32398571482992, 'gamma': 0.001909786716730586, 'epsilon': 0.08101343081735783}. Best is trial 110 with value: 0.4557306861243869.
[I 2024-12-03 18:40:07,669] Trial 120 finished with value: 7.6008539669295745 and parameters: {'kernel': 'sigmoid', 'C': 0.5276278801970254, 'gamma': 0.3449584456868656, 'epsilon': 0.001899942760018921}. Best is trial 110 with value: 0.4557306861243869.
[I 2024-12-03 18:40:07,678] Trial 112 finished with value: 0.51542058582481 and parameters: {'kernel': 'rbf', 'C': 82.75808123464785, 'gamma': 0.03155575111340223, 'epsilon': 0.013935586584092396}. Best is trial 110 with value: 0.4557306861243869.
[I 2024-12-03 18:40:07,681] Trial 126 finished with value: 0.5191554429897651 and parameters: {'kernel': 'rbf', 'C': 84.09856191951465, 'gamma': 0.0050790220635288106, 'epsilon': 0.0011748437631026092}. Best is trial 110 with value: 0.4557306861243869.
[I 2024-12-03 18:40:07,789] Trial 122 finished with value: 0.870486029619701 and parameters: {'kernel': 'sigmoid', 'C': 0.552365412424868, 'gamma': 0.008161539020080193, 'epsilon': 0.8058423297878434}. Best is trial 110 with value: 0.4557306861243869.
[I 2024-12-03 18:40:08,420] Trial 128 finished with value: 0.45715222425918967 and parameters: {'kernel': 'rbf', 'C': 77.4861020038685, 'gamma': 0.017082759555343257, 'epsilon': 0.034691702314032194}. Best is trial 110 with value: 0.4557306861243869.
[I 2024-12-03 18:40:08,463] Trial 127 finished with value: 0.5239157896310581 and parameters: {'kernel': 'rbf', 'C': 96.90927634534252, 'gamma': 0.030476844204919896, 'epsilon': 0.006750658855600518}. Best is trial 110 with value: 0.4557306861243869.
[I 2024-12-03 18:40:09,015] Trial 133 finished with value: 0.7752138924821214 and parameters: {'kernel': 'poly', 'C': 49.591992508832824, 'gamma': 0.028641269803396662, 'epsilon': 0.04395959265295039}. Best is trial 110 with value: 0.4557306861243869.
[I 2024-12-03 18:40:09,082] Trial 130 finished with value: 1.2933743656375007 and parameters: {'kernel': 'poly', 'C': 1.6989761765100748, 'gamma': 0.00011864060709687924, 'epsilon': 0.7500135234396915}. Best is trial 110 with value: 0.4557306861243869.
[I 2024-12-03 18:40:09,634] Trial 134 finished with value: 0.49336493396926123 and parameters: {'kernel': 'rbf', 'C': 33.26392710079746, 'gamma': 0.011939996033390566, 'epsilon': 0.017208228865362038}. Best is trial 110 with value: 0.4557306861243869.
[I 2024-12-03 18:40:09,877] Trial 135 finished with value: 0.8546222269925176 and parameters: {'kernel': 'poly', 'C': 51.25116692072655, 'gamma': 0.028145011191136042, 'epsilon': 0.40880281551161746}. Best is trial 110 with value: 0.4557306861243869.
[I 2024-12-03 18:40:09,887] Trial 121 finished with value: 1.067713370527773 and parameters: {'kernel': 'poly', 'C': 79.600406416445, 'gamma': 0.004082742465767359, 'epsilon': 0.355962158177301}. Best is trial 110 with value: 0.4557306861243869.
[I 2024-12-03 18:40:11,619] Trial 142 finished with value: 1.3260501286054096 and parameters: {'kernel': 'rbf', 'C': 0.018444094065154657, 'gamma': 0.25846866256520334, 'epsilon': 0.019015679110899967}. Best is trial 110 with value: 0.4557306861243869.
[I 2024-12-03 18:40:11,740] Trial 139 finished with value: 0.4722761149755402 and parameters: {'kernel': 'rbf', 'C': 93.47728655973027, 'gamma': 0.02078081563625946, 'epsilon': 0.0015333603189927945}. Best is trial 110 with value: 0.4557306861243869.
[I 2024-12-03 18:40:11,753] Trial 132 finished with value: 0.5888923790754569 and parameters: {'kernel': 'rbf', 'C': 76.29663733935169, 'gamma': 0.001113627854628689, 'epsilon': 0.017834717193924782}. Best is trial 110 with value: 0.4557306861243869.
[I 2024-12-03 18:40:11,764] Trial 116 finished with value: 0.46570336315915944 and parameters: {'kernel': 'rbf', 'C': 33.02867368357019, 'gamma': 0.028406665140726053, 'epsilon': 0.018611571060074324}. Best is trial 110 with value: 0.4557306861243869.
[I 2024-12-03 18:40:11,882] Trial 141 finished with value: 0.45975378816594953 and parameters: {'kernel': 'rbf', 'C': 99.994811704091, 'gamma': 0.010685327604055382, 'epsilon': 0.04039910664974561}. Best is trial 110 with value: 0.4557306861243869.
