[I 2024-12-04 13:52:50,017] Trial 2454 finished with value: 0.3493132532635573 and parameters: {'n_estimators': 1431, 'learning_rate': 0.05736850526300022, 'max_depth': 5, 'min_samples_split': 7, 'min_samples_leaf': 3, 'subsample': 0.7706910957053632, 'max_features': 'sqrt'}. Best is trial 2314 with value: 0.22206050798261862.
[I 2024-12-04 13:52:51,070] Trial 2464 finished with value: 0.25510189305801984 and parameters: {'n_estimators': 1176, 'learning_rate': 0.09507641111197837, 'max_depth': 9, 'min_samples_split': 6, 'min_samples_leaf': 1, 'subsample': 0.6873594877867129, 'max_features': 'sqrt'}. Best is trial 2314 with value: 0.22206050798261862.
[I 2024-12-04 13:52:54,807] Trial 2458 finished with value: 0.23537940537500973 and parameters: {'n_estimators': 1465, 'learning_rate': 0.08774219413873893, 'max_depth': 6, 'min_samples_split': 3, 'min_samples_leaf': 1, 'subsample': 0.7421939056337572, 'max_features': 'sqrt'}. Best is trial 2314 with value: 0.22206050798261862.
[I 2024-12-04 13:53:01,027] Trial 2491 finished with value: 1.2420488584281772 and parameters: {'n_estimators': 188, 'learning_rate': 0.010705434234319607, 'max_depth': 12, 'min_samples_split': 3, 'min_samples_leaf': 7, 'subsample': 0.6381515472352925, 'max_features': 'log2'}. Best is trial 2314 with value: 0.22206050798261862.
[I 2024-12-04 13:53:03,876] Trial 2465 finished with value: 0.7272073706646901 and parameters: {'n_estimators': 1311, 'learning_rate': 0.03295758696459465, 'max_depth': 5, 'min_samples_split': 9, 'min_samples_leaf': 9, 'subsample': 0.686813683862733, 'max_features': 'log2'}. Best is trial 2314 with value: 0.22206050798261862.
[I 2024-12-04 13:53:10,438] Trial 2484 finished with value: 0.32191924577760445 and parameters: {'n_estimators': 534, 'learning_rate': 0.04544592480251446, 'max_depth': 11, 'min_samples_split': 18, 'min_samples_leaf': 1, 'subsample': 0.6589769368743912, 'max_features': None}. Best is trial 2314 with value: 0.22206050798261862.
[I 2024-12-04 13:53:11,150] Trial 2477 finished with value: 0.3366467221717011 and parameters: {'n_estimators': 838, 'learning_rate': 0.06737268390132892, 'max_depth': 10, 'min_samples_split': 20, 'min_samples_leaf': 2, 'subsample': 0.8586419738707596, 'max_features': None}. Best is trial 2314 with value: 0.22206050798261862.
[I 2024-12-04 13:53:15,261] Trial 2466 finished with value: 0.3002096980864484 and parameters: {'n_estimators': 1434, 'learning_rate': 0.024268498058840123, 'max_depth': 7, 'min_samples_split': 16, 'min_samples_leaf': 2, 'subsample': 0.6824299900774944, 'max_features': 'sqrt'}. Best is trial 2314 with value: 0.22206050798261862.
[I 2024-12-04 13:53:15,790] Trial 2471 finished with value: 0.25480831089773226 and parameters: {'n_estimators': 1184, 'learning_rate': 0.061631667162668144, 'max_depth': 12, 'min_samples_split': 2, 'min_samples_leaf': 1, 'subsample': 0.7442225774430773, 'max_features': 'sqrt'}. Best is trial 2314 with value: 0.22206050798261862.
[I 2024-12-04 13:53:18,531] Trial 2467 finished with value: 0.2509102248225971 and parameters: {'n_estimators': 1432, 'learning_rate': 0.0490746544617998, 'max_depth': 11, 'min_samples_split': 5, 'min_samples_leaf': 1, 'subsample': 0.6680030584393418, 'max_features': 'sqrt'}. Best is trial 2314 with value: 0.22206050798261862.
[I 2024-12-04 13:53:20,736] Trial 2472 finished with value: 0.3685192523878214 and parameters: {'n_estimators': 1290, 'learning_rate': 0.09182023669987757, 'max_depth': 10, 'min_samples_split': 6, 'min_samples_leaf': 3, 'subsample': 0.9475769119598498, 'max_features': 'sqrt'}. Best is trial 2314 with value: 0.22206050798261862.
[I 2024-12-04 13:53:22,019] Trial 2470 finished with value: 0.27709571169406993 and parameters: {'n_estimators': 1398, 'learning_rate': 0.04660391187576326, 'max_depth': 7, 'min_samples_split': 2, 'min_samples_leaf': 1, 'subsample': 0.7134611976542197, 'max_features': 'log2'}. Best is trial 2314 with value: 0.22206050798261862.
[I 2024-12-04 13:53:22,419] Trial 2496 finished with value: 0.4913309675357491 and parameters: {'n_estimators': 342, 'learning_rate': 0.01922883168764823, 'max_depth': 5, 'min_samples_split': 13, 'min_samples_leaf': 10, 'subsample': 0.9017140130788506, 'max_features': None}. Best is trial 2314 with value: 0.22206050798261862.
[I 2024-12-04 13:53:23,268] Trial 2468 finished with value: 0.28019502503250737 and parameters: {'n_estimators': 1488, 'learning_rate': 0.05503714600648058, 'max_depth': 12, 'min_samples_split': 2, 'min_samples_leaf': 2, 'subsample': 0.6332743950391142, 'max_features': 'sqrt'}. Best is trial 2314 with value: 0.22206050798261862.
[I 2024-12-04 13:53:24,490] Trial 2486 finished with value: 0.3645869568175343 and parameters: {'n_estimators': 773, 'learning_rate': 0.0901357681442895, 'max_depth': 11, 'min_samples_split': 5, 'min_samples_leaf': 4, 'subsample': 0.922575336179224, 'max_features': 'sqrt'}. Best is trial 2314 with value: 0.22206050798261862.
[I 2024-12-04 13:53:24,846] Trial 2478 finished with value: 0.24741775171113953 and parameters: {'n_estimators': 1156, 'learning_rate': 0.06810192159217833, 'max_depth': 9, 'min_samples_split': 2, 'min_samples_leaf': 1, 'subsample': 0.9464544426014433, 'max_features': 'sqrt'}. Best is trial 2314 with value: 0.22206050798261862.
[I 2024-12-04 13:53:24,999] Trial 2475 finished with value: 0.265111642258112 and parameters: {'n_estimators': 1236, 'learning_rate': 0.05751693876694185, 'max_depth': 8, 'min_samples_split': 7, 'min_samples_leaf': 1, 'subsample': 0.7941553935279261, 'max_features': 'sqrt'}. Best is trial 2314 with value: 0.22206050798261862.
[I 2024-12-04 13:53:25,283] Trial 2474 finished with value: 0.24595897814342582 and parameters: {'n_estimators': 1308, 'learning_rate': 0.09763483900099526, 'max_depth': 10, 'min_samples_split': 4, 'min_samples_leaf': 1, 'subsample': 0.8626671553998126, 'max_features': 'sqrt'}. Best is trial 2314 with value: 0.22206050798261862.
[I 2024-12-04 13:53:26,553] Trial 2476 finished with value: 0.22978061482542858 and parameters: {'n_estimators': 1231, 'learning_rate': 0.06282959685053004, 'max_depth': 8, 'min_samples_split': 3, 'min_samples_leaf': 1, 'subsample': 0.7605715236951786, 'max_features': 'sqrt'}. Best is trial 2314 with value: 0.22206050798261862.
[I 2024-12-04 13:53:29,677] Trial 2473 finished with value: 0.3669134456002528 and parameters: {'n_estimators': 1427, 'learning_rate': 0.09671825995352641, 'max_depth': 3, 'min_samples_split': 4, 'min_samples_leaf': 4, 'subsample': 0.6199827681352137, 'max_features': 'sqrt'}. Best is trial 2314 with value: 0.22206050798261862.
[I 2024-12-04 13:53:31,974] Trial 2483 finished with value: 0.2548125113068075 and parameters: {'n_estimators': 1085, 'learning_rate': 0.08955169022382886, 'max_depth': 8, 'min_samples_split': 2, 'min_samples_leaf': 1, 'subsample': 0.6704132983919971, 'max_features': 'sqrt'}. Best is trial 2314 with value: 0.22206050798261862.
[I 2024-12-04 13:53:32,155] Trial 2482 finished with value: 0.5284212468258441 and parameters: {'n_estimators': 1066, 'learning_rate': 0.015280229554510118, 'max_depth': 7, 'min_samples_split': 7, 'min_samples_leaf': 8, 'subsample': 0.7941013133121922, 'max_features': 'sqrt'}. Best is trial 2314 with value: 0.22206050798261862.
[I 2024-12-04 13:53:34,116] Trial 2485 finished with value: 0.35809012379939437 and parameters: {'n_estimators': 1062, 'learning_rate': 0.057256721902793066, 'max_depth': 9, 'min_samples_split': 2, 'min_samples_leaf': 3, 'subsample': 0.7772546748563317, 'max_features': 'sqrt'}. Best is trial 2314 with value: 0.22206050798261862.
[I 2024-12-04 13:53:34,966] Trial 2479 finished with value: 0.35933617427461517 and parameters: {'n_estimators': 1420, 'learning_rate': 0.09613650748492256, 'max_depth': 8, 'min_samples_split': 8, 'min_samples_leaf': 3, 'subsample': 0.8533003010114043, 'max_features': 'sqrt'}. Best is trial 2314 with value: 0.22206050798261862.
[I 2024-12-04 13:53:36,614] Trial 2489 finished with value: 0.35068700724140905 and parameters: {'n_estimators': 1058, 'learning_rate': 0.061236189061786586, 'max_depth': 8, 'min_samples_split': 6, 'min_samples_leaf': 3, 'subsample': 0.9155417341051583, 'max_features': 'sqrt'}. Best is trial 2314 with value: 0.22206050798261862.
[I 2024-12-04 13:53:37,881] Trial 2487 finished with value: 0.24792005251689297 and parameters: {'n_estimators': 1133, 'learning_rate': 0.09877217769923051, 'max_depth': 8, 'min_samples_split': 5, 'min_samples_leaf': 1, 'subsample': 0.8145037265359042, 'max_features': 'sqrt'}. Best is trial 2314 with value: 0.22206050798261862.
[I 2024-12-04 13:53:38,217] Trial 2497 finished with value: 0.31260483188945065 and parameters: {'n_estimators': 842, 'learning_rate': 0.05430168521351378, 'max_depth': 9, 'min_samples_split': 5, 'min_samples_leaf': 1, 'subsample': 0.9734871829952614, 'max_features': 'log2'}. Best is trial 2314 with value: 0.22206050798261862.
[I 2024-12-04 13:53:39,173] Trial 2480 finished with value: 0.2822586971875638 and parameters: {'n_estimators': 1487, 'learning_rate': 0.08499426846317128, 'max_depth': 7, 'min_samples_split': 5, 'min_samples_leaf': 2, 'subsample': 0.7705379629116971, 'max_features': 'sqrt'}. Best is trial 2314 with value: 0.22206050798261862.
[I 2024-12-04 13:53:40,674] Trial 2481 finished with value: 0.36612946670476715 and parameters: {'n_estimators': 1488, 'learning_rate': 0.09182884514356136, 'max_depth': 9, 'min_samples_split': 4, 'min_samples_leaf': 4, 'subsample': 0.7453446605348714, 'max_features': 'sqrt'}. Best is trial 2314 with value: 0.22206050798261862.
[I 2024-12-04 13:53:41,558] Trial 2499 finished with value: 0.2567531455271679 and parameters: {'n_estimators': 925, 'learning_rate': 0.06188890542151865, 'max_depth': 8, 'min_samples_split': 5, 'min_samples_leaf': 1, 'subsample': 0.700020481698019, 'max_features': 'sqrt'}. Best is trial 2314 with value: 0.22206050798261862.
[I 2024-12-04 13:53:42,738] Trial 2488 finished with value: 0.3469930423408646 and parameters: {'n_estimators': 1425, 'learning_rate': 0.0918610935989017, 'max_depth': 7, 'min_samples_split': 4, 'min_samples_leaf': 3, 'subsample': 0.73542521399638, 'max_features': 'sqrt'}. Best is trial 2314 with value: 0.22206050798261862.
[I 2024-12-04 13:53:42,905] Trial 2492 finished with value: 0.3203404781545256 and parameters: {'n_estimators': 1348, 'learning_rate': 0.017932993131150494, 'max_depth': 12, 'min_samples_split': 18, 'min_samples_leaf': 1, 'subsample': 0.7464748235521463, 'max_features': 'log2'}. Best is trial 2314 with value: 0.22206050798261862.
[I 2024-12-04 13:53:43,051] Trial 2494 finished with value: 0.2568119293023703 and parameters: {'n_estimators': 1244, 'learning_rate': 0.0974846759366575, 'max_depth': 7, 'min_samples_split': 5, 'min_samples_leaf': 1, 'subsample': 0.7250404163034164, 'max_features': 'sqrt'}. Best is trial 2314 with value: 0.22206050798261862.
[I 2024-12-04 13:53:43,118] Trial 2490 finished with value: 0.23879131145240245 and parameters: {'n_estimators': 1452, 'learning_rate': 0.09904088530708749, 'max_depth': 6, 'min_samples_split': 2, 'min_samples_leaf': 1, 'subsample': 0.7772348792384118, 'max_features': 'sqrt'}. Best is trial 2314 with value: 0.22206050798261862.
[I 2024-12-04 13:53:43,122] Trial 2495 finished with value: 0.23537715103370777 and parameters: {'n_estimators': 1238, 'learning_rate': 0.07460991630419907, 'max_depth': 8, 'min_samples_split': 2, 'min_samples_leaf': 1, 'subsample': 0.8561572730519506, 'max_features': 'sqrt'}. Best is trial 2314 with value: 0.22206050798261862.
[I 2024-12-04 13:53:43,457] Trial 2498 finished with value: 0.34661402298213306 and parameters: {'n_estimators': 1419, 'learning_rate': 0.0763618702925007, 'max_depth': 10, 'min_samples_split': 5, 'min_samples_leaf': 3, 'subsample': 0.6936167293142708, 'max_features': 'sqrt'}. Best is trial 2314 with value: 0.22206050798261862.
[I 2024-12-04 13:53:44,300] Trial 2493 finished with value: 0.3497299220965075 and parameters: {'n_estimators': 1439, 'learning_rate': 0.0560930734088848, 'max_depth': 10, 'min_samples_split': 3, 'min_samples_leaf': 1, 'subsample': 0.7180674834477303, 'max_features': None}. Best is trial 2314 with value: 0.22206050798261862.
