[I 2024-12-04 12:31:42,567] Trial 958 finished with value: 0.4160107773607718 and parameters: {'n_estimators': 385, 'learning_rate': 0.024849095542901656, 'max_depth': 11, 'min_samples_split': 11, 'min_samples_leaf': 7, 'subsample': 0.8693436405015696, 'max_features': None}. Best is trial 428 with value: 0.31740361133065975.
[I 2024-12-04 12:31:43,745] Trial 937 finished with value: 0.39210654438230674 and parameters: {'n_estimators': 1057, 'learning_rate': 0.05456175777871851, 'max_depth': 6, 'min_samples_split': 7, 'min_samples_leaf': 1, 'subsample': 0.6561361356957769, 'max_features': None}. Best is trial 428 with value: 0.31740361133065975.
[I 2024-12-04 12:31:46,720] Trial 940 finished with value: 0.3796497825958665 and parameters: {'n_estimators': 1158, 'learning_rate': 0.048698490116216, 'max_depth': 10, 'min_samples_split': 4, 'min_samples_leaf': 2, 'subsample': 0.7565685533363569, 'max_features': 'sqrt'}. Best is trial 428 with value: 0.31740361133065975.
[I 2024-12-04 12:31:48,667] Trial 934 finished with value: 0.3841010847114293 and parameters: {'n_estimators': 1256, 'learning_rate': 0.07587634452007863, 'max_depth': 7, 'min_samples_split': 4, 'min_samples_leaf': 3, 'subsample': 0.6558435112243919, 'max_features': None}. Best is trial 428 with value: 0.31740361133065975.
[I 2024-12-04 12:31:50,081] Trial 931 finished with value: 0.389258505075102 and parameters: {'n_estimators': 1376, 'learning_rate': 0.0784749003191033, 'max_depth': 8, 'min_samples_split': 7, 'min_samples_leaf': 3, 'subsample': 0.7223867716221095, 'max_features': None}. Best is trial 428 with value: 0.31740361133065975.
[I 2024-12-04 12:31:50,082] Trial 945 finished with value: 0.3845538365122339 and parameters: {'n_estimators': 1179, 'learning_rate': 0.0656213790743793, 'max_depth': 7, 'min_samples_split': 10, 'min_samples_leaf': 2, 'subsample': 0.7525114221377887, 'max_features': 'sqrt'}. Best is trial 428 with value: 0.31740361133065975.
[I 2024-12-04 12:31:51,172] Trial 964 finished with value: 0.9691345314066041 and parameters: {'n_estimators': 344, 'learning_rate': 0.0142039771837182, 'max_depth': 9, 'min_samples_split': 12, 'min_samples_leaf': 8, 'subsample': 0.9851189676126362, 'max_features': 'log2'}. Best is trial 428 with value: 0.31740361133065975.
[I 2024-12-04 12:31:51,180] Trial 930 finished with value: 0.368208043403739 and parameters: {'n_estimators': 1421, 'learning_rate': 0.09015453506062833, 'max_depth': 8, 'min_samples_split': 6, 'min_samples_leaf': 4, 'subsample': 0.6818599152369014, 'max_features': None}. Best is trial 428 with value: 0.31740361133065975.
[I 2024-12-04 12:31:51,223] Trial 936 finished with value: 0.3988812496252957 and parameters: {'n_estimators': 1230, 'learning_rate': 0.0747710391377501, 'max_depth': 7, 'min_samples_split': 3, 'min_samples_leaf': 3, 'subsample': 0.6932729774281177, 'max_features': None}. Best is trial 428 with value: 0.31740361133065975.
[I 2024-12-04 12:31:52,643] Trial 949 finished with value: 0.3850533866170928 and parameters: {'n_estimators': 965, 'learning_rate': 0.09770501732124987, 'max_depth': 5, 'min_samples_split': 6, 'min_samples_leaf': 1, 'subsample': 0.6832967528538647, 'max_features': None}. Best is trial 428 with value: 0.31740361133065975.
[I 2024-12-04 12:31:53,720] Trial 943 finished with value: 0.4017290074756334 and parameters: {'n_estimators': 1096, 'learning_rate': 0.08110644945942007, 'max_depth': 8, 'min_samples_split': 7, 'min_samples_leaf': 1, 'subsample': 0.7998166118252803, 'max_features': None}. Best is trial 428 with value: 0.31740361133065975.
[I 2024-12-04 12:31:54,990] Trial 951 finished with value: 0.39401501816797363 and parameters: {'n_estimators': 1034, 'learning_rate': 0.08459549084969605, 'max_depth': 7, 'min_samples_split': 6, 'min_samples_leaf': 3, 'subsample': 0.6392314083309454, 'max_features': 'sqrt'}. Best is trial 428 with value: 0.31740361133065975.
[I 2024-12-04 12:31:55,377] Trial 965 finished with value: 0.389726578252568 and parameters: {'n_estimators': 377, 'learning_rate': 0.09828229668050767, 'max_depth': 9, 'min_samples_split': 4, 'min_samples_leaf': 1, 'subsample': 0.6511207640679348, 'max_features': None}. Best is trial 428 with value: 0.31740361133065975.
[I 2024-12-04 12:31:57,579] Trial 955 finished with value: 0.3575301700870059 and parameters: {'n_estimators': 908, 'learning_rate': 0.07906162216328669, 'max_depth': 6, 'min_samples_split': 9, 'min_samples_leaf': 2, 'subsample': 0.9114486363973926, 'max_features': None}. Best is trial 428 with value: 0.31740361133065975.
[I 2024-12-04 12:31:58,539] Trial 941 finished with value: 0.3859264121254258 and parameters: {'n_estimators': 1182, 'learning_rate': 0.09066430663047179, 'max_depth': 7, 'min_samples_split': 2, 'min_samples_leaf': 1, 'subsample': 0.7604098244595904, 'max_features': None}. Best is trial 428 with value: 0.31740361133065975.
[I 2024-12-04 12:31:59,630] Trial 952 finished with value: 0.37181409533056886 and parameters: {'n_estimators': 1016, 'learning_rate': 0.05508389713243867, 'max_depth': 9, 'min_samples_split': 10, 'min_samples_leaf': 3, 'subsample': 0.7170789195629872, 'max_features': None}. Best is trial 428 with value: 0.31740361133065975.
[I 2024-12-04 12:32:00,030] Trial 948 finished with value: 0.3907833217908787 and parameters: {'n_estimators': 1130, 'learning_rate': 0.08866157792926212, 'max_depth': 8, 'min_samples_split': 6, 'min_samples_leaf': 3, 'subsample': 0.8035383483529042, 'max_features': None}. Best is trial 428 with value: 0.31740361133065975.
[I 2024-12-04 12:32:02,778] Trial 942 finished with value: 0.3371636265038668 and parameters: {'n_estimators': 1343, 'learning_rate': 0.0988666818742984, 'max_depth': 7, 'min_samples_split': 6, 'min_samples_leaf': 2, 'subsample': 0.7580115200685786, 'max_features': None}. Best is trial 428 with value: 0.31740361133065975.
[I 2024-12-04 12:32:02,778] Trial 944 finished with value: 0.37551943146250233 and parameters: {'n_estimators': 1317, 'learning_rate': 0.06691041603765768, 'max_depth': 9, 'min_samples_split': 9, 'min_samples_leaf': 1, 'subsample': 0.7821529798789009, 'max_features': None}. Best is trial 428 with value: 0.31740361133065975.
[I 2024-12-04 12:32:06,651] Trial 947 finished with value: 0.3183598916371086 and parameters: {'n_estimators': 1404, 'learning_rate': 0.0898248437419127, 'max_depth': 6, 'min_samples_split': 2, 'min_samples_leaf': 2, 'subsample': 0.6496777200928849, 'max_features': None}. Best is trial 428 with value: 0.31740361133065975.
[I 2024-12-04 12:32:07,938] Trial 950 finished with value: 0.37602966301814783 and parameters: {'n_estimators': 1359, 'learning_rate': 0.0706104087580548, 'max_depth': 7, 'min_samples_split': 2, 'min_samples_leaf': 1, 'subsample': 0.7168378287074685, 'max_features': None}. Best is trial 428 with value: 0.31740361133065975.
[I 2024-12-04 12:32:07,963] Trial 959 finished with value: 0.4062768065306898 and parameters: {'n_estimators': 1164, 'learning_rate': 0.07005921448361442, 'max_depth': 8, 'min_samples_split': 2, 'min_samples_leaf': 4, 'subsample': 0.7278356996838151, 'max_features': 'sqrt'}. Best is trial 428 with value: 0.31740361133065975.
[I 2024-12-04 12:32:09,854] Trial 962 finished with value: 0.3250137449406406 and parameters: {'n_estimators': 981, 'learning_rate': 0.06405868635604725, 'max_depth': 8, 'min_samples_split': 5, 'min_samples_leaf': 2, 'subsample': 0.6702072088611313, 'max_features': None}. Best is trial 428 with value: 0.31740361133065975.
[I 2024-12-04 12:32:11,283] Trial 957 finished with value: 0.38457014704601 and parameters: {'n_estimators': 1298, 'learning_rate': 0.054620204454956814, 'max_depth': 7, 'min_samples_split': 6, 'min_samples_leaf': 1, 'subsample': 0.702295418969043, 'max_features': None}. Best is trial 428 with value: 0.31740361133065975.
[I 2024-12-04 12:32:12,114] Trial 984 finished with value: 0.551464305243972 and parameters: {'n_estimators': 201, 'learning_rate': 0.0703837611194433, 'max_depth': 4, 'min_samples_split': 6, 'min_samples_leaf': 6, 'subsample': 0.853495978781672, 'max_features': 'sqrt'}. Best is trial 428 with value: 0.31740361133065975.
[I 2024-12-04 12:32:13,553] Trial 961 finished with value: 0.32908444841138934 and parameters: {'n_estimators': 1148, 'learning_rate': 0.06354143583423016, 'max_depth': 7, 'min_samples_split': 3, 'min_samples_leaf': 2, 'subsample': 0.6577472023209245, 'max_features': None}. Best is trial 428 with value: 0.31740361133065975.
[I 2024-12-04 12:32:14,982] Trial 963 finished with value: 0.4304609278217865 and parameters: {'n_estimators': 1272, 'learning_rate': 0.031050430331363624, 'max_depth': 11, 'min_samples_split': 5, 'min_samples_leaf': 2, 'subsample': 0.9844685154547679, 'max_features': 'log2'}. Best is trial 428 with value: 0.31740361133065975.
[I 2024-12-04 12:32:15,812] Trial 960 finished with value: 0.3905643358338191 and parameters: {'n_estimators': 1153, 'learning_rate': 0.054176308043376434, 'max_depth': 9, 'min_samples_split': 5, 'min_samples_leaf': 3, 'subsample': 0.6816654187694317, 'max_features': None}. Best is trial 428 with value: 0.31740361133065975.
[I 2024-12-04 12:32:16,368] Trial 956 finished with value: 0.3816914081822754 and parameters: {'n_estimators': 1464, 'learning_rate': 0.056716990583118965, 'max_depth': 7, 'min_samples_split': 7, 'min_samples_leaf': 3, 'subsample': 0.7069481514321815, 'max_features': None}. Best is trial 428 with value: 0.31740361133065975.
[I 2024-12-04 12:32:17,547] Trial 971 finished with value: 0.337137858954492 and parameters: {'n_estimators': 889, 'learning_rate': 0.03971672946706639, 'max_depth': 6, 'min_samples_split': 4, 'min_samples_leaf': 2, 'subsample': 0.6483823404768838, 'max_features': None}. Best is trial 428 with value: 0.31740361133065975.
[I 2024-12-04 12:32:18,148] Trial 988 finished with value: 0.5346560470785251 and parameters: {'n_estimators': 344, 'learning_rate': 0.017113540510626905, 'max_depth': 8, 'min_samples_split': 5, 'min_samples_leaf': 2, 'subsample': 0.737487647193563, 'max_features': 'sqrt'}. Best is trial 428 with value: 0.31740361133065975.
[I 2024-12-04 12:32:21,809] Trial 967 finished with value: 0.5441658334130016 and parameters: {'n_estimators': 1223, 'learning_rate': 0.027039746946871324, 'max_depth': 8, 'min_samples_split': 17, 'min_samples_leaf': 4, 'subsample': 0.6459415671413685, 'max_features': 'log2'}. Best is trial 428 with value: 0.31740361133065975.
[I 2024-12-04 12:32:21,952] Trial 966 finished with value: 0.3294053492962489 and parameters: {'n_estimators': 1047, 'learning_rate': 0.06068513545248865, 'max_depth': 9, 'min_samples_split': 3, 'min_samples_leaf': 2, 'subsample': 0.6798559814785661, 'max_features': None}. Best is trial 428 with value: 0.31740361133065975.
[I 2024-12-04 12:32:22,580] Trial 977 finished with value: 0.4466169280778182 and parameters: {'n_estimators': 914, 'learning_rate': 0.03763595068944532, 'max_depth': 6, 'min_samples_split': 12, 'min_samples_leaf': 1, 'subsample': 0.9385563721575803, 'max_features': 'log2'}. Best is trial 428 with value: 0.31740361133065975.
[I 2024-12-04 12:32:25,464] Trial 976 finished with value: 0.374289068649545 and parameters: {'n_estimators': 854, 'learning_rate': 0.09354464669282751, 'max_depth': 8, 'min_samples_split': 6, 'min_samples_leaf': 4, 'subsample': 0.8502672591673565, 'max_features': None}. Best is trial 428 with value: 0.31740361133065975.
[I 2024-12-04 12:32:26,185] Trial 978 finished with value: 0.37023644044907833 and parameters: {'n_estimators': 815, 'learning_rate': 0.09554473527246865, 'max_depth': 8, 'min_samples_split': 9, 'min_samples_leaf': 3, 'subsample': 0.7370627753505078, 'max_features': None}. Best is trial 428 with value: 0.31740361133065975.
[I 2024-12-04 12:32:26,912] Trial 969 finished with value: 0.4115397559695991 and parameters: {'n_estimators': 1339, 'learning_rate': 0.07015719927229384, 'max_depth': 7, 'min_samples_split': 2, 'min_samples_leaf': 3, 'subsample': 0.6213488128916795, 'max_features': 'sqrt'}. Best is trial 428 with value: 0.31740361133065975.
[I 2024-12-04 12:32:27,803] Trial 973 finished with value: 0.37768986270372373 and parameters: {'n_estimators': 1072, 'learning_rate': 0.05897201198306995, 'max_depth': 7, 'min_samples_split': 3, 'min_samples_leaf': 1, 'subsample': 0.6747871761619096, 'max_features': None}. Best is trial 428 with value: 0.31740361133065975.
[I 2024-12-04 12:32:28,804] Trial 979 finished with value: 0.3795425400538184 and parameters: {'n_estimators': 846, 'learning_rate': 0.09415412927661813, 'max_depth': 8, 'min_samples_split': 6, 'min_samples_leaf': 1, 'subsample': 0.682045644390447, 'max_features': None}. Best is trial 428 with value: 0.31740361133065975.
[I 2024-12-04 12:32:28,805] Trial 975 finished with value: 0.3393796667020208 and parameters: {'n_estimators': 979, 'learning_rate': 0.09365051052658194, 'max_depth': 9, 'min_samples_split': 6, 'min_samples_leaf': 2, 'subsample': 0.6184944492898613, 'max_features': None}. Best is trial 428 with value: 0.31740361133065975.
[I 2024-12-04 12:32:29,744] Trial 972 finished with value: 0.3329486177052836 and parameters: {'n_estimators': 1171, 'learning_rate': 0.05261970166289075, 'max_depth': 6, 'min_samples_split': 2, 'min_samples_leaf': 2, 'subsample': 0.7168444080387992, 'max_features': None}. Best is trial 428 with value: 0.31740361133065975.
[I 2024-12-04 12:32:32,716] Trial 970 finished with value: 0.362761470162004 and parameters: {'n_estimators': 1416, 'learning_rate': 0.02801948771860587, 'max_depth': 11, 'min_samples_split': 15, 'min_samples_leaf': 2, 'subsample': 0.9118399052048731, 'max_features': 'sqrt'}. Best is trial 428 with value: 0.31740361133065975.
[I 2024-12-04 12:32:33,014] Trial 968 finished with value: 0.38381683663503013 and parameters: {'n_estimators': 1400, 'learning_rate': 0.06161086428243034, 'max_depth': 5, 'min_samples_split': 6, 'min_samples_leaf': 1, 'subsample': 0.6111419992724807, 'max_features': None}. Best is trial 428 with value: 0.31740361133065975.
[I 2024-12-04 12:32:33,149] Trial 982 finished with value: 0.38753794329296193 and parameters: {'n_estimators': 885, 'learning_rate': 0.05202455613701942, 'max_depth': 7, 'min_samples_split': 2, 'min_samples_leaf': 3, 'subsample': 0.6867060757760809, 'max_features': None}. Best is trial 428 with value: 0.31740361133065975.
[I 2024-12-04 12:32:35,847] Trial 974 finished with value: 0.39317571936604717 and parameters: {'n_estimators': 1191, 'learning_rate': 0.06508574075307429, 'max_depth': 6, 'min_samples_split': 6, 'min_samples_leaf': 1, 'subsample': 0.8051293726464324, 'max_features': None}. Best is trial 428 with value: 0.31740361133065975.
[I 2024-12-04 12:32:37,062] Trial 980 finished with value: 0.3332882893617505 and parameters: {'n_estimators': 1018, 'learning_rate': 0.06716466100786199, 'max_depth': 7, 'min_samples_split': 3, 'min_samples_leaf': 2, 'subsample': 0.7071794608763328, 'max_features': None}. Best is trial 428 with value: 0.31740361133065975.
[I 2024-12-04 12:32:40,368] Trial 983 finished with value: 0.3167302963613237 and parameters: {'n_estimators': 1065, 'learning_rate': 0.09621898751691743, 'max_depth': 6, 'min_samples_split': 5, 'min_samples_leaf': 2, 'subsample': 0.7485651589255788, 'max_features': None}. Best is trial 983 with value: 0.3167302963613237.
[I 2024-12-04 12:32:40,408] Trial 985 finished with value: 0.38399090230579963 and parameters: {'n_estimators': 969, 'learning_rate': 0.06151916242401884, 'max_depth': 10, 'min_samples_split': 5, 'min_samples_leaf': 3, 'subsample': 0.7184016553493794, 'max_features': None}. Best is trial 983 with value: 0.3167302963613237.
[I 2024-12-04 12:32:44,067] Trial 981 finished with value: 0.36863212219762415 and parameters: {'n_estimators': 1207, 'learning_rate': 0.05021618693101572, 'max_depth': 7, 'min_samples_split': 6, 'min_samples_leaf': 4, 'subsample': 0.7154797106271267, 'max_features': None}. Best is trial 983 with value: 0.3167302963613237.
[I 2024-12-04 12:32:45,689] Trial 1013 finished with value: 0.6055366684925231 and parameters: {'n_estimators': 217, 'learning_rate': 0.01838270850952931, 'max_depth': 10, 'min_samples_split': 17, 'min_samples_leaf': 3, 'subsample': 0.7487895256435477, 'max_features': 'sqrt'}. Best is trial 983 with value: 0.3167302963613237.
[I 2024-12-04 12:32:47,341] Trial 987 finished with value: 0.39979251330931026 and parameters: {'n_estimators': 1121, 'learning_rate': 0.06490964125603939, 'max_depth': 6, 'min_samples_split': 6, 'min_samples_leaf': 3, 'subsample': 0.6780115807744982, 'max_features': None}. Best is trial 983 with value: 0.3167302963613237.
[I 2024-12-04 12:32:47,624] Trial 1016 finished with value: 0.5800087177298635 and parameters: {'n_estimators': 129, 'learning_rate': 0.049974318874409465, 'max_depth': 6, 'min_samples_split': 4, 'min_samples_leaf': 10, 'subsample': 0.6230688850338534, 'max_features': None}. Best is trial 983 with value: 0.3167302963613237.
[I 2024-12-04 12:32:48,900] Trial 986 finished with value: 0.389385263390469 and parameters: {'n_estimators': 1244, 'learning_rate': 0.09992919673382893, 'max_depth': 5, 'min_samples_split': 5, 'min_samples_leaf': 3, 'subsample': 0.6726682273228609, 'max_features': None}. Best is trial 983 with value: 0.3167302963613237.
[I 2024-12-04 12:32:48,936] Trial 1000 finished with value: 0.38192957177972 and parameters: {'n_estimators': 711, 'learning_rate': 0.05187670703475059, 'max_depth': 8, 'min_samples_split': 5, 'min_samples_leaf': 1, 'subsample': 0.7196888906542309, 'max_features': None}. Best is trial 983 with value: 0.3167302963613237.
[I 2024-12-04 12:32:49,520] Trial 1004 finished with value: 0.4782221737825173 and parameters: {'n_estimators': 651, 'learning_rate': 0.03583464477906587, 'max_depth': 9, 'min_samples_split': 14, 'min_samples_leaf': 7, 'subsample': 0.7611045883499289, 'max_features': 'sqrt'}. Best is trial 983 with value: 0.3167302963613237.
[I 2024-12-04 12:32:50,255] Trial 995 finished with value: 0.5950307979221134 and parameters: {'n_estimators': 1028, 'learning_rate': 0.07232261699113944, 'max_depth': 6, 'min_samples_split': 15, 'min_samples_leaf': 10, 'subsample': 0.7240346773624886, 'max_features': 'sqrt'}. Best is trial 983 with value: 0.3167302963613237.
[I 2024-12-04 12:32:51,689] Trial 994 finished with value: 0.4122155833934075 and parameters: {'n_estimators': 1121, 'learning_rate': 0.06293321289132657, 'max_depth': 7, 'min_samples_split': 7, 'min_samples_leaf': 2, 'subsample': 0.613191461950771, 'max_features': 'log2'}. Best is trial 983 with value: 0.3167302963613237.
[I 2024-12-04 12:32:52,130] Trial 1010 finished with value: 0.5137380165424765 and parameters: {'n_estimators': 478, 'learning_rate': 0.03573951925010723, 'max_depth': 8, 'min_samples_split': 18, 'min_samples_leaf': 8, 'subsample': 0.6568216950216632, 'max_features': None}. Best is trial 983 with value: 0.3167302963613237.
[I 2024-12-04 12:32:54,552] Trial 1018 finished with value: 0.5025833447075262 and parameters: {'n_estimators': 224, 'learning_rate': 0.011997330909313651, 'max_depth': 7, 'min_samples_split': 13, 'min_samples_leaf': 4, 'subsample': 0.7276384347974135, 'max_features': None}. Best is trial 983 with value: 0.3167302963613237.
[I 2024-12-04 12:32:55,157] Trial 990 finished with value: 0.38404479624565663 and parameters: {'n_estimators': 1226, 'learning_rate': 0.08657838001148785, 'max_depth': 6, 'min_samples_split': 2, 'min_samples_leaf': 3, 'subsample': 0.6446688519431117, 'max_features': None}. Best is trial 983 with value: 0.3167302963613237.
[I 2024-12-04 12:32:59,418] Trial 1003 finished with value: 0.8187631230349388 and parameters: {'n_estimators': 1046, 'learning_rate': 0.0231685724197553, 'max_depth': 8, 'min_samples_split': 19, 'min_samples_leaf': 9, 'subsample': 0.6403800020285022, 'max_features': 'log2'}. Best is trial 983 with value: 0.3167302963613237.
[I 2024-12-04 12:33:00,143] Trial 1007 finished with value: 0.7608030425469696 and parameters: {'n_estimators': 876, 'learning_rate': 0.035592931434735166, 'max_depth': 10, 'min_samples_split': 9, 'min_samples_leaf': 10, 'subsample': 0.9762237633160944, 'max_features': 'log2'}. Best is trial 983 with value: 0.3167302963613237.
[I 2024-12-04 12:33:01,199] Trial 989 finished with value: 0.3092662874814911 and parameters: {'n_estimators': 1477, 'learning_rate': 0.09084880674496996, 'max_depth': 7, 'min_samples_split': 5, 'min_samples_leaf': 2, 'subsample': 0.6159528555509055, 'max_features': None}. Best is trial 989 with value: 0.3092662874814911.
[I 2024-12-04 12:33:03,258] Trial 999 finished with value: 0.4007744226011937 and parameters: {'n_estimators': 1235, 'learning_rate': 0.06413162882712767, 'max_depth': 3, 'min_samples_split': 2, 'min_samples_leaf': 4, 'subsample': 0.6029754893271775, 'max_features': None}. Best is trial 989 with value: 0.3092662874814911.
[I 2024-12-04 12:33:03,627] Trial 998 finished with value: 0.3915142895844193 and parameters: {'n_estimators': 1325, 'learning_rate': 0.07036584598098224, 'max_depth': 6, 'min_samples_split': 2, 'min_samples_leaf': 1, 'subsample': 0.7036617642771221, 'max_features': 'sqrt'}. Best is trial 989 with value: 0.3092662874814911.
[I 2024-12-04 12:33:03,628] Trial 991 finished with value: 0.3758811851860746 and parameters: {'n_estimators': 1453, 'learning_rate': 0.0742712302089856, 'max_depth': 6, 'min_samples_split': 4, 'min_samples_leaf': 1, 'subsample': 0.6299193365054236, 'max_features': None}. Best is trial 989 with value: 0.3092662874814911.
[I 2024-12-04 12:33:03,717] Trial 1006 finished with value: 0.3840041415836056 and parameters: {'n_estimators': 866, 'learning_rate': 0.0574154689541768, 'max_depth': 9, 'min_samples_split': 5, 'min_samples_leaf': 1, 'subsample': 0.6884880476326953, 'max_features': None}. Best is trial 989 with value: 0.3092662874814911.
