[I 2024-12-03 19:01:46,703] Trial 1367 finished with value: 0.3724533539596029 and parameters: {'kernel': 'linear', 'C': 0.010669011012925564, 'gamma': 0.00021836995373306875, 'epsilon': 0.4569757410547359}. Best is trial 345 with value: 0.13438257115663557.
[I 2024-12-03 19:01:46,911] Trial 1361 finished with value: 0.13654427773597155 and parameters: {'kernel': 'linear', 'C': 4.670340374232319, 'gamma': 0.0063642557149107, 'epsilon': 0.028207871363709433}. Best is trial 345 with value: 0.13438257115663557.
[I 2024-12-03 19:01:52,652] Trial 1326 finished with value: 0.13493619115021144 and parameters: {'kernel': 'linear', 'C': 99.56027187830001, 'gamma': 0.003882210750859173, 'epsilon': 0.03976618735484399}. Best is trial 345 with value: 0.13438257115663557.
[I 2024-12-03 19:01:53,578] Trial 1324 finished with value: 0.13529488575272589 and parameters: {'kernel': 'linear', 'C': 93.29942289736644, 'gamma': 0.0017917420374943328, 'epsilon': 0.04091291093191835}. Best is trial 345 with value: 0.13438257115663557.
[I 2024-12-03 19:01:54,671] Trial 1371 finished with value: 0.42624551801640226 and parameters: {'kernel': 'poly', 'C': 56.03917377134849, 'gamma': 0.005814013898819211, 'epsilon': 0.01129555310100533}. Best is trial 345 with value: 0.13438257115663557.
[I 2024-12-03 19:01:55,852] Trial 1359 finished with value: 0.1379535856230938 and parameters: {'kernel': 'linear', 'C': 13.954252208249423, 'gamma': 0.0018225589231866263, 'epsilon': 0.013950669111410649}. Best is trial 345 with value: 0.13438257115663557.
[I 2024-12-03 19:01:56,402] Trial 1293 finished with value: 0.13878761814608495 and parameters: {'kernel': 'linear', 'C': 93.41835056845512, 'gamma': 0.005338920891078051, 'epsilon': 0.010977891333894315}. Best is trial 345 with value: 0.13438257115663557.
[I 2024-12-03 19:01:57,055] Trial 1363 finished with value: 0.1357471450594346 and parameters: {'kernel': 'linear', 'C': 15.924538765100667, 'gamma': 0.0066811758698014905, 'epsilon': 0.034911184920378015}. Best is trial 345 with value: 0.13438257115663557.
[I 2024-12-03 19:01:57,573] Trial 1360 finished with value: 0.13572539291949484 and parameters: {'kernel': 'linear', 'C': 13.164360866200822, 'gamma': 0.0021354333344745743, 'epsilon': 0.02772470242233314}. Best is trial 345 with value: 0.13438257115663557.
[I 2024-12-03 19:01:57,833] Trial 1315 finished with value: 0.13493557158489855 and parameters: {'kernel': 'linear', 'C': 87.10751927385616, 'gamma': 0.01744299712372439, 'epsilon': 0.03894620574354591}. Best is trial 345 with value: 0.13438257115663557.
[I 2024-12-03 19:01:58,126] Trial 1372 finished with value: 0.13752504479613514 and parameters: {'kernel': 'linear', 'C': 2.0354907138667957, 'gamma': 0.003926704550311604, 'epsilon': 0.04958452111164776}. Best is trial 345 with value: 0.13438257115663557.
[I 2024-12-03 19:01:59,897] Trial 1375 finished with value: 0.17269534392322636 and parameters: {'kernel': 'rbf', 'C': 98.71178387072099, 'gamma': 0.0185962730156016, 'epsilon': 0.016848408191930356}. Best is trial 345 with value: 0.13438257115663557.
[I 2024-12-03 19:02:00,517] Trial 1334 finished with value: 0.137622329182759 and parameters: {'kernel': 'linear', 'C': 97.9986877999167, 'gamma': 0.0010636262891659913, 'epsilon': 0.020610817686879942}. Best is trial 345 with value: 0.13438257115663557.
[I 2024-12-03 19:02:01,814] Trial 1380 finished with value: 0.44233129336553295 and parameters: {'kernel': 'poly', 'C': 5.910013319184285, 'gamma': 0.010750146127421055, 'epsilon': 0.08729406803983769}. Best is trial 345 with value: 0.13438257115663557.
[I 2024-12-03 19:02:02,636] Trial 1366 finished with value: 0.13598524341509027 and parameters: {'kernel': 'linear', 'C': 20.533419414267666, 'gamma': 0.0018194627424355453, 'epsilon': 0.051591145131301135}. Best is trial 345 with value: 0.13438257115663557.
[I 2024-12-03 19:02:03,767] Trial 1287 finished with value: 0.138887388893674 and parameters: {'kernel': 'linear', 'C': 84.22125021846833, 'gamma': 0.0013309696571971311, 'epsilon': 0.011902870501263952}. Best is trial 345 with value: 0.13438257115663557.
[I 2024-12-03 19:02:06,150] Trial 1306 finished with value: 0.13874497059907384 and parameters: {'kernel': 'linear', 'C': 86.29219002310931, 'gamma': 0.009828899769808495, 'epsilon': 0.017016773029938488}. Best is trial 345 with value: 0.13438257115663557.
[I 2024-12-03 19:02:07,260] Trial 1369 finished with value: 0.13666231757343866 and parameters: {'kernel': 'linear', 'C': 15.705837375948578, 'gamma': 0.005933127200830528, 'epsilon': 0.023650925343934554}. Best is trial 345 with value: 0.13438257115663557.
[I 2024-12-03 19:02:08,406] Trial 1385 finished with value: 0.1740348861050716 and parameters: {'kernel': 'rbf', 'C': 15.88651441678644, 'gamma': 0.0044698738487213025, 'epsilon': 0.025461605556894727}. Best is trial 345 with value: 0.13438257115663557.
[I 2024-12-03 19:02:08,489] Trial 1321 finished with value: 0.13521546488529884 and parameters: {'kernel': 'linear', 'C': 96.33465964660682, 'gamma': 0.028079309872410804, 'epsilon': 0.03329420256793178}. Best is trial 345 with value: 0.13438257115663557.
[I 2024-12-03 19:02:09,483] Trial 1368 finished with value: 0.1349685709734479 and parameters: {'kernel': 'linear', 'C': 21.867593716504558, 'gamma': 0.004344630226901807, 'epsilon': 0.03880020667578574}. Best is trial 345 with value: 0.13438257115663557.
[I 2024-12-03 19:02:09,557] Trial 1386 finished with value: 0.7410525495259767 and parameters: {'kernel': 'sigmoid', 'C': 0.871165553910438, 'gamma': 0.003513392427260133, 'epsilon': 0.1659173908543451}. Best is trial 345 with value: 0.13438257115663557.
[I 2024-12-03 19:02:10,112] Trial 1370 finished with value: 0.14585223497486882 and parameters: {'kernel': 'linear', 'C': 96.66520293741974, 'gamma': 0.009527534948782453, 'epsilon': 0.12994946134412916}. Best is trial 345 with value: 0.13438257115663557.
[I 2024-12-03 19:02:10,806] Trial 1346 finished with value: 0.13485829044269249 and parameters: {'kernel': 'linear', 'C': 93.1907549200795, 'gamma': 0.007903355932232613, 'epsilon': 0.029778145777652}. Best is trial 345 with value: 0.13438257115663557.
[I 2024-12-03 19:02:10,850] Trial 1337 finished with value: 0.13746108905487864 and parameters: {'kernel': 'linear', 'C': 91.7457545057501, 'gamma': 0.017333960146092033, 'epsilon': 0.021690753813112546}. Best is trial 345 with value: 0.13438257115663557.
[I 2024-12-03 19:02:11,538] Trial 1319 finished with value: 0.13858569371418314 and parameters: {'kernel': 'linear', 'C': 96.6111545709155, 'gamma': 0.0014667505676136002, 'epsilon': 0.017048988156034846}. Best is trial 345 with value: 0.13438257115663557.
[I 2024-12-03 19:02:13,290] Trial 1365 finished with value: 0.13788771791639756 and parameters: {'kernel': 'linear', 'C': 17.247079592194314, 'gamma': 0.003986399017677417, 'epsilon': 0.014807659922146693}. Best is trial 345 with value: 0.13438257115663557.
[I 2024-12-03 19:02:14,476] Trial 1362 finished with value: 0.13800880735047372 and parameters: {'kernel': 'linear', 'C': 24.909196453626837, 'gamma': 0.0027763340410748645, 'epsilon': 0.017173642464639483}. Best is trial 345 with value: 0.13438257115663557.
[I 2024-12-03 19:02:16,294] Trial 1395 finished with value: 723.4400672883664 and parameters: {'kernel': 'sigmoid', 'C': 73.99443668418893, 'gamma': 0.01645465476654135, 'epsilon': 0.056876086280555065}. Best is trial 345 with value: 0.13438257115663557.
[I 2024-12-03 19:02:17,347] Trial 1313 finished with value: 0.13831836330628572 and parameters: {'kernel': 'linear', 'C': 90.83657723773386, 'gamma': 0.01419765116724716, 'epsilon': 0.015785280536137817}. Best is trial 345 with value: 0.13438257115663557.
[I 2024-12-03 19:02:17,677] Trial 1325 finished with value: 0.135077975838386 and parameters: {'kernel': 'linear', 'C': 90.88428082409463, 'gamma': 0.009023015884850421, 'epsilon': 0.038839675095770555}. Best is trial 345 with value: 0.13438257115663557.
[I 2024-12-03 19:02:21,564] Trial 1381 finished with value: 0.13517899844617443 and parameters: {'kernel': 'linear', 'C': 27.143754328016264, 'gamma': 0.005038558297746712, 'epsilon': 0.06092298905297236}. Best is trial 345 with value: 0.13438257115663557.
[I 2024-12-03 19:02:22,531] Trial 1393 finished with value: 0.13531345598505273 and parameters: {'kernel': 'linear', 'C': 15.607242317113753, 'gamma': 0.004079880608988319, 'epsilon': 0.05820975599712067}. Best is trial 345 with value: 0.13438257115663557.
[I 2024-12-03 19:02:26,571] Trial 1387 finished with value: 0.14408649417604186 and parameters: {'kernel': 'linear', 'C': 92.34378534350566, 'gamma': 0.09044937155783996, 'epsilon': 0.1187389721744427}. Best is trial 345 with value: 0.13438257115663557.
[I 2024-12-03 19:02:26,698] Trial 1376 finished with value: 0.1381174509665294 and parameters: {'kernel': 'linear', 'C': 20.79420107435956, 'gamma': 0.0005009004619999785, 'epsilon': 0.0082523284809988}. Best is trial 345 with value: 0.13438257115663557.
[I 2024-12-03 19:02:29,049] Trial 1389 finished with value: 0.13993322066932923 and parameters: {'kernel': 'linear', 'C': 97.9112448301784, 'gamma': 0.003298183733092669, 'epsilon': 0.09940516998949714}. Best is trial 345 with value: 0.13438257115663557.
[I 2024-12-03 19:02:31,828] Trial 1399 finished with value: 0.13509769096581997 and parameters: {'kernel': 'linear', 'C': 26.56612521532116, 'gamma': 0.003748027879827394, 'epsilon': 0.05612412844142996}. Best is trial 345 with value: 0.13438257115663557.
[I 2024-12-03 19:02:32,529] Trial 1383 finished with value: 0.13561669858704495 and parameters: {'kernel': 'linear', 'C': 28.385155469080438, 'gamma': 0.0004231055841214518, 'epsilon': 0.03455455106029731}. Best is trial 345 with value: 0.13438257115663557.
[I 2024-12-03 19:02:34,918] Trial 1378 finished with value: 0.13555851673162522 and parameters: {'kernel': 'linear', 'C': 31.031661358190327, 'gamma': 0.0035787473698790833, 'epsilon': 0.027901311039619837}. Best is trial 345 with value: 0.13438257115663557.
[I 2024-12-03 19:02:36,613] Trial 1388 finished with value: 0.1376864614887999 and parameters: {'kernel': 'linear', 'C': 22.60034756036057, 'gamma': 0.02093869597364747, 'epsilon': 0.017696043761182192}. Best is trial 345 with value: 0.13438257115663557.
[I 2024-12-03 19:02:40,803] Trial 1398 finished with value: 0.1348874614761641 and parameters: {'kernel': 'linear', 'C': 31.302858497467287, 'gamma': 0.004044844332544797, 'epsilon': 0.03922379916600613}. Best is trial 345 with value: 0.13438257115663557.
[I 2024-12-03 19:02:43,046] Trial 1394 finished with value: 0.1380403512090158 and parameters: {'kernel': 'linear', 'C': 18.23963919090941, 'gamma': 0.0071595691743395985, 'epsilon': 0.007606446880965054}. Best is trial 345 with value: 0.13438257115663557.
[I 2024-12-03 19:02:44,639] Trial 1409 finished with value: 0.16788366598732027 and parameters: {'kernel': 'linear', 'C': 2.4358530913834318, 'gamma': 0.0034153035418324268, 'epsilon': 0.1503156475214541}. Best is trial 345 with value: 0.13438257115663557.
[I 2024-12-03 19:02:44,675] Trial 1382 finished with value: 0.1380710528686576 and parameters: {'kernel': 'linear', 'C': 95.20561868308688, 'gamma': 0.026260314907973786, 'epsilon': 0.0793816449639381}. Best is trial 345 with value: 0.13438257115663557.
[I 2024-12-03 19:02:45,270] Trial 1348 finished with value: 0.13604509998161235 and parameters: {'kernel': 'linear', 'C': 94.88351093718602, 'gamma': 0.0014454804446969367, 'epsilon': 0.05220645863933813}. Best is trial 345 with value: 0.13438257115663557.
[I 2024-12-03 19:02:46,751] Trial 1400 finished with value: 0.1356286586903173 and parameters: {'kernel': 'linear', 'C': 24.809549720958305, 'gamma': 0.0005846750428610489, 'epsilon': 0.027859919788379612}. Best is trial 345 with value: 0.13438257115663557.
[I 2024-12-03 19:02:47,588] Trial 1374 finished with value: 0.13640150596916012 and parameters: {'kernel': 'linear', 'C': 87.86651137949056, 'gamma': 0.006958028146143753, 'epsilon': 0.04313975970899668}. Best is trial 345 with value: 0.13438257115663557.
[I 2024-12-03 19:02:48,326] Trial 1413 finished with value: 0.17365337640738274 and parameters: {'kernel': 'rbf', 'C': 75.00883127776696, 'gamma': 0.006631809122711791, 'epsilon': 0.06445262809052658}. Best is trial 345 with value: 0.13438257115663557.
[I 2024-12-03 19:02:50,083] Trial 1406 finished with value: 0.13658347292289455 and parameters: {'kernel': 'linear', 'C': 16.115489994687163, 'gamma': 0.007710945369927447, 'epsilon': 0.02405479390691754}. Best is trial 345 with value: 0.13438257115663557.
[I 2024-12-03 19:02:51,287] Trial 1404 finished with value: 0.13526217776278715 and parameters: {'kernel': 'linear', 'C': 18.59787152607733, 'gamma': 0.0038560951814881083, 'epsilon': 0.04090080192058248}. Best is trial 345 with value: 0.13438257115663557.
[I 2024-12-03 19:02:55,444] Trial 1416 finished with value: 0.14093998774503455 and parameters: {'kernel': 'linear', 'C': 14.768487296736355, 'gamma': 0.003678773740316789, 'epsilon': 0.09900251005936629}. Best is trial 345 with value: 0.13438257115663557.
[I 2024-12-03 19:03:01,143] Trial 1312 finished with value: 0.1382193864462332 and parameters: {'kernel': 'linear', 'C': 99.526161748848, 'gamma': 0.009566277436084571, 'epsilon': 0.006675965253709484}. Best is trial 345 with value: 0.13438257115663557.
[I 2024-12-03 19:03:06,168] Trial 1410 finished with value: 0.13690312167785212 and parameters: {'kernel': 'linear', 'C': 20.719342925424552, 'gamma': 0.0015788209163112102, 'epsilon': 0.04955966063186217}. Best is trial 345 with value: 0.13438257115663557.
[I 2024-12-03 19:03:07,904] Trial 1415 finished with value: 0.13659960891981288 and parameters: {'kernel': 'linear', 'C': 15.248439463485738, 'gamma': 0.005025353598771109, 'epsilon': 0.026220003317021866}. Best is trial 345 with value: 0.13438257115663557.
[I 2024-12-03 19:03:11,581] Trial 1379 finished with value: 0.13525367937164812 and parameters: {'kernel': 'linear', 'C': 94.15582573493408, 'gamma': 0.009061092430951656, 'epsilon': 0.02882322098346903}. Best is trial 345 with value: 0.13438257115663557.
[I 2024-12-03 19:03:13,557] Trial 1390 finished with value: 0.13601638973653898 and parameters: {'kernel': 'linear', 'C': 44.26211419103306, 'gamma': 0.0025648073977715046, 'epsilon': 0.024892284761113537}. Best is trial 345 with value: 0.13438257115663557.
[I 2024-12-03 19:03:13,599] Trial 1419 finished with value: 0.13822458282043232 and parameters: {'kernel': 'linear', 'C': 9.04008814091403, 'gamma': 0.003586230783843598, 'epsilon': 0.013784864899217066}. Best is trial 345 with value: 0.13438257115663557.
[I 2024-12-03 19:03:15,094] Trial 1421 finished with value: 0.13965185072789854 and parameters: {'kernel': 'linear', 'C': 18.767900483382537, 'gamma': 0.010658742223068169, 'epsilon': 0.0856282371070157}. Best is trial 345 with value: 0.13438257115663557.
[I 2024-12-03 19:03:15,416] Trial 1391 finished with value: 0.135243785397708 and parameters: {'kernel': 'linear', 'C': 72.57719304737869, 'gamma': 0.009508254257179034, 'epsilon': 0.0385042088596651}. Best is trial 345 with value: 0.13438257115663557.
[I 2024-12-03 19:03:16,912] Trial 46 finished with value: 0.37493902348113545 and parameters: {'kernel': 'poly', 'C': 40.58679538428044, 'gamma': 0.15142480238335948, 'epsilon': 0.01859014257196785}. Best is trial 345 with value: 0.13438257115663557.
[I 2024-12-03 19:03:17,425] Trial 1402 finished with value: 0.13542747792357343 and parameters: {'kernel': 'linear', 'C': 89.53425462407144, 'gamma': 0.01684562979714749, 'epsilon': 0.06578744865790613}. Best is trial 345 with value: 0.13438257115663557.
[I 2024-12-03 19:03:20,984] Trial 1427 finished with value: 0.15162101993482233 and parameters: {'kernel': 'linear', 'C': 16.51667330770515, 'gamma': 0.004684407889223156, 'epsilon': 0.1492198359917848}. Best is trial 345 with value: 0.13438257115663557.
[I 2024-12-03 19:03:21,796] Trial 1408 finished with value: 0.13758058970658485 and parameters: {'kernel': 'linear', 'C': 43.147728160305945, 'gamma': 0.010962602212105925, 'epsilon': 0.022046068443880115}. Best is trial 345 with value: 0.13438257115663557.
[I 2024-12-03 19:03:22,916] Trial 1407 finished with value: 0.1354967642624883 and parameters: {'kernel': 'linear', 'C': 95.80005007132942, 'gamma': 0.003964374922524423, 'epsilon': 0.053846137379478305}. Best is trial 345 with value: 0.13438257115663557.
[I 2024-12-03 19:03:25,021] Trial 1431 finished with value: 0.14036386942055926 and parameters: {'kernel': 'linear', 'C': 1.360520921846276, 'gamma': 0.007296731907632991, 'epsilon': 0.057043240830954474}. Best is trial 345 with value: 0.13438257115663557.
[I 2024-12-03 19:03:25,322] Trial 1384 finished with value: 0.13515257432711278 and parameters: {'kernel': 'linear', 'C': 95.1190623219176, 'gamma': 0.04960378139631622, 'epsilon': 0.028836907706036658}. Best is trial 345 with value: 0.13438257115663557.
[I 2024-12-03 19:03:26,429] Trial 1430 finished with value: 0.1390871622916834 and parameters: {'kernel': 'linear', 'C': 15.396296945883435, 'gamma': 0.0016004978972813371, 'epsilon': 0.08393874952187821}. Best is trial 345 with value: 0.13438257115663557.
[I 2024-12-03 19:03:27,851] Trial 1401 finished with value: 0.13755614591338233 and parameters: {'kernel': 'linear', 'C': 34.868519009964075, 'gamma': 0.005331840500625706, 'epsilon': 0.0026461421783665973}. Best is trial 345 with value: 0.13438257115663557.
[I 2024-12-03 19:03:30,730] Trial 1426 finished with value: 0.1363987547514891 and parameters: {'kernel': 'linear', 'C': 12.405774714563032, 'gamma': 0.0013985420064055738, 'epsilon': 0.026696995386610883}. Best is trial 345 with value: 0.13438257115663557.
[I 2024-12-03 19:03:30,801] Trial 1396 finished with value: 0.13579962252931954 and parameters: {'kernel': 'linear', 'C': 67.1805246363257, 'gamma': 0.001930852266620737, 'epsilon': 0.025997409761832936}. Best is trial 345 with value: 0.13438257115663557.
[I 2024-12-03 19:03:31,902] Trial 1420 finished with value: 0.1355198705476284 and parameters: {'kernel': 'linear', 'C': 18.8768361261433, 'gamma': 0.017560718035266595, 'epsilon': 0.027998570185638984}. Best is trial 345 with value: 0.13438257115663557.
[I 2024-12-03 19:03:33,470] Trial 1437 finished with value: 0.2977700577336519 and parameters: {'kernel': 'rbf', 'C': 9.062268652177888, 'gamma': 0.000689938982988549, 'epsilon': 0.005689714425902204}. Best is trial 345 with value: 0.13438257115663557.
[I 2024-12-03 19:03:33,639] Trial 1438 finished with value: 0.39161445410144613 and parameters: {'kernel': 'linear', 'C': 0.00904489236416868, 'gamma': 0.0040800674858718685, 'epsilon': 0.5149737402477212}. Best is trial 345 with value: 0.13438257115663557.
[I 2024-12-03 19:03:35,232] Trial 1439 finished with value: 0.3522483653163541 and parameters: {'kernel': 'sigmoid', 'C': 17.840569027168705, 'gamma': 0.0004013832878596182, 'epsilon': 0.038788965185740994}. Best is trial 345 with value: 0.13438257115663557.
[I 2024-12-03 19:03:35,552] Trial 1440 finished with value: 113.60660913937912 and parameters: {'kernel': 'sigmoid', 'C': 82.80084966856315, 'gamma': 0.00441408651162679, 'epsilon': 0.025055736617152408}. Best is trial 345 with value: 0.13438257115663557.
[I 2024-12-03 19:03:36,642] Trial 1441 finished with value: 0.24294039233999412 and parameters: {'kernel': 'rbf', 'C': 3.176157974021668, 'gamma': 0.005878368507813904, 'epsilon': 0.1599659316005692}. Best is trial 345 with value: 0.13438257115663557.
[I 2024-12-03 19:03:36,932] Trial 1417 finished with value: 0.136091544542784 and parameters: {'kernel': 'linear', 'C': 84.01505416123659, 'gamma': 0.003660182736885043, 'epsilon': 0.05240786591927825}. Best is trial 345 with value: 0.13438257115663557.
[I 2024-12-03 19:03:37,790] Trial 1435 finished with value: 0.13526179384610468 and parameters: {'kernel': 'linear', 'C': 17.12701655804227, 'gamma': 0.001955481519386522, 'epsilon': 0.054428957629038544}. Best is trial 345 with value: 0.13438257115663557.
[I 2024-12-03 19:03:38,042] Trial 1444 finished with value: 1.0962143675229954 and parameters: {'kernel': 'sigmoid', 'C': 1.2777560617763304, 'gamma': 0.00010960269529714233, 'epsilon': 0.9251693905334676}. Best is trial 345 with value: 0.13438257115663557.
[I 2024-12-03 19:03:40,578] Trial 1446 finished with value: 0.1393858225506329 and parameters: {'kernel': 'linear', 'C': 3.696779954673694, 'gamma': 0.007071219441680691, 'epsilon': 0.07324472943479443}. Best is trial 345 with value: 0.13438257115663557.
[I 2024-12-03 19:03:41,888] Trial 1447 finished with value: 1.309296419362478 and parameters: {'kernel': 'sigmoid', 'C': 0.006687915647406218, 'gamma': 0.09719101125330362, 'epsilon': 0.002704445024128063}. Best is trial 345 with value: 0.13438257115663557.
[I 2024-12-03 19:03:42,373] Trial 1424 finished with value: 0.13806672586891663 and parameters: {'kernel': 'linear', 'C': 16.37803217018982, 'gamma': 0.0034791426924326747, 'epsilon': 0.006943105868526421}. Best is trial 345 with value: 0.13438257115663557.
[I 2024-12-03 19:03:42,907] Trial 1423 finished with value: 0.13808139033881645 and parameters: {'kernel': 'linear', 'C': 97.15793934633541, 'gamma': 0.011265529179863159, 'epsilon': 0.07874071664947482}. Best is trial 345 with value: 0.13438257115663557.
[I 2024-12-03 19:03:45,694] Trial 1433 finished with value: 0.13564898618921692 and parameters: {'kernel': 'linear', 'C': 20.893144504551973, 'gamma': 0.0065452324025126974, 'epsilon': 0.03396092598126756}. Best is trial 345 with value: 0.13438257115663557.
[I 2024-12-03 19:03:46,199] Trial 1392 finished with value: 0.13804337697064592 and parameters: {'kernel': 'linear', 'C': 81.5117228931482, 'gamma': 0.007607996069475176, 'epsilon': 0.01526554167553931}. Best is trial 345 with value: 0.13438257115663557.
