[I 2024-12-04 12:27:41,097] Trial 2495 finished with value: 0.48681349226421633 and parameters: {'n_estimators': 288, 'max_depth': 35, 'min_samples_split': 2, 'min_samples_leaf': 1, 'max_features': 'log2', 'bootstrap': True, 'criterion': 'absolute_error'}. Best is trial 341 with value: 0.2909369124469028.
[I 2024-12-04 12:27:43,565] Trial 2493 finished with value: 0.49383043175908176 and parameters: {'n_estimators': 593, 'max_depth': 49, 'min_samples_split': 4, 'min_samples_leaf': 2, 'max_features': 'sqrt', 'bootstrap': True, 'criterion': 'absolute_error'}. Best is trial 341 with value: 0.2909369124469028.
