[I 2024-12-03 18:43:38,212] Trial 412 finished with value: 0.3678135445139879 and parameters: {'kernel': 'rbf', 'C': 82.39807815576694, 'gamma': 0.057523236167574605, 'epsilon': 0.20411341829812404}. Best is trial 88 with value: 0.3542875001421725.
[I 2024-12-03 18:43:38,854] Trial 417 finished with value: 0.3635510811074161 and parameters: {'kernel': 'rbf', 'C': 95.83201804336618, 'gamma': 0.034062605576439135, 'epsilon': 0.11787487324386416}. Best is trial 88 with value: 0.3542875001421725.
[I 2024-12-03 18:43:38,857] Trial 420 finished with value: 0.6286450541275996 and parameters: {'kernel': 'rbf', 'C': 13.364434626239806, 'gamma': 0.09427502047110686, 'epsilon': 0.6983185868056536}. Best is trial 88 with value: 0.3542875001421725.
[I 2024-12-03 18:43:39,388] Trial 418 finished with value: 0.5796346502005415 and parameters: {'kernel': 'rbf', 'C': 18.90990563963734, 'gamma': 0.2081028611499969, 'epsilon': 0.3342234236016144}. Best is trial 88 with value: 0.3542875001421725.
[I 2024-12-03 18:43:39,807] Trial 416 finished with value: 0.41945878547474325 and parameters: {'kernel': 'rbf', 'C': 13.214212716861045, 'gamma': 0.07611106800624898, 'epsilon': 0.104337718267145}. Best is trial 88 with value: 0.3542875001421725.
[I 2024-12-03 18:43:40,103] Trial 403 finished with value: 0.39412247080600304 and parameters: {'kernel': 'rbf', 'C': 93.12671064004172, 'gamma': 0.008079643440429423, 'epsilon': 0.25805413045843545}. Best is trial 88 with value: 0.3542875001421725.
[I 2024-12-03 18:43:40,379] Trial 359 finished with value: 0.7146124657790482 and parameters: {'kernel': 'linear', 'C': 63.046258090687, 'gamma': 0.0396379769704197, 'epsilon': 0.2865915718748686}. Best is trial 88 with value: 0.3542875001421725.
[I 2024-12-03 18:43:40,677] Trial 427 finished with value: 0.3576563051220752 and parameters: {'kernel': 'rbf', 'C': 96.0455466141731, 'gamma': 0.04826543948702003, 'epsilon': 0.1718382769059789}. Best is trial 88 with value: 0.3542875001421725.
[I 2024-12-03 18:43:41,043] Trial 423 finished with value: 0.43236994206549895 and parameters: {'kernel': 'rbf', 'C': 80.97740902195908, 'gamma': 0.00718528851432938, 'epsilon': 0.10071438355815643}. Best is trial 88 with value: 0.3542875001421725.
[I 2024-12-03 18:43:41,831] Trial 426 finished with value: 0.3668311182014877 and parameters: {'kernel': 'rbf', 'C': 92.57209423180473, 'gamma': 0.026517687146785977, 'epsilon': 0.06967926936900357}. Best is trial 88 with value: 0.3542875001421725.
[I 2024-12-03 18:43:41,952] Trial 421 finished with value: 0.3668021343034126 and parameters: {'kernel': 'rbf', 'C': 91.00062079710118, 'gamma': 0.02831562625686523, 'epsilon': 0.12651138485551802}. Best is trial 88 with value: 0.3542875001421725.
[I 2024-12-03 18:43:42,186] Trial 425 finished with value: 312.98203869502885 and parameters: {'kernel': 'sigmoid', 'C': 14.859708165646207, 'gamma': 0.0707724247155964, 'epsilon': 0.9151151696463267}. Best is trial 88 with value: 0.3542875001421725.
[I 2024-12-03 18:43:42,651] Trial 431 finished with value: 0.3918136672654106 and parameters: {'kernel': 'rbf', 'C': 96.29670732211432, 'gamma': 0.015360333882881713, 'epsilon': 0.07278322603984481}. Best is trial 88 with value: 0.3542875001421725.
[I 2024-12-03 18:43:43,685] Trial 429 finished with value: 0.3562982149948256 and parameters: {'kernel': 'rbf', 'C': 83.54226423277824, 'gamma': 0.052908264509163826, 'epsilon': 0.11572615883850772}. Best is trial 88 with value: 0.3542875001421725.
[I 2024-12-03 18:43:43,713] Trial 432 finished with value: 0.36838540984544815 and parameters: {'kernel': 'rbf', 'C': 99.49119476735922, 'gamma': 0.060542897759829455, 'epsilon': 0.11499666615493925}. Best is trial 88 with value: 0.3542875001421725.
[I 2024-12-03 18:43:44,084] Trial 433 finished with value: 0.3664404078907849 and parameters: {'kernel': 'rbf', 'C': 97.97918821882381, 'gamma': 0.023459232335818744, 'epsilon': 0.31852159384078427}. Best is trial 88 with value: 0.3542875001421725.
[I 2024-12-03 18:43:44,255] Trial 434 finished with value: 0.39954801894092806 and parameters: {'kernel': 'rbf', 'C': 82.22008712496688, 'gamma': 0.02885947668399965, 'epsilon': 0.4784675215190938}. Best is trial 88 with value: 0.3542875001421725.
[I 2024-12-03 18:43:45,066] Trial 424 finished with value: 0.5262700590548329 and parameters: {'kernel': 'rbf', 'C': 78.93670011781563, 'gamma': 0.2256323334937556, 'epsilon': 0.05084977437717492}. Best is trial 88 with value: 0.3542875001421725.
[I 2024-12-03 18:43:45,067] Trial 428 finished with value: 0.4174444529787538 and parameters: {'kernel': 'rbf', 'C': 25.402007401805648, 'gamma': 0.11280395713313972, 'epsilon': 0.0626486568755117}. Best is trial 88 with value: 0.3542875001421725.
[I 2024-12-03 18:43:45,306] Trial 430 finished with value: 1.0269280557437541 and parameters: {'kernel': 'rbf', 'C': 0.002099941933975302, 'gamma': 0.044956413001348054, 'epsilon': 0.002745657967665469}. Best is trial 88 with value: 0.3542875001421725.
[I 2024-12-03 18:43:46,039] Trial 438 finished with value: 0.4726932463708414 and parameters: {'kernel': 'rbf', 'C': 92.64587232147504, 'gamma': 0.09631565052472116, 'epsilon': 0.3804830971313726}. Best is trial 88 with value: 0.3542875001421725.
[I 2024-12-03 18:43:46,481] Trial 435 finished with value: 0.39968071553727247 and parameters: {'kernel': 'rbf', 'C': 89.17578426106763, 'gamma': 0.10360887924657446, 'epsilon': 0.06565485008460815}. Best is trial 88 with value: 0.3542875001421725.
[I 2024-12-03 18:43:46,546] Trial 440 finished with value: 10.13676854819216 and parameters: {'kernel': 'sigmoid', 'C': 0.47302815814606697, 'gamma': 0.16744279059919506, 'epsilon': 0.004094249952004813}. Best is trial 88 with value: 0.3542875001421725.
[I 2024-12-03 18:43:46,547] Trial 439 finished with value: 0.4256042874261051 and parameters: {'kernel': 'rbf', 'C': 20.688077099316367, 'gamma': 0.028142236205216442, 'epsilon': 0.05109260544476118}. Best is trial 88 with value: 0.3542875001421725.
[I 2024-12-03 18:43:47,608] Trial 436 finished with value: 0.439284625021695 and parameters: {'kernel': 'rbf', 'C': 13.142236437704923, 'gamma': 0.0449168299861197, 'epsilon': 0.027134282457598063}. Best is trial 88 with value: 0.3542875001421725.
[I 2024-12-03 18:43:48,442] Trial 442 finished with value: 0.5823182914597885 and parameters: {'kernel': 'rbf', 'C': 73.50873768610035, 'gamma': 0.27258428839756066, 'epsilon': 0.17354448344056697}. Best is trial 88 with value: 0.3542875001421725.
[I 2024-12-03 18:43:48,461] Trial 437 finished with value: 1.1499908038408138 and parameters: {'kernel': 'poly', 'C': 0.03883292558859223, 'gamma': 0.003538474753491709, 'epsilon': 0.06165306791376639}. Best is trial 88 with value: 0.3542875001421725.
[I 2024-12-03 18:43:49,258] Trial 446 finished with value: 0.46148735715040423 and parameters: {'kernel': 'rbf', 'C': 89.5663957813152, 'gamma': 0.12057193634519861, 'epsilon': 0.2466796683246762}. Best is trial 88 with value: 0.3542875001421725.
[I 2024-12-03 18:43:49,549] Trial 447 finished with value: 0.36593953782474486 and parameters: {'kernel': 'rbf', 'C': 99.4601313654106, 'gamma': 0.02622612173284113, 'epsilon': 0.2533074499460294}. Best is trial 88 with value: 0.3542875001421725.
[I 2024-12-03 18:43:49,717] Trial 451 finished with value: 0.40372525586848773 and parameters: {'kernel': 'rbf', 'C': 17.658269916046706, 'gamma': 0.0529306240343604, 'epsilon': 0.12440204912681209}. Best is trial 88 with value: 0.3542875001421725.
[I 2024-12-03 18:43:49,719] Trial 449 finished with value: 0.36573112649284817 and parameters: {'kernel': 'rbf', 'C': 82.93372437570866, 'gamma': 0.03060857938371721, 'epsilon': 0.1329078517316172}. Best is trial 88 with value: 0.3542875001421725.
[I 2024-12-03 18:43:50,509] Trial 354 finished with value: 1.1169180324489907 and parameters: {'kernel': 'poly', 'C': 6.876953384614622, 'gamma': 0.10450529607678047, 'epsilon': 0.45756161121042244}. Best is trial 88 with value: 0.3542875001421725.
[I 2024-12-03 18:43:51,053] Trial 443 finished with value: 0.3627318021529453 and parameters: {'kernel': 'rbf', 'C': 92.06308841997784, 'gamma': 0.054466229249907544, 'epsilon': 0.09545792504958829}. Best is trial 88 with value: 0.3542875001421725.
[I 2024-12-03 18:43:51,055] Trial 452 finished with value: 0.37822610443304266 and parameters: {'kernel': 'rbf', 'C': 89.07554883096206, 'gamma': 0.07318830625310493, 'epsilon': 0.09377900799186485}. Best is trial 88 with value: 0.3542875001421725.
[I 2024-12-03 18:43:51,056] Trial 441 finished with value: 0.4423221182197767 and parameters: {'kernel': 'rbf', 'C': 95.33532562665177, 'gamma': 0.009616597263161518, 'epsilon': 0.5151846366751179}. Best is trial 88 with value: 0.3542875001421725.
[I 2024-12-03 18:43:51,240] Trial 453 finished with value: 0.42356597400946483 and parameters: {'kernel': 'rbf', 'C': 12.333785293918648, 'gamma': 0.03731214649387696, 'epsilon': 0.1684319433126704}. Best is trial 88 with value: 0.3542875001421725.
[I 2024-12-03 18:43:51,864] Trial 444 finished with value: 0.3948430813027743 and parameters: {'kernel': 'rbf', 'C': 95.44261111899415, 'gamma': 0.015413330933030775, 'epsilon': 0.03167449205946221}. Best is trial 88 with value: 0.3542875001421725.
[I 2024-12-03 18:43:51,938] Trial 455 finished with value: 0.5223818587527489 and parameters: {'kernel': 'rbf', 'C': 12.970757625760426, 'gamma': 0.2100613983466689, 'epsilon': 0.06995248194361464}. Best is trial 88 with value: 0.3542875001421725.
[I 2024-12-03 18:43:52,233] Trial 454 finished with value: 0.8786965684269038 and parameters: {'kernel': 'linear', 'C': 0.010865350243788242, 'gamma': 0.04122366512044606, 'epsilon': 0.006134802146236737}. Best is trial 88 with value: 0.3542875001421725.
[I 2024-12-03 18:43:53,445] Trial 457 finished with value: 0.3767275790216388 and parameters: {'kernel': 'rbf', 'C': 69.19687394091216, 'gamma': 0.0771231859393216, 'epsilon': 0.07386307473799046}. Best is trial 88 with value: 0.3542875001421725.
[I 2024-12-03 18:43:53,459] Trial 456 finished with value: 0.38876333820318065 and parameters: {'kernel': 'rbf', 'C': 74.38332844194836, 'gamma': 0.08843254236836129, 'epsilon': 0.039186674431222236}. Best is trial 88 with value: 0.3542875001421725.
[I 2024-12-03 18:43:55,060] Trial 460 finished with value: 2.8772683013115015 and parameters: {'kernel': 'poly', 'C': 0.03111675531587179, 'gamma': 0.05710773660162158, 'epsilon': 0.002909294369657662}. Best is trial 88 with value: 0.3542875001421725.
[I 2024-12-03 18:43:55,277] Trial 465 finished with value: 0.38916858965580803 and parameters: {'kernel': 'rbf', 'C': 99.36905256003764, 'gamma': 0.07495811779388246, 'epsilon': 0.03298066492971764}. Best is trial 88 with value: 0.3542875001421725.
[I 2024-12-03 18:43:55,278] Trial 462 finished with value: 0.4307436366472275 and parameters: {'kernel': 'rbf', 'C': 18.454916472560274, 'gamma': 0.02836271251962426, 'epsilon': 0.028104248987947337}. Best is trial 88 with value: 0.3542875001421725.
[I 2024-12-03 18:43:55,607] Trial 463 finished with value: 0.36660386177754156 and parameters: {'kernel': 'rbf', 'C': 97.81751136588223, 'gamma': 0.023030671150408986, 'epsilon': 0.09116461661371408}. Best is trial 88 with value: 0.3542875001421725.
[I 2024-12-03 18:43:55,793] Trial 459 finished with value: 0.4259007556207261 and parameters: {'kernel': 'rbf', 'C': 13.78814550134885, 'gamma': 0.029782694071545948, 'epsilon': 0.10590730153966071}. Best is trial 88 with value: 0.3542875001421725.
[I 2024-12-03 18:43:56,384] Trial 468 finished with value: 1665.1168433662756 and parameters: {'kernel': 'sigmoid', 'C': 77.71247635610628, 'gamma': 0.053668156648135394, 'epsilon': 0.13599881733835323}. Best is trial 88 with value: 0.3542875001421725.
[I 2024-12-03 18:43:56,400] Trial 461 finished with value: 0.42367406044450495 and parameters: {'kernel': 'rbf', 'C': 14.727886498038606, 'gamma': 0.05137870186568366, 'epsilon': 0.06220298810731144}. Best is trial 88 with value: 0.3542875001421725.
[I 2024-12-03 18:43:56,634] Trial 464 finished with value: 0.420900287151263 and parameters: {'kernel': 'rbf', 'C': 13.99738230272949, 'gamma': 0.08922826256640258, 'epsilon': 0.09091870486940488}. Best is trial 88 with value: 0.3542875001421725.
[I 2024-12-03 18:43:56,795] Trial 467 finished with value: 0.36593437469478063 and parameters: {'kernel': 'rbf', 'C': 94.56653523144463, 'gamma': 0.03842261914334143, 'epsilon': 0.051563976429069285}. Best is trial 88 with value: 0.3542875001421725.
[I 2024-12-03 18:43:56,884] Trial 466 finished with value: 0.7935971950397432 and parameters: {'kernel': 'linear', 'C': 0.19445238858254724, 'gamma': 0.0009351879754633655, 'epsilon': 0.008831352496497387}. Best is trial 88 with value: 0.3542875001421725.
[I 2024-12-03 18:43:57,670] Trial 469 finished with value: 0.5828712519920786 and parameters: {'kernel': 'rbf', 'C': 91.05729138305226, 'gamma': 0.2910782474450125, 'epsilon': 0.11646944894798626}. Best is trial 88 with value: 0.3542875001421725.
[I 2024-12-03 18:43:58,469] Trial 470 finished with value: 0.40373974897312537 and parameters: {'kernel': 'rbf', 'C': 94.31333753362861, 'gamma': 0.10755496249430901, 'epsilon': 0.10047217240158839}. Best is trial 88 with value: 0.3542875001421725.
[I 2024-12-03 18:43:59,412] Trial 378 finished with value: 4.485432497273086 and parameters: {'kernel': 'poly', 'C': 81.04490448986202, 'gamma': 0.06779248111110606, 'epsilon': 0.2674869197209341}. Best is trial 88 with value: 0.3542875001421725.
[I 2024-12-03 18:43:59,669] Trial 477 finished with value: 0.3631693406489361 and parameters: {'kernel': 'rbf', 'C': 94.13074807797886, 'gamma': 0.05601573989290798, 'epsilon': 0.10965213361944114}. Best is trial 88 with value: 0.3542875001421725.
[I 2024-12-03 18:43:59,670] Trial 471 finished with value: 0.42248695270480213 and parameters: {'kernel': 'rbf', 'C': 11.823245739658251, 'gamma': 0.038648221656578906, 'epsilon': 0.24920219391618034}. Best is trial 88 with value: 0.3542875001421725.
[I 2024-12-03 18:44:00,432] Trial 475 finished with value: 0.36554404491108144 and parameters: {'kernel': 'rbf', 'C': 92.44329962873763, 'gamma': 0.0446651592029347, 'epsilon': 0.04128287478844738}. Best is trial 88 with value: 0.3542875001421725.
[I 2024-12-03 18:44:00,444] Trial 479 finished with value: 0.4014575496224425 and parameters: {'kernel': 'rbf', 'C': 12.434720120353619, 'gamma': 0.013779079408950316, 'epsilon': 0.06260265336256794}. Best is trial 88 with value: 0.3542875001421725.
[I 2024-12-03 18:44:00,472] Trial 472 finished with value: 0.410221301230002 and parameters: {'kernel': 'rbf', 'C': 81.3286390670681, 'gamma': 0.012365514628026361, 'epsilon': 0.06299673975138538}. Best is trial 88 with value: 0.3542875001421725.
[I 2024-12-03 18:44:01,200] Trial 483 finished with value: 0.36110871523687943 and parameters: {'kernel': 'rbf', 'C': 95.95598455886602, 'gamma': 0.051792235443739607, 'epsilon': 0.12351176311900587}. Best is trial 88 with value: 0.3542875001421725.
[I 2024-12-03 18:44:01,201] Trial 478 finished with value: 0.37382408236348225 and parameters: {'kernel': 'rbf', 'C': 97.52614777271407, 'gamma': 0.06188326796579719, 'epsilon': 0.06379064426517596}. Best is trial 88 with value: 0.3542875001421725.
[I 2024-12-03 18:44:01,232] Trial 480 finished with value: 0.48987087123991546 and parameters: {'kernel': 'rbf', 'C': 13.29846258940012, 'gamma': 0.1556250927021918, 'epsilon': 0.1578726802963948}. Best is trial 88 with value: 0.3542875001421725.
[I 2024-12-03 18:44:01,243] Trial 481 finished with value: 0.4269434982923469 and parameters: {'kernel': 'rbf', 'C': 15.437450660164476, 'gamma': 0.028790363399095763, 'epsilon': 0.07208145058649075}. Best is trial 88 with value: 0.3542875001421725.
[I 2024-12-03 18:44:02,096] Trial 476 finished with value: 0.40434425630394627 and parameters: {'kernel': 'rbf', 'C': 98.16988443023313, 'gamma': 0.10931437375397875, 'epsilon': 0.07922796885185515}. Best is trial 88 with value: 0.3542875001421725.
[I 2024-12-03 18:44:02,378] Trial 482 finished with value: 0.3955622064523068 and parameters: {'kernel': 'rbf', 'C': 20.59560141161505, 'gamma': 0.0648719662601355, 'epsilon': 0.09303677230647135}. Best is trial 88 with value: 0.3542875001421725.
[I 2024-12-03 18:44:02,815] Trial 485 finished with value: 0.39151575293805185 and parameters: {'kernel': 'rbf', 'C': 20.96767591922275, 'gamma': 0.05469107586839402, 'epsilon': 0.1434963656868728}. Best is trial 88 with value: 0.3542875001421725.
[I 2024-12-03 18:44:02,892] Trial 484 finished with value: 0.36734295436645314 and parameters: {'kernel': 'rbf', 'C': 99.04516742319906, 'gamma': 0.02195450502414617, 'epsilon': 0.10918165457691953}. Best is trial 88 with value: 0.3542875001421725.
[I 2024-12-03 18:44:03,119] Trial 488 finished with value: 271.29577506145864 and parameters: {'kernel': 'sigmoid', 'C': 12.574577413849852, 'gamma': 0.04371930875348664, 'epsilon': 0.05090719454475247}. Best is trial 88 with value: 0.3542875001421725.
[I 2024-12-03 18:44:03,624] Trial 486 finished with value: 0.4367764108905299 and parameters: {'kernel': 'rbf', 'C': 87.80434506379032, 'gamma': 0.09479969727011123, 'epsilon': 0.28868150777208745}. Best is trial 88 with value: 0.3542875001421725.
[I 2024-12-03 18:44:04,571] Trial 487 finished with value: 0.5016054055996416 and parameters: {'kernel': 'rbf', 'C': 21.61750281691579, 'gamma': 0.16078972246657258, 'epsilon': 0.2207112760281676}. Best is trial 88 with value: 0.3542875001421725.
[I 2024-12-03 18:44:05,427] Trial 489 finished with value: 0.9379356393917468 and parameters: {'kernel': 'sigmoid', 'C': 0.039742575297880715, 'gamma': 0.0014246418926497674, 'epsilon': 0.0022338336742774466}. Best is trial 88 with value: 0.3542875001421725.
[I 2024-12-03 18:44:05,472] Trial 491 finished with value: 0.39235201946767506 and parameters: {'kernel': 'rbf', 'C': 74.02364688129782, 'gamma': 0.07946093990960876, 'epsilon': 0.2153779059443956}. Best is trial 88 with value: 0.3542875001421725.
[I 2024-12-03 18:44:06,179] Trial 490 finished with value: 0.35552304988936206 and parameters: {'kernel': 'rbf', 'C': 94.38870943501864, 'gamma': 0.042325934298006046, 'epsilon': 0.14533467468463096}. Best is trial 88 with value: 0.3542875001421725.
[I 2024-12-03 18:44:06,261] Trial 492 finished with value: 0.40609755980073364 and parameters: {'kernel': 'rbf', 'C': 97.16236514410146, 'gamma': 0.011897444169340755, 'epsilon': 0.11628574014661236}. Best is trial 88 with value: 0.3542875001421725.
[I 2024-12-03 18:44:06,262] Trial 493 finished with value: 0.4347700328028391 and parameters: {'kernel': 'rbf', 'C': 18.796317644970994, 'gamma': 0.0144434960190808, 'epsilon': 0.15043849813722804}. Best is trial 88 with value: 0.3542875001421725.
[I 2024-12-03 18:44:07,040] Trial 495 finished with value: 0.42750544230763404 and parameters: {'kernel': 'rbf', 'C': 11.177750647940956, 'gamma': 0.023662776157781482, 'epsilon': 0.31553717705534484}. Best is trial 88 with value: 0.3542875001421725.
[I 2024-12-03 18:44:07,096] Trial 494 finished with value: 0.3634049287179385 and parameters: {'kernel': 'rbf', 'C': 91.95713046269778, 'gamma': 0.036909092760560334, 'epsilon': 0.07812998567593885}. Best is trial 88 with value: 0.3542875001421725.
[I 2024-12-03 18:44:07,694] Trial 499 finished with value: 0.48042228553981775 and parameters: {'kernel': 'rbf', 'C': 7.060583750061525, 'gamma': 0.13308037677841397, 'epsilon': 0.0015143775223181888}. Best is trial 88 with value: 0.3542875001421725.
[I 2024-12-03 18:44:07,696] Trial 497 finished with value: 0.5514368047940377 and parameters: {'kernel': 'rbf', 'C': 86.73069414795448, 'gamma': 0.2188457846001754, 'epsilon': 0.20871180331307862}. Best is trial 88 with value: 0.3542875001421725.
[I 2024-12-03 18:44:07,756] Trial 498 finished with value: 0.37729060762094174 and parameters: {'kernel': 'rbf', 'C': 90.24584411636017, 'gamma': 0.06912021929301178, 'epsilon': 0.1936370036303131}. Best is trial 88 with value: 0.3542875001421725.
[I 2024-12-03 18:44:08,131] Trial 496 finished with value: 0.3572831191899461 and parameters: {'kernel': 'rbf', 'C': 90.32151981515257, 'gamma': 0.040422318731139766, 'epsilon': 0.21852449859331916}. Best is trial 88 with value: 0.3542875001421725.
[I 2024-12-03 18:44:09,195] Trial 502 finished with value: 0.7500559447677293 and parameters: {'kernel': 'rbf', 'C': 82.14772002933482, 'gamma': 0.19600685991440767, 'epsilon': 0.7897118046674569}. Best is trial 88 with value: 0.3542875001421725.
[I 2024-12-03 18:44:09,568] Trial 501 finished with value: 0.3646927468020483 and parameters: {'kernel': 'rbf', 'C': 85.65425006321921, 'gamma': 0.05028997817166042, 'epsilon': 0.2259608839528928}. Best is trial 88 with value: 0.3542875001421725.
[I 2024-12-03 18:44:10,142] Trial 506 finished with value: 0.8958413135754607 and parameters: {'kernel': 'linear', 'C': 0.001426951921504978, 'gamma': 0.2473735137351508, 'epsilon': 0.002100631081103968}. Best is trial 88 with value: 0.3542875001421725.
[I 2024-12-03 18:44:10,157] Trial 503 finished with value: 0.3696859475129223 and parameters: {'kernel': 'rbf', 'C': 90.63688932143334, 'gamma': 0.025941731432757763, 'epsilon': 0.15702592947518978}. Best is trial 88 with value: 0.3542875001421725.
[I 2024-12-03 18:44:10,358] Trial 508 finished with value: 0.4097942284939289 and parameters: {'kernel': 'rbf', 'C': 19.143398949450425, 'gamma': 0.021924819390710906, 'epsilon': 0.20204339165185256}. Best is trial 88 with value: 0.3542875001421725.
[I 2024-12-03 18:44:10,824] Trial 505 finished with value: 0.4327564031905773 and parameters: {'kernel': 'rbf', 'C': 69.58326839809585, 'gamma': 0.0026819684544512118, 'epsilon': 0.3070010980552552}. Best is trial 88 with value: 0.3542875001421725.
[I 2024-12-03 18:44:10,825] Trial 509 finished with value: 0.3992266580739592 and parameters: {'kernel': 'rbf', 'C': 84.49642153385207, 'gamma': 0.009441262532091491, 'epsilon': 0.3014900428450258}. Best is trial 88 with value: 0.3542875001421725.
