[I 2024-12-04 20:27:17,821] Trial 1080 finished with value: 0.14249505778804572 and parameters: {'kernel_type': 'Matern', 'length_scale': 123.50372584623858, 'noise_level': 0.023960194384901077, 'constant_value': 2.584441832293541, 'nu': 1.5}. Best is trial 959 with value: 0.1375110730946576.
[I 2024-12-04 20:27:20,730] Trial 1083 finished with value: 0.1424950816261671 and parameters: {'kernel_type': 'Matern', 'length_scale': 89.57816063986867, 'noise_level': 0.08830819267101894, 'constant_value': 2938.7370390714555, 'nu': 1.5}. Best is trial 959 with value: 0.1375110730946576.
[I 2024-12-04 20:27:21,384] Trial 1082 finished with value: 0.14249504132062313 and parameters: {'kernel_type': 'Matern', 'length_scale': 3.863832606756324, 'noise_level': 0.7070727675464292, 'constant_value': 1.5759902597129691, 'nu': 1.5}. Best is trial 959 with value: 0.1375110730946576.
[I 2024-12-04 20:27:23,870] Trial 1084 finished with value: 0.9864686819186046 and parameters: {'kernel_type': 'Matern', 'length_scale': 2081.124066942646, 'noise_level': 8.755091219393807e-05, 'constant_value': 79304.82043611711, 'nu': 1.5}. Best is trial 959 with value: 0.1375110730946576.
[I 2024-12-04 20:27:26,926] Trial 1085 finished with value: 0.1972000381368138 and parameters: {'kernel_type': 'Matern', 'length_scale': 0.6667791803090602, 'noise_level': 0.005484912863979729, 'constant_value': 7.268639588430029, 'nu': 0.5}. Best is trial 959 with value: 0.1375110730946576.
[I 2024-12-04 20:27:28,373] Trial 1086 finished with value: 0.9864686819251682 and parameters: {'kernel_type': 'Matern', 'length_scale': 129.4193609152083, 'noise_level': 1.1186452076288833e-08, 'constant_value': 129.82949112259385, 'nu': 2.5}. Best is trial 959 with value: 0.1375110730946576.
[I 2024-12-04 20:27:31,439] Trial 1087 finished with value: 0.14249516297161827 and parameters: {'kernel_type': 'Matern', 'length_scale': 2261.441692925924, 'noise_level': 0.02995942405802855, 'constant_value': 744.5912110793653, 'nu': 1.5}. Best is trial 959 with value: 0.1375110730946576.
[I 2024-12-04 20:27:34,944] Trial 1088 finished with value: 0.14249506456910382 and parameters: {'kernel_type': 'Matern', 'length_scale': 0.5029182727085922, 'noise_level': 0.12787026583281094, 'constant_value': 3.5224103603096384, 'nu': 1.5}. Best is trial 959 with value: 0.1375110730946576.
[I 2024-12-04 20:27:35,565] Trial 1089 finished with value: 0.14249515913899985 and parameters: {'kernel_type': 'Matern', 'length_scale': 1574.2785980278084, 'noise_level': 0.9515263680639677, 'constant_value': 30.72382203258596, 'nu': 1.5}. Best is trial 959 with value: 0.1375110730946576.
[I 2024-12-04 20:27:36,064] Trial 1090 finished with value: 0.9982169672553024 and parameters: {'kernel_type': 'Matern', 'length_scale': 666.868274928815, 'noise_level': 8.104223382619206e-06, 'constant_value': 367.51975121707693, 'nu': 0.5}. Best is trial 959 with value: 0.1375110730946576.
[I 2024-12-04 20:27:40,685] Trial 1091 finished with value: 0.1972000363509546 and parameters: {'kernel_type': 'Matern', 'length_scale': 168.79019514081526, 'noise_level': 0.010798118084852145, 'constant_value': 260.7487975409627, 'nu': 0.5}. Best is trial 959 with value: 0.1375110730946576.
[I 2024-12-04 20:27:43,041] Trial 1093 finished with value: 0.14249506272750342 and parameters: {'kernel_type': 'Matern', 'length_scale': 20.880307175016316, 'noise_level': 0.05766934447574396, 'constant_value': 37.65693394445773, 'nu': 1.5}. Best is trial 959 with value: 0.1375110730946576.
[I 2024-12-04 20:27:46,495] Trial 1092 finished with value: 0.9864686819180141 and parameters: {'kernel_type': 'RBF', 'length_scale': 541.6164373067279, 'noise_level': 9.821497822761102e-05, 'constant_value': 0.0007196429972267963, 'nu': 1.5}. Best is trial 959 with value: 0.1375110730946576.
[I 2024-12-04 20:27:47,400] Trial 1094 finished with value: 0.1424950796767694 and parameters: {'kernel_type': 'Matern', 'length_scale': 4.0260103050732345, 'noise_level': 0.7306293529262251, 'constant_value': 104.28021259479047, 'nu': 1.5}. Best is trial 959 with value: 0.1375110730946576.
[I 2024-12-04 20:27:49,309] Trial 1095 finished with value: 0.14249508382211704 and parameters: {'kernel_type': 'Matern', 'length_scale': 15.2119117698965, 'noise_level': 0.0009243831745076977, 'constant_value': 57.523429793802585, 'nu': 1.5}. Best is trial 959 with value: 0.1375110730946576.
[I 2024-12-04 20:27:53,702] Trial 1097 finished with value: 0.19720003455749727 and parameters: {'kernel_type': 'Matern', 'length_scale': 0.7213436959924381, 'noise_level': 0.0006416523074232451, 'constant_value': 1165.8642207422702, 'nu': 0.5}. Best is trial 959 with value: 0.1375110730946576.
[I 2024-12-04 20:27:57,243] Trial 1098 finished with value: 0.1424950536295564 and parameters: {'kernel_type': 'Matern', 'length_scale': 8.793811291102841, 'noise_level': 0.004502902185764171, 'constant_value': 7145.179782987913, 'nu': 1.5}. Best is trial 959 with value: 0.1375110730946576.
[I 2024-12-04 20:28:00,356] Trial 1096 finished with value: 0.14249506346481672 and parameters: {'kernel_type': 'Matern', 'length_scale': 0.12968043642697138, 'noise_level': 0.9209828340473803, 'constant_value': 651.5256930876651, 'nu': 1.5}. Best is trial 959 with value: 0.1375110730946576.
[I 2024-12-04 20:28:00,805] Trial 1099 finished with value: 0.9864686818121495 and parameters: {'kernel_type': 'RBF', 'length_scale': 0.10760676852123097, 'noise_level': 0.06725992911833624, 'constant_value': 410.2817708411123, 'nu': 1.5}. Best is trial 959 with value: 0.1375110730946576.
[I 2024-12-04 20:28:06,180] Trial 1100 finished with value: 0.14249506627499336 and parameters: {'kernel_type': 'Matern', 'length_scale': 1.6290474507266979, 'noise_level': 0.032137398614413254, 'constant_value': 683.6531392431611, 'nu': 1.5}. Best is trial 959 with value: 0.1375110730946576.
[I 2024-12-04 20:28:06,507] Trial 1102 finished with value: 0.1446988783005013 and parameters: {'kernel_type': 'Matern', 'length_scale': 12.841479625118467, 'noise_level': 0.8216654311194527, 'constant_value': 672.5819909793165, 'nu': 2.5}. Best is trial 959 with value: 0.1375110730946576.
[I 2024-12-04 20:28:07,538] Trial 1101 finished with value: 0.142495046966968 and parameters: {'kernel_type': 'Matern', 'length_scale': 18.413053779269728, 'noise_level': 0.9756089593341687, 'constant_value': 16.12064749988871, 'nu': 1.5}. Best is trial 959 with value: 0.1375110730946576.
[I 2024-12-04 20:28:11,679] Trial 1104 finished with value: 0.14249502769322286 and parameters: {'kernel_type': 'Matern', 'length_scale': 163.69079399933713, 'noise_level': 0.027304259954333422, 'constant_value': 9462.80295172265, 'nu': 1.5}. Best is trial 959 with value: 0.1375110730946576.
[I 2024-12-04 20:28:13,529] Trial 1103 finished with value: 0.14771036926237033 and parameters: {'kernel_type': 'RBF', 'length_scale': 5.485767964399514, 'noise_level': 0.022989448569016403, 'constant_value': 3.890605177873264, 'nu': 1.5}. Best is trial 959 with value: 0.1375110730946576.
[I 2024-12-04 20:28:14,048] Trial 1105 finished with value: 0.1424950297582382 and parameters: {'kernel_type': 'Matern', 'length_scale': 25.965022053696583, 'noise_level': 0.9929507811862327, 'constant_value': 4715.662241868189, 'nu': 1.5}. Best is trial 959 with value: 0.1375110730946576.
[I 2024-12-04 20:28:19,162] Trial 1107 finished with value: 0.14249516429785386 and parameters: {'kernel_type': 'Matern', 'length_scale': 9.367842535438223, 'noise_level': 0.0008900348691719435, 'constant_value': 4.2574332594099795, 'nu': 1.5}. Best is trial 959 with value: 0.1375110730946576.
[I 2024-12-04 20:28:21,180] Trial 1106 finished with value: 0.14249534126756214 and parameters: {'kernel_type': 'Matern', 'length_scale': 275.1484921670687, 'noise_level': 0.8791311347930478, 'constant_value': 4.220685080613789, 'nu': 1.5}. Best is trial 959 with value: 0.1375110730946576.
[I 2024-12-04 20:28:24,418] Trial 1108 finished with value: 0.1424950799776433 and parameters: {'kernel_type': 'Matern', 'length_scale': 0.3116050824284813, 'noise_level': 0.01963562642211997, 'constant_value': 1620.9541367925103, 'nu': 1.5}. Best is trial 959 with value: 0.1375110730946576.
[I 2024-12-04 20:28:25,280] Trial 1110 finished with value: 0.9864686819169347 and parameters: {'kernel_type': 'Matern', 'length_scale': 0.0021472889293627133, 'noise_level': 0.01978457992217917, 'constant_value': 4.263429658405921, 'nu': 1.5}. Best is trial 959 with value: 0.1375110730946576.
[I 2024-12-04 20:28:26,979] Trial 1109 finished with value: 0.14249512187012978 and parameters: {'kernel_type': 'Matern', 'length_scale': 0.7350779316212916, 'noise_level': 0.03459150313566466, 'constant_value': 81713.67401043494, 'nu': 1.5}. Best is trial 959 with value: 0.1375110730946576.
[I 2024-12-04 20:28:32,503] Trial 1112 finished with value: 0.9864686818804904 and parameters: {'kernel_type': 'RBF', 'length_scale': 0.11106604887924773, 'noise_level': 0.8388222258367417, 'constant_value': 2466.7287664035566, 'nu': 0.5}. Best is trial 959 with value: 0.1375110730946576.
[I 2024-12-04 20:28:35,343] Trial 1111 finished with value: 0.1424951060887844 and parameters: {'kernel_type': 'Matern', 'length_scale': 1.9989957147287785, 'noise_level': 0.02225452792151069, 'constant_value': 98.87471514975213, 'nu': 1.5}. Best is trial 959 with value: 0.1375110730946576.
[I 2024-12-04 20:28:36,209] Trial 1113 finished with value: 0.14249510934841877 and parameters: {'kernel_type': 'Matern', 'length_scale': 17.554111782952045, 'noise_level': 0.05598073238368389, 'constant_value': 1594.621361254358, 'nu': 1.5}. Best is trial 959 with value: 0.1375110730946576.
[I 2024-12-04 20:28:40,469] Trial 1114 finished with value: 0.14249493995276075 and parameters: {'kernel_type': 'Matern', 'length_scale': 79.25240886881224, 'noise_level': 0.026745318873116108, 'constant_value': 3.021047079918705, 'nu': 1.5}. Best is trial 959 with value: 0.1375110730946576.
[I 2024-12-04 20:28:43,631] Trial 1116 finished with value: 0.19720005036382612 and parameters: {'kernel_type': 'Matern', 'length_scale': 0.43088700853110584, 'noise_level': 0.46494941155155595, 'constant_value': 41280.88540799925, 'nu': 0.5}. Best is trial 959 with value: 0.1375110730946576.
[I 2024-12-04 20:28:45,137] Trial 1115 finished with value: 0.9864686819213465 and parameters: {'kernel_type': 'Matern', 'length_scale': 3081.3562403512665, 'noise_level': 0.005885080005254997, 'constant_value': 3.3467977795246586, 'nu': 1.5}. Best is trial 959 with value: 0.1375110730946576.
[I 2024-12-04 20:28:49,414] Trial 1117 finished with value: 0.14249492359414004 and parameters: {'kernel_type': 'Matern', 'length_scale': 1.3779024807544873, 'noise_level': 0.0009843421841814884, 'constant_value': 2.650956449701614, 'nu': 1.5}. Best is trial 959 with value: 0.1375110730946576.
[I 2024-12-04 20:28:51,610] Trial 1119 finished with value: 0.1424950633382526 and parameters: {'kernel_type': 'Matern', 'length_scale': 77.924897221902, 'noise_level': 0.9425711786336805, 'constant_value': 2159.4806624458342, 'nu': 1.5}. Best is trial 959 with value: 0.1375110730946576.
[I 2024-12-04 20:28:54,785] Trial 1118 finished with value: 0.14249510093432063 and parameters: {'kernel_type': 'Matern', 'length_scale': 191.00984140061092, 'noise_level': 0.011019735143055666, 'constant_value': 228.6945509332347, 'nu': 1.5}. Best is trial 959 with value: 0.1375110730946576.
[I 2024-12-04 20:28:57,335] Trial 1120 finished with value: 0.1424950293170017 and parameters: {'kernel_type': 'Matern', 'length_scale': 1.3035353936041056, 'noise_level': 0.04416755244644279, 'constant_value': 0.03784873692286134, 'nu': 1.5}. Best is trial 959 with value: 0.1375110730946576.
[I 2024-12-04 20:29:01,688] Trial 1121 finished with value: 0.9864686820374228 and parameters: {'kernel_type': 'Matern', 'length_scale': 303.23852225928783, 'noise_level': 0.0006037688498326963, 'constant_value': 0.1605459613108174, 'nu': 1.5}. Best is trial 959 with value: 0.1375110730946576.
[I 2024-12-04 20:29:05,556] Trial 1123 finished with value: 0.14469881890262642 and parameters: {'kernel_type': 'Matern', 'length_scale': 3.3218123346280595, 'noise_level': 0.0445949415341479, 'constant_value': 0.36097914510737805, 'nu': 2.5}. Best is trial 959 with value: 0.1375110730946576.
[I 2024-12-04 20:29:05,882] Trial 1122 finished with value: 0.14249496728143612 and parameters: {'kernel_type': 'Matern', 'length_scale': 2.494050677992067, 'noise_level': 0.047161720150832837, 'constant_value': 310.08664222427404, 'nu': 1.5}. Best is trial 959 with value: 0.1375110730946576.
[I 2024-12-04 20:29:06,342] Trial 1124 finished with value: 0.9982167338041052 and parameters: {'kernel_type': 'RBF', 'length_scale': 0.0669930424741645, 'noise_level': 3.7036948201040457e-10, 'constant_value': 2.0320432703517315, 'nu': 1.5}. Best is trial 959 with value: 0.1375110730946576.
[I 2024-12-04 20:29:11,289] Trial 1125 finished with value: 0.14249506332256812 and parameters: {'kernel_type': 'Matern', 'length_scale': 41.5403027696734, 'noise_level': 0.025928139130838978, 'constant_value': 161.69903204547262, 'nu': 1.5}. Best is trial 959 with value: 0.1375110730946576.
[I 2024-12-04 20:29:12,902] Trial 1126 finished with value: 0.14249501767444409 and parameters: {'kernel_type': 'Matern', 'length_scale': 4.016129336557919, 'noise_level': 0.05389935862715455, 'constant_value': 8673.838663954662, 'nu': 1.5}. Best is trial 959 with value: 0.1375110730946576.
[I 2024-12-04 20:29:18,124] Trial 1128 finished with value: 0.19719999603547786 and parameters: {'kernel_type': 'Matern', 'length_scale': 1.3202481613017643, 'noise_level': 1.2598842612209553e-10, 'constant_value': 0.01527788302593103, 'nu': 0.5}. Best is trial 959 with value: 0.1375110730946576.
[I 2024-12-04 20:29:18,534] Trial 1129 finished with value: 0.14249504952735734 and parameters: {'kernel_type': 'Matern', 'length_scale': 0.9134709949030205, 'noise_level': 0.7938764860227019, 'constant_value': 67918.21178001186, 'nu': 1.5}. Best is trial 959 with value: 0.1375110730946576.
[I 2024-12-04 20:29:22,617] Trial 1127 finished with value: 0.14249508535043834 and parameters: {'kernel_type': 'Matern', 'length_scale': 0.12367065073721575, 'noise_level': 0.04748694244052666, 'constant_value': 13.333210297735599, 'nu': 1.5}. Best is trial 959 with value: 0.1375110730946576.
[I 2024-12-04 20:29:23,610] Trial 1130 finished with value: 0.9864686819231302 and parameters: {'kernel_type': 'Matern', 'length_scale': 0.04696300042759601, 'noise_level': 0.9134266728484229, 'constant_value': 518.213921281046, 'nu': 1.5}. Best is trial 959 with value: 0.1375110730946576.
[I 2024-12-04 20:29:24,029] Trial 1131 finished with value: 0.9864686818980324 and parameters: {'kernel_type': 'RBF', 'length_scale': 3.4563583468827785e-05, 'noise_level': 7.930523856689735e-10, 'constant_value': 0.0012688129755424103, 'nu': 2.5}. Best is trial 959 with value: 0.1375110730946576.
[I 2024-12-04 20:29:29,727] Trial 1132 finished with value: 0.14249501859854652 and parameters: {'kernel_type': 'Matern', 'length_scale': 24.104446110407643, 'noise_level': 7.053952790884802e-05, 'constant_value': 789.8690373570446, 'nu': 1.5}. Best is trial 959 with value: 0.1375110730946576.
[I 2024-12-04 20:29:30,830] Trial 1134 finished with value: 0.14249492932552796 and parameters: {'kernel_type': 'Matern', 'length_scale': 118.41677361514611, 'noise_level': 0.0015936198579260363, 'constant_value': 89263.65207979355, 'nu': 1.5}. Best is trial 959 with value: 0.1375110730946576.
[I 2024-12-04 20:29:31,346] Trial 1133 finished with value: 0.9864686819230498 and parameters: {'kernel_type': 'Matern', 'length_scale': 10.684425524917758, 'noise_level': 0.00021090491381479305, 'constant_value': 0.0027645899529571884, 'nu': 1.5}. Best is trial 959 with value: 0.1375110730946576.
[I 2024-12-04 20:29:38,701] Trial 1137 finished with value: 0.1424950576386046 and parameters: {'kernel_type': 'Matern', 'length_scale': 248.10403129692645, 'noise_level': 0.8576678601362322, 'constant_value': 326.96852208646914, 'nu': 1.5}. Best is trial 959 with value: 0.1375110730946576.
[I 2024-12-04 20:29:39,390] Trial 1136 finished with value: 0.14249506188733696 and parameters: {'kernel_type': 'Matern', 'length_scale': 2.2655508948881433, 'noise_level': 0.03233704011016687, 'constant_value': 26.69447271805943, 'nu': 1.5}. Best is trial 959 with value: 0.1375110730946576.
[I 2024-12-04 20:29:39,471] Trial 1135 finished with value: 0.14249506411504925 and parameters: {'kernel_type': 'Matern', 'length_scale': 66.84955035595765, 'noise_level': 0.49135521774865554, 'constant_value': 0.3134383226538841, 'nu': 1.5}. Best is trial 959 with value: 0.1375110730946576.
[I 2024-12-04 20:29:45,163] Trial 1138 finished with value: 0.1424950704803225 and parameters: {'kernel_type': 'Matern', 'length_scale': 116.02629049680964, 'noise_level': 0.04928100962671182, 'constant_value': 62.40700830613044, 'nu': 1.5}. Best is trial 959 with value: 0.1375110730946576.
[I 2024-12-04 20:29:46,965] Trial 1139 finished with value: 0.1424934374283823 and parameters: {'kernel_type': 'Matern', 'length_scale': 1.586080457622793, 'noise_level': 0.12870207801746586, 'constant_value': 0.4667913460808607, 'nu': 1.5}. Best is trial 959 with value: 0.1375110730946576.
[I 2024-12-04 20:29:47,126] Trial 1140 finished with value: 0.14249504821692635 and parameters: {'kernel_type': 'Matern', 'length_scale': 17.63831314670678, 'noise_level': 0.0466048337958727, 'constant_value': 609.1706202031472, 'nu': 1.5}. Best is trial 959 with value: 0.1375110730946576.
[I 2024-12-04 20:29:51,213] Trial 1141 finished with value: 0.9864686821913906 and parameters: {'kernel_type': 'Matern', 'length_scale': 5535.607697583113, 'noise_level': 0.00194523992710034, 'constant_value': 72258.18192361147, 'nu': 1.5}. Best is trial 959 with value: 0.1375110730946576.
[I 2024-12-04 20:29:56,417] Trial 1144 finished with value: 0.9864686819101816 and parameters: {'kernel_type': 'Matern', 'length_scale': 0.0501311369512188, 'noise_level': 0.0008783159427714177, 'constant_value': 14.2282210108726, 'nu': 1.5}. Best is trial 959 with value: 0.1375110730946576.
[I 2024-12-04 20:29:57,654] Trial 1142 finished with value: 0.14249507267204736 and parameters: {'kernel_type': 'Matern', 'length_scale': 1.4928536312430738, 'noise_level': 0.11042143142154842, 'constant_value': 0.5406457404898537, 'nu': 1.5}. Best is trial 959 with value: 0.1375110730946576.
[I 2024-12-04 20:29:58,580] Trial 1143 finished with value: 0.14249506006432588 and parameters: {'kernel_type': 'Matern', 'length_scale': 7.751139857729665, 'noise_level': 0.04277729571032759, 'constant_value': 0.021476858328916923, 'nu': 1.5}. Best is trial 959 with value: 0.1375110730946576.
[I 2024-12-04 20:30:03,251] Trial 1146 finished with value: 0.9864686822139127 and parameters: {'kernel_type': 'Matern', 'length_scale': 0.003694109209241538, 'noise_level': 0.16218261664637784, 'constant_value': 0.36104274376061773, 'nu': 1.5}. Best is trial 959 with value: 0.1375110730946576.
[I 2024-12-04 20:30:07,111] Trial 1147 finished with value: 0.14249506816896357 and parameters: {'kernel_type': 'Matern', 'length_scale': 10.312052801506626, 'noise_level': 0.07976174867070678, 'constant_value': 0.8510486605825965, 'nu': 1.5}. Best is trial 959 with value: 0.1375110730946576.
[I 2024-12-04 20:30:08,652] Trial 1148 finished with value: 0.9864686815794751 and parameters: {'kernel_type': 'Matern', 'length_scale': 0.07143266229604671, 'noise_level': 0.09019495718769606, 'constant_value': 0.3154244503890043, 'nu': 1.5}. Best is trial 959 with value: 0.1375110730946576.
[I 2024-12-04 20:30:09,171] Trial 1145 finished with value: 0.14249502331046732 and parameters: {'kernel_type': 'Matern', 'length_scale': 0.37898024145431314, 'noise_level': 0.9970550303947298, 'constant_value': 0.009072784758501715, 'nu': 1.5}. Best is trial 959 with value: 0.1375110730946576.
[I 2024-12-04 20:30:13,144] Trial 1149 finished with value: 0.9864686688020731 and parameters: {'kernel_type': 'Matern', 'length_scale': 0.08479850244775172, 'noise_level': 0.7370124240642122, 'constant_value': 0.44348124464522704, 'nu': 1.5}. Best is trial 959 with value: 0.1375110730946576.
[I 2024-12-04 20:30:16,597] Trial 1150 finished with value: 0.14249516718650349 and parameters: {'kernel_type': 'Matern', 'length_scale': 12.20762928373415, 'noise_level': 0.4043874399583062, 'constant_value': 0.5640042760363546, 'nu': 1.5}. Best is trial 959 with value: 0.1375110730946576.
[I 2024-12-04 20:30:17,477] Trial 1151 finished with value: 0.986468681930577 and parameters: {'kernel_type': 'Matern', 'length_scale': 18.36784362829691, 'noise_level': 0.015143238551527454, 'constant_value': 0.057937282754932, 'nu': 1.5}. Best is trial 959 with value: 0.1375110730946576.
[I 2024-12-04 20:30:21,418] Trial 1152 finished with value: 0.14249493062395893 and parameters: {'kernel_type': 'Matern', 'length_scale': 9.233938763285556, 'noise_level': 0.017765809610744723, 'constant_value': 1.0466300440199345, 'nu': 1.5}. Best is trial 959 with value: 0.1375110730946576.
[I 2024-12-04 20:30:25,388] Trial 1153 finished with value: 0.14249508371568878 and parameters: {'kernel_type': 'Matern', 'length_scale': 0.22302412364609825, 'noise_level': 0.0498170435636068, 'constant_value': 0.3561995899111622, 'nu': 1.5}. Best is trial 959 with value: 0.1375110730946576.
[I 2024-12-04 20:30:25,713] Trial 1154 finished with value: 0.14249505145013996 and parameters: {'kernel_type': 'Matern', 'length_scale': 53.082279099184404, 'noise_level': 0.9131590982719514, 'constant_value': 2.8240873229754215, 'nu': 1.5}. Best is trial 959 with value: 0.1375110730946576.
