[I 2024-12-04 15:10:16,705] Trial 1502 finished with value: 0.4883034295980622 and parameters: {'kernel_type': 'Matern', 'length_scale': 18.961672120867508, 'noise_level': 0.013189615007518113, 'constant_value': 10.15752787574295, 'nu': 0.5}. Best is trial 386 with value: 0.4872991004520934.
[I 2024-12-04 15:10:16,719] Trial 1497 finished with value: 0.48830342498294943 and parameters: {'kernel_type': 'Matern', 'length_scale': 97513.88105487244, 'noise_level': 0.041511827605926525, 'constant_value': 51922.121475051295, 'nu': 0.5}. Best is trial 386 with value: 0.4872991004520934.
[I 2024-12-04 15:10:16,721] Trial 1501 finished with value: 0.4883033998038158 and parameters: {'kernel_type': 'Matern', 'length_scale': 70.79607236610207, 'noise_level': 0.7450918153526275, 'constant_value': 0.017950585795151314, 'nu': 0.5}. Best is trial 386 with value: 0.4872991004520934.
[I 2024-12-04 15:10:16,738] Trial 1504 finished with value: 0.4883034205822558 and parameters: {'kernel_type': 'Matern', 'length_scale': 978.062331617114, 'noise_level': 0.6783111103614786, 'constant_value': 78539.29791544996, 'nu': 0.5}. Best is trial 386 with value: 0.4872991004520934.
[I 2024-12-04 15:10:17,360] Trial 1510 finished with value: 0.4883034184668356 and parameters: {'kernel_type': 'Matern', 'length_scale': 1855.7224970518953, 'noise_level': 0.004077349177795996, 'constant_value': 71286.05355097371, 'nu': 0.5}. Best is trial 386 with value: 0.4872991004520934.
[I 2024-12-04 15:10:19,256] Trial 1505 finished with value: 0.4883034315201367 and parameters: {'kernel_type': 'Matern', 'length_scale': 0.9937607602735608, 'noise_level': 0.00023387516659779045, 'constant_value': 0.1029866258666692, 'nu': 0.5}. Best is trial 386 with value: 0.4872991004520934.
[I 2024-12-04 15:10:19,748] Trial 1503 finished with value: 0.6443853564244785 and parameters: {'kernel_type': 'RBF', 'length_scale': 21641.507026519084, 'noise_level': 0.810196164910405, 'constant_value': 1380.2177480368273, 'nu': 0.5}. Best is trial 386 with value: 0.4872991004520934.
[I 2024-12-04 15:10:21,152] Trial 1512 finished with value: 0.48830343619340644 and parameters: {'kernel_type': 'Matern', 'length_scale': 593.9020065280835, 'noise_level': 0.9327939733857896, 'constant_value': 3906.7087158809827, 'nu': 0.5}. Best is trial 386 with value: 0.4872991004520934.
[I 2024-12-04 15:10:21,423] Trial 1517 finished with value: 0.488303668881458 and parameters: {'kernel_type': 'Matern', 'length_scale': 98049.40115153168, 'noise_level': 0.06303385524794383, 'constant_value': 1333.0808525420753, 'nu': 0.5}. Best is trial 386 with value: 0.4872991004520934.
[I 2024-12-04 15:10:21,775] Trial 1516 finished with value: 0.4883034545575481 and parameters: {'kernel_type': 'Matern', 'length_scale': 92728.04216801634, 'noise_level': 0.06988353049947206, 'constant_value': 1377.612084488905, 'nu': 0.5}. Best is trial 386 with value: 0.4872991004520934.
[I 2024-12-04 15:10:23,370] Trial 1509 finished with value: 1.2401112326127164 and parameters: {'kernel_type': 'Matern', 'length_scale': 440.80888564432854, 'noise_level': 0.011872100302628304, 'constant_value': 234.53395904820957, 'nu': 2.5}. Best is trial 386 with value: 0.4872991004520934.
[I 2024-12-04 15:10:23,467] Trial 1507 finished with value: 0.4883034302065849 and parameters: {'kernel_type': 'Matern', 'length_scale': 1275.7549200558526, 'noise_level': 0.06827905137888637, 'constant_value': 24.054291279169522, 'nu': 0.5}. Best is trial 386 with value: 0.4872991004520934.
[I 2024-12-04 15:10:23,639] Trial 1506 finished with value: 0.48830277785098564 and parameters: {'kernel_type': 'Matern', 'length_scale': 69606.20674919272, 'noise_level': 0.9885043615030773, 'constant_value': 68.29093893629376, 'nu': 0.5}. Best is trial 386 with value: 0.4872991004520934.
[I 2024-12-04 15:10:24,728] Trial 1511 finished with value: 0.48830369474109453 and parameters: {'kernel_type': 'Matern', 'length_scale': 76854.28926169919, 'noise_level': 0.932525511603759, 'constant_value': 44347.39073074894, 'nu': 0.5}. Best is trial 386 with value: 0.4872991004520934.
[I 2024-12-04 15:10:24,737] Trial 1521 finished with value: 0.48830341889140605 and parameters: {'kernel_type': 'Matern', 'length_scale': 810.9137217475081, 'noise_level': 0.020186690944385525, 'constant_value': 2234.681893995713, 'nu': 0.5}. Best is trial 386 with value: 0.4872991004520934.
[I 2024-12-04 15:10:25,278] Trial 1514 finished with value: 0.5273059903154609 and parameters: {'kernel_type': 'Matern', 'length_scale': 47006.62639003755, 'noise_level': 0.980675501295687, 'constant_value': 13651.66547164737, 'nu': 1.5}. Best is trial 386 with value: 0.4872991004520934.
[I 2024-12-04 15:10:26,544] Trial 1522 finished with value: 0.4883034124983969 and parameters: {'kernel_type': 'Matern', 'length_scale': 56612.040024155045, 'noise_level': 0.9310370893224514, 'constant_value': 523.2980766887805, 'nu': 0.5}. Best is trial 386 with value: 0.4872991004520934.
[I 2024-12-04 15:10:26,663] Trial 1515 finished with value: 0.5273061587549636 and parameters: {'kernel_type': 'Matern', 'length_scale': 1280.7937215602565, 'noise_level': 0.8314287687685858, 'constant_value': 8589.320716347847, 'nu': 1.5}. Best is trial 386 with value: 0.4872991004520934.
[I 2024-12-04 15:10:29,068] Trial 1518 finished with value: 0.4883034493134739 and parameters: {'kernel_type': 'Matern', 'length_scale': 23139.87956469615, 'noise_level': 0.20141711545844346, 'constant_value': 2.137350375542357, 'nu': 0.5}. Best is trial 386 with value: 0.4872991004520934.
[I 2024-12-04 15:10:29,069] Trial 1513 finished with value: 1.2401112351239398 and parameters: {'kernel_type': 'RBF', 'length_scale': 0.054452729839118086, 'noise_level': 0.00018102386156058927, 'constant_value': 0.0023764256984479502, 'nu': 2.5}. Best is trial 386 with value: 0.4872991004520934.
[I 2024-12-04 15:10:29,380] Trial 1508 finished with value: 0.4883034192080434 and parameters: {'kernel_type': 'Matern', 'length_scale': 2255.7371901202882, 'noise_level': 0.8504748389820722, 'constant_value': 26696.604742685526, 'nu': 0.5}. Best is trial 386 with value: 0.4872991004520934.
[I 2024-12-04 15:10:30,133] Trial 1523 finished with value: 1.2401112326053056 and parameters: {'kernel_type': 'Matern', 'length_scale': 88422.78769260616, 'noise_level': 0.022722651981607944, 'constant_value': 126.76916250113169, 'nu': 0.5}. Best is trial 386 with value: 0.4872991004520934.
[I 2024-12-04 15:10:31,710] Trial 1526 finished with value: 1.2401112319620842 and parameters: {'kernel_type': 'Matern', 'length_scale': 96410.64963685766, 'noise_level': 0.005380814172072078, 'constant_value': 93.64891629026954, 'nu': 0.5}. Best is trial 386 with value: 0.4872991004520934.
[I 2024-12-04 15:10:32,365] Trial 1524 finished with value: 0.5663936920003254 and parameters: {'kernel_type': 'Matern', 'length_scale': 6.533587901633143, 'noise_level': 0.32554690072137876, 'constant_value': 102.79746331238208, 'nu': 2.5}. Best is trial 386 with value: 0.4872991004520934.
[I 2024-12-04 15:10:32,373] Trial 1520 finished with value: 1.2401112327710127 and parameters: {'kernel_type': 'Matern', 'length_scale': 52192.79311223877, 'noise_level': 0.0001467984237474453, 'constant_value': 16834.00348420508, 'nu': 2.5}. Best is trial 386 with value: 0.4872991004520934.
[I 2024-12-04 15:10:33,252] Trial 1528 finished with value: 0.48830343769330575 and parameters: {'kernel_type': 'Matern', 'length_scale': 14337.18518827617, 'noise_level': 0.6560629942934761, 'constant_value': 6.760687743606282, 'nu': 0.5}. Best is trial 386 with value: 0.4872991004520934.
[I 2024-12-04 15:10:33,471] Trial 1531 finished with value: 0.48830341433705327 and parameters: {'kernel_type': 'Matern', 'length_scale': 31.598585758102477, 'noise_level': 0.8566234188005747, 'constant_value': 2.535577285368186, 'nu': 0.5}. Best is trial 386 with value: 0.4872991004520934.
[I 2024-12-04 15:10:33,623] Trial 1527 finished with value: 1.2401112327128336 and parameters: {'kernel_type': 'Matern', 'length_scale': 89149.05494772829, 'noise_level': 0.018596539032448362, 'constant_value': 95.11731562319602, 'nu': 0.5}. Best is trial 386 with value: 0.4872991004520934.
[I 2024-12-04 15:10:34,133] Trial 1530 finished with value: 1.2401112325770178 and parameters: {'kernel_type': 'Matern', 'length_scale': 79432.93144300416, 'noise_level': 0.007415629180500645, 'constant_value': 102.84648401809417, 'nu': 0.5}. Best is trial 386 with value: 0.4872991004520934.
[I 2024-12-04 15:10:35,079] Trial 1535 finished with value: 0.48830343321996345 and parameters: {'kernel_type': 'Matern', 'length_scale': 12925.903260131989, 'noise_level': 0.1517738870879972, 'constant_value': 84.66800706033867, 'nu': 0.5}. Best is trial 386 with value: 0.4872991004520934.
[I 2024-12-04 15:10:35,416] Trial 1538 finished with value: 1.261454797635225 and parameters: {'kernel_type': 'Matern', 'length_scale': 37315.847885033785, 'noise_level': 0.9010289661256807, 'constant_value': 67.60449433508776, 'nu': 2.5}. Best is trial 386 with value: 0.4872991004520934.
[I 2024-12-04 15:10:37,083] Trial 1533 finished with value: 0.48830356756284604 and parameters: {'kernel_type': 'Matern', 'length_scale': 48934.03953500707, 'noise_level': 0.9724580916126156, 'constant_value': 3.676245924255025, 'nu': 0.5}. Best is trial 386 with value: 0.4872991004520934.
[I 2024-12-04 15:10:37,222] Trial 1532 finished with value: 0.4883033814196993 and parameters: {'kernel_type': 'Matern', 'length_scale': 99849.36170177287, 'noise_level': 0.6754049895158682, 'constant_value': 25682.882080491327, 'nu': 0.5}. Best is trial 386 with value: 0.4872991004520934.
[I 2024-12-04 15:10:37,476] Trial 1529 finished with value: 0.4883034206409932 and parameters: {'kernel_type': 'Matern', 'length_scale': 2477.269433264519, 'noise_level': 0.9301466729219667, 'constant_value': 1789.6362008026244, 'nu': 0.5}. Best is trial 386 with value: 0.4872991004520934.
[I 2024-12-04 15:10:38,073] Trial 1519 finished with value: 0.48830341855380754 and parameters: {'kernel_type': 'Matern', 'length_scale': 24881.692450872964, 'noise_level': 0.3056034227080118, 'constant_value': 14.663794060086925, 'nu': 0.5}. Best is trial 386 with value: 0.4872991004520934.
[I 2024-12-04 15:10:39,145] Trial 1525 finished with value: 0.4883034178672885 and parameters: {'kernel_type': 'Matern', 'length_scale': 74802.07934501921, 'noise_level': 0.0491887425079786, 'constant_value': 2882.3338126052254, 'nu': 0.5}. Best is trial 386 with value: 0.4872991004520934.
[I 2024-12-04 15:10:39,612] Trial 1534 finished with value: 1.2401112304305277 and parameters: {'kernel_type': 'Matern', 'length_scale': 86.77626183796262, 'noise_level': 1.713432915665566e-09, 'constant_value': 2.6900887001426094e-07, 'nu': 2.5}. Best is trial 386 with value: 0.4872991004520934.
[I 2024-12-04 15:10:39,678] Trial 1537 finished with value: 0.48830355828624056 and parameters: {'kernel_type': 'Matern', 'length_scale': 1696.032068247035, 'noise_level': 0.9250608779895475, 'constant_value': 0.733972198699768, 'nu': 0.5}. Best is trial 386 with value: 0.4872991004520934.
[I 2024-12-04 15:10:40,001] Trial 1548 finished with value: 0.48830341777213654 and parameters: {'kernel_type': 'Matern', 'length_scale': 21199.741143501065, 'noise_level': 0.9546409817907152, 'constant_value': 990.2449879526215, 'nu': 0.5}. Best is trial 386 with value: 0.4872991004520934.
[I 2024-12-04 15:10:40,094] Trial 1536 finished with value: 0.48830348660478645 and parameters: {'kernel_type': 'Matern', 'length_scale': 4298.578028548004, 'noise_level': 0.9025632995908429, 'constant_value': 3027.4648109988416, 'nu': 0.5}. Best is trial 386 with value: 0.4872991004520934.
[I 2024-12-04 15:10:40,201] Trial 1541 finished with value: 1.261454748687966 and parameters: {'kernel_type': 'Matern', 'length_scale': 44411.76507000003, 'noise_level': 0.7668336645257976, 'constant_value': 0.41895759756003736, 'nu': 0.5}. Best is trial 386 with value: 0.4872991004520934.
[I 2024-12-04 15:10:42,370] Trial 1547 finished with value: 1.2614547976351287 and parameters: {'kernel_type': 'Matern', 'length_scale': 54.74814112634081, 'noise_level': 2.8325770069961706e-07, 'constant_value': 65711.70213280937, 'nu': 1.5}. Best is trial 386 with value: 0.4872991004520934.
[I 2024-12-04 15:10:42,742] Trial 1549 finished with value: 1.2614547150371949 and parameters: {'kernel_type': 'Matern', 'length_scale': 3055.9564445886576, 'noise_level': 0.9151640900115265, 'constant_value': 0.0009901363709302919, 'nu': 0.5}. Best is trial 386 with value: 0.4872991004520934.
[I 2024-12-04 15:10:43,476] Trial 1540 finished with value: 0.4883034222421521 and parameters: {'kernel_type': 'Matern', 'length_scale': 6847.559779051808, 'noise_level': 0.7984022110939843, 'constant_value': 24.396697812625604, 'nu': 0.5}. Best is trial 386 with value: 0.4872991004520934.
[I 2024-12-04 15:10:43,875] Trial 1539 finished with value: 0.4883036434216401 and parameters: {'kernel_type': 'Matern', 'length_scale': 55355.42617944055, 'noise_level': 0.999099273522754, 'constant_value': 267.0252069699814, 'nu': 0.5}. Best is trial 386 with value: 0.4872991004520934.
[I 2024-12-04 15:10:45,141] Trial 1543 finished with value: 0.4883034198910903 and parameters: {'kernel_type': 'Matern', 'length_scale': 42238.255928248356, 'noise_level': 0.4312183319073986, 'constant_value': 610.2257213948634, 'nu': 0.5}. Best is trial 386 with value: 0.4872991004520934.
[I 2024-12-04 15:10:46,378] Trial 1551 finished with value: 0.488303447480511 and parameters: {'kernel_type': 'Matern', 'length_scale': 37735.50826480971, 'noise_level': 0.6746424644715198, 'constant_value': 108.39455655689036, 'nu': 0.5}. Best is trial 386 with value: 0.4872991004520934.
[I 2024-12-04 15:10:46,399] Trial 1554 finished with value: 0.48830342115064657 and parameters: {'kernel_type': 'Matern', 'length_scale': 37045.794777978146, 'noise_level': 0.8577454113422277, 'constant_value': 91.91254436934176, 'nu': 0.5}. Best is trial 386 with value: 0.4872991004520934.
[I 2024-12-04 15:10:46,788] Trial 1550 finished with value: 0.48830333247331487 and parameters: {'kernel_type': 'Matern', 'length_scale': 72181.4068510276, 'noise_level': 0.43917303067089186, 'constant_value': 105.96836466583134, 'nu': 0.5}. Best is trial 386 with value: 0.4872991004520934.
[I 2024-12-04 15:10:46,789] Trial 1545 finished with value: 1.2614547976352422 and parameters: {'kernel_type': 'RBF', 'length_scale': 75719.12381777503, 'noise_level': 0.7969286179044267, 'constant_value': 790.0150298898473, 'nu': 0.5}. Best is trial 386 with value: 0.4872991004520934.
[I 2024-12-04 15:10:47,718] Trial 1552 finished with value: 0.48830341892010276 and parameters: {'kernel_type': 'Matern', 'length_scale': 87290.38762515265, 'noise_level': 0.024696401059783542, 'constant_value': 447.65417486815306, 'nu': 0.5}. Best is trial 386 with value: 0.4872991004520934.
[I 2024-12-04 15:10:48,057] Trial 1546 finished with value: 0.4883034212313674 and parameters: {'kernel_type': 'Matern', 'length_scale': 1825.4254432803316, 'noise_level': 0.5221513797710394, 'constant_value': 59479.83013762736, 'nu': 0.5}. Best is trial 386 with value: 0.4872991004520934.
[I 2024-12-04 15:10:48,257] Trial 1553 finished with value: 0.5663936417467821 and parameters: {'kernel_type': 'Matern', 'length_scale': 414.81830699061203, 'noise_level': 0.04929319239787278, 'constant_value': 61847.92111890537, 'nu': 2.5}. Best is trial 386 with value: 0.4872991004520934.
[I 2024-12-04 15:10:48,459] Trial 1542 finished with value: 0.4883034177988672 and parameters: {'kernel_type': 'Matern', 'length_scale': 94608.42471905376, 'noise_level': 0.06861759212586344, 'constant_value': 48.061617393127044, 'nu': 0.5}. Best is trial 386 with value: 0.4872991004520934.
[I 2024-12-04 15:10:51,922] Trial 1564 finished with value: 0.4883034293367408 and parameters: {'kernel_type': 'Matern', 'length_scale': 1758.4621566157498, 'noise_level': 0.7585716570443866, 'constant_value': 189.3985479401383, 'nu': 0.5}. Best is trial 386 with value: 0.4872991004520934.
[I 2024-12-04 15:10:52,925] Trial 1555 finished with value: 0.4883033883897077 and parameters: {'kernel_type': 'Matern', 'length_scale': 182.87340630947074, 'noise_level': 0.8690882445341309, 'constant_value': 22.661984072396663, 'nu': 0.5}. Best is trial 386 with value: 0.4872991004520934.
[I 2024-12-04 15:10:53,556] Trial 1562 finished with value: 0.4883034305884935 and parameters: {'kernel_type': 'Matern', 'length_scale': 1218.173882306834, 'noise_level': 0.812048466048264, 'constant_value': 9.894186621536562, 'nu': 0.5}. Best is trial 386 with value: 0.4872991004520934.
[I 2024-12-04 15:10:53,576] Trial 1556 finished with value: 0.4883034074018925 and parameters: {'kernel_type': 'Matern', 'length_scale': 11527.515032710495, 'noise_level': 0.7954619680600049, 'constant_value': 830.4937479326826, 'nu': 0.5}. Best is trial 386 with value: 0.4872991004520934.
[I 2024-12-04 15:10:54,133] Trial 1544 finished with value: 0.48830344968934625 and parameters: {'kernel_type': 'Matern', 'length_scale': 80.14967806954475, 'noise_level': 0.9795045015580572, 'constant_value': 10106.712475954278, 'nu': 0.5}. Best is trial 386 with value: 0.4872991004520934.
[I 2024-12-04 15:10:54,164] Trial 1558 finished with value: 0.4883034140156473 and parameters: {'kernel_type': 'Matern', 'length_scale': 4213.527004988257, 'noise_level': 0.015536423552320933, 'constant_value': 35729.057595915176, 'nu': 0.5}. Best is trial 386 with value: 0.4872991004520934.
[I 2024-12-04 15:10:54,883] Trial 1561 finished with value: 0.48830341921185527 and parameters: {'kernel_type': 'Matern', 'length_scale': 2171.245349287701, 'noise_level': 0.8870234595078568, 'constant_value': 159.92771116860672, 'nu': 0.5}. Best is trial 386 with value: 0.4872991004520934.
[I 2024-12-04 15:10:56,288] Trial 1568 finished with value: 0.6443852623791717 and parameters: {'kernel_type': 'RBF', 'length_scale': 180.27188085872612, 'noise_level': 0.014398222981784241, 'constant_value': 404.6400753265091, 'nu': 0.5}. Best is trial 386 with value: 0.4872991004520934.
[I 2024-12-04 15:10:56,364] Trial 1559 finished with value: 0.48830340311889614 and parameters: {'kernel_type': 'Matern', 'length_scale': 330.8926158429288, 'noise_level': 0.7718789594147224, 'constant_value': 45587.90943050198, 'nu': 0.5}. Best is trial 386 with value: 0.4872991004520934.
[I 2024-12-04 15:10:57,123] Trial 1570 finished with value: 1.240111232373662 and parameters: {'kernel_type': 'RBF', 'length_scale': 0.028804295551150907, 'noise_level': 0.04673571410733005, 'constant_value': 0.20193067972178289, 'nu': 0.5}. Best is trial 386 with value: 0.4872991004520934.
[I 2024-12-04 15:10:57,219] Trial 1565 finished with value: 0.4883034431383711 and parameters: {'kernel_type': 'Matern', 'length_scale': 1236.780681147728, 'noise_level': 0.04231279296209127, 'constant_value': 3829.9116400044445, 'nu': 0.5}. Best is trial 386 with value: 0.4872991004520934.
[I 2024-12-04 15:10:57,890] Trial 1566 finished with value: 0.4883034403905526 and parameters: {'kernel_type': 'Matern', 'length_scale': 0.1590143256681389, 'noise_level': 0.7009670402738344, 'constant_value': 0.10290589138555895, 'nu': 0.5}. Best is trial 386 with value: 0.4872991004520934.
[I 2024-12-04 15:10:57,981] Trial 1563 finished with value: 1.2614547953941475 and parameters: {'kernel_type': 'Matern', 'length_scale': 1768.0505260673233, 'noise_level': 0.03030752036996949, 'constant_value': 81336.89204870226, 'nu': 0.5}. Best is trial 386 with value: 0.4872991004520934.
[I 2024-12-04 15:10:58,056] Trial 1567 finished with value: 0.4883034191321483 and parameters: {'kernel_type': 'Matern', 'length_scale': 17226.09570577409, 'noise_level': 0.005268869711842047, 'constant_value': 81334.70488799793, 'nu': 0.5}. Best is trial 386 with value: 0.4872991004520934.
[I 2024-12-04 15:10:58,118] Trial 1573 finished with value: 0.48830342883687855 and parameters: {'kernel_type': 'Matern', 'length_scale': 97.80912923844875, 'noise_level': 0.9398619603921408, 'constant_value': 37.416230127682134, 'nu': 0.5}. Best is trial 386 with value: 0.4872991004520934.
[I 2024-12-04 15:10:58,803] Trial 1569 finished with value: 0.4883034191605304 and parameters: {'kernel_type': 'Matern', 'length_scale': 7859.003444534154, 'noise_level': 0.8851229259702935, 'constant_value': 5916.238889744845, 'nu': 0.5}. Best is trial 386 with value: 0.4872991004520934.
[I 2024-12-04 15:10:59,030] Trial 1557 finished with value: 0.48830339357685965 and parameters: {'kernel_type': 'Matern', 'length_scale': 86960.42447234258, 'noise_level': 0.5835811865293137, 'constant_value': 710.1767960651365, 'nu': 0.5}. Best is trial 386 with value: 0.4872991004520934.
[I 2024-12-04 15:11:01,020] Trial 1560 finished with value: 0.5273054071979707 and parameters: {'kernel_type': 'Matern', 'length_scale': 6.075459439376019, 'noise_level': 0.5168988519185647, 'constant_value': 0.026705983382029935, 'nu': 1.5}. Best is trial 386 with value: 0.4872991004520934.
[I 2024-12-04 15:11:01,715] Trial 1571 finished with value: 0.48830341656065207 and parameters: {'kernel_type': 'Matern', 'length_scale': 47335.78655678377, 'noise_level': 0.15563559218975168, 'constant_value': 99308.13699421208, 'nu': 0.5}. Best is trial 386 with value: 0.4872991004520934.
[I 2024-12-04 15:11:02,168] Trial 1574 finished with value: 0.48830342128123355 and parameters: {'kernel_type': 'Matern', 'length_scale': 83564.46353109615, 'noise_level': 0.09672146328183383, 'constant_value': 889.641390397921, 'nu': 0.5}. Best is trial 386 with value: 0.4872991004520934.
[I 2024-12-04 15:11:03,914] Trial 1578 finished with value: 0.6443853570277743 and parameters: {'kernel_type': 'RBF', 'length_scale': 1.9012750345836646, 'noise_level': 0.31852039511157854, 'constant_value': 0.07031047267133232, 'nu': 0.5}. Best is trial 386 with value: 0.4872991004520934.
