[I 2024-12-04 00:13:41,035] Trial 945 finished with value: 0.24717940757361126 and parameters: {'kernel': 'rbf', 'C': 22.31760264722704, 'gamma': 0.0038163219639341054, 'epsilon': 0.004346903165692086}. Best is trial 448 with value: 0.13989258940934515.
[I 2024-12-04 00:13:41,115] Trial 942 finished with value: 0.1505431870598685 and parameters: {'kernel': 'rbf', 'C': 95.55028688400324, 'gamma': 0.005461907689462582, 'epsilon': 0.0010713641379762222}. Best is trial 448 with value: 0.13989258940934515.
[I 2024-12-04 00:13:43,694] Trial 949 finished with value: 0.3194945399788697 and parameters: {'kernel': 'rbf', 'C': 24.119659363452456, 'gamma': 0.0009773584281241709, 'epsilon': 0.0024300074409171414}. Best is trial 448 with value: 0.13989258940934515.
[I 2024-12-04 00:13:44,305] Trial 947 finished with value: 0.174704532313018 and parameters: {'kernel': 'rbf', 'C': 92.03519973613743, 'gamma': 0.0035470642176334633, 'epsilon': 0.002921011136974124}. Best is trial 448 with value: 0.13989258940934515.
[I 2024-12-04 00:13:45,386] Trial 943 finished with value: 0.541121107807925 and parameters: {'kernel': 'poly', 'C': 0.12792089030114753, 'gamma': 0.0858474707473142, 'epsilon': 0.062167589636499286}. Best is trial 448 with value: 0.13989258940934515.
[I 2024-12-04 00:13:46,166] Trial 948 finished with value: 0.1455971905190484 and parameters: {'kernel': 'rbf', 'C': 84.61059942715536, 'gamma': 0.006782867222733881, 'epsilon': 0.0036655704052938613}. Best is trial 448 with value: 0.13989258940934515.
[I 2024-12-04 00:13:46,239] Trial 950 finished with value: 0.22467277506971492 and parameters: {'kernel': 'rbf', 'C': 94.57728820715626, 'gamma': 0.0015384133746377355, 'epsilon': 0.0026518786281281093}. Best is trial 448 with value: 0.13989258940934515.
[I 2024-12-04 00:13:47,494] Trial 952 finished with value: 0.7267438397890096 and parameters: {'kernel': 'poly', 'C': 72.17199910232884, 'gamma': 0.0036711924328590405, 'epsilon': 0.0011190056899263853}. Best is trial 448 with value: 0.13989258940934515.
[I 2024-12-04 00:13:50,853] Trial 951 finished with value: 0.18042516249891044 and parameters: {'kernel': 'rbf', 'C': 97.31701087677227, 'gamma': 0.027059007586449066, 'epsilon': 0.003229301580186479}. Best is trial 448 with value: 0.13989258940934515.
[I 2024-12-04 00:13:51,216] Trial 955 finished with value: 0.19916995018752853 and parameters: {'kernel': 'rbf', 'C': 19.167774034997827, 'gamma': 0.05347711712204791, 'epsilon': 0.0017863745252119682}. Best is trial 448 with value: 0.13989258940934515.
[I 2024-12-04 00:13:51,255] Trial 954 finished with value: 0.14006384686583706 and parameters: {'kernel': 'rbf', 'C': 97.76783307616661, 'gamma': 0.008772662662572697, 'epsilon': 0.002267935909362971}. Best is trial 448 with value: 0.13989258940934515.
[I 2024-12-04 00:13:54,593] Trial 958 finished with value: 0.2206570566810093 and parameters: {'kernel': 'rbf', 'C': 16.72709338266376, 'gamma': 0.007473080029834367, 'epsilon': 0.0024089286223452264}. Best is trial 448 with value: 0.13989258940934515.
[I 2024-12-04 00:13:55,515] Trial 876 finished with value: 0.5522177473258257 and parameters: {'kernel': 'poly', 'C': 81.36666284543142, 'gamma': 0.015872906683239006, 'epsilon': 0.0012325869319348185}. Best is trial 448 with value: 0.13989258940934515.
[I 2024-12-04 00:13:55,561] Trial 957 finished with value: 0.18596682311040347 and parameters: {'kernel': 'rbf', 'C': 95.52881650331874, 'gamma': 0.0030069319143891985, 'epsilon': 0.002802108196144846}. Best is trial 448 with value: 0.13989258940934515.
[I 2024-12-04 00:13:56,649] Trial 869 finished with value: 0.351471680339929 and parameters: {'kernel': 'linear', 'C': 14.247511801071273, 'gamma': 0.018025933449830493, 'epsilon': 0.0024506386727448006}. Best is trial 448 with value: 0.13989258940934515.
[I 2024-12-04 00:13:56,761] Trial 959 finished with value: 0.30159310461795286 and parameters: {'kernel': 'rbf', 'C': 10.909485791631857, 'gamma': 0.002326052378800757, 'epsilon': 0.0010527424160167644}. Best is trial 448 with value: 0.13989258940934515.
[I 2024-12-04 00:13:57,558] Trial 961 finished with value: 0.5857645939649134 and parameters: {'kernel': 'linear', 'C': 0.0029043023848177602, 'gamma': 0.013974414586816319, 'epsilon': 0.19203510641088198}. Best is trial 448 with value: 0.13989258940934515.
[I 2024-12-04 00:13:58,011] Trial 956 finished with value: 0.16686168657778538 and parameters: {'kernel': 'rbf', 'C': 85.84763131475603, 'gamma': 0.01733100352883856, 'epsilon': 0.00273081948345561}. Best is trial 448 with value: 0.13989258940934515.
[I 2024-12-04 00:13:58,354] Trial 960 finished with value: 0.1525685717309152 and parameters: {'kernel': 'rbf', 'C': 19.369277442273926, 'gamma': 0.01712545016243149, 'epsilon': 0.0012340380768162478}. Best is trial 448 with value: 0.13989258940934515.
[I 2024-12-04 00:13:58,636] Trial 962 finished with value: 0.27588969819056575 and parameters: {'kernel': 'rbf', 'C': 2.2338861495947806, 'gamma': 0.015062939034380322, 'epsilon': 0.0051899969479400595}. Best is trial 448 with value: 0.13989258940934515.
[I 2024-12-04 00:14:02,023] Trial 963 finished with value: 0.1408835354700145 and parameters: {'kernel': 'rbf', 'C': 89.72181698219944, 'gamma': 0.009459624217842029, 'epsilon': 0.003133639899312875}. Best is trial 448 with value: 0.13989258940934515.
[I 2024-12-04 00:14:03,652] Trial 966 finished with value: 0.14088083913787675 and parameters: {'kernel': 'rbf', 'C': 90.8484187230473, 'gamma': 0.007640805360816293, 'epsilon': 0.0032555997863621547}. Best is trial 448 with value: 0.13989258940934515.
[I 2024-12-04 00:14:03,931] Trial 967 finished with value: 0.14129155374789573 and parameters: {'kernel': 'rbf', 'C': 87.01118758176113, 'gamma': 0.008681370896582472, 'epsilon': 0.003026040370976391}. Best is trial 448 with value: 0.13989258940934515.
[I 2024-12-04 00:14:04,451] Trial 964 finished with value: 0.17273193817409468 and parameters: {'kernel': 'rbf', 'C': 96.41081220754093, 'gamma': 0.021410519199885902, 'epsilon': 0.001037115273848954}. Best is trial 448 with value: 0.13989258940934515.
[I 2024-12-04 00:14:04,659] Trial 968 finished with value: 0.22162443455493797 and parameters: {'kernel': 'rbf', 'C': 18.64105889540791, 'gamma': 0.006829697840227298, 'epsilon': 0.0044415391341029705}. Best is trial 448 with value: 0.13989258940934515.
[I 2024-12-04 00:14:06,266] Trial 965 finished with value: 0.19018798468422748 and parameters: {'kernel': 'rbf', 'C': 83.25507533075725, 'gamma': 0.03716738992171682, 'epsilon': 0.0010389632259285538}. Best is trial 448 with value: 0.13989258940934515.
[I 2024-12-04 00:14:07,199] Trial 969 finished with value: 0.15031223186572232 and parameters: {'kernel': 'rbf', 'C': 17.82321896765258, 'gamma': 0.023400276075682475, 'epsilon': 0.0035568177430057627}. Best is trial 448 with value: 0.13989258940934515.
[I 2024-12-04 00:14:07,274] Trial 972 finished with value: 0.2880652916318564 and parameters: {'kernel': 'rbf', 'C': 17.88071902451988, 'gamma': 0.0018761931146627619, 'epsilon': 0.004666151346586015}. Best is trial 448 with value: 0.13989258940934515.
[I 2024-12-04 00:14:08,978] Trial 970 finished with value: 0.1444862618203982 and parameters: {'kernel': 'rbf', 'C': 93.94936978781098, 'gamma': 0.006422662740483012, 'epsilon': 0.002710996681004397}. Best is trial 448 with value: 0.13989258940934515.
[I 2024-12-04 00:14:09,106] Trial 971 finished with value: 0.14964536936884715 and parameters: {'kernel': 'rbf', 'C': 91.89048511339281, 'gamma': 0.005645739476855555, 'epsilon': 0.0011728373373323456}. Best is trial 448 with value: 0.13989258940934515.
[I 2024-12-04 00:14:10,643] Trial 974 finished with value: 0.1866573506217081 and parameters: {'kernel': 'rbf', 'C': 95.66250712926464, 'gamma': 0.0029664836715730366, 'epsilon': 0.0036700615048097436}. Best is trial 448 with value: 0.13989258940934515.
[I 2024-12-04 00:14:10,990] Trial 973 finished with value: 0.1397919550170376 and parameters: {'kernel': 'rbf', 'C': 94.47438897493997, 'gamma': 0.008532419389434337, 'epsilon': 0.0010631673985804222}. Best is trial 973 with value: 0.1397919550170376.
[I 2024-12-04 00:14:12,383] Trial 977 finished with value: 0.2467535747478294 and parameters: {'kernel': 'rbf', 'C': 15.537636375337785, 'gamma': 0.005262513241713795, 'epsilon': 0.0029248641932197927}. Best is trial 973 with value: 0.1397919550170376.
[I 2024-12-04 00:14:12,384] Trial 976 finished with value: 0.14971146778767153 and parameters: {'kernel': 'rbf', 'C': 17.845235873481155, 'gamma': 0.02139642116004608, 'epsilon': 0.0027091607783138434}. Best is trial 973 with value: 0.1397919550170376.
[I 2024-12-04 00:14:12,398] Trial 975 finished with value: 0.1406944742260774 and parameters: {'kernel': 'rbf', 'C': 96.1206498993186, 'gamma': 0.007795618134305742, 'epsilon': 0.0035370675359142636}. Best is trial 973 with value: 0.1397919550170376.
[I 2024-12-04 00:14:14,223] Trial 978 finished with value: 0.21528365596375482 and parameters: {'kernel': 'rbf', 'C': 17.303400440812077, 'gamma': 0.007789470455295101, 'epsilon': 0.00162703438843641}. Best is trial 973 with value: 0.1397919550170376.
[I 2024-12-04 00:14:15,329] Trial 982 finished with value: 0.31570143964819114 and parameters: {'kernel': 'rbf', 'C': 22.37283847997448, 'gamma': 0.0010941580864329953, 'epsilon': 0.0010271036709552565}. Best is trial 973 with value: 0.1397919550170376.
[I 2024-12-04 00:14:16,406] Trial 979 finished with value: 0.17796136822031125 and parameters: {'kernel': 'rbf', 'C': 16.035286980233213, 'gamma': 0.03854910596995395, 'epsilon': 0.0011795700426188301}. Best is trial 973 with value: 0.1397919550170376.
[I 2024-12-04 00:14:17,672] Trial 980 finished with value: 0.1579907080194815 and parameters: {'kernel': 'rbf', 'C': 93.23827123235249, 'gamma': 0.004634223536016793, 'epsilon': 0.0012408810355369138}. Best is trial 973 with value: 0.1397919550170376.
[I 2024-12-04 00:14:18,373] Trial 984 finished with value: 0.21155653990556314 and parameters: {'kernel': 'rbf', 'C': 18.32566014669335, 'gamma': 0.007757137786115528, 'epsilon': 0.0013122800609135835}. Best is trial 973 with value: 0.1397919550170376.
[I 2024-12-04 00:14:21,311] Trial 987 finished with value: 0.24091524454766902 and parameters: {'kernel': 'rbf', 'C': 23.748889486177433, 'gamma': 0.004076115075671214, 'epsilon': 0.0012192808307555007}. Best is trial 973 with value: 0.1397919550170376.
[I 2024-12-04 00:14:21,843] Trial 981 finished with value: 0.18792888395432733 and parameters: {'kernel': 'rbf', 'C': 87.20819711754642, 'gamma': 0.03525341031338975, 'epsilon': 0.0030088032317733965}. Best is trial 973 with value: 0.1397919550170376.
[I 2024-12-04 00:14:23,736] Trial 986 finished with value: 0.14034848439681608 and parameters: {'kernel': 'rbf', 'C': 94.83666466382148, 'gamma': 0.007497467038082975, 'epsilon': 0.0010011118418783648}. Best is trial 973 with value: 0.1397919550170376.
[I 2024-12-04 00:14:24,377] Trial 989 finished with value: 32.40170957110611 and parameters: {'kernel': 'sigmoid', 'C': 10.459782003108174, 'gamma': 0.0027684811288204215, 'epsilon': 0.002446558076394404}. Best is trial 973 with value: 0.1397919550170376.
[I 2024-12-04 00:14:27,074] Trial 946 finished with value: 0.3526801240779921 and parameters: {'kernel': 'linear', 'C': 10.182409990014099, 'gamma': 0.011482868818482511, 'epsilon': 0.0010677690947488298}. Best is trial 973 with value: 0.1397919550170376.
[I 2024-12-04 00:14:28,669] Trial 991 finished with value: 0.17160395543677132 and parameters: {'kernel': 'rbf', 'C': 99.26857673510591, 'gamma': 0.0034831867851837033, 'epsilon': 0.0012137130084119586}. Best is trial 973 with value: 0.1397919550170376.
[I 2024-12-04 00:14:29,160] Trial 992 finished with value: 0.19877268771548245 and parameters: {'kernel': 'rbf', 'C': 18.170456985277415, 'gamma': 0.008904397277168855, 'epsilon': 0.0011358111524631008}. Best is trial 973 with value: 0.1397919550170376.
[I 2024-12-04 00:14:30,055] Trial 990 finished with value: 0.14062647637219028 and parameters: {'kernel': 'rbf', 'C': 83.33411262688305, 'gamma': 0.008807949443338138, 'epsilon': 0.001061220637466751}. Best is trial 973 with value: 0.1397919550170376.
[I 2024-12-04 00:14:30,473] Trial 993 finished with value: 0.49116705430538776 and parameters: {'kernel': 'linear', 'C': 0.012856870791458965, 'gamma': 0.00019992733549514173, 'epsilon': 0.030817366656282427}. Best is trial 973 with value: 0.1397919550170376.
[I 2024-12-04 00:14:32,001] Trial 994 finished with value: 0.21326985081023173 and parameters: {'kernel': 'rbf', 'C': 53.04962352584071, 'gamma': 0.0031984454938008447, 'epsilon': 0.0010344931202800841}. Best is trial 973 with value: 0.1397919550170376.
[I 2024-12-04 00:14:32,617] Trial 983 finished with value: 0.5231177230883571 and parameters: {'kernel': 'poly', 'C': 0.005273996650833594, 'gamma': 0.28501215888933196, 'epsilon': 0.003115184247497698}. Best is trial 973 with value: 0.1397919550170376.
[I 2024-12-04 00:14:33,099] Trial 996 finished with value: 0.25836326599092935 and parameters: {'kernel': 'rbf', 'C': 18.7645400630472, 'gamma': 0.003384488113663883, 'epsilon': 0.0010080845919376445}. Best is trial 973 with value: 0.1397919550170376.
[I 2024-12-04 00:14:35,109] Trial 997 finished with value: 0.18415952105369388 and parameters: {'kernel': 'rbf', 'C': 76.36007511674651, 'gamma': 0.0035612275957706482, 'epsilon': 0.0010329011650684167}. Best is trial 973 with value: 0.1397919550170376.
[I 2024-12-04 00:14:36,158] Trial 998 finished with value: 0.1520043465915912 and parameters: {'kernel': 'rbf', 'C': 17.522160440251316, 'gamma': 0.02517112635334682, 'epsilon': 0.00161210649939921}. Best is trial 973 with value: 0.1397919550170376.
[I 2024-12-04 00:14:36,159] Trial 999 finished with value: 0.5993628164983411 and parameters: {'kernel': 'rbf', 'C': 1.6640088605656775, 'gamma': 0.000336951211266317, 'epsilon': 0.10799945179624296}. Best is trial 973 with value: 0.1397919550170376.
[I 2024-12-04 00:14:37,088] Trial 985 finished with value: 0.5190971337813969 and parameters: {'kernel': 'poly', 'C': 19.724323055203076, 'gamma': 0.019458415239484644, 'epsilon': 0.002114984525460175}. Best is trial 973 with value: 0.1397919550170376.
[I 2024-12-04 00:14:37,096] Trial 988 finished with value: 0.5278719024522537 and parameters: {'kernel': 'poly', 'C': 0.041822335395737674, 'gamma': 0.1365383775365846, 'epsilon': 0.0013073718168946436}. Best is trial 973 with value: 0.1397919550170376.
[I 2024-12-04 00:14:38,127] Trial 995 finished with value: 0.18423780057117828 and parameters: {'kernel': 'rbf', 'C': 76.75717845165913, 'gamma': 0.03175916118789197, 'epsilon': 0.0011118452713926841}. Best is trial 973 with value: 0.1397919550170376.
[I 2024-12-04 00:14:38,845] Trial 1001 finished with value: 0.2543875755752868 and parameters: {'kernel': 'rbf', 'C': 11.458641332258683, 'gamma': 0.005811364558506184, 'epsilon': 0.0012984850526496395}. Best is trial 973 with value: 0.1397919550170376.
[I 2024-12-04 00:14:40,363] Trial 1004 finished with value: 0.18088664655306413 and parameters: {'kernel': 'rbf', 'C': 11.804289027226808, 'gamma': 0.015506060401521112, 'epsilon': 0.0011076394862752977}. Best is trial 973 with value: 0.1397919550170376.
[I 2024-12-04 00:14:40,399] Trial 1002 finished with value: 0.1492463927437486 and parameters: {'kernel': 'rbf', 'C': 40.51283356967187, 'gamma': 0.009547046745994384, 'epsilon': 0.0010064849903420967}. Best is trial 973 with value: 0.1397919550170376.
[I 2024-12-04 00:14:41,597] Trial 1003 finished with value: 0.16359863108651265 and parameters: {'kernel': 'rbf', 'C': 66.16738487375214, 'gamma': 0.005283718895033954, 'epsilon': 0.0010325683246258485}. Best is trial 973 with value: 0.1397919550170376.
[I 2024-12-04 00:14:41,720] Trial 1006 finished with value: 0.24684552934628423 and parameters: {'kernel': 'rbf', 'C': 88.60530261164773, 'gamma': 0.0009941846797664683, 'epsilon': 0.0017375383065107966}. Best is trial 973 with value: 0.1397919550170376.
[I 2024-12-04 00:14:42,250] Trial 1000 finished with value: 0.17346143750361828 and parameters: {'kernel': 'rbf', 'C': 89.68511429800469, 'gamma': 0.022703396239427943, 'epsilon': 0.0020897998734400137}. Best is trial 973 with value: 0.1397919550170376.
[I 2024-12-04 00:14:43,210] Trial 1008 finished with value: 0.8069558369763086 and parameters: {'kernel': 'poly', 'C': 0.019812648001830066, 'gamma': 0.02969994860108786, 'epsilon': 0.1946152959757067}. Best is trial 973 with value: 0.1397919550170376.
[I 2024-12-04 00:14:44,191] Trial 1009 finished with value: 0.8333356528175794 and parameters: {'kernel': 'poly', 'C': 5.932696534068759, 'gamma': 0.003425487284257329, 'epsilon': 0.10524642927351417}. Best is trial 973 with value: 0.1397919550170376.
[I 2024-12-04 00:14:44,852] Trial 1011 finished with value: 0.966097175870516 and parameters: {'kernel': 'poly', 'C': 1.1751426132652694, 'gamma': 0.0003733278045146075, 'epsilon': 0.006246329250711928}. Best is trial 973 with value: 0.1397919550170376.
[I 2024-12-04 00:14:45,055] Trial 1007 finished with value: 0.17419847230717897 and parameters: {'kernel': 'rbf', 'C': 91.01994373801526, 'gamma': 0.003577084886377648, 'epsilon': 0.0010909856053768802}. Best is trial 973 with value: 0.1397919550170376.
[I 2024-12-04 00:14:46,418] Trial 1005 finished with value: 0.16735772265366883 and parameters: {'kernel': 'rbf', 'C': 94.7229108372411, 'gamma': 0.01671705205120769, 'epsilon': 0.003939044271944916}. Best is trial 973 with value: 0.1397919550170376.
[I 2024-12-04 00:14:46,705] Trial 1013 finished with value: 0.9258129531538329 and parameters: {'kernel': 'sigmoid', 'C': 0.15976900337839872, 'gamma': 0.00014139162048806164, 'epsilon': 0.027038393739253513}. Best is trial 973 with value: 0.1397919550170376.
[I 2024-12-04 00:14:48,460] Trial 1010 finished with value: 0.14247602288605526 and parameters: {'kernel': 'rbf', 'C': 70.18321040907405, 'gamma': 0.009817287679724677, 'epsilon': 0.0011233495223273741}. Best is trial 973 with value: 0.1397919550170376.
[I 2024-12-04 00:14:49,773] Trial 1015 finished with value: 0.1505134762036828 and parameters: {'kernel': 'rbf', 'C': 19.040194275613896, 'gamma': 0.023892665933310662, 'epsilon': 0.0035312111124271134}. Best is trial 973 with value: 0.1397919550170376.
[I 2024-12-04 00:14:51,711] Trial 1018 finished with value: 0.25314818483856255 and parameters: {'kernel': 'rbf', 'C': 54.56734150866063, 'gamma': 0.0013724274662596134, 'epsilon': 0.0010328696408477204}. Best is trial 973 with value: 0.1397919550170376.
[I 2024-12-04 00:14:52,043] Trial 1017 finished with value: 0.15033707816473837 and parameters: {'kernel': 'rbf', 'C': 26.799769887896066, 'gamma': 0.021370782249217575, 'epsilon': 0.001107898242707861}. Best is trial 973 with value: 0.1397919550170376.
[I 2024-12-04 00:14:52,448] Trial 1014 finished with value: 0.14389071496296627 and parameters: {'kernel': 'rbf', 'C': 73.91700507436774, 'gamma': 0.010777613243410715, 'epsilon': 0.0011017908608259455}. Best is trial 973 with value: 0.1397919550170376.
[I 2024-12-04 00:14:55,003] Trial 1021 finished with value: 0.31570127782406077 and parameters: {'kernel': 'rbf', 'C': 1.0628691704141882, 'gamma': 0.018219084361094484, 'epsilon': 0.001319423472585371}. Best is trial 973 with value: 0.1397919550170376.
[I 2024-12-04 00:14:56,171] Trial 1012 finished with value: 0.19078208868534308 and parameters: {'kernel': 'rbf', 'C': 95.41315324047065, 'gamma': 0.03594909482518608, 'epsilon': 0.001082762640869126}. Best is trial 973 with value: 0.1397919550170376.
[I 2024-12-04 00:14:57,350] Trial 1016 finished with value: 0.17852149752462865 and parameters: {'kernel': 'rbf', 'C': 89.00130790334993, 'gamma': 0.025993932001755343, 'epsilon': 0.001068176682951879}. Best is trial 973 with value: 0.1397919550170376.
[I 2024-12-04 00:14:57,412] Trial 1022 finished with value: 0.2561977446588585 and parameters: {'kernel': 'rbf', 'C': 97.62727440780843, 'gamma': 0.0007766883728507883, 'epsilon': 0.0010408256427586115}. Best is trial 973 with value: 0.1397919550170376.
[I 2024-12-04 00:14:57,482] Trial 1019 finished with value: 0.1473574901429996 and parameters: {'kernel': 'rbf', 'C': 74.58959158178382, 'gamma': 0.012321737612199372, 'epsilon': 0.0010072274008807794}. Best is trial 973 with value: 0.1397919550170376.
[I 2024-12-04 00:14:58,959] Trial 1024 finished with value: 0.9949639745811866 and parameters: {'kernel': 'sigmoid', 'C': 0.002505853603426917, 'gamma': 0.0004133909356960696, 'epsilon': 0.0011070501183818478}. Best is trial 973 with value: 0.1397919550170376.
[I 2024-12-04 00:14:59,122] Trial 1020 finished with value: 0.13985919257378046 and parameters: {'kernel': 'rbf', 'C': 96.9512357411251, 'gamma': 0.008040251822634984, 'epsilon': 0.0010226514511843439}. Best is trial 973 with value: 0.1397919550170376.
[I 2024-12-04 00:15:00,504] Trial 1026 finished with value: 0.8177067011812663 and parameters: {'kernel': 'poly', 'C': 11.577030630660927, 'gamma': 0.0031941141504105044, 'epsilon': 0.002665516886473238}. Best is trial 973 with value: 0.1397919550170376.
[I 2024-12-04 00:15:00,551] Trial 1027 finished with value: 52.08190486808971 and parameters: {'kernel': 'sigmoid', 'C': 91.54778762264942, 'gamma': 0.0011297892744011123, 'epsilon': 0.003301002783876882}. Best is trial 973 with value: 0.1397919550170376.
[I 2024-12-04 00:15:01,746] Trial 1029 finished with value: 13.046648806611017 and parameters: {'kernel': 'sigmoid', 'C': 0.6689363685866915, 'gamma': 0.021929368234815137, 'epsilon': 0.11787098268238091}. Best is trial 973 with value: 0.1397919550170376.
[I 2024-12-04 00:15:01,933] Trial 1025 finished with value: 0.16068834865883874 and parameters: {'kernel': 'rbf', 'C': 27.681146067093895, 'gamma': 0.010523328291179348, 'epsilon': 0.002825986616588289}. Best is trial 973 with value: 0.1397919550170376.
