[I 2024-12-04 12:08:53,310] Trial 1088 finished with value: 0.3107425281026167 and parameters: {'n_estimators': 426, 'max_depth': 42, 'min_samples_split': 4, 'min_samples_leaf': 1, 'max_features': 'sqrt', 'bootstrap': False, 'criterion': 'squared_error'}. Best is trial 341 with value: 0.2909369124469028.
[I 2024-12-04 12:08:53,314] Trial 1065 finished with value: 0.46774700267548974 and parameters: {'n_estimators': 521, 'max_depth': 36, 'min_samples_split': 2, 'min_samples_leaf': 2, 'max_features': 'sqrt', 'bootstrap': False, 'criterion': 'absolute_error'}. Best is trial 341 with value: 0.2909369124469028.
[I 2024-12-04 12:08:53,376] Trial 1089 finished with value: 0.3054232011290347 and parameters: {'n_estimators': 250, 'max_depth': 43, 'min_samples_split': 2, 'min_samples_leaf': 1, 'max_features': 'sqrt', 'bootstrap': False, 'criterion': 'squared_error'}. Best is trial 341 with value: 0.2909369124469028.
[I 2024-12-04 12:08:53,821] Trial 1092 finished with value: 0.2996586947894698 and parameters: {'n_estimators': 306, 'max_depth': 50, 'min_samples_split': 4, 'min_samples_leaf': 1, 'max_features': 'sqrt', 'bootstrap': False, 'criterion': 'squared_error'}. Best is trial 341 with value: 0.2909369124469028.
[I 2024-12-04 12:08:54,063] Trial 1093 finished with value: 0.45348701335734276 and parameters: {'n_estimators': 123, 'max_depth': 38, 'min_samples_split': 3, 'min_samples_leaf': 2, 'max_features': 'sqrt', 'bootstrap': False, 'criterion': 'squared_error'}. Best is trial 341 with value: 0.2909369124469028.
[I 2024-12-04 12:08:54,376] Trial 1070 finished with value: 0.8064738743075454 and parameters: {'n_estimators': 923, 'max_depth': 9, 'min_samples_split': 2, 'min_samples_leaf': 1, 'max_features': 'log2', 'bootstrap': False, 'criterion': 'absolute_error'}. Best is trial 341 with value: 0.2909369124469028.
[I 2024-12-04 12:08:54,901] Trial 1094 finished with value: 0.3104296863753401 and parameters: {'n_estimators': 104, 'max_depth': 44, 'min_samples_split': 5, 'min_samples_leaf': 1, 'max_features': 'sqrt', 'bootstrap': False, 'criterion': 'squared_error'}. Best is trial 341 with value: 0.2909369124469028.
[I 2024-12-04 12:08:55,066] Trial 1081 finished with value: 0.29193970469366737 and parameters: {'n_estimators': 536, 'max_depth': 49, 'min_samples_split': 3, 'min_samples_leaf': 1, 'max_features': 'sqrt', 'bootstrap': False, 'criterion': 'squared_error'}. Best is trial 341 with value: 0.2909369124469028.
[I 2024-12-04 12:08:55,067] Trial 1095 finished with value: 0.294378688997004 and parameters: {'n_estimators': 199, 'max_depth': 50, 'min_samples_split': 3, 'min_samples_leaf': 1, 'max_features': 'sqrt', 'bootstrap': False, 'criterion': 'squared_error'}. Best is trial 341 with value: 0.2909369124469028.
[I 2024-12-04 12:08:55,974] Trial 1090 finished with value: 0.8508693614658039 and parameters: {'n_estimators': 625, 'max_depth': 21, 'min_samples_split': 2, 'min_samples_leaf': 4, 'max_features': 'log2', 'bootstrap': False, 'criterion': 'squared_error'}. Best is trial 341 with value: 0.2909369124469028.
[I 2024-12-04 12:08:56,697] Trial 1098 finished with value: 0.29261985948526215 and parameters: {'n_estimators': 160, 'max_depth': 50, 'min_samples_split': 3, 'min_samples_leaf': 1, 'max_features': 'sqrt', 'bootstrap': False, 'criterion': 'squared_error'}. Best is trial 341 with value: 0.2909369124469028.
[I 2024-12-04 12:08:57,169] Trial 1091 finished with value: 0.45086099692808396 and parameters: {'n_estimators': 206, 'max_depth': 41, 'min_samples_split': 12, 'min_samples_leaf': 2, 'max_features': 'sqrt', 'bootstrap': False, 'criterion': 'squared_error'}. Best is trial 341 with value: 0.2909369124469028.
[I 2024-12-04 12:08:57,457] Trial 1084 finished with value: 0.4486809694104095 and parameters: {'n_estimators': 596, 'max_depth': 6, 'min_samples_split': 3, 'min_samples_leaf': 1, 'max_features': None, 'bootstrap': True, 'criterion': 'squared_error'}. Best is trial 341 with value: 0.2909369124469028.
[I 2024-12-04 12:08:57,851] Trial 1085 finished with value: 0.41627304581148855 and parameters: {'n_estimators': 577, 'max_depth': 41, 'min_samples_split': 3, 'min_samples_leaf': 2, 'max_features': None, 'bootstrap': False, 'criterion': 'squared_error'}. Best is trial 341 with value: 0.2909369124469028.
[I 2024-12-04 12:08:59,853] Trial 1087 finished with value: 0.3284044848147407 and parameters: {'n_estimators': 311, 'max_depth': 43, 'min_samples_split': 5, 'min_samples_leaf': 1, 'max_features': 'sqrt', 'bootstrap': False, 'criterion': 'absolute_error'}. Best is trial 341 with value: 0.2909369124469028.
[I 2024-12-04 12:09:00,398] Trial 1102 finished with value: 0.44320106023275013 and parameters: {'n_estimators': 211, 'max_depth': 50, 'min_samples_split': 2, 'min_samples_leaf': 2, 'max_features': 'sqrt', 'bootstrap': False, 'criterion': 'squared_error'}. Best is trial 341 with value: 0.2909369124469028.
[I 2024-12-04 12:09:01,711] Trial 1099 finished with value: 0.3023880561305158 and parameters: {'n_estimators': 251, 'max_depth': 42, 'min_samples_split': 3, 'min_samples_leaf': 1, 'max_features': 'sqrt', 'bootstrap': False, 'criterion': 'squared_error'}. Best is trial 341 with value: 0.2909369124469028.
[I 2024-12-04 12:09:01,854] Trial 1104 finished with value: 0.4427389975623686 and parameters: {'n_estimators': 612, 'max_depth': 43, 'min_samples_split': 3, 'min_samples_leaf': 2, 'max_features': 'sqrt', 'bootstrap': False, 'criterion': 'squared_error'}. Best is trial 341 with value: 0.2909369124469028.
[I 2024-12-04 12:09:02,462] Trial 1101 finished with value: 0.3063120698347225 and parameters: {'n_estimators': 465, 'max_depth': 43, 'min_samples_split': 4, 'min_samples_leaf': 1, 'max_features': 'sqrt', 'bootstrap': False, 'criterion': 'squared_error'}. Best is trial 341 with value: 0.2909369124469028.
[I 2024-12-04 12:09:03,699] Trial 999 finished with value: 0.35483002062264624 and parameters: {'n_estimators': 839, 'max_depth': 45, 'min_samples_split': 2, 'min_samples_leaf': 2, 'max_features': None, 'bootstrap': True, 'criterion': 'absolute_error'}. Best is trial 341 with value: 0.2909369124469028.
[I 2024-12-04 12:09:04,070] Trial 1105 finished with value: 0.2992076746757976 and parameters: {'n_estimators': 103, 'max_depth': 50, 'min_samples_split': 2, 'min_samples_leaf': 1, 'max_features': 'sqrt', 'bootstrap': False, 'criterion': 'squared_error'}. Best is trial 341 with value: 0.2909369124469028.
[I 2024-12-04 12:09:05,956] Trial 1107 finished with value: 0.9696152501356977 and parameters: {'n_estimators': 203, 'max_depth': 17, 'min_samples_split': 27, 'min_samples_leaf': 13, 'max_features': 'log2', 'bootstrap': True, 'criterion': 'absolute_error'}. Best is trial 341 with value: 0.2909369124469028.
[I 2024-12-04 12:09:07,914] Trial 1100 finished with value: 0.3015997522226039 and parameters: {'n_estimators': 581, 'max_depth': 43, 'min_samples_split': 3, 'min_samples_leaf': 1, 'max_features': 'sqrt', 'bootstrap': False, 'criterion': 'squared_error'}. Best is trial 341 with value: 0.2909369124469028.
[I 2024-12-04 12:09:08,343] Trial 1096 finished with value: 0.44171316155925144 and parameters: {'n_estimators': 680, 'max_depth': 50, 'min_samples_split': 3, 'min_samples_leaf': 2, 'max_features': 'sqrt', 'bootstrap': False, 'criterion': 'squared_error'}. Best is trial 341 with value: 0.2909369124469028.
[I 2024-12-04 12:09:09,180] Trial 1108 finished with value: 0.4128206591167652 and parameters: {'n_estimators': 667, 'max_depth': 46, 'min_samples_split': 6, 'min_samples_leaf': 1, 'max_features': 'log2', 'bootstrap': False, 'criterion': 'squared_error'}. Best is trial 341 with value: 0.2909369124469028.
[I 2024-12-04 12:09:09,575] Trial 1110 finished with value: 0.31045010479948987 and parameters: {'n_estimators': 549, 'max_depth': 48, 'min_samples_split': 6, 'min_samples_leaf': 1, 'max_features': 'sqrt', 'bootstrap': False, 'criterion': 'squared_error'}. Best is trial 341 with value: 0.2909369124469028.
[I 2024-12-04 12:09:10,121] Trial 1057 finished with value: 0.43362053696671404 and parameters: {'n_estimators': 583, 'max_depth': 22, 'min_samples_split': 49, 'min_samples_leaf': 3, 'max_features': None, 'bootstrap': True, 'criterion': 'absolute_error'}. Best is trial 341 with value: 0.2909369124469028.
[I 2024-12-04 12:09:10,648] Trial 1097 finished with value: 0.29217498739050096 and parameters: {'n_estimators': 571, 'max_depth': 49, 'min_samples_split': 3, 'min_samples_leaf': 1, 'max_features': 'sqrt', 'bootstrap': False, 'criterion': 'squared_error'}. Best is trial 341 with value: 0.2909369124469028.
[I 2024-12-04 12:09:10,743] Trial 1109 finished with value: 0.31042598743608557 and parameters: {'n_estimators': 561, 'max_depth': 39, 'min_samples_split': 3, 'min_samples_leaf': 1, 'max_features': 'sqrt', 'bootstrap': False, 'criterion': 'squared_error'}. Best is trial 341 with value: 0.2909369124469028.
[I 2024-12-04 12:09:11,947] Trial 1113 finished with value: 0.8199523378706641 and parameters: {'n_estimators': 546, 'max_depth': 48, 'min_samples_split': 41, 'min_samples_leaf': 11, 'max_features': 'sqrt', 'bootstrap': False, 'criterion': 'absolute_error'}. Best is trial 341 with value: 0.2909369124469028.
[I 2024-12-04 12:09:12,110] Trial 1112 finished with value: 0.30633966925339545 and parameters: {'n_estimators': 438, 'max_depth': 49, 'min_samples_split': 5, 'min_samples_leaf': 1, 'max_features': 'sqrt', 'bootstrap': False, 'criterion': 'squared_error'}. Best is trial 341 with value: 0.2909369124469028.
[I 2024-12-04 12:09:13,588] Trial 1111 finished with value: 0.30170841014165 and parameters: {'n_estimators': 542, 'max_depth': 46, 'min_samples_split': 2, 'min_samples_leaf': 1, 'max_features': 'sqrt', 'bootstrap': False, 'criterion': 'squared_error'}. Best is trial 341 with value: 0.2909369124469028.
[I 2024-12-04 12:09:18,487] Trial 1122 finished with value: 0.2999847463078806 and parameters: {'n_estimators': 467, 'max_depth': 50, 'min_samples_split': 4, 'min_samples_leaf': 1, 'max_features': 'sqrt', 'bootstrap': False, 'criterion': 'squared_error'}. Best is trial 341 with value: 0.2909369124469028.
[I 2024-12-04 12:09:20,881] Trial 1115 finished with value: 0.2938146028147951 and parameters: {'n_estimators': 488, 'max_depth': 50, 'min_samples_split': 3, 'min_samples_leaf': 1, 'max_features': 'sqrt', 'bootstrap': False, 'criterion': 'squared_error'}. Best is trial 341 with value: 0.2909369124469028.
[I 2024-12-04 12:09:21,076] Trial 1103 finished with value: 0.43042979140048415 and parameters: {'n_estimators': 250, 'max_depth': 8, 'min_samples_split': 6, 'min_samples_leaf': 3, 'max_features': None, 'bootstrap': True, 'criterion': 'absolute_error'}. Best is trial 341 with value: 0.2909369124469028.
[I 2024-12-04 12:09:21,913] Trial 1118 finished with value: 0.29634712819995945 and parameters: {'n_estimators': 540, 'max_depth': 48, 'min_samples_split': 2, 'min_samples_leaf': 1, 'max_features': 'sqrt', 'bootstrap': False, 'criterion': 'squared_error'}. Best is trial 341 with value: 0.2909369124469028.
[I 2024-12-04 12:09:21,918] Trial 1123 finished with value: 0.30519053202583235 and parameters: {'n_estimators': 490, 'max_depth': 44, 'min_samples_split': 2, 'min_samples_leaf': 1, 'max_features': 'sqrt', 'bootstrap': False, 'criterion': 'squared_error'}. Best is trial 341 with value: 0.2909369124469028.
[I 2024-12-04 12:09:24,694] Trial 1120 finished with value: 0.44131746342504197 and parameters: {'n_estimators': 620, 'max_depth': 45, 'min_samples_split': 4, 'min_samples_leaf': 2, 'max_features': 'sqrt', 'bootstrap': False, 'criterion': 'squared_error'}. Best is trial 341 with value: 0.2909369124469028.
[I 2024-12-04 12:09:24,856] Trial 1116 finished with value: 0.47352484021677493 and parameters: {'n_estimators': 528, 'max_depth': 8, 'min_samples_split': 11, 'min_samples_leaf': 5, 'max_features': None, 'bootstrap': False, 'criterion': 'squared_error'}. Best is trial 341 with value: 0.2909369124469028.
[I 2024-12-04 12:09:25,891] Trial 1117 finished with value: 0.29512470629961146 and parameters: {'n_estimators': 673, 'max_depth': 47, 'min_samples_split': 3, 'min_samples_leaf': 1, 'max_features': 'sqrt', 'bootstrap': False, 'criterion': 'squared_error'}. Best is trial 341 with value: 0.2909369124469028.
[I 2024-12-04 12:09:27,562] Trial 1125 finished with value: 0.29432906102258927 and parameters: {'n_estimators': 686, 'max_depth': 50, 'min_samples_split': 3, 'min_samples_leaf': 1, 'max_features': 'sqrt', 'bootstrap': False, 'criterion': 'squared_error'}. Best is trial 341 with value: 0.2909369124469028.
[I 2024-12-04 12:09:27,859] Trial 1121 finished with value: 0.4609550414494845 and parameters: {'n_estimators': 664, 'max_depth': 36, 'min_samples_split': 2, 'min_samples_leaf': 1, 'max_features': 'log2', 'bootstrap': False, 'criterion': 'squared_error'}. Best is trial 341 with value: 0.2909369124469028.
[I 2024-12-04 12:09:28,579] Trial 1119 finished with value: 0.29660570102242395 and parameters: {'n_estimators': 627, 'max_depth': 49, 'min_samples_split': 2, 'min_samples_leaf': 1, 'max_features': 'sqrt', 'bootstrap': False, 'criterion': 'squared_error'}. Best is trial 341 with value: 0.2909369124469028.
[I 2024-12-04 12:09:28,603] Trial 1114 finished with value: 0.45660332969444484 and parameters: {'n_estimators': 499, 'max_depth': 49, 'min_samples_split': 2, 'min_samples_leaf': 2, 'max_features': 'sqrt', 'bootstrap': False, 'criterion': 'absolute_error'}. Best is trial 341 with value: 0.2909369124469028.
[I 2024-12-04 12:09:28,643] Trial 1051 finished with value: 0.3727897085896191 and parameters: {'n_estimators': 689, 'max_depth': 19, 'min_samples_split': 10, 'min_samples_leaf': 2, 'max_features': None, 'bootstrap': True, 'criterion': 'absolute_error'}. Best is trial 341 with value: 0.2909369124469028.
[I 2024-12-04 12:09:29,951] Trial 1134 finished with value: 0.44165182706258177 and parameters: {'n_estimators': 570, 'max_depth': 48, 'min_samples_split': 3, 'min_samples_leaf': 2, 'max_features': 'sqrt', 'bootstrap': False, 'criterion': 'squared_error'}. Best is trial 341 with value: 0.2909369124469028.
[I 2024-12-04 12:09:30,325] Trial 1127 finished with value: 0.31977469586458174 and parameters: {'n_estimators': 798, 'max_depth': 50, 'min_samples_split': 9, 'min_samples_leaf': 1, 'max_features': 'sqrt', 'bootstrap': False, 'criterion': 'squared_error'}. Best is trial 341 with value: 0.2909369124469028.
[I 2024-12-04 12:09:30,748] Trial 1130 finished with value: 0.4420551889931903 and parameters: {'n_estimators': 557, 'max_depth': 47, 'min_samples_split': 9, 'min_samples_leaf': 2, 'max_features': 'sqrt', 'bootstrap': False, 'criterion': 'squared_error'}. Best is trial 341 with value: 0.2909369124469028.
[I 2024-12-04 12:09:31,023] Trial 1124 finished with value: 0.5381670158297749 and parameters: {'n_estimators': 821, 'max_depth': 23, 'min_samples_split': 31, 'min_samples_leaf': 3, 'max_features': 'sqrt', 'bootstrap': False, 'criterion': 'squared_error'}. Best is trial 341 with value: 0.2909369124469028.
[I 2024-12-04 12:09:31,433] Trial 1129 finished with value: 0.44270881051913585 and parameters: {'n_estimators': 517, 'max_depth': 44, 'min_samples_split': 4, 'min_samples_leaf': 2, 'max_features': 'sqrt', 'bootstrap': False, 'criterion': 'squared_error'}. Best is trial 341 with value: 0.2909369124469028.
[I 2024-12-04 12:09:32,097] Trial 1128 finished with value: 0.29203029014174225 and parameters: {'n_estimators': 540, 'max_depth': 49, 'min_samples_split': 3, 'min_samples_leaf': 1, 'max_features': 'sqrt', 'bootstrap': False, 'criterion': 'squared_error'}. Best is trial 341 with value: 0.2909369124469028.
[I 2024-12-04 12:09:32,874] Trial 1126 finished with value: 0.30742560202822833 and parameters: {'n_estimators': 681, 'max_depth': 45, 'min_samples_split': 4, 'min_samples_leaf': 1, 'max_features': 'sqrt', 'bootstrap': False, 'criterion': 'squared_error'}. Best is trial 341 with value: 0.2909369124469028.
[I 2024-12-04 12:09:32,957] Trial 1132 finished with value: 0.29831363218303314 and parameters: {'n_estimators': 556, 'max_depth': 50, 'min_samples_split': 2, 'min_samples_leaf': 1, 'max_features': 'sqrt', 'bootstrap': False, 'criterion': 'squared_error'}. Best is trial 341 with value: 0.2909369124469028.
[I 2024-12-04 12:09:33,023] Trial 1133 finished with value: 0.4535341510107001 and parameters: {'n_estimators': 893, 'max_depth': 35, 'min_samples_split': 5, 'min_samples_leaf': 2, 'max_features': 'sqrt', 'bootstrap': False, 'criterion': 'squared_error'}. Best is trial 341 with value: 0.2909369124469028.
[I 2024-12-04 12:09:35,383] Trial 1131 finished with value: 0.6976596600167138 and parameters: {'n_estimators': 503, 'max_depth': 48, 'min_samples_split': 2, 'min_samples_leaf': 2, 'max_features': 'log2', 'bootstrap': False, 'criterion': 'squared_error'}. Best is trial 341 with value: 0.2909369124469028.
[I 2024-12-04 12:09:35,422] Trial 1135 finished with value: 0.29872976991920946 and parameters: {'n_estimators': 592, 'max_depth': 50, 'min_samples_split': 2, 'min_samples_leaf': 1, 'max_features': 'sqrt', 'bootstrap': False, 'criterion': 'squared_error'}. Best is trial 341 with value: 0.2909369124469028.
[I 2024-12-04 12:09:35,532] Trial 1137 finished with value: 0.30265872526240795 and parameters: {'n_estimators': 528, 'max_depth': 47, 'min_samples_split': 4, 'min_samples_leaf': 1, 'max_features': 'sqrt', 'bootstrap': False, 'criterion': 'squared_error'}. Best is trial 341 with value: 0.2909369124469028.
[I 2024-12-04 12:09:36,603] Trial 1138 finished with value: 0.9722794631188516 and parameters: {'n_estimators': 808, 'max_depth': 32, 'min_samples_split': 25, 'min_samples_leaf': 15, 'max_features': 'log2', 'bootstrap': True, 'criterion': 'absolute_error'}. Best is trial 341 with value: 0.2909369124469028.
[I 2024-12-04 12:09:36,677] Trial 1136 finished with value: 0.29398154445365043 and parameters: {'n_estimators': 666, 'max_depth': 50, 'min_samples_split': 3, 'min_samples_leaf': 1, 'max_features': 'sqrt', 'bootstrap': False, 'criterion': 'squared_error'}. Best is trial 341 with value: 0.2909369124469028.
[I 2024-12-04 12:09:37,704] Trial 1141 finished with value: 0.2982471084134603 and parameters: {'n_estimators': 394, 'max_depth': 50, 'min_samples_split': 2, 'min_samples_leaf': 1, 'max_features': 'sqrt', 'bootstrap': False, 'criterion': 'squared_error'}. Best is trial 341 with value: 0.2909369124469028.
[I 2024-12-04 12:09:41,363] Trial 1139 finished with value: 0.5039110142495662 and parameters: {'n_estimators': 928, 'max_depth': 6, 'min_samples_split': 4, 'min_samples_leaf': 1, 'max_features': None, 'bootstrap': False, 'criterion': 'squared_error'}. Best is trial 341 with value: 0.2909369124469028.
[I 2024-12-04 12:09:41,512] Trial 1143 finished with value: 0.40170990408348184 and parameters: {'n_estimators': 124, 'max_depth': 47, 'min_samples_split': 2, 'min_samples_leaf': 1, 'max_features': 'log2', 'bootstrap': True, 'criterion': 'squared_error'}. Best is trial 341 with value: 0.2909369124469028.
[I 2024-12-04 12:09:43,697] Trial 1147 finished with value: 0.31139302483751624 and parameters: {'n_estimators': 590, 'max_depth': 49, 'min_samples_split': 6, 'min_samples_leaf': 1, 'max_features': 'sqrt', 'bootstrap': False, 'criterion': 'squared_error'}. Best is trial 341 with value: 0.2909369124469028.
[I 2024-12-04 12:09:44,577] Trial 1146 finished with value: 0.29415001337918956 and parameters: {'n_estimators': 601, 'max_depth': 50, 'min_samples_split': 3, 'min_samples_leaf': 1, 'max_features': 'sqrt', 'bootstrap': False, 'criterion': 'squared_error'}. Best is trial 341 with value: 0.2909369124469028.
[I 2024-12-04 12:09:45,452] Trial 1142 finished with value: 0.3136078068644597 and parameters: {'n_estimators': 630, 'max_depth': 41, 'min_samples_split': 4, 'min_samples_leaf': 1, 'max_features': 'sqrt', 'bootstrap': False, 'criterion': 'squared_error'}. Best is trial 341 with value: 0.2909369124469028.
[I 2024-12-04 12:09:49,217] Trial 1157 finished with value: 0.30032111851086213 and parameters: {'n_estimators': 470, 'max_depth': 48, 'min_samples_split': 4, 'min_samples_leaf': 1, 'max_features': 'sqrt', 'bootstrap': False, 'criterion': 'squared_error'}. Best is trial 341 with value: 0.2909369124469028.
[I 2024-12-04 12:09:50,003] Trial 1150 finished with value: 0.30235566055643387 and parameters: {'n_estimators': 722, 'max_depth': 43, 'min_samples_split': 3, 'min_samples_leaf': 1, 'max_features': 'sqrt', 'bootstrap': False, 'criterion': 'squared_error'}. Best is trial 341 with value: 0.2909369124469028.
[I 2024-12-04 12:09:50,233] Trial 1144 finished with value: 0.4220309937266704 and parameters: {'n_estimators': 764, 'max_depth': 42, 'min_samples_split': 2, 'min_samples_leaf': 5, 'max_features': None, 'bootstrap': True, 'criterion': 'squared_error'}. Best is trial 341 with value: 0.2909369124469028.
[I 2024-12-04 12:09:52,685] Trial 1149 finished with value: 0.30047278123879967 and parameters: {'n_estimators': 663, 'max_depth': 49, 'min_samples_split': 4, 'min_samples_leaf': 1, 'max_features': 'sqrt', 'bootstrap': False, 'criterion': 'squared_error'}. Best is trial 341 with value: 0.2909369124469028.
[I 2024-12-04 12:09:52,686] Trial 1145 finished with value: 0.3758879688919952 and parameters: {'n_estimators': 605, 'max_depth': 30, 'min_samples_split': 9, 'min_samples_leaf': 3, 'max_features': None, 'bootstrap': True, 'criterion': 'squared_error'}. Best is trial 341 with value: 0.2909369124469028.
[I 2024-12-04 12:09:53,559] Trial 1151 finished with value: 0.3033377441937324 and parameters: {'n_estimators': 519, 'max_depth': 45, 'min_samples_split': 2, 'min_samples_leaf': 1, 'max_features': 'sqrt', 'bootstrap': False, 'criterion': 'squared_error'}. Best is trial 341 with value: 0.2909369124469028.
