[I 2024-12-04 13:41:00,272] Trial 2192 finished with value: 0.250312467857684 and parameters: {'n_estimators': 1237, 'learning_rate': 0.09421657678471784, 'max_depth': 5, 'min_samples_split': 5, 'min_samples_leaf': 1, 'subsample': 0.7192617548599508, 'max_features': 'sqrt'}. Best is trial 1389 with value: 0.22332552856343169.
[I 2024-12-04 13:41:01,903] Trial 2185 finished with value: 0.24323705956397618 and parameters: {'n_estimators': 1499, 'learning_rate': 0.05883611748372479, 'max_depth': 6, 'min_samples_split': 6, 'min_samples_leaf': 1, 'subsample': 0.7299671234401491, 'max_features': 'sqrt'}. Best is trial 1389 with value: 0.22332552856343169.
[I 2024-12-04 13:41:04,407] Trial 2215 finished with value: 0.3466633844654474 and parameters: {'n_estimators': 464, 'learning_rate': 0.07835825975109877, 'max_depth': 7, 'min_samples_split': 2, 'min_samples_leaf': 1, 'subsample': 0.987641319584649, 'max_features': None}. Best is trial 1389 with value: 0.22332552856343169.
[I 2024-12-04 13:41:06,951] Trial 2216 finished with value: 0.27297248194915663 and parameters: {'n_estimators': 516, 'learning_rate': 0.09152114578660135, 'max_depth': 8, 'min_samples_split': 4, 'min_samples_leaf': 1, 'subsample': 0.9633561211855223, 'max_features': 'sqrt'}. Best is trial 1389 with value: 0.22332552856343169.
[I 2024-12-04 13:41:06,968] Trial 2212 finished with value: 0.5023162972675342 and parameters: {'n_estimators': 602, 'learning_rate': 0.04694519977576558, 'max_depth': 5, 'min_samples_split': 20, 'min_samples_leaf': 9, 'subsample': 0.7094265089353661, 'max_features': 'sqrt'}. Best is trial 1389 with value: 0.22332552856343169.
[I 2024-12-04 13:41:07,611] Trial 2194 finished with value: 0.23691390663614684 and parameters: {'n_estimators': 1394, 'learning_rate': 0.05785010568610672, 'max_depth': 9, 'min_samples_split': 7, 'min_samples_leaf': 1, 'subsample': 0.6013303064723602, 'max_features': 'sqrt'}. Best is trial 1389 with value: 0.22332552856343169.
[I 2024-12-04 13:41:08,120] Trial 2206 finished with value: 0.920005978206868 and parameters: {'n_estimators': 919, 'learning_rate': 0.017765882116500962, 'max_depth': 3, 'min_samples_split': 4, 'min_samples_leaf': 8, 'subsample': 0.764353362462496, 'max_features': 'log2'}. Best is trial 1389 with value: 0.22332552856343169.
[I 2024-12-04 13:41:08,992] Trial 2200 finished with value: 0.3145323000581567 and parameters: {'n_estimators': 1162, 'learning_rate': 0.08051001676265648, 'max_depth': 12, 'min_samples_split': 8, 'min_samples_leaf': 2, 'subsample': 0.8032934234737382, 'max_features': 'sqrt'}. Best is trial 1389 with value: 0.22332552856343169.
[I 2024-12-04 13:41:15,285] Trial 2222 finished with value: 0.4992039069039835 and parameters: {'n_estimators': 319, 'learning_rate': 0.013897269619298271, 'max_depth': 5, 'min_samples_split': 3, 'min_samples_leaf': 10, 'subsample': 0.950649173074887, 'max_features': None}. Best is trial 1389 with value: 0.22332552856343169.
[I 2024-12-04 13:41:15,534] Trial 2199 finished with value: 0.26668995930984674 and parameters: {'n_estimators': 1226, 'learning_rate': 0.07396246630009669, 'max_depth': 9, 'min_samples_split': 7, 'min_samples_leaf': 1, 'subsample': 0.8722790981604674, 'max_features': 'sqrt'}. Best is trial 1389 with value: 0.22332552856343169.
[I 2024-12-04 13:41:20,812] Trial 2203 finished with value: 0.26087720952005383 and parameters: {'n_estimators': 1203, 'learning_rate': 0.06571923589337751, 'max_depth': 8, 'min_samples_split': 6, 'min_samples_leaf': 1, 'subsample': 0.8968949885110546, 'max_features': 'sqrt'}. Best is trial 1389 with value: 0.22332552856343169.
[I 2024-12-04 13:41:20,822] Trial 2197 finished with value: 0.25936720110589395 and parameters: {'n_estimators': 1270, 'learning_rate': 0.06239399465242842, 'max_depth': 10, 'min_samples_split': 7, 'min_samples_leaf': 1, 'subsample': 0.8243348995945864, 'max_features': 'sqrt'}. Best is trial 1389 with value: 0.22332552856343169.
[I 2024-12-04 13:41:26,609] Trial 2225 finished with value: 0.6358318280686258 and parameters: {'n_estimators': 493, 'learning_rate': 0.02643588055360684, 'max_depth': 7, 'min_samples_split': 10, 'min_samples_leaf': 9, 'subsample': 0.6859170137205399, 'max_features': 'sqrt'}. Best is trial 1389 with value: 0.22332552856343169.
[I 2024-12-04 13:41:27,282] Trial 2202 finished with value: 0.247417469274243 and parameters: {'n_estimators': 1321, 'learning_rate': 0.06089564181404825, 'max_depth': 12, 'min_samples_split': 4, 'min_samples_leaf': 1, 'subsample': 0.6786922728019169, 'max_features': 'sqrt'}. Best is trial 1389 with value: 0.22332552856343169.
[I 2024-12-04 13:41:29,874] Trial 2201 finished with value: 0.25706136122277484 and parameters: {'n_estimators': 1430, 'learning_rate': 0.06807684723870082, 'max_depth': 12, 'min_samples_split': 8, 'min_samples_leaf': 1, 'subsample': 0.7254813185732976, 'max_features': 'sqrt'}. Best is trial 1389 with value: 0.22332552856343169.
[I 2024-12-04 13:41:31,879] Trial 2208 finished with value: 0.24216469430899887 and parameters: {'n_estimators': 1162, 'learning_rate': 0.07856913669027629, 'max_depth': 7, 'min_samples_split': 5, 'min_samples_leaf': 1, 'subsample': 0.8258045316191368, 'max_features': 'sqrt'}. Best is trial 1389 with value: 0.22332552856343169.
[I 2024-12-04 13:41:39,645] Trial 2214 finished with value: 0.28318284866668164 and parameters: {'n_estimators': 1096, 'learning_rate': 0.09221708530013538, 'max_depth': 7, 'min_samples_split': 2, 'min_samples_leaf': 2, 'subsample': 0.8941128683325412, 'max_features': 'sqrt'}. Best is trial 1389 with value: 0.22332552856343169.
[I 2024-12-04 13:41:39,802] Trial 2204 finished with value: 0.2683561890058988 and parameters: {'n_estimators': 1497, 'learning_rate': 0.08766813871635427, 'max_depth': 5, 'min_samples_split': 5, 'min_samples_leaf': 1, 'subsample': 0.8100613470733238, 'max_features': 'sqrt'}. Best is trial 1389 with value: 0.22332552856343169.
[I 2024-12-04 13:41:42,661] Trial 2211 finished with value: 0.5565913288351768 and parameters: {'n_estimators': 1261, 'learning_rate': 0.03490568022773749, 'max_depth': 4, 'min_samples_split': 16, 'min_samples_leaf': 6, 'subsample': 0.7375517420916432, 'max_features': 'log2'}. Best is trial 1389 with value: 0.22332552856343169.
[I 2024-12-04 13:41:46,247] Trial 2218 finished with value: 0.25452886131584235 and parameters: {'n_estimators': 1053, 'learning_rate': 0.06681140006654486, 'max_depth': 6, 'min_samples_split': 6, 'min_samples_leaf': 1, 'subsample': 0.894862168379841, 'max_features': 'sqrt'}. Best is trial 1389 with value: 0.22332552856343169.
[I 2024-12-04 13:41:48,431] Trial 2210 finished with value: 0.292604270037392 and parameters: {'n_estimators': 1382, 'learning_rate': 0.06530522450446556, 'max_depth': 6, 'min_samples_split': 9, 'min_samples_leaf': 2, 'subsample': 0.7501496978820599, 'max_features': 'log2'}. Best is trial 1389 with value: 0.22332552856343169.
[I 2024-12-04 13:41:51,993] Trial 2213 finished with value: 0.3511384222095316 and parameters: {'n_estimators': 1319, 'learning_rate': 0.0732079127004941, 'max_depth': 5, 'min_samples_split': 5, 'min_samples_leaf': 3, 'subsample': 0.7134535611539257, 'max_features': 'sqrt'}. Best is trial 1389 with value: 0.22332552856343169.
[I 2024-12-04 13:41:52,998] Trial 2228 finished with value: 0.2626884965609251 and parameters: {'n_estimators': 746, 'learning_rate': 0.07352295620374207, 'max_depth': 7, 'min_samples_split': 8, 'min_samples_leaf': 1, 'subsample': 0.8759070897716279, 'max_features': 'sqrt'}. Best is trial 1389 with value: 0.22332552856343169.
[I 2024-12-04 13:41:53,354] Trial 2224 finished with value: 0.35489784405267993 and parameters: {'n_estimators': 883, 'learning_rate': 0.07236666842510073, 'max_depth': 11, 'min_samples_split': 2, 'min_samples_leaf': 3, 'subsample': 0.7265442015685967, 'max_features': 'sqrt'}. Best is trial 1389 with value: 0.22332552856343169.
[I 2024-12-04 13:41:53,820] Trial 2245 finished with value: 1.2366062210724846 and parameters: {'n_estimators': 107, 'learning_rate': 0.03775815874596969, 'max_depth': 7, 'min_samples_split': 7, 'min_samples_leaf': 10, 'subsample': 0.6161807960061454, 'max_features': 'log2'}. Best is trial 1389 with value: 0.22332552856343169.
[I 2024-12-04 13:41:55,921] Trial 2227 finished with value: 0.2966103485587025 and parameters: {'n_estimators': 853, 'learning_rate': 0.09159824038697915, 'max_depth': 8, 'min_samples_split': 5, 'min_samples_leaf': 1, 'subsample': 0.9511205777774803, 'max_features': 'sqrt'}. Best is trial 1389 with value: 0.22332552856343169.
[I 2024-12-04 13:41:57,980] Trial 2217 finished with value: 0.2571991386330533 and parameters: {'n_estimators': 1180, 'learning_rate': 0.07771559099212656, 'max_depth': 8, 'min_samples_split': 6, 'min_samples_leaf': 1, 'subsample': 0.6829623860238893, 'max_features': 'sqrt'}. Best is trial 1389 with value: 0.22332552856343169.
[I 2024-12-04 13:42:04,591] Trial 2221 finished with value: 0.2539080343887923 and parameters: {'n_estimators': 1236, 'learning_rate': 0.051251536421686825, 'max_depth': 10, 'min_samples_split': 10, 'min_samples_leaf': 1, 'subsample': 0.9774449150148351, 'max_features': 'sqrt'}. Best is trial 1389 with value: 0.22332552856343169.
[I 2024-12-04 13:42:05,387] Trial 2230 finished with value: 0.24743050580773418 and parameters: {'n_estimators': 923, 'learning_rate': 0.054816030687107276, 'max_depth': 10, 'min_samples_split': 5, 'min_samples_leaf': 1, 'subsample': 0.7196776363673488, 'max_features': 'sqrt'}. Best is trial 1389 with value: 0.22332552856343169.
[I 2024-12-04 13:42:05,400] Trial 2226 finished with value: 0.3008273257244973 and parameters: {'n_estimators': 1033, 'learning_rate': 0.09648473993901414, 'max_depth': 4, 'min_samples_split': 3, 'min_samples_leaf': 1, 'subsample': 0.6411392493559226, 'max_features': None}. Best is trial 1389 with value: 0.22332552856343169.
[I 2024-12-04 13:42:06,194] Trial 2235 finished with value: 0.40530949968980656 and parameters: {'n_estimators': 616, 'learning_rate': 0.04044032175807606, 'max_depth': 5, 'min_samples_split': 11, 'min_samples_leaf': 6, 'subsample': 0.8844083405018434, 'max_features': 'sqrt'}. Best is trial 1389 with value: 0.22332552856343169.
[I 2024-12-04 13:42:16,347] Trial 2223 finished with value: 0.2464221276886802 and parameters: {'n_estimators': 1245, 'learning_rate': 0.09637528651256187, 'max_depth': 8, 'min_samples_split': 2, 'min_samples_leaf': 1, 'subsample': 0.753566848895081, 'max_features': 'sqrt'}. Best is trial 1389 with value: 0.22332552856343169.
[I 2024-12-04 13:42:18,975] Trial 2229 finished with value: 0.2559123616700472 and parameters: {'n_estimators': 1171, 'learning_rate': 0.05944454251933773, 'max_depth': 7, 'min_samples_split': 5, 'min_samples_leaf': 1, 'subsample': 0.8587977483922271, 'max_features': 'sqrt'}. Best is trial 1389 with value: 0.22332552856343169.
[I 2024-12-04 13:42:22,316] Trial 2244 finished with value: 0.44924972670343144 and parameters: {'n_estimators': 559, 'learning_rate': 0.03895073292507095, 'max_depth': 12, 'min_samples_split': 4, 'min_samples_leaf': 7, 'subsample': 0.9911933263280781, 'max_features': None}. Best is trial 1389 with value: 0.22332552856343169.
[I 2024-12-04 13:42:25,993] Trial 2220 finished with value: 0.252888645689515 and parameters: {'n_estimators': 1483, 'learning_rate': 0.05591462316622968, 'max_depth': 7, 'min_samples_split': 5, 'min_samples_leaf': 1, 'subsample': 0.6056838971933254, 'max_features': 'sqrt'}. Best is trial 1389 with value: 0.22332552856343169.
[I 2024-12-04 13:42:26,110] Trial 2233 finished with value: 0.5349108160389484 and parameters: {'n_estimators': 1153, 'learning_rate': 0.013066827396363383, 'max_depth': 3, 'min_samples_split': 13, 'min_samples_leaf': 5, 'subsample': 0.9341542642122622, 'max_features': 'sqrt'}. Best is trial 1389 with value: 0.22332552856343169.
[I 2024-12-04 13:42:27,621] Trial 2236 finished with value: 0.23665092775232577 and parameters: {'n_estimators': 1004, 'learning_rate': 0.057776476914458745, 'max_depth': 9, 'min_samples_split': 5, 'min_samples_leaf': 1, 'subsample': 0.9205653782601422, 'max_features': 'sqrt'}. Best is trial 1389 with value: 0.22332552856343169.
[I 2024-12-04 13:42:28,872] Trial 2234 finished with value: 0.2495834825963342 and parameters: {'n_estimators': 1110, 'learning_rate': 0.06221997251634453, 'max_depth': 8, 'min_samples_split': 2, 'min_samples_leaf': 1, 'subsample': 0.9229932117184338, 'max_features': 'sqrt'}. Best is trial 1389 with value: 0.22332552856343169.
[I 2024-12-04 13:42:28,923] Trial 2239 finished with value: 0.32976116756704915 and parameters: {'n_estimators': 815, 'learning_rate': 0.0575591028057151, 'max_depth': 12, 'min_samples_split': 9, 'min_samples_leaf': 1, 'subsample': 0.751337194527901, 'max_features': None}. Best is trial 1389 with value: 0.22332552856343169.
[I 2024-12-04 13:42:32,030] Trial 2231 finished with value: 0.23720107197343146 and parameters: {'n_estimators': 1292, 'learning_rate': 0.08954259316311387, 'max_depth': 11, 'min_samples_split': 6, 'min_samples_leaf': 1, 'subsample': 0.6896019846152881, 'max_features': 'sqrt'}. Best is trial 1389 with value: 0.22332552856343169.
[I 2024-12-04 13:42:33,893] Trial 2232 finished with value: 0.2641200688622941 and parameters: {'n_estimators': 1267, 'learning_rate': 0.0982525491510004, 'max_depth': 8, 'min_samples_split': 10, 'min_samples_leaf': 1, 'subsample': 0.7738294045637736, 'max_features': 'sqrt'}. Best is trial 1389 with value: 0.22332552856343169.
[I 2024-12-04 13:42:36,431] Trial 2237 finished with value: 0.3403601430401272 and parameters: {'n_estimators': 1041, 'learning_rate': 0.09629883265118577, 'max_depth': 9, 'min_samples_split': 5, 'min_samples_leaf': 1, 'subsample': 0.6961824718568397, 'max_features': None}. Best is trial 1389 with value: 0.22332552856343169.
[I 2024-12-04 13:42:36,892] Trial 2240 finished with value: 0.2832611729559577 and parameters: {'n_estimators': 951, 'learning_rate': 0.09654753866083358, 'max_depth': 8, 'min_samples_split': 2, 'min_samples_leaf': 2, 'subsample': 0.6823655338629668, 'max_features': 'sqrt'}. Best is trial 1389 with value: 0.22332552856343169.
[I 2024-12-04 13:42:39,615] Trial 2249 finished with value: 0.4639222082666759 and parameters: {'n_estimators': 616, 'learning_rate': 0.027727982519228384, 'max_depth': 9, 'min_samples_split': 2, 'min_samples_leaf': 3, 'subsample': 0.9806752342406685, 'max_features': None}. Best is trial 1389 with value: 0.22332552856343169.
[I 2024-12-04 13:42:41,016] Trial 2260 finished with value: 0.4366051551811226 and parameters: {'n_estimators': 299, 'learning_rate': 0.07248540271290613, 'max_depth': 8, 'min_samples_split': 9, 'min_samples_leaf': 8, 'subsample': 0.9814313639040432, 'max_features': 'sqrt'}. Best is trial 1389 with value: 0.22332552856343169.
[I 2024-12-04 13:42:48,007] Trial 2242 finished with value: 0.9363404846233372 and parameters: {'n_estimators': 1090, 'learning_rate': 0.014733822591891927, 'max_depth': 11, 'min_samples_split': 2, 'min_samples_leaf': 7, 'subsample': 0.6938752903429458, 'max_features': 'log2'}. Best is trial 1389 with value: 0.22332552856343169.
[I 2024-12-04 13:42:48,014] Trial 2248 finished with value: 0.2518565890597621 and parameters: {'n_estimators': 871, 'learning_rate': 0.09988103699106113, 'max_depth': 6, 'min_samples_split': 3, 'min_samples_leaf': 1, 'subsample': 0.8681532924215039, 'max_features': 'sqrt'}. Best is trial 1389 with value: 0.22332552856343169.
[I 2024-12-04 13:42:48,885] Trial 2256 finished with value: 0.26950063857793255 and parameters: {'n_estimators': 606, 'learning_rate': 0.09683033625965577, 'max_depth': 8, 'min_samples_split': 8, 'min_samples_leaf': 1, 'subsample': 0.8822513408551413, 'max_features': 'sqrt'}. Best is trial 1389 with value: 0.22332552856343169.
[I 2024-12-04 13:42:49,262] Trial 2238 finished with value: 0.2866876152010777 and parameters: {'n_estimators': 1212, 'learning_rate': 0.09712420283472643, 'max_depth': 4, 'min_samples_split': 5, 'min_samples_leaf': 2, 'subsample': 0.6478350092266627, 'max_features': 'sqrt'}. Best is trial 1389 with value: 0.22332552856343169.
[I 2024-12-04 13:42:52,074] Trial 2259 finished with value: 0.47976092458507746 and parameters: {'n_estimators': 462, 'learning_rate': 0.09478698244695888, 'max_depth': 11, 'min_samples_split': 4, 'min_samples_leaf': 10, 'subsample': 0.674375590244922, 'max_features': None}. Best is trial 1389 with value: 0.22332552856343169.
[I 2024-12-04 13:42:54,182] Trial 2264 finished with value: 0.4851068084446916 and parameters: {'n_estimators': 373, 'learning_rate': 0.029008594691028067, 'max_depth': 4, 'min_samples_split': 4, 'min_samples_leaf': 9, 'subsample': 0.649711190956737, 'max_features': None}. Best is trial 1389 with value: 0.22332552856343169.
[I 2024-12-04 13:42:54,277] Trial 2247 finished with value: 0.2758001768182408 and parameters: {'n_estimators': 947, 'learning_rate': 0.04763483350095284, 'max_depth': 8, 'min_samples_split': 10, 'min_samples_leaf': 1, 'subsample': 0.8129053112755998, 'max_features': 'sqrt'}. Best is trial 1389 with value: 0.22332552856343169.
[I 2024-12-04 13:42:56,570] Trial 2241 finished with value: 0.24391796554048412 and parameters: {'n_estimators': 1169, 'learning_rate': 0.09229272393908876, 'max_depth': 8, 'min_samples_split': 5, 'min_samples_leaf': 1, 'subsample': 0.9208028094144127, 'max_features': 'sqrt'}. Best is trial 1389 with value: 0.22332552856343169.
[I 2024-12-04 13:42:58,606] Trial 2243 finished with value: 0.3533090646630598 and parameters: {'n_estimators': 1220, 'learning_rate': 0.03978011718892666, 'max_depth': 10, 'min_samples_split': 6, 'min_samples_leaf': 3, 'subsample': 0.6747452149745601, 'max_features': 'sqrt'}. Best is trial 1389 with value: 0.22332552856343169.
[I 2024-12-04 13:43:00,564] Trial 2246 finished with value: 0.2454841926039763 and parameters: {'n_estimators': 1178, 'learning_rate': 0.053315718622021016, 'max_depth': 12, 'min_samples_split': 4, 'min_samples_leaf': 1, 'subsample': 0.6188950618131206, 'max_features': 'sqrt'}. Best is trial 1389 with value: 0.22332552856343169.
[I 2024-12-04 13:43:15,407] Trial 2251 finished with value: 0.2926463488258416 and parameters: {'n_estimators': 1172, 'learning_rate': 0.0674084986384483, 'max_depth': 8, 'min_samples_split': 5, 'min_samples_leaf': 2, 'subsample': 0.8835219183501699, 'max_features': 'sqrt'}. Best is trial 1389 with value: 0.22332552856343169.
[I 2024-12-04 13:43:16,327] Trial 2252 finished with value: 0.24510887382512653 and parameters: {'n_estimators': 1088, 'learning_rate': 0.09478843827237302, 'max_depth': 3, 'min_samples_split': 2, 'min_samples_leaf': 1, 'subsample': 0.9565092187444851, 'max_features': 'sqrt'}. Best is trial 1389 with value: 0.22332552856343169.
[I 2024-12-04 13:43:17,068] Trial 2250 finished with value: 0.385203722585748 and parameters: {'n_estimators': 1171, 'learning_rate': 0.08999641408812149, 'max_depth': 5, 'min_samples_split': 7, 'min_samples_leaf': 3, 'subsample': 0.9088023588288516, 'max_features': None}. Best is trial 1389 with value: 0.22332552856343169.
[I 2024-12-04 13:43:17,979] Trial 2280 finished with value: 1.1331196270787942 and parameters: {'n_estimators': 105, 'learning_rate': 0.014291694163415173, 'max_depth': 6, 'min_samples_split': 2, 'min_samples_leaf': 10, 'subsample': 0.8853261052878562, 'max_features': 'sqrt'}. Best is trial 1389 with value: 0.22332552856343169.
[I 2024-12-04 13:43:26,465] Trial 2255 finished with value: 0.25206019400634294 and parameters: {'n_estimators': 1281, 'learning_rate': 0.06961529177866266, 'max_depth': 6, 'min_samples_split': 8, 'min_samples_leaf': 1, 'subsample': 0.8308395776823454, 'max_features': 'sqrt'}. Best is trial 1389 with value: 0.22332552856343169.
[I 2024-12-04 13:43:26,466] Trial 2257 finished with value: 0.3466404241162357 and parameters: {'n_estimators': 1119, 'learning_rate': 0.09817905449294333, 'max_depth': 8, 'min_samples_split': 2, 'min_samples_leaf': 3, 'subsample': 0.6694963416225959, 'max_features': 'sqrt'}. Best is trial 1389 with value: 0.22332552856343169.
[I 2024-12-04 13:43:27,241] Trial 2271 finished with value: 0.6619574981920132 and parameters: {'n_estimators': 525, 'learning_rate': 0.01471315729407171, 'max_depth': 6, 'min_samples_split': 4, 'min_samples_leaf': 6, 'subsample': 0.6713925480753408, 'max_features': 'sqrt'}. Best is trial 1389 with value: 0.22332552856343169.
[I 2024-12-04 13:43:30,122] Trial 2253 finished with value: 0.3459383527045626 and parameters: {'n_estimators': 1340, 'learning_rate': 0.09230365913823678, 'max_depth': 6, 'min_samples_split': 2, 'min_samples_leaf': 3, 'subsample': 0.7673723558214648, 'max_features': 'sqrt'}. Best is trial 1389 with value: 0.22332552856343169.
[I 2024-12-04 13:43:37,068] Trial 2267 finished with value: 0.2494790071277365 and parameters: {'n_estimators': 975, 'learning_rate': 0.09897380804401117, 'max_depth': 8, 'min_samples_split': 4, 'min_samples_leaf': 1, 'subsample': 0.9043916529695605, 'max_features': 'sqrt'}. Best is trial 1389 with value: 0.22332552856343169.
[I 2024-12-04 13:43:39,547] Trial 2254 finished with value: 0.24886068305143447 and parameters: {'n_estimators': 1440, 'learning_rate': 0.05780270732667086, 'max_depth': 7, 'min_samples_split': 5, 'min_samples_leaf': 1, 'subsample': 0.7317688852763069, 'max_features': 'sqrt'}. Best is trial 1389 with value: 0.22332552856343169.
[I 2024-12-04 13:43:44,050] Trial 2266 finished with value: 0.460540995207845 and parameters: {'n_estimators': 911, 'learning_rate': 0.013253283834951864, 'max_depth': 8, 'min_samples_split': 4, 'min_samples_leaf': 2, 'subsample': 0.8573370529632535, 'max_features': None}. Best is trial 1389 with value: 0.22332552856343169.
