[I 2024-12-04 11:54:57,261] A new study created in RDB with name: Tc_rf
[I 2024-12-04 11:55:03,490] Trial 4 finished with value: 0.8026095227854158 and parameters: {'n_estimators': 358, 'max_depth': 6, 'min_samples_split': 4, 'min_samples_leaf': 5, 'max_features': 'sqrt', 'bootstrap': True, 'criterion': 'squared_error'}. Best is trial 4 with value: 0.8026095227854158.
[I 2024-12-04 11:55:03,506] Trial 0 finished with value: 0.888165749481829 and parameters: {'n_estimators': 365, 'max_depth': 27, 'min_samples_split': 7, 'min_samples_leaf': 5, 'max_features': 'log2', 'bootstrap': False, 'criterion': 'squared_error'}. Best is trial 4 with value: 0.8026095227854158.
[I 2024-12-04 11:55:07,281] Trial 24 finished with value: 0.7987934808923406 and parameters: {'n_estimators': 454, 'max_depth': 9, 'min_samples_split': 2, 'min_samples_leaf': 1, 'max_features': 'log2', 'bootstrap': False, 'criterion': 'squared_error'}. Best is trial 24 with value: 0.7987934808923406.
[I 2024-12-04 11:55:08,114] Trial 12 finished with value: 0.9531511822680138 and parameters: {'n_estimators': 210, 'max_depth': 14, 'min_samples_split': 5, 'min_samples_leaf': 11, 'max_features': 'log2', 'bootstrap': False, 'criterion': 'squared_error'}. Best is trial 8 with value: 0.7473079809214838.
[I 2024-12-04 11:55:09,387] Trial 8 finished with value: 0.7473079809214838 and parameters: {'n_estimators': 184, 'max_depth': 22, 'min_samples_split': 7, 'min_samples_leaf': 2, 'max_features': 'log2', 'bootstrap': False, 'criterion': 'absolute_error'}. Best is trial 8 with value: 0.7473079809214838.
[I 2024-12-04 11:55:09,526] Trial 15 finished with value: 0.8124337753752683 and parameters: {'n_estimators': 537, 'max_depth': 33, 'min_samples_split': 12, 'min_samples_leaf': 7, 'max_features': 'sqrt', 'bootstrap': True, 'criterion': 'squared_error'}. Best is trial 8 with value: 0.7473079809214838.
[I 2024-12-04 11:55:10,989] Trial 26 finished with value: 0.6660446891173301 and parameters: {'n_estimators': 780, 'max_depth': 10, 'min_samples_split': 41, 'min_samples_leaf': 2, 'max_features': 'sqrt', 'bootstrap': False, 'criterion': 'squared_error'}. Best is trial 6 with value: 0.4184257998729195.
[I 2024-12-04 11:55:11,386] Trial 20 finished with value: 0.8524519838601361 and parameters: {'n_estimators': 652, 'max_depth': 31, 'min_samples_split': 2, 'min_samples_leaf': 9, 'max_features': 'sqrt', 'bootstrap': True, 'criterion': 'squared_error'}. Best is trial 6 with value: 0.4184257998729195.
[I 2024-12-04 11:55:12,661] Trial 6 finished with value: 0.4184257998729195 and parameters: {'n_estimators': 735, 'max_depth': 17, 'min_samples_split': 3, 'min_samples_leaf': 2, 'max_features': None, 'bootstrap': False, 'criterion': 'squared_error'}. Best is trial 6 with value: 0.4184257998729195.
[I 2024-12-04 11:55:12,688] Trial 2 finished with value: 0.5712504975801528 and parameters: {'n_estimators': 199, 'max_depth': 44, 'min_samples_split': 8, 'min_samples_leaf': 4, 'max_features': 'sqrt', 'bootstrap': False, 'criterion': 'absolute_error'}. Best is trial 6 with value: 0.4184257998729195.
[I 2024-12-04 11:55:12,824] Trial 13 finished with value: 0.9465542284489628 and parameters: {'n_estimators': 849, 'max_depth': 19, 'min_samples_split': 4, 'min_samples_leaf': 9, 'max_features': 'log2', 'bootstrap': False, 'criterion': 'absolute_error'}. Best is trial 6 with value: 0.4184257998729195.
[I 2024-12-04 11:55:17,444] Trial 14 finished with value: 0.9335019820557862 and parameters: {'n_estimators': 549, 'max_depth': 31, 'min_samples_split': 26, 'min_samples_leaf': 5, 'max_features': 'log2', 'bootstrap': True, 'criterion': 'squared_error'}. Best is trial 6 with value: 0.4184257998729195.
[I 2024-12-04 11:55:17,828] Trial 10 finished with value: 0.5908303130596131 and parameters: {'n_estimators': 463, 'max_depth': 20, 'min_samples_split': 22, 'min_samples_leaf': 3, 'max_features': 'sqrt', 'bootstrap': True, 'criterion': 'squared_error'}. Best is trial 6 with value: 0.4184257998729195.
[I 2024-12-04 11:55:19,098] Trial 11 finished with value: 0.9562860805505141 and parameters: {'n_estimators': 677, 'max_depth': 6, 'min_samples_split': 38, 'min_samples_leaf': 8, 'max_features': 'log2', 'bootstrap': True, 'criterion': 'absolute_error'}. Best is trial 6 with value: 0.4184257998729195.
[I 2024-12-04 11:55:22,763] Trial 1 finished with value: 0.42002658694126216 and parameters: {'n_estimators': 178, 'max_depth': 16, 'min_samples_split': 7, 'min_samples_leaf': 5, 'max_features': None, 'bootstrap': True, 'criterion': 'squared_error'}. Best is trial 6 with value: 0.4184257998729195.
[I 2024-12-04 11:55:24,548] Trial 3 finished with value: 0.4995845945581964 and parameters: {'n_estimators': 701, 'max_depth': 20, 'min_samples_split': 15, 'min_samples_leaf': 1, 'max_features': 'sqrt', 'bootstrap': True, 'criterion': 'squared_error'}. Best is trial 19 with value: 0.3634825778986447.
[I 2024-12-04 11:55:26,017] Trial 19 finished with value: 0.3634825778986447 and parameters: {'n_estimators': 668, 'max_depth': 43, 'min_samples_split': 16, 'min_samples_leaf': 1, 'max_features': 'sqrt', 'bootstrap': False, 'criterion': 'squared_error'}. Best is trial 19 with value: 0.3634825778986447.
[I 2024-12-04 11:55:29,870] Trial 28 finished with value: 0.5093478390292432 and parameters: {'n_estimators': 838, 'max_depth': 38, 'min_samples_split': 17, 'min_samples_leaf': 3, 'max_features': 'sqrt', 'bootstrap': False, 'criterion': 'squared_error'}. Best is trial 19 with value: 0.3634825778986447.
[I 2024-12-04 11:55:30,057] Trial 29 finished with value: 0.5372546200770771 and parameters: {'n_estimators': 194, 'max_depth': 36, 'min_samples_split': 2, 'min_samples_leaf': 12, 'max_features': None, 'bootstrap': True, 'criterion': 'absolute_error'}. Best is trial 19 with value: 0.3634825778986447.
[I 2024-12-04 11:55:31,011] Trial 25 finished with value: 0.3464932675921379 and parameters: {'n_estimators': 915, 'max_depth': 36, 'min_samples_split': 8, 'min_samples_leaf': 1, 'max_features': 'sqrt', 'bootstrap': False, 'criterion': 'squared_error'}. Best is trial 25 with value: 0.3464932675921379.
[I 2024-12-04 11:55:31,667] Trial 33 finished with value: 0.4367042331642191 and parameters: {'n_estimators': 133, 'max_depth': 21, 'min_samples_split': 9, 'min_samples_leaf': 6, 'max_features': None, 'bootstrap': True, 'criterion': 'squared_error'}. Best is trial 25 with value: 0.3464932675921379.
[I 2024-12-04 11:55:32,986] Trial 5 finished with value: 0.5219904982149636 and parameters: {'n_estimators': 200, 'max_depth': 28, 'min_samples_split': 44, 'min_samples_leaf': 14, 'max_features': None, 'bootstrap': False, 'criterion': 'absolute_error'}. Best is trial 25 with value: 0.3464932675921379.
[I 2024-12-04 11:55:32,987] Trial 39 finished with value: 0.4995433537608217 and parameters: {'n_estimators': 121, 'max_depth': 5, 'min_samples_split': 11, 'min_samples_leaf': 9, 'max_features': None, 'bootstrap': True, 'criterion': 'squared_error'}. Best is trial 25 with value: 0.3464932675921379.
[I 2024-12-04 11:55:34,091] Trial 16 finished with value: 0.40577561087579034 and parameters: {'n_estimators': 257, 'max_depth': 49, 'min_samples_split': 5, 'min_samples_leaf': 1, 'max_features': 'log2', 'bootstrap': False, 'criterion': 'absolute_error'}. Best is trial 25 with value: 0.3464932675921379.
[I 2024-12-04 11:55:40,562] Trial 40 finished with value: 0.4008716290567726 and parameters: {'n_estimators': 275, 'max_depth': 19, 'min_samples_split': 6, 'min_samples_leaf': 4, 'max_features': None, 'bootstrap': True, 'criterion': 'squared_error'}. Best is trial 25 with value: 0.3464932675921379.
[I 2024-12-04 11:55:42,289] Trial 31 finished with value: 0.9176974761987515 and parameters: {'n_estimators': 962, 'max_depth': 15, 'min_samples_split': 2, 'min_samples_leaf': 6, 'max_features': 'log2', 'bootstrap': False, 'criterion': 'absolute_error'}. Best is trial 25 with value: 0.3464932675921379.
[I 2024-12-04 11:55:42,471] Trial 32 finished with value: 0.8047830004920101 and parameters: {'n_estimators': 600, 'max_depth': 29, 'min_samples_split': 16, 'min_samples_leaf': 3, 'max_features': 'log2', 'bootstrap': False, 'criterion': 'absolute_error'}. Best is trial 25 with value: 0.3464932675921379.
[I 2024-12-04 11:55:43,169] Trial 7 finished with value: 0.7926021289059856 and parameters: {'n_estimators': 881, 'max_depth': 6, 'min_samples_split': 40, 'min_samples_leaf': 6, 'max_features': 'sqrt', 'bootstrap': False, 'criterion': 'absolute_error'}. Best is trial 25 with value: 0.3464932675921379.
[I 2024-12-04 11:55:43,713] Trial 9 finished with value: 0.4689605198218254 and parameters: {'n_estimators': 335, 'max_depth': 8, 'min_samples_split': 5, 'min_samples_leaf': 6, 'max_features': None, 'bootstrap': False, 'criterion': 'absolute_error'}. Best is trial 25 with value: 0.3464932675921379.
[I 2024-12-04 11:55:44,176] Trial 35 finished with value: 0.4074191605560743 and parameters: {'n_estimators': 425, 'max_depth': 23, 'min_samples_split': 9, 'min_samples_leaf': 2, 'max_features': None, 'bootstrap': False, 'criterion': 'squared_error'}. Best is trial 25 with value: 0.3464932675921379.
[I 2024-12-04 11:55:45,426] Trial 42 finished with value: 0.7223160934621496 and parameters: {'n_estimators': 201, 'max_depth': 50, 'min_samples_split': 5, 'min_samples_leaf': 2, 'max_features': 'log2', 'bootstrap': False, 'criterion': 'absolute_error'}. Best is trial 25 with value: 0.3464932675921379.
[I 2024-12-04 11:55:46,889] Trial 41 finished with value: 0.4067684627330713 and parameters: {'n_estimators': 216, 'max_depth': 47, 'min_samples_split': 4, 'min_samples_leaf': 1, 'max_features': 'log2', 'bootstrap': False, 'criterion': 'squared_error'}. Best is trial 25 with value: 0.3464932675921379.
[I 2024-12-04 11:55:46,898] Trial 22 finished with value: 0.36078288464256547 and parameters: {'n_estimators': 856, 'max_depth': 19, 'min_samples_split': 8, 'min_samples_leaf': 2, 'max_features': None, 'bootstrap': True, 'criterion': 'squared_error'}. Best is trial 25 with value: 0.3464932675921379.
[I 2024-12-04 11:55:47,815] Trial 27 finished with value: 0.6136760987385061 and parameters: {'n_estimators': 895, 'max_depth': 26, 'min_samples_split': 24, 'min_samples_leaf': 1, 'max_features': 'log2', 'bootstrap': True, 'criterion': 'absolute_error'}. Best is trial 25 with value: 0.3464932675921379.
[I 2024-12-04 11:55:48,406] Trial 34 finished with value: 0.4276605780400213 and parameters: {'n_estimators': 693, 'max_depth': 11, 'min_samples_split': 4, 'min_samples_leaf': 4, 'max_features': None, 'bootstrap': False, 'criterion': 'squared_error'}. Best is trial 25 with value: 0.3464932675921379.
[I 2024-12-04 11:55:48,425] Trial 43 finished with value: 0.41097208096807103 and parameters: {'n_estimators': 166, 'max_depth': 46, 'min_samples_split': 3, 'min_samples_leaf': 1, 'max_features': 'log2', 'bootstrap': False, 'criterion': 'absolute_error'}. Best is trial 25 with value: 0.3464932675921379.
[I 2024-12-04 11:55:49,137] Trial 36 finished with value: 0.40360207442670587 and parameters: {'n_estimators': 631, 'max_depth': 23, 'min_samples_split': 4, 'min_samples_leaf': 1, 'max_features': None, 'bootstrap': False, 'criterion': 'squared_error'}. Best is trial 25 with value: 0.3464932675921379.
[I 2024-12-04 11:55:51,911] Trial 37 finished with value: 0.3041230780622461 and parameters: {'n_estimators': 810, 'max_depth': 42, 'min_samples_split': 3, 'min_samples_leaf': 1, 'max_features': 'sqrt', 'bootstrap': False, 'criterion': 'squared_error'}. Best is trial 37 with value: 0.3041230780622461.
[I 2024-12-04 11:55:51,913] Trial 38 finished with value: 0.49250633225831664 and parameters: {'n_estimators': 870, 'max_depth': 7, 'min_samples_split': 2, 'min_samples_leaf': 4, 'max_features': None, 'bootstrap': False, 'criterion': 'squared_error'}. Best is trial 37 with value: 0.3041230780622461.
[I 2024-12-04 11:55:51,918] Trial 46 finished with value: 0.491010552928716 and parameters: {'n_estimators': 682, 'max_depth': 36, 'min_samples_split': 10, 'min_samples_leaf': 1, 'max_features': 'log2', 'bootstrap': False, 'criterion': 'squared_error'}. Best is trial 37 with value: 0.3041230780622461.
[I 2024-12-04 11:55:52,086] Trial 45 finished with value: 0.4000470169016073 and parameters: {'n_estimators': 684, 'max_depth': 46, 'min_samples_split': 41, 'min_samples_leaf': 1, 'max_features': 'sqrt', 'bootstrap': False, 'criterion': 'squared_error'}. Best is trial 37 with value: 0.3041230780622461.
[I 2024-12-04 11:55:52,761] Trial 51 finished with value: 0.36359629861620063 and parameters: {'n_estimators': 438, 'max_depth': 34, 'min_samples_split': 10, 'min_samples_leaf': 1, 'max_features': 'sqrt', 'bootstrap': False, 'criterion': 'squared_error'}. Best is trial 37 with value: 0.3041230780622461.
[I 2024-12-04 11:55:52,774] Trial 53 finished with value: 0.798411315424441 and parameters: {'n_estimators': 179, 'max_depth': 20, 'min_samples_split': 5, 'min_samples_leaf': 2, 'max_features': 'log2', 'bootstrap': True, 'criterion': 'squared_error'}. Best is trial 37 with value: 0.3041230780622461.
[I 2024-12-04 11:55:54,417] Trial 44 finished with value: 0.39495816512672594 and parameters: {'n_estimators': 784, 'max_depth': 45, 'min_samples_split': 23, 'min_samples_leaf': 1, 'max_features': 'sqrt', 'bootstrap': True, 'criterion': 'squared_error'}. Best is trial 37 with value: 0.3041230780622461.
[I 2024-12-04 11:55:55,515] Trial 30 finished with value: 0.49223715201167045 and parameters: {'n_estimators': 815, 'max_depth': 32, 'min_samples_split': 45, 'min_samples_leaf': 2, 'max_features': 'sqrt', 'bootstrap': False, 'criterion': 'absolute_error'}. Best is trial 37 with value: 0.3041230780622461.
[I 2024-12-04 11:55:55,517] Trial 49 finished with value: 0.3982004612005399 and parameters: {'n_estimators': 787, 'max_depth': 27, 'min_samples_split': 8, 'min_samples_leaf': 1, 'max_features': 'sqrt', 'bootstrap': False, 'criterion': 'squared_error'}. Best is trial 37 with value: 0.3041230780622461.
[I 2024-12-04 11:55:55,719] Trial 17 finished with value: 0.4293632991070458 and parameters: {'n_estimators': 638, 'max_depth': 14, 'min_samples_split': 4, 'min_samples_leaf': 5, 'max_features': None, 'bootstrap': True, 'criterion': 'absolute_error'}. Best is trial 37 with value: 0.3041230780622461.
[I 2024-12-04 11:55:57,355] Trial 56 finished with value: 0.3472245399879307 and parameters: {'n_estimators': 321, 'max_depth': 42, 'min_samples_split': 12, 'min_samples_leaf': 1, 'max_features': 'sqrt', 'bootstrap': False, 'criterion': 'squared_error'}. Best is trial 37 with value: 0.3041230780622461.
[I 2024-12-04 11:55:58,373] Trial 54 finished with value: 0.4593327077432436 and parameters: {'n_estimators': 272, 'max_depth': 34, 'min_samples_split': 12, 'min_samples_leaf': 2, 'max_features': 'sqrt', 'bootstrap': False, 'criterion': 'squared_error'}. Best is trial 37 with value: 0.3041230780622461.
[I 2024-12-04 11:56:01,377] Trial 48 finished with value: 0.398525611515504 and parameters: {'n_estimators': 724, 'max_depth': 29, 'min_samples_split': 12, 'min_samples_leaf': 1, 'max_features': 'sqrt', 'bootstrap': False, 'criterion': 'squared_error'}. Best is trial 55 with value: 0.3031707776353285.
[I 2024-12-04 11:56:02,117] Trial 55 finished with value: 0.3031707776353285 and parameters: {'n_estimators': 699, 'max_depth': 47, 'min_samples_split': 4, 'min_samples_leaf': 1, 'max_features': 'sqrt', 'bootstrap': False, 'criterion': 'squared_error'}. Best is trial 55 with value: 0.3031707776353285.
[I 2024-12-04 11:56:04,581] Trial 60 finished with value: 0.4080914731210249 and parameters: {'n_estimators': 781, 'max_depth': 44, 'min_samples_split': 45, 'min_samples_leaf': 1, 'max_features': 'sqrt', 'bootstrap': False, 'criterion': 'squared_error'}. Best is trial 55 with value: 0.3031707776353285.
[I 2024-12-04 11:56:06,388] Trial 23 finished with value: 0.40853148487448115 and parameters: {'n_estimators': 972, 'max_depth': 34, 'min_samples_split': 19, 'min_samples_leaf': 1, 'max_features': 'sqrt', 'bootstrap': False, 'criterion': 'absolute_error'}. Best is trial 55 with value: 0.3031707776353285.
[I 2024-12-04 11:56:08,692] Trial 64 finished with value: 0.4890281475505781 and parameters: {'n_estimators': 179, 'max_depth': 40, 'min_samples_split': 13, 'min_samples_leaf': 1, 'max_features': 'log2', 'bootstrap': True, 'criterion': 'squared_error'}. Best is trial 55 with value: 0.3031707776353285.
[I 2024-12-04 11:56:09,024] Trial 50 finished with value: 0.41018570396014303 and parameters: {'n_estimators': 895, 'max_depth': 9, 'min_samples_split': 9, 'min_samples_leaf': 3, 'max_features': None, 'bootstrap': True, 'criterion': 'squared_error'}. Best is trial 55 with value: 0.3031707776353285.
[I 2024-12-04 11:56:09,593] Trial 57 finished with value: 0.44160695926109783 and parameters: {'n_estimators': 703, 'max_depth': 40, 'min_samples_split': 2, 'min_samples_leaf': 1, 'max_features': 'log2', 'bootstrap': True, 'criterion': 'squared_error'}. Best is trial 55 with value: 0.3031707776353285.
[I 2024-12-04 11:56:09,597] Trial 62 finished with value: 0.3642971586894147 and parameters: {'n_estimators': 782, 'max_depth': 35, 'min_samples_split': 5, 'min_samples_leaf': 1, 'max_features': 'sqrt', 'bootstrap': True, 'criterion': 'squared_error'}. Best is trial 55 with value: 0.3031707776353285.
[I 2024-12-04 11:56:09,603] Trial 59 finished with value: 0.4482048692977088 and parameters: {'n_estimators': 698, 'max_depth': 38, 'min_samples_split': 2, 'min_samples_leaf': 2, 'max_features': 'sqrt', 'bootstrap': False, 'criterion': 'squared_error'}. Best is trial 55 with value: 0.3031707776353285.
[I 2024-12-04 11:56:12,835] Trial 69 finished with value: 0.5160957991716771 and parameters: {'n_estimators': 265, 'max_depth': 40, 'min_samples_split': 36, 'min_samples_leaf': 1, 'max_features': 'log2', 'bootstrap': False, 'criterion': 'squared_error'}. Best is trial 55 with value: 0.3031707776353285.
[I 2024-12-04 11:56:12,844] Trial 47 finished with value: 0.37388936278550655 and parameters: {'n_estimators': 802, 'max_depth': 28, 'min_samples_split': 4, 'min_samples_leaf': 3, 'max_features': None, 'bootstrap': True, 'criterion': 'squared_error'}. Best is trial 55 with value: 0.3031707776353285.
[I 2024-12-04 11:56:12,875] Trial 66 finished with value: 0.3310849921939185 and parameters: {'n_estimators': 462, 'max_depth': 49, 'min_samples_split': 11, 'min_samples_leaf': 1, 'max_features': 'sqrt', 'bootstrap': False, 'criterion': 'squared_error'}. Best is trial 55 with value: 0.3031707776353285.
[I 2024-12-04 11:56:14,359] Trial 68 finished with value: 0.3383640555914883 and parameters: {'n_estimators': 986, 'max_depth': 40, 'min_samples_split': 9, 'min_samples_leaf': 1, 'max_features': 'sqrt', 'bootstrap': False, 'criterion': 'squared_error'}. Best is trial 74 with value: 0.30055921487811155.
[I 2024-12-04 11:56:15,632] Trial 74 finished with value: 0.30055921487811155 and parameters: {'n_estimators': 612, 'max_depth': 50, 'min_samples_split': 4, 'min_samples_leaf': 1, 'max_features': 'sqrt', 'bootstrap': False, 'criterion': 'squared_error'}. Best is trial 74 with value: 0.30055921487811155.
[I 2024-12-04 11:56:15,636] Trial 52 finished with value: 0.38601262483053533 and parameters: {'n_estimators': 554, 'max_depth': 42, 'min_samples_split': 19, 'min_samples_leaf': 1, 'max_features': 'sqrt', 'bootstrap': False, 'criterion': 'absolute_error'}. Best is trial 74 with value: 0.30055921487811155.
[I 2024-12-04 11:56:16,721] Trial 58 finished with value: 0.3563784639957434 and parameters: {'n_estimators': 815, 'max_depth': 19, 'min_samples_split': 13, 'min_samples_leaf': 1, 'max_features': None, 'bootstrap': True, 'criterion': 'squared_error'}. Best is trial 74 with value: 0.30055921487811155.
[I 2024-12-04 11:56:17,185] Trial 71 finished with value: 0.42254330864294115 and parameters: {'n_estimators': 114, 'max_depth': 46, 'min_samples_split': 17, 'min_samples_leaf': 1, 'max_features': None, 'bootstrap': False, 'criterion': 'squared_error'}. Best is trial 74 with value: 0.30055921487811155.
[I 2024-12-04 11:56:17,200] Trial 63 finished with value: 0.5236105601778671 and parameters: {'n_estimators': 969, 'max_depth': 33, 'min_samples_split': 9, 'min_samples_leaf': 1, 'max_features': 'log2', 'bootstrap': True, 'criterion': 'squared_error'}. Best is trial 74 with value: 0.30055921487811155.
[I 2024-12-04 11:56:18,123] Trial 72 finished with value: 0.4428670532643997 and parameters: {'n_estimators': 954, 'max_depth': 50, 'min_samples_split': 3, 'min_samples_leaf': 2, 'max_features': 'sqrt', 'bootstrap': False, 'criterion': 'squared_error'}. Best is trial 74 with value: 0.30055921487811155.
[I 2024-12-04 11:56:19,635] Trial 61 finished with value: 0.3797786176170556 and parameters: {'n_estimators': 984, 'max_depth': 44, 'min_samples_split': 3, 'min_samples_leaf': 1, 'max_features': None, 'bootstrap': False, 'criterion': 'squared_error'}. Best is trial 74 with value: 0.30055921487811155.
[I 2024-12-04 11:56:21,151] Trial 73 finished with value: 0.36093691763959734 and parameters: {'n_estimators': 314, 'max_depth': 50, 'min_samples_split': 19, 'min_samples_leaf': 1, 'max_features': 'sqrt', 'bootstrap': False, 'criterion': 'squared_error'}. Best is trial 74 with value: 0.30055921487811155.
[I 2024-12-04 11:56:22,184] Trial 21 finished with value: 0.4182355429200223 and parameters: {'n_estimators': 302, 'max_depth': 43, 'min_samples_split': 7, 'min_samples_leaf': 1, 'max_features': None, 'bootstrap': False, 'criterion': 'absolute_error'}. Best is trial 74 with value: 0.30055921487811155.
[I 2024-12-04 11:56:23,552] Trial 77 finished with value: 0.34859943302523994 and parameters: {'n_estimators': 305, 'max_depth': 45, 'min_samples_split': 13, 'min_samples_leaf': 1, 'max_features': 'sqrt', 'bootstrap': False, 'criterion': 'squared_error'}. Best is trial 74 with value: 0.30055921487811155.
