[I 2024-12-04 14:55:25,088] Trial 71 finished with value: 1.269363502856977 and parameters: {'kernel_type': 'Matern', 'length_scale': 0.02806741867896278, 'noise_level': 0.4281736903868893, 'constant_value': 0.3328807176194178, 'nu': 1.5}. Best is trial 49 with value: 0.13435423034437025.
[I 2024-12-04 14:55:30,233] Trial 70 finished with value: 0.13435447830611133 and parameters: {'kernel_type': 'Matern', 'length_scale': 0.13215776096342138, 'noise_level': 8.115704645640305e-06, 'constant_value': 0.968258080792664, 'nu': 1.5}. Best is trial 49 with value: 0.13435423034437025.
[I 2024-12-04 14:55:32,495] Trial 78 finished with value: 1.2693635028570536 and parameters: {'kernel_type': 'Matern', 'length_scale': 457.1883681306998, 'noise_level': 0.0005286355741020499, 'constant_value': 127.46759308165352, 'nu': 1.5}. Best is trial 49 with value: 0.13435423034437025.
[I 2024-12-04 14:55:34,359] Trial 80 finished with value: 1.2693635028562777 and parameters: {'kernel_type': 'Matern', 'length_scale': 47.68186463226631, 'noise_level': 1.5769382415859438e-09, 'constant_value': 0.3260921042733291, 'nu': 1.5}. Best is trial 49 with value: 0.13435423034437025.
[I 2024-12-04 14:55:34,892] Trial 77 finished with value: 0.13435439346554978 and parameters: {'kernel_type': 'Matern', 'length_scale': 0.24872911794748856, 'noise_level': 0.0010087565725954962, 'constant_value': 0.004073980754668305, 'nu': 1.5}. Best is trial 49 with value: 0.13435423034437025.
[I 2024-12-04 14:55:36,652] Trial 87 finished with value: 1.269363502861816 and parameters: {'kernel_type': 'Matern', 'length_scale': 0.031962949794343644, 'noise_level': 0.8276043864470003, 'constant_value': 11790.786029903387, 'nu': 1.5}. Best is trial 49 with value: 0.13435423034437025.
[I 2024-12-04 14:55:37,371] Trial 81 finished with value: 0.13435439889139408 and parameters: {'kernel_type': 'Matern', 'length_scale': 3.570140563517545, 'noise_level': 0.028101253772478206, 'constant_value': 6448.7910531853, 'nu': 1.5}. Best is trial 49 with value: 0.13435423034437025.
[I 2024-12-04 14:55:37,529] Trial 84 finished with value: 0.151672975451362 and parameters: {'kernel_type': 'RBF', 'length_scale': 1.1137868474338222, 'noise_level': 3.0330245217431475e-07, 'constant_value': 1.9553177368982227e-05, 'nu': 1.5}. Best is trial 49 with value: 0.13435423034437025.
[I 2024-12-04 14:55:38,446] Trial 73 finished with value: 0.1343544041608063 and parameters: {'kernel_type': 'Matern', 'length_scale': 0.7994617593990704, 'noise_level': 3.7368447232934407e-06, 'constant_value': 0.00181425796344307, 'nu': 1.5}. Best is trial 49 with value: 0.13435423034437025.
[I 2024-12-04 14:55:39,766] Trial 82 finished with value: 0.1343544004389138 and parameters: {'kernel_type': 'Matern', 'length_scale': 5.8716790621256925, 'noise_level': 0.07267425475401448, 'constant_value': 78.19251431889077, 'nu': 1.5}. Best is trial 49 with value: 0.13435423034437025.
[I 2024-12-04 14:55:40,722] Trial 88 finished with value: 0.13435439855644246 and parameters: {'kernel_type': 'Matern', 'length_scale': 2.566425759525387, 'noise_level': 2.09731607838273e-07, 'constant_value': 2.193037734467274e-06, 'nu': 1.5}. Best is trial 49 with value: 0.13435423034437025.
[I 2024-12-04 14:55:40,878] Trial 86 finished with value: 0.13435438903954278 and parameters: {'kernel_type': 'Matern', 'length_scale': 2.7852327453099828, 'noise_level': 0.5559658638647369, 'constant_value': 832.1132637116352, 'nu': 1.5}. Best is trial 49 with value: 0.13435423034437025.
[I 2024-12-04 14:55:43,590] Trial 91 finished with value: 1.2693635028573764 and parameters: {'kernel_type': 'Matern', 'length_scale': 7536.044711212698, 'noise_level': 0.00013993436533317518, 'constant_value': 1.313780308286304e-06, 'nu': 1.5}. Best is trial 49 with value: 0.13435423034437025.
[I 2024-12-04 14:55:43,650] Trial 75 finished with value: 1.3007745978976708 and parameters: {'kernel_type': 'Matern', 'length_scale': 62592.870789680666, 'noise_level': 0.007568958784375728, 'constant_value': 0.08992550703447343, 'nu': 1.5}. Best is trial 49 with value: 0.13435423034437025.
[I 2024-12-04 14:55:43,723] Trial 92 finished with value: 0.13435440295540954 and parameters: {'kernel_type': 'Matern', 'length_scale': 1392.490709047338, 'noise_level': 0.04238186782131534, 'constant_value': 6.093879618048535, 'nu': 1.5}. Best is trial 49 with value: 0.13435423034437025.
[I 2024-12-04 14:55:43,780] Trial 94 finished with value: 1.300773803245429 and parameters: {'kernel_type': 'Matern', 'length_scale': 334.40751192636367, 'noise_level': 0.015248674256114267, 'constant_value': 8.920064129844718e-07, 'nu': 2.5}. Best is trial 49 with value: 0.13435423034437025.
[I 2024-12-04 14:55:44,162] Trial 89 finished with value: 0.17251040423562589 and parameters: {'kernel_type': 'Matern', 'length_scale': 0.4705801778668275, 'noise_level': 0.0033561839045355233, 'constant_value': 0.00010102970416266245, 'nu': 0.5}. Best is trial 49 with value: 0.13435423034437025.
[I 2024-12-04 14:55:44,172] Trial 96 finished with value: 0.172510403547623 and parameters: {'kernel_type': 'Matern', 'length_scale': 1108.512464165211, 'noise_level': 0.06230217250237174, 'constant_value': 0.2723183895690356, 'nu': 0.5}. Best is trial 49 with value: 0.13435423034437025.
[I 2024-12-04 14:55:45,013] Trial 98 finished with value: 1.269363502857017 and parameters: {'kernel_type': 'Matern', 'length_scale': 501.7075291661391, 'noise_level': 0.005862680260980149, 'constant_value': 0.04982429882519398, 'nu': 0.5}. Best is trial 49 with value: 0.13435423034437025.
[I 2024-12-04 14:55:47,186] Trial 106 finished with value: 0.13435441016497854 and parameters: {'kernel_type': 'Matern', 'length_scale': 726.2505986792464, 'noise_level': 0.023604544649639937, 'constant_value': 19371.878499716946, 'nu': 1.5}. Best is trial 49 with value: 0.13435423034437025.
[I 2024-12-04 14:55:47,895] Trial 93 finished with value: 1.3007745889474738 and parameters: {'kernel_type': 'RBF', 'length_scale': 2005.7454421984764, 'noise_level': 0.34703282392442014, 'constant_value': 0.01911720226485265, 'nu': 1.5}. Best is trial 105 with value: 0.13435422421010806.
[I 2024-12-04 14:55:49,005] Trial 90 finished with value: 1.269363502855968 and parameters: {'kernel_type': 'Matern', 'length_scale': 75.3434889409444, 'noise_level': 0.0002831659347997551, 'constant_value': 5.29946957544715e-07, 'nu': 1.5}. Best is trial 105 with value: 0.13435422421010806.
[I 2024-12-04 14:55:49,103] Trial 105 finished with value: 0.13435422421010806 and parameters: {'kernel_type': 'Matern', 'length_scale': 1.6713596206534205, 'noise_level': 0.011358090906686994, 'constant_value': 89261.29710897771, 'nu': 1.5}. Best is trial 105 with value: 0.13435422421010806.
[I 2024-12-04 14:55:49,661] Trial 85 finished with value: 1.3007745978764185 and parameters: {'kernel_type': 'Matern', 'length_scale': 76045.6442493771, 'noise_level': 0.3267026952465532, 'constant_value': 34.78656762877787, 'nu': 1.5}. Best is trial 105 with value: 0.13435422421010806.
[I 2024-12-04 14:55:53,114] Trial 97 finished with value: 0.13435434425216722 and parameters: {'kernel_type': 'Matern', 'length_scale': 1403.4415024497519, 'noise_level': 0.5529668790234957, 'constant_value': 38893.588808173954, 'nu': 1.5}. Best is trial 105 with value: 0.13435422421010806.
[I 2024-12-04 14:55:53,186] Trial 95 finished with value: 0.14859828253678095 and parameters: {'kernel_type': 'Matern', 'length_scale': 0.7770692228671158, 'noise_level': 1.0751731625859267e-06, 'constant_value': 0.038260054045118244, 'nu': 2.5}. Best is trial 105 with value: 0.13435422421010806.
[I 2024-12-04 14:55:54,360] Trial 101 finished with value: 0.13435439774516758 and parameters: {'kernel_type': 'Matern', 'length_scale': 0.47336298308014646, 'noise_level': 0.0007863564698042303, 'constant_value': 1.9524878452746568, 'nu': 1.5}. Best is trial 105 with value: 0.13435422421010806.
[I 2024-12-04 14:55:56,883] Trial 100 finished with value: 0.13435439751018335 and parameters: {'kernel_type': 'Matern', 'length_scale': 42.86573795726178, 'noise_level': 0.4936872093122115, 'constant_value': 0.05700035702948345, 'nu': 1.5}. Best is trial 105 with value: 0.13435422421010806.
[I 2024-12-04 14:56:00,063] Trial 108 finished with value: 0.13435433807222275 and parameters: {'kernel_type': 'Matern', 'length_scale': 218.13819460068729, 'noise_level': 0.2378263744170674, 'constant_value': 3144.3714309980046, 'nu': 1.5}. Best is trial 105 with value: 0.13435422421010806.
[I 2024-12-04 14:56:02,033] Trial 99 finished with value: 0.13435439905707566 and parameters: {'kernel_type': 'Matern', 'length_scale': 0.4536062309926948, 'noise_level': 0.0006041959379314642, 'constant_value': 0.0009237866161582135, 'nu': 1.5}. Best is trial 105 with value: 0.13435422421010806.
[I 2024-12-04 14:56:02,038] Trial 103 finished with value: 1.269363502856894 and parameters: {'kernel_type': 'RBF', 'length_scale': 0.008509284172698101, 'noise_level': 7.707102377123928e-05, 'constant_value': 0.020747674134757043, 'nu': 1.5}. Best is trial 105 with value: 0.13435422421010806.
[I 2024-12-04 14:56:04,732] Trial 114 finished with value: 0.1516729715506045 and parameters: {'kernel_type': 'RBF', 'length_scale': 19.429581425148008, 'noise_level': 0.004368816681267999, 'constant_value': 1098.1494532972804, 'nu': 1.5}. Best is trial 105 with value: 0.13435422421010806.
[I 2024-12-04 14:56:05,975] Trial 109 finished with value: 0.17251040312796043 and parameters: {'kernel_type': 'Matern', 'length_scale': 0.3300002509090692, 'noise_level': 0.9925887493008018, 'constant_value': 78.14176935179619, 'nu': 0.5}. Best is trial 105 with value: 0.13435422421010806.
[I 2024-12-04 14:56:06,011] Trial 102 finished with value: 0.1343543301194049 and parameters: {'kernel_type': 'Matern', 'length_scale': 2.8477129320543937, 'noise_level': 0.00269960957688411, 'constant_value': 973.5045932791547, 'nu': 1.5}. Best is trial 105 with value: 0.13435422421010806.
[I 2024-12-04 14:56:06,040] Trial 110 finished with value: 0.13435440460312978 and parameters: {'kernel_type': 'Matern', 'length_scale': 0.6559696336883197, 'noise_level': 0.02497589297057312, 'constant_value': 18871.10676143785, 'nu': 1.5}. Best is trial 105 with value: 0.13435422421010806.
[I 2024-12-04 14:56:06,554] Trial 118 finished with value: 0.13435439978857505 and parameters: {'kernel_type': 'Matern', 'length_scale': 1.6114226864860495, 'noise_level': 0.007725537189097744, 'constant_value': 0.3633110233231519, 'nu': 1.5}. Best is trial 105 with value: 0.13435422421010806.
[I 2024-12-04 14:56:06,571] Trial 104 finished with value: 1.2693635028569819 and parameters: {'kernel_type': 'Matern', 'length_scale': 322.80454749287145, 'noise_level': 8.014821699008381e-09, 'constant_value': 3.0378839513427203e-07, 'nu': 1.5}. Best is trial 105 with value: 0.13435422421010806.
[I 2024-12-04 14:56:08,094] Trial 111 finished with value: 0.13435439434978513 and parameters: {'kernel_type': 'Matern', 'length_scale': 8.91985897614342, 'noise_level': 0.1313803389519156, 'constant_value': 50263.31481880155, 'nu': 1.5}. Best is trial 105 with value: 0.13435422421010806.
[I 2024-12-04 14:56:08,862] Trial 115 finished with value: 0.14859830270549085 and parameters: {'kernel_type': 'Matern', 'length_scale': 5.157444371448783, 'noise_level': 0.0143388481049828, 'constant_value': 0.6338051492672485, 'nu': 2.5}. Best is trial 105 with value: 0.13435422421010806.
[I 2024-12-04 14:56:10,028] Trial 116 finished with value: 0.14859823764913965 and parameters: {'kernel_type': 'Matern', 'length_scale': 4.4883094508685595, 'noise_level': 0.04252415429411212, 'constant_value': 0.9955894901344812, 'nu': 2.5}. Best is trial 105 with value: 0.13435422421010806.
[I 2024-12-04 14:56:15,046] Trial 107 finished with value: 0.13435431243639662 and parameters: {'kernel_type': 'Matern', 'length_scale': 27.15161043129566, 'noise_level': 0.04656365313205152, 'constant_value': 0.017105301095370576, 'nu': 1.5}. Best is trial 105 with value: 0.13435422421010806.
[I 2024-12-04 14:56:17,346] Trial 129 finished with value: 1.2693635028631576 and parameters: {'kernel_type': 'Matern', 'length_scale': 0.0023991926988590163, 'noise_level': 0.0007961720744633279, 'constant_value': 0.032897610926234354, 'nu': 1.5}. Best is trial 105 with value: 0.13435422421010806.
[I 2024-12-04 14:56:17,506] Trial 112 finished with value: 0.13435440875851254 and parameters: {'kernel_type': 'Matern', 'length_scale': 0.3369991502400396, 'noise_level': 2.3129509051492053e-09, 'constant_value': 3.4999266926570326e-05, 'nu': 1.5}. Best is trial 105 with value: 0.13435422421010806.
[I 2024-12-04 14:56:18,898] Trial 120 finished with value: 0.13435439309072505 and parameters: {'kernel_type': 'Matern', 'length_scale': 20.738327173477952, 'noise_level': 3.7356774141406745e-06, 'constant_value': 1801.850790610805, 'nu': 1.5}. Best is trial 105 with value: 0.13435422421010806.
[I 2024-12-04 14:56:19,089] Trial 124 finished with value: 0.13435440163540854 and parameters: {'kernel_type': 'Matern', 'length_scale': 6738.442238081895, 'noise_level': 0.050735745191720076, 'constant_value': 3561.527654985993, 'nu': 1.5}. Best is trial 105 with value: 0.13435422421010806.
[I 2024-12-04 14:56:19,588] Trial 113 finished with value: 0.13435442964147137 and parameters: {'kernel_type': 'Matern', 'length_scale': 0.5254547766236601, 'noise_level': 0.00033160368848135816, 'constant_value': 1.3958059231321636, 'nu': 1.5}. Best is trial 105 with value: 0.13435422421010806.
[I 2024-12-04 14:56:19,631] Trial 125 finished with value: 0.13435442303951625 and parameters: {'kernel_type': 'Matern', 'length_scale': 10.415042581078463, 'noise_level': 0.00048754571249534016, 'constant_value': 4217.410366558544, 'nu': 1.5}. Best is trial 105 with value: 0.13435422421010806.
[I 2024-12-04 14:56:21,199] Trial 121 finished with value: 1.2693635028569688 and parameters: {'kernel_type': 'Matern', 'length_scale': 0.03869451905371295, 'noise_level': 0.0028887768614097534, 'constant_value': 0.00048130548058037634, 'nu': 2.5}. Best is trial 105 with value: 0.13435422421010806.
[I 2024-12-04 14:56:21,205] Trial 122 finished with value: 0.13435440092043785 and parameters: {'kernel_type': 'Matern', 'length_scale': 20.98551783224348, 'noise_level': 0.2739947479130251, 'constant_value': 8299.599332354972, 'nu': 1.5}. Best is trial 105 with value: 0.13435422421010806.
[I 2024-12-04 14:56:21,394] Trial 126 finished with value: 1.2693635028569554 and parameters: {'kernel_type': 'Matern', 'length_scale': 20.43077697494798, 'noise_level': 5.613207289588209e-05, 'constant_value': 0.09537814132648258, 'nu': 1.5}. Best is trial 105 with value: 0.13435422421010806.
[I 2024-12-04 14:56:22,986] Trial 117 finished with value: 1.269363502856974 and parameters: {'kernel_type': 'RBF', 'length_scale': 0.0004027776372102408, 'noise_level': 0.04492225387727125, 'constant_value': 0.00011625756588654384, 'nu': 2.5}. Best is trial 105 with value: 0.13435422421010806.
[I 2024-12-04 14:56:24,157] Trial 131 finished with value: 0.13435438786642412 and parameters: {'kernel_type': 'Matern', 'length_scale': 53.059175342232244, 'noise_level': 0.016527078217122532, 'constant_value': 5.50599877623486, 'nu': 1.5}. Best is trial 105 with value: 0.13435422421010806.
[I 2024-12-04 14:56:25,313] Trial 119 finished with value: 0.1343546775186345 and parameters: {'kernel_type': 'Matern', 'length_scale': 79.85215808423791, 'noise_level': 0.1432012866243178, 'constant_value': 0.061950217649852625, 'nu': 1.5}. Best is trial 105 with value: 0.13435422421010806.
[I 2024-12-04 14:56:25,330] Trial 128 finished with value: 0.13435440368779322 and parameters: {'kernel_type': 'Matern', 'length_scale': 38.21681202158726, 'noise_level': 0.26202234068459146, 'constant_value': 30417.108257486772, 'nu': 1.5}. Best is trial 105 with value: 0.13435422421010806.
[I 2024-12-04 14:56:26,479] Trial 127 finished with value: 0.1343544797492834 and parameters: {'kernel_type': 'Matern', 'length_scale': 1602.4865341897748, 'noise_level': 0.3585666360673509, 'constant_value': 86633.77680573986, 'nu': 1.5}. Best is trial 105 with value: 0.13435422421010806.
[I 2024-12-04 14:56:26,566] Trial 133 finished with value: 1.3007745979657548 and parameters: {'kernel_type': 'Matern', 'length_scale': 11.219999300578255, 'noise_level': 5.295412161082018e-06, 'constant_value': 5842.573612519236, 'nu': 1.5}. Best is trial 105 with value: 0.13435422421010806.
[I 2024-12-04 14:56:27,470] Trial 123 finished with value: 0.17251040542997567 and parameters: {'kernel_type': 'Matern', 'length_scale': 8089.698128453875, 'noise_level': 0.9264213696394448, 'constant_value': 4423.512657877948, 'nu': 0.5}. Best is trial 105 with value: 0.13435422421010806.
[I 2024-12-04 14:56:28,564] Trial 132 finished with value: 1.269363502856159 and parameters: {'kernel_type': 'RBF', 'length_scale': 3337.5891668560625, 'noise_level': 2.755820108814042e-10, 'constant_value': 14.102368726946962, 'nu': 2.5}. Best is trial 105 with value: 0.13435422421010806.
[I 2024-12-04 14:56:29,307] Trial 136 finished with value: 0.13435437684261925 and parameters: {'kernel_type': 'Matern', 'length_scale': 127.23292919928355, 'noise_level': 1.949231464587761e-07, 'constant_value': 1895.139121670796, 'nu': 1.5}. Best is trial 105 with value: 0.13435422421010806.
[I 2024-12-04 14:56:32,201] Trial 135 finished with value: 1.2693635028374048 and parameters: {'kernel_type': 'Matern', 'length_scale': 5780.89312963705, 'noise_level': 2.3331865604113417e-08, 'constant_value': 6134.747817952151, 'nu': 1.5}. Best is trial 105 with value: 0.13435422421010806.
[I 2024-12-04 14:56:32,552] Trial 138 finished with value: 0.15167297614506625 and parameters: {'kernel_type': 'RBF', 'length_scale': 54.69629936386958, 'noise_level': 0.32292265212866733, 'constant_value': 8.251724259670894, 'nu': 1.5}. Best is trial 105 with value: 0.13435422421010806.
[I 2024-12-04 14:56:32,554] Trial 130 finished with value: 0.15167297676236627 and parameters: {'kernel_type': 'RBF', 'length_scale': 0.41892988563256994, 'noise_level': 1.617323113016793e-10, 'constant_value': 74611.18167508698, 'nu': 2.5}. Best is trial 105 with value: 0.13435422421010806.
[I 2024-12-04 14:56:33,941] Trial 140 finished with value: 0.14859826869308332 and parameters: {'kernel_type': 'Matern', 'length_scale': 4.006298819673722, 'noise_level': 2.0014979171512296e-10, 'constant_value': 14.048965006754615, 'nu': 2.5}. Best is trial 105 with value: 0.13435422421010806.
[I 2024-12-04 14:56:34,225] Trial 146 finished with value: 1.3007739235930502 and parameters: {'kernel_type': 'RBF', 'length_scale': 0.006119816999475617, 'noise_level': 1.8709488421035222e-08, 'constant_value': 73529.36940739412, 'nu': 1.5}. Best is trial 105 with value: 0.13435422421010806.
[I 2024-12-04 14:56:34,403] Trial 141 finished with value: 0.1343544958342381 and parameters: {'kernel_type': 'Matern', 'length_scale': 2.211135839817496, 'noise_level': 0.11172859031242585, 'constant_value': 0.0011014966868750408, 'nu': 1.5}. Best is trial 105 with value: 0.13435422421010806.
[I 2024-12-04 14:56:34,404] Trial 142 finished with value: 0.13435440906039606 and parameters: {'kernel_type': 'Matern', 'length_scale': 0.36222231910412617, 'noise_level': 0.0004624157279961504, 'constant_value': 20795.186506792146, 'nu': 1.5}. Best is trial 105 with value: 0.13435422421010806.
[I 2024-12-04 14:56:35,687] Trial 139 finished with value: 0.17251039772003163 and parameters: {'kernel_type': 'Matern', 'length_scale': 192.43243685029162, 'noise_level': 1.8534925658629882e-06, 'constant_value': 2808.5303519749114, 'nu': 0.5}. Best is trial 105 with value: 0.13435422421010806.
[I 2024-12-04 14:56:35,966] Trial 137 finished with value: 0.13435440123833234 and parameters: {'kernel_type': 'Matern', 'length_scale': 0.29087175679064886, 'noise_level': 0.005933506073786195, 'constant_value': 59507.11419754395, 'nu': 1.5}. Best is trial 105 with value: 0.13435422421010806.
[I 2024-12-04 14:56:37,258] Trial 143 finished with value: 0.13435440687125674 and parameters: {'kernel_type': 'Matern', 'length_scale': 18.162197422158172, 'noise_level': 0.02396591621103967, 'constant_value': 210.07285237749252, 'nu': 1.5}. Best is trial 105 with value: 0.13435422421010806.
[I 2024-12-04 14:56:41,237] Trial 156 finished with value: 1.300774597869345 and parameters: {'kernel_type': 'Matern', 'length_scale': 1.7425700456678626, 'noise_level': 1.0543348191791593e-07, 'constant_value': 51702.56250006398, 'nu': 1.5}. Best is trial 105 with value: 0.13435422421010806.
[I 2024-12-04 14:56:45,734] Trial 144 finished with value: 1.2693635028573023 and parameters: {'kernel_type': 'Matern', 'length_scale': 77.96726734831446, 'noise_level': 1.976389868141245e-05, 'constant_value': 0.00018554134363668275, 'nu': 1.5}. Best is trial 105 with value: 0.13435422421010806.
[I 2024-12-04 14:56:47,146] Trial 145 finished with value: 0.1343543344348458 and parameters: {'kernel_type': 'Matern', 'length_scale': 48.84178368594049, 'noise_level': 0.9744644604553105, 'constant_value': 3749.404301178777, 'nu': 1.5}. Best is trial 105 with value: 0.13435422421010806.
[I 2024-12-04 14:56:48,939] Trial 159 finished with value: 1.2693635028569394 and parameters: {'kernel_type': 'Matern', 'length_scale': 3.542075091695628e-05, 'noise_level': 3.862598793382859e-09, 'constant_value': 22.869324377047914, 'nu': 0.5}. Best is trial 105 with value: 0.13435422421010806.
[I 2024-12-04 14:56:48,946] Trial 158 finished with value: 1.269363502850115 and parameters: {'kernel_type': 'Matern', 'length_scale': 1.1865486381799129e-05, 'noise_level': 0.01372068634816006, 'constant_value': 254.8462128029309, 'nu': 0.5}. Best is trial 105 with value: 0.13435422421010806.
