[I 2024-12-04 14:47:59,065] Trial 153 finished with value: 0.4204035019299797 and parameters: {'n_estimators': 349, 'max_depth': 40, 'min_samples_split': 2, 'min_samples_leaf': 1, 'max_features': None, 'bootstrap': True, 'criterion': 'squared_error'}. Best is trial 122 with value: 0.41989619919923427.
[I 2024-12-04 14:47:59,646] Trial 120 finished with value: 0.46710240490242944 and parameters: {'n_estimators': 477, 'max_depth': 31, 'min_samples_split': 8, 'min_samples_leaf': 2, 'max_features': None, 'bootstrap': True, 'criterion': 'absolute_error'}. Best is trial 122 with value: 0.41989619919923427.
[I 2024-12-04 14:48:00,181] Trial 150 finished with value: 0.42180232690373926 and parameters: {'n_estimators': 638, 'max_depth': 34, 'min_samples_split': 2, 'min_samples_leaf': 1, 'max_features': None, 'bootstrap': True, 'criterion': 'squared_error'}. Best is trial 122 with value: 0.41989619919923427.
[I 2024-12-04 14:48:02,213] Trial 147 finished with value: 0.4274462485860114 and parameters: {'n_estimators': 531, 'max_depth': 45, 'min_samples_split': 3, 'min_samples_leaf': 1, 'max_features': None, 'bootstrap': True, 'criterion': 'squared_error'}. Best is trial 122 with value: 0.41989619919923427.
[I 2024-12-04 14:48:02,790] Trial 145 finished with value: 0.5876235210275238 and parameters: {'n_estimators': 965, 'max_depth': 26, 'min_samples_split': 2, 'min_samples_leaf': 1, 'max_features': 'sqrt', 'bootstrap': True, 'criterion': 'squared_error'}. Best is trial 122 with value: 0.41989619919923427.
[I 2024-12-04 14:48:03,898] Trial 142 finished with value: 0.42278744880375385 and parameters: {'n_estimators': 835, 'max_depth': 30, 'min_samples_split': 2, 'min_samples_leaf': 1, 'max_features': None, 'bootstrap': True, 'criterion': 'squared_error'}. Best is trial 122 with value: 0.41989619919923427.
[I 2024-12-04 14:48:06,389] Trial 151 finished with value: 0.4664462729443238 and parameters: {'n_estimators': 450, 'max_depth': 50, 'min_samples_split': 2, 'min_samples_leaf': 2, 'max_features': None, 'bootstrap': True, 'criterion': 'squared_error'}. Best is trial 122 with value: 0.41989619919923427.
[I 2024-12-04 14:48:07,948] Trial 155 finished with value: 0.42292936773568424 and parameters: {'n_estimators': 375, 'max_depth': 39, 'min_samples_split': 2, 'min_samples_leaf': 1, 'max_features': None, 'bootstrap': True, 'criterion': 'squared_error'}. Best is trial 122 with value: 0.41989619919923427.
[I 2024-12-04 14:48:08,133] Trial 152 finished with value: 0.42473554265140817 and parameters: {'n_estimators': 538, 'max_depth': 50, 'min_samples_split': 2, 'min_samples_leaf': 1, 'max_features': None, 'bootstrap': True, 'criterion': 'squared_error'}. Best is trial 122 with value: 0.41989619919923427.
[I 2024-12-04 14:48:08,415] Trial 161 finished with value: 0.42005440553678586 and parameters: {'n_estimators': 257, 'max_depth': 41, 'min_samples_split': 2, 'min_samples_leaf': 1, 'max_features': None, 'bootstrap': True, 'criterion': 'squared_error'}. Best is trial 122 with value: 0.41989619919923427.
[I 2024-12-04 14:48:08,418] Trial 159 finished with value: 0.7260802929261818 and parameters: {'n_estimators': 304, 'max_depth': 43, 'min_samples_split': 15, 'min_samples_leaf': 10, 'max_features': None, 'bootstrap': False, 'criterion': 'absolute_error'}. Best is trial 122 with value: 0.41989619919923427.
[I 2024-12-04 14:48:08,468] Trial 156 finished with value: 0.520074528288815 and parameters: {'n_estimators': 744, 'max_depth': 50, 'min_samples_split': 4, 'min_samples_leaf': 1, 'max_features': None, 'bootstrap': False, 'criterion': 'squared_error'}. Best is trial 122 with value: 0.41989619919923427.
[I 2024-12-04 14:48:13,520] Trial 157 finished with value: 0.4216779641272497 and parameters: {'n_estimators': 520, 'max_depth': 40, 'min_samples_split': 2, 'min_samples_leaf': 1, 'max_features': None, 'bootstrap': True, 'criterion': 'squared_error'}. Best is trial 122 with value: 0.41989619919923427.
[I 2024-12-04 14:48:13,691] Trial 154 finished with value: 0.46518933799057127 and parameters: {'n_estimators': 761, 'max_depth': 46, 'min_samples_split': 3, 'min_samples_leaf': 2, 'max_features': None, 'bootstrap': True, 'criterion': 'squared_error'}. Best is trial 122 with value: 0.41989619919923427.
[I 2024-12-04 14:48:14,426] Trial 162 finished with value: 1.0703918377589257 and parameters: {'n_estimators': 916, 'max_depth': 24, 'min_samples_split': 8, 'min_samples_leaf': 12, 'max_features': 'log2', 'bootstrap': True, 'criterion': 'squared_error'}. Best is trial 122 with value: 0.41989619919923427.
[I 2024-12-04 14:48:18,172] Trial 160 finished with value: 0.9659942682195589 and parameters: {'n_estimators': 671, 'max_depth': 21, 'min_samples_split': 12, 'min_samples_leaf': 2, 'max_features': 'log2', 'bootstrap': True, 'criterion': 'squared_error'}. Best is trial 122 with value: 0.41989619919923427.
[I 2024-12-04 14:48:21,156] Trial 169 finished with value: 0.4246262859761467 and parameters: {'n_estimators': 521, 'max_depth': 33, 'min_samples_split': 2, 'min_samples_leaf': 1, 'max_features': None, 'bootstrap': True, 'criterion': 'squared_error'}. Best is trial 122 with value: 0.41989619919923427.
[I 2024-12-04 14:48:22,757] Trial 163 finished with value: 0.5570387691894074 and parameters: {'n_estimators': 983, 'max_depth': 14, 'min_samples_split': 33, 'min_samples_leaf': 3, 'max_features': None, 'bootstrap': True, 'criterion': 'squared_error'}. Best is trial 122 with value: 0.41989619919923427.
[I 2024-12-04 14:48:23,015] Trial 158 finished with value: 0.4208622492554816 and parameters: {'n_estimators': 732, 'max_depth': 48, 'min_samples_split': 2, 'min_samples_leaf': 1, 'max_features': None, 'bootstrap': True, 'criterion': 'squared_error'}. Best is trial 122 with value: 0.41989619919923427.
[I 2024-12-04 14:48:24,865] Trial 173 finished with value: 0.9291109130305912 and parameters: {'n_estimators': 919, 'max_depth': 44, 'min_samples_split': 2, 'min_samples_leaf': 8, 'max_features': 'sqrt', 'bootstrap': False, 'criterion': 'squared_error'}. Best is trial 164 with value: 0.4195097393669946.
[I 2024-12-04 14:48:25,354] Trial 167 finished with value: 0.4647862800358779 and parameters: {'n_estimators': 642, 'max_depth': 28, 'min_samples_split': 2, 'min_samples_leaf': 2, 'max_features': None, 'bootstrap': True, 'criterion': 'squared_error'}. Best is trial 164 with value: 0.4195097393669946.
[I 2024-12-04 14:48:26,624] Trial 164 finished with value: 0.4195097393669946 and parameters: {'n_estimators': 924, 'max_depth': 41, 'min_samples_split': 2, 'min_samples_leaf': 1, 'max_features': None, 'bootstrap': True, 'criterion': 'squared_error'}. Best is trial 164 with value: 0.4195097393669946.
[I 2024-12-04 14:48:31,838] Trial 178 finished with value: 1.0293840223129866 and parameters: {'n_estimators': 347, 'max_depth': 6, 'min_samples_split': 6, 'min_samples_leaf': 13, 'max_features': 'sqrt', 'bootstrap': True, 'criterion': 'absolute_error'}. Best is trial 164 with value: 0.4195097393669946.
[I 2024-12-04 14:48:32,830] Trial 171 finished with value: 0.4230217392790767 and parameters: {'n_estimators': 495, 'max_depth': 42, 'min_samples_split': 2, 'min_samples_leaf': 1, 'max_features': None, 'bootstrap': True, 'criterion': 'squared_error'}. Best is trial 164 with value: 0.4195097393669946.
[I 2024-12-04 14:48:33,101] Trial 168 finished with value: 0.42622228696570774 and parameters: {'n_estimators': 757, 'max_depth': 31, 'min_samples_split': 3, 'min_samples_leaf': 1, 'max_features': None, 'bootstrap': True, 'criterion': 'squared_error'}. Best is trial 164 with value: 0.4195097393669946.
[I 2024-12-04 14:48:33,476] Trial 177 finished with value: 0.4666499080743359 and parameters: {'n_estimators': 403, 'max_depth': 36, 'min_samples_split': 2, 'min_samples_leaf': 2, 'max_features': None, 'bootstrap': True, 'criterion': 'squared_error'}. Best is trial 164 with value: 0.4195097393669946.
[I 2024-12-04 14:48:33,603] Trial 99 finished with value: 0.4292019096728953 and parameters: {'n_estimators': 719, 'max_depth': 38, 'min_samples_split': 3, 'min_samples_leaf': 1, 'max_features': None, 'bootstrap': True, 'criterion': 'absolute_error'}. Best is trial 164 with value: 0.4195097393669946.
[I 2024-12-04 14:48:33,730] Trial 170 finished with value: 0.4230543111061543 and parameters: {'n_estimators': 769, 'max_depth': 28, 'min_samples_split': 2, 'min_samples_leaf': 1, 'max_features': None, 'bootstrap': True, 'criterion': 'squared_error'}. Best is trial 164 with value: 0.4195097393669946.
[I 2024-12-04 14:48:37,119] Trial 166 finished with value: 0.46585077853851087 and parameters: {'n_estimators': 962, 'max_depth': 26, 'min_samples_split': 2, 'min_samples_leaf': 2, 'max_features': None, 'bootstrap': True, 'criterion': 'squared_error'}. Best is trial 164 with value: 0.4195097393669946.
[I 2024-12-04 14:48:38,015] Trial 165 finished with value: 0.7957762250000073 and parameters: {'n_estimators': 990, 'max_depth': 23, 'min_samples_split': 2, 'min_samples_leaf': 1, 'max_features': 'log2', 'bootstrap': True, 'criterion': 'absolute_error'}. Best is trial 164 with value: 0.4195097393669946.
[I 2024-12-04 14:48:38,060] Trial 180 finished with value: 0.422214428149586 and parameters: {'n_estimators': 431, 'max_depth': 42, 'min_samples_split': 2, 'min_samples_leaf': 1, 'max_features': None, 'bootstrap': True, 'criterion': 'squared_error'}. Best is trial 164 with value: 0.4195097393669946.
[I 2024-12-04 14:48:39,609] Trial 183 finished with value: 0.9582333443790606 and parameters: {'n_estimators': 835, 'max_depth': 27, 'min_samples_split': 3, 'min_samples_leaf': 2, 'max_features': 'log2', 'bootstrap': True, 'criterion': 'squared_error'}. Best is trial 164 with value: 0.4195097393669946.
[I 2024-12-04 14:48:41,154] Trial 176 finished with value: 0.9768918920489997 and parameters: {'n_estimators': 986, 'max_depth': 22, 'min_samples_split': 8, 'min_samples_leaf': 3, 'max_features': 'log2', 'bootstrap': False, 'criterion': 'absolute_error'}. Best is trial 164 with value: 0.4195097393669946.
[I 2024-12-04 14:48:47,769] Trial 179 finished with value: 0.4211166480298714 and parameters: {'n_estimators': 695, 'max_depth': 38, 'min_samples_split': 2, 'min_samples_leaf': 1, 'max_features': None, 'bootstrap': True, 'criterion': 'squared_error'}. Best is trial 164 with value: 0.4195097393669946.
[I 2024-12-04 14:48:51,029] Trial 189 finished with value: 1.054202704187009 and parameters: {'n_estimators': 788, 'max_depth': 50, 'min_samples_split': 20, 'min_samples_leaf': 11, 'max_features': 'log2', 'bootstrap': False, 'criterion': 'absolute_error'}. Best is trial 164 with value: 0.4195097393669946.
[I 2024-12-04 14:48:51,684] Trial 186 finished with value: 0.42298114774540435 and parameters: {'n_estimators': 501, 'max_depth': 42, 'min_samples_split': 2, 'min_samples_leaf': 1, 'max_features': None, 'bootstrap': True, 'criterion': 'squared_error'}. Best is trial 164 with value: 0.4195097393669946.
[I 2024-12-04 14:48:51,714] Trial 181 finished with value: 0.7581748530819405 and parameters: {'n_estimators': 704, 'max_depth': 24, 'min_samples_split': 2, 'min_samples_leaf': 1, 'max_features': 'log2', 'bootstrap': False, 'criterion': 'squared_error'}. Best is trial 164 with value: 0.4195097393669946.
[I 2024-12-04 14:48:56,493] Trial 190 finished with value: 0.4203507589263528 and parameters: {'n_estimators': 399, 'max_depth': 41, 'min_samples_split': 2, 'min_samples_leaf': 1, 'max_features': None, 'bootstrap': True, 'criterion': 'squared_error'}. Best is trial 164 with value: 0.4195097393669946.
[I 2024-12-04 14:48:57,866] Trial 174 finished with value: 0.4218358485043496 and parameters: {'n_estimators': 766, 'max_depth': 50, 'min_samples_split': 2, 'min_samples_leaf': 1, 'max_features': None, 'bootstrap': True, 'criterion': 'squared_error'}. Best is trial 164 with value: 0.4195097393669946.
[I 2024-12-04 14:48:59,982] Trial 187 finished with value: 0.4226536465991796 and parameters: {'n_estimators': 669, 'max_depth': 32, 'min_samples_split': 2, 'min_samples_leaf': 1, 'max_features': None, 'bootstrap': True, 'criterion': 'squared_error'}. Best is trial 164 with value: 0.4195097393669946.
[I 2024-12-04 14:49:03,644] Trial 184 finished with value: 0.42184251909224074 and parameters: {'n_estimators': 814, 'max_depth': 50, 'min_samples_split': 2, 'min_samples_leaf': 1, 'max_features': None, 'bootstrap': True, 'criterion': 'squared_error'}. Best is trial 164 with value: 0.4195097393669946.
[I 2024-12-04 14:49:06,025] Trial 192 finished with value: 0.5062412607198462 and parameters: {'n_estimators': 805, 'max_depth': 43, 'min_samples_split': 3, 'min_samples_leaf': 1, 'max_features': 'sqrt', 'bootstrap': True, 'criterion': 'squared_error'}. Best is trial 164 with value: 0.4195097393669946.
[I 2024-12-04 14:49:06,065] Trial 202 finished with value: 0.7672301694456272 and parameters: {'n_estimators': 964, 'max_depth': 13, 'min_samples_split': 23, 'min_samples_leaf': 1, 'max_features': 'sqrt', 'bootstrap': False, 'criterion': 'squared_error'}. Best is trial 164 with value: 0.4195097393669946.
[I 2024-12-04 14:49:09,901] Trial 200 finished with value: 0.6136138703561328 and parameters: {'n_estimators': 462, 'max_depth': 50, 'min_samples_split': 2, 'min_samples_leaf': 2, 'max_features': None, 'bootstrap': False, 'criterion': 'squared_error'}. Best is trial 164 with value: 0.4195097393669946.
[I 2024-12-04 14:49:09,939] Trial 197 finished with value: 0.42333317089863376 and parameters: {'n_estimators': 365, 'max_depth': 34, 'min_samples_split': 2, 'min_samples_leaf': 1, 'max_features': None, 'bootstrap': True, 'criterion': 'squared_error'}. Best is trial 164 with value: 0.4195097393669946.
[I 2024-12-04 14:49:10,610] Trial 201 finished with value: 0.621404490531212 and parameters: {'n_estimators': 468, 'max_depth': 41, 'min_samples_split': 2, 'min_samples_leaf': 1, 'max_features': 'log2', 'bootstrap': True, 'criterion': 'squared_error'}. Best is trial 164 with value: 0.4195097393669946.
[I 2024-12-04 14:49:12,738] Trial 182 finished with value: 0.4240976371442264 and parameters: {'n_estimators': 966, 'max_depth': 37, 'min_samples_split': 3, 'min_samples_leaf': 1, 'max_features': None, 'bootstrap': True, 'criterion': 'squared_error'}. Best is trial 164 with value: 0.4195097393669946.
[I 2024-12-04 14:49:14,389] Trial 198 finished with value: 0.9834023077428365 and parameters: {'n_estimators': 798, 'max_depth': 42, 'min_samples_split': 5, 'min_samples_leaf': 7, 'max_features': 'sqrt', 'bootstrap': True, 'criterion': 'absolute_error'}. Best is trial 164 with value: 0.4195097393669946.
[I 2024-12-04 14:49:15,045] Trial 175 finished with value: 0.43459496504656697 and parameters: {'n_estimators': 477, 'max_depth': 32, 'min_samples_split': 2, 'min_samples_leaf': 1, 'max_features': None, 'bootstrap': True, 'criterion': 'absolute_error'}. Best is trial 164 with value: 0.4195097393669946.
[I 2024-12-04 14:49:15,228] Trial 148 finished with value: 0.4275345074397422 and parameters: {'n_estimators': 651, 'max_depth': 50, 'min_samples_split': 2, 'min_samples_leaf': 1, 'max_features': None, 'bootstrap': True, 'criterion': 'absolute_error'}. Best is trial 164 with value: 0.4195097393669946.
[I 2024-12-04 14:49:15,917] Trial 195 finished with value: 0.42107949980041126 and parameters: {'n_estimators': 568, 'max_depth': 41, 'min_samples_split': 2, 'min_samples_leaf': 1, 'max_features': None, 'bootstrap': True, 'criterion': 'squared_error'}. Best is trial 164 with value: 0.4195097393669946.
[I 2024-12-04 14:49:16,156] Trial 203 finished with value: 0.46856793564786164 and parameters: {'n_estimators': 311, 'max_depth': 43, 'min_samples_split': 2, 'min_samples_leaf': 2, 'max_features': None, 'bootstrap': True, 'criterion': 'squared_error'}. Best is trial 164 with value: 0.4195097393669946.
[I 2024-12-04 14:49:17,843] Trial 188 finished with value: 0.42111072275132494 and parameters: {'n_estimators': 947, 'max_depth': 37, 'min_samples_split': 2, 'min_samples_leaf': 1, 'max_features': None, 'bootstrap': True, 'criterion': 'squared_error'}. Best is trial 164 with value: 0.4195097393669946.
[I 2024-12-04 14:49:18,552] Trial 193 finished with value: 0.4343116744608967 and parameters: {'n_estimators': 715, 'max_depth': 45, 'min_samples_split': 5, 'min_samples_leaf': 1, 'max_features': None, 'bootstrap': True, 'criterion': 'squared_error'}. Best is trial 164 with value: 0.4195097393669946.
[I 2024-12-04 14:49:19,709] Trial 196 finished with value: 0.4233609567676394 and parameters: {'n_estimators': 594, 'max_depth': 44, 'min_samples_split': 2, 'min_samples_leaf': 1, 'max_features': None, 'bootstrap': True, 'criterion': 'squared_error'}. Best is trial 164 with value: 0.4195097393669946.
[I 2024-12-04 14:49:21,711] Trial 194 finished with value: 0.4194559540623761 and parameters: {'n_estimators': 779, 'max_depth': 39, 'min_samples_split': 2, 'min_samples_leaf': 1, 'max_features': None, 'bootstrap': True, 'criterion': 'squared_error'}. Best is trial 194 with value: 0.4194559540623761.
[I 2024-12-04 14:49:23,261] Trial 199 finished with value: 0.43181992626732024 and parameters: {'n_estimators': 643, 'max_depth': 41, 'min_samples_split': 4, 'min_samples_leaf': 1, 'max_features': None, 'bootstrap': True, 'criterion': 'squared_error'}. Best is trial 194 with value: 0.4194559540623761.
[I 2024-12-04 14:49:23,367] Trial 205 finished with value: 0.4221137374981139 and parameters: {'n_estimators': 436, 'max_depth': 42, 'min_samples_split': 2, 'min_samples_leaf': 1, 'max_features': None, 'bootstrap': True, 'criterion': 'squared_error'}. Best is trial 194 with value: 0.4194559540623761.
[I 2024-12-04 14:49:23,501] Trial 214 finished with value: 0.6795352217627925 and parameters: {'n_estimators': 158, 'max_depth': 14, 'min_samples_split': 49, 'min_samples_leaf': 9, 'max_features': None, 'bootstrap': True, 'criterion': 'squared_error'}. Best is trial 194 with value: 0.4194559540623761.
[I 2024-12-04 14:49:23,517] Trial 185 finished with value: 0.428560959291647 and parameters: {'n_estimators': 357, 'max_depth': 47, 'min_samples_split': 2, 'min_samples_leaf': 1, 'max_features': None, 'bootstrap': True, 'criterion': 'absolute_error'}. Best is trial 194 with value: 0.4194559540623761.
[I 2024-12-04 14:49:28,564] Trial 172 finished with value: 0.5568662549499742 and parameters: {'n_estimators': 421, 'max_depth': 31, 'min_samples_split': 2, 'min_samples_leaf': 1, 'max_features': None, 'bootstrap': False, 'criterion': 'absolute_error'}. Best is trial 194 with value: 0.4194559540623761.
[I 2024-12-04 14:49:29,961] Trial 217 finished with value: 1.066569988968526 and parameters: {'n_estimators': 465, 'max_depth': 11, 'min_samples_split': 47, 'min_samples_leaf': 8, 'max_features': 'log2', 'bootstrap': True, 'criterion': 'squared_error'}. Best is trial 194 with value: 0.4194559540623761.
[I 2024-12-04 14:49:32,121] Trial 216 finished with value: 0.5811040982329893 and parameters: {'n_estimators': 400, 'max_depth': 20, 'min_samples_split': 9, 'min_samples_leaf': 2, 'max_features': None, 'bootstrap': False, 'criterion': 'squared_error'}. Best is trial 194 with value: 0.4194559540623761.
[I 2024-12-04 14:49:33,731] Trial 221 finished with value: 1.043951474052195 and parameters: {'n_estimators': 598, 'max_depth': 16, 'min_samples_split': 10, 'min_samples_leaf': 7, 'max_features': 'log2', 'bootstrap': False, 'criterion': 'absolute_error'}. Best is trial 194 with value: 0.4194559540623761.
[I 2024-12-04 14:49:33,939] Trial 218 finished with value: 1.0056513609286637 and parameters: {'n_estimators': 801, 'max_depth': 24, 'min_samples_split': 19, 'min_samples_leaf': 15, 'max_features': 'sqrt', 'bootstrap': False, 'criterion': 'absolute_error'}. Best is trial 194 with value: 0.4194559540623761.
[I 2024-12-04 14:49:43,976] Trial 206 finished with value: 0.42120579218802456 and parameters: {'n_estimators': 840, 'max_depth': 47, 'min_samples_split': 2, 'min_samples_leaf': 1, 'max_features': None, 'bootstrap': True, 'criterion': 'squared_error'}. Best is trial 194 with value: 0.4194559540623761.
[I 2024-12-04 14:49:46,165] Trial 208 finished with value: 0.4205027133574142 and parameters: {'n_estimators': 767, 'max_depth': 48, 'min_samples_split': 2, 'min_samples_leaf': 1, 'max_features': None, 'bootstrap': True, 'criterion': 'squared_error'}. Best is trial 194 with value: 0.4194559540623761.
[I 2024-12-04 14:49:47,828] Trial 212 finished with value: 0.46549870497236223 and parameters: {'n_estimators': 801, 'max_depth': 46, 'min_samples_split': 2, 'min_samples_leaf': 2, 'max_features': None, 'bootstrap': True, 'criterion': 'squared_error'}. Best is trial 194 with value: 0.4194559540623761.
[I 2024-12-04 14:49:48,837] Trial 228 finished with value: 0.500922117403635 and parameters: {'n_estimators': 877, 'max_depth': 38, 'min_samples_split': 3, 'min_samples_leaf': 1, 'max_features': 'sqrt', 'bootstrap': False, 'criterion': 'squared_error'}. Best is trial 194 with value: 0.4194559540623761.
[I 2024-12-04 14:49:48,854] Trial 213 finished with value: 0.4221236730616941 and parameters: {'n_estimators': 665, 'max_depth': 42, 'min_samples_split': 2, 'min_samples_leaf': 1, 'max_features': None, 'bootstrap': True, 'criterion': 'squared_error'}. Best is trial 194 with value: 0.4194559540623761.
[I 2024-12-04 14:49:49,926] Trial 210 finished with value: 0.422169211527965 and parameters: {'n_estimators': 791, 'max_depth': 50, 'min_samples_split': 2, 'min_samples_leaf': 1, 'max_features': None, 'bootstrap': True, 'criterion': 'squared_error'}. Best is trial 194 with value: 0.4194559540623761.
[I 2024-12-04 14:49:53,907] Trial 209 finished with value: 0.4240520652692302 and parameters: {'n_estimators': 864, 'max_depth': 50, 'min_samples_split': 3, 'min_samples_leaf': 1, 'max_features': None, 'bootstrap': True, 'criterion': 'squared_error'}. Best is trial 194 with value: 0.4194559540623761.
