[I 2024-12-04 12:16:09,768] Trial 71 finished with value: 0.40413131087635407 and parameters: {'n_estimators': 319, 'learning_rate': 0.0712273499421677, 'max_depth': 11, 'min_samples_split': 5, 'min_samples_leaf': 3, 'subsample': 0.603214807112048, 'max_features': None}. Best is trial 16 with value: 0.24131607807430555.
[I 2024-12-04 12:16:10,167] Trial 42 finished with value: 0.4290673580306256 and parameters: {'n_estimators': 1430, 'learning_rate': 0.03061503991378518, 'max_depth': 4, 'min_samples_split': 5, 'min_samples_leaf': 7, 'subsample': 0.6978658240681248, 'max_features': None}. Best is trial 16 with value: 0.24131607807430555.
[I 2024-12-04 12:16:13,235] Trial 81 finished with value: 0.34941032299633973 and parameters: {'n_estimators': 307, 'learning_rate': 0.056913114767417367, 'max_depth': 6, 'min_samples_split': 7, 'min_samples_leaf': 1, 'subsample': 0.6673527838642578, 'max_features': 'sqrt'}. Best is trial 16 with value: 0.24131607807430555.
[I 2024-12-04 12:16:14,381] Trial 70 finished with value: 0.7773964485549675 and parameters: {'n_estimators': 289, 'learning_rate': 0.06601943454285611, 'max_depth': 5, 'min_samples_split': 20, 'min_samples_leaf': 4, 'subsample': 0.7941711370858968, 'max_features': 'log2'}. Best is trial 16 with value: 0.24131607807430555.
[I 2024-12-04 12:16:16,666] Trial 66 finished with value: 0.30998595638667176 and parameters: {'n_estimators': 759, 'learning_rate': 0.07357898246358203, 'max_depth': 8, 'min_samples_split': 7, 'min_samples_leaf': 1, 'subsample': 0.7165367082409775, 'max_features': None}. Best is trial 16 with value: 0.24131607807430555.
[I 2024-12-04 12:16:18,042] Trial 69 finished with value: 0.35736043550093655 and parameters: {'n_estimators': 1197, 'learning_rate': 0.05161910919758108, 'max_depth': 10, 'min_samples_split': 11, 'min_samples_leaf': 3, 'subsample': 0.6177960260924245, 'max_features': 'sqrt'}. Best is trial 16 with value: 0.24131607807430555.
[I 2024-12-04 12:16:18,854] Trial 77 finished with value: 0.3765787620567336 and parameters: {'n_estimators': 411, 'learning_rate': 0.09784085354549975, 'max_depth': 4, 'min_samples_split': 19, 'min_samples_leaf': 3, 'subsample': 0.9039330584456076, 'max_features': None}. Best is trial 16 with value: 0.24131607807430555.
[I 2024-12-04 12:16:19,818] Trial 76 finished with value: 0.3277310512680559 and parameters: {'n_estimators': 599, 'learning_rate': 0.033698116904362634, 'max_depth': 4, 'min_samples_split': 14, 'min_samples_leaf': 2, 'subsample': 0.7260657252316778, 'max_features': None}. Best is trial 16 with value: 0.24131607807430555.
[I 2024-12-04 12:16:20,100] Trial 82 finished with value: 0.2817654037393957 and parameters: {'n_estimators': 324, 'learning_rate': 0.09972390716332521, 'max_depth': 8, 'min_samples_split': 8, 'min_samples_leaf': 2, 'subsample': 0.7504421940749056, 'max_features': 'sqrt'}. Best is trial 16 with value: 0.24131607807430555.
[I 2024-12-04 12:16:20,362] Trial 75 finished with value: 0.3244591546486922 and parameters: {'n_estimators': 501, 'learning_rate': 0.087294752225778, 'max_depth': 5, 'min_samples_split': 13, 'min_samples_leaf': 2, 'subsample': 0.9304330012724641, 'max_features': None}. Best is trial 16 with value: 0.24131607807430555.
[I 2024-12-04 12:16:23,149] Trial 83 finished with value: 0.4563817595802228 and parameters: {'n_estimators': 195, 'learning_rate': 0.07106312957146571, 'max_depth': 4, 'min_samples_split': 13, 'min_samples_leaf': 4, 'subsample': 0.8111974000620943, 'max_features': 'sqrt'}. Best is trial 16 with value: 0.24131607807430555.
[I 2024-12-04 12:16:27,487] Trial 93 finished with value: 0.6287265298745419 and parameters: {'n_estimators': 295, 'learning_rate': 0.08132176497081631, 'max_depth': 4, 'min_samples_split': 9, 'min_samples_leaf': 2, 'subsample': 0.6561783854120345, 'max_features': 'log2'}. Best is trial 16 with value: 0.24131607807430555.
[I 2024-12-04 12:16:31,453] Trial 95 finished with value: 0.32277260985066125 and parameters: {'n_estimators': 199, 'learning_rate': 0.096100352365594, 'max_depth': 8, 'min_samples_split': 3, 'min_samples_leaf': 1, 'subsample': 0.7308304807140618, 'max_features': 'sqrt'}. Best is trial 16 with value: 0.24131607807430555.
[I 2024-12-04 12:16:31,642] Trial 98 finished with value: 0.2764159619136238 and parameters: {'n_estimators': 365, 'learning_rate': 0.09264745130014641, 'max_depth': 7, 'min_samples_split': 9, 'min_samples_leaf': 1, 'subsample': 0.7795267218994151, 'max_features': 'sqrt'}. Best is trial 16 with value: 0.24131607807430555.
[I 2024-12-04 12:16:31,655] Trial 80 finished with value: 0.31111622990740084 and parameters: {'n_estimators': 888, 'learning_rate': 0.022342456957889636, 'max_depth': 8, 'min_samples_split': 6, 'min_samples_leaf': 2, 'subsample': 0.8426280297137374, 'max_features': 'sqrt'}. Best is trial 16 with value: 0.24131607807430555.
[I 2024-12-04 12:16:31,936] Trial 86 finished with value: 0.3121705124386887 and parameters: {'n_estimators': 756, 'learning_rate': 0.05474374929644068, 'max_depth': 7, 'min_samples_split': 15, 'min_samples_leaf': 1, 'subsample': 0.8023557252271953, 'max_features': 'log2'}. Best is trial 16 with value: 0.24131607807430555.
[I 2024-12-04 12:16:36,406] Trial 74 finished with value: 0.2766939026698038 and parameters: {'n_estimators': 1123, 'learning_rate': 0.022561644607298252, 'max_depth': 11, 'min_samples_split': 7, 'min_samples_leaf': 1, 'subsample': 0.9738026682405521, 'max_features': 'sqrt'}. Best is trial 16 with value: 0.24131607807430555.
[I 2024-12-04 12:16:38,468] Trial 94 finished with value: 0.3397447191019961 and parameters: {'n_estimators': 549, 'learning_rate': 0.042126289921526255, 'max_depth': 3, 'min_samples_split': 11, 'min_samples_leaf': 2, 'subsample': 0.7175095638429237, 'max_features': None}. Best is trial 16 with value: 0.24131607807430555.
[I 2024-12-04 12:16:39,584] Trial 104 finished with value: 0.409309141158635 and parameters: {'n_estimators': 156, 'learning_rate': 0.08246479683756938, 'max_depth': 8, 'min_samples_split': 5, 'min_samples_leaf': 3, 'subsample': 0.7312886491185361, 'max_features': 'sqrt'}. Best is trial 16 with value: 0.24131607807430555.
[I 2024-12-04 12:16:40,782] Trial 92 finished with value: 0.3326959787964657 and parameters: {'n_estimators': 495, 'learning_rate': 0.0773751951402211, 'max_depth': 4, 'min_samples_split': 10, 'min_samples_leaf': 1, 'subsample': 0.9995582460854999, 'max_features': None}. Best is trial 16 with value: 0.24131607807430555.
[I 2024-12-04 12:16:40,877] Trial 89 finished with value: 0.33164657887086957 and parameters: {'n_estimators': 736, 'learning_rate': 0.04745443696804753, 'max_depth': 8, 'min_samples_split': 8, 'min_samples_leaf': 1, 'subsample': 0.8236706796838185, 'max_features': None}. Best is trial 16 with value: 0.24131607807430555.
[I 2024-12-04 12:16:40,884] Trial 84 finished with value: 0.24820320734308265 and parameters: {'n_estimators': 1321, 'learning_rate': 0.048502389971876676, 'max_depth': 8, 'min_samples_split': 2, 'min_samples_leaf': 1, 'subsample': 0.8676609212761183, 'max_features': 'sqrt'}. Best is trial 16 with value: 0.24131607807430555.
[I 2024-12-04 12:16:41,295] Trial 96 finished with value: 0.37319762891191965 and parameters: {'n_estimators': 674, 'learning_rate': 0.09435410649057696, 'max_depth': 9, 'min_samples_split': 12, 'min_samples_leaf': 4, 'subsample': 0.698148533857144, 'max_features': 'sqrt'}. Best is trial 16 with value: 0.24131607807430555.
[I 2024-12-04 12:16:41,379] Trial 73 finished with value: 0.2962888310303407 and parameters: {'n_estimators': 1317, 'learning_rate': 0.06165531868474522, 'max_depth': 8, 'min_samples_split': 6, 'min_samples_leaf': 2, 'subsample': 0.8502048878180684, 'max_features': 'sqrt'}. Best is trial 16 with value: 0.24131607807430555.
[I 2024-12-04 12:16:41,687] Trial 72 finished with value: 0.41463969856181365 and parameters: {'n_estimators': 1491, 'learning_rate': 0.02665478669208431, 'max_depth': 11, 'min_samples_split': 4, 'min_samples_leaf': 4, 'subsample': 0.6415509885087812, 'max_features': None}. Best is trial 16 with value: 0.24131607807430555.
[I 2024-12-04 12:16:47,237] Trial 79 finished with value: 0.3121250985736938 and parameters: {'n_estimators': 1440, 'learning_rate': 0.016980943361637912, 'max_depth': 7, 'min_samples_split': 2, 'min_samples_leaf': 2, 'subsample': 0.7658846666243968, 'max_features': 'sqrt'}. Best is trial 16 with value: 0.24131607807430555.
[I 2024-12-04 12:16:50,393] Trial 85 finished with value: 0.30666763028023 and parameters: {'n_estimators': 824, 'learning_rate': 0.02973007121918212, 'max_depth': 11, 'min_samples_split': 10, 'min_samples_leaf': 2, 'subsample': 0.6010335625186622, 'max_features': 'sqrt'}. Best is trial 16 with value: 0.24131607807430555.
[I 2024-12-04 12:16:52,748] Trial 112 finished with value: 0.31528170707074166 and parameters: {'n_estimators': 315, 'learning_rate': 0.09315948823785922, 'max_depth': 8, 'min_samples_split': 11, 'min_samples_leaf': 2, 'subsample': 0.7694904026208689, 'max_features': 'sqrt'}. Best is trial 16 with value: 0.24131607807430555.
[I 2024-12-04 12:16:52,763] Trial 87 finished with value: 0.3100413209499697 and parameters: {'n_estimators': 1432, 'learning_rate': 0.03683092615622902, 'max_depth': 11, 'min_samples_split': 4, 'min_samples_leaf': 2, 'subsample': 0.8564701985771025, 'max_features': 'log2'}. Best is trial 16 with value: 0.24131607807430555.
[I 2024-12-04 12:16:56,660] Trial 88 finished with value: 0.3146251693744004 and parameters: {'n_estimators': 1192, 'learning_rate': 0.02287957406256239, 'max_depth': 12, 'min_samples_split': 9, 'min_samples_leaf': 1, 'subsample': 0.6181930634765246, 'max_features': None}. Best is trial 16 with value: 0.24131607807430555.
[I 2024-12-04 12:16:57,204] Trial 102 finished with value: 0.3489224631786251 and parameters: {'n_estimators': 825, 'learning_rate': 0.08807192450512756, 'max_depth': 6, 'min_samples_split': 16, 'min_samples_leaf': 3, 'subsample': 0.9373814802192938, 'max_features': 'sqrt'}. Best is trial 16 with value: 0.24131607807430555.
[I 2024-12-04 12:16:59,265] Trial 78 finished with value: 0.31133265138021743 and parameters: {'n_estimators': 1175, 'learning_rate': 0.07703410345749026, 'max_depth': 8, 'min_samples_split': 6, 'min_samples_leaf': 1, 'subsample': 0.7294544466238911, 'max_features': None}. Best is trial 16 with value: 0.24131607807430555.
[I 2024-12-04 12:17:04,081] Trial 111 finished with value: 0.33278850640588553 and parameters: {'n_estimators': 683, 'learning_rate': 0.021257035913034177, 'max_depth': 8, 'min_samples_split': 3, 'min_samples_leaf': 2, 'subsample': 0.8379457155376029, 'max_features': 'sqrt'}. Best is trial 16 with value: 0.24131607807430555.
[I 2024-12-04 12:17:05,272] Trial 91 finished with value: 0.2994832973989718 and parameters: {'n_estimators': 1382, 'learning_rate': 0.01832285487855597, 'max_depth': 11, 'min_samples_split': 3, 'min_samples_leaf': 2, 'subsample': 0.8712834773185488, 'max_features': 'sqrt'}. Best is trial 16 with value: 0.24131607807430555.
[I 2024-12-04 12:17:07,462] Trial 120 finished with value: 0.3959574109160668 and parameters: {'n_estimators': 348, 'learning_rate': 0.08396401344071053, 'max_depth': 9, 'min_samples_split': 6, 'min_samples_leaf': 2, 'subsample': 0.8019111458123139, 'max_features': 'log2'}. Best is trial 16 with value: 0.24131607807430555.
[I 2024-12-04 12:17:07,773] Trial 105 finished with value: 0.37562417599204645 and parameters: {'n_estimators': 882, 'learning_rate': 0.052732683052411335, 'max_depth': 5, 'min_samples_split': 14, 'min_samples_leaf': 2, 'subsample': 0.6880104092946661, 'max_features': 'log2'}. Best is trial 16 with value: 0.24131607807430555.
[I 2024-12-04 12:17:08,606] Trial 106 finished with value: 0.29076295369403127 and parameters: {'n_estimators': 1019, 'learning_rate': 0.04557874441591805, 'max_depth': 7, 'min_samples_split': 3, 'min_samples_leaf': 2, 'subsample': 0.6771528081276436, 'max_features': 'sqrt'}. Best is trial 16 with value: 0.24131607807430555.
[I 2024-12-04 12:17:12,129] Trial 101 finished with value: 0.488268708432734 and parameters: {'n_estimators': 1032, 'learning_rate': 0.012929554632311374, 'max_depth': 9, 'min_samples_split': 4, 'min_samples_leaf': 1, 'subsample': 0.8708517558969566, 'max_features': 'log2'}. Best is trial 16 with value: 0.24131607807430555.
[I 2024-12-04 12:17:12,443] Trial 108 finished with value: 0.326813380247206 and parameters: {'n_estimators': 898, 'learning_rate': 0.026597778901078527, 'max_depth': 6, 'min_samples_split': 8, 'min_samples_leaf': 2, 'subsample': 0.9574476175996705, 'max_features': 'sqrt'}. Best is trial 16 with value: 0.24131607807430555.
[I 2024-12-04 12:17:13,339] Trial 100 finished with value: 0.5729403940944979 and parameters: {'n_estimators': 1220, 'learning_rate': 0.015029553080555955, 'max_depth': 5, 'min_samples_split': 9, 'min_samples_leaf': 1, 'subsample': 0.7640051973402037, 'max_features': 'log2'}. Best is trial 16 with value: 0.24131607807430555.
[I 2024-12-04 12:17:14,653] Trial 113 finished with value: 0.3064261828391681 and parameters: {'n_estimators': 731, 'learning_rate': 0.019622852023064, 'max_depth': 11, 'min_samples_split': 8, 'min_samples_leaf': 2, 'subsample': 0.8738475913315643, 'max_features': 'sqrt'}. Best is trial 16 with value: 0.24131607807430555.
[I 2024-12-04 12:17:15,784] Trial 103 finished with value: 0.39281641308204795 and parameters: {'n_estimators': 1252, 'learning_rate': 0.025176198896609058, 'max_depth': 7, 'min_samples_split': 3, 'min_samples_leaf': 5, 'subsample': 0.862786331665547, 'max_features': 'sqrt'}. Best is trial 16 with value: 0.24131607807430555.
[I 2024-12-04 12:17:16,515] Trial 99 finished with value: 0.27430175268578494 and parameters: {'n_estimators': 1284, 'learning_rate': 0.026134617612280853, 'max_depth': 9, 'min_samples_split': 6, 'min_samples_leaf': 1, 'subsample': 0.7996880188272694, 'max_features': 'sqrt'}. Best is trial 16 with value: 0.24131607807430555.
[I 2024-12-04 12:17:20,872] Trial 97 finished with value: 0.35564276144293916 and parameters: {'n_estimators': 1060, 'learning_rate': 0.028134369377251514, 'max_depth': 9, 'min_samples_split': 3, 'min_samples_leaf': 1, 'subsample': 0.824717522523289, 'max_features': None}. Best is trial 16 with value: 0.24131607807430555.
[I 2024-12-04 12:17:22,661] Trial 109 finished with value: 0.2958314330525495 and parameters: {'n_estimators': 1143, 'learning_rate': 0.05018842444912326, 'max_depth': 8, 'min_samples_split': 14, 'min_samples_leaf': 1, 'subsample': 0.8758199059241577, 'max_features': 'log2'}. Best is trial 16 with value: 0.24131607807430555.
[I 2024-12-04 12:17:25,454] Trial 119 finished with value: 0.7833602685831126 and parameters: {'n_estimators': 669, 'learning_rate': 0.015069255694638403, 'max_depth': 12, 'min_samples_split': 11, 'min_samples_leaf': 3, 'subsample': 0.6640276926734779, 'max_features': 'log2'}. Best is trial 16 with value: 0.24131607807430555.
[I 2024-12-04 12:17:25,467] Trial 110 finished with value: 0.26256773350261137 and parameters: {'n_estimators': 1125, 'learning_rate': 0.031837885210414536, 'max_depth': 11, 'min_samples_split': 3, 'min_samples_leaf': 1, 'subsample': 0.9790264224879989, 'max_features': 'sqrt'}. Best is trial 16 with value: 0.24131607807430555.
[I 2024-12-04 12:17:25,861] Trial 129 finished with value: 0.28638388257918335 and parameters: {'n_estimators': 488, 'learning_rate': 0.09299952588489106, 'max_depth': 8, 'min_samples_split': 8, 'min_samples_leaf': 1, 'subsample': 0.8916786083179762, 'max_features': 'sqrt'}. Best is trial 16 with value: 0.24131607807430555.
[I 2024-12-04 12:17:27,133] Trial 134 finished with value: 0.3584652322084514 and parameters: {'n_estimators': 252, 'learning_rate': 0.056671839513654364, 'max_depth': 6, 'min_samples_split': 9, 'min_samples_leaf': 1, 'subsample': 0.8450123065433888, 'max_features': 'sqrt'}. Best is trial 16 with value: 0.24131607807430555.
[I 2024-12-04 12:17:28,498] Trial 90 finished with value: 0.3105504089795686 and parameters: {'n_estimators': 1401, 'learning_rate': 0.0154054369051118, 'max_depth': 9, 'min_samples_split': 13, 'min_samples_leaf': 2, 'subsample': 0.6064660960000077, 'max_features': 'sqrt'}. Best is trial 16 with value: 0.24131607807430555.
[I 2024-12-04 12:17:29,344] Trial 123 finished with value: 0.3790836064555593 and parameters: {'n_estimators': 738, 'learning_rate': 0.01968509226631134, 'max_depth': 9, 'min_samples_split': 12, 'min_samples_leaf': 3, 'subsample': 0.6311756614033365, 'max_features': 'sqrt'}. Best is trial 16 with value: 0.24131607807430555.
[I 2024-12-04 12:17:30,579] Trial 124 finished with value: 0.2568188721612996 and parameters: {'n_estimators': 746, 'learning_rate': 0.04502030966913073, 'max_depth': 12, 'min_samples_split': 10, 'min_samples_leaf': 1, 'subsample': 0.6245413085107345, 'max_features': 'sqrt'}. Best is trial 16 with value: 0.24131607807430555.
[I 2024-12-04 12:17:33,180] Trial 125 finished with value: 0.2999122964974826 and parameters: {'n_estimators': 742, 'learning_rate': 0.09129979886032027, 'max_depth': 5, 'min_samples_split': 10, 'min_samples_leaf': 2, 'subsample': 0.7951243226584702, 'max_features': 'sqrt'}. Best is trial 16 with value: 0.24131607807430555.
[I 2024-12-04 12:17:34,605] Trial 107 finished with value: 0.36076830753216077 and parameters: {'n_estimators': 1311, 'learning_rate': 0.02339987678505862, 'max_depth': 11, 'min_samples_split': 11, 'min_samples_leaf': 3, 'subsample': 0.9736994469591209, 'max_features': 'sqrt'}. Best is trial 16 with value: 0.24131607807430555.
[I 2024-12-04 12:17:35,844] Trial 114 finished with value: 0.2729368872931594 and parameters: {'n_estimators': 1136, 'learning_rate': 0.05002779981126254, 'max_depth': 6, 'min_samples_split': 5, 'min_samples_leaf': 1, 'subsample': 0.8985282174627205, 'max_features': 'sqrt'}. Best is trial 16 with value: 0.24131607807430555.
[I 2024-12-04 12:17:39,096] Trial 118 finished with value: 0.30389740703226303 and parameters: {'n_estimators': 1000, 'learning_rate': 0.07000377710366826, 'max_depth': 7, 'min_samples_split': 3, 'min_samples_leaf': 2, 'subsample': 0.7991213778851578, 'max_features': 'sqrt'}. Best is trial 16 with value: 0.24131607807430555.
[I 2024-12-04 12:17:39,619] Trial 128 finished with value: 0.329592761940706 and parameters: {'n_estimators': 812, 'learning_rate': 0.010721195342399344, 'max_depth': 12, 'min_samples_split': 5, 'min_samples_leaf': 1, 'subsample': 0.9988987275676996, 'max_features': 'sqrt'}. Best is trial 16 with value: 0.24131607807430555.
[I 2024-12-04 12:17:39,661] Trial 143 finished with value: 0.35450718176669316 and parameters: {'n_estimators': 131, 'learning_rate': 0.08027571784775614, 'max_depth': 9, 'min_samples_split': 6, 'min_samples_leaf': 1, 'subsample': 0.9815400744443719, 'max_features': 'sqrt'}. Best is trial 16 with value: 0.24131607807430555.
[I 2024-12-04 12:17:39,780] Trial 126 finished with value: 0.44072003814418476 and parameters: {'n_estimators': 896, 'learning_rate': 0.029661083551576792, 'max_depth': 12, 'min_samples_split': 5, 'min_samples_leaf': 7, 'subsample': 0.6481697323178967, 'max_features': 'sqrt'}. Best is trial 16 with value: 0.24131607807430555.
[I 2024-12-04 12:17:42,144] Trial 121 finished with value: 0.2840591969318475 and parameters: {'n_estimators': 994, 'learning_rate': 0.03459953262506042, 'max_depth': 11, 'min_samples_split': 9, 'min_samples_leaf': 1, 'subsample': 0.6443428276762815, 'max_features': 'sqrt'}. Best is trial 16 with value: 0.24131607807430555.
[I 2024-12-04 12:17:45,226] Trial 115 finished with value: 0.28178533482618817 and parameters: {'n_estimators': 1378, 'learning_rate': 0.07211897406911051, 'max_depth': 10, 'min_samples_split': 9, 'min_samples_leaf': 2, 'subsample': 0.904370383885093, 'max_features': 'sqrt'}. Best is trial 16 with value: 0.24131607807430555.
[I 2024-12-04 12:17:49,191] Trial 130 finished with value: 0.3680928898943074 and parameters: {'n_estimators': 994, 'learning_rate': 0.02299193715217255, 'max_depth': 12, 'min_samples_split': 12, 'min_samples_leaf': 4, 'subsample': 0.6659151149739946, 'max_features': 'sqrt'}. Best is trial 16 with value: 0.24131607807430555.
[I 2024-12-04 12:17:50,030] Trial 116 finished with value: 0.3683693343580732 and parameters: {'n_estimators': 1273, 'learning_rate': 0.03982686232393729, 'max_depth': 10, 'min_samples_split': 6, 'min_samples_leaf': 4, 'subsample': 0.8259446206774099, 'max_features': 'sqrt'}. Best is trial 16 with value: 0.24131607807430555.
[I 2024-12-04 12:17:51,082] Trial 122 finished with value: 0.24900824862647258 and parameters: {'n_estimators': 1330, 'learning_rate': 0.03763962425574602, 'max_depth': 10, 'min_samples_split': 2, 'min_samples_leaf': 1, 'subsample': 0.8636040272700103, 'max_features': 'sqrt'}. Best is trial 16 with value: 0.24131607807430555.
[I 2024-12-04 12:17:52,875] Trial 117 finished with value: 0.34916809049768543 and parameters: {'n_estimators': 1415, 'learning_rate': 0.05946572292082918, 'max_depth': 8, 'min_samples_split': 2, 'min_samples_leaf': 3, 'subsample': 0.8961293547273712, 'max_features': 'sqrt'}. Best is trial 16 with value: 0.24131607807430555.
[I 2024-12-04 12:17:56,039] Trial 150 finished with value: 0.36068753331978665 and parameters: {'n_estimators': 394, 'learning_rate': 0.09295807287290737, 'max_depth': 9, 'min_samples_split': 6, 'min_samples_leaf': 4, 'subsample': 0.910705561405094, 'max_features': 'sqrt'}. Best is trial 16 with value: 0.24131607807430555.
[I 2024-12-04 12:17:59,796] Trial 127 finished with value: 0.24677566189760144 and parameters: {'n_estimators': 1408, 'learning_rate': 0.02877470317261691, 'max_depth': 7, 'min_samples_split': 4, 'min_samples_leaf': 1, 'subsample': 0.9223952513900598, 'max_features': 'sqrt'}. Best is trial 16 with value: 0.24131607807430555.
