[I 2024-12-04 20:51:31,773] Trial 1601 finished with value: 0.14249507943537337 and parameters: {'kernel_type': 'Matern', 'length_scale': 8.072033603809178, 'noise_level': 0.9220920597653092, 'constant_value': 0.18806572444475267, 'nu': 1.5}. Best is trial 959 with value: 0.1375110730946576.
[I 2024-12-04 20:51:34,998] Trial 1603 finished with value: 0.1424950625214226 and parameters: {'kernel_type': 'Matern', 'length_scale': 186.3764592707402, 'noise_level': 0.3184797569473463, 'constant_value': 29.023283785970442, 'nu': 1.5}. Best is trial 959 with value: 0.1375110730946576.
[I 2024-12-04 20:51:35,296] Trial 1602 finished with value: 0.1424950548410473 and parameters: {'kernel_type': 'Matern', 'length_scale': 1.3042746619550025, 'noise_level': 1.1886991690421285e-06, 'constant_value': 6.291058834263246e-07, 'nu': 1.5}. Best is trial 959 with value: 0.1375110730946576.
[I 2024-12-04 20:51:41,439] Trial 1604 finished with value: 0.1424950622030929 and parameters: {'kernel_type': 'Matern', 'length_scale': 3.5571812790250985, 'noise_level': 0.024789306950742867, 'constant_value': 9.274754446255331, 'nu': 1.5}. Best is trial 959 with value: 0.1375110730946576.
[I 2024-12-04 20:51:42,778] Trial 1605 finished with value: 0.1424947992375891 and parameters: {'kernel_type': 'Matern', 'length_scale': 34.6707748298997, 'noise_level': 0.2128338516742718, 'constant_value': 0.42772437456576234, 'nu': 1.5}. Best is trial 959 with value: 0.1375110730946576.
[I 2024-12-04 20:51:44,030] Trial 1606 finished with value: 0.1424950536133634 and parameters: {'kernel_type': 'Matern', 'length_scale': 69.0447202655148, 'noise_level': 0.03403498810031707, 'constant_value': 0.45310137422191743, 'nu': 1.5}. Best is trial 959 with value: 0.1375110730946576.
[I 2024-12-04 20:51:48,903] Trial 1609 finished with value: 0.9864686819293766 and parameters: {'kernel_type': 'Matern', 'length_scale': 0.00011988278600339556, 'noise_level': 1.4456978283905133e-06, 'constant_value': 0.0013298824857836892, 'nu': 0.5}. Best is trial 959 with value: 0.1375110730946576.
[I 2024-12-04 20:51:49,999] Trial 1607 finished with value: 0.14249505514750896 and parameters: {'kernel_type': 'Matern', 'length_scale': 632.7932280544175, 'noise_level': 0.39365356991548234, 'constant_value': 1.2752098342658849, 'nu': 1.5}. Best is trial 959 with value: 0.1375110730946576.
[I 2024-12-04 20:51:51,569] Trial 1608 finished with value: 0.14249478995545858 and parameters: {'kernel_type': 'Matern', 'length_scale': 13.86944447580319, 'noise_level': 0.048601977594048974, 'constant_value': 0.9163742222566346, 'nu': 1.5}. Best is trial 959 with value: 0.1375110730946576.
[I 2024-12-04 20:51:59,540] Trial 1612 finished with value: 0.1424950996246274 and parameters: {'kernel_type': 'Matern', 'length_scale': 55.6856199117128, 'noise_level': 0.99839848451144, 'constant_value': 58.31874032576207, 'nu': 1.5}. Best is trial 959 with value: 0.1375110730946576.
[I 2024-12-04 20:52:01,604] Trial 1611 finished with value: 0.14469882719624996 and parameters: {'kernel_type': 'Matern', 'length_scale': 3270.505542744448, 'noise_level': 0.7049711972150363, 'constant_value': 1.07386117784681, 'nu': 2.5}. Best is trial 959 with value: 0.1375110730946576.
[I 2024-12-04 20:52:01,965] Trial 1610 finished with value: 0.14249488224906975 and parameters: {'kernel_type': 'Matern', 'length_scale': 539.1839208538073, 'noise_level': 0.9252275809567856, 'constant_value': 0.07494583703861146, 'nu': 1.5}. Best is trial 959 with value: 0.1375110730946576.
[I 2024-12-04 20:52:06,298] Trial 1613 finished with value: 0.19720002954073185 and parameters: {'kernel_type': 'Matern', 'length_scale': 867.5377191638939, 'noise_level': 0.03195459012432783, 'constant_value': 41749.85231208231, 'nu': 0.5}. Best is trial 959 with value: 0.1375110730946576.
[I 2024-12-04 20:52:08,979] Trial 1614 finished with value: 0.14249506613509297 and parameters: {'kernel_type': 'Matern', 'length_scale': 72.48980431479391, 'noise_level': 0.9777201139310813, 'constant_value': 1.246425649785384, 'nu': 1.5}. Best is trial 959 with value: 0.1375110730946576.
[I 2024-12-04 20:52:13,149] Trial 1615 finished with value: 0.14249485046736424 and parameters: {'kernel_type': 'Matern', 'length_scale': 0.3404402803872545, 'noise_level': 0.000571436051055515, 'constant_value': 26.70060257280454, 'nu': 1.5}. Best is trial 959 with value: 0.1375110730946576.
[I 2024-12-04 20:52:13,900] Trial 1616 finished with value: 0.14249503943254674 and parameters: {'kernel_type': 'Matern', 'length_scale': 2.499657613078954, 'noise_level': 0.0738974399971132, 'constant_value': 2.3973419527206175, 'nu': 1.5}. Best is trial 959 with value: 0.1375110730946576.
[I 2024-12-04 20:52:15,475] Trial 1617 finished with value: 0.19720002377801193 and parameters: {'kernel_type': 'Matern', 'length_scale': 2969.5414947153686, 'noise_level': 0.20451209224391273, 'constant_value': 115.39852432804243, 'nu': 0.5}. Best is trial 959 with value: 0.1375110730946576.
[I 2024-12-04 20:52:22,825] Trial 1619 finished with value: 0.9864686819061618 and parameters: {'kernel_type': 'Matern', 'length_scale': 1355.0667357285358, 'noise_level': 0.018911144771011072, 'constant_value': 4.47645128246463, 'nu': 1.5}. Best is trial 959 with value: 0.1375110730946576.
[I 2024-12-04 20:52:23,371] Trial 1620 finished with value: 0.14249508366847943 and parameters: {'kernel_type': 'Matern', 'length_scale': 37.612077032226644, 'noise_level': 0.058687919276098614, 'constant_value': 14.595685819516358, 'nu': 1.5}. Best is trial 959 with value: 0.1375110730946576.
[I 2024-12-04 20:52:28,988] Trial 1622 finished with value: 0.14249506251811211 and parameters: {'kernel_type': 'Matern', 'length_scale': 466.4453676571442, 'noise_level': 0.08948050509346378, 'constant_value': 146.98929640285996, 'nu': 1.5}. Best is trial 959 with value: 0.1375110730946576.
[I 2024-12-04 20:52:31,456] Trial 1618 finished with value: 0.1477103488743189 and parameters: {'kernel_type': 'RBF', 'length_scale': 5807.891109032156, 'noise_level': 0.8653584586183636, 'constant_value': 2.0699128155725286, 'nu': 1.5}. Best is trial 959 with value: 0.1375110730946576.
[I 2024-12-04 20:52:32,969] Trial 1621 finished with value: 0.986468682290266 and parameters: {'kernel_type': 'RBF', 'length_scale': 43037.55955340739, 'noise_level': 5.194579919442261e-10, 'constant_value': 45.43734543023348, 'nu': 2.5}. Best is trial 959 with value: 0.1375110730946576.
[I 2024-12-04 20:52:37,141] Trial 1624 finished with value: 0.9864686818762245 and parameters: {'kernel_type': 'Matern', 'length_scale': 0.05186462848594114, 'noise_level': 0.7142745949529671, 'constant_value': 6.734633777868312, 'nu': 1.5}. Best is trial 959 with value: 0.1375110730946576.
[I 2024-12-04 20:52:40,005] Trial 1623 finished with value: 0.14249497343068476 and parameters: {'kernel_type': 'Matern', 'length_scale': 0.20996778134875058, 'noise_level': 0.014531804541202257, 'constant_value': 5.856482060537263, 'nu': 1.5}. Best is trial 959 with value: 0.1375110730946576.
[I 2024-12-04 20:52:43,006] Trial 1625 finished with value: 0.9864686819246772 and parameters: {'kernel_type': 'Matern', 'length_scale': 8.969262216421141, 'noise_level': 6.337804252305698e-09, 'constant_value': 1.16576854570178e-07, 'nu': 1.5}. Best is trial 959 with value: 0.1375110730946576.
[I 2024-12-04 20:52:45,927] Trial 1626 finished with value: 0.1424952671117787 and parameters: {'kernel_type': 'Matern', 'length_scale': 213.5956643834892, 'noise_level': 0.7859473720166713, 'constant_value': 8.583216919219515, 'nu': 1.5}. Best is trial 959 with value: 0.1375110730946576.
[I 2024-12-04 20:52:46,727] Trial 1627 finished with value: 0.142495063298394 and parameters: {'kernel_type': 'Matern', 'length_scale': 0.34953847743930744, 'noise_level': 0.026285038237575022, 'constant_value': 0.8340178792816929, 'nu': 1.5}. Best is trial 959 with value: 0.1375110730946576.
[I 2024-12-04 20:52:52,419] Trial 1628 finished with value: 0.9864686819530659 and parameters: {'kernel_type': 'RBF', 'length_scale': 29598.69948498483, 'noise_level': 5.7545817885483746e-06, 'constant_value': 0.36847789448290996, 'nu': 2.5}. Best is trial 959 with value: 0.1375110730946576.
[I 2024-12-04 20:52:54,199] Trial 1629 finished with value: 0.14249497128130187 and parameters: {'kernel_type': 'Matern', 'length_scale': 11.508020427166711, 'noise_level': 0.8955399076002402, 'constant_value': 5.591736930134267, 'nu': 1.5}. Best is trial 959 with value: 0.1375110730946576.
[I 2024-12-04 20:52:54,996] Trial 1630 finished with value: 0.14249500524341893 and parameters: {'kernel_type': 'Matern', 'length_scale': 267.8058972474085, 'noise_level': 0.989379288485101, 'constant_value': 200.94167718356047, 'nu': 1.5}. Best is trial 959 with value: 0.1375110730946576.
[I 2024-12-04 20:53:01,411] Trial 1633 finished with value: 0.14249504324641607 and parameters: {'kernel_type': 'Matern', 'length_scale': 168.45385018121607, 'noise_level': 0.060659013125231316, 'constant_value': 58.191079255470676, 'nu': 1.5}. Best is trial 959 with value: 0.1375110730946576.
[I 2024-12-04 20:53:01,412] Trial 1631 finished with value: 0.19720003479662174 and parameters: {'kernel_type': 'Matern', 'length_scale': 0.2822222672930868, 'noise_level': 0.9568621896936788, 'constant_value': 0.012083932585398765, 'nu': 0.5}. Best is trial 959 with value: 0.1375110730946576.
[I 2024-12-04 20:53:08,873] Trial 1634 finished with value: 0.9982167337571846 and parameters: {'kernel_type': 'Matern', 'length_scale': 0.012467178484343745, 'noise_level': 0.0025241911935935646, 'constant_value': 278.3343543620228, 'nu': 1.5}. Best is trial 959 with value: 0.1375110730946576.
[I 2024-12-04 20:53:12,893] Trial 1635 finished with value: 0.14249504779789007 and parameters: {'kernel_type': 'Matern', 'length_scale': 4.111359542494017, 'noise_level': 0.005916750684812936, 'constant_value': 1.7371134647184996, 'nu': 1.5}. Best is trial 959 with value: 0.1375110730946576.
[I 2024-12-04 20:53:13,414] Trial 1632 finished with value: 0.14771049357529634 and parameters: {'kernel_type': 'RBF', 'length_scale': 0.6069032004913992, 'noise_level': 6.350700017233831e-06, 'constant_value': 3.885667233440082e-05, 'nu': 0.5}. Best is trial 959 with value: 0.1375110730946576.
[I 2024-12-04 20:53:16,837] Trial 1636 finished with value: 0.14249494095250206 and parameters: {'kernel_type': 'Matern', 'length_scale': 149.21324542699276, 'noise_level': 0.9790006144532636, 'constant_value': 0.9777529909083287, 'nu': 1.5}. Best is trial 959 with value: 0.1375110730946576.
[I 2024-12-04 20:53:23,569] Trial 1638 finished with value: 0.9864686819074372 and parameters: {'kernel_type': 'Matern', 'length_scale': 19774.843923964716, 'noise_level': 0.006113562585766298, 'constant_value': 875.6168519423017, 'nu': 1.5}. Best is trial 959 with value: 0.1375110730946576.
[I 2024-12-04 20:53:24,008] Trial 1639 finished with value: 0.1424950498125216 and parameters: {'kernel_type': 'Matern', 'length_scale': 1.277707152919718, 'noise_level': 0.8996270897885844, 'constant_value': 2.972781597467153, 'nu': 1.5}. Best is trial 959 with value: 0.1375110730946576.
[I 2024-12-04 20:53:26,052] Trial 1637 finished with value: 0.14249506921059546 and parameters: {'kernel_type': 'Matern', 'length_scale': 29.45130309864829, 'noise_level': 0.5425503737118731, 'constant_value': 0.0001283012766322265, 'nu': 1.5}. Best is trial 959 with value: 0.1375110730946576.
[I 2024-12-04 20:53:31,383] Trial 1641 finished with value: 0.1424950575433763 and parameters: {'kernel_type': 'Matern', 'length_scale': 15.485581192125819, 'noise_level': 0.015151791497320584, 'constant_value': 61.028060895925506, 'nu': 1.5}. Best is trial 959 with value: 0.1375110730946576.
[I 2024-12-04 20:53:31,555] Trial 1642 finished with value: 0.9982171094420351 and parameters: {'kernel_type': 'Matern', 'length_scale': 49786.36742810021, 'noise_level': 0.5030917602696606, 'constant_value': 0.9801132228470445, 'nu': 1.5}. Best is trial 959 with value: 0.1375110730946576.
[I 2024-12-04 20:53:31,779] Trial 1640 finished with value: 0.1424955427421523 and parameters: {'kernel_type': 'Matern', 'length_scale': 1.9326382434134517, 'noise_level': 0.0030667348608159114, 'constant_value': 0.005326861862143091, 'nu': 1.5}. Best is trial 959 with value: 0.1375110730946576.
[I 2024-12-04 20:53:36,634] Trial 1645 finished with value: 0.9864686819256171 and parameters: {'kernel_type': 'Matern', 'length_scale': 0.05612479425392374, 'noise_level': 0.009980547638395513, 'constant_value': 12.373973673977023, 'nu': 1.5}. Best is trial 959 with value: 0.1375110730946576.
[I 2024-12-04 20:53:38,249] Trial 1643 finished with value: 0.14771048861625838 and parameters: {'kernel_type': 'RBF', 'length_scale': 2.4569305497939773, 'noise_level': 0.013086616123213515, 'constant_value': 60.64666990465144, 'nu': 1.5}. Best is trial 959 with value: 0.1375110730946576.
[I 2024-12-04 20:53:38,791] Trial 1644 finished with value: 0.1424950601761683 and parameters: {'kernel_type': 'Matern', 'length_scale': 2.020855444631797, 'noise_level': 0.03995724772702139, 'constant_value': 1.4904556759019565, 'nu': 1.5}. Best is trial 959 with value: 0.1375110730946576.
[I 2024-12-04 20:53:43,668] Trial 1646 finished with value: 0.14249506448533425 and parameters: {'kernel_type': 'Matern', 'length_scale': 34.535132713909675, 'noise_level': 0.014077116340487132, 'constant_value': 29.16538598362856, 'nu': 1.5}. Best is trial 959 with value: 0.1375110730946576.
[I 2024-12-04 20:53:44,979] Trial 1648 finished with value: 0.14249506335288198 and parameters: {'kernel_type': 'Matern', 'length_scale': 3.710068559017807, 'noise_level': 0.0012972880603753323, 'constant_value': 98958.32615774106, 'nu': 1.5}. Best is trial 959 with value: 0.1375110730946576.
[I 2024-12-04 20:53:46,426] Trial 1647 finished with value: 0.14249513736103878 and parameters: {'kernel_type': 'Matern', 'length_scale': 1.2044958289080618, 'noise_level': 0.038327729648841305, 'constant_value': 28.172521663925632, 'nu': 1.5}. Best is trial 959 with value: 0.1375110730946576.
[I 2024-12-04 20:53:48,743] Trial 1649 finished with value: 0.14249506059864597 and parameters: {'kernel_type': 'Matern', 'length_scale': 104.14469490526312, 'noise_level': 0.9318280807202247, 'constant_value': 98.92821832531202, 'nu': 1.5}. Best is trial 959 with value: 0.1375110730946576.
[I 2024-12-04 20:53:48,807] Trial 1650 finished with value: 0.9982162458258294 and parameters: {'kernel_type': 'Matern', 'length_scale': 2.509533358917166, 'noise_level': 1.3502754734846052e-05, 'constant_value': 141.74850793273137, 'nu': 0.5}. Best is trial 959 with value: 0.1375110730946576.
[I 2024-12-04 20:53:55,654] Trial 1652 finished with value: 0.1424950793357351 and parameters: {'kernel_type': 'Matern', 'length_scale': 0.6140598836056753, 'noise_level': 0.02401731712802249, 'constant_value': 67.1119276955551, 'nu': 1.5}. Best is trial 959 with value: 0.1375110730946576.
[I 2024-12-04 20:53:55,837] Trial 1651 finished with value: 0.14249509794003398 and parameters: {'kernel_type': 'Matern', 'length_scale': 0.36574144078299464, 'noise_level': 0.01372545930115124, 'constant_value': 0.04792812046053086, 'nu': 1.5}. Best is trial 959 with value: 0.1375110730946576.
[I 2024-12-04 20:53:58,909] Trial 1653 finished with value: 0.6340913734161523 and parameters: {'kernel_type': 'Matern', 'length_scale': 1389.2908823640926, 'noise_level': 0.9593737897968103, 'constant_value': 0.14278263723435874, 'nu': 1.5}. Best is trial 959 with value: 0.1375110730946576.
[I 2024-12-04 20:54:02,683] Trial 1654 finished with value: 0.14249512253822955 and parameters: {'kernel_type': 'Matern', 'length_scale': 68.19524878908307, 'noise_level': 0.961532389662648, 'constant_value': 48.217152302611645, 'nu': 1.5}. Best is trial 959 with value: 0.1375110730946576.
[I 2024-12-04 20:54:04,710] Trial 1655 finished with value: 0.1424951973004799 and parameters: {'kernel_type': 'Matern', 'length_scale': 0.3304061723338049, 'noise_level': 7.20110628693321e-05, 'constant_value': 589.8734832483352, 'nu': 1.5}. Best is trial 959 with value: 0.1375110730946576.
[I 2024-12-04 20:54:08,968] Trial 1656 finished with value: 0.9864686819232056 and parameters: {'kernel_type': 'Matern', 'length_scale': 678.788098186873, 'noise_level': 0.014955456043688559, 'constant_value': 52.041086451885874, 'nu': 1.5}. Best is trial 959 with value: 0.1375110730946576.
[I 2024-12-04 20:54:11,725] Trial 1658 finished with value: 0.1424950629126783 and parameters: {'kernel_type': 'Matern', 'length_scale': 106.86321656406831, 'noise_level': 0.011384707571832194, 'constant_value': 41.877501879737046, 'nu': 1.5}. Best is trial 959 with value: 0.1375110730946576.
[I 2024-12-04 20:54:13,633] Trial 1657 finished with value: 0.1446986076301223 and parameters: {'kernel_type': 'Matern', 'length_scale': 0.850004957231034, 'noise_level': 0.005240151015846996, 'constant_value': 1.9485450121649805, 'nu': 2.5}. Best is trial 959 with value: 0.1375110730946576.
[I 2024-12-04 20:54:18,430] Trial 1659 finished with value: 0.9864686814733831 and parameters: {'kernel_type': 'RBF', 'length_scale': 75162.13597321836, 'noise_level': 8.172798615507288e-05, 'constant_value': 6205.957241023604, 'nu': 1.5}. Best is trial 959 with value: 0.1375110730946576.
[I 2024-12-04 20:54:19,866] Trial 1660 finished with value: 0.9864686818230052 and parameters: {'kernel_type': 'RBF', 'length_scale': 231.07086482109804, 'noise_level': 0.0196743649324282, 'constant_value': 0.00021341003795285638, 'nu': 2.5}. Best is trial 959 with value: 0.1375110730946576.
[I 2024-12-04 20:54:20,943] Trial 1661 finished with value: 0.14249506453388502 and parameters: {'kernel_type': 'Matern', 'length_scale': 26.902296896784282, 'noise_level': 0.03461239575084126, 'constant_value': 0.8385927053339217, 'nu': 1.5}. Best is trial 959 with value: 0.1375110730946576.
[I 2024-12-04 20:54:24,028] Trial 1662 finished with value: 0.14249527278676943 and parameters: {'kernel_type': 'Matern', 'length_scale': 6523.764731849802, 'noise_level': 0.02453659618792358, 'constant_value': 58536.449359776714, 'nu': 1.5}. Best is trial 959 with value: 0.1375110730946576.
[I 2024-12-04 20:54:28,189] Trial 1663 finished with value: 0.14249479244495303 and parameters: {'kernel_type': 'Matern', 'length_scale': 4.670643465463235, 'noise_level': 0.13214985691143555, 'constant_value': 13.205296932130981, 'nu': 1.5}. Best is trial 959 with value: 0.1375110730946576.
[I 2024-12-04 20:54:29,523] Trial 1664 finished with value: 0.1424950666941772 and parameters: {'kernel_type': 'Matern', 'length_scale': 7.506000285272367, 'noise_level': 0.863648887923758, 'constant_value': 150.39675690795193, 'nu': 1.5}. Best is trial 959 with value: 0.1375110730946576.
[I 2024-12-04 20:54:30,345] Trial 1665 finished with value: 0.14249506507824958 and parameters: {'kernel_type': 'Matern', 'length_scale': 13.667471081419329, 'noise_level': 0.008197606148999084, 'constant_value': 108.72173013366556, 'nu': 1.5}. Best is trial 959 with value: 0.1375110730946576.
[I 2024-12-04 20:54:36,323] Trial 1668 finished with value: 0.9864685906619579 and parameters: {'kernel_type': 'Matern', 'length_scale': 0.09410707541991514, 'noise_level': 0.9693307070333823, 'constant_value': 3.1964917062145664, 'nu': 1.5}. Best is trial 959 with value: 0.1375110730946576.
[I 2024-12-04 20:54:37,158] Trial 1667 finished with value: 0.9864686818373297 and parameters: {'kernel_type': 'Matern', 'length_scale': 0.0673315744305847, 'noise_level': 0.9475812989553516, 'constant_value': 0.18050872318931177, 'nu': 1.5}. Best is trial 959 with value: 0.1375110730946576.
[I 2024-12-04 20:54:39,269] Trial 1666 finished with value: 0.1424950635600875 and parameters: {'kernel_type': 'Matern', 'length_scale': 0.19656087488751045, 'noise_level': 0.019423031519781364, 'constant_value': 639.9660530619444, 'nu': 1.5}. Best is trial 959 with value: 0.1375110730946576.
[I 2024-12-04 20:54:44,874] Trial 1670 finished with value: 0.14249500070250284 and parameters: {'kernel_type': 'Matern', 'length_scale': 2651.5228580314424, 'noise_level': 0.06094972293516619, 'constant_value': 136.38498533052373, 'nu': 1.5}. Best is trial 959 with value: 0.1375110730946576.
[I 2024-12-04 20:54:45,825] Trial 1669 finished with value: 0.1446988223417742 and parameters: {'kernel_type': 'Matern', 'length_scale': 0.4559678902969357, 'noise_level': 0.013836480065626492, 'constant_value': 0.017847398915846205, 'nu': 2.5}. Best is trial 959 with value: 0.1375110730946576.
[I 2024-12-04 20:54:47,440] Trial 1671 finished with value: 0.14249504505753507 and parameters: {'kernel_type': 'Matern', 'length_scale': 7.543515275592565, 'noise_level': 0.034140091575797615, 'constant_value': 0.9397641776707858, 'nu': 1.5}. Best is trial 959 with value: 0.1375110730946576.
[I 2024-12-04 20:54:57,172] Trial 1672 finished with value: 0.1446988346230584 and parameters: {'kernel_type': 'Matern', 'length_scale': 60.04547405269012, 'noise_level': 0.2756846609455091, 'constant_value': 59.05551389147, 'nu': 2.5}. Best is trial 959 with value: 0.1375110730946576.
[I 2024-12-04 20:54:57,294] Trial 1674 finished with value: 0.9982171094940401 and parameters: {'kernel_type': 'Matern', 'length_scale': 1.342428174667196, 'noise_level': 0.003012987682183474, 'constant_value': 202.9541893985399, 'nu': 1.5}. Best is trial 959 with value: 0.1375110730946576.
[I 2024-12-04 20:54:59,802] Trial 1673 finished with value: 0.9864686819125049 and parameters: {'kernel_type': 'Matern', 'length_scale': 0.018621378489753763, 'noise_level': 0.6230680960585309, 'constant_value': 52.0300629383461, 'nu': 1.5}. Best is trial 959 with value: 0.1375110730946576.
[I 2024-12-04 20:55:05,900] Trial 1677 finished with value: 0.19720002437521955 and parameters: {'kernel_type': 'Matern', 'length_scale': 0.5198501832029467, 'noise_level': 0.9091732143816729, 'constant_value': 588.3080414204215, 'nu': 0.5}. Best is trial 959 with value: 0.1375110730946576.
