[I 2024-12-04 12:23:53,323] Trial 280 finished with value: 0.23935903481675466 and parameters: {'n_estimators': 807, 'learning_rate': 0.09113945531894976, 'max_depth': 8, 'min_samples_split': 20, 'min_samples_leaf': 1, 'subsample': 0.9652987484631245, 'max_features': 'sqrt'}. Best is trial 259 with value: 0.21062976081411197.
[I 2024-12-04 12:23:54,718] Trial 276 finished with value: 0.230893357890711 and parameters: {'n_estimators': 918, 'learning_rate': 0.08111487379918035, 'max_depth': 11, 'min_samples_split': 11, 'min_samples_leaf': 1, 'subsample': 0.855545817427986, 'max_features': 'sqrt'}. Best is trial 259 with value: 0.21062976081411197.
[I 2024-12-04 12:23:55,626] Trial 263 finished with value: 0.2583614821709358 and parameters: {'n_estimators': 1426, 'learning_rate': 0.09112731437111632, 'max_depth': 8, 'min_samples_split': 17, 'min_samples_leaf': 3, 'subsample': 0.7150234380799636, 'max_features': 'sqrt'}. Best is trial 259 with value: 0.21062976081411197.
[I 2024-12-04 12:23:57,211] Trial 272 finished with value: 0.24903761246097403 and parameters: {'n_estimators': 1036, 'learning_rate': 0.08539985953013352, 'max_depth': 8, 'min_samples_split': 17, 'min_samples_leaf': 1, 'subsample': 0.9245644796708777, 'max_features': 'sqrt'}. Best is trial 259 with value: 0.21062976081411197.
[I 2024-12-04 12:23:57,212] Trial 265 finished with value: 0.24750405501754197 and parameters: {'n_estimators': 1406, 'learning_rate': 0.06343545526627897, 'max_depth': 9, 'min_samples_split': 20, 'min_samples_leaf': 2, 'subsample': 0.7624358222024318, 'max_features': 'sqrt'}. Best is trial 259 with value: 0.21062976081411197.
[I 2024-12-04 12:23:59,296] Trial 282 finished with value: 0.2516898736982481 and parameters: {'n_estimators': 831, 'learning_rate': 0.09810884153797014, 'max_depth': 10, 'min_samples_split': 18, 'min_samples_leaf': 3, 'subsample': 0.9946574279405539, 'max_features': 'sqrt'}. Best is trial 259 with value: 0.21062976081411197.
[I 2024-12-04 12:24:03,087] Trial 273 finished with value: 0.23460603945537115 and parameters: {'n_estimators': 1185, 'learning_rate': 0.08296161433320053, 'max_depth': 11, 'min_samples_split': 6, 'min_samples_leaf': 1, 'subsample': 0.7239053694188214, 'max_features': 'sqrt'}. Best is trial 259 with value: 0.21062976081411197.
[I 2024-12-04 12:24:03,123] Trial 264 finished with value: 0.23443974871208656 and parameters: {'n_estimators': 1443, 'learning_rate': 0.0915240696168706, 'max_depth': 9, 'min_samples_split': 12, 'min_samples_leaf': 1, 'subsample': 0.6870870580712582, 'max_features': 'sqrt'}. Best is trial 259 with value: 0.21062976081411197.
[I 2024-12-04 12:24:03,977] Trial 267 finished with value: 0.2245084699159079 and parameters: {'n_estimators': 1352, 'learning_rate': 0.08618379735671454, 'max_depth': 9, 'min_samples_split': 17, 'min_samples_leaf': 1, 'subsample': 0.7192395644692261, 'max_features': 'sqrt'}. Best is trial 259 with value: 0.21062976081411197.
[I 2024-12-04 12:24:05,577] Trial 284 finished with value: 0.23067189351964945 and parameters: {'n_estimators': 878, 'learning_rate': 0.08415898496358955, 'max_depth': 12, 'min_samples_split': 9, 'min_samples_leaf': 1, 'subsample': 0.8601504753575927, 'max_features': 'sqrt'}. Best is trial 259 with value: 0.21062976081411197.
[I 2024-12-04 12:24:05,583] Trial 277 finished with value: 0.30645515214500796 and parameters: {'n_estimators': 987, 'learning_rate': 0.0811681018673529, 'max_depth': 11, 'min_samples_split': 17, 'min_samples_leaf': 3, 'subsample': 0.9810620286590195, 'max_features': None}. Best is trial 259 with value: 0.21062976081411197.
[I 2024-12-04 12:24:09,955] Trial 269 finished with value: 0.24813738707051458 and parameters: {'n_estimators': 1470, 'learning_rate': 0.0585142402823964, 'max_depth': 11, 'min_samples_split': 7, 'min_samples_leaf': 2, 'subsample': 0.7857602022758611, 'max_features': 'sqrt'}. Best is trial 259 with value: 0.21062976081411197.
[I 2024-12-04 12:24:12,204] Trial 281 finished with value: 0.2240176592873918 and parameters: {'n_estimators': 1114, 'learning_rate': 0.09451590509505595, 'max_depth': 11, 'min_samples_split': 6, 'min_samples_leaf': 1, 'subsample': 0.8626659129989174, 'max_features': 'sqrt'}. Best is trial 259 with value: 0.21062976081411197.
[I 2024-12-04 12:24:14,293] Trial 283 finished with value: 0.22942350013036086 and parameters: {'n_estimators': 1062, 'learning_rate': 0.0810315706739739, 'max_depth': 10, 'min_samples_split': 20, 'min_samples_leaf': 1, 'subsample': 0.9456438183145782, 'max_features': 'sqrt'}. Best is trial 259 with value: 0.21062976081411197.
[I 2024-12-04 12:24:15,529] Trial 271 finished with value: 0.2337708202554872 and parameters: {'n_estimators': 1415, 'learning_rate': 0.09266974902726188, 'max_depth': 12, 'min_samples_split': 9, 'min_samples_leaf': 2, 'subsample': 0.8417836990792413, 'max_features': 'sqrt'}. Best is trial 259 with value: 0.21062976081411197.
[I 2024-12-04 12:24:16,800] Trial 288 finished with value: 0.3818282076731098 and parameters: {'n_estimators': 686, 'learning_rate': 0.030542709795879256, 'max_depth': 7, 'min_samples_split': 6, 'min_samples_leaf': 10, 'subsample': 0.8746283317701502, 'max_features': None}. Best is trial 259 with value: 0.21062976081411197.
[I 2024-12-04 12:24:22,398] Trial 275 finished with value: 0.23542045278959595 and parameters: {'n_estimators': 1471, 'learning_rate': 0.09984601229460191, 'max_depth': 12, 'min_samples_split': 6, 'min_samples_leaf': 1, 'subsample': 0.9833305649028019, 'max_features': 'sqrt'}. Best is trial 259 with value: 0.21062976081411197.
[I 2024-12-04 12:24:22,839] Trial 286 finished with value: 0.24748986915837473 and parameters: {'n_estimators': 1011, 'learning_rate': 0.09152694827994276, 'max_depth': 12, 'min_samples_split': 12, 'min_samples_leaf': 4, 'subsample': 0.8499506428535778, 'max_features': 'sqrt'}. Best is trial 259 with value: 0.21062976081411197.
[I 2024-12-04 12:24:24,668] Trial 300 finished with value: 0.41469006441013073 and parameters: {'n_estimators': 413, 'learning_rate': 0.016706014243951506, 'max_depth': 4, 'min_samples_split': 11, 'min_samples_leaf': 9, 'subsample': 0.7503148077723691, 'max_features': None}. Best is trial 259 with value: 0.21062976081411197.
[I 2024-12-04 12:24:26,660] Trial 279 finished with value: 0.2531372936018599 and parameters: {'n_estimators': 1484, 'learning_rate': 0.09625152593273469, 'max_depth': 10, 'min_samples_split': 8, 'min_samples_leaf': 3, 'subsample': 0.753404909281911, 'max_features': 'sqrt'}. Best is trial 259 with value: 0.21062976081411197.
[I 2024-12-04 12:24:27,813] Trial 304 finished with value: 0.3142390369717684 and parameters: {'n_estimators': 403, 'learning_rate': 0.0760275644976385, 'max_depth': 5, 'min_samples_split': 10, 'min_samples_leaf': 1, 'subsample': 0.9915131736238185, 'max_features': 'sqrt'}. Best is trial 259 with value: 0.21062976081411197.
[I 2024-12-04 12:24:28,843] Trial 310 finished with value: 0.4326446656961102 and parameters: {'n_estimators': 135, 'learning_rate': 0.03421363396786629, 'max_depth': 4, 'min_samples_split': 20, 'min_samples_leaf': 8, 'subsample': 0.6639522760838084, 'max_features': None}. Best is trial 259 with value: 0.21062976081411197.
[I 2024-12-04 12:24:28,846] Trial 278 finished with value: 0.2874072411713312 and parameters: {'n_estimators': 1389, 'learning_rate': 0.09060657300163845, 'max_depth': 9, 'min_samples_split': 18, 'min_samples_leaf': 2, 'subsample': 0.6610108595316816, 'max_features': None}. Best is trial 259 with value: 0.21062976081411197.
[I 2024-12-04 12:24:28,853] Trial 294 finished with value: 0.2453433393199176 and parameters: {'n_estimators': 753, 'learning_rate': 0.04576139732656502, 'max_depth': 12, 'min_samples_split': 18, 'min_samples_leaf': 1, 'subsample': 0.9629207845458512, 'max_features': 'sqrt'}. Best is trial 259 with value: 0.21062976081411197.
[I 2024-12-04 12:24:34,977] Trial 292 finished with value: 0.2411708995000598 and parameters: {'n_estimators': 927, 'learning_rate': 0.052971425121425476, 'max_depth': 12, 'min_samples_split': 8, 'min_samples_leaf': 1, 'subsample': 0.7390012826205737, 'max_features': 'sqrt'}. Best is trial 259 with value: 0.21062976081411197.
[I 2024-12-04 12:24:36,894] Trial 287 finished with value: 0.24608714306126062 and parameters: {'n_estimators': 1207, 'learning_rate': 0.033063795741777216, 'max_depth': 10, 'min_samples_split': 4, 'min_samples_leaf': 1, 'subsample': 0.6239389976778493, 'max_features': 'sqrt'}. Best is trial 259 with value: 0.21062976081411197.
[I 2024-12-04 12:24:38,363] Trial 285 finished with value: 0.2443852751460489 and parameters: {'n_estimators': 1406, 'learning_rate': 0.04605167064430079, 'max_depth': 8, 'min_samples_split': 5, 'min_samples_leaf': 1, 'subsample': 0.6526056068197593, 'max_features': 'sqrt'}. Best is trial 259 with value: 0.21062976081411197.
[I 2024-12-04 12:24:40,738] Trial 301 finished with value: 0.23353772544526372 and parameters: {'n_estimators': 720, 'learning_rate': 0.0659688643533618, 'max_depth': 12, 'min_samples_split': 13, 'min_samples_leaf': 2, 'subsample': 0.8890369411005383, 'max_features': 'sqrt'}. Best is trial 259 with value: 0.21062976081411197.
[I 2024-12-04 12:24:43,956] Trial 291 finished with value: 0.23806093319483213 and parameters: {'n_estimators': 1196, 'learning_rate': 0.09124660092779115, 'max_depth': 11, 'min_samples_split': 13, 'min_samples_leaf': 2, 'subsample': 0.6346536225032701, 'max_features': 'sqrt'}. Best is trial 259 with value: 0.21062976081411197.
[I 2024-12-04 12:24:45,406] Trial 290 finished with value: 0.24668931695628624 and parameters: {'n_estimators': 1258, 'learning_rate': 0.08314071430997684, 'max_depth': 10, 'min_samples_split': 15, 'min_samples_leaf': 2, 'subsample': 0.8422490209412943, 'max_features': 'sqrt'}. Best is trial 259 with value: 0.21062976081411197.
[I 2024-12-04 12:24:46,677] Trial 289 finished with value: 0.2604874583123372 and parameters: {'n_estimators': 1306, 'learning_rate': 0.07980784588724325, 'max_depth': 7, 'min_samples_split': 18, 'min_samples_leaf': 4, 'subsample': 0.936323531712707, 'max_features': 'sqrt'}. Best is trial 259 with value: 0.21062976081411197.
[I 2024-12-04 12:24:54,214] Trial 295 finished with value: 0.2438680346999412 and parameters: {'n_estimators': 1283, 'learning_rate': 0.08046950544913206, 'max_depth': 11, 'min_samples_split': 20, 'min_samples_leaf': 3, 'subsample': 0.6766740534950189, 'max_features': 'sqrt'}. Best is trial 259 with value: 0.21062976081411197.
[I 2024-12-04 12:24:56,134] Trial 302 finished with value: 0.24117662369292522 and parameters: {'n_estimators': 941, 'learning_rate': 0.09687715882869766, 'max_depth': 12, 'min_samples_split': 7, 'min_samples_leaf': 1, 'subsample': 0.8757517611476167, 'max_features': 'sqrt'}. Best is trial 259 with value: 0.21062976081411197.
[I 2024-12-04 12:24:58,164] Trial 327 finished with value: 0.6582110246862823 and parameters: {'n_estimators': 215, 'learning_rate': 0.011364701455463044, 'max_depth': 11, 'min_samples_split': 17, 'min_samples_leaf': 8, 'subsample': 0.8444792812585454, 'max_features': 'sqrt'}. Best is trial 259 with value: 0.21062976081411197.
[I 2024-12-04 12:24:59,043] Trial 297 finished with value: 0.23442192727772437 and parameters: {'n_estimators': 1259, 'learning_rate': 0.06669919435794494, 'max_depth': 11, 'min_samples_split': 3, 'min_samples_leaf': 1, 'subsample': 0.6336409305443297, 'max_features': 'sqrt'}. Best is trial 259 with value: 0.21062976081411197.
[I 2024-12-04 12:25:01,770] Trial 328 finished with value: 0.8750333155017525 and parameters: {'n_estimators': 242, 'learning_rate': 0.01875028015164088, 'max_depth': 9, 'min_samples_split': 5, 'min_samples_leaf': 10, 'subsample': 0.8621799063610731, 'max_features': 'log2'}. Best is trial 259 with value: 0.21062976081411197.
[I 2024-12-04 12:25:01,772] Trial 311 finished with value: 0.25664318989494195 and parameters: {'n_estimators': 797, 'learning_rate': 0.05313873362761055, 'max_depth': 8, 'min_samples_split': 12, 'min_samples_leaf': 1, 'subsample': 0.9851429192540172, 'max_features': 'sqrt'}. Best is trial 259 with value: 0.21062976081411197.
[I 2024-12-04 12:25:05,157] Trial 293 finished with value: 0.2141631362571464 and parameters: {'n_estimators': 1424, 'learning_rate': 0.09964781524641945, 'max_depth': 10, 'min_samples_split': 11, 'min_samples_leaf': 1, 'subsample': 0.8057991867952062, 'max_features': 'sqrt'}. Best is trial 259 with value: 0.21062976081411197.
[I 2024-12-04 12:25:05,159] Trial 296 finished with value: 0.2357505117174815 and parameters: {'n_estimators': 1347, 'learning_rate': 0.05873976307933469, 'max_depth': 11, 'min_samples_split': 5, 'min_samples_leaf': 1, 'subsample': 0.658860306865464, 'max_features': 'sqrt'}. Best is trial 259 with value: 0.21062976081411197.
[I 2024-12-04 12:25:09,541] Trial 303 finished with value: 0.2230111856158578 and parameters: {'n_estimators': 1238, 'learning_rate': 0.06856552381303913, 'max_depth': 10, 'min_samples_split': 12, 'min_samples_leaf': 1, 'subsample': 0.8855191024121051, 'max_features': 'sqrt'}. Best is trial 259 with value: 0.21062976081411197.
[I 2024-12-04 12:25:12,166] Trial 299 finished with value: 0.24703381761255727 and parameters: {'n_estimators': 1479, 'learning_rate': 0.052340443395480975, 'max_depth': 6, 'min_samples_split': 12, 'min_samples_leaf': 1, 'subsample': 0.847030380094898, 'max_features': 'sqrt'}. Best is trial 259 with value: 0.21062976081411197.
[I 2024-12-04 12:25:12,205] Trial 298 finished with value: 0.2682287539649963 and parameters: {'n_estimators': 1334, 'learning_rate': 0.09428549023329917, 'max_depth': 12, 'min_samples_split': 14, 'min_samples_leaf': 1, 'subsample': 0.6448103104240392, 'max_features': None}. Best is trial 259 with value: 0.21062976081411197.
[I 2024-12-04 12:25:15,196] Trial 333 finished with value: 0.48609284657670987 and parameters: {'n_estimators': 277, 'learning_rate': 0.06334412700988816, 'max_depth': 4, 'min_samples_split': 7, 'min_samples_leaf': 1, 'subsample': 0.7994510066410724, 'max_features': 'log2'}. Best is trial 259 with value: 0.21062976081411197.
[I 2024-12-04 12:25:16,640] Trial 308 finished with value: 0.23907811363576162 and parameters: {'n_estimators': 1201, 'learning_rate': 0.07399908264832278, 'max_depth': 11, 'min_samples_split': 7, 'min_samples_leaf': 1, 'subsample': 0.8114671821631884, 'max_features': 'sqrt'}. Best is trial 259 with value: 0.21062976081411197.
[I 2024-12-04 12:25:16,650] Trial 309 finished with value: 0.23157796344685946 and parameters: {'n_estimators': 1206, 'learning_rate': 0.09425969960317938, 'max_depth': 11, 'min_samples_split': 18, 'min_samples_leaf': 1, 'subsample': 0.9778299114499952, 'max_features': 'sqrt'}. Best is trial 259 with value: 0.21062976081411197.
[I 2024-12-04 12:25:16,654] Trial 322 finished with value: 0.24005729520400743 and parameters: {'n_estimators': 770, 'learning_rate': 0.09572270194246928, 'max_depth': 12, 'min_samples_split': 9, 'min_samples_leaf': 1, 'subsample': 0.792362622173437, 'max_features': 'sqrt'}. Best is trial 259 with value: 0.21062976081411197.
[I 2024-12-04 12:25:16,657] Trial 313 finished with value: 0.24074234168214945 and parameters: {'n_estimators': 1071, 'learning_rate': 0.08529125003788496, 'max_depth': 9, 'min_samples_split': 20, 'min_samples_leaf': 1, 'subsample': 0.9619763448981892, 'max_features': 'sqrt'}. Best is trial 259 with value: 0.21062976081411197.
[I 2024-12-04 12:25:18,255] Trial 315 finished with value: 0.24371108509388653 and parameters: {'n_estimators': 1007, 'learning_rate': 0.0610040486058748, 'max_depth': 11, 'min_samples_split': 6, 'min_samples_leaf': 1, 'subsample': 0.8781661606131634, 'max_features': 'sqrt'}. Best is trial 259 with value: 0.21062976081411197.
[I 2024-12-04 12:25:18,301] Trial 307 finished with value: 0.2469702518812763 and parameters: {'n_estimators': 1247, 'learning_rate': 0.08974328554143111, 'max_depth': 10, 'min_samples_split': 4, 'min_samples_leaf': 1, 'subsample': 0.9213004296363422, 'max_features': 'sqrt'}. Best is trial 259 with value: 0.21062976081411197.
[I 2024-12-04 12:25:21,132] Trial 305 finished with value: 0.22800902446255117 and parameters: {'n_estimators': 1378, 'learning_rate': 0.0649497536249299, 'max_depth': 9, 'min_samples_split': 18, 'min_samples_leaf': 1, 'subsample': 0.6762951213610203, 'max_features': 'sqrt'}. Best is trial 259 with value: 0.21062976081411197.
[I 2024-12-04 12:25:23,014] Trial 306 finished with value: 0.22359069648729163 and parameters: {'n_estimators': 1431, 'learning_rate': 0.05748658993211909, 'max_depth': 9, 'min_samples_split': 9, 'min_samples_leaf': 1, 'subsample': 0.9130082009153215, 'max_features': 'sqrt'}. Best is trial 259 with value: 0.21062976081411197.
[I 2024-12-04 12:25:23,866] Trial 326 finished with value: 0.24348518868058197 and parameters: {'n_estimators': 836, 'learning_rate': 0.0960566858816703, 'max_depth': 10, 'min_samples_split': 14, 'min_samples_leaf': 2, 'subsample': 0.975287574235779, 'max_features': 'sqrt'}. Best is trial 259 with value: 0.21062976081411197.
[I 2024-12-04 12:25:27,556] Trial 324 finished with value: 0.25676143632044607 and parameters: {'n_estimators': 936, 'learning_rate': 0.07760058297105708, 'max_depth': 12, 'min_samples_split': 7, 'min_samples_leaf': 1, 'subsample': 0.808996065854642, 'max_features': 'log2'}. Best is trial 259 with value: 0.21062976081411197.
[I 2024-12-04 12:25:28,489] Trial 320 finished with value: 0.46899105795245516 and parameters: {'n_estimators': 1126, 'learning_rate': 0.017929973331608853, 'max_depth': 9, 'min_samples_split': 5, 'min_samples_leaf': 6, 'subsample': 0.9795637369237266, 'max_features': 'log2'}. Best is trial 259 with value: 0.21062976081411197.
[I 2024-12-04 12:25:29,230] Trial 325 finished with value: 0.22625308323477325 and parameters: {'n_estimators': 982, 'learning_rate': 0.0898878302066419, 'max_depth': 12, 'min_samples_split': 20, 'min_samples_leaf': 1, 'subsample': 0.909943899141493, 'max_features': 'sqrt'}. Best is trial 259 with value: 0.21062976081411197.
[I 2024-12-04 12:25:29,506] Trial 316 finished with value: 0.23239986175200464 and parameters: {'n_estimators': 1310, 'learning_rate': 0.08288683323739209, 'max_depth': 10, 'min_samples_split': 16, 'min_samples_leaf': 1, 'subsample': 0.701555287928117, 'max_features': 'sqrt'}. Best is trial 259 with value: 0.21062976081411197.
[I 2024-12-04 12:25:29,513] Trial 317 finished with value: 0.38203439726881183 and parameters: {'n_estimators': 1160, 'learning_rate': 0.012245374153815878, 'max_depth': 6, 'min_samples_split': 8, 'min_samples_leaf': 8, 'subsample': 0.6642576523042071, 'max_features': None}. Best is trial 259 with value: 0.21062976081411197.
[I 2024-12-04 12:25:31,963] Trial 312 finished with value: 0.31233668877650816 and parameters: {'n_estimators': 1296, 'learning_rate': 0.08650147501503112, 'max_depth': 12, 'min_samples_split': 7, 'min_samples_leaf': 3, 'subsample': 0.7786591916725365, 'max_features': None}. Best is trial 259 with value: 0.21062976081411197.
[I 2024-12-04 12:25:32,294] Trial 319 finished with value: 0.21934937047351777 and parameters: {'n_estimators': 1180, 'learning_rate': 0.09793245567898334, 'max_depth': 12, 'min_samples_split': 6, 'min_samples_leaf': 1, 'subsample': 0.786342944145794, 'max_features': 'sqrt'}. Best is trial 259 with value: 0.21062976081411197.
[I 2024-12-04 12:25:35,768] Trial 321 finished with value: 0.3751040847567251 and parameters: {'n_estimators': 1126, 'learning_rate': 0.0891969011576406, 'max_depth': 11, 'min_samples_split': 12, 'min_samples_leaf': 9, 'subsample': 0.6776435045618949, 'max_features': None}. Best is trial 259 with value: 0.21062976081411197.
[I 2024-12-04 12:25:36,029] Trial 344 finished with value: 0.7511240424864873 and parameters: {'n_estimators': 329, 'learning_rate': 0.0186831447810727, 'max_depth': 7, 'min_samples_split': 19, 'min_samples_leaf': 6, 'subsample': 0.7062387936078064, 'max_features': 'log2'}. Best is trial 259 with value: 0.21062976081411197.
[I 2024-12-04 12:25:42,725] Trial 318 finished with value: 0.2640635175415432 and parameters: {'n_estimators': 1399, 'learning_rate': 0.08421186388017884, 'max_depth': 7, 'min_samples_split': 14, 'min_samples_leaf': 3, 'subsample': 0.9915338308687051, 'max_features': 'sqrt'}. Best is trial 259 with value: 0.21062976081411197.
[I 2024-12-04 12:25:42,767] Trial 346 finished with value: 0.3561301083170025 and parameters: {'n_estimators': 228, 'learning_rate': 0.06725029436871523, 'max_depth': 10, 'min_samples_split': 16, 'min_samples_leaf': 7, 'subsample': 0.6566285671090923, 'max_features': None}. Best is trial 259 with value: 0.21062976081411197.
[I 2024-12-04 12:25:43,064] Trial 323 finished with value: 0.2453484609589259 and parameters: {'n_estimators': 1382, 'learning_rate': 0.06758655845236798, 'max_depth': 9, 'min_samples_split': 9, 'min_samples_leaf': 2, 'subsample': 0.9805750745500651, 'max_features': 'sqrt'}. Best is trial 259 with value: 0.21062976081411197.
[I 2024-12-04 12:25:45,385] Trial 314 finished with value: 0.2692639427934239 and parameters: {'n_estimators': 1494, 'learning_rate': 0.05657399444390412, 'max_depth': 8, 'min_samples_split': 12, 'min_samples_leaf': 1, 'subsample': 0.81352773381913, 'max_features': None}. Best is trial 259 with value: 0.21062976081411197.
[I 2024-12-04 12:25:45,753] Trial 329 finished with value: 0.2413368021292221 and parameters: {'n_estimators': 1229, 'learning_rate': 0.09941958013898164, 'max_depth': 11, 'min_samples_split': 5, 'min_samples_leaf': 1, 'subsample': 0.8687089265711974, 'max_features': 'sqrt'}. Best is trial 259 with value: 0.21062976081411197.
[I 2024-12-04 12:25:51,495] Trial 338 finished with value: 0.7050908901166073 and parameters: {'n_estimators': 931, 'learning_rate': 0.010105990459005837, 'max_depth': 11, 'min_samples_split': 16, 'min_samples_leaf': 8, 'subsample': 0.7436770687846529, 'max_features': 'log2'}. Best is trial 259 with value: 0.21062976081411197.
