[I 2024-12-04 12:23:38,804] Trial 531 finished with value: 0.36871723868092093 and parameters: {'n_estimators': 1479, 'learning_rate': 0.07245140040501272, 'max_depth': 8, 'min_samples_split': 4, 'min_samples_leaf': 2, 'subsample': 0.6921369965863922, 'max_features': 'sqrt'}. Best is trial 428 with value: 0.31740361133065975.
[I 2024-12-04 12:23:39,644] Trial 538 finished with value: 0.3911988958972823 and parameters: {'n_estimators': 1125, 'learning_rate': 0.0992517071977037, 'max_depth': 5, 'min_samples_split': 7, 'min_samples_leaf': 3, 'subsample': 0.6614492403303786, 'max_features': None}. Best is trial 428 with value: 0.31740361133065975.
[I 2024-12-04 12:23:39,727] Trial 539 finished with value: 0.3235692170243994 and parameters: {'n_estimators': 1063, 'learning_rate': 0.09831154420740956, 'max_depth': 6, 'min_samples_split': 5, 'min_samples_leaf': 2, 'subsample': 0.6969414767852146, 'max_features': None}. Best is trial 428 with value: 0.31740361133065975.
[I 2024-12-04 12:23:42,387] Trial 546 finished with value: 0.7485092607182591 and parameters: {'n_estimators': 1050, 'learning_rate': 0.02773392091044671, 'max_depth': 4, 'min_samples_split': 7, 'min_samples_leaf': 9, 'subsample': 0.790323229703439, 'max_features': 'log2'}. Best is trial 428 with value: 0.31740361133065975.
[I 2024-12-04 12:23:42,627] Trial 528 finished with value: 0.3680402462344321 and parameters: {'n_estimators': 1434, 'learning_rate': 0.052420358308442896, 'max_depth': 10, 'min_samples_split': 15, 'min_samples_leaf': 1, 'subsample': 0.6875173425687374, 'max_features': None}. Best is trial 428 with value: 0.31740361133065975.
[I 2024-12-04 12:23:42,716] Trial 532 finished with value: 0.4334121494207997 and parameters: {'n_estimators': 1384, 'learning_rate': 0.01061178433731294, 'max_depth': 5, 'min_samples_split': 5, 'min_samples_leaf': 7, 'subsample': 0.7354518435817393, 'max_features': None}. Best is trial 428 with value: 0.31740361133065975.
[I 2024-12-04 12:23:43,032] Trial 535 finished with value: 0.3899003437154604 and parameters: {'n_estimators': 1229, 'learning_rate': 0.01628583535178278, 'max_depth': 11, 'min_samples_split': 2, 'min_samples_leaf': 3, 'subsample': 0.8363394249939772, 'max_features': None}. Best is trial 428 with value: 0.31740361133065975.
[I 2024-12-04 12:23:43,467] Trial 548 finished with value: 0.4147550019610342 and parameters: {'n_estimators': 802, 'learning_rate': 0.09121773213507438, 'max_depth': 4, 'min_samples_split': 2, 'min_samples_leaf': 3, 'subsample': 0.6107512844826173, 'max_features': None}. Best is trial 428 with value: 0.31740361133065975.
[I 2024-12-04 12:23:44,670] Trial 552 finished with value: 0.6980167530479414 and parameters: {'n_estimators': 752, 'learning_rate': 0.051217847459330064, 'max_depth': 11, 'min_samples_split': 3, 'min_samples_leaf': 10, 'subsample': 0.7588317450977569, 'max_features': 'log2'}. Best is trial 428 with value: 0.31740361133065975.
[I 2024-12-04 12:23:46,628] Trial 540 finished with value: 0.4107060181441879 and parameters: {'n_estimators': 1213, 'learning_rate': 0.02515073071723245, 'max_depth': 8, 'min_samples_split': 4, 'min_samples_leaf': 1, 'subsample': 0.7987498416231051, 'max_features': None}. Best is trial 428 with value: 0.31740361133065975.
[I 2024-12-04 12:23:46,670] Trial 549 finished with value: 0.5626197312098882 and parameters: {'n_estimators': 989, 'learning_rate': 0.013560782306608675, 'max_depth': 5, 'min_samples_split': 20, 'min_samples_leaf': 7, 'subsample': 0.8086429032432957, 'max_features': 'sqrt'}. Best is trial 428 with value: 0.31740361133065975.
[I 2024-12-04 12:23:48,835] Trial 541 finished with value: 0.3866295238845022 and parameters: {'n_estimators': 1460, 'learning_rate': 0.0434062421940652, 'max_depth': 8, 'min_samples_split': 12, 'min_samples_leaf': 1, 'subsample': 0.7313014049613707, 'max_features': 'sqrt'}. Best is trial 428 with value: 0.31740361133065975.
[I 2024-12-04 12:23:49,475] Trial 547 finished with value: 0.6090144968544984 and parameters: {'n_estimators': 1306, 'learning_rate': 0.03365101510741557, 'max_depth': 3, 'min_samples_split': 11, 'min_samples_leaf': 10, 'subsample': 0.7424056487784716, 'max_features': 'sqrt'}. Best is trial 428 with value: 0.31740361133065975.
[I 2024-12-04 12:23:49,997] Trial 545 finished with value: 0.3729609600959705 and parameters: {'n_estimators': 1228, 'learning_rate': 0.060304759924477466, 'max_depth': 7, 'min_samples_split': 5, 'min_samples_leaf': 1, 'subsample': 0.6627133788193739, 'max_features': None}. Best is trial 428 with value: 0.31740361133065975.
[I 2024-12-04 12:23:52,934] Trial 543 finished with value: 0.38349809508491145 and parameters: {'n_estimators': 1287, 'learning_rate': 0.01806514997889465, 'max_depth': 10, 'min_samples_split': 6, 'min_samples_leaf': 5, 'subsample': 0.7520575727321211, 'max_features': None}. Best is trial 428 with value: 0.31740361133065975.
[I 2024-12-04 12:23:56,787] Trial 577 finished with value: 0.8701726747128052 and parameters: {'n_estimators': 250, 'learning_rate': 0.016560326698913646, 'max_depth': 3, 'min_samples_split': 18, 'min_samples_leaf': 9, 'subsample': 0.6278740196346719, 'max_features': 'sqrt'}. Best is trial 428 with value: 0.31740361133065975.
[I 2024-12-04 12:23:58,188] Trial 550 finished with value: 0.39100647389029436 and parameters: {'n_estimators': 1227, 'learning_rate': 0.05469894867971803, 'max_depth': 7, 'min_samples_split': 6, 'min_samples_leaf': 3, 'subsample': 0.7406330952982066, 'max_features': None}. Best is trial 428 with value: 0.31740361133065975.
[I 2024-12-04 12:24:00,181] Trial 551 finished with value: 0.3791986038536269 and parameters: {'n_estimators': 1225, 'learning_rate': 0.03532129952850057, 'max_depth': 9, 'min_samples_split': 12, 'min_samples_leaf': 1, 'subsample': 0.7846386805311535, 'max_features': None}. Best is trial 428 with value: 0.31740361133065975.
[I 2024-12-04 12:24:00,875] Trial 554 finished with value: 0.37498731491918996 and parameters: {'n_estimators': 1031, 'learning_rate': 0.046557913853937344, 'max_depth': 9, 'min_samples_split': 9, 'min_samples_leaf': 1, 'subsample': 0.7057565154759237, 'max_features': None}. Best is trial 428 with value: 0.31740361133065975.
[I 2024-12-04 12:24:05,515] Trial 556 finished with value: 0.3796856129516935 and parameters: {'n_estimators': 1153, 'learning_rate': 0.08092221761054555, 'max_depth': 8, 'min_samples_split': 7, 'min_samples_leaf': 3, 'subsample': 0.7265206320071197, 'max_features': None}. Best is trial 428 with value: 0.31740361133065975.
[I 2024-12-04 12:24:06,302] Trial 562 finished with value: 0.3839485166768157 and parameters: {'n_estimators': 1006, 'learning_rate': 0.017698197009546654, 'max_depth': 8, 'min_samples_split': 7, 'min_samples_leaf': 4, 'subsample': 0.8464732413098023, 'max_features': None}. Best is trial 428 with value: 0.31740361133065975.
[I 2024-12-04 12:24:08,223] Trial 555 finished with value: 0.3356228448300585 and parameters: {'n_estimators': 1264, 'learning_rate': 0.05535939783341969, 'max_depth': 10, 'min_samples_split': 3, 'min_samples_leaf': 2, 'subsample': 0.6502951111389443, 'max_features': None}. Best is trial 428 with value: 0.31740361133065975.
[I 2024-12-04 12:24:09,489] Trial 553 finished with value: 0.38479129599258627 and parameters: {'n_estimators': 1389, 'learning_rate': 0.06442655328990697, 'max_depth': 10, 'min_samples_split': 3, 'min_samples_leaf': 3, 'subsample': 0.6552198740336523, 'max_features': None}. Best is trial 428 with value: 0.31740361133065975.
[I 2024-12-04 12:24:10,368] Trial 560 finished with value: 0.37954371858344554 and parameters: {'n_estimators': 1225, 'learning_rate': 0.04423293697222227, 'max_depth': 6, 'min_samples_split': 9, 'min_samples_leaf': 1, 'subsample': 0.6054541575678762, 'max_features': None}. Best is trial 428 with value: 0.31740361133065975.
[I 2024-12-04 12:24:10,408] Trial 563 finished with value: 0.383784776978942 and parameters: {'n_estimators': 1116, 'learning_rate': 0.04163109219177284, 'max_depth': 9, 'min_samples_split': 2, 'min_samples_leaf': 5, 'subsample': 0.6367472723576844, 'max_features': None}. Best is trial 428 with value: 0.31740361133065975.
[I 2024-12-04 12:24:11,161] Trial 561 finished with value: 0.39290250765526313 and parameters: {'n_estimators': 1165, 'learning_rate': 0.05168984102138583, 'max_depth': 8, 'min_samples_split': 2, 'min_samples_leaf': 3, 'subsample': 0.7322974929400051, 'max_features': None}. Best is trial 428 with value: 0.31740361133065975.
[I 2024-12-04 12:24:12,963] Trial 581 finished with value: 0.4597818418898298 and parameters: {'n_estimators': 626, 'learning_rate': 0.02321502133333, 'max_depth': 3, 'min_samples_split': 4, 'min_samples_leaf': 6, 'subsample': 0.7679852788891155, 'max_features': None}. Best is trial 428 with value: 0.31740361133065975.
[I 2024-12-04 12:24:14,192] Trial 570 finished with value: 0.4209317703656289 and parameters: {'n_estimators': 1105, 'learning_rate': 0.03719268038655469, 'max_depth': 8, 'min_samples_split': 3, 'min_samples_leaf': 4, 'subsample': 0.6688976726916694, 'max_features': 'sqrt'}. Best is trial 428 with value: 0.31740361133065975.
[I 2024-12-04 12:24:15,326] Trial 567 finished with value: 0.3330357112976981 and parameters: {'n_estimators': 1054, 'learning_rate': 0.06043835214132419, 'max_depth': 9, 'min_samples_split': 5, 'min_samples_leaf': 2, 'subsample': 0.6356636311577248, 'max_features': None}. Best is trial 428 with value: 0.31740361133065975.
[I 2024-12-04 12:24:15,573] Trial 564 finished with value: 0.3913857586608934 and parameters: {'n_estimators': 1364, 'learning_rate': 0.08959335601844212, 'max_depth': 11, 'min_samples_split': 3, 'min_samples_leaf': 1, 'subsample': 0.7555575343666592, 'max_features': 'sqrt'}. Best is trial 428 with value: 0.31740361133065975.
[I 2024-12-04 12:24:15,574] Trial 565 finished with value: 0.32027856947678385 and parameters: {'n_estimators': 1134, 'learning_rate': 0.08050016815730904, 'max_depth': 6, 'min_samples_split': 5, 'min_samples_leaf': 2, 'subsample': 0.9098626897310793, 'max_features': None}. Best is trial 428 with value: 0.31740361133065975.
[I 2024-12-04 12:24:16,326] Trial 557 finished with value: 0.3765936830571763 and parameters: {'n_estimators': 1414, 'learning_rate': 0.08159290805006973, 'max_depth': 8, 'min_samples_split': 2, 'min_samples_leaf': 4, 'subsample': 0.7106492013861523, 'max_features': None}. Best is trial 428 with value: 0.31740361133065975.
[I 2024-12-04 12:24:16,617] Trial 569 finished with value: 0.40797981783443693 and parameters: {'n_estimators': 1230, 'learning_rate': 0.08969041355341273, 'max_depth': 10, 'min_samples_split': 10, 'min_samples_leaf': 5, 'subsample': 0.6133997023166516, 'max_features': 'sqrt'}. Best is trial 428 with value: 0.31740361133065975.
[I 2024-12-04 12:24:16,624] Trial 571 finished with value: 0.4528661207080901 and parameters: {'n_estimators': 1043, 'learning_rate': 0.010976998619110421, 'max_depth': 7, 'min_samples_split': 2, 'min_samples_leaf': 2, 'subsample': 0.8050770789880699, 'max_features': 'sqrt'}. Best is trial 428 with value: 0.31740361133065975.
[I 2024-12-04 12:24:19,455] Trial 559 finished with value: 0.38960963531422743 and parameters: {'n_estimators': 1475, 'learning_rate': 0.044559571434658385, 'max_depth': 6, 'min_samples_split': 2, 'min_samples_leaf': 1, 'subsample': 0.8637261731178234, 'max_features': None}. Best is trial 428 with value: 0.31740361133065975.
[I 2024-12-04 12:24:19,460] Trial 558 finished with value: 0.32288510013992666 and parameters: {'n_estimators': 1469, 'learning_rate': 0.05359295901715734, 'max_depth': 7, 'min_samples_split': 2, 'min_samples_leaf': 2, 'subsample': 0.7860340269906991, 'max_features': None}. Best is trial 428 with value: 0.31740361133065975.
[I 2024-12-04 12:24:22,092] Trial 576 finished with value: 0.38566087553855016 and parameters: {'n_estimators': 985, 'learning_rate': 0.014024735292783164, 'max_depth': 6, 'min_samples_split': 5, 'min_samples_leaf': 2, 'subsample': 0.7860514104169459, 'max_features': None}. Best is trial 428 with value: 0.31740361133065975.
[I 2024-12-04 12:24:22,608] Trial 572 finished with value: 0.4256694210322532 and parameters: {'n_estimators': 1155, 'learning_rate': 0.09446786832840436, 'max_depth': 3, 'min_samples_split': 7, 'min_samples_leaf': 1, 'subsample': 0.8169779185897129, 'max_features': None}. Best is trial 428 with value: 0.31740361133065975.
[I 2024-12-04 12:24:24,016] Trial 568 finished with value: 0.36905420060778155 and parameters: {'n_estimators': 1299, 'learning_rate': 0.049266104694788336, 'max_depth': 9, 'min_samples_split': 8, 'min_samples_leaf': 4, 'subsample': 0.6598820223140395, 'max_features': None}. Best is trial 428 with value: 0.31740361133065975.
[I 2024-12-04 12:24:26,133] Trial 578 finished with value: 0.35909374533814326 and parameters: {'n_estimators': 1032, 'learning_rate': 0.07671388028872923, 'max_depth': 8, 'min_samples_split': 2, 'min_samples_leaf': 1, 'subsample': 0.6793911976818222, 'max_features': None}. Best is trial 428 with value: 0.31740361133065975.
[I 2024-12-04 12:24:27,089] Trial 566 finished with value: 0.33264647851281304 and parameters: {'n_estimators': 1450, 'learning_rate': 0.05675309831587803, 'max_depth': 7, 'min_samples_split': 2, 'min_samples_leaf': 2, 'subsample': 0.656667595909482, 'max_features': None}. Best is trial 428 with value: 0.31740361133065975.
[I 2024-12-04 12:24:27,090] Trial 579 finished with value: 0.34296086673303094 and parameters: {'n_estimators': 1060, 'learning_rate': 0.07906154429390012, 'max_depth': 8, 'min_samples_split': 2, 'min_samples_leaf': 2, 'subsample': 0.6666549505322883, 'max_features': None}. Best is trial 428 with value: 0.31740361133065975.
[I 2024-12-04 12:24:28,292] Trial 573 finished with value: 0.3418369667311084 and parameters: {'n_estimators': 1269, 'learning_rate': 0.0160844072505591, 'max_depth': 9, 'min_samples_split': 5, 'min_samples_leaf': 2, 'subsample': 0.7812835646379025, 'max_features': None}. Best is trial 428 with value: 0.31740361133065975.
[I 2024-12-04 12:24:31,563] Trial 582 finished with value: 0.3531078576532406 and parameters: {'n_estimators': 1203, 'learning_rate': 0.08863346312662619, 'max_depth': 4, 'min_samples_split': 2, 'min_samples_leaf': 2, 'subsample': 0.7210841184056915, 'max_features': None}. Best is trial 428 with value: 0.31740361133065975.
[I 2024-12-04 12:24:31,585] Trial 580 finished with value: 0.35486718269066114 and parameters: {'n_estimators': 1126, 'learning_rate': 0.0841815147352925, 'max_depth': 9, 'min_samples_split': 8, 'min_samples_leaf': 2, 'subsample': 0.8440334468026368, 'max_features': None}. Best is trial 428 with value: 0.31740361133065975.
[I 2024-12-04 12:24:32,316] Trial 574 finished with value: 0.3735389863994018 and parameters: {'n_estimators': 1446, 'learning_rate': 0.0814196017614511, 'max_depth': 5, 'min_samples_split': 2, 'min_samples_leaf': 1, 'subsample': 0.7378187773573477, 'max_features': None}. Best is trial 428 with value: 0.31740361133065975.
[I 2024-12-04 12:24:32,987] Trial 596 finished with value: 0.4823377698387676 and parameters: {'n_estimators': 435, 'learning_rate': 0.012778063997071758, 'max_depth': 12, 'min_samples_split': 2, 'min_samples_leaf': 1, 'subsample': 0.6497446425465825, 'max_features': 'sqrt'}. Best is trial 428 with value: 0.31740361133065975.
[I 2024-12-04 12:24:35,624] Trial 599 finished with value: 0.5543452911387453 and parameters: {'n_estimators': 457, 'learning_rate': 0.013976690229278561, 'max_depth': 8, 'min_samples_split': 4, 'min_samples_leaf': 4, 'subsample': 0.9803870935698282, 'max_features': 'sqrt'}. Best is trial 428 with value: 0.31740361133065975.
[I 2024-12-04 12:24:35,919] Trial 575 finished with value: 0.36790746647318 and parameters: {'n_estimators': 1394, 'learning_rate': 0.04278748490207573, 'max_depth': 10, 'min_samples_split': 6, 'min_samples_leaf': 1, 'subsample': 0.6455037657468027, 'max_features': None}. Best is trial 428 with value: 0.31740361133065975.
[I 2024-12-04 12:24:36,053] Trial 590 finished with value: 0.3621278094803492 and parameters: {'n_estimators': 736, 'learning_rate': 0.09300244074140543, 'max_depth': 4, 'min_samples_split': 4, 'min_samples_leaf': 2, 'subsample': 0.7378248622046136, 'max_features': None}. Best is trial 428 with value: 0.31740361133065975.
[I 2024-12-04 12:24:38,860] Trial 585 finished with value: 0.3562595391568922 and parameters: {'n_estimators': 1299, 'learning_rate': 0.07040872882804704, 'max_depth': 10, 'min_samples_split': 6, 'min_samples_leaf': 1, 'subsample': 0.7811287154610315, 'max_features': 'log2'}. Best is trial 428 with value: 0.31740361133065975.
[I 2024-12-04 12:24:38,889] Trial 583 finished with value: 0.4096779953078245 and parameters: {'n_estimators': 1450, 'learning_rate': 0.03372844574149117, 'max_depth': 4, 'min_samples_split': 17, 'min_samples_leaf': 1, 'subsample': 0.7001877299103458, 'max_features': 'sqrt'}. Best is trial 428 with value: 0.31740361133065975.
[I 2024-12-04 12:24:38,891] Trial 589 finished with value: 0.489888140252404 and parameters: {'n_estimators': 1013, 'learning_rate': 0.05420837156076332, 'max_depth': 5, 'min_samples_split': 15, 'min_samples_leaf': 5, 'subsample': 0.8425882922270528, 'max_features': 'log2'}. Best is trial 428 with value: 0.31740361133065975.
[I 2024-12-04 12:24:45,965] Trial 594 finished with value: 0.3757376446329663 and parameters: {'n_estimators': 923, 'learning_rate': 0.09767893933645025, 'max_depth': 5, 'min_samples_split': 7, 'min_samples_leaf': 4, 'subsample': 0.9023227119662128, 'max_features': None}. Best is trial 428 with value: 0.31740361133065975.
[I 2024-12-04 12:24:47,527] Trial 588 finished with value: 0.3923933401622513 and parameters: {'n_estimators': 1249, 'learning_rate': 0.09413977983076721, 'max_depth': 5, 'min_samples_split': 2, 'min_samples_leaf': 3, 'subsample': 0.7799192436676512, 'max_features': None}. Best is trial 428 with value: 0.31740361133065975.
[I 2024-12-04 12:24:48,113] Trial 584 finished with value: 0.32107708734772983 and parameters: {'n_estimators': 1489, 'learning_rate': 0.09854928017655254, 'max_depth': 7, 'min_samples_split': 2, 'min_samples_leaf': 2, 'subsample': 0.7161820032606968, 'max_features': None}. Best is trial 428 with value: 0.31740361133065975.
[I 2024-12-04 12:24:50,396] Trial 593 finished with value: 0.3649406565297991 and parameters: {'n_estimators': 1256, 'learning_rate': 0.07327090183837998, 'max_depth': 8, 'min_samples_split': 10, 'min_samples_leaf': 2, 'subsample': 0.6692973089710503, 'max_features': 'sqrt'}. Best is trial 428 with value: 0.31740361133065975.
[I 2024-12-04 12:24:51,765] Trial 586 finished with value: 0.38449084654973825 and parameters: {'n_estimators': 1484, 'learning_rate': 0.05835653327317877, 'max_depth': 9, 'min_samples_split': 4, 'min_samples_leaf': 1, 'subsample': 0.7345621662820412, 'max_features': None}. Best is trial 428 with value: 0.31740361133065975.
[I 2024-12-04 12:24:53,257] Trial 595 finished with value: 0.45367754253453374 and parameters: {'n_estimators': 1249, 'learning_rate': 0.08064867518413593, 'max_depth': 4, 'min_samples_split': 4, 'min_samples_leaf': 4, 'subsample': 0.6240322973960293, 'max_features': 'log2'}. Best is trial 428 with value: 0.31740361133065975.
[I 2024-12-04 12:24:53,594] Trial 619 finished with value: 0.6350179506971794 and parameters: {'n_estimators': 394, 'learning_rate': 0.01985566892088855, 'max_depth': 4, 'min_samples_split': 6, 'min_samples_leaf': 3, 'subsample': 0.834569785119899, 'max_features': 'sqrt'}. Best is trial 428 with value: 0.31740361133065975.
[I 2024-12-04 12:24:54,116] Trial 591 finished with value: 0.33318757263580506 and parameters: {'n_estimators': 1226, 'learning_rate': 0.049654403266907045, 'max_depth': 10, 'min_samples_split': 4, 'min_samples_leaf': 2, 'subsample': 0.6473478562227454, 'max_features': None}. Best is trial 428 with value: 0.31740361133065975.
[I 2024-12-04 12:24:55,200] Trial 587 finished with value: 0.37396059210637594 and parameters: {'n_estimators': 1479, 'learning_rate': 0.054647611702291356, 'max_depth': 6, 'min_samples_split': 5, 'min_samples_leaf': 1, 'subsample': 0.719225977918675, 'max_features': None}. Best is trial 428 with value: 0.31740361133065975.
[I 2024-12-04 12:24:55,842] Trial 616 finished with value: 0.5650432810744977 and parameters: {'n_estimators': 517, 'learning_rate': 0.016116957661035988, 'max_depth': 6, 'min_samples_split': 6, 'min_samples_leaf': 10, 'subsample': 0.8842027398598772, 'max_features': None}. Best is trial 428 with value: 0.31740361133065975.
[I 2024-12-04 12:24:57,586] Trial 603 finished with value: 0.5524989563253756 and parameters: {'n_estimators': 1028, 'learning_rate': 0.0259051165735165, 'max_depth': 4, 'min_samples_split': 9, 'min_samples_leaf': 9, 'subsample': 0.989808267503276, 'max_features': None}. Best is trial 428 with value: 0.31740361133065975.
[I 2024-12-04 12:24:58,530] Trial 592 finished with value: 0.33563439194460143 and parameters: {'n_estimators': 1304, 'learning_rate': 0.03923515242462491, 'max_depth': 11, 'min_samples_split': 2, 'min_samples_leaf': 2, 'subsample': 0.6758369946158997, 'max_features': None}. Best is trial 428 with value: 0.31740361133065975.
[I 2024-12-04 12:25:00,777] Trial 601 finished with value: 0.33541317672735554 and parameters: {'n_estimators': 1148, 'learning_rate': 0.06290025070778332, 'max_depth': 4, 'min_samples_split': 2, 'min_samples_leaf': 2, 'subsample': 0.8370150417270208, 'max_features': None}. Best is trial 428 with value: 0.31740361133065975.
[I 2024-12-04 12:25:01,114] Trial 600 finished with value: 0.38780528503733347 and parameters: {'n_estimators': 1123, 'learning_rate': 0.059470981706726635, 'max_depth': 9, 'min_samples_split': 7, 'min_samples_leaf': 3, 'subsample': 0.6527828382846992, 'max_features': None}. Best is trial 428 with value: 0.31740361133065975.
