[I 2024-12-04 21:30:05,418] Trial 2422 finished with value: 0.14249507089443453 and parameters: {'kernel_type': 'Matern', 'length_scale': 9.910819873626181, 'noise_level': 0.04399334825022995, 'constant_value': 0.4695494268793461, 'nu': 1.5}. Best is trial 959 with value: 0.1375110730946576.
[I 2024-12-04 21:30:10,587] Trial 2426 finished with value: 0.9864686819410775 and parameters: {'kernel_type': 'Matern', 'length_scale': 0.04633742490119977, 'noise_level': 0.0033582916915617703, 'constant_value': 60.50230893888278, 'nu': 1.5}. Best is trial 959 with value: 0.1375110730946576.
[I 2024-12-04 21:30:11,411] Trial 2425 finished with value: 0.9864686819225804 and parameters: {'kernel_type': 'RBF', 'length_scale': 3250.3997005631477, 'noise_level': 4.786601084166118e-06, 'constant_value': 522.6594073147508, 'nu': 0.5}. Best is trial 959 with value: 0.1375110730946576.
[I 2024-12-04 21:30:16,481] Trial 2427 finished with value: 0.986468681942501 and parameters: {'kernel_type': 'Matern', 'length_scale': 473.56789629317814, 'noise_level': 0.046259852753831425, 'constant_value': 0.1928063044710559, 'nu': 1.5}. Best is trial 959 with value: 0.1375110730946576.
[I 2024-12-04 21:30:18,838] Trial 2429 finished with value: 0.14249503111975617 and parameters: {'kernel_type': 'Matern', 'length_scale': 300.78827750925103, 'noise_level': 0.9263004838793223, 'constant_value': 20.87762642536804, 'nu': 1.5}. Best is trial 959 with value: 0.1375110730946576.
[I 2024-12-04 21:30:21,647] Trial 2428 finished with value: 0.14249529603171907 and parameters: {'kernel_type': 'Matern', 'length_scale': 1327.2316994354774, 'noise_level': 0.930734639857914, 'constant_value': 5.8658714920951125, 'nu': 1.5}. Best is trial 959 with value: 0.1375110730946576.
[I 2024-12-04 21:30:23,319] Trial 2430 finished with value: 0.14249506098205217 and parameters: {'kernel_type': 'Matern', 'length_scale': 17.424558459414936, 'noise_level': 0.0013797777337841023, 'constant_value': 25.994161927543875, 'nu': 1.5}. Best is trial 959 with value: 0.1375110730946576.
[I 2024-12-04 21:30:27,764] Trial 2433 finished with value: 0.9864686819221706 and parameters: {'kernel_type': 'Matern', 'length_scale': 0.0008881922718444597, 'noise_level': 0.01611646764592881, 'constant_value': 3.6161582471845803, 'nu': 1.5}. Best is trial 959 with value: 0.1375110730946576.
[I 2024-12-04 21:30:28,681] Trial 2431 finished with value: 0.1424946160642995 and parameters: {'kernel_type': 'Matern', 'length_scale': 8.544616930573744, 'noise_level': 0.9521298418306927, 'constant_value': 7.724527336701716, 'nu': 1.5}. Best is trial 959 with value: 0.1375110730946576.
[I 2024-12-04 21:30:29,456] Trial 2432 finished with value: 0.9864686818274895 and parameters: {'kernel_type': 'Matern', 'length_scale': 160.17758962248072, 'noise_level': 0.0031226845822341916, 'constant_value': 0.8969637969092034, 'nu': 1.5}. Best is trial 959 with value: 0.1375110730946576.
[I 2024-12-04 21:30:34,663] Trial 2436 finished with value: 0.9982167338036667 and parameters: {'kernel_type': 'Matern', 'length_scale': 0.004232658443222, 'noise_level': 1.1068554372129125e-08, 'constant_value': 69486.18516269619, 'nu': 0.5}. Best is trial 959 with value: 0.1375110730946576.
[I 2024-12-04 21:30:35,785] Trial 2435 finished with value: 0.14249471508831837 and parameters: {'kernel_type': 'Matern', 'length_scale': 54.822363240257765, 'noise_level': 0.013854584151378836, 'constant_value': 454.8866153271262, 'nu': 1.5}. Best is trial 959 with value: 0.1375110730946576.
[I 2024-12-04 21:30:35,860] Trial 2434 finished with value: 0.14249508671601202 and parameters: {'kernel_type': 'Matern', 'length_scale': 3.108079276821226, 'noise_level': 0.9581500403364385, 'constant_value': 51.14227295750741, 'nu': 1.5}. Best is trial 959 with value: 0.1375110730946576.
[I 2024-12-04 21:30:43,515] Trial 2438 finished with value: 0.14249499847959443 and parameters: {'kernel_type': 'Matern', 'length_scale': 0.8616773454121539, 'noise_level': 0.002021913362156081, 'constant_value': 38.45902470628215, 'nu': 1.5}. Best is trial 959 with value: 0.1375110730946576.
[I 2024-12-04 21:30:44,385] Trial 2437 finished with value: 0.1424950630278631 and parameters: {'kernel_type': 'Matern', 'length_scale': 46.084338505158776, 'noise_level': 0.029732380939868002, 'constant_value': 0.1029636508890241, 'nu': 1.5}. Best is trial 959 with value: 0.1375110730946576.
[I 2024-12-04 21:30:44,795] Trial 2439 finished with value: 0.14249506305097398 and parameters: {'kernel_type': 'Matern', 'length_scale': 256.4834848426826, 'noise_level': 0.9189699037577677, 'constant_value': 4.191850251537664, 'nu': 1.5}. Best is trial 959 with value: 0.1375110730946576.
[I 2024-12-04 21:30:51,826] Trial 2441 finished with value: 0.998217057844599 and parameters: {'kernel_type': 'Matern', 'length_scale': 1.3309052586085932, 'noise_level': 0.006777431767394956, 'constant_value': 4.724046725636534e-05, 'nu': 1.5}. Best is trial 959 with value: 0.1375110730946576.
[I 2024-12-04 21:30:51,940] Trial 2440 finished with value: 0.14249417867399997 and parameters: {'kernel_type': 'Matern', 'length_scale': 1.2213041511592932, 'noise_level': 0.02931141569166377, 'constant_value': 15.012313735414944, 'nu': 1.5}. Best is trial 959 with value: 0.1375110730946576.
[I 2024-12-04 21:30:58,030] Trial 2443 finished with value: 0.14249506740980425 and parameters: {'kernel_type': 'Matern', 'length_scale': 238.094212066547, 'noise_level': 0.016413221134463637, 'constant_value': 102.03504890306631, 'nu': 1.5}. Best is trial 959 with value: 0.1375110730946576.
[I 2024-12-04 21:30:58,147] Trial 2442 finished with value: 0.14249501066578021 and parameters: {'kernel_type': 'Matern', 'length_scale': 14.548460665694623, 'noise_level': 0.01816139859902242, 'constant_value': 16.68004597704222, 'nu': 1.5}. Best is trial 959 with value: 0.1375110730946576.
[I 2024-12-04 21:31:00,108] Trial 2444 finished with value: 0.1477103260151794 and parameters: {'kernel_type': 'RBF', 'length_scale': 0.5507609812887828, 'noise_level': 0.008697404452237566, 'constant_value': 837.6711240512586, 'nu': 1.5}. Best is trial 959 with value: 0.1375110730946576.
[I 2024-12-04 21:31:04,142] Trial 2446 finished with value: 0.9864684716902926 and parameters: {'kernel_type': 'Matern', 'length_scale': 0.09882652565681518, 'noise_level': 0.03322000744370635, 'constant_value': 0.2386610333423992, 'nu': 1.5}. Best is trial 959 with value: 0.1375110730946576.
[I 2024-12-04 21:31:04,998] Trial 2447 finished with value: 0.986468679242169 and parameters: {'kernel_type': 'Matern', 'length_scale': 0.0783156035268606, 'noise_level': 0.06539266784423088, 'constant_value': 39.35016169103929, 'nu': 1.5}. Best is trial 959 with value: 0.1375110730946576.
[I 2024-12-04 21:31:08,175] Trial 2445 finished with value: 0.1424951742820974 and parameters: {'kernel_type': 'Matern', 'length_scale': 59.48121217319081, 'noise_level': 0.06835222221762428, 'constant_value': 1.7932650838999602, 'nu': 1.5}. Best is trial 959 with value: 0.1375110730946576.
[I 2024-12-04 21:31:11,321] Trial 2449 finished with value: 0.9982170981472489 and parameters: {'kernel_type': 'Matern', 'length_scale': 3520.41873690185, 'noise_level': 0.0804464631158567, 'constant_value': 5.180902066498559e-05, 'nu': 1.5}. Best is trial 959 with value: 0.1375110730946576.
[I 2024-12-04 21:31:12,785] Trial 2448 finished with value: 0.14249506338085685 and parameters: {'kernel_type': 'Matern', 'length_scale': 1.6646783622349979, 'noise_level': 0.8706583224523056, 'constant_value': 86.0034804093256, 'nu': 1.5}. Best is trial 959 with value: 0.1375110730946576.
[I 2024-12-04 21:31:14,280] Trial 2450 finished with value: 0.9864686819144616 and parameters: {'kernel_type': 'Matern', 'length_scale': 8.46842892935042, 'noise_level': 0.017618660349277122, 'constant_value': 0.19495310524773782, 'nu': 1.5}. Best is trial 959 with value: 0.1375110730946576.
[I 2024-12-04 21:31:19,100] Trial 2451 finished with value: 0.1424950875579067 and parameters: {'kernel_type': 'Matern', 'length_scale': 104.37395260852769, 'noise_level': 0.9987879886506251, 'constant_value': 126.30734397863674, 'nu': 1.5}. Best is trial 959 with value: 0.1375110730946576.
[I 2024-12-04 21:31:20,601] Trial 2452 finished with value: 0.14249506219192967 and parameters: {'kernel_type': 'Matern', 'length_scale': 215.67358196423655, 'noise_level': 0.9662072064406038, 'constant_value': 17.18359896082332, 'nu': 1.5}. Best is trial 959 with value: 0.1375110730946576.
[I 2024-12-04 21:31:23,038] Trial 2453 finished with value: 0.14249536155812642 and parameters: {'kernel_type': 'Matern', 'length_scale': 11.227788070012537, 'noise_level': 0.9472729954798024, 'constant_value': 1.2679084933511957, 'nu': 1.5}. Best is trial 959 with value: 0.1375110730946576.
[I 2024-12-04 21:31:24,931] Trial 2454 finished with value: 0.1424950615709076 and parameters: {'kernel_type': 'Matern', 'length_scale': 442.4276398946131, 'noise_level': 0.025598275673112347, 'constant_value': 266.3343528968843, 'nu': 1.5}. Best is trial 959 with value: 0.1375110730946576.
[I 2024-12-04 21:31:26,384] Trial 2455 finished with value: 0.14469865788577993 and parameters: {'kernel_type': 'Matern', 'length_scale': 94.00488633647188, 'noise_level': 0.012612423797277903, 'constant_value': 264.83677680567695, 'nu': 2.5}. Best is trial 959 with value: 0.1375110730946576.
[I 2024-12-04 21:31:35,963] Trial 2458 finished with value: 0.14249495424716282 and parameters: {'kernel_type': 'Matern', 'length_scale': 1.3609169368208485, 'noise_level': 0.969773045919182, 'constant_value': 0.12309707357816096, 'nu': 1.5}. Best is trial 959 with value: 0.1375110730946576.
[I 2024-12-04 21:31:40,053] Trial 2457 finished with value: 0.9864686819235537 and parameters: {'kernel_type': 'Matern', 'length_scale': 0.1567908838713129, 'noise_level': 0.04220715466016256, 'constant_value': 0.00394712098088298, 'nu': 1.5}. Best is trial 959 with value: 0.1375110730946576.
[I 2024-12-04 21:31:40,875] Trial 2456 finished with value: 0.14249506015797214 and parameters: {'kernel_type': 'Matern', 'length_scale': 9.03641033004962, 'noise_level': 0.0417156523325391, 'constant_value': 0.036556520838750745, 'nu': 1.5}. Best is trial 959 with value: 0.1375110730946576.
[I 2024-12-04 21:31:43,836] Trial 2459 finished with value: 0.19720003402050948 and parameters: {'kernel_type': 'Matern', 'length_scale': 242.72224661699894, 'noise_level': 0.026552152074586822, 'constant_value': 206.56975685489905, 'nu': 0.5}. Best is trial 959 with value: 0.1375110730946576.
[I 2024-12-04 21:31:44,744] Trial 2460 finished with value: 0.9982170457784071 and parameters: {'kernel_type': 'Matern', 'length_scale': 2899.7521811244083, 'noise_level': 0.9991993998651545, 'constant_value': 0.04038339300466648, 'nu': 1.5}. Best is trial 959 with value: 0.1375110730946576.
[I 2024-12-04 21:31:47,189] Trial 2461 finished with value: 0.9864686819247834 and parameters: {'kernel_type': 'Matern', 'length_scale': 115.91604896368965, 'noise_level': 0.0014550094502873243, 'constant_value': 75.33549663456634, 'nu': 1.5}. Best is trial 959 with value: 0.1375110730946576.
[I 2024-12-04 21:31:50,926] Trial 2462 finished with value: 0.9864686819007056 and parameters: {'kernel_type': 'RBF', 'length_scale': 5.519540003493452e-05, 'noise_level': 3.725247005569326e-10, 'constant_value': 4.5572653902441335e-07, 'nu': 2.5}. Best is trial 959 with value: 0.1375110730946576.
[I 2024-12-04 21:31:52,134] Trial 2463 finished with value: 0.14249502746215462 and parameters: {'kernel_type': 'Matern', 'length_scale': 315.25873053789326, 'noise_level': 0.9387459025268601, 'constant_value': 156.2615598106635, 'nu': 1.5}. Best is trial 959 with value: 0.1375110730946576.
[I 2024-12-04 21:31:53,441] Trial 2464 finished with value: 0.14249509802566634 and parameters: {'kernel_type': 'Matern', 'length_scale': 0.4265485042284576, 'noise_level': 0.015136923767516576, 'constant_value': 131.97722417256307, 'nu': 1.5}. Best is trial 959 with value: 0.1375110730946576.
[I 2024-12-04 21:31:59,618] Trial 2467 finished with value: 0.14469906420965076 and parameters: {'kernel_type': 'Matern', 'length_scale': 14.075695367408244, 'noise_level': 0.7480679859401589, 'constant_value': 46.88928613394222, 'nu': 2.5}. Best is trial 959 with value: 0.1375110730946576.
[I 2024-12-04 21:31:59,717] Trial 2466 finished with value: 0.14249505938522278 and parameters: {'kernel_type': 'Matern', 'length_scale': 2.240472472444566, 'noise_level': 0.017988297461438207, 'constant_value': 51.87395816593127, 'nu': 1.5}. Best is trial 959 with value: 0.1375110730946576.
[I 2024-12-04 21:32:00,002] Trial 2465 finished with value: 0.9864686819214141 and parameters: {'kernel_type': 'Matern', 'length_scale': 39976.424573880875, 'noise_level': 0.026359821073646997, 'constant_value': 3.882886571280837, 'nu': 1.5}. Best is trial 959 with value: 0.1375110730946576.
[I 2024-12-04 21:32:06,625] Trial 2470 finished with value: 0.14249506286977562 and parameters: {'kernel_type': 'Matern', 'length_scale': 45.47865616371535, 'noise_level': 0.026671114664064896, 'constant_value': 91.64041899871222, 'nu': 1.5}. Best is trial 959 with value: 0.1375110730946576.
[I 2024-12-04 21:32:08,021] Trial 2469 finished with value: 0.1424949765350837 and parameters: {'kernel_type': 'Matern', 'length_scale': 7.176326907707025, 'noise_level': 0.6682722164423909, 'constant_value': 0.011111337234738726, 'nu': 1.5}. Best is trial 959 with value: 0.1375110730946576.
[I 2024-12-04 21:32:09,514] Trial 2468 finished with value: 0.14249512233822215 and parameters: {'kernel_type': 'Matern', 'length_scale': 86.50722284293909, 'noise_level': 0.9669714724881889, 'constant_value': 0.48759425504830006, 'nu': 1.5}. Best is trial 959 with value: 0.1375110730946576.
[I 2024-12-04 21:32:13,498] Trial 2471 finished with value: 0.14249499455809467 and parameters: {'kernel_type': 'Matern', 'length_scale': 0.4659685235662394, 'noise_level': 0.8831799778139475, 'constant_value': 11.1259382557371, 'nu': 1.5}. Best is trial 959 with value: 0.1375110730946576.
[I 2024-12-04 21:32:14,853] Trial 2472 finished with value: 0.14249506145963314 and parameters: {'kernel_type': 'Matern', 'length_scale': 685.7732849385095, 'noise_level': 0.983614532056265, 'constant_value': 158.8879949871738, 'nu': 1.5}. Best is trial 959 with value: 0.1375110730946576.
[I 2024-12-04 21:32:16,224] Trial 2473 finished with value: 0.1424950671408202 and parameters: {'kernel_type': 'Matern', 'length_scale': 27.317002401982563, 'noise_level': 0.05316968445318521, 'constant_value': 2.030634215303922, 'nu': 1.5}. Best is trial 959 with value: 0.1375110730946576.
[I 2024-12-04 21:32:20,964] Trial 2475 finished with value: 0.14249509848682648 and parameters: {'kernel_type': 'Matern', 'length_scale': 16.444398635419024, 'noise_level': 0.06290981347802418, 'constant_value': 140.00392598176498, 'nu': 1.5}. Best is trial 959 with value: 0.1375110730946576.
[I 2024-12-04 21:32:21,528] Trial 2474 finished with value: 0.14249522782845417 and parameters: {'kernel_type': 'Matern', 'length_scale': 0.7248709007953271, 'noise_level': 0.9035513110352489, 'constant_value': 16.86642720722278, 'nu': 1.5}. Best is trial 959 with value: 0.1375110730946576.
[I 2024-12-04 21:32:23,704] Trial 2476 finished with value: 0.14249502292392557 and parameters: {'kernel_type': 'Matern', 'length_scale': 10.584784134655097, 'noise_level': 0.04362117686542136, 'constant_value': 8.285339179469274, 'nu': 1.5}. Best is trial 959 with value: 0.1375110730946576.
[I 2024-12-04 21:32:27,360] Trial 2478 finished with value: 0.19720015427641255 and parameters: {'kernel_type': 'Matern', 'length_scale': 2.1106851889758187, 'noise_level': 0.0756301806503063, 'constant_value': 0.00981399349032644, 'nu': 0.5}. Best is trial 959 with value: 0.1375110730946576.
[I 2024-12-04 21:32:30,209] Trial 2479 finished with value: 0.14249516033792575 and parameters: {'kernel_type': 'Matern', 'length_scale': 0.448362023648135, 'noise_level': 0.0013455650714399524, 'constant_value': 0.16127462688069222, 'nu': 1.5}. Best is trial 959 with value: 0.1375110730946576.
[I 2024-12-04 21:32:30,607] Trial 2477 finished with value: 0.9864686818796875 and parameters: {'kernel_type': 'Matern', 'length_scale': 62.154327020587644, 'noise_level': 0.01623502826285355, 'constant_value': 0.005368786489323341, 'nu': 1.5}. Best is trial 959 with value: 0.1375110730946576.
[I 2024-12-04 21:32:34,505] Trial 2480 finished with value: 0.14249483667994192 and parameters: {'kernel_type': 'Matern', 'length_scale': 5.992873054601156, 'noise_level': 0.04695803646605637, 'constant_value': 1372.0837067390767, 'nu': 1.5}. Best is trial 959 with value: 0.1375110730946576.
[I 2024-12-04 21:32:37,331] Trial 2482 finished with value: 0.14249475032210304 and parameters: {'kernel_type': 'Matern', 'length_scale': 486.1494084456869, 'noise_level': 0.76977970378811, 'constant_value': 2128.9973681391007, 'nu': 1.5}. Best is trial 959 with value: 0.1375110730946576.
[I 2024-12-04 21:32:37,785] Trial 2481 finished with value: 0.14469893213805038 and parameters: {'kernel_type': 'Matern', 'length_scale': 50.59287569177625, 'noise_level': 0.6405429071719083, 'constant_value': 0.2361863372553426, 'nu': 2.5}. Best is trial 959 with value: 0.1375110730946576.
[I 2024-12-04 21:32:42,735] Trial 2484 finished with value: 0.14249147456499345 and parameters: {'kernel_type': 'Matern', 'length_scale': 28.272211869441765, 'noise_level': 0.0332301942442672, 'constant_value': 683.6234806607509, 'nu': 1.5}. Best is trial 959 with value: 0.1375110730946576.
[I 2024-12-04 21:32:44,525] Trial 2483 finished with value: 0.142495060508002 and parameters: {'kernel_type': 'Matern', 'length_scale': 14681.133866551376, 'noise_level': 0.8524898963186744, 'constant_value': 49.7128711229642, 'nu': 1.5}. Best is trial 959 with value: 0.1375110730946576.
[I 2024-12-04 21:32:46,024] Trial 2485 finished with value: 0.9864686819206957 and parameters: {'kernel_type': 'Matern', 'length_scale': 3234.3140081904703, 'noise_level': 0.04277974419096942, 'constant_value': 6.09611575962109, 'nu': 1.5}. Best is trial 959 with value: 0.1375110730946576.
[I 2024-12-04 21:32:51,712] Trial 2486 finished with value: 0.14249506608793108 and parameters: {'kernel_type': 'Matern', 'length_scale': 506.3800079201063, 'noise_level': 0.0364149403992592, 'constant_value': 4.227444708791, 'nu': 1.5}. Best is trial 959 with value: 0.1375110730946576.
[I 2024-12-04 21:32:54,500] Trial 2488 finished with value: 0.13847884252480383 and parameters: {'kernel_type': 'Matern', 'length_scale': 30.58234537399657, 'noise_level': 0.9842175517257014, 'constant_value': 437.4101167474768, 'nu': 1.5}. Best is trial 959 with value: 0.1375110730946576.
[I 2024-12-04 21:32:55,702] Trial 2487 finished with value: 0.9864686819226367 and parameters: {'kernel_type': 'Matern', 'length_scale': 3684.759168014056, 'noise_level': 0.0003806755193560036, 'constant_value': 0.017031213624317632, 'nu': 1.5}. Best is trial 959 with value: 0.1375110730946576.
[I 2024-12-04 21:32:59,870] Trial 2489 finished with value: 0.9864686819168637 and parameters: {'kernel_type': 'Matern', 'length_scale': 60.58473209133136, 'noise_level': 0.024191082469006538, 'constant_value': 0.027934400141276183, 'nu': 1.5}. Best is trial 959 with value: 0.1375110730946576.
[I 2024-12-04 21:33:05,004] Trial 2490 finished with value: 0.1424950540207271 and parameters: {'kernel_type': 'Matern', 'length_scale': 0.20881300788755205, 'noise_level': 0.025426919691125743, 'constant_value': 6.933952626286627, 'nu': 1.5}. Best is trial 959 with value: 0.1375110730946576.
[I 2024-12-04 21:33:06,981] Trial 2492 finished with value: 0.14249506980012244 and parameters: {'kernel_type': 'Matern', 'length_scale': 11.159276857806118, 'noise_level': 0.8205140184195063, 'constant_value': 16.791222205696922, 'nu': 1.5}. Best is trial 959 with value: 0.1375110730946576.
[I 2024-12-04 21:33:07,492] Trial 2491 finished with value: 0.9864686819238431 and parameters: {'kernel_type': 'RBF', 'length_scale': 0.04815397196170376, 'noise_level': 0.000523391366834932, 'constant_value': 2.6071248133653823e-05, 'nu': 0.5}. Best is trial 959 with value: 0.1375110730946576.
[I 2024-12-04 21:33:13,502] Trial 2493 finished with value: 0.9864686819200288 and parameters: {'kernel_type': 'RBF', 'length_scale': 8078.807709874521, 'noise_level': 8.056563203184662e-08, 'constant_value': 80.02631603798761, 'nu': 1.5}. Best is trial 959 with value: 0.1375110730946576.
[I 2024-12-04 21:33:14,648] Trial 2495 finished with value: 0.14249500755047237 and parameters: {'kernel_type': 'Matern', 'length_scale': 19.611747115371486, 'noise_level': 0.9781775993403079, 'constant_value': 4.151402731690032, 'nu': 1.5}. Best is trial 959 with value: 0.1375110730946576.
[I 2024-12-04 21:33:15,020] Trial 2494 finished with value: 0.14249505960951095 and parameters: {'kernel_type': 'Matern', 'length_scale': 7.1655294110849095, 'noise_level': 0.07814909462351015, 'constant_value': 0.5490861380900344, 'nu': 1.5}. Best is trial 959 with value: 0.1375110730946576.
[I 2024-12-04 21:33:20,021] Trial 2498 finished with value: 0.9864686819231321 and parameters: {'kernel_type': 'Matern', 'length_scale': 2.90149869065774e-05, 'noise_level': 4.5379057829750724e-09, 'constant_value': 0.012519657352135328, 'nu': 0.5}. Best is trial 959 with value: 0.1375110730946576.
[I 2024-12-04 21:33:21,642] Trial 2496 finished with value: 0.9864686819387254 and parameters: {'kernel_type': 'Matern', 'length_scale': 624.2192232964435, 'noise_level': 0.005927566768979563, 'constant_value': 0.2988267297549854, 'nu': 1.5}. Best is trial 959 with value: 0.1375110730946576.
[I 2024-12-04 21:33:22,200] Trial 2497 finished with value: 0.14249501168587575 and parameters: {'kernel_type': 'Matern', 'length_scale': 85.71270442132833, 'noise_level': 0.055607984957141414, 'constant_value': 9.87178835192213, 'nu': 1.5}. Best is trial 959 with value: 0.1375110730946576.
