[I 2024-12-04 12:10:49,312] Trial 1076 finished with value: 0.514585626596143 and parameters: {'n_estimators': 219, 'max_depth': 20, 'min_samples_split': 5, 'min_samples_leaf': 1, 'max_features': None, 'bootstrap': True, 'criterion': 'absolute_error'}. Best is trial 744 with value: 0.5032383725751689.
[I 2024-12-04 12:10:50,792] Trial 1086 finished with value: 0.55748230045627 and parameters: {'n_estimators': 107, 'max_depth': 20, 'min_samples_split': 4, 'min_samples_leaf': 2, 'max_features': None, 'bootstrap': True, 'criterion': 'absolute_error'}. Best is trial 744 with value: 0.5032383725751689.
[I 2024-12-04 12:10:50,829] Trial 1091 finished with value: 0.5555779049865698 and parameters: {'n_estimators': 109, 'max_depth': 16, 'min_samples_split': 2, 'min_samples_leaf': 2, 'max_features': None, 'bootstrap': True, 'criterion': 'absolute_error'}. Best is trial 744 with value: 0.5032383725751689.
[I 2024-12-04 12:10:51,532] Trial 1070 finished with value: 0.5207889768698817 and parameters: {'n_estimators': 271, 'max_depth': 22, 'min_samples_split': 7, 'min_samples_leaf': 1, 'max_features': None, 'bootstrap': True, 'criterion': 'absolute_error'}. Best is trial 744 with value: 0.5032383725751689.
[I 2024-12-04 12:10:51,545] Trial 1090 finished with value: 1.3674786557663978 and parameters: {'n_estimators': 836, 'max_depth': 14, 'min_samples_split': 7, 'min_samples_leaf': 15, 'max_features': 'log2', 'bootstrap': True, 'criterion': 'absolute_error'}. Best is trial 744 with value: 0.5032383725751689.
[I 2024-12-04 12:10:51,697] Trial 1085 finished with value: 0.5256976461523983 and parameters: {'n_estimators': 218, 'max_depth': 8, 'min_samples_split': 2, 'min_samples_leaf': 1, 'max_features': None, 'bootstrap': True, 'criterion': 'absolute_error'}. Best is trial 744 with value: 0.5032383725751689.
[I 2024-12-04 12:10:52,667] Trial 1087 finished with value: 0.5155952433310339 and parameters: {'n_estimators': 104, 'max_depth': 22, 'min_samples_split': 2, 'min_samples_leaf': 1, 'max_features': None, 'bootstrap': True, 'criterion': 'absolute_error'}. Best is trial 744 with value: 0.5032383725751689.
[I 2024-12-04 12:10:56,327] Trial 1094 finished with value: 0.9676392474774911 and parameters: {'n_estimators': 298, 'max_depth': 22, 'min_samples_split': 6, 'min_samples_leaf': 2, 'max_features': 'sqrt', 'bootstrap': True, 'criterion': 'absolute_error'}. Best is trial 744 with value: 0.5032383725751689.
[I 2024-12-04 12:10:56,479] Trial 1097 finished with value: 1.3720332018070458 and parameters: {'n_estimators': 178, 'max_depth': 32, 'min_samples_split': 4, 'min_samples_leaf': 15, 'max_features': 'log2', 'bootstrap': True, 'criterion': 'absolute_error'}. Best is trial 744 with value: 0.5032383725751689.
[I 2024-12-04 12:10:57,836] Trial 1095 finished with value: 0.5131248445160708 and parameters: {'n_estimators': 104, 'max_depth': 14, 'min_samples_split': 4, 'min_samples_leaf': 1, 'max_features': None, 'bootstrap': True, 'criterion': 'absolute_error'}. Best is trial 744 with value: 0.5032383725751689.
[I 2024-12-04 12:10:59,093] Trial 1098 finished with value: 1.193590264082412 and parameters: {'n_estimators': 597, 'max_depth': 24, 'min_samples_split': 46, 'min_samples_leaf': 5, 'max_features': 'sqrt', 'bootstrap': False, 'criterion': 'absolute_error'}. Best is trial 744 with value: 0.5032383725751689.
[I 2024-12-04 12:11:02,645] Trial 1082 finished with value: 0.6629762469052318 and parameters: {'n_estimators': 845, 'max_depth': 27, 'min_samples_split': 2, 'min_samples_leaf': 9, 'max_features': None, 'bootstrap': False, 'criterion': 'absolute_error'}. Best is trial 744 with value: 0.5032383725751689.
[I 2024-12-04 12:11:03,877] Trial 1084 finished with value: 0.5589082818091023 and parameters: {'n_estimators': 298, 'max_depth': 23, 'min_samples_split': 6, 'min_samples_leaf': 2, 'max_features': None, 'bootstrap': True, 'criterion': 'absolute_error'}. Best is trial 744 with value: 0.5032383725751689.
[I 2024-12-04 12:11:04,397] Trial 1096 finished with value: 0.5136298233606414 and parameters: {'n_estimators': 101, 'max_depth': 21, 'min_samples_split': 3, 'min_samples_leaf': 1, 'max_features': None, 'bootstrap': True, 'criterion': 'absolute_error'}. Best is trial 744 with value: 0.5032383725751689.
[I 2024-12-04 12:11:04,561] Trial 1093 finished with value: 0.5177091582071817 and parameters: {'n_estimators': 106, 'max_depth': 14, 'min_samples_split': 2, 'min_samples_leaf': 1, 'max_features': None, 'bootstrap': True, 'criterion': 'absolute_error'}. Best is trial 744 with value: 0.5032383725751689.
[I 2024-12-04 12:11:07,913] Trial 1104 finished with value: 0.5565345033987354 and parameters: {'n_estimators': 179, 'max_depth': 13, 'min_samples_split': 7, 'min_samples_leaf': 2, 'max_features': None, 'bootstrap': True, 'criterion': 'absolute_error'}. Best is trial 744 with value: 0.5032383725751689.
[I 2024-12-04 12:11:07,961] Trial 1101 finished with value: 1.0514844438234854 and parameters: {'n_estimators': 375, 'max_depth': 20, 'min_samples_split': 23, 'min_samples_leaf': 1, 'max_features': 'log2', 'bootstrap': True, 'criterion': 'absolute_error'}. Best is trial 744 with value: 0.5032383725751689.
[I 2024-12-04 12:11:12,332] Trial 1112 finished with value: 0.5505980301576625 and parameters: {'n_estimators': 117, 'max_depth': 17, 'min_samples_split': 10, 'min_samples_leaf': 2, 'max_features': None, 'bootstrap': True, 'criterion': 'squared_error'}. Best is trial 744 with value: 0.5032383725751689.
[I 2024-12-04 12:11:13,518] Trial 1102 finished with value: 0.5189274898340744 and parameters: {'n_estimators': 101, 'max_depth': 29, 'min_samples_split': 7, 'min_samples_leaf': 1, 'max_features': None, 'bootstrap': True, 'criterion': 'absolute_error'}. Best is trial 744 with value: 0.5032383725751689.
[I 2024-12-04 12:11:14,502] Trial 1108 finished with value: 0.5067921150276271 and parameters: {'n_estimators': 122, 'max_depth': 19, 'min_samples_split': 5, 'min_samples_leaf': 1, 'max_features': None, 'bootstrap': True, 'criterion': 'absolute_error'}. Best is trial 744 with value: 0.5032383725751689.
[I 2024-12-04 12:11:14,563] Trial 1100 finished with value: 0.5241026193036572 and parameters: {'n_estimators': 121, 'max_depth': 21, 'min_samples_split': 8, 'min_samples_leaf': 1, 'max_features': None, 'bootstrap': True, 'criterion': 'absolute_error'}. Best is trial 744 with value: 0.5032383725751689.
[I 2024-12-04 12:11:15,229] Trial 1111 finished with value: 1.3472403273513645 and parameters: {'n_estimators': 579, 'max_depth': 5, 'min_samples_split': 41, 'min_samples_leaf': 6, 'max_features': 'log2', 'bootstrap': True, 'criterion': 'absolute_error'}. Best is trial 744 with value: 0.5032383725751689.
[I 2024-12-04 12:11:15,368] Trial 1113 finished with value: 0.5043048340394243 and parameters: {'n_estimators': 102, 'max_depth': 16, 'min_samples_split': 4, 'min_samples_leaf': 1, 'max_features': None, 'bootstrap': True, 'criterion': 'absolute_error'}. Best is trial 744 with value: 0.5032383725751689.
[I 2024-12-04 12:11:17,028] Trial 1107 finished with value: 0.5136542805556494 and parameters: {'n_estimators': 103, 'max_depth': 23, 'min_samples_split': 5, 'min_samples_leaf': 1, 'max_features': None, 'bootstrap': True, 'criterion': 'absolute_error'}. Best is trial 744 with value: 0.5032383725751689.
[I 2024-12-04 12:11:17,432] Trial 1120 finished with value: 1.1368000817526227 and parameters: {'n_estimators': 202, 'max_depth': 10, 'min_samples_split': 9, 'min_samples_leaf': 2, 'max_features': 'log2', 'bootstrap': False, 'criterion': 'squared_error'}. Best is trial 744 with value: 0.5032383725751689.
[I 2024-12-04 12:11:17,469] Trial 1105 finished with value: 0.9942406302283247 and parameters: {'n_estimators': 875, 'max_depth': 22, 'min_samples_split': 12, 'min_samples_leaf': 1, 'max_features': 'log2', 'bootstrap': True, 'criterion': 'absolute_error'}. Best is trial 744 with value: 0.5032383725751689.
[I 2024-12-04 12:11:17,605] Trial 1115 finished with value: 0.5104002576553875 and parameters: {'n_estimators': 103, 'max_depth': 16, 'min_samples_split': 5, 'min_samples_leaf': 1, 'max_features': None, 'bootstrap': True, 'criterion': 'absolute_error'}. Best is trial 744 with value: 0.5032383725751689.
[I 2024-12-04 12:11:19,555] Trial 1089 finished with value: 0.5637417597661226 and parameters: {'n_estimators': 308, 'max_depth': 17, 'min_samples_split': 5, 'min_samples_leaf': 1, 'max_features': None, 'bootstrap': False, 'criterion': 'absolute_error'}. Best is trial 744 with value: 0.5032383725751689.
[I 2024-12-04 12:11:19,955] Trial 1099 finished with value: 1.0439301422902991 and parameters: {'n_estimators': 709, 'max_depth': 9, 'min_samples_split': 10, 'min_samples_leaf': 1, 'max_features': 'sqrt', 'bootstrap': True, 'criterion': 'absolute_error'}. Best is trial 744 with value: 0.5032383725751689.
[I 2024-12-04 12:11:23,210] Trial 1114 finished with value: 0.6866628155455743 and parameters: {'n_estimators': 714, 'max_depth': 19, 'min_samples_split': 9, 'min_samples_leaf': 9, 'max_features': None, 'bootstrap': True, 'criterion': 'squared_error'}. Best is trial 744 with value: 0.5032383725751689.
[I 2024-12-04 12:11:23,959] Trial 1116 finished with value: 0.5189959101153375 and parameters: {'n_estimators': 100, 'max_depth': 24, 'min_samples_split': 7, 'min_samples_leaf': 1, 'max_features': None, 'bootstrap': True, 'criterion': 'absolute_error'}. Best is trial 744 with value: 0.5032383725751689.
[I 2024-12-04 12:11:24,482] Trial 1122 finished with value: 0.5567848072854025 and parameters: {'n_estimators': 115, 'max_depth': 15, 'min_samples_split': 5, 'min_samples_leaf': 2, 'max_features': None, 'bootstrap': True, 'criterion': 'absolute_error'}. Best is trial 744 with value: 0.5032383725751689.
[I 2024-12-04 12:11:24,636] Trial 1106 finished with value: 0.5162011209074823 and parameters: {'n_estimators': 242, 'max_depth': 20, 'min_samples_split': 4, 'min_samples_leaf': 1, 'max_features': None, 'bootstrap': True, 'criterion': 'absolute_error'}. Best is trial 744 with value: 0.5032383725751689.
[I 2024-12-04 12:11:26,336] Trial 1119 finished with value: 0.8679607567100778 and parameters: {'n_estimators': 268, 'max_depth': 15, 'min_samples_split': 5, 'min_samples_leaf': 1, 'max_features': 'sqrt', 'bootstrap': False, 'criterion': 'absolute_error'}. Best is trial 744 with value: 0.5032383725751689.
[I 2024-12-04 12:11:27,904] Trial 1110 finished with value: 0.5198396111805521 and parameters: {'n_estimators': 273, 'max_depth': 10, 'min_samples_split': 4, 'min_samples_leaf': 1, 'max_features': None, 'bootstrap': True, 'criterion': 'absolute_error'}. Best is trial 744 with value: 0.5032383725751689.
[I 2024-12-04 12:11:30,877] Trial 1132 finished with value: 1.2329862089195 and parameters: {'n_estimators': 120, 'max_depth': 7, 'min_samples_split': 6, 'min_samples_leaf': 1, 'max_features': 'log2', 'bootstrap': True, 'criterion': 'absolute_error'}. Best is trial 744 with value: 0.5032383725751689.
[I 2024-12-04 12:11:30,946] Trial 1127 finished with value: 0.7235137606142261 and parameters: {'n_estimators': 710, 'max_depth': 6, 'min_samples_split': 8, 'min_samples_leaf': 14, 'max_features': None, 'bootstrap': False, 'criterion': 'squared_error'}. Best is trial 744 with value: 0.5032383725751689.
[I 2024-12-04 12:11:33,824] Trial 1117 finished with value: 0.517549463203632 and parameters: {'n_estimators': 238, 'max_depth': 16, 'min_samples_split': 3, 'min_samples_leaf': 1, 'max_features': None, 'bootstrap': True, 'criterion': 'absolute_error'}. Best is trial 744 with value: 0.5032383725751689.
[I 2024-12-04 12:11:35,972] Trial 1137 finished with value: 1.2002237839896497 and parameters: {'n_estimators': 515, 'max_depth': 37, 'min_samples_split': 9, 'min_samples_leaf': 8, 'max_features': 'sqrt', 'bootstrap': True, 'criterion': 'squared_error'}. Best is trial 744 with value: 0.5032383725751689.
[I 2024-12-04 12:11:36,465] Trial 1126 finished with value: 0.5147406645725062 and parameters: {'n_estimators': 102, 'max_depth': 21, 'min_samples_split': 4, 'min_samples_leaf': 1, 'max_features': None, 'bootstrap': True, 'criterion': 'absolute_error'}. Best is trial 744 with value: 0.5032383725751689.
[I 2024-12-04 12:11:36,966] Trial 1066 finished with value: 0.6120200521663614 and parameters: {'n_estimators': 979, 'max_depth': 17, 'min_samples_split': 5, 'min_samples_leaf': 2, 'max_features': None, 'bootstrap': False, 'criterion': 'absolute_error'}. Best is trial 744 with value: 0.5032383725751689.
[I 2024-12-04 12:11:38,579] Trial 1109 finished with value: 0.6363853487048791 and parameters: {'n_estimators': 397, 'max_depth': 47, 'min_samples_split': 3, 'min_samples_leaf': 3, 'max_features': None, 'bootstrap': False, 'criterion': 'absolute_error'}. Best is trial 744 with value: 0.5032383725751689.
[I 2024-12-04 12:11:39,204] Trial 1103 finished with value: 0.617143811226827 and parameters: {'n_estimators': 807, 'max_depth': 20, 'min_samples_split': 22, 'min_samples_leaf': 4, 'max_features': None, 'bootstrap': True, 'criterion': 'absolute_error'}. Best is trial 744 with value: 0.5032383725751689.
[I 2024-12-04 12:11:39,820] Trial 1131 finished with value: 1.103066606072135 and parameters: {'n_estimators': 859, 'max_depth': 22, 'min_samples_split': 24, 'min_samples_leaf': 2, 'max_features': 'log2', 'bootstrap': False, 'criterion': 'squared_error'}. Best is trial 744 with value: 0.5032383725751689.
[I 2024-12-04 12:11:40,383] Trial 1123 finished with value: 0.5171990014790662 and parameters: {'n_estimators': 233, 'max_depth': 15, 'min_samples_split': 3, 'min_samples_leaf': 1, 'max_features': None, 'bootstrap': True, 'criterion': 'absolute_error'}. Best is trial 744 with value: 0.5032383725751689.
[I 2024-12-04 12:11:40,417] Trial 1135 finished with value: 0.5559535067522047 and parameters: {'n_estimators': 101, 'max_depth': 17, 'min_samples_split': 2, 'min_samples_leaf': 2, 'max_features': None, 'bootstrap': True, 'criterion': 'absolute_error'}. Best is trial 744 with value: 0.5032383725751689.
[I 2024-12-04 12:11:40,731] Trial 1118 finished with value: 0.8382238790301847 and parameters: {'n_estimators': 551, 'max_depth': 44, 'min_samples_split': 18, 'min_samples_leaf': 1, 'max_features': 'log2', 'bootstrap': True, 'criterion': 'absolute_error'}. Best is trial 744 with value: 0.5032383725751689.
[I 2024-12-04 12:11:40,836] Trial 1138 finished with value: 1.142547650247715 and parameters: {'n_estimators': 911, 'max_depth': 13, 'min_samples_split': 5, 'min_samples_leaf': 8, 'max_features': 'sqrt', 'bootstrap': False, 'criterion': 'squared_error'}. Best is trial 744 with value: 0.5032383725751689.
[I 2024-12-04 12:11:41,986] Trial 1134 finished with value: 0.5614892019686928 and parameters: {'n_estimators': 121, 'max_depth': 20, 'min_samples_split': 5, 'min_samples_leaf': 1, 'max_features': None, 'bootstrap': False, 'criterion': 'absolute_error'}. Best is trial 744 with value: 0.5032383725751689.
[I 2024-12-04 12:11:44,003] Trial 1121 finished with value: 0.5190706757862759 and parameters: {'n_estimators': 249, 'max_depth': 19, 'min_samples_split': 2, 'min_samples_leaf': 1, 'max_features': None, 'bootstrap': True, 'criterion': 'absolute_error'}. Best is trial 744 with value: 0.5032383725751689.
[I 2024-12-04 12:11:44,628] Trial 1124 finished with value: 0.5225230394483371 and parameters: {'n_estimators': 246, 'max_depth': 8, 'min_samples_split': 4, 'min_samples_leaf': 1, 'max_features': None, 'bootstrap': True, 'criterion': 'absolute_error'}. Best is trial 744 with value: 0.5032383725751689.
[I 2024-12-04 12:11:45,301] Trial 1139 finished with value: 0.5180809016005686 and parameters: {'n_estimators': 110, 'max_depth': 12, 'min_samples_split': 3, 'min_samples_leaf': 1, 'max_features': None, 'bootstrap': True, 'criterion': 'absolute_error'}. Best is trial 744 with value: 0.5032383725751689.
[I 2024-12-04 12:11:45,350] Trial 1140 finished with value: 0.5334548191925901 and parameters: {'n_estimators': 118, 'max_depth': 7, 'min_samples_split': 3, 'min_samples_leaf': 1, 'max_features': None, 'bootstrap': True, 'criterion': 'absolute_error'}. Best is trial 744 with value: 0.5032383725751689.
[I 2024-12-04 12:11:46,939] Trial 1136 finished with value: 0.5422115151801791 and parameters: {'n_estimators': 101, 'max_depth': 6, 'min_samples_split': 3, 'min_samples_leaf': 1, 'max_features': None, 'bootstrap': True, 'criterion': 'absolute_error'}. Best is trial 744 with value: 0.5032383725751689.
[I 2024-12-04 12:11:47,383] Trial 1145 finished with value: 0.8804360903876647 and parameters: {'n_estimators': 383, 'max_depth': 24, 'min_samples_split': 23, 'min_samples_leaf': 3, 'max_features': 'sqrt', 'bootstrap': False, 'criterion': 'squared_error'}. Best is trial 744 with value: 0.5032383725751689.
[I 2024-12-04 12:11:48,992] Trial 1125 finished with value: 0.5586160016448447 and parameters: {'n_estimators': 310, 'max_depth': 7, 'min_samples_split': 4, 'min_samples_leaf': 2, 'max_features': None, 'bootstrap': True, 'criterion': 'absolute_error'}. Best is trial 744 with value: 0.5032383725751689.
[I 2024-12-04 12:11:49,905] Trial 1142 finished with value: 0.512436712800411 and parameters: {'n_estimators': 104, 'max_depth': 17, 'min_samples_split': 4, 'min_samples_leaf': 1, 'max_features': None, 'bootstrap': True, 'criterion': 'absolute_error'}. Best is trial 744 with value: 0.5032383725751689.
[I 2024-12-04 12:11:50,045] Trial 1130 finished with value: 0.6151434704208946 and parameters: {'n_estimators': 935, 'max_depth': 47, 'min_samples_split': 7, 'min_samples_leaf': 3, 'max_features': None, 'bootstrap': False, 'criterion': 'squared_error'}. Best is trial 744 with value: 0.5032383725751689.
[I 2024-12-04 12:11:50,046] Trial 1133 finished with value: 0.5534396813572043 and parameters: {'n_estimators': 279, 'max_depth': 15, 'min_samples_split': 5, 'min_samples_leaf': 2, 'max_features': None, 'bootstrap': True, 'criterion': 'absolute_error'}. Best is trial 744 with value: 0.5032383725751689.
[I 2024-12-04 12:11:51,959] Trial 1156 finished with value: 1.2342042427461342 and parameters: {'n_estimators': 160, 'max_depth': 10, 'min_samples_split': 21, 'min_samples_leaf': 10, 'max_features': 'log2', 'bootstrap': False, 'criterion': 'squared_error'}. Best is trial 744 with value: 0.5032383725751689.
[I 2024-12-04 12:11:52,021] Trial 1144 finished with value: 0.6134440585943433 and parameters: {'n_estimators': 636, 'max_depth': 41, 'min_samples_split': 8, 'min_samples_leaf': 6, 'max_features': None, 'bootstrap': True, 'criterion': 'squared_error'}. Best is trial 744 with value: 0.5032383725751689.
[I 2024-12-04 12:11:52,608] Trial 1146 finished with value: 0.560910168325017 and parameters: {'n_estimators': 120, 'max_depth': 21, 'min_samples_split': 7, 'min_samples_leaf': 2, 'max_features': None, 'bootstrap': True, 'criterion': 'absolute_error'}. Best is trial 744 with value: 0.5032383725751689.
[I 2024-12-04 12:11:54,561] Trial 1045 finished with value: 0.5581615730752625 and parameters: {'n_estimators': 932, 'max_depth': 35, 'min_samples_split': 3, 'min_samples_leaf': 1, 'max_features': None, 'bootstrap': False, 'criterion': 'absolute_error'}. Best is trial 744 with value: 0.5032383725751689.
[I 2024-12-04 12:11:55,728] Trial 1149 finished with value: 0.548915933623769 and parameters: {'n_estimators': 101, 'max_depth': 13, 'min_samples_split': 4, 'min_samples_leaf': 2, 'max_features': None, 'bootstrap': True, 'criterion': 'absolute_error'}. Best is trial 744 with value: 0.5032383725751689.
[I 2024-12-04 12:11:59,321] Trial 1155 finished with value: 0.8845943176115372 and parameters: {'n_estimators': 793, 'max_depth': 18, 'min_samples_split': 45, 'min_samples_leaf': 3, 'max_features': 'sqrt', 'bootstrap': False, 'criterion': 'squared_error'}. Best is trial 744 with value: 0.5032383725751689.
[I 2024-12-04 12:11:59,456] Trial 1148 finished with value: 0.5091336737439935 and parameters: {'n_estimators': 111, 'max_depth': 13, 'min_samples_split': 5, 'min_samples_leaf': 1, 'max_features': None, 'bootstrap': True, 'criterion': 'absolute_error'}. Best is trial 744 with value: 0.5032383725751689.
[I 2024-12-04 12:11:59,603] Trial 1147 finished with value: 0.5595847493102833 and parameters: {'n_estimators': 219, 'max_depth': 22, 'min_samples_split': 6, 'min_samples_leaf': 2, 'max_features': None, 'bootstrap': True, 'criterion': 'absolute_error'}. Best is trial 744 with value: 0.5032383725751689.
[I 2024-12-04 12:12:00,038] Trial 1151 finished with value: 0.5102954966951164 and parameters: {'n_estimators': 102, 'max_depth': 23, 'min_samples_split': 4, 'min_samples_leaf': 1, 'max_features': None, 'bootstrap': True, 'criterion': 'absolute_error'}. Best is trial 744 with value: 0.5032383725751689.
[I 2024-12-04 12:12:00,476] Trial 1152 finished with value: 0.5151713726937295 and parameters: {'n_estimators': 106, 'max_depth': 16, 'min_samples_split': 3, 'min_samples_leaf': 1, 'max_features': None, 'bootstrap': True, 'criterion': 'absolute_error'}. Best is trial 744 with value: 0.5032383725751689.
[I 2024-12-04 12:12:00,622] Trial 1153 finished with value: 1.2347473408145788 and parameters: {'n_estimators': 954, 'max_depth': 13, 'min_samples_split': 38, 'min_samples_leaf': 12, 'max_features': 'sqrt', 'bootstrap': True, 'criterion': 'squared_error'}. Best is trial 744 with value: 0.5032383725751689.
[I 2024-12-04 12:12:00,623] Trial 1154 finished with value: 0.5133000713667651 and parameters: {'n_estimators': 107, 'max_depth': 20, 'min_samples_split': 6, 'min_samples_leaf': 1, 'max_features': None, 'bootstrap': True, 'criterion': 'absolute_error'}. Best is trial 744 with value: 0.5032383725751689.
[I 2024-12-04 12:12:00,977] Trial 1068 finished with value: 0.5536038511058197 and parameters: {'n_estimators': 959, 'max_depth': 20, 'min_samples_split': 24, 'min_samples_leaf': 1, 'max_features': None, 'bootstrap': False, 'criterion': 'absolute_error'}. Best is trial 744 with value: 0.5032383725751689.
