[I 2024-12-03 18:40:38,478] Trial 228 finished with value: 0.4670259359909608 and parameters: {'kernel': 'rbf', 'C': 53.106165354282076, 'gamma': 0.012589429162211625, 'epsilon': 0.041378729267546474}. Best is trial 232 with value: 0.45028150795531247.
[I 2024-12-03 18:40:38,838] Trial 225 finished with value: 0.4629142607994276 and parameters: {'kernel': 'rbf', 'C': 95.4972050115654, 'gamma': 0.019074908878155456, 'epsilon': 0.07667830069908022}. Best is trial 232 with value: 0.45028150795531247.
[I 2024-12-03 18:40:39,236] Trial 239 finished with value: 0.7274888468528062 and parameters: {'kernel': 'rbf', 'C': 7.084061733788632, 'gamma': 0.0029190134125638436, 'epsilon': 0.05509378435225444}. Best is trial 232 with value: 0.45028150795531247.
[I 2024-12-03 18:40:39,347] Trial 229 finished with value: 0.4634970928383942 and parameters: {'kernel': 'rbf', 'C': 58.14704611965444, 'gamma': 0.014814371402319271, 'epsilon': 0.023211208292815838}. Best is trial 232 with value: 0.45028150795531247.
[I 2024-12-03 18:40:39,367] Trial 232 finished with value: 0.45028150795531247 and parameters: {'kernel': 'rbf', 'C': 83.43344321485199, 'gamma': 0.013602861566099397, 'epsilon': 0.058812412846092295}. Best is trial 232 with value: 0.45028150795531247.
[I 2024-12-03 18:40:40,540] Trial 235 finished with value: 0.47833420010307354 and parameters: {'kernel': 'rbf', 'C': 83.14624274149145, 'gamma': 0.008164645528420089, 'epsilon': 0.07086434067986169}. Best is trial 232 with value: 0.45028150795531247.
[I 2024-12-03 18:40:40,765] Trial 233 finished with value: 0.4675756462851138 and parameters: {'kernel': 'rbf', 'C': 92.05763736021333, 'gamma': 0.00954131773396252, 'epsilon': 0.039178727869762314}. Best is trial 245 with value: 0.4498699730221994.
[I 2024-12-03 18:40:41,061] Trial 238 finished with value: 0.8155650865855497 and parameters: {'kernel': 'sigmoid', 'C': 2.6244991453178677, 'gamma': 0.004511546229644683, 'epsilon': 0.06670613370622891}. Best is trial 245 with value: 0.4498699730221994.
[I 2024-12-03 18:40:41,145] Trial 234 finished with value: 0.5460472859251927 and parameters: {'kernel': 'rbf', 'C': 11.965798811745223, 'gamma': 0.010729134850109998, 'epsilon': 0.09844107214491885}. Best is trial 245 with value: 0.4498699730221994.
[I 2024-12-03 18:40:41,556] Trial 230 finished with value: 0.5670224835791311 and parameters: {'kernel': 'rbf', 'C': 78.4178759912501, 'gamma': 0.04052855932206949, 'epsilon': 0.095411122454356}. Best is trial 245 with value: 0.4498699730221994.
[I 2024-12-03 18:40:42,108] Trial 242 finished with value: 0.5791632014418664 and parameters: {'kernel': 'rbf', 'C': 27.61953991476549, 'gamma': 0.0030425179166121, 'epsilon': 0.3267930644876612}. Best is trial 245 with value: 0.4498699730221994.
[I 2024-12-03 18:40:42,375] Trial 244 finished with value: 0.48573136258956146 and parameters: {'kernel': 'rbf', 'C': 90.17517689189144, 'gamma': 0.02364802917585097, 'epsilon': 0.07544801539357923}. Best is trial 245 with value: 0.4498699730221994.
[I 2024-12-03 18:40:42,470] Trial 245 finished with value: 0.4498699730221994 and parameters: {'kernel': 'rbf', 'C': 92.22345795259102, 'gamma': 0.014529394972394161, 'epsilon': 0.05886419766474157}. Best is trial 245 with value: 0.4498699730221994.
[I 2024-12-03 18:40:42,565] Trial 246 finished with value: 0.5369834625754042 and parameters: {'kernel': 'rbf', 'C': 98.90015278876083, 'gamma': 0.03129760190987732, 'epsilon': 0.03125596984987624}. Best is trial 245 with value: 0.4498699730221994.
[I 2024-12-03 18:40:43,094] Trial 247 finished with value: 0.469321364706006 and parameters: {'kernel': 'rbf', 'C': 43.90572504635406, 'gamma': 0.012817865994829347, 'epsilon': 0.05416959000659047}. Best is trial 245 with value: 0.4498699730221994.
[I 2024-12-03 18:40:43,905] Trial 255 finished with value: 0.45832234227517826 and parameters: {'kernel': 'rbf', 'C': 91.80885164115203, 'gamma': 0.011429625319986455, 'epsilon': 0.04906737212409904}. Best is trial 245 with value: 0.4498699730221994.
[I 2024-12-03 18:40:43,908] Trial 216 finished with value: 0.48833469558661036 and parameters: {'kernel': 'rbf', 'C': 80.19284448776548, 'gamma': 0.007072809745187543, 'epsilon': 0.04211614521526181}. Best is trial 245 with value: 0.4498699730221994.
[I 2024-12-03 18:40:44,069] Trial 248 finished with value: 0.5353868493245615 and parameters: {'kernel': 'rbf', 'C': 79.88397456547308, 'gamma': 0.007055715784886953, 'epsilon': 0.23826176347760608}. Best is trial 245 with value: 0.4498699730221994.
[I 2024-12-03 18:40:44,123] Trial 240 finished with value: 0.4601545609494979 and parameters: {'kernel': 'rbf', 'C': 56.042123284263724, 'gamma': 0.01825323955557503, 'epsilon': 0.08788886084868941}. Best is trial 245 with value: 0.4498699730221994.
[I 2024-12-03 18:40:44,139] Trial 236 finished with value: 0.7834726437202798 and parameters: {'kernel': 'poly', 'C': 99.55059914992093, 'gamma': 0.01933184922060475, 'epsilon': 0.02037127937489788}. Best is trial 245 with value: 0.4498699730221994.
[I 2024-12-03 18:40:44,143] Trial 253 finished with value: 0.5515858970277313 and parameters: {'kernel': 'rbf', 'C': 6.033876176605054, 'gamma': 0.01829824919407072, 'epsilon': 0.09641209664897347}. Best is trial 245 with value: 0.4498699730221994.
[I 2024-12-03 18:40:44,358] Trial 243 finished with value: 0.5079100791093113 and parameters: {'kernel': 'rbf', 'C': 79.5051518910407, 'gamma': 0.005265414967057586, 'epsilon': 0.10320304080357669}. Best is trial 245 with value: 0.4498699730221994.
[I 2024-12-03 18:40:44,509] Trial 252 finished with value: 0.4752562303924928 and parameters: {'kernel': 'rbf', 'C': 75.60718230727373, 'gamma': 0.02307166410762224, 'epsilon': 0.0812870843520338}. Best is trial 245 with value: 0.4498699730221994.
[I 2024-12-03 18:40:44,769] Trial 250 finished with value: 0.4666789083342175 and parameters: {'kernel': 'rbf', 'C': 69.23054226017875, 'gamma': 0.020476473933234467, 'epsilon': 0.08719162337475042}. Best is trial 245 with value: 0.4498699730221994.
[I 2024-12-03 18:40:45,190] Trial 237 finished with value: 0.5542919560002965 and parameters: {'kernel': 'rbf', 'C': 97.93742889690883, 'gamma': 0.03038590836791159, 'epsilon': 0.17858014979693856}. Best is trial 245 with value: 0.4498699730221994.
[I 2024-12-03 18:40:45,285] Trial 254 finished with value: 0.46631167919953165 and parameters: {'kernel': 'rbf', 'C': 66.47905761967282, 'gamma': 0.01152015793783306, 'epsilon': 0.04266382905609263}. Best is trial 245 with value: 0.4498699730221994.
[I 2024-12-03 18:40:46,076] Trial 259 finished with value: 0.6549594366172203 and parameters: {'kernel': 'rbf', 'C': 98.52573877877244, 'gamma': 0.0691809180059448, 'epsilon': 0.04202367670822322}. Best is trial 245 with value: 0.4498699730221994.
[I 2024-12-03 18:40:46,198] Trial 263 finished with value: 0.5840686672745634 and parameters: {'kernel': 'rbf', 'C': 67.36139331046401, 'gamma': 0.0015865732831528956, 'epsilon': 0.03253724182646136}. Best is trial 245 with value: 0.4498699730221994.
[I 2024-12-03 18:40:46,305] Trial 260 finished with value: 0.6488308064769881 and parameters: {'kernel': 'rbf', 'C': 9.568463511417882, 'gamma': 0.004243003988777044, 'epsilon': 0.03590108874012746}. Best is trial 245 with value: 0.4498699730221994.
[I 2024-12-03 18:40:46,331] Trial 257 finished with value: 1.3653821873540977 and parameters: {'kernel': 'rbf', 'C': 0.0014463883700153637, 'gamma': 0.00040333798486723077, 'epsilon': 0.062454979610732514}. Best is trial 245 with value: 0.4498699730221994.
[I 2024-12-03 18:40:47,168] Trial 258 finished with value: 1.3608183998486603 and parameters: {'kernel': 'rbf', 'C': 0.003357700566032467, 'gamma': 0.0028793047583895236, 'epsilon': 0.00884730745625011}. Best is trial 245 with value: 0.4498699730221994.
[I 2024-12-03 18:40:47,169] Trial 251 finished with value: 0.57874060813849 and parameters: {'kernel': 'rbf', 'C': 23.693364607733493, 'gamma': 0.003501259314129052, 'epsilon': 0.09080141414029956}. Best is trial 245 with value: 0.4498699730221994.
[I 2024-12-03 18:40:47,223] Trial 249 finished with value: 0.4573871487060974 and parameters: {'kernel': 'rbf', 'C': 91.31073838754398, 'gamma': 0.012033800151478969, 'epsilon': 0.04055948186636553}. Best is trial 245 with value: 0.4498699730221994.
[I 2024-12-03 18:40:47,801] Trial 261 finished with value: 0.45870630798987855 and parameters: {'kernel': 'rbf', 'C': 96.55665175117335, 'gamma': 0.017241564947654265, 'epsilon': 0.03493060117768773}. Best is trial 245 with value: 0.4498699730221994.
[I 2024-12-03 18:40:47,807] Trial 256 finished with value: 0.49964257051762007 and parameters: {'kernel': 'rbf', 'C': 97.5933800106325, 'gamma': 0.027079913838228283, 'epsilon': 0.021038981127394683}. Best is trial 245 with value: 0.4498699730221994.
[I 2024-12-03 18:40:47,963] Trial 262 finished with value: 776.5564938492695 and parameters: {'kernel': 'sigmoid', 'C': 77.2019362907208, 'gamma': 0.9007919224618043, 'epsilon': 0.009343103181901576}. Best is trial 245 with value: 0.4498699730221994.
[I 2024-12-03 18:40:48,001] Trial 241 finished with value: 0.5664773902707314 and parameters: {'kernel': 'linear', 'C': 64.94059549254126, 'gamma': 0.0017285890956506647, 'epsilon': 0.0491310202927172}. Best is trial 245 with value: 0.4498699730221994.
[I 2024-12-03 18:40:49,177] Trial 265 finished with value: 0.5135601422752436 and parameters: {'kernel': 'rbf', 'C': 7.381006423640037, 'gamma': 0.029880329982010345, 'epsilon': 0.022422251306161725}. Best is trial 245 with value: 0.4498699730221994.
[I 2024-12-03 18:40:49,184] Trial 266 finished with value: 0.5775202874117722 and parameters: {'kernel': 'rbf', 'C': 15.124085501623417, 'gamma': 0.005468999173308775, 'epsilon': 0.0328865178489341}. Best is trial 245 with value: 0.4498699730221994.
[I 2024-12-03 18:40:50,214] Trial 273 finished with value: 0.8794332241470871 and parameters: {'kernel': 'linear', 'C': 0.0019297905790393525, 'gamma': 0.0009652740242190973, 'epsilon': 0.3412296273110731}. Best is trial 245 with value: 0.4498699730221994.
[I 2024-12-03 18:40:50,387] Trial 264 finished with value: 0.5596238672802938 and parameters: {'kernel': 'linear', 'C': 64.85807946106921, 'gamma': 0.016092021103656796, 'epsilon': 0.02460136906926159}. Best is trial 245 with value: 0.4498699730221994.
[I 2024-12-03 18:40:50,388] Trial 275 finished with value: 0.5419077766762811 and parameters: {'kernel': 'rbf', 'C': 70.93664733640018, 'gamma': 0.0037991103651359584, 'epsilon': 0.019724770482968997}. Best is trial 245 with value: 0.4498699730221994.
[I 2024-12-03 18:40:50,576] Trial 268 finished with value: 0.5066420802410608 and parameters: {'kernel': 'rbf', 'C': 11.907572185210059, 'gamma': 0.019371396549799823, 'epsilon': 0.05739173995958745}. Best is trial 245 with value: 0.4498699730221994.
[I 2024-12-03 18:40:50,917] Trial 269 finished with value: 0.5325571983394103 and parameters: {'kernel': 'rbf', 'C': 97.62993803199005, 'gamma': 0.003267176547368216, 'epsilon': 0.08429197952098177}. Best is trial 245 with value: 0.4498699730221994.
[I 2024-12-03 18:40:51,413] Trial 277 finished with value: 1.3470745805597761 and parameters: {'kernel': 'sigmoid', 'C': 0.020313013426229543, 'gamma': 0.0019184916431056907, 'epsilon': 0.0016044634182140333}. Best is trial 245 with value: 0.4498699730221994.
[I 2024-12-03 18:40:51,416] Trial 267 finished with value: 0.531421622164885 and parameters: {'kernel': 'rbf', 'C': 14.041119840319947, 'gamma': 0.013076611126084088, 'epsilon': 0.023593745036473462}. Best is trial 245 with value: 0.4498699730221994.
[I 2024-12-03 18:40:51,805] Trial 270 finished with value: 0.4885752875734826 and parameters: {'kernel': 'rbf', 'C': 94.66860176758543, 'gamma': 0.0064509642696184725, 'epsilon': 0.040955085020313475}. Best is trial 245 with value: 0.4498699730221994.
[I 2024-12-03 18:40:52,382] Trial 271 finished with value: 7.066224776945721 and parameters: {'kernel': 'sigmoid', 'C': 39.83032210575722, 'gamma': 0.004242890061265562, 'epsilon': 0.043173679961184035}. Best is trial 245 with value: 0.4498699730221994.
[I 2024-12-03 18:40:52,760] Trial 283 finished with value: 0.4571928373452379 and parameters: {'kernel': 'rbf', 'C': 70.25663188511169, 'gamma': 0.017844408008655725, 'epsilon': 0.031993457721769925}. Best is trial 245 with value: 0.4498699730221994.
[I 2024-12-03 18:40:53,067] Trial 274 finished with value: 0.4659545538006445 and parameters: {'kernel': 'rbf', 'C': 94.5955310071276, 'gamma': 0.010023894076443643, 'epsilon': 0.034803334568195}. Best is trial 245 with value: 0.4498699730221994.
[I 2024-12-03 18:40:53,730] Trial 280 finished with value: 0.48245158986351633 and parameters: {'kernel': 'rbf', 'C': 77.95355710268313, 'gamma': 0.026152859089512075, 'epsilon': 0.023846791013871414}. Best is trial 245 with value: 0.4498699730221994.
[I 2024-12-03 18:40:53,868] Trial 276 finished with value: 0.4624402120726642 and parameters: {'kernel': 'rbf', 'C': 68.7096328343709, 'gamma': 0.021144750645949385, 'epsilon': 0.02382110689151735}. Best is trial 245 with value: 0.4498699730221994.
[I 2024-12-03 18:40:53,940] Trial 285 finished with value: 0.8004785893229076 and parameters: {'kernel': 'linear', 'C': 0.006663981338006508, 'gamma': 0.021743744237613133, 'epsilon': 0.035286074540877906}. Best is trial 245 with value: 0.4498699730221994.
[I 2024-12-03 18:40:54,302] Trial 272 finished with value: 0.6271211847960257 and parameters: {'kernel': 'rbf', 'C': 13.927922628923113, 'gamma': 0.24895029867121088, 'epsilon': 0.022544731625475028}. Best is trial 245 with value: 0.4498699730221994.
[I 2024-12-03 18:40:54,353] Trial 291 finished with value: 0.46078527519920953 and parameters: {'kernel': 'rbf', 'C': 88.75758341129402, 'gamma': 0.011147111198166004, 'epsilon': 0.039541501498247866}. Best is trial 245 with value: 0.4498699730221994.
[I 2024-12-03 18:40:54,584] Trial 278 finished with value: 92.65380849548075 and parameters: {'kernel': 'sigmoid', 'C': 16.407070206754074, 'gamma': 0.03470840335887241, 'epsilon': 0.05148595163521769}. Best is trial 245 with value: 0.4498699730221994.
[I 2024-12-03 18:40:54,604] Trial 288 finished with value: 0.4584114215656067 and parameters: {'kernel': 'rbf', 'C': 99.78751433936021, 'gamma': 0.0147931947766234, 'epsilon': 0.027728713521431882}. Best is trial 245 with value: 0.4498699730221994.
[I 2024-12-03 18:40:54,757] Trial 284 finished with value: 0.5142176435562658 and parameters: {'kernel': 'rbf', 'C': 87.42237045152088, 'gamma': 0.030270028482361953, 'epsilon': 0.036607410179405865}. Best is trial 245 with value: 0.4498699730221994.
[I 2024-12-03 18:40:55,667] Trial 290 finished with value: 0.49240093790997874 and parameters: {'kernel': 'rbf', 'C': 8.543223753595635, 'gamma': 0.0422077893200337, 'epsilon': 0.04395553669750899}. Best is trial 245 with value: 0.4498699730221994.
[I 2024-12-03 18:40:55,672] Trial 292 finished with value: 1.373784434513271 and parameters: {'kernel': 'poly', 'C': 0.0014656758976876734, 'gamma': 0.00019983397256440632, 'epsilon': 0.0018642387639507495}. Best is trial 245 with value: 0.4498699730221994.
[I 2024-12-03 18:40:56,965] Trial 281 finished with value: 0.460619106798868 and parameters: {'kernel': 'rbf', 'C': 90.05120310244365, 'gamma': 0.01775661548131394, 'epsilon': 0.027090172536002242}. Best is trial 245 with value: 0.4498699730221994.
[I 2024-12-03 18:40:57,242] Trial 279 finished with value: 0.5208927974729373 and parameters: {'kernel': 'rbf', 'C': 22.798515227381472, 'gamma': 0.009948219570548497, 'epsilon': 0.05170964358058859}. Best is trial 245 with value: 0.4498699730221994.
[I 2024-12-03 18:40:57,379] Trial 221 finished with value: 1.042217985919385 and parameters: {'kernel': 'poly', 'C': 77.80379886101352, 'gamma': 0.24302427247166952, 'epsilon': 0.02452019020733119}. Best is trial 245 with value: 0.4498699730221994.
[I 2024-12-03 18:40:57,774] Trial 282 finished with value: 0.48608326057633283 and parameters: {'kernel': 'rbf', 'C': 70.69890045977913, 'gamma': 0.02856233194780859, 'epsilon': 0.01785047953637765}. Best is trial 245 with value: 0.4498699730221994.
[I 2024-12-03 18:40:58,397] Trial 286 finished with value: 0.4837912935163165 and parameters: {'kernel': 'rbf', 'C': 49.232134824024186, 'gamma': 0.010847344953599125, 'epsilon': 0.010408053445142257}. Best is trial 245 with value: 0.4498699730221994.
[I 2024-12-03 18:40:58,400] Trial 289 finished with value: 0.5224237393424188 and parameters: {'kernel': 'rbf', 'C': 88.04821180787897, 'gamma': 0.004265438931198933, 'epsilon': 0.024700087957489476}. Best is trial 245 with value: 0.4498699730221994.
[I 2024-12-03 18:40:58,484] Trial 303 finished with value: 0.460014505489612 and parameters: {'kernel': 'rbf', 'C': 68.46740105802884, 'gamma': 0.019864301448973786, 'epsilon': 0.03215890432421266}. Best is trial 245 with value: 0.4498699730221994.
[I 2024-12-03 18:40:58,622] Trial 293 finished with value: 0.507142248574383 and parameters: {'kernel': 'rbf', 'C': 80.21882034053134, 'gamma': 0.005730632177030873, 'epsilon': 0.021312063488103022}. Best is trial 245 with value: 0.4498699730221994.
[I 2024-12-03 18:40:58,624] Trial 294 finished with value: 1.3133302852638267 and parameters: {'kernel': 'sigmoid', 'C': 0.029139731043677224, 'gamma': 0.8993262657410402, 'epsilon': 0.07337855630077793}. Best is trial 245 with value: 0.4498699730221994.
[I 2024-12-03 18:40:58,753] Trial 287 finished with value: 0.7999392002435399 and parameters: {'kernel': 'rbf', 'C': 0.869659284140554, 'gamma': 0.006351200648076241, 'epsilon': 0.9415379850264313}. Best is trial 245 with value: 0.4498699730221994.
[I 2024-12-03 18:40:59,561] Trial 296 finished with value: 0.49789488155623024 and parameters: {'kernel': 'rbf', 'C': 18.385051853372094, 'gamma': 0.04449154761299723, 'epsilon': 0.09771241152277013}. Best is trial 245 with value: 0.4498699730221994.
[I 2024-12-03 18:40:59,901] Trial 299 finished with value: 0.4506796435051393 and parameters: {'kernel': 'rbf', 'C': 71.42099456100988, 'gamma': 0.01428387340332406, 'epsilon': 0.06077388650179937}. Best is trial 245 with value: 0.4498699730221994.
[I 2024-12-03 18:41:00,460] Trial 301 finished with value: 0.5135259618520285 and parameters: {'kernel': 'rbf', 'C': 96.86267378847275, 'gamma': 0.028873432706050948, 'epsilon': 0.021277721024961224}. Best is trial 245 with value: 0.4498699730221994.
[I 2024-12-03 18:41:00,468] Trial 297 finished with value: 1.0988978971716723 and parameters: {'kernel': 'poly', 'C': 17.151314212724845, 'gamma': 0.5050712497462458, 'epsilon': 0.8713921460830208}. Best is trial 245 with value: 0.4498699730221994.
[I 2024-12-03 18:41:00,983] Trial 300 finished with value: 0.5392032421445901 and parameters: {'kernel': 'rbf', 'C': 12.255760666235854, 'gamma': 0.011692310684369267, 'epsilon': 0.04595687511670356}. Best is trial 245 with value: 0.4498699730221994.
[I 2024-12-03 18:41:00,987] Trial 295 finished with value: 0.4588429255565422 and parameters: {'kernel': 'rbf', 'C': 89.28657924444971, 'gamma': 0.012898079729587545, 'epsilon': 0.02598202785622971}. Best is trial 245 with value: 0.4498699730221994.
[I 2024-12-03 18:41:01,050] Trial 305 finished with value: 0.4596500110124487 and parameters: {'kernel': 'rbf', 'C': 86.45647132884292, 'gamma': 0.01944926533390822, 'epsilon': 0.07111284725118139}. Best is trial 245 with value: 0.4498699730221994.
[I 2024-12-03 18:41:01,056] Trial 298 finished with value: 0.48667619336253676 and parameters: {'kernel': 'rbf', 'C': 77.86417028101349, 'gamma': 0.007669538042325252, 'epsilon': 0.11311701851465127}. Best is trial 245 with value: 0.4498699730221994.
[I 2024-12-03 18:41:01,375] Trial 306 finished with value: 0.5087920954641727 and parameters: {'kernel': 'rbf', 'C': 26.09945197281702, 'gamma': 0.04800976463315056, 'epsilon': 0.05139146111324206}. Best is trial 245 with value: 0.4498699730221994.
[I 2024-12-03 18:41:01,957] Trial 311 finished with value: 0.6786673499835613 and parameters: {'kernel': 'rbf', 'C': 99.13919942229104, 'gamma': 0.3397905027774763, 'epsilon': 0.2577541471459998}. Best is trial 245 with value: 0.4498699730221994.
[I 2024-12-03 18:41:02,446] Trial 304 finished with value: 0.5413972490037561 and parameters: {'kernel': 'rbf', 'C': 15.058614491465569, 'gamma': 0.009693806458892599, 'epsilon': 0.09136659151994192}. Best is trial 245 with value: 0.4498699730221994.
[I 2024-12-03 18:41:03,643] Trial 316 finished with value: 0.4580286518310914 and parameters: {'kernel': 'rbf', 'C': 88.87913329452384, 'gamma': 0.017400320179530773, 'epsilon': 0.036204668669033414}. Best is trial 245 with value: 0.4498699730221994.
[I 2024-12-03 18:41:04,022] Trial 312 finished with value: 0.693079046183716 and parameters: {'kernel': 'linear', 'C': 0.053844483512977305, 'gamma': 0.00012797331161707178, 'epsilon': 0.002902984410253949}. Best is trial 245 with value: 0.4498699730221994.
[I 2024-12-03 18:41:04,338] Trial 309 finished with value: 0.5437866953200235 and parameters: {'kernel': 'rbf', 'C': 11.055342769946806, 'gamma': 0.011419014287982261, 'epsilon': 0.03614970669061933}. Best is trial 245 with value: 0.4498699730221994.
[I 2024-12-03 18:41:04,792] Trial 317 finished with value: 479.03629565658775 and parameters: {'kernel': 'sigmoid', 'C': 92.70355393966999, 'gamma': 0.02691577871247345, 'epsilon': 0.019256606691416774}. Best is trial 245 with value: 0.4498699730221994.
[I 2024-12-03 18:41:04,914] Trial 321 finished with value: 0.5152512789992395 and parameters: {'kernel': 'rbf', 'C': 92.5258767326173, 'gamma': 0.004162651056351526, 'epsilon': 0.049089814319225586}. Best is trial 245 with value: 0.4498699730221994.
[I 2024-12-03 18:41:05,142] Trial 308 finished with value: 0.5615526308762467 and parameters: {'kernel': 'rbf', 'C': 89.7155141752829, 'gamma': 0.03580696760929068, 'epsilon': 0.05280883441090775}. Best is trial 245 with value: 0.4498699730221994.
