[I 2024-12-04 12:01:17,496] Trial 438 finished with value: 0.44272053064268185 and parameters: {'n_estimators': 270, 'max_depth': 49, 'min_samples_split': 2, 'min_samples_leaf': 2, 'max_features': 'sqrt', 'bootstrap': False, 'criterion': 'squared_error'}. Best is trial 341 with value: 0.2909369124469028.
[I 2024-12-04 12:01:17,866] Trial 426 finished with value: 0.7224526343703157 and parameters: {'n_estimators': 417, 'max_depth': 15, 'min_samples_split': 24, 'min_samples_leaf': 1, 'max_features': 'log2', 'bootstrap': False, 'criterion': 'absolute_error'}. Best is trial 341 with value: 0.2909369124469028.
[I 2024-12-04 12:01:18,229] Trial 441 finished with value: 0.29453892694887845 and parameters: {'n_estimators': 132, 'max_depth': 50, 'min_samples_split': 3, 'min_samples_leaf': 1, 'max_features': 'sqrt', 'bootstrap': False, 'criterion': 'squared_error'}. Best is trial 341 with value: 0.2909369124469028.
[I 2024-12-04 12:01:18,375] Trial 442 finished with value: 0.4409962643847999 and parameters: {'n_estimators': 110, 'max_depth': 50, 'min_samples_split': 2, 'min_samples_leaf': 2, 'max_features': 'sqrt', 'bootstrap': False, 'criterion': 'squared_error'}. Best is trial 341 with value: 0.2909369124469028.
[I 2024-12-04 12:01:19,238] Trial 433 finished with value: 0.2941211724785668 and parameters: {'n_estimators': 141, 'max_depth': 50, 'min_samples_split': 3, 'min_samples_leaf': 1, 'max_features': 'sqrt', 'bootstrap': False, 'criterion': 'squared_error'}. Best is trial 341 with value: 0.2909369124469028.
[I 2024-12-04 12:01:19,296] Trial 439 finished with value: 0.41726985596767624 and parameters: {'n_estimators': 173, 'max_depth': 49, 'min_samples_split': 9, 'min_samples_leaf': 1, 'max_features': 'log2', 'bootstrap': False, 'criterion': 'squared_error'}. Best is trial 341 with value: 0.2909369124469028.
[I 2024-12-04 12:01:19,678] Trial 444 finished with value: 0.331636454483705 and parameters: {'n_estimators': 139, 'max_depth': 45, 'min_samples_split': 4, 'min_samples_leaf': 1, 'max_features': 'sqrt', 'bootstrap': True, 'criterion': 'squared_error'}. Best is trial 341 with value: 0.2909369124469028.
[I 2024-12-04 12:01:19,796] Trial 440 finished with value: 0.2932479049618731 and parameters: {'n_estimators': 193, 'max_depth': 49, 'min_samples_split': 3, 'min_samples_leaf': 1, 'max_features': 'sqrt', 'bootstrap': False, 'criterion': 'squared_error'}. Best is trial 341 with value: 0.2909369124469028.
[I 2024-12-04 12:01:19,848] Trial 399 finished with value: 0.4123729008653445 and parameters: {'n_estimators': 147, 'max_depth': 44, 'min_samples_split': 4, 'min_samples_leaf': 1, 'max_features': None, 'bootstrap': False, 'criterion': 'absolute_error'}. Best is trial 341 with value: 0.2909369124469028.
[I 2024-12-04 12:01:20,992] Trial 436 finished with value: 0.898922601483498 and parameters: {'n_estimators': 611, 'max_depth': 28, 'min_samples_split': 7, 'min_samples_leaf': 13, 'max_features': 'sqrt', 'bootstrap': True, 'criterion': 'absolute_error'}. Best is trial 341 with value: 0.2909369124469028.
[I 2024-12-04 12:01:21,106] Trial 449 finished with value: 0.29868687790246407 and parameters: {'n_estimators': 134, 'max_depth': 50, 'min_samples_split': 2, 'min_samples_leaf': 1, 'max_features': 'sqrt', 'bootstrap': False, 'criterion': 'squared_error'}. Best is trial 341 with value: 0.2909369124469028.
[I 2024-12-04 12:01:21,736] Trial 420 finished with value: 0.5132145407200208 and parameters: {'n_estimators': 628, 'max_depth': 35, 'min_samples_split': 5, 'min_samples_leaf': 1, 'max_features': 'log2', 'bootstrap': True, 'criterion': 'absolute_error'}. Best is trial 341 with value: 0.2909369124469028.
[I 2024-12-04 12:01:22,137] Trial 447 finished with value: 0.30575528332712293 and parameters: {'n_estimators': 152, 'max_depth': 40, 'min_samples_split': 3, 'min_samples_leaf': 1, 'max_features': 'sqrt', 'bootstrap': False, 'criterion': 'squared_error'}. Best is trial 341 with value: 0.2909369124469028.
[I 2024-12-04 12:01:24,417] Trial 435 finished with value: 0.4487128951473923 and parameters: {'n_estimators': 135, 'max_depth': 45, 'min_samples_split': 19, 'min_samples_leaf': 8, 'max_features': None, 'bootstrap': False, 'criterion': 'absolute_error'}. Best is trial 341 with value: 0.2909369124469028.
[I 2024-12-04 12:01:24,961] Trial 448 finished with value: 0.31772909182266973 and parameters: {'n_estimators': 288, 'max_depth': 42, 'min_samples_split': 6, 'min_samples_leaf': 1, 'max_features': 'sqrt', 'bootstrap': False, 'criterion': 'squared_error'}. Best is trial 341 with value: 0.2909369124469028.
[I 2024-12-04 12:01:25,792] Trial 454 finished with value: 0.809407321241097 and parameters: {'n_estimators': 450, 'max_depth': 5, 'min_samples_split': 41, 'min_samples_leaf': 3, 'max_features': 'sqrt', 'bootstrap': True, 'criterion': 'absolute_error'}. Best is trial 341 with value: 0.2909369124469028.
[I 2024-12-04 12:01:25,941] Trial 446 finished with value: 0.301908463077645 and parameters: {'n_estimators': 220, 'max_depth': 42, 'min_samples_split': 3, 'min_samples_leaf': 1, 'max_features': 'sqrt', 'bootstrap': False, 'criterion': 'squared_error'}. Best is trial 341 with value: 0.2909369124469028.
[I 2024-12-04 12:01:25,943] Trial 452 finished with value: 0.32932269159213845 and parameters: {'n_estimators': 230, 'max_depth': 41, 'min_samples_split': 7, 'min_samples_leaf': 1, 'max_features': 'sqrt', 'bootstrap': False, 'criterion': 'squared_error'}. Best is trial 341 with value: 0.2909369124469028.
[I 2024-12-04 12:01:26,468] Trial 456 finished with value: 0.29912399968660647 and parameters: {'n_estimators': 221, 'max_depth': 50, 'min_samples_split': 2, 'min_samples_leaf': 1, 'max_features': 'sqrt', 'bootstrap': False, 'criterion': 'squared_error'}. Best is trial 341 with value: 0.2909369124469028.
[I 2024-12-04 12:01:27,512] Trial 451 finished with value: 0.31418402128024897 and parameters: {'n_estimators': 310, 'max_depth': 50, 'min_samples_split': 7, 'min_samples_leaf': 1, 'max_features': 'sqrt', 'bootstrap': False, 'criterion': 'squared_error'}. Best is trial 341 with value: 0.2909369124469028.
[I 2024-12-04 12:01:27,515] Trial 459 finished with value: 0.4464087551277395 and parameters: {'n_estimators': 201, 'max_depth': 50, 'min_samples_split': 5, 'min_samples_leaf': 2, 'max_features': 'sqrt', 'bootstrap': False, 'criterion': 'squared_error'}. Best is trial 341 with value: 0.2909369124469028.
[I 2024-12-04 12:01:27,918] Trial 453 finished with value: 0.44428706747882946 and parameters: {'n_estimators': 184, 'max_depth': 50, 'min_samples_split': 3, 'min_samples_leaf': 2, 'max_features': 'sqrt', 'bootstrap': False, 'criterion': 'squared_error'}. Best is trial 341 with value: 0.2909369124469028.
[I 2024-12-04 12:01:29,520] Trial 457 finished with value: 0.2918775314181176 and parameters: {'n_estimators': 240, 'max_depth': 48, 'min_samples_split': 3, 'min_samples_leaf': 1, 'max_features': 'sqrt', 'bootstrap': False, 'criterion': 'squared_error'}. Best is trial 341 with value: 0.2909369124469028.
[I 2024-12-04 12:01:29,698] Trial 445 finished with value: 0.44663440681540423 and parameters: {'n_estimators': 178, 'max_depth': 47, 'min_samples_split': 3, 'min_samples_leaf': 2, 'max_features': 'sqrt', 'bootstrap': False, 'criterion': 'squared_error'}. Best is trial 341 with value: 0.2909369124469028.
[I 2024-12-04 12:01:29,900] Trial 450 finished with value: 0.4582347463368427 and parameters: {'n_estimators': 236, 'max_depth': 38, 'min_samples_split': 4, 'min_samples_leaf': 1, 'max_features': 'log2', 'bootstrap': False, 'criterion': 'squared_error'}. Best is trial 341 with value: 0.2909369124469028.
[I 2024-12-04 12:01:30,309] Trial 463 finished with value: 0.2925200020924061 and parameters: {'n_estimators': 257, 'max_depth': 48, 'min_samples_split': 3, 'min_samples_leaf': 1, 'max_features': 'sqrt', 'bootstrap': False, 'criterion': 'squared_error'}. Best is trial 341 with value: 0.2909369124469028.
[I 2024-12-04 12:01:31,890] Trial 455 finished with value: 0.873004668826583 and parameters: {'n_estimators': 627, 'max_depth': 7, 'min_samples_split': 6, 'min_samples_leaf': 3, 'max_features': 'log2', 'bootstrap': False, 'criterion': 'absolute_error'}. Best is trial 341 with value: 0.2909369124469028.
[I 2024-12-04 12:01:32,014] Trial 469 finished with value: 0.2932147723524234 and parameters: {'n_estimators': 183, 'max_depth': 50, 'min_samples_split': 3, 'min_samples_leaf': 1, 'max_features': 'sqrt', 'bootstrap': False, 'criterion': 'squared_error'}. Best is trial 341 with value: 0.2909369124469028.
[I 2024-12-04 12:01:32,805] Trial 462 finished with value: 0.29988792085412125 and parameters: {'n_estimators': 277, 'max_depth': 50, 'min_samples_split': 4, 'min_samples_leaf': 1, 'max_features': 'sqrt', 'bootstrap': False, 'criterion': 'squared_error'}. Best is trial 341 with value: 0.2909369124469028.
[I 2024-12-04 12:01:32,838] Trial 470 finished with value: 0.29400313927698757 and parameters: {'n_estimators': 102, 'max_depth': 50, 'min_samples_split': 3, 'min_samples_leaf': 1, 'max_features': 'sqrt', 'bootstrap': False, 'criterion': 'squared_error'}. Best is trial 341 with value: 0.2909369124469028.
[I 2024-12-04 12:01:32,906] Trial 458 finished with value: 0.6682209756017232 and parameters: {'n_estimators': 581, 'max_depth': 48, 'min_samples_split': 18, 'min_samples_leaf': 4, 'max_features': 'sqrt', 'bootstrap': True, 'criterion': 'absolute_error'}. Best is trial 341 with value: 0.2909369124469028.
[I 2024-12-04 12:01:33,328] Trial 468 finished with value: 0.3028537541386627 and parameters: {'n_estimators': 344, 'max_depth': 42, 'min_samples_split': 3, 'min_samples_leaf': 1, 'max_features': 'sqrt', 'bootstrap': False, 'criterion': 'squared_error'}. Best is trial 341 with value: 0.2909369124469028.
[I 2024-12-04 12:01:34,732] Trial 467 finished with value: 0.3029784643563408 and parameters: {'n_estimators': 286, 'max_depth': 42, 'min_samples_split': 3, 'min_samples_leaf': 1, 'max_features': 'sqrt', 'bootstrap': False, 'criterion': 'squared_error'}. Best is trial 341 with value: 0.2909369124469028.
[I 2024-12-04 12:01:34,792] Trial 465 finished with value: 0.3807408338872233 and parameters: {'n_estimators': 200, 'max_depth': 49, 'min_samples_split': 3, 'min_samples_leaf': 1, 'max_features': None, 'bootstrap': False, 'criterion': 'squared_error'}. Best is trial 341 with value: 0.2909369124469028.
[I 2024-12-04 12:01:36,189] Trial 472 finished with value: 0.7115901108880714 and parameters: {'n_estimators': 546, 'max_depth': 30, 'min_samples_split': 4, 'min_samples_leaf': 7, 'max_features': 'sqrt', 'bootstrap': False, 'criterion': 'squared_error'}. Best is trial 341 with value: 0.2909369124469028.
[I 2024-12-04 12:01:36,850] Trial 471 finished with value: 0.3064688332761293 and parameters: {'n_estimators': 339, 'max_depth': 43, 'min_samples_split': 2, 'min_samples_leaf': 1, 'max_features': 'sqrt', 'bootstrap': False, 'criterion': 'squared_error'}. Best is trial 341 with value: 0.2909369124469028.
[I 2024-12-04 12:01:37,059] Trial 460 finished with value: 0.5534410715214552 and parameters: {'n_estimators': 535, 'max_depth': 19, 'min_samples_split': 25, 'min_samples_leaf': 3, 'max_features': 'sqrt', 'bootstrap': False, 'criterion': 'squared_error'}. Best is trial 341 with value: 0.2909369124469028.
[I 2024-12-04 12:01:37,094] Trial 473 finished with value: 0.509768828687209 and parameters: {'n_estimators': 754, 'max_depth': 25, 'min_samples_split': 2, 'min_samples_leaf': 2, 'max_features': 'sqrt', 'bootstrap': True, 'criterion': 'squared_error'}. Best is trial 341 with value: 0.2909369124469028.
[I 2024-12-04 12:01:39,513] Trial 476 finished with value: 0.308649512623981 and parameters: {'n_estimators': 238, 'max_depth': 50, 'min_samples_split': 6, 'min_samples_leaf': 1, 'max_features': 'sqrt', 'bootstrap': False, 'criterion': 'squared_error'}. Best is trial 341 with value: 0.2909369124469028.
[I 2024-12-04 12:01:39,533] Trial 478 finished with value: 0.7217484683843862 and parameters: {'n_estimators': 118, 'max_depth': 14, 'min_samples_split': 12, 'min_samples_leaf': 1, 'max_features': 'log2', 'bootstrap': True, 'criterion': 'squared_error'}. Best is trial 341 with value: 0.2909369124469028.
[I 2024-12-04 12:01:40,846] Trial 461 finished with value: 0.5541989446664619 and parameters: {'n_estimators': 570, 'max_depth': 18, 'min_samples_split': 11, 'min_samples_leaf': 15, 'max_features': None, 'bootstrap': True, 'criterion': 'squared_error'}. Best is trial 341 with value: 0.2909369124469028.
[I 2024-12-04 12:01:41,451] Trial 480 finished with value: 0.4457831070308334 and parameters: {'n_estimators': 116, 'max_depth': 39, 'min_samples_split': 2, 'min_samples_leaf': 1, 'max_features': 'log2', 'bootstrap': False, 'criterion': 'squared_error'}. Best is trial 341 with value: 0.2909369124469028.
[I 2024-12-04 12:01:41,508] Trial 464 finished with value: 0.30554928288297556 and parameters: {'n_estimators': 233, 'max_depth': 43, 'min_samples_split': 2, 'min_samples_leaf': 1, 'max_features': 'sqrt', 'bootstrap': False, 'criterion': 'squared_error'}. Best is trial 341 with value: 0.2909369124469028.
[I 2024-12-04 12:01:43,350] Trial 481 finished with value: 0.9535794128213229 and parameters: {'n_estimators': 251, 'max_depth': 43, 'min_samples_split': 2, 'min_samples_leaf': 8, 'max_features': 'log2', 'bootstrap': True, 'criterion': 'absolute_error'}. Best is trial 341 with value: 0.2909369124469028.
[I 2024-12-04 12:01:43,359] Trial 485 finished with value: 0.4479084636920912 and parameters: {'n_estimators': 352, 'max_depth': 38, 'min_samples_split': 3, 'min_samples_leaf': 2, 'max_features': 'sqrt', 'bootstrap': False, 'criterion': 'squared_error'}. Best is trial 341 with value: 0.2909369124469028.
[I 2024-12-04 12:01:43,859] Trial 479 finished with value: 0.30034489140659615 and parameters: {'n_estimators': 246, 'max_depth': 50, 'min_samples_split': 4, 'min_samples_leaf': 1, 'max_features': 'sqrt', 'bootstrap': False, 'criterion': 'squared_error'}. Best is trial 341 with value: 0.2909369124469028.
[I 2024-12-04 12:01:43,959] Trial 493 finished with value: 0.8424557640313152 and parameters: {'n_estimators': 123, 'max_depth': 31, 'min_samples_split': 38, 'min_samples_leaf': 15, 'max_features': 'sqrt', 'bootstrap': False, 'criterion': 'absolute_error'}. Best is trial 341 with value: 0.2909369124469028.
[I 2024-12-04 12:01:43,976] Trial 484 finished with value: 0.3090853095225644 and parameters: {'n_estimators': 219, 'max_depth': 42, 'min_samples_split': 4, 'min_samples_leaf': 1, 'max_features': 'sqrt', 'bootstrap': False, 'criterion': 'squared_error'}. Best is trial 341 with value: 0.2909369124469028.
[I 2024-12-04 12:01:44,400] Trial 466 finished with value: 0.30557407070547293 and parameters: {'n_estimators': 243, 'max_depth': 49, 'min_samples_split': 3, 'min_samples_leaf': 1, 'max_features': 'sqrt', 'bootstrap': False, 'criterion': 'absolute_error'}. Best is trial 341 with value: 0.2909369124469028.
[I 2024-12-04 12:01:45,245] Trial 474 finished with value: 0.8451524191075289 and parameters: {'n_estimators': 916, 'max_depth': 29, 'min_samples_split': 47, 'min_samples_leaf': 13, 'max_features': 'sqrt', 'bootstrap': False, 'criterion': 'absolute_error'}. Best is trial 341 with value: 0.2909369124469028.
[I 2024-12-04 12:01:45,370] Trial 489 finished with value: 0.44675460233110387 and parameters: {'n_estimators': 262, 'max_depth': 41, 'min_samples_split': 3, 'min_samples_leaf': 2, 'max_features': 'sqrt', 'bootstrap': False, 'criterion': 'squared_error'}. Best is trial 341 with value: 0.2909369124469028.
[I 2024-12-04 12:01:45,721] Trial 492 finished with value: 0.2981946995644585 and parameters: {'n_estimators': 202, 'max_depth': 50, 'min_samples_split': 2, 'min_samples_leaf': 1, 'max_features': 'sqrt', 'bootstrap': False, 'criterion': 'squared_error'}. Best is trial 341 with value: 0.2909369124469028.
[I 2024-12-04 12:01:46,013] Trial 482 finished with value: 0.29309931458040317 and parameters: {'n_estimators': 258, 'max_depth': 49, 'min_samples_split': 3, 'min_samples_leaf': 1, 'max_features': 'sqrt', 'bootstrap': False, 'criterion': 'squared_error'}. Best is trial 341 with value: 0.2909369124469028.
[I 2024-12-04 12:01:46,086] Trial 499 finished with value: 0.32562684433784933 and parameters: {'n_estimators': 106, 'max_depth': 36, 'min_samples_split': 3, 'min_samples_leaf': 1, 'max_features': 'sqrt', 'bootstrap': False, 'criterion': 'squared_error'}. Best is trial 341 with value: 0.2909369124469028.
[I 2024-12-04 12:01:46,259] Trial 491 finished with value: 0.3054067649916674 and parameters: {'n_estimators': 204, 'max_depth': 43, 'min_samples_split': 4, 'min_samples_leaf': 1, 'max_features': 'sqrt', 'bootstrap': False, 'criterion': 'squared_error'}. Best is trial 341 with value: 0.2909369124469028.
[I 2024-12-04 12:01:46,955] Trial 487 finished with value: 0.7902339621487945 and parameters: {'n_estimators': 403, 'max_depth': 44, 'min_samples_split': 2, 'min_samples_leaf': 2, 'max_features': 'log2', 'bootstrap': True, 'criterion': 'squared_error'}. Best is trial 341 with value: 0.2909369124469028.
[I 2024-12-04 12:01:47,140] Trial 488 finished with value: 0.4440105513028404 and parameters: {'n_estimators': 315, 'max_depth': 48, 'min_samples_split': 4, 'min_samples_leaf': 2, 'max_features': 'sqrt', 'bootstrap': False, 'criterion': 'squared_error'}. Best is trial 341 with value: 0.2909369124469028.
[I 2024-12-04 12:01:47,509] Trial 339 finished with value: 0.4360850629952864 and parameters: {'n_estimators': 684, 'max_depth': 24, 'min_samples_split': 2, 'min_samples_leaf': 2, 'max_features': None, 'bootstrap': False, 'criterion': 'absolute_error'}. Best is trial 341 with value: 0.2909369124469028.
[I 2024-12-04 12:01:49,504] Trial 495 finished with value: 0.29483343716832444 and parameters: {'n_estimators': 285, 'max_depth': 50, 'min_samples_split': 3, 'min_samples_leaf': 1, 'max_features': 'sqrt', 'bootstrap': False, 'criterion': 'squared_error'}. Best is trial 341 with value: 0.2909369124469028.
[I 2024-12-04 12:01:49,505] Trial 490 finished with value: 0.3060503873691488 and parameters: {'n_estimators': 249, 'max_depth': 42, 'min_samples_split': 2, 'min_samples_leaf': 1, 'max_features': 'sqrt', 'bootstrap': False, 'criterion': 'squared_error'}. Best is trial 341 with value: 0.2909369124469028.
[I 2024-12-04 12:01:49,807] Trial 498 finished with value: 0.3105380015191217 and parameters: {'n_estimators': 111, 'max_depth': 42, 'min_samples_split': 2, 'min_samples_leaf': 1, 'max_features': 'sqrt', 'bootstrap': False, 'criterion': 'squared_error'}. Best is trial 341 with value: 0.2909369124469028.
[I 2024-12-04 12:01:50,583] Trial 502 finished with value: 0.9276669950618542 and parameters: {'n_estimators': 152, 'max_depth': 32, 'min_samples_split': 44, 'min_samples_leaf': 6, 'max_features': 'log2', 'bootstrap': False, 'criterion': 'squared_error'}. Best is trial 341 with value: 0.2909369124469028.
[I 2024-12-04 12:01:50,584] Trial 486 finished with value: 0.6503282766716794 and parameters: {'n_estimators': 592, 'max_depth': 11, 'min_samples_split': 10, 'min_samples_leaf': 2, 'max_features': 'sqrt', 'bootstrap': True, 'criterion': 'squared_error'}. Best is trial 341 with value: 0.2909369124469028.
[I 2024-12-04 12:01:52,651] Trial 497 finished with value: 0.2979588135957969 and parameters: {'n_estimators': 322, 'max_depth': 50, 'min_samples_split': 2, 'min_samples_leaf': 1, 'max_features': 'sqrt', 'bootstrap': False, 'criterion': 'squared_error'}. Best is trial 341 with value: 0.2909369124469028.
[I 2024-12-04 12:01:53,312] Trial 505 finished with value: 0.39429059520070886 and parameters: {'n_estimators': 132, 'max_depth': 50, 'min_samples_split': 4, 'min_samples_leaf': 1, 'max_features': 'log2', 'bootstrap': False, 'criterion': 'squared_error'}. Best is trial 341 with value: 0.2909369124469028.
[I 2024-12-04 12:01:53,318] Trial 503 finished with value: 0.44333646057281967 and parameters: {'n_estimators': 285, 'max_depth': 50, 'min_samples_split': 4, 'min_samples_leaf': 2, 'max_features': 'sqrt', 'bootstrap': False, 'criterion': 'squared_error'}. Best is trial 341 with value: 0.2909369124469028.
[I 2024-12-04 12:01:53,930] Trial 483 finished with value: 0.7925835375852438 and parameters: {'n_estimators': 682, 'max_depth': 5, 'min_samples_split': 9, 'min_samples_leaf': 1, 'max_features': 'sqrt', 'bootstrap': False, 'criterion': 'absolute_error'}. Best is trial 341 with value: 0.2909369124469028.
[I 2024-12-04 12:01:55,370] Trial 507 finished with value: 0.30644161671699127 and parameters: {'n_estimators': 327, 'max_depth': 49, 'min_samples_split': 5, 'min_samples_leaf': 1, 'max_features': 'sqrt', 'bootstrap': False, 'criterion': 'squared_error'}. Best is trial 341 with value: 0.2909369124469028.
[I 2024-12-04 12:01:55,525] Trial 494 finished with value: 0.44397964420840363 and parameters: {'n_estimators': 296, 'max_depth': 48, 'min_samples_split': 4, 'min_samples_leaf': 2, 'max_features': 'sqrt', 'bootstrap': False, 'criterion': 'squared_error'}. Best is trial 341 with value: 0.2909369124469028.
[I 2024-12-04 12:01:57,958] Trial 511 finished with value: 0.29499908749147696 and parameters: {'n_estimators': 267, 'max_depth': 50, 'min_samples_split': 3, 'min_samples_leaf': 1, 'max_features': 'sqrt', 'bootstrap': False, 'criterion': 'squared_error'}. Best is trial 341 with value: 0.2909369124469028.
[I 2024-12-04 12:01:58,009] Trial 500 finished with value: 0.3006535132993899 and parameters: {'n_estimators': 273, 'max_depth': 44, 'min_samples_split': 3, 'min_samples_leaf': 1, 'max_features': 'sqrt', 'bootstrap': False, 'criterion': 'squared_error'}. Best is trial 341 with value: 0.2909369124469028.
[I 2024-12-04 12:01:58,405] Trial 501 finished with value: 0.29487400654131035 and parameters: {'n_estimators': 282, 'max_depth': 47, 'min_samples_split': 3, 'min_samples_leaf': 1, 'max_features': 'sqrt', 'bootstrap': False, 'criterion': 'squared_error'}. Best is trial 341 with value: 0.2909369124469028.
