[I 2024-12-04 15:13:08,996] Trial 1118 finished with value: 0.15167297135329605 and parameters: {'kernel_type': 'RBF', 'length_scale': 2.3024107521433193, 'noise_level': 0.02582120735693811, 'constant_value': 63.21955035628236, 'nu': 1.5}. Best is trial 750 with value: 0.13435342446039877.
[I 2024-12-04 15:13:10,378] Trial 1120 finished with value: 1.269363502868941 and parameters: {'kernel_type': 'Matern', 'length_scale': 0.04544166357542728, 'noise_level': 8.302510766126837e-07, 'constant_value': 13.58095311989819, 'nu': 1.5}. Best is trial 750 with value: 0.13435342446039877.
[I 2024-12-04 15:13:14,049] Trial 1122 finished with value: 1.2693635028416501 and parameters: {'kernel_type': 'Matern', 'length_scale': 0.034760751484368704, 'noise_level': 0.01956688236581307, 'constant_value': 211.46037333586088, 'nu': 1.5}. Best is trial 750 with value: 0.13435342446039877.
[I 2024-12-04 15:13:14,446] Trial 1123 finished with value: 0.13435439940859287 and parameters: {'kernel_type': 'Matern', 'length_scale': 16.439079382382452, 'noise_level': 0.6087179748436716, 'constant_value': 55.396898786948974, 'nu': 1.5}. Best is trial 750 with value: 0.13435342446039877.
[I 2024-12-04 15:13:15,199] Trial 1121 finished with value: 0.13435439984659747 and parameters: {'kernel_type': 'Matern', 'length_scale': 2.3852450013712034, 'noise_level': 0.4847559640501041, 'constant_value': 903.0381042324149, 'nu': 1.5}. Best is trial 750 with value: 0.13435342446039877.
[I 2024-12-04 15:13:15,201] Trial 1113 finished with value: 0.13435440102850613 and parameters: {'kernel_type': 'Matern', 'length_scale': 2.9516658461105214, 'noise_level': 0.5845328827021538, 'constant_value': 61.28214233524366, 'nu': 1.5}. Best is trial 750 with value: 0.13435342446039877.
[I 2024-12-04 15:13:16,237] Trial 1119 finished with value: 0.13435435516146838 and parameters: {'kernel_type': 'Matern', 'length_scale': 5.2677529885929255, 'noise_level': 0.09064351243338288, 'constant_value': 551.4794161581917, 'nu': 1.5}. Best is trial 750 with value: 0.13435342446039877.
[I 2024-12-04 15:13:18,073] Trial 1117 finished with value: 0.15167294550618837 and parameters: {'kernel_type': 'RBF', 'length_scale': 9.49269360543254, 'noise_level': 0.02014612313912362, 'constant_value': 230.3479043828035, 'nu': 1.5}. Best is trial 750 with value: 0.13435342446039877.
[I 2024-12-04 15:13:18,185] Trial 1116 finished with value: 0.13435441795317285 and parameters: {'kernel_type': 'Matern', 'length_scale': 1.5113967481601331, 'noise_level': 0.013962233717796082, 'constant_value': 2041.8195145165373, 'nu': 1.5}. Best is trial 750 with value: 0.13435342446039877.
[I 2024-12-04 15:13:19,515] Trial 1125 finished with value: 0.13435454429360857 and parameters: {'kernel_type': 'Matern', 'length_scale': 10.254141161313404, 'noise_level': 0.005595135132989261, 'constant_value': 4.8739867129691445, 'nu': 1.5}. Best is trial 750 with value: 0.13435342446039877.
[I 2024-12-04 15:13:19,927] Trial 1127 finished with value: 0.13435439822931652 and parameters: {'kernel_type': 'Matern', 'length_scale': 21.062325515489377, 'noise_level': 0.005800216252880238, 'constant_value': 13.145968242836496, 'nu': 1.5}. Best is trial 750 with value: 0.13435342446039877.
[I 2024-12-04 15:13:20,582] Trial 1130 finished with value: 1.2693635028571641 and parameters: {'kernel_type': 'Matern', 'length_scale': 0.0483995680444737, 'noise_level': 0.006222681497383766, 'constant_value': 1122.3060539937364, 'nu': 1.5}. Best is trial 750 with value: 0.13435342446039877.
[I 2024-12-04 15:13:20,824] Trial 1129 finished with value: 0.13435445607938845 and parameters: {'kernel_type': 'Matern', 'length_scale': 0.29438581221110965, 'noise_level': 0.00025889191293256984, 'constant_value': 0.3344370161609622, 'nu': 1.5}. Best is trial 750 with value: 0.13435342446039877.
[I 2024-12-04 15:13:25,651] Trial 1128 finished with value: 0.13435437542210182 and parameters: {'kernel_type': 'Matern', 'length_scale': 0.933361127398641, 'noise_level': 0.008490820738114708, 'constant_value': 3.469097804688405, 'nu': 1.5}. Best is trial 750 with value: 0.13435342446039877.
[I 2024-12-04 15:13:26,885] Trial 1138 finished with value: 0.13435439924117623 and parameters: {'kernel_type': 'Matern', 'length_scale': 0.6658804953922204, 'noise_level': 0.000651198111024823, 'constant_value': 8.662098596721902, 'nu': 1.5}. Best is trial 750 with value: 0.13435342446039877.
[I 2024-12-04 15:13:29,349] Trial 1124 finished with value: 0.17251040506824847 and parameters: {'kernel_type': 'Matern', 'length_scale': 0.1417398192326419, 'noise_level': 3.590658410259158e-05, 'constant_value': 11.766279930613752, 'nu': 0.5}. Best is trial 750 with value: 0.13435342446039877.
[I 2024-12-04 15:13:30,229] Trial 1132 finished with value: 1.269363502855082 and parameters: {'kernel_type': 'Matern', 'length_scale': 1.6619987166770624e-05, 'noise_level': 0.9916382360786274, 'constant_value': 0.2462491912711781, 'nu': 1.5}. Best is trial 750 with value: 0.13435342446039877.
[I 2024-12-04 15:13:30,235] Trial 1126 finished with value: 0.1343543952480944 and parameters: {'kernel_type': 'Matern', 'length_scale': 6.012514137184595, 'noise_level': 0.00026798885304447125, 'constant_value': 36.230190246267085, 'nu': 1.5}. Best is trial 750 with value: 0.13435342446039877.
[I 2024-12-04 15:13:31,338] Trial 1133 finished with value: 1.3007739235930598 and parameters: {'kernel_type': 'RBF', 'length_scale': 0.001573072060534815, 'noise_level': 1.1765322844613361e-08, 'constant_value': 69243.95877507568, 'nu': 2.5}. Best is trial 750 with value: 0.13435342446039877.
[I 2024-12-04 15:13:31,348] Trial 1134 finished with value: 0.13435439997801624 and parameters: {'kernel_type': 'Matern', 'length_scale': 193.1419330563176, 'noise_level': 0.7401528924410157, 'constant_value': 0.18261539697953028, 'nu': 1.5}. Best is trial 750 with value: 0.13435342446039877.
[I 2024-12-04 15:13:32,434] Trial 1135 finished with value: 0.13435441681295443 and parameters: {'kernel_type': 'Matern', 'length_scale': 0.5836874073237925, 'noise_level': 0.027529816263595106, 'constant_value': 1255.3012600461084, 'nu': 1.5}. Best is trial 750 with value: 0.13435342446039877.
[I 2024-12-04 15:13:32,439] Trial 1131 finished with value: 0.1343546205980307 and parameters: {'kernel_type': 'Matern', 'length_scale': 0.9483613275497975, 'noise_level': 0.00012268915146608475, 'constant_value': 8.503194048197946, 'nu': 1.5}. Best is trial 750 with value: 0.13435342446039877.
[I 2024-12-04 15:13:32,958] Trial 1147 finished with value: 1.269363502857331 and parameters: {'kernel_type': 'RBF', 'length_scale': 0.039983782010099694, 'noise_level': 6.896621444562436e-07, 'constant_value': 0.009148906888749326, 'nu': 1.5}. Best is trial 750 with value: 0.13435342446039877.
[I 2024-12-04 15:13:34,488] Trial 1137 finished with value: 0.1343543963354086 and parameters: {'kernel_type': 'Matern', 'length_scale': 84.74559481069342, 'noise_level': 0.003970573821649593, 'constant_value': 47.142662377075354, 'nu': 1.5}. Best is trial 750 with value: 0.13435342446039877.
[I 2024-12-04 15:13:35,187] Trial 1145 finished with value: 1.2693635028571395 and parameters: {'kernel_type': 'Matern', 'length_scale': 0.002332515870090767, 'noise_level': 0.00029892457381940513, 'constant_value': 172.45180402765823, 'nu': 1.5}. Best is trial 750 with value: 0.13435342446039877.
[I 2024-12-04 15:13:36,197] Trial 1142 finished with value: 1.2693614177406833 and parameters: {'kernel_type': 'Matern', 'length_scale': 0.11094307020824044, 'noise_level': 0.0023137989142168382, 'constant_value': 29.683680133110386, 'nu': 1.5}. Best is trial 750 with value: 0.13435342446039877.
[I 2024-12-04 15:13:36,438] Trial 1144 finished with value: 1.3007745979657548 and parameters: {'kernel_type': 'Matern', 'length_scale': 2.4955403359703348, 'noise_level': 0.0012023839767916183, 'constant_value': 32.26953819851557, 'nu': 1.5}. Best is trial 750 with value: 0.13435342446039877.
[I 2024-12-04 15:13:38,344] Trial 1140 finished with value: 0.1343544086167345 and parameters: {'kernel_type': 'Matern', 'length_scale': 5.080959889790083, 'noise_level': 0.020970353014089067, 'constant_value': 1752.4081775864443, 'nu': 1.5}. Best is trial 750 with value: 0.13435342446039877.
[I 2024-12-04 15:13:38,416] Trial 1136 finished with value: 0.13435438777011194 and parameters: {'kernel_type': 'Matern', 'length_scale': 1.8318786275952446, 'noise_level': 0.006231744417713029, 'constant_value': 0.014198925653110664, 'nu': 1.5}. Best is trial 750 with value: 0.13435342446039877.
[I 2024-12-04 15:13:39,372] Trial 1152 finished with value: 0.13435441455847036 and parameters: {'kernel_type': 'Matern', 'length_scale': 899.1277566837065, 'noise_level': 0.06099348684958962, 'constant_value': 158.12003108386463, 'nu': 1.5}. Best is trial 750 with value: 0.13435342446039877.
[I 2024-12-04 15:13:40,643] Trial 1143 finished with value: 0.13435430630998016 and parameters: {'kernel_type': 'Matern', 'length_scale': 12.417199860344088, 'noise_level': 0.00046796471449569467, 'constant_value': 0.10313637024410012, 'nu': 1.5}. Best is trial 750 with value: 0.13435342446039877.
[I 2024-12-04 15:13:42,260] Trial 1141 finished with value: 0.13435440012127478 and parameters: {'kernel_type': 'Matern', 'length_scale': 0.1587083196221481, 'noise_level': 0.005162522241430796, 'constant_value': 0.7750234758043383, 'nu': 1.5}. Best is trial 750 with value: 0.13435342446039877.
[I 2024-12-04 15:13:43,240] Trial 1139 finished with value: 0.13435439341320182 and parameters: {'kernel_type': 'Matern', 'length_scale': 2.1524616797529874, 'noise_level': 0.0003800795097141934, 'constant_value': 34.59653842581159, 'nu': 1.5}. Best is trial 750 with value: 0.13435342446039877.
[I 2024-12-04 15:13:43,979] Trial 1149 finished with value: 0.13435442219754778 and parameters: {'kernel_type': 'Matern', 'length_scale': 4622.436609522878, 'noise_level': 0.5175389026850463, 'constant_value': 730.7591560280806, 'nu': 1.5}. Best is trial 750 with value: 0.13435342446039877.
[I 2024-12-04 15:13:43,995] Trial 1151 finished with value: 0.13435437508656084 and parameters: {'kernel_type': 'Matern', 'length_scale': 10.139042934786367, 'noise_level': 0.013065452499806543, 'constant_value': 137.26266257128125, 'nu': 1.5}. Best is trial 750 with value: 0.13435342446039877.
[I 2024-12-04 15:13:50,246] Trial 1150 finished with value: 1.2693635028573669 and parameters: {'kernel_type': 'RBF', 'length_scale': 3358.3355418288857, 'noise_level': 6.319459056481749e-08, 'constant_value': 11.776135991900087, 'nu': 1.5}. Best is trial 750 with value: 0.13435342446039877.
[I 2024-12-04 15:13:50,883] Trial 1157 finished with value: 0.13435436768877448 and parameters: {'kernel_type': 'Matern', 'length_scale': 678.3156244134428, 'noise_level': 0.04412698038636028, 'constant_value': 2.5375423768524383, 'nu': 1.5}. Best is trial 750 with value: 0.13435342446039877.
[I 2024-12-04 15:13:51,071] Trial 1156 finished with value: 0.13435435177349428 and parameters: {'kernel_type': 'Matern', 'length_scale': 9.933204864542398, 'noise_level': 0.004408857747100481, 'constant_value': 811.2612405479091, 'nu': 1.5}. Best is trial 750 with value: 0.13435342446039877.
[I 2024-12-04 15:13:51,432] Trial 1146 finished with value: 0.13435432461061783 and parameters: {'kernel_type': 'Matern', 'length_scale': 15.177455895461472, 'noise_level': 0.00807025819910986, 'constant_value': 982.197188486377, 'nu': 1.5}. Best is trial 750 with value: 0.13435342446039877.
[I 2024-12-04 15:13:52,429] Trial 1159 finished with value: 1.3007745979525076 and parameters: {'kernel_type': 'RBF', 'length_scale': 66853.274157676, 'noise_level': 0.00013231635733130379, 'constant_value': 2.4584366436064787e-05, 'nu': 2.5}. Best is trial 750 with value: 0.13435342446039877.
[I 2024-12-04 15:13:52,903] Trial 1154 finished with value: 0.13435439963901824 and parameters: {'kernel_type': 'Matern', 'length_scale': 0.40091738017777445, 'noise_level': 0.2835482605864022, 'constant_value': 2609.450324109927, 'nu': 1.5}. Best is trial 750 with value: 0.13435342446039877.
[I 2024-12-04 15:13:53,798] Trial 1148 finished with value: 0.13435358499548808 and parameters: {'kernel_type': 'Matern', 'length_scale': 11.559608818276882, 'noise_level': 0.012509191231238347, 'constant_value': 1872.0565493637346, 'nu': 1.5}. Best is trial 750 with value: 0.13435342446039877.
[I 2024-12-04 15:13:56,780] Trial 1158 finished with value: 0.1343543656962976 and parameters: {'kernel_type': 'Matern', 'length_scale': 2.9290327185646636, 'noise_level': 0.026618877406142348, 'constant_value': 5.829293414843385, 'nu': 1.5}. Best is trial 750 with value: 0.13435342446039877.
[I 2024-12-04 15:13:57,584] Trial 1155 finished with value: 0.13435441060108913 and parameters: {'kernel_type': 'Matern', 'length_scale': 0.7504222299849086, 'noise_level': 0.0005252409566493591, 'constant_value': 275.78683234925006, 'nu': 1.5}. Best is trial 750 with value: 0.13435342446039877.
[I 2024-12-04 15:13:58,568] Trial 1169 finished with value: 0.13435421925490684 and parameters: {'kernel_type': 'Matern', 'length_scale': 106.95187167293899, 'noise_level': 0.045513642617731866, 'constant_value': 391.829939014666, 'nu': 1.5}. Best is trial 750 with value: 0.13435342446039877.
[I 2024-12-04 15:13:59,426] Trial 1162 finished with value: 0.13435439393900397 and parameters: {'kernel_type': 'Matern', 'length_scale': 333.5020422104473, 'noise_level': 0.6629620489859377, 'constant_value': 129.2473045901637, 'nu': 1.5}. Best is trial 750 with value: 0.13435342446039877.
[I 2024-12-04 15:13:59,718] Trial 1164 finished with value: 0.13435440081294364 and parameters: {'kernel_type': 'Matern', 'length_scale': 845.710697826929, 'noise_level': 0.03621921053273562, 'constant_value': 1010.0172946440947, 'nu': 1.5}. Best is trial 750 with value: 0.13435342446039877.
[I 2024-12-04 15:14:01,193] Trial 1168 finished with value: 0.1343547834659663 and parameters: {'kernel_type': 'Matern', 'length_scale': 634.0697160997288, 'noise_level': 0.022263680096968226, 'constant_value': 1145.7505256646832, 'nu': 1.5}. Best is trial 750 with value: 0.13435342446039877.
[I 2024-12-04 15:14:03,498] Trial 1160 finished with value: 0.13435440589532366 and parameters: {'kernel_type': 'Matern', 'length_scale': 0.11382009701707169, 'noise_level': 0.0001298290386553987, 'constant_value': 769.2933134140816, 'nu': 1.5}. Best is trial 750 with value: 0.13435342446039877.
[I 2024-12-04 15:14:03,743] Trial 1167 finished with value: 0.17251029983716182 and parameters: {'kernel_type': 'Matern', 'length_scale': 407.87093174611573, 'noise_level': 0.016567154066618947, 'constant_value': 2165.610841558233, 'nu': 0.5}. Best is trial 750 with value: 0.13435342446039877.
[I 2024-12-04 15:14:05,926] Trial 1161 finished with value: 0.13435440373527738 and parameters: {'kernel_type': 'Matern', 'length_scale': 2.045417613338689, 'noise_level': 0.02416713093744168, 'constant_value': 94977.94270908224, 'nu': 1.5}. Best is trial 750 with value: 0.13435342446039877.
[I 2024-12-04 15:14:06,223] Trial 1170 finished with value: 0.1343543381594949 and parameters: {'kernel_type': 'Matern', 'length_scale': 19.93553695144383, 'noise_level': 7.570809619028325e-06, 'constant_value': 3.338730993690132, 'nu': 1.5}. Best is trial 750 with value: 0.13435342446039877.
[I 2024-12-04 15:14:06,392] Trial 1153 finished with value: 0.1343544245768583 and parameters: {'kernel_type': 'Matern', 'length_scale': 0.18908529683538938, 'noise_level': 0.05416711234940899, 'constant_value': 1945.5443599145437, 'nu': 1.5}. Best is trial 750 with value: 0.13435342446039877.
[I 2024-12-04 15:14:06,786] Trial 1163 finished with value: 0.13435408651386896 and parameters: {'kernel_type': 'Matern', 'length_scale': 4.061514164652142, 'noise_level': 0.04203773572751716, 'constant_value': 409.99814030902775, 'nu': 1.5}. Best is trial 750 with value: 0.13435342446039877.
[I 2024-12-04 15:14:06,901] Trial 1171 finished with value: 0.13435439268991967 and parameters: {'kernel_type': 'Matern', 'length_scale': 2.1049684572353, 'noise_level': 0.010677188229345333, 'constant_value': 723.1918073929457, 'nu': 1.5}. Best is trial 750 with value: 0.13435342446039877.
[I 2024-12-04 15:14:07,119] Trial 1172 finished with value: 0.15167298251751324 and parameters: {'kernel_type': 'RBF', 'length_scale': 64.6524255777806, 'noise_level': 0.0010224577604623667, 'constant_value': 87713.22891985829, 'nu': 1.5}. Best is trial 750 with value: 0.13435342446039877.
[I 2024-12-04 15:14:08,714] Trial 1175 finished with value: 0.172510399500766 and parameters: {'kernel_type': 'Matern', 'length_scale': 0.9215332513176732, 'noise_level': 0.010753081524549285, 'constant_value': 355.3012034504257, 'nu': 0.5}. Best is trial 750 with value: 0.13435342446039877.
[I 2024-12-04 15:14:12,749] Trial 1166 finished with value: 0.13435463265913586 and parameters: {'kernel_type': 'Matern', 'length_scale': 2.892786460594251, 'noise_level': 0.0005962454690250561, 'constant_value': 896.262315415081, 'nu': 1.5}. Best is trial 750 with value: 0.13435342446039877.
[I 2024-12-04 15:14:12,817] Trial 1181 finished with value: 0.13435440591324535 and parameters: {'kernel_type': 'Matern', 'length_scale': 0.5196512497968748, 'noise_level': 0.001365820199139396, 'constant_value': 5337.224751626917, 'nu': 1.5}. Best is trial 750 with value: 0.13435342446039877.
[I 2024-12-04 15:14:16,190] Trial 1177 finished with value: 1.2693635028597325 and parameters: {'kernel_type': 'Matern', 'length_scale': 8.513623431782287e-05, 'noise_level': 0.47045320365772464, 'constant_value': 0.001788888084051601, 'nu': 0.5}. Best is trial 750 with value: 0.13435342446039877.
[I 2024-12-04 15:14:16,331] Trial 1176 finished with value: 0.1343543320908017 and parameters: {'kernel_type': 'Matern', 'length_scale': 4.838074585595924, 'noise_level': 0.00020520212759946984, 'constant_value': 214.82631722842638, 'nu': 1.5}. Best is trial 750 with value: 0.13435342446039877.
[I 2024-12-04 15:14:17,953] Trial 1178 finished with value: 1.2693635028576695 and parameters: {'kernel_type': 'RBF', 'length_scale': 4.0078244652664906e-05, 'noise_level': 2.0170974703560083e-05, 'constant_value': 0.0002702134817892305, 'nu': 0.5}. Best is trial 750 with value: 0.13435342446039877.
[I 2024-12-04 15:14:19,455] Trial 1182 finished with value: 1.2693635028567085 and parameters: {'kernel_type': 'Matern', 'length_scale': 0.006845215568719188, 'noise_level': 0.011211168642497169, 'constant_value': 399.1700242918122, 'nu': 1.5}. Best is trial 750 with value: 0.13435342446039877.
[I 2024-12-04 15:14:20,748] Trial 1165 finished with value: 0.1343544477675015 and parameters: {'kernel_type': 'Matern', 'length_scale': 0.7690636428979157, 'noise_level': 0.0086933646187569, 'constant_value': 17.82657028883804, 'nu': 1.5}. Best is trial 750 with value: 0.13435342446039877.
[I 2024-12-04 15:14:21,205] Trial 1183 finished with value: 1.300774596277452 and parameters: {'kernel_type': 'RBF', 'length_scale': 6815.382654042268, 'noise_level': 0.4092042607039005, 'constant_value': 0.6454061815139085, 'nu': 1.5}. Best is trial 750 with value: 0.13435342446039877.
[I 2024-12-04 15:14:22,406] Trial 1173 finished with value: 0.14859828760611213 and parameters: {'kernel_type': 'Matern', 'length_scale': 1.3030623818793272, 'noise_level': 0.00321571648879507, 'constant_value': 522.2907310227821, 'nu': 2.5}. Best is trial 750 with value: 0.13435342446039877.
[I 2024-12-04 15:14:23,187] Trial 1179 finished with value: 0.13435430575581508 and parameters: {'kernel_type': 'Matern', 'length_scale': 0.29736569115514916, 'noise_level': 0.7913508463260788, 'constant_value': 12.610852020370768, 'nu': 1.5}. Best is trial 750 with value: 0.13435342446039877.
[I 2024-12-04 15:14:23,203] Trial 1184 finished with value: 1.269363502856961 and parameters: {'kernel_type': 'RBF', 'length_scale': 5.4171667909668945e-05, 'noise_level': 1.4438221041335016e-10, 'constant_value': 0.000284211500750126, 'nu': 0.5}. Best is trial 750 with value: 0.13435342446039877.
[I 2024-12-04 15:14:24,111] Trial 1186 finished with value: 0.13435431529863126 and parameters: {'kernel_type': 'Matern', 'length_scale': 1.2417154046031986, 'noise_level': 0.0948533987834693, 'constant_value': 2401.843662054902, 'nu': 1.5}. Best is trial 750 with value: 0.13435342446039877.
[I 2024-12-04 15:14:24,138] Trial 1188 finished with value: 0.1343544081196528 and parameters: {'kernel_type': 'Matern', 'length_scale': 3.496104984793841, 'noise_level': 0.48866305379429176, 'constant_value': 58.59990025446124, 'nu': 1.5}. Best is trial 750 with value: 0.13435342446039877.
[I 2024-12-04 15:14:24,171] Trial 1189 finished with value: 0.1343543961875199 and parameters: {'kernel_type': 'Matern', 'length_scale': 3.8029801542668977, 'noise_level': 0.1846743265770131, 'constant_value': 0.948162553672848, 'nu': 1.5}. Best is trial 750 with value: 0.13435342446039877.
[I 2024-12-04 15:14:24,665] Trial 1191 finished with value: 0.13435439971715163 and parameters: {'kernel_type': 'Matern', 'length_scale': 0.5730666005071157, 'noise_level': 0.16894865830398823, 'constant_value': 1485.6713938490223, 'nu': 1.5}. Best is trial 750 with value: 0.13435342446039877.
[I 2024-12-04 15:14:25,760] Trial 1190 finished with value: 0.13435437759442326 and parameters: {'kernel_type': 'Matern', 'length_scale': 10.953741882257983, 'noise_level': 0.05945580163086971, 'constant_value': 193.49188808434263, 'nu': 1.5}. Best is trial 750 with value: 0.13435342446039877.
[I 2024-12-04 15:14:26,239] Trial 1185 finished with value: 0.13435437889681026 and parameters: {'kernel_type': 'Matern', 'length_scale': 13.221009318087539, 'noise_level': 0.04345386218423715, 'constant_value': 906.6772472518194, 'nu': 1.5}. Best is trial 750 with value: 0.13435342446039877.
