[I 2024-12-04 12:26:35,030] Trial 391 finished with value: 0.4116090241115497 and parameters: {'n_estimators': 1485, 'learning_rate': 0.07440326962583775, 'max_depth': 9, 'min_samples_split': 3, 'min_samples_leaf': 5, 'subsample': 0.6595871205401358, 'max_features': 'sqrt'}. Best is trial 360 with value: 0.2288165351387474.
[I 2024-12-04 12:26:35,107] Trial 392 finished with value: 0.2649347775993685 and parameters: {'n_estimators': 1463, 'learning_rate': 0.04011384581878264, 'max_depth': 9, 'min_samples_split': 3, 'min_samples_leaf': 1, 'subsample': 0.7657759428186214, 'max_features': 'sqrt'}. Best is trial 360 with value: 0.2288165351387474.
[I 2024-12-04 12:26:36,525] Trial 405 finished with value: 0.46281424582683844 and parameters: {'n_estimators': 947, 'learning_rate': 0.05278036974021647, 'max_depth': 7, 'min_samples_split': 19, 'min_samples_leaf': 8, 'subsample': 0.6214120753301682, 'max_features': 'sqrt'}. Best is trial 360 with value: 0.2288165351387474.
[I 2024-12-04 12:26:39,987] Trial 409 finished with value: 0.47420596122309444 and parameters: {'n_estimators': 805, 'learning_rate': 0.04298532180159751, 'max_depth': 3, 'min_samples_split': 16, 'min_samples_leaf': 10, 'subsample': 0.864337054236128, 'max_features': None}. Best is trial 360 with value: 0.2288165351387474.
[I 2024-12-04 12:26:41,102] Trial 400 finished with value: 0.24012002685488631 and parameters: {'n_estimators': 1249, 'learning_rate': 0.06666669037754248, 'max_depth': 10, 'min_samples_split': 4, 'min_samples_leaf': 1, 'subsample': 0.650768948581112, 'max_features': 'sqrt'}. Best is trial 360 with value: 0.2288165351387474.
[I 2024-12-04 12:26:41,132] Trial 419 finished with value: 0.2432550208820009 and parameters: {'n_estimators': 545, 'learning_rate': 0.08212822398995215, 'max_depth': 8, 'min_samples_split': 4, 'min_samples_leaf': 1, 'subsample': 0.6824572144008912, 'max_features': 'sqrt'}. Best is trial 360 with value: 0.2288165351387474.
[I 2024-12-04 12:26:43,006] Trial 398 finished with value: 0.25686449336787626 and parameters: {'n_estimators': 1379, 'learning_rate': 0.08167793879899297, 'max_depth': 10, 'min_samples_split': 9, 'min_samples_leaf': 1, 'subsample': 0.6978378470252374, 'max_features': 'sqrt'}. Best is trial 360 with value: 0.2288165351387474.
[I 2024-12-04 12:26:45,747] Trial 408 finished with value: 0.24553170596765092 and parameters: {'n_estimators': 1004, 'learning_rate': 0.05260279562609945, 'max_depth': 9, 'min_samples_split': 3, 'min_samples_leaf': 1, 'subsample': 0.8023272141347122, 'max_features': 'sqrt'}. Best is trial 360 with value: 0.2288165351387474.
[I 2024-12-04 12:26:47,962] Trial 435 finished with value: 0.455121284807672 and parameters: {'n_estimators': 121, 'learning_rate': 0.02572140664454893, 'max_depth': 9, 'min_samples_split': 8, 'min_samples_leaf': 5, 'subsample': 0.642385956034039, 'max_features': None}. Best is trial 360 with value: 0.2288165351387474.
[I 2024-12-04 12:26:48,317] Trial 424 finished with value: 0.4876983438579797 and parameters: {'n_estimators': 451, 'learning_rate': 0.08607243249370565, 'max_depth': 7, 'min_samples_split': 16, 'min_samples_leaf': 9, 'subsample': 0.8330532446814561, 'max_features': None}. Best is trial 360 with value: 0.2288165351387474.
[I 2024-12-04 12:26:49,364] Trial 402 finished with value: 0.25185467876673995 and parameters: {'n_estimators': 1263, 'learning_rate': 0.0517881239485542, 'max_depth': 8, 'min_samples_split': 2, 'min_samples_leaf': 1, 'subsample': 0.7315406488647807, 'max_features': 'sqrt'}. Best is trial 360 with value: 0.2288165351387474.
[I 2024-12-04 12:26:50,449] Trial 401 finished with value: 0.24859735201208275 and parameters: {'n_estimators': 1367, 'learning_rate': 0.045369326025858664, 'max_depth': 9, 'min_samples_split': 5, 'min_samples_leaf': 1, 'subsample': 0.6868986277425373, 'max_features': 'sqrt'}. Best is trial 360 with value: 0.2288165351387474.
[I 2024-12-04 12:26:51,554] Trial 414 finished with value: 0.2923041132201171 and parameters: {'n_estimators': 946, 'learning_rate': 0.08182093772670655, 'max_depth': 7, 'min_samples_split': 3, 'min_samples_leaf': 2, 'subsample': 0.7129843227457774, 'max_features': 'sqrt'}. Best is trial 360 with value: 0.2288165351387474.
[I 2024-12-04 12:26:56,875] Trial 441 finished with value: 0.7084455729578035 and parameters: {'n_estimators': 106, 'learning_rate': 0.05031055298216716, 'max_depth': 7, 'min_samples_split': 20, 'min_samples_leaf': 10, 'subsample': 0.9952982496581156, 'max_features': 'sqrt'}. Best is trial 360 with value: 0.2288165351387474.
[I 2024-12-04 12:26:57,867] Trial 434 finished with value: 0.36146133605644426 and parameters: {'n_estimators': 310, 'learning_rate': 0.046339847448481186, 'max_depth': 8, 'min_samples_split': 3, 'min_samples_leaf': 1, 'subsample': 0.7454058436616287, 'max_features': None}. Best is trial 360 with value: 0.2288165351387474.
[I 2024-12-04 12:26:59,328] Trial 415 finished with value: 0.2463735955121879 and parameters: {'n_estimators': 1026, 'learning_rate': 0.06486600161721072, 'max_depth': 8, 'min_samples_split': 4, 'min_samples_leaf': 1, 'subsample': 0.6861365673060523, 'max_features': 'sqrt'}. Best is trial 360 with value: 0.2288165351387474.
[I 2024-12-04 12:27:01,670] Trial 413 finished with value: 0.267660814357649 and parameters: {'n_estimators': 1085, 'learning_rate': 0.035300028708991314, 'max_depth': 9, 'min_samples_split': 9, 'min_samples_leaf': 1, 'subsample': 0.8882042872953742, 'max_features': 'sqrt'}. Best is trial 360 with value: 0.2288165351387474.
[I 2024-12-04 12:27:03,232] Trial 423 finished with value: 0.2969218419278226 and parameters: {'n_estimators': 805, 'learning_rate': 0.03231342589850138, 'max_depth': 6, 'min_samples_split': 2, 'min_samples_leaf': 1, 'subsample': 0.7497895211728384, 'max_features': 'sqrt'}. Best is trial 360 with value: 0.2288165351387474.
[I 2024-12-04 12:27:07,311] Trial 420 finished with value: 0.8396835900585512 and parameters: {'n_estimators': 1003, 'learning_rate': 0.02900165248479418, 'max_depth': 5, 'min_samples_split': 19, 'min_samples_leaf': 7, 'subsample': 0.6548158807783252, 'max_features': 'log2'}. Best is trial 360 with value: 0.2288165351387474.
[I 2024-12-04 12:27:09,119] Trial 438 finished with value: 0.26287969808120304 and parameters: {'n_estimators': 406, 'learning_rate': 0.08707241513043945, 'max_depth': 7, 'min_samples_split': 4, 'min_samples_leaf': 1, 'subsample': 0.7041493873299279, 'max_features': 'sqrt'}. Best is trial 360 with value: 0.2288165351387474.
[I 2024-12-04 12:27:09,374] Trial 410 finished with value: 0.2464007901025929 and parameters: {'n_estimators': 1317, 'learning_rate': 0.06659792152468556, 'max_depth': 9, 'min_samples_split': 4, 'min_samples_leaf': 1, 'subsample': 0.6286830384869413, 'max_features': 'log2'}. Best is trial 360 with value: 0.2288165351387474.
[I 2024-12-04 12:27:09,841] Trial 412 finished with value: 0.25877885639707204 and parameters: {'n_estimators': 1352, 'learning_rate': 0.06905217268484838, 'max_depth': 7, 'min_samples_split': 7, 'min_samples_leaf': 1, 'subsample': 0.6609929699903474, 'max_features': 'sqrt'}. Best is trial 360 with value: 0.2288165351387474.
[I 2024-12-04 12:27:11,653] Trial 440 finished with value: 0.2759763734385863 and parameters: {'n_estimators': 405, 'learning_rate': 0.0968839326519806, 'max_depth': 10, 'min_samples_split': 5, 'min_samples_leaf': 1, 'subsample': 0.6266547281066795, 'max_features': 'sqrt'}. Best is trial 360 with value: 0.2288165351387474.
[I 2024-12-04 12:27:13,439] Trial 437 finished with value: 0.28381936634864735 and parameters: {'n_estimators': 532, 'learning_rate': 0.0382742432216206, 'max_depth': 8, 'min_samples_split': 7, 'min_samples_leaf': 1, 'subsample': 0.6215441760135181, 'max_features': 'sqrt'}. Best is trial 360 with value: 0.2288165351387474.
[I 2024-12-04 12:27:19,822] Trial 418 finished with value: 0.42181226482131 and parameters: {'n_estimators': 1299, 'learning_rate': 0.06938552389244126, 'max_depth': 6, 'min_samples_split': 10, 'min_samples_leaf': 6, 'subsample': 0.6285891207421452, 'max_features': 'log2'}. Best is trial 360 with value: 0.2288165351387474.
[I 2024-12-04 12:27:20,302] Trial 431 finished with value: 0.8203790539028085 and parameters: {'n_estimators': 877, 'learning_rate': 0.03532597017993879, 'max_depth': 10, 'min_samples_split': 6, 'min_samples_leaf': 10, 'subsample': 0.9463829775667872, 'max_features': 'log2'}. Best is trial 360 with value: 0.2288165351387474.
[I 2024-12-04 12:27:22,060] Trial 416 finished with value: 0.24608147865617938 and parameters: {'n_estimators': 1441, 'learning_rate': 0.05716924102564304, 'max_depth': 6, 'min_samples_split': 3, 'min_samples_leaf': 1, 'subsample': 0.6831816702315394, 'max_features': 'sqrt'}. Best is trial 360 with value: 0.2288165351387474.
[I 2024-12-04 12:27:23,989] Trial 417 finished with value: 0.27398296518903587 and parameters: {'n_estimators': 1468, 'learning_rate': 0.07558595211302087, 'max_depth': 9, 'min_samples_split': 2, 'min_samples_leaf': 2, 'subsample': 0.8040277727320787, 'max_features': 'log2'}. Best is trial 360 with value: 0.2288165351387474.
[I 2024-12-04 12:27:25,324] Trial 422 finished with value: 0.26337145266358947 and parameters: {'n_estimators': 1278, 'learning_rate': 0.08906753593625423, 'max_depth': 6, 'min_samples_split': 2, 'min_samples_leaf': 1, 'subsample': 0.7800490882055554, 'max_features': 'sqrt'}. Best is trial 360 with value: 0.2288165351387474.
[I 2024-12-04 12:27:25,574] Trial 445 finished with value: 0.4692986263083559 and parameters: {'n_estimators': 456, 'learning_rate': 0.022742428742377547, 'max_depth': 3, 'min_samples_split': 6, 'min_samples_leaf': 9, 'subsample': 0.8492117023883059, 'max_features': None}. Best is trial 360 with value: 0.2288165351387474.
[I 2024-12-04 12:27:31,265] Trial 421 finished with value: 0.23538258422848843 and parameters: {'n_estimators': 1467, 'learning_rate': 0.06488587676201338, 'max_depth': 11, 'min_samples_split': 3, 'min_samples_leaf': 1, 'subsample': 0.6569340300224209, 'max_features': 'sqrt'}. Best is trial 360 with value: 0.2288165351387474.
[I 2024-12-04 12:27:33,025] Trial 425 finished with value: 0.2672728666651367 and parameters: {'n_estimators': 1352, 'learning_rate': 0.05859879029082465, 'max_depth': 7, 'min_samples_split': 2, 'min_samples_leaf': 1, 'subsample': 0.792378211319003, 'max_features': 'sqrt'}. Best is trial 360 with value: 0.2288165351387474.
[I 2024-12-04 12:27:34,233] Trial 458 finished with value: 0.46634646077855146 and parameters: {'n_estimators': 169, 'learning_rate': 0.060709727976085676, 'max_depth': 11, 'min_samples_split': 4, 'min_samples_leaf': 8, 'subsample': 0.7036676426170714, 'max_features': None}. Best is trial 360 with value: 0.2288165351387474.
[I 2024-12-04 12:27:36,789] Trial 439 finished with value: 0.25198791740041004 and parameters: {'n_estimators': 916, 'learning_rate': 0.037437150047451795, 'max_depth': 10, 'min_samples_split': 4, 'min_samples_leaf': 1, 'subsample': 0.7905885329167717, 'max_features': 'sqrt'}. Best is trial 360 with value: 0.2288165351387474.
[I 2024-12-04 12:27:37,739] Trial 432 finished with value: 0.2447587370632615 and parameters: {'n_estimators': 1166, 'learning_rate': 0.034827892094912084, 'max_depth': 11, 'min_samples_split': 2, 'min_samples_leaf': 1, 'subsample': 0.7083963801323035, 'max_features': 'sqrt'}. Best is trial 360 with value: 0.2288165351387474.
[I 2024-12-04 12:27:40,509] Trial 433 finished with value: 0.3378146503386669 and parameters: {'n_estimators': 1085, 'learning_rate': 0.0331291788096528, 'max_depth': 10, 'min_samples_split': 20, 'min_samples_leaf': 2, 'subsample': 0.9477489902902483, 'max_features': None}. Best is trial 360 with value: 0.2288165351387474.
[I 2024-12-04 12:27:41,529] Trial 428 finished with value: 0.3581784319419588 and parameters: {'n_estimators': 1377, 'learning_rate': 0.06997857029926127, 'max_depth': 10, 'min_samples_split': 6, 'min_samples_leaf': 3, 'subsample': 0.7399128587125573, 'max_features': 'sqrt'}. Best is trial 360 with value: 0.2288165351387474.
[I 2024-12-04 12:27:44,515] Trial 426 finished with value: 0.29313880243132906 and parameters: {'n_estimators': 1494, 'learning_rate': 0.017659236574487782, 'max_depth': 10, 'min_samples_split': 2, 'min_samples_leaf': 2, 'subsample': 0.6251794945693755, 'max_features': 'sqrt'}. Best is trial 360 with value: 0.2288165351387474.
[I 2024-12-04 12:27:44,553] Trial 429 finished with value: 0.2819935121102168 and parameters: {'n_estimators': 1378, 'learning_rate': 0.08558472437202976, 'max_depth': 12, 'min_samples_split': 7, 'min_samples_leaf': 1, 'subsample': 0.7552986857665386, 'max_features': 'sqrt'}. Best is trial 360 with value: 0.2288165351387474.
[I 2024-12-04 12:27:46,857] Trial 436 finished with value: 0.2629266445191507 and parameters: {'n_estimators': 1203, 'learning_rate': 0.06700452313469164, 'max_depth': 9, 'min_samples_split': 2, 'min_samples_leaf': 1, 'subsample': 0.7591007238615701, 'max_features': 'sqrt'}. Best is trial 360 with value: 0.2288165351387474.
[I 2024-12-04 12:27:48,161] Trial 430 finished with value: 0.34933501845461606 and parameters: {'n_estimators': 1439, 'learning_rate': 0.030472312219895575, 'max_depth': 7, 'min_samples_split': 3, 'min_samples_leaf': 2, 'subsample': 0.7454015641528952, 'max_features': 'log2'}. Best is trial 360 with value: 0.2288165351387474.
[I 2024-12-04 12:27:52,124] Trial 446 finished with value: 0.24532868376372363 and parameters: {'n_estimators': 970, 'learning_rate': 0.03752378808524749, 'max_depth': 8, 'min_samples_split': 3, 'min_samples_leaf': 1, 'subsample': 0.7941291840085669, 'max_features': 'sqrt'}. Best is trial 360 with value: 0.2288165351387474.
[I 2024-12-04 12:27:52,174] Trial 427 finished with value: 0.33518237335320866 and parameters: {'n_estimators': 1441, 'learning_rate': 0.06855271419597549, 'max_depth': 10, 'min_samples_split': 6, 'min_samples_leaf': 1, 'subsample': 0.7002646726226411, 'max_features': None}. Best is trial 360 with value: 0.2288165351387474.
[I 2024-12-04 12:27:57,129] Trial 443 finished with value: 0.25203962917655315 and parameters: {'n_estimators': 1149, 'learning_rate': 0.0892498359952676, 'max_depth': 10, 'min_samples_split': 5, 'min_samples_leaf': 1, 'subsample': 0.637070597254558, 'max_features': 'sqrt'}. Best is trial 360 with value: 0.2288165351387474.
[I 2024-12-04 12:28:00,947] Trial 454 finished with value: 0.3488588544531554 and parameters: {'n_estimators': 741, 'learning_rate': 0.06282658534094164, 'max_depth': 9, 'min_samples_split': 5, 'min_samples_leaf': 2, 'subsample': 0.6143547833816749, 'max_features': None}. Best is trial 360 with value: 0.2288165351387474.
[I 2024-12-04 12:28:13,332] Trial 447 finished with value: 0.550729912335968 and parameters: {'n_estimators': 1353, 'learning_rate': 0.0500714095672937, 'max_depth': 4, 'min_samples_split': 17, 'min_samples_leaf': 9, 'subsample': 0.8998551400558741, 'max_features': 'log2'}. Best is trial 360 with value: 0.2288165351387474.
[I 2024-12-04 12:28:14,903] Trial 442 finished with value: 0.36068388497068893 and parameters: {'n_estimators': 1484, 'learning_rate': 0.05860651629043757, 'max_depth': 6, 'min_samples_split': 2, 'min_samples_leaf': 4, 'subsample': 0.7316664981473644, 'max_features': 'sqrt'}. Best is trial 360 with value: 0.2288165351387474.
[I 2024-12-04 12:28:15,682] Trial 451 finished with value: 0.44091376222961304 and parameters: {'n_estimators': 1240, 'learning_rate': 0.01925677931565721, 'max_depth': 6, 'min_samples_split': 15, 'min_samples_leaf': 8, 'subsample': 0.8675892087094598, 'max_features': 'sqrt'}. Best is trial 360 with value: 0.2288165351387474.
[I 2024-12-04 12:28:18,577] Trial 449 finished with value: 0.295807924520639 and parameters: {'n_estimators': 1336, 'learning_rate': 0.06553301990228294, 'max_depth': 11, 'min_samples_split': 6, 'min_samples_leaf': 2, 'subsample': 0.6795303270025825, 'max_features': 'sqrt'}. Best is trial 360 with value: 0.2288165351387474.
[I 2024-12-04 12:28:18,958] Trial 444 finished with value: 0.23333332187606676 and parameters: {'n_estimators': 1480, 'learning_rate': 0.04868860011223499, 'max_depth': 8, 'min_samples_split': 2, 'min_samples_leaf': 1, 'subsample': 0.6158821564840281, 'max_features': 'sqrt'}. Best is trial 360 with value: 0.2288165351387474.
[I 2024-12-04 12:28:20,523] Trial 452 finished with value: 0.24997536335981474 and parameters: {'n_estimators': 1236, 'learning_rate': 0.06098970142323865, 'max_depth': 11, 'min_samples_split': 5, 'min_samples_leaf': 1, 'subsample': 0.6660211333294883, 'max_features': 'log2'}. Best is trial 360 with value: 0.2288165351387474.
[I 2024-12-04 12:28:22,930] Trial 453 finished with value: 0.2505028767312043 and parameters: {'n_estimators': 1160, 'learning_rate': 0.07576412565128848, 'max_depth': 8, 'min_samples_split': 7, 'min_samples_leaf': 1, 'subsample': 0.6279196380772173, 'max_features': 'sqrt'}. Best is trial 360 with value: 0.2288165351387474.
[I 2024-12-04 12:28:26,300] Trial 448 finished with value: 0.26313968198406684 and parameters: {'n_estimators': 1484, 'learning_rate': 0.08828969215182256, 'max_depth': 11, 'min_samples_split': 2, 'min_samples_leaf': 1, 'subsample': 0.7131667867628058, 'max_features': 'sqrt'}. Best is trial 360 with value: 0.2288165351387474.
[I 2024-12-04 12:28:28,514] Trial 455 finished with value: 0.23427503043440653 and parameters: {'n_estimators': 1275, 'learning_rate': 0.06021044992933102, 'max_depth': 12, 'min_samples_split': 5, 'min_samples_leaf': 1, 'subsample': 0.7197385422219567, 'max_features': 'sqrt'}. Best is trial 360 with value: 0.2288165351387474.
[I 2024-12-04 12:28:29,514] Trial 456 finished with value: 0.2974789355540002 and parameters: {'n_estimators': 1246, 'learning_rate': 0.047657030131706433, 'max_depth': 9, 'min_samples_split': 5, 'min_samples_leaf': 2, 'subsample': 0.6835996486760556, 'max_features': 'sqrt'}. Best is trial 360 with value: 0.2288165351387474.
[I 2024-12-04 12:28:30,455] Trial 450 finished with value: 0.2594686360196895 and parameters: {'n_estimators': 1484, 'learning_rate': 0.0398500118911931, 'max_depth': 8, 'min_samples_split': 2, 'min_samples_leaf': 1, 'subsample': 0.7079091542605351, 'max_features': 'sqrt'}. Best is trial 360 with value: 0.2288165351387474.
[I 2024-12-04 12:28:34,039] Trial 462 finished with value: 0.4801360689798299 and parameters: {'n_estimators': 1079, 'learning_rate': 0.021791777506233158, 'max_depth': 6, 'min_samples_split': 9, 'min_samples_leaf': 9, 'subsample': 0.636746233928255, 'max_features': None}. Best is trial 360 with value: 0.2288165351387474.
[I 2024-12-04 12:28:35,564] Trial 470 finished with value: 0.4708514161948876 and parameters: {'n_estimators': 915, 'learning_rate': 0.05466933045779893, 'max_depth': 7, 'min_samples_split': 2, 'min_samples_leaf': 5, 'subsample': 0.7131666322965584, 'max_features': 'log2'}. Best is trial 360 with value: 0.2288165351387474.
[I 2024-12-04 12:28:37,436] Trial 457 finished with value: 0.23515557903548967 and parameters: {'n_estimators': 1353, 'learning_rate': 0.04767174978278628, 'max_depth': 11, 'min_samples_split': 2, 'min_samples_leaf': 1, 'subsample': 0.7327200996996535, 'max_features': 'sqrt'}. Best is trial 360 with value: 0.2288165351387474.
[I 2024-12-04 12:28:38,643] Trial 471 finished with value: 0.606709973673367 and parameters: {'n_estimators': 866, 'learning_rate': 0.012828337905529561, 'max_depth': 3, 'min_samples_split': 9, 'min_samples_leaf': 4, 'subsample': 0.8331650470010642, 'max_features': 'sqrt'}. Best is trial 360 with value: 0.2288165351387474.
[I 2024-12-04 12:28:41,611] Trial 467 finished with value: 0.25619611270326736 and parameters: {'n_estimators': 1065, 'learning_rate': 0.03794515713029947, 'max_depth': 9, 'min_samples_split': 2, 'min_samples_leaf': 1, 'subsample': 0.6784361378166472, 'max_features': 'sqrt'}. Best is trial 360 with value: 0.2288165351387474.
[I 2024-12-04 12:28:41,693] Trial 468 finished with value: 0.35364581373672815 and parameters: {'n_estimators': 1079, 'learning_rate': 0.03773343065679053, 'max_depth': 6, 'min_samples_split': 5, 'min_samples_leaf': 3, 'subsample': 0.8223436169605153, 'max_features': 'sqrt'}. Best is trial 360 with value: 0.2288165351387474.
[I 2024-12-04 12:28:44,159] Trial 463 finished with value: 0.26376047317514995 and parameters: {'n_estimators': 1325, 'learning_rate': 0.08348407153003498, 'max_depth': 4, 'min_samples_split': 2, 'min_samples_leaf': 1, 'subsample': 0.6034659671959041, 'max_features': 'log2'}. Best is trial 360 with value: 0.2288165351387474.
[I 2024-12-04 12:28:47,319] Trial 459 finished with value: 0.486438927854028 and parameters: {'n_estimators': 1416, 'learning_rate': 0.058135676265109806, 'max_depth': 4, 'min_samples_split': 2, 'min_samples_leaf': 10, 'subsample': 0.6526243761617052, 'max_features': None}. Best is trial 360 with value: 0.2288165351387474.
[I 2024-12-04 12:28:48,823] Trial 460 finished with value: 0.2535224192688828 and parameters: {'n_estimators': 1452, 'learning_rate': 0.04536053365956581, 'max_depth': 5, 'min_samples_split': 4, 'min_samples_leaf': 1, 'subsample': 0.6876003423904977, 'max_features': 'sqrt'}. Best is trial 360 with value: 0.2288165351387474.
[I 2024-12-04 12:28:52,886] Trial 480 finished with value: 0.971120908520075 and parameters: {'n_estimators': 599, 'learning_rate': 0.043606339720003925, 'max_depth': 3, 'min_samples_split': 3, 'min_samples_leaf': 10, 'subsample': 0.6579805112964887, 'max_features': 'log2'}. Best is trial 360 with value: 0.2288165351387474.
[I 2024-12-04 12:28:54,061] Trial 477 finished with value: 0.3075986868972623 and parameters: {'n_estimators': 968, 'learning_rate': 0.03426726836201029, 'max_depth': 7, 'min_samples_split': 2, 'min_samples_leaf': 2, 'subsample': 0.8324516058817698, 'max_features': 'sqrt'}. Best is trial 360 with value: 0.2288165351387474.
