[I 2024-12-04 15:02:42,361] Trial 993 finished with value: 0.4889017369633769 and parameters: {'n_estimators': 1423, 'learning_rate': 0.0879595069679425, 'max_depth': 12, 'min_samples_split': 17, 'min_samples_leaf': 1, 'subsample': 0.9952947416597515, 'max_features': None}. Best is trial 603 with value: 0.45955205541891275.
[I 2024-12-04 15:02:44,537] Trial 997 finished with value: 0.4674055452145782 and parameters: {'n_estimators': 1405, 'learning_rate': 0.0716893199868719, 'max_depth': 12, 'min_samples_split': 18, 'min_samples_leaf': 1, 'subsample': 0.9833485474509247, 'max_features': None}. Best is trial 603 with value: 0.45955205541891275.
[I 2024-12-04 15:02:45,391] Trial 1003 finished with value: 0.5038432131968744 and parameters: {'n_estimators': 1111, 'learning_rate': 0.06208321946232992, 'max_depth': 12, 'min_samples_split': 16, 'min_samples_leaf': 1, 'subsample': 0.9520071481233501, 'max_features': None}. Best is trial 603 with value: 0.45955205541891275.
[I 2024-12-04 15:02:46,300] Trial 1017 finished with value: 0.678442979924667 and parameters: {'n_estimators': 699, 'learning_rate': 0.013729350174633103, 'max_depth': 6, 'min_samples_split': 3, 'min_samples_leaf': 6, 'subsample': 0.9506857827431738, 'max_features': 'sqrt'}. Best is trial 603 with value: 0.45955205541891275.
[I 2024-12-04 15:02:47,300] Trial 1009 finished with value: 0.467678411880266 and parameters: {'n_estimators': 1049, 'learning_rate': 0.05520340392570623, 'max_depth': 12, 'min_samples_split': 19, 'min_samples_leaf': 1, 'subsample': 0.9898866991754566, 'max_features': None}. Best is trial 603 with value: 0.45955205541891275.
[I 2024-12-04 15:02:48,008] Trial 1002 finished with value: 0.6317899365034707 and parameters: {'n_estimators': 1182, 'learning_rate': 0.06091993736728147, 'max_depth': 12, 'min_samples_split': 19, 'min_samples_leaf': 2, 'subsample': 0.9913870232373451, 'max_features': None}. Best is trial 603 with value: 0.45955205541891275.
[I 2024-12-04 15:02:50,765] Trial 1019 finished with value: 0.9393830575701752 and parameters: {'n_estimators': 773, 'learning_rate': 0.02839145519813894, 'max_depth': 8, 'min_samples_split': 3, 'min_samples_leaf': 10, 'subsample': 0.8103006022784778, 'max_features': 'log2'}. Best is trial 603 with value: 0.45955205541891275.
[I 2024-12-04 15:02:50,812] Trial 1012 finished with value: 0.6030273437512684 and parameters: {'n_estimators': 965, 'learning_rate': 0.04436464490427245, 'max_depth': 12, 'min_samples_split': 14, 'min_samples_leaf': 6, 'subsample': 0.9931688768862048, 'max_features': None}. Best is trial 603 with value: 0.45955205541891275.
[I 2024-12-04 15:02:53,648] Trial 1021 finished with value: 0.6138330904712231 and parameters: {'n_estimators': 630, 'learning_rate': 0.0665265331378783, 'max_depth': 10, 'min_samples_split': 19, 'min_samples_leaf': 3, 'subsample': 0.9988761996105436, 'max_features': None}. Best is trial 603 with value: 0.45955205541891275.
[I 2024-12-04 15:02:55,337] Trial 1005 finished with value: 0.4760475400730189 and parameters: {'n_estimators': 1429, 'learning_rate': 0.06628661098071881, 'max_depth': 12, 'min_samples_split': 19, 'min_samples_leaf': 1, 'subsample': 0.9833296830075939, 'max_features': None}. Best is trial 603 with value: 0.45955205541891275.
[I 2024-12-04 15:02:56,391] Trial 1011 finished with value: 0.7905897417827513 and parameters: {'n_estimators': 1459, 'learning_rate': 0.022391517868269265, 'max_depth': 12, 'min_samples_split': 5, 'min_samples_leaf': 10, 'subsample': 0.9690600311728248, 'max_features': 'sqrt'}. Best is trial 603 with value: 0.45955205541891275.
[I 2024-12-04 15:02:56,991] Trial 1004 finished with value: 0.6221248073111912 and parameters: {'n_estimators': 1491, 'learning_rate': 0.05059579160267085, 'max_depth': 12, 'min_samples_split': 20, 'min_samples_leaf': 2, 'subsample': 0.987539347828853, 'max_features': None}. Best is trial 603 with value: 0.45955205541891275.
[I 2024-12-04 15:02:57,362] Trial 1025 finished with value: 0.6939444989666274 and parameters: {'n_estimators': 794, 'learning_rate': 0.03262551788095886, 'max_depth': 10, 'min_samples_split': 9, 'min_samples_leaf': 6, 'subsample': 0.817945911178213, 'max_features': 'sqrt'}. Best is trial 603 with value: 0.45955205541891275.
[I 2024-12-04 15:02:59,134] Trial 1013 finished with value: 0.48339192355243066 and parameters: {'n_estimators': 1169, 'learning_rate': 0.036403519300203864, 'max_depth': 10, 'min_samples_split': 20, 'min_samples_leaf': 1, 'subsample': 0.9928013911496605, 'max_features': None}. Best is trial 603 with value: 0.45955205541891275.
[I 2024-12-04 15:03:00,450] Trial 1016 finished with value: 0.6211722676703735 and parameters: {'n_estimators': 1011, 'learning_rate': 0.04052538074690603, 'max_depth': 10, 'min_samples_split': 20, 'min_samples_leaf': 4, 'subsample': 0.9962500932408263, 'max_features': None}. Best is trial 603 with value: 0.45955205541891275.
[I 2024-12-04 15:03:01,531] Trial 1015 finished with value: 0.6377556028341315 and parameters: {'n_estimators': 1269, 'learning_rate': 0.058487979581391146, 'max_depth': 11, 'min_samples_split': 19, 'min_samples_leaf': 3, 'subsample': 0.9812812564032706, 'max_features': 'log2'}. Best is trial 603 with value: 0.45955205541891275.
[I 2024-12-04 15:03:03,997] Trial 1043 finished with value: 0.625627282525078 and parameters: {'n_estimators': 475, 'learning_rate': 0.07392327341185362, 'max_depth': 7, 'min_samples_split': 10, 'min_samples_leaf': 2, 'subsample': 0.7762888508695275, 'max_features': 'sqrt'}. Best is trial 603 with value: 0.45955205541891275.
[I 2024-12-04 15:03:10,124] Trial 1037 finished with value: 0.6903706994240333 and parameters: {'n_estimators': 939, 'learning_rate': 0.026046447122896405, 'max_depth': 9, 'min_samples_split': 19, 'min_samples_leaf': 8, 'subsample': 0.9604933974691306, 'max_features': 'sqrt'}. Best is trial 603 with value: 0.45955205541891275.
[I 2024-12-04 15:03:12,373] Trial 1028 finished with value: 0.5870137181620997 and parameters: {'n_estimators': 1327, 'learning_rate': 0.03839850988070755, 'max_depth': 9, 'min_samples_split': 18, 'min_samples_leaf': 1, 'subsample': 0.7418967373620514, 'max_features': 'log2'}. Best is trial 603 with value: 0.45955205541891275.
[I 2024-12-04 15:03:14,865] Trial 1032 finished with value: 0.646937923723018 and parameters: {'n_estimators': 1313, 'learning_rate': 0.036399259728078094, 'max_depth': 12, 'min_samples_split': 20, 'min_samples_leaf': 3, 'subsample': 0.99377709818722, 'max_features': 'sqrt'}. Best is trial 603 with value: 0.45955205541891275.
[I 2024-12-04 15:03:16,631] Trial 1018 finished with value: 0.4743283677303923 and parameters: {'n_estimators': 1487, 'learning_rate': 0.047062838046387535, 'max_depth': 12, 'min_samples_split': 20, 'min_samples_leaf': 1, 'subsample': 0.8795306739141941, 'max_features': None}. Best is trial 603 with value: 0.45955205541891275.
[I 2024-12-04 15:03:16,865] Trial 1027 finished with value: 0.63180752215249 and parameters: {'n_estimators': 1467, 'learning_rate': 0.053251208109565136, 'max_depth': 3, 'min_samples_split': 20, 'min_samples_leaf': 3, 'subsample': 0.969965197011314, 'max_features': None}. Best is trial 603 with value: 0.45955205541891275.
[I 2024-12-04 15:03:17,889] Trial 1024 finished with value: 0.47294665178423356 and parameters: {'n_estimators': 1331, 'learning_rate': 0.033133779751819845, 'max_depth': 12, 'min_samples_split': 20, 'min_samples_leaf': 1, 'subsample': 0.971401412682161, 'max_features': None}. Best is trial 603 with value: 0.45955205541891275.
[I 2024-12-04 15:03:18,761] Trial 1030 finished with value: 0.6498052148729073 and parameters: {'n_estimators': 1254, 'learning_rate': 0.08483875003862973, 'max_depth': 12, 'min_samples_split': 17, 'min_samples_leaf': 3, 'subsample': 0.9612409724499269, 'max_features': None}. Best is trial 603 with value: 0.45955205541891275.
[I 2024-12-04 15:03:19,687] Trial 1023 finished with value: 0.775333680619261 and parameters: {'n_estimators': 1455, 'learning_rate': 0.09469766849647722, 'max_depth': 8, 'min_samples_split': 8, 'min_samples_leaf': 2, 'subsample': 0.9884075783666966, 'max_features': None}. Best is trial 603 with value: 0.45955205541891275.
[I 2024-12-04 15:03:19,723] Trial 1020 finished with value: 0.6337776677287953 and parameters: {'n_estimators': 1500, 'learning_rate': 0.050616877249340435, 'max_depth': 12, 'min_samples_split': 20, 'min_samples_leaf': 2, 'subsample': 0.9936758479298153, 'max_features': None}. Best is trial 603 with value: 0.45955205541891275.
[I 2024-12-04 15:03:19,726] Trial 1031 finished with value: 0.5283438359689504 and parameters: {'n_estimators': 1237, 'learning_rate': 0.09924748928199534, 'max_depth': 11, 'min_samples_split': 14, 'min_samples_leaf': 1, 'subsample': 0.9525234979856326, 'max_features': None}. Best is trial 603 with value: 0.45955205541891275.
[I 2024-12-04 15:03:22,122] Trial 1035 finished with value: 0.5316090660584974 and parameters: {'n_estimators': 1450, 'learning_rate': 0.048386760637852994, 'max_depth': 12, 'min_samples_split': 18, 'min_samples_leaf': 1, 'subsample': 0.9720796463187306, 'max_features': 'sqrt'}. Best is trial 603 with value: 0.45955205541891275.
[I 2024-12-04 15:03:22,906] Trial 1026 finished with value: 0.4961669952658206 and parameters: {'n_estimators': 1411, 'learning_rate': 0.051786009436227604, 'max_depth': 12, 'min_samples_split': 17, 'min_samples_leaf': 1, 'subsample': 0.9977720622277563, 'max_features': None}. Best is trial 603 with value: 0.45955205541891275.
[I 2024-12-04 15:03:23,904] Trial 1033 finished with value: 0.4859233204580293 and parameters: {'n_estimators': 1275, 'learning_rate': 0.09552938473381561, 'max_depth': 12, 'min_samples_split': 18, 'min_samples_leaf': 1, 'subsample': 0.9488300618582725, 'max_features': None}. Best is trial 603 with value: 0.45955205541891275.
[I 2024-12-04 15:03:25,313] Trial 1058 finished with value: 1.1478093342544955 and parameters: {'n_estimators': 205, 'learning_rate': 0.016943548523002647, 'max_depth': 6, 'min_samples_split': 12, 'min_samples_leaf': 10, 'subsample': 0.6060803849526036, 'max_features': 'sqrt'}. Best is trial 603 with value: 0.45955205541891275.
[I 2024-12-04 15:03:26,485] Trial 1038 finished with value: 0.47245491897531344 and parameters: {'n_estimators': 1222, 'learning_rate': 0.043478400004717775, 'max_depth': 12, 'min_samples_split': 20, 'min_samples_leaf': 1, 'subsample': 0.993001538860561, 'max_features': None}. Best is trial 603 with value: 0.45955205541891275.
[I 2024-12-04 15:03:26,537] Trial 1029 finished with value: 0.46947667942433713 and parameters: {'n_estimators': 1449, 'learning_rate': 0.05656894256629362, 'max_depth': 12, 'min_samples_split': 20, 'min_samples_leaf': 1, 'subsample': 0.979515890281263, 'max_features': None}. Best is trial 603 with value: 0.45955205541891275.
[I 2024-12-04 15:03:27,624] Trial 1034 finished with value: 0.49820933669660245 and parameters: {'n_estimators': 1400, 'learning_rate': 0.08484164799184042, 'max_depth': 10, 'min_samples_split': 20, 'min_samples_leaf': 1, 'subsample': 0.8862094627181047, 'max_features': None}. Best is trial 603 with value: 0.45955205541891275.
[I 2024-12-04 15:03:29,991] Trial 1040 finished with value: 0.6307946629065935 and parameters: {'n_estimators': 1366, 'learning_rate': 0.0745681082266573, 'max_depth': 12, 'min_samples_split': 20, 'min_samples_leaf': 4, 'subsample': 0.855557233670027, 'max_features': None}. Best is trial 603 with value: 0.45955205541891275.
[I 2024-12-04 15:03:30,575] Trial 1041 finished with value: 0.64171036554978 and parameters: {'n_estimators': 1295, 'learning_rate': 0.035054715404937035, 'max_depth': 9, 'min_samples_split': 20, 'min_samples_leaf': 2, 'subsample': 0.9342399653721246, 'max_features': None}. Best is trial 603 with value: 0.45955205541891275.
[I 2024-12-04 15:03:32,578] Trial 1046 finished with value: 0.46903310295057 and parameters: {'n_estimators': 1120, 'learning_rate': 0.056311551526010785, 'max_depth': 12, 'min_samples_split': 20, 'min_samples_leaf': 1, 'subsample': 0.9848757035121533, 'max_features': None}. Best is trial 603 with value: 0.45955205541891275.
[I 2024-12-04 15:03:33,083] Trial 1044 finished with value: 0.6688835795422127 and parameters: {'n_estimators': 1298, 'learning_rate': 0.05706011220531363, 'max_depth': 9, 'min_samples_split': 19, 'min_samples_leaf': 3, 'subsample': 0.9371539248018317, 'max_features': None}. Best is trial 603 with value: 0.45955205541891275.
[I 2024-12-04 15:03:33,483] Trial 1049 finished with value: 0.4819247116725849 and parameters: {'n_estimators': 1019, 'learning_rate': 0.03759793193323388, 'max_depth': 12, 'min_samples_split': 17, 'min_samples_leaf': 1, 'subsample': 0.9904200420069519, 'max_features': None}. Best is trial 603 with value: 0.45955205541891275.
[I 2024-12-04 15:03:34,658] Trial 1042 finished with value: 0.634373362574203 and parameters: {'n_estimators': 1345, 'learning_rate': 0.08223880768031588, 'max_depth': 12, 'min_samples_split': 20, 'min_samples_leaf': 2, 'subsample': 0.9983921702969257, 'max_features': None}. Best is trial 603 with value: 0.45955205541891275.
[I 2024-12-04 15:03:35,442] Trial 1039 finished with value: 0.6614644303138859 and parameters: {'n_estimators': 1432, 'learning_rate': 0.054987319174854284, 'max_depth': 10, 'min_samples_split': 16, 'min_samples_leaf': 3, 'subsample': 0.9877758484640212, 'max_features': None}. Best is trial 603 with value: 0.45955205541891275.
[I 2024-12-04 15:03:35,567] Trial 1048 finished with value: 0.5036666918701815 and parameters: {'n_estimators': 1083, 'learning_rate': 0.04056364591435676, 'max_depth': 12, 'min_samples_split': 15, 'min_samples_leaf': 1, 'subsample': 0.9808645862349088, 'max_features': None}. Best is trial 603 with value: 0.45955205541891275.
[I 2024-12-04 15:03:36,220] Trial 1036 finished with value: 0.4694427240513238 and parameters: {'n_estimators': 1491, 'learning_rate': 0.050174803777407934, 'max_depth': 12, 'min_samples_split': 20, 'min_samples_leaf': 1, 'subsample': 0.9444188039076854, 'max_features': None}. Best is trial 603 with value: 0.45955205541891275.
[I 2024-12-04 15:03:38,959] Trial 1074 finished with value: 0.6642534407950264 and parameters: {'n_estimators': 112, 'learning_rate': 0.010272780040362067, 'max_depth': 8, 'min_samples_split': 16, 'min_samples_leaf': 2, 'subsample': 0.8391963557244151, 'max_features': None}. Best is trial 603 with value: 0.45955205541891275.
[I 2024-12-04 15:03:40,440] Trial 1053 finished with value: 0.4994560268975747 and parameters: {'n_estimators': 1133, 'learning_rate': 0.06084598687880496, 'max_depth': 11, 'min_samples_split': 17, 'min_samples_leaf': 1, 'subsample': 0.92637455065651, 'max_features': None}. Best is trial 603 with value: 0.45955205541891275.
[I 2024-12-04 15:03:41,527] Trial 1051 finished with value: 0.6509093257140088 and parameters: {'n_estimators': 1270, 'learning_rate': 0.04011908289606384, 'max_depth': 12, 'min_samples_split': 16, 'min_samples_leaf': 3, 'subsample': 0.898744104625561, 'max_features': None}. Best is trial 603 with value: 0.45955205541891275.
[I 2024-12-04 15:03:42,744] Trial 1045 finished with value: 0.5045811386256078 and parameters: {'n_estimators': 1486, 'learning_rate': 0.06180310693766627, 'max_depth': 10, 'min_samples_split': 19, 'min_samples_leaf': 1, 'subsample': 0.9981825137869079, 'max_features': None}. Best is trial 603 with value: 0.45955205541891275.
[I 2024-12-04 15:03:43,915] Trial 1052 finished with value: 0.47795541286849963 and parameters: {'n_estimators': 1306, 'learning_rate': 0.06858066328736956, 'max_depth': 9, 'min_samples_split': 18, 'min_samples_leaf': 1, 'subsample': 0.9192334557640157, 'max_features': None}. Best is trial 603 with value: 0.45955205541891275.
[I 2024-12-04 15:03:45,006] Trial 1081 finished with value: 0.5973585255307311 and parameters: {'n_estimators': 124, 'learning_rate': 0.03293929262011624, 'max_depth': 4, 'min_samples_split': 14, 'min_samples_leaf': 8, 'subsample': 0.9417235045088715, 'max_features': None}. Best is trial 603 with value: 0.45955205541891275.
[I 2024-12-04 15:03:45,051] Trial 1047 finished with value: 0.6471710858797275 and parameters: {'n_estimators': 1449, 'learning_rate': 0.08216695687786499, 'max_depth': 11, 'min_samples_split': 19, 'min_samples_leaf': 4, 'subsample': 0.9998375043879723, 'max_features': None}. Best is trial 603 with value: 0.45955205541891275.
[I 2024-12-04 15:03:46,045] Trial 1050 finished with value: 0.5071409026292356 and parameters: {'n_estimators': 1418, 'learning_rate': 0.07855761539967795, 'max_depth': 10, 'min_samples_split': 16, 'min_samples_leaf': 1, 'subsample': 0.8909312770201562, 'max_features': None}. Best is trial 603 with value: 0.45955205541891275.
[I 2024-12-04 15:03:50,465] Trial 1054 finished with value: 0.468994483284356 and parameters: {'n_estimators': 1382, 'learning_rate': 0.08130460042595176, 'max_depth': 11, 'min_samples_split': 20, 'min_samples_leaf': 1, 'subsample': 0.9115231968773764, 'max_features': None}. Best is trial 603 with value: 0.45955205541891275.
[I 2024-12-04 15:03:51,031] Trial 1066 finished with value: 0.7690776450478477 and parameters: {'n_estimators': 952, 'learning_rate': 0.036075314643561375, 'max_depth': 4, 'min_samples_split': 2, 'min_samples_leaf': 6, 'subsample': 0.6513990598170923, 'max_features': 'log2'}. Best is trial 603 with value: 0.45955205541891275.
[I 2024-12-04 15:03:55,487] Trial 1086 finished with value: 0.9727919372810858 and parameters: {'n_estimators': 350, 'learning_rate': 0.030284672834629826, 'max_depth': 12, 'min_samples_split': 15, 'min_samples_leaf': 10, 'subsample': 0.8628640483656262, 'max_features': 'log2'}. Best is trial 603 with value: 0.45955205541891275.
[I 2024-12-04 15:03:56,526] Trial 1067 finished with value: 0.7077561266223467 and parameters: {'n_estimators': 1053, 'learning_rate': 0.013742333380513635, 'max_depth': 3, 'min_samples_split': 14, 'min_samples_leaf': 9, 'subsample': 0.913739246129081, 'max_features': None}. Best is trial 603 with value: 0.45955205541891275.
[I 2024-12-04 15:03:58,092] Trial 1059 finished with value: 0.6576982154116127 and parameters: {'n_estimators': 1411, 'learning_rate': 0.05519840555995045, 'max_depth': 12, 'min_samples_split': 13, 'min_samples_leaf': 3, 'subsample': 0.9660334700019441, 'max_features': 'log2'}. Best is trial 603 with value: 0.45955205541891275.
[I 2024-12-04 15:03:58,543] Trial 1060 finished with value: 0.6822845537976062 and parameters: {'n_estimators': 1390, 'learning_rate': 0.09155755972487387, 'max_depth': 11, 'min_samples_split': 18, 'min_samples_leaf': 2, 'subsample': 0.9902095937383113, 'max_features': 'log2'}. Best is trial 603 with value: 0.45955205541891275.
[I 2024-12-04 15:03:58,828] Trial 1057 finished with value: 0.635513824951947 and parameters: {'n_estimators': 1292, 'learning_rate': 0.028314085696673735, 'max_depth': 10, 'min_samples_split': 15, 'min_samples_leaf': 2, 'subsample': 0.8483873496315596, 'max_features': None}. Best is trial 603 with value: 0.45955205541891275.
[I 2024-12-04 15:03:59,387] Trial 1062 finished with value: 0.655748211523557 and parameters: {'n_estimators': 1132, 'learning_rate': 0.05825512292765636, 'max_depth': 10, 'min_samples_split': 20, 'min_samples_leaf': 3, 'subsample': 0.9180411363573863, 'max_features': None}. Best is trial 603 with value: 0.45955205541891275.
[I 2024-12-04 15:04:00,927] Trial 1055 finished with value: 0.48080307228292624 and parameters: {'n_estimators': 1461, 'learning_rate': 0.06251061476917806, 'max_depth': 12, 'min_samples_split': 20, 'min_samples_leaf': 1, 'subsample': 0.9749940501482477, 'max_features': None}. Best is trial 603 with value: 0.45955205541891275.
[I 2024-12-04 15:04:02,650] Trial 1056 finished with value: 0.6753936674998783 and parameters: {'n_estimators': 1431, 'learning_rate': 0.09146577845294454, 'max_depth': 10, 'min_samples_split': 19, 'min_samples_leaf': 2, 'subsample': 0.9477659148930043, 'max_features': None}. Best is trial 603 with value: 0.45955205541891275.
[I 2024-12-04 15:04:03,500] Trial 1063 finished with value: 0.6231409725150256 and parameters: {'n_estimators': 1183, 'learning_rate': 0.05092904681480943, 'max_depth': 12, 'min_samples_split': 20, 'min_samples_leaf': 2, 'subsample': 0.9150080594572693, 'max_features': None}. Best is trial 603 with value: 0.45955205541891275.
[I 2024-12-04 15:04:04,919] Trial 1069 finished with value: 0.7022984456158242 and parameters: {'n_estimators': 1330, 'learning_rate': 0.03324822259627236, 'max_depth': 10, 'min_samples_split': 10, 'min_samples_leaf': 6, 'subsample': 0.925305142295256, 'max_features': 'sqrt'}. Best is trial 603 with value: 0.45955205541891275.
[I 2024-12-04 15:04:05,008] Trial 1061 finished with value: 0.4825914405211093 and parameters: {'n_estimators': 1267, 'learning_rate': 0.06455654642347615, 'max_depth': 11, 'min_samples_split': 19, 'min_samples_leaf': 1, 'subsample': 0.9986490119973067, 'max_features': None}. Best is trial 603 with value: 0.45955205541891275.
[I 2024-12-04 15:04:05,946] Trial 1064 finished with value: 0.6134140453715518 and parameters: {'n_estimators': 1208, 'learning_rate': 0.05416288191034391, 'max_depth': 12, 'min_samples_split': 16, 'min_samples_leaf': 2, 'subsample': 0.9971658022597959, 'max_features': None}. Best is trial 603 with value: 0.45955205541891275.
[I 2024-12-04 15:04:07,376] Trial 1077 finished with value: 0.5688724959455804 and parameters: {'n_estimators': 1099, 'learning_rate': 0.0634009469397759, 'max_depth': 12, 'min_samples_split': 17, 'min_samples_leaf': 1, 'subsample': 0.9943806612504584, 'max_features': 'log2'}. Best is trial 603 with value: 0.45955205541891275.
[I 2024-12-04 15:04:08,142] Trial 1080 finished with value: 0.49181595483174656 and parameters: {'n_estimators': 818, 'learning_rate': 0.08208927284449137, 'max_depth': 12, 'min_samples_split': 16, 'min_samples_leaf': 1, 'subsample': 0.9697532730802562, 'max_features': None}. Best is trial 603 with value: 0.45955205541891275.
