[I 2024-12-03 18:41:05,455] Trial 323 finished with value: 0.569386153525634 and parameters: {'kernel': 'linear', 'C': 4.58824606918741, 'gamma': 0.02332409637114057, 'epsilon': 0.1807927605436049}. Best is trial 245 with value: 0.4498699730221994.
[I 2024-12-03 18:41:05,746] Trial 319 finished with value: 0.6268770594697229 and parameters: {'kernel': 'rbf', 'C': 94.14021203878418, 'gamma': 0.08132493233932739, 'epsilon': 0.05407447751071094}. Best is trial 245 with value: 0.4498699730221994.
[I 2024-12-03 18:41:05,849] Trial 315 finished with value: 0.4623975072529074 and parameters: {'kernel': 'rbf', 'C': 76.51129582259571, 'gamma': 0.01229760174443548, 'epsilon': 0.029234278259171936}. Best is trial 245 with value: 0.4498699730221994.
[I 2024-12-03 18:41:06,911] Trial 313 finished with value: 0.4983424289263647 and parameters: {'kernel': 'rbf', 'C': 18.38491284091138, 'gamma': 0.050161432856092446, 'epsilon': 0.057766984026480415}. Best is trial 245 with value: 0.4498699730221994.
[I 2024-12-03 18:41:07,442] Trial 325 finished with value: 0.48924561982350867 and parameters: {'kernel': 'rbf', 'C': 13.435452315950455, 'gamma': 0.02223946172915622, 'epsilon': 0.044010810692312344}. Best is trial 245 with value: 0.4498699730221994.
[I 2024-12-03 18:41:07,590] Trial 318 finished with value: 0.4815844753551723 and parameters: {'kernel': 'rbf', 'C': 89.68066369084603, 'gamma': 0.007511327228714159, 'epsilon': 0.07119396440739661}. Best is trial 245 with value: 0.4498699730221994.
[I 2024-12-03 18:41:07,749] Trial 314 finished with value: 0.7941444805619844 and parameters: {'kernel': 'poly', 'C': 84.1959359515837, 'gamma': 0.016107290040265405, 'epsilon': 0.0910288869250505}. Best is trial 334 with value: 0.4492351460020274.
[I 2024-12-03 18:41:07,793] Trial 310 finished with value: 0.6262374400679964 and parameters: {'kernel': 'rbf', 'C': 51.17066027764541, 'gamma': 0.0856811575677756, 'epsilon': 0.037846681346692806}. Best is trial 334 with value: 0.4492351460020274.
[I 2024-12-03 18:41:08,013] Trial 320 finished with value: 0.5518672897608161 and parameters: {'kernel': 'rbf', 'C': 99.39397640819845, 'gamma': 0.03295858441555933, 'epsilon': 0.03071676614038414}. Best is trial 334 with value: 0.4492351460020274.
[I 2024-12-03 18:41:08,310] Trial 334 finished with value: 0.4492351460020274 and parameters: {'kernel': 'rbf', 'C': 91.31541017802547, 'gamma': 0.01357713948945622, 'epsilon': 0.07410177630837363}. Best is trial 334 with value: 0.4492351460020274.
[I 2024-12-03 18:41:08,324] Trial 307 finished with value: 0.4589335822328795 and parameters: {'kernel': 'rbf', 'C': 93.69032255107432, 'gamma': 0.011521206632954547, 'epsilon': 0.04438854365897955}. Best is trial 334 with value: 0.4492351460020274.
[I 2024-12-03 18:41:08,703] Trial 327 finished with value: 0.5811859597943163 and parameters: {'kernel': 'rbf', 'C': 80.25792607442672, 'gamma': 0.04334372687272194, 'epsilon': 0.04311641338871772}. Best is trial 334 with value: 0.4492351460020274.
[I 2024-12-03 18:41:09,338] Trial 333 finished with value: 0.4639827159722005 and parameters: {'kernel': 'rbf', 'C': 70.37825892231382, 'gamma': 0.015008795082046025, 'epsilon': 0.1365148717473986}. Best is trial 334 with value: 0.4492351460020274.
[I 2024-12-03 18:41:09,339] Trial 322 finished with value: 0.4953903271324229 and parameters: {'kernel': 'rbf', 'C': 82.19179797820303, 'gamma': 0.00680895761736238, 'epsilon': 0.011507672461639022}. Best is trial 334 with value: 0.4492351460020274.
[I 2024-12-03 18:41:09,363] Trial 326 finished with value: 1.369244217153559 and parameters: {'kernel': 'poly', 'C': 23.155504246897447, 'gamma': 0.00028287452440906106, 'epsilon': 0.004224386608133421}. Best is trial 334 with value: 0.4492351460020274.
[I 2024-12-03 18:41:09,480] Trial 302 finished with value: 1.3698995536990528 and parameters: {'kernel': 'poly', 'C': 0.5657402920957065, 'gamma': 0.0002894742548199372, 'epsilon': 0.0747117875587925}. Best is trial 334 with value: 0.4492351460020274.
[I 2024-12-03 18:41:09,494] Trial 331 finished with value: 1.3313911839421 and parameters: {'kernel': 'rbf', 'C': 0.0016837086530245486, 'gamma': 0.002468634831761997, 'epsilon': 0.3963201779014745}. Best is trial 334 with value: 0.4492351460020274.
[I 2024-12-03 18:41:09,495] Trial 335 finished with value: 0.5680568341827749 and parameters: {'kernel': 'rbf', 'C': 14.986882611422438, 'gamma': 0.0063860974338632425, 'epsilon': 0.03154734088698989}. Best is trial 334 with value: 0.4492351460020274.
[I 2024-12-03 18:41:09,641] Trial 324 finished with value: 1.0935282587839297 and parameters: {'kernel': 'poly', 'C': 14.175638128053349, 'gamma': 0.005154702404085821, 'epsilon': 0.02632532129681991}. Best is trial 334 with value: 0.4492351460020274.
[I 2024-12-03 18:41:09,720] Trial 332 finished with value: 0.45557828171997533 and parameters: {'kernel': 'rbf', 'C': 87.08240368751773, 'gamma': 0.01769666358138828, 'epsilon': 0.04631386116091042}. Best is trial 334 with value: 0.4492351460020274.
[I 2024-12-03 18:41:09,873] Trial 328 finished with value: 0.5407223714282662 and parameters: {'kernel': 'rbf', 'C': 12.323388915702363, 'gamma': 0.011877722369606162, 'epsilon': 0.02351199978300716}. Best is trial 334 with value: 0.4492351460020274.
[I 2024-12-03 18:41:10,137] Trial 336 finished with value: 0.540601782487991 and parameters: {'kernel': 'rbf', 'C': 97.23076749161972, 'gamma': 0.0031569521175969333, 'epsilon': 0.02244699800797927}. Best is trial 334 with value: 0.4492351460020274.
[I 2024-12-03 18:41:10,955] Trial 330 finished with value: 0.483626095736043 and parameters: {'kernel': 'rbf', 'C': 88.807749821401, 'gamma': 0.007203026036325688, 'epsilon': 0.06352340449570794}. Best is trial 334 with value: 0.4492351460020274.
[I 2024-12-03 18:41:11,435] Trial 342 finished with value: 0.4622703591081683 and parameters: {'kernel': 'rbf', 'C': 82.94137318701982, 'gamma': 0.011154565592424328, 'epsilon': 0.04287724256170947}. Best is trial 334 with value: 0.4492351460020274.
[I 2024-12-03 18:41:11,601] Trial 339 finished with value: 0.4679744055902387 and parameters: {'kernel': 'rbf', 'C': 96.11861250017047, 'gamma': 0.008573148212176562, 'epsilon': 0.1111136994131179}. Best is trial 334 with value: 0.4492351460020274.
[I 2024-12-03 18:41:11,777] Trial 329 finished with value: 0.7800747110653091 and parameters: {'kernel': 'sigmoid', 'C': 5.026800133603166, 'gamma': 0.0012926414524648648, 'epsilon': 0.5611345533898281}. Best is trial 334 with value: 0.4492351460020274.
[I 2024-12-03 18:41:12,200] Trial 340 finished with value: 0.4889702091843628 and parameters: {'kernel': 'rbf', 'C': 98.68176468940099, 'gamma': 0.02433028236701078, 'epsilon': 0.05569954974514526}. Best is trial 334 with value: 0.4492351460020274.
[I 2024-12-03 18:41:12,889] Trial 338 finished with value: 0.5655399652677031 and parameters: {'kernel': 'linear', 'C': 4.052818990841089, 'gamma': 0.011718317605359607, 'epsilon': 0.01198041670454976}. Best is trial 334 with value: 0.4492351460020274.
[I 2024-12-03 18:41:12,973] Trial 344 finished with value: 1.1144762685630853 and parameters: {'kernel': 'rbf', 'C': 0.17890054435485914, 'gamma': 0.44459635535192615, 'epsilon': 0.7636872045322489}. Best is trial 334 with value: 0.4492351460020274.
[I 2024-12-03 18:41:13,423] Trial 345 finished with value: 0.6577265639630226 and parameters: {'kernel': 'rbf', 'C': 13.30085269608858, 'gamma': 0.0028107158415468154, 'epsilon': 0.05904601436924446}. Best is trial 334 with value: 0.4492351460020274.
[I 2024-12-03 18:41:13,539] Trial 341 finished with value: 0.6530573757698778 and parameters: {'kernel': 'rbf', 'C': 10.777191195281938, 'gamma': 0.003596519321048765, 'epsilon': 0.09930066010165253}. Best is trial 334 with value: 0.4492351460020274.
[I 2024-12-03 18:41:14,007] Trial 350 finished with value: 0.4590083982418478 and parameters: {'kernel': 'rbf', 'C': 85.90785455567804, 'gamma': 0.01371852698807452, 'epsilon': 0.02383372525690327}. Best is trial 334 with value: 0.4492351460020274.
[I 2024-12-03 18:41:14,187] Trial 337 finished with value: 0.47695772107594997 and parameters: {'kernel': 'rbf', 'C': 23.66745084821418, 'gamma': 0.017610325491950816, 'epsilon': 0.020933395465524068}. Best is trial 334 with value: 0.4492351460020274.
[I 2024-12-03 18:41:14,583] Trial 351 finished with value: 0.46467005136414435 and parameters: {'kernel': 'rbf', 'C': 98.13021933125724, 'gamma': 0.010482549127056432, 'epsilon': 0.023339477084388247}. Best is trial 334 with value: 0.4492351460020274.
[I 2024-12-03 18:41:15,157] Trial 347 finished with value: 0.5559854429193961 and parameters: {'kernel': 'linear', 'C': 47.73651602950984, 'gamma': 0.04611193412759583, 'epsilon': 0.018931176824849398}. Best is trial 334 with value: 0.4492351460020274.
[I 2024-12-03 18:41:15,242] Trial 356 finished with value: 193.78359730636205 and parameters: {'kernel': 'sigmoid', 'C': 60.66420979681655, 'gamma': 0.01743457634012288, 'epsilon': 0.0750636089676478}. Best is trial 334 with value: 0.4492351460020274.
[I 2024-12-03 18:41:16,052] Trial 357 finished with value: 0.47911035744454655 and parameters: {'kernel': 'rbf', 'C': 13.8516765526633, 'gamma': 0.03618602157062339, 'epsilon': 0.01065078952974198}. Best is trial 334 with value: 0.4492351460020274.
[I 2024-12-03 18:41:16,373] Trial 358 finished with value: 0.6205228589462525 and parameters: {'kernel': 'rbf', 'C': 83.5347426640046, 'gamma': 0.05183289618985597, 'epsilon': 0.011955572242693694}. Best is trial 334 with value: 0.4492351460020274.
[I 2024-12-03 18:41:16,377] Trial 343 finished with value: 0.6163315999833137 and parameters: {'kernel': 'rbf', 'C': 80.55283327513233, 'gamma': 0.1875083911478208, 'epsilon': 0.011616003908955829}. Best is trial 334 with value: 0.4492351460020274.
[I 2024-12-03 18:41:16,482] Trial 349 finished with value: 0.48179193213657323 and parameters: {'kernel': 'rbf', 'C': 79.72320103487127, 'gamma': 0.00834289063190282, 'epsilon': 0.02621417057845046}. Best is trial 334 with value: 0.4492351460020274.
[I 2024-12-03 18:41:16,670] Trial 362 finished with value: 0.4650257474758015 and parameters: {'kernel': 'rbf', 'C': 97.33290495064465, 'gamma': 0.011800123308710655, 'epsilon': 0.01222692068836027}. Best is trial 334 with value: 0.4492351460020274.
[I 2024-12-03 18:41:16,999] Trial 346 finished with value: 0.7330078842419624 and parameters: {'kernel': 'rbf', 'C': 81.57096774282283, 'gamma': 0.00019258563764693056, 'epsilon': 0.14986761637286883}. Best is trial 334 with value: 0.4492351460020274.
[I 2024-12-03 18:41:17,584] Trial 360 finished with value: 0.7885985633495104 and parameters: {'kernel': 'poly', 'C': 8.425453064903389, 'gamma': 0.06793167090536378, 'epsilon': 0.050080093162015525}. Best is trial 334 with value: 0.4492351460020274.
[I 2024-12-03 18:41:17,767] Trial 353 finished with value: 0.4523695407654664 and parameters: {'kernel': 'rbf', 'C': 90.3369278220585, 'gamma': 0.015069589144464417, 'epsilon': 0.046882518963141384}. Best is trial 334 with value: 0.4492351460020274.
[I 2024-12-03 18:41:18,290] Trial 361 finished with value: 0.5779933686372923 and parameters: {'kernel': 'rbf', 'C': 12.929698313039111, 'gamma': 0.005910349408774233, 'epsilon': 0.027388956495271562}. Best is trial 334 with value: 0.4492351460020274.
[I 2024-12-03 18:41:19,082] Trial 348 finished with value: 0.4795684727296358 and parameters: {'kernel': 'rbf', 'C': 81.74658921346038, 'gamma': 0.025422580475643677, 'epsilon': 0.05568920199064184}. Best is trial 334 with value: 0.4492351460020274.
[I 2024-12-03 18:41:19,095] Trial 366 finished with value: 1.2250399487381047 and parameters: {'kernel': 'sigmoid', 'C': 0.03213994603736266, 'gamma': 0.011240651013131491, 'epsilon': 0.0725238578732262}. Best is trial 334 with value: 0.4492351460020274.
[I 2024-12-03 18:41:19,498] Trial 363 finished with value: 0.5743050651317683 and parameters: {'kernel': 'linear', 'C': 78.16324230466333, 'gamma': 0.030525573540331943, 'epsilon': 0.08049856846309134}. Best is trial 334 with value: 0.4492351460020274.
[I 2024-12-03 18:41:19,604] Trial 354 finished with value: 0.552518871022309 and parameters: {'kernel': 'rbf', 'C': 6.664456405197257, 'gamma': 0.017439701767677937, 'epsilon': 0.015041933987471154}. Best is trial 334 with value: 0.4492351460020274.
[I 2024-12-03 18:41:19,856] Trial 364 finished with value: 1.3685956199589482 and parameters: {'kernel': 'rbf', 'C': 0.0010167208716052377, 'gamma': 0.37920369168077944, 'epsilon': 0.001519136964576867}. Best is trial 334 with value: 0.4492351460020274.
[I 2024-12-03 18:41:19,931] Trial 359 finished with value: 0.5406279548217721 and parameters: {'kernel': 'rbf', 'C': 75.67364619165522, 'gamma': 0.0035364818699136938, 'epsilon': 0.04214488168431923}. Best is trial 334 with value: 0.4492351460020274.
[I 2024-12-03 18:41:20,163] Trial 355 finished with value: 0.5595030688726923 and parameters: {'kernel': 'rbf', 'C': 9.341887980054299, 'gamma': 0.010523526288556302, 'epsilon': 0.1525968902457786}. Best is trial 334 with value: 0.4492351460020274.
[I 2024-12-03 18:41:21,398] Trial 369 finished with value: 0.4976326677070991 and parameters: {'kernel': 'rbf', 'C': 93.66837504425801, 'gamma': 0.005329682211256107, 'epsilon': 0.04889962906388074}. Best is trial 334 with value: 0.4492351460020274.
[I 2024-12-03 18:41:21,597] Trial 368 finished with value: 0.5341658816308131 and parameters: {'kernel': 'rbf', 'C': 12.06369626633952, 'gamma': 0.01293035846859352, 'epsilon': 0.04664183058239834}. Best is trial 334 with value: 0.4492351460020274.
[I 2024-12-03 18:41:21,850] Trial 375 finished with value: 0.5232402539349105 and parameters: {'kernel': 'rbf', 'C': 96.53455591181493, 'gamma': 0.02095145824188156, 'epsilon': 0.18371477289174423}. Best is trial 334 with value: 0.4492351460020274.
[I 2024-12-03 18:41:21,899] Trial 372 finished with value: 1.3329276121547335 and parameters: {'kernel': 'rbf', 'C': 0.07573948968747143, 'gamma': 0.0004790081203799764, 'epsilon': 0.004728706434543502}. Best is trial 334 with value: 0.4492351460020274.
[I 2024-12-03 18:41:22,009] Trial 373 finished with value: 0.45039294722595385 and parameters: {'kernel': 'rbf', 'C': 88.36655720126157, 'gamma': 0.011933715618734969, 'epsilon': 0.07496503846246315}. Best is trial 334 with value: 0.4492351460020274.
[I 2024-12-03 18:41:22,133] Trial 352 finished with value: 0.4953938982692182 and parameters: {'kernel': 'rbf', 'C': 11.482513439606073, 'gamma': 0.04627888532725387, 'epsilon': 0.08202292834198496}. Best is trial 334 with value: 0.4492351460020274.
[I 2024-12-03 18:41:22,137] Trial 370 finished with value: 1.3418788120830278 and parameters: {'kernel': 'poly', 'C': 0.010279859416442596, 'gamma': 0.006735494711853805, 'epsilon': 0.044545189991128734}. Best is trial 334 with value: 0.4492351460020274.
[I 2024-12-03 18:41:22,665] Trial 367 finished with value: 1.2939287127091892 and parameters: {'kernel': 'rbf', 'C': 0.12636519765956392, 'gamma': 0.0005475516860702245, 'epsilon': 0.09791965802132625}. Best is trial 334 with value: 0.4492351460020274.
[I 2024-12-03 18:41:24,099] Trial 365 finished with value: 0.4555233920562289 and parameters: {'kernel': 'rbf', 'C': 83.81034248604495, 'gamma': 0.018177197450069352, 'epsilon': 0.058526585923175195}. Best is trial 334 with value: 0.4492351460020274.
[I 2024-12-03 18:41:25,267] Trial 388 finished with value: 0.5191752525657964 and parameters: {'kernel': 'rbf', 'C': 21.190195012246843, 'gamma': 0.010868871167064718, 'epsilon': 0.0676573299276553}. Best is trial 334 with value: 0.4492351460020274.
[I 2024-12-03 18:41:25,269] Trial 376 finished with value: 0.4864317289194581 and parameters: {'kernel': 'rbf', 'C': 16.88204465693852, 'gamma': 0.039101011081910164, 'epsilon': 0.09182992432393194}. Best is trial 334 with value: 0.4492351460020274.
[I 2024-12-03 18:41:25,271] Trial 383 finished with value: 0.9479408349814108 and parameters: {'kernel': 'rbf', 'C': 0.14558635544457232, 'gamma': 0.02361996208933797, 'epsilon': 0.013299308951835271}. Best is trial 334 with value: 0.4492351460020274.
[I 2024-12-03 18:41:25,273] Trial 374 finished with value: 0.4552367174615998 and parameters: {'kernel': 'rbf', 'C': 86.50576312376668, 'gamma': 0.013778435217576365, 'epsilon': 0.09671538316628311}. Best is trial 334 with value: 0.4492351460020274.
[I 2024-12-03 18:41:25,462] Trial 386 finished with value: 0.505399438848649 and parameters: {'kernel': 'rbf', 'C': 79.23974311287459, 'gamma': 0.02743123498639925, 'epsilon': 0.08055851066556713}. Best is trial 334 with value: 0.4492351460020274.
[I 2024-12-03 18:41:25,914] Trial 387 finished with value: 1.2968052249007802 and parameters: {'kernel': 'sigmoid', 'C': 0.02973744039325554, 'gamma': 0.0010127298697962723, 'epsilon': 0.6041875182174072}. Best is trial 334 with value: 0.4492351460020274.
[I 2024-12-03 18:41:26,762] Trial 379 finished with value: 0.5659915099580809 and parameters: {'kernel': 'linear', 'C': 71.92708458121, 'gamma': 0.007524005777272926, 'epsilon': 0.04622784764848598}. Best is trial 334 with value: 0.4492351460020274.
[I 2024-12-03 18:41:26,961] Trial 381 finished with value: 0.620154512533618 and parameters: {'kernel': 'rbf', 'C': 93.66116792644843, 'gamma': 0.0787006360971204, 'epsilon': 0.09906105314678326}. Best is trial 334 with value: 0.4492351460020274.
[I 2024-12-03 18:41:27,170] Trial 380 finished with value: 0.5545183758099718 and parameters: {'kernel': 'rbf', 'C': 89.50346585294324, 'gamma': 0.002657887572975863, 'epsilon': 0.11578509145669102}. Best is trial 334 with value: 0.4492351460020274.
[I 2024-12-03 18:41:27,227] Trial 385 finished with value: 0.5285151375085524 and parameters: {'kernel': 'rbf', 'C': 96.11888940056112, 'gamma': 0.022650632642499793, 'epsilon': 0.21121959172656588}. Best is trial 334 with value: 0.4492351460020274.
[I 2024-12-03 18:41:27,333] Trial 371 finished with value: 1.3471812634220193 and parameters: {'kernel': 'poly', 'C': 0.39912930988102346, 'gamma': 0.0019593034595416317, 'epsilon': 0.011808463520523942}. Best is trial 334 with value: 0.4492351460020274.
[I 2024-12-03 18:41:27,969] Trial 389 finished with value: 0.5257752900834903 and parameters: {'kernel': 'rbf', 'C': 18.182535915546122, 'gamma': 0.011464857433846726, 'epsilon': 0.09954941804265482}. Best is trial 334 with value: 0.4492351460020274.
[I 2024-12-03 18:41:28,007] Trial 378 finished with value: 0.5070439910096269 and parameters: {'kernel': 'rbf', 'C': 21.010510460085964, 'gamma': 0.012509447098165623, 'epsilon': 0.07075970065125219}. Best is trial 334 with value: 0.4492351460020274.
[I 2024-12-03 18:41:28,324] Trial 390 finished with value: 0.5904067804329504 and parameters: {'kernel': 'linear', 'C': 0.948469558335831, 'gamma': 0.0002712120907360872, 'epsilon': 0.17667967398578047}. Best is trial 334 with value: 0.4492351460020274.
[I 2024-12-03 18:41:28,716] Trial 382 finished with value: 0.6347259230369623 and parameters: {'kernel': 'rbf', 'C': 96.2091854805464, 'gamma': 0.07399959328155932, 'epsilon': 0.07143041439110284}. Best is trial 334 with value: 0.4492351460020274.
[I 2024-12-03 18:41:28,820] Trial 392 finished with value: 0.49176047156519676 and parameters: {'kernel': 'rbf', 'C': 13.72430370155688, 'gamma': 0.030095509959051536, 'epsilon': 0.22237366449827575}. Best is trial 334 with value: 0.4492351460020274.
[I 2024-12-03 18:41:29,224] Trial 377 finished with value: 1.3735191215692146 and parameters: {'kernel': 'sigmoid', 'C': 0.0013401485805071749, 'gamma': 0.00024967753162229335, 'epsilon': 0.0040003811380552555}. Best is trial 334 with value: 0.4492351460020274.
[I 2024-12-03 18:41:29,371] Trial 393 finished with value: 0.5592286871062278 and parameters: {'kernel': 'rbf', 'C': 93.66656807822937, 'gamma': 0.03492218831870911, 'epsilon': 0.050494083291264806}. Best is trial 334 with value: 0.4492351460020274.
[I 2024-12-03 18:41:29,623] Trial 398 finished with value: 0.5017120815750954 and parameters: {'kernel': 'rbf', 'C': 59.41195619001232, 'gamma': 0.006687947603320578, 'epsilon': 0.08012031945202182}. Best is trial 334 with value: 0.4492351460020274.
[I 2024-12-03 18:41:29,734] Trial 399 finished with value: 5.0450448067479305 and parameters: {'kernel': 'sigmoid', 'C': 70.63542363103709, 'gamma': 0.0030750788977421803, 'epsilon': 0.17096656589556508}. Best is trial 334 with value: 0.4492351460020274.
[I 2024-12-03 18:41:29,762] Trial 391 finished with value: 0.48548302329420356 and parameters: {'kernel': 'rbf', 'C': 95.82968685706423, 'gamma': 0.01821062703870043, 'epsilon': 0.123081132024078}. Best is trial 334 with value: 0.4492351460020274.
[I 2024-12-03 18:41:30,127] Trial 397 finished with value: 0.4887632869211723 and parameters: {'kernel': 'rbf', 'C': 99.1260088725878, 'gamma': 0.011392620806944634, 'epsilon': 0.2129911466358625}. Best is trial 334 with value: 0.4492351460020274.
[I 2024-12-03 18:41:30,378] Trial 400 finished with value: 0.527770571564269 and parameters: {'kernel': 'rbf', 'C': 11.798863656669791, 'gamma': 0.07345903378410927, 'epsilon': 0.02600407536013394}. Best is trial 334 with value: 0.4492351460020274.
[I 2024-12-03 18:41:30,533] Trial 394 finished with value: 1.0452696895044278 and parameters: {'kernel': 'poly', 'C': 90.42280093661364, 'gamma': 0.00444669542287791, 'epsilon': 0.0340954867921278}. Best is trial 334 with value: 0.4492351460020274.
[I 2024-12-03 18:41:31,138] Trial 384 finished with value: 0.4583113911704949 and parameters: {'kernel': 'rbf', 'C': 78.04409627440128, 'gamma': 0.012316438661201879, 'epsilon': 0.050444973214895564}. Best is trial 334 with value: 0.4492351460020274.
[I 2024-12-03 18:41:32,046] Trial 404 finished with value: 0.48381197476881105 and parameters: {'kernel': 'rbf', 'C': 9.870906358119308, 'gamma': 0.03278847815731351, 'epsilon': 0.04240103059190952}. Best is trial 334 with value: 0.4492351460020274.
