[I 2024-12-04 12:26:01,924] Trial 2364 finished with value: 0.32871892615420434 and parameters: {'n_estimators': 142, 'max_depth': 50, 'min_samples_split': 2, 'min_samples_leaf': 1, 'max_features': None, 'bootstrap': True, 'criterion': 'squared_error'}. Best is trial 341 with value: 0.2909369124469028.
[I 2024-12-04 12:26:02,175] Trial 2367 finished with value: 0.32120707981273844 and parameters: {'n_estimators': 117, 'max_depth': 42, 'min_samples_split': 6, 'min_samples_leaf': 1, 'max_features': 'sqrt', 'bootstrap': False, 'criterion': 'squared_error'}. Best is trial 341 with value: 0.2909369124469028.
[I 2024-12-04 12:26:02,595] Trial 2369 finished with value: 0.30208320731627936 and parameters: {'n_estimators': 127, 'max_depth': 50, 'min_samples_split': 5, 'min_samples_leaf': 1, 'max_features': 'sqrt', 'bootstrap': False, 'criterion': 'squared_error'}. Best is trial 341 with value: 0.2909369124469028.
[I 2024-12-04 12:26:02,658] Trial 2366 finished with value: 0.42989295841830677 and parameters: {'n_estimators': 101, 'max_depth': 42, 'min_samples_split': 3, 'min_samples_leaf': 1, 'max_features': 'log2', 'bootstrap': False, 'criterion': 'squared_error'}. Best is trial 341 with value: 0.2909369124469028.
[I 2024-12-04 12:26:04,505] Trial 2368 finished with value: 0.29876070990072423 and parameters: {'n_estimators': 157, 'max_depth': 50, 'min_samples_split': 4, 'min_samples_leaf': 1, 'max_features': 'sqrt', 'bootstrap': False, 'criterion': 'squared_error'}. Best is trial 341 with value: 0.2909369124469028.
[I 2024-12-04 12:26:06,140] Trial 2350 finished with value: 0.45752616569468674 and parameters: {'n_estimators': 637, 'max_depth': 50, 'min_samples_split': 3, 'min_samples_leaf': 2, 'max_features': 'sqrt', 'bootstrap': False, 'criterion': 'absolute_error'}. Best is trial 341 with value: 0.2909369124469028.
[I 2024-12-04 12:26:07,346] Trial 2347 finished with value: 0.4128963254094536 and parameters: {'n_estimators': 530, 'max_depth': 50, 'min_samples_split': 5, 'min_samples_leaf': 2, 'max_features': None, 'bootstrap': False, 'criterion': 'squared_error'}. Best is trial 341 with value: 0.2909369124469028.
[I 2024-12-04 12:26:07,973] Trial 2357 finished with value: 0.45881699219954125 and parameters: {'n_estimators': 362, 'max_depth': 50, 'min_samples_split': 4, 'min_samples_leaf': 2, 'max_features': 'sqrt', 'bootstrap': False, 'criterion': 'absolute_error'}. Best is trial 341 with value: 0.2909369124469028.
[I 2024-12-04 12:26:08,971] Trial 2365 finished with value: 0.3077835710519679 and parameters: {'n_estimators': 680, 'max_depth': 43, 'min_samples_split': 4, 'min_samples_leaf': 1, 'max_features': 'sqrt', 'bootstrap': False, 'criterion': 'squared_error'}. Best is trial 341 with value: 0.2909369124469028.
[I 2024-12-04 12:26:09,174] Trial 2373 finished with value: 0.30623756016347387 and parameters: {'n_estimators': 371, 'max_depth': 43, 'min_samples_split': 2, 'min_samples_leaf': 1, 'max_features': 'sqrt', 'bootstrap': False, 'criterion': 'squared_error'}. Best is trial 341 with value: 0.2909369124469028.
[I 2024-12-04 12:26:11,576] Trial 2371 finished with value: 0.4443490937894097 and parameters: {'n_estimators': 446, 'max_depth': 41, 'min_samples_split': 2, 'min_samples_leaf': 2, 'max_features': 'sqrt', 'bootstrap': False, 'criterion': 'squared_error'}. Best is trial 341 with value: 0.2909369124469028.
[I 2024-12-04 12:26:12,391] Trial 2360 finished with value: 0.4201998495156973 and parameters: {'n_estimators': 838, 'max_depth': 32, 'min_samples_split': 15, 'min_samples_leaf': 5, 'max_features': None, 'bootstrap': True, 'criterion': 'squared_error'}. Best is trial 341 with value: 0.2909369124469028.
[I 2024-12-04 12:26:14,082] Trial 2374 finished with value: 0.3034928100334093 and parameters: {'n_estimators': 519, 'max_depth': 50, 'min_samples_split': 5, 'min_samples_leaf': 1, 'max_features': 'sqrt', 'bootstrap': False, 'criterion': 'squared_error'}. Best is trial 341 with value: 0.2909369124469028.
[I 2024-12-04 12:26:14,691] Trial 2372 finished with value: 0.3060056891143937 and parameters: {'n_estimators': 309, 'max_depth': 43, 'min_samples_split': 2, 'min_samples_leaf': 1, 'max_features': 'sqrt', 'bootstrap': False, 'criterion': 'squared_error'}. Best is trial 341 with value: 0.2909369124469028.
[I 2024-12-04 12:26:17,321] Trial 2377 finished with value: 0.3008566573433145 and parameters: {'n_estimators': 280, 'max_depth': 43, 'min_samples_split': 3, 'min_samples_leaf': 1, 'max_features': 'sqrt', 'bootstrap': False, 'criterion': 'squared_error'}. Best is trial 341 with value: 0.2909369124469028.
[I 2024-12-04 12:26:17,335] Trial 2376 finished with value: 0.2938266296966762 and parameters: {'n_estimators': 636, 'max_depth': 50, 'min_samples_split': 3, 'min_samples_leaf': 1, 'max_features': 'sqrt', 'bootstrap': False, 'criterion': 'squared_error'}. Best is trial 341 with value: 0.2909369124469028.
[I 2024-12-04 12:26:17,653] Trial 2363 finished with value: 0.5545681015763911 and parameters: {'n_estimators': 923, 'max_depth': 34, 'min_samples_split': 17, 'min_samples_leaf': 15, 'max_features': None, 'bootstrap': True, 'criterion': 'squared_error'}. Best is trial 341 with value: 0.2909369124469028.
[I 2024-12-04 12:26:18,193] Trial 2375 finished with value: 0.29831363218303314 and parameters: {'n_estimators': 556, 'max_depth': 50, 'min_samples_split': 2, 'min_samples_leaf': 1, 'max_features': 'sqrt', 'bootstrap': False, 'criterion': 'squared_error'}. Best is trial 341 with value: 0.2909369124469028.
[I 2024-12-04 12:26:18,497] Trial 2383 finished with value: 0.5752144820675067 and parameters: {'n_estimators': 141, 'max_depth': 28, 'min_samples_split': 10, 'min_samples_leaf': 3, 'max_features': 'sqrt', 'bootstrap': True, 'criterion': 'absolute_error'}. Best is trial 341 with value: 0.2909369124469028.
[I 2024-12-04 12:26:19,055] Trial 2378 finished with value: 0.4413776075814103 and parameters: {'n_estimators': 646, 'max_depth': 50, 'min_samples_split': 2, 'min_samples_leaf': 2, 'max_features': 'sqrt', 'bootstrap': False, 'criterion': 'squared_error'}. Best is trial 341 with value: 0.2909369124469028.
[I 2024-12-04 12:26:19,920] Trial 2384 finished with value: 0.30670970970201866 and parameters: {'n_estimators': 321, 'max_depth': 43, 'min_samples_split': 4, 'min_samples_leaf': 1, 'max_features': 'sqrt', 'bootstrap': False, 'criterion': 'squared_error'}. Best is trial 341 with value: 0.2909369124469028.
[I 2024-12-04 12:26:21,139] Trial 2370 finished with value: 0.29863496028530323 and parameters: {'n_estimators': 821, 'max_depth': 50, 'min_samples_split': 2, 'min_samples_leaf': 1, 'max_features': 'sqrt', 'bootstrap': False, 'criterion': 'squared_error'}. Best is trial 341 with value: 0.2909369124469028.
[I 2024-12-04 12:26:21,148] Trial 2390 finished with value: 0.3040030658142192 and parameters: {'n_estimators': 456, 'max_depth': 50, 'min_samples_split': 5, 'min_samples_leaf': 1, 'max_features': 'sqrt', 'bootstrap': False, 'criterion': 'squared_error'}. Best is trial 341 with value: 0.2909369124469028.
[I 2024-12-04 12:26:21,200] Trial 2380 finished with value: 0.2934860429448949 and parameters: {'n_estimators': 517, 'max_depth': 50, 'min_samples_split': 3, 'min_samples_leaf': 1, 'max_features': 'sqrt', 'bootstrap': False, 'criterion': 'squared_error'}. Best is trial 341 with value: 0.2909369124469028.
[I 2024-12-04 12:26:21,212] Trial 2387 finished with value: 0.3132357933383198 and parameters: {'n_estimators': 155, 'max_depth': 37, 'min_samples_split': 3, 'min_samples_leaf': 1, 'max_features': 'sqrt', 'bootstrap': False, 'criterion': 'squared_error'}. Best is trial 341 with value: 0.2909369124469028.
[I 2024-12-04 12:26:21,215] Trial 2382 finished with value: 0.3111313123192499 and parameters: {'n_estimators': 580, 'max_depth': 41, 'min_samples_split': 2, 'min_samples_leaf': 1, 'max_features': 'sqrt', 'bootstrap': False, 'criterion': 'squared_error'}. Best is trial 341 with value: 0.2909369124469028.
[I 2024-12-04 12:26:21,399] Trial 2381 finished with value: 0.3192276830604589 and parameters: {'n_estimators': 469, 'max_depth': 42, 'min_samples_split': 6, 'min_samples_leaf': 1, 'max_features': 'sqrt', 'bootstrap': False, 'criterion': 'squared_error'}. Best is trial 341 with value: 0.2909369124469028.
[I 2024-12-04 12:26:21,821] Trial 2333 finished with value: 0.3318061340291229 and parameters: {'n_estimators': 301, 'max_depth': 49, 'min_samples_split': 3, 'min_samples_leaf': 1, 'max_features': None, 'bootstrap': True, 'criterion': 'absolute_error'}. Best is trial 341 with value: 0.2909369124469028.
[I 2024-12-04 12:26:21,857] Trial 2386 finished with value: 0.3139340835436106 and parameters: {'n_estimators': 583, 'max_depth': 40, 'min_samples_split': 2, 'min_samples_leaf': 1, 'max_features': 'sqrt', 'bootstrap': False, 'criterion': 'squared_error'}. Best is trial 341 with value: 0.2909369124469028.
[I 2024-12-04 12:26:22,296] Trial 2385 finished with value: 0.3048528177993622 and parameters: {'n_estimators': 639, 'max_depth': 50, 'min_samples_split': 5, 'min_samples_leaf': 1, 'max_features': 'sqrt', 'bootstrap': False, 'criterion': 'squared_error'}. Best is trial 341 with value: 0.2909369124469028.
[I 2024-12-04 12:26:22,783] Trial 2379 finished with value: 0.9650360267578084 and parameters: {'n_estimators': 550, 'max_depth': 21, 'min_samples_split': 6, 'min_samples_leaf': 12, 'max_features': 'log2', 'bootstrap': True, 'criterion': 'absolute_error'}. Best is trial 341 with value: 0.2909369124469028.
[I 2024-12-04 12:26:23,295] Trial 2388 finished with value: 0.4014065210136011 and parameters: {'n_estimators': 124, 'max_depth': 50, 'min_samples_split': 6, 'min_samples_leaf': 1, 'max_features': 'log2', 'bootstrap': False, 'criterion': 'squared_error'}. Best is trial 341 with value: 0.2909369124469028.
[I 2024-12-04 12:26:24,001] Trial 2389 finished with value: 0.6345532484468162 and parameters: {'n_estimators': 159, 'max_depth': 19, 'min_samples_split': 25, 'min_samples_leaf': 5, 'max_features': 'sqrt', 'bootstrap': False, 'criterion': 'absolute_error'}. Best is trial 341 with value: 0.2909369124469028.
[I 2024-12-04 12:26:24,725] Trial 2398 finished with value: 0.4443261732747647 and parameters: {'n_estimators': 292, 'max_depth': 42, 'min_samples_split': 4, 'min_samples_leaf': 2, 'max_features': 'sqrt', 'bootstrap': False, 'criterion': 'squared_error'}. Best is trial 341 with value: 0.2909369124469028.
[I 2024-12-04 12:26:24,729] Trial 2396 finished with value: 0.2996035661596623 and parameters: {'n_estimators': 248, 'max_depth': 50, 'min_samples_split': 2, 'min_samples_leaf': 1, 'max_features': 'sqrt', 'bootstrap': False, 'criterion': 'squared_error'}. Best is trial 341 with value: 0.2909369124469028.
[I 2024-12-04 12:26:24,824] Trial 2393 finished with value: 0.29463365800373714 and parameters: {'n_estimators': 277, 'max_depth': 50, 'min_samples_split': 3, 'min_samples_leaf': 1, 'max_features': 'sqrt', 'bootstrap': False, 'criterion': 'squared_error'}. Best is trial 341 with value: 0.2909369124469028.
[I 2024-12-04 12:26:24,989] Trial 2392 finished with value: 0.3054267531290985 and parameters: {'n_estimators': 220, 'max_depth': 44, 'min_samples_split': 2, 'min_samples_leaf': 1, 'max_features': 'sqrt', 'bootstrap': False, 'criterion': 'squared_error'}. Best is trial 341 with value: 0.2909369124469028.
[I 2024-12-04 12:26:25,336] Trial 2391 finished with value: 0.3876645064391572 and parameters: {'n_estimators': 242, 'max_depth': 50, 'min_samples_split': 2, 'min_samples_leaf': 1, 'max_features': None, 'bootstrap': False, 'criterion': 'squared_error'}. Best is trial 341 with value: 0.2909369124469028.
[I 2024-12-04 12:26:28,178] Trial 2401 finished with value: 0.2976108745249506 and parameters: {'n_estimators': 101, 'max_depth': 49, 'min_samples_split': 3, 'min_samples_leaf': 1, 'max_features': 'sqrt', 'bootstrap': False, 'criterion': 'squared_error'}. Best is trial 341 with value: 0.2909369124469028.
[I 2024-12-04 12:26:29,938] Trial 2394 finished with value: 0.3056599470644129 and parameters: {'n_estimators': 362, 'max_depth': 45, 'min_samples_split': 4, 'min_samples_leaf': 1, 'max_features': 'sqrt', 'bootstrap': False, 'criterion': 'squared_error'}. Best is trial 341 with value: 0.2909369124469028.
[I 2024-12-04 12:26:30,239] Trial 2395 finished with value: 0.3359970812352636 and parameters: {'n_estimators': 530, 'max_depth': 39, 'min_samples_split': 3, 'min_samples_leaf': 1, 'max_features': 'sqrt', 'bootstrap': True, 'criterion': 'squared_error'}. Best is trial 341 with value: 0.2909369124469028.
[I 2024-12-04 12:26:31,717] Trial 2267 finished with value: 0.4322139645275101 and parameters: {'n_estimators': 562, 'max_depth': 49, 'min_samples_split': 2, 'min_samples_leaf': 1, 'max_features': None, 'bootstrap': False, 'criterion': 'absolute_error'}. Best is trial 341 with value: 0.2909369124469028.
[I 2024-12-04 12:26:34,979] Trial 2405 finished with value: 0.4413468291412039 and parameters: {'n_estimators': 664, 'max_depth': 50, 'min_samples_split': 4, 'min_samples_leaf': 2, 'max_features': 'sqrt', 'bootstrap': False, 'criterion': 'squared_error'}. Best is trial 341 with value: 0.2909369124469028.
[I 2024-12-04 12:26:35,166] Trial 2407 finished with value: 0.4442624941843716 and parameters: {'n_estimators': 225, 'max_depth': 45, 'min_samples_split': 7, 'min_samples_leaf': 2, 'max_features': 'sqrt', 'bootstrap': False, 'criterion': 'squared_error'}. Best is trial 341 with value: 0.2909369124469028.
[I 2024-12-04 12:26:35,418] Trial 2402 finished with value: 0.4470124535759326 and parameters: {'n_estimators': 205, 'max_depth': 45, 'min_samples_split': 2, 'min_samples_leaf': 2, 'max_features': 'sqrt', 'bootstrap': False, 'criterion': 'squared_error'}. Best is trial 341 with value: 0.2909369124469028.
[I 2024-12-04 12:26:35,512] Trial 2404 finished with value: 0.32938507309201853 and parameters: {'n_estimators': 277, 'max_depth': 49, 'min_samples_split': 5, 'min_samples_leaf': 1, 'max_features': 'sqrt', 'bootstrap': True, 'criterion': 'squared_error'}. Best is trial 341 with value: 0.2909369124469028.
[I 2024-12-04 12:26:35,513] Trial 2399 finished with value: 0.29312383214185284 and parameters: {'n_estimators': 758, 'max_depth': 50, 'min_samples_split': 3, 'min_samples_leaf': 1, 'max_features': 'sqrt', 'bootstrap': False, 'criterion': 'squared_error'}. Best is trial 341 with value: 0.2909369124469028.
[I 2024-12-04 12:26:36,018] Trial 2400 finished with value: 0.44312929647786764 and parameters: {'n_estimators': 538, 'max_depth': 43, 'min_samples_split': 3, 'min_samples_leaf': 2, 'max_features': 'sqrt', 'bootstrap': False, 'criterion': 'squared_error'}. Best is trial 341 with value: 0.2909369124469028.
[I 2024-12-04 12:26:37,962] Trial 2406 finished with value: 0.30152208979617634 and parameters: {'n_estimators': 584, 'max_depth': 43, 'min_samples_split': 3, 'min_samples_leaf': 1, 'max_features': 'sqrt', 'bootstrap': False, 'criterion': 'squared_error'}. Best is trial 341 with value: 0.2909369124469028.
[I 2024-12-04 12:26:38,387] Trial 2411 finished with value: 0.44333646057281967 and parameters: {'n_estimators': 285, 'max_depth': 50, 'min_samples_split': 4, 'min_samples_leaf': 2, 'max_features': 'sqrt', 'bootstrap': False, 'criterion': 'squared_error'}. Best is trial 341 with value: 0.2909369124469028.
[I 2024-12-04 12:26:39,126] Trial 2416 finished with value: 0.6755873685320138 and parameters: {'n_estimators': 116, 'max_depth': 11, 'min_samples_split': 6, 'min_samples_leaf': 4, 'max_features': 'sqrt', 'bootstrap': False, 'criterion': 'absolute_error'}. Best is trial 341 with value: 0.2909369124469028.
[I 2024-12-04 12:26:39,824] Trial 2403 finished with value: 0.30748693064103577 and parameters: {'n_estimators': 354, 'max_depth': 50, 'min_samples_split': 6, 'min_samples_leaf': 1, 'max_features': 'sqrt', 'bootstrap': False, 'criterion': 'squared_error'}. Best is trial 341 with value: 0.2909369124469028.
[I 2024-12-04 12:26:40,869] Trial 2410 finished with value: 0.3040334591186054 and parameters: {'n_estimators': 476, 'max_depth': 44, 'min_samples_split': 2, 'min_samples_leaf': 1, 'max_features': 'sqrt', 'bootstrap': False, 'criterion': 'squared_error'}. Best is trial 341 with value: 0.2909369124469028.
[I 2024-12-04 12:26:41,253] Trial 2418 finished with value: 0.2952724034270525 and parameters: {'n_estimators': 231, 'max_depth': 50, 'min_samples_split': 3, 'min_samples_leaf': 1, 'max_features': 'sqrt', 'bootstrap': False, 'criterion': 'squared_error'}. Best is trial 341 with value: 0.2909369124469028.
[I 2024-12-04 12:26:41,415] Trial 2409 finished with value: 0.44433505861032574 and parameters: {'n_estimators': 204, 'max_depth': 50, 'min_samples_split': 2, 'min_samples_leaf': 2, 'max_features': 'sqrt', 'bootstrap': False, 'criterion': 'squared_error'}. Best is trial 341 with value: 0.2909369124469028.
[I 2024-12-04 12:26:41,648] Trial 2415 finished with value: 0.32474383693515124 and parameters: {'n_estimators': 254, 'max_depth': 44, 'min_samples_split': 8, 'min_samples_leaf': 1, 'max_features': 'sqrt', 'bootstrap': False, 'criterion': 'squared_error'}. Best is trial 341 with value: 0.2909369124469028.
[I 2024-12-04 12:26:41,913] Trial 2414 finished with value: 0.4509502631393212 and parameters: {'n_estimators': 246, 'max_depth': 37, 'min_samples_split': 3, 'min_samples_leaf': 2, 'max_features': 'sqrt', 'bootstrap': False, 'criterion': 'squared_error'}. Best is trial 341 with value: 0.2909369124469028.
[I 2024-12-04 12:26:43,659] Trial 2417 finished with value: 0.3103311129315068 and parameters: {'n_estimators': 235, 'max_depth': 44, 'min_samples_split': 5, 'min_samples_leaf': 1, 'max_features': 'sqrt', 'bootstrap': False, 'criterion': 'squared_error'}. Best is trial 341 with value: 0.2909369124469028.
[I 2024-12-04 12:26:45,408] Trial 2397 finished with value: 0.38769124557542606 and parameters: {'n_estimators': 672, 'max_depth': 49, 'min_samples_split': 2, 'min_samples_leaf': 1, 'max_features': None, 'bootstrap': False, 'criterion': 'squared_error'}. Best is trial 341 with value: 0.2909369124469028.
[I 2024-12-04 12:26:45,764] Trial 2412 finished with value: 0.2939895783263259 and parameters: {'n_estimators': 482, 'max_depth': 50, 'min_samples_split': 3, 'min_samples_leaf': 1, 'max_features': 'sqrt', 'bootstrap': False, 'criterion': 'squared_error'}. Best is trial 341 with value: 0.2909369124469028.
[I 2024-12-04 12:26:45,830] Trial 2408 finished with value: 0.36281522348473155 and parameters: {'n_estimators': 243, 'max_depth': 46, 'min_samples_split': 28, 'min_samples_leaf': 1, 'max_features': None, 'bootstrap': True, 'criterion': 'squared_error'}. Best is trial 341 with value: 0.2909369124469028.
[I 2024-12-04 12:26:45,838] Trial 2413 finished with value: 0.2985433969107727 and parameters: {'n_estimators': 445, 'max_depth': 50, 'min_samples_split': 2, 'min_samples_leaf': 1, 'max_features': 'sqrt', 'bootstrap': False, 'criterion': 'squared_error'}. Best is trial 341 with value: 0.2909369124469028.
[I 2024-12-04 12:26:45,907] Trial 2219 finished with value: 0.4451055933243054 and parameters: {'n_estimators': 939, 'max_depth': 21, 'min_samples_split': 29, 'min_samples_leaf': 1, 'max_features': None, 'bootstrap': False, 'criterion': 'absolute_error'}. Best is trial 341 with value: 0.2909369124469028.
[I 2024-12-04 12:26:46,953] Trial 2422 finished with value: 0.3054961852827269 and parameters: {'n_estimators': 155, 'max_depth': 42, 'min_samples_split': 2, 'min_samples_leaf': 1, 'max_features': 'sqrt', 'bootstrap': False, 'criterion': 'squared_error'}. Best is trial 341 with value: 0.2909369124469028.
[I 2024-12-04 12:26:49,549] Trial 2420 finished with value: 0.30564918944896663 and parameters: {'n_estimators': 234, 'max_depth': 44, 'min_samples_split': 2, 'min_samples_leaf': 1, 'max_features': 'sqrt', 'bootstrap': False, 'criterion': 'squared_error'}. Best is trial 341 with value: 0.2909369124469028.
[I 2024-12-04 12:26:50,008] Trial 2424 finished with value: 0.30102701401919096 and parameters: {'n_estimators': 778, 'max_depth': 50, 'min_samples_split': 4, 'min_samples_leaf': 1, 'max_features': 'sqrt', 'bootstrap': False, 'criterion': 'squared_error'}. Best is trial 341 with value: 0.2909369124469028.
[I 2024-12-04 12:26:50,357] Trial 2427 finished with value: 0.44278304168048327 and parameters: {'n_estimators': 509, 'max_depth': 43, 'min_samples_split': 3, 'min_samples_leaf': 2, 'max_features': 'sqrt', 'bootstrap': False, 'criterion': 'squared_error'}. Best is trial 341 with value: 0.2909369124469028.
[I 2024-12-04 12:26:50,701] Trial 2419 finished with value: 0.4943680006995801 and parameters: {'n_estimators': 101, 'max_depth': 33, 'min_samples_split': 27, 'min_samples_leaf': 2, 'max_features': 'sqrt', 'bootstrap': False, 'criterion': 'absolute_error'}. Best is trial 341 with value: 0.2909369124469028.
[I 2024-12-04 12:26:50,718] Trial 2428 finished with value: 0.326241640017996 and parameters: {'n_estimators': 305, 'max_depth': 35, 'min_samples_split': 3, 'min_samples_leaf': 1, 'max_features': 'sqrt', 'bootstrap': False, 'criterion': 'squared_error'}. Best is trial 341 with value: 0.2909369124469028.
[I 2024-12-04 12:26:51,699] Trial 2421 finished with value: 0.30914614500214355 and parameters: {'n_estimators': 153, 'max_depth': 42, 'min_samples_split': 4, 'min_samples_leaf': 1, 'max_features': 'sqrt', 'bootstrap': False, 'criterion': 'squared_error'}. Best is trial 341 with value: 0.2909369124469028.
[I 2024-12-04 12:26:51,997] Trial 2431 finished with value: 0.2951716014168749 and parameters: {'n_estimators': 264, 'max_depth': 50, 'min_samples_split': 3, 'min_samples_leaf': 1, 'max_features': 'sqrt', 'bootstrap': False, 'criterion': 'squared_error'}. Best is trial 341 with value: 0.2909369124469028.
