[I 2024-12-03 18:43:33,891] Trial 739 finished with value: 0.5532619414253418 and parameters: {'kernel': 'rbf', 'C': 15.086452362848489, 'gamma': 0.00816919936410895, 'epsilon': 0.19956845684350483}. Best is trial 482 with value: 0.4491649651596098.
[I 2024-12-03 18:43:34,070] Trial 753 finished with value: 0.4981689227641654 and parameters: {'kernel': 'rbf', 'C': 21.485165688501155, 'gamma': 0.04423517791164133, 'epsilon': 0.0856183120713586}. Best is trial 482 with value: 0.4491649651596098.
[I 2024-12-03 18:43:34,344] Trial 749 finished with value: 0.5256131512051524 and parameters: {'kernel': 'rbf', 'C': 66.35340104213843, 'gamma': 0.004711378368042037, 'epsilon': 0.0320443734705437}. Best is trial 482 with value: 0.4491649651596098.
[I 2024-12-03 18:43:34,739] Trial 761 finished with value: 0.5306306416673593 and parameters: {'kernel': 'rbf', 'C': 16.616652864594176, 'gamma': 0.01117100281038962, 'epsilon': 0.056103554194195784}. Best is trial 482 with value: 0.4491649651596098.
[I 2024-12-03 18:43:34,793] Trial 737 finished with value: 0.5691731650508262 and parameters: {'kernel': 'rbf', 'C': 17.995818297810942, 'gamma': 0.005913697037074508, 'epsilon': 0.01932283809277325}. Best is trial 482 with value: 0.4491649651596098.
[I 2024-12-03 18:43:34,964] Trial 758 finished with value: 1.0990825776368107 and parameters: {'kernel': 'poly', 'C': 83.6464234891682, 'gamma': 0.0012356571056477412, 'epsilon': 0.047658551782368656}. Best is trial 482 with value: 0.4491649651596098.
[I 2024-12-03 18:43:35,090] Trial 752 finished with value: 0.5008836207437464 and parameters: {'kernel': 'rbf', 'C': 98.64625177851707, 'gamma': 0.00513996802630518, 'epsilon': 0.09590660997498356}. Best is trial 482 with value: 0.4491649651596098.
[I 2024-12-03 18:43:35,346] Trial 750 finished with value: 0.553026833562851 and parameters: {'kernel': 'rbf', 'C': 15.492110338778211, 'gamma': 0.008163636721250806, 'epsilon': 0.02523039357242153}. Best is trial 482 with value: 0.4491649651596098.
[I 2024-12-03 18:43:35,736] Trial 745 finished with value: 0.8523957566022983 and parameters: {'kernel': 'poly', 'C': 68.74978246391352, 'gamma': 0.013325896709372979, 'epsilon': 0.3304156432682758}. Best is trial 482 with value: 0.4491649651596098.
[I 2024-12-03 18:43:36,035] Trial 759 finished with value: 0.5595409881115844 and parameters: {'kernel': 'linear', 'C': 9.900272993097726, 'gamma': 0.013463632611619479, 'epsilon': 0.030112529916081886}. Best is trial 482 with value: 0.4491649651596098.
[I 2024-12-03 18:43:36,145] Trial 762 finished with value: 0.46047629832997594 and parameters: {'kernel': 'rbf', 'C': 92.84888169382312, 'gamma': 0.012864056423606924, 'epsilon': 0.02219478801394262}. Best is trial 482 with value: 0.4491649651596098.
[I 2024-12-03 18:43:36,542] Trial 756 finished with value: 0.6017034173699688 and parameters: {'kernel': 'rbf', 'C': 94.82996040956947, 'gamma': 0.04502118073702424, 'epsilon': 0.03401322042484247}. Best is trial 482 with value: 0.4491649651596098.
[I 2024-12-03 18:43:37,198] Trial 757 finished with value: 0.5099241568444834 and parameters: {'kernel': 'rbf', 'C': 83.52171254635182, 'gamma': 0.005044462429440151, 'epsilon': 0.03310471552265957}. Best is trial 482 with value: 0.4491649651596098.
[I 2024-12-03 18:43:37,644] Trial 755 finished with value: 0.5507444316616994 and parameters: {'kernel': 'rbf', 'C': 95.39263970220591, 'gamma': 0.0029026914272283003, 'epsilon': 0.008754081017447183}. Best is trial 482 with value: 0.4491649651596098.
[I 2024-12-03 18:43:38,203] Trial 769 finished with value: 0.46491640600810036 and parameters: {'kernel': 'rbf', 'C': 90.44219648253913, 'gamma': 0.019637038207190004, 'epsilon': 0.031148878803754543}. Best is trial 482 with value: 0.4491649651596098.
[I 2024-12-03 18:43:38,633] Trial 764 finished with value: 0.5710747928881674 and parameters: {'kernel': 'rbf', 'C': 14.660743763675864, 'gamma': 0.005654583669835925, 'epsilon': 0.08869788648033833}. Best is trial 482 with value: 0.4491649651596098.
[I 2024-12-03 18:43:39,474] Trial 767 finished with value: 0.4832393056616571 and parameters: {'kernel': 'rbf', 'C': 15.389701071462431, 'gamma': 0.021088182257105122, 'epsilon': 0.05601223676176554}. Best is trial 482 with value: 0.4491649651596098.
[I 2024-12-03 18:43:39,922] Trial 768 finished with value: 1.2952019531909729 and parameters: {'kernel': 'rbf', 'C': 0.12592534172093975, 'gamma': 0.8242946249744703, 'epsilon': 0.0037867287924439066}. Best is trial 482 with value: 0.4491649651596098.
[I 2024-12-03 18:43:40,063] Trial 771 finished with value: 0.5320215182305238 and parameters: {'kernel': 'rbf', 'C': 93.65551948430604, 'gamma': 0.02781664381334199, 'epsilon': 0.10547177745793562}. Best is trial 482 with value: 0.4491649651596098.
[I 2024-12-03 18:43:40,709] Trial 765 finished with value: 0.4728216455097669 and parameters: {'kernel': 'rbf', 'C': 66.77563861875456, 'gamma': 0.010126317105391181, 'epsilon': 0.06649511169750763}. Best is trial 482 with value: 0.4491649651596098.
[I 2024-12-03 18:43:41,924] Trial 772 finished with value: 0.45812440390637993 and parameters: {'kernel': 'rbf', 'C': 48.43724801652748, 'gamma': 0.016211074839031024, 'epsilon': 0.08089445307257014}. Best is trial 482 with value: 0.4491649651596098.
[I 2024-12-03 18:43:42,406] Trial 776 finished with value: 0.49031653157192523 and parameters: {'kernel': 'rbf', 'C': 13.585843810340092, 'gamma': 0.023368411600301627, 'epsilon': 0.012084175498358144}. Best is trial 482 with value: 0.4491649651596098.
[I 2024-12-03 18:43:42,656] Trial 782 finished with value: 0.4842752942560212 and parameters: {'kernel': 'rbf', 'C': 99.283965157774, 'gamma': 0.023620698254736987, 'epsilon': 0.053771217329270156}. Best is trial 482 with value: 0.4491649651596098.
[I 2024-12-03 18:43:42,816] Trial 763 finished with value: 0.6449301678656226 and parameters: {'kernel': 'linear', 'C': 3.432159871132322, 'gamma': 0.00022823275263589705, 'epsilon': 0.8139112641256038}. Best is trial 482 with value: 0.4491649651596098.
[I 2024-12-03 18:43:42,866] Trial 775 finished with value: 0.47846580457750415 and parameters: {'kernel': 'rbf', 'C': 80.35449600725485, 'gamma': 0.008611143859827518, 'epsilon': 0.030185929956001757}. Best is trial 482 with value: 0.4491649651596098.
[I 2024-12-03 18:43:43,389] Trial 779 finished with value: 1.0337674235555898 and parameters: {'kernel': 'poly', 'C': 96.23078729434968, 'gamma': 0.004759540829736091, 'epsilon': 0.014232053279714526}. Best is trial 482 with value: 0.4491649651596098.
[I 2024-12-03 18:43:43,690] Trial 784 finished with value: 0.45441487868406627 and parameters: {'kernel': 'rbf', 'C': 94.22046190146627, 'gamma': 0.013508591568957451, 'epsilon': 0.04368307781649104}. Best is trial 482 with value: 0.4491649651596098.
[I 2024-12-03 18:43:43,792] Trial 785 finished with value: 0.7134407432698929 and parameters: {'kernel': 'rbf', 'C': 23.71676139279313, 'gamma': 0.0009942273723114855, 'epsilon': 0.05606292232646764}. Best is trial 482 with value: 0.4491649651596098.
[I 2024-12-03 18:43:44,076] Trial 777 finished with value: 0.7060964872505038 and parameters: {'kernel': 'linear', 'C': 0.046983881556360664, 'gamma': 0.02567941017581521, 'epsilon': 0.0011643549931088747}. Best is trial 482 with value: 0.4491649651596098.
[I 2024-12-03 18:43:44,420] Trial 791 finished with value: 0.4975513837845075 and parameters: {'kernel': 'rbf', 'C': 93.69673948224712, 'gamma': 0.005911819821458369, 'epsilon': 0.11997281535708688}. Best is trial 482 with value: 0.4491649651596098.
[I 2024-12-03 18:43:44,629] Trial 773 finished with value: 0.5409737325469025 and parameters: {'kernel': 'rbf', 'C': 17.755217425343893, 'gamma': 0.06797748116760415, 'epsilon': 0.04635145983430152}. Best is trial 482 with value: 0.4491649651596098.
[I 2024-12-03 18:43:44,982] Trial 780 finished with value: 208.778564662094 and parameters: {'kernel': 'sigmoid', 'C': 88.6137770145969, 'gamma': 0.01399944394980602, 'epsilon': 0.12011460478630293}. Best is trial 482 with value: 0.4491649651596098.
[I 2024-12-03 18:43:45,018] Trial 766 finished with value: 1.1268839559289558 and parameters: {'kernel': 'poly', 'C': 0.08900815981898338, 'gamma': 0.4760590411603447, 'epsilon': 0.5218811677602828}. Best is trial 482 with value: 0.4491649651596098.
[I 2024-12-03 18:43:45,023] Trial 789 finished with value: 0.4648958156948387 and parameters: {'kernel': 'rbf', 'C': 92.05721289582291, 'gamma': 0.02000445606574476, 'epsilon': 0.020744048228112214}. Best is trial 482 with value: 0.4491649651596098.
[I 2024-12-03 18:43:45,074] Trial 783 finished with value: 0.5347586555370344 and parameters: {'kernel': 'rbf', 'C': 17.516965024043756, 'gamma': 0.00977450920627451, 'epsilon': 0.0695702034615771}. Best is trial 482 with value: 0.4491649651596098.
[I 2024-12-03 18:43:45,642] Trial 656 finished with value: 1.0494183665086456 and parameters: {'kernel': 'poly', 'C': 56.401035236577755, 'gamma': 0.18913055134568607, 'epsilon': 0.07452951071090755}. Best is trial 482 with value: 0.4491649651596098.
[I 2024-12-03 18:43:45,685] Trial 792 finished with value: 0.48702881348851385 and parameters: {'kernel': 'rbf', 'C': 94.80242879357834, 'gamma': 0.024692273696768324, 'epsilon': 0.052225196226246905}. Best is trial 482 with value: 0.4491649651596098.
[I 2024-12-03 18:43:45,691] Trial 770 finished with value: 0.5355642438894567 and parameters: {'kernel': 'rbf', 'C': 14.927327609189227, 'gamma': 0.010613930595848678, 'epsilon': 0.05209788044258517}. Best is trial 482 with value: 0.4491649651596098.
[I 2024-12-03 18:43:46,141] Trial 795 finished with value: 0.5998308118590365 and parameters: {'kernel': 'rbf', 'C': 16.329991499061908, 'gamma': 0.0032920862844563383, 'epsilon': 0.2700665013688589}. Best is trial 482 with value: 0.4491649651596098.
[I 2024-12-03 18:43:46,213] Trial 774 finished with value: 0.6532180494987941 and parameters: {'kernel': 'rbf', 'C': 96.95211955354226, 'gamma': 0.06724940838390223, 'epsilon': 0.06013276590966844}. Best is trial 482 with value: 0.4491649651596098.
[I 2024-12-03 18:43:46,271] Trial 786 finished with value: 0.49772139749112126 and parameters: {'kernel': 'rbf', 'C': 97.67727733780148, 'gamma': 0.004971171155702603, 'epsilon': 0.07321997265060697}. Best is trial 482 with value: 0.4491649651596098.
[I 2024-12-03 18:43:46,813] Trial 794 finished with value: 0.5850772102514468 and parameters: {'kernel': 'linear', 'C': 76.39762953736465, 'gamma': 0.0009902100217468305, 'epsilon': 0.1550651176612453}. Best is trial 482 with value: 0.4491649651596098.
[I 2024-12-03 18:43:47,164] Trial 790 finished with value: 0.4612545811172113 and parameters: {'kernel': 'rbf', 'C': 83.88488345692578, 'gamma': 0.010665080656318403, 'epsilon': 0.0639515737840887}. Best is trial 482 with value: 0.4491649651596098.
[I 2024-12-03 18:43:47,928] Trial 788 finished with value: 96.41594957638416 and parameters: {'kernel': 'sigmoid', 'C': 7.621056138687344, 'gamma': 0.2009144039016118, 'epsilon': 0.0021663868816840753}. Best is trial 482 with value: 0.4491649651596098.
[I 2024-12-03 18:43:48,993] Trial 796 finished with value: 0.5227008316739634 and parameters: {'kernel': 'rbf', 'C': 86.69993743481216, 'gamma': 0.013403385821402563, 'epsilon': 0.3024785515909057}. Best is trial 482 with value: 0.4491649651596098.
[I 2024-12-03 18:43:49,067] Trial 778 finished with value: 1.0163138899224866 and parameters: {'kernel': 'poly', 'C': 0.527740146380602, 'gamma': 0.6570596204703074, 'epsilon': 0.04267738159911376}. Best is trial 482 with value: 0.4491649651596098.
[I 2024-12-03 18:43:49,365] Trial 800 finished with value: 0.44984353532732557 and parameters: {'kernel': 'rbf', 'C': 85.28526634673929, 'gamma': 0.013925085737428542, 'epsilon': 0.07250506055499813}. Best is trial 482 with value: 0.4491649651596098.
[I 2024-12-03 18:43:49,865] Trial 797 finished with value: 0.4689007269240192 and parameters: {'kernel': 'rbf', 'C': 94.66690939893246, 'gamma': 0.010310761017867058, 'epsilon': 0.008863646299690326}. Best is trial 482 with value: 0.4491649651596098.
[I 2024-12-03 18:43:50,206] Trial 804 finished with value: 1.017788744477569 and parameters: {'kernel': 'poly', 'C': 46.75726103205072, 'gamma': 0.005984698634571937, 'epsilon': 0.05555303924435451}. Best is trial 482 with value: 0.4491649651596098.
[I 2024-12-03 18:43:50,282] Trial 793 finished with value: 0.44947104463648024 and parameters: {'kernel': 'rbf', 'C': 89.27604429836182, 'gamma': 0.013922480052952066, 'epsilon': 0.06995924195555145}. Best is trial 482 with value: 0.4491649651596098.
[I 2024-12-03 18:43:50,911] Trial 787 finished with value: 0.5535622628849886 and parameters: {'kernel': 'rbf', 'C': 23.634822472773674, 'gamma': 0.005712029657475434, 'epsilon': 0.0576407571030626}. Best is trial 482 with value: 0.4491649651596098.
[I 2024-12-03 18:43:51,223] Trial 805 finished with value: 1.3244151334963687 and parameters: {'kernel': 'rbf', 'C': 0.0020142488336252614, 'gamma': 0.02030679731703041, 'epsilon': 0.29462464170078945}. Best is trial 482 with value: 0.4491649651596098.
[I 2024-12-03 18:43:51,234] Trial 803 finished with value: 0.47329780399839233 and parameters: {'kernel': 'rbf', 'C': 90.5564293609348, 'gamma': 0.008459361296293724, 'epsilon': 0.0443867588580032}. Best is trial 482 with value: 0.4491649651596098.
[I 2024-12-03 18:43:51,506] Trial 801 finished with value: 1.2274407058338102 and parameters: {'kernel': 'rbf', 'C': 1.1302926514886955, 'gamma': 0.00011004692780157711, 'epsilon': 0.11814646278584452}. Best is trial 482 with value: 0.4491649651596098.
[I 2024-12-03 18:43:51,673] Trial 807 finished with value: 0.5620849393521028 and parameters: {'kernel': 'rbf', 'C': 15.205321095023281, 'gamma': 0.007070723970179507, 'epsilon': 0.029057563791953428}. Best is trial 482 with value: 0.4491649651596098.
[I 2024-12-03 18:43:51,677] Trial 781 finished with value: 0.5671099797456748 and parameters: {'kernel': 'linear', 'C': 88.77653355559173, 'gamma': 0.015532032405024057, 'epsilon': 0.054053610260330925}. Best is trial 482 with value: 0.4491649651596098.
[I 2024-12-03 18:43:51,916] Trial 799 finished with value: 0.5365405960388928 and parameters: {'kernel': 'rbf', 'C': 22.537774620167117, 'gamma': 0.008576004450543207, 'epsilon': 0.016627005674284854}. Best is trial 482 with value: 0.4491649651596098.
[I 2024-12-03 18:43:51,922] Trial 808 finished with value: 0.5553035644364162 and parameters: {'kernel': 'rbf', 'C': 13.501872177196407, 'gamma': 0.07893077776690718, 'epsilon': 0.12376345163933673}. Best is trial 482 with value: 0.4491649651596098.
[I 2024-12-03 18:43:52,491] Trial 802 finished with value: 0.7507509066940411 and parameters: {'kernel': 'poly', 'C': 0.004376646918319794, 'gamma': 0.9456830506772825, 'epsilon': 0.09252530776924608}. Best is trial 482 with value: 0.4491649651596098.
[I 2024-12-03 18:43:52,773] Trial 798 finished with value: 0.4866935799516336 and parameters: {'kernel': 'rbf', 'C': 19.587811996960973, 'gamma': 0.03494973020447789, 'epsilon': 0.16149611903915745}. Best is trial 482 with value: 0.4491649651596098.
[I 2024-12-03 18:43:52,960] Trial 806 finished with value: 0.5378545163323459 and parameters: {'kernel': 'rbf', 'C': 94.81026716018957, 'gamma': 0.02950505743724216, 'epsilon': 0.09542599676685132}. Best is trial 482 with value: 0.4491649651596098.
[I 2024-12-03 18:43:53,399] Trial 816 finished with value: 26.51766903937083 and parameters: {'kernel': 'sigmoid', 'C': 4.203424477279334, 'gamma': 0.04315899051729856, 'epsilon': 0.05321807971537326}. Best is trial 482 with value: 0.4491649651596098.
[I 2024-12-03 18:43:53,400] Trial 813 finished with value: 0.8599276401311459 and parameters: {'kernel': 'rbf', 'C': 0.7613398698458627, 'gamma': 0.36785408585073265, 'epsilon': 0.029415176325620674}. Best is trial 482 with value: 0.4491649651596098.
[I 2024-12-03 18:43:53,844] Trial 812 finished with value: 0.5389931275391844 and parameters: {'kernel': 'rbf', 'C': 21.58997687810784, 'gamma': 0.009313520330921234, 'epsilon': 0.14144633757253686}. Best is trial 482 with value: 0.4491649651596098.
[I 2024-12-03 18:43:54,213] Trial 810 finished with value: 0.4635305076816711 and parameters: {'kernel': 'rbf', 'C': 23.8592131066016, 'gamma': 0.021313377345459746, 'epsilon': 0.10874863455142096}. Best is trial 482 with value: 0.4491649651596098.
[I 2024-12-03 18:43:54,322] Trial 814 finished with value: 0.4899225676304885 and parameters: {'kernel': 'rbf', 'C': 98.34190390228407, 'gamma': 0.0064591192216095624, 'epsilon': 0.09397653027606626}. Best is trial 482 with value: 0.4491649651596098.
[I 2024-12-03 18:43:55,045] Trial 809 finished with value: 0.5312717908096509 and parameters: {'kernel': 'rbf', 'C': 89.50666719351499, 'gamma': 0.026316562884762713, 'epsilon': 0.12924393035929913}. Best is trial 482 with value: 0.4491649651596098.
[I 2024-12-03 18:43:56,441] Trial 821 finished with value: 0.6043714766173415 and parameters: {'kernel': 'rbf', 'C': 92.42750898152723, 'gamma': 0.04629874542712761, 'epsilon': 0.03836512555750039}. Best is trial 482 with value: 0.4491649651596098.
[I 2024-12-03 18:43:56,604] Trial 818 finished with value: 0.45965598753288434 and parameters: {'kernel': 'rbf', 'C': 27.97475568429141, 'gamma': 0.02424190969251058, 'epsilon': 0.04491832019089606}. Best is trial 482 with value: 0.4491649651596098.
[I 2024-12-03 18:43:56,606] Trial 822 finished with value: 0.6267861991053181 and parameters: {'kernel': 'rbf', 'C': 54.638212608262776, 'gamma': 0.13568732776024967, 'epsilon': 0.4464486108263017}. Best is trial 482 with value: 0.4491649651596098.
[I 2024-12-03 18:43:56,866] Trial 811 finished with value: 0.6382874801887846 and parameters: {'kernel': 'rbf', 'C': 16.343070604666597, 'gamma': 0.002677101090055141, 'epsilon': 0.035687930475571845}. Best is trial 482 with value: 0.4491649651596098.
[I 2024-12-03 18:43:57,271] Trial 817 finished with value: 0.5959691709297249 and parameters: {'kernel': 'rbf', 'C': 98.37432401648883, 'gamma': 0.0007660115141685643, 'epsilon': 0.11085774800125225}. Best is trial 482 with value: 0.4491649651596098.
[I 2024-12-03 18:43:57,469] Trial 819 finished with value: 0.44986232862365183 and parameters: {'kernel': 'rbf', 'C': 85.05831653040669, 'gamma': 0.014299995955488178, 'epsilon': 0.07145688594353068}. Best is trial 482 with value: 0.4491649651596098.
[I 2024-12-03 18:43:57,812] Trial 815 finished with value: 1.3614578161485669 and parameters: {'kernel': 'sigmoid', 'C': 0.0011756217963773878, 'gamma': 0.08238375571156126, 'epsilon': 0.005925613069659105}. Best is trial 482 with value: 0.4491649651596098.
[I 2024-12-03 18:43:58,224] Trial 823 finished with value: 0.4743708821394274 and parameters: {'kernel': 'rbf', 'C': 17.321847683470136, 'gamma': 0.02483388303293256, 'epsilon': 0.06537209465326604}. Best is trial 482 with value: 0.4491649651596098.
[I 2024-12-03 18:43:58,438] Trial 820 finished with value: 0.4708248736208877 and parameters: {'kernel': 'rbf', 'C': 15.921612471040866, 'gamma': 0.025625456405630142, 'epsilon': 0.03758691568350921}. Best is trial 482 with value: 0.4491649651596098.
[I 2024-12-03 18:43:59,753] Trial 834 finished with value: 0.7614984527739662 and parameters: {'kernel': 'rbf', 'C': 1.3479146754741926, 'gamma': 0.00816764451859138, 'epsilon': 0.09091468499174561}. Best is trial 482 with value: 0.4491649651596098.
[I 2024-12-03 18:44:00,129] Trial 830 finished with value: 0.5543591419348074 and parameters: {'kernel': 'rbf', 'C': 23.906586253769046, 'gamma': 0.005441040116094541, 'epsilon': 0.09010819463570498}. Best is trial 482 with value: 0.4491649651596098.
[I 2024-12-03 18:44:00,168] Trial 835 finished with value: 0.45649137422235303 and parameters: {'kernel': 'rbf', 'C': 82.53378936680578, 'gamma': 0.01548691558452858, 'epsilon': 0.03510245686705833}. Best is trial 482 with value: 0.4491649651596098.
[I 2024-12-03 18:44:00,780] Trial 824 finished with value: 0.5848917963721086 and parameters: {'kernel': 'linear', 'C': 15.608324841226251, 'gamma': 0.028822315023375053, 'epsilon': 0.16807481196030727}. Best is trial 482 with value: 0.4491649651596098.
[I 2024-12-03 18:44:00,864] Trial 826 finished with value: 0.4839232049576051 and parameters: {'kernel': 'rbf', 'C': 98.35765038270087, 'gamma': 0.017878325175218167, 'epsilon': 0.12139921626938555}. Best is trial 482 with value: 0.4491649651596098.
[I 2024-12-03 18:44:01,168] Trial 832 finished with value: 0.46869030712751136 and parameters: {'kernel': 'rbf', 'C': 88.0707727506934, 'gamma': 0.009671994622899062, 'epsilon': 0.05219568630056938}. Best is trial 482 with value: 0.4491649651596098.
[I 2024-12-03 18:44:01,232] Trial 829 finished with value: 0.4798068383100236 and parameters: {'kernel': 'rbf', 'C': 17.10612927826694, 'gamma': 0.04106422703359477, 'epsilon': 0.02810000606791944}. Best is trial 482 with value: 0.4491649651596098.
[I 2024-12-03 18:44:01,547] Trial 836 finished with value: 0.5524929712975528 and parameters: {'kernel': 'rbf', 'C': 13.096510200576489, 'gamma': 0.008786754207608157, 'epsilon': 0.04392423081537253}. Best is trial 482 with value: 0.4491649651596098.
[I 2024-12-03 18:44:01,649] Trial 839 finished with value: 0.5661165047133154 and parameters: {'kernel': 'rbf', 'C': 88.82138906517301, 'gamma': 0.037793621582149106, 'epsilon': 0.04350552348033537}. Best is trial 482 with value: 0.4491649651596098.
[I 2024-12-03 18:44:01,815] Trial 825 finished with value: 0.5636424982241058 and parameters: {'kernel': 'linear', 'C': 3.0163180013317192, 'gamma': 0.12315204081984008, 'epsilon': 0.03447153034067001}. Best is trial 482 with value: 0.4491649651596098.
[I 2024-12-03 18:44:01,869] Trial 831 finished with value: 0.7943501297510919 and parameters: {'kernel': 'rbf', 'C': 5.508234047296425, 'gamma': 0.6588793325648428, 'epsilon': 0.00256228364391823}. Best is trial 482 with value: 0.4491649651596098.
