[I 2024-12-04 00:05:33,398] A new study created in RDB with name: Tc_svr
/zhome/b1/0/88900/miniconda3/envs/critprops/lib/python3.9/site-packages/optuna/_experimental.py:31: ExperimentalWarning: Argument ``multivariate`` is an experimental feature. The interface can change in the future.
  warnings.warn(
/zhome/b1/0/88900/miniconda3/envs/critprops/lib/python3.9/site-packages/optuna/_experimental.py:31: ExperimentalWarning: Argument ``constant_liar`` is an experimental feature. The interface can change in the future.
  warnings.warn(
[I 2024-12-04 00:05:36,352] Trial 4 finished with value: 0.9984889494495958 and parameters: {'kernel': 'poly', 'C': 0.0017305516738677974, 'gamma': 0.00012552196782769735, 'epsilon': 0.7352940827831068}. Best is trial 9 with value: 0.5841171808494275.
/zhome/b1/0/88900/miniconda3/envs/critprops/lib/python3.9/site-packages/optuna/_experimental.py:31: ExperimentalWarning: Argument ``multivariate`` is an experimental feature. The interface can change in the future.
  warnings.warn(
/zhome/b1/0/88900/miniconda3/envs/critprops/lib/python3.9/site-packages/optuna/_experimental.py:31: ExperimentalWarning: Argument ``constant_liar`` is an experimental feature. The interface can change in the future.
  warnings.warn(
[I 2024-12-04 00:05:36,849] Trial 9 finished with value: 0.5841171808494275 and parameters: {'kernel': 'linear', 'C': 0.002570007021383046, 'gamma': 0.0023316345472710336, 'epsilon': 0.0029707962188584877}. Best is trial 2 with value: 0.29792121112755227.
/zhome/b1/0/88900/miniconda3/envs/critprops/lib/python3.9/site-packages/optuna/_experimental.py:31: ExperimentalWarning: Argument ``multivariate`` is an experimental feature. The interface can change in the future.
  warnings.warn(
/zhome/b1/0/88900/miniconda3/envs/critprops/lib/python3.9/site-packages/optuna/_experimental.py:31: ExperimentalWarning: Argument ``constant_liar`` is an experimental feature. The interface can change in the future.
  warnings.warn(
[I 2024-12-04 00:05:36,995] Trial 1 finished with value: 0.8308028331572495 and parameters: {'kernel': 'poly', 'C': 0.002365483854979007, 'gamma': 0.046913426969295464, 'epsilon': 0.005281982856699909}. Best is trial 2 with value: 0.29792121112755227.
[I 2024-12-04 00:05:37,058] Trial 2 finished with value: 0.29792121112755227 and parameters: {'kernel': 'linear', 'C': 2.0350348689006923, 'gamma': 0.013478103369979675, 'epsilon': 0.17905141732908306}. Best is trial 2 with value: 0.29792121112755227.
[I 2024-12-04 00:05:37,062] Trial 12 finished with value: 0.9621704064815777 and parameters: {'kernel': 'poly', 'C': 25.15484188323258, 'gamma': 0.0002515146935403878, 'epsilon': 0.3237539993454453}. Best is trial 2 with value: 0.29792121112755227.
/zhome/b1/0/88900/miniconda3/envs/critprops/lib/python3.9/site-packages/optuna/_experimental.py:31: ExperimentalWarning: Argument ``multivariate`` is an experimental feature. The interface can change in the future.
  warnings.warn(
/zhome/b1/0/88900/miniconda3/envs/critprops/lib/python3.9/site-packages/optuna/_experimental.py:31: ExperimentalWarning: Argument ``constant_liar`` is an experimental feature. The interface can change in the future.
  warnings.warn(
/zhome/b1/0/88900/miniconda3/envs/critprops/lib/python3.9/site-packages/optuna/_experimental.py:31: ExperimentalWarning: Argument ``multivariate`` is an experimental feature. The interface can change in the future.
  warnings.warn(
/zhome/b1/0/88900/miniconda3/envs/critprops/lib/python3.9/site-packages/optuna/_experimental.py:31: ExperimentalWarning: Argument ``constant_liar`` is an experimental feature. The interface can change in the future.
  warnings.warn(
[I 2024-12-04 00:05:37,422] Trial 6 finished with value: 0.560357125003195 and parameters: {'kernel': 'rbf', 'C': 0.7765633535121883, 'gamma': 0.0010783764598982107, 'epsilon': 0.008015766674178689}. Best is trial 2 with value: 0.29792121112755227.
/zhome/b1/0/88900/miniconda3/envs/critprops/lib/python3.9/site-packages/optuna/_experimental.py:31: ExperimentalWarning: Argument ``multivariate`` is an experimental feature. The interface can change in the future.
  warnings.warn(
/zhome/b1/0/88900/miniconda3/envs/critprops/lib/python3.9/site-packages/optuna/_experimental.py:31: ExperimentalWarning: Argument ``constant_liar`` is an experimental feature. The interface can change in the future.
  warnings.warn(
[I 2024-12-04 00:05:37,885] Trial 10 finished with value: 0.9317429901582839 and parameters: {'kernel': 'poly', 'C': 0.0023210021286700407, 'gamma': 0.013677971016507123, 'epsilon': 0.00260822286039392}. Best is trial 2 with value: 0.29792121112755227.
[I 2024-12-04 00:05:38,063] Trial 15 finished with value: 0.3804109023036274 and parameters: {'kernel': 'rbf', 'C': 13.977169026824917, 'gamma': 0.0007734809229721275, 'epsilon': 0.0039038985599064704}. Best is trial 2 with value: 0.29792121112755227.
/zhome/b1/0/88900/miniconda3/envs/critprops/lib/python3.9/site-packages/optuna/_experimental.py:31: ExperimentalWarning: Argument ``multivariate`` is an experimental feature. The interface can change in the future.
  warnings.warn(
/zhome/b1/0/88900/miniconda3/envs/critprops/lib/python3.9/site-packages/optuna/_experimental.py:31: ExperimentalWarning: Argument ``constant_liar`` is an experimental feature. The interface can change in the future.
  warnings.warn(
[I 2024-12-04 00:05:38,326] Trial 0 finished with value: 0.446542247835683 and parameters: {'kernel': 'linear', 'C': 0.5182342610242031, 'gamma': 0.003046827958908765, 'epsilon': 0.8276718249743404}. Best is trial 2 with value: 0.29792121112755227.
[I 2024-12-04 00:05:38,329] Trial 18 finished with value: 0.8968282597962977 and parameters: {'kernel': 'rbf', 'C': 0.2097969210937665, 'gamma': 0.8099293304630323, 'epsilon': 0.8494718670491641}. Best is trial 2 with value: 0.29792121112755227.
[I 2024-12-04 00:05:38,462] Trial 11 finished with value: 0.5724917384478281 and parameters: {'kernel': 'rbf', 'C': 5.8260633402587905, 'gamma': 0.0001643595360843699, 'epsilon': 0.19119832841276857}. Best is trial 2 with value: 0.29792121112755227.
[I 2024-12-04 00:05:38,564] Trial 8 finished with value: 1.2419039905838167 and parameters: {'kernel': 'sigmoid', 'C': 1.6454729616138764, 'gamma': 0.0014530900764465314, 'epsilon': 0.41291570234901964}. Best is trial 2 with value: 0.29792121112755227.
/zhome/b1/0/88900/miniconda3/envs/critprops/lib/python3.9/site-packages/optuna/_experimental.py:31: ExperimentalWarning: Argument ``multivariate`` is an experimental feature. The interface can change in the future.
  warnings.warn(
/zhome/b1/0/88900/miniconda3/envs/critprops/lib/python3.9/site-packages/optuna/_experimental.py:31: ExperimentalWarning: Argument ``constant_liar`` is an experimental feature. The interface can change in the future.
  warnings.warn(
[I 2024-12-04 00:05:38,849] Trial 14 finished with value: 0.9926339207327246 and parameters: {'kernel': 'rbf', 'C': 0.0018482626559817635, 'gamma': 0.0005595396607066715, 'epsilon': 0.0010357022343151657}. Best is trial 2 with value: 0.29792121112755227.
/zhome/b1/0/88900/miniconda3/envs/critprops/lib/python3.9/site-packages/optuna/_experimental.py:31: ExperimentalWarning: Argument ``multivariate`` is an experimental feature. The interface can change in the future.
  warnings.warn(
/zhome/b1/0/88900/miniconda3/envs/critprops/lib/python3.9/site-packages/optuna/_experimental.py:31: ExperimentalWarning: Argument ``constant_liar`` is an experimental feature. The interface can change in the future.
  warnings.warn(
/zhome/b1/0/88900/miniconda3/envs/critprops/lib/python3.9/site-packages/optuna/_experimental.py:31: ExperimentalWarning: Argument ``multivariate`` is an experimental feature. The interface can change in the future.
  warnings.warn(
/zhome/b1/0/88900/miniconda3/envs/critprops/lib/python3.9/site-packages/optuna/_experimental.py:31: ExperimentalWarning: Argument ``constant_liar`` is an experimental feature. The interface can change in the future.
  warnings.warn(
/zhome/b1/0/88900/miniconda3/envs/critprops/lib/python3.9/site-packages/optuna/_experimental.py:31: ExperimentalWarning: Argument ``multivariate`` is an experimental feature. The interface can change in the future.
  warnings.warn(
/zhome/b1/0/88900/miniconda3/envs/critprops/lib/python3.9/site-packages/optuna/_experimental.py:31: ExperimentalWarning: Argument ``constant_liar`` is an experimental feature. The interface can change in the future.
  warnings.warn(
/zhome/b1/0/88900/miniconda3/envs/critprops/lib/python3.9/site-packages/optuna/_experimental.py:31: ExperimentalWarning: Argument ``multivariate`` is an experimental feature. The interface can change in the future.
  warnings.warn(
/zhome/b1/0/88900/miniconda3/envs/critprops/lib/python3.9/site-packages/optuna/_experimental.py:31: ExperimentalWarning: Argument ``constant_liar`` is an experimental feature. The interface can change in the future.
  warnings.warn(
[I 2024-12-04 00:05:40,514] Trial 21 finished with value: 0.41269263729516764 and parameters: {'kernel': 'rbf', 'C': 33.79669716003184, 'gamma': 0.2921949708644715, 'epsilon': 0.09883177924467615}. Best is trial 2 with value: 0.29792121112755227.
[I 2024-12-04 00:05:41,001] Trial 25 finished with value: 0.2436133862735644 and parameters: {'kernel': 'rbf', 'C': 46.56144786507905, 'gamma': 0.001947560494145801, 'epsilon': 0.0028639857034164057}. Best is trial 25 with value: 0.2436133862735644.
[I 2024-12-04 00:05:41,006] Trial 22 finished with value: 0.4356426720077719 and parameters: {'kernel': 'rbf', 'C': 9.933649149213974, 'gamma': 0.0006224924539948402, 'epsilon': 0.0011078892395202213}. Best is trial 25 with value: 0.2436133862735644.
/zhome/b1/0/88900/miniconda3/envs/critprops/lib/python3.9/site-packages/optuna/_experimental.py:31: ExperimentalWarning: Argument ``multivariate`` is an experimental feature. The interface can change in the future.
  warnings.warn(
/zhome/b1/0/88900/miniconda3/envs/critprops/lib/python3.9/site-packages/optuna/_experimental.py:31: ExperimentalWarning: Argument ``constant_liar`` is an experimental feature. The interface can change in the future.
  warnings.warn(
/zhome/b1/0/88900/miniconda3/envs/critprops/lib/python3.9/site-packages/optuna/_experimental.py:31: ExperimentalWarning: Argument ``multivariate`` is an experimental feature. The interface can change in the future.
  warnings.warn(
/zhome/b1/0/88900/miniconda3/envs/critprops/lib/python3.9/site-packages/optuna/_experimental.py:31: ExperimentalWarning: Argument ``constant_liar`` is an experimental feature. The interface can change in the future.
  warnings.warn(
/zhome/b1/0/88900/miniconda3/envs/critprops/lib/python3.9/site-packages/optuna/_experimental.py:31: ExperimentalWarning: Argument ``multivariate`` is an experimental feature. The interface can change in the future.
  warnings.warn(
/zhome/b1/0/88900/miniconda3/envs/critprops/lib/python3.9/site-packages/optuna/_experimental.py:31: ExperimentalWarning: Argument ``constant_liar`` is an experimental feature. The interface can change in the future.
  warnings.warn(
[I 2024-12-04 00:05:41,466] Trial 29 finished with value: 0.37548431873866867 and parameters: {'kernel': 'linear', 'C': 0.07229131475132926, 'gamma': 0.032554063573636154, 'epsilon': 0.09809637196138883}. Best is trial 25 with value: 0.2436133862735644.
/zhome/b1/0/88900/miniconda3/envs/critprops/lib/python3.9/site-packages/optuna/_experimental.py:31: ExperimentalWarning: Argument ``multivariate`` is an experimental feature. The interface can change in the future.
  warnings.warn(
/zhome/b1/0/88900/miniconda3/envs/critprops/lib/python3.9/site-packages/optuna/_experimental.py:31: ExperimentalWarning: Argument ``constant_liar`` is an experimental feature. The interface can change in the future.
  warnings.warn(
[I 2024-12-04 00:05:41,825] Trial 19 finished with value: 0.4903045992048703 and parameters: {'kernel': 'linear', 'C': 0.01259026174313598, 'gamma': 0.02265791246915651, 'epsilon': 0.07882977938236711}. Best is trial 25 with value: 0.2436133862735644.
[I 2024-12-04 00:05:41,991] Trial 20 finished with value: 0.3572951748611146 and parameters: {'kernel': 'linear', 'C': 0.1276755108608653, 'gamma': 0.0016131821349907585, 'epsilon': 0.027785044204600484}. Best is trial 25 with value: 0.2436133862735644.
[I 2024-12-04 00:05:41,998] Trial 27 finished with value: 0.6277812982979635 and parameters: {'kernel': 'sigmoid', 'C': 55.103585720339176, 'gamma': 0.00017963863885728823, 'epsilon': 0.004390829744782693}. Best is trial 25 with value: 0.2436133862735644.
[I 2024-12-04 00:05:42,006] Trial 24 finished with value: 0.8480156622182946 and parameters: {'kernel': 'poly', 'C': 1.1438775888516244, 'gamma': 0.005056594666057374, 'epsilon': 0.15518544869926681}. Best is trial 25 with value: 0.2436133862735644.
[I 2024-12-04 00:05:42,030] Trial 28 finished with value: 0.7720773212314741 and parameters: {'kernel': 'sigmoid', 'C': 0.2175683948274112, 'gamma': 0.0006249576444008035, 'epsilon': 0.002625377369917712}. Best is trial 25 with value: 0.2436133862735644.
[I 2024-12-04 00:05:42,046] Trial 30 finished with value: 0.616870992017605 and parameters: {'kernel': 'sigmoid', 'C': 40.7822003841538, 'gamma': 0.0001818239390399542, 'epsilon': 0.01533628428761559}. Best is trial 25 with value: 0.2436133862735644.
[I 2024-12-04 00:05:42,403] Trial 32 finished with value: 0.7656778365383317 and parameters: {'kernel': 'poly', 'C': 77.98628985795793, 'gamma': 0.0027698012251260564, 'epsilon': 0.0022445254729207636}. Best is trial 25 with value: 0.2436133862735644.
[I 2024-12-04 00:05:42,508] Trial 16 finished with value: 0.3452666232480422 and parameters: {'kernel': 'linear', 'C': 0.17753983829835776, 'gamma': 0.09703351001941428, 'epsilon': 0.04972150920335952}. Best is trial 25 with value: 0.2436133862735644.
/zhome/b1/0/88900/miniconda3/envs/critprops/lib/python3.9/site-packages/optuna/_experimental.py:31: ExperimentalWarning: Argument ``multivariate`` is an experimental feature. The interface can change in the future.
  warnings.warn(
/zhome/b1/0/88900/miniconda3/envs/critprops/lib/python3.9/site-packages/optuna/_experimental.py:31: ExperimentalWarning: Argument ``constant_liar`` is an experimental feature. The interface can change in the future.
  warnings.warn(
[I 2024-12-04 00:05:42,785] Trial 40 finished with value: 0.9673291251524173 and parameters: {'kernel': 'sigmoid', 'C': 0.0012944136337099056, 'gamma': 0.2855986891306148, 'epsilon': 0.48004261787138863}. Best is trial 37 with value: 0.1794719914982659.
[I 2024-12-04 00:05:42,933] Trial 37 finished with value: 0.1794719914982659 and parameters: {'kernel': 'rbf', 'C': 7.095605833904886, 'gamma': 0.025737534751803303, 'epsilon': 0.0011128994794734675}. Best is trial 37 with value: 0.1794719914982659.
[I 2024-12-04 00:05:43,569] Trial 34 finished with value: 0.3700385736538559 and parameters: {'kernel': 'linear', 'C': 0.07956389196448156, 'gamma': 0.00035782470315509363, 'epsilon': 0.13612086232238238}. Best is trial 37 with value: 0.1794719914982659.
[I 2024-12-04 00:05:43,838] Trial 36 finished with value: 0.3695667564376018 and parameters: {'kernel': 'linear', 'C': 0.08833213572831232, 'gamma': 0.6289544680136658, 'epsilon': 0.0572367725070774}. Best is trial 37 with value: 0.1794719914982659.
[I 2024-12-04 00:05:44,949] Trial 35 finished with value: 0.1878966681678641 and parameters: {'kernel': 'rbf', 'C': 26.396183956540877, 'gamma': 0.040866981007932374, 'epsilon': 0.005483574801502755}. Best is trial 37 with value: 0.1794719914982659.
[I 2024-12-04 00:05:45,123] Trial 39 finished with value: 0.26175789135897976 and parameters: {'kernel': 'rbf', 'C': 2.6544979582550177, 'gamma': 0.01752843536504707, 'epsilon': 0.0012119735135934049}. Best is trial 37 with value: 0.1794719914982659.
[I 2024-12-04 00:05:45,164] Trial 38 finished with value: 0.33460028233928135 and parameters: {'kernel': 'linear', 'C': 1.0668460301764804, 'gamma': 0.0019200089634741871, 'epsilon': 0.053087911491313096}. Best is trial 37 with value: 0.1794719914982659.
[I 2024-12-04 00:05:45,560] Trial 31 finished with value: 0.31262978399097563 and parameters: {'kernel': 'linear', 'C': 3.5694967872096086, 'gamma': 0.022007123451020974, 'epsilon': 0.23394003836480343}. Best is trial 37 with value: 0.1794719914982659.
[I 2024-12-04 00:05:45,671] Trial 42 finished with value: 488.0358336129695 and parameters: {'kernel': 'sigmoid', 'C': 23.0406362741417, 'gamma': 0.02736447017006716, 'epsilon': 0.0011634458064509244}. Best is trial 37 with value: 0.1794719914982659.
[I 2024-12-04 00:05:45,797] Trial 41 finished with value: 317.04997786091326 and parameters: {'kernel': 'sigmoid', 'C': 24.158449329358067, 'gamma': 0.010385613161531908, 'epsilon': 0.017976635700078673}. Best is trial 37 with value: 0.1794719914982659.
[I 2024-12-04 00:05:46,377] Trial 45 finished with value: 0.1983008826180661 and parameters: {'kernel': 'rbf', 'C': 11.969234443354575, 'gamma': 0.05623795678284996, 'epsilon': 0.010430683077056274}. Best is trial 37 with value: 0.1794719914982659.
[I 2024-12-04 00:05:46,431] Trial 52 finished with value: 0.28519504401108126 and parameters: {'kernel': 'rbf', 'C': 0.9114239861418144, 'gamma': 0.04268384904333784, 'epsilon': 0.0019281919841933387}. Best is trial 37 with value: 0.1794719914982659.
[I 2024-12-04 00:05:47,032] Trial 55 finished with value: 0.8102916213923612 and parameters: {'kernel': 'poly', 'C': 0.5894368671896886, 'gamma': 0.009583998837002216, 'epsilon': 0.0012939201575854421}. Best is trial 47 with value: 0.16787505727381305.
[I 2024-12-04 00:05:47,188] Trial 54 finished with value: 0.23790288070782026 and parameters: {'kernel': 'rbf', 'C': 1.9911011064369075, 'gamma': 0.040512147504625, 'epsilon': 0.02033296795185811}. Best is trial 47 with value: 0.16787505727381305.
[I 2024-12-04 00:05:47,198] Trial 48 finished with value: 0.8232491038678316 and parameters: {'kernel': 'poly', 'C': 1.5635397053005886, 'gamma': 0.005910150252131622, 'epsilon': 0.00237147633154376}. Best is trial 47 with value: 0.16787505727381305.
[I 2024-12-04 00:05:47,216] Trial 50 finished with value: 0.2295994995584042 and parameters: {'kernel': 'rbf', 'C': 14.313083477787357, 'gamma': 0.00751747832030996, 'epsilon': 0.00394990133600835}. Best is trial 47 with value: 0.16787505727381305.
[I 2024-12-04 00:05:47,267] Trial 53 finished with value: 0.19566401114980705 and parameters: {'kernel': 'rbf', 'C': 5.0621656084915125, 'gamma': 0.02585661716654052, 'epsilon': 0.01508061699827477}. Best is trial 47 with value: 0.16787505727381305.
[I 2024-12-04 00:05:47,268] Trial 3 finished with value: 0.3160272907431323 and parameters: {'kernel': 'linear', 'C': 49.53814671442238, 'gamma': 0.0023227663814488937, 'epsilon': 0.226972856138125}. Best is trial 47 with value: 0.16787505727381305.
[I 2024-12-04 00:05:47,270] Trial 47 finished with value: 0.16787505727381305 and parameters: {'kernel': 'rbf', 'C': 37.63173751747825, 'gamma': 0.007517737286279187, 'epsilon': 0.0022447529637217747}. Best is trial 47 with value: 0.16787505727381305.
[I 2024-12-04 00:05:47,630] Trial 46 finished with value: 0.20468566655741505 and parameters: {'kernel': 'rbf', 'C': 9.73004895021683, 'gamma': 0.06324133541339107, 'epsilon': 0.025711195909553414}. Best is trial 47 with value: 0.16787505727381305.
[I 2024-12-04 00:05:47,704] Trial 43 finished with value: 0.24998029057067989 and parameters: {'kernel': 'rbf', 'C': 24.46949902446142, 'gamma': 0.11738277486506403, 'epsilon': 0.0021534067780472157}. Best is trial 47 with value: 0.16787505727381305.
[I 2024-12-04 00:05:48,310] Trial 51 finished with value: 0.19075232349239826 and parameters: {'kernel': 'rbf', 'C': 16.570065692574634, 'gamma': 0.04729210044632344, 'epsilon': 0.001598505343072077}. Best is trial 47 with value: 0.16787505727381305.
[I 2024-12-04 00:05:48,883] Trial 56 finished with value: 0.2788491322964143 and parameters: {'kernel': 'rbf', 'C': 39.077494127074324, 'gamma': 0.0011046153391336838, 'epsilon': 0.00810442215431104}. Best is trial 59 with value: 0.15463293808006018.
[I 2024-12-04 00:05:48,955] Trial 59 finished with value: 0.15463293808006018 and parameters: {'kernel': 'rbf', 'C': 94.22694379814973, 'gamma': 0.013804887163411888, 'epsilon': 0.024081983552034326}. Best is trial 59 with value: 0.15463293808006018.
/zhome/b1/0/88900/miniconda3/envs/critprops/lib/python3.9/site-packages/optuna/_experimental.py:31: ExperimentalWarning: Argument ``multivariate`` is an experimental feature. The interface can change in the future.
  warnings.warn(
/zhome/b1/0/88900/miniconda3/envs/critprops/lib/python3.9/site-packages/optuna/_experimental.py:31: ExperimentalWarning: Argument ``constant_liar`` is an experimental feature. The interface can change in the future.
  warnings.warn(
[I 2024-12-04 00:05:49,143] Trial 57 finished with value: 0.4733705403183362 and parameters: {'kernel': 'rbf', 'C': 2.947871687784112, 'gamma': 0.42394512338924, 'epsilon': 0.008728085391833064}. Best is trial 59 with value: 0.15463293808006018.
[I 2024-12-04 00:05:49,231] Trial 64 finished with value: 949.8902550208164 and parameters: {'kernel': 'sigmoid', 'C': 79.75691803874497, 'gamma': 0.008967737346465152, 'epsilon': 0.7277064063887324}. Best is trial 59 with value: 0.15463293808006018.
[I 2024-12-04 00:05:49,703] Trial 62 finished with value: 0.8973720421637034 and parameters: {'kernel': 'rbf', 'C': 0.015113841545954652, 'gamma': 0.28374550057382686, 'epsilon': 0.0033180040465102885}. Best is trial 59 with value: 0.15463293808006018.
[I 2024-12-04 00:05:49,888] Trial 66 finished with value: 27.206949339354626 and parameters: {'kernel': 'sigmoid', 'C': 1.2332869351899896, 'gamma': 0.14164669250744877, 'epsilon': 0.0016005965915784574}. Best is trial 59 with value: 0.15463293808006018.
