[I 2024-12-04 13:46:50,787] Trial 2331 finished with value: 0.30040623557095725 and parameters: {'n_estimators': 1101, 'learning_rate': 0.06735585341939261, 'max_depth': 10, 'min_samples_split': 6, 'min_samples_leaf': 2, 'subsample': 0.7242901363296916, 'max_features': 'sqrt'}. Best is trial 2314 with value: 0.22206050798261862.
[I 2024-12-04 13:46:55,042] Trial 2323 finished with value: 0.2870124137926773 and parameters: {'n_estimators': 1492, 'learning_rate': 0.09326189068093545, 'max_depth': 5, 'min_samples_split': 6, 'min_samples_leaf': 2, 'subsample': 0.7531636250616585, 'max_features': 'sqrt'}. Best is trial 2314 with value: 0.22206050798261862.
[I 2024-12-04 13:46:56,153] Trial 2325 finished with value: 0.471171213131178 and parameters: {'n_estimators': 1450, 'learning_rate': 0.01712962572082469, 'max_depth': 10, 'min_samples_split': 3, 'min_samples_leaf': 7, 'subsample': 0.6068380628451265, 'max_features': 'sqrt'}. Best is trial 2314 with value: 0.22206050798261862.
[I 2024-12-04 13:47:00,251] Trial 2360 finished with value: 0.47911497530902875 and parameters: {'n_estimators': 215, 'learning_rate': 0.06748121009494994, 'max_depth': 10, 'min_samples_split': 11, 'min_samples_leaf': 9, 'subsample': 0.6971920571046042, 'max_features': None}. Best is trial 2314 with value: 0.22206050798261862.
[I 2024-12-04 13:47:02,208] Trial 2335 finished with value: 0.4356777584976753 and parameters: {'n_estimators': 893, 'learning_rate': 0.01888408838217302, 'max_depth': 11, 'min_samples_split': 20, 'min_samples_leaf': 5, 'subsample': 0.968927053735744, 'max_features': None}. Best is trial 2314 with value: 0.22206050798261862.
[I 2024-12-04 13:47:02,221] Trial 2338 finished with value: 0.8485772991724577 and parameters: {'n_estimators': 1118, 'learning_rate': 0.01059239785232679, 'max_depth': 5, 'min_samples_split': 15, 'min_samples_leaf': 4, 'subsample': 0.7081094664787881, 'max_features': 'log2'}. Best is trial 2314 with value: 0.22206050798261862.
[I 2024-12-04 13:47:04,202] Trial 2357 finished with value: 0.44193089170554484 and parameters: {'n_estimators': 327, 'learning_rate': 0.021252678211629808, 'max_depth': 8, 'min_samples_split': 3, 'min_samples_leaf': 6, 'subsample': 0.8089130403248807, 'max_features': None}. Best is trial 2314 with value: 0.22206050798261862.
[I 2024-12-04 13:47:07,361] Trial 2336 finished with value: 0.42671462802020044 and parameters: {'n_estimators': 1028, 'learning_rate': 0.010325848952693797, 'max_depth': 5, 'min_samples_split': 5, 'min_samples_leaf': 5, 'subsample': 0.7298445643325061, 'max_features': None}. Best is trial 2314 with value: 0.22206050798261862.
[I 2024-12-04 13:47:07,369] Trial 2326 finished with value: 0.2514957228072795 and parameters: {'n_estimators': 1433, 'learning_rate': 0.09913022454752345, 'max_depth': 6, 'min_samples_split': 11, 'min_samples_leaf': 1, 'subsample': 0.8925209797554898, 'max_features': 'sqrt'}. Best is trial 2314 with value: 0.22206050798261862.
[I 2024-12-04 13:47:09,519] Trial 2327 finished with value: 0.3677340956127611 and parameters: {'n_estimators': 1474, 'learning_rate': 0.04632800136742148, 'max_depth': 12, 'min_samples_split': 5, 'min_samples_leaf': 3, 'subsample': 0.6079501863714123, 'max_features': 'sqrt'}. Best is trial 2314 with value: 0.22206050798261862.
[I 2024-12-04 13:47:18,752] Trial 2361 finished with value: 0.3745463257767377 and parameters: {'n_estimators': 403, 'learning_rate': 0.08548790433528905, 'max_depth': 6, 'min_samples_split': 8, 'min_samples_leaf': 2, 'subsample': 0.9194405065146671, 'max_features': 'log2'}. Best is trial 2314 with value: 0.22206050798261862.
[I 2024-12-04 13:47:21,926] Trial 2341 finished with value: 0.24110646185850254 and parameters: {'n_estimators': 1190, 'learning_rate': 0.09723410837451676, 'max_depth': 10, 'min_samples_split': 3, 'min_samples_leaf': 1, 'subsample': 0.946613737628234, 'max_features': 'sqrt'}. Best is trial 2314 with value: 0.22206050798261862.
[I 2024-12-04 13:47:24,399] Trial 2340 finished with value: 0.2695566113316302 and parameters: {'n_estimators': 1249, 'learning_rate': 0.07029125604194146, 'max_depth': 5, 'min_samples_split': 6, 'min_samples_leaf': 1, 'subsample': 0.7556944112623067, 'max_features': 'sqrt'}. Best is trial 2314 with value: 0.22206050798261862.
[I 2024-12-04 13:47:27,639] Trial 2344 finished with value: 0.25566563101271855 and parameters: {'n_estimators': 1123, 'learning_rate': 0.08367348987917908, 'max_depth': 9, 'min_samples_split': 6, 'min_samples_leaf': 1, 'subsample': 0.8501738777626614, 'max_features': 'sqrt'}. Best is trial 2314 with value: 0.22206050798261862.
[I 2024-12-04 13:47:30,648] Trial 2355 finished with value: 0.6689152050558517 and parameters: {'n_estimators': 838, 'learning_rate': 0.014890102002076815, 'max_depth': 5, 'min_samples_split': 5, 'min_samples_leaf': 1, 'subsample': 0.6071018142307083, 'max_features': 'log2'}. Best is trial 2314 with value: 0.22206050798261862.
[I 2024-12-04 13:47:34,167] Trial 2350 finished with value: 0.2699357604381754 and parameters: {'n_estimators': 1017, 'learning_rate': 0.09497731437204177, 'max_depth': 9, 'min_samples_split': 6, 'min_samples_leaf': 1, 'subsample': 0.7848573137402486, 'max_features': 'log2'}. Best is trial 2314 with value: 0.22206050798261862.
[I 2024-12-04 13:47:35,717] Trial 2337 finished with value: 0.2852500622612634 and parameters: {'n_estimators': 1492, 'learning_rate': 0.05780865312407635, 'max_depth': 8, 'min_samples_split': 4, 'min_samples_leaf': 2, 'subsample': 0.6533976587661195, 'max_features': 'sqrt'}. Best is trial 2314 with value: 0.22206050798261862.
[I 2024-12-04 13:47:39,482] Trial 2351 finished with value: 0.2697487143744491 and parameters: {'n_estimators': 1025, 'learning_rate': 0.08289164286600799, 'max_depth': 12, 'min_samples_split': 7, 'min_samples_leaf': 1, 'subsample': 0.7057827786748679, 'max_features': 'sqrt'}. Best is trial 2314 with value: 0.22206050798261862.
[I 2024-12-04 13:47:41,243] Trial 2346 finished with value: 0.25565066713594137 and parameters: {'n_estimators': 1190, 'learning_rate': 0.06003322643893684, 'max_depth': 9, 'min_samples_split': 5, 'min_samples_leaf': 1, 'subsample': 0.8661793513736322, 'max_features': 'sqrt'}. Best is trial 2314 with value: 0.22206050798261862.
[I 2024-12-04 13:47:44,416] Trial 2348 finished with value: 0.2480939558978452 and parameters: {'n_estimators': 1235, 'learning_rate': 0.08026331933717226, 'max_depth': 10, 'min_samples_split': 8, 'min_samples_leaf': 1, 'subsample': 0.8713291115073332, 'max_features': 'sqrt'}. Best is trial 2314 with value: 0.22206050798261862.
[I 2024-12-04 13:47:46,717] Trial 2343 finished with value: 0.23660777834610397 and parameters: {'n_estimators': 1401, 'learning_rate': 0.06430279201628054, 'max_depth': 11, 'min_samples_split': 2, 'min_samples_leaf': 1, 'subsample': 0.6784460148023831, 'max_features': 'sqrt'}. Best is trial 2314 with value: 0.22206050798261862.
[I 2024-12-04 13:47:46,756] Trial 2352 finished with value: 0.5947764329634583 and parameters: {'n_estimators': 1178, 'learning_rate': 0.022735607474229116, 'max_depth': 4, 'min_samples_split': 12, 'min_samples_leaf': 2, 'subsample': 0.9647134880420023, 'max_features': 'log2'}. Best is trial 2314 with value: 0.22206050798261862.
[I 2024-12-04 13:47:48,214] Trial 2342 finished with value: 0.24918204132002048 and parameters: {'n_estimators': 1497, 'learning_rate': 0.06281414370474504, 'max_depth': 8, 'min_samples_split': 5, 'min_samples_leaf': 1, 'subsample': 0.7034639922522035, 'max_features': 'sqrt'}. Best is trial 2314 with value: 0.22206050798261862.
[I 2024-12-04 13:47:50,560] Trial 2372 finished with value: 1.0334856713599387 and parameters: {'n_estimators': 421, 'learning_rate': 0.02823382017671975, 'max_depth': 5, 'min_samples_split': 15, 'min_samples_leaf': 7, 'subsample': 0.7548800244676824, 'max_features': 'log2'}. Best is trial 2314 with value: 0.22206050798261862.
[I 2024-12-04 13:47:53,001] Trial 2345 finished with value: 0.2866599401015039 and parameters: {'n_estimators': 1357, 'learning_rate': 0.09488890768768261, 'max_depth': 11, 'min_samples_split': 3, 'min_samples_leaf': 2, 'subsample': 0.847072420661899, 'max_features': 'sqrt'}. Best is trial 2314 with value: 0.22206050798261862.
[I 2024-12-04 13:47:53,519] Trial 2354 finished with value: 0.28694755020191076 and parameters: {'n_estimators': 1181, 'learning_rate': 0.08240120792160047, 'max_depth': 11, 'min_samples_split': 6, 'min_samples_leaf': 2, 'subsample': 0.8871461039584437, 'max_features': 'sqrt'}. Best is trial 2314 with value: 0.22206050798261862.
[I 2024-12-04 13:47:59,337] Trial 2349 finished with value: 0.25118242552832615 and parameters: {'n_estimators': 1297, 'learning_rate': 0.08256156901242512, 'max_depth': 9, 'min_samples_split': 7, 'min_samples_leaf': 1, 'subsample': 0.8276034291752828, 'max_features': 'sqrt'}. Best is trial 2314 with value: 0.22206050798261862.
[I 2024-12-04 13:48:05,368] Trial 2347 finished with value: 0.31356464668115397 and parameters: {'n_estimators': 1414, 'learning_rate': 0.07378158023863389, 'max_depth': 6, 'min_samples_split': 4, 'min_samples_leaf': 1, 'subsample': 0.7873606460170922, 'max_features': None}. Best is trial 2314 with value: 0.22206050798261862.
[I 2024-12-04 13:48:08,489] Trial 2353 finished with value: 0.3003092528561145 and parameters: {'n_estimators': 1416, 'learning_rate': 0.08513827152759554, 'max_depth': 11, 'min_samples_split': 4, 'min_samples_leaf': 2, 'subsample': 0.9009928333389476, 'max_features': 'sqrt'}. Best is trial 2314 with value: 0.22206050798261862.
[I 2024-12-04 13:48:09,412] Trial 2358 finished with value: 0.3562056602810589 and parameters: {'n_estimators': 1223, 'learning_rate': 0.06825435431450756, 'max_depth': 10, 'min_samples_split': 3, 'min_samples_leaf': 3, 'subsample': 0.8328480621340255, 'max_features': 'sqrt'}. Best is trial 2314 with value: 0.22206050798261862.
[I 2024-12-04 13:48:09,475] Trial 2356 finished with value: 0.3407802718002133 and parameters: {'n_estimators': 1303, 'learning_rate': 0.09687991586240575, 'max_depth': 8, 'min_samples_split': 6, 'min_samples_leaf': 3, 'subsample': 0.6662429649636955, 'max_features': 'log2'}. Best is trial 2314 with value: 0.22206050798261862.
[I 2024-12-04 13:48:10,094] Trial 2362 finished with value: 0.29958741056191035 and parameters: {'n_estimators': 1137, 'learning_rate': 0.09891690402600097, 'max_depth': 10, 'min_samples_split': 3, 'min_samples_leaf': 2, 'subsample': 0.8767220595267313, 'max_features': 'sqrt'}. Best is trial 2314 with value: 0.22206050798261862.
[I 2024-12-04 13:48:16,598] Trial 2366 finished with value: 0.2444857773125996 and parameters: {'n_estimators': 994, 'learning_rate': 0.07630924189139365, 'max_depth': 11, 'min_samples_split': 8, 'min_samples_leaf': 1, 'subsample': 0.8036810659609236, 'max_features': 'sqrt'}. Best is trial 2314 with value: 0.22206050798261862.
[I 2024-12-04 13:48:24,238] Trial 2363 finished with value: 0.2637747811510984 and parameters: {'n_estimators': 1305, 'learning_rate': 0.06779129445302179, 'max_depth': 10, 'min_samples_split': 6, 'min_samples_leaf': 1, 'subsample': 0.920721665248388, 'max_features': 'sqrt'}. Best is trial 2314 with value: 0.22206050798261862.
[I 2024-12-04 13:48:26,376] Trial 2359 finished with value: 0.24996389031999952 and parameters: {'n_estimators': 1489, 'learning_rate': 0.09241947533369117, 'max_depth': 7, 'min_samples_split': 2, 'min_samples_leaf': 1, 'subsample': 0.8406013319695507, 'max_features': 'sqrt'}. Best is trial 2314 with value: 0.22206050798261862.
[I 2024-12-04 13:48:29,197] Trial 2365 finished with value: 0.24642407089879 and parameters: {'n_estimators': 1222, 'learning_rate': 0.03275171723116362, 'max_depth': 9, 'min_samples_split': 4, 'min_samples_leaf': 1, 'subsample': 0.6883997516323002, 'max_features': 'sqrt'}. Best is trial 2314 with value: 0.22206050798261862.
[I 2024-12-04 13:48:33,004] Trial 2371 finished with value: 0.38029561871485984 and parameters: {'n_estimators': 1051, 'learning_rate': 0.045172566683614135, 'max_depth': 12, 'min_samples_split': 8, 'min_samples_leaf': 5, 'subsample': 0.7475769542498131, 'max_features': 'sqrt'}. Best is trial 2314 with value: 0.22206050798261862.
[I 2024-12-04 13:48:34,642] Trial 2367 finished with value: 0.25591280259828875 and parameters: {'n_estimators': 1138, 'learning_rate': 0.05221965706724027, 'max_depth': 10, 'min_samples_split': 8, 'min_samples_leaf': 1, 'subsample': 0.6058817919690094, 'max_features': 'sqrt'}. Best is trial 2314 with value: 0.22206050798261862.
[I 2024-12-04 13:48:38,526] Trial 2374 finished with value: 0.3483716278463912 and parameters: {'n_estimators': 1020, 'learning_rate': 0.06165457988710967, 'max_depth': 10, 'min_samples_split': 10, 'min_samples_leaf': 3, 'subsample': 0.857963888404416, 'max_features': 'sqrt'}. Best is trial 2314 with value: 0.22206050798261862.
[I 2024-12-04 13:48:41,993] Trial 2364 finished with value: 0.2650716264850284 and parameters: {'n_estimators': 1441, 'learning_rate': 0.09167228854357998, 'max_depth': 8, 'min_samples_split': 2, 'min_samples_leaf': 1, 'subsample': 0.8034841828008032, 'max_features': 'sqrt'}. Best is trial 2314 with value: 0.22206050798261862.
[I 2024-12-04 13:48:45,513] Trial 2369 finished with value: 0.25446427196155225 and parameters: {'n_estimators': 1277, 'learning_rate': 0.057907889509096894, 'max_depth': 8, 'min_samples_split': 8, 'min_samples_leaf': 1, 'subsample': 0.7074998942814472, 'max_features': 'sqrt'}. Best is trial 2314 with value: 0.22206050798261862.
[I 2024-12-04 13:48:48,310] Trial 2373 finished with value: 0.4079529582789478 and parameters: {'n_estimators': 1173, 'learning_rate': 0.09544751322545632, 'max_depth': 3, 'min_samples_split': 20, 'min_samples_leaf': 6, 'subsample': 0.8914335527126956, 'max_features': None}. Best is trial 2314 with value: 0.22206050798261862.
[I 2024-12-04 13:48:50,034] Trial 2375 finished with value: 0.28588506546918896 and parameters: {'n_estimators': 1141, 'learning_rate': 0.09857980210216688, 'max_depth': 11, 'min_samples_split': 6, 'min_samples_leaf': 1, 'subsample': 0.9340314545261114, 'max_features': 'sqrt'}. Best is trial 2314 with value: 0.22206050798261862.
[I 2024-12-04 13:48:53,893] Trial 2399 finished with value: 1.236453022761774 and parameters: {'n_estimators': 212, 'learning_rate': 0.018266954807067134, 'max_depth': 3, 'min_samples_split': 5, 'min_samples_leaf': 9, 'subsample': 0.6527515737078604, 'max_features': 'log2'}. Best is trial 2314 with value: 0.22206050798261862.
[I 2024-12-04 13:48:56,618] Trial 2397 finished with value: 0.48796250821891346 and parameters: {'n_estimators': 323, 'learning_rate': 0.011574630002412201, 'max_depth': 12, 'min_samples_split': 18, 'min_samples_leaf': 8, 'subsample': 0.672676224748426, 'max_features': None}. Best is trial 2314 with value: 0.22206050798261862.
[I 2024-12-04 13:48:56,629] Trial 2370 finished with value: 0.2975879400007599 and parameters: {'n_estimators': 1347, 'learning_rate': 0.07813028226508414, 'max_depth': 10, 'min_samples_split': 6, 'min_samples_leaf': 2, 'subsample': 0.8283529772332243, 'max_features': 'sqrt'}. Best is trial 2314 with value: 0.22206050798261862.
[I 2024-12-04 13:48:58,714] Trial 2401 finished with value: 0.7314096194542514 and parameters: {'n_estimators': 190, 'learning_rate': 0.031955888526649545, 'max_depth': 5, 'min_samples_split': 2, 'min_samples_leaf': 8, 'subsample': 0.6753705083796997, 'max_features': 'sqrt'}. Best is trial 2314 with value: 0.22206050798261862.
[I 2024-12-04 13:49:03,492] Trial 2378 finished with value: 0.253035056112627 and parameters: {'n_estimators': 1187, 'learning_rate': 0.09782325496265233, 'max_depth': 9, 'min_samples_split': 4, 'min_samples_leaf': 1, 'subsample': 0.9151727950966208, 'max_features': 'sqrt'}. Best is trial 2314 with value: 0.22206050798261862.
[I 2024-12-04 13:49:04,524] Trial 2368 finished with value: 0.4712021053390494 and parameters: {'n_estimators': 1392, 'learning_rate': 0.036568809265055624, 'max_depth': 11, 'min_samples_split': 4, 'min_samples_leaf': 9, 'subsample': 0.9745028043046813, 'max_features': None}. Best is trial 2314 with value: 0.22206050798261862.
[I 2024-12-04 13:49:07,174] Trial 2382 finished with value: 0.2865267416165261 and parameters: {'n_estimators': 1096, 'learning_rate': 0.05647734458571204, 'max_depth': 7, 'min_samples_split': 9, 'min_samples_leaf': 2, 'subsample': 0.7937586860808795, 'max_features': 'sqrt'}. Best is trial 2314 with value: 0.22206050798261862.
[I 2024-12-04 13:49:12,775] Trial 2376 finished with value: 0.24154641932154197 and parameters: {'n_estimators': 1432, 'learning_rate': 0.07231982874976325, 'max_depth': 10, 'min_samples_split': 3, 'min_samples_leaf': 1, 'subsample': 0.8741189936396955, 'max_features': 'sqrt'}. Best is trial 2314 with value: 0.22206050798261862.
[I 2024-12-04 13:49:13,962] Trial 2377 finished with value: 0.2504111433835779 and parameters: {'n_estimators': 1395, 'learning_rate': 0.09134008788172761, 'max_depth': 9, 'min_samples_split': 7, 'min_samples_leaf': 1, 'subsample': 0.8005023067787802, 'max_features': 'sqrt'}. Best is trial 2314 with value: 0.22206050798261862.
[I 2024-12-04 13:49:14,942] Trial 2381 finished with value: 0.2915695448184097 and parameters: {'n_estimators': 1289, 'learning_rate': 0.06815976666825811, 'max_depth': 11, 'min_samples_split': 5, 'min_samples_leaf': 2, 'subsample': 0.9386225317928252, 'max_features': 'log2'}. Best is trial 2314 with value: 0.22206050798261862.
[I 2024-12-04 13:49:18,699] Trial 2380 finished with value: 0.25784037534698057 and parameters: {'n_estimators': 1342, 'learning_rate': 0.09328570858314814, 'max_depth': 11, 'min_samples_split': 4, 'min_samples_leaf': 1, 'subsample': 0.9405548437645725, 'max_features': 'sqrt'}. Best is trial 2314 with value: 0.22206050798261862.
[I 2024-12-04 13:49:22,440] Trial 2385 finished with value: 0.3667777378298377 and parameters: {'n_estimators': 1072, 'learning_rate': 0.010803162350438421, 'max_depth': 8, 'min_samples_split': 5, 'min_samples_leaf': 2, 'subsample': 0.6161231236315998, 'max_features': None}. Best is trial 2314 with value: 0.22206050798261862.
[I 2024-12-04 13:49:23,567] Trial 2379 finished with value: 0.34857101195666595 and parameters: {'n_estimators': 1445, 'learning_rate': 0.09999842510092907, 'max_depth': 8, 'min_samples_split': 3, 'min_samples_leaf': 3, 'subsample': 0.9273084202822685, 'max_features': 'sqrt'}. Best is trial 2314 with value: 0.22206050798261862.
[I 2024-12-04 13:49:24,934] Trial 2384 finished with value: 0.29497670139870685 and parameters: {'n_estimators': 1210, 'learning_rate': 0.03316242269950443, 'max_depth': 10, 'min_samples_split': 2, 'min_samples_leaf': 2, 'subsample': 0.6483756953800238, 'max_features': 'sqrt'}. Best is trial 2314 with value: 0.22206050798261862.
[I 2024-12-04 13:49:25,133] Trial 2391 finished with value: 0.775478750308501 and parameters: {'n_estimators': 897, 'learning_rate': 0.020971977101207278, 'max_depth': 10, 'min_samples_split': 19, 'min_samples_leaf': 6, 'subsample': 0.9905442814142655, 'max_features': 'log2'}. Best is trial 2314 with value: 0.22206050798261862.
[I 2024-12-04 13:49:26,820] Trial 2387 finished with value: 0.25158137469960307 and parameters: {'n_estimators': 1149, 'learning_rate': 0.06599991639737267, 'max_depth': 5, 'min_samples_split': 2, 'min_samples_leaf': 1, 'subsample': 0.6618658913285408, 'max_features': 'sqrt'}. Best is trial 2314 with value: 0.22206050798261862.
[I 2024-12-04 13:49:29,597] Trial 2408 finished with value: 0.40766421135485403 and parameters: {'n_estimators': 313, 'learning_rate': 0.05501127277277335, 'max_depth': 3, 'min_samples_split': 14, 'min_samples_leaf': 4, 'subsample': 0.612259004123517, 'max_features': None}. Best is trial 2314 with value: 0.22206050798261862.
[I 2024-12-04 13:49:31,618] Trial 2388 finished with value: 0.2377016130212142 and parameters: {'n_estimators': 1160, 'learning_rate': 0.09718197411181376, 'max_depth': 7, 'min_samples_split': 7, 'min_samples_leaf': 1, 'subsample': 0.7419466205438419, 'max_features': 'sqrt'}. Best is trial 2314 with value: 0.22206050798261862.
[I 2024-12-04 13:49:32,427] Trial 2383 finished with value: 0.35267095341833843 and parameters: {'n_estimators': 1320, 'learning_rate': 0.056525973028006195, 'max_depth': 7, 'min_samples_split': 5, 'min_samples_leaf': 3, 'subsample': 0.8504723830438774, 'max_features': 'sqrt'}. Best is trial 2314 with value: 0.22206050798261862.
[I 2024-12-04 13:49:35,904] Trial 2403 finished with value: 0.4170559960211025 and parameters: {'n_estimators': 589, 'learning_rate': 0.08214322790538535, 'max_depth': 7, 'min_samples_split': 4, 'min_samples_leaf': 4, 'subsample': 0.6280572474784784, 'max_features': None}. Best is trial 2314 with value: 0.22206050798261862.
[I 2024-12-04 13:49:39,556] Trial 2390 finished with value: 0.3093319157094965 and parameters: {'n_estimators': 1216, 'learning_rate': 0.091379125698901, 'max_depth': 10, 'min_samples_split': 5, 'min_samples_leaf': 2, 'subsample': 0.8358124979708456, 'max_features': 'sqrt'}. Best is trial 2314 with value: 0.22206050798261862.
[I 2024-12-04 13:49:41,964] Trial 2394 finished with value: 0.349621225237526 and parameters: {'n_estimators': 1141, 'learning_rate': 0.09892572606768127, 'max_depth': 6, 'min_samples_split': 6, 'min_samples_leaf': 3, 'subsample': 0.7156026517989768, 'max_features': 'sqrt'}. Best is trial 2314 with value: 0.22206050798261862.
[I 2024-12-04 13:49:46,754] Trial 2389 finished with value: 0.24054113273440253 and parameters: {'n_estimators': 1375, 'learning_rate': 0.08870225064981341, 'max_depth': 8, 'min_samples_split': 5, 'min_samples_leaf': 1, 'subsample': 0.8153207557342629, 'max_features': 'sqrt'}. Best is trial 2314 with value: 0.22206050798261862.
