[I 2024-12-03 18:41:56,227] Trial 61 finished with value: 1.3254077760362235 and parameters: {'kernel': 'poly', 'C': 0.0018066438805693058, 'gamma': 0.00015596147452383687, 'epsilon': 0.6509064479093629}. Best is trial 13 with value: 0.1360230006006195.
[I 2024-12-03 18:41:56,696] Trial 64 finished with value: 0.6192451358477407 and parameters: {'kernel': 'sigmoid', 'C': 25.60168914842857, 'gamma': 0.0009941515091972004, 'epsilon': 0.0166610594381815}. Best is trial 13 with value: 0.1360230006006195.
[I 2024-12-03 18:41:56,763] Trial 57 finished with value: 0.13873468531548794 and parameters: {'kernel': 'linear', 'C': 1.50975634426761, 'gamma': 0.37418325483281006, 'epsilon': 0.010109552292779487}. Best is trial 13 with value: 0.1360230006006195.
[I 2024-12-03 18:41:56,765] Trial 55 finished with value: 0.13774067055575295 and parameters: {'kernel': 'linear', 'C': 4.7822408945790285, 'gamma': 0.08085613285841052, 'epsilon': 0.01851495112218569}. Best is trial 13 with value: 0.1360230006006195.
[I 2024-12-03 18:41:56,788] Trial 62 finished with value: 141.14903743431802 and parameters: {'kernel': 'sigmoid', 'C': 8.559037718760313, 'gamma': 0.05282903731675083, 'epsilon': 0.07349280597779387}. Best is trial 13 with value: 0.1360230006006195.
[I 2024-12-03 18:41:56,790] Trial 53 finished with value: 0.1386805763998219 and parameters: {'kernel': 'linear', 'C': 1.730493062354861, 'gamma': 0.5806462361871733, 'epsilon': 0.009648562259856197}. Best is trial 13 with value: 0.1360230006006195.
[I 2024-12-03 18:41:56,813] Trial 35 finished with value: 0.13615569017642457 and parameters: {'kernel': 'linear', 'C': 38.57028383672811, 'gamma': 0.00028775486845439497, 'epsilon': 0.05202475996963314}. Best is trial 13 with value: 0.1360230006006195.
[I 2024-12-03 18:41:57,201] Trial 49 finished with value: 0.13708539500785824 and parameters: {'kernel': 'linear', 'C': 4.110597956536149, 'gamma': 0.0341513164277333, 'epsilon': 0.021780163462454778}. Best is trial 13 with value: 0.1360230006006195.
[I 2024-12-03 18:41:58,009] Trial 54 finished with value: 0.13734397135376217 and parameters: {'kernel': 'linear', 'C': 4.233610297102763, 'gamma': 0.00010846441462661704, 'epsilon': 0.0026980635538507926}. Best is trial 13 with value: 0.1360230006006195.
[I 2024-12-03 18:41:58,010] Trial 41 finished with value: 0.13700923172307078 and parameters: {'kernel': 'linear', 'C': 48.965574975673746, 'gamma': 0.12680882070513264, 'epsilon': 0.045312626780016886}. Best is trial 13 with value: 0.1360230006006195.
[I 2024-12-03 18:41:58,542] Trial 68 finished with value: 1.2722279055444468 and parameters: {'kernel': 'rbf', 'C': 0.00663249918643607, 'gamma': 0.12267071497010615, 'epsilon': 0.144318498062588}. Best is trial 13 with value: 0.1360230006006195.
[I 2024-12-03 18:41:59,474] Trial 63 finished with value: 0.13813292149601483 and parameters: {'kernel': 'linear', 'C': 3.431695948882137, 'gamma': 0.0002987380126904674, 'epsilon': 0.0078098731084575755}. Best is trial 13 with value: 0.1360230006006195.
[I 2024-12-03 18:41:59,957] Trial 69 finished with value: 1.318567111052893 and parameters: {'kernel': 'rbf', 'C': 0.007349023874125734, 'gamma': 0.0013234074150788276, 'epsilon': 0.0022973614549123035}. Best is trial 13 with value: 0.1360230006006195.
[I 2024-12-03 18:42:00,279] Trial 84 finished with value: 0.779354658720842 and parameters: {'kernel': 'sigmoid', 'C': 2.190653602585643, 'gamma': 0.00012613851164792634, 'epsilon': 0.004099653231199464}. Best is trial 13 with value: 0.1360230006006195.
[I 2024-12-03 18:42:00,311] Trial 76 finished with value: 1.3591434780691023 and parameters: {'kernel': 'poly', 'C': 0.6679650975359426, 'gamma': 0.0003849284173254825, 'epsilon': 0.0021816318724447526}. Best is trial 13 with value: 0.1360230006006195.
[I 2024-12-03 18:42:00,370] Trial 59 finished with value: 0.13742044376630105 and parameters: {'kernel': 'linear', 'C': 6.37826907698972, 'gamma': 0.0033759234381456923, 'epsilon': 0.00446875827575115}. Best is trial 13 with value: 0.1360230006006195.
[I 2024-12-03 18:42:00,466] Trial 82 finished with value: 0.9368406393761497 and parameters: {'kernel': 'rbf', 'C': 0.4266424265343425, 'gamma': 0.00021810166987293003, 'epsilon': 0.0016642833295459878}. Best is trial 13 with value: 0.1360230006006195.
[I 2024-12-03 18:42:00,502] Trial 72 finished with value: 0.32564207094210634 and parameters: {'kernel': 'sigmoid', 'C': 28.379394890470646, 'gamma': 0.00045355839370902215, 'epsilon': 0.10699654262530624}. Best is trial 13 with value: 0.1360230006006195.
[I 2024-12-03 18:42:00,965] Trial 73 finished with value: 0.7538972683634093 and parameters: {'kernel': 'poly', 'C': 86.7779355584455, 'gamma': 0.0004786442642921864, 'epsilon': 0.03875595710373996}. Best is trial 13 with value: 0.1360230006006195.
[I 2024-12-03 18:42:00,980] Trial 70 finished with value: 0.13795082021058871 and parameters: {'kernel': 'linear', 'C': 2.6552040540917647, 'gamma': 0.0002197449409099722, 'epsilon': 0.001804577580384162}. Best is trial 13 with value: 0.1360230006006195.
[I 2024-12-03 18:42:01,151] Trial 83 finished with value: 10.384937137930319 and parameters: {'kernel': 'sigmoid', 'C': 0.5994702756742141, 'gamma': 0.0391042872922644, 'epsilon': 0.011618975690774623}. Best is trial 13 with value: 0.1360230006006195.
[I 2024-12-03 18:42:01,389] Trial 87 finished with value: 0.4351383670411649 and parameters: {'kernel': 'poly', 'C': 22.724868214463914, 'gamma': 0.0069796760975651155, 'epsilon': 0.009708221395406074}. Best is trial 13 with value: 0.1360230006006195.
[I 2024-12-03 18:42:01,603] Trial 71 finished with value: 0.13778004169299599 and parameters: {'kernel': 'linear', 'C': 30.444654123605257, 'gamma': 0.3990096189271647, 'epsilon': 0.07767862059035467}. Best is trial 13 with value: 0.1360230006006195.
[I 2024-12-03 18:42:02,028] Trial 80 finished with value: 0.36654093562048934 and parameters: {'kernel': 'rbf', 'C': 4.881562407440863, 'gamma': 0.04778807668013569, 'epsilon': 0.05068533427077981}. Best is trial 13 with value: 0.1360230006006195.
[I 2024-12-03 18:42:02,033] Trial 85 finished with value: 1.2128068763558013 and parameters: {'kernel': 'poly', 'C': 0.0018192125903961074, 'gamma': 0.009574951185635377, 'epsilon': 0.005451282841413441}. Best is trial 13 with value: 0.1360230006006195.
[I 2024-12-03 18:42:02,191] Trial 75 finished with value: 0.13769090980185433 and parameters: {'kernel': 'linear', 'C': 3.6508148671400775, 'gamma': 0.0001790118420012619, 'epsilon': 0.0016008729488275978}. Best is trial 13 with value: 0.1360230006006195.
[I 2024-12-03 18:42:02,260] Trial 79 finished with value: 0.1622767290795733 and parameters: {'kernel': 'rbf', 'C': 58.59500306064237, 'gamma': 0.004591097883738956, 'epsilon': 0.0012571587227918361}. Best is trial 13 with value: 0.1360230006006195.
[I 2024-12-03 18:42:03,592] Trial 81 finished with value: 1349.860109121912 and parameters: {'kernel': 'sigmoid', 'C': 62.32888204258641, 'gamma': 0.3266672462297871, 'epsilon': 0.02380091499027062}. Best is trial 13 with value: 0.1360230006006195.
[I 2024-12-03 18:42:04,800] Trial 66 finished with value: 0.135336598925964 and parameters: {'kernel': 'linear', 'C': 23.364265901141366, 'gamma': 0.18487829529546465, 'epsilon': 0.05862008942339151}. Best is trial 66 with value: 0.135336598925964.
[I 2024-12-03 18:42:05,249] Trial 90 finished with value: 1.3145326556340964 and parameters: {'kernel': 'poly', 'C': 26.913131833338788, 'gamma': 0.0002659546678846132, 'epsilon': 0.0013298551111187104}. Best is trial 66 with value: 0.135336598925964.
[I 2024-12-03 18:42:05,437] Trial 94 finished with value: 0.2980165958629601 and parameters: {'kernel': 'rbf', 'C': 31.961831003242665, 'gamma': 0.0001958011814122876, 'epsilon': 0.05900464729049254}. Best is trial 66 with value: 0.135336598925964.
[I 2024-12-03 18:42:05,570] Trial 89 finished with value: 0.6078122909984529 and parameters: {'kernel': 'sigmoid', 'C': 1.270006497481529, 'gamma': 0.0026105897368855673, 'epsilon': 0.0011543933177995222}. Best is trial 60 with value: 0.13482943310261095.
[I 2024-12-03 18:42:05,744] Trial 92 finished with value: 0.14169495196432047 and parameters: {'kernel': 'linear', 'C': 1.074949430695586, 'gamma': 0.04518515480162668, 'epsilon': 0.03671830196066807}. Best is trial 60 with value: 0.13482943310261095.
[I 2024-12-03 18:42:05,811] Trial 60 finished with value: 0.13482943310261095 and parameters: {'kernel': 'linear', 'C': 21.324536742790055, 'gamma': 0.0001713555311224277, 'epsilon': 0.0398246375033051}. Best is trial 60 with value: 0.13482943310261095.
[I 2024-12-03 18:42:05,857] Trial 91 finished with value: 0.137378741649732 and parameters: {'kernel': 'linear', 'C': 5.25231279148753, 'gamma': 0.027285660755355157, 'epsilon': 0.02226408663380111}. Best is trial 60 with value: 0.13482943310261095.
[I 2024-12-03 18:42:06,159] Trial 78 finished with value: 0.13729801047333956 and parameters: {'kernel': 'linear', 'C': 4.781739930858773, 'gamma': 0.006865296200436937, 'epsilon': 0.003270500548651618}. Best is trial 60 with value: 0.13482943310261095.
[I 2024-12-03 18:42:07,845] Trial 95 finished with value: 0.14179367881842997 and parameters: {'kernel': 'linear', 'C': 4.302760523025878, 'gamma': 0.08708939362989111, 'epsilon': 0.08299775648132265}. Best is trial 60 with value: 0.13482943310261095.
[I 2024-12-03 18:42:08,267] Trial 93 finished with value: 0.23328200323064888 and parameters: {'kernel': 'linear', 'C': 11.986938887970359, 'gamma': 0.2376539273014935, 'epsilon': 0.32641517218430205}. Best is trial 60 with value: 0.13482943310261095.
[I 2024-12-03 18:42:09,228] Trial 97 finished with value: 0.1361734913759385 and parameters: {'kernel': 'linear', 'C': 3.6816250322649324, 'gamma': 0.32052787109494607, 'epsilon': 0.040415909807922125}. Best is trial 60 with value: 0.13482943310261095.
[I 2024-12-03 18:42:09,953] Trial 44 finished with value: 0.13824873252933204 and parameters: {'kernel': 'linear', 'C': 20.934231821509968, 'gamma': 0.00667603170065788, 'epsilon': 0.014709048265449677}. Best is trial 60 with value: 0.13482943310261095.
[I 2024-12-03 18:42:10,288] Trial 102 finished with value: 0.13769342666320075 and parameters: {'kernel': 'linear', 'C': 4.161896086737943, 'gamma': 0.0001407271535728069, 'epsilon': 0.016813863022974957}. Best is trial 60 with value: 0.13482943310261095.
[I 2024-12-03 18:42:10,892] Trial 99 finished with value: 0.18674031883851375 and parameters: {'kernel': 'linear', 'C': 34.28343368940626, 'gamma': 0.00021106215248866824, 'epsilon': 0.2181511863031336}. Best is trial 60 with value: 0.13482943310261095.
[I 2024-12-03 18:42:11,161] Trial 101 finished with value: 0.13638676513618622 and parameters: {'kernel': 'linear', 'C': 2.7864793811678648, 'gamma': 0.00017593288757890128, 'epsilon': 0.046324991071318745}. Best is trial 60 with value: 0.13482943310261095.
[I 2024-12-03 18:42:11,630] Trial 104 finished with value: 1.3411709993946566 and parameters: {'kernel': 'sigmoid', 'C': 0.0011547316972146426, 'gamma': 0.08727346665331062, 'epsilon': 0.0013879853786207938}. Best is trial 60 with value: 0.13482943310261095.
[I 2024-12-03 18:42:11,916] Trial 96 finished with value: 0.17611087854710814 and parameters: {'kernel': 'linear', 'C': 26.325955244374494, 'gamma': 0.00022192411956331695, 'epsilon': 0.19726910000413417}. Best is trial 60 with value: 0.13482943310261095.
[I 2024-12-03 18:42:12,198] Trial 106 finished with value: 0.3654132238927843 and parameters: {'kernel': 'poly', 'C': 3.5802131144440468, 'gamma': 0.03266670030577277, 'epsilon': 0.037380192330542246}. Best is trial 60 with value: 0.13482943310261095.
[I 2024-12-03 18:42:12,334] Trial 100 finished with value: 0.17982770798002365 and parameters: {'kernel': 'linear', 'C': 2.642082273713034, 'gamma': 0.0005252574313773097, 'epsilon': 0.17760405954505407}. Best is trial 60 with value: 0.13482943310261095.
[I 2024-12-03 18:42:12,595] Trial 77 finished with value: 0.13508043730414665 and parameters: {'kernel': 'linear', 'C': 76.7455303642928, 'gamma': 0.03611299774358932, 'epsilon': 0.06302301317596569}. Best is trial 60 with value: 0.13482943310261095.
[I 2024-12-03 18:42:13,070] Trial 43 finished with value: 0.13781469700265694 and parameters: {'kernel': 'linear', 'C': 56.54324319756349, 'gamma': 0.9322615519636517, 'epsilon': 0.013450491396863709}. Best is trial 60 with value: 0.13482943310261095.
[I 2024-12-03 18:42:13,789] Trial 108 finished with value: 0.2625080428357421 and parameters: {'kernel': 'linear', 'C': 0.03190514629295532, 'gamma': 0.00025694717205206334, 'epsilon': 0.004512323616985932}. Best is trial 60 with value: 0.13482943310261095.
[I 2024-12-03 18:42:14,083] Trial 105 finished with value: 0.3184495304199165 and parameters: {'kernel': 'rbf', 'C': 13.094208327404608, 'gamma': 0.000329993848308184, 'epsilon': 0.007241405057879343}. Best is trial 60 with value: 0.13482943310261095.
[I 2024-12-03 18:42:15,213] Trial 115 finished with value: 0.15676655461749311 and parameters: {'kernel': 'linear', 'C': 0.6224739673696376, 'gamma': 0.00013041585670699302, 'epsilon': 0.07798675059642611}. Best is trial 60 with value: 0.13482943310261095.
[I 2024-12-03 18:42:16,069] Trial 103 finished with value: 0.13829614383377753 and parameters: {'kernel': 'linear', 'C': 1.9303832834257224, 'gamma': 0.023452979725189733, 'epsilon': 0.0025220375999572826}. Best is trial 60 with value: 0.13482943310261095.
[I 2024-12-03 18:42:16,361] Trial 119 finished with value: 0.4674854402079047 and parameters: {'kernel': 'poly', 'C': 1.2435714919408807, 'gamma': 0.01680127886711082, 'epsilon': 0.0021041564381370976}. Best is trial 60 with value: 0.13482943310261095.
[I 2024-12-03 18:42:16,574] Trial 74 finished with value: 0.13827427834408842 and parameters: {'kernel': 'linear', 'C': 34.61972545477916, 'gamma': 0.06108835962187743, 'epsilon': 0.009948115839728754}. Best is trial 60 with value: 0.13482943310261095.
[I 2024-12-03 18:42:16,595] Trial 121 finished with value: 0.6035868061866874 and parameters: {'kernel': 'rbf', 'C': 0.20978600252289764, 'gamma': 0.010371688908911207, 'epsilon': 0.4186304693226893}. Best is trial 60 with value: 0.13482943310261095.
[I 2024-12-03 18:42:17,229] Trial 110 finished with value: 0.13604982202564386 and parameters: {'kernel': 'linear', 'C': 4.28189686280927, 'gamma': 0.00012632002984048772, 'epsilon': 0.055026804526086034}. Best is trial 60 with value: 0.13482943310261095.
[I 2024-12-03 18:42:18,448] Trial 116 finished with value: 0.13623298668352127 and parameters: {'kernel': 'linear', 'C': 20.114677604219903, 'gamma': 0.024641962982326945, 'epsilon': 0.07144825567028304}. Best is trial 60 with value: 0.13482943310261095.
[I 2024-12-03 18:42:18,908] Trial 129 finished with value: 1.0161383864728173 and parameters: {'kernel': 'sigmoid', 'C': 1.1893997910888674, 'gamma': 0.00012428548156245145, 'epsilon': 0.13336652470812793}. Best is trial 60 with value: 0.13482943310261095.
[I 2024-12-03 18:42:19,278] Trial 111 finished with value: 0.13631070206157092 and parameters: {'kernel': 'linear', 'C': 34.87934921998656, 'gamma': 0.4410626992023532, 'epsilon': 0.042903756635633054}. Best is trial 60 with value: 0.13482943310261095.
[I 2024-12-03 18:42:19,916] Trial 117 finished with value: 0.15642412698617977 and parameters: {'kernel': 'linear', 'C': 84.28545114614492, 'gamma': 0.023751517122786343, 'epsilon': 0.15692087459675902}. Best is trial 60 with value: 0.13482943310261095.
[I 2024-12-03 18:42:19,944] Trial 118 finished with value: 0.2733022986364704 and parameters: {'kernel': 'linear', 'C': 69.87894170199856, 'gamma': 0.019698982359416566, 'epsilon': 0.40948529086237784}. Best is trial 60 with value: 0.13482943310261095.
[I 2024-12-03 18:42:21,989] Trial 65 finished with value: 0.13544268661400766 and parameters: {'kernel': 'linear', 'C': 95.21934553590994, 'gamma': 0.0004307789429668111, 'epsilon': 0.06581925180646667}. Best is trial 60 with value: 0.13482943310261095.
[I 2024-12-03 18:42:22,076] Trial 107 finished with value: 0.1363034013929295 and parameters: {'kernel': 'linear', 'C': 32.04297457463153, 'gamma': 0.00013669871939707068, 'epsilon': 0.050925044038787975}. Best is trial 60 with value: 0.13482943310261095.
[I 2024-12-03 18:42:22,092] Trial 127 finished with value: 1.3641238281566122 and parameters: {'kernel': 'sigmoid', 'C': 0.0028018113472437914, 'gamma': 0.00016561676628581342, 'epsilon': 0.13687698509129578}. Best is trial 60 with value: 0.13482943310261095.
[I 2024-12-03 18:42:22,099] Trial 86 finished with value: 0.13742045074410494 and parameters: {'kernel': 'linear', 'C': 33.92493715371022, 'gamma': 0.0015783933890171104, 'epsilon': 0.0031309503899904657}. Best is trial 60 with value: 0.13482943310261095.
[I 2024-12-03 18:42:22,431] Trial 114 finished with value: 0.13620061513959825 and parameters: {'kernel': 'linear', 'C': 11.37666403666245, 'gamma': 0.2476919604868288, 'epsilon': 0.043094786359231536}. Best is trial 60 with value: 0.13482943310261095.
[I 2024-12-03 18:42:22,448] Trial 124 finished with value: 0.1364364552281402 and parameters: {'kernel': 'linear', 'C': 6.036755337240755, 'gamma': 0.000629825305658628, 'epsilon': 0.04527662965041206}. Best is trial 60 with value: 0.13482943310261095.
[I 2024-12-03 18:42:22,549] Trial 122 finished with value: 0.14371257734508586 and parameters: {'kernel': 'linear', 'C': 9.421319019320032, 'gamma': 0.011321283529290318, 'epsilon': 0.1114032268782886}. Best is trial 60 with value: 0.13482943310261095.
[I 2024-12-03 18:42:22,677] Trial 120 finished with value: 0.13599880122634422 and parameters: {'kernel': 'linear', 'C': 7.148730114124465, 'gamma': 0.0001177230598713832, 'epsilon': 0.036925037594077885}. Best is trial 60 with value: 0.13482943310261095.
[I 2024-12-03 18:42:22,753] Trial 88 finished with value: 0.1376848881507203 and parameters: {'kernel': 'linear', 'C': 27.31327956861273, 'gamma': 0.013387212023978223, 'epsilon': 0.0013515572767142192}. Best is trial 60 with value: 0.13482943310261095.
[I 2024-12-03 18:42:22,772] Trial 98 finished with value: 0.13564853351112308 and parameters: {'kernel': 'linear', 'C': 31.878427625074785, 'gamma': 0.03803582772342714, 'epsilon': 0.03468792347585381}. Best is trial 60 with value: 0.13482943310261095.
[I 2024-12-03 18:42:23,375] Trial 67 finished with value: 0.1374660920867773 and parameters: {'kernel': 'linear', 'C': 80.1844074650842, 'gamma': 0.000560483167503011, 'epsilon': 0.021753661413201474}. Best is trial 60 with value: 0.13482943310261095.
[I 2024-12-03 18:42:23,470] Trial 113 finished with value: 0.13833180826418542 and parameters: {'kernel': 'linear', 'C': 86.88366625085195, 'gamma': 0.08787575150273405, 'epsilon': 0.08218699539936258}. Best is trial 60 with value: 0.13482943310261095.
[I 2024-12-03 18:42:24,651] Trial 140 finished with value: 1.3590622296677692 and parameters: {'kernel': 'poly', 'C': 12.022965618942756, 'gamma': 0.00013403236659753715, 'epsilon': 0.01545043655027159}. Best is trial 60 with value: 0.13482943310261095.
[I 2024-12-03 18:42:25,093] Trial 125 finished with value: 0.13676036905497374 and parameters: {'kernel': 'linear', 'C': 3.1844387736036075, 'gamma': 0.27537748060519635, 'epsilon': 0.0568341372524165}. Best is trial 60 with value: 0.13482943310261095.
[I 2024-12-03 18:42:25,244] Trial 139 finished with value: 0.4080581254106647 and parameters: {'kernel': 'sigmoid', 'C': 18.465862918456768, 'gamma': 0.00012917858606532195, 'epsilon': 0.02710135974295629}. Best is trial 60 with value: 0.13482943310261095.
[I 2024-12-03 18:42:26,925] Trial 146 finished with value: 0.13861674187422274 and parameters: {'kernel': 'linear', 'C': 2.8042845031779855, 'gamma': 0.11819321889602082, 'epsilon': 0.05971600339348059}. Best is trial 60 with value: 0.13482943310261095.
[I 2024-12-03 18:42:27,582] Trial 141 finished with value: 0.14187178748037743 and parameters: {'kernel': 'linear', 'C': 2.6682976777392993, 'gamma': 0.00016233936362209885, 'epsilon': 0.07612609162674892}. Best is trial 60 with value: 0.13482943310261095.
[I 2024-12-03 18:42:28,055] Trial 109 finished with value: 0.13539175695656605 and parameters: {'kernel': 'linear', 'C': 20.934154623502387, 'gamma': 0.05554173411271245, 'epsilon': 0.0312064391869044}. Best is trial 60 with value: 0.13482943310261095.
[I 2024-12-03 18:42:28,289] Trial 148 finished with value: 0.9361212773675384 and parameters: {'kernel': 'poly', 'C': 0.012050721546189516, 'gamma': 0.0354096745288454, 'epsilon': 0.131830595929855}. Best is trial 60 with value: 0.13482943310261095.
[I 2024-12-03 18:42:28,383] Trial 135 finished with value: 0.13811383191845833 and parameters: {'kernel': 'linear', 'C': 62.393945488214904, 'gamma': 0.00024130503853455587, 'epsilon': 0.07967176873387469}. Best is trial 60 with value: 0.13482943310261095.
[I 2024-12-03 18:42:28,617] Trial 134 finished with value: 1.2852544219407664 and parameters: {'kernel': 'rbf', 'C': 0.0036099411992922925, 'gamma': 0.012888397660414398, 'epsilon': 0.01956624200806612}. Best is trial 60 with value: 0.13482943310261095.
[I 2024-12-03 18:42:28,665] Trial 123 finished with value: 0.13560957285756486 and parameters: {'kernel': 'linear', 'C': 19.651240900737772, 'gamma': 0.0007756851221122454, 'epsilon': 0.05297929919524243}. Best is trial 60 with value: 0.13482943310261095.
[I 2024-12-03 18:42:28,825] Trial 147 finished with value: 0.14079410311921767 and parameters: {'kernel': 'linear', 'C': 9.395710506724132, 'gamma': 0.05019146900969888, 'epsilon': 0.08672844275583047}. Best is trial 60 with value: 0.13482943310261095.
[I 2024-12-03 18:42:29,234] Trial 149 finished with value: 0.9843965116993636 and parameters: {'kernel': 'rbf', 'C': 0.624244240611821, 'gamma': 0.00013143907610030752, 'epsilon': 0.11878543505850647}. Best is trial 60 with value: 0.13482943310261095.
