[I 2024-12-04 12:05:04,799] Trial 2084 finished with value: 0.8101385948198155 and parameters: {'max_depth': 35, 'min_samples_split': 2, 'min_samples_leaf': 3, 'max_features': 'sqrt', 'criterion': 'squared_error', 'splitter': 'best'}. Best is trial 838 with value: 0.5900375110830633.
[I 2024-12-04 12:05:05,353] Trial 2081 finished with value: 0.7482013871683771 and parameters: {'max_depth': 35, 'min_samples_split': 2, 'min_samples_leaf': 1, 'max_features': 'sqrt', 'criterion': 'absolute_error', 'splitter': 'best'}. Best is trial 838 with value: 0.5900375110830633.
[I 2024-12-04 12:05:06,030] Trial 2088 finished with value: 0.8241861685151659 and parameters: {'max_depth': 35, 'min_samples_split': 3, 'min_samples_leaf': 2, 'max_features': 'sqrt', 'criterion': 'squared_error', 'splitter': 'best'}. Best is trial 838 with value: 0.5900375110830633.
[I 2024-12-04 12:05:06,476] Trial 2082 finished with value: 0.7531469782681599 and parameters: {'max_depth': 30, 'min_samples_split': 4, 'min_samples_leaf': 2, 'max_features': 'sqrt', 'criterion': 'squared_error', 'splitter': 'random'}. Best is trial 838 with value: 0.5900375110830633.
[I 2024-12-04 12:05:06,876] Trial 2086 finished with value: 0.6960703836181407 and parameters: {'max_depth': 32, 'min_samples_split': 2, 'min_samples_leaf': 1, 'max_features': 'sqrt', 'criterion': 'friedman_mse', 'splitter': 'best'}. Best is trial 838 with value: 0.5900375110830633.
[I 2024-12-04 12:05:07,187] Trial 2083 finished with value: 0.8225022089543504 and parameters: {'max_depth': 30, 'min_samples_split': 6, 'min_samples_leaf': 2, 'max_features': 'sqrt', 'criterion': 'squared_error', 'splitter': 'best'}. Best is trial 838 with value: 0.5900375110830633.
[I 2024-12-04 12:05:07,439] Trial 2091 finished with value: 0.6671320020529113 and parameters: {'max_depth': 30, 'min_samples_split': 6, 'min_samples_leaf': 1, 'max_features': 'sqrt', 'criterion': 'squared_error', 'splitter': 'best'}. Best is trial 838 with value: 0.5900375110830633.
[I 2024-12-04 12:05:09,336] Trial 2095 finished with value: 0.7955075067752949 and parameters: {'max_depth': 29, 'min_samples_split': 9, 'min_samples_leaf': 2, 'max_features': 'log2', 'criterion': 'squared_error', 'splitter': 'best'}. Best is trial 838 with value: 0.5900375110830633.
[I 2024-12-04 12:05:09,465] Trial 2085 finished with value: 1.092723027538113 and parameters: {'max_depth': 18, 'min_samples_split': 15, 'min_samples_leaf': 8, 'max_features': 'log2', 'criterion': 'squared_error', 'splitter': 'random'}. Best is trial 838 with value: 0.5900375110830633.
[I 2024-12-04 12:05:10,597] Trial 2099 finished with value: 1.0740768482351102 and parameters: {'max_depth': 2, 'min_samples_split': 10, 'min_samples_leaf': 1, 'max_features': 'log2', 'criterion': 'absolute_error', 'splitter': 'best'}. Best is trial 838 with value: 0.5900375110830633.
[I 2024-12-04 12:05:10,687] Trial 2087 finished with value: 0.7291342883560936 and parameters: {'max_depth': 35, 'min_samples_split': 5, 'min_samples_leaf': 1, 'max_features': 'sqrt', 'criterion': 'squared_error', 'splitter': 'best'}. Best is trial 838 with value: 0.5900375110830633.
[I 2024-12-04 12:05:11,022] Trial 2089 finished with value: 0.7291342883560936 and parameters: {'max_depth': 35, 'min_samples_split': 5, 'min_samples_leaf': 1, 'max_features': 'sqrt', 'criterion': 'squared_error', 'splitter': 'best'}. Best is trial 838 with value: 0.5900375110830633.
[I 2024-12-04 12:05:11,420] Trial 2080 finished with value: 0.6361563548204678 and parameters: {'max_depth': 30, 'min_samples_split': 4, 'min_samples_leaf': 1, 'max_features': 'sqrt', 'criterion': 'squared_error', 'splitter': 'best'}. Best is trial 838 with value: 0.5900375110830633.
[I 2024-12-04 12:05:11,430] Trial 2096 finished with value: 0.7231530055805183 and parameters: {'max_depth': 30, 'min_samples_split': 2, 'min_samples_leaf': 1, 'max_features': 'sqrt', 'criterion': 'squared_error', 'splitter': 'best'}. Best is trial 838 with value: 0.5900375110830633.
[I 2024-12-04 12:05:11,623] Trial 2092 finished with value: 0.6361563548204678 and parameters: {'max_depth': 30, 'min_samples_split': 4, 'min_samples_leaf': 1, 'max_features': 'sqrt', 'criterion': 'squared_error', 'splitter': 'best'}. Best is trial 838 with value: 0.5900375110830633.
[I 2024-12-04 12:05:12,188] Trial 2076 finished with value: 0.676636829282285 and parameters: {'max_depth': 35, 'min_samples_split': 6, 'min_samples_leaf': 1, 'max_features': 'sqrt', 'criterion': 'squared_error', 'splitter': 'best'}. Best is trial 838 with value: 0.5900375110830633.
[I 2024-12-04 12:05:12,208] Trial 2090 finished with value: 0.7044023234155515 and parameters: {'max_depth': 35, 'min_samples_split': 2, 'min_samples_leaf': 1, 'max_features': 'sqrt', 'criterion': 'squared_error', 'splitter': 'best'}. Best is trial 838 with value: 0.5900375110830633.
[I 2024-12-04 12:05:12,507] Trial 2094 finished with value: 0.59023342761678 and parameters: {'max_depth': 35, 'min_samples_split': 4, 'min_samples_leaf': 1, 'max_features': 'sqrt', 'criterion': 'squared_error', 'splitter': 'best'}. Best is trial 838 with value: 0.5900375110830633.
[I 2024-12-04 12:05:12,957] Trial 2100 finished with value: 0.8225022089543504 and parameters: {'max_depth': 23, 'min_samples_split': 6, 'min_samples_leaf': 2, 'max_features': 'sqrt', 'criterion': 'squared_error', 'splitter': 'best'}. Best is trial 838 with value: 0.5900375110830633.
[I 2024-12-04 12:05:13,419] Trial 2107 finished with value: 0.8209492412990053 and parameters: {'max_depth': 35, 'min_samples_split': 7, 'min_samples_leaf': 2, 'max_features': 'sqrt', 'criterion': 'squared_error', 'splitter': 'best'}. Best is trial 838 with value: 0.5900375110830633.
[I 2024-12-04 12:05:13,605] Trial 2104 finished with value: 0.8391355810268111 and parameters: {'max_depth': 30, 'min_samples_split': 8, 'min_samples_leaf': 2, 'max_features': 'sqrt', 'criterion': 'squared_error', 'splitter': 'best'}. Best is trial 838 with value: 0.5900375110830633.
[I 2024-12-04 12:05:14,291] Trial 2098 finished with value: 1.0689310653398096 and parameters: {'max_depth': 5, 'min_samples_split': 4, 'min_samples_leaf': 3, 'max_features': 'log2', 'criterion': 'absolute_error', 'splitter': 'random'}. Best is trial 838 with value: 0.5900375110830633.
[I 2024-12-04 12:05:14,471] Trial 2105 finished with value: 0.59023342761678 and parameters: {'max_depth': 35, 'min_samples_split': 4, 'min_samples_leaf': 1, 'max_features': 'sqrt', 'criterion': 'squared_error', 'splitter': 'best'}. Best is trial 838 with value: 0.5900375110830633.
[I 2024-12-04 12:05:14,711] Trial 2103 finished with value: 0.7291342883560936 and parameters: {'max_depth': 35, 'min_samples_split': 5, 'min_samples_leaf': 1, 'max_features': 'sqrt', 'criterion': 'squared_error', 'splitter': 'best'}. Best is trial 838 with value: 0.5900375110830633.
[I 2024-12-04 12:05:14,886] Trial 2093 finished with value: 0.8253909316251304 and parameters: {'max_depth': 35, 'min_samples_split': 6, 'min_samples_leaf': 2, 'max_features': 'log2', 'criterion': 'squared_error', 'splitter': 'best'}. Best is trial 838 with value: 0.5900375110830633.
[I 2024-12-04 12:05:15,458] Trial 2117 finished with value: 0.8101385948198155 and parameters: {'max_depth': 29, 'min_samples_split': 4, 'min_samples_leaf': 3, 'max_features': 'sqrt', 'criterion': 'squared_error', 'splitter': 'best'}. Best is trial 838 with value: 0.5900375110830633.
[I 2024-12-04 12:05:15,781] Trial 2102 finished with value: 0.8101385948198155 and parameters: {'max_depth': 35, 'min_samples_split': 5, 'min_samples_leaf': 3, 'max_features': 'sqrt', 'criterion': 'squared_error', 'splitter': 'best'}. Best is trial 838 with value: 0.5900375110830633.
[I 2024-12-04 12:05:15,810] Trial 2109 finished with value: 0.7486339970164284 and parameters: {'max_depth': 23, 'min_samples_split': 5, 'min_samples_leaf': 1, 'max_features': 'sqrt', 'criterion': 'squared_error', 'splitter': 'best'}. Best is trial 838 with value: 0.5900375110830633.
[I 2024-12-04 12:05:15,945] Trial 2112 finished with value: 0.7987748637010382 and parameters: {'max_depth': 35, 'min_samples_split': 7, 'min_samples_leaf': 3, 'max_features': 'sqrt', 'criterion': 'squared_error', 'splitter': 'best'}. Best is trial 838 with value: 0.5900375110830633.
[I 2024-12-04 12:05:15,984] Trial 2101 finished with value: 0.7989492908150976 and parameters: {'max_depth': 35, 'min_samples_split': 6, 'min_samples_leaf': 1, 'max_features': 'sqrt', 'criterion': 'squared_error', 'splitter': 'random'}. Best is trial 838 with value: 0.5900375110830633.
[I 2024-12-04 12:05:17,067] Trial 2115 finished with value: 0.6361563548204678 and parameters: {'max_depth': 30, 'min_samples_split': 4, 'min_samples_leaf': 1, 'max_features': 'sqrt', 'criterion': 'squared_error', 'splitter': 'best'}. Best is trial 838 with value: 0.5900375110830633.
[I 2024-12-04 12:05:18,205] Trial 2118 finished with value: 1.092723027538113 and parameters: {'max_depth': 34, 'min_samples_split': 16, 'min_samples_leaf': 8, 'max_features': 'log2', 'criterion': 'friedman_mse', 'splitter': 'random'}. Best is trial 838 with value: 0.5900375110830633.
[I 2024-12-04 12:05:19,415] Trial 2111 finished with value: 0.8101385948198155 and parameters: {'max_depth': 29, 'min_samples_split': 4, 'min_samples_leaf': 3, 'max_features': 'sqrt', 'criterion': 'squared_error', 'splitter': 'best'}. Best is trial 838 with value: 0.5900375110830633.
[I 2024-12-04 12:05:19,790] Trial 2116 finished with value: 0.7561416007830879 and parameters: {'max_depth': 35, 'min_samples_split': 3, 'min_samples_leaf': 1, 'max_features': 'log2', 'criterion': 'squared_error', 'splitter': 'best'}. Best is trial 838 with value: 0.5900375110830633.
[I 2024-12-04 12:05:20,554] Trial 2114 finished with value: 0.6361563548204678 and parameters: {'max_depth': 30, 'min_samples_split': 4, 'min_samples_leaf': 1, 'max_features': 'sqrt', 'criterion': 'squared_error', 'splitter': 'best'}. Best is trial 838 with value: 0.5900375110830633.
[I 2024-12-04 12:05:21,147] Trial 2097 finished with value: 1.075383350593605 and parameters: {'max_depth': 34, 'min_samples_split': 17, 'min_samples_leaf': 9, 'max_features': 'sqrt', 'criterion': 'absolute_error', 'splitter': 'random'}. Best is trial 838 with value: 0.5900375110830633.
[I 2024-12-04 12:05:22,052] Trial 2123 finished with value: 0.6777561409658496 and parameters: {'max_depth': 30, 'min_samples_split': 5, 'min_samples_leaf': 1, 'max_features': 'sqrt', 'criterion': 'squared_error', 'splitter': 'best'}. Best is trial 838 with value: 0.5900375110830633.
[I 2024-12-04 12:05:22,055] Trial 2108 finished with value: 0.676636829282285 and parameters: {'max_depth': 35, 'min_samples_split': 6, 'min_samples_leaf': 1, 'max_features': 'sqrt', 'criterion': 'squared_error', 'splitter': 'best'}. Best is trial 838 with value: 0.5900375110830633.
[I 2024-12-04 12:05:22,337] Trial 2110 finished with value: 0.6207030990698891 and parameters: {'max_depth': 23, 'min_samples_split': 2, 'min_samples_leaf': 1, 'max_features': 'sqrt', 'criterion': 'squared_error', 'splitter': 'best'}. Best is trial 838 with value: 0.5900375110830633.
[I 2024-12-04 12:05:23,206] Trial 2126 finished with value: 0.59023342761678 and parameters: {'max_depth': 35, 'min_samples_split': 4, 'min_samples_leaf': 1, 'max_features': 'sqrt', 'criterion': 'squared_error', 'splitter': 'best'}. Best is trial 838 with value: 0.5900375110830633.
[I 2024-12-04 12:05:23,804] Trial 2121 finished with value: 0.7291342883560936 and parameters: {'max_depth': 35, 'min_samples_split': 5, 'min_samples_leaf': 1, 'max_features': 'sqrt', 'criterion': 'squared_error', 'splitter': 'best'}. Best is trial 838 with value: 0.5900375110830633.
[I 2024-12-04 12:05:24,548] Trial 2113 finished with value: 0.8101385948198155 and parameters: {'max_depth': 35, 'min_samples_split': 2, 'min_samples_leaf': 3, 'max_features': 'sqrt', 'criterion': 'squared_error', 'splitter': 'best'}. Best is trial 838 with value: 0.5900375110830633.
[I 2024-12-04 12:05:24,759] Trial 2129 finished with value: 0.6207030990698891 and parameters: {'max_depth': 23, 'min_samples_split': 2, 'min_samples_leaf': 1, 'max_features': 'sqrt', 'criterion': 'squared_error', 'splitter': 'best'}. Best is trial 838 with value: 0.5900375110830633.
[I 2024-12-04 12:05:25,488] Trial 2130 finished with value: 1.0526519156681744 and parameters: {'max_depth': 5, 'min_samples_split': 2, 'min_samples_leaf': 6, 'max_features': 'sqrt', 'criterion': 'squared_error', 'splitter': 'best'}. Best is trial 838 with value: 0.5900375110830633.
[I 2024-12-04 12:05:25,941] Trial 2124 finished with value: 0.59023342761678 and parameters: {'max_depth': 35, 'min_samples_split': 4, 'min_samples_leaf': 1, 'max_features': 'sqrt', 'criterion': 'squared_error', 'splitter': 'best'}. Best is trial 838 with value: 0.5900375110830633.
[I 2024-12-04 12:05:25,943] Trial 2120 finished with value: 0.713722108439527 and parameters: {'max_depth': 35, 'min_samples_split': 3, 'min_samples_leaf': 1, 'max_features': 'sqrt', 'criterion': 'friedman_mse', 'splitter': 'best'}. Best is trial 838 with value: 0.5900375110830633.
[I 2024-12-04 12:05:26,094] Trial 2127 finished with value: 0.8101385948198155 and parameters: {'max_depth': 28, 'min_samples_split': 2, 'min_samples_leaf': 3, 'max_features': 'sqrt', 'criterion': 'squared_error', 'splitter': 'best'}. Best is trial 838 with value: 0.5900375110830633.
[I 2024-12-04 12:05:26,127] Trial 2122 finished with value: 0.7229093250446635 and parameters: {'max_depth': 34, 'min_samples_split': 6, 'min_samples_leaf': 1, 'max_features': 'sqrt', 'criterion': 'absolute_error', 'splitter': 'best'}. Best is trial 838 with value: 0.5900375110830633.
[I 2024-12-04 12:05:26,346] Trial 2125 finished with value: 0.8209492412990053 and parameters: {'max_depth': 29, 'min_samples_split': 7, 'min_samples_leaf': 2, 'max_features': 'sqrt', 'criterion': 'squared_error', 'splitter': 'best'}. Best is trial 838 with value: 0.5900375110830633.
[I 2024-12-04 12:05:28,145] Trial 2138 finished with value: 0.7291342883560936 and parameters: {'max_depth': 35, 'min_samples_split': 5, 'min_samples_leaf': 1, 'max_features': 'sqrt', 'criterion': 'squared_error', 'splitter': 'best'}. Best is trial 838 with value: 0.5900375110830633.
[I 2024-12-04 12:05:28,296] Trial 2119 finished with value: 0.8300015320785108 and parameters: {'max_depth': 35, 'min_samples_split': 5, 'min_samples_leaf': 2, 'max_features': 'sqrt', 'criterion': 'squared_error', 'splitter': 'best'}. Best is trial 838 with value: 0.5900375110830633.
[I 2024-12-04 12:05:28,586] Trial 2106 finished with value: 0.7044023234155515 and parameters: {'max_depth': 35, 'min_samples_split': 2, 'min_samples_leaf': 1, 'max_features': 'sqrt', 'criterion': 'squared_error', 'splitter': 'best'}. Best is trial 838 with value: 0.5900375110830633.
[I 2024-12-04 12:05:28,592] Trial 2131 finished with value: 0.7242053946898249 and parameters: {'max_depth': 30, 'min_samples_split': 7, 'min_samples_leaf': 1, 'max_features': 'sqrt', 'criterion': 'squared_error', 'splitter': 'best'}. Best is trial 838 with value: 0.5900375110830633.
[I 2024-12-04 12:05:28,736] Trial 2133 finished with value: 0.6777561409658496 and parameters: {'max_depth': 30, 'min_samples_split': 5, 'min_samples_leaf': 1, 'max_features': 'sqrt', 'criterion': 'friedman_mse', 'splitter': 'best'}. Best is trial 838 with value: 0.5900375110830633.
[I 2024-12-04 12:05:28,774] Trial 2135 finished with value: 1.092723027538113 and parameters: {'max_depth': 13, 'min_samples_split': 20, 'min_samples_leaf': 9, 'max_features': 'log2', 'criterion': 'squared_error', 'splitter': 'random'}. Best is trial 838 with value: 0.5900375110830633.
[I 2024-12-04 12:05:28,988] Trial 2134 finished with value: 0.9450964332687992 and parameters: {'max_depth': 31, 'min_samples_split': 3, 'min_samples_leaf': 3, 'max_features': 'log2', 'criterion': 'squared_error', 'splitter': 'best'}. Best is trial 838 with value: 0.5900375110830633.
[I 2024-12-04 12:05:29,167] Trial 2143 finished with value: 0.59023342761678 and parameters: {'max_depth': 35, 'min_samples_split': 4, 'min_samples_leaf': 1, 'max_features': 'sqrt', 'criterion': 'squared_error', 'splitter': 'best'}. Best is trial 838 with value: 0.5900375110830633.
[I 2024-12-04 12:05:29,168] Trial 2139 finished with value: 0.7044023234155515 and parameters: {'max_depth': 35, 'min_samples_split': 2, 'min_samples_leaf': 1, 'max_features': 'sqrt', 'criterion': 'squared_error', 'splitter': 'best'}. Best is trial 838 with value: 0.5900375110830633.
[I 2024-12-04 12:05:29,289] Trial 2132 finished with value: 1.091656728529238 and parameters: {'max_depth': 6, 'min_samples_split': 3, 'min_samples_leaf': 10, 'max_features': 'log2', 'criterion': 'friedman_mse', 'splitter': 'best'}. Best is trial 838 with value: 0.5900375110830633.
[I 2024-12-04 12:05:29,291] Trial 2136 finished with value: 0.8066762268897443 and parameters: {'max_depth': 35, 'min_samples_split': 9, 'min_samples_leaf': 3, 'max_features': 'sqrt', 'criterion': 'squared_error', 'splitter': 'best'}. Best is trial 838 with value: 0.5900375110830633.
[I 2024-12-04 12:05:29,581] Trial 2128 finished with value: 0.6914476389215761 and parameters: {'max_depth': 22, 'min_samples_split': 4, 'min_samples_leaf': 1, 'max_features': 'sqrt', 'criterion': 'friedman_mse', 'splitter': 'best'}. Best is trial 838 with value: 0.5900375110830633.
[I 2024-12-04 12:05:30,215] Trial 2137 finished with value: 0.8101385948198155 and parameters: {'max_depth': 35, 'min_samples_split': 4, 'min_samples_leaf': 3, 'max_features': 'sqrt', 'criterion': 'squared_error', 'splitter': 'best'}. Best is trial 838 with value: 0.5900375110830633.
[I 2024-12-04 12:05:31,899] Trial 2140 finished with value: 0.8101385948198155 and parameters: {'max_depth': 29, 'min_samples_split': 5, 'min_samples_leaf': 3, 'max_features': 'sqrt', 'criterion': 'squared_error', 'splitter': 'best'}. Best is trial 838 with value: 0.5900375110830633.
[I 2024-12-04 12:05:32,107] Trial 2142 finished with value: 0.8101385948198155 and parameters: {'max_depth': 35, 'min_samples_split': 2, 'min_samples_leaf': 3, 'max_features': 'sqrt', 'criterion': 'squared_error', 'splitter': 'best'}. Best is trial 838 with value: 0.5900375110830633.
[I 2024-12-04 12:05:32,368] Trial 2145 finished with value: 0.6416220728212735 and parameters: {'max_depth': 29, 'min_samples_split': 2, 'min_samples_leaf': 1, 'max_features': 'sqrt', 'criterion': 'squared_error', 'splitter': 'best'}. Best is trial 838 with value: 0.5900375110830633.
[I 2024-12-04 12:05:32,491] Trial 2141 finished with value: 0.6548912683909761 and parameters: {'max_depth': 29, 'min_samples_split': 5, 'min_samples_leaf': 1, 'max_features': 'sqrt', 'criterion': 'squared_error', 'splitter': 'best'}. Best is trial 838 with value: 0.5900375110830633.
[I 2024-12-04 12:05:33,093] Trial 2147 finished with value: 0.7722845288492907 and parameters: {'max_depth': 30, 'min_samples_split': 8, 'min_samples_leaf': 1, 'max_features': 'sqrt', 'criterion': 'squared_error', 'splitter': 'best'}. Best is trial 838 with value: 0.5900375110830633.
[I 2024-12-04 12:05:34,495] Trial 2150 finished with value: 0.8799691268308566 and parameters: {'max_depth': 24, 'min_samples_split': 6, 'min_samples_leaf': 6, 'max_features': 'sqrt', 'criterion': 'absolute_error', 'splitter': 'best'}. Best is trial 838 with value: 0.5900375110830633.
[I 2024-12-04 12:05:35,392] Trial 2146 finished with value: 0.676636829282285 and parameters: {'max_depth': 35, 'min_samples_split': 6, 'min_samples_leaf': 1, 'max_features': 'sqrt', 'criterion': 'squared_error', 'splitter': 'best'}. Best is trial 838 with value: 0.5900375110830633.
[I 2024-12-04 12:05:36,260] Trial 2148 finished with value: 0.6416220728212735 and parameters: {'max_depth': 29, 'min_samples_split': 2, 'min_samples_leaf': 1, 'max_features': 'sqrt', 'criterion': 'squared_error', 'splitter': 'best'}. Best is trial 838 with value: 0.5900375110830633.
[I 2024-12-04 12:05:36,266] Trial 2144 finished with value: 0.7291342883560936 and parameters: {'max_depth': 35, 'min_samples_split': 5, 'min_samples_leaf': 1, 'max_features': 'sqrt', 'criterion': 'friedman_mse', 'splitter': 'best'}. Best is trial 838 with value: 0.5900375110830633.
[I 2024-12-04 12:05:36,521] Trial 2160 finished with value: 0.774293158467234 and parameters: {'max_depth': 35, 'min_samples_split': 4, 'min_samples_leaf': 3, 'max_features': 'sqrt', 'criterion': 'absolute_error', 'splitter': 'best'}. Best is trial 838 with value: 0.5900375110830633.
[I 2024-12-04 12:05:36,957] Trial 2149 finished with value: 0.7044023234155515 and parameters: {'max_depth': 35, 'min_samples_split': 2, 'min_samples_leaf': 1, 'max_features': 'sqrt', 'criterion': 'squared_error', 'splitter': 'best'}. Best is trial 838 with value: 0.5900375110830633.
[I 2024-12-04 12:05:37,466] Trial 2153 finished with value: 0.8328651770740843 and parameters: {'max_depth': 14, 'min_samples_split': 13, 'min_samples_leaf': 1, 'max_features': 'sqrt', 'criterion': 'absolute_error', 'splitter': 'random'}. Best is trial 838 with value: 0.5900375110830633.
[I 2024-12-04 12:05:38,017] Trial 2157 finished with value: 0.8101385948198155 and parameters: {'max_depth': 35, 'min_samples_split': 5, 'min_samples_leaf': 3, 'max_features': 'sqrt', 'criterion': 'squared_error', 'splitter': 'best'}. Best is trial 838 with value: 0.5900375110830633.
[I 2024-12-04 12:05:39,300] Trial 2154 finished with value: 0.8860959900393195 and parameters: {'max_depth': 13, 'min_samples_split': 15, 'min_samples_leaf': 7, 'max_features': 'sqrt', 'criterion': 'absolute_error', 'splitter': 'best'}. Best is trial 838 with value: 0.5900375110830633.
[I 2024-12-04 12:05:39,584] Trial 2156 finished with value: 0.7674771189356004 and parameters: {'max_depth': 28, 'min_samples_split': 2, 'min_samples_leaf': 1, 'max_features': 'sqrt', 'criterion': 'squared_error', 'splitter': 'random'}. Best is trial 838 with value: 0.5900375110830633.
