[I 2024-12-03 18:49:21,501] Trial 1792 finished with value: 0.45105728517210664 and parameters: {'kernel': 'rbf', 'C': 88.94360900929, 'gamma': 0.01649585491163778, 'epsilon': 0.06219659427047053}. Best is trial 1119 with value: 0.4485361816812923.
[I 2024-12-03 18:49:22,140] Trial 1791 finished with value: 0.6044101322435237 and parameters: {'kernel': 'rbf', 'C': 93.72350819345655, 'gamma': 0.15320924378489126, 'epsilon': 0.058451655113799975}. Best is trial 1119 with value: 0.4485361816812923.
[I 2024-12-03 18:49:22,298] Trial 1795 finished with value: 0.5740849645842644 and parameters: {'kernel': 'rbf', 'C': 24.187509348291353, 'gamma': 0.004426851021682942, 'epsilon': 0.025101166978386227}. Best is trial 1119 with value: 0.4485361816812923.
[I 2024-12-03 18:49:23,388] Trial 1787 finished with value: 0.47365315714513384 and parameters: {'kernel': 'rbf', 'C': 26.07252171627538, 'gamma': 0.018034048728648118, 'epsilon': 0.008259127687548629}. Best is trial 1119 with value: 0.4485361816812923.
[I 2024-12-03 18:49:23,780] Trial 1797 finished with value: 0.8534694490200329 and parameters: {'kernel': 'linear', 'C': 0.002674285498738733, 'gamma': 0.00010889630437162396, 'epsilon': 0.002607491790576212}. Best is trial 1119 with value: 0.4485361816812923.
[I 2024-12-03 18:49:24,319] Trial 1806 finished with value: 0.45586145311008275 and parameters: {'kernel': 'rbf', 'C': 98.78746389923282, 'gamma': 0.013886264467918744, 'epsilon': 0.09368663010556888}. Best is trial 1119 with value: 0.4485361816812923.
[I 2024-12-03 18:49:24,711] Trial 1782 finished with value: 0.5551849847885836 and parameters: {'kernel': 'linear', 'C': 85.06653711681304, 'gamma': 0.023310590996628935, 'epsilon': 0.016511286614815403}. Best is trial 1119 with value: 0.4485361816812923.
[I 2024-12-03 18:49:24,715] Trial 1799 finished with value: 0.7800417020101403 and parameters: {'kernel': 'rbf', 'C': 2.7920207460703184, 'gamma': 0.002491811944297163, 'epsilon': 0.030563190991657246}. Best is trial 1119 with value: 0.4485361816812923.
[I 2024-12-03 18:49:24,736] Trial 1789 finished with value: 0.4665836739915282 and parameters: {'kernel': 'rbf', 'C': 99.9538188484244, 'gamma': 0.009489230098541307, 'epsilon': 0.04466566750023212}. Best is trial 1119 with value: 0.4485361816812923.
[I 2024-12-03 18:49:25,132] Trial 1803 finished with value: 0.46224320692094917 and parameters: {'kernel': 'rbf', 'C': 27.267987735531513, 'gamma': 0.026045488524942102, 'epsilon': 0.05024810912725569}. Best is trial 1119 with value: 0.4485361816812923.
[I 2024-12-03 18:49:25,199] Trial 1801 finished with value: 0.49273165520072076 and parameters: {'kernel': 'rbf', 'C': 23.18833416214729, 'gamma': 0.014909328512759066, 'epsilon': 0.022156625656763136}. Best is trial 1119 with value: 0.4485361816812923.
[I 2024-12-03 18:49:25,499] Trial 1800 finished with value: 0.7809886697221327 and parameters: {'kernel': 'poly', 'C': 65.86135045962699, 'gamma': 0.0206047153818813, 'epsilon': 0.01822615836856814}. Best is trial 1119 with value: 0.4485361816812923.
[I 2024-12-03 18:49:26,052] Trial 1805 finished with value: 0.5225131279376237 and parameters: {'kernel': 'rbf', 'C': 89.02336167643197, 'gamma': 0.004017147050903854, 'epsilon': 0.03993182198923393}. Best is trial 1119 with value: 0.4485361816812923.
[I 2024-12-03 18:49:26,095] Trial 1808 finished with value: 0.9541097135651376 and parameters: {'kernel': 'poly', 'C': 82.18407074404126, 'gamma': 0.007228192645960805, 'epsilon': 0.0834014500580775}. Best is trial 1119 with value: 0.4485361816812923.
[I 2024-12-03 18:49:26,180] Trial 1794 finished with value: 0.6275472470954779 and parameters: {'kernel': 'rbf', 'C': 25.472209855537884, 'gamma': 0.0020190366930048407, 'epsilon': 0.0681899679575599}. Best is trial 1119 with value: 0.4485361816812923.
[I 2024-12-03 18:49:26,189] Trial 1804 finished with value: 0.8572655030599161 and parameters: {'kernel': 'poly', 'C': 57.90251852443667, 'gamma': 0.012636143700686204, 'epsilon': 0.3005869007160838}. Best is trial 1119 with value: 0.4485361816812923.
[I 2024-12-03 18:49:26,362] Trial 1802 finished with value: 0.5719842418320776 and parameters: {'kernel': 'linear', 'C': 37.96904876797043, 'gamma': 0.00766572979109832, 'epsilon': 0.09716358149910123}. Best is trial 1119 with value: 0.4485361816812923.
[I 2024-12-03 18:49:26,582] Trial 1798 finished with value: 0.46889305943441856 and parameters: {'kernel': 'rbf', 'C': 24.54571525987385, 'gamma': 0.032237651687076346, 'epsilon': 0.025423209316367386}. Best is trial 1119 with value: 0.4485361816812923.
[I 2024-12-03 18:49:26,589] Trial 1796 finished with value: 0.5634594285997895 and parameters: {'kernel': 'rbf', 'C': 98.01617301338092, 'gamma': 0.0016745541951622201, 'epsilon': 0.07139031680936297}. Best is trial 1119 with value: 0.4485361816812923.
[I 2024-12-03 18:49:27,708] Trial 1809 finished with value: 0.4891297174748246 and parameters: {'kernel': 'rbf', 'C': 20.34947253841354, 'gamma': 0.01584134307955548, 'epsilon': 0.11094613614081893}. Best is trial 1119 with value: 0.4485361816812923.
[I 2024-12-03 18:49:27,976] Trial 1812 finished with value: 0.5146095716316256 and parameters: {'kernel': 'rbf', 'C': 9.909335083308685, 'gamma': 0.06472141727036913, 'epsilon': 0.009794947024024782}. Best is trial 1119 with value: 0.4485361816812923.
[I 2024-12-03 18:49:28,310] Trial 1810 finished with value: 0.47434478656432855 and parameters: {'kernel': 'rbf', 'C': 92.54988596557718, 'gamma': 0.008211060592419437, 'epsilon': 0.065647043934392}. Best is trial 1119 with value: 0.4485361816812923.
[I 2024-12-03 18:49:28,693] Trial 1807 finished with value: 0.49778536533560314 and parameters: {'kernel': 'rbf', 'C': 95.02818358839103, 'gamma': 0.006025893633896975, 'epsilon': 0.014833219568408608}. Best is trial 1119 with value: 0.4485361816812923.
[I 2024-12-03 18:49:28,702] Trial 1811 finished with value: 0.49100571262371817 and parameters: {'kernel': 'rbf', 'C': 99.10604869075358, 'gamma': 0.02379686803338202, 'epsilon': 0.06663247602627734}. Best is trial 1119 with value: 0.4485361816812923.
[I 2024-12-03 18:49:30,222] Trial 1817 finished with value: 0.6228098505276536 and parameters: {'kernel': 'rbf', 'C': 94.60115900668694, 'gamma': 0.08438346226157596, 'epsilon': 0.05406564053791274}. Best is trial 1119 with value: 0.4485361816812923.
[I 2024-12-03 18:49:30,559] Trial 1814 finished with value: 0.4777071714914889 and parameters: {'kernel': 'rbf', 'C': 21.270627231598723, 'gamma': 0.03716469943031696, 'epsilon': 0.045139784730896}. Best is trial 1119 with value: 0.4485361816812923.
[I 2024-12-03 18:49:30,755] Trial 1819 finished with value: 0.5182963783931334 and parameters: {'kernel': 'rbf', 'C': 21.06102892665727, 'gamma': 0.011012407910622314, 'epsilon': 0.04265197224813452}. Best is trial 1119 with value: 0.4485361816812923.
[I 2024-12-03 18:49:32,144] Trial 1827 finished with value: 312.12810443541053 and parameters: {'kernel': 'sigmoid', 'C': 98.2463014384787, 'gamma': 0.017386801439787988, 'epsilon': 0.06708284026468522}. Best is trial 1119 with value: 0.4485361816812923.
[I 2024-12-03 18:49:32,246] Trial 1826 finished with value: 1.358419024668093 and parameters: {'kernel': 'sigmoid', 'C': 0.001987627892300027, 'gamma': 0.010912809271609182, 'epsilon': 0.07225261040790623}. Best is trial 1119 with value: 0.4485361816812923.
[I 2024-12-03 18:49:32,247] Trial 1825 finished with value: 0.47567847333131746 and parameters: {'kernel': 'rbf', 'C': 16.992123472888906, 'gamma': 0.03194244960885061, 'epsilon': 0.11568534678818683}. Best is trial 1119 with value: 0.4485361816812923.
[I 2024-12-03 18:49:34,109] Trial 1823 finished with value: 0.5085331811913991 and parameters: {'kernel': 'rbf', 'C': 25.04786321844901, 'gamma': 0.01307522271950348, 'epsilon': 0.21756633466569256}. Best is trial 1119 with value: 0.4485361816812923.
[I 2024-12-03 18:49:34,423] Trial 1828 finished with value: 0.7218417147751209 and parameters: {'kernel': 'rbf', 'C': 4.130199521795297, 'gamma': 0.004847502693529685, 'epsilon': 0.12649263306934277}. Best is trial 1119 with value: 0.4485361816812923.
[I 2024-12-03 18:49:35,831] Trial 1829 finished with value: 0.47107691300232635 and parameters: {'kernel': 'rbf', 'C': 95.31891774818942, 'gamma': 0.009777831548854067, 'epsilon': 0.007592759648737475}. Best is trial 1119 with value: 0.4485361816812923.
[I 2024-12-03 18:49:35,848] Trial 1816 finished with value: 0.46131764471760367 and parameters: {'kernel': 'rbf', 'C': 99.33084511366998, 'gamma': 0.01798089786535282, 'epsilon': 0.034360322761776634}. Best is trial 1119 with value: 0.4485361816812923.
[I 2024-12-03 18:49:36,002] Trial 1813 finished with value: 0.5607175121485486 and parameters: {'kernel': 'rbf', 'C': 98.36479222729135, 'gamma': 0.0018060296078474924, 'epsilon': 0.07288332008603034}. Best is trial 1119 with value: 0.4485361816812923.
[I 2024-12-03 18:49:36,508] Trial 1820 finished with value: 9.360543747181515 and parameters: {'kernel': 'sigmoid', 'C': 89.9673998912808, 'gamma': 0.0034757189115516445, 'epsilon': 0.2500029844714193}. Best is trial 1119 with value: 0.4485361816812923.
[I 2024-12-03 18:49:36,516] Trial 1824 finished with value: 0.521730022887426 and parameters: {'kernel': 'rbf', 'C': 18.822161526833742, 'gamma': 0.011925724091817032, 'epsilon': 0.09587075667958564}. Best is trial 1119 with value: 0.4485361816812923.
[I 2024-12-03 18:49:36,522] Trial 1836 finished with value: 0.49069634553618846 and parameters: {'kernel': 'rbf', 'C': 98.59869593625352, 'gamma': 0.025446635739172167, 'epsilon': 0.03953305024001007}. Best is trial 1119 with value: 0.4485361816812923.
[I 2024-12-03 18:49:37,238] Trial 1822 finished with value: 0.4893321097527916 and parameters: {'kernel': 'rbf', 'C': 96.68999618114835, 'gamma': 0.010332826575252443, 'epsilon': 0.21467884895842299}. Best is trial 1119 with value: 0.4485361816812923.
[I 2024-12-03 18:49:37,402] Trial 1818 finished with value: 0.5385866938303419 and parameters: {'kernel': 'rbf', 'C': 23.37177078237013, 'gamma': 0.007697874752408956, 'epsilon': 0.05567040241235649}. Best is trial 1119 with value: 0.4485361816812923.
[I 2024-12-03 18:49:37,621] Trial 1833 finished with value: 0.5618481204726821 and parameters: {'kernel': 'rbf', 'C': 19.84515875394674, 'gamma': 0.00557814096918214, 'epsilon': 0.041971561165206395}. Best is trial 1119 with value: 0.4485361816812923.
[I 2024-12-03 18:49:38,199] Trial 1832 finished with value: 0.47719630824530995 and parameters: {'kernel': 'rbf', 'C': 18.12330393240161, 'gamma': 0.030930848851890996, 'epsilon': 0.09387075975918947}. Best is trial 1119 with value: 0.4485361816812923.
[I 2024-12-03 18:49:38,340] Trial 1839 finished with value: 0.5522021240416193 and parameters: {'kernel': 'rbf', 'C': 21.124758137935853, 'gamma': 0.007602707164986326, 'epsilon': 0.24289314923685415}. Best is trial 1119 with value: 0.4485361816812923.
[I 2024-12-03 18:49:38,385] Trial 1815 finished with value: 0.5737852811863952 and parameters: {'kernel': 'linear', 'C': 21.94382819506892, 'gamma': 0.025358634123913665, 'epsilon': 0.06482737249507241}. Best is trial 1119 with value: 0.4485361816812923.
[I 2024-12-03 18:49:38,466] Trial 1831 finished with value: 0.46707292689290164 and parameters: {'kernel': 'rbf', 'C': 97.71833683923117, 'gamma': 0.009573528675107966, 'epsilon': 0.03841355560010662}. Best is trial 1119 with value: 0.4485361816812923.
[I 2024-12-03 18:49:38,529] Trial 1845 finished with value: 0.6098589490854264 and parameters: {'kernel': 'rbf', 'C': 92.06286074062446, 'gamma': 0.0884678518187607, 'epsilon': 0.10225071498876702}. Best is trial 1119 with value: 0.4485361816812923.
[I 2024-12-03 18:49:38,767] Trial 1842 finished with value: 0.6172454974550208 and parameters: {'kernel': 'rbf', 'C': 4.021958724188652, 'gamma': 0.01275529513851913, 'epsilon': 0.03169421476107296}. Best is trial 1119 with value: 0.4485361816812923.
[I 2024-12-03 18:49:39,053] Trial 1843 finished with value: 0.48338689568428855 and parameters: {'kernel': 'rbf', 'C': 98.95920142735837, 'gamma': 0.008823373875071108, 'epsilon': 0.184087586109936}. Best is trial 1119 with value: 0.4485361816812923.
[I 2024-12-03 18:49:39,126] Trial 1834 finished with value: 0.5545573908912104 and parameters: {'kernel': 'rbf', 'C': 24.826568014455813, 'gamma': 0.005633370502653978, 'epsilon': 0.045967045073289615}. Best is trial 1119 with value: 0.4485361816812923.
[I 2024-12-03 18:49:39,310] Trial 1840 finished with value: 0.5357304081176233 and parameters: {'kernel': 'rbf', 'C': 26.878955776176504, 'gamma': 0.0506858026301119, 'epsilon': 0.10885743716069424}. Best is trial 1119 with value: 0.4485361816812923.
[I 2024-12-03 18:49:39,313] Trial 1835 finished with value: 0.45263066603092167 and parameters: {'kernel': 'rbf', 'C': 93.32740747199595, 'gamma': 0.01107906475480302, 'epsilon': 0.08846816576773871}. Best is trial 1119 with value: 0.4485361816812923.
[I 2024-12-03 18:49:39,320] Trial 1821 finished with value: 0.6607970498736676 and parameters: {'kernel': 'rbf', 'C': 19.92188105425712, 'gamma': 0.001632343441568039, 'epsilon': 0.2586665552951893}. Best is trial 1119 with value: 0.4485361816812923.
[I 2024-12-03 18:49:39,624] Trial 1837 finished with value: 0.5072375900294482 and parameters: {'kernel': 'rbf', 'C': 97.53097004628829, 'gamma': 0.005187241098260943, 'epsilon': 0.01837661226137732}. Best is trial 1119 with value: 0.4485361816812923.
[I 2024-12-03 18:49:39,752] Trial 1830 finished with value: 0.5612110080301188 and parameters: {'kernel': 'linear', 'C': 3.53257869834963, 'gamma': 0.000823986696743639, 'epsilon': 0.08827973800678153}. Best is trial 1119 with value: 0.4485361816812923.
[I 2024-12-03 18:49:40,281] Trial 1847 finished with value: 0.6817473300599931 and parameters: {'kernel': 'sigmoid', 'C': 81.97020571197903, 'gamma': 0.0010767887872441865, 'epsilon': 0.07364972838351379}. Best is trial 1119 with value: 0.4485361816812923.
[I 2024-12-03 18:49:40,409] Trial 1841 finished with value: 0.4786501717512085 and parameters: {'kernel': 'rbf', 'C': 20.99412203584313, 'gamma': 0.018459822796134236, 'epsilon': 0.08354549460904799}. Best is trial 1119 with value: 0.4485361816812923.
[I 2024-12-03 18:49:40,597] Trial 1838 finished with value: 1.343719639428827 and parameters: {'kernel': 'rbf', 'C': 0.005185258587240966, 'gamma': 0.10454291831762383, 'epsilon': 0.028279477607761422}. Best is trial 1119 with value: 0.4485361816812923.
[I 2024-12-03 18:49:41,186] Trial 1846 finished with value: 0.4878689967860326 and parameters: {'kernel': 'rbf', 'C': 98.81997187888898, 'gamma': 0.0063353798888195435, 'epsilon': 0.044083311937213564}. Best is trial 1119 with value: 0.4485361816812923.
[I 2024-12-03 18:49:42,683] Trial 1844 finished with value: 0.5462636986554751 and parameters: {'kernel': 'rbf', 'C': 21.129759412649324, 'gamma': 0.0067379100744441684, 'epsilon': 0.09555534038308576}. Best is trial 1119 with value: 0.4485361816812923.
[I 2024-12-03 18:49:42,771] Trial 1851 finished with value: 0.7978267111048849 and parameters: {'kernel': 'poly', 'C': 0.07227124161232794, 'gamma': 0.23835367629738113, 'epsilon': 0.0017304494190556467}. Best is trial 1119 with value: 0.4485361816812923.
[I 2024-12-03 18:49:43,807] Trial 1852 finished with value: 0.6275773004952461 and parameters: {'kernel': 'rbf', 'C': 95.50288811888434, 'gamma': 0.08002254182776843, 'epsilon': 0.06253144010677261}. Best is trial 1119 with value: 0.4485361816812923.
[I 2024-12-03 18:49:43,813] Trial 1850 finished with value: 0.4750308525529714 and parameters: {'kernel': 'rbf', 'C': 18.277588011575425, 'gamma': 0.03618406212775311, 'epsilon': 0.05146698705726933}. Best is trial 1119 with value: 0.4485361816812923.
[I 2024-12-03 18:49:44,872] Trial 1860 finished with value: 0.5094701377376762 and parameters: {'kernel': 'rbf', 'C': 22.558148414066196, 'gamma': 0.0118649573727956, 'epsilon': 0.04470085965883441}. Best is trial 1119 with value: 0.4485361816812923.
[I 2024-12-03 18:49:44,875] Trial 1859 finished with value: 0.5615108716238844 and parameters: {'kernel': 'rbf', 'C': 21.846346989217587, 'gamma': 0.005008528371539776, 'epsilon': 0.08505885207830086}. Best is trial 1119 with value: 0.4485361816812923.
[I 2024-12-03 18:49:44,946] Trial 1857 finished with value: 0.5531108409921925 and parameters: {'kernel': 'rbf', 'C': 19.338544940322546, 'gamma': 0.006556588611980673, 'epsilon': 0.12248084313534657}. Best is trial 1119 with value: 0.4485361816812923.
[I 2024-12-03 18:49:45,945] Trial 1858 finished with value: 0.5490377415750239 and parameters: {'kernel': 'rbf', 'C': 87.21604458143092, 'gamma': 0.03309708625700949, 'epsilon': 0.12668852772086656}. Best is trial 1119 with value: 0.4485361816812923.
[I 2024-12-03 18:49:46,023] Trial 1862 finished with value: 0.557131145633706 and parameters: {'kernel': 'rbf', 'C': 92.63633414495374, 'gamma': 0.0021827059894233376, 'epsilon': 0.08517700385995991}. Best is trial 1119 with value: 0.4485361816812923.
[I 2024-12-03 18:49:46,472] Trial 1853 finished with value: 1.0208394844202473 and parameters: {'kernel': 'poly', 'C': 0.47334621990360387, 'gamma': 0.008525139523925238, 'epsilon': 0.8610677045563647}. Best is trial 1119 with value: 0.4485361816812923.
[I 2024-12-03 18:49:47,006] Trial 1867 finished with value: 1.3635420593648577 and parameters: {'kernel': 'rbf', 'C': 0.0012597471345052046, 'gamma': 0.002322390660685106, 'epsilon': 0.05248346158514319}. Best is trial 1119 with value: 0.4485361816812923.
[I 2024-12-03 18:49:47,007] Trial 1868 finished with value: 0.541989710381818 and parameters: {'kernel': 'rbf', 'C': 25.07797551343827, 'gamma': 0.05493408804802385, 'epsilon': 0.19591889201574617}. Best is trial 1119 with value: 0.4485361816812923.
[I 2024-12-03 18:49:47,290] Trial 1856 finished with value: 0.4890196128051966 and parameters: {'kernel': 'rbf', 'C': 99.89632729418707, 'gamma': 0.006255582273160486, 'epsilon': 0.03921552280112465}. Best is trial 1119 with value: 0.4485361816812923.
[I 2024-12-03 18:49:47,544] Trial 1849 finished with value: 1.3570357551513517 and parameters: {'kernel': 'rbf', 'C': 0.01874202111841218, 'gamma': 0.0005840688861627012, 'epsilon': 0.002400407524111117}. Best is trial 1119 with value: 0.4485361816812923.
[I 2024-12-03 18:49:48,107] Trial 1872 finished with value: 0.4757254265609985 and parameters: {'kernel': 'rbf', 'C': 25.274691090476658, 'gamma': 0.017038081204098984, 'epsilon': 0.023413672969119184}. Best is trial 1119 with value: 0.4485361816812923.
[I 2024-12-03 18:49:48,182] Trial 1874 finished with value: 0.4700971051758729 and parameters: {'kernel': 'rbf', 'C': 19.196402885312914, 'gamma': 0.02177123118684522, 'epsilon': 0.03478170305181696}. Best is trial 1119 with value: 0.4485361816812923.
[I 2024-12-03 18:49:48,259] Trial 1869 finished with value: 0.4583971409714038 and parameters: {'kernel': 'rbf', 'C': 96.3581957050561, 'gamma': 0.017723913682206535, 'epsilon': 0.050417206176792434}. Best is trial 1119 with value: 0.4485361816812923.
[I 2024-12-03 18:49:48,270] Trial 1865 finished with value: 0.4877765332053943 and parameters: {'kernel': 'rbf', 'C': 28.734314677602224, 'gamma': 0.01266416429942198, 'epsilon': 0.10929786492462362}. Best is trial 1119 with value: 0.4485361816812923.
[I 2024-12-03 18:49:48,313] Trial 1848 finished with value: 0.6413354772116406 and parameters: {'kernel': 'rbf', 'C': 94.45796596571036, 'gamma': 0.06497411636874953, 'epsilon': 0.09716313430931375}. Best is trial 1119 with value: 0.4485361816812923.
[I 2024-12-03 18:49:48,320] Trial 1875 finished with value: 0.6264910521983259 and parameters: {'kernel': 'rbf', 'C': 3.0998689452706665, 'gamma': 0.015273291165659413, 'epsilon': 0.07999379015081531}. Best is trial 1119 with value: 0.4485361816812923.
[I 2024-12-03 18:49:48,334] Trial 1854 finished with value: 0.481490164837474 and parameters: {'kernel': 'rbf', 'C': 29.23340393280198, 'gamma': 0.01648790007840816, 'epsilon': 0.19674596222587493}. Best is trial 1119 with value: 0.4485361816812923.
[I 2024-12-03 18:49:48,505] Trial 1863 finished with value: 0.5371118086227522 and parameters: {'kernel': 'rbf', 'C': 89.08688750641788, 'gamma': 0.026423692691507607, 'epsilon': 0.21431183387955682}. Best is trial 1119 with value: 0.4485361816812923.
[I 2024-12-03 18:49:49,071] Trial 1876 finished with value: 0.4897768260488028 and parameters: {'kernel': 'rbf', 'C': 95.38631253071829, 'gamma': 0.006264865284169106, 'epsilon': 0.07899682022432998}. Best is trial 1119 with value: 0.4485361816812923.
[I 2024-12-03 18:49:49,177] Trial 1866 finished with value: 0.625694522539881 and parameters: {'kernel': 'rbf', 'C': 86.24167192886665, 'gamma': 0.05296959075504695, 'epsilon': 0.034118856361347746}. Best is trial 1119 with value: 0.4485361816812923.
[I 2024-12-03 18:49:49,390] Trial 1855 finished with value: 0.4490406059938613 and parameters: {'kernel': 'rbf', 'C': 93.39669669575947, 'gamma': 0.014398288040681207, 'epsilon': 0.06253357902911313}. Best is trial 1119 with value: 0.4485361816812923.
[I 2024-12-03 18:49:50,216] Trial 1864 finished with value: 1.370274349239883 and parameters: {'kernel': 'poly', 'C': 76.72667194436413, 'gamma': 0.00017410502119269381, 'epsilon': 0.0025920478219484244}. Best is trial 1119 with value: 0.4485361816812923.
[I 2024-12-03 18:49:50,520] Trial 1871 finished with value: 0.5439995363644993 and parameters: {'kernel': 'rbf', 'C': 20.927815682399867, 'gamma': 0.0068781046572283875, 'epsilon': 0.15660649872807755}. Best is trial 1119 with value: 0.4485361816812923.
[I 2024-12-03 18:49:50,694] Trial 1861 finished with value: 0.653392164752526 and parameters: {'kernel': 'rbf', 'C': 50.15838560845658, 'gamma': 0.0007835924777131225, 'epsilon': 0.021434521771176263}. Best is trial 1119 with value: 0.4485361816812923.
[I 2024-12-03 18:49:50,705] Trial 1873 finished with value: 0.5657789493239691 and parameters: {'kernel': 'linear', 'C': 43.624012124095486, 'gamma': 0.002129094852388024, 'epsilon': 0.04554335714645225}. Best is trial 1119 with value: 0.4485361816812923.
