[I 2024-12-04 00:11:51,523] Trial 773 finished with value: 0.9984746587387947 and parameters: {'kernel': 'poly', 'C': 0.004735288663817127, 'gamma': 0.00038580897200664533, 'epsilon': 0.025759940320016002}. Best is trial 448 with value: 0.13989258940934515.
[I 2024-12-04 00:11:53,836] Trial 772 finished with value: 0.1445113169758684 and parameters: {'kernel': 'rbf', 'C': 70.15813103929776, 'gamma': 0.00750235645861177, 'epsilon': 0.0017054060486558105}. Best is trial 448 with value: 0.13989258940934515.
[I 2024-12-04 00:11:54,653] Trial 770 finished with value: 0.1633634128107336 and parameters: {'kernel': 'rbf', 'C': 75.19302408230212, 'gamma': 0.01684209104804513, 'epsilon': 0.0011136300014973895}. Best is trial 448 with value: 0.13989258940934515.
[I 2024-12-04 00:11:55,941] Trial 778 finished with value: 0.9977609752641388 and parameters: {'kernel': 'poly', 'C': 0.0064346957982298935, 'gamma': 0.00044629310743028706, 'epsilon': 0.9411028020680103}. Best is trial 448 with value: 0.13989258940934515.
[I 2024-12-04 00:11:56,510] Trial 776 finished with value: 0.14055004902820525 and parameters: {'kernel': 'rbf', 'C': 94.7897099867904, 'gamma': 0.00817599130013565, 'epsilon': 0.002547821164084949}. Best is trial 448 with value: 0.13989258940934515.
[I 2024-12-04 00:11:56,512] Trial 777 finished with value: 0.22874059835584912 and parameters: {'kernel': 'rbf', 'C': 48.77473365106066, 'gamma': 0.0027225107262096575, 'epsilon': 0.0010277539244329856}. Best is trial 448 with value: 0.13989258940934515.
[I 2024-12-04 00:11:58,836] Trial 774 finished with value: 0.17314331685743692 and parameters: {'kernel': 'rbf', 'C': 89.87934508395138, 'gamma': 0.0223406564648912, 'epsilon': 0.0016615692192684585}. Best is trial 448 with value: 0.13989258940934515.
[I 2024-12-04 00:11:58,838] Trial 775 finished with value: 0.18578635153188108 and parameters: {'kernel': 'rbf', 'C': 85.54358050249955, 'gamma': 0.03263517090823863, 'epsilon': 0.0010999818710274608}. Best is trial 448 with value: 0.13989258940934515.
[I 2024-12-04 00:11:59,762] Trial 779 finished with value: 0.17172205853107958 and parameters: {'kernel': 'rbf', 'C': 89.79776866123315, 'gamma': 0.003734754409638522, 'epsilon': 0.002034728636187152}. Best is trial 448 with value: 0.13989258940934515.
[I 2024-12-04 00:12:00,934] Trial 781 finished with value: 0.15241642365561098 and parameters: {'kernel': 'rbf', 'C': 88.81069993370464, 'gamma': 0.005415559669282875, 'epsilon': 0.0014431273541081061}. Best is trial 448 with value: 0.13989258940934515.
[I 2024-12-04 00:12:02,243] Trial 782 finished with value: 0.17888045312567588 and parameters: {'kernel': 'rbf', 'C': 66.41043186475554, 'gamma': 0.004237778885000803, 'epsilon': 0.0012658648581216605}. Best is trial 448 with value: 0.13989258940934515.
[I 2024-12-04 00:12:03,801] Trial 783 finished with value: 0.14015241386423438 and parameters: {'kernel': 'rbf', 'C': 95.94309783612638, 'gamma': 0.007696522646763818, 'epsilon': 0.0015152185909276055}. Best is trial 448 with value: 0.13989258940934515.
[I 2024-12-04 00:12:04,023] Trial 785 finished with value: 0.16944223638343905 and parameters: {'kernel': 'rbf', 'C': 20.820107157469092, 'gamma': 0.011668853275541678, 'epsilon': 0.0029156327709318366}. Best is trial 448 with value: 0.13989258940934515.
[I 2024-12-04 00:12:05,131] Trial 780 finished with value: 0.16708999963427779 and parameters: {'kernel': 'rbf', 'C': 93.28251001332022, 'gamma': 0.015983734813457356, 'epsilon': 0.0010388228415433786}. Best is trial 448 with value: 0.13989258940934515.
[I 2024-12-04 00:12:06,762] Trial 787 finished with value: 0.1708985909620044 and parameters: {'kernel': 'rbf', 'C': 16.76507600760286, 'gamma': 0.013774887104489842, 'epsilon': 0.0012025156601800147}. Best is trial 448 with value: 0.13989258940934515.
[I 2024-12-04 00:12:06,765] Trial 771 finished with value: 0.34851893954686547 and parameters: {'kernel': 'linear', 'C': 3.338255655695101, 'gamma': 0.001822009873264966, 'epsilon': 0.0019109000452656464}. Best is trial 448 with value: 0.13989258940934515.
[I 2024-12-04 00:12:07,942] Trial 788 finished with value: 0.16158276100818408 and parameters: {'kernel': 'rbf', 'C': 61.46586842405641, 'gamma': 0.005793068090330337, 'epsilon': 0.0010127994243991417}. Best is trial 448 with value: 0.13989258940934515.
[I 2024-12-04 00:12:10,059] Trial 789 finished with value: 0.14610898785141227 and parameters: {'kernel': 'rbf', 'C': 74.45986394796148, 'gamma': 0.006770035894890888, 'epsilon': 0.001095436841344437}. Best is trial 448 with value: 0.13989258940934515.
[I 2024-12-04 00:12:10,257] Trial 790 finished with value: 0.1975737854684042 and parameters: {'kernel': 'rbf', 'C': 53.98933226688616, 'gamma': 0.0038611740363280115, 'epsilon': 0.0010119133968608117}. Best is trial 448 with value: 0.13989258940934515.
[I 2024-12-04 00:12:10,739] Trial 752 finished with value: 0.5344996483861626 and parameters: {'kernel': 'poly', 'C': 97.95223930822662, 'gamma': 0.013560199026835222, 'epsilon': 0.003803426690277743}. Best is trial 448 with value: 0.13989258940934515.
[I 2024-12-04 00:12:10,901] Trial 786 finished with value: 0.2099315687584305 and parameters: {'kernel': 'rbf', 'C': 90.35128363737358, 'gamma': 0.052373359109140316, 'epsilon': 0.00113712186015687}. Best is trial 448 with value: 0.13989258940934515.
[I 2024-12-04 00:12:11,560] Trial 792 finished with value: 0.1548492615713798 and parameters: {'kernel': 'rbf', 'C': 16.05265136430784, 'gamma': 0.01923404695851542, 'epsilon': 0.0019012261552955381}. Best is trial 448 with value: 0.13989258940934515.
[I 2024-12-04 00:12:12,297] Trial 791 finished with value: 0.14036874385470555 and parameters: {'kernel': 'rbf', 'C': 91.12166393360934, 'gamma': 0.007424617112929496, 'epsilon': 0.0013268749296327478}. Best is trial 448 with value: 0.13989258940934515.
[I 2024-12-04 00:12:12,781] Trial 793 finished with value: 0.2453454626327043 and parameters: {'kernel': 'rbf', 'C': 23.123712801150898, 'gamma': 0.0038356069222629102, 'epsilon': 0.0023852034182064853}. Best is trial 448 with value: 0.13989258940934515.
[I 2024-12-04 00:12:14,437] Trial 795 finished with value: 67.39618100052702 and parameters: {'kernel': 'sigmoid', 'C': 6.500920328836085, 'gamma': 0.0075596116909080815, 'epsilon': 0.0015517369996325629}. Best is trial 448 with value: 0.13989258940934515.
[I 2024-12-04 00:12:14,748] Trial 796 finished with value: 0.2074747353540448 and parameters: {'kernel': 'rbf', 'C': 29.02170862052848, 'gamma': 0.0056159712959014604, 'epsilon': 0.0012085815155152939}. Best is trial 448 with value: 0.13989258940934515.
[I 2024-12-04 00:12:16,191] Trial 797 finished with value: 0.21027631894306292 and parameters: {'kernel': 'rbf', 'C': 60.604418624753045, 'gamma': 0.0030104644723753585, 'epsilon': 0.001015039108655989}. Best is trial 448 with value: 0.13989258940934515.
[I 2024-12-04 00:12:16,359] Trial 799 finished with value: 0.25138771531296816 and parameters: {'kernel': 'rbf', 'C': 93.02485583530823, 'gamma': 0.0008817312269172032, 'epsilon': 0.001101400306402667}. Best is trial 448 with value: 0.13989258940934515.
[I 2024-12-04 00:12:16,763] Trial 798 finished with value: 0.16067067500624693 and parameters: {'kernel': 'rbf', 'C': 20.39638595465375, 'gamma': 0.013734706610291138, 'epsilon': 0.0010153158379779814}. Best is trial 448 with value: 0.13989258940934515.
[I 2024-12-04 00:12:18,515] Trial 800 finished with value: 0.2073812900369297 and parameters: {'kernel': 'rbf', 'C': 77.65166550187202, 'gamma': 0.0025729626978836595, 'epsilon': 0.0011232466191969344}. Best is trial 448 with value: 0.13989258940934515.
[I 2024-12-04 00:12:19,169] Trial 670 finished with value: 0.3535147838776309 and parameters: {'kernel': 'linear', 'C': 35.080738209114074, 'gamma': 0.006046960853894989, 'epsilon': 0.003223471631976266}. Best is trial 448 with value: 0.13989258940934515.
[I 2024-12-04 00:12:19,649] Trial 508 finished with value: 0.35246591964437823 and parameters: {'kernel': 'linear', 'C': 67.01486619582337, 'gamma': 0.010753053045114536, 'epsilon': 0.0011243828232464052}. Best is trial 448 with value: 0.13989258940934515.
[I 2024-12-04 00:12:20,088] Trial 803 finished with value: 0.15942653216907604 and parameters: {'kernel': 'rbf', 'C': 16.368292423468702, 'gamma': 0.01701697079582675, 'epsilon': 0.0023502123204937027}. Best is trial 448 with value: 0.13989258940934515.
[I 2024-12-04 00:12:20,331] Trial 801 finished with value: 0.14917877934199855 and parameters: {'kernel': 'rbf', 'C': 84.91117848313324, 'gamma': 0.005933104197235254, 'epsilon': 0.0013455122766364751}. Best is trial 448 with value: 0.13989258940934515.
[I 2024-12-04 00:12:20,415] Trial 794 finished with value: 0.17025777635321046 and parameters: {'kernel': 'rbf', 'C': 96.77696680258884, 'gamma': 0.019122528327381587, 'epsilon': 0.0028713039769546482}. Best is trial 448 with value: 0.13989258940934515.
[I 2024-12-04 00:12:20,416] Trial 802 finished with value: 0.15231566527537133 and parameters: {'kernel': 'rbf', 'C': 38.8421788328848, 'gamma': 0.009207000864796332, 'epsilon': 0.001021103402682514}. Best is trial 448 with value: 0.13989258940934515.
[I 2024-12-04 00:12:22,168] Trial 806 finished with value: 0.259040520825537 and parameters: {'kernel': 'rbf', 'C': 91.14207955775409, 'gamma': 0.12625920782364808, 'epsilon': 0.0010915874171262946}. Best is trial 448 with value: 0.13989258940934515.
[I 2024-12-04 00:12:22,441] Trial 804 finished with value: 0.14848400439373718 and parameters: {'kernel': 'rbf', 'C': 93.86238414614749, 'gamma': 0.011537789809039255, 'epsilon': 0.001733663667803828}. Best is trial 448 with value: 0.13989258940934515.
[I 2024-12-04 00:12:22,836] Trial 805 finished with value: 0.14088871078132406 and parameters: {'kernel': 'rbf', 'C': 98.43366347682885, 'gamma': 0.009894479823174865, 'epsilon': 0.0019686320761342383}. Best is trial 448 with value: 0.13989258940934515.
[I 2024-12-04 00:12:23,253] Trial 810 finished with value: 0.23565130713374496 and parameters: {'kernel': 'rbf', 'C': 16.555586675649156, 'gamma': 0.006072134557623647, 'epsilon': 0.002254287437827865}. Best is trial 448 with value: 0.13989258940934515.
[I 2024-12-04 00:12:23,254] Trial 809 finished with value: 0.23409166161942702 and parameters: {'kernel': 'rbf', 'C': 19.756073136291388, 'gamma': 0.005331608445582212, 'epsilon': 0.001138566729638028}. Best is trial 448 with value: 0.13989258940934515.
[I 2024-12-04 00:12:24,584] Trial 812 finished with value: 0.4753943598183258 and parameters: {'kernel': 'rbf', 'C': 7.854825778293425, 'gamma': 0.0004808406165159136, 'epsilon': 0.0014729536533165657}. Best is trial 448 with value: 0.13989258940934515.
[I 2024-12-04 00:12:25,060] Trial 811 finished with value: 0.14070337567142613 and parameters: {'kernel': 'rbf', 'C': 84.47405719953902, 'gamma': 0.008419112857350301, 'epsilon': 0.0012154830184180722}. Best is trial 448 with value: 0.13989258940934515.
[I 2024-12-04 00:12:25,474] Trial 299 finished with value: 0.3533404091394699 and parameters: {'kernel': 'linear', 'C': 96.42093191513374, 'gamma': 0.044325901684230076, 'epsilon': 0.0027915136177566143}. Best is trial 448 with value: 0.13989258940934515.
[I 2024-12-04 00:12:26,083] Trial 807 finished with value: 0.1837849113417656 and parameters: {'kernel': 'rbf', 'C': 75.86881665833616, 'gamma': 0.03170108724280275, 'epsilon': 0.0020518565939153972}. Best is trial 448 with value: 0.13989258940934515.
[I 2024-12-04 00:12:26,456] Trial 813 finished with value: 0.1807080344888677 and parameters: {'kernel': 'rbf', 'C': 84.24089904662476, 'gamma': 0.028338562759665318, 'epsilon': 0.002878975814411362}. Best is trial 448 with value: 0.13989258940934515.
[I 2024-12-04 00:12:27,087] Trial 815 finished with value: 0.6308885527941859 and parameters: {'kernel': 'linear', 'C': 0.0011991586317926155, 'gamma': 0.038142249426452855, 'epsilon': 0.008177393662241248}. Best is trial 448 with value: 0.13989258940934515.
[I 2024-12-04 00:12:27,648] Trial 814 finished with value: 0.16144115513435467 and parameters: {'kernel': 'rbf', 'C': 90.11979450958577, 'gamma': 0.004397068598467605, 'epsilon': 0.0016268340416074223}. Best is trial 448 with value: 0.13989258940934515.
[I 2024-12-04 00:12:27,649] Trial 816 finished with value: 0.1868252850853681 and parameters: {'kernel': 'rbf', 'C': 99.82010426107188, 'gamma': 0.002893045942719715, 'epsilon': 0.001105276032953253}. Best is trial 448 with value: 0.13989258940934515.
[I 2024-12-04 00:12:28,277] Trial 818 finished with value: 0.18817909928765073 and parameters: {'kernel': 'rbf', 'C': 86.30278335286741, 'gamma': 0.003121894145381887, 'epsilon': 0.002789954304243804}. Best is trial 448 with value: 0.13989258940934515.
[I 2024-12-04 00:12:28,768] Trial 819 finished with value: 0.24085699864247356 and parameters: {'kernel': 'rbf', 'C': 15.19423163917588, 'gamma': 0.0060195459134165805, 'epsilon': 0.0028798008361283667}. Best is trial 448 with value: 0.13989258940934515.
[I 2024-12-04 00:12:28,896] Trial 821 finished with value: 0.9401347987422031 and parameters: {'kernel': 'poly', 'C': 0.0018826054086982275, 'gamma': 0.009646199667206494, 'epsilon': 0.014919479489797594}. Best is trial 448 with value: 0.13989258940934515.
[I 2024-12-04 00:12:29,937] Trial 822 finished with value: 0.24176399297431686 and parameters: {'kernel': 'rbf', 'C': 92.50655294428981, 'gamma': 0.0010890218478316175, 'epsilon': 0.0022802096552640796}. Best is trial 448 with value: 0.13989258940934515.
[I 2024-12-04 00:12:29,997] Trial 820 finished with value: 0.15771281202961013 and parameters: {'kernel': 'rbf', 'C': 93.36896430821989, 'gamma': 0.004608296029696771, 'epsilon': 0.0020552548336649915}. Best is trial 448 with value: 0.13989258940934515.
[I 2024-12-04 00:12:31,112] Trial 826 finished with value: 0.9365858893376179 and parameters: {'kernel': 'poly', 'C': 98.07320282956681, 'gamma': 0.00027682659282220504, 'epsilon': 0.005662489707372836}. Best is trial 448 with value: 0.13989258940934515.
[I 2024-12-04 00:12:31,340] Trial 823 finished with value: 0.14772267300331277 and parameters: {'kernel': 'rbf', 'C': 78.80385032059678, 'gamma': 0.006366168424481476, 'epsilon': 0.0013977447517179518}. Best is trial 448 with value: 0.13989258940934515.
[I 2024-12-04 00:12:31,774] Trial 828 finished with value: 0.6392054235513138 and parameters: {'kernel': 'linear', 'C': 0.0010612142144570847, 'gamma': 0.895347116418311, 'epsilon': 0.38285669418477886}. Best is trial 448 with value: 0.13989258940934515.
[I 2024-12-04 00:12:31,800] Trial 825 finished with value: 0.15045897219024676 and parameters: {'kernel': 'rbf', 'C': 17.296832650047183, 'gamma': 0.02141604682247282, 'epsilon': 0.0013854641944735496}. Best is trial 448 with value: 0.13989258940934515.
[I 2024-12-04 00:12:31,952] Trial 824 finished with value: 0.15043859250802225 and parameters: {'kernel': 'rbf', 'C': 17.766157735413458, 'gamma': 0.023627202038698805, 'epsilon': 0.0030916313320646736}. Best is trial 448 with value: 0.13989258940934515.
[I 2024-12-04 00:12:32,310] Trial 817 finished with value: 0.18991850823933282 and parameters: {'kernel': 'rbf', 'C': 78.48733938642492, 'gamma': 0.03756405361640717, 'epsilon': 0.0010324245725563386}. Best is trial 448 with value: 0.13989258940934515.
[I 2024-12-04 00:12:33,887] Trial 829 finished with value: 0.15826180602284176 and parameters: {'kernel': 'rbf', 'C': 54.99773394535461, 'gamma': 0.018046885453675717, 'epsilon': 0.0010453821165976203}. Best is trial 448 with value: 0.13989258940934515.
[I 2024-12-04 00:12:34,406] Trial 831 finished with value: 0.7794373559160876 and parameters: {'kernel': 'poly', 'C': 10.440140278440099, 'gamma': 0.0047394386266316505, 'epsilon': 0.0010635591270914879}. Best is trial 448 with value: 0.13989258940934515.
[I 2024-12-04 00:12:34,813] Trial 834 finished with value: 1733.7474029476741 and parameters: {'kernel': 'sigmoid', 'C': 75.7367335340348, 'gamma': 0.04571546305397761, 'epsilon': 0.0028953853748384948}. Best is trial 448 with value: 0.13989258940934515.
[I 2024-12-04 00:12:35,683] Trial 827 finished with value: 0.1522789535196959 and parameters: {'kernel': 'rbf', 'C': 81.53643918221118, 'gamma': 0.012929090306108483, 'epsilon': 0.0015363025773731628}. Best is trial 448 with value: 0.13989258940934515.
[I 2024-12-04 00:12:36,136] Trial 836 finished with value: 2.371264261273898 and parameters: {'kernel': 'sigmoid', 'C': 34.69182533672666, 'gamma': 0.0005369599842463982, 'epsilon': 0.001277797632954356}. Best is trial 448 with value: 0.13989258940934515.
[I 2024-12-04 00:12:36,138] Trial 830 finished with value: 0.15034883100412957 and parameters: {'kernel': 'rbf', 'C': 97.32680259486139, 'gamma': 0.005431852691951501, 'epsilon': 0.002895156545595834}. Best is trial 448 with value: 0.13989258940934515.
[I 2024-12-04 00:12:36,590] Trial 835 finished with value: 0.1567608559957729 and parameters: {'kernel': 'rbf', 'C': 87.25466445896129, 'gamma': 0.004935827415270999, 'epsilon': 0.0011612699808848726}. Best is trial 448 with value: 0.13989258940934515.
[I 2024-12-04 00:12:37,093] Trial 832 finished with value: 0.1470051665935324 and parameters: {'kernel': 'rbf', 'C': 89.24925824533462, 'gamma': 0.011497828573480338, 'epsilon': 0.0026537894384210583}. Best is trial 448 with value: 0.13989258940934515.
[I 2024-12-04 00:12:37,535] Trial 833 finished with value: 0.15158927902246003 and parameters: {'kernel': 'rbf', 'C': 96.58529296148996, 'gamma': 0.011935045675667952, 'epsilon': 0.0018880163641887817}. Best is trial 448 with value: 0.13989258940934515.
[I 2024-12-04 00:12:38,594] Trial 839 finished with value: 0.18313954840942365 and parameters: {'kernel': 'rbf', 'C': 14.245235118475797, 'gamma': 0.012864242662009808, 'epsilon': 0.0022441933642697487}. Best is trial 448 with value: 0.13989258940934515.
[I 2024-12-04 00:12:39,100] Trial 841 finished with value: 0.30990576731886044 and parameters: {'kernel': 'rbf', 'C': 16.3866123539639, 'gamma': 0.0015164559552900828, 'epsilon': 0.004034463479523967}. Best is trial 448 with value: 0.13989258940934515.
[I 2024-12-04 00:12:39,625] Trial 840 finished with value: 0.23607484200057824 and parameters: {'kernel': 'rbf', 'C': 94.61750527231406, 'gamma': 0.0012214620042142771, 'epsilon': 0.004722853107094923}. Best is trial 448 with value: 0.13989258940934515.
[I 2024-12-04 00:12:39,626] Trial 842 finished with value: 0.35571718650811707 and parameters: {'kernel': 'rbf', 'C': 1.9175473656452329, 'gamma': 0.005275309858759143, 'epsilon': 0.0019612754349459327}. Best is trial 448 with value: 0.13989258940934515.
[I 2024-12-04 00:12:40,067] Trial 844 finished with value: 0.26318699756251546 and parameters: {'kernel': 'rbf', 'C': 11.820331262222142, 'gamma': 0.004576493034706024, 'epsilon': 0.003360809147318892}. Best is trial 448 with value: 0.13989258940934515.
[I 2024-12-04 00:12:40,106] Trial 838 finished with value: 0.14014264064504847 and parameters: {'kernel': 'rbf', 'C': 94.6006154493913, 'gamma': 0.008698477785462995, 'epsilon': 0.0012639711633773054}. Best is trial 448 with value: 0.13989258940934515.
[I 2024-12-04 00:12:41,278] Trial 845 finished with value: 0.19046496210919386 and parameters: {'kernel': 'rbf', 'C': 14.780267038600071, 'gamma': 0.011407501630806317, 'epsilon': 0.0018868257043871868}. Best is trial 448 with value: 0.13989258940934515.
[I 2024-12-04 00:12:42,232] Trial 837 finished with value: 0.1877659940024703 and parameters: {'kernel': 'rbf', 'C': 99.7897450126679, 'gamma': 0.033265306018734786, 'epsilon': 0.0012931180114651346}. Best is trial 448 with value: 0.13989258940934515.
[I 2024-12-04 00:12:42,319] Trial 847 finished with value: 0.9403333209072773 and parameters: {'kernel': 'rbf', 'C': 0.0185710850961424, 'gamma': 0.0005796349041997816, 'epsilon': 0.0022004746169294242}. Best is trial 448 with value: 0.13989258940934515.
[I 2024-12-04 00:12:42,334] Trial 843 finished with value: 0.14948071425291012 and parameters: {'kernel': 'rbf', 'C': 94.02440816929801, 'gamma': 0.011717515272184623, 'epsilon': 0.0024039682356920985}. Best is trial 448 with value: 0.13989258940934515.
[I 2024-12-04 00:12:42,693] Trial 849 finished with value: 0.35834517796434184 and parameters: {'kernel': 'rbf', 'C': 5.291152132279974, 'gamma': 0.0021801905333682387, 'epsilon': 0.0016179305846131392}. Best is trial 448 with value: 0.13989258940934515.
[I 2024-12-04 00:12:43,178] Trial 848 finished with value: 0.16138936684423072 and parameters: {'kernel': 'rbf', 'C': 75.01751934033065, 'gamma': 0.005023147829899174, 'epsilon': 0.0011490494650862007}. Best is trial 448 with value: 0.13989258940934515.
[I 2024-12-04 00:12:44,391] Trial 851 finished with value: 0.2095303090802844 and parameters: {'kernel': 'rbf', 'C': 16.15127982241072, 'gamma': 0.008759061762937026, 'epsilon': 0.0013102260758019704}. Best is trial 448 with value: 0.13989258940934515.
[I 2024-12-04 00:12:44,391] Trial 850 finished with value: 0.17468059953469792 and parameters: {'kernel': 'rbf', 'C': 98.41998234087716, 'gamma': 0.0033757625011561695, 'epsilon': 0.0021638138153089116}. Best is trial 448 with value: 0.13989258940934515.
[I 2024-12-04 00:12:44,525] Trial 852 finished with value: 0.28780359379246606 and parameters: {'kernel': 'rbf', 'C': 8.502412587452795, 'gamma': 0.0035671612090038833, 'epsilon': 0.0012398267245904739}. Best is trial 448 with value: 0.13989258940934515.
[I 2024-12-04 00:12:44,526] Trial 846 finished with value: 0.1425236826595761 and parameters: {'kernel': 'rbf', 'C': 76.71523546899469, 'gamma': 0.010177459785576005, 'epsilon': 0.001064660690133648}. Best is trial 448 with value: 0.13989258940934515.
[I 2024-12-04 00:12:45,020] Trial 855 finished with value: 0.3764766758184009 and parameters: {'kernel': 'linear', 'C': 0.06632224376248946, 'gamma': 0.00043708245999869277, 'epsilon': 0.0011644579969049198}. Best is trial 448 with value: 0.13989258940934515.
