[I 2024-12-04 13:26:31,183] Trial 1870 finished with value: 0.29088361248191213 and parameters: {'n_estimators': 995, 'learning_rate': 0.09863041910220993, 'max_depth': 7, 'min_samples_split': 6, 'min_samples_leaf': 2, 'subsample': 0.8947919037912871, 'max_features': 'sqrt'}. Best is trial 1389 with value: 0.22332552856343169.
[I 2024-12-04 13:26:33,563] Trial 1872 finished with value: 0.2548287314241963 and parameters: {'n_estimators': 967, 'learning_rate': 0.07389031131336794, 'max_depth': 7, 'min_samples_split': 2, 'min_samples_leaf': 1, 'subsample': 0.7011318496143849, 'max_features': 'sqrt'}. Best is trial 1389 with value: 0.22332552856343169.
[I 2024-12-04 13:26:34,367] Trial 1887 finished with value: 0.4133236288688616 and parameters: {'n_estimators': 425, 'learning_rate': 0.044582719025340854, 'max_depth': 3, 'min_samples_split': 15, 'min_samples_leaf': 6, 'subsample': 0.8007445073008839, 'max_features': None}. Best is trial 1389 with value: 0.22332552856343169.
[I 2024-12-04 13:26:41,576] Trial 1873 finished with value: 0.37486058440890124 and parameters: {'n_estimators': 1055, 'learning_rate': 0.01516636698746362, 'max_depth': 9, 'min_samples_split': 5, 'min_samples_leaf': 4, 'subsample': 0.7675738226741277, 'max_features': 'sqrt'}. Best is trial 1389 with value: 0.22332552856343169.
[I 2024-12-04 13:26:41,592] Trial 1881 finished with value: 0.680424713503886 and parameters: {'n_estimators': 730, 'learning_rate': 0.03178736497414415, 'max_depth': 4, 'min_samples_split': 9, 'min_samples_leaf': 1, 'subsample': 0.7883828684868438, 'max_features': 'log2'}. Best is trial 1389 with value: 0.22332552856343169.
[I 2024-12-04 13:26:44,023] Trial 1866 finished with value: 0.2388973903681343 and parameters: {'n_estimators': 1447, 'learning_rate': 0.05117841213029242, 'max_depth': 6, 'min_samples_split': 3, 'min_samples_leaf': 1, 'subsample': 0.8331410135252717, 'max_features': 'sqrt'}. Best is trial 1389 with value: 0.22332552856343169.
[I 2024-12-04 13:26:46,146] Trial 1874 finished with value: 0.28356638088859776 and parameters: {'n_estimators': 1126, 'learning_rate': 0.08211639948502021, 'max_depth': 9, 'min_samples_split': 6, 'min_samples_leaf': 1, 'subsample': 0.9476610619441922, 'max_features': 'sqrt'}. Best is trial 1389 with value: 0.22332552856343169.
[I 2024-12-04 13:26:46,156] Trial 1876 finished with value: 0.25752020810667337 and parameters: {'n_estimators': 1029, 'learning_rate': 0.09363809399761418, 'max_depth': 8, 'min_samples_split': 3, 'min_samples_leaf': 1, 'subsample': 0.8694547736276305, 'max_features': 'sqrt'}. Best is trial 1389 with value: 0.22332552856343169.
[I 2024-12-04 13:26:46,685] Trial 1868 finished with value: 0.2853199126066373 and parameters: {'n_estimators': 1455, 'learning_rate': 0.06418447202644005, 'max_depth': 7, 'min_samples_split': 5, 'min_samples_leaf': 2, 'subsample': 0.7797979265726731, 'max_features': 'sqrt'}. Best is trial 1389 with value: 0.22332552856343169.
[I 2024-12-04 13:26:49,619] Trial 1898 finished with value: 0.32091841421447725 and parameters: {'n_estimators': 186, 'learning_rate': 0.08131989597814661, 'max_depth': 8, 'min_samples_split': 4, 'min_samples_leaf': 1, 'subsample': 0.8205951201622874, 'max_features': 'sqrt'}. Best is trial 1389 with value: 0.22332552856343169.
[I 2024-12-04 13:26:51,321] Trial 1869 finished with value: 0.5531368284543194 and parameters: {'n_estimators': 1429, 'learning_rate': 0.01592877593613036, 'max_depth': 7, 'min_samples_split': 18, 'min_samples_leaf': 3, 'subsample': 0.7259604250075817, 'max_features': 'log2'}. Best is trial 1389 with value: 0.22332552856343169.
[I 2024-12-04 13:26:51,380] Trial 1877 finished with value: 0.2601610933869211 and parameters: {'n_estimators': 1104, 'learning_rate': 0.08342516673201086, 'max_depth': 6, 'min_samples_split': 9, 'min_samples_leaf': 1, 'subsample': 0.9967683935842206, 'max_features': 'sqrt'}. Best is trial 1389 with value: 0.22332552856343169.
[I 2024-12-04 13:26:52,984] Trial 1875 finished with value: 0.2870965276177414 and parameters: {'n_estimators': 1131, 'learning_rate': 0.09912179123068972, 'max_depth': 7, 'min_samples_split': 5, 'min_samples_leaf': 2, 'subsample': 0.8122747026428909, 'max_features': 'sqrt'}. Best is trial 1389 with value: 0.22332552856343169.
[I 2024-12-04 13:26:56,359] Trial 1886 finished with value: 0.38943912772660266 and parameters: {'n_estimators': 767, 'learning_rate': 0.0846721087859488, 'max_depth': 7, 'min_samples_split': 12, 'min_samples_leaf': 5, 'subsample': 0.8538193169430491, 'max_features': 'sqrt'}. Best is trial 1389 with value: 0.22332552856343169.
[I 2024-12-04 13:26:56,379] Trial 1888 finished with value: 0.2925199534288501 and parameters: {'n_estimators': 712, 'learning_rate': 0.09446902068433914, 'max_depth': 10, 'min_samples_split': 6, 'min_samples_leaf': 2, 'subsample': 0.9790726273331549, 'max_features': 'log2'}. Best is trial 1389 with value: 0.22332552856343169.
[I 2024-12-04 13:27:01,915] Trial 1871 finished with value: 0.24945672614899195 and parameters: {'n_estimators': 1499, 'learning_rate': 0.061752104402964726, 'max_depth': 5, 'min_samples_split': 6, 'min_samples_leaf': 1, 'subsample': 0.809189033383853, 'max_features': 'sqrt'}. Best is trial 1389 with value: 0.22332552856343169.
[I 2024-12-04 13:27:14,246] Trial 1883 finished with value: 0.3647825231232902 and parameters: {'n_estimators': 1160, 'learning_rate': 0.0609542319661239, 'max_depth': 8, 'min_samples_split': 6, 'min_samples_leaf': 3, 'subsample': 0.7273155861209184, 'max_features': 'sqrt'}. Best is trial 1389 with value: 0.22332552856343169.
[I 2024-12-04 13:27:15,091] Trial 1879 finished with value: 0.3250463221171145 and parameters: {'n_estimators': 1286, 'learning_rate': 0.04552486124261367, 'max_depth': 7, 'min_samples_split': 2, 'min_samples_leaf': 1, 'subsample': 0.7221571059005498, 'max_features': None}. Best is trial 1389 with value: 0.22332552856343169.
[I 2024-12-04 13:27:15,224] Trial 1878 finished with value: 0.5159247929826448 and parameters: {'n_estimators': 1484, 'learning_rate': 0.04659228693927533, 'max_depth': 10, 'min_samples_split': 9, 'min_samples_leaf': 8, 'subsample': 0.9729709785670173, 'max_features': 'log2'}. Best is trial 1389 with value: 0.22332552856343169.
[I 2024-12-04 13:27:17,192] Trial 1912 finished with value: 1.1275003913318877 and parameters: {'n_estimators': 120, 'learning_rate': 0.03753732695881925, 'max_depth': 7, 'min_samples_split': 2, 'min_samples_leaf': 9, 'subsample': 0.9444864770804986, 'max_features': 'log2'}. Best is trial 1389 with value: 0.22332552856343169.
[I 2024-12-04 13:27:23,465] Trial 1900 finished with value: 0.3622674689951224 and parameters: {'n_estimators': 684, 'learning_rate': 0.09483717128160375, 'max_depth': 7, 'min_samples_split': 2, 'min_samples_leaf': 4, 'subsample': 0.9063531882257962, 'max_features': 'log2'}. Best is trial 1389 with value: 0.22332552856343169.
[I 2024-12-04 13:27:25,183] Trial 1882 finished with value: 0.23869588814375936 and parameters: {'n_estimators': 1357, 'learning_rate': 0.06285733091516953, 'max_depth': 8, 'min_samples_split': 2, 'min_samples_leaf': 1, 'subsample': 0.7791765248418631, 'max_features': 'sqrt'}. Best is trial 1389 with value: 0.22332552856343169.
[I 2024-12-04 13:27:25,382] Trial 1904 finished with value: 0.47294196075963907 and parameters: {'n_estimators': 469, 'learning_rate': 0.06163058505033907, 'max_depth': 10, 'min_samples_split': 13, 'min_samples_leaf': 9, 'subsample': 0.9303242650762712, 'max_features': None}. Best is trial 1389 with value: 0.22332552856343169.
[I 2024-12-04 13:27:25,525] Trial 1884 finished with value: 0.36932807467050255 and parameters: {'n_estimators': 1298, 'learning_rate': 0.09872035007053209, 'max_depth': 9, 'min_samples_split': 5, 'min_samples_leaf': 4, 'subsample': 0.8629484534561954, 'max_features': 'sqrt'}. Best is trial 1389 with value: 0.22332552856343169.
[I 2024-12-04 13:27:28,726] Trial 1894 finished with value: 0.25047835574718696 and parameters: {'n_estimators': 1010, 'learning_rate': 0.0919379525181079, 'max_depth': 7, 'min_samples_split': 4, 'min_samples_leaf': 1, 'subsample': 0.7921180832883126, 'max_features': 'sqrt'}. Best is trial 1389 with value: 0.22332552856343169.
[I 2024-12-04 13:27:37,948] Trial 1885 finished with value: 0.2511172468195042 and parameters: {'n_estimators': 1460, 'learning_rate': 0.0920743348679201, 'max_depth': 8, 'min_samples_split': 6, 'min_samples_leaf': 1, 'subsample': 0.79411178652423, 'max_features': 'log2'}. Best is trial 1389 with value: 0.22332552856343169.
[I 2024-12-04 13:27:40,995] Trial 1897 finished with value: 0.34359692721205176 and parameters: {'n_estimators': 1094, 'learning_rate': 0.09278702332819058, 'max_depth': 9, 'min_samples_split': 3, 'min_samples_leaf': 3, 'subsample': 0.9370493565036153, 'max_features': 'sqrt'}. Best is trial 1389 with value: 0.22332552856343169.
[I 2024-12-04 13:27:41,015] Trial 1890 finished with value: 0.35589022358505484 and parameters: {'n_estimators': 1381, 'learning_rate': 0.04341516597638634, 'max_depth': 7, 'min_samples_split': 2, 'min_samples_leaf': 4, 'subsample': 0.8233414444305448, 'max_features': 'sqrt'}. Best is trial 1389 with value: 0.22332552856343169.
[I 2024-12-04 13:27:43,581] Trial 1893 finished with value: 0.26128333193935294 and parameters: {'n_estimators': 1295, 'learning_rate': 0.0587579049245905, 'max_depth': 6, 'min_samples_split': 6, 'min_samples_leaf': 1, 'subsample': 0.7939945183861832, 'max_features': 'sqrt'}. Best is trial 1389 with value: 0.22332552856343169.
[I 2024-12-04 13:27:47,699] Trial 1903 finished with value: 0.36082793135720165 and parameters: {'n_estimators': 949, 'learning_rate': 0.048687615325209765, 'max_depth': 5, 'min_samples_split': 6, 'min_samples_leaf': 3, 'subsample': 0.7756826681665702, 'max_features': 'sqrt'}. Best is trial 1389 with value: 0.22332552856343169.
[I 2024-12-04 13:27:47,766] Trial 1895 finished with value: 0.3469134127580713 and parameters: {'n_estimators': 1218, 'learning_rate': 0.09417747407481031, 'max_depth': 8, 'min_samples_split': 4, 'min_samples_leaf': 3, 'subsample': 0.9049820493195009, 'max_features': 'sqrt'}. Best is trial 1389 with value: 0.22332552856343169.
[I 2024-12-04 13:27:49,283] Trial 1917 finished with value: 0.30443083484582906 and parameters: {'n_estimators': 356, 'learning_rate': 0.09984608896161376, 'max_depth': 6, 'min_samples_split': 5, 'min_samples_leaf': 2, 'subsample': 0.8639711264509604, 'max_features': 'sqrt'}. Best is trial 1389 with value: 0.22332552856343169.
[I 2024-12-04 13:27:52,150] Trial 1921 finished with value: 0.6727888069407533 and parameters: {'n_estimators': 209, 'learning_rate': 0.021942489679415218, 'max_depth': 9, 'min_samples_split': 3, 'min_samples_leaf': 4, 'subsample': 0.6993067394151425, 'max_features': 'sqrt'}. Best is trial 1389 with value: 0.22332552856343169.
[I 2024-12-04 13:27:52,574] Trial 1889 finished with value: 0.32504894135977686 and parameters: {'n_estimators': 1493, 'learning_rate': 0.08209512993388061, 'max_depth': 4, 'min_samples_split': 3, 'min_samples_leaf': 2, 'subsample': 0.6386586609341021, 'max_features': None}. Best is trial 1389 with value: 0.22332552856343169.
[I 2024-12-04 13:27:54,316] Trial 1899 finished with value: 0.24049150849184686 and parameters: {'n_estimators': 1106, 'learning_rate': 0.09710990668891259, 'max_depth': 8, 'min_samples_split': 3, 'min_samples_leaf': 1, 'subsample': 0.8639787128759908, 'max_features': 'sqrt'}. Best is trial 1389 with value: 0.22332552856343169.
[I 2024-12-04 13:28:01,050] Trial 1892 finished with value: 0.27657723649842436 and parameters: {'n_estimators': 1387, 'learning_rate': 0.03171883795167194, 'max_depth': 6, 'min_samples_split': 7, 'min_samples_leaf': 1, 'subsample': 0.6737122198416352, 'max_features': 'sqrt'}. Best is trial 1389 with value: 0.22332552856343169.
[I 2024-12-04 13:28:01,121] Trial 1901 finished with value: 0.679140313602922 and parameters: {'n_estimators': 1200, 'learning_rate': 0.028226814919959327, 'max_depth': 12, 'min_samples_split': 12, 'min_samples_leaf': 10, 'subsample': 0.8414672139222934, 'max_features': 'log2'}. Best is trial 1389 with value: 0.22332552856343169.
[I 2024-12-04 13:28:03,832] Trial 1896 finished with value: 0.2746471934756109 and parameters: {'n_estimators': 1383, 'learning_rate': 0.06375801751607822, 'max_depth': 8, 'min_samples_split': 12, 'min_samples_leaf': 1, 'subsample': 0.7795238540896082, 'max_features': 'sqrt'}. Best is trial 1389 with value: 0.22332552856343169.
[I 2024-12-04 13:28:05,509] Trial 1915 finished with value: 0.28731384088178297 and parameters: {'n_estimators': 708, 'learning_rate': 0.09786159073771786, 'max_depth': 7, 'min_samples_split': 2, 'min_samples_leaf': 2, 'subsample': 0.8980078165612236, 'max_features': 'sqrt'}. Best is trial 1389 with value: 0.22332552856343169.
[I 2024-12-04 13:28:19,520] Trial 1920 finished with value: 0.36203102085568817 and parameters: {'n_estimators': 767, 'learning_rate': 0.0711373250141381, 'max_depth': 4, 'min_samples_split': 5, 'min_samples_leaf': 4, 'subsample': 0.9132151941134729, 'max_features': 'sqrt'}. Best is trial 1389 with value: 0.22332552856343169.
[I 2024-12-04 13:28:21,544] Trial 1902 finished with value: 0.2373660379932119 and parameters: {'n_estimators': 1496, 'learning_rate': 0.049204553777280516, 'max_depth': 9, 'min_samples_split': 4, 'min_samples_leaf': 1, 'subsample': 0.8395770056509273, 'max_features': 'sqrt'}. Best is trial 1389 with value: 0.22332552856343169.
[I 2024-12-04 13:28:22,684] Trial 1932 finished with value: 0.42271560109708267 and parameters: {'n_estimators': 294, 'learning_rate': 0.010959108587193197, 'max_depth': 5, 'min_samples_split': 13, 'min_samples_leaf': 2, 'subsample': 0.8875647434478139, 'max_features': None}. Best is trial 1389 with value: 0.22332552856343169.
[I 2024-12-04 13:28:24,804] Trial 1919 finished with value: 0.2364317885813719 and parameters: {'n_estimators': 859, 'learning_rate': 0.09881715037217409, 'max_depth': 5, 'min_samples_split': 3, 'min_samples_leaf': 1, 'subsample': 0.9147055439182981, 'max_features': 'sqrt'}. Best is trial 1389 with value: 0.22332552856343169.
[I 2024-12-04 13:28:27,314] Trial 1918 finished with value: 0.263625253887926 and parameters: {'n_estimators': 887, 'learning_rate': 0.09976373139831794, 'max_depth': 7, 'min_samples_split': 2, 'min_samples_leaf': 1, 'subsample': 0.8166613052359293, 'max_features': 'sqrt'}. Best is trial 1389 with value: 0.22332552856343169.
[I 2024-12-04 13:28:30,273] Trial 1905 finished with value: 0.24643938237641658 and parameters: {'n_estimators': 1456, 'learning_rate': 0.06909170123772286, 'max_depth': 7, 'min_samples_split': 8, 'min_samples_leaf': 1, 'subsample': 0.7389591690391281, 'max_features': 'sqrt'}. Best is trial 1389 with value: 0.22332552856343169.
[I 2024-12-04 13:28:34,243] Trial 1914 finished with value: 0.22975928194017675 and parameters: {'n_estimators': 1123, 'learning_rate': 0.07450351556719793, 'max_depth': 7, 'min_samples_split': 2, 'min_samples_leaf': 1, 'subsample': 0.9266665540841672, 'max_features': 'sqrt'}. Best is trial 1389 with value: 0.22332552856343169.
[I 2024-12-04 13:28:36,416] Trial 1908 finished with value: 0.23517204745245854 and parameters: {'n_estimators': 1434, 'learning_rate': 0.06950238565982994, 'max_depth': 7, 'min_samples_split': 5, 'min_samples_leaf': 1, 'subsample': 0.7701224477830904, 'max_features': 'sqrt'}. Best is trial 1389 with value: 0.22332552856343169.
[I 2024-12-04 13:28:37,434] Trial 1907 finished with value: 0.3525558423267966 and parameters: {'n_estimators': 1420, 'learning_rate': 0.05650865483466583, 'max_depth': 7, 'min_samples_split': 2, 'min_samples_leaf': 3, 'subsample': 0.9623163260250898, 'max_features': 'sqrt'}. Best is trial 1389 with value: 0.22332552856343169.
[I 2024-12-04 13:28:38,504] Trial 1913 finished with value: 0.2796704092956622 and parameters: {'n_estimators': 1196, 'learning_rate': 0.09847814089867496, 'max_depth': 10, 'min_samples_split': 8, 'min_samples_leaf': 1, 'subsample': 0.9073143438025641, 'max_features': 'sqrt'}. Best is trial 1389 with value: 0.22332552856343169.
[I 2024-12-04 13:28:43,497] Trial 1906 finished with value: 0.35715785303461006 and parameters: {'n_estimators': 1485, 'learning_rate': 0.05416080975258748, 'max_depth': 4, 'min_samples_split': 2, 'min_samples_leaf': 3, 'subsample': 0.711196032389745, 'max_features': 'sqrt'}. Best is trial 1389 with value: 0.22332552856343169.
[I 2024-12-04 13:28:45,648] Trial 1916 finished with value: 0.29859889371461606 and parameters: {'n_estimators': 1267, 'learning_rate': 0.09267549238353825, 'max_depth': 12, 'min_samples_split': 6, 'min_samples_leaf': 2, 'subsample': 0.6632850197909547, 'max_features': 'sqrt'}. Best is trial 1389 with value: 0.22332552856343169.
[I 2024-12-04 13:28:46,279] Trial 1909 finished with value: 0.25571278061975644 and parameters: {'n_estimators': 1486, 'learning_rate': 0.04168684643323835, 'max_depth': 9, 'min_samples_split': 4, 'min_samples_leaf': 1, 'subsample': 0.6983663923172128, 'max_features': 'sqrt'}. Best is trial 1389 with value: 0.22332552856343169.
[I 2024-12-04 13:28:49,994] Trial 1923 finished with value: 0.24283210931686194 and parameters: {'n_estimators': 970, 'learning_rate': 0.09842603226310956, 'max_depth': 8, 'min_samples_split': 2, 'min_samples_leaf': 1, 'subsample': 0.749723270874749, 'max_features': 'sqrt'}. Best is trial 1389 with value: 0.22332552856343169.
[I 2024-12-04 13:28:50,434] Trial 1910 finished with value: 0.2502474764626283 and parameters: {'n_estimators': 1491, 'learning_rate': 0.04825952496338809, 'max_depth': 6, 'min_samples_split': 2, 'min_samples_leaf': 1, 'subsample': 0.937653925226244, 'max_features': 'sqrt'}. Best is trial 1389 with value: 0.22332552856343169.
[I 2024-12-04 13:28:50,860] Trial 1911 finished with value: 0.29066589189340813 and parameters: {'n_estimators': 1329, 'learning_rate': 0.021118591513551898, 'max_depth': 12, 'min_samples_split': 5, 'min_samples_leaf': 1, 'subsample': 0.6240786685661213, 'max_features': 'log2'}. Best is trial 1389 with value: 0.22332552856343169.
[I 2024-12-04 13:28:52,885] Trial 1926 finished with value: 0.49239730986695346 and parameters: {'n_estimators': 883, 'learning_rate': 0.03086067382733335, 'max_depth': 9, 'min_samples_split': 10, 'min_samples_leaf': 10, 'subsample': 0.6729187766807366, 'max_features': None}. Best is trial 1389 with value: 0.22332552856343169.
[I 2024-12-04 13:28:58,162] Trial 1927 finished with value: 0.2523624554681667 and parameters: {'n_estimators': 1001, 'learning_rate': 0.09677093006265695, 'max_depth': 10, 'min_samples_split': 3, 'min_samples_leaf': 1, 'subsample': 0.6907439801547175, 'max_features': 'sqrt'}. Best is trial 1389 with value: 0.22332552856343169.
[I 2024-12-04 13:28:59,256] Trial 1935 finished with value: 0.7020292076955318 and parameters: {'n_estimators': 721, 'learning_rate': 0.08089075045215269, 'max_depth': 8, 'min_samples_split': 16, 'min_samples_leaf': 9, 'subsample': 0.7283222281246158, 'max_features': 'log2'}. Best is trial 1389 with value: 0.22332552856343169.
[I 2024-12-04 13:29:00,623] Trial 1924 finished with value: 0.2656147861189483 and parameters: {'n_estimators': 1174, 'learning_rate': 0.053668178116311825, 'max_depth': 8, 'min_samples_split': 6, 'min_samples_leaf': 1, 'subsample': 0.8802014427824715, 'max_features': 'sqrt'}. Best is trial 1389 with value: 0.22332552856343169.
[I 2024-12-04 13:29:05,081] Trial 1940 finished with value: 0.8659139956341593 and parameters: {'n_estimators': 518, 'learning_rate': 0.017555597752999707, 'max_depth': 3, 'min_samples_split': 18, 'min_samples_leaf': 9, 'subsample': 0.6363103864951338, 'max_features': 'sqrt'}. Best is trial 1389 with value: 0.22332552856343169.
[I 2024-12-04 13:29:07,210] Trial 1928 finished with value: 0.25224236139530176 and parameters: {'n_estimators': 1105, 'learning_rate': 0.09844062989238854, 'max_depth': 6, 'min_samples_split': 3, 'min_samples_leaf': 1, 'subsample': 0.9249144120962884, 'max_features': 'sqrt'}. Best is trial 1389 with value: 0.22332552856343169.
[I 2024-12-04 13:29:07,634] Trial 1925 finished with value: 0.24831895271830798 and parameters: {'n_estimators': 1242, 'learning_rate': 0.06397229664290328, 'max_depth': 9, 'min_samples_split': 2, 'min_samples_leaf': 1, 'subsample': 0.8062083704398652, 'max_features': 'sqrt'}. Best is trial 1389 with value: 0.22332552856343169.
[I 2024-12-04 13:29:13,210] Trial 1930 finished with value: 0.35773199654586624 and parameters: {'n_estimators': 1080, 'learning_rate': 0.07579149990916133, 'max_depth': 6, 'min_samples_split': 5, 'min_samples_leaf': 3, 'subsample': 0.9548908927272572, 'max_features': 'sqrt'}. Best is trial 1389 with value: 0.22332552856343169.
[I 2024-12-04 13:29:13,708] Trial 1931 finished with value: 0.33597359370127333 and parameters: {'n_estimators': 1020, 'learning_rate': 0.06402073122227274, 'max_depth': 5, 'min_samples_split': 6, 'min_samples_leaf': 1, 'subsample': 0.7281851136973069, 'max_features': 'log2'}. Best is trial 1389 with value: 0.22332552856343169.
[I 2024-12-04 13:29:16,714] Trial 1929 finished with value: 0.26157211246913975 and parameters: {'n_estimators': 1206, 'learning_rate': 0.08087304901408422, 'max_depth': 7, 'min_samples_split': 10, 'min_samples_leaf': 1, 'subsample': 0.6586233298443631, 'max_features': 'sqrt'}. Best is trial 1389 with value: 0.22332552856343169.
[I 2024-12-04 13:29:20,141] Trial 1922 finished with value: 0.24084473856101568 and parameters: {'n_estimators': 1499, 'learning_rate': 0.0707378266390125, 'max_depth': 8, 'min_samples_split': 2, 'min_samples_leaf': 1, 'subsample': 0.8771143534887004, 'max_features': 'sqrt'}. Best is trial 1389 with value: 0.22332552856343169.
