[I 2024-12-04 13:10:38,160] Trial 1465 finished with value: 0.24397361186571442 and parameters: {'n_estimators': 1250, 'learning_rate': 0.0766299489496654, 'max_depth': 10, 'min_samples_split': 15, 'min_samples_leaf': 3, 'subsample': 0.662388674142677, 'max_features': 'sqrt'}. Best is trial 1137 with value: 0.19687116000636118.
[I 2024-12-04 13:10:39,850] Trial 1460 finished with value: 0.24660472801446875 and parameters: {'n_estimators': 1442, 'learning_rate': 0.06426844583940419, 'max_depth': 10, 'min_samples_split': 17, 'min_samples_leaf': 3, 'subsample': 0.6003040451995743, 'max_features': 'sqrt'}. Best is trial 1137 with value: 0.19687116000636118.
[I 2024-12-04 13:10:42,618] Trial 1476 finished with value: 0.23982067691395795 and parameters: {'n_estimators': 825, 'learning_rate': 0.09511188899196904, 'max_depth': 10, 'min_samples_split': 16, 'min_samples_leaf': 2, 'subsample': 0.6163063437833628, 'max_features': 'sqrt'}. Best is trial 1137 with value: 0.19687116000636118.
[I 2024-12-04 13:10:42,695] Trial 1462 finished with value: 0.2017466184446912 and parameters: {'n_estimators': 1386, 'learning_rate': 0.09597063158676189, 'max_depth': 12, 'min_samples_split': 15, 'min_samples_leaf': 1, 'subsample': 0.6642897909941955, 'max_features': 'sqrt'}. Best is trial 1137 with value: 0.19687116000636118.
[I 2024-12-04 13:10:49,290] Trial 1468 finished with value: 0.2459722363931134 and parameters: {'n_estimators': 1289, 'learning_rate': 0.09461064703549099, 'max_depth': 12, 'min_samples_split': 20, 'min_samples_leaf': 3, 'subsample': 0.6923978358973805, 'max_features': 'sqrt'}. Best is trial 1137 with value: 0.19687116000636118.
[I 2024-12-04 13:10:51,795] Trial 1473 finished with value: 0.22285405809792613 and parameters: {'n_estimators': 1090, 'learning_rate': 0.07239577162341879, 'max_depth': 12, 'min_samples_split': 15, 'min_samples_leaf': 1, 'subsample': 0.6025323921696331, 'max_features': 'sqrt'}. Best is trial 1137 with value: 0.19687116000636118.
[I 2024-12-04 13:10:51,893] Trial 1466 finished with value: 0.22911623772040296 and parameters: {'n_estimators': 1446, 'learning_rate': 0.09105991952891476, 'max_depth': 10, 'min_samples_split': 16, 'min_samples_leaf': 1, 'subsample': 0.7038423826535315, 'max_features': 'sqrt'}. Best is trial 1137 with value: 0.19687116000636118.
[I 2024-12-04 13:10:55,031] Trial 1470 finished with value: 0.20831102229029685 and parameters: {'n_estimators': 1372, 'learning_rate': 0.08011938219306007, 'max_depth': 12, 'min_samples_split': 18, 'min_samples_leaf': 1, 'subsample': 0.7236817460365119, 'max_features': 'sqrt'}. Best is trial 1137 with value: 0.19687116000636118.
[I 2024-12-04 13:10:57,032] Trial 1469 finished with value: 0.21444711824437152 and parameters: {'n_estimators': 1421, 'learning_rate': 0.07099294149670023, 'max_depth': 10, 'min_samples_split': 15, 'min_samples_leaf': 1, 'subsample': 0.6101748889815399, 'max_features': 'sqrt'}. Best is trial 1137 with value: 0.19687116000636118.
[I 2024-12-04 13:11:00,977] Trial 1471 finished with value: 0.22030454428193122 and parameters: {'n_estimators': 1279, 'learning_rate': 0.09012571648821784, 'max_depth': 10, 'min_samples_split': 14, 'min_samples_leaf': 1, 'subsample': 0.6114838710680548, 'max_features': 'sqrt'}. Best is trial 1137 with value: 0.19687116000636118.
[I 2024-12-04 13:11:02,513] Trial 1475 finished with value: 0.23713048772741063 and parameters: {'n_estimators': 1211, 'learning_rate': 0.08608367117520956, 'max_depth': 11, 'min_samples_split': 16, 'min_samples_leaf': 1, 'subsample': 0.6372438957635234, 'max_features': 'log2'}. Best is trial 1137 with value: 0.19687116000636118.
[I 2024-12-04 13:11:05,191] Trial 1474 finished with value: 0.28176587508313833 and parameters: {'n_estimators': 1279, 'learning_rate': 0.07732317337154461, 'max_depth': 12, 'min_samples_split': 16, 'min_samples_leaf': 3, 'subsample': 0.6626049853229474, 'max_features': 'log2'}. Best is trial 1137 with value: 0.19687116000636118.
[I 2024-12-04 13:11:08,850] Trial 1503 finished with value: 0.49626660202264505 and parameters: {'n_estimators': 175, 'learning_rate': 0.026185016175714927, 'max_depth': 9, 'min_samples_split': 6, 'min_samples_leaf': 7, 'subsample': 0.971131013143975, 'max_features': 'sqrt'}. Best is trial 1137 with value: 0.19687116000636118.
[I 2024-12-04 13:11:10,102] Trial 1478 finished with value: 0.24233121729252818 and parameters: {'n_estimators': 1180, 'learning_rate': 0.081428216615311, 'max_depth': 10, 'min_samples_split': 15, 'min_samples_leaf': 1, 'subsample': 0.6035864218425073, 'max_features': 'sqrt'}. Best is trial 1137 with value: 0.19687116000636118.
[I 2024-12-04 13:11:13,265] Trial 1482 finished with value: 0.21535099926016152 and parameters: {'n_estimators': 1123, 'learning_rate': 0.08997865568164236, 'max_depth': 12, 'min_samples_split': 17, 'min_samples_leaf': 1, 'subsample': 0.6542481141507698, 'max_features': 'sqrt'}. Best is trial 1137 with value: 0.19687116000636118.
[I 2024-12-04 13:11:21,687] Trial 1480 finished with value: 0.21588288776861644 and parameters: {'n_estimators': 1310, 'learning_rate': 0.09440552890395615, 'max_depth': 12, 'min_samples_split': 12, 'min_samples_leaf': 1, 'subsample': 0.6179732627689208, 'max_features': 'sqrt'}. Best is trial 1137 with value: 0.19687116000636118.
[I 2024-12-04 13:11:28,650] Trial 1479 finished with value: 0.25278453011842283 and parameters: {'n_estimators': 1469, 'learning_rate': 0.0869081436798245, 'max_depth': 9, 'min_samples_split': 16, 'min_samples_leaf': 3, 'subsample': 0.600927718238869, 'max_features': 'sqrt'}. Best is trial 1137 with value: 0.19687116000636118.
[I 2024-12-04 13:11:32,283] Trial 1481 finished with value: 0.25058857097031995 and parameters: {'n_estimators': 1466, 'learning_rate': 0.09017298930245529, 'max_depth': 12, 'min_samples_split': 13, 'min_samples_leaf': 3, 'subsample': 0.6110119692041275, 'max_features': 'sqrt'}. Best is trial 1137 with value: 0.19687116000636118.
[I 2024-12-04 13:11:34,387] Trial 1494 finished with value: 0.48126622202258773 and parameters: {'n_estimators': 963, 'learning_rate': 0.016419458628000767, 'max_depth': 8, 'min_samples_split': 2, 'min_samples_leaf': 10, 'subsample': 0.6315678916084966, 'max_features': 'sqrt'}. Best is trial 1137 with value: 0.19687116000636118.
[I 2024-12-04 13:11:36,179] Trial 1486 finished with value: 0.25415544207649116 and parameters: {'n_estimators': 1339, 'learning_rate': 0.059980013523321954, 'max_depth': 10, 'min_samples_split': 20, 'min_samples_leaf': 3, 'subsample': 0.7480595256502034, 'max_features': 'sqrt'}. Best is trial 1137 with value: 0.19687116000636118.
[I 2024-12-04 13:11:36,190] Trial 1483 finished with value: 0.21439790772079712 and parameters: {'n_estimators': 1438, 'learning_rate': 0.09698408282736627, 'max_depth': 11, 'min_samples_split': 20, 'min_samples_leaf': 1, 'subsample': 0.607495909237417, 'max_features': 'sqrt'}. Best is trial 1137 with value: 0.19687116000636118.
[I 2024-12-04 13:11:38,138] Trial 1513 finished with value: 0.7122234611698168 and parameters: {'n_estimators': 216, 'learning_rate': 0.013507580194123845, 'max_depth': 6, 'min_samples_split': 8, 'min_samples_leaf': 9, 'subsample': 0.6578420454121205, 'max_features': 'sqrt'}. Best is trial 1137 with value: 0.19687116000636118.
[I 2024-12-04 13:11:39,496] Trial 1484 finished with value: 0.23018391650895825 and parameters: {'n_estimators': 1448, 'learning_rate': 0.05681504042690494, 'max_depth': 10, 'min_samples_split': 18, 'min_samples_leaf': 1, 'subsample': 0.6751388949081564, 'max_features': 'sqrt'}. Best is trial 1137 with value: 0.19687116000636118.
[I 2024-12-04 13:11:40,135] Trial 1485 finished with value: 0.22107649636513885 and parameters: {'n_estimators': 1429, 'learning_rate': 0.07709071323544185, 'max_depth': 12, 'min_samples_split': 15, 'min_samples_leaf': 1, 'subsample': 0.6032444362635704, 'max_features': 'sqrt'}. Best is trial 1137 with value: 0.19687116000636118.
[I 2024-12-04 13:11:43,431] Trial 1506 finished with value: 0.30388594409590813 and parameters: {'n_estimators': 580, 'learning_rate': 0.014647500949490489, 'max_depth': 10, 'min_samples_split': 20, 'min_samples_leaf': 2, 'subsample': 0.8522938158346811, 'max_features': None}. Best is trial 1137 with value: 0.19687116000636118.
[I 2024-12-04 13:11:46,341] Trial 1488 finished with value: 0.2932159365447248 and parameters: {'n_estimators': 1259, 'learning_rate': 0.08727896451752556, 'max_depth': 5, 'min_samples_split': 7, 'min_samples_leaf': 2, 'subsample': 0.6275706765109391, 'max_features': None}. Best is trial 1137 with value: 0.19687116000636118.
[I 2024-12-04 13:11:49,878] Trial 1492 finished with value: 0.2185360471423532 and parameters: {'n_estimators': 1193, 'learning_rate': 0.07707517265397261, 'max_depth': 12, 'min_samples_split': 16, 'min_samples_leaf': 1, 'subsample': 0.6674357820011072, 'max_features': 'sqrt'}. Best is trial 1137 with value: 0.19687116000636118.
[I 2024-12-04 13:11:51,249] Trial 1496 finished with value: 0.38216531937105974 and parameters: {'n_estimators': 1109, 'learning_rate': 0.09325163400638822, 'max_depth': 8, 'min_samples_split': 14, 'min_samples_leaf': 8, 'subsample': 0.6622793908150855, 'max_features': 'sqrt'}. Best is trial 1137 with value: 0.19687116000636118.
[I 2024-12-04 13:11:51,962] Trial 1487 finished with value: 0.23537447049201474 and parameters: {'n_estimators': 1499, 'learning_rate': 0.0890164847888579, 'max_depth': 11, 'min_samples_split': 16, 'min_samples_leaf': 2, 'subsample': 0.6134927188440593, 'max_features': 'sqrt'}. Best is trial 1137 with value: 0.19687116000636118.
[I 2024-12-04 13:11:53,922] Trial 1493 finished with value: 0.22241893977280727 and parameters: {'n_estimators': 1313, 'learning_rate': 0.09708496664775375, 'max_depth': 12, 'min_samples_split': 15, 'min_samples_leaf': 1, 'subsample': 0.6045031857818136, 'max_features': 'sqrt'}. Best is trial 1137 with value: 0.19687116000636118.
[I 2024-12-04 13:11:54,251] Trial 1507 finished with value: 0.4120709127756509 and parameters: {'n_estimators': 793, 'learning_rate': 0.07420294095897931, 'max_depth': 11, 'min_samples_split': 3, 'min_samples_leaf': 10, 'subsample': 0.7564313722084073, 'max_features': 'sqrt'}. Best is trial 1137 with value: 0.19687116000636118.
[I 2024-12-04 13:11:57,191] Trial 1491 finished with value: 0.2180313626276719 and parameters: {'n_estimators': 1417, 'learning_rate': 0.09251432296092396, 'max_depth': 12, 'min_samples_split': 14, 'min_samples_leaf': 1, 'subsample': 0.633450716877998, 'max_features': 'sqrt'}. Best is trial 1137 with value: 0.19687116000636118.
[I 2024-12-04 13:11:59,283] Trial 1489 finished with value: 0.21483913280669556 and parameters: {'n_estimators': 1467, 'learning_rate': 0.07002026876180081, 'max_depth': 10, 'min_samples_split': 17, 'min_samples_leaf': 1, 'subsample': 0.6109066197748707, 'max_features': 'sqrt'}. Best is trial 1137 with value: 0.19687116000636118.
[I 2024-12-04 13:12:00,083] Trial 1490 finished with value: 0.23379785290223162 and parameters: {'n_estimators': 1454, 'learning_rate': 0.03708414837954539, 'max_depth': 12, 'min_samples_split': 19, 'min_samples_leaf': 1, 'subsample': 0.806504270275558, 'max_features': 'sqrt'}. Best is trial 1137 with value: 0.19687116000636118.
[I 2024-12-04 13:12:02,962] Trial 1497 finished with value: 0.2564113870550963 and parameters: {'n_estimators': 1168, 'learning_rate': 0.09163766086807, 'max_depth': 10, 'min_samples_split': 17, 'min_samples_leaf': 1, 'subsample': 0.608184098151753, 'max_features': None}. Best is trial 1137 with value: 0.19687116000636118.
[I 2024-12-04 13:12:06,070] Trial 1495 finished with value: 0.22152290199817223 and parameters: {'n_estimators': 1455, 'learning_rate': 0.060036577561128145, 'max_depth': 11, 'min_samples_split': 16, 'min_samples_leaf': 1, 'subsample': 0.6056325779741817, 'max_features': 'sqrt'}. Best is trial 1137 with value: 0.19687116000636118.
[I 2024-12-04 13:12:08,289] Trial 1502 finished with value: 0.23032719500946647 and parameters: {'n_estimators': 1261, 'learning_rate': 0.06647586941364175, 'max_depth': 12, 'min_samples_split': 17, 'min_samples_leaf': 2, 'subsample': 0.6936893890677689, 'max_features': 'sqrt'}. Best is trial 1137 with value: 0.19687116000636118.
[I 2024-12-04 13:12:09,525] Trial 1498 finished with value: 0.40640229822889884 and parameters: {'n_estimators': 1452, 'learning_rate': 0.043434791813472734, 'max_depth': 3, 'min_samples_split': 4, 'min_samples_leaf': 6, 'subsample': 0.9144493569904028, 'max_features': 'log2'}. Best is trial 1137 with value: 0.19687116000636118.
[I 2024-12-04 13:12:10,471] Trial 1528 finished with value: 0.38929458948225054 and parameters: {'n_estimators': 113, 'learning_rate': 0.0263940312108308, 'max_depth': 12, 'min_samples_split': 8, 'min_samples_leaf': 6, 'subsample': 0.7113664198879576, 'max_features': None}. Best is trial 1137 with value: 0.19687116000636118.
[I 2024-12-04 13:12:11,640] Trial 1500 finished with value: 0.21228511730468372 and parameters: {'n_estimators': 1371, 'learning_rate': 0.09465905393425886, 'max_depth': 11, 'min_samples_split': 16, 'min_samples_leaf': 1, 'subsample': 0.7093544015755298, 'max_features': 'sqrt'}. Best is trial 1137 with value: 0.19687116000636118.
[I 2024-12-04 13:12:12,734] Trial 1499 finished with value: 0.24287146937901663 and parameters: {'n_estimators': 1473, 'learning_rate': 0.07156419878753836, 'max_depth': 12, 'min_samples_split': 16, 'min_samples_leaf': 3, 'subsample': 0.6636037850130253, 'max_features': 'sqrt'}. Best is trial 1137 with value: 0.19687116000636118.
[I 2024-12-04 13:12:14,313] Trial 1501 finished with value: 0.222101084194285 and parameters: {'n_estimators': 1500, 'learning_rate': 0.0870204750523156, 'max_depth': 10, 'min_samples_split': 15, 'min_samples_leaf': 2, 'subsample': 0.6300901837692364, 'max_features': 'sqrt'}. Best is trial 1137 with value: 0.19687116000636118.
[I 2024-12-04 13:12:16,410] Trial 1525 finished with value: 0.2858606669610183 and parameters: {'n_estimators': 329, 'learning_rate': 0.06164308782284781, 'max_depth': 12, 'min_samples_split': 7, 'min_samples_leaf': 1, 'subsample': 0.7732827385992163, 'max_features': None}. Best is trial 1137 with value: 0.19687116000636118.
[I 2024-12-04 13:12:17,872] Trial 1505 finished with value: 0.20644894055481203 and parameters: {'n_estimators': 1424, 'learning_rate': 0.09235440575562377, 'max_depth': 10, 'min_samples_split': 15, 'min_samples_leaf': 1, 'subsample': 0.6116127696637926, 'max_features': 'sqrt'}. Best is trial 1137 with value: 0.19687116000636118.
[I 2024-12-04 13:12:18,988] Trial 1504 finished with value: 0.22219704777017754 and parameters: {'n_estimators': 1475, 'learning_rate': 0.08198464577316997, 'max_depth': 12, 'min_samples_split': 17, 'min_samples_leaf': 1, 'subsample': 0.6195721984841096, 'max_features': 'sqrt'}. Best is trial 1137 with value: 0.19687116000636118.
[I 2024-12-04 13:12:20,078] Trial 1509 finished with value: 0.22862318392764303 and parameters: {'n_estimators': 1347, 'learning_rate': 0.09920576177114962, 'max_depth': 12, 'min_samples_split': 17, 'min_samples_leaf': 1, 'subsample': 0.6702487204616828, 'max_features': 'sqrt'}. Best is trial 1137 with value: 0.19687116000636118.
[I 2024-12-04 13:12:22,832] Trial 1530 finished with value: 0.4800015141140925 and parameters: {'n_estimators': 399, 'learning_rate': 0.011855202770898868, 'max_depth': 8, 'min_samples_split': 20, 'min_samples_leaf': 5, 'subsample': 0.8160890764269342, 'max_features': 'sqrt'}. Best is trial 1137 with value: 0.19687116000636118.
[I 2024-12-04 13:12:24,258] Trial 1508 finished with value: 0.21976742634000052 and parameters: {'n_estimators': 1475, 'learning_rate': 0.09658074813652268, 'max_depth': 12, 'min_samples_split': 16, 'min_samples_leaf': 1, 'subsample': 0.6357332060374574, 'max_features': 'sqrt'}. Best is trial 1137 with value: 0.19687116000636118.
[I 2024-12-04 13:12:25,989] Trial 1510 finished with value: 0.21528488814647023 and parameters: {'n_estimators': 1449, 'learning_rate': 0.09090142523282502, 'max_depth': 12, 'min_samples_split': 13, 'min_samples_leaf': 1, 'subsample': 0.6042863831316334, 'max_features': 'sqrt'}. Best is trial 1137 with value: 0.19687116000636118.
[I 2024-12-04 13:12:28,654] Trial 1511 finished with value: 0.20690648513362941 and parameters: {'n_estimators': 1473, 'learning_rate': 0.09226390108816974, 'max_depth': 11, 'min_samples_split': 16, 'min_samples_leaf': 1, 'subsample': 0.6175058997876666, 'max_features': 'sqrt'}. Best is trial 1137 with value: 0.19687116000636118.
[I 2024-12-04 13:12:30,405] Trial 1512 finished with value: 0.22188169255050139 and parameters: {'n_estimators': 1474, 'learning_rate': 0.09416606414937957, 'max_depth': 10, 'min_samples_split': 14, 'min_samples_leaf': 1, 'subsample': 0.6103779358776387, 'max_features': 'sqrt'}. Best is trial 1137 with value: 0.19687116000636118.
[I 2024-12-04 13:12:31,648] Trial 1519 finished with value: 0.3750426488605158 and parameters: {'n_estimators': 900, 'learning_rate': 0.0179186778555993, 'max_depth': 7, 'min_samples_split': 14, 'min_samples_leaf': 8, 'subsample': 0.6962441242641411, 'max_features': None}. Best is trial 1137 with value: 0.19687116000636118.
[I 2024-12-04 13:12:34,187] Trial 1531 finished with value: 0.356216937090629 and parameters: {'n_estimators': 590, 'learning_rate': 0.011867236102121405, 'max_depth': 5, 'min_samples_split': 7, 'min_samples_leaf': 2, 'subsample': 0.7449920666137982, 'max_features': None}. Best is trial 1137 with value: 0.19687116000636118.
[I 2024-12-04 13:12:37,098] Trial 1532 finished with value: 0.38153685093702056 and parameters: {'n_estimators': 546, 'learning_rate': 0.021813637101909717, 'max_depth': 11, 'min_samples_split': 15, 'min_samples_leaf': 10, 'subsample': 0.9785640830412778, 'max_features': None}. Best is trial 1137 with value: 0.19687116000636118.
[I 2024-12-04 13:12:39,554] Trial 1514 finished with value: 0.3592690897447848 and parameters: {'n_estimators': 1210, 'learning_rate': 0.09422714695184117, 'max_depth': 11, 'min_samples_split': 5, 'min_samples_leaf': 9, 'subsample': 0.8255055405307586, 'max_features': None}. Best is trial 1137 with value: 0.19687116000636118.
[I 2024-12-04 13:12:41,409] Trial 1535 finished with value: 0.49543198009314376 and parameters: {'n_estimators': 548, 'learning_rate': 0.0863289209589106, 'max_depth': 8, 'min_samples_split': 4, 'min_samples_leaf': 8, 'subsample': 0.6460706225862745, 'max_features': 'log2'}. Best is trial 1137 with value: 0.19687116000636118.
[I 2024-12-04 13:12:46,320] Trial 1533 finished with value: 0.3675936860051712 and parameters: {'n_estimators': 714, 'learning_rate': 0.018674380880636207, 'max_depth': 3, 'min_samples_split': 11, 'min_samples_leaf': 3, 'subsample': 0.8457900059002814, 'max_features': None}. Best is trial 1137 with value: 0.19687116000636118.
[I 2024-12-04 13:12:49,597] Trial 1515 finished with value: 0.20946914123304095 and parameters: {'n_estimators': 1496, 'learning_rate': 0.08591317958276781, 'max_depth': 12, 'min_samples_split': 14, 'min_samples_leaf': 1, 'subsample': 0.6568364508670712, 'max_features': 'sqrt'}. Best is trial 1137 with value: 0.19687116000636118.
[I 2024-12-04 13:12:51,776] Trial 1517 finished with value: 0.5658743211366798 and parameters: {'n_estimators': 1433, 'learning_rate': 0.010203932524753845, 'max_depth': 10, 'min_samples_split': 7, 'min_samples_leaf': 7, 'subsample': 0.9406645144359707, 'max_features': 'log2'}. Best is trial 1137 with value: 0.19687116000636118.
[I 2024-12-04 13:12:53,487] Trial 1516 finished with value: 0.21695013464260132 and parameters: {'n_estimators': 1496, 'learning_rate': 0.0516733706861037, 'max_depth': 12, 'min_samples_split': 13, 'min_samples_leaf': 1, 'subsample': 0.6003155139830797, 'max_features': 'sqrt'}. Best is trial 1137 with value: 0.19687116000636118.
[I 2024-12-04 13:12:54,874] Trial 1520 finished with value: 0.24372415093732328 and parameters: {'n_estimators': 1378, 'learning_rate': 0.0983839532240956, 'max_depth': 11, 'min_samples_split': 17, 'min_samples_leaf': 2, 'subsample': 0.7319946044967834, 'max_features': 'sqrt'}. Best is trial 1137 with value: 0.19687116000636118.
[I 2024-12-04 13:12:54,884] Trial 1537 finished with value: 0.6220255108310534 and parameters: {'n_estimators': 666, 'learning_rate': 0.024294193495560182, 'max_depth': 3, 'min_samples_split': 18, 'min_samples_leaf': 8, 'subsample': 0.9368486521355871, 'max_features': 'log2'}. Best is trial 1137 with value: 0.19687116000636118.
[I 2024-12-04 13:12:57,343] Trial 1518 finished with value: 0.24422267937003983 and parameters: {'n_estimators': 1497, 'learning_rate': 0.07053531680063922, 'max_depth': 8, 'min_samples_split': 17, 'min_samples_leaf': 2, 'subsample': 0.6051826692168784, 'max_features': 'sqrt'}. Best is trial 1137 with value: 0.19687116000636118.
[I 2024-12-04 13:13:00,638] Trial 1522 finished with value: 0.2542346157651143 and parameters: {'n_estimators': 1419, 'learning_rate': 0.09997417660189778, 'max_depth': 12, 'min_samples_split': 15, 'min_samples_leaf': 4, 'subsample': 0.7122350469230384, 'max_features': 'sqrt'}. Best is trial 1137 with value: 0.19687116000636118.
[I 2024-12-04 13:13:04,525] Trial 1521 finished with value: 0.3339807970724636 and parameters: {'n_estimators': 1486, 'learning_rate': 0.013737035565382541, 'max_depth': 9, 'min_samples_split': 13, 'min_samples_leaf': 1, 'subsample': 0.9280654117578722, 'max_features': 'log2'}. Best is trial 1137 with value: 0.19687116000636118.
[I 2024-12-04 13:13:07,607] Trial 1523 finished with value: 0.2776935965283032 and parameters: {'n_estimators': 1364, 'learning_rate': 0.05715812955137461, 'max_depth': 9, 'min_samples_split': 14, 'min_samples_leaf': 4, 'subsample': 0.6184713145103135, 'max_features': None}. Best is trial 1137 with value: 0.19687116000636118.
