[I 2024-12-04 12:23:14,459] Trial 1944 finished with value: 0.5156271747676298 and parameters: {'n_estimators': 107, 'max_depth': 17, 'min_samples_split': 3, 'min_samples_leaf': 1, 'max_features': None, 'bootstrap': True, 'criterion': 'absolute_error'}. Best is trial 1749 with value: 0.502720715661024.
[I 2024-12-04 12:23:14,622] Trial 1927 finished with value: 0.5144471207072746 and parameters: {'n_estimators': 271, 'max_depth': 20, 'min_samples_split': 4, 'min_samples_leaf': 1, 'max_features': None, 'bootstrap': True, 'criterion': 'absolute_error'}. Best is trial 1749 with value: 0.502720715661024.
[I 2024-12-04 12:23:16,157] Trial 1949 finished with value: 0.8748048502876388 and parameters: {'n_estimators': 443, 'max_depth': 28, 'min_samples_split': 18, 'min_samples_leaf': 1, 'max_features': 'log2', 'bootstrap': True, 'criterion': 'squared_error'}. Best is trial 1749 with value: 0.502720715661024.
[I 2024-12-04 12:23:16,976] Trial 1938 finished with value: 0.5221510422664656 and parameters: {'n_estimators': 110, 'max_depth': 24, 'min_samples_split': 7, 'min_samples_leaf': 1, 'max_features': None, 'bootstrap': True, 'criterion': 'absolute_error'}. Best is trial 1749 with value: 0.502720715661024.
[I 2024-12-04 12:23:17,415] Trial 1954 finished with value: 0.5189207558506091 and parameters: {'n_estimators': 111, 'max_depth': 22, 'min_samples_split': 7, 'min_samples_leaf': 1, 'max_features': None, 'bootstrap': True, 'criterion': 'absolute_error'}. Best is trial 1749 with value: 0.502720715661024.
[I 2024-12-04 12:23:18,407] Trial 1952 finished with value: 0.5191519126373167 and parameters: {'n_estimators': 114, 'max_depth': 19, 'min_samples_split': 3, 'min_samples_leaf': 1, 'max_features': None, 'bootstrap': True, 'criterion': 'absolute_error'}. Best is trial 1749 with value: 0.502720715661024.
[I 2024-12-04 12:23:18,934] Trial 1951 finished with value: 0.5154358631076994 and parameters: {'n_estimators': 100, 'max_depth': 24, 'min_samples_split': 6, 'min_samples_leaf': 1, 'max_features': None, 'bootstrap': True, 'criterion': 'absolute_error'}. Best is trial 1749 with value: 0.502720715661024.
[I 2024-12-04 12:23:18,936] Trial 1959 finished with value: 1.0390071921789263 and parameters: {'n_estimators': 710, 'max_depth': 33, 'min_samples_split': 14, 'min_samples_leaf': 5, 'max_features': 'sqrt', 'bootstrap': False, 'criterion': 'squared_error'}. Best is trial 1749 with value: 0.502720715661024.
[I 2024-12-04 12:23:19,549] Trial 1945 finished with value: 0.667868244231594 and parameters: {'n_estimators': 426, 'max_depth': 5, 'min_samples_split': 2, 'min_samples_leaf': 7, 'max_features': None, 'bootstrap': False, 'criterion': 'absolute_error'}. Best is trial 1749 with value: 0.502720715661024.
[I 2024-12-04 12:23:22,133] Trial 1946 finished with value: 0.5161777908178203 and parameters: {'n_estimators': 252, 'max_depth': 15, 'min_samples_split': 5, 'min_samples_leaf': 1, 'max_features': None, 'bootstrap': True, 'criterion': 'absolute_error'}. Best is trial 1749 with value: 0.502720715661024.
[I 2024-12-04 12:23:23,447] Trial 1953 finished with value: 0.5179706228709204 and parameters: {'n_estimators': 101, 'max_depth': 13, 'min_samples_split': 7, 'min_samples_leaf': 1, 'max_features': None, 'bootstrap': True, 'criterion': 'absolute_error'}. Best is trial 1749 with value: 0.502720715661024.
[I 2024-12-04 12:23:25,972] Trial 1960 finished with value: 0.5223328095870029 and parameters: {'n_estimators': 117, 'max_depth': 18, 'min_samples_split': 7, 'min_samples_leaf': 1, 'max_features': None, 'bootstrap': True, 'criterion': 'absolute_error'}. Best is trial 1749 with value: 0.502720715661024.
[I 2024-12-04 12:23:27,464] Trial 1963 finished with value: 0.5144542717313849 and parameters: {'n_estimators': 118, 'max_depth': 15, 'min_samples_split': 4, 'min_samples_leaf': 1, 'max_features': None, 'bootstrap': True, 'criterion': 'absolute_error'}. Best is trial 1749 with value: 0.502720715661024.
[I 2024-12-04 12:23:29,350] Trial 1962 finished with value: 0.5117056954052875 and parameters: {'n_estimators': 102, 'max_depth': 12, 'min_samples_split': 4, 'min_samples_leaf': 1, 'max_features': None, 'bootstrap': True, 'criterion': 'absolute_error'}. Best is trial 1749 with value: 0.502720715661024.
[I 2024-12-04 12:23:30,266] Trial 1958 finished with value: 0.5165358935859867 and parameters: {'n_estimators': 180, 'max_depth': 14, 'min_samples_split': 5, 'min_samples_leaf': 1, 'max_features': None, 'bootstrap': True, 'criterion': 'absolute_error'}. Best is trial 1749 with value: 0.502720715661024.
[I 2024-12-04 12:23:30,363] Trial 1964 finished with value: 0.9534700234581259 and parameters: {'n_estimators': 305, 'max_depth': 26, 'min_samples_split': 4, 'min_samples_leaf': 1, 'max_features': 'log2', 'bootstrap': True, 'criterion': 'absolute_error'}. Best is trial 1749 with value: 0.502720715661024.
[I 2024-12-04 12:23:31,178] Trial 1965 finished with value: 0.5041955874758516 and parameters: {'n_estimators': 108, 'max_depth': 16, 'min_samples_split': 4, 'min_samples_leaf': 1, 'max_features': None, 'bootstrap': True, 'criterion': 'absolute_error'}. Best is trial 1749 with value: 0.502720715661024.
[I 2024-12-04 12:23:31,709] Trial 1957 finished with value: 0.5060917318187269 and parameters: {'n_estimators': 110, 'max_depth': 18, 'min_samples_split': 4, 'min_samples_leaf': 1, 'max_features': None, 'bootstrap': True, 'criterion': 'absolute_error'}. Best is trial 1749 with value: 0.502720715661024.
[I 2024-12-04 12:23:31,753] Trial 1975 finished with value: 1.2132319767313908 and parameters: {'n_estimators': 950, 'max_depth': 9, 'min_samples_split': 47, 'min_samples_leaf': 6, 'max_features': 'log2', 'bootstrap': False, 'criterion': 'squared_error'}. Best is trial 1749 with value: 0.502720715661024.
[I 2024-12-04 12:23:32,570] Trial 1955 finished with value: 0.5604951710972716 and parameters: {'n_estimators': 250, 'max_depth': 17, 'min_samples_split': 5, 'min_samples_leaf': 2, 'max_features': None, 'bootstrap': True, 'criterion': 'absolute_error'}. Best is trial 1749 with value: 0.502720715661024.
[I 2024-12-04 12:23:33,121] Trial 1956 finished with value: 0.5128304580597899 and parameters: {'n_estimators': 214, 'max_depth': 18, 'min_samples_split': 4, 'min_samples_leaf': 1, 'max_features': None, 'bootstrap': True, 'criterion': 'absolute_error'}. Best is trial 1749 with value: 0.502720715661024.
[I 2024-12-04 12:23:35,266] Trial 1948 finished with value: 0.5293039544641235 and parameters: {'n_estimators': 249, 'max_depth': 23, 'min_samples_split': 6, 'min_samples_leaf': 1, 'max_features': None, 'bootstrap': False, 'criterion': 'absolute_error'}. Best is trial 1749 with value: 0.502720715661024.
[I 2024-12-04 12:23:35,772] Trial 1972 finished with value: 0.5579098342319008 and parameters: {'n_estimators': 102, 'max_depth': 16, 'min_samples_split': 3, 'min_samples_leaf': 2, 'max_features': None, 'bootstrap': True, 'criterion': 'absolute_error'}. Best is trial 1749 with value: 0.502720715661024.
[I 2024-12-04 12:23:36,404] Trial 1979 finished with value: 0.6821330722245253 and parameters: {'n_estimators': 221, 'max_depth': 25, 'min_samples_split': 3, 'min_samples_leaf': 1, 'max_features': 'sqrt', 'bootstrap': False, 'criterion': 'absolute_error'}. Best is trial 1749 with value: 0.502720715661024.
[I 2024-12-04 12:23:37,039] Trial 1971 finished with value: 0.5214949311619559 and parameters: {'n_estimators': 107, 'max_depth': 21, 'min_samples_split': 7, 'min_samples_leaf': 1, 'max_features': None, 'bootstrap': True, 'criterion': 'absolute_error'}. Best is trial 1749 with value: 0.502720715661024.
[I 2024-12-04 12:23:37,056] Trial 1966 finished with value: 0.5264618748775274 and parameters: {'n_estimators': 105, 'max_depth': 24, 'min_samples_split': 3, 'min_samples_leaf': 1, 'max_features': None, 'bootstrap': True, 'criterion': 'absolute_error'}. Best is trial 1749 with value: 0.502720715661024.
[I 2024-12-04 12:23:37,943] Trial 1970 finished with value: 0.5131833075644436 and parameters: {'n_estimators': 115, 'max_depth': 17, 'min_samples_split': 4, 'min_samples_leaf': 1, 'max_features': None, 'bootstrap': True, 'criterion': 'absolute_error'}. Best is trial 1749 with value: 0.502720715661024.
[I 2024-12-04 12:23:38,980] Trial 1978 finished with value: 1.3224546760356808 and parameters: {'n_estimators': 933, 'max_depth': 16, 'min_samples_split': 2, 'min_samples_leaf': 12, 'max_features': 'sqrt', 'bootstrap': False, 'criterion': 'absolute_error'}. Best is trial 1749 with value: 0.502720715661024.
[I 2024-12-04 12:23:39,168] Trial 1968 finished with value: 0.5806093517460984 and parameters: {'n_estimators': 224, 'max_depth': 18, 'min_samples_split': 8, 'min_samples_leaf': 2, 'max_features': None, 'bootstrap': False, 'criterion': 'absolute_error'}. Best is trial 1749 with value: 0.502720715661024.
[I 2024-12-04 12:23:39,326] Trial 1976 finished with value: 0.5542999175297454 and parameters: {'n_estimators': 105, 'max_depth': 21, 'min_samples_split': 6, 'min_samples_leaf': 2, 'max_features': None, 'bootstrap': True, 'criterion': 'absolute_error'}. Best is trial 1749 with value: 0.502720715661024.
[I 2024-12-04 12:23:41,713] Trial 1977 finished with value: 1.2669979440474537 and parameters: {'n_estimators': 825, 'max_depth': 21, 'min_samples_split': 40, 'min_samples_leaf': 5, 'max_features': 'sqrt', 'bootstrap': True, 'criterion': 'absolute_error'}. Best is trial 1749 with value: 0.502720715661024.
[I 2024-12-04 12:23:42,148] Trial 1961 finished with value: 0.5221305186820776 and parameters: {'n_estimators': 247, 'max_depth': 24, 'min_samples_split': 3, 'min_samples_leaf': 1, 'max_features': None, 'bootstrap': True, 'criterion': 'absolute_error'}. Best is trial 1749 with value: 0.502720715661024.
[I 2024-12-04 12:23:42,383] Trial 1974 finished with value: 0.5519673315559678 and parameters: {'n_estimators': 283, 'max_depth': 14, 'min_samples_split': 4, 'min_samples_leaf': 2, 'max_features': None, 'bootstrap': True, 'criterion': 'absolute_error'}. Best is trial 1749 with value: 0.502720715661024.
[I 2024-12-04 12:23:43,432] Trial 1973 finished with value: 0.5108576592370399 and parameters: {'n_estimators': 106, 'max_depth': 21, 'min_samples_split': 5, 'min_samples_leaf': 1, 'max_features': None, 'bootstrap': True, 'criterion': 'absolute_error'}. Best is trial 1749 with value: 0.502720715661024.
[I 2024-12-04 12:23:44,642] Trial 1967 finished with value: 0.5201640093527026 and parameters: {'n_estimators': 251, 'max_depth': 26, 'min_samples_split': 4, 'min_samples_leaf': 1, 'max_features': None, 'bootstrap': True, 'criterion': 'absolute_error'}. Best is trial 1749 with value: 0.502720715661024.
[I 2024-12-04 12:23:44,894] Trial 1969 finished with value: 0.5164106425504248 and parameters: {'n_estimators': 271, 'max_depth': 14, 'min_samples_split': 4, 'min_samples_leaf': 1, 'max_features': None, 'bootstrap': True, 'criterion': 'absolute_error'}. Best is trial 1749 with value: 0.502720715661024.
[I 2024-12-04 12:23:46,178] Trial 1987 finished with value: 0.5401246205465714 and parameters: {'n_estimators': 274, 'max_depth': 50, 'min_samples_split': 2, 'min_samples_leaf': 1, 'max_features': None, 'bootstrap': True, 'criterion': 'squared_error'}. Best is trial 1749 with value: 0.502720715661024.
[I 2024-12-04 12:23:46,436] Trial 1983 finished with value: 0.5100106789831362 and parameters: {'n_estimators': 105, 'max_depth': 13, 'min_samples_split': 4, 'min_samples_leaf': 1, 'max_features': None, 'bootstrap': True, 'criterion': 'absolute_error'}. Best is trial 1749 with value: 0.502720715661024.
[I 2024-12-04 12:23:46,827] Trial 1980 finished with value: 0.5161575179377965 and parameters: {'n_estimators': 198, 'max_depth': 11, 'min_samples_split': 4, 'min_samples_leaf': 1, 'max_features': None, 'bootstrap': True, 'criterion': 'absolute_error'}. Best is trial 1749 with value: 0.502720715661024.
[I 2024-12-04 12:23:46,952] Trial 1985 finished with value: 0.5204978111427236 and parameters: {'n_estimators': 276, 'max_depth': 16, 'min_samples_split': 4, 'min_samples_leaf': 1, 'max_features': None, 'bootstrap': True, 'criterion': 'squared_error'}. Best is trial 1749 with value: 0.502720715661024.
[I 2024-12-04 12:23:48,413] Trial 1981 finished with value: 0.5150008505101907 and parameters: {'n_estimators': 105, 'max_depth': 16, 'min_samples_split': 3, 'min_samples_leaf': 1, 'max_features': None, 'bootstrap': True, 'criterion': 'absolute_error'}. Best is trial 1749 with value: 0.502720715661024.
[I 2024-12-04 12:23:49,949] Trial 1989 finished with value: 0.5163440697035149 and parameters: {'n_estimators': 106, 'max_depth': 19, 'min_samples_split': 7, 'min_samples_leaf': 1, 'max_features': None, 'bootstrap': True, 'criterion': 'absolute_error'}. Best is trial 1749 with value: 0.502720715661024.
[I 2024-12-04 12:23:50,628] Trial 1991 finished with value: 0.5231455741764669 and parameters: {'n_estimators': 102, 'max_depth': 21, 'min_samples_split': 8, 'min_samples_leaf': 1, 'max_features': None, 'bootstrap': True, 'criterion': 'absolute_error'}. Best is trial 1749 with value: 0.502720715661024.
[I 2024-12-04 12:23:51,399] Trial 1988 finished with value: 0.5086782176110866 and parameters: {'n_estimators': 101, 'max_depth': 13, 'min_samples_split': 4, 'min_samples_leaf': 1, 'max_features': None, 'bootstrap': True, 'criterion': 'absolute_error'}. Best is trial 1749 with value: 0.502720715661024.
[I 2024-12-04 12:23:53,891] Trial 1992 finished with value: 0.5244570255736835 and parameters: {'n_estimators': 108, 'max_depth': 13, 'min_samples_split': 4, 'min_samples_leaf': 1, 'max_features': None, 'bootstrap': True, 'criterion': 'squared_error'}. Best is trial 1749 with value: 0.502720715661024.
[I 2024-12-04 12:23:54,329] Trial 1982 finished with value: 0.5149832326699719 and parameters: {'n_estimators': 251, 'max_depth': 16, 'min_samples_split': 4, 'min_samples_leaf': 1, 'max_features': None, 'bootstrap': True, 'criterion': 'absolute_error'}. Best is trial 1749 with value: 0.502720715661024.
[I 2024-12-04 12:23:54,363] Trial 1990 finished with value: 1.2130873127481223 and parameters: {'n_estimators': 187, 'max_depth': 5, 'min_samples_split': 8, 'min_samples_leaf': 4, 'max_features': 'sqrt', 'bootstrap': False, 'criterion': 'absolute_error'}. Best is trial 1749 with value: 0.502720715661024.
[I 2024-12-04 12:23:55,110] Trial 2004 finished with value: 0.8052977836826909 and parameters: {'n_estimators': 102, 'max_depth': 19, 'min_samples_split': 4, 'min_samples_leaf': 1, 'max_features': 'sqrt', 'bootstrap': True, 'criterion': 'absolute_error'}. Best is trial 1749 with value: 0.502720715661024.
[I 2024-12-04 12:23:55,359] Trial 1984 finished with value: 0.5947451679524666 and parameters: {'n_estimators': 931, 'max_depth': 49, 'min_samples_split': 3, 'min_samples_leaf': 1, 'max_features': None, 'bootstrap': False, 'criterion': 'squared_error'}. Best is trial 1749 with value: 0.502720715661024.
[I 2024-12-04 12:23:57,195] Trial 1996 finished with value: 0.5082671632087482 and parameters: {'n_estimators': 102, 'max_depth': 18, 'min_samples_split': 5, 'min_samples_leaf': 1, 'max_features': None, 'bootstrap': True, 'criterion': 'absolute_error'}. Best is trial 1749 with value: 0.502720715661024.
[I 2024-12-04 12:23:57,211] Trial 1986 finished with value: 0.5594250411540488 and parameters: {'n_estimators': 237, 'max_depth': 18, 'min_samples_split': 4, 'min_samples_leaf': 2, 'max_features': None, 'bootstrap': True, 'criterion': 'absolute_error'}. Best is trial 1749 with value: 0.502720715661024.
[I 2024-12-04 12:23:57,844] Trial 1993 finished with value: 0.5549984513584056 and parameters: {'n_estimators': 222, 'max_depth': 10, 'min_samples_split': 4, 'min_samples_leaf': 2, 'max_features': None, 'bootstrap': True, 'criterion': 'absolute_error'}. Best is trial 1749 with value: 0.502720715661024.
[I 2024-12-04 12:23:57,853] Trial 1999 finished with value: 0.505626062830932 and parameters: {'n_estimators': 101, 'max_depth': 11, 'min_samples_split': 4, 'min_samples_leaf': 1, 'max_features': None, 'bootstrap': True, 'criterion': 'absolute_error'}. Best is trial 1749 with value: 0.502720715661024.
[I 2024-12-04 12:23:58,332] Trial 2009 finished with value: 0.6303679277961898 and parameters: {'n_estimators': 154, 'max_depth': 19, 'min_samples_split': 22, 'min_samples_leaf': 4, 'max_features': None, 'bootstrap': False, 'criterion': 'squared_error'}. Best is trial 1749 with value: 0.502720715661024.
[I 2024-12-04 12:23:59,025] Trial 2003 finished with value: 0.5129174419471255 and parameters: {'n_estimators': 101, 'max_depth': 21, 'min_samples_split': 4, 'min_samples_leaf': 1, 'max_features': None, 'bootstrap': True, 'criterion': 'absolute_error'}. Best is trial 1749 with value: 0.502720715661024.
[I 2024-12-04 12:23:59,802] Trial 1995 finished with value: 0.6279488141394705 and parameters: {'n_estimators': 199, 'max_depth': 11, 'min_samples_split': 5, 'min_samples_leaf': 2, 'max_features': None, 'bootstrap': False, 'criterion': 'absolute_error'}. Best is trial 1749 with value: 0.502720715661024.
[I 2024-12-04 12:24:00,734] Trial 2010 finished with value: 1.2311226726981332 and parameters: {'n_estimators': 421, 'max_depth': 19, 'min_samples_split': 18, 'min_samples_leaf': 11, 'max_features': 'log2', 'bootstrap': False, 'criterion': 'squared_error'}. Best is trial 1749 with value: 0.502720715661024.
[I 2024-12-04 12:24:00,760] Trial 1997 finished with value: 0.8404365609573469 and parameters: {'n_estimators': 600, 'max_depth': 21, 'min_samples_split': 32, 'min_samples_leaf': 1, 'max_features': 'sqrt', 'bootstrap': False, 'criterion': 'absolute_error'}. Best is trial 1749 with value: 0.502720715661024.
[I 2024-12-04 12:24:01,716] Trial 2000 finished with value: 0.5576872889166171 and parameters: {'n_estimators': 111, 'max_depth': 13, 'min_samples_split': 8, 'min_samples_leaf': 2, 'max_features': None, 'bootstrap': True, 'criterion': 'absolute_error'}. Best is trial 1749 with value: 0.502720715661024.
[I 2024-12-04 12:24:02,601] Trial 1994 finished with value: 0.5259322548060138 and parameters: {'n_estimators': 260, 'max_depth': 9, 'min_samples_split': 6, 'min_samples_leaf': 1, 'max_features': None, 'bootstrap': True, 'criterion': 'absolute_error'}. Best is trial 1749 with value: 0.502720715661024.
[I 2024-12-04 12:24:02,719] Trial 1998 finished with value: 0.5062205029163291 and parameters: {'n_estimators': 103, 'max_depth': 19, 'min_samples_split': 4, 'min_samples_leaf': 1, 'max_features': None, 'bootstrap': True, 'criterion': 'absolute_error'}. Best is trial 1749 with value: 0.502720715661024.
[I 2024-12-04 12:24:06,693] Trial 2007 finished with value: 1.0653501392705749 and parameters: {'n_estimators': 272, 'max_depth': 17, 'min_samples_split': 5, 'min_samples_leaf': 1, 'max_features': 'log2', 'bootstrap': True, 'criterion': 'absolute_error'}. Best is trial 1749 with value: 0.502720715661024.
[I 2024-12-04 12:24:06,928] Trial 2008 finished with value: 0.531938179657063 and parameters: {'n_estimators': 131, 'max_depth': 7, 'min_samples_split': 6, 'min_samples_leaf': 1, 'max_features': None, 'bootstrap': True, 'criterion': 'absolute_error'}. Best is trial 1749 with value: 0.502720715661024.
[I 2024-12-04 12:24:09,156] Trial 2019 finished with value: 0.8020609552478106 and parameters: {'n_estimators': 215, 'max_depth': 35, 'min_samples_split': 8, 'min_samples_leaf': 1, 'max_features': 'log2', 'bootstrap': True, 'criterion': 'squared_error'}. Best is trial 1749 with value: 0.502720715661024.
[I 2024-12-04 12:24:09,303] Trial 2002 finished with value: 0.566631146844168 and parameters: {'n_estimators': 237, 'max_depth': 10, 'min_samples_split': 4, 'min_samples_leaf': 1, 'max_features': None, 'bootstrap': False, 'criterion': 'absolute_error'}. Best is trial 1749 with value: 0.502720715661024.
[I 2024-12-04 12:24:09,889] Trial 2001 finished with value: 0.5194601951066994 and parameters: {'n_estimators': 247, 'max_depth': 21, 'min_samples_split': 4, 'min_samples_leaf': 1, 'max_features': None, 'bootstrap': True, 'criterion': 'absolute_error'}. Best is trial 1749 with value: 0.502720715661024.
[I 2024-12-04 12:24:10,599] Trial 2017 finished with value: 0.5230384099067283 and parameters: {'n_estimators': 104, 'max_depth': 10, 'min_samples_split': 3, 'min_samples_leaf': 1, 'max_features': None, 'bootstrap': True, 'criterion': 'absolute_error'}. Best is trial 1749 with value: 0.502720715661024.
[I 2024-12-04 12:24:13,480] Trial 2020 finished with value: 1.3051455781431551 and parameters: {'n_estimators': 292, 'max_depth': 6, 'min_samples_split': 3, 'min_samples_leaf': 2, 'max_features': 'log2', 'bootstrap': True, 'criterion': 'absolute_error'}. Best is trial 1749 with value: 0.502720715661024.
[I 2024-12-04 12:24:13,951] Trial 2016 finished with value: 0.5324785268236807 and parameters: {'n_estimators': 165, 'max_depth': 7, 'min_samples_split': 3, 'min_samples_leaf': 1, 'max_features': None, 'bootstrap': True, 'criterion': 'absolute_error'}. Best is trial 1749 with value: 0.502720715661024.
[I 2024-12-04 12:24:14,553] Trial 2021 finished with value: 1.0514150425592732 and parameters: {'n_estimators': 148, 'max_depth': 44, 'min_samples_split': 12, 'min_samples_leaf': 3, 'max_features': 'sqrt', 'bootstrap': False, 'criterion': 'absolute_error'}. Best is trial 1749 with value: 0.502720715661024.
[I 2024-12-04 12:24:14,754] Trial 2014 finished with value: 1.0409469854533353 and parameters: {'n_estimators': 715, 'max_depth': 43, 'min_samples_split': 48, 'min_samples_leaf': 14, 'max_features': None, 'bootstrap': True, 'criterion': 'absolute_error'}. Best is trial 1749 with value: 0.502720715661024.
[I 2024-12-04 12:24:16,362] Trial 2011 finished with value: 0.5324695510891752 and parameters: {'n_estimators': 247, 'max_depth': 7, 'min_samples_split': 5, 'min_samples_leaf': 1, 'max_features': None, 'bootstrap': True, 'criterion': 'absolute_error'}. Best is trial 1749 with value: 0.502720715661024.
