[I 2024-12-04 15:31:12,345] Trial 1792 finished with value: 1.0296206117806659 and parameters: {'n_estimators': 796, 'max_depth': 49, 'min_samples_split': 47, 'min_samples_leaf': 12, 'max_features': 'sqrt', 'bootstrap': True, 'criterion': 'squared_error'}. Best is trial 1025 with value: 0.41844370194907604.
[I 2024-12-04 15:31:13,103] Trial 1794 finished with value: 0.42328030061873223 and parameters: {'n_estimators': 695, 'max_depth': 50, 'min_samples_split': 2, 'min_samples_leaf': 1, 'max_features': None, 'bootstrap': True, 'criterion': 'squared_error'}. Best is trial 1025 with value: 0.41844370194907604.
[I 2024-12-04 15:31:18,707] Trial 1797 finished with value: 0.9964472057770762 and parameters: {'n_estimators': 660, 'max_depth': 6, 'min_samples_split': 5, 'min_samples_leaf': 1, 'max_features': 'log2', 'bootstrap': False, 'criterion': 'absolute_error'}. Best is trial 1025 with value: 0.41844370194907604.
[I 2024-12-04 15:31:19,341] Trial 1793 finished with value: 0.46472153178659936 and parameters: {'n_estimators': 631, 'max_depth': 44, 'min_samples_split': 3, 'min_samples_leaf': 2, 'max_features': None, 'bootstrap': True, 'criterion': 'squared_error'}. Best is trial 1025 with value: 0.41844370194907604.
[I 2024-12-04 15:31:20,031] Trial 1813 finished with value: 1.0277333700031601 and parameters: {'n_estimators': 250, 'max_depth': 29, 'min_samples_split': 36, 'min_samples_leaf': 3, 'max_features': 'log2', 'bootstrap': True, 'criterion': 'squared_error'}. Best is trial 1025 with value: 0.41844370194907604.
[I 2024-12-04 15:31:25,070] Trial 1805 finished with value: 0.421784675463169 and parameters: {'n_estimators': 554, 'max_depth': 41, 'min_samples_split': 2, 'min_samples_leaf': 1, 'max_features': None, 'bootstrap': True, 'criterion': 'squared_error'}. Best is trial 1025 with value: 0.41844370194907604.
[I 2024-12-04 15:31:25,325] Trial 1804 finished with value: 0.465257173357222 and parameters: {'n_estimators': 759, 'max_depth': 42, 'min_samples_split': 3, 'min_samples_leaf': 2, 'max_features': None, 'bootstrap': True, 'criterion': 'squared_error'}. Best is trial 1025 with value: 0.41844370194907604.
[I 2024-12-04 15:31:25,334] Trial 1795 finished with value: 0.4211485121961391 and parameters: {'n_estimators': 762, 'max_depth': 45, 'min_samples_split': 2, 'min_samples_leaf': 1, 'max_features': None, 'bootstrap': True, 'criterion': 'squared_error'}. Best is trial 1025 with value: 0.41844370194907604.
[I 2024-12-04 15:31:25,343] Trial 1789 finished with value: 0.42183775651742556 and parameters: {'n_estimators': 825, 'max_depth': 50, 'min_samples_split': 2, 'min_samples_leaf': 1, 'max_features': None, 'bootstrap': True, 'criterion': 'squared_error'}. Best is trial 1025 with value: 0.41844370194907604.
[I 2024-12-04 15:31:26,721] Trial 1802 finished with value: 0.4649278272815824 and parameters: {'n_estimators': 742, 'max_depth': 39, 'min_samples_split': 2, 'min_samples_leaf': 2, 'max_features': None, 'bootstrap': True, 'criterion': 'squared_error'}. Best is trial 1025 with value: 0.41844370194907604.
[I 2024-12-04 15:31:28,543] Trial 1796 finished with value: 0.42183397457492156 and parameters: {'n_estimators': 799, 'max_depth': 42, 'min_samples_split': 2, 'min_samples_leaf': 1, 'max_features': None, 'bootstrap': True, 'criterion': 'squared_error'}. Best is trial 1025 with value: 0.41844370194907604.
[I 2024-12-04 15:31:32,645] Trial 1803 finished with value: 0.420969304563051 and parameters: {'n_estimators': 797, 'max_depth': 36, 'min_samples_split': 2, 'min_samples_leaf': 1, 'max_features': None, 'bootstrap': True, 'criterion': 'squared_error'}. Best is trial 1025 with value: 0.41844370194907604.
[I 2024-12-04 15:31:34,207] Trial 1798 finished with value: 0.42510085015681975 and parameters: {'n_estimators': 757, 'max_depth': 34, 'min_samples_split': 3, 'min_samples_leaf': 1, 'max_features': None, 'bootstrap': True, 'criterion': 'squared_error'}. Best is trial 1025 with value: 0.41844370194907604.
[I 2024-12-04 15:31:40,641] Trial 1808 finished with value: 0.4192824937660168 and parameters: {'n_estimators': 776, 'max_depth': 41, 'min_samples_split': 2, 'min_samples_leaf': 1, 'max_features': None, 'bootstrap': True, 'criterion': 'squared_error'}. Best is trial 1025 with value: 0.41844370194907604.
[I 2024-12-04 15:31:43,382] Trial 1809 finished with value: 0.42322670859710654 and parameters: {'n_estimators': 843, 'max_depth': 41, 'min_samples_split': 3, 'min_samples_leaf': 1, 'max_features': None, 'bootstrap': True, 'criterion': 'squared_error'}. Best is trial 1025 with value: 0.41844370194907604.
[I 2024-12-04 15:31:44,159] Trial 1806 finished with value: 0.4241214853882903 and parameters: {'n_estimators': 761, 'max_depth': 38, 'min_samples_split': 3, 'min_samples_leaf': 1, 'max_features': None, 'bootstrap': True, 'criterion': 'squared_error'}. Best is trial 1025 with value: 0.41844370194907604.
[I 2024-12-04 15:31:46,190] Trial 1807 finished with value: 0.4211017036357861 and parameters: {'n_estimators': 811, 'max_depth': 34, 'min_samples_split': 2, 'min_samples_leaf': 1, 'max_features': None, 'bootstrap': True, 'criterion': 'squared_error'}. Best is trial 1025 with value: 0.41844370194907604.
[I 2024-12-04 15:31:48,026] Trial 1810 finished with value: 0.46510530481594725 and parameters: {'n_estimators': 853, 'max_depth': 46, 'min_samples_split': 2, 'min_samples_leaf': 2, 'max_features': None, 'bootstrap': True, 'criterion': 'squared_error'}. Best is trial 1025 with value: 0.41844370194907604.
[I 2024-12-04 15:31:49,062] Trial 1817 finished with value: 0.6779438253330909 and parameters: {'n_estimators': 674, 'max_depth': 9, 'min_samples_split': 3, 'min_samples_leaf': 11, 'max_features': None, 'bootstrap': True, 'criterion': 'squared_error'}. Best is trial 1025 with value: 0.41844370194907604.
[I 2024-12-04 15:31:52,878] Trial 1811 finished with value: 0.4316680671494446 and parameters: {'n_estimators': 796, 'max_depth': 44, 'min_samples_split': 4, 'min_samples_leaf': 1, 'max_features': None, 'bootstrap': True, 'criterion': 'squared_error'}. Best is trial 1025 with value: 0.41844370194907604.
[I 2024-12-04 15:31:54,493] Trial 1814 finished with value: 0.42041288588984 and parameters: {'n_estimators': 792, 'max_depth': 38, 'min_samples_split': 2, 'min_samples_leaf': 1, 'max_features': None, 'bootstrap': True, 'criterion': 'squared_error'}. Best is trial 1025 with value: 0.41844370194907604.
[I 2024-12-04 15:31:54,714] Trial 1819 finished with value: 0.4649983102121632 and parameters: {'n_estimators': 752, 'max_depth': 27, 'min_samples_split': 2, 'min_samples_leaf': 2, 'max_features': None, 'bootstrap': True, 'criterion': 'squared_error'}. Best is trial 1025 with value: 0.41844370194907604.
[I 2024-12-04 15:31:55,591] Trial 1815 finished with value: 0.4647522931319257 and parameters: {'n_estimators': 730, 'max_depth': 31, 'min_samples_split': 2, 'min_samples_leaf': 2, 'max_features': None, 'bootstrap': True, 'criterion': 'squared_error'}. Best is trial 1025 with value: 0.41844370194907604.
[I 2024-12-04 15:31:57,722] Trial 1824 finished with value: 0.5196424631918166 and parameters: {'n_estimators': 713, 'max_depth': 41, 'min_samples_split': 4, 'min_samples_leaf': 1, 'max_features': 'sqrt', 'bootstrap': True, 'criterion': 'squared_error'}. Best is trial 1025 with value: 0.41844370194907604.
[I 2024-12-04 15:32:01,703] Trial 1831 finished with value: 0.8374740007473782 and parameters: {'n_estimators': 453, 'max_depth': 20, 'min_samples_split': 3, 'min_samples_leaf': 5, 'max_features': 'sqrt', 'bootstrap': False, 'criterion': 'squared_error'}. Best is trial 1025 with value: 0.41844370194907604.
[I 2024-12-04 15:32:02,921] Trial 1812 finished with value: 0.42133783786502577 and parameters: {'n_estimators': 774, 'max_depth': 42, 'min_samples_split': 2, 'min_samples_leaf': 1, 'max_features': None, 'bootstrap': True, 'criterion': 'squared_error'}. Best is trial 1025 with value: 0.41844370194907604.
[I 2024-12-04 15:32:08,268] Trial 1816 finished with value: 0.42130493592460694 and parameters: {'n_estimators': 837, 'max_depth': 35, 'min_samples_split': 2, 'min_samples_leaf': 1, 'max_features': None, 'bootstrap': True, 'criterion': 'squared_error'}. Best is trial 1025 with value: 0.41844370194907604.
[I 2024-12-04 15:32:08,525] Trial 1823 finished with value: 0.4647851156808412 and parameters: {'n_estimators': 730, 'max_depth': 39, 'min_samples_split': 4, 'min_samples_leaf': 2, 'max_features': None, 'bootstrap': True, 'criterion': 'squared_error'}. Best is trial 1025 with value: 0.41844370194907604.
[I 2024-12-04 15:32:08,538] Trial 1821 finished with value: 0.4308268114508215 and parameters: {'n_estimators': 887, 'max_depth': 21, 'min_samples_split': 2, 'min_samples_leaf': 1, 'max_features': None, 'bootstrap': True, 'criterion': 'squared_error'}. Best is trial 1025 with value: 0.41844370194907604.
[I 2024-12-04 15:32:10,221] Trial 1832 finished with value: 0.735715122992756 and parameters: {'n_estimators': 622, 'max_depth': 6, 'min_samples_split': 8, 'min_samples_leaf': 2, 'max_features': None, 'bootstrap': False, 'criterion': 'squared_error'}. Best is trial 1025 with value: 0.41844370194907604.
[I 2024-12-04 15:32:10,243] Trial 1818 finished with value: 0.42041718309149395 and parameters: {'n_estimators': 840, 'max_depth': 36, 'min_samples_split': 2, 'min_samples_leaf': 1, 'max_features': None, 'bootstrap': True, 'criterion': 'squared_error'}. Best is trial 1025 with value: 0.41844370194907604.
[I 2024-12-04 15:32:11,406] Trial 1820 finished with value: 0.42202419378804734 and parameters: {'n_estimators': 817, 'max_depth': 46, 'min_samples_split': 2, 'min_samples_leaf': 1, 'max_features': None, 'bootstrap': True, 'criterion': 'squared_error'}. Best is trial 1025 with value: 0.41844370194907604.
[I 2024-12-04 15:32:16,472] Trial 1822 finished with value: 0.4195663195713334 and parameters: {'n_estimators': 782, 'max_depth': 39, 'min_samples_split': 2, 'min_samples_leaf': 1, 'max_features': None, 'bootstrap': True, 'criterion': 'squared_error'}. Best is trial 1025 with value: 0.41844370194907604.
[I 2024-12-04 15:32:18,479] Trial 1825 finished with value: 0.4654455613359904 and parameters: {'n_estimators': 832, 'max_depth': 42, 'min_samples_split': 2, 'min_samples_leaf': 2, 'max_features': None, 'bootstrap': True, 'criterion': 'squared_error'}. Best is trial 1025 with value: 0.41844370194907604.
[I 2024-12-04 15:32:20,258] Trial 1827 finished with value: 0.42164594057715515 and parameters: {'n_estimators': 748, 'max_depth': 42, 'min_samples_split': 2, 'min_samples_leaf': 1, 'max_features': None, 'bootstrap': True, 'criterion': 'squared_error'}. Best is trial 1025 with value: 0.41844370194907604.
[I 2024-12-04 15:32:22,722] Trial 1841 finished with value: 0.879484359646226 and parameters: {'n_estimators': 219, 'max_depth': 15, 'min_samples_split': 5, 'min_samples_leaf': 1, 'max_features': 'log2', 'bootstrap': False, 'criterion': 'squared_error'}. Best is trial 1025 with value: 0.41844370194907604.
[I 2024-12-04 15:32:24,913] Trial 1800 finished with value: 0.5680687586361373 and parameters: {'n_estimators': 781, 'max_depth': 10, 'min_samples_split': 5, 'min_samples_leaf': 1, 'max_features': None, 'bootstrap': True, 'criterion': 'absolute_error'}. Best is trial 1025 with value: 0.41844370194907604.
[I 2024-12-04 15:32:26,263] Trial 1834 finished with value: 0.43185066491775875 and parameters: {'n_estimators': 626, 'max_depth': 37, 'min_samples_split': 4, 'min_samples_leaf': 1, 'max_features': None, 'bootstrap': True, 'criterion': 'squared_error'}. Best is trial 1025 with value: 0.41844370194907604.
[I 2024-12-04 15:32:26,352] Trial 1826 finished with value: 0.43120747506314444 and parameters: {'n_estimators': 841, 'max_depth': 41, 'min_samples_split': 4, 'min_samples_leaf': 1, 'max_features': None, 'bootstrap': True, 'criterion': 'squared_error'}. Best is trial 1025 with value: 0.41844370194907604.
[I 2024-12-04 15:32:26,693] Trial 1829 finished with value: 0.41918240132289275 and parameters: {'n_estimators': 605, 'max_depth': 41, 'min_samples_split': 2, 'min_samples_leaf': 1, 'max_features': None, 'bootstrap': True, 'criterion': 'squared_error'}. Best is trial 1025 with value: 0.41844370194907604.
[I 2024-12-04 15:32:28,167] Trial 1830 finished with value: 0.46505321411967027 and parameters: {'n_estimators': 856, 'max_depth': 37, 'min_samples_split': 3, 'min_samples_leaf': 2, 'max_features': None, 'bootstrap': True, 'criterion': 'squared_error'}. Best is trial 1025 with value: 0.41844370194907604.
[I 2024-12-04 15:32:29,991] Trial 1788 finished with value: 0.4293299645082588 and parameters: {'n_estimators': 756, 'max_depth': 43, 'min_samples_split': 2, 'min_samples_leaf': 1, 'max_features': None, 'bootstrap': True, 'criterion': 'absolute_error'}. Best is trial 1025 with value: 0.41844370194907604.
[I 2024-12-04 15:32:34,243] Trial 1833 finished with value: 0.42069704016719933 and parameters: {'n_estimators': 812, 'max_depth': 43, 'min_samples_split': 2, 'min_samples_leaf': 1, 'max_features': None, 'bootstrap': True, 'criterion': 'squared_error'}. Best is trial 1025 with value: 0.41844370194907604.
[I 2024-12-04 15:32:34,886] Trial 1838 finished with value: 0.4645111505617091 and parameters: {'n_estimators': 623, 'max_depth': 38, 'min_samples_split': 2, 'min_samples_leaf': 2, 'max_features': None, 'bootstrap': True, 'criterion': 'squared_error'}. Best is trial 1025 with value: 0.41844370194907604.
[I 2024-12-04 15:32:36,294] Trial 1840 finished with value: 0.6896189233534732 and parameters: {'n_estimators': 420, 'max_depth': 41, 'min_samples_split': 26, 'min_samples_leaf': 6, 'max_features': None, 'bootstrap': False, 'criterion': 'absolute_error'}. Best is trial 1025 with value: 0.41844370194907604.
[I 2024-12-04 15:32:40,262] Trial 1828 finished with value: 0.4202261635741316 and parameters: {'n_estimators': 786, 'max_depth': 38, 'min_samples_split': 2, 'min_samples_leaf': 1, 'max_features': None, 'bootstrap': True, 'criterion': 'squared_error'}. Best is trial 1025 with value: 0.41844370194907604.
[I 2024-12-04 15:32:43,262] Trial 1837 finished with value: 0.4651057043939824 and parameters: {'n_estimators': 852, 'max_depth': 43, 'min_samples_split': 2, 'min_samples_leaf': 2, 'max_features': None, 'bootstrap': True, 'criterion': 'squared_error'}. Best is trial 1025 with value: 0.41844370194907604.
[I 2024-12-04 15:32:46,315] Trial 1835 finished with value: 0.4319620567987929 and parameters: {'n_estimators': 791, 'max_depth': 35, 'min_samples_split': 4, 'min_samples_leaf': 1, 'max_features': None, 'bootstrap': True, 'criterion': 'squared_error'}. Best is trial 1025 with value: 0.41844370194907604.
[I 2024-12-04 15:32:46,378] Trial 1846 finished with value: 0.45597338374525925 and parameters: {'n_estimators': 492, 'max_depth': 37, 'min_samples_split': 16, 'min_samples_leaf': 1, 'max_features': None, 'bootstrap': True, 'criterion': 'squared_error'}. Best is trial 1025 with value: 0.41844370194907604.
[I 2024-12-04 15:32:47,359] Trial 1843 finished with value: 0.5275195704830024 and parameters: {'n_estimators': 830, 'max_depth': 39, 'min_samples_split': 2, 'min_samples_leaf': 1, 'max_features': None, 'bootstrap': False, 'criterion': 'squared_error'}. Best is trial 1025 with value: 0.41844370194907604.
[I 2024-12-04 15:32:48,085] Trial 1848 finished with value: 0.6731118751034179 and parameters: {'n_estimators': 968, 'max_depth': 20, 'min_samples_split': 7, 'min_samples_leaf': 1, 'max_features': 'sqrt', 'bootstrap': True, 'criterion': 'squared_error'}. Best is trial 1025 with value: 0.41844370194907604.
[I 2024-12-04 15:32:50,150] Trial 1839 finished with value: 0.4193421511268708 and parameters: {'n_estimators': 760, 'max_depth': 41, 'min_samples_split': 2, 'min_samples_leaf': 1, 'max_features': None, 'bootstrap': True, 'criterion': 'squared_error'}. Best is trial 1025 with value: 0.41844370194907604.
[I 2024-12-04 15:32:51,219] Trial 1842 finished with value: 0.5542372976187888 and parameters: {'n_estimators': 164, 'max_depth': 33, 'min_samples_split': 2, 'min_samples_leaf': 1, 'max_features': None, 'bootstrap': False, 'criterion': 'absolute_error'}. Best is trial 1025 with value: 0.41844370194907604.
[I 2024-12-04 15:32:52,049] Trial 1845 finished with value: 0.465195428883066 and parameters: {'n_estimators': 776, 'max_depth': 38, 'min_samples_split': 2, 'min_samples_leaf': 2, 'max_features': None, 'bootstrap': True, 'criterion': 'squared_error'}. Best is trial 1025 with value: 0.41844370194907604.
[I 2024-12-04 15:32:52,057] Trial 1836 finished with value: 0.41893884278516585 and parameters: {'n_estimators': 837, 'max_depth': 40, 'min_samples_split': 2, 'min_samples_leaf': 1, 'max_features': None, 'bootstrap': True, 'criterion': 'squared_error'}. Best is trial 1025 with value: 0.41844370194907604.
[I 2024-12-04 15:32:52,115] Trial 1857 finished with value: 1.0313756795640108 and parameters: {'n_estimators': 480, 'max_depth': 39, 'min_samples_split': 7, 'min_samples_leaf': 5, 'max_features': 'log2', 'bootstrap': False, 'criterion': 'absolute_error'}. Best is trial 1025 with value: 0.41844370194907604.
[I 2024-12-04 15:32:52,768] Trial 1844 finished with value: 0.42484799131197953 and parameters: {'n_estimators': 819, 'max_depth': 46, 'min_samples_split': 3, 'min_samples_leaf': 1, 'max_features': None, 'bootstrap': True, 'criterion': 'squared_error'}. Best is trial 1025 with value: 0.41844370194907604.
[I 2024-12-04 15:32:52,841] Trial 1784 finished with value: 0.5827821009435581 and parameters: {'n_estimators': 802, 'max_depth': 42, 'min_samples_split': 13, 'min_samples_leaf': 1, 'max_features': None, 'bootstrap': False, 'criterion': 'absolute_error'}. Best is trial 1025 with value: 0.41844370194907604.
[I 2024-12-04 15:32:53,944] Trial 1853 finished with value: 0.4323647774482707 and parameters: {'n_estimators': 636, 'max_depth': 43, 'min_samples_split': 4, 'min_samples_leaf': 1, 'max_features': None, 'bootstrap': True, 'criterion': 'squared_error'}. Best is trial 1025 with value: 0.41844370194907604.
[I 2024-12-04 15:32:54,169] Trial 1852 finished with value: 1.022566528145547 and parameters: {'n_estimators': 558, 'max_depth': 5, 'min_samples_split': 5, 'min_samples_leaf': 3, 'max_features': 'log2', 'bootstrap': False, 'criterion': 'absolute_error'}. Best is trial 1025 with value: 0.41844370194907604.
[I 2024-12-04 15:32:54,778] Trial 1861 finished with value: 1.0606011483660875 and parameters: {'n_estimators': 577, 'max_depth': 32, 'min_samples_split': 2, 'min_samples_leaf': 6, 'max_features': 'log2', 'bootstrap': True, 'criterion': 'squared_error'}. Best is trial 1025 with value: 0.41844370194907604.
[I 2024-12-04 15:32:55,363] Trial 1856 finished with value: 0.9571005469227618 and parameters: {'n_estimators': 657, 'max_depth': 5, 'min_samples_split': 4, 'min_samples_leaf': 2, 'max_features': 'sqrt', 'bootstrap': False, 'criterion': 'absolute_error'}. Best is trial 1025 with value: 0.41844370194907604.
[I 2024-12-04 15:32:55,666] Trial 1851 finished with value: 0.4249477208231272 and parameters: {'n_estimators': 800, 'max_depth': 32, 'min_samples_split': 3, 'min_samples_leaf': 1, 'max_features': None, 'bootstrap': True, 'criterion': 'squared_error'}. Best is trial 1025 with value: 0.41844370194907604.
[I 2024-12-04 15:32:55,815] Trial 1850 finished with value: 0.4254229258030962 and parameters: {'n_estimators': 611, 'max_depth': 42, 'min_samples_split': 3, 'min_samples_leaf': 1, 'max_features': None, 'bootstrap': True, 'criterion': 'squared_error'}. Best is trial 1025 with value: 0.41844370194907604.
[I 2024-12-04 15:32:56,052] Trial 1849 finished with value: 0.42220816532325006 and parameters: {'n_estimators': 638, 'max_depth': 42, 'min_samples_split': 2, 'min_samples_leaf': 1, 'max_features': None, 'bootstrap': True, 'criterion': 'squared_error'}. Best is trial 1025 with value: 0.41844370194907604.
[I 2024-12-04 15:33:01,849] Trial 1847 finished with value: 0.4211170321310158 and parameters: {'n_estimators': 806, 'max_depth': 34, 'min_samples_split': 2, 'min_samples_leaf': 1, 'max_features': None, 'bootstrap': True, 'criterion': 'squared_error'}. Best is trial 1025 with value: 0.41844370194907604.
[I 2024-12-04 15:33:02,969] Trial 1858 finished with value: 0.9607224073614028 and parameters: {'n_estimators': 734, 'max_depth': 29, 'min_samples_split': 4, 'min_samples_leaf': 2, 'max_features': 'log2', 'bootstrap': True, 'criterion': 'squared_error'}. Best is trial 1025 with value: 0.41844370194907604.
[I 2024-12-04 15:33:05,827] Trial 1855 finished with value: 0.9570492146767301 and parameters: {'n_estimators': 893, 'max_depth': 40, 'min_samples_split': 2, 'min_samples_leaf': 2, 'max_features': 'log2', 'bootstrap': True, 'criterion': 'squared_error'}. Best is trial 1025 with value: 0.41844370194907604.
[I 2024-12-04 15:33:05,984] Trial 1863 finished with value: 0.42381490836927954 and parameters: {'n_estimators': 624, 'max_depth': 30, 'min_samples_split': 2, 'min_samples_leaf': 1, 'max_features': None, 'bootstrap': True, 'criterion': 'squared_error'}. Best is trial 1025 with value: 0.41844370194907604.
[I 2024-12-04 15:33:06,697] Trial 1860 finished with value: 0.42357668106912894 and parameters: {'n_estimators': 832, 'max_depth': 40, 'min_samples_split': 3, 'min_samples_leaf': 1, 'max_features': None, 'bootstrap': True, 'criterion': 'squared_error'}. Best is trial 1025 with value: 0.41844370194907604.
[I 2024-12-04 15:33:07,293] Trial 1859 finished with value: 0.4315894153198862 and parameters: {'n_estimators': 818, 'max_depth': 41, 'min_samples_split': 4, 'min_samples_leaf': 1, 'max_features': None, 'bootstrap': True, 'criterion': 'squared_error'}. Best is trial 1025 with value: 0.41844370194907604.
