[I 2024-12-04 12:05:00,486] Trial 2065 finished with value: 0.7188087833617175 and parameters: {'max_depth': 31, 'min_samples_split': 5, 'min_samples_leaf': 1, 'max_features': 'sqrt', 'criterion': 'absolute_error', 'splitter': 'best'}. Best is trial 309 with value: 0.46729638362398634.
[I 2024-12-04 12:05:00,624] Trial 2074 finished with value: 0.5680194359354153 and parameters: {'max_depth': 34, 'min_samples_split': 2, 'min_samples_leaf': 1, 'max_features': 'sqrt', 'criterion': 'absolute_error', 'splitter': 'best'}. Best is trial 309 with value: 0.46729638362398634.
[I 2024-12-04 12:05:00,724] Trial 2062 finished with value: 0.46729638362398634 and parameters: {'max_depth': 31, 'min_samples_split': 2, 'min_samples_leaf': 1, 'max_features': 'sqrt', 'criterion': 'absolute_error', 'splitter': 'best'}. Best is trial 309 with value: 0.46729638362398634.
[I 2024-12-04 12:05:01,402] Trial 2068 finished with value: 0.5680194359354153 and parameters: {'max_depth': 34, 'min_samples_split': 2, 'min_samples_leaf': 1, 'max_features': 'sqrt', 'criterion': 'absolute_error', 'splitter': 'best'}. Best is trial 309 with value: 0.46729638362398634.
[I 2024-12-04 12:05:01,714] Trial 2066 finished with value: 1.0479797941399644 and parameters: {'max_depth': 26, 'min_samples_split': 2, 'min_samples_leaf': 1, 'max_features': 'sqrt', 'criterion': 'absolute_error', 'splitter': 'best'}. Best is trial 309 with value: 0.46729638362398634.
[I 2024-12-04 12:05:01,956] Trial 2069 finished with value: 0.46729638362398634 and parameters: {'max_depth': 31, 'min_samples_split': 2, 'min_samples_leaf': 1, 'max_features': 'sqrt', 'criterion': 'absolute_error', 'splitter': 'best'}. Best is trial 309 with value: 0.46729638362398634.
[I 2024-12-04 12:05:02,032] Trial 2048 finished with value: 0.5380234000646094 and parameters: {'max_depth': 30, 'min_samples_split': 2, 'min_samples_leaf': 1, 'max_features': 'sqrt', 'criterion': 'absolute_error', 'splitter': 'best'}. Best is trial 309 with value: 0.46729638362398634.
[I 2024-12-04 12:05:02,039] Trial 2071 finished with value: 1.0235080961846112 and parameters: {'max_depth': 25, 'min_samples_split': 2, 'min_samples_leaf': 1, 'max_features': 'sqrt', 'criterion': 'absolute_error', 'splitter': 'best'}. Best is trial 309 with value: 0.46729638362398634.
[I 2024-12-04 12:05:02,177] Trial 2067 finished with value: 1.107575270643249 and parameters: {'max_depth': 31, 'min_samples_split': 5, 'min_samples_leaf': 2, 'max_features': 'sqrt', 'criterion': 'absolute_error', 'splitter': 'best'}. Best is trial 309 with value: 0.46729638362398634.
[I 2024-12-04 12:05:02,709] Trial 2078 finished with value: 0.5222024842783579 and parameters: {'max_depth': 35, 'min_samples_split': 2, 'min_samples_leaf': 1, 'max_features': 'sqrt', 'criterion': 'absolute_error', 'splitter': 'best'}. Best is trial 309 with value: 0.46729638362398634.
[I 2024-12-04 12:05:02,717] Trial 2061 finished with value: 1.111707684217243 and parameters: {'max_depth': 24, 'min_samples_split': 5, 'min_samples_leaf': 2, 'max_features': 'sqrt', 'criterion': 'absolute_error', 'splitter': 'best'}. Best is trial 309 with value: 0.46729638362398634.
[I 2024-12-04 12:05:03,167] Trial 2080 finished with value: 0.8666968382247049 and parameters: {'max_depth': 35, 'min_samples_split': 2, 'min_samples_leaf': 3, 'max_features': 'sqrt', 'criterion': 'absolute_error', 'splitter': 'best'}. Best is trial 309 with value: 0.46729638362398634.
[I 2024-12-04 12:05:03,371] Trial 2064 finished with value: 1.0894525583560912 and parameters: {'max_depth': 35, 'min_samples_split': 2, 'min_samples_leaf': 2, 'max_features': 'sqrt', 'criterion': 'absolute_error', 'splitter': 'best'}. Best is trial 309 with value: 0.46729638362398634.
[I 2024-12-04 12:05:05,013] Trial 2081 finished with value: 1.3130149982826922 and parameters: {'max_depth': 1, 'min_samples_split': 19, 'min_samples_leaf': 1, 'max_features': 'sqrt', 'criterion': 'squared_error', 'splitter': 'random'}. Best is trial 309 with value: 0.46729638362398634.
[I 2024-12-04 12:05:05,017] Trial 2079 finished with value: 1.009355341748503 and parameters: {'max_depth': 29, 'min_samples_split': 5, 'min_samples_leaf': 2, 'max_features': 'log2', 'criterion': 'absolute_error', 'splitter': 'best'}. Best is trial 309 with value: 0.46729638362398634.
[I 2024-12-04 12:05:05,021] Trial 2075 finished with value: 1.3105279435582882 and parameters: {'max_depth': 27, 'min_samples_split': 17, 'min_samples_leaf': 10, 'max_features': 'sqrt', 'criterion': 'squared_error', 'splitter': 'best'}. Best is trial 309 with value: 0.46729638362398634.
[I 2024-12-04 12:05:05,032] Trial 2084 finished with value: 1.111989940503367 and parameters: {'max_depth': 29, 'min_samples_split': 5, 'min_samples_leaf': 2, 'max_features': 'sqrt', 'criterion': 'absolute_error', 'splitter': 'best'}. Best is trial 309 with value: 0.46729638362398634.
[I 2024-12-04 12:05:05,682] Trial 2070 finished with value: 0.8666968382247049 and parameters: {'max_depth': 23, 'min_samples_split': 5, 'min_samples_leaf': 3, 'max_features': 'sqrt', 'criterion': 'absolute_error', 'splitter': 'best'}. Best is trial 309 with value: 0.46729638362398634.
[I 2024-12-04 12:05:05,822] Trial 2083 finished with value: 0.8666968382247049 and parameters: {'max_depth': 28, 'min_samples_split': 2, 'min_samples_leaf': 3, 'max_features': 'sqrt', 'criterion': 'absolute_error', 'splitter': 'best'}. Best is trial 309 with value: 0.46729638362398634.
[I 2024-12-04 12:05:06,242] Trial 2055 finished with value: 1.0654889095182796 and parameters: {'max_depth': 23, 'min_samples_split': 5, 'min_samples_leaf': 2, 'max_features': 'sqrt', 'criterion': 'absolute_error', 'splitter': 'best'}. Best is trial 309 with value: 0.46729638362398634.
[I 2024-12-04 12:05:06,644] Trial 2076 finished with value: 0.7188087833617175 and parameters: {'max_depth': 31, 'min_samples_split': 5, 'min_samples_leaf': 1, 'max_features': 'sqrt', 'criterion': 'absolute_error', 'splitter': 'best'}. Best is trial 309 with value: 0.46729638362398634.
[I 2024-12-04 12:05:06,647] Trial 2077 finished with value: 1.1183076970096313 and parameters: {'max_depth': 29, 'min_samples_split': 2, 'min_samples_leaf': 2, 'max_features': 'sqrt', 'criterion': 'absolute_error', 'splitter': 'best'}. Best is trial 309 with value: 0.46729638362398634.
[I 2024-12-04 12:05:06,824] Trial 2086 finished with value: 0.9391413480553363 and parameters: {'max_depth': 28, 'min_samples_split': 2, 'min_samples_leaf': 1, 'max_features': 'sqrt', 'criterion': 'absolute_error', 'splitter': 'best'}. Best is trial 309 with value: 0.46729638362398634.
[I 2024-12-04 12:05:08,744] Trial 2092 finished with value: 0.7238455884864453 and parameters: {'max_depth': 35, 'min_samples_split': 5, 'min_samples_leaf': 1, 'max_features': 'sqrt', 'criterion': 'absolute_error', 'splitter': 'best'}. Best is trial 309 with value: 0.46729638362398634.
[I 2024-12-04 12:05:08,754] Trial 2085 finished with value: 0.7188087833617175 and parameters: {'max_depth': 31, 'min_samples_split': 5, 'min_samples_leaf': 1, 'max_features': 'sqrt', 'criterion': 'absolute_error', 'splitter': 'best'}. Best is trial 309 with value: 0.46729638362398634.
[I 2024-12-04 12:05:09,257] Trial 2087 finished with value: 0.5209986636170143 and parameters: {'max_depth': 29, 'min_samples_split': 2, 'min_samples_leaf': 1, 'max_features': 'sqrt', 'criterion': 'absolute_error', 'splitter': 'best'}. Best is trial 309 with value: 0.46729638362398634.
[I 2024-12-04 12:05:09,552] Trial 2093 finished with value: 1.3591855934222943 and parameters: {'max_depth': 2, 'min_samples_split': 16, 'min_samples_leaf': 6, 'max_features': 'sqrt', 'criterion': 'absolute_error', 'splitter': 'best'}. Best is trial 309 with value: 0.46729638362398634.
[I 2024-12-04 12:05:09,554] Trial 2082 finished with value: 0.5222024842783579 and parameters: {'max_depth': 35, 'min_samples_split': 2, 'min_samples_leaf': 1, 'max_features': 'sqrt', 'criterion': 'absolute_error', 'splitter': 'best'}. Best is trial 309 with value: 0.46729638362398634.
[I 2024-12-04 12:05:11,481] Trial 2088 finished with value: 0.9391413480553363 and parameters: {'max_depth': 28, 'min_samples_split': 2, 'min_samples_leaf': 1, 'max_features': 'sqrt', 'criterion': 'absolute_error', 'splitter': 'best'}. Best is trial 309 with value: 0.46729638362398634.
[I 2024-12-04 12:05:12,203] Trial 2097 finished with value: 1.1183076970096313 and parameters: {'max_depth': 29, 'min_samples_split': 2, 'min_samples_leaf': 2, 'max_features': 'sqrt', 'criterion': 'absolute_error', 'splitter': 'best'}. Best is trial 309 with value: 0.46729638362398634.
[I 2024-12-04 12:05:12,952] Trial 2091 finished with value: 0.6050209057105678 and parameters: {'max_depth': 29, 'min_samples_split': 5, 'min_samples_leaf': 1, 'max_features': 'sqrt', 'criterion': 'absolute_error', 'splitter': 'best'}. Best is trial 309 with value: 0.46729638362398634.
[I 2024-12-04 12:05:13,285] Trial 2102 finished with value: 0.6128215778007012 and parameters: {'max_depth': 30, 'min_samples_split': 5, 'min_samples_leaf': 1, 'max_features': 'sqrt', 'criterion': 'absolute_error', 'splitter': 'best'}. Best is trial 309 with value: 0.46729638362398634.
[I 2024-12-04 12:05:13,529] Trial 2090 finished with value: 1.3014693347727373 and parameters: {'max_depth': 5, 'min_samples_split': 20, 'min_samples_leaf': 10, 'max_features': 'log2', 'criterion': 'friedman_mse', 'splitter': 'random'}. Best is trial 309 with value: 0.46729638362398634.
[I 2024-12-04 12:05:13,831] Trial 2089 finished with value: 0.8666968382247049 and parameters: {'max_depth': 35, 'min_samples_split': 5, 'min_samples_leaf': 3, 'max_features': 'sqrt', 'criterion': 'absolute_error', 'splitter': 'best'}. Best is trial 309 with value: 0.46729638362398634.
[I 2024-12-04 12:05:14,558] Trial 2094 finished with value: 1.0977389566103577 and parameters: {'max_depth': 30, 'min_samples_split': 2, 'min_samples_leaf': 2, 'max_features': 'sqrt', 'criterion': 'absolute_error', 'splitter': 'best'}. Best is trial 309 with value: 0.46729638362398634.
[I 2024-12-04 12:05:15,031] Trial 2098 finished with value: 0.8666968382247049 and parameters: {'max_depth': 26, 'min_samples_split': 2, 'min_samples_leaf': 3, 'max_features': 'sqrt', 'criterion': 'absolute_error', 'splitter': 'best'}. Best is trial 309 with value: 0.46729638362398634.
[I 2024-12-04 12:05:15,514] Trial 2107 finished with value: 0.7698922830511513 and parameters: {'max_depth': 26, 'min_samples_split': 5, 'min_samples_leaf': 1, 'max_features': 'sqrt', 'criterion': 'absolute_error', 'splitter': 'best'}. Best is trial 309 with value: 0.46729638362398634.
[I 2024-12-04 12:05:16,065] Trial 2111 finished with value: 1.0894525583560912 and parameters: {'max_depth': 35, 'min_samples_split': 2, 'min_samples_leaf': 2, 'max_features': 'sqrt', 'criterion': 'absolute_error', 'splitter': 'best'}. Best is trial 309 with value: 0.46729638362398634.
[I 2024-12-04 12:05:16,068] Trial 2106 finished with value: 0.8666968382247049 and parameters: {'max_depth': 31, 'min_samples_split': 5, 'min_samples_leaf': 3, 'max_features': 'sqrt', 'criterion': 'absolute_error', 'splitter': 'best'}. Best is trial 309 with value: 0.46729638362398634.
[I 2024-12-04 12:05:16,326] Trial 2103 finished with value: 0.5380234000646094 and parameters: {'max_depth': 30, 'min_samples_split': 2, 'min_samples_leaf': 1, 'max_features': 'sqrt', 'criterion': 'absolute_error', 'splitter': 'best'}. Best is trial 309 with value: 0.46729638362398634.
[I 2024-12-04 12:05:16,657] Trial 2095 finished with value: 1.0235080961846112 and parameters: {'max_depth': 25, 'min_samples_split': 2, 'min_samples_leaf': 1, 'max_features': 'sqrt', 'criterion': 'absolute_error', 'splitter': 'best'}. Best is trial 309 with value: 0.46729638362398634.
[I 2024-12-04 12:05:16,691] Trial 2101 finished with value: 1.303033894503269 and parameters: {'max_depth': 35, 'min_samples_split': 2, 'min_samples_leaf': 3, 'max_features': 'sqrt', 'criterion': 'absolute_error', 'splitter': 'random'}. Best is trial 309 with value: 0.46729638362398634.
[I 2024-12-04 12:05:17,536] Trial 2117 finished with value: 1.3007745979739842 and parameters: {'max_depth': 23, 'min_samples_split': 2, 'min_samples_leaf': 8, 'max_features': 'log2', 'criterion': 'friedman_mse', 'splitter': 'best'}. Best is trial 309 with value: 0.46729638362398634.
[I 2024-12-04 12:05:17,816] Trial 2109 finished with value: 1.0081785092902962 and parameters: {'max_depth': 27, 'min_samples_split': 2, 'min_samples_leaf': 1, 'max_features': 'sqrt', 'criterion': 'absolute_error', 'splitter': 'best'}. Best is trial 309 with value: 0.46729638362398634.
[I 2024-12-04 12:05:18,630] Trial 2099 finished with value: 0.5914449057625799 and parameters: {'max_depth': 21, 'min_samples_split': 2, 'min_samples_leaf': 1, 'max_features': 'sqrt', 'criterion': 'squared_error', 'splitter': 'best'}. Best is trial 309 with value: 0.46729638362398634.
[I 2024-12-04 12:05:19,818] Trial 2118 finished with value: 0.5907229439202928 and parameters: {'max_depth': 24, 'min_samples_split': 5, 'min_samples_leaf': 1, 'max_features': 'sqrt', 'criterion': 'absolute_error', 'splitter': 'best'}. Best is trial 309 with value: 0.46729638362398634.
[I 2024-12-04 12:05:20,018] Trial 2115 finished with value: 0.7238455884864453 and parameters: {'max_depth': 35, 'min_samples_split': 5, 'min_samples_leaf': 1, 'max_features': 'sqrt', 'criterion': 'absolute_error', 'splitter': 'best'}. Best is trial 309 with value: 0.46729638362398634.
[I 2024-12-04 12:05:20,344] Trial 2096 finished with value: 0.46729638362398634 and parameters: {'max_depth': 31, 'min_samples_split': 2, 'min_samples_leaf': 1, 'max_features': 'sqrt', 'criterion': 'absolute_error', 'splitter': 'best'}. Best is trial 309 with value: 0.46729638362398634.
[I 2024-12-04 12:05:20,522] Trial 2119 finished with value: 0.9391413480553363 and parameters: {'max_depth': 28, 'min_samples_split': 2, 'min_samples_leaf': 1, 'max_features': 'sqrt', 'criterion': 'absolute_error', 'splitter': 'best'}. Best is trial 309 with value: 0.46729638362398634.
[I 2024-12-04 12:05:21,345] Trial 2104 finished with value: 0.6128215778007012 and parameters: {'max_depth': 30, 'min_samples_split': 5, 'min_samples_leaf': 1, 'max_features': 'sqrt', 'criterion': 'absolute_error', 'splitter': 'best'}. Best is trial 309 with value: 0.46729638362398634.
[I 2024-12-04 12:05:21,346] Trial 2114 finished with value: 1.1280756880674372 and parameters: {'max_depth': 29, 'min_samples_split': 9, 'min_samples_leaf': 2, 'max_features': 'sqrt', 'criterion': 'absolute_error', 'splitter': 'best'}. Best is trial 309 with value: 0.46729638362398634.
[I 2024-12-04 12:05:21,720] Trial 2116 finished with value: 1.0201410606892172 and parameters: {'max_depth': 32, 'min_samples_split': 2, 'min_samples_leaf': 3, 'max_features': 'log2', 'criterion': 'absolute_error', 'splitter': 'best'}. Best is trial 309 with value: 0.46729638362398634.
[I 2024-12-04 12:05:22,143] Trial 2105 finished with value: 0.8666968382247049 and parameters: {'max_depth': 30, 'min_samples_split': 2, 'min_samples_leaf': 3, 'max_features': 'sqrt', 'criterion': 'absolute_error', 'splitter': 'best'}. Best is trial 309 with value: 0.46729638362398634.
[I 2024-12-04 12:05:22,753] Trial 2120 finished with value: 1.2964780731118999 and parameters: {'max_depth': 2, 'min_samples_split': 13, 'min_samples_leaf': 1, 'max_features': 'log2', 'criterion': 'friedman_mse', 'splitter': 'random'}. Best is trial 309 with value: 0.46729638362398634.
[I 2024-12-04 12:05:22,952] Trial 2100 finished with value: 0.5266640698896663 and parameters: {'max_depth': 32, 'min_samples_split': 2, 'min_samples_leaf': 1, 'max_features': 'sqrt', 'criterion': 'absolute_error', 'splitter': 'best'}. Best is trial 309 with value: 0.46729638362398634.
[I 2024-12-04 12:05:23,525] Trial 2108 finished with value: 0.5620446269911709 and parameters: {'max_depth': 28, 'min_samples_split': 5, 'min_samples_leaf': 1, 'max_features': 'sqrt', 'criterion': 'friedman_mse', 'splitter': 'best'}. Best is trial 309 with value: 0.46729638362398634.
[I 2024-12-04 12:05:24,094] Trial 2121 finished with value: 0.5222024842783579 and parameters: {'max_depth': 35, 'min_samples_split': 2, 'min_samples_leaf': 1, 'max_features': 'sqrt', 'criterion': 'absolute_error', 'splitter': 'best'}. Best is trial 309 with value: 0.46729638362398634.
[I 2024-12-04 12:05:24,333] Trial 2110 finished with value: 0.8666968382247049 and parameters: {'max_depth': 31, 'min_samples_split': 2, 'min_samples_leaf': 3, 'max_features': 'sqrt', 'criterion': 'absolute_error', 'splitter': 'best'}. Best is trial 309 with value: 0.46729638362398634.
[I 2024-12-04 12:05:24,334] Trial 2113 finished with value: 1.1057983852989977 and parameters: {'max_depth': 30, 'min_samples_split': 5, 'min_samples_leaf': 2, 'max_features': 'sqrt', 'criterion': 'absolute_error', 'splitter': 'best'}. Best is trial 309 with value: 0.46729638362398634.
[I 2024-12-04 12:05:25,099] Trial 2129 finished with value: 1.1183076970096313 and parameters: {'max_depth': 29, 'min_samples_split': 2, 'min_samples_leaf': 2, 'max_features': 'sqrt', 'criterion': 'absolute_error', 'splitter': 'best'}. Best is trial 309 with value: 0.46729638362398634.
[I 2024-12-04 12:05:26,141] Trial 2122 finished with value: 0.8666968382247049 and parameters: {'max_depth': 28, 'min_samples_split': 5, 'min_samples_leaf': 3, 'max_features': 'sqrt', 'criterion': 'absolute_error', 'splitter': 'best'}. Best is trial 309 with value: 0.46729638362398634.
[I 2024-12-04 12:05:26,629] Trial 2128 finished with value: 0.6242410834238855 and parameters: {'max_depth': 27, 'min_samples_split': 5, 'min_samples_leaf': 1, 'max_features': 'sqrt', 'criterion': 'absolute_error', 'splitter': 'best'}. Best is trial 309 with value: 0.46729638362398634.
[I 2024-12-04 12:05:26,907] Trial 2123 finished with value: 1.066041238602433 and parameters: {'max_depth': 20, 'min_samples_split': 2, 'min_samples_leaf': 1, 'max_features': 'sqrt', 'criterion': 'absolute_error', 'splitter': 'best'}. Best is trial 309 with value: 0.46729638362398634.
[I 2024-12-04 12:05:26,930] Trial 2125 finished with value: 0.5380234000646094 and parameters: {'max_depth': 30, 'min_samples_split': 2, 'min_samples_leaf': 1, 'max_features': 'sqrt', 'criterion': 'absolute_error', 'splitter': 'best'}. Best is trial 309 with value: 0.46729638362398634.
[I 2024-12-04 12:05:27,022] Trial 2124 finished with value: 1.303033894503269 and parameters: {'max_depth': 30, 'min_samples_split': 6, 'min_samples_leaf': 3, 'max_features': 'sqrt', 'criterion': 'absolute_error', 'splitter': 'random'}. Best is trial 309 with value: 0.46729638362398634.
[I 2024-12-04 12:05:27,221] Trial 2126 finished with value: 0.5209986636170143 and parameters: {'max_depth': 29, 'min_samples_split': 2, 'min_samples_leaf': 1, 'max_features': 'sqrt', 'criterion': 'absolute_error', 'splitter': 'best'}. Best is trial 309 with value: 0.46729638362398634.
[I 2024-12-04 12:05:28,037] Trial 2133 finished with value: 0.6242410834238855 and parameters: {'max_depth': 27, 'min_samples_split': 5, 'min_samples_leaf': 1, 'max_features': 'sqrt', 'criterion': 'absolute_error', 'splitter': 'best'}. Best is trial 309 with value: 0.46729638362398634.
[I 2024-12-04 12:05:29,344] Trial 2136 finished with value: 0.5202341974932455 and parameters: {'max_depth': 30, 'min_samples_split': 2, 'min_samples_leaf': 1, 'max_features': 'log2', 'criterion': 'absolute_error', 'splitter': 'best'}. Best is trial 309 with value: 0.46729638362398634.
[I 2024-12-04 12:05:29,351] Trial 2112 finished with value: 0.8666968382247049 and parameters: {'max_depth': 21, 'min_samples_split': 2, 'min_samples_leaf': 3, 'max_features': 'sqrt', 'criterion': 'absolute_error', 'splitter': 'best'}. Best is trial 309 with value: 0.46729638362398634.
[I 2024-12-04 12:05:29,582] Trial 2130 finished with value: 0.46729638362398634 and parameters: {'max_depth': 31, 'min_samples_split': 2, 'min_samples_leaf': 1, 'max_features': 'sqrt', 'criterion': 'absolute_error', 'splitter': 'best'}. Best is trial 309 with value: 0.46729638362398634.
[I 2024-12-04 12:05:30,386] Trial 2139 finished with value: 0.5065208369659612 and parameters: {'max_depth': 31, 'min_samples_split': 2, 'min_samples_leaf': 1, 'max_features': 'log2', 'criterion': 'absolute_error', 'splitter': 'best'}. Best is trial 309 with value: 0.46729638362398634.
[I 2024-12-04 12:05:30,864] Trial 2131 finished with value: 1.107575270643249 and parameters: {'max_depth': 31, 'min_samples_split': 5, 'min_samples_leaf': 2, 'max_features': 'sqrt', 'criterion': 'absolute_error', 'splitter': 'best'}. Best is trial 309 with value: 0.46729638362398634.
[I 2024-12-04 12:05:31,074] Trial 2127 finished with value: 0.8666968382247049 and parameters: {'max_depth': 31, 'min_samples_split': 4, 'min_samples_leaf': 3, 'max_features': 'sqrt', 'criterion': 'absolute_error', 'splitter': 'best'}. Best is trial 309 with value: 0.46729638362398634.
[I 2024-12-04 12:05:31,296] Trial 2137 finished with value: 1.3629276849850611 and parameters: {'max_depth': 32, 'min_samples_split': 20, 'min_samples_leaf': 9, 'max_features': 'sqrt', 'criterion': 'absolute_error', 'splitter': 'random'}. Best is trial 309 with value: 0.46729638362398634.
[I 2024-12-04 12:05:31,298] Trial 2143 finished with value: 1.1408779699500264 and parameters: {'max_depth': 33, 'min_samples_split': 2, 'min_samples_leaf': 2, 'max_features': 'sqrt', 'criterion': 'absolute_error', 'splitter': 'best'}. Best is trial 309 with value: 0.46729638362398634.
[I 2024-12-04 12:05:31,676] Trial 2135 finished with value: 0.9391413480553363 and parameters: {'max_depth': 28, 'min_samples_split': 2, 'min_samples_leaf': 1, 'max_features': 'sqrt', 'criterion': 'absolute_error', 'splitter': 'best'}. Best is trial 309 with value: 0.46729638362398634.
