[I 2024-12-04 13:07:43,623] Trial 1400 finished with value: 0.21148790127553124 and parameters: {'n_estimators': 1378, 'learning_rate': 0.0824197559998637, 'max_depth': 12, 'min_samples_split': 15, 'min_samples_leaf': 1, 'subsample': 0.662739034162176, 'max_features': 'sqrt'}. Best is trial 1137 with value: 0.19687116000636118.
[I 2024-12-04 13:07:48,357] Trial 1402 finished with value: 0.22365424141028653 and parameters: {'n_estimators': 1367, 'learning_rate': 0.07752384978463031, 'max_depth': 11, 'min_samples_split': 17, 'min_samples_leaf': 1, 'subsample': 0.6042395210465594, 'max_features': 'sqrt'}. Best is trial 1137 with value: 0.19687116000636118.
[I 2024-12-04 13:07:52,714] Trial 1401 finished with value: 0.2226689760222264 and parameters: {'n_estimators': 1458, 'learning_rate': 0.07012033152058479, 'max_depth': 12, 'min_samples_split': 16, 'min_samples_leaf': 1, 'subsample': 0.7175384434438902, 'max_features': 'sqrt'}. Best is trial 1137 with value: 0.19687116000636118.
[I 2024-12-04 13:07:57,290] Trial 1403 finished with value: 0.24212904661892315 and parameters: {'n_estimators': 1481, 'learning_rate': 0.09842416193949234, 'max_depth': 10, 'min_samples_split': 14, 'min_samples_leaf': 2, 'subsample': 0.6890351486469375, 'max_features': 'sqrt'}. Best is trial 1137 with value: 0.19687116000636118.
[I 2024-12-04 13:08:01,044] Trial 1406 finished with value: 0.21733251177093363 and parameters: {'n_estimators': 1277, 'learning_rate': 0.059128750112877576, 'max_depth': 12, 'min_samples_split': 14, 'min_samples_leaf': 1, 'subsample': 0.6014185168123806, 'max_features': 'sqrt'}. Best is trial 1137 with value: 0.19687116000636118.
[I 2024-12-04 13:08:03,143] Trial 1405 finished with value: 0.25337655661442443 and parameters: {'n_estimators': 1360, 'learning_rate': 0.09093877525578077, 'max_depth': 12, 'min_samples_split': 17, 'min_samples_leaf': 4, 'subsample': 0.6927372404840325, 'max_features': 'sqrt'}. Best is trial 1137 with value: 0.19687116000636118.
[I 2024-12-04 13:08:05,149] Trial 1404 finished with value: 0.20944625840728173 and parameters: {'n_estimators': 1472, 'learning_rate': 0.08679860255209655, 'max_depth': 12, 'min_samples_split': 19, 'min_samples_leaf': 1, 'subsample': 0.6044720808849543, 'max_features': 'sqrt'}. Best is trial 1137 with value: 0.19687116000636118.
[I 2024-12-04 13:08:06,089] Trial 1420 finished with value: 0.36877895835483854 and parameters: {'n_estimators': 622, 'learning_rate': 0.09090984136202737, 'max_depth': 7, 'min_samples_split': 8, 'min_samples_leaf': 9, 'subsample': 0.8355400647260596, 'max_features': None}. Best is trial 1137 with value: 0.19687116000636118.
[I 2024-12-04 13:08:06,092] Trial 1407 finished with value: 0.22042321526820732 and parameters: {'n_estimators': 1327, 'learning_rate': 0.066806142314874, 'max_depth': 12, 'min_samples_split': 16, 'min_samples_leaf': 1, 'subsample': 0.6310169485194651, 'max_features': 'sqrt'}. Best is trial 1137 with value: 0.19687116000636118.
[I 2024-12-04 13:08:08,948] Trial 1422 finished with value: 0.4790181800452114 and parameters: {'n_estimators': 681, 'learning_rate': 0.01764076064736459, 'max_depth': 3, 'min_samples_split': 13, 'min_samples_leaf': 1, 'subsample': 0.7162246797919705, 'max_features': 'sqrt'}. Best is trial 1137 with value: 0.19687116000636118.
[I 2024-12-04 13:08:10,148] Trial 1434 finished with value: 0.37760377025057323 and parameters: {'n_estimators': 189, 'learning_rate': 0.010894341277401753, 'max_depth': 12, 'min_samples_split': 7, 'min_samples_leaf': 3, 'subsample': 0.9886064170755329, 'max_features': None}. Best is trial 1137 with value: 0.19687116000636118.
[I 2024-12-04 13:08:14,137] Trial 1409 finished with value: 0.208834646723176 and parameters: {'n_estimators': 1299, 'learning_rate': 0.07236024683173352, 'max_depth': 12, 'min_samples_split': 16, 'min_samples_leaf': 1, 'subsample': 0.6989791276141548, 'max_features': 'sqrt'}. Best is trial 1137 with value: 0.19687116000636118.
[I 2024-12-04 13:08:19,198] Trial 1408 finished with value: 0.25724100703295216 and parameters: {'n_estimators': 1472, 'learning_rate': 0.09098219335568208, 'max_depth': 12, 'min_samples_split': 15, 'min_samples_leaf': 3, 'subsample': 0.650848716230183, 'max_features': 'sqrt'}. Best is trial 1137 with value: 0.19687116000636118.
[I 2024-12-04 13:08:22,612] Trial 1423 finished with value: 0.2821979753447771 and parameters: {'n_estimators': 700, 'learning_rate': 0.03804300667860757, 'max_depth': 10, 'min_samples_split': 15, 'min_samples_leaf': 4, 'subsample': 0.8303828725021115, 'max_features': None}. Best is trial 1137 with value: 0.19687116000636118.
[I 2024-12-04 13:08:23,993] Trial 1411 finished with value: 0.21119594133509206 and parameters: {'n_estimators': 1422, 'learning_rate': 0.05927908915626702, 'max_depth': 12, 'min_samples_split': 15, 'min_samples_leaf': 1, 'subsample': 0.604582045982707, 'max_features': 'sqrt'}. Best is trial 1137 with value: 0.19687116000636118.
[I 2024-12-04 13:08:27,225] Trial 1410 finished with value: 0.22892514307313647 and parameters: {'n_estimators': 1483, 'learning_rate': 0.07972969020088572, 'max_depth': 12, 'min_samples_split': 16, 'min_samples_leaf': 2, 'subsample': 0.6473589611924976, 'max_features': 'sqrt'}. Best is trial 1137 with value: 0.19687116000636118.
[I 2024-12-04 13:08:29,912] Trial 1412 finished with value: 0.2310757645212116 and parameters: {'n_estimators': 1457, 'learning_rate': 0.07988423784561491, 'max_depth': 11, 'min_samples_split': 15, 'min_samples_leaf': 1, 'subsample': 0.6616768216512219, 'max_features': 'sqrt'}. Best is trial 1137 with value: 0.19687116000636118.
[I 2024-12-04 13:08:33,413] Trial 1415 finished with value: 0.2426843108756068 and parameters: {'n_estimators': 1313, 'learning_rate': 0.0824407385475036, 'max_depth': 12, 'min_samples_split': 16, 'min_samples_leaf': 3, 'subsample': 0.6043146974555685, 'max_features': 'sqrt'}. Best is trial 1137 with value: 0.19687116000636118.
[I 2024-12-04 13:08:35,176] Trial 1418 finished with value: 0.20659512269237487 and parameters: {'n_estimators': 1197, 'learning_rate': 0.0995731994206798, 'max_depth': 11, 'min_samples_split': 14, 'min_samples_leaf': 1, 'subsample': 0.6345819426069904, 'max_features': 'sqrt'}. Best is trial 1137 with value: 0.19687116000636118.
[I 2024-12-04 13:08:37,062] Trial 1440 finished with value: 0.8217374420242488 and parameters: {'n_estimators': 299, 'learning_rate': 0.010257789313820088, 'max_depth': 6, 'min_samples_split': 11, 'min_samples_leaf': 5, 'subsample': 0.699539313231047, 'max_features': 'log2'}. Best is trial 1137 with value: 0.19687116000636118.
[I 2024-12-04 13:08:38,324] Trial 1414 finished with value: 0.22378007771875888 and parameters: {'n_estimators': 1436, 'learning_rate': 0.09343978962364334, 'max_depth': 12, 'min_samples_split': 17, 'min_samples_leaf': 1, 'subsample': 0.6758222753244468, 'max_features': 'sqrt'}. Best is trial 1137 with value: 0.19687116000636118.
[I 2024-12-04 13:08:38,340] Trial 1413 finished with value: 0.23975668547215892 and parameters: {'n_estimators': 1478, 'learning_rate': 0.0592581866933586, 'max_depth': 12, 'min_samples_split': 17, 'min_samples_leaf': 2, 'subsample': 0.6998793174021923, 'max_features': 'sqrt'}. Best is trial 1137 with value: 0.19687116000636118.
[I 2024-12-04 13:08:46,628] Trial 1416 finished with value: 0.2453295368346587 and parameters: {'n_estimators': 1472, 'learning_rate': 0.06950106600281249, 'max_depth': 9, 'min_samples_split': 14, 'min_samples_leaf': 3, 'subsample': 0.6147171206065465, 'max_features': 'sqrt'}. Best is trial 1137 with value: 0.19687116000636118.
[I 2024-12-04 13:08:48,281] Trial 1417 finished with value: 0.21574297432522072 and parameters: {'n_estimators': 1458, 'learning_rate': 0.08660831016303472, 'max_depth': 11, 'min_samples_split': 16, 'min_samples_leaf': 1, 'subsample': 0.6170982548127605, 'max_features': 'sqrt'}. Best is trial 1137 with value: 0.19687116000636118.
[I 2024-12-04 13:08:52,175] Trial 1419 finished with value: 0.21748544172057482 and parameters: {'n_estimators': 1476, 'learning_rate': 0.08641218092606401, 'max_depth': 12, 'min_samples_split': 15, 'min_samples_leaf': 1, 'subsample': 0.6623067768402127, 'max_features': 'sqrt'}. Best is trial 1137 with value: 0.19687116000636118.
[I 2024-12-04 13:08:54,472] Trial 1424 finished with value: 0.22939376896149943 and parameters: {'n_estimators': 1303, 'learning_rate': 0.047258662572356586, 'max_depth': 12, 'min_samples_split': 15, 'min_samples_leaf': 1, 'subsample': 0.6845296432985644, 'max_features': 'sqrt'}. Best is trial 1137 with value: 0.19687116000636118.
[I 2024-12-04 13:08:56,856] Trial 1427 finished with value: 0.2069196893789311 and parameters: {'n_estimators': 1205, 'learning_rate': 0.07560064844520377, 'max_depth': 12, 'min_samples_split': 17, 'min_samples_leaf': 1, 'subsample': 0.6096114826415265, 'max_features': 'sqrt'}. Best is trial 1137 with value: 0.19687116000636118.
[I 2024-12-04 13:08:58,034] Trial 1425 finished with value: 0.25484421911303856 and parameters: {'n_estimators': 1326, 'learning_rate': 0.09939588568527957, 'max_depth': 10, 'min_samples_split': 18, 'min_samples_leaf': 3, 'subsample': 0.603686682590729, 'max_features': 'sqrt'}. Best is trial 1137 with value: 0.19687116000636118.
[I 2024-12-04 13:08:58,518] Trial 1421 finished with value: 0.21285153610173665 and parameters: {'n_estimators': 1411, 'learning_rate': 0.0879167119086811, 'max_depth': 12, 'min_samples_split': 14, 'min_samples_leaf': 1, 'subsample': 0.6440235673113359, 'max_features': 'sqrt'}. Best is trial 1137 with value: 0.19687116000636118.
[I 2024-12-04 13:09:03,127] Trial 1430 finished with value: 0.2412952374958593 and parameters: {'n_estimators': 1215, 'learning_rate': 0.07296923137973117, 'max_depth': 9, 'min_samples_split': 15, 'min_samples_leaf': 1, 'subsample': 0.6200954861728858, 'max_features': 'sqrt'}. Best is trial 1137 with value: 0.19687116000636118.
[I 2024-12-04 13:09:03,188] Trial 1453 finished with value: 0.7453587001285366 and parameters: {'n_estimators': 253, 'learning_rate': 0.015885112304556435, 'max_depth': 4, 'min_samples_split': 14, 'min_samples_leaf': 2, 'subsample': 0.9369837011801476, 'max_features': 'log2'}. Best is trial 1137 with value: 0.19687116000636118.
[I 2024-12-04 13:09:03,246] Trial 1429 finished with value: 0.23573920981414925 and parameters: {'n_estimators': 1267, 'learning_rate': 0.09492360770827592, 'max_depth': 12, 'min_samples_split': 17, 'min_samples_leaf': 2, 'subsample': 0.6351065633477408, 'max_features': 'sqrt'}. Best is trial 1137 with value: 0.19687116000636118.
[I 2024-12-04 13:09:07,224] Trial 1433 finished with value: 0.49572485796813603 and parameters: {'n_estimators': 1186, 'learning_rate': 0.03609680460255079, 'max_depth': 11, 'min_samples_split': 11, 'min_samples_leaf': 10, 'subsample': 0.855764422952514, 'max_features': 'log2'}. Best is trial 1137 with value: 0.19687116000636118.
[I 2024-12-04 13:09:11,080] Trial 1426 finished with value: 0.21842147205241305 and parameters: {'n_estimators': 1488, 'learning_rate': 0.09635189442062185, 'max_depth': 11, 'min_samples_split': 16, 'min_samples_leaf': 1, 'subsample': 0.6439371114934874, 'max_features': 'sqrt'}. Best is trial 1137 with value: 0.19687116000636118.
[I 2024-12-04 13:09:11,938] Trial 1447 finished with value: 0.7156549467100974 and parameters: {'n_estimators': 628, 'learning_rate': 0.01587282795915357, 'max_depth': 11, 'min_samples_split': 20, 'min_samples_leaf': 10, 'subsample': 0.8271238213957997, 'max_features': 'log2'}. Best is trial 1137 with value: 0.19687116000636118.
[I 2024-12-04 13:09:13,953] Trial 1428 finished with value: 0.22233384458038333 and parameters: {'n_estimators': 1453, 'learning_rate': 0.08065259305334017, 'max_depth': 12, 'min_samples_split': 20, 'min_samples_leaf': 1, 'subsample': 0.6194967571110626, 'max_features': 'sqrt'}. Best is trial 1137 with value: 0.19687116000636118.
[I 2024-12-04 13:09:17,395] Trial 1431 finished with value: 0.23482624938912933 and parameters: {'n_estimators': 1417, 'learning_rate': 0.05368220184299058, 'max_depth': 10, 'min_samples_split': 16, 'min_samples_leaf': 1, 'subsample': 0.6307782016798037, 'max_features': 'sqrt'}. Best is trial 1137 with value: 0.19687116000636118.
[I 2024-12-04 13:09:20,288] Trial 1451 finished with value: 0.4882730674494118 and parameters: {'n_estimators': 582, 'learning_rate': 0.022234602444012284, 'max_depth': 12, 'min_samples_split': 18, 'min_samples_leaf': 4, 'subsample': 0.7420110829096, 'max_features': 'log2'}. Best is trial 1137 with value: 0.19687116000636118.
[I 2024-12-04 13:09:22,877] Trial 1432 finished with value: 0.22553790493096626 and parameters: {'n_estimators': 1496, 'learning_rate': 0.08758108923864717, 'max_depth': 12, 'min_samples_split': 20, 'min_samples_leaf': 1, 'subsample': 0.6008531691587453, 'max_features': 'sqrt'}. Best is trial 1137 with value: 0.19687116000636118.
[I 2024-12-04 13:09:30,904] Trial 1435 finished with value: 0.25302550290482756 and parameters: {'n_estimators': 1418, 'learning_rate': 0.094455302736378, 'max_depth': 11, 'min_samples_split': 15, 'min_samples_leaf': 2, 'subsample': 0.6056140691229909, 'max_features': 'sqrt'}. Best is trial 1137 with value: 0.19687116000636118.
[I 2024-12-04 13:09:31,807] Trial 1437 finished with value: 0.28661658503924103 and parameters: {'n_estimators': 1329, 'learning_rate': 0.0653436637952864, 'max_depth': 11, 'min_samples_split': 14, 'min_samples_leaf': 3, 'subsample': 0.6127257048031943, 'max_features': 'log2'}. Best is trial 1137 with value: 0.19687116000636118.
[I 2024-12-04 13:09:34,920] Trial 1436 finished with value: 0.20366528055453947 and parameters: {'n_estimators': 1406, 'learning_rate': 0.08088841461747416, 'max_depth': 12, 'min_samples_split': 18, 'min_samples_leaf': 1, 'subsample': 0.6163092764608894, 'max_features': 'sqrt'}. Best is trial 1137 with value: 0.19687116000636118.
[I 2024-12-04 13:09:35,915] Trial 1448 finished with value: 0.3199392405472822 and parameters: {'n_estimators': 861, 'learning_rate': 0.0831457361336052, 'max_depth': 8, 'min_samples_split': 2, 'min_samples_leaf': 5, 'subsample': 0.9417429933130521, 'max_features': None}. Best is trial 1137 with value: 0.19687116000636118.
[I 2024-12-04 13:09:39,843] Trial 1443 finished with value: 0.24178015310548706 and parameters: {'n_estimators': 1248, 'learning_rate': 0.09701825563067103, 'max_depth': 12, 'min_samples_split': 18, 'min_samples_leaf': 3, 'subsample': 0.6046603164607633, 'max_features': 'sqrt'}. Best is trial 1137 with value: 0.19687116000636118.
[I 2024-12-04 13:09:43,310] Trial 1438 finished with value: 0.22459641927566834 and parameters: {'n_estimators': 1447, 'learning_rate': 0.07421080707226531, 'max_depth': 9, 'min_samples_split': 15, 'min_samples_leaf': 1, 'subsample': 0.6025192513066376, 'max_features': 'sqrt'}. Best is trial 1137 with value: 0.19687116000636118.
[I 2024-12-04 13:09:45,644] Trial 1449 finished with value: 0.30338086475164433 and parameters: {'n_estimators': 1082, 'learning_rate': 0.049825001763218434, 'max_depth': 6, 'min_samples_split': 4, 'min_samples_leaf': 2, 'subsample': 0.6029434773638338, 'max_features': 'log2'}. Best is trial 1137 with value: 0.19687116000636118.
[I 2024-12-04 13:09:47,690] Trial 1444 finished with value: 0.21038281666083275 and parameters: {'n_estimators': 1299, 'learning_rate': 0.09809469419057479, 'max_depth': 12, 'min_samples_split': 17, 'min_samples_leaf': 1, 'subsample': 0.7392254211447465, 'max_features': 'sqrt'}. Best is trial 1137 with value: 0.19687116000636118.
[I 2024-12-04 13:09:49,610] Trial 1445 finished with value: 0.24644996170762373 and parameters: {'n_estimators': 1275, 'learning_rate': 0.0704257895726149, 'max_depth': 11, 'min_samples_split': 17, 'min_samples_leaf': 3, 'subsample': 0.7231799183155889, 'max_features': 'sqrt'}. Best is trial 1137 with value: 0.19687116000636118.
[I 2024-12-04 13:09:51,399] Trial 1439 finished with value: 0.22116772326965176 and parameters: {'n_estimators': 1498, 'learning_rate': 0.07862458938119135, 'max_depth': 10, 'min_samples_split': 16, 'min_samples_leaf': 1, 'subsample': 0.645146137085292, 'max_features': 'sqrt'}. Best is trial 1137 with value: 0.19687116000636118.
[I 2024-12-04 13:09:52,540] Trial 1441 finished with value: 0.21208126218583268 and parameters: {'n_estimators': 1457, 'learning_rate': 0.09825947595236197, 'max_depth': 11, 'min_samples_split': 15, 'min_samples_leaf': 1, 'subsample': 0.6785578230653871, 'max_features': 'sqrt'}. Best is trial 1137 with value: 0.19687116000636118.
[I 2024-12-04 13:09:56,078] Trial 1442 finished with value: 0.22282215277878503 and parameters: {'n_estimators': 1499, 'learning_rate': 0.0894817460630048, 'max_depth': 12, 'min_samples_split': 17, 'min_samples_leaf': 1, 'subsample': 0.6201112464375059, 'max_features': 'sqrt'}. Best is trial 1137 with value: 0.19687116000636118.
[I 2024-12-04 13:10:00,119] Trial 1446 finished with value: 0.21922040529334189 and parameters: {'n_estimators': 1407, 'learning_rate': 0.07380927293256544, 'max_depth': 12, 'min_samples_split': 17, 'min_samples_leaf': 1, 'subsample': 0.6173820132925181, 'max_features': 'sqrt'}. Best is trial 1137 with value: 0.19687116000636118.
[I 2024-12-04 13:10:01,106] Trial 1477 finished with value: 0.8059101329469955 and parameters: {'n_estimators': 171, 'learning_rate': 0.021344598608543444, 'max_depth': 9, 'min_samples_split': 9, 'min_samples_leaf': 5, 'subsample': 0.6059038973067925, 'max_features': 'log2'}. Best is trial 1137 with value: 0.19687116000636118.
[I 2024-12-04 13:10:04,873] Trial 1472 finished with value: 0.3274431961098599 and parameters: {'n_estimators': 414, 'learning_rate': 0.09479045262351327, 'max_depth': 7, 'min_samples_split': 17, 'min_samples_leaf': 1, 'subsample': 0.7710782292007923, 'max_features': 'log2'}. Best is trial 1137 with value: 0.19687116000636118.
[I 2024-12-04 13:10:07,021] Trial 1467 finished with value: 0.31653447855173505 and parameters: {'n_estimators': 664, 'learning_rate': 0.01958955458934555, 'max_depth': 5, 'min_samples_split': 4, 'min_samples_leaf': 2, 'subsample': 0.6158572827059204, 'max_features': None}. Best is trial 1137 with value: 0.19687116000636118.
[I 2024-12-04 13:10:13,437] Trial 1464 finished with value: 0.2788596599648778 and parameters: {'n_estimators': 852, 'learning_rate': 0.035631906309849304, 'max_depth': 7, 'min_samples_split': 20, 'min_samples_leaf': 1, 'subsample': 0.6634623227876888, 'max_features': None}. Best is trial 1137 with value: 0.19687116000636118.
[I 2024-12-04 13:10:15,682] Trial 1450 finished with value: 0.2205118633883522 and parameters: {'n_estimators': 1477, 'learning_rate': 0.09040250557536375, 'max_depth': 10, 'min_samples_split': 19, 'min_samples_leaf': 1, 'subsample': 0.6958667024815411, 'max_features': 'sqrt'}. Best is trial 1137 with value: 0.19687116000636118.
[I 2024-12-04 13:10:18,762] Trial 1452 finished with value: 0.23927095997234973 and parameters: {'n_estimators': 1463, 'learning_rate': 0.08679770052139836, 'max_depth': 12, 'min_samples_split': 17, 'min_samples_leaf': 2, 'subsample': 0.6002970642726102, 'max_features': 'sqrt'}. Best is trial 1137 with value: 0.19687116000636118.
[I 2024-12-04 13:10:19,804] Trial 1455 finished with value: 0.21317139232743704 and parameters: {'n_estimators': 1367, 'learning_rate': 0.09004120202682936, 'max_depth': 9, 'min_samples_split': 16, 'min_samples_leaf': 1, 'subsample': 0.6141010152069479, 'max_features': 'sqrt'}. Best is trial 1137 with value: 0.19687116000636118.
[I 2024-12-04 13:10:20,755] Trial 1459 finished with value: 0.24636023782789016 and parameters: {'n_estimators': 1171, 'learning_rate': 0.06799380537758554, 'max_depth': 12, 'min_samples_split': 18, 'min_samples_leaf': 3, 'subsample': 0.670558842116118, 'max_features': 'sqrt'}. Best is trial 1137 with value: 0.19687116000636118.
[I 2024-12-04 13:10:23,917] Trial 1463 finished with value: 0.23790754196543087 and parameters: {'n_estimators': 1098, 'learning_rate': 0.09813097691964304, 'max_depth': 12, 'min_samples_split': 16, 'min_samples_leaf': 2, 'subsample': 0.6324566649385054, 'max_features': 'sqrt'}. Best is trial 1137 with value: 0.19687116000636118.
[I 2024-12-04 13:10:25,514] Trial 1456 finished with value: 0.36164710501272895 and parameters: {'n_estimators': 1415, 'learning_rate': 0.020861816747630785, 'max_depth': 7, 'min_samples_split': 2, 'min_samples_leaf': 3, 'subsample': 0.973358718831788, 'max_features': 'log2'}. Best is trial 1137 with value: 0.19687116000636118.
[I 2024-12-04 13:10:28,534] Trial 1454 finished with value: 0.2608512794843748 and parameters: {'n_estimators': 1495, 'learning_rate': 0.09800258779469681, 'max_depth': 11, 'min_samples_split': 17, 'min_samples_leaf': 3, 'subsample': 0.7450117882780047, 'max_features': 'sqrt'}. Best is trial 1137 with value: 0.19687116000636118.
[I 2024-12-04 13:10:32,736] Trial 1458 finished with value: 0.21388959252253695 and parameters: {'n_estimators': 1409, 'learning_rate': 0.09298213981884802, 'max_depth': 12, 'min_samples_split': 17, 'min_samples_leaf': 1, 'subsample': 0.632368469073293, 'max_features': 'sqrt'}. Best is trial 1137 with value: 0.19687116000636118.
[I 2024-12-04 13:10:35,190] Trial 1461 finished with value: 0.23626980396726924 and parameters: {'n_estimators': 1319, 'learning_rate': 0.09890192152424353, 'max_depth': 12, 'min_samples_split': 13, 'min_samples_leaf': 1, 'subsample': 0.6033416364107884, 'max_features': 'log2'}. Best is trial 1137 with value: 0.19687116000636118.
[I 2024-12-04 13:10:35,195] Trial 1457 finished with value: 0.2004154740294898 and parameters: {'n_estimators': 1495, 'learning_rate': 0.08420407948047215, 'max_depth': 11, 'min_samples_split': 16, 'min_samples_leaf': 1, 'subsample': 0.6008882146761925, 'max_features': 'sqrt'}. Best is trial 1137 with value: 0.19687116000636118.
