[I 2024-12-04 11:51:50,241] Trial 81 finished with value: 0.9449188483277082 and parameters: {'max_depth': 18, 'min_samples_split': 10, 'min_samples_leaf': 3, 'max_features': 'log2', 'criterion': 'squared_error', 'splitter': 'best'}. Best is trial 70 with value: 0.6689799910368681.
[I 2024-12-04 11:51:50,408] Trial 65 finished with value: 0.6872254165149658 and parameters: {'max_depth': 35, 'min_samples_split': 19, 'min_samples_leaf': 1, 'max_features': 'sqrt', 'criterion': 'friedman_mse', 'splitter': 'best'}. Best is trial 70 with value: 0.6689799910368681.
[I 2024-12-04 11:51:50,429] Trial 72 finished with value: 0.7261921773094132 and parameters: {'max_depth': 34, 'min_samples_split': 20, 'min_samples_leaf': 1, 'max_features': 'log2', 'criterion': 'friedman_mse', 'splitter': 'best'}. Best is trial 70 with value: 0.6689799910368681.
[I 2024-12-04 11:51:52,057] Trial 68 finished with value: 0.9655153093480978 and parameters: {'max_depth': 27, 'min_samples_split': 7, 'min_samples_leaf': 3, 'max_features': 'log2', 'criterion': 'squared_error', 'splitter': 'best'}. Best is trial 70 with value: 0.6689799910368681.
[I 2024-12-04 11:51:52,238] Trial 82 finished with value: 0.7897963278346607 and parameters: {'max_depth': 17, 'min_samples_split': 6, 'min_samples_leaf': 1, 'max_features': 'log2', 'criterion': 'squared_error', 'splitter': 'best'}. Best is trial 70 with value: 0.6689799910368681.
[I 2024-12-04 11:51:52,921] Trial 92 finished with value: 0.7675010212888028 and parameters: {'max_depth': 25, 'min_samples_split': 20, 'min_samples_leaf': 1, 'max_features': 'log2', 'criterion': 'squared_error', 'splitter': 'best'}. Best is trial 70 with value: 0.6689799910368681.
[I 2024-12-04 11:51:53,514] Trial 91 finished with value: 0.8438680410846965 and parameters: {'max_depth': 26, 'min_samples_split': 12, 'min_samples_leaf': 2, 'max_features': 'log2', 'criterion': 'absolute_error', 'splitter': 'best'}. Best is trial 70 with value: 0.6689799910368681.
[I 2024-12-04 11:51:53,579] Trial 85 finished with value: 0.6766244744481564 and parameters: {'max_depth': 34, 'min_samples_split': 10, 'min_samples_leaf': 1, 'max_features': 'log2', 'criterion': 'squared_error', 'splitter': 'best'}. Best is trial 70 with value: 0.6689799910368681.
[I 2024-12-04 11:51:54,121] Trial 80 finished with value: 0.6986905669945083 and parameters: {'max_depth': 30, 'min_samples_split': 18, 'min_samples_leaf': 1, 'max_features': 'sqrt', 'criterion': 'friedman_mse', 'splitter': 'best'}. Best is trial 70 with value: 0.6689799910368681.
[I 2024-12-04 11:51:55,855] Trial 93 finished with value: 0.7798659411261304 and parameters: {'max_depth': 34, 'min_samples_split': 16, 'min_samples_leaf': 1, 'max_features': 'sqrt', 'criterion': 'absolute_error', 'splitter': 'best'}. Best is trial 70 with value: 0.6689799910368681.
[I 2024-12-04 11:51:55,857] Trial 83 finished with value: 0.8202493159766523 and parameters: {'max_depth': 31, 'min_samples_split': 20, 'min_samples_leaf': 2, 'max_features': 'sqrt', 'criterion': 'friedman_mse', 'splitter': 'best'}. Best is trial 70 with value: 0.6689799910368681.
[I 2024-12-04 11:51:56,098] Trial 87 finished with value: 0.6816434108193725 and parameters: {'max_depth': 33, 'min_samples_split': 16, 'min_samples_leaf': 1, 'max_features': 'sqrt', 'criterion': 'friedman_mse', 'splitter': 'best'}. Best is trial 70 with value: 0.6689799910368681.
[I 2024-12-04 11:51:56,233] Trial 95 finished with value: 0.8260837121483238 and parameters: {'max_depth': 34, 'min_samples_split': 14, 'min_samples_leaf': 2, 'max_features': 'log2', 'criterion': 'squared_error', 'splitter': 'best'}. Best is trial 70 with value: 0.6689799910368681.
[I 2024-12-04 11:51:56,785] Trial 84 finished with value: 0.7101112790978361 and parameters: {'max_depth': 29, 'min_samples_split': 7, 'min_samples_leaf': 1, 'max_features': 'log2', 'criterion': 'squared_error', 'splitter': 'best'}. Best is trial 70 with value: 0.6689799910368681.
[I 2024-12-04 11:51:56,919] Trial 86 finished with value: 1.0404234411650808 and parameters: {'max_depth': 27, 'min_samples_split': 3, 'min_samples_leaf': 1, 'max_features': 'log2', 'criterion': 'squared_error', 'splitter': 'random'}. Best is trial 70 with value: 0.6689799910368681.
[I 2024-12-04 11:51:57,253] Trial 89 finished with value: 0.8300015320785108 and parameters: {'max_depth': 31, 'min_samples_split': 5, 'min_samples_leaf': 2, 'max_features': 'sqrt', 'criterion': 'squared_error', 'splitter': 'best'}. Best is trial 70 with value: 0.6689799910368681.
[I 2024-12-04 11:51:58,243] Trial 110 finished with value: 0.7239837360259648 and parameters: {'max_depth': 31, 'min_samples_split': 2, 'min_samples_leaf': 1, 'max_features': 'log2', 'criterion': 'squared_error', 'splitter': 'best'}. Best is trial 99 with value: 0.6617883277386292.
[I 2024-12-04 11:51:58,341] Trial 96 finished with value: 0.8241861685151659 and parameters: {'max_depth': 13, 'min_samples_split': 2, 'min_samples_leaf': 2, 'max_features': 'sqrt', 'criterion': 'friedman_mse', 'splitter': 'best'}. Best is trial 99 with value: 0.6617883277386292.
[I 2024-12-04 11:51:58,461] Trial 88 finished with value: 0.8281137437381925 and parameters: {'max_depth': 34, 'min_samples_split': 10, 'min_samples_leaf': 2, 'max_features': 'log2', 'criterion': 'squared_error', 'splitter': 'best'}. Best is trial 99 with value: 0.6617883277386292.
[I 2024-12-04 11:51:58,511] Trial 98 finished with value: 0.7902562954229078 and parameters: {'max_depth': 21, 'min_samples_split': 6, 'min_samples_leaf': 2, 'max_features': 'log2', 'criterion': 'friedman_mse', 'splitter': 'best'}. Best is trial 99 with value: 0.6617883277386292.
[I 2024-12-04 11:51:58,617] Trial 97 finished with value: 0.8717918335326041 and parameters: {'max_depth': 23, 'min_samples_split': 4, 'min_samples_leaf': 1, 'max_features': 'log2', 'criterion': 'absolute_error', 'splitter': 'best'}. Best is trial 99 with value: 0.6617883277386292.
[I 2024-12-04 11:51:58,620] Trial 103 finished with value: 1.0816149376799358 and parameters: {'max_depth': 19, 'min_samples_split': 20, 'min_samples_leaf': 9, 'max_features': 'sqrt', 'criterion': 'squared_error', 'splitter': 'random'}. Best is trial 99 with value: 0.6617883277386292.
[I 2024-12-04 11:51:58,854] Trial 99 finished with value: 0.6617883277386292 and parameters: {'max_depth': 35, 'min_samples_split': 18, 'min_samples_leaf': 1, 'max_features': 'sqrt', 'criterion': 'friedman_mse', 'splitter': 'best'}. Best is trial 99 with value: 0.6617883277386292.
[I 2024-12-04 11:51:59,278] Trial 90 finished with value: 0.6818398381643099 and parameters: {'max_depth': 25, 'min_samples_split': 11, 'min_samples_leaf': 1, 'max_features': 'log2', 'criterion': 'squared_error', 'splitter': 'best'}. Best is trial 99 with value: 0.6617883277386292.
[I 2024-12-04 11:51:59,286] Trial 102 finished with value: 0.8395446230831913 and parameters: {'max_depth': 16, 'min_samples_split': 7, 'min_samples_leaf': 2, 'max_features': 'log2', 'criterion': 'friedman_mse', 'splitter': 'best'}. Best is trial 99 with value: 0.6617883277386292.
[I 2024-12-04 11:51:59,433] Trial 106 finished with value: 0.8606038828695697 and parameters: {'max_depth': 33, 'min_samples_split': 4, 'min_samples_leaf': 2, 'max_features': 'log2', 'criterion': 'squared_error', 'splitter': 'best'}. Best is trial 99 with value: 0.6617883277386292.
[I 2024-12-04 11:51:59,899] Trial 94 finished with value: 0.6860982593403033 and parameters: {'max_depth': 28, 'min_samples_split': 16, 'min_samples_leaf': 1, 'max_features': 'sqrt', 'criterion': 'friedman_mse', 'splitter': 'best'}. Best is trial 99 with value: 0.6617883277386292.
[I 2024-12-04 11:51:59,998] Trial 109 finished with value: 0.7310174147676479 and parameters: {'max_depth': 30, 'min_samples_split': 3, 'min_samples_leaf': 1, 'max_features': 'log2', 'criterion': 'squared_error', 'splitter': 'best'}. Best is trial 104 with value: 0.6388600128475983.
[I 2024-12-04 11:52:00,096] Trial 105 finished with value: 0.7196718784894784 and parameters: {'max_depth': 31, 'min_samples_split': 5, 'min_samples_leaf': 1, 'max_features': 'log2', 'criterion': 'squared_error', 'splitter': 'best'}. Best is trial 104 with value: 0.6388600128475983.
[I 2024-12-04 11:52:00,591] Trial 112 finished with value: 0.7532386497112189 and parameters: {'max_depth': 26, 'min_samples_split': 16, 'min_samples_leaf': 1, 'max_features': 'sqrt', 'criterion': 'friedman_mse', 'splitter': 'best'}. Best is trial 104 with value: 0.6388600128475983.
[I 2024-12-04 11:52:00,661] Trial 104 finished with value: 0.6388600128475983 and parameters: {'max_depth': 33, 'min_samples_split': 15, 'min_samples_leaf': 1, 'max_features': 'sqrt', 'criterion': 'friedman_mse', 'splitter': 'best'}. Best is trial 104 with value: 0.6388600128475983.
[I 2024-12-04 11:52:00,931] Trial 100 finished with value: 0.8270933799801797 and parameters: {'max_depth': 35, 'min_samples_split': 19, 'min_samples_leaf': 5, 'max_features': 'sqrt', 'criterion': 'friedman_mse', 'splitter': 'best'}. Best is trial 104 with value: 0.6388600128475983.
[I 2024-12-04 11:52:01,032] Trial 101 finished with value: 0.708453794192028 and parameters: {'max_depth': 31, 'min_samples_split': 17, 'min_samples_leaf': 1, 'max_features': 'sqrt', 'criterion': 'friedman_mse', 'splitter': 'best'}. Best is trial 104 with value: 0.6388600128475983.
[I 2024-12-04 11:52:02,722] Trial 107 finished with value: 0.6872254165149658 and parameters: {'max_depth': 35, 'min_samples_split': 19, 'min_samples_leaf': 1, 'max_features': 'sqrt', 'criterion': 'friedman_mse', 'splitter': 'best'}. Best is trial 115 with value: 0.6379386941389483.
[I 2024-12-04 11:52:02,820] Trial 115 finished with value: 0.6379386941389483 and parameters: {'max_depth': 34, 'min_samples_split': 12, 'min_samples_leaf': 1, 'max_features': 'sqrt', 'criterion': 'squared_error', 'splitter': 'best'}. Best is trial 115 with value: 0.6379386941389483.
[I 2024-12-04 11:52:03,011] Trial 111 finished with value: 0.6446088891088776 and parameters: {'max_depth': 33, 'min_samples_split': 17, 'min_samples_leaf': 1, 'max_features': 'sqrt', 'criterion': 'friedman_mse', 'splitter': 'best'}. Best is trial 115 with value: 0.6379386941389483.
[I 2024-12-04 11:52:03,770] Trial 125 finished with value: 1.0740768482351102 and parameters: {'max_depth': 22, 'min_samples_split': 20, 'min_samples_leaf': 10, 'max_features': 'log2', 'criterion': 'absolute_error', 'splitter': 'best'}. Best is trial 115 with value: 0.6379386941389483.
[I 2024-12-04 11:52:03,800] Trial 118 finished with value: 0.9027776115607438 and parameters: {'max_depth': 8, 'min_samples_split': 8, 'min_samples_leaf': 2, 'max_features': 'sqrt', 'criterion': 'squared_error', 'splitter': 'best'}. Best is trial 115 with value: 0.6379386941389483.
[I 2024-12-04 11:52:04,105] Trial 108 finished with value: 1.092723027538113 and parameters: {'max_depth': 30, 'min_samples_split': 11, 'min_samples_leaf': 10, 'max_features': 'log2', 'criterion': 'squared_error', 'splitter': 'random'}. Best is trial 115 with value: 0.6379386941389483.
[I 2024-12-04 11:52:04,346] Trial 113 finished with value: 0.9041722436759626 and parameters: {'max_depth': 21, 'min_samples_split': 7, 'min_samples_leaf': 8, 'max_features': 'sqrt', 'criterion': 'absolute_error', 'splitter': 'best'}. Best is trial 115 with value: 0.6379386941389483.
[I 2024-12-04 11:52:04,532] Trial 123 finished with value: 0.6718709178866841 and parameters: {'max_depth': 33, 'min_samples_split': 20, 'min_samples_leaf': 1, 'max_features': 'sqrt', 'criterion': 'friedman_mse', 'splitter': 'best'}. Best is trial 115 with value: 0.6379386941389483.
[I 2024-12-04 11:52:04,626] Trial 116 finished with value: 0.6439029894887489 and parameters: {'max_depth': 29, 'min_samples_split': 13, 'min_samples_leaf': 1, 'max_features': 'sqrt', 'criterion': 'friedman_mse', 'splitter': 'best'}. Best is trial 115 with value: 0.6379386941389483.
[I 2024-12-04 11:52:04,873] Trial 121 finished with value: 0.7007608286806496 and parameters: {'max_depth': 30, 'min_samples_split': 14, 'min_samples_leaf': 1, 'max_features': 'sqrt', 'criterion': 'squared_error', 'splitter': 'best'}. Best is trial 115 with value: 0.6379386941389483.
[I 2024-12-04 11:52:05,002] Trial 114 finished with value: 0.8197632085734636 and parameters: {'max_depth': 31, 'min_samples_split': 16, 'min_samples_leaf': 2, 'max_features': 'sqrt', 'criterion': 'friedman_mse', 'splitter': 'best'}. Best is trial 115 with value: 0.6379386941389483.
[I 2024-12-04 11:52:05,727] Trial 117 finished with value: 0.8266069286848198 and parameters: {'max_depth': 33, 'min_samples_split': 10, 'min_samples_leaf': 2, 'max_features': 'sqrt', 'criterion': 'squared_error', 'splitter': 'best'}. Best is trial 115 with value: 0.6379386941389483.
[I 2024-12-04 11:52:07,046] Trial 124 finished with value: 0.677269555622075 and parameters: {'max_depth': 27, 'min_samples_split': 12, 'min_samples_leaf': 1, 'max_features': 'sqrt', 'criterion': 'friedman_mse', 'splitter': 'best'}. Best is trial 115 with value: 0.6379386941389483.
[I 2024-12-04 11:52:07,642] Trial 120 finished with value: 0.6789669071314235 and parameters: {'max_depth': 31, 'min_samples_split': 10, 'min_samples_leaf': 1, 'max_features': 'sqrt', 'criterion': 'friedman_mse', 'splitter': 'best'}. Best is trial 115 with value: 0.6379386941389483.
[I 2024-12-04 11:52:08,986] Trial 122 finished with value: 0.6737660440780254 and parameters: {'max_depth': 33, 'min_samples_split': 9, 'min_samples_leaf': 1, 'max_features': 'sqrt', 'criterion': 'friedman_mse', 'splitter': 'best'}. Best is trial 115 with value: 0.6379386941389483.
[I 2024-12-04 11:52:09,685] Trial 138 finished with value: 0.6954451968836555 and parameters: {'max_depth': 34, 'min_samples_split': 20, 'min_samples_leaf': 1, 'max_features': 'sqrt', 'criterion': 'friedman_mse', 'splitter': 'best'}. Best is trial 115 with value: 0.6379386941389483.
[I 2024-12-04 11:52:10,172] Trial 119 finished with value: 0.7037914714631972 and parameters: {'max_depth': 34, 'min_samples_split': 16, 'min_samples_leaf': 1, 'max_features': 'sqrt', 'criterion': 'friedman_mse', 'splitter': 'best'}. Best is trial 115 with value: 0.6379386941389483.
[I 2024-12-04 11:52:10,199] Trial 126 finished with value: 0.8197632085734636 and parameters: {'max_depth': 29, 'min_samples_split': 13, 'min_samples_leaf': 2, 'max_features': 'sqrt', 'criterion': 'friedman_mse', 'splitter': 'best'}. Best is trial 115 with value: 0.6379386941389483.
[I 2024-12-04 11:52:10,576] Trial 131 finished with value: 0.7550563054416447 and parameters: {'max_depth': 23, 'min_samples_split': 10, 'min_samples_leaf': 1, 'max_features': 'sqrt', 'criterion': 'friedman_mse', 'splitter': 'best'}. Best is trial 115 with value: 0.6379386941389483.
[I 2024-12-04 11:52:10,622] Trial 134 finished with value: 0.7298335403464106 and parameters: {'max_depth': 35, 'min_samples_split': 9, 'min_samples_leaf': 1, 'max_features': 'log2', 'criterion': 'friedman_mse', 'splitter': 'best'}. Best is trial 115 with value: 0.6379386941389483.
[I 2024-12-04 11:52:12,455] Trial 128 finished with value: 0.8066762268897443 and parameters: {'max_depth': 25, 'min_samples_split': 9, 'min_samples_leaf': 3, 'max_features': 'sqrt', 'criterion': 'friedman_mse', 'splitter': 'best'}. Best is trial 115 with value: 0.6379386941389483.
[I 2024-12-04 11:52:12,523] Trial 132 finished with value: 0.6599142051111299 and parameters: {'max_depth': 28, 'min_samples_split': 2, 'min_samples_leaf': 1, 'max_features': 'sqrt', 'criterion': 'friedman_mse', 'splitter': 'best'}. Best is trial 115 with value: 0.6379386941389483.
[I 2024-12-04 11:52:16,928] Trial 133 finished with value: 0.6862313348684029 and parameters: {'max_depth': 29, 'min_samples_split': 12, 'min_samples_leaf': 1, 'max_features': 'sqrt', 'criterion': 'friedman_mse', 'splitter': 'best'}. Best is trial 115 with value: 0.6379386941389483.
[I 2024-12-04 11:52:17,125] Trial 143 finished with value: 0.6945768284293156 and parameters: {'max_depth': 35, 'min_samples_split': 9, 'min_samples_leaf': 1, 'max_features': 'sqrt', 'criterion': 'friedman_mse', 'splitter': 'best'}. Best is trial 115 with value: 0.6379386941389483.
[I 2024-12-04 11:52:18,561] Trial 127 finished with value: 0.7380957714121964 and parameters: {'max_depth': 28, 'min_samples_split': 10, 'min_samples_leaf': 1, 'max_features': 'log2', 'criterion': 'friedman_mse', 'splitter': 'best'}. Best is trial 115 with value: 0.6379386941389483.
[I 2024-12-04 11:52:18,828] Trial 144 finished with value: 0.6774751628355143 and parameters: {'max_depth': 29, 'min_samples_split': 11, 'min_samples_leaf': 1, 'max_features': 'sqrt', 'criterion': 'friedman_mse', 'splitter': 'best'}. Best is trial 115 with value: 0.6379386941389483.
[I 2024-12-04 11:52:18,933] Trial 129 finished with value: 0.8241861685151659 and parameters: {'max_depth': 35, 'min_samples_split': 2, 'min_samples_leaf': 2, 'max_features': 'sqrt', 'criterion': 'friedman_mse', 'splitter': 'best'}. Best is trial 115 with value: 0.6379386941389483.
[I 2024-12-04 11:52:19,013] Trial 136 finished with value: 0.7880197175705858 and parameters: {'max_depth': 31, 'min_samples_split': 10, 'min_samples_leaf': 1, 'max_features': 'sqrt', 'criterion': 'absolute_error', 'splitter': 'best'}. Best is trial 115 with value: 0.6379386941389483.
[I 2024-12-04 11:52:19,200] Trial 135 finished with value: 0.8266069286848198 and parameters: {'max_depth': 34, 'min_samples_split': 9, 'min_samples_leaf': 2, 'max_features': 'sqrt', 'criterion': 'friedman_mse', 'splitter': 'best'}. Best is trial 115 with value: 0.6379386941389483.
[I 2024-12-04 11:52:19,205] Trial 151 finished with value: 0.7235062702460188 and parameters: {'max_depth': 34, 'min_samples_split': 11, 'min_samples_leaf': 1, 'max_features': 'sqrt', 'criterion': 'squared_error', 'splitter': 'best'}. Best is trial 115 with value: 0.6379386941389483.
[I 2024-12-04 11:52:19,211] Trial 137 finished with value: 0.6702654654144604 and parameters: {'max_depth': 35, 'min_samples_split': 14, 'min_samples_leaf': 1, 'max_features': 'sqrt', 'criterion': 'squared_error', 'splitter': 'best'}. Best is trial 115 with value: 0.6379386941389483.
[I 2024-12-04 11:52:19,219] Trial 141 finished with value: 0.7173076925763602 and parameters: {'max_depth': 27, 'min_samples_split': 11, 'min_samples_leaf': 1, 'max_features': 'sqrt', 'criterion': 'absolute_error', 'splitter': 'best'}. Best is trial 115 with value: 0.6379386941389483.
[I 2024-12-04 11:52:19,396] Trial 130 finished with value: 0.6599142051111299 and parameters: {'max_depth': 28, 'min_samples_split': 2, 'min_samples_leaf': 1, 'max_features': 'sqrt', 'criterion': 'friedman_mse', 'splitter': 'best'}. Best is trial 115 with value: 0.6379386941389483.
[I 2024-12-04 11:52:19,575] Trial 145 finished with value: 0.7350548992447786 and parameters: {'max_depth': 24, 'min_samples_split': 5, 'min_samples_leaf': 1, 'max_features': 'sqrt', 'criterion': 'friedman_mse', 'splitter': 'best'}. Best is trial 115 with value: 0.6379386941389483.
[I 2024-12-04 11:52:20,600] Trial 152 finished with value: 0.7957607517832435 and parameters: {'max_depth': 26, 'min_samples_split': 2, 'min_samples_leaf': 1, 'max_features': 'sqrt', 'criterion': 'friedman_mse', 'splitter': 'best'}. Best is trial 115 with value: 0.6379386941389483.
[I 2024-12-04 11:52:22,592] Trial 150 finished with value: 0.6789802738421568 and parameters: {'max_depth': 35, 'min_samples_split': 13, 'min_samples_leaf': 1, 'max_features': 'sqrt', 'criterion': 'friedman_mse', 'splitter': 'best'}. Best is trial 115 with value: 0.6379386941389483.
[I 2024-12-04 11:52:22,775] Trial 146 finished with value: 1.0909840109486761 and parameters: {'max_depth': 27, 'min_samples_split': 9, 'min_samples_leaf': 5, 'max_features': 'log2', 'criterion': 'squared_error', 'splitter': 'random'}. Best is trial 115 with value: 0.6379386941389483.
[I 2024-12-04 11:52:22,829] Trial 153 finished with value: 0.7557957616677142 and parameters: {'max_depth': 21, 'min_samples_split': 9, 'min_samples_leaf': 1, 'max_features': 'sqrt', 'criterion': 'squared_error', 'splitter': 'best'}. Best is trial 115 with value: 0.6379386941389483.
[I 2024-12-04 11:52:23,173] Trial 142 finished with value: 0.7082626802070764 and parameters: {'max_depth': 24, 'min_samples_split': 3, 'min_samples_leaf': 1, 'max_features': 'sqrt', 'criterion': 'friedman_mse', 'splitter': 'best'}. Best is trial 115 with value: 0.6379386941389483.
[I 2024-12-04 11:52:23,488] Trial 140 finished with value: 1.0852584603456297 and parameters: {'max_depth': 1, 'min_samples_split': 12, 'min_samples_leaf': 8, 'max_features': 'sqrt', 'criterion': 'absolute_error', 'splitter': 'best'}. Best is trial 115 with value: 0.6379386941389483.
[I 2024-12-04 11:52:23,490] Trial 147 finished with value: 0.774293158467234 and parameters: {'max_depth': 31, 'min_samples_split': 3, 'min_samples_leaf': 3, 'max_features': 'sqrt', 'criterion': 'absolute_error', 'splitter': 'best'}. Best is trial 115 with value: 0.6379386941389483.
[I 2024-12-04 11:52:23,566] Trial 155 finished with value: 0.8197632085734636 and parameters: {'max_depth': 35, 'min_samples_split': 15, 'min_samples_leaf': 2, 'max_features': 'sqrt', 'criterion': 'squared_error', 'splitter': 'best'}. Best is trial 115 with value: 0.6379386941389483.
[I 2024-12-04 11:52:24,182] Trial 161 finished with value: 0.825562298787238 and parameters: {'max_depth': 35, 'min_samples_split': 13, 'min_samples_leaf': 3, 'max_features': 'sqrt', 'criterion': 'friedman_mse', 'splitter': 'best'}. Best is trial 115 with value: 0.6379386941389483.
[I 2024-12-04 11:52:24,294] Trial 157 finished with value: 0.6777561409658496 and parameters: {'max_depth': 30, 'min_samples_split': 5, 'min_samples_leaf': 1, 'max_features': 'sqrt', 'criterion': 'friedman_mse', 'splitter': 'best'}. Best is trial 115 with value: 0.6379386941389483.
