[I 2024-12-04 13:43:44,172] Trial 2269 finished with value: 0.35339034732778446 and parameters: {'n_estimators': 941, 'learning_rate': 0.08270207969574182, 'max_depth': 6, 'min_samples_split': 3, 'min_samples_leaf': 3, 'subsample': 0.8464447150454936, 'max_features': 'sqrt'}. Best is trial 1389 with value: 0.22332552856343169.
[I 2024-12-04 13:43:51,499] Trial 2262 finished with value: 0.2453856881507069 and parameters: {'n_estimators': 1335, 'learning_rate': 0.048910002890629856, 'max_depth': 12, 'min_samples_split': 5, 'min_samples_leaf': 1, 'subsample': 0.6043676860432587, 'max_features': 'sqrt'}. Best is trial 1389 with value: 0.22332552856343169.
[I 2024-12-04 13:43:53,170] Trial 2274 finished with value: 0.4418695044969238 and parameters: {'n_estimators': 807, 'learning_rate': 0.05277745171087353, 'max_depth': 6, 'min_samples_split': 6, 'min_samples_leaf': 3, 'subsample': 0.8691802170747398, 'max_features': 'log2'}. Best is trial 1389 with value: 0.22332552856343169.
[I 2024-12-04 13:43:56,889] Trial 2261 finished with value: 0.262651789274789 and parameters: {'n_estimators': 1447, 'learning_rate': 0.0927961886529507, 'max_depth': 10, 'min_samples_split': 2, 'min_samples_leaf': 1, 'subsample': 0.7497956006421237, 'max_features': 'log2'}. Best is trial 1389 with value: 0.22332552856343169.
[I 2024-12-04 13:43:56,907] Trial 2258 finished with value: 0.2513700808935378 and parameters: {'n_estimators': 1490, 'learning_rate': 0.06196627497714606, 'max_depth': 6, 'min_samples_split': 3, 'min_samples_leaf': 1, 'subsample': 0.6803978301101355, 'max_features': 'sqrt'}. Best is trial 1389 with value: 0.22332552856343169.
[I 2024-12-04 13:43:59,561] Trial 2268 finished with value: 0.2791538450962678 and parameters: {'n_estimators': 1187, 'learning_rate': 0.09682466228842694, 'max_depth': 9, 'min_samples_split': 5, 'min_samples_leaf': 2, 'subsample': 0.8720906560680743, 'max_features': 'sqrt'}. Best is trial 1389 with value: 0.22332552856343169.
[I 2024-12-04 13:44:01,425] Trial 2283 finished with value: 0.2530889620510485 and parameters: {'n_estimators': 640, 'learning_rate': 0.0946567161704836, 'max_depth': 7, 'min_samples_split': 4, 'min_samples_leaf': 1, 'subsample': 0.8833555629244885, 'max_features': 'sqrt'}. Best is trial 1389 with value: 0.22332552856343169.
[I 2024-12-04 13:44:05,152] Trial 2263 finished with value: 0.24035351753986336 and parameters: {'n_estimators': 1484, 'learning_rate': 0.05723728594881203, 'max_depth': 9, 'min_samples_split': 4, 'min_samples_leaf': 1, 'subsample': 0.7194684872271855, 'max_features': 'sqrt'}. Best is trial 1389 with value: 0.22332552856343169.
[I 2024-12-04 13:44:05,843] Trial 2270 finished with value: 0.2644074108370688 and parameters: {'n_estimators': 1150, 'learning_rate': 0.04207710738722041, 'max_depth': 10, 'min_samples_split': 5, 'min_samples_leaf': 1, 'subsample': 0.727881434936458, 'max_features': 'sqrt'}. Best is trial 1389 with value: 0.22332552856343169.
[I 2024-12-04 13:44:06,205] Trial 2275 finished with value: 0.4861086831561083 and parameters: {'n_estimators': 1020, 'learning_rate': 0.04773703736886469, 'max_depth': 7, 'min_samples_split': 14, 'min_samples_leaf': 6, 'subsample': 0.7477639786134357, 'max_features': 'log2'}. Best is trial 1389 with value: 0.22332552856343169.
[I 2024-12-04 13:44:10,750] Trial 2265 finished with value: 0.28017204449995686 and parameters: {'n_estimators': 1390, 'learning_rate': 0.09831466865785514, 'max_depth': 9, 'min_samples_split': 7, 'min_samples_leaf': 2, 'subsample': 0.7528885931160951, 'max_features': 'sqrt'}. Best is trial 1389 with value: 0.22332552856343169.
[I 2024-12-04 13:44:17,253] Trial 2278 finished with value: 0.35745119071029136 and parameters: {'n_estimators': 1007, 'learning_rate': 0.07523854604398679, 'max_depth': 8, 'min_samples_split': 8, 'min_samples_leaf': 3, 'subsample': 0.9320418667043407, 'max_features': 'sqrt'}. Best is trial 1389 with value: 0.22332552856343169.
[I 2024-12-04 13:44:18,467] Trial 2288 finished with value: 0.4341922430502464 and parameters: {'n_estimators': 728, 'learning_rate': 0.02321070245997719, 'max_depth': 8, 'min_samples_split': 13, 'min_samples_leaf': 7, 'subsample': 0.9072073139485748, 'max_features': 'sqrt'}. Best is trial 1389 with value: 0.22332552856343169.
[I 2024-12-04 13:44:20,401] Trial 2277 finished with value: 0.35825859643943214 and parameters: {'n_estimators': 917, 'learning_rate': 0.053798693036795464, 'max_depth': 7, 'min_samples_split': 2, 'min_samples_leaf': 3, 'subsample': 0.9062419669268155, 'max_features': 'sqrt'}. Best is trial 1389 with value: 0.22332552856343169.
[I 2024-12-04 13:44:21,808] Trial 2272 finished with value: 0.2672999819136595 and parameters: {'n_estimators': 1398, 'learning_rate': 0.09132240564100254, 'max_depth': 6, 'min_samples_split': 2, 'min_samples_leaf': 1, 'subsample': 0.8464002134187882, 'max_features': 'log2'}. Best is trial 1389 with value: 0.22332552856343169.
[I 2024-12-04 13:44:27,479] Trial 2282 finished with value: 0.2916115618447771 and parameters: {'n_estimators': 984, 'learning_rate': 0.056916280043663614, 'max_depth': 9, 'min_samples_split': 5, 'min_samples_leaf': 2, 'subsample': 0.8630804199281378, 'max_features': 'sqrt'}. Best is trial 1389 with value: 0.22332552856343169.
[I 2024-12-04 13:44:31,135] Trial 2276 finished with value: 0.38165492699379433 and parameters: {'n_estimators': 1182, 'learning_rate': 0.016438928134708708, 'max_depth': 12, 'min_samples_split': 5, 'min_samples_leaf': 4, 'subsample': 0.6052146102768299, 'max_features': 'sqrt'}. Best is trial 1389 with value: 0.22332552856343169.
[I 2024-12-04 13:44:32,994] Trial 2281 finished with value: 0.24734200751355787 and parameters: {'n_estimators': 1067, 'learning_rate': 0.06324650510822925, 'max_depth': 12, 'min_samples_split': 2, 'min_samples_leaf': 1, 'subsample': 0.6069891165453026, 'max_features': 'sqrt'}. Best is trial 1389 with value: 0.22332552856343169.
[I 2024-12-04 13:44:38,157] Trial 2279 finished with value: 0.23996431413027208 and parameters: {'n_estimators': 1224, 'learning_rate': 0.09044908571116295, 'max_depth': 7, 'min_samples_split': 3, 'min_samples_leaf': 1, 'subsample': 0.8054826813443037, 'max_features': 'sqrt'}. Best is trial 1389 with value: 0.22332552856343169.
[I 2024-12-04 13:44:39,802] Trial 2273 finished with value: 0.28968603736043536 and parameters: {'n_estimators': 1490, 'learning_rate': 0.05039349872890338, 'max_depth': 7, 'min_samples_split': 8, 'min_samples_leaf': 2, 'subsample': 0.8637923801978599, 'max_features': 'sqrt'}. Best is trial 1389 with value: 0.22332552856343169.
[I 2024-12-04 13:44:47,367] Trial 2284 finished with value: 0.24891687298005707 and parameters: {'n_estimators': 1288, 'learning_rate': 0.061744484191941236, 'max_depth': 7, 'min_samples_split': 3, 'min_samples_leaf': 1, 'subsample': 0.9417193878811557, 'max_features': 'sqrt'}. Best is trial 1389 with value: 0.22332552856343169.
[I 2024-12-04 13:44:50,082] Trial 2294 finished with value: 0.23724272910613337 and parameters: {'n_estimators': 950, 'learning_rate': 0.0964023290007567, 'max_depth': 9, 'min_samples_split': 5, 'min_samples_leaf': 1, 'subsample': 0.8193738375787017, 'max_features': 'sqrt'}. Best is trial 1389 with value: 0.22332552856343169.
[I 2024-12-04 13:44:54,038] Trial 2293 finished with value: 0.42928070735694046 and parameters: {'n_estimators': 956, 'learning_rate': 0.04005709070601198, 'max_depth': 11, 'min_samples_split': 17, 'min_samples_leaf': 5, 'subsample': 0.8282873717054687, 'max_features': None}. Best is trial 1389 with value: 0.22332552856343169.
[I 2024-12-04 13:44:56,752] Trial 2287 finished with value: 0.24587858027087373 and parameters: {'n_estimators': 1260, 'learning_rate': 0.09477242268012279, 'max_depth': 6, 'min_samples_split': 2, 'min_samples_leaf': 1, 'subsample': 0.711374439272613, 'max_features': 'sqrt'}. Best is trial 1389 with value: 0.22332552856343169.
[I 2024-12-04 13:45:05,060] Trial 2285 finished with value: 0.23839851176341442 and parameters: {'n_estimators': 1486, 'learning_rate': 0.05916067728532469, 'max_depth': 9, 'min_samples_split': 3, 'min_samples_leaf': 1, 'subsample': 0.6814329121992254, 'max_features': 'sqrt'}. Best is trial 1389 with value: 0.22332552856343169.
[I 2024-12-04 13:45:06,221] Trial 2302 finished with value: 0.40551004617621955 and parameters: {'n_estimators': 766, 'learning_rate': 0.05559569877246776, 'max_depth': 8, 'min_samples_split': 8, 'min_samples_leaf': 3, 'subsample': 0.753129835093684, 'max_features': 'log2'}. Best is trial 1389 with value: 0.22332552856343169.
[I 2024-12-04 13:45:09,908] Trial 2292 finished with value: 0.28365269027772366 and parameters: {'n_estimators': 1287, 'learning_rate': 0.06371199754449053, 'max_depth': 9, 'min_samples_split': 6, 'min_samples_leaf': 2, 'subsample': 0.8191332138548874, 'max_features': 'sqrt'}. Best is trial 1389 with value: 0.22332552856343169.
[I 2024-12-04 13:45:10,100] Trial 2290 finished with value: 0.5005802091519918 and parameters: {'n_estimators': 1330, 'learning_rate': 0.012972112020241422, 'max_depth': 3, 'min_samples_split': 8, 'min_samples_leaf': 1, 'subsample': 0.7281346439892135, 'max_features': 'sqrt'}. Best is trial 1389 with value: 0.22332552856343169.
[I 2024-12-04 13:45:10,438] Trial 2286 finished with value: 0.38905562604475313 and parameters: {'n_estimators': 1457, 'learning_rate': 0.09039052886627365, 'max_depth': 5, 'min_samples_split': 5, 'min_samples_leaf': 5, 'subsample': 0.6239289320005531, 'max_features': 'log2'}. Best is trial 1389 with value: 0.22332552856343169.
[I 2024-12-04 13:45:11,274] Trial 2306 finished with value: 0.35459687501496656 and parameters: {'n_estimators': 747, 'learning_rate': 0.05513324710749971, 'max_depth': 9, 'min_samples_split': 2, 'min_samples_leaf': 3, 'subsample': 0.8672126923621817, 'max_features': 'sqrt'}. Best is trial 1389 with value: 0.22332552856343169.
[I 2024-12-04 13:45:12,840] Trial 2317 finished with value: 1.1467928463368864 and parameters: {'n_estimators': 241, 'learning_rate': 0.03128377303455414, 'max_depth': 11, 'min_samples_split': 8, 'min_samples_leaf': 10, 'subsample': 0.6272387545983613, 'max_features': 'log2'}. Best is trial 1389 with value: 0.22332552856343169.
[I 2024-12-04 13:45:13,114] Trial 2291 finished with value: 0.3610983197916759 and parameters: {'n_estimators': 1315, 'learning_rate': 0.06761641326018306, 'max_depth': 12, 'min_samples_split': 5, 'min_samples_leaf': 3, 'subsample': 0.64007853713687, 'max_features': 'sqrt'}. Best is trial 1389 with value: 0.22332552856343169.
[I 2024-12-04 13:45:14,685] Trial 2289 finished with value: 0.25375911915071475 and parameters: {'n_estimators': 1433, 'learning_rate': 0.04129120217301236, 'max_depth': 8, 'min_samples_split': 2, 'min_samples_leaf': 1, 'subsample': 0.6642762216649369, 'max_features': 'sqrt'}. Best is trial 1389 with value: 0.22332552856343169.
[I 2024-12-04 13:45:15,413] Trial 2296 finished with value: 0.35881748753265713 and parameters: {'n_estimators': 1185, 'learning_rate': 0.07408126081310704, 'max_depth': 7, 'min_samples_split': 3, 'min_samples_leaf': 3, 'subsample': 0.9196414974199248, 'max_features': 'sqrt'}. Best is trial 1389 with value: 0.22332552856343169.
[I 2024-12-04 13:45:23,926] Trial 2298 finished with value: 0.24926303414154874 and parameters: {'n_estimators': 1177, 'learning_rate': 0.09315068660367086, 'max_depth': 10, 'min_samples_split': 2, 'min_samples_leaf': 1, 'subsample': 0.8436970674004327, 'max_features': 'sqrt'}. Best is trial 1389 with value: 0.22332552856343169.
[I 2024-12-04 13:45:24,409] Trial 2297 finished with value: 0.3365703128658658 and parameters: {'n_estimators': 1338, 'learning_rate': 0.07355140409081713, 'max_depth': 5, 'min_samples_split': 3, 'min_samples_leaf': 3, 'subsample': 0.9730794166495749, 'max_features': 'sqrt'}. Best is trial 1389 with value: 0.22332552856343169.
[I 2024-12-04 13:45:29,462] Trial 2295 finished with value: 0.24317980321713958 and parameters: {'n_estimators': 1469, 'learning_rate': 0.07558714473882706, 'max_depth': 10, 'min_samples_split': 2, 'min_samples_leaf': 1, 'subsample': 0.6576589835893063, 'max_features': 'sqrt'}. Best is trial 1389 with value: 0.22332552856343169.
[I 2024-12-04 13:45:35,536] Trial 2303 finished with value: 0.3546116947737152 and parameters: {'n_estimators': 1190, 'learning_rate': 0.0945660776887, 'max_depth': 8, 'min_samples_split': 2, 'min_samples_leaf': 3, 'subsample': 0.7850043853853771, 'max_features': 'sqrt'}. Best is trial 1389 with value: 0.22332552856343169.
[I 2024-12-04 13:45:38,741] Trial 2300 finished with value: 0.2625388851532322 and parameters: {'n_estimators': 1337, 'learning_rate': 0.0680859831725821, 'max_depth': 10, 'min_samples_split': 7, 'min_samples_leaf': 1, 'subsample': 0.6630453663200035, 'max_features': 'sqrt'}. Best is trial 1389 with value: 0.22332552856343169.
[I 2024-12-04 13:45:39,241] Trial 2307 finished with value: 0.28693872164942275 and parameters: {'n_estimators': 1115, 'learning_rate': 0.06159534433255051, 'max_depth': 6, 'min_samples_split': 5, 'min_samples_leaf': 2, 'subsample': 0.7217623016437128, 'max_features': 'sqrt'}. Best is trial 1389 with value: 0.22332552856343169.
[I 2024-12-04 13:45:39,283] Trial 2304 finished with value: 0.25153958875654825 and parameters: {'n_estimators': 1173, 'learning_rate': 0.06276263834139444, 'max_depth': 7, 'min_samples_split': 6, 'min_samples_leaf': 1, 'subsample': 0.8433284897636979, 'max_features': 'sqrt'}. Best is trial 1389 with value: 0.22332552856343169.
[I 2024-12-04 13:45:40,243] Trial 2315 finished with value: 0.2876742794687784 and parameters: {'n_estimators': 825, 'learning_rate': 0.0964163843515563, 'max_depth': 7, 'min_samples_split': 4, 'min_samples_leaf': 2, 'subsample': 0.815848751869345, 'max_features': 'sqrt'}. Best is trial 1389 with value: 0.22332552856343169.
[I 2024-12-04 13:45:40,280] Trial 2301 finished with value: 0.35180343019179017 and parameters: {'n_estimators': 1348, 'learning_rate': 0.06786211609071206, 'max_depth': 7, 'min_samples_split': 6, 'min_samples_leaf': 3, 'subsample': 0.8111811063935707, 'max_features': 'sqrt'}. Best is trial 1389 with value: 0.22332552856343169.
[I 2024-12-04 13:45:45,384] Trial 2328 finished with value: 0.5174298323464751 and parameters: {'n_estimators': 229, 'learning_rate': 0.08101986051195108, 'max_depth': 7, 'min_samples_split': 20, 'min_samples_leaf': 2, 'subsample': 0.6860480252351638, 'max_features': 'log2'}. Best is trial 1389 with value: 0.22332552856343169.
[I 2024-12-04 13:45:45,688] Trial 2299 finished with value: 0.2779030367808721 and parameters: {'n_estimators': 1481, 'learning_rate': 0.09011739837894034, 'max_depth': 7, 'min_samples_split': 6, 'min_samples_leaf': 2, 'subsample': 0.7146612615029644, 'max_features': 'sqrt'}. Best is trial 1389 with value: 0.22332552856343169.
[I 2024-12-04 13:45:45,753] Trial 2318 finished with value: 0.25710858792132796 and parameters: {'n_estimators': 741, 'learning_rate': 0.05507181405270362, 'max_depth': 7, 'min_samples_split': 2, 'min_samples_leaf': 1, 'subsample': 0.8588772324003155, 'max_features': 'sqrt'}. Best is trial 1389 with value: 0.22332552856343169.
[I 2024-12-04 13:45:48,732] Trial 2305 finished with value: 0.28076860666700987 and parameters: {'n_estimators': 1247, 'learning_rate': 0.09543388508223079, 'max_depth': 7, 'min_samples_split': 7, 'min_samples_leaf': 1, 'subsample': 0.797257918429225, 'max_features': 'sqrt'}. Best is trial 1389 with value: 0.22332552856343169.
[I 2024-12-04 13:45:52,855] Trial 2308 finished with value: 0.3972230544012645 and parameters: {'n_estimators': 1172, 'learning_rate': 0.08586004703961435, 'max_depth': 6, 'min_samples_split': 3, 'min_samples_leaf': 3, 'subsample': 0.8607527108845991, 'max_features': None}. Best is trial 1389 with value: 0.22332552856343169.
[I 2024-12-04 13:45:53,808] Trial 2321 finished with value: 0.48030656928335175 and parameters: {'n_estimators': 576, 'learning_rate': 0.035756956683820625, 'max_depth': 11, 'min_samples_split': 13, 'min_samples_leaf': 9, 'subsample': 0.8768203929889237, 'max_features': 'sqrt'}. Best is trial 1389 with value: 0.22332552856343169.
[I 2024-12-04 13:45:54,913] Trial 2311 finished with value: 0.347625735612505 and parameters: {'n_estimators': 1240, 'learning_rate': 0.06988505287221972, 'max_depth': 7, 'min_samples_split': 9, 'min_samples_leaf': 3, 'subsample': 0.8365558445096165, 'max_features': 'sqrt'}. Best is trial 1389 with value: 0.22332552856343169.
[I 2024-12-04 13:45:55,376] Trial 2310 finished with value: 0.3619653748910194 and parameters: {'n_estimators': 1223, 'learning_rate': 0.05267464875437652, 'max_depth': 12, 'min_samples_split': 2, 'min_samples_leaf': 3, 'subsample': 0.7136490611132724, 'max_features': 'sqrt'}. Best is trial 1389 with value: 0.22332552856343169.
[I 2024-12-04 13:45:56,716] Trial 2312 finished with value: 0.3380365033424568 and parameters: {'n_estimators': 1236, 'learning_rate': 0.08729207268665624, 'max_depth': 5, 'min_samples_split': 2, 'min_samples_leaf': 3, 'subsample': 0.7132185038550325, 'max_features': 'sqrt'}. Best is trial 1389 with value: 0.22332552856343169.
[I 2024-12-04 13:46:04,490] Trial 2313 finished with value: 0.3433893686764538 and parameters: {'n_estimators': 1282, 'learning_rate': 0.08534722473397344, 'max_depth': 8, 'min_samples_split': 6, 'min_samples_leaf': 3, 'subsample': 0.8997888441942289, 'max_features': 'sqrt'}. Best is trial 2314 with value: 0.22206050798261862.
[I 2024-12-04 13:46:06,439] Trial 2314 finished with value: 0.22206050798261862 and parameters: {'n_estimators': 1271, 'learning_rate': 0.09903733421776957, 'max_depth': 10, 'min_samples_split': 5, 'min_samples_leaf': 1, 'subsample': 0.8770173767036639, 'max_features': 'sqrt'}. Best is trial 2314 with value: 0.22206050798261862.
[I 2024-12-04 13:46:08,090] Trial 2309 finished with value: 0.25963146124979886 and parameters: {'n_estimators': 1493, 'learning_rate': 0.07971886890696009, 'max_depth': 8, 'min_samples_split': 7, 'min_samples_leaf': 1, 'subsample': 0.8762967311406855, 'max_features': 'sqrt'}. Best is trial 2314 with value: 0.22206050798261862.
[I 2024-12-04 13:46:10,119] Trial 2316 finished with value: 0.2663939022802818 and parameters: {'n_estimators': 1283, 'learning_rate': 0.026482508521114837, 'max_depth': 9, 'min_samples_split': 6, 'min_samples_leaf': 1, 'subsample': 0.6378323022912156, 'max_features': 'sqrt'}. Best is trial 2314 with value: 0.22206050798261862.
[I 2024-12-04 13:46:16,156] Trial 2339 finished with value: 0.49021345866131616 and parameters: {'n_estimators': 133, 'learning_rate': 0.035905598989769444, 'max_depth': 12, 'min_samples_split': 16, 'min_samples_leaf': 9, 'subsample': 0.992078697886173, 'max_features': None}. Best is trial 2314 with value: 0.22206050798261862.
[I 2024-12-04 13:46:18,882] Trial 2319 finished with value: 0.25133899844356894 and parameters: {'n_estimators': 1326, 'learning_rate': 0.0726451972017284, 'max_depth': 9, 'min_samples_split': 8, 'min_samples_leaf': 1, 'subsample': 0.9856620311985951, 'max_features': 'sqrt'}. Best is trial 2314 with value: 0.22206050798261862.
[I 2024-12-04 13:46:20,782] Trial 2333 finished with value: 0.536125175854537 and parameters: {'n_estimators': 705, 'learning_rate': 0.010599574374202626, 'max_depth': 6, 'min_samples_split': 17, 'min_samples_leaf': 4, 'subsample': 0.7213490530028126, 'max_features': 'sqrt'}. Best is trial 2314 with value: 0.22206050798261862.
[I 2024-12-04 13:46:29,245] Trial 2329 finished with value: 0.27062683556151856 and parameters: {'n_estimators': 957, 'learning_rate': 0.07982702581071234, 'max_depth': 7, 'min_samples_split': 6, 'min_samples_leaf': 1, 'subsample': 0.6610120595556718, 'max_features': 'sqrt'}. Best is trial 2314 with value: 0.22206050798261862.
[I 2024-12-04 13:46:29,261] Trial 2330 finished with value: 0.25469568743064414 and parameters: {'n_estimators': 931, 'learning_rate': 0.09026956332786669, 'max_depth': 8, 'min_samples_split': 2, 'min_samples_leaf': 1, 'subsample': 0.8599737564037888, 'max_features': 'sqrt'}. Best is trial 2314 with value: 0.22206050798261862.
[I 2024-12-04 13:46:31,867] Trial 2320 finished with value: 0.2656826475315689 and parameters: {'n_estimators': 1439, 'learning_rate': 0.06368776750142467, 'max_depth': 5, 'min_samples_split': 3, 'min_samples_leaf': 1, 'subsample': 0.7182301779633449, 'max_features': 'sqrt'}. Best is trial 2314 with value: 0.22206050798261862.
[I 2024-12-04 13:46:31,950] Trial 2334 finished with value: 0.2529074472549779 and parameters: {'n_estimators': 732, 'learning_rate': 0.09732272123726411, 'max_depth': 9, 'min_samples_split': 6, 'min_samples_leaf': 1, 'subsample': 0.6632737241420011, 'max_features': 'sqrt'}. Best is trial 2314 with value: 0.22206050798261862.
[I 2024-12-04 13:46:37,796] Trial 2332 finished with value: 0.3797239872306874 and parameters: {'n_estimators': 945, 'learning_rate': 0.04917273680609053, 'max_depth': 9, 'min_samples_split': 7, 'min_samples_leaf': 5, 'subsample': 0.8583128412890925, 'max_features': 'sqrt'}. Best is trial 2314 with value: 0.22206050798261862.
[I 2024-12-04 13:46:44,098] Trial 2324 finished with value: 0.25975870068223345 and parameters: {'n_estimators': 1279, 'learning_rate': 0.039856014168926646, 'max_depth': 11, 'min_samples_split': 7, 'min_samples_leaf': 1, 'subsample': 0.7010469964290023, 'max_features': 'sqrt'}. Best is trial 2314 with value: 0.22206050798261862.
[I 2024-12-04 13:46:44,195] Trial 2322 finished with value: 0.3745604332639251 and parameters: {'n_estimators': 1462, 'learning_rate': 0.04995391853906609, 'max_depth': 7, 'min_samples_split': 2, 'min_samples_leaf': 4, 'subsample': 0.7244913765147045, 'max_features': 'log2'}. Best is trial 2314 with value: 0.22206050798261862.
