[I 2024-12-04 14:55:13,279] Trial 73 finished with value: 0.4883034191928714 and parameters: {'kernel_type': 'Matern', 'length_scale': 162.2982793071582, 'noise_level': 0.10760346062049667, 'constant_value': 0.1116258505192334, 'nu': 0.5}. Best is trial 65 with value: 0.4883033203991969.
[I 2024-12-04 14:55:14,013] Trial 78 finished with value: 1.2401112325874588 and parameters: {'kernel_type': 'Matern', 'length_scale': 2466.0394214752787, 'noise_level': 2.5271407809190024e-06, 'constant_value': 0.10793616402611761, 'nu': 0.5}. Best is trial 65 with value: 0.4883033203991969.
[I 2024-12-04 14:55:14,059] Trial 80 finished with value: 1.240111232584094 and parameters: {'kernel_type': 'RBF', 'length_scale': 0.03910927444326031, 'noise_level': 0.008798224159655253, 'constant_value': 1.4529019033415532e-07, 'nu': 0.5}. Best is trial 65 with value: 0.4883033203991969.
[I 2024-12-04 14:55:17,380] Trial 77 finished with value: 0.4883034414444192 and parameters: {'kernel_type': 'Matern', 'length_scale': 453.46725820241716, 'noise_level': 0.7555462905855143, 'constant_value': 29.652561890971672, 'nu': 0.5}. Best is trial 65 with value: 0.4883033203991969.
[I 2024-12-04 14:55:18,851] Trial 70 finished with value: 1.240111232475487 and parameters: {'kernel_type': 'Matern', 'length_scale': 0.037151911877391135, 'noise_level': 0.001817378266074884, 'constant_value': 7.046291651578765e-05, 'nu': 0.5}. Best is trial 72 with value: 0.4883032434011174.
[I 2024-12-04 14:55:18,882] Trial 72 finished with value: 0.4883032434011174 and parameters: {'kernel_type': 'Matern', 'length_scale': 6.060065415721755, 'noise_level': 0.0024930071962354656, 'constant_value': 0.8909831247386172, 'nu': 0.5}. Best is trial 72 with value: 0.4883032434011174.
[I 2024-12-04 14:55:20,154] Trial 82 finished with value: 0.4883034131377049 and parameters: {'kernel_type': 'Matern', 'length_scale': 0.21279363702172055, 'noise_level': 1.4930305566215125e-05, 'constant_value': 0.07294096905678756, 'nu': 0.5}. Best is trial 72 with value: 0.4883032434011174.
[I 2024-12-04 14:55:20,317] Trial 88 finished with value: 1.2614546955737087 and parameters: {'kernel_type': 'Matern', 'length_scale': 1.074952272516727, 'noise_level': 3.7032952384368996e-08, 'constant_value': 95.83759992346094, 'nu': 0.5}. Best is trial 72 with value: 0.4883032434011174.
[I 2024-12-04 14:55:20,329] Trial 85 finished with value: 0.48830345669996794 and parameters: {'kernel_type': 'Matern', 'length_scale': 144.54990089352373, 'noise_level': 0.5779084919762507, 'constant_value': 120.39714087643033, 'nu': 0.5}. Best is trial 72 with value: 0.4883032434011174.
[I 2024-12-04 14:55:22,503] Trial 76 finished with value: 1.2401112325791115 and parameters: {'kernel_type': 'RBF', 'length_scale': 6586.799144233004, 'noise_level': 1.1295075878785794e-10, 'constant_value': 0.009654840129693953, 'nu': 1.5}. Best is trial 72 with value: 0.4883032434011174.
[I 2024-12-04 14:55:23,293] Trial 83 finished with value: 0.48830336850141587 and parameters: {'kernel_type': 'Matern', 'length_scale': 253.63835848564466, 'noise_level': 0.0002428174240997304, 'constant_value': 5.945357570905334, 'nu': 0.5}. Best is trial 72 with value: 0.4883032434011174.
[I 2024-12-04 14:55:23,716] Trial 87 finished with value: 1.2401112325236479 and parameters: {'kernel_type': 'Matern', 'length_scale': 5.125661184915912, 'noise_level': 3.9866771652534586e-07, 'constant_value': 0.08708883648000518, 'nu': 0.5}. Best is trial 72 with value: 0.4883032434011174.
[I 2024-12-04 14:55:24,125] Trial 84 finished with value: 1.2401112325131658 and parameters: {'kernel_type': 'RBF', 'length_scale': 29.28120753463641, 'noise_level': 7.051335542554722e-07, 'constant_value': 0.7788851496644779, 'nu': 0.5}. Best is trial 72 with value: 0.4883032434011174.
[I 2024-12-04 14:55:24,307] Trial 90 finished with value: 1.2401112322266505 and parameters: {'kernel_type': 'RBF', 'length_scale': 236.9891278836, 'noise_level': 2.1914899191185065e-10, 'constant_value': 866.8024782196467, 'nu': 2.5}. Best is trial 72 with value: 0.4883032434011174.
[I 2024-12-04 14:55:25,020] Trial 89 finished with value: 0.48830335351897264 and parameters: {'kernel_type': 'Matern', 'length_scale': 3.2608515913908698, 'noise_level': 0.16946118992872441, 'constant_value': 7863.716430573491, 'nu': 0.5}. Best is trial 72 with value: 0.4883032434011174.
[I 2024-12-04 14:55:25,629] Trial 101 finished with value: 1.261454797498116 and parameters: {'kernel_type': 'Matern', 'length_scale': 55998.88965624567, 'noise_level': 1.2830463926683545e-06, 'constant_value': 4.121262336761387e-06, 'nu': 2.5}. Best is trial 72 with value: 0.4883032434011174.
[I 2024-12-04 14:55:25,640] Trial 92 finished with value: 0.48830347355152287 and parameters: {'kernel_type': 'Matern', 'length_scale': 5.555870630260834, 'noise_level': 0.007758953255408924, 'constant_value': 6.682518587003824, 'nu': 0.5}. Best is trial 72 with value: 0.4883032434011174.
[I 2024-12-04 14:55:25,642] Trial 94 finished with value: 0.48830365105096174 and parameters: {'kernel_type': 'Matern', 'length_scale': 0.4671860752577084, 'noise_level': 0.06794972914853442, 'constant_value': 0.26311638085357486, 'nu': 0.5}. Best is trial 72 with value: 0.4883032434011174.
[I 2024-12-04 14:55:26,133] Trial 97 finished with value: 1.2401112325817274 and parameters: {'kernel_type': 'Matern', 'length_scale': 37.98737760150026, 'noise_level': 0.0004352465952852522, 'constant_value': 0.0008940081996077485, 'nu': 0.5}. Best is trial 72 with value: 0.4883032434011174.
[I 2024-12-04 14:55:26,703] Trial 95 finished with value: 0.48830334255609387 and parameters: {'kernel_type': 'Matern', 'length_scale': 2.4860210422801523, 'noise_level': 0.008890251710278315, 'constant_value': 0.25068912889329237, 'nu': 0.5}. Best is trial 72 with value: 0.4883032434011174.
[I 2024-12-04 14:55:27,927] Trial 86 finished with value: 1.2401112297734704 and parameters: {'kernel_type': 'Matern', 'length_scale': 682.7729632131138, 'noise_level': 0.015233038324203226, 'constant_value': 1.2872928566446813, 'nu': 2.5}. Best is trial 72 with value: 0.4883032434011174.
[I 2024-12-04 14:55:28,191] Trial 93 finished with value: 0.5663937108963938 and parameters: {'kernel_type': 'Matern', 'length_scale': 2513.3494914823277, 'noise_level': 0.3033183306984079, 'constant_value': 40218.71194241314, 'nu': 2.5}. Best is trial 72 with value: 0.4883032434011174.
[I 2024-12-04 14:55:28,386] Trial 99 finished with value: 1.240111241889494 and parameters: {'kernel_type': 'RBF', 'length_scale': 0.009897722595296756, 'noise_level': 2.3181767847588543e-10, 'constant_value': 5.260018978945957e-05, 'nu': 2.5}. Best is trial 72 with value: 0.4883032434011174.
[I 2024-12-04 14:55:28,979] Trial 98 finished with value: 1.2614543702006558 and parameters: {'kernel_type': 'RBF', 'length_scale': 0.0014856599733095717, 'noise_level': 0.000448347175084992, 'constant_value': 59508.87403039998, 'nu': 1.5}. Best is trial 72 with value: 0.4883032434011174.
[I 2024-12-04 14:55:29,974] Trial 106 finished with value: 1.240111232610272 and parameters: {'kernel_type': 'Matern', 'length_scale': 9.669588399121928e-05, 'noise_level': 8.885794714518117e-09, 'constant_value': 0.003460809881158038, 'nu': 0.5}. Best is trial 72 with value: 0.4883032434011174.
[I 2024-12-04 14:55:30,461] Trial 104 finished with value: 1.2401112325800836 and parameters: {'kernel_type': 'RBF', 'length_scale': 854.2835606613187, 'noise_level': 0.0012673595837617996, 'constant_value': 115.00218742669551, 'nu': 0.5}. Best is trial 72 with value: 0.4883032434011174.
[I 2024-12-04 14:55:30,684] Trial 102 finished with value: 1.261454708344435 and parameters: {'kernel_type': 'Matern', 'length_scale': 0.4913376227914551, 'noise_level': 0.02212506271744174, 'constant_value': 99640.66924391333, 'nu': 0.5}. Best is trial 72 with value: 0.4883032434011174.
[I 2024-12-04 14:55:30,687] Trial 107 finished with value: 0.4883034116992369 and parameters: {'kernel_type': 'Matern', 'length_scale': 11.268110066150381, 'noise_level': 0.772640859649631, 'constant_value': 16727.444507679957, 'nu': 0.5}. Best is trial 72 with value: 0.4883032434011174.
[I 2024-12-04 14:55:31,581] Trial 110 finished with value: 1.24011123215504 and parameters: {'kernel_type': 'RBF', 'length_scale': 10491.906170324055, 'noise_level': 0.0015263233986548966, 'constant_value': 91421.67067498322, 'nu': 2.5}. Best is trial 72 with value: 0.4883032434011174.
[I 2024-12-04 14:55:31,681] Trial 100 finished with value: 1.2401112327761932 and parameters: {'kernel_type': 'Matern', 'length_scale': 860.0302643768223, 'noise_level': 0.0034034942610603543, 'constant_value': 3.2492252192786553, 'nu': 0.5}. Best is trial 72 with value: 0.4883032434011174.
[I 2024-12-04 14:55:31,686] Trial 96 finished with value: 0.48830343701225914 and parameters: {'kernel_type': 'Matern', 'length_scale': 0.14874734087007888, 'noise_level': 0.33530781094630946, 'constant_value': 376.7827264113664, 'nu': 0.5}. Best is trial 72 with value: 0.4883032434011174.
[I 2024-12-04 14:55:32,189] Trial 103 finished with value: 1.240111232426651 and parameters: {'kernel_type': 'Matern', 'length_scale': 3034.5800586188875, 'noise_level': 8.708636692881903e-05, 'constant_value': 1.2211853016202356, 'nu': 0.5}. Best is trial 72 with value: 0.4883032434011174.
[I 2024-12-04 14:55:32,483] Trial 109 finished with value: 1.2401112322752557 and parameters: {'kernel_type': 'Matern', 'length_scale': 8.922395640793857, 'noise_level': 0.0004171055609596676, 'constant_value': 0.23447974675402797, 'nu': 2.5}. Best is trial 72 with value: 0.4883032434011174.
[I 2024-12-04 14:55:33,446] Trial 108 finished with value: 1.261454795394147 and parameters: {'kernel_type': 'Matern', 'length_scale': 2.829255729219126, 'noise_level': 0.025918741475018752, 'constant_value': 403.7857099097833, 'nu': 0.5}. Best is trial 72 with value: 0.4883032434011174.
[I 2024-12-04 14:55:34,501] Trial 105 finished with value: 0.48830342860296844 and parameters: {'kernel_type': 'Matern', 'length_scale': 2.9399349629155282, 'noise_level': 0.00048549505626350326, 'constant_value': 0.36114436146814616, 'nu': 0.5}. Best is trial 72 with value: 0.4883032434011174.
[I 2024-12-04 14:55:36,309] Trial 112 finished with value: 1.2401112325210466 and parameters: {'kernel_type': 'Matern', 'length_scale': 20485.038208947575, 'noise_level': 1.739092129253486e-05, 'constant_value': 1.799149296388574, 'nu': 1.5}. Best is trial 72 with value: 0.4883032434011174.
[I 2024-12-04 14:55:37,437] Trial 122 finished with value: 1.2401112325832984 and parameters: {'kernel_type': 'Matern', 'length_scale': 0.0009162517915321633, 'noise_level': 0.24125478719660545, 'constant_value': 169.578775906069, 'nu': 1.5}. Best is trial 72 with value: 0.4883032434011174.
[I 2024-12-04 14:55:37,448] Trial 120 finished with value: 0.4883034188758875 and parameters: {'kernel_type': 'Matern', 'length_scale': 0.4589514445060709, 'noise_level': 0.0256414203891975, 'constant_value': 0.0004687572734851702, 'nu': 0.5}. Best is trial 72 with value: 0.4883032434011174.
[I 2024-12-04 14:55:40,740] Trial 117 finished with value: 1.2614543702018493 and parameters: {'kernel_type': 'Matern', 'length_scale': 1.0653824266548946e-05, 'noise_level': 0.0003743940506033497, 'constant_value': 6352.954419135794, 'nu': 2.5}. Best is trial 72 with value: 0.4883032434011174.
[I 2024-12-04 14:55:40,752] Trial 91 finished with value: 0.48830332473288857 and parameters: {'kernel_type': 'Matern', 'length_scale': 139.63625390246494, 'noise_level': 0.0029398548516931904, 'constant_value': 26.073234911051358, 'nu': 0.5}. Best is trial 72 with value: 0.4883032434011174.
[I 2024-12-04 14:55:41,031] Trial 111 finished with value: 1.2401112326054597 and parameters: {'kernel_type': 'Matern', 'length_scale': 92798.32238921052, 'noise_level': 0.005411321483074151, 'constant_value': 8.08881924668015, 'nu': 0.5}. Best is trial 72 with value: 0.4883032434011174.
[I 2024-12-04 14:55:41,305] Trial 115 finished with value: 1.240111232734046 and parameters: {'kernel_type': 'RBF', 'length_scale': 1.1416895995054696e-05, 'noise_level': 8.380531480310173e-05, 'constant_value': 0.0015695038475819283, 'nu': 1.5}. Best is trial 72 with value: 0.4883032434011174.
[I 2024-12-04 14:55:42,177] Trial 116 finished with value: 1.2401112325565307 and parameters: {'kernel_type': 'Matern', 'length_scale': 39.93573711036899, 'noise_level': 2.1924487241062024e-05, 'constant_value': 0.0020664095756916037, 'nu': 1.5}. Best is trial 72 with value: 0.4883032434011174.
[I 2024-12-04 14:55:42,778] Trial 125 finished with value: 0.4883034420961986 and parameters: {'kernel_type': 'Matern', 'length_scale': 148.91303873572232, 'noise_level': 0.000267510357812892, 'constant_value': 937.5619362758089, 'nu': 0.5}. Best is trial 72 with value: 0.4883032434011174.
[I 2024-12-04 14:55:43,083] Trial 127 finished with value: 0.644385356013343 and parameters: {'kernel_type': 'RBF', 'length_scale': 26.502388846302107, 'noise_level': 0.8193055468184559, 'constant_value': 74.02629473605953, 'nu': 0.5}. Best is trial 72 with value: 0.4883032434011174.
[I 2024-12-04 14:55:43,299] Trial 124 finished with value: 0.4883034316786005 and parameters: {'kernel_type': 'Matern', 'length_scale': 10.805168564088499, 'noise_level': 0.03291044106227312, 'constant_value': 5.245555327203931, 'nu': 0.5}. Best is trial 72 with value: 0.4883032434011174.
[I 2024-12-04 14:55:43,736] Trial 114 finished with value: 1.2401112340321143 and parameters: {'kernel_type': 'Matern', 'length_scale': 1.9828686263599794e-05, 'noise_level': 0.0004487380678238374, 'constant_value': 0.3766450562381092, 'nu': 0.5}. Best is trial 72 with value: 0.4883032434011174.
[I 2024-12-04 14:55:43,818] Trial 118 finished with value: 1.2401112342501537 and parameters: {'kernel_type': 'Matern', 'length_scale': 164.69002745435745, 'noise_level': 0.0056662030239839015, 'constant_value': 0.09380831324535559, 'nu': 0.5}. Best is trial 72 with value: 0.4883032434011174.
[I 2024-12-04 14:55:44,051] Trial 121 finished with value: 0.48830340708647785 and parameters: {'kernel_type': 'Matern', 'length_scale': 219.23515691430174, 'noise_level': 0.0011453457018494552, 'constant_value': 25.12940705463975, 'nu': 0.5}. Best is trial 72 with value: 0.4883032434011174.
[I 2024-12-04 14:55:44,249] Trial 119 finished with value: 1.2401112321616026 and parameters: {'kernel_type': 'RBF', 'length_scale': 5897.250862698245, 'noise_level': 0.00022143430419294393, 'constant_value': 0.0036366831593694325, 'nu': 1.5}. Best is trial 72 with value: 0.4883032434011174.
[I 2024-12-04 14:55:45,789] Trial 113 finished with value: 0.48830341537678634 and parameters: {'kernel_type': 'Matern', 'length_scale': 2345.8067853347316, 'noise_level': 0.8376143064653747, 'constant_value': 3.388859660476182, 'nu': 0.5}. Best is trial 72 with value: 0.4883032434011174.
[I 2024-12-04 14:55:45,947] Trial 130 finished with value: 0.4883034358296025 and parameters: {'kernel_type': 'Matern', 'length_scale': 8.747493637770937, 'noise_level': 0.006252746155690504, 'constant_value': 0.20902639050302804, 'nu': 0.5}. Best is trial 72 with value: 0.4883032434011174.
[I 2024-12-04 14:55:46,390] Trial 132 finished with value: 1.2401112272406196 and parameters: {'kernel_type': 'RBF', 'length_scale': 0.025378288670971038, 'noise_level': 4.132684199147024e-06, 'constant_value': 4.361896577707724e-07, 'nu': 1.5}. Best is trial 72 with value: 0.4883032434011174.
[I 2024-12-04 14:55:46,704] Trial 128 finished with value: 0.48830341664123805 and parameters: {'kernel_type': 'Matern', 'length_scale': 10131.759952480814, 'noise_level': 0.9436577292526686, 'constant_value': 30.22321207023883, 'nu': 0.5}. Best is trial 72 with value: 0.4883032434011174.
[I 2024-12-04 14:55:47,018] Trial 135 finished with value: 0.488303686041088 and parameters: {'kernel_type': 'Matern', 'length_scale': 171.02294099496834, 'noise_level': 0.01945655547747055, 'constant_value': 433.20376621647165, 'nu': 0.5}. Best is trial 72 with value: 0.4883032434011174.
[I 2024-12-04 14:55:48,569] Trial 133 finished with value: 0.4883034178866958 and parameters: {'kernel_type': 'Matern', 'length_scale': 8.380945760215457, 'noise_level': 0.002937584975364109, 'constant_value': 10.51817375147005, 'nu': 0.5}. Best is trial 72 with value: 0.4883032434011174.
[I 2024-12-04 14:55:48,857] Trial 131 finished with value: 1.2614518328303987 and parameters: {'kernel_type': 'Matern', 'length_scale': 0.4161894077651328, 'noise_level': 0.00011975149879618354, 'constant_value': 5.837445351617323, 'nu': 0.5}. Best is trial 72 with value: 0.4883032434011174.
[I 2024-12-04 14:55:50,000] Trial 143 finished with value: 1.261454747037611 and parameters: {'kernel_type': 'Matern', 'length_scale': 10.117505975439387, 'noise_level': 1.3140354575444328e-06, 'constant_value': 46.18612518775317, 'nu': 0.5}. Best is trial 72 with value: 0.4883032434011174.
[I 2024-12-04 14:55:50,463] Trial 138 finished with value: 0.5273056337034123 and parameters: {'kernel_type': 'Matern', 'length_scale': 0.9433279965284396, 'noise_level': 0.08746059733677161, 'constant_value': 7406.350621949393, 'nu': 1.5}. Best is trial 134 with value: 0.4883028873262967.
[I 2024-12-04 14:55:50,618] Trial 136 finished with value: 1.2401112330691049 and parameters: {'kernel_type': 'RBF', 'length_scale': 42681.7047258477, 'noise_level': 6.994370891191138e-06, 'constant_value': 0.35415248563989277, 'nu': 2.5}. Best is trial 134 with value: 0.4883028873262967.
[I 2024-12-04 14:55:50,650] Trial 137 finished with value: 1.240111232381295 and parameters: {'kernel_type': 'Matern', 'length_scale': 150.6855732952953, 'noise_level': 9.49205856988388e-05, 'constant_value': 28.77626682656209, 'nu': 1.5}. Best is trial 134 with value: 0.4883028873262967.
[I 2024-12-04 14:55:51,238] Trial 129 finished with value: 1.2614547790747204 and parameters: {'kernel_type': 'Matern', 'length_scale': 110.01986341688634, 'noise_level': 6.358196637886074e-05, 'constant_value': 61.47380844022114, 'nu': 0.5}. Best is trial 134 with value: 0.4883028873262967.
[I 2024-12-04 14:55:51,443] Trial 141 finished with value: 1.2614547953941473 and parameters: {'kernel_type': 'Matern', 'length_scale': 10.91717308762192, 'noise_level': 0.03430011700162361, 'constant_value': 1291.30983278483, 'nu': 0.5}. Best is trial 134 with value: 0.4883028873262967.
[I 2024-12-04 14:55:52,079] Trial 134 finished with value: 0.4883028873262967 and parameters: {'kernel_type': 'Matern', 'length_scale': 38205.43979724109, 'noise_level': 0.1731425629803303, 'constant_value': 25643.44165775766, 'nu': 0.5}. Best is trial 134 with value: 0.4883028873262967.
[I 2024-12-04 14:55:53,566] Trial 140 finished with value: 0.6443853515661091 and parameters: {'kernel_type': 'RBF', 'length_scale': 14109.803717229523, 'noise_level': 0.1603967802196986, 'constant_value': 28035.461999147123, 'nu': 0.5}. Best is trial 134 with value: 0.4883028873262967.
[I 2024-12-04 14:55:53,938] Trial 126 finished with value: 0.48830342808401206 and parameters: {'kernel_type': 'Matern', 'length_scale': 21.36435533703912, 'noise_level': 0.010944596054631444, 'constant_value': 3593.4851709497484, 'nu': 0.5}. Best is trial 134 with value: 0.4883028873262967.
[I 2024-12-04 14:55:54,756] Trial 148 finished with value: 0.4883034068379067 and parameters: {'kernel_type': 'Matern', 'length_scale': 49.245926824097594, 'noise_level': 0.01627766396288804, 'constant_value': 4.45525910484423, 'nu': 0.5}. Best is trial 134 with value: 0.4883028873262967.
[I 2024-12-04 14:55:56,515] Trial 123 finished with value: 0.48830342688145734 and parameters: {'kernel_type': 'Matern', 'length_scale': 0.7771308776339615, 'noise_level': 0.0008596791905198998, 'constant_value': 9.862408328099055e-06, 'nu': 0.5}. Best is trial 134 with value: 0.4883028873262967.
[I 2024-12-04 14:55:56,846] Trial 139 finished with value: 0.4883034192340167 and parameters: {'kernel_type': 'Matern', 'length_scale': 81.56488640228467, 'noise_level': 0.00019470359010272163, 'constant_value': 9.88446292947546, 'nu': 0.5}. Best is trial 134 with value: 0.4883028873262967.
[I 2024-12-04 14:55:57,211] Trial 153 finished with value: 1.2401112317819483 and parameters: {'kernel_type': 'RBF', 'length_scale': 0.0048841208344632325, 'noise_level': 0.22690833878258468, 'constant_value': 1760.4387043580682, 'nu': 2.5}. Best is trial 134 with value: 0.4883028873262967.
[I 2024-12-04 14:55:57,255] Trial 144 finished with value: 0.48830341580195974 and parameters: {'kernel_type': 'Matern', 'length_scale': 13046.199077353443, 'noise_level': 0.7404890165436605, 'constant_value': 7373.824540821845, 'nu': 0.5}. Best is trial 134 with value: 0.4883028873262967.
[I 2024-12-04 14:55:57,698] Trial 151 finished with value: 0.48830341954287976 and parameters: {'kernel_type': 'Matern', 'length_scale': 90771.34072973407, 'noise_level': 0.0034931460142486022, 'constant_value': 9885.814974626377, 'nu': 0.5}. Best is trial 134 with value: 0.4883028873262967.
[I 2024-12-04 14:55:58,229] Trial 147 finished with value: 1.2401112324642383 and parameters: {'kernel_type': 'RBF', 'length_scale': 169.43691715639565, 'noise_level': 4.674520170153821e-10, 'constant_value': 0.00026250243017693706, 'nu': 0.5}. Best is trial 134 with value: 0.4883028873262967.
[I 2024-12-04 14:55:59,442] Trial 150 finished with value: 0.488301845184712 and parameters: {'kernel_type': 'Matern', 'length_scale': 80781.85144446745, 'noise_level': 0.23087110488375723, 'constant_value': 18165.901862688515, 'nu': 0.5}. Best is trial 150 with value: 0.488301845184712.
[I 2024-12-04 14:55:59,697] Trial 145 finished with value: 1.2614547685420503 and parameters: {'kernel_type': 'Matern', 'length_scale': 3.2428575709767977, 'noise_level': 9.206409631524518e-08, 'constant_value': 2.3821560005504145, 'nu': 2.5}. Best is trial 150 with value: 0.488301845184712.
