[I 2024-12-04 12:19:54,644] Trial 1915 finished with value: 0.5236526471983175 and parameters: {'n_estimators': 339, 'max_depth': 40, 'min_samples_split': 33, 'min_samples_leaf': 11, 'max_features': None, 'bootstrap': False, 'criterion': 'absolute_error'}. Best is trial 341 with value: 0.2909369124469028.
[I 2024-12-04 12:19:55,573] Trial 1933 finished with value: 0.44630333730404953 and parameters: {'n_estimators': 707, 'max_depth': 40, 'min_samples_split': 2, 'min_samples_leaf': 2, 'max_features': 'sqrt', 'bootstrap': False, 'criterion': 'squared_error'}. Best is trial 341 with value: 0.2909369124469028.
[I 2024-12-04 12:19:57,255] Trial 1924 finished with value: 0.2984894613772476 and parameters: {'n_estimators': 616, 'max_depth': 50, 'min_samples_split': 2, 'min_samples_leaf': 1, 'max_features': 'sqrt', 'bootstrap': False, 'criterion': 'squared_error'}. Best is trial 341 with value: 0.2909369124469028.
[I 2024-12-04 12:19:57,548] Trial 1938 finished with value: 0.31811538890699353 and parameters: {'n_estimators': 353, 'max_depth': 44, 'min_samples_split': 6, 'min_samples_leaf': 1, 'max_features': 'sqrt', 'bootstrap': False, 'criterion': 'squared_error'}. Best is trial 341 with value: 0.2909369124469028.
[I 2024-12-04 12:19:58,478] Trial 1936 finished with value: 0.380497466471926 and parameters: {'n_estimators': 115, 'max_depth': 46, 'min_samples_split': 3, 'min_samples_leaf': 1, 'max_features': None, 'bootstrap': False, 'criterion': 'squared_error'}. Best is trial 341 with value: 0.2909369124469028.
[I 2024-12-04 12:19:59,561] Trial 1939 finished with value: 0.9415552318949092 and parameters: {'n_estimators': 389, 'max_depth': 32, 'min_samples_split': 39, 'min_samples_leaf': 9, 'max_features': 'log2', 'bootstrap': False, 'criterion': 'squared_error'}. Best is trial 341 with value: 0.2909369124469028.
[I 2024-12-04 12:20:00,152] Trial 1926 finished with value: 0.4484966167980329 and parameters: {'n_estimators': 816, 'max_depth': 41, 'min_samples_split': 10, 'min_samples_leaf': 2, 'max_features': 'sqrt', 'bootstrap': False, 'criterion': 'squared_error'}. Best is trial 341 with value: 0.2909369124469028.
[I 2024-12-04 12:20:00,341] Trial 1940 finished with value: 0.31859867792180274 and parameters: {'n_estimators': 250, 'max_depth': 41, 'min_samples_split': 5, 'min_samples_leaf': 1, 'max_features': 'sqrt', 'bootstrap': False, 'criterion': 'squared_error'}. Best is trial 341 with value: 0.2909369124469028.
[I 2024-12-04 12:20:02,945] Trial 1942 finished with value: 0.31220004073379753 and parameters: {'n_estimators': 496, 'max_depth': 44, 'min_samples_split': 5, 'min_samples_leaf': 1, 'max_features': 'sqrt', 'bootstrap': False, 'criterion': 'squared_error'}. Best is trial 341 with value: 0.2909369124469028.
[I 2024-12-04 12:20:06,109] Trial 1953 finished with value: 0.2996215146844043 and parameters: {'n_estimators': 257, 'max_depth': 50, 'min_samples_split': 2, 'min_samples_leaf': 1, 'max_features': 'sqrt', 'bootstrap': False, 'criterion': 'squared_error'}. Best is trial 341 with value: 0.2909369124469028.
[I 2024-12-04 12:20:06,252] Trial 1949 finished with value: 0.3010131266559905 and parameters: {'n_estimators': 644, 'max_depth': 50, 'min_samples_split': 4, 'min_samples_leaf': 1, 'max_features': 'sqrt', 'bootstrap': False, 'criterion': 'squared_error'}. Best is trial 341 with value: 0.2909369124469028.
[I 2024-12-04 12:20:06,474] Trial 1947 finished with value: 0.4437975511085766 and parameters: {'n_estimators': 237, 'max_depth': 45, 'min_samples_split': 7, 'min_samples_leaf': 2, 'max_features': 'sqrt', 'bootstrap': False, 'criterion': 'squared_error'}. Best is trial 341 with value: 0.2909369124469028.
[I 2024-12-04 12:20:07,143] Trial 1950 finished with value: 0.4590591676678764 and parameters: {'n_estimators': 879, 'max_depth': 50, 'min_samples_split': 46, 'min_samples_leaf': 2, 'max_features': 'sqrt', 'bootstrap': False, 'criterion': 'squared_error'}. Best is trial 341 with value: 0.2909369124469028.
[I 2024-12-04 12:20:07,152] Trial 1922 finished with value: 0.416287048514185 and parameters: {'n_estimators': 682, 'max_depth': 50, 'min_samples_split': 3, 'min_samples_leaf': 2, 'max_features': None, 'bootstrap': False, 'criterion': 'squared_error'}. Best is trial 341 with value: 0.2909369124469028.
[I 2024-12-04 12:20:09,593] Trial 1925 finished with value: 0.5063338142824079 and parameters: {'n_estimators': 800, 'max_depth': 32, 'min_samples_split': 9, 'min_samples_leaf': 2, 'max_features': 'sqrt', 'bootstrap': True, 'criterion': 'absolute_error'}. Best is trial 341 with value: 0.2909369124469028.
[I 2024-12-04 12:20:09,731] Trial 1948 finished with value: 0.4476994416421014 and parameters: {'n_estimators': 708, 'max_depth': 40, 'min_samples_split': 6, 'min_samples_leaf': 2, 'max_features': 'sqrt', 'bootstrap': False, 'criterion': 'squared_error'}. Best is trial 341 with value: 0.2909369124469028.
[I 2024-12-04 12:20:09,997] Trial 1941 finished with value: 0.3872029135593684 and parameters: {'n_estimators': 479, 'max_depth': 50, 'min_samples_split': 2, 'min_samples_leaf': 1, 'max_features': None, 'bootstrap': False, 'criterion': 'squared_error'}. Best is trial 341 with value: 0.2909369124469028.
[I 2024-12-04 12:20:10,765] Trial 1956 finished with value: 0.3020808335039844 and parameters: {'n_estimators': 396, 'max_depth': 43, 'min_samples_split': 3, 'min_samples_leaf': 1, 'max_features': 'sqrt', 'bootstrap': False, 'criterion': 'squared_error'}. Best is trial 341 with value: 0.2909369124469028.
[I 2024-12-04 12:20:10,988] Trial 1960 finished with value: 0.29459719988557637 and parameters: {'n_estimators': 104, 'max_depth': 50, 'min_samples_split': 3, 'min_samples_leaf': 1, 'max_features': 'sqrt', 'bootstrap': False, 'criterion': 'squared_error'}. Best is trial 341 with value: 0.2909369124469028.
[I 2024-12-04 12:20:11,859] Trial 1951 finished with value: 0.44290982870171586 and parameters: {'n_estimators': 415, 'max_depth': 43, 'min_samples_split': 4, 'min_samples_leaf': 2, 'max_features': 'sqrt', 'bootstrap': False, 'criterion': 'squared_error'}. Best is trial 341 with value: 0.2909369124469028.
[I 2024-12-04 12:20:11,894] Trial 1944 finished with value: 0.3041326244209879 and parameters: {'n_estimators': 303, 'max_depth': 44, 'min_samples_split': 2, 'min_samples_leaf': 1, 'max_features': 'sqrt', 'bootstrap': False, 'criterion': 'squared_error'}. Best is trial 341 with value: 0.2909369124469028.
[I 2024-12-04 12:20:12,646] Trial 1958 finished with value: 0.44610406023692795 and parameters: {'n_estimators': 112, 'max_depth': 46, 'min_samples_split': 5, 'min_samples_leaf': 2, 'max_features': 'sqrt', 'bootstrap': False, 'criterion': 'squared_error'}. Best is trial 341 with value: 0.2909369124469028.
[I 2024-12-04 12:20:13,220] Trial 1965 finished with value: 0.30478286281475336 and parameters: {'n_estimators': 250, 'max_depth': 50, 'min_samples_split': 5, 'min_samples_leaf': 1, 'max_features': 'sqrt', 'bootstrap': False, 'criterion': 'squared_error'}. Best is trial 341 with value: 0.2909369124469028.
[I 2024-12-04 12:20:13,494] Trial 1954 finished with value: 0.29414762294742786 and parameters: {'n_estimators': 402, 'max_depth': 50, 'min_samples_split': 3, 'min_samples_leaf': 1, 'max_features': 'sqrt', 'bootstrap': False, 'criterion': 'squared_error'}. Best is trial 341 with value: 0.2909369124469028.
[I 2024-12-04 12:20:13,739] Trial 1946 finished with value: 0.3159710726424458 and parameters: {'n_estimators': 728, 'max_depth': 49, 'min_samples_split': 3, 'min_samples_leaf': 1, 'max_features': 'sqrt', 'bootstrap': True, 'criterion': 'squared_error'}. Best is trial 341 with value: 0.2909369124469028.
[I 2024-12-04 12:20:13,911] Trial 1943 finished with value: 0.3102450563901045 and parameters: {'n_estimators': 589, 'max_depth': 42, 'min_samples_split': 2, 'min_samples_leaf': 1, 'max_features': 'sqrt', 'bootstrap': False, 'criterion': 'squared_error'}. Best is trial 341 with value: 0.2909369124469028.
[I 2024-12-04 12:20:14,169] Trial 1961 finished with value: 0.3037337905165447 and parameters: {'n_estimators': 507, 'max_depth': 50, 'min_samples_split': 5, 'min_samples_leaf': 1, 'max_features': 'sqrt', 'bootstrap': False, 'criterion': 'squared_error'}. Best is trial 341 with value: 0.2909369124469028.
[I 2024-12-04 12:20:14,438] Trial 1945 finished with value: 0.2981107013283862 and parameters: {'n_estimators': 497, 'max_depth': 50, 'min_samples_split': 2, 'min_samples_leaf': 1, 'max_features': 'sqrt', 'bootstrap': False, 'criterion': 'squared_error'}. Best is trial 341 with value: 0.2909369124469028.
[I 2024-12-04 12:20:14,440] Trial 1952 finished with value: 0.4020069390781597 and parameters: {'n_estimators': 546, 'max_depth': 45, 'min_samples_split': 3, 'min_samples_leaf': 1, 'max_features': 'log2', 'bootstrap': False, 'criterion': 'squared_error'}. Best is trial 341 with value: 0.2909369124469028.
[I 2024-12-04 12:20:16,950] Trial 1966 finished with value: 0.3167611749764638 and parameters: {'n_estimators': 110, 'max_depth': 42, 'min_samples_split': 5, 'min_samples_leaf': 1, 'max_features': 'sqrt', 'bootstrap': False, 'criterion': 'squared_error'}. Best is trial 341 with value: 0.2909369124469028.
[I 2024-12-04 12:20:17,942] Trial 1962 finished with value: 0.3110181139338824 and parameters: {'n_estimators': 257, 'max_depth': 39, 'min_samples_split': 3, 'min_samples_leaf': 1, 'max_features': 'sqrt', 'bootstrap': False, 'criterion': 'squared_error'}. Best is trial 341 with value: 0.2909369124469028.
[I 2024-12-04 12:20:18,355] Trial 1969 finished with value: 0.3012375024728452 and parameters: {'n_estimators': 210, 'max_depth': 44, 'min_samples_split': 3, 'min_samples_leaf': 1, 'max_features': 'sqrt', 'bootstrap': False, 'criterion': 'squared_error'}. Best is trial 341 with value: 0.2909369124469028.
[I 2024-12-04 12:20:19,893] Trial 1957 finished with value: 0.5615014294829895 and parameters: {'n_estimators': 971, 'max_depth': 26, 'min_samples_split': 5, 'min_samples_leaf': 1, 'max_features': 'log2', 'bootstrap': False, 'criterion': 'squared_error'}. Best is trial 341 with value: 0.2909369124469028.
[I 2024-12-04 12:20:20,117] Trial 1968 finished with value: 0.3006005858414934 and parameters: {'n_estimators': 215, 'max_depth': 42, 'min_samples_split': 3, 'min_samples_leaf': 1, 'max_features': 'sqrt', 'bootstrap': False, 'criterion': 'squared_error'}. Best is trial 341 with value: 0.2909369124469028.
[I 2024-12-04 12:20:20,441] Trial 1964 finished with value: 0.3043117458967409 and parameters: {'n_estimators': 702, 'max_depth': 42, 'min_samples_split': 3, 'min_samples_leaf': 1, 'max_features': 'sqrt', 'bootstrap': False, 'criterion': 'squared_error'}. Best is trial 341 with value: 0.2909369124469028.
[I 2024-12-04 12:20:21,277] Trial 1970 finished with value: 0.44063039437168466 and parameters: {'n_estimators': 328, 'max_depth': 50, 'min_samples_split': 6, 'min_samples_leaf': 2, 'max_features': 'sqrt', 'bootstrap': False, 'criterion': 'squared_error'}. Best is trial 341 with value: 0.2909369124469028.
[I 2024-12-04 12:20:21,571] Trial 1974 finished with value: 0.5675166748423616 and parameters: {'n_estimators': 160, 'max_depth': 41, 'min_samples_split': 39, 'min_samples_leaf': 4, 'max_features': 'sqrt', 'bootstrap': False, 'criterion': 'squared_error'}. Best is trial 341 with value: 0.2909369124469028.
[I 2024-12-04 12:20:22,070] Trial 1963 finished with value: 0.30010426070675345 and parameters: {'n_estimators': 511, 'max_depth': 50, 'min_samples_split': 4, 'min_samples_leaf': 1, 'max_features': 'sqrt', 'bootstrap': False, 'criterion': 'squared_error'}. Best is trial 341 with value: 0.2909369124469028.
[I 2024-12-04 12:20:22,387] Trial 1967 finished with value: 0.3308373489633227 and parameters: {'n_estimators': 635, 'max_depth': 43, 'min_samples_split': 9, 'min_samples_leaf': 1, 'max_features': 'sqrt', 'bootstrap': False, 'criterion': 'squared_error'}. Best is trial 341 with value: 0.2909369124469028.
[I 2024-12-04 12:20:23,336] Trial 1959 finished with value: 0.7546727130255337 and parameters: {'n_estimators': 706, 'max_depth': 18, 'min_samples_split': 17, 'min_samples_leaf': 2, 'max_features': 'log2', 'bootstrap': False, 'criterion': 'absolute_error'}. Best is trial 341 with value: 0.2909369124469028.
[I 2024-12-04 12:20:23,366] Trial 1978 finished with value: 0.30466674555432316 and parameters: {'n_estimators': 271, 'max_depth': 44, 'min_samples_split': 2, 'min_samples_leaf': 1, 'max_features': 'sqrt', 'bootstrap': False, 'criterion': 'squared_error'}. Best is trial 341 with value: 0.2909369124469028.
[I 2024-12-04 12:20:25,376] Trial 1973 finished with value: 0.29628582042413215 and parameters: {'n_estimators': 101, 'max_depth': 48, 'min_samples_split': 4, 'min_samples_leaf': 1, 'max_features': 'sqrt', 'bootstrap': False, 'criterion': 'squared_error'}. Best is trial 341 with value: 0.2909369124469028.
[I 2024-12-04 12:20:25,758] Trial 1975 finished with value: 0.30732267833201615 and parameters: {'n_estimators': 623, 'max_depth': 44, 'min_samples_split': 4, 'min_samples_leaf': 1, 'max_features': 'sqrt', 'bootstrap': False, 'criterion': 'squared_error'}. Best is trial 341 with value: 0.2909369124469028.
[I 2024-12-04 12:20:26,072] Trial 1971 finished with value: 0.29464997828780626 and parameters: {'n_estimators': 315, 'max_depth': 50, 'min_samples_split': 3, 'min_samples_leaf': 1, 'max_features': 'sqrt', 'bootstrap': False, 'criterion': 'squared_error'}. Best is trial 341 with value: 0.2909369124469028.
[I 2024-12-04 12:20:26,099] Trial 1972 finished with value: 0.44428706747882946 and parameters: {'n_estimators': 184, 'max_depth': 50, 'min_samples_split': 3, 'min_samples_leaf': 2, 'max_features': 'sqrt', 'bootstrap': False, 'criterion': 'squared_error'}. Best is trial 341 with value: 0.2909369124469028.
[I 2024-12-04 12:20:27,071] Trial 1980 finished with value: 0.4403148129821077 and parameters: {'n_estimators': 432, 'max_depth': 49, 'min_samples_split': 4, 'min_samples_leaf': 2, 'max_features': 'sqrt', 'bootstrap': False, 'criterion': 'squared_error'}. Best is trial 341 with value: 0.2909369124469028.
[I 2024-12-04 12:20:27,716] Trial 1976 finished with value: 0.3015997522226039 and parameters: {'n_estimators': 581, 'max_depth': 43, 'min_samples_split': 3, 'min_samples_leaf': 1, 'max_features': 'sqrt', 'bootstrap': False, 'criterion': 'squared_error'}. Best is trial 341 with value: 0.2909369124469028.
[I 2024-12-04 12:20:28,950] Trial 1985 finished with value: 0.4436739926556534 and parameters: {'n_estimators': 266, 'max_depth': 50, 'min_samples_split': 4, 'min_samples_leaf': 2, 'max_features': 'sqrt', 'bootstrap': False, 'criterion': 'squared_error'}. Best is trial 341 with value: 0.2909369124469028.
[I 2024-12-04 12:20:29,094] Trial 1979 finished with value: 0.3071013563402126 and parameters: {'n_estimators': 409, 'max_depth': 43, 'min_samples_split': 2, 'min_samples_leaf': 1, 'max_features': 'sqrt', 'bootstrap': False, 'criterion': 'squared_error'}. Best is trial 341 with value: 0.2909369124469028.
[I 2024-12-04 12:20:29,189] Trial 1982 finished with value: 0.29490049060191453 and parameters: {'n_estimators': 275, 'max_depth': 50, 'min_samples_split': 3, 'min_samples_leaf': 1, 'max_features': 'sqrt', 'bootstrap': False, 'criterion': 'squared_error'}. Best is trial 341 with value: 0.2909369124469028.
[I 2024-12-04 12:20:30,430] Trial 1977 finished with value: 0.3050343022491532 and parameters: {'n_estimators': 669, 'max_depth': 50, 'min_samples_split': 5, 'min_samples_leaf': 1, 'max_features': 'sqrt', 'bootstrap': False, 'criterion': 'squared_error'}. Best is trial 341 with value: 0.2909369124469028.
[I 2024-12-04 12:20:31,206] Trial 1981 finished with value: 0.9572458710682752 and parameters: {'n_estimators': 102, 'max_depth': 47, 'min_samples_split': 38, 'min_samples_leaf': 13, 'max_features': 'log2', 'bootstrap': False, 'criterion': 'absolute_error'}. Best is trial 341 with value: 0.2909369124469028.
[I 2024-12-04 12:20:31,298] Trial 1955 finished with value: 0.3207125997475776 and parameters: {'n_estimators': 589, 'max_depth': 43, 'min_samples_split': 4, 'min_samples_leaf': 1, 'max_features': 'sqrt', 'bootstrap': False, 'criterion': 'absolute_error'}. Best is trial 341 with value: 0.2909369124469028.
[I 2024-12-04 12:20:31,786] Trial 1988 finished with value: 0.42391166623344145 and parameters: {'n_estimators': 259, 'max_depth': 42, 'min_samples_split': 2, 'min_samples_leaf': 1, 'max_features': 'log2', 'bootstrap': False, 'criterion': 'squared_error'}. Best is trial 341 with value: 0.2909369124469028.
[I 2024-12-04 12:20:32,226] Trial 1984 finished with value: 0.321196949004428 and parameters: {'n_estimators': 271, 'max_depth': 43, 'min_samples_split': 7, 'min_samples_leaf': 1, 'max_features': 'sqrt', 'bootstrap': False, 'criterion': 'squared_error'}. Best is trial 341 with value: 0.2909369124469028.
[I 2024-12-04 12:20:34,490] Trial 1992 finished with value: 0.4000598032319206 and parameters: {'n_estimators': 155, 'max_depth': 47, 'min_samples_split': 2, 'min_samples_leaf': 1, 'max_features': 'log2', 'bootstrap': False, 'criterion': 'squared_error'}. Best is trial 341 with value: 0.2909369124469028.
[I 2024-12-04 12:20:36,456] Trial 1986 finished with value: 0.30298716624739797 and parameters: {'n_estimators': 368, 'max_depth': 42, 'min_samples_split': 3, 'min_samples_leaf': 1, 'max_features': 'sqrt', 'bootstrap': False, 'criterion': 'squared_error'}. Best is trial 341 with value: 0.2909369124469028.
[I 2024-12-04 12:20:36,464] Trial 1987 finished with value: 0.34237286013034884 and parameters: {'n_estimators': 364, 'max_depth': 32, 'min_samples_split': 3, 'min_samples_leaf': 1, 'max_features': 'sqrt', 'bootstrap': False, 'criterion': 'squared_error'}. Best is trial 341 with value: 0.2909369124469028.
[I 2024-12-04 12:20:36,567] Trial 1990 finished with value: 0.3092554613051707 and parameters: {'n_estimators': 253, 'max_depth': 42, 'min_samples_split': 4, 'min_samples_leaf': 1, 'max_features': 'sqrt', 'bootstrap': False, 'criterion': 'squared_error'}. Best is trial 341 with value: 0.2909369124469028.
[I 2024-12-04 12:20:37,594] Trial 1996 finished with value: 0.2943379913069389 and parameters: {'n_estimators': 220, 'max_depth': 50, 'min_samples_split': 3, 'min_samples_leaf': 1, 'max_features': 'sqrt', 'bootstrap': False, 'criterion': 'squared_error'}. Best is trial 341 with value: 0.2909369124469028.
[I 2024-12-04 12:20:38,195] Trial 1995 finished with value: 0.9593268846518171 and parameters: {'n_estimators': 215, 'max_depth': 48, 'min_samples_split': 10, 'min_samples_leaf': 15, 'max_features': 'log2', 'bootstrap': False, 'criterion': 'squared_error'}. Best is trial 341 with value: 0.2909369124469028.
[I 2024-12-04 12:20:38,215] Trial 1997 finished with value: 0.2995888831040162 and parameters: {'n_estimators': 101, 'max_depth': 50, 'min_samples_split': 2, 'min_samples_leaf': 1, 'max_features': 'sqrt', 'bootstrap': False, 'criterion': 'squared_error'}. Best is trial 341 with value: 0.2909369124469028.
[I 2024-12-04 12:20:38,508] Trial 1991 finished with value: 0.44290924423014816 and parameters: {'n_estimators': 842, 'max_depth': 50, 'min_samples_split': 3, 'min_samples_leaf': 2, 'max_features': 'sqrt', 'bootstrap': False, 'criterion': 'squared_error'}. Best is trial 341 with value: 0.2909369124469028.
[I 2024-12-04 12:20:38,813] Trial 1983 finished with value: 0.30054082750874644 and parameters: {'n_estimators': 578, 'max_depth': 50, 'min_samples_split': 4, 'min_samples_leaf': 1, 'max_features': 'sqrt', 'bootstrap': False, 'criterion': 'squared_error'}. Best is trial 341 with value: 0.2909369124469028.
[I 2024-12-04 12:20:40,910] Trial 1993 finished with value: 0.9577948440275776 and parameters: {'n_estimators': 864, 'max_depth': 32, 'min_samples_split': 12, 'min_samples_leaf': 9, 'max_features': 'log2', 'bootstrap': True, 'criterion': 'squared_error'}. Best is trial 341 with value: 0.2909369124469028.
[I 2024-12-04 12:20:41,040] Trial 1994 finished with value: 0.29991231005542135 and parameters: {'n_estimators': 190, 'max_depth': 50, 'min_samples_split': 4, 'min_samples_leaf': 1, 'max_features': 'sqrt', 'bootstrap': False, 'criterion': 'squared_error'}. Best is trial 341 with value: 0.2909369124469028.
[I 2024-12-04 12:20:41,306] Trial 2000 finished with value: 0.29937089081285073 and parameters: {'n_estimators': 696, 'max_depth': 50, 'min_samples_split': 2, 'min_samples_leaf': 1, 'max_features': 'sqrt', 'bootstrap': False, 'criterion': 'squared_error'}. Best is trial 341 with value: 0.2909369124469028.
[I 2024-12-04 12:20:41,791] Trial 2001 finished with value: 0.2978493241827122 and parameters: {'n_estimators': 387, 'max_depth': 50, 'min_samples_split': 2, 'min_samples_leaf': 1, 'max_features': 'sqrt', 'bootstrap': False, 'criterion': 'squared_error'}. Best is trial 341 with value: 0.2909369124469028.
[I 2024-12-04 12:20:43,415] Trial 2006 finished with value: 0.44249555866392465 and parameters: {'n_estimators': 380, 'max_depth': 42, 'min_samples_split': 2, 'min_samples_leaf': 2, 'max_features': 'sqrt', 'bootstrap': False, 'criterion': 'squared_error'}. Best is trial 341 with value: 0.2909369124469028.
[I 2024-12-04 12:20:43,449] Trial 1916 finished with value: 0.441725124202675 and parameters: {'n_estimators': 299, 'max_depth': 22, 'min_samples_split': 37, 'min_samples_leaf': 1, 'max_features': None, 'bootstrap': False, 'criterion': 'absolute_error'}. Best is trial 341 with value: 0.2909369124469028.
[I 2024-12-04 12:20:43,813] Trial 1989 finished with value: 0.44749408810195684 and parameters: {'n_estimators': 128, 'max_depth': 43, 'min_samples_split': 3, 'min_samples_leaf': 2, 'max_features': 'sqrt', 'bootstrap': False, 'criterion': 'squared_error'}. Best is trial 341 with value: 0.2909369124469028.
