[I 2024-12-04 12:04:49,455] Trial 624 finished with value: 0.5180760307757251 and parameters: {'n_estimators': 362, 'max_depth': 29, 'min_samples_split': 6, 'min_samples_leaf': 1, 'max_features': None, 'bootstrap': True, 'criterion': 'absolute_error'}. Best is trial 306 with value: 0.5054021215392881.
[I 2024-12-04 12:04:49,556] Trial 656 finished with value: 0.5249552928296238 and parameters: {'n_estimators': 109, 'max_depth': 27, 'min_samples_split': 7, 'min_samples_leaf': 1, 'max_features': None, 'bootstrap': True, 'criterion': 'absolute_error'}. Best is trial 306 with value: 0.5054021215392881.
[I 2024-12-04 12:04:49,788] Trial 655 finished with value: 0.5327823412593423 and parameters: {'n_estimators': 218, 'max_depth': 23, 'min_samples_split': 11, 'min_samples_leaf': 1, 'max_features': None, 'bootstrap': True, 'criterion': 'squared_error'}. Best is trial 306 with value: 0.5054021215392881.
[I 2024-12-04 12:04:51,310] Trial 667 finished with value: 1.3698272284712363 and parameters: {'n_estimators': 113, 'max_depth': 34, 'min_samples_split': 26, 'min_samples_leaf': 11, 'max_features': 'log2', 'bootstrap': True, 'criterion': 'absolute_error'}. Best is trial 306 with value: 0.5054021215392881.
[I 2024-12-04 12:04:51,584] Trial 659 finished with value: 0.563668467768832 and parameters: {'n_estimators': 116, 'max_depth': 18, 'min_samples_split': 7, 'min_samples_leaf': 2, 'max_features': None, 'bootstrap': True, 'criterion': 'absolute_error'}. Best is trial 306 with value: 0.5054021215392881.
[I 2024-12-04 12:04:51,710] Trial 662 finished with value: 0.7350894474285958 and parameters: {'n_estimators': 156, 'max_depth': 25, 'min_samples_split': 7, 'min_samples_leaf': 1, 'max_features': 'sqrt', 'bootstrap': True, 'criterion': 'absolute_error'}. Best is trial 306 with value: 0.5054021215392881.
[I 2024-12-04 12:04:51,883] Trial 650 finished with value: 1.0445226867597133 and parameters: {'n_estimators': 541, 'max_depth': 8, 'min_samples_split': 7, 'min_samples_leaf': 1, 'max_features': 'sqrt', 'bootstrap': False, 'criterion': 'absolute_error'}. Best is trial 306 with value: 0.5054021215392881.
[I 2024-12-04 12:04:51,962] Trial 654 finished with value: 0.5504680067970025 and parameters: {'n_estimators': 114, 'max_depth': 5, 'min_samples_split': 2, 'min_samples_leaf': 1, 'max_features': None, 'bootstrap': True, 'criterion': 'absolute_error'}. Best is trial 306 with value: 0.5054021215392881.
[I 2024-12-04 12:04:52,338] Trial 658 finished with value: 0.5153895220250094 and parameters: {'n_estimators': 103, 'max_depth': 16, 'min_samples_split': 3, 'min_samples_leaf': 1, 'max_features': None, 'bootstrap': True, 'criterion': 'absolute_error'}. Best is trial 306 with value: 0.5054021215392881.
[I 2024-12-04 12:04:52,506] Trial 643 finished with value: 0.6462190810033487 and parameters: {'n_estimators': 667, 'max_depth': 50, 'min_samples_split': 2, 'min_samples_leaf': 1, 'max_features': 'log2', 'bootstrap': False, 'criterion': 'absolute_error'}. Best is trial 306 with value: 0.5054021215392881.
[I 2024-12-04 12:04:53,195] Trial 661 finished with value: 0.5070923385919925 and parameters: {'n_estimators': 102, 'max_depth': 17, 'min_samples_split': 5, 'min_samples_leaf': 1, 'max_features': None, 'bootstrap': True, 'criterion': 'absolute_error'}. Best is trial 306 with value: 0.5054021215392881.
[I 2024-12-04 12:04:55,412] Trial 657 finished with value: 0.5076307817949018 and parameters: {'n_estimators': 108, 'max_depth': 17, 'min_samples_split': 5, 'min_samples_leaf': 1, 'max_features': None, 'bootstrap': True, 'criterion': 'absolute_error'}. Best is trial 306 with value: 0.5054021215392881.
[I 2024-12-04 12:04:56,883] Trial 660 finished with value: 0.5553306717306125 and parameters: {'n_estimators': 257, 'max_depth': 15, 'min_samples_split': 4, 'min_samples_leaf': 2, 'max_features': None, 'bootstrap': True, 'criterion': 'absolute_error'}. Best is trial 306 with value: 0.5054021215392881.
[I 2024-12-04 12:04:57,664] Trial 652 finished with value: 0.5586960297641107 and parameters: {'n_estimators': 302, 'max_depth': 20, 'min_samples_split': 5, 'min_samples_leaf': 2, 'max_features': None, 'bootstrap': True, 'criterion': 'absolute_error'}. Best is trial 306 with value: 0.5054021215392881.
[I 2024-12-04 12:04:57,984] Trial 672 finished with value: 0.5610235470410196 and parameters: {'n_estimators': 102, 'max_depth': 10, 'min_samples_split': 5, 'min_samples_leaf': 1, 'max_features': None, 'bootstrap': False, 'criterion': 'absolute_error'}. Best is trial 306 with value: 0.5054021215392881.
[I 2024-12-04 12:04:58,300] Trial 646 finished with value: 0.518914161053642 and parameters: {'n_estimators': 302, 'max_depth': 22, 'min_samples_split': 4, 'min_samples_leaf': 1, 'max_features': None, 'bootstrap': True, 'criterion': 'absolute_error'}. Best is trial 306 with value: 0.5054021215392881.
[I 2024-12-04 12:04:58,363] Trial 665 finished with value: 0.5129841540178642 and parameters: {'n_estimators': 106, 'max_depth': 19, 'min_samples_split': 6, 'min_samples_leaf': 1, 'max_features': None, 'bootstrap': True, 'criterion': 'absolute_error'}. Best is trial 306 with value: 0.5054021215392881.
[I 2024-12-04 12:04:59,408] Trial 653 finished with value: 0.5149184575724447 and parameters: {'n_estimators': 289, 'max_depth': 16, 'min_samples_split': 3, 'min_samples_leaf': 1, 'max_features': None, 'bootstrap': True, 'criterion': 'absolute_error'}. Best is trial 306 with value: 0.5054021215392881.
[I 2024-12-04 12:04:59,540] Trial 669 finished with value: 0.515756990240172 and parameters: {'n_estimators': 108, 'max_depth': 29, 'min_samples_split': 3, 'min_samples_leaf': 1, 'max_features': None, 'bootstrap': True, 'criterion': 'absolute_error'}. Best is trial 306 with value: 0.5054021215392881.
[I 2024-12-04 12:04:59,806] Trial 670 finished with value: 0.5602705258145285 and parameters: {'n_estimators': 110, 'max_depth': 29, 'min_samples_split': 9, 'min_samples_leaf': 2, 'max_features': None, 'bootstrap': True, 'criterion': 'absolute_error'}. Best is trial 306 with value: 0.5054021215392881.
[I 2024-12-04 12:05:00,489] Trial 666 finished with value: 0.92693235340532 and parameters: {'n_estimators': 182, 'max_depth': 17, 'min_samples_split': 7, 'min_samples_leaf': 2, 'max_features': 'sqrt', 'bootstrap': False, 'criterion': 'absolute_error'}. Best is trial 306 with value: 0.5054021215392881.
[I 2024-12-04 12:05:03,287] Trial 663 finished with value: 0.5594599117162133 and parameters: {'n_estimators': 158, 'max_depth': 26, 'min_samples_split': 5, 'min_samples_leaf': 2, 'max_features': None, 'bootstrap': True, 'criterion': 'absolute_error'}. Best is trial 306 with value: 0.5054021215392881.
[I 2024-12-04 12:05:04,964] Trial 680 finished with value: 1.1942668706536497 and parameters: {'n_estimators': 139, 'max_depth': 5, 'min_samples_split': 3, 'min_samples_leaf': 1, 'max_features': 'sqrt', 'bootstrap': True, 'criterion': 'absolute_error'}. Best is trial 306 with value: 0.5054021215392881.
[I 2024-12-04 12:05:05,830] Trial 676 finished with value: 0.5134128755262901 and parameters: {'n_estimators': 101, 'max_depth': 11, 'min_samples_split': 6, 'min_samples_leaf': 1, 'max_features': None, 'bootstrap': True, 'criterion': 'absolute_error'}. Best is trial 306 with value: 0.5054021215392881.
[I 2024-12-04 12:05:07,034] Trial 668 finished with value: 0.5138958949097441 and parameters: {'n_estimators': 114, 'max_depth': 12, 'min_samples_split': 6, 'min_samples_leaf': 1, 'max_features': None, 'bootstrap': True, 'criterion': 'absolute_error'}. Best is trial 306 with value: 0.5054021215392881.
[I 2024-12-04 12:05:07,945] Trial 679 finished with value: 0.514641080745442 and parameters: {'n_estimators': 110, 'max_depth': 8, 'min_samples_split': 5, 'min_samples_leaf': 1, 'max_features': None, 'bootstrap': True, 'criterion': 'absolute_error'}. Best is trial 306 with value: 0.5054021215392881.
[I 2024-12-04 12:05:08,166] Trial 686 finished with value: 0.9435656695162213 and parameters: {'n_estimators': 512, 'max_depth': 11, 'min_samples_split': 25, 'min_samples_leaf': 1, 'max_features': 'sqrt', 'bootstrap': True, 'criterion': 'squared_error'}. Best is trial 306 with value: 0.5054021215392881.
[I 2024-12-04 12:05:08,607] Trial 688 finished with value: 0.5132916331545024 and parameters: {'n_estimators': 101, 'max_depth': 15, 'min_samples_split': 4, 'min_samples_leaf': 1, 'max_features': None, 'bootstrap': True, 'criterion': 'absolute_error'}. Best is trial 306 with value: 0.5054021215392881.
[I 2024-12-04 12:05:08,985] Trial 689 finished with value: 1.1102268620867306 and parameters: {'n_estimators': 150, 'max_depth': 27, 'min_samples_split': 2, 'min_samples_leaf': 2, 'max_features': 'log2', 'bootstrap': False, 'criterion': 'squared_error'}. Best is trial 306 with value: 0.5054021215392881.
[I 2024-12-04 12:05:09,355] Trial 673 finished with value: 1.0274793851449242 and parameters: {'n_estimators': 746, 'max_depth': 9, 'min_samples_split': 2, 'min_samples_leaf': 1, 'max_features': 'sqrt', 'bootstrap': True, 'criterion': 'absolute_error'}. Best is trial 306 with value: 0.5054021215392881.
[I 2024-12-04 12:05:09,478] Trial 674 finished with value: 0.9152217974330765 and parameters: {'n_estimators': 810, 'max_depth': 23, 'min_samples_split': 3, 'min_samples_leaf': 1, 'max_features': 'log2', 'bootstrap': False, 'criterion': 'absolute_error'}. Best is trial 306 with value: 0.5054021215392881.
[I 2024-12-04 12:05:09,479] Trial 687 finished with value: 1.3415567066613965 and parameters: {'n_estimators': 554, 'max_depth': 12, 'min_samples_split': 19, 'min_samples_leaf': 8, 'max_features': 'log2', 'bootstrap': False, 'criterion': 'absolute_error'}. Best is trial 306 with value: 0.5054021215392881.
[I 2024-12-04 12:05:10,002] Trial 678 finished with value: 0.5326393780049781 and parameters: {'n_estimators': 259, 'max_depth': 8, 'min_samples_split': 7, 'min_samples_leaf': 1, 'max_features': None, 'bootstrap': True, 'criterion': 'absolute_error'}. Best is trial 306 with value: 0.5054021215392881.
[I 2024-12-04 12:05:10,824] Trial 685 finished with value: 0.5044782096845337 and parameters: {'n_estimators': 103, 'max_depth': 16, 'min_samples_split': 4, 'min_samples_leaf': 1, 'max_features': None, 'bootstrap': True, 'criterion': 'absolute_error'}. Best is trial 685 with value: 0.5044782096845337.
[I 2024-12-04 12:05:11,410] Trial 675 finished with value: 0.5194304677665507 and parameters: {'n_estimators': 235, 'max_depth': 11, 'min_samples_split': 5, 'min_samples_leaf': 1, 'max_features': None, 'bootstrap': True, 'criterion': 'absolute_error'}. Best is trial 685 with value: 0.5044782096845337.
[I 2024-12-04 12:05:11,439] Trial 677 finished with value: 0.6698381991112847 and parameters: {'n_estimators': 411, 'max_depth': 30, 'min_samples_split': 36, 'min_samples_leaf': 8, 'max_features': None, 'bootstrap': False, 'criterion': 'absolute_error'}. Best is trial 685 with value: 0.5044782096845337.
[I 2024-12-04 12:05:11,563] Trial 671 finished with value: 0.5176524504732809 and parameters: {'n_estimators': 251, 'max_depth': 30, 'min_samples_split': 4, 'min_samples_leaf': 1, 'max_features': None, 'bootstrap': True, 'criterion': 'absolute_error'}. Best is trial 685 with value: 0.5044782096845337.
[I 2024-12-04 12:05:11,925] Trial 664 finished with value: 0.5133814571024069 and parameters: {'n_estimators': 282, 'max_depth': 15, 'min_samples_split': 3, 'min_samples_leaf': 1, 'max_features': None, 'bootstrap': True, 'criterion': 'absolute_error'}. Best is trial 685 with value: 0.5044782096845337.
[I 2024-12-04 12:05:11,930] Trial 683 finished with value: 0.5311267683952507 and parameters: {'n_estimators': 115, 'max_depth': 20, 'min_samples_split': 9, 'min_samples_leaf': 1, 'max_features': None, 'bootstrap': True, 'criterion': 'absolute_error'}. Best is trial 685 with value: 0.5044782096845337.
[I 2024-12-04 12:05:13,211] Trial 682 finished with value: 0.520421940504829 and parameters: {'n_estimators': 121, 'max_depth': 20, 'min_samples_split': 8, 'min_samples_leaf': 1, 'max_features': None, 'bootstrap': True, 'criterion': 'absolute_error'}. Best is trial 685 with value: 0.5044782096845337.
[I 2024-12-04 12:05:13,552] Trial 684 finished with value: 0.5091765272681822 and parameters: {'n_estimators': 118, 'max_depth': 17, 'min_samples_split': 5, 'min_samples_leaf': 1, 'max_features': None, 'bootstrap': True, 'criterion': 'absolute_error'}. Best is trial 685 with value: 0.5044782096845337.
[I 2024-12-04 12:05:14,011] Trial 693 finished with value: 0.7585220840539728 and parameters: {'n_estimators': 311, 'max_depth': 49, 'min_samples_split': 5, 'min_samples_leaf': 11, 'max_features': None, 'bootstrap': True, 'criterion': 'squared_error'}. Best is trial 685 with value: 0.5044782096845337.
[I 2024-12-04 12:05:16,328] Trial 701 finished with value: 1.2008075188629799 and parameters: {'n_estimators': 104, 'max_depth': 34, 'min_samples_split': 32, 'min_samples_leaf': 6, 'max_features': 'sqrt', 'bootstrap': True, 'criterion': 'squared_error'}. Best is trial 685 with value: 0.5044782096845337.
[I 2024-12-04 12:05:16,913] Trial 698 finished with value: 0.9938957915814012 and parameters: {'n_estimators': 772, 'max_depth': 30, 'min_samples_split': 2, 'min_samples_leaf': 4, 'max_features': 'sqrt', 'bootstrap': False, 'criterion': 'squared_error'}. Best is trial 685 with value: 0.5044782096845337.
[I 2024-12-04 12:05:17,011] Trial 700 finished with value: 1.2194866272826594 and parameters: {'n_estimators': 466, 'max_depth': 31, 'min_samples_split': 14, 'min_samples_leaf': 3, 'max_features': 'log2', 'bootstrap': True, 'criterion': 'squared_error'}. Best is trial 685 with value: 0.5044782096845337.
[I 2024-12-04 12:05:17,413] Trial 681 finished with value: 1.037659094816344 and parameters: {'n_estimators': 684, 'max_depth': 39, 'min_samples_split': 5, 'min_samples_leaf': 15, 'max_features': None, 'bootstrap': True, 'criterion': 'absolute_error'}. Best is trial 685 with value: 0.5044782096845337.
[I 2024-12-04 12:05:18,319] Trial 692 finished with value: 0.6686567146261967 and parameters: {'n_estimators': 529, 'max_depth': 45, 'min_samples_split': 6, 'min_samples_leaf': 11, 'max_features': None, 'bootstrap': False, 'criterion': 'absolute_error'}. Best is trial 685 with value: 0.5044782096845337.
[I 2024-12-04 12:05:18,607] Trial 696 finished with value: 0.5112325373897221 and parameters: {'n_estimators': 100, 'max_depth': 20, 'min_samples_split': 6, 'min_samples_leaf': 1, 'max_features': None, 'bootstrap': True, 'criterion': 'absolute_error'}. Best is trial 685 with value: 0.5044782096845337.
[I 2024-12-04 12:05:19,489] Trial 690 finished with value: 0.5285493363174731 and parameters: {'n_estimators': 227, 'max_depth': 20, 'min_samples_split': 11, 'min_samples_leaf': 1, 'max_features': None, 'bootstrap': True, 'criterion': 'absolute_error'}. Best is trial 694 with value: 0.5040991153389499.
[I 2024-12-04 12:05:19,911] Trial 697 finished with value: 0.5122020440314513 and parameters: {'n_estimators': 101, 'max_depth': 15, 'min_samples_split': 3, 'min_samples_leaf': 1, 'max_features': None, 'bootstrap': True, 'criterion': 'absolute_error'}. Best is trial 694 with value: 0.5040991153389499.
[I 2024-12-04 12:05:20,457] Trial 695 finished with value: 0.505818075094308 and parameters: {'n_estimators': 119, 'max_depth': 19, 'min_samples_split': 4, 'min_samples_leaf': 1, 'max_features': None, 'bootstrap': True, 'criterion': 'absolute_error'}. Best is trial 694 with value: 0.5040991153389499.
[I 2024-12-04 12:05:20,686] Trial 699 finished with value: 0.5098175701744232 and parameters: {'n_estimators': 127, 'max_depth': 18, 'min_samples_split': 5, 'min_samples_leaf': 1, 'max_features': None, 'bootstrap': True, 'criterion': 'absolute_error'}. Best is trial 694 with value: 0.5040991153389499.
[I 2024-12-04 12:05:20,996] Trial 694 finished with value: 0.5040991153389499 and parameters: {'n_estimators': 107, 'max_depth': 16, 'min_samples_split': 4, 'min_samples_leaf': 1, 'max_features': None, 'bootstrap': True, 'criterion': 'absolute_error'}. Best is trial 694 with value: 0.5040991153389499.
[I 2024-12-04 12:05:24,162] Trial 706 finished with value: 0.5272582673974082 and parameters: {'n_estimators': 107, 'max_depth': 13, 'min_samples_split': 7, 'min_samples_leaf': 1, 'max_features': None, 'bootstrap': True, 'criterion': 'squared_error'}. Best is trial 694 with value: 0.5040991153389499.
[I 2024-12-04 12:05:24,838] Trial 713 finished with value: 0.5530788357761982 and parameters: {'n_estimators': 100, 'max_depth': 23, 'min_samples_split': 4, 'min_samples_leaf': 2, 'max_features': None, 'bootstrap': True, 'criterion': 'absolute_error'}. Best is trial 694 with value: 0.5040991153389499.
[I 2024-12-04 12:05:25,109] Trial 708 finished with value: 0.5596635554045789 and parameters: {'n_estimators': 109, 'max_depth': 11, 'min_samples_split': 8, 'min_samples_leaf': 2, 'max_features': None, 'bootstrap': True, 'criterion': 'absolute_error'}. Best is trial 694 with value: 0.5040991153389499.
[I 2024-12-04 12:05:25,135] Trial 710 finished with value: 1.2535795119562816 and parameters: {'n_estimators': 289, 'max_depth': 19, 'min_samples_split': 44, 'min_samples_leaf': 12, 'max_features': 'log2', 'bootstrap': True, 'criterion': 'squared_error'}. Best is trial 694 with value: 0.5040991153389499.
[I 2024-12-04 12:05:26,570] Trial 702 finished with value: 1.0954928186278228 and parameters: {'n_estimators': 137, 'max_depth': 14, 'min_samples_split': 2, 'min_samples_leaf': 1, 'max_features': 'log2', 'bootstrap': False, 'criterion': 'absolute_error'}. Best is trial 694 with value: 0.5040991153389499.
[I 2024-12-04 12:05:27,068] Trial 691 finished with value: 0.5174186993784524 and parameters: {'n_estimators': 257, 'max_depth': 20, 'min_samples_split': 4, 'min_samples_leaf': 1, 'max_features': None, 'bootstrap': True, 'criterion': 'absolute_error'}. Best is trial 694 with value: 0.5040991153389499.
[I 2024-12-04 12:05:27,364] Trial 704 finished with value: 0.552671156666457 and parameters: {'n_estimators': 203, 'max_depth': 11, 'min_samples_split': 4, 'min_samples_leaf': 2, 'max_features': None, 'bootstrap': True, 'criterion': 'absolute_error'}. Best is trial 694 with value: 0.5040991153389499.
[I 2024-12-04 12:05:27,836] Trial 717 finished with value: 1.3203053400497038 and parameters: {'n_estimators': 239, 'max_depth': 31, 'min_samples_split': 14, 'min_samples_leaf': 8, 'max_features': 'sqrt', 'bootstrap': True, 'criterion': 'absolute_error'}. Best is trial 694 with value: 0.5040991153389499.
[I 2024-12-04 12:05:28,048] Trial 711 finished with value: 1.0304238969382407 and parameters: {'n_estimators': 379, 'max_depth': 12, 'min_samples_split': 3, 'min_samples_leaf': 2, 'max_features': 'sqrt', 'bootstrap': True, 'criterion': 'absolute_error'}. Best is trial 694 with value: 0.5040991153389499.
[I 2024-12-04 12:05:28,813] Trial 705 finished with value: 0.5568022378653532 and parameters: {'n_estimators': 109, 'max_depth': 27, 'min_samples_split': 5, 'min_samples_leaf': 1, 'max_features': None, 'bootstrap': False, 'criterion': 'absolute_error'}. Best is trial 694 with value: 0.5040991153389499.
[I 2024-12-04 12:05:30,560] Trial 716 finished with value: 0.5149735399340402 and parameters: {'n_estimators': 110, 'max_depth': 16, 'min_samples_split': 3, 'min_samples_leaf': 1, 'max_features': None, 'bootstrap': True, 'criterion': 'absolute_error'}. Best is trial 694 with value: 0.5040991153389499.
[I 2024-12-04 12:05:32,117] Trial 709 finished with value: 0.9014508155170828 and parameters: {'n_estimators': 896, 'max_depth': 28, 'min_samples_split': 17, 'min_samples_leaf': 14, 'max_features': None, 'bootstrap': True, 'criterion': 'squared_error'}. Best is trial 694 with value: 0.5040991153389499.
[I 2024-12-04 12:05:33,540] Trial 721 finished with value: 0.5518632385303959 and parameters: {'n_estimators': 131, 'max_depth': 19, 'min_samples_split': 4, 'min_samples_leaf': 2, 'max_features': None, 'bootstrap': True, 'criterion': 'absolute_error'}. Best is trial 694 with value: 0.5040991153389499.
[I 2024-12-04 12:05:33,713] Trial 707 finished with value: 0.5584160844358195 and parameters: {'n_estimators': 284, 'max_depth': 21, 'min_samples_split': 3, 'min_samples_leaf': 2, 'max_features': None, 'bootstrap': True, 'criterion': 'absolute_error'}. Best is trial 694 with value: 0.5040991153389499.
[I 2024-12-04 12:05:33,716] Trial 728 finished with value: 1.1603546753102172 and parameters: {'n_estimators': 113, 'max_depth': 5, 'min_samples_split': 2, 'min_samples_leaf': 1, 'max_features': 'sqrt', 'bootstrap': False, 'criterion': 'absolute_error'}. Best is trial 694 with value: 0.5040991153389499.
[I 2024-12-04 12:05:35,186] Trial 724 finished with value: 1.2866599577697504 and parameters: {'n_estimators': 144, 'max_depth': 21, 'min_samples_split': 9, 'min_samples_leaf': 2, 'max_features': 'log2', 'bootstrap': True, 'criterion': 'absolute_error'}. Best is trial 694 with value: 0.5040991153389499.
[I 2024-12-04 12:05:35,188] Trial 719 finished with value: 0.5142477535338787 and parameters: {'n_estimators': 106, 'max_depth': 15, 'min_samples_split': 4, 'min_samples_leaf': 1, 'max_features': None, 'bootstrap': True, 'criterion': 'absolute_error'}. Best is trial 694 with value: 0.5040991153389499.
[I 2024-12-04 12:05:35,943] Trial 712 finished with value: 0.6744586696428205 and parameters: {'n_estimators': 744, 'max_depth': 6, 'min_samples_split': 10, 'min_samples_leaf': 10, 'max_features': None, 'bootstrap': False, 'criterion': 'absolute_error'}. Best is trial 694 with value: 0.5040991153389499.
[I 2024-12-04 12:05:35,977] Trial 703 finished with value: 0.5133575025940237 and parameters: {'n_estimators': 279, 'max_depth': 14, 'min_samples_split': 5, 'min_samples_leaf': 1, 'max_features': None, 'bootstrap': True, 'criterion': 'absolute_error'}. Best is trial 694 with value: 0.5040991153389499.
