[I 2024-12-04 15:07:00,328] Trial 1201 finished with value: 0.488303401068402 and parameters: {'kernel_type': 'Matern', 'length_scale': 66100.70882057922, 'noise_level': 0.04090103480630636, 'constant_value': 89746.90337480363, 'nu': 0.5}. Best is trial 386 with value: 0.4872991004520934.
[I 2024-12-04 15:07:00,354] Trial 1183 finished with value: 0.4883034205389126 and parameters: {'kernel_type': 'Matern', 'length_scale': 0.13513278610155505, 'noise_level': 0.012941512747272342, 'constant_value': 0.0587011729947381, 'nu': 0.5}. Best is trial 386 with value: 0.4872991004520934.
[I 2024-12-04 15:07:00,359] Trial 1191 finished with value: 0.4883037401960729 and parameters: {'kernel_type': 'Matern', 'length_scale': 6614.908185985042, 'noise_level': 0.6712916918732561, 'constant_value': 53.36663272813218, 'nu': 0.5}. Best is trial 386 with value: 0.4872991004520934.
[I 2024-12-04 15:07:00,380] Trial 1198 finished with value: 0.4883034202059881 and parameters: {'kernel_type': 'Matern', 'length_scale': 6329.788694005087, 'noise_level': 0.03999546932782592, 'constant_value': 127.79838685430288, 'nu': 0.5}. Best is trial 386 with value: 0.4872991004520934.
[I 2024-12-04 15:07:00,419] Trial 1208 finished with value: 0.48830341927128007 and parameters: {'kernel_type': 'Matern', 'length_scale': 64302.48826748195, 'noise_level': 0.35350129769275956, 'constant_value': 265.1047237354999, 'nu': 0.5}. Best is trial 386 with value: 0.4872991004520934.
[I 2024-12-04 15:07:02,157] Trial 1207 finished with value: 0.48830334146673054 and parameters: {'kernel_type': 'Matern', 'length_scale': 29832.18291079401, 'noise_level': 0.7244218398005978, 'constant_value': 149.20287247630415, 'nu': 0.5}. Best is trial 386 with value: 0.4872991004520934.
[I 2024-12-04 15:07:03,182] Trial 1205 finished with value: 1.2401112325769477 and parameters: {'kernel_type': 'RBF', 'length_scale': 2477.2738541892218, 'noise_level': 0.0011263385295312703, 'constant_value': 188.98256807925213, 'nu': 0.5}. Best is trial 386 with value: 0.4872991004520934.
[I 2024-12-04 15:07:05,707] Trial 1206 finished with value: 0.48830305930636125 and parameters: {'kernel_type': 'Matern', 'length_scale': 4271.941108870275, 'noise_level': 0.04964504740829441, 'constant_value': 2608.6469128735666, 'nu': 0.5}. Best is trial 386 with value: 0.4872991004520934.
[I 2024-12-04 15:07:06,725] Trial 1216 finished with value: 1.2401112326499202 and parameters: {'kernel_type': 'RBF', 'length_scale': 0.02071473699624238, 'noise_level': 0.0017242225882033945, 'constant_value': 6.452157727826369e-06, 'nu': 1.5}. Best is trial 386 with value: 0.4872991004520934.
[I 2024-12-04 15:07:07,084] Trial 1211 finished with value: 1.2401112325833472 and parameters: {'kernel_type': 'RBF', 'length_scale': 2.6144976652668097e-05, 'noise_level': 0.005613889366565767, 'constant_value': 0.01905681239759595, 'nu': 1.5}. Best is trial 386 with value: 0.4872991004520934.
[I 2024-12-04 15:07:07,087] Trial 1210 finished with value: 0.4883034242904546 and parameters: {'kernel_type': 'Matern', 'length_scale': 74173.63800339996, 'noise_level': 0.041259373284993926, 'constant_value': 220.60573528998708, 'nu': 0.5}. Best is trial 386 with value: 0.4872991004520934.
[I 2024-12-04 15:07:07,094] Trial 1204 finished with value: 0.48830332131610465 and parameters: {'kernel_type': 'Matern', 'length_scale': 844.3565499903341, 'noise_level': 0.0015934314255328745, 'constant_value': 13.801529787100206, 'nu': 0.5}. Best is trial 386 with value: 0.4872991004520934.
[I 2024-12-04 15:07:07,297] Trial 1212 finished with value: 1.26145457725949 and parameters: {'kernel_type': 'Matern', 'length_scale': 1199.4199588733452, 'noise_level': 0.3462942805672755, 'constant_value': 0.00019393710328260828, 'nu': 0.5}. Best is trial 386 with value: 0.4872991004520934.
[I 2024-12-04 15:07:08,664] Trial 1214 finished with value: 0.5273056310281601 and parameters: {'kernel_type': 'Matern', 'length_scale': 6250.434292793992, 'noise_level': 0.4390560261000452, 'constant_value': 809.4686060331366, 'nu': 1.5}. Best is trial 386 with value: 0.4872991004520934.
[I 2024-12-04 15:07:08,765] Trial 1215 finished with value: 0.48830352577458946 and parameters: {'kernel_type': 'Matern', 'length_scale': 70223.93969073545, 'noise_level': 0.05469690945855462, 'constant_value': 1948.7085900779196, 'nu': 0.5}. Best is trial 386 with value: 0.4872991004520934.
[I 2024-12-04 15:07:08,876] Trial 1209 finished with value: 0.48830341098161784 and parameters: {'kernel_type': 'Matern', 'length_scale': 91709.48386578179, 'noise_level': 0.8039162047997426, 'constant_value': 58257.74047027423, 'nu': 0.5}. Best is trial 386 with value: 0.4872991004520934.
[I 2024-12-04 15:07:11,054] Trial 1219 finished with value: 0.48830310620754475 and parameters: {'kernel_type': 'Matern', 'length_scale': 3516.0734692962433, 'noise_level': 0.9552457877849124, 'constant_value': 2535.743736820743, 'nu': 0.5}. Best is trial 386 with value: 0.4872991004520934.
[I 2024-12-04 15:07:13,723] Trial 1221 finished with value: 0.4883034183331995 and parameters: {'kernel_type': 'Matern', 'length_scale': 3284.8617326834433, 'noise_level': 0.5442664592862697, 'constant_value': 80848.50332930242, 'nu': 0.5}. Best is trial 386 with value: 0.4872991004520934.
[I 2024-12-04 15:07:14,568] Trial 1213 finished with value: 0.488303510272162 and parameters: {'kernel_type': 'Matern', 'length_scale': 1947.4364252108053, 'noise_level': 0.023585647145209696, 'constant_value': 1553.9595538510875, 'nu': 0.5}. Best is trial 386 with value: 0.4872991004520934.
[I 2024-12-04 15:07:15,395] Trial 1218 finished with value: 0.4883034239558644 and parameters: {'kernel_type': 'Matern', 'length_scale': 58026.99401993217, 'noise_level': 0.7003009600272332, 'constant_value': 19.31703732856424, 'nu': 0.5}. Best is trial 386 with value: 0.4872991004520934.
[I 2024-12-04 15:07:16,728] Trial 1224 finished with value: 1.2401109947607305 and parameters: {'kernel_type': 'Matern', 'length_scale': 0.16659314189483646, 'noise_level': 0.0031636814370734315, 'constant_value': 0.03089085871886728, 'nu': 2.5}. Best is trial 386 with value: 0.4872991004520934.
[I 2024-12-04 15:07:17,119] Trial 1232 finished with value: 0.4883034189593833 and parameters: {'kernel_type': 'Matern', 'length_scale': 79212.59526846325, 'noise_level': 0.03321864206376056, 'constant_value': 5515.540249264903, 'nu': 0.5}. Best is trial 386 with value: 0.4872991004520934.
[I 2024-12-04 15:07:17,414] Trial 1225 finished with value: 0.48830342124985904 and parameters: {'kernel_type': 'Matern', 'length_scale': 92613.49804429057, 'noise_level': 0.4379292532410801, 'constant_value': 221.72624882596457, 'nu': 0.5}. Best is trial 386 with value: 0.4872991004520934.
[I 2024-12-04 15:07:17,557] Trial 1227 finished with value: 0.48830338599018025 and parameters: {'kernel_type': 'Matern', 'length_scale': 9485.414941982348, 'noise_level': 0.998771269173321, 'constant_value': 11724.114827233518, 'nu': 0.5}. Best is trial 386 with value: 0.4872991004520934.
[I 2024-12-04 15:07:18,041] Trial 1222 finished with value: 1.2401112325826282 and parameters: {'kernel_type': 'RBF', 'length_scale': 0.004165557326813185, 'noise_level': 1.4437580278550865e-05, 'constant_value': 2.0334024982544607e-07, 'nu': 0.5}. Best is trial 386 with value: 0.4872991004520934.
[I 2024-12-04 15:07:18,051] Trial 1220 finished with value: 0.48830342045456987 and parameters: {'kernel_type': 'Matern', 'length_scale': 3457.420613991082, 'noise_level': 0.13367679307532804, 'constant_value': 1103.55494103827, 'nu': 0.5}. Best is trial 386 with value: 0.4872991004520934.
[I 2024-12-04 15:07:18,251] Trial 1223 finished with value: 0.48830394397261895 and parameters: {'kernel_type': 'Matern', 'length_scale': 4430.983726444649, 'noise_level': 0.9383882448048679, 'constant_value': 97389.61011412773, 'nu': 0.5}. Best is trial 386 with value: 0.4872991004520934.
[I 2024-12-04 15:07:18,263] Trial 1226 finished with value: 0.48830343177662494 and parameters: {'kernel_type': 'Matern', 'length_scale': 2919.5929702190165, 'noise_level': 0.7963064974635786, 'constant_value': 987.0422333585047, 'nu': 0.5}. Best is trial 386 with value: 0.4872991004520934.
[I 2024-12-04 15:07:18,466] Trial 1217 finished with value: 0.48830341454005655 and parameters: {'kernel_type': 'Matern', 'length_scale': 2424.9908966793714, 'noise_level': 0.0001726458110272298, 'constant_value': 1847.9365824437648, 'nu': 0.5}. Best is trial 386 with value: 0.4872991004520934.
[I 2024-12-04 15:07:19,364] Trial 1230 finished with value: 1.2401112300825348 and parameters: {'kernel_type': 'Matern', 'length_scale': 4.2475955697557465e-05, 'noise_level': 0.27656412700592553, 'constant_value': 36500.74698445682, 'nu': 1.5}. Best is trial 386 with value: 0.4872991004520934.
[I 2024-12-04 15:07:19,959] Trial 1233 finished with value: 0.48830342184869685 and parameters: {'kernel_type': 'Matern', 'length_scale': 3145.1154304161046, 'noise_level': 0.03973110065661684, 'constant_value': 232.14417568155727, 'nu': 0.5}. Best is trial 386 with value: 0.4872991004520934.
[I 2024-12-04 15:07:20,175] Trial 1234 finished with value: 0.48830306693097836 and parameters: {'kernel_type': 'Matern', 'length_scale': 5512.06073758106, 'noise_level': 0.7848875277248155, 'constant_value': 10328.127110829495, 'nu': 0.5}. Best is trial 386 with value: 0.4872991004520934.
[I 2024-12-04 15:07:20,843] Trial 1231 finished with value: 0.4883034241495839 and parameters: {'kernel_type': 'Matern', 'length_scale': 9740.723636328958, 'noise_level': 0.5678010140271245, 'constant_value': 321.83367855952866, 'nu': 0.5}. Best is trial 386 with value: 0.4872991004520934.
[I 2024-12-04 15:07:21,289] Trial 1228 finished with value: 0.4883033883636934 and parameters: {'kernel_type': 'Matern', 'length_scale': 9684.713378914645, 'noise_level': 0.5790664003089572, 'constant_value': 1246.3020410245383, 'nu': 0.5}. Best is trial 386 with value: 0.4872991004520934.
[I 2024-12-04 15:07:21,384] Trial 1237 finished with value: 0.4883034260702659 and parameters: {'kernel_type': 'Matern', 'length_scale': 359.955119032947, 'noise_level': 0.7757173773594485, 'constant_value': 74219.69088914013, 'nu': 0.5}. Best is trial 386 with value: 0.4872991004520934.
[I 2024-12-04 15:07:21,977] Trial 1235 finished with value: 0.4883034190688763 and parameters: {'kernel_type': 'Matern', 'length_scale': 4624.504933831287, 'noise_level': 0.037632021847380695, 'constant_value': 344.52092442790314, 'nu': 0.5}. Best is trial 386 with value: 0.4872991004520934.
[I 2024-12-04 15:07:23,225] Trial 1241 finished with value: 1.2614547976351869 and parameters: {'kernel_type': 'Matern', 'length_scale': 16589.167661587802, 'noise_level': 0.21451650994271515, 'constant_value': 1.3473862729324548e-07, 'nu': 2.5}. Best is trial 386 with value: 0.4872991004520934.
[I 2024-12-04 15:07:24,317] Trial 1240 finished with value: 0.644385307608714 and parameters: {'kernel_type': 'RBF', 'length_scale': 52219.60080804467, 'noise_level': 0.02887084244494564, 'constant_value': 186.39724321244617, 'nu': 0.5}. Best is trial 386 with value: 0.4872991004520934.
[I 2024-12-04 15:07:24,369] Trial 1236 finished with value: 0.48830341079066486 and parameters: {'kernel_type': 'Matern', 'length_scale': 50381.56445874388, 'noise_level': 0.12441538388997998, 'constant_value': 592.0254890313245, 'nu': 0.5}. Best is trial 386 with value: 0.4872991004520934.
[I 2024-12-04 15:07:24,871] Trial 1243 finished with value: 1.24011123249509 and parameters: {'kernel_type': 'RBF', 'length_scale': 0.001808539862033263, 'noise_level': 3.0186524741665835e-05, 'constant_value': 0.1229157539543178, 'nu': 0.5}. Best is trial 386 with value: 0.4872991004520934.
[I 2024-12-04 15:07:29,076] Trial 1229 finished with value: 0.48830341867808125 and parameters: {'kernel_type': 'Matern', 'length_scale': 2076.4632760073932, 'noise_level': 0.08018312137437626, 'constant_value': 7914.1113902805955, 'nu': 0.5}. Best is trial 386 with value: 0.4872991004520934.
[I 2024-12-04 15:07:30,378] Trial 1246 finished with value: 0.48830341685152506 and parameters: {'kernel_type': 'Matern', 'length_scale': 1686.6111632762604, 'noise_level': 0.132091794126794, 'constant_value': 7149.260337630729, 'nu': 0.5}. Best is trial 386 with value: 0.4872991004520934.
[I 2024-12-04 15:07:30,594] Trial 1238 finished with value: 0.5273057933276305 and parameters: {'kernel_type': 'Matern', 'length_scale': 4512.387160326996, 'noise_level': 0.4567286277913547, 'constant_value': 68609.51657487015, 'nu': 1.5}. Best is trial 386 with value: 0.4872991004520934.
[I 2024-12-04 15:07:30,898] Trial 1244 finished with value: 0.4883034414754856 and parameters: {'kernel_type': 'Matern', 'length_scale': 41895.1615543772, 'noise_level': 0.7128048142645746, 'constant_value': 48139.17867759741, 'nu': 0.5}. Best is trial 386 with value: 0.4872991004520934.
[I 2024-12-04 15:07:33,566] Trial 1242 finished with value: 0.48830242454037087 and parameters: {'kernel_type': 'Matern', 'length_scale': 1924.27424559846, 'noise_level': 0.7170660549490864, 'constant_value': 16.389111970383947, 'nu': 0.5}. Best is trial 386 with value: 0.4872991004520934.
[I 2024-12-04 15:07:34,102] Trial 1248 finished with value: 1.2401112326088384 and parameters: {'kernel_type': 'RBF', 'length_scale': 16139.049815821789, 'noise_level': 2.470375703615982e-10, 'constant_value': 7.358919967206129e-07, 'nu': 1.5}. Best is trial 386 with value: 0.4872991004520934.
[I 2024-12-04 15:07:34,133] Trial 1251 finished with value: 1.2614543702026477 and parameters: {'kernel_type': 'RBF', 'length_scale': 0.0011305237778333056, 'noise_level': 6.317154682395155e-10, 'constant_value': 1747.2116966089882, 'nu': 2.5}. Best is trial 386 with value: 0.4872991004520934.
[I 2024-12-04 15:07:34,167] Trial 1247 finished with value: 1.2401112332226847 and parameters: {'kernel_type': 'Matern', 'length_scale': 32951.73919313141, 'noise_level': 1.4271859497940606e-09, 'constant_value': 855.6224593434091, 'nu': 1.5}. Best is trial 386 with value: 0.4872991004520934.
[I 2024-12-04 15:07:35,320] Trial 1253 finished with value: 0.48830341625760376 and parameters: {'kernel_type': 'Matern', 'length_scale': 79727.76947197995, 'noise_level': 0.3989801178775456, 'constant_value': 912.9867494816884, 'nu': 0.5}. Best is trial 386 with value: 0.4872991004520934.
[I 2024-12-04 15:07:35,683] Trial 1260 finished with value: 0.4883034322819609 and parameters: {'kernel_type': 'Matern', 'length_scale': 1415.5379263936065, 'noise_level': 0.45877129954796325, 'constant_value': 458.3150268115029, 'nu': 0.5}. Best is trial 386 with value: 0.4872991004520934.
[I 2024-12-04 15:07:35,855] Trial 1262 finished with value: 0.4883033339822754 and parameters: {'kernel_type': 'Matern', 'length_scale': 2214.6037530366375, 'noise_level': 0.03457711707152639, 'constant_value': 12283.745191054595, 'nu': 0.5}. Best is trial 386 with value: 0.4872991004520934.
[I 2024-12-04 15:07:36,174] Trial 1245 finished with value: 0.4883034000216881 and parameters: {'kernel_type': 'Matern', 'length_scale': 3031.306134668074, 'noise_level': 0.9195261302862241, 'constant_value': 38.929393138692525, 'nu': 0.5}. Best is trial 386 with value: 0.4872991004520934.
[I 2024-12-04 15:07:37,183] Trial 1255 finished with value: 0.48830342757511497 and parameters: {'kernel_type': 'Matern', 'length_scale': 5251.874932556598, 'noise_level': 0.9068744574417029, 'constant_value': 38.20646802906802, 'nu': 0.5}. Best is trial 386 with value: 0.4872991004520934.
[I 2024-12-04 15:07:37,579] Trial 1254 finished with value: 0.48830341731293436 and parameters: {'kernel_type': 'Matern', 'length_scale': 87635.58557280016, 'noise_level': 0.4197366268894916, 'constant_value': 2277.604349576801, 'nu': 0.5}. Best is trial 386 with value: 0.4872991004520934.
[I 2024-12-04 15:07:37,582] Trial 1257 finished with value: 1.2401112325437735 and parameters: {'kernel_type': 'Matern', 'length_scale': 1665.59568703151, 'noise_level': 0.00863557944571443, 'constant_value': 93.5667694927884, 'nu': 2.5}. Best is trial 386 with value: 0.4872991004520934.
[I 2024-12-04 15:07:39,147] Trial 1249 finished with value: 0.6443856707909678 and parameters: {'kernel_type': 'RBF', 'length_scale': 385.6520443131227, 'noise_level': 0.4330221087732906, 'constant_value': 8.051502005325709, 'nu': 0.5}. Best is trial 386 with value: 0.4872991004520934.
[I 2024-12-04 15:07:39,149] Trial 1259 finished with value: 0.4883034146389351 and parameters: {'kernel_type': 'Matern', 'length_scale': 1699.506599020443, 'noise_level': 0.0638614650315433, 'constant_value': 99372.55825848093, 'nu': 0.5}. Best is trial 386 with value: 0.4872991004520934.
[I 2024-12-04 15:07:39,564] Trial 1250 finished with value: 0.4883034175717269 and parameters: {'kernel_type': 'Matern', 'length_scale': 95215.27148452544, 'noise_level': 0.17031358611876737, 'constant_value': 593.2010959483225, 'nu': 0.5}. Best is trial 386 with value: 0.4872991004520934.
[I 2024-12-04 15:07:39,723] Trial 1239 finished with value: 0.4883033879670324 and parameters: {'kernel_type': 'Matern', 'length_scale': 1658.2093379606135, 'noise_level': 0.9442285826677741, 'constant_value': 50939.434678222744, 'nu': 0.5}. Best is trial 386 with value: 0.4872991004520934.
[I 2024-12-04 15:07:41,873] Trial 1252 finished with value: 0.6443854180953685 and parameters: {'kernel_type': 'RBF', 'length_scale': 1.6131550740636982, 'noise_level': 0.2674602706365498, 'constant_value': 1.4693972214185453e-07, 'nu': 0.5}. Best is trial 386 with value: 0.4872991004520934.
[I 2024-12-04 15:07:42,901] Trial 1256 finished with value: 0.4883034170833895 and parameters: {'kernel_type': 'Matern', 'length_scale': 717.8369974306729, 'noise_level': 0.4962368234770874, 'constant_value': 7.657451332390362, 'nu': 0.5}. Best is trial 386 with value: 0.4872991004520934.
[I 2024-12-04 15:07:43,432] Trial 1261 finished with value: 1.2401112325754478 and parameters: {'kernel_type': 'Matern', 'length_scale': 5871.08892315091, 'noise_level': 0.038632741625696194, 'constant_value': 39.91316027310176, 'nu': 1.5}. Best is trial 386 with value: 0.4872991004520934.
[I 2024-12-04 15:07:44,029] Trial 1258 finished with value: 0.48830342666845783 and parameters: {'kernel_type': 'Matern', 'length_scale': 78227.8495217897, 'noise_level': 0.7644497930989046, 'constant_value': 183.29083143187995, 'nu': 0.5}. Best is trial 386 with value: 0.4872991004520934.
[I 2024-12-04 15:07:44,364] Trial 1267 finished with value: 1.24011123100429 and parameters: {'kernel_type': 'RBF', 'length_scale': 316.0462662682858, 'noise_level': 1.1839314920183303e-09, 'constant_value': 3.546164620392867e-07, 'nu': 2.5}. Best is trial 386 with value: 0.4872991004520934.
[I 2024-12-04 15:07:44,903] Trial 1263 finished with value: 1.2401112321664858 and parameters: {'kernel_type': 'Matern', 'length_scale': 3223.5367501324245, 'noise_level': 0.030482469523157515, 'constant_value': 0.06975623929883813, 'nu': 0.5}. Best is trial 386 with value: 0.4872991004520934.
[I 2024-12-04 15:07:45,308] Trial 1271 finished with value: 0.48830341408627664 and parameters: {'kernel_type': 'Matern', 'length_scale': 473.10582878477675, 'noise_level': 0.26213170780326195, 'constant_value': 2.6028089057699626, 'nu': 0.5}. Best is trial 386 with value: 0.4872991004520934.
[I 2024-12-04 15:07:45,442] Trial 1269 finished with value: 0.48830341949196554 and parameters: {'kernel_type': 'Matern', 'length_scale': 47658.04871717032, 'noise_level': 0.8112992279840232, 'constant_value': 36908.69284644142, 'nu': 0.5}. Best is trial 386 with value: 0.4872991004520934.
[I 2024-12-04 15:07:45,989] Trial 1268 finished with value: 0.48830342412530625 and parameters: {'kernel_type': 'Matern', 'length_scale': 162.77236764007745, 'noise_level': 0.1411823219043082, 'constant_value': 0.24860463009222128, 'nu': 0.5}. Best is trial 386 with value: 0.4872991004520934.
[I 2024-12-04 15:07:47,065] Trial 1265 finished with value: 0.4883034190593345 and parameters: {'kernel_type': 'Matern', 'length_scale': 2686.307908836829, 'noise_level': 0.12257277639850306, 'constant_value': 2.674537823969067, 'nu': 0.5}. Best is trial 386 with value: 0.4872991004520934.
[I 2024-12-04 15:07:47,617] Trial 1275 finished with value: 0.48830340595878224 and parameters: {'kernel_type': 'Matern', 'length_scale': 1424.623063586321, 'noise_level': 0.16510574250412663, 'constant_value': 0.190405548710449, 'nu': 0.5}. Best is trial 386 with value: 0.4872991004520934.
[I 2024-12-04 15:07:47,632] Trial 1266 finished with value: 1.240111232617716 and parameters: {'kernel_type': 'Matern', 'length_scale': 80628.5109200081, 'noise_level': 0.013611534896639589, 'constant_value': 1.5687894504100088, 'nu': 0.5}. Best is trial 386 with value: 0.4872991004520934.
[I 2024-12-04 15:07:48,071] Trial 1264 finished with value: 0.488303448336131 and parameters: {'kernel_type': 'Matern', 'length_scale': 25171.793537093257, 'noise_level': 0.012520616679714398, 'constant_value': 93521.74351358767, 'nu': 0.5}. Best is trial 386 with value: 0.4872991004520934.
[I 2024-12-04 15:07:48,072] Trial 1272 finished with value: 1.2401112327132915 and parameters: {'kernel_type': 'Matern', 'length_scale': 83069.49975476628, 'noise_level': 0.06242403045255042, 'constant_value': 15445.859251402626, 'nu': 1.5}. Best is trial 386 with value: 0.4872991004520934.
[I 2024-12-04 15:07:48,664] Trial 1270 finished with value: 1.2401112305214677 and parameters: {'kernel_type': 'RBF', 'length_scale': 93851.7873169623, 'noise_level': 0.01582670092467259, 'constant_value': 40038.28124346828, 'nu': 0.5}. Best is trial 386 with value: 0.4872991004520934.
[I 2024-12-04 15:07:49,508] Trial 1278 finished with value: 0.48830338564993125 and parameters: {'kernel_type': 'Matern', 'length_scale': 1000.087917668577, 'noise_level': 0.8695310048635795, 'constant_value': 6.796591097277051, 'nu': 0.5}. Best is trial 386 with value: 0.4872991004520934.
