[I 2024-12-03 18:41:32,087] Trial 395 finished with value: 0.5258625124100651 and parameters: {'kernel': 'rbf', 'C': 31.483185614388674, 'gamma': 0.008495748043847475, 'epsilon': 0.15596962866664957}. Best is trial 334 with value: 0.4492351460020274.
[I 2024-12-03 18:41:32,414] Trial 407 finished with value: 0.5895736425780018 and parameters: {'kernel': 'rbf', 'C': 17.906612480931265, 'gamma': 0.0038366527019222598, 'epsilon': 0.051556461138172756}. Best is trial 334 with value: 0.4492351460020274.
[I 2024-12-03 18:41:32,416] Trial 396 finished with value: 0.4669099667217438 and parameters: {'kernel': 'rbf', 'C': 98.34378692461755, 'gamma': 0.02014266076999509, 'epsilon': 0.04632455273710843}. Best is trial 334 with value: 0.4492351460020274.
[I 2024-12-03 18:41:32,661] Trial 403 finished with value: 0.4578985899489762 and parameters: {'kernel': 'rbf', 'C': 92.8377895517848, 'gamma': 0.010478698301950704, 'epsilon': 0.06595989480110305}. Best is trial 334 with value: 0.4492351460020274.
[I 2024-12-03 18:41:32,689] Trial 401 finished with value: 0.4585901291276127 and parameters: {'kernel': 'rbf', 'C': 95.2734409086643, 'gamma': 0.01782306847700085, 'epsilon': 0.05668762104730862}. Best is trial 334 with value: 0.4492351460020274.
[I 2024-12-03 18:41:33,494] Trial 413 finished with value: 0.5096475353795339 and parameters: {'kernel': 'rbf', 'C': 15.47173150700553, 'gamma': 0.015257371251985872, 'epsilon': 0.06252588710744077}. Best is trial 334 with value: 0.4492351460020274.
[I 2024-12-03 18:41:33,686] Trial 402 finished with value: 1.281920681519992 and parameters: {'kernel': 'sigmoid', 'C': 0.1914663680521179, 'gamma': 0.0007637993291330701, 'epsilon': 0.013423674901405194}. Best is trial 334 with value: 0.4492351460020274.
[I 2024-12-03 18:41:34,383] Trial 418 finished with value: 0.5608453761968587 and parameters: {'kernel': 'rbf', 'C': 89.40308494104693, 'gamma': 0.002880214051530202, 'epsilon': 0.23915275008702558}. Best is trial 334 with value: 0.4492351460020274.
[I 2024-12-03 18:41:34,602] Trial 408 finished with value: 0.5384763790114481 and parameters: {'kernel': 'rbf', 'C': 22.611794657264692, 'gamma': 0.008706657071698267, 'epsilon': 0.17927105799833237}. Best is trial 334 with value: 0.4492351460020274.
[I 2024-12-03 18:41:35,168] Trial 405 finished with value: 0.5736382459925373 and parameters: {'kernel': 'rbf', 'C': 92.69190100082173, 'gamma': 0.0015412930741778791, 'epsilon': 0.06619581146321447}. Best is trial 334 with value: 0.4492351460020274.
[I 2024-12-03 18:41:35,277] Trial 424 finished with value: 0.5374437230649555 and parameters: {'kernel': 'rbf', 'C': 26.23296594592434, 'gamma': 0.007525895938463186, 'epsilon': 0.05644139301807762}. Best is trial 334 with value: 0.4492351460020274.
[I 2024-12-03 18:41:35,426] Trial 411 finished with value: 0.48052696269502093 and parameters: {'kernel': 'rbf', 'C': 83.75768253684714, 'gamma': 0.007837663110461265, 'epsilon': 0.06556280760641166}. Best is trial 334 with value: 0.4492351460020274.
[I 2024-12-03 18:41:35,991] Trial 412 finished with value: 0.4935104105618815 and parameters: {'kernel': 'rbf', 'C': 77.23968140994724, 'gamma': 0.020501516128316903, 'epsilon': 0.14856621135009415}. Best is trial 334 with value: 0.4492351460020274.
[I 2024-12-03 18:41:36,010] Trial 422 finished with value: 0.7648922471500766 and parameters: {'kernel': 'linear', 'C': 0.02111185596892844, 'gamma': 0.11232881275965105, 'epsilon': 0.004325637360914394}. Best is trial 334 with value: 0.4492351460020274.
[I 2024-12-03 18:41:36,376] Trial 419 finished with value: 0.4910478565820024 and parameters: {'kernel': 'rbf', 'C': 13.726980730874992, 'gamma': 0.02270666533903987, 'epsilon': 0.07213135507421636}. Best is trial 334 with value: 0.4492351460020274.
[I 2024-12-03 18:41:37,781] Trial 414 finished with value: 0.5469970575569666 and parameters: {'kernel': 'rbf', 'C': 69.28227769389535, 'gamma': 0.002495167220621569, 'epsilon': 0.19524545832948012}. Best is trial 334 with value: 0.4492351460020274.
[I 2024-12-03 18:41:38,137] Trial 421 finished with value: 0.5766695328269216 and parameters: {'kernel': 'rbf', 'C': 78.36890614431215, 'gamma': 0.04358628494916046, 'epsilon': 0.09116277887731222}. Best is trial 334 with value: 0.4492351460020274.
[I 2024-12-03 18:41:38,229] Trial 415 finished with value: 0.5103147202522903 and parameters: {'kernel': 'rbf', 'C': 81.2257806963944, 'gamma': 0.02917033195538046, 'epsilon': 0.06453688885544535}. Best is trial 334 with value: 0.4492351460020274.
[I 2024-12-03 18:41:38,230] Trial 410 finished with value: 0.49510588463454736 and parameters: {'kernel': 'rbf', 'C': 90.48590121661341, 'gamma': 0.005508341452007312, 'epsilon': 0.0635780955981837}. Best is trial 334 with value: 0.4492351460020274.
[I 2024-12-03 18:41:38,735] Trial 428 finished with value: 0.45310435575874286 and parameters: {'kernel': 'rbf', 'C': 91.3762992202976, 'gamma': 0.016267462512760126, 'epsilon': 0.05032220477516815}. Best is trial 334 with value: 0.4492351460020274.
[I 2024-12-03 18:41:39,167] Trial 420 finished with value: 1.141720365332863 and parameters: {'kernel': 'poly', 'C': 20.026947505902186, 'gamma': 0.001288791099938387, 'epsilon': 0.13078065450380905}. Best is trial 334 with value: 0.4492351460020274.
[I 2024-12-03 18:41:39,264] Trial 425 finished with value: 0.4568913615243846 and parameters: {'kernel': 'rbf', 'C': 82.17445600168145, 'gamma': 0.016336034814236396, 'epsilon': 0.08358160792870666}. Best is trial 334 with value: 0.4492351460020274.
[I 2024-12-03 18:41:39,288] Trial 436 finished with value: 0.5654378748124805 and parameters: {'kernel': 'rbf', 'C': 12.213098706650994, 'gamma': 0.0073251590430183835, 'epsilon': 0.04543541677897616}. Best is trial 334 with value: 0.4492351460020274.
[I 2024-12-03 18:41:39,289] Trial 423 finished with value: 0.5061327124644401 and parameters: {'kernel': 'rbf', 'C': 19.17169078157379, 'gamma': 0.054363333054034034, 'epsilon': 0.02498544403639767}. Best is trial 334 with value: 0.4492351460020274.
[I 2024-12-03 18:41:39,671] Trial 409 finished with value: 1.0822777305340237 and parameters: {'kernel': 'poly', 'C': 0.12836375142405393, 'gamma': 0.029075332830029055, 'epsilon': 0.0031323690135658354}. Best is trial 334 with value: 0.4492351460020274.
[I 2024-12-03 18:41:40,392] Trial 406 finished with value: 0.49174653704141846 and parameters: {'kernel': 'rbf', 'C': 98.19961923020145, 'gamma': 0.005727000512696021, 'epsilon': 0.07023180162878616}. Best is trial 334 with value: 0.4492351460020274.
[I 2024-12-03 18:41:40,494] Trial 416 finished with value: 0.5066421328489819 and parameters: {'kernel': 'rbf', 'C': 88.05834534865132, 'gamma': 0.02840058067576338, 'epsilon': 0.054506991310938106}. Best is trial 334 with value: 0.4492351460020274.
[I 2024-12-03 18:41:40,783] Trial 417 finished with value: 0.4573606594019439 and parameters: {'kernel': 'rbf', 'C': 94.16658174554544, 'gamma': 0.01140977014142916, 'epsilon': 0.12199013362365484}. Best is trial 334 with value: 0.4492351460020274.
[I 2024-12-03 18:41:40,784] Trial 431 finished with value: 0.5058047491965012 and parameters: {'kernel': 'rbf', 'C': 98.62261457326764, 'gamma': 0.01864884784887821, 'epsilon': 0.17753949181039883}. Best is trial 334 with value: 0.4492351460020274.
[I 2024-12-03 18:41:40,880] Trial 430 finished with value: 0.9016050596655574 and parameters: {'kernel': 'linear', 'C': 0.0018534013016877305, 'gamma': 0.04843674656259859, 'epsilon': 0.0010152973712148413}. Best is trial 334 with value: 0.4492351460020274.
[I 2024-12-03 18:41:41,243] Trial 433 finished with value: 0.5124245562210483 and parameters: {'kernel': 'rbf', 'C': 21.880594876552184, 'gamma': 0.04927159030247191, 'epsilon': 0.08607851180085349}. Best is trial 334 with value: 0.4492351460020274.
[I 2024-12-03 18:41:41,244] Trial 434 finished with value: 0.8140497592508791 and parameters: {'kernel': 'poly', 'C': 62.83166966658732, 'gamma': 0.06044673719756356, 'epsilon': 0.14677583758634655}. Best is trial 334 with value: 0.4492351460020274.
[I 2024-12-03 18:41:41,665] Trial 435 finished with value: 0.7765147676669233 and parameters: {'kernel': 'poly', 'C': 53.88893718339065, 'gamma': 0.025675560317312125, 'epsilon': 0.029260820851570134}. Best is trial 334 with value: 0.4492351460020274.
[I 2024-12-03 18:41:41,803] Trial 440 finished with value: 0.5262787307060768 and parameters: {'kernel': 'rbf', 'C': 8.933242653509344, 'gamma': 0.01950576585168831, 'epsilon': 0.1919264673677602}. Best is trial 334 with value: 0.4492351460020274.
[I 2024-12-03 18:41:42,605] Trial 437 finished with value: 0.5112000645904974 and parameters: {'kernel': 'rbf', 'C': 22.973250376274702, 'gamma': 0.011765301269774904, 'epsilon': 0.08824167991675481}. Best is trial 334 with value: 0.4492351460020274.
[I 2024-12-03 18:41:42,751] Trial 429 finished with value: 0.6210841224390242 and parameters: {'kernel': 'rbf', 'C': 17.84256457342217, 'gamma': 0.2319664511903159, 'epsilon': 0.07477164027697439}. Best is trial 334 with value: 0.4492351460020274.
[I 2024-12-03 18:41:42,840] Trial 442 finished with value: 0.5937030928500336 and parameters: {'kernel': 'rbf', 'C': 76.23201036935993, 'gamma': 0.10474556074147179, 'epsilon': 0.16522468369761625}. Best is trial 334 with value: 0.4492351460020274.
[I 2024-12-03 18:41:43,682] Trial 427 finished with value: 482.48986660625053 and parameters: {'kernel': 'sigmoid', 'C': 74.06626703376544, 'gamma': 0.05262397984849399, 'epsilon': 0.10930437565357487}. Best is trial 334 with value: 0.4492351460020274.
[I 2024-12-03 18:41:43,725] Trial 443 finished with value: 0.5204383116385399 and parameters: {'kernel': 'rbf', 'C': 27.12242379611659, 'gamma': 0.009933119249313872, 'epsilon': 0.12620027412942544}. Best is trial 334 with value: 0.4492351460020274.
[I 2024-12-03 18:41:43,973] Trial 438 finished with value: 0.5514737243356781 and parameters: {'kernel': 'rbf', 'C': 15.832969313324481, 'gamma': 0.007721506150404032, 'epsilon': 0.1366741574916657}. Best is trial 334 with value: 0.4492351460020274.
[I 2024-12-03 18:41:44,098] Trial 426 finished with value: 0.4590167694162644 and parameters: {'kernel': 'rbf', 'C': 98.56491438348485, 'gamma': 0.009667388552400614, 'epsilon': 0.11518828337997525}. Best is trial 334 with value: 0.4492351460020274.
[I 2024-12-03 18:41:44,706] Trial 447 finished with value: 0.514544688663933 and parameters: {'kernel': 'rbf', 'C': 76.5232379252147, 'gamma': 0.004721259709589748, 'epsilon': 0.09198613013616412}. Best is trial 334 with value: 0.4492351460020274.
[I 2024-12-03 18:41:46,740] Trial 449 finished with value: 0.5025457499524427 and parameters: {'kernel': 'rbf', 'C': 16.981509995142815, 'gamma': 0.01627649671042747, 'epsilon': 0.029591370108553693}. Best is trial 334 with value: 0.4492351460020274.
[I 2024-12-03 18:41:47,016] Trial 439 finished with value: 0.5704914962538326 and parameters: {'kernel': 'linear', 'C': 42.121586416692445, 'gamma': 0.717133907028475, 'epsilon': 0.05780574872616728}. Best is trial 334 with value: 0.4492351460020274.
[I 2024-12-03 18:41:47,180] Trial 457 finished with value: 0.48035977283792275 and parameters: {'kernel': 'rbf', 'C': 92.9614291448239, 'gamma': 0.00754374928180158, 'epsilon': 0.08449458907373411}. Best is trial 334 with value: 0.4492351460020274.
[I 2024-12-03 18:41:47,365] Trial 444 finished with value: 0.5695255967078083 and parameters: {'kernel': 'rbf', 'C': 97.32269646176469, 'gamma': 0.053117158094070256, 'epsilon': 0.3068478991748113}. Best is trial 334 with value: 0.4492351460020274.
[I 2024-12-03 18:41:47,472] Trial 441 finished with value: 0.49035390215512437 and parameters: {'kernel': 'rbf', 'C': 19.163385809332407, 'gamma': 0.038948748762397144, 'epsilon': 0.12105859776823334}. Best is trial 334 with value: 0.4492351460020274.
[I 2024-12-03 18:41:47,501] Trial 445 finished with value: 1.3335753510765187 and parameters: {'kernel': 'poly', 'C': 0.020407393021623685, 'gamma': 0.0006673875584461559, 'epsilon': 0.3200492516924715}. Best is trial 334 with value: 0.4492351460020274.
[I 2024-12-03 18:41:47,502] Trial 432 finished with value: 0.5677952648140265 and parameters: {'kernel': 'linear', 'C': 86.65763964838915, 'gamma': 0.007914511179462031, 'epsilon': 0.10831021202160485}. Best is trial 334 with value: 0.4492351460020274.
[I 2024-12-03 18:41:47,505] Trial 453 finished with value: 20.58579556366819 and parameters: {'kernel': 'sigmoid', 'C': 4.496442723413321, 'gamma': 0.024688580605699516, 'epsilon': 0.009745405317592083}. Best is trial 334 with value: 0.4492351460020274.
[I 2024-12-03 18:41:47,989] Trial 450 finished with value: 0.4894176903102827 and parameters: {'kernel': 'rbf', 'C': 94.95549587000897, 'gamma': 0.011147082447617983, 'epsilon': 0.2155988858048049}. Best is trial 334 with value: 0.4492351460020274.
[I 2024-12-03 18:41:48,042] Trial 462 finished with value: 0.47467709423457094 and parameters: {'kernel': 'rbf', 'C': 13.805523467029156, 'gamma': 0.0281808890111218, 'epsilon': 0.046797337160330625}. Best is trial 334 with value: 0.4492351460020274.
[I 2024-12-03 18:41:48,043] Trial 458 finished with value: 21.10275906508359 and parameters: {'kernel': 'sigmoid', 'C': 25.962322680637634, 'gamma': 0.007877804557872866, 'epsilon': 0.046718283982760386}. Best is trial 334 with value: 0.4492351460020274.
[I 2024-12-03 18:41:48,453] Trial 456 finished with value: 0.5007538660730779 and parameters: {'kernel': 'rbf', 'C': 96.46379109633254, 'gamma': 0.023610014251985223, 'epsilon': 0.0909599613003305}. Best is trial 334 with value: 0.4492351460020274.
[I 2024-12-03 18:41:48,484] Trial 460 finished with value: 0.5494081123252854 and parameters: {'kernel': 'rbf', 'C': 84.46733979095366, 'gamma': 0.033797001269034774, 'epsilon': 0.10270415186979677}. Best is trial 334 with value: 0.4492351460020274.
[I 2024-12-03 18:41:48,541] Trial 446 finished with value: 0.4591933071515507 and parameters: {'kernel': 'rbf', 'C': 93.7231656527953, 'gamma': 0.010023374489910567, 'epsilon': 0.0933757057992277}. Best is trial 334 with value: 0.4492351460020274.
[I 2024-12-03 18:41:49,318] Trial 461 finished with value: 0.49694132667944385 and parameters: {'kernel': 'rbf', 'C': 74.870901382778, 'gamma': 0.024047880828857737, 'epsilon': 0.11151544238390622}. Best is trial 334 with value: 0.4492351460020274.
[I 2024-12-03 18:41:50,197] Trial 463 finished with value: 0.4950605101227406 and parameters: {'kernel': 'rbf', 'C': 23.025525996611535, 'gamma': 0.013843480627147018, 'epsilon': 0.04177563069033165}. Best is trial 334 with value: 0.4492351460020274.
[I 2024-12-03 18:41:50,446] Trial 454 finished with value: 1.0817365565794876 and parameters: {'kernel': 'poly', 'C': 3.0507710599630737, 'gamma': 0.01102229673346162, 'epsilon': 0.8133847370137525}. Best is trial 334 with value: 0.4492351460020274.
[I 2024-12-03 18:41:50,476] Trial 452 finished with value: 1.3611802508180875 and parameters: {'kernel': 'poly', 'C': 1.4108568362560625, 'gamma': 0.0010121743511653661, 'epsilon': 0.001600627387260321}. Best is trial 334 with value: 0.4492351460020274.
[I 2024-12-03 18:41:50,644] Trial 465 finished with value: 0.599204851996268 and parameters: {'kernel': 'rbf', 'C': 78.07507956906564, 'gamma': 0.0009844720188359167, 'epsilon': 0.051218736873210075}. Best is trial 334 with value: 0.4492351460020274.
[I 2024-12-03 18:41:50,726] Trial 464 finished with value: 0.6179709646378243 and parameters: {'kernel': 'rbf', 'C': 82.80283308896243, 'gamma': 0.09264524699740896, 'epsilon': 0.04197432950857179}. Best is trial 334 with value: 0.4492351460020274.
[I 2024-12-03 18:41:50,729] Trial 466 finished with value: 0.4661579856888682 and parameters: {'kernel': 'rbf', 'C': 90.69013627228429, 'gamma': 0.010302135285542576, 'epsilon': 0.03291598009362625}. Best is trial 334 with value: 0.4492351460020274.
[I 2024-12-03 18:41:51,236] Trial 448 finished with value: 0.5771033241578543 and parameters: {'kernel': 'rbf', 'C': 27.780432671593445, 'gamma': 0.0036207175306406164, 'epsilon': 0.02872442888686809}. Best is trial 334 with value: 0.4492351460020274.
[I 2024-12-03 18:41:51,543] Trial 459 finished with value: 0.5087271625950843 and parameters: {'kernel': 'rbf', 'C': 13.43945789552818, 'gamma': 0.0170997029979305, 'epsilon': 0.0541581461153177}. Best is trial 334 with value: 0.4492351460020274.
[I 2024-12-03 18:41:51,727] Trial 455 finished with value: 0.690264341418731 and parameters: {'kernel': 'rbf', 'C': 10.726983659872309, 'gamma': 0.002600183727973985, 'epsilon': 0.009470357651749995}. Best is trial 334 with value: 0.4492351460020274.
[I 2024-12-03 18:41:51,732] Trial 451 finished with value: 0.5662829459326719 and parameters: {'kernel': 'rbf', 'C': 88.00265746214333, 'gamma': 0.03780288938499295, 'epsilon': 0.05002517331023226}. Best is trial 334 with value: 0.4492351460020274.
[I 2024-12-03 18:41:52,107] Trial 472 finished with value: 0.49801353458418157 and parameters: {'kernel': 'rbf', 'C': 99.96854438004958, 'gamma': 0.005203168667188525, 'epsilon': 0.041183426660425584}. Best is trial 334 with value: 0.4492351460020274.
[I 2024-12-03 18:41:52,751] Trial 467 finished with value: 10.757186119476566 and parameters: {'kernel': 'sigmoid', 'C': 7.198681603675298, 'gamma': 0.011496829380502666, 'epsilon': 0.24909732244268462}. Best is trial 334 with value: 0.4492351460020274.
[I 2024-12-03 18:41:54,577] Trial 468 finished with value: 0.49472125308303516 and parameters: {'kernel': 'rbf', 'C': 88.83720333364845, 'gamma': 0.027407107320277613, 'epsilon': 0.03014422530383749}. Best is trial 334 with value: 0.4492351460020274.
[I 2024-12-03 18:41:55,961] Trial 478 finished with value: 0.6417991068432551 and parameters: {'kernel': 'rbf', 'C': 12.949127051694157, 'gamma': 0.003204569894288847, 'epsilon': 0.1295880589921874}. Best is trial 334 with value: 0.4492351460020274.
[I 2024-12-03 18:41:56,117] Trial 469 finished with value: 0.6747058216830912 and parameters: {'kernel': 'rbf', 'C': 95.5060843047968, 'gamma': 0.05965736067484734, 'epsilon': 0.019102392534356926}. Best is trial 334 with value: 0.4492351460020274.
[I 2024-12-03 18:41:56,195] Trial 470 finished with value: 0.6664392588151693 and parameters: {'kernel': 'rbf', 'C': 19.885842029068897, 'gamma': 0.009281302511128938, 'epsilon': 0.938195568383037}. Best is trial 334 with value: 0.4492351460020274.
[I 2024-12-03 18:41:56,447] Trial 473 finished with value: 0.5815991250903858 and parameters: {'kernel': 'rbf', 'C': 12.05486744621306, 'gamma': 0.005864073288670256, 'epsilon': 0.05699462909133671}. Best is trial 482 with value: 0.4491649651596098.
[I 2024-12-03 18:41:56,695] Trial 471 finished with value: 0.46457978266180977 and parameters: {'kernel': 'rbf', 'C': 95.42155447660579, 'gamma': 0.009349648947749157, 'epsilon': 0.07244673301988687}. Best is trial 482 with value: 0.4491649651596098.
[I 2024-12-03 18:41:56,790] Trial 481 finished with value: 1.3436848342987078 and parameters: {'kernel': 'rbf', 'C': 0.004811331139068924, 'gamma': 0.649191721301366, 'epsilon': 0.27984864917761026}. Best is trial 482 with value: 0.4491649651596098.
[I 2024-12-03 18:41:56,841] Trial 475 finished with value: 0.49600913617057907 and parameters: {'kernel': 'rbf', 'C': 18.303815082278163, 'gamma': 0.049214370043466946, 'epsilon': 0.0488041809530128}. Best is trial 482 with value: 0.4491649651596098.
[I 2024-12-03 18:41:56,968] Trial 480 finished with value: 0.4988008099071888 and parameters: {'kernel': 'rbf', 'C': 17.772680681185182, 'gamma': 0.016390652332338603, 'epsilon': 0.030902250233055744}. Best is trial 482 with value: 0.4491649651596098.
[I 2024-12-03 18:41:57,026] Trial 476 finished with value: 0.6576541493840362 and parameters: {'kernel': 'rbf', 'C': 97.75678243939166, 'gamma': 0.06423094776533286, 'epsilon': 0.06772322209881464}. Best is trial 482 with value: 0.4491649651596098.
[I 2024-12-03 18:41:57,941] Trial 474 finished with value: 0.46859424882466844 and parameters: {'kernel': 'rbf', 'C': 89.45608334926928, 'gamma': 0.009303521409152048, 'epsilon': 0.044210294920987964}. Best is trial 482 with value: 0.4491649651596098.
[I 2024-12-03 18:41:58,424] Trial 482 finished with value: 0.4491649651596098 and parameters: {'kernel': 'rbf', 'C': 93.88763521721134, 'gamma': 0.014442379542720502, 'epsilon': 0.07191039577614829}. Best is trial 482 with value: 0.4491649651596098.
[I 2024-12-03 18:41:58,797] Trial 486 finished with value: 0.51224975797331 and parameters: {'kernel': 'rbf', 'C': 18.49878896122021, 'gamma': 0.013069442088390521, 'epsilon': 0.0776349726792092}. Best is trial 482 with value: 0.4491649651596098.
[I 2024-12-03 18:41:58,798] Trial 487 finished with value: 0.47789750368910716 and parameters: {'kernel': 'rbf', 'C': 85.70842682532587, 'gamma': 0.020983917710395514, 'epsilon': 0.09747909416040813}. Best is trial 482 with value: 0.4491649651596098.
[I 2024-12-03 18:41:58,821] Trial 477 finished with value: 0.5732103619113911 and parameters: {'kernel': 'linear', 'C': 13.580787358727866, 'gamma': 0.02168321079055038, 'epsilon': 0.08233070975261908}. Best is trial 482 with value: 0.4491649651596098.
[I 2024-12-03 18:41:59,166] Trial 484 finished with value: 0.5512627677653711 and parameters: {'kernel': 'rbf', 'C': 10.51057377365328, 'gamma': 0.010712567990904401, 'epsilon': 0.09027984818723726}. Best is trial 482 with value: 0.4491649651596098.
[I 2024-12-03 18:41:59,538] Trial 491 finished with value: 0.4931072634273926 and parameters: {'kernel': 'rbf', 'C': 96.92694753835019, 'gamma': 0.006020139774959468, 'epsilon': 0.09211704231172274}. Best is trial 482 with value: 0.4491649651596098.
[I 2024-12-03 18:41:59,712] Trial 494 finished with value: 0.45872903648052815 and parameters: {'kernel': 'rbf', 'C': 88.87343717213163, 'gamma': 0.01169340568349822, 'epsilon': 0.12663422179421072}. Best is trial 482 with value: 0.4491649651596098.
