[I 2024-12-04 12:00:48,296] Trial 371 finished with value: 1.2462316667093496 and parameters: {'n_estimators': 949, 'max_depth': 45, 'min_samples_split': 10, 'min_samples_leaf': 10, 'max_features': 'log2', 'bootstrap': True, 'criterion': 'squared_error'}. Best is trial 306 with value: 0.5054021215392881.
[I 2024-12-04 12:00:49,057] Trial 364 finished with value: 0.5087962124671408 and parameters: {'n_estimators': 100, 'max_depth': 15, 'min_samples_split': 5, 'min_samples_leaf': 1, 'max_features': None, 'bootstrap': True, 'criterion': 'absolute_error'}. Best is trial 306 with value: 0.5054021215392881.
[I 2024-12-04 12:00:50,118] Trial 355 finished with value: 0.5593320715410335 and parameters: {'n_estimators': 274, 'max_depth': 20, 'min_samples_split': 4, 'min_samples_leaf': 2, 'max_features': None, 'bootstrap': True, 'criterion': 'absolute_error'}. Best is trial 306 with value: 0.5054021215392881.
[I 2024-12-04 12:00:50,661] Trial 354 finished with value: 0.5362417631672755 and parameters: {'n_estimators': 367, 'max_depth': 6, 'min_samples_split': 4, 'min_samples_leaf': 1, 'max_features': None, 'bootstrap': True, 'criterion': 'absolute_error'}. Best is trial 306 with value: 0.5054021215392881.
[I 2024-12-04 12:00:51,608] Trial 318 finished with value: 0.5726413823294643 and parameters: {'n_estimators': 761, 'max_depth': 7, 'min_samples_split': 31, 'min_samples_leaf': 1, 'max_features': None, 'bootstrap': False, 'criterion': 'absolute_error'}. Best is trial 306 with value: 0.5054021215392881.
[I 2024-12-04 12:00:51,612] Trial 376 finished with value: 0.509948144097748 and parameters: {'n_estimators': 101, 'max_depth': 12, 'min_samples_split': 4, 'min_samples_leaf': 1, 'max_features': None, 'bootstrap': True, 'criterion': 'absolute_error'}. Best is trial 306 with value: 0.5054021215392881.
[I 2024-12-04 12:00:51,723] Trial 362 finished with value: 0.5098927371332813 and parameters: {'n_estimators': 126, 'max_depth': 18, 'min_samples_split': 6, 'min_samples_leaf': 1, 'max_features': None, 'bootstrap': True, 'criterion': 'absolute_error'}. Best is trial 306 with value: 0.5054021215392881.
[I 2024-12-04 12:00:51,860] Trial 369 finished with value: 0.512576194125051 and parameters: {'n_estimators': 129, 'max_depth': 12, 'min_samples_split': 6, 'min_samples_leaf': 1, 'max_features': None, 'bootstrap': True, 'criterion': 'absolute_error'}. Best is trial 306 with value: 0.5054021215392881.
[I 2024-12-04 12:00:53,837] Trial 374 finished with value: 0.5107650777263145 and parameters: {'n_estimators': 110, 'max_depth': 12, 'min_samples_split': 5, 'min_samples_leaf': 1, 'max_features': None, 'bootstrap': True, 'criterion': 'absolute_error'}. Best is trial 306 with value: 0.5054021215392881.
[I 2024-12-04 12:00:53,946] Trial 372 finished with value: 0.698156178036968 and parameters: {'n_estimators': 149, 'max_depth': 28, 'min_samples_split': 2, 'min_samples_leaf': 1, 'max_features': 'sqrt', 'bootstrap': True, 'criterion': 'absolute_error'}. Best is trial 306 with value: 0.5054021215392881.
[I 2024-12-04 12:00:54,215] Trial 377 finished with value: 0.6587189504417903 and parameters: {'n_estimators': 297, 'max_depth': 11, 'min_samples_split': 19, 'min_samples_leaf': 8, 'max_features': None, 'bootstrap': True, 'criterion': 'squared_error'}. Best is trial 306 with value: 0.5054021215392881.
[I 2024-12-04 12:00:54,492] Trial 385 finished with value: 1.1986177974433523 and parameters: {'n_estimators': 154, 'max_depth': 9, 'min_samples_split': 4, 'min_samples_leaf': 1, 'max_features': 'log2', 'bootstrap': True, 'criterion': 'absolute_error'}. Best is trial 306 with value: 0.5054021215392881.
[I 2024-12-04 12:00:55,140] Trial 365 finished with value: 0.5784002301374925 and parameters: {'n_estimators': 664, 'max_depth': 8, 'min_samples_split': 45, 'min_samples_leaf': 2, 'max_features': None, 'bootstrap': True, 'criterion': 'squared_error'}. Best is trial 306 with value: 0.5054021215392881.
[I 2024-12-04 12:00:55,899] Trial 366 finished with value: 0.5138504181718447 and parameters: {'n_estimators': 282, 'max_depth': 15, 'min_samples_split': 5, 'min_samples_leaf': 1, 'max_features': None, 'bootstrap': True, 'criterion': 'absolute_error'}. Best is trial 306 with value: 0.5054021215392881.
[I 2024-12-04 12:00:56,541] Trial 375 finished with value: 1.1440827532326616 and parameters: {'n_estimators': 437, 'max_depth': 14, 'min_samples_split': 2, 'min_samples_leaf': 4, 'max_features': 'sqrt', 'bootstrap': False, 'criterion': 'absolute_error'}. Best is trial 306 with value: 0.5054021215392881.
[I 2024-12-04 12:00:56,583] Trial 281 finished with value: 0.5175038245871862 and parameters: {'n_estimators': 720, 'max_depth': 50, 'min_samples_split': 8, 'min_samples_leaf': 1, 'max_features': None, 'bootstrap': False, 'criterion': 'absolute_error'}. Best is trial 306 with value: 0.5054021215392881.
[I 2024-12-04 12:00:56,627] Trial 368 finished with value: 0.5877450346644881 and parameters: {'n_estimators': 259, 'max_depth': 15, 'min_samples_split': 22, 'min_samples_leaf': 1, 'max_features': None, 'bootstrap': True, 'criterion': 'absolute_error'}. Best is trial 306 with value: 0.5054021215392881.
[I 2024-12-04 12:00:57,562] Trial 379 finished with value: 0.568737237084298 and parameters: {'n_estimators': 129, 'max_depth': 5, 'min_samples_split': 10, 'min_samples_leaf': 1, 'max_features': None, 'bootstrap': True, 'criterion': 'absolute_error'}. Best is trial 306 with value: 0.5054021215392881.
[I 2024-12-04 12:00:59,277] Trial 373 finished with value: 1.0796003764706554 and parameters: {'n_estimators': 814, 'max_depth': 7, 'min_samples_split': 2, 'min_samples_leaf': 1, 'max_features': 'sqrt', 'bootstrap': False, 'criterion': 'absolute_error'}. Best is trial 306 with value: 0.5054021215392881.
[I 2024-12-04 12:01:00,303] Trial 378 finished with value: 0.5267206991716743 and parameters: {'n_estimators': 113, 'max_depth': 15, 'min_samples_split': 9, 'min_samples_leaf': 1, 'max_features': None, 'bootstrap': True, 'criterion': 'absolute_error'}. Best is trial 306 with value: 0.5054021215392881.
[I 2024-12-04 12:01:03,309] Trial 382 finished with value: 0.5140941317137837 and parameters: {'n_estimators': 117, 'max_depth': 14, 'min_samples_split': 6, 'min_samples_leaf': 1, 'max_features': None, 'bootstrap': True, 'criterion': 'absolute_error'}. Best is trial 306 with value: 0.5054021215392881.
[I 2024-12-04 12:01:04,265] Trial 388 finished with value: 0.5135682865805831 and parameters: {'n_estimators': 130, 'max_depth': 13, 'min_samples_split': 3, 'min_samples_leaf': 1, 'max_features': None, 'bootstrap': True, 'criterion': 'absolute_error'}. Best is trial 306 with value: 0.5054021215392881.
[I 2024-12-04 12:01:04,401] Trial 392 finished with value: 0.5634902928797555 and parameters: {'n_estimators': 136, 'max_depth': 6, 'min_samples_split': 3, 'min_samples_leaf': 2, 'max_features': None, 'bootstrap': True, 'criterion': 'squared_error'}. Best is trial 306 with value: 0.5054021215392881.
[I 2024-12-04 12:01:05,322] Trial 387 finished with value: 0.5402176748296755 and parameters: {'n_estimators': 126, 'max_depth': 6, 'min_samples_split': 5, 'min_samples_leaf': 1, 'max_features': None, 'bootstrap': True, 'criterion': 'absolute_error'}. Best is trial 306 with value: 0.5054021215392881.
[I 2024-12-04 12:01:06,386] Trial 384 finished with value: 0.5571887714381755 and parameters: {'n_estimators': 137, 'max_depth': 14, 'min_samples_split': 5, 'min_samples_leaf': 2, 'max_features': None, 'bootstrap': True, 'criterion': 'absolute_error'}. Best is trial 306 with value: 0.5054021215392881.
[I 2024-12-04 12:01:06,576] Trial 383 finished with value: 0.5232182852892817 and parameters: {'n_estimators': 118, 'max_depth': 24, 'min_samples_split': 3, 'min_samples_leaf': 1, 'max_features': None, 'bootstrap': True, 'criterion': 'absolute_error'}. Best is trial 306 with value: 0.5054021215392881.
[I 2024-12-04 12:01:07,274] Trial 394 finished with value: 0.5438165374736413 and parameters: {'n_estimators': 167, 'max_depth': 11, 'min_samples_split': 6, 'min_samples_leaf': 2, 'max_features': None, 'bootstrap': True, 'criterion': 'squared_error'}. Best is trial 306 with value: 0.5054021215392881.
[I 2024-12-04 12:01:07,287] Trial 389 finished with value: 0.5096980767619163 and parameters: {'n_estimators': 105, 'max_depth': 15, 'min_samples_split': 5, 'min_samples_leaf': 1, 'max_features': None, 'bootstrap': True, 'criterion': 'absolute_error'}. Best is trial 306 with value: 0.5054021215392881.
[I 2024-12-04 12:01:07,338] Trial 381 finished with value: 0.5170311285616508 and parameters: {'n_estimators': 127, 'max_depth': 11, 'min_samples_split': 2, 'min_samples_leaf': 1, 'max_features': None, 'bootstrap': True, 'criterion': 'absolute_error'}. Best is trial 306 with value: 0.5054021215392881.
[I 2024-12-04 12:01:08,051] Trial 380 finished with value: 0.5131704886709235 and parameters: {'n_estimators': 137, 'max_depth': 15, 'min_samples_split': 5, 'min_samples_leaf': 1, 'max_features': None, 'bootstrap': True, 'criterion': 'absolute_error'}. Best is trial 306 with value: 0.5054021215392881.
[I 2024-12-04 12:01:08,557] Trial 390 finished with value: 0.5558899964981739 and parameters: {'n_estimators': 120, 'max_depth': 21, 'min_samples_split': 4, 'min_samples_leaf': 2, 'max_features': None, 'bootstrap': True, 'criterion': 'absolute_error'}. Best is trial 306 with value: 0.5054021215392881.
[I 2024-12-04 12:01:09,092] Trial 391 finished with value: 0.5162617970771208 and parameters: {'n_estimators': 125, 'max_depth': 10, 'min_samples_split': 4, 'min_samples_leaf': 1, 'max_features': None, 'bootstrap': True, 'criterion': 'absolute_error'}. Best is trial 306 with value: 0.5054021215392881.
[I 2024-12-04 12:01:09,683] Trial 397 finished with value: 0.5137396966614131 and parameters: {'n_estimators': 110, 'max_depth': 29, 'min_samples_split': 6, 'min_samples_leaf': 1, 'max_features': None, 'bootstrap': True, 'criterion': 'absolute_error'}. Best is trial 306 with value: 0.5054021215392881.
[I 2024-12-04 12:01:10,669] Trial 395 finished with value: 0.5090366812851895 and parameters: {'n_estimators': 125, 'max_depth': 14, 'min_samples_split': 5, 'min_samples_leaf': 1, 'max_features': None, 'bootstrap': True, 'criterion': 'absolute_error'}. Best is trial 306 with value: 0.5054021215392881.
[I 2024-12-04 12:01:10,836] Trial 407 finished with value: 0.524267551160417 and parameters: {'n_estimators': 110, 'max_depth': 31, 'min_samples_split': 6, 'min_samples_leaf': 1, 'max_features': None, 'bootstrap': True, 'criterion': 'squared_error'}. Best is trial 306 with value: 0.5054021215392881.
[I 2024-12-04 12:01:10,898] Trial 400 finished with value: 0.517480531043055 and parameters: {'n_estimators': 105, 'max_depth': 18, 'min_samples_split': 3, 'min_samples_leaf': 1, 'max_features': None, 'bootstrap': True, 'criterion': 'absolute_error'}. Best is trial 306 with value: 0.5054021215392881.
[I 2024-12-04 12:01:11,768] Trial 409 finished with value: 1.0198743287011596 and parameters: {'n_estimators': 114, 'max_depth': 17, 'min_samples_split': 2, 'min_samples_leaf': 2, 'max_features': 'sqrt', 'bootstrap': True, 'criterion': 'absolute_error'}. Best is trial 306 with value: 0.5054021215392881.
[I 2024-12-04 12:01:11,874] Trial 370 finished with value: 0.5197397820375655 and parameters: {'n_estimators': 350, 'max_depth': 27, 'min_samples_split': 3, 'min_samples_leaf': 1, 'max_features': None, 'bootstrap': True, 'criterion': 'absolute_error'}. Best is trial 306 with value: 0.5054021215392881.
[I 2024-12-04 12:01:12,030] Trial 386 finished with value: 0.871014992705056 and parameters: {'n_estimators': 851, 'max_depth': 23, 'min_samples_split': 19, 'min_samples_leaf': 15, 'max_features': None, 'bootstrap': False, 'criterion': 'absolute_error'}. Best is trial 306 with value: 0.5054021215392881.
[I 2024-12-04 12:01:12,853] Trial 403 finished with value: 1.2232784913856145 and parameters: {'n_estimators': 203, 'max_depth': 8, 'min_samples_split': 8, 'min_samples_leaf': 1, 'max_features': 'log2', 'bootstrap': False, 'criterion': 'absolute_error'}. Best is trial 306 with value: 0.5054021215392881.
[I 2024-12-04 12:01:13,201] Trial 399 finished with value: 0.6806757288794846 and parameters: {'n_estimators': 424, 'max_depth': 22, 'min_samples_split': 2, 'min_samples_leaf': 7, 'max_features': None, 'bootstrap': False, 'criterion': 'squared_error'}. Best is trial 306 with value: 0.5054021215392881.
[I 2024-12-04 12:01:13,415] Trial 402 finished with value: 1.2863506720772933 and parameters: {'n_estimators': 665, 'max_depth': 37, 'min_samples_split': 11, 'min_samples_leaf': 2, 'max_features': 'log2', 'bootstrap': True, 'criterion': 'absolute_error'}. Best is trial 306 with value: 0.5054021215392881.
[I 2024-12-04 12:01:13,604] Trial 401 finished with value: 0.622663547813948 and parameters: {'n_estimators': 427, 'max_depth': 6, 'min_samples_split': 5, 'min_samples_leaf': 4, 'max_features': None, 'bootstrap': False, 'criterion': 'squared_error'}. Best is trial 306 with value: 0.5054021215392881.
[I 2024-12-04 12:01:14,347] Trial 398 finished with value: 0.5100962542142985 and parameters: {'n_estimators': 109, 'max_depth': 12, 'min_samples_split': 5, 'min_samples_leaf': 1, 'max_features': None, 'bootstrap': True, 'criterion': 'absolute_error'}. Best is trial 306 with value: 0.5054021215392881.
[I 2024-12-04 12:01:14,379] Trial 408 finished with value: 0.7527726288162966 and parameters: {'n_estimators': 731, 'max_depth': 45, 'min_samples_split': 2, 'min_samples_leaf': 2, 'max_features': 'sqrt', 'bootstrap': False, 'criterion': 'squared_error'}. Best is trial 306 with value: 0.5054021215392881.
[I 2024-12-04 12:01:17,025] Trial 419 finished with value: 1.2269503165654387 and parameters: {'n_estimators': 184, 'max_depth': 17, 'min_samples_split': 28, 'min_samples_leaf': 3, 'max_features': 'log2', 'bootstrap': True, 'criterion': 'squared_error'}. Best is trial 306 with value: 0.5054021215392881.
[I 2024-12-04 12:01:18,419] Trial 406 finished with value: 0.5091160070298753 and parameters: {'n_estimators': 108, 'max_depth': 25, 'min_samples_split': 5, 'min_samples_leaf': 1, 'max_features': None, 'bootstrap': True, 'criterion': 'absolute_error'}. Best is trial 306 with value: 0.5054021215392881.
[I 2024-12-04 12:01:19,693] Trial 396 finished with value: 0.6094591228336669 and parameters: {'n_estimators': 700, 'max_depth': 41, 'min_samples_split': 5, 'min_samples_leaf': 1, 'max_features': 'sqrt', 'bootstrap': False, 'criterion': 'absolute_error'}. Best is trial 306 with value: 0.5054021215392881.
[I 2024-12-04 12:01:20,192] Trial 418 finished with value: 0.9980980150577151 and parameters: {'n_estimators': 244, 'max_depth': 23, 'min_samples_split': 5, 'min_samples_leaf': 1, 'max_features': 'log2', 'bootstrap': True, 'criterion': 'absolute_error'}. Best is trial 306 with value: 0.5054021215392881.
[I 2024-12-04 12:01:22,017] Trial 404 finished with value: 0.5107775578979667 and parameters: {'n_estimators': 102, 'max_depth': 22, 'min_samples_split': 5, 'min_samples_leaf': 1, 'max_features': None, 'bootstrap': True, 'criterion': 'absolute_error'}. Best is trial 306 with value: 0.5054021215392881.
[I 2024-12-04 12:01:23,310] Trial 420 finished with value: 0.6806293184978971 and parameters: {'n_estimators': 670, 'max_depth': 9, 'min_samples_split': 17, 'min_samples_leaf': 6, 'max_features': None, 'bootstrap': False, 'criterion': 'squared_error'}. Best is trial 306 with value: 0.5054021215392881.
[I 2024-12-04 12:01:23,959] Trial 426 finished with value: 0.9897849759903696 and parameters: {'n_estimators': 154, 'max_depth': 21, 'min_samples_split': 6, 'min_samples_leaf': 2, 'max_features': 'sqrt', 'bootstrap': True, 'criterion': 'absolute_error'}. Best is trial 306 with value: 0.5054021215392881.
[I 2024-12-04 12:01:23,987] Trial 421 finished with value: 0.5598333296231733 and parameters: {'n_estimators': 148, 'max_depth': 22, 'min_samples_split': 8, 'min_samples_leaf': 2, 'max_features': None, 'bootstrap': True, 'criterion': 'absolute_error'}. Best is trial 306 with value: 0.5054021215392881.
[I 2024-12-04 12:01:25,329] Trial 393 finished with value: 0.5128175809799155 and parameters: {'n_estimators': 323, 'max_depth': 16, 'min_samples_split': 6, 'min_samples_leaf': 1, 'max_features': None, 'bootstrap': True, 'criterion': 'absolute_error'}. Best is trial 306 with value: 0.5054021215392881.
[I 2024-12-04 12:01:25,332] Trial 410 finished with value: 0.5571249625219288 and parameters: {'n_estimators': 284, 'max_depth': 10, 'min_samples_split': 8, 'min_samples_leaf': 2, 'max_features': None, 'bootstrap': True, 'criterion': 'absolute_error'}. Best is trial 306 with value: 0.5054021215392881.
[I 2024-12-04 12:01:26,012] Trial 417 finished with value: 0.5124129603710338 and parameters: {'n_estimators': 110, 'max_depth': 14, 'min_samples_split': 6, 'min_samples_leaf': 1, 'max_features': None, 'bootstrap': True, 'criterion': 'absolute_error'}. Best is trial 306 with value: 0.5054021215392881.
[I 2024-12-04 12:01:26,013] Trial 416 finished with value: 1.1117503853662938 and parameters: {'n_estimators': 117, 'max_depth': 50, 'min_samples_split': 19, 'min_samples_leaf': 2, 'max_features': 'log2', 'bootstrap': False, 'criterion': 'squared_error'}. Best is trial 306 with value: 0.5054021215392881.
[I 2024-12-04 12:01:27,244] Trial 411 finished with value: 0.5639285053943698 and parameters: {'n_estimators': 118, 'max_depth': 20, 'min_samples_split': 2, 'min_samples_leaf': 1, 'max_features': None, 'bootstrap': False, 'criterion': 'absolute_error'}. Best is trial 306 with value: 0.5054021215392881.
[I 2024-12-04 12:01:28,193] Trial 432 finished with value: 0.5168470535137487 and parameters: {'n_estimators': 139, 'max_depth': 17, 'min_samples_split': 5, 'min_samples_leaf': 1, 'max_features': None, 'bootstrap': True, 'criterion': 'squared_error'}. Best is trial 306 with value: 0.5054021215392881.
[I 2024-12-04 12:01:28,471] Trial 414 finished with value: 0.5145365154124791 and parameters: {'n_estimators': 123, 'max_depth': 20, 'min_samples_split': 6, 'min_samples_leaf': 1, 'max_features': None, 'bootstrap': True, 'criterion': 'absolute_error'}. Best is trial 306 with value: 0.5054021215392881.
[I 2024-12-04 12:01:30,208] Trial 424 finished with value: 1.0602493216722568 and parameters: {'n_estimators': 138, 'max_depth': 10, 'min_samples_split': 5, 'min_samples_leaf': 1, 'max_features': 'sqrt', 'bootstrap': True, 'criterion': 'absolute_error'}. Best is trial 306 with value: 0.5054021215392881.
[I 2024-12-04 12:01:31,458] Trial 429 finished with value: 0.5086694088127345 and parameters: {'n_estimators': 115, 'max_depth': 11, 'min_samples_split': 4, 'min_samples_leaf': 1, 'max_features': None, 'bootstrap': True, 'criterion': 'absolute_error'}. Best is trial 306 with value: 0.5054021215392881.
[I 2024-12-04 12:01:32,956] Trial 415 finished with value: 0.5125418745653868 and parameters: {'n_estimators': 119, 'max_depth': 14, 'min_samples_split': 4, 'min_samples_leaf': 1, 'max_features': None, 'bootstrap': True, 'criterion': 'absolute_error'}. Best is trial 306 with value: 0.5054021215392881.
[I 2024-12-04 12:01:36,627] Trial 425 finished with value: 0.7006440889093318 and parameters: {'n_estimators': 344, 'max_depth': 30, 'min_samples_split': 5, 'min_samples_leaf': 1, 'max_features': 'sqrt', 'bootstrap': True, 'criterion': 'absolute_error'}. Best is trial 306 with value: 0.5054021215392881.
[I 2024-12-04 12:01:37,831] Trial 431 finished with value: 0.5124942124403291 and parameters: {'n_estimators': 106, 'max_depth': 29, 'min_samples_split': 4, 'min_samples_leaf': 1, 'max_features': None, 'bootstrap': True, 'criterion': 'absolute_error'}. Best is trial 306 with value: 0.5054021215392881.
[I 2024-12-04 12:01:39,067] Trial 434 finished with value: 0.5087708516814423 and parameters: {'n_estimators': 108, 'max_depth': 24, 'min_samples_split': 5, 'min_samples_leaf': 1, 'max_features': None, 'bootstrap': True, 'criterion': 'absolute_error'}. Best is trial 306 with value: 0.5054021215392881.
[I 2024-12-04 12:01:41,472] Trial 428 finished with value: 0.5541140595626836 and parameters: {'n_estimators': 151, 'max_depth': 21, 'min_samples_split': 5, 'min_samples_leaf': 2, 'max_features': None, 'bootstrap': True, 'criterion': 'absolute_error'}. Best is trial 306 with value: 0.5054021215392881.
[I 2024-12-04 12:01:49,711] Trial 427 finished with value: 0.5202664788371335 and parameters: {'n_estimators': 262, 'max_depth': 11, 'min_samples_split': 5, 'min_samples_leaf': 1, 'max_features': None, 'bootstrap': True, 'criterion': 'absolute_error'}. Best is trial 306 with value: 0.5054021215392881.
[I 2024-12-04 12:01:49,721] Trial 433 finished with value: 0.5196723742729593 and parameters: {'n_estimators': 173, 'max_depth': 21, 'min_samples_split': 4, 'min_samples_leaf': 1, 'max_features': None, 'bootstrap': True, 'criterion': 'absolute_error'}. Best is trial 306 with value: 0.5054021215392881.
[I 2024-12-04 12:01:49,949] Trial 441 finished with value: 0.5261215503510825 and parameters: {'n_estimators': 117, 'max_depth': 7, 'min_samples_split': 4, 'min_samples_leaf': 1, 'max_features': None, 'bootstrap': True, 'criterion': 'absolute_error'}. Best is trial 306 with value: 0.5054021215392881.
[I 2024-12-04 12:01:49,952] Trial 440 finished with value: 0.5257426041723717 and parameters: {'n_estimators': 105, 'max_depth': 8, 'min_samples_split': 3, 'min_samples_leaf': 1, 'max_features': None, 'bootstrap': True, 'criterion': 'absolute_error'}. Best is trial 306 with value: 0.5054021215392881.
[I 2024-12-04 12:01:49,968] Trial 422 finished with value: 0.5172368665835465 and parameters: {'n_estimators': 186, 'max_depth': 24, 'min_samples_split': 5, 'min_samples_leaf': 1, 'max_features': None, 'bootstrap': True, 'criterion': 'absolute_error'}. Best is trial 306 with value: 0.5054021215392881.
