[I 2024-12-04 20:10:29,522] Trial 706 finished with value: 0.1424950776817316 and parameters: {'kernel_type': 'Matern', 'length_scale': 359.99217535157817, 'noise_level': 0.8734605120045901, 'constant_value': 0.3746365948884401, 'nu': 1.5}. Best is trial 616 with value: 0.1375127577189955.
[I 2024-12-04 20:10:31,025] Trial 707 finished with value: 0.14249493231404314 and parameters: {'kernel_type': 'Matern', 'length_scale': 8.643034897807535, 'noise_level': 0.013562814473994763, 'constant_value': 477.9467417222305, 'nu': 1.5}. Best is trial 616 with value: 0.1375127577189955.
[I 2024-12-04 20:10:32,078] Trial 708 finished with value: 0.14249506458562022 and parameters: {'kernel_type': 'Matern', 'length_scale': 22.577399351610172, 'noise_level': 0.08695939429185019, 'constant_value': 371.105606272117, 'nu': 1.5}. Best is trial 616 with value: 0.1375127577189955.
[I 2024-12-04 20:10:37,482] Trial 709 finished with value: 0.9864686819226388 and parameters: {'kernel_type': 'Matern', 'length_scale': 759.1399638207496, 'noise_level': 0.010762398095089802, 'constant_value': 3.5381034828777236, 'nu': 2.5}. Best is trial 616 with value: 0.1375127577189955.
[I 2024-12-04 20:10:38,894] Trial 710 finished with value: 0.14249505828540465 and parameters: {'kernel_type': 'Matern', 'length_scale': 28.75611901399816, 'noise_level': 0.6925941703472133, 'constant_value': 5.38511356350772, 'nu': 1.5}. Best is trial 616 with value: 0.1375127577189955.
[I 2024-12-04 20:10:41,394] Trial 711 finished with value: 0.9864686819226194 and parameters: {'kernel_type': 'RBF', 'length_scale': 63.421506490608294, 'noise_level': 0.0005417771811725897, 'constant_value': 0.0007754598171844904, 'nu': 0.5}. Best is trial 616 with value: 0.1375127577189955.
[I 2024-12-04 20:10:46,045] Trial 713 finished with value: 0.1424950875205502 and parameters: {'kernel_type': 'Matern', 'length_scale': 1.042740777976374, 'noise_level': 0.9225006255192397, 'constant_value': 2247.1745790561326, 'nu': 1.5}. Best is trial 616 with value: 0.1375127577189955.
[I 2024-12-04 20:10:47,680] Trial 712 finished with value: 0.14249505891067807 and parameters: {'kernel_type': 'Matern', 'length_scale': 0.13256631217044526, 'noise_level': 0.030211266341642572, 'constant_value': 183.28902758006512, 'nu': 1.5}. Best is trial 616 with value: 0.1375127577189955.
[I 2024-12-04 20:10:49,448] Trial 714 finished with value: 0.9864686819225666 and parameters: {'kernel_type': 'Matern', 'length_scale': 4206.496614086596, 'noise_level': 0.01391009560940096, 'constant_value': 90.44494647787057, 'nu': 1.5}. Best is trial 616 with value: 0.1375127577189955.
[I 2024-12-04 20:10:50,548] Trial 715 finished with value: 0.9982171094696269 and parameters: {'kernel_type': 'Matern', 'length_scale': 5.794868614879717, 'noise_level': 2.2526999871707869e-10, 'constant_value': 13797.266994070345, 'nu': 2.5}. Best is trial 616 with value: 0.1375127577189955.
[I 2024-12-04 20:10:54,496] Trial 716 finished with value: 0.9982171094774962 and parameters: {'kernel_type': 'Matern', 'length_scale': 67812.3544155401, 'noise_level': 0.14422916043355907, 'constant_value': 0.0011882726932421006, 'nu': 1.5}. Best is trial 616 with value: 0.1375127577189955.
[I 2024-12-04 20:10:59,460] Trial 717 finished with value: 0.14249494489208828 and parameters: {'kernel_type': 'Matern', 'length_scale': 769.8368164338866, 'noise_level': 0.05320191681675691, 'constant_value': 25.823963782032326, 'nu': 1.5}. Best is trial 616 with value: 0.1375127577189955.
[I 2024-12-04 20:11:02,130] Trial 719 finished with value: 0.19720000405738805 and parameters: {'kernel_type': 'Matern', 'length_scale': 72.46093498063817, 'noise_level': 0.41721574912103526, 'constant_value': 3905.2078997447716, 'nu': 0.5}. Best is trial 616 with value: 0.1375127577189955.
[I 2024-12-04 20:11:03,376] Trial 718 finished with value: 0.9864686819381236 and parameters: {'kernel_type': 'Matern', 'length_scale': 9282.778921422398, 'noise_level': 0.7884315908412018, 'constant_value': 2.672592506287131, 'nu': 1.5}. Best is trial 616 with value: 0.1375127577189955.
[I 2024-12-04 20:11:07,497] Trial 720 finished with value: 0.14249506402364295 and parameters: {'kernel_type': 'Matern', 'length_scale': 3.842373201762509, 'noise_level': 0.02369598691283997, 'constant_value': 175.40485598048113, 'nu': 1.5}. Best is trial 616 with value: 0.1375127577189955.
[I 2024-12-04 20:11:09,482] Trial 721 finished with value: 0.9864686819007056 and parameters: {'kernel_type': 'RBF', 'length_scale': 0.00035957811169933185, 'noise_level': 7.993593393393195e-06, 'constant_value': 2.2325443651571902e-07, 'nu': 2.5}. Best is trial 616 with value: 0.1375127577189955.
[I 2024-12-04 20:11:11,766] Trial 722 finished with value: 0.1424948773447948 and parameters: {'kernel_type': 'Matern', 'length_scale': 0.2874017016524469, 'noise_level': 0.02569418602010601, 'constant_value': 7526.353773521493, 'nu': 1.5}. Best is trial 616 with value: 0.1375127577189955.
[I 2024-12-04 20:11:15,777] Trial 724 finished with value: 0.1424949282420175 and parameters: {'kernel_type': 'Matern', 'length_scale': 35.46824002841094, 'noise_level': 0.815445420497006, 'constant_value': 1.9088226339130268, 'nu': 1.5}. Best is trial 616 with value: 0.1375127577189955.
[I 2024-12-04 20:11:16,280] Trial 725 finished with value: 0.9982166058321885 and parameters: {'kernel_type': 'Matern', 'length_scale': 5.6909216307161605, 'noise_level': 7.715164529704468e-08, 'constant_value': 1443.6124108869299, 'nu': 0.5}. Best is trial 616 with value: 0.1375127577189955.
[I 2024-12-04 20:11:19,141] Trial 723 finished with value: 0.9864686819184186 and parameters: {'kernel_type': 'Matern', 'length_scale': 2.7201613669596546e-05, 'noise_level': 0.0001435305027980547, 'constant_value': 1.0699118785652953e-07, 'nu': 1.5}. Best is trial 616 with value: 0.1375127577189955.
[I 2024-12-04 20:11:23,030] Trial 726 finished with value: 0.14249496373980072 and parameters: {'kernel_type': 'Matern', 'length_scale': 249.18112226750603, 'noise_level': 0.028698364471626766, 'constant_value': 45.659741217852996, 'nu': 1.5}. Best is trial 616 with value: 0.1375127577189955.
[I 2024-12-04 20:11:23,665] Trial 727 finished with value: 0.1424949183745166 and parameters: {'kernel_type': 'Matern', 'length_scale': 4.782818348069406, 'noise_level': 0.013136367079615508, 'constant_value': 340.8141062671037, 'nu': 1.5}. Best is trial 616 with value: 0.1375127577189955.
[I 2024-12-04 20:11:28,372] Trial 728 finished with value: 0.19720003385925255 and parameters: {'kernel_type': 'Matern', 'length_scale': 0.13559865058069417, 'noise_level': 0.5682248180224027, 'constant_value': 10.69613621115823, 'nu': 0.5}. Best is trial 616 with value: 0.1375127577189955.
[I 2024-12-04 20:11:31,354] Trial 730 finished with value: 0.14249505117121167 and parameters: {'kernel_type': 'Matern', 'length_scale': 0.4525458278900557, 'noise_level': 0.9066291852300173, 'constant_value': 1776.1945275217697, 'nu': 1.5}. Best is trial 616 with value: 0.1375127577189955.
[I 2024-12-04 20:11:34,145] Trial 729 finished with value: 0.14249512066794326 and parameters: {'kernel_type': 'Matern', 'length_scale': 0.20648774353841412, 'noise_level': 0.4528519321986905, 'constant_value': 11.42398429913811, 'nu': 1.5}. Best is trial 616 with value: 0.1375127577189955.
[I 2024-12-04 20:11:36,701] Trial 731 finished with value: 0.9864686819275678 and parameters: {'kernel_type': 'Matern', 'length_scale': 9.253333758818727, 'noise_level': 2.411573326629318e-07, 'constant_value': 0.3248317220319025, 'nu': 0.5}. Best is trial 616 with value: 0.1375127577189955.
[I 2024-12-04 20:11:38,939] Trial 732 finished with value: 0.14771037526608674 and parameters: {'kernel_type': 'RBF', 'length_scale': 1.1827234887116074, 'noise_level': 0.9138002220174352, 'constant_value': 204.5415114956634, 'nu': 1.5}. Best is trial 616 with value: 0.1375127577189955.
[I 2024-12-04 20:11:42,681] Trial 733 finished with value: 0.14249506196575384 and parameters: {'kernel_type': 'Matern', 'length_scale': 1.838341386570063, 'noise_level': 0.013093344042084685, 'constant_value': 0.07495913278897064, 'nu': 1.5}. Best is trial 616 with value: 0.1375127577189955.
[I 2024-12-04 20:11:45,097] Trial 734 finished with value: 0.14249506596988057 and parameters: {'kernel_type': 'Matern', 'length_scale': 62.581927606975476, 'noise_level': 0.926039590510355, 'constant_value': 79.80186997250391, 'nu': 1.5}. Best is trial 616 with value: 0.1375127577189955.
[I 2024-12-04 20:11:49,609] Trial 735 finished with value: 0.1424950615632095 and parameters: {'kernel_type': 'Matern', 'length_scale': 2.1274969221657543, 'noise_level': 0.0003357868321550481, 'constant_value': 22.505899331179176, 'nu': 1.5}. Best is trial 616 with value: 0.1375127577189955.
[I 2024-12-04 20:11:50,590] Trial 736 finished with value: 0.142495041697491 and parameters: {'kernel_type': 'Matern', 'length_scale': 20.039832817570804, 'noise_level': 0.005075140279860096, 'constant_value': 3510.3626959811736, 'nu': 1.5}. Best is trial 616 with value: 0.1375127577189955.
[I 2024-12-04 20:11:51,890] Trial 737 finished with value: 0.1446986371383529 and parameters: {'kernel_type': 'Matern', 'length_scale': 35.22214016886814, 'noise_level': 0.7564502965601753, 'constant_value': 48.664412216343884, 'nu': 2.5}. Best is trial 616 with value: 0.1375127577189955.
[I 2024-12-04 20:11:58,319] Trial 739 finished with value: 0.1424950655900012 and parameters: {'kernel_type': 'Matern', 'length_scale': 7.856702812166955, 'noise_level': 0.0526530500571042, 'constant_value': 3.914057868163093, 'nu': 1.5}. Best is trial 616 with value: 0.1375127577189955.
[I 2024-12-04 20:11:58,352] Trial 738 finished with value: 0.9864686819226696 and parameters: {'kernel_type': 'Matern', 'length_scale': 759.6414099267101, 'noise_level': 0.011231485486332163, 'constant_value': 78.06562484019187, 'nu': 1.5}. Best is trial 616 with value: 0.1375127577189955.
[I 2024-12-04 20:12:06,330] Trial 740 finished with value: 0.9864686821130926 and parameters: {'kernel_type': 'RBF', 'length_scale': 2480.0908371607793, 'noise_level': 3.886063369110083e-09, 'constant_value': 2.9979980075110683e-06, 'nu': 2.5}. Best is trial 616 with value: 0.1375127577189955.
[I 2024-12-04 20:12:06,973] Trial 741 finished with value: 0.14249507202347617 and parameters: {'kernel_type': 'Matern', 'length_scale': 0.37786297162846005, 'noise_level': 0.04686937286646864, 'constant_value': 57666.08869855219, 'nu': 1.5}. Best is trial 616 with value: 0.1375127577189955.
[I 2024-12-04 20:12:08,608] Trial 742 finished with value: 0.9864686819226751 and parameters: {'kernel_type': 'RBF', 'length_scale': 22846.28932323718, 'noise_level': 1.7024311013566526e-05, 'constant_value': 0.0027478118276210426, 'nu': 0.5}. Best is trial 616 with value: 0.1375127577189955.
[I 2024-12-04 20:12:11,769] Trial 744 finished with value: 0.9864686820181022 and parameters: {'kernel_type': 'Matern', 'length_scale': 0.00012786137566539856, 'noise_level': 0.0006120445019769385, 'constant_value': 0.14310444825080182, 'nu': 2.5}. Best is trial 616 with value: 0.1375127577189955.
[I 2024-12-04 20:12:12,767] Trial 743 finished with value: 0.14249501852500354 and parameters: {'kernel_type': 'Matern', 'length_scale': 33.65663006226043, 'noise_level': 0.0262586195602103, 'constant_value': 616.5601412787296, 'nu': 1.5}. Best is trial 616 with value: 0.1375127577189955.
[I 2024-12-04 20:12:16,885] Trial 745 finished with value: 0.14249507358082375 and parameters: {'kernel_type': 'Matern', 'length_scale': 0.5945603892982355, 'noise_level': 0.9920560156679393, 'constant_value': 30.43156452068587, 'nu': 1.5}. Best is trial 616 with value: 0.1375127577189955.
[I 2024-12-04 20:12:17,829] Trial 746 finished with value: 0.14249506278525978 and parameters: {'kernel_type': 'Matern', 'length_scale': 78.70716046019844, 'noise_level': 0.0617173601635892, 'constant_value': 192.50631731415623, 'nu': 1.5}. Best is trial 616 with value: 0.1375127577189955.
[I 2024-12-04 20:12:20,926] Trial 747 finished with value: 0.1424950597395293 and parameters: {'kernel_type': 'Matern', 'length_scale': 2.6638216776948886, 'noise_level': 0.7455978934336088, 'constant_value': 736.1447251486367, 'nu': 1.5}. Best is trial 616 with value: 0.1375127577189955.
[I 2024-12-04 20:12:24,980] Trial 749 finished with value: 0.142494911136492 and parameters: {'kernel_type': 'Matern', 'length_scale': 1.8064741214603905, 'noise_level': 0.008951311991579265, 'constant_value': 3.456632516525181, 'nu': 1.5}. Best is trial 616 with value: 0.1375127577189955.
[I 2024-12-04 20:12:26,209] Trial 748 finished with value: 0.9864686819212696 and parameters: {'kernel_type': 'Matern', 'length_scale': 13651.77372139421, 'noise_level': 0.007756521090070322, 'constant_value': 13011.810566279515, 'nu': 1.5}. Best is trial 616 with value: 0.1375127577189955.
[I 2024-12-04 20:12:31,281] Trial 751 finished with value: 0.9864686819226597 and parameters: {'kernel_type': 'Matern', 'length_scale': 0.035703253487910036, 'noise_level': 0.008609566033726207, 'constant_value': 19.35423673928033, 'nu': 1.5}. Best is trial 616 with value: 0.1375127577189955.
[I 2024-12-04 20:12:32,456] Trial 750 finished with value: 0.9864686818119223 and parameters: {'kernel_type': 'RBF', 'length_scale': 2.604653802664009, 'noise_level': 2.4010973574190514e-10, 'constant_value': 3.2826805303654893e-07, 'nu': 2.5}. Best is trial 616 with value: 0.1375127577189955.
[I 2024-12-04 20:12:35,655] Trial 752 finished with value: 0.9982171093337681 and parameters: {'kernel_type': 'Matern', 'length_scale': 52515.37267816728, 'noise_level': 0.012674325885370073, 'constant_value': 0.11313530074098335, 'nu': 1.5}. Best is trial 616 with value: 0.1375127577189955.
[I 2024-12-04 20:12:39,899] Trial 753 finished with value: 0.14249506157157524 and parameters: {'kernel_type': 'Matern', 'length_scale': 9.822705207346242, 'noise_level': 0.7451988478912787, 'constant_value': 384.46583493438527, 'nu': 1.5}. Best is trial 616 with value: 0.1375127577189955.
[I 2024-12-04 20:12:42,906] Trial 754 finished with value: 0.9864686819210242 and parameters: {'kernel_type': 'RBF', 'length_scale': 26.790753790425324, 'noise_level': 5.343166538036133e-09, 'constant_value': 1.7348883696218509e-06, 'nu': 0.5}. Best is trial 616 with value: 0.1375127577189955.
[I 2024-12-04 20:12:43,218] Trial 755 finished with value: 0.14249506452101426 and parameters: {'kernel_type': 'Matern', 'length_scale': 98.29952533116499, 'noise_level': 0.017450817005789144, 'constant_value': 6.635933730109215, 'nu': 1.5}. Best is trial 616 with value: 0.1375127577189955.
[I 2024-12-04 20:12:48,230] Trial 756 finished with value: 0.14249506411246793 and parameters: {'kernel_type': 'Matern', 'length_scale': 6.85958356757043, 'noise_level': 0.9985253400033872, 'constant_value': 102.56824488518792, 'nu': 1.5}. Best is trial 616 with value: 0.1375127577189955.
[I 2024-12-04 20:12:48,614] Trial 757 finished with value: 0.14771000395699938 and parameters: {'kernel_type': 'RBF', 'length_scale': 17.84147880218536, 'noise_level': 0.0058907722697927765, 'constant_value': 253.09937576164995, 'nu': 1.5}. Best is trial 616 with value: 0.1375127577189955.
[I 2024-12-04 20:12:51,123] Trial 758 finished with value: 0.14249571491971966 and parameters: {'kernel_type': 'Matern', 'length_scale': 11.248029468460329, 'noise_level': 0.6161148883653906, 'constant_value': 0.05010376314633712, 'nu': 1.5}. Best is trial 616 with value: 0.1375127577189955.
[I 2024-12-04 20:12:54,524] Trial 759 finished with value: 0.998217104852917 and parameters: {'kernel_type': 'Matern', 'length_scale': 5588.161158626251, 'noise_level': 0.7343964447221286, 'constant_value': 0.0044006017626295095, 'nu': 1.5}. Best is trial 616 with value: 0.1375127577189955.
[I 2024-12-04 20:12:55,431] Trial 760 finished with value: 0.14249501359255565 and parameters: {'kernel_type': 'Matern', 'length_scale': 0.397872802810247, 'noise_level': 0.23394115203282967, 'constant_value': 87554.76225823343, 'nu': 1.5}. Best is trial 616 with value: 0.1375127577189955.
[I 2024-12-04 20:12:56,985] Trial 761 finished with value: 0.14249485469913079 and parameters: {'kernel_type': 'Matern', 'length_scale': 34.241069818712084, 'noise_level': 0.006229122876743446, 'constant_value': 1714.4099752286263, 'nu': 1.5}. Best is trial 616 with value: 0.1375127577189955.
[I 2024-12-04 20:12:59,073] Trial 762 finished with value: 0.986468681972991 and parameters: {'kernel_type': 'RBF', 'length_scale': 4.006824085817314e-05, 'noise_level': 2.9890670437199657e-05, 'constant_value': 2.4754264951904417, 'nu': 2.5}. Best is trial 616 with value: 0.1375127577189955.
[I 2024-12-04 20:13:02,840] Trial 764 finished with value: 0.9982171095015707 and parameters: {'kernel_type': 'RBF', 'length_scale': 84648.95420481137, 'noise_level': 0.7878660359886442, 'constant_value': 0.0008830113532779041, 'nu': 2.5}. Best is trial 616 with value: 0.1375127577189955.
[I 2024-12-04 20:13:04,981] Trial 763 finished with value: 0.14249530609316868 and parameters: {'kernel_type': 'Matern', 'length_scale': 38.73391314005873, 'noise_level': 0.01627196979367006, 'constant_value': 743.0016230986993, 'nu': 1.5}. Best is trial 616 with value: 0.1375127577189955.
[I 2024-12-04 20:13:09,176] Trial 765 finished with value: 0.1424950332484132 and parameters: {'kernel_type': 'Matern', 'length_scale': 0.19547994093569085, 'noise_level': 0.031197912667131237, 'constant_value': 0.8151136701603836, 'nu': 1.5}. Best is trial 616 with value: 0.1375127577189955.
[I 2024-12-04 20:13:09,735] Trial 766 finished with value: 0.14249506395440908 and parameters: {'kernel_type': 'Matern', 'length_scale': 112.76181565558021, 'noise_level': 0.06784812519871053, 'constant_value': 30.801977847693294, 'nu': 1.5}. Best is trial 616 with value: 0.1375127577189955.
[I 2024-12-04 20:13:11,331] Trial 767 finished with value: 0.9982170794966873 and parameters: {'kernel_type': 'Matern', 'length_scale': 7464.104391662695, 'noise_level': 0.4631673066681636, 'constant_value': 0.3612356571866369, 'nu': 1.5}. Best is trial 616 with value: 0.1375127577189955.
[I 2024-12-04 20:13:13,871] Trial 768 finished with value: 0.9864686224971728 and parameters: {'kernel_type': 'Matern', 'length_scale': 0.09186417675789717, 'noise_level': 0.0005748487095641082, 'constant_value': 59.72192888675836, 'nu': 1.5}. Best is trial 616 with value: 0.1375127577189955.
[I 2024-12-04 20:13:18,796] Trial 769 finished with value: 0.14249508932036867 and parameters: {'kernel_type': 'Matern', 'length_scale': 18.45680266357038, 'noise_level': 0.008300134085339018, 'constant_value': 23351.46652152426, 'nu': 1.5}. Best is trial 616 with value: 0.1375127577189955.
[I 2024-12-04 20:13:25,946] Trial 772 finished with value: 0.9864686819224444 and parameters: {'kernel_type': 'Matern', 'length_scale': 0.030146260974011442, 'noise_level': 0.6157048188354789, 'constant_value': 1438.110827473924, 'nu': 1.5}. Best is trial 616 with value: 0.1375127577189955.
[I 2024-12-04 20:13:27,142] Trial 770 finished with value: 0.14249505937097431 and parameters: {'kernel_type': 'Matern', 'length_scale': 4.132388124187431, 'noise_level': 0.8520996505983643, 'constant_value': 0.9478435850720642, 'nu': 1.5}. Best is trial 616 with value: 0.1375127577189955.
[I 2024-12-04 20:13:32,923] Trial 771 finished with value: 0.14249430333039834 and parameters: {'kernel_type': 'Matern', 'length_scale': 27.080878815901023, 'noise_level': 0.0014398613824736421, 'constant_value': 5.62324283420227, 'nu': 1.5}. Best is trial 616 with value: 0.1375127577189955.
[I 2024-12-04 20:13:35,224] Trial 774 finished with value: 0.1424950654965417 and parameters: {'kernel_type': 'Matern', 'length_scale': 1028.4746809649985, 'noise_level': 0.0378248365977991, 'constant_value': 108.3297091468463, 'nu': 1.5}. Best is trial 616 with value: 0.1375127577189955.
[I 2024-12-04 20:13:37,217] Trial 773 finished with value: 0.14249522216000574 and parameters: {'kernel_type': 'Matern', 'length_scale': 34.80301048246889, 'noise_level': 0.06645316971805523, 'constant_value': 1619.6454872407237, 'nu': 1.5}. Best is trial 616 with value: 0.1375127577189955.
[I 2024-12-04 20:13:38,819] Trial 775 finished with value: 0.9864686819438956 and parameters: {'kernel_type': 'Matern', 'length_scale': 23.406740982910815, 'noise_level': 4.626774788006955e-05, 'constant_value': 1.9604461916897342, 'nu': 1.5}. Best is trial 616 with value: 0.1375127577189955.
[I 2024-12-04 20:13:42,222] Trial 776 finished with value: 0.9864686819223163 and parameters: {'kernel_type': 'Matern', 'length_scale': 264.90372356961194, 'noise_level': 8.936630436449387e-05, 'constant_value': 107.25805066620511, 'nu': 1.5}. Best is trial 616 with value: 0.1375127577189955.
[I 2024-12-04 20:13:42,975] Trial 777 finished with value: 0.1477101668675649 and parameters: {'kernel_type': 'RBF', 'length_scale': 485.9976441637412, 'noise_level': 0.7463827679206562, 'constant_value': 67.12731240726693, 'nu': 1.5}. Best is trial 616 with value: 0.1375127577189955.
[I 2024-12-04 20:13:43,665] Trial 778 finished with value: 0.9864686819243048 and parameters: {'kernel_type': 'Matern', 'length_scale': 0.0002331550086958246, 'noise_level': 1.5403190074461036e-06, 'constant_value': 0.027964609336695687, 'nu': 1.5}. Best is trial 616 with value: 0.1375127577189955.
[I 2024-12-04 20:13:48,435] Trial 780 finished with value: 0.9864686819196639 and parameters: {'kernel_type': 'Matern', 'length_scale': 2.4940194876010807e-05, 'noise_level': 2.0156264591009484e-10, 'constant_value': 0.010797731202496639, 'nu': 2.5}. Best is trial 616 with value: 0.1375127577189955.
[I 2024-12-04 20:13:50,715] Trial 779 finished with value: 0.14249505776607616 and parameters: {'kernel_type': 'Matern', 'length_scale': 116.67149424807714, 'noise_level': 0.017761084314759076, 'constant_value': 9.672707811069728, 'nu': 1.5}. Best is trial 616 with value: 0.1375127577189955.
