[I 2024-12-04 12:07:59,709] Trial 2441 finished with value: 1.2668403378809088 and parameters: {'max_depth': 25, 'min_samples_split': 2, 'min_samples_leaf': 1, 'max_features': 'sqrt', 'criterion': 'absolute_error', 'splitter': 'random'}. Best is trial 309 with value: 0.46729638362398634.
[I 2024-12-04 12:07:59,753] Trial 2447 finished with value: 0.7188087833617175 and parameters: {'max_depth': 31, 'min_samples_split': 5, 'min_samples_leaf': 1, 'max_features': 'sqrt', 'criterion': 'absolute_error', 'splitter': 'best'}. Best is trial 309 with value: 0.46729638362398634.
[I 2024-12-04 12:08:00,149] Trial 2451 finished with value: 0.5380234000646094 and parameters: {'max_depth': 30, 'min_samples_split': 2, 'min_samples_leaf': 1, 'max_features': 'sqrt', 'criterion': 'absolute_error', 'splitter': 'best'}. Best is trial 309 with value: 0.46729638362398634.
[I 2024-12-04 12:08:00,152] Trial 2442 finished with value: 0.5380234000646094 and parameters: {'max_depth': 30, 'min_samples_split': 2, 'min_samples_leaf': 1, 'max_features': 'sqrt', 'criterion': 'absolute_error', 'splitter': 'best'}. Best is trial 309 with value: 0.46729638362398634.
[I 2024-12-04 12:08:00,554] Trial 2444 finished with value: 0.8666968382247049 and parameters: {'max_depth': 27, 'min_samples_split': 2, 'min_samples_leaf': 3, 'max_features': 'sqrt', 'criterion': 'absolute_error', 'splitter': 'best'}. Best is trial 309 with value: 0.46729638362398634.
[I 2024-12-04 12:08:00,717] Trial 2449 finished with value: 0.6050209057105678 and parameters: {'max_depth': 29, 'min_samples_split': 5, 'min_samples_leaf': 1, 'max_features': 'sqrt', 'criterion': 'absolute_error', 'splitter': 'best'}. Best is trial 309 with value: 0.46729638362398634.
[I 2024-12-04 12:08:01,755] Trial 2455 finished with value: 0.8122081295971162 and parameters: {'max_depth': 29, 'min_samples_split': 5, 'min_samples_leaf': 2, 'max_features': 'sqrt', 'criterion': 'absolute_error', 'splitter': 'random'}. Best is trial 309 with value: 0.46729638362398634.
[I 2024-12-04 12:08:01,756] Trial 2448 finished with value: 0.8666968382247049 and parameters: {'max_depth': 30, 'min_samples_split': 2, 'min_samples_leaf': 3, 'max_features': 'sqrt', 'criterion': 'absolute_error', 'splitter': 'best'}. Best is trial 309 with value: 0.46729638362398634.
[I 2024-12-04 12:08:02,146] Trial 2450 finished with value: 1.0894525583560912 and parameters: {'max_depth': 35, 'min_samples_split': 2, 'min_samples_leaf': 2, 'max_features': 'sqrt', 'criterion': 'absolute_error', 'splitter': 'best'}. Best is trial 309 with value: 0.46729638362398634.
[I 2024-12-04 12:08:03,034] Trial 2440 finished with value: 0.8666968382247049 and parameters: {'max_depth': 29, 'min_samples_split': 5, 'min_samples_leaf': 3, 'max_features': 'sqrt', 'criterion': 'absolute_error', 'splitter': 'best'}. Best is trial 309 with value: 0.46729638362398634.
[I 2024-12-04 12:08:03,307] Trial 2465 finished with value: 1.0081785092902962 and parameters: {'max_depth': 27, 'min_samples_split': 2, 'min_samples_leaf': 1, 'max_features': 'sqrt', 'criterion': 'absolute_error', 'splitter': 'best'}. Best is trial 309 with value: 0.46729638362398634.
[I 2024-12-04 12:08:03,592] Trial 2453 finished with value: 1.1104329532849138 and parameters: {'max_depth': 35, 'min_samples_split': 5, 'min_samples_leaf': 2, 'max_features': 'sqrt', 'criterion': 'absolute_error', 'splitter': 'best'}. Best is trial 309 with value: 0.46729638362398634.
[I 2024-12-04 12:08:03,594] Trial 2452 finished with value: 0.6128215778007012 and parameters: {'max_depth': 30, 'min_samples_split': 5, 'min_samples_leaf': 1, 'max_features': 'sqrt', 'criterion': 'absolute_error', 'splitter': 'best'}. Best is trial 309 with value: 0.46729638362398634.
[I 2024-12-04 12:08:04,429] Trial 2454 finished with value: 0.8666968382247049 and parameters: {'max_depth': 35, 'min_samples_split': 2, 'min_samples_leaf': 3, 'max_features': 'sqrt', 'criterion': 'absolute_error', 'splitter': 'best'}. Best is trial 309 with value: 0.46729638362398634.
[I 2024-12-04 12:08:04,812] Trial 2466 finished with value: 0.7238455884864453 and parameters: {'max_depth': 35, 'min_samples_split': 5, 'min_samples_leaf': 1, 'max_features': 'sqrt', 'criterion': 'absolute_error', 'splitter': 'best'}. Best is trial 309 with value: 0.46729638362398634.
[I 2024-12-04 12:08:05,151] Trial 2460 finished with value: 0.5266640698896663 and parameters: {'max_depth': 32, 'min_samples_split': 2, 'min_samples_leaf': 1, 'max_features': 'sqrt', 'criterion': 'absolute_error', 'splitter': 'best'}. Best is trial 309 with value: 0.46729638362398634.
[I 2024-12-04 12:08:05,166] Trial 2456 finished with value: 1.332079314898737 and parameters: {'max_depth': 21, 'min_samples_split': 11, 'min_samples_leaf': 1, 'max_features': 'log2', 'criterion': 'absolute_error', 'splitter': 'random'}. Best is trial 309 with value: 0.46729638362398634.
[I 2024-12-04 12:08:05,327] Trial 2439 finished with value: 1.107575270643249 and parameters: {'max_depth': 31, 'min_samples_split': 5, 'min_samples_leaf': 2, 'max_features': 'sqrt', 'criterion': 'absolute_error', 'splitter': 'best'}. Best is trial 309 with value: 0.46729638362398634.
[I 2024-12-04 12:08:06,363] Trial 2461 finished with value: 0.46729638362398634 and parameters: {'max_depth': 31, 'min_samples_split': 2, 'min_samples_leaf': 1, 'max_features': 'sqrt', 'criterion': 'absolute_error', 'splitter': 'best'}. Best is trial 309 with value: 0.46729638362398634.
[I 2024-12-04 12:08:06,578] Trial 2464 finished with value: 0.8666968382247049 and parameters: {'max_depth': 23, 'min_samples_split': 5, 'min_samples_leaf': 3, 'max_features': 'sqrt', 'criterion': 'absolute_error', 'splitter': 'best'}. Best is trial 309 with value: 0.46729638362398634.
[I 2024-12-04 12:08:07,046] Trial 2457 finished with value: 1.1208924650731016 and parameters: {'max_depth': 20, 'min_samples_split': 5, 'min_samples_leaf': 2, 'max_features': 'sqrt', 'criterion': 'absolute_error', 'splitter': 'best'}. Best is trial 309 with value: 0.46729638362398634.
[I 2024-12-04 12:08:07,179] Trial 2458 finished with value: 0.7172083157732059 and parameters: {'max_depth': 12, 'min_samples_split': 20, 'min_samples_leaf': 1, 'max_features': 'log2', 'criterion': 'friedman_mse', 'splitter': 'best'}. Best is trial 309 with value: 0.46729638362398634.
[I 2024-12-04 12:08:07,612] Trial 2463 finished with value: 0.46729638362398634 and parameters: {'max_depth': 31, 'min_samples_split': 2, 'min_samples_leaf': 1, 'max_features': 'sqrt', 'criterion': 'absolute_error', 'splitter': 'best'}. Best is trial 309 with value: 0.46729638362398634.
[I 2024-12-04 12:08:08,087] Trial 2467 finished with value: 0.5222024842783579 and parameters: {'max_depth': 35, 'min_samples_split': 2, 'min_samples_leaf': 1, 'max_features': 'sqrt', 'criterion': 'absolute_error', 'splitter': 'best'}. Best is trial 309 with value: 0.46729638362398634.
[I 2024-12-04 12:08:08,137] Trial 2470 finished with value: 1.0292874552700746 and parameters: {'max_depth': 22, 'min_samples_split': 2, 'min_samples_leaf': 1, 'max_features': 'sqrt', 'criterion': 'absolute_error', 'splitter': 'best'}. Best is trial 309 with value: 0.46729638362398634.
[I 2024-12-04 12:08:09,313] Trial 2459 finished with value: 0.7427434405271562 and parameters: {'max_depth': 22, 'min_samples_split': 2, 'min_samples_leaf': 2, 'max_features': 'sqrt', 'criterion': 'squared_error', 'splitter': 'best'}. Best is trial 309 with value: 0.46729638362398634.
[I 2024-12-04 12:08:10,386] Trial 2472 finished with value: 0.6913069320104774 and parameters: {'max_depth': 26, 'min_samples_split': 4, 'min_samples_leaf': 1, 'max_features': 'sqrt', 'criterion': 'absolute_error', 'splitter': 'best'}. Best is trial 309 with value: 0.46729638362398634.
[I 2024-12-04 12:08:10,552] Trial 2478 finished with value: 0.5917985221191467 and parameters: {'max_depth': 22, 'min_samples_split': 2, 'min_samples_leaf': 1, 'max_features': 'log2', 'criterion': 'absolute_error', 'splitter': 'best'}. Best is trial 309 with value: 0.46729638362398634.
[I 2024-12-04 12:08:10,922] Trial 2479 finished with value: 0.5380234000646094 and parameters: {'max_depth': 30, 'min_samples_split': 2, 'min_samples_leaf': 1, 'max_features': 'sqrt', 'criterion': 'absolute_error', 'splitter': 'best'}. Best is trial 309 with value: 0.46729638362398634.
[I 2024-12-04 12:08:10,963] Trial 2471 finished with value: 0.6050209057105678 and parameters: {'max_depth': 29, 'min_samples_split': 5, 'min_samples_leaf': 1, 'max_features': 'sqrt', 'criterion': 'absolute_error', 'splitter': 'best'}. Best is trial 309 with value: 0.46729638362398634.
[I 2024-12-04 12:08:12,215] Trial 2469 finished with value: 1.298283307656757 and parameters: {'max_depth': 30, 'min_samples_split': 18, 'min_samples_leaf': 6, 'max_features': 'log2', 'criterion': 'squared_error', 'splitter': 'random'}. Best is trial 309 with value: 0.46729638362398634.
[I 2024-12-04 12:08:12,878] Trial 2481 finished with value: 0.6567233315466673 and parameters: {'max_depth': 27, 'min_samples_split': 2, 'min_samples_leaf': 2, 'max_features': 'sqrt', 'criterion': 'absolute_error', 'splitter': 'best'}. Best is trial 309 with value: 0.46729638362398634.
[I 2024-12-04 12:08:14,011] Trial 2487 finished with value: 0.8666968382247049 and parameters: {'max_depth': 25, 'min_samples_split': 2, 'min_samples_leaf': 3, 'max_features': 'sqrt', 'criterion': 'absolute_error', 'splitter': 'best'}. Best is trial 309 with value: 0.46729638362398634.
[I 2024-12-04 12:08:14,086] Trial 2468 finished with value: 1.3629276849850611 and parameters: {'max_depth': 28, 'min_samples_split': 8, 'min_samples_leaf': 10, 'max_features': 'sqrt', 'criterion': 'absolute_error', 'splitter': 'random'}. Best is trial 309 with value: 0.46729638362398634.
[I 2024-12-04 12:08:14,154] Trial 2477 finished with value: 0.8666968382247049 and parameters: {'max_depth': 27, 'min_samples_split': 2, 'min_samples_leaf': 3, 'max_features': 'sqrt', 'criterion': 'absolute_error', 'splitter': 'best'}. Best is trial 309 with value: 0.46729638362398634.
[I 2024-12-04 12:08:14,178] Trial 2476 finished with value: 1.107575270643249 and parameters: {'max_depth': 31, 'min_samples_split': 5, 'min_samples_leaf': 2, 'max_features': 'sqrt', 'criterion': 'absolute_error', 'splitter': 'best'}. Best is trial 309 with value: 0.46729638362398634.
[I 2024-12-04 12:08:14,191] Trial 2462 finished with value: 0.5380234000646094 and parameters: {'max_depth': 30, 'min_samples_split': 2, 'min_samples_leaf': 1, 'max_features': 'sqrt', 'criterion': 'absolute_error', 'splitter': 'best'}. Best is trial 309 with value: 0.46729638362398634.
[I 2024-12-04 12:08:14,875] Trial 2474 finished with value: 0.5380234000646094 and parameters: {'max_depth': 30, 'min_samples_split': 2, 'min_samples_leaf': 1, 'max_features': 'sqrt', 'criterion': 'absolute_error', 'splitter': 'best'}. Best is trial 309 with value: 0.46729638362398634.
[I 2024-12-04 12:08:15,069] Trial 2486 finished with value: 1.1875076693358655 and parameters: {'max_depth': 26, 'min_samples_split': 2, 'min_samples_leaf': 1, 'max_features': 'sqrt', 'criterion': 'squared_error', 'splitter': 'random'}. Best is trial 309 with value: 0.46729638362398634.
[I 2024-12-04 12:08:15,278] Trial 2489 finished with value: 1.3629276849850611 and parameters: {'max_depth': 4, 'min_samples_split': 17, 'min_samples_leaf': 8, 'max_features': 'log2', 'criterion': 'absolute_error', 'splitter': 'random'}. Best is trial 309 with value: 0.46729638362398634.
[I 2024-12-04 12:08:16,062] Trial 2473 finished with value: 0.8666968382247049 and parameters: {'max_depth': 29, 'min_samples_split': 5, 'min_samples_leaf': 3, 'max_features': 'sqrt', 'criterion': 'absolute_error', 'splitter': 'best'}. Best is trial 309 with value: 0.46729638362398634.
[I 2024-12-04 12:08:16,692] Trial 2480 finished with value: 0.5209986636170143 and parameters: {'max_depth': 29, 'min_samples_split': 2, 'min_samples_leaf': 1, 'max_features': 'sqrt', 'criterion': 'absolute_error', 'splitter': 'best'}. Best is trial 309 with value: 0.46729638362398634.
[I 2024-12-04 12:08:16,983] Trial 2490 finished with value: 0.8666968382247049 and parameters: {'max_depth': 31, 'min_samples_split': 2, 'min_samples_leaf': 3, 'max_features': 'sqrt', 'criterion': 'absolute_error', 'splitter': 'best'}. Best is trial 309 with value: 0.46729638362398634.
[I 2024-12-04 12:08:16,997] Trial 2484 finished with value: 0.7238455884864453 and parameters: {'max_depth': 35, 'min_samples_split': 5, 'min_samples_leaf': 1, 'max_features': 'sqrt', 'criterion': 'absolute_error', 'splitter': 'best'}. Best is trial 309 with value: 0.46729638362398634.
[I 2024-12-04 12:08:17,263] Trial 2488 finished with value: 1.0235080961846112 and parameters: {'max_depth': 25, 'min_samples_split': 2, 'min_samples_leaf': 1, 'max_features': 'sqrt', 'criterion': 'absolute_error', 'splitter': 'best'}. Best is trial 309 with value: 0.46729638362398634.
[I 2024-12-04 12:08:17,319] Trial 2475 finished with value: 0.8666968382247049 and parameters: {'max_depth': 32, 'min_samples_split': 2, 'min_samples_leaf': 3, 'max_features': 'sqrt', 'criterion': 'absolute_error', 'splitter': 'best'}. Best is trial 309 with value: 0.46729638362398634.
[I 2024-12-04 12:08:17,477] Trial 2483 finished with value: 0.8666968382247049 and parameters: {'max_depth': 35, 'min_samples_split': 2, 'min_samples_leaf': 3, 'max_features': 'sqrt', 'criterion': 'absolute_error', 'splitter': 'best'}. Best is trial 309 with value: 0.46729638362398634.
[I 2024-12-04 12:08:17,489] Trial 2491 finished with value: 0.7169847047063859 and parameters: {'max_depth': 31, 'min_samples_split': 2, 'min_samples_leaf': 2, 'max_features': 'sqrt', 'criterion': 'absolute_error', 'splitter': 'best'}. Best is trial 309 with value: 0.46729638362398634.
[I 2024-12-04 12:08:17,491] Trial 2482 finished with value: 0.6050209057105678 and parameters: {'max_depth': 29, 'min_samples_split': 5, 'min_samples_leaf': 1, 'max_features': 'sqrt', 'criterion': 'absolute_error', 'splitter': 'best'}. Best is trial 309 with value: 0.46729638362398634.
[I 2024-12-04 12:08:17,498] Trial 2494 finished with value: 0.7253539704328348 and parameters: {'max_depth': 25, 'min_samples_split': 5, 'min_samples_leaf': 1, 'max_features': 'sqrt', 'criterion': 'absolute_error', 'splitter': 'best'}. Best is trial 309 with value: 0.46729638362398634.
[I 2024-12-04 12:08:17,726] Trial 2485 finished with value: 0.6050209057105678 and parameters: {'max_depth': 29, 'min_samples_split': 5, 'min_samples_leaf': 1, 'max_features': 'sqrt', 'criterion': 'absolute_error', 'splitter': 'best'}. Best is trial 309 with value: 0.46729638362398634.
[I 2024-12-04 12:08:17,771] Trial 2493 finished with value: 0.6128215778007012 and parameters: {'max_depth': 30, 'min_samples_split': 5, 'min_samples_leaf': 1, 'max_features': 'sqrt', 'criterion': 'absolute_error', 'splitter': 'best'}. Best is trial 309 with value: 0.46729638362398634.
[I 2024-12-04 12:08:17,938] Trial 2496 finished with value: 1.3130149982826922 and parameters: {'max_depth': 1, 'min_samples_split': 20, 'min_samples_leaf': 1, 'max_features': 'sqrt', 'criterion': 'friedman_mse', 'splitter': 'random'}. Best is trial 309 with value: 0.46729638362398634.
[I 2024-12-04 12:08:18,119] Trial 2492 finished with value: 1.3242587659035392 and parameters: {'max_depth': 24, 'min_samples_split': 2, 'min_samples_leaf': 1, 'max_features': 'log2', 'criterion': 'absolute_error', 'splitter': 'random'}. Best is trial 309 with value: 0.46729638362398634.
[I 2024-12-04 12:08:18,488] Trial 2497 finished with value: 0.583648648522531 and parameters: {'max_depth': 35, 'min_samples_split': 2, 'min_samples_leaf': 1, 'max_features': 'sqrt', 'criterion': 'absolute_error', 'splitter': 'random'}. Best is trial 309 with value: 0.46729638362398634.
[I 2024-12-04 12:08:18,956] Trial 2495 finished with value: 0.48023816165717975 and parameters: {'max_depth': 33, 'min_samples_split': 2, 'min_samples_leaf': 1, 'max_features': 'sqrt', 'criterion': 'absolute_error', 'splitter': 'best'}. Best is trial 309 with value: 0.46729638362398634.
[I 2024-12-04 12:08:18,962] Trial 2499 finished with value: 0.48023816165717975 and parameters: {'max_depth': 33, 'min_samples_split': 2, 'min_samples_leaf': 1, 'max_features': 'sqrt', 'criterion': 'absolute_error', 'splitter': 'best'}. Best is trial 309 with value: 0.46729638362398634.
[I 2024-12-04 12:08:19,040] Trial 2498 finished with value: 0.7188087833617175 and parameters: {'max_depth': 31, 'min_samples_split': 5, 'min_samples_leaf': 1, 'max_features': 'sqrt', 'criterion': 'absolute_error', 'splitter': 'best'}. Best is trial 309 with value: 0.46729638362398634.
