[I 2024-12-04 12:19:09,727] Trial 1859 finished with value: 0.2940625520366374 and parameters: {'n_estimators': 559, 'max_depth': 50, 'min_samples_split': 3, 'min_samples_leaf': 1, 'max_features': 'sqrt', 'bootstrap': False, 'criterion': 'squared_error'}. Best is trial 341 with value: 0.2909369124469028.
[I 2024-12-04 12:19:09,895] Trial 1854 finished with value: 0.30634024597580284 and parameters: {'n_estimators': 459, 'max_depth': 43, 'min_samples_split': 4, 'min_samples_leaf': 1, 'max_features': 'sqrt', 'bootstrap': False, 'criterion': 'squared_error'}. Best is trial 341 with value: 0.2909369124469028.
[I 2024-12-04 12:19:10,524] Trial 1847 finished with value: 0.2940251388978985 and parameters: {'n_estimators': 719, 'max_depth': 50, 'min_samples_split': 3, 'min_samples_leaf': 1, 'max_features': 'sqrt', 'bootstrap': False, 'criterion': 'squared_error'}. Best is trial 341 with value: 0.2909369124469028.
[I 2024-12-04 12:19:10,593] Trial 1836 finished with value: 0.3106229996145531 and parameters: {'n_estimators': 527, 'max_depth': 46, 'min_samples_split': 3, 'min_samples_leaf': 1, 'max_features': 'sqrt', 'bootstrap': False, 'criterion': 'absolute_error'}. Best is trial 341 with value: 0.2909369124469028.
[I 2024-12-04 12:19:11,438] Trial 1868 finished with value: 0.29793714916590625 and parameters: {'n_estimators': 365, 'max_depth': 50, 'min_samples_split': 2, 'min_samples_leaf': 1, 'max_features': 'sqrt', 'bootstrap': False, 'criterion': 'squared_error'}. Best is trial 341 with value: 0.2909369124469028.
[I 2024-12-04 12:19:12,326] Trial 1864 finished with value: 0.43897033317691087 and parameters: {'n_estimators': 257, 'max_depth': 31, 'min_samples_split': 40, 'min_samples_leaf': 1, 'max_features': None, 'bootstrap': False, 'criterion': 'squared_error'}. Best is trial 341 with value: 0.2909369124469028.
[I 2024-12-04 12:19:12,336] Trial 1869 finished with value: 0.29992285621594317 and parameters: {'n_estimators': 481, 'max_depth': 50, 'min_samples_split': 4, 'min_samples_leaf': 1, 'max_features': 'sqrt', 'bootstrap': False, 'criterion': 'squared_error'}. Best is trial 341 with value: 0.2909369124469028.
[I 2024-12-04 12:19:12,571] Trial 1871 finished with value: 0.3011961021477248 and parameters: {'n_estimators': 103, 'max_depth': 50, 'min_samples_split': 5, 'min_samples_leaf': 1, 'max_features': 'sqrt', 'bootstrap': False, 'criterion': 'squared_error'}. Best is trial 341 with value: 0.2909369124469028.
[I 2024-12-04 12:19:13,228] Trial 1867 finished with value: 0.3089736360084695 and parameters: {'n_estimators': 305, 'max_depth': 42, 'min_samples_split': 4, 'min_samples_leaf': 1, 'max_features': 'sqrt', 'bootstrap': False, 'criterion': 'squared_error'}. Best is trial 341 with value: 0.2909369124469028.
[I 2024-12-04 12:19:13,230] Trial 1866 finished with value: 0.3299053494939748 and parameters: {'n_estimators': 135, 'max_depth': 36, 'min_samples_split': 4, 'min_samples_leaf': 1, 'max_features': 'sqrt', 'bootstrap': False, 'criterion': 'squared_error'}. Best is trial 341 with value: 0.2909369124469028.
[I 2024-12-04 12:19:13,337] Trial 1872 finished with value: 0.2957324153701091 and parameters: {'n_estimators': 252, 'max_depth': 46, 'min_samples_split': 3, 'min_samples_leaf': 1, 'max_features': 'sqrt', 'bootstrap': False, 'criterion': 'squared_error'}. Best is trial 341 with value: 0.2909369124469028.
[I 2024-12-04 12:19:14,488] Trial 1865 finished with value: 0.3037525255049784 and parameters: {'n_estimators': 467, 'max_depth': 50, 'min_samples_split': 5, 'min_samples_leaf': 1, 'max_features': 'sqrt', 'bootstrap': False, 'criterion': 'squared_error'}. Best is trial 341 with value: 0.2909369124469028.
[I 2024-12-04 12:19:14,864] Trial 1857 finished with value: 0.3461575039027903 and parameters: {'n_estimators': 488, 'max_depth': 50, 'min_samples_split': 2, 'min_samples_leaf': 2, 'max_features': None, 'bootstrap': True, 'criterion': 'squared_error'}. Best is trial 341 with value: 0.2909369124469028.
[I 2024-12-04 12:19:16,054] Trial 1877 finished with value: 0.8218667969812147 and parameters: {'n_estimators': 169, 'max_depth': 25, 'min_samples_split': 18, 'min_samples_leaf': 3, 'max_features': 'log2', 'bootstrap': False, 'criterion': 'absolute_error'}. Best is trial 341 with value: 0.2909369124469028.
[I 2024-12-04 12:19:17,856] Trial 1876 finished with value: 0.2954218744350181 and parameters: {'n_estimators': 101, 'max_depth': 49, 'min_samples_split': 2, 'min_samples_leaf': 1, 'max_features': 'sqrt', 'bootstrap': False, 'criterion': 'squared_error'}. Best is trial 341 with value: 0.2909369124469028.
[I 2024-12-04 12:19:20,142] Trial 1874 finished with value: 0.29899693116713594 and parameters: {'n_estimators': 675, 'max_depth': 50, 'min_samples_split': 2, 'min_samples_leaf': 1, 'max_features': 'sqrt', 'bootstrap': False, 'criterion': 'squared_error'}. Best is trial 341 with value: 0.2909369124469028.
[I 2024-12-04 12:19:20,350] Trial 1883 finished with value: 0.44552708464668683 and parameters: {'n_estimators': 298, 'max_depth': 45, 'min_samples_split': 4, 'min_samples_leaf': 2, 'max_features': 'sqrt', 'bootstrap': False, 'criterion': 'squared_error'}. Best is trial 341 with value: 0.2909369124469028.
[I 2024-12-04 12:19:22,023] Trial 1875 finished with value: 0.30644396658030876 and parameters: {'n_estimators': 248, 'max_depth': 43, 'min_samples_split': 4, 'min_samples_leaf': 1, 'max_features': 'sqrt', 'bootstrap': False, 'criterion': 'squared_error'}. Best is trial 341 with value: 0.2909369124469028.
[I 2024-12-04 12:19:22,300] Trial 1873 finished with value: 0.29392840047893976 and parameters: {'n_estimators': 629, 'max_depth': 50, 'min_samples_split': 3, 'min_samples_leaf': 1, 'max_features': 'sqrt', 'bootstrap': False, 'criterion': 'squared_error'}. Best is trial 341 with value: 0.2909369124469028.
[I 2024-12-04 12:19:23,109] Trial 1880 finished with value: 0.4408338285054088 and parameters: {'n_estimators': 430, 'max_depth': 50, 'min_samples_split': 2, 'min_samples_leaf': 2, 'max_features': 'sqrt', 'bootstrap': False, 'criterion': 'squared_error'}. Best is trial 341 with value: 0.2909369124469028.
[I 2024-12-04 12:19:23,912] Trial 1870 finished with value: 0.30770683737112414 and parameters: {'n_estimators': 131, 'max_depth': 48, 'min_samples_split': 4, 'min_samples_leaf': 1, 'max_features': 'sqrt', 'bootstrap': False, 'criterion': 'absolute_error'}. Best is trial 341 with value: 0.2909369124469028.
[I 2024-12-04 12:19:24,278] Trial 1878 finished with value: 0.44271499152698096 and parameters: {'n_estimators': 320, 'max_depth': 50, 'min_samples_split': 2, 'min_samples_leaf': 2, 'max_features': 'sqrt', 'bootstrap': False, 'criterion': 'squared_error'}. Best is trial 341 with value: 0.2909369124469028.
[I 2024-12-04 12:19:26,824] Trial 1881 finished with value: 0.2970567404344642 and parameters: {'n_estimators': 147, 'max_depth': 50, 'min_samples_split': 2, 'min_samples_leaf': 1, 'max_features': 'sqrt', 'bootstrap': False, 'criterion': 'squared_error'}. Best is trial 341 with value: 0.2909369124469028.
[I 2024-12-04 12:19:27,087] Trial 1885 finished with value: 0.44547229588666826 and parameters: {'n_estimators': 186, 'max_depth': 50, 'min_samples_split': 5, 'min_samples_leaf': 2, 'max_features': 'sqrt', 'bootstrap': False, 'criterion': 'squared_error'}. Best is trial 341 with value: 0.2909369124469028.
[I 2024-12-04 12:19:27,914] Trial 1894 finished with value: 0.448443201578441 and parameters: {'n_estimators': 204, 'max_depth': 41, 'min_samples_split': 2, 'min_samples_leaf': 2, 'max_features': 'sqrt', 'bootstrap': False, 'criterion': 'squared_error'}. Best is trial 341 with value: 0.2909369124469028.
[I 2024-12-04 12:19:27,940] Trial 1886 finished with value: 0.4128580717546912 and parameters: {'n_estimators': 210, 'max_depth': 36, 'min_samples_split': 5, 'min_samples_leaf': 2, 'max_features': None, 'bootstrap': False, 'criterion': 'squared_error'}. Best is trial 341 with value: 0.2909369124469028.
[I 2024-12-04 12:19:28,266] Trial 1882 finished with value: 0.29431808963250006 and parameters: {'n_estimators': 301, 'max_depth': 50, 'min_samples_split': 3, 'min_samples_leaf': 1, 'max_features': 'sqrt', 'bootstrap': False, 'criterion': 'squared_error'}. Best is trial 341 with value: 0.2909369124469028.
[I 2024-12-04 12:19:28,940] Trial 1891 finished with value: 0.44078960897627384 and parameters: {'n_estimators': 690, 'max_depth': 50, 'min_samples_split': 6, 'min_samples_leaf': 2, 'max_features': 'sqrt', 'bootstrap': False, 'criterion': 'squared_error'}. Best is trial 341 with value: 0.2909369124469028.
[I 2024-12-04 12:19:29,050] Trial 1879 finished with value: 0.458719383774903 and parameters: {'n_estimators': 311, 'max_depth': 48, 'min_samples_split': 2, 'min_samples_leaf': 2, 'max_features': 'sqrt', 'bootstrap': False, 'criterion': 'absolute_error'}. Best is trial 341 with value: 0.2909369124469028.
[I 2024-12-04 12:19:30,442] Trial 1887 finished with value: 0.3119461784694236 and parameters: {'n_estimators': 680, 'max_depth': 41, 'min_samples_split': 2, 'min_samples_leaf': 1, 'max_features': 'sqrt', 'bootstrap': False, 'criterion': 'squared_error'}. Best is trial 341 with value: 0.2909369124469028.
[I 2024-12-04 12:19:30,944] Trial 1896 finished with value: 0.29905699641139777 and parameters: {'n_estimators': 278, 'max_depth': 50, 'min_samples_split': 2, 'min_samples_leaf': 1, 'max_features': 'sqrt', 'bootstrap': False, 'criterion': 'squared_error'}. Best is trial 341 with value: 0.2909369124469028.
[I 2024-12-04 12:19:31,009] Trial 1904 finished with value: 0.2996078190905902 and parameters: {'n_estimators': 100, 'max_depth': 43, 'min_samples_split': 3, 'min_samples_leaf': 1, 'max_features': 'sqrt', 'bootstrap': False, 'criterion': 'squared_error'}. Best is trial 341 with value: 0.2909369124469028.
[I 2024-12-04 12:19:31,176] Trial 1897 finished with value: 0.30516816152866133 and parameters: {'n_estimators': 583, 'max_depth': 41, 'min_samples_split': 3, 'min_samples_leaf': 1, 'max_features': 'sqrt', 'bootstrap': False, 'criterion': 'squared_error'}. Best is trial 341 with value: 0.2909369124469028.
[I 2024-12-04 12:19:31,345] Trial 1902 finished with value: 0.2947084819735222 and parameters: {'n_estimators': 317, 'max_depth': 50, 'min_samples_split': 3, 'min_samples_leaf': 1, 'max_features': 'sqrt', 'bootstrap': False, 'criterion': 'squared_error'}. Best is trial 341 with value: 0.2909369124469028.
[I 2024-12-04 12:19:31,423] Trial 1890 finished with value: 0.3000111261445527 and parameters: {'n_estimators': 260, 'max_depth': 50, 'min_samples_split': 4, 'min_samples_leaf': 1, 'max_features': 'sqrt', 'bootstrap': False, 'criterion': 'squared_error'}. Best is trial 341 with value: 0.2909369124469028.
[I 2024-12-04 12:19:32,103] Trial 1888 finished with value: 0.31510620973919734 and parameters: {'n_estimators': 272, 'max_depth': 50, 'min_samples_split': 8, 'min_samples_leaf': 1, 'max_features': 'sqrt', 'bootstrap': False, 'criterion': 'squared_error'}. Best is trial 341 with value: 0.2909369124469028.
[I 2024-12-04 12:19:32,119] Trial 1889 finished with value: 0.4992872018348804 and parameters: {'n_estimators': 717, 'max_depth': 23, 'min_samples_split': 2, 'min_samples_leaf': 2, 'max_features': 'sqrt', 'bootstrap': False, 'criterion': 'squared_error'}. Best is trial 341 with value: 0.2909369124469028.
[I 2024-12-04 12:19:32,120] Trial 1884 finished with value: 0.3811127552562734 and parameters: {'n_estimators': 455, 'max_depth': 48, 'min_samples_split': 3, 'min_samples_leaf': 1, 'max_features': None, 'bootstrap': False, 'criterion': 'squared_error'}. Best is trial 341 with value: 0.2909369124469028.
[I 2024-12-04 12:19:32,969] Trial 1893 finished with value: 0.3076438141359734 and parameters: {'n_estimators': 300, 'max_depth': 42, 'min_samples_split': 2, 'min_samples_leaf': 1, 'max_features': 'sqrt', 'bootstrap': False, 'criterion': 'squared_error'}. Best is trial 341 with value: 0.2909369124469028.
[I 2024-12-04 12:19:33,584] Trial 1903 finished with value: 0.30354733232452236 and parameters: {'n_estimators': 221, 'max_depth': 41, 'min_samples_split': 3, 'min_samples_leaf': 1, 'max_features': 'sqrt', 'bootstrap': False, 'criterion': 'squared_error'}. Best is trial 341 with value: 0.2909369124469028.
[I 2024-12-04 12:19:33,590] Trial 1901 finished with value: 0.2996121293436114 and parameters: {'n_estimators': 311, 'max_depth': 50, 'min_samples_split': 4, 'min_samples_leaf': 1, 'max_features': 'sqrt', 'bootstrap': False, 'criterion': 'squared_error'}. Best is trial 341 with value: 0.2909369124469028.
[I 2024-12-04 12:19:33,829] Trial 1900 finished with value: 0.3026959493974646 and parameters: {'n_estimators': 476, 'max_depth': 42, 'min_samples_split': 3, 'min_samples_leaf': 1, 'max_features': 'sqrt', 'bootstrap': False, 'criterion': 'squared_error'}. Best is trial 341 with value: 0.2909369124469028.
[I 2024-12-04 12:19:33,974] Trial 1899 finished with value: 0.2986765144654764 and parameters: {'n_estimators': 448, 'max_depth': 45, 'min_samples_split': 3, 'min_samples_leaf': 1, 'max_features': 'sqrt', 'bootstrap': False, 'criterion': 'squared_error'}. Best is trial 341 with value: 0.2909369124469028.
[I 2024-12-04 12:19:34,230] Trial 1898 finished with value: 0.3034279502994819 and parameters: {'n_estimators': 456, 'max_depth': 42, 'min_samples_split': 3, 'min_samples_leaf': 1, 'max_features': 'sqrt', 'bootstrap': False, 'criterion': 'squared_error'}. Best is trial 341 with value: 0.2909369124469028.
[I 2024-12-04 12:19:34,458] Trial 1895 finished with value: 0.29412385973671873 and parameters: {'n_estimators': 536, 'max_depth': 50, 'min_samples_split': 3, 'min_samples_leaf': 1, 'max_features': 'sqrt', 'bootstrap': False, 'criterion': 'squared_error'}. Best is trial 341 with value: 0.2909369124469028.
[I 2024-12-04 12:19:35,463] Trial 1905 finished with value: 0.7019113197319631 and parameters: {'n_estimators': 525, 'max_depth': 38, 'min_samples_split': 2, 'min_samples_leaf': 2, 'max_features': 'log2', 'bootstrap': False, 'criterion': 'squared_error'}. Best is trial 341 with value: 0.2909369124469028.
[I 2024-12-04 12:19:39,060] Trial 1892 finished with value: 0.30396968411044284 and parameters: {'n_estimators': 191, 'max_depth': 49, 'min_samples_split': 2, 'min_samples_leaf': 1, 'max_features': 'sqrt', 'bootstrap': False, 'criterion': 'absolute_error'}. Best is trial 341 with value: 0.2909369124469028.
[I 2024-12-04 12:19:39,636] Trial 1907 finished with value: 0.2944372870463366 and parameters: {'n_estimators': 196, 'max_depth': 50, 'min_samples_split': 3, 'min_samples_leaf': 1, 'max_features': 'sqrt', 'bootstrap': False, 'criterion': 'squared_error'}. Best is trial 341 with value: 0.2909369124469028.
[I 2024-12-04 12:19:40,546] Trial 1909 finished with value: 0.2944640030185939 and parameters: {'n_estimators': 292, 'max_depth': 50, 'min_samples_split': 3, 'min_samples_leaf': 1, 'max_features': 'sqrt', 'bootstrap': False, 'criterion': 'squared_error'}. Best is trial 341 with value: 0.2909369124469028.
[I 2024-12-04 12:19:43,383] Trial 1913 finished with value: 0.4790879720188795 and parameters: {'n_estimators': 197, 'max_depth': 40, 'min_samples_split': 2, 'min_samples_leaf': 2, 'max_features': 'sqrt', 'bootstrap': True, 'criterion': 'squared_error'}. Best is trial 341 with value: 0.2909369124469028.
[I 2024-12-04 12:19:44,557] Trial 1911 finished with value: 0.33824093788716897 and parameters: {'n_estimators': 150, 'max_depth': 45, 'min_samples_split': 2, 'min_samples_leaf': 1, 'max_features': 'sqrt', 'bootstrap': True, 'criterion': 'absolute_error'}. Best is trial 341 with value: 0.2909369124469028.
[I 2024-12-04 12:19:44,660] Trial 1908 finished with value: 0.4453397788400786 and parameters: {'n_estimators': 268, 'max_depth': 44, 'min_samples_split': 3, 'min_samples_leaf': 2, 'max_features': 'sqrt', 'bootstrap': False, 'criterion': 'squared_error'}. Best is trial 341 with value: 0.2909369124469028.
[I 2024-12-04 12:19:44,904] Trial 1906 finished with value: 0.294081928427824 and parameters: {'n_estimators': 568, 'max_depth': 50, 'min_samples_split': 3, 'min_samples_leaf': 1, 'max_features': 'sqrt', 'bootstrap': False, 'criterion': 'squared_error'}. Best is trial 341 with value: 0.2909369124469028.
[I 2024-12-04 12:19:45,145] Trial 1923 finished with value: 0.787464643074052 and parameters: {'n_estimators': 168, 'max_depth': 50, 'min_samples_split': 3, 'min_samples_leaf': 2, 'max_features': 'log2', 'bootstrap': True, 'criterion': 'squared_error'}. Best is trial 341 with value: 0.2909369124469028.
[I 2024-12-04 12:19:45,154] Trial 1914 finished with value: 0.4433841426221063 and parameters: {'n_estimators': 533, 'max_depth': 43, 'min_samples_split': 2, 'min_samples_leaf': 2, 'max_features': 'sqrt', 'bootstrap': False, 'criterion': 'squared_error'}. Best is trial 341 with value: 0.2909369124469028.
[I 2024-12-04 12:19:46,773] Trial 1918 finished with value: 0.347211717458512 and parameters: {'n_estimators': 607, 'max_depth': 31, 'min_samples_split': 3, 'min_samples_leaf': 1, 'max_features': 'sqrt', 'bootstrap': False, 'criterion': 'squared_error'}. Best is trial 341 with value: 0.2909369124469028.
[I 2024-12-04 12:19:46,841] Trial 1910 finished with value: 0.3130249447120611 and parameters: {'n_estimators': 688, 'max_depth': 44, 'min_samples_split': 5, 'min_samples_leaf': 1, 'max_features': 'sqrt', 'bootstrap': False, 'criterion': 'squared_error'}. Best is trial 341 with value: 0.2909369124469028.
[I 2024-12-04 12:19:47,894] Trial 1917 finished with value: 0.31387381518075763 and parameters: {'n_estimators': 200, 'max_depth': 50, 'min_samples_split': 3, 'min_samples_leaf': 1, 'max_features': 'sqrt', 'bootstrap': True, 'criterion': 'squared_error'}. Best is trial 341 with value: 0.2909369124469028.
[I 2024-12-04 12:19:49,490] Trial 1919 finished with value: 0.44042839718063637 and parameters: {'n_estimators': 587, 'max_depth': 50, 'min_samples_split': 3, 'min_samples_leaf': 2, 'max_features': 'sqrt', 'bootstrap': False, 'criterion': 'squared_error'}. Best is trial 341 with value: 0.2909369124469028.
[I 2024-12-04 12:19:50,058] Trial 1921 finished with value: 0.34674808339759 and parameters: {'n_estimators': 121, 'max_depth': 33, 'min_samples_split': 2, 'min_samples_leaf': 1, 'max_features': 'sqrt', 'bootstrap': False, 'criterion': 'squared_error'}. Best is trial 341 with value: 0.2909369124469028.
[I 2024-12-04 12:19:50,463] Trial 1912 finished with value: 0.4445725091411149 and parameters: {'n_estimators': 291, 'max_depth': 43, 'min_samples_split': 2, 'min_samples_leaf': 2, 'max_features': 'sqrt', 'bootstrap': False, 'criterion': 'squared_error'}. Best is trial 341 with value: 0.2909369124469028.
[I 2024-12-04 12:19:50,567] Trial 1927 finished with value: 0.41629682210317326 and parameters: {'n_estimators': 273, 'max_depth': 45, 'min_samples_split': 2, 'min_samples_leaf': 2, 'max_features': None, 'bootstrap': False, 'criterion': 'squared_error'}. Best is trial 341 with value: 0.2909369124469028.
[I 2024-12-04 12:19:50,578] Trial 1930 finished with value: 0.3928143730756029 and parameters: {'n_estimators': 173, 'max_depth': 49, 'min_samples_split': 4, 'min_samples_leaf': 1, 'max_features': 'log2', 'bootstrap': False, 'criterion': 'squared_error'}. Best is trial 341 with value: 0.2909369124469028.
[I 2024-12-04 12:19:50,694] Trial 1931 finished with value: 0.5544475932012948 and parameters: {'n_estimators': 326, 'max_depth': 35, 'min_samples_split': 9, 'min_samples_leaf': 15, 'max_features': None, 'bootstrap': True, 'criterion': 'squared_error'}. Best is trial 341 with value: 0.2909369124469028.
[I 2024-12-04 12:19:51,041] Trial 1932 finished with value: 0.4441656034130601 and parameters: {'n_estimators': 206, 'max_depth': 50, 'min_samples_split': 2, 'min_samples_leaf': 2, 'max_features': 'sqrt', 'bootstrap': False, 'criterion': 'squared_error'}. Best is trial 341 with value: 0.2909369124469028.
[I 2024-12-04 12:19:51,575] Trial 1920 finished with value: 0.308761042243526 and parameters: {'n_estimators': 100, 'max_depth': 42, 'min_samples_split': 2, 'min_samples_leaf': 1, 'max_features': 'sqrt', 'bootstrap': False, 'criterion': 'squared_error'}. Best is trial 341 with value: 0.2909369124469028.
[I 2024-12-04 12:19:52,042] Trial 1934 finished with value: 0.30058245973694014 and parameters: {'n_estimators': 399, 'max_depth': 44, 'min_samples_split': 3, 'min_samples_leaf': 1, 'max_features': 'sqrt', 'bootstrap': False, 'criterion': 'squared_error'}. Best is trial 341 with value: 0.2909369124469028.
[I 2024-12-04 12:19:52,442] Trial 1929 finished with value: 0.30187917880033294 and parameters: {'n_estimators': 234, 'max_depth': 44, 'min_samples_split': 3, 'min_samples_leaf': 1, 'max_features': 'sqrt', 'bootstrap': False, 'criterion': 'squared_error'}. Best is trial 341 with value: 0.2909369124469028.
[I 2024-12-04 12:19:53,219] Trial 1937 finished with value: 0.2942761360658445 and parameters: {'n_estimators': 193, 'max_depth': 50, 'min_samples_split': 3, 'min_samples_leaf': 1, 'max_features': 'sqrt', 'bootstrap': False, 'criterion': 'squared_error'}. Best is trial 341 with value: 0.2909369124469028.
[I 2024-12-04 12:19:53,220] Trial 1928 finished with value: 0.9533935241198388 and parameters: {'n_estimators': 249, 'max_depth': 26, 'min_samples_split': 6, 'min_samples_leaf': 13, 'max_features': 'log2', 'bootstrap': False, 'criterion': 'squared_error'}. Best is trial 341 with value: 0.2909369124469028.
[I 2024-12-04 12:19:53,227] Trial 1935 finished with value: 0.3005366136872339 and parameters: {'n_estimators': 270, 'max_depth': 44, 'min_samples_split': 3, 'min_samples_leaf': 1, 'max_features': 'sqrt', 'bootstrap': False, 'criterion': 'squared_error'}. Best is trial 341 with value: 0.2909369124469028.
