[I 2024-12-04 19:50:35,523] Trial 256 finished with value: 0.9864686818748977 and parameters: {'kernel_type': 'Matern', 'length_scale': 0.06582210302664633, 'noise_level': 0.25261434060408045, 'constant_value': 6.510719654548049, 'nu': 1.5}. Best is trial 254 with value: 0.13754915492432768.
[I 2024-12-04 19:50:38,101] Trial 257 finished with value: 0.14770960561959515 and parameters: {'kernel_type': 'RBF', 'length_scale': 993.6231940464951, 'noise_level': 0.11260204183654735, 'constant_value': 0.829615211674465, 'nu': 1.5}. Best is trial 254 with value: 0.13754915492432768.
[I 2024-12-04 19:50:41,928] Trial 258 finished with value: 0.9864686819044074 and parameters: {'kernel_type': 'Matern', 'length_scale': 1622.0709599552602, 'noise_level': 0.05090498265484876, 'constant_value': 4.203567157585614, 'nu': 1.5}. Best is trial 254 with value: 0.13754915492432768.
[I 2024-12-04 19:50:43,491] Trial 259 finished with value: 0.1424950649121157 and parameters: {'kernel_type': 'Matern', 'length_scale': 15.365544255694171, 'noise_level': 0.7821047021764516, 'constant_value': 4.93783523525309, 'nu': 1.5}. Best is trial 254 with value: 0.13754915492432768.
[I 2024-12-04 19:50:44,626] Trial 260 finished with value: 0.14249515752058356 and parameters: {'kernel_type': 'Matern', 'length_scale': 22.913902660024277, 'noise_level': 0.04884872887154112, 'constant_value': 26.73887065913508, 'nu': 1.5}. Best is trial 254 with value: 0.13754915492432768.
[I 2024-12-04 19:50:51,536] Trial 263 finished with value: 0.14249468516920374 and parameters: {'kernel_type': 'Matern', 'length_scale': 327.75090130221287, 'noise_level': 0.2993489759407503, 'constant_value': 1.6978306957050588, 'nu': 1.5}. Best is trial 254 with value: 0.13754915492432768.
[I 2024-12-04 19:50:52,337] Trial 262 finished with value: 0.9864686819228478 and parameters: {'kernel_type': 'Matern', 'length_scale': 49775.801536726714, 'noise_level': 6.718960260483977e-07, 'constant_value': 0.043793273797740374, 'nu': 0.5}. Best is trial 254 with value: 0.13754915492432768.
[I 2024-12-04 19:50:52,714] Trial 261 finished with value: 0.14249492941374964 and parameters: {'kernel_type': 'Matern', 'length_scale': 10.690898434716024, 'noise_level': 0.9744601637393514, 'constant_value': 76.84882949787472, 'nu': 1.5}. Best is trial 254 with value: 0.13754915492432768.
[I 2024-12-04 19:50:59,050] Trial 264 finished with value: 0.9864686819236405 and parameters: {'kernel_type': 'Matern', 'length_scale': 1886.8139695958407, 'noise_level': 0.009112781961186022, 'constant_value': 1.4611948635794414, 'nu': 1.5}. Best is trial 254 with value: 0.13754915492432768.
[I 2024-12-04 19:51:00,502] Trial 266 finished with value: 0.14771036290422923 and parameters: {'kernel_type': 'RBF', 'length_scale': 7312.579080320473, 'noise_level': 0.7487152245626028, 'constant_value': 7918.398560394486, 'nu': 1.5}. Best is trial 254 with value: 0.13754915492432768.
[I 2024-12-04 19:51:00,750] Trial 265 finished with value: 0.14249472383863532 and parameters: {'kernel_type': 'Matern', 'length_scale': 196.99248347997667, 'noise_level': 0.06863262967064737, 'constant_value': 0.1388087684926872, 'nu': 1.5}. Best is trial 254 with value: 0.13754915492432768.
[I 2024-12-04 19:51:09,317] Trial 267 finished with value: 0.14249505284422692 and parameters: {'kernel_type': 'Matern', 'length_scale': 112.22453176676949, 'noise_level': 0.5786428756832735, 'constant_value': 49.67650133234485, 'nu': 1.5}. Best is trial 254 with value: 0.13754915492432768.
[I 2024-12-04 19:51:10,167] Trial 269 finished with value: 0.9864686819226297 and parameters: {'kernel_type': 'RBF', 'length_scale': 0.1011782045883398, 'noise_level': 0.9115401287176974, 'constant_value': 36.724707971297484, 'nu': 1.5}. Best is trial 254 with value: 0.13754915492432768.
[I 2024-12-04 19:51:15,280] Trial 268 finished with value: 0.9864686819518166 and parameters: {'kernel_type': 'Matern', 'length_scale': 2183.5846067084412, 'noise_level': 0.028539796780376953, 'constant_value': 0.08007785740889811, 'nu': 1.5}. Best is trial 254 with value: 0.13754915492432768.
[I 2024-12-04 19:51:17,029] Trial 270 finished with value: 0.14249493593027315 and parameters: {'kernel_type': 'Matern', 'length_scale': 254.5674705635271, 'noise_level': 0.20257421301286688, 'constant_value': 2.7532187352417936, 'nu': 1.5}. Best is trial 254 with value: 0.13754915492432768.
[I 2024-12-04 19:51:20,062] Trial 271 finished with value: 0.14249507186559895 and parameters: {'kernel_type': 'Matern', 'length_scale': 1006.1265147375364, 'noise_level': 0.6131172953515021, 'constant_value': 0.27194368611498637, 'nu': 1.5}. Best is trial 254 with value: 0.13754915492432768.
[I 2024-12-04 19:51:20,907] Trial 272 finished with value: 0.9982171094900214 and parameters: {'kernel_type': 'RBF', 'length_scale': 53501.14434064763, 'noise_level': 0.0002817841818437536, 'constant_value': 4.076535165269768e-07, 'nu': 0.5}. Best is trial 254 with value: 0.13754915492432768.
[I 2024-12-04 19:51:24,099] Trial 273 finished with value: 0.9864686819936855 and parameters: {'kernel_type': 'Matern', 'length_scale': 21.75968520306555, 'noise_level': 0.023594566372221425, 'constant_value': 0.47532654064580926, 'nu': 1.5}. Best is trial 254 with value: 0.13754915492432768.
[I 2024-12-04 19:51:26,121] Trial 275 finished with value: 0.9864686819083667 and parameters: {'kernel_type': 'RBF', 'length_scale': 0.0020954638530273993, 'noise_level': 0.2065595916892842, 'constant_value': 713.392431865349, 'nu': 2.5}. Best is trial 254 with value: 0.13754915492432768.
[I 2024-12-04 19:51:28,034] Trial 274 finished with value: 0.14249507900202354 and parameters: {'kernel_type': 'Matern', 'length_scale': 3.336535575698286, 'noise_level': 0.8554464939258775, 'constant_value': 0.8264183346014836, 'nu': 1.5}. Best is trial 254 with value: 0.13754915492432768.
[I 2024-12-04 19:51:32,426] Trial 276 finished with value: 0.14249506473179363 and parameters: {'kernel_type': 'Matern', 'length_scale': 24748.201778475057, 'noise_level': 0.39220400319162896, 'constant_value': 107.27442306612296, 'nu': 1.5}. Best is trial 254 with value: 0.13754915492432768.
[I 2024-12-04 19:51:35,371] Trial 277 finished with value: 0.14249506744808943 and parameters: {'kernel_type': 'Matern', 'length_scale': 422.39159664328866, 'noise_level': 0.5545550578262942, 'constant_value': 17.624978373081248, 'nu': 1.5}. Best is trial 254 with value: 0.13754915492432768.
[I 2024-12-04 19:51:35,552] Trial 278 finished with value: 0.1972000369381612 and parameters: {'kernel_type': 'Matern', 'length_scale': 73.38400697146213, 'noise_level': 0.40854256394916366, 'constant_value': 827.7234626505148, 'nu': 0.5}. Best is trial 254 with value: 0.13754915492432768.
[I 2024-12-04 19:51:39,857] Trial 279 finished with value: 0.14249506200628553 and parameters: {'kernel_type': 'Matern', 'length_scale': 17.891263929828472, 'noise_level': 0.04594984105171406, 'constant_value': 0.6598843655979352, 'nu': 1.5}. Best is trial 254 with value: 0.13754915492432768.
[I 2024-12-04 19:51:43,729] Trial 280 finished with value: 0.14249504472195826 and parameters: {'kernel_type': 'Matern', 'length_scale': 972.8624421528746, 'noise_level': 0.25716466267951194, 'constant_value': 8.366797790513838, 'nu': 1.5}. Best is trial 254 with value: 0.13754915492432768.
[I 2024-12-04 19:51:44,001] Trial 281 finished with value: 0.14249502994047306 and parameters: {'kernel_type': 'Matern', 'length_scale': 15.098739301210786, 'noise_level': 0.4265647592438893, 'constant_value': 9.84730738393797, 'nu': 1.5}. Best is trial 254 with value: 0.13754915492432768.
[I 2024-12-04 19:51:49,620] Trial 282 finished with value: 0.14249536663396306 and parameters: {'kernel_type': 'Matern', 'length_scale': 0.3020598341428379, 'noise_level': 0.8035343294197602, 'constant_value': 64.98555874472275, 'nu': 1.5}. Best is trial 254 with value: 0.13754915492432768.
[I 2024-12-04 19:51:50,712] Trial 283 finished with value: 0.1424950631069336 and parameters: {'kernel_type': 'Matern', 'length_scale': 64.12373620368106, 'noise_level': 0.34149596454287695, 'constant_value': 55.7581921734386, 'nu': 1.5}. Best is trial 254 with value: 0.13754915492432768.
[I 2024-12-04 19:51:53,597] Trial 284 finished with value: 0.14249506317258406 and parameters: {'kernel_type': 'Matern', 'length_scale': 1040.2142655382086, 'noise_level': 0.5412639668432114, 'constant_value': 4.593526749611139, 'nu': 1.5}. Best is trial 254 with value: 0.13754915492432768.
[I 2024-12-04 19:51:56,992] Trial 286 finished with value: 0.1424951354174902 and parameters: {'kernel_type': 'Matern', 'length_scale': 40.11444985160883, 'noise_level': 0.07737668930621822, 'constant_value': 289.43855461818805, 'nu': 1.5}. Best is trial 254 with value: 0.13754915492432768.
[I 2024-12-04 19:52:00,059] Trial 285 finished with value: 0.14249503226671456 and parameters: {'kernel_type': 'Matern', 'length_scale': 7.345067514882568, 'noise_level': 0.8568281523750392, 'constant_value': 9.080624714770932, 'nu': 1.5}. Best is trial 254 with value: 0.13754915492432768.
[I 2024-12-04 19:52:00,075] Trial 287 finished with value: 0.14469978483776819 and parameters: {'kernel_type': 'Matern', 'length_scale': 277.9990703247854, 'noise_level': 0.251734473396618, 'constant_value': 23.70737090290397, 'nu': 2.5}. Best is trial 254 with value: 0.13754915492432768.
[I 2024-12-04 19:52:05,074] Trial 288 finished with value: 0.1424950627333633 and parameters: {'kernel_type': 'Matern', 'length_scale': 27.345857080865297, 'noise_level': 0.5935519800785481, 'constant_value': 38.91284864949264, 'nu': 1.5}. Best is trial 254 with value: 0.13754915492432768.
[I 2024-12-04 19:52:07,660] Trial 290 finished with value: 0.14249505755413258 and parameters: {'kernel_type': 'Matern', 'length_scale': 4.4653023808864205, 'noise_level': 0.8838591120828115, 'constant_value': 5555.524983926893, 'nu': 1.5}. Best is trial 254 with value: 0.13754915492432768.
[I 2024-12-04 19:52:11,815] Trial 289 finished with value: 0.9864686819226003 and parameters: {'kernel_type': 'Matern', 'length_scale': 2059.6983102287577, 'noise_level': 0.008002878248697332, 'constant_value': 10.66580620217603, 'nu': 1.5}. Best is trial 254 with value: 0.13754915492432768.
[I 2024-12-04 19:52:11,914] Trial 291 finished with value: 0.9864686819259335 and parameters: {'kernel_type': 'Matern', 'length_scale': 1.5882535840193663e-05, 'noise_level': 0.5701815170785531, 'constant_value': 0.2754176655951369, 'nu': 2.5}. Best is trial 254 with value: 0.13754915492432768.
[I 2024-12-04 19:52:14,682] Trial 292 finished with value: 0.19720003906577685 and parameters: {'kernel_type': 'Matern', 'length_scale': 8867.6095042114, 'noise_level': 0.24063138495118075, 'constant_value': 7.230855938679057, 'nu': 0.5}. Best is trial 254 with value: 0.13754915492432768.
[I 2024-12-04 19:52:21,283] Trial 293 finished with value: 0.9864686819075387 and parameters: {'kernel_type': 'Matern', 'length_scale': 42.10992200599757, 'noise_level': 0.0013828552962100926, 'constant_value': 0.08625388773176354, 'nu': 1.5}. Best is trial 254 with value: 0.13754915492432768.
[I 2024-12-04 19:52:22,714] Trial 294 finished with value: 0.14249505464132628 and parameters: {'kernel_type': 'Matern', 'length_scale': 32.42201687528567, 'noise_level': 0.04545362315385931, 'constant_value': 0.0179850608807302, 'nu': 1.5}. Best is trial 254 with value: 0.13754915492432768.
[I 2024-12-04 19:52:28,876] Trial 297 finished with value: 0.19720004460220236 and parameters: {'kernel_type': 'Matern', 'length_scale': 0.6085598175599742, 'noise_level': 0.12345993055524364, 'constant_value': 37.59719889240673, 'nu': 0.5}. Best is trial 254 with value: 0.13754915492432768.
[I 2024-12-04 19:52:28,891] Trial 295 finished with value: 0.9864686819423376 and parameters: {'kernel_type': 'Matern', 'length_scale': 6249.726839386313, 'noise_level': 1.7641203558962398e-09, 'constant_value': 5.328509372256424e-06, 'nu': 1.5}. Best is trial 254 with value: 0.13754915492432768.
[I 2024-12-04 19:52:29,755] Trial 296 finished with value: 0.14249509438446084 and parameters: {'kernel_type': 'Matern', 'length_scale': 170.03902192649565, 'noise_level': 0.030436027631455864, 'constant_value': 0.6791152321694517, 'nu': 1.5}. Best is trial 254 with value: 0.13754915492432768.
[I 2024-12-04 19:52:36,147] Trial 299 finished with value: 0.14249506873096077 and parameters: {'kernel_type': 'Matern', 'length_scale': 126.30645215855053, 'noise_level': 0.008094669093875075, 'constant_value': 310.8441942592496, 'nu': 1.5}. Best is trial 254 with value: 0.13754915492432768.
[I 2024-12-04 19:52:36,393] Trial 300 finished with value: 0.14249511802916617 and parameters: {'kernel_type': 'Matern', 'length_scale': 222.05550853842146, 'noise_level': 0.3330564180348829, 'constant_value': 104.46331555644164, 'nu': 1.5}. Best is trial 254 with value: 0.13754915492432768.
[I 2024-12-04 19:52:36,730] Trial 298 finished with value: 0.1424950639869861 and parameters: {'kernel_type': 'Matern', 'length_scale': 74.59077369359636, 'noise_level': 0.939140295080989, 'constant_value': 2.744577796945653, 'nu': 1.5}. Best is trial 254 with value: 0.13754915492432768.
[I 2024-12-04 19:52:40,965] Trial 301 finished with value: 0.14249506994064665 and parameters: {'kernel_type': 'Matern', 'length_scale': 226.65074384985573, 'noise_level': 0.0750903539257374, 'constant_value': 26620.827724572428, 'nu': 1.5}. Best is trial 254 with value: 0.13754915492432768.
[I 2024-12-04 19:52:42,890] Trial 303 finished with value: 0.14249542974378546 and parameters: {'kernel_type': 'Matern', 'length_scale': 342.8354165766104, 'noise_level': 0.017120102278481868, 'constant_value': 663.6664131913059, 'nu': 1.5}. Best is trial 254 with value: 0.13754915492432768.
[I 2024-12-04 19:52:43,941] Trial 302 finished with value: 0.14249527330806835 and parameters: {'kernel_type': 'Matern', 'length_scale': 4.951513526696259, 'noise_level': 0.2824846941775347, 'constant_value': 63.69645748426562, 'nu': 1.5}. Best is trial 254 with value: 0.13754915492432768.
[I 2024-12-04 19:52:48,697] Trial 304 finished with value: 0.14249465290683838 and parameters: {'kernel_type': 'Matern', 'length_scale': 2900.643697313027, 'noise_level': 0.5979105968518554, 'constant_value': 57938.180449747415, 'nu': 1.5}. Best is trial 254 with value: 0.13754915492432768.
[I 2024-12-04 19:52:49,027] Trial 305 finished with value: 0.14249505951006364 and parameters: {'kernel_type': 'Matern', 'length_scale': 105.53439288670168, 'noise_level': 0.45566978725942703, 'constant_value': 1353.5170987866188, 'nu': 1.5}. Best is trial 254 with value: 0.13754915492432768.
[I 2024-12-04 19:52:51,273] Trial 306 finished with value: 0.14249506638641915 and parameters: {'kernel_type': 'Matern', 'length_scale': 0.38054785765609445, 'noise_level': 0.8318317735085513, 'constant_value': 182.11799397915397, 'nu': 1.5}. Best is trial 254 with value: 0.13754915492432768.
[I 2024-12-04 19:52:54,425] Trial 307 finished with value: 0.14249491721076185 and parameters: {'kernel_type': 'Matern', 'length_scale': 3249.8320714184106, 'noise_level': 0.08019955942523337, 'constant_value': 10633.646972318278, 'nu': 1.5}. Best is trial 254 with value: 0.13754915492432768.
[I 2024-12-04 19:52:56,160] Trial 308 finished with value: 0.142495090949246 and parameters: {'kernel_type': 'Matern', 'length_scale': 24297.77529678481, 'noise_level': 0.31309429734370103, 'constant_value': 15145.193416086964, 'nu': 1.5}. Best is trial 254 with value: 0.13754915492432768.
[I 2024-12-04 19:52:57,729] Trial 309 finished with value: 0.9982165121674599 and parameters: {'kernel_type': 'Matern', 'length_scale': 14383.892047183383, 'noise_level': 0.7604851993347184, 'constant_value': 3.0128516257392377, 'nu': 1.5}. Best is trial 254 with value: 0.13754915492432768.
[I 2024-12-04 19:53:02,396] Trial 311 finished with value: 0.14249508420778073 and parameters: {'kernel_type': 'Matern', 'length_scale': 3093.325762916404, 'noise_level': 0.9357712715110814, 'constant_value': 10576.3093680027, 'nu': 1.5}. Best is trial 254 with value: 0.13754915492432768.
[I 2024-12-04 19:53:03,095] Trial 312 finished with value: 0.14249527597780828 and parameters: {'kernel_type': 'Matern', 'length_scale': 734.1769712613493, 'noise_level': 0.025064558092316856, 'constant_value': 30659.516147737315, 'nu': 1.5}. Best is trial 254 with value: 0.13754915492432768.
[I 2024-12-04 19:53:04,118] Trial 310 finished with value: 0.986468681966189 and parameters: {'kernel_type': 'Matern', 'length_scale': 37982.88051826607, 'noise_level': 0.019322526649730054, 'constant_value': 61679.07586607504, 'nu': 1.5}. Best is trial 254 with value: 0.13754915492432768.
[I 2024-12-04 19:53:07,708] Trial 314 finished with value: 0.998216733804003 and parameters: {'kernel_type': 'Matern', 'length_scale': 0.001505180419436149, 'noise_level': 3.9735494058423104e-07, 'constant_value': 108.57844618187045, 'nu': 0.5}. Best is trial 254 with value: 0.13754915492432768.
[I 2024-12-04 19:53:08,794] Trial 315 finished with value: 0.998216733803679 and parameters: {'kernel_type': 'RBF', 'length_scale': 0.01034769600356451, 'noise_level': 4.597191874640005e-08, 'constant_value': 57649.12813521367, 'nu': 0.5}. Best is trial 254 with value: 0.13754915492432768.
[I 2024-12-04 19:53:10,750] Trial 313 finished with value: 0.14249486039243023 and parameters: {'kernel_type': 'Matern', 'length_scale': 65.762135897471, 'noise_level': 0.026736530734691916, 'constant_value': 5.273483159463514, 'nu': 1.5}. Best is trial 254 with value: 0.13754915492432768.
[I 2024-12-04 19:53:13,867] Trial 316 finished with value: 0.14249504789334985 and parameters: {'kernel_type': 'Matern', 'length_scale': 230.10203086120612, 'noise_level': 0.02728064806636798, 'constant_value': 82.04240113916605, 'nu': 1.5}. Best is trial 254 with value: 0.13754915492432768.
[I 2024-12-04 19:53:17,501] Trial 318 finished with value: 0.9864686821356401 and parameters: {'kernel_type': 'Matern', 'length_scale': 27.897463671240477, 'noise_level': 0.006348617799540313, 'constant_value': 2.194624757811936, 'nu': 1.5}. Best is trial 254 with value: 0.13754915492432768.
[I 2024-12-04 19:53:19,817] Trial 319 finished with value: 0.14771063870702883 and parameters: {'kernel_type': 'RBF', 'length_scale': 6.389056239400759, 'noise_level': 0.0018371462925850604, 'constant_value': 4457.602079031415, 'nu': 2.5}. Best is trial 254 with value: 0.13754915492432768.
[I 2024-12-04 19:53:19,843] Trial 317 finished with value: 0.14249490466959958 and parameters: {'kernel_type': 'Matern', 'length_scale': 148.5891180221035, 'noise_level': 0.027365078222934044, 'constant_value': 35346.345680610895, 'nu': 1.5}. Best is trial 254 with value: 0.13754915492432768.
[I 2024-12-04 19:53:25,359] Trial 321 finished with value: 0.9982043651341308 and parameters: {'kernel_type': 'Matern', 'length_scale': 0.08474982586459034, 'noise_level': 0.018808930531089556, 'constant_value': 1.0723531377549444e-07, 'nu': 1.5}. Best is trial 254 with value: 0.13754915492432768.
[I 2024-12-04 19:53:26,545] Trial 320 finished with value: 0.13799177291943412 and parameters: {'kernel_type': 'Matern', 'length_scale': 4.400718604030221, 'noise_level': 0.04485882023668263, 'constant_value': 1.1231021769223022, 'nu': 1.5}. Best is trial 254 with value: 0.13754915492432768.
[I 2024-12-04 19:53:29,584] Trial 322 finished with value: 0.14249507479491574 and parameters: {'kernel_type': 'Matern', 'length_scale': 101.09378809359953, 'noise_level': 0.13840627045337836, 'constant_value': 0.01253037722985185, 'nu': 1.5}. Best is trial 254 with value: 0.13754915492432768.
[I 2024-12-04 19:53:34,224] Trial 323 finished with value: 0.1424954756783772 and parameters: {'kernel_type': 'Matern', 'length_scale': 1477.0039956226192, 'noise_level': 0.15903949377353468, 'constant_value': 55573.848175022365, 'nu': 1.5}. Best is trial 254 with value: 0.13754915492432768.
[I 2024-12-04 19:53:34,375] Trial 324 finished with value: 0.14469880077951444 and parameters: {'kernel_type': 'Matern', 'length_scale': 17550.074300192773, 'noise_level': 0.17887848329208275, 'constant_value': 41591.985609238654, 'nu': 2.5}. Best is trial 254 with value: 0.13754915492432768.
[I 2024-12-04 19:53:39,696] Trial 327 finished with value: 0.1424948421332593 and parameters: {'kernel_type': 'Matern', 'length_scale': 47.34569054156975, 'noise_level': 0.187083407791326, 'constant_value': 50777.524136665255, 'nu': 1.5}. Best is trial 254 with value: 0.13754915492432768.
[I 2024-12-04 19:53:39,736] Trial 326 finished with value: 0.14249507573696923 and parameters: {'kernel_type': 'Matern', 'length_scale': 394.83038980607654, 'noise_level': 0.0068075224149130855, 'constant_value': 10570.146752020879, 'nu': 1.5}. Best is trial 254 with value: 0.13754915492432768.
[I 2024-12-04 19:53:43,622] Trial 325 finished with value: 0.1424950777608238 and parameters: {'kernel_type': 'Matern', 'length_scale': 1.62611909917513, 'noise_level': 0.03507496788211218, 'constant_value': 1.070248766458543, 'nu': 1.5}. Best is trial 254 with value: 0.13754915492432768.
[I 2024-12-04 19:53:45,977] Trial 329 finished with value: 0.9864686819386407 and parameters: {'kernel_type': 'Matern', 'length_scale': 0.048392587056003605, 'noise_level': 0.06083424488928955, 'constant_value': 0.3378695181847279, 'nu': 1.5}. Best is trial 254 with value: 0.13754915492432768.
[I 2024-12-04 19:53:49,662] Trial 330 finished with value: 0.14249476858742233 and parameters: {'kernel_type': 'Matern', 'length_scale': 64.83605241666854, 'noise_level': 0.9600674611132743, 'constant_value': 79923.05733630668, 'nu': 1.5}. Best is trial 254 with value: 0.13754915492432768.
[I 2024-12-04 19:53:50,187] Trial 328 finished with value: 0.13858020578708877 and parameters: {'kernel_type': 'Matern', 'length_scale': 0.8316540064303323, 'noise_level': 0.028286177200892142, 'constant_value': 6.591513254789468, 'nu': 1.5}. Best is trial 254 with value: 0.13754915492432768.
