[I 2024-12-04 14:58:00,122] Trial 218 finished with value: 0.13435442129733194 and parameters: {'kernel_type': 'Matern', 'length_scale': 7.223496813973678, 'noise_level': 3.361764015847195e-08, 'constant_value': 0.41086729090645385, 'nu': 1.5}. Best is trial 196 with value: 0.1343540633963538.
[I 2024-12-04 14:58:00,136] Trial 224 finished with value: 0.13435438820851742 and parameters: {'kernel_type': 'Matern', 'length_scale': 383.30280087706717, 'noise_level': 0.3554958814727658, 'constant_value': 97343.87820278284, 'nu': 1.5}. Best is trial 196 with value: 0.1343540633963538.
[I 2024-12-04 14:58:00,728] Trial 220 finished with value: 0.1343543240616601 and parameters: {'kernel_type': 'Matern', 'length_scale': 1.5846849751786978, 'noise_level': 1.8522046147688338e-06, 'constant_value': 0.05149915599079728, 'nu': 1.5}. Best is trial 196 with value: 0.1343540633963538.
[I 2024-12-04 14:58:00,943] Trial 236 finished with value: 0.13435439447801864 and parameters: {'kernel_type': 'Matern', 'length_scale': 63.56217380381766, 'noise_level': 0.0023248366744350202, 'constant_value': 1495.1187618939505, 'nu': 1.5}. Best is trial 196 with value: 0.1343540633963538.
[I 2024-12-04 14:58:01,434] Trial 231 finished with value: 0.13435440142092833 and parameters: {'kernel_type': 'Matern', 'length_scale': 461.6952041896656, 'noise_level': 0.1463912771864313, 'constant_value': 114.78403633382858, 'nu': 1.5}. Best is trial 196 with value: 0.1343540633963538.
[I 2024-12-04 14:58:01,581] Trial 227 finished with value: 0.13435437282980656 and parameters: {'kernel_type': 'Matern', 'length_scale': 25.870646135336084, 'noise_level': 0.9908195616515945, 'constant_value': 355.2400708532877, 'nu': 1.5}. Best is trial 196 with value: 0.1343540633963538.
[I 2024-12-04 14:58:02,487] Trial 225 finished with value: 1.2693635028593457 and parameters: {'kernel_type': 'RBF', 'length_scale': 3.265567106506457e-05, 'noise_level': 0.00011010681524707836, 'constant_value': 411.19985595390085, 'nu': 0.5}. Best is trial 196 with value: 0.1343540633963538.
[I 2024-12-04 14:58:03,837] Trial 229 finished with value: 0.1343544227620498 and parameters: {'kernel_type': 'Matern', 'length_scale': 3.4885187694748, 'noise_level': 9.270631308230831e-06, 'constant_value': 2.330325495128643, 'nu': 1.5}. Best is trial 196 with value: 0.1343540633963538.
[I 2024-12-04 14:58:06,253] Trial 238 finished with value: 1.300773915300973 and parameters: {'kernel_type': 'Matern', 'length_scale': 0.18456379509340257, 'noise_level': 1.4169819130640693e-05, 'constant_value': 1510.0643488159983, 'nu': 1.5}. Best is trial 196 with value: 0.1343540633963538.
[I 2024-12-04 14:58:06,780] Trial 233 finished with value: 1.2693635028542365 and parameters: {'kernel_type': 'Matern', 'length_scale': 79.37308467455038, 'noise_level': 1.5500148026542003e-06, 'constant_value': 1.666265997476865, 'nu': 1.5}. Best is trial 196 with value: 0.1343540633963538.
[I 2024-12-04 14:58:06,781] Trial 235 finished with value: 1.269363502857231 and parameters: {'kernel_type': 'RBF', 'length_scale': 2.24630974457927e-05, 'noise_level': 3.645512492401983e-08, 'constant_value': 0.03936302890473315, 'nu': 0.5}. Best is trial 196 with value: 0.1343540633963538.
[I 2024-12-04 14:58:08,529] Trial 232 finished with value: 0.13435434230496504 and parameters: {'kernel_type': 'Matern', 'length_scale': 73.56357897839383, 'noise_level': 0.6286782918411263, 'constant_value': 352.58837122957675, 'nu': 1.5}. Best is trial 196 with value: 0.1343540633963538.
[I 2024-12-04 14:58:09,848] Trial 237 finished with value: 1.2693635028561234 and parameters: {'kernel_type': 'Matern', 'length_scale': 0.056192386038683914, 'noise_level': 6.244737160078582e-08, 'constant_value': 0.02295813061564537, 'nu': 1.5}. Best is trial 196 with value: 0.1343540633963538.
[I 2024-12-04 14:58:10,789] Trial 239 finished with value: 0.13435440942046778 and parameters: {'kernel_type': 'Matern', 'length_scale': 0.8573403468863008, 'noise_level': 0.007489633893240368, 'constant_value': 1520.629406967775, 'nu': 1.5}. Best is trial 196 with value: 0.1343540633963538.
[I 2024-12-04 14:58:11,063] Trial 242 finished with value: 0.13435440430502416 and parameters: {'kernel_type': 'Matern', 'length_scale': 0.8615588064862639, 'noise_level': 0.294325795607157, 'constant_value': 27556.91410174673, 'nu': 1.5}. Best is trial 196 with value: 0.1343540633963538.
[I 2024-12-04 14:58:11,093] Trial 234 finished with value: 0.13435436418015112 and parameters: {'kernel_type': 'Matern', 'length_scale': 7.15797756366034, 'noise_level': 1.1586793970023247e-07, 'constant_value': 9.184960193519114, 'nu': 1.5}. Best is trial 196 with value: 0.1343540633963538.
[I 2024-12-04 14:58:12,943] Trial 226 finished with value: 0.13435436479004473 and parameters: {'kernel_type': 'Matern', 'length_scale': 1204.2226600512827, 'noise_level': 0.43289083999168, 'constant_value': 3023.44954465631, 'nu': 1.5}. Best is trial 196 with value: 0.1343540633963538.
[I 2024-12-04 14:58:13,660] Trial 240 finished with value: 0.13435440232010593 and parameters: {'kernel_type': 'Matern', 'length_scale': 0.40858035965089057, 'noise_level': 0.008266635449550915, 'constant_value': 52591.18340372952, 'nu': 1.5}. Best is trial 196 with value: 0.1343540633963538.
[I 2024-12-04 14:58:13,840] Trial 241 finished with value: 1.2693635028569015 and parameters: {'kernel_type': 'Matern', 'length_scale': 0.05483993921166685, 'noise_level': 1.0771118234524562e-06, 'constant_value': 0.018611856126794824, 'nu': 1.5}. Best is trial 196 with value: 0.1343540633963538.
[I 2024-12-04 14:58:17,934] Trial 249 finished with value: 1.2693629000201654 and parameters: {'kernel_type': 'Matern', 'length_scale': 0.11180439161095973, 'noise_level': 2.0942275855525855e-05, 'constant_value': 0.010489415032074264, 'nu': 1.5}. Best is trial 196 with value: 0.1343540633963538.
[I 2024-12-04 14:58:17,996] Trial 244 finished with value: 0.13435434480322503 and parameters: {'kernel_type': 'Matern', 'length_scale': 41.29439888502833, 'noise_level': 0.04992591381195272, 'constant_value': 3454.7494778503915, 'nu': 1.5}. Best is trial 196 with value: 0.1343540633963538.
[I 2024-12-04 14:58:20,116] Trial 243 finished with value: 1.26936350285585 and parameters: {'kernel_type': 'RBF', 'length_scale': 34.473587126808226, 'noise_level': 6.384400970262065e-06, 'constant_value': 0.14134533701285298, 'nu': 1.5}. Best is trial 196 with value: 0.1343540633963538.
[I 2024-12-04 14:58:20,664] Trial 255 finished with value: 0.13435406851385456 and parameters: {'kernel_type': 'Matern', 'length_scale': 0.4065274108875506, 'noise_level': 7.679578493222275e-07, 'constant_value': 0.5568643988541973, 'nu': 1.5}. Best is trial 196 with value: 0.1343540633963538.
[I 2024-12-04 14:58:20,970] Trial 250 finished with value: 0.15167297513312694 and parameters: {'kernel_type': 'RBF', 'length_scale': 5563.121071772607, 'noise_level': 0.6698458808636868, 'constant_value': 165.75645820327807, 'nu': 0.5}. Best is trial 196 with value: 0.1343540633963538.
[I 2024-12-04 14:58:22,728] Trial 251 finished with value: 0.13435427716746498 and parameters: {'kernel_type': 'Matern', 'length_scale': 4.033090326154964, 'noise_level': 1.4739675030962443e-06, 'constant_value': 13.17762056024504, 'nu': 1.5}. Best is trial 196 with value: 0.1343540633963538.
[I 2024-12-04 14:58:22,807] Trial 246 finished with value: 0.1343544009522092 and parameters: {'kernel_type': 'Matern', 'length_scale': 2309.4541502120255, 'noise_level': 0.17050640247556637, 'constant_value': 34986.99937480714, 'nu': 1.5}. Best is trial 196 with value: 0.1343540633963538.
[I 2024-12-04 14:58:24,034] Trial 253 finished with value: 1.26936350285723 and parameters: {'kernel_type': 'Matern', 'length_scale': 64.92508001624124, 'noise_level': 4.485361740318386e-08, 'constant_value': 0.037226844241495013, 'nu': 1.5}. Best is trial 196 with value: 0.1343540633963538.
[I 2024-12-04 14:58:24,948] Trial 254 finished with value: 0.13435439815370184 and parameters: {'kernel_type': 'Matern', 'length_scale': 432.04972986197293, 'noise_level': 0.9230489888674154, 'constant_value': 11489.561844560354, 'nu': 1.5}. Best is trial 196 with value: 0.1343540633963538.
[I 2024-12-04 14:58:24,980] Trial 248 finished with value: 0.1343543780131031 and parameters: {'kernel_type': 'Matern', 'length_scale': 1.4335281965715552, 'noise_level': 0.10742483004898033, 'constant_value': 75081.97906564546, 'nu': 1.5}. Best is trial 196 with value: 0.1343540633963538.
[I 2024-12-04 14:58:25,598] Trial 258 finished with value: 1.269363502856965 and parameters: {'kernel_type': 'Matern', 'length_scale': 24.270268404743785, 'noise_level': 2.973472233287243e-06, 'constant_value': 0.007580104493866631, 'nu': 1.5}. Best is trial 196 with value: 0.1343540633963538.
[I 2024-12-04 14:58:26,908] Trial 260 finished with value: 1.269363502856998 and parameters: {'kernel_type': 'RBF', 'length_scale': 10.695943232406663, 'noise_level': 2.523167255186328e-06, 'constant_value': 0.0038093973904977938, 'nu': 2.5}. Best is trial 196 with value: 0.1343540633963538.
[I 2024-12-04 14:58:27,491] Trial 245 finished with value: 0.13435439193219997 and parameters: {'kernel_type': 'Matern', 'length_scale': 2.28930367493521, 'noise_level': 4.87924590541372e-08, 'constant_value': 178.99641029774529, 'nu': 1.5}. Best is trial 196 with value: 0.1343540633963538.
[I 2024-12-04 14:58:28,722] Trial 256 finished with value: 1.2693635028569692 and parameters: {'kernel_type': 'RBF', 'length_scale': 1.724703500863708e-05, 'noise_level': 9.332216620820707e-09, 'constant_value': 2.065558619629756e-07, 'nu': 1.5}. Best is trial 196 with value: 0.1343540633963538.
[I 2024-12-04 14:58:30,347] Trial 259 finished with value: 0.1516729718681906 and parameters: {'kernel_type': 'RBF', 'length_scale': 6.511364108889523, 'noise_level': 0.8578263671559311, 'constant_value': 0.004934733931292193, 'nu': 1.5}. Best is trial 196 with value: 0.1343540633963538.
[I 2024-12-04 14:58:31,046] Trial 252 finished with value: 1.3007745931306622 and parameters: {'kernel_type': 'Matern', 'length_scale': 3105.8518030833975, 'noise_level': 0.2584081321897676, 'constant_value': 0.001493311086582239, 'nu': 2.5}. Best is trial 196 with value: 0.1343540633963538.
[I 2024-12-04 14:58:31,659] Trial 247 finished with value: 0.13435440441089333 and parameters: {'kernel_type': 'Matern', 'length_scale': 3.244634916201798, 'noise_level': 8.380846753740011e-07, 'constant_value': 2.2320943053324585, 'nu': 1.5}. Best is trial 196 with value: 0.1343540633963538.
[I 2024-12-04 14:58:33,125] Trial 263 finished with value: 0.13435450784719985 and parameters: {'kernel_type': 'Matern', 'length_scale': 2557.888398561595, 'noise_level': 0.8220612578764022, 'constant_value': 24.166802247279577, 'nu': 1.5}. Best is trial 196 with value: 0.1343540633963538.
[I 2024-12-04 14:58:33,316] Trial 257 finished with value: 0.13435439129578183 and parameters: {'kernel_type': 'Matern', 'length_scale': 2852.382005235793, 'noise_level': 0.19032806811269265, 'constant_value': 1849.0874173221462, 'nu': 1.5}. Best is trial 196 with value: 0.1343540633963538.
[I 2024-12-04 14:58:33,732] Trial 266 finished with value: 1.269363502856963 and parameters: {'kernel_type': 'Matern', 'length_scale': 0.010524207510903764, 'noise_level': 6.981709014539847e-07, 'constant_value': 2.4242662427698214, 'nu': 1.5}. Best is trial 196 with value: 0.1343540633963538.
[I 2024-12-04 14:58:36,727] Trial 264 finished with value: 0.13435440019217762 and parameters: {'kernel_type': 'Matern', 'length_scale': 0.80761640307263, 'noise_level': 6.352620132477671e-06, 'constant_value': 0.4942323811749987, 'nu': 1.5}. Best is trial 196 with value: 0.1343540633963538.
[I 2024-12-04 14:58:36,943] Trial 267 finished with value: 1.3007745934780586 and parameters: {'kernel_type': 'RBF', 'length_scale': 0.5011328816798104, 'noise_level': 0.00018262676674861295, 'constant_value': 2.3896696017723373e-06, 'nu': 0.5}. Best is trial 196 with value: 0.1343540633963538.
[I 2024-12-04 14:58:37,873] Trial 262 finished with value: 0.13435440398692064 and parameters: {'kernel_type': 'Matern', 'length_scale': 38.22324276401459, 'noise_level': 0.044531850589257876, 'constant_value': 9.48039173522442, 'nu': 1.5}. Best is trial 196 with value: 0.1343540633963538.
[I 2024-12-04 14:58:38,299] Trial 271 finished with value: 0.13435439860512158 and parameters: {'kernel_type': 'Matern', 'length_scale': 27.376058166063146, 'noise_level': 0.38159003708982026, 'constant_value': 14.302135182095833, 'nu': 1.5}. Best is trial 196 with value: 0.1343540633963538.
[I 2024-12-04 14:58:39,035] Trial 265 finished with value: 1.2693635028575967 and parameters: {'kernel_type': 'Matern', 'length_scale': 5.24371074033759e-05, 'noise_level': 0.27964474243434473, 'constant_value': 1310.66447419657, 'nu': 1.5}. Best is trial 196 with value: 0.1343540633963538.
[I 2024-12-04 14:58:44,356] Trial 269 finished with value: 1.2693635028570602 and parameters: {'kernel_type': 'RBF', 'length_scale': 0.03173811150173973, 'noise_level': 0.24225632016900694, 'constant_value': 41.007538757492405, 'nu': 1.5}. Best is trial 196 with value: 0.1343540633963538.
[I 2024-12-04 14:58:44,435] Trial 261 finished with value: 0.13435439071968716 and parameters: {'kernel_type': 'Matern', 'length_scale': 41.89602763579124, 'noise_level': 0.5717046387353772, 'constant_value': 0.0006300756583751187, 'nu': 1.5}. Best is trial 196 with value: 0.1343540633963538.
[I 2024-12-04 14:58:45,462] Trial 274 finished with value: 0.1485980144416287 and parameters: {'kernel_type': 'Matern', 'length_scale': 42.635913952003435, 'noise_level': 0.00048469566135049357, 'constant_value': 310.38971416771653, 'nu': 2.5}. Best is trial 276 with value: 0.13435392997433446.
[I 2024-12-04 14:58:47,534] Trial 276 finished with value: 0.13435392997433446 and parameters: {'kernel_type': 'Matern', 'length_scale': 1.3047616965135678, 'noise_level': 0.002488745294522966, 'constant_value': 224.27341107298227, 'nu': 1.5}. Best is trial 276 with value: 0.13435392997433446.
[I 2024-12-04 14:58:48,893] Trial 268 finished with value: 0.13435433944480119 and parameters: {'kernel_type': 'Matern', 'length_scale': 0.4419375305598909, 'noise_level': 1.1779403064654955e-06, 'constant_value': 58.77283034942796, 'nu': 1.5}. Best is trial 276 with value: 0.13435392997433446.
[I 2024-12-04 14:58:50,080] Trial 272 finished with value: 0.13435428533464525 and parameters: {'kernel_type': 'Matern', 'length_scale': 18.652267747181636, 'noise_level': 0.40632068584873493, 'constant_value': 4.589741243402325, 'nu': 1.5}. Best is trial 276 with value: 0.13435392997433446.
[I 2024-12-04 14:58:51,432] Trial 280 finished with value: 0.13435445224345824 and parameters: {'kernel_type': 'Matern', 'length_scale': 18.47075931626305, 'noise_level': 0.05140905284225119, 'constant_value': 1355.087511227076, 'nu': 1.5}. Best is trial 276 with value: 0.13435392997433446.
[I 2024-12-04 14:58:52,009] Trial 273 finished with value: 0.13435442191484911 and parameters: {'kernel_type': 'Matern', 'length_scale': 2.927183546629414, 'noise_level': 3.007044677845543e-06, 'constant_value': 14.359124360247595, 'nu': 1.5}. Best is trial 276 with value: 0.13435392997433446.
[I 2024-12-04 14:58:54,437] Trial 277 finished with value: 0.13435440253479833 and parameters: {'kernel_type': 'Matern', 'length_scale': 2.258787061261159, 'noise_level': 0.3549473537520326, 'constant_value': 66324.56466963084, 'nu': 1.5}. Best is trial 276 with value: 0.13435392997433446.
[I 2024-12-04 14:58:55,413] Trial 279 finished with value: 0.1343544024059075 and parameters: {'kernel_type': 'Matern', 'length_scale': 6.596292665439603, 'noise_level': 0.0026882525969073837, 'constant_value': 0.004309118367373332, 'nu': 1.5}. Best is trial 276 with value: 0.13435392997433446.
[I 2024-12-04 14:58:56,165] Trial 284 finished with value: 0.13435439932486076 and parameters: {'kernel_type': 'Matern', 'length_scale': 211.6275593605857, 'noise_level': 0.8279386613615639, 'constant_value': 395.67987319893484, 'nu': 1.5}. Best is trial 276 with value: 0.13435392997433446.
[I 2024-12-04 14:58:56,167] Trial 278 finished with value: 0.13435453861256666 and parameters: {'kernel_type': 'Matern', 'length_scale': 24.288404120315807, 'noise_level': 0.006512519849820953, 'constant_value': 23579.341970063557, 'nu': 1.5}. Best is trial 276 with value: 0.13435392997433446.
[I 2024-12-04 14:58:57,373] Trial 281 finished with value: 1.3007745965168247 and parameters: {'kernel_type': 'Matern', 'length_scale': 0.9802384709484668, 'noise_level': 4.031710985780453e-06, 'constant_value': 4327.461031764501, 'nu': 1.5}. Best is trial 276 with value: 0.13435392997433446.
[I 2024-12-04 14:58:57,474] Trial 283 finished with value: 0.13435438931858723 and parameters: {'kernel_type': 'Matern', 'length_scale': 237.56089054626926, 'noise_level': 0.1875262615087405, 'constant_value': 2.2922007425775206, 'nu': 1.5}. Best is trial 276 with value: 0.13435392997433446.
[I 2024-12-04 14:58:58,058] Trial 285 finished with value: 1.2693635028570098 and parameters: {'kernel_type': 'Matern', 'length_scale': 0.02874823449453286, 'noise_level': 0.014022767965045573, 'constant_value': 50578.74849925358, 'nu': 1.5}. Best is trial 276 with value: 0.13435392997433446.
[I 2024-12-04 14:59:00,048] Trial 270 finished with value: 0.134354102128243 and parameters: {'kernel_type': 'Matern', 'length_scale': 13.681932935510808, 'noise_level': 0.22247552697838108, 'constant_value': 38300.623860122185, 'nu': 1.5}. Best is trial 276 with value: 0.13435392997433446.
[I 2024-12-04 14:59:00,529] Trial 282 finished with value: 1.2693635028551755 and parameters: {'kernel_type': 'Matern', 'length_scale': 0.014618407777276427, 'noise_level': 0.051488534893801854, 'constant_value': 56258.87829653957, 'nu': 0.5}. Best is trial 276 with value: 0.13435392997433446.
[I 2024-12-04 14:59:01,038] Trial 286 finished with value: 1.2693635028569692 and parameters: {'kernel_type': 'Matern', 'length_scale': 0.016518136599507283, 'noise_level': 6.628736038143287e-10, 'constant_value': 3.61962061445431e-06, 'nu': 0.5}. Best is trial 276 with value: 0.13435392997433446.
[I 2024-12-04 14:59:02,162] Trial 275 finished with value: 0.13435439618816156 and parameters: {'kernel_type': 'Matern', 'length_scale': 100.20577574558087, 'noise_level': 0.000986475248780409, 'constant_value': 11437.436911815284, 'nu': 1.5}. Best is trial 276 with value: 0.13435392997433446.
[I 2024-12-04 14:59:03,039] Trial 289 finished with value: 0.13435439876362387 and parameters: {'kernel_type': 'Matern', 'length_scale': 1.4790683654102081, 'noise_level': 2.2238554111554048e-05, 'constant_value': 0.35496462882743895, 'nu': 1.5}. Best is trial 276 with value: 0.13435392997433446.
[I 2024-12-04 14:59:06,463] Trial 291 finished with value: 1.2693635028585408 and parameters: {'kernel_type': 'Matern', 'length_scale': 0.041228426020335954, 'noise_level': 0.00022034066389912014, 'constant_value': 16.711876802044557, 'nu': 1.5}. Best is trial 276 with value: 0.13435392997433446.
[I 2024-12-04 14:59:08,049] Trial 287 finished with value: 0.13435438973650307 and parameters: {'kernel_type': 'Matern', 'length_scale': 2.477920133657049, 'noise_level': 0.03403441714163969, 'constant_value': 1.0060149297312633, 'nu': 1.5}. Best is trial 276 with value: 0.13435392997433446.
[I 2024-12-04 14:59:11,044] Trial 288 finished with value: 1.2693635028570411 and parameters: {'kernel_type': 'Matern', 'length_scale': 0.042126340598036965, 'noise_level': 2.854083607664631e-07, 'constant_value': 12.3472660245749, 'nu': 1.5}. Best is trial 276 with value: 0.13435392997433446.
[I 2024-12-04 14:59:11,452] Trial 290 finished with value: 1.3007739229148825 and parameters: {'kernel_type': 'Matern', 'length_scale': 0.1433359012747265, 'noise_level': 8.964640524145026e-07, 'constant_value': 231.87264584631677, 'nu': 1.5}. Best is trial 276 with value: 0.13435392997433446.
[I 2024-12-04 14:59:11,455] Trial 294 finished with value: 0.13435439724826817 and parameters: {'kernel_type': 'Matern', 'length_scale': 4.963735077010265, 'noise_level': 1.0805317768629048e-05, 'constant_value': 232.66487717579835, 'nu': 1.5}. Best is trial 276 with value: 0.13435392997433446.
[I 2024-12-04 14:59:11,879] Trial 293 finished with value: 0.13435440150857947 and parameters: {'kernel_type': 'Matern', 'length_scale': 1.34078129186015, 'noise_level': 1.4931942713974446e-05, 'constant_value': 31.499305745256983, 'nu': 1.5}. Best is trial 276 with value: 0.13435392997433446.
[I 2024-12-04 14:59:16,238] Trial 296 finished with value: 0.13435444045675957 and parameters: {'kernel_type': 'Matern', 'length_scale': 5.000336837279113, 'noise_level': 0.0007481617347652263, 'constant_value': 6.649721126196383, 'nu': 1.5}. Best is trial 276 with value: 0.13435392997433446.
[I 2024-12-04 14:59:17,109] Trial 297 finished with value: 0.13435431525261524 and parameters: {'kernel_type': 'Matern', 'length_scale': 2.3198349868169874, 'noise_level': 0.0004111725276130021, 'constant_value': 6645.559513028033, 'nu': 1.5}. Best is trial 276 with value: 0.13435392997433446.
[I 2024-12-04 14:59:18,363] Trial 298 finished with value: 0.13435447325175537 and parameters: {'kernel_type': 'Matern', 'length_scale': 0.6050591131017805, 'noise_level': 0.12391658635043684, 'constant_value': 0.06889127289189001, 'nu': 1.5}. Best is trial 276 with value: 0.13435392997433446.
[I 2024-12-04 14:59:20,212] Trial 292 finished with value: 1.2693635028567667 and parameters: {'kernel_type': 'RBF', 'length_scale': 0.1050788728804961, 'noise_level': 0.00014931469397690925, 'constant_value': 21199.766727596623, 'nu': 1.5}. Best is trial 276 with value: 0.13435392997433446.
