[I 2024-12-04 00:22:04,867] Trial 1459 finished with value: 0.17307563119628416 and parameters: {'kernel': 'rbf', 'C': 33.098328098735834, 'gamma': 0.029453575146403795, 'epsilon': 0.0010063560504172204}. Best is trial 973 with value: 0.1397919550170376.
[I 2024-12-04 00:22:06,633] Trial 1463 finished with value: 0.25302789034474704 and parameters: {'kernel': 'rbf', 'C': 19.507745875543637, 'gamma': 0.003739355417846022, 'epsilon': 0.0010025853899010796}. Best is trial 973 with value: 0.1397919550170376.
[I 2024-12-04 00:22:07,992] Trial 1464 finished with value: 0.22428974510792066 and parameters: {'kernel': 'rbf', 'C': 97.19449522651465, 'gamma': 0.001511230751935218, 'epsilon': 0.003125673771972205}. Best is trial 973 with value: 0.1397919550170376.
[I 2024-12-04 00:22:09,266] Trial 1465 finished with value: 0.6404018824788453 and parameters: {'kernel': 'rbf', 'C': 0.09563838124775549, 'gamma': 0.19467162132117558, 'epsilon': 0.009796156368798136}. Best is trial 973 with value: 0.1397919550170376.
[I 2024-12-04 00:22:09,899] Trial 1466 finished with value: 0.9551091102434912 and parameters: {'kernel': 'poly', 'C': 0.0044999391008850795, 'gamma': 0.007204296039617474, 'epsilon': 0.6611981769794798}. Best is trial 973 with value: 0.1397919550170376.
[I 2024-12-04 00:22:11,321] Trial 1462 finished with value: 0.16852224190745443 and parameters: {'kernel': 'rbf', 'C': 94.82628816517779, 'gamma': 0.01779515620909162, 'epsilon': 0.0028403896148657183}. Best is trial 973 with value: 0.1397919550170376.
[I 2024-12-04 00:22:12,592] Trial 423 finished with value: 0.926423850494502 and parameters: {'kernel': 'poly', 'C': 0.21806446960447287, 'gamma': 0.727717561174028, 'epsilon': 0.2984255294959081}. Best is trial 973 with value: 0.1397919550170376.
[I 2024-12-04 00:22:15,018] Trial 1469 finished with value: 0.1714122271941668 and parameters: {'kernel': 'rbf', 'C': 92.65519054939266, 'gamma': 0.0036733096557449428, 'epsilon': 0.002730199976703025}. Best is trial 973 with value: 0.1397919550170376.
[I 2024-12-04 00:22:15,653] Trial 1467 finished with value: 0.15604075919481847 and parameters: {'kernel': 'rbf', 'C': 94.14618525071539, 'gamma': 0.013158424804684092, 'epsilon': 0.006874447736279327}. Best is trial 973 with value: 0.1397919550170376.
[I 2024-12-04 00:22:16,396] Trial 1468 finished with value: 0.1489033978687479 and parameters: {'kernel': 'rbf', 'C': 96.99717757394689, 'gamma': 0.0114889825374416, 'epsilon': 0.003674939773483006}. Best is trial 973 with value: 0.1397919550170376.
[I 2024-12-04 00:22:18,679] Trial 1471 finished with value: 0.16751190641228103 and parameters: {'kernel': 'rbf', 'C': 99.42513820749762, 'gamma': 0.0036976750833445137, 'epsilon': 0.004497253434276718}. Best is trial 973 with value: 0.1397919550170376.
[I 2024-12-04 00:22:18,709] Trial 1472 finished with value: 0.16907402871592134 and parameters: {'kernel': 'rbf', 'C': 21.272109126256524, 'gamma': 0.011440098973741703, 'epsilon': 0.002127228072351642}. Best is trial 973 with value: 0.1397919550170376.
[I 2024-12-04 00:22:19,464] Trial 1473 finished with value: 0.2226548189740113 and parameters: {'kernel': 'rbf', 'C': 23.07045699811136, 'gamma': 0.005495128728438777, 'epsilon': 0.0010397424935062564}. Best is trial 973 with value: 0.1397919550170376.
[I 2024-12-04 00:22:21,660] Trial 1470 finished with value: 0.18735445473733003 and parameters: {'kernel': 'rbf', 'C': 98.51777585333603, 'gamma': 0.03310403831151792, 'epsilon': 0.0014544991821729835}. Best is trial 973 with value: 0.1397919550170376.
[I 2024-12-04 00:22:21,901] Trial 1476 finished with value: 0.28316500015270757 and parameters: {'kernel': 'rbf', 'C': 2.788474378745229, 'gamma': 0.010779294677555496, 'epsilon': 0.0010795982042142763}. Best is trial 973 with value: 0.1397919550170376.
[I 2024-12-04 00:22:24,019] Trial 1474 finished with value: 0.14033696320535208 and parameters: {'kernel': 'rbf', 'C': 93.001726274749, 'gamma': 0.007925023757176856, 'epsilon': 0.0011400796788303225}. Best is trial 973 with value: 0.1397919550170376.
[I 2024-12-04 00:22:24,158] Trial 1475 finished with value: 0.16218821344826242 and parameters: {'kernel': 'rbf', 'C': 95.86497438041037, 'gamma': 0.016606681700024793, 'epsilon': 0.011051615115482425}. Best is trial 973 with value: 0.1397919550170376.
[I 2024-12-04 00:22:26,051] Trial 1477 finished with value: 0.1525088565077015 and parameters: {'kernel': 'rbf', 'C': 98.42267813892913, 'gamma': 0.005067479742477455, 'epsilon': 0.0033828324197876986}. Best is trial 973 with value: 0.1397919550170376.
[I 2024-12-04 00:22:26,091] Trial 1480 finished with value: 159.2106509353943 and parameters: {'kernel': 'sigmoid', 'C': 28.53176472224554, 'gamma': 0.004111924573300168, 'epsilon': 0.003631283759661466}. Best is trial 973 with value: 0.1397919550170376.
[I 2024-12-04 00:22:28,257] Trial 1481 finished with value: 300.98562878097493 and parameters: {'kernel': 'sigmoid', 'C': 76.36611841550676, 'gamma': 0.0031659560597753033, 'epsilon': 0.001366613407094501}. Best is trial 973 with value: 0.1397919550170376.
[I 2024-12-04 00:22:29,539] Trial 1479 finished with value: 0.13978216740910654 and parameters: {'kernel': 'rbf', 'C': 99.98076205104768, 'gamma': 0.007859891263360579, 'epsilon': 0.001233081843694928}. Best is trial 1479 with value: 0.13978216740910654.
[I 2024-12-04 00:22:29,701] Trial 1482 finished with value: 0.1913276568473646 and parameters: {'kernel': 'rbf', 'C': 93.99144408193466, 'gamma': 0.002848888438970578, 'epsilon': 0.0023916554477270394}. Best is trial 1479 with value: 0.13978216740910654.
[I 2024-12-04 00:22:31,634] Trial 1484 finished with value: 0.6212495807037104 and parameters: {'kernel': 'linear', 'C': 0.00138126140551436, 'gamma': 0.2062506089475774, 'epsilon': 0.002488622786129006}. Best is trial 1479 with value: 0.13978216740910654.
[I 2024-12-04 00:22:32,295] Trial 1485 finished with value: 0.2806697009317599 and parameters: {'kernel': 'rbf', 'C': 18.18474341822254, 'gamma': 0.0020706854170104536, 'epsilon': 0.00302419208262014}. Best is trial 1479 with value: 0.13978216740910654.
[I 2024-12-04 00:22:37,106] Trial 1487 finished with value: 0.14092712069318028 and parameters: {'kernel': 'rbf', 'C': 76.05614551896244, 'gamma': 0.00854586509899407, 'epsilon': 0.001021560392728647}. Best is trial 1479 with value: 0.13978216740910654.
[I 2024-12-04 00:22:38,118] Trial 1486 finished with value: 0.14258035373699085 and parameters: {'kernel': 'rbf', 'C': 92.14418531267185, 'gamma': 0.010334929099282015, 'epsilon': 0.0010668470836289407}. Best is trial 1479 with value: 0.13978216740910654.
[I 2024-12-04 00:22:39,599] Trial 1488 finished with value: 0.2413332055257979 and parameters: {'kernel': 'rbf', 'C': 23.988950145585616, 'gamma': 0.003999092004563383, 'epsilon': 0.002166879291231516}. Best is trial 1479 with value: 0.13978216740910654.
[I 2024-12-04 00:22:40,832] Trial 1483 finished with value: 0.34396034638062706 and parameters: {'kernel': 'linear', 'C': 2.259206369677523, 'gamma': 0.00024043136489956707, 'epsilon': 0.009231865117673387}. Best is trial 1479 with value: 0.13978216740910654.
[I 2024-12-04 00:22:42,870] Trial 1490 finished with value: 0.3045309126643361 and parameters: {'kernel': 'rbf', 'C': 16.437800169565868, 'gamma': 0.0016062834753197647, 'epsilon': 0.0011922221038378872}. Best is trial 1479 with value: 0.13978216740910654.
[I 2024-12-04 00:22:43,900] Trial 1491 finished with value: 0.22210547648742654 and parameters: {'kernel': 'rbf', 'C': 25.496815669071133, 'gamma': 0.00508122991144383, 'epsilon': 0.0010082707319467872}. Best is trial 1479 with value: 0.13978216740910654.
[I 2024-12-04 00:22:45,623] Trial 1492 finished with value: 0.6863055138447077 and parameters: {'kernel': 'poly', 'C': 70.12649984479627, 'gamma': 0.004733546383011367, 'epsilon': 0.001009707131093571}. Best is trial 1479 with value: 0.13978216740910654.
[I 2024-12-04 00:22:46,096] Trial 1493 finished with value: 3.979159416903677 and parameters: {'kernel': 'sigmoid', 'C': 4.925340035544097, 'gamma': 0.001527647466056542, 'epsilon': 0.006313386620917528}. Best is trial 1479 with value: 0.13978216740910654.
[I 2024-12-04 00:22:47,366] Trial 1489 finished with value: 0.17309848436483113 and parameters: {'kernel': 'rbf', 'C': 96.71449858749082, 'gamma': 0.021698093560942235, 'epsilon': 0.0011226973031044755}. Best is trial 1479 with value: 0.13978216740910654.
[I 2024-12-04 00:22:47,632] Trial 1494 finished with value: 177.26336643889735 and parameters: {'kernel': 'sigmoid', 'C': 12.233333379131148, 'gamma': 0.012038174825764695, 'epsilon': 0.0010365178800884245}. Best is trial 1479 with value: 0.13978216740910654.
[I 2024-12-04 00:22:49,822] Trial 1461 finished with value: 0.3533038289238075 and parameters: {'kernel': 'linear', 'C': 9.16746312365788, 'gamma': 0.002837351249762117, 'epsilon': 0.0011304072259512975}. Best is trial 1479 with value: 0.13978216740910654.
[I 2024-12-04 00:22:49,824] Trial 1497 finished with value: 340.4093073835099 and parameters: {'kernel': 'sigmoid', 'C': 14.230449966418947, 'gamma': 0.06847039427394216, 'epsilon': 0.15610529583760505}. Best is trial 1479 with value: 0.13978216740910654.
[I 2024-12-04 00:22:50,345] Trial 1496 finished with value: 0.20768334865754076 and parameters: {'kernel': 'rbf', 'C': 30.65848492439554, 'gamma': 0.005358582809147482, 'epsilon': 0.0010149842387920651}. Best is trial 1479 with value: 0.13978216740910654.
[I 2024-12-04 00:22:50,641] Trial 1495 finished with value: 0.15631109550922645 and parameters: {'kernel': 'rbf', 'C': 95.06162290321708, 'gamma': 0.004715715787200083, 'epsilon': 0.0010623942265442663}. Best is trial 1479 with value: 0.13978216740910654.
[I 2024-12-04 00:22:53,623] Trial 1500 finished with value: 0.26061259074900456 and parameters: {'kernel': 'rbf', 'C': 14.029496406770875, 'gamma': 0.0042448363245850594, 'epsilon': 0.008182500638909202}. Best is trial 1479 with value: 0.13978216740910654.
[I 2024-12-04 00:22:54,400] Trial 1501 finished with value: 0.22419760529911312 and parameters: {'kernel': 'rbf', 'C': 26.03193268975151, 'gamma': 0.0048877391981414445, 'epsilon': 0.0035099531761878483}. Best is trial 1479 with value: 0.13978216740910654.
[I 2024-12-04 00:22:54,786] Trial 1499 finished with value: 0.17251265234976948 and parameters: {'kernel': 'rbf', 'C': 96.34050161719246, 'gamma': 0.00351432970934777, 'epsilon': 0.0011011737647602065}. Best is trial 1479 with value: 0.13978216740910654.
[I 2024-12-04 00:22:54,891] Trial 1498 finished with value: 0.1724787646571961 and parameters: {'kernel': 'rbf', 'C': 21.911828614097725, 'gamma': 0.032890124045369895, 'epsilon': 0.0026345865470355488}. Best is trial 1479 with value: 0.13978216740910654.
[I 2024-12-04 00:22:56,510] Trial 1157 finished with value: 0.3532963671309729 and parameters: {'kernel': 'linear', 'C': 96.66694105914921, 'gamma': 0.018613841407893995, 'epsilon': 0.002770962861005766}. Best is trial 1479 with value: 0.13978216740910654.
[I 2024-12-04 00:22:56,776] Trial 1503 finished with value: 0.26695270078566513 and parameters: {'kernel': 'rbf', 'C': 2.6419867962933044, 'gamma': 0.015480176579105996, 'epsilon': 0.003041573149430121}. Best is trial 1479 with value: 0.13978216740910654.
[I 2024-12-04 00:22:58,061] Trial 1478 finished with value: 0.3514150643108983 and parameters: {'kernel': 'linear', 'C': 9.491008758149102, 'gamma': 0.008877633714666986, 'epsilon': 0.004226130874404885}. Best is trial 1479 with value: 0.13978216740910654.
[I 2024-12-04 00:22:58,308] Trial 1505 finished with value: 0.18206384793653804 and parameters: {'kernel': 'rbf', 'C': 25.792668254924198, 'gamma': 0.008334491769970885, 'epsilon': 0.0024022591031653603}. Best is trial 1479 with value: 0.13978216740910654.
[I 2024-12-04 00:22:59,392] Trial 1506 finished with value: 0.18916280805843533 and parameters: {'kernel': 'rbf', 'C': 16.15388702689891, 'gamma': 0.010791408594929741, 'epsilon': 0.001030424706538927}. Best is trial 1479 with value: 0.13978216740910654.
[I 2024-12-04 00:22:59,665] Trial 1504 finished with value: 0.15259605628765516 and parameters: {'kernel': 'rbf', 'C': 99.94144044068214, 'gamma': 0.005015667840975256, 'epsilon': 0.0028999337451302877}. Best is trial 1479 with value: 0.13978216740910654.
[I 2024-12-04 00:23:00,240] Trial 1507 finished with value: 0.19960585160954286 and parameters: {'kernel': 'rbf', 'C': 95.88995322705324, 'gamma': 0.0024652403141402213, 'epsilon': 0.0016064110080158535}. Best is trial 1479 with value: 0.13978216740910654.
[I 2024-12-04 00:23:02,094] Trial 1509 finished with value: 0.19559020142469513 and parameters: {'kernel': 'rbf', 'C': 24.924072830307356, 'gamma': 0.04870907926785886, 'epsilon': 0.0027624438546661966}. Best is trial 1479 with value: 0.13978216740910654.
[I 2024-12-04 00:23:02,517] Trial 1511 finished with value: 0.25453267574719174 and parameters: {'kernel': 'rbf', 'C': 15.511121730830693, 'gamma': 0.004414596880115012, 'epsilon': 0.0010052865199858358}. Best is trial 1479 with value: 0.13978216740910654.
[I 2024-12-04 00:23:03,307] Trial 1508 finished with value: 0.1622316558434806 and parameters: {'kernel': 'rbf', 'C': 95.30298164494369, 'gamma': 0.014765390424477678, 'epsilon': 0.005139037649652763}. Best is trial 1479 with value: 0.13978216740910654.
[I 2024-12-04 00:23:03,593] Trial 1510 finished with value: 0.14781006046309192 and parameters: {'kernel': 'rbf', 'C': 25.052514961136445, 'gamma': 0.018884906014516263, 'epsilon': 0.0010287607443244795}. Best is trial 1479 with value: 0.13978216740910654.
[I 2024-12-04 00:23:05,744] Trial 1514 finished with value: 0.4283318687629483 and parameters: {'kernel': 'rbf', 'C': 0.7702764310883243, 'gamma': 0.005582586764182573, 'epsilon': 0.06439553048439761}. Best is trial 1479 with value: 0.13978216740910654.
[I 2024-12-04 00:23:06,009] Trial 1516 finished with value: 0.533252158204409 and parameters: {'kernel': 'linear', 'C': 0.00718152455542408, 'gamma': 0.6566957661375651, 'epsilon': 0.059843465249222814}. Best is trial 1479 with value: 0.13978216740910654.
[I 2024-12-04 00:23:06,942] Trial 1515 finished with value: 0.23724806692190126 and parameters: {'kernel': 'rbf', 'C': 14.933949529278253, 'gamma': 0.10169351277998562, 'epsilon': 0.010735760369944426}. Best is trial 1479 with value: 0.13978216740910654.
[I 2024-12-04 00:23:07,446] Trial 1512 finished with value: 0.18474417210850091 and parameters: {'kernel': 'rbf', 'C': 92.71051413155837, 'gamma': 0.031430701671255126, 'epsilon': 0.002430335491397227}. Best is trial 1479 with value: 0.13978216740910654.
[I 2024-12-04 00:23:10,083] Trial 1517 finished with value: 0.14074119216279676 and parameters: {'kernel': 'rbf', 'C': 92.48099964417024, 'gamma': 0.008688243774613266, 'epsilon': 0.002652094388383964}. Best is trial 1479 with value: 0.13978216740910654.
[I 2024-12-04 00:23:10,109] Trial 1513 finished with value: 0.1771866238152745 and parameters: {'kernel': 'rbf', 'C': 99.97750746744708, 'gamma': 0.02482881030337491, 'epsilon': 0.0044532468666747625}. Best is trial 1479 with value: 0.13978216740910654.
[I 2024-12-04 00:23:10,111] Trial 1520 finished with value: 1083.383478466963 and parameters: {'kernel': 'sigmoid', 'C': 91.54026409947643, 'gamma': 0.008886441011181084, 'epsilon': 0.0026592892019260826}. Best is trial 1479 with value: 0.13978216740910654.
[I 2024-12-04 00:23:10,458] Trial 1519 finished with value: 0.2343527457573347 and parameters: {'kernel': 'rbf', 'C': 17.17351384478744, 'gamma': 0.006013832443307105, 'epsilon': 0.0020749727218779606}. Best is trial 1479 with value: 0.13978216740910654.
[I 2024-12-04 00:23:13,243] Trial 1522 finished with value: 0.20419880973872492 and parameters: {'kernel': 'rbf', 'C': 6.622452146546936, 'gamma': 0.018142793616989457, 'epsilon': 0.006805850021867872}. Best is trial 1479 with value: 0.13978216740910654.
[I 2024-12-04 00:23:13,279] Trial 1518 finished with value: 0.16448674603006688 and parameters: {'kernel': 'rbf', 'C': 96.23781388366287, 'gamma': 0.014999415249424518, 'epsilon': 0.0020372394243315306}. Best is trial 1479 with value: 0.13978216740910654.
[I 2024-12-04 00:23:13,281] Trial 1523 finished with value: 0.7493211659219285 and parameters: {'kernel': 'sigmoid', 'C': 0.03760477434801959, 'gamma': 0.01142800963299169, 'epsilon': 0.015439836300762561}. Best is trial 1479 with value: 0.13978216740910654.
[I 2024-12-04 00:23:13,640] Trial 1521 finished with value: 0.19840625462635172 and parameters: {'kernel': 'rbf', 'C': 95.14467361113142, 'gamma': 0.0025424779722991848, 'epsilon': 0.0012389182289712492}. Best is trial 1479 with value: 0.13978216740910654.
[I 2024-12-04 00:23:13,810] Trial 1524 finished with value: 0.21158364660481419 and parameters: {'kernel': 'rbf', 'C': 21.84646414588015, 'gamma': 0.0068639012748527226, 'epsilon': 0.0055325077254872075}. Best is trial 1479 with value: 0.13978216740910654.
[I 2024-12-04 00:23:16,455] Trial 1529 finished with value: 0.6894133463171784 and parameters: {'kernel': 'rbf', 'C': 54.25385112999225, 'gamma': 0.47106157167180873, 'epsilon': 0.619750295257216}. Best is trial 1479 with value: 0.13978216740910654.
[I 2024-12-04 00:23:16,687] Trial 1527 finished with value: 0.3716224857788305 and parameters: {'kernel': 'rbf', 'C': 14.339720852555791, 'gamma': 0.0008347278009132945, 'epsilon': 0.0022978755207347964}. Best is trial 1479 with value: 0.13978216740910654.
[I 2024-12-04 00:23:17,497] Trial 1526 finished with value: 0.1658160943883813 and parameters: {'kernel': 'rbf', 'C': 14.915678263369607, 'gamma': 0.01621473107666896, 'epsilon': 0.0033619656123054335}. Best is trial 1479 with value: 0.13978216740910654.
[I 2024-12-04 00:23:17,623] Trial 1528 finished with value: 0.3727207041450397 and parameters: {'kernel': 'linear', 'C': 0.075621597345674, 'gamma': 0.0001454676617572711, 'epsilon': 0.006689510491965377}. Best is trial 1479 with value: 0.13978216740910654.
[I 2024-12-04 00:23:18,741] Trial 1530 finished with value: 0.9740214861068618 and parameters: {'kernel': 'poly', 'C': 3.5418964750873005, 'gamma': 0.00021097827230912453, 'epsilon': 0.8814192626373366}. Best is trial 1479 with value: 0.13978216740910654.
[I 2024-12-04 00:23:19,765] Trial 1525 finished with value: 0.14018960935053873 and parameters: {'kernel': 'rbf', 'C': 95.06109801065543, 'gamma': 0.0077183818711205375, 'epsilon': 0.001043883759610705}. Best is trial 1479 with value: 0.13978216740910654.
[I 2024-12-04 00:23:19,766] Trial 1531 finished with value: 0.2619680270573476 and parameters: {'kernel': 'rbf', 'C': 14.721498472244726, 'gamma': 0.003885203129380199, 'epsilon': 0.002556048818900143}. Best is trial 1479 with value: 0.13978216740910654.
[I 2024-12-04 00:23:21,141] Trial 1532 finished with value: 0.26403083194435534 and parameters: {'kernel': 'rbf', 'C': 23.55347535779616, 'gamma': 0.0023304503903807125, 'epsilon': 0.0023743181532572665}. Best is trial 1479 with value: 0.13978216740910654.
[I 2024-12-04 00:23:22,735] Trial 1533 finished with value: 0.15999288827350727 and parameters: {'kernel': 'rbf', 'C': 98.3038997012801, 'gamma': 0.00428396529617507, 'epsilon': 0.0012739220435306108}. Best is trial 1479 with value: 0.13978216740910654.
[I 2024-12-04 00:23:22,763] Trial 1534 finished with value: 0.16585436046153149 and parameters: {'kernel': 'rbf', 'C': 9.872354926084013, 'gamma': 0.03323004727457161, 'epsilon': 0.001127997912518111}. Best is trial 1479 with value: 0.13978216740910654.
[I 2024-12-04 00:23:24,669] Trial 1536 finished with value: 0.19566515179619978 and parameters: {'kernel': 'rbf', 'C': 94.87383289839761, 'gamma': 0.00265555451103495, 'epsilon': 0.0011660399066035477}. Best is trial 1479 with value: 0.13978216740910654.
[I 2024-12-04 00:23:24,795] Trial 1535 finished with value: 0.16086436236137217 and parameters: {'kernel': 'rbf', 'C': 88.2712625486011, 'gamma': 0.004527311519290027, 'epsilon': 0.0011494635341394522}. Best is trial 1479 with value: 0.13978216740910654.
[I 2024-12-04 00:23:26,027] Trial 1539 finished with value: 0.8635712671788519 and parameters: {'kernel': 'poly', 'C': 14.223739376063358, 'gamma': 0.0018189358862347282, 'epsilon': 0.004966118868914806}. Best is trial 1479 with value: 0.13978216740910654.
[I 2024-12-04 00:23:27,099] Trial 1537 finished with value: 0.14633087276091072 and parameters: {'kernel': 'rbf', 'C': 98.69097326523817, 'gamma': 0.005932360723626108, 'epsilon': 0.0011771621076347685}. Best is trial 1479 with value: 0.13978216740910654.
[I 2024-12-04 00:23:28,405] Trial 1540 finished with value: 0.17360857663978094 and parameters: {'kernel': 'rbf', 'C': 27.546293934128833, 'gamma': 0.008728259609980926, 'epsilon': 0.0010870790949445907}. Best is trial 1479 with value: 0.13978216740910654.
[I 2024-12-04 00:23:30,635] Trial 1543 finished with value: 0.17186574360779813 and parameters: {'kernel': 'rbf', 'C': 18.750198830002187, 'gamma': 0.012222264298079398, 'epsilon': 0.0010152536005632112}. Best is trial 1479 with value: 0.13978216740910654.
[I 2024-12-04 00:23:33,219] Trial 1545 finished with value: 0.41792159669252804 and parameters: {'kernel': 'rbf', 'C': 2.8699758504658415, 'gamma': 0.002002378771401763, 'epsilon': 0.002075060331093617}. Best is trial 1479 with value: 0.13978216740910654.
[I 2024-12-04 00:23:33,993] Trial 1542 finished with value: 0.15006382925524878 and parameters: {'kernel': 'rbf', 'C': 98.71914367982676, 'gamma': 0.011574214434592795, 'epsilon': 0.0015826827299872826}. Best is trial 1479 with value: 0.13978216740910654.
[I 2024-12-04 00:23:34,571] Trial 1544 finished with value: 0.14499904386343163 and parameters: {'kernel': 'rbf', 'C': 98.88201858178473, 'gamma': 0.006094741939561574, 'epsilon': 0.001023820676993624}. Best is trial 1479 with value: 0.13978216740910654.
[I 2024-12-04 00:23:35,895] Trial 1546 finished with value: 93.11573881597702 and parameters: {'kernel': 'sigmoid', 'C': 2.2464599947917523, 'gamma': 0.8763337582089398, 'epsilon': 0.0016010456734576212}. Best is trial 1479 with value: 0.13978216740910654.
