[I 2024-12-04 14:56:49,895] Trial 151 finished with value: 0.1343544000583968 and parameters: {'kernel_type': 'Matern', 'length_scale': 77.1662723455231, 'noise_level': 4.927430475618823e-07, 'constant_value': 172.95533016934957, 'nu': 1.5}. Best is trial 105 with value: 0.13435422421010806.
[I 2024-12-04 14:56:50,856] Trial 148 finished with value: 0.17251040347225158 and parameters: {'kernel_type': 'Matern', 'length_scale': 5.886091708757497, 'noise_level': 1.0903812399435271e-06, 'constant_value': 0.07570635911287811, 'nu': 0.5}. Best is trial 105 with value: 0.13435422421010806.
[I 2024-12-04 14:56:51,027] Trial 149 finished with value: 1.269363502856709 and parameters: {'kernel_type': 'Matern', 'length_scale': 162.11548689176757, 'noise_level': 0.0023212650766778983, 'constant_value': 0.3824863284428836, 'nu': 1.5}. Best is trial 105 with value: 0.13435422421010806.
[I 2024-12-04 14:56:51,465] Trial 153 finished with value: 1.2693635028569252 and parameters: {'kernel_type': 'RBF', 'length_scale': 54.00373926850166, 'noise_level': 1.396759819988539e-10, 'constant_value': 0.06466779634043558, 'nu': 1.5}. Best is trial 105 with value: 0.13435422421010806.
[I 2024-12-04 14:56:51,467] Trial 152 finished with value: 0.13435438449241235 and parameters: {'kernel_type': 'Matern', 'length_scale': 10.195586649260344, 'noise_level': 0.5075833281488465, 'constant_value': 0.07538910354896344, 'nu': 1.5}. Best is trial 105 with value: 0.13435422421010806.
[I 2024-12-04 14:56:51,506] Trial 155 finished with value: 0.13435449299272467 and parameters: {'kernel_type': 'Matern', 'length_scale': 98.79218930892809, 'noise_level': 0.08650469914987721, 'constant_value': 7.0716675644967015, 'nu': 1.5}. Best is trial 105 with value: 0.13435422421010806.
[I 2024-12-04 14:56:52,498] Trial 134 finished with value: 0.1343544079947719 and parameters: {'kernel_type': 'Matern', 'length_scale': 422.45412098935947, 'noise_level': 0.12076894855357159, 'constant_value': 0.0006138624180783311, 'nu': 1.5}. Best is trial 105 with value: 0.13435422421010806.
[I 2024-12-04 14:56:53,132] Trial 162 finished with value: 0.1343543262302528 and parameters: {'kernel_type': 'Matern', 'length_scale': 20.206719654261445, 'noise_level': 8.579401722582598e-10, 'constant_value': 1036.003485386958, 'nu': 1.5}. Best is trial 105 with value: 0.13435422421010806.
[I 2024-12-04 14:56:53,545] Trial 163 finished with value: 0.13435457231753917 and parameters: {'kernel_type': 'Matern', 'length_scale': 324.67956038723366, 'noise_level': 0.000958895494374351, 'constant_value': 47768.95676991067, 'nu': 1.5}. Best is trial 105 with value: 0.13435422421010806.
[I 2024-12-04 14:56:53,618] Trial 164 finished with value: 1.2693635028570531 and parameters: {'kernel_type': 'Matern', 'length_scale': 757.9530601803493, 'noise_level': 1.9977144743603202e-07, 'constant_value': 3651.520627046929, 'nu': 1.5}. Best is trial 105 with value: 0.13435422421010806.
[I 2024-12-04 14:56:53,639] Trial 150 finished with value: 1.2693635028569692 and parameters: {'kernel_type': 'Matern', 'length_scale': 2.9248304284190406e-05, 'noise_level': 3.824210400772305e-09, 'constant_value': 2.773418435307225e-07, 'nu': 2.5}. Best is trial 105 with value: 0.13435422421010806.
[I 2024-12-04 14:56:54,018] Trial 157 finished with value: 1.2693635028545485 and parameters: {'kernel_type': 'RBF', 'length_scale': 12458.150530258219, 'noise_level': 1.9422497599983714e-05, 'constant_value': 76863.48496364024, 'nu': 1.5}. Best is trial 105 with value: 0.13435422421010806.
[I 2024-12-04 14:56:54,956] Trial 154 finished with value: 0.13435438640558714 and parameters: {'kernel_type': 'Matern', 'length_scale': 145.7606962536492, 'noise_level': 0.0003368373841134604, 'constant_value': 35.326356031761684, 'nu': 1.5}. Best is trial 105 with value: 0.13435422421010806.
[I 2024-12-04 14:56:55,379] Trial 147 finished with value: 1.300774581196478 and parameters: {'kernel_type': 'RBF', 'length_scale': 0.5985389331912987, 'noise_level': 0.00495099851583105, 'constant_value': 9.092159718713285e-06, 'nu': 1.5}. Best is trial 105 with value: 0.13435422421010806.
[I 2024-12-04 14:56:56,112] Trial 166 finished with value: 0.14859826912464325 and parameters: {'kernel_type': 'Matern', 'length_scale': 5.756420828491121, 'noise_level': 0.5823594289591556, 'constant_value': 29804.7130253577, 'nu': 2.5}. Best is trial 105 with value: 0.13435422421010806.
[I 2024-12-04 14:56:58,684] Trial 160 finished with value: 0.15167297671203114 and parameters: {'kernel_type': 'RBF', 'length_scale': 113.2341379429096, 'noise_level': 0.3645692822153485, 'constant_value': 69912.5196204076, 'nu': 1.5}. Best is trial 105 with value: 0.13435422421010806.
[I 2024-12-04 14:57:01,986] Trial 161 finished with value: 0.13435414529464426 and parameters: {'kernel_type': 'Matern', 'length_scale': 374.0032832797072, 'noise_level': 0.28540117678783344, 'constant_value': 7117.219855913222, 'nu': 1.5}. Best is trial 161 with value: 0.13435414529464426.
[I 2024-12-04 14:57:04,821] Trial 165 finished with value: 0.13435452073709378 and parameters: {'kernel_type': 'Matern', 'length_scale': 432.13288879690157, 'noise_level': 0.21531538196769326, 'constant_value': 665.3843353251236, 'nu': 1.5}. Best is trial 161 with value: 0.13435414529464426.
[I 2024-12-04 14:57:05,619] Trial 172 finished with value: 0.1343543825689464 and parameters: {'kernel_type': 'Matern', 'length_scale': 108.95026162146331, 'noise_level': 0.0009052161704196891, 'constant_value': 243.39455465801194, 'nu': 1.5}. Best is trial 161 with value: 0.13435414529464426.
[I 2024-12-04 14:57:06,090] Trial 171 finished with value: 0.13435435574118107 and parameters: {'kernel_type': 'Matern', 'length_scale': 0.39981457619587923, 'noise_level': 0.36933345910059895, 'constant_value': 1607.2728921739847, 'nu': 1.5}. Best is trial 161 with value: 0.13435414529464426.
[I 2024-12-04 14:57:06,908] Trial 167 finished with value: 0.1343543350314583 and parameters: {'kernel_type': 'Matern', 'length_scale': 7.449045005680198, 'noise_level': 0.753351124643024, 'constant_value': 11.734802486921634, 'nu': 1.5}. Best is trial 161 with value: 0.13435414529464426.
[I 2024-12-04 14:57:07,190] Trial 170 finished with value: 0.13435440349247105 and parameters: {'kernel_type': 'Matern', 'length_scale': 576.7042939703317, 'noise_level': 0.7911556813976733, 'constant_value': 15.812175054776098, 'nu': 1.5}. Best is trial 161 with value: 0.13435414529464426.
[I 2024-12-04 14:57:07,888] Trial 174 finished with value: 1.269363502856735 and parameters: {'kernel_type': 'RBF', 'length_scale': 1282.0005149481478, 'noise_level': 6.852878565428182e-09, 'constant_value': 3347.5350971394705, 'nu': 1.5}. Best is trial 161 with value: 0.13435414529464426.
[I 2024-12-04 14:57:08,584] Trial 173 finished with value: 1.2693635028572738 and parameters: {'kernel_type': 'Matern', 'length_scale': 8672.180481558458, 'noise_level': 9.663393477605139e-05, 'constant_value': 2.5170757644739132, 'nu': 1.5}. Best is trial 161 with value: 0.13435414529464426.
[I 2024-12-04 14:57:09,558] Trial 168 finished with value: 0.1343543995662746 and parameters: {'kernel_type': 'Matern', 'length_scale': 35.37470916504171, 'noise_level': 1.9497421255581078e-10, 'constant_value': 127.26098201009933, 'nu': 1.5}. Best is trial 161 with value: 0.13435414529464426.
[I 2024-12-04 14:57:10,446] Trial 175 finished with value: 0.13435430760426856 and parameters: {'kernel_type': 'Matern', 'length_scale': 2.457759302574315, 'noise_level': 0.8174297598442001, 'constant_value': 75266.93725339403, 'nu': 1.5}. Best is trial 161 with value: 0.13435414529464426.
[I 2024-12-04 14:57:10,864] Trial 176 finished with value: 0.13435433336884467 and parameters: {'kernel_type': 'Matern', 'length_scale': 9.919646546340822, 'noise_level': 2.869536634383607e-06, 'constant_value': 829.8922607955756, 'nu': 1.5}. Best is trial 161 with value: 0.13435414529464426.
[I 2024-12-04 14:57:12,076] Trial 181 finished with value: 0.13435445800918633 and parameters: {'kernel_type': 'Matern', 'length_scale': 10.100341287429478, 'noise_level': 0.00011168920796008675, 'constant_value': 32.29424610390393, 'nu': 1.5}. Best is trial 161 with value: 0.13435414529464426.
[I 2024-12-04 14:57:12,366] Trial 178 finished with value: 1.269363502861445 and parameters: {'kernel_type': 'RBF', 'length_scale': 0.0001095565791069612, 'noise_level': 2.3444553499088547e-10, 'constant_value': 0.016051223451683246, 'nu': 2.5}. Best is trial 161 with value: 0.13435414529464426.
[I 2024-12-04 14:57:12,922] Trial 180 finished with value: 0.13435440796008255 and parameters: {'kernel_type': 'Matern', 'length_scale': 98236.89043638158, 'noise_level': 0.6187038817788273, 'constant_value': 2570.299362090606, 'nu': 1.5}. Best is trial 161 with value: 0.13435414529464426.
[I 2024-12-04 14:57:13,304] Trial 182 finished with value: 0.13435440027068313 and parameters: {'kernel_type': 'Matern', 'length_scale': 89.35380496961524, 'noise_level': 0.7400205515655367, 'constant_value': 10480.925747779796, 'nu': 1.5}. Best is trial 161 with value: 0.13435414529464426.
[I 2024-12-04 14:57:13,454] Trial 169 finished with value: 0.134354396192461 and parameters: {'kernel_type': 'Matern', 'length_scale': 0.2227861827213651, 'noise_level': 0.0008941280226380896, 'constant_value': 0.0001798308303776783, 'nu': 1.5}. Best is trial 161 with value: 0.13435414529464426.
[I 2024-12-04 14:57:14,075] Trial 184 finished with value: 0.13435440621318817 and parameters: {'kernel_type': 'Matern', 'length_scale': 0.4262822132443531, 'noise_level': 0.21777885586286708, 'constant_value': 3.0963348581078756, 'nu': 1.5}. Best is trial 161 with value: 0.13435414529464426.
[I 2024-12-04 14:57:14,175] Trial 177 finished with value: 0.13435446959971045 and parameters: {'kernel_type': 'Matern', 'length_scale': 108.79108498078244, 'noise_level': 0.00013015185443578838, 'constant_value': 36.88792952258512, 'nu': 1.5}. Best is trial 161 with value: 0.13435414529464426.
[I 2024-12-04 14:57:15,379] Trial 186 finished with value: 1.3007745575158691 and parameters: {'kernel_type': 'Matern', 'length_scale': 173.1626108180554, 'noise_level': 3.4490606428768825e-10, 'constant_value': 27970.55341206137, 'nu': 0.5}. Best is trial 161 with value: 0.13435414529464426.
[I 2024-12-04 14:57:15,569] Trial 185 finished with value: 0.1343544279622723 and parameters: {'kernel_type': 'Matern', 'length_scale': 1.626784120867571, 'noise_level': 0.5145445543121593, 'constant_value': 1390.8682082681005, 'nu': 1.5}. Best is trial 161 with value: 0.13435414529464426.
[I 2024-12-04 14:57:16,402] Trial 183 finished with value: 0.13435439750776726 and parameters: {'kernel_type': 'Matern', 'length_scale': 236.78636717841283, 'noise_level': 0.2618669871384144, 'constant_value': 1121.098948351358, 'nu': 1.5}. Best is trial 161 with value: 0.13435414529464426.
[I 2024-12-04 14:57:18,151] Trial 188 finished with value: 1.3007739235567983 and parameters: {'kernel_type': 'Matern', 'length_scale': 0.11399749495287374, 'noise_level': 7.468947375275368e-09, 'constant_value': 414.61961358862345, 'nu': 1.5}. Best is trial 161 with value: 0.13435414529464426.
[I 2024-12-04 14:57:18,324] Trial 179 finished with value: 0.13435438776540062 and parameters: {'kernel_type': 'Matern', 'length_scale': 3.660545462283207, 'noise_level': 0.23527331708591237, 'constant_value': 11642.465282153365, 'nu': 1.5}. Best is trial 161 with value: 0.13435414529464426.
[I 2024-12-04 14:57:20,624] Trial 187 finished with value: 1.2693635028569796 and parameters: {'kernel_type': 'Matern', 'length_scale': 0.0278241328498372, 'noise_level': 0.03534145176385452, 'constant_value': 130.08709065098523, 'nu': 1.5}. Best is trial 161 with value: 0.13435414529464426.
[I 2024-12-04 14:57:21,126] Trial 189 finished with value: 0.13435443492535584 and parameters: {'kernel_type': 'Matern', 'length_scale': 25.880133919061198, 'noise_level': 1.0977969895276628e-08, 'constant_value': 1810.0760838423573, 'nu': 1.5}. Best is trial 161 with value: 0.13435414529464426.
[I 2024-12-04 14:57:22,247] Trial 192 finished with value: 1.3007739229344206 and parameters: {'kernel_type': 'Matern', 'length_scale': 0.14292858910509038, 'noise_level': 6.680929591826569e-09, 'constant_value': 139.67393248629517, 'nu': 1.5}. Best is trial 161 with value: 0.13435414529464426.
[I 2024-12-04 14:57:25,456] Trial 190 finished with value: 0.13435440961774137 and parameters: {'kernel_type': 'Matern', 'length_scale': 10.616410842927928, 'noise_level': 0.36948484178892127, 'constant_value': 0.3228216525534171, 'nu': 1.5}. Best is trial 196 with value: 0.1343540633963538.
[I 2024-12-04 14:57:25,935] Trial 195 finished with value: 0.17251040098953857 and parameters: {'kernel_type': 'Matern', 'length_scale': 8.65827997819163, 'noise_level': 0.08129811237814909, 'constant_value': 16607.238693533585, 'nu': 0.5}. Best is trial 196 with value: 0.1343540633963538.
[I 2024-12-04 14:57:28,938] Trial 198 finished with value: 0.13435435117413982 and parameters: {'kernel_type': 'Matern', 'length_scale': 1114.0498973030963, 'noise_level': 0.9386008731796162, 'constant_value': 5220.69513413033, 'nu': 1.5}. Best is trial 196 with value: 0.1343540633963538.
[I 2024-12-04 14:57:29,875] Trial 196 finished with value: 0.1343540633963538 and parameters: {'kernel_type': 'Matern', 'length_scale': 32.0205592279211, 'noise_level': 0.032666841216033894, 'constant_value': 7.911929283968454, 'nu': 1.5}. Best is trial 196 with value: 0.1343540633963538.
[I 2024-12-04 14:57:32,868] Trial 203 finished with value: 0.1343544008005746 and parameters: {'kernel_type': 'Matern', 'length_scale': 8.558761089219713, 'noise_level': 0.010899290285338422, 'constant_value': 80.33817818827245, 'nu': 1.5}. Best is trial 196 with value: 0.1343540633963538.
[I 2024-12-04 14:57:33,351] Trial 193 finished with value: 0.13435439986245887 and parameters: {'kernel_type': 'Matern', 'length_scale': 0.19798216402795105, 'noise_level': 0.7075997672144261, 'constant_value': 1955.0015798532984, 'nu': 1.5}. Best is trial 196 with value: 0.1343540633963538.
[I 2024-12-04 14:57:34,139] Trial 194 finished with value: 0.13435432832571362 and parameters: {'kernel_type': 'Matern', 'length_scale': 20.4682526107315, 'noise_level': 0.0006850516490930229, 'constant_value': 255.2314666900221, 'nu': 1.5}. Best is trial 196 with value: 0.1343540633963538.
[I 2024-12-04 14:57:34,390] Trial 201 finished with value: 1.269363502856972 and parameters: {'kernel_type': 'Matern', 'length_scale': 13910.236725182225, 'noise_level': 2.2325734452518667e-05, 'constant_value': 397.9499060651362, 'nu': 2.5}. Best is trial 196 with value: 0.1343540633963538.
[I 2024-12-04 14:57:35,534] Trial 191 finished with value: 0.13435439879763236 and parameters: {'kernel_type': 'Matern', 'length_scale': 0.20815089196879358, 'noise_level': 0.13597812315059318, 'constant_value': 6266.963042107893, 'nu': 1.5}. Best is trial 196 with value: 0.1343540633963538.
[I 2024-12-04 14:57:36,703] Trial 197 finished with value: 1.2693635028572194 and parameters: {'kernel_type': 'Matern', 'length_scale': 3130.0746493597267, 'noise_level': 0.00040683911846421157, 'constant_value': 368.1164584005736, 'nu': 1.5}. Best is trial 196 with value: 0.1343540633963538.
[I 2024-12-04 14:57:37,012] Trial 208 finished with value: 0.13435435788843048 and parameters: {'kernel_type': 'Matern', 'length_scale': 4.2082177083797205, 'noise_level': 1.1062707133502884e-06, 'constant_value': 0.20052002100503719, 'nu': 1.5}. Best is trial 196 with value: 0.1343540633963538.
[I 2024-12-04 14:57:38,049] Trial 204 finished with value: 0.13435445270538654 and parameters: {'kernel_type': 'Matern', 'length_scale': 23.139568024349387, 'noise_level': 0.004934128647488813, 'constant_value': 79079.13962758392, 'nu': 1.5}. Best is trial 196 with value: 0.1343540633963538.
[I 2024-12-04 14:57:38,818] Trial 200 finished with value: 0.1343543670453485 and parameters: {'kernel_type': 'Matern', 'length_scale': 3.93520013181866, 'noise_level': 0.6999401027960794, 'constant_value': 65777.08518197005, 'nu': 1.5}. Best is trial 196 with value: 0.1343540633963538.
[I 2024-12-04 14:57:40,337] Trial 215 finished with value: 1.3007745979657548 and parameters: {'kernel_type': 'Matern', 'length_scale': 8.299718194057796, 'noise_level': 2.9694014404993544e-10, 'constant_value': 29816.152959193158, 'nu': 1.5}. Best is trial 196 with value: 0.1343540633963538.
[I 2024-12-04 14:57:42,545] Trial 206 finished with value: 0.13435437778856893 and parameters: {'kernel_type': 'Matern', 'length_scale': 613.0810983884493, 'noise_level': 0.27009891010883674, 'constant_value': 1084.0697717994187, 'nu': 1.5}. Best is trial 196 with value: 0.1343540633963538.
[I 2024-12-04 14:57:42,573] Trial 210 finished with value: 0.1343544537032542 and parameters: {'kernel_type': 'Matern', 'length_scale': 233.42911254542565, 'noise_level': 0.5553476592986282, 'constant_value': 4614.967967213912, 'nu': 1.5}. Best is trial 196 with value: 0.1343540633963538.
[I 2024-12-04 14:57:44,052] Trial 217 finished with value: 0.13435440513995842 and parameters: {'kernel_type': 'Matern', 'length_scale': 484.47768983423424, 'noise_level': 0.05177463398418655, 'constant_value': 8.804173391392256, 'nu': 1.5}. Best is trial 196 with value: 0.1343540633963538.
[I 2024-12-04 14:57:44,997] Trial 202 finished with value: 1.2693635028567194 and parameters: {'kernel_type': 'Matern', 'length_scale': 176.39865825866846, 'noise_level': 1.3267986871485035e-08, 'constant_value': 3654.552562288109, 'nu': 2.5}. Best is trial 196 with value: 0.1343540633963538.
[I 2024-12-04 14:57:47,590] Trial 219 finished with value: 0.13435440675105306 and parameters: {'kernel_type': 'Matern', 'length_scale': 1.7833387408788883, 'noise_level': 0.6702362048121203, 'constant_value': 58.90748689135983, 'nu': 1.5}. Best is trial 196 with value: 0.1343540633963538.
[I 2024-12-04 14:57:49,938] Trial 213 finished with value: 0.1725104015423685 and parameters: {'kernel_type': 'Matern', 'length_scale': 1.1994439331449664, 'noise_level': 0.0015579466757736416, 'constant_value': 1.1370806140416507, 'nu': 0.5}. Best is trial 196 with value: 0.1343540633963538.
[I 2024-12-04 14:57:50,750] Trial 216 finished with value: 0.13435439918266232 and parameters: {'kernel_type': 'Matern', 'length_scale': 66716.44653637335, 'noise_level': 0.017425807389618714, 'constant_value': 64175.57177347989, 'nu': 1.5}. Best is trial 196 with value: 0.1343540633963538.
[I 2024-12-04 14:57:51,430] Trial 205 finished with value: 1.269363502856752 and parameters: {'kernel_type': 'Matern', 'length_scale': 257.8375733120605, 'noise_level': 0.0017576793965431597, 'constant_value': 1.533078154784269, 'nu': 1.5}. Best is trial 196 with value: 0.1343540633963538.
[I 2024-12-04 14:57:51,490] Trial 214 finished with value: 0.13435447623415342 and parameters: {'kernel_type': 'Matern', 'length_scale': 27.955426735422318, 'noise_level': 1.3965865748704456e-05, 'constant_value': 166.76200386403406, 'nu': 1.5}. Best is trial 196 with value: 0.1343540633963538.
[I 2024-12-04 14:57:53,248] Trial 199 finished with value: 0.13435433778571315 and parameters: {'kernel_type': 'Matern', 'length_scale': 43.26490238352939, 'noise_level': 0.33524624375772205, 'constant_value': 0.017411877186669783, 'nu': 1.5}. Best is trial 196 with value: 0.1343540633963538.
[I 2024-12-04 14:57:54,335] Trial 211 finished with value: 1.2693635028569847 and parameters: {'kernel_type': 'Matern', 'length_scale': 181.43575740521197, 'noise_level': 0.004712859458869742, 'constant_value': 0.009022205942846941, 'nu': 1.5}. Best is trial 196 with value: 0.1343540633963538.
[I 2024-12-04 14:57:54,879] Trial 209 finished with value: 0.13435438566287206 and parameters: {'kernel_type': 'Matern', 'length_scale': 796.0061174906114, 'noise_level': 0.32710349202544164, 'constant_value': 15248.299930501607, 'nu': 1.5}. Best is trial 196 with value: 0.1343540633963538.
[I 2024-12-04 14:57:55,419] Trial 222 finished with value: 0.13435428504924535 and parameters: {'kernel_type': 'Matern', 'length_scale': 3.3323659462557016, 'noise_level': 1.4639219374108973e-06, 'constant_value': 23.451089556437605, 'nu': 1.5}. Best is trial 196 with value: 0.1343540633963538.
[I 2024-12-04 14:57:55,840] Trial 221 finished with value: 1.2693635028571142 and parameters: {'kernel_type': 'Matern', 'length_scale': 867.4514143294031, 'noise_level': 2.4288571331233014e-08, 'constant_value': 6.509112818721945, 'nu': 1.5}. Best is trial 196 with value: 0.1343540633963538.
[I 2024-12-04 14:57:56,125] Trial 207 finished with value: 1.26936350285331 and parameters: {'kernel_type': 'RBF', 'length_scale': 80884.8769842202, 'noise_level': 0.00011848520453498524, 'constant_value': 0.5533991184914248, 'nu': 1.5}. Best is trial 196 with value: 0.1343540633963538.
[I 2024-12-04 14:57:56,130] Trial 230 finished with value: 1.3007103329547176 and parameters: {'kernel_type': 'RBF', 'length_scale': 1183.343244426497, 'noise_level': 6.83028878293098e-05, 'constant_value': 0.00012226212841167538, 'nu': 0.5}. Best is trial 196 with value: 0.1343540633963538.
[I 2024-12-04 14:57:56,277] Trial 223 finished with value: 0.13435439967038457 and parameters: {'kernel_type': 'Matern', 'length_scale': 2.5482425568102016, 'noise_level': 0.0017042897956571663, 'constant_value': 203.16639987761425, 'nu': 1.5}. Best is trial 196 with value: 0.1343540633963538.
[I 2024-12-04 14:57:56,717] Trial 212 finished with value: 0.13435441750201255 and parameters: {'kernel_type': 'Matern', 'length_scale': 852.1526923661019, 'noise_level': 0.42563678716321873, 'constant_value': 0.09873828203931867, 'nu': 1.5}. Best is trial 196 with value: 0.1343540633963538.
[I 2024-12-04 14:57:57,905] Trial 228 finished with value: 0.1343542286002981 and parameters: {'kernel_type': 'Matern', 'length_scale': 0.6658817075210214, 'noise_level': 0.18727191842862492, 'constant_value': 77627.99002080476, 'nu': 1.5}. Best is trial 196 with value: 0.1343540633963538.
