[I 2024-12-04 12:33:03,723] Trial 993 finished with value: 0.3899614874721679 and parameters: {'n_estimators': 1420, 'learning_rate': 0.04008847157983211, 'max_depth': 4, 'min_samples_split': 6, 'min_samples_leaf': 5, 'subsample': 0.6043815978252697, 'max_features': None}. Best is trial 989 with value: 0.3092662874814911.
[I 2024-12-04 12:33:04,522] Trial 1009 finished with value: 0.4117423588937147 and parameters: {'n_estimators': 793, 'learning_rate': 0.0414128172595062, 'max_depth': 8, 'min_samples_split': 5, 'min_samples_leaf': 7, 'subsample': 0.6410418162779301, 'max_features': None}. Best is trial 989 with value: 0.3092662874814911.
[I 2024-12-04 12:33:05,182] Trial 992 finished with value: 0.3355611945913591 and parameters: {'n_estimators': 1476, 'learning_rate': 0.037577774977366335, 'max_depth': 6, 'min_samples_split': 9, 'min_samples_leaf': 2, 'subsample': 0.6003862093589178, 'max_features': None}. Best is trial 989 with value: 0.3092662874814911.
[I 2024-12-04 12:33:05,229] Trial 1024 finished with value: 0.5510684475404863 and parameters: {'n_estimators': 244, 'learning_rate': 0.07979672238331044, 'max_depth': 12, 'min_samples_split': 8, 'min_samples_leaf': 9, 'subsample': 0.9256617454285393, 'max_features': None}. Best is trial 989 with value: 0.3092662874814911.
[I 2024-12-04 12:33:06,297] Trial 1002 finished with value: 0.47195171946633 and parameters: {'n_estimators': 1281, 'learning_rate': 0.06759512559598321, 'max_depth': 10, 'min_samples_split': 18, 'min_samples_leaf': 5, 'subsample': 0.8729610743744203, 'max_features': 'log2'}. Best is trial 989 with value: 0.3092662874814911.
[I 2024-12-04 12:33:06,300] Trial 1021 finished with value: 0.5556209751966521 and parameters: {'n_estimators': 454, 'learning_rate': 0.06466706248254547, 'max_depth': 3, 'min_samples_split': 12, 'min_samples_leaf': 1, 'subsample': 0.7476977343953035, 'max_features': 'log2'}. Best is trial 989 with value: 0.3092662874814911.
[I 2024-12-04 12:33:06,933] Trial 1001 finished with value: 0.3797207135148582 and parameters: {'n_estimators': 1193, 'learning_rate': 0.052338409607204546, 'max_depth': 7, 'min_samples_split': 7, 'min_samples_leaf': 1, 'subsample': 0.6056212485373383, 'max_features': None}. Best is trial 989 with value: 0.3092662874814911.
[I 2024-12-04 12:33:07,164] Trial 1005 finished with value: 0.451470572359193 and parameters: {'n_estimators': 1173, 'learning_rate': 0.034558055476280804, 'max_depth': 5, 'min_samples_split': 10, 'min_samples_leaf': 6, 'subsample': 0.7996004981645446, 'max_features': 'sqrt'}. Best is trial 989 with value: 0.3092662874814911.
[I 2024-12-04 12:33:09,428] Trial 997 finished with value: 0.32380722288349895 and parameters: {'n_estimators': 1447, 'learning_rate': 0.09408273364144985, 'max_depth': 5, 'min_samples_split': 3, 'min_samples_leaf': 2, 'subsample': 0.6170476696390284, 'max_features': None}. Best is trial 989 with value: 0.3092662874814911.
[I 2024-12-04 12:33:11,273] Trial 1031 finished with value: 0.4494955256402274 and parameters: {'n_estimators': 211, 'learning_rate': 0.0716868091855891, 'max_depth': 3, 'min_samples_split': 11, 'min_samples_leaf': 4, 'subsample': 0.8856760385785378, 'max_features': None}. Best is trial 989 with value: 0.3092662874814911.
[I 2024-12-04 12:33:11,488] Trial 1011 finished with value: 0.3797979831563385 and parameters: {'n_estimators': 916, 'learning_rate': 0.07020864124577618, 'max_depth': 7, 'min_samples_split': 4, 'min_samples_leaf': 1, 'subsample': 0.6401485687108948, 'max_features': None}. Best is trial 989 with value: 0.3092662874814911.
[I 2024-12-04 12:33:14,136] Trial 996 finished with value: 0.3996249351423171 and parameters: {'n_estimators': 1498, 'learning_rate': 0.0935802563894879, 'max_depth': 6, 'min_samples_split': 5, 'min_samples_leaf': 3, 'subsample': 0.6768624916432442, 'max_features': None}. Best is trial 989 with value: 0.3092662874814911.
[I 2024-12-04 12:33:15,744] Trial 1017 finished with value: 0.3228219500930993 and parameters: {'n_estimators': 974, 'learning_rate': 0.09219534101358168, 'max_depth': 6, 'min_samples_split': 3, 'min_samples_leaf': 2, 'subsample': 0.755175011906264, 'max_features': None}. Best is trial 989 with value: 0.3092662874814911.
[I 2024-12-04 12:33:17,491] Trial 1029 finished with value: 0.4704427705303146 and parameters: {'n_estimators': 672, 'learning_rate': 0.06333481794126955, 'max_depth': 5, 'min_samples_split': 8, 'min_samples_leaf': 7, 'subsample': 0.7278435732458892, 'max_features': 'sqrt'}. Best is trial 989 with value: 0.3092662874814911.
[I 2024-12-04 12:33:17,689] Trial 1012 finished with value: 0.3282217278055437 and parameters: {'n_estimators': 1142, 'learning_rate': 0.05355511521005417, 'max_depth': 8, 'min_samples_split': 6, 'min_samples_leaf': 2, 'subsample': 0.6975388798566802, 'max_features': None}. Best is trial 989 with value: 0.3092662874814911.
[I 2024-12-04 12:33:17,889] Trial 1014 finished with value: 0.32488573544594107 and parameters: {'n_estimators': 1091, 'learning_rate': 0.06574572458042553, 'max_depth': 7, 'min_samples_split': 7, 'min_samples_leaf': 2, 'subsample': 0.7106039780584694, 'max_features': None}. Best is trial 989 with value: 0.3092662874814911.
[I 2024-12-04 12:33:19,128] Trial 1019 finished with value: 0.4274764574587898 and parameters: {'n_estimators': 981, 'learning_rate': 0.05772932203757349, 'max_depth': 3, 'min_samples_split': 18, 'min_samples_leaf': 1, 'subsample': 0.6753004318280719, 'max_features': None}. Best is trial 989 with value: 0.3092662874814911.
[I 2024-12-04 12:33:20,134] Trial 1015 finished with value: 0.3200043454986678 and parameters: {'n_estimators': 1152, 'learning_rate': 0.09750946151499398, 'max_depth': 6, 'min_samples_split': 2, 'min_samples_leaf': 2, 'subsample': 0.6774960015801412, 'max_features': None}. Best is trial 989 with value: 0.3092662874814911.
[I 2024-12-04 12:33:20,312] Trial 1023 finished with value: 0.3882810326427582 and parameters: {'n_estimators': 841, 'learning_rate': 0.07143400657048057, 'max_depth': 8, 'min_samples_split': 6, 'min_samples_leaf': 3, 'subsample': 0.6715406721616893, 'max_features': None}. Best is trial 989 with value: 0.3092662874814911.
[I 2024-12-04 12:33:24,295] Trial 1022 finished with value: 0.3778405038939511 and parameters: {'n_estimators': 877, 'learning_rate': 0.07473316992963229, 'max_depth': 8, 'min_samples_split': 6, 'min_samples_leaf': 4, 'subsample': 0.6985068898053932, 'max_features': None}. Best is trial 989 with value: 0.3092662874814911.
[I 2024-12-04 12:33:25,795] Trial 1028 finished with value: 0.3722340086559783 and parameters: {'n_estimators': 951, 'learning_rate': 0.09339910822440517, 'max_depth': 7, 'min_samples_split': 8, 'min_samples_leaf': 1, 'subsample': 0.9614506704028866, 'max_features': 'sqrt'}. Best is trial 989 with value: 0.3092662874814911.
[I 2024-12-04 12:33:27,671] Trial 1008 finished with value: 0.39506315175058554 and parameters: {'n_estimators': 1498, 'learning_rate': 0.047490324056225754, 'max_depth': 9, 'min_samples_split': 2, 'min_samples_leaf': 3, 'subsample': 0.8229700499224873, 'max_features': None}. Best is trial 989 with value: 0.3092662874814911.
[I 2024-12-04 12:33:27,881] Trial 1020 finished with value: 0.3581928487779363 and parameters: {'n_estimators': 1182, 'learning_rate': 0.09345742968018868, 'max_depth': 5, 'min_samples_split': 10, 'min_samples_leaf': 2, 'subsample': 0.7252158998623988, 'max_features': None}. Best is trial 989 with value: 0.3092662874814911.
[I 2024-12-04 12:33:30,231] Trial 1026 finished with value: 0.38516849115817764 and parameters: {'n_estimators': 1043, 'learning_rate': 0.09871032160744768, 'max_depth': 5, 'min_samples_split': 7, 'min_samples_leaf': 5, 'subsample': 0.7358748564464023, 'max_features': None}. Best is trial 989 with value: 0.3092662874814911.
[I 2024-12-04 12:33:31,511] Trial 1041 finished with value: 0.5547988105819311 and parameters: {'n_estimators': 422, 'learning_rate': 0.01686463393407058, 'max_depth': 12, 'min_samples_split': 16, 'min_samples_leaf': 1, 'subsample': 0.6951013033560797, 'max_features': 'log2'}. Best is trial 989 with value: 0.3092662874814911.
[I 2024-12-04 12:33:31,911] Trial 1038 finished with value: 0.5955249864198433 and parameters: {'n_estimators': 727, 'learning_rate': 0.03908445388303164, 'max_depth': 5, 'min_samples_split': 4, 'min_samples_leaf': 9, 'subsample': 0.92122017124535, 'max_features': 'sqrt'}. Best is trial 989 with value: 0.3092662874814911.
[I 2024-12-04 12:33:32,966] Trial 1025 finished with value: 0.3778070944861975 and parameters: {'n_estimators': 1249, 'learning_rate': 0.09005574523116693, 'max_depth': 4, 'min_samples_split': 2, 'min_samples_leaf': 1, 'subsample': 0.6751030911691809, 'max_features': None}. Best is trial 989 with value: 0.3092662874814911.
[I 2024-12-04 12:33:33,470] Trial 1033 finished with value: 0.47272322616773754 and parameters: {'n_estimators': 802, 'learning_rate': 0.012457662260935299, 'max_depth': 9, 'min_samples_split': 12, 'min_samples_leaf': 3, 'subsample': 0.9046007091563648, 'max_features': 'sqrt'}. Best is trial 989 with value: 0.3092662874814911.
[I 2024-12-04 12:33:38,558] Trial 1027 finished with value: 0.38730587360326013 and parameters: {'n_estimators': 1288, 'learning_rate': 0.09283979285800577, 'max_depth': 6, 'min_samples_split': 7, 'min_samples_leaf': 1, 'subsample': 0.8105069738911759, 'max_features': None}. Best is trial 989 with value: 0.3092662874814911.
[I 2024-12-04 12:33:45,242] Trial 1034 finished with value: 0.36493488039257493 and parameters: {'n_estimators': 1221, 'learning_rate': 0.09456144423296776, 'max_depth': 5, 'min_samples_split': 4, 'min_samples_leaf': 1, 'subsample': 0.6040026058228762, 'max_features': None}. Best is trial 989 with value: 0.3092662874814911.
[I 2024-12-04 12:33:46,148] Trial 1048 finished with value: 0.3886704067920024 and parameters: {'n_estimators': 692, 'learning_rate': 0.09945658709930526, 'max_depth': 5, 'min_samples_split': 8, 'min_samples_leaf': 3, 'subsample': 0.6650264911622379, 'max_features': None}. Best is trial 989 with value: 0.3092662874814911.
[I 2024-12-04 12:33:46,840] Trial 1030 finished with value: 0.38406856262655853 and parameters: {'n_estimators': 1476, 'learning_rate': 0.07866285146434375, 'max_depth': 6, 'min_samples_split': 2, 'min_samples_leaf': 1, 'subsample': 0.7468501183039792, 'max_features': None}. Best is trial 989 with value: 0.3092662874814911.
[I 2024-12-04 12:33:47,888] Trial 1032 finished with value: 0.3921984094431205 and parameters: {'n_estimators': 1441, 'learning_rate': 0.09876677670704416, 'max_depth': 6, 'min_samples_split': 2, 'min_samples_leaf': 3, 'subsample': 0.7158784719101847, 'max_features': None}. Best is trial 989 with value: 0.3092662874814911.
[I 2024-12-04 12:33:50,568] Trial 1045 finished with value: 0.5612086369606734 and parameters: {'n_estimators': 1048, 'learning_rate': 0.011640970823453396, 'max_depth': 10, 'min_samples_split': 18, 'min_samples_leaf': 10, 'subsample': 0.835554022355737, 'max_features': None}. Best is trial 989 with value: 0.3092662874814911.
[I 2024-12-04 12:33:52,112] Trial 1035 finished with value: 0.40704177983221834 and parameters: {'n_estimators': 1387, 'learning_rate': 0.08741616890150358, 'max_depth': 4, 'min_samples_split': 3, 'min_samples_leaf': 3, 'subsample': 0.6769388858482814, 'max_features': None}. Best is trial 989 with value: 0.3092662874814911.
[I 2024-12-04 12:33:53,034] Trial 1039 finished with value: 0.3689871530412382 and parameters: {'n_estimators': 1243, 'learning_rate': 0.08629110991344457, 'max_depth': 5, 'min_samples_split': 4, 'min_samples_leaf': 4, 'subsample': 0.6156890142620294, 'max_features': None}. Best is trial 989 with value: 0.3092662874814911.
[I 2024-12-04 12:33:54,158] Trial 1049 finished with value: 0.38339548806696216 and parameters: {'n_estimators': 1077, 'learning_rate': 0.09099540460563711, 'max_depth': 6, 'min_samples_split': 3, 'min_samples_leaf': 2, 'subsample': 0.7521528837432777, 'max_features': 'sqrt'}. Best is trial 989 with value: 0.3092662874814911.
[I 2024-12-04 12:33:55,544] Trial 1040 finished with value: 0.3829271791200724 and parameters: {'n_estimators': 1328, 'learning_rate': 0.09936096631144939, 'max_depth': 5, 'min_samples_split': 9, 'min_samples_leaf': 3, 'subsample': 0.6546040892352669, 'max_features': None}. Best is trial 989 with value: 0.3092662874814911.
[I 2024-12-04 12:33:55,726] Trial 1051 finished with value: 0.39462793894693404 and parameters: {'n_estimators': 770, 'learning_rate': 0.07464808420968244, 'max_depth': 5, 'min_samples_split': 4, 'min_samples_leaf': 1, 'subsample': 0.760677619025778, 'max_features': None}. Best is trial 989 with value: 0.3092662874814911.
[I 2024-12-04 12:33:56,029] Trial 1063 finished with value: 0.7223950957095845 and parameters: {'n_estimators': 575, 'learning_rate': 0.04520884110399105, 'max_depth': 3, 'min_samples_split': 6, 'min_samples_leaf': 7, 'subsample': 0.9275925482576926, 'max_features': 'log2'}. Best is trial 989 with value: 0.3092662874814911.
[I 2024-12-04 12:33:56,881] Trial 1042 finished with value: 0.329907865361893 and parameters: {'n_estimators': 1268, 'learning_rate': 0.098590400327999, 'max_depth': 5, 'min_samples_split': 6, 'min_samples_leaf': 2, 'subsample': 0.6188691825068037, 'max_features': None}. Best is trial 989 with value: 0.3092662874814911.
[I 2024-12-04 12:33:58,282] Trial 1036 finished with value: 0.34813052073946893 and parameters: {'n_estimators': 1483, 'learning_rate': 0.08258953238554051, 'max_depth': 4, 'min_samples_split': 5, 'min_samples_leaf': 2, 'subsample': 0.644895383012403, 'max_features': None}. Best is trial 989 with value: 0.3092662874814911.
[I 2024-12-04 12:33:58,286] Trial 1037 finished with value: 0.32679044361472553 and parameters: {'n_estimators': 1438, 'learning_rate': 0.08564990613818739, 'max_depth': 7, 'min_samples_split': 4, 'min_samples_leaf': 2, 'subsample': 0.613662642859105, 'max_features': None}. Best is trial 989 with value: 0.3092662874814911.
[I 2024-12-04 12:34:00,407] Trial 1043 finished with value: 0.3822270401023201 and parameters: {'n_estimators': 1397, 'learning_rate': 0.09301611562508896, 'max_depth': 8, 'min_samples_split': 6, 'min_samples_leaf': 1, 'subsample': 0.6406693326737768, 'max_features': 'log2'}. Best is trial 989 with value: 0.3092662874814911.
[I 2024-12-04 12:34:00,408] Trial 1059 finished with value: 0.4967921815428171 and parameters: {'n_estimators': 786, 'learning_rate': 0.02327110839074208, 'max_depth': 9, 'min_samples_split': 18, 'min_samples_leaf': 6, 'subsample': 0.6404345706581795, 'max_features': 'sqrt'}. Best is trial 989 with value: 0.3092662874814911.
[I 2024-12-04 12:34:01,415] Trial 1052 finished with value: 0.4593264366607952 and parameters: {'n_estimators': 1110, 'learning_rate': 0.06932216491599993, 'max_depth': 6, 'min_samples_split': 6, 'min_samples_leaf': 3, 'subsample': 0.768113576961955, 'max_features': 'log2'}. Best is trial 989 with value: 0.3092662874814911.
[I 2024-12-04 12:34:05,859] Trial 1053 finished with value: 0.3818859830493625 and parameters: {'n_estimators': 1173, 'learning_rate': 0.07662160729705993, 'max_depth': 5, 'min_samples_split': 4, 'min_samples_leaf': 3, 'subsample': 0.7058607930380909, 'max_features': None}. Best is trial 989 with value: 0.3092662874814911.
[I 2024-12-04 12:34:06,896] Trial 1044 finished with value: 0.32232496043874914 and parameters: {'n_estimators': 1464, 'learning_rate': 0.09930163348793467, 'max_depth': 6, 'min_samples_split': 3, 'min_samples_leaf': 2, 'subsample': 0.6570409158492453, 'max_features': None}. Best is trial 989 with value: 0.3092662874814911.
[I 2024-12-04 12:34:06,896] Trial 1046 finished with value: 0.3333443135199799 and parameters: {'n_estimators': 1384, 'learning_rate': 0.08861030441738392, 'max_depth': 6, 'min_samples_split': 5, 'min_samples_leaf': 2, 'subsample': 0.600986192417591, 'max_features': None}. Best is trial 989 with value: 0.3092662874814911.
[I 2024-12-04 12:34:08,075] Trial 1047 finished with value: 0.34437521391311704 and parameters: {'n_estimators': 1357, 'learning_rate': 0.08337499088130369, 'max_depth': 8, 'min_samples_split': 4, 'min_samples_leaf': 1, 'subsample': 0.6094825361899999, 'max_features': None}. Best is trial 989 with value: 0.3092662874814911.
[I 2024-12-04 12:34:10,856] Trial 1057 finished with value: 0.38264296157839656 and parameters: {'n_estimators': 1122, 'learning_rate': 0.09361762973913129, 'max_depth': 8, 'min_samples_split': 5, 'min_samples_leaf': 1, 'subsample': 0.7325573552483847, 'max_features': None}. Best is trial 989 with value: 0.3092662874814911.
[I 2024-12-04 12:34:12,142] Trial 1077 finished with value: 0.9898254156602081 and parameters: {'n_estimators': 234, 'learning_rate': 0.02335917313655167, 'max_depth': 5, 'min_samples_split': 11, 'min_samples_leaf': 6, 'subsample': 0.6000570204016613, 'max_features': 'log2'}. Best is trial 989 with value: 0.3092662874814911.
[I 2024-12-04 12:34:13,145] Trial 1065 finished with value: 0.46763391039538854 and parameters: {'n_estimators': 1112, 'learning_rate': 0.0927066003894011, 'max_depth': 4, 'min_samples_split': 10, 'min_samples_leaf': 6, 'subsample': 0.8651065076788603, 'max_features': 'log2'}. Best is trial 989 with value: 0.3092662874814911.
[I 2024-12-04 12:34:13,559] Trial 1055 finished with value: 0.3607663511667839 and parameters: {'n_estimators': 1435, 'learning_rate': 0.06641923482636634, 'max_depth': 3, 'min_samples_split': 2, 'min_samples_leaf': 2, 'subsample': 0.6189047241085458, 'max_features': None}. Best is trial 989 with value: 0.3092662874814911.
[I 2024-12-04 12:34:14,000] Trial 1056 finished with value: 0.3716938409061274 and parameters: {'n_estimators': 1205, 'learning_rate': 0.08699058557461867, 'max_depth': 6, 'min_samples_split': 2, 'min_samples_leaf': 4, 'subsample': 0.7154033777371278, 'max_features': None}. Best is trial 989 with value: 0.3092662874814911.
[I 2024-12-04 12:34:14,056] Trial 1061 finished with value: 0.331127609063716 and parameters: {'n_estimators': 1044, 'learning_rate': 0.08878606583233387, 'max_depth': 5, 'min_samples_split': 2, 'min_samples_leaf': 2, 'subsample': 0.7905039798713559, 'max_features': None}. Best is trial 989 with value: 0.3092662874814911.
[I 2024-12-04 12:34:16,427] Trial 1050 finished with value: 0.3209453900689552 and parameters: {'n_estimators': 1491, 'learning_rate': 0.06824585384391282, 'max_depth': 6, 'min_samples_split': 2, 'min_samples_leaf': 2, 'subsample': 0.6235375322958971, 'max_features': None}. Best is trial 989 with value: 0.3092662874814911.
[I 2024-12-04 12:34:16,589] Trial 1062 finished with value: 0.3788037357079475 and parameters: {'n_estimators': 1132, 'learning_rate': 0.045056640239887945, 'max_depth': 7, 'min_samples_split': 2, 'min_samples_leaf': 5, 'subsample': 0.7943412508099752, 'max_features': None}. Best is trial 989 with value: 0.3092662874814911.
[I 2024-12-04 12:34:16,737] Trial 1054 finished with value: 0.36656947184538935 and parameters: {'n_estimators': 1452, 'learning_rate': 0.09960416231505897, 'max_depth': 4, 'min_samples_split': 6, 'min_samples_leaf': 1, 'subsample': 0.6144051703764917, 'max_features': None}. Best is trial 989 with value: 0.3092662874814911.
[I 2024-12-04 12:34:19,792] Trial 1060 finished with value: 0.36251009695250597 and parameters: {'n_estimators': 1225, 'learning_rate': 0.09361144917406572, 'max_depth': 6, 'min_samples_split': 2, 'min_samples_leaf': 1, 'subsample': 0.6681172589601541, 'max_features': None}. Best is trial 989 with value: 0.3092662874814911.
[I 2024-12-04 12:34:20,723] Trial 1066 finished with value: 0.3187638834282065 and parameters: {'n_estimators': 873, 'learning_rate': 0.09515960219495193, 'max_depth': 7, 'min_samples_split': 2, 'min_samples_leaf': 2, 'subsample': 0.6999780486424536, 'max_features': None}. Best is trial 989 with value: 0.3092662874814911.
[I 2024-12-04 12:34:21,785] Trial 1064 finished with value: 0.4277585068203018 and parameters: {'n_estimators': 1411, 'learning_rate': 0.061554649454683356, 'max_depth': 4, 'min_samples_split': 3, 'min_samples_leaf': 1, 'subsample': 0.6720025296327473, 'max_features': 'log2'}. Best is trial 989 with value: 0.3092662874814911.
[I 2024-12-04 12:34:25,340] Trial 1070 finished with value: 0.3860492755199668 and parameters: {'n_estimators': 883, 'learning_rate': 0.07534608244241377, 'max_depth': 5, 'min_samples_split': 3, 'min_samples_leaf': 1, 'subsample': 0.706938150213202, 'max_features': None}. Best is trial 989 with value: 0.3092662874814911.
[I 2024-12-04 12:34:25,520] Trial 1058 finished with value: 0.3922264565088658 and parameters: {'n_estimators': 1428, 'learning_rate': 0.07339047845816375, 'max_depth': 7, 'min_samples_split': 5, 'min_samples_leaf': 3, 'subsample': 0.603480012235416, 'max_features': None}. Best is trial 989 with value: 0.3092662874814911.
[I 2024-12-04 12:34:25,689] Trial 1071 finished with value: 0.39244334902970174 and parameters: {'n_estimators': 788, 'learning_rate': 0.02980988243689333, 'max_depth': 10, 'min_samples_split': 19, 'min_samples_leaf': 6, 'subsample': 0.9775469409664428, 'max_features': None}. Best is trial 989 with value: 0.3092662874814911.
[I 2024-12-04 12:34:25,731] Trial 1068 finished with value: 0.5840619360101325 and parameters: {'n_estimators': 1112, 'learning_rate': 0.04729033850316887, 'max_depth': 8, 'min_samples_split': 6, 'min_samples_leaf': 10, 'subsample': 0.8873242370757312, 'max_features': 'sqrt'}. Best is trial 989 with value: 0.3092662874814911.
[I 2024-12-04 12:34:25,986] Trial 1067 finished with value: 0.3165804485723643 and parameters: {'n_estimators': 1038, 'learning_rate': 0.0798739993707653, 'max_depth': 6, 'min_samples_split': 2, 'min_samples_leaf': 2, 'subsample': 0.778793884857445, 'max_features': None}. Best is trial 989 with value: 0.3092662874814911.
