[I 2024-12-03 18:42:29,236] Trial 155 finished with value: 1.2885490325041589 and parameters: {'kernel': 'rbf', 'C': 0.004452857194028642, 'gamma': 0.001785736430295309, 'epsilon': 0.8637580969473696}. Best is trial 60 with value: 0.13482943310261095.
[I 2024-12-03 18:42:29,260] Trial 132 finished with value: 106.92189473762441 and parameters: {'kernel': 'sigmoid', 'C': 24.15329218102652, 'gamma': 0.008384282220593568, 'epsilon': 0.19128636823714854}. Best is trial 60 with value: 0.13482943310261095.
[I 2024-12-03 18:42:29,584] Trial 154 finished with value: 0.19194323268716718 and parameters: {'kernel': 'rbf', 'C': 29.526385063552777, 'gamma': 0.013759101268514352, 'epsilon': 0.019821012561140647}. Best is trial 60 with value: 0.13482943310261095.
[I 2024-12-03 18:42:29,600] Trial 153 finished with value: 0.26224773478280866 and parameters: {'kernel': 'rbf', 'C': 40.24313063388195, 'gamma': 0.038961483417319795, 'epsilon': 0.034303871840047497}. Best is trial 60 with value: 0.13482943310261095.
[I 2024-12-03 18:42:29,993] Trial 151 finished with value: 0.15130216741240016 and parameters: {'kernel': 'linear', 'C': 8.153802336764798, 'gamma': 0.00010296733474922813, 'epsilon': 0.14008416270995447}. Best is trial 60 with value: 0.13482943310261095.
[I 2024-12-03 18:42:31,557] Trial 157 finished with value: 0.1353517818558708 and parameters: {'kernel': 'linear', 'C': 5.631958705641409, 'gamma': 0.2902982638589289, 'epsilon': 0.06568227472230516}. Best is trial 60 with value: 0.13482943310261095.
[I 2024-12-03 18:42:31,762] Trial 144 finished with value: 0.14093850646251138 and parameters: {'kernel': 'linear', 'C': 12.377704698156979, 'gamma': 0.0001812353932538015, 'epsilon': 0.09813837523729305}. Best is trial 60 with value: 0.13482943310261095.
[I 2024-12-03 18:42:31,771] Trial 159 finished with value: 1595.462196342711 and parameters: {'kernel': 'sigmoid', 'C': 96.38606592289409, 'gamma': 0.05518483384830839, 'epsilon': 0.05694994624919689}. Best is trial 60 with value: 0.13482943310261095.
[I 2024-12-03 18:42:32,337] Trial 166 finished with value: 1.3215116494472345 and parameters: {'kernel': 'poly', 'C': 4.68276053643721, 'gamma': 0.0004610480986929364, 'epsilon': 0.10781814028466083}. Best is trial 60 with value: 0.13482943310261095.
[I 2024-12-03 18:42:32,349] Trial 136 finished with value: 0.13726860519189166 and parameters: {'kernel': 'linear', 'C': 10.72234835345353, 'gamma': 0.00032406166199633237, 'epsilon': 0.023145860731461163}. Best is trial 60 with value: 0.13482943310261095.
[I 2024-12-03 18:42:33,785] Trial 161 finished with value: 0.14261557231896801 and parameters: {'kernel': 'linear', 'C': 15.744175827505972, 'gamma': 0.039160862316999015, 'epsilon': 0.11227798089639757}. Best is trial 60 with value: 0.13482943310261095.
[I 2024-12-03 18:42:34,056] Trial 165 finished with value: 0.14335169378630772 and parameters: {'kernel': 'linear', 'C': 9.8037574753318, 'gamma': 0.399093399010976, 'epsilon': 0.11366054882737546}. Best is trial 60 with value: 0.13482943310261095.
[I 2024-12-03 18:42:34,118] Trial 163 finished with value: 0.6771916838362925 and parameters: {'kernel': 'rbf', 'C': 26.097223752573914, 'gamma': 0.3350924015776064, 'epsilon': 0.03942032781431198}. Best is trial 60 with value: 0.13482943310261095.
[I 2024-12-03 18:42:34,145] Trial 170 finished with value: 0.18585242898070317 and parameters: {'kernel': 'linear', 'C': 0.486870464517124, 'gamma': 0.13345662543583028, 'epsilon': 0.1339401725497238}. Best is trial 60 with value: 0.13482943310261095.
[I 2024-12-03 18:42:34,903] Trial 168 finished with value: 0.13748936222483757 and parameters: {'kernel': 'linear', 'C': 2.9970806526834055, 'gamma': 0.9043682336642936, 'epsilon': 0.05368516580489186}. Best is trial 60 with value: 0.13482943310261095.
[I 2024-12-03 18:42:34,948] Trial 174 finished with value: 0.26981161963927935 and parameters: {'kernel': 'linear', 'C': 0.02742826087846236, 'gamma': 0.06707660853973575, 'epsilon': 0.0013449782423179425}. Best is trial 60 with value: 0.13482943310261095.
[I 2024-12-03 18:42:35,190] Trial 175 finished with value: 46.98707622491952 and parameters: {'kernel': 'sigmoid', 'C': 2.3652123694131952, 'gamma': 0.19607160228702153, 'epsilon': 0.07670320313244265}. Best is trial 60 with value: 0.13482943310261095.
[I 2024-12-03 18:42:35,525] Trial 162 finished with value: 0.14119624577990045 and parameters: {'kernel': 'linear', 'C': 15.89745543592418, 'gamma': 0.0012224946379866004, 'epsilon': 0.0946100757946074}. Best is trial 60 with value: 0.13482943310261095.
[I 2024-12-03 18:42:35,783] Trial 158 finished with value: 0.13590606647879183 and parameters: {'kernel': 'linear', 'C': 6.823955008203759, 'gamma': 0.1884513262517641, 'epsilon': 0.02921994443406013}. Best is trial 60 with value: 0.13482943310261095.
[I 2024-12-03 18:42:35,854] Trial 173 finished with value: 0.15038113444338602 and parameters: {'kernel': 'linear', 'C': 10.418420712857085, 'gamma': 0.12026652166509513, 'epsilon': 0.1391590002667562}. Best is trial 60 with value: 0.13482943310261095.
[I 2024-12-03 18:42:36,009] Trial 169 finished with value: 0.3379877724787955 and parameters: {'kernel': 'poly', 'C': 75.6030891643574, 'gamma': 0.017303421355070066, 'epsilon': 0.02803807723630618}. Best is trial 60 with value: 0.13482943310261095.
[I 2024-12-03 18:42:36,652] Trial 128 finished with value: 0.13781362550869852 and parameters: {'kernel': 'linear', 'C': 36.32030411480422, 'gamma': 0.08452141799644004, 'epsilon': 0.02161043098419188}. Best is trial 60 with value: 0.13482943310261095.
[I 2024-12-03 18:42:36,656] Trial 167 finished with value: 0.13766676082298013 and parameters: {'kernel': 'linear', 'C': 3.1669713280313374, 'gamma': 0.4222977054012115, 'epsilon': 0.01870580834492938}. Best is trial 60 with value: 0.13482943310261095.
[I 2024-12-03 18:42:36,811] Trial 176 finished with value: 0.13749355735900137 and parameters: {'kernel': 'linear', 'C': 1.6379498784574755, 'gamma': 0.00010193697302466505, 'epsilon': 0.041108407166624034}. Best is trial 60 with value: 0.13482943310261095.
[I 2024-12-03 18:42:37,347] Trial 131 finished with value: 0.1354693937200166 and parameters: {'kernel': 'linear', 'C': 36.98425741757423, 'gamma': 0.25491598250480574, 'epsilon': 0.03816372078023043}. Best is trial 60 with value: 0.13482943310261095.
[I 2024-12-03 18:42:37,818] Trial 183 finished with value: 0.9388972854714389 and parameters: {'kernel': 'sigmoid', 'C': 0.09077103730056943, 'gamma': 0.0028132585523596276, 'epsilon': 0.4820436817924078}. Best is trial 60 with value: 0.13482943310261095.
[I 2024-12-03 18:42:38,149] Trial 178 finished with value: 0.1383635428519027 and parameters: {'kernel': 'linear', 'C': 1.8504560889643995, 'gamma': 0.07798640632765509, 'epsilon': 0.02693646365634508}. Best is trial 60 with value: 0.13482943310261095.
[I 2024-12-03 18:42:39,013] Trial 138 finished with value: 0.13571930814331917 and parameters: {'kernel': 'linear', 'C': 21.138956614290034, 'gamma': 0.00013520200822937718, 'epsilon': 0.03458210527598738}. Best is trial 60 with value: 0.13482943310261095.
[I 2024-12-03 18:42:39,388] Trial 145 finished with value: 0.13634267483539877 and parameters: {'kernel': 'linear', 'C': 35.66446018847896, 'gamma': 0.0001024071737293379, 'epsilon': 0.04270701077988883}. Best is trial 60 with value: 0.13482943310261095.
[I 2024-12-03 18:42:39,636] Trial 182 finished with value: 0.13847074863343756 and parameters: {'kernel': 'linear', 'C': 11.696081718243901, 'gamma': 0.21794203130989093, 'epsilon': 0.08089940335901288}. Best is trial 60 with value: 0.13482943310261095.
[I 2024-12-03 18:42:40,527] Trial 189 finished with value: 1.358310536268189 and parameters: {'kernel': 'poly', 'C': 0.0024145731420275084, 'gamma': 0.0026984228455054736, 'epsilon': 0.06387758258534122}. Best is trial 60 with value: 0.13482943310261095.
[I 2024-12-03 18:42:40,611] Trial 137 finished with value: 0.13719381951535953 and parameters: {'kernel': 'linear', 'C': 58.97982109249551, 'gamma': 0.0002726127165308852, 'epsilon': 0.07510836089991668}. Best is trial 60 with value: 0.13482943310261095.
[I 2024-12-03 18:42:41,002] Trial 171 finished with value: 0.13553093907012778 and parameters: {'kernel': 'linear', 'C': 7.439425028568536, 'gamma': 0.06308559945607227, 'epsilon': 0.039082244774067895}. Best is trial 60 with value: 0.13482943310261095.
[I 2024-12-03 18:42:41,152] Trial 172 finished with value: 0.14523746761686918 and parameters: {'kernel': 'linear', 'C': 70.40503666552628, 'gamma': 0.0010450979383806141, 'epsilon': 0.1222564607849304}. Best is trial 60 with value: 0.13482943310261095.
[I 2024-12-03 18:42:41,171] Trial 181 finished with value: 0.1362877456611286 and parameters: {'kernel': 'linear', 'C': 4.345242572635762, 'gamma': 0.1103609740129487, 'epsilon': 0.026314669961648506}. Best is trial 60 with value: 0.13482943310261095.
[I 2024-12-03 18:42:41,303] Trial 193 finished with value: 0.3486488700643183 and parameters: {'kernel': 'rbf', 'C': 2.717055357740889, 'gamma': 0.0008737926672571912, 'epsilon': 0.028959227295863924}. Best is trial 60 with value: 0.13482943310261095.
[I 2024-12-03 18:42:42,557] Trial 196 finished with value: 1.2331606481389594 and parameters: {'kernel': 'rbf', 'C': 0.21967040799234056, 'gamma': 0.8929531132877404, 'epsilon': 0.020209297218605482}. Best is trial 60 with value: 0.13482943310261095.
[I 2024-12-03 18:42:43,112] Trial 177 finished with value: 0.1372666383016705 and parameters: {'kernel': 'linear', 'C': 7.5121345816299465, 'gamma': 0.0001256217904614238, 'epsilon': 0.019511062122591856}. Best is trial 60 with value: 0.13482943310261095.
[I 2024-12-03 18:42:43,219] Trial 199 finished with value: 0.38726561551304794 and parameters: {'kernel': 'linear', 'C': 0.004736491406896591, 'gamma': 0.023461197949039465, 'epsilon': 0.2643792654621299}. Best is trial 60 with value: 0.13482943310261095.
[I 2024-12-03 18:42:44,341] Trial 203 finished with value: 0.21116631783931905 and parameters: {'kernel': 'rbf', 'C': 27.6028394378945, 'gamma': 0.0017516986173267714, 'epsilon': 0.20760478333107296}. Best is trial 60 with value: 0.13482943310261095.
[I 2024-12-03 18:42:45,616] Trial 126 finished with value: 0.13459441547810197 and parameters: {'kernel': 'linear', 'C': 39.535339203661024, 'gamma': 0.008836701775147822, 'epsilon': 0.0398470310908039}. Best is trial 126 with value: 0.13459441547810197.
[I 2024-12-03 18:42:46,452] Trial 164 finished with value: 0.13570376762937056 and parameters: {'kernel': 'linear', 'C': 14.934269202049341, 'gamma': 0.0006422869010599968, 'epsilon': 0.0361030956621314}. Best is trial 126 with value: 0.13459441547810197.
[I 2024-12-03 18:42:46,982] Trial 184 finished with value: 0.13615710295887717 and parameters: {'kernel': 'linear', 'C': 11.852975549768868, 'gamma': 0.2208725881638431, 'epsilon': 0.05401093357111465}. Best is trial 126 with value: 0.13459441547810197.
[I 2024-12-03 18:42:47,110] Trial 197 finished with value: 0.13564711641707405 and parameters: {'kernel': 'linear', 'C': 4.403065766145781, 'gamma': 0.026971660970663353, 'epsilon': 0.04727079803260421}. Best is trial 126 with value: 0.13459441547810197.
[I 2024-12-03 18:42:48,415] Trial 179 finished with value: 0.1355872405133348 and parameters: {'kernel': 'linear', 'C': 18.510190481864413, 'gamma': 0.0010258493579163315, 'epsilon': 0.033296131038008575}. Best is trial 126 with value: 0.13459441547810197.
[I 2024-12-03 18:42:50,189] Trial 156 finished with value: 0.1352551424527357 and parameters: {'kernel': 'linear', 'C': 33.07143471463261, 'gamma': 0.04599157856473816, 'epsilon': 0.028742730001143142}. Best is trial 126 with value: 0.13459441547810197.
[I 2024-12-03 18:42:50,241] Trial 190 finished with value: 0.13547068474658341 and parameters: {'kernel': 'linear', 'C': 14.901921021045302, 'gamma': 0.00021823106925059725, 'epsilon': 0.03255058969331702}. Best is trial 126 with value: 0.13459441547810197.
[I 2024-12-03 18:42:50,293] Trial 202 finished with value: 0.13614388156199148 and parameters: {'kernel': 'linear', 'C': 3.9850105346079765, 'gamma': 0.13604954185959803, 'epsilon': 0.038862345388631016}. Best is trial 126 with value: 0.13459441547810197.
[I 2024-12-03 18:42:51,190] Trial 204 finished with value: 0.14488293061444538 and parameters: {'kernel': 'linear', 'C': 38.78023527929346, 'gamma': 0.12595946824414803, 'epsilon': 0.12089278076748086}. Best is trial 126 with value: 0.13459441547810197.
[I 2024-12-03 18:42:51,307] Trial 185 finished with value: 0.13691338706561473 and parameters: {'kernel': 'linear', 'C': 9.82711958021401, 'gamma': 0.358388077819315, 'epsilon': 0.025088717225733703}. Best is trial 126 with value: 0.13459441547810197.
[I 2024-12-03 18:42:51,309] Trial 208 finished with value: 0.13486343688959046 and parameters: {'kernel': 'linear', 'C': 5.466538872086796, 'gamma': 0.02000548318584441, 'epsilon': 0.06151513855895074}. Best is trial 126 with value: 0.13459441547810197.
[I 2024-12-03 18:42:51,547] Trial 194 finished with value: 0.135828087770468 and parameters: {'kernel': 'linear', 'C': 8.111507591126045, 'gamma': 0.00020348641391175978, 'epsilon': 0.03552449485148548}. Best is trial 126 with value: 0.13459441547810197.
[I 2024-12-03 18:42:51,960] Trial 198 finished with value: 0.13489567887448334 and parameters: {'kernel': 'linear', 'C': 9.225539446812368, 'gamma': 0.0005946828516600194, 'epsilon': 0.06237352498290978}. Best is trial 126 with value: 0.13459441547810197.
[I 2024-12-03 18:42:51,980] Trial 207 finished with value: 0.13732981985573875 and parameters: {'kernel': 'linear', 'C': 3.8959431489534193, 'gamma': 0.001629337974831992, 'epsilon': 0.023839441618890463}. Best is trial 126 with value: 0.13459441547810197.
[I 2024-12-03 18:42:52,344] Trial 211 finished with value: 0.15210318616027613 and parameters: {'kernel': 'linear', 'C': 2.7324261105643357, 'gamma': 0.005436481960735871, 'epsilon': 0.10229694835313474}. Best is trial 126 with value: 0.13459441547810197.
[I 2024-12-03 18:42:52,772] Trial 201 finished with value: 0.13614706032195129 and parameters: {'kernel': 'linear', 'C': 11.621098287522754, 'gamma': 0.17480028837260175, 'epsilon': 0.052380296398689234}. Best is trial 126 with value: 0.13459441547810197.
[I 2024-12-03 18:42:53,449] Trial 150 finished with value: 0.1357633635833429 and parameters: {'kernel': 'linear', 'C': 26.24569874568737, 'gamma': 0.036585727191215306, 'epsilon': 0.026516924331365155}. Best is trial 126 with value: 0.13459441547810197.
[I 2024-12-03 18:42:54,911] Trial 142 finished with value: 0.30746774952577255 and parameters: {'kernel': 'poly', 'C': 0.01583311742808316, 'gamma': 0.6154662757400515, 'epsilon': 0.004828926055183602}. Best is trial 126 with value: 0.13459441547810197.
[I 2024-12-03 18:42:55,724] Trial 223 finished with value: 1.1428803571363686 and parameters: {'kernel': 'rbf', 'C': 0.013059360674301345, 'gamma': 0.04952075969770969, 'epsilon': 0.0025046609708426395}. Best is trial 126 with value: 0.13459441547810197.
[I 2024-12-03 18:42:56,441] Trial 224 finished with value: 0.4395557720315286 and parameters: {'kernel': 'sigmoid', 'C': 1.59161790167397, 'gamma': 0.0013578650293215163, 'epsilon': 0.07097962523335552}. Best is trial 126 with value: 0.13459441547810197.
[I 2024-12-03 18:42:56,478] Trial 209 finished with value: 0.1381374629016368 and parameters: {'kernel': 'linear', 'C': 8.443889615454324, 'gamma': 0.019961557062491052, 'epsilon': 0.01876588768188831}. Best is trial 126 with value: 0.13459441547810197.
[I 2024-12-03 18:42:57,154] Trial 195 finished with value: 0.1366099672917414 and parameters: {'kernel': 'linear', 'C': 17.389596755723556, 'gamma': 0.09315146630066495, 'epsilon': 0.02405169110926163}. Best is trial 126 with value: 0.13459441547810197.
[I 2024-12-03 18:42:57,626] Trial 215 finished with value: 0.13461662333301497 and parameters: {'kernel': 'linear', 'C': 10.154847807589581, 'gamma': 0.010342468869308572, 'epsilon': 0.06397446235708473}. Best is trial 126 with value: 0.13459441547810197.
[I 2024-12-03 18:42:57,709] Trial 226 finished with value: 0.4069286808076312 and parameters: {'kernel': 'poly', 'C': 1.9370106118294066, 'gamma': 0.02831551654512902, 'epsilon': 0.2302657519024085}. Best is trial 126 with value: 0.13459441547810197.
[I 2024-12-03 18:42:58,074] Trial 221 finished with value: 0.14362107775439606 and parameters: {'kernel': 'linear', 'C': 8.095059652989463, 'gamma': 0.0011512197435424414, 'epsilon': 0.11226074347807198}. Best is trial 126 with value: 0.13459441547810197.
[I 2024-12-03 18:42:59,364] Trial 214 finished with value: 0.1355007439911926 and parameters: {'kernel': 'linear', 'C': 7.998293530843228, 'gamma': 0.00851026838104587, 'epsilon': 0.03815889099744078}. Best is trial 126 with value: 0.13459441547810197.
[I 2024-12-03 18:42:59,520] Trial 230 finished with value: 1.0879193729792225 and parameters: {'kernel': 'poly', 'C': 22.24309087234212, 'gamma': 0.0013778751560168888, 'epsilon': 0.05044689120485422}. Best is trial 126 with value: 0.13459441547810197.
[I 2024-12-03 18:43:00,409] Trial 227 finished with value: 0.14091625333717994 and parameters: {'kernel': 'linear', 'C': 3.1834090557293018, 'gamma': 0.02933932795988029, 'epsilon': 0.07500136962868459}. Best is trial 126 with value: 0.13459441547810197.
[I 2024-12-03 18:43:00,419] Trial 229 finished with value: 0.14263491297581443 and parameters: {'kernel': 'linear', 'C': 1.3560884768945456, 'gamma': 0.012045523793073852, 'epsilon': 0.06381632079037831}. Best is trial 126 with value: 0.13459441547810197.
[I 2024-12-03 18:43:00,436] Trial 213 finished with value: 0.13616504840240493 and parameters: {'kernel': 'linear', 'C': 12.950178012642741, 'gamma': 0.003861385787097708, 'epsilon': 0.05432527011169091}. Best is trial 126 with value: 0.13459441547810197.
[I 2024-12-03 18:43:01,356] Trial 231 finished with value: 1.3600727634287206 and parameters: {'kernel': 'sigmoid', 'C': 0.0016248175639929565, 'gamma': 0.0006323052520299457, 'epsilon': 0.001377910739511603}. Best is trial 126 with value: 0.13459441547810197.
[I 2024-12-03 18:43:01,379] Trial 217 finished with value: 0.13585397014862677 and parameters: {'kernel': 'linear', 'C': 6.9249282397422665, 'gamma': 0.018136967795206287, 'epsilon': 0.028201266005676608}. Best is trial 126 with value: 0.13459441547810197.
[I 2024-12-03 18:43:02,421] Trial 234 finished with value: 122.34895871790329 and parameters: {'kernel': 'sigmoid', 'C': 8.076368780031745, 'gamma': 0.03262710974950315, 'epsilon': 0.017683338205309707}. Best is trial 126 with value: 0.13459441547810197.
[I 2024-12-03 18:43:02,538] Trial 232 finished with value: 0.137701797282594 and parameters: {'kernel': 'linear', 'C': 3.235487651172496, 'gamma': 0.009867287228670255, 'epsilon': 0.06155707892268437}. Best is trial 126 with value: 0.13459441547810197.
[I 2024-12-03 18:43:03,333] Trial 238 finished with value: 0.6118675868287545 and parameters: {'kernel': 'rbf', 'C': 6.013033730939368, 'gamma': 0.12377133539632447, 'epsilon': 0.48504346565310447}. Best is trial 126 with value: 0.13459441547810197.
[I 2024-12-03 18:43:04,064] Trial 186 finished with value: 0.13769133898963118 and parameters: {'kernel': 'linear', 'C': 25.78153430341467, 'gamma': 0.1180617862754077, 'epsilon': 0.0212710818373786}. Best is trial 126 with value: 0.13459441547810197.
[I 2024-12-03 18:43:04,882] Trial 192 finished with value: 0.13776079611717865 and parameters: {'kernel': 'linear', 'C': 84.41122349152529, 'gamma': 0.625611740554553, 'epsilon': 0.07770768697223836}. Best is trial 126 with value: 0.13459441547810197.
[I 2024-12-03 18:43:04,992] Trial 241 finished with value: 0.33737940935070193 and parameters: {'kernel': 'rbf', 'C': 92.76515583171786, 'gamma': 0.04678775766235923, 'epsilon': 0.14701821937059764}. Best is trial 126 with value: 0.13459441547810197.
[I 2024-12-03 18:43:05,633] Trial 235 finished with value: 0.13470391706958698 and parameters: {'kernel': 'linear', 'C': 8.537477493914656, 'gamma': 0.012117434310957884, 'epsilon': 0.06634526478201064}. Best is trial 126 with value: 0.13459441547810197.
[I 2024-12-03 18:43:06,315] Trial 243 finished with value: 0.2421240233452446 and parameters: {'kernel': 'linear', 'C': 6.206519961932741, 'gamma': 0.0059252890888707565, 'epsilon': 0.34700062343681454}. Best is trial 126 with value: 0.13459441547810197.
[I 2024-12-03 18:43:08,235] Trial 216 finished with value: 0.13709293979038542 and parameters: {'kernel': 'linear', 'C': 21.250002513474602, 'gamma': 0.01794309351194417, 'epsilon': 0.048503504619510654}. Best is trial 126 with value: 0.13459441547810197.
[I 2024-12-03 18:43:08,492] Trial 245 finished with value: 0.14427224792884996 and parameters: {'kernel': 'linear', 'C': 6.098175985244265, 'gamma': 0.0008720520851264878, 'epsilon': 0.10926419037322899}. Best is trial 126 with value: 0.13459441547810197.
[I 2024-12-03 18:43:08,746] Trial 160 finished with value: 0.13620533408525437 and parameters: {'kernel': 'linear', 'C': 62.34228475347888, 'gamma': 0.018610186884146472, 'epsilon': 0.05209092008694406}. Best is trial 126 with value: 0.13459441547810197.
[I 2024-12-03 18:43:08,752] Trial 152 finished with value: 0.13503705270280406 and parameters: {'kernel': 'linear', 'C': 66.39634095406545, 'gamma': 0.001814541040419703, 'epsilon': 0.055930345956168116}. Best is trial 126 with value: 0.13459441547810197.
[I 2024-12-03 18:43:09,330] Trial 239 finished with value: 0.13567146923728282 and parameters: {'kernel': 'linear', 'C': 7.0403627352416045, 'gamma': 0.017487485021798015, 'epsilon': 0.04171303347872571}. Best is trial 126 with value: 0.13459441547810197.
[I 2024-12-03 18:43:09,888] Trial 246 finished with value: 0.14880000329640522 and parameters: {'kernel': 'linear', 'C': 0.6364165634856208, 'gamma': 0.015245496040421426, 'epsilon': 0.023486554199345002}. Best is trial 126 with value: 0.13459441547810197.
