[I 2024-12-03 18:53:54,422] Trial 1024 finished with value: 0.15175385141707737 and parameters: {'kernel': 'linear', 'C': 0.5314813740450278, 'gamma': 0.05865674597925668, 'epsilon': 0.024131540246449788}. Best is trial 345 with value: 0.13438257115663557.
[I 2024-12-03 18:53:54,807] Trial 959 finished with value: 0.1382078968242547 and parameters: {'kernel': 'linear', 'C': 69.13069786996427, 'gamma': 0.01042484213289836, 'epsilon': 0.015471467670115046}. Best is trial 345 with value: 0.13438257115663557.
[I 2024-12-03 18:53:55,105] Trial 1021 finished with value: 0.3503628715267597 and parameters: {'kernel': 'poly', 'C': 21.024293655838694, 'gamma': 0.04879132118529267, 'epsilon': 0.1032863807451495}. Best is trial 345 with value: 0.13438257115663557.
[I 2024-12-03 18:53:55,234] Trial 1006 finished with value: 0.1387601762282357 and parameters: {'kernel': 'linear', 'C': 29.722676856419383, 'gamma': 0.12556173219422084, 'epsilon': 0.08513973684064265}. Best is trial 345 with value: 0.13438257115663557.
[I 2024-12-03 18:53:56,393] Trial 1026 finished with value: 0.14711349408996982 and parameters: {'kernel': 'linear', 'C': 0.8739473017756713, 'gamma': 0.025851585809353664, 'epsilon': 0.06561992914070829}. Best is trial 345 with value: 0.13438257115663557.
[I 2024-12-03 18:53:56,455] Trial 1025 finished with value: 0.13879868738113577 and parameters: {'kernel': 'linear', 'C': 2.813202775885102, 'gamma': 0.08558203370801029, 'epsilon': 0.06350029553026078}. Best is trial 345 with value: 0.13438257115663557.
[I 2024-12-03 18:53:56,553] Trial 1027 finished with value: 0.20747247862340248 and parameters: {'kernel': 'linear', 'C': 0.2164050784657463, 'gamma': 0.11487308447576484, 'epsilon': 0.14203186283252667}. Best is trial 345 with value: 0.13438257115663557.
[I 2024-12-03 18:53:57,977] Trial 939 finished with value: 0.13510807199862476 and parameters: {'kernel': 'linear', 'C': 99.03081987506829, 'gamma': 0.014891682484965528, 'epsilon': 0.029473026626840402}. Best is trial 345 with value: 0.13438257115663557.
[I 2024-12-03 18:53:58,363] Trial 1030 finished with value: 17.89733864147775 and parameters: {'kernel': 'sigmoid', 'C': 53.53403708559157, 'gamma': 0.00245124311491926, 'epsilon': 0.008956843316192455}. Best is trial 345 with value: 0.13438257115663557.
[I 2024-12-03 18:53:58,954] Trial 1031 finished with value: 0.15825827303807555 and parameters: {'kernel': 'linear', 'C': 3.1269451461727114, 'gamma': 0.055187320510381804, 'epsilon': 0.1338160785997467}. Best is trial 345 with value: 0.13438257115663557.
[I 2024-12-03 18:53:59,614] Trial 1033 finished with value: 0.27125789036431097 and parameters: {'kernel': 'rbf', 'C': 6.430857267331429, 'gamma': 0.017663943676232845, 'epsilon': 0.05031428774512001}. Best is trial 345 with value: 0.13438257115663557.
[I 2024-12-03 18:54:00,219] Trial 941 finished with value: 0.1347223611354389 and parameters: {'kernel': 'linear', 'C': 92.63856372315988, 'gamma': 0.004923380153769019, 'epsilon': 0.031233710525130586}. Best is trial 345 with value: 0.13438257115663557.
[I 2024-12-03 18:54:00,294] Trial 1035 finished with value: 0.9363378820546022 and parameters: {'kernel': 'rbf', 'C': 0.12544686441608682, 'gamma': 0.0017806562843037958, 'epsilon': 0.9621497921318708}. Best is trial 345 with value: 0.13438257115663557.
[I 2024-12-03 18:54:01,278] Trial 961 finished with value: 0.13614809648052684 and parameters: {'kernel': 'linear', 'C': 85.17318484909654, 'gamma': 0.013226530125320948, 'epsilon': 0.042383093563248334}. Best is trial 345 with value: 0.13438257115663557.
[I 2024-12-03 18:54:01,837] Trial 1037 finished with value: 0.6413463467168593 and parameters: {'kernel': 'rbf', 'C': 6.441294051186252, 'gamma': 0.2370414908744167, 'epsilon': 0.1441076612007248}. Best is trial 345 with value: 0.13438257115663557.
[I 2024-12-03 18:54:03,771] Trial 1028 finished with value: 0.13691159294042238 and parameters: {'kernel': 'linear', 'C': 4.471609035653309, 'gamma': 0.007242870077336472, 'epsilon': 0.025505721704457685}. Best is trial 345 with value: 0.13438257115663557.
[I 2024-12-03 18:54:05,047] Trial 1041 finished with value: 1213.1562033966075 and parameters: {'kernel': 'sigmoid', 'C': 79.10408621675182, 'gamma': 0.034039215088511425, 'epsilon': 0.017921447811567764}. Best is trial 345 with value: 0.13438257115663557.
[I 2024-12-03 18:54:06,663] Trial 1022 finished with value: 0.1350961825539859 and parameters: {'kernel': 'linear', 'C': 21.102871520941314, 'gamma': 0.032755610752446505, 'epsilon': 0.038956939640967844}. Best is trial 345 with value: 0.13438257115663557.
[I 2024-12-03 18:54:07,192] Trial 1014 finished with value: 0.13573880787011075 and parameters: {'kernel': 'linear', 'C': 24.809979871884128, 'gamma': 0.12954355785847163, 'epsilon': 0.03531518986664238}. Best is trial 345 with value: 0.13438257115663557.
[I 2024-12-03 18:54:07,806] Trial 1019 finished with value: 0.14027192841582328 and parameters: {'kernel': 'linear', 'C': 94.96851650071343, 'gamma': 0.038921900059755224, 'epsilon': 0.10322606426137229}. Best is trial 345 with value: 0.13438257115663557.
[I 2024-12-03 18:54:07,888] Trial 1004 finished with value: 0.1367499456274782 and parameters: {'kernel': 'linear', 'C': 31.878820508302827, 'gamma': 0.0652244738500184, 'epsilon': 0.04406913541610101}. Best is trial 345 with value: 0.13438257115663557.
[I 2024-12-03 18:54:08,380] Trial 1043 finished with value: 0.3689229313050018 and parameters: {'kernel': 'poly', 'C': 11.61848238039937, 'gamma': 0.02075546650852835, 'epsilon': 0.007490359123044701}. Best is trial 345 with value: 0.13438257115663557.
[I 2024-12-03 18:54:09,505] Trial 1046 finished with value: 0.6528868249829475 and parameters: {'kernel': 'rbf', 'C': 0.3953062072876935, 'gamma': 0.0005551381099472519, 'epsilon': 0.016790467917064057}. Best is trial 345 with value: 0.13438257115663557.
[I 2024-12-03 18:54:10,577] Trial 989 finished with value: 0.1380415306132241 and parameters: {'kernel': 'linear', 'C': 38.16736578088125, 'gamma': 0.0893509474584796, 'epsilon': 0.014482936185726991}. Best is trial 345 with value: 0.13438257115663557.
[I 2024-12-03 18:54:10,770] Trial 1015 finished with value: 0.1357199648061754 and parameters: {'kernel': 'linear', 'C': 25.3366167997619, 'gamma': 0.06363653479337447, 'epsilon': 0.035297562883213444}. Best is trial 345 with value: 0.13438257115663557.
[I 2024-12-03 18:54:12,564] Trial 1050 finished with value: 0.16003681047483403 and parameters: {'kernel': 'linear', 'C': 0.3585910757925662, 'gamma': 0.494382021052238, 'epsilon': 0.03551282731215831}. Best is trial 345 with value: 0.13438257115663557.
[I 2024-12-03 18:54:13,038] Trial 1029 finished with value: 0.13541455986875847 and parameters: {'kernel': 'linear', 'C': 15.792211256298136, 'gamma': 0.013441695740330554, 'epsilon': 0.037806955460143586}. Best is trial 345 with value: 0.13438257115663557.
[I 2024-12-03 18:54:18,116] Trial 1048 finished with value: 0.34730037802292285 and parameters: {'kernel': 'poly', 'C': 0.03529135364585946, 'gamma': 0.2469635564036449, 'epsilon': 0.01082312342770909}. Best is trial 345 with value: 0.13438257115663557.
[I 2024-12-03 18:54:18,545] Trial 965 finished with value: 0.13469166793221177 and parameters: {'kernel': 'linear', 'C': 82.4396207773675, 'gamma': 0.003644264967958603, 'epsilon': 0.03209517021989326}. Best is trial 345 with value: 0.13438257115663557.
[I 2024-12-03 18:54:19,993] Trial 973 finished with value: 0.1370061925167645 and parameters: {'kernel': 'linear', 'C': 93.6058733856899, 'gamma': 0.008781306626867224, 'epsilon': 0.0447708206414598}. Best is trial 345 with value: 0.13438257115663557.
[I 2024-12-03 18:54:20,892] Trial 1049 finished with value: 0.13779377269496898 and parameters: {'kernel': 'linear', 'C': 4.665653673660917, 'gamma': 0.0012001713719262785, 'epsilon': 0.00100823699638155}. Best is trial 345 with value: 0.13438257115663557.
[I 2024-12-03 18:54:24,124] Trial 970 finished with value: 0.13786569371049343 and parameters: {'kernel': 'linear', 'C': 89.06339377085986, 'gamma': 0.012855940884291265, 'epsilon': 0.009428734116635286}. Best is trial 345 with value: 0.13438257115663557.
[I 2024-12-03 18:54:26,559] Trial 1005 finished with value: 0.13546774463429392 and parameters: {'kernel': 'linear', 'C': 66.30489025157293, 'gamma': 0.07966650258567899, 'epsilon': 0.028167996406306392}. Best is trial 345 with value: 0.13438257115663557.
[I 2024-12-03 18:54:27,795] Trial 1045 finished with value: 0.1372169667303863 and parameters: {'kernel': 'linear', 'C': 28.98471167986849, 'gamma': 0.0025722859095703285, 'epsilon': 0.04800779545091814}. Best is trial 345 with value: 0.13438257115663557.
[I 2024-12-03 18:54:30,148] Trial 1044 finished with value: 0.13740979113012872 and parameters: {'kernel': 'linear', 'C': 18.98380955757591, 'gamma': 0.004176383920564547, 'epsilon': 0.019409702159326452}. Best is trial 345 with value: 0.13438257115663557.
[I 2024-12-03 18:54:41,986] Trial 916 finished with value: 0.13789734364824197 and parameters: {'kernel': 'linear', 'C': 97.66251819308764, 'gamma': 0.0301581182772235, 'epsilon': 0.00836666695502788}. Best is trial 345 with value: 0.13438257115663557.
[I 2024-12-03 18:54:43,756] Trial 1038 finished with value: 0.1356782954933228 and parameters: {'kernel': 'linear', 'C': 34.83293780835702, 'gamma': 0.004715552833363162, 'epsilon': 0.026694151003250382}. Best is trial 345 with value: 0.13438257115663557.
[I 2024-12-03 18:54:45,195] Trial 1062 finished with value: 0.16159599276346243 and parameters: {'kernel': 'linear', 'C': 3.320680236025797, 'gamma': 0.00303392405968299, 'epsilon': 0.13917072683282908}. Best is trial 345 with value: 0.13438257115663557.
[I 2024-12-03 18:54:46,569] Trial 1063 finished with value: 0.621230374782119 and parameters: {'kernel': 'poly', 'C': 23.7111616519095, 'gamma': 0.00511197397711603, 'epsilon': 0.036609660793377095}. Best is trial 345 with value: 0.13438257115663557.
[I 2024-12-03 18:54:46,710] Trial 1051 finished with value: 0.13743662938374146 and parameters: {'kernel': 'linear', 'C': 30.732070240349138, 'gamma': 0.009493694700566569, 'epsilon': 0.020108879644118324}. Best is trial 345 with value: 0.13438257115663557.
[I 2024-12-03 18:54:47,912] Trial 1064 finished with value: 1.3532408521244055 and parameters: {'kernel': 'sigmoid', 'C': 0.022247072571216688, 'gamma': 0.00016812363477261658, 'epsilon': 0.16173209111167777}. Best is trial 345 with value: 0.13438257115663557.
[I 2024-12-03 18:54:48,038] Trial 987 finished with value: 0.1361562914746196 and parameters: {'kernel': 'linear', 'C': 97.2134482413818, 'gamma': 0.002626947654915581, 'epsilon': 0.042298961996335864}. Best is trial 345 with value: 0.13438257115663557.
[I 2024-12-03 18:54:48,596] Trial 988 finished with value: 0.13571499758688874 and parameters: {'kernel': 'linear', 'C': 74.39799670216301, 'gamma': 0.03514416477162822, 'epsilon': 0.036726628418427464}. Best is trial 345 with value: 0.13438257115663557.
[I 2024-12-03 18:54:49,100] Trial 1066 finished with value: 0.46273413721152606 and parameters: {'kernel': 'linear', 'C': 0.007129147611830139, 'gamma': 0.05101851829376809, 'epsilon': 0.8268114318426537}. Best is trial 345 with value: 0.13438257115663557.
[I 2024-12-03 18:54:49,973] Trial 968 finished with value: 0.1354623351327084 and parameters: {'kernel': 'linear', 'C': 97.40199416164349, 'gamma': 0.009302981411421486, 'epsilon': 0.028005083566990302}. Best is trial 345 with value: 0.13438257115663557.
[I 2024-12-03 18:54:50,136] Trial 1036 finished with value: 0.1350909419571584 and parameters: {'kernel': 'linear', 'C': 64.22856750117313, 'gamma': 0.017780464647933317, 'epsilon': 0.02950609730122388}. Best is trial 345 with value: 0.13438257115663557.
[I 2024-12-03 18:54:50,391] Trial 1067 finished with value: 15.820631875179329 and parameters: {'kernel': 'sigmoid', 'C': 1.2200736652371467, 'gamma': 0.022325956213778957, 'epsilon': 0.03582003187043551}. Best is trial 345 with value: 0.13438257115663557.
[I 2024-12-03 18:54:57,758] Trial 1060 finished with value: 0.1378307040865031 and parameters: {'kernel': 'linear', 'C': 26.836230185318954, 'gamma': 0.0021632696558759575, 'epsilon': 0.012812796326105267}. Best is trial 345 with value: 0.13438257115663557.
[I 2024-12-03 18:55:01,998] Trial 1072 finished with value: 0.15601968525549967 and parameters: {'kernel': 'linear', 'C': 94.72515107171483, 'gamma': 0.0011876408865265041, 'epsilon': 0.1560648926153059}. Best is trial 345 with value: 0.13438257115663557.
[I 2024-12-03 18:55:04,163] Trial 1065 finished with value: 0.13560878619002145 and parameters: {'kernel': 'linear', 'C': 15.490352579317145, 'gamma': 0.0040235649309749225, 'epsilon': 0.0362344756160551}. Best is trial 345 with value: 0.13438257115663557.
[I 2024-12-03 18:55:05,294] Trial 990 finished with value: 0.13860410021494035 and parameters: {'kernel': 'linear', 'C': 67.34420079203447, 'gamma': 0.004162840759508121, 'epsilon': 0.012147331662704626}. Best is trial 345 with value: 0.13438257115663557.
[I 2024-12-03 18:55:06,060] Trial 1074 finished with value: 0.1417382120947066 and parameters: {'kernel': 'linear', 'C': 10.447614747877498, 'gamma': 0.005206817014401615, 'epsilon': 0.10682683661613797}. Best is trial 345 with value: 0.13438257115663557.
[I 2024-12-03 18:55:08,721] Trial 1002 finished with value: 0.1382584882413649 and parameters: {'kernel': 'linear', 'C': 81.90480477087662, 'gamma': 0.015609312139910155, 'epsilon': 0.015775102433306824}. Best is trial 345 with value: 0.13438257115663557.
[I 2024-12-03 18:55:10,609] Trial 1058 finished with value: 0.13577681545713297 and parameters: {'kernel': 'linear', 'C': 39.51706504351862, 'gamma': 0.003821810313202138, 'epsilon': 0.026185464631116512}. Best is trial 345 with value: 0.13438257115663557.
[I 2024-12-03 18:55:15,653] Trial 1057 finished with value: 0.1353381184009205 and parameters: {'kernel': 'linear', 'C': 94.07009634559307, 'gamma': 0.004049924896850623, 'epsilon': 0.05752385152252007}. Best is trial 345 with value: 0.13438257115663557.
[I 2024-12-03 18:55:17,064] Trial 1080 finished with value: 0.16539263514180633 and parameters: {'kernel': 'rbf', 'C': 69.69092049375364, 'gamma': 0.00889354920797015, 'epsilon': 0.032322581745739376}. Best is trial 345 with value: 0.13438257115663557.
[I 2024-12-03 18:55:17,137] Trial 1071 finished with value: 0.136174995020509 and parameters: {'kernel': 'linear', 'C': 24.743023106365268, 'gamma': 0.002864982301966374, 'epsilon': 0.0433174089780125}. Best is trial 345 with value: 0.13438257115663557.
[I 2024-12-03 18:55:17,877] Trial 1056 finished with value: 0.1356645691014284 and parameters: {'kernel': 'linear', 'C': 44.60007644735236, 'gamma': 0.0030800604193648414, 'epsilon': 0.02663900815796343}. Best is trial 345 with value: 0.13438257115663557.
[I 2024-12-03 18:55:18,939] Trial 1010 finished with value: 0.1377291032185812 and parameters: {'kernel': 'linear', 'C': 62.370196462749576, 'gamma': 0.08256263091386637, 'epsilon': 0.017821691321710433}. Best is trial 345 with value: 0.13438257115663557.
[I 2024-12-03 18:55:19,607] Trial 1083 finished with value: 6.9645783778174355 and parameters: {'kernel': 'sigmoid', 'C': 80.54352873039497, 'gamma': 0.0015081217658672633, 'epsilon': 0.03080647688611221}. Best is trial 345 with value: 0.13438257115663557.
[I 2024-12-03 18:55:20,622] Trial 1081 finished with value: 0.13789638268198956 and parameters: {'kernel': 'linear', 'C': 1.963713225165201, 'gamma': 0.0011194020572864382, 'epsilon': 0.015445100892457923}. Best is trial 345 with value: 0.13438257115663557.
[I 2024-12-03 18:55:22,437] Trial 1073 finished with value: 0.13502735204897226 and parameters: {'kernel': 'linear', 'C': 47.91247513042697, 'gamma': 0.0008016027410174298, 'epsilon': 0.0611995723531409}. Best is trial 345 with value: 0.13438257115663557.
[I 2024-12-03 18:55:26,738] Trial 1075 finished with value: 0.1380622497307021 and parameters: {'kernel': 'linear', 'C': 12.321991683840409, 'gamma': 0.018129796444234184, 'epsilon': 0.006790209151427123}. Best is trial 345 with value: 0.13438257115663557.
[I 2024-12-03 18:55:27,605] Trial 1087 finished with value: 0.13560765255923962 and parameters: {'kernel': 'linear', 'C': 9.384218042995544, 'gamma': 0.013619590691546954, 'epsilon': 0.0600413521004541}. Best is trial 345 with value: 0.13438257115663557.
[I 2024-12-03 18:55:28,715] Trial 1055 finished with value: 0.1358856913457472 and parameters: {'kernel': 'linear', 'C': 73.93078940750324, 'gamma': 0.003322440194700839, 'epsilon': 0.025913128234980282}. Best is trial 345 with value: 0.13438257115663557.
[I 2024-12-03 18:55:30,763] Trial 1084 finished with value: 0.13560119940220774 and parameters: {'kernel': 'linear', 'C': 9.289943788406543, 'gamma': 0.0014826823367271812, 'epsilon': 0.028500385988337675}. Best is trial 345 with value: 0.13438257115663557.
[I 2024-12-03 18:55:31,101] Trial 1052 finished with value: 0.13477622401205847 and parameters: {'kernel': 'linear', 'C': 59.51770806358888, 'gamma': 0.006829922897489997, 'epsilon': 0.039984064371604615}. Best is trial 345 with value: 0.13438257115663557.
[I 2024-12-03 18:55:34,343] Trial 1047 finished with value: 0.13779024093280542 and parameters: {'kernel': 'linear', 'C': 76.56668716400469, 'gamma': 0.0017714600059337523, 'epsilon': 0.01345014234744381}. Best is trial 345 with value: 0.13438257115663557.
[I 2024-12-03 18:55:36,514] Trial 1042 finished with value: 0.13670608364503178 and parameters: {'kernel': 'linear', 'C': 99.6524837259764, 'gamma': 0.006153822270535212, 'epsilon': 0.046755378943258964}. Best is trial 345 with value: 0.13438257115663557.
[I 2024-12-03 18:55:39,032] Trial 1091 finished with value: 0.13878466755642643 and parameters: {'kernel': 'linear', 'C': 31.439936260882067, 'gamma': 0.0057317860458401, 'epsilon': 0.08642365055365595}. Best is trial 345 with value: 0.13438257115663557.
[I 2024-12-03 18:55:39,758] Trial 1082 finished with value: 0.32573720614795565 and parameters: {'kernel': 'poly', 'C': 23.229799159613478, 'gamma': 0.04518125645803979, 'epsilon': 0.0344408857617403}. Best is trial 345 with value: 0.13438257115663557.
[I 2024-12-03 18:55:39,761] Trial 1053 finished with value: 0.13732817516724208 and parameters: {'kernel': 'linear', 'C': 90.76689566440012, 'gamma': 0.003060621054766822, 'epsilon': 0.022274690048221683}. Best is trial 345 with value: 0.13438257115663557.
[I 2024-12-03 18:55:41,273] Trial 1040 finished with value: 0.1358052021515277 and parameters: {'kernel': 'linear', 'C': 77.4123996266256, 'gamma': 0.0019891074917868764, 'epsilon': 0.02580489283883973}. Best is trial 345 with value: 0.13438257115663557.
[I 2024-12-03 18:55:46,988] Trial 1086 finished with value: 0.13569824269501427 and parameters: {'kernel': 'linear', 'C': 22.01164809121375, 'gamma': 0.01001937081774825, 'epsilon': 0.027305307234518184}. Best is trial 345 with value: 0.13438257115663557.
[I 2024-12-03 18:55:48,329] Trial 1093 finished with value: 0.13721756485018 and parameters: {'kernel': 'linear', 'C': 22.027972144695298, 'gamma': 0.007749212634789072, 'epsilon': 0.046960362726684586}. Best is trial 345 with value: 0.13438257115663557.
[I 2024-12-03 18:55:49,365] Trial 1100 finished with value: 0.19684798062842915 and parameters: {'kernel': 'rbf', 'C': 26.86542365515721, 'gamma': 0.0013644249676297837, 'epsilon': 0.05340230995975509}. Best is trial 345 with value: 0.13438257115663557.
[I 2024-12-03 18:55:51,138] Trial 1095 finished with value: 0.13846708240315914 and parameters: {'kernel': 'linear', 'C': 5.635173896360593, 'gamma': 0.003849687513846322, 'epsilon': 0.009902190059255316}. Best is trial 345 with value: 0.13438257115663557.
[I 2024-12-03 18:55:54,174] Trial 1054 finished with value: 0.135726155030144 and parameters: {'kernel': 'linear', 'C': 78.28704377346043, 'gamma': 0.0014744615923677747, 'epsilon': 0.026143439212002923}. Best is trial 345 with value: 0.13438257115663557.
[I 2024-12-03 18:55:55,349] Trial 1032 finished with value: 0.13830786951245108 and parameters: {'kernel': 'linear', 'C': 82.38291834852618, 'gamma': 0.010119061582151631, 'epsilon': 0.01498181149960166}. Best is trial 345 with value: 0.13438257115663557.
[I 2024-12-03 18:55:56,298] Trial 1104 finished with value: 0.7731658021514982 and parameters: {'kernel': 'poly', 'C': 0.001304051155668094, 'gamma': 0.023456188198961583, 'epsilon': 0.09532457285866801}. Best is trial 345 with value: 0.13438257115663557.
[I 2024-12-03 18:55:57,290] Trial 1076 finished with value: 0.13518326501650033 and parameters: {'kernel': 'linear', 'C': 74.57587565571936, 'gamma': 0.006182923916114081, 'epsilon': 0.056188857403719254}. Best is trial 345 with value: 0.13438257115663557.
[I 2024-12-03 18:55:57,321] Trial 1098 finished with value: 0.14068715373208127 and parameters: {'kernel': 'linear', 'C': 77.60480154415913, 'gamma': 0.013594618224454931, 'epsilon': 0.08904834831920452}. Best is trial 345 with value: 0.13438257115663557.
[I 2024-12-03 18:55:58,711] Trial 1070 finished with value: 0.1347772666380611 and parameters: {'kernel': 'linear', 'C': 72.07954231568169, 'gamma': 0.004588295858217096, 'epsilon': 0.03934276052763075}. Best is trial 345 with value: 0.13438257115663557.
[I 2024-12-03 18:55:59,433] Trial 1068 finished with value: 0.13763343984452905 and parameters: {'kernel': 'linear', 'C': 47.57247667517133, 'gamma': 0.0021131278096821657, 'epsilon': 0.0041036994261307675}. Best is trial 345 with value: 0.13438257115663557.
[I 2024-12-03 18:55:59,891] Trial 1101 finished with value: 0.13536455386965932 and parameters: {'kernel': 'linear', 'C': 18.13454725253452, 'gamma': 0.010789916047017872, 'epsilon': 0.06514382334199065}. Best is trial 345 with value: 0.13438257115663557.
[I 2024-12-03 18:56:00,275] Trial 1059 finished with value: 0.1360798827168039 and parameters: {'kernel': 'linear', 'C': 99.41995720603161, 'gamma': 0.010009478917649977, 'epsilon': 0.042208020684357105}. Best is trial 345 with value: 0.13438257115663557.
