[I 2024-12-04 20:31:52,836] Trial 1597 finished with value: 0.3592112812314539 and parameters: {'kernel_type': 'Matern', 'length_scale': 3.717908579035644, 'noise_level': 0.052141472831648, 'constant_value': 28.780414187137605, 'nu': 0.5}. Best is trial 881 with value: 0.35916990930150405.
[I 2024-12-04 20:31:55,701] Trial 1598 finished with value: 0.3592109615707982 and parameters: {'kernel_type': 'Matern', 'length_scale': 4.4929561849703505, 'noise_level': 0.08601176377864116, 'constant_value': 1.3771733162606967, 'nu': 0.5}. Best is trial 881 with value: 0.35916990930150405.
[I 2024-12-04 20:31:56,716] Trial 1599 finished with value: 0.35921124132720006 and parameters: {'kernel_type': 'Matern', 'length_scale': 22.11438185839472, 'noise_level': 0.0008564696050972835, 'constant_value': 62237.88757986196, 'nu': 0.5}. Best is trial 881 with value: 0.35916990930150405.
[I 2024-12-04 20:31:57,904] Trial 1600 finished with value: 0.41956600026657553 and parameters: {'kernel_type': 'Matern', 'length_scale': 253.3605734668223, 'noise_level': 0.0907071322056141, 'constant_value': 1983.5040385236603, 'nu': 2.5}. Best is trial 881 with value: 0.35916990930150405.
[I 2024-12-04 20:32:01,227] Trial 1601 finished with value: 0.35921134887567524 and parameters: {'kernel_type': 'Matern', 'length_scale': 1.5301944999518138, 'noise_level': 0.011323326673908207, 'constant_value': 4282.78053115718, 'nu': 0.5}. Best is trial 881 with value: 0.35916990930150405.
[I 2024-12-04 20:32:01,229] Trial 1602 finished with value: 0.3592111562354624 and parameters: {'kernel_type': 'Matern', 'length_scale': 244.65099091486405, 'noise_level': 0.02491317958186653, 'constant_value': 1201.8579695009885, 'nu': 0.5}. Best is trial 881 with value: 0.35916990930150405.
[I 2024-12-04 20:32:02,927] Trial 1603 finished with value: 0.3592115575033166 and parameters: {'kernel_type': 'Matern', 'length_scale': 30.648516904126954, 'noise_level': 7.749327239064389e-05, 'constant_value': 5.232141125923666, 'nu': 0.5}. Best is trial 881 with value: 0.35916990930150405.
[I 2024-12-04 20:32:06,679] Trial 1604 finished with value: 0.35921133346570083 and parameters: {'kernel_type': 'Matern', 'length_scale': 0.5945055314831219, 'noise_level': 0.00010122282020208161, 'constant_value': 65.22457400918141, 'nu': 0.5}. Best is trial 881 with value: 0.35916990930150405.
[I 2024-12-04 20:32:09,864] Trial 1606 finished with value: 1.0624161172869448 and parameters: {'kernel_type': 'RBF', 'length_scale': 0.00023535292868441654, 'noise_level': 0.0020296755007121058, 'constant_value': 2.987708948068151e-07, 'nu': 2.5}. Best is trial 881 with value: 0.35916990930150405.
[I 2024-12-04 20:32:13,000] Trial 1605 finished with value: 0.3592110247312009 and parameters: {'kernel_type': 'Matern', 'length_scale': 0.1228107739185803, 'noise_level': 0.07305884533451892, 'constant_value': 59717.15899798413, 'nu': 0.5}. Best is trial 881 with value: 0.35916990930150405.
[I 2024-12-04 20:32:14,284] Trial 1607 finished with value: 1.062416117636735 and parameters: {'kernel_type': 'Matern', 'length_scale': 700.0956610898818, 'noise_level': 7.990160578154756e-05, 'constant_value': 11.229411221173388, 'nu': 2.5}. Best is trial 881 with value: 0.35916990930150405.
[I 2024-12-04 20:32:15,179] Trial 1608 finished with value: 0.3592111656753748 and parameters: {'kernel_type': 'Matern', 'length_scale': 5.582363131557711, 'noise_level': 0.4873441997815515, 'constant_value': 7.231596406698064, 'nu': 0.5}. Best is trial 881 with value: 0.35916990930150405.
[I 2024-12-04 20:32:19,529] Trial 1609 finished with value: 1.0624161167025068 and parameters: {'kernel_type': 'Matern', 'length_scale': 0.018566680350301283, 'noise_level': 0.4284936973783689, 'constant_value': 0.4659108656712664, 'nu': 0.5}. Best is trial 881 with value: 0.35916990930150405.
[I 2024-12-04 20:32:21,165] Trial 1610 finished with value: 0.35921126923005187 and parameters: {'kernel_type': 'Matern', 'length_scale': 10.823031911812256, 'noise_level': 0.0007407719931677251, 'constant_value': 37.143005271254076, 'nu': 0.5}. Best is trial 881 with value: 0.35916990930150405.
[I 2024-12-04 20:32:21,828] Trial 1611 finished with value: 0.35921125711490287 and parameters: {'kernel_type': 'Matern', 'length_scale': 98.13360836719085, 'noise_level': 0.017102711132571898, 'constant_value': 5.550671977183206, 'nu': 0.5}. Best is trial 881 with value: 0.35916990930150405.
[I 2024-12-04 20:32:25,925] Trial 1613 finished with value: 0.3592112653898467 and parameters: {'kernel_type': 'Matern', 'length_scale': 161.87574712272166, 'noise_level': 0.6250408910056794, 'constant_value': 322.92452615657123, 'nu': 0.5}. Best is trial 881 with value: 0.35916990930150405.
[I 2024-12-04 20:32:26,316] Trial 1612 finished with value: 0.35921136422464406 and parameters: {'kernel_type': 'Matern', 'length_scale': 7.286185407233373, 'noise_level': 0.008913650383694694, 'constant_value': 322.20031187037733, 'nu': 0.5}. Best is trial 881 with value: 0.35916990930150405.
[I 2024-12-04 20:32:28,316] Trial 1614 finished with value: 1.0624161175715894 and parameters: {'kernel_type': 'Matern', 'length_scale': 2141.552682542749, 'noise_level': 0.0005569324120004743, 'constant_value': 0.583731165488547, 'nu': 0.5}. Best is trial 881 with value: 0.35916990930150405.
[I 2024-12-04 20:32:32,231] Trial 1616 finished with value: 1.0624161172658515 and parameters: {'kernel_type': 'Matern', 'length_scale': 0.016115527273388604, 'noise_level': 0.8255202838459587, 'constant_value': 701.5103337420885, 'nu': 0.5}. Best is trial 881 with value: 0.35916990930150405.
[I 2024-12-04 20:32:33,715] Trial 1617 finished with value: 1.062416117253315 and parameters: {'kernel_type': 'Matern', 'length_scale': 1.2938436090030793e-05, 'noise_level': 1.0399381334047535e-05, 'constant_value': 0.00034452313773474793, 'nu': 1.5}. Best is trial 881 with value: 0.35916990930150405.
[I 2024-12-04 20:32:37,061] Trial 1615 finished with value: 1.0624161172487783 and parameters: {'kernel_type': 'Matern', 'length_scale': 599.8639446320117, 'noise_level': 0.001209591092243752, 'constant_value': 0.000846089208342811, 'nu': 2.5}. Best is trial 881 with value: 0.35916990930150405.
[I 2024-12-04 20:32:37,739] Trial 1619 finished with value: 0.35921145232885565 and parameters: {'kernel_type': 'Matern', 'length_scale': 29.940895034078252, 'noise_level': 0.01587130635647457, 'constant_value': 509.59164793246185, 'nu': 0.5}. Best is trial 881 with value: 0.35916990930150405.
[I 2024-12-04 20:32:39,929] Trial 1618 finished with value: 1.0624161189354255 and parameters: {'kernel_type': 'RBF', 'length_scale': 42111.23053254283, 'noise_level': 1.1897942487350742e-06, 'constant_value': 0.0048682125614462205, 'nu': 0.5}. Best is trial 881 with value: 0.35916990930150405.
[I 2024-12-04 20:32:40,766] Trial 1620 finished with value: 1.0624161167936093 and parameters: {'kernel_type': 'Matern', 'length_scale': 0.03555039436423268, 'noise_level': 0.015228402982658137, 'constant_value': 3.427684968942343, 'nu': 0.5}. Best is trial 881 with value: 0.35916990930150405.
[I 2024-12-04 20:32:43,443] Trial 1621 finished with value: 0.3592112717844325 and parameters: {'kernel_type': 'Matern', 'length_scale': 881.1556378060184, 'noise_level': 0.0001831791325970265, 'constant_value': 616.4807765424207, 'nu': 0.5}. Best is trial 881 with value: 0.35916990930150405.
[I 2024-12-04 20:32:43,624] Trial 1623 finished with value: 1.0916558493897184 and parameters: {'kernel_type': 'RBF', 'length_scale': 0.038111686489262435, 'noise_level': 1.6324894469453658e-10, 'constant_value': 114.67459627857325, 'nu': 1.5}. Best is trial 881 with value: 0.35916990930150405.
[I 2024-12-04 20:32:46,774] Trial 1622 finished with value: 0.42868351160767604 and parameters: {'kernel_type': 'RBF', 'length_scale': 6837.279810801567, 'noise_level': 0.3752004100926859, 'constant_value': 780.7904422555818, 'nu': 1.5}. Best is trial 881 with value: 0.35916990930150405.
[I 2024-12-04 20:32:48,146] Trial 1624 finished with value: 0.3592104665284049 and parameters: {'kernel_type': 'Matern', 'length_scale': 0.2798166670976172, 'noise_level': 0.0005895156548258361, 'constant_value': 1.8429715375562796, 'nu': 0.5}. Best is trial 881 with value: 0.35916990930150405.
[I 2024-12-04 20:32:48,235] Trial 1625 finished with value: 0.428683510180081 and parameters: {'kernel_type': 'RBF', 'length_scale': 6.949936337902488, 'noise_level': 0.0061447575790106726, 'constant_value': 2.821161296323027, 'nu': 0.5}. Best is trial 881 with value: 0.35916990930150405.
[I 2024-12-04 20:32:50,351] Trial 1627 finished with value: 1.09165670484921 and parameters: {'kernel_type': 'Matern', 'length_scale': 1788.6783607057848, 'noise_level': 0.006617251711674855, 'constant_value': 95889.4935901992, 'nu': 0.5}. Best is trial 881 with value: 0.35916990930150405.
[I 2024-12-04 20:32:51,322] Trial 1626 finished with value: 0.3592112614005518 and parameters: {'kernel_type': 'Matern', 'length_scale': 2.359467679863909, 'noise_level': 0.09543010634417105, 'constant_value': 511.8199126922901, 'nu': 0.5}. Best is trial 881 with value: 0.35916990930150405.
[I 2024-12-04 20:32:53,577] Trial 1628 finished with value: 0.3592112256324088 and parameters: {'kernel_type': 'Matern', 'length_scale': 72.86800104509956, 'noise_level': 0.008820164646469744, 'constant_value': 0.8478171672191275, 'nu': 0.5}. Best is trial 881 with value: 0.35916990930150405.
[I 2024-12-04 20:32:55,756] Trial 1629 finished with value: 0.3592121798145299 and parameters: {'kernel_type': 'Matern', 'length_scale': 0.4303875021837537, 'noise_level': 0.039302863460661766, 'constant_value': 2657.640669430821, 'nu': 0.5}. Best is trial 881 with value: 0.35916990930150405.
[I 2024-12-04 20:32:56,413] Trial 1630 finished with value: 1.0624161177846991 and parameters: {'kernel_type': 'RBF', 'length_scale': 0.0027021419757472125, 'noise_level': 2.9769854988101976e-10, 'constant_value': 0.02101023000929769, 'nu': 1.5}. Best is trial 881 with value: 0.35916990930150405.
[I 2024-12-04 20:32:58,658] Trial 1631 finished with value: 0.3592112513426781 and parameters: {'kernel_type': 'Matern', 'length_scale': 417.2666945958146, 'noise_level': 0.027453550528456157, 'constant_value': 262.18050897431254, 'nu': 0.5}. Best is trial 881 with value: 0.35916990930150405.
[I 2024-12-04 20:33:02,212] Trial 1632 finished with value: 0.4286835212329656 and parameters: {'kernel_type': 'RBF', 'length_scale': 698.7965497731975, 'noise_level': 0.1804959811378752, 'constant_value': 4326.1068307195965, 'nu': 2.5}. Best is trial 881 with value: 0.35916990930150405.
[I 2024-12-04 20:33:02,306] Trial 1633 finished with value: 0.35921122841006914 and parameters: {'kernel_type': 'Matern', 'length_scale': 0.44415347968216995, 'noise_level': 0.8146686343581206, 'constant_value': 1.005623292341312, 'nu': 0.5}. Best is trial 881 with value: 0.35916990930150405.
[I 2024-12-04 20:33:03,499] Trial 1634 finished with value: 0.3592111135128567 and parameters: {'kernel_type': 'Matern', 'length_scale': 88.05706936665125, 'noise_level': 0.053161612829984835, 'constant_value': 36.067974399358796, 'nu': 0.5}. Best is trial 881 with value: 0.35916990930150405.
[I 2024-12-04 20:33:07,562] Trial 1635 finished with value: 0.3592106572294734 and parameters: {'kernel_type': 'Matern', 'length_scale': 0.6139948034348441, 'noise_level': 0.6940492150404763, 'constant_value': 103.8165014601941, 'nu': 0.5}. Best is trial 881 with value: 0.35916990930150405.
[I 2024-12-04 20:33:09,159] Trial 1637 finished with value: 0.3592112497063017 and parameters: {'kernel_type': 'Matern', 'length_scale': 1.983282216368426, 'noise_level': 0.3751285381614036, 'constant_value': 84277.60190048332, 'nu': 0.5}. Best is trial 881 with value: 0.35916990930150405.
[I 2024-12-04 20:33:09,456] Trial 1636 finished with value: 0.3592113412676097 and parameters: {'kernel_type': 'Matern', 'length_scale': 9.517441688636087, 'noise_level': 0.010265595463949576, 'constant_value': 2225.2280861885665, 'nu': 0.5}. Best is trial 881 with value: 0.35916990930150405.
[I 2024-12-04 20:33:12,648] Trial 1638 finished with value: 0.35921124737307564 and parameters: {'kernel_type': 'Matern', 'length_scale': 22.807650194186966, 'noise_level': 0.025902359488175788, 'constant_value': 1.0688986155608038, 'nu': 0.5}. Best is trial 881 with value: 0.35916990930150405.
[I 2024-12-04 20:33:13,501] Trial 1640 finished with value: 1.0624161172724182 and parameters: {'kernel_type': 'Matern', 'length_scale': 0.0364820917922575, 'noise_level': 0.001598890484306666, 'constant_value': 1612.625935635605, 'nu': 0.5}. Best is trial 881 with value: 0.35916990930150405.
[I 2024-12-04 20:33:14,278] Trial 1639 finished with value: 0.35921144544376044 and parameters: {'kernel_type': 'Matern', 'length_scale': 529.7772382649006, 'noise_level': 0.004415200921368746, 'constant_value': 6.760784786649301, 'nu': 0.5}. Best is trial 881 with value: 0.35916990930150405.
[I 2024-12-04 20:33:16,383] Trial 1641 finished with value: 1.0916558493885993 and parameters: {'kernel_type': 'Matern', 'length_scale': 0.03363358150367556, 'noise_level': 2.535730510183337e-05, 'constant_value': 6.239861826945402, 'nu': 0.5}. Best is trial 881 with value: 0.35916990930150405.
[I 2024-12-04 20:33:18,114] Trial 1643 finished with value: 1.0624161172995743 and parameters: {'kernel_type': 'RBF', 'length_scale': 0.0038140432421232833, 'noise_level': 8.805680329310619e-09, 'constant_value': 0.013573655720457664, 'nu': 2.5}. Best is trial 881 with value: 0.35916990930150405.
[I 2024-12-04 20:33:19,197] Trial 1642 finished with value: 0.3592114234157459 and parameters: {'kernel_type': 'Matern', 'length_scale': 4195.911341599672, 'noise_level': 0.0006505182160030727, 'constant_value': 630.7685796809589, 'nu': 0.5}. Best is trial 881 with value: 0.35916990930150405.
[I 2024-12-04 20:33:21,399] Trial 1644 finished with value: 0.35921109438012405 and parameters: {'kernel_type': 'Matern', 'length_scale': 0.7694179272161448, 'noise_level': 0.013856199955238508, 'constant_value': 4.552619576804708, 'nu': 0.5}. Best is trial 881 with value: 0.35916990930150405.
[I 2024-12-04 20:33:22,347] Trial 1645 finished with value: 1.0624161172766868 and parameters: {'kernel_type': 'RBF', 'length_scale': 0.0021789156371239187, 'noise_level': 0.00032322705548657306, 'constant_value': 931.9090601830267, 'nu': 2.5}. Best is trial 881 with value: 0.35916990930150405.
[I 2024-12-04 20:33:25,148] Trial 1646 finished with value: 0.41956600863519206 and parameters: {'kernel_type': 'Matern', 'length_scale': 0.6232098406100643, 'noise_level': 4.8701253530992695e-05, 'constant_value': 6.213276697650653, 'nu': 2.5}. Best is trial 881 with value: 0.35916990930150405.
[I 2024-12-04 20:33:26,299] Trial 1647 finished with value: 0.35921109220375064 and parameters: {'kernel_type': 'Matern', 'length_scale': 13.439646375262301, 'noise_level': 0.9267348286589947, 'constant_value': 122.77764365337974, 'nu': 0.5}. Best is trial 881 with value: 0.35916990930150405.
[I 2024-12-04 20:33:28,122] Trial 1648 finished with value: 0.4195660061769693 and parameters: {'kernel_type': 'Matern', 'length_scale': 6.290483472564517, 'noise_level': 0.8810016995775178, 'constant_value': 17790.10897360282, 'nu': 2.5}. Best is trial 881 with value: 0.35916990930150405.
[I 2024-12-04 20:33:30,732] Trial 1649 finished with value: 0.35921124090649453 and parameters: {'kernel_type': 'Matern', 'length_scale': 3886.603643691491, 'noise_level': 0.06507910081745844, 'constant_value': 1739.5435126645282, 'nu': 0.5}. Best is trial 881 with value: 0.35916990930150405.
[I 2024-12-04 20:33:33,096] Trial 1651 finished with value: 0.35921124262745935 and parameters: {'kernel_type': 'Matern', 'length_scale': 19.59674497077914, 'noise_level': 0.003990904288026202, 'constant_value': 3716.2025744069074, 'nu': 0.5}. Best is trial 881 with value: 0.35916990930150405.
[I 2024-12-04 20:33:34,433] Trial 1650 finished with value: 0.3592113339858046 and parameters: {'kernel_type': 'Matern', 'length_scale': 7.05797588722535, 'noise_level': 0.00854564331177483, 'constant_value': 0.060388605377807915, 'nu': 0.5}. Best is trial 881 with value: 0.35916990930150405.
[I 2024-12-04 20:33:35,454] Trial 1652 finished with value: 0.42868353990260927 and parameters: {'kernel_type': 'RBF', 'length_scale': 0.5173321745377184, 'noise_level': 0.045288035643183386, 'constant_value': 673.1877559585182, 'nu': 0.5}. Best is trial 881 with value: 0.35916990930150405.
[I 2024-12-04 20:33:36,503] Trial 1653 finished with value: 1.0916558938423193 and parameters: {'kernel_type': 'Matern', 'length_scale': 0.5843584957208373, 'noise_level': 3.378352564515466e-05, 'constant_value': 1208.7817331347871, 'nu': 0.5}. Best is trial 881 with value: 0.35916990930150405.
[I 2024-12-04 20:33:39,455] Trial 1654 finished with value: 0.35921059997181615 and parameters: {'kernel_type': 'Matern', 'length_scale': 2.0392564502105603, 'noise_level': 0.030159936242863793, 'constant_value': 923.383800188377, 'nu': 0.5}. Best is trial 881 with value: 0.35916990930150405.
[I 2024-12-04 20:33:41,557] Trial 1656 finished with value: 0.3592112451362076 and parameters: {'kernel_type': 'Matern', 'length_scale': 3.1348970288582114, 'noise_level': 0.0009265806656980371, 'constant_value': 3.422053596635962, 'nu': 0.5}. Best is trial 881 with value: 0.35916990930150405.
[I 2024-12-04 20:33:44,553] Trial 1657 finished with value: 0.35921123912938063 and parameters: {'kernel_type': 'Matern', 'length_scale': 44.47667829012718, 'noise_level': 0.0003607650431062367, 'constant_value': 1137.8329095090742, 'nu': 0.5}. Best is trial 881 with value: 0.35916990930150405.
[I 2024-12-04 20:33:46,462] Trial 1658 finished with value: 0.35921119548611313 and parameters: {'kernel_type': 'Matern', 'length_scale': 81.24247385684333, 'noise_level': 0.0262331453734764, 'constant_value': 299.4267448422071, 'nu': 0.5}. Best is trial 881 with value: 0.35916990930150405.
[I 2024-12-04 20:33:46,528] Trial 1655 finished with value: 0.36110070047884557 and parameters: {'kernel_type': 'Matern', 'length_scale': 0.06795764144049016, 'noise_level': 0.07702344405746663, 'constant_value': 0.0005198321631057829, 'nu': 0.5}. Best is trial 881 with value: 0.35916990930150405.
[I 2024-12-04 20:33:49,133] Trial 1659 finished with value: 0.3592108760923901 and parameters: {'kernel_type': 'Matern', 'length_scale': 39.31276912120701, 'noise_level': 0.08825813631951972, 'constant_value': 4.104592231599233, 'nu': 0.5}. Best is trial 881 with value: 0.35916990930150405.
[I 2024-12-04 20:33:51,918] Trial 1660 finished with value: 0.3592113157196732 and parameters: {'kernel_type': 'Matern', 'length_scale': 79.86417175298601, 'noise_level': 0.6303231277586611, 'constant_value': 1491.5423025975797, 'nu': 0.5}. Best is trial 881 with value: 0.35916990930150405.
[I 2024-12-04 20:33:52,236] Trial 1662 finished with value: 1.0916558332576638 and parameters: {'kernel_type': 'Matern', 'length_scale': 0.15802090743192518, 'noise_level': 0.0059221160031312815, 'constant_value': 5686.19183519617, 'nu': 0.5}. Best is trial 881 with value: 0.35916990930150405.
[I 2024-12-04 20:33:53,034] Trial 1661 finished with value: 0.35921124487723255 and parameters: {'kernel_type': 'Matern', 'length_scale': 0.6819869929739881, 'noise_level': 0.017965678882229642, 'constant_value': 0.011264953039904388, 'nu': 0.5}. Best is trial 881 with value: 0.35916990930150405.
[I 2024-12-04 20:33:56,663] Trial 1663 finished with value: 0.3592112394484 and parameters: {'kernel_type': 'Matern', 'length_scale': 0.47529447531032326, 'noise_level': 0.0652433652498833, 'constant_value': 125.14820161774195, 'nu': 0.5}. Best is trial 881 with value: 0.35916990930150405.
[I 2024-12-04 20:33:57,960] Trial 1664 finished with value: 0.3592112380534027 and parameters: {'kernel_type': 'Matern', 'length_scale': 4101.046079934123, 'noise_level': 0.0011894676363943468, 'constant_value': 84892.5816358188, 'nu': 0.5}. Best is trial 881 with value: 0.35916990930150405.
[I 2024-12-04 20:33:58,748] Trial 1665 finished with value: 0.35921123893993695 and parameters: {'kernel_type': 'Matern', 'length_scale': 65.64935498706141, 'noise_level': 0.021614895883952833, 'constant_value': 43204.946127604315, 'nu': 0.5}. Best is trial 881 with value: 0.35916990930150405.
[I 2024-12-04 20:34:01,847] Trial 1666 finished with value: 0.35921123802715343 and parameters: {'kernel_type': 'Matern', 'length_scale': 226.85500062642936, 'noise_level': 0.00023952478528319128, 'constant_value': 2.6112349317811225, 'nu': 0.5}. Best is trial 881 with value: 0.35916990930150405.
[I 2024-12-04 20:34:03,619] Trial 1667 finished with value: 0.3592095482691452 and parameters: {'kernel_type': 'Matern', 'length_scale': 25.16163470842307, 'noise_level': 0.7818546170038015, 'constant_value': 224.43106940431028, 'nu': 0.5}. Best is trial 881 with value: 0.35916990930150405.
[I 2024-12-04 20:34:03,986] Trial 1668 finished with value: 0.35921058080040874 and parameters: {'kernel_type': 'Matern', 'length_scale': 0.38517884004165953, 'noise_level': 0.5665404978886454, 'constant_value': 2348.4515032120885, 'nu': 0.5}. Best is trial 881 with value: 0.35916990930150405.
[I 2024-12-04 20:34:06,456] Trial 1669 finished with value: 0.3592110168124115 and parameters: {'kernel_type': 'Matern', 'length_scale': 726.1094936989077, 'noise_level': 0.003766390484207827, 'constant_value': 40.73074291046766, 'nu': 0.5}. Best is trial 881 with value: 0.35916990930150405.
[I 2024-12-04 20:34:08,673] Trial 1671 finished with value: 0.35921197541865235 and parameters: {'kernel_type': 'Matern', 'length_scale': 105.17325555067741, 'noise_level': 0.34907331358055393, 'constant_value': 20.411931664911982, 'nu': 0.5}. Best is trial 881 with value: 0.35916990930150405.
