[I 2024-12-04 15:09:21,449] Trial 926 finished with value: 0.42371300083174995 and parameters: {'n_estimators': 829, 'max_depth': 37, 'min_samples_split': 3, 'min_samples_leaf': 1, 'max_features': None, 'bootstrap': True, 'criterion': 'squared_error'}. Best is trial 590 with value: 0.4185444504443197.
[I 2024-12-04 15:09:28,867] Trial 952 finished with value: 0.9034843142452763 and parameters: {'n_estimators': 261, 'max_depth': 46, 'min_samples_split': 24, 'min_samples_leaf': 2, 'max_features': 'log2', 'bootstrap': False, 'criterion': 'squared_error'}. Best is trial 590 with value: 0.4185444504443197.
[I 2024-12-04 15:09:32,562] Trial 939 finished with value: 0.4205793877073589 and parameters: {'n_estimators': 950, 'max_depth': 44, 'min_samples_split': 2, 'min_samples_leaf': 1, 'max_features': None, 'bootstrap': True, 'criterion': 'squared_error'}. Best is trial 590 with value: 0.4185444504443197.
[I 2024-12-04 15:09:33,251] Trial 943 finished with value: 0.4193492390665042 and parameters: {'n_estimators': 920, 'max_depth': 40, 'min_samples_split': 2, 'min_samples_leaf': 1, 'max_features': None, 'bootstrap': True, 'criterion': 'squared_error'}. Best is trial 590 with value: 0.4185444504443197.
[I 2024-12-04 15:09:35,297] Trial 936 finished with value: 0.4206231597995061 and parameters: {'n_estimators': 980, 'max_depth': 42, 'min_samples_split': 2, 'min_samples_leaf': 1, 'max_features': None, 'bootstrap': True, 'criterion': 'squared_error'}. Best is trial 590 with value: 0.4185444504443197.
[I 2024-12-04 15:09:35,585] Trial 941 finished with value: 0.420210793602837 and parameters: {'n_estimators': 881, 'max_depth': 38, 'min_samples_split': 2, 'min_samples_leaf': 1, 'max_features': None, 'bootstrap': True, 'criterion': 'squared_error'}. Best is trial 590 with value: 0.4185444504443197.
[I 2024-12-04 15:09:39,249] Trial 945 finished with value: 0.4210643972679978 and parameters: {'n_estimators': 878, 'max_depth': 35, 'min_samples_split': 2, 'min_samples_leaf': 1, 'max_features': None, 'bootstrap': True, 'criterion': 'squared_error'}. Best is trial 590 with value: 0.4185444504443197.
[I 2024-12-04 15:09:43,326] Trial 942 finished with value: 0.4194981730029092 and parameters: {'n_estimators': 850, 'max_depth': 39, 'min_samples_split': 2, 'min_samples_leaf': 1, 'max_features': None, 'bootstrap': True, 'criterion': 'squared_error'}. Best is trial 590 with value: 0.4185444504443197.
[I 2024-12-04 15:09:43,339] Trial 947 finished with value: 0.4653223257929724 and parameters: {'n_estimators': 827, 'max_depth': 43, 'min_samples_split': 2, 'min_samples_leaf': 2, 'max_features': None, 'bootstrap': True, 'criterion': 'squared_error'}. Best is trial 590 with value: 0.4185444504443197.
[I 2024-12-04 15:09:45,429] Trial 944 finished with value: 0.435259611231088 and parameters: {'n_estimators': 970, 'max_depth': 26, 'min_samples_split': 4, 'min_samples_leaf': 1, 'max_features': None, 'bootstrap': True, 'criterion': 'squared_error'}. Best is trial 590 with value: 0.4185444504443197.
[I 2024-12-04 15:09:46,125] Trial 949 finished with value: 0.4314947314135436 and parameters: {'n_estimators': 863, 'max_depth': 42, 'min_samples_split': 4, 'min_samples_leaf': 1, 'max_features': None, 'bootstrap': True, 'criterion': 'squared_error'}. Best is trial 590 with value: 0.4185444504443197.
[I 2024-12-04 15:09:49,614] Trial 948 finished with value: 0.4242015295045809 and parameters: {'n_estimators': 991, 'max_depth': 36, 'min_samples_split': 3, 'min_samples_leaf': 1, 'max_features': None, 'bootstrap': True, 'criterion': 'squared_error'}. Best is trial 590 with value: 0.4185444504443197.
[I 2024-12-04 15:09:52,604] Trial 955 finished with value: 0.4214992191126046 and parameters: {'n_estimators': 805, 'max_depth': 42, 'min_samples_split': 2, 'min_samples_leaf': 1, 'max_features': None, 'bootstrap': True, 'criterion': 'squared_error'}. Best is trial 590 with value: 0.4185444504443197.
[I 2024-12-04 15:09:54,558] Trial 956 finished with value: 0.4188398890260366 and parameters: {'n_estimators': 842, 'max_depth': 40, 'min_samples_split': 2, 'min_samples_leaf': 1, 'max_features': None, 'bootstrap': True, 'criterion': 'squared_error'}. Best is trial 590 with value: 0.4185444504443197.
[I 2024-12-04 15:09:54,649] Trial 959 finished with value: 0.6276942173755767 and parameters: {'n_estimators': 828, 'max_depth': 41, 'min_samples_split': 2, 'min_samples_leaf': 1, 'max_features': 'log2', 'bootstrap': True, 'criterion': 'squared_error'}. Best is trial 590 with value: 0.4185444504443197.
[I 2024-12-04 15:09:58,984] Trial 957 finished with value: 0.46526879558448764 and parameters: {'n_estimators': 999, 'max_depth': 43, 'min_samples_split': 4, 'min_samples_leaf': 2, 'max_features': None, 'bootstrap': True, 'criterion': 'squared_error'}. Best is trial 590 with value: 0.4185444504443197.
[I 2024-12-04 15:09:59,030] Trial 951 finished with value: 0.42126635918756755 and parameters: {'n_estimators': 747, 'max_depth': 33, 'min_samples_split': 2, 'min_samples_leaf': 1, 'max_features': None, 'bootstrap': True, 'criterion': 'squared_error'}. Best is trial 590 with value: 0.4185444504443197.
[I 2024-12-04 15:09:59,032] Trial 954 finished with value: 0.4200346083573864 and parameters: {'n_estimators': 812, 'max_depth': 38, 'min_samples_split': 2, 'min_samples_leaf': 1, 'max_features': None, 'bootstrap': True, 'criterion': 'squared_error'}. Best is trial 590 with value: 0.4185444504443197.
[I 2024-12-04 15:10:02,095] Trial 961 finished with value: 0.4648475050526285 and parameters: {'n_estimators': 683, 'max_depth': 39, 'min_samples_split': 4, 'min_samples_leaf': 2, 'max_features': None, 'bootstrap': True, 'criterion': 'squared_error'}. Best is trial 590 with value: 0.4185444504443197.
[I 2024-12-04 15:10:02,861] Trial 960 finished with value: 0.46510126685230824 and parameters: {'n_estimators': 763, 'max_depth': 38, 'min_samples_split': 3, 'min_samples_leaf': 2, 'max_features': None, 'bootstrap': True, 'criterion': 'squared_error'}. Best is trial 590 with value: 0.4185444504443197.
[I 2024-12-04 15:10:03,194] Trial 958 finished with value: 0.4317723431542937 and parameters: {'n_estimators': 793, 'max_depth': 49, 'min_samples_split': 4, 'min_samples_leaf': 1, 'max_features': None, 'bootstrap': True, 'criterion': 'squared_error'}. Best is trial 590 with value: 0.4185444504443197.
[I 2024-12-04 15:10:03,863] Trial 953 finished with value: 0.46531449170754197 and parameters: {'n_estimators': 997, 'max_depth': 40, 'min_samples_split': 3, 'min_samples_leaf': 2, 'max_features': None, 'bootstrap': True, 'criterion': 'squared_error'}. Best is trial 590 with value: 0.4185444504443197.
[I 2024-12-04 15:10:06,696] Trial 950 finished with value: 0.42216232997008424 and parameters: {'n_estimators': 820, 'max_depth': 49, 'min_samples_split': 2, 'min_samples_leaf': 1, 'max_features': None, 'bootstrap': True, 'criterion': 'squared_error'}. Best is trial 590 with value: 0.4185444504443197.
[I 2024-12-04 15:10:07,177] Trial 962 finished with value: 0.465394916150425 and parameters: {'n_estimators': 986, 'max_depth': 31, 'min_samples_split': 2, 'min_samples_leaf': 2, 'max_features': None, 'bootstrap': True, 'criterion': 'squared_error'}. Best is trial 590 with value: 0.4185444504443197.
[I 2024-12-04 15:10:07,604] Trial 916 finished with value: 0.42815718436745687 and parameters: {'n_estimators': 807, 'max_depth': 46, 'min_samples_split': 2, 'min_samples_leaf': 1, 'max_features': None, 'bootstrap': True, 'criterion': 'absolute_error'}. Best is trial 590 with value: 0.4185444504443197.
[I 2024-12-04 15:10:07,783] Trial 908 finished with value: 0.4394933473901228 and parameters: {'n_estimators': 981, 'max_depth': 28, 'min_samples_split': 2, 'min_samples_leaf': 1, 'max_features': None, 'bootstrap': True, 'criterion': 'absolute_error'}. Best is trial 590 with value: 0.4185444504443197.
[I 2024-12-04 15:10:11,302] Trial 964 finished with value: 0.42159603380101845 and parameters: {'n_estimators': 818, 'max_depth': 42, 'min_samples_split': 2, 'min_samples_leaf': 1, 'max_features': None, 'bootstrap': True, 'criterion': 'squared_error'}. Best is trial 590 with value: 0.4185444504443197.
[I 2024-12-04 15:10:11,809] Trial 972 finished with value: 0.8934826139715225 and parameters: {'n_estimators': 706, 'max_depth': 33, 'min_samples_split': 2, 'min_samples_leaf': 2, 'max_features': 'log2', 'bootstrap': False, 'criterion': 'squared_error'}. Best is trial 590 with value: 0.4185444504443197.
[I 2024-12-04 15:10:12,791] Trial 968 finished with value: 0.4237304823774108 and parameters: {'n_estimators': 713, 'max_depth': 37, 'min_samples_split': 3, 'min_samples_leaf': 1, 'max_features': None, 'bootstrap': True, 'criterion': 'squared_error'}. Best is trial 590 with value: 0.4185444504443197.
[I 2024-12-04 15:10:16,128] Trial 966 finished with value: 0.42490168726543276 and parameters: {'n_estimators': 735, 'max_depth': 36, 'min_samples_split': 3, 'min_samples_leaf': 1, 'max_features': None, 'bootstrap': True, 'criterion': 'squared_error'}. Best is trial 590 with value: 0.4185444504443197.
[I 2024-12-04 15:10:16,491] Trial 975 finished with value: 0.8597189402647568 and parameters: {'n_estimators': 613, 'max_depth': 18, 'min_samples_split': 10, 'min_samples_leaf': 1, 'max_features': 'log2', 'bootstrap': False, 'criterion': 'absolute_error'}. Best is trial 590 with value: 0.4185444504443197.
[I 2024-12-04 15:10:16,528] Trial 965 finished with value: 0.42091530325514964 and parameters: {'n_estimators': 990, 'max_depth': 35, 'min_samples_split': 2, 'min_samples_leaf': 1, 'max_features': None, 'bootstrap': True, 'criterion': 'squared_error'}. Best is trial 590 with value: 0.4185444504443197.
[I 2024-12-04 15:10:16,941] Trial 969 finished with value: 0.46555887292772846 and parameters: {'n_estimators': 785, 'max_depth': 35, 'min_samples_split': 2, 'min_samples_leaf': 2, 'max_features': None, 'bootstrap': True, 'criterion': 'squared_error'}. Best is trial 590 with value: 0.4185444504443197.
[I 2024-12-04 15:10:17,098] Trial 963 finished with value: 0.4211263311432269 and parameters: {'n_estimators': 878, 'max_depth': 42, 'min_samples_split': 2, 'min_samples_leaf': 1, 'max_features': None, 'bootstrap': True, 'criterion': 'squared_error'}. Best is trial 590 with value: 0.4185444504443197.
[I 2024-12-04 15:10:24,505] Trial 967 finished with value: 0.41884946971283493 and parameters: {'n_estimators': 750, 'max_depth': 40, 'min_samples_split': 2, 'min_samples_leaf': 1, 'max_features': None, 'bootstrap': True, 'criterion': 'squared_error'}. Best is trial 590 with value: 0.4185444504443197.
[I 2024-12-04 15:10:29,083] Trial 940 finished with value: 0.4348834024471903 and parameters: {'n_estimators': 739, 'max_depth': 45, 'min_samples_split': 5, 'min_samples_leaf': 1, 'max_features': None, 'bootstrap': True, 'criterion': 'absolute_error'}. Best is trial 590 with value: 0.4185444504443197.
[I 2024-12-04 15:10:29,843] Trial 974 finished with value: 0.4234670915163893 and parameters: {'n_estimators': 829, 'max_depth': 40, 'min_samples_split': 3, 'min_samples_leaf': 1, 'max_features': None, 'bootstrap': True, 'criterion': 'squared_error'}. Best is trial 590 with value: 0.4185444504443197.
[I 2024-12-04 15:10:31,238] Trial 986 finished with value: 0.9707450006721763 and parameters: {'n_estimators': 757, 'max_depth': 8, 'min_samples_split': 6, 'min_samples_leaf': 1, 'max_features': 'log2', 'bootstrap': False, 'criterion': 'squared_error'}. Best is trial 590 with value: 0.4185444504443197.
[I 2024-12-04 15:10:32,386] Trial 973 finished with value: 0.46540311625302416 and parameters: {'n_estimators': 822, 'max_depth': 42, 'min_samples_split': 2, 'min_samples_leaf': 2, 'max_features': None, 'bootstrap': True, 'criterion': 'squared_error'}. Best is trial 590 with value: 0.4185444504443197.
[I 2024-12-04 15:10:33,261] Trial 970 finished with value: 0.42101274451320103 and parameters: {'n_estimators': 970, 'max_depth': 37, 'min_samples_split': 2, 'min_samples_leaf': 1, 'max_features': None, 'bootstrap': True, 'criterion': 'squared_error'}. Best is trial 590 with value: 0.4185444504443197.
[I 2024-12-04 15:10:33,327] Trial 985 finished with value: 0.686350343593168 and parameters: {'n_estimators': 225, 'max_depth': 24, 'min_samples_split': 14, 'min_samples_leaf': 5, 'max_features': None, 'bootstrap': False, 'criterion': 'absolute_error'}. Best is trial 590 with value: 0.4185444504443197.
[I 2024-12-04 15:10:34,634] Trial 984 finished with value: 0.5383969922522978 and parameters: {'n_estimators': 740, 'max_depth': 45, 'min_samples_split': 8, 'min_samples_leaf': 1, 'max_features': 'sqrt', 'bootstrap': True, 'criterion': 'squared_error'}. Best is trial 590 with value: 0.4185444504443197.
[I 2024-12-04 15:10:36,021] Trial 971 finished with value: 0.42427674701406765 and parameters: {'n_estimators': 944, 'max_depth': 44, 'min_samples_split': 3, 'min_samples_leaf': 1, 'max_features': None, 'bootstrap': True, 'criterion': 'squared_error'}. Best is trial 590 with value: 0.4185444504443197.
[I 2024-12-04 15:10:36,149] Trial 981 finished with value: 0.5113776150067206 and parameters: {'n_estimators': 815, 'max_depth': 29, 'min_samples_split': 4, 'min_samples_leaf': 1, 'max_features': None, 'bootstrap': False, 'criterion': 'squared_error'}. Best is trial 590 with value: 0.4185444504443197.
[I 2024-12-04 15:10:37,087] Trial 989 finished with value: 0.6850420516257875 and parameters: {'n_estimators': 447, 'max_depth': 20, 'min_samples_split': 26, 'min_samples_leaf': 12, 'max_features': None, 'bootstrap': True, 'criterion': 'squared_error'}. Best is trial 590 with value: 0.4185444504443197.
[I 2024-12-04 15:10:37,129] Trial 979 finished with value: 0.42100868660174656 and parameters: {'n_estimators': 811, 'max_depth': 33, 'min_samples_split': 2, 'min_samples_leaf': 1, 'max_features': None, 'bootstrap': True, 'criterion': 'squared_error'}. Best is trial 590 with value: 0.4185444504443197.
[I 2024-12-04 15:10:38,620] Trial 980 finished with value: 0.4213944257716545 and parameters: {'n_estimators': 858, 'max_depth': 46, 'min_samples_split': 2, 'min_samples_leaf': 1, 'max_features': None, 'bootstrap': True, 'criterion': 'squared_error'}. Best is trial 590 with value: 0.4185444504443197.
[I 2024-12-04 15:10:39,140] Trial 977 finished with value: 0.4206565144984661 and parameters: {'n_estimators': 995, 'max_depth': 37, 'min_samples_split': 2, 'min_samples_leaf': 1, 'max_features': None, 'bootstrap': True, 'criterion': 'squared_error'}. Best is trial 590 with value: 0.4185444504443197.
[I 2024-12-04 15:10:40,158] Trial 978 finished with value: 0.4206083070925293 and parameters: {'n_estimators': 953, 'max_depth': 44, 'min_samples_split': 2, 'min_samples_leaf': 1, 'max_features': None, 'bootstrap': True, 'criterion': 'squared_error'}. Best is trial 590 with value: 0.4185444504443197.
[I 2024-12-04 15:10:40,779] Trial 983 finished with value: 0.42101252708930464 and parameters: {'n_estimators': 813, 'max_depth': 33, 'min_samples_split': 2, 'min_samples_leaf': 1, 'max_features': None, 'bootstrap': True, 'criterion': 'squared_error'}. Best is trial 590 with value: 0.4185444504443197.
[I 2024-12-04 15:10:41,762] Trial 988 finished with value: 0.4197516556705113 and parameters: {'n_estimators': 703, 'max_depth': 39, 'min_samples_split': 2, 'min_samples_leaf': 1, 'max_features': None, 'bootstrap': True, 'criterion': 'squared_error'}. Best is trial 590 with value: 0.4185444504443197.
[I 2024-12-04 15:10:41,838] Trial 982 finished with value: 0.4209993445313289 and parameters: {'n_estimators': 621, 'max_depth': 37, 'min_samples_split': 2, 'min_samples_leaf': 1, 'max_features': None, 'bootstrap': True, 'criterion': 'squared_error'}. Best is trial 590 with value: 0.4185444504443197.
[I 2024-12-04 15:10:42,328] Trial 993 finished with value: 0.5241567853662016 and parameters: {'n_estimators': 548, 'max_depth': 36, 'min_samples_split': 2, 'min_samples_leaf': 1, 'max_features': 'sqrt', 'bootstrap': True, 'criterion': 'squared_error'}. Best is trial 590 with value: 0.4185444504443197.
[I 2024-12-04 15:10:42,677] Trial 987 finished with value: 0.4647180882289542 and parameters: {'n_estimators': 638, 'max_depth': 47, 'min_samples_split': 2, 'min_samples_leaf': 2, 'max_features': None, 'bootstrap': True, 'criterion': 'squared_error'}. Best is trial 590 with value: 0.4185444504443197.
[I 2024-12-04 15:10:43,364] Trial 992 finished with value: 0.4664515446876035 and parameters: {'n_estimators': 536, 'max_depth': 49, 'min_samples_split': 2, 'min_samples_leaf': 2, 'max_features': None, 'bootstrap': True, 'criterion': 'squared_error'}. Best is trial 590 with value: 0.4185444504443197.
[I 2024-12-04 15:10:43,443] Trial 1002 finished with value: 0.9936165217754392 and parameters: {'n_estimators': 148, 'max_depth': 23, 'min_samples_split': 19, 'min_samples_leaf': 12, 'max_features': 'sqrt', 'bootstrap': False, 'criterion': 'absolute_error'}. Best is trial 590 with value: 0.4185444504443197.
[I 2024-12-04 15:10:44,140] Trial 991 finished with value: 0.43358256210793744 and parameters: {'n_estimators': 503, 'max_depth': 48, 'min_samples_split': 4, 'min_samples_leaf': 1, 'max_features': None, 'bootstrap': True, 'criterion': 'squared_error'}. Best is trial 590 with value: 0.4185444504443197.
[I 2024-12-04 15:10:44,357] Trial 1000 finished with value: 0.7989418086415366 and parameters: {'n_estimators': 427, 'max_depth': 21, 'min_samples_split': 5, 'min_samples_leaf': 1, 'max_features': 'log2', 'bootstrap': True, 'criterion': 'squared_error'}. Best is trial 590 with value: 0.4185444504443197.
[I 2024-12-04 15:10:44,375] Trial 990 finished with value: 0.4643346738878059 and parameters: {'n_estimators': 714, 'max_depth': 43, 'min_samples_split': 2, 'min_samples_leaf': 2, 'max_features': None, 'bootstrap': True, 'criterion': 'squared_error'}. Best is trial 590 with value: 0.4185444504443197.
[I 2024-12-04 15:10:45,502] Trial 994 finished with value: 0.6512925476767241 and parameters: {'n_estimators': 235, 'max_depth': 34, 'min_samples_split': 31, 'min_samples_leaf': 1, 'max_features': 'sqrt', 'bootstrap': True, 'criterion': 'absolute_error'}. Best is trial 590 with value: 0.4185444504443197.
[I 2024-12-04 15:10:49,097] Trial 996 finished with value: 0.42166914938480093 and parameters: {'n_estimators': 614, 'max_depth': 42, 'min_samples_split': 2, 'min_samples_leaf': 1, 'max_features': None, 'bootstrap': True, 'criterion': 'squared_error'}. Best is trial 590 with value: 0.4185444504443197.
[I 2024-12-04 15:10:53,873] Trial 995 finished with value: 0.8089551437591725 and parameters: {'n_estimators': 882, 'max_depth': 32, 'min_samples_split': 13, 'min_samples_leaf': 4, 'max_features': 'sqrt', 'bootstrap': False, 'criterion': 'absolute_error'}. Best is trial 590 with value: 0.4185444504443197.
[I 2024-12-04 15:10:53,906] Trial 998 finished with value: 0.4313688256441416 and parameters: {'n_estimators': 727, 'max_depth': 40, 'min_samples_split': 4, 'min_samples_leaf': 1, 'max_features': None, 'bootstrap': True, 'criterion': 'squared_error'}. Best is trial 590 with value: 0.4185444504443197.
[I 2024-12-04 15:10:54,628] Trial 997 finished with value: 0.4348420226472851 and parameters: {'n_estimators': 718, 'max_depth': 26, 'min_samples_split': 4, 'min_samples_leaf': 1, 'max_features': None, 'bootstrap': True, 'criterion': 'squared_error'}. Best is trial 590 with value: 0.4185444504443197.
[I 2024-12-04 15:10:55,430] Trial 1004 finished with value: 0.9579930563119973 and parameters: {'n_estimators': 833, 'max_depth': 33, 'min_samples_split': 2, 'min_samples_leaf': 2, 'max_features': 'log2', 'bootstrap': True, 'criterion': 'squared_error'}. Best is trial 590 with value: 0.4185444504443197.
[I 2024-12-04 15:11:01,079] Trial 999 finished with value: 0.42260714847819236 and parameters: {'n_estimators': 697, 'max_depth': 45, 'min_samples_split': 2, 'min_samples_leaf': 1, 'max_features': None, 'bootstrap': True, 'criterion': 'squared_error'}. Best is trial 590 with value: 0.4185444504443197.
[I 2024-12-04 15:11:02,628] Trial 1001 finished with value: 0.4206314668359255 and parameters: {'n_estimators': 768, 'max_depth': 43, 'min_samples_split': 2, 'min_samples_leaf': 1, 'max_features': None, 'bootstrap': True, 'criterion': 'squared_error'}. Best is trial 590 with value: 0.4185444504443197.
[I 2024-12-04 15:11:03,879] Trial 1006 finished with value: 0.42451393763004824 and parameters: {'n_estimators': 654, 'max_depth': 40, 'min_samples_split': 3, 'min_samples_leaf': 1, 'max_features': None, 'bootstrap': True, 'criterion': 'squared_error'}. Best is trial 590 with value: 0.4185444504443197.
[I 2024-12-04 15:11:05,752] Trial 1012 finished with value: 0.8850275176281511 and parameters: {'n_estimators': 199, 'max_depth': 23, 'min_samples_split': 14, 'min_samples_leaf': 4, 'max_features': 'sqrt', 'bootstrap': True, 'criterion': 'squared_error'}. Best is trial 590 with value: 0.4185444504443197.
[I 2024-12-04 15:11:06,482] Trial 1010 finished with value: 0.422918751400539 and parameters: {'n_estimators': 679, 'max_depth': 35, 'min_samples_split': 2, 'min_samples_leaf': 1, 'max_features': None, 'bootstrap': True, 'criterion': 'squared_error'}. Best is trial 590 with value: 0.4185444504443197.
[I 2024-12-04 15:11:07,688] Trial 976 finished with value: 0.7488521621685257 and parameters: {'n_estimators': 904, 'max_depth': 7, 'min_samples_split': 45, 'min_samples_leaf': 4, 'max_features': None, 'bootstrap': False, 'criterion': 'absolute_error'}. Best is trial 590 with value: 0.4185444504443197.
[I 2024-12-04 15:11:09,825] Trial 1007 finished with value: 0.4236126901401277 and parameters: {'n_estimators': 689, 'max_depth': 29, 'min_samples_split': 2, 'min_samples_leaf': 1, 'max_features': None, 'bootstrap': True, 'criterion': 'squared_error'}. Best is trial 590 with value: 0.4185444504443197.
