[I 2024-12-04 15:01:56,343] Trial 440 finished with value: 1.2693635028570747 and parameters: {'kernel_type': 'Matern', 'length_scale': 54973.2780074487, 'noise_level': 0.024061557719375203, 'constant_value': 14.143012445661338, 'nu': 1.5}. Best is trial 276 with value: 0.13435392997433446.
[I 2024-12-04 15:01:56,870] Trial 453 finished with value: 1.2693635028373744 and parameters: {'kernel_type': 'Matern', 'length_scale': 0.062473622930039205, 'noise_level': 0.0014290447861466946, 'constant_value': 302.13546592965736, 'nu': 1.5}. Best is trial 276 with value: 0.13435392997433446.
[I 2024-12-04 15:01:57,549] Trial 446 finished with value: 0.13435441877188514 and parameters: {'kernel_type': 'Matern', 'length_scale': 5.839378015728156, 'noise_level': 0.009202660625595617, 'constant_value': 0.24491109014934886, 'nu': 1.5}. Best is trial 276 with value: 0.13435392997433446.
[I 2024-12-04 15:01:59,484] Trial 439 finished with value: 0.13435437898089908 and parameters: {'kernel_type': 'Matern', 'length_scale': 0.39774514224865026, 'noise_level': 0.23684887885036163, 'constant_value': 1049.9552068495827, 'nu': 1.5}. Best is trial 276 with value: 0.13435392997433446.
[I 2024-12-04 15:01:59,488] Trial 450 finished with value: 0.134354403361658 and parameters: {'kernel_type': 'Matern', 'length_scale': 0.14008438903097667, 'noise_level': 0.0075632507062899715, 'constant_value': 3.320133114101882, 'nu': 1.5}. Best is trial 276 with value: 0.13435392997433446.
[I 2024-12-04 15:02:00,443] Trial 452 finished with value: 0.13435431624395353 and parameters: {'kernel_type': 'Matern', 'length_scale': 21.890710948017453, 'noise_level': 0.017211685208952797, 'constant_value': 808.1469992021031, 'nu': 1.5}. Best is trial 276 with value: 0.13435392997433446.
[I 2024-12-04 15:02:02,049] Trial 448 finished with value: 1.2693635028569707 and parameters: {'kernel_type': 'RBF', 'length_scale': 0.0022092579564470917, 'noise_level': 0.00011418389501479295, 'constant_value': 0.0030017486300197805, 'nu': 2.5}. Best is trial 276 with value: 0.13435392997433446.
[I 2024-12-04 15:02:02,736] Trial 461 finished with value: 1.3007745979653018 and parameters: {'kernel_type': 'Matern', 'length_scale': 0.7711013224654608, 'noise_level': 0.0009991215625700454, 'constant_value': 90800.88452370143, 'nu': 1.5}. Best is trial 276 with value: 0.13435392997433446.
[I 2024-12-04 15:02:03,868] Trial 454 finished with value: 1.269363502857396 and parameters: {'kernel_type': 'Matern', 'length_scale': 1622.0770251166027, 'noise_level': 0.0005907237436102378, 'constant_value': 248.7687510326294, 'nu': 1.5}. Best is trial 276 with value: 0.13435392997433446.
[I 2024-12-04 15:02:03,990] Trial 460 finished with value: 0.14859830533839555 and parameters: {'kernel_type': 'Matern', 'length_scale': 116.302180282778, 'noise_level': 0.4738188375590398, 'constant_value': 73666.15087959876, 'nu': 2.5}. Best is trial 276 with value: 0.13435392997433446.
[I 2024-12-04 15:02:04,779] Trial 456 finished with value: 0.13435440152281036 and parameters: {'kernel_type': 'Matern', 'length_scale': 831.3330130874334, 'noise_level': 0.05123463192984918, 'constant_value': 5.4163603983772175, 'nu': 1.5}. Best is trial 276 with value: 0.13435392997433446.
[I 2024-12-04 15:02:06,634] Trial 466 finished with value: 1.2693635028569925 and parameters: {'kernel_type': 'Matern', 'length_scale': 0.0007673803825774177, 'noise_level': 0.0029287868835141907, 'constant_value': 48744.49457093943, 'nu': 1.5}. Best is trial 276 with value: 0.13435392997433446.
[I 2024-12-04 15:02:06,784] Trial 451 finished with value: 0.13435440546127583 and parameters: {'kernel_type': 'Matern', 'length_scale': 0.335251190876504, 'noise_level': 0.0018377761258668932, 'constant_value': 438.52926263825196, 'nu': 1.5}. Best is trial 276 with value: 0.13435392997433446.
[I 2024-12-04 15:02:07,371] Trial 462 finished with value: 0.13435439563430143 and parameters: {'kernel_type': 'Matern', 'length_scale': 0.3713778740788224, 'noise_level': 0.013239205812999992, 'constant_value': 8339.421096349688, 'nu': 1.5}. Best is trial 276 with value: 0.13435392997433446.
[I 2024-12-04 15:02:07,987] Trial 455 finished with value: 1.2693635028569776 and parameters: {'kernel_type': 'Matern', 'length_scale': 5986.09802702934, 'noise_level': 0.0010697251645785432, 'constant_value': 196.28409488362536, 'nu': 1.5}. Best is trial 276 with value: 0.13435392997433446.
[I 2024-12-04 15:02:08,728] Trial 459 finished with value: 0.1343544035583706 and parameters: {'kernel_type': 'Matern', 'length_scale': 8.307831518841814, 'noise_level': 0.4793743254621243, 'constant_value': 48735.455343825204, 'nu': 1.5}. Best is trial 276 with value: 0.13435392997433446.
[I 2024-12-04 15:02:09,388] Trial 458 finished with value: 0.13435427444018713 and parameters: {'kernel_type': 'Matern', 'length_scale': 4413.15454194238, 'noise_level': 0.006147634734955932, 'constant_value': 3048.683262698605, 'nu': 1.5}. Best is trial 276 with value: 0.13435392997433446.
[I 2024-12-04 15:02:11,547] Trial 464 finished with value: 0.13435437875986664 and parameters: {'kernel_type': 'Matern', 'length_scale': 2.9234543324628337, 'noise_level': 0.021323298773757896, 'constant_value': 111.21958598370584, 'nu': 1.5}. Best is trial 276 with value: 0.13435392997433446.
[I 2024-12-04 15:02:13,688] Trial 468 finished with value: 0.13435433018424672 and parameters: {'kernel_type': 'Matern', 'length_scale': 0.18456455655075035, 'noise_level': 0.004443822618964669, 'constant_value': 59792.51150676481, 'nu': 1.5}. Best is trial 276 with value: 0.13435392997433446.
[I 2024-12-04 15:02:13,699] Trial 457 finished with value: 0.1343543994202528 and parameters: {'kernel_type': 'Matern', 'length_scale': 0.18837486857352956, 'noise_level': 0.08244294183223946, 'constant_value': 9111.953036845507, 'nu': 1.5}. Best is trial 276 with value: 0.13435392997433446.
[I 2024-12-04 15:02:13,920] Trial 469 finished with value: 0.13435442568470488 and parameters: {'kernel_type': 'Matern', 'length_scale': 41.14629589441884, 'noise_level': 0.8347878464508993, 'constant_value': 97935.52615850497, 'nu': 1.5}. Best is trial 276 with value: 0.13435392997433446.
[I 2024-12-04 15:02:14,052] Trial 465 finished with value: 0.13435439890156067 and parameters: {'kernel_type': 'Matern', 'length_scale': 335.23259567240626, 'noise_level': 0.0034414412511927545, 'constant_value': 53.04149159061307, 'nu': 1.5}. Best is trial 276 with value: 0.13435392997433446.
[I 2024-12-04 15:02:14,342] Trial 473 finished with value: 0.13435438955716517 and parameters: {'kernel_type': 'Matern', 'length_scale': 118.6670783014594, 'noise_level': 0.006046038847464196, 'constant_value': 36.80311786460374, 'nu': 1.5}. Best is trial 276 with value: 0.13435392997433446.
[I 2024-12-04 15:02:15,357] Trial 472 finished with value: 1.26936350285699 and parameters: {'kernel_type': 'Matern', 'length_scale': 1966.4922629525977, 'noise_level': 0.0014227646696558516, 'constant_value': 10.351558600374583, 'nu': 1.5}. Best is trial 276 with value: 0.13435392997433446.
[I 2024-12-04 15:02:18,647] Trial 467 finished with value: 0.13435439681934222 and parameters: {'kernel_type': 'Matern', 'length_scale': 672.714509032136, 'noise_level': 0.005076816511584966, 'constant_value': 61615.522544450614, 'nu': 1.5}. Best is trial 276 with value: 0.13435392997433446.
[I 2024-12-04 15:02:19,122] Trial 470 finished with value: 0.13435433965271534 and parameters: {'kernel_type': 'Matern', 'length_scale': 787.0732192862864, 'noise_level': 0.02964887248828212, 'constant_value': 3560.0131147024663, 'nu': 1.5}. Best is trial 276 with value: 0.13435392997433446.
[I 2024-12-04 15:02:22,522] Trial 474 finished with value: 1.2693635028572077 and parameters: {'kernel_type': 'Matern', 'length_scale': 2759.1033765676293, 'noise_level': 0.0007799297523112711, 'constant_value': 2724.60523695852, 'nu': 1.5}. Best is trial 276 with value: 0.13435392997433446.
[I 2024-12-04 15:02:22,912] Trial 463 finished with value: 0.13435439968948873 and parameters: {'kernel_type': 'Matern', 'length_scale': 2.796190747818151, 'noise_level': 0.1311351413079126, 'constant_value': 70632.25881800153, 'nu': 1.5}. Best is trial 276 with value: 0.13435392997433446.
[I 2024-12-04 15:02:23,707] Trial 477 finished with value: 0.13435417403371516 and parameters: {'kernel_type': 'Matern', 'length_scale': 7975.258997053459, 'noise_level': 0.03819867609492429, 'constant_value': 84520.1464575799, 'nu': 1.5}. Best is trial 276 with value: 0.13435392997433446.
[I 2024-12-04 15:02:23,839] Trial 478 finished with value: 1.2693635028569952 and parameters: {'kernel_type': 'RBF', 'length_scale': 58.51293012239322, 'noise_level': 0.0032827821055177436, 'constant_value': 6.743662361380053, 'nu': 1.5}. Best is trial 276 with value: 0.13435392997433446.
[I 2024-12-04 15:02:23,854] Trial 471 finished with value: 1.2693635028576622 and parameters: {'kernel_type': 'Matern', 'length_scale': 3170.012063230496, 'noise_level': 0.0048657138952439595, 'constant_value': 1198.897057068474, 'nu': 1.5}. Best is trial 276 with value: 0.13435392997433446.
[I 2024-12-04 15:02:24,404] Trial 479 finished with value: 1.269363502856842 and parameters: {'kernel_type': 'Matern', 'length_scale': 1742.0437862847853, 'noise_level': 0.0031520644899568737, 'constant_value': 69.11178765965397, 'nu': 1.5}. Best is trial 276 with value: 0.13435392997433446.
[I 2024-12-04 15:02:28,446] Trial 476 finished with value: 1.2693635028584578 and parameters: {'kernel_type': 'Matern', 'length_scale': 16688.183005962794, 'noise_level': 0.011088304308232716, 'constant_value': 2792.9649064369255, 'nu': 1.5}. Best is trial 276 with value: 0.13435392997433446.
[I 2024-12-04 15:02:28,754] Trial 482 finished with value: 0.13435439474294794 and parameters: {'kernel_type': 'Matern', 'length_scale': 56.116463544629326, 'noise_level': 0.003671229091003752, 'constant_value': 447.972630960071, 'nu': 1.5}. Best is trial 276 with value: 0.13435392997433446.
[I 2024-12-04 15:02:32,378] Trial 483 finished with value: 1.2693635028566297 and parameters: {'kernel_type': 'Matern', 'length_scale': 7.738899346175736, 'noise_level': 1.3100561767546864e-08, 'constant_value': 0.004383218936922568, 'nu': 2.5}. Best is trial 276 with value: 0.13435392997433446.
[I 2024-12-04 15:02:37,004] Trial 484 finished with value: 0.14859820507578914 and parameters: {'kernel_type': 'Matern', 'length_scale': 5312.234902178649, 'noise_level': 0.0071803301838629105, 'constant_value': 77069.29868261996, 'nu': 2.5}. Best is trial 276 with value: 0.13435392997433446.
[I 2024-12-04 15:02:37,170] Trial 487 finished with value: 0.13435438233695424 and parameters: {'kernel_type': 'Matern', 'length_scale': 69863.86039363171, 'noise_level': 0.7011705947284151, 'constant_value': 44464.58036290435, 'nu': 1.5}. Best is trial 276 with value: 0.13435392997433446.
[I 2024-12-04 15:02:38,952] Trial 491 finished with value: 1.2693635028569776 and parameters: {'kernel_type': 'Matern', 'length_scale': 56437.7616512588, 'noise_level': 0.0180119054795325, 'constant_value': 3505.0583370369295, 'nu': 1.5}. Best is trial 276 with value: 0.13435392997433446.
[I 2024-12-04 15:02:39,626] Trial 485 finished with value: 0.1343544211128998 and parameters: {'kernel_type': 'Matern', 'length_scale': 19.016153102837542, 'noise_level': 0.5540953461009596, 'constant_value': 288.01480736355705, 'nu': 1.5}. Best is trial 276 with value: 0.13435392997433446.
[I 2024-12-04 15:02:41,371] Trial 492 finished with value: 0.13435440015306424 and parameters: {'kernel_type': 'Matern', 'length_scale': 3210.0369602329565, 'noise_level': 0.08337598885611147, 'constant_value': 6094.073394628264, 'nu': 1.5}. Best is trial 276 with value: 0.13435392997433446.
[I 2024-12-04 15:02:41,530] Trial 495 finished with value: 0.1343543874297086 and parameters: {'kernel_type': 'Matern', 'length_scale': 336.63053185011967, 'noise_level': 0.005665296819556511, 'constant_value': 8268.00369880573, 'nu': 1.5}. Best is trial 276 with value: 0.13435392997433446.
[I 2024-12-04 15:02:41,550] Trial 481 finished with value: 1.2693635028570105 and parameters: {'kernel_type': 'Matern', 'length_scale': 4484.097373883285, 'noise_level': 1.24367604154125e-06, 'constant_value': 0.019366939653112907, 'nu': 0.5}. Best is trial 276 with value: 0.13435392997433446.
[I 2024-12-04 15:02:42,521] Trial 493 finished with value: 1.300774597965657 and parameters: {'kernel_type': 'Matern', 'length_scale': 0.7736884187657932, 'noise_level': 0.0011280882895567661, 'constant_value': 95949.90141918446, 'nu': 1.5}. Best is trial 276 with value: 0.13435392997433446.
[I 2024-12-04 15:02:43,588] Trial 489 finished with value: 0.14859828325205146 and parameters: {'kernel_type': 'Matern', 'length_scale': 1.5852639762975553, 'noise_level': 4.7326113792426254e-07, 'constant_value': 1.0886510681135886e-06, 'nu': 2.5}. Best is trial 276 with value: 0.13435392997433446.
[I 2024-12-04 15:02:43,822] Trial 497 finished with value: 0.13435439940888355 and parameters: {'kernel_type': 'Matern', 'length_scale': 86.80506312574103, 'noise_level': 0.021959564196087338, 'constant_value': 101.20518253181487, 'nu': 1.5}. Best is trial 276 with value: 0.13435392997433446.
[I 2024-12-04 15:02:44,086] Trial 490 finished with value: 0.13435440047683436 and parameters: {'kernel_type': 'Matern', 'length_scale': 1370.1136942534545, 'noise_level': 0.001834657051520092, 'constant_value': 39269.173333800834, 'nu': 1.5}. Best is trial 276 with value: 0.13435392997433446.
[I 2024-12-04 15:02:44,157] Trial 500 finished with value: 0.13435439988512154 and parameters: {'kernel_type': 'Matern', 'length_scale': 1656.4645018341964, 'noise_level': 0.021290434363265862, 'constant_value': 67674.989611443, 'nu': 1.5}. Best is trial 276 with value: 0.13435392997433446.
[I 2024-12-04 15:02:44,617] Trial 475 finished with value: 1.269363502856223 and parameters: {'kernel_type': 'Matern', 'length_scale': 0.018108383861174242, 'noise_level': 0.03753942770137503, 'constant_value': 95285.02342611052, 'nu': 1.5}. Best is trial 276 with value: 0.13435392997433446.
[I 2024-12-04 15:02:44,652] Trial 488 finished with value: 0.15167297548203074 and parameters: {'kernel_type': 'RBF', 'length_scale': 3162.018614275301, 'noise_level': 0.056379927900759366, 'constant_value': 2147.167055148315, 'nu': 1.5}. Best is trial 276 with value: 0.13435392997433446.
[I 2024-12-04 15:02:45,027] Trial 501 finished with value: 0.13435439998142767 and parameters: {'kernel_type': 'Matern', 'length_scale': 840.2166355029213, 'noise_level': 0.10444817401007228, 'constant_value': 26.63359838794669, 'nu': 1.5}. Best is trial 276 with value: 0.13435392997433446.
[I 2024-12-04 15:02:45,262] Trial 494 finished with value: 0.1343544002766411 and parameters: {'kernel_type': 'Matern', 'length_scale': 7118.51199875119, 'noise_level': 0.084267502533017, 'constant_value': 34895.86128972896, 'nu': 1.5}. Best is trial 276 with value: 0.13435392997433446.
[I 2024-12-04 15:02:45,467] Trial 480 finished with value: 0.13435440379308852 and parameters: {'kernel_type': 'Matern', 'length_scale': 4923.810793626184, 'noise_level': 0.0003035985517192037, 'constant_value': 77859.7302793628, 'nu': 1.5}. Best is trial 276 with value: 0.13435392997433446.
[I 2024-12-04 15:02:46,034] Trial 498 finished with value: 0.1343542467658741 and parameters: {'kernel_type': 'Matern', 'length_scale': 564.2879330742805, 'noise_level': 0.009264360904789359, 'constant_value': 224.53959053052836, 'nu': 1.5}. Best is trial 276 with value: 0.13435392997433446.
[I 2024-12-04 15:02:47,460] Trial 499 finished with value: 0.17251039789082812 and parameters: {'kernel_type': 'Matern', 'length_scale': 1.2542075967713926, 'noise_level': 0.010178023955451575, 'constant_value': 50654.0426163646, 'nu': 0.5}. Best is trial 276 with value: 0.13435392997433446.
[I 2024-12-04 15:02:49,068] Trial 486 finished with value: 0.13435440038359148 and parameters: {'kernel_type': 'Matern', 'length_scale': 146.38840274618164, 'noise_level': 0.02220584109748172, 'constant_value': 78964.55455156257, 'nu': 1.5}. Best is trial 276 with value: 0.13435392997433446.
[I 2024-12-04 15:02:52,155] Trial 503 finished with value: 0.172510402505 and parameters: {'kernel_type': 'Matern', 'length_scale': 21280.261295286386, 'noise_level': 2.1820247250427097e-05, 'constant_value': 11257.120069650551, 'nu': 0.5}. Best is trial 276 with value: 0.13435392997433446.
[I 2024-12-04 15:02:52,163] Trial 496 finished with value: 0.13435447022867303 and parameters: {'kernel_type': 'Matern', 'length_scale': 613.3627411226538, 'noise_level': 0.022705558814303615, 'constant_value': 18958.303550779165, 'nu': 1.5}. Best is trial 276 with value: 0.13435392997433446.
[I 2024-12-04 15:02:52,841] Trial 502 finished with value: 0.13435434499646295 and parameters: {'kernel_type': 'Matern', 'length_scale': 10.533905368321449, 'noise_level': 4.7015276720490054e-07, 'constant_value': 8.259059422171264, 'nu': 1.5}. Best is trial 276 with value: 0.13435392997433446.
[I 2024-12-04 15:02:52,846] Trial 505 finished with value: 1.2693635028569603 and parameters: {'kernel_type': 'Matern', 'length_scale': 0.0014099613794059645, 'noise_level': 7.157035496429747e-07, 'constant_value': 4.8131842908935234e-05, 'nu': 2.5}. Best is trial 276 with value: 0.13435392997433446.
[I 2024-12-04 15:02:52,958] Trial 504 finished with value: 1.2693635028569366 and parameters: {'kernel_type': 'Matern', 'length_scale': 98205.93371436582, 'noise_level': 0.0022038666017573498, 'constant_value': 25626.941197026314, 'nu': 1.5}. Best is trial 276 with value: 0.13435392997433446.
[I 2024-12-04 15:02:54,092] Trial 506 finished with value: 0.13435446662176892 and parameters: {'kernel_type': 'Matern', 'length_scale': 0.2895150805900142, 'noise_level': 8.948125316520544e-07, 'constant_value': 8.100045975788126, 'nu': 1.5}. Best is trial 276 with value: 0.13435392997433446.
[I 2024-12-04 15:02:54,642] Trial 511 finished with value: 1.3007739235932056 and parameters: {'kernel_type': 'Matern', 'length_scale': 0.00479880787669132, 'noise_level': 2.9087516663063893e-09, 'constant_value': 25704.878439143416, 'nu': 0.5}. Best is trial 276 with value: 0.13435392997433446.
[I 2024-12-04 15:02:55,760] Trial 508 finished with value: 0.148598270723655 and parameters: {'kernel_type': 'Matern', 'length_scale': 679.2905641800447, 'noise_level': 0.34802056479679105, 'constant_value': 2.4403276200192963, 'nu': 2.5}. Best is trial 276 with value: 0.13435392997433446.
[I 2024-12-04 15:02:56,427] Trial 512 finished with value: 1.3007739235933147 and parameters: {'kernel_type': 'Matern', 'length_scale': 0.0008630101375582716, 'noise_level': 2.1266670270031347e-06, 'constant_value': 11505.996557071874, 'nu': 1.5}. Best is trial 276 with value: 0.13435392997433446.
[I 2024-12-04 15:02:58,958] Trial 510 finished with value: 0.1343542057967893 and parameters: {'kernel_type': 'Matern', 'length_scale': 6.247980572125258, 'noise_level': 0.005867888606322993, 'constant_value': 2281.314328765422, 'nu': 1.5}. Best is trial 276 with value: 0.13435392997433446.
[I 2024-12-04 15:02:59,012] Trial 513 finished with value: 1.269363502857 and parameters: {'kernel_type': 'Matern', 'length_scale': 1626.0353441398906, 'noise_level': 0.00351731517128944, 'constant_value': 242.96713401959337, 'nu': 1.5}. Best is trial 276 with value: 0.13435392997433446.
[I 2024-12-04 15:03:01,294] Trial 514 finished with value: 0.1516730168854814 and parameters: {'kernel_type': 'RBF', 'length_scale': 67.39833069489312, 'noise_level': 0.0007041799541047599, 'constant_value': 16800.768690868124, 'nu': 1.5}. Best is trial 276 with value: 0.13435392997433446.
[I 2024-12-04 15:03:02,380] Trial 507 finished with value: 0.13435440995137377 and parameters: {'kernel_type': 'Matern', 'length_scale': 165.76420573088188, 'noise_level': 0.04015213377153698, 'constant_value': 483.97432668924614, 'nu': 1.5}. Best is trial 276 with value: 0.13435392997433446.
[I 2024-12-04 15:03:03,683] Trial 516 finished with value: 1.2693635028576549 and parameters: {'kernel_type': 'Matern', 'length_scale': 1050.7633414516, 'noise_level': 1.0240591677767772e-05, 'constant_value': 5.344290557820074, 'nu': 1.5}. Best is trial 276 with value: 0.13435392997433446.
[I 2024-12-04 15:03:03,753] Trial 515 finished with value: 1.2693635028576515 and parameters: {'kernel_type': 'RBF', 'length_scale': 0.0008252450518245893, 'noise_level': 1.1521515642738756e-10, 'constant_value': 4.435850581678122e-05, 'nu': 1.5}. Best is trial 276 with value: 0.13435392997433446.
[I 2024-12-04 15:03:07,486] Trial 519 finished with value: 1.3007745979290528 and parameters: {'kernel_type': 'Matern', 'length_scale': 39037.52122366082, 'noise_level': 0.0003837286010953297, 'constant_value': 1.5066831477062079e-05, 'nu': 2.5}. Best is trial 276 with value: 0.13435392997433446.
[I 2024-12-04 15:03:09,117] Trial 520 finished with value: 1.2693635028569692 and parameters: {'kernel_type': 'Matern', 'length_scale': 0.0008977345614180254, 'noise_level': 1.0927572559004458e-06, 'constant_value': 2.785215576920224e-07, 'nu': 0.5}. Best is trial 276 with value: 0.13435392997433446.
[I 2024-12-04 15:03:09,490] Trial 524 finished with value: 1.2693635028562809 and parameters: {'kernel_type': 'RBF', 'length_scale': 0.00040028062136203895, 'noise_level': 0.07282679843263251, 'constant_value': 14349.12803548978, 'nu': 0.5}. Best is trial 276 with value: 0.13435392997433446.
[I 2024-12-04 15:03:09,724] Trial 522 finished with value: 1.2693635028570045 and parameters: {'kernel_type': 'Matern', 'length_scale': 25572.882989427948, 'noise_level': 1.2740411781218861e-05, 'constant_value': 480.96987110519865, 'nu': 1.5}. Best is trial 276 with value: 0.13435392997433446.
