[I 2024-12-04 11:56:01,199] Trial 766 finished with value: 0.8101385948198155 and parameters: {'max_depth': 35, 'min_samples_split': 5, 'min_samples_leaf': 3, 'max_features': 'sqrt', 'criterion': 'squared_error', 'splitter': 'best'}. Best is trial 748 with value: 0.59023342761678.
[I 2024-12-04 11:56:01,354] Trial 774 finished with value: 1.0720027384799424 and parameters: {'max_depth': 5, 'min_samples_split': 5, 'min_samples_leaf': 1, 'max_features': 'sqrt', 'criterion': 'friedman_mse', 'splitter': 'best'}. Best is trial 748 with value: 0.59023342761678.
[I 2024-12-04 11:56:01,685] Trial 758 finished with value: 0.676636829282285 and parameters: {'max_depth': 35, 'min_samples_split': 6, 'min_samples_leaf': 1, 'max_features': 'sqrt', 'criterion': 'squared_error', 'splitter': 'best'}. Best is trial 748 with value: 0.59023342761678.
[I 2024-12-04 11:56:01,957] Trial 764 finished with value: 0.6822383172238039 and parameters: {'max_depth': 32, 'min_samples_split': 3, 'min_samples_leaf': 1, 'max_features': 'sqrt', 'criterion': 'squared_error', 'splitter': 'best'}. Best is trial 748 with value: 0.59023342761678.
[I 2024-12-04 11:56:01,961] Trial 763 finished with value: 0.8225022089543504 and parameters: {'max_depth': 33, 'min_samples_split': 6, 'min_samples_leaf': 2, 'max_features': 'sqrt', 'criterion': 'squared_error', 'splitter': 'best'}. Best is trial 748 with value: 0.59023342761678.
[I 2024-12-04 11:56:02,553] Trial 787 finished with value: 0.8943154636912028 and parameters: {'max_depth': 6, 'min_samples_split': 13, 'min_samples_leaf': 3, 'max_features': 'sqrt', 'criterion': 'squared_error', 'splitter': 'best'}. Best is trial 748 with value: 0.59023342761678.
[I 2024-12-04 11:56:02,613] Trial 780 finished with value: 1.0909840109486761 and parameters: {'max_depth': 29, 'min_samples_split': 18, 'min_samples_leaf': 6, 'max_features': 'log2', 'criterion': 'friedman_mse', 'splitter': 'random'}. Best is trial 748 with value: 0.59023342761678.
[I 2024-12-04 11:56:02,961] Trial 770 finished with value: 0.8764642500355264 and parameters: {'max_depth': 28, 'min_samples_split': 11, 'min_samples_leaf': 10, 'max_features': 'sqrt', 'criterion': 'friedman_mse', 'splitter': 'best'}. Best is trial 748 with value: 0.59023342761678.
[I 2024-12-04 11:56:03,614] Trial 788 finished with value: 1.091656728529238 and parameters: {'max_depth': 5, 'min_samples_split': 9, 'min_samples_leaf': 10, 'max_features': 'log2', 'criterion': 'friedman_mse', 'splitter': 'best'}. Best is trial 748 with value: 0.59023342761678.
[I 2024-12-04 11:56:04,213] Trial 777 finished with value: 0.8241861685151659 and parameters: {'max_depth': 34, 'min_samples_split': 3, 'min_samples_leaf': 2, 'max_features': 'sqrt', 'criterion': 'squared_error', 'splitter': 'best'}. Best is trial 748 with value: 0.59023342761678.
[I 2024-12-04 11:56:04,646] Trial 786 finished with value: 0.8241861685151659 and parameters: {'max_depth': 35, 'min_samples_split': 2, 'min_samples_leaf': 2, 'max_features': 'sqrt', 'criterion': 'squared_error', 'splitter': 'best'}. Best is trial 748 with value: 0.59023342761678.
[I 2024-12-04 11:56:04,977] Trial 776 finished with value: 0.6619213368346581 and parameters: {'max_depth': 28, 'min_samples_split': 5, 'min_samples_leaf': 1, 'max_features': 'sqrt', 'criterion': 'squared_error', 'splitter': 'best'}. Best is trial 748 with value: 0.59023342761678.
[I 2024-12-04 11:56:05,201] Trial 779 finished with value: 0.6855856489406115 and parameters: {'max_depth': 34, 'min_samples_split': 7, 'min_samples_leaf': 1, 'max_features': 'sqrt', 'criterion': 'squared_error', 'splitter': 'best'}. Best is trial 748 with value: 0.59023342761678.
[I 2024-12-04 11:56:05,922] Trial 783 finished with value: 0.6296640809588671 and parameters: {'max_depth': 30, 'min_samples_split': 3, 'min_samples_leaf': 1, 'max_features': 'sqrt', 'criterion': 'squared_error', 'splitter': 'best'}. Best is trial 748 with value: 0.59023342761678.
[I 2024-12-04 11:56:06,253] Trial 781 finished with value: 1.0745658542945478 and parameters: {'max_depth': 30, 'min_samples_split': 12, 'min_samples_leaf': 5, 'max_features': 'log2', 'criterion': 'absolute_error', 'splitter': 'random'}. Best is trial 748 with value: 0.59023342761678.
[I 2024-12-04 11:56:07,006] Trial 771 finished with value: 0.8089192780293623 and parameters: {'max_depth': 29, 'min_samples_split': 4, 'min_samples_leaf': 1, 'max_features': 'sqrt', 'criterion': 'squared_error', 'splitter': 'random'}. Best is trial 748 with value: 0.59023342761678.
[I 2024-12-04 11:56:07,241] Trial 782 finished with value: 0.6822383172238039 and parameters: {'max_depth': 32, 'min_samples_split': 3, 'min_samples_leaf': 1, 'max_features': 'sqrt', 'criterion': 'squared_error', 'splitter': 'best'}. Best is trial 748 with value: 0.59023342761678.
[I 2024-12-04 11:56:07,377] Trial 784 finished with value: 0.6548912683909761 and parameters: {'max_depth': 29, 'min_samples_split': 5, 'min_samples_leaf': 1, 'max_features': 'sqrt', 'criterion': 'squared_error', 'splitter': 'best'}. Best is trial 748 with value: 0.59023342761678.
[I 2024-12-04 11:56:07,422] Trial 791 finished with value: 1.0915425952976505 and parameters: {'max_depth': 10, 'min_samples_split': 13, 'min_samples_leaf': 1, 'max_features': 'log2', 'criterion': 'squared_error', 'splitter': 'random'}. Best is trial 748 with value: 0.59023342761678.
[I 2024-12-04 11:56:07,800] Trial 792 finished with value: 0.9375380774315807 and parameters: {'max_depth': 30, 'min_samples_split': 4, 'min_samples_leaf': 4, 'max_features': 'log2', 'criterion': 'squared_error', 'splitter': 'best'}. Best is trial 748 with value: 0.59023342761678.
[I 2024-12-04 11:56:07,936] Trial 785 finished with value: 1.0689310653398096 and parameters: {'max_depth': 10, 'min_samples_split': 18, 'min_samples_leaf': 3, 'max_features': 'log2', 'criterion': 'absolute_error', 'splitter': 'random'}. Best is trial 748 with value: 0.59023342761678.
[I 2024-12-04 11:56:07,999] Trial 793 finished with value: 0.8241861685151659 and parameters: {'max_depth': 29, 'min_samples_split': 3, 'min_samples_leaf': 2, 'max_features': 'sqrt', 'criterion': 'squared_error', 'splitter': 'best'}. Best is trial 748 with value: 0.59023342761678.
[I 2024-12-04 11:56:08,207] Trial 797 finished with value: 0.6314823881705866 and parameters: {'max_depth': 31, 'min_samples_split': 10, 'min_samples_leaf': 1, 'max_features': 'sqrt', 'criterion': 'absolute_error', 'splitter': 'random'}. Best is trial 748 with value: 0.59023342761678.
[I 2024-12-04 11:56:08,209] Trial 790 finished with value: 0.8241861685151659 and parameters: {'max_depth': 34, 'min_samples_split': 2, 'min_samples_leaf': 2, 'max_features': 'sqrt', 'criterion': 'squared_error', 'splitter': 'best'}. Best is trial 748 with value: 0.59023342761678.
[I 2024-12-04 11:56:08,603] Trial 798 finished with value: 0.713722108439527 and parameters: {'max_depth': 35, 'min_samples_split': 3, 'min_samples_leaf': 1, 'max_features': 'sqrt', 'criterion': 'squared_error', 'splitter': 'best'}. Best is trial 748 with value: 0.59023342761678.
[I 2024-12-04 11:56:09,616] Trial 800 finished with value: 1.074761472342103 and parameters: {'max_depth': 11, 'min_samples_split': 14, 'min_samples_leaf': 4, 'max_features': 'log2', 'criterion': 'absolute_error', 'splitter': 'random'}. Best is trial 748 with value: 0.59023342761678.
[I 2024-12-04 11:56:09,852] Trial 794 finished with value: 0.7570446136178774 and parameters: {'max_depth': 35, 'min_samples_split': 3, 'min_samples_leaf': 2, 'max_features': 'sqrt', 'criterion': 'squared_error', 'splitter': 'random'}. Best is trial 748 with value: 0.59023342761678.
[I 2024-12-04 11:56:10,313] Trial 804 finished with value: 0.8225022089543504 and parameters: {'max_depth': 25, 'min_samples_split': 6, 'min_samples_leaf': 2, 'max_features': 'sqrt', 'criterion': 'squared_error', 'splitter': 'best'}. Best is trial 748 with value: 0.59023342761678.
[I 2024-12-04 11:56:10,505] Trial 805 finished with value: 0.825529227572405 and parameters: {'max_depth': 31, 'min_samples_split': 9, 'min_samples_leaf': 2, 'max_features': 'sqrt', 'criterion': 'absolute_error', 'splitter': 'random'}. Best is trial 748 with value: 0.59023342761678.
[I 2024-12-04 11:56:10,971] Trial 801 finished with value: 0.825529227572405 and parameters: {'max_depth': 33, 'min_samples_split': 12, 'min_samples_leaf': 2, 'max_features': 'sqrt', 'criterion': 'absolute_error', 'splitter': 'random'}. Best is trial 748 with value: 0.59023342761678.
[I 2024-12-04 11:56:11,158] Trial 789 finished with value: 0.6777561409658496 and parameters: {'max_depth': 30, 'min_samples_split': 5, 'min_samples_leaf': 1, 'max_features': 'sqrt', 'criterion': 'squared_error', 'splitter': 'best'}. Best is trial 748 with value: 0.59023342761678.
[I 2024-12-04 11:56:11,605] Trial 807 finished with value: 0.825529227572405 and parameters: {'max_depth': 24, 'min_samples_split': 9, 'min_samples_leaf': 2, 'max_features': 'sqrt', 'criterion': 'absolute_error', 'splitter': 'random'}. Best is trial 748 with value: 0.59023342761678.
[I 2024-12-04 11:56:12,470] Trial 795 finished with value: 0.825529227572405 and parameters: {'max_depth': 31, 'min_samples_split': 11, 'min_samples_leaf': 2, 'max_features': 'sqrt', 'criterion': 'absolute_error', 'splitter': 'random'}. Best is trial 748 with value: 0.59023342761678.
[I 2024-12-04 11:56:13,127] Trial 806 finished with value: 0.8241861685151659 and parameters: {'max_depth': 19, 'min_samples_split': 2, 'min_samples_leaf': 2, 'max_features': 'sqrt', 'criterion': 'squared_error', 'splitter': 'best'}. Best is trial 748 with value: 0.59023342761678.
[I 2024-12-04 11:56:13,515] Trial 796 finished with value: 0.825529227572405 and parameters: {'max_depth': 29, 'min_samples_split': 14, 'min_samples_leaf': 2, 'max_features': 'sqrt', 'criterion': 'absolute_error', 'splitter': 'random'}. Best is trial 748 with value: 0.59023342761678.
[I 2024-12-04 11:56:13,748] Trial 803 finished with value: 0.7044023234155515 and parameters: {'max_depth': 35, 'min_samples_split': 2, 'min_samples_leaf': 1, 'max_features': 'sqrt', 'criterion': 'squared_error', 'splitter': 'best'}. Best is trial 748 with value: 0.59023342761678.
[I 2024-12-04 11:56:14,675] Trial 811 finished with value: 0.7231530055805183 and parameters: {'max_depth': 30, 'min_samples_split': 2, 'min_samples_leaf': 1, 'max_features': 'sqrt', 'criterion': 'squared_error', 'splitter': 'best'}. Best is trial 748 with value: 0.59023342761678.
[I 2024-12-04 11:56:15,245] Trial 808 finished with value: 0.653185483159977 and parameters: {'max_depth': 28, 'min_samples_split': 4, 'min_samples_leaf': 1, 'max_features': 'sqrt', 'criterion': 'squared_error', 'splitter': 'best'}. Best is trial 748 with value: 0.59023342761678.
[I 2024-12-04 11:56:15,289] Trial 815 finished with value: 0.8300015320785108 and parameters: {'max_depth': 32, 'min_samples_split': 5, 'min_samples_leaf': 2, 'max_features': 'sqrt', 'criterion': 'squared_error', 'splitter': 'best'}. Best is trial 748 with value: 0.59023342761678.
[I 2024-12-04 11:56:16,410] Trial 812 finished with value: 0.825529227572405 and parameters: {'max_depth': 34, 'min_samples_split': 10, 'min_samples_leaf': 2, 'max_features': 'sqrt', 'criterion': 'absolute_error', 'splitter': 'random'}. Best is trial 748 with value: 0.59023342761678.
[I 2024-12-04 11:56:16,483] Trial 813 finished with value: 0.6582758409466469 and parameters: {'max_depth': 32, 'min_samples_split': 8, 'min_samples_leaf': 1, 'max_features': 'sqrt', 'criterion': 'absolute_error', 'splitter': 'random'}. Best is trial 748 with value: 0.59023342761678.
[I 2024-12-04 11:56:16,554] Trial 821 finished with value: 0.6288333537578643 and parameters: {'max_depth': 34, 'min_samples_split': 4, 'min_samples_leaf': 1, 'max_features': 'sqrt', 'criterion': 'squared_error', 'splitter': 'best'}. Best is trial 748 with value: 0.59023342761678.
[I 2024-12-04 11:56:16,651] Trial 819 finished with value: 0.6525099878830255 and parameters: {'max_depth': 35, 'min_samples_split': 13, 'min_samples_leaf': 1, 'max_features': 'sqrt', 'criterion': 'absolute_error', 'splitter': 'random'}. Best is trial 748 with value: 0.59023342761678.
[I 2024-12-04 11:56:16,849] Trial 826 finished with value: 0.8061568860233352 and parameters: {'max_depth': 32, 'min_samples_split': 12, 'min_samples_leaf': 1, 'max_features': 'sqrt', 'criterion': 'squared_error', 'splitter': 'random'}. Best is trial 748 with value: 0.59023342761678.
[I 2024-12-04 11:56:16,862] Trial 814 finished with value: 0.6434949359888923 and parameters: {'max_depth': 34, 'min_samples_split': 5, 'min_samples_leaf': 1, 'max_features': 'sqrt', 'criterion': 'absolute_error', 'splitter': 'random'}. Best is trial 748 with value: 0.59023342761678.
[I 2024-12-04 11:56:16,966] Trial 809 finished with value: 0.7958664622562024 and parameters: {'max_depth': 33, 'min_samples_split': 4, 'min_samples_leaf': 1, 'max_features': 'sqrt', 'criterion': 'squared_error', 'splitter': 'best'}. Best is trial 748 with value: 0.59023342761678.
[I 2024-12-04 11:56:17,101] Trial 823 finished with value: 0.716860153973057 and parameters: {'max_depth': 31, 'min_samples_split': 2, 'min_samples_leaf': 1, 'max_features': 'sqrt', 'criterion': 'squared_error', 'splitter': 'best'}. Best is trial 748 with value: 0.59023342761678.
[I 2024-12-04 11:56:17,551] Trial 810 finished with value: 0.6696175097475049 and parameters: {'max_depth': 27, 'min_samples_split': 10, 'min_samples_leaf': 1, 'max_features': 'sqrt', 'criterion': 'absolute_error', 'splitter': 'random'}. Best is trial 748 with value: 0.59023342761678.
[I 2024-12-04 11:56:17,637] Trial 816 finished with value: 0.825529227572405 and parameters: {'max_depth': 27, 'min_samples_split': 10, 'min_samples_leaf': 2, 'max_features': 'sqrt', 'criterion': 'absolute_error', 'splitter': 'random'}. Best is trial 748 with value: 0.59023342761678.
[I 2024-12-04 11:56:18,675] Trial 802 finished with value: 0.7025072921375977 and parameters: {'max_depth': 27, 'min_samples_split': 14, 'min_samples_leaf': 1, 'max_features': 'sqrt', 'criterion': 'absolute_error', 'splitter': 'random'}. Best is trial 748 with value: 0.59023342761678.
[I 2024-12-04 11:56:18,860] Trial 799 finished with value: 0.6869124026100815 and parameters: {'max_depth': 32, 'min_samples_split': 5, 'min_samples_leaf': 1, 'max_features': 'sqrt', 'criterion': 'squared_error', 'splitter': 'best'}. Best is trial 748 with value: 0.59023342761678.
[I 2024-12-04 11:56:19,174] Trial 817 finished with value: 0.8606038828695697 and parameters: {'max_depth': 25, 'min_samples_split': 2, 'min_samples_leaf': 2, 'max_features': 'log2', 'criterion': 'squared_error', 'splitter': 'best'}. Best is trial 748 with value: 0.59023342761678.
[I 2024-12-04 11:56:19,244] Trial 818 finished with value: 0.6930927172635389 and parameters: {'max_depth': 32, 'min_samples_split': 9, 'min_samples_leaf': 1, 'max_features': 'sqrt', 'criterion': 'absolute_error', 'splitter': 'random'}. Best is trial 748 with value: 0.59023342761678.
[I 2024-12-04 11:56:19,369] Trial 829 finished with value: 0.978306986612747 and parameters: {'max_depth': 34, 'min_samples_split': 4, 'min_samples_leaf': 1, 'max_features': 'log2', 'criterion': 'absolute_error', 'splitter': 'random'}. Best is trial 748 with value: 0.59023342761678.
[I 2024-12-04 11:56:19,438] Trial 830 finished with value: 0.6208302021574689 and parameters: {'max_depth': 33, 'min_samples_split': 3, 'min_samples_leaf': 1, 'max_features': 'sqrt', 'criterion': 'squared_error', 'splitter': 'best'}. Best is trial 748 with value: 0.59023342761678.
[I 2024-12-04 11:56:19,446] Trial 825 finished with value: 0.7021743520610745 and parameters: {'max_depth': 27, 'min_samples_split': 3, 'min_samples_leaf': 1, 'max_features': 'sqrt', 'criterion': 'squared_error', 'splitter': 'best'}. Best is trial 748 with value: 0.59023342761678.
[I 2024-12-04 11:56:20,479] Trial 822 finished with value: 1.0593548366167873 and parameters: {'max_depth': 24, 'min_samples_split': 18, 'min_samples_leaf': 1, 'max_features': 'log2', 'criterion': 'squared_error', 'splitter': 'random'}. Best is trial 748 with value: 0.59023342761678.
[I 2024-12-04 11:56:20,603] Trial 828 finished with value: 0.7271069002219231 and parameters: {'max_depth': 33, 'min_samples_split': 5, 'min_samples_leaf': 1, 'max_features': 'sqrt', 'criterion': 'squared_error', 'splitter': 'best'}. Best is trial 748 with value: 0.59023342761678.
[I 2024-12-04 11:56:20,617] Trial 834 finished with value: 0.6208302021574689 and parameters: {'max_depth': 33, 'min_samples_split': 3, 'min_samples_leaf': 1, 'max_features': 'sqrt', 'criterion': 'squared_error', 'splitter': 'best'}. Best is trial 748 with value: 0.59023342761678.
[I 2024-12-04 11:56:21,097] Trial 831 finished with value: 0.7987748637010382 and parameters: {'max_depth': 35, 'min_samples_split': 7, 'min_samples_leaf': 3, 'max_features': 'sqrt', 'criterion': 'squared_error', 'splitter': 'best'}. Best is trial 748 with value: 0.59023342761678.
[I 2024-12-04 11:56:21,382] Trial 827 finished with value: 0.7231530055805183 and parameters: {'max_depth': 30, 'min_samples_split': 2, 'min_samples_leaf': 1, 'max_features': 'sqrt', 'criterion': 'squared_error', 'splitter': 'best'}. Best is trial 748 with value: 0.59023342761678.
[I 2024-12-04 11:56:22,612] Trial 835 finished with value: 0.6208302021574689 and parameters: {'max_depth': 33, 'min_samples_split': 3, 'min_samples_leaf': 1, 'max_features': 'sqrt', 'criterion': 'squared_error', 'splitter': 'best'}. Best is trial 748 with value: 0.59023342761678.
[I 2024-12-04 11:56:22,891] Trial 824 finished with value: 0.6288333537578643 and parameters: {'max_depth': 34, 'min_samples_split': 4, 'min_samples_leaf': 1, 'max_features': 'sqrt', 'criterion': 'squared_error', 'splitter': 'best'}. Best is trial 748 with value: 0.59023342761678.
[I 2024-12-04 11:56:23,756] Trial 842 finished with value: 0.8606038828695697 and parameters: {'max_depth': 35, 'min_samples_split': 3, 'min_samples_leaf': 2, 'max_features': 'log2', 'criterion': 'squared_error', 'splitter': 'best'}. Best is trial 748 with value: 0.59023342761678.
[I 2024-12-04 11:56:23,857] Trial 832 finished with value: 0.7044023234155515 and parameters: {'max_depth': 35, 'min_samples_split': 2, 'min_samples_leaf': 1, 'max_features': 'sqrt', 'criterion': 'squared_error', 'splitter': 'best'}. Best is trial 748 with value: 0.59023342761678.
[I 2024-12-04 11:56:24,560] Trial 836 finished with value: 0.8101385948198155 and parameters: {'max_depth': 35, 'min_samples_split': 5, 'min_samples_leaf': 3, 'max_features': 'sqrt', 'criterion': 'squared_error', 'splitter': 'best'}. Best is trial 748 with value: 0.59023342761678.
[I 2024-12-04 11:56:24,576] Trial 820 finished with value: 0.7231530055805183 and parameters: {'max_depth': 30, 'min_samples_split': 2, 'min_samples_leaf': 1, 'max_features': 'sqrt', 'criterion': 'squared_error', 'splitter': 'best'}. Best is trial 748 with value: 0.59023342761678.
[I 2024-12-04 11:56:24,863] Trial 839 finished with value: 0.624759203549427 and parameters: {'max_depth': 34, 'min_samples_split': 3, 'min_samples_leaf': 1, 'max_features': 'sqrt', 'criterion': 'squared_error', 'splitter': 'best'}. Best is trial 748 with value: 0.59023342761678.
[I 2024-12-04 11:56:26,273] Trial 833 finished with value: 0.636523508223405 and parameters: {'max_depth': 34, 'min_samples_split': 5, 'min_samples_leaf': 1, 'max_features': 'sqrt', 'criterion': 'squared_error', 'splitter': 'best'}. Best is trial 748 with value: 0.59023342761678.
[I 2024-12-04 11:56:26,513] Trial 849 finished with value: 0.8101385948198155 and parameters: {'max_depth': 32, 'min_samples_split': 2, 'min_samples_leaf': 3, 'max_features': 'sqrt', 'criterion': 'squared_error', 'splitter': 'best'}. Best is trial 748 with value: 0.59023342761678.
[I 2024-12-04 11:56:27,128] Trial 837 finished with value: 0.624759203549427 and parameters: {'max_depth': 34, 'min_samples_split': 3, 'min_samples_leaf': 1, 'max_features': 'sqrt', 'criterion': 'squared_error', 'splitter': 'best'}. Best is trial 748 with value: 0.59023342761678.
[I 2024-12-04 11:56:27,481] Trial 841 finished with value: 0.6464934833285224 and parameters: {'max_depth': 34, 'min_samples_split': 6, 'min_samples_leaf': 1, 'max_features': 'sqrt', 'criterion': 'squared_error', 'splitter': 'best'}. Best is trial 748 with value: 0.59023342761678.
[I 2024-12-04 11:56:27,596] Trial 851 finished with value: 0.8101385948198155 and parameters: {'max_depth': 28, 'min_samples_split': 2, 'min_samples_leaf': 3, 'max_features': 'sqrt', 'criterion': 'squared_error', 'splitter': 'best'}. Best is trial 748 with value: 0.59023342761678.
[I 2024-12-04 11:56:27,786] Trial 847 finished with value: 0.6960703836181407 and parameters: {'max_depth': 32, 'min_samples_split': 2, 'min_samples_leaf': 1, 'max_features': 'sqrt', 'criterion': 'squared_error', 'splitter': 'best'}. Best is trial 748 with value: 0.59023342761678.
[I 2024-12-04 11:56:28,387] Trial 846 finished with value: 0.713722108439527 and parameters: {'max_depth': 35, 'min_samples_split': 3, 'min_samples_leaf': 1, 'max_features': 'sqrt', 'criterion': 'squared_error', 'splitter': 'best'}. Best is trial 748 with value: 0.59023342761678.
[I 2024-12-04 11:56:28,953] Trial 852 finished with value: 1.0662738708770902 and parameters: {'max_depth': 31, 'min_samples_split': 11, 'min_samples_leaf': 2, 'max_features': 'log2', 'criterion': 'absolute_error', 'splitter': 'random'}. Best is trial 748 with value: 0.59023342761678.
[I 2024-12-04 11:56:29,419] Trial 843 finished with value: 0.713722108439527 and parameters: {'max_depth': 35, 'min_samples_split': 3, 'min_samples_leaf': 1, 'max_features': 'sqrt', 'criterion': 'squared_error', 'splitter': 'best'}. Best is trial 748 with value: 0.59023342761678.
