[I 2024-12-03 18:43:10,597] Trial 233 finished with value: 0.13587053073830124 and parameters: {'kernel': 'linear', 'C': 5.990607933816365, 'gamma': 0.005324716119077022, 'epsilon': 0.038173134769315276}. Best is trial 126 with value: 0.13459441547810197.
[I 2024-12-03 18:43:10,633] Trial 249 finished with value: 0.15472099506787074 and parameters: {'kernel': 'linear', 'C': 8.681128904812928, 'gamma': 0.021352485644503975, 'epsilon': 0.161209524130386}. Best is trial 126 with value: 0.13459441547810197.
[I 2024-12-03 18:43:11,734] Trial 228 finished with value: 0.13798973982781504 and parameters: {'kernel': 'linear', 'C': 11.564071114694572, 'gamma': 0.0006509383390326406, 'epsilon': 0.01668054902613874}. Best is trial 126 with value: 0.13459441547810197.
[I 2024-12-03 18:43:12,309] Trial 248 finished with value: 0.14092677528901157 and parameters: {'kernel': 'linear', 'C': 6.592146116112083, 'gamma': 0.022899672652501625, 'epsilon': 0.0815223921131654}. Best is trial 126 with value: 0.13459441547810197.
[I 2024-12-03 18:43:13,757] Trial 219 finished with value: 0.13480652312847122 and parameters: {'kernel': 'linear', 'C': 33.12039947554399, 'gamma': 0.023679810618152237, 'epsilon': 0.03028611409535039}. Best is trial 126 with value: 0.13459441547810197.
[I 2024-12-03 18:43:13,795] Trial 244 finished with value: 0.1422967018274282 and parameters: {'kernel': 'linear', 'C': 36.41896582512754, 'gamma': 0.0040216035246862045, 'epsilon': 0.11595144060232679}. Best is trial 126 with value: 0.13459441547810197.
[I 2024-12-03 18:43:13,811] Trial 240 finished with value: 0.1359218368579023 and parameters: {'kernel': 'linear', 'C': 6.191779090376625, 'gamma': 0.0005798867616639492, 'epsilon': 0.0328319729862762}. Best is trial 126 with value: 0.13459441547810197.
[I 2024-12-03 18:43:14,701] Trial 187 finished with value: 0.13759883780843624 and parameters: {'kernel': 'linear', 'C': 34.59086718158826, 'gamma': 0.21207541193512564, 'epsilon': 0.018165223453505838}. Best is trial 126 with value: 0.13459441547810197.
[I 2024-12-03 18:43:15,715] Trial 250 finished with value: 0.13575677043733897 and parameters: {'kernel': 'linear', 'C': 5.530990037600377, 'gamma': 0.022332571792138153, 'epsilon': 0.03937727869514413}. Best is trial 126 with value: 0.13459441547810197.
[I 2024-12-03 18:43:18,447] Trial 247 finished with value: 0.13701101067477722 and parameters: {'kernel': 'linear', 'C': 12.105886058909011, 'gamma': 0.0035043235656433544, 'epsilon': 0.046231946357784576}. Best is trial 126 with value: 0.13459441547810197.
[I 2024-12-03 18:43:18,556] Trial 252 finished with value: 0.13555224106529862 and parameters: {'kernel': 'linear', 'C': 7.2330515059692715, 'gamma': 0.00551958324580951, 'epsilon': 0.03833459742735512}. Best is trial 126 with value: 0.13459441547810197.
[I 2024-12-03 18:43:19,607] Trial 222 finished with value: 0.13725422392238712 and parameters: {'kernel': 'linear', 'C': 82.16006569420944, 'gamma': 0.05392671276626675, 'epsilon': 0.0757170123555407}. Best is trial 126 with value: 0.13459441547810197.
[I 2024-12-03 18:43:20,003] Trial 237 finished with value: 0.1365933691238451 and parameters: {'kernel': 'linear', 'C': 14.030603315092781, 'gamma': 0.0006956962179908656, 'epsilon': 0.025811976779220792}. Best is trial 126 with value: 0.13459441547810197.
[I 2024-12-03 18:43:20,196] Trial 200 finished with value: 0.1374072401785317 and parameters: {'kernel': 'linear', 'C': 25.477266095471137, 'gamma': 0.4023736660503339, 'epsilon': 0.0031029724079242945}. Best is trial 126 with value: 0.13459441547810197.
[I 2024-12-03 18:43:20,858] Trial 242 finished with value: 0.13529919388261147 and parameters: {'kernel': 'linear', 'C': 17.301454396936705, 'gamma': 0.02276591781936062, 'epsilon': 0.053508993222028074}. Best is trial 126 with value: 0.13459441547810197.
[I 2024-12-03 18:43:20,906] Trial 253 finished with value: 0.1385417715407968 and parameters: {'kernel': 'linear', 'C': 6.3858367229290485, 'gamma': 0.013001155341143569, 'epsilon': 0.017333912972580696}. Best is trial 126 with value: 0.13459441547810197.
[I 2024-12-03 18:43:22,518] Trial 261 finished with value: 0.13648764654099493 and parameters: {'kernel': 'linear', 'C': 3.2921818057428887, 'gamma': 0.011309448725316598, 'epsilon': 0.044352409508765143}. Best is trial 126 with value: 0.13459441547810197.
[I 2024-12-03 18:43:22,858] Trial 265 finished with value: 0.14058893611591416 and parameters: {'kernel': 'linear', 'C': 1.1162334048442362, 'gamma': 0.04453078953255279, 'epsilon': 0.05397342538666601}. Best is trial 126 with value: 0.13459441547810197.
[I 2024-12-03 18:43:23,547] Trial 263 finished with value: 0.13676596541150424 and parameters: {'kernel': 'linear', 'C': 2.535611453813704, 'gamma': 0.0029500155147098263, 'epsilon': 0.04954103926607393}. Best is trial 126 with value: 0.13459441547810197.
[I 2024-12-03 18:43:23,549] Trial 212 finished with value: 0.13559415987019532 and parameters: {'kernel': 'linear', 'C': 24.914594927061003, 'gamma': 0.0013375690765688995, 'epsilon': 0.03425606058206835}. Best is trial 126 with value: 0.13459441547810197.
[I 2024-12-03 18:43:24,276] Trial 264 finished with value: 0.14210343828135177 and parameters: {'kernel': 'linear', 'C': 10.18689403167909, 'gamma': 0.0066202721773240426, 'epsilon': 0.10632889361210614}. Best is trial 126 with value: 0.13459441547810197.
[I 2024-12-03 18:43:24,430] Trial 257 finished with value: 0.13498331114007867 and parameters: {'kernel': 'linear', 'C': 11.008972173184404, 'gamma': 0.019585509290731405, 'epsilon': 0.040445372777064365}. Best is trial 126 with value: 0.13459441547810197.
[I 2024-12-03 18:43:24,996] Trial 254 finished with value: 0.13584474590078788 and parameters: {'kernel': 'linear', 'C': 22.67941882283836, 'gamma': 0.024102846292612515, 'epsilon': 0.05250710046638882}. Best is trial 126 with value: 0.13459441547810197.
[I 2024-12-03 18:43:25,429] Trial 210 finished with value: 0.13778699714972795 and parameters: {'kernel': 'linear', 'C': 37.041050828828695, 'gamma': 0.0026914341488681144, 'epsilon': 0.01992238211855007}. Best is trial 126 with value: 0.13459441547810197.
[I 2024-12-03 18:43:25,685] Trial 272 finished with value: 0.3251462658940731 and parameters: {'kernel': 'rbf', 'C': 1.7329847478629012, 'gamma': 0.015266457419888016, 'epsilon': 0.032787436794752454}. Best is trial 126 with value: 0.13459441547810197.
[I 2024-12-03 18:43:26,049] Trial 273 finished with value: 17.46310284629779 and parameters: {'kernel': 'sigmoid', 'C': 4.922179085938616, 'gamma': 0.007303202282028828, 'epsilon': 0.0370977185013282}. Best is trial 126 with value: 0.13459441547810197.
[I 2024-12-03 18:43:27,536] Trial 275 finished with value: 0.15718571036340634 and parameters: {'kernel': 'rbf', 'C': 35.400944184553715, 'gamma': 0.0038972248701641754, 'epsilon': 0.03907520485543001}. Best is trial 126 with value: 0.13459441547810197.
[I 2024-12-03 18:43:27,572] Trial 218 finished with value: 0.13746201760157056 and parameters: {'kernel': 'linear', 'C': 24.30108798023599, 'gamma': 0.0007569850509888544, 'epsilon': 0.01915947886956286}. Best is trial 126 with value: 0.13459441547810197.
[I 2024-12-03 18:43:28,938] Trial 278 finished with value: 0.41721937621346405 and parameters: {'kernel': 'linear', 'C': 0.002009687354258538, 'gamma': 0.0035734532405845548, 'epsilon': 0.005242884043802967}. Best is trial 126 with value: 0.13459441547810197.
[I 2024-12-03 18:43:29,960] Trial 251 finished with value: 0.1370174388208059 and parameters: {'kernel': 'linear', 'C': 55.48400457324598, 'gamma': 0.003660278116182769, 'epsilon': 0.07415527765339706}. Best is trial 126 with value: 0.13459441547810197.
[I 2024-12-03 18:43:33,492] Trial 268 finished with value: 0.13577362066637355 and parameters: {'kernel': 'linear', 'C': 13.85379050447843, 'gamma': 0.05695521853735629, 'epsilon': 0.033540061746889574}. Best is trial 126 with value: 0.13459441547810197.
[I 2024-12-03 18:43:33,979] Trial 281 finished with value: 0.14233929682032592 and parameters: {'kernel': 'linear', 'C': 19.780410029358723, 'gamma': 0.0005454571067570395, 'epsilon': 0.09286528930778083}. Best is trial 126 with value: 0.13459441547810197.
[I 2024-12-03 18:43:34,191] Trial 280 finished with value: 0.14772104995252056 and parameters: {'kernel': 'linear', 'C': 34.351702010546695, 'gamma': 0.007908547971229536, 'epsilon': 0.13649757537524213}. Best is trial 126 with value: 0.13459441547810197.
[I 2024-12-03 18:43:34,527] Trial 271 finished with value: 0.1360821590668596 and parameters: {'kernel': 'linear', 'C': 29.038047515041484, 'gamma': 0.000899636726835644, 'epsilon': 0.051320384127011516}. Best is trial 126 with value: 0.13459441547810197.
[I 2024-12-03 18:43:35,132] Trial 282 finished with value: 0.14567071941498738 and parameters: {'kernel': 'linear', 'C': 2.616636610859299, 'gamma': 0.023888694819944347, 'epsilon': 0.08496053911083286}. Best is trial 126 with value: 0.13459441547810197.
[I 2024-12-03 18:43:35,498] Trial 225 finished with value: 0.13471322220340431 and parameters: {'kernel': 'linear', 'C': 37.50468838825609, 'gamma': 0.00048062529035860184, 'epsilon': 0.03933580321440908}. Best is trial 126 with value: 0.13459441547810197.
[I 2024-12-03 18:43:36,130] Trial 286 finished with value: 1.0664909373786353 and parameters: {'kernel': 'poly', 'C': 71.17352124212518, 'gamma': 0.0009720528881884396, 'epsilon': 0.2642166428090261}. Best is trial 126 with value: 0.13459441547810197.
[I 2024-12-03 18:43:36,169] Trial 191 finished with value: 0.13762921057751057 and parameters: {'kernel': 'linear', 'C': 75.11963243665464, 'gamma': 0.00019472819321236668, 'epsilon': 0.021174102087126907}. Best is trial 126 with value: 0.13459441547810197.
[I 2024-12-03 18:43:36,412] Trial 269 finished with value: 0.13518941332866694 and parameters: {'kernel': 'linear', 'C': 29.07649195160855, 'gamma': 0.028187838926405404, 'epsilon': 0.06418238344636976}. Best is trial 126 with value: 0.13459441547810197.
[I 2024-12-03 18:43:36,937] Trial 274 finished with value: 0.13599654554938026 and parameters: {'kernel': 'linear', 'C': 11.184819878237485, 'gamma': 0.0028991785898650722, 'epsilon': 0.031667901071364794}. Best is trial 126 with value: 0.13459441547810197.
[I 2024-12-03 18:43:37,137] Trial 285 finished with value: 0.199685141076766 and parameters: {'kernel': 'linear', 'C': 88.1013178705287, 'gamma': 0.000357065104198515, 'epsilon': 0.2516396548294699}. Best is trial 126 with value: 0.13459441547810197.
[I 2024-12-03 18:43:37,176] Trial 260 finished with value: 0.13687997802347607 and parameters: {'kernel': 'linear', 'C': 31.262968438293676, 'gamma': 0.0008092849421463001, 'epsilon': 0.04949384914441878}. Best is trial 126 with value: 0.13459441547810197.
[I 2024-12-03 18:43:37,286] Trial 288 finished with value: 0.48917560281270084 and parameters: {'kernel': 'poly', 'C': 0.0052757895450546806, 'gamma': 0.2563732653458256, 'epsilon': 0.7967946155122277}. Best is trial 126 with value: 0.13459441547810197.
[I 2024-12-03 18:43:37,792] Trial 267 finished with value: 0.13553206188656375 and parameters: {'kernel': 'linear', 'C': 12.02275242750126, 'gamma': 0.008204978408728244, 'epsilon': 0.03739709178683511}. Best is trial 126 with value: 0.13459441547810197.
[I 2024-12-03 18:43:38,277] Trial 130 finished with value: 0.13538550523106738 and parameters: {'kernel': 'linear', 'C': 89.89652143375251, 'gamma': 0.41387362636093294, 'epsilon': 0.02878544097289597}. Best is trial 126 with value: 0.13459441547810197.
[I 2024-12-03 18:43:38,457] Trial 291 finished with value: 0.5474469642397559 and parameters: {'kernel': 'linear', 'C': 0.06497110881974338, 'gamma': 0.00043871428869313774, 'epsilon': 0.9939133081010392}. Best is trial 126 with value: 0.13459441547810197.
[I 2024-12-03 18:43:39,367] Trial 279 finished with value: 0.13603931961511778 and parameters: {'kernel': 'linear', 'C': 8.772227010360373, 'gamma': 0.040191715506229735, 'epsilon': 0.03135439079883005}. Best is trial 126 with value: 0.13459441547810197.
[I 2024-12-03 18:43:39,498] Trial 283 finished with value: 0.13609958208074155 and parameters: {'kernel': 'linear', 'C': 6.567182841614292, 'gamma': 0.01034468020173055, 'epsilon': 0.052675344138692876}. Best is trial 126 with value: 0.13459441547810197.
[I 2024-12-03 18:43:39,771] Trial 290 finished with value: 0.20205466224959695 and parameters: {'kernel': 'linear', 'C': 84.51447537128354, 'gamma': 0.11844118643059533, 'epsilon': 0.25822398008475417}. Best is trial 126 with value: 0.13459441547810197.
[I 2024-12-03 18:43:41,152] Trial 276 finished with value: 0.13801734771424382 and parameters: {'kernel': 'linear', 'C': 11.146409776806303, 'gamma': 0.003976290297390848, 'epsilon': 0.015424029458315277}. Best is trial 126 with value: 0.13459441547810197.
[I 2024-12-03 18:43:41,155] Trial 300 finished with value: 0.33460119066539507 and parameters: {'kernel': 'linear', 'C': 0.026599861779235855, 'gamma': 0.49297625110605353, 'epsilon': 0.4017589662387034}. Best is trial 126 with value: 0.13459441547810197.
[I 2024-12-03 18:43:42,044] Trial 299 finished with value: 274.9089338705471 and parameters: {'kernel': 'sigmoid', 'C': 91.21275076015303, 'gamma': 0.006623381513988589, 'epsilon': 0.005570545352028804}. Best is trial 126 with value: 0.13459441547810197.
[I 2024-12-03 18:43:42,222] Trial 277 finished with value: 0.13633739807994455 and parameters: {'kernel': 'linear', 'C': 13.710240455920431, 'gamma': 0.002036945996608383, 'epsilon': 0.05209598857621083}. Best is trial 126 with value: 0.13459441547810197.
[I 2024-12-03 18:43:43,160] Trial 256 finished with value: 0.13527065356289475 and parameters: {'kernel': 'linear', 'C': 28.392232944987676, 'gamma': 0.010849494095769088, 'epsilon': 0.032994704156047}. Best is trial 126 with value: 0.13459441547810197.
[I 2024-12-03 18:43:44,476] Trial 143 finished with value: 0.1369150334652884 and parameters: {'kernel': 'linear', 'C': 95.66668063157044, 'gamma': 0.02591638247279917, 'epsilon': 0.024348978359990062}. Best is trial 126 with value: 0.13459441547810197.
[I 2024-12-03 18:43:46,660] Trial 206 finished with value: 0.13603496269288823 and parameters: {'kernel': 'linear', 'C': 60.383122983880064, 'gamma': 0.00873716093728824, 'epsilon': 0.025380196327948322}. Best is trial 126 with value: 0.13459441547810197.
[I 2024-12-03 18:43:46,663] Trial 295 finished with value: 0.13570274182908687 and parameters: {'kernel': 'linear', 'C': 7.0546447651045625, 'gamma': 0.010469207814454509, 'epsilon': 0.028574856076038702}. Best is trial 126 with value: 0.13459441547810197.
[I 2024-12-03 18:43:48,238] Trial 303 finished with value: 0.13947620436224226 and parameters: {'kernel': 'linear', 'C': 21.344287475421392, 'gamma': 0.010413003145277438, 'epsilon': 0.08526469576542454}. Best is trial 126 with value: 0.13459441547810197.
[I 2024-12-03 18:43:48,974] Trial 258 finished with value: 0.1350833673404821 and parameters: {'kernel': 'linear', 'C': 39.25981904967792, 'gamma': 0.029587744591901673, 'epsilon': 0.05585539677357203}. Best is trial 126 with value: 0.13459441547810197.
[I 2024-12-03 18:43:49,887] Trial 220 finished with value: 0.13707150598109252 and parameters: {'kernel': 'linear', 'C': 89.3161676805173, 'gamma': 0.019412270631290845, 'epsilon': 0.04512172177083604}. Best is trial 126 with value: 0.13459441547810197.
[I 2024-12-03 18:43:50,806] Trial 311 finished with value: 0.23287388419133917 and parameters: {'kernel': 'linear', 'C': 9.444406355463478, 'gamma': 0.041666593711077254, 'epsilon': 0.3328174481344915}. Best is trial 126 with value: 0.13459441547810197.
[I 2024-12-03 18:43:51,597] Trial 312 finished with value: 0.23396158072668616 and parameters: {'kernel': 'linear', 'C': 2.1537194576688976, 'gamma': 0.33310231665796153, 'epsilon': 0.29022507468931236}. Best is trial 126 with value: 0.13459441547810197.
[I 2024-12-03 18:43:51,852] Trial 205 finished with value: 0.13703942780922465 and parameters: {'kernel': 'linear', 'C': 93.57000023942769, 'gamma': 0.0015858791392464535, 'epsilon': 0.04535315153181554}. Best is trial 126 with value: 0.13459441547810197.
[I 2024-12-03 18:43:54,344] Trial 313 finished with value: 0.14424384843981172 and parameters: {'kernel': 'linear', 'C': 10.03631754273125, 'gamma': 0.05525247867184888, 'epsilon': 0.1182946122664968}. Best is trial 126 with value: 0.13459441547810197.
[I 2024-12-03 18:43:54,536] Trial 298 finished with value: 0.13793552909475415 and parameters: {'kernel': 'linear', 'C': 40.270468654338224, 'gamma': 0.04291752761462319, 'epsilon': 0.08132282760506925}. Best is trial 126 with value: 0.13459441547810197.
[I 2024-12-03 18:43:56,237] Trial 259 finished with value: 0.13547141176369124 and parameters: {'kernel': 'linear', 'C': 44.30694144129197, 'gamma': 0.17123126723216875, 'epsilon': 0.038039807334798566}. Best is trial 126 with value: 0.13459441547810197.
[I 2024-12-03 18:43:56,703] Trial 289 finished with value: 0.1353379547482246 and parameters: {'kernel': 'linear', 'C': 25.293120295299726, 'gamma': 0.09845047474419756, 'epsilon': 0.06530012453545718}. Best is trial 126 with value: 0.13459441547810197.
[I 2024-12-03 18:43:56,925] Trial 133 finished with value: 0.1357955512745295 and parameters: {'kernel': 'linear', 'C': 88.44738173791055, 'gamma': 0.00012704687642986506, 'epsilon': 0.025919433200822507}. Best is trial 126 with value: 0.13459441547810197.
[I 2024-12-03 18:43:57,715] Trial 318 finished with value: 1.3044596847117491 and parameters: {'kernel': 'sigmoid', 'C': 0.002930955039020835, 'gamma': 0.12640813042617569, 'epsilon': 0.6490280358283668}. Best is trial 126 with value: 0.13459441547810197.
[I 2024-12-03 18:43:57,847] Trial 302 finished with value: 0.32548752486976334 and parameters: {'kernel': 'poly', 'C': 7.495295189396288, 'gamma': 0.057143743059656166, 'epsilon': 0.03266791948631763}. Best is trial 126 with value: 0.13459441547810197.
[I 2024-12-03 18:43:59,057] Trial 305 finished with value: 0.13829484860566774 and parameters: {'kernel': 'linear', 'C': 10.986118614770609, 'gamma': 0.01533290606324793, 'epsilon': 0.010594541120170668}. Best is trial 126 with value: 0.13459441547810197.
[I 2024-12-03 18:44:00,175] Trial 316 finished with value: 0.13644050279681372 and parameters: {'kernel': 'linear', 'C': 7.7297415446129065, 'gamma': 0.05678408993955969, 'epsilon': 0.05351830972232598}. Best is trial 126 with value: 0.13459441547810197.
[I 2024-12-03 18:44:00,419] Trial 308 finished with value: 0.13713686885349352 and parameters: {'kernel': 'linear', 'C': 18.52726999975831, 'gamma': 0.06545420148259166, 'epsilon': 0.04833333195814594}. Best is trial 126 with value: 0.13459441547810197.
[I 2024-12-03 18:44:01,075] Trial 236 finished with value: 0.13782119032521373 and parameters: {'kernel': 'linear', 'C': 44.207098973801926, 'gamma': 0.014083644836639363, 'epsilon': 0.005707907498175815}. Best is trial 126 with value: 0.13459441547810197.
[I 2024-12-03 18:44:03,000] Trial 320 finished with value: 0.1410796519079345 and parameters: {'kernel': 'linear', 'C': 10.805917660168111, 'gamma': 0.3066955196159412, 'epsilon': 0.09915683400939924}. Best is trial 126 with value: 0.13459441547810197.
[I 2024-12-03 18:44:05,088] Trial 306 finished with value: 0.13563845281227727 and parameters: {'kernel': 'linear', 'C': 17.163348723553543, 'gamma': 0.019467493326260132, 'epsilon': 0.03747915807928738}. Best is trial 126 with value: 0.13459441547810197.
[I 2024-12-03 18:44:06,096] Trial 327 finished with value: 0.43203286661682644 and parameters: {'kernel': 'linear', 'C': 0.0014973218275905395, 'gamma': 0.35359996188789705, 'epsilon': 0.0049922290472679725}. Best is trial 126 with value: 0.13459441547810197.
[I 2024-12-03 18:44:07,021] Trial 328 finished with value: 1.1397890963770558 and parameters: {'kernel': 'poly', 'C': 0.5007198156168319, 'gamma': 0.0016812173645063668, 'epsilon': 0.2779977110594911}. Best is trial 126 with value: 0.13459441547810197.
[I 2024-12-03 18:44:08,091] Trial 326 finished with value: 0.1360016323302603 and parameters: {'kernel': 'linear', 'C': 12.42153359875416, 'gamma': 0.10911867221112088, 'epsilon': 0.07119966980614235}. Best is trial 126 with value: 0.13459441547810197.
[I 2024-12-03 18:44:08,649] Trial 255 finished with value: 0.13796894412641772 and parameters: {'kernel': 'linear', 'C': 40.66489449788193, 'gamma': 0.03121242576808902, 'epsilon': 0.014522581620684025}. Best is trial 126 with value: 0.13459441547810197.
[I 2024-12-03 18:44:08,900] Trial 270 finished with value: 0.13719525465973023 and parameters: {'kernel': 'linear', 'C': 77.18990229427727, 'gamma': 0.0007310292423346983, 'epsilon': 0.04781051784614874}. Best is trial 126 with value: 0.13459441547810197.
[I 2024-12-03 18:44:10,344] Trial 332 finished with value: 489.23248830154046 and parameters: {'kernel': 'sigmoid', 'C': 62.017897041530425, 'gamma': 0.013265294185517602, 'epsilon': 0.02925663054831671}. Best is trial 126 with value: 0.13459441547810197.
[I 2024-12-03 18:44:11,701] Trial 310 finished with value: 0.13528262230916172 and parameters: {'kernel': 'linear', 'C': 31.757193036284356, 'gamma': 0.0235805024517132, 'epsilon': 0.05993166684272456}. Best is trial 126 with value: 0.13459441547810197.
[I 2024-12-03 18:44:11,827] Trial 292 finished with value: 0.13510269830138327 and parameters: {'kernel': 'linear', 'C': 54.903315841199486, 'gamma': 0.29251623651905956, 'epsilon': 0.054791386983690855}. Best is trial 126 with value: 0.13459441547810197.
[I 2024-12-03 18:44:12,503] Trial 284 finished with value: 0.13790984266512035 and parameters: {'kernel': 'linear', 'C': 46.17932729395279, 'gamma': 0.003632101664970278, 'epsilon': 0.021209560212781507}. Best is trial 126 with value: 0.13459441547810197.
[I 2024-12-03 18:44:12,930] Trial 294 finished with value: 0.13518766515497863 and parameters: {'kernel': 'linear', 'C': 68.39216905364519, 'gamma': 0.014651062852873783, 'epsilon': 0.06117103569710544}. Best is trial 126 with value: 0.13459441547810197.
