[I 2024-12-04 11:56:24,818] Trial 80 finished with value: 0.3303291271750314 and parameters: {'n_estimators': 618, 'max_depth': 50, 'min_samples_split': 11, 'min_samples_leaf': 1, 'max_features': 'sqrt', 'bootstrap': False, 'criterion': 'squared_error'}. Best is trial 74 with value: 0.30055921487811155.
[I 2024-12-04 11:56:24,843] Trial 75 finished with value: 0.36245298543003085 and parameters: {'n_estimators': 211, 'max_depth': 47, 'min_samples_split': 8, 'min_samples_leaf': 1, 'max_features': 'sqrt', 'bootstrap': True, 'criterion': 'absolute_error'}. Best is trial 74 with value: 0.30055921487811155.
[I 2024-12-04 11:56:25,680] Trial 76 finished with value: 0.31893025460273144 and parameters: {'n_estimators': 351, 'max_depth': 48, 'min_samples_split': 8, 'min_samples_leaf': 1, 'max_features': 'sqrt', 'bootstrap': False, 'criterion': 'squared_error'}. Best is trial 74 with value: 0.30055921487811155.
[I 2024-12-04 11:56:26,636] Trial 78 finished with value: 0.31103870135437717 and parameters: {'n_estimators': 647, 'max_depth': 42, 'min_samples_split': 4, 'min_samples_leaf': 1, 'max_features': 'sqrt', 'bootstrap': False, 'criterion': 'squared_error'}. Best is trial 74 with value: 0.30055921487811155.
[I 2024-12-04 11:56:27,463] Trial 85 finished with value: 0.3126198416058791 and parameters: {'n_estimators': 142, 'max_depth': 40, 'min_samples_split': 4, 'min_samples_leaf': 1, 'max_features': 'sqrt', 'bootstrap': False, 'criterion': 'squared_error'}. Best is trial 74 with value: 0.30055921487811155.
[I 2024-12-04 11:56:27,529] Trial 79 finished with value: 0.38513756356242923 and parameters: {'n_estimators': 636, 'max_depth': 45, 'min_samples_split': 6, 'min_samples_leaf': 1, 'max_features': None, 'bootstrap': False, 'criterion': 'squared_error'}. Best is trial 74 with value: 0.30055921487811155.
[I 2024-12-04 11:56:29,268] Trial 65 finished with value: 0.42457741559610823 and parameters: {'n_estimators': 938, 'max_depth': 28, 'min_samples_split': 13, 'min_samples_leaf': 3, 'max_features': None, 'bootstrap': False, 'criterion': 'squared_error'}. Best is trial 74 with value: 0.30055921487811155.
[I 2024-12-04 11:56:30,775] Trial 81 finished with value: 0.3920182473261652 and parameters: {'n_estimators': 221, 'max_depth': 43, 'min_samples_split': 19, 'min_samples_leaf': 1, 'max_features': 'sqrt', 'bootstrap': True, 'criterion': 'squared_error'}. Best is trial 86 with value: 0.2953333358123381.
[I 2024-12-04 11:56:30,926] Trial 86 finished with value: 0.2953333358123381 and parameters: {'n_estimators': 640, 'max_depth': 47, 'min_samples_split': 3, 'min_samples_leaf': 1, 'max_features': 'sqrt', 'bootstrap': False, 'criterion': 'squared_error'}. Best is trial 86 with value: 0.2953333358123381.
[I 2024-12-04 11:56:31,166] Trial 91 finished with value: 0.4419477970059622 and parameters: {'n_estimators': 476, 'max_depth': 42, 'min_samples_split': 6, 'min_samples_leaf': 2, 'max_features': 'sqrt', 'bootstrap': False, 'criterion': 'squared_error'}. Best is trial 86 with value: 0.2953333358123381.
[I 2024-12-04 11:56:32,079] Trial 83 finished with value: 0.33204250472427055 and parameters: {'n_estimators': 597, 'max_depth': 47, 'min_samples_split': 5, 'min_samples_leaf': 1, 'max_features': 'sqrt', 'bootstrap': True, 'criterion': 'squared_error'}. Best is trial 86 with value: 0.2953333358123381.
[I 2024-12-04 11:56:32,103] Trial 87 finished with value: 0.3325787442038792 and parameters: {'n_estimators': 932, 'max_depth': 41, 'min_samples_split': 8, 'min_samples_leaf': 1, 'max_features': 'sqrt', 'bootstrap': False, 'criterion': 'squared_error'}. Best is trial 86 with value: 0.2953333358123381.
[I 2024-12-04 11:56:32,836] Trial 84 finished with value: 0.3670677117221476 and parameters: {'n_estimators': 973, 'max_depth': 29, 'min_samples_split': 2, 'min_samples_leaf': 1, 'max_features': 'sqrt', 'bootstrap': False, 'criterion': 'squared_error'}. Best is trial 86 with value: 0.2953333358123381.
[I 2024-12-04 11:56:32,839] Trial 99 finished with value: 0.32677934481274945 and parameters: {'n_estimators': 114, 'max_depth': 48, 'min_samples_split': 5, 'min_samples_leaf': 1, 'max_features': 'sqrt', 'bootstrap': True, 'criterion': 'squared_error'}. Best is trial 86 with value: 0.2953333358123381.
[I 2024-12-04 11:56:33,216] Trial 94 finished with value: 0.3194731380259416 and parameters: {'n_estimators': 652, 'max_depth': 50, 'min_samples_split': 9, 'min_samples_leaf': 1, 'max_features': 'sqrt', 'bootstrap': False, 'criterion': 'squared_error'}. Best is trial 86 with value: 0.2953333358123381.
[I 2024-12-04 11:56:33,425] Trial 90 finished with value: 0.3829860465024766 and parameters: {'n_estimators': 642, 'max_depth': 49, 'min_samples_split': 3, 'min_samples_leaf': 1, 'max_features': 'log2', 'bootstrap': False, 'criterion': 'squared_error'}. Best is trial 86 with value: 0.2953333358123381.
[I 2024-12-04 11:56:33,894] Trial 88 finished with value: 0.38094324383268413 and parameters: {'n_estimators': 205, 'max_depth': 43, 'min_samples_split': 3, 'min_samples_leaf': 1, 'max_features': None, 'bootstrap': False, 'criterion': 'squared_error'}. Best is trial 86 with value: 0.2953333358123381.
[I 2024-12-04 11:56:33,902] Trial 93 finished with value: 0.3071845486549943 and parameters: {'n_estimators': 139, 'max_depth': 42, 'min_samples_split': 2, 'min_samples_leaf': 1, 'max_features': 'sqrt', 'bootstrap': False, 'criterion': 'squared_error'}. Best is trial 86 with value: 0.2953333358123381.
[I 2024-12-04 11:56:34,648] Trial 82 finished with value: 0.4241136719060423 and parameters: {'n_estimators': 991, 'max_depth': 42, 'min_samples_split': 17, 'min_samples_leaf': 1, 'max_features': None, 'bootstrap': False, 'criterion': 'squared_error'}. Best is trial 86 with value: 0.2953333358123381.
[I 2024-12-04 11:56:34,694] Trial 96 finished with value: 0.2986736411312632 and parameters: {'n_estimators': 385, 'max_depth': 45, 'min_samples_split': 3, 'min_samples_leaf': 1, 'max_features': 'sqrt', 'bootstrap': False, 'criterion': 'squared_error'}. Best is trial 86 with value: 0.2953333358123381.
[I 2024-12-04 11:56:36,139] Trial 97 finished with value: 0.36834820582113964 and parameters: {'n_estimators': 205, 'max_depth': 30, 'min_samples_split': 5, 'min_samples_leaf': 1, 'max_features': 'sqrt', 'bootstrap': False, 'criterion': 'squared_error'}. Best is trial 86 with value: 0.2953333358123381.
[I 2024-12-04 11:56:36,217] Trial 92 finished with value: 0.3066367013027102 and parameters: {'n_estimators': 563, 'max_depth': 43, 'min_samples_split': 4, 'min_samples_leaf': 1, 'max_features': 'sqrt', 'bootstrap': False, 'criterion': 'squared_error'}. Best is trial 86 with value: 0.2953333358123381.
[I 2024-12-04 11:56:36,423] Trial 89 finished with value: 0.4134612760072895 and parameters: {'n_estimators': 827, 'max_depth': 43, 'min_samples_split': 2, 'min_samples_leaf': 1, 'max_features': 'log2', 'bootstrap': False, 'criterion': 'squared_error'}. Best is trial 86 with value: 0.2953333358123381.
[I 2024-12-04 11:56:37,461] Trial 103 finished with value: 0.3106813361897728 and parameters: {'n_estimators': 134, 'max_depth': 42, 'min_samples_split': 4, 'min_samples_leaf': 1, 'max_features': 'sqrt', 'bootstrap': False, 'criterion': 'squared_error'}. Best is trial 86 with value: 0.2953333358123381.
[I 2024-12-04 11:56:38,089] Trial 102 finished with value: 0.2960477685119199 and parameters: {'n_estimators': 181, 'max_depth': 48, 'min_samples_split': 2, 'min_samples_leaf': 1, 'max_features': 'sqrt', 'bootstrap': False, 'criterion': 'squared_error'}. Best is trial 86 with value: 0.2953333358123381.
[I 2024-12-04 11:56:38,243] Trial 98 finished with value: 0.3088737124865962 and parameters: {'n_estimators': 660, 'max_depth': 40, 'min_samples_split': 3, 'min_samples_leaf': 1, 'max_features': 'sqrt', 'bootstrap': False, 'criterion': 'squared_error'}. Best is trial 86 with value: 0.2953333358123381.
[I 2024-12-04 11:56:39,227] Trial 109 finished with value: 0.4945126907279934 and parameters: {'n_estimators': 159, 'max_depth': 32, 'min_samples_split': 2, 'min_samples_leaf': 1, 'max_features': 'log2', 'bootstrap': False, 'criterion': 'squared_error'}. Best is trial 86 with value: 0.2953333358123381.
[I 2024-12-04 11:56:39,970] Trial 95 finished with value: 0.4227657044651427 and parameters: {'n_estimators': 421, 'max_depth': 49, 'min_samples_split': 11, 'min_samples_leaf': 3, 'max_features': None, 'bootstrap': False, 'criterion': 'squared_error'}. Best is trial 86 with value: 0.2953333358123381.
[I 2024-12-04 11:56:40,681] Trial 101 finished with value: 0.29703853601922287 and parameters: {'n_estimators': 589, 'max_depth': 49, 'min_samples_split': 2, 'min_samples_leaf': 1, 'max_features': 'sqrt', 'bootstrap': False, 'criterion': 'squared_error'}. Best is trial 86 with value: 0.2953333358123381.
[I 2024-12-04 11:56:41,214] Trial 111 finished with value: 0.569190498423475 and parameters: {'n_estimators': 120, 'max_depth': 44, 'min_samples_split': 2, 'min_samples_leaf': 4, 'max_features': 'sqrt', 'bootstrap': False, 'criterion': 'squared_error'}. Best is trial 86 with value: 0.2953333358123381.
[I 2024-12-04 11:56:43,606] Trial 105 finished with value: 0.3082297141015879 and parameters: {'n_estimators': 456, 'max_depth': 40, 'min_samples_split': 3, 'min_samples_leaf': 1, 'max_features': 'sqrt', 'bootstrap': False, 'criterion': 'squared_error'}. Best is trial 86 with value: 0.2953333358123381.
[I 2024-12-04 11:56:43,608] Trial 108 finished with value: 0.3020857301442681 and parameters: {'n_estimators': 184, 'max_depth': 46, 'min_samples_split': 2, 'min_samples_leaf': 1, 'max_features': 'sqrt', 'bootstrap': False, 'criterion': 'squared_error'}. Best is trial 86 with value: 0.2953333358123381.
[I 2024-12-04 11:56:43,994] Trial 112 finished with value: 0.299057175415464 and parameters: {'n_estimators': 229, 'max_depth': 50, 'min_samples_split': 2, 'min_samples_leaf': 1, 'max_features': 'sqrt', 'bootstrap': False, 'criterion': 'squared_error'}. Best is trial 86 with value: 0.2953333358123381.
[I 2024-12-04 11:56:44,349] Trial 113 finished with value: 0.36242936905286194 and parameters: {'n_estimators': 130, 'max_depth': 34, 'min_samples_split': 2, 'min_samples_leaf': 1, 'max_features': 'sqrt', 'bootstrap': True, 'criterion': 'squared_error'}. Best is trial 86 with value: 0.2953333358123381.
[I 2024-12-04 11:56:44,626] Trial 100 finished with value: 0.33167759605110986 and parameters: {'n_estimators': 382, 'max_depth': 35, 'min_samples_split': 2, 'min_samples_leaf': 1, 'max_features': 'sqrt', 'bootstrap': False, 'criterion': 'squared_error'}. Best is trial 86 with value: 0.2953333358123381.
[I 2024-12-04 11:56:45,553] Trial 70 finished with value: 0.31352529824707787 and parameters: {'n_estimators': 742, 'max_depth': 44, 'min_samples_split': 3, 'min_samples_leaf': 1, 'max_features': 'sqrt', 'bootstrap': False, 'criterion': 'absolute_error'}. Best is trial 86 with value: 0.2953333358123381.
[I 2024-12-04 11:56:46,806] Trial 67 finished with value: 0.31968501511706204 and parameters: {'n_estimators': 839, 'max_depth': 49, 'min_samples_split': 6, 'min_samples_leaf': 1, 'max_features': 'sqrt', 'bootstrap': False, 'criterion': 'absolute_error'}. Best is trial 86 with value: 0.2953333358123381.
[I 2024-12-04 11:56:48,090] Trial 106 finished with value: 0.35381682419075694 and parameters: {'n_estimators': 238, 'max_depth': 35, 'min_samples_split': 5, 'min_samples_leaf': 1, 'max_features': 'sqrt', 'bootstrap': False, 'criterion': 'absolute_error'}. Best is trial 86 with value: 0.2953333358123381.
[I 2024-12-04 11:56:48,483] Trial 107 finished with value: 0.301532217523247 and parameters: {'n_estimators': 684, 'max_depth': 50, 'min_samples_split': 4, 'min_samples_leaf': 1, 'max_features': 'sqrt', 'bootstrap': False, 'criterion': 'squared_error'}. Best is trial 86 with value: 0.2953333358123381.
[I 2024-12-04 11:56:49,651] Trial 117 finished with value: 0.3058463283568799 and parameters: {'n_estimators': 358, 'max_depth': 45, 'min_samples_split': 4, 'min_samples_leaf': 1, 'max_features': 'sqrt', 'bootstrap': False, 'criterion': 'squared_error'}. Best is trial 86 with value: 0.2953333358123381.
[I 2024-12-04 11:56:49,809] Trial 121 finished with value: 0.30019316181169775 and parameters: {'n_estimators': 228, 'max_depth': 45, 'min_samples_split': 2, 'min_samples_leaf': 1, 'max_features': 'sqrt', 'bootstrap': False, 'criterion': 'squared_error'}. Best is trial 86 with value: 0.2953333358123381.
[I 2024-12-04 11:56:50,123] Trial 120 finished with value: 0.2992076746757976 and parameters: {'n_estimators': 103, 'max_depth': 50, 'min_samples_split': 2, 'min_samples_leaf': 1, 'max_features': 'sqrt', 'bootstrap': False, 'criterion': 'squared_error'}. Best is trial 86 with value: 0.2953333358123381.
[I 2024-12-04 11:56:50,170] Trial 114 finished with value: 0.31382973952279153 and parameters: {'n_estimators': 582, 'max_depth': 40, 'min_samples_split': 2, 'min_samples_leaf': 1, 'max_features': 'sqrt', 'bootstrap': False, 'criterion': 'squared_error'}. Best is trial 86 with value: 0.2953333358123381.
[I 2024-12-04 11:56:51,374] Trial 119 finished with value: 0.29604512638720826 and parameters: {'n_estimators': 612, 'max_depth': 48, 'min_samples_split': 2, 'min_samples_leaf': 1, 'max_features': 'sqrt', 'bootstrap': False, 'criterion': 'squared_error'}. Best is trial 86 with value: 0.2953333358123381.
[I 2024-12-04 11:56:51,429] Trial 116 finished with value: 0.6914841868401097 and parameters: {'n_estimators': 345, 'max_depth': 47, 'min_samples_split': 2, 'min_samples_leaf': 2, 'max_features': 'log2', 'bootstrap': False, 'criterion': 'squared_error'}. Best is trial 86 with value: 0.2953333358123381.
[I 2024-12-04 11:56:51,784] Trial 128 finished with value: 0.6925974007348158 and parameters: {'n_estimators': 392, 'max_depth': 50, 'min_samples_split': 2, 'min_samples_leaf': 2, 'max_features': 'log2', 'bootstrap': False, 'criterion': 'squared_error'}. Best is trial 86 with value: 0.2953333358123381.
[I 2024-12-04 11:56:51,933] Trial 115 finished with value: 0.2982685191953895 and parameters: {'n_estimators': 518, 'max_depth': 50, 'min_samples_split': 2, 'min_samples_leaf': 1, 'max_features': 'sqrt', 'bootstrap': False, 'criterion': 'squared_error'}. Best is trial 86 with value: 0.2953333358123381.
[I 2024-12-04 11:56:51,941] Trial 127 finished with value: 0.299128194843579 and parameters: {'n_estimators': 277, 'max_depth': 50, 'min_samples_split': 2, 'min_samples_leaf': 1, 'max_features': 'sqrt', 'bootstrap': False, 'criterion': 'squared_error'}. Best is trial 86 with value: 0.2953333358123381.
[I 2024-12-04 11:56:52,293] Trial 110 finished with value: 0.3022542342152083 and parameters: {'n_estimators': 810, 'max_depth': 46, 'min_samples_split': 2, 'min_samples_leaf': 1, 'max_features': 'sqrt', 'bootstrap': False, 'criterion': 'squared_error'}. Best is trial 86 with value: 0.2953333358123381.
[I 2024-12-04 11:56:52,299] Trial 123 finished with value: 0.31864476859503554 and parameters: {'n_estimators': 785, 'max_depth': 37, 'min_samples_split': 3, 'min_samples_leaf': 1, 'max_features': 'sqrt', 'bootstrap': False, 'criterion': 'squared_error'}. Best is trial 86 with value: 0.2953333358123381.
[I 2024-12-04 11:56:53,045] Trial 118 finished with value: 0.30153378359051214 and parameters: {'n_estimators': 631, 'max_depth': 48, 'min_samples_split': 4, 'min_samples_leaf': 1, 'max_features': 'sqrt', 'bootstrap': False, 'criterion': 'squared_error'}. Best is trial 86 with value: 0.2953333358123381.
[I 2024-12-04 11:56:55,412] Trial 130 finished with value: 0.30229507098875824 and parameters: {'n_estimators': 185, 'max_depth': 46, 'min_samples_split': 2, 'min_samples_leaf': 1, 'max_features': 'sqrt', 'bootstrap': False, 'criterion': 'squared_error'}. Best is trial 86 with value: 0.2953333358123381.
[I 2024-12-04 11:56:55,546] Trial 129 finished with value: 0.4403238263522375 and parameters: {'n_estimators': 463, 'max_depth': 50, 'min_samples_split': 2, 'min_samples_leaf': 2, 'max_features': 'sqrt', 'bootstrap': False, 'criterion': 'squared_error'}. Best is trial 86 with value: 0.2953333358123381.
[I 2024-12-04 11:56:58,107] Trial 104 finished with value: 0.31322817942625464 and parameters: {'n_estimators': 415, 'max_depth': 44, 'min_samples_split': 3, 'min_samples_leaf': 1, 'max_features': 'sqrt', 'bootstrap': False, 'criterion': 'absolute_error'}. Best is trial 86 with value: 0.2953333358123381.
[I 2024-12-04 11:56:58,448] Trial 135 finished with value: 0.3044727827635552 and parameters: {'n_estimators': 404, 'max_depth': 44, 'min_samples_split': 2, 'min_samples_leaf': 1, 'max_features': 'sqrt', 'bootstrap': False, 'criterion': 'squared_error'}. Best is trial 133 with value: 0.29356449467344287.
[I 2024-12-04 11:56:58,906] Trial 134 finished with value: 0.2995819751677774 and parameters: {'n_estimators': 113, 'max_depth': 50, 'min_samples_split': 2, 'min_samples_leaf': 1, 'max_features': 'sqrt', 'bootstrap': False, 'criterion': 'squared_error'}. Best is trial 133 with value: 0.29356449467344287.
[I 2024-12-04 11:56:58,976] Trial 125 finished with value: 0.3195212974337432 and parameters: {'n_estimators': 109, 'max_depth': 43, 'min_samples_split': 2, 'min_samples_leaf': 1, 'max_features': 'sqrt', 'bootstrap': False, 'criterion': 'absolute_error'}. Best is trial 133 with value: 0.29356449467344287.
[I 2024-12-04 11:56:58,997] Trial 141 finished with value: 0.4436667718399004 and parameters: {'n_estimators': 217, 'max_depth': 48, 'min_samples_split': 2, 'min_samples_leaf': 2, 'max_features': 'sqrt', 'bootstrap': False, 'criterion': 'squared_error'}. Best is trial 133 with value: 0.29356449467344287.
[I 2024-12-04 11:56:59,053] Trial 136 finished with value: 0.29786047993363607 and parameters: {'n_estimators': 388, 'max_depth': 50, 'min_samples_split': 2, 'min_samples_leaf': 1, 'max_features': 'sqrt', 'bootstrap': False, 'criterion': 'squared_error'}. Best is trial 133 with value: 0.29356449467344287.
[I 2024-12-04 11:56:59,151] Trial 133 finished with value: 0.29356449467344287 and parameters: {'n_estimators': 185, 'max_depth': 50, 'min_samples_split': 3, 'min_samples_leaf': 1, 'max_features': 'sqrt', 'bootstrap': False, 'criterion': 'squared_error'}. Best is trial 133 with value: 0.29356449467344287.
[I 2024-12-04 11:57:00,825] Trial 122 finished with value: 0.579215742595401 and parameters: {'n_estimators': 756, 'max_depth': 47, 'min_samples_split': 2, 'min_samples_leaf': 3, 'max_features': 'sqrt', 'bootstrap': True, 'criterion': 'absolute_error'}. Best is trial 133 with value: 0.29356449467344287.
[I 2024-12-04 11:57:01,967] Trial 124 finished with value: 0.296957968011347 and parameters: {'n_estimators': 605, 'max_depth': 49, 'min_samples_split': 2, 'min_samples_leaf': 1, 'max_features': 'sqrt', 'bootstrap': False, 'criterion': 'squared_error'}. Best is trial 133 with value: 0.29356449467344287.
[I 2024-12-04 11:57:02,086] Trial 142 finished with value: 0.29749864299612966 and parameters: {'n_estimators': 120, 'max_depth': 49, 'min_samples_split': 2, 'min_samples_leaf': 1, 'max_features': 'sqrt', 'bootstrap': False, 'criterion': 'squared_error'}. Best is trial 133 with value: 0.29356449467344287.
[I 2024-12-04 11:57:02,587] Trial 146 finished with value: 0.2966349322227096 and parameters: {'n_estimators': 120, 'max_depth': 50, 'min_samples_split': 3, 'min_samples_leaf': 1, 'max_features': 'sqrt', 'bootstrap': False, 'criterion': 'squared_error'}. Best is trial 133 with value: 0.29356449467344287.
[I 2024-12-04 11:57:02,989] Trial 145 finished with value: 0.30624502130524556 and parameters: {'n_estimators': 572, 'max_depth': 50, 'min_samples_split': 6, 'min_samples_leaf': 1, 'max_features': 'sqrt', 'bootstrap': False, 'criterion': 'squared_error'}. Best is trial 133 with value: 0.29356449467344287.
[I 2024-12-04 11:57:03,144] Trial 131 finished with value: 0.3881630193822695 and parameters: {'n_estimators': 532, 'max_depth': 43, 'min_samples_split': 2, 'min_samples_leaf': 1, 'max_features': None, 'bootstrap': False, 'criterion': 'squared_error'}. Best is trial 133 with value: 0.29356449467344287.
[I 2024-12-04 11:57:03,409] Trial 139 finished with value: 0.2995888831040162 and parameters: {'n_estimators': 101, 'max_depth': 50, 'min_samples_split': 2, 'min_samples_leaf': 1, 'max_features': 'sqrt', 'bootstrap': False, 'criterion': 'squared_error'}. Best is trial 133 with value: 0.29356449467344287.
[I 2024-12-04 11:57:04,732] Trial 126 finished with value: 0.9160032318088404 and parameters: {'n_estimators': 955, 'max_depth': 48, 'min_samples_split': 12, 'min_samples_leaf': 4, 'max_features': 'log2', 'bootstrap': True, 'criterion': 'absolute_error'}. Best is trial 133 with value: 0.29356449467344287.
[I 2024-12-04 11:57:04,787] Trial 138 finished with value: 0.2981691745408633 and parameters: {'n_estimators': 544, 'max_depth': 50, 'min_samples_split': 2, 'min_samples_leaf': 1, 'max_features': 'sqrt', 'bootstrap': False, 'criterion': 'squared_error'}. Best is trial 133 with value: 0.29356449467344287.
[I 2024-12-04 11:57:05,138] Trial 137 finished with value: 0.5201686380082381 and parameters: {'n_estimators': 267, 'max_depth': 22, 'min_samples_split': 32, 'min_samples_leaf': 1, 'max_features': 'sqrt', 'bootstrap': True, 'criterion': 'absolute_error'}. Best is trial 133 with value: 0.29356449467344287.
[I 2024-12-04 11:57:05,582] Trial 144 finished with value: 0.39329998346996803 and parameters: {'n_estimators': 134, 'max_depth': 49, 'min_samples_split': 2, 'min_samples_leaf': 1, 'max_features': 'log2', 'bootstrap': False, 'criterion': 'squared_error'}. Best is trial 133 with value: 0.29356449467344287.
[I 2024-12-04 11:57:06,024] Trial 147 finished with value: 0.41625441720299916 and parameters: {'n_estimators': 158, 'max_depth': 47, 'min_samples_split': 2, 'min_samples_leaf': 2, 'max_features': None, 'bootstrap': False, 'criterion': 'squared_error'}. Best is trial 133 with value: 0.29356449467344287.
