[I 2024-12-04 12:22:13,583] Trial 264 finished with value: 0.3731841319833462 and parameters: {'n_estimators': 1165, 'learning_rate': 0.03215393361182494, 'max_depth': 10, 'min_samples_split': 2, 'min_samples_leaf': 1, 'subsample': 0.9370393443946626, 'max_features': None}. Best is trial 212 with value: 0.23718385215198057.
[I 2024-12-04 12:22:15,152] Trial 268 finished with value: 0.2874696605221795 and parameters: {'n_estimators': 1225, 'learning_rate': 0.05105905415955795, 'max_depth': 12, 'min_samples_split': 2, 'min_samples_leaf': 1, 'subsample': 0.9984991062827488, 'max_features': 'sqrt'}. Best is trial 212 with value: 0.23718385215198057.
[I 2024-12-04 12:22:15,243] Trial 263 finished with value: 0.30593339191821717 and parameters: {'n_estimators': 1493, 'learning_rate': 0.03632643254375448, 'max_depth': 11, 'min_samples_split': 9, 'min_samples_leaf': 2, 'subsample': 0.9409662520931158, 'max_features': 'sqrt'}. Best is trial 212 with value: 0.23718385215198057.
[I 2024-12-04 12:22:15,561] Trial 273 finished with value: 0.2931039344687172 and parameters: {'n_estimators': 1166, 'learning_rate': 0.02423933863613051, 'max_depth': 10, 'min_samples_split': 7, 'min_samples_leaf': 2, 'subsample': 0.9651966185367908, 'max_features': 'sqrt'}. Best is trial 212 with value: 0.23718385215198057.
[I 2024-12-04 12:22:19,327] Trial 269 finished with value: 0.2646110115570047 and parameters: {'n_estimators': 1322, 'learning_rate': 0.043212358411253336, 'max_depth': 12, 'min_samples_split': 4, 'min_samples_leaf': 1, 'subsample': 0.9046143973039655, 'max_features': 'sqrt'}. Best is trial 212 with value: 0.23718385215198057.
[I 2024-12-04 12:22:22,684] Trial 266 finished with value: 0.2544459316557834 and parameters: {'n_estimators': 1485, 'learning_rate': 0.03570652728845468, 'max_depth': 11, 'min_samples_split': 4, 'min_samples_leaf': 1, 'subsample': 0.9872685313523075, 'max_features': 'sqrt'}. Best is trial 212 with value: 0.23718385215198057.
[I 2024-12-04 12:22:22,699] Trial 272 finished with value: 0.26136045257266655 and parameters: {'n_estimators': 1324, 'learning_rate': 0.024796144594429085, 'max_depth': 12, 'min_samples_split': 7, 'min_samples_leaf': 1, 'subsample': 0.9322150741087569, 'max_features': 'sqrt'}. Best is trial 212 with value: 0.23718385215198057.
[I 2024-12-04 12:22:23,370] Trial 271 finished with value: 0.2873346114965179 and parameters: {'n_estimators': 1302, 'learning_rate': 0.025356746050225167, 'max_depth': 8, 'min_samples_split': 6, 'min_samples_leaf': 1, 'subsample': 0.9835837989826923, 'max_features': 'sqrt'}. Best is trial 212 with value: 0.23718385215198057.
[I 2024-12-04 12:22:26,981] Trial 278 finished with value: 0.25805908996300037 and parameters: {'n_estimators': 1159, 'learning_rate': 0.03130328561719556, 'max_depth': 12, 'min_samples_split': 4, 'min_samples_leaf': 1, 'subsample': 0.9357146610048642, 'max_features': 'sqrt'}. Best is trial 212 with value: 0.23718385215198057.
[I 2024-12-04 12:22:30,471] Trial 282 finished with value: 0.2566341839242091 and parameters: {'n_estimators': 1129, 'learning_rate': 0.06104792074398316, 'max_depth': 10, 'min_samples_split': 7, 'min_samples_leaf': 1, 'subsample': 0.7884734055245401, 'max_features': 'sqrt'}. Best is trial 212 with value: 0.23718385215198057.
[I 2024-12-04 12:22:32,362] Trial 276 finished with value: 0.2718447888338458 and parameters: {'n_estimators': 1429, 'learning_rate': 0.06372325018833573, 'max_depth': 3, 'min_samples_split': 3, 'min_samples_leaf': 1, 'subsample': 0.6156159774749088, 'max_features': 'sqrt'}. Best is trial 212 with value: 0.23718385215198057.
[I 2024-12-04 12:22:34,330] Trial 277 finished with value: 0.2569985758427426 and parameters: {'n_estimators': 1432, 'learning_rate': 0.05287353921012093, 'max_depth': 11, 'min_samples_split': 14, 'min_samples_leaf': 1, 'subsample': 0.8914519644245781, 'max_features': 'log2'}. Best is trial 212 with value: 0.23718385215198057.
[I 2024-12-04 12:22:34,389] Trial 280 finished with value: 0.3599100947714771 and parameters: {'n_estimators': 1244, 'learning_rate': 0.0713605029198071, 'max_depth': 4, 'min_samples_split': 2, 'min_samples_leaf': 3, 'subsample': 0.7017645112043401, 'max_features': 'sqrt'}. Best is trial 212 with value: 0.23718385215198057.
[I 2024-12-04 12:22:36,394] Trial 270 finished with value: 0.41477532046246796 and parameters: {'n_estimators': 1482, 'learning_rate': 0.021249897242229258, 'max_depth': 6, 'min_samples_split': 6, 'min_samples_leaf': 2, 'subsample': 0.945319645774441, 'max_features': None}. Best is trial 212 with value: 0.23718385215198057.
[I 2024-12-04 12:22:39,771] Trial 279 finished with value: 0.4330576878868372 and parameters: {'n_estimators': 1215, 'learning_rate': 0.043776829148460254, 'max_depth': 12, 'min_samples_split': 4, 'min_samples_leaf': 2, 'subsample': 0.7532688199199498, 'max_features': None}. Best is trial 212 with value: 0.23718385215198057.
[I 2024-12-04 12:22:42,916] Trial 306 finished with value: 0.9009470762031961 and parameters: {'n_estimators': 227, 'learning_rate': 0.016479539956625388, 'max_depth': 6, 'min_samples_split': 3, 'min_samples_leaf': 7, 'subsample': 0.8096227231723857, 'max_features': 'sqrt'}. Best is trial 212 with value: 0.23718385215198057.
[I 2024-12-04 12:22:43,807] Trial 287 finished with value: 0.26364453422288603 and parameters: {'n_estimators': 1061, 'learning_rate': 0.09056628555011197, 'max_depth': 3, 'min_samples_split': 2, 'min_samples_leaf': 1, 'subsample': 0.650070619678047, 'max_features': 'sqrt'}. Best is trial 212 with value: 0.23718385215198057.
[I 2024-12-04 12:22:44,852] Trial 289 finished with value: 0.31085021851315914 and parameters: {'n_estimators': 1050, 'learning_rate': 0.022110763278870488, 'max_depth': 6, 'min_samples_split': 5, 'min_samples_leaf': 1, 'subsample': 0.7650982030023777, 'max_features': 'sqrt'}. Best is trial 212 with value: 0.23718385215198057.
[I 2024-12-04 12:22:48,466] Trial 285 finished with value: 0.300610561386843 and parameters: {'n_estimators': 1244, 'learning_rate': 0.09909363845786197, 'max_depth': 5, 'min_samples_split': 4, 'min_samples_leaf': 2, 'subsample': 0.7065645958434473, 'max_features': 'log2'}. Best is trial 212 with value: 0.23718385215198057.
[I 2024-12-04 12:22:48,495] Trial 281 finished with value: 0.2939377699502042 and parameters: {'n_estimators': 1456, 'learning_rate': 0.04784344109778077, 'max_depth': 11, 'min_samples_split': 11, 'min_samples_leaf': 2, 'subsample': 0.96882715457451, 'max_features': 'log2'}. Best is trial 212 with value: 0.23718385215198057.
[I 2024-12-04 12:22:50,098] Trial 286 finished with value: 0.2346395170810878 and parameters: {'n_estimators': 1209, 'learning_rate': 0.0679128839368169, 'max_depth': 9, 'min_samples_split': 2, 'min_samples_leaf': 1, 'subsample': 0.8736348609335429, 'max_features': 'sqrt'}. Best is trial 286 with value: 0.2346395170810878.
[I 2024-12-04 12:22:50,435] Trial 284 finished with value: 0.25140208756424937 and parameters: {'n_estimators': 1423, 'learning_rate': 0.03802193680318106, 'max_depth': 8, 'min_samples_split': 5, 'min_samples_leaf': 1, 'subsample': 0.8903068476422098, 'max_features': 'sqrt'}. Best is trial 286 with value: 0.2346395170810878.
[I 2024-12-04 12:22:56,001] Trial 291 finished with value: 0.3654980389938987 and parameters: {'n_estimators': 1124, 'learning_rate': 0.035322187907212005, 'max_depth': 8, 'min_samples_split': 9, 'min_samples_leaf': 3, 'subsample': 0.9031387760993412, 'max_features': 'sqrt'}. Best is trial 286 with value: 0.2346395170810878.
[I 2024-12-04 12:23:02,171] Trial 288 finished with value: 0.24301509892409065 and parameters: {'n_estimators': 1380, 'learning_rate': 0.031377122605412595, 'max_depth': 11, 'min_samples_split': 3, 'min_samples_leaf': 1, 'subsample': 0.7192579456985014, 'max_features': 'sqrt'}. Best is trial 286 with value: 0.2346395170810878.
[I 2024-12-04 12:23:04,481] Trial 290 finished with value: 0.25424600468764275 and parameters: {'n_estimators': 1366, 'learning_rate': 0.04352848755052251, 'max_depth': 6, 'min_samples_split': 8, 'min_samples_leaf': 1, 'subsample': 0.9425718260331258, 'max_features': 'sqrt'}. Best is trial 286 with value: 0.2346395170810878.
[I 2024-12-04 12:23:05,971] Trial 292 finished with value: 0.24099578442661287 and parameters: {'n_estimators': 1272, 'learning_rate': 0.0979750259727029, 'max_depth': 5, 'min_samples_split': 4, 'min_samples_leaf': 1, 'subsample': 0.6083823736667612, 'max_features': 'sqrt'}. Best is trial 286 with value: 0.2346395170810878.
[I 2024-12-04 12:23:05,973] Trial 293 finished with value: 0.24834905775945426 and parameters: {'n_estimators': 1241, 'learning_rate': 0.03759645504296544, 'max_depth': 10, 'min_samples_split': 6, 'min_samples_leaf': 1, 'subsample': 0.9344612185195336, 'max_features': 'sqrt'}. Best is trial 286 with value: 0.2346395170810878.
[I 2024-12-04 12:23:07,791] Trial 301 finished with value: 0.23777948848051766 and parameters: {'n_estimators': 788, 'learning_rate': 0.049730184472280975, 'max_depth': 8, 'min_samples_split': 2, 'min_samples_leaf': 1, 'subsample': 0.7666519124973996, 'max_features': 'sqrt'}. Best is trial 286 with value: 0.2346395170810878.
[I 2024-12-04 12:23:14,201] Trial 298 finished with value: 0.26839424508384363 and parameters: {'n_estimators': 1159, 'learning_rate': 0.02728324765390925, 'max_depth': 8, 'min_samples_split': 4, 'min_samples_leaf': 1, 'subsample': 0.7324338334731095, 'max_features': 'sqrt'}. Best is trial 286 with value: 0.2346395170810878.
[I 2024-12-04 12:23:14,939] Trial 295 finished with value: 0.2406584188760311 and parameters: {'n_estimators': 1347, 'learning_rate': 0.04852567517776834, 'max_depth': 8, 'min_samples_split': 2, 'min_samples_leaf': 1, 'subsample': 0.8289110417076453, 'max_features': 'sqrt'}. Best is trial 286 with value: 0.2346395170810878.
[I 2024-12-04 12:23:14,947] Trial 294 finished with value: 0.24343113691329216 and parameters: {'n_estimators': 1424, 'learning_rate': 0.05734357211645042, 'max_depth': 9, 'min_samples_split': 3, 'min_samples_leaf': 1, 'subsample': 0.7088521436047681, 'max_features': 'sqrt'}. Best is trial 286 with value: 0.2346395170810878.
[I 2024-12-04 12:23:19,743] Trial 299 finished with value: 0.3611732590583316 and parameters: {'n_estimators': 1221, 'learning_rate': 0.027128832128792718, 'max_depth': 12, 'min_samples_split': 6, 'min_samples_leaf': 3, 'subsample': 0.7389079294077235, 'max_features': 'sqrt'}. Best is trial 286 with value: 0.2346395170810878.
[I 2024-12-04 12:23:22,881] Trial 314 finished with value: 0.24908908023477044 and parameters: {'n_estimators': 780, 'learning_rate': 0.04201735841742602, 'max_depth': 11, 'min_samples_split': 4, 'min_samples_leaf': 1, 'subsample': 0.6983231453963582, 'max_features': 'sqrt'}. Best is trial 286 with value: 0.2346395170810878.
[I 2024-12-04 12:23:24,453] Trial 296 finished with value: 0.258421869931929 and parameters: {'n_estimators': 1497, 'learning_rate': 0.09572443040375211, 'max_depth': 4, 'min_samples_split': 5, 'min_samples_leaf': 1, 'subsample': 0.7231905264771162, 'max_features': 'sqrt'}. Best is trial 286 with value: 0.2346395170810878.
[I 2024-12-04 12:23:25,946] Trial 297 finished with value: 0.2883189280423033 and parameters: {'n_estimators': 1377, 'learning_rate': 0.054177159516523944, 'max_depth': 6, 'min_samples_split': 6, 'min_samples_leaf': 2, 'subsample': 0.7597368086849203, 'max_features': 'sqrt'}. Best is trial 286 with value: 0.2346395170810878.
[I 2024-12-04 12:23:26,748] Trial 303 finished with value: 0.6069792115663207 and parameters: {'n_estimators': 1224, 'learning_rate': 0.028473952567868256, 'max_depth': 12, 'min_samples_split': 18, 'min_samples_leaf': 7, 'subsample': 0.7566617294369657, 'max_features': 'log2'}. Best is trial 286 with value: 0.2346395170810878.
[I 2024-12-04 12:23:27,723] Trial 300 finished with value: 0.23199682095001278 and parameters: {'n_estimators': 1307, 'learning_rate': 0.06230463920023488, 'max_depth': 7, 'min_samples_split': 2, 'min_samples_leaf': 1, 'subsample': 0.8013897138266887, 'max_features': 'sqrt'}. Best is trial 300 with value: 0.23199682095001278.
[I 2024-12-04 12:23:31,490] Trial 309 finished with value: 0.2665623160873331 and parameters: {'n_estimators': 1081, 'learning_rate': 0.023945088001040237, 'max_depth': 12, 'min_samples_split': 6, 'min_samples_leaf': 1, 'subsample': 0.8786000816799967, 'max_features': 'sqrt'}. Best is trial 300 with value: 0.23199682095001278.
[I 2024-12-04 12:23:35,274] Trial 320 finished with value: 0.3553987219577585 and parameters: {'n_estimators': 784, 'learning_rate': 0.06719806020762294, 'max_depth': 12, 'min_samples_split': 9, 'min_samples_leaf': 3, 'subsample': 0.7999091675590787, 'max_features': 'sqrt'}. Best is trial 300 with value: 0.23199682095001278.
[I 2024-12-04 12:23:36,473] Trial 302 finished with value: 0.30560820768256286 and parameters: {'n_estimators': 1334, 'learning_rate': 0.09808002986486114, 'max_depth': 5, 'min_samples_split': 6, 'min_samples_leaf': 1, 'subsample': 0.8766122019718549, 'max_features': None}. Best is trial 300 with value: 0.23199682095001278.
[I 2024-12-04 12:23:37,531] Trial 305 finished with value: 0.2740359521530894 and parameters: {'n_estimators': 1312, 'learning_rate': 0.03297165301736513, 'max_depth': 12, 'min_samples_split': 3, 'min_samples_leaf': 1, 'subsample': 0.9902357711182777, 'max_features': 'sqrt'}. Best is trial 300 with value: 0.23199682095001278.
[I 2024-12-04 12:23:38,422] Trial 304 finished with value: 0.28625776399541414 and parameters: {'n_estimators': 1397, 'learning_rate': 0.023001367148446986, 'max_depth': 12, 'min_samples_split': 7, 'min_samples_leaf': 2, 'subsample': 0.961735947800655, 'max_features': 'sqrt'}. Best is trial 300 with value: 0.23199682095001278.
[I 2024-12-04 12:23:39,477] Trial 324 finished with value: 0.43289753061870095 and parameters: {'n_estimators': 582, 'learning_rate': 0.012079962590420852, 'max_depth': 8, 'min_samples_split': 18, 'min_samples_leaf': 4, 'subsample': 0.6925405809656029, 'max_features': None}. Best is trial 300 with value: 0.23199682095001278.
[I 2024-12-04 12:23:39,485] Trial 310 finished with value: 0.260027071704425 and parameters: {'n_estimators': 1202, 'learning_rate': 0.09544983293871649, 'max_depth': 9, 'min_samples_split': 7, 'min_samples_leaf': 1, 'subsample': 0.8044897049274036, 'max_features': 'sqrt'}. Best is trial 300 with value: 0.23199682095001278.
[I 2024-12-04 12:23:42,314] Trial 313 finished with value: 0.46455488032529185 and parameters: {'n_estimators': 1188, 'learning_rate': 0.022939554447346504, 'max_depth': 3, 'min_samples_split': 3, 'min_samples_leaf': 6, 'subsample': 0.9828793585445494, 'max_features': 'sqrt'}. Best is trial 300 with value: 0.23199682095001278.
[I 2024-12-04 12:23:46,939] Trial 307 finished with value: 0.26031062674812966 and parameters: {'n_estimators': 1452, 'learning_rate': 0.0358525772587628, 'max_depth': 10, 'min_samples_split': 6, 'min_samples_leaf': 1, 'subsample': 0.9917826043481767, 'max_features': 'sqrt'}. Best is trial 300 with value: 0.23199682095001278.
[I 2024-12-04 12:23:48,280] Trial 308 finished with value: 0.2725400520124623 and parameters: {'n_estimators': 1493, 'learning_rate': 0.026798513461399078, 'max_depth': 5, 'min_samples_split': 4, 'min_samples_leaf': 1, 'subsample': 0.9865270660069444, 'max_features': 'sqrt'}. Best is trial 300 with value: 0.23199682095001278.
[I 2024-12-04 12:23:50,877] Trial 312 finished with value: 0.31295996795405817 and parameters: {'n_estimators': 1377, 'learning_rate': 0.03642074237845275, 'max_depth': 10, 'min_samples_split': 14, 'min_samples_leaf': 2, 'subsample': 0.9073753892799757, 'max_features': 'log2'}. Best is trial 300 with value: 0.23199682095001278.
[I 2024-12-04 12:23:51,892] Trial 323 finished with value: 0.359069676915786 and parameters: {'n_estimators': 937, 'learning_rate': 0.08247240508028843, 'max_depth': 8, 'min_samples_split': 3, 'min_samples_leaf': 3, 'subsample': 0.8830875657647843, 'max_features': 'sqrt'}. Best is trial 300 with value: 0.23199682095001278.
[I 2024-12-04 12:23:52,725] Trial 318 finished with value: 0.28192394529321246 and parameters: {'n_estimators': 1163, 'learning_rate': 0.03860199476647945, 'max_depth': 8, 'min_samples_split': 7, 'min_samples_leaf': 1, 'subsample': 0.7774925512426554, 'max_features': 'sqrt'}. Best is trial 300 with value: 0.23199682095001278.
[I 2024-12-04 12:23:54,053] Trial 343 finished with value: 1.2604715375757893 and parameters: {'n_estimators': 109, 'learning_rate': 0.011501419853325702, 'max_depth': 3, 'min_samples_split': 20, 'min_samples_leaf': 9, 'subsample': 0.7210209216470002, 'max_features': 'log2'}. Best is trial 300 with value: 0.23199682095001278.
[I 2024-12-04 12:23:56,383] Trial 315 finished with value: 0.2791953639086001 and parameters: {'n_estimators': 1307, 'learning_rate': 0.07504853454612884, 'max_depth': 10, 'min_samples_split': 13, 'min_samples_leaf': 1, 'subsample': 0.8641402044054641, 'max_features': 'log2'}. Best is trial 300 with value: 0.23199682095001278.
[I 2024-12-04 12:23:57,487] Trial 311 finished with value: 0.3746833680732522 and parameters: {'n_estimators': 1491, 'learning_rate': 0.046892268282589945, 'max_depth': 12, 'min_samples_split': 17, 'min_samples_leaf': 3, 'subsample': 0.9092931542394729, 'max_features': 'log2'}. Best is trial 300 with value: 0.23199682095001278.
[I 2024-12-04 12:23:57,495] Trial 319 finished with value: 0.25827448909179457 and parameters: {'n_estimators': 1207, 'learning_rate': 0.07129991619896756, 'max_depth': 9, 'min_samples_split': 4, 'min_samples_leaf': 1, 'subsample': 0.9273423293687671, 'max_features': 'sqrt'}. Best is trial 300 with value: 0.23199682095001278.
[I 2024-12-04 12:24:00,321] Trial 317 finished with value: 0.2561687438433909 and parameters: {'n_estimators': 1346, 'learning_rate': 0.0464046840843155, 'max_depth': 10, 'min_samples_split': 6, 'min_samples_leaf': 1, 'subsample': 0.7428728385099553, 'max_features': 'log2'}. Best is trial 300 with value: 0.23199682095001278.
[I 2024-12-04 12:24:00,323] Trial 331 finished with value: 0.3761462739045287 and parameters: {'n_estimators': 703, 'learning_rate': 0.044506077611831805, 'max_depth': 7, 'min_samples_split': 4, 'min_samples_leaf': 1, 'subsample': 0.7484122041872934, 'max_features': 'log2'}. Best is trial 300 with value: 0.23199682095001278.
[I 2024-12-04 12:24:01,604] Trial 346 finished with value: 1.1546651145721591 and parameters: {'n_estimators': 105, 'learning_rate': 0.04710312190461247, 'max_depth': 11, 'min_samples_split': 10, 'min_samples_leaf': 10, 'subsample': 0.7622289829015442, 'max_features': 'log2'}. Best is trial 300 with value: 0.23199682095001278.
[I 2024-12-04 12:24:04,436] Trial 316 finished with value: 0.2926289557691982 and parameters: {'n_estimators': 1451, 'learning_rate': 0.026632284475027346, 'max_depth': 10, 'min_samples_split': 2, 'min_samples_leaf': 2, 'subsample': 0.910262620507506, 'max_features': 'sqrt'}. Best is trial 300 with value: 0.23199682095001278.
[I 2024-12-04 12:24:05,836] Trial 321 finished with value: 0.25273944901776063 and parameters: {'n_estimators': 1310, 'learning_rate': 0.05575773302131926, 'max_depth': 10, 'min_samples_split': 8, 'min_samples_leaf': 1, 'subsample': 0.8052581194764777, 'max_features': 'sqrt'}. Best is trial 300 with value: 0.23199682095001278.
[I 2024-12-04 12:24:06,889] Trial 326 finished with value: 0.3718111566126928 and parameters: {'n_estimators': 1067, 'learning_rate': 0.07093677318894266, 'max_depth': 9, 'min_samples_split': 6, 'min_samples_leaf': 3, 'subsample': 0.8225871166671703, 'max_features': 'log2'}. Best is trial 300 with value: 0.23199682095001278.
[I 2024-12-04 12:24:12,630] Trial 334 finished with value: 0.23635326075929897 and parameters: {'n_estimators': 752, 'learning_rate': 0.06922819438154423, 'max_depth': 8, 'min_samples_split': 2, 'min_samples_leaf': 1, 'subsample': 0.7224128039117236, 'max_features': 'sqrt'}. Best is trial 300 with value: 0.23199682095001278.
[I 2024-12-04 12:24:12,763] Trial 322 finished with value: 0.2915872500802236 and parameters: {'n_estimators': 1450, 'learning_rate': 0.031228501744345685, 'max_depth': 7, 'min_samples_split': 8, 'min_samples_leaf': 2, 'subsample': 0.8784844205388772, 'max_features': 'sqrt'}. Best is trial 300 with value: 0.23199682095001278.
[I 2024-12-04 12:24:16,328] Trial 344 finished with value: 0.2630500985058595 and parameters: {'n_estimators': 465, 'learning_rate': 0.03922629527987624, 'max_depth': 10, 'min_samples_split': 2, 'min_samples_leaf': 1, 'subsample': 0.6870074106295128, 'max_features': 'sqrt'}. Best is trial 300 with value: 0.23199682095001278.
[I 2024-12-04 12:24:16,589] Trial 337 finished with value: 0.2939753716550374 and parameters: {'n_estimators': 789, 'learning_rate': 0.06013058794841814, 'max_depth': 12, 'min_samples_split': 4, 'min_samples_leaf': 2, 'subsample': 0.7064904191945106, 'max_features': 'sqrt'}. Best is trial 300 with value: 0.23199682095001278.
[I 2024-12-04 12:24:16,616] Trial 336 finished with value: 0.2933321068947586 and parameters: {'n_estimators': 814, 'learning_rate': 0.039446139142977926, 'max_depth': 9, 'min_samples_split': 2, 'min_samples_leaf': 2, 'subsample': 0.7296825405326662, 'max_features': 'sqrt'}. Best is trial 300 with value: 0.23199682095001278.
[I 2024-12-04 12:24:17,904] Trial 327 finished with value: 0.24760932336710037 and parameters: {'n_estimators': 1246, 'learning_rate': 0.07905846158054522, 'max_depth': 7, 'min_samples_split': 4, 'min_samples_leaf': 1, 'subsample': 0.6779710741061248, 'max_features': 'sqrt'}. Best is trial 300 with value: 0.23199682095001278.
[I 2024-12-04 12:24:21,762] Trial 328 finished with value: 0.2761992578034106 and parameters: {'n_estimators': 1222, 'learning_rate': 0.0761484498299016, 'max_depth': 9, 'min_samples_split': 3, 'min_samples_leaf': 2, 'subsample': 0.8551636938616032, 'max_features': 'sqrt'}. Best is trial 300 with value: 0.23199682095001278.
