[I 2024-12-04 20:06:56,233] Trial 901 finished with value: 0.5448156952894659 and parameters: {'n_estimators': 250, 'max_depth': 49, 'min_samples_split': 3, 'min_samples_leaf': 1, 'max_features': 'log2', 'bootstrap': False, 'criterion': 'squared_error'}. Best is trial 874 with value: 0.32176430753353746.
[I 2024-12-04 20:06:56,341] Trial 900 finished with value: 0.32351132331643373 and parameters: {'n_estimators': 321, 'max_depth': 50, 'min_samples_split': 2, 'min_samples_leaf': 1, 'max_features': 'sqrt', 'bootstrap': False, 'criterion': 'squared_error'}. Best is trial 874 with value: 0.32176430753353746.
[I 2024-12-04 20:06:57,113] Trial 899 finished with value: 0.48181564284877604 and parameters: {'n_estimators': 414, 'max_depth': 48, 'min_samples_split': 6, 'min_samples_leaf': 1, 'max_features': None, 'bootstrap': False, 'criterion': 'squared_error'}. Best is trial 874 with value: 0.32176430753353746.
[I 2024-12-04 20:06:57,977] Trial 902 finished with value: 0.32618657432518644 and parameters: {'n_estimators': 233, 'max_depth': 50, 'min_samples_split': 2, 'min_samples_leaf': 1, 'max_features': 'sqrt', 'bootstrap': False, 'criterion': 'squared_error'}. Best is trial 874 with value: 0.32176430753353746.
[I 2024-12-04 20:06:57,978] Trial 903 finished with value: 0.39853707044023284 and parameters: {'n_estimators': 270, 'max_depth': 49, 'min_samples_split': 3, 'min_samples_leaf': 1, 'max_features': 'sqrt', 'bootstrap': True, 'criterion': 'squared_error'}. Best is trial 874 with value: 0.32176430753353746.
[I 2024-12-04 20:06:58,414] Trial 904 finished with value: 0.3659685207738374 and parameters: {'n_estimators': 133, 'max_depth': 44, 'min_samples_split': 2, 'min_samples_leaf': 1, 'max_features': 'sqrt', 'bootstrap': False, 'criterion': 'squared_error'}. Best is trial 874 with value: 0.32176430753353746.
[I 2024-12-04 20:06:59,725] Trial 905 finished with value: 0.6913671325832335 and parameters: {'n_estimators': 465, 'max_depth': 50, 'min_samples_split': 3, 'min_samples_leaf': 2, 'max_features': 'sqrt', 'bootstrap': False, 'criterion': 'squared_error'}. Best is trial 874 with value: 0.32176430753353746.
[I 2024-12-04 20:07:00,241] Trial 907 finished with value: 0.3272438099125244 and parameters: {'n_estimators': 214, 'max_depth': 49, 'min_samples_split': 2, 'min_samples_leaf': 1, 'max_features': 'sqrt', 'bootstrap': False, 'criterion': 'squared_error'}. Best is trial 874 with value: 0.32176430753353746.
[I 2024-12-04 20:07:00,487] Trial 906 finished with value: 0.32370481251745215 and parameters: {'n_estimators': 318, 'max_depth': 50, 'min_samples_split': 2, 'min_samples_leaf': 1, 'max_features': 'sqrt', 'bootstrap': False, 'criterion': 'squared_error'}. Best is trial 874 with value: 0.32176430753353746.
[I 2024-12-04 20:07:01,596] Trial 910 finished with value: 0.8177704815840201 and parameters: {'n_estimators': 117, 'max_depth': 48, 'min_samples_split': 2, 'min_samples_leaf': 2, 'max_features': 'sqrt', 'bootstrap': True, 'criterion': 'squared_error'}. Best is trial 874 with value: 0.32176430753353746.
[I 2024-12-04 20:07:02,524] Trial 909 finished with value: 0.32303015618779657 and parameters: {'n_estimators': 368, 'max_depth': 50, 'min_samples_split': 2, 'min_samples_leaf': 1, 'max_features': 'sqrt', 'bootstrap': False, 'criterion': 'squared_error'}. Best is trial 874 with value: 0.32176430753353746.
[I 2024-12-04 20:07:02,557] Trial 911 finished with value: 0.5250681024704194 and parameters: {'n_estimators': 106, 'max_depth': 6, 'min_samples_split': 5, 'min_samples_leaf': 2, 'max_features': None, 'bootstrap': True, 'criterion': 'squared_error'}. Best is trial 874 with value: 0.32176430753353746.
[I 2024-12-04 20:07:02,577] Trial 908 finished with value: 0.5373517670943987 and parameters: {'n_estimators': 321, 'max_depth': 43, 'min_samples_split': 2, 'min_samples_leaf': 2, 'max_features': None, 'bootstrap': False, 'criterion': 'squared_error'}. Best is trial 874 with value: 0.32176430753353746.
[I 2024-12-04 20:07:04,253] Trial 913 finished with value: 0.3431432335922242 and parameters: {'n_estimators': 111, 'max_depth': 49, 'min_samples_split': 2, 'min_samples_leaf': 1, 'max_features': 'sqrt', 'bootstrap': False, 'criterion': 'squared_error'}. Best is trial 874 with value: 0.32176430753353746.
[I 2024-12-04 20:07:04,877] Trial 912 finished with value: 0.3412695638784561 and parameters: {'n_estimators': 287, 'max_depth': 41, 'min_samples_split': 2, 'min_samples_leaf': 1, 'max_features': 'sqrt', 'bootstrap': False, 'criterion': 'squared_error'}. Best is trial 874 with value: 0.32176430753353746.
[I 2024-12-04 20:07:10,248] Trial 916 finished with value: 0.9402672180679744 and parameters: {'n_estimators': 421, 'max_depth': 26, 'min_samples_split': 2, 'min_samples_leaf': 1, 'max_features': 'log2', 'bootstrap': True, 'criterion': 'absolute_error'}. Best is trial 874 with value: 0.32176430753353746.
[I 2024-12-04 20:07:11,834] Trial 917 finished with value: 1.1305573622803196 and parameters: {'n_estimators': 890, 'max_depth': 14, 'min_samples_split': 3, 'min_samples_leaf': 2, 'max_features': 'log2', 'bootstrap': False, 'criterion': 'squared_error'}. Best is trial 874 with value: 0.32176430753353746.
[I 2024-12-04 20:07:12,787] Trial 918 finished with value: 0.3966332718240759 and parameters: {'n_estimators': 105, 'max_depth': 50, 'min_samples_split': 4, 'min_samples_leaf': 1, 'max_features': 'sqrt', 'bootstrap': False, 'criterion': 'squared_error'}. Best is trial 874 with value: 0.32176430753353746.
[I 2024-12-04 20:07:13,437] Trial 914 finished with value: 1.1289253259202976 and parameters: {'n_estimators': 990, 'max_depth': 9, 'min_samples_split': 18, 'min_samples_leaf': 2, 'max_features': 'sqrt', 'bootstrap': False, 'criterion': 'absolute_error'}. Best is trial 874 with value: 0.32176430753353746.
[I 2024-12-04 20:07:13,817] Trial 915 finished with value: 0.4106793491807731 and parameters: {'n_estimators': 325, 'max_depth': 38, 'min_samples_split': 2, 'min_samples_leaf': 1, 'max_features': 'sqrt', 'bootstrap': False, 'criterion': 'absolute_error'}. Best is trial 874 with value: 0.32176430753353746.
[I 2024-12-04 20:07:15,292] Trial 919 finished with value: 0.34608472105443644 and parameters: {'n_estimators': 362, 'max_depth': 42, 'min_samples_split': 2, 'min_samples_leaf': 1, 'max_features': 'sqrt', 'bootstrap': False, 'criterion': 'squared_error'}. Best is trial 874 with value: 0.32176430753353746.
[I 2024-12-04 20:07:15,344] Trial 920 finished with value: 0.6436741698874091 and parameters: {'n_estimators': 553, 'max_depth': 48, 'min_samples_split': 7, 'min_samples_leaf': 1, 'max_features': 'log2', 'bootstrap': False, 'criterion': 'squared_error'}. Best is trial 874 with value: 0.32176430753353746.
[I 2024-12-04 20:07:15,542] Trial 921 finished with value: 1.2662515079127434 and parameters: {'n_estimators': 326, 'max_depth': 22, 'min_samples_split': 6, 'min_samples_leaf': 7, 'max_features': 'sqrt', 'bootstrap': True, 'criterion': 'absolute_error'}. Best is trial 874 with value: 0.32176430753353746.
[I 2024-12-04 20:07:17,584] Trial 923 finished with value: 0.3261434885900742 and parameters: {'n_estimators': 231, 'max_depth': 50, 'min_samples_split': 2, 'min_samples_leaf': 1, 'max_features': 'sqrt', 'bootstrap': False, 'criterion': 'squared_error'}. Best is trial 874 with value: 0.32176430753353746.
[I 2024-12-04 20:07:18,708] Trial 922 finished with value: 0.3234659763435935 and parameters: {'n_estimators': 417, 'max_depth': 50, 'min_samples_split': 2, 'min_samples_leaf': 1, 'max_features': 'sqrt', 'bootstrap': False, 'criterion': 'squared_error'}. Best is trial 874 with value: 0.32176430753353746.
[I 2024-12-04 20:07:20,173] Trial 924 finished with value: 0.4749157673855797 and parameters: {'n_estimators': 814, 'max_depth': 9, 'min_samples_split': 8, 'min_samples_leaf': 1, 'max_features': None, 'bootstrap': True, 'criterion': 'squared_error'}. Best is trial 874 with value: 0.32176430753353746.
[I 2024-12-04 20:07:21,743] Trial 925 finished with value: 0.4335235245476943 and parameters: {'n_estimators': 387, 'max_depth': 46, 'min_samples_split': 2, 'min_samples_leaf': 1, 'max_features': None, 'bootstrap': False, 'criterion': 'squared_error'}. Best is trial 874 with value: 0.32176430753353746.
[I 2024-12-04 20:07:21,879] Trial 927 finished with value: 0.41068699292313304 and parameters: {'n_estimators': 343, 'max_depth': 41, 'min_samples_split': 4, 'min_samples_leaf': 1, 'max_features': 'sqrt', 'bootstrap': False, 'criterion': 'squared_error'}. Best is trial 874 with value: 0.32176430753353746.
[I 2024-12-04 20:07:22,635] Trial 926 finished with value: 0.6316924372196454 and parameters: {'n_estimators': 849, 'max_depth': 18, 'min_samples_split': 35, 'min_samples_leaf': 1, 'max_features': None, 'bootstrap': True, 'criterion': 'squared_error'}. Best is trial 874 with value: 0.32176430753353746.
[I 2024-12-04 20:07:24,063] Trial 928 finished with value: 0.4173137808526319 and parameters: {'n_estimators': 558, 'max_depth': 42, 'min_samples_split': 4, 'min_samples_leaf': 1, 'max_features': 'sqrt', 'bootstrap': False, 'criterion': 'squared_error'}. Best is trial 874 with value: 0.32176430753353746.
[I 2024-12-04 20:07:24,586] Trial 929 finished with value: 0.3232888595106857 and parameters: {'n_estimators': 386, 'max_depth': 50, 'min_samples_split': 2, 'min_samples_leaf': 1, 'max_features': 'sqrt', 'bootstrap': False, 'criterion': 'squared_error'}. Best is trial 874 with value: 0.32176430753353746.
[I 2024-12-04 20:07:24,826] Trial 930 finished with value: 0.3644156430469495 and parameters: {'n_estimators': 438, 'max_depth': 50, 'min_samples_split': 3, 'min_samples_leaf': 1, 'max_features': 'sqrt', 'bootstrap': False, 'criterion': 'squared_error'}. Best is trial 874 with value: 0.32176430753353746.
[I 2024-12-04 20:07:25,213] Trial 931 finished with value: 0.6555530120616785 and parameters: {'n_estimators': 177, 'max_depth': 50, 'min_samples_split': 3, 'min_samples_leaf': 2, 'max_features': 'sqrt', 'bootstrap': False, 'criterion': 'squared_error'}. Best is trial 874 with value: 0.32176430753353746.
[I 2024-12-04 20:07:26,740] Trial 934 finished with value: 1.0556556084316724 and parameters: {'n_estimators': 367, 'max_depth': 50, 'min_samples_split': 2, 'min_samples_leaf': 2, 'max_features': 'log2', 'bootstrap': False, 'criterion': 'squared_error'}. Best is trial 874 with value: 0.32176430753353746.
[I 2024-12-04 20:07:26,996] Trial 933 finished with value: 1.3346138174741256 and parameters: {'n_estimators': 565, 'max_depth': 19, 'min_samples_split': 22, 'min_samples_leaf': 8, 'max_features': 'log2', 'bootstrap': False, 'criterion': 'absolute_error'}. Best is trial 874 with value: 0.32176430753353746.
[I 2024-12-04 20:07:27,961] Trial 936 finished with value: 1.3190170526196794 and parameters: {'n_estimators': 108, 'max_depth': 36, 'min_samples_split': 26, 'min_samples_leaf': 6, 'max_features': 'log2', 'bootstrap': False, 'criterion': 'absolute_error'}. Best is trial 874 with value: 0.32176430753353746.
[I 2024-12-04 20:07:28,244] Trial 932 finished with value: 0.562173136931815 and parameters: {'n_estimators': 696, 'max_depth': 7, 'min_samples_split': 25, 'min_samples_leaf': 1, 'max_features': None, 'bootstrap': False, 'criterion': 'squared_error'}. Best is trial 874 with value: 0.32176430753353746.
[I 2024-12-04 20:07:29,229] Trial 935 finished with value: 0.5373532371825533 and parameters: {'n_estimators': 242, 'max_depth': 50, 'min_samples_split': 2, 'min_samples_leaf': 2, 'max_features': None, 'bootstrap': False, 'criterion': 'squared_error'}. Best is trial 874 with value: 0.32176430753353746.
[I 2024-12-04 20:07:30,000] Trial 938 finished with value: 0.6686900172276986 and parameters: {'n_estimators': 349, 'max_depth': 49, 'min_samples_split': 2, 'min_samples_leaf': 2, 'max_features': 'sqrt', 'bootstrap': False, 'criterion': 'squared_error'}. Best is trial 874 with value: 0.32176430753353746.
[I 2024-12-04 20:07:30,633] Trial 939 finished with value: 1.2239735215175165 and parameters: {'n_estimators': 627, 'max_depth': 6, 'min_samples_split': 32, 'min_samples_leaf': 3, 'max_features': 'log2', 'bootstrap': False, 'criterion': 'squared_error'}. Best is trial 874 with value: 0.32176430753353746.
[I 2024-12-04 20:07:31,875] Trial 940 finished with value: 0.6982740087487159 and parameters: {'n_estimators': 514, 'max_depth': 40, 'min_samples_split': 2, 'min_samples_leaf': 2, 'max_features': 'sqrt', 'bootstrap': False, 'criterion': 'squared_error'}. Best is trial 874 with value: 0.32176430753353746.
[I 2024-12-04 20:07:32,937] Trial 941 finished with value: 0.3959888114945573 and parameters: {'n_estimators': 404, 'max_depth': 48, 'min_samples_split': 2, 'min_samples_leaf': 1, 'max_features': 'sqrt', 'bootstrap': True, 'criterion': 'squared_error'}. Best is trial 874 with value: 0.32176430753353746.
[I 2024-12-04 20:07:32,944] Trial 937 finished with value: 1.2681992986264148 and parameters: {'n_estimators': 848, 'max_depth': 7, 'min_samples_split': 8, 'min_samples_leaf': 1, 'max_features': 'log2', 'bootstrap': True, 'criterion': 'absolute_error'}. Best is trial 874 with value: 0.32176430753353746.
[I 2024-12-04 20:07:34,239] Trial 942 finished with value: 0.322154751645969 and parameters: {'n_estimators': 374, 'max_depth': 50, 'min_samples_split': 2, 'min_samples_leaf': 1, 'max_features': 'sqrt', 'bootstrap': False, 'criterion': 'squared_error'}. Best is trial 874 with value: 0.32176430753353746.
[I 2024-12-04 20:07:34,772] Trial 944 finished with value: 0.4064515234075665 and parameters: {'n_estimators': 306, 'max_depth': 41, 'min_samples_split': 4, 'min_samples_leaf': 1, 'max_features': 'sqrt', 'bootstrap': False, 'criterion': 'squared_error'}. Best is trial 874 with value: 0.32176430753353746.
[I 2024-12-04 20:07:34,950] Trial 943 finished with value: 0.35587231863414054 and parameters: {'n_estimators': 322, 'max_depth': 50, 'min_samples_split': 3, 'min_samples_leaf': 1, 'max_features': 'sqrt', 'bootstrap': False, 'criterion': 'squared_error'}. Best is trial 874 with value: 0.32176430753353746.
[I 2024-12-04 20:07:36,339] Trial 946 finished with value: 0.6689332366695069 and parameters: {'n_estimators': 359, 'max_depth': 50, 'min_samples_split': 2, 'min_samples_leaf': 2, 'max_features': 'sqrt', 'bootstrap': False, 'criterion': 'squared_error'}. Best is trial 874 with value: 0.32176430753353746.
[I 2024-12-04 20:07:36,664] Trial 945 finished with value: 0.3476947725686698 and parameters: {'n_estimators': 394, 'max_depth': 42, 'min_samples_split': 2, 'min_samples_leaf': 1, 'max_features': 'sqrt', 'bootstrap': False, 'criterion': 'squared_error'}. Best is trial 874 with value: 0.32176430753353746.
[I 2024-12-04 20:07:36,690] Trial 947 finished with value: 0.32497643816954297 and parameters: {'n_estimators': 192, 'max_depth': 50, 'min_samples_split': 2, 'min_samples_leaf': 1, 'max_features': 'sqrt', 'bootstrap': False, 'criterion': 'squared_error'}. Best is trial 874 with value: 0.32176430753353746.
[I 2024-12-04 20:07:38,134] Trial 948 finished with value: 1.3407541674465573 and parameters: {'n_estimators': 350, 'max_depth': 21, 'min_samples_split': 46, 'min_samples_leaf': 10, 'max_features': 'log2', 'bootstrap': True, 'criterion': 'absolute_error'}. Best is trial 874 with value: 0.32176430753353746.
[I 2024-12-04 20:07:39,480] Trial 950 finished with value: 1.169025345820772 and parameters: {'n_estimators': 995, 'max_depth': 24, 'min_samples_split': 7, 'min_samples_leaf': 2, 'max_features': 'log2', 'bootstrap': True, 'criterion': 'squared_error'}. Best is trial 874 with value: 0.32176430753353746.
[I 2024-12-04 20:07:39,865] Trial 949 finished with value: 0.3241660666406343 and parameters: {'n_estimators': 413, 'max_depth': 50, 'min_samples_split': 2, 'min_samples_leaf': 1, 'max_features': 'sqrt', 'bootstrap': False, 'criterion': 'squared_error'}. Best is trial 874 with value: 0.32176430753353746.
[I 2024-12-04 20:07:41,804] Trial 953 finished with value: 0.34422839765051194 and parameters: {'n_estimators': 286, 'max_depth': 44, 'min_samples_split': 2, 'min_samples_leaf': 1, 'max_features': 'sqrt', 'bootstrap': False, 'criterion': 'squared_error'}. Best is trial 874 with value: 0.32176430753353746.
[I 2024-12-04 20:07:43,006] Trial 951 finished with value: 0.9736670296393686 and parameters: {'n_estimators': 313, 'max_depth': 22, 'min_samples_split': 31, 'min_samples_leaf': 2, 'max_features': 'sqrt', 'bootstrap': False, 'criterion': 'absolute_error'}. Best is trial 874 with value: 0.32176430753353746.
[I 2024-12-04 20:07:43,475] Trial 954 finished with value: 0.6819820922084685 and parameters: {'n_estimators': 534, 'max_depth': 50, 'min_samples_split': 2, 'min_samples_leaf': 2, 'max_features': 'sqrt', 'bootstrap': False, 'criterion': 'squared_error'}. Best is trial 874 with value: 0.32176430753353746.
[I 2024-12-04 20:07:43,748] Trial 952 finished with value: 0.5076566931698071 and parameters: {'n_estimators': 907, 'max_depth': 9, 'min_samples_split': 2, 'min_samples_leaf': 2, 'max_features': None, 'bootstrap': True, 'criterion': 'squared_error'}. Best is trial 874 with value: 0.32176430753353746.
[I 2024-12-04 20:07:44,718] Trial 955 finished with value: 0.6789027067616534 and parameters: {'n_estimators': 381, 'max_depth': 50, 'min_samples_split': 4, 'min_samples_leaf': 2, 'max_features': 'sqrt', 'bootstrap': False, 'criterion': 'squared_error'}. Best is trial 874 with value: 0.32176430753353746.
[I 2024-12-04 20:07:45,767] Trial 956 finished with value: 0.32563521502948495 and parameters: {'n_estimators': 274, 'max_depth': 50, 'min_samples_split': 2, 'min_samples_leaf': 1, 'max_features': 'sqrt', 'bootstrap': False, 'criterion': 'squared_error'}. Best is trial 874 with value: 0.32176430753353746.
[I 2024-12-04 20:07:46,349] Trial 958 finished with value: 0.38881958259085747 and parameters: {'n_estimators': 281, 'max_depth': 42, 'min_samples_split': 3, 'min_samples_leaf': 1, 'max_features': 'sqrt', 'bootstrap': False, 'criterion': 'squared_error'}. Best is trial 874 with value: 0.32176430753353746.
[I 2024-12-04 20:07:46,570] Trial 957 finished with value: 0.32314672875857625 and parameters: {'n_estimators': 404, 'max_depth': 50, 'min_samples_split': 2, 'min_samples_leaf': 1, 'max_features': 'sqrt', 'bootstrap': False, 'criterion': 'squared_error'}. Best is trial 874 with value: 0.32176430753353746.
[I 2024-12-04 20:07:47,452] Trial 960 finished with value: 0.6517755021006165 and parameters: {'n_estimators': 149, 'max_depth': 50, 'min_samples_split': 2, 'min_samples_leaf': 2, 'max_features': 'sqrt', 'bootstrap': False, 'criterion': 'squared_error'}. Best is trial 874 with value: 0.32176430753353746.
[I 2024-12-04 20:07:47,991] Trial 959 finished with value: 0.32246671764803314 and parameters: {'n_estimators': 341, 'max_depth': 50, 'min_samples_split': 2, 'min_samples_leaf': 1, 'max_features': 'sqrt', 'bootstrap': False, 'criterion': 'squared_error'}. Best is trial 874 with value: 0.32176430753353746.
[I 2024-12-04 20:07:49,335] Trial 962 finished with value: 0.4112711886612752 and parameters: {'n_estimators': 389, 'max_depth': 42, 'min_samples_split': 4, 'min_samples_leaf': 1, 'max_features': 'sqrt', 'bootstrap': False, 'criterion': 'squared_error'}. Best is trial 874 with value: 0.32176430753353746.
[I 2024-12-04 20:07:49,341] Trial 963 finished with value: 1.2689282370879935 and parameters: {'n_estimators': 772, 'max_depth': 50, 'min_samples_split': 4, 'min_samples_leaf': 10, 'max_features': 'log2', 'bootstrap': False, 'criterion': 'squared_error'}. Best is trial 874 with value: 0.32176430753353746.
[I 2024-12-04 20:07:51,168] Trial 961 finished with value: 0.3448134536546712 and parameters: {'n_estimators': 149, 'max_depth': 50, 'min_samples_split': 2, 'min_samples_leaf': 1, 'max_features': 'sqrt', 'bootstrap': False, 'criterion': 'absolute_error'}. Best is trial 874 with value: 0.32176430753353746.
[I 2024-12-04 20:07:52,116] Trial 965 finished with value: 0.35619624508780984 and parameters: {'n_estimators': 490, 'max_depth': 42, 'min_samples_split': 2, 'min_samples_leaf': 1, 'max_features': 'sqrt', 'bootstrap': False, 'criterion': 'squared_error'}. Best is trial 874 with value: 0.32176430753353746.
[I 2024-12-04 20:07:53,215] Trial 966 finished with value: 0.3223327925900426 and parameters: {'n_estimators': 343, 'max_depth': 50, 'min_samples_split': 2, 'min_samples_leaf': 1, 'max_features': 'sqrt', 'bootstrap': False, 'criterion': 'squared_error'}. Best is trial 874 with value: 0.32176430753353746.
[I 2024-12-04 20:07:53,796] Trial 967 finished with value: 0.3875358856008499 and parameters: {'n_estimators': 368, 'max_depth': 49, 'min_samples_split': 4, 'min_samples_leaf': 1, 'max_features': 'sqrt', 'bootstrap': False, 'criterion': 'squared_error'}. Best is trial 874 with value: 0.32176430753353746.
[I 2024-12-04 20:07:54,576] Trial 968 finished with value: 0.6713568596788928 and parameters: {'n_estimators': 302, 'max_depth': 43, 'min_samples_split': 4, 'min_samples_leaf': 2, 'max_features': 'sqrt', 'bootstrap': False, 'criterion': 'squared_error'}. Best is trial 874 with value: 0.32176430753353746.
[I 2024-12-04 20:07:55,726] Trial 969 finished with value: 0.3576294085098991 and parameters: {'n_estimators': 300, 'max_depth': 40, 'min_samples_split': 2, 'min_samples_leaf': 1, 'max_features': 'sqrt', 'bootstrap': False, 'criterion': 'squared_error'}. Best is trial 874 with value: 0.32176430753353746.
[I 2024-12-04 20:07:56,012] Trial 970 finished with value: 0.3867509050397004 and parameters: {'n_estimators': 310, 'max_depth': 49, 'min_samples_split': 4, 'min_samples_leaf': 1, 'max_features': 'sqrt', 'bootstrap': False, 'criterion': 'squared_error'}. Best is trial 874 with value: 0.32176430753353746.
