[I 2024-12-04 20:48:03,978] Trial 2115 finished with value: 1.0916558490794455 and parameters: {'kernel_type': 'Matern', 'length_scale': 0.09908725165166805, 'noise_level': 4.302623586338487e-05, 'constant_value': 913.9186612312318, 'nu': 0.5}. Best is trial 1997 with value: 0.359156695282073.
[I 2024-12-04 20:48:08,143] Trial 2116 finished with value: 0.3592112183642299 and parameters: {'kernel_type': 'Matern', 'length_scale': 0.5345029223291986, 'noise_level': 0.00039481644511243214, 'constant_value': 134.1267725265132, 'nu': 0.5}. Best is trial 1997 with value: 0.359156695282073.
[I 2024-12-04 20:48:08,504] Trial 2117 finished with value: 0.35921124609980953 and parameters: {'kernel_type': 'Matern', 'length_scale': 0.6025839557291925, 'noise_level': 0.0015477322704269538, 'constant_value': 24.476561927642603, 'nu': 0.5}. Best is trial 1997 with value: 0.359156695282073.
[I 2024-12-04 20:48:09,248] Trial 2118 finished with value: 0.35921112006727973 and parameters: {'kernel_type': 'Matern', 'length_scale': 0.2885839788366003, 'noise_level': 0.0003668076244609619, 'constant_value': 4.028050832789629, 'nu': 0.5}. Best is trial 1997 with value: 0.359156695282073.
[I 2024-12-04 20:48:12,482] Trial 2119 finished with value: 0.3592110368210342 and parameters: {'kernel_type': 'Matern', 'length_scale': 0.49868455279075513, 'noise_level': 6.414250239264442e-05, 'constant_value': 179.27636596392077, 'nu': 0.5}. Best is trial 1997 with value: 0.359156695282073.
[I 2024-12-04 20:48:13,328] Trial 2121 finished with value: 1.0624161178139835 and parameters: {'kernel_type': 'Matern', 'length_scale': 1.7451944098030293e-05, 'noise_level': 3.9801887968883496e-05, 'constant_value': 0.02753353884619455, 'nu': 0.5}. Best is trial 1997 with value: 0.359156695282073.
[I 2024-12-04 20:48:15,605] Trial 2120 finished with value: 1.0624161172673892 and parameters: {'kernel_type': 'Matern', 'length_scale': 70.42566354463591, 'noise_level': 7.407643613395895e-06, 'constant_value': 0.0976480598070636, 'nu': 2.5}. Best is trial 1997 with value: 0.359156695282073.
[I 2024-12-04 20:48:16,493] Trial 2123 finished with value: 1.0916567281544172 and parameters: {'kernel_type': 'RBF', 'length_scale': 2.589072328604928, 'noise_level': 9.777722463865658e-07, 'constant_value': 207.27823587973745, 'nu': 2.5}. Best is trial 1997 with value: 0.359156695282073.
[I 2024-12-04 20:48:17,023] Trial 2122 finished with value: 0.3592110022424203 and parameters: {'kernel_type': 'Matern', 'length_scale': 2.8911406116062297, 'noise_level': 0.004233222891870649, 'constant_value': 625.5085347024477, 'nu': 0.5}. Best is trial 1997 with value: 0.359156695282073.
[I 2024-12-04 20:48:19,864] Trial 2125 finished with value: 1.0916566977198887 and parameters: {'kernel_type': 'Matern', 'length_scale': 11753.155691108803, 'noise_level': 1.261918684522596e-05, 'constant_value': 6906.919817260043, 'nu': 0.5}. Best is trial 1997 with value: 0.359156695282073.
[I 2024-12-04 20:48:20,271] Trial 2126 finished with value: 1.0916558493883473 and parameters: {'kernel_type': 'Matern', 'length_scale': 5.242261787476311e-05, 'noise_level': 9.730647636901596e-09, 'constant_value': 55601.714254506354, 'nu': 2.5}. Best is trial 1997 with value: 0.359156695282073.
[I 2024-12-04 20:48:23,698] Trial 2124 finished with value: 0.3592124698266663 and parameters: {'kernel_type': 'Matern', 'length_scale': 0.11648857163923436, 'noise_level': 0.0015696033856309002, 'constant_value': 223.79614948102255, 'nu': 0.5}. Best is trial 1997 with value: 0.359156695282073.
[I 2024-12-04 20:48:23,992] Trial 2128 finished with value: 0.4286832150233737 and parameters: {'kernel_type': 'RBF', 'length_scale': 0.35558982947687734, 'noise_level': 0.000536788905919506, 'constant_value': 74.44849843925539, 'nu': 0.5}. Best is trial 1997 with value: 0.359156695282073.
[I 2024-12-04 20:48:24,173] Trial 2127 finished with value: 0.3592111235959084 and parameters: {'kernel_type': 'Matern', 'length_scale': 0.26412727389901774, 'noise_level': 0.00031725071128121745, 'constant_value': 141.857084547533, 'nu': 0.5}. Best is trial 1997 with value: 0.359156695282073.
[I 2024-12-04 20:48:27,499] Trial 2131 finished with value: 1.0916567268512904 and parameters: {'kernel_type': 'Matern', 'length_scale': 1.3064518120810933, 'noise_level': 1.176719346023934e-10, 'constant_value': 29596.68260102558, 'nu': 1.5}. Best is trial 1997 with value: 0.359156695282073.
[I 2024-12-04 20:48:29,210] Trial 2130 finished with value: 0.3592112289438679 and parameters: {'kernel_type': 'Matern', 'length_scale': 481.2825231747436, 'noise_level': 0.0029611887647181256, 'constant_value': 423.73030592524316, 'nu': 0.5}. Best is trial 1997 with value: 0.359156695282073.
[I 2024-12-04 20:48:31,791] Trial 2129 finished with value: 0.35921109417730174 and parameters: {'kernel_type': 'Matern', 'length_scale': 0.09377376214472587, 'noise_level': 0.0007807217930466817, 'constant_value': 47.50304640768565, 'nu': 0.5}. Best is trial 1997 with value: 0.359156695282073.
[I 2024-12-04 20:48:32,135] Trial 2132 finished with value: 0.35921104607294385 and parameters: {'kernel_type': 'Matern', 'length_scale': 1.9104154155700128, 'noise_level': 7.139754549857106e-05, 'constant_value': 414.93453557591414, 'nu': 0.5}. Best is trial 1997 with value: 0.359156695282073.
[I 2024-12-04 20:48:34,561] Trial 2133 finished with value: 1.0916567285180188 and parameters: {'kernel_type': 'Matern', 'length_scale': 63701.36232043872, 'noise_level': 0.07122186639856815, 'constant_value': 0.001061479362506612, 'nu': 2.5}. Best is trial 1997 with value: 0.359156695282073.
[I 2024-12-04 20:48:36,380] Trial 2134 finished with value: 0.3592113125647946 and parameters: {'kernel_type': 'Matern', 'length_scale': 1.4007686685108673, 'noise_level': 0.0015677874303539768, 'constant_value': 29.067625166232165, 'nu': 0.5}. Best is trial 1997 with value: 0.359156695282073.
[I 2024-12-04 20:48:36,937] Trial 2135 finished with value: 0.3592112023288857 and parameters: {'kernel_type': 'Matern', 'length_scale': 10.344788164271364, 'noise_level': 0.0005913448706309049, 'constant_value': 1105.644692328599, 'nu': 0.5}. Best is trial 1997 with value: 0.359156695282073.
[I 2024-12-04 20:48:38,367] Trial 2136 finished with value: 0.35921121168942294 and parameters: {'kernel_type': 'Matern', 'length_scale': 4.116753126391076, 'noise_level': 0.0009651116541816186, 'constant_value': 2052.719565080645, 'nu': 0.5}. Best is trial 1997 with value: 0.359156695282073.
[I 2024-12-04 20:48:41,418] Trial 2138 finished with value: 0.35921125051648556 and parameters: {'kernel_type': 'Matern', 'length_scale': 2.9839107603755193, 'noise_level': 0.0010092739820253822, 'constant_value': 169.7398072647126, 'nu': 0.5}. Best is trial 1997 with value: 0.359156695282073.
[I 2024-12-04 20:48:41,520] Trial 2137 finished with value: 0.3592112386978878 and parameters: {'kernel_type': 'Matern', 'length_scale': 2082.336525884795, 'noise_level': 0.025311968590930704, 'constant_value': 32.06620782588381, 'nu': 0.5}. Best is trial 1997 with value: 0.359156695282073.
[I 2024-12-04 20:48:45,622] Trial 2139 finished with value: 1.062416117286118 and parameters: {'kernel_type': 'RBF', 'length_scale': 17.209560930003924, 'noise_level': 2.0408979958758528e-07, 'constant_value': 1.2833273147717666e-07, 'nu': 1.5}. Best is trial 1997 with value: 0.359156695282073.
[I 2024-12-04 20:48:45,697] Trial 2140 finished with value: 0.35921123029503155 and parameters: {'kernel_type': 'Matern', 'length_scale': 26.39156025365499, 'noise_level': 0.010189363397345236, 'constant_value': 15.828379331279939, 'nu': 0.5}. Best is trial 1997 with value: 0.359156695282073.
[I 2024-12-04 20:48:46,611] Trial 2141 finished with value: 0.3592112406110771 and parameters: {'kernel_type': 'Matern', 'length_scale': 721.0886520571624, 'noise_level': 0.0330472330359803, 'constant_value': 16.75995245307452, 'nu': 0.5}. Best is trial 1997 with value: 0.359156695282073.
[I 2024-12-04 20:48:49,073] Trial 2142 finished with value: 1.0916562043260483 and parameters: {'kernel_type': 'Matern', 'length_scale': 0.8301984216746515, 'noise_level': 6.626160716107659e-06, 'constant_value': 14346.942960248594, 'nu': 0.5}. Best is trial 1997 with value: 0.359156695282073.
[I 2024-12-04 20:48:51,099] Trial 2143 finished with value: 0.35921132207640377 and parameters: {'kernel_type': 'Matern', 'length_scale': 2525.348621046408, 'noise_level': 0.06648433110487045, 'constant_value': 2063.1066218838064, 'nu': 0.5}. Best is trial 1997 with value: 0.359156695282073.
[I 2024-12-04 20:48:52,272] Trial 2144 finished with value: 0.3592112382968749 and parameters: {'kernel_type': 'Matern', 'length_scale': 11335.796205854402, 'noise_level': 0.00039728653718450126, 'constant_value': 209.38033905552905, 'nu': 0.5}. Best is trial 1997 with value: 0.359156695282073.
[I 2024-12-04 20:48:53,446] Trial 2145 finished with value: 0.3592109103663241 and parameters: {'kernel_type': 'Matern', 'length_scale': 1.4300488605851385, 'noise_level': 0.002193519928174424, 'constant_value': 112.99145109445267, 'nu': 0.5}. Best is trial 1997 with value: 0.359156695282073.
[I 2024-12-04 20:48:53,677] Trial 2146 finished with value: 1.0916567048549892 and parameters: {'kernel_type': 'Matern', 'length_scale': 14.133647091341926, 'noise_level': 0.0054838938269916575, 'constant_value': 1003.9075708105445, 'nu': 0.5}. Best is trial 1997 with value: 0.359156695282073.
[I 2024-12-04 20:48:57,200] Trial 2148 finished with value: 0.35921132574281345 and parameters: {'kernel_type': 'Matern', 'length_scale': 18.415059848509532, 'noise_level': 0.001687270566890823, 'constant_value': 146.6989452937335, 'nu': 0.5}. Best is trial 1997 with value: 0.359156695282073.
[I 2024-12-04 20:48:57,201] Trial 2149 finished with value: 1.091655849386279 and parameters: {'kernel_type': 'Matern', 'length_scale': 0.0014374311149976957, 'noise_level': 1.3980628538448117e-05, 'constant_value': 22785.386992481763, 'nu': 0.5}. Best is trial 1997 with value: 0.359156695282073.
[I 2024-12-04 20:48:57,525] Trial 2147 finished with value: 0.35921114324402026 and parameters: {'kernel_type': 'Matern', 'length_scale': 29.5919733859629, 'noise_level': 0.004323679817839213, 'constant_value': 23.623369400670512, 'nu': 0.5}. Best is trial 1997 with value: 0.359156695282073.
[I 2024-12-04 20:49:01,284] Trial 2150 finished with value: 1.091655849367517 and parameters: {'kernel_type': 'Matern', 'length_scale': 0.10276399998995785, 'noise_level': 0.006317876470220567, 'constant_value': 86.31948115032101, 'nu': 2.5}. Best is trial 1997 with value: 0.359156695282073.
[I 2024-12-04 20:49:02,334] Trial 2151 finished with value: 1.0624161167939181 and parameters: {'kernel_type': 'Matern', 'length_scale': 0.016341618268288453, 'noise_level': 0.0012335532248326578, 'constant_value': 5.8464473197205455, 'nu': 0.5}. Best is trial 1997 with value: 0.359156695282073.
[I 2024-12-04 20:49:03,986] Trial 2152 finished with value: 0.35921052265024667 and parameters: {'kernel_type': 'Matern', 'length_scale': 581.483412277753, 'noise_level': 0.19354900577069073, 'constant_value': 1.2761876099377991, 'nu': 0.5}. Best is trial 1997 with value: 0.359156695282073.
[I 2024-12-04 20:49:06,357] Trial 2155 finished with value: 1.091656704854988 and parameters: {'kernel_type': 'Matern', 'length_scale': 0.46170711838262923, 'noise_level': 0.0073381983863592135, 'constant_value': 2030.033468484599, 'nu': 0.5}. Best is trial 1997 with value: 0.359156695282073.
[I 2024-12-04 20:49:06,883] Trial 2153 finished with value: 0.35921150037664623 and parameters: {'kernel_type': 'Matern', 'length_scale': 869.9862117377434, 'noise_level': 0.8682581089802146, 'constant_value': 33.77047643867722, 'nu': 0.5}. Best is trial 1997 with value: 0.359156695282073.
[I 2024-12-04 20:49:08,014] Trial 2154 finished with value: 0.42868398595010043 and parameters: {'kernel_type': 'RBF', 'length_scale': 29.0775175165715, 'noise_level': 0.003097844071526434, 'constant_value': 723.3751427985235, 'nu': 0.5}. Best is trial 1997 with value: 0.359156695282073.
[I 2024-12-04 20:49:11,277] Trial 2156 finished with value: 0.35921116277101856 and parameters: {'kernel_type': 'Matern', 'length_scale': 5041.08822553516, 'noise_level': 0.9717236304502185, 'constant_value': 175.69956394827145, 'nu': 0.5}. Best is trial 1997 with value: 0.359156695282073.
[I 2024-12-04 20:49:11,955] Trial 2157 finished with value: 1.0624161168907251 and parameters: {'kernel_type': 'Matern', 'length_scale': 266.76675334469473, 'noise_level': 0.00025346355876595115, 'constant_value': 694.2266867673324, 'nu': 1.5}. Best is trial 1997 with value: 0.359156695282073.
[I 2024-12-04 20:49:12,245] Trial 2158 finished with value: 1.062416117226091 and parameters: {'kernel_type': 'Matern', 'length_scale': 3.8095146501077664, 'noise_level': 1.742396776811043e-08, 'constant_value': 0.015574798281468055, 'nu': 2.5}. Best is trial 1997 with value: 0.359156695282073.
[I 2024-12-04 20:49:15,191] Trial 2161 finished with value: 1.091656704854989 and parameters: {'kernel_type': 'Matern', 'length_scale': 2.130832611559148, 'noise_level': 0.005038324088216602, 'constant_value': 712.34677779485, 'nu': 0.5}. Best is trial 1997 with value: 0.359156695282073.
[I 2024-12-04 20:49:17,398] Trial 2160 finished with value: 0.3592112839925459 and parameters: {'kernel_type': 'Matern', 'length_scale': 562.8333155170184, 'noise_level': 0.0002893693582248517, 'constant_value': 1337.6802557389124, 'nu': 0.5}. Best is trial 1997 with value: 0.359156695282073.
[I 2024-12-04 20:49:18,596] Trial 2159 finished with value: 1.0624161171826085 and parameters: {'kernel_type': 'RBF', 'length_scale': 47.70363683192067, 'noise_level': 2.6562820616954347e-05, 'constant_value': 0.002008522035576025, 'nu': 0.5}. Best is trial 1997 with value: 0.359156695282073.
[I 2024-12-04 20:49:18,995] Trial 2162 finished with value: 1.0624161172570763 and parameters: {'kernel_type': 'Matern', 'length_scale': 0.002913538209356931, 'noise_level': 0.0002286383443949956, 'constant_value': 81.99419877350638, 'nu': 0.5}. Best is trial 1997 with value: 0.359156695282073.
[I 2024-12-04 20:49:22,909] Trial 2163 finished with value: 0.3592112399850001 and parameters: {'kernel_type': 'Matern', 'length_scale': 163.7691081061337, 'noise_level': 0.03575210779282977, 'constant_value': 657.3255138624237, 'nu': 0.5}. Best is trial 1997 with value: 0.359156695282073.
[I 2024-12-04 20:49:23,822] Trial 2164 finished with value: 0.3592112361991727 and parameters: {'kernel_type': 'Matern', 'length_scale': 13031.59368700902, 'noise_level': 0.03645952579207187, 'constant_value': 3.3745739557626355, 'nu': 0.5}. Best is trial 1997 with value: 0.359156695282073.
[I 2024-12-04 20:49:24,614] Trial 2165 finished with value: 0.359211252243965 and parameters: {'kernel_type': 'Matern', 'length_scale': 2.0087660050738436, 'noise_level': 0.03512272712872736, 'constant_value': 1900.2318517776357, 'nu': 0.5}. Best is trial 1997 with value: 0.359156695282073.
[I 2024-12-04 20:49:30,057] Trial 2166 finished with value: 1.062416117268552 and parameters: {'kernel_type': 'Matern', 'length_scale': 0.028790216574095844, 'noise_level': 6.219168227310757e-05, 'constant_value': 349.8464929386202, 'nu': 2.5}. Best is trial 1997 with value: 0.359156695282073.
[I 2024-12-04 20:49:32,017] Trial 2167 finished with value: 0.3592111067240102 and parameters: {'kernel_type': 'Matern', 'length_scale': 27.59784573169062, 'noise_level': 0.006124263742473189, 'constant_value': 19.61968039914071, 'nu': 0.5}. Best is trial 1997 with value: 0.359156695282073.
[I 2024-12-04 20:49:32,430] Trial 2168 finished with value: 0.3592112378352624 and parameters: {'kernel_type': 'Matern', 'length_scale': 4.173569037993194, 'noise_level': 0.03617345191092015, 'constant_value': 2909.574642742175, 'nu': 0.5}. Best is trial 1997 with value: 0.359156695282073.
[I 2024-12-04 20:49:33,955] Trial 2169 finished with value: 0.359211270001496 and parameters: {'kernel_type': 'Matern', 'length_scale': 1.4789294864589313, 'noise_level': 0.0008773429444580034, 'constant_value': 612.3291041114213, 'nu': 0.5}. Best is trial 1997 with value: 0.359156695282073.
[I 2024-12-04 20:49:36,296] Trial 2170 finished with value: 1.0916566804444496 and parameters: {'kernel_type': 'Matern', 'length_scale': 5.687180519870567, 'noise_level': 6.829751543782536e-05, 'constant_value': 95124.12499786976, 'nu': 0.5}. Best is trial 1997 with value: 0.359156695282073.
[I 2024-12-04 20:49:41,292] Trial 2171 finished with value: 0.35921084829541844 and parameters: {'kernel_type': 'Matern', 'length_scale': 51.60592694929848, 'noise_level': 0.0162572237837459, 'constant_value': 21.190577574092764, 'nu': 0.5}. Best is trial 1997 with value: 0.359156695282073.
[I 2024-12-04 20:49:42,256] Trial 2172 finished with value: 1.062416116671731 and parameters: {'kernel_type': 'Matern', 'length_scale': 0.007979335072540106, 'noise_level': 0.029431828948273748, 'constant_value': 10.25043652952468, 'nu': 0.5}. Best is trial 1997 with value: 0.359156695282073.
[I 2024-12-04 20:49:45,858] Trial 2173 finished with value: 0.4195661433646127 and parameters: {'kernel_type': 'Matern', 'length_scale': 589.6374965166642, 'noise_level': 0.5689181226614514, 'constant_value': 29.400184678353703, 'nu': 2.5}. Best is trial 1997 with value: 0.359156695282073.
[I 2024-12-04 20:49:46,245] Trial 2174 finished with value: 0.3592112938767533 and parameters: {'kernel_type': 'Matern', 'length_scale': 1.4231417152440675, 'noise_level': 0.0009278266613941885, 'constant_value': 7.03091532205157, 'nu': 0.5}. Best is trial 1997 with value: 0.359156695282073.
[I 2024-12-04 20:49:47,228] Trial 2175 finished with value: 0.35921510711685467 and parameters: {'kernel_type': 'Matern', 'length_scale': 410.4347523498315, 'noise_level': 0.043357412864741984, 'constant_value': 275.64989270615484, 'nu': 0.5}. Best is trial 1997 with value: 0.359156695282073.
[I 2024-12-04 20:49:50,269] Trial 2177 finished with value: 0.35921112617859385 and parameters: {'kernel_type': 'Matern', 'length_scale': 2.817649229358549, 'noise_level': 0.03073557549576467, 'constant_value': 944.790053935744, 'nu': 0.5}. Best is trial 1997 with value: 0.359156695282073.
[I 2024-12-04 20:49:51,592] Trial 2178 finished with value: 0.3592112448024608 and parameters: {'kernel_type': 'Matern', 'length_scale': 1.7984749895259942, 'noise_level': 0.0003959766729851304, 'constant_value': 11.116784791791643, 'nu': 0.5}. Best is trial 1997 with value: 0.359156695282073.
[I 2024-12-04 20:49:51,663] Trial 2176 finished with value: 0.4286837106687857 and parameters: {'kernel_type': 'RBF', 'length_scale': 1101.4249209006132, 'noise_level': 0.1236632023019072, 'constant_value': 19.57987277158947, 'nu': 0.5}. Best is trial 1997 with value: 0.359156695282073.
[I 2024-12-04 20:49:55,852] Trial 2179 finished with value: 0.35921124581726654 and parameters: {'kernel_type': 'Matern', 'length_scale': 958.8135219083603, 'noise_level': 0.8926682896071557, 'constant_value': 2411.9556397083384, 'nu': 0.5}. Best is trial 1997 with value: 0.359156695282073.
[I 2024-12-04 20:49:56,899] Trial 2180 finished with value: 0.35921125725035485 and parameters: {'kernel_type': 'Matern', 'length_scale': 5.099968898075345, 'noise_level': 0.001469786525781273, 'constant_value': 8597.443336065335, 'nu': 0.5}. Best is trial 1997 with value: 0.359156695282073.
[I 2024-12-04 20:49:56,905] Trial 2181 finished with value: 0.3592112388069544 and parameters: {'kernel_type': 'Matern', 'length_scale': 64.35014054030934, 'noise_level': 0.028664302115257882, 'constant_value': 1347.299597659504, 'nu': 0.5}. Best is trial 1997 with value: 0.359156695282073.
[I 2024-12-04 20:49:59,923] Trial 2184 finished with value: 1.062415958879774 and parameters: {'kernel_type': 'Matern', 'length_scale': 0.0661406669548083, 'noise_level': 0.04957401570982316, 'constant_value': 176.31286981084543, 'nu': 0.5}. Best is trial 1997 with value: 0.359156695282073.
[I 2024-12-04 20:50:01,644] Trial 2182 finished with value: 1.0624161172704685 and parameters: {'kernel_type': 'Matern', 'length_scale': 7316.624495223649, 'noise_level': 0.012659020009678425, 'constant_value': 11719.679544546452, 'nu': 1.5}. Best is trial 1997 with value: 0.359156695282073.
[I 2024-12-04 20:50:02,308] Trial 2183 finished with value: 0.35921122581708453 and parameters: {'kernel_type': 'Matern', 'length_scale': 370.1477481377775, 'noise_level': 0.0004597071715447068, 'constant_value': 915.3003549148365, 'nu': 0.5}. Best is trial 1997 with value: 0.359156695282073.
[I 2024-12-04 20:50:05,420] Trial 2185 finished with value: 0.3592112657130105 and parameters: {'kernel_type': 'Matern', 'length_scale': 16264.392980192677, 'noise_level': 0.006654027151421759, 'constant_value': 1239.3870049455302, 'nu': 0.5}. Best is trial 1997 with value: 0.359156695282073.
[I 2024-12-04 20:50:08,323] Trial 2187 finished with value: 1.0624161172629076 and parameters: {'kernel_type': 'RBF', 'length_scale': 0.03216172648177121, 'noise_level': 1.0898788591285268e-09, 'constant_value': 1.622041665215963e-07, 'nu': 2.5}. Best is trial 1997 with value: 0.359156695282073.
[I 2024-12-04 20:50:10,293] Trial 2186 finished with value: 0.3592112595377352 and parameters: {'kernel_type': 'Matern', 'length_scale': 0.1119863853873397, 'noise_level': 0.0003141423694732584, 'constant_value': 811.2625030301805, 'nu': 0.5}. Best is trial 1997 with value: 0.359156695282073.
[I 2024-12-04 20:50:10,713] Trial 2188 finished with value: 0.35921118526579027 and parameters: {'kernel_type': 'Matern', 'length_scale': 109.22105390763625, 'noise_level': 0.000709610011598859, 'constant_value': 4532.94628284115, 'nu': 0.5}. Best is trial 1997 with value: 0.359156695282073.
