[I 2024-12-04 15:11:05,197] Trial 1584 finished with value: 0.48830342149571354 and parameters: {'kernel_type': 'Matern', 'length_scale': 9426.79614989264, 'noise_level': 0.834632399887255, 'constant_value': 77779.29070905442, 'nu': 0.5}. Best is trial 386 with value: 0.4872991004520934.
[I 2024-12-04 15:11:05,736] Trial 1572 finished with value: 0.48830324752232107 and parameters: {'kernel_type': 'Matern', 'length_scale': 41.337983750330196, 'noise_level': 0.08085807532977317, 'constant_value': 90307.04236210218, 'nu': 0.5}. Best is trial 386 with value: 0.4872991004520934.
[I 2024-12-04 15:11:06,631] Trial 1575 finished with value: 0.48830342282503725 and parameters: {'kernel_type': 'Matern', 'length_scale': 994.56708379469, 'noise_level': 0.014821846344318478, 'constant_value': 88714.27910389344, 'nu': 0.5}. Best is trial 386 with value: 0.4872991004520934.
[I 2024-12-04 15:11:09,407] Trial 1577 finished with value: 0.4883034189684147 and parameters: {'kernel_type': 'Matern', 'length_scale': 4739.329552516264, 'noise_level': 0.8030527188751773, 'constant_value': 841.3442650050015, 'nu': 0.5}. Best is trial 386 with value: 0.4872991004520934.
[I 2024-12-04 15:11:09,464] Trial 1581 finished with value: 0.48830341684365575 and parameters: {'kernel_type': 'Matern', 'length_scale': 58663.93676808272, 'noise_level': 0.009686877438237217, 'constant_value': 99468.61457398659, 'nu': 0.5}. Best is trial 386 with value: 0.4872991004520934.
[I 2024-12-04 15:11:09,906] Trial 1579 finished with value: 0.4883034153933773 and parameters: {'kernel_type': 'Matern', 'length_scale': 1478.589541655932, 'noise_level': 0.9519551441541715, 'constant_value': 1898.7479385631111, 'nu': 0.5}. Best is trial 386 with value: 0.4872991004520934.
[I 2024-12-04 15:11:10,332] Trial 1589 finished with value: 1.2401112325574717 and parameters: {'kernel_type': 'RBF', 'length_scale': 484.4135937742732, 'noise_level': 3.4175045815780925e-07, 'constant_value': 0.013990836566195104, 'nu': 2.5}. Best is trial 386 with value: 0.4872991004520934.
[I 2024-12-04 15:11:10,579] Trial 1580 finished with value: 0.48830341812975486 and parameters: {'kernel_type': 'Matern', 'length_scale': 79422.07222429388, 'noise_level': 0.3953322833821373, 'constant_value': 52141.639270770625, 'nu': 0.5}. Best is trial 386 with value: 0.4872991004520934.
[I 2024-12-04 15:11:11,035] Trial 1590 finished with value: 0.48830341929190374 and parameters: {'kernel_type': 'Matern', 'length_scale': 80325.3180438254, 'noise_level': 0.8641786762852897, 'constant_value': 58514.49649265415, 'nu': 0.5}. Best is trial 386 with value: 0.4872991004520934.
[I 2024-12-04 15:11:13,253] Trial 1576 finished with value: 0.566393623678456 and parameters: {'kernel_type': 'Matern', 'length_scale': 646.0042004433728, 'noise_level': 0.8649534639015942, 'constant_value': 66326.10624502397, 'nu': 2.5}. Best is trial 386 with value: 0.4872991004520934.
[I 2024-12-04 15:11:15,119] Trial 1588 finished with value: 1.2614547802261666 and parameters: {'kernel_type': 'Matern', 'length_scale': 94673.40529010189, 'noise_level': 0.3927587143332612, 'constant_value': 0.7521838529715126, 'nu': 0.5}. Best is trial 386 with value: 0.4872991004520934.
[I 2024-12-04 15:11:15,172] Trial 1587 finished with value: 0.4883034295328539 and parameters: {'kernel_type': 'Matern', 'length_scale': 41.50375750492411, 'noise_level': 0.018038552881274872, 'constant_value': 618.9218271386038, 'nu': 0.5}. Best is trial 386 with value: 0.4872991004520934.
[I 2024-12-04 15:11:16,212] Trial 1583 finished with value: 0.48830357929265916 and parameters: {'kernel_type': 'Matern', 'length_scale': 55298.63221010125, 'noise_level': 0.762378417048619, 'constant_value': 126.70206604032751, 'nu': 0.5}. Best is trial 386 with value: 0.4872991004520934.
[I 2024-12-04 15:11:16,812] Trial 1582 finished with value: 0.4883034086016925 and parameters: {'kernel_type': 'Matern', 'length_scale': 91833.95993654327, 'noise_level': 0.003846692053217861, 'constant_value': 1636.3698029613604, 'nu': 0.5}. Best is trial 386 with value: 0.4872991004520934.
[I 2024-12-04 15:11:16,853] Trial 1592 finished with value: 0.48830340690056573 and parameters: {'kernel_type': 'Matern', 'length_scale': 2648.9669380288265, 'noise_level': 0.5703295359068812, 'constant_value': 95441.7295071293, 'nu': 0.5}. Best is trial 386 with value: 0.4872991004520934.
[I 2024-12-04 15:11:17,186] Trial 1593 finished with value: 0.4883034189209161 and parameters: {'kernel_type': 'Matern', 'length_scale': 3070.6662261644165, 'noise_level': 0.012084012158564281, 'constant_value': 228.77664518537495, 'nu': 0.5}. Best is trial 386 with value: 0.4872991004520934.
[I 2024-12-04 15:11:18,177] Trial 1598 finished with value: 0.4883033462413611 and parameters: {'kernel_type': 'Matern', 'length_scale': 98613.35994077612, 'noise_level': 0.7319019645977616, 'constant_value': 77357.28875394857, 'nu': 0.5}. Best is trial 386 with value: 0.4872991004520934.
[I 2024-12-04 15:11:18,628] Trial 1591 finished with value: 0.48830342014628714 and parameters: {'kernel_type': 'Matern', 'length_scale': 1807.5702013149703, 'noise_level': 0.0436896319236827, 'constant_value': 54.268003525986515, 'nu': 0.5}. Best is trial 386 with value: 0.4872991004520934.
[I 2024-12-04 15:11:18,737] Trial 1595 finished with value: 0.48830339472650736 and parameters: {'kernel_type': 'Matern', 'length_scale': 86987.77516087866, 'noise_level': 0.026748826204856548, 'constant_value': 4067.1264456430054, 'nu': 0.5}. Best is trial 386 with value: 0.4872991004520934.
[I 2024-12-04 15:11:19,489] Trial 1586 finished with value: 0.4883035682925612 and parameters: {'kernel_type': 'Matern', 'length_scale': 31.184333464011228, 'noise_level': 0.8553801607757394, 'constant_value': 4.586445423873416, 'nu': 0.5}. Best is trial 386 with value: 0.4872991004520934.
[I 2024-12-04 15:11:19,612] Trial 1596 finished with value: 0.6443853557989652 and parameters: {'kernel_type': 'RBF', 'length_scale': 1.1030643734339551, 'noise_level': 1.7440426832269727e-10, 'constant_value': 3.089370380752227e-06, 'nu': 1.5}. Best is trial 386 with value: 0.4872991004520934.
[I 2024-12-04 15:11:19,760] Trial 1600 finished with value: 0.6443853212341368 and parameters: {'kernel_type': 'RBF', 'length_scale': 36.40268931963004, 'noise_level': 0.8248976411684699, 'constant_value': 595.693130723554, 'nu': 0.5}. Best is trial 386 with value: 0.4872991004520934.
[I 2024-12-04 15:11:20,036] Trial 1585 finished with value: 1.240111232332585 and parameters: {'kernel_type': 'Matern', 'length_scale': 20.822111882187286, 'noise_level': 0.0008023331340908963, 'constant_value': 0.00022959593939745474, 'nu': 1.5}. Best is trial 386 with value: 0.4872991004520934.
[I 2024-12-04 15:11:21,133] Trial 1603 finished with value: 0.4883034242251511 and parameters: {'kernel_type': 'Matern', 'length_scale': 1090.6176058479118, 'noise_level': 0.9575881748660958, 'constant_value': 1155.1830794950813, 'nu': 0.5}. Best is trial 386 with value: 0.4872991004520934.
[I 2024-12-04 15:11:21,627] Trial 1597 finished with value: 0.48830343018403327 and parameters: {'kernel_type': 'Matern', 'length_scale': 3223.7729319905166, 'noise_level': 0.015595672323620297, 'constant_value': 2789.5930247918213, 'nu': 0.5}. Best is trial 386 with value: 0.4872991004520934.
[I 2024-12-04 15:11:21,820] Trial 1601 finished with value: 1.24011123254202 and parameters: {'kernel_type': 'Matern', 'length_scale': 95.49242176456752, 'noise_level': 0.000866602634502713, 'constant_value': 0.007548223707718015, 'nu': 2.5}. Best is trial 386 with value: 0.4872991004520934.
[I 2024-12-04 15:11:23,587] Trial 1594 finished with value: 0.48830341864931054 and parameters: {'kernel_type': 'Matern', 'length_scale': 3632.4922474392715, 'noise_level': 0.011521722102952657, 'constant_value': 2376.107584375112, 'nu': 0.5}. Best is trial 386 with value: 0.4872991004520934.
[I 2024-12-04 15:11:23,680] Trial 1609 finished with value: 0.48830341889534445 and parameters: {'kernel_type': 'Matern', 'length_scale': 1623.4027488419872, 'noise_level': 0.8331863859325722, 'constant_value': 888.7985643549248, 'nu': 0.5}. Best is trial 386 with value: 0.4872991004520934.
[I 2024-12-04 15:11:23,827] Trial 1607 finished with value: 0.4883034188485418 and parameters: {'kernel_type': 'Matern', 'length_scale': 69064.78810280882, 'noise_level': 0.005621871052393311, 'constant_value': 3559.119018840483, 'nu': 0.5}. Best is trial 386 with value: 0.4872991004520934.
[I 2024-12-04 15:11:23,828] Trial 1605 finished with value: 0.4883033964955348 and parameters: {'kernel_type': 'Matern', 'length_scale': 50621.63227075983, 'noise_level': 0.9633549645324397, 'constant_value': 2324.771189753484, 'nu': 0.5}. Best is trial 386 with value: 0.4872991004520934.
[I 2024-12-04 15:11:24,023] Trial 1599 finished with value: 0.48830364378855856 and parameters: {'kernel_type': 'Matern', 'length_scale': 81603.89053074336, 'noise_level': 0.008383477037328457, 'constant_value': 792.1158736862427, 'nu': 0.5}. Best is trial 386 with value: 0.4872991004520934.
[I 2024-12-04 15:11:24,054] Trial 1606 finished with value: 1.2401112330788464 and parameters: {'kernel_type': 'Matern', 'length_scale': 5.0113940992544395, 'noise_level': 0.01129357967544273, 'constant_value': 0.02547515604253422, 'nu': 0.5}. Best is trial 386 with value: 0.4872991004520934.
[I 2024-12-04 15:11:24,553] Trial 1602 finished with value: 0.48830341185604903 and parameters: {'kernel_type': 'Matern', 'length_scale': 1.7428426107474422, 'noise_level': 0.6373444527105356, 'constant_value': 3184.624639973502, 'nu': 0.5}. Best is trial 386 with value: 0.4872991004520934.
[I 2024-12-04 15:11:26,154] Trial 1604 finished with value: 0.48830341920849524 and parameters: {'kernel_type': 'Matern', 'length_scale': 7345.674404322002, 'noise_level': 0.0017837548005470683, 'constant_value': 55597.3564012563, 'nu': 0.5}. Best is trial 386 with value: 0.4872991004520934.
[I 2024-12-04 15:11:26,157] Trial 1611 finished with value: 0.644385974434274 and parameters: {'kernel_type': 'RBF', 'length_scale': 432.7791098278869, 'noise_level': 0.07170008754662587, 'constant_value': 43767.69112268854, 'nu': 0.5}. Best is trial 386 with value: 0.4872991004520934.
[I 2024-12-04 15:11:27,311] Trial 1610 finished with value: 0.488303422082794 and parameters: {'kernel_type': 'Matern', 'length_scale': 4536.768745187029, 'noise_level': 0.027434879458856875, 'constant_value': 1073.6728622124879, 'nu': 0.5}. Best is trial 386 with value: 0.4872991004520934.
[I 2024-12-04 15:11:27,881] Trial 1616 finished with value: 0.4883034189114974 and parameters: {'kernel_type': 'Matern', 'length_scale': 95976.447190515, 'noise_level': 0.4077378540201848, 'constant_value': 27.494457028283, 'nu': 0.5}. Best is trial 386 with value: 0.4872991004520934.
[I 2024-12-04 15:11:30,361] Trial 1608 finished with value: 0.5273053355318978 and parameters: {'kernel_type': 'Matern', 'length_scale': 307.8222641049272, 'noise_level': 0.19053213162611918, 'constant_value': 30.351553776474706, 'nu': 1.5}. Best is trial 386 with value: 0.4872991004520934.
[I 2024-12-04 15:11:32,635] Trial 1619 finished with value: 0.4883034174622274 and parameters: {'kernel_type': 'Matern', 'length_scale': 89443.23795605471, 'noise_level': 0.5749100137128256, 'constant_value': 338.58625634858515, 'nu': 0.5}. Best is trial 386 with value: 0.4872991004520934.
[I 2024-12-04 15:11:32,711] Trial 1613 finished with value: 0.48830351921060416 and parameters: {'kernel_type': 'Matern', 'length_scale': 59116.13907404062, 'noise_level': 0.7901160086194733, 'constant_value': 108.6252220014426, 'nu': 0.5}. Best is trial 386 with value: 0.4872991004520934.
[I 2024-12-04 15:11:32,719] Trial 1615 finished with value: 0.48830341111423503 and parameters: {'kernel_type': 'Matern', 'length_scale': 66827.38660818832, 'noise_level': 0.02805023864873091, 'constant_value': 63694.082255959234, 'nu': 0.5}. Best is trial 386 with value: 0.4872991004520934.
[I 2024-12-04 15:11:33,544] Trial 1614 finished with value: 1.2614547976219832 and parameters: {'kernel_type': 'RBF', 'length_scale': 1.2751026571183603, 'noise_level': 1.0345448376831795e-10, 'constant_value': 0.5202125742231708, 'nu': 1.5}. Best is trial 386 with value: 0.4872991004520934.
[I 2024-12-04 15:11:34,196] Trial 1625 finished with value: 1.240111232574733 and parameters: {'kernel_type': 'Matern', 'length_scale': 96465.46341583294, 'noise_level': 0.021489785555196136, 'constant_value': 5.154697074838079, 'nu': 0.5}. Best is trial 386 with value: 0.4872991004520934.
[I 2024-12-04 15:11:35,037] Trial 1623 finished with value: 0.4883034220919538 and parameters: {'kernel_type': 'Matern', 'length_scale': 99263.53431715164, 'noise_level': 0.0020249036854865688, 'constant_value': 22817.89753895038, 'nu': 0.5}. Best is trial 386 with value: 0.4872991004520934.
[I 2024-12-04 15:11:35,202] Trial 1618 finished with value: 0.4883034195446827 and parameters: {'kernel_type': 'Matern', 'length_scale': 41.323794870494176, 'noise_level': 0.06746690579658464, 'constant_value': 1616.1478239876624, 'nu': 0.5}. Best is trial 386 with value: 0.4872991004520934.
[I 2024-12-04 15:11:35,294] Trial 1612 finished with value: 0.48830316805879453 and parameters: {'kernel_type': 'Matern', 'length_scale': 28.201729315147574, 'noise_level': 0.04661237358666921, 'constant_value': 51.32616716562706, 'nu': 0.5}. Best is trial 386 with value: 0.4872991004520934.
[I 2024-12-04 15:11:35,297] Trial 1620 finished with value: 1.240111231903876 and parameters: {'kernel_type': 'Matern', 'length_scale': 0.0013585889849870624, 'noise_level': 1.1832961895831525e-07, 'constant_value': 5.175894820540974e-05, 'nu': 1.5}. Best is trial 386 with value: 0.4872991004520934.
[I 2024-12-04 15:11:35,314] Trial 1622 finished with value: 0.48830340344461964 and parameters: {'kernel_type': 'Matern', 'length_scale': 0.12400783362934971, 'noise_level': 0.01010058886636065, 'constant_value': 0.8441910595327461, 'nu': 0.5}. Best is trial 386 with value: 0.4872991004520934.
[I 2024-12-04 15:11:37,243] Trial 1629 finished with value: 0.4883033614195131 and parameters: {'kernel_type': 'Matern', 'length_scale': 4.18416700781737, 'noise_level': 0.9548214127183438, 'constant_value': 788.4778366568838, 'nu': 0.5}. Best is trial 386 with value: 0.4872991004520934.
[I 2024-12-04 15:11:39,804] Trial 1628 finished with value: 0.48830326428445053 and parameters: {'kernel_type': 'Matern', 'length_scale': 1123.7800534770204, 'noise_level': 0.8807261020828853, 'constant_value': 5.5850249193629615, 'nu': 0.5}. Best is trial 386 with value: 0.4872991004520934.
[I 2024-12-04 15:11:39,808] Trial 1617 finished with value: 0.4883034045029278 and parameters: {'kernel_type': 'Matern', 'length_scale': 1413.73351917562, 'noise_level': 0.02744057862814548, 'constant_value': 5.886767677008183, 'nu': 0.5}. Best is trial 386 with value: 0.4872991004520934.
[I 2024-12-04 15:11:39,811] Trial 1634 finished with value: 1.261454795394147 and parameters: {'kernel_type': 'Matern', 'length_scale': 2586.5345371514936, 'noise_level': 0.025230517243414106, 'constant_value': 81698.27300845101, 'nu': 0.5}. Best is trial 386 with value: 0.4872991004520934.
[I 2024-12-04 15:11:40,940] Trial 1630 finished with value: 0.48830341532159666 and parameters: {'kernel_type': 'Matern', 'length_scale': 1103.2543497880667, 'noise_level': 0.8214953200081658, 'constant_value': 945.1257688569818, 'nu': 0.5}. Best is trial 386 with value: 0.4872991004520934.
[I 2024-12-04 15:11:41,423] Trial 1627 finished with value: 0.4883034218417644 and parameters: {'kernel_type': 'Matern', 'length_scale': 1322.96122073067, 'noise_level': 0.9312040542698261, 'constant_value': 148.64762082852175, 'nu': 0.5}. Best is trial 386 with value: 0.4872991004520934.
[I 2024-12-04 15:11:41,428] Trial 1632 finished with value: 0.48830340973034425 and parameters: {'kernel_type': 'Matern', 'length_scale': 1041.0006905203159, 'noise_level': 0.04648088470421306, 'constant_value': 6578.860837766121, 'nu': 0.5}. Best is trial 386 with value: 0.4872991004520934.
[I 2024-12-04 15:11:41,913] Trial 1633 finished with value: 0.4883035536601021 and parameters: {'kernel_type': 'Matern', 'length_scale': 878.0581081252494, 'noise_level': 0.09749100919147673, 'constant_value': 1378.4935227291332, 'nu': 0.5}. Best is trial 386 with value: 0.4872991004520934.
[I 2024-12-04 15:11:42,429] Trial 1621 finished with value: 0.4883033667581175 and parameters: {'kernel_type': 'Matern', 'length_scale': 19.008297745585402, 'noise_level': 0.6461677757544317, 'constant_value': 0.08506804777656299, 'nu': 0.5}. Best is trial 386 with value: 0.4872991004520934.
[I 2024-12-04 15:11:44,610] Trial 1636 finished with value: 0.4883034560964518 and parameters: {'kernel_type': 'Matern', 'length_scale': 47.587212491728394, 'noise_level': 0.9105263681907426, 'constant_value': 6302.601989745164, 'nu': 0.5}. Best is trial 386 with value: 0.4872991004520934.
[I 2024-12-04 15:11:44,854] Trial 1626 finished with value: 0.4883034170875805 and parameters: {'kernel_type': 'Matern', 'length_scale': 115.27309662249195, 'noise_level': 0.3492367426793223, 'constant_value': 0.00025340675446558654, 'nu': 0.5}. Best is trial 386 with value: 0.4872991004520934.
[I 2024-12-04 15:11:45,659] Trial 1631 finished with value: 1.240110552573953 and parameters: {'kernel_type': 'Matern', 'length_scale': 0.174775176377888, 'noise_level': 1.019858159294545e-07, 'constant_value': 0.3086760239369841, 'nu': 2.5}. Best is trial 386 with value: 0.4872991004520934.
[I 2024-12-04 15:11:47,436] Trial 1641 finished with value: 0.48830340435780095 and parameters: {'kernel_type': 'Matern', 'length_scale': 3475.356886094527, 'noise_level': 0.06137424038468324, 'constant_value': 65040.758125725544, 'nu': 0.5}. Best is trial 386 with value: 0.4872991004520934.
[I 2024-12-04 15:11:47,615] Trial 1640 finished with value: 0.4883034187482799 and parameters: {'kernel_type': 'Matern', 'length_scale': 5197.566061776246, 'noise_level': 0.0025758654564213474, 'constant_value': 81985.25899757001, 'nu': 0.5}. Best is trial 386 with value: 0.4872991004520934.
[I 2024-12-04 15:11:47,872] Trial 1635 finished with value: 1.261454797635233 and parameters: {'kernel_type': 'Matern', 'length_scale': 56444.419000481925, 'noise_level': 0.18624103319285848, 'constant_value': 65.98871535133347, 'nu': 1.5}. Best is trial 386 with value: 0.4872991004520934.
[I 2024-12-04 15:11:48,643] Trial 1638 finished with value: 0.48830342314948066 and parameters: {'kernel_type': 'Matern', 'length_scale': 84368.66090246614, 'noise_level': 0.014500077145401658, 'constant_value': 1612.2948499594377, 'nu': 0.5}. Best is trial 386 with value: 0.4872991004520934.
[I 2024-12-04 15:11:49,471] Trial 1646 finished with value: 1.240111234354436 and parameters: {'kernel_type': 'RBF', 'length_scale': 119.6130083309239, 'noise_level': 1.5426575714223003e-09, 'constant_value': 16854.38200435477, 'nu': 1.5}. Best is trial 386 with value: 0.4872991004520934.
[I 2024-12-04 15:11:50,824] Trial 1624 finished with value: 0.48830341450233733 and parameters: {'kernel_type': 'Matern', 'length_scale': 95801.57595692795, 'noise_level': 0.04415496185805229, 'constant_value': 38080.551331391034, 'nu': 0.5}. Best is trial 386 with value: 0.4872991004520934.
[I 2024-12-04 15:11:51,523] Trial 1642 finished with value: 0.4883034624331837 and parameters: {'kernel_type': 'Matern', 'length_scale': 3470.8769724424637, 'noise_level': 0.05040891299099005, 'constant_value': 424.36615105199223, 'nu': 0.5}. Best is trial 386 with value: 0.4872991004520934.
[I 2024-12-04 15:11:51,653] Trial 1637 finished with value: 1.2401112325005446 and parameters: {'kernel_type': 'Matern', 'length_scale': 41.366100127844675, 'noise_level': 0.0007022961674712425, 'constant_value': 6.641306509677036e-07, 'nu': 2.5}. Best is trial 386 with value: 0.4872991004520934.
[I 2024-12-04 15:11:52,067] Trial 1639 finished with value: 0.488303417936144 and parameters: {'kernel_type': 'Matern', 'length_scale': 92615.2156542128, 'noise_level': 0.19640606728042811, 'constant_value': 8.663481653815518, 'nu': 0.5}. Best is trial 386 with value: 0.4872991004520934.
[I 2024-12-04 15:11:52,076] Trial 1643 finished with value: 0.4883033824241353 and parameters: {'kernel_type': 'Matern', 'length_scale': 15.125061270275477, 'noise_level': 0.01714946420080793, 'constant_value': 0.9414569668288646, 'nu': 0.5}. Best is trial 386 with value: 0.4872991004520934.
[I 2024-12-04 15:11:52,082] Trial 1647 finished with value: 0.48830343321247477 and parameters: {'kernel_type': 'Matern', 'length_scale': 468.6098780181296, 'noise_level': 0.16763478488165892, 'constant_value': 92784.04472985705, 'nu': 0.5}. Best is trial 386 with value: 0.4872991004520934.
[I 2024-12-04 15:11:52,104] Trial 1644 finished with value: 0.48830346705023814 and parameters: {'kernel_type': 'Matern', 'length_scale': 1559.2598055252288, 'noise_level': 0.08894926722474888, 'constant_value': 165.351654708356, 'nu': 0.5}. Best is trial 386 with value: 0.4872991004520934.
[I 2024-12-04 15:11:52,777] Trial 1650 finished with value: 0.4883034179640665 and parameters: {'kernel_type': 'Matern', 'length_scale': 1367.56176670996, 'noise_level': 0.005372307079635485, 'constant_value': 74758.6121540132, 'nu': 0.5}. Best is trial 386 with value: 0.4872991004520934.
[I 2024-12-04 15:11:53,058] Trial 1645 finished with value: 0.488303438839426 and parameters: {'kernel_type': 'Matern', 'length_scale': 0.5280347373915989, 'noise_level': 5.0764430047755e-05, 'constant_value': 0.004500692357991657, 'nu': 0.5}. Best is trial 386 with value: 0.4872991004520934.
[I 2024-12-04 15:11:53,890] Trial 1649 finished with value: 0.48830341360611684 and parameters: {'kernel_type': 'Matern', 'length_scale': 97.21678966476227, 'noise_level': 0.03615507196102936, 'constant_value': 4.195182449239328, 'nu': 0.5}. Best is trial 386 with value: 0.4872991004520934.
