[I 2024-12-03 18:46:54,234] Trial 867 finished with value: 0.39269005056993767 and parameters: {'kernel': 'rbf', 'C': 96.5623744923546, 'gamma': 0.08941673699666239, 'epsilon': 0.1647400871880267}. Best is trial 88 with value: 0.3542875001421725.
[I 2024-12-03 18:46:54,437] Trial 57 finished with value: 3.3060658957243154 and parameters: {'kernel': 'poly', 'C': 46.88315789323832, 'gamma': 0.05734808007253528, 'epsilon': 0.13601899755001978}. Best is trial 88 with value: 0.3542875001421725.
[I 2024-12-03 18:46:55,044] Trial 869 finished with value: 0.5907830692356637 and parameters: {'kernel': 'rbf', 'C': 26.038341155139666, 'gamma': 0.13439273808113916, 'epsilon': 0.5405024033536876}. Best is trial 88 with value: 0.3542875001421725.
[I 2024-12-03 18:46:55,045] Trial 870 finished with value: 0.42806884310900745 and parameters: {'kernel': 'rbf', 'C': 19.879766616983016, 'gamma': 0.01617089537869638, 'epsilon': 0.21015980105319226}. Best is trial 88 with value: 0.3542875001421725.
[I 2024-12-03 18:46:55,175] Trial 847 finished with value: 1.2647395486393058 and parameters: {'kernel': 'poly', 'C': 75.19147585573694, 'gamma': 0.019206047095246006, 'epsilon': 0.2186071288263769}. Best is trial 88 with value: 0.3542875001421725.
[I 2024-12-03 18:46:56,933] Trial 873 finished with value: 0.5987656380268542 and parameters: {'kernel': 'rbf', 'C': 27.392077642088033, 'gamma': 0.028582812603456166, 'epsilon': 0.8695574020166776}. Best is trial 88 with value: 0.3542875001421725.
[I 2024-12-03 18:46:56,939] Trial 872 finished with value: 0.4868338586017364 and parameters: {'kernel': 'rbf', 'C': 16.25445805678835, 'gamma': 0.0034912647982702286, 'epsilon': 0.5021044044773144}. Best is trial 88 with value: 0.3542875001421725.
[I 2024-12-03 18:46:57,032] Trial 871 finished with value: 1950.3218967612565 and parameters: {'kernel': 'sigmoid', 'C': 95.17433909804151, 'gamma': 0.03618249301907211, 'epsilon': 0.12599608658927344}. Best is trial 88 with value: 0.3542875001421725.
[I 2024-12-03 18:46:57,448] Trial 876 finished with value: 0.6340177204878813 and parameters: {'kernel': 'rbf', 'C': 99.17437681198865, 'gamma': 0.1681342455560494, 'epsilon': 0.5683669548307968}. Best is trial 88 with value: 0.3542875001421725.
[I 2024-12-03 18:46:57,866] Trial 875 finished with value: 1.3541625090685163 and parameters: {'kernel': 'sigmoid', 'C': 0.038010947873745926, 'gamma': 0.07113551495024405, 'epsilon': 0.002397462424004094}. Best is trial 88 with value: 0.3542875001421725.
[I 2024-12-03 18:46:58,154] Trial 874 finished with value: 0.40939025029890075 and parameters: {'kernel': 'rbf', 'C': 98.70716216935338, 'gamma': 0.009659255650336068, 'epsilon': 0.14600439805739265}. Best is trial 88 with value: 0.3542875001421725.
[I 2024-12-03 18:46:58,847] Trial 877 finished with value: 0.3805038338633732 and parameters: {'kernel': 'rbf', 'C': 92.52673072666947, 'gamma': 0.03876351340674166, 'epsilon': 0.3453245026984913}. Best is trial 88 with value: 0.3542875001421725.
[I 2024-12-03 18:46:59,055] Trial 879 finished with value: 0.3945549871291543 and parameters: {'kernel': 'rbf', 'C': 96.8670113618133, 'gamma': 0.03577290402931358, 'epsilon': 0.4186628068372764}. Best is trial 88 with value: 0.3542875001421725.
[I 2024-12-03 18:47:00,099] Trial 880 finished with value: 0.43932125590837806 and parameters: {'kernel': 'rbf', 'C': 19.357888761950782, 'gamma': 0.11779633732919198, 'epsilon': 0.1451980160280304}. Best is trial 88 with value: 0.3542875001421725.
[I 2024-12-03 18:47:00,439] Trial 878 finished with value: 0.3803561779186661 and parameters: {'kernel': 'rbf', 'C': 96.84855852719309, 'gamma': 0.016513516029100884, 'epsilon': 0.13766960375613393}. Best is trial 88 with value: 0.3542875001421725.
[I 2024-12-03 18:47:00,441] Trial 881 finished with value: 0.50744227942385 and parameters: {'kernel': 'rbf', 'C': 99.1865339096841, 'gamma': 0.19295345540842795, 'epsilon': 0.11964573380927089}. Best is trial 88 with value: 0.3542875001421725.
[I 2024-12-03 18:47:01,050] Trial 808 finished with value: 0.734728958768867 and parameters: {'kernel': 'linear', 'C': 87.95002916746922, 'gamma': 0.07747115439545581, 'epsilon': 0.3942784012094276}. Best is trial 88 with value: 0.3542875001421725.
[I 2024-12-03 18:47:01,344] Trial 883 finished with value: 0.4154573054232736 and parameters: {'kernel': 'rbf', 'C': 19.61127686088929, 'gamma': 0.0156417001091355, 'epsilon': 0.06310516555194973}. Best is trial 88 with value: 0.3542875001421725.
[I 2024-12-03 18:47:01,459] Trial 882 finished with value: 0.4427405962797672 and parameters: {'kernel': 'rbf', 'C': 4.097944727730131, 'gamma': 0.012350535938994208, 'epsilon': 0.08814280337738148}. Best is trial 88 with value: 0.3542875001421725.
[I 2024-12-03 18:47:01,626] Trial 884 finished with value: 0.43566689068986714 and parameters: {'kernel': 'rbf', 'C': 19.113731152011244, 'gamma': 0.01523503654511877, 'epsilon': 0.15698487297380706}. Best is trial 88 with value: 0.3542875001421725.
[I 2024-12-03 18:47:03,719] Trial 885 finished with value: 0.3670401903981517 and parameters: {'kernel': 'rbf', 'C': 82.76321472396182, 'gamma': 0.02621134553970736, 'epsilon': 0.14616548674328148}. Best is trial 88 with value: 0.3542875001421725.
[I 2024-12-03 18:47:04,220] Trial 887 finished with value: 0.4199931413323358 and parameters: {'kernel': 'rbf', 'C': 16.92917125397451, 'gamma': 0.0272338836498574, 'epsilon': 0.1262352780166364}. Best is trial 88 with value: 0.3542875001421725.
[I 2024-12-03 18:47:04,851] Trial 886 finished with value: 0.49036624801421835 and parameters: {'kernel': 'rbf', 'C': 17.257513706912704, 'gamma': 0.12928965875704335, 'epsilon': 0.27851518323309776}. Best is trial 88 with value: 0.3542875001421725.
[I 2024-12-03 18:47:06,069] Trial 890 finished with value: 0.3705106963491475 and parameters: {'kernel': 'rbf', 'C': 84.93314573343805, 'gamma': 0.02329814097814952, 'epsilon': 0.3493816717505362}. Best is trial 88 with value: 0.3542875001421725.
[I 2024-12-03 18:47:06,117] Trial 539 finished with value: 0.7959264022836229 and parameters: {'kernel': 'linear', 'C': 75.09561440824284, 'gamma': 0.00013882258431865467, 'epsilon': 0.01806688370194589}. Best is trial 88 with value: 0.3542875001421725.
[I 2024-12-03 18:47:06,327] Trial 891 finished with value: 0.3803284691116118 and parameters: {'kernel': 'rbf', 'C': 93.24927594646215, 'gamma': 0.0739050585773989, 'epsilon': 0.08891024602270432}. Best is trial 88 with value: 0.3542875001421725.
[I 2024-12-03 18:47:06,734] Trial 889 finished with value: 0.40466968062337677 and parameters: {'kernel': 'rbf', 'C': 92.63362315584288, 'gamma': 0.07227812428285038, 'epsilon': 0.3016316577747152}. Best is trial 88 with value: 0.3542875001421725.
[I 2024-12-03 18:47:07,646] Trial 888 finished with value: 0.4154296892198818 and parameters: {'kernel': 'rbf', 'C': 17.134232732472594, 'gamma': 0.053865055962896716, 'epsilon': 0.3209635608986538}. Best is trial 88 with value: 0.3542875001421725.
[I 2024-12-03 18:47:09,932] Trial 233 finished with value: 1.0430052944535604 and parameters: {'kernel': 'poly', 'C': 51.981669154944235, 'gamma': 0.016527707673620287, 'epsilon': 0.05117223318600132}. Best is trial 88 with value: 0.3542875001421725.
[I 2024-12-03 18:47:10,182] Trial 893 finished with value: 0.39072618585651164 and parameters: {'kernel': 'rbf', 'C': 21.946879906451485, 'gamma': 0.057796635393065406, 'epsilon': 0.12041476916593909}. Best is trial 88 with value: 0.3542875001421725.
[I 2024-12-03 18:47:10,206] Trial 892 finished with value: 0.4019830107909842 and parameters: {'kernel': 'rbf', 'C': 96.1218006639757, 'gamma': 0.07622930194161191, 'epsilon': 0.2745625305831567}. Best is trial 88 with value: 0.3542875001421725.
[I 2024-12-03 18:47:10,408] Trial 895 finished with value: 0.4062467315783481 and parameters: {'kernel': 'rbf', 'C': 93.008762169577, 'gamma': 0.010671024026313475, 'epsilon': 0.1323884137139161}. Best is trial 88 with value: 0.3542875001421725.
[I 2024-12-03 18:47:10,840] Trial 894 finished with value: 0.5050596909898616 and parameters: {'kernel': 'rbf', 'C': 99.3462113494569, 'gamma': 0.17640473400333356, 'epsilon': 0.17830930602475747}. Best is trial 88 with value: 0.3542875001421725.
[I 2024-12-03 18:47:11,819] Trial 896 finished with value: 0.43819927665080965 and parameters: {'kernel': 'rbf', 'C': 16.74539050595583, 'gamma': 0.01691947006555398, 'epsilon': 0.1822812010865178}. Best is trial 88 with value: 0.3542875001421725.
[I 2024-12-03 18:47:12,495] Trial 898 finished with value: 0.3798016193556683 and parameters: {'kernel': 'rbf', 'C': 96.7495388283054, 'gamma': 0.0764704783296736, 'epsilon': 0.14958127146701763}. Best is trial 88 with value: 0.3542875001421725.
[I 2024-12-03 18:47:13,544] Trial 899 finished with value: 0.36536055118487026 and parameters: {'kernel': 'rbf', 'C': 96.1637516830989, 'gamma': 0.0320686693924781, 'epsilon': 0.11693512744259531}. Best is trial 88 with value: 0.3542875001421725.
[I 2024-12-03 18:47:14,837] Trial 902 finished with value: 0.8112410501819962 and parameters: {'kernel': 'linear', 'C': 0.022472654109183247, 'gamma': 0.03682003385822546, 'epsilon': 0.2938454087257121}. Best is trial 88 with value: 0.3542875001421725.
[I 2024-12-03 18:47:14,839] Trial 901 finished with value: 0.4086119210720726 and parameters: {'kernel': 'rbf', 'C': 20.547126917161158, 'gamma': 0.026753979773297843, 'epsilon': 0.19227126178688347}. Best is trial 88 with value: 0.3542875001421725.
[I 2024-12-03 18:47:15,118] Trial 904 finished with value: 0.38590989390304503 and parameters: {'kernel': 'rbf', 'C': 96.8023684426284, 'gamma': 0.0804216991439799, 'epsilon': 0.10387550116198294}. Best is trial 88 with value: 0.3542875001421725.
[I 2024-12-03 18:47:15,754] Trial 903 finished with value: 0.40342407657169804 and parameters: {'kernel': 'rbf', 'C': 21.40351067970893, 'gamma': 0.04914960223623082, 'epsilon': 0.037814949598463446}. Best is trial 88 with value: 0.3542875001421725.
[I 2024-12-03 18:47:15,843] Trial 905 finished with value: 0.4114150987655115 and parameters: {'kernel': 'rbf', 'C': 97.00056608530008, 'gamma': 0.0061302184481163875, 'epsilon': 0.05552330111380121}. Best is trial 88 with value: 0.3542875001421725.
[I 2024-12-03 18:47:16,675] Trial 907 finished with value: 0.40600033253055084 and parameters: {'kernel': 'rbf', 'C': 94.11167318114794, 'gamma': 0.02998312804351899, 'epsilon': 0.4895538102914839}. Best is trial 88 with value: 0.3542875001421725.
[I 2024-12-03 18:47:16,999] Trial 906 finished with value: 0.39712437369969034 and parameters: {'kernel': 'rbf', 'C': 98.8145867923276, 'gamma': 0.10084988071874926, 'epsilon': 0.07871486171093335}. Best is trial 88 with value: 0.3542875001421725.
[I 2024-12-03 18:47:17,287] Trial 758 finished with value: 0.7845183525877001 and parameters: {'kernel': 'linear', 'C': 87.94798305415046, 'gamma': 0.0028439028812927273, 'epsilon': 0.1310193395748476}. Best is trial 88 with value: 0.3542875001421725.
[I 2024-12-03 18:47:17,393] Trial 909 finished with value: 0.6513394433305831 and parameters: {'kernel': 'rbf', 'C': 16.049482195298815, 'gamma': 0.30177461630244745, 'epsilon': 0.3867542986193616}. Best is trial 88 with value: 0.3542875001421725.
[I 2024-12-03 18:47:18,274] Trial 910 finished with value: 0.36989818256040713 and parameters: {'kernel': 'rbf', 'C': 95.74601539888495, 'gamma': 0.03808539831402822, 'epsilon': 0.31063940201726975}. Best is trial 88 with value: 0.3542875001421725.
[I 2024-12-03 18:47:19,215] Trial 911 finished with value: 0.6776505824243432 and parameters: {'kernel': 'rbf', 'C': 78.28280109500582, 'gamma': 0.0034778212767202945, 'epsilon': 0.9230985417244726}. Best is trial 88 with value: 0.3542875001421725.
[I 2024-12-03 18:47:19,808] Trial 913 finished with value: 0.7830830640353824 and parameters: {'kernel': 'rbf', 'C': 0.8721395804524832, 'gamma': 0.08091932419214619, 'epsilon': 0.9422097072642285}. Best is trial 88 with value: 0.3542875001421725.
[I 2024-12-03 18:47:21,332] Trial 908 finished with value: 0.3686453805614128 and parameters: {'kernel': 'rbf', 'C': 91.26372809621823, 'gamma': 0.02238653528085332, 'epsilon': 0.09036560412479465}. Best is trial 88 with value: 0.3542875001421725.
[I 2024-12-03 18:47:21,828] Trial 914 finished with value: 0.41603845296824166 and parameters: {'kernel': 'rbf', 'C': 18.22379815167874, 'gamma': 0.018983874452545218, 'epsilon': 0.26576556168032733}. Best is trial 88 with value: 0.3542875001421725.
[I 2024-12-03 18:47:23,048] Trial 915 finished with value: 0.42576926209322435 and parameters: {'kernel': 'rbf', 'C': 18.49472591992585, 'gamma': 0.11349062837139154, 'epsilon': 0.09550773231045599}. Best is trial 88 with value: 0.3542875001421725.
[I 2024-12-03 18:47:23,073] Trial 916 finished with value: 0.4398590457246225 and parameters: {'kernel': 'rbf', 'C': 88.95753117610364, 'gamma': 0.0037933450045762396, 'epsilon': 0.3015325907671679}. Best is trial 88 with value: 0.3542875001421725.
[I 2024-12-03 18:47:23,074] Trial 918 finished with value: 0.39714815189231273 and parameters: {'kernel': 'rbf', 'C': 21.727750409853297, 'gamma': 0.04368415846014713, 'epsilon': 0.28780710210729965}. Best is trial 88 with value: 0.3542875001421725.
[I 2024-12-03 18:47:23,132] Trial 917 finished with value: 0.41784125528886806 and parameters: {'kernel': 'rbf', 'C': 19.8727903092019, 'gamma': 0.03254086880607575, 'epsilon': 0.08562068535626963}. Best is trial 88 with value: 0.3542875001421725.
[I 2024-12-03 18:47:23,585] Trial 919 finished with value: 0.3663413453484223 and parameters: {'kernel': 'rbf', 'C': 94.54271357085499, 'gamma': 0.023406728064328742, 'epsilon': 0.13416785084583252}. Best is trial 88 with value: 0.3542875001421725.
[I 2024-12-03 18:47:24,543] Trial 912 finished with value: 0.7942851708883638 and parameters: {'kernel': 'linear', 'C': 7.121604938198933, 'gamma': 0.003983924749527452, 'epsilon': 0.010777643151020982}. Best is trial 88 with value: 0.3542875001421725.
[I 2024-12-03 18:47:25,350] Trial 920 finished with value: 1.0565784901425477 and parameters: {'kernel': 'sigmoid', 'C': 0.009430270680849718, 'gamma': 0.1769073865431828, 'epsilon': 0.3278003077498204}. Best is trial 88 with value: 0.3542875001421725.
[I 2024-12-03 18:47:26,066] Trial 924 finished with value: 0.35914852537943 and parameters: {'kernel': 'rbf', 'C': 96.95693265301688, 'gamma': 0.0478287210347932, 'epsilon': 0.06931841626003693}. Best is trial 88 with value: 0.3542875001421725.
[I 2024-12-03 18:47:26,304] Trial 922 finished with value: 1578.794459369977 and parameters: {'kernel': 'sigmoid', 'C': 78.9066596688089, 'gamma': 0.11126545715803036, 'epsilon': 0.1880869590017327}. Best is trial 88 with value: 0.3542875001421725.
[I 2024-12-03 18:47:26,305] Trial 926 finished with value: 0.36427859557833553 and parameters: {'kernel': 'rbf', 'C': 98.09029610560499, 'gamma': 0.03010057049953842, 'epsilon': 0.21050700685888318}. Best is trial 88 with value: 0.3542875001421725.
[I 2024-12-03 18:47:26,836] Trial 923 finished with value: 0.40046227495786174 and parameters: {'kernel': 'rbf', 'C': 24.17324995109293, 'gamma': 0.09241398616699771, 'epsilon': 0.09213601715945956}. Best is trial 88 with value: 0.3542875001421725.
[I 2024-12-03 18:47:26,837] Trial 925 finished with value: 0.4873124934995198 and parameters: {'kernel': 'rbf', 'C': 2.725240690285951, 'gamma': 0.03459301806447252, 'epsilon': 0.18355009398982333}. Best is trial 88 with value: 0.3542875001421725.
[I 2024-12-03 18:47:27,726] Trial 927 finished with value: 0.37192324662655013 and parameters: {'kernel': 'rbf', 'C': 99.49102075234353, 'gamma': 0.023861364078307, 'epsilon': 0.19447300929929662}. Best is trial 88 with value: 0.3542875001421725.
[I 2024-12-03 18:47:28,990] Trial 930 finished with value: 0.42643276208833075 and parameters: {'kernel': 'rbf', 'C': 13.598866286941943, 'gamma': 0.025892788204847344, 'epsilon': 0.10208297932701521}. Best is trial 88 with value: 0.3542875001421725.
[I 2024-12-03 18:47:29,103] Trial 929 finished with value: 0.5501193828477426 and parameters: {'kernel': 'rbf', 'C': 97.68663678921469, 'gamma': 0.14156683896749295, 'epsilon': 0.41698530183467386}. Best is trial 88 with value: 0.3542875001421725.
[I 2024-12-03 18:47:29,157] Trial 931 finished with value: 0.552382525317952 and parameters: {'kernel': 'rbf', 'C': 31.761136841315633, 'gamma': 0.2206709875348818, 'epsilon': 0.20681382002107077}. Best is trial 88 with value: 0.3542875001421725.
[I 2024-12-03 18:47:29,697] Trial 928 finished with value: 0.7873486866768578 and parameters: {'kernel': 'linear', 'C': 1.79470924953094, 'gamma': 0.0013556570535668813, 'epsilon': 0.13292789329363947}. Best is trial 88 with value: 0.3542875001421725.
[I 2024-12-03 18:47:29,870] Trial 932 finished with value: 0.9726457293069158 and parameters: {'kernel': 'sigmoid', 'C': 0.09583700884661826, 'gamma': 0.0003788973194618156, 'epsilon': 0.009928053108555194}. Best is trial 88 with value: 0.3542875001421725.
[I 2024-12-03 18:47:30,325] Trial 933 finished with value: 0.4120504159714985 and parameters: {'kernel': 'rbf', 'C': 14.433333392411631, 'gamma': 0.0697916933601104, 'epsilon': 0.1508869701829604}. Best is trial 88 with value: 0.3542875001421725.
[I 2024-12-03 18:47:30,906] Trial 934 finished with value: 0.3668965627283935 and parameters: {'kernel': 'rbf', 'C': 88.1924286320462, 'gamma': 0.02315642068831142, 'epsilon': 0.12749084112296796}. Best is trial 88 with value: 0.3542875001421725.
[I 2024-12-03 18:47:31,645] Trial 935 finished with value: 0.41804505011406035 and parameters: {'kernel': 'rbf', 'C': 89.42758996734274, 'gamma': 0.11101503050023245, 'epsilon': 0.15162997181007404}. Best is trial 88 with value: 0.3542875001421725.
[I 2024-12-03 18:47:31,909] Trial 939 finished with value: 0.46717872381864217 and parameters: {'kernel': 'rbf', 'C': 20.991513688844222, 'gamma': 0.14921974796456303, 'epsilon': 0.11397686470267478}. Best is trial 88 with value: 0.3542875001421725.
[I 2024-12-03 18:47:32,953] Trial 938 finished with value: 0.368572542201173 and parameters: {'kernel': 'rbf', 'C': 93.58750007783559, 'gamma': 0.027972123905363556, 'epsilon': 0.19446489484371848}. Best is trial 88 with value: 0.3542875001421725.
[I 2024-12-03 18:47:33,593] Trial 936 finished with value: 0.44088478192174885 and parameters: {'kernel': 'rbf', 'C': 17.182294572121503, 'gamma': 0.015449110121179685, 'epsilon': 0.3936777615811249}. Best is trial 88 with value: 0.3542875001421725.
[I 2024-12-03 18:47:33,595] Trial 940 finished with value: 0.4180882606762357 and parameters: {'kernel': 'rbf', 'C': 19.235797728298493, 'gamma': 0.004363279266590415, 'epsilon': 0.15774204151848528}. Best is trial 88 with value: 0.3542875001421725.
[I 2024-12-03 18:47:33,894] Trial 937 finished with value: 0.3775880579606774 and parameters: {'kernel': 'rbf', 'C': 97.83217419791735, 'gamma': 0.056251087172364725, 'epsilon': 0.04511945881407974}. Best is trial 88 with value: 0.3542875001421725.
[I 2024-12-03 18:47:34,180] Trial 942 finished with value: 0.41896550914364133 and parameters: {'kernel': 'rbf', 'C': 22.10968317364818, 'gamma': 0.0768554844357011, 'epsilon': 0.276542212449503}. Best is trial 88 with value: 0.3542875001421725.
[I 2024-12-03 18:47:34,814] Trial 941 finished with value: 0.35604194843390785 and parameters: {'kernel': 'rbf', 'C': 95.69653888996746, 'gamma': 0.048109359505047, 'epsilon': 0.09298191125567078}. Best is trial 88 with value: 0.3542875001421725.
[I 2024-12-03 18:47:35,724] Trial 944 finished with value: 0.41554999911816026 and parameters: {'kernel': 'rbf', 'C': 16.861809729423147, 'gamma': 0.0894279588478424, 'epsilon': 0.026861860770326228}. Best is trial 88 with value: 0.3542875001421725.
[I 2024-12-03 18:47:35,955] Trial 946 finished with value: 0.43654900542094294 and parameters: {'kernel': 'rbf', 'C': 12.973736884915004, 'gamma': 0.024508203346536393, 'epsilon': 0.05351886791576169}. Best is trial 88 with value: 0.3542875001421725.
[I 2024-12-03 18:47:36,363] Trial 947 finished with value: 1.0666015089762972 and parameters: {'kernel': 'rbf', 'C': 0.0010069798494922926, 'gamma': 0.0017573871754479834, 'epsilon': 0.004999317952670173}. Best is trial 88 with value: 0.3542875001421725.
[I 2024-12-03 18:47:36,836] Trial 945 finished with value: 0.3983675746699347 and parameters: {'kernel': 'rbf', 'C': 33.40420459659857, 'gamma': 0.008295340090495956, 'epsilon': 0.03962645912560865}. Best is trial 88 with value: 0.3542875001421725.
[I 2024-12-03 18:47:37,066] Trial 948 finished with value: 0.4378364031180515 and parameters: {'kernel': 'rbf', 'C': 18.44265042125449, 'gamma': 0.12538860354805148, 'epsilon': 0.07818027083631009}. Best is trial 88 with value: 0.3542875001421725.
[I 2024-12-03 18:47:37,679] Trial 949 finished with value: 0.35661249716977145 and parameters: {'kernel': 'rbf', 'C': 99.49200636707207, 'gamma': 0.043525535844746804, 'epsilon': 0.18997322632450592}. Best is trial 88 with value: 0.3542875001421725.
[I 2024-12-03 18:47:38,470] Trial 950 finished with value: 0.4209860291115399 and parameters: {'kernel': 'rbf', 'C': 19.273603125694887, 'gamma': 0.03561160802826205, 'epsilon': 0.06387776922476845}. Best is trial 88 with value: 0.3542875001421725.
[I 2024-12-03 18:47:38,898] Trial 951 finished with value: 0.4211121713644198 and parameters: {'kernel': 'rbf', 'C': 25.961020127294844, 'gamma': 0.014719802792479007, 'epsilon': 0.06393641870716278}. Best is trial 88 with value: 0.3542875001421725.
[I 2024-12-03 18:47:38,931] Trial 952 finished with value: 0.6205713568970465 and parameters: {'kernel': 'rbf', 'C': 9.257228297378779, 'gamma': 0.3816126909304849, 'epsilon': 0.037010933434390235}. Best is trial 88 with value: 0.3542875001421725.
[I 2024-12-03 18:47:40,037] Trial 954 finished with value: 0.41091412452699805 and parameters: {'kernel': 'rbf', 'C': 18.40811630078029, 'gamma': 0.04561099365312163, 'epsilon': 0.08684878653695928}. Best is trial 88 with value: 0.3542875001421725.
