[I 2024-12-04 20:02:38,724] Trial 706 finished with value: 0.3592112416740698 and parameters: {'kernel_type': 'Matern', 'length_scale': 8.414136038845557, 'noise_level': 0.023364520438331374, 'constant_value': 75840.07350365171, 'nu': 0.5}. Best is trial 448 with value: 0.3592093758005386.
[I 2024-12-04 20:02:41,080] Trial 707 finished with value: 1.062415993106997 and parameters: {'kernel_type': 'Matern', 'length_scale': 0.06509118828134729, 'noise_level': 0.03907605955307321, 'constant_value': 20.975620893819883, 'nu': 0.5}. Best is trial 448 with value: 0.3592093758005386.
[I 2024-12-04 20:02:43,207] Trial 709 finished with value: 0.4286835158066126 and parameters: {'kernel_type': 'RBF', 'length_scale': 94.91549634192212, 'noise_level': 0.04990791403449943, 'constant_value': 1.639737043562661, 'nu': 0.5}. Best is trial 448 with value: 0.3592093758005386.
[I 2024-12-04 20:02:45,727] Trial 710 finished with value: 0.35921066092177134 and parameters: {'kernel_type': 'Matern', 'length_scale': 0.27636288357192995, 'noise_level': 7.835467586371494e-05, 'constant_value': 23.0097173075651, 'nu': 0.5}. Best is trial 448 with value: 0.3592093758005386.
[I 2024-12-04 20:02:46,962] Trial 708 finished with value: 0.35921125733560844 and parameters: {'kernel_type': 'Matern', 'length_scale': 0.07376581867673039, 'noise_level': 0.9462832514881063, 'constant_value': 418.23082425734634, 'nu': 0.5}. Best is trial 448 with value: 0.3592093758005386.
[I 2024-12-04 20:02:50,570] Trial 713 finished with value: 1.062416117268891 and parameters: {'kernel_type': 'RBF', 'length_scale': 4.409683061801317e-05, 'noise_level': 0.0032720205653389207, 'constant_value': 1.7564910408098693, 'nu': 2.5}. Best is trial 448 with value: 0.3592093758005386.
[I 2024-12-04 20:02:50,571] Trial 712 finished with value: 1.062416117267376 and parameters: {'kernel_type': 'Matern', 'length_scale': 0.02146939428913679, 'noise_level': 0.0007219755559353981, 'constant_value': 58.22823278783865, 'nu': 0.5}. Best is trial 448 with value: 0.3592093758005386.
[I 2024-12-04 20:02:50,847] Trial 711 finished with value: 0.42868347629833375 and parameters: {'kernel_type': 'RBF', 'length_scale': 2.6341278064146625, 'noise_level': 0.11933335272064002, 'constant_value': 31952.4243417006, 'nu': 0.5}. Best is trial 448 with value: 0.3592093758005386.
[I 2024-12-04 20:02:53,473] Trial 716 finished with value: 1.0916558493902273 and parameters: {'kernel_type': 'Matern', 'length_scale': 0.00033236251251439133, 'noise_level': 4.179765643158354e-06, 'constant_value': 4.3535185398315805, 'nu': 0.5}. Best is trial 448 with value: 0.3592093758005386.
[I 2024-12-04 20:02:55,094] Trial 714 finished with value: 0.3592110145557821 and parameters: {'kernel_type': 'Matern', 'length_scale': 1.4596761410019907, 'noise_level': 9.111861907768003e-05, 'constant_value': 59.39991925137625, 'nu': 0.5}. Best is trial 448 with value: 0.3592093758005386.
[I 2024-12-04 20:02:56,844] Trial 715 finished with value: 0.3592112108723908 and parameters: {'kernel_type': 'Matern', 'length_scale': 0.1634880931587312, 'noise_level': 7.592578883904172e-05, 'constant_value': 10.624464631601036, 'nu': 0.5}. Best is trial 448 with value: 0.3592093758005386.
[I 2024-12-04 20:02:59,124] Trial 717 finished with value: 1.062416117685176 and parameters: {'kernel_type': 'RBF', 'length_scale': 0.0013247066650152242, 'noise_level': 0.18411662888786273, 'constant_value': 0.010714011489985072, 'nu': 1.5}. Best is trial 448 with value: 0.3592093758005386.
[I 2024-12-04 20:02:59,585] Trial 719 finished with value: 1.0624161172843452 and parameters: {'kernel_type': 'Matern', 'length_scale': 0.00011330079927866375, 'noise_level': 0.003563076151628585, 'constant_value': 0.9816007679350492, 'nu': 2.5}. Best is trial 448 with value: 0.3592093758005386.
[I 2024-12-04 20:03:00,200] Trial 718 finished with value: 1.091656685975418 and parameters: {'kernel_type': 'RBF', 'length_scale': 1156.6560876299238, 'noise_level': 0.7608264588596356, 'constant_value': 0.014557297239249383, 'nu': 0.5}. Best is trial 448 with value: 0.3592093758005386.
[I 2024-12-04 20:03:04,790] Trial 720 finished with value: 1.0916558493879616 and parameters: {'kernel_type': 'Matern', 'length_scale': 0.015080409245590082, 'noise_level': 4.059681175828723e-06, 'constant_value': 390.30395635591844, 'nu': 0.5}. Best is trial 448 with value: 0.3592093758005386.
[I 2024-12-04 20:03:05,669] Trial 721 finished with value: 1.0916567282564482 and parameters: {'kernel_type': 'RBF', 'length_scale': 10061.595485989801, 'noise_level': 0.0034340189088853577, 'constant_value': 4.1177559246926424e-07, 'nu': 1.5}. Best is trial 448 with value: 0.3592093758005386.
[I 2024-12-04 20:03:07,050] Trial 722 finished with value: 0.35921122002806766 and parameters: {'kernel_type': 'Matern', 'length_scale': 0.33243098222174833, 'noise_level': 0.0007393709523015773, 'constant_value': 4.649581532670443, 'nu': 0.5}. Best is trial 448 with value: 0.3592093758005386.
[I 2024-12-04 20:03:08,097] Trial 723 finished with value: 1.091655175165523 and parameters: {'kernel_type': 'Matern', 'length_scale': 0.4673964030187421, 'noise_level': 1.2133146755483137e-07, 'constant_value': 57.92060218905729, 'nu': 0.5}. Best is trial 448 with value: 0.3592093758005386.
[I 2024-12-04 20:03:10,066] Trial 724 finished with value: 0.3592176789382586 and parameters: {'kernel_type': 'Matern', 'length_scale': 1.7584327226274976, 'noise_level': 0.04656879631170193, 'constant_value': 558.0305139631197, 'nu': 0.5}. Best is trial 448 with value: 0.3592093758005386.
[I 2024-12-04 20:03:11,041] Trial 725 finished with value: 1.0916563695132036 and parameters: {'kernel_type': 'Matern', 'length_scale': 4.029204255848336, 'noise_level': 4.690520158212432e-06, 'constant_value': 1778.5015033015002, 'nu': 0.5}. Best is trial 448 with value: 0.3592093758005386.
[I 2024-12-04 20:03:15,224] Trial 728 finished with value: 1.0916558493886845 and parameters: {'kernel_type': 'Matern', 'length_scale': 0.033758994145698794, 'noise_level': 6.644273171810719e-06, 'constant_value': 9.559997577252815, 'nu': 0.5}. Best is trial 448 with value: 0.3592093758005386.
[I 2024-12-04 20:03:15,733] Trial 727 finished with value: 1.0624161161945493 and parameters: {'kernel_type': 'Matern', 'length_scale': 0.04974119271886713, 'noise_level': 8.689384419872245e-05, 'constant_value': 1671.0812662042217, 'nu': 0.5}. Best is trial 448 with value: 0.3592093758005386.
[I 2024-12-04 20:03:20,535] Trial 726 finished with value: 1.062416117258584 and parameters: {'kernel_type': 'Matern', 'length_scale': 0.021011137110420765, 'noise_level': 0.01257439186650798, 'constant_value': 0.0033667959704142643, 'nu': 0.5}. Best is trial 448 with value: 0.3592093758005386.
[I 2024-12-04 20:03:23,005] Trial 729 finished with value: 0.35921124106669117 and parameters: {'kernel_type': 'Matern', 'length_scale': 27.663201433406186, 'noise_level': 0.7709724259681867, 'constant_value': 5164.3982308389095, 'nu': 0.5}. Best is trial 448 with value: 0.3592093758005386.
[I 2024-12-04 20:03:23,307] Trial 730 finished with value: 0.35921156075245264 and parameters: {'kernel_type': 'Matern', 'length_scale': 0.3041220662834797, 'noise_level': 0.003974154186399981, 'constant_value': 969.6201847207318, 'nu': 0.5}. Best is trial 448 with value: 0.3592093758005386.
[I 2024-12-04 20:03:26,295] Trial 731 finished with value: 1.0624161173290738 and parameters: {'kernel_type': 'Matern', 'length_scale': 2.0919931736122925, 'noise_level': 0.0002554054744156837, 'constant_value': 0.10403486080393949, 'nu': 2.5}. Best is trial 448 with value: 0.3592093758005386.
[I 2024-12-04 20:03:29,535] Trial 732 finished with value: 0.35921126193771274 and parameters: {'kernel_type': 'Matern', 'length_scale': 2354.500170456355, 'noise_level': 0.2717787265014412, 'constant_value': 59661.324385602435, 'nu': 0.5}. Best is trial 448 with value: 0.3592093758005386.
[I 2024-12-04 20:03:29,707] Trial 733 finished with value: 0.35921142347874707 and parameters: {'kernel_type': 'Matern', 'length_scale': 70.58504439341966, 'noise_level': 0.30591642841882966, 'constant_value': 0.021622257969164664, 'nu': 0.5}. Best is trial 448 with value: 0.3592093758005386.
[I 2024-12-04 20:03:30,213] Trial 734 finished with value: 1.0624161172141842 and parameters: {'kernel_type': 'Matern', 'length_scale': 0.03764535538868623, 'noise_level': 0.012480813964761037, 'constant_value': 0.08922514234440238, 'nu': 0.5}. Best is trial 448 with value: 0.3592093758005386.
[I 2024-12-04 20:03:33,768] Trial 735 finished with value: 1.0624115209265028 and parameters: {'kernel_type': 'Matern', 'length_scale': 4.913455230616402, 'noise_level': 5.014745014666695e-05, 'constant_value': 0.13055175923330675, 'nu': 0.5}. Best is trial 448 with value: 0.3592093758005386.
[I 2024-12-04 20:03:35,224] Trial 736 finished with value: 0.35921124750948263 and parameters: {'kernel_type': 'Matern', 'length_scale': 0.3384254462756654, 'noise_level': 0.025652546237154024, 'constant_value': 0.6421655568919042, 'nu': 0.5}. Best is trial 448 with value: 0.3592093758005386.
[I 2024-12-04 20:03:35,575] Trial 737 finished with value: 1.0624161170931417 and parameters: {'kernel_type': 'RBF', 'length_scale': 0.035603217151513926, 'noise_level': 0.4327669283954818, 'constant_value': 0.049354153789077475, 'nu': 0.5}. Best is trial 448 with value: 0.3592093758005386.
[I 2024-12-04 20:03:36,987] Trial 738 finished with value: 1.091655925907895 and parameters: {'kernel_type': 'Matern', 'length_scale': 1.1517586492785605, 'noise_level': 2.6131779826465783e-05, 'constant_value': 95.10846261366133, 'nu': 0.5}. Best is trial 448 with value: 0.3592093758005386.
[I 2024-12-04 20:03:39,183] Trial 739 finished with value: 0.35921026059852534 and parameters: {'kernel_type': 'Matern', 'length_scale': 20.849571996585436, 'noise_level': 0.0017809460523510697, 'constant_value': 197.32917200455688, 'nu': 0.5}. Best is trial 448 with value: 0.3592093758005386.
[I 2024-12-04 20:03:41,555] Trial 741 finished with value: 0.35921122162939517 and parameters: {'kernel_type': 'Matern', 'length_scale': 1.7796058764021045, 'noise_level': 0.004126573376478311, 'constant_value': 5.784849509681683, 'nu': 0.5}. Best is trial 448 with value: 0.3592093758005386.
[I 2024-12-04 20:03:42,012] Trial 740 finished with value: 0.35921178287892674 and parameters: {'kernel_type': 'Matern', 'length_scale': 0.37497747932969955, 'noise_level': 9.854037628505193e-06, 'constant_value': 0.8434716077608013, 'nu': 0.5}. Best is trial 448 with value: 0.3592093758005386.
[I 2024-12-04 20:03:44,864] Trial 742 finished with value: 0.4226892854235054 and parameters: {'kernel_type': 'Matern', 'length_scale': 4.282703206678818, 'noise_level': 0.08174568000754984, 'constant_value': 735.8775795243239, 'nu': 1.5}. Best is trial 448 with value: 0.3592093758005386.
[I 2024-12-04 20:03:46,566] Trial 743 finished with value: 0.3592112063048503 and parameters: {'kernel_type': 'Matern', 'length_scale': 296.2112898734777, 'noise_level': 0.0005663944424379376, 'constant_value': 194.45554793907675, 'nu': 0.5}. Best is trial 448 with value: 0.3592093758005386.
[I 2024-12-04 20:03:47,797] Trial 744 finished with value: 1.0624161172774134 and parameters: {'kernel_type': 'RBF', 'length_scale': 8.238906410794282, 'noise_level': 4.296279548103964e-07, 'constant_value': 48031.326798986316, 'nu': 0.5}. Best is trial 448 with value: 0.3592093758005386.
[I 2024-12-04 20:03:52,387] Trial 747 finished with value: 0.35921124255012715 and parameters: {'kernel_type': 'Matern', 'length_scale': 18.725101525380992, 'noise_level': 0.00026664381440364793, 'constant_value': 2455.642304824341, 'nu': 0.5}. Best is trial 448 with value: 0.3592093758005386.
[I 2024-12-04 20:03:53,411] Trial 745 finished with value: 0.35921123789441456 and parameters: {'kernel_type': 'Matern', 'length_scale': 0.10992412536577295, 'noise_level': 0.8471440266779232, 'constant_value': 34840.971433708146, 'nu': 0.5}. Best is trial 448 with value: 0.3592093758005386.
[I 2024-12-04 20:03:56,381] Trial 746 finished with value: 1.0624161191359878 and parameters: {'kernel_type': 'Matern', 'length_scale': 189.55389440561714, 'noise_level': 4.739226469627467e-08, 'constant_value': 7.249132121495066e-07, 'nu': 0.5}. Best is trial 448 with value: 0.3592093758005386.
[I 2024-12-04 20:03:58,209] Trial 748 finished with value: 0.3592112313253966 and parameters: {'kernel_type': 'Matern', 'length_scale': 17.682496018471834, 'noise_level': 3.281995832499813e-05, 'constant_value': 27.616398096330276, 'nu': 0.5}. Best is trial 448 with value: 0.3592093758005386.
[I 2024-12-04 20:03:58,746] Trial 749 finished with value: 0.35921123734564125 and parameters: {'kernel_type': 'Matern', 'length_scale': 360.66429088299526, 'noise_level': 0.0012167366709853553, 'constant_value': 937.1012629569042, 'nu': 0.5}. Best is trial 448 with value: 0.3592093758005386.
[I 2024-12-04 20:04:01,641] Trial 750 finished with value: 1.0624161174365916 and parameters: {'kernel_type': 'RBF', 'length_scale': 110.60503675025188, 'noise_level': 0.00018288426054327488, 'constant_value': 3621.7428607172933, 'nu': 0.5}. Best is trial 448 with value: 0.3592093758005386.
[I 2024-12-04 20:04:03,271] Trial 752 finished with value: 0.35921141578824 and parameters: {'kernel_type': 'Matern', 'length_scale': 2.5498086843339385, 'noise_level': 0.0009626457047716351, 'constant_value': 152.5417696643283, 'nu': 0.5}. Best is trial 448 with value: 0.3592093758005386.
[I 2024-12-04 20:04:04,360] Trial 751 finished with value: 1.0624161180478893 and parameters: {'kernel_type': 'Matern', 'length_scale': 102.10039122549655, 'noise_level': 1.359141502606807e-10, 'constant_value': 0.00017031235746387414, 'nu': 0.5}. Best is trial 448 with value: 0.3592093758005386.
[I 2024-12-04 20:04:06,590] Trial 753 finished with value: 0.35921098367582144 and parameters: {'kernel_type': 'Matern', 'length_scale': 14.290961423858619, 'noise_level': 0.0014008289994309696, 'constant_value': 1749.3813444232853, 'nu': 0.5}. Best is trial 448 with value: 0.3592093758005386.
[I 2024-12-04 20:04:09,378] Trial 755 finished with value: 0.35921250647428216 and parameters: {'kernel_type': 'Matern', 'length_scale': 0.46440595871640455, 'noise_level': 0.01354443378614603, 'constant_value': 334.3582361932471, 'nu': 0.5}. Best is trial 448 with value: 0.3592093758005386.
[I 2024-12-04 20:04:09,917] Trial 754 finished with value: 1.062416117289221 and parameters: {'kernel_type': 'RBF', 'length_scale': 32819.98118242884, 'noise_level': 0.00044733280614627267, 'constant_value': 18.699715564417737, 'nu': 1.5}. Best is trial 448 with value: 0.3592093758005386.
[I 2024-12-04 20:04:11,770] Trial 756 finished with value: 0.35921124789751663 and parameters: {'kernel_type': 'Matern', 'length_scale': 12.73285050716742, 'noise_level': 0.0015753709269587894, 'constant_value': 6.098354230392284, 'nu': 0.5}. Best is trial 448 with value: 0.3592093758005386.
[I 2024-12-04 20:04:15,149] Trial 757 finished with value: 0.3592112630399011 and parameters: {'kernel_type': 'Matern', 'length_scale': 66.38696125205438, 'noise_level': 0.01915106510073451, 'constant_value': 162.9381156190871, 'nu': 0.5}. Best is trial 448 with value: 0.3592093758005386.
[I 2024-12-04 20:04:16,042] Trial 758 finished with value: 0.3592117419975178 and parameters: {'kernel_type': 'Matern', 'length_scale': 2.9291052541232294, 'noise_level': 0.00014329979181772033, 'constant_value': 16.608211548765162, 'nu': 0.5}. Best is trial 448 with value: 0.3592093758005386.
[I 2024-12-04 20:04:16,544] Trial 759 finished with value: 0.3592106388020882 and parameters: {'kernel_type': 'Matern', 'length_scale': 12.630660567805606, 'noise_level': 0.012653378427450453, 'constant_value': 49.258493714835566, 'nu': 0.5}. Best is trial 448 with value: 0.3592093758005386.
[I 2024-12-04 20:04:21,270] Trial 762 finished with value: 0.35921128942502845 and parameters: {'kernel_type': 'Matern', 'length_scale': 31.191858238385166, 'noise_level': 0.45727876457683114, 'constant_value': 54.16150980232854, 'nu': 0.5}. Best is trial 448 with value: 0.3592093758005386.
[I 2024-12-04 20:04:21,759] Trial 760 finished with value: 1.062416118184574 and parameters: {'kernel_type': 'Matern', 'length_scale': 104.46447085317385, 'noise_level': 0.003382838323293499, 'constant_value': 211.5129454496478, 'nu': 2.5}. Best is trial 448 with value: 0.3592093758005386.
[I 2024-12-04 20:04:22,447] Trial 761 finished with value: 0.3592113637822424 and parameters: {'kernel_type': 'Matern', 'length_scale': 10.825068062485762, 'noise_level': 0.013194584270494398, 'constant_value': 398.00673971010883, 'nu': 0.5}. Best is trial 448 with value: 0.3592093758005386.
[I 2024-12-04 20:04:25,058] Trial 763 finished with value: 1.0624161172846038 and parameters: {'kernel_type': 'Matern', 'length_scale': 0.0002176552949443527, 'noise_level': 0.10070304477581792, 'constant_value': 1.2369917675566793, 'nu': 1.5}. Best is trial 448 with value: 0.3592093758005386.
[I 2024-12-04 20:04:27,605] Trial 765 finished with value: 0.35921114580087715 and parameters: {'kernel_type': 'Matern', 'length_scale': 1.9557477469152103, 'noise_level': 0.10988196195367593, 'constant_value': 495.026181365935, 'nu': 0.5}. Best is trial 448 with value: 0.3592093758005386.
[I 2024-12-04 20:04:27,706] Trial 764 finished with value: 0.3592112731444447 and parameters: {'kernel_type': 'Matern', 'length_scale': 1.0508120232680636, 'noise_level': 0.00998377041855083, 'constant_value': 283.88705292381195, 'nu': 0.5}. Best is trial 448 with value: 0.3592093758005386.
[I 2024-12-04 20:04:31,965] Trial 768 finished with value: 1.0624161170145796 and parameters: {'kernel_type': 'Matern', 'length_scale': 0.024103561841895098, 'noise_level': 0.0001407559120314072, 'constant_value': 0.9392327357259012, 'nu': 0.5}. Best is trial 448 with value: 0.3592093758005386.
[I 2024-12-04 20:04:32,209] Trial 766 finished with value: 0.3592111942896957 and parameters: {'kernel_type': 'Matern', 'length_scale': 12.849804156556642, 'noise_level': 0.01075486865040972, 'constant_value': 30708.59759377908, 'nu': 0.5}. Best is trial 448 with value: 0.3592093758005386.
[I 2024-12-04 20:04:33,067] Trial 767 finished with value: 0.35921145627633366 and parameters: {'kernel_type': 'Matern', 'length_scale': 1.158855604952042, 'noise_level': 0.0014887409308460134, 'constant_value': 19.218681311179797, 'nu': 0.5}. Best is trial 448 with value: 0.3592093758005386.
[I 2024-12-04 20:04:37,516] Trial 770 finished with value: 1.062416117400742 and parameters: {'kernel_type': 'RBF', 'length_scale': 11.371026174427964, 'noise_level': 2.0315747609757938e-10, 'constant_value': 4.856693492602786, 'nu': 0.5}. Best is trial 448 with value: 0.3592093758005386.
[I 2024-12-04 20:04:37,525] Trial 771 finished with value: 0.35921202711604955 and parameters: {'kernel_type': 'Matern', 'length_scale': 0.6364806653801792, 'noise_level': 0.08596978740026898, 'constant_value': 59.567326513911944, 'nu': 0.5}. Best is trial 448 with value: 0.3592093758005386.
[I 2024-12-04 20:04:38,747] Trial 769 finished with value: 1.0624161173886217 and parameters: {'kernel_type': 'RBF', 'length_scale': 741.5735784992759, 'noise_level': 1.8957933639899797e-08, 'constant_value': 16.338985147696487, 'nu': 1.5}. Best is trial 448 with value: 0.3592093758005386.
[I 2024-12-04 20:04:44,288] Trial 774 finished with value: 0.3592112371599973 and parameters: {'kernel_type': 'Matern', 'length_scale': 166.80262826780643, 'noise_level': 0.1776033624165528, 'constant_value': 1394.1949339817306, 'nu': 0.5}. Best is trial 448 with value: 0.3592093758005386.
[I 2024-12-04 20:04:48,534] Trial 773 finished with value: 1.0624161170300732 and parameters: {'kernel_type': 'Matern', 'length_scale': 0.0028194819682051428, 'noise_level': 0.0019814265004430326, 'constant_value': 0.00047314143815120244, 'nu': 2.5}. Best is trial 448 with value: 0.3592093758005386.
[I 2024-12-04 20:04:51,588] Trial 775 finished with value: 0.42868378134624996 and parameters: {'kernel_type': 'RBF', 'length_scale': 20622.17991211188, 'noise_level': 0.15367277569624638, 'constant_value': 271.0051729053993, 'nu': 0.5}. Best is trial 448 with value: 0.3592093758005386.
[I 2024-12-04 20:04:51,646] Trial 776 finished with value: 1.0916558492749762 and parameters: {'kernel_type': 'Matern', 'length_scale': 0.029462962742012207, 'noise_level': 0.005848536051165412, 'constant_value': 315.6580025307649, 'nu': 0.5}. Best is trial 448 with value: 0.3592093758005386.
[I 2024-12-04 20:04:52,946] Trial 772 finished with value: 1.0624161172883362 and parameters: {'kernel_type': 'Matern', 'length_scale': 31302.779522921064, 'noise_level': 3.207345768720353e-05, 'constant_value': 0.00012828033757941135, 'nu': 2.5}. Best is trial 448 with value: 0.3592093758005386.
[I 2024-12-04 20:04:56,684] Trial 777 finished with value: 0.35921124263074666 and parameters: {'kernel_type': 'Matern', 'length_scale': 5.7855640838134095, 'noise_level': 0.96012850223601, 'constant_value': 55.99446812309007, 'nu': 0.5}. Best is trial 448 with value: 0.3592093758005386.
[I 2024-12-04 20:04:57,150] Trial 779 finished with value: 1.0624161172363924 and parameters: {'kernel_type': 'RBF', 'length_scale': 0.0008538789160087799, 'noise_level': 0.7876923277215298, 'constant_value': 80014.32885358081, 'nu': 1.5}. Best is trial 448 with value: 0.3592093758005386.
[I 2024-12-04 20:04:57,869] Trial 778 finished with value: 0.3592103335714512 and parameters: {'kernel_type': 'Matern', 'length_scale': 5.2639226899519596, 'noise_level': 0.03969777367921353, 'constant_value': 590.8295966274604, 'nu': 0.5}. Best is trial 448 with value: 0.3592093758005386.
[I 2024-12-04 20:05:02,240] Trial 780 finished with value: 0.35922140753752435 and parameters: {'kernel_type': 'Matern', 'length_scale': 4471.690400738974, 'noise_level': 0.01382726493731908, 'constant_value': 68.26716148591888, 'nu': 0.5}. Best is trial 448 with value: 0.3592093758005386.
