[I 2024-12-04 15:13:07,820] Trial 1083 finished with value: 0.4654553933553958 and parameters: {'n_estimators': 814, 'max_depth': 49, 'min_samples_split': 3, 'min_samples_leaf': 2, 'max_features': None, 'bootstrap': True, 'criterion': 'squared_error'}. Best is trial 1025 with value: 0.41844370194907604.
[I 2024-12-04 15:13:09,939] Trial 1081 finished with value: 0.41975686095027254 and parameters: {'n_estimators': 824, 'max_depth': 39, 'min_samples_split': 2, 'min_samples_leaf': 1, 'max_features': None, 'bootstrap': True, 'criterion': 'squared_error'}. Best is trial 1025 with value: 0.41844370194907604.
[I 2024-12-04 15:13:17,045] Trial 1080 finished with value: 0.643330164354214 and parameters: {'n_estimators': 836, 'max_depth': 44, 'min_samples_split': 2, 'min_samples_leaf': 1, 'max_features': 'log2', 'bootstrap': True, 'criterion': 'absolute_error'}. Best is trial 1025 with value: 0.41844370194907604.
[I 2024-12-04 15:13:17,592] Trial 1079 finished with value: 0.4325967106477906 and parameters: {'n_estimators': 759, 'max_depth': 34, 'min_samples_split': 4, 'min_samples_leaf': 1, 'max_features': None, 'bootstrap': True, 'criterion': 'squared_error'}. Best is trial 1025 with value: 0.41844370194907604.
[I 2024-12-04 15:13:17,761] Trial 1092 finished with value: 1.0290980003418553 and parameters: {'n_estimators': 230, 'max_depth': 49, 'min_samples_split': 24, 'min_samples_leaf': 3, 'max_features': 'log2', 'bootstrap': True, 'criterion': 'squared_error'}. Best is trial 1025 with value: 0.41844370194907604.
[I 2024-12-04 15:13:17,767] Trial 1105 finished with value: 1.0358040419459826 and parameters: {'n_estimators': 240, 'max_depth': 29, 'min_samples_split': 20, 'min_samples_leaf': 13, 'max_features': 'sqrt', 'bootstrap': True, 'criterion': 'absolute_error'}. Best is trial 1025 with value: 0.41844370194907604.
[I 2024-12-04 15:13:17,961] Trial 1086 finished with value: 0.42457104685402997 and parameters: {'n_estimators': 768, 'max_depth': 44, 'min_samples_split': 3, 'min_samples_leaf': 1, 'max_features': None, 'bootstrap': True, 'criterion': 'squared_error'}. Best is trial 1025 with value: 0.41844370194907604.
[I 2024-12-04 15:13:17,970] Trial 1087 finished with value: 0.4310747376022272 and parameters: {'n_estimators': 726, 'max_depth': 48, 'min_samples_split': 4, 'min_samples_leaf': 1, 'max_features': None, 'bootstrap': True, 'criterion': 'squared_error'}. Best is trial 1025 with value: 0.41844370194907604.
[I 2024-12-04 15:13:17,974] Trial 1094 finished with value: 0.5282497583427218 and parameters: {'n_estimators': 725, 'max_depth': 41, 'min_samples_split': 2, 'min_samples_leaf': 1, 'max_features': None, 'bootstrap': False, 'criterion': 'squared_error'}. Best is trial 1025 with value: 0.41844370194907604.
[I 2024-12-04 15:13:19,603] Trial 1088 finished with value: 0.4255792045954443 and parameters: {'n_estimators': 628, 'max_depth': 42, 'min_samples_split': 3, 'min_samples_leaf': 1, 'max_features': None, 'bootstrap': True, 'criterion': 'squared_error'}. Best is trial 1025 with value: 0.41844370194907604.
[I 2024-12-04 15:13:19,620] Trial 1093 finished with value: 0.46488780526584683 and parameters: {'n_estimators': 636, 'max_depth': 37, 'min_samples_split': 2, 'min_samples_leaf': 2, 'max_features': None, 'bootstrap': True, 'criterion': 'squared_error'}. Best is trial 1025 with value: 0.41844370194907604.
[I 2024-12-04 15:13:21,038] Trial 1089 finished with value: 0.4315902921805136 and parameters: {'n_estimators': 807, 'max_depth': 35, 'min_samples_split': 4, 'min_samples_leaf': 1, 'max_features': None, 'bootstrap': True, 'criterion': 'squared_error'}. Best is trial 1025 with value: 0.41844370194907604.
[I 2024-12-04 15:13:24,242] Trial 1091 finished with value: 0.42159603380101845 and parameters: {'n_estimators': 818, 'max_depth': 42, 'min_samples_split': 2, 'min_samples_leaf': 1, 'max_features': None, 'bootstrap': True, 'criterion': 'squared_error'}. Best is trial 1025 with value: 0.41844370194907604.
[I 2024-12-04 15:13:24,893] Trial 1100 finished with value: 0.7929076027633742 and parameters: {'n_estimators': 578, 'max_depth': 27, 'min_samples_split': 27, 'min_samples_leaf': 1, 'max_features': 'log2', 'bootstrap': True, 'criterion': 'squared_error'}. Best is trial 1025 with value: 0.41844370194907604.
[I 2024-12-04 15:13:27,402] Trial 1096 finished with value: 0.42266594258329293 and parameters: {'n_estimators': 667, 'max_depth': 45, 'min_samples_split': 2, 'min_samples_leaf': 1, 'max_features': None, 'bootstrap': True, 'criterion': 'squared_error'}. Best is trial 1025 with value: 0.41844370194907604.
[I 2024-12-04 15:13:28,915] Trial 1090 finished with value: 0.4210868992447684 and parameters: {'n_estimators': 831, 'max_depth': 34, 'min_samples_split': 2, 'min_samples_leaf': 1, 'max_features': None, 'bootstrap': True, 'criterion': 'squared_error'}. Best is trial 1025 with value: 0.41844370194907604.
[I 2024-12-04 15:13:38,636] Trial 1095 finished with value: 0.4210982360399379 and parameters: {'n_estimators': 859, 'max_depth': 42, 'min_samples_split': 2, 'min_samples_leaf': 1, 'max_features': None, 'bootstrap': True, 'criterion': 'squared_error'}. Best is trial 1025 with value: 0.41844370194907604.
[I 2024-12-04 15:13:40,045] Trial 1111 finished with value: 1.0484569806570807 and parameters: {'n_estimators': 182, 'max_depth': 5, 'min_samples_split': 7, 'min_samples_leaf': 5, 'max_features': 'log2', 'bootstrap': True, 'criterion': 'absolute_error'}. Best is trial 1025 with value: 0.41844370194907604.
[I 2024-12-04 15:13:40,477] Trial 1099 finished with value: 0.42138175174606235 and parameters: {'n_estimators': 690, 'max_depth': 37, 'min_samples_split': 2, 'min_samples_leaf': 1, 'max_features': None, 'bootstrap': True, 'criterion': 'squared_error'}. Best is trial 1025 with value: 0.41844370194907604.
[I 2024-12-04 15:13:41,676] Trial 1106 finished with value: 0.7127850469131322 and parameters: {'n_estimators': 878, 'max_depth': 30, 'min_samples_split': 8, 'min_samples_leaf': 14, 'max_features': None, 'bootstrap': False, 'criterion': 'squared_error'}. Best is trial 1025 with value: 0.41844370194907604.
[I 2024-12-04 15:13:42,305] Trial 1104 finished with value: 0.42043008476306704 and parameters: {'n_estimators': 871, 'max_depth': 48, 'min_samples_split': 2, 'min_samples_leaf': 1, 'max_features': None, 'bootstrap': True, 'criterion': 'squared_error'}. Best is trial 1025 with value: 0.41844370194907604.
[I 2024-12-04 15:13:43,316] Trial 1098 finished with value: 0.42105519737024616 and parameters: {'n_estimators': 694, 'max_depth': 38, 'min_samples_split': 2, 'min_samples_leaf': 1, 'max_features': None, 'bootstrap': True, 'criterion': 'squared_error'}. Best is trial 1025 with value: 0.41844370194907604.
[I 2024-12-04 15:13:43,350] Trial 1101 finished with value: 0.421358259113444 and parameters: {'n_estimators': 833, 'max_depth': 47, 'min_samples_split': 2, 'min_samples_leaf': 1, 'max_features': None, 'bootstrap': True, 'criterion': 'squared_error'}. Best is trial 1025 with value: 0.41844370194907604.
[I 2024-12-04 15:13:47,883] Trial 1108 finished with value: 0.4663833019782652 and parameters: {'n_estimators': 530, 'max_depth': 25, 'min_samples_split': 2, 'min_samples_leaf': 2, 'max_features': None, 'bootstrap': True, 'criterion': 'squared_error'}. Best is trial 1025 with value: 0.41844370194907604.
[I 2024-12-04 15:13:47,897] Trial 1052 finished with value: 0.5546857491179525 and parameters: {'n_estimators': 650, 'max_depth': 42, 'min_samples_split': 2, 'min_samples_leaf': 1, 'max_features': None, 'bootstrap': False, 'criterion': 'absolute_error'}. Best is trial 1025 with value: 0.41844370194907604.
[I 2024-12-04 15:13:48,110] Trial 1112 finished with value: 0.674805023889889 and parameters: {'n_estimators': 259, 'max_depth': 29, 'min_samples_split': 43, 'min_samples_leaf': 1, 'max_features': 'sqrt', 'bootstrap': False, 'criterion': 'absolute_error'}. Best is trial 1025 with value: 0.41844370194907604.
[I 2024-12-04 15:13:49,605] Trial 1102 finished with value: 0.4214963099897911 and parameters: {'n_estimators': 906, 'max_depth': 32, 'min_samples_split': 2, 'min_samples_leaf': 1, 'max_features': None, 'bootstrap': True, 'criterion': 'squared_error'}. Best is trial 1025 with value: 0.41844370194907604.
[I 2024-12-04 15:13:49,618] Trial 1117 finished with value: 0.9548613098838936 and parameters: {'n_estimators': 450, 'max_depth': 46, 'min_samples_split': 2, 'min_samples_leaf': 2, 'max_features': 'log2', 'bootstrap': True, 'criterion': 'squared_error'}. Best is trial 1025 with value: 0.41844370194907604.
[I 2024-12-04 15:13:49,660] Trial 1103 finished with value: 0.42267398387724453 and parameters: {'n_estimators': 875, 'max_depth': 30, 'min_samples_split': 2, 'min_samples_leaf': 1, 'max_features': None, 'bootstrap': True, 'criterion': 'squared_error'}. Best is trial 1025 with value: 0.41844370194907604.
[I 2024-12-04 15:13:49,661] Trial 1109 finished with value: 0.46471995728719556 and parameters: {'n_estimators': 739, 'max_depth': 41, 'min_samples_split': 3, 'min_samples_leaf': 2, 'max_features': None, 'bootstrap': True, 'criterion': 'squared_error'}. Best is trial 1025 with value: 0.41844370194907604.
[I 2024-12-04 15:13:49,699] Trial 1097 finished with value: 0.46536321210346154 and parameters: {'n_estimators': 808, 'max_depth': 40, 'min_samples_split': 2, 'min_samples_leaf': 2, 'max_features': None, 'bootstrap': True, 'criterion': 'squared_error'}. Best is trial 1025 with value: 0.41844370194907604.
[I 2024-12-04 15:13:52,884] Trial 1114 finished with value: 0.9568151136386567 and parameters: {'n_estimators': 974, 'max_depth': 33, 'min_samples_split': 6, 'min_samples_leaf': 2, 'max_features': 'log2', 'bootstrap': True, 'criterion': 'squared_error'}. Best is trial 1025 with value: 0.41844370194907604.
[I 2024-12-04 15:13:56,701] Trial 1107 finished with value: 0.4310318523215759 and parameters: {'n_estimators': 844, 'max_depth': 39, 'min_samples_split': 4, 'min_samples_leaf': 1, 'max_features': None, 'bootstrap': True, 'criterion': 'squared_error'}. Best is trial 1025 with value: 0.41844370194907604.
[I 2024-12-04 15:13:59,823] Trial 1120 finished with value: 0.5101740180053587 and parameters: {'n_estimators': 775, 'max_depth': 41, 'min_samples_split': 3, 'min_samples_leaf': 1, 'max_features': 'sqrt', 'bootstrap': True, 'criterion': 'squared_error'}. Best is trial 1025 with value: 0.41844370194907604.
[I 2024-12-04 15:14:07,264] Trial 1125 finished with value: 0.8709690150408892 and parameters: {'n_estimators': 735, 'max_depth': 31, 'min_samples_split': 2, 'min_samples_leaf': 6, 'max_features': 'sqrt', 'bootstrap': False, 'criterion': 'squared_error'}. Best is trial 1025 with value: 0.41844370194907604.
[I 2024-12-04 15:14:09,501] Trial 1121 finished with value: 0.6449573392190234 and parameters: {'n_estimators': 878, 'max_depth': 37, 'min_samples_split': 2, 'min_samples_leaf': 1, 'max_features': 'log2', 'bootstrap': True, 'criterion': 'squared_error'}. Best is trial 1025 with value: 0.41844370194907604.
[I 2024-12-04 15:14:10,869] Trial 1122 finished with value: 0.6440686997653388 and parameters: {'n_estimators': 886, 'max_depth': 38, 'min_samples_split': 2, 'min_samples_leaf': 1, 'max_features': 'log2', 'bootstrap': True, 'criterion': 'squared_error'}. Best is trial 1025 with value: 0.41844370194907604.
[I 2024-12-04 15:14:13,163] Trial 1085 finished with value: 0.4314602645141507 and parameters: {'n_estimators': 601, 'max_depth': 39, 'min_samples_split': 2, 'min_samples_leaf': 1, 'max_features': None, 'bootstrap': True, 'criterion': 'absolute_error'}. Best is trial 1025 with value: 0.41844370194907604.
[I 2024-12-04 15:14:14,300] Trial 1115 finished with value: 0.9688284705192064 and parameters: {'n_estimators': 969, 'max_depth': 8, 'min_samples_split': 7, 'min_samples_leaf': 1, 'max_features': 'log2', 'bootstrap': True, 'criterion': 'absolute_error'}. Best is trial 1025 with value: 0.41844370194907604.
[I 2024-12-04 15:14:15,745] Trial 1127 finished with value: 0.4332094019001142 and parameters: {'n_estimators': 503, 'max_depth': 37, 'min_samples_split': 4, 'min_samples_leaf': 1, 'max_features': None, 'bootstrap': True, 'criterion': 'squared_error'}. Best is trial 1025 with value: 0.41844370194907604.
[I 2024-12-04 15:14:16,068] Trial 1132 finished with value: 0.9754868559741706 and parameters: {'n_estimators': 916, 'max_depth': 17, 'min_samples_split': 4, 'min_samples_leaf': 3, 'max_features': 'log2', 'bootstrap': False, 'criterion': 'squared_error'}. Best is trial 1025 with value: 0.41844370194907604.
[I 2024-12-04 15:14:17,019] Trial 1123 finished with value: 0.43145277912486163 and parameters: {'n_estimators': 703, 'max_depth': 42, 'min_samples_split': 4, 'min_samples_leaf': 1, 'max_features': None, 'bootstrap': True, 'criterion': 'squared_error'}. Best is trial 1025 with value: 0.41844370194907604.
[I 2024-12-04 15:14:17,345] Trial 1113 finished with value: 0.7156445735508526 and parameters: {'n_estimators': 759, 'max_depth': 36, 'min_samples_split': 6, 'min_samples_leaf': 1, 'max_features': 'log2', 'bootstrap': True, 'criterion': 'absolute_error'}. Best is trial 1025 with value: 0.41844370194907604.
[I 2024-12-04 15:14:18,601] Trial 1116 finished with value: 0.4194179520333209 and parameters: {'n_estimators': 880, 'max_depth': 39, 'min_samples_split': 2, 'min_samples_leaf': 1, 'max_features': None, 'bootstrap': True, 'criterion': 'squared_error'}. Best is trial 1025 with value: 0.41844370194907604.
[I 2024-12-04 15:14:19,024] Trial 1110 finished with value: 0.7004217556817509 and parameters: {'n_estimators': 337, 'max_depth': 10, 'min_samples_split': 8, 'min_samples_leaf': 1, 'max_features': None, 'bootstrap': False, 'criterion': 'absolute_error'}. Best is trial 1025 with value: 0.41844370194907604.
[I 2024-12-04 15:14:20,032] Trial 1124 finished with value: 0.46455473502839295 and parameters: {'n_estimators': 872, 'max_depth': 35, 'min_samples_split': 2, 'min_samples_leaf': 2, 'max_features': None, 'bootstrap': True, 'criterion': 'squared_error'}. Best is trial 1025 with value: 0.41844370194907604.
[I 2024-12-04 15:14:22,529] Trial 1126 finished with value: 0.4213922629289989 and parameters: {'n_estimators': 535, 'max_depth': 40, 'min_samples_split': 2, 'min_samples_leaf': 1, 'max_features': None, 'bootstrap': True, 'criterion': 'squared_error'}. Best is trial 1025 with value: 0.41844370194907604.
[I 2024-12-04 15:14:25,795] Trial 1129 finished with value: 0.4214705603754929 and parameters: {'n_estimators': 691, 'max_depth': 37, 'min_samples_split': 2, 'min_samples_leaf': 1, 'max_features': None, 'bootstrap': True, 'criterion': 'squared_error'}. Best is trial 1025 with value: 0.41844370194907604.
[I 2024-12-04 15:14:29,544] Trial 1133 finished with value: 0.4217981099167622 and parameters: {'n_estimators': 727, 'max_depth': 42, 'min_samples_split': 2, 'min_samples_leaf': 1, 'max_features': None, 'bootstrap': True, 'criterion': 'squared_error'}. Best is trial 1025 with value: 0.41844370194907604.
[I 2024-12-04 15:14:30,169] Trial 1138 finished with value: 0.6028225675139056 and parameters: {'n_estimators': 793, 'max_depth': 7, 'min_samples_split': 4, 'min_samples_leaf': 3, 'max_features': None, 'bootstrap': True, 'criterion': 'squared_error'}. Best is trial 1025 with value: 0.41844370194907604.
[I 2024-12-04 15:14:37,186] Trial 1131 finished with value: 0.41984399514112747 and parameters: {'n_estimators': 821, 'max_depth': 39, 'min_samples_split': 2, 'min_samples_leaf': 1, 'max_features': None, 'bootstrap': True, 'criterion': 'squared_error'}. Best is trial 1025 with value: 0.41844370194907604.
[I 2024-12-04 15:14:37,811] Trial 1137 finished with value: 0.46484975292186503 and parameters: {'n_estimators': 736, 'max_depth': 42, 'min_samples_split': 2, 'min_samples_leaf': 2, 'max_features': None, 'bootstrap': True, 'criterion': 'squared_error'}. Best is trial 1025 with value: 0.41844370194907604.
[I 2024-12-04 15:14:38,881] Trial 1144 finished with value: 0.7834722655799965 and parameters: {'n_estimators': 331, 'max_depth': 23, 'min_samples_split': 3, 'min_samples_leaf': 1, 'max_features': 'log2', 'bootstrap': False, 'criterion': 'absolute_error'}. Best is trial 1025 with value: 0.41844370194907604.
[I 2024-12-04 15:14:39,608] Trial 1140 finished with value: 0.42459611380731627 and parameters: {'n_estimators': 876, 'max_depth': 43, 'min_samples_split': 3, 'min_samples_leaf': 1, 'max_features': None, 'bootstrap': True, 'criterion': 'squared_error'}. Best is trial 1025 with value: 0.41844370194907604.
[I 2024-12-04 15:14:39,908] Trial 1136 finished with value: 0.4227874251967499 and parameters: {'n_estimators': 653, 'max_depth': 49, 'min_samples_split': 2, 'min_samples_leaf': 1, 'max_features': None, 'bootstrap': True, 'criterion': 'squared_error'}. Best is trial 1025 with value: 0.41844370194907604.
[I 2024-12-04 15:14:39,909] Trial 1141 finished with value: 0.4211355445937156 and parameters: {'n_estimators': 647, 'max_depth': 39, 'min_samples_split': 2, 'min_samples_leaf': 1, 'max_features': None, 'bootstrap': True, 'criterion': 'squared_error'}. Best is trial 1025 with value: 0.41844370194907604.
[I 2024-12-04 15:14:40,213] Trial 1130 finished with value: 0.4193886684201326 and parameters: {'n_estimators': 982, 'max_depth': 39, 'min_samples_split': 2, 'min_samples_leaf': 1, 'max_features': None, 'bootstrap': True, 'criterion': 'squared_error'}. Best is trial 1025 with value: 0.41844370194907604.
[I 2024-12-04 15:14:42,879] Trial 1128 finished with value: 0.4245570768029807 and parameters: {'n_estimators': 879, 'max_depth': 44, 'min_samples_split': 3, 'min_samples_leaf': 1, 'max_features': None, 'bootstrap': True, 'criterion': 'squared_error'}. Best is trial 1025 with value: 0.41844370194907604.
[I 2024-12-04 15:14:43,818] Trial 1134 finished with value: 0.4201690107426859 and parameters: {'n_estimators': 996, 'max_depth': 48, 'min_samples_split': 2, 'min_samples_leaf': 1, 'max_features': None, 'bootstrap': True, 'criterion': 'squared_error'}. Best is trial 1025 with value: 0.41844370194907604.
[I 2024-12-04 15:14:44,094] Trial 1139 finished with value: 0.5810373043908932 and parameters: {'n_estimators': 760, 'max_depth': 49, 'min_samples_split': 2, 'min_samples_leaf': 1, 'max_features': 'log2', 'bootstrap': True, 'criterion': 'squared_error'}. Best is trial 1025 with value: 0.41844370194907604.
[I 2024-12-04 15:14:44,222] Trial 1154 finished with value: 0.9925649825430716 and parameters: {'n_estimators': 288, 'max_depth': 49, 'min_samples_split': 7, 'min_samples_leaf': 7, 'max_features': 'sqrt', 'bootstrap': True, 'criterion': 'squared_error'}. Best is trial 1025 with value: 0.41844370194907604.
[I 2024-12-04 15:14:45,002] Trial 1143 finished with value: 0.42060631594774917 and parameters: {'n_estimators': 840, 'max_depth': 37, 'min_samples_split': 2, 'min_samples_leaf': 1, 'max_features': None, 'bootstrap': True, 'criterion': 'squared_error'}. Best is trial 1025 with value: 0.41844370194907604.
[I 2024-12-04 15:14:45,234] Trial 1142 finished with value: 0.4208420525464082 and parameters: {'n_estimators': 826, 'max_depth': 37, 'min_samples_split': 2, 'min_samples_leaf': 1, 'max_features': None, 'bootstrap': True, 'criterion': 'squared_error'}. Best is trial 1025 with value: 0.41844370194907604.
[I 2024-12-04 15:14:46,082] Trial 1152 finished with value: 0.519635347920044 and parameters: {'n_estimators': 356, 'max_depth': 31, 'min_samples_split': 41, 'min_samples_leaf': 1, 'max_features': None, 'bootstrap': True, 'criterion': 'squared_error'}. Best is trial 1025 with value: 0.41844370194907604.
[I 2024-12-04 15:14:46,194] Trial 1135 finished with value: 0.4647604129230146 and parameters: {'n_estimators': 894, 'max_depth': 41, 'min_samples_split': 2, 'min_samples_leaf': 2, 'max_features': None, 'bootstrap': True, 'criterion': 'squared_error'}. Best is trial 1025 with value: 0.41844370194907604.
[I 2024-12-04 15:14:47,674] Trial 1155 finished with value: 1.045993478361391 and parameters: {'n_estimators': 698, 'max_depth': 49, 'min_samples_split': 5, 'min_samples_leaf': 15, 'max_features': 'sqrt', 'bootstrap': True, 'criterion': 'squared_error'}. Best is trial 1025 with value: 0.41844370194907604.
[I 2024-12-04 15:14:48,292] Trial 1159 finished with value: 1.0220031603932442 and parameters: {'n_estimators': 144, 'max_depth': 40, 'min_samples_split': 11, 'min_samples_leaf': 3, 'max_features': 'log2', 'bootstrap': True, 'criterion': 'absolute_error'}. Best is trial 1025 with value: 0.41844370194907604.
[I 2024-12-04 15:14:49,544] Trial 1145 finished with value: 0.42078475358884926 and parameters: {'n_estimators': 723, 'max_depth': 43, 'min_samples_split': 2, 'min_samples_leaf': 1, 'max_features': None, 'bootstrap': True, 'criterion': 'squared_error'}. Best is trial 1025 with value: 0.41844370194907604.
[I 2024-12-04 15:14:51,163] Trial 1146 finished with value: 0.42277148598560405 and parameters: {'n_estimators': 658, 'max_depth': 35, 'min_samples_split': 2, 'min_samples_leaf': 1, 'max_features': None, 'bootstrap': True, 'criterion': 'squared_error'}. Best is trial 1025 with value: 0.41844370194907604.
[I 2024-12-04 15:14:53,551] Trial 1148 finished with value: 0.46459657894899115 and parameters: {'n_estimators': 651, 'max_depth': 33, 'min_samples_split': 2, 'min_samples_leaf': 2, 'max_features': None, 'bootstrap': True, 'criterion': 'squared_error'}. Best is trial 1025 with value: 0.41844370194907604.
[I 2024-12-04 15:14:54,840] Trial 1149 finished with value: 0.4311014539483882 and parameters: {'n_estimators': 712, 'max_depth': 37, 'min_samples_split': 4, 'min_samples_leaf': 1, 'max_features': None, 'bootstrap': True, 'criterion': 'squared_error'}. Best is trial 1025 with value: 0.41844370194907604.
