[I 2024-12-04 14:54:23,400] A new study created in RDB with name: Omega_gpr
[I 2024-12-04 14:54:31,846] Trial 6 finished with value: 1.2614547976346084 and parameters: {'kernel_type': 'Matern', 'length_scale': 8.403365736452622, 'noise_level': 6.999907422007719e-07, 'constant_value': 6285.983798166039, 'nu': 1.5}. Best is trial 14 with value: 1.2401112323940329.
[I 2024-12-04 14:54:31,849] Trial 3 finished with value: 1.240111232697153 and parameters: {'kernel_type': 'RBF', 'length_scale': 0.022198594722588894, 'noise_level': 4.824985779512822e-05, 'constant_value': 0.0037712775361202757, 'nu': 1.5}. Best is trial 14 with value: 1.2401112323940329.
[I 2024-12-04 14:54:32,109] Trial 10 finished with value: 1.2614547976352362 and parameters: {'kernel_type': 'RBF', 'length_scale': 84836.3900172024, 'noise_level': 5.895991715042808e-10, 'constant_value': 6.468470438100187e-06, 'nu': 2.5}. Best is trial 14 with value: 1.2401112323940329.
[I 2024-12-04 14:54:32,139] Trial 7 finished with value: 1.261454370108697 and parameters: {'kernel_type': 'Matern', 'length_scale': 0.09014647528821873, 'noise_level': 7.014720116576165e-07, 'constant_value': 58570.86257729834, 'nu': 0.5}. Best is trial 14 with value: 1.2401112323940329.
[I 2024-12-04 14:54:32,658] Trial 14 finished with value: 1.2401112323940329 and parameters: {'kernel_type': 'Matern', 'length_scale': 0.03298536972380841, 'noise_level': 0.20696722364476797, 'constant_value': 0.08392676630055647, 'nu': 0.5}. Best is trial 14 with value: 1.2401112323940329.
[I 2024-12-04 14:54:33,795] Trial 2 finished with value: 1.2401112324292285 and parameters: {'kernel_type': 'RBF', 'length_scale': 0.00015052303993017663, 'noise_level': 2.1803075351001724e-10, 'constant_value': 1.558161080327764e-05, 'nu': 1.5}. Best is trial 13 with value: 0.644385096842994.
[I 2024-12-04 14:54:34,152] Trial 13 finished with value: 0.644385096842994 and parameters: {'kernel_type': 'RBF', 'length_scale': 0.48224096686614154, 'noise_level': 0.25157860794556824, 'constant_value': 788.735526281943, 'nu': 0.5}. Best is trial 13 with value: 0.644385096842994.
[I 2024-12-04 14:54:34,637] Trial 11 finished with value: 1.2401112272406196 and parameters: {'kernel_type': 'RBF', 'length_scale': 0.00014122512154989233, 'noise_level': 4.2699530147738455e-09, 'constant_value': 4.719340336919109e-06, 'nu': 1.5}. Best is trial 13 with value: 0.644385096842994.
[I 2024-12-04 14:54:34,941] Trial 17 finished with value: 1.261449765049606 and parameters: {'kernel_type': 'Matern', 'length_scale': 0.00632259285155279, 'noise_level': 0.9567228578997251, 'constant_value': 0.00011774437934402614, 'nu': 2.5}. Best is trial 13 with value: 0.644385096842994.
[I 2024-12-04 14:54:35,012] Trial 24 finished with value: 0.6443851032091124 and parameters: {'kernel_type': 'RBF', 'length_scale': 1.619233587042751, 'noise_level': 0.00123116270954721, 'constant_value': 1.440961035516528, 'nu': 0.5}. Best is trial 13 with value: 0.644385096842994.
[I 2024-12-04 14:54:35,015] Trial 8 finished with value: 1.2401112272406196 and parameters: {'kernel_type': 'Matern', 'length_scale': 0.0026067159418685973, 'noise_level': 1.2579537191740812e-08, 'constant_value': 1.4232210824121595e-06, 'nu': 1.5}. Best is trial 13 with value: 0.644385096842994.
[I 2024-12-04 14:54:35,038] Trial 12 finished with value: 1.240111232580858 and parameters: {'kernel_type': 'RBF', 'length_scale': 5.033892247828662, 'noise_level': 4.299755730897575e-06, 'constant_value': 31.792621243887623, 'nu': 1.5}. Best is trial 13 with value: 0.644385096842994.
[I 2024-12-04 14:54:35,685] Trial 19 finished with value: 1.2401112325759236 and parameters: {'kernel_type': 'Matern', 'length_scale': 119.39299220356214, 'noise_level': 6.437487127466943e-09, 'constant_value': 9.950439855699821, 'nu': 1.5}. Best is trial 13 with value: 0.644385096842994.
[I 2024-12-04 14:54:36,456] Trial 4 finished with value: 1.2401112343841694 and parameters: {'kernel_type': 'RBF', 'length_scale': 0.05015809334556739, 'noise_level': 0.00538650843217597, 'constant_value': 3.0028000356561686e-06, 'nu': 2.5}. Best is trial 15 with value: 0.5273052583069139.
[I 2024-12-04 14:54:36,458] Trial 20 finished with value: 1.2401112343649061 and parameters: {'kernel_type': 'RBF', 'length_scale': 21409.558534697037, 'noise_level': 0.006740440471416729, 'constant_value': 93.56997289825316, 'nu': 1.5}. Best is trial 15 with value: 0.5273052583069139.
[I 2024-12-04 14:54:36,862] Trial 22 finished with value: 1.2401112327437034 and parameters: {'kernel_type': 'RBF', 'length_scale': 63.41317682638687, 'noise_level': 1.1604241581794545e-05, 'constant_value': 41.07665617719584, 'nu': 1.5}. Best is trial 15 with value: 0.5273052583069139.
[I 2024-12-04 14:54:36,869] Trial 15 finished with value: 0.5273052583069139 and parameters: {'kernel_type': 'Matern', 'length_scale': 25694.390635663876, 'noise_level': 0.12628125127253328, 'constant_value': 234.8158087687283, 'nu': 1.5}. Best is trial 15 with value: 0.5273052583069139.
[I 2024-12-04 14:54:36,901] Trial 27 finished with value: 1.2401112326682655 and parameters: {'kernel_type': 'RBF', 'length_scale': 0.007142887082159582, 'noise_level': 0.0057196212571157725, 'constant_value': 0.16690214364169137, 'nu': 2.5}. Best is trial 15 with value: 0.5273052583069139.
[I 2024-12-04 14:54:36,936] Trial 25 finished with value: 1.2614012783974338 and parameters: {'kernel_type': 'Matern', 'length_scale': 60.226373078863546, 'noise_level': 7.905015975390959e-06, 'constant_value': 1.3954582331531198e-07, 'nu': 1.5}. Best is trial 15 with value: 0.5273052583069139.
[I 2024-12-04 14:54:37,178] Trial 5 finished with value: 1.2401112324810095 and parameters: {'kernel_type': 'RBF', 'length_scale': 11.569037428156038, 'noise_level': 6.552575196908884e-07, 'constant_value': 0.00021813982161776444, 'nu': 2.5}. Best is trial 15 with value: 0.5273052583069139.
[I 2024-12-04 14:54:40,264] Trial 16 finished with value: 1.2614547976352468 and parameters: {'kernel_type': 'Matern', 'length_scale': 68681.36498952247, 'noise_level': 0.03459321648925828, 'constant_value': 4.454801954941471, 'nu': 2.5}. Best is trial 15 with value: 0.5273052583069139.
[I 2024-12-04 14:54:40,971] Trial 29 finished with value: 1.2614543702027634 and parameters: {'kernel_type': 'Matern', 'length_scale': 0.0017193810592345362, 'noise_level': 1.899074079561801e-09, 'constant_value': 3.9784787277153706, 'nu': 1.5}. Best is trial 15 with value: 0.5273052583069139.
[I 2024-12-04 14:54:42,330] Trial 1 finished with value: 1.2613942456495255 and parameters: {'kernel_type': 'Matern', 'length_scale': 75.93906726097161, 'noise_level': 4.875039482867013e-06, 'constant_value': 3.904862327032912e-07, 'nu': 0.5}. Best is trial 0 with value: 0.4883034000252698.
[I 2024-12-04 14:54:42,350] Trial 9 finished with value: 1.2401112325697905 and parameters: {'kernel_type': 'RBF', 'length_scale': 1824.8761913699577, 'noise_level': 7.566411429652e-05, 'constant_value': 5.670063299554789e-07, 'nu': 0.5}. Best is trial 0 with value: 0.4883034000252698.
[I 2024-12-04 14:54:42,463] Trial 23 finished with value: 1.240111231937275 and parameters: {'kernel_type': 'Matern', 'length_scale': 290.9282712314433, 'noise_level': 0.005043506410272106, 'constant_value': 0.000698418705009176, 'nu': 0.5}. Best is trial 0 with value: 0.4883034000252698.
[I 2024-12-04 14:54:43,042] Trial 33 finished with value: 1.2614543701632317 and parameters: {'kernel_type': 'RBF', 'length_scale': 0.03377886557703801, 'noise_level': 0.031201281289978254, 'constant_value': 8.417069174699016, 'nu': 0.5}. Best is trial 0 with value: 0.4883034000252698.
[I 2024-12-04 14:54:43,051] Trial 31 finished with value: 1.2401112323212014 and parameters: {'kernel_type': 'Matern', 'length_scale': 5299.361045013442, 'noise_level': 5.881242024422471e-10, 'constant_value': 183.83075288759895, 'nu': 0.5}. Best is trial 0 with value: 0.4883034000252698.
[I 2024-12-04 14:54:43,777] Trial 21 finished with value: 1.2401112368801226 and parameters: {'kernel_type': 'Matern', 'length_scale': 1928.7385646669204, 'noise_level': 2.753808128230629e-07, 'constant_value': 46.5737200981202, 'nu': 2.5}. Best is trial 0 with value: 0.4883034000252698.
[I 2024-12-04 14:54:43,877] Trial 0 finished with value: 0.4883034000252698 and parameters: {'kernel_type': 'Matern', 'length_scale': 3.5655929256762824, 'noise_level': 0.001838692024896992, 'constant_value': 3.327210541516607e-05, 'nu': 0.5}. Best is trial 0 with value: 0.4883034000252698.
[I 2024-12-04 14:54:43,884] Trial 28 finished with value: 1.240111232702513 and parameters: {'kernel_type': 'RBF', 'length_scale': 147.96847857643075, 'noise_level': 0.003491065532352665, 'constant_value': 79425.5239923959, 'nu': 0.5}. Best is trial 0 with value: 0.4883034000252698.
[I 2024-12-04 14:54:45,829] Trial 30 finished with value: 1.2401112272406196 and parameters: {'kernel_type': 'Matern', 'length_scale': 0.01691596523789788, 'noise_level': 7.446133497140444e-09, 'constant_value': 4.3921584194871453e-07, 'nu': 0.5}. Best is trial 0 with value: 0.4883034000252698.
[I 2024-12-04 14:54:47,275] Trial 26 finished with value: 1.261454797634171 and parameters: {'kernel_type': 'RBF', 'length_scale': 0.588737567863497, 'noise_level': 3.4752792344648522e-09, 'constant_value': 3679.8659901472556, 'nu': 0.5}. Best is trial 0 with value: 0.4883034000252698.
[I 2024-12-04 14:54:47,279] Trial 32 finished with value: 1.240111232567693 and parameters: {'kernel_type': 'RBF', 'length_scale': 185.70745790446387, 'noise_level': 0.0003231845448835723, 'constant_value': 0.02672956923307781, 'nu': 0.5}. Best is trial 0 with value: 0.4883034000252698.
[I 2024-12-04 14:54:47,381] Trial 18 finished with value: 0.6443853307960551 and parameters: {'kernel_type': 'RBF', 'length_scale': 1.1647095948424426, 'noise_level': 0.33772395370133, 'constant_value': 14164.937579992502, 'nu': 0.5}. Best is trial 0 with value: 0.4883034000252698.
[I 2024-12-04 14:54:47,387] Trial 45 finished with value: 0.6443853208342787 and parameters: {'kernel_type': 'RBF', 'length_scale': 0.4235788017415513, 'noise_level': 0.6620098253647718, 'constant_value': 392.19802866255105, 'nu': 1.5}. Best is trial 0 with value: 0.4883034000252698.
[I 2024-12-04 14:54:48,258] Trial 40 finished with value: 0.5273053905380908 and parameters: {'kernel_type': 'Matern', 'length_scale': 1050.7391889166665, 'noise_level': 0.1064268030293414, 'constant_value': 589.7204383664753, 'nu': 1.5}. Best is trial 0 with value: 0.4883034000252698.
[I 2024-12-04 14:54:49,280] Trial 41 finished with value: 0.488303822004856 and parameters: {'kernel_type': 'Matern', 'length_scale': 58034.138405639475, 'noise_level': 0.030018065099832774, 'constant_value': 356.45036113186694, 'nu': 0.5}. Best is trial 0 with value: 0.4883034000252698.
[I 2024-12-04 14:54:49,335] Trial 37 finished with value: 1.2614340888814395 and parameters: {'kernel_type': 'Matern', 'length_scale': 2.4289343317439576, 'noise_level': 0.632503916171958, 'constant_value': 2.241160586061128e-06, 'nu': 0.5}. Best is trial 0 with value: 0.4883034000252698.
[I 2024-12-04 14:54:50,443] Trial 36 finished with value: 1.2401112325310744 and parameters: {'kernel_type': 'RBF', 'length_scale': 11.753404588453924, 'noise_level': 0.0014905751848562382, 'constant_value': 9.625179501827338, 'nu': 2.5}. Best is trial 0 with value: 0.4883034000252698.
[I 2024-12-04 14:54:51,882] Trial 47 finished with value: 1.2401112320846794 and parameters: {'kernel_type': 'Matern', 'length_scale': 5.371086742037349, 'noise_level': 8.369117965420648e-05, 'constant_value': 0.00012037743401958118, 'nu': 0.5}. Best is trial 0 with value: 0.4883034000252698.
[I 2024-12-04 14:54:52,840] Trial 39 finished with value: 1.2401112332891255 and parameters: {'kernel_type': 'RBF', 'length_scale': 0.0823877111443365, 'noise_level': 0.00015634281003583104, 'constant_value': 0.010377806618661717, 'nu': 0.5}. Best is trial 0 with value: 0.4883034000252698.
[I 2024-12-04 14:54:53,463] Trial 48 finished with value: 0.527305409846367 and parameters: {'kernel_type': 'Matern', 'length_scale': 65.71403853784552, 'noise_level': 0.4129634172676597, 'constant_value': 91.28125436645593, 'nu': 1.5}. Best is trial 0 with value: 0.4883034000252698.
[I 2024-12-04 14:54:54,355] Trial 44 finished with value: 0.5273056190584858 and parameters: {'kernel_type': 'Matern', 'length_scale': 1119.7946881599614, 'noise_level': 0.01701393004885507, 'constant_value': 56532.976066832554, 'nu': 1.5}. Best is trial 0 with value: 0.4883034000252698.
[I 2024-12-04 14:54:55,104] Trial 51 finished with value: 0.4883034043229834 and parameters: {'kernel_type': 'Matern', 'length_scale': 8.960273482742945, 'noise_level': 0.01963358592085079, 'constant_value': 64.66305785844668, 'nu': 0.5}. Best is trial 0 with value: 0.4883034000252698.
[I 2024-12-04 14:54:56,075] Trial 38 finished with value: 1.2401112313743827 and parameters: {'kernel_type': 'Matern', 'length_scale': 28.49478188967414, 'noise_level': 0.001353435231082104, 'constant_value': 6.661606413310697e-05, 'nu': 2.5}. Best is trial 0 with value: 0.4883034000252698.
[I 2024-12-04 14:54:56,733] Trial 61 finished with value: 1.261454797635246 and parameters: {'kernel_type': 'RBF', 'length_scale': 45446.48600100685, 'noise_level': 0.4467832356723168, 'constant_value': 1.9802174032723876, 'nu': 0.5}. Best is trial 49 with value: 0.48830339276992535.
[I 2024-12-04 14:54:56,960] Trial 35 finished with value: 0.4883034123292643 and parameters: {'kernel_type': 'Matern', 'length_scale': 2128.778571206108, 'noise_level': 0.06020298987655037, 'constant_value': 22726.47023692822, 'nu': 0.5}. Best is trial 49 with value: 0.48830339276992535.
[I 2024-12-04 14:54:58,130] Trial 49 finished with value: 0.48830339276992535 and parameters: {'kernel_type': 'Matern', 'length_scale': 80860.36726031564, 'noise_level': 0.0989460545468855, 'constant_value': 61.494366802124674, 'nu': 0.5}. Best is trial 49 with value: 0.48830339276992535.
[I 2024-12-04 14:54:58,869] Trial 42 finished with value: 1.2401112335426216 and parameters: {'kernel_type': 'Matern', 'length_scale': 8479.135948125984, 'noise_level': 0.0059764267403773835, 'constant_value': 27764.365457302258, 'nu': 1.5}. Best is trial 49 with value: 0.48830339276992535.
[I 2024-12-04 14:54:59,130] Trial 34 finished with value: 0.5663937171171013 and parameters: {'kernel_type': 'Matern', 'length_scale': 19.631484657861584, 'noise_level': 0.002143996173191216, 'constant_value': 53623.33973225501, 'nu': 2.5}. Best is trial 49 with value: 0.48830339276992535.
[I 2024-12-04 14:55:00,023] Trial 50 finished with value: 0.5273053411058843 and parameters: {'kernel_type': 'Matern', 'length_scale': 1.5257572287595025, 'noise_level': 0.017881781396687127, 'constant_value': 4.6322893886253995, 'nu': 1.5}. Best is trial 49 with value: 0.48830339276992535.
[I 2024-12-04 14:55:01,683] Trial 54 finished with value: 1.2614547953941473 and parameters: {'kernel_type': 'Matern', 'length_scale': 791.2764142799176, 'noise_level': 0.02901290671876535, 'constant_value': 7985.630815918744, 'nu': 0.5}. Best is trial 52 with value: 0.48830339117573807.
[I 2024-12-04 14:55:02,082] Trial 53 finished with value: 0.48830341627401824 and parameters: {'kernel_type': 'Matern', 'length_scale': 3.9285046925044833, 'noise_level': 0.0010789660198310279, 'constant_value': 136.11726508929107, 'nu': 0.5}. Best is trial 52 with value: 0.48830339117573807.
[I 2024-12-04 14:55:02,088] Trial 52 finished with value: 0.48830339117573807 and parameters: {'kernel_type': 'Matern', 'length_scale': 39.70196277292347, 'noise_level': 0.030347723784118135, 'constant_value': 30.74144914775946, 'nu': 0.5}. Best is trial 52 with value: 0.48830339117573807.
[I 2024-12-04 14:55:02,285] Trial 46 finished with value: 0.527306996276701 and parameters: {'kernel_type': 'Matern', 'length_scale': 2753.5444278526284, 'noise_level': 0.07816573996862405, 'constant_value': 6.32415622304328, 'nu': 1.5}. Best is trial 52 with value: 0.48830339117573807.
[I 2024-12-04 14:55:02,354] Trial 43 finished with value: 0.5273054294473624 and parameters: {'kernel_type': 'Matern', 'length_scale': 92422.8134245254, 'noise_level': 0.576246749736567, 'constant_value': 2959.743650484494, 'nu': 1.5}. Best is trial 52 with value: 0.48830339117573807.
[I 2024-12-04 14:55:02,737] Trial 57 finished with value: 1.240111232054248 and parameters: {'kernel_type': 'Matern', 'length_scale': 0.02252855186659031, 'noise_level': 0.001161412911728914, 'constant_value': 1.696786516548404e-05, 'nu': 1.5}. Best is trial 52 with value: 0.48830339117573807.
[I 2024-12-04 14:55:04,423] Trial 58 finished with value: 1.2401112365873923 and parameters: {'kernel_type': 'Matern', 'length_scale': 0.0027195597853592614, 'noise_level': 3.849983840597614e-07, 'constant_value': 0.0026466267035114115, 'nu': 2.5}. Best is trial 52 with value: 0.48830339117573807.
[I 2024-12-04 14:55:04,867] Trial 64 finished with value: 1.2401112325797325 and parameters: {'kernel_type': 'Matern', 'length_scale': 38765.95595492748, 'noise_level': 0.0009983132231415235, 'constant_value': 501.39176007116197, 'nu': 0.5}. Best is trial 55 with value: 0.4883033224458376.
[I 2024-12-04 14:55:04,878] Trial 56 finished with value: 0.48830344467862435 and parameters: {'kernel_type': 'Matern', 'length_scale': 7362.673114263688, 'noise_level': 0.044475155741018575, 'constant_value': 15616.44577940605, 'nu': 0.5}. Best is trial 55 with value: 0.4883033224458376.
[I 2024-12-04 14:55:07,061] Trial 55 finished with value: 0.4883033224458376 and parameters: {'kernel_type': 'Matern', 'length_scale': 22563.31739990307, 'noise_level': 0.3583610015664929, 'constant_value': 7.6712540068268025, 'nu': 0.5}. Best is trial 55 with value: 0.4883033224458376.
[I 2024-12-04 14:55:07,250] Trial 62 finished with value: 1.2401112326063655 and parameters: {'kernel_type': 'Matern', 'length_scale': 43994.96702022809, 'noise_level': 0.04188188354363809, 'constant_value': 0.24132797421048335, 'nu': 0.5}. Best is trial 55 with value: 0.4883033224458376.
[I 2024-12-04 14:55:07,364] Trial 66 finished with value: 0.48830335520649465 and parameters: {'kernel_type': 'Matern', 'length_scale': 29537.686440446614, 'noise_level': 0.02947277335608804, 'constant_value': 1457.6974775796616, 'nu': 0.5}. Best is trial 55 with value: 0.4883033224458376.
[I 2024-12-04 14:55:07,578] Trial 67 finished with value: 1.261454370202776 and parameters: {'kernel_type': 'RBF', 'length_scale': 0.0005772950287151487, 'noise_level': 1.3517508519585065e-07, 'constant_value': 21.468201809590102, 'nu': 2.5}. Best is trial 55 with value: 0.4883033224458376.
[I 2024-12-04 14:55:08,235] Trial 60 finished with value: 1.240111232622352 and parameters: {'kernel_type': 'Matern', 'length_scale': 33212.09787868042, 'noise_level': 0.02741197472402655, 'constant_value': 61.1951804959973, 'nu': 0.5}. Best is trial 65 with value: 0.4883033203991969.
[I 2024-12-04 14:55:09,099] Trial 68 finished with value: 0.48830341749913564 and parameters: {'kernel_type': 'Matern', 'length_scale': 1.6363883768945708, 'noise_level': 0.9483876881391811, 'constant_value': 32.43282752930402, 'nu': 0.5}. Best is trial 65 with value: 0.4883033203991969.
[I 2024-12-04 14:55:09,118] Trial 59 finished with value: 0.6443830810819825 and parameters: {'kernel_type': 'RBF', 'length_scale': 0.5844928384213915, 'noise_level': 0.16465990148943896, 'constant_value': 4.833259882750679e-05, 'nu': 1.5}. Best is trial 65 with value: 0.4883033203991969.
[I 2024-12-04 14:55:09,121] Trial 65 finished with value: 0.4883033203991969 and parameters: {'kernel_type': 'Matern', 'length_scale': 16.237451153014913, 'noise_level': 0.6971020960804822, 'constant_value': 236.5052499029259, 'nu': 0.5}. Best is trial 65 with value: 0.4883033203991969.
[I 2024-12-04 14:55:09,192] Trial 63 finished with value: 0.48830340783712844 and parameters: {'kernel_type': 'Matern', 'length_scale': 0.27124041643589886, 'noise_level': 0.0016417522942805182, 'constant_value': 2957.146929739833, 'nu': 0.5}. Best is trial 65 with value: 0.4883033203991969.
[I 2024-12-04 14:55:09,408] Trial 69 finished with value: 0.4883034027287463 and parameters: {'kernel_type': 'Matern', 'length_scale': 11.414504247990104, 'noise_level': 7.558880419410162e-06, 'constant_value': 2.581495373743984, 'nu': 0.5}. Best is trial 65 with value: 0.4883033203991969.
[I 2024-12-04 14:55:11,141] Trial 74 finished with value: 1.261454776784104 and parameters: {'kernel_type': 'Matern', 'length_scale': 17.491032581474162, 'noise_level': 5.369243479533796e-05, 'constant_value': 1678.8537224226463, 'nu': 0.5}. Best is trial 65 with value: 0.4883033203991969.
[I 2024-12-04 14:55:12,046] Trial 81 finished with value: 0.5663937243267222 and parameters: {'kernel_type': 'Matern', 'length_scale': 0.7516171725172209, 'noise_level': 0.41029254430627593, 'constant_value': 19.864450743294643, 'nu': 2.5}. Best is trial 65 with value: 0.4883033203991969.
[I 2024-12-04 14:55:12,222] Trial 79 finished with value: 0.48830340698265573 and parameters: {'kernel_type': 'Matern', 'length_scale': 31274.847394596323, 'noise_level': 0.8189018166737657, 'constant_value': 121.95851415623048, 'nu': 0.5}. Best is trial 65 with value: 0.4883033203991969.
[I 2024-12-04 14:55:12,281] Trial 75 finished with value: 0.4883033860832947 and parameters: {'kernel_type': 'Matern', 'length_scale': 7.4708742613990555, 'noise_level': 0.006415891051867244, 'constant_value': 63.654820420264436, 'nu': 0.5}. Best is trial 65 with value: 0.4883033203991969.
[I 2024-12-04 14:55:13,255] Trial 71 finished with value: 1.2563200854449006 and parameters: {'kernel_type': 'Matern', 'length_scale': 86.89064702898226, 'noise_level': 0.0003091529805129335, 'constant_value': 1.4350777611740284e-07, 'nu': 0.5}. Best is trial 65 with value: 0.4883033203991969.
