[I 2024-12-04 12:20:44,214] Trial 1998 finished with value: 0.30971581827939726 and parameters: {'n_estimators': 510, 'max_depth': 42, 'min_samples_split': 2, 'min_samples_leaf': 1, 'max_features': 'sqrt', 'bootstrap': False, 'criterion': 'squared_error'}. Best is trial 341 with value: 0.2909369124469028.
[I 2024-12-04 12:20:44,650] Trial 2010 finished with value: 0.44295062266083973 and parameters: {'n_estimators': 400, 'max_depth': 43, 'min_samples_split': 3, 'min_samples_leaf': 2, 'max_features': 'sqrt', 'bootstrap': False, 'criterion': 'squared_error'}. Best is trial 341 with value: 0.2909369124469028.
[I 2024-12-04 12:20:44,658] Trial 2003 finished with value: 0.4389783393372414 and parameters: {'n_estimators': 569, 'max_depth': 50, 'min_samples_split': 5, 'min_samples_leaf': 2, 'max_features': 'sqrt', 'bootstrap': False, 'criterion': 'squared_error'}. Best is trial 341 with value: 0.2909369124469028.
[I 2024-12-04 12:20:44,878] Trial 1999 finished with value: 0.3064507165568764 and parameters: {'n_estimators': 399, 'max_depth': 50, 'min_samples_split': 6, 'min_samples_leaf': 1, 'max_features': 'sqrt', 'bootstrap': False, 'criterion': 'squared_error'}. Best is trial 341 with value: 0.2909369124469028.
[I 2024-12-04 12:20:44,880] Trial 2002 finished with value: 0.3151729542152211 and parameters: {'n_estimators': 257, 'max_depth': 43, 'min_samples_split': 5, 'min_samples_leaf': 1, 'max_features': 'sqrt', 'bootstrap': False, 'criterion': 'squared_error'}. Best is trial 341 with value: 0.2909369124469028.
[I 2024-12-04 12:20:48,013] Trial 2014 finished with value: 0.30757736673746866 and parameters: {'n_estimators': 103, 'max_depth': 50, 'min_samples_split': 6, 'min_samples_leaf': 1, 'max_features': 'sqrt', 'bootstrap': False, 'criterion': 'squared_error'}. Best is trial 341 with value: 0.2909369124469028.
[I 2024-12-04 12:20:48,021] Trial 2013 finished with value: 0.3003785905845608 and parameters: {'n_estimators': 229, 'max_depth': 43, 'min_samples_split': 3, 'min_samples_leaf': 1, 'max_features': 'sqrt', 'bootstrap': False, 'criterion': 'squared_error'}. Best is trial 341 with value: 0.2909369124469028.
[I 2024-12-04 12:20:48,323] Trial 2004 finished with value: 0.4427146486910674 and parameters: {'n_estimators': 239, 'max_depth': 50, 'min_samples_split': 3, 'min_samples_leaf': 2, 'max_features': 'sqrt', 'bootstrap': False, 'criterion': 'squared_error'}. Best is trial 341 with value: 0.2909369124469028.
[I 2024-12-04 12:20:48,336] Trial 2007 finished with value: 0.45399972514804626 and parameters: {'n_estimators': 555, 'max_depth': 33, 'min_samples_split': 3, 'min_samples_leaf': 2, 'max_features': 'sqrt', 'bootstrap': False, 'criterion': 'squared_error'}. Best is trial 341 with value: 0.2909369124469028.
[I 2024-12-04 12:20:52,417] Trial 2005 finished with value: 0.3007495576483994 and parameters: {'n_estimators': 178, 'max_depth': 44, 'min_samples_split': 3, 'min_samples_leaf': 1, 'max_features': 'sqrt', 'bootstrap': False, 'criterion': 'squared_error'}. Best is trial 341 with value: 0.2909369124469028.
[I 2024-12-04 12:20:52,733] Trial 2011 finished with value: 0.2979527574458973 and parameters: {'n_estimators': 386, 'max_depth': 50, 'min_samples_split': 2, 'min_samples_leaf': 1, 'max_features': 'sqrt', 'bootstrap': False, 'criterion': 'squared_error'}. Best is trial 341 with value: 0.2909369124469028.
[I 2024-12-04 12:20:55,062] Trial 2015 finished with value: 0.3003702412440497 and parameters: {'n_estimators': 543, 'max_depth': 50, 'min_samples_split': 4, 'min_samples_leaf': 1, 'max_features': 'sqrt', 'bootstrap': False, 'criterion': 'squared_error'}. Best is trial 341 with value: 0.2909369124469028.
[I 2024-12-04 12:20:56,503] Trial 2022 finished with value: 0.4410674733508322 and parameters: {'n_estimators': 533, 'max_depth': 50, 'min_samples_split': 3, 'min_samples_leaf': 2, 'max_features': 'sqrt', 'bootstrap': False, 'criterion': 'squared_error'}. Best is trial 341 with value: 0.2909369124469028.
[I 2024-12-04 12:20:56,617] Trial 2017 finished with value: 0.2995721585224271 and parameters: {'n_estimators': 243, 'max_depth': 50, 'min_samples_split': 2, 'min_samples_leaf': 1, 'max_features': 'sqrt', 'bootstrap': False, 'criterion': 'squared_error'}. Best is trial 341 with value: 0.2909369124469028.
[I 2024-12-04 12:20:57,914] Trial 2021 finished with value: 0.30049711593316814 and parameters: {'n_estimators': 414, 'max_depth': 50, 'min_samples_split': 4, 'min_samples_leaf': 1, 'max_features': 'sqrt', 'bootstrap': False, 'criterion': 'squared_error'}. Best is trial 341 with value: 0.2909369124469028.
[I 2024-12-04 12:20:58,040] Trial 2009 finished with value: 0.5013883461682411 and parameters: {'n_estimators': 971, 'max_depth': 45, 'min_samples_split': 14, 'min_samples_leaf': 14, 'max_features': None, 'bootstrap': False, 'criterion': 'squared_error'}. Best is trial 341 with value: 0.2909369124469028.
[I 2024-12-04 12:21:00,714] Trial 2019 finished with value: 0.47374942178359186 and parameters: {'n_estimators': 101, 'max_depth': 8, 'min_samples_split': 40, 'min_samples_leaf': 7, 'max_features': None, 'bootstrap': True, 'criterion': 'absolute_error'}. Best is trial 341 with value: 0.2909369124469028.
[I 2024-12-04 12:21:00,768] Trial 2008 finished with value: 0.4388163479074688 and parameters: {'n_estimators': 614, 'max_depth': 11, 'min_samples_split': 25, 'min_samples_leaf': 6, 'max_features': None, 'bootstrap': True, 'criterion': 'squared_error'}. Best is trial 341 with value: 0.2909369124469028.
[I 2024-12-04 12:21:02,142] Trial 2020 finished with value: 0.44161462797239953 and parameters: {'n_estimators': 602, 'max_depth': 45, 'min_samples_split': 2, 'min_samples_leaf': 2, 'max_features': 'sqrt', 'bootstrap': False, 'criterion': 'squared_error'}. Best is trial 341 with value: 0.2909369124469028.
[I 2024-12-04 12:21:03,005] Trial 2032 finished with value: 0.3014502787818886 and parameters: {'n_estimators': 390, 'max_depth': 43, 'min_samples_split': 3, 'min_samples_leaf': 1, 'max_features': 'sqrt', 'bootstrap': False, 'criterion': 'squared_error'}. Best is trial 341 with value: 0.2909369124469028.
[I 2024-12-04 12:21:03,367] Trial 2016 finished with value: 0.2943140586990195 and parameters: {'n_estimators': 682, 'max_depth': 50, 'min_samples_split': 3, 'min_samples_leaf': 1, 'max_features': 'sqrt', 'bootstrap': False, 'criterion': 'squared_error'}. Best is trial 341 with value: 0.2909369124469028.
[I 2024-12-04 12:21:03,900] Trial 2027 finished with value: 0.29899002903256944 and parameters: {'n_estimators': 413, 'max_depth': 50, 'min_samples_split': 2, 'min_samples_leaf': 1, 'max_features': 'sqrt', 'bootstrap': False, 'criterion': 'squared_error'}. Best is trial 341 with value: 0.2909369124469028.
[I 2024-12-04 12:21:04,166] Trial 2028 finished with value: 0.3102735282943513 and parameters: {'n_estimators': 521, 'max_depth': 42, 'min_samples_split': 4, 'min_samples_leaf': 1, 'max_features': 'sqrt', 'bootstrap': False, 'criterion': 'squared_error'}. Best is trial 341 with value: 0.2909369124469028.
[I 2024-12-04 12:21:04,168] Trial 2025 finished with value: 0.44314856574834577 and parameters: {'n_estimators': 272, 'max_depth': 50, 'min_samples_split': 3, 'min_samples_leaf': 2, 'max_features': 'sqrt', 'bootstrap': False, 'criterion': 'squared_error'}. Best is trial 341 with value: 0.2909369124469028.
[I 2024-12-04 12:21:05,352] Trial 2030 finished with value: 0.30070973530050177 and parameters: {'n_estimators': 236, 'max_depth': 50, 'min_samples_split': 4, 'min_samples_leaf': 1, 'max_features': 'sqrt', 'bootstrap': False, 'criterion': 'squared_error'}. Best is trial 341 with value: 0.2909369124469028.
[I 2024-12-04 12:21:06,209] Trial 2031 finished with value: 0.30784697089855156 and parameters: {'n_estimators': 264, 'max_depth': 42, 'min_samples_split': 2, 'min_samples_leaf': 1, 'max_features': 'sqrt', 'bootstrap': False, 'criterion': 'squared_error'}. Best is trial 341 with value: 0.2909369124469028.
[I 2024-12-04 12:21:08,120] Trial 2024 finished with value: 0.5400692202474442 and parameters: {'n_estimators': 823, 'max_depth': 48, 'min_samples_split': 2, 'min_samples_leaf': 13, 'max_features': None, 'bootstrap': True, 'criterion': 'squared_error'}. Best is trial 341 with value: 0.2909369124469028.
[I 2024-12-04 12:21:08,151] Trial 2026 finished with value: 0.3473205630014354 and parameters: {'n_estimators': 458, 'max_depth': 19, 'min_samples_split': 6, 'min_samples_leaf': 1, 'max_features': None, 'bootstrap': True, 'criterion': 'squared_error'}. Best is trial 341 with value: 0.2909369124469028.
[I 2024-12-04 12:21:08,521] Trial 2034 finished with value: 0.30737165058411603 and parameters: {'n_estimators': 239, 'max_depth': 44, 'min_samples_split': 4, 'min_samples_leaf': 1, 'max_features': 'sqrt', 'bootstrap': False, 'criterion': 'squared_error'}. Best is trial 341 with value: 0.2909369124469028.
[I 2024-12-04 12:21:08,527] Trial 2038 finished with value: 0.3015385982848819 and parameters: {'n_estimators': 526, 'max_depth': 43, 'min_samples_split': 3, 'min_samples_leaf': 1, 'max_features': 'sqrt', 'bootstrap': False, 'criterion': 'squared_error'}. Best is trial 341 with value: 0.2909369124469028.
[I 2024-12-04 12:21:08,659] Trial 2029 finished with value: 0.4481866078207198 and parameters: {'n_estimators': 145, 'max_depth': 44, 'min_samples_split': 2, 'min_samples_leaf': 2, 'max_features': 'sqrt', 'bootstrap': False, 'criterion': 'squared_error'}. Best is trial 341 with value: 0.2909369124469028.
[I 2024-12-04 12:21:09,361] Trial 2039 finished with value: 0.48460806069769674 and parameters: {'n_estimators': 437, 'max_depth': 30, 'min_samples_split': 4, 'min_samples_leaf': 10, 'max_features': None, 'bootstrap': False, 'criterion': 'squared_error'}. Best is trial 341 with value: 0.2909369124469028.
[I 2024-12-04 12:21:09,776] Trial 2042 finished with value: 0.3159802890779869 and parameters: {'n_estimators': 127, 'max_depth': 39, 'min_samples_split': 2, 'min_samples_leaf': 1, 'max_features': 'sqrt', 'bootstrap': False, 'criterion': 'squared_error'}. Best is trial 341 with value: 0.2909369124469028.
[I 2024-12-04 12:21:09,929] Trial 2018 finished with value: 0.486283616203702 and parameters: {'n_estimators': 364, 'max_depth': 22, 'min_samples_split': 24, 'min_samples_leaf': 1, 'max_features': 'sqrt', 'bootstrap': False, 'criterion': 'absolute_error'}. Best is trial 341 with value: 0.2909369124469028.
[I 2024-12-04 12:21:10,059] Trial 2041 finished with value: 0.4446112595344916 and parameters: {'n_estimators': 689, 'max_depth': 43, 'min_samples_split': 4, 'min_samples_leaf': 2, 'max_features': 'sqrt', 'bootstrap': False, 'criterion': 'squared_error'}. Best is trial 341 with value: 0.2909369124469028.
[I 2024-12-04 12:21:10,306] Trial 2033 finished with value: 0.44435618384186004 and parameters: {'n_estimators': 248, 'max_depth': 44, 'min_samples_split': 2, 'min_samples_leaf': 2, 'max_features': 'sqrt', 'bootstrap': False, 'criterion': 'squared_error'}. Best is trial 341 with value: 0.2909369124469028.
[I 2024-12-04 12:21:10,403] Trial 2037 finished with value: 0.3209476865224896 and parameters: {'n_estimators': 295, 'max_depth': 45, 'min_samples_split': 2, 'min_samples_leaf': 1, 'max_features': 'sqrt', 'bootstrap': True, 'criterion': 'squared_error'}. Best is trial 341 with value: 0.2909369124469028.
[I 2024-12-04 12:21:11,678] Trial 2036 finished with value: 0.8741188310485684 and parameters: {'n_estimators': 584, 'max_depth': 14, 'min_samples_split': 2, 'min_samples_leaf': 3, 'max_features': 'log2', 'bootstrap': True, 'criterion': 'squared_error'}. Best is trial 341 with value: 0.2909369124469028.
[I 2024-12-04 12:21:12,207] Trial 2044 finished with value: 0.2982401546380932 and parameters: {'n_estimators': 203, 'max_depth': 50, 'min_samples_split': 2, 'min_samples_leaf': 1, 'max_features': 'sqrt', 'bootstrap': False, 'criterion': 'squared_error'}. Best is trial 341 with value: 0.2909369124469028.
[I 2024-12-04 12:21:13,715] Trial 2043 finished with value: 0.8029394114505167 and parameters: {'n_estimators': 847, 'max_depth': 42, 'min_samples_split': 41, 'min_samples_leaf': 10, 'max_features': 'sqrt', 'bootstrap': False, 'criterion': 'squared_error'}. Best is trial 341 with value: 0.2909369124469028.
[I 2024-12-04 12:21:14,849] Trial 2040 finished with value: 0.2993010776771464 and parameters: {'n_estimators': 699, 'max_depth': 50, 'min_samples_split': 2, 'min_samples_leaf': 1, 'max_features': 'sqrt', 'bootstrap': False, 'criterion': 'squared_error'}. Best is trial 341 with value: 0.2909369124469028.
[I 2024-12-04 12:21:16,108] Trial 2053 finished with value: 0.973729605885603 and parameters: {'n_estimators': 224, 'max_depth': 8, 'min_samples_split': 8, 'min_samples_leaf': 15, 'max_features': 'log2', 'bootstrap': True, 'criterion': 'squared_error'}. Best is trial 341 with value: 0.2909369124469028.
[I 2024-12-04 12:21:17,044] Trial 2023 finished with value: 0.8694479127145469 and parameters: {'n_estimators': 901, 'max_depth': 45, 'min_samples_split': 17, 'min_samples_leaf': 10, 'max_features': 'sqrt', 'bootstrap': True, 'criterion': 'absolute_error'}. Best is trial 341 with value: 0.2909369124469028.
[I 2024-12-04 12:21:17,701] Trial 2047 finished with value: 0.30491167790081064 and parameters: {'n_estimators': 519, 'max_depth': 44, 'min_samples_split': 2, 'min_samples_leaf': 1, 'max_features': 'sqrt', 'bootstrap': False, 'criterion': 'squared_error'}. Best is trial 341 with value: 0.2909369124469028.
[I 2024-12-04 12:21:18,724] Trial 2052 finished with value: 0.9549205870502897 and parameters: {'n_estimators': 865, 'max_depth': 28, 'min_samples_split': 49, 'min_samples_leaf': 8, 'max_features': 'log2', 'bootstrap': True, 'criterion': 'squared_error'}. Best is trial 341 with value: 0.2909369124469028.
[I 2024-12-04 12:21:20,356] Trial 2050 finished with value: 0.29439342385361605 and parameters: {'n_estimators': 421, 'max_depth': 50, 'min_samples_split': 3, 'min_samples_leaf': 1, 'max_features': 'sqrt', 'bootstrap': False, 'criterion': 'squared_error'}. Best is trial 341 with value: 0.2909369124469028.
[I 2024-12-04 12:21:20,947] Trial 2056 finished with value: 0.30700163525953567 and parameters: {'n_estimators': 123, 'max_depth': 49, 'min_samples_split': 4, 'min_samples_leaf': 1, 'max_features': 'sqrt', 'bootstrap': False, 'criterion': 'squared_error'}. Best is trial 341 with value: 0.2909369124469028.
[I 2024-12-04 12:21:21,314] Trial 2058 finished with value: 0.3074625923354829 and parameters: {'n_estimators': 406, 'max_depth': 44, 'min_samples_split': 4, 'min_samples_leaf': 1, 'max_features': 'sqrt', 'bootstrap': False, 'criterion': 'squared_error'}. Best is trial 341 with value: 0.2909369124469028.
[I 2024-12-04 12:21:23,179] Trial 2054 finished with value: 0.29261985948526215 and parameters: {'n_estimators': 160, 'max_depth': 50, 'min_samples_split': 3, 'min_samples_leaf': 1, 'max_features': 'sqrt', 'bootstrap': False, 'criterion': 'squared_error'}. Best is trial 341 with value: 0.2909369124469028.
[I 2024-12-04 12:21:26,308] Trial 2045 finished with value: 0.3221927991497595 and parameters: {'n_estimators': 316, 'max_depth': 50, 'min_samples_split': 4, 'min_samples_leaf': 1, 'max_features': 'sqrt', 'bootstrap': True, 'criterion': 'squared_error'}. Best is trial 341 with value: 0.2909369124469028.
[I 2024-12-04 12:21:26,512] Trial 2046 finished with value: 0.4444188596292399 and parameters: {'n_estimators': 592, 'max_depth': 40, 'min_samples_split': 4, 'min_samples_leaf': 2, 'max_features': 'sqrt', 'bootstrap': False, 'criterion': 'squared_error'}. Best is trial 341 with value: 0.2909369124469028.
[I 2024-12-04 12:21:27,423] Trial 2035 finished with value: 0.4331828627765008 and parameters: {'n_estimators': 116, 'max_depth': 49, 'min_samples_split': 2, 'min_samples_leaf': 1, 'max_features': None, 'bootstrap': False, 'criterion': 'absolute_error'}. Best is trial 341 with value: 0.2909369124469028.
[I 2024-12-04 12:21:29,715] Trial 2061 finished with value: 0.44474093670828835 and parameters: {'n_estimators': 320, 'max_depth': 41, 'min_samples_split': 4, 'min_samples_leaf': 2, 'max_features': 'sqrt', 'bootstrap': False, 'criterion': 'squared_error'}. Best is trial 341 with value: 0.2909369124469028.
[I 2024-12-04 12:21:29,717] Trial 2060 finished with value: 0.30035065621696727 and parameters: {'n_estimators': 119, 'max_depth': 43, 'min_samples_split': 3, 'min_samples_leaf': 1, 'max_features': 'sqrt', 'bootstrap': False, 'criterion': 'squared_error'}. Best is trial 341 with value: 0.2909369124469028.
[I 2024-12-04 12:21:29,908] Trial 2051 finished with value: 0.8398272476204935 and parameters: {'n_estimators': 230, 'max_depth': 37, 'min_samples_split': 9, 'min_samples_leaf': 8, 'max_features': 'sqrt', 'bootstrap': True, 'criterion': 'squared_error'}. Best is trial 341 with value: 0.2909369124469028.
[I 2024-12-04 12:21:30,104] Trial 2059 finished with value: 0.4773823868294984 and parameters: {'n_estimators': 223, 'max_depth': 50, 'min_samples_split': 3, 'min_samples_leaf': 2, 'max_features': 'sqrt', 'bootstrap': True, 'criterion': 'squared_error'}. Best is trial 341 with value: 0.2909369124469028.
[I 2024-12-04 12:21:30,597] Trial 2070 finished with value: 0.30048840912117625 and parameters: {'n_estimators': 260, 'max_depth': 45, 'min_samples_split': 2, 'min_samples_leaf': 1, 'max_features': 'sqrt', 'bootstrap': False, 'criterion': 'squared_error'}. Best is trial 341 with value: 0.2909369124469028.
[I 2024-12-04 12:21:30,622] Trial 2057 finished with value: 0.30097743034474667 and parameters: {'n_estimators': 304, 'max_depth': 43, 'min_samples_split': 3, 'min_samples_leaf': 1, 'max_features': 'sqrt', 'bootstrap': False, 'criterion': 'squared_error'}. Best is trial 341 with value: 0.2909369124469028.
[I 2024-12-04 12:21:30,996] Trial 2065 finished with value: 0.3026009092878668 and parameters: {'n_estimators': 672, 'max_depth': 43, 'min_samples_split': 3, 'min_samples_leaf': 1, 'max_features': 'sqrt', 'bootstrap': False, 'criterion': 'squared_error'}. Best is trial 341 with value: 0.2909369124469028.
[I 2024-12-04 12:21:31,081] Trial 2049 finished with value: 0.44042839718063637 and parameters: {'n_estimators': 587, 'max_depth': 50, 'min_samples_split': 4, 'min_samples_leaf': 2, 'max_features': 'sqrt', 'bootstrap': False, 'criterion': 'squared_error'}. Best is trial 341 with value: 0.2909369124469028.
[I 2024-12-04 12:21:31,181] Trial 2067 finished with value: 0.3192320913421647 and parameters: {'n_estimators': 473, 'max_depth': 42, 'min_samples_split': 6, 'min_samples_leaf': 1, 'max_features': 'sqrt', 'bootstrap': False, 'criterion': 'squared_error'}. Best is trial 341 with value: 0.2909369124469028.
[I 2024-12-04 12:21:32,675] Trial 2066 finished with value: 0.3659253556410934 and parameters: {'n_estimators': 100, 'max_depth': 35, 'min_samples_split': 11, 'min_samples_leaf': 1, 'max_features': 'sqrt', 'bootstrap': False, 'criterion': 'squared_error'}. Best is trial 341 with value: 0.2909369124469028.
[I 2024-12-04 12:21:33,949] Trial 2055 finished with value: 0.32368411462870084 and parameters: {'n_estimators': 629, 'max_depth': 49, 'min_samples_split': 4, 'min_samples_leaf': 1, 'max_features': 'sqrt', 'bootstrap': True, 'criterion': 'squared_error'}. Best is trial 341 with value: 0.2909369124469028.
[I 2024-12-04 12:21:34,052] Trial 2072 finished with value: 0.880931721611039 and parameters: {'n_estimators': 103, 'max_depth': 29, 'min_samples_split': 23, 'min_samples_leaf': 11, 'max_features': 'sqrt', 'bootstrap': True, 'criterion': 'squared_error'}. Best is trial 341 with value: 0.2909369124469028.
[I 2024-12-04 12:21:34,226] Trial 2076 finished with value: 0.2945108620440511 and parameters: {'n_estimators': 134, 'max_depth': 50, 'min_samples_split': 3, 'min_samples_leaf': 1, 'max_features': 'sqrt', 'bootstrap': False, 'criterion': 'squared_error'}. Best is trial 341 with value: 0.2909369124469028.
[I 2024-12-04 12:21:36,421] Trial 2069 finished with value: 0.3834409344303718 and parameters: {'n_estimators': 234, 'max_depth': 44, 'min_samples_split': 4, 'min_samples_leaf': 1, 'max_features': None, 'bootstrap': False, 'criterion': 'squared_error'}. Best is trial 341 with value: 0.2909369124469028.
[I 2024-12-04 12:21:36,625] Trial 2068 finished with value: 0.30437696542191695 and parameters: {'n_estimators': 614, 'max_depth': 50, 'min_samples_split': 5, 'min_samples_leaf': 1, 'max_features': 'sqrt', 'bootstrap': False, 'criterion': 'squared_error'}. Best is trial 341 with value: 0.2909369124469028.
[I 2024-12-04 12:21:36,653] Trial 2064 finished with value: 0.3104894243550993 and parameters: {'n_estimators': 238, 'max_depth': 44, 'min_samples_split': 5, 'min_samples_leaf': 1, 'max_features': 'sqrt', 'bootstrap': False, 'criterion': 'squared_error'}. Best is trial 341 with value: 0.2909369124469028.
[I 2024-12-04 12:21:36,656] Trial 2079 finished with value: 0.44516777419316006 and parameters: {'n_estimators': 274, 'max_depth': 42, 'min_samples_split': 4, 'min_samples_leaf': 2, 'max_features': 'sqrt', 'bootstrap': False, 'criterion': 'squared_error'}. Best is trial 341 with value: 0.2909369124469028.
[I 2024-12-04 12:21:37,256] Trial 2077 finished with value: 0.7107188776380318 and parameters: {'n_estimators': 195, 'max_depth': 49, 'min_samples_split': 6, 'min_samples_leaf': 2, 'max_features': 'log2', 'bootstrap': False, 'criterion': 'squared_error'}. Best is trial 341 with value: 0.2909369124469028.
[I 2024-12-04 12:21:37,257] Trial 2071 finished with value: 0.31110880013266173 and parameters: {'n_estimators': 767, 'max_depth': 42, 'min_samples_split': 4, 'min_samples_leaf': 1, 'max_features': 'sqrt', 'bootstrap': False, 'criterion': 'squared_error'}. Best is trial 341 with value: 0.2909369124469028.
