[I 2024-12-04 12:28:26,825] Trial 2304 finished with value: 0.5045759212715245 and parameters: {'n_estimators': 100, 'max_depth': 19, 'min_samples_split': 4, 'min_samples_leaf': 1, 'max_features': None, 'bootstrap': True, 'criterion': 'absolute_error'}. Best is trial 1749 with value: 0.502720715661024.
[I 2024-12-04 12:28:27,843] Trial 2305 finished with value: 0.9995976341744899 and parameters: {'n_estimators': 245, 'max_depth': 22, 'min_samples_split': 7, 'min_samples_leaf': 1, 'max_features': 'log2', 'bootstrap': True, 'criterion': 'absolute_error'}. Best is trial 1749 with value: 0.502720715661024.
[I 2024-12-04 12:28:29,983] Trial 2283 finished with value: 0.7022005494376571 and parameters: {'n_estimators': 359, 'max_depth': 24, 'min_samples_split': 46, 'min_samples_leaf': 1, 'max_features': None, 'bootstrap': True, 'criterion': 'absolute_error'}. Best is trial 1749 with value: 0.502720715661024.
[I 2024-12-04 12:28:32,210] Trial 2317 finished with value: 0.5774068397437889 and parameters: {'n_estimators': 103, 'max_depth': 26, 'min_samples_split': 4, 'min_samples_leaf': 1, 'max_features': None, 'bootstrap': False, 'criterion': 'squared_error'}. Best is trial 1749 with value: 0.502720715661024.
[I 2024-12-04 12:28:33,343] Trial 2310 finished with value: 0.6810477746238066 and parameters: {'n_estimators': 702, 'max_depth': 35, 'min_samples_split': 12, 'min_samples_leaf': 1, 'max_features': 'sqrt', 'bootstrap': True, 'criterion': 'squared_error'}. Best is trial 1749 with value: 0.502720715661024.
[I 2024-12-04 12:28:38,448] Trial 2319 finished with value: 0.5131502780385343 and parameters: {'n_estimators': 105, 'max_depth': 14, 'min_samples_split': 4, 'min_samples_leaf': 1, 'max_features': None, 'bootstrap': True, 'criterion': 'absolute_error'}. Best is trial 1749 with value: 0.502720715661024.
[I 2024-12-04 12:28:38,726] Trial 2314 finished with value: 0.5076098788974869 and parameters: {'n_estimators': 106, 'max_depth': 14, 'min_samples_split': 5, 'min_samples_leaf': 1, 'max_features': None, 'bootstrap': True, 'criterion': 'absolute_error'}. Best is trial 1749 with value: 0.502720715661024.
[I 2024-12-04 12:28:39,619] Trial 2321 finished with value: 0.558763892794201 and parameters: {'n_estimators': 106, 'max_depth': 20, 'min_samples_split': 4, 'min_samples_leaf': 2, 'max_features': None, 'bootstrap': True, 'criterion': 'absolute_error'}. Best is trial 1749 with value: 0.502720715661024.
[I 2024-12-04 12:28:39,875] Trial 2313 finished with value: 0.5152386865861325 and parameters: {'n_estimators': 104, 'max_depth': 22, 'min_samples_split': 6, 'min_samples_leaf': 1, 'max_features': None, 'bootstrap': True, 'criterion': 'absolute_error'}. Best is trial 1749 with value: 0.502720715661024.
[I 2024-12-04 12:28:40,347] Trial 2309 finished with value: 0.5538436517431152 and parameters: {'n_estimators': 250, 'max_depth': 14, 'min_samples_split': 4, 'min_samples_leaf': 2, 'max_features': None, 'bootstrap': True, 'criterion': 'absolute_error'}. Best is trial 1749 with value: 0.502720715661024.
[I 2024-12-04 12:28:41,200] Trial 2299 finished with value: 0.5218373561034823 and parameters: {'n_estimators': 259, 'max_depth': 24, 'min_samples_split': 3, 'min_samples_leaf': 1, 'max_features': None, 'bootstrap': True, 'criterion': 'absolute_error'}. Best is trial 1749 with value: 0.502720715661024.
[I 2024-12-04 12:28:41,537] Trial 2311 finished with value: 0.5582622513733931 and parameters: {'n_estimators': 293, 'max_depth': 20, 'min_samples_split': 6, 'min_samples_leaf': 2, 'max_features': None, 'bootstrap': True, 'criterion': 'absolute_error'}. Best is trial 1749 with value: 0.502720715661024.
[I 2024-12-04 12:28:43,313] Trial 2312 finished with value: 0.5179532358556194 and parameters: {'n_estimators': 209, 'max_depth': 14, 'min_samples_split': 4, 'min_samples_leaf': 1, 'max_features': None, 'bootstrap': True, 'criterion': 'absolute_error'}. Best is trial 1749 with value: 0.502720715661024.
[I 2024-12-04 12:28:43,352] Trial 2315 finished with value: 0.5137305759404308 and parameters: {'n_estimators': 233, 'max_depth': 13, 'min_samples_split': 3, 'min_samples_leaf': 1, 'max_features': None, 'bootstrap': True, 'criterion': 'absolute_error'}. Best is trial 1749 with value: 0.502720715661024.
[I 2024-12-04 12:28:43,512] Trial 2327 finished with value: 0.5578944289361044 and parameters: {'n_estimators': 104, 'max_depth': 14, 'min_samples_split': 4, 'min_samples_leaf': 2, 'max_features': None, 'bootstrap': True, 'criterion': 'absolute_error'}. Best is trial 1749 with value: 0.502720715661024.
[I 2024-12-04 12:28:43,514] Trial 2316 finished with value: 0.5175709544655602 and parameters: {'n_estimators': 110, 'max_depth': 18, 'min_samples_split': 3, 'min_samples_leaf': 1, 'max_features': None, 'bootstrap': True, 'criterion': 'absolute_error'}. Best is trial 1749 with value: 0.502720715661024.
[I 2024-12-04 12:28:43,948] Trial 2318 finished with value: 0.5148118694336186 and parameters: {'n_estimators': 102, 'max_depth': 15, 'min_samples_split': 3, 'min_samples_leaf': 1, 'max_features': None, 'bootstrap': True, 'criterion': 'absolute_error'}. Best is trial 1749 with value: 0.502720715661024.
[I 2024-12-04 12:28:46,663] Trial 2330 finished with value: 0.5141181044236646 and parameters: {'n_estimators': 104, 'max_depth': 15, 'min_samples_split': 3, 'min_samples_leaf': 1, 'max_features': None, 'bootstrap': True, 'criterion': 'absolute_error'}. Best is trial 1749 with value: 0.502720715661024.
[I 2024-12-04 12:28:48,830] Trial 2320 finished with value: 0.5136325027960988 and parameters: {'n_estimators': 100, 'max_depth': 25, 'min_samples_split': 2, 'min_samples_leaf': 1, 'max_features': None, 'bootstrap': True, 'criterion': 'absolute_error'}. Best is trial 1749 with value: 0.502720715661024.
[I 2024-12-04 12:28:49,357] Trial 2334 finished with value: 1.234666491132772 and parameters: {'n_estimators': 803, 'max_depth': 33, 'min_samples_split': 3, 'min_samples_leaf': 13, 'max_features': 'log2', 'bootstrap': False, 'criterion': 'squared_error'}. Best is trial 1749 with value: 0.502720715661024.
[I 2024-12-04 12:28:54,143] Trial 2326 finished with value: 1.0377655532313153 and parameters: {'n_estimators': 730, 'max_depth': 15, 'min_samples_split': 3, 'min_samples_leaf': 15, 'max_features': None, 'bootstrap': True, 'criterion': 'absolute_error'}. Best is trial 1749 with value: 0.502720715661024.
[I 2024-12-04 12:28:54,248] Trial 2332 finished with value: 0.7528457541531998 and parameters: {'n_estimators': 238, 'max_depth': 29, 'min_samples_split': 15, 'min_samples_leaf': 1, 'max_features': 'sqrt', 'bootstrap': True, 'criterion': 'absolute_error'}. Best is trial 1749 with value: 0.502720715661024.
[I 2024-12-04 12:28:54,754] Trial 2338 finished with value: 0.53081292203215 and parameters: {'n_estimators': 101, 'max_depth': 11, 'min_samples_split': 13, 'min_samples_leaf': 1, 'max_features': None, 'bootstrap': True, 'criterion': 'absolute_error'}. Best is trial 1749 with value: 0.502720715661024.
[I 2024-12-04 12:28:56,735] Trial 2308 finished with value: 0.514609029275699 and parameters: {'n_estimators': 450, 'max_depth': 12, 'min_samples_split': 4, 'min_samples_leaf': 1, 'max_features': None, 'bootstrap': True, 'criterion': 'absolute_error'}. Best is trial 1749 with value: 0.502720715661024.
[I 2024-12-04 12:28:57,553] Trial 2335 finished with value: 0.5539850477779382 and parameters: {'n_estimators': 112, 'max_depth': 19, 'min_samples_split': 3, 'min_samples_leaf': 2, 'max_features': None, 'bootstrap': True, 'criterion': 'absolute_error'}. Best is trial 1749 with value: 0.502720715661024.
[I 2024-12-04 12:28:59,441] Trial 2333 finished with value: 0.5229096897845449 and parameters: {'n_estimators': 100, 'max_depth': 17, 'min_samples_split': 10, 'min_samples_leaf': 1, 'max_features': None, 'bootstrap': True, 'criterion': 'absolute_error'}. Best is trial 1749 with value: 0.502720715661024.
[I 2024-12-04 12:29:01,169] Trial 2337 finished with value: 0.5637933296212424 and parameters: {'n_estimators': 234, 'max_depth': 20, 'min_samples_split': 7, 'min_samples_leaf': 2, 'max_features': None, 'bootstrap': True, 'criterion': 'absolute_error'}. Best is trial 1749 with value: 0.502720715661024.
[I 2024-12-04 12:29:02,460] Trial 2340 finished with value: 0.5033950497536382 and parameters: {'n_estimators': 101, 'max_depth': 19, 'min_samples_split': 5, 'min_samples_leaf': 1, 'max_features': None, 'bootstrap': True, 'criterion': 'absolute_error'}. Best is trial 1749 with value: 0.502720715661024.
[I 2024-12-04 12:29:02,461] Trial 2322 finished with value: 0.5149948281929845 and parameters: {'n_estimators': 293, 'max_depth': 18, 'min_samples_split': 5, 'min_samples_leaf': 1, 'max_features': None, 'bootstrap': True, 'criterion': 'absolute_error'}. Best is trial 1749 with value: 0.502720715661024.
[I 2024-12-04 12:29:03,112] Trial 2324 finished with value: 0.5190983110305671 and parameters: {'n_estimators': 258, 'max_depth': 17, 'min_samples_split': 3, 'min_samples_leaf': 1, 'max_features': None, 'bootstrap': True, 'criterion': 'absolute_error'}. Best is trial 1749 with value: 0.502720715661024.
[I 2024-12-04 12:29:04,065] Trial 2331 finished with value: 0.5149358133392361 and parameters: {'n_estimators': 249, 'max_depth': 13, 'min_samples_split': 4, 'min_samples_leaf': 1, 'max_features': None, 'bootstrap': True, 'criterion': 'absolute_error'}. Best is trial 1749 with value: 0.502720715661024.
[I 2024-12-04 12:29:04,844] Trial 2323 finished with value: 0.5143039611688308 and parameters: {'n_estimators': 279, 'max_depth': 18, 'min_samples_split': 6, 'min_samples_leaf': 1, 'max_features': None, 'bootstrap': True, 'criterion': 'absolute_error'}. Best is trial 1749 with value: 0.502720715661024.
[I 2024-12-04 12:29:04,850] Trial 2336 finished with value: 0.7474754850539381 and parameters: {'n_estimators': 612, 'max_depth': 43, 'min_samples_split': 6, 'min_samples_leaf': 1, 'max_features': 'log2', 'bootstrap': False, 'criterion': 'absolute_error'}. Best is trial 1749 with value: 0.502720715661024.
[I 2024-12-04 12:29:05,657] Trial 2339 finished with value: 0.5053574990952825 and parameters: {'n_estimators': 103, 'max_depth': 19, 'min_samples_split': 5, 'min_samples_leaf': 1, 'max_features': None, 'bootstrap': True, 'criterion': 'absolute_error'}. Best is trial 1749 with value: 0.502720715661024.
[I 2024-12-04 12:29:05,890] Trial 2329 finished with value: 0.5259348128096989 and parameters: {'n_estimators': 230, 'max_depth': 15, 'min_samples_split': 8, 'min_samples_leaf': 1, 'max_features': None, 'bootstrap': True, 'criterion': 'absolute_error'}. Best is trial 1749 with value: 0.502720715661024.
[I 2024-12-04 12:29:06,724] Trial 2352 finished with value: 0.54978489962545 and parameters: {'n_estimators': 107, 'max_depth': 8, 'min_samples_split': 3, 'min_samples_leaf': 2, 'max_features': None, 'bootstrap': True, 'criterion': 'squared_error'}. Best is trial 1749 with value: 0.502720715661024.
[I 2024-12-04 12:29:06,835] Trial 2347 finished with value: 0.5114057537099097 and parameters: {'n_estimators': 102, 'max_depth': 16, 'min_samples_split': 2, 'min_samples_leaf': 1, 'max_features': None, 'bootstrap': True, 'criterion': 'absolute_error'}. Best is trial 1749 with value: 0.502720715661024.
[I 2024-12-04 12:29:08,584] Trial 2343 finished with value: 0.5169277948724174 and parameters: {'n_estimators': 114, 'max_depth': 11, 'min_samples_split': 3, 'min_samples_leaf': 1, 'max_features': None, 'bootstrap': True, 'criterion': 'absolute_error'}. Best is trial 1749 with value: 0.502720715661024.
[I 2024-12-04 12:29:09,233] Trial 2348 finished with value: 0.5124129603710338 and parameters: {'n_estimators': 110, 'max_depth': 14, 'min_samples_split': 6, 'min_samples_leaf': 1, 'max_features': None, 'bootstrap': True, 'criterion': 'absolute_error'}. Best is trial 1749 with value: 0.502720715661024.
[I 2024-12-04 12:29:10,408] Trial 2342 finished with value: 0.556341795801037 and parameters: {'n_estimators': 109, 'max_depth': 20, 'min_samples_split': 6, 'min_samples_leaf': 2, 'max_features': None, 'bootstrap': True, 'criterion': 'absolute_error'}. Best is trial 1749 with value: 0.502720715661024.
[I 2024-12-04 12:29:10,991] Trial 2350 finished with value: 1.0761670911348407 and parameters: {'n_estimators': 351, 'max_depth': 9, 'min_samples_split': 5, 'min_samples_leaf': 2, 'max_features': 'sqrt', 'bootstrap': True, 'criterion': 'absolute_error'}. Best is trial 1749 with value: 0.502720715661024.
[I 2024-12-04 12:29:11,244] Trial 2325 finished with value: 0.6340267321223515 and parameters: {'n_estimators': 290, 'max_depth': 35, 'min_samples_split': 14, 'min_samples_leaf': 3, 'max_features': None, 'bootstrap': False, 'criterion': 'absolute_error'}. Best is trial 1749 with value: 0.502720715661024.
[I 2024-12-04 12:29:11,582] Trial 2355 finished with value: 1.2287492940120597 and parameters: {'n_estimators': 133, 'max_depth': 8, 'min_samples_split': 5, 'min_samples_leaf': 1, 'max_features': 'log2', 'bootstrap': False, 'criterion': 'absolute_error'}. Best is trial 1749 with value: 0.502720715661024.
[I 2024-12-04 12:29:12,821] Trial 2349 finished with value: 0.523498750177361 and parameters: {'n_estimators': 106, 'max_depth': 10, 'min_samples_split': 3, 'min_samples_leaf': 1, 'max_features': None, 'bootstrap': True, 'criterion': 'absolute_error'}. Best is trial 1749 with value: 0.502720715661024.
[I 2024-12-04 12:29:15,656] Trial 2360 finished with value: 1.3328116647397052 and parameters: {'n_estimators': 571, 'max_depth': 17, 'min_samples_split': 4, 'min_samples_leaf': 4, 'max_features': 'log2', 'bootstrap': True, 'criterion': 'absolute_error'}. Best is trial 1749 with value: 0.502720715661024.
[I 2024-12-04 12:29:15,722] Trial 2354 finished with value: 0.5143608505680224 and parameters: {'n_estimators': 103, 'max_depth': 32, 'min_samples_split': 4, 'min_samples_leaf': 1, 'max_features': None, 'bootstrap': True, 'criterion': 'absolute_error'}. Best is trial 1749 with value: 0.502720715661024.
[I 2024-12-04 12:29:20,193] Trial 2341 finished with value: 0.5182844175512836 and parameters: {'n_estimators': 254, 'max_depth': 14, 'min_samples_split': 2, 'min_samples_leaf': 1, 'max_features': None, 'bootstrap': True, 'criterion': 'absolute_error'}. Best is trial 1749 with value: 0.502720715661024.
[I 2024-12-04 12:29:21,293] Trial 2346 finished with value: 0.5211937974114454 and parameters: {'n_estimators': 266, 'max_depth': 20, 'min_samples_split': 3, 'min_samples_leaf': 1, 'max_features': None, 'bootstrap': True, 'criterion': 'absolute_error'}. Best is trial 1749 with value: 0.502720715661024.
[I 2024-12-04 12:29:21,590] Trial 2328 finished with value: 0.5665982392332396 and parameters: {'n_estimators': 338, 'max_depth': 19, 'min_samples_split': 2, 'min_samples_leaf': 1, 'max_features': None, 'bootstrap': False, 'criterion': 'absolute_error'}. Best is trial 1749 with value: 0.502720715661024.
[I 2024-12-04 12:29:21,646] Trial 2359 finished with value: 0.5199724277596348 and parameters: {'n_estimators': 108, 'max_depth': 18, 'min_samples_split': 7, 'min_samples_leaf': 1, 'max_features': None, 'bootstrap': True, 'criterion': 'absolute_error'}. Best is trial 1749 with value: 0.502720715661024.
[I 2024-12-04 12:29:24,423] Trial 2361 finished with value: 0.5173589140917706 and parameters: {'n_estimators': 108, 'max_depth': 26, 'min_samples_split': 6, 'min_samples_leaf': 1, 'max_features': None, 'bootstrap': True, 'criterion': 'absolute_error'}. Best is trial 1749 with value: 0.502720715661024.
[I 2024-12-04 12:29:25,428] Trial 2365 finished with value: 0.5252719925144412 and parameters: {'n_estimators': 315, 'max_depth': 15, 'min_samples_split': 7, 'min_samples_leaf': 1, 'max_features': None, 'bootstrap': True, 'criterion': 'squared_error'}. Best is trial 1749 with value: 0.502720715661024.
[I 2024-12-04 12:29:25,458] Trial 2367 finished with value: 0.5567681172498044 and parameters: {'n_estimators': 102, 'max_depth': 28, 'min_samples_split': 5, 'min_samples_leaf': 2, 'max_features': None, 'bootstrap': True, 'criterion': 'squared_error'}. Best is trial 1749 with value: 0.502720715661024.
[I 2024-12-04 12:29:25,861] Trial 2358 finished with value: 0.5237361794640523 and parameters: {'n_estimators': 140, 'max_depth': 21, 'min_samples_split': 8, 'min_samples_leaf': 1, 'max_features': None, 'bootstrap': True, 'criterion': 'absolute_error'}. Best is trial 1749 with value: 0.502720715661024.
[I 2024-12-04 12:29:27,467] Trial 2357 finished with value: 0.5255907863579737 and parameters: {'n_estimators': 205, 'max_depth': 19, 'min_samples_split': 13, 'min_samples_leaf': 1, 'max_features': None, 'bootstrap': True, 'criterion': 'absolute_error'}. Best is trial 1749 with value: 0.502720715661024.
[I 2024-12-04 12:29:30,051] Trial 2362 finished with value: 0.5136601739557172 and parameters: {'n_estimators': 107, 'max_depth': 15, 'min_samples_split': 4, 'min_samples_leaf': 1, 'max_features': None, 'bootstrap': True, 'criterion': 'absolute_error'}. Best is trial 1749 with value: 0.502720715661024.
[I 2024-12-04 12:29:32,381] Trial 2351 finished with value: 0.8617688870479634 and parameters: {'n_estimators': 663, 'max_depth': 36, 'min_samples_split': 49, 'min_samples_leaf': 13, 'max_features': None, 'bootstrap': False, 'criterion': 'absolute_error'}. Best is trial 1749 with value: 0.502720715661024.
[I 2024-12-04 12:29:32,382] Trial 2344 finished with value: 0.5265829782733586 and parameters: {'n_estimators': 267, 'max_depth': 35, 'min_samples_split': 3, 'min_samples_leaf': 1, 'max_features': None, 'bootstrap': True, 'criterion': 'absolute_error'}. Best is trial 1749 with value: 0.502720715661024.
[I 2024-12-04 12:29:32,710] Trial 2366 finished with value: 0.5577050237796531 and parameters: {'n_estimators': 102, 'max_depth': 24, 'min_samples_split': 17, 'min_samples_leaf': 2, 'max_features': None, 'bootstrap': True, 'criterion': 'absolute_error'}. Best is trial 1749 with value: 0.502720715661024.
[I 2024-12-04 12:29:33,703] Trial 2356 finished with value: 0.5272625206889513 and parameters: {'n_estimators': 205, 'max_depth': 24, 'min_samples_split': 9, 'min_samples_leaf': 1, 'max_features': None, 'bootstrap': True, 'criterion': 'absolute_error'}. Best is trial 1749 with value: 0.502720715661024.
[I 2024-12-04 12:29:34,159] Trial 2353 finished with value: 0.5198072797633857 and parameters: {'n_estimators': 265, 'max_depth': 26, 'min_samples_split': 5, 'min_samples_leaf': 1, 'max_features': None, 'bootstrap': True, 'criterion': 'absolute_error'}. Best is trial 1749 with value: 0.502720715661024.
[I 2024-12-04 12:29:34,160] Trial 2372 finished with value: 0.5539159498775844 and parameters: {'n_estimators': 100, 'max_depth': 23, 'min_samples_split': 6, 'min_samples_leaf': 2, 'max_features': None, 'bootstrap': True, 'criterion': 'absolute_error'}. Best is trial 1749 with value: 0.502720715661024.
[I 2024-12-04 12:29:35,780] Trial 2369 finished with value: 0.530293651895525 and parameters: {'n_estimators': 106, 'max_depth': 27, 'min_samples_split': 10, 'min_samples_leaf': 1, 'max_features': None, 'bootstrap': True, 'criterion': 'absolute_error'}. Best is trial 1749 with value: 0.502720715661024.
[I 2024-12-04 12:29:37,271] Trial 2381 finished with value: 1.0544180755520849 and parameters: {'n_estimators': 126, 'max_depth': 14, 'min_samples_split': 5, 'min_samples_leaf': 2, 'max_features': 'sqrt', 'bootstrap': True, 'criterion': 'absolute_error'}. Best is trial 1749 with value: 0.502720715661024.
[I 2024-12-04 12:29:37,865] Trial 2373 finished with value: 0.8084491169613974 and parameters: {'n_estimators': 209, 'max_depth': 45, 'min_samples_split': 20, 'min_samples_leaf': 12, 'max_features': None, 'bootstrap': True, 'criterion': 'squared_error'}. Best is trial 1749 with value: 0.502720715661024.
[I 2024-12-04 12:29:38,476] Trial 2363 finished with value: 0.5252038428909236 and parameters: {'n_estimators': 229, 'max_depth': 17, 'min_samples_split': 9, 'min_samples_leaf': 1, 'max_features': None, 'bootstrap': True, 'criterion': 'absolute_error'}. Best is trial 1749 with value: 0.502720715661024.
[I 2024-12-04 12:29:39,260] Trial 2368 finished with value: 0.5264594416538768 and parameters: {'n_estimators': 115, 'max_depth': 18, 'min_samples_split': 10, 'min_samples_leaf': 1, 'max_features': None, 'bootstrap': True, 'criterion': 'absolute_error'}. Best is trial 1749 with value: 0.502720715661024.
[I 2024-12-04 12:29:40,996] Trial 2378 finished with value: 0.5276853287902297 and parameters: {'n_estimators': 109, 'max_depth': 19, 'min_samples_split': 10, 'min_samples_leaf': 1, 'max_features': None, 'bootstrap': True, 'criterion': 'absolute_error'}. Best is trial 1749 with value: 0.502720715661024.
[I 2024-12-04 12:29:41,314] Trial 2364 finished with value: 0.5265236192869074 and parameters: {'n_estimators': 244, 'max_depth': 20, 'min_samples_split': 7, 'min_samples_leaf': 1, 'max_features': None, 'bootstrap': True, 'criterion': 'absolute_error'}. Best is trial 1749 with value: 0.502720715661024.
[I 2024-12-04 12:29:42,768] Trial 2388 finished with value: 1.2926119089801273 and parameters: {'n_estimators': 105, 'max_depth': 21, 'min_samples_split': 3, 'min_samples_leaf': 2, 'max_features': 'log2', 'bootstrap': True, 'criterion': 'absolute_error'}. Best is trial 1749 with value: 0.502720715661024.
[I 2024-12-04 12:29:42,768] Trial 2374 finished with value: 0.5136601739557172 and parameters: {'n_estimators': 107, 'max_depth': 15, 'min_samples_split': 4, 'min_samples_leaf': 1, 'max_features': None, 'bootstrap': True, 'criterion': 'absolute_error'}. Best is trial 1749 with value: 0.502720715661024.
[I 2024-12-04 12:29:44,002] Trial 2376 finished with value: 0.5601321614958026 and parameters: {'n_estimators': 190, 'max_depth': 27, 'min_samples_split': 9, 'min_samples_leaf': 2, 'max_features': None, 'bootstrap': True, 'criterion': 'absolute_error'}. Best is trial 1749 with value: 0.502720715661024.
