[I 2024-12-04 12:03:20,091] Trial 648 finished with value: 0.29928962453007085 and parameters: {'n_estimators': 204, 'max_depth': 45, 'min_samples_split': 3, 'min_samples_leaf': 1, 'max_features': 'sqrt', 'bootstrap': False, 'criterion': 'squared_error'}. Best is trial 341 with value: 0.2909369124469028.
[I 2024-12-04 12:03:20,555] Trial 642 finished with value: 0.8531588341118552 and parameters: {'n_estimators': 744, 'max_depth': 6, 'min_samples_split': 2, 'min_samples_leaf': 1, 'max_features': 'log2', 'bootstrap': True, 'criterion': 'squared_error'}. Best is trial 341 with value: 0.2909369124469028.
[I 2024-12-04 12:03:20,834] Trial 654 finished with value: 0.4461676105153217 and parameters: {'n_estimators': 231, 'max_depth': 41, 'min_samples_split': 3, 'min_samples_leaf': 2, 'max_features': 'sqrt', 'bootstrap': False, 'criterion': 'squared_error'}. Best is trial 341 with value: 0.2909369124469028.
[I 2024-12-04 12:03:20,913] Trial 657 finished with value: 0.2953293888728031 and parameters: {'n_estimators': 232, 'max_depth': 50, 'min_samples_split': 3, 'min_samples_leaf': 1, 'max_features': 'sqrt', 'bootstrap': False, 'criterion': 'squared_error'}. Best is trial 341 with value: 0.2909369124469028.
[I 2024-12-04 12:03:23,150] Trial 659 finished with value: 0.404300043110862 and parameters: {'n_estimators': 383, 'max_depth': 25, 'min_samples_split': 5, 'min_samples_leaf': 1, 'max_features': 'sqrt', 'bootstrap': False, 'criterion': 'squared_error'}. Best is trial 341 with value: 0.2909369124469028.
[I 2024-12-04 12:03:23,392] Trial 649 finished with value: 0.31824898011396036 and parameters: {'n_estimators': 371, 'max_depth': 46, 'min_samples_split': 7, 'min_samples_leaf': 1, 'max_features': 'sqrt', 'bootstrap': False, 'criterion': 'squared_error'}. Best is trial 341 with value: 0.2909369124469028.
[I 2024-12-04 12:03:23,975] Trial 655 finished with value: 0.3149159590314086 and parameters: {'n_estimators': 375, 'max_depth': 43, 'min_samples_split': 5, 'min_samples_leaf': 1, 'max_features': 'sqrt', 'bootstrap': False, 'criterion': 'squared_error'}. Best is trial 341 with value: 0.2909369124469028.
[I 2024-12-04 12:03:24,589] Trial 656 finished with value: 0.4424784154593861 and parameters: {'n_estimators': 221, 'max_depth': 50, 'min_samples_split': 3, 'min_samples_leaf': 2, 'max_features': 'sqrt', 'bootstrap': False, 'criterion': 'squared_error'}. Best is trial 341 with value: 0.2909369124469028.
[I 2024-12-04 12:03:25,094] Trial 658 finished with value: 0.9508400757528636 and parameters: {'n_estimators': 457, 'max_depth': 8, 'min_samples_split': 27, 'min_samples_leaf': 11, 'max_features': 'log2', 'bootstrap': False, 'criterion': 'squared_error'}. Best is trial 341 with value: 0.2909369124469028.
[I 2024-12-04 12:03:25,586] Trial 661 finished with value: 0.29985838091086137 and parameters: {'n_estimators': 269, 'max_depth': 50, 'min_samples_split': 2, 'min_samples_leaf': 1, 'max_features': 'sqrt', 'bootstrap': False, 'criterion': 'squared_error'}. Best is trial 341 with value: 0.2909369124469028.
[I 2024-12-04 12:03:26,778] Trial 663 finished with value: 0.30632456987005985 and parameters: {'n_estimators': 146, 'max_depth': 44, 'min_samples_split': 4, 'min_samples_leaf': 1, 'max_features': 'sqrt', 'bootstrap': False, 'criterion': 'squared_error'}. Best is trial 341 with value: 0.2909369124469028.
[I 2024-12-04 12:03:26,988] Trial 666 finished with value: 0.32154888704028495 and parameters: {'n_estimators': 126, 'max_depth': 50, 'min_samples_split': 4, 'min_samples_leaf': 1, 'max_features': 'sqrt', 'bootstrap': True, 'criterion': 'squared_error'}. Best is trial 341 with value: 0.2909369124469028.
[I 2024-12-04 12:03:27,405] Trial 665 finished with value: 0.3027434443961006 and parameters: {'n_estimators': 261, 'max_depth': 41, 'min_samples_split': 3, 'min_samples_leaf': 1, 'max_features': 'sqrt', 'bootstrap': False, 'criterion': 'squared_error'}. Best is trial 341 with value: 0.2909369124469028.
[I 2024-12-04 12:03:28,673] Trial 660 finished with value: 0.8740810666871033 and parameters: {'n_estimators': 906, 'max_depth': 18, 'min_samples_split': 7, 'min_samples_leaf': 11, 'max_features': 'sqrt', 'bootstrap': True, 'criterion': 'squared_error'}. Best is trial 341 with value: 0.2909369124469028.
[I 2024-12-04 12:03:29,908] Trial 668 finished with value: 0.44682865661935556 and parameters: {'n_estimators': 141, 'max_depth': 50, 'min_samples_split': 3, 'min_samples_leaf': 2, 'max_features': 'sqrt', 'bootstrap': False, 'criterion': 'squared_error'}. Best is trial 341 with value: 0.2909369124469028.
[I 2024-12-04 12:03:30,476] Trial 667 finished with value: 0.3031679408499221 and parameters: {'n_estimators': 264, 'max_depth': 42, 'min_samples_split': 3, 'min_samples_leaf': 1, 'max_features': 'sqrt', 'bootstrap': False, 'criterion': 'squared_error'}. Best is trial 341 with value: 0.2909369124469028.
[I 2024-12-04 12:03:30,890] Trial 669 finished with value: 0.30879625593712623 and parameters: {'n_estimators': 236, 'max_depth': 50, 'min_samples_split': 6, 'min_samples_leaf': 1, 'max_features': 'sqrt', 'bootstrap': False, 'criterion': 'squared_error'}. Best is trial 341 with value: 0.2909369124469028.
[I 2024-12-04 12:03:32,438] Trial 645 finished with value: 0.4316068231656519 and parameters: {'n_estimators': 118, 'max_depth': 43, 'min_samples_split': 2, 'min_samples_leaf': 3, 'max_features': None, 'bootstrap': False, 'criterion': 'absolute_error'}. Best is trial 341 with value: 0.2909369124469028.
[I 2024-12-04 12:03:32,973] Trial 662 finished with value: 0.3061119698045225 and parameters: {'n_estimators': 257, 'max_depth': 43, 'min_samples_split': 4, 'min_samples_leaf': 1, 'max_features': 'sqrt', 'bootstrap': False, 'criterion': 'squared_error'}. Best is trial 341 with value: 0.2909369124469028.
[I 2024-12-04 12:03:33,136] Trial 673 finished with value: 0.2943268263221781 and parameters: {'n_estimators': 296, 'max_depth': 50, 'min_samples_split': 3, 'min_samples_leaf': 1, 'max_features': 'sqrt', 'bootstrap': False, 'criterion': 'squared_error'}. Best is trial 341 with value: 0.2909369124469028.
[I 2024-12-04 12:03:33,140] Trial 682 finished with value: 0.30494818304643023 and parameters: {'n_estimators': 104, 'max_depth': 49, 'min_samples_split': 4, 'min_samples_leaf': 1, 'max_features': 'sqrt', 'bootstrap': False, 'criterion': 'squared_error'}. Best is trial 341 with value: 0.2909369124469028.
[I 2024-12-04 12:03:33,210] Trial 680 finished with value: 0.2951737504209516 and parameters: {'n_estimators': 107, 'max_depth': 48, 'min_samples_split': 3, 'min_samples_leaf': 1, 'max_features': 'sqrt', 'bootstrap': False, 'criterion': 'squared_error'}. Best is trial 341 with value: 0.2909369124469028.
[I 2024-12-04 12:03:33,749] Trial 672 finished with value: 0.3046553683542191 and parameters: {'n_estimators': 273, 'max_depth': 50, 'min_samples_split': 5, 'min_samples_leaf': 1, 'max_features': 'sqrt', 'bootstrap': False, 'criterion': 'squared_error'}. Best is trial 341 with value: 0.2909369124469028.
[I 2024-12-04 12:03:34,693] Trial 679 finished with value: 0.4399657719802959 and parameters: {'n_estimators': 352, 'max_depth': 50, 'min_samples_split': 9, 'min_samples_leaf': 2, 'max_features': 'sqrt', 'bootstrap': False, 'criterion': 'squared_error'}. Best is trial 341 with value: 0.2909369124469028.
[I 2024-12-04 12:03:34,773] Trial 643 finished with value: 0.5494421610790158 and parameters: {'n_estimators': 904, 'max_depth': 39, 'min_samples_split': 2, 'min_samples_leaf': 13, 'max_features': None, 'bootstrap': True, 'criterion': 'absolute_error'}. Best is trial 341 with value: 0.2909369124469028.
[I 2024-12-04 12:03:35,149] Trial 671 finished with value: 0.2965346798911387 and parameters: {'n_estimators': 114, 'max_depth': 48, 'min_samples_split': 3, 'min_samples_leaf': 1, 'max_features': 'sqrt', 'bootstrap': False, 'criterion': 'squared_error'}. Best is trial 341 with value: 0.2909369124469028.
[I 2024-12-04 12:03:36,203] Trial 676 finished with value: 0.7563700015882724 and parameters: {'n_estimators': 957, 'max_depth': 6, 'min_samples_split': 6, 'min_samples_leaf': 1, 'max_features': 'sqrt', 'bootstrap': True, 'criterion': 'squared_error'}. Best is trial 341 with value: 0.2909369124469028.
[I 2024-12-04 12:03:36,526] Trial 681 finished with value: 0.29782576411052364 and parameters: {'n_estimators': 314, 'max_depth': 50, 'min_samples_split': 2, 'min_samples_leaf': 1, 'max_features': 'sqrt', 'bootstrap': False, 'criterion': 'squared_error'}. Best is trial 341 with value: 0.2909369124469028.
[I 2024-12-04 12:03:36,845] Trial 677 finished with value: 0.30077988546104006 and parameters: {'n_estimators': 241, 'max_depth': 50, 'min_samples_split': 4, 'min_samples_leaf': 1, 'max_features': 'sqrt', 'bootstrap': False, 'criterion': 'squared_error'}. Best is trial 341 with value: 0.2909369124469028.
[I 2024-12-04 12:03:38,260] Trial 685 finished with value: 0.44384523556753247 and parameters: {'n_estimators': 340, 'max_depth': 44, 'min_samples_split': 4, 'min_samples_leaf': 2, 'max_features': 'sqrt', 'bootstrap': False, 'criterion': 'squared_error'}. Best is trial 341 with value: 0.2909369124469028.
[I 2024-12-04 12:03:38,692] Trial 688 finished with value: 0.824712604144241 and parameters: {'n_estimators': 429, 'max_depth': 29, 'min_samples_split': 37, 'min_samples_leaf': 12, 'max_features': 'sqrt', 'bootstrap': False, 'criterion': 'squared_error'}. Best is trial 341 with value: 0.2909369124469028.
[I 2024-12-04 12:03:39,027] Trial 624 finished with value: 0.43914413356951904 and parameters: {'n_estimators': 158, 'max_depth': 37, 'min_samples_split': 25, 'min_samples_leaf': 1, 'max_features': None, 'bootstrap': False, 'criterion': 'absolute_error'}. Best is trial 341 with value: 0.2909369124469028.
[I 2024-12-04 12:03:39,050] Trial 678 finished with value: 0.38110035647492707 and parameters: {'n_estimators': 402, 'max_depth': 43, 'min_samples_split': 3, 'min_samples_leaf': 1, 'max_features': None, 'bootstrap': False, 'criterion': 'squared_error'}. Best is trial 341 with value: 0.2909369124469028.
[I 2024-12-04 12:03:39,992] Trial 683 finished with value: 0.3058226894416763 and parameters: {'n_estimators': 413, 'max_depth': 41, 'min_samples_split': 3, 'min_samples_leaf': 1, 'max_features': 'sqrt', 'bootstrap': False, 'criterion': 'squared_error'}. Best is trial 341 with value: 0.2909369124469028.
[I 2024-12-04 12:03:40,814] Trial 674 finished with value: 0.3031679408499221 and parameters: {'n_estimators': 264, 'max_depth': 42, 'min_samples_split': 3, 'min_samples_leaf': 1, 'max_features': 'sqrt', 'bootstrap': False, 'criterion': 'squared_error'}. Best is trial 341 with value: 0.2909369124469028.
[I 2024-12-04 12:03:43,311] Trial 694 finished with value: 0.4420110361811167 and parameters: {'n_estimators': 317, 'max_depth': 49, 'min_samples_split': 3, 'min_samples_leaf': 2, 'max_features': 'sqrt', 'bootstrap': False, 'criterion': 'squared_error'}. Best is trial 341 with value: 0.2909369124469028.
[I 2024-12-04 12:03:43,314] Trial 686 finished with value: 0.3056356735742646 and parameters: {'n_estimators': 276, 'max_depth': 43, 'min_samples_split': 2, 'min_samples_leaf': 1, 'max_features': 'sqrt', 'bootstrap': False, 'criterion': 'squared_error'}. Best is trial 341 with value: 0.2909369124469028.
[I 2024-12-04 12:03:46,662] Trial 698 finished with value: 0.2939514996353892 and parameters: {'n_estimators': 191, 'max_depth': 50, 'min_samples_split': 3, 'min_samples_leaf': 1, 'max_features': 'sqrt', 'bootstrap': False, 'criterion': 'squared_error'}. Best is trial 341 with value: 0.2909369124469028.
[I 2024-12-04 12:03:48,350] Trial 692 finished with value: 0.3318007720005457 and parameters: {'n_estimators': 101, 'max_depth': 43, 'min_samples_split': 5, 'min_samples_leaf': 1, 'max_features': 'sqrt', 'bootstrap': False, 'criterion': 'absolute_error'}. Best is trial 341 with value: 0.2909369124469028.
[I 2024-12-04 12:03:49,266] Trial 702 finished with value: 0.44586641463565996 and parameters: {'n_estimators': 150, 'max_depth': 50, 'min_samples_split': 2, 'min_samples_leaf': 2, 'max_features': 'sqrt', 'bootstrap': False, 'criterion': 'squared_error'}. Best is trial 341 with value: 0.2909369124469028.
[I 2024-12-04 12:03:49,627] Trial 699 finished with value: 0.7613582501463232 and parameters: {'n_estimators': 242, 'max_depth': 16, 'min_samples_split': 5, 'min_samples_leaf': 2, 'max_features': 'log2', 'bootstrap': False, 'criterion': 'squared_error'}. Best is trial 341 with value: 0.2909369124469028.
[I 2024-12-04 12:03:54,405] Trial 696 finished with value: 0.4411948897372366 and parameters: {'n_estimators': 763, 'max_depth': 49, 'min_samples_split': 5, 'min_samples_leaf': 2, 'max_features': 'sqrt', 'bootstrap': False, 'criterion': 'squared_error'}. Best is trial 341 with value: 0.2909369124469028.
[I 2024-12-04 12:03:54,531] Trial 695 finished with value: 0.8824314119948379 and parameters: {'n_estimators': 253, 'max_depth': 49, 'min_samples_split': 32, 'min_samples_leaf': 11, 'max_features': 'sqrt', 'bootstrap': True, 'criterion': 'squared_error'}. Best is trial 341 with value: 0.2909369124469028.
[I 2024-12-04 12:03:55,181] Trial 701 finished with value: 0.8962268107596382 and parameters: {'n_estimators': 298, 'max_depth': 46, 'min_samples_split': 13, 'min_samples_leaf': 5, 'max_features': 'log2', 'bootstrap': False, 'criterion': 'absolute_error'}. Best is trial 341 with value: 0.2909369124469028.
[I 2024-12-04 12:03:55,208] Trial 689 finished with value: 0.44694373911709057 and parameters: {'n_estimators': 552, 'max_depth': 23, 'min_samples_split': 10, 'min_samples_leaf': 7, 'max_features': None, 'bootstrap': False, 'criterion': 'squared_error'}. Best is trial 341 with value: 0.2909369124469028.
[I 2024-12-04 12:03:56,020] Trial 697 finished with value: 0.29877976834627146 and parameters: {'n_estimators': 286, 'max_depth': 50, 'min_samples_split': 2, 'min_samples_leaf': 1, 'max_features': 'sqrt', 'bootstrap': False, 'criterion': 'squared_error'}. Best is trial 341 with value: 0.2909369124469028.
[I 2024-12-04 12:03:56,038] Trial 703 finished with value: 0.3013459277829649 and parameters: {'n_estimators': 219, 'max_depth': 44, 'min_samples_split': 3, 'min_samples_leaf': 1, 'max_features': 'sqrt', 'bootstrap': False, 'criterion': 'squared_error'}. Best is trial 341 with value: 0.2909369124469028.
[I 2024-12-04 12:03:56,678] Trial 620 finished with value: 0.46234593413371966 and parameters: {'n_estimators': 425, 'max_depth': 13, 'min_samples_split': 2, 'min_samples_leaf': 3, 'max_features': None, 'bootstrap': False, 'criterion': 'absolute_error'}. Best is trial 341 with value: 0.2909369124469028.
[I 2024-12-04 12:03:56,903] Trial 675 finished with value: 0.37966818347229025 and parameters: {'n_estimators': 794, 'max_depth': 35, 'min_samples_split': 3, 'min_samples_leaf': 1, 'max_features': None, 'bootstrap': False, 'criterion': 'squared_error'}. Best is trial 341 with value: 0.2909369124469028.
[I 2024-12-04 12:03:57,496] Trial 705 finished with value: 0.9410396036373001 and parameters: {'n_estimators': 357, 'max_depth': 7, 'min_samples_split': 4, 'min_samples_leaf': 6, 'max_features': 'log2', 'bootstrap': True, 'criterion': 'squared_error'}. Best is trial 341 with value: 0.2909369124469028.
[I 2024-12-04 12:03:57,537] Trial 706 finished with value: 0.29205513510170683 and parameters: {'n_estimators': 248, 'max_depth': 48, 'min_samples_split': 3, 'min_samples_leaf': 1, 'max_features': 'sqrt', 'bootstrap': False, 'criterion': 'squared_error'}. Best is trial 341 with value: 0.2909369124469028.
[I 2024-12-04 12:03:58,113] Trial 693 finished with value: 0.3486416243048943 and parameters: {'n_estimators': 956, 'max_depth': 48, 'min_samples_split': 8, 'min_samples_leaf': 1, 'max_features': 'sqrt', 'bootstrap': True, 'criterion': 'squared_error'}. Best is trial 341 with value: 0.2909369124469028.
[I 2024-12-04 12:03:58,363] Trial 709 finished with value: 0.29414276867088485 and parameters: {'n_estimators': 188, 'max_depth': 50, 'min_samples_split': 3, 'min_samples_leaf': 1, 'max_features': 'sqrt', 'bootstrap': False, 'criterion': 'squared_error'}. Best is trial 341 with value: 0.2909369124469028.
[I 2024-12-04 12:03:59,067] Trial 710 finished with value: 0.2989902487449881 and parameters: {'n_estimators': 223, 'max_depth': 50, 'min_samples_split': 2, 'min_samples_leaf': 1, 'max_features': 'sqrt', 'bootstrap': False, 'criterion': 'squared_error'}. Best is trial 341 with value: 0.2909369124469028.
[I 2024-12-04 12:04:00,320] Trial 708 finished with value: 0.2949050305342347 and parameters: {'n_estimators': 274, 'max_depth': 50, 'min_samples_split': 3, 'min_samples_leaf': 1, 'max_features': 'sqrt', 'bootstrap': False, 'criterion': 'squared_error'}. Best is trial 341 with value: 0.2909369124469028.
[I 2024-12-04 12:04:00,454] Trial 700 finished with value: 0.3173135411335561 and parameters: {'n_estimators': 201, 'max_depth': 41, 'min_samples_split': 5, 'min_samples_leaf': 1, 'max_features': 'sqrt', 'bootstrap': False, 'criterion': 'squared_error'}. Best is trial 341 with value: 0.2909369124469028.
[I 2024-12-04 12:04:00,785] Trial 691 finished with value: 0.863291941935353 and parameters: {'n_estimators': 728, 'max_depth': 8, 'min_samples_split': 42, 'min_samples_leaf': 3, 'max_features': 'log2', 'bootstrap': False, 'criterion': 'absolute_error'}. Best is trial 341 with value: 0.2909369124469028.
[I 2024-12-04 12:04:00,978] Trial 711 finished with value: 0.3044001939275806 and parameters: {'n_estimators': 335, 'max_depth': 50, 'min_samples_split': 5, 'min_samples_leaf': 1, 'max_features': 'sqrt', 'bootstrap': False, 'criterion': 'squared_error'}. Best is trial 341 with value: 0.2909369124469028.
[I 2024-12-04 12:04:01,247] Trial 712 finished with value: 0.30402054329021094 and parameters: {'n_estimators': 411, 'max_depth': 50, 'min_samples_split': 5, 'min_samples_leaf': 1, 'max_features': 'sqrt', 'bootstrap': False, 'criterion': 'squared_error'}. Best is trial 341 with value: 0.2909369124469028.
[I 2024-12-04 12:04:01,885] Trial 714 finished with value: 0.44546316926954166 and parameters: {'n_estimators': 106, 'max_depth': 45, 'min_samples_split': 5, 'min_samples_leaf': 2, 'max_features': 'sqrt', 'bootstrap': False, 'criterion': 'squared_error'}. Best is trial 341 with value: 0.2909369124469028.
[I 2024-12-04 12:04:03,654] Trial 717 finished with value: 0.44235372003879775 and parameters: {'n_estimators': 110, 'max_depth': 50, 'min_samples_split': 5, 'min_samples_leaf': 2, 'max_features': 'sqrt', 'bootstrap': False, 'criterion': 'squared_error'}. Best is trial 341 with value: 0.2909369124469028.
[I 2024-12-04 12:04:04,073] Trial 718 finished with value: 0.44749030119409144 and parameters: {'n_estimators': 196, 'max_depth': 41, 'min_samples_split': 2, 'min_samples_leaf': 2, 'max_features': 'sqrt', 'bootstrap': False, 'criterion': 'squared_error'}. Best is trial 341 with value: 0.2909369124469028.
[I 2024-12-04 12:04:04,204] Trial 716 finished with value: 0.9548944896008962 and parameters: {'n_estimators': 443, 'max_depth': 31, 'min_samples_split': 4, 'min_samples_leaf': 9, 'max_features': 'log2', 'bootstrap': True, 'criterion': 'absolute_error'}. Best is trial 341 with value: 0.2909369124469028.
[I 2024-12-04 12:04:05,989] Trial 715 finished with value: 0.3131456659899236 and parameters: {'n_estimators': 212, 'max_depth': 40, 'min_samples_split': 4, 'min_samples_leaf': 1, 'max_features': 'sqrt', 'bootstrap': False, 'criterion': 'squared_error'}. Best is trial 341 with value: 0.2909369124469028.
[I 2024-12-04 12:04:06,343] Trial 722 finished with value: 0.29806861847104765 and parameters: {'n_estimators': 171, 'max_depth': 42, 'min_samples_split': 3, 'min_samples_leaf': 1, 'max_features': 'sqrt', 'bootstrap': False, 'criterion': 'squared_error'}. Best is trial 341 with value: 0.2909369124469028.
[I 2024-12-04 12:04:06,344] Trial 723 finished with value: 0.2977260344513477 and parameters: {'n_estimators': 116, 'max_depth': 49, 'min_samples_split': 2, 'min_samples_leaf': 1, 'max_features': 'sqrt', 'bootstrap': False, 'criterion': 'squared_error'}. Best is trial 341 with value: 0.2909369124469028.
[I 2024-12-04 12:04:06,390] Trial 690 finished with value: 0.5182059338856544 and parameters: {'n_estimators': 153, 'max_depth': 6, 'min_samples_split': 11, 'min_samples_leaf': 1, 'max_features': None, 'bootstrap': False, 'criterion': 'absolute_error'}. Best is trial 341 with value: 0.2909369124469028.
[I 2024-12-04 12:04:06,674] Trial 707 finished with value: 0.8735786102677243 and parameters: {'n_estimators': 851, 'max_depth': 29, 'min_samples_split': 6, 'min_samples_leaf': 3, 'max_features': 'log2', 'bootstrap': True, 'criterion': 'absolute_error'}. Best is trial 341 with value: 0.2909369124469028.
[I 2024-12-04 12:04:07,652] Trial 664 finished with value: 0.39971357290273263 and parameters: {'n_estimators': 945, 'max_depth': 28, 'min_samples_split': 8, 'min_samples_leaf': 1, 'max_features': 'sqrt', 'bootstrap': False, 'criterion': 'absolute_error'}. Best is trial 341 with value: 0.2909369124469028.
[I 2024-12-04 12:04:09,355] Trial 719 finished with value: 0.3458875917268861 and parameters: {'n_estimators': 347, 'max_depth': 40, 'min_samples_split': 5, 'min_samples_leaf': 1, 'max_features': 'sqrt', 'bootstrap': True, 'criterion': 'squared_error'}. Best is trial 341 with value: 0.2909369124469028.
[I 2024-12-04 12:04:09,489] Trial 713 finished with value: 0.7867707460478052 and parameters: {'n_estimators': 775, 'max_depth': 43, 'min_samples_split': 10, 'min_samples_leaf': 2, 'max_features': 'log2', 'bootstrap': True, 'criterion': 'squared_error'}. Best is trial 341 with value: 0.2909369124469028.
[I 2024-12-04 12:04:09,911] Trial 727 finished with value: 0.3117498365360958 and parameters: {'n_estimators': 765, 'max_depth': 46, 'min_samples_split': 5, 'min_samples_leaf': 1, 'max_features': 'sqrt', 'bootstrap': False, 'criterion': 'squared_error'}. Best is trial 341 with value: 0.2909369124469028.
