[I 2024-12-03 19:01:49,199] Trial 1570 finished with value: 0.38757485605442843 and parameters: {'kernel': 'rbf', 'C': 95.52879655859786, 'gamma': 0.0868555193275937, 'epsilon': 0.107882536493625}. Best is trial 88 with value: 0.3542875001421725.
[I 2024-12-03 19:01:50,496] Trial 1571 finished with value: 0.35585632391118965 and parameters: {'kernel': 'rbf', 'C': 97.09385844015492, 'gamma': 0.045409054966748436, 'epsilon': 0.17482550275504782}. Best is trial 88 with value: 0.3542875001421725.
[I 2024-12-03 19:01:51,904] Trial 1572 finished with value: 4.772882604814808 and parameters: {'kernel': 'sigmoid', 'C': 2.612237761518946, 'gamma': 0.001842781687518493, 'epsilon': 0.005835242213899422}. Best is trial 88 with value: 0.3542875001421725.
[I 2024-12-03 19:01:53,258] Trial 1573 finished with value: 0.42478051353723423 and parameters: {'kernel': 'rbf', 'C': 16.552008670285694, 'gamma': 0.10672860980663279, 'epsilon': 0.10867295255651094}. Best is trial 88 with value: 0.3542875001421725.
[I 2024-12-03 19:01:53,770] Trial 1557 finished with value: 0.7970417013175244 and parameters: {'kernel': 'linear', 'C': 58.720415172577056, 'gamma': 0.007307078722391556, 'epsilon': 0.013966566754567873}. Best is trial 88 with value: 0.3542875001421725.
[I 2024-12-03 19:01:54,847] Trial 1574 finished with value: 0.4720621396753407 and parameters: {'kernel': 'rbf', 'C': 19.380666717207852, 'gamma': 0.16040736722142, 'epsilon': 0.04359319622429969}. Best is trial 88 with value: 0.3542875001421725.
[I 2024-12-03 19:01:55,579] Trial 1575 finished with value: 0.420612579182402 and parameters: {'kernel': 'rbf', 'C': 18.738122901364086, 'gamma': 0.02746355278056565, 'epsilon': 0.09432484378601577}. Best is trial 88 with value: 0.3542875001421725.
[I 2024-12-03 19:01:56,140] Trial 1576 finished with value: 0.4973863204844773 and parameters: {'kernel': 'rbf', 'C': 4.993424685276038, 'gamma': 0.12319979952857858, 'epsilon': 0.20493232907337242}. Best is trial 88 with value: 0.3542875001421725.
[I 2024-12-03 19:01:57,237] Trial 1577 finished with value: 0.38577756978614425 and parameters: {'kernel': 'rbf', 'C': 26.580434916795628, 'gamma': 0.05755582296668051, 'epsilon': 0.1489493954853296}. Best is trial 88 with value: 0.3542875001421725.
[I 2024-12-03 19:01:58,277] Trial 1578 finished with value: 0.42780928304647503 and parameters: {'kernel': 'rbf', 'C': 30.407835922103335, 'gamma': 0.015065647801481343, 'epsilon': 0.055327556884757184}. Best is trial 88 with value: 0.3542875001421725.
[I 2024-12-03 19:01:59,163] Trial 1579 finished with value: 0.35951214126976877 and parameters: {'kernel': 'rbf', 'C': 90.83829449606326, 'gamma': 0.03860245180291645, 'epsilon': 0.1452998960733823}. Best is trial 88 with value: 0.3542875001421725.
[I 2024-12-03 19:02:00,081] Trial 1580 finished with value: 0.4988367427197314 and parameters: {'kernel': 'rbf', 'C': 2.7935297132128656, 'gamma': 0.00727848166990219, 'epsilon': 0.10675702648309977}. Best is trial 88 with value: 0.3542875001421725.
[I 2024-12-03 19:02:01,076] Trial 1581 finished with value: 0.47317180422504285 and parameters: {'kernel': 'rbf', 'C': 22.256162312992544, 'gamma': 0.1614238088239905, 'epsilon': 0.08455601770783229}. Best is trial 88 with value: 0.3542875001421725.
[I 2024-12-03 19:02:02,321] Trial 1582 finished with value: 0.4309530493404934 and parameters: {'kernel': 'rbf', 'C': 19.69693479824856, 'gamma': 0.024473616929739157, 'epsilon': 0.0324825862804011}. Best is trial 88 with value: 0.3542875001421725.
[I 2024-12-03 19:02:05,690] Trial 1584 finished with value: 0.3675796031670383 and parameters: {'kernel': 'rbf', 'C': 81.13955477698309, 'gamma': 0.028948909624279436, 'epsilon': 0.048483375585157765}. Best is trial 88 with value: 0.3542875001421725.
[I 2024-12-03 19:02:20,505] Trial 1585 finished with value: 4.277238605630791 and parameters: {'kernel': 'poly', 'C': 66.2250217939105, 'gamma': 0.09287145937732275, 'epsilon': 0.8678331219135155}. Best is trial 88 with value: 0.3542875001421725.
[I 2024-12-03 19:02:22,036] Trial 1586 finished with value: 0.3735388741300227 and parameters: {'kernel': 'rbf', 'C': 94.69438518469899, 'gamma': 0.06739510250983706, 'epsilon': 0.1700626511004661}. Best is trial 88 with value: 0.3542875001421725.
[I 2024-12-03 19:02:23,492] Trial 1587 finished with value: 0.5954082112001058 and parameters: {'kernel': 'rbf', 'C': 1.9635438541752024, 'gamma': 0.0021446885544302683, 'epsilon': 0.03149928776934252}. Best is trial 88 with value: 0.3542875001421725.
[I 2024-12-03 19:02:24,705] Trial 1588 finished with value: 0.5970279840021269 and parameters: {'kernel': 'rbf', 'C': 28.012291706700864, 'gamma': 0.286292915188597, 'epsilon': 0.20053856182890997}. Best is trial 88 with value: 0.3542875001421725.
[I 2024-12-03 19:02:26,425] Trial 1589 finished with value: 0.3934690291935181 and parameters: {'kernel': 'rbf', 'C': 93.1721256463415, 'gamma': 0.015382336010728978, 'epsilon': 0.0690738584532301}. Best is trial 88 with value: 0.3542875001421725.
[I 2024-12-03 19:02:27,863] Trial 1590 finished with value: 176.0443968802042 and parameters: {'kernel': 'sigmoid', 'C': 8.86250890990739, 'gamma': 0.13529071782013288, 'epsilon': 0.05148980942726001}. Best is trial 88 with value: 0.3542875001421725.
[I 2024-12-03 19:02:29,073] Trial 1591 finished with value: 0.3725194576350141 and parameters: {'kernel': 'rbf', 'C': 96.34922313376599, 'gamma': 0.016194706659280255, 'epsilon': 0.27564404327418757}. Best is trial 88 with value: 0.3542875001421725.
[I 2024-12-03 19:02:29,604] Trial 1583 finished with value: 0.7859596569746483 and parameters: {'kernel': 'linear', 'C': 23.06445129560365, 'gamma': 0.115854657563562, 'epsilon': 0.11026346304721633}. Best is trial 88 with value: 0.3542875001421725.
[I 2024-12-03 19:02:30,571] Trial 1592 finished with value: 0.4141318065134863 and parameters: {'kernel': 'rbf', 'C': 24.65798423392145, 'gamma': 0.10625129400322825, 'epsilon': 0.10649603429978226}. Best is trial 88 with value: 0.3542875001421725.
[I 2024-12-03 19:02:31,387] Trial 1593 finished with value: 0.3901349664863084 and parameters: {'kernel': 'rbf', 'C': 28.387925718924077, 'gamma': 0.040755473910203247, 'epsilon': 0.08175435436075022}. Best is trial 88 with value: 0.3542875001421725.
[I 2024-12-03 19:02:32,163] Trial 1594 finished with value: 1.0760210634071394 and parameters: {'kernel': 'poly', 'C': 0.06961948133579528, 'gamma': 0.00019453473259111177, 'epsilon': 0.1467714132777746}. Best is trial 88 with value: 0.3542875001421725.
[I 2024-12-03 19:02:33,001] Trial 1595 finished with value: 0.4670605524547345 and parameters: {'kernel': 'rbf', 'C': 91.93621717975225, 'gamma': 0.1633070287425821, 'epsilon': 0.07411645225707834}. Best is trial 88 with value: 0.3542875001421725.
[I 2024-12-03 19:02:33,761] Trial 1596 finished with value: 0.4572802101035952 and parameters: {'kernel': 'rbf', 'C': 3.7629261752083174, 'gamma': 0.029564017695716583, 'epsilon': 0.100497112354316}. Best is trial 88 with value: 0.3542875001421725.
[I 2024-12-03 19:02:34,202] Trial 1597 finished with value: 0.4872895510654505 and parameters: {'kernel': 'rbf', 'C': 3.6151391448258186, 'gamma': 0.04342861244192827, 'epsilon': 0.4135654004563758}. Best is trial 88 with value: 0.3542875001421725.
[I 2024-12-03 19:02:35,454] Trial 1598 finished with value: 0.386820133567198 and parameters: {'kernel': 'rbf', 'C': 95.59178921508725, 'gamma': 0.08154120796333096, 'epsilon': 0.08595055377490496}. Best is trial 88 with value: 0.3542875001421725.
[I 2024-12-03 19:02:35,853] Trial 1599 finished with value: 0.6704273930456847 and parameters: {'kernel': 'rbf', 'C': 92.24214877052262, 'gamma': 0.3811272737345356, 'epsilon': 0.30982943139836305}. Best is trial 88 with value: 0.3542875001421725.
[I 2024-12-03 19:02:36,991] Trial 1600 finished with value: 0.8600614436002934 and parameters: {'kernel': 'rbf', 'C': 0.7429703996175008, 'gamma': 0.9130170971782926, 'epsilon': 0.13355165460300797}. Best is trial 88 with value: 0.3542875001421725.
[I 2024-12-03 19:02:37,780] Trial 1601 finished with value: 0.3559257165913917 and parameters: {'kernel': 'rbf', 'C': 93.36169163474946, 'gamma': 0.04257275899717376, 'epsilon': 0.1377944257483507}. Best is trial 88 with value: 0.3542875001421725.
[I 2024-12-03 19:02:38,360] Trial 1602 finished with value: 0.4775929448726978 and parameters: {'kernel': 'rbf', 'C': 94.71183406907927, 'gamma': 0.10099463970592648, 'epsilon': 0.3738205457989804}. Best is trial 88 with value: 0.3542875001421725.
[I 2024-12-03 19:02:38,361] Trial 132 finished with value: 2.8033635167892528 and parameters: {'kernel': 'poly', 'C': 87.41917013450721, 'gamma': 0.04296645139280308, 'epsilon': 0.10424852770815689}. Best is trial 88 with value: 0.3542875001421725.
[I 2024-12-03 19:02:39,767] Trial 1603 finished with value: 0.7698607514093907 and parameters: {'kernel': 'rbf', 'C': 0.07562786540864194, 'gamma': 0.005685902043759567, 'epsilon': 0.006879971841871782}. Best is trial 88 with value: 0.3542875001421725.
[I 2024-12-03 19:02:41,585] Trial 1604 finished with value: 0.4207964378584871 and parameters: {'kernel': 'rbf', 'C': 19.91465993237269, 'gamma': 0.042379802424222845, 'epsilon': 0.019695896304091458}. Best is trial 88 with value: 0.3542875001421725.
[I 2024-12-03 19:02:42,031] Trial 1606 finished with value: 0.41070192308635134 and parameters: {'kernel': 'rbf', 'C': 27.42627964159043, 'gamma': 0.027904121155685146, 'epsilon': 0.0784725432795703}. Best is trial 88 with value: 0.3542875001421725.
[I 2024-12-03 19:02:42,033] Trial 1605 finished with value: 0.3690151775909269 and parameters: {'kernel': 'rbf', 'C': 84.98867948740096, 'gamma': 0.03775886523601976, 'epsilon': 0.04942674478735252}. Best is trial 88 with value: 0.3542875001421725.
[I 2024-12-03 19:02:43,608] Trial 1607 finished with value: 0.38677037710149187 and parameters: {'kernel': 'rbf', 'C': 23.956292766606055, 'gamma': 0.05640546498166556, 'epsilon': 0.12555630704794987}. Best is trial 88 with value: 0.3542875001421725.
[I 2024-12-03 19:02:44,212] Trial 1609 finished with value: 1.5337561286229004 and parameters: {'kernel': 'poly', 'C': 0.7311523387017944, 'gamma': 0.0031464439980011766, 'epsilon': 0.04715322151684512}. Best is trial 88 with value: 0.3542875001421725.
[I 2024-12-03 19:02:44,490] Trial 1608 finished with value: 0.8043262872092065 and parameters: {'kernel': 'rbf', 'C': 2.718829795907958, 'gamma': 0.0001239965807849929, 'epsilon': 0.18806780785261207}. Best is trial 88 with value: 0.3542875001421725.
[I 2024-12-03 19:02:46,063] Trial 1611 finished with value: 0.877535113939289 and parameters: {'kernel': 'sigmoid', 'C': 0.16312792495821013, 'gamma': 0.0023073064798519037, 'epsilon': 0.2608759916290302}. Best is trial 88 with value: 0.3542875001421725.
[I 2024-12-03 19:02:46,961] Trial 1612 finished with value: 0.7398328441690231 and parameters: {'kernel': 'rbf', 'C': 2.116316178894398, 'gamma': 0.6837357882730423, 'epsilon': 0.0018597994046381568}. Best is trial 88 with value: 0.3542875001421725.
[I 2024-12-03 19:02:47,574] Trial 1610 finished with value: 2.980548066383869 and parameters: {'kernel': 'poly', 'C': 79.63226151172428, 'gamma': 0.008817915979111537, 'epsilon': 0.20495997669295607}. Best is trial 88 with value: 0.3542875001421725.
[I 2024-12-03 19:02:48,163] Trial 1613 finished with value: 0.3884959113916456 and parameters: {'kernel': 'rbf', 'C': 98.3535993247346, 'gamma': 0.08251505196717386, 'epsilon': 0.07448273905927559}. Best is trial 88 with value: 0.3542875001421725.
[I 2024-12-03 19:02:48,999] Trial 1614 finished with value: 0.42775325830639443 and parameters: {'kernel': 'rbf', 'C': 28.981432620481865, 'gamma': 0.015422538236258271, 'epsilon': 0.0881055094637804}. Best is trial 88 with value: 0.3542875001421725.
[I 2024-12-03 19:02:49,000] Trial 1615 finished with value: 0.7582868694131762 and parameters: {'kernel': 'rbf', 'C': 0.10267302822025713, 'gamma': 0.03607055086038227, 'epsilon': 0.6539733453321073}. Best is trial 88 with value: 0.3542875001421725.
[I 2024-12-03 19:02:50,105] Trial 1616 finished with value: 0.8050725713545615 and parameters: {'kernel': 'rbf', 'C': 89.98863166393537, 'gamma': 0.8782589079351263, 'epsilon': 0.0963500724838037}. Best is trial 88 with value: 0.3542875001421725.
[I 2024-12-03 19:02:51,320] Trial 1617 finished with value: 0.4139432969610351 and parameters: {'kernel': 'rbf', 'C': 15.625258543027659, 'gamma': 0.06840236826440904, 'epsilon': 0.03920131409148467}. Best is trial 88 with value: 0.3542875001421725.
[I 2024-12-03 19:02:51,556] Trial 1618 finished with value: 0.40000493568698064 and parameters: {'kernel': 'rbf', 'C': 89.80388248595187, 'gamma': 0.10373011888406092, 'epsilon': 0.05281532971086789}. Best is trial 88 with value: 0.3542875001421725.
[I 2024-12-03 19:02:51,923] Trial 1619 finished with value: 0.47033860527721333 and parameters: {'kernel': 'rbf', 'C': 19.903263050747988, 'gamma': 0.14516477933505775, 'epsilon': 0.14346874230921494}. Best is trial 88 with value: 0.3542875001421725.
[I 2024-12-03 19:02:53,903] Trial 1622 finished with value: 0.3560606333788726 and parameters: {'kernel': 'rbf', 'C': 97.90523987803721, 'gamma': 0.04538848417973442, 'epsilon': 0.16010714277155166}. Best is trial 88 with value: 0.3542875001421725.
[I 2024-12-03 19:02:54,476] Trial 1621 finished with value: 0.3640335415370157 and parameters: {'kernel': 'rbf', 'C': 92.83488890414836, 'gamma': 0.036068204683253564, 'epsilon': 0.08132390320854677}. Best is trial 88 with value: 0.3542875001421725.
[I 2024-12-03 19:02:55,521] Trial 1623 finished with value: 0.3948118408602483 and parameters: {'kernel': 'rbf', 'C': 23.655312849911116, 'gamma': 0.006261766539580411, 'epsilon': 0.11895669013283584}. Best is trial 88 with value: 0.3542875001421725.
[I 2024-12-03 19:02:56,899] Trial 1624 finished with value: 0.3670915248239809 and parameters: {'kernel': 'rbf', 'C': 95.14493320790451, 'gamma': 0.027274465942024165, 'epsilon': 0.059825157710575484}. Best is trial 88 with value: 0.3542875001421725.
[I 2024-12-03 19:02:57,472] Trial 1625 finished with value: 0.3873064070029024 and parameters: {'kernel': 'rbf', 'C': 96.31208844377795, 'gamma': 0.08357718866550078, 'epsilon': 0.093288321086183}. Best is trial 88 with value: 0.3542875001421725.
[I 2024-12-03 19:02:59,232] Trial 1626 finished with value: 0.4166274618876183 and parameters: {'kernel': 'rbf', 'C': 21.354830046953975, 'gamma': 0.02899405057318011, 'epsilon': 0.09492345970407279}. Best is trial 88 with value: 0.3542875001421725.
[I 2024-12-03 19:03:00,217] Trial 1627 finished with value: 0.36690125837518245 and parameters: {'kernel': 'rbf', 'C': 89.08815351188112, 'gamma': 0.056762986551652496, 'epsilon': 0.07471215619962503}. Best is trial 88 with value: 0.3542875001421725.
[I 2024-12-03 19:03:00,773] Trial 1628 finished with value: 0.9929990542789464 and parameters: {'kernel': 'rbf', 'C': 0.01855213812003437, 'gamma': 0.0016343366217738849, 'epsilon': 0.6092369331651272}. Best is trial 88 with value: 0.3542875001421725.
[I 2024-12-03 19:03:01,798] Trial 1629 finished with value: 0.5017169043675456 and parameters: {'kernel': 'rbf', 'C': 4.174965285609839, 'gamma': 0.11500451960783861, 'epsilon': 0.18594557456032318}. Best is trial 88 with value: 0.3542875001421725.
[I 2024-12-03 19:03:02,751] Trial 1630 finished with value: 0.3681195275096549 and parameters: {'kernel': 'rbf', 'C': 97.1707918138296, 'gamma': 0.02312766423156923, 'epsilon': 0.14710036288165898}. Best is trial 88 with value: 0.3542875001421725.
[I 2024-12-03 19:03:04,130] Trial 1631 finished with value: 0.41807430683931535 and parameters: {'kernel': 'rbf', 'C': 94.50666774442895, 'gamma': 0.006627007276077824, 'epsilon': 0.051158725075358964}. Best is trial 88 with value: 0.3542875001421725.
[I 2024-12-03 19:03:04,357] Trial 1632 finished with value: 1.064323578427282 and parameters: {'kernel': 'poly', 'C': 0.00473513974235716, 'gamma': 0.0013358649968447038, 'epsilon': 0.0532943571146986}. Best is trial 88 with value: 0.3542875001421725.
[I 2024-12-03 19:03:05,671] Trial 1633 finished with value: 0.39251003445961213 and parameters: {'kernel': 'rbf', 'C': 21.85900509707875, 'gamma': 0.03627969012969991, 'epsilon': 0.22343894517212515}. Best is trial 88 with value: 0.3542875001421725.
[I 2024-12-03 19:03:06,245] Trial 1634 finished with value: 0.4068284164004626 and parameters: {'kernel': 'rbf', 'C': 16.239911194191624, 'gamma': 0.04853601925515768, 'epsilon': 0.15431950920913978}. Best is trial 88 with value: 0.3542875001421725.
[I 2024-12-03 19:03:07,778] Trial 1635 finished with value: 0.3855267260969791 and parameters: {'kernel': 'rbf', 'C': 95.85666096318425, 'gamma': 0.016583828440207303, 'epsilon': 0.08567574242608883}. Best is trial 88 with value: 0.3542875001421725.
[I 2024-12-03 19:03:07,938] Trial 1636 finished with value: 0.48209851755856764 and parameters: {'kernel': 'rbf', 'C': 29.611427445419817, 'gamma': 0.165738903683203, 'epsilon': 0.13391461901121118}. Best is trial 88 with value: 0.3542875001421725.
[I 2024-12-03 19:03:09,530] Trial 1637 finished with value: 1.1456497737877862 and parameters: {'kernel': 'poly', 'C': 0.02090698999829239, 'gamma': 0.0032064662107835593, 'epsilon': 0.0012047247810016077}. Best is trial 88 with value: 0.3542875001421725.
[I 2024-12-03 19:03:10,106] Trial 1638 finished with value: 0.49980498144887225 and parameters: {'kernel': 'rbf', 'C': 98.2324395637462, 'gamma': 0.1957998239631122, 'epsilon': 0.05854064722194611}. Best is trial 88 with value: 0.3542875001421725.
[I 2024-12-03 19:03:11,246] Trial 1639 finished with value: 591.4197899243774 and parameters: {'kernel': 'sigmoid', 'C': 28.88234080211124, 'gamma': 0.09645102806166786, 'epsilon': 0.022742465403245125}. Best is trial 88 with value: 0.3542875001421725.
[I 2024-12-03 19:03:12,145] Trial 1640 finished with value: 0.4360892126157206 and parameters: {'kernel': 'rbf', 'C': 90.26337248307321, 'gamma': 0.13502087868248547, 'epsilon': 0.09322937219859392}. Best is trial 88 with value: 0.3542875001421725.
[I 2024-12-03 19:03:13,555] Trial 1641 finished with value: 0.3599688867345241 and parameters: {'kernel': 'rbf', 'C': 85.59028222634385, 'gamma': 0.04190306011049781, 'epsilon': 0.0831937626708869}. Best is trial 88 with value: 0.3542875001421725.
[I 2024-12-03 19:03:14,778] Trial 1642 finished with value: 0.4189196529950656 and parameters: {'kernel': 'rbf', 'C': 15.27418850696616, 'gamma': 0.05467505983357352, 'epsilon': 0.059829705797558655}. Best is trial 88 with value: 0.3542875001421725.
[I 2024-12-03 19:03:17,990] Trial 1644 finished with value: 0.37145722350344446 and parameters: {'kernel': 'rbf', 'C': 95.99048450582893, 'gamma': 0.034059713786745896, 'epsilon': 0.023616048575324046}. Best is trial 88 with value: 0.3542875001421725.
[I 2024-12-03 19:03:19,473] Trial 1645 finished with value: 1602.638310593765 and parameters: {'kernel': 'sigmoid', 'C': 76.5225619092333, 'gamma': 0.03727238296824233, 'epsilon': 0.025369196449210853}. Best is trial 88 with value: 0.3542875001421725.
[I 2024-12-03 19:03:20,975] Trial 1646 finished with value: 0.5202369516365165 and parameters: {'kernel': 'rbf', 'C': 10.603735745472452, 'gamma': 0.20613301295017183, 'epsilon': 0.04208653120082038}. Best is trial 88 with value: 0.3542875001421725.
[I 2024-12-03 19:03:23,140] Trial 1647 finished with value: 0.45005885200381435 and parameters: {'kernel': 'rbf', 'C': 95.00192363133635, 'gamma': 0.12174021198883392, 'epsilon': 0.20877620567181845}. Best is trial 88 with value: 0.3542875001421725.
[I 2024-12-03 19:03:24,606] Trial 1648 finished with value: 0.43161845079327327 and parameters: {'kernel': 'rbf', 'C': 12.79630891872028, 'gamma': 0.02436750816167589, 'epsilon': 0.09533352882783444}. Best is trial 88 with value: 0.3542875001421725.
[I 2024-12-03 19:03:32,781] Trial 1649 finished with value: 1.8376556225553025 and parameters: {'kernel': 'poly', 'C': 0.003979306392652097, 'gamma': 0.3911888762527175, 'epsilon': 0.16975821667142665}. Best is trial 88 with value: 0.3542875001421725.
[I 2024-12-03 19:03:34,134] Trial 1650 finished with value: 0.3883417004615086 and parameters: {'kernel': 'rbf', 'C': 24.40861405216546, 'gamma': 0.04263638562839473, 'epsilon': 0.1474931966113053}. Best is trial 88 with value: 0.3542875001421725.
[I 2024-12-03 19:03:35,627] Trial 1651 finished with value: 1.0380446201754219 and parameters: {'kernel': 'rbf', 'C': 0.056184486003971225, 'gamma': 0.00010743609550420579, 'epsilon': 0.048933851719662996}. Best is trial 88 with value: 0.3542875001421725.
[I 2024-12-03 19:03:37,183] Trial 1652 finished with value: 0.41603022572788134 and parameters: {'kernel': 'rbf', 'C': 23.08374679663011, 'gamma': 0.030354817711323225, 'epsilon': 0.0727553588496045}. Best is trial 88 with value: 0.3542875001421725.
[I 2024-12-03 19:03:38,654] Trial 1653 finished with value: 56.01112172063188 and parameters: {'kernel': 'sigmoid', 'C': 86.55395343676531, 'gamma': 0.0010214288791833557, 'epsilon': 0.07158680387240408}. Best is trial 88 with value: 0.3542875001421725.
[I 2024-12-03 19:03:40,150] Trial 1654 finished with value: 0.3971815178767311 and parameters: {'kernel': 'rbf', 'C': 97.88537650726788, 'gamma': 0.008073252131650263, 'epsilon': 0.24904174182130362}. Best is trial 88 with value: 0.3542875001421725.
[I 2024-12-03 19:03:41,597] Trial 1655 finished with value: 0.38525393883624354 and parameters: {'kernel': 'rbf', 'C': 81.82698300644525, 'gamma': 0.08378232706413144, 'epsilon': 0.11661587783889699}. Best is trial 88 with value: 0.3542875001421725.
[I 2024-12-03 19:03:42,780] Trial 1656 finished with value: 0.5706563341184425 and parameters: {'kernel': 'rbf', 'C': 19.83798070989654, 'gamma': 0.20737780018770977, 'epsilon': 0.30599408512691034}. Best is trial 88 with value: 0.3542875001421725.
