[I 2024-12-04 15:42:58,679] Trial 2225 finished with value: 0.44059099625138437 and parameters: {'n_estimators': 620, 'max_depth': 30, 'min_samples_split': 8, 'min_samples_leaf': 1, 'max_features': None, 'bootstrap': True, 'criterion': 'squared_error'}. Best is trial 1025 with value: 0.41844370194907604.
[I 2024-12-04 15:43:01,035] Trial 2218 finished with value: 0.42082588023211615 and parameters: {'n_estimators': 875, 'max_depth': 44, 'min_samples_split': 2, 'min_samples_leaf': 1, 'max_features': None, 'bootstrap': True, 'criterion': 'squared_error'}. Best is trial 1025 with value: 0.41844370194907604.
[I 2024-12-04 15:43:01,089] Trial 2172 finished with value: 0.43276032970964806 and parameters: {'n_estimators': 886, 'max_depth': 37, 'min_samples_split': 4, 'min_samples_leaf': 1, 'max_features': None, 'bootstrap': True, 'criterion': 'absolute_error'}. Best is trial 1025 with value: 0.41844370194907604.
[I 2024-12-04 15:43:01,769] Trial 2232 finished with value: 1.0549676555342233 and parameters: {'n_estimators': 343, 'max_depth': 40, 'min_samples_split': 44, 'min_samples_leaf': 10, 'max_features': 'log2', 'bootstrap': True, 'criterion': 'absolute_error'}. Best is trial 1025 with value: 0.41844370194907604.
[I 2024-12-04 15:43:02,471] Trial 2211 finished with value: 0.4315966578685177 and parameters: {'n_estimators': 806, 'max_depth': 35, 'min_samples_split': 4, 'min_samples_leaf': 1, 'max_features': None, 'bootstrap': True, 'criterion': 'squared_error'}. Best is trial 1025 with value: 0.41844370194907604.
[I 2024-12-04 15:43:06,188] Trial 2221 finished with value: 0.4194384322196208 and parameters: {'n_estimators': 843, 'max_depth': 39, 'min_samples_split': 2, 'min_samples_leaf': 1, 'max_features': None, 'bootstrap': True, 'criterion': 'squared_error'}. Best is trial 1025 with value: 0.41844370194907604.
[I 2024-12-04 15:43:06,259] Trial 2226 finished with value: 0.7434444766444199 and parameters: {'n_estimators': 596, 'max_depth': 23, 'min_samples_split': 45, 'min_samples_leaf': 2, 'max_features': 'sqrt', 'bootstrap': False, 'criterion': 'absolute_error'}. Best is trial 1025 with value: 0.41844370194907604.
[I 2024-12-04 15:43:07,654] Trial 2222 finished with value: 0.464749164217028 and parameters: {'n_estimators': 877, 'max_depth': 41, 'min_samples_split': 2, 'min_samples_leaf': 2, 'max_features': None, 'bootstrap': True, 'criterion': 'squared_error'}. Best is trial 1025 with value: 0.41844370194907604.
[I 2024-12-04 15:43:08,576] Trial 2220 finished with value: 0.43170010433492123 and parameters: {'n_estimators': 832, 'max_depth': 40, 'min_samples_split': 4, 'min_samples_leaf': 1, 'max_features': None, 'bootstrap': True, 'criterion': 'squared_error'}. Best is trial 1025 with value: 0.41844370194907604.
[I 2024-12-04 15:43:10,527] Trial 2229 finished with value: 0.42320443986512113 and parameters: {'n_estimators': 701, 'max_depth': 30, 'min_samples_split': 2, 'min_samples_leaf': 1, 'max_features': None, 'bootstrap': True, 'criterion': 'squared_error'}. Best is trial 1025 with value: 0.41844370194907604.
[I 2024-12-04 15:43:11,040] Trial 2237 finished with value: 0.9219748375863018 and parameters: {'n_estimators': 490, 'max_depth': 24, 'min_samples_split': 27, 'min_samples_leaf': 5, 'max_features': 'sqrt', 'bootstrap': True, 'criterion': 'squared_error'}. Best is trial 1025 with value: 0.41844370194907604.
[I 2024-12-04 15:43:13,658] Trial 2224 finished with value: 0.4230304449190308 and parameters: {'n_estimators': 740, 'max_depth': 30, 'min_samples_split': 2, 'min_samples_leaf': 1, 'max_features': None, 'bootstrap': True, 'criterion': 'squared_error'}. Best is trial 1025 with value: 0.41844370194907604.
[I 2024-12-04 15:43:13,679] Trial 2223 finished with value: 0.4196014476727432 and parameters: {'n_estimators': 815, 'max_depth': 39, 'min_samples_split': 2, 'min_samples_leaf': 1, 'max_features': None, 'bootstrap': True, 'criterion': 'squared_error'}. Best is trial 1025 with value: 0.41844370194907604.
[I 2024-12-04 15:43:14,446] Trial 2234 finished with value: 0.5331373746790979 and parameters: {'n_estimators': 740, 'max_depth': 34, 'min_samples_split': 2, 'min_samples_leaf': 1, 'max_features': 'sqrt', 'bootstrap': True, 'criterion': 'squared_error'}. Best is trial 1025 with value: 0.41844370194907604.
[I 2024-12-04 15:43:19,900] Trial 2240 finished with value: 1.040150844943597 and parameters: {'n_estimators': 880, 'max_depth': 5, 'min_samples_split': 7, 'min_samples_leaf': 6, 'max_features': 'log2', 'bootstrap': False, 'criterion': 'absolute_error'}. Best is trial 1025 with value: 0.41844370194907604.
[I 2024-12-04 15:43:21,423] Trial 2228 finished with value: 0.42431101920064557 and parameters: {'n_estimators': 934, 'max_depth': 27, 'min_samples_split': 2, 'min_samples_leaf': 1, 'max_features': None, 'bootstrap': True, 'criterion': 'squared_error'}. Best is trial 1025 with value: 0.41844370194907604.
[I 2024-12-04 15:43:23,891] Trial 2233 finished with value: 0.4656511206399525 and parameters: {'n_estimators': 958, 'max_depth': 47, 'min_samples_split': 2, 'min_samples_leaf': 2, 'max_features': None, 'bootstrap': True, 'criterion': 'squared_error'}. Best is trial 1025 with value: 0.41844370194907604.
[I 2024-12-04 15:43:24,969] Trial 2231 finished with value: 0.4320777546431984 and parameters: {'n_estimators': 816, 'max_depth': 43, 'min_samples_split': 4, 'min_samples_leaf': 1, 'max_features': None, 'bootstrap': True, 'criterion': 'squared_error'}. Best is trial 1025 with value: 0.41844370194907604.
[I 2024-12-04 15:43:27,905] Trial 2230 finished with value: 0.43185971097716824 and parameters: {'n_estimators': 787, 'max_depth': 40, 'min_samples_split': 4, 'min_samples_leaf': 1, 'max_features': None, 'bootstrap': True, 'criterion': 'squared_error'}. Best is trial 1025 with value: 0.41844370194907604.
[I 2024-12-04 15:43:28,083] Trial 2239 finished with value: 0.6056217840688978 and parameters: {'n_estimators': 920, 'max_depth': 44, 'min_samples_split': 2, 'min_samples_leaf': 1, 'max_features': 'log2', 'bootstrap': True, 'criterion': 'squared_error'}. Best is trial 1025 with value: 0.41844370194907604.
[I 2024-12-04 15:43:28,602] Trial 2196 finished with value: 0.4599210528288633 and parameters: {'n_estimators': 991, 'max_depth': 44, 'min_samples_split': 2, 'min_samples_leaf': 2, 'max_features': None, 'bootstrap': True, 'criterion': 'absolute_error'}. Best is trial 1025 with value: 0.41844370194907604.
[I 2024-12-04 15:43:29,371] Trial 2251 finished with value: 1.0678984044791988 and parameters: {'n_estimators': 637, 'max_depth': 50, 'min_samples_split': 8, 'min_samples_leaf': 8, 'max_features': 'log2', 'bootstrap': True, 'criterion': 'squared_error'}. Best is trial 1025 with value: 0.41844370194907604.
[I 2024-12-04 15:43:30,210] Trial 2236 finished with value: 0.4212128492229824 and parameters: {'n_estimators': 836, 'max_depth': 35, 'min_samples_split': 2, 'min_samples_leaf': 1, 'max_features': None, 'bootstrap': True, 'criterion': 'squared_error'}. Best is trial 1025 with value: 0.41844370194907604.
[I 2024-12-04 15:43:30,253] Trial 2241 finished with value: 0.6128876635843199 and parameters: {'n_estimators': 925, 'max_depth': 42, 'min_samples_split': 4, 'min_samples_leaf': 2, 'max_features': None, 'bootstrap': False, 'criterion': 'squared_error'}. Best is trial 1025 with value: 0.41844370194907604.
[I 2024-12-04 15:43:33,942] Trial 2235 finished with value: 0.4195401830625556 and parameters: {'n_estimators': 838, 'max_depth': 39, 'min_samples_split': 2, 'min_samples_leaf': 1, 'max_features': None, 'bootstrap': True, 'criterion': 'squared_error'}. Best is trial 1025 with value: 0.41844370194907604.
[I 2024-12-04 15:43:35,148] Trial 2248 finished with value: 0.8124963234551831 and parameters: {'n_estimators': 389, 'max_depth': 32, 'min_samples_split': 26, 'min_samples_leaf': 4, 'max_features': 'sqrt', 'bootstrap': False, 'criterion': 'absolute_error'}. Best is trial 1025 with value: 0.41844370194907604.
[I 2024-12-04 15:43:37,472] Trial 2246 finished with value: 0.46503037333833114 and parameters: {'n_estimators': 744, 'max_depth': 34, 'min_samples_split': 3, 'min_samples_leaf': 2, 'max_features': None, 'bootstrap': True, 'criterion': 'squared_error'}. Best is trial 1025 with value: 0.41844370194907604.
[I 2024-12-04 15:43:37,493] Trial 2242 finished with value: 0.4214101514571715 and parameters: {'n_estimators': 900, 'max_depth': 49, 'min_samples_split': 2, 'min_samples_leaf': 1, 'max_features': None, 'bootstrap': True, 'criterion': 'squared_error'}. Best is trial 1025 with value: 0.41844370194907604.
[I 2024-12-04 15:43:37,671] Trial 2238 finished with value: 0.4197321450604232 and parameters: {'n_estimators': 755, 'max_depth': 39, 'min_samples_split': 2, 'min_samples_leaf': 1, 'max_features': None, 'bootstrap': True, 'criterion': 'squared_error'}. Best is trial 1025 with value: 0.41844370194907604.
[I 2024-12-04 15:43:37,926] Trial 2244 finished with value: 0.8776393173662697 and parameters: {'n_estimators': 979, 'max_depth': 16, 'min_samples_split': 25, 'min_samples_leaf': 5, 'max_features': 'sqrt', 'bootstrap': False, 'criterion': 'absolute_error'}. Best is trial 1025 with value: 0.41844370194907604.
[I 2024-12-04 15:43:44,125] Trial 2243 finished with value: 0.41964847230084873 and parameters: {'n_estimators': 752, 'max_depth': 39, 'min_samples_split': 2, 'min_samples_leaf': 1, 'max_features': None, 'bootstrap': True, 'criterion': 'squared_error'}. Best is trial 1025 with value: 0.41844370194907604.
[I 2024-12-04 15:43:47,075] Trial 2259 finished with value: 0.997978785166874 and parameters: {'n_estimators': 945, 'max_depth': 14, 'min_samples_split': 2, 'min_samples_leaf': 13, 'max_features': 'sqrt', 'bootstrap': False, 'criterion': 'absolute_error'}. Best is trial 1025 with value: 0.41844370194907604.
[I 2024-12-04 15:43:47,647] Trial 2250 finished with value: 0.5276923740641798 and parameters: {'n_estimators': 930, 'max_depth': 38, 'min_samples_split': 2, 'min_samples_leaf': 1, 'max_features': None, 'bootstrap': False, 'criterion': 'squared_error'}. Best is trial 1025 with value: 0.41844370194907604.
[I 2024-12-04 15:43:48,115] Trial 2245 finished with value: 0.42003869191209664 and parameters: {'n_estimators': 919, 'max_depth': 38, 'min_samples_split': 2, 'min_samples_leaf': 1, 'max_features': None, 'bootstrap': True, 'criterion': 'squared_error'}. Best is trial 1025 with value: 0.41844370194907604.
[I 2024-12-04 15:43:48,313] Trial 2249 finished with value: 0.46490096305430023 and parameters: {'n_estimators': 742, 'max_depth': 40, 'min_samples_split': 3, 'min_samples_leaf': 2, 'max_features': None, 'bootstrap': True, 'criterion': 'squared_error'}. Best is trial 1025 with value: 0.41844370194907604.
[I 2024-12-04 15:43:49,252] Trial 2253 finished with value: 0.46485502418561453 and parameters: {'n_estimators': 740, 'max_depth': 38, 'min_samples_split': 2, 'min_samples_leaf': 2, 'max_features': None, 'bootstrap': True, 'criterion': 'squared_error'}. Best is trial 1025 with value: 0.41844370194907604.
[I 2024-12-04 15:43:49,392] Trial 2247 finished with value: 0.4650806562965922 and parameters: {'n_estimators': 909, 'max_depth': 40, 'min_samples_split': 2, 'min_samples_leaf': 2, 'max_features': None, 'bootstrap': True, 'criterion': 'squared_error'}. Best is trial 1025 with value: 0.41844370194907604.
[I 2024-12-04 15:43:51,933] Trial 2257 finished with value: 0.6123952753494741 and parameters: {'n_estimators': 937, 'max_depth': 35, 'min_samples_split': 2, 'min_samples_leaf': 2, 'max_features': None, 'bootstrap': False, 'criterion': 'squared_error'}. Best is trial 1025 with value: 0.41844370194907604.
[I 2024-12-04 15:43:52,471] Trial 2269 finished with value: 0.5634294369747287 and parameters: {'n_estimators': 161, 'max_depth': 37, 'min_samples_split': 21, 'min_samples_leaf': 1, 'max_features': 'sqrt', 'bootstrap': False, 'criterion': 'squared_error'}. Best is trial 1025 with value: 0.41844370194907604.
[I 2024-12-04 15:43:55,299] Trial 2260 finished with value: 0.4930471378613944 and parameters: {'n_estimators': 824, 'max_depth': 49, 'min_samples_split': 3, 'min_samples_leaf': 1, 'max_features': 'sqrt', 'bootstrap': True, 'criterion': 'squared_error'}. Best is trial 1025 with value: 0.41844370194907604.
[I 2024-12-04 15:43:55,302] Trial 2255 finished with value: 0.4211791021258502 and parameters: {'n_estimators': 765, 'max_depth': 45, 'min_samples_split': 2, 'min_samples_leaf': 1, 'max_features': None, 'bootstrap': True, 'criterion': 'squared_error'}. Best is trial 1025 with value: 0.41844370194907604.
[I 2024-12-04 15:43:59,934] Trial 2272 finished with value: 0.6654407977259857 and parameters: {'n_estimators': 127, 'max_depth': 44, 'min_samples_split': 23, 'min_samples_leaf': 8, 'max_features': None, 'bootstrap': True, 'criterion': 'absolute_error'}. Best is trial 1025 with value: 0.41844370194907604.
[I 2024-12-04 15:44:01,885] Trial 2256 finished with value: 0.4201811857246795 and parameters: {'n_estimators': 770, 'max_depth': 38, 'min_samples_split': 2, 'min_samples_leaf': 1, 'max_features': None, 'bootstrap': True, 'criterion': 'squared_error'}. Best is trial 1025 with value: 0.41844370194907604.
[I 2024-12-04 15:44:02,687] Trial 2264 finished with value: 0.5328375586848964 and parameters: {'n_estimators': 875, 'max_depth': 50, 'min_samples_split': 2, 'min_samples_leaf': 1, 'max_features': None, 'bootstrap': False, 'criterion': 'squared_error'}. Best is trial 1025 with value: 0.41844370194907604.
[I 2024-12-04 15:44:03,518] Trial 2258 finished with value: 0.4243521261313178 and parameters: {'n_estimators': 703, 'max_depth': 38, 'min_samples_split': 3, 'min_samples_leaf': 1, 'max_features': None, 'bootstrap': True, 'criterion': 'squared_error'}. Best is trial 1025 with value: 0.41844370194907604.
[I 2024-12-04 15:44:04,211] Trial 2252 finished with value: 0.42174165142312636 and parameters: {'n_estimators': 820, 'max_depth': 45, 'min_samples_split': 2, 'min_samples_leaf': 1, 'max_features': None, 'bootstrap': True, 'criterion': 'squared_error'}. Best is trial 1025 with value: 0.41844370194907604.
[I 2024-12-04 15:44:06,368] Trial 2254 finished with value: 0.4193447939432374 and parameters: {'n_estimators': 897, 'max_depth': 39, 'min_samples_split': 2, 'min_samples_leaf': 1, 'max_features': None, 'bootstrap': True, 'criterion': 'squared_error'}. Best is trial 1025 with value: 0.41844370194907604.
[I 2024-12-04 15:44:06,408] Trial 2267 finished with value: 1.06517930770108 and parameters: {'n_estimators': 577, 'max_depth': 15, 'min_samples_split': 15, 'min_samples_leaf': 7, 'max_features': 'log2', 'bootstrap': True, 'criterion': 'squared_error'}. Best is trial 1025 with value: 0.41844370194907604.
[I 2024-12-04 15:44:17,183] Trial 2268 finished with value: 0.4316846647237008 and parameters: {'n_estimators': 730, 'max_depth': 42, 'min_samples_split': 4, 'min_samples_leaf': 1, 'max_features': None, 'bootstrap': True, 'criterion': 'squared_error'}. Best is trial 1025 with value: 0.41844370194907604.
[I 2024-12-04 15:44:19,107] Trial 2265 finished with value: 0.4205090073885384 and parameters: {'n_estimators': 897, 'max_depth': 43, 'min_samples_split': 2, 'min_samples_leaf': 1, 'max_features': None, 'bootstrap': True, 'criterion': 'squared_error'}. Best is trial 1025 with value: 0.41844370194907604.
[I 2024-12-04 15:44:19,451] Trial 2266 finished with value: 0.4237816948284874 and parameters: {'n_estimators': 737, 'max_depth': 37, 'min_samples_split': 3, 'min_samples_leaf': 1, 'max_features': None, 'bootstrap': True, 'criterion': 'squared_error'}. Best is trial 1025 with value: 0.41844370194907604.
[I 2024-12-04 15:44:22,592] Trial 2271 finished with value: 0.4197257796472458 and parameters: {'n_estimators': 759, 'max_depth': 39, 'min_samples_split': 2, 'min_samples_leaf': 1, 'max_features': None, 'bootstrap': True, 'criterion': 'squared_error'}. Best is trial 1025 with value: 0.41844370194907604.
[I 2024-12-04 15:44:26,017] Trial 2270 finished with value: 0.46510078034280095 and parameters: {'n_estimators': 762, 'max_depth': 45, 'min_samples_split': 4, 'min_samples_leaf': 2, 'max_features': None, 'bootstrap': True, 'criterion': 'squared_error'}. Best is trial 1025 with value: 0.41844370194907604.
[I 2024-12-04 15:44:26,018] Trial 2262 finished with value: 0.4314310737019189 and parameters: {'n_estimators': 986, 'max_depth': 41, 'min_samples_split': 4, 'min_samples_leaf': 1, 'max_features': None, 'bootstrap': True, 'criterion': 'squared_error'}. Best is trial 1025 with value: 0.41844370194907604.
[I 2024-12-04 15:44:28,193] Trial 2273 finished with value: 0.4653265609980238 and parameters: {'n_estimators': 771, 'max_depth': 46, 'min_samples_split': 2, 'min_samples_leaf': 2, 'max_features': None, 'bootstrap': True, 'criterion': 'squared_error'}. Best is trial 1025 with value: 0.41844370194907604.
[I 2024-12-04 15:44:28,738] Trial 2276 finished with value: 0.4339328008099562 and parameters: {'n_estimators': 912, 'max_depth': 30, 'min_samples_split': 4, 'min_samples_leaf': 1, 'max_features': None, 'bootstrap': True, 'criterion': 'squared_error'}. Best is trial 1025 with value: 0.41844370194907604.
[I 2024-12-04 15:44:29,062] Trial 2227 finished with value: 0.4273038453989267 and parameters: {'n_estimators': 791, 'max_depth': 49, 'min_samples_split': 2, 'min_samples_leaf': 1, 'max_features': None, 'bootstrap': True, 'criterion': 'absolute_error'}. Best is trial 1025 with value: 0.41844370194907604.
[I 2024-12-04 15:44:29,679] Trial 2274 finished with value: 0.4187205755539451 and parameters: {'n_estimators': 772, 'max_depth': 40, 'min_samples_split': 2, 'min_samples_leaf': 1, 'max_features': None, 'bootstrap': True, 'criterion': 'squared_error'}. Best is trial 1025 with value: 0.41844370194907604.
[I 2024-12-04 15:44:31,641] Trial 2287 finished with value: 0.7056986044600463 and parameters: {'n_estimators': 889, 'max_depth': 37, 'min_samples_split': 13, 'min_samples_leaf': 2, 'max_features': 'sqrt', 'bootstrap': True, 'criterion': 'squared_error'}. Best is trial 1025 with value: 0.41844370194907604.
[I 2024-12-04 15:44:32,005] Trial 2275 finished with value: 0.43132451827116336 and parameters: {'n_estimators': 746, 'max_depth': 49, 'min_samples_split': 4, 'min_samples_leaf': 1, 'max_features': None, 'bootstrap': True, 'criterion': 'squared_error'}. Best is trial 1025 with value: 0.41844370194907604.
[I 2024-12-04 15:44:32,314] Trial 2277 finished with value: 0.42057431066277384 and parameters: {'n_estimators': 917, 'max_depth': 31, 'min_samples_split': 2, 'min_samples_leaf': 1, 'max_features': None, 'bootstrap': True, 'criterion': 'squared_error'}. Best is trial 1025 with value: 0.41844370194907604.
[I 2024-12-04 15:44:35,311] Trial 2284 finished with value: 0.4655114823910174 and parameters: {'n_estimators': 794, 'max_depth': 38, 'min_samples_split': 2, 'min_samples_leaf': 2, 'max_features': None, 'bootstrap': True, 'criterion': 'squared_error'}. Best is trial 1025 with value: 0.41844370194907604.
[I 2024-12-04 15:44:35,801] Trial 2278 finished with value: 0.42139898435830037 and parameters: {'n_estimators': 772, 'max_depth': 42, 'min_samples_split': 2, 'min_samples_leaf': 1, 'max_features': None, 'bootstrap': True, 'criterion': 'squared_error'}. Best is trial 1025 with value: 0.41844370194907604.
[I 2024-12-04 15:44:36,681] Trial 2280 finished with value: 0.4651478399826343 and parameters: {'n_estimators': 904, 'max_depth': 37, 'min_samples_split': 2, 'min_samples_leaf': 2, 'max_features': None, 'bootstrap': True, 'criterion': 'squared_error'}. Best is trial 1025 with value: 0.41844370194907604.
[I 2024-12-04 15:44:37,246] Trial 2295 finished with value: 0.9767666017885531 and parameters: {'n_estimators': 317, 'max_depth': 31, 'min_samples_split': 10, 'min_samples_leaf': 10, 'max_features': 'sqrt', 'bootstrap': False, 'criterion': 'squared_error'}. Best is trial 1025 with value: 0.41844370194907604.
[I 2024-12-04 15:44:38,597] Trial 2279 finished with value: 0.42501210886821766 and parameters: {'n_estimators': 740, 'max_depth': 32, 'min_samples_split': 3, 'min_samples_leaf': 1, 'max_features': None, 'bootstrap': True, 'criterion': 'squared_error'}. Best is trial 1025 with value: 0.41844370194907604.
[I 2024-12-04 15:44:41,824] Trial 2288 finished with value: 0.42642671919191266 and parameters: {'n_estimators': 753, 'max_depth': 29, 'min_samples_split': 3, 'min_samples_leaf': 1, 'max_features': None, 'bootstrap': True, 'criterion': 'squared_error'}. Best is trial 1025 with value: 0.41844370194907604.
[I 2024-12-04 15:44:43,188] Trial 2291 finished with value: 0.957349782234704 and parameters: {'n_estimators': 865, 'max_depth': 42, 'min_samples_split': 2, 'min_samples_leaf': 2, 'max_features': 'log2', 'bootstrap': True, 'criterion': 'squared_error'}. Best is trial 1025 with value: 0.41844370194907604.
[I 2024-12-04 15:44:51,402] Trial 2286 finished with value: 0.4319171257026168 and parameters: {'n_estimators': 911, 'max_depth': 40, 'min_samples_split': 4, 'min_samples_leaf': 1, 'max_features': None, 'bootstrap': True, 'criterion': 'squared_error'}. Best is trial 1025 with value: 0.41844370194907604.
[I 2024-12-04 15:44:51,563] Trial 2281 finished with value: 0.4312616846992407 and parameters: {'n_estimators': 935, 'max_depth': 42, 'min_samples_split': 4, 'min_samples_leaf': 1, 'max_features': None, 'bootstrap': True, 'criterion': 'squared_error'}. Best is trial 1025 with value: 0.41844370194907604.
[I 2024-12-04 15:44:51,873] Trial 2290 finished with value: 0.42355738644176677 and parameters: {'n_estimators': 721, 'max_depth': 41, 'min_samples_split': 3, 'min_samples_leaf': 1, 'max_features': None, 'bootstrap': True, 'criterion': 'squared_error'}. Best is trial 1025 with value: 0.41844370194907604.
