[I 2024-12-03 18:43:05,607] Trial 652 finished with value: 0.466908609783029 and parameters: {'kernel': 'rbf', 'C': 95.65745398681305, 'gamma': 0.012613658847592963, 'epsilon': 0.14522981837295085}. Best is trial 482 with value: 0.4491649651596098.
[I 2024-12-03 18:43:05,753] Trial 672 finished with value: 0.4798854325941077 and parameters: {'kernel': 'rbf', 'C': 92.96546404759742, 'gamma': 0.023551996285582605, 'epsilon': 0.016529795765564848}. Best is trial 482 with value: 0.4491649651596098.
[I 2024-12-03 18:43:05,963] Trial 668 finished with value: 0.5708344591230488 and parameters: {'kernel': 'linear', 'C': 24.02335868126402, 'gamma': 0.00037694542920885656, 'epsilon': 0.0965879941613402}. Best is trial 482 with value: 0.4491649651596098.
[I 2024-12-03 18:43:05,998] Trial 662 finished with value: 0.5453905227406711 and parameters: {'kernel': 'rbf', 'C': 28.22587249572305, 'gamma': 0.005731685739401276, 'epsilon': 0.05090202988827558}. Best is trial 482 with value: 0.4491649651596098.
[I 2024-12-03 18:43:06,233] Trial 667 finished with value: 0.486753369671551 and parameters: {'kernel': 'rbf', 'C': 95.04500906839682, 'gamma': 0.006886447034652806, 'epsilon': 0.10820875780382223}. Best is trial 482 with value: 0.4491649651596098.
[I 2024-12-03 18:43:06,400] Trial 666 finished with value: 0.8191607951346619 and parameters: {'kernel': 'rbf', 'C': 2.607090628019805, 'gamma': 0.0010834982350567187, 'epsilon': 0.09049134381876435}. Best is trial 482 with value: 0.4491649651596098.
[I 2024-12-03 18:43:06,580] Trial 676 finished with value: 0.5747618678855624 and parameters: {'kernel': 'rbf', 'C': 78.39111880177951, 'gamma': 0.011231315700644048, 'epsilon': 0.45252431365530593}. Best is trial 482 with value: 0.4491649651596098.
[I 2024-12-03 18:43:06,892] Trial 673 finished with value: 1.3260466786198246 and parameters: {'kernel': 'sigmoid', 'C': 0.009221211896160578, 'gamma': 0.0001040517011196515, 'epsilon': 0.4723076286539848}. Best is trial 482 with value: 0.4491649651596098.
[I 2024-12-03 18:43:06,893] Trial 671 finished with value: 0.5929976292104054 and parameters: {'kernel': 'rbf', 'C': 91.70807514652066, 'gamma': 0.0010335996817309946, 'epsilon': 0.04279405243114562}. Best is trial 482 with value: 0.4491649651596098.
[I 2024-12-03 18:43:07,137] Trial 675 finished with value: 431.4243647622446 and parameters: {'kernel': 'sigmoid', 'C': 80.22320930863117, 'gamma': 0.030410643589363212, 'epsilon': 0.30736753001576606}. Best is trial 482 with value: 0.4491649651596098.
[I 2024-12-03 18:43:07,304] Trial 659 finished with value: 0.46589432089361704 and parameters: {'kernel': 'rbf', 'C': 25.235550691979924, 'gamma': 0.029446597271859554, 'epsilon': 0.046274812923979676}. Best is trial 482 with value: 0.4491649651596098.
[I 2024-12-03 18:43:07,306] Trial 669 finished with value: 0.5724088578031875 and parameters: {'kernel': 'linear', 'C': 21.93278906541244, 'gamma': 0.011341872632066206, 'epsilon': 0.08837201679730171}. Best is trial 482 with value: 0.4491649651596098.
[I 2024-12-03 18:43:07,353] Trial 678 finished with value: 0.46223532929674205 and parameters: {'kernel': 'rbf', 'C': 93.81227687669308, 'gamma': 0.01932168356653421, 'epsilon': 0.05401422022477129}. Best is trial 482 with value: 0.4491649651596098.
[I 2024-12-03 18:43:08,274] Trial 679 finished with value: 34.57874645350881 and parameters: {'kernel': 'sigmoid', 'C': 52.77917487982709, 'gamma': 0.007016501373125947, 'epsilon': 0.06814665850006045}. Best is trial 482 with value: 0.4491649651596098.
[I 2024-12-03 18:43:09,894] Trial 674 finished with value: 0.49885464276671543 and parameters: {'kernel': 'rbf', 'C': 10.618857269442872, 'gamma': 0.04323722650620224, 'epsilon': 0.17311630296773886}. Best is trial 482 with value: 0.4491649651596098.
[I 2024-12-03 18:43:10,080] Trial 663 finished with value: 0.6825461129376723 and parameters: {'kernel': 'rbf', 'C': 1.4447604721106322, 'gamma': 0.022297567614156858, 'epsilon': 0.11602998355036766}. Best is trial 482 with value: 0.4491649651596098.
[I 2024-12-03 18:43:10,571] Trial 688 finished with value: 1.3588499898915931 and parameters: {'kernel': 'rbf', 'C': 0.06610201228043128, 'gamma': 0.00014395235363211825, 'epsilon': 0.0010626933924450356}. Best is trial 482 with value: 0.4491649651596098.
[I 2024-12-03 18:43:10,888] Trial 681 finished with value: 0.54933689679793 and parameters: {'kernel': 'rbf', 'C': 26.975391931774425, 'gamma': 0.0056391895298228455, 'epsilon': 0.04065911236186415}. Best is trial 482 with value: 0.4491649651596098.
[I 2024-12-03 18:43:10,890] Trial 664 finished with value: 0.670825687318944 and parameters: {'kernel': 'linear', 'C': 0.07087520764561352, 'gamma': 0.008381872144421074, 'epsilon': 0.042072876353355104}. Best is trial 482 with value: 0.4491649651596098.
[I 2024-12-03 18:43:10,892] Trial 682 finished with value: 0.46377809955408134 and parameters: {'kernel': 'rbf', 'C': 88.83802048471881, 'gamma': 0.009593231325979761, 'epsilon': 0.1004018778968759}. Best is trial 482 with value: 0.4491649651596098.
[I 2024-12-03 18:43:12,320] Trial 687 finished with value: 0.48495711896068433 and parameters: {'kernel': 'rbf', 'C': 23.216785273377013, 'gamma': 0.03948309373534423, 'epsilon': 0.0705957657775214}. Best is trial 482 with value: 0.4491649651596098.
[I 2024-12-03 18:43:12,839] Trial 680 finished with value: 0.4859324659572302 and parameters: {'kernel': 'rbf', 'C': 99.6623624741884, 'gamma': 0.006570753210781465, 'epsilon': 0.0420073583550016}. Best is trial 482 with value: 0.4491649651596098.
[I 2024-12-03 18:43:12,852] Trial 685 finished with value: 0.540024877088458 and parameters: {'kernel': 'rbf', 'C': 95.47911325274859, 'gamma': 0.003052064723448804, 'epsilon': 0.05394433201780228}. Best is trial 482 with value: 0.4491649651596098.
[I 2024-12-03 18:43:13,182] Trial 693 finished with value: 0.4545508926245042 and parameters: {'kernel': 'rbf', 'C': 99.64217652691825, 'gamma': 0.010358509469145509, 'epsilon': 0.09250927443835802}. Best is trial 482 with value: 0.4491649651596098.
[I 2024-12-03 18:43:13,303] Trial 697 finished with value: 0.6035142847353936 and parameters: {'kernel': 'rbf', 'C': 9.623082814835488, 'gamma': 0.1506223980295626, 'epsilon': 0.2598180308943343}. Best is trial 482 with value: 0.4491649651596098.
[I 2024-12-03 18:43:13,484] Trial 690 finished with value: 0.5645171474938371 and parameters: {'kernel': 'rbf', 'C': 65.08650475489583, 'gamma': 0.0037885381756223263, 'epsilon': 0.32305835306256653}. Best is trial 482 with value: 0.4491649651596098.
[I 2024-12-03 18:43:13,659] Trial 689 finished with value: 0.5688970169877671 and parameters: {'kernel': 'linear', 'C': 98.686018697796, 'gamma': 0.016445754487466293, 'epsilon': 0.11944479930728555}. Best is trial 482 with value: 0.4491649651596098.
[I 2024-12-03 18:43:14,360] Trial 677 finished with value: 0.48045933892631243 and parameters: {'kernel': 'rbf', 'C': 23.024742442679514, 'gamma': 0.015675096819893566, 'epsilon': 0.14825342091852672}. Best is trial 482 with value: 0.4491649651596098.
[I 2024-12-03 18:43:14,367] Trial 700 finished with value: 1.3167053985407762 and parameters: {'kernel': 'sigmoid', 'C': 0.002398134916567567, 'gamma': 0.018412211832137385, 'epsilon': 0.34063147647579456}. Best is trial 482 with value: 0.4491649651596098.
[I 2024-12-03 18:43:14,556] Trial 701 finished with value: 0.5244036168110809 and parameters: {'kernel': 'rbf', 'C': 84.44918451662755, 'gamma': 0.02440417005436783, 'epsilon': 0.13613841933790252}. Best is trial 482 with value: 0.4491649651596098.
[I 2024-12-03 18:43:14,638] Trial 684 finished with value: 0.49217174986262596 and parameters: {'kernel': 'rbf', 'C': 94.76261573947369, 'gamma': 0.012435912111274228, 'epsilon': 0.22275971530436448}. Best is trial 482 with value: 0.4491649651596098.
[I 2024-12-03 18:43:15,395] Trial 683 finished with value: 0.6296459029867547 and parameters: {'kernel': 'rbf', 'C': 11.91639439565727, 'gamma': 0.003945904295367239, 'epsilon': 0.11096169946730312}. Best is trial 482 with value: 0.4491649651596098.
[I 2024-12-03 18:43:15,399] Trial 698 finished with value: 0.6112809773209613 and parameters: {'kernel': 'linear', 'C': 1.5287359644474, 'gamma': 0.0051322989109442154, 'epsilon': 0.45421021492386915}. Best is trial 482 with value: 0.4491649651596098.
[I 2024-12-03 18:43:15,404] Trial 702 finished with value: 0.7832235460214114 and parameters: {'kernel': 'sigmoid', 'C': 57.678200317853666, 'gamma': 0.00016125892396946738, 'epsilon': 0.002525700940540736}. Best is trial 482 with value: 0.4491649651596098.
[I 2024-12-03 18:43:15,503] Trial 695 finished with value: 0.5023691420547856 and parameters: {'kernel': 'rbf', 'C': 89.35012529866022, 'gamma': 0.005669896121343105, 'epsilon': 0.13086485968615538}. Best is trial 482 with value: 0.4491649651596098.
[I 2024-12-03 18:43:15,957] Trial 699 finished with value: 0.5664518794307042 and parameters: {'kernel': 'rbf', 'C': 14.485680988736243, 'gamma': 0.00609313424868689, 'epsilon': 0.12599039829233422}. Best is trial 482 with value: 0.4491649651596098.
[I 2024-12-03 18:43:16,280] Trial 692 finished with value: 0.489977107786125 and parameters: {'kernel': 'rbf', 'C': 73.6386246327918, 'gamma': 0.007101865284471199, 'epsilon': 0.05127958061325816}. Best is trial 482 with value: 0.4491649651596098.
[I 2024-12-03 18:43:16,337] Trial 703 finished with value: 0.534474467893966 and parameters: {'kernel': 'rbf', 'C': 19.305395842306247, 'gamma': 0.010900147763047444, 'epsilon': 0.28512090584320376}. Best is trial 482 with value: 0.4491649651596098.
[I 2024-12-03 18:43:17,033] Trial 696 finished with value: 0.4675328206897253 and parameters: {'kernel': 'rbf', 'C': 79.34708445492615, 'gamma': 0.021686535504909496, 'epsilon': 0.07582234175178046}. Best is trial 482 with value: 0.4491649651596098.
[I 2024-12-03 18:43:17,439] Trial 686 finished with value: 0.5023797691522007 and parameters: {'kernel': 'rbf', 'C': 92.80994520264638, 'gamma': 0.005080640915443813, 'epsilon': 0.041536113126042884}. Best is trial 482 with value: 0.4491649651596098.
[I 2024-12-03 18:43:18,118] Trial 691 finished with value: 0.5271920611234142 and parameters: {'kernel': 'rbf', 'C': 99.59586214567982, 'gamma': 0.02748001532294823, 'epsilon': 0.0833333260024287}. Best is trial 482 with value: 0.4491649651596098.
[I 2024-12-03 18:43:18,297] Trial 711 finished with value: 0.7546373718130793 and parameters: {'kernel': 'rbf', 'C': 0.7051053797347387, 'gamma': 0.14108544616863175, 'epsilon': 0.0016348515533218726}. Best is trial 482 with value: 0.4491649651596098.
[I 2024-12-03 18:43:18,800] Trial 710 finished with value: 0.5062612622215863 and parameters: {'kernel': 'rbf', 'C': 20.130832422408243, 'gamma': 0.052279758590530204, 'epsilon': 0.05079402436726875}. Best is trial 482 with value: 0.4491649651596098.
[I 2024-12-03 18:43:19,183] Trial 707 finished with value: 0.4922810108468298 and parameters: {'kernel': 'rbf', 'C': 99.23683406172097, 'gamma': 0.006265656577152322, 'epsilon': 0.12314976451503121}. Best is trial 482 with value: 0.4491649651596098.
[I 2024-12-03 18:43:19,193] Trial 705 finished with value: 0.46184009630201384 and parameters: {'kernel': 'rbf', 'C': 98.23604255047323, 'gamma': 0.018115742563405337, 'epsilon': 0.026751910963553588}. Best is trial 482 with value: 0.4491649651596098.
[I 2024-12-03 18:43:19,849] Trial 709 finished with value: 0.5463662351098209 and parameters: {'kernel': 'rbf', 'C': 98.87996569681034, 'gamma': 0.027586095549499038, 'epsilon': 0.1665265065105382}. Best is trial 482 with value: 0.4491649651596098.
[I 2024-12-03 18:43:20,322] Trial 704 finished with value: 0.5563220760062761 and parameters: {'kernel': 'rbf', 'C': 15.36094315787819, 'gamma': 0.006907947796697951, 'epsilon': 0.09587885047955592}. Best is trial 482 with value: 0.4491649651596098.
[I 2024-12-03 18:43:21,744] Trial 706 finished with value: 0.48372112772816395 and parameters: {'kernel': 'rbf', 'C': 97.41919417326528, 'gamma': 0.007217733256188357, 'epsilon': 0.029328574064134867}. Best is trial 482 with value: 0.4491649651596098.
[I 2024-12-03 18:43:21,976] Trial 714 finished with value: 14.146328139884305 and parameters: {'kernel': 'sigmoid', 'C': 85.70821899238948, 'gamma': 0.004026842301635575, 'epsilon': 0.041293154973119375}. Best is trial 482 with value: 0.4491649651596098.
[I 2024-12-03 18:43:22,371] Trial 716 finished with value: 0.46970862204290736 and parameters: {'kernel': 'rbf', 'C': 87.8868957888368, 'gamma': 0.008736488241767362, 'epsilon': 0.08592837982684043}. Best is trial 482 with value: 0.4491649651596098.
[I 2024-12-03 18:43:22,558] Trial 722 finished with value: 0.7262640936140761 and parameters: {'kernel': 'rbf', 'C': 2.4043244713359573, 'gamma': 0.008797243566461945, 'epsilon': 0.03544987796087631}. Best is trial 482 with value: 0.4491649651596098.
[I 2024-12-03 18:43:22,752] Trial 725 finished with value: 0.6382931500240445 and parameters: {'kernel': 'rbf', 'C': 13.158196684158742, 'gamma': 0.003324902892029362, 'epsilon': 0.03358315144403699}. Best is trial 482 with value: 0.4491649651596098.
[I 2024-12-03 18:43:23,053] Trial 708 finished with value: 0.490765434552177 and parameters: {'kernel': 'rbf', 'C': 19.29757940016639, 'gamma': 0.03599123771624952, 'epsilon': 0.17695720724069006}. Best is trial 482 with value: 0.4491649651596098.
[I 2024-12-03 18:43:23,386] Trial 723 finished with value: 0.9112495458376534 and parameters: {'kernel': 'poly', 'C': 9.298081533455136, 'gamma': 0.019767238574544092, 'epsilon': 0.024142595178847513}. Best is trial 482 with value: 0.4491649651596098.
[I 2024-12-03 18:43:23,543] Trial 715 finished with value: 0.48291945986861207 and parameters: {'kernel': 'rbf', 'C': 17.0571550928153, 'gamma': 0.019178698966692484, 'epsilon': 0.04958887007831749}. Best is trial 482 with value: 0.4491649651596098.
[I 2024-12-03 18:43:24,001] Trial 713 finished with value: 0.4765116488459314 and parameters: {'kernel': 'rbf', 'C': 99.08989059622614, 'gamma': 0.007545117175961991, 'epsilon': 0.08544450849847673}. Best is trial 482 with value: 0.4491649651596098.
[I 2024-12-03 18:43:24,226] Trial 719 finished with value: 0.7957013565686935 and parameters: {'kernel': 'linear', 'C': 0.007707593082735278, 'gamma': 0.00014252753858162614, 'epsilon': 0.22507505480965656}. Best is trial 482 with value: 0.4491649651596098.
[I 2024-12-03 18:43:24,362] Trial 720 finished with value: 0.494567083510879 and parameters: {'kernel': 'rbf', 'C': 15.069382980034122, 'gamma': 0.019359096777763686, 'epsilon': 0.09804188881348694}. Best is trial 482 with value: 0.4491649651596098.
[I 2024-12-03 18:43:24,949] Trial 724 finished with value: 0.4645041432797512 and parameters: {'kernel': 'rbf', 'C': 97.45409417625602, 'gamma': 0.01675796779457012, 'epsilon': 0.0953021469555359}. Best is trial 482 with value: 0.4491649651596098.
[I 2024-12-03 18:43:25,211] Trial 729 finished with value: 0.4728960751366235 and parameters: {'kernel': 'rbf', 'C': 28.02870178086135, 'gamma': 0.01568794905431589, 'epsilon': 0.061454283488408756}. Best is trial 482 with value: 0.4491649651596098.
[I 2024-12-03 18:43:25,218] Trial 694 finished with value: 0.5605592409011095 and parameters: {'kernel': 'linear', 'C': 97.3615526538986, 'gamma': 0.005047863968455385, 'epsilon': 0.02785612974346338}. Best is trial 482 with value: 0.4491649651596098.
[I 2024-12-03 18:43:25,341] Trial 712 finished with value: 0.6069436455062891 and parameters: {'kernel': 'rbf', 'C': 93.32030565851294, 'gamma': 0.10812116252223782, 'epsilon': 0.057452194508744385}. Best is trial 482 with value: 0.4491649651596098.
[I 2024-12-03 18:43:25,396] Trial 717 finished with value: 0.5580351723007793 and parameters: {'kernel': 'rbf', 'C': 19.80391532801384, 'gamma': 0.005869008639703246, 'epsilon': 0.06504161322456295}. Best is trial 482 with value: 0.4491649651596098.
[I 2024-12-03 18:43:25,738] Trial 721 finished with value: 0.7407012844074947 and parameters: {'kernel': 'rbf', 'C': 11.664583929286248, 'gamma': 0.0010789078912824264, 'epsilon': 0.13756839305524202}. Best is trial 482 with value: 0.4491649651596098.
[I 2024-12-03 18:43:26,547] Trial 733 finished with value: 0.4573945508572795 and parameters: {'kernel': 'rbf', 'C': 90.76956190569415, 'gamma': 0.018102241464676993, 'epsilon': 0.06284354491087868}. Best is trial 482 with value: 0.4491649651596098.
[I 2024-12-03 18:43:26,744] Trial 730 finished with value: 0.4795150591550153 and parameters: {'kernel': 'rbf', 'C': 90.7184139963874, 'gamma': 0.008002303176737762, 'epsilon': 0.03095739378103512}. Best is trial 482 with value: 0.4491649651596098.
[I 2024-12-03 18:43:26,745] Trial 734 finished with value: 0.6385953333370271 and parameters: {'kernel': 'rbf', 'C': 98.73524473634808, 'gamma': 0.05222776573467391, 'epsilon': 0.03607868505356431}. Best is trial 482 with value: 0.4491649651596098.
[I 2024-12-03 18:43:26,752] Trial 732 finished with value: 0.566388864518403 and parameters: {'kernel': 'rbf', 'C': 95.14886135687826, 'gamma': 0.03701757180049815, 'epsilon': 0.02302151203815936}. Best is trial 482 with value: 0.4491649651596098.
[I 2024-12-03 18:43:27,152] Trial 735 finished with value: 0.6067608287835491 and parameters: {'kernel': 'rbf', 'C': 97.85783714200217, 'gamma': 0.09159159955697613, 'epsilon': 0.1082988092107056}. Best is trial 482 with value: 0.4491649651596098.
[I 2024-12-03 18:43:27,182] Trial 727 finished with value: 0.5324637625871148 and parameters: {'kernel': 'rbf', 'C': 99.44198394816682, 'gamma': 0.024365212348770853, 'epsilon': 0.13786733916995153}. Best is trial 482 with value: 0.4491649651596098.
[I 2024-12-03 18:43:27,606] Trial 736 finished with value: 0.5882976050436862 and parameters: {'kernel': 'rbf', 'C': 89.28120661726676, 'gamma': 0.0009691667835733851, 'epsilon': 0.01666834094529893}. Best is trial 482 with value: 0.4491649651596098.
[I 2024-12-03 18:43:28,127] Trial 728 finished with value: 0.8661847756853029 and parameters: {'kernel': 'poly', 'C': 5.5229661937263925, 'gamma': 0.0261178383433057, 'epsilon': 0.20811890631203334}. Best is trial 482 with value: 0.4491649651596098.
[I 2024-12-03 18:43:28,228] Trial 718 finished with value: 0.4744418979872054 and parameters: {'kernel': 'rbf', 'C': 15.261991880377812, 'gamma': 0.03412371559892787, 'epsilon': 0.02094159112325931}. Best is trial 482 with value: 0.4491649651596098.
[I 2024-12-03 18:43:28,408] Trial 726 finished with value: 0.45312927682298293 and parameters: {'kernel': 'rbf', 'C': 87.3829547894975, 'gamma': 0.011408583011050598, 'epsilon': 0.07004960533926985}. Best is trial 482 with value: 0.4491649651596098.
[I 2024-12-03 18:43:30,685] Trial 744 finished with value: 0.5000060998584447 and parameters: {'kernel': 'rbf', 'C': 15.42565042771715, 'gamma': 0.02543880357807265, 'epsilon': 0.2737408691132777}. Best is trial 482 with value: 0.4491649651596098.
[I 2024-12-03 18:43:31,091] Trial 740 finished with value: 0.5413795791026655 and parameters: {'kernel': 'rbf', 'C': 25.348305987789114, 'gamma': 0.00629668448148104, 'epsilon': 0.061553196872646015}. Best is trial 482 with value: 0.4491649651596098.
[I 2024-12-03 18:43:31,235] Trial 731 finished with value: 0.6349955986206043 and parameters: {'kernel': 'rbf', 'C': 15.63864291797587, 'gamma': 0.0027281512891889157, 'epsilon': 0.15627844061229373}. Best is trial 482 with value: 0.4491649651596098.
[I 2024-12-03 18:43:31,507] Trial 746 finished with value: 0.5620095683570181 and parameters: {'kernel': 'rbf', 'C': 72.91961474983931, 'gamma': 0.0021066269269623, 'epsilon': 0.08864871837759762}. Best is trial 482 with value: 0.4491649651596098.
[I 2024-12-03 18:43:31,876] Trial 738 finished with value: 0.5490066530996413 and parameters: {'kernel': 'rbf', 'C': 87.44419203428211, 'gamma': 0.0029105052491402816, 'epsilon': 0.1579322838689807}. Best is trial 482 with value: 0.4491649651596098.
[I 2024-12-03 18:43:32,211] Trial 743 finished with value: 0.45223113647567686 and parameters: {'kernel': 'rbf', 'C': 99.8897095671956, 'gamma': 0.01257134257176998, 'epsilon': 0.0513690369016966}. Best is trial 482 with value: 0.4491649651596098.
[I 2024-12-03 18:43:32,716] Trial 742 finished with value: 0.5089476582866878 and parameters: {'kernel': 'rbf', 'C': 92.1188918248044, 'gamma': 0.00445081601999431, 'epsilon': 0.05170476754435516}. Best is trial 482 with value: 0.4491649651596098.
[I 2024-12-03 18:43:32,920] Trial 748 finished with value: 0.5342887554289036 and parameters: {'kernel': 'rbf', 'C': 95.40342671535959, 'gamma': 0.023960177294316955, 'epsilon': 0.2347683993881818}. Best is trial 482 with value: 0.4491649651596098.
[I 2024-12-03 18:43:33,228] Trial 747 finished with value: 0.4794186095644683 and parameters: {'kernel': 'rbf', 'C': 14.898072320545225, 'gamma': 0.030075144764264785, 'epsilon': 0.07792438453009465}. Best is trial 482 with value: 0.4491649651596098.
[I 2024-12-03 18:43:33,230] Trial 741 finished with value: 0.8448268718006383 and parameters: {'kernel': 'rbf', 'C': 1.4908115469809067, 'gamma': 0.0009461720142494938, 'epsilon': 0.0017684880398901313}. Best is trial 482 with value: 0.4491649651596098.
[I 2024-12-03 18:43:33,337] Trial 754 finished with value: 0.7158850949922543 and parameters: {'kernel': 'linear', 'C': 0.04006708964646696, 'gamma': 0.07515572486118134, 'epsilon': 0.18727551023449285}. Best is trial 482 with value: 0.4491649651596098.
[I 2024-12-03 18:43:33,474] Trial 760 finished with value: 0.7401963062389445 and parameters: {'kernel': 'poly', 'C': 75.39542318630507, 'gamma': 0.04028392030416414, 'epsilon': 0.08231608503436748}. Best is trial 482 with value: 0.4491649651596098.
[I 2024-12-03 18:43:33,692] Trial 751 finished with value: 1.083760714968685 and parameters: {'kernel': 'poly', 'C': 0.005566645013968883, 'gamma': 0.039768750817270555, 'epsilon': 0.5478205906146925}. Best is trial 482 with value: 0.4491649651596098.
