[I 2024-12-04 15:10:43,374] Trial 968 finished with value: 0.13435440261231957 and parameters: {'kernel_type': 'Matern', 'length_scale': 5.964481304291279, 'noise_level': 0.061004215745420906, 'constant_value': 37810.155130393156, 'nu': 1.5}. Best is trial 750 with value: 0.13435342446039877.
[I 2024-12-04 15:10:43,494] Trial 945 finished with value: 1.2693635028609778 and parameters: {'kernel_type': 'RBF', 'length_scale': 82257.3620759268, 'noise_level': 2.5969531763373036e-10, 'constant_value': 4.957782583173152e-06, 'nu': 0.5}. Best is trial 750 with value: 0.13435342446039877.
[I 2024-12-04 15:10:44,835] Trial 969 finished with value: 0.13435437867793232 and parameters: {'kernel_type': 'Matern', 'length_scale': 8.759118254039237, 'noise_level': 0.16592919894794433, 'constant_value': 26325.79755489805, 'nu': 1.5}. Best is trial 750 with value: 0.13435342446039877.
[I 2024-12-04 15:10:46,367] Trial 970 finished with value: 0.134354366973434 and parameters: {'kernel_type': 'Matern', 'length_scale': 16.114463245972978, 'noise_level': 0.09754720334996606, 'constant_value': 8.558882016449683, 'nu': 1.5}. Best is trial 750 with value: 0.13435342446039877.
[I 2024-12-04 15:10:46,731] Trial 973 finished with value: 0.13435440392724501 and parameters: {'kernel_type': 'Matern', 'length_scale': 0.6358538308629819, 'noise_level': 0.7566082924477413, 'constant_value': 17925.426260581247, 'nu': 1.5}. Best is trial 750 with value: 0.13435342446039877.
[I 2024-12-04 15:10:47,443] Trial 965 finished with value: 0.13435437887751675 and parameters: {'kernel_type': 'Matern', 'length_scale': 5.889853986534975, 'noise_level': 0.019236228245231638, 'constant_value': 61386.44503972424, 'nu': 1.5}. Best is trial 750 with value: 0.13435342446039877.
[I 2024-12-04 15:10:47,983] Trial 972 finished with value: 1.3007739235938762 and parameters: {'kernel_type': 'Matern', 'length_scale': 0.006058467247534162, 'noise_level': 7.920136292730765e-08, 'constant_value': 431.92769419086034, 'nu': 2.5}. Best is trial 750 with value: 0.13435342446039877.
[I 2024-12-04 15:10:51,071] Trial 980 finished with value: 1.2693635028573662 and parameters: {'kernel_type': 'Matern', 'length_scale': 0.005503491057854587, 'noise_level': 0.012981080713217357, 'constant_value': 2.7961674654892485, 'nu': 1.5}. Best is trial 750 with value: 0.13435342446039877.
[I 2024-12-04 15:10:51,820] Trial 971 finished with value: 1.269363502856923 and parameters: {'kernel_type': 'RBF', 'length_scale': 43658.93541148855, 'noise_level': 0.00013267268050378575, 'constant_value': 998.5603054033314, 'nu': 0.5}. Best is trial 750 with value: 0.13435342446039877.
[I 2024-12-04 15:10:52,164] Trial 983 finished with value: 0.1343543922128893 and parameters: {'kernel_type': 'Matern', 'length_scale': 162.47892082965578, 'noise_level': 0.07139158319369955, 'constant_value': 755.2132981223374, 'nu': 1.5}. Best is trial 750 with value: 0.13435342446039877.
[I 2024-12-04 15:10:52,624] Trial 977 finished with value: 0.13435389664145508 and parameters: {'kernel_type': 'Matern', 'length_scale': 0.667561758213034, 'noise_level': 0.7628049153233979, 'constant_value': 1002.1090411060045, 'nu': 1.5}. Best is trial 750 with value: 0.13435342446039877.
[I 2024-12-04 15:10:52,900] Trial 975 finished with value: 1.269363502857172 and parameters: {'kernel_type': 'RBF', 'length_scale': 0.0036095993920542743, 'noise_level': 0.1519375280417954, 'constant_value': 0.47572626919570654, 'nu': 0.5}. Best is trial 750 with value: 0.13435342446039877.
[I 2024-12-04 15:10:53,124] Trial 985 finished with value: 0.13435437870234726 and parameters: {'kernel_type': 'Matern', 'length_scale': 13.101200089918603, 'noise_level': 0.1459824425811416, 'constant_value': 89226.44824826602, 'nu': 1.5}. Best is trial 750 with value: 0.13435342446039877.
[I 2024-12-04 15:10:58,002] Trial 979 finished with value: 1.2693635026214414 and parameters: {'kernel_type': 'Matern', 'length_scale': 0.06883710504172261, 'noise_level': 0.002658866821517581, 'constant_value': 8.419284985660816, 'nu': 1.5}. Best is trial 750 with value: 0.13435342446039877.
[I 2024-12-04 15:10:58,009] Trial 978 finished with value: 0.13435440076730376 and parameters: {'kernel_type': 'Matern', 'length_scale': 9.931504334118227, 'noise_level': 0.2494638307228129, 'constant_value': 58.08598866266585, 'nu': 1.5}. Best is trial 750 with value: 0.13435342446039877.
[I 2024-12-04 15:10:58,488] Trial 986 finished with value: 0.13435424672763785 and parameters: {'kernel_type': 'Matern', 'length_scale': 0.7490715093781266, 'noise_level': 0.03374904838918241, 'constant_value': 959.4748140802984, 'nu': 1.5}. Best is trial 750 with value: 0.13435342446039877.
[I 2024-12-04 15:10:59,080] Trial 976 finished with value: 1.2693634041846515 and parameters: {'kernel_type': 'Matern', 'length_scale': 0.09197808407376788, 'noise_level': 0.2799905308491351, 'constant_value': 32.19738421193294, 'nu': 1.5}. Best is trial 750 with value: 0.13435342446039877.
[I 2024-12-04 15:11:02,329] Trial 987 finished with value: 1.2693635028553996 and parameters: {'kernel_type': 'Matern', 'length_scale': 0.03090759257872285, 'noise_level': 0.5802499145444235, 'constant_value': 32860.2101587725, 'nu': 1.5}. Best is trial 750 with value: 0.13435342446039877.
[I 2024-12-04 15:11:03,009] Trial 982 finished with value: 0.13435439875023947 and parameters: {'kernel_type': 'Matern', 'length_scale': 5.997010069978731, 'noise_level': 0.44870572869749825, 'constant_value': 81.73093054182014, 'nu': 1.5}. Best is trial 750 with value: 0.13435342446039877.
[I 2024-12-04 15:11:03,212] Trial 984 finished with value: 0.13435438115884543 and parameters: {'kernel_type': 'Matern', 'length_scale': 0.3531450044868824, 'noise_level': 0.08557676399186881, 'constant_value': 921.0066298210805, 'nu': 1.5}. Best is trial 750 with value: 0.13435342446039877.
[I 2024-12-04 15:11:03,414] Trial 988 finished with value: 0.1343544398551115 and parameters: {'kernel_type': 'Matern', 'length_scale': 74.66720887206218, 'noise_level': 0.749696869986114, 'constant_value': 1428.9523839122749, 'nu': 1.5}. Best is trial 750 with value: 0.13435342446039877.
[I 2024-12-04 15:11:03,999] Trial 974 finished with value: 0.13435441523336944 and parameters: {'kernel_type': 'Matern', 'length_scale': 1.5473121604876796, 'noise_level': 0.5918157772710363, 'constant_value': 318.61872183345, 'nu': 1.5}. Best is trial 750 with value: 0.13435342446039877.
[I 2024-12-04 15:11:06,289] Trial 995 finished with value: 0.1343543226347238 and parameters: {'kernel_type': 'Matern', 'length_scale': 0.3770885519068936, 'noise_level': 0.02805909188080465, 'constant_value': 3.538896544038622, 'nu': 1.5}. Best is trial 750 with value: 0.13435342446039877.
[I 2024-12-04 15:11:06,388] Trial 990 finished with value: 1.2693635028571604 and parameters: {'kernel_type': 'Matern', 'length_scale': 17684.167205792575, 'noise_level': 1.814691576643513e-08, 'constant_value': 129.95214016303407, 'nu': 2.5}. Best is trial 750 with value: 0.13435342446039877.
[I 2024-12-04 15:11:06,796] Trial 989 finished with value: 0.1343544046828436 and parameters: {'kernel_type': 'Matern', 'length_scale': 0.16396695231530226, 'noise_level': 0.32404441835258957, 'constant_value': 162.10878436043086, 'nu': 1.5}. Best is trial 750 with value: 0.13435342446039877.
[I 2024-12-04 15:11:06,821] Trial 981 finished with value: 0.13435440071089597 and parameters: {'kernel_type': 'Matern', 'length_scale': 0.337379685337894, 'noise_level': 0.011109936006677971, 'constant_value': 5.976367459591203, 'nu': 1.5}. Best is trial 750 with value: 0.13435342446039877.
[I 2024-12-04 15:11:07,295] Trial 996 finished with value: 1.269363502853465 and parameters: {'kernel_type': 'Matern', 'length_scale': 0.002127040243252773, 'noise_level': 0.8484396938151182, 'constant_value': 752.7402466733975, 'nu': 1.5}. Best is trial 750 with value: 0.13435342446039877.
[I 2024-12-04 15:11:08,057] Trial 994 finished with value: 0.15167297885192746 and parameters: {'kernel_type': 'RBF', 'length_scale': 3.6206931905957753, 'noise_level': 0.6303215162409493, 'constant_value': 51208.830063786816, 'nu': 1.5}. Best is trial 750 with value: 0.13435342446039877.
[I 2024-12-04 15:11:09,481] Trial 997 finished with value: 1.2693634303389572 and parameters: {'kernel_type': 'Matern', 'length_scale': 0.09042237866812872, 'noise_level': 0.36968279220813705, 'constant_value': 349.568927205908, 'nu': 1.5}. Best is trial 750 with value: 0.13435342446039877.
[I 2024-12-04 15:11:11,943] Trial 998 finished with value: 1.2693635028579928 and parameters: {'kernel_type': 'Matern', 'length_scale': 0.006514078465539359, 'noise_level': 0.6579530054598872, 'constant_value': 6.622678710887495, 'nu': 1.5}. Best is trial 750 with value: 0.13435342446039877.
[I 2024-12-04 15:11:12,263] Trial 1001 finished with value: 0.13435440066235782 and parameters: {'kernel_type': 'Matern', 'length_scale': 2.2553354304434747, 'noise_level': 0.017876390904990647, 'constant_value': 145.1024005905158, 'nu': 1.5}. Best is trial 750 with value: 0.13435342446039877.
[I 2024-12-04 15:11:14,163] Trial 1003 finished with value: 0.1343543998086834 and parameters: {'kernel_type': 'Matern', 'length_scale': 0.6124139791166552, 'noise_level': 0.9867394690200597, 'constant_value': 808.8775443943011, 'nu': 1.5}. Best is trial 750 with value: 0.13435342446039877.
[I 2024-12-04 15:11:14,505] Trial 1006 finished with value: 1.2693635028654078 and parameters: {'kernel_type': 'Matern', 'length_scale': 0.05025528783812489, 'noise_level': 0.021872261613280007, 'constant_value': 498.5796759627444, 'nu': 1.5}. Best is trial 750 with value: 0.13435342446039877.
[I 2024-12-04 15:11:14,712] Trial 993 finished with value: 0.13435439100968996 and parameters: {'kernel_type': 'Matern', 'length_scale': 0.15447670674049807, 'noise_level': 0.5389577963461136, 'constant_value': 31278.991457177453, 'nu': 1.5}. Best is trial 750 with value: 0.13435342446039877.
[I 2024-12-04 15:11:14,767] Trial 991 finished with value: 0.17251040473503404 and parameters: {'kernel_type': 'Matern', 'length_scale': 3.1927494303552617, 'noise_level': 0.05514668655532068, 'constant_value': 2914.5289158018704, 'nu': 0.5}. Best is trial 750 with value: 0.13435342446039877.
[I 2024-12-04 15:11:17,197] Trial 1010 finished with value: 0.1343543712098698 and parameters: {'kernel_type': 'Matern', 'length_scale': 3.372730573964896, 'noise_level': 0.5219052497085528, 'constant_value': 9536.228933537988, 'nu': 1.5}. Best is trial 750 with value: 0.13435342446039877.
[I 2024-12-04 15:11:17,449] Trial 1000 finished with value: 0.13435439841258684 and parameters: {'kernel_type': 'Matern', 'length_scale': 2.783359410510406, 'noise_level': 0.2782961364265732, 'constant_value': 594.2179566301805, 'nu': 1.5}. Best is trial 750 with value: 0.13435342446039877.
[I 2024-12-04 15:11:17,672] Trial 992 finished with value: 1.2693635025557144 and parameters: {'kernel_type': 'Matern', 'length_scale': 0.06960317814945077, 'noise_level': 0.9852987085472219, 'constant_value': 1530.8015878742044, 'nu': 1.5}. Best is trial 750 with value: 0.13435342446039877.
[I 2024-12-04 15:11:18,764] Trial 1005 finished with value: 0.1516729491563351 and parameters: {'kernel_type': 'RBF', 'length_scale': 0.952437051701278, 'noise_level': 0.0102302388674622, 'constant_value': 241.55996058423182, 'nu': 1.5}. Best is trial 750 with value: 0.13435342446039877.
[I 2024-12-04 15:11:20,197] Trial 1009 finished with value: 0.1343544265088611 and parameters: {'kernel_type': 'Matern', 'length_scale': 13.826683957339718, 'noise_level': 0.6855958802806804, 'constant_value': 3659.6167986354944, 'nu': 1.5}. Best is trial 750 with value: 0.13435342446039877.
[I 2024-12-04 15:11:21,733] Trial 999 finished with value: 0.13435422629094926 and parameters: {'kernel_type': 'Matern', 'length_scale': 4.953962485164697, 'noise_level': 0.09602932368777614, 'constant_value': 679.4914515351151, 'nu': 1.5}. Best is trial 750 with value: 0.13435342446039877.
[I 2024-12-04 15:11:21,896] Trial 1013 finished with value: 0.134354309615102 and parameters: {'kernel_type': 'Matern', 'length_scale': 3.5316748670996088, 'noise_level': 0.02457919553005463, 'constant_value': 431.41852382872025, 'nu': 1.5}. Best is trial 750 with value: 0.13435342446039877.
[I 2024-12-04 15:11:24,490] Trial 1002 finished with value: 0.13435438424168886 and parameters: {'kernel_type': 'Matern', 'length_scale': 52.8120356966823, 'noise_level': 0.019612479008364932, 'constant_value': 563.9916685724419, 'nu': 1.5}. Best is trial 750 with value: 0.13435342446039877.
[I 2024-12-04 15:11:24,601] Trial 1004 finished with value: 0.13435436403485107 and parameters: {'kernel_type': 'Matern', 'length_scale': 3.4147463970052536, 'noise_level': 0.0072498205526743045, 'constant_value': 611.3870171158707, 'nu': 1.5}. Best is trial 750 with value: 0.13435342446039877.
[I 2024-12-04 15:11:25,121] Trial 1015 finished with value: 0.1343543906274355 and parameters: {'kernel_type': 'Matern', 'length_scale': 7.32365107355658, 'noise_level': 0.7848156934433792, 'constant_value': 74199.1443330748, 'nu': 1.5}. Best is trial 750 with value: 0.13435342446039877.
[I 2024-12-04 15:11:25,191] Trial 1008 finished with value: 0.13435439824196999 and parameters: {'kernel_type': 'Matern', 'length_scale': 0.3686091981231509, 'noise_level': 0.01611481123861421, 'constant_value': 706.0909382392631, 'nu': 1.5}. Best is trial 750 with value: 0.13435342446039877.
[I 2024-12-04 15:11:25,203] Trial 1014 finished with value: 0.13435441141484494 and parameters: {'kernel_type': 'Matern', 'length_scale': 25.708621902092393, 'noise_level': 0.0004140503148325753, 'constant_value': 243.4761608282043, 'nu': 1.5}. Best is trial 750 with value: 0.13435342446039877.
[I 2024-12-04 15:11:25,877] Trial 1017 finished with value: 0.17251040178860963 and parameters: {'kernel_type': 'Matern', 'length_scale': 43.74414772923956, 'noise_level': 0.12509645401990774, 'constant_value': 121.19799628821316, 'nu': 0.5}. Best is trial 750 with value: 0.13435342446039877.
[I 2024-12-04 15:11:26,137] Trial 1012 finished with value: 0.13435399824500838 and parameters: {'kernel_type': 'Matern', 'length_scale': 17.66535048836601, 'noise_level': 0.343915361930569, 'constant_value': 2.363953852415751, 'nu': 1.5}. Best is trial 750 with value: 0.13435342446039877.
[I 2024-12-04 15:11:29,229] Trial 1021 finished with value: 0.1343545111397297 and parameters: {'kernel_type': 'Matern', 'length_scale': 16.444820270746348, 'noise_level': 0.014293713308933958, 'constant_value': 77682.68826093824, 'nu': 1.5}. Best is trial 750 with value: 0.13435342446039877.
[I 2024-12-04 15:11:30,656] Trial 1016 finished with value: 0.14859829743594383 and parameters: {'kernel_type': 'Matern', 'length_scale': 64.08044648236105, 'noise_level': 0.02697215133290066, 'constant_value': 98.8231750349106, 'nu': 2.5}. Best is trial 750 with value: 0.13435342446039877.
[I 2024-12-04 15:11:30,660] Trial 1011 finished with value: 0.1516729857509466 and parameters: {'kernel_type': 'RBF', 'length_scale': 196.793466323517, 'noise_level': 0.7948572471408959, 'constant_value': 43532.88475018043, 'nu': 1.5}. Best is trial 750 with value: 0.13435342446039877.
[I 2024-12-04 15:11:30,718] Trial 1020 finished with value: 0.1343543997502314 and parameters: {'kernel_type': 'Matern', 'length_scale': 18.24873951005251, 'noise_level': 0.9786271330800093, 'constant_value': 69608.72067702073, 'nu': 1.5}. Best is trial 750 with value: 0.13435342446039877.
[I 2024-12-04 15:11:30,725] Trial 1022 finished with value: 0.13435439496624063 and parameters: {'kernel_type': 'Matern', 'length_scale': 0.7489524949019137, 'noise_level': 0.0004540297647293192, 'constant_value': 4784.117145155235, 'nu': 1.5}. Best is trial 750 with value: 0.13435342446039877.
[I 2024-12-04 15:11:34,999] Trial 1007 finished with value: 0.13435443059550514 and parameters: {'kernel_type': 'Matern', 'length_scale': 54.1584528397793, 'noise_level': 0.0063660720862211, 'constant_value': 672.463876809934, 'nu': 1.5}. Best is trial 750 with value: 0.13435342446039877.
[I 2024-12-04 15:11:36,331] Trial 1019 finished with value: 1.2693635028568784 and parameters: {'kernel_type': 'Matern', 'length_scale': 4.748956440429357e-05, 'noise_level': 8.307089926302252e-05, 'constant_value': 3.98259145699155, 'nu': 0.5}. Best is trial 750 with value: 0.13435342446039877.
[I 2024-12-04 15:11:36,794] Trial 1018 finished with value: 0.14859826363302037 and parameters: {'kernel_type': 'Matern', 'length_scale': 5.016993227406563, 'noise_level': 0.0475875255705011, 'constant_value': 35997.85627454179, 'nu': 2.5}. Best is trial 750 with value: 0.13435342446039877.
[I 2024-12-04 15:11:39,240] Trial 1024 finished with value: 1.2693635028569692 and parameters: {'kernel_type': 'RBF', 'length_scale': 0.012859820203639283, 'noise_level': 7.369328989779203e-07, 'constant_value': 1.5018739824936132e-07, 'nu': 1.5}. Best is trial 750 with value: 0.13435342446039877.
[I 2024-12-04 15:11:39,376] Trial 1023 finished with value: 0.13435434583413464 and parameters: {'kernel_type': 'Matern', 'length_scale': 4.870095803908196, 'noise_level': 0.009123727743569128, 'constant_value': 1221.7235875489384, 'nu': 1.5}. Best is trial 750 with value: 0.13435342446039877.
[I 2024-12-04 15:11:40,034] Trial 1031 finished with value: 1.300774589812253 and parameters: {'kernel_type': 'Matern', 'length_scale': 3164.2092980738835, 'noise_level': 0.3721131322083427, 'constant_value': 7.179001014215759e-07, 'nu': 1.5}. Best is trial 750 with value: 0.13435342446039877.
[I 2024-12-04 15:11:40,690] Trial 1029 finished with value: 1.269363502848626 and parameters: {'kernel_type': 'Matern', 'length_scale': 4.001039611855684e-05, 'noise_level': 0.0005354704907592038, 'constant_value': 0.0009783215645377593, 'nu': 2.5}. Best is trial 750 with value: 0.13435342446039877.
[I 2024-12-04 15:11:40,709] Trial 1027 finished with value: 0.13435437819396942 and parameters: {'kernel_type': 'Matern', 'length_scale': 8.462882837299574, 'noise_level': 0.9415675654175626, 'constant_value': 55.92057429836071, 'nu': 1.5}. Best is trial 750 with value: 0.13435342446039877.
[I 2024-12-04 15:11:41,056] Trial 1025 finished with value: 1.269363502856967 and parameters: {'kernel_type': 'RBF', 'length_scale': 40081.698074880325, 'noise_level': 1.5847399046635905e-09, 'constant_value': 0.3005386209272326, 'nu': 0.5}. Best is trial 750 with value: 0.13435342446039877.
[I 2024-12-04 15:11:42,021] Trial 1026 finished with value: 0.13435444666712412 and parameters: {'kernel_type': 'Matern', 'length_scale': 147.83901753943744, 'noise_level': 0.5548593706855508, 'constant_value': 68.84434825502531, 'nu': 1.5}. Best is trial 750 with value: 0.13435342446039877.
[I 2024-12-04 15:11:43,075] Trial 1030 finished with value: 0.13435439883393072 and parameters: {'kernel_type': 'Matern', 'length_scale': 0.9256197193191992, 'noise_level': 0.9950882015347025, 'constant_value': 0.09586985731151053, 'nu': 1.5}. Best is trial 750 with value: 0.13435342446039877.
[I 2024-12-04 15:11:43,516] Trial 1028 finished with value: 0.13435452978273274 and parameters: {'kernel_type': 'Matern', 'length_scale': 8.161357308785284, 'noise_level': 0.0027200174196175815, 'constant_value': 1363.3690359325396, 'nu': 1.5}. Best is trial 750 with value: 0.13435342446039877.
[I 2024-12-04 15:11:44,069] Trial 1032 finished with value: 0.1343544915877644 and parameters: {'kernel_type': 'Matern', 'length_scale': 264.81854690005696, 'noise_level': 0.6365805602273915, 'constant_value': 7.5250444238813685, 'nu': 1.5}. Best is trial 750 with value: 0.13435342446039877.
[I 2024-12-04 15:11:44,296] Trial 1033 finished with value: 0.13435440239745508 and parameters: {'kernel_type': 'Matern', 'length_scale': 21.77764406818474, 'noise_level': 0.0608314332098067, 'constant_value': 0.10429984994801299, 'nu': 1.5}. Best is trial 750 with value: 0.13435342446039877.
[I 2024-12-04 15:11:48,076] Trial 1035 finished with value: 0.13435443688129936 and parameters: {'kernel_type': 'Matern', 'length_scale': 12.119592675233864, 'noise_level': 0.38579435616676816, 'constant_value': 0.3586069067451228, 'nu': 1.5}. Best is trial 750 with value: 0.13435342446039877.
[I 2024-12-04 15:11:48,276] Trial 1037 finished with value: 0.13435437394247415 and parameters: {'kernel_type': 'Matern', 'length_scale': 77.21021189143367, 'noise_level': 0.6762230303532137, 'constant_value': 2.912449704021194, 'nu': 1.5}. Best is trial 750 with value: 0.13435342446039877.
[I 2024-12-04 15:11:50,015] Trial 1041 finished with value: 0.13435438744172154 and parameters: {'kernel_type': 'Matern', 'length_scale': 41.48604588788693, 'noise_level': 0.2650963656732767, 'constant_value': 3.6106939722898015, 'nu': 1.5}. Best is trial 750 with value: 0.13435342446039877.
[I 2024-12-04 15:11:53,666] Trial 1039 finished with value: 0.13435437999661218 and parameters: {'kernel_type': 'Matern', 'length_scale': 62.471855550825, 'noise_level': 0.02320835898443717, 'constant_value': 65.45936792074623, 'nu': 1.5}. Best is trial 750 with value: 0.13435342446039877.
[I 2024-12-04 15:11:54,940] Trial 1044 finished with value: 0.13435440218587918 and parameters: {'kernel_type': 'Matern', 'length_scale': 4.3213328669191675, 'noise_level': 0.004154892764635566, 'constant_value': 1.3287433637441215, 'nu': 1.5}. Best is trial 750 with value: 0.13435342446039877.
[I 2024-12-04 15:11:55,978] Trial 1045 finished with value: 0.13435439991570894 and parameters: {'kernel_type': 'Matern', 'length_scale': 0.951923171209233, 'noise_level': 0.04909004487201388, 'constant_value': 67.63878369464133, 'nu': 1.5}. Best is trial 750 with value: 0.13435342446039877.
[I 2024-12-04 15:11:56,299] Trial 1034 finished with value: 0.13435457620913455 and parameters: {'kernel_type': 'Matern', 'length_scale': 150.14112358514646, 'noise_level': 0.0032749257774148275, 'constant_value': 8.555816178873464, 'nu': 1.5}. Best is trial 750 with value: 0.13435342446039877.
