[I 2024-12-04 12:46:35,877] Trial 931 finished with value: 0.36559827869620876 and parameters: {'n_estimators': 1464, 'learning_rate': 0.09246811770441833, 'max_depth': 11, 'min_samples_split': 5, 'min_samples_leaf': 3, 'subsample': 0.6288487124637383, 'max_features': 'sqrt'}. Best is trial 621 with value: 0.2256726988932517.
[I 2024-12-04 12:46:35,951] Trial 962 finished with value: 0.5014050386852817 and parameters: {'n_estimators': 278, 'learning_rate': 0.026032083658640206, 'max_depth': 8, 'min_samples_split': 15, 'min_samples_leaf': 3, 'subsample': 0.9303164061552905, 'max_features': 'sqrt'}. Best is trial 621 with value: 0.2256726988932517.
[I 2024-12-04 12:46:37,627] Trial 932 finished with value: 0.4153628263204074 and parameters: {'n_estimators': 1303, 'learning_rate': 0.09089128033147822, 'max_depth': 8, 'min_samples_split': 7, 'min_samples_leaf': 4, 'subsample': 0.9154323162286915, 'max_features': None}. Best is trial 621 with value: 0.2256726988932517.
[I 2024-12-04 12:46:42,384] Trial 941 finished with value: 0.29737224993081846 and parameters: {'n_estimators': 1139, 'learning_rate': 0.09497147329930128, 'max_depth': 5, 'min_samples_split': 2, 'min_samples_leaf': 2, 'subsample': 0.6734894592701546, 'max_features': 'sqrt'}. Best is trial 621 with value: 0.2256726988932517.
[I 2024-12-04 12:46:43,264] Trial 938 finished with value: 0.2494411890448037 and parameters: {'n_estimators': 1340, 'learning_rate': 0.09757791561904262, 'max_depth': 5, 'min_samples_split': 5, 'min_samples_leaf': 1, 'subsample': 0.7801113328116234, 'max_features': 'sqrt'}. Best is trial 621 with value: 0.2256726988932517.
[I 2024-12-04 12:46:43,342] Trial 940 finished with value: 0.33294807032882917 and parameters: {'n_estimators': 1097, 'learning_rate': 0.09168041410845272, 'max_depth': 8, 'min_samples_split': 8, 'min_samples_leaf': 1, 'subsample': 0.9036467625942451, 'max_features': None}. Best is trial 621 with value: 0.2256726988932517.
[I 2024-12-04 12:46:45,327] Trial 949 finished with value: 0.2871824105360058 and parameters: {'n_estimators': 890, 'learning_rate': 0.09875927409690916, 'max_depth': 10, 'min_samples_split': 7, 'min_samples_leaf': 1, 'subsample': 0.8846374421088388, 'max_features': 'sqrt'}. Best is trial 621 with value: 0.2256726988932517.
[I 2024-12-04 12:46:46,865] Trial 942 finished with value: 0.24328694826739422 and parameters: {'n_estimators': 1175, 'learning_rate': 0.05932940528162162, 'max_depth': 12, 'min_samples_split': 5, 'min_samples_leaf': 1, 'subsample': 0.720640567584974, 'max_features': 'sqrt'}. Best is trial 621 with value: 0.2256726988932517.
[I 2024-12-04 12:46:48,905] Trial 944 finished with value: 0.2867036708080558 and parameters: {'n_estimators': 1144, 'learning_rate': 0.08396030469123038, 'max_depth': 5, 'min_samples_split': 2, 'min_samples_leaf': 2, 'subsample': 0.7418777254009095, 'max_features': 'sqrt'}. Best is trial 621 with value: 0.2256726988932517.
[I 2024-12-04 12:46:51,532] Trial 943 finished with value: 0.3491495297620902 and parameters: {'n_estimators': 1232, 'learning_rate': 0.054779721671468565, 'max_depth': 12, 'min_samples_split': 2, 'min_samples_leaf': 3, 'subsample': 0.6388598608051268, 'max_features': 'sqrt'}. Best is trial 621 with value: 0.2256726988932517.
[I 2024-12-04 12:46:54,981] Trial 945 finished with value: 0.26295775410683636 and parameters: {'n_estimators': 1195, 'learning_rate': 0.04092475279374441, 'max_depth': 11, 'min_samples_split': 3, 'min_samples_leaf': 1, 'subsample': 0.660797515829796, 'max_features': 'sqrt'}. Best is trial 621 with value: 0.2256726988932517.
[I 2024-12-04 12:46:55,456] Trial 961 finished with value: 1.122302733242932 and parameters: {'n_estimators': 635, 'learning_rate': 0.012252186966797548, 'max_depth': 8, 'min_samples_split': 4, 'min_samples_leaf': 9, 'subsample': 0.7209781438123244, 'max_features': 'log2'}. Best is trial 621 with value: 0.2256726988932517.
[I 2024-12-04 12:47:05,299] Trial 946 finished with value: 0.35566831066390453 and parameters: {'n_estimators': 1406, 'learning_rate': 0.09434204272224718, 'max_depth': 7, 'min_samples_split': 5, 'min_samples_leaf': 3, 'subsample': 0.7177825933439613, 'max_features': 'sqrt'}. Best is trial 621 with value: 0.2256726988932517.
[I 2024-12-04 12:47:08,024] Trial 950 finished with value: 0.4552593107810139 and parameters: {'n_estimators': 1221, 'learning_rate': 0.01788578831929099, 'max_depth': 8, 'min_samples_split': 15, 'min_samples_leaf': 8, 'subsample': 0.7674961760575773, 'max_features': None}. Best is trial 621 with value: 0.2256726988932517.
[I 2024-12-04 12:47:10,138] Trial 948 finished with value: 0.29762069141160274 and parameters: {'n_estimators': 1385, 'learning_rate': 0.0666769884787821, 'max_depth': 6, 'min_samples_split': 7, 'min_samples_leaf': 2, 'subsample': 0.8026236315620044, 'max_features': 'sqrt'}. Best is trial 621 with value: 0.2256726988932517.
[I 2024-12-04 12:47:10,352] Trial 952 finished with value: 0.2538602463324261 and parameters: {'n_estimators': 1270, 'learning_rate': 0.08650269154209127, 'max_depth': 7, 'min_samples_split': 7, 'min_samples_leaf': 1, 'subsample': 0.7305925349117572, 'max_features': 'sqrt'}. Best is trial 621 with value: 0.2256726988932517.
[I 2024-12-04 12:47:12,532] Trial 953 finished with value: 0.2449680814236833 and parameters: {'n_estimators': 1225, 'learning_rate': 0.09591623968872309, 'max_depth': 8, 'min_samples_split': 2, 'min_samples_leaf': 1, 'subsample': 0.8741295591583895, 'max_features': 'sqrt'}. Best is trial 621 with value: 0.2256726988932517.
[I 2024-12-04 12:47:13,260] Trial 947 finished with value: 0.34407346832090224 and parameters: {'n_estimators': 1448, 'learning_rate': 0.09623566531699909, 'max_depth': 7, 'min_samples_split': 6, 'min_samples_leaf': 3, 'subsample': 0.8494162175323138, 'max_features': 'sqrt'}. Best is trial 621 with value: 0.2256726988932517.
[I 2024-12-04 12:47:17,007] Trial 951 finished with value: 0.2820387544200449 and parameters: {'n_estimators': 1253, 'learning_rate': 0.09322241711811273, 'max_depth': 9, 'min_samples_split': 8, 'min_samples_leaf': 1, 'subsample': 0.6579330065366283, 'max_features': None}. Best is trial 621 with value: 0.2256726988932517.
[I 2024-12-04 12:47:17,904] Trial 954 finished with value: 0.24412210767964376 and parameters: {'n_estimators': 1278, 'learning_rate': 0.07548176107644076, 'max_depth': 7, 'min_samples_split': 4, 'min_samples_leaf': 1, 'subsample': 0.8204846511500974, 'max_features': 'sqrt'}. Best is trial 621 with value: 0.2256726988932517.
[I 2024-12-04 12:47:19,505] Trial 959 finished with value: 0.23974176722587728 and parameters: {'n_estimators': 1118, 'learning_rate': 0.06187458036513074, 'max_depth': 7, 'min_samples_split': 5, 'min_samples_leaf': 1, 'subsample': 0.9069787288719444, 'max_features': 'sqrt'}. Best is trial 621 with value: 0.2256726988932517.
[I 2024-12-04 12:47:28,368] Trial 956 finished with value: 0.2504679449526784 and parameters: {'n_estimators': 1409, 'learning_rate': 0.07398407021440936, 'max_depth': 10, 'min_samples_split': 6, 'min_samples_leaf': 1, 'subsample': 0.6024522581299909, 'max_features': 'sqrt'}. Best is trial 621 with value: 0.2256726988932517.
[I 2024-12-04 12:47:30,169] Trial 955 finished with value: 0.30104835580977424 and parameters: {'n_estimators': 1484, 'learning_rate': 0.08532104045616111, 'max_depth': 9, 'min_samples_split': 2, 'min_samples_leaf': 2, 'subsample': 0.8521722048264609, 'max_features': 'sqrt'}. Best is trial 621 with value: 0.2256726988932517.
[I 2024-12-04 12:47:32,890] Trial 958 finished with value: 0.4512941467056107 and parameters: {'n_estimators': 1426, 'learning_rate': 0.031964951481763725, 'max_depth': 11, 'min_samples_split': 17, 'min_samples_leaf': 9, 'subsample': 0.8103244553907224, 'max_features': 'sqrt'}. Best is trial 621 with value: 0.2256726988932517.
[I 2024-12-04 12:47:34,492] Trial 957 finished with value: 0.24388036928923468 and parameters: {'n_estimators': 1446, 'learning_rate': 0.06046300086436183, 'max_depth': 9, 'min_samples_split': 6, 'min_samples_leaf': 1, 'subsample': 0.8305452415353083, 'max_features': 'sqrt'}. Best is trial 621 with value: 0.2256726988932517.
[I 2024-12-04 12:47:40,709] Trial 969 finished with value: 0.26397320043134875 and parameters: {'n_estimators': 1000, 'learning_rate': 0.09449750783367594, 'max_depth': 8, 'min_samples_split': 6, 'min_samples_leaf': 1, 'subsample': 0.9258684811374593, 'max_features': 'sqrt'}. Best is trial 621 with value: 0.2256726988932517.
[I 2024-12-04 12:47:41,609] Trial 963 finished with value: 0.24240781977997305 and parameters: {'n_estimators': 1298, 'learning_rate': 0.05883813772987433, 'max_depth': 12, 'min_samples_split': 5, 'min_samples_leaf': 1, 'subsample': 0.710439410959102, 'max_features': 'sqrt'}. Best is trial 621 with value: 0.2256726988932517.
[I 2024-12-04 12:47:47,404] Trial 968 finished with value: 0.3286977925135408 and parameters: {'n_estimators': 1218, 'learning_rate': 0.08589678301199186, 'max_depth': 9, 'min_samples_split': 5, 'min_samples_leaf': 2, 'subsample': 0.8098085820006098, 'max_features': 'sqrt'}. Best is trial 621 with value: 0.2256726988932517.
[I 2024-12-04 12:47:50,070] Trial 964 finished with value: 0.23297027749778054 and parameters: {'n_estimators': 1434, 'learning_rate': 0.07560008097982493, 'max_depth': 8, 'min_samples_split': 3, 'min_samples_leaf': 1, 'subsample': 0.8156256561554546, 'max_features': 'sqrt'}. Best is trial 621 with value: 0.2256726988932517.
[I 2024-12-04 12:47:51,532] Trial 965 finished with value: 0.27564674681991225 and parameters: {'n_estimators': 1437, 'learning_rate': 0.0856806027048384, 'max_depth': 9, 'min_samples_split': 5, 'min_samples_leaf': 1, 'subsample': 0.7609644320430561, 'max_features': 'sqrt'}. Best is trial 621 with value: 0.2256726988932517.
[I 2024-12-04 12:47:51,535] Trial 966 finished with value: 0.29690290831537586 and parameters: {'n_estimators': 1428, 'learning_rate': 0.0884830906658214, 'max_depth': 9, 'min_samples_split': 5, 'min_samples_leaf': 2, 'subsample': 0.7344147579442493, 'max_features': 'sqrt'}. Best is trial 621 with value: 0.2256726988932517.
[I 2024-12-04 12:47:52,281] Trial 967 finished with value: 0.29711607496854586 and parameters: {'n_estimators': 1360, 'learning_rate': 0.08043943872016304, 'max_depth': 4, 'min_samples_split': 2, 'min_samples_leaf': 2, 'subsample': 0.7042771840864657, 'max_features': 'sqrt'}. Best is trial 621 with value: 0.2256726988932517.
[I 2024-12-04 12:47:57,394] Trial 994 finished with value: 0.7149499231465558 and parameters: {'n_estimators': 293, 'learning_rate': 0.029960205638056937, 'max_depth': 9, 'min_samples_split': 5, 'min_samples_leaf': 8, 'subsample': 0.6038613601859586, 'max_features': 'sqrt'}. Best is trial 621 with value: 0.2256726988932517.
[I 2024-12-04 12:47:58,555] Trial 976 finished with value: 0.36574581462492567 and parameters: {'n_estimators': 1071, 'learning_rate': 0.09616966516936984, 'max_depth': 8, 'min_samples_split': 3, 'min_samples_leaf': 3, 'subsample': 0.9796065087568055, 'max_features': 'sqrt'}. Best is trial 621 with value: 0.2256726988932517.
[I 2024-12-04 12:48:00,747] Trial 978 finished with value: 0.29635790035024207 and parameters: {'n_estimators': 985, 'learning_rate': 0.05301237663722228, 'max_depth': 12, 'min_samples_split': 2, 'min_samples_leaf': 2, 'subsample': 0.727969739950423, 'max_features': 'sqrt'}. Best is trial 621 with value: 0.2256726988932517.
[I 2024-12-04 12:48:01,130] Trial 987 finished with value: 0.34987778868131764 and parameters: {'n_estimators': 657, 'learning_rate': 0.07465010691010918, 'max_depth': 5, 'min_samples_split': 3, 'min_samples_leaf': 3, 'subsample': 0.8312349619651069, 'max_features': 'sqrt'}. Best is trial 621 with value: 0.2256726988932517.
[I 2024-12-04 12:48:04,533] Trial 979 finished with value: 0.3504990604782208 and parameters: {'n_estimators': 919, 'learning_rate': 0.09516596100256768, 'max_depth': 8, 'min_samples_split': 2, 'min_samples_leaf': 1, 'subsample': 0.9667747573765147, 'max_features': None}. Best is trial 621 with value: 0.2256726988932517.
[I 2024-12-04 12:48:06,017] Trial 974 finished with value: 0.3481876420884032 and parameters: {'n_estimators': 1194, 'learning_rate': 0.05829301040160354, 'max_depth': 8, 'min_samples_split': 10, 'min_samples_leaf': 3, 'subsample': 0.6937774299178183, 'max_features': 'sqrt'}. Best is trial 621 with value: 0.2256726988932517.
[I 2024-12-04 12:48:07,672] Trial 971 finished with value: 0.24831034148021644 and parameters: {'n_estimators': 1383, 'learning_rate': 0.09173366540426764, 'max_depth': 12, 'min_samples_split': 7, 'min_samples_leaf': 1, 'subsample': 0.6469896878500153, 'max_features': 'sqrt'}. Best is trial 621 with value: 0.2256726988932517.
[I 2024-12-04 12:48:13,161] Trial 988 finished with value: 0.41476847682220774 and parameters: {'n_estimators': 772, 'learning_rate': 0.05513380778347617, 'max_depth': 4, 'min_samples_split': 20, 'min_samples_leaf': 5, 'subsample': 0.9751579220539166, 'max_features': None}. Best is trial 621 with value: 0.2256726988932517.
[I 2024-12-04 12:48:15,736] Trial 970 finished with value: 0.3985003883149639 and parameters: {'n_estimators': 1459, 'learning_rate': 0.06049457391840581, 'max_depth': 5, 'min_samples_split': 5, 'min_samples_leaf': 4, 'subsample': 0.8226669989394808, 'max_features': None}. Best is trial 621 with value: 0.2256726988932517.
[I 2024-12-04 12:48:16,757] Trial 977 finished with value: 0.24703052159899314 and parameters: {'n_estimators': 1314, 'learning_rate': 0.055064891204262105, 'max_depth': 12, 'min_samples_split': 7, 'min_samples_leaf': 1, 'subsample': 0.6110396715599696, 'max_features': 'sqrt'}. Best is trial 621 with value: 0.2256726988932517.
[I 2024-12-04 12:48:18,051] Trial 972 finished with value: 0.27902276877309884 and parameters: {'n_estimators': 1499, 'learning_rate': 0.08444711664929094, 'max_depth': 5, 'min_samples_split': 10, 'min_samples_leaf': 1, 'subsample': 0.7738690832519244, 'max_features': 'sqrt'}. Best is trial 621 with value: 0.2256726988932517.
[I 2024-12-04 12:48:19,836] Trial 975 finished with value: 0.25128953756313827 and parameters: {'n_estimators': 1426, 'learning_rate': 0.08020585963362958, 'max_depth': 9, 'min_samples_split': 3, 'min_samples_leaf': 1, 'subsample': 0.698462763728094, 'max_features': 'sqrt'}. Best is trial 621 with value: 0.2256726988932517.
[I 2024-12-04 12:48:23,108] Trial 989 finished with value: 0.2582573136382904 and parameters: {'n_estimators': 908, 'learning_rate': 0.07313634016164874, 'max_depth': 7, 'min_samples_split': 2, 'min_samples_leaf': 1, 'subsample': 0.8798812444228424, 'max_features': 'sqrt'}. Best is trial 621 with value: 0.2256726988932517.
[I 2024-12-04 12:48:23,127] Trial 984 finished with value: 0.6167190244465178 and parameters: {'n_estimators': 1139, 'learning_rate': 0.049234931630607534, 'max_depth': 7, 'min_samples_split': 13, 'min_samples_leaf': 10, 'subsample': 0.9889979003075141, 'max_features': 'log2'}. Best is trial 621 with value: 0.2256726988932517.
[I 2024-12-04 12:48:25,802] Trial 973 finished with value: 0.36108185523670566 and parameters: {'n_estimators': 1432, 'learning_rate': 0.05822079568424345, 'max_depth': 12, 'min_samples_split': 5, 'min_samples_leaf': 3, 'subsample': 0.7794238514137725, 'max_features': 'sqrt'}. Best is trial 621 with value: 0.2256726988932517.
[I 2024-12-04 12:48:25,897] Trial 982 finished with value: 0.3008835938231195 and parameters: {'n_estimators': 1227, 'learning_rate': 0.025225223705418194, 'max_depth': 8, 'min_samples_split': 7, 'min_samples_leaf': 2, 'subsample': 0.644044136872302, 'max_features': 'sqrt'}. Best is trial 621 with value: 0.2256726988932517.
[I 2024-12-04 12:48:25,898] Trial 992 finished with value: 0.4369290321825944 and parameters: {'n_estimators': 826, 'learning_rate': 0.054439085624154546, 'max_depth': 11, 'min_samples_split': 18, 'min_samples_leaf': 5, 'subsample': 0.9886629750259245, 'max_features': 'log2'}. Best is trial 621 with value: 0.2256726988932517.
[I 2024-12-04 12:48:27,977] Trial 983 finished with value: 0.23982329717510886 and parameters: {'n_estimators': 1210, 'learning_rate': 0.05933979808918956, 'max_depth': 10, 'min_samples_split': 3, 'min_samples_leaf': 1, 'subsample': 0.6187191708451917, 'max_features': 'sqrt'}. Best is trial 621 with value: 0.2256726988932517.
[I 2024-12-04 12:48:29,466] Trial 1009 finished with value: 0.45874984896343957 and parameters: {'n_estimators': 182, 'learning_rate': 0.04913157480503343, 'max_depth': 9, 'min_samples_split': 3, 'min_samples_leaf': 7, 'subsample': 0.9641044956485937, 'max_features': None}. Best is trial 621 with value: 0.2256726988932517.
[I 2024-12-04 12:48:30,403] Trial 995 finished with value: 0.8300119690987675 and parameters: {'n_estimators': 763, 'learning_rate': 0.025775000381072423, 'max_depth': 11, 'min_samples_split': 15, 'min_samples_leaf': 10, 'subsample': 0.9883698562988812, 'max_features': 'log2'}. Best is trial 621 with value: 0.2256726988932517.
[I 2024-12-04 12:48:32,800] Trial 986 finished with value: 0.28317095523339003 and parameters: {'n_estimators': 1201, 'learning_rate': 0.058476284729322724, 'max_depth': 9, 'min_samples_split': 3, 'min_samples_leaf': 2, 'subsample': 0.9591794771985046, 'max_features': 'sqrt'}. Best is trial 621 with value: 0.2256726988932517.
[I 2024-12-04 12:48:33,731] Trial 980 finished with value: 0.25503363350514174 and parameters: {'n_estimators': 1488, 'learning_rate': 0.08679161218870725, 'max_depth': 7, 'min_samples_split': 5, 'min_samples_leaf': 1, 'subsample': 0.7624792053441733, 'max_features': 'sqrt'}. Best is trial 621 with value: 0.2256726988932517.
[I 2024-12-04 12:48:35,926] Trial 981 finished with value: 0.254929616321609 and parameters: {'n_estimators': 1500, 'learning_rate': 0.07119871834356344, 'max_depth': 10, 'min_samples_split': 5, 'min_samples_leaf': 1, 'subsample': 0.7122325315355091, 'max_features': 'sqrt'}. Best is trial 621 with value: 0.2256726988932517.
[I 2024-12-04 12:48:37,544] Trial 1004 finished with value: 0.4523775483485739 and parameters: {'n_estimators': 455, 'learning_rate': 0.016326953996683748, 'max_depth': 6, 'min_samples_split': 12, 'min_samples_leaf': 6, 'subsample': 0.9974472517506332, 'max_features': None}. Best is trial 621 with value: 0.2256726988932517.
[I 2024-12-04 12:48:37,554] Trial 985 finished with value: 0.3798808462386098 and parameters: {'n_estimators': 1330, 'learning_rate': 0.05660709246553248, 'max_depth': 5, 'min_samples_split': 3, 'min_samples_leaf': 3, 'subsample': 0.7380890616506773, 'max_features': 'log2'}. Best is trial 621 with value: 0.2256726988932517.
[I 2024-12-04 12:48:42,709] Trial 993 finished with value: 0.3015179869740156 and parameters: {'n_estimators': 1057, 'learning_rate': 0.09907662407621867, 'max_depth': 12, 'min_samples_split': 3, 'min_samples_leaf': 1, 'subsample': 0.7098191572443686, 'max_features': 'sqrt'}. Best is trial 621 with value: 0.2256726988932517.
[I 2024-12-04 12:48:42,903] Trial 990 finished with value: 0.24431350189973194 and parameters: {'n_estimators': 1220, 'learning_rate': 0.059345639246203404, 'max_depth': 7, 'min_samples_split': 9, 'min_samples_leaf': 1, 'subsample': 0.8578089384128071, 'max_features': 'sqrt'}. Best is trial 621 with value: 0.2256726988932517.
[I 2024-12-04 12:48:46,512] Trial 1013 finished with value: 1.1126547691487032 and parameters: {'n_estimators': 253, 'learning_rate': 0.019568194207751348, 'max_depth': 10, 'min_samples_split': 3, 'min_samples_leaf': 7, 'subsample': 0.9454427211493763, 'max_features': 'log2'}. Best is trial 621 with value: 0.2256726988932517.
[I 2024-12-04 12:48:46,514] Trial 991 finished with value: 0.28881006211113586 and parameters: {'n_estimators': 1173, 'learning_rate': 0.03598724578888914, 'max_depth': 12, 'min_samples_split': 5, 'min_samples_leaf': 2, 'subsample': 0.6841380244212805, 'max_features': 'sqrt'}. Best is trial 621 with value: 0.2256726988932517.
[I 2024-12-04 12:48:51,673] Trial 1005 finished with value: 0.29758026695206813 and parameters: {'n_estimators': 678, 'learning_rate': 0.0915115736404106, 'max_depth': 8, 'min_samples_split': 7, 'min_samples_leaf': 1, 'subsample': 0.9428874123412047, 'max_features': 'sqrt'}. Best is trial 621 with value: 0.2256726988932517.
[I 2024-12-04 12:48:57,004] Trial 1017 finished with value: 0.36202756250524315 and parameters: {'n_estimators': 319, 'learning_rate': 0.017898875841272706, 'max_depth': 8, 'min_samples_split': 12, 'min_samples_leaf': 2, 'subsample': 0.7314159396638479, 'max_features': None}. Best is trial 621 with value: 0.2256726988932517.
[I 2024-12-04 12:49:05,154] Trial 1001 finished with value: 0.23990416083916588 and parameters: {'n_estimators': 1160, 'learning_rate': 0.07470648154205135, 'max_depth': 9, 'min_samples_split': 4, 'min_samples_leaf': 1, 'subsample': 0.8113947780182796, 'max_features': 'sqrt'}. Best is trial 621 with value: 0.2256726988932517.
[I 2024-12-04 12:49:09,519] Trial 996 finished with value: 0.2934020685807308 and parameters: {'n_estimators': 1483, 'learning_rate': 0.09728468955946015, 'max_depth': 7, 'min_samples_split': 2, 'min_samples_leaf': 2, 'subsample': 0.7535118558524212, 'max_features': 'sqrt'}. Best is trial 621 with value: 0.2256726988932517.
[I 2024-12-04 12:49:12,586] Trial 1002 finished with value: 0.2623782047239871 and parameters: {'n_estimators': 1224, 'learning_rate': 0.0973559513179689, 'max_depth': 9, 'min_samples_split': 2, 'min_samples_leaf': 1, 'subsample': 0.8224846482716973, 'max_features': 'sqrt'}. Best is trial 621 with value: 0.2256726988932517.
[I 2024-12-04 12:49:12,606] Trial 1018 finished with value: 0.4320670997099819 and parameters: {'n_estimators': 547, 'learning_rate': 0.0784672039661988, 'max_depth': 6, 'min_samples_split': 13, 'min_samples_leaf': 6, 'subsample': 0.9800226249340345, 'max_features': None}. Best is trial 621 with value: 0.2256726988932517.
