[I 2024-12-04 15:16:40,818] Trial 1732 finished with value: 0.6324459502858465 and parameters: {'n_estimators': 958, 'learning_rate': 0.08755325173560126, 'max_depth': 12, 'min_samples_split': 18, 'min_samples_leaf': 2, 'subsample': 0.9986099020593708, 'max_features': None}. Best is trial 1435 with value: 0.45467030752684195.
[I 2024-12-04 15:16:43,214] Trial 1737 finished with value: 0.47826080281043676 and parameters: {'n_estimators': 890, 'learning_rate': 0.08833614880234567, 'max_depth': 12, 'min_samples_split': 17, 'min_samples_leaf': 1, 'subsample': 0.9922419306343131, 'max_features': None}. Best is trial 1435 with value: 0.45467030752684195.
[I 2024-12-04 15:16:44,542] Trial 1731 finished with value: 0.6583874800357804 and parameters: {'n_estimators': 1391, 'learning_rate': 0.035176755105441604, 'max_depth': 4, 'min_samples_split': 3, 'min_samples_leaf': 2, 'subsample': 0.7093179179343007, 'max_features': 'sqrt'}. Best is trial 1435 with value: 0.45467030752684195.
[I 2024-12-04 15:16:47,310] Trial 1751 finished with value: 0.7653277239246681 and parameters: {'n_estimators': 639, 'learning_rate': 0.012281522145660518, 'max_depth': 3, 'min_samples_split': 3, 'min_samples_leaf': 3, 'subsample': 0.7465789086992071, 'max_features': 'sqrt'}. Best is trial 1435 with value: 0.45467030752684195.
[I 2024-12-04 15:16:47,764] Trial 1733 finished with value: 0.7779262450399372 and parameters: {'n_estimators': 1346, 'learning_rate': 0.04124214074753596, 'max_depth': 12, 'min_samples_split': 15, 'min_samples_leaf': 8, 'subsample': 0.6366680721049919, 'max_features': 'log2'}. Best is trial 1435 with value: 0.45467030752684195.
[I 2024-12-04 15:16:47,926] Trial 1762 finished with value: 1.0532524969807158 and parameters: {'n_estimators': 102, 'learning_rate': 0.09079874371267742, 'max_depth': 5, 'min_samples_split': 13, 'min_samples_leaf': 9, 'subsample': 0.9867618306810066, 'max_features': 'log2'}. Best is trial 1435 with value: 0.45467030752684195.
[I 2024-12-04 15:16:48,531] Trial 1742 finished with value: 0.6558526826129472 and parameters: {'n_estimators': 1090, 'learning_rate': 0.05202154979207481, 'max_depth': 3, 'min_samples_split': 12, 'min_samples_leaf': 3, 'subsample': 0.97225857307103, 'max_features': None}. Best is trial 1435 with value: 0.45467030752684195.
[I 2024-12-04 15:16:50,209] Trial 1760 finished with value: 0.8591512399569861 and parameters: {'n_estimators': 458, 'learning_rate': 0.053158402631647755, 'max_depth': 4, 'min_samples_split': 19, 'min_samples_leaf': 8, 'subsample': 0.834548330475509, 'max_features': 'log2'}. Best is trial 1435 with value: 0.45467030752684195.
[I 2024-12-04 15:16:53,402] Trial 1746 finished with value: 0.4782999858894055 and parameters: {'n_estimators': 856, 'learning_rate': 0.08976422203181915, 'max_depth': 12, 'min_samples_split': 20, 'min_samples_leaf': 1, 'subsample': 0.9688509004739244, 'max_features': None}. Best is trial 1435 with value: 0.45467030752684195.
[I 2024-12-04 15:16:55,438] Trial 1745 finished with value: 0.5677340169825291 and parameters: {'n_estimators': 1183, 'learning_rate': 0.031752054810119466, 'max_depth': 6, 'min_samples_split': 3, 'min_samples_leaf': 5, 'subsample': 0.8014563137352474, 'max_features': None}. Best is trial 1435 with value: 0.45467030752684195.
[I 2024-12-04 15:16:55,912] Trial 1755 finished with value: 0.7790374117888138 and parameters: {'n_estimators': 785, 'learning_rate': 0.07174207606553558, 'max_depth': 7, 'min_samples_split': 19, 'min_samples_leaf': 7, 'subsample': 0.6074583744533784, 'max_features': 'sqrt'}. Best is trial 1435 with value: 0.45467030752684195.
[I 2024-12-04 15:16:55,998] Trial 1747 finished with value: 0.517609784945248 and parameters: {'n_estimators': 944, 'learning_rate': 0.08378307003180713, 'max_depth': 11, 'min_samples_split': 17, 'min_samples_leaf': 1, 'subsample': 0.9972821803155192, 'max_features': None}. Best is trial 1435 with value: 0.45467030752684195.
[I 2024-12-04 15:16:56,000] Trial 1744 finished with value: 0.6405522398877386 and parameters: {'n_estimators': 1441, 'learning_rate': 0.014993280095257891, 'max_depth': 3, 'min_samples_split': 16, 'min_samples_leaf': 2, 'subsample': 0.7695950863911925, 'max_features': 'sqrt'}. Best is trial 1435 with value: 0.45467030752684195.
[I 2024-12-04 15:16:56,229] Trial 1748 finished with value: 0.6223083994821997 and parameters: {'n_estimators': 921, 'learning_rate': 0.06645186381838165, 'max_depth': 12, 'min_samples_split': 20, 'min_samples_leaf': 2, 'subsample': 0.9137202824738172, 'max_features': None}. Best is trial 1435 with value: 0.45467030752684195.
[I 2024-12-04 15:16:59,978] Trial 1749 finished with value: 0.5095068816503613 and parameters: {'n_estimators': 966, 'learning_rate': 0.09493820629325729, 'max_depth': 12, 'min_samples_split': 16, 'min_samples_leaf': 1, 'subsample': 0.9291809095004223, 'max_features': None}. Best is trial 1435 with value: 0.45467030752684195.
[I 2024-12-04 15:17:00,012] Trial 1773 finished with value: 0.5798333475562738 and parameters: {'n_estimators': 255, 'learning_rate': 0.027058321351138535, 'max_depth': 8, 'min_samples_split': 11, 'min_samples_leaf': 4, 'subsample': 0.7749279954627837, 'max_features': None}. Best is trial 1435 with value: 0.45467030752684195.
[I 2024-12-04 15:17:02,476] Trial 1763 finished with value: 0.7813660703422939 and parameters: {'n_estimators': 628, 'learning_rate': 0.02658582871003191, 'max_depth': 12, 'min_samples_split': 20, 'min_samples_leaf': 3, 'subsample': 0.6300809318608214, 'max_features': 'log2'}. Best is trial 1435 with value: 0.45467030752684195.
[I 2024-12-04 15:17:03,803] Trial 1770 finished with value: 0.6560041974854035 and parameters: {'n_estimators': 514, 'learning_rate': 0.054866134316848274, 'max_depth': 9, 'min_samples_split': 2, 'min_samples_leaf': 2, 'subsample': 0.6008631367739162, 'max_features': 'sqrt'}. Best is trial 1435 with value: 0.45467030752684195.
[I 2024-12-04 15:17:04,978] Trial 1754 finished with value: 0.46318164273755164 and parameters: {'n_estimators': 980, 'learning_rate': 0.09277976701884169, 'max_depth': 12, 'min_samples_split': 20, 'min_samples_leaf': 1, 'subsample': 0.9951616598980202, 'max_features': None}. Best is trial 1435 with value: 0.45467030752684195.
[I 2024-12-04 15:17:06,991] Trial 1778 finished with value: 1.061633867550498 and parameters: {'n_estimators': 402, 'learning_rate': 0.013555814895035373, 'max_depth': 12, 'min_samples_split': 15, 'min_samples_leaf': 3, 'subsample': 0.654385832917143, 'max_features': 'log2'}. Best is trial 1435 with value: 0.45467030752684195.
[I 2024-12-04 15:17:07,341] Trial 1765 finished with value: 0.5019009877270392 and parameters: {'n_estimators': 617, 'learning_rate': 0.07004535143162041, 'max_depth': 10, 'min_samples_split': 16, 'min_samples_leaf': 1, 'subsample': 0.8932490516583514, 'max_features': None}. Best is trial 1435 with value: 0.45467030752684195.
[I 2024-12-04 15:17:07,661] Trial 1758 finished with value: 0.6367618373717753 and parameters: {'n_estimators': 797, 'learning_rate': 0.09415548626031513, 'max_depth': 12, 'min_samples_split': 17, 'min_samples_leaf': 2, 'subsample': 0.997915229357147, 'max_features': None}. Best is trial 1435 with value: 0.45467030752684195.
[I 2024-12-04 15:17:10,228] Trial 1782 finished with value: 0.8439766645110154 and parameters: {'n_estimators': 328, 'learning_rate': 0.0958731750770748, 'max_depth': 7, 'min_samples_split': 16, 'min_samples_leaf': 7, 'subsample': 0.6009651425990035, 'max_features': 'log2'}. Best is trial 1435 with value: 0.45467030752684195.
[I 2024-12-04 15:17:10,682] Trial 1752 finished with value: 0.6394985878595005 and parameters: {'n_estimators': 1142, 'learning_rate': 0.06923128947814713, 'max_depth': 12, 'min_samples_split': 20, 'min_samples_leaf': 3, 'subsample': 0.9669261515267704, 'max_features': None}. Best is trial 1435 with value: 0.45467030752684195.
[I 2024-12-04 15:17:12,229] Trial 1757 finished with value: 0.6489957707835776 and parameters: {'n_estimators': 993, 'learning_rate': 0.07446084925639407, 'max_depth': 10, 'min_samples_split': 17, 'min_samples_leaf': 3, 'subsample': 0.9636410128305735, 'max_features': None}. Best is trial 1435 with value: 0.45467030752684195.
[I 2024-12-04 15:17:12,504] Trial 1750 finished with value: 0.4909250770728719 and parameters: {'n_estimators': 1258, 'learning_rate': 0.09892871368666033, 'max_depth': 11, 'min_samples_split': 17, 'min_samples_leaf': 1, 'subsample': 0.9929826612132606, 'max_features': None}. Best is trial 1435 with value: 0.45467030752684195.
[I 2024-12-04 15:17:12,666] Trial 1769 finished with value: 0.693489379189132 and parameters: {'n_estimators': 688, 'learning_rate': 0.057434637026788755, 'max_depth': 12, 'min_samples_split': 20, 'min_samples_leaf': 7, 'subsample': 0.8633971076925604, 'max_features': None}. Best is trial 1435 with value: 0.45467030752684195.
[I 2024-12-04 15:17:13,185] Trial 1753 finished with value: 0.5063708945413513 and parameters: {'n_estimators': 1193, 'learning_rate': 0.09188370275277778, 'max_depth': 10, 'min_samples_split': 19, 'min_samples_leaf': 1, 'subsample': 0.9950039107689335, 'max_features': None}. Best is trial 1435 with value: 0.45467030752684195.
[I 2024-12-04 15:17:14,591] Trial 1767 finished with value: 0.5280640865624963 and parameters: {'n_estimators': 786, 'learning_rate': 0.05032622026997797, 'max_depth': 7, 'min_samples_split': 5, 'min_samples_leaf': 1, 'subsample': 0.8865755954245887, 'max_features': None}. Best is trial 1435 with value: 0.45467030752684195.
[I 2024-12-04 15:17:15,256] Trial 1756 finished with value: 0.48470077810698403 and parameters: {'n_estimators': 1047, 'learning_rate': 0.07043303262069783, 'max_depth': 10, 'min_samples_split': 20, 'min_samples_leaf': 1, 'subsample': 0.8690831111509612, 'max_features': None}. Best is trial 1435 with value: 0.45467030752684195.
[I 2024-12-04 15:17:16,445] Trial 1766 finished with value: 0.6200694917296489 and parameters: {'n_estimators': 834, 'learning_rate': 0.054836800301018666, 'max_depth': 12, 'min_samples_split': 17, 'min_samples_leaf': 2, 'subsample': 0.9135426907976758, 'max_features': None}. Best is trial 1435 with value: 0.45467030752684195.
[I 2024-12-04 15:17:18,999] Trial 1771 finished with value: 0.6015801419965153 and parameters: {'n_estimators': 962, 'learning_rate': 0.050814052917488015, 'max_depth': 4, 'min_samples_split': 12, 'min_samples_leaf': 1, 'subsample': 0.878403203897844, 'max_features': 'log2'}. Best is trial 1435 with value: 0.45467030752684195.
[I 2024-12-04 15:17:19,396] Trial 1759 finished with value: 0.4810005662737431 and parameters: {'n_estimators': 1028, 'learning_rate': 0.09171376212403752, 'max_depth': 12, 'min_samples_split': 20, 'min_samples_leaf': 1, 'subsample': 0.9962211024183537, 'max_features': None}. Best is trial 1435 with value: 0.45467030752684195.
[I 2024-12-04 15:17:19,863] Trial 1777 finished with value: 0.4994021231910881 and parameters: {'n_estimators': 692, 'learning_rate': 0.06456472033817012, 'max_depth': 12, 'min_samples_split': 20, 'min_samples_leaf': 1, 'subsample': 0.9969818762876278, 'max_features': None}. Best is trial 1435 with value: 0.45467030752684195.
[I 2024-12-04 15:17:21,667] Trial 1781 finished with value: 0.8305487203834397 and parameters: {'n_estimators': 735, 'learning_rate': 0.09726202883143917, 'max_depth': 3, 'min_samples_split': 9, 'min_samples_leaf': 10, 'subsample': 0.7361532813419874, 'max_features': 'sqrt'}. Best is trial 1435 with value: 0.45467030752684195.
[I 2024-12-04 15:17:22,685] Trial 1768 finished with value: 0.4787887606992109 and parameters: {'n_estimators': 1104, 'learning_rate': 0.09199283080512625, 'max_depth': 12, 'min_samples_split': 18, 'min_samples_leaf': 1, 'subsample': 0.9192819947785325, 'max_features': None}. Best is trial 1435 with value: 0.45467030752684195.
[I 2024-12-04 15:17:23,290] Trial 1761 finished with value: 0.7655938260732749 and parameters: {'n_estimators': 1248, 'learning_rate': 0.022657917113935933, 'max_depth': 12, 'min_samples_split': 7, 'min_samples_leaf': 6, 'subsample': 0.9886130512835949, 'max_features': 'log2'}. Best is trial 1435 with value: 0.45467030752684195.
[I 2024-12-04 15:17:23,687] Trial 1764 finished with value: 0.49999561619374744 and parameters: {'n_estimators': 911, 'learning_rate': 0.07563081746672538, 'max_depth': 12, 'min_samples_split': 20, 'min_samples_leaf': 1, 'subsample': 0.9071464827842818, 'max_features': None}. Best is trial 1435 with value: 0.45467030752684195.
[I 2024-12-04 15:17:25,771] Trial 1779 finished with value: 0.5286508568755774 and parameters: {'n_estimators': 1097, 'learning_rate': 0.06509889513587457, 'max_depth': 10, 'min_samples_split': 17, 'min_samples_leaf': 1, 'subsample': 0.9105830927020613, 'max_features': 'sqrt'}. Best is trial 1435 with value: 0.45467030752684195.
[I 2024-12-04 15:17:25,794] Trial 1775 finished with value: 0.4933239010523766 and parameters: {'n_estimators': 982, 'learning_rate': 0.05943541033177225, 'max_depth': 10, 'min_samples_split': 19, 'min_samples_leaf': 1, 'subsample': 0.9968883924458118, 'max_features': None}. Best is trial 1435 with value: 0.45467030752684195.
[I 2024-12-04 15:17:27,065] Trial 1774 finished with value: 0.6306580364835174 and parameters: {'n_estimators': 972, 'learning_rate': 0.06934064467827018, 'max_depth': 11, 'min_samples_split': 20, 'min_samples_leaf': 2, 'subsample': 0.941288645105635, 'max_features': None}. Best is trial 1435 with value: 0.45467030752684195.
[I 2024-12-04 15:17:28,533] Trial 1788 finished with value: 0.5508844485955284 and parameters: {'n_estimators': 946, 'learning_rate': 0.06572547363144528, 'max_depth': 11, 'min_samples_split': 17, 'min_samples_leaf': 1, 'subsample': 0.9230721368258616, 'max_features': 'log2'}. Best is trial 1435 with value: 0.45467030752684195.
[I 2024-12-04 15:17:31,651] Trial 1772 finished with value: 0.47922342125787754 and parameters: {'n_estimators': 1237, 'learning_rate': 0.09662072002053054, 'max_depth': 12, 'min_samples_split': 18, 'min_samples_leaf': 1, 'subsample': 0.9831398354675395, 'max_features': None}. Best is trial 1435 with value: 0.45467030752684195.
[I 2024-12-04 15:17:32,674] Trial 1787 finished with value: 0.5790869457815728 and parameters: {'n_estimators': 1101, 'learning_rate': 0.04927473796782412, 'max_depth': 9, 'min_samples_split': 20, 'min_samples_leaf': 1, 'subsample': 0.9773498052887234, 'max_features': 'log2'}. Best is trial 1435 with value: 0.45467030752684195.
[I 2024-12-04 15:17:32,735] Trial 1784 finished with value: 0.5601865008102505 and parameters: {'n_estimators': 1148, 'learning_rate': 0.0928696242214448, 'max_depth': 12, 'min_samples_split': 17, 'min_samples_leaf': 1, 'subsample': 0.9754335000319948, 'max_features': 'log2'}. Best is trial 1435 with value: 0.45467030752684195.
[I 2024-12-04 15:17:33,313] Trial 1780 finished with value: 0.6351702938859196 and parameters: {'n_estimators': 1185, 'learning_rate': 0.05839157273614471, 'max_depth': 6, 'min_samples_split': 18, 'min_samples_leaf': 2, 'subsample': 0.9908629840691022, 'max_features': None}. Best is trial 1435 with value: 0.45467030752684195.
[I 2024-12-04 15:17:34,726] Trial 1776 finished with value: 0.6680990446714041 and parameters: {'n_estimators': 1285, 'learning_rate': 0.09746433651714867, 'max_depth': 11, 'min_samples_split': 18, 'min_samples_leaf': 3, 'subsample': 0.911446410442375, 'max_features': None}. Best is trial 1435 with value: 0.45467030752684195.
[I 2024-12-04 15:17:34,989] Trial 1785 finished with value: 0.48616732423906434 and parameters: {'n_estimators': 971, 'learning_rate': 0.07613046575439301, 'max_depth': 12, 'min_samples_split': 20, 'min_samples_leaf': 1, 'subsample': 0.8086564459356078, 'max_features': None}. Best is trial 1435 with value: 0.45467030752684195.
[I 2024-12-04 15:17:35,378] Trial 1786 finished with value: 0.47833158534677855 and parameters: {'n_estimators': 1019, 'learning_rate': 0.07857875319258747, 'max_depth': 10, 'min_samples_split': 19, 'min_samples_leaf': 1, 'subsample': 0.9934765580346995, 'max_features': None}. Best is trial 1435 with value: 0.45467030752684195.
[I 2024-12-04 15:17:36,148] Trial 1790 finished with value: 0.5492297764683969 and parameters: {'n_estimators': 854, 'learning_rate': 0.027444101913725507, 'max_depth': 4, 'min_samples_split': 3, 'min_samples_leaf': 1, 'subsample': 0.7417735419088952, 'max_features': None}. Best is trial 1435 with value: 0.45467030752684195.
[I 2024-12-04 15:17:39,761] Trial 1797 finished with value: 0.6420024124127087 and parameters: {'n_estimators': 786, 'learning_rate': 0.089457950588452, 'max_depth': 11, 'min_samples_split': 19, 'min_samples_leaf': 4, 'subsample': 0.8946809219722897, 'max_features': 'sqrt'}. Best is trial 1435 with value: 0.45467030752684195.
[I 2024-12-04 15:17:42,225] Trial 1792 finished with value: 0.616142123159535 and parameters: {'n_estimators': 986, 'learning_rate': 0.09375533304766001, 'max_depth': 12, 'min_samples_split': 18, 'min_samples_leaf': 2, 'subsample': 0.9856086546079846, 'max_features': None}. Best is trial 1435 with value: 0.45467030752684195.
[I 2024-12-04 15:17:42,867] Trial 1789 finished with value: 0.6128115200499407 and parameters: {'n_estimators': 1143, 'learning_rate': 0.08641514878358655, 'max_depth': 12, 'min_samples_split': 20, 'min_samples_leaf': 2, 'subsample': 0.9853944639148187, 'max_features': None}. Best is trial 1435 with value: 0.45467030752684195.
[I 2024-12-04 15:17:43,618] Trial 1810 finished with value: 1.1674989520885095 and parameters: {'n_estimators': 268, 'learning_rate': 0.011841949052708252, 'max_depth': 10, 'min_samples_split': 10, 'min_samples_leaf': 9, 'subsample': 0.929316179891915, 'max_features': 'log2'}. Best is trial 1435 with value: 0.45467030752684195.
[I 2024-12-04 15:17:45,038] Trial 1791 finished with value: 0.670754025267379 and parameters: {'n_estimators': 1071, 'learning_rate': 0.0961999237703821, 'max_depth': 11, 'min_samples_split': 20, 'min_samples_leaf': 3, 'subsample': 0.9166674463818613, 'max_features': None}. Best is trial 1435 with value: 0.45467030752684195.
[I 2024-12-04 15:17:47,149] Trial 1812 finished with value: 0.6393284559107346 and parameters: {'n_estimators': 393, 'learning_rate': 0.037915017572990144, 'max_depth': 7, 'min_samples_split': 12, 'min_samples_leaf': 1, 'subsample': 0.8329761624938022, 'max_features': 'log2'}. Best is trial 1435 with value: 0.45467030752684195.
[I 2024-12-04 15:17:47,773] Trial 1783 finished with value: 0.641706960641116 and parameters: {'n_estimators': 1459, 'learning_rate': 0.03379083239749112, 'max_depth': 12, 'min_samples_split': 18, 'min_samples_leaf': 2, 'subsample': 0.844488202828982, 'max_features': None}. Best is trial 1435 with value: 0.45467030752684195.
[I 2024-12-04 15:17:49,568] Trial 1795 finished with value: 0.6288818293940097 and parameters: {'n_estimators': 826, 'learning_rate': 0.06938497974103358, 'max_depth': 12, 'min_samples_split': 20, 'min_samples_leaf': 3, 'subsample': 0.9866136702490498, 'max_features': None}. Best is trial 1435 with value: 0.45467030752684195.
[I 2024-12-04 15:17:51,057] Trial 1796 finished with value: 0.4867683786329931 and parameters: {'n_estimators': 810, 'learning_rate': 0.08072264948238009, 'max_depth': 12, 'min_samples_split': 17, 'min_samples_leaf': 1, 'subsample': 0.9952841277842561, 'max_features': None}. Best is trial 1435 with value: 0.45467030752684195.
[I 2024-12-04 15:17:52,292] Trial 1807 finished with value: 0.5535816398376744 and parameters: {'n_estimators': 649, 'learning_rate': 0.010539671245821924, 'max_depth': 3, 'min_samples_split': 14, 'min_samples_leaf': 4, 'subsample': 0.6252228065318813, 'max_features': None}. Best is trial 1435 with value: 0.45467030752684195.
[I 2024-12-04 15:17:53,997] Trial 1794 finished with value: 0.6597550779338647 and parameters: {'n_estimators': 1143, 'learning_rate': 0.09848284175727741, 'max_depth': 12, 'min_samples_split': 19, 'min_samples_leaf': 3, 'subsample': 0.9880136794761365, 'max_features': None}. Best is trial 1435 with value: 0.45467030752684195.
[I 2024-12-04 15:17:55,088] Trial 1800 finished with value: 0.6486531413154787 and parameters: {'n_estimators': 979, 'learning_rate': 0.07867940626106472, 'max_depth': 11, 'min_samples_split': 20, 'min_samples_leaf': 2, 'subsample': 0.9610741486044619, 'max_features': 'sqrt'}. Best is trial 1435 with value: 0.45467030752684195.
[I 2024-12-04 15:17:55,172] Trial 1801 finished with value: 0.4640417759764136 and parameters: {'n_estimators': 768, 'learning_rate': 0.0971990280810899, 'max_depth': 12, 'min_samples_split': 20, 'min_samples_leaf': 1, 'subsample': 0.9943576243823382, 'max_features': None}. Best is trial 1435 with value: 0.45467030752684195.
[I 2024-12-04 15:17:56,608] Trial 1823 finished with value: 0.6935659761859037 and parameters: {'n_estimators': 341, 'learning_rate': 0.09998952817095984, 'max_depth': 11, 'min_samples_split': 5, 'min_samples_leaf': 2, 'subsample': 0.8884484549312315, 'max_features': 'sqrt'}. Best is trial 1435 with value: 0.45467030752684195.
[I 2024-12-04 15:17:56,806] Trial 1798 finished with value: 0.47532200801489105 and parameters: {'n_estimators': 1034, 'learning_rate': 0.09531443632281195, 'max_depth': 12, 'min_samples_split': 20, 'min_samples_leaf': 1, 'subsample': 0.9600975569158006, 'max_features': None}. Best is trial 1435 with value: 0.45467030752684195.
[I 2024-12-04 15:17:57,961] Trial 1811 finished with value: 0.6519553358624577 and parameters: {'n_estimators': 661, 'learning_rate': 0.09753648564144889, 'max_depth': 12, 'min_samples_split': 15, 'min_samples_leaf': 2, 'subsample': 0.9690114045312396, 'max_features': None}. Best is trial 1435 with value: 0.45467030752684195.
