[I 2024-12-03 19:21:12,477] Trial 2294 finished with value: 0.13574450611201763 and parameters: {'kernel': 'linear', 'C': 15.506962817186496, 'gamma': 0.0005861946557879106, 'epsilon': 0.036105957433824415}. Best is trial 345 with value: 0.13438257115663557.
[I 2024-12-03 19:21:13,385] Trial 2285 finished with value: 0.14009437783604267 and parameters: {'kernel': 'linear', 'C': 95.9101002154841, 'gamma': 0.08460545647480298, 'epsilon': 0.10094250954956283}. Best is trial 345 with value: 0.13438257115663557.
[I 2024-12-03 19:21:13,990] Trial 2298 finished with value: 0.138225517070663 and parameters: {'kernel': 'linear', 'C': 87.72006350510195, 'gamma': 0.002267417333882854, 'epsilon': 0.08200172371071651}. Best is trial 345 with value: 0.13438257115663557.
[I 2024-12-03 19:21:15,550] Trial 2305 finished with value: 0.15672864749437015 and parameters: {'kernel': 'rbf', 'C': 94.19989348419482, 'gamma': 0.003849576323452804, 'epsilon': 0.010325061636644567}. Best is trial 345 with value: 0.13438257115663557.
[I 2024-12-03 19:21:19,835] Trial 2306 finished with value: 0.14233421477534255 and parameters: {'kernel': 'linear', 'C': 33.904530309774415, 'gamma': 0.029806235087929213, 'epsilon': 0.09354434584536765}. Best is trial 345 with value: 0.13438257115663557.
[I 2024-12-03 19:21:24,931] Trial 2236 finished with value: 0.1357049348429699 and parameters: {'kernel': 'linear', 'C': 88.28440974967856, 'gamma': 0.0007311514143751326, 'epsilon': 0.03512706937185161}. Best is trial 345 with value: 0.13438257115663557.
[I 2024-12-03 19:21:26,424] Trial 2309 finished with value: 0.9393633652276475 and parameters: {'kernel': 'rbf', 'C': 1.2728028971178678, 'gamma': 0.5493655134369609, 'epsilon': 0.017242275621586096}. Best is trial 345 with value: 0.13438257115663557.
[I 2024-12-03 19:21:26,486] Trial 2198 finished with value: 0.13792557389812535 and parameters: {'kernel': 'linear', 'C': 96.25953971785356, 'gamma': 0.0009784466970874626, 'epsilon': 0.0025569706309019613}. Best is trial 345 with value: 0.13438257115663557.
[I 2024-12-03 19:21:27,574] Trial 2301 finished with value: 0.13802334603343935 and parameters: {'kernel': 'linear', 'C': 13.866132927977073, 'gamma': 0.002191124648555196, 'epsilon': 0.006258064799435052}. Best is trial 345 with value: 0.13438257115663557.
[I 2024-12-03 19:21:29,382] Trial 2303 finished with value: 0.1363809598927859 and parameters: {'kernel': 'linear', 'C': 22.714949347728083, 'gamma': 0.010104362841208792, 'epsilon': 0.05110040631333745}. Best is trial 345 with value: 0.13438257115663557.
[I 2024-12-03 19:21:29,818] Trial 2312 finished with value: 1.152429495377875 and parameters: {'kernel': 'rbf', 'C': 0.014897101550965535, 'gamma': 0.005388851533190333, 'epsilon': 0.0017980627707147115}. Best is trial 345 with value: 0.13438257115663557.
[I 2024-12-03 19:21:32,079] Trial 2314 finished with value: 213.13213155126175 and parameters: {'kernel': 'sigmoid', 'C': 14.742823179539625, 'gamma': 0.029699104109114343, 'epsilon': 0.2173170667002624}. Best is trial 345 with value: 0.13438257115663557.
[I 2024-12-03 19:21:32,985] Trial 2295 finished with value: 0.136069298447823 and parameters: {'kernel': 'linear', 'C': 28.673392264372648, 'gamma': 0.007675771775721732, 'epsilon': 0.02600436850563288}. Best is trial 345 with value: 0.13438257115663557.
[I 2024-12-03 19:21:33,870] Trial 2250 finished with value: 0.13571215599113098 and parameters: {'kernel': 'linear', 'C': 81.08255442557918, 'gamma': 0.0005238592911336398, 'epsilon': 0.02711789702836993}. Best is trial 345 with value: 0.13438257115663557.
[I 2024-12-03 19:21:33,870] Trial 2315 finished with value: 0.22067009431691348 and parameters: {'kernel': 'linear', 'C': 13.689087975727293, 'gamma': 0.007008956593846974, 'epsilon': 0.29758152942636584}. Best is trial 345 with value: 0.13438257115663557.
[I 2024-12-03 19:21:35,805] Trial 2317 finished with value: 0.36382494921219727 and parameters: {'kernel': 'rbf', 'C': 4.918584903778237, 'gamma': 0.045737000054604966, 'epsilon': 0.02091011441931396}. Best is trial 345 with value: 0.13438257115663557.
[I 2024-12-03 19:21:37,978] Trial 2311 finished with value: 0.1368013843113592 and parameters: {'kernel': 'linear', 'C': 14.460692221004674, 'gamma': 0.001447190246916314, 'epsilon': 0.044379124535455776}. Best is trial 345 with value: 0.13438257115663557.
[I 2024-12-03 19:21:38,484] Trial 2307 finished with value: 0.1380986620022394 and parameters: {'kernel': 'linear', 'C': 18.392637527871717, 'gamma': 0.00022095351365612466, 'epsilon': 0.012173643062478435}. Best is trial 345 with value: 0.13438257115663557.
[I 2024-12-03 19:21:39,401] Trial 2320 finished with value: 0.43573959571453524 and parameters: {'kernel': 'linear', 'C': 0.0013961673729051952, 'gamma': 0.03884754175354022, 'epsilon': 0.026120738613417606}. Best is trial 345 with value: 0.13438257115663557.
[I 2024-12-03 19:21:41,995] Trial 2316 finished with value: 0.1417894945707478 and parameters: {'kernel': 'linear', 'C': 37.08785605065945, 'gamma': 0.004806317906777897, 'epsilon': 0.09549918365188433}. Best is trial 345 with value: 0.13438257115663557.
[I 2024-12-03 19:21:42,149] Trial 2246 finished with value: 0.13739697100249051 and parameters: {'kernel': 'linear', 'C': 90.73733889473537, 'gamma': 0.023057328273467154, 'epsilon': 0.01974531120476059}. Best is trial 345 with value: 0.13438257115663557.
[I 2024-12-03 19:21:42,513] Trial 2264 finished with value: 0.1371015300085673 and parameters: {'kernel': 'linear', 'C': 97.53885792093703, 'gamma': 0.0011496099776297764, 'epsilon': 0.022613140943901176}. Best is trial 345 with value: 0.13438257115663557.
[I 2024-12-03 19:21:43,474] Trial 2276 finished with value: 0.1354126109248337 and parameters: {'kernel': 'linear', 'C': 89.89142805006139, 'gamma': 0.0759310297372383, 'epsilon': 0.03833604605249876}. Best is trial 345 with value: 0.13438257115663557.
[I 2024-12-03 19:21:43,621] Trial 2323 finished with value: 0.46177160090241853 and parameters: {'kernel': 'poly', 'C': 0.010623888830308539, 'gamma': 0.08420156430703629, 'epsilon': 0.050651456539695924}. Best is trial 345 with value: 0.13438257115663557.
[I 2024-12-03 19:21:45,599] Trial 2327 finished with value: 0.7551706837499326 and parameters: {'kernel': 'poly', 'C': 63.61256376359195, 'gamma': 0.0032251226356459052, 'epsilon': 0.009873162004316873}. Best is trial 345 with value: 0.13438257115663557.
[I 2024-12-03 19:21:47,274] Trial 2328 finished with value: 0.6116658515627938 and parameters: {'kernel': 'rbf', 'C': 91.65795742085638, 'gamma': 0.20757707119654592, 'epsilon': 0.007224589781015431}. Best is trial 345 with value: 0.13438257115663557.
[I 2024-12-03 19:21:48,700] Trial 2329 finished with value: 496.22791170028773 and parameters: {'kernel': 'sigmoid', 'C': 31.019238150158255, 'gamma': 0.041987333894972105, 'epsilon': 0.03265237818936057}. Best is trial 345 with value: 0.13438257115663557.
[I 2024-12-03 19:21:49,244] Trial 2302 finished with value: 0.13574539086391324 and parameters: {'kernel': 'linear', 'C': 30.64566600630179, 'gamma': 0.020454885067999813, 'epsilon': 0.03618128589548243}. Best is trial 345 with value: 0.13438257115663557.
[I 2024-12-03 19:21:51,217] Trial 2247 finished with value: 0.13539705947374486 and parameters: {'kernel': 'linear', 'C': 98.29014699014155, 'gamma': 0.05458935270988957, 'epsilon': 0.03831245766310052}. Best is trial 345 with value: 0.13438257115663557.
[I 2024-12-03 19:21:52,403] Trial 2332 finished with value: 4.937290360050691 and parameters: {'kernel': 'sigmoid', 'C': 75.00284276072232, 'gamma': 0.0013790991667000803, 'epsilon': 0.07172550501161172}. Best is trial 345 with value: 0.13438257115663557.
[I 2024-12-03 19:21:53,443] Trial 2310 finished with value: 0.13760448378741844 and parameters: {'kernel': 'linear', 'C': 22.671657802747, 'gamma': 0.009720783576827083, 'epsilon': 0.01916084848103131}. Best is trial 345 with value: 0.13438257115663557.
[I 2024-12-03 19:21:54,312] Trial 2333 finished with value: 0.16842906825550433 and parameters: {'kernel': 'linear', 'C': 14.762379260342327, 'gamma': 0.0013198838824904152, 'epsilon': 0.18709486404133807}. Best is trial 345 with value: 0.13438257115663557.
[I 2024-12-03 19:21:55,022] Trial 2318 finished with value: 0.1407067383619853 and parameters: {'kernel': 'linear', 'C': 91.18586761902407, 'gamma': 0.00125593799257826, 'epsilon': 0.09071916271935873}. Best is trial 345 with value: 0.13438257115663557.
[I 2024-12-03 19:21:55,117] Trial 2308 finished with value: 0.1383588761239633 and parameters: {'kernel': 'linear', 'C': 30.03441788941114, 'gamma': 0.0029038094479686477, 'epsilon': 0.011816505737913353}. Best is trial 345 with value: 0.13438257115663557.
[I 2024-12-03 19:21:56,890] Trial 2336 finished with value: 0.1719526269382988 and parameters: {'kernel': 'linear', 'C': 1.7285921927731807, 'gamma': 0.0009479789291542724, 'epsilon': 0.15934877885336415}. Best is trial 345 with value: 0.13438257115663557.
[I 2024-12-03 19:21:59,031] Trial 2326 finished with value: 0.13556120377527792 and parameters: {'kernel': 'linear', 'C': 11.308480374311243, 'gamma': 0.0035759078666885214, 'epsilon': 0.02873102231391432}. Best is trial 345 with value: 0.13438257115663557.
[I 2024-12-03 19:22:00,740] Trial 2280 finished with value: 0.1352029660846963 and parameters: {'kernel': 'linear', 'C': 91.26597933425762, 'gamma': 0.004096080867544733, 'epsilon': 0.033393692375131796}. Best is trial 345 with value: 0.13438257115663557.
[I 2024-12-03 19:22:01,271] Trial 2300 finished with value: 0.13705721345329494 and parameters: {'kernel': 'linear', 'C': 91.52068463348084, 'gamma': 0.004281540330928006, 'epsilon': 0.04774830366432443}. Best is trial 345 with value: 0.13438257115663557.
[I 2024-12-03 19:22:03,452] Trial 2325 finished with value: 0.13788054479243012 and parameters: {'kernel': 'linear', 'C': 16.013732728990572, 'gamma': 0.05152424366279115, 'epsilon': 0.013120858048032152}. Best is trial 345 with value: 0.13438257115663557.
[I 2024-12-03 19:22:03,956] Trial 2340 finished with value: 0.13541168006281418 and parameters: {'kernel': 'linear', 'C': 3.693327300413595, 'gamma': 0.004244653626181446, 'epsilon': 0.05169990875398869}. Best is trial 345 with value: 0.13438257115663557.
[I 2024-12-03 19:22:03,957] Trial 2319 finished with value: 0.13651980746677256 and parameters: {'kernel': 'linear', 'C': 22.87015310375483, 'gamma': 0.008593185709542513, 'epsilon': 0.024940953357015214}. Best is trial 345 with value: 0.13438257115663557.
[I 2024-12-03 19:22:04,211] Trial 2334 finished with value: 0.15777124181408342 and parameters: {'kernel': 'linear', 'C': 85.47253406923258, 'gamma': 0.00018778287173675225, 'epsilon': 0.15988694440693885}. Best is trial 345 with value: 0.13438257115663557.
[I 2024-12-03 19:22:06,899] Trial 2344 finished with value: 0.5923055967674903 and parameters: {'kernel': 'rbf', 'C': 0.35618884611399576, 'gamma': 0.03140862982085824, 'epsilon': 0.016435847296500616}. Best is trial 345 with value: 0.13438257115663557.
[I 2024-12-03 19:22:07,155] Trial 2345 finished with value: 1.3520417320360287 and parameters: {'kernel': 'rbf', 'C': 0.0016836725015942477, 'gamma': 0.29491123134947456, 'epsilon': 0.023841617974975082}. Best is trial 345 with value: 0.13438257115663557.
[I 2024-12-03 19:22:07,632] Trial 2343 finished with value: 1.0634873339019746 and parameters: {'kernel': 'poly', 'C': 7.5096414661094135, 'gamma': 0.0029116424655210513, 'epsilon': 0.029273456203737773}. Best is trial 345 with value: 0.13438257115663557.
[I 2024-12-03 19:22:08,142] Trial 2339 finished with value: 0.13837410612784407 and parameters: {'kernel': 'linear', 'C': 5.129589924522851, 'gamma': 0.020171478176586877, 'epsilon': 0.010750284666219348}. Best is trial 345 with value: 0.13438257115663557.
[I 2024-12-03 19:22:08,642] Trial 2258 finished with value: 0.13635683029622322 and parameters: {'kernel': 'linear', 'C': 92.75781854777284, 'gamma': 0.0011267371092942944, 'epsilon': 0.025346775358435825}. Best is trial 345 with value: 0.13438257115663557.
[I 2024-12-03 19:22:10,321] Trial 2342 finished with value: 0.13810168468943873 and parameters: {'kernel': 'linear', 'C': 3.834496573391607, 'gamma': 0.00012188343687182727, 'epsilon': 0.011412566152453478}. Best is trial 345 with value: 0.13438257115663557.
[I 2024-12-03 19:22:10,924] Trial 2338 finished with value: 0.1358286446483945 and parameters: {'kernel': 'linear', 'C': 16.999728487961267, 'gamma': 0.000156301519910582, 'epsilon': 0.04223233196847641}. Best is trial 345 with value: 0.13438257115663557.
[I 2024-12-03 19:22:12,736] Trial 2350 finished with value: 0.14370881825218046 and parameters: {'kernel': 'linear', 'C': 6.160255932641832, 'gamma': 0.011408128518272786, 'epsilon': 0.09233902037773116}. Best is trial 345 with value: 0.13438257115663557.
[I 2024-12-03 19:22:12,804] Trial 2351 finished with value: 0.25278729784100207 and parameters: {'kernel': 'rbf', 'C': 88.04065861254217, 'gamma': 0.0001511181682195629, 'epsilon': 0.005314883562302419}. Best is trial 345 with value: 0.13438257115663557.
[I 2024-12-03 19:22:14,511] Trial 2337 finished with value: 0.37296165628189437 and parameters: {'kernel': 'poly', 'C': 0.31451065807819617, 'gamma': 0.2513426284090458, 'epsilon': 0.13153094981339888}. Best is trial 345 with value: 0.13438257115663557.
[I 2024-12-03 19:22:14,891] Trial 2353 finished with value: 0.3345618301262452 and parameters: {'kernel': 'rbf', 'C': 1.9337572353540806, 'gamma': 0.0018303500840887318, 'epsilon': 0.04332137287337821}. Best is trial 345 with value: 0.13438257115663557.
[I 2024-12-03 19:22:15,979] Trial 2354 finished with value: 0.1473646585567629 and parameters: {'kernel': 'linear', 'C': 4.520650857589506, 'gamma': 0.0018424370554248107, 'epsilon': 0.1063596044973538}. Best is trial 345 with value: 0.13438257115663557.
[I 2024-12-03 19:22:19,986] Trial 2341 finished with value: 0.138065822146637 and parameters: {'kernel': 'linear', 'C': 15.851919028532127, 'gamma': 0.001031448887918829, 'epsilon': 0.011911105681538192}. Best is trial 345 with value: 0.13438257115663557.
[I 2024-12-03 19:22:24,041] Trial 2349 finished with value: 0.13534327641732655 and parameters: {'kernel': 'linear', 'C': 13.739514652546282, 'gamma': 0.16694089027912726, 'epsilon': 0.02929528213229155}. Best is trial 345 with value: 0.13438257115663557.
[I 2024-12-03 19:22:24,362] Trial 2284 finished with value: 0.1356359650525901 and parameters: {'kernel': 'linear', 'C': 93.117918631033, 'gamma': 0.19334830593839092, 'epsilon': 0.026424122207307665}. Best is trial 345 with value: 0.13438257115663557.
[I 2024-12-03 19:22:25,102] Trial 2228 finished with value: 0.13805880228691778 and parameters: {'kernel': 'linear', 'C': 99.34767752251653, 'gamma': 0.005008241128933168, 'epsilon': 0.010079626843041126}. Best is trial 345 with value: 0.13438257115663557.
[I 2024-12-03 19:22:25,674] Trial 2359 finished with value: 0.7599839385245085 and parameters: {'kernel': 'poly', 'C': 0.028151199317766242, 'gamma': 0.006871655788870477, 'epsilon': 0.09917011474679628}. Best is trial 345 with value: 0.13438257115663557.
[I 2024-12-03 19:22:27,970] Trial 2352 finished with value: 0.13568352401825715 and parameters: {'kernel': 'linear', 'C': 27.9899879383266, 'gamma': 0.00121327045234565, 'epsilon': 0.05277839558425812}. Best is trial 345 with value: 0.13438257115663557.
[I 2024-12-03 19:22:29,263] Trial 2363 finished with value: 0.53309988996798 and parameters: {'kernel': 'rbf', 'C': 0.5442538361296797, 'gamma': 0.03166596659281384, 'epsilon': 0.15150198899982253}. Best is trial 345 with value: 0.13438257115663557.
[I 2024-12-03 19:22:30,007] Trial 2348 finished with value: 0.13526083781295747 and parameters: {'kernel': 'linear', 'C': 28.545892094832304, 'gamma': 0.0056212342468635185, 'epsilon': 0.060768060519242835}. Best is trial 345 with value: 0.13438257115663557.
[I 2024-12-03 19:22:31,459] Trial 2364 finished with value: 0.2338696821323122 and parameters: {'kernel': 'linear', 'C': 0.06423342136656338, 'gamma': 0.00011049943924087276, 'epsilon': 0.014574261244682245}. Best is trial 345 with value: 0.13438257115663557.
[I 2024-12-03 19:22:31,483] Trial 2222 finished with value: 0.13479826266647055 and parameters: {'kernel': 'linear', 'C': 98.92955883312464, 'gamma': 0.011474157432697241, 'epsilon': 0.03204172549864528}. Best is trial 345 with value: 0.13438257115663557.
[I 2024-12-03 19:22:32,861] Trial 2362 finished with value: 0.13669019288467005 and parameters: {'kernel': 'linear', 'C': 3.3073927082271584, 'gamma': 0.002928265732439038, 'epsilon': 0.024480719617782927}. Best is trial 345 with value: 0.13438257115663557.
[I 2024-12-03 19:22:37,041] Trial 2260 finished with value: 0.13546408350910083 and parameters: {'kernel': 'linear', 'C': 91.69911421395382, 'gamma': 0.00021085789748138183, 'epsilon': 0.02800267877061299}. Best is trial 345 with value: 0.13438257115663557.
[I 2024-12-03 19:22:39,166] Trial 2355 finished with value: 0.14104380753260115 and parameters: {'kernel': 'linear', 'C': 95.76885594515741, 'gamma': 0.016452662657784115, 'epsilon': 0.09022095324576883}. Best is trial 345 with value: 0.13438257115663557.
[I 2024-12-03 19:22:40,036] Trial 2346 finished with value: 0.13770610125723884 and parameters: {'kernel': 'linear', 'C': 26.27476695989812, 'gamma': 0.002291177586198323, 'epsilon': 0.0184146405866801}. Best is trial 345 with value: 0.13438257115663557.
[I 2024-12-03 19:22:40,242] Trial 2356 finished with value: 0.136671843110799 and parameters: {'kernel': 'linear', 'C': 17.153111638985937, 'gamma': 0.04315536699522812, 'epsilon': 0.02347351445069652}. Best is trial 345 with value: 0.13438257115663557.
[I 2024-12-03 19:22:40,506] Trial 2324 finished with value: 0.14015979995142472 and parameters: {'kernel': 'linear', 'C': 96.01442172140942, 'gamma': 0.009830764205019146, 'epsilon': 0.10476044483665313}. Best is trial 345 with value: 0.13438257115663557.
[I 2024-12-03 19:22:40,878] Trial 2254 finished with value: 0.13822549015624697 and parameters: {'kernel': 'linear', 'C': 99.15672106562069, 'gamma': 0.00043635624624656914, 'epsilon': 0.006509435376165235}. Best is trial 345 with value: 0.13438257115663557.
[I 2024-12-03 19:22:42,600] Trial 2372 finished with value: 0.3151164795588405 and parameters: {'kernel': 'sigmoid', 'C': 46.95208944900237, 'gamma': 0.0002966308772049255, 'epsilon': 0.01080643225047131}. Best is trial 345 with value: 0.13438257115663557.
[I 2024-12-03 19:22:43,611] Trial 2374 finished with value: 0.23905139051956062 and parameters: {'kernel': 'rbf', 'C': 19.13817744116767, 'gamma': 0.0008061399384106955, 'epsilon': 0.03403502938982432}. Best is trial 345 with value: 0.13438257115663557.
[I 2024-12-03 19:22:43,976] Trial 2369 finished with value: 0.13753047306007732 and parameters: {'kernel': 'linear', 'C': 25.190666600481755, 'gamma': 0.0024695686220113223, 'epsilon': 0.07811644949291911}. Best is trial 345 with value: 0.13438257115663557.
[I 2024-12-03 19:22:44,670] Trial 2365 finished with value: 0.1371883044013266 and parameters: {'kernel': 'linear', 'C': 19.30800933044135, 'gamma': 0.0004233089897066024, 'epsilon': 0.04857603009926063}. Best is trial 345 with value: 0.13438257115663557.
[I 2024-12-03 19:22:45,345] Trial 2361 finished with value: 0.1353078240692428 and parameters: {'kernel': 'linear', 'C': 22.19758198987215, 'gamma': 0.0015126885760125752, 'epsilon': 0.04101171627960737}. Best is trial 345 with value: 0.13438257115663557.
[I 2024-12-03 19:22:45,930] Trial 2370 finished with value: 0.13805989464172858 and parameters: {'kernel': 'linear', 'C': 28.56189285931209, 'gamma': 0.03857078129921886, 'epsilon': 0.08283376562967933}. Best is trial 345 with value: 0.13438257115663557.
[I 2024-12-03 19:22:47,410] Trial 2367 finished with value: 0.13562373883871653 and parameters: {'kernel': 'linear', 'C': 15.994768055733587, 'gamma': 0.42414897873363117, 'epsilon': 0.05378258253390336}. Best is trial 345 with value: 0.13438257115663557.
[I 2024-12-03 19:22:47,519] Trial 2358 finished with value: 0.13771741227062398 and parameters: {'kernel': 'linear', 'C': 23.16618689422666, 'gamma': 0.0041539539820202205, 'epsilon': 0.01752148063397342}. Best is trial 345 with value: 0.13438257115663557.
[I 2024-12-03 19:22:50,935] Trial 2368 finished with value: 0.13513528226430474 and parameters: {'kernel': 'linear', 'C': 20.1985353050853, 'gamma': 0.009512418375775478, 'epsilon': 0.05914667169882591}. Best is trial 345 with value: 0.13438257115663557.
[I 2024-12-03 19:22:52,248] Trial 2381 finished with value: 0.13514237931694456 and parameters: {'kernel': 'linear', 'C': 5.051813248114388, 'gamma': 0.008191651215005724, 'epsilon': 0.05149513201382747}. Best is trial 345 with value: 0.13438257115663557.
[I 2024-12-03 19:22:52,250] Trial 2322 finished with value: 0.13508209335456156 and parameters: {'kernel': 'linear', 'C': 99.33959918391317, 'gamma': 0.01294262235400162, 'epsilon': 0.04067733273763323}. Best is trial 345 with value: 0.13438257115663557.
[I 2024-12-03 19:22:54,877] Trial 2313 finished with value: 0.13544561758742715 and parameters: {'kernel': 'linear', 'C': 90.15998171711452, 'gamma': 0.22379946725627287, 'epsilon': 0.027943262102958596}. Best is trial 345 with value: 0.13438257115663557.
[I 2024-12-03 19:22:56,324] Trial 2378 finished with value: 0.1373851846173511 and parameters: {'kernel': 'linear', 'C': 4.727515549895977, 'gamma': 0.6916385852663627, 'epsilon': 0.0037330771945208634}. Best is trial 345 with value: 0.13438257115663557.
[I 2024-12-03 19:22:57,817] Trial 2383 finished with value: 0.15998373923567932 and parameters: {'kernel': 'linear', 'C': 96.21999871860818, 'gamma': 0.16616346909505675, 'epsilon': 0.16497779554006778}. Best is trial 345 with value: 0.13438257115663557.
