[I 2024-12-04 11:52:19,712] Trial 153 finished with value: 1.3007745979739842 and parameters: {'max_depth': 22, 'min_samples_split': 3, 'min_samples_leaf': 6, 'max_features': 'log2', 'criterion': 'squared_error', 'splitter': 'best'}. Best is trial 132 with value: 0.5172303731839445.
[I 2024-12-04 11:52:20,300] Trial 150 finished with value: 0.5715332410516556 and parameters: {'max_depth': 23, 'min_samples_split': 2, 'min_samples_leaf': 1, 'max_features': 'log2', 'criterion': 'squared_error', 'splitter': 'best'}. Best is trial 132 with value: 0.5172303731839445.
[I 2024-12-04 11:52:20,383] Trial 149 finished with value: 0.924799806170231 and parameters: {'max_depth': 23, 'min_samples_split': 2, 'min_samples_leaf': 3, 'max_features': 'log2', 'criterion': 'squared_error', 'splitter': 'best'}. Best is trial 132 with value: 0.5172303731839445.
[I 2024-12-04 11:52:20,825] Trial 148 finished with value: 1.3007745979739842 and parameters: {'max_depth': 33, 'min_samples_split': 8, 'min_samples_leaf': 4, 'max_features': 'log2', 'criterion': 'squared_error', 'splitter': 'best'}. Best is trial 132 with value: 0.5172303731839445.
[I 2024-12-04 11:52:22,389] Trial 154 finished with value: 0.5365713065858015 and parameters: {'max_depth': 35, 'min_samples_split': 2, 'min_samples_leaf': 1, 'max_features': 'log2', 'criterion': 'absolute_error', 'splitter': 'best'}. Best is trial 132 with value: 0.5172303731839445.
[I 2024-12-04 11:52:22,399] Trial 167 finished with value: 0.5583963367356682 and parameters: {'max_depth': 32, 'min_samples_split': 2, 'min_samples_leaf': 1, 'max_features': 'log2', 'criterion': 'squared_error', 'splitter': 'best'}. Best is trial 132 with value: 0.5172303731839445.
[I 2024-12-04 11:52:22,480] Trial 176 finished with value: 1.3629276849850611 and parameters: {'max_depth': 23, 'min_samples_split': 18, 'min_samples_leaf': 10, 'max_features': 'sqrt', 'criterion': 'absolute_error', 'splitter': 'random'}. Best is trial 132 with value: 0.5172303731839445.
[I 2024-12-04 11:52:22,777] Trial 163 finished with value: 0.5855175778219047 and parameters: {'max_depth': 35, 'min_samples_split': 3, 'min_samples_leaf': 1, 'max_features': 'log2', 'criterion': 'squared_error', 'splitter': 'best'}. Best is trial 132 with value: 0.5172303731839445.
[I 2024-12-04 11:52:23,235] Trial 169 finished with value: 1.3083975849649514 and parameters: {'max_depth': 5, 'min_samples_split': 15, 'min_samples_leaf': 3, 'max_features': 'sqrt', 'criterion': 'friedman_mse', 'splitter': 'best'}. Best is trial 132 with value: 0.5172303731839445.
[I 2024-12-04 11:52:23,310] Trial 162 finished with value: 1.3175104290264963 and parameters: {'max_depth': 2, 'min_samples_split': 7, 'min_samples_leaf': 7, 'max_features': 'sqrt', 'criterion': 'friedman_mse', 'splitter': 'best'}. Best is trial 132 with value: 0.5172303731839445.
[I 2024-12-04 11:52:23,351] Trial 164 finished with value: 0.6245493493852258 and parameters: {'max_depth': 24, 'min_samples_split': 3, 'min_samples_leaf': 1, 'max_features': 'log2', 'criterion': 'squared_error', 'splitter': 'best'}. Best is trial 132 with value: 0.5172303731839445.
[I 2024-12-04 11:52:23,529] Trial 159 finished with value: 0.5421908820820033 and parameters: {'max_depth': 34, 'min_samples_split': 2, 'min_samples_leaf': 1, 'max_features': 'log2', 'criterion': 'absolute_error', 'splitter': 'best'}. Best is trial 132 with value: 0.5172303731839445.
[I 2024-12-04 11:52:23,755] Trial 161 finished with value: 0.7177525863158705 and parameters: {'max_depth': 34, 'min_samples_split': 3, 'min_samples_leaf': 2, 'max_features': 'log2', 'criterion': 'squared_error', 'splitter': 'best'}. Best is trial 132 with value: 0.5172303731839445.
[I 2024-12-04 11:52:23,793] Trial 170 finished with value: 0.5807019516226011 and parameters: {'max_depth': 22, 'min_samples_split': 2, 'min_samples_leaf': 1, 'max_features': 'log2', 'criterion': 'squared_error', 'splitter': 'best'}. Best is trial 132 with value: 0.5172303731839445.
[I 2024-12-04 11:52:23,826] Trial 171 finished with value: 1.3014693347727373 and parameters: {'max_depth': 11, 'min_samples_split': 13, 'min_samples_leaf': 9, 'max_features': 'log2', 'criterion': 'friedman_mse', 'splitter': 'random'}. Best is trial 132 with value: 0.5172303731839445.
[I 2024-12-04 11:52:24,771] Trial 168 finished with value: 1.009355341748503 and parameters: {'max_depth': 35, 'min_samples_split': 3, 'min_samples_leaf': 2, 'max_features': 'log2', 'criterion': 'absolute_error', 'splitter': 'best'}. Best is trial 132 with value: 0.5172303731839445.
[I 2024-12-04 11:52:24,929] Trial 166 finished with value: 0.7077652071943146 and parameters: {'max_depth': 33, 'min_samples_split': 5, 'min_samples_leaf': 1, 'max_features': 'log2', 'criterion': 'absolute_error', 'splitter': 'best'}. Best is trial 132 with value: 0.5172303731839445.
[I 2024-12-04 11:52:25,306] Trial 174 finished with value: 1.298283307656757 and parameters: {'max_depth': 32, 'min_samples_split': 3, 'min_samples_leaf': 5, 'max_features': 'log2', 'criterion': 'squared_error', 'splitter': 'random'}. Best is trial 132 with value: 0.5172303731839445.
[I 2024-12-04 11:52:25,610] Trial 175 finished with value: 1.36280343027112 and parameters: {'max_depth': 32, 'min_samples_split': 2, 'min_samples_leaf': 4, 'max_features': 'log2', 'criterion': 'absolute_error', 'splitter': 'best'}. Best is trial 160 with value: 0.5065208369659612.
[I 2024-12-04 11:52:25,791] Trial 172 finished with value: 0.5880429615991086 and parameters: {'max_depth': 33, 'min_samples_split': 2, 'min_samples_leaf': 1, 'max_features': 'log2', 'criterion': 'absolute_error', 'splitter': 'best'}. Best is trial 160 with value: 0.5065208369659612.
[I 2024-12-04 11:52:25,960] Trial 160 finished with value: 0.5065208369659612 and parameters: {'max_depth': 31, 'min_samples_split': 2, 'min_samples_leaf': 1, 'max_features': 'log2', 'criterion': 'absolute_error', 'splitter': 'best'}. Best is trial 160 with value: 0.5065208369659612.
[I 2024-12-04 11:52:26,650] Trial 181 finished with value: 0.5583963367356682 and parameters: {'max_depth': 32, 'min_samples_split': 2, 'min_samples_leaf': 1, 'max_features': 'log2', 'criterion': 'squared_error', 'splitter': 'best'}. Best is trial 160 with value: 0.5065208369659612.
[I 2024-12-04 11:52:27,224] Trial 165 finished with value: 1.2862484594633363 and parameters: {'max_depth': 11, 'min_samples_split': 5, 'min_samples_leaf': 5, 'max_features': 'sqrt', 'criterion': 'squared_error', 'splitter': 'random'}. Best is trial 160 with value: 0.5065208369659612.
[I 2024-12-04 11:52:27,743] Trial 178 finished with value: 1.3007745979739842 and parameters: {'max_depth': 30, 'min_samples_split': 17, 'min_samples_leaf': 6, 'max_features': 'log2', 'criterion': 'friedman_mse', 'splitter': 'best'}. Best is trial 160 with value: 0.5065208369659612.
[I 2024-12-04 11:52:28,443] Trial 182 finished with value: 0.5995818917979532 and parameters: {'max_depth': 28, 'min_samples_split': 2, 'min_samples_leaf': 1, 'max_features': 'log2', 'criterion': 'squared_error', 'splitter': 'best'}. Best is trial 160 with value: 0.5065208369659612.
[I 2024-12-04 11:52:28,587] Trial 177 finished with value: 0.5880429615991086 and parameters: {'max_depth': 33, 'min_samples_split': 2, 'min_samples_leaf': 1, 'max_features': 'log2', 'criterion': 'absolute_error', 'splitter': 'best'}. Best is trial 160 with value: 0.5065208369659612.
[I 2024-12-04 11:52:28,589] Trial 173 finished with value: 0.5917985221191467 and parameters: {'max_depth': 22, 'min_samples_split': 2, 'min_samples_leaf': 1, 'max_features': 'log2', 'criterion': 'absolute_error', 'splitter': 'best'}. Best is trial 160 with value: 0.5065208369659612.
[I 2024-12-04 11:52:28,663] Trial 179 finished with value: 0.5436720392838054 and parameters: {'max_depth': 33, 'min_samples_split': 3, 'min_samples_leaf': 1, 'max_features': 'log2', 'criterion': 'absolute_error', 'splitter': 'best'}. Best is trial 160 with value: 0.5065208369659612.
[I 2024-12-04 11:52:29,529] Trial 180 finished with value: 1.3604321503216543 and parameters: {'max_depth': 5, 'min_samples_split': 7, 'min_samples_leaf': 6, 'max_features': 'log2', 'criterion': 'absolute_error', 'splitter': 'random'}. Best is trial 160 with value: 0.5065208369659612.
[I 2024-12-04 11:52:29,675] Trial 186 finished with value: 0.924799806170231 and parameters: {'max_depth': 31, 'min_samples_split': 2, 'min_samples_leaf': 3, 'max_features': 'log2', 'criterion': 'squared_error', 'splitter': 'best'}. Best is trial 160 with value: 0.5065208369659612.
[I 2024-12-04 11:52:29,768] Trial 187 finished with value: 0.526171915895561 and parameters: {'max_depth': 35, 'min_samples_split': 2, 'min_samples_leaf': 1, 'max_features': 'log2', 'criterion': 'squared_error', 'splitter': 'best'}. Best is trial 160 with value: 0.5065208369659612.
[I 2024-12-04 11:52:29,941] Trial 190 finished with value: 1.3014693347727373 and parameters: {'max_depth': 1, 'min_samples_split': 13, 'min_samples_leaf': 6, 'max_features': 'log2', 'criterion': 'squared_error', 'splitter': 'random'}. Best is trial 160 with value: 0.5065208369659612.
[I 2024-12-04 11:52:30,146] Trial 185 finished with value: 0.5065208369659612 and parameters: {'max_depth': 31, 'min_samples_split': 2, 'min_samples_leaf': 1, 'max_features': 'log2', 'criterion': 'absolute_error', 'splitter': 'best'}. Best is trial 160 with value: 0.5065208369659612.
[I 2024-12-04 11:52:30,154] Trial 192 finished with value: 1.3007745979739842 and parameters: {'max_depth': 28, 'min_samples_split': 11, 'min_samples_leaf': 8, 'max_features': 'log2', 'criterion': 'squared_error', 'splitter': 'best'}. Best is trial 160 with value: 0.5065208369659612.
[I 2024-12-04 11:52:30,156] Trial 183 finished with value: 1.3105279435582882 and parameters: {'max_depth': 17, 'min_samples_split': 6, 'min_samples_leaf': 10, 'max_features': 'sqrt', 'criterion': 'friedman_mse', 'splitter': 'best'}. Best is trial 160 with value: 0.5065208369659612.
[I 2024-12-04 11:52:31,072] Trial 195 finished with value: 1.009355341748503 and parameters: {'max_depth': 33, 'min_samples_split': 5, 'min_samples_leaf': 2, 'max_features': 'log2', 'criterion': 'absolute_error', 'splitter': 'best'}. Best is trial 160 with value: 0.5065208369659612.
[I 2024-12-04 11:52:31,858] Trial 189 finished with value: 0.5346482740235124 and parameters: {'max_depth': 34, 'min_samples_split': 2, 'min_samples_leaf': 1, 'max_features': 'log2', 'criterion': 'squared_error', 'splitter': 'best'}. Best is trial 160 with value: 0.5065208369659612.
[I 2024-12-04 11:52:32,072] Trial 200 finished with value: 1.009355341748503 and parameters: {'max_depth': 28, 'min_samples_split': 2, 'min_samples_leaf': 2, 'max_features': 'log2', 'criterion': 'absolute_error', 'splitter': 'best'}. Best is trial 160 with value: 0.5065208369659612.
[I 2024-12-04 11:52:32,789] Trial 196 finished with value: 1.0201410606892172 and parameters: {'max_depth': 35, 'min_samples_split': 2, 'min_samples_leaf': 3, 'max_features': 'log2', 'criterion': 'absolute_error', 'splitter': 'best'}. Best is trial 160 with value: 0.5065208369659612.
[I 2024-12-04 11:52:33,018] Trial 197 finished with value: 0.8699818612819172 and parameters: {'max_depth': 13, 'min_samples_split': 18, 'min_samples_leaf': 6, 'max_features': 'sqrt', 'criterion': 'friedman_mse', 'splitter': 'random'}. Best is trial 160 with value: 0.5065208369659612.
[I 2024-12-04 11:52:33,818] Trial 184 finished with value: 1.3146688863221643 and parameters: {'max_depth': 35, 'min_samples_split': 2, 'min_samples_leaf': 1, 'max_features': 'log2', 'criterion': 'absolute_error', 'splitter': 'random'}. Best is trial 160 with value: 0.5065208369659612.
[I 2024-12-04 11:52:34,394] Trial 199 finished with value: 0.6011584966791916 and parameters: {'max_depth': 30, 'min_samples_split': 5, 'min_samples_leaf': 1, 'max_features': 'log2', 'criterion': 'absolute_error', 'splitter': 'best'}. Best is trial 160 with value: 0.5065208369659612.
[I 2024-12-04 11:52:34,432] Trial 188 finished with value: 0.5101794984186436 and parameters: {'max_depth': 35, 'min_samples_split': 4, 'min_samples_leaf': 1, 'max_features': 'log2', 'criterion': 'absolute_error', 'splitter': 'best'}. Best is trial 160 with value: 0.5065208369659612.
[I 2024-12-04 11:52:34,901] Trial 194 finished with value: 0.7177525863158705 and parameters: {'max_depth': 34, 'min_samples_split': 2, 'min_samples_leaf': 2, 'max_features': 'log2', 'criterion': 'squared_error', 'splitter': 'best'}. Best is trial 160 with value: 0.5065208369659612.
[I 2024-12-04 11:52:35,273] Trial 191 finished with value: 0.5741055305825652 and parameters: {'max_depth': 28, 'min_samples_split': 2, 'min_samples_leaf': 1, 'max_features': 'log2', 'criterion': 'absolute_error', 'splitter': 'best'}. Best is trial 160 with value: 0.5065208369659612.
[I 2024-12-04 11:52:35,320] Trial 193 finished with value: 0.526171915895561 and parameters: {'max_depth': 35, 'min_samples_split': 2, 'min_samples_leaf': 1, 'max_features': 'log2', 'criterion': 'squared_error', 'splitter': 'best'}. Best is trial 160 with value: 0.5065208369659612.
[I 2024-12-04 11:52:35,567] Trial 204 finished with value: 0.526171915895561 and parameters: {'max_depth': 35, 'min_samples_split': 2, 'min_samples_leaf': 1, 'max_features': 'log2', 'criterion': 'squared_error', 'splitter': 'best'}. Best is trial 160 with value: 0.5065208369659612.
[I 2024-12-04 11:52:35,568] Trial 205 finished with value: 0.7414768836782462 and parameters: {'max_depth': 35, 'min_samples_split': 5, 'min_samples_leaf': 1, 'max_features': 'log2', 'criterion': 'absolute_error', 'splitter': 'best'}. Best is trial 160 with value: 0.5065208369659612.
[I 2024-12-04 11:52:36,075] Trial 202 finished with value: 0.5624801211765672 and parameters: {'max_depth': 33, 'min_samples_split': 4, 'min_samples_leaf': 1, 'max_features': 'log2', 'criterion': 'absolute_error', 'splitter': 'best'}. Best is trial 160 with value: 0.5065208369659612.
[I 2024-12-04 11:52:36,173] Trial 203 finished with value: 0.6023566599390917 and parameters: {'max_depth': 32, 'min_samples_split': 4, 'min_samples_leaf': 1, 'max_features': 'log2', 'criterion': 'absolute_error', 'splitter': 'best'}. Best is trial 160 with value: 0.5065208369659612.
[I 2024-12-04 11:52:36,295] Trial 207 finished with value: 1.1408779699500264 and parameters: {'max_depth': 33, 'min_samples_split': 2, 'min_samples_leaf': 2, 'max_features': 'sqrt', 'criterion': 'absolute_error', 'splitter': 'best'}. Best is trial 160 with value: 0.5065208369659612.
[I 2024-12-04 11:52:38,169] Trial 220 finished with value: 0.5421908820820033 and parameters: {'max_depth': 34, 'min_samples_split': 2, 'min_samples_leaf': 1, 'max_features': 'log2', 'criterion': 'absolute_error', 'splitter': 'best'}. Best is trial 160 with value: 0.5065208369659612.
[I 2024-12-04 11:52:38,567] Trial 209 finished with value: 0.5855175778219047 and parameters: {'max_depth': 35, 'min_samples_split': 3, 'min_samples_leaf': 1, 'max_features': 'log2', 'criterion': 'squared_error', 'splitter': 'best'}. Best is trial 160 with value: 0.5065208369659612.
[I 2024-12-04 11:52:38,627] Trial 210 finished with value: 0.7177525863158705 and parameters: {'max_depth': 35, 'min_samples_split': 3, 'min_samples_leaf': 2, 'max_features': 'log2', 'criterion': 'squared_error', 'splitter': 'best'}. Best is trial 160 with value: 0.5065208369659612.
[I 2024-12-04 11:52:38,904] Trial 218 finished with value: 1.009355341748503 and parameters: {'max_depth': 31, 'min_samples_split': 2, 'min_samples_leaf': 2, 'max_features': 'log2', 'criterion': 'absolute_error', 'splitter': 'best'}. Best is trial 160 with value: 0.5065208369659612.
[I 2024-12-04 11:52:39,205] Trial 201 finished with value: 0.7177525863158705 and parameters: {'max_depth': 35, 'min_samples_split': 2, 'min_samples_leaf': 2, 'max_features': 'log2', 'criterion': 'squared_error', 'splitter': 'best'}. Best is trial 160 with value: 0.5065208369659612.
[I 2024-12-04 11:52:39,207] Trial 213 finished with value: 0.5346482740235124 and parameters: {'max_depth': 34, 'min_samples_split': 2, 'min_samples_leaf': 1, 'max_features': 'log2', 'criterion': 'squared_error', 'splitter': 'best'}. Best is trial 160 with value: 0.5065208369659612.
[I 2024-12-04 11:52:39,217] Trial 208 finished with value: 0.526171915895561 and parameters: {'max_depth': 35, 'min_samples_split': 2, 'min_samples_leaf': 1, 'max_features': 'log2', 'criterion': 'squared_error', 'splitter': 'best'}. Best is trial 160 with value: 0.5065208369659612.
[I 2024-12-04 11:52:39,475] Trial 198 finished with value: 1.009355341748503 and parameters: {'max_depth': 35, 'min_samples_split': 3, 'min_samples_leaf': 2, 'max_features': 'log2', 'criterion': 'absolute_error', 'splitter': 'best'}. Best is trial 160 with value: 0.5065208369659612.
[I 2024-12-04 11:52:39,640] Trial 219 finished with value: 0.5172303731839445 and parameters: {'max_depth': 33, 'min_samples_split': 2, 'min_samples_leaf': 1, 'max_features': 'log2', 'criterion': 'squared_error', 'splitter': 'best'}. Best is trial 160 with value: 0.5065208369659612.
[I 2024-12-04 11:52:39,793] Trial 212 finished with value: 0.8733456625980828 and parameters: {'max_depth': 35, 'min_samples_split': 8, 'min_samples_leaf': 2, 'max_features': 'log2', 'criterion': 'squared_error', 'splitter': 'best'}. Best is trial 160 with value: 0.5065208369659612.
[I 2024-12-04 11:52:39,808] Trial 206 finished with value: 0.7177525863158705 and parameters: {'max_depth': 35, 'min_samples_split': 2, 'min_samples_leaf': 2, 'max_features': 'log2', 'criterion': 'squared_error', 'splitter': 'best'}. Best is trial 160 with value: 0.5065208369659612.
[I 2024-12-04 11:52:40,290] Trial 221 finished with value: 0.5346482740235124 and parameters: {'max_depth': 34, 'min_samples_split': 2, 'min_samples_leaf': 1, 'max_features': 'log2', 'criterion': 'friedman_mse', 'splitter': 'best'}. Best is trial 160 with value: 0.5065208369659612.
[I 2024-12-04 11:52:40,771] Trial 223 finished with value: 0.65707188224495 and parameters: {'max_depth': 32, 'min_samples_split': 4, 'min_samples_leaf': 1, 'max_features': 'log2', 'criterion': 'squared_error', 'splitter': 'best'}. Best is trial 160 with value: 0.5065208369659612.
[I 2024-12-04 11:52:41,131] Trial 215 finished with value: 0.5729089406692737 and parameters: {'max_depth': 34, 'min_samples_split': 3, 'min_samples_leaf': 1, 'max_features': 'log2', 'criterion': 'squared_error', 'splitter': 'best'}. Best is trial 160 with value: 0.5065208369659612.
[I 2024-12-04 11:52:41,259] Trial 224 finished with value: 0.5729089406692737 and parameters: {'max_depth': 34, 'min_samples_split': 3, 'min_samples_leaf': 1, 'max_features': 'log2', 'criterion': 'squared_error', 'splitter': 'best'}. Best is trial 160 with value: 0.5065208369659612.
[I 2024-12-04 11:52:41,447] Trial 217 finished with value: 0.924799806170231 and parameters: {'max_depth': 32, 'min_samples_split': 3, 'min_samples_leaf': 3, 'max_features': 'log2', 'criterion': 'friedman_mse', 'splitter': 'best'}. Best is trial 160 with value: 0.5065208369659612.
[I 2024-12-04 11:52:42,477] Trial 214 finished with value: 0.5855175778219047 and parameters: {'max_depth': 35, 'min_samples_split': 3, 'min_samples_leaf': 1, 'max_features': 'log2', 'criterion': 'squared_error', 'splitter': 'best'}. Best is trial 160 with value: 0.5065208369659612.
[I 2024-12-04 11:52:42,900] Trial 211 finished with value: 0.5365713065858015 and parameters: {'max_depth': 35, 'min_samples_split': 2, 'min_samples_leaf': 1, 'max_features': 'log2', 'criterion': 'absolute_error', 'splitter': 'best'}. Best is trial 160 with value: 0.5065208369659612.
[I 2024-12-04 11:52:43,161] Trial 226 finished with value: 1.3400153874729748 and parameters: {'max_depth': 31, 'min_samples_split': 13, 'min_samples_leaf': 10, 'max_features': 'sqrt', 'criterion': 'absolute_error', 'splitter': 'best'}. Best is trial 160 with value: 0.5065208369659612.
[I 2024-12-04 11:52:44,068] Trial 233 finished with value: 0.5365713065858015 and parameters: {'max_depth': 35, 'min_samples_split': 2, 'min_samples_leaf': 1, 'max_features': 'log2', 'criterion': 'absolute_error', 'splitter': 'best'}. Best is trial 160 with value: 0.5065208369659612.
[I 2024-12-04 11:52:44,433] Trial 240 finished with value: 0.5066822665811462 and parameters: {'max_depth': 35, 'min_samples_split': 3, 'min_samples_leaf': 1, 'max_features': 'log2', 'criterion': 'absolute_error', 'splitter': 'best'}. Best is trial 160 with value: 0.5065208369659612.
[I 2024-12-04 11:52:44,529] Trial 234 finished with value: 0.5172303731839445 and parameters: {'max_depth': 33, 'min_samples_split': 2, 'min_samples_leaf': 1, 'max_features': 'log2', 'criterion': 'squared_error', 'splitter': 'best'}. Best is trial 160 with value: 0.5065208369659612.
[I 2024-12-04 11:52:44,832] Trial 229 finished with value: 0.6228875839303879 and parameters: {'max_depth': 35, 'min_samples_split': 4, 'min_samples_leaf': 1, 'max_features': 'sqrt', 'criterion': 'friedman_mse', 'splitter': 'best'}. Best is trial 160 with value: 0.5065208369659612.
[I 2024-12-04 11:52:45,888] Trial 222 finished with value: 0.5880429615991086 and parameters: {'max_depth': 33, 'min_samples_split': 2, 'min_samples_leaf': 1, 'max_features': 'log2', 'criterion': 'absolute_error', 'splitter': 'best'}. Best is trial 160 with value: 0.5065208369659612.
[I 2024-12-04 11:52:46,422] Trial 227 finished with value: 1.3130149982826922 and parameters: {'max_depth': 35, 'min_samples_split': 17, 'min_samples_leaf': 9, 'max_features': 'sqrt', 'criterion': 'friedman_mse', 'splitter': 'random'}. Best is trial 160 with value: 0.5065208369659612.
[I 2024-12-04 11:52:46,432] Trial 225 finished with value: 0.6674762672909911 and parameters: {'max_depth': 34, 'min_samples_split': 5, 'min_samples_leaf': 1, 'max_features': 'log2', 'criterion': 'friedman_mse', 'splitter': 'best'}. Best is trial 160 with value: 0.5065208369659612.
