[I 2024-12-04 15:15:16,018] Trial 1955 finished with value: 0.48830341904419117 and parameters: {'kernel_type': 'Matern', 'length_scale': 3791.725279858943, 'noise_level': 0.956098284057974, 'constant_value': 3180.9827899339675, 'nu': 0.5}. Best is trial 386 with value: 0.4872991004520934.
[I 2024-12-04 15:15:16,245] Trial 1958 finished with value: 0.48830341353860474 and parameters: {'kernel_type': 'Matern', 'length_scale': 271.43573892866436, 'noise_level': 0.005817202747157289, 'constant_value': 77660.70287998395, 'nu': 0.5}. Best is trial 386 with value: 0.4872991004520934.
[I 2024-12-04 15:15:16,833] Trial 1947 finished with value: 0.6443853015423362 and parameters: {'kernel_type': 'RBF', 'length_scale': 0.9285230267741131, 'noise_level': 0.00032565462976480626, 'constant_value': 0.34868714325969785, 'nu': 0.5}. Best is trial 386 with value: 0.4872991004520934.
[I 2024-12-04 15:15:17,565] Trial 1957 finished with value: 0.48830341958474666 and parameters: {'kernel_type': 'Matern', 'length_scale': 28405.568179351587, 'noise_level': 0.8369226659056659, 'constant_value': 74936.9312184569, 'nu': 0.5}. Best is trial 386 with value: 0.4872991004520934.
[I 2024-12-04 15:15:20,512] Trial 1953 finished with value: 0.48830342272382843 and parameters: {'kernel_type': 'Matern', 'length_scale': 361.153434252315, 'noise_level': 0.7834759960174795, 'constant_value': 1806.020486272054, 'nu': 0.5}. Best is trial 386 with value: 0.4872991004520934.
[I 2024-12-04 15:15:21,120] Trial 1960 finished with value: 1.2401112324662928 and parameters: {'kernel_type': 'Matern', 'length_scale': 4517.97601289775, 'noise_level': 0.0139747439489704, 'constant_value': 26.668540796578274, 'nu': 0.5}. Best is trial 386 with value: 0.4872991004520934.
[I 2024-12-04 15:15:22,840] Trial 1945 finished with value: 0.48830342378701874 and parameters: {'kernel_type': 'Matern', 'length_scale': 45611.21057420939, 'noise_level': 0.9925716268936948, 'constant_value': 474.40709298735356, 'nu': 0.5}. Best is trial 386 with value: 0.4872991004520934.
[I 2024-12-04 15:15:23,176] Trial 1950 finished with value: 0.4883034841936945 and parameters: {'kernel_type': 'Matern', 'length_scale': 2178.369164424476, 'noise_level': 0.027409819587573915, 'constant_value': 304.07138611007167, 'nu': 0.5}. Best is trial 386 with value: 0.4872991004520934.
[I 2024-12-04 15:15:23,723] Trial 1964 finished with value: 1.2614547976260768 and parameters: {'kernel_type': 'RBF', 'length_scale': 1.1168144652949454, 'noise_level': 0.00869271988023472, 'constant_value': 0.0013518874412972082, 'nu': 1.5}. Best is trial 386 with value: 0.4872991004520934.
[I 2024-12-04 15:15:25,485] Trial 1954 finished with value: 1.2401112290797796 and parameters: {'kernel_type': 'Matern', 'length_scale': 5.964623422885838, 'noise_level': 0.03799901901990473, 'constant_value': 0.00020316546204897669, 'nu': 2.5}. Best is trial 386 with value: 0.4872991004520934.
[I 2024-12-04 15:15:26,224] Trial 1943 finished with value: 1.240111232718425 and parameters: {'kernel_type': 'RBF', 'length_scale': 57.98913746951328, 'noise_level': 1.9762243206667227e-09, 'constant_value': 0.026079168501355447, 'nu': 2.5}. Best is trial 386 with value: 0.4872991004520934.
[I 2024-12-04 15:15:26,520] Trial 1972 finished with value: 1.261454795394147 and parameters: {'kernel_type': 'Matern', 'length_scale': 3.451665773092937, 'noise_level': 0.02678180907207785, 'constant_value': 90.73881187780586, 'nu': 0.5}. Best is trial 386 with value: 0.4872991004520934.
[I 2024-12-04 15:15:26,857] Trial 1965 finished with value: 0.4883034462752902 and parameters: {'kernel_type': 'Matern', 'length_scale': 97432.37980339011, 'noise_level': 0.6395758661211441, 'constant_value': 7.680438207541546, 'nu': 0.5}. Best is trial 386 with value: 0.4872991004520934.
[I 2024-12-04 15:15:27,723] Trial 1962 finished with value: 0.48830342459080794 and parameters: {'kernel_type': 'Matern', 'length_scale': 1813.8567785670102, 'noise_level': 0.03144482614543417, 'constant_value': 3827.0866916118666, 'nu': 0.5}. Best is trial 386 with value: 0.4872991004520934.
[I 2024-12-04 15:15:27,920] Trial 1966 finished with value: 0.48830341996427507 and parameters: {'kernel_type': 'Matern', 'length_scale': 3111.8345738451308, 'noise_level': 0.03645952413286258, 'constant_value': 6632.6140912356195, 'nu': 0.5}. Best is trial 386 with value: 0.4872991004520934.
[I 2024-12-04 15:15:27,930] Trial 1959 finished with value: 0.4883034524683668 and parameters: {'kernel_type': 'Matern', 'length_scale': 252.10472634644992, 'noise_level': 0.6998514418370284, 'constant_value': 0.002232816564823124, 'nu': 0.5}. Best is trial 386 with value: 0.4872991004520934.
[I 2024-12-04 15:15:27,932] Trial 1961 finished with value: 0.48830341836333047 and parameters: {'kernel_type': 'Matern', 'length_scale': 69754.8074398963, 'noise_level': 0.0054114875559921356, 'constant_value': 95181.15153575095, 'nu': 0.5}. Best is trial 386 with value: 0.4872991004520934.
[I 2024-12-04 15:15:28,174] Trial 1963 finished with value: 0.4883063362585229 and parameters: {'kernel_type': 'Matern', 'length_scale': 5684.9297602718625, 'noise_level': 0.8935611160201101, 'constant_value': 51.059579720968145, 'nu': 0.5}. Best is trial 386 with value: 0.4872991004520934.
[I 2024-12-04 15:15:30,169] Trial 1974 finished with value: 1.240111232723648 and parameters: {'kernel_type': 'RBF', 'length_scale': 2.6280173871432232e-05, 'noise_level': 0.012020741124093648, 'constant_value': 11.683361053946971, 'nu': 1.5}. Best is trial 386 with value: 0.4872991004520934.
[I 2024-12-04 15:15:30,354] Trial 1976 finished with value: 0.4883029688528259 and parameters: {'kernel_type': 'Matern', 'length_scale': 23803.30734132684, 'noise_level': 0.5700104859792674, 'constant_value': 91848.99267227034, 'nu': 0.5}. Best is trial 386 with value: 0.4872991004520934.
[I 2024-12-04 15:15:31,326] Trial 1971 finished with value: 0.48830341953987083 and parameters: {'kernel_type': 'Matern', 'length_scale': 85171.58755701681, 'noise_level': 0.863229933815461, 'constant_value': 5200.478676933218, 'nu': 0.5}. Best is trial 386 with value: 0.4872991004520934.
[I 2024-12-04 15:15:32,206] Trial 1967 finished with value: 0.6443853606556896 and parameters: {'kernel_type': 'RBF', 'length_scale': 616.5367459423339, 'noise_level': 0.8487642001538462, 'constant_value': 10450.374250218725, 'nu': 0.5}. Best is trial 386 with value: 0.4872991004520934.
[I 2024-12-04 15:15:32,369] Trial 1969 finished with value: 0.4883034191452268 and parameters: {'kernel_type': 'Matern', 'length_scale': 7851.261471027176, 'noise_level': 0.0002971525092866559, 'constant_value': 1130.2799010654844, 'nu': 0.5}. Best is trial 386 with value: 0.4872991004520934.
[I 2024-12-04 15:15:32,444] Trial 1973 finished with value: 0.4883034185555952 and parameters: {'kernel_type': 'Matern', 'length_scale': 1781.5527524864901, 'noise_level': 0.9816710095889287, 'constant_value': 1882.2658500585555, 'nu': 0.5}. Best is trial 386 with value: 0.4872991004520934.
[I 2024-12-04 15:15:32,805] Trial 1980 finished with value: 1.2401112272406196 and parameters: {'kernel_type': 'Matern', 'length_scale': 0.0003195862640884671, 'noise_level': 1.7112181601805124e-10, 'constant_value': 1.0330913726837123e-07, 'nu': 2.5}. Best is trial 386 with value: 0.4872991004520934.
[I 2024-12-04 15:15:33,924] Trial 1968 finished with value: 1.2401112325568662 and parameters: {'kernel_type': 'RBF', 'length_scale': 76.17611548247346, 'noise_level': 0.004432822655532316, 'constant_value': 0.00010866587879878002, 'nu': 2.5}. Best is trial 386 with value: 0.4872991004520934.
[I 2024-12-04 15:15:34,162] Trial 1970 finished with value: 0.5273055474885456 and parameters: {'kernel_type': 'Matern', 'length_scale': 6.524852546931366, 'noise_level': 0.00946382430522477, 'constant_value': 22.34417493907309, 'nu': 1.5}. Best is trial 386 with value: 0.4872991004520934.
[I 2024-12-04 15:15:34,276] Trial 1975 finished with value: 0.4883033684799346 and parameters: {'kernel_type': 'Matern', 'length_scale': 72712.48314725999, 'noise_level': 0.9869613466128775, 'constant_value': 40618.43237589714, 'nu': 0.5}. Best is trial 386 with value: 0.4872991004520934.
[I 2024-12-04 15:15:36,494] Trial 1978 finished with value: 0.48830341997035276 and parameters: {'kernel_type': 'Matern', 'length_scale': 1735.6470315530948, 'noise_level': 0.8540706006060642, 'constant_value': 85769.23101495537, 'nu': 0.5}. Best is trial 386 with value: 0.4872991004520934.
[I 2024-12-04 15:15:36,766] Trial 1983 finished with value: 0.4883033334878917 and parameters: {'kernel_type': 'Matern', 'length_scale': 171.27193356834422, 'noise_level': 0.02806302356240154, 'constant_value': 3.7289967002083517, 'nu': 0.5}. Best is trial 386 with value: 0.4872991004520934.
[I 2024-12-04 15:15:36,768] Trial 1984 finished with value: 1.2614547976333967 and parameters: {'kernel_type': 'Matern', 'length_scale': 47285.350983727774, 'noise_level': 0.6943389985267282, 'constant_value': 701.6996164574059, 'nu': 2.5}. Best is trial 386 with value: 0.4872991004520934.
[I 2024-12-04 15:15:36,956] Trial 1979 finished with value: 0.4883034182357567 and parameters: {'kernel_type': 'Matern', 'length_scale': 2329.985406781353, 'noise_level': 0.7815204046377743, 'constant_value': 4.501527231655291, 'nu': 0.5}. Best is trial 386 with value: 0.4872991004520934.
[I 2024-12-04 15:15:37,367] Trial 1981 finished with value: 1.2401112327040291 and parameters: {'kernel_type': 'RBF', 'length_scale': 24596.82616762476, 'noise_level': 2.2928083534483142e-08, 'constant_value': 547.8368470820905, 'nu': 0.5}. Best is trial 386 with value: 0.4872991004520934.
[I 2024-12-04 15:15:37,989] Trial 1986 finished with value: 0.4883021708055571 and parameters: {'kernel_type': 'Matern', 'length_scale': 301.97678115951834, 'noise_level': 0.04534938584636467, 'constant_value': 62510.543375531015, 'nu': 0.5}. Best is trial 386 with value: 0.4872991004520934.
[I 2024-12-04 15:15:41,155] Trial 1985 finished with value: 0.4883034257481907 and parameters: {'kernel_type': 'Matern', 'length_scale': 1677.8914277529318, 'noise_level': 0.7295289218361733, 'constant_value': 5.533705631962737, 'nu': 0.5}. Best is trial 386 with value: 0.4872991004520934.
[I 2024-12-04 15:15:41,379] Trial 1977 finished with value: 0.4883034162582912 and parameters: {'kernel_type': 'Matern', 'length_scale': 2757.4610798597155, 'noise_level': 0.9238777310658832, 'constant_value': 385.096483330412, 'nu': 0.5}. Best is trial 386 with value: 0.4872991004520934.
[I 2024-12-04 15:15:41,559] Trial 1982 finished with value: 0.5273051220437919 and parameters: {'kernel_type': 'Matern', 'length_scale': 494.69073057299954, 'noise_level': 0.005246988300802226, 'constant_value': 66459.96057197258, 'nu': 1.5}. Best is trial 386 with value: 0.4872991004520934.
[I 2024-12-04 15:15:41,893] Trial 1988 finished with value: 0.48830343213390565 and parameters: {'kernel_type': 'Matern', 'length_scale': 28.498136838651334, 'noise_level': 0.6071891993327617, 'constant_value': 57940.71065242103, 'nu': 0.5}. Best is trial 386 with value: 0.4872991004520934.
[I 2024-12-04 15:15:43,500] Trial 2000 finished with value: 1.2614547953941473 and parameters: {'kernel_type': 'Matern', 'length_scale': 184.6640769154857, 'noise_level': 0.023198660262950744, 'constant_value': 9543.761311880668, 'nu': 0.5}. Best is trial 386 with value: 0.4872991004520934.
[I 2024-12-04 15:15:43,996] Trial 1987 finished with value: 0.4883034533711371 and parameters: {'kernel_type': 'Matern', 'length_scale': 60.94379786536485, 'noise_level': 0.039912827752123244, 'constant_value': 1451.4089196277096, 'nu': 0.5}. Best is trial 386 with value: 0.4872991004520934.
[I 2024-12-04 15:15:44,217] Trial 1989 finished with value: 1.240108222394388 and parameters: {'kernel_type': 'Matern', 'length_scale': 0.12041952516000327, 'noise_level': 2.0057967818797456e-05, 'constant_value': 0.15641082543569618, 'nu': 1.5}. Best is trial 386 with value: 0.4872991004520934.
[I 2024-12-04 15:15:44,995] Trial 1994 finished with value: 0.488303367593236 and parameters: {'kernel_type': 'Matern', 'length_scale': 1.7005721194833727, 'noise_level': 0.013454197340365884, 'constant_value': 5590.699755180632, 'nu': 0.5}. Best is trial 386 with value: 0.4872991004520934.
[I 2024-12-04 15:15:44,997] Trial 1998 finished with value: 0.4883034181863989 and parameters: {'kernel_type': 'Matern', 'length_scale': 1229.777159404718, 'noise_level': 0.0025423190760345527, 'constant_value': 62343.35005586843, 'nu': 0.5}. Best is trial 386 with value: 0.4872991004520934.
[I 2024-12-04 15:15:45,269] Trial 1991 finished with value: 0.48830606905356844 and parameters: {'kernel_type': 'Matern', 'length_scale': 48.61927684102955, 'noise_level': 0.003296509326914881, 'constant_value': 40936.29154626838, 'nu': 0.5}. Best is trial 386 with value: 0.4872991004520934.
[I 2024-12-04 15:15:45,687] Trial 1993 finished with value: 0.48830342284585143 and parameters: {'kernel_type': 'Matern', 'length_scale': 304.16789274437457, 'noise_level': 0.627824920272881, 'constant_value': 70441.81778461303, 'nu': 0.5}. Best is trial 386 with value: 0.4872991004520934.
[I 2024-12-04 15:15:46,029] Trial 1997 finished with value: 1.2614547953941473 and parameters: {'kernel_type': 'Matern', 'length_scale': 243.35807877705375, 'noise_level': 0.03607044979325311, 'constant_value': 72369.84135349194, 'nu': 0.5}. Best is trial 386 with value: 0.4872991004520934.
[I 2024-12-04 15:15:46,030] Trial 1995 finished with value: 1.2614547953941473 and parameters: {'kernel_type': 'Matern', 'length_scale': 386.9617069504972, 'noise_level': 0.032306233281316724, 'constant_value': 66489.19554152893, 'nu': 0.5}. Best is trial 386 with value: 0.4872991004520934.
[I 2024-12-04 15:15:46,225] Trial 2002 finished with value: 0.4883033605469649 and parameters: {'kernel_type': 'Matern', 'length_scale': 4.1908395337011, 'noise_level': 0.012174543837569695, 'constant_value': 3450.149597880732, 'nu': 0.5}. Best is trial 386 with value: 0.4872991004520934.
[I 2024-12-04 15:15:46,900] Trial 1999 finished with value: 0.4883035372458563 and parameters: {'kernel_type': 'Matern', 'length_scale': 71.53989562744937, 'noise_level': 0.12015246388642245, 'constant_value': 17338.24133197709, 'nu': 0.5}. Best is trial 386 with value: 0.4872991004520934.
[I 2024-12-04 15:15:47,321] Trial 1992 finished with value: 1.2401112325806156 and parameters: {'kernel_type': 'RBF', 'length_scale': 76461.16966840933, 'noise_level': 0.012585550347164553, 'constant_value': 719.5010104186557, 'nu': 0.5}. Best is trial 386 with value: 0.4872991004520934.
[I 2024-12-04 15:15:49,242] Trial 2004 finished with value: 0.48830339900381625 and parameters: {'kernel_type': 'Matern', 'length_scale': 137.56050625390753, 'noise_level': 0.11438717604615548, 'constant_value': 66940.20524888288, 'nu': 0.5}. Best is trial 386 with value: 0.4872991004520934.
[I 2024-12-04 15:15:49,925] Trial 2007 finished with value: 0.48830341843787045 and parameters: {'kernel_type': 'Matern', 'length_scale': 278.9652809049978, 'noise_level': 0.003786206491121148, 'constant_value': 32288.957831892378, 'nu': 0.5}. Best is trial 386 with value: 0.4872991004520934.
[I 2024-12-04 15:15:50,266] Trial 1990 finished with value: 0.48830349681939655 and parameters: {'kernel_type': 'Matern', 'length_scale': 4441.769849121811, 'noise_level': 0.9263279547852313, 'constant_value': 99303.98658328476, 'nu': 0.5}. Best is trial 386 with value: 0.4872991004520934.
[I 2024-12-04 15:15:50,371] Trial 2001 finished with value: 0.48830341891699264 and parameters: {'kernel_type': 'Matern', 'length_scale': 200.6836486589031, 'noise_level': 0.0018084228666061378, 'constant_value': 307.6691904514505, 'nu': 0.5}. Best is trial 386 with value: 0.4872991004520934.
[I 2024-12-04 15:15:51,897] Trial 1996 finished with value: 0.48830353206331867 and parameters: {'kernel_type': 'Matern', 'length_scale': 2808.2282412815034, 'noise_level': 0.004113994525629107, 'constant_value': 1982.1198268467094, 'nu': 0.5}. Best is trial 386 with value: 0.4872991004520934.
[I 2024-12-04 15:15:53,010] Trial 2012 finished with value: 0.48830341206762656 and parameters: {'kernel_type': 'Matern', 'length_scale': 276.05348726214925, 'noise_level': 0.035220113227842284, 'constant_value': 1250.2346941779, 'nu': 0.5}. Best is trial 386 with value: 0.4872991004520934.
[I 2024-12-04 15:15:54,608] Trial 2006 finished with value: 0.48830282268964087 and parameters: {'kernel_type': 'Matern', 'length_scale': 443.4401861693206, 'noise_level': 0.01151772211360872, 'constant_value': 33757.99154794081, 'nu': 0.5}. Best is trial 386 with value: 0.4872991004520934.
[I 2024-12-04 15:15:56,422] Trial 2010 finished with value: 0.48830341599912497 and parameters: {'kernel_type': 'Matern', 'length_scale': 474.2332186351195, 'noise_level': 0.09529317904309137, 'constant_value': 95641.46521174173, 'nu': 0.5}. Best is trial 386 with value: 0.4872991004520934.
[I 2024-12-04 15:15:56,423] Trial 2011 finished with value: 0.48830354744786314 and parameters: {'kernel_type': 'Matern', 'length_scale': 428.5109673132575, 'noise_level': 0.007183919330116208, 'constant_value': 65841.53375508888, 'nu': 0.5}. Best is trial 386 with value: 0.4872991004520934.
[I 2024-12-04 15:15:56,923] Trial 2005 finished with value: 0.4883037485708598 and parameters: {'kernel_type': 'Matern', 'length_scale': 17.64602067064224, 'noise_level': 0.9772751184648979, 'constant_value': 6073.2749266267065, 'nu': 0.5}. Best is trial 386 with value: 0.4872991004520934.
[I 2024-12-04 15:15:58,269] Trial 2018 finished with value: 0.48830309482425693 and parameters: {'kernel_type': 'Matern', 'length_scale': 3787.900542537685, 'noise_level': 0.0035306217257535582, 'constant_value': 94540.51769704376, 'nu': 0.5}. Best is trial 386 with value: 0.4872991004520934.
[I 2024-12-04 15:15:58,269] Trial 2013 finished with value: 1.2614547953933302 and parameters: {'kernel_type': 'Matern', 'length_scale': 10.833039460637698, 'noise_level': 0.03151559914384104, 'constant_value': 74431.07610226725, 'nu': 0.5}. Best is trial 386 with value: 0.4872991004520934.
[I 2024-12-04 15:15:59,501] Trial 2014 finished with value: 0.4883034189653512 and parameters: {'kernel_type': 'Matern', 'length_scale': 656.4900562508287, 'noise_level': 0.572035286018786, 'constant_value': 91196.6673964992, 'nu': 0.5}. Best is trial 386 with value: 0.4872991004520934.
[I 2024-12-04 15:15:59,759] Trial 2009 finished with value: 0.4883034185707288 and parameters: {'kernel_type': 'Matern', 'length_scale': 1272.378808561667, 'noise_level': 0.01526650008591134, 'constant_value': 75702.20270438498, 'nu': 0.5}. Best is trial 386 with value: 0.4872991004520934.
[I 2024-12-04 15:16:00,373] Trial 2008 finished with value: 0.48830340823016627 and parameters: {'kernel_type': 'Matern', 'length_scale': 2614.666750073991, 'noise_level': 0.014574690373609114, 'constant_value': 1449.2384745614886, 'nu': 0.5}. Best is trial 386 with value: 0.4872991004520934.
[I 2024-12-04 15:16:00,733] Trial 2017 finished with value: 0.4883034244006429 and parameters: {'kernel_type': 'Matern', 'length_scale': 83798.18986375367, 'noise_level': 0.020109929810401054, 'constant_value': 3172.964055296457, 'nu': 0.5}. Best is trial 386 with value: 0.4872991004520934.
[I 2024-12-04 15:16:01,298] Trial 2022 finished with value: 0.48830335515469897 and parameters: {'kernel_type': 'Matern', 'length_scale': 2049.017259352349, 'noise_level': 0.9983487233049072, 'constant_value': 5739.220172818576, 'nu': 0.5}. Best is trial 386 with value: 0.4872991004520934.
[I 2024-12-04 15:16:02,111] Trial 2015 finished with value: 0.5273053870497246 and parameters: {'kernel_type': 'Matern', 'length_scale': 159.26853263078573, 'noise_level': 0.7713838035034928, 'constant_value': 3368.767771100236, 'nu': 1.5}. Best is trial 386 with value: 0.4872991004520934.
[I 2024-12-04 15:16:02,343] Trial 2021 finished with value: 0.4883034294617293 and parameters: {'kernel_type': 'Matern', 'length_scale': 2761.4554500748873, 'noise_level': 0.019874451941601038, 'constant_value': 296.21681759459585, 'nu': 0.5}. Best is trial 386 with value: 0.4872991004520934.
[I 2024-12-04 15:16:02,479] Trial 2020 finished with value: 1.240111232855203 and parameters: {'kernel_type': 'Matern', 'length_scale': 97556.23627237364, 'noise_level': 0.05772414431290612, 'constant_value': 9.880173564734193, 'nu': 0.5}. Best is trial 386 with value: 0.4872991004520934.
[I 2024-12-04 15:16:02,742] Trial 2030 finished with value: 0.48830341657008625 and parameters: {'kernel_type': 'Matern', 'length_scale': 863.8117715505108, 'noise_level': 0.043375650685395076, 'constant_value': 1929.8081745172915, 'nu': 0.5}. Best is trial 386 with value: 0.4872991004520934.
[I 2024-12-04 15:16:02,753] Trial 2019 finished with value: 1.2401112326475312 and parameters: {'kernel_type': 'RBF', 'length_scale': 2457.725054975417, 'noise_level': 0.005196539361215866, 'constant_value': 17823.663804995856, 'nu': 0.5}. Best is trial 386 with value: 0.4872991004520934.
[I 2024-12-04 15:16:03,393] Trial 2026 finished with value: 0.4883034189363496 and parameters: {'kernel_type': 'Matern', 'length_scale': 94134.18177494551, 'noise_level': 0.0195641297591546, 'constant_value': 1865.6389751787199, 'nu': 0.5}. Best is trial 386 with value: 0.4872991004520934.
[I 2024-12-04 15:16:05,294] Trial 2003 finished with value: 0.4883033406594012 and parameters: {'kernel_type': 'Matern', 'length_scale': 78479.07148936584, 'noise_level': 0.9807440602117059, 'constant_value': 54722.05820075046, 'nu': 0.5}. Best is trial 386 with value: 0.4872991004520934.
[I 2024-12-04 15:16:06,018] Trial 2028 finished with value: 0.4883032913213955 and parameters: {'kernel_type': 'Matern', 'length_scale': 39.6502381844105, 'noise_level': 0.0021759452118928547, 'constant_value': 204.88982834307126, 'nu': 0.5}. Best is trial 386 with value: 0.4872991004520934.
