[I 2024-12-04 00:23:35,901] Trial 1541 finished with value: 0.18963315104035755 and parameters: {'kernel': 'rbf', 'C': 96.02593241725013, 'gamma': 0.0349878693581764, 'epsilon': 0.0010770904839219062}. Best is trial 1479 with value: 0.13978216740910654.
[I 2024-12-04 00:23:36,802] Trial 1547 finished with value: 0.28973294239247843 and parameters: {'kernel': 'rbf', 'C': 16.47736336965782, 'gamma': 0.0019707642139127892, 'epsilon': 0.0010234273368213054}. Best is trial 1479 with value: 0.13978216740910654.
[I 2024-12-04 00:23:38,133] Trial 1548 finished with value: 0.24243846263898805 and parameters: {'kernel': 'rbf', 'C': 55.01351528736363, 'gamma': 0.001736620417675728, 'epsilon': 0.0010405268230536534}. Best is trial 1479 with value: 0.13978216740910654.
[I 2024-12-04 00:23:38,687] Trial 1549 finished with value: 461.4923829919811 and parameters: {'kernel': 'sigmoid', 'C': 21.341986670209835, 'gamma': 0.1533232263179135, 'epsilon': 0.0011856578796080176}. Best is trial 1479 with value: 0.13978216740910654.
[I 2024-12-04 00:23:38,768] Trial 1550 finished with value: 0.2788843880085113 and parameters: {'kernel': 'rbf', 'C': 10.040799012121369, 'gamma': 0.003710237249745786, 'epsilon': 0.0010292426368759214}. Best is trial 1479 with value: 0.13978216740910654.
[I 2024-12-04 00:23:39,413] Trial 1551 finished with value: 0.907404128912703 and parameters: {'kernel': 'poly', 'C': 0.4723448904516071, 'gamma': 0.0035540215824144817, 'epsilon': 0.002586696174531188}. Best is trial 1479 with value: 0.13978216740910654.
[I 2024-12-04 00:23:41,608] Trial 1552 finished with value: 0.1609552700382198 and parameters: {'kernel': 'rbf', 'C': 16.315142394968777, 'gamma': 0.016437868271876474, 'epsilon': 0.001070373536540621}. Best is trial 1479 with value: 0.13978216740910654.
[I 2024-12-04 00:23:42,809] Trial 1553 finished with value: 0.16137688177429857 and parameters: {'kernel': 'rbf', 'C': 14.710477853970257, 'gamma': 0.01789105004860958, 'epsilon': 0.00238981976242769}. Best is trial 1479 with value: 0.13978216740910654.
[I 2024-12-04 00:23:43,093] Trial 1555 finished with value: 0.2148975679630319 and parameters: {'kernel': 'rbf', 'C': 25.36013929182622, 'gamma': 0.005685929534376835, 'epsilon': 0.0010135456165888544}. Best is trial 1479 with value: 0.13978216740910654.
[I 2024-12-04 00:23:44,800] Trial 1556 finished with value: 0.2313848704384759 and parameters: {'kernel': 'rbf', 'C': 97.53410241514426, 'gamma': 0.0013149304413687447, 'epsilon': 0.002497284631329904}. Best is trial 1479 with value: 0.13978216740910654.
[I 2024-12-04 00:23:47,372] Trial 1559 finished with value: 0.9947561530321696 and parameters: {'kernel': 'rbf', 'C': 0.00106576152263469, 'gamma': 0.48818698857582, 'epsilon': 0.006274864484514507}. Best is trial 1479 with value: 0.13978216740910654.
[I 2024-12-04 00:23:49,392] Trial 1557 finished with value: 0.14880275796582948 and parameters: {'kernel': 'rbf', 'C': 89.05018889964589, 'gamma': 0.006011264353819839, 'epsilon': 0.003453845897762815}. Best is trial 1479 with value: 0.13978216740910654.
[I 2024-12-04 00:23:50,144] Trial 1554 finished with value: 0.21519163665988936 and parameters: {'kernel': 'rbf', 'C': 86.56801776444277, 'gamma': 0.06386744999500944, 'epsilon': 0.001011620505152101}. Best is trial 1479 with value: 0.13978216740910654.
[I 2024-12-04 00:23:51,379] Trial 1560 finished with value: 0.7321747058667695 and parameters: {'kernel': 'poly', 'C': 97.55097485307795, 'gamma': 0.003198855622850893, 'epsilon': 0.0024240303074220095}. Best is trial 1479 with value: 0.13978216740910654.
[I 2024-12-04 00:23:51,466] Trial 1558 finished with value: 0.16706793436039416 and parameters: {'kernel': 'rbf', 'C': 84.64197262591834, 'gamma': 0.017033494254032968, 'epsilon': 0.0011268705718588676}. Best is trial 1479 with value: 0.13978216740910654.
[I 2024-12-04 00:23:51,741] Trial 1561 finished with value: 1937.7693754511338 and parameters: {'kernel': 'sigmoid', 'C': 83.90806511331095, 'gamma': 0.05157123489212408, 'epsilon': 0.0010239693370226216}. Best is trial 1479 with value: 0.13978216740910654.
[I 2024-12-04 00:23:54,666] Trial 1563 finished with value: 0.22900017131055891 and parameters: {'kernel': 'rbf', 'C': 74.99829190110611, 'gamma': 0.0017211607829464644, 'epsilon': 0.0010757281656270155}. Best is trial 1479 with value: 0.13978216740910654.
[I 2024-12-04 00:23:55,736] Trial 1564 finished with value: 0.2063602657238389 and parameters: {'kernel': 'rbf', 'C': 96.41888368423565, 'gamma': 0.002188552402178176, 'epsilon': 0.0011927194598618457}. Best is trial 1479 with value: 0.13978216740910654.
[I 2024-12-04 00:23:57,943] Trial 1566 finished with value: 0.2001301078150351 and parameters: {'kernel': 'rbf', 'C': 18.125150107083282, 'gamma': 0.00880209925992885, 'epsilon': 0.0011656518558803557}. Best is trial 1479 with value: 0.13978216740910654.
[I 2024-12-04 00:23:59,212] Trial 1562 finished with value: 0.1698469937008244 and parameters: {'kernel': 'rbf', 'C': 99.76553330435176, 'gamma': 0.017160102244814828, 'epsilon': 0.0012846421068785077}. Best is trial 1479 with value: 0.13978216740910654.
[I 2024-12-04 00:24:00,847] Trial 1567 finished with value: 0.14755750085082897 and parameters: {'kernel': 'rbf', 'C': 82.65240291320215, 'gamma': 0.006234106863010212, 'epsilon': 0.0011239536666260892}. Best is trial 1479 with value: 0.13978216740910654.
[I 2024-12-04 00:24:02,082] Trial 1565 finished with value: 0.17025410345800845 and parameters: {'kernel': 'rbf', 'C': 92.85189218825582, 'gamma': 0.01867169001219596, 'epsilon': 0.0011279345129311432}. Best is trial 1479 with value: 0.13978216740910654.
[I 2024-12-04 00:24:02,260] Trial 1569 finished with value: 0.2390246287612512 and parameters: {'kernel': 'rbf', 'C': 20.11889377754818, 'gamma': 0.004860453923261946, 'epsilon': 0.002806831979256107}. Best is trial 1479 with value: 0.13978216740910654.
[I 2024-12-04 00:24:03,340] Trial 1570 finished with value: 0.9859620777958445 and parameters: {'kernel': 'rbf', 'C': 0.0014807277140596927, 'gamma': 0.27705706517819584, 'epsilon': 0.16368960795318863}. Best is trial 1479 with value: 0.13978216740910654.
[I 2024-12-04 00:24:03,345] Trial 1270 finished with value: 0.3533801882014689 and parameters: {'kernel': 'linear', 'C': 93.55502200609955, 'gamma': 0.003948505258938384, 'epsilon': 0.008311521444934973}. Best is trial 1479 with value: 0.13978216740910654.
[I 2024-12-04 00:24:03,803] Trial 1568 finished with value: 0.14057398619849903 and parameters: {'kernel': 'rbf', 'C': 97.07130800228434, 'gamma': 0.007776593211546439, 'epsilon': 0.0034914701988550258}. Best is trial 1479 with value: 0.13978216740910654.
[I 2024-12-04 00:24:06,205] Trial 1571 finished with value: 0.18139639097489837 and parameters: {'kernel': 'rbf', 'C': 90.19900437409092, 'gamma': 0.003301102208333743, 'epsilon': 0.00292079176339835}. Best is trial 1479 with value: 0.13978216740910654.
[I 2024-12-04 00:24:06,544] Trial 1574 finished with value: 0.26747323814024937 and parameters: {'kernel': 'rbf', 'C': 2.5796113803211163, 'gamma': 0.01572018749422726, 'epsilon': 0.0012960159711690328}. Best is trial 1479 with value: 0.13978216740910654.
[I 2024-12-04 00:24:07,789] Trial 1573 finished with value: 0.14941591387011732 and parameters: {'kernel': 'rbf', 'C': 21.064626496563857, 'gamma': 0.017442342359507, 'epsilon': 0.0023067999490229644}. Best is trial 1479 with value: 0.13978216740910654.
[I 2024-12-04 00:24:08,561] Trial 1575 finished with value: 0.16731118718176993 and parameters: {'kernel': 'rbf', 'C': 15.203417470218044, 'gamma': 0.03440393391216133, 'epsilon': 0.002260856939416863}. Best is trial 1479 with value: 0.13978216740910654.
[I 2024-12-04 00:24:09,956] Trial 1572 finished with value: 0.15227621479742845 and parameters: {'kernel': 'rbf', 'C': 86.58775694050391, 'gamma': 0.012601858354997015, 'epsilon': 0.0010917029794422742}. Best is trial 1479 with value: 0.13978216740910654.
[I 2024-12-04 00:24:09,976] Trial 1577 finished with value: 0.17876095077960277 and parameters: {'kernel': 'rbf', 'C': 22.028207006695336, 'gamma': 0.009675645440030833, 'epsilon': 0.0010117049899993201}. Best is trial 1479 with value: 0.13978216740910654.
[I 2024-12-04 00:24:11,727] Trial 1578 finished with value: 0.1544577310033806 and parameters: {'kernel': 'rbf', 'C': 24.376775149599066, 'gamma': 0.01346953720610446, 'epsilon': 0.002791968372540601}. Best is trial 1479 with value: 0.13978216740910654.
[I 2024-12-04 00:24:11,729] Trial 1579 finished with value: 0.20677346167791238 and parameters: {'kernel': 'rbf', 'C': 14.721890749159519, 'gamma': 0.009669489729931601, 'epsilon': 0.0010611817593007098}. Best is trial 1479 with value: 0.13978216740910654.
[I 2024-12-04 00:24:13,814] Trial 1576 finished with value: 0.20636182314719057 and parameters: {'kernel': 'rbf', 'C': 32.78283647948439, 'gamma': 0.06086203723685888, 'epsilon': 0.0010170184667966668}. Best is trial 1479 with value: 0.13978216740910654.
[I 2024-12-04 00:24:17,629] Trial 1584 finished with value: 0.16518687059314197 and parameters: {'kernel': 'rbf', 'C': 24.175580906632227, 'gamma': 0.010933192571781401, 'epsilon': 0.002360372991215297}. Best is trial 1479 with value: 0.13978216740910654.
[I 2024-12-04 00:24:18,392] Trial 1580 finished with value: 0.17572444268419904 and parameters: {'kernel': 'rbf', 'C': 74.2493192140024, 'gamma': 0.02518809475862726, 'epsilon': 0.0010134769324412834}. Best is trial 1479 with value: 0.13978216740910654.
[I 2024-12-04 00:24:19,046] Trial 1581 finished with value: 0.16975764435227556 and parameters: {'kernel': 'rbf', 'C': 86.0046148368855, 'gamma': 0.018579017055063894, 'epsilon': 0.0011050165912659556}. Best is trial 1479 with value: 0.13978216740910654.
[I 2024-12-04 00:24:21,714] Trial 1583 finished with value: 0.16640938932304528 and parameters: {'kernel': 'rbf', 'C': 88.0572422681685, 'gamma': 0.016280418328692026, 'epsilon': 0.0010080087610214658}. Best is trial 1479 with value: 0.13978216740910654.
[I 2024-12-04 00:24:23,536] Trial 1587 finished with value: 0.1664461838701426 and parameters: {'kernel': 'rbf', 'C': 78.06130823186966, 'gamma': 0.0044617184976919345, 'epsilon': 0.002329243601849922}. Best is trial 1479 with value: 0.13978216740910654.
[I 2024-12-04 00:24:24,332] Trial 1586 finished with value: 0.14218143299400096 and parameters: {'kernel': 'rbf', 'C': 86.38905434257819, 'gamma': 0.0070857351082702505, 'epsilon': 0.0010584429581242216}. Best is trial 1479 with value: 0.13978216740910654.
[I 2024-12-04 00:24:25,802] Trial 1585 finished with value: 0.1678186792265916 and parameters: {'kernel': 'rbf', 'C': 99.86951265066357, 'gamma': 0.01723697186723071, 'epsilon': 0.00376766320545145}. Best is trial 1479 with value: 0.13978216740910654.
[I 2024-12-04 00:24:27,587] Trial 1589 finished with value: 0.1847991719808425 and parameters: {'kernel': 'rbf', 'C': 87.7713415818973, 'gamma': 0.003220030780369142, 'epsilon': 0.0010160094585210846}. Best is trial 1479 with value: 0.13978216740910654.
[I 2024-12-04 00:24:28,704] Trial 1591 finished with value: 0.3327863299787625 and parameters: {'kernel': 'rbf', 'C': 2.8313370057638116, 'gamma': 0.004837432137537321, 'epsilon': 0.00281648596459904}. Best is trial 1479 with value: 0.13978216740910654.
[I 2024-12-04 00:24:29,236] Trial 1592 finished with value: 0.5418048524042488 and parameters: {'kernel': 'rbf', 'C': 38.759188967309704, 'gamma': 0.0001078625402978115, 'epsilon': 0.7459645777641787}. Best is trial 1479 with value: 0.13978216740910654.
[I 2024-12-04 00:24:31,770] Trial 1590 finished with value: 0.15441835084760733 and parameters: {'kernel': 'rbf', 'C': 91.33985500829463, 'gamma': 0.012756248330839399, 'epsilon': 0.002391823871982903}. Best is trial 1479 with value: 0.13978216740910654.
[I 2024-12-04 00:24:32,544] Trial 1594 finished with value: 0.23729865851590198 and parameters: {'kernel': 'rbf', 'C': 21.221966433525242, 'gamma': 0.004764161554250153, 'epsilon': 0.0023459440021866484}. Best is trial 1479 with value: 0.13978216740910654.
[I 2024-12-04 00:24:33,867] Trial 1442 finished with value: 0.35386039625074395 and parameters: {'kernel': 'linear', 'C': 46.921678834172035, 'gamma': 0.24159530637170454, 'epsilon': 0.0033977368126400422}. Best is trial 1479 with value: 0.13978216740910654.
[I 2024-12-04 00:24:34,382] Trial 1593 finished with value: 0.14440830587377862 and parameters: {'kernel': 'rbf', 'C': 97.30573235246847, 'gamma': 0.006655075236268265, 'epsilon': 0.004551113716819862}. Best is trial 1479 with value: 0.13978216740910654.
[I 2024-12-04 00:24:34,383] Trial 1595 finished with value: 0.5646181241997973 and parameters: {'kernel': 'rbf', 'C': 1.7624093235498308, 'gamma': 0.00047613054523463604, 'epsilon': 0.0011131880368555151}. Best is trial 1479 with value: 0.13978216740910654.
[I 2024-12-04 00:24:36,154] Trial 1596 finished with value: 0.19345728736530388 and parameters: {'kernel': 'rbf', 'C': 94.60167764257253, 'gamma': 0.0027418683443605437, 'epsilon': 0.0030216554040526956}. Best is trial 1479 with value: 0.13978216740910654.
[I 2024-12-04 00:24:37,592] Trial 1599 finished with value: 0.28015786064708786 and parameters: {'kernel': 'rbf', 'C': 18.066411606800013, 'gamma': 0.0020914157413187058, 'epsilon': 0.0011143424498439851}. Best is trial 1479 with value: 0.13978216740910654.
[I 2024-12-04 00:24:37,949] Trial 1597 finished with value: 0.17661360395088585 and parameters: {'kernel': 'rbf', 'C': 99.51694329283654, 'gamma': 0.0032601302922511343, 'epsilon': 0.001881285692222246}. Best is trial 1479 with value: 0.13978216740910654.
[I 2024-12-04 00:24:38,316] Trial 1598 finished with value: 0.2098285389252511 and parameters: {'kernel': 'rbf', 'C': 74.16331147045088, 'gamma': 0.002578489028643845, 'epsilon': 0.0010076960963532548}. Best is trial 1479 with value: 0.13978216740910654.
[I 2024-12-04 00:24:39,992] Trial 1600 finished with value: 0.30862288714143243 and parameters: {'kernel': 'rbf', 'C': 85.44351819588121, 'gamma': 0.18638537030361998, 'epsilon': 0.0028813614775792923}. Best is trial 1479 with value: 0.13978216740910654.
[I 2024-12-04 00:24:40,267] Trial 1601 finished with value: 750.7117102706369 and parameters: {'kernel': 'sigmoid', 'C': 97.47792087682816, 'gamma': 0.005417342392528436, 'epsilon': 0.0012903282913668066}. Best is trial 1479 with value: 0.13978216740910654.
[I 2024-12-04 00:24:40,272] Trial 1602 finished with value: 1.9194690386336184 and parameters: {'kernel': 'sigmoid', 'C': 0.06518539778156995, 'gamma': 0.49333298836265715, 'epsilon': 0.02467600800608222}. Best is trial 1479 with value: 0.13978216740910654.
[I 2024-12-04 00:24:41,467] Trial 1603 finished with value: 0.276527643995838 and parameters: {'kernel': 'rbf', 'C': 32.383783779261066, 'gamma': 0.0013544839843174694, 'epsilon': 0.003010117580057014}. Best is trial 1479 with value: 0.13978216740910654.
[I 2024-12-04 00:24:44,183] Trial 1604 finished with value: 0.16918825203735058 and parameters: {'kernel': 'rbf', 'C': 10.556428970412066, 'gamma': 0.020789082414257143, 'epsilon': 0.0010265877085127075}. Best is trial 1479 with value: 0.13978216740910654.
[I 2024-12-04 00:24:44,514] Trial 1606 finished with value: 0.2850572822446073 and parameters: {'kernel': 'rbf', 'C': 21.43934018233251, 'gamma': 0.0016877365588030514, 'epsilon': 0.0010023361109319682}. Best is trial 1479 with value: 0.13978216740910654.
[I 2024-12-04 00:24:45,322] Trial 1605 finished with value: 0.14915146139469812 and parameters: {'kernel': 'rbf', 'C': 18.859320204900214, 'gamma': 0.01998424812919281, 'epsilon': 0.00279401068734954}. Best is trial 1479 with value: 0.13978216740910654.
[I 2024-12-04 00:24:50,333] Trial 1608 finished with value: 0.14584241717103522 and parameters: {'kernel': 'rbf', 'C': 91.80946209013138, 'gamma': 0.006322631667843607, 'epsilon': 0.0031509504059394873}. Best is trial 1479 with value: 0.13978216740910654.
[I 2024-12-04 00:24:51,708] Trial 1607 finished with value: 0.22103253767083275 and parameters: {'kernel': 'rbf', 'C': 97.01028590588564, 'gamma': 0.07516259486045508, 'epsilon': 0.0016803167564577181}. Best is trial 1479 with value: 0.13978216740910654.
[I 2024-12-04 00:24:54,703] Trial 1610 finished with value: 0.17281454940822832 and parameters: {'kernel': 'rbf', 'C': 91.52303932372054, 'gamma': 0.022388389425026953, 'epsilon': 0.0035553905951347035}. Best is trial 1479 with value: 0.13978216740910654.
[I 2024-12-04 00:24:55,498] Trial 1612 finished with value: 0.1845039971561961 and parameters: {'kernel': 'rbf', 'C': 33.668009293553354, 'gamma': 0.006702555082849927, 'epsilon': 0.002627185600144325}. Best is trial 1479 with value: 0.13978216740910654.
[I 2024-12-04 00:24:56,125] Trial 1611 finished with value: 0.14651438185412383 and parameters: {'kernel': 'rbf', 'C': 99.7895054791825, 'gamma': 0.005900884885827722, 'epsilon': 0.0018700095241628767}. Best is trial 1479 with value: 0.13978216740910654.
[I 2024-12-04 00:24:57,672] Trial 1312 finished with value: 0.3530201363188668 and parameters: {'kernel': 'linear', 'C': 83.9710130591884, 'gamma': 0.01730790050830583, 'epsilon': 0.002059718463808492}. Best is trial 1479 with value: 0.13978216740910654.
[I 2024-12-04 00:24:58,539] Trial 1614 finished with value: 0.3716264780632825 and parameters: {'kernel': 'linear', 'C': 0.0858903168325824, 'gamma': 0.17355851236061207, 'epsilon': 0.04801840560042561}. Best is trial 1479 with value: 0.13978216740910654.
[I 2024-12-04 00:24:59,003] Trial 1613 finished with value: 0.14843833389260097 and parameters: {'kernel': 'rbf', 'C': 21.281910887103717, 'gamma': 0.021483414188647947, 'epsilon': 0.002866932486881547}. Best is trial 1479 with value: 0.13978216740910654.
[I 2024-12-04 00:25:00,312] Trial 1615 finished with value: 0.19486926805408253 and parameters: {'kernel': 'rbf', 'C': 17.51909522238741, 'gamma': 0.04972367296932748, 'epsilon': 0.0010090093155556204}. Best is trial 1479 with value: 0.13978216740910654.
[I 2024-12-04 00:25:00,313] Trial 1616 finished with value: 0.2220274484054257 and parameters: {'kernel': 'rbf', 'C': 23.046295534902, 'gamma': 0.005588314034248248, 'epsilon': 0.0020293861955960786}. Best is trial 1479 with value: 0.13978216740910654.
[I 2024-12-04 00:25:01,836] Trial 1618 finished with value: 0.3711405132183968 and parameters: {'kernel': 'rbf', 'C': 65.03079229847354, 'gamma': 0.0002404170675798487, 'epsilon': 0.0037971362713112027}. Best is trial 1479 with value: 0.13978216740910654.
[I 2024-12-04 00:25:03,211] Trial 1620 finished with value: 0.24365314596146825 and parameters: {'kernel': 'rbf', 'C': 16.59321783094668, 'gamma': 0.005267517255731972, 'epsilon': 0.0026472149795318065}. Best is trial 1479 with value: 0.13978216740910654.
[I 2024-12-04 00:25:04,476] Trial 1619 finished with value: 0.15382212461583936 and parameters: {'kernel': 'rbf', 'C': 33.311058247758005, 'gamma': 0.010247475074348521, 'epsilon': 0.002485618158892799}. Best is trial 1479 with value: 0.13978216740910654.
[I 2024-12-04 00:25:05,137] Trial 1617 finished with value: 0.16373445609171175 and parameters: {'kernel': 'rbf', 'C': 96.80035048863867, 'gamma': 0.014652278739252475, 'epsilon': 0.0011239537626636035}. Best is trial 1479 with value: 0.13978216740910654.
[I 2024-12-04 00:25:06,460] Trial 1622 finished with value: 0.206672165536843 and parameters: {'kernel': 'rbf', 'C': 99.40930402836682, 'gamma': 0.0021020740094755777, 'epsilon': 0.0040129546048622115}. Best is trial 1479 with value: 0.13978216740910654.
[I 2024-12-04 00:25:07,719] Trial 1623 finished with value: 0.21716652888046367 and parameters: {'kernel': 'rbf', 'C': 24.16361880090107, 'gamma': 0.005811610315973894, 'epsilon': 0.003069995240574877}. Best is trial 1479 with value: 0.13978216740910654.
[I 2024-12-04 00:25:07,796] Trial 1624 finished with value: 0.2719714586392862 and parameters: {'kernel': 'rbf', 'C': 25.825451194678894, 'gamma': 0.0017694338922118347, 'epsilon': 0.002650790609554785}. Best is trial 1479 with value: 0.13978216740910654.
[I 2024-12-04 00:25:07,798] Trial 1621 finished with value: 0.1424393697299149 and parameters: {'kernel': 'rbf', 'C': 90.93706254861767, 'gamma': 0.006827628300109355, 'epsilon': 0.0011535578678339871}. Best is trial 1479 with value: 0.13978216740910654.
[I 2024-12-04 00:25:09,860] Trial 1625 finished with value: 0.2748977280520433 and parameters: {'kernel': 'rbf', 'C': 6.368457083597776, 'gamma': 0.00608780844585896, 'epsilon': 0.00105568771479804}. Best is trial 1479 with value: 0.13978216740910654.
[I 2024-12-04 00:25:11,350] Trial 1626 finished with value: 0.31831660270204026 and parameters: {'kernel': 'rbf', 'C': 22.887776190214634, 'gamma': 0.0010377624555508393, 'epsilon': 0.008388530889937379}. Best is trial 1479 with value: 0.13978216740910654.
[I 2024-12-04 00:25:12,167] Trial 1628 finished with value: 0.1753389973702406 and parameters: {'kernel': 'rbf', 'C': 15.308391842457304, 'gamma': 0.013708960086169049, 'epsilon': 0.0021922277562366455}. Best is trial 1479 with value: 0.13978216740910654.
[I 2024-12-04 00:25:12,941] Trial 1630 finished with value: 0.5071948117791222 and parameters: {'kernel': 'rbf', 'C': 11.867031498602667, 'gamma': 0.002794371271908007, 'epsilon': 0.9065156506675873}. Best is trial 1479 with value: 0.13978216740910654.
[I 2024-12-04 00:25:13,701] Trial 1396 finished with value: 0.353160856793961 and parameters: {'kernel': 'linear', 'C': 95.47371743730109, 'gamma': 0.37358019964951217, 'epsilon': 0.0391848586286054}. Best is trial 1479 with value: 0.13978216740910654.
[I 2024-12-04 00:25:14,194] Trial 1627 finished with value: 0.14045310870466846 and parameters: {'kernel': 'rbf', 'C': 92.75600931411095, 'gamma': 0.008533742896901678, 'epsilon': 0.002044402187438298}. Best is trial 1479 with value: 0.13978216740910654.
[I 2024-12-04 00:25:15,427] Trial 1629 finished with value: 0.14608596162055945 and parameters: {'kernel': 'rbf', 'C': 91.65135218051574, 'gamma': 0.011230300552021476, 'epsilon': 0.0030303972639932598}. Best is trial 1479 with value: 0.13978216740910654.
