[I 2024-12-04 12:15:16,234] A new study created in RDB with name: Tc_gb
[I 2024-12-04 12:15:26,145] Trial 6 finished with value: 0.3797782050536306 and parameters: {'n_estimators': 572, 'learning_rate': 0.04730699009721845, 'max_depth': 7, 'min_samples_split': 15, 'min_samples_leaf': 3, 'subsample': 0.9614521589940268, 'max_features': 'log2'}. Best is trial 6 with value: 0.3797782050536306.
[I 2024-12-04 12:15:26,816] Trial 5 finished with value: 0.5516418609974278 and parameters: {'n_estimators': 274, 'learning_rate': 0.020575820398673502, 'max_depth': 4, 'min_samples_split': 14, 'min_samples_leaf': 4, 'subsample': 0.7727524072883653, 'max_features': 'sqrt'}. Best is trial 6 with value: 0.3797782050536306.
[I 2024-12-04 12:15:27,035] Trial 0 finished with value: 0.6734773884950975 and parameters: {'n_estimators': 527, 'learning_rate': 0.03291339924318619, 'max_depth': 8, 'min_samples_split': 9, 'min_samples_leaf': 10, 'subsample': 0.7046617096042328, 'max_features': 'log2'}. Best is trial 6 with value: 0.3797782050536306.
[I 2024-12-04 12:15:31,040] Trial 1 finished with value: 0.9045660543393903 and parameters: {'n_estimators': 126, 'learning_rate': 0.01613623654790185, 'max_depth': 12, 'min_samples_split': 10, 'min_samples_leaf': 6, 'subsample': 0.7004821960760323, 'max_features': 'log2'}. Best is trial 6 with value: 0.3797782050536306.
[I 2024-12-04 12:15:31,091] Trial 15 finished with value: 0.46010527569080795 and parameters: {'n_estimators': 520, 'learning_rate': 0.012692126528695682, 'max_depth': 8, 'min_samples_split': 7, 'min_samples_leaf': 6, 'subsample': 0.7169522567095559, 'max_features': 'sqrt'}. Best is trial 6 with value: 0.3797782050536306.
[I 2024-12-04 12:15:33,237] Trial 12 finished with value: 0.844132758321594 and parameters: {'n_estimators': 413, 'learning_rate': 0.01014445817131208, 'max_depth': 4, 'min_samples_split': 20, 'min_samples_leaf': 8, 'subsample': 0.7862524419847512, 'max_features': 'log2'}. Best is trial 6 with value: 0.3797782050536306.
[I 2024-12-04 12:15:36,203] Trial 16 finished with value: 0.49829488839126734 and parameters: {'n_estimators': 475, 'learning_rate': 0.016012227540589764, 'max_depth': 7, 'min_samples_split': 17, 'min_samples_leaf': 9, 'subsample': 0.9319518496296508, 'max_features': 'sqrt'}. Best is trial 6 with value: 0.3797782050536306.
[I 2024-12-04 12:15:38,649] Trial 18 finished with value: 0.3162160522286937 and parameters: {'n_estimators': 214, 'learning_rate': 0.038539467408138225, 'max_depth': 8, 'min_samples_split': 2, 'min_samples_leaf': 1, 'subsample': 0.9163896541757379, 'max_features': None}. Best is trial 18 with value: 0.3162160522286937.
[I 2024-12-04 12:15:40,123] Trial 2 finished with value: 0.5306679537568237 and parameters: {'n_estimators': 240, 'learning_rate': 0.011505881402967525, 'max_depth': 10, 'min_samples_split': 17, 'min_samples_leaf': 4, 'subsample': 0.856412143639638, 'max_features': 'sqrt'}. Best is trial 18 with value: 0.3162160522286937.
[I 2024-12-04 12:15:47,052] Trial 4 finished with value: 0.34384365199205147 and parameters: {'n_estimators': 892, 'learning_rate': 0.024456894589921632, 'max_depth': 11, 'min_samples_split': 7, 'min_samples_leaf': 7, 'subsample': 0.9707808622317882, 'max_features': None}. Best is trial 18 with value: 0.3162160522286937.
[I 2024-12-04 12:15:47,430] Trial 37 finished with value: 0.40361367564912176 and parameters: {'n_estimators': 247, 'learning_rate': 0.06520994009897996, 'max_depth': 4, 'min_samples_split': 9, 'min_samples_leaf': 10, 'subsample': 0.8572868045238525, 'max_features': None}. Best is trial 18 with value: 0.3162160522286937.
[I 2024-12-04 12:15:48,456] Trial 10 finished with value: 0.3160926035293926 and parameters: {'n_estimators': 493, 'learning_rate': 0.03288978772153175, 'max_depth': 7, 'min_samples_split': 7, 'min_samples_leaf': 1, 'subsample': 0.6547616524521325, 'max_features': 'sqrt'}. Best is trial 10 with value: 0.3160926035293926.
[I 2024-12-04 12:15:48,467] Trial 17 finished with value: 0.32472549738660716 and parameters: {'n_estimators': 518, 'learning_rate': 0.06276702771040385, 'max_depth': 9, 'min_samples_split': 16, 'min_samples_leaf': 2, 'subsample': 0.6998320233348313, 'max_features': 'log2'}. Best is trial 10 with value: 0.3160926035293926.
[I 2024-12-04 12:15:52,903] Trial 19 finished with value: 0.586200083000097 and parameters: {'n_estimators': 589, 'learning_rate': 0.013671319236307036, 'max_depth': 4, 'min_samples_split': 8, 'min_samples_leaf': 1, 'subsample': 0.9074181213336971, 'max_features': 'log2'}. Best is trial 10 with value: 0.3160926035293926.
[I 2024-12-04 12:15:54,945] Trial 28 finished with value: 0.27849057072938393 and parameters: {'n_estimators': 896, 'learning_rate': 0.09784364821899245, 'max_depth': 5, 'min_samples_split': 18, 'min_samples_leaf': 4, 'subsample': 0.9782031430296401, 'max_features': 'sqrt'}. Best is trial 28 with value: 0.27849057072938393.
[I 2024-12-04 12:15:57,154] Trial 3 finished with value: 0.36356970960297835 and parameters: {'n_estimators': 1119, 'learning_rate': 0.04932650407450817, 'max_depth': 10, 'min_samples_split': 18, 'min_samples_leaf': 6, 'subsample': 0.9371712500782883, 'max_features': 'log2'}. Best is trial 28 with value: 0.27849057072938393.
[I 2024-12-04 12:15:57,169] Trial 32 finished with value: 0.3716489679264192 and parameters: {'n_estimators': 484, 'learning_rate': 0.022778276718824562, 'max_depth': 4, 'min_samples_split': 7, 'min_samples_leaf': 5, 'subsample': 0.9264753848923825, 'max_features': None}. Best is trial 28 with value: 0.27849057072938393.
[I 2024-12-04 12:15:59,895] Trial 26 finished with value: 0.40301733060882766 and parameters: {'n_estimators': 1070, 'learning_rate': 0.06229808183709624, 'max_depth': 5, 'min_samples_split': 3, 'min_samples_leaf': 9, 'subsample': 0.8479406819777093, 'max_features': 'sqrt'}. Best is trial 28 with value: 0.27849057072938393.
[I 2024-12-04 12:16:01,815] Trial 31 finished with value: 0.5277541284590637 and parameters: {'n_estimators': 668, 'learning_rate': 0.027755295604146555, 'max_depth': 3, 'min_samples_split': 13, 'min_samples_leaf': 5, 'subsample': 0.960039115007384, 'max_features': 'log2'}. Best is trial 28 with value: 0.27849057072938393.
[I 2024-12-04 12:16:02,289] Trial 14 finished with value: 0.371087779141146 and parameters: {'n_estimators': 677, 'learning_rate': 0.0358684346378093, 'max_depth': 12, 'min_samples_split': 2, 'min_samples_leaf': 10, 'subsample': 0.8581130344445356, 'max_features': None}. Best is trial 28 with value: 0.27849057072938393.
[I 2024-12-04 12:16:04,361] Trial 22 finished with value: 0.443726376921846 and parameters: {'n_estimators': 925, 'learning_rate': 0.015517394781043274, 'max_depth': 3, 'min_samples_split': 9, 'min_samples_leaf': 5, 'subsample': 0.6791552850386973, 'max_features': 'sqrt'}. Best is trial 28 with value: 0.27849057072938393.
[I 2024-12-04 12:16:04,495] Trial 41 finished with value: 0.4944601420930714 and parameters: {'n_estimators': 196, 'learning_rate': 0.040238793966439104, 'max_depth': 10, 'min_samples_split': 7, 'min_samples_leaf': 3, 'subsample': 0.969828499734041, 'max_features': 'log2'}. Best is trial 28 with value: 0.27849057072938393.
[I 2024-12-04 12:16:06,689] Trial 20 finished with value: 0.4463278508532419 and parameters: {'n_estimators': 1163, 'learning_rate': 0.01353824032696163, 'max_depth': 7, 'min_samples_split': 3, 'min_samples_leaf': 3, 'subsample': 0.6860426442730008, 'max_features': 'log2'}. Best is trial 28 with value: 0.27849057072938393.
[I 2024-12-04 12:16:08,836] Trial 24 finished with value: 0.4309847308582139 and parameters: {'n_estimators': 991, 'learning_rate': 0.021077585103939565, 'max_depth': 7, 'min_samples_split': 17, 'min_samples_leaf': 9, 'subsample': 0.7812655471685469, 'max_features': 'sqrt'}. Best is trial 28 with value: 0.27849057072938393.
[I 2024-12-04 12:16:10,109] Trial 9 finished with value: 0.33413941726573093 and parameters: {'n_estimators': 875, 'learning_rate': 0.040282293711831105, 'max_depth': 8, 'min_samples_split': 4, 'min_samples_leaf': 6, 'subsample': 0.7215842471472567, 'max_features': None}. Best is trial 28 with value: 0.27849057072938393.
[I 2024-12-04 12:16:12,022] Trial 23 finished with value: 0.3494582203753216 and parameters: {'n_estimators': 1014, 'learning_rate': 0.01453512792623782, 'max_depth': 11, 'min_samples_split': 14, 'min_samples_leaf': 1, 'subsample': 0.8265667390327047, 'max_features': 'log2'}. Best is trial 28 with value: 0.27849057072938393.
[I 2024-12-04 12:16:13,858] Trial 43 finished with value: 0.42061958567218005 and parameters: {'n_estimators': 371, 'learning_rate': 0.042771071682766226, 'max_depth': 3, 'min_samples_split': 2, 'min_samples_leaf': 1, 'subsample': 0.6706640815006458, 'max_features': 'sqrt'}. Best is trial 28 with value: 0.27849057072938393.
[I 2024-12-04 12:16:13,860] Trial 11 finished with value: 0.39056803160606085 and parameters: {'n_estimators': 1010, 'learning_rate': 0.09867801931056927, 'max_depth': 5, 'min_samples_split': 20, 'min_samples_leaf': 10, 'subsample': 0.6448530397794197, 'max_features': None}. Best is trial 28 with value: 0.27849057072938393.
[I 2024-12-04 12:16:13,876] Trial 39 finished with value: 0.4989144423116668 and parameters: {'n_estimators': 686, 'learning_rate': 0.05628770193039215, 'max_depth': 4, 'min_samples_split': 2, 'min_samples_leaf': 9, 'subsample': 0.9590849878474571, 'max_features': 'log2'}. Best is trial 28 with value: 0.27849057072938393.
[I 2024-12-04 12:16:15,376] Trial 7 finished with value: 0.3262332742790414 and parameters: {'n_estimators': 919, 'learning_rate': 0.01841887973828667, 'max_depth': 8, 'min_samples_split': 4, 'min_samples_leaf': 4, 'subsample': 0.7042688183243551, 'max_features': 'sqrt'}. Best is trial 28 with value: 0.27849057072938393.
[I 2024-12-04 12:16:15,748] Trial 50 finished with value: 0.34889934910121817 and parameters: {'n_estimators': 133, 'learning_rate': 0.05346054164465708, 'max_depth': 6, 'min_samples_split': 2, 'min_samples_leaf': 1, 'subsample': 0.9966667375959795, 'max_features': None}. Best is trial 28 with value: 0.27849057072938393.
[I 2024-12-04 12:16:16,905] Trial 29 finished with value: 0.36624965605498194 and parameters: {'n_estimators': 1028, 'learning_rate': 0.019391285044819465, 'max_depth': 4, 'min_samples_split': 17, 'min_samples_leaf': 1, 'subsample': 0.976610403015507, 'max_features': 'sqrt'}. Best is trial 28 with value: 0.27849057072938393.
[I 2024-12-04 12:16:17,132] Trial 51 finished with value: 0.5587933057871071 and parameters: {'n_estimators': 200, 'learning_rate': 0.026099235425239054, 'max_depth': 7, 'min_samples_split': 4, 'min_samples_leaf': 1, 'subsample': 0.8056647530948748, 'max_features': 'log2'}. Best is trial 28 with value: 0.27849057072938393.
[I 2024-12-04 12:16:17,410] Trial 44 finished with value: 0.2859305617303554 and parameters: {'n_estimators': 451, 'learning_rate': 0.03462140021393415, 'max_depth': 10, 'min_samples_split': 4, 'min_samples_leaf': 1, 'subsample': 0.6765527119676893, 'max_features': 'sqrt'}. Best is trial 28 with value: 0.27849057072938393.
[I 2024-12-04 12:16:18,951] Trial 21 finished with value: 0.3701780878172976 and parameters: {'n_estimators': 1072, 'learning_rate': 0.06878848217722093, 'max_depth': 5, 'min_samples_split': 10, 'min_samples_leaf': 8, 'subsample': 0.8636572038776317, 'max_features': None}. Best is trial 28 with value: 0.27849057072938393.
[I 2024-12-04 12:16:19,218] Trial 49 finished with value: 0.30163583045887254 and parameters: {'n_estimators': 258, 'learning_rate': 0.09085132431930037, 'max_depth': 6, 'min_samples_split': 20, 'min_samples_leaf': 3, 'subsample': 0.9927731639482518, 'max_features': None}. Best is trial 28 with value: 0.27849057072938393.
[I 2024-12-04 12:16:19,239] Trial 47 finished with value: 0.32995391020814907 and parameters: {'n_estimators': 346, 'learning_rate': 0.03539485141370408, 'max_depth': 8, 'min_samples_split': 13, 'min_samples_leaf': 1, 'subsample': 0.7784664833006318, 'max_features': 'sqrt'}. Best is trial 28 with value: 0.27849057072938393.
[I 2024-12-04 12:16:19,241] Trial 13 finished with value: 0.2817466750589483 and parameters: {'n_estimators': 1245, 'learning_rate': 0.01898760519017102, 'max_depth': 9, 'min_samples_split': 2, 'min_samples_leaf': 3, 'subsample': 0.6334837268982596, 'max_features': None}. Best is trial 28 with value: 0.27849057072938393.
[I 2024-12-04 12:16:19,896] Trial 8 finished with value: 0.4348686205257482 and parameters: {'n_estimators': 1267, 'learning_rate': 0.027070142585780724, 'max_depth': 11, 'min_samples_split': 17, 'min_samples_leaf': 7, 'subsample': 0.9498210086001917, 'max_features': 'log2'}. Best is trial 28 with value: 0.27849057072938393.
[I 2024-12-04 12:16:23,191] Trial 36 finished with value: 0.6713073164501218 and parameters: {'n_estimators': 1052, 'learning_rate': 0.011594745225168221, 'max_depth': 12, 'min_samples_split': 6, 'min_samples_leaf': 9, 'subsample': 0.8707413263837283, 'max_features': 'log2'}. Best is trial 28 with value: 0.27849057072938393.
[I 2024-12-04 12:16:23,232] Trial 48 finished with value: 0.475827386271178 and parameters: {'n_estimators': 454, 'learning_rate': 0.01820827095364936, 'max_depth': 4, 'min_samples_split': 10, 'min_samples_leaf': 1, 'subsample': 0.6301956023747863, 'max_features': 'sqrt'}. Best is trial 28 with value: 0.27849057072938393.
[I 2024-12-04 12:16:23,249] Trial 33 finished with value: 0.3945461549477486 and parameters: {'n_estimators': 1117, 'learning_rate': 0.05313417661531067, 'max_depth': 6, 'min_samples_split': 20, 'min_samples_leaf': 7, 'subsample': 0.8968994670052133, 'max_features': 'log2'}. Best is trial 28 with value: 0.27849057072938393.
[I 2024-12-04 12:16:23,251] Trial 35 finished with value: 0.47608109479029065 and parameters: {'n_estimators': 1059, 'learning_rate': 0.010860482342622097, 'max_depth': 3, 'min_samples_split': 17, 'min_samples_leaf': 1, 'subsample': 0.8320681168241356, 'max_features': 'sqrt'}. Best is trial 28 with value: 0.27849057072938393.
[I 2024-12-04 12:16:23,417] Trial 27 finished with value: 0.28829842424292784 and parameters: {'n_estimators': 1380, 'learning_rate': 0.031472043216450384, 'max_depth': 11, 'min_samples_split': 8, 'min_samples_leaf': 2, 'subsample': 0.6862135786417566, 'max_features': 'log2'}. Best is trial 28 with value: 0.27849057072938393.
[I 2024-12-04 12:16:24,037] Trial 38 finished with value: 0.4332749996361658 and parameters: {'n_estimators': 1060, 'learning_rate': 0.09556886834918854, 'max_depth': 4, 'min_samples_split': 20, 'min_samples_leaf': 8, 'subsample': 0.6923376206901382, 'max_features': 'log2'}. Best is trial 28 with value: 0.27849057072938393.
[I 2024-12-04 12:16:24,039] Trial 42 finished with value: 0.2897457746962799 and parameters: {'n_estimators': 586, 'learning_rate': 0.04037385792605091, 'max_depth': 10, 'min_samples_split': 9, 'min_samples_leaf': 2, 'subsample': 0.8963301492531782, 'max_features': None}. Best is trial 28 with value: 0.27849057072938393.
[I 2024-12-04 12:16:25,637] Trial 34 finished with value: 0.3320785934988938 and parameters: {'n_estimators': 1214, 'learning_rate': 0.06710636707320523, 'max_depth': 7, 'min_samples_split': 10, 'min_samples_leaf': 7, 'subsample': 0.9924913679822048, 'max_features': 'sqrt'}. Best is trial 45 with value: 0.27748311854237845.
[I 2024-12-04 12:16:26,870] Trial 53 finished with value: 0.30841946282063254 and parameters: {'n_estimators': 450, 'learning_rate': 0.05979150620763111, 'max_depth': 6, 'min_samples_split': 10, 'min_samples_leaf': 3, 'subsample': 0.6666148384157988, 'max_features': 'sqrt'}. Best is trial 45 with value: 0.27748311854237845.
[I 2024-12-04 12:16:27,693] Trial 25 finished with value: 0.29172963823600195 and parameters: {'n_estimators': 1448, 'learning_rate': 0.035519037504797395, 'max_depth': 5, 'min_samples_split': 9, 'min_samples_leaf': 4, 'subsample': 0.771865962685943, 'max_features': 'sqrt'}. Best is trial 45 with value: 0.27748311854237845.
[I 2024-12-04 12:16:27,694] Trial 55 finished with value: 0.30326822890721455 and parameters: {'n_estimators': 309, 'learning_rate': 0.04381468175721519, 'max_depth': 8, 'min_samples_split': 3, 'min_samples_leaf': 3, 'subsample': 0.8419500261349875, 'max_features': None}. Best is trial 45 with value: 0.27748311854237845.
[I 2024-12-04 12:16:27,765] Trial 45 finished with value: 0.27748311854237845 and parameters: {'n_estimators': 720, 'learning_rate': 0.08060398100541011, 'max_depth': 6, 'min_samples_split': 15, 'min_samples_leaf': 4, 'subsample': 0.9597856040672845, 'max_features': 'sqrt'}. Best is trial 45 with value: 0.27748311854237845.
[I 2024-12-04 12:16:28,243] Trial 60 finished with value: 0.30680886430900334 and parameters: {'n_estimators': 261, 'learning_rate': 0.037697262059608154, 'max_depth': 12, 'min_samples_split': 2, 'min_samples_leaf': 2, 'subsample': 0.652729371352581, 'max_features': 'sqrt'}. Best is trial 45 with value: 0.27748311854237845.
[I 2024-12-04 12:16:28,886] Trial 57 finished with value: 0.39336174395163037 and parameters: {'n_estimators': 529, 'learning_rate': 0.09572086322317416, 'max_depth': 4, 'min_samples_split': 18, 'min_samples_leaf': 8, 'subsample': 0.9258511606605261, 'max_features': 'sqrt'}. Best is trial 45 with value: 0.27748311854237845.
[I 2024-12-04 12:16:31,001] Trial 59 finished with value: 0.32430280312478826 and parameters: {'n_estimators': 273, 'learning_rate': 0.06880113417125462, 'max_depth': 7, 'min_samples_split': 18, 'min_samples_leaf': 5, 'subsample': 0.9738194674474375, 'max_features': None}. Best is trial 45 with value: 0.27748311854237845.
[I 2024-12-04 12:16:31,002] Trial 52 finished with value: 0.289599589478005 and parameters: {'n_estimators': 331, 'learning_rate': 0.03524746879844252, 'max_depth': 11, 'min_samples_split': 2, 'min_samples_leaf': 1, 'subsample': 0.9382704335081168, 'max_features': None}. Best is trial 45 with value: 0.27748311854237845.
[I 2024-12-04 12:16:31,141] Trial 40 finished with value: 0.4923639284387777 and parameters: {'n_estimators': 1338, 'learning_rate': 0.04127563207263322, 'max_depth': 5, 'min_samples_split': 9, 'min_samples_leaf': 10, 'subsample': 0.8511425142128697, 'max_features': 'log2'}. Best is trial 45 with value: 0.27748311854237845.
[I 2024-12-04 12:16:32,117] Trial 30 finished with value: 0.289857009152679 and parameters: {'n_estimators': 1484, 'learning_rate': 0.022329996397558702, 'max_depth': 8, 'min_samples_split': 7, 'min_samples_leaf': 3, 'subsample': 0.7774384359923484, 'max_features': None}. Best is trial 45 with value: 0.27748311854237845.
[I 2024-12-04 12:16:34,240] Trial 56 finished with value: 0.2750037047262183 and parameters: {'n_estimators': 663, 'learning_rate': 0.05333628907183966, 'max_depth': 10, 'min_samples_split': 2, 'min_samples_leaf': 1, 'subsample': 0.9059739606395855, 'max_features': 'sqrt'}. Best is trial 56 with value: 0.2750037047262183.
[I 2024-12-04 12:16:35,270] Trial 46 finished with value: 0.31512695513950345 and parameters: {'n_estimators': 1254, 'learning_rate': 0.08356465038370511, 'max_depth': 3, 'min_samples_split': 17, 'min_samples_leaf': 5, 'subsample': 0.7858655427693484, 'max_features': 'sqrt'}. Best is trial 56 with value: 0.2750037047262183.
[I 2024-12-04 12:16:37,343] Trial 54 finished with value: 0.2851789907983127 and parameters: {'n_estimators': 1163, 'learning_rate': 0.058879344638511404, 'max_depth': 3, 'min_samples_split': 16, 'min_samples_leaf': 2, 'subsample': 0.9685985581879204, 'max_features': None}. Best is trial 56 with value: 0.2750037047262183.
[I 2024-12-04 12:16:38,588] Trial 66 finished with value: 0.3145757046868187 and parameters: {'n_estimators': 228, 'learning_rate': 0.028370356620633932, 'max_depth': 11, 'min_samples_split': 3, 'min_samples_leaf': 2, 'subsample': 0.9437668159676412, 'max_features': None}. Best is trial 62 with value: 0.26362476135020013.
[I 2024-12-04 12:16:40,124] Trial 62 finished with value: 0.26362476135020013 and parameters: {'n_estimators': 978, 'learning_rate': 0.025384829964225173, 'max_depth': 10, 'min_samples_split': 4, 'min_samples_leaf': 1, 'subsample': 0.6605244926725817, 'max_features': 'sqrt'}. Best is trial 62 with value: 0.26362476135020013.
[I 2024-12-04 12:16:40,403] Trial 64 finished with value: 0.2773398516806529 and parameters: {'n_estimators': 590, 'learning_rate': 0.06879983900117363, 'max_depth': 9, 'min_samples_split': 18, 'min_samples_leaf': 4, 'subsample': 0.8898482615779536, 'max_features': 'sqrt'}. Best is trial 62 with value: 0.26362476135020013.
[I 2024-12-04 12:16:42,133] Trial 63 finished with value: 0.2812122049437862 and parameters: {'n_estimators': 782, 'learning_rate': 0.09092369670618074, 'max_depth': 5, 'min_samples_split': 15, 'min_samples_leaf': 3, 'subsample': 0.9953464628298556, 'max_features': 'sqrt'}. Best is trial 62 with value: 0.26362476135020013.
[I 2024-12-04 12:16:44,742] Trial 61 finished with value: 0.2825763865459126 and parameters: {'n_estimators': 1421, 'learning_rate': 0.02709906629408198, 'max_depth': 12, 'min_samples_split': 7, 'min_samples_leaf': 2, 'subsample': 0.6641519549299911, 'max_features': 'log2'}. Best is trial 62 with value: 0.26362476135020013.
[I 2024-12-04 12:16:45,507] Trial 58 finished with value: 0.2833125746429313 and parameters: {'n_estimators': 1116, 'learning_rate': 0.01566364949848253, 'max_depth': 10, 'min_samples_split': 3, 'min_samples_leaf': 3, 'subsample': 0.6387070586976629, 'max_features': None}. Best is trial 62 with value: 0.26362476135020013.
[I 2024-12-04 12:16:45,514] Trial 70 finished with value: 0.2797345169208939 and parameters: {'n_estimators': 581, 'learning_rate': 0.08242091838185336, 'max_depth': 6, 'min_samples_split': 18, 'min_samples_leaf': 1, 'subsample': 0.8533728262399941, 'max_features': 'sqrt'}. Best is trial 62 with value: 0.26362476135020013.
