[I 2024-12-04 20:25:28,990] Trial 1893 finished with value: 0.32356484656231804 and parameters: {'n_estimators': 401, 'max_depth': 50, 'min_samples_split': 2, 'min_samples_leaf': 1, 'max_features': 'sqrt', 'bootstrap': False, 'criterion': 'squared_error'}. Best is trial 1631 with value: 0.32128932742921457.
[I 2024-12-04 20:25:29,755] Trial 1895 finished with value: 0.6558021461160508 and parameters: {'n_estimators': 288, 'max_depth': 50, 'min_samples_split': 3, 'min_samples_leaf': 2, 'max_features': 'sqrt', 'bootstrap': False, 'criterion': 'squared_error'}. Best is trial 1631 with value: 0.32128932742921457.
[I 2024-12-04 20:25:30,283] Trial 1896 finished with value: 0.6622353502023369 and parameters: {'n_estimators': 156, 'max_depth': 50, 'min_samples_split': 2, 'min_samples_leaf': 2, 'max_features': 'sqrt', 'bootstrap': False, 'criterion': 'squared_error'}. Best is trial 1631 with value: 0.32128932742921457.
[I 2024-12-04 20:25:30,588] Trial 1894 finished with value: 1.3265309606392521 and parameters: {'n_estimators': 721, 'max_depth': 42, 'min_samples_split': 4, 'min_samples_leaf': 6, 'max_features': 'log2', 'bootstrap': False, 'criterion': 'absolute_error'}. Best is trial 1631 with value: 0.32128932742921457.
[I 2024-12-04 20:25:32,662] Trial 1897 finished with value: 0.7124553219588814 and parameters: {'n_estimators': 606, 'max_depth': 9, 'min_samples_split': 2, 'min_samples_leaf': 12, 'max_features': None, 'bootstrap': True, 'criterion': 'squared_error'}. Best is trial 1631 with value: 0.32128932742921457.
[I 2024-12-04 20:25:32,805] Trial 1899 finished with value: 0.3968623770913069 and parameters: {'n_estimators': 474, 'max_depth': 41, 'min_samples_split': 3, 'min_samples_leaf': 1, 'max_features': 'sqrt', 'bootstrap': False, 'criterion': 'squared_error'}. Best is trial 1631 with value: 0.32128932742921457.
[I 2024-12-04 20:25:32,907] Trial 1898 finished with value: 0.3229197978438165 and parameters: {'n_estimators': 378, 'max_depth': 50, 'min_samples_split': 2, 'min_samples_leaf': 1, 'max_features': 'sqrt', 'bootstrap': False, 'criterion': 'squared_error'}. Best is trial 1631 with value: 0.32128932742921457.
[I 2024-12-04 20:25:34,851] Trial 1901 finished with value: 1.2913383433565582 and parameters: {'n_estimators': 270, 'max_depth': 24, 'min_samples_split': 10, 'min_samples_leaf': 4, 'max_features': 'log2', 'bootstrap': False, 'criterion': 'absolute_error'}. Best is trial 1631 with value: 0.32128932742921457.
[I 2024-12-04 20:25:35,061] Trial 1902 finished with value: 0.35682719802382923 and parameters: {'n_estimators': 337, 'max_depth': 50, 'min_samples_split': 3, 'min_samples_leaf': 1, 'max_features': 'sqrt', 'bootstrap': False, 'criterion': 'squared_error'}. Best is trial 1631 with value: 0.32128932742921457.
[I 2024-12-04 20:25:35,248] Trial 1900 finished with value: 0.352044176401188 and parameters: {'n_estimators': 418, 'max_depth': 42, 'min_samples_split': 2, 'min_samples_leaf': 1, 'max_features': 'sqrt', 'bootstrap': False, 'criterion': 'squared_error'}. Best is trial 1631 with value: 0.32128932742921457.
[I 2024-12-04 20:25:36,653] Trial 1903 finished with value: 0.5427110663946734 and parameters: {'n_estimators': 243, 'max_depth': 49, 'min_samples_split': 3, 'min_samples_leaf': 1, 'max_features': 'log2', 'bootstrap': False, 'criterion': 'squared_error'}. Best is trial 1631 with value: 0.32128932742921457.
[I 2024-12-04 20:25:37,381] Trial 1904 finished with value: 0.3850344307887684 and parameters: {'n_estimators': 336, 'max_depth': 50, 'min_samples_split': 4, 'min_samples_leaf': 1, 'max_features': 'sqrt', 'bootstrap': False, 'criterion': 'squared_error'}. Best is trial 1631 with value: 0.32128932742921457.
[I 2024-12-04 20:25:37,840] Trial 1906 finished with value: 1.2842779296268554 and parameters: {'n_estimators': 184, 'max_depth': 9, 'min_samples_split': 9, 'min_samples_leaf': 14, 'max_features': 'log2', 'bootstrap': True, 'criterion': 'squared_error'}. Best is trial 1631 with value: 0.32128932742921457.
[I 2024-12-04 20:25:38,221] Trial 1905 finished with value: 0.32284333741137333 and parameters: {'n_estimators': 379, 'max_depth': 50, 'min_samples_split': 2, 'min_samples_leaf': 1, 'max_features': 'sqrt', 'bootstrap': False, 'criterion': 'squared_error'}. Best is trial 1631 with value: 0.32128932742921457.
[I 2024-12-04 20:25:38,699] Trial 1907 finished with value: 0.4337353931338786 and parameters: {'n_estimators': 100, 'max_depth': 43, 'min_samples_split': 3, 'min_samples_leaf': 1, 'max_features': 'sqrt', 'bootstrap': False, 'criterion': 'squared_error'}. Best is trial 1631 with value: 0.32128932742921457.
[I 2024-12-04 20:25:39,973] Trial 1908 finished with value: 0.3240573755776583 and parameters: {'n_estimators': 243, 'max_depth': 50, 'min_samples_split': 2, 'min_samples_leaf': 1, 'max_features': 'sqrt', 'bootstrap': False, 'criterion': 'squared_error'}. Best is trial 1631 with value: 0.32128932742921457.
[I 2024-12-04 20:25:41,175] Trial 1909 finished with value: 0.595427154811986 and parameters: {'n_estimators': 541, 'max_depth': 6, 'min_samples_split': 2, 'min_samples_leaf': 2, 'max_features': None, 'bootstrap': False, 'criterion': 'squared_error'}. Best is trial 1631 with value: 0.32128932742921457.
[I 2024-12-04 20:25:41,254] Trial 1910 finished with value: 0.3508155383677479 and parameters: {'n_estimators': 424, 'max_depth': 43, 'min_samples_split': 2, 'min_samples_leaf': 1, 'max_features': 'sqrt', 'bootstrap': False, 'criterion': 'squared_error'}. Best is trial 1631 with value: 0.32128932742921457.
[I 2024-12-04 20:25:42,997] Trial 1911 finished with value: 0.3541203145236031 and parameters: {'n_estimators': 538, 'max_depth': 42, 'min_samples_split': 2, 'min_samples_leaf': 1, 'max_features': 'sqrt', 'bootstrap': False, 'criterion': 'squared_error'}. Best is trial 1631 with value: 0.32128932742921457.
[I 2024-12-04 20:25:43,258] Trial 1913 finished with value: 0.32612211740733094 and parameters: {'n_estimators': 229, 'max_depth': 50, 'min_samples_split': 2, 'min_samples_leaf': 1, 'max_features': 'sqrt', 'bootstrap': False, 'criterion': 'squared_error'}. Best is trial 1631 with value: 0.32128932742921457.
[I 2024-12-04 20:25:44,268] Trial 1914 finished with value: 0.669479852509258 and parameters: {'n_estimators': 224, 'max_depth': 43, 'min_samples_split': 2, 'min_samples_leaf': 2, 'max_features': 'sqrt', 'bootstrap': False, 'criterion': 'squared_error'}. Best is trial 1631 with value: 0.32128932742921457.
[I 2024-12-04 20:25:46,098] Trial 1912 finished with value: 0.4887906796851707 and parameters: {'n_estimators': 890, 'max_depth': 40, 'min_samples_split': 10, 'min_samples_leaf': 2, 'max_features': None, 'bootstrap': True, 'criterion': 'squared_error'}. Best is trial 1631 with value: 0.32128932742921457.
[I 2024-12-04 20:25:47,748] Trial 1917 finished with value: 0.3581633023807213 and parameters: {'n_estimators': 354, 'max_depth': 50, 'min_samples_split': 3, 'min_samples_leaf': 1, 'max_features': 'sqrt', 'bootstrap': False, 'criterion': 'squared_error'}. Best is trial 1631 with value: 0.32128932742921457.
[I 2024-12-04 20:25:48,247] Trial 1915 finished with value: 0.34112623774053563 and parameters: {'n_estimators': 161, 'max_depth': 50, 'min_samples_split': 2, 'min_samples_leaf': 1, 'max_features': 'sqrt', 'bootstrap': False, 'criterion': 'absolute_error'}. Best is trial 1631 with value: 0.32128932742921457.
[I 2024-12-04 20:25:49,571] Trial 1919 finished with value: 0.6581545593752356 and parameters: {'n_estimators': 209, 'max_depth': 50, 'min_samples_split': 2, 'min_samples_leaf': 2, 'max_features': 'sqrt', 'bootstrap': False, 'criterion': 'squared_error'}. Best is trial 1631 with value: 0.32128932742921457.
[I 2024-12-04 20:25:55,679] Trial 1916 finished with value: 1.0126237109523957 and parameters: {'n_estimators': 717, 'max_depth': 20, 'min_samples_split': 33, 'min_samples_leaf': 2, 'max_features': 'sqrt', 'bootstrap': False, 'criterion': 'absolute_error'}. Best is trial 1631 with value: 0.32128932742921457.
[I 2024-12-04 20:25:57,107] Trial 1921 finished with value: 1.068134366378358 and parameters: {'n_estimators': 545, 'max_depth': 7, 'min_samples_split': 44, 'min_samples_leaf': 2, 'max_features': 'sqrt', 'bootstrap': True, 'criterion': 'squared_error'}. Best is trial 1631 with value: 0.32128932742921457.
[I 2024-12-04 20:25:57,765] Trial 1918 finished with value: 1.0657353615306078 and parameters: {'n_estimators': 962, 'max_depth': 34, 'min_samples_split': 6, 'min_samples_leaf': 4, 'max_features': 'sqrt', 'bootstrap': False, 'criterion': 'absolute_error'}. Best is trial 1631 with value: 0.32128932742921457.
[I 2024-12-04 20:25:59,419] Trial 1922 finished with value: 0.3228847481584375 and parameters: {'n_estimators': 367, 'max_depth': 50, 'min_samples_split': 2, 'min_samples_leaf': 1, 'max_features': 'sqrt', 'bootstrap': False, 'criterion': 'squared_error'}. Best is trial 1631 with value: 0.32128932742921457.
[I 2024-12-04 20:25:59,726] Trial 1923 finished with value: 0.3450689503761683 and parameters: {'n_estimators': 307, 'max_depth': 44, 'min_samples_split': 2, 'min_samples_leaf': 1, 'max_features': 'sqrt', 'bootstrap': False, 'criterion': 'squared_error'}. Best is trial 1631 with value: 0.32128932742921457.
[I 2024-12-04 20:26:02,377] Trial 1925 finished with value: 0.6041476570464063 and parameters: {'n_estimators': 496, 'max_depth': 26, 'min_samples_split': 6, 'min_samples_leaf': 13, 'max_features': None, 'bootstrap': False, 'criterion': 'squared_error'}. Best is trial 1631 with value: 0.32128932742921457.
[I 2024-12-04 20:26:02,378] Trial 1924 finished with value: 1.2994009977383902 and parameters: {'n_estimators': 896, 'max_depth': 30, 'min_samples_split': 20, 'min_samples_leaf': 3, 'max_features': 'log2', 'bootstrap': True, 'criterion': 'absolute_error'}. Best is trial 1631 with value: 0.32128932742921457.
[I 2024-12-04 20:26:03,942] Trial 1920 finished with value: 0.6288756847686992 and parameters: {'n_estimators': 855, 'max_depth': 31, 'min_samples_split': 4, 'min_samples_leaf': 1, 'max_features': 'sqrt', 'bootstrap': True, 'criterion': 'absolute_error'}. Best is trial 1631 with value: 0.32128932742921457.
[I 2024-12-04 20:26:04,308] Trial 1926 finished with value: 0.872874828058646 and parameters: {'n_estimators': 570, 'max_depth': 28, 'min_samples_split': 23, 'min_samples_leaf': 3, 'max_features': 'sqrt', 'bootstrap': False, 'criterion': 'squared_error'}. Best is trial 1631 with value: 0.32128932742921457.
[I 2024-12-04 20:26:05,824] Trial 1929 finished with value: 0.7448463483014979 and parameters: {'n_estimators': 253, 'max_depth': 48, 'min_samples_split': 4, 'min_samples_leaf': 15, 'max_features': None, 'bootstrap': True, 'criterion': 'squared_error'}. Best is trial 1631 with value: 0.32128932742921457.
[I 2024-12-04 20:26:06,807] Trial 1928 finished with value: 0.838099558577294 and parameters: {'n_estimators': 566, 'max_depth': 10, 'min_samples_split': 40, 'min_samples_leaf': 15, 'max_features': None, 'bootstrap': False, 'criterion': 'squared_error'}. Best is trial 1631 with value: 0.32128932742921457.
[I 2024-12-04 20:26:08,424] Trial 1931 finished with value: 0.3471066869511802 and parameters: {'n_estimators': 274, 'max_depth': 42, 'min_samples_split': 2, 'min_samples_leaf': 1, 'max_features': 'sqrt', 'bootstrap': False, 'criterion': 'squared_error'}. Best is trial 1631 with value: 0.32128932742921457.
[I 2024-12-04 20:26:10,213] Trial 1932 finished with value: 0.7428889807433837 and parameters: {'n_estimators': 506, 'max_depth': 33, 'min_samples_split': 2, 'min_samples_leaf': 1, 'max_features': 'log2', 'bootstrap': True, 'criterion': 'squared_error'}. Best is trial 1631 with value: 0.32128932742921457.
[I 2024-12-04 20:26:11,941] Trial 1933 finished with value: 0.6762248338151055 and parameters: {'n_estimators': 552, 'max_depth': 50, 'min_samples_split': 2, 'min_samples_leaf': 2, 'max_features': 'sqrt', 'bootstrap': False, 'criterion': 'squared_error'}. Best is trial 1631 with value: 0.32128932742921457.
[I 2024-12-04 20:26:13,027] Trial 1934 finished with value: 0.7940505513623672 and parameters: {'n_estimators': 230, 'max_depth': 50, 'min_samples_split': 3, 'min_samples_leaf': 2, 'max_features': 'sqrt', 'bootstrap': True, 'criterion': 'squared_error'}. Best is trial 1631 with value: 0.32128932742921457.
[I 2024-12-04 20:26:14,203] Trial 1935 finished with value: 0.33813968127447414 and parameters: {'n_estimators': 125, 'max_depth': 50, 'min_samples_split': 2, 'min_samples_leaf': 1, 'max_features': 'sqrt', 'bootstrap': False, 'criterion': 'squared_error'}. Best is trial 1631 with value: 0.32128932742921457.
[I 2024-12-04 20:26:15,218] Trial 1936 finished with value: 0.7626695113208158 and parameters: {'n_estimators': 195, 'max_depth': 43, 'min_samples_split': 11, 'min_samples_leaf': 2, 'max_features': 'sqrt', 'bootstrap': False, 'criterion': 'squared_error'}. Best is trial 1631 with value: 0.32128932742921457.
[I 2024-12-04 20:26:24,573] Trial 1927 finished with value: 0.5794825604721867 and parameters: {'n_estimators': 943, 'max_depth': 13, 'min_samples_split': 13, 'min_samples_leaf': 10, 'max_features': None, 'bootstrap': False, 'criterion': 'absolute_error'}. Best is trial 1631 with value: 0.32128932742921457.
[I 2024-12-04 20:26:25,465] Trial 1938 finished with value: 1.342315364657111 and parameters: {'n_estimators': 114, 'max_depth': 50, 'min_samples_split': 43, 'min_samples_leaf': 15, 'max_features': 'log2', 'bootstrap': False, 'criterion': 'absolute_error'}. Best is trial 1631 with value: 0.32128932742921457.
[I 2024-12-04 20:26:27,798] Trial 1939 finished with value: 0.3233522130985557 and parameters: {'n_estimators': 410, 'max_depth': 50, 'min_samples_split': 2, 'min_samples_leaf': 1, 'max_features': 'sqrt', 'bootstrap': False, 'criterion': 'squared_error'}. Best is trial 1631 with value: 0.32128932742921457.
[I 2024-12-04 20:26:30,661] Trial 1940 finished with value: 0.327403625812863 and parameters: {'n_estimators': 563, 'max_depth': 50, 'min_samples_split': 2, 'min_samples_leaf': 1, 'max_features': 'sqrt', 'bootstrap': False, 'criterion': 'squared_error'}. Best is trial 1631 with value: 0.32128932742921457.
[I 2024-12-04 20:26:32,737] Trial 1941 finished with value: 0.35122751899655197 and parameters: {'n_estimators': 414, 'max_depth': 43, 'min_samples_split': 2, 'min_samples_leaf': 1, 'max_features': 'sqrt', 'bootstrap': False, 'criterion': 'squared_error'}. Best is trial 1631 with value: 0.32128932742921457.
[I 2024-12-04 20:26:34,282] Trial 1942 finished with value: 0.3440262448157002 and parameters: {'n_estimators': 246, 'max_depth': 43, 'min_samples_split': 2, 'min_samples_leaf': 1, 'max_features': 'sqrt', 'bootstrap': False, 'criterion': 'squared_error'}. Best is trial 1631 with value: 0.32128932742921457.
[I 2024-12-04 20:26:35,674] Trial 1943 finished with value: 0.37525572436713406 and parameters: {'n_estimators': 127, 'max_depth': 50, 'min_samples_split': 3, 'min_samples_leaf': 1, 'max_features': 'sqrt', 'bootstrap': False, 'criterion': 'squared_error'}. Best is trial 1631 with value: 0.32128932742921457.
[I 2024-12-04 20:26:36,585] Trial 1930 finished with value: 0.5659317555394565 and parameters: {'n_estimators': 588, 'max_depth': 39, 'min_samples_split': 11, 'min_samples_leaf': 4, 'max_features': None, 'bootstrap': False, 'criterion': 'absolute_error'}. Best is trial 1631 with value: 0.32128932742921457.
[I 2024-12-04 20:26:37,404] Trial 1944 finished with value: 0.5402531334054052 and parameters: {'n_estimators': 399, 'max_depth': 50, 'min_samples_split': 4, 'min_samples_leaf': 1, 'max_features': 'log2', 'bootstrap': False, 'criterion': 'squared_error'}. Best is trial 1631 with value: 0.32128932742921457.
[I 2024-12-04 20:26:38,304] Trial 1945 finished with value: 0.37038026273671093 and parameters: {'n_estimators': 241, 'max_depth': 50, 'min_samples_split': 2, 'min_samples_leaf': 1, 'max_features': 'sqrt', 'bootstrap': True, 'criterion': 'squared_error'}. Best is trial 1631 with value: 0.32128932742921457.
[I 2024-12-04 20:26:39,273] Trial 1946 finished with value: 0.38644004466739224 and parameters: {'n_estimators': 370, 'max_depth': 50, 'min_samples_split': 4, 'min_samples_leaf': 1, 'max_features': 'sqrt', 'bootstrap': False, 'criterion': 'squared_error'}. Best is trial 1631 with value: 0.32128932742921457.
[I 2024-12-04 20:26:40,437] Trial 1948 finished with value: 0.6689558644251673 and parameters: {'n_estimators': 298, 'max_depth': 43, 'min_samples_split': 2, 'min_samples_leaf': 2, 'max_features': 'sqrt', 'bootstrap': False, 'criterion': 'squared_error'}. Best is trial 1631 with value: 0.32128932742921457.
[I 2024-12-04 20:26:40,504] Trial 1947 finished with value: 0.3237337339444885 and parameters: {'n_estimators': 361, 'max_depth': 50, 'min_samples_split': 2, 'min_samples_leaf': 1, 'max_features': 'sqrt', 'bootstrap': False, 'criterion': 'squared_error'}. Best is trial 1631 with value: 0.32128932742921457.
[I 2024-12-04 20:26:42,153] Trial 1949 finished with value: 0.44936741077016956 and parameters: {'n_estimators': 286, 'max_depth': 32, 'min_samples_split': 3, 'min_samples_leaf': 1, 'max_features': 'sqrt', 'bootstrap': False, 'criterion': 'squared_error'}. Best is trial 1631 with value: 0.32128932742921457.
[I 2024-12-04 20:26:42,217] Trial 1950 finished with value: 0.4769462108200328 and parameters: {'n_estimators': 367, 'max_depth': 32, 'min_samples_split': 4, 'min_samples_leaf': 1, 'max_features': 'sqrt', 'bootstrap': False, 'criterion': 'squared_error'}. Best is trial 1631 with value: 0.32128932742921457.
[I 2024-12-04 20:26:43,842] Trial 1951 finished with value: 0.6842544451743328 and parameters: {'n_estimators': 414, 'max_depth': 50, 'min_samples_split': 2, 'min_samples_leaf': 2, 'max_features': 'sqrt', 'bootstrap': False, 'criterion': 'squared_error'}. Best is trial 1631 with value: 0.32128932742921457.
[I 2024-12-04 20:26:43,908] Trial 1952 finished with value: 0.40638543481232914 and parameters: {'n_estimators': 291, 'max_depth': 42, 'min_samples_split': 4, 'min_samples_leaf': 1, 'max_features': 'sqrt', 'bootstrap': False, 'criterion': 'squared_error'}. Best is trial 1631 with value: 0.32128932742921457.
[I 2024-12-04 20:26:45,332] Trial 1953 finished with value: 0.6705943976780918 and parameters: {'n_estimators': 282, 'max_depth': 42, 'min_samples_split': 4, 'min_samples_leaf': 2, 'max_features': 'sqrt', 'bootstrap': False, 'criterion': 'squared_error'}. Best is trial 1631 with value: 0.32128932742921457.
[I 2024-12-04 20:26:46,378] Trial 1955 finished with value: 1.300083117256725 and parameters: {'n_estimators': 178, 'max_depth': 12, 'min_samples_split': 7, 'min_samples_leaf': 15, 'max_features': 'sqrt', 'bootstrap': False, 'criterion': 'absolute_error'}. Best is trial 1631 with value: 0.32128932742921457.
[I 2024-12-04 20:26:46,562] Trial 1954 finished with value: 0.32472716326916434 and parameters: {'n_estimators': 428, 'max_depth': 50, 'min_samples_split': 2, 'min_samples_leaf': 1, 'max_features': 'sqrt', 'bootstrap': False, 'criterion': 'squared_error'}. Best is trial 1631 with value: 0.32128932742921457.
[I 2024-12-04 20:26:48,061] Trial 1956 finished with value: 0.32276894222646274 and parameters: {'n_estimators': 222, 'max_depth': 50, 'min_samples_split': 2, 'min_samples_leaf': 1, 'max_features': 'sqrt', 'bootstrap': False, 'criterion': 'squared_error'}. Best is trial 1631 with value: 0.32128932742921457.
[I 2024-12-04 20:26:49,126] Trial 1957 finished with value: 0.3230509500930674 and parameters: {'n_estimators': 405, 'max_depth': 50, 'min_samples_split': 2, 'min_samples_leaf': 1, 'max_features': 'sqrt', 'bootstrap': False, 'criterion': 'squared_error'}. Best is trial 1631 with value: 0.32128932742921457.
[I 2024-12-04 20:26:52,782] Trial 1958 finished with value: 0.4340177871974092 and parameters: {'n_estimators': 453, 'max_depth': 50, 'min_samples_split': 2, 'min_samples_leaf': 1, 'max_features': None, 'bootstrap': False, 'criterion': 'squared_error'}. Best is trial 1631 with value: 0.32128932742921457.
[I 2024-12-04 20:26:54,582] Trial 1960 finished with value: 0.3460098636924682 and parameters: {'n_estimators': 326, 'max_depth': 42, 'min_samples_split': 2, 'min_samples_leaf': 1, 'max_features': 'sqrt', 'bootstrap': False, 'criterion': 'squared_error'}. Best is trial 1631 with value: 0.32128932742921457.
[I 2024-12-04 20:26:56,011] Trial 1961 finished with value: 0.3566044265708879 and parameters: {'n_estimators': 270, 'max_depth': 50, 'min_samples_split': 3, 'min_samples_leaf': 1, 'max_features': 'sqrt', 'bootstrap': False, 'criterion': 'squared_error'}. Best is trial 1631 with value: 0.32128932742921457.
[I 2024-12-04 20:26:57,476] Trial 1962 finished with value: 0.4085789589851543 and parameters: {'n_estimators': 253, 'max_depth': 43, 'min_samples_split': 4, 'min_samples_leaf': 1, 'max_features': 'sqrt', 'bootstrap': False, 'criterion': 'squared_error'}. Best is trial 1631 with value: 0.32128932742921457.
[I 2024-12-04 20:26:57,543] Trial 1959 finished with value: 0.3826215484377204 and parameters: {'n_estimators': 328, 'max_depth': 41, 'min_samples_split': 2, 'min_samples_leaf': 1, 'max_features': 'sqrt', 'bootstrap': False, 'criterion': 'absolute_error'}. Best is trial 1631 with value: 0.32128932742921457.
[I 2024-12-04 20:26:59,045] Trial 1963 finished with value: 0.3876595315328397 and parameters: {'n_estimators': 233, 'max_depth': 50, 'min_samples_split': 4, 'min_samples_leaf': 1, 'max_features': 'sqrt', 'bootstrap': False, 'criterion': 'squared_error'}. Best is trial 1631 with value: 0.32128932742921457.
[I 2024-12-04 20:26:59,321] Trial 1964 finished with value: 0.357020916563663 and parameters: {'n_estimators': 250, 'max_depth': 50, 'min_samples_split': 3, 'min_samples_leaf': 1, 'max_features': 'sqrt', 'bootstrap': False, 'criterion': 'squared_error'}. Best is trial 1631 with value: 0.32128932742921457.
