[I 2024-12-03 18:48:49,378] Trial 675 finished with value: 0.13716446993052653 and parameters: {'kernel': 'linear', 'C': 10.335618473087582, 'gamma': 0.004307553747487069, 'epsilon': 0.04698555518867071}. Best is trial 345 with value: 0.13438257115663557.
[I 2024-12-03 18:48:50,383] Trial 571 finished with value: 0.13584863134252062 and parameters: {'kernel': 'linear', 'C': 94.93120717655543, 'gamma': 0.00022711870799511016, 'epsilon': 0.03560662159768091}. Best is trial 345 with value: 0.13438257115663557.
[I 2024-12-03 18:48:51,633] Trial 656 finished with value: 0.13762316069043765 and parameters: {'kernel': 'linear', 'C': 32.81598618615241, 'gamma': 0.0009183171454960053, 'epsilon': 0.01948071204600593}. Best is trial 345 with value: 0.13438257115663557.
[I 2024-12-03 18:48:52,041] Trial 674 finished with value: 0.13622415453376993 and parameters: {'kernel': 'linear', 'C': 14.696646421137913, 'gamma': 0.0005307326211548603, 'epsilon': 0.06992462995445939}. Best is trial 345 with value: 0.13438257115663557.
[I 2024-12-03 18:48:52,753] Trial 683 finished with value: 0.13508307542300238 and parameters: {'kernel': 'linear', 'C': 4.055363886599826, 'gamma': 0.0005932350962458692, 'epsilon': 0.06288400462448006}. Best is trial 345 with value: 0.13438257115663557.
[I 2024-12-03 18:48:53,371] Trial 684 finished with value: 0.36841807465675974 and parameters: {'kernel': 'poly', 'C': 97.61255920951216, 'gamma': 0.011166471141667871, 'epsilon': 0.09518898651944849}. Best is trial 345 with value: 0.13438257115663557.
[I 2024-12-03 18:48:55,694] Trial 649 finished with value: 0.13530128534818556 and parameters: {'kernel': 'linear', 'C': 48.72791886272839, 'gamma': 0.0024475822718617946, 'epsilon': 0.05739729790084009}. Best is trial 345 with value: 0.13438257115663557.
[I 2024-12-03 18:48:56,903] Trial 688 finished with value: 0.1703746484035333 and parameters: {'kernel': 'linear', 'C': 1.6862146857634341, 'gamma': 0.00047370042434242136, 'epsilon': 0.1565517272170021}. Best is trial 345 with value: 0.13438257115663557.
[I 2024-12-03 18:48:57,901] Trial 659 finished with value: 0.13610876359596163 and parameters: {'kernel': 'linear', 'C': 46.48249107705724, 'gamma': 0.00038395292131147493, 'epsilon': 0.05205308531626683}. Best is trial 345 with value: 0.13438257115663557.
[I 2024-12-03 18:48:58,906] Trial 689 finished with value: 0.8270519457322946 and parameters: {'kernel': 'rbf', 'C': 85.7865466806914, 'gamma': 0.7316237776689125, 'epsilon': 0.004627522260216269}. Best is trial 345 with value: 0.13438257115663557.
[I 2024-12-03 18:48:58,953] Trial 554 finished with value: 0.13791014597377893 and parameters: {'kernel': 'linear', 'C': 97.62940275812691, 'gamma': 0.0029716233327683355, 'epsilon': 0.005932825150890658}. Best is trial 345 with value: 0.13438257115663557.
[I 2024-12-03 18:48:59,507] Trial 680 finished with value: 0.1382903939936369 and parameters: {'kernel': 'linear', 'C': 9.753892964933163, 'gamma': 0.00016934934589221608, 'epsilon': 0.010642164820438846}. Best is trial 345 with value: 0.13438257115663557.
[I 2024-12-03 18:48:59,952] Trial 637 finished with value: 0.13598638342205074 and parameters: {'kernel': 'linear', 'C': 63.93562615860742, 'gamma': 0.023173897986086562, 'epsilon': 0.05262739422178855}. Best is trial 345 with value: 0.13438257115663557.
[I 2024-12-03 18:49:00,797] Trial 609 finished with value: 0.13627204595603906 and parameters: {'kernel': 'linear', 'C': 73.31639880253422, 'gamma': 0.00011117926051223158, 'epsilon': 0.042523043703705785}. Best is trial 345 with value: 0.13438257115663557.
[I 2024-12-03 18:49:00,853] Trial 690 finished with value: 0.15014152710842274 and parameters: {'kernel': 'linear', 'C': 12.81682996455298, 'gamma': 0.0022103435406481504, 'epsilon': 0.14040582736844578}. Best is trial 345 with value: 0.13438257115663557.
[I 2024-12-03 18:49:01,656] Trial 661 finished with value: 0.13531773987560883 and parameters: {'kernel': 'linear', 'C': 37.1830928519404, 'gamma': 0.0010457859623352066, 'epsilon': 0.06000694628697972}. Best is trial 345 with value: 0.13438257115663557.
[I 2024-12-03 18:49:02,170] Trial 696 finished with value: 0.23183106751532598 and parameters: {'kernel': 'rbf', 'C': 18.14286369686361, 'gamma': 0.02166070166961477, 'epsilon': 0.11887794583263893}. Best is trial 345 with value: 0.13438257115663557.
[I 2024-12-03 18:49:02,171] Trial 695 finished with value: 0.5793326790934828 and parameters: {'kernel': 'rbf', 'C': 0.19442600118077732, 'gamma': 0.009078558092165246, 'epsilon': 0.049478857484653464}. Best is trial 345 with value: 0.13438257115663557.
[I 2024-12-03 18:49:02,817] Trial 697 finished with value: 0.29411544553570806 and parameters: {'kernel': 'linear', 'C': 1.6622966929453706, 'gamma': 0.015990911200894586, 'epsilon': 0.4443664856212414}. Best is trial 345 with value: 0.13438257115663557.
[I 2024-12-03 18:49:03,708] Trial 533 finished with value: 0.13771673812036495 and parameters: {'kernel': 'linear', 'C': 89.7147141443497, 'gamma': 0.024278011958336242, 'epsilon': 0.013829858894616328}. Best is trial 345 with value: 0.13438257115663557.
[I 2024-12-03 18:49:03,948] Trial 685 finished with value: 0.13710876161800098 and parameters: {'kernel': 'linear', 'C': 10.919279163062619, 'gamma': 0.006816369385761762, 'epsilon': 0.02048087580896028}. Best is trial 345 with value: 0.13438257115663557.
[I 2024-12-03 18:49:03,948] Trial 686 finished with value: 0.13682797662391583 and parameters: {'kernel': 'linear', 'C': 10.66142844792078, 'gamma': 0.00013433500660425612, 'epsilon': 0.025109932535931082}. Best is trial 345 with value: 0.13438257115663557.
[I 2024-12-03 18:49:06,332] Trial 698 finished with value: 0.1364166070389832 and parameters: {'kernel': 'linear', 'C': 4.008588214692691, 'gamma': 0.04136105960895694, 'epsilon': 0.05792292263476631}. Best is trial 345 with value: 0.13438257115663557.
[I 2024-12-03 18:49:07,244] Trial 635 finished with value: 0.13742139581185242 and parameters: {'kernel': 'linear', 'C': 74.94206843158044, 'gamma': 0.014314050150221034, 'epsilon': 0.020872015993570914}. Best is trial 345 with value: 0.13438257115663557.
[I 2024-12-03 18:49:07,811] Trial 699 finished with value: 0.13546687459619708 and parameters: {'kernel': 'linear', 'C': 6.220974595366234, 'gamma': 0.00985290398685974, 'epsilon': 0.052062596911678166}. Best is trial 345 with value: 0.13438257115663557.
[I 2024-12-03 18:49:08,049] Trial 703 finished with value: 0.13819982134805664 and parameters: {'kernel': 'linear', 'C': 10.277426672985118, 'gamma': 0.00011563286130936771, 'epsilon': 0.07778569501827731}. Best is trial 345 with value: 0.13438257115663557.
[I 2024-12-03 18:49:09,655] Trial 694 finished with value: 0.13641521268192353 and parameters: {'kernel': 'linear', 'C': 16.36632287061267, 'gamma': 0.0004179810523970898, 'epsilon': 0.043350375113231095}. Best is trial 345 with value: 0.13438257115663557.
[I 2024-12-03 18:49:10,255] Trial 704 finished with value: 0.14125024669954686 and parameters: {'kernel': 'linear', 'C': 12.678191963722355, 'gamma': 0.012301170609393073, 'epsilon': 0.09646444106874497}. Best is trial 345 with value: 0.13438257115663557.
[I 2024-12-03 18:49:10,930] Trial 708 finished with value: 0.18516153078815878 and parameters: {'kernel': 'rbf', 'C': 34.35479008770102, 'gamma': 0.0012710831892902437, 'epsilon': 0.023464485138062787}. Best is trial 345 with value: 0.13438257115663557.
[I 2024-12-03 18:49:11,607] Trial 709 finished with value: 0.3954309566466825 and parameters: {'kernel': 'poly', 'C': 3.4727308971124597, 'gamma': 0.01775736605935835, 'epsilon': 0.03387363703567353}. Best is trial 345 with value: 0.13438257115663557.
[I 2024-12-03 18:49:12,803] Trial 700 finished with value: 0.1372154198496705 and parameters: {'kernel': 'linear', 'C': 10.17403739014821, 'gamma': 0.007556961632040683, 'epsilon': 0.020536235708884656}. Best is trial 345 with value: 0.13438257115663557.
[I 2024-12-03 18:49:13,509] Trial 711 finished with value: 1.3487875395132483 and parameters: {'kernel': 'poly', 'C': 69.91238528204353, 'gamma': 0.0001346277611219678, 'epsilon': 0.09939289870170466}. Best is trial 345 with value: 0.13438257115663557.
[I 2024-12-03 18:49:13,651] Trial 692 finished with value: 0.14044391178362997 and parameters: {'kernel': 'linear', 'C': 34.83423577228883, 'gamma': 0.0029333158117770125, 'epsilon': 0.1064376159936188}. Best is trial 345 with value: 0.13438257115663557.
[I 2024-12-03 18:49:13,957] Trial 626 finished with value: 0.13542152464715398 and parameters: {'kernel': 'linear', 'C': 84.35089003082189, 'gamma': 0.001080778374450064, 'epsilon': 0.03827842597837817}. Best is trial 345 with value: 0.13438257115663557.
[I 2024-12-03 18:49:15,308] Trial 714 finished with value: 0.17603120886387003 and parameters: {'kernel': 'linear', 'C': 0.2278276938912037, 'gamma': 0.04690132954813256, 'epsilon': 0.01270938515236452}. Best is trial 345 with value: 0.13438257115663557.
[I 2024-12-03 18:49:15,595] Trial 644 finished with value: 0.13714194000379482 and parameters: {'kernel': 'linear', 'C': 91.99308917803835, 'gamma': 0.005837067732930324, 'epsilon': 0.04824003932027774}. Best is trial 345 with value: 0.13438257115663557.
[I 2024-12-03 18:49:16,388] Trial 705 finished with value: 0.1358767440594605 and parameters: {'kernel': 'linear', 'C': 9.477291391224453, 'gamma': 0.0017456605253195654, 'epsilon': 0.034082499181429936}. Best is trial 345 with value: 0.13438257115663557.
[I 2024-12-03 18:49:16,825] Trial 706 finished with value: 0.13713027501753952 and parameters: {'kernel': 'linear', 'C': 7.295102736636763, 'gamma': 0.03972673854542969, 'epsilon': 0.02206728912485052}. Best is trial 345 with value: 0.13438257115663557.
[I 2024-12-03 18:49:17,949] Trial 654 finished with value: 0.1388494500985765 and parameters: {'kernel': 'linear', 'C': 58.25512297246354, 'gamma': 0.0002754331905441636, 'epsilon': 0.01175467267787275}. Best is trial 345 with value: 0.13438257115663557.
[I 2024-12-03 18:49:17,971] Trial 717 finished with value: 0.15040019104773122 and parameters: {'kernel': 'linear', 'C': 15.20389610910948, 'gamma': 0.008332002384196183, 'epsilon': 0.14364392360109104}. Best is trial 345 with value: 0.13438257115663557.
[I 2024-12-03 18:49:19,526] Trial 719 finished with value: 0.17188194634538656 and parameters: {'kernel': 'linear', 'C': 18.9337272789977, 'gamma': 0.0002442439242371758, 'epsilon': 0.18873646665414934}. Best is trial 345 with value: 0.13438257115663557.
[I 2024-12-03 18:49:20,662] Trial 682 finished with value: 0.13912353620468174 and parameters: {'kernel': 'linear', 'C': 26.78735791834806, 'gamma': 0.006986050431652236, 'epsilon': 0.011202999965815958}. Best is trial 345 with value: 0.13438257115663557.
[I 2024-12-03 18:49:21,877] Trial 707 finished with value: 0.1350393587626638 and parameters: {'kernel': 'linear', 'C': 15.685494924001695, 'gamma': 0.00011410065645040817, 'epsilon': 0.03873517185690569}. Best is trial 345 with value: 0.13438257115663557.
[I 2024-12-03 18:49:21,901] Trial 723 finished with value: 0.16286962033317592 and parameters: {'kernel': 'linear', 'C': 0.4763906947019678, 'gamma': 0.025298154120545778, 'epsilon': 0.07407127389512357}. Best is trial 345 with value: 0.13438257115663557.
[I 2024-12-03 18:49:21,904] Trial 691 finished with value: 0.1402776481878423 and parameters: {'kernel': 'linear', 'C': 95.77003426695296, 'gamma': 0.0007852480256240647, 'epsilon': 0.10269418313959965}. Best is trial 345 with value: 0.13438257115663557.
[I 2024-12-03 18:49:22,255] Trial 718 finished with value: 0.13926042314841378 and parameters: {'kernel': 'linear', 'C': 22.487825742951163, 'gamma': 0.00031654466603399774, 'epsilon': 0.08532838414512313}. Best is trial 345 with value: 0.13438257115663557.
[I 2024-12-03 18:49:22,782] Trial 722 finished with value: 0.14086050370285141 and parameters: {'kernel': 'linear', 'C': 7.025624447651804, 'gamma': 0.0006363125398202776, 'epsilon': 0.0815772749625613}. Best is trial 345 with value: 0.13438257115663557.
[I 2024-12-03 18:49:23,643] Trial 724 finished with value: 1.03732263360837 and parameters: {'kernel': 'sigmoid', 'C': 0.3759249149234125, 'gamma': 0.0004084355211360036, 'epsilon': 0.4765772471794938}. Best is trial 345 with value: 0.13438257115663557.
[I 2024-12-03 18:49:23,687] Trial 713 finished with value: 0.13547787798524563 and parameters: {'kernel': 'linear', 'C': 15.935113680896531, 'gamma': 0.0008357490964279686, 'epsilon': 0.0660068003575054}. Best is trial 345 with value: 0.13438257115663557.
[I 2024-12-03 18:49:23,692] Trial 712 finished with value: 0.13524238960865304 and parameters: {'kernel': 'linear', 'C': 19.089176536600153, 'gamma': 0.007536672236699414, 'epsilon': 0.05388138421933006}. Best is trial 345 with value: 0.13438257115663557.
[I 2024-12-03 18:49:25,939] Trial 731 finished with value: 0.2460491528245912 and parameters: {'kernel': 'linear', 'C': 0.05207323028028091, 'gamma': 0.4952840981490263, 'epsilon': 0.03572607938019701}. Best is trial 345 with value: 0.13438257115663557.
[I 2024-12-03 18:49:26,199] Trial 728 finished with value: 0.1416892613957019 and parameters: {'kernel': 'linear', 'C': 0.9693324468109338, 'gamma': 0.00023627127417782706, 'epsilon': 0.028782150554961732}. Best is trial 345 with value: 0.13438257115663557.
[I 2024-12-03 18:49:28,419] Trial 732 finished with value: 0.24200211256542403 and parameters: {'kernel': 'rbf', 'C': 91.71109394949467, 'gamma': 0.00017485404775386578, 'epsilon': 0.00199284360885997}. Best is trial 345 with value: 0.13438257115663557.
[I 2024-12-03 18:49:28,507] Trial 733 finished with value: 1.346778729190073 and parameters: {'kernel': 'sigmoid', 'C': 0.0029458495026374785, 'gamma': 0.00256709835145317, 'epsilon': 0.1340429344673844}. Best is trial 345 with value: 0.13438257115663557.
[I 2024-12-03 18:49:29,114] Trial 729 finished with value: 0.13807476902821011 and parameters: {'kernel': 'linear', 'C': 1.9441046839300586, 'gamma': 0.00011734671279915257, 'epsilon': 0.02646860372327273}. Best is trial 345 with value: 0.13438257115663557.
[I 2024-12-03 18:49:30,250] Trial 710 finished with value: 0.13674484619621458 and parameters: {'kernel': 'linear', 'C': 21.26844492875509, 'gamma': 0.007000775726111885, 'epsilon': 0.023888360505202884}. Best is trial 345 with value: 0.13438257115663557.
[I 2024-12-03 18:49:30,252] Trial 735 finished with value: 236.27071505396015 and parameters: {'kernel': 'sigmoid', 'C': 75.90381942483015, 'gamma': 0.006748082571242801, 'epsilon': 0.05792261071262199}. Best is trial 345 with value: 0.13438257115663557.
[I 2024-12-03 18:49:31,153] Trial 736 finished with value: 2.040142871375491 and parameters: {'kernel': 'sigmoid', 'C': 37.17407327118757, 'gamma': 0.0013247332053676808, 'epsilon': 0.0010739554696480537}. Best is trial 345 with value: 0.13438257115663557.
[I 2024-12-03 18:49:31,984] Trial 737 finished with value: 0.3767509609956586 and parameters: {'kernel': 'sigmoid', 'C': 8.749879741592757, 'gamma': 0.0009192806280419043, 'epsilon': 0.026185553615726956}. Best is trial 345 with value: 0.13438257115663557.
[I 2024-12-03 18:49:32,965] Trial 721 finished with value: 0.13526589715890505 and parameters: {'kernel': 'linear', 'C': 18.043321265460825, 'gamma': 0.014723219259133027, 'epsilon': 0.0557522399296731}. Best is trial 345 with value: 0.13438257115663557.
[I 2024-12-03 18:49:33,440] Trial 739 finished with value: 0.13861966545558702 and parameters: {'kernel': 'linear', 'C': 2.3018920403743164, 'gamma': 0.00021926651203567766, 'epsilon': 0.06339429899911418}. Best is trial 345 with value: 0.13438257115663557.
[I 2024-12-03 18:49:34,768] Trial 741 finished with value: 1.359743813831995 and parameters: {'kernel': 'poly', 'C': 11.091023989200485, 'gamma': 0.00011160078545193249, 'epsilon': 0.025790505878269997}. Best is trial 345 with value: 0.13438257115663557.
[I 2024-12-03 18:49:35,753] Trial 693 finished with value: 0.135073950203582 and parameters: {'kernel': 'linear', 'C': 83.52848671634719, 'gamma': 0.001852660082136206, 'epsilon': 0.055768423363995706}. Best is trial 345 with value: 0.13438257115663557.
[I 2024-12-03 18:49:36,045] Trial 638 finished with value: 0.1347495256966988 and parameters: {'kernel': 'linear', 'C': 92.41981463879307, 'gamma': 0.012496935531220272, 'epsilon': 0.030384696756841093}. Best is trial 345 with value: 0.13438257115663557.
[I 2024-12-03 18:49:36,491] Trial 701 finished with value: 0.1381762526981452 and parameters: {'kernel': 'linear', 'C': 27.875591687121965, 'gamma': 0.024833773890857638, 'epsilon': 0.00827122295239113}. Best is trial 345 with value: 0.13438257115663557.
[I 2024-12-03 18:49:36,742] Trial 738 finished with value: 0.14057186061084753 and parameters: {'kernel': 'linear', 'C': 30.790040373319478, 'gamma': 0.0001589556236792283, 'epsilon': 0.10784807319121734}. Best is trial 345 with value: 0.13438257115663557.
[I 2024-12-03 18:49:37,731] Trial 720 finished with value: 0.13550803670669406 and parameters: {'kernel': 'linear', 'C': 20.547438893314418, 'gamma': 0.029696141618260445, 'epsilon': 0.032808856851088704}. Best is trial 345 with value: 0.13438257115663557.
[I 2024-12-03 18:49:38,619] Trial 679 finished with value: 0.13674563621512023 and parameters: {'kernel': 'linear', 'C': 87.29830568912125, 'gamma': 0.0004866037849667215, 'epsilon': 0.05003899644832958}. Best is trial 345 with value: 0.13438257115663557.
[I 2024-12-03 18:49:39,335] Trial 727 finished with value: 0.13713198030901055 and parameters: {'kernel': 'linear', 'C': 10.608734759975082, 'gamma': 0.00035556835658263506, 'epsilon': 0.022694465809988802}. Best is trial 345 with value: 0.13438257115663557.
[I 2024-12-03 18:49:40,047] Trial 648 finished with value: 0.1352194383567356 and parameters: {'kernel': 'linear', 'C': 86.64710944123192, 'gamma': 0.004297060937606038, 'epsilon': 0.05687120343066217}. Best is trial 345 with value: 0.13438257115663557.
[I 2024-12-03 18:49:40,060] Trial 725 finished with value: 0.1354037135746891 and parameters: {'kernel': 'linear', 'C': 11.16178630174159, 'gamma': 0.00031284668234813815, 'epsilon': 0.029144791403843937}. Best is trial 345 with value: 0.13438257115663557.
[I 2024-12-03 18:49:40,227] Trial 702 finished with value: 0.14017228899054202 and parameters: {'kernel': 'linear', 'C': 74.87152697222668, 'gamma': 0.006204089742388027, 'epsilon': 0.10474124073480856}. Best is trial 345 with value: 0.13438257115663557.
[I 2024-12-03 18:49:42,219] Trial 752 finished with value: 0.4587846296585907 and parameters: {'kernel': 'rbf', 'C': 2.1020785578347483, 'gamma': 0.0009157447333142153, 'epsilon': 0.7587831343494623}. Best is trial 345 with value: 0.13438257115663557.
[I 2024-12-03 18:49:42,221] Trial 749 finished with value: 0.13717706232574367 and parameters: {'kernel': 'linear', 'C': 1.9715040916566744, 'gamma': 0.011448607420600752, 'epsilon': 0.046733931269282755}. Best is trial 345 with value: 0.13438257115663557.
[I 2024-12-03 18:49:43,152] Trial 598 finished with value: 0.13724392513985373 and parameters: {'kernel': 'linear', 'C': 96.19707656350214, 'gamma': 0.004088722235620848, 'epsilon': 0.01878853218232937}. Best is trial 345 with value: 0.13438257115663557.
[I 2024-12-03 18:49:43,161] Trial 653 finished with value: 0.1372905335271671 and parameters: {'kernel': 'linear', 'C': 99.18443709987483, 'gamma': 0.00014822059267328815, 'epsilon': 0.02087038772757129}. Best is trial 345 with value: 0.13438257115663557.
[I 2024-12-03 18:49:44,274] Trial 740 finished with value: 0.13562313584022626 and parameters: {'kernel': 'linear', 'C': 9.435835103218578, 'gamma': 0.00016139544629893002, 'epsilon': 0.027899606307112548}. Best is trial 345 with value: 0.13438257115663557.
[I 2024-12-03 18:49:44,407] Trial 755 finished with value: 0.1448911279703939 and parameters: {'kernel': 'linear', 'C': 0.7321142007986485, 'gamma': 0.0024764632953892846, 'epsilon': 0.034977570057174084}. Best is trial 345 with value: 0.13438257115663557.
[I 2024-12-03 18:49:44,759] Trial 757 finished with value: 0.4235261990736214 and parameters: {'kernel': 'poly', 'C': 51.929004884978816, 'gamma': 0.005964899947035311, 'epsilon': 0.018720414997898917}. Best is trial 345 with value: 0.13438257115663557.
[I 2024-12-03 18:49:45,223] Trial 676 finished with value: 0.13480832361652778 and parameters: {'kernel': 'linear', 'C': 66.32237582400262, 'gamma': 0.004084353713371209, 'epsilon': 0.039282633992449946}. Best is trial 345 with value: 0.13438257115663557.
[I 2024-12-03 18:49:45,963] Trial 743 finished with value: 0.1381415080857025 and parameters: {'kernel': 'linear', 'C': 57.526791364874605, 'gamma': 0.00010236716837593292, 'epsilon': 0.0807271889021725}. Best is trial 345 with value: 0.13438257115663557.
[I 2024-12-03 18:49:46,053] Trial 759 finished with value: 0.3026563351121244 and parameters: {'kernel': 'rbf', 'C': 3.359768373536052, 'gamma': 0.0017701198180938389, 'epsilon': 0.0011381436505005292}. Best is trial 345 with value: 0.13438257115663557.
[I 2024-12-03 18:49:46,583] Trial 761 finished with value: 0.18350294736854958 and parameters: {'kernel': 'rbf', 'C': 69.59780273654226, 'gamma': 0.0010711455401043327, 'epsilon': 0.13897008301960295}. Best is trial 345 with value: 0.13438257115663557.
[I 2024-12-03 18:49:47,497] Trial 763 finished with value: 0.8839789713450528 and parameters: {'kernel': 'poly', 'C': 32.88386617210119, 'gamma': 0.0031184939590419036, 'epsilon': 0.06231359627319109}. Best is trial 345 with value: 0.13438257115663557.
[I 2024-12-03 18:49:49,063] Trial 756 finished with value: 0.13978475072139154 and parameters: {'kernel': 'linear', 'C': 24.239612298459807, 'gamma': 0.006193838260063515, 'epsilon': 0.10133784136928171}. Best is trial 345 with value: 0.13438257115663557.
[I 2024-12-03 18:49:49,315] Trial 751 finished with value: 0.13707344648498887 and parameters: {'kernel': 'linear', 'C': 19.06958332548918, 'gamma': 0.004824683136722271, 'epsilon': 0.04845908585213917}. Best is trial 345 with value: 0.13438257115663557.
