[I 2024-12-04 14:47:37,362] Trial 130 finished with value: 0.5184178229143425 and parameters: {'n_estimators': 630, 'learning_rate': 0.021903274503024824, 'max_depth': 8, 'min_samples_split': 19, 'min_samples_leaf': 1, 'subsample': 0.6288216604683209, 'max_features': None}. Best is trial 123 with value: 0.47822716547411176.
[I 2024-12-04 14:47:40,180] Trial 140 finished with value: 0.5171835996203534 and parameters: {'n_estimators': 998, 'learning_rate': 0.09821576272830337, 'max_depth': 8, 'min_samples_split': 20, 'min_samples_leaf': 1, 'subsample': 0.8237517414254318, 'max_features': None}. Best is trial 123 with value: 0.47822716547411176.
[I 2024-12-04 14:47:40,437] Trial 153 finished with value: 0.6263020660619325 and parameters: {'n_estimators': 529, 'learning_rate': 0.018293376945535265, 'max_depth': 8, 'min_samples_split': 17, 'min_samples_leaf': 2, 'subsample': 0.6492908065912026, 'max_features': 'sqrt'}. Best is trial 123 with value: 0.47822716547411176.
[I 2024-12-04 14:47:40,878] Trial 149 finished with value: 0.5659751679427162 and parameters: {'n_estimators': 115, 'learning_rate': 0.057265703546644973, 'max_depth': 12, 'min_samples_split': 14, 'min_samples_leaf': 2, 'subsample': 0.9810536989051121, 'max_features': None}. Best is trial 123 with value: 0.47822716547411176.
[I 2024-12-04 14:47:40,885] Trial 139 finished with value: 0.5308103322725924 and parameters: {'n_estimators': 666, 'learning_rate': 0.05731796665524116, 'max_depth': 7, 'min_samples_split': 19, 'min_samples_leaf': 1, 'subsample': 0.6869887117864732, 'max_features': None}. Best is trial 123 with value: 0.47822716547411176.
[I 2024-12-04 14:47:41,084] Trial 141 finished with value: 0.7661726304406541 and parameters: {'n_estimators': 462, 'learning_rate': 0.044256300800728565, 'max_depth': 9, 'min_samples_split': 16, 'min_samples_leaf': 3, 'subsample': 0.6452696943342705, 'max_features': 'log2'}. Best is trial 123 with value: 0.47822716547411176.
[I 2024-12-04 14:47:41,471] Trial 132 finished with value: 0.4984296752389106 and parameters: {'n_estimators': 551, 'learning_rate': 0.0270928522524351, 'max_depth': 12, 'min_samples_split': 18, 'min_samples_leaf': 1, 'subsample': 0.820803234993875, 'max_features': None}. Best is trial 123 with value: 0.47822716547411176.
[I 2024-12-04 14:47:44,416] Trial 162 finished with value: 0.6146133365974108 and parameters: {'n_estimators': 191, 'learning_rate': 0.07853079915536451, 'max_depth': 9, 'min_samples_split': 16, 'min_samples_leaf': 2, 'subsample': 0.951718251728969, 'max_features': None}. Best is trial 123 with value: 0.47822716547411176.
[I 2024-12-04 14:47:44,520] Trial 138 finished with value: 0.5383797911571978 and parameters: {'n_estimators': 914, 'learning_rate': 0.0377137456535554, 'max_depth': 5, 'min_samples_split': 18, 'min_samples_leaf': 1, 'subsample': 0.7825430485058611, 'max_features': None}. Best is trial 123 with value: 0.47822716547411176.
[I 2024-12-04 14:47:44,522] Trial 137 finished with value: 0.6066067681791705 and parameters: {'n_estimators': 509, 'learning_rate': 0.03750152893730328, 'max_depth': 12, 'min_samples_split': 18, 'min_samples_leaf': 4, 'subsample': 0.915906537157384, 'max_features': None}. Best is trial 123 with value: 0.47822716547411176.
[I 2024-12-04 14:47:46,677] Trial 148 finished with value: 0.7016800758576783 and parameters: {'n_estimators': 699, 'learning_rate': 0.020616518199999354, 'max_depth': 12, 'min_samples_split': 15, 'min_samples_leaf': 2, 'subsample': 0.9820839231163829, 'max_features': 'log2'}. Best is trial 123 with value: 0.47822716547411176.
[I 2024-12-04 14:47:46,840] Trial 143 finished with value: 0.6016493790956053 and parameters: {'n_estimators': 959, 'learning_rate': 0.024518610607483775, 'max_depth': 5, 'min_samples_split': 20, 'min_samples_leaf': 2, 'subsample': 0.7137448658589389, 'max_features': None}. Best is trial 123 with value: 0.47822716547411176.
[I 2024-12-04 14:47:47,256] Trial 157 finished with value: 0.5030350462293224 and parameters: {'n_estimators': 516, 'learning_rate': 0.07004370223466516, 'max_depth': 11, 'min_samples_split': 20, 'min_samples_leaf': 1, 'subsample': 0.7771628226694678, 'max_features': None}. Best is trial 123 with value: 0.47822716547411176.
[I 2024-12-04 14:47:48,372] Trial 136 finished with value: 0.5347089671411338 and parameters: {'n_estimators': 982, 'learning_rate': 0.015330694079581916, 'max_depth': 6, 'min_samples_split': 20, 'min_samples_leaf': 1, 'subsample': 0.6142751663404304, 'max_features': None}. Best is trial 123 with value: 0.47822716547411176.
[I 2024-12-04 14:47:49,592] Trial 147 finished with value: 0.6005009352988798 and parameters: {'n_estimators': 713, 'learning_rate': 0.028374709011281477, 'max_depth': 9, 'min_samples_split': 14, 'min_samples_leaf': 2, 'subsample': 0.714613011699537, 'max_features': None}. Best is trial 123 with value: 0.47822716547411176.
[I 2024-12-04 14:47:49,872] Trial 145 finished with value: 0.5118002071971157 and parameters: {'n_estimators': 633, 'learning_rate': 0.041874852120097616, 'max_depth': 11, 'min_samples_split': 12, 'min_samples_leaf': 1, 'subsample': 0.807366462935792, 'max_features': None}. Best is trial 123 with value: 0.47822716547411176.
[I 2024-12-04 14:47:50,788] Trial 161 finished with value: 0.5070731935279184 and parameters: {'n_estimators': 362, 'learning_rate': 0.0998732602030612, 'max_depth': 12, 'min_samples_split': 15, 'min_samples_leaf': 1, 'subsample': 0.9287442397451467, 'max_features': None}. Best is trial 123 with value: 0.47822716547411176.
[I 2024-12-04 14:47:51,130] Trial 146 finished with value: 0.4880694530478747 and parameters: {'n_estimators': 837, 'learning_rate': 0.03795434054035753, 'max_depth': 10, 'min_samples_split': 18, 'min_samples_leaf': 1, 'subsample': 0.9622555518437264, 'max_features': None}. Best is trial 123 with value: 0.47822716547411176.
[I 2024-12-04 14:47:51,136] Trial 151 finished with value: 0.5017751895977337 and parameters: {'n_estimators': 521, 'learning_rate': 0.06565318530074772, 'max_depth': 8, 'min_samples_split': 16, 'min_samples_leaf': 1, 'subsample': 0.8551954306680717, 'max_features': None}. Best is trial 123 with value: 0.47822716547411176.
[I 2024-12-04 14:47:52,233] Trial 152 finished with value: 0.6268112816350816 and parameters: {'n_estimators': 653, 'learning_rate': 0.06089631365836473, 'max_depth': 7, 'min_samples_split': 17, 'min_samples_leaf': 3, 'subsample': 0.9279787468745384, 'max_features': None}. Best is trial 123 with value: 0.47822716547411176.
[I 2024-12-04 14:47:53,121] Trial 165 finished with value: 0.6827291062313601 and parameters: {'n_estimators': 459, 'learning_rate': 0.08269977450939586, 'max_depth': 11, 'min_samples_split': 12, 'min_samples_leaf': 3, 'subsample': 0.9761884142462273, 'max_features': 'log2'}. Best is trial 123 with value: 0.47822716547411176.
[I 2024-12-04 14:47:53,357] Trial 158 finished with value: 0.5664200057919753 and parameters: {'n_estimators': 755, 'learning_rate': 0.0723427389234317, 'max_depth': 11, 'min_samples_split': 18, 'min_samples_leaf': 1, 'subsample': 0.9198745819015661, 'max_features': 'sqrt'}. Best is trial 123 with value: 0.47822716547411176.
[I 2024-12-04 14:47:55,656] Trial 142 finished with value: 0.6623227595368345 and parameters: {'n_estimators': 988, 'learning_rate': 0.06580575832283173, 'max_depth': 11, 'min_samples_split': 19, 'min_samples_leaf': 2, 'subsample': 0.8191332050446916, 'max_features': None}. Best is trial 123 with value: 0.47822716547411176.
[I 2024-12-04 14:47:57,139] Trial 144 finished with value: 0.6274363995813093 and parameters: {'n_estimators': 1047, 'learning_rate': 0.0325332681732759, 'max_depth': 11, 'min_samples_split': 16, 'min_samples_leaf': 2, 'subsample': 0.9343887494558006, 'max_features': None}. Best is trial 123 with value: 0.47822716547411176.
[I 2024-12-04 14:47:57,824] Trial 164 finished with value: 0.5418269958127268 and parameters: {'n_estimators': 587, 'learning_rate': 0.015608882310099478, 'max_depth': 6, 'min_samples_split': 17, 'min_samples_leaf': 1, 'subsample': 0.6153674727535087, 'max_features': None}. Best is trial 123 with value: 0.47822716547411176.
[I 2024-12-04 14:47:58,348] Trial 159 finished with value: 0.4799779492597982 and parameters: {'n_estimators': 696, 'learning_rate': 0.04090575471739718, 'max_depth': 10, 'min_samples_split': 20, 'min_samples_leaf': 1, 'subsample': 0.8748048517397756, 'max_features': None}. Best is trial 123 with value: 0.47822716547411176.
[I 2024-12-04 14:47:58,632] Trial 169 finished with value: 0.5747347106180583 and parameters: {'n_estimators': 395, 'learning_rate': 0.019493763295663068, 'max_depth': 11, 'min_samples_split': 20, 'min_samples_leaf': 2, 'subsample': 0.8501404836036175, 'max_features': None}. Best is trial 123 with value: 0.47822716547411176.
[I 2024-12-04 14:47:58,987] Trial 163 finished with value: 0.5284012011977797 and parameters: {'n_estimators': 632, 'learning_rate': 0.021150625706328783, 'max_depth': 7, 'min_samples_split': 17, 'min_samples_leaf': 1, 'subsample': 0.6904515493442063, 'max_features': None}. Best is trial 123 with value: 0.47822716547411176.
[I 2024-12-04 14:48:01,716] Trial 154 finished with value: 0.634786695167999 and parameters: {'n_estimators': 891, 'learning_rate': 0.04825424914699878, 'max_depth': 8, 'min_samples_split': 20, 'min_samples_leaf': 2, 'subsample': 0.8389947135339765, 'max_features': None}. Best is trial 123 with value: 0.47822716547411176.
[I 2024-12-04 14:48:02,760] Trial 178 finished with value: 0.491569273739537 and parameters: {'n_estimators': 299, 'learning_rate': 0.06053095039795212, 'max_depth': 11, 'min_samples_split': 19, 'min_samples_leaf': 1, 'subsample': 0.7679373558756175, 'max_features': None}. Best is trial 123 with value: 0.47822716547411176.
[I 2024-12-04 14:48:03,572] Trial 155 finished with value: 0.52811032843139 and parameters: {'n_estimators': 830, 'learning_rate': 0.05168829562533862, 'max_depth': 10, 'min_samples_split': 12, 'min_samples_leaf': 1, 'subsample': 0.6416632974809233, 'max_features': None}. Best is trial 123 with value: 0.47822716547411176.
[I 2024-12-04 14:48:04,518] Trial 160 finished with value: 0.6622668655265077 and parameters: {'n_estimators': 1084, 'learning_rate': 0.09236453264570046, 'max_depth': 10, 'min_samples_split': 18, 'min_samples_leaf': 3, 'subsample': 0.9475039917112091, 'max_features': 'log2'}. Best is trial 123 with value: 0.47822716547411176.
[I 2024-12-04 14:48:05,143] Trial 176 finished with value: 0.5304381952912823 and parameters: {'n_estimators': 606, 'learning_rate': 0.045601446056968205, 'max_depth': 9, 'min_samples_split': 14, 'min_samples_leaf': 1, 'subsample': 0.8120881704607994, 'max_features': 'sqrt'}. Best is trial 123 with value: 0.47822716547411176.
[I 2024-12-04 14:48:05,228] Trial 179 finished with value: 0.5280214192989043 and parameters: {'n_estimators': 415, 'learning_rate': 0.07875087312873018, 'max_depth': 11, 'min_samples_split': 12, 'min_samples_leaf': 1, 'subsample': 0.9060264741213976, 'max_features': None}. Best is trial 123 with value: 0.47822716547411176.
[I 2024-12-04 14:48:06,450] Trial 156 finished with value: 0.6363364611803289 and parameters: {'n_estimators': 1204, 'learning_rate': 0.03069425615550542, 'max_depth': 9, 'min_samples_split': 14, 'min_samples_leaf': 2, 'subsample': 0.8483314081938533, 'max_features': 'sqrt'}. Best is trial 123 with value: 0.47822716547411176.
[I 2024-12-04 14:48:06,452] Trial 177 finished with value: 0.6553210657422331 and parameters: {'n_estimators': 520, 'learning_rate': 0.09776942318136898, 'max_depth': 10, 'min_samples_split': 17, 'min_samples_leaf': 2, 'subsample': 0.750377048998268, 'max_features': 'log2'}. Best is trial 123 with value: 0.47822716547411176.
[I 2024-12-04 14:48:08,599] Trial 194 finished with value: 0.5968173430492912 and parameters: {'n_estimators': 130, 'learning_rate': 0.06942961897550735, 'max_depth': 10, 'min_samples_split': 18, 'min_samples_leaf': 2, 'subsample': 0.7444732658130058, 'max_features': None}. Best is trial 123 with value: 0.47822716547411176.
[I 2024-12-04 14:48:09,434] Trial 168 finished with value: 0.5256308314499184 and parameters: {'n_estimators': 813, 'learning_rate': 0.08599776429512576, 'max_depth': 10, 'min_samples_split': 17, 'min_samples_leaf': 1, 'subsample': 0.7556033364102122, 'max_features': None}. Best is trial 167 with value: 0.47128001676423487.
[I 2024-12-04 14:48:09,475] Trial 184 finished with value: 0.6741890332038816 and parameters: {'n_estimators': 354, 'learning_rate': 0.09950706402925978, 'max_depth': 12, 'min_samples_split': 13, 'min_samples_leaf': 2, 'subsample': 0.9635655557037482, 'max_features': None}. Best is trial 167 with value: 0.47128001676423487.
[I 2024-12-04 14:48:09,612] Trial 167 finished with value: 0.47128001676423487 and parameters: {'n_estimators': 899, 'learning_rate': 0.0899846000843851, 'max_depth': 10, 'min_samples_split': 19, 'min_samples_leaf': 1, 'subsample': 0.8825507134573184, 'max_features': None}. Best is trial 167 with value: 0.47128001676423487.
[I 2024-12-04 14:48:10,972] Trial 170 finished with value: 0.5201390639432345 and parameters: {'n_estimators': 772, 'learning_rate': 0.013843816379652863, 'max_depth': 10, 'min_samples_split': 20, 'min_samples_leaf': 1, 'subsample': 0.6655624955891072, 'max_features': None}. Best is trial 167 with value: 0.47128001676423487.
[I 2024-12-04 14:48:11,403] Trial 174 finished with value: 0.5223933667468843 and parameters: {'n_estimators': 669, 'learning_rate': 0.04727146438141569, 'max_depth': 11, 'min_samples_split': 14, 'min_samples_leaf': 1, 'subsample': 0.8137991956612943, 'max_features': None}. Best is trial 167 with value: 0.47128001676423487.
[I 2024-12-04 14:48:11,570] Trial 175 finished with value: 0.4949370163222316 and parameters: {'n_estimators': 693, 'learning_rate': 0.026359889942785333, 'max_depth': 11, 'min_samples_split': 18, 'min_samples_leaf': 1, 'subsample': 0.7906982899462344, 'max_features': None}. Best is trial 167 with value: 0.47128001676423487.
[I 2024-12-04 14:48:11,826] Trial 187 finished with value: 0.48965541054934625 and parameters: {'n_estimators': 437, 'learning_rate': 0.05813085382721131, 'max_depth': 7, 'min_samples_split': 19, 'min_samples_leaf': 1, 'subsample': 0.8669012770632564, 'max_features': None}. Best is trial 167 with value: 0.47128001676423487.
[I 2024-12-04 14:48:13,997] Trial 183 finished with value: 0.514590629553786 and parameters: {'n_estimators': 459, 'learning_rate': 0.04159539181448817, 'max_depth': 8, 'min_samples_split': 19, 'min_samples_leaf': 1, 'subsample': 0.8849498713242496, 'max_features': None}. Best is trial 167 with value: 0.47128001676423487.
[I 2024-12-04 14:48:14,015] Trial 190 finished with value: 0.6325603058425509 and parameters: {'n_estimators': 351, 'learning_rate': 0.06657395894680763, 'max_depth': 12, 'min_samples_split': 12, 'min_samples_leaf': 2, 'subsample': 0.886197222323832, 'max_features': 'sqrt'}. Best is trial 167 with value: 0.47128001676423487.
[I 2024-12-04 14:48:15,897] Trial 166 finished with value: 0.5304000307212153 and parameters: {'n_estimators': 1092, 'learning_rate': 0.03314601052741726, 'max_depth': 8, 'min_samples_split': 13, 'min_samples_leaf': 1, 'subsample': 0.8552468227990632, 'max_features': None}. Best is trial 167 with value: 0.47128001676423487.
[I 2024-12-04 14:48:16,274] Trial 188 finished with value: 0.5884705507675486 and parameters: {'n_estimators': 463, 'learning_rate': 0.021773871241026276, 'max_depth': 11, 'min_samples_split': 14, 'min_samples_leaf': 2, 'subsample': 0.7972373754926353, 'max_features': None}. Best is trial 167 with value: 0.47128001676423487.
[I 2024-12-04 14:48:16,275] Trial 186 finished with value: 0.48446124599080786 and parameters: {'n_estimators': 511, 'learning_rate': 0.06329160569242034, 'max_depth': 12, 'min_samples_split': 19, 'min_samples_leaf': 1, 'subsample': 0.993854899731086, 'max_features': None}. Best is trial 167 with value: 0.47128001676423487.
[I 2024-12-04 14:48:16,391] Trial 200 finished with value: 0.6104799157417018 and parameters: {'n_estimators': 190, 'learning_rate': 0.07425635365517493, 'max_depth': 9, 'min_samples_split': 18, 'min_samples_leaf': 3, 'subsample': 0.7823757515227832, 'max_features': 'sqrt'}. Best is trial 167 with value: 0.47128001676423487.
[I 2024-12-04 14:48:16,506] Trial 181 finished with value: 0.4984801154017781 and parameters: {'n_estimators': 556, 'learning_rate': 0.08858482730522013, 'max_depth': 12, 'min_samples_split': 16, 'min_samples_leaf': 1, 'subsample': 0.9521940483256527, 'max_features': None}. Best is trial 167 with value: 0.47128001676423487.
[I 2024-12-04 14:48:16,538] Trial 180 finished with value: 0.506641394003181 and parameters: {'n_estimators': 671, 'learning_rate': 0.03960781440989872, 'max_depth': 10, 'min_samples_split': 15, 'min_samples_leaf': 1, 'subsample': 0.9290566021017994, 'max_features': None}. Best is trial 167 with value: 0.47128001676423487.
[I 2024-12-04 14:48:16,894] Trial 189 finished with value: 0.5204683329715606 and parameters: {'n_estimators': 516, 'learning_rate': 0.06322278987789695, 'max_depth': 9, 'min_samples_split': 12, 'min_samples_leaf': 1, 'subsample': 0.8101897991989847, 'max_features': None}. Best is trial 167 with value: 0.47128001676423487.
[I 2024-12-04 14:48:17,671] Trial 172 finished with value: 0.5350737113200305 and parameters: {'n_estimators': 1062, 'learning_rate': 0.09454318775594764, 'max_depth': 4, 'min_samples_split': 18, 'min_samples_leaf': 1, 'subsample': 0.7950411977714195, 'max_features': None}. Best is trial 167 with value: 0.47128001676423487.
[I 2024-12-04 14:48:19,685] Trial 192 finished with value: 0.5853531939821873 and parameters: {'n_estimators': 640, 'learning_rate': 0.04618038739318272, 'max_depth': 9, 'min_samples_split': 18, 'min_samples_leaf': 1, 'subsample': 0.9810355911499689, 'max_features': 'log2'}. Best is trial 167 with value: 0.47128001676423487.
[I 2024-12-04 14:48:19,690] Trial 185 finished with value: 0.49440750552972745 and parameters: {'n_estimators': 796, 'learning_rate': 0.021013540263444725, 'max_depth': 12, 'min_samples_split': 18, 'min_samples_leaf': 1, 'subsample': 0.9670251356826527, 'max_features': None}. Best is trial 167 with value: 0.47128001676423487.
[I 2024-12-04 14:48:20,527] Trial 197 finished with value: 0.5968795012167314 and parameters: {'n_estimators': 394, 'learning_rate': 0.040247782998672856, 'max_depth': 12, 'min_samples_split': 19, 'min_samples_leaf': 2, 'subsample': 0.7866169569746853, 'max_features': None}. Best is trial 167 with value: 0.47128001676423487.
[I 2024-12-04 14:48:20,852] Trial 196 finished with value: 0.5222148485625315 and parameters: {'n_estimators': 511, 'learning_rate': 0.08149070754746987, 'max_depth': 10, 'min_samples_split': 19, 'min_samples_leaf': 1, 'subsample': 0.8050538729068033, 'max_features': None}. Best is trial 167 with value: 0.47128001676423487.
[I 2024-12-04 14:48:20,885] Trial 171 finished with value: 0.7028018640216055 and parameters: {'n_estimators': 1176, 'learning_rate': 0.08454718239865162, 'max_depth': 5, 'min_samples_split': 17, 'min_samples_leaf': 2, 'subsample': 0.8675083384808073, 'max_features': None}. Best is trial 167 with value: 0.47128001676423487.
[I 2024-12-04 14:48:22,092] Trial 209 finished with value: 0.5529170723726691 and parameters: {'n_estimators': 189, 'learning_rate': 0.05190429125473236, 'max_depth': 11, 'min_samples_split': 19, 'min_samples_leaf': 1, 'subsample': 0.6231023039123929, 'max_features': 'sqrt'}. Best is trial 167 with value: 0.47128001676423487.
[I 2024-12-04 14:48:23,215] Trial 182 finished with value: 0.6383980254055042 and parameters: {'n_estimators': 734, 'learning_rate': 0.029109077545495902, 'max_depth': 12, 'min_samples_split': 8, 'min_samples_leaf': 2, 'subsample': 0.792587119164697, 'max_features': None}. Best is trial 167 with value: 0.47128001676423487.
[I 2024-12-04 14:48:23,272] Trial 204 finished with value: 0.5986961117050957 and parameters: {'n_estimators': 456, 'learning_rate': 0.060308719578366025, 'max_depth': 6, 'min_samples_split': 19, 'min_samples_leaf': 3, 'subsample': 0.8456988485642721, 'max_features': None}. Best is trial 167 with value: 0.47128001676423487.
[I 2024-12-04 14:48:23,369] Trial 173 finished with value: 0.5174991987172513 and parameters: {'n_estimators': 1231, 'learning_rate': 0.08908350370159471, 'max_depth': 7, 'min_samples_split': 18, 'min_samples_leaf': 1, 'subsample': 0.8980305716010415, 'max_features': None}. Best is trial 167 with value: 0.47128001676423487.
[I 2024-12-04 14:48:24,690] Trial 193 finished with value: 0.5037283920710589 and parameters: {'n_estimators': 586, 'learning_rate': 0.053852565475362345, 'max_depth': 10, 'min_samples_split': 20, 'min_samples_leaf': 1, 'subsample': 0.8218292703978544, 'max_features': None}. Best is trial 167 with value: 0.47128001676423487.
[I 2024-12-04 14:48:26,206] Trial 202 finished with value: 0.5904437446940535 and parameters: {'n_estimators': 530, 'learning_rate': 0.027064454259533237, 'max_depth': 12, 'min_samples_split': 15, 'min_samples_leaf': 2, 'subsample': 0.7780170613833607, 'max_features': None}. Best is trial 167 with value: 0.47128001676423487.
[I 2024-12-04 14:48:26,615] Trial 208 finished with value: 0.58318914856407 and parameters: {'n_estimators': 437, 'learning_rate': 0.08119877564444831, 'max_depth': 12, 'min_samples_split': 19, 'min_samples_leaf': 2, 'subsample': 0.9788860811868215, 'max_features': None}. Best is trial 167 with value: 0.47128001676423487.
[I 2024-12-04 14:48:29,200] Trial 191 finished with value: 0.5042804348630965 and parameters: {'n_estimators': 993, 'learning_rate': 0.028420128755337466, 'max_depth': 9, 'min_samples_split': 20, 'min_samples_leaf': 1, 'subsample': 0.9544129541395778, 'max_features': None}. Best is trial 167 with value: 0.47128001676423487.
