[I 2024-12-04 12:51:17,598] Trial 1871 finished with value: 0.41052705964345243 and parameters: {'n_estimators': 1221, 'learning_rate': 0.09439656524559331, 'max_depth': 6, 'min_samples_split': 6, 'min_samples_leaf': 2, 'subsample': 0.6140660718751318, 'max_features': 'log2'}. Best is trial 1454 with value: 0.30763307678022894.
[I 2024-12-04 12:51:17,650] Trial 1867 finished with value: 0.39866409887457926 and parameters: {'n_estimators': 1183, 'learning_rate': 0.09930519368114153, 'max_depth': 6, 'min_samples_split': 2, 'min_samples_leaf': 1, 'subsample': 0.7327232806639467, 'max_features': None}. Best is trial 1454 with value: 0.30763307678022894.
[I 2024-12-04 12:51:18,404] Trial 1876 finished with value: 0.3314594102606633 and parameters: {'n_estimators': 882, 'learning_rate': 0.06780759732812293, 'max_depth': 6, 'min_samples_split': 6, 'min_samples_leaf': 2, 'subsample': 0.7355505928811042, 'max_features': None}. Best is trial 1454 with value: 0.30763307678022894.
[I 2024-12-04 12:51:20,063] Trial 1877 finished with value: 0.39359426434370554 and parameters: {'n_estimators': 996, 'learning_rate': 0.0621605134613354, 'max_depth': 5, 'min_samples_split': 5, 'min_samples_leaf': 3, 'subsample': 0.6900716527573202, 'max_features': None}. Best is trial 1454 with value: 0.30763307678022894.
[I 2024-12-04 12:51:20,992] Trial 1878 finished with value: 0.3694414072811232 and parameters: {'n_estimators': 951, 'learning_rate': 0.07903500175007551, 'max_depth': 6, 'min_samples_split': 2, 'min_samples_leaf': 4, 'subsample': 0.6966136149377665, 'max_features': None}. Best is trial 1454 with value: 0.30763307678022894.
[I 2024-12-04 12:51:23,186] Trial 1898 finished with value: 0.37837224236013206 and parameters: {'n_estimators': 392, 'learning_rate': 0.05699199671568059, 'max_depth': 6, 'min_samples_split': 7, 'min_samples_leaf': 2, 'subsample': 0.6382320919813969, 'max_features': None}. Best is trial 1454 with value: 0.30763307678022894.
[I 2024-12-04 12:51:24,697] Trial 1882 finished with value: 0.3247324231780964 and parameters: {'n_estimators': 870, 'learning_rate': 0.09220343158772863, 'max_depth': 6, 'min_samples_split': 2, 'min_samples_leaf': 2, 'subsample': 0.747622649491281, 'max_features': None}. Best is trial 1454 with value: 0.30763307678022894.
[I 2024-12-04 12:51:25,778] Trial 1881 finished with value: 0.6084458925523882 and parameters: {'n_estimators': 1094, 'learning_rate': 0.0427219955063625, 'max_depth': 10, 'min_samples_split': 9, 'min_samples_leaf': 7, 'subsample': 0.7074789918742306, 'max_features': 'log2'}. Best is trial 1454 with value: 0.30763307678022894.
[I 2024-12-04 12:51:27,107] Trial 1891 finished with value: 0.3853250847974707 and parameters: {'n_estimators': 711, 'learning_rate': 0.04535882119544737, 'max_depth': 7, 'min_samples_split': 5, 'min_samples_leaf': 5, 'subsample': 0.765431148402861, 'max_features': None}. Best is trial 1454 with value: 0.30763307678022894.
[I 2024-12-04 12:51:27,602] Trial 1901 finished with value: 0.5559354214927348 and parameters: {'n_estimators': 386, 'learning_rate': 0.03810413002132491, 'max_depth': 8, 'min_samples_split': 11, 'min_samples_leaf': 9, 'subsample': 0.8099843445468404, 'max_features': None}. Best is trial 1454 with value: 0.30763307678022894.
[I 2024-12-04 12:51:30,043] Trial 1883 finished with value: 0.5663079544696795 and parameters: {'n_estimators': 1199, 'learning_rate': 0.02408747863536035, 'max_depth': 12, 'min_samples_split': 17, 'min_samples_leaf': 4, 'subsample': 0.7006935780242713, 'max_features': 'log2'}. Best is trial 1454 with value: 0.30763307678022894.
[I 2024-12-04 12:51:30,050] Trial 1885 finished with value: 0.3962179843425518 and parameters: {'n_estimators': 917, 'learning_rate': 0.0695750594216527, 'max_depth': 10, 'min_samples_split': 2, 'min_samples_leaf': 3, 'subsample': 0.6288799282492532, 'max_features': None}. Best is trial 1454 with value: 0.30763307678022894.
[I 2024-12-04 12:51:30,943] Trial 1887 finished with value: 0.37689034905253715 and parameters: {'n_estimators': 938, 'learning_rate': 0.05260918059787968, 'max_depth': 8, 'min_samples_split': 4, 'min_samples_leaf': 4, 'subsample': 0.6513094834523196, 'max_features': None}. Best is trial 1454 with value: 0.30763307678022894.
[I 2024-12-04 12:51:32,397] Trial 1884 finished with value: 0.4045503877643324 and parameters: {'n_estimators': 1141, 'learning_rate': 0.024860105671149376, 'max_depth': 6, 'min_samples_split': 2, 'min_samples_leaf': 6, 'subsample': 0.6363759836064118, 'max_features': None}. Best is trial 1454 with value: 0.30763307678022894.
[I 2024-12-04 12:51:32,721] Trial 1906 finished with value: 0.4119888379915874 and parameters: {'n_estimators': 444, 'learning_rate': 0.06285480673093709, 'max_depth': 7, 'min_samples_split': 2, 'min_samples_leaf': 1, 'subsample': 0.7854427895282967, 'max_features': None}. Best is trial 1454 with value: 0.30763307678022894.
[I 2024-12-04 12:51:33,286] Trial 1888 finished with value: 0.32875210179335235 and parameters: {'n_estimators': 973, 'learning_rate': 0.05160135828994676, 'max_depth': 8, 'min_samples_split': 6, 'min_samples_leaf': 2, 'subsample': 0.6917782482313763, 'max_features': None}. Best is trial 1454 with value: 0.30763307678022894.
[I 2024-12-04 12:51:36,757] Trial 1902 finished with value: 0.37761683745747227 and parameters: {'n_estimators': 740, 'learning_rate': 0.09690795146248625, 'max_depth': 8, 'min_samples_split': 4, 'min_samples_leaf': 1, 'subsample': 0.7223066587792285, 'max_features': 'sqrt'}. Best is trial 1454 with value: 0.30763307678022894.
[I 2024-12-04 12:51:37,751] Trial 1893 finished with value: 0.3779729851969994 and parameters: {'n_estimators': 947, 'learning_rate': 0.05785870913429762, 'max_depth': 7, 'min_samples_split': 3, 'min_samples_leaf': 1, 'subsample': 0.622797321061568, 'max_features': None}. Best is trial 1454 with value: 0.30763307678022894.
[I 2024-12-04 12:51:40,020] Trial 1889 finished with value: 0.37229146667502117 and parameters: {'n_estimators': 1077, 'learning_rate': 0.03129411924020319, 'max_depth': 10, 'min_samples_split': 2, 'min_samples_leaf': 4, 'subsample': 0.7192823026023628, 'max_features': None}. Best is trial 1454 with value: 0.30763307678022894.
[I 2024-12-04 12:51:40,084] Trial 1894 finished with value: 0.3695981671857872 and parameters: {'n_estimators': 974, 'learning_rate': 0.04131719419670568, 'max_depth': 8, 'min_samples_split': 2, 'min_samples_leaf': 4, 'subsample': 0.6845179196443969, 'max_features': None}. Best is trial 1454 with value: 0.30763307678022894.
[I 2024-12-04 12:51:40,827] Trial 1890 finished with value: 0.32922163506061536 and parameters: {'n_estimators': 1136, 'learning_rate': 0.04862438323154339, 'max_depth': 10, 'min_samples_split': 2, 'min_samples_leaf': 2, 'subsample': 0.6461787021513016, 'max_features': None}. Best is trial 1454 with value: 0.30763307678022894.
[I 2024-12-04 12:51:41,421] Trial 1896 finished with value: 0.42933624971633366 and parameters: {'n_estimators': 1021, 'learning_rate': 0.028753134870382512, 'max_depth': 7, 'min_samples_split': 8, 'min_samples_leaf': 3, 'subsample': 0.7729725355449933, 'max_features': 'sqrt'}. Best is trial 1454 with value: 0.30763307678022894.
[I 2024-12-04 12:51:42,508] Trial 1880 finished with value: 0.3212459578441216 and parameters: {'n_estimators': 1354, 'learning_rate': 0.06923232920020667, 'max_depth': 9, 'min_samples_split': 5, 'min_samples_leaf': 2, 'subsample': 0.6262672762937447, 'max_features': None}. Best is trial 1454 with value: 0.30763307678022894.
[I 2024-12-04 12:51:42,984] Trial 1900 finished with value: 0.37391280702026397 and parameters: {'n_estimators': 826, 'learning_rate': 0.09143051799193953, 'max_depth': 10, 'min_samples_split': 2, 'min_samples_leaf': 1, 'subsample': 0.7414734840105248, 'max_features': None}. Best is trial 1454 with value: 0.30763307678022894.
[I 2024-12-04 12:51:47,602] Trial 1903 finished with value: 0.32916229530694285 and parameters: {'n_estimators': 942, 'learning_rate': 0.06187563870273268, 'max_depth': 6, 'min_samples_split': 2, 'min_samples_leaf': 2, 'subsample': 0.7992644825167139, 'max_features': None}. Best is trial 1454 with value: 0.30763307678022894.
[I 2024-12-04 12:51:47,970] Trial 1892 finished with value: 0.32529044833095916 and parameters: {'n_estimators': 1158, 'learning_rate': 0.06030497387923637, 'max_depth': 8, 'min_samples_split': 3, 'min_samples_leaf': 2, 'subsample': 0.7016526388543788, 'max_features': None}. Best is trial 1454 with value: 0.30763307678022894.
[I 2024-12-04 12:51:48,827] Trial 1904 finished with value: 0.36575636193643396 and parameters: {'n_estimators': 923, 'learning_rate': 0.06602989967684782, 'max_depth': 8, 'min_samples_split': 2, 'min_samples_leaf': 1, 'subsample': 0.6346345111590607, 'max_features': None}. Best is trial 1454 with value: 0.30763307678022894.
[I 2024-12-04 12:51:50,259] Trial 1886 finished with value: 0.5497708245520694 and parameters: {'n_estimators': 1457, 'learning_rate': 0.023323219208471843, 'max_depth': 12, 'min_samples_split': 9, 'min_samples_leaf': 9, 'subsample': 0.8780592042895761, 'max_features': None}. Best is trial 1454 with value: 0.30763307678022894.
[I 2024-12-04 12:51:51,760] Trial 1897 finished with value: 0.3333420635251336 and parameters: {'n_estimators': 1206, 'learning_rate': 0.07243526996315655, 'max_depth': 8, 'min_samples_split': 4, 'min_samples_leaf': 2, 'subsample': 0.614175706022479, 'max_features': None}. Best is trial 1454 with value: 0.30763307678022894.
[I 2024-12-04 12:51:53,672] Trial 1916 finished with value: 0.4153090466015599 and parameters: {'n_estimators': 742, 'learning_rate': 0.09235074929759579, 'max_depth': 9, 'min_samples_split': 2, 'min_samples_leaf': 2, 'subsample': 0.7472094067991133, 'max_features': 'log2'}. Best is trial 1454 with value: 0.30763307678022894.
[I 2024-12-04 12:51:54,956] Trial 1908 finished with value: 0.4214212126512959 and parameters: {'n_estimators': 1012, 'learning_rate': 0.04133781690747003, 'max_depth': 3, 'min_samples_split': 9, 'min_samples_leaf': 3, 'subsample': 0.795043069496705, 'max_features': None}. Best is trial 1454 with value: 0.30763307678022894.
[I 2024-12-04 12:51:55,633] Trial 1899 finished with value: 0.38846494869780324 and parameters: {'n_estimators': 1243, 'learning_rate': 0.03609287993082814, 'max_depth': 9, 'min_samples_split': 3, 'min_samples_leaf': 3, 'subsample': 0.6524225063227291, 'max_features': None}. Best is trial 1454 with value: 0.30763307678022894.
[I 2024-12-04 12:51:57,048] Trial 1929 finished with value: 0.6774090335882063 and parameters: {'n_estimators': 309, 'learning_rate': 0.055839675165053136, 'max_depth': 3, 'min_samples_split': 17, 'min_samples_leaf': 2, 'subsample': 0.9202496966304003, 'max_features': 'log2'}. Best is trial 1454 with value: 0.30763307678022894.
[I 2024-12-04 12:51:57,051] Trial 1905 finished with value: 0.3838743342303686 and parameters: {'n_estimators': 1128, 'learning_rate': 0.04772762284324854, 'max_depth': 8, 'min_samples_split': 3, 'min_samples_leaf': 1, 'subsample': 0.6764911440621072, 'max_features': None}. Best is trial 1454 with value: 0.30763307678022894.
[I 2024-12-04 12:51:58,583] Trial 1911 finished with value: 0.32649767875370433 and parameters: {'n_estimators': 971, 'learning_rate': 0.0941762985766602, 'max_depth': 5, 'min_samples_split': 2, 'min_samples_leaf': 2, 'subsample': 0.6800166431632856, 'max_features': None}. Best is trial 1454 with value: 0.30763307678022894.
[I 2024-12-04 12:51:58,606] Trial 1907 finished with value: 0.3372832068122618 and parameters: {'n_estimators': 1107, 'learning_rate': 0.04847077714025803, 'max_depth': 8, 'min_samples_split': 3, 'min_samples_leaf': 2, 'subsample': 0.6254896419685326, 'max_features': None}. Best is trial 1454 with value: 0.30763307678022894.
[I 2024-12-04 12:51:59,511] Trial 1917 finished with value: 0.3850636915578383 and parameters: {'n_estimators': 732, 'learning_rate': 0.037301497434248106, 'max_depth': 7, 'min_samples_split': 2, 'min_samples_leaf': 1, 'subsample': 0.6255699823243724, 'max_features': None}. Best is trial 1454 with value: 0.30763307678022894.
[I 2024-12-04 12:52:00,190] Trial 1918 finished with value: 0.3308416569666761 and parameters: {'n_estimators': 706, 'learning_rate': 0.07912983449926331, 'max_depth': 7, 'min_samples_split': 2, 'min_samples_leaf': 2, 'subsample': 0.6406688956750072, 'max_features': None}. Best is trial 1454 with value: 0.30763307678022894.
[I 2024-12-04 12:52:04,315] Trial 1913 finished with value: 0.3899355833814885 and parameters: {'n_estimators': 1172, 'learning_rate': 0.05359959830817974, 'max_depth': 8, 'min_samples_split': 3, 'min_samples_leaf': 1, 'subsample': 0.6047352512584152, 'max_features': 'sqrt'}. Best is trial 1454 with value: 0.30763307678022894.
[I 2024-12-04 12:52:06,608] Trial 1909 finished with value: 0.4764649519951162 and parameters: {'n_estimators': 1429, 'learning_rate': 0.011802732367623523, 'max_depth': 12, 'min_samples_split': 19, 'min_samples_leaf': 7, 'subsample': 0.9048414941192391, 'max_features': 'sqrt'}. Best is trial 1454 with value: 0.30763307678022894.
[I 2024-12-04 12:52:07,223] Trial 1914 finished with value: 0.33365979378004623 and parameters: {'n_estimators': 1080, 'learning_rate': 0.032329428926725017, 'max_depth': 7, 'min_samples_split': 2, 'min_samples_leaf': 2, 'subsample': 0.7387691064966416, 'max_features': None}. Best is trial 1454 with value: 0.30763307678022894.
[I 2024-12-04 12:52:08,409] Trial 1912 finished with value: 0.40171710247059567 and parameters: {'n_estimators': 1395, 'learning_rate': 0.09930418426967383, 'max_depth': 5, 'min_samples_split': 6, 'min_samples_leaf': 1, 'subsample': 0.6946086287667173, 'max_features': 'sqrt'}. Best is trial 1454 with value: 0.30763307678022894.
[I 2024-12-04 12:52:10,709] Trial 1915 finished with value: 0.3794406505091811 and parameters: {'n_estimators': 1151, 'learning_rate': 0.060617340503092525, 'max_depth': 7, 'min_samples_split': 4, 'min_samples_leaf': 1, 'subsample': 0.61387875537764, 'max_features': None}. Best is trial 1454 with value: 0.30763307678022894.
[I 2024-12-04 12:52:11,937] Trial 1938 finished with value: 0.9380093033970571 and parameters: {'n_estimators': 418, 'learning_rate': 0.01704235078542727, 'max_depth': 5, 'min_samples_split': 4, 'min_samples_leaf': 7, 'subsample': 0.696289853914623, 'max_features': 'log2'}. Best is trial 1454 with value: 0.30763307678022894.
[I 2024-12-04 12:52:12,377] Trial 1910 finished with value: 0.3929606832765449 and parameters: {'n_estimators': 1449, 'learning_rate': 0.09391887348251252, 'max_depth': 5, 'min_samples_split': 2, 'min_samples_leaf': 3, 'subsample': 0.6272306441332505, 'max_features': None}. Best is trial 1454 with value: 0.30763307678022894.
[I 2024-12-04 12:52:14,016] Trial 1919 finished with value: 0.39962407518006005 and parameters: {'n_estimators': 1100, 'learning_rate': 0.047482282314085245, 'max_depth': 8, 'min_samples_split': 5, 'min_samples_leaf': 3, 'subsample': 0.640634894471748, 'max_features': None}. Best is trial 1454 with value: 0.30763307678022894.
[I 2024-12-04 12:52:14,017] Trial 1928 finished with value: 0.33870967411280756 and parameters: {'n_estimators': 793, 'learning_rate': 0.09097043935345354, 'max_depth': 6, 'min_samples_split': 5, 'min_samples_leaf': 2, 'subsample': 0.6322148745432379, 'max_features': None}. Best is trial 1454 with value: 0.30763307678022894.
[I 2024-12-04 12:52:16,266] Trial 1923 finished with value: 0.3763082274710532 and parameters: {'n_estimators': 1064, 'learning_rate': 0.07378089875411535, 'max_depth': 6, 'min_samples_split': 5, 'min_samples_leaf': 3, 'subsample': 0.6481310400298645, 'max_features': None}. Best is trial 1454 with value: 0.30763307678022894.
[I 2024-12-04 12:52:16,480] Trial 1921 finished with value: 0.3857884061790865 and parameters: {'n_estimators': 1090, 'learning_rate': 0.04271698280908694, 'max_depth': 7, 'min_samples_split': 2, 'min_samples_leaf': 1, 'subsample': 0.6634886230318626, 'max_features': None}. Best is trial 1454 with value: 0.30763307678022894.
[I 2024-12-04 12:52:18,881] Trial 1927 finished with value: 0.5555659727056497 and parameters: {'n_estimators': 857, 'learning_rate': 0.016226149965826556, 'max_depth': 11, 'min_samples_split': 9, 'min_samples_leaf': 9, 'subsample': 0.7675735799125903, 'max_features': None}. Best is trial 1454 with value: 0.30763307678022894.
[I 2024-12-04 12:52:18,945] Trial 1930 finished with value: 0.3366125391272334 and parameters: {'n_estimators': 831, 'learning_rate': 0.0384296831349115, 'max_depth': 9, 'min_samples_split': 4, 'min_samples_leaf': 2, 'subsample': 0.6322679755508247, 'max_features': None}. Best is trial 1454 with value: 0.30763307678022894.
[I 2024-12-04 12:52:19,345] Trial 1943 finished with value: 0.7706189444382793 and parameters: {'n_estimators': 448, 'learning_rate': 0.023621123431916757, 'max_depth': 4, 'min_samples_split': 11, 'min_samples_leaf': 4, 'subsample': 0.7656191775378618, 'max_features': 'log2'}. Best is trial 1454 with value: 0.30763307678022894.
[I 2024-12-04 12:52:21,455] Trial 1936 finished with value: 0.39576787879710784 and parameters: {'n_estimators': 695, 'learning_rate': 0.08377223116978443, 'max_depth': 6, 'min_samples_split': 6, 'min_samples_leaf': 1, 'subsample': 0.7145034989028226, 'max_features': None}. Best is trial 1454 with value: 0.30763307678022894.
[I 2024-12-04 12:52:21,799] Trial 1920 finished with value: 0.7382440474640177 and parameters: {'n_estimators': 1414, 'learning_rate': 0.0187062822800889, 'max_depth': 3, 'min_samples_split': 13, 'min_samples_leaf': 6, 'subsample': 0.6340858674335373, 'max_features': 'log2'}. Best is trial 1454 with value: 0.30763307678022894.
[I 2024-12-04 12:52:22,052] Trial 1933 finished with value: 0.37992808021332597 and parameters: {'n_estimators': 830, 'learning_rate': 0.04253573168481222, 'max_depth': 6, 'min_samples_split': 6, 'min_samples_leaf': 4, 'subsample': 0.6228563192104356, 'max_features': None}. Best is trial 1454 with value: 0.30763307678022894.
[I 2024-12-04 12:52:24,746] Trial 1926 finished with value: 0.40376135886538894 and parameters: {'n_estimators': 1211, 'learning_rate': 0.08849844311436134, 'max_depth': 9, 'min_samples_split': 2, 'min_samples_leaf': 3, 'subsample': 0.8194703714080578, 'max_features': 'sqrt'}. Best is trial 1454 with value: 0.30763307678022894.
[I 2024-12-04 12:52:25,312] Trial 1922 finished with value: 0.3256401476644576 and parameters: {'n_estimators': 1239, 'learning_rate': 0.06167033792390274, 'max_depth': 8, 'min_samples_split': 2, 'min_samples_leaf': 2, 'subsample': 0.6635451700703574, 'max_features': None}. Best is trial 1454 with value: 0.30763307678022894.
[I 2024-12-04 12:52:25,596] Trial 1925 finished with value: 0.36879715151381803 and parameters: {'n_estimators': 1178, 'learning_rate': 0.040396862552845386, 'max_depth': 8, 'min_samples_split': 4, 'min_samples_leaf': 4, 'subsample': 0.6032071703520284, 'max_features': None}. Best is trial 1454 with value: 0.30763307678022894.
[I 2024-12-04 12:52:25,966] Trial 1931 finished with value: 0.3876701442415777 and parameters: {'n_estimators': 990, 'learning_rate': 0.07579125908982605, 'max_depth': 7, 'min_samples_split': 2, 'min_samples_leaf': 3, 'subsample': 0.6976544556365023, 'max_features': None}. Best is trial 1454 with value: 0.30763307678022894.
[I 2024-12-04 12:52:25,972] Trial 1946 finished with value: 0.3827886556319714 and parameters: {'n_estimators': 525, 'learning_rate': 0.08678245582938925, 'max_depth': 5, 'min_samples_split': 2, 'min_samples_leaf': 1, 'subsample': 0.645527690256053, 'max_features': None}. Best is trial 1454 with value: 0.30763307678022894.
[I 2024-12-04 12:52:26,252] Trial 1934 finished with value: 0.33016494474377933 and parameters: {'n_estimators': 881, 'learning_rate': 0.09404818771065514, 'max_depth': 7, 'min_samples_split': 2, 'min_samples_leaf': 2, 'subsample': 0.6753812064467488, 'max_features': None}. Best is trial 1454 with value: 0.30763307678022894.
[I 2024-12-04 12:52:29,850] Trial 1935 finished with value: 0.7226106372682947 and parameters: {'n_estimators': 1145, 'learning_rate': 0.037727681775805336, 'max_depth': 8, 'min_samples_split': 3, 'min_samples_leaf': 10, 'subsample': 0.6056662082879674, 'max_features': 'log2'}. Best is trial 1454 with value: 0.30763307678022894.
[I 2024-12-04 12:52:30,173] Trial 1940 finished with value: 0.39001493788138286 and parameters: {'n_estimators': 866, 'learning_rate': 0.04337860791349102, 'max_depth': 7, 'min_samples_split': 6, 'min_samples_leaf': 2, 'subsample': 0.7102539861758705, 'max_features': 'sqrt'}. Best is trial 1454 with value: 0.30763307678022894.
[I 2024-12-04 12:52:31,398] Trial 1924 finished with value: 0.37310186178772586 and parameters: {'n_estimators': 1379, 'learning_rate': 0.05305417416309637, 'max_depth': 9, 'min_samples_split': 4, 'min_samples_leaf': 4, 'subsample': 0.6229732295971188, 'max_features': None}. Best is trial 1454 with value: 0.30763307678022894.
[I 2024-12-04 12:52:31,621] Trial 1941 finished with value: 0.3872900935666972 and parameters: {'n_estimators': 796, 'learning_rate': 0.04934284036973702, 'max_depth': 7, 'min_samples_split': 2, 'min_samples_leaf': 3, 'subsample': 0.660535393628321, 'max_features': None}. Best is trial 1454 with value: 0.30763307678022894.
[I 2024-12-04 12:52:36,795] Trial 1939 finished with value: 0.33974648779401867 and parameters: {'n_estimators': 1024, 'learning_rate': 0.04593787832782119, 'max_depth': 7, 'min_samples_split': 2, 'min_samples_leaf': 2, 'subsample': 0.6207722069682543, 'max_features': None}. Best is trial 1454 with value: 0.30763307678022894.
[I 2024-12-04 12:52:38,287] Trial 1950 finished with value: 0.38419291633408165 and parameters: {'n_estimators': 695, 'learning_rate': 0.07540821530251908, 'max_depth': 6, 'min_samples_split': 2, 'min_samples_leaf': 4, 'subsample': 0.6819889490049564, 'max_features': None}. Best is trial 1454 with value: 0.30763307678022894.
