[I 2024-12-04 14:50:30,377] Trial 346 finished with value: 0.5130293093116778 and parameters: {'n_estimators': 530, 'learning_rate': 0.030828479960652865, 'max_depth': 10, 'min_samples_split': 16, 'min_samples_leaf': 1, 'subsample': 0.9771140303158886, 'max_features': None}. Best is trial 167 with value: 0.47128001676423487.
[I 2024-12-04 14:50:33,225] Trial 341 finished with value: 0.6201814503090388 and parameters: {'n_estimators': 861, 'learning_rate': 0.02341673514016657, 'max_depth': 10, 'min_samples_split': 16, 'min_samples_leaf': 2, 'subsample': 0.9726746530170017, 'max_features': None}. Best is trial 167 with value: 0.47128001676423487.
[I 2024-12-04 14:50:33,677] Trial 354 finished with value: 0.6728371361448524 and parameters: {'n_estimators': 529, 'learning_rate': 0.04116065014077909, 'max_depth': 11, 'min_samples_split': 20, 'min_samples_leaf': 3, 'subsample': 0.9868170715375557, 'max_features': 'log2'}. Best is trial 167 with value: 0.47128001676423487.
[I 2024-12-04 14:50:34,306] Trial 351 finished with value: 0.48241497859145255 and parameters: {'n_estimators': 531, 'learning_rate': 0.05354053506187094, 'max_depth': 11, 'min_samples_split': 19, 'min_samples_leaf': 1, 'subsample': 0.9583842985161949, 'max_features': None}. Best is trial 167 with value: 0.47128001676423487.
[I 2024-12-04 14:50:36,480] Trial 332 finished with value: 0.6331226296291169 and parameters: {'n_estimators': 1209, 'learning_rate': 0.014388817877865409, 'max_depth': 8, 'min_samples_split': 14, 'min_samples_leaf': 2, 'subsample': 0.9895602442415707, 'max_features': None}. Best is trial 167 with value: 0.47128001676423487.
[I 2024-12-04 14:50:37,421] Trial 359 finished with value: 0.6118291346616133 and parameters: {'n_estimators': 431, 'learning_rate': 0.03403030846156161, 'max_depth': 8, 'min_samples_split': 16, 'min_samples_leaf': 3, 'subsample': 0.9670505655249855, 'max_features': None}. Best is trial 167 with value: 0.47128001676423487.
[I 2024-12-04 14:50:37,426] Trial 339 finished with value: 0.4860766748176122 and parameters: {'n_estimators': 1016, 'learning_rate': 0.025549783318202984, 'max_depth': 12, 'min_samples_split': 20, 'min_samples_leaf': 1, 'subsample': 0.9419626350734921, 'max_features': None}. Best is trial 167 with value: 0.47128001676423487.
[I 2024-12-04 14:50:38,753] Trial 367 finished with value: 0.6182302168668131 and parameters: {'n_estimators': 253, 'learning_rate': 0.030250504769294938, 'max_depth': 12, 'min_samples_split': 20, 'min_samples_leaf': 3, 'subsample': 0.806940645685887, 'max_features': 'sqrt'}. Best is trial 167 with value: 0.47128001676423487.
[I 2024-12-04 14:50:39,793] Trial 337 finished with value: 0.5142959654701516 and parameters: {'n_estimators': 1156, 'learning_rate': 0.024563156623848958, 'max_depth': 9, 'min_samples_split': 16, 'min_samples_leaf': 1, 'subsample': 0.9581567628159102, 'max_features': None}. Best is trial 167 with value: 0.47128001676423487.
[I 2024-12-04 14:50:39,842] Trial 368 finished with value: 0.6197560241490997 and parameters: {'n_estimators': 234, 'learning_rate': 0.05780337413860542, 'max_depth': 10, 'min_samples_split': 3, 'min_samples_leaf': 1, 'subsample': 0.8046473176511871, 'max_features': 'log2'}. Best is trial 167 with value: 0.47128001676423487.
[I 2024-12-04 14:50:40,028] Trial 344 finished with value: 0.49017763571660317 and parameters: {'n_estimators': 956, 'learning_rate': 0.03359685486744444, 'max_depth': 10, 'min_samples_split': 18, 'min_samples_leaf': 1, 'subsample': 0.9653266512089922, 'max_features': None}. Best is trial 167 with value: 0.47128001676423487.
[I 2024-12-04 14:50:40,491] Trial 349 finished with value: 0.6585257446437923 and parameters: {'n_estimators': 934, 'learning_rate': 0.03170080614580774, 'max_depth': 12, 'min_samples_split': 19, 'min_samples_leaf': 2, 'subsample': 0.9389678161642381, 'max_features': 'log2'}. Best is trial 167 with value: 0.47128001676423487.
[I 2024-12-04 14:50:41,126] Trial 348 finished with value: 0.7355765528953884 and parameters: {'n_estimators': 837, 'learning_rate': 0.04640047244742423, 'max_depth': 7, 'min_samples_split': 12, 'min_samples_leaf': 2, 'subsample': 0.9913495951122838, 'max_features': None}. Best is trial 167 with value: 0.47128001676423487.
[I 2024-12-04 14:50:43,061] Trial 363 finished with value: 0.4900228376744397 and parameters: {'n_estimators': 491, 'learning_rate': 0.03464741684305962, 'max_depth': 8, 'min_samples_split': 19, 'min_samples_leaf': 1, 'subsample': 0.9779300781036763, 'max_features': None}. Best is trial 167 with value: 0.47128001676423487.
[I 2024-12-04 14:50:44,809] Trial 350 finished with value: 0.6330170608343273 and parameters: {'n_estimators': 894, 'learning_rate': 0.050306976325302136, 'max_depth': 11, 'min_samples_split': 20, 'min_samples_leaf': 2, 'subsample': 0.9784640154017205, 'max_features': None}. Best is trial 167 with value: 0.47128001676423487.
[I 2024-12-04 14:50:44,899] Trial 356 finished with value: 0.4873201412986374 and parameters: {'n_estimators': 647, 'learning_rate': 0.07265683790129773, 'max_depth': 11, 'min_samples_split': 19, 'min_samples_leaf': 1, 'subsample': 0.9921380373417834, 'max_features': None}. Best is trial 167 with value: 0.47128001676423487.
[I 2024-12-04 14:50:45,534] Trial 335 finished with value: 0.49538150420840654 and parameters: {'n_estimators': 1411, 'learning_rate': 0.010503798300942334, 'max_depth': 7, 'min_samples_split': 18, 'min_samples_leaf': 1, 'subsample': 0.9749700899311704, 'max_features': None}. Best is trial 167 with value: 0.47128001676423487.
[I 2024-12-04 14:50:46,680] Trial 345 finished with value: 0.5882229178994794 and parameters: {'n_estimators': 1320, 'learning_rate': 0.013298134582055643, 'max_depth': 10, 'min_samples_split': 18, 'min_samples_leaf': 1, 'subsample': 0.9787735096090446, 'max_features': 'log2'}. Best is trial 167 with value: 0.47128001676423487.
[I 2024-12-04 14:50:47,337] Trial 340 finished with value: 0.6295451625595029 and parameters: {'n_estimators': 1253, 'learning_rate': 0.0312673720675227, 'max_depth': 12, 'min_samples_split': 16, 'min_samples_leaf': 2, 'subsample': 0.9671039900592109, 'max_features': None}. Best is trial 167 with value: 0.47128001676423487.
[I 2024-12-04 14:50:50,167] Trial 342 finished with value: 0.5989557185139088 and parameters: {'n_estimators': 1307, 'learning_rate': 0.017054629612504972, 'max_depth': 10, 'min_samples_split': 19, 'min_samples_leaf': 3, 'subsample': 0.984152249726821, 'max_features': None}. Best is trial 167 with value: 0.47128001676423487.
[I 2024-12-04 14:50:50,403] Trial 353 finished with value: 0.4913438906117849 and parameters: {'n_estimators': 942, 'learning_rate': 0.01974508217723014, 'max_depth': 9, 'min_samples_split': 17, 'min_samples_leaf': 1, 'subsample': 0.9778833555847358, 'max_features': None}. Best is trial 167 with value: 0.47128001676423487.
[I 2024-12-04 14:50:52,006] Trial 376 finished with value: 1.1844666181999237 and parameters: {'n_estimators': 221, 'learning_rate': 0.01356376468870021, 'max_depth': 4, 'min_samples_split': 19, 'min_samples_leaf': 7, 'subsample': 0.7782227349543478, 'max_features': 'log2'}. Best is trial 167 with value: 0.47128001676423487.
[I 2024-12-04 14:50:52,007] Trial 357 finished with value: 0.6057915399500783 and parameters: {'n_estimators': 885, 'learning_rate': 0.03168884037375899, 'max_depth': 8, 'min_samples_split': 17, 'min_samples_leaf': 4, 'subsample': 0.9940278995647803, 'max_features': None}. Best is trial 167 with value: 0.47128001676423487.
[I 2024-12-04 14:50:52,071] Trial 361 finished with value: 0.48509257022628816 and parameters: {'n_estimators': 778, 'learning_rate': 0.035195621226037366, 'max_depth': 11, 'min_samples_split': 19, 'min_samples_leaf': 1, 'subsample': 0.9961452522948677, 'max_features': None}. Best is trial 167 with value: 0.47128001676423487.
[I 2024-12-04 14:50:52,084] Trial 347 finished with value: 0.4949488978802204 and parameters: {'n_estimators': 1160, 'learning_rate': 0.01791433709153194, 'max_depth': 10, 'min_samples_split': 18, 'min_samples_leaf': 1, 'subsample': 0.9121849396144803, 'max_features': None}. Best is trial 167 with value: 0.47128001676423487.
[I 2024-12-04 14:50:53,122] Trial 372 finished with value: 0.6407764810075456 and parameters: {'n_estimators': 485, 'learning_rate': 0.026394184594646496, 'max_depth': 12, 'min_samples_split': 20, 'min_samples_leaf': 2, 'subsample': 0.9552160002825236, 'max_features': 'sqrt'}. Best is trial 167 with value: 0.47128001676423487.
[I 2024-12-04 14:50:54,096] Trial 362 finished with value: 0.4763827599680997 and parameters: {'n_estimators': 789, 'learning_rate': 0.06264478512675209, 'max_depth': 12, 'min_samples_split': 19, 'min_samples_leaf': 1, 'subsample': 0.9832831735927368, 'max_features': None}. Best is trial 167 with value: 0.47128001676423487.
[I 2024-12-04 14:50:54,977] Trial 352 finished with value: 0.6358736447472285 and parameters: {'n_estimators': 1305, 'learning_rate': 0.07972844837412736, 'max_depth': 9, 'min_samples_split': 3, 'min_samples_leaf': 4, 'subsample': 0.861329447929738, 'max_features': 'sqrt'}. Best is trial 167 with value: 0.47128001676423487.
[I 2024-12-04 14:50:55,863] Trial 364 finished with value: 0.5918922394610636 and parameters: {'n_estimators': 796, 'learning_rate': 0.03138170271983356, 'max_depth': 12, 'min_samples_split': 19, 'min_samples_leaf': 2, 'subsample': 0.8912329280105675, 'max_features': None}. Best is trial 343 with value: 0.46471393404590294.
[I 2024-12-04 14:50:55,898] Trial 343 finished with value: 0.46471393404590294 and parameters: {'n_estimators': 1426, 'learning_rate': 0.029766022307131858, 'max_depth': 12, 'min_samples_split': 19, 'min_samples_leaf': 1, 'subsample': 0.8759964361524608, 'max_features': None}. Best is trial 343 with value: 0.46471393404590294.
[I 2024-12-04 14:50:59,938] Trial 380 finished with value: 0.5844588254300291 and parameters: {'n_estimators': 485, 'learning_rate': 0.03430842644833575, 'max_depth': 5, 'min_samples_split': 19, 'min_samples_leaf': 3, 'subsample': 0.9667592325370709, 'max_features': None}. Best is trial 343 with value: 0.46471393404590294.
[I 2024-12-04 14:51:00,179] Trial 378 finished with value: 0.586549954466254 and parameters: {'n_estimators': 503, 'learning_rate': 0.0377811381664035, 'max_depth': 12, 'min_samples_split': 2, 'min_samples_leaf': 6, 'subsample': 0.9968685616290013, 'max_features': None}. Best is trial 343 with value: 0.46471393404590294.
[I 2024-12-04 14:51:00,562] Trial 370 finished with value: 0.5930837511642143 and parameters: {'n_estimators': 736, 'learning_rate': 0.03400763741643383, 'max_depth': 9, 'min_samples_split': 20, 'min_samples_leaf': 3, 'subsample': 0.9904405978790957, 'max_features': None}. Best is trial 343 with value: 0.46471393404590294.
[I 2024-12-04 14:51:01,655] Trial 358 finished with value: 0.5898644115670978 and parameters: {'n_estimators': 1163, 'learning_rate': 0.017088136109971907, 'max_depth': 11, 'min_samples_split': 19, 'min_samples_leaf': 2, 'subsample': 0.9936604314130012, 'max_features': None}. Best is trial 343 with value: 0.46471393404590294.
[I 2024-12-04 14:51:01,959] Trial 366 finished with value: 0.49036855137211577 and parameters: {'n_estimators': 877, 'learning_rate': 0.03064737709273674, 'max_depth': 12, 'min_samples_split': 19, 'min_samples_leaf': 1, 'subsample': 0.932899682079646, 'max_features': None}. Best is trial 343 with value: 0.46471393404590294.
[I 2024-12-04 14:51:02,778] Trial 365 finished with value: 0.7974181124941466 and parameters: {'n_estimators': 1225, 'learning_rate': 0.012257224968530014, 'max_depth': 5, 'min_samples_split': 8, 'min_samples_leaf': 9, 'subsample': 0.9458094007068835, 'max_features': 'sqrt'}. Best is trial 343 with value: 0.46471393404590294.
[I 2024-12-04 14:51:03,029] Trial 379 finished with value: 0.5052517851024869 and parameters: {'n_estimators': 508, 'learning_rate': 0.060128548882640395, 'max_depth': 10, 'min_samples_split': 20, 'min_samples_leaf': 1, 'subsample': 0.99596314691954, 'max_features': None}. Best is trial 343 with value: 0.46471393404590294.
[I 2024-12-04 14:51:04,536] Trial 355 finished with value: 0.5035314252444745 and parameters: {'n_estimators': 1281, 'learning_rate': 0.017769728274570146, 'max_depth': 9, 'min_samples_split': 19, 'min_samples_leaf': 1, 'subsample': 0.9462053661033947, 'max_features': None}. Best is trial 343 with value: 0.46471393404590294.
[I 2024-12-04 14:51:04,569] Trial 377 finished with value: 0.7991140192134999 and parameters: {'n_estimators': 708, 'learning_rate': 0.02792505329067903, 'max_depth': 12, 'min_samples_split': 8, 'min_samples_leaf': 10, 'subsample': 0.7741094898514674, 'max_features': 'sqrt'}. Best is trial 343 with value: 0.46471393404590294.
[I 2024-12-04 14:51:04,673] Trial 360 finished with value: 0.6542246167071073 and parameters: {'n_estimators': 1400, 'learning_rate': 0.017816586589821555, 'max_depth': 11, 'min_samples_split': 2, 'min_samples_leaf': 3, 'subsample': 0.9129993196828772, 'max_features': 'log2'}. Best is trial 343 with value: 0.46471393404590294.
[I 2024-12-04 14:51:04,674] Trial 369 finished with value: 0.4852544767520428 and parameters: {'n_estimators': 847, 'learning_rate': 0.06350136461741414, 'max_depth': 10, 'min_samples_split': 20, 'min_samples_leaf': 1, 'subsample': 0.9418952307751388, 'max_features': None}. Best is trial 343 with value: 0.46471393404590294.
[I 2024-12-04 14:51:08,727] Trial 383 finished with value: 0.6144343283303864 and parameters: {'n_estimators': 598, 'learning_rate': 0.049415609091853954, 'max_depth': 11, 'min_samples_split': 20, 'min_samples_leaf': 3, 'subsample': 0.9507823278366927, 'max_features': None}. Best is trial 343 with value: 0.46471393404590294.
[I 2024-12-04 14:51:09,965] Trial 386 finished with value: 0.49516918608243254 and parameters: {'n_estimators': 630, 'learning_rate': 0.03663752127376349, 'max_depth': 7, 'min_samples_split': 20, 'min_samples_leaf': 1, 'subsample': 0.9908000807494016, 'max_features': None}. Best is trial 343 with value: 0.46471393404590294.
[I 2024-12-04 14:51:10,533] Trial 394 finished with value: 0.5353996585262003 and parameters: {'n_estimators': 389, 'learning_rate': 0.08859381134592045, 'max_depth': 12, 'min_samples_split': 19, 'min_samples_leaf': 1, 'subsample': 0.9873792523419535, 'max_features': 'sqrt'}. Best is trial 343 with value: 0.46471393404590294.
[I 2024-12-04 14:51:10,571] Trial 384 finished with value: 0.6022692909072529 and parameters: {'n_estimators': 680, 'learning_rate': 0.04732090571630315, 'max_depth': 12, 'min_samples_split': 20, 'min_samples_leaf': 2, 'subsample': 0.9721110057121394, 'max_features': None}. Best is trial 343 with value: 0.46471393404590294.
[I 2024-12-04 14:51:13,175] Trial 396 finished with value: 0.554671079049296 and parameters: {'n_estimators': 507, 'learning_rate': 0.08435705266185012, 'max_depth': 11, 'min_samples_split': 18, 'min_samples_leaf': 1, 'subsample': 0.9993893902366106, 'max_features': 'sqrt'}. Best is trial 343 with value: 0.46471393404590294.
[I 2024-12-04 14:51:13,192] Trial 375 finished with value: 0.4902759102050804 and parameters: {'n_estimators': 969, 'learning_rate': 0.021964607803546633, 'max_depth': 12, 'min_samples_split': 20, 'min_samples_leaf': 1, 'subsample': 0.958158348952213, 'max_features': None}. Best is trial 343 with value: 0.46471393404590294.
[I 2024-12-04 14:51:15,396] Trial 400 finished with value: 0.716357613744609 and parameters: {'n_estimators': 390, 'learning_rate': 0.029477629407738293, 'max_depth': 3, 'min_samples_split': 4, 'min_samples_leaf': 10, 'subsample': 0.681383400735439, 'max_features': None}. Best is trial 343 with value: 0.46471393404590294.
[I 2024-12-04 14:51:18,752] Trial 397 finished with value: 0.6009560049456759 and parameters: {'n_estimators': 612, 'learning_rate': 0.05399515862036994, 'max_depth': 12, 'min_samples_split': 20, 'min_samples_leaf': 2, 'subsample': 0.9478720687160236, 'max_features': None}. Best is trial 343 with value: 0.46471393404590294.
[I 2024-12-04 14:51:18,765] Trial 374 finished with value: 0.4847396176060337 and parameters: {'n_estimators': 1208, 'learning_rate': 0.0394090846585238, 'max_depth': 12, 'min_samples_split': 18, 'min_samples_leaf': 1, 'subsample': 0.8858971809000467, 'max_features': None}. Best is trial 343 with value: 0.46471393404590294.
[I 2024-12-04 14:51:19,389] Trial 381 finished with value: 0.7177743746507438 and parameters: {'n_estimators': 1356, 'learning_rate': 0.058614429124000465, 'max_depth': 3, 'min_samples_split': 17, 'min_samples_leaf': 7, 'subsample': 0.8187583608752067, 'max_features': 'log2'}. Best is trial 343 with value: 0.46471393404590294.
[I 2024-12-04 14:51:21,252] Trial 389 finished with value: 0.5191059564691276 and parameters: {'n_estimators': 772, 'learning_rate': 0.06175626021618554, 'max_depth': 12, 'min_samples_split': 15, 'min_samples_leaf': 1, 'subsample': 0.9735073193065884, 'max_features': None}. Best is trial 343 with value: 0.46471393404590294.
[I 2024-12-04 14:51:21,740] Trial 395 finished with value: 0.522628824563728 and parameters: {'n_estimators': 739, 'learning_rate': 0.09534942476631529, 'max_depth': 9, 'min_samples_split': 15, 'min_samples_leaf': 1, 'subsample': 0.9685521723789512, 'max_features': None}. Best is trial 343 with value: 0.46471393404590294.
[I 2024-12-04 14:51:22,847] Trial 385 finished with value: 0.8712785605543806 and parameters: {'n_estimators': 1312, 'learning_rate': 0.026850609264235173, 'max_depth': 3, 'min_samples_split': 6, 'min_samples_leaf': 10, 'subsample': 0.6671871075059521, 'max_features': 'log2'}. Best is trial 343 with value: 0.46471393404590294.
[I 2024-12-04 14:51:23,425] Trial 371 finished with value: 0.527332039763786 and parameters: {'n_estimators': 1400, 'learning_rate': 0.022991189752708082, 'max_depth': 12, 'min_samples_split': 14, 'min_samples_leaf': 1, 'subsample': 0.9111940431561453, 'max_features': None}. Best is trial 343 with value: 0.46471393404590294.
[I 2024-12-04 14:51:24,207] Trial 382 finished with value: 0.6037684643358341 and parameters: {'n_estimators': 1334, 'learning_rate': 0.011462679475300412, 'max_depth': 3, 'min_samples_split': 20, 'min_samples_leaf': 6, 'subsample': 0.8528099297250218, 'max_features': None}. Best is trial 343 with value: 0.46471393404590294.
[I 2024-12-04 14:51:26,417] Trial 388 finished with value: 0.6075586585985303 and parameters: {'n_estimators': 1059, 'learning_rate': 0.029293533202557755, 'max_depth': 12, 'min_samples_split': 18, 'min_samples_leaf': 2, 'subsample': 0.9121039151111178, 'max_features': None}. Best is trial 343 with value: 0.46471393404590294.
[I 2024-12-04 14:51:26,649] Trial 387 finished with value: 0.4851438741494393 and parameters: {'n_estimators': 1063, 'learning_rate': 0.04436726419618658, 'max_depth': 11, 'min_samples_split': 17, 'min_samples_leaf': 1, 'subsample': 0.9482501276697073, 'max_features': None}. Best is trial 343 with value: 0.46471393404590294.
[I 2024-12-04 14:51:28,427] Trial 393 finished with value: 0.49910117392675196 and parameters: {'n_estimators': 882, 'learning_rate': 0.09996512203926161, 'max_depth': 12, 'min_samples_split': 18, 'min_samples_leaf': 1, 'subsample': 0.8973660095009607, 'max_features': None}. Best is trial 343 with value: 0.46471393404590294.
[I 2024-12-04 14:51:28,430] Trial 392 finished with value: 0.49703125449653107 and parameters: {'n_estimators': 958, 'learning_rate': 0.041133844094715995, 'max_depth': 12, 'min_samples_split': 20, 'min_samples_leaf': 1, 'subsample': 0.8582739176056864, 'max_features': None}. Best is trial 343 with value: 0.46471393404590294.
[I 2024-12-04 14:51:29,316] Trial 373 finished with value: 0.48142887490486547 and parameters: {'n_estimators': 1479, 'learning_rate': 0.01953038352872325, 'max_depth': 11, 'min_samples_split': 18, 'min_samples_leaf': 1, 'subsample': 0.934481044215122, 'max_features': None}. Best is trial 343 with value: 0.46471393404590294.
[I 2024-12-04 14:51:31,111] Trial 402 finished with value: 0.484361533294618 and parameters: {'n_estimators': 689, 'learning_rate': 0.06238784846665234, 'max_depth': 11, 'min_samples_split': 18, 'min_samples_leaf': 1, 'subsample': 0.9512469041488516, 'max_features': None}. Best is trial 343 with value: 0.46471393404590294.
[I 2024-12-04 14:51:31,983] Trial 423 finished with value: 0.4866541218454101 and parameters: {'n_estimators': 152, 'learning_rate': 0.03938793922785581, 'max_depth': 12, 'min_samples_split': 19, 'min_samples_leaf': 1, 'subsample': 0.9320947464048546, 'max_features': None}. Best is trial 343 with value: 0.46471393404590294.
[I 2024-12-04 14:51:32,702] Trial 412 finished with value: 0.5629621475222418 and parameters: {'n_estimators': 663, 'learning_rate': 0.08780904555812846, 'max_depth': 10, 'min_samples_split': 17, 'min_samples_leaf': 1, 'subsample': 0.9578413670056842, 'max_features': 'log2'}. Best is trial 343 with value: 0.46471393404590294.
[I 2024-12-04 14:51:34,116] Trial 390 finished with value: 0.4918322260985452 and parameters: {'n_estimators': 1171, 'learning_rate': 0.03368081010041979, 'max_depth': 11, 'min_samples_split': 20, 'min_samples_leaf': 1, 'subsample': 0.9591360147858699, 'max_features': None}. Best is trial 343 with value: 0.46471393404590294.
[I 2024-12-04 14:51:35,003] Trial 408 finished with value: 0.6305556050447937 and parameters: {'n_estimators': 722, 'learning_rate': 0.05911731473250708, 'max_depth': 12, 'min_samples_split': 16, 'min_samples_leaf': 2, 'subsample': 0.994365793191777, 'max_features': None}. Best is trial 343 with value: 0.46471393404590294.
[I 2024-12-04 14:51:35,073] Trial 406 finished with value: 0.7112637216625269 and parameters: {'n_estimators': 760, 'learning_rate': 0.012120210327052152, 'max_depth': 10, 'min_samples_split': 6, 'min_samples_leaf': 10, 'subsample': 0.8163390033233178, 'max_features': None}. Best is trial 343 with value: 0.46471393404590294.
