[I 2024-12-04 11:51:17,989] A new study created in RDB with name: Vc_dt
[I 2024-12-04 11:51:20,514] Trial 1 finished with value: 1.3014693347727373 and parameters: {'max_depth': 34, 'min_samples_split': 9, 'min_samples_leaf': 9, 'max_features': 'log2', 'criterion': 'friedman_mse', 'splitter': 'random'}. Best is trial 8 with value: 0.8872834757136301.
[I 2024-12-04 11:51:20,933] Trial 14 finished with value: 1.3007745979739842 and parameters: {'max_depth': 18, 'min_samples_split': 4, 'min_samples_leaf': 6, 'max_features': 'log2', 'criterion': 'friedman_mse', 'splitter': 'best'}. Best is trial 8 with value: 0.8872834757136301.
[I 2024-12-04 11:51:21,832] Trial 7 finished with value: 1.36280343027112 and parameters: {'max_depth': 13, 'min_samples_split': 11, 'min_samples_leaf': 4, 'max_features': 'log2', 'criterion': 'absolute_error', 'splitter': 'best'}. Best is trial 8 with value: 0.8872834757136301.
[I 2024-12-04 11:51:22,240] Trial 3 finished with value: 1.3303823508952066 and parameters: {'max_depth': 22, 'min_samples_split': 12, 'min_samples_leaf': 4, 'max_features': 'sqrt', 'criterion': 'absolute_error', 'splitter': 'random'}. Best is trial 8 with value: 0.8872834757136301.
[I 2024-12-04 11:51:22,353] Trial 8 finished with value: 0.8872834757136301 and parameters: {'max_depth': 20, 'min_samples_split': 7, 'min_samples_leaf': 5, 'max_features': 'sqrt', 'criterion': 'friedman_mse', 'splitter': 'best'}. Best is trial 8 with value: 0.8872834757136301.
[I 2024-12-04 11:51:22,992] Trial 19 finished with value: 1.3130149982826922 and parameters: {'max_depth': 2, 'min_samples_split': 13, 'min_samples_leaf': 9, 'max_features': 'sqrt', 'criterion': 'friedman_mse', 'splitter': 'random'}. Best is trial 8 with value: 0.8872834757136301.
[I 2024-12-04 11:51:23,571] Trial 16 finished with value: 1.36280343027112 and parameters: {'max_depth': 19, 'min_samples_split': 10, 'min_samples_leaf': 10, 'max_features': 'log2', 'criterion': 'absolute_error', 'splitter': 'best'}. Best is trial 8 with value: 0.8872834757136301.
[I 2024-12-04 11:51:23,839] Trial 20 finished with value: 1.2825287830398628 and parameters: {'max_depth': 23, 'min_samples_split': 14, 'min_samples_leaf': 2, 'max_features': 'log2', 'criterion': 'squared_error', 'splitter': 'random'}. Best is trial 27 with value: 0.6974869350647459.
[I 2024-12-04 11:51:24,519] Trial 27 finished with value: 0.6974869350647459 and parameters: {'max_depth': 26, 'min_samples_split': 15, 'min_samples_leaf': 1, 'max_features': 'log2', 'criterion': 'absolute_error', 'splitter': 'best'}. Best is trial 27 with value: 0.6974869350647459.
[I 2024-12-04 11:51:24,646] Trial 22 finished with value: 1.2594527375158908 and parameters: {'max_depth': 8, 'min_samples_split': 3, 'min_samples_leaf': 6, 'max_features': 'sqrt', 'criterion': 'friedman_mse', 'splitter': 'random'}. Best is trial 27 with value: 0.6974869350647459.
[I 2024-12-04 11:51:24,914] Trial 4 finished with value: 1.2825287830398628 and parameters: {'max_depth': 31, 'min_samples_split': 8, 'min_samples_leaf': 2, 'max_features': 'log2', 'criterion': 'friedman_mse', 'splitter': 'random'}. Best is trial 27 with value: 0.6974869350647459.
[I 2024-12-04 11:51:24,924] Trial 9 finished with value: 0.74539529450018 and parameters: {'max_depth': 19, 'min_samples_split': 18, 'min_samples_leaf': 3, 'max_features': 'sqrt', 'criterion': 'absolute_error', 'splitter': 'random'}. Best is trial 27 with value: 0.6974869350647459.
[I 2024-12-04 11:51:24,985] Trial 12 finished with value: 1.298283307656757 and parameters: {'max_depth': 22, 'min_samples_split': 12, 'min_samples_leaf': 4, 'max_features': 'log2', 'criterion': 'friedman_mse', 'splitter': 'random'}. Best is trial 27 with value: 0.6974869350647459.
[I 2024-12-04 11:51:25,279] Trial 29 finished with value: 1.2599065340718358 and parameters: {'max_depth': 5, 'min_samples_split': 9, 'min_samples_leaf': 4, 'max_features': 'sqrt', 'criterion': 'friedman_mse', 'splitter': 'random'}. Best is trial 27 with value: 0.6974869350647459.
[I 2024-12-04 11:51:25,348] Trial 18 finished with value: 1.3105279435582882 and parameters: {'max_depth': 14, 'min_samples_split': 3, 'min_samples_leaf': 9, 'max_features': 'sqrt', 'criterion': 'squared_error', 'splitter': 'best'}. Best is trial 27 with value: 0.6974869350647459.
[I 2024-12-04 11:51:25,349] Trial 0 finished with value: 1.3130149982826922 and parameters: {'max_depth': 32, 'min_samples_split': 20, 'min_samples_leaf': 10, 'max_features': 'sqrt', 'criterion': 'squared_error', 'splitter': 'random'}. Best is trial 27 with value: 0.6974869350647459.
[I 2024-12-04 11:51:25,417] Trial 11 finished with value: 1.298283307656757 and parameters: {'max_depth': 25, 'min_samples_split': 12, 'min_samples_leaf': 4, 'max_features': 'log2', 'criterion': 'squared_error', 'splitter': 'random'}. Best is trial 27 with value: 0.6974869350647459.
[I 2024-12-04 11:51:25,510] Trial 25 finished with value: 1.3604321503216543 and parameters: {'max_depth': 29, 'min_samples_split': 18, 'min_samples_leaf': 4, 'max_features': 'log2', 'criterion': 'absolute_error', 'splitter': 'random'}. Best is trial 27 with value: 0.6974869350647459.
[I 2024-12-04 11:51:25,766] Trial 28 finished with value: 1.3589482855309905 and parameters: {'max_depth': 15, 'min_samples_split': 7, 'min_samples_leaf': 3, 'max_features': 'log2', 'criterion': 'absolute_error', 'splitter': 'random'}. Best is trial 27 with value: 0.6974869350647459.
[I 2024-12-04 11:51:26,275] Trial 31 finished with value: 1.3105279435582882 and parameters: {'max_depth': 3, 'min_samples_split': 19, 'min_samples_leaf': 7, 'max_features': 'sqrt', 'criterion': 'squared_error', 'splitter': 'best'}. Best is trial 27 with value: 0.6974869350647459.
[I 2024-12-04 11:51:26,341] Trial 23 finished with value: 1.2998456676161818 and parameters: {'max_depth': 13, 'min_samples_split': 17, 'min_samples_leaf': 2, 'max_features': 'sqrt', 'criterion': 'absolute_error', 'splitter': 'random'}. Best is trial 27 with value: 0.6974869350647459.
[I 2024-12-04 11:51:26,835] Trial 30 finished with value: 1.3177439342035693 and parameters: {'max_depth': 3, 'min_samples_split': 13, 'min_samples_leaf': 4, 'max_features': 'sqrt', 'criterion': 'squared_error', 'splitter': 'random'}. Best is trial 27 with value: 0.6974869350647459.
[I 2024-12-04 11:51:26,962] Trial 26 finished with value: 0.8382477721889255 and parameters: {'max_depth': 29, 'min_samples_split': 10, 'min_samples_leaf': 2, 'max_features': 'sqrt', 'criterion': 'friedman_mse', 'splitter': 'random'}. Best is trial 27 with value: 0.6974869350647459.
[I 2024-12-04 11:51:27,013] Trial 10 finished with value: 0.9091836888051117 and parameters: {'max_depth': 18, 'min_samples_split': 14, 'min_samples_leaf': 2, 'max_features': 'log2', 'criterion': 'squared_error', 'splitter': 'best'}. Best is trial 27 with value: 0.6974869350647459.
[I 2024-12-04 11:51:27,276] Trial 5 finished with value: 1.3007745979739842 and parameters: {'max_depth': 18, 'min_samples_split': 10, 'min_samples_leaf': 6, 'max_features': 'log2', 'criterion': 'squared_error', 'splitter': 'best'}. Best is trial 27 with value: 0.6974869350647459.
[I 2024-12-04 11:51:27,654] Trial 13 finished with value: 0.8912381971797895 and parameters: {'max_depth': 32, 'min_samples_split': 3, 'min_samples_leaf': 4, 'max_features': 'sqrt', 'criterion': 'squared_error', 'splitter': 'best'}. Best is trial 27 with value: 0.6974869350647459.
[I 2024-12-04 11:51:27,762] Trial 24 finished with value: 0.8912381971797895 and parameters: {'max_depth': 20, 'min_samples_split': 9, 'min_samples_leaf': 4, 'max_features': 'sqrt', 'criterion': 'friedman_mse', 'splitter': 'best'}. Best is trial 15 with value: 0.6961030996390428.
[I 2024-12-04 11:51:27,999] Trial 6 finished with value: 1.3014693347727373 and parameters: {'max_depth': 31, 'min_samples_split': 15, 'min_samples_leaf': 10, 'max_features': 'log2', 'criterion': 'squared_error', 'splitter': 'random'}. Best is trial 15 with value: 0.6961030996390428.
[I 2024-12-04 11:51:28,289] Trial 17 finished with value: 0.7425710514568459 and parameters: {'max_depth': 5, 'min_samples_split': 8, 'min_samples_leaf': 3, 'max_features': 'log2', 'criterion': 'friedman_mse', 'splitter': 'best'}. Best is trial 15 with value: 0.6961030996390428.
[I 2024-12-04 11:51:28,488] Trial 21 finished with value: 1.3298796816472964 and parameters: {'max_depth': 8, 'min_samples_split': 15, 'min_samples_leaf': 7, 'max_features': 'sqrt', 'criterion': 'absolute_error', 'splitter': 'best'}. Best is trial 15 with value: 0.6961030996390428.
[I 2024-12-04 11:51:28,497] Trial 15 finished with value: 0.6961030996390428 and parameters: {'max_depth': 28, 'min_samples_split': 16, 'min_samples_leaf': 1, 'max_features': 'log2', 'criterion': 'absolute_error', 'splitter': 'best'}. Best is trial 15 with value: 0.6961030996390428.
[I 2024-12-04 11:51:28,510] Trial 2 finished with value: 1.114121958823475 and parameters: {'max_depth': 35, 'min_samples_split': 13, 'min_samples_leaf': 2, 'max_features': 'sqrt', 'criterion': 'absolute_error', 'splitter': 'best'}. Best is trial 15 with value: 0.6961030996390428.
[I 2024-12-04 11:51:30,920] Trial 38 finished with value: 0.8784264443084727 and parameters: {'max_depth': 28, 'min_samples_split': 14, 'min_samples_leaf': 1, 'max_features': 'log2', 'criterion': 'friedman_mse', 'splitter': 'best'}. Best is trial 36 with value: 0.6404962250438521.
[I 2024-12-04 11:51:30,923] Trial 33 finished with value: 1.2689568155403492 and parameters: {'max_depth': 26, 'min_samples_split': 16, 'min_samples_leaf': 1, 'max_features': 'sqrt', 'criterion': 'friedman_mse', 'splitter': 'random'}. Best is trial 36 with value: 0.6404962250438521.
[I 2024-12-04 11:51:31,356] Trial 36 finished with value: 0.6404962250438521 and parameters: {'max_depth': 28, 'min_samples_split': 11, 'min_samples_leaf': 1, 'max_features': 'log2', 'criterion': 'absolute_error', 'splitter': 'best'}. Best is trial 36 with value: 0.6404962250438521.
[I 2024-12-04 11:51:31,366] Trial 32 finished with value: 0.9917256650424148 and parameters: {'max_depth': 27, 'min_samples_split': 19, 'min_samples_leaf': 2, 'max_features': 'log2', 'criterion': 'absolute_error', 'splitter': 'best'}. Best is trial 36 with value: 0.6404962250438521.
[I 2024-12-04 11:51:31,660] Trial 34 finished with value: 0.9277755480346891 and parameters: {'max_depth': 4, 'min_samples_split': 4, 'min_samples_leaf': 3, 'max_features': 'log2', 'criterion': 'friedman_mse', 'splitter': 'best'}. Best is trial 36 with value: 0.6404962250438521.
[I 2024-12-04 11:51:31,664] Trial 35 finished with value: 0.6974869350647459 and parameters: {'max_depth': 26, 'min_samples_split': 15, 'min_samples_leaf': 1, 'max_features': 'log2', 'criterion': 'absolute_error', 'splitter': 'best'}. Best is trial 36 with value: 0.6404962250438521.
[I 2024-12-04 11:51:31,886] Trial 37 finished with value: 0.8788495399380377 and parameters: {'max_depth': 21, 'min_samples_split': 15, 'min_samples_leaf': 3, 'max_features': 'sqrt', 'criterion': 'absolute_error', 'splitter': 'best'}. Best is trial 36 with value: 0.6404962250438521.
[I 2024-12-04 11:51:31,981] Trial 39 finished with value: 1.3007745979739842 and parameters: {'max_depth': 10, 'min_samples_split': 12, 'min_samples_leaf': 4, 'max_features': 'log2', 'criterion': 'friedman_mse', 'splitter': 'best'}. Best is trial 36 with value: 0.6404962250438521.
[I 2024-12-04 11:51:32,008] Trial 42 finished with value: 0.6710799294294387 and parameters: {'max_depth': 32, 'min_samples_split': 13, 'min_samples_leaf': 1, 'max_features': 'log2', 'criterion': 'absolute_error', 'splitter': 'best'}. Best is trial 36 with value: 0.6404962250438521.
[I 2024-12-04 11:51:34,176] Trial 47 finished with value: 0.678262511222372 and parameters: {'max_depth': 19, 'min_samples_split': 13, 'min_samples_leaf': 1, 'max_features': 'log2', 'criterion': 'absolute_error', 'splitter': 'best'}. Best is trial 36 with value: 0.6404962250438521.
[I 2024-12-04 11:51:34,341] Trial 50 finished with value: 1.3203941421312428 and parameters: {'max_depth': 32, 'min_samples_split': 12, 'min_samples_leaf': 1, 'max_features': 'log2', 'criterion': 'absolute_error', 'splitter': 'random'}. Best is trial 36 with value: 0.6404962250438521.
[I 2024-12-04 11:51:34,639] Trial 44 finished with value: 1.36280343027112 and parameters: {'max_depth': 27, 'min_samples_split': 10, 'min_samples_leaf': 4, 'max_features': 'log2', 'criterion': 'absolute_error', 'splitter': 'best'}. Best is trial 36 with value: 0.6404962250438521.
[I 2024-12-04 11:51:35,588] Trial 43 finished with value: 0.9917256650424148 and parameters: {'max_depth': 26, 'min_samples_split': 14, 'min_samples_leaf': 2, 'max_features': 'log2', 'criterion': 'absolute_error', 'splitter': 'best'}. Best is trial 53 with value: 0.6149901809318068.
[I 2024-12-04 11:51:36,247] Trial 51 finished with value: 0.6698784368279321 and parameters: {'max_depth': 35, 'min_samples_split': 16, 'min_samples_leaf': 1, 'max_features': 'log2', 'criterion': 'absolute_error', 'splitter': 'best'}. Best is trial 53 with value: 0.6149901809318068.
[I 2024-12-04 11:51:36,919] Trial 53 finished with value: 0.6149901809318068 and parameters: {'max_depth': 20, 'min_samples_split': 10, 'min_samples_leaf': 1, 'max_features': 'log2', 'criterion': 'absolute_error', 'splitter': 'best'}. Best is trial 53 with value: 0.6149901809318068.
[I 2024-12-04 11:51:36,992] Trial 41 finished with value: 0.8600635023250038 and parameters: {'max_depth': 32, 'min_samples_split': 11, 'min_samples_leaf': 1, 'max_features': 'log2', 'criterion': 'absolute_error', 'splitter': 'best'}. Best is trial 53 with value: 0.6149901809318068.
[I 2024-12-04 11:51:37,137] Trial 60 finished with value: 1.0197880190179527 and parameters: {'max_depth': 11, 'min_samples_split': 15, 'min_samples_leaf': 1, 'max_features': 'log2', 'criterion': 'absolute_error', 'splitter': 'best'}. Best is trial 53 with value: 0.6149901809318068.
[I 2024-12-04 11:51:37,279] Trial 56 finished with value: 0.9722997294792806 and parameters: {'max_depth': 19, 'min_samples_split': 15, 'min_samples_leaf': 1, 'max_features': 'log2', 'criterion': 'absolute_error', 'splitter': 'best'}. Best is trial 53 with value: 0.6149901809318068.
[I 2024-12-04 11:51:38,406] Trial 40 finished with value: 0.6818858402709942 and parameters: {'max_depth': 23, 'min_samples_split': 9, 'min_samples_leaf': 1, 'max_features': 'log2', 'criterion': 'squared_error', 'splitter': 'best'}. Best is trial 53 with value: 0.6149901809318068.
[I 2024-12-04 11:51:38,521] Trial 62 finished with value: 0.9411786888208623 and parameters: {'max_depth': 34, 'min_samples_split': 13, 'min_samples_leaf': 1, 'max_features': 'log2', 'criterion': 'absolute_error', 'splitter': 'best'}. Best is trial 53 with value: 0.6149901809318068.
[I 2024-12-04 11:51:39,511] Trial 48 finished with value: 0.9131543513168395 and parameters: {'max_depth': 21, 'min_samples_split': 9, 'min_samples_leaf': 3, 'max_features': 'log2', 'criterion': 'squared_error', 'splitter': 'best'}. Best is trial 53 with value: 0.6149901809318068.
[I 2024-12-04 11:51:39,545] Trial 49 finished with value: 0.6771140537288562 and parameters: {'max_depth': 27, 'min_samples_split': 6, 'min_samples_leaf': 1, 'max_features': 'log2', 'criterion': 'squared_error', 'splitter': 'best'}. Best is trial 53 with value: 0.6149901809318068.
[I 2024-12-04 11:51:39,633] Trial 61 finished with value: 0.697700207511673 and parameters: {'max_depth': 18, 'min_samples_split': 7, 'min_samples_leaf': 1, 'max_features': 'log2', 'criterion': 'absolute_error', 'splitter': 'best'}. Best is trial 53 with value: 0.6149901809318068.
[I 2024-12-04 11:51:39,784] Trial 54 finished with value: 0.6411182054685817 and parameters: {'max_depth': 19, 'min_samples_split': 10, 'min_samples_leaf': 1, 'max_features': 'log2', 'criterion': 'friedman_mse', 'splitter': 'best'}. Best is trial 53 with value: 0.6149901809318068.
[I 2024-12-04 11:51:39,826] Trial 58 finished with value: 1.111334160830707 and parameters: {'max_depth': 21, 'min_samples_split': 11, 'min_samples_leaf': 1, 'max_features': 'sqrt', 'criterion': 'absolute_error', 'splitter': 'best'}. Best is trial 53 with value: 0.6149901809318068.
[I 2024-12-04 11:51:39,957] Trial 59 finished with value: 1.1391149058658985 and parameters: {'max_depth': 32, 'min_samples_split': 18, 'min_samples_leaf': 1, 'max_features': 'sqrt', 'criterion': 'absolute_error', 'splitter': 'best'}. Best is trial 53 with value: 0.6149901809318068.
[I 2024-12-04 11:51:40,321] Trial 45 finished with value: 0.9379389609791097 and parameters: {'max_depth': 19, 'min_samples_split': 6, 'min_samples_leaf': 2, 'max_features': 'log2', 'criterion': 'squared_error', 'splitter': 'best'}. Best is trial 53 with value: 0.6149901809318068.
[I 2024-12-04 11:51:40,601] Trial 67 finished with value: 1.1081473547701821 and parameters: {'max_depth': 22, 'min_samples_split': 9, 'min_samples_leaf': 2, 'max_features': 'sqrt', 'criterion': 'squared_error', 'splitter': 'best'}. Best is trial 53 with value: 0.6149901809318068.
[I 2024-12-04 11:51:40,651] Trial 57 finished with value: 0.9091836888051117 and parameters: {'max_depth': 33, 'min_samples_split': 12, 'min_samples_leaf': 2, 'max_features': 'log2', 'criterion': 'squared_error', 'splitter': 'best'}. Best is trial 53 with value: 0.6149901809318068.
[I 2024-12-04 11:51:41,198] Trial 52 finished with value: 0.6817381330540195 and parameters: {'max_depth': 13, 'min_samples_split': 15, 'min_samples_leaf': 1, 'max_features': 'sqrt', 'criterion': 'squared_error', 'splitter': 'best'}. Best is trial 69 with value: 0.5889436172244497.
[I 2024-12-04 11:51:41,342] Trial 63 finished with value: 0.664925135121458 and parameters: {'max_depth': 33, 'min_samples_split': 6, 'min_samples_leaf': 1, 'max_features': 'log2', 'criterion': 'squared_error', 'splitter': 'best'}. Best is trial 69 with value: 0.5889436172244497.
[I 2024-12-04 11:51:41,640] Trial 69 finished with value: 0.5889436172244497 and parameters: {'max_depth': 27, 'min_samples_split': 2, 'min_samples_leaf': 1, 'max_features': 'log2', 'criterion': 'squared_error', 'splitter': 'best'}. Best is trial 69 with value: 0.5889436172244497.
[I 2024-12-04 11:51:43,138] Trial 71 finished with value: 0.601812258417148 and parameters: {'max_depth': 17, 'min_samples_split': 3, 'min_samples_leaf': 1, 'max_features': 'log2', 'criterion': 'friedman_mse', 'splitter': 'best'}. Best is trial 69 with value: 0.5889436172244497.
[I 2024-12-04 11:51:43,192] Trial 70 finished with value: 0.6972993796452206 and parameters: {'max_depth': 22, 'min_samples_split': 10, 'min_samples_leaf': 1, 'max_features': 'log2', 'criterion': 'absolute_error', 'splitter': 'best'}. Best is trial 69 with value: 0.5889436172244497.
[I 2024-12-04 11:51:43,200] Trial 66 finished with value: 0.9159892033176296 and parameters: {'max_depth': 35, 'min_samples_split': 17, 'min_samples_leaf': 1, 'max_features': 'log2', 'criterion': 'absolute_error', 'splitter': 'best'}. Best is trial 69 with value: 0.5889436172244497.
[I 2024-12-04 11:51:43,446] Trial 64 finished with value: 1.298283307656757 and parameters: {'max_depth': 4, 'min_samples_split': 19, 'min_samples_leaf': 6, 'max_features': 'log2', 'criterion': 'friedman_mse', 'splitter': 'random'}. Best is trial 69 with value: 0.5889436172244497.
[I 2024-12-04 11:51:43,654] Trial 65 finished with value: 0.6406976299609266 and parameters: {'max_depth': 19, 'min_samples_split': 11, 'min_samples_leaf': 1, 'max_features': 'log2', 'criterion': 'friedman_mse', 'splitter': 'best'}. Best is trial 69 with value: 0.5889436172244497.
[I 2024-12-04 11:51:43,759] Trial 46 finished with value: 0.6291709037972518 and parameters: {'max_depth': 20, 'min_samples_split': 3, 'min_samples_leaf': 1, 'max_features': 'log2', 'criterion': 'friedman_mse', 'splitter': 'best'}. Best is trial 72 with value: 0.5750297489827128.
[I 2024-12-04 11:51:44,171] Trial 68 finished with value: 0.6698784368279321 and parameters: {'max_depth': 35, 'min_samples_split': 15, 'min_samples_leaf': 1, 'max_features': 'log2', 'criterion': 'absolute_error', 'splitter': 'best'}. Best is trial 72 with value: 0.5750297489827128.
[I 2024-12-04 11:51:44,438] Trial 73 finished with value: 0.6070688658470655 and parameters: {'max_depth': 14, 'min_samples_split': 2, 'min_samples_leaf': 1, 'max_features': 'log2', 'criterion': 'friedman_mse', 'splitter': 'best'}. Best is trial 72 with value: 0.5750297489827128.
[I 2024-12-04 11:51:45,577] Trial 55 finished with value: 1.3210544926733645 and parameters: {'max_depth': 14, 'min_samples_split': 13, 'min_samples_leaf': 1, 'max_features': 'log2', 'criterion': 'absolute_error', 'splitter': 'random'}. Best is trial 72 with value: 0.5750297489827128.
[I 2024-12-04 11:51:45,819] Trial 72 finished with value: 0.5750297489827128 and parameters: {'max_depth': 26, 'min_samples_split': 2, 'min_samples_leaf': 1, 'max_features': 'log2', 'criterion': 'squared_error', 'splitter': 'best'}. Best is trial 72 with value: 0.5750297489827128.
[I 2024-12-04 11:51:45,956] Trial 83 finished with value: 0.924799806170231 and parameters: {'max_depth': 29, 'min_samples_split': 2, 'min_samples_leaf': 3, 'max_features': 'log2', 'criterion': 'friedman_mse', 'splitter': 'best'}. Best is trial 72 with value: 0.5750297489827128.
[I 2024-12-04 11:51:46,157] Trial 84 finished with value: 0.8597742107803458 and parameters: {'max_depth': 18, 'min_samples_split': 13, 'min_samples_leaf': 1, 'max_features': 'log2', 'criterion': 'friedman_mse', 'splitter': 'best'}. Best is trial 72 with value: 0.5750297489827128.
[I 2024-12-04 11:51:46,352] Trial 76 finished with value: 0.6327182423606923 and parameters: {'max_depth': 17, 'min_samples_split': 4, 'min_samples_leaf': 1, 'max_features': 'log2', 'criterion': 'friedman_mse', 'splitter': 'best'}. Best is trial 72 with value: 0.5750297489827128.
