[I 2024-12-04 15:05:33,113] Trial 1132 finished with value: 0.6274789028043712 and parameters: {'n_estimators': 1405, 'learning_rate': 0.03933074700933946, 'max_depth': 12, 'min_samples_split': 19, 'min_samples_leaf': 4, 'subsample': 0.9077937916922265, 'max_features': None}. Best is trial 603 with value: 0.45955205541891275.
[I 2024-12-04 15:05:33,301] Trial 1149 finished with value: 0.6539010143195022 and parameters: {'n_estimators': 859, 'learning_rate': 0.06396180085866247, 'max_depth': 12, 'min_samples_split': 15, 'min_samples_leaf': 3, 'subsample': 0.9051674910710561, 'max_features': None}. Best is trial 603 with value: 0.45955205541891275.
[I 2024-12-04 15:05:33,954] Trial 1142 finished with value: 0.6294810659578935 and parameters: {'n_estimators': 1317, 'learning_rate': 0.04489698928273836, 'max_depth': 3, 'min_samples_split': 17, 'min_samples_leaf': 4, 'subsample': 0.9158719283688909, 'max_features': 'log2'}. Best is trial 603 with value: 0.45955205541891275.
[I 2024-12-04 15:05:33,966] Trial 1129 finished with value: 0.4786418781925793 and parameters: {'n_estimators': 1492, 'learning_rate': 0.08116285341278151, 'max_depth': 10, 'min_samples_split': 20, 'min_samples_leaf': 1, 'subsample': 0.9736204790279434, 'max_features': None}. Best is trial 603 with value: 0.45955205541891275.
[I 2024-12-04 15:05:35,729] Trial 1161 finished with value: 0.6536397927103421 and parameters: {'n_estimators': 536, 'learning_rate': 0.09588665790879752, 'max_depth': 12, 'min_samples_split': 14, 'min_samples_leaf': 2, 'subsample': 0.9475588818604621, 'max_features': None}. Best is trial 603 with value: 0.45955205541891275.
[I 2024-12-04 15:05:36,213] Trial 1131 finished with value: 0.6326373119099575 and parameters: {'n_estimators': 1456, 'learning_rate': 0.03295443820563106, 'max_depth': 12, 'min_samples_split': 18, 'min_samples_leaf': 3, 'subsample': 0.9298266672163299, 'max_features': None}. Best is trial 603 with value: 0.45955205541891275.
[I 2024-12-04 15:05:36,450] Trial 1159 finished with value: 0.6333829306734554 and parameters: {'n_estimators': 807, 'learning_rate': 0.02731611030909135, 'max_depth': 9, 'min_samples_split': 12, 'min_samples_leaf': 2, 'subsample': 0.7575550421279766, 'max_features': 'log2'}. Best is trial 603 with value: 0.45955205541891275.
[I 2024-12-04 15:05:36,577] Trial 1138 finished with value: 0.4717010255632871 and parameters: {'n_estimators': 1237, 'learning_rate': 0.05463862115975446, 'max_depth': 11, 'min_samples_split': 20, 'min_samples_leaf': 1, 'subsample': 0.8841302127920136, 'max_features': None}. Best is trial 603 with value: 0.45955205541891275.
[I 2024-12-04 15:05:36,808] Trial 1154 finished with value: 0.6287898903268785 and parameters: {'n_estimators': 808, 'learning_rate': 0.09570212784513787, 'max_depth': 10, 'min_samples_split': 20, 'min_samples_leaf': 3, 'subsample': 0.978005084849773, 'max_features': None}. Best is trial 603 with value: 0.45955205541891275.
[I 2024-12-04 15:05:38,368] Trial 1140 finished with value: 0.5004281205510868 and parameters: {'n_estimators': 1183, 'learning_rate': 0.0588433749640275, 'max_depth': 12, 'min_samples_split': 15, 'min_samples_leaf': 1, 'subsample': 0.9957222406341852, 'max_features': None}. Best is trial 603 with value: 0.45955205541891275.
[I 2024-12-04 15:05:39,308] Trial 1133 finished with value: 0.47066535539470833 and parameters: {'n_estimators': 1455, 'learning_rate': 0.06764044286097688, 'max_depth': 12, 'min_samples_split': 18, 'min_samples_leaf': 1, 'subsample': 0.9934141792858272, 'max_features': None}. Best is trial 603 with value: 0.45955205541891275.
[I 2024-12-04 15:05:39,648] Trial 1164 finished with value: 0.8167161654849846 and parameters: {'n_estimators': 731, 'learning_rate': 0.017484827656308644, 'max_depth': 8, 'min_samples_split': 17, 'min_samples_leaf': 3, 'subsample': 0.9938696801209588, 'max_features': 'log2'}. Best is trial 603 with value: 0.45955205541891275.
[I 2024-12-04 15:05:41,090] Trial 1172 finished with value: 1.2045232321750097 and parameters: {'n_estimators': 107, 'learning_rate': 0.020414401084451052, 'max_depth': 4, 'min_samples_split': 19, 'min_samples_leaf': 6, 'subsample': 0.9324328980572518, 'max_features': 'log2'}. Best is trial 603 with value: 0.45955205541891275.
[I 2024-12-04 15:05:41,907] Trial 1160 finished with value: 0.6199629548934289 and parameters: {'n_estimators': 767, 'learning_rate': 0.05846737368503752, 'max_depth': 11, 'min_samples_split': 20, 'min_samples_leaf': 3, 'subsample': 0.999341046286869, 'max_features': None}. Best is trial 603 with value: 0.45955205541891275.
[I 2024-12-04 15:05:41,944] Trial 1139 finished with value: 0.6143595505668251 and parameters: {'n_estimators': 1342, 'learning_rate': 0.042528941337257035, 'max_depth': 10, 'min_samples_split': 20, 'min_samples_leaf': 4, 'subsample': 0.9979871362120565, 'max_features': None}. Best is trial 603 with value: 0.45955205541891275.
[I 2024-12-04 15:05:44,955] Trial 1146 finished with value: 0.4998108349662608 and parameters: {'n_estimators': 1188, 'learning_rate': 0.07937459697959716, 'max_depth': 12, 'min_samples_split': 18, 'min_samples_leaf': 1, 'subsample': 0.9210252695576943, 'max_features': None}. Best is trial 603 with value: 0.45955205541891275.
[I 2024-12-04 15:05:45,884] Trial 1152 finished with value: 0.5075944267923463 and parameters: {'n_estimators': 1142, 'learning_rate': 0.04996476127568979, 'max_depth': 10, 'min_samples_split': 17, 'min_samples_leaf': 1, 'subsample': 0.99358549409813, 'max_features': None}. Best is trial 603 with value: 0.45955205541891275.
[I 2024-12-04 15:05:46,054] Trial 1151 finished with value: 0.4842628721207156 and parameters: {'n_estimators': 1138, 'learning_rate': 0.06377105330168684, 'max_depth': 12, 'min_samples_split': 19, 'min_samples_leaf': 1, 'subsample': 0.9069134096598762, 'max_features': None}. Best is trial 603 with value: 0.45955205541891275.
[I 2024-12-04 15:05:46,073] Trial 1156 finished with value: 0.48096572338740745 and parameters: {'n_estimators': 1012, 'learning_rate': 0.04695154922947478, 'max_depth': 12, 'min_samples_split': 20, 'min_samples_leaf': 1, 'subsample': 0.9798073561867151, 'max_features': None}. Best is trial 603 with value: 0.45955205541891275.
[I 2024-12-04 15:05:46,185] Trial 1155 finished with value: 0.5076811487405863 and parameters: {'n_estimators': 938, 'learning_rate': 0.05860343167735341, 'max_depth': 12, 'min_samples_split': 16, 'min_samples_leaf': 1, 'subsample': 0.9978201487280802, 'max_features': None}. Best is trial 603 with value: 0.45955205541891275.
[I 2024-12-04 15:05:47,263] Trial 1165 finished with value: 0.4768876303845012 and parameters: {'n_estimators': 753, 'learning_rate': 0.09595436389330951, 'max_depth': 12, 'min_samples_split': 17, 'min_samples_leaf': 1, 'subsample': 0.9286636011764438, 'max_features': None}. Best is trial 603 with value: 0.45955205541891275.
[I 2024-12-04 15:05:50,216] Trial 1170 finished with value: 0.48494392863232816 and parameters: {'n_estimators': 431, 'learning_rate': 0.07383531295985216, 'max_depth': 12, 'min_samples_split': 20, 'min_samples_leaf': 1, 'subsample': 0.9962528677416168, 'max_features': None}. Best is trial 603 with value: 0.45955205541891275.
[I 2024-12-04 15:05:51,130] Trial 1171 finished with value: 0.9194638423158112 and parameters: {'n_estimators': 574, 'learning_rate': 0.011393571012979999, 'max_depth': 10, 'min_samples_split': 9, 'min_samples_leaf': 9, 'subsample': 0.77544785292858, 'max_features': 'sqrt'}. Best is trial 603 with value: 0.45955205541891275.
[I 2024-12-04 15:05:51,349] Trial 1144 finished with value: 0.5034111614507473 and parameters: {'n_estimators': 1492, 'learning_rate': 0.08421839525863484, 'max_depth': 11, 'min_samples_split': 19, 'min_samples_leaf': 1, 'subsample': 0.9012903186954802, 'max_features': None}. Best is trial 603 with value: 0.45955205541891275.
[I 2024-12-04 15:05:53,829] Trial 1162 finished with value: 0.5595338928037124 and parameters: {'n_estimators': 1343, 'learning_rate': 0.025510396589604568, 'max_depth': 8, 'min_samples_split': 15, 'min_samples_leaf': 1, 'subsample': 0.6464261536039957, 'max_features': 'sqrt'}. Best is trial 603 with value: 0.45955205541891275.
[I 2024-12-04 15:05:53,840] Trial 1150 finished with value: 0.4729378576776467 and parameters: {'n_estimators': 1374, 'learning_rate': 0.0875289932738219, 'max_depth': 12, 'min_samples_split': 19, 'min_samples_leaf': 1, 'subsample': 0.9981772359029571, 'max_features': None}. Best is trial 603 with value: 0.45955205541891275.
[I 2024-12-04 15:05:54,797] Trial 1174 finished with value: 0.7531739007542213 and parameters: {'n_estimators': 554, 'learning_rate': 0.08894177091111592, 'max_depth': 11, 'min_samples_split': 4, 'min_samples_leaf': 6, 'subsample': 0.6277535902063826, 'max_features': 'log2'}. Best is trial 603 with value: 0.45955205541891275.
[I 2024-12-04 15:05:55,422] Trial 1176 finished with value: 0.6348800744088702 and parameters: {'n_estimators': 522, 'learning_rate': 0.011890685297306693, 'max_depth': 12, 'min_samples_split': 19, 'min_samples_leaf': 3, 'subsample': 0.6870223342723412, 'max_features': 'sqrt'}. Best is trial 603 with value: 0.45955205541891275.
[I 2024-12-04 15:05:57,048] Trial 1153 finished with value: 0.6515447829470717 and parameters: {'n_estimators': 1479, 'learning_rate': 0.0398817835200408, 'max_depth': 10, 'min_samples_split': 16, 'min_samples_leaf': 2, 'subsample': 0.8971066583698746, 'max_features': None}. Best is trial 603 with value: 0.45955205541891275.
[I 2024-12-04 15:05:58,859] Trial 1163 finished with value: 0.608023394024307 and parameters: {'n_estimators': 1208, 'learning_rate': 0.05872435206998865, 'max_depth': 12, 'min_samples_split': 20, 'min_samples_leaf': 2, 'subsample': 0.9906429881331673, 'max_features': None}. Best is trial 603 with value: 0.45955205541891275.
[I 2024-12-04 15:06:00,330] Trial 1183 finished with value: 0.7132106382267264 and parameters: {'n_estimators': 553, 'learning_rate': 0.06126505753718099, 'max_depth': 8, 'min_samples_split': 11, 'min_samples_leaf': 5, 'subsample': 0.9875333434334802, 'max_features': 'log2'}. Best is trial 603 with value: 0.45955205541891275.
[I 2024-12-04 15:06:01,457] Trial 1158 finished with value: 0.4655541881939565 and parameters: {'n_estimators': 1373, 'learning_rate': 0.05122225248262875, 'max_depth': 12, 'min_samples_split': 19, 'min_samples_leaf': 1, 'subsample': 0.9925981360782311, 'max_features': None}. Best is trial 603 with value: 0.45955205541891275.
[I 2024-12-04 15:06:03,373] Trial 1193 finished with value: 1.065467964379564 and parameters: {'n_estimators': 336, 'learning_rate': 0.02756634681377157, 'max_depth': 10, 'min_samples_split': 20, 'min_samples_leaf': 6, 'subsample': 0.799813075901438, 'max_features': 'log2'}. Best is trial 603 with value: 0.45955205541891275.
[I 2024-12-04 15:06:06,964] Trial 1167 finished with value: 0.6699440486385781 and parameters: {'n_estimators': 1102, 'learning_rate': 0.08479653054640611, 'max_depth': 12, 'min_samples_split': 18, 'min_samples_leaf': 3, 'subsample': 0.920700842894209, 'max_features': None}. Best is trial 603 with value: 0.45955205541891275.
[I 2024-12-04 15:06:07,373] Trial 1169 finished with value: 0.4780904535585625 and parameters: {'n_estimators': 1002, 'learning_rate': 0.06488778674739208, 'max_depth': 12, 'min_samples_split': 20, 'min_samples_leaf': 1, 'subsample': 0.994665557547699, 'max_features': None}. Best is trial 603 with value: 0.45955205541891275.
[I 2024-12-04 15:06:11,525] Trial 1175 finished with value: 0.5700240415158774 and parameters: {'n_estimators': 1282, 'learning_rate': 0.09820404347712601, 'max_depth': 12, 'min_samples_split': 19, 'min_samples_leaf': 1, 'subsample': 0.9885422214354919, 'max_features': 'log2'}. Best is trial 603 with value: 0.45955205541891275.
[I 2024-12-04 15:06:12,540] Trial 1179 finished with value: 0.4744261922123525 and parameters: {'n_estimators': 905, 'learning_rate': 0.07748441730067616, 'max_depth': 12, 'min_samples_split': 20, 'min_samples_leaf': 1, 'subsample': 0.9925270690306542, 'max_features': None}. Best is trial 603 with value: 0.45955205541891275.
[I 2024-12-04 15:06:13,022] Trial 1205 finished with value: 0.7791762896731862 and parameters: {'n_estimators': 175, 'learning_rate': 0.0889991297861312, 'max_depth': 7, 'min_samples_split': 9, 'min_samples_leaf': 5, 'subsample': 0.787960926025271, 'max_features': 'log2'}. Best is trial 603 with value: 0.45955205541891275.
[I 2024-12-04 15:06:14,985] Trial 1166 finished with value: 0.5018961499045879 and parameters: {'n_estimators': 1462, 'learning_rate': 0.03715203371788594, 'max_depth': 10, 'min_samples_split': 20, 'min_samples_leaf': 1, 'subsample': 0.9678454248755138, 'max_features': None}. Best is trial 603 with value: 0.45955205541891275.
[I 2024-12-04 15:06:15,693] Trial 1200 finished with value: 0.6027046113456537 and parameters: {'n_estimators': 524, 'learning_rate': 0.05822551679107112, 'max_depth': 12, 'min_samples_split': 16, 'min_samples_leaf': 2, 'subsample': 0.9903981386663275, 'max_features': None}. Best is trial 603 with value: 0.45955205541891275.
[I 2024-12-04 15:06:16,628] Trial 1168 finished with value: 0.6564943914076875 and parameters: {'n_estimators': 1335, 'learning_rate': 0.06727853864928353, 'max_depth': 12, 'min_samples_split': 20, 'min_samples_leaf': 3, 'subsample': 0.9219408652602225, 'max_features': None}. Best is trial 603 with value: 0.45955205541891275.
[I 2024-12-04 15:06:16,832] Trial 1197 finished with value: 0.5781684284096277 and parameters: {'n_estimators': 662, 'learning_rate': 0.010837276487650576, 'max_depth': 9, 'min_samples_split': 11, 'min_samples_leaf': 6, 'subsample': 0.8036296829860861, 'max_features': None}. Best is trial 603 with value: 0.45955205541891275.
[I 2024-12-04 15:06:17,191] Trial 1182 finished with value: 0.49964800721797226 and parameters: {'n_estimators': 1011, 'learning_rate': 0.08577941872968366, 'max_depth': 10, 'min_samples_split': 20, 'min_samples_leaf': 1, 'subsample': 0.9217130094274015, 'max_features': None}. Best is trial 603 with value: 0.45955205541891275.
[I 2024-12-04 15:06:17,349] Trial 1198 finished with value: 0.5224601669945145 and parameters: {'n_estimators': 607, 'learning_rate': 0.0726138322859135, 'max_depth': 10, 'min_samples_split': 16, 'min_samples_leaf': 1, 'subsample': 0.9662910469455314, 'max_features': None}. Best is trial 603 with value: 0.45955205541891275.
[I 2024-12-04 15:06:21,656] Trial 1181 finished with value: 0.5112986685215812 and parameters: {'n_estimators': 1060, 'learning_rate': 0.0699853944768396, 'max_depth': 12, 'min_samples_split': 15, 'min_samples_leaf': 1, 'subsample': 0.9991942511946424, 'max_features': None}. Best is trial 603 with value: 0.45955205541891275.
[I 2024-12-04 15:06:21,967] Trial 1190 finished with value: 0.6246018040246886 and parameters: {'n_estimators': 907, 'learning_rate': 0.04480854625203183, 'max_depth': 12, 'min_samples_split': 17, 'min_samples_leaf': 3, 'subsample': 0.9658776671648154, 'max_features': None}. Best is trial 603 with value: 0.45955205541891275.
[I 2024-12-04 15:06:22,291] Trial 1199 finished with value: 0.7691922116673264 and parameters: {'n_estimators': 935, 'learning_rate': 0.01372643964016303, 'max_depth': 12, 'min_samples_split': 9, 'min_samples_leaf': 3, 'subsample': 0.9397742813645895, 'max_features': 'log2'}. Best is trial 603 with value: 0.45955205541891275.
[I 2024-12-04 15:06:22,975] Trial 1206 finished with value: 1.087478242082941 and parameters: {'n_estimators': 502, 'learning_rate': 0.03294433953830471, 'max_depth': 10, 'min_samples_split': 8, 'min_samples_leaf': 10, 'subsample': 0.6603772475172721, 'max_features': 'log2'}. Best is trial 603 with value: 0.45955205541891275.
[I 2024-12-04 15:06:23,287] Trial 1177 finished with value: 0.6707800652405211 and parameters: {'n_estimators': 1291, 'learning_rate': 0.07458699802955701, 'max_depth': 10, 'min_samples_split': 16, 'min_samples_leaf': 3, 'subsample': 0.9411956391094017, 'max_features': None}. Best is trial 603 with value: 0.45955205541891275.
[I 2024-12-04 15:06:23,859] Trial 1180 finished with value: 0.4901639588918879 and parameters: {'n_estimators': 1220, 'learning_rate': 0.06031691827198396, 'max_depth': 12, 'min_samples_split': 17, 'min_samples_leaf': 1, 'subsample': 0.992126071518769, 'max_features': None}. Best is trial 603 with value: 0.45955205541891275.
[I 2024-12-04 15:06:25,119] Trial 1188 finished with value: 0.48470738085834214 and parameters: {'n_estimators': 974, 'learning_rate': 0.05887243147290842, 'max_depth': 10, 'min_samples_split': 17, 'min_samples_leaf': 1, 'subsample': 0.966223276922162, 'max_features': None}. Best is trial 603 with value: 0.45955205541891275.
[I 2024-12-04 15:06:25,779] Trial 1201 finished with value: 0.6655622266736654 and parameters: {'n_estimators': 932, 'learning_rate': 0.013012623517242757, 'max_depth': 7, 'min_samples_split': 13, 'min_samples_leaf': 6, 'subsample': 0.9536080376622567, 'max_features': 'sqrt'}. Best is trial 603 with value: 0.45955205541891275.
[I 2024-12-04 15:06:26,462] Trial 1191 finished with value: 0.5635633307003837 and parameters: {'n_estimators': 1290, 'learning_rate': 0.08385474353876032, 'max_depth': 7, 'min_samples_split': 20, 'min_samples_leaf': 1, 'subsample': 0.87533394225411, 'max_features': 'sqrt'}. Best is trial 603 with value: 0.45955205541891275.
[I 2024-12-04 15:06:27,270] Trial 1173 finished with value: 0.47707725197456646 and parameters: {'n_estimators': 1465, 'learning_rate': 0.05118473213906255, 'max_depth': 12, 'min_samples_split': 20, 'min_samples_leaf': 1, 'subsample': 0.9983993155109796, 'max_features': None}. Best is trial 603 with value: 0.45955205541891275.
[I 2024-12-04 15:06:28,352] Trial 1185 finished with value: 0.5200682972143754 and parameters: {'n_estimators': 1162, 'learning_rate': 0.09959440257154081, 'max_depth': 12, 'min_samples_split': 15, 'min_samples_leaf': 1, 'subsample': 0.9759010598120822, 'max_features': None}. Best is trial 603 with value: 0.45955205541891275.
[I 2024-12-04 15:06:29,754] Trial 1186 finished with value: 0.6712852991124375 and parameters: {'n_estimators': 1257, 'learning_rate': 0.09881169849791961, 'max_depth': 8, 'min_samples_split': 17, 'min_samples_leaf': 3, 'subsample': 0.9850717383874357, 'max_features': None}. Best is trial 603 with value: 0.45955205541891275.
[I 2024-12-04 15:06:30,071] Trial 1192 finished with value: 0.6597842113140646 and parameters: {'n_estimators': 1435, 'learning_rate': 0.039853119997657664, 'max_depth': 9, 'min_samples_split': 13, 'min_samples_leaf': 3, 'subsample': 0.9200283037919658, 'max_features': 'sqrt'}. Best is trial 603 with value: 0.45955205541891275.
[I 2024-12-04 15:06:30,881] Trial 1187 finished with value: 0.47711543203665807 and parameters: {'n_estimators': 1231, 'learning_rate': 0.05005370383249885, 'max_depth': 12, 'min_samples_split': 19, 'min_samples_leaf': 1, 'subsample': 0.9332863932956281, 'max_features': None}. Best is trial 603 with value: 0.45955205541891275.
[I 2024-12-04 15:06:32,713] Trial 1178 finished with value: 0.5040887264808321 and parameters: {'n_estimators': 1493, 'learning_rate': 0.07210666235456369, 'max_depth': 10, 'min_samples_split': 17, 'min_samples_leaf': 1, 'subsample': 0.9302756823550994, 'max_features': None}. Best is trial 603 with value: 0.45955205541891275.
[I 2024-12-04 15:06:33,348] Trial 1184 finished with value: 0.4796503508413188 and parameters: {'n_estimators': 1428, 'learning_rate': 0.09799907575053894, 'max_depth': 10, 'min_samples_split': 19, 'min_samples_leaf': 1, 'subsample': 0.9170941263671943, 'max_features': None}. Best is trial 603 with value: 0.45955205541891275.
[I 2024-12-04 15:06:33,881] Trial 1194 finished with value: 0.6897422754053885 and parameters: {'n_estimators': 1188, 'learning_rate': 0.07722709814366036, 'max_depth': 9, 'min_samples_split': 16, 'min_samples_leaf': 2, 'subsample': 0.9990801246594405, 'max_features': None}. Best is trial 603 with value: 0.45955205541891275.
[I 2024-12-04 15:06:34,552] Trial 1195 finished with value: 0.6207584834589095 and parameters: {'n_estimators': 1149, 'learning_rate': 0.034452222498783075, 'max_depth': 12, 'min_samples_split': 20, 'min_samples_leaf': 2, 'subsample': 0.9978071830779592, 'max_features': None}. Best is trial 603 with value: 0.45955205541891275.
[I 2024-12-04 15:06:35,920] Trial 1189 finished with value: 0.5133746600047132 and parameters: {'n_estimators': 1356, 'learning_rate': 0.043769946987731775, 'max_depth': 12, 'min_samples_split': 16, 'min_samples_leaf': 1, 'subsample': 0.9108444698708672, 'max_features': None}. Best is trial 603 with value: 0.45955205541891275.
[I 2024-12-04 15:06:36,203] Trial 1208 finished with value: 0.6251703304348795 and parameters: {'n_estimators': 658, 'learning_rate': 0.012495411907399244, 'max_depth': 6, 'min_samples_split': 3, 'min_samples_leaf': 8, 'subsample': 0.8712038909400751, 'max_features': None}. Best is trial 603 with value: 0.45955205541891275.
[I 2024-12-04 15:06:36,498] Trial 1219 finished with value: 0.921080661039349 and parameters: {'n_estimators': 315, 'learning_rate': 0.024818200254004108, 'max_depth': 7, 'min_samples_split': 12, 'min_samples_leaf': 10, 'subsample': 0.8039702526104899, 'max_features': 'sqrt'}. Best is trial 603 with value: 0.45955205541891275.
[I 2024-12-04 15:06:36,930] Trial 1202 finished with value: 0.6444467401632182 and parameters: {'n_estimators': 1042, 'learning_rate': 0.08448618303620943, 'max_depth': 10, 'min_samples_split': 20, 'min_samples_leaf': 3, 'subsample': 0.9857451610829163, 'max_features': None}. Best is trial 603 with value: 0.45955205541891275.
[I 2024-12-04 15:06:38,714] Trial 1207 finished with value: 0.6421128233750476 and parameters: {'n_estimators': 913, 'learning_rate': 0.010163401216384892, 'max_depth': 8, 'min_samples_split': 5, 'min_samples_leaf': 4, 'subsample': 0.7736091453475319, 'max_features': 'sqrt'}. Best is trial 603 with value: 0.45955205541891275.
