[I 2024-12-04 12:06:45,591] Trial 2308 finished with value: 0.8101385948198155 and parameters: {'max_depth': 35, 'min_samples_split': 5, 'min_samples_leaf': 3, 'max_features': 'sqrt', 'criterion': 'squared_error', 'splitter': 'best'}. Best is trial 838 with value: 0.5900375110830633.
[I 2024-12-04 12:06:46,262] Trial 2312 finished with value: 0.7030091902207406 and parameters: {'max_depth': 35, 'min_samples_split': 7, 'min_samples_leaf': 1, 'max_features': 'sqrt', 'criterion': 'squared_error', 'splitter': 'best'}. Best is trial 838 with value: 0.5900375110830633.
[I 2024-12-04 12:06:48,007] Trial 2317 finished with value: 0.7486339970164284 and parameters: {'max_depth': 23, 'min_samples_split': 5, 'min_samples_leaf': 1, 'max_features': 'sqrt', 'criterion': 'squared_error', 'splitter': 'best'}. Best is trial 838 with value: 0.5900375110830633.
[I 2024-12-04 12:06:48,037] Trial 2303 finished with value: 0.7291342883560936 and parameters: {'max_depth': 35, 'min_samples_split': 5, 'min_samples_leaf': 1, 'max_features': 'sqrt', 'criterion': 'squared_error', 'splitter': 'best'}. Best is trial 838 with value: 0.5900375110830633.
[I 2024-12-04 12:06:48,348] Trial 2302 finished with value: 0.7044023234155515 and parameters: {'max_depth': 35, 'min_samples_split': 2, 'min_samples_leaf': 1, 'max_features': 'sqrt', 'criterion': 'squared_error', 'splitter': 'best'}. Best is trial 838 with value: 0.5900375110830633.
[I 2024-12-04 12:06:48,852] Trial 2297 finished with value: 0.8300015320785108 and parameters: {'max_depth': 29, 'min_samples_split': 5, 'min_samples_leaf': 2, 'max_features': 'sqrt', 'criterion': 'squared_error', 'splitter': 'best'}. Best is trial 838 with value: 0.5900375110830633.
[I 2024-12-04 12:06:49,378] Trial 2315 finished with value: 0.8241861685151659 and parameters: {'max_depth': 35, 'min_samples_split': 2, 'min_samples_leaf': 2, 'max_features': 'sqrt', 'criterion': 'squared_error', 'splitter': 'best'}. Best is trial 838 with value: 0.5900375110830633.
[I 2024-12-04 12:06:49,551] Trial 2322 finished with value: 0.7044023234155515 and parameters: {'max_depth': 35, 'min_samples_split': 2, 'min_samples_leaf': 1, 'max_features': 'sqrt', 'criterion': 'friedman_mse', 'splitter': 'best'}. Best is trial 838 with value: 0.5900375110830633.
[I 2024-12-04 12:06:49,552] Trial 2316 finished with value: 0.6777561409658496 and parameters: {'max_depth': 30, 'min_samples_split': 5, 'min_samples_leaf': 1, 'max_features': 'sqrt', 'criterion': 'squared_error', 'splitter': 'best'}. Best is trial 838 with value: 0.5900375110830633.
[I 2024-12-04 12:06:49,901] Trial 2326 finished with value: 0.8378489055613652 and parameters: {'max_depth': 29, 'min_samples_split': 10, 'min_samples_leaf': 6, 'max_features': 'sqrt', 'criterion': 'squared_error', 'splitter': 'best'}. Best is trial 838 with value: 0.5900375110830633.
[I 2024-12-04 12:06:50,401] Trial 2320 finished with value: 0.8241861685151659 and parameters: {'max_depth': 23, 'min_samples_split': 2, 'min_samples_leaf': 2, 'max_features': 'sqrt', 'criterion': 'squared_error', 'splitter': 'best'}. Best is trial 838 with value: 0.5900375110830633.
[I 2024-12-04 12:06:50,516] Trial 2318 finished with value: 0.8101385948198155 and parameters: {'max_depth': 30, 'min_samples_split': 4, 'min_samples_leaf': 3, 'max_features': 'sqrt', 'criterion': 'squared_error', 'splitter': 'best'}. Best is trial 838 with value: 0.5900375110830633.
[I 2024-12-04 12:06:53,102] Trial 2324 finished with value: 0.7291342883560936 and parameters: {'max_depth': 35, 'min_samples_split': 5, 'min_samples_leaf': 1, 'max_features': 'sqrt', 'criterion': 'squared_error', 'splitter': 'best'}. Best is trial 838 with value: 0.5900375110830633.
[I 2024-12-04 12:06:54,756] Trial 2323 finished with value: 0.7030091902207406 and parameters: {'max_depth': 35, 'min_samples_split': 7, 'min_samples_leaf': 1, 'max_features': 'sqrt', 'criterion': 'squared_error', 'splitter': 'best'}. Best is trial 838 with value: 0.5900375110830633.
[I 2024-12-04 12:06:54,782] Trial 2332 finished with value: 0.8101385948198155 and parameters: {'max_depth': 35, 'min_samples_split': 6, 'min_samples_leaf': 3, 'max_features': 'sqrt', 'criterion': 'squared_error', 'splitter': 'best'}. Best is trial 838 with value: 0.5900375110830633.
[I 2024-12-04 12:06:54,784] Trial 2329 finished with value: 0.7193300292543298 and parameters: {'max_depth': 29, 'min_samples_split': 7, 'min_samples_leaf': 1, 'max_features': 'sqrt', 'criterion': 'absolute_error', 'splitter': 'best'}. Best is trial 838 with value: 0.5900375110830633.
[I 2024-12-04 12:06:54,791] Trial 2321 finished with value: 0.7044023234155515 and parameters: {'max_depth': 35, 'min_samples_split': 2, 'min_samples_leaf': 1, 'max_features': 'sqrt', 'criterion': 'squared_error', 'splitter': 'best'}. Best is trial 838 with value: 0.5900375110830633.
[I 2024-12-04 12:06:55,655] Trial 2319 finished with value: 0.8101385948198155 and parameters: {'max_depth': 30, 'min_samples_split': 4, 'min_samples_leaf': 3, 'max_features': 'sqrt', 'criterion': 'squared_error', 'splitter': 'best'}. Best is trial 838 with value: 0.5900375110830633.
[I 2024-12-04 12:06:55,660] Trial 2335 finished with value: 0.6361563548204678 and parameters: {'max_depth': 30, 'min_samples_split': 4, 'min_samples_leaf': 1, 'max_features': 'sqrt', 'criterion': 'squared_error', 'splitter': 'best'}. Best is trial 838 with value: 0.5900375110830633.
[I 2024-12-04 12:06:55,806] Trial 2325 finished with value: 0.6361563548204678 and parameters: {'max_depth': 30, 'min_samples_split': 4, 'min_samples_leaf': 1, 'max_features': 'sqrt', 'criterion': 'squared_error', 'splitter': 'best'}. Best is trial 838 with value: 0.5900375110830633.
[I 2024-12-04 12:06:56,249] Trial 2339 finished with value: 0.7291342883560936 and parameters: {'max_depth': 35, 'min_samples_split': 5, 'min_samples_leaf': 1, 'max_features': 'sqrt', 'criterion': 'squared_error', 'splitter': 'best'}. Best is trial 838 with value: 0.5900375110830633.
[I 2024-12-04 12:06:56,261] Trial 2327 finished with value: 0.8241861685151659 and parameters: {'max_depth': 35, 'min_samples_split': 4, 'min_samples_leaf': 2, 'max_features': 'sqrt', 'criterion': 'squared_error', 'splitter': 'best'}. Best is trial 838 with value: 0.5900375110830633.
[I 2024-12-04 12:06:56,484] Trial 2333 finished with value: 0.8948705414188449 and parameters: {'max_depth': 34, 'min_samples_split': 4, 'min_samples_leaf': 3, 'max_features': 'sqrt', 'criterion': 'squared_error', 'splitter': 'random'}. Best is trial 838 with value: 0.5900375110830633.
[I 2024-12-04 12:06:57,453] Trial 2337 finished with value: 0.8241861685151659 and parameters: {'max_depth': 35, 'min_samples_split': 4, 'min_samples_leaf': 2, 'max_features': 'sqrt', 'criterion': 'squared_error', 'splitter': 'best'}. Best is trial 838 with value: 0.5900375110830633.
[I 2024-12-04 12:06:57,772] Trial 2338 finished with value: 0.9450964332687992 and parameters: {'max_depth': 35, 'min_samples_split': 6, 'min_samples_leaf': 3, 'max_features': 'log2', 'criterion': 'squared_error', 'splitter': 'best'}. Best is trial 838 with value: 0.5900375110830633.
[I 2024-12-04 12:06:59,122] Trial 2344 finished with value: 0.8434181468012534 and parameters: {'max_depth': 19, 'min_samples_split': 19, 'min_samples_leaf': 2, 'max_features': 'sqrt', 'criterion': 'friedman_mse', 'splitter': 'random'}. Best is trial 838 with value: 0.5900375110830633.
[I 2024-12-04 12:06:59,645] Trial 2343 finished with value: 0.8325912807680651 and parameters: {'max_depth': 10, 'min_samples_split': 5, 'min_samples_leaf': 1, 'max_features': 'sqrt', 'criterion': 'squared_error', 'splitter': 'best'}. Best is trial 838 with value: 0.5900375110830633.
[I 2024-12-04 12:07:00,416] Trial 2346 finished with value: 0.6361563548204678 and parameters: {'max_depth': 30, 'min_samples_split': 4, 'min_samples_leaf': 1, 'max_features': 'sqrt', 'criterion': 'squared_error', 'splitter': 'best'}. Best is trial 838 with value: 0.5900375110830633.
[I 2024-12-04 12:07:00,533] Trial 2340 finished with value: 0.8101385948198155 and parameters: {'max_depth': 35, 'min_samples_split': 2, 'min_samples_leaf': 3, 'max_features': 'sqrt', 'criterion': 'squared_error', 'splitter': 'best'}. Best is trial 838 with value: 0.5900375110830633.
[I 2024-12-04 12:07:01,425] Trial 2342 finished with value: 0.7030091902207406 and parameters: {'max_depth': 35, 'min_samples_split': 7, 'min_samples_leaf': 1, 'max_features': 'sqrt', 'criterion': 'squared_error', 'splitter': 'best'}. Best is trial 838 with value: 0.5900375110830633.
[I 2024-12-04 12:07:01,707] Trial 2336 finished with value: 0.6777561409658496 and parameters: {'max_depth': 30, 'min_samples_split': 5, 'min_samples_leaf': 1, 'max_features': 'sqrt', 'criterion': 'squared_error', 'splitter': 'best'}. Best is trial 838 with value: 0.5900375110830633.
[I 2024-12-04 12:07:03,057] Trial 2330 finished with value: 0.7044023234155515 and parameters: {'max_depth': 35, 'min_samples_split': 2, 'min_samples_leaf': 1, 'max_features': 'sqrt', 'criterion': 'squared_error', 'splitter': 'best'}. Best is trial 838 with value: 0.5900375110830633.
[I 2024-12-04 12:07:03,569] Trial 2355 finished with value: 0.8056989539390975 and parameters: {'max_depth': 35, 'min_samples_split': 8, 'min_samples_leaf': 3, 'max_features': 'sqrt', 'criterion': 'squared_error', 'splitter': 'best'}. Best is trial 838 with value: 0.5900375110830633.
[I 2024-12-04 12:07:03,571] Trial 2348 finished with value: 0.6777561409658496 and parameters: {'max_depth': 30, 'min_samples_split': 5, 'min_samples_leaf': 1, 'max_features': 'sqrt', 'criterion': 'squared_error', 'splitter': 'best'}. Best is trial 838 with value: 0.5900375110830633.
[I 2024-12-04 12:07:03,689] Trial 2351 finished with value: 0.6416220728212735 and parameters: {'max_depth': 29, 'min_samples_split': 2, 'min_samples_leaf': 1, 'max_features': 'sqrt', 'criterion': 'squared_error', 'splitter': 'best'}. Best is trial 838 with value: 0.5900375110830633.
[I 2024-12-04 12:07:03,990] Trial 2341 finished with value: 0.59023342761678 and parameters: {'max_depth': 35, 'min_samples_split': 4, 'min_samples_leaf': 1, 'max_features': 'sqrt', 'criterion': 'squared_error', 'splitter': 'best'}. Best is trial 838 with value: 0.5900375110830633.
[I 2024-12-04 12:07:05,105] Trial 2345 finished with value: 0.8101385948198155 and parameters: {'max_depth': 35, 'min_samples_split': 4, 'min_samples_leaf': 3, 'max_features': 'sqrt', 'criterion': 'friedman_mse', 'splitter': 'best'}. Best is trial 838 with value: 0.5900375110830633.
[I 2024-12-04 12:07:05,681] Trial 2358 finished with value: 0.6595568366176189 and parameters: {'max_depth': 35, 'min_samples_split': 8, 'min_samples_leaf': 1, 'max_features': 'sqrt', 'criterion': 'squared_error', 'splitter': 'best'}. Best is trial 838 with value: 0.5900375110830633.
[I 2024-12-04 12:07:05,693] Trial 2334 finished with value: 0.8266069286848198 and parameters: {'max_depth': 29, 'min_samples_split': 9, 'min_samples_leaf': 2, 'max_features': 'sqrt', 'criterion': 'squared_error', 'splitter': 'best'}. Best is trial 838 with value: 0.5900375110830633.
[I 2024-12-04 12:07:05,704] Trial 2347 finished with value: 0.8101385948198155 and parameters: {'max_depth': 35, 'min_samples_split': 5, 'min_samples_leaf': 3, 'max_features': 'sqrt', 'criterion': 'squared_error', 'splitter': 'best'}. Best is trial 838 with value: 0.5900375110830633.
[I 2024-12-04 12:07:06,130] Trial 2359 finished with value: 0.8300015320785108 and parameters: {'max_depth': 27, 'min_samples_split': 5, 'min_samples_leaf': 2, 'max_features': 'sqrt', 'criterion': 'friedman_mse', 'splitter': 'best'}. Best is trial 838 with value: 0.5900375110830633.
[I 2024-12-04 12:07:06,491] Trial 2357 finished with value: 1.0740768482351102 and parameters: {'max_depth': 14, 'min_samples_split': 20, 'min_samples_leaf': 9, 'max_features': 'log2', 'criterion': 'absolute_error', 'splitter': 'best'}. Best is trial 838 with value: 0.5900375110830633.
[I 2024-12-04 12:07:07,166] Trial 2352 finished with value: 0.6777561409658496 and parameters: {'max_depth': 30, 'min_samples_split': 5, 'min_samples_leaf': 1, 'max_features': 'sqrt', 'criterion': 'squared_error', 'splitter': 'best'}. Best is trial 838 with value: 0.5900375110830633.
[I 2024-12-04 12:07:07,167] Trial 2328 finished with value: 0.8948705414188449 and parameters: {'max_depth': 35, 'min_samples_split': 6, 'min_samples_leaf': 3, 'max_features': 'sqrt', 'criterion': 'squared_error', 'splitter': 'random'}. Best is trial 838 with value: 0.5900375110830633.
[I 2024-12-04 12:07:07,931] Trial 2364 finished with value: 0.7044023234155515 and parameters: {'max_depth': 35, 'min_samples_split': 2, 'min_samples_leaf': 1, 'max_features': 'sqrt', 'criterion': 'squared_error', 'splitter': 'best'}. Best is trial 838 with value: 0.5900375110830633.
[I 2024-12-04 12:07:08,496] Trial 2353 finished with value: 0.8300015320785108 and parameters: {'max_depth': 35, 'min_samples_split': 5, 'min_samples_leaf': 2, 'max_features': 'sqrt', 'criterion': 'squared_error', 'splitter': 'best'}. Best is trial 838 with value: 0.5900375110830633.
[I 2024-12-04 12:07:08,985] Trial 2350 finished with value: 0.7231530055805183 and parameters: {'max_depth': 30, 'min_samples_split': 2, 'min_samples_leaf': 1, 'max_features': 'sqrt', 'criterion': 'squared_error', 'splitter': 'best'}. Best is trial 838 with value: 0.5900375110830633.
[I 2024-12-04 12:07:09,850] Trial 2363 finished with value: 0.59023342761678 and parameters: {'max_depth': 35, 'min_samples_split': 4, 'min_samples_leaf': 1, 'max_features': 'sqrt', 'criterion': 'squared_error', 'splitter': 'best'}. Best is trial 838 with value: 0.5900375110830633.
[I 2024-12-04 12:07:10,113] Trial 2361 finished with value: 1.0675246405133478 and parameters: {'max_depth': 2, 'min_samples_split': 20, 'min_samples_leaf': 6, 'max_features': 'sqrt', 'criterion': 'friedman_mse', 'splitter': 'best'}. Best is trial 838 with value: 0.5900375110830633.
[I 2024-12-04 12:07:11,029] Trial 2349 finished with value: 0.7291342883560936 and parameters: {'max_depth': 35, 'min_samples_split': 5, 'min_samples_leaf': 1, 'max_features': 'sqrt', 'criterion': 'squared_error', 'splitter': 'best'}. Best is trial 838 with value: 0.5900375110830633.
[I 2024-12-04 12:07:11,053] Trial 2365 finished with value: 0.8241861685151659 and parameters: {'max_depth': 35, 'min_samples_split': 4, 'min_samples_leaf': 2, 'max_features': 'sqrt', 'criterion': 'squared_error', 'splitter': 'best'}. Best is trial 838 with value: 0.5900375110830633.
[I 2024-12-04 12:07:11,213] Trial 2366 finished with value: 0.8551951934380061 and parameters: {'max_depth': 35, 'min_samples_split': 2, 'min_samples_leaf': 2, 'max_features': 'log2', 'criterion': 'absolute_error', 'splitter': 'best'}. Best is trial 838 with value: 0.5900375110830633.
[I 2024-12-04 12:07:11,217] Trial 2354 finished with value: 0.7760913389393442 and parameters: {'max_depth': 29, 'min_samples_split': 3, 'min_samples_leaf': 1, 'max_features': 'sqrt', 'criterion': 'absolute_error', 'splitter': 'best'}. Best is trial 838 with value: 0.5900375110830633.
[I 2024-12-04 12:07:11,244] Trial 2356 finished with value: 0.7242053946898249 and parameters: {'max_depth': 30, 'min_samples_split': 7, 'min_samples_leaf': 1, 'max_features': 'sqrt', 'criterion': 'squared_error', 'splitter': 'best'}. Best is trial 838 with value: 0.5900375110830633.
[I 2024-12-04 12:07:15,444] Trial 2360 finished with value: 0.8241861685151659 and parameters: {'max_depth': 30, 'min_samples_split': 2, 'min_samples_leaf': 2, 'max_features': 'sqrt', 'criterion': 'squared_error', 'splitter': 'best'}. Best is trial 838 with value: 0.5900375110830633.
[I 2024-12-04 12:07:15,445] Trial 2362 finished with value: 1.0944406534581308 and parameters: {'max_depth': 1, 'min_samples_split': 18, 'min_samples_leaf': 6, 'max_features': 'sqrt', 'criterion': 'friedman_mse', 'splitter': 'random'}. Best is trial 838 with value: 0.5900375110830633.
[I 2024-12-04 12:07:17,501] Trial 2368 finished with value: 0.7030091902207406 and parameters: {'max_depth': 35, 'min_samples_split': 7, 'min_samples_leaf': 1, 'max_features': 'sqrt', 'criterion': 'squared_error', 'splitter': 'best'}. Best is trial 838 with value: 0.5900375110830633.
[I 2024-12-04 12:07:17,765] Trial 2369 finished with value: 0.6361563548204678 and parameters: {'max_depth': 30, 'min_samples_split': 4, 'min_samples_leaf': 1, 'max_features': 'sqrt', 'criterion': 'friedman_mse', 'splitter': 'best'}. Best is trial 838 with value: 0.5900375110830633.
[I 2024-12-04 12:07:17,896] Trial 2371 finished with value: 0.8378489055613652 and parameters: {'max_depth': 34, 'min_samples_split': 5, 'min_samples_leaf': 6, 'max_features': 'sqrt', 'criterion': 'friedman_mse', 'splitter': 'best'}. Best is trial 838 with value: 0.5900375110830633.
[I 2024-12-04 12:07:18,056] Trial 2331 finished with value: 0.8101385948198155 and parameters: {'max_depth': 30, 'min_samples_split': 5, 'min_samples_leaf': 3, 'max_features': 'sqrt', 'criterion': 'squared_error', 'splitter': 'best'}. Best is trial 838 with value: 0.5900375110830633.
[I 2024-12-04 12:07:18,247] Trial 2370 finished with value: 0.676636829282285 and parameters: {'max_depth': 35, 'min_samples_split': 6, 'min_samples_leaf': 1, 'max_features': 'sqrt', 'criterion': 'squared_error', 'splitter': 'best'}. Best is trial 838 with value: 0.5900375110830633.
[I 2024-12-04 12:07:19,753] Trial 2372 finished with value: 1.0816149376799358 and parameters: {'max_depth': 18, 'min_samples_split': 2, 'min_samples_leaf': 7, 'max_features': 'sqrt', 'criterion': 'friedman_mse', 'splitter': 'random'}. Best is trial 838 with value: 0.5900375110830633.
[I 2024-12-04 12:07:21,670] Trial 2377 finished with value: 0.7291342883560936 and parameters: {'max_depth': 35, 'min_samples_split': 5, 'min_samples_leaf': 1, 'max_features': 'sqrt', 'criterion': 'friedman_mse', 'splitter': 'best'}. Best is trial 838 with value: 0.5900375110830633.
[I 2024-12-04 12:07:23,706] Trial 2373 finished with value: 0.8241861685151659 and parameters: {'max_depth': 35, 'min_samples_split': 2, 'min_samples_leaf': 2, 'max_features': 'sqrt', 'criterion': 'squared_error', 'splitter': 'best'}. Best is trial 838 with value: 0.5900375110830633.
[I 2024-12-04 12:07:23,756] Trial 2367 finished with value: 0.8037648258474691 and parameters: {'max_depth': 28, 'min_samples_split': 7, 'min_samples_leaf': 1, 'max_features': 'sqrt', 'criterion': 'squared_error', 'splitter': 'random'}. Best is trial 838 with value: 0.5900375110830633.
[I 2024-12-04 12:07:24,206] Trial 2380 finished with value: 0.8101385948198155 and parameters: {'max_depth': 30, 'min_samples_split': 6, 'min_samples_leaf': 3, 'max_features': 'sqrt', 'criterion': 'squared_error', 'splitter': 'best'}. Best is trial 838 with value: 0.5900375110830633.
[I 2024-12-04 12:07:24,566] Trial 2385 finished with value: 0.59023342761678 and parameters: {'max_depth': 35, 'min_samples_split': 4, 'min_samples_leaf': 1, 'max_features': 'sqrt', 'criterion': 'squared_error', 'splitter': 'best'}. Best is trial 838 with value: 0.5900375110830633.
[I 2024-12-04 12:07:25,184] Trial 2376 finished with value: 0.6777561409658496 and parameters: {'max_depth': 30, 'min_samples_split': 5, 'min_samples_leaf': 1, 'max_features': 'sqrt', 'criterion': 'squared_error', 'splitter': 'best'}. Best is trial 838 with value: 0.5900375110830633.
[I 2024-12-04 12:07:25,342] Trial 2384 finished with value: 0.7231530055805183 and parameters: {'max_depth': 30, 'min_samples_split': 2, 'min_samples_leaf': 1, 'max_features': 'sqrt', 'criterion': 'squared_error', 'splitter': 'best'}. Best is trial 838 with value: 0.5900375110830633.
[I 2024-12-04 12:07:25,378] Trial 2375 finished with value: 1.0816149376799358 and parameters: {'max_depth': 29, 'min_samples_split': 9, 'min_samples_leaf': 10, 'max_features': 'sqrt', 'criterion': 'friedman_mse', 'splitter': 'random'}. Best is trial 838 with value: 0.5900375110830633.
[I 2024-12-04 12:07:25,379] Trial 2379 finished with value: 0.6777561409658496 and parameters: {'max_depth': 30, 'min_samples_split': 5, 'min_samples_leaf': 1, 'max_features': 'sqrt', 'criterion': 'squared_error', 'splitter': 'best'}. Best is trial 838 with value: 0.5900375110830633.
[I 2024-12-04 12:07:26,414] Trial 2388 finished with value: 1.091656728529238 and parameters: {'max_depth': 30, 'min_samples_split': 9, 'min_samples_leaf': 10, 'max_features': 'log2', 'criterion': 'friedman_mse', 'splitter': 'best'}. Best is trial 838 with value: 0.5900375110830633.
[I 2024-12-04 12:07:26,963] Trial 2378 finished with value: 0.774293158467234 and parameters: {'max_depth': 35, 'min_samples_split': 2, 'min_samples_leaf': 3, 'max_features': 'sqrt', 'criterion': 'absolute_error', 'splitter': 'best'}. Best is trial 838 with value: 0.5900375110830633.
[I 2024-12-04 12:07:28,244] Trial 2387 finished with value: 1.0831025649903463 and parameters: {'max_depth': 3, 'min_samples_split': 12, 'min_samples_leaf': 1, 'max_features': 'log2', 'criterion': 'squared_error', 'splitter': 'best'}. Best is trial 838 with value: 0.5900375110830633.
[I 2024-12-04 12:07:28,479] Trial 2391 finished with value: 0.8300015320785108 and parameters: {'max_depth': 30, 'min_samples_split': 5, 'min_samples_leaf': 2, 'max_features': 'sqrt', 'criterion': 'squared_error', 'splitter': 'best'}. Best is trial 838 with value: 0.5900375110830633.
[I 2024-12-04 12:07:28,752] Trial 2393 finished with value: 0.7291342883560936 and parameters: {'max_depth': 35, 'min_samples_split': 5, 'min_samples_leaf': 1, 'max_features': 'sqrt', 'criterion': 'squared_error', 'splitter': 'best'}. Best is trial 838 with value: 0.5900375110830633.
[I 2024-12-04 12:07:28,913] Trial 2386 finished with value: 0.8101385948198155 and parameters: {'max_depth': 28, 'min_samples_split': 2, 'min_samples_leaf': 3, 'max_features': 'sqrt', 'criterion': 'squared_error', 'splitter': 'best'}. Best is trial 838 with value: 0.5900375110830633.
