[I 2024-12-04 21:02:11,128] Trial 1825 finished with value: 0.986468681888647 and parameters: {'kernel_type': 'RBF', 'length_scale': 0.03376714215356754, 'noise_level': 8.891347243908118e-08, 'constant_value': 0.00045327596372254914, 'nu': 1.5}. Best is trial 959 with value: 0.1375110730946576.
[I 2024-12-04 21:02:15,829] Trial 1826 finished with value: 0.14249503986377418 and parameters: {'kernel_type': 'Matern', 'length_scale': 70.1758412851532, 'noise_level': 0.13662430539217651, 'constant_value': 1.1683653660160829, 'nu': 1.5}. Best is trial 959 with value: 0.1375110730946576.
[I 2024-12-04 21:02:18,659] Trial 1828 finished with value: 0.14249506542492557 and parameters: {'kernel_type': 'Matern', 'length_scale': 19.65516656821082, 'noise_level': 0.031057248129109635, 'constant_value': 25.978513498156925, 'nu': 1.5}. Best is trial 959 with value: 0.1375110730946576.
[I 2024-12-04 21:02:19,085] Trial 1827 finished with value: 0.14249500531373316 and parameters: {'kernel_type': 'Matern', 'length_scale': 197.97720036791793, 'noise_level': 0.02494284849847625, 'constant_value': 10.02653524234934, 'nu': 1.5}. Best is trial 959 with value: 0.1375110730946576.
[I 2024-12-04 21:02:22,972] Trial 1829 finished with value: 0.1424950632229246 and parameters: {'kernel_type': 'Matern', 'length_scale': 616.7907246483968, 'noise_level': 0.901998106961671, 'constant_value': 84.7515359626167, 'nu': 1.5}. Best is trial 959 with value: 0.1375110730946576.
[I 2024-12-04 21:02:29,893] Trial 1830 finished with value: 0.1424949572662532 and parameters: {'kernel_type': 'Matern', 'length_scale': 1.349733913725161, 'noise_level': 0.8910102867324483, 'constant_value': 8.569590779302649, 'nu': 1.5}. Best is trial 959 with value: 0.1375110730946576.
[I 2024-12-04 21:02:29,995] Trial 1832 finished with value: 0.14249496207695336 and parameters: {'kernel_type': 'Matern', 'length_scale': 712.4781680155673, 'noise_level': 0.6513006560234615, 'constant_value': 27.190421221398644, 'nu': 1.5}. Best is trial 959 with value: 0.1375110730946576.
[I 2024-12-04 21:02:32,186] Trial 1831 finished with value: 0.1424951463984666 and parameters: {'kernel_type': 'Matern', 'length_scale': 4.975269646000091, 'noise_level': 0.7544627412392261, 'constant_value': 5.207994803257438, 'nu': 1.5}. Best is trial 959 with value: 0.1375110730946576.
[I 2024-12-04 21:02:35,715] Trial 1835 finished with value: 0.9864686819417929 and parameters: {'kernel_type': 'RBF', 'length_scale': 0.017784114341214314, 'noise_level': 0.057799723659162625, 'constant_value': 160.50996895816314, 'nu': 1.5}. Best is trial 959 with value: 0.1375110730946576.
[I 2024-12-04 21:02:37,336] Trial 1834 finished with value: 0.14249504651373868 and parameters: {'kernel_type': 'Matern', 'length_scale': 126.43934244931555, 'noise_level': 0.9516363812196675, 'constant_value': 327.7237951710058, 'nu': 1.5}. Best is trial 959 with value: 0.1375110730946576.
[I 2024-12-04 21:02:37,439] Trial 1833 finished with value: 0.1424952093830204 and parameters: {'kernel_type': 'Matern', 'length_scale': 5.207091153397995, 'noise_level': 0.01610808096815938, 'constant_value': 65.88239288462702, 'nu': 1.5}. Best is trial 959 with value: 0.1375110730946576.
[I 2024-12-04 21:02:40,179] Trial 1836 finished with value: 0.9982167338039759 and parameters: {'kernel_type': 'RBF', 'length_scale': 0.004066390056748505, 'noise_level': 2.506297200549537e-10, 'constant_value': 438.1893474582357, 'nu': 2.5}. Best is trial 959 with value: 0.1375110730946576.
[I 2024-12-04 21:02:47,825] Trial 1838 finished with value: 0.986468681933391 and parameters: {'kernel_type': 'Matern', 'length_scale': 185.75639177416375, 'noise_level': 0.003525824492087544, 'constant_value': 1.6119680293158182e-07, 'nu': 2.5}. Best is trial 959 with value: 0.1375110730946576.
[I 2024-12-04 21:02:48,754] Trial 1837 finished with value: 0.9864686819289966 and parameters: {'kernel_type': 'Matern', 'length_scale': 52.13606722648574, 'noise_level': 1.516310807278378e-08, 'constant_value': 0.0005334077324565683, 'nu': 1.5}. Best is trial 959 with value: 0.1375110730946576.
[I 2024-12-04 21:02:54,435] Trial 1839 finished with value: 0.14249451680461858 and parameters: {'kernel_type': 'Matern', 'length_scale': 137.1714149090586, 'noise_level': 0.6157495946631416, 'constant_value': 0.5829939982631678, 'nu': 1.5}. Best is trial 959 with value: 0.1375110730946576.
[I 2024-12-04 21:02:55,636] Trial 1841 finished with value: 0.9864686819007056 and parameters: {'kernel_type': 'RBF', 'length_scale': 0.02728070217064563, 'noise_level': 1.1962125721416625e-10, 'constant_value': 4.9019972678601e-06, 'nu': 0.5}. Best is trial 959 with value: 0.1375110730946576.
[I 2024-12-04 21:02:55,977] Trial 1840 finished with value: 0.142494895558201 and parameters: {'kernel_type': 'Matern', 'length_scale': 321.91040307648416, 'noise_level': 0.9988114552543434, 'constant_value': 2.617610195214787, 'nu': 1.5}. Best is trial 959 with value: 0.1375110730946576.
[I 2024-12-04 21:03:03,784] Trial 1843 finished with value: 0.14249506329907818 and parameters: {'kernel_type': 'Matern', 'length_scale': 2.1201428562148323, 'noise_level': 0.9702891135744178, 'constant_value': 8.243012057114516, 'nu': 1.5}. Best is trial 959 with value: 0.1375110730946576.
[I 2024-12-04 21:03:04,590] Trial 1842 finished with value: 0.1424951053226353 and parameters: {'kernel_type': 'Matern', 'length_scale': 0.14652852619582254, 'noise_level': 0.011185030940421467, 'constant_value': 3.733370595843911, 'nu': 1.5}. Best is trial 959 with value: 0.1375110730946576.
[I 2024-12-04 21:03:06,219] Trial 1844 finished with value: 0.14771040318727408 and parameters: {'kernel_type': 'RBF', 'length_scale': 45.29790852296508, 'noise_level': 0.12239242364938166, 'constant_value': 0.001965882169193365, 'nu': 1.5}. Best is trial 959 with value: 0.1375110730946576.
[I 2024-12-04 21:03:10,730] Trial 1845 finished with value: 0.9864686819458715 and parameters: {'kernel_type': 'Matern', 'length_scale': 6.75902716946898, 'noise_level': 0.014678118757147435, 'constant_value': 0.0345907260338936, 'nu': 1.5}. Best is trial 959 with value: 0.1375110730946576.
[I 2024-12-04 21:03:13,754] Trial 1846 finished with value: 0.13764421009528469 and parameters: {'kernel_type': 'Matern', 'length_scale': 5.884980989918983, 'noise_level': 0.691483354358831, 'constant_value': 0.07440658072998636, 'nu': 1.5}. Best is trial 959 with value: 0.1375110730946576.
[I 2024-12-04 21:03:14,023] Trial 1847 finished with value: 0.9864686819201914 and parameters: {'kernel_type': 'Matern', 'length_scale': 13.005820088859744, 'noise_level': 2.152438444621335e-05, 'constant_value': 4.727995813210188, 'nu': 2.5}. Best is trial 959 with value: 0.1375110730946576.
[I 2024-12-04 21:03:18,776] Trial 1848 finished with value: 0.14249506403586837 and parameters: {'kernel_type': 'Matern', 'length_scale': 2.3503515350262925, 'noise_level': 0.8647650155129493, 'constant_value': 139.34065726691455, 'nu': 1.5}. Best is trial 959 with value: 0.1375110730946576.
[I 2024-12-04 21:03:20,491] Trial 1849 finished with value: 0.1424950645639024 and parameters: {'kernel_type': 'Matern', 'length_scale': 1.910615101320059, 'noise_level': 0.19257351400311803, 'constant_value': 0.2104410125235375, 'nu': 1.5}. Best is trial 959 with value: 0.1375110730946576.
[I 2024-12-04 21:03:26,743] Trial 1851 finished with value: 0.1424950782046555 and parameters: {'kernel_type': 'Matern', 'length_scale': 2.435862204100444, 'noise_level': 0.1629412500974306, 'constant_value': 0.0047248412699369986, 'nu': 1.5}. Best is trial 959 with value: 0.1375110730946576.
[I 2024-12-04 21:03:28,904] Trial 1850 finished with value: 0.14249483902766905 and parameters: {'kernel_type': 'Matern', 'length_scale': 9.499702034753788, 'noise_level': 0.24772174771674835, 'constant_value': 0.008666345575372946, 'nu': 1.5}. Best is trial 959 with value: 0.1375110730946576.
[I 2024-12-04 21:03:32,302] Trial 1852 finished with value: 0.9864686292524689 and parameters: {'kernel_type': 'Matern', 'length_scale': 0.13828692602812115, 'noise_level': 0.13572987111236748, 'constant_value': 0.0015763074735090383, 'nu': 1.5}. Best is trial 959 with value: 0.1375110730946576.
[I 2024-12-04 21:03:33,934] Trial 1853 finished with value: 0.14249517373552137 and parameters: {'kernel_type': 'Matern', 'length_scale': 38.5250508318132, 'noise_level': 0.4287415150253413, 'constant_value': 0.5940232637972265, 'nu': 1.5}. Best is trial 959 with value: 0.1375110730946576.
[I 2024-12-04 21:03:38,214] Trial 1856 finished with value: 0.9864686819153167 and parameters: {'kernel_type': 'RBF', 'length_scale': 0.00022380325819600728, 'noise_level': 0.011629680912151403, 'constant_value': 11.026555129550696, 'nu': 2.5}. Best is trial 959 with value: 0.1375110730946576.
[I 2024-12-04 21:03:39,490] Trial 1854 finished with value: 0.1424950575740009 and parameters: {'kernel_type': 'Matern', 'length_scale': 177.86406448652696, 'noise_level': 0.14701485553971677, 'constant_value': 0.044973725297499226, 'nu': 1.5}. Best is trial 959 with value: 0.1375110730946576.
[I 2024-12-04 21:03:43,014] Trial 1855 finished with value: 0.14249505075933905 and parameters: {'kernel_type': 'Matern', 'length_scale': 41.06441346735443, 'noise_level': 0.5309728949500129, 'constant_value': 0.02526651235662318, 'nu': 1.5}. Best is trial 959 with value: 0.1375110730946576.
[I 2024-12-04 21:03:44,605] Trial 1857 finished with value: 0.1424950633008589 and parameters: {'kernel_type': 'Matern', 'length_scale': 0.2891602615374392, 'noise_level': 0.40582876034473525, 'constant_value': 0.11271231078518441, 'nu': 1.5}. Best is trial 959 with value: 0.1375110730946576.
[I 2024-12-04 21:03:50,065] Trial 1858 finished with value: 0.14249506590388855 and parameters: {'kernel_type': 'Matern', 'length_scale': 217.73913001654458, 'noise_level': 0.24285684517327416, 'constant_value': 0.010095768103372205, 'nu': 1.5}. Best is trial 959 with value: 0.1375110730946576.
[I 2024-12-04 21:03:52,913] Trial 1859 finished with value: 0.1424950605033438 and parameters: {'kernel_type': 'Matern', 'length_scale': 2.081525488178231, 'noise_level': 0.005009380944303817, 'constant_value': 0.0013300742581252303, 'nu': 1.5}. Best is trial 959 with value: 0.1375110730946576.
[I 2024-12-04 21:03:55,140] Trial 1860 finished with value: 0.14249505546156427 and parameters: {'kernel_type': 'Matern', 'length_scale': 161.4854570285292, 'noise_level': 0.8032747935491303, 'constant_value': 0.022751353748399858, 'nu': 1.5}. Best is trial 959 with value: 0.1375110730946576.
[I 2024-12-04 21:03:58,634] Trial 1861 finished with value: 0.14249506292834693 and parameters: {'kernel_type': 'Matern', 'length_scale': 0.21613387413526147, 'noise_level': 0.7912633024808562, 'constant_value': 0.9329687521146403, 'nu': 1.5}. Best is trial 959 with value: 0.1375110730946576.
[I 2024-12-04 21:04:01,268] Trial 1862 finished with value: 0.14249506631619227 and parameters: {'kernel_type': 'Matern', 'length_scale': 39.98971562798517, 'noise_level': 0.5753925711159854, 'constant_value': 1.33014908741907, 'nu': 1.5}. Best is trial 959 with value: 0.1375110730946576.
[I 2024-12-04 21:04:02,888] Trial 1863 finished with value: 0.14249505658887984 and parameters: {'kernel_type': 'Matern', 'length_scale': 36.38471009965345, 'noise_level': 0.8102531488444121, 'constant_value': 0.9177871337757842, 'nu': 1.5}. Best is trial 959 with value: 0.1375110730946576.
[I 2024-12-04 21:04:05,234] Trial 1864 finished with value: 0.14249506564408537 and parameters: {'kernel_type': 'Matern', 'length_scale': 15.66014428848369, 'noise_level': 0.14329230218352682, 'constant_value': 0.0019825230284329634, 'nu': 1.5}. Best is trial 959 with value: 0.1375110730946576.
[I 2024-12-04 21:04:09,190] Trial 1865 finished with value: 0.14249507913921372 and parameters: {'kernel_type': 'Matern', 'length_scale': 2.707809320977064, 'noise_level': 0.07302224460483092, 'constant_value': 0.1122635516911758, 'nu': 1.5}. Best is trial 959 with value: 0.1375110730946576.
[I 2024-12-04 21:04:14,956] Trial 1866 finished with value: 0.9864686819192195 and parameters: {'kernel_type': 'Matern', 'length_scale': 448.2378371004574, 'noise_level': 0.01685160722378273, 'constant_value': 0.00047859663578427584, 'nu': 1.5}. Best is trial 959 with value: 0.1375110730946576.
[I 2024-12-04 21:04:17,129] Trial 1868 finished with value: 0.14249505686613115 and parameters: {'kernel_type': 'Matern', 'length_scale': 26.337092344457638, 'noise_level': 0.8718397514616887, 'constant_value': 0.2673089961683413, 'nu': 1.5}. Best is trial 959 with value: 0.1375110730946576.
[I 2024-12-04 21:04:21,467] Trial 1867 finished with value: 0.9864686819199826 and parameters: {'kernel_type': 'Matern', 'length_scale': 32.71776369475064, 'noise_level': 0.00841956184318506, 'constant_value': 0.00387398866410644, 'nu': 1.5}. Best is trial 959 with value: 0.1375110730946576.
[I 2024-12-04 21:04:22,397] Trial 1869 finished with value: 0.14249505275140265 and parameters: {'kernel_type': 'Matern', 'length_scale': 2.3303512440590994, 'noise_level': 0.3211057576960465, 'constant_value': 0.0310842671408789, 'nu': 1.5}. Best is trial 959 with value: 0.1375110730946576.
[I 2024-12-04 21:04:27,096] Trial 1870 finished with value: 0.14249506659236275 and parameters: {'kernel_type': 'Matern', 'length_scale': 0.39114096928847203, 'noise_level': 0.4821813265886407, 'constant_value': 0.008898580607228705, 'nu': 1.5}. Best is trial 959 with value: 0.1375110730946576.
[I 2024-12-04 21:04:27,168] Trial 1871 finished with value: 0.9864686814071962 and parameters: {'kernel_type': 'Matern', 'length_scale': 3.9299479755635702, 'noise_level': 0.01371384860350593, 'constant_value': 0.05798683711831648, 'nu': 1.5}. Best is trial 959 with value: 0.1375110730946576.
[I 2024-12-04 21:04:33,452] Trial 1873 finished with value: 0.9982167338041052 and parameters: {'kernel_type': 'RBF', 'length_scale': 0.091629414193617, 'noise_level': 2.70923707395886e-08, 'constant_value': 1.1027850391214167, 'nu': 0.5}. Best is trial 959 with value: 0.1375110730946576.
[I 2024-12-04 21:04:34,109] Trial 1872 finished with value: 0.1375560557451154 and parameters: {'kernel_type': 'Matern', 'length_scale': 0.3632950777008649, 'noise_level': 0.9695872649552728, 'constant_value': 76.21249913452571, 'nu': 1.5}. Best is trial 959 with value: 0.1375110730946576.
[I 2024-12-04 21:04:35,756] Trial 1874 finished with value: 0.14249485176184593 and parameters: {'kernel_type': 'Matern', 'length_scale': 87.87797267958597, 'noise_level': 0.7158307441429019, 'constant_value': 43.55214901817561, 'nu': 1.5}. Best is trial 959 with value: 0.1375110730946576.
[I 2024-12-04 21:04:38,978] Trial 1876 finished with value: 0.9864686738976125 and parameters: {'kernel_type': 'Matern', 'length_scale': 0.08264470816593485, 'noise_level': 0.9334298279900383, 'constant_value': 2213.3529218803246, 'nu': 1.5}. Best is trial 959 with value: 0.1375110730946576.
[I 2024-12-04 21:04:41,015] Trial 1877 finished with value: 0.986468669810533 and parameters: {'kernel_type': 'Matern', 'length_scale': 0.08440827695243575, 'noise_level': 0.06343849287075946, 'constant_value': 24.397967495070635, 'nu': 1.5}. Best is trial 959 with value: 0.1375110730946576.
[I 2024-12-04 21:04:45,181] Trial 1875 finished with value: 0.14249506652115668 and parameters: {'kernel_type': 'Matern', 'length_scale': 11.347197891091744, 'noise_level': 0.7749601786338057, 'constant_value': 0.0011973747576760482, 'nu': 1.5}. Best is trial 959 with value: 0.1375110730946576.
[I 2024-12-04 21:04:48,239] Trial 1879 finished with value: 0.9864686819237036 and parameters: {'kernel_type': 'Matern', 'length_scale': 0.014252553293328694, 'noise_level': 0.6708611552612924, 'constant_value': 305.81875609320815, 'nu': 2.5}. Best is trial 959 with value: 0.1375110730946576.
[I 2024-12-04 21:04:52,474] Trial 1878 finished with value: 0.9864686819218412 and parameters: {'kernel_type': 'RBF', 'length_scale': 0.030720589572512117, 'noise_level': 0.0002492111526869938, 'constant_value': 1.0390117725812203e-07, 'nu': 1.5}. Best is trial 959 with value: 0.1375110730946576.
[I 2024-12-04 21:04:53,225] Trial 1881 finished with value: 0.9864686819221876 and parameters: {'kernel_type': 'Matern', 'length_scale': 0.049718116465813, 'noise_level': 0.18308375161079976, 'constant_value': 83.53586571588534, 'nu': 1.5}. Best is trial 959 with value: 0.1375110730946576.
[I 2024-12-04 21:04:57,197] Trial 1880 finished with value: 0.14249501628005629 and parameters: {'kernel_type': 'Matern', 'length_scale': 0.24934118014411658, 'noise_level': 0.9846304714449879, 'constant_value': 6.668901639868858, 'nu': 1.5}. Best is trial 959 with value: 0.1375110730946576.
[I 2024-12-04 21:05:03,456] Trial 1882 finished with value: 0.986468681921631 and parameters: {'kernel_type': 'Matern', 'length_scale': 0.010576885380508662, 'noise_level': 0.2853944137719152, 'constant_value': 236.336921771554, 'nu': 1.5}. Best is trial 959 with value: 0.1375110730946576.
[I 2024-12-04 21:05:09,479] Trial 1883 finished with value: 0.9864686819239442 and parameters: {'kernel_type': 'Matern', 'length_scale': 0.018691056388568984, 'noise_level': 0.838020448837097, 'constant_value': 28.678542197529406, 'nu': 1.5}. Best is trial 959 with value: 0.1375110730946576.
[I 2024-12-04 21:05:10,310] Trial 1884 finished with value: 0.9864686787979003 and parameters: {'kernel_type': 'Matern', 'length_scale': 0.07893747329968487, 'noise_level': 0.08881445126641421, 'constant_value': 4.228462324110237, 'nu': 1.5}. Best is trial 959 with value: 0.1375110730946576.
[I 2024-12-04 21:05:14,131] Trial 1886 finished with value: 0.9864686818002302 and parameters: {'kernel_type': 'Matern', 'length_scale': 0.0015676389699770866, 'noise_level': 0.9327790331064122, 'constant_value': 1983.4388141653337, 'nu': 1.5}. Best is trial 959 with value: 0.1375110730946576.
[I 2024-12-04 21:05:16,944] Trial 1885 finished with value: 0.9864686819124564 and parameters: {'kernel_type': 'RBF', 'length_scale': 43077.57437103084, 'noise_level': 1.0133852248933518e-06, 'constant_value': 0.3437910014482386, 'nu': 0.5}. Best is trial 959 with value: 0.1375110730946576.
[I 2024-12-04 21:05:17,038] Trial 1887 finished with value: 0.14249507908571196 and parameters: {'kernel_type': 'Matern', 'length_scale': 2.3334726876611853, 'noise_level': 0.7988451138402706, 'constant_value': 0.21392145894335565, 'nu': 1.5}. Best is trial 959 with value: 0.1375110730946576.
[I 2024-12-04 21:05:19,272] Trial 1888 finished with value: 0.986468673580606 and parameters: {'kernel_type': 'Matern', 'length_scale': 0.08281427257975615, 'noise_level': 0.006910855922840702, 'constant_value': 0.1463584983995996, 'nu': 1.5}. Best is trial 959 with value: 0.1375110730946576.
[I 2024-12-04 21:05:25,664] Trial 1890 finished with value: 0.14249506423252326 and parameters: {'kernel_type': 'Matern', 'length_scale': 0.457233704198054, 'noise_level': 0.6056424524683227, 'constant_value': 1.9083370165055629, 'nu': 1.5}. Best is trial 959 with value: 0.1375110730946576.
[I 2024-12-04 21:05:26,275] Trial 1891 finished with value: 0.14249506332995313 and parameters: {'kernel_type': 'Matern', 'length_scale': 0.43882065167291523, 'noise_level': 0.3801422076732234, 'constant_value': 411.44904377601205, 'nu': 1.5}. Best is trial 959 with value: 0.1375110730946576.
[I 2024-12-04 21:05:30,508] Trial 1892 finished with value: 0.9864669246060863 and parameters: {'kernel_type': 'Matern', 'length_scale': 0.11301543835132408, 'noise_level': 0.7559969020610717, 'constant_value': 1.5738263905969572, 'nu': 1.5}. Best is trial 959 with value: 0.1375110730946576.
[I 2024-12-04 21:05:32,116] Trial 1889 finished with value: 0.14249506538187698 and parameters: {'kernel_type': 'Matern', 'length_scale': 0.12673437281497668, 'noise_level': 0.8962004423439673, 'constant_value': 66.82474967322939, 'nu': 1.5}. Best is trial 959 with value: 0.1375110730946576.
[I 2024-12-04 21:05:34,049] Trial 1893 finished with value: 0.14249503081126208 and parameters: {'kernel_type': 'Matern', 'length_scale': 4.4000617090091225, 'noise_level': 0.03674156742298192, 'constant_value': 0.10960765909378203, 'nu': 1.5}. Best is trial 959 with value: 0.1375110730946576.
[I 2024-12-04 21:05:44,394] Trial 1896 finished with value: 0.9864686819227311 and parameters: {'kernel_type': 'Matern', 'length_scale': 0.01867526332504629, 'noise_level': 0.5745777937817728, 'constant_value': 249.82286438356664, 'nu': 1.5}. Best is trial 959 with value: 0.1375110730946576.
[I 2024-12-04 21:05:45,379] Trial 1894 finished with value: 0.1808622549624013 and parameters: {'kernel_type': 'Matern', 'length_scale': 0.3297284411936331, 'noise_level': 0.915923282207567, 'constant_value': 0.008924243737952428, 'nu': 1.5}. Best is trial 959 with value: 0.1375110730946576.
[I 2024-12-04 21:05:46,211] Trial 1895 finished with value: 0.14469877043790333 and parameters: {'kernel_type': 'Matern', 'length_scale': 8.584424261463981, 'noise_level': 0.6857639712469814, 'constant_value': 20.272741594825078, 'nu': 2.5}. Best is trial 959 with value: 0.1375110730946576.
[I 2024-12-04 21:05:53,075] Trial 1897 finished with value: 0.142495084094561 and parameters: {'kernel_type': 'Matern', 'length_scale': 0.45159990663995336, 'noise_level': 0.8663125061112322, 'constant_value': 6207.039523524877, 'nu': 1.5}. Best is trial 959 with value: 0.1375110730946576.
[I 2024-12-04 21:05:53,711] Trial 1898 finished with value: 0.14249506221872887 and parameters: {'kernel_type': 'Matern', 'length_scale': 3.2296466829445762, 'noise_level': 0.953523846393138, 'constant_value': 0.026714367681495488, 'nu': 1.5}. Best is trial 959 with value: 0.1375110730946576.
[I 2024-12-04 21:05:56,406] Trial 1899 finished with value: 0.9864686819223667 and parameters: {'kernel_type': 'Matern', 'length_scale': 20.284617611636072, 'noise_level': 0.01130019413138564, 'constant_value': 1.0203945843777953, 'nu': 2.5}. Best is trial 959 with value: 0.1375110730946576.
