[I 2024-12-04 15:05:07,842] Trial 787 finished with value: 0.42157949158401725 and parameters: {'n_estimators': 738, 'max_depth': 42, 'min_samples_split': 2, 'min_samples_leaf': 1, 'max_features': None, 'bootstrap': True, 'criterion': 'squared_error'}. Best is trial 590 with value: 0.4185444504443197.
[I 2024-12-04 15:05:09,949] Trial 789 finished with value: 0.4212928062028264 and parameters: {'n_estimators': 810, 'max_depth': 42, 'min_samples_split': 2, 'min_samples_leaf': 1, 'max_features': None, 'bootstrap': True, 'criterion': 'squared_error'}. Best is trial 590 with value: 0.4185444504443197.
[I 2024-12-04 15:05:16,603] Trial 799 finished with value: 0.4652904625766574 and parameters: {'n_estimators': 838, 'max_depth': 42, 'min_samples_split': 2, 'min_samples_leaf': 2, 'max_features': None, 'bootstrap': True, 'criterion': 'squared_error'}. Best is trial 590 with value: 0.4185444504443197.
[I 2024-12-04 15:05:17,752] Trial 795 finished with value: 0.4273505216033957 and parameters: {'n_estimators': 577, 'max_depth': 35, 'min_samples_split': 3, 'min_samples_leaf': 1, 'max_features': None, 'bootstrap': True, 'criterion': 'squared_error'}. Best is trial 590 with value: 0.4185444504443197.
[I 2024-12-04 15:05:20,715] Trial 797 finished with value: 0.421419249261715 and parameters: {'n_estimators': 811, 'max_depth': 35, 'min_samples_split': 2, 'min_samples_leaf': 1, 'max_features': None, 'bootstrap': True, 'criterion': 'squared_error'}. Best is trial 590 with value: 0.4185444504443197.
[I 2024-12-04 15:05:20,720] Trial 806 finished with value: 0.7241636379823637 and parameters: {'n_estimators': 911, 'max_depth': 28, 'min_samples_split': 3, 'min_samples_leaf': 1, 'max_features': 'log2', 'bootstrap': True, 'criterion': 'squared_error'}. Best is trial 590 with value: 0.4185444504443197.
[I 2024-12-04 15:05:20,728] Trial 802 finished with value: 0.46568789209836686 and parameters: {'n_estimators': 561, 'max_depth': 45, 'min_samples_split': 2, 'min_samples_leaf': 2, 'max_features': None, 'bootstrap': True, 'criterion': 'squared_error'}. Best is trial 590 with value: 0.4185444504443197.
[I 2024-12-04 15:05:20,841] Trial 811 finished with value: 1.0570937071159792 and parameters: {'n_estimators': 370, 'max_depth': 26, 'min_samples_split': 34, 'min_samples_leaf': 13, 'max_features': 'log2', 'bootstrap': True, 'criterion': 'absolute_error'}. Best is trial 590 with value: 0.4185444504443197.
[I 2024-12-04 15:05:21,583] Trial 796 finished with value: 0.419609674905819 and parameters: {'n_estimators': 770, 'max_depth': 39, 'min_samples_split': 2, 'min_samples_leaf': 1, 'max_features': None, 'bootstrap': True, 'criterion': 'squared_error'}. Best is trial 590 with value: 0.4185444504443197.
[I 2024-12-04 15:05:22,905] Trial 808 finished with value: 0.6976903340386357 and parameters: {'n_estimators': 831, 'max_depth': 39, 'min_samples_split': 2, 'min_samples_leaf': 2, 'max_features': 'sqrt', 'bootstrap': True, 'criterion': 'squared_error'}. Best is trial 590 with value: 0.4185444504443197.
[I 2024-12-04 15:05:23,691] Trial 760 finished with value: 0.6692950142837467 and parameters: {'n_estimators': 517, 'max_depth': 12, 'min_samples_split': 25, 'min_samples_leaf': 1, 'max_features': None, 'bootstrap': False, 'criterion': 'absolute_error'}. Best is trial 590 with value: 0.4185444504443197.
[I 2024-12-04 15:05:24,958] Trial 794 finished with value: 0.42004075889457715 and parameters: {'n_estimators': 780, 'max_depth': 38, 'min_samples_split': 2, 'min_samples_leaf': 1, 'max_features': None, 'bootstrap': True, 'criterion': 'squared_error'}. Best is trial 590 with value: 0.4185444504443197.
[I 2024-12-04 15:05:25,786] Trial 818 finished with value: 0.6853706056902192 and parameters: {'n_estimators': 212, 'max_depth': 29, 'min_samples_split': 6, 'min_samples_leaf': 12, 'max_features': None, 'bootstrap': True, 'criterion': 'squared_error'}. Best is trial 590 with value: 0.4185444504443197.
[I 2024-12-04 15:05:26,952] Trial 804 finished with value: 0.603208661465913 and parameters: {'n_estimators': 988, 'max_depth': 45, 'min_samples_split': 2, 'min_samples_leaf': 1, 'max_features': 'log2', 'bootstrap': True, 'criterion': 'squared_error'}. Best is trial 590 with value: 0.4185444504443197.
[I 2024-12-04 15:05:28,781] Trial 816 finished with value: 1.025641005705995 and parameters: {'n_estimators': 251, 'max_depth': 28, 'min_samples_split': 9, 'min_samples_leaf': 3, 'max_features': 'log2', 'bootstrap': True, 'criterion': 'squared_error'}. Best is trial 590 with value: 0.4185444504443197.
[I 2024-12-04 15:05:34,572] Trial 812 finished with value: 0.4217543315876962 and parameters: {'n_estimators': 622, 'max_depth': 34, 'min_samples_split': 2, 'min_samples_leaf': 1, 'max_features': None, 'bootstrap': True, 'criterion': 'squared_error'}. Best is trial 590 with value: 0.4185444504443197.
[I 2024-12-04 15:05:35,446] Trial 807 finished with value: 0.46525424851722236 and parameters: {'n_estimators': 840, 'max_depth': 38, 'min_samples_split': 3, 'min_samples_leaf': 2, 'max_features': None, 'bootstrap': True, 'criterion': 'squared_error'}. Best is trial 590 with value: 0.4185444504443197.
[I 2024-12-04 15:05:35,603] Trial 805 finished with value: 0.4218486098785828 and parameters: {'n_estimators': 780, 'max_depth': 49, 'min_samples_split': 2, 'min_samples_leaf': 1, 'max_features': None, 'bootstrap': True, 'criterion': 'squared_error'}. Best is trial 590 with value: 0.4185444504443197.
[I 2024-12-04 15:05:36,780] Trial 810 finished with value: 0.42363408293935634 and parameters: {'n_estimators': 834, 'max_depth': 39, 'min_samples_split': 3, 'min_samples_leaf': 1, 'max_features': None, 'bootstrap': True, 'criterion': 'squared_error'}. Best is trial 590 with value: 0.4185444504443197.
[I 2024-12-04 15:05:44,294] Trial 814 finished with value: 0.5329812591699099 and parameters: {'n_estimators': 959, 'max_depth': 39, 'min_samples_split': 5, 'min_samples_leaf': 1, 'max_features': 'sqrt', 'bootstrap': True, 'criterion': 'squared_error'}. Best is trial 590 with value: 0.4185444504443197.
[I 2024-12-04 15:05:46,252] Trial 813 finished with value: 0.5079141567364484 and parameters: {'n_estimators': 823, 'max_depth': 42, 'min_samples_split': 3, 'min_samples_leaf': 1, 'max_features': None, 'bootstrap': False, 'criterion': 'squared_error'}. Best is trial 590 with value: 0.4185444504443197.
[I 2024-12-04 15:05:47,578] Trial 819 finished with value: 0.4316096495133492 and parameters: {'n_estimators': 714, 'max_depth': 36, 'min_samples_split': 4, 'min_samples_leaf': 1, 'max_features': None, 'bootstrap': True, 'criterion': 'squared_error'}. Best is trial 590 with value: 0.4185444504443197.
[I 2024-12-04 15:05:51,917] Trial 822 finished with value: 0.6129136683350649 and parameters: {'n_estimators': 993, 'max_depth': 40, 'min_samples_split': 2, 'min_samples_leaf': 2, 'max_features': None, 'bootstrap': False, 'criterion': 'squared_error'}. Best is trial 590 with value: 0.4185444504443197.
[I 2024-12-04 15:05:58,883] Trial 809 finished with value: 0.4247393108541001 and parameters: {'n_estimators': 721, 'max_depth': 44, 'min_samples_split': 3, 'min_samples_leaf': 1, 'max_features': None, 'bootstrap': True, 'criterion': 'squared_error'}. Best is trial 590 with value: 0.4185444504443197.
[I 2024-12-04 15:05:59,034] Trial 817 finished with value: 0.42057628637534367 and parameters: {'n_estimators': 827, 'max_depth': 43, 'min_samples_split': 2, 'min_samples_leaf': 1, 'max_features': None, 'bootstrap': True, 'criterion': 'squared_error'}. Best is trial 590 with value: 0.4185444504443197.
[I 2024-12-04 15:05:59,035] Trial 821 finished with value: 0.4189518163203514 and parameters: {'n_estimators': 831, 'max_depth': 40, 'min_samples_split': 2, 'min_samples_leaf': 1, 'max_features': None, 'bootstrap': True, 'criterion': 'squared_error'}. Best is trial 590 with value: 0.4185444504443197.
[I 2024-12-04 15:06:05,397] Trial 820 finished with value: 0.465537176608695 and parameters: {'n_estimators': 795, 'max_depth': 49, 'min_samples_split': 4, 'min_samples_leaf': 2, 'max_features': None, 'bootstrap': True, 'criterion': 'squared_error'}. Best is trial 590 with value: 0.4185444504443197.
[I 2024-12-04 15:06:06,143] Trial 823 finished with value: 0.422302732796861 and parameters: {'n_estimators': 606, 'max_depth': 44, 'min_samples_split': 2, 'min_samples_leaf': 1, 'max_features': None, 'bootstrap': True, 'criterion': 'squared_error'}. Best is trial 590 with value: 0.4185444504443197.
[I 2024-12-04 15:06:07,975] Trial 840 finished with value: 0.8887527035424351 and parameters: {'n_estimators': 182, 'max_depth': 39, 'min_samples_split': 18, 'min_samples_leaf': 4, 'max_features': 'sqrt', 'bootstrap': True, 'criterion': 'squared_error'}. Best is trial 590 with value: 0.4185444504443197.
[I 2024-12-04 15:06:08,464] Trial 815 finished with value: 0.4218538469115429 and parameters: {'n_estimators': 798, 'max_depth': 35, 'min_samples_split': 2, 'min_samples_leaf': 1, 'max_features': None, 'bootstrap': True, 'criterion': 'squared_error'}. Best is trial 590 with value: 0.4185444504443197.
[I 2024-12-04 15:06:10,315] Trial 831 finished with value: 0.6380553126435475 and parameters: {'n_estimators': 689, 'max_depth': 22, 'min_samples_split': 13, 'min_samples_leaf': 1, 'max_features': 'sqrt', 'bootstrap': False, 'criterion': 'squared_error'}. Best is trial 590 with value: 0.4185444504443197.
[I 2024-12-04 15:06:12,872] Trial 836 finished with value: 0.9163707745879487 and parameters: {'n_estimators': 219, 'max_depth': 8, 'min_samples_split': 7, 'min_samples_leaf': 2, 'max_features': 'sqrt', 'bootstrap': True, 'criterion': 'absolute_error'}. Best is trial 590 with value: 0.4185444504443197.
[I 2024-12-04 15:06:13,093] Trial 833 finished with value: 0.721480627564045 and parameters: {'n_estimators': 921, 'max_depth': 11, 'min_samples_split': 20, 'min_samples_leaf': 10, 'max_features': None, 'bootstrap': False, 'criterion': 'squared_error'}. Best is trial 590 with value: 0.4185444504443197.
[I 2024-12-04 15:06:13,311] Trial 834 finished with value: 0.9589062909733204 and parameters: {'n_estimators': 811, 'max_depth': 12, 'min_samples_split': 4, 'min_samples_leaf': 2, 'max_features': 'log2', 'bootstrap': False, 'criterion': 'absolute_error'}. Best is trial 590 with value: 0.4185444504443197.
[I 2024-12-04 15:06:13,932] Trial 825 finished with value: 0.42147335251349444 and parameters: {'n_estimators': 795, 'max_depth': 34, 'min_samples_split': 2, 'min_samples_leaf': 1, 'max_features': None, 'bootstrap': True, 'criterion': 'squared_error'}. Best is trial 590 with value: 0.4185444504443197.
[I 2024-12-04 15:06:14,344] Trial 790 finished with value: 0.4292563308137578 and parameters: {'n_estimators': 660, 'max_depth': 44, 'min_samples_split': 2, 'min_samples_leaf': 1, 'max_features': None, 'bootstrap': True, 'criterion': 'absolute_error'}. Best is trial 590 with value: 0.4185444504443197.
[I 2024-12-04 15:06:15,249] Trial 785 finished with value: 0.6107048422683196 and parameters: {'n_estimators': 998, 'max_depth': 43, 'min_samples_split': 25, 'min_samples_leaf': 3, 'max_features': None, 'bootstrap': False, 'criterion': 'absolute_error'}. Best is trial 590 with value: 0.4185444504443197.
[I 2024-12-04 15:06:18,503] Trial 828 finished with value: 0.46526969546413693 and parameters: {'n_estimators': 839, 'max_depth': 40, 'min_samples_split': 2, 'min_samples_leaf': 2, 'max_features': None, 'bootstrap': True, 'criterion': 'squared_error'}. Best is trial 590 with value: 0.4185444504443197.
[I 2024-12-04 15:06:18,981] Trial 827 finished with value: 0.42444274855262903 and parameters: {'n_estimators': 869, 'max_depth': 43, 'min_samples_split': 3, 'min_samples_leaf': 1, 'max_features': None, 'bootstrap': True, 'criterion': 'squared_error'}. Best is trial 590 with value: 0.4185444504443197.
[I 2024-12-04 15:06:19,076] Trial 824 finished with value: 0.6778852479276093 and parameters: {'n_estimators': 762, 'max_depth': 19, 'min_samples_split': 12, 'min_samples_leaf': 10, 'max_features': None, 'bootstrap': True, 'criterion': 'absolute_error'}. Best is trial 590 with value: 0.4185444504443197.
[I 2024-12-04 15:06:19,178] Trial 837 finished with value: 0.4254778630075068 and parameters: {'n_estimators': 665, 'max_depth': 42, 'min_samples_split': 3, 'min_samples_leaf': 1, 'max_features': None, 'bootstrap': True, 'criterion': 'squared_error'}. Best is trial 590 with value: 0.4185444504443197.
[I 2024-12-04 15:06:19,511] Trial 803 finished with value: 0.6673402710823144 and parameters: {'n_estimators': 616, 'max_depth': 12, 'min_samples_split': 2, 'min_samples_leaf': 2, 'max_features': None, 'bootstrap': False, 'criterion': 'absolute_error'}. Best is trial 590 with value: 0.4185444504443197.
[I 2024-12-04 15:06:19,530] Trial 835 finished with value: 0.4320661960224787 and parameters: {'n_estimators': 865, 'max_depth': 33, 'min_samples_split': 4, 'min_samples_leaf': 1, 'max_features': None, 'bootstrap': True, 'criterion': 'squared_error'}. Best is trial 590 with value: 0.4185444504443197.
[I 2024-12-04 15:06:19,885] Trial 843 finished with value: 1.051876641415185 and parameters: {'n_estimators': 559, 'max_depth': 31, 'min_samples_split': 2, 'min_samples_leaf': 7, 'max_features': 'log2', 'bootstrap': True, 'criterion': 'absolute_error'}. Best is trial 590 with value: 0.4185444504443197.
[I 2024-12-04 15:06:20,747] Trial 829 finished with value: 0.4221537425090419 and parameters: {'n_estimators': 631, 'max_depth': 42, 'min_samples_split': 2, 'min_samples_leaf': 1, 'max_features': None, 'bootstrap': True, 'criterion': 'squared_error'}. Best is trial 590 with value: 0.4185444504443197.
[I 2024-12-04 15:06:23,522] Trial 846 finished with value: 0.9576684461147164 and parameters: {'n_estimators': 180, 'max_depth': 7, 'min_samples_split': 2, 'min_samples_leaf': 4, 'max_features': 'sqrt', 'bootstrap': True, 'criterion': 'squared_error'}. Best is trial 590 with value: 0.4185444504443197.
[I 2024-12-04 15:06:24,894] Trial 826 finished with value: 0.4316524194142451 and parameters: {'n_estimators': 795, 'max_depth': 44, 'min_samples_split': 4, 'min_samples_leaf': 1, 'max_features': None, 'bootstrap': True, 'criterion': 'squared_error'}. Best is trial 590 with value: 0.4185444504443197.
[I 2024-12-04 15:06:25,081] Trial 832 finished with value: 0.4213675183326084 and parameters: {'n_estimators': 845, 'max_depth': 42, 'min_samples_split': 2, 'min_samples_leaf': 1, 'max_features': None, 'bootstrap': True, 'criterion': 'squared_error'}. Best is trial 590 with value: 0.4185444504443197.
[I 2024-12-04 15:06:27,044] Trial 839 finished with value: 0.4196248011196816 and parameters: {'n_estimators': 803, 'max_depth': 39, 'min_samples_split': 2, 'min_samples_leaf': 1, 'max_features': None, 'bootstrap': True, 'criterion': 'squared_error'}. Best is trial 590 with value: 0.4185444504443197.
[I 2024-12-04 15:06:27,818] Trial 838 finished with value: 0.4653544495663305 and parameters: {'n_estimators': 987, 'max_depth': 41, 'min_samples_split': 2, 'min_samples_leaf': 2, 'max_features': None, 'bootstrap': True, 'criterion': 'squared_error'}. Best is trial 590 with value: 0.4185444504443197.
[I 2024-12-04 15:06:29,091] Trial 841 finished with value: 0.42143445319808354 and parameters: {'n_estimators': 782, 'max_depth': 45, 'min_samples_split': 2, 'min_samples_leaf': 1, 'max_features': None, 'bootstrap': True, 'criterion': 'squared_error'}. Best is trial 590 with value: 0.4185444504443197.
[I 2024-12-04 15:06:32,232] Trial 842 finished with value: 0.4207636498900949 and parameters: {'n_estimators': 871, 'max_depth': 37, 'min_samples_split': 2, 'min_samples_leaf': 1, 'max_features': None, 'bootstrap': True, 'criterion': 'squared_error'}. Best is trial 590 with value: 0.4185444504443197.
[I 2024-12-04 15:06:33,951] Trial 845 finished with value: 0.431749412420343 and parameters: {'n_estimators': 851, 'max_depth': 36, 'min_samples_split': 4, 'min_samples_leaf': 1, 'max_features': None, 'bootstrap': True, 'criterion': 'squared_error'}. Best is trial 590 with value: 0.4185444504443197.
[I 2024-12-04 15:06:37,315] Trial 844 finished with value: 0.4313314254975676 and parameters: {'n_estimators': 865, 'max_depth': 41, 'min_samples_split': 4, 'min_samples_leaf': 1, 'max_features': None, 'bootstrap': True, 'criterion': 'squared_error'}. Best is trial 590 with value: 0.4185444504443197.
[I 2024-12-04 15:06:39,121] Trial 851 finished with value: 0.6564162332864251 and parameters: {'n_estimators': 331, 'max_depth': 24, 'min_samples_split': 38, 'min_samples_leaf': 4, 'max_features': None, 'bootstrap': False, 'criterion': 'squared_error'}. Best is trial 590 with value: 0.4185444504443197.
[I 2024-12-04 15:06:40,443] Trial 849 finished with value: 0.5312416244965841 and parameters: {'n_estimators': 940, 'max_depth': 35, 'min_samples_split': 2, 'min_samples_leaf': 1, 'max_features': 'sqrt', 'bootstrap': True, 'criterion': 'squared_error'}. Best is trial 590 with value: 0.4185444504443197.
[I 2024-12-04 15:06:41,824] Trial 864 finished with value: 1.0659799860234354 and parameters: {'n_estimators': 946, 'max_depth': 7, 'min_samples_split': 16, 'min_samples_leaf': 11, 'max_features': 'log2', 'bootstrap': False, 'criterion': 'squared_error'}. Best is trial 590 with value: 0.4185444504443197.
[I 2024-12-04 15:06:45,365] Trial 847 finished with value: 0.5428626236744992 and parameters: {'n_estimators': 897, 'max_depth': 32, 'min_samples_split': 2, 'min_samples_leaf': 1, 'max_features': 'sqrt', 'bootstrap': True, 'criterion': 'squared_error'}. Best is trial 590 with value: 0.4185444504443197.
[I 2024-12-04 15:06:46,123] Trial 852 finished with value: 0.4653594860103645 and parameters: {'n_estimators': 771, 'max_depth': 39, 'min_samples_split': 2, 'min_samples_leaf': 2, 'max_features': None, 'bootstrap': True, 'criterion': 'squared_error'}. Best is trial 590 with value: 0.4185444504443197.
[I 2024-12-04 15:06:53,452] Trial 854 finished with value: 0.4201106351530576 and parameters: {'n_estimators': 848, 'max_depth': 38, 'min_samples_split': 2, 'min_samples_leaf': 1, 'max_features': None, 'bootstrap': True, 'criterion': 'squared_error'}. Best is trial 590 with value: 0.4185444504443197.
[I 2024-12-04 15:06:55,925] Trial 870 finished with value: 1.0204211173513142 and parameters: {'n_estimators': 577, 'max_depth': 5, 'min_samples_split': 45, 'min_samples_leaf': 2, 'max_features': 'log2', 'bootstrap': False, 'criterion': 'squared_error'}. Best is trial 590 with value: 0.4185444504443197.
[I 2024-12-04 15:06:57,767] Trial 859 finished with value: 0.47920053726415174 and parameters: {'n_estimators': 762, 'max_depth': 21, 'min_samples_split': 14, 'min_samples_leaf': 2, 'max_features': None, 'bootstrap': True, 'criterion': 'squared_error'}. Best is trial 590 with value: 0.4185444504443197.
[I 2024-12-04 15:07:02,686] Trial 850 finished with value: 0.4246475168049713 and parameters: {'n_estimators': 870, 'max_depth': 27, 'min_samples_split': 2, 'min_samples_leaf': 1, 'max_features': None, 'bootstrap': True, 'criterion': 'squared_error'}. Best is trial 590 with value: 0.4185444504443197.
[I 2024-12-04 15:07:03,122] Trial 830 finished with value: 0.6195298505536656 and parameters: {'n_estimators': 482, 'max_depth': 40, 'min_samples_split': 36, 'min_samples_leaf': 1, 'max_features': None, 'bootstrap': False, 'criterion': 'absolute_error'}. Best is trial 590 with value: 0.4185444504443197.
[I 2024-12-04 15:07:03,553] Trial 855 finished with value: 0.5592080430751415 and parameters: {'n_estimators': 905, 'max_depth': 26, 'min_samples_split': 15, 'min_samples_leaf': 4, 'max_features': None, 'bootstrap': True, 'criterion': 'squared_error'}. Best is trial 590 with value: 0.4185444504443197.
[I 2024-12-04 15:07:11,761] Trial 857 finished with value: 0.42470918924762435 and parameters: {'n_estimators': 991, 'max_depth': 49, 'min_samples_split': 3, 'min_samples_leaf': 1, 'max_features': None, 'bootstrap': True, 'criterion': 'squared_error'}. Best is trial 590 with value: 0.4185444504443197.
[I 2024-12-04 15:07:11,801] Trial 858 finished with value: 0.4196436018410106 and parameters: {'n_estimators': 895, 'max_depth': 41, 'min_samples_split': 2, 'min_samples_leaf': 1, 'max_features': None, 'bootstrap': True, 'criterion': 'squared_error'}. Best is trial 590 with value: 0.4185444504443197.
[I 2024-12-04 15:07:18,180] Trial 862 finished with value: 0.4222073562243758 and parameters: {'n_estimators': 661, 'max_depth': 33, 'min_samples_split': 2, 'min_samples_leaf': 1, 'max_features': None, 'bootstrap': True, 'criterion': 'squared_error'}. Best is trial 590 with value: 0.4185444504443197.
[I 2024-12-04 15:07:18,271] Trial 871 finished with value: 0.46674694000575495 and parameters: {'n_estimators': 516, 'max_depth': 35, 'min_samples_split': 2, 'min_samples_leaf': 2, 'max_features': None, 'bootstrap': True, 'criterion': 'squared_error'}. Best is trial 590 with value: 0.4185444504443197.
[I 2024-12-04 15:07:18,628] Trial 861 finished with value: 0.41998014174093096 and parameters: {'n_estimators': 864, 'max_depth': 31, 'min_samples_split': 2, 'min_samples_leaf': 1, 'max_features': None, 'bootstrap': True, 'criterion': 'squared_error'}. Best is trial 590 with value: 0.4185444504443197.
[I 2024-12-04 15:07:19,584] Trial 863 finished with value: 0.4215563017437167 and parameters: {'n_estimators': 842, 'max_depth': 46, 'min_samples_split': 2, 'min_samples_leaf': 1, 'max_features': None, 'bootstrap': True, 'criterion': 'squared_error'}. Best is trial 590 with value: 0.4185444504443197.
[I 2024-12-04 15:07:20,122] Trial 869 finished with value: 0.46513553275996095 and parameters: {'n_estimators': 601, 'max_depth': 36, 'min_samples_split': 3, 'min_samples_leaf': 2, 'max_features': None, 'bootstrap': True, 'criterion': 'squared_error'}. Best is trial 590 with value: 0.4185444504443197.
