[I 2024-12-04 20:59:08,175] Trial 2486 finished with value: 1.091652967285212 and parameters: {'kernel_type': 'Matern', 'length_scale': 0.13731682021397215, 'noise_level': 0.00055346821148972, 'constant_value': 88526.14661187404, 'nu': 0.5}. Best is trial 1997 with value: 0.359156695282073.
[I 2024-12-04 20:59:09,581] Trial 2485 finished with value: 0.35921116322094 and parameters: {'kernel_type': 'Matern', 'length_scale': 843.2926265653706, 'noise_level': 0.0011580351225723164, 'constant_value': 672.3860924981068, 'nu': 0.5}. Best is trial 1997 with value: 0.359156695282073.
[I 2024-12-04 20:59:11,545] Trial 2488 finished with value: 1.0916561177402608 and parameters: {'kernel_type': 'Matern', 'length_scale': 0.7582524330660497, 'noise_level': 6.0670306154817196e-05, 'constant_value': 1171.3626243713175, 'nu': 0.5}. Best is trial 1997 with value: 0.359156695282073.
[I 2024-12-04 20:59:11,547] Trial 2487 finished with value: 0.35921130930597023 and parameters: {'kernel_type': 'Matern', 'length_scale': 4.115338035107169, 'noise_level': 0.0005278562830373012, 'constant_value': 23367.03649335566, 'nu': 0.5}. Best is trial 1997 with value: 0.359156695282073.
[I 2024-12-04 20:59:13,489] Trial 2489 finished with value: 1.0624161143509168 and parameters: {'kernel_type': 'RBF', 'length_scale': 4.02104371034082e-05, 'noise_level': 0.6604794528646405, 'constant_value': 3094.440059006976, 'nu': 0.5}. Best is trial 1997 with value: 0.359156695282073.
[I 2024-12-04 20:59:15,246] Trial 2491 finished with value: 1.0916566833853913 and parameters: {'kernel_type': 'Matern', 'length_scale': 2249.5215112991805, 'noise_level': 8.816279297521127e-06, 'constant_value': 56905.243647054485, 'nu': 0.5}. Best is trial 1997 with value: 0.359156695282073.
[I 2024-12-04 20:59:17,047] Trial 2490 finished with value: 0.359211348729002 and parameters: {'kernel_type': 'Matern', 'length_scale': 1599.6264668201318, 'noise_level': 0.0004136670598484961, 'constant_value': 140.70493008775668, 'nu': 0.5}. Best is trial 1997 with value: 0.359156695282073.
[I 2024-12-04 20:59:18,574] Trial 2492 finished with value: 0.35921091787599047 and parameters: {'kernel_type': 'Matern', 'length_scale': 14.567910055261235, 'noise_level': 0.00012670345480557486, 'constant_value': 767.9570261380405, 'nu': 0.5}. Best is trial 1997 with value: 0.359156695282073.
[I 2024-12-04 20:59:22,321] Trial 2493 finished with value: 0.3592112502764024 and parameters: {'kernel_type': 'Matern', 'length_scale': 459.64773907579604, 'noise_level': 0.00029028524219582583, 'constant_value': 753.4774794639027, 'nu': 0.5}. Best is trial 1997 with value: 0.359156695282073.
[I 2024-12-04 20:59:24,736] Trial 2495 finished with value: 1.0916558493888404 and parameters: {'kernel_type': 'Matern', 'length_scale': 0.006823846926544684, 'noise_level': 2.0826043563753384e-05, 'constant_value': 180.48120310165132, 'nu': 0.5}. Best is trial 1997 with value: 0.359156695282073.
[I 2024-12-04 20:59:25,741] Trial 2494 finished with value: 0.3592112417391886 and parameters: {'kernel_type': 'Matern', 'length_scale': 8315.74840371823, 'noise_level': 0.01757417603928974, 'constant_value': 12739.108321851529, 'nu': 0.5}. Best is trial 1997 with value: 0.359156695282073.
[I 2024-12-04 20:59:28,348] Trial 2496 finished with value: 0.35920950830565107 and parameters: {'kernel_type': 'Matern', 'length_scale': 43.16638387108258, 'noise_level': 0.0006148683906316916, 'constant_value': 92231.99218614525, 'nu': 0.5}. Best is trial 1997 with value: 0.359156695282073.
[I 2024-12-04 20:59:29,443] Trial 2498 finished with value: 1.0916558493886472 and parameters: {'kernel_type': 'RBF', 'length_scale': 4.571936631743251e-05, 'noise_level': 2.081375064533223e-05, 'constant_value': 499.5091076733631, 'nu': 0.5}. Best is trial 1997 with value: 0.359156695282073.
[I 2024-12-04 20:59:31,123] Trial 2497 finished with value: 0.35921126239217294 and parameters: {'kernel_type': 'Matern', 'length_scale': 64518.48474756449, 'noise_level': 0.000981676982836985, 'constant_value': 925.6973413928039, 'nu': 0.5}. Best is trial 1997 with value: 0.359156695282073.
[I 2024-12-04 20:59:35,157] Trial 2499 finished with value: 1.062416117551836 and parameters: {'kernel_type': 'RBF', 'length_scale': 3819.4579570312744, 'noise_level': 0.007776785149519644, 'constant_value': 20852.55422742213, 'nu': 0.5}. Best is trial 1997 with value: 0.359156695282073.
