[I 2024-12-04 15:13:36,509] Trial 1799 finished with value: 0.4883034112515933 and parameters: {'kernel_type': 'Matern', 'length_scale': 62735.76368957268, 'noise_level': 0.015985976954373107, 'constant_value': 93133.8689469836, 'nu': 0.5}. Best is trial 386 with value: 0.4872991004520934.
[I 2024-12-04 15:13:37,108] Trial 1792 finished with value: 0.48830341825180096 and parameters: {'kernel_type': 'Matern', 'length_scale': 62.349666700791836, 'noise_level': 0.8699020433375555, 'constant_value': 842.7556309642606, 'nu': 0.5}. Best is trial 386 with value: 0.4872991004520934.
[I 2024-12-04 15:13:37,949] Trial 1808 finished with value: 1.2613979515073737 and parameters: {'kernel_type': 'RBF', 'length_scale': 143.9498906140341, 'noise_level': 6.300616030586239e-08, 'constant_value': 4.556894086328985e-05, 'nu': 1.5}. Best is trial 386 with value: 0.4872991004520934.
[I 2024-12-04 15:13:38,176] Trial 1790 finished with value: 1.2401112325615353 and parameters: {'kernel_type': 'Matern', 'length_scale': 335.7124973773053, 'noise_level': 0.02601162297290916, 'constant_value': 0.10203203671492812, 'nu': 0.5}. Best is trial 386 with value: 0.4872991004520934.
[I 2024-12-04 15:13:38,905] Trial 1818 finished with value: 1.2614547953941475 and parameters: {'kernel_type': 'Matern', 'length_scale': 88787.64067801049, 'noise_level': 1.856538931969905e-05, 'constant_value': 67029.47064825112, 'nu': 0.5}. Best is trial 386 with value: 0.4872991004520934.
[I 2024-12-04 15:13:38,990] Trial 1814 finished with value: 0.4883034169876548 and parameters: {'kernel_type': 'Matern', 'length_scale': 1944.9790657345302, 'noise_level': 0.8329517709712805, 'constant_value': 25.592196648625652, 'nu': 0.5}. Best is trial 386 with value: 0.4872991004520934.
[I 2024-12-04 15:13:39,818] Trial 1794 finished with value: 1.2401112326098718 and parameters: {'kernel_type': 'Matern', 'length_scale': 71392.91617904877, 'noise_level': 0.01343120562987678, 'constant_value': 0.27751189545870625, 'nu': 0.5}. Best is trial 386 with value: 0.4872991004520934.
[I 2024-12-04 15:13:40,105] Trial 1811 finished with value: 0.4883034189736356 and parameters: {'kernel_type': 'Matern', 'length_scale': 64767.50719865769, 'noise_level': 0.49793068746392416, 'constant_value': 2981.4133683139885, 'nu': 0.5}. Best is trial 386 with value: 0.4872991004520934.
[I 2024-12-04 15:13:40,415] Trial 1810 finished with value: 0.4883034242395744 and parameters: {'kernel_type': 'Matern', 'length_scale': 1658.8168940308715, 'noise_level': 0.030310676227213378, 'constant_value': 1158.7716600780434, 'nu': 0.5}. Best is trial 386 with value: 0.4872991004520934.
[I 2024-12-04 15:13:40,428] Trial 1809 finished with value: 0.4883034219411862 and parameters: {'kernel_type': 'Matern', 'length_scale': 5870.109028329624, 'noise_level': 0.04887253444016671, 'constant_value': 16.797027962982472, 'nu': 0.5}. Best is trial 386 with value: 0.4872991004520934.
[I 2024-12-04 15:13:41,390] Trial 1813 finished with value: 0.48830352683059125 and parameters: {'kernel_type': 'Matern', 'length_scale': 28999.107405490304, 'noise_level': 0.6329596850387065, 'constant_value': 94125.50646582643, 'nu': 0.5}. Best is trial 386 with value: 0.4872991004520934.
[I 2024-12-04 15:13:41,549] Trial 1805 finished with value: 0.4883034975093326 and parameters: {'kernel_type': 'Matern', 'length_scale': 44.55040953986988, 'noise_level': 0.8323182159303096, 'constant_value': 0.40500393919946776, 'nu': 0.5}. Best is trial 386 with value: 0.4872991004520934.
[I 2024-12-04 15:13:41,931] Trial 1815 finished with value: 0.4883026465626562 and parameters: {'kernel_type': 'Matern', 'length_scale': 59116.58579892337, 'noise_level': 0.7752729798807171, 'constant_value': 66899.94798496264, 'nu': 0.5}. Best is trial 386 with value: 0.4872991004520934.
[I 2024-12-04 15:13:42,144] Trial 1819 finished with value: 0.48830346281686415 and parameters: {'kernel_type': 'Matern', 'length_scale': 1428.7513383961277, 'noise_level': 0.05286339686663652, 'constant_value': 5403.199752118767, 'nu': 0.5}. Best is trial 386 with value: 0.4872991004520934.
[I 2024-12-04 15:13:42,871] Trial 1806 finished with value: 0.4883038361144412 and parameters: {'kernel_type': 'Matern', 'length_scale': 58368.75032009042, 'noise_level': 0.9796413240136059, 'constant_value': 4.203728372905947, 'nu': 0.5}. Best is trial 386 with value: 0.4872991004520934.
[I 2024-12-04 15:13:43,049] Trial 1804 finished with value: 0.4883033761646192 and parameters: {'kernel_type': 'Matern', 'length_scale': 62507.69635075663, 'noise_level': 0.7330737586504512, 'constant_value': 818.3754487785274, 'nu': 0.5}. Best is trial 386 with value: 0.4872991004520934.
[I 2024-12-04 15:13:43,159] Trial 1823 finished with value: 1.2614543701822134 and parameters: {'kernel_type': 'Matern', 'length_scale': 1.621821818874145e-05, 'noise_level': 0.6607896720825818, 'constant_value': 3.416959397323883e-06, 'nu': 2.5}. Best is trial 386 with value: 0.4872991004520934.
[I 2024-12-04 15:13:43,638] Trial 1820 finished with value: 1.2401112300969312 and parameters: {'kernel_type': 'Matern', 'length_scale': 1492.6737288501313, 'noise_level': 0.015287752631560342, 'constant_value': 4.252764489988546, 'nu': 0.5}. Best is trial 386 with value: 0.4872991004520934.
[I 2024-12-04 15:13:44,017] Trial 1817 finished with value: 0.4883034260291072 and parameters: {'kernel_type': 'Matern', 'length_scale': 7005.994228597598, 'noise_level': 0.014573632722301751, 'constant_value': 115.60863097190165, 'nu': 0.5}. Best is trial 386 with value: 0.4872991004520934.
[I 2024-12-04 15:13:44,418] Trial 1824 finished with value: 0.4883034116424729 and parameters: {'kernel_type': 'Matern', 'length_scale': 66.45877626036373, 'noise_level': 0.07105202043401876, 'constant_value': 4938.0831771310795, 'nu': 0.5}. Best is trial 386 with value: 0.4872991004520934.
[I 2024-12-04 15:13:45,252] Trial 1807 finished with value: 1.2401112327909383 and parameters: {'kernel_type': 'Matern', 'length_scale': 0.003961050887509102, 'noise_level': 0.24864897155972632, 'constant_value': 0.1709827489194722, 'nu': 0.5}. Best is trial 386 with value: 0.4872991004520934.
[I 2024-12-04 15:13:48,449] Trial 1816 finished with value: 0.48830341912088177 and parameters: {'kernel_type': 'Matern', 'length_scale': 5404.364182613817, 'noise_level': 0.590023412213086, 'constant_value': 68901.46193819452, 'nu': 0.5}. Best is trial 386 with value: 0.4872991004520934.
[I 2024-12-04 15:13:48,450] Trial 1812 finished with value: 0.4883011360617432 and parameters: {'kernel_type': 'Matern', 'length_scale': 2615.0517579045854, 'noise_level': 0.005475718557896582, 'constant_value': 99996.38620576946, 'nu': 0.5}. Best is trial 386 with value: 0.4872991004520934.
[I 2024-12-04 15:13:48,767] Trial 1821 finished with value: 0.4883033776768199 and parameters: {'kernel_type': 'Matern', 'length_scale': 51.456007397372716, 'noise_level': 0.008362416153875443, 'constant_value': 5.43186419038536, 'nu': 0.5}. Best is trial 386 with value: 0.4872991004520934.
[I 2024-12-04 15:13:49,188] Trial 1822 finished with value: 0.4883034224667403 and parameters: {'kernel_type': 'Matern', 'length_scale': 4.780053903187443, 'noise_level': 0.01899687356178199, 'constant_value': 0.26194025393782283, 'nu': 0.5}. Best is trial 386 with value: 0.4872991004520934.
[I 2024-12-04 15:13:50,026] Trial 1828 finished with value: 1.2401112325819459 and parameters: {'kernel_type': 'Matern', 'length_scale': 36252.017849737145, 'noise_level': 1.1459453266838591e-05, 'constant_value': 33.06949059226177, 'nu': 1.5}. Best is trial 386 with value: 0.4872991004520934.
[I 2024-12-04 15:13:50,289] Trial 1829 finished with value: 1.261454795394147 and parameters: {'kernel_type': 'Matern', 'length_scale': 39277.57342597679, 'noise_level': 0.028463993827816333, 'constant_value': 85864.51778301259, 'nu': 0.5}. Best is trial 386 with value: 0.4872991004520934.
[I 2024-12-04 15:13:52,520] Trial 1830 finished with value: 0.4883035055126745 and parameters: {'kernel_type': 'Matern', 'length_scale': 90310.5097359, 'noise_level': 0.5221728030594747, 'constant_value': 37948.92249790517, 'nu': 0.5}. Best is trial 386 with value: 0.4872991004520934.
[I 2024-12-04 15:13:53,740] Trial 1832 finished with value: 0.4883034166453545 and parameters: {'kernel_type': 'Matern', 'length_scale': 85480.12409936363, 'noise_level': 0.25450857570991603, 'constant_value': 2040.293274022694, 'nu': 0.5}. Best is trial 386 with value: 0.4872991004520934.
[I 2024-12-04 15:13:53,744] Trial 1843 finished with value: 0.48830349446210874 and parameters: {'kernel_type': 'Matern', 'length_scale': 204.9145494041908, 'noise_level': 0.0002595159829778444, 'constant_value': 21624.650619318872, 'nu': 0.5}. Best is trial 386 with value: 0.4872991004520934.
[I 2024-12-04 15:13:54,653] Trial 1825 finished with value: 0.4883034146956812 and parameters: {'kernel_type': 'Matern', 'length_scale': 46920.27973991304, 'noise_level': 0.9481838647810175, 'constant_value': 12219.12496433861, 'nu': 0.5}. Best is trial 386 with value: 0.4872991004520934.
[I 2024-12-04 15:13:55,382] Trial 1826 finished with value: 1.240111232500175 and parameters: {'kernel_type': 'RBF', 'length_scale': 1055.3876818237327, 'noise_level': 9.695484248267518e-08, 'constant_value': 14.579688654883693, 'nu': 2.5}. Best is trial 386 with value: 0.4872991004520934.
[I 2024-12-04 15:13:55,690] Trial 1827 finished with value: 0.4883029942040053 and parameters: {'kernel_type': 'Matern', 'length_scale': 50503.79216287041, 'noise_level': 0.1467999006811409, 'constant_value': 4008.133351238222, 'nu': 0.5}. Best is trial 386 with value: 0.4872991004520934.
[I 2024-12-04 15:13:56,985] Trial 1837 finished with value: 0.48830341696700486 and parameters: {'kernel_type': 'Matern', 'length_scale': 93732.23065410437, 'noise_level': 0.17681419646657154, 'constant_value': 12482.289992599483, 'nu': 0.5}. Best is trial 386 with value: 0.4872991004520934.
[I 2024-12-04 15:13:57,814] Trial 1831 finished with value: 0.48830347913199185 and parameters: {'kernel_type': 'Matern', 'length_scale': 82398.42707557107, 'noise_level': 0.3308252300902323, 'constant_value': 85061.96501735543, 'nu': 0.5}. Best is trial 386 with value: 0.4872991004520934.
[I 2024-12-04 15:13:58,836] Trial 1836 finished with value: 0.48830342198332205 and parameters: {'kernel_type': 'Matern', 'length_scale': 16290.947554112503, 'noise_level': 0.5448398134628344, 'constant_value': 96215.20500433743, 'nu': 0.5}. Best is trial 386 with value: 0.4872991004520934.
[I 2024-12-04 15:13:59,464] Trial 1833 finished with value: 0.4883034104990722 and parameters: {'kernel_type': 'Matern', 'length_scale': 2456.888668064039, 'noise_level': 0.0002789281505840408, 'constant_value': 8770.761726735658, 'nu': 0.5}. Best is trial 386 with value: 0.4872991004520934.
[I 2024-12-04 15:13:59,992] Trial 1841 finished with value: 1.261454795394147 and parameters: {'kernel_type': 'Matern', 'length_scale': 3419.591957585625, 'noise_level': 0.02816326260077129, 'constant_value': 86792.57314629391, 'nu': 0.5}. Best is trial 386 with value: 0.4872991004520934.
[I 2024-12-04 15:14:00,038] Trial 1842 finished with value: 0.48830341851970455 and parameters: {'kernel_type': 'Matern', 'length_scale': 80764.37178676252, 'noise_level': 0.9281433929599189, 'constant_value': 29233.044625636183, 'nu': 0.5}. Best is trial 386 with value: 0.4872991004520934.
[I 2024-12-04 15:14:01,028] Trial 1847 finished with value: 0.4883034155431095 and parameters: {'kernel_type': 'Matern', 'length_scale': 71450.27345152335, 'noise_level': 0.03743459722729041, 'constant_value': 846.7234292292153, 'nu': 0.5}. Best is trial 386 with value: 0.4872991004520934.
[I 2024-12-04 15:14:01,158] Trial 1839 finished with value: 0.4883023908116769 and parameters: {'kernel_type': 'Matern', 'length_scale': 67093.46187783954, 'noise_level': 0.9135068120798984, 'constant_value': 69751.81682034607, 'nu': 0.5}. Best is trial 386 with value: 0.4872991004520934.
[I 2024-12-04 15:14:01,233] Trial 1838 finished with value: 1.26145479763525 and parameters: {'kernel_type': 'RBF', 'length_scale': 95534.5621275772, 'noise_level': 0.7664771183953348, 'constant_value': 5.420172409739362, 'nu': 0.5}. Best is trial 386 with value: 0.4872991004520934.
[I 2024-12-04 15:14:01,289] Trial 1834 finished with value: 0.48830341881061645 and parameters: {'kernel_type': 'Matern', 'length_scale': 75.3180626831833, 'noise_level': 0.9691947784352721, 'constant_value': 69848.13136705455, 'nu': 0.5}. Best is trial 386 with value: 0.4872991004520934.
[I 2024-12-04 15:14:02,205] Trial 1848 finished with value: 0.48830324093881117 and parameters: {'kernel_type': 'Matern', 'length_scale': 1769.198889610136, 'noise_level': 0.0003489424285301216, 'constant_value': 46545.54703374599, 'nu': 0.5}. Best is trial 386 with value: 0.4872991004520934.
[I 2024-12-04 15:14:02,938] Trial 1840 finished with value: 1.2614547971545644 and parameters: {'kernel_type': 'Matern', 'length_scale': 801.3247976902926, 'noise_level': 0.9757223896155844, 'constant_value': 0.021887846026845056, 'nu': 1.5}. Best is trial 386 with value: 0.4872991004520934.
[I 2024-12-04 15:14:02,951] Trial 1835 finished with value: 1.2401112293934942 and parameters: {'kernel_type': 'Matern', 'length_scale': 386.19832203243425, 'noise_level': 0.0001610551915214503, 'constant_value': 0.0005623113218674952, 'nu': 0.5}. Best is trial 386 with value: 0.4872991004520934.
[I 2024-12-04 15:14:03,831] Trial 1846 finished with value: 0.4883034187733647 and parameters: {'kernel_type': 'Matern', 'length_scale': 90432.62602430437, 'noise_level': 0.7007774875416841, 'constant_value': 2730.444073230134, 'nu': 0.5}. Best is trial 386 with value: 0.4872991004520934.
[I 2024-12-04 15:14:04,629] Trial 1851 finished with value: 0.4883034446844818 and parameters: {'kernel_type': 'Matern', 'length_scale': 51805.29708754473, 'noise_level': 0.773104479433307, 'constant_value': 99174.33492972028, 'nu': 0.5}. Best is trial 386 with value: 0.4872991004520934.
[I 2024-12-04 15:14:04,822] Trial 1850 finished with value: 1.2614543634580855 and parameters: {'kernel_type': 'RBF', 'length_scale': 1.3503255350961786e-05, 'noise_level': 0.12260324786950166, 'constant_value': 5.9840661314067385e-06, 'nu': 2.5}. Best is trial 386 with value: 0.4872991004520934.
[I 2024-12-04 15:14:04,851] Trial 1852 finished with value: 1.2614343651316078 and parameters: {'kernel_type': 'RBF', 'length_scale': 3928.896195421145, 'noise_level': 2.9061287430745697e-05, 'constant_value': 5.50813365282272e-06, 'nu': 2.5}. Best is trial 386 with value: 0.4872991004520934.
[I 2024-12-04 15:14:05,075] Trial 1844 finished with value: 1.261454370202825 and parameters: {'kernel_type': 'Matern', 'length_scale': 1.5226219426813702e-05, 'noise_level': 2.8586341807562415e-05, 'constant_value': 420.8230017808465, 'nu': 2.5}. Best is trial 386 with value: 0.4872991004520934.
[I 2024-12-04 15:14:05,167] Trial 1849 finished with value: 0.48830341884351464 and parameters: {'kernel_type': 'Matern', 'length_scale': 71224.39774423215, 'noise_level': 0.9693454109175795, 'constant_value': 43.53819926634224, 'nu': 0.5}. Best is trial 386 with value: 0.4872991004520934.
[I 2024-12-04 15:14:06,147] Trial 1857 finished with value: 0.4883034138917637 and parameters: {'kernel_type': 'Matern', 'length_scale': 867.5583840793461, 'noise_level': 0.22946999886836614, 'constant_value': 99153.56266148185, 'nu': 0.5}. Best is trial 386 with value: 0.4872991004520934.
[I 2024-12-04 15:14:07,055] Trial 1855 finished with value: 0.4883034221913183 and parameters: {'kernel_type': 'Matern', 'length_scale': 12712.940481476306, 'noise_level': 0.39465896189601785, 'constant_value': 40650.01163577546, 'nu': 0.5}. Best is trial 386 with value: 0.4872991004520934.
[I 2024-12-04 15:14:07,135] Trial 1853 finished with value: 0.48830341948819533 and parameters: {'kernel_type': 'Matern', 'length_scale': 23831.911844625603, 'noise_level': 0.6800928299808928, 'constant_value': 2834.8279965957845, 'nu': 0.5}. Best is trial 386 with value: 0.4872991004520934.
[I 2024-12-04 15:14:10,388] Trial 1845 finished with value: 1.2401112325807264 and parameters: {'kernel_type': 'Matern', 'length_scale': 2281.9138074389325, 'noise_level': 0.016752737871525838, 'constant_value': 1087.7810275699185, 'nu': 2.5}. Best is trial 386 with value: 0.4872991004520934.
[I 2024-12-04 15:14:11,501] Trial 1856 finished with value: 1.2614547976352386 and parameters: {'kernel_type': 'Matern', 'length_scale': 52906.18456692974, 'noise_level': 0.8291638636065235, 'constant_value': 4.357392157461467, 'nu': 1.5}. Best is trial 386 with value: 0.4872991004520934.
[I 2024-12-04 15:14:11,659] Trial 1854 finished with value: 1.2401112325714043 and parameters: {'kernel_type': 'Matern', 'length_scale': 93052.38995001327, 'noise_level': 0.017517664774596535, 'constant_value': 120.27357444141009, 'nu': 0.5}. Best is trial 386 with value: 0.4872991004520934.
[I 2024-12-04 15:14:12,611] Trial 1865 finished with value: 1.2401112325798453 and parameters: {'kernel_type': 'RBF', 'length_scale': 10.895722181309376, 'noise_level': 9.711826816792057e-10, 'constant_value': 17323.30302646724, 'nu': 2.5}. Best is trial 386 with value: 0.4872991004520934.
[I 2024-12-04 15:14:12,922] Trial 1862 finished with value: 0.48830341991209747 and parameters: {'kernel_type': 'Matern', 'length_scale': 2454.2684525387067, 'noise_level': 0.31531246946867114, 'constant_value': 94904.58208751601, 'nu': 0.5}. Best is trial 386 with value: 0.4872991004520934.
[I 2024-12-04 15:14:14,983] Trial 1866 finished with value: 0.5273054031553569 and parameters: {'kernel_type': 'Matern', 'length_scale': 843.2040655374153, 'noise_level': 0.3521238051662031, 'constant_value': 87783.41262947585, 'nu': 1.5}. Best is trial 386 with value: 0.4872991004520934.
[I 2024-12-04 15:14:14,987] Trial 1867 finished with value: 0.4883034189086352 and parameters: {'kernel_type': 'Matern', 'length_scale': 3454.653616802593, 'noise_level': 0.9911818440628155, 'constant_value': 10.694580483356601, 'nu': 0.5}. Best is trial 386 with value: 0.4872991004520934.
[I 2024-12-04 15:14:16,103] Trial 1861 finished with value: 0.48830340561009333 and parameters: {'kernel_type': 'Matern', 'length_scale': 38062.328870698046, 'noise_level': 0.5913002099482388, 'constant_value': 52100.72671178429, 'nu': 0.5}. Best is trial 386 with value: 0.4872991004520934.
[I 2024-12-04 15:14:16,677] Trial 1864 finished with value: 0.4883034143983689 and parameters: {'kernel_type': 'Matern', 'length_scale': 86591.01941341697, 'noise_level': 0.063897306886093, 'constant_value': 79084.15392354438, 'nu': 0.5}. Best is trial 386 with value: 0.4872991004520934.
[I 2024-12-04 15:14:17,790] Trial 1858 finished with value: 0.488303732525721 and parameters: {'kernel_type': 'Matern', 'length_scale': 89604.92780186335, 'noise_level': 0.377304537713311, 'constant_value': 2955.543419621025, 'nu': 0.5}. Best is trial 386 with value: 0.4872991004520934.
[I 2024-12-04 15:14:17,795] Trial 1863 finished with value: 0.48830342327546883 and parameters: {'kernel_type': 'Matern', 'length_scale': 4368.021668967515, 'noise_level': 0.039105903892628684, 'constant_value': 1523.2008402835286, 'nu': 0.5}. Best is trial 386 with value: 0.4872991004520934.
[I 2024-12-04 15:14:20,326] Trial 1860 finished with value: 0.4883034167528428 and parameters: {'kernel_type': 'Matern', 'length_scale': 17369.515110125652, 'noise_level': 0.8338506297329993, 'constant_value': 1396.0295131603511, 'nu': 0.5}. Best is trial 386 with value: 0.4872991004520934.
[I 2024-12-04 15:14:20,438] Trial 1869 finished with value: 0.4883034147664549 and parameters: {'kernel_type': 'Matern', 'length_scale': 66417.10383257503, 'noise_level': 0.86667296748637, 'constant_value': 8913.691927843785, 'nu': 0.5}. Best is trial 386 with value: 0.4872991004520934.
[I 2024-12-04 15:14:20,829] Trial 1870 finished with value: 0.4883034189783406 and parameters: {'kernel_type': 'Matern', 'length_scale': 3116.0727848323495, 'noise_level': 0.6123968673464968, 'constant_value': 93867.78424506805, 'nu': 0.5}. Best is trial 386 with value: 0.4872991004520934.
[I 2024-12-04 15:14:21,473] Trial 1873 finished with value: 0.6443852474995109 and parameters: {'kernel_type': 'RBF', 'length_scale': 54583.72467251108, 'noise_level': 0.30968018249411317, 'constant_value': 91497.49990436688, 'nu': 0.5}. Best is trial 386 with value: 0.4872991004520934.
[I 2024-12-04 15:14:21,563] Trial 1868 finished with value: 0.5273053681314273 and parameters: {'kernel_type': 'Matern', 'length_scale': 10.070472560881276, 'noise_level': 0.3958479053180336, 'constant_value': 7.392686322156588e-07, 'nu': 1.5}. Best is trial 386 with value: 0.4872991004520934.
[I 2024-12-04 15:14:21,755] Trial 1875 finished with value: 0.48830339813016216 and parameters: {'kernel_type': 'Matern', 'length_scale': 1295.816381607969, 'noise_level': 0.1205940959239729, 'constant_value': 82491.17831728946, 'nu': 0.5}. Best is trial 386 with value: 0.4872991004520934.
[I 2024-12-04 15:14:22,598] Trial 1874 finished with value: 0.48830342331777965 and parameters: {'kernel_type': 'Matern', 'length_scale': 19.6810058152152, 'noise_level': 0.0042813922451298055, 'constant_value': 68569.87134459893, 'nu': 0.5}. Best is trial 386 with value: 0.4872991004520934.
[I 2024-12-04 15:14:22,949] Trial 1880 finished with value: 0.48830341347373235 and parameters: {'kernel_type': 'Matern', 'length_scale': 68158.08164702609, 'noise_level': 0.741009232890014, 'constant_value': 70026.7760847802, 'nu': 0.5}. Best is trial 386 with value: 0.4872991004520934.
[I 2024-12-04 15:14:23,016] Trial 1876 finished with value: 0.4883034210902332 and parameters: {'kernel_type': 'Matern', 'length_scale': 4323.707947147192, 'noise_level': 0.7680178183692274, 'constant_value': 155.72825453923377, 'nu': 0.5}. Best is trial 386 with value: 0.4872991004520934.
