[I 2024-12-03 18:47:29,608] Trial 1448 finished with value: 0.5635823216301982 and parameters: {'kernel': 'rbf', 'C': 97.71093850143608, 'gamma': 0.03556610536032643, 'epsilon': 0.05032578375202692}. Best is trial 1119 with value: 0.4485361816812923.
[I 2024-12-03 18:47:29,638] Trial 1441 finished with value: 0.8280335588456205 and parameters: {'kernel': 'rbf', 'C': 0.5178409485934856, 'gamma': 0.005142142336522466, 'epsilon': 0.0072965373414640294}. Best is trial 1119 with value: 0.4485361816812923.
[I 2024-12-03 18:47:29,936] Trial 1438 finished with value: 0.4678826305140707 and parameters: {'kernel': 'rbf', 'C': 96.42581885218924, 'gamma': 0.009367935191322172, 'epsilon': 0.03688050965433201}. Best is trial 1119 with value: 0.4485361816812923.
[I 2024-12-03 18:47:30,162] Trial 1453 finished with value: 0.45213433623618676 and parameters: {'kernel': 'rbf', 'C': 87.92916560007721, 'gamma': 0.011608006733042577, 'epsilon': 0.08139640770554879}. Best is trial 1119 with value: 0.4485361816812923.
[I 2024-12-03 18:47:30,347] Trial 1449 finished with value: 0.488065335240115 and parameters: {'kernel': 'rbf', 'C': 19.585844527917484, 'gamma': 0.01695693576797582, 'epsilon': 0.0830192246563286}. Best is trial 1119 with value: 0.4485361816812923.
[I 2024-12-03 18:47:30,897] Trial 1451 finished with value: 0.507723551903191 and parameters: {'kernel': 'rbf', 'C': 98.27877305903513, 'gamma': 0.01985325801574869, 'epsilon': 0.13675478997288792}. Best is trial 1119 with value: 0.4485361816812923.
[I 2024-12-03 18:47:30,974] Trial 1445 finished with value: 1.3181668577852026 and parameters: {'kernel': 'poly', 'C': 0.005324729973131488, 'gamma': 0.0002636138668623131, 'epsilon': 0.5601116861159932}. Best is trial 1119 with value: 0.4485361816812923.
[I 2024-12-03 18:47:31,263] Trial 1432 finished with value: 0.5444002390073462 and parameters: {'kernel': 'rbf', 'C': 89.57689127520709, 'gamma': 0.032111642994765335, 'epsilon': 0.08180084868522038}. Best is trial 1119 with value: 0.4485361816812923.
[I 2024-12-03 18:47:31,275] Trial 1444 finished with value: 0.5246204547005997 and parameters: {'kernel': 'rbf', 'C': 25.99325365945008, 'gamma': 0.00882710220377312, 'epsilon': 0.027236765183004257}. Best is trial 1119 with value: 0.4485361816812923.
[I 2024-12-03 18:47:31,717] Trial 1443 finished with value: 0.5719262077263999 and parameters: {'kernel': 'rbf', 'C': 17.96148532872413, 'gamma': 0.005266277241523262, 'epsilon': 0.1625881796411712}. Best is trial 1119 with value: 0.4485361816812923.
[I 2024-12-03 18:47:32,605] Trial 1457 finished with value: 0.4945672742442221 and parameters: {'kernel': 'rbf', 'C': 22.89376924785087, 'gamma': 0.014549601668335133, 'epsilon': 0.026852540103699186}. Best is trial 1119 with value: 0.4485361816812923.
[I 2024-12-03 18:47:32,715] Trial 1450 finished with value: 0.5626709147680994 and parameters: {'kernel': 'rbf', 'C': 96.40851203065974, 'gamma': 0.03658749247709565, 'epsilon': 0.08921863044271172}. Best is trial 1119 with value: 0.4485361816812923.
[I 2024-12-03 18:47:32,718] Trial 1447 finished with value: 0.46679786277173724 and parameters: {'kernel': 'rbf', 'C': 32.110451541059895, 'gamma': 0.01862018262148871, 'epsilon': 0.017325662245504015}. Best is trial 1119 with value: 0.4485361816812923.
[I 2024-12-03 18:47:32,928] Trial 1461 finished with value: 0.5288647547800318 and parameters: {'kernel': 'rbf', 'C': 18.258667274274607, 'gamma': 0.011663330061858842, 'epsilon': 0.1842768532665981}. Best is trial 1119 with value: 0.4485361816812923.
[I 2024-12-03 18:47:33,843] Trial 1467 finished with value: 0.6658250981149485 and parameters: {'kernel': 'rbf', 'C': 4.232103270771844, 'gamma': 0.007938236936488008, 'epsilon': 0.11580308805430219}. Best is trial 1119 with value: 0.4485361816812923.
[I 2024-12-03 18:47:33,850] Trial 1456 finished with value: 0.4685375237981878 and parameters: {'kernel': 'rbf', 'C': 18.734261611633517, 'gamma': 0.02994225341432733, 'epsilon': 0.05041341484529209}. Best is trial 1119 with value: 0.4485361816812923.
[I 2024-12-03 18:47:33,860] Trial 1458 finished with value: 0.5557824290839098 and parameters: {'kernel': 'rbf', 'C': 24.349974516871107, 'gamma': 0.005364081696589947, 'epsilon': 0.0659276827691743}. Best is trial 1119 with value: 0.4485361816812923.
[I 2024-12-03 18:47:34,357] Trial 1454 finished with value: 0.5611394010702733 and parameters: {'kernel': 'rbf', 'C': 96.9108115162098, 'gamma': 0.0015942730252571846, 'epsilon': 0.12487708985197285}. Best is trial 1119 with value: 0.4485361816812923.
[I 2024-12-03 18:47:35,189] Trial 1452 finished with value: 0.6499013890264603 and parameters: {'kernel': 'rbf', 'C': 97.35614259499204, 'gamma': 0.05411949870384134, 'epsilon': 0.06099985123388956}. Best is trial 1119 with value: 0.4485361816812923.
[I 2024-12-03 18:47:35,606] Trial 1466 finished with value: 0.9018798510889207 and parameters: {'kernel': 'poly', 'C': 1.6503471589647116, 'gamma': 0.03790802195628997, 'epsilon': 0.0012605600418419793}. Best is trial 1119 with value: 0.4485361816812923.
[I 2024-12-03 18:47:35,809] Trial 1462 finished with value: 0.4556561447891589 and parameters: {'kernel': 'rbf', 'C': 99.4588541473808, 'gamma': 0.015272633945605253, 'epsilon': 0.08385942517185964}. Best is trial 1119 with value: 0.4485361816812923.
[I 2024-12-03 18:47:36,459] Trial 1470 finished with value: 0.46140435407321134 and parameters: {'kernel': 'rbf', 'C': 95.41030726192784, 'gamma': 0.01132039348498114, 'epsilon': 0.02580472115812994}. Best is trial 1119 with value: 0.4485361816812923.
[I 2024-12-03 18:47:36,757] Trial 1472 finished with value: 0.49086132480139844 and parameters: {'kernel': 'rbf', 'C': 90.66609572906502, 'gamma': 0.006414675095668123, 'epsilon': 0.037000768224550576}. Best is trial 1119 with value: 0.4485361816812923.
[I 2024-12-03 18:47:36,828] Trial 1474 finished with value: 0.4603169236419008 and parameters: {'kernel': 'rbf', 'C': 99.22621232437716, 'gamma': 0.017808078474445942, 'epsilon': 0.08026542607094905}. Best is trial 1119 with value: 0.4485361816812923.
[I 2024-12-03 18:47:37,107] Trial 1464 finished with value: 0.5339051125323029 and parameters: {'kernel': 'rbf', 'C': 17.18203409759003, 'gamma': 0.00976715451522829, 'epsilon': 0.11854163175385803}. Best is trial 1119 with value: 0.4485361816812923.
[I 2024-12-03 18:47:37,649] Trial 1471 finished with value: 0.5915081760243622 and parameters: {'kernel': 'linear', 'C': 0.1993691180835738, 'gamma': 0.05299201260742923, 'epsilon': 0.019273415483431037}. Best is trial 1119 with value: 0.4485361816812923.
[I 2024-12-03 18:47:37,743] Trial 1455 finished with value: 0.4588888047963547 and parameters: {'kernel': 'rbf', 'C': 97.45886294860543, 'gamma': 0.017676785150296144, 'epsilon': 0.0405143240414954}. Best is trial 1119 with value: 0.4485361816812923.
[I 2024-12-03 18:47:38,057] Trial 1476 finished with value: 0.5783847245655269 and parameters: {'kernel': 'rbf', 'C': 19.868304640873195, 'gamma': 0.004353756324889261, 'epsilon': 0.02633125191639703}. Best is trial 1119 with value: 0.4485361816812923.
[I 2024-12-03 18:47:38,102] Trial 1479 finished with value: 0.4808351996680308 and parameters: {'kernel': 'rbf', 'C': 85.9724877563666, 'gamma': 0.017496449722309737, 'epsilon': 0.14320175881358724}. Best is trial 1119 with value: 0.4485361816812923.
[I 2024-12-03 18:47:38,525] Trial 1465 finished with value: 0.5404058829615211 and parameters: {'kernel': 'rbf', 'C': 86.75907949474028, 'gamma': 0.02704620089969751, 'epsilon': 0.2708597515830207}. Best is trial 1119 with value: 0.4485361816812923.
[I 2024-12-03 18:47:38,985] Trial 1460 finished with value: 0.581466566928428 and parameters: {'kernel': 'rbf', 'C': 25.44786374629478, 'gamma': 0.0031516436699018193, 'epsilon': 0.09968476528202755}. Best is trial 1119 with value: 0.4485361816812923.
[I 2024-12-03 18:47:38,987] Trial 1473 finished with value: 0.7517735672020665 and parameters: {'kernel': 'poly', 'C': 22.40784274498219, 'gamma': 0.060132190359805555, 'epsilon': 0.035508681118157664}. Best is trial 1119 with value: 0.4485361816812923.
[I 2024-12-03 18:47:39,111] Trial 1463 finished with value: 0.6116403553805742 and parameters: {'kernel': 'rbf', 'C': 21.475310336253308, 'gamma': 0.19351193895797053, 'epsilon': 0.04805619635115129}. Best is trial 1119 with value: 0.4485361816812923.
[I 2024-12-03 18:47:39,332] Trial 1468 finished with value: 0.5119259991772626 and parameters: {'kernel': 'rbf', 'C': 96.96581209504241, 'gamma': 0.00478691945835854, 'epsilon': 0.12037612157836271}. Best is trial 1119 with value: 0.4485361816812923.
[I 2024-12-03 18:47:39,774] Trial 1459 finished with value: 0.5185278443815523 and parameters: {'kernel': 'rbf', 'C': 85.99088146376485, 'gamma': 0.0041276688062081394, 'epsilon': 0.0600446887840057}. Best is trial 1119 with value: 0.4485361816812923.
[I 2024-12-03 18:47:40,363] Trial 1475 finished with value: 0.5336934130025331 and parameters: {'kernel': 'rbf', 'C': 17.07761490413743, 'gamma': 0.010220148358326261, 'epsilon': 0.06905598309004049}. Best is trial 1119 with value: 0.4485361816812923.
[I 2024-12-03 18:47:40,539] Trial 1481 finished with value: 0.47249537742631686 and parameters: {'kernel': 'rbf', 'C': 24.257741459470363, 'gamma': 0.03414914807924642, 'epsilon': 0.03744950617544239}. Best is trial 1119 with value: 0.4485361816812923.
[I 2024-12-03 18:47:41,415] Trial 1482 finished with value: 0.4586580086291481 and parameters: {'kernel': 'rbf', 'C': 99.10446757151486, 'gamma': 0.013204441635810672, 'epsilon': 0.02254112308753111}. Best is trial 1119 with value: 0.4485361816812923.
[I 2024-12-03 18:47:41,715] Trial 1480 finished with value: 0.562662561885403 and parameters: {'kernel': 'rbf', 'C': 18.538658857931047, 'gamma': 0.005346984033521229, 'epsilon': 0.0653687724426447}. Best is trial 1119 with value: 0.4485361816812923.
[I 2024-12-03 18:47:41,716] Trial 1477 finished with value: 0.5585830318779461 and parameters: {'kernel': 'linear', 'C': 26.41923428927319, 'gamma': 0.018651983452127194, 'epsilon': 0.02171830922099905}. Best is trial 1119 with value: 0.4485361816812923.
[I 2024-12-03 18:47:41,726] Trial 1469 finished with value: 0.5802847859327998 and parameters: {'kernel': 'rbf', 'C': 99.38886064192506, 'gamma': 0.03379460866065536, 'epsilon': 0.2462194651268211}. Best is trial 1119 with value: 0.4485361816812923.
[I 2024-12-03 18:47:41,742] Trial 1487 finished with value: 0.599828986345228 and parameters: {'kernel': 'rbf', 'C': 17.4962179123326, 'gamma': 0.09911992649562354, 'epsilon': 0.09372747238323229}. Best is trial 1119 with value: 0.4485361816812923.
[I 2024-12-03 18:47:42,994] Trial 1485 finished with value: 0.5207265783030579 and parameters: {'kernel': 'rbf', 'C': 92.37582080499205, 'gamma': 0.004038600390481895, 'epsilon': 0.03648165537047049}. Best is trial 1119 with value: 0.4485361816812923.
[I 2024-12-03 18:47:43,106] Trial 1488 finished with value: 9.759756421201606 and parameters: {'kernel': 'sigmoid', 'C': 4.053479698622271, 'gamma': 0.016976270407418753, 'epsilon': 0.699477357082696}. Best is trial 1119 with value: 0.4485361816812923.
[I 2024-12-03 18:47:43,302] Trial 1478 finished with value: 0.46729202711249135 and parameters: {'kernel': 'rbf', 'C': 95.96918976012392, 'gamma': 0.00881966047108608, 'epsilon': 0.07656295162784527}. Best is trial 1119 with value: 0.4485361816812923.
[I 2024-12-03 18:47:43,551] Trial 1484 finished with value: 0.47653117170968046 and parameters: {'kernel': 'rbf', 'C': 17.476640738569543, 'gamma': 0.022025772979146402, 'epsilon': 0.16221492191029568}. Best is trial 1119 with value: 0.4485361816812923.
[I 2024-12-03 18:47:44,439] Trial 1483 finished with value: 0.6312090986852038 and parameters: {'kernel': 'rbf', 'C': 91.13533604781877, 'gamma': 0.052643309197689975, 'epsilon': 0.020239933162263236}. Best is trial 1119 with value: 0.4485361816812923.
[I 2024-12-03 18:47:44,809] Trial 1493 finished with value: 0.5897738026846098 and parameters: {'kernel': 'rbf', 'C': 2.9546304744067977, 'gamma': 0.022919696830102625, 'epsilon': 0.07538728711048032}. Best is trial 1119 with value: 0.4485361816812923.
[I 2024-12-03 18:47:44,892] Trial 1500 finished with value: 1.3737789262351783 and parameters: {'kernel': 'poly', 'C': 0.009853938222200691, 'gamma': 0.0004031453991673399, 'epsilon': 0.0024250746599817643}. Best is trial 1119 with value: 0.4485361816812923.
[I 2024-12-03 18:47:45,292] Trial 1486 finished with value: 0.5757157578560925 and parameters: {'kernel': 'rbf', 'C': 19.11771962435614, 'gamma': 0.00435699537928205, 'epsilon': 0.2616699812798459}. Best is trial 1119 with value: 0.4485361816812923.
[I 2024-12-03 18:47:45,764] Trial 1489 finished with value: 0.5613552329455788 and parameters: {'kernel': 'rbf', 'C': 89.45954390582044, 'gamma': 0.0039592659698495436, 'epsilon': 0.34325319359391865}. Best is trial 1119 with value: 0.4485361816812923.
[I 2024-12-03 18:47:45,793] Trial 1496 finished with value: 0.4900134427883398 and parameters: {'kernel': 'rbf', 'C': 99.05100437035372, 'gamma': 0.02363911512193459, 'epsilon': 0.06627682169475212}. Best is trial 1119 with value: 0.4485361816812923.
[I 2024-12-03 18:47:45,961] Trial 1490 finished with value: 0.4491658820487528 and parameters: {'kernel': 'rbf', 'C': 97.01922911912767, 'gamma': 0.014065608498476219, 'epsilon': 0.062094080765788796}. Best is trial 1119 with value: 0.4485361816812923.
[I 2024-12-03 18:47:46,115] Trial 1498 finished with value: 0.7758470363911456 and parameters: {'kernel': 'poly', 'C': 98.07133401858354, 'gamma': 0.03895906869785862, 'epsilon': 0.13628822699435597}. Best is trial 1119 with value: 0.4485361816812923.
[I 2024-12-03 18:47:46,316] Trial 1504 finished with value: 0.4768795782020482 and parameters: {'kernel': 'rbf', 'C': 19.81237035893072, 'gamma': 0.03392694110828511, 'epsilon': 0.0760946924693131}. Best is trial 1119 with value: 0.4485361816812923.
[I 2024-12-03 18:47:46,399] Trial 1501 finished with value: 0.5536682563030747 and parameters: {'kernel': 'rbf', 'C': 97.11115473757074, 'gamma': 0.0025820840929753805, 'epsilon': 0.04801741452246714}. Best is trial 1119 with value: 0.4485361816812923.
[I 2024-12-03 18:47:47,074] Trial 1495 finished with value: 0.4747164138712933 and parameters: {'kernel': 'rbf', 'C': 97.9699911172772, 'gamma': 0.00775909816993863, 'epsilon': 0.10001644280211824}. Best is trial 1119 with value: 0.4485361816812923.
[I 2024-12-03 18:47:47,441] Trial 1491 finished with value: 0.4710534564372085 and parameters: {'kernel': 'rbf', 'C': 19.690713773193902, 'gamma': 0.0249437913651582, 'epsilon': 0.09345621478383373}. Best is trial 1119 with value: 0.4485361816812923.
[I 2024-12-03 18:47:47,694] Trial 1508 finished with value: 0.5386444486658669 and parameters: {'kernel': 'rbf', 'C': 14.483613603015783, 'gamma': 0.010496827495825404, 'epsilon': 0.08742228704004136}. Best is trial 1119 with value: 0.4485361816812923.
[I 2024-12-03 18:47:48,004] Trial 1497 finished with value: 0.5169647106620353 and parameters: {'kernel': 'rbf', 'C': 96.46384138351905, 'gamma': 0.026316793518211517, 'epsilon': 0.08562440367023495}. Best is trial 1119 with value: 0.4485361816812923.
[I 2024-12-03 18:47:48,093] Trial 1492 finished with value: 0.4600515167653662 and parameters: {'kernel': 'rbf', 'C': 94.32937278009373, 'gamma': 0.01142020256849115, 'epsilon': 0.03034193096674406}. Best is trial 1119 with value: 0.4485361816812923.
[I 2024-12-03 18:47:48,723] Trial 1503 finished with value: 0.5398117780401955 and parameters: {'kernel': 'rbf', 'C': 22.24539824573891, 'gamma': 0.008241017646138242, 'epsilon': 0.017579208234438797}. Best is trial 1119 with value: 0.4485361816812923.
[I 2024-12-03 18:47:50,378] Trial 1506 finished with value: 0.6203356266059008 and parameters: {'kernel': 'rbf', 'C': 97.24599914615497, 'gamma': 0.08246197930245636, 'epsilon': 0.08501505376595303}. Best is trial 1119 with value: 0.4485361816812923.
[I 2024-12-03 18:47:50,400] Trial 1502 finished with value: 0.477791749805497 and parameters: {'kernel': 'rbf', 'C': 99.12694566818112, 'gamma': 0.022498535229271786, 'epsilon': 0.03522907328329317}. Best is trial 1119 with value: 0.4485361816812923.
[I 2024-12-03 18:47:50,640] Trial 1507 finished with value: 0.5318248698226035 and parameters: {'kernel': 'rbf', 'C': 87.43254218766398, 'gamma': 0.010336504563636198, 'epsilon': 0.33683641925497276}. Best is trial 1119 with value: 0.4485361816812923.
[I 2024-12-03 18:47:50,761] Trial 1505 finished with value: 99.69928768576918 and parameters: {'kernel': 'sigmoid', 'C': 91.14490558166801, 'gamma': 0.008948107944907548, 'epsilon': 0.09967107078184227}. Best is trial 1119 with value: 0.4485361816812923.
[I 2024-12-03 18:47:50,990] Trial 1499 finished with value: 0.5679224949386722 and parameters: {'kernel': 'linear', 'C': 16.855632000915147, 'gamma': 0.017551456774150827, 'epsilon': 0.10631257270164461}. Best is trial 1119 with value: 0.4485361816812923.
[I 2024-12-03 18:47:51,472] Trial 1518 finished with value: 0.7115554762326517 and parameters: {'kernel': 'rbf', 'C': 4.319545942761379, 'gamma': 0.005462735304210989, 'epsilon': 0.03009494709132304}. Best is trial 1119 with value: 0.4485361816812923.
[I 2024-12-03 18:47:52,127] Trial 1514 finished with value: 0.5389542775977276 and parameters: {'kernel': 'rbf', 'C': 18.863017895647147, 'gamma': 0.008778522393992298, 'epsilon': 0.15453569794068522}. Best is trial 1119 with value: 0.4485361816812923.
[I 2024-12-03 18:47:52,397] Trial 1510 finished with value: 0.47000037929884003 and parameters: {'kernel': 'rbf', 'C': 18.319973125743175, 'gamma': 0.032022739433370626, 'epsilon': 0.02354661506702693}. Best is trial 1119 with value: 0.4485361816812923.
[I 2024-12-03 18:47:52,753] Trial 1520 finished with value: 0.5498747629250803 and parameters: {'kernel': 'rbf', 'C': 29.429985501645003, 'gamma': 0.005120179628108053, 'epsilon': 0.10661955886959529}. Best is trial 1119 with value: 0.4485361816812923.
[I 2024-12-03 18:47:53,088] Trial 1516 finished with value: 0.45933098381876497 and parameters: {'kernel': 'rbf', 'C': 98.9776992934331, 'gamma': 0.018074483932969527, 'epsilon': 0.06297579055916333}. Best is trial 1119 with value: 0.4485361816812923.
[I 2024-12-03 18:47:53,343] Trial 1513 finished with value: 0.5103492558361126 and parameters: {'kernel': 'rbf', 'C': 17.670564126809808, 'gamma': 0.014003789577842285, 'epsilon': 0.044001563879641464}. Best is trial 1119 with value: 0.4485361816812923.
[I 2024-12-03 18:47:53,866] Trial 1512 finished with value: 0.89010195132762 and parameters: {'kernel': 'poly', 'C': 22.10236344082848, 'gamma': 0.01653093923046914, 'epsilon': 0.0722542137664379}. Best is trial 1119 with value: 0.4485361816812923.
[I 2024-12-03 18:47:53,950] Trial 1511 finished with value: 0.6400577255409694 and parameters: {'kernel': 'sigmoid', 'C': 82.66917547142586, 'gamma': 0.0011038151466870323, 'epsilon': 0.2585504222151191}. Best is trial 1119 with value: 0.4485361816812923.
[I 2024-12-03 18:47:53,951] Trial 1528 finished with value: 0.45537218198871515 and parameters: {'kernel': 'rbf', 'C': 97.31634129306339, 'gamma': 0.01097445907010474, 'epsilon': 0.0580097074432725}. Best is trial 1119 with value: 0.4485361816812923.
[I 2024-12-03 18:47:54,127] Trial 1519 finished with value: 1.2380636702814045 and parameters: {'kernel': 'rbf', 'C': 0.030102233659628167, 'gamma': 0.10320472238901675, 'epsilon': 0.004352873364347991}. Best is trial 1119 with value: 0.4485361816812923.
[I 2024-12-03 18:47:54,256] Trial 1494 finished with value: 0.48879517417826246 and parameters: {'kernel': 'rbf', 'C': 26.448572655514905, 'gamma': 0.013164530825712195, 'epsilon': 0.05629619661318254}. Best is trial 1119 with value: 0.4485361816812923.
[I 2024-12-03 18:47:54,766] Trial 1532 finished with value: 59.01873903986157 and parameters: {'kernel': 'sigmoid', 'C': 93.26634772508696, 'gamma': 0.006863889856296663, 'epsilon': 0.028876002411945018}. Best is trial 1119 with value: 0.4485361816812923.
[I 2024-12-03 18:47:55,229] Trial 1515 finished with value: 0.48944998308529003 and parameters: {'kernel': 'rbf', 'C': 89.37630859196743, 'gamma': 0.008174655857963021, 'epsilon': 0.17986615367013592}. Best is trial 1119 with value: 0.4485361816812923.
[I 2024-12-03 18:47:55,515] Trial 1517 finished with value: 0.5340371605970753 and parameters: {'kernel': 'rbf', 'C': 19.62449166349745, 'gamma': 0.009345590782822112, 'epsilon': 0.04921215324300518}. Best is trial 1119 with value: 0.4485361816812923.
[I 2024-12-03 18:47:56,247] Trial 1533 finished with value: 0.46252585478164565 and parameters: {'kernel': 'rbf', 'C': 88.94849520691288, 'gamma': 0.009535448904359187, 'epsilon': 0.13211472114326048}. Best is trial 1119 with value: 0.4485361816812923.
[I 2024-12-03 18:47:56,492] Trial 1523 finished with value: 0.5120326301001035 and parameters: {'kernel': 'rbf', 'C': 97.67510303784474, 'gamma': 0.004336628466040825, 'epsilon': 0.03381762819546418}. Best is trial 1119 with value: 0.4485361816812923.
[I 2024-12-03 18:47:56,588] Trial 1521 finished with value: 0.5794050725087556 and parameters: {'kernel': 'rbf', 'C': 99.97123794219478, 'gamma': 0.039485283064488556, 'epsilon': 0.036276387670798486}. Best is trial 1119 with value: 0.4485361816812923.
[I 2024-12-03 18:47:56,851] Trial 1524 finished with value: 0.5559348833721788 and parameters: {'kernel': 'rbf', 'C': 94.34579878681157, 'gamma': 0.002374849169551486, 'epsilon': 0.0745439384596031}. Best is trial 1119 with value: 0.4485361816812923.
[I 2024-12-03 18:47:57,821] Trial 1526 finished with value: 0.5532075093268797 and parameters: {'kernel': 'rbf', 'C': 15.138223052991865, 'gamma': 0.007828330684592941, 'epsilon': 0.05086322554121508}. Best is trial 1119 with value: 0.4485361816812923.
[I 2024-12-03 18:47:57,881] Trial 1530 finished with value: 0.6082521955862207 and parameters: {'kernel': 'rbf', 'C': 26.635691520374262, 'gamma': 0.002181905412410154, 'epsilon': 0.024104694218278325}. Best is trial 1119 with value: 0.4485361816812923.
