[I 2024-12-04 15:10:37,690] Trial 1398 finished with value: 0.484909841839496 and parameters: {'n_estimators': 1353, 'learning_rate': 0.0536318926054732, 'max_depth': 12, 'min_samples_split': 18, 'min_samples_leaf': 1, 'subsample': 0.8937615643952438, 'max_features': None}. Best is trial 603 with value: 0.45955205541891275.
[I 2024-12-04 15:10:38,295] Trial 1411 finished with value: 0.4731560786977583 and parameters: {'n_estimators': 1004, 'learning_rate': 0.07716235955675821, 'max_depth': 12, 'min_samples_split': 19, 'min_samples_leaf': 1, 'subsample': 0.99693081296084, 'max_features': None}. Best is trial 603 with value: 0.45955205541891275.
[I 2024-12-04 15:10:39,746] Trial 1409 finished with value: 0.650911437586067 and parameters: {'n_estimators': 1210, 'learning_rate': 0.0944154657833508, 'max_depth': 12, 'min_samples_split': 20, 'min_samples_leaf': 3, 'subsample': 0.9123896224559339, 'max_features': None}. Best is trial 603 with value: 0.45955205541891275.
[I 2024-12-04 15:10:42,778] Trial 1400 finished with value: 0.46874261075496015 and parameters: {'n_estimators': 1446, 'learning_rate': 0.07253443290125304, 'max_depth': 12, 'min_samples_split': 20, 'min_samples_leaf': 1, 'subsample': 0.9912304982855425, 'max_features': None}. Best is trial 603 with value: 0.45955205541891275.
[I 2024-12-04 15:10:43,067] Trial 1399 finished with value: 0.6166508394323112 and parameters: {'n_estimators': 1441, 'learning_rate': 0.03150734571867734, 'max_depth': 12, 'min_samples_split': 19, 'min_samples_leaf': 3, 'subsample': 0.9989785982723366, 'max_features': None}. Best is trial 603 with value: 0.45955205541891275.
[I 2024-12-04 15:10:43,818] Trial 1407 finished with value: 0.45837155910294247 and parameters: {'n_estimators': 1219, 'learning_rate': 0.0704783146049047, 'max_depth': 12, 'min_samples_split': 20, 'min_samples_leaf': 1, 'subsample': 0.9976511457001858, 'max_features': None}. Best is trial 1407 with value: 0.45837155910294247.
[I 2024-12-04 15:10:44,023] Trial 1417 finished with value: 0.4764437501693054 and parameters: {'n_estimators': 1096, 'learning_rate': 0.04986181987804984, 'max_depth': 10, 'min_samples_split': 20, 'min_samples_leaf': 1, 'subsample': 0.9213093762112854, 'max_features': None}. Best is trial 1407 with value: 0.45837155910294247.
[I 2024-12-04 15:10:44,235] Trial 1442 finished with value: 1.1539137978980678 and parameters: {'n_estimators': 109, 'learning_rate': 0.04135749681325392, 'max_depth': 5, 'min_samples_split': 2, 'min_samples_leaf': 6, 'subsample': 0.7862198059995208, 'max_features': 'log2'}. Best is trial 1407 with value: 0.45837155910294247.
[I 2024-12-04 15:10:44,332] Trial 1416 finished with value: 0.6332736299270956 and parameters: {'n_estimators': 1093, 'learning_rate': 0.09039100894400522, 'max_depth': 10, 'min_samples_split': 20, 'min_samples_leaf': 2, 'subsample': 0.997958405506293, 'max_features': None}. Best is trial 1407 with value: 0.45837155910294247.
[I 2024-12-04 15:10:46,254] Trial 1415 finished with value: 0.6644021748319296 and parameters: {'n_estimators': 1469, 'learning_rate': 0.07485492584200153, 'max_depth': 11, 'min_samples_split': 6, 'min_samples_leaf': 3, 'subsample': 0.9696009323431675, 'max_features': 'sqrt'}. Best is trial 1407 with value: 0.45837155910294247.
[I 2024-12-04 15:10:49,037] Trial 1419 finished with value: 0.4807299173278289 and parameters: {'n_estimators': 1157, 'learning_rate': 0.05343369969040684, 'max_depth': 12, 'min_samples_split': 20, 'min_samples_leaf': 1, 'subsample': 0.9962343389053394, 'max_features': None}. Best is trial 1407 with value: 0.45837155910294247.
[I 2024-12-04 15:10:50,172] Trial 1421 finished with value: 0.633043365218928 and parameters: {'n_estimators': 1112, 'learning_rate': 0.05275470863280738, 'max_depth': 11, 'min_samples_split': 20, 'min_samples_leaf': 3, 'subsample': 0.9191218756438218, 'max_features': None}. Best is trial 1407 with value: 0.45837155910294247.
[I 2024-12-04 15:10:50,446] Trial 1413 finished with value: 0.4666728176176735 and parameters: {'n_estimators': 1304, 'learning_rate': 0.06371194850806244, 'max_depth': 12, 'min_samples_split': 18, 'min_samples_leaf': 1, 'subsample': 0.9942781397403138, 'max_features': None}. Best is trial 1407 with value: 0.45837155910294247.
[I 2024-12-04 15:10:51,055] Trial 1420 finished with value: 0.6539310905905851 and parameters: {'n_estimators': 1216, 'learning_rate': 0.08859485131364925, 'max_depth': 12, 'min_samples_split': 16, 'min_samples_leaf': 2, 'subsample': 0.9240343712140514, 'max_features': None}. Best is trial 1407 with value: 0.45837155910294247.
[I 2024-12-04 15:10:54,244] Trial 1412 finished with value: 0.47594303904867896 and parameters: {'n_estimators': 1432, 'learning_rate': 0.02627408607902484, 'max_depth': 12, 'min_samples_split': 20, 'min_samples_leaf': 1, 'subsample': 0.9365925824320387, 'max_features': None}. Best is trial 1407 with value: 0.45837155910294247.
[I 2024-12-04 15:10:55,037] Trial 1441 finished with value: 0.9978166778325496 and parameters: {'n_estimators': 539, 'learning_rate': 0.01223426545719842, 'max_depth': 7, 'min_samples_split': 15, 'min_samples_leaf': 4, 'subsample': 0.7302995316681725, 'max_features': 'log2'}. Best is trial 1407 with value: 0.45837155910294247.
[I 2024-12-04 15:10:55,611] Trial 1430 finished with value: 0.6611202264269737 and parameters: {'n_estimators': 1100, 'learning_rate': 0.06980453215745054, 'max_depth': 11, 'min_samples_split': 18, 'min_samples_leaf': 3, 'subsample': 0.9980881933047893, 'max_features': 'sqrt'}. Best is trial 1407 with value: 0.45837155910294247.
[I 2024-12-04 15:10:55,636] Trial 1418 finished with value: 0.6543586042779759 and parameters: {'n_estimators': 1419, 'learning_rate': 0.07796894126267831, 'max_depth': 12, 'min_samples_split': 20, 'min_samples_leaf': 3, 'subsample': 0.9593951055329255, 'max_features': None}. Best is trial 1407 with value: 0.45837155910294247.
[I 2024-12-04 15:10:56,649] Trial 1426 finished with value: 0.8684877583550564 and parameters: {'n_estimators': 1443, 'learning_rate': 0.016714522787181427, 'max_depth': 10, 'min_samples_split': 2, 'min_samples_leaf': 7, 'subsample': 0.6543820097307498, 'max_features': 'log2'}. Best is trial 1407 with value: 0.45837155910294247.
[I 2024-12-04 15:10:58,989] Trial 1424 finished with value: 0.4682778376610304 and parameters: {'n_estimators': 1211, 'learning_rate': 0.05354361487710617, 'max_depth': 12, 'min_samples_split': 20, 'min_samples_leaf': 1, 'subsample': 0.9939095800363364, 'max_features': None}. Best is trial 1407 with value: 0.45837155910294247.
[I 2024-12-04 15:10:59,328] Trial 1428 finished with value: 0.6433030554754633 and parameters: {'n_estimators': 1067, 'learning_rate': 0.06803497362008834, 'max_depth': 10, 'min_samples_split': 20, 'min_samples_leaf': 3, 'subsample': 0.9983451462026715, 'max_features': None}. Best is trial 1407 with value: 0.45837155910294247.
[I 2024-12-04 15:11:00,631] Trial 1451 finished with value: 1.04298266154525 and parameters: {'n_estimators': 266, 'learning_rate': 0.02381713216935911, 'max_depth': 3, 'min_samples_split': 2, 'min_samples_leaf': 3, 'subsample': 0.7392484805594187, 'max_features': 'log2'}. Best is trial 1407 with value: 0.45837155910294247.
[I 2024-12-04 15:11:02,037] Trial 1432 finished with value: 0.49449242370636953 and parameters: {'n_estimators': 977, 'learning_rate': 0.09200821122903673, 'max_depth': 11, 'min_samples_split': 20, 'min_samples_leaf': 1, 'subsample': 0.9125163114028285, 'max_features': None}. Best is trial 1407 with value: 0.45837155910294247.
[I 2024-12-04 15:11:02,083] Trial 1427 finished with value: 0.5128022523849554 and parameters: {'n_estimators': 1176, 'learning_rate': 0.0639344244909055, 'max_depth': 10, 'min_samples_split': 16, 'min_samples_leaf': 1, 'subsample': 0.9954516658876534, 'max_features': None}. Best is trial 1407 with value: 0.45837155910294247.
[I 2024-12-04 15:11:02,095] Trial 1425 finished with value: 0.6842958550757616 and parameters: {'n_estimators': 1329, 'learning_rate': 0.08368406598382136, 'max_depth': 10, 'min_samples_split': 16, 'min_samples_leaf': 3, 'subsample': 0.9850385919437108, 'max_features': None}. Best is trial 1407 with value: 0.45837155910294247.
[I 2024-12-04 15:11:05,721] Trial 1445 finished with value: 0.7430291532825856 and parameters: {'n_estimators': 576, 'learning_rate': 0.05819987776933483, 'max_depth': 5, 'min_samples_split': 10, 'min_samples_leaf': 9, 'subsample': 0.9738845947137096, 'max_features': None}. Best is trial 1407 with value: 0.45837155910294247.
[I 2024-12-04 15:11:07,245] Trial 1435 finished with value: 0.45467030752684195 and parameters: {'n_estimators': 949, 'learning_rate': 0.07239647449022006, 'max_depth': 12, 'min_samples_split': 19, 'min_samples_leaf': 1, 'subsample': 0.9993121101201083, 'max_features': None}. Best is trial 1435 with value: 0.45467030752684195.
[I 2024-12-04 15:11:07,733] Trial 1423 finished with value: 0.5088174163337151 and parameters: {'n_estimators': 1500, 'learning_rate': 0.04750251528636433, 'max_depth': 12, 'min_samples_split': 14, 'min_samples_leaf': 1, 'subsample': 0.9858921592058725, 'max_features': None}. Best is trial 1435 with value: 0.45467030752684195.
[I 2024-12-04 15:11:10,765] Trial 1429 finished with value: 0.48136921381408077 and parameters: {'n_estimators': 1356, 'learning_rate': 0.052188106109455706, 'max_depth': 12, 'min_samples_split': 20, 'min_samples_leaf': 1, 'subsample': 0.8991865323493029, 'max_features': None}. Best is trial 1435 with value: 0.45467030752684195.
[I 2024-12-04 15:11:11,502] Trial 1448 finished with value: 0.56595742605184 and parameters: {'n_estimators': 831, 'learning_rate': 0.037816148420550415, 'max_depth': 4, 'min_samples_split': 8, 'min_samples_leaf': 1, 'subsample': 0.6245976733941774, 'max_features': 'sqrt'}. Best is trial 1435 with value: 0.45467030752684195.
[I 2024-12-04 15:11:11,959] Trial 1434 finished with value: 0.6532184496476744 and parameters: {'n_estimators': 1224, 'learning_rate': 0.06021102179475958, 'max_depth': 12, 'min_samples_split': 17, 'min_samples_leaf': 3, 'subsample': 0.9200362128537113, 'max_features': None}. Best is trial 1435 with value: 0.45467030752684195.
[I 2024-12-04 15:11:13,278] Trial 1433 finished with value: 0.4738392901731111 and parameters: {'n_estimators': 1241, 'learning_rate': 0.04487903784076097, 'max_depth': 12, 'min_samples_split': 20, 'min_samples_leaf': 1, 'subsample': 0.9307381738047585, 'max_features': None}. Best is trial 1435 with value: 0.45467030752684195.
[I 2024-12-04 15:11:13,481] Trial 1431 finished with value: 0.5188558331921752 and parameters: {'n_estimators': 1377, 'learning_rate': 0.06648980813754253, 'max_depth': 10, 'min_samples_split': 17, 'min_samples_leaf': 1, 'subsample': 0.9986561033948078, 'max_features': None}. Best is trial 1435 with value: 0.45467030752684195.
[I 2024-12-04 15:11:13,486] Trial 1439 finished with value: 0.8104895571514452 and parameters: {'n_estimators': 1328, 'learning_rate': 0.0771962956695837, 'max_depth': 10, 'min_samples_split': 8, 'min_samples_leaf': 9, 'subsample': 0.6207306420392373, 'max_features': 'log2'}. Best is trial 1435 with value: 0.45467030752684195.
[I 2024-12-04 15:11:14,659] Trial 1440 finished with value: 0.48500843929543247 and parameters: {'n_estimators': 998, 'learning_rate': 0.06931333829105514, 'max_depth': 11, 'min_samples_split': 20, 'min_samples_leaf': 1, 'subsample': 0.9491412578419502, 'max_features': None}. Best is trial 1435 with value: 0.45467030752684195.
[I 2024-12-04 15:11:16,910] Trial 1437 finished with value: 0.48534109982531315 and parameters: {'n_estimators': 1165, 'learning_rate': 0.09460755541987627, 'max_depth': 10, 'min_samples_split': 17, 'min_samples_leaf': 1, 'subsample': 0.9620579190774761, 'max_features': None}. Best is trial 1435 with value: 0.45467030752684195.
[I 2024-12-04 15:11:20,402] Trial 1444 finished with value: 0.6378285822842824 and parameters: {'n_estimators': 1028, 'learning_rate': 0.09989346012854669, 'max_depth': 12, 'min_samples_split': 20, 'min_samples_leaf': 2, 'subsample': 0.977845044266315, 'max_features': None}. Best is trial 1435 with value: 0.45467030752684195.
[I 2024-12-04 15:11:23,293] Trial 1436 finished with value: 0.48472113191476296 and parameters: {'n_estimators': 1457, 'learning_rate': 0.029936253827480018, 'max_depth': 12, 'min_samples_split': 17, 'min_samples_leaf': 1, 'subsample': 0.963381190259037, 'max_features': None}. Best is trial 1435 with value: 0.45467030752684195.
[I 2024-12-04 15:11:23,304] Trial 1459 finished with value: 0.573293218489427 and parameters: {'n_estimators': 894, 'learning_rate': 0.09427981561743726, 'max_depth': 10, 'min_samples_split': 19, 'min_samples_leaf': 1, 'subsample': 0.9681774979889459, 'max_features': 'log2'}. Best is trial 1435 with value: 0.45467030752684195.
[I 2024-12-04 15:11:24,206] Trial 1443 finished with value: 0.5078694197814642 and parameters: {'n_estimators': 1179, 'learning_rate': 0.09380445006985191, 'max_depth': 11, 'min_samples_split': 20, 'min_samples_leaf': 1, 'subsample': 0.9204889822187352, 'max_features': None}. Best is trial 1435 with value: 0.45467030752684195.
[I 2024-12-04 15:11:24,468] Trial 1438 finished with value: 0.478715757011663 and parameters: {'n_estimators': 1383, 'learning_rate': 0.058011317050569305, 'max_depth': 12, 'min_samples_split': 20, 'min_samples_leaf': 1, 'subsample': 0.9326756545382903, 'max_features': None}. Best is trial 1435 with value: 0.45467030752684195.
[I 2024-12-04 15:11:27,057] Trial 1447 finished with value: 0.4824540282380789 and parameters: {'n_estimators': 1166, 'learning_rate': 0.07806302796983555, 'max_depth': 11, 'min_samples_split': 20, 'min_samples_leaf': 1, 'subsample': 0.9195344744463554, 'max_features': None}. Best is trial 1435 with value: 0.45467030752684195.
[I 2024-12-04 15:11:27,808] Trial 1454 finished with value: 0.6290932419690581 and parameters: {'n_estimators': 950, 'learning_rate': 0.0647154960087155, 'max_depth': 12, 'min_samples_split': 18, 'min_samples_leaf': 3, 'subsample': 0.9909315008279269, 'max_features': None}. Best is trial 1435 with value: 0.45467030752684195.
[I 2024-12-04 15:11:28,337] Trial 1453 finished with value: 0.6298641350389924 and parameters: {'n_estimators': 1310, 'learning_rate': 0.013328748043610995, 'max_depth': 9, 'min_samples_split': 10, 'min_samples_leaf': 2, 'subsample': 0.8034420920864536, 'max_features': 'sqrt'}. Best is trial 1435 with value: 0.45467030752684195.
[I 2024-12-04 15:11:29,614] Trial 1446 finished with value: 0.4941038170114126 and parameters: {'n_estimators': 1240, 'learning_rate': 0.04097777199674441, 'max_depth': 12, 'min_samples_split': 17, 'min_samples_leaf': 1, 'subsample': 0.9987355905493116, 'max_features': None}. Best is trial 1435 with value: 0.45467030752684195.
[I 2024-12-04 15:11:30,420] Trial 1457 finished with value: 0.48044625967144705 and parameters: {'n_estimators': 917, 'learning_rate': 0.0670842120613672, 'max_depth': 12, 'min_samples_split': 19, 'min_samples_leaf': 1, 'subsample': 0.9116305853113809, 'max_features': None}. Best is trial 1435 with value: 0.45467030752684195.
[I 2024-12-04 15:11:31,623] Trial 1455 finished with value: 0.48798606087234897 and parameters: {'n_estimators': 982, 'learning_rate': 0.09717766501214763, 'max_depth': 12, 'min_samples_split': 17, 'min_samples_leaf': 1, 'subsample': 0.9927573857141374, 'max_features': None}. Best is trial 1435 with value: 0.45467030752684195.
[I 2024-12-04 15:11:31,771] Trial 1449 finished with value: 0.481956616828483 and parameters: {'n_estimators': 1219, 'learning_rate': 0.06404798141414604, 'max_depth': 11, 'min_samples_split': 20, 'min_samples_leaf': 1, 'subsample': 0.9955390811654287, 'max_features': None}. Best is trial 1435 with value: 0.45467030752684195.
[I 2024-12-04 15:11:35,161] Trial 1456 finished with value: 0.6457965033767581 and parameters: {'n_estimators': 1121, 'learning_rate': 0.07095482798647769, 'max_depth': 12, 'min_samples_split': 20, 'min_samples_leaf': 3, 'subsample': 0.9493274387163029, 'max_features': None}. Best is trial 1435 with value: 0.45467030752684195.
[I 2024-12-04 15:11:37,670] Trial 1473 finished with value: 0.5743496615079354 and parameters: {'n_estimators': 744, 'learning_rate': 0.026424075068172948, 'max_depth': 3, 'min_samples_split': 20, 'min_samples_leaf': 5, 'subsample': 0.7196934278012156, 'max_features': None}. Best is trial 1435 with value: 0.45467030752684195.
[I 2024-12-04 15:11:38,236] Trial 1487 finished with value: 1.1886133749650027 and parameters: {'n_estimators': 146, 'learning_rate': 0.010266582596981405, 'max_depth': 9, 'min_samples_split': 16, 'min_samples_leaf': 4, 'subsample': 0.9897555261983608, 'max_features': 'log2'}. Best is trial 1435 with value: 0.45467030752684195.
[I 2024-12-04 15:11:38,362] Trial 1466 finished with value: 0.47925995351599665 and parameters: {'n_estimators': 870, 'learning_rate': 0.09754878339222488, 'max_depth': 12, 'min_samples_split': 20, 'min_samples_leaf': 1, 'subsample': 0.9717174759414717, 'max_features': None}. Best is trial 1435 with value: 0.45467030752684195.
[I 2024-12-04 15:11:38,913] Trial 1463 finished with value: 0.7183269149819655 and parameters: {'n_estimators': 1364, 'learning_rate': 0.01691396663394773, 'max_depth': 5, 'min_samples_split': 8, 'min_samples_leaf': 3, 'subsample': 0.7653185386086098, 'max_features': 'log2'}. Best is trial 1435 with value: 0.45467030752684195.
[I 2024-12-04 15:11:40,216] Trial 1467 finished with value: 0.6678484781307821 and parameters: {'n_estimators': 987, 'learning_rate': 0.022362413265421675, 'max_depth': 10, 'min_samples_split': 6, 'min_samples_leaf': 7, 'subsample': 0.8110663754644781, 'max_features': None}. Best is trial 1435 with value: 0.45467030752684195.
[I 2024-12-04 15:11:40,386] Trial 1458 finished with value: 0.6381484237092113 and parameters: {'n_estimators': 1243, 'learning_rate': 0.06661600830714116, 'max_depth': 10, 'min_samples_split': 20, 'min_samples_leaf': 2, 'subsample': 0.9935678054670207, 'max_features': None}. Best is trial 1435 with value: 0.45467030752684195.
[I 2024-12-04 15:11:40,550] Trial 1461 finished with value: 0.503681297275827 and parameters: {'n_estimators': 1164, 'learning_rate': 0.09050414139545651, 'max_depth': 10, 'min_samples_split': 19, 'min_samples_leaf': 1, 'subsample': 0.9841324851953467, 'max_features': None}. Best is trial 1435 with value: 0.45467030752684195.
[I 2024-12-04 15:11:41,462] Trial 1450 finished with value: 0.47468745843954385 and parameters: {'n_estimators': 1472, 'learning_rate': 0.037194186727910965, 'max_depth': 12, 'min_samples_split': 19, 'min_samples_leaf': 1, 'subsample': 0.9674287217047696, 'max_features': None}. Best is trial 1435 with value: 0.45467030752684195.
[I 2024-12-04 15:11:42,761] Trial 1470 finished with value: 0.9096131934621381 and parameters: {'n_estimators': 1052, 'learning_rate': 0.01872972172175321, 'max_depth': 9, 'min_samples_split': 13, 'min_samples_leaf': 7, 'subsample': 0.6505277748498002, 'max_features': 'log2'}. Best is trial 1435 with value: 0.45467030752684195.
[I 2024-12-04 15:11:43,265] Trial 1460 finished with value: 0.6398670959900129 and parameters: {'n_estimators': 1256, 'learning_rate': 0.048584368886831784, 'max_depth': 12, 'min_samples_split': 20, 'min_samples_leaf': 3, 'subsample': 0.9700394849956616, 'max_features': None}. Best is trial 1435 with value: 0.45467030752684195.
[I 2024-12-04 15:11:43,980] Trial 1452 finished with value: 0.46899871870744075 and parameters: {'n_estimators': 1442, 'learning_rate': 0.0556054380695938, 'max_depth': 12, 'min_samples_split': 20, 'min_samples_leaf': 1, 'subsample': 0.9560448181349317, 'max_features': None}. Best is trial 1435 with value: 0.45467030752684195.
[I 2024-12-04 15:11:44,172] Trial 1468 finished with value: 0.4865965590026768 and parameters: {'n_estimators': 918, 'learning_rate': 0.05762413071802458, 'max_depth': 12, 'min_samples_split': 17, 'min_samples_leaf': 1, 'subsample': 0.9608554821797481, 'max_features': None}. Best is trial 1435 with value: 0.45467030752684195.
[I 2024-12-04 15:11:44,900] Trial 1483 finished with value: 0.6263577779543521 and parameters: {'n_estimators': 443, 'learning_rate': 0.07464353692366431, 'max_depth': 3, 'min_samples_split': 2, 'min_samples_leaf': 4, 'subsample': 0.9880647382090558, 'max_features': None}. Best is trial 1435 with value: 0.45467030752684195.
[I 2024-12-04 15:11:49,594] Trial 1471 finished with value: 0.4763104138053404 and parameters: {'n_estimators': 933, 'learning_rate': 0.09598928674061893, 'max_depth': 12, 'min_samples_split': 20, 'min_samples_leaf': 1, 'subsample': 0.9882501969340144, 'max_features': None}. Best is trial 1435 with value: 0.45467030752684195.
[I 2024-12-04 15:11:49,596] Trial 1480 finished with value: 0.5240971900417277 and parameters: {'n_estimators': 745, 'learning_rate': 0.056474989822397306, 'max_depth': 11, 'min_samples_split': 12, 'min_samples_leaf': 1, 'subsample': 0.9817108228485919, 'max_features': 'sqrt'}. Best is trial 1435 with value: 0.45467030752684195.
[I 2024-12-04 15:11:49,823] Trial 1474 finished with value: 0.5868086512223932 and parameters: {'n_estimators': 1177, 'learning_rate': 0.02488215262501511, 'max_depth': 11, 'min_samples_split': 17, 'min_samples_leaf': 1, 'subsample': 0.8218444647711806, 'max_features': 'log2'}. Best is trial 1435 with value: 0.45467030752684195.
[I 2024-12-04 15:11:49,869] Trial 1462 finished with value: 0.5050838316792667 and parameters: {'n_estimators': 1319, 'learning_rate': 0.09425404306164652, 'max_depth': 12, 'min_samples_split': 16, 'min_samples_leaf': 1, 'subsample': 0.9995126635591767, 'max_features': None}. Best is trial 1435 with value: 0.45467030752684195.
