[I 2024-12-04 15:14:28,570] Trial 1180 finished with value: 0.13435413300694496 and parameters: {'kernel_type': 'Matern', 'length_scale': 2.6590213494389814, 'noise_level': 0.01171370732618932, 'constant_value': 2570.463488455899, 'nu': 1.5}. Best is trial 750 with value: 0.13435342446039877.
[I 2024-12-04 15:14:29,233] Trial 1174 finished with value: 0.14859827059871472 and parameters: {'kernel_type': 'Matern', 'length_scale': 14.040245235445967, 'noise_level': 0.6418515242725066, 'constant_value': 5.004865695141348e-05, 'nu': 2.5}. Best is trial 750 with value: 0.13435342446039877.
[I 2024-12-04 15:14:29,285] Trial 1187 finished with value: 0.13435440197567897 and parameters: {'kernel_type': 'Matern', 'length_scale': 0.37914102898521157, 'noise_level': 0.05721609149092612, 'constant_value': 1427.5672241374637, 'nu': 1.5}. Best is trial 750 with value: 0.13435342446039877.
[I 2024-12-04 15:14:31,930] Trial 1193 finished with value: 1.2693635028550232 and parameters: {'kernel_type': 'Matern', 'length_scale': 0.05721901263970829, 'noise_level': 0.0015892667890009884, 'constant_value': 70.42938897367617, 'nu': 1.5}. Best is trial 750 with value: 0.13435342446039877.
[I 2024-12-04 15:14:33,066] Trial 1194 finished with value: 0.1343544032557886 and parameters: {'kernel_type': 'Matern', 'length_scale': 4.347432747188656, 'noise_level': 0.006432905439939717, 'constant_value': 33.86922016357055, 'nu': 1.5}. Best is trial 750 with value: 0.13435342446039877.
[I 2024-12-04 15:14:34,621] Trial 1199 finished with value: 0.13435442361430752 and parameters: {'kernel_type': 'Matern', 'length_scale': 1.3605536371330067, 'noise_level': 0.00042994299936628726, 'constant_value': 91096.66669318032, 'nu': 1.5}. Best is trial 750 with value: 0.13435342446039877.
[I 2024-12-04 15:14:36,039] Trial 1192 finished with value: 0.15167286686283987 and parameters: {'kernel_type': 'RBF', 'length_scale': 0.22751133348290178, 'noise_level': 0.00031066239347187717, 'constant_value': 553.9002890439965, 'nu': 1.5}. Best is trial 750 with value: 0.13435342446039877.
[I 2024-12-04 15:14:36,073] Trial 1198 finished with value: 0.13435440367483642 and parameters: {'kernel_type': 'Matern', 'length_scale': 6.586067170073629, 'noise_level': 0.02787636243323893, 'constant_value': 242.81810716793507, 'nu': 1.5}. Best is trial 750 with value: 0.13435342446039877.
[I 2024-12-04 15:14:38,484] Trial 1204 finished with value: 0.13435438350863213 and parameters: {'kernel_type': 'Matern', 'length_scale': 7.732631903767332, 'noise_level': 0.021906786176057447, 'constant_value': 1933.1791575253778, 'nu': 1.5}. Best is trial 750 with value: 0.13435342446039877.
[I 2024-12-04 15:14:38,534] Trial 1195 finished with value: 0.13435449077383024 and parameters: {'kernel_type': 'Matern', 'length_scale': 25.563948840719675, 'noise_level': 0.020444258685299303, 'constant_value': 0.48626209041257396, 'nu': 1.5}. Best is trial 750 with value: 0.13435342446039877.
[I 2024-12-04 15:14:41,114] Trial 1197 finished with value: 0.13435439940780208 and parameters: {'kernel_type': 'Matern', 'length_scale': 0.3490999530901885, 'noise_level': 0.006841162575458119, 'constant_value': 3563.064432243962, 'nu': 1.5}. Best is trial 750 with value: 0.13435342446039877.
[I 2024-12-04 15:14:41,115] Trial 1200 finished with value: 1.2693630575004775 and parameters: {'kernel_type': 'Matern', 'length_scale': 0.10044897813716006, 'noise_level': 0.016969496445416073, 'constant_value': 2359.7082778302774, 'nu': 1.5}. Best is trial 750 with value: 0.13435342446039877.
[I 2024-12-04 15:14:43,375] Trial 1202 finished with value: 1.3007739235933953 and parameters: {'kernel_type': 'RBF', 'length_scale': 0.028896445181271112, 'noise_level': 1.0889484228942182e-09, 'constant_value': 6188.3003003797885, 'nu': 0.5}. Best is trial 750 with value: 0.13435342446039877.
[I 2024-12-04 15:14:43,613] Trial 1209 finished with value: 0.13435432771598116 and parameters: {'kernel_type': 'Matern', 'length_scale': 1.4171103506460272, 'noise_level': 0.023755912088460344, 'constant_value': 247.7500374228382, 'nu': 1.5}. Best is trial 750 with value: 0.13435342446039877.
[I 2024-12-04 15:14:46,831] Trial 1210 finished with value: 1.3007745979657548 and parameters: {'kernel_type': 'Matern', 'length_scale': 3.554721668672584, 'noise_level': 0.0008022170356989317, 'constant_value': 87685.38831877975, 'nu': 1.5}. Best is trial 750 with value: 0.13435342446039877.
[I 2024-12-04 15:14:48,593] Trial 1203 finished with value: 0.15167297810121894 and parameters: {'kernel_type': 'RBF', 'length_scale': 3.544617487475313, 'noise_level': 2.469169209114454e-07, 'constant_value': 7.2242169774139885e-06, 'nu': 0.5}. Best is trial 750 with value: 0.13435342446039877.
[I 2024-12-04 15:14:49,310] Trial 1196 finished with value: 0.13435422999203805 and parameters: {'kernel_type': 'Matern', 'length_scale': 37.320295452603325, 'noise_level': 0.005956181941262984, 'constant_value': 584.8571696878527, 'nu': 1.5}. Best is trial 750 with value: 0.13435342446039877.
[I 2024-12-04 15:14:49,628] Trial 1205 finished with value: 0.13435438626897822 and parameters: {'kernel_type': 'Matern', 'length_scale': 1.2498601696301235, 'noise_level': 0.025721281776667056, 'constant_value': 1091.6442915413586, 'nu': 1.5}. Best is trial 750 with value: 0.13435342446039877.
[I 2024-12-04 15:14:49,688] Trial 1201 finished with value: 0.13435439982107003 and parameters: {'kernel_type': 'Matern', 'length_scale': 1.0133554671511482, 'noise_level': 0.5882872451255725, 'constant_value': 4551.610960745032, 'nu': 1.5}. Best is trial 750 with value: 0.13435342446039877.
[I 2024-12-04 15:14:54,639] Trial 1206 finished with value: 1.2693635028569692 and parameters: {'kernel_type': 'RBF', 'length_scale': 0.05214971656341444, 'noise_level': 6.254402120440712e-06, 'constant_value': 1.7017048479656059e-07, 'nu': 2.5}. Best is trial 750 with value: 0.13435342446039877.
[I 2024-12-04 15:14:56,326] Trial 1218 finished with value: 0.1343543947923638 and parameters: {'kernel_type': 'Matern', 'length_scale': 0.5579102853482527, 'noise_level': 0.8558405371753527, 'constant_value': 2130.738211022904, 'nu': 1.5}. Best is trial 750 with value: 0.13435342446039877.
[I 2024-12-04 15:14:57,132] Trial 1207 finished with value: 1.269363502682572 and parameters: {'kernel_type': 'Matern', 'length_scale': 0.06807728353654081, 'noise_level': 0.11475902321296463, 'constant_value': 0.0035089385698892465, 'nu': 1.5}. Best is trial 750 with value: 0.13435342446039877.
[I 2024-12-04 15:14:58,519] Trial 1214 finished with value: 0.13435450139390712 and parameters: {'kernel_type': 'Matern', 'length_scale': 7.39904823174664, 'noise_level': 0.17501993782225023, 'constant_value': 2157.8110189841477, 'nu': 1.5}. Best is trial 750 with value: 0.13435342446039877.
[I 2024-12-04 15:14:58,534] Trial 1208 finished with value: 0.13435453949075052 and parameters: {'kernel_type': 'Matern', 'length_scale': 0.7815070944239243, 'noise_level': 0.09070938465687924, 'constant_value': 70122.96096881841, 'nu': 1.5}. Best is trial 750 with value: 0.13435342446039877.
[I 2024-12-04 15:14:59,459] Trial 1212 finished with value: 0.1343543767195967 and parameters: {'kernel_type': 'Matern', 'length_scale': 0.224490358945877, 'noise_level': 0.16443739837208068, 'constant_value': 75977.91965355849, 'nu': 1.5}. Best is trial 750 with value: 0.13435342446039877.
[I 2024-12-04 15:15:01,365] Trial 1219 finished with value: 1.269363502856957 and parameters: {'kernel_type': 'Matern', 'length_scale': 0.042327756020065714, 'noise_level': 2.2795054410117452e-08, 'constant_value': 24.744157694810855, 'nu': 1.5}. Best is trial 750 with value: 0.13435342446039877.
[I 2024-12-04 15:15:01,861] Trial 1222 finished with value: 0.1343543699404528 and parameters: {'kernel_type': 'Matern', 'length_scale': 0.4028003124028974, 'noise_level': 0.02750267315044477, 'constant_value': 6.031845446830442, 'nu': 1.5}. Best is trial 750 with value: 0.13435342446039877.
[I 2024-12-04 15:15:02,119] Trial 1216 finished with value: 0.13435440785233713 and parameters: {'kernel_type': 'Matern', 'length_scale': 0.8406655904231668, 'noise_level': 0.03753359789793893, 'constant_value': 1.4975623176696582, 'nu': 1.5}. Best is trial 750 with value: 0.13435342446039877.
[I 2024-12-04 15:15:05,196] Trial 1217 finished with value: 0.13435439023164436 and parameters: {'kernel_type': 'Matern', 'length_scale': 0.36461743695346854, 'noise_level': 0.0019798584218144516, 'constant_value': 1208.2140284744526, 'nu': 1.5}. Best is trial 750 with value: 0.13435342446039877.
[I 2024-12-04 15:15:06,641] Trial 1226 finished with value: 0.13435426666695213 and parameters: {'kernel_type': 'Matern', 'length_scale': 8.064199561739471, 'noise_level': 0.0003817610630084958, 'constant_value': 1352.795242725409, 'nu': 1.5}. Best is trial 750 with value: 0.13435342446039877.
[I 2024-12-04 15:15:06,683] Trial 1220 finished with value: 0.151672963821464 and parameters: {'kernel_type': 'RBF', 'length_scale': 3.350632575602444, 'noise_level': 0.9371518052750877, 'constant_value': 209.3544912354835, 'nu': 1.5}. Best is trial 750 with value: 0.13435342446039877.
[I 2024-12-04 15:15:08,188] Trial 1223 finished with value: 0.1485983877920715 and parameters: {'kernel_type': 'Matern', 'length_scale': 697.0679610008665, 'noise_level': 0.1315521080927445, 'constant_value': 96155.46131605649, 'nu': 2.5}. Best is trial 750 with value: 0.13435342446039877.
[I 2024-12-04 15:15:08,918] Trial 1213 finished with value: 0.13435459130234248 and parameters: {'kernel_type': 'Matern', 'length_scale': 1.0924520497815728, 'noise_level': 0.007956730251571426, 'constant_value': 51119.78705454824, 'nu': 1.5}. Best is trial 750 with value: 0.13435342446039877.
[I 2024-12-04 15:15:09,893] Trial 1211 finished with value: 0.13435363871193404 and parameters: {'kernel_type': 'Matern', 'length_scale': 18.580441156167666, 'noise_level': 0.019821357762136272, 'constant_value': 92072.99250073472, 'nu': 1.5}. Best is trial 750 with value: 0.13435342446039877.
[I 2024-12-04 15:15:12,911] Trial 1232 finished with value: 1.3007745979657548 and parameters: {'kernel_type': 'Matern', 'length_scale': 8.145140469478534, 'noise_level': 0.001187668770773729, 'constant_value': 503.93960283447103, 'nu': 1.5}. Best is trial 750 with value: 0.13435342446039877.
[I 2024-12-04 15:15:13,582] Trial 1227 finished with value: 0.13435445152568806 and parameters: {'kernel_type': 'Matern', 'length_scale': 0.597224565770243, 'noise_level': 0.002132232071241055, 'constant_value': 516.2604085370499, 'nu': 1.5}. Best is trial 750 with value: 0.13435342446039877.
[I 2024-12-04 15:15:13,838] Trial 1215 finished with value: 1.2693632828976813 and parameters: {'kernel_type': 'RBF', 'length_scale': 0.18218023737460176, 'noise_level': 0.014335113151066463, 'constant_value': 8.571165934182421e-07, 'nu': 0.5}. Best is trial 750 with value: 0.13435342446039877.
[I 2024-12-04 15:15:14,506] Trial 1221 finished with value: 0.13435437623458762 and parameters: {'kernel_type': 'Matern', 'length_scale': 1.6091734831430304, 'noise_level': 0.010725174662823552, 'constant_value': 15.00488901405769, 'nu': 1.5}. Best is trial 750 with value: 0.13435342446039877.
[I 2024-12-04 15:15:17,418] Trial 1224 finished with value: 0.13435426180063936 and parameters: {'kernel_type': 'Matern', 'length_scale': 14.974652047975944, 'noise_level': 0.002032806948117349, 'constant_value': 23.020494909598302, 'nu': 1.5}. Best is trial 750 with value: 0.13435342446039877.
[I 2024-12-04 15:15:17,741] Trial 1233 finished with value: 1.2693635028733996 and parameters: {'kernel_type': 'Matern', 'length_scale': 0.02481476013193827, 'noise_level': 0.022555586775624387, 'constant_value': 486.0899999735718, 'nu': 1.5}. Best is trial 750 with value: 0.13435342446039877.
[I 2024-12-04 15:15:18,242] Trial 1225 finished with value: 0.13435440079022298 and parameters: {'kernel_type': 'Matern', 'length_scale': 1.3106822779192076, 'noise_level': 3.336919579532005e-05, 'constant_value': 5.620063591799651, 'nu': 1.5}. Best is trial 750 with value: 0.13435342446039877.
[I 2024-12-04 15:15:18,551] Trial 1229 finished with value: 0.13435426367658101 and parameters: {'kernel_type': 'Matern', 'length_scale': 4.337169361428945, 'noise_level': 0.5999147702193296, 'constant_value': 20.317651140047825, 'nu': 1.5}. Best is trial 750 with value: 0.13435342446039877.
[I 2024-12-04 15:15:19,869] Trial 1228 finished with value: 0.13435439961622822 and parameters: {'kernel_type': 'Matern', 'length_scale': 3.6465878047933735, 'noise_level': 0.0143023485725248, 'constant_value': 4934.943812965832, 'nu': 1.5}. Best is trial 750 with value: 0.13435342446039877.
[I 2024-12-04 15:15:23,636] Trial 1231 finished with value: 0.1343543789410866 and parameters: {'kernel_type': 'Matern', 'length_scale': 9.503174920122916, 'noise_level': 0.6844724045773761, 'constant_value': 2281.2199729871036, 'nu': 1.5}. Best is trial 750 with value: 0.13435342446039877.
[I 2024-12-04 15:15:23,662] Trial 1230 finished with value: 0.13435435852364708 and parameters: {'kernel_type': 'Matern', 'length_scale': 3.056913464332932, 'noise_level': 0.027955019337674962, 'constant_value': 1042.703213082467, 'nu': 1.5}. Best is trial 750 with value: 0.13435342446039877.
[I 2024-12-04 15:15:25,562] Trial 1239 finished with value: 0.13435442123629882 and parameters: {'kernel_type': 'Matern', 'length_scale': 179.66921127767975, 'noise_level': 0.005916448198339061, 'constant_value': 1468.8994999332472, 'nu': 1.5}. Best is trial 750 with value: 0.13435342446039877.
[I 2024-12-04 15:15:25,671] Trial 1235 finished with value: 0.13435440345593044 and parameters: {'kernel_type': 'Matern', 'length_scale': 11.339270672344378, 'noise_level': 0.05126927594291159, 'constant_value': 90472.11039715317, 'nu': 1.5}. Best is trial 750 with value: 0.13435342446039877.
[I 2024-12-04 15:15:29,264] Trial 1238 finished with value: 0.1343543102807303 and parameters: {'kernel_type': 'Matern', 'length_scale': 7.57378803549645, 'noise_level': 0.013388609112233232, 'constant_value': 22022.64085882916, 'nu': 1.5}. Best is trial 750 with value: 0.13435342446039877.
[I 2024-12-04 15:15:30,573] Trial 1234 finished with value: 0.13435494709264534 and parameters: {'kernel_type': 'Matern', 'length_scale': 13.537443115531731, 'noise_level': 0.0007633972422221036, 'constant_value': 44316.41169052176, 'nu': 1.5}. Best is trial 750 with value: 0.13435342446039877.
[I 2024-12-04 15:15:31,297] Trial 1244 finished with value: 0.134354399584804 and parameters: {'kernel_type': 'Matern', 'length_scale': 472.938364520035, 'noise_level': 0.011974083359380105, 'constant_value': 51375.38746459337, 'nu': 1.5}. Best is trial 750 with value: 0.13435342446039877.
[I 2024-12-04 15:15:31,930] Trial 1242 finished with value: 0.13435437872947453 and parameters: {'kernel_type': 'Matern', 'length_scale': 8.02272180713026, 'noise_level': 0.07865374825320164, 'constant_value': 87027.5657328144, 'nu': 1.5}. Best is trial 750 with value: 0.13435342446039877.
[I 2024-12-04 15:15:32,488] Trial 1240 finished with value: 0.13435442022366503 and parameters: {'kernel_type': 'Matern', 'length_scale': 5.583026028244786, 'noise_level': 0.004922574518870709, 'constant_value': 37035.45225746755, 'nu': 1.5}. Best is trial 750 with value: 0.13435342446039877.
[I 2024-12-04 15:15:35,434] Trial 1237 finished with value: 0.13435439775195615 and parameters: {'kernel_type': 'Matern', 'length_scale': 5.762844946286657, 'noise_level': 0.05626364373413274, 'constant_value': 69903.36653632186, 'nu': 1.5}. Best is trial 750 with value: 0.13435342446039877.
[I 2024-12-04 15:15:35,443] Trial 1252 finished with value: 0.13435435651772523 and parameters: {'kernel_type': 'Matern', 'length_scale': 56.46262472978527, 'noise_level': 0.009581116686469437, 'constant_value': 67498.12178747503, 'nu': 1.5}. Best is trial 750 with value: 0.13435342446039877.
[I 2024-12-04 15:15:36,151] Trial 1245 finished with value: 0.1516730045349863 and parameters: {'kernel_type': 'RBF', 'length_scale': 17375.4426166854, 'noise_level': 0.21807125873105423, 'constant_value': 46803.21710028394, 'nu': 1.5}. Best is trial 750 with value: 0.13435342446039877.
[I 2024-12-04 15:15:38,348] Trial 1250 finished with value: 0.13435430643560714 and parameters: {'kernel_type': 'Matern', 'length_scale': 335.90834296157726, 'noise_level': 0.00020429566653752435, 'constant_value': 52415.39859521987, 'nu': 1.5}. Best is trial 750 with value: 0.13435342446039877.
[I 2024-12-04 15:15:38,380] Trial 1251 finished with value: 0.13435398800257783 and parameters: {'kernel_type': 'Matern', 'length_scale': 4.911756515943444, 'noise_level': 0.009455609882809801, 'constant_value': 64397.837355626216, 'nu': 1.5}. Best is trial 750 with value: 0.13435342446039877.
[I 2024-12-04 15:15:40,967] Trial 1253 finished with value: 0.13435436290392438 and parameters: {'kernel_type': 'Matern', 'length_scale': 53.87233732036678, 'noise_level': 0.6660817518655706, 'constant_value': 60238.77749875387, 'nu': 1.5}. Best is trial 750 with value: 0.13435342446039877.
[I 2024-12-04 15:15:41,235] Trial 1247 finished with value: 0.1485983345429467 and parameters: {'kernel_type': 'Matern', 'length_scale': 1.3695712181817536, 'noise_level': 0.007880778365682637, 'constant_value': 99369.32742990584, 'nu': 2.5}. Best is trial 750 with value: 0.13435342446039877.
[I 2024-12-04 15:15:41,856] Trial 1236 finished with value: 1.2693635028565362 and parameters: {'kernel_type': 'RBF', 'length_scale': 47146.17501162244, 'noise_level': 2.663568563854844e-10, 'constant_value': 3.293001205967033e-06, 'nu': 2.5}. Best is trial 750 with value: 0.13435342446039877.
[I 2024-12-04 15:15:42,912] Trial 1241 finished with value: 0.13435442573613265 and parameters: {'kernel_type': 'Matern', 'length_scale': 58.38449589824261, 'noise_level': 0.5369790319764354, 'constant_value': 50759.98849477285, 'nu': 1.5}. Best is trial 750 with value: 0.13435342446039877.
[I 2024-12-04 15:15:42,913] Trial 1243 finished with value: 1.2693635028450319 and parameters: {'kernel_type': 'Matern', 'length_scale': 1976.7894882345522, 'noise_level': 1.7037420945168212e-10, 'constant_value': 7.36832167836158e-05, 'nu': 2.5}. Best is trial 750 with value: 0.13435342446039877.
[I 2024-12-04 15:15:42,963] Trial 1255 finished with value: 1.3007745958834387 and parameters: {'kernel_type': 'RBF', 'length_scale': 3623.197145256027, 'noise_level': 0.04828874523169961, 'constant_value': 6.732013906855597e-07, 'nu': 2.5}. Best is trial 750 with value: 0.13435342446039877.
[I 2024-12-04 15:15:43,715] Trial 1256 finished with value: 0.1343543527862993 and parameters: {'kernel_type': 'Matern', 'length_scale': 4.388954946033824, 'noise_level': 0.532172753988241, 'constant_value': 1568.9218221892745, 'nu': 1.5}. Best is trial 750 with value: 0.13435342446039877.
[I 2024-12-04 15:15:43,758] Trial 1257 finished with value: 0.13435440217760758 and parameters: {'kernel_type': 'Matern', 'length_scale': 26.68314229978664, 'noise_level': 0.005849095462671995, 'constant_value': 0.5369672167559902, 'nu': 1.5}. Best is trial 750 with value: 0.13435342446039877.
[I 2024-12-04 15:15:44,410] Trial 1254 finished with value: 0.13435406598700034 and parameters: {'kernel_type': 'Matern', 'length_scale': 173.18584826288196, 'noise_level': 0.6670901223371114, 'constant_value': 55610.82822212554, 'nu': 1.5}. Best is trial 750 with value: 0.13435342446039877.
[I 2024-12-04 15:15:45,020] Trial 1259 finished with value: 0.1343543769449927 and parameters: {'kernel_type': 'Matern', 'length_scale': 158.32334843047548, 'noise_level': 0.0035625773508937432, 'constant_value': 57285.64726225747, 'nu': 1.5}. Best is trial 750 with value: 0.13435342446039877.
[I 2024-12-04 15:15:45,467] Trial 1249 finished with value: 0.13435440535001633 and parameters: {'kernel_type': 'Matern', 'length_scale': 54.60789765288848, 'noise_level': 0.0016431473705987977, 'constant_value': 927.721664251036, 'nu': 1.5}. Best is trial 750 with value: 0.13435342446039877.
[I 2024-12-04 15:15:47,531] Trial 1248 finished with value: 0.1343541650952412 and parameters: {'kernel_type': 'Matern', 'length_scale': 181.7935252377991, 'noise_level': 0.027321058612182234, 'constant_value': 25571.382824698583, 'nu': 1.5}. Best is trial 750 with value: 0.13435342446039877.
[I 2024-12-04 15:15:47,703] Trial 1246 finished with value: 0.15167297691631668 and parameters: {'kernel_type': 'RBF', 'length_scale': 0.57578969846932, 'noise_level': 0.0019442431389853825, 'constant_value': 0.008744779469329429, 'nu': 1.5}. Best is trial 750 with value: 0.13435342446039877.
[I 2024-12-04 15:15:47,734] Trial 1262 finished with value: 0.13435400515307022 and parameters: {'kernel_type': 'Matern', 'length_scale': 25.35285533562627, 'noise_level': 0.03039929388254342, 'constant_value': 1722.8439918272068, 'nu': 1.5}. Best is trial 750 with value: 0.13435342446039877.
[I 2024-12-04 15:15:50,338] Trial 1260 finished with value: 0.13435440065701645 and parameters: {'kernel_type': 'Matern', 'length_scale': 41.065829233313565, 'noise_level': 0.0008282072632628692, 'constant_value': 90207.04915415554, 'nu': 1.5}. Best is trial 750 with value: 0.13435342446039877.
[I 2024-12-04 15:15:50,620] Trial 1264 finished with value: 0.13435426921090382 and parameters: {'kernel_type': 'Matern', 'length_scale': 21.70457085010288, 'noise_level': 0.00048290374007328545, 'constant_value': 89460.95910534344, 'nu': 1.5}. Best is trial 750 with value: 0.13435342446039877.
[I 2024-12-04 15:15:50,890] Trial 1266 finished with value: 0.1343543905550168 and parameters: {'kernel_type': 'Matern', 'length_scale': 4.1610409112456805, 'noise_level': 0.028373191187793755, 'constant_value': 5825.526674827195, 'nu': 1.5}. Best is trial 750 with value: 0.13435342446039877.
