[I 2024-12-04 20:17:38,094] Trial 1155 finished with value: 0.3592652227070144 and parameters: {'kernel_type': 'Matern', 'length_scale': 20.988346203517736, 'noise_level': 0.004150759073800938, 'constant_value': 332.2216797830837, 'nu': 0.5}. Best is trial 881 with value: 0.35916990930150405.
[I 2024-12-04 20:17:40,666] Trial 1153 finished with value: 1.0624161172123587 and parameters: {'kernel_type': 'Matern', 'length_scale': 6372.729749629131, 'noise_level': 0.00022618200601627172, 'constant_value': 6678.500622554386, 'nu': 2.5}. Best is trial 881 with value: 0.35916990930150405.
[I 2024-12-04 20:17:40,667] Trial 1154 finished with value: 1.06241611731452 and parameters: {'kernel_type': 'RBF', 'length_scale': 11.655824039446765, 'noise_level': 0.002742541274807962, 'constant_value': 0.5235638474593562, 'nu': 1.5}. Best is trial 881 with value: 0.35916990930150405.
[I 2024-12-04 20:17:41,125] Trial 1156 finished with value: 1.0916564560957578 and parameters: {'kernel_type': 'Matern', 'length_scale': 44.43376501935125, 'noise_level': 5.583342066317588e-06, 'constant_value': 26.60886502726318, 'nu': 0.5}. Best is trial 881 with value: 0.35916990930150405.
[I 2024-12-04 20:17:45,623] Trial 1157 finished with value: 0.35921110332905476 and parameters: {'kernel_type': 'Matern', 'length_scale': 955.8778999692097, 'noise_level': 0.000953920322244219, 'constant_value': 53.989288907807435, 'nu': 0.5}. Best is trial 881 with value: 0.35916990930150405.
[I 2024-12-04 20:17:46,521] Trial 1159 finished with value: 0.3592112280845939 and parameters: {'kernel_type': 'Matern', 'length_scale': 5.2277913320623215, 'noise_level': 0.6387447419918244, 'constant_value': 86157.70544705354, 'nu': 0.5}. Best is trial 881 with value: 0.35916990930150405.
[I 2024-12-04 20:17:49,777] Trial 1158 finished with value: 0.35921128044090317 and parameters: {'kernel_type': 'Matern', 'length_scale': 0.10513024669782543, 'noise_level': 0.008137017450130497, 'constant_value': 29.784427485698878, 'nu': 0.5}. Best is trial 881 with value: 0.35916990930150405.
[I 2024-12-04 20:17:50,425] Trial 1160 finished with value: 0.35921120419546554 and parameters: {'kernel_type': 'Matern', 'length_scale': 1.011948721402873, 'noise_level': 0.002840974603416827, 'constant_value': 47.58659857007533, 'nu': 0.5}. Best is trial 881 with value: 0.35916990930150405.
[I 2024-12-04 20:17:50,696] Trial 1161 finished with value: 0.359211253300022 and parameters: {'kernel_type': 'Matern', 'length_scale': 165.74857214026147, 'noise_level': 0.006910435158080863, 'constant_value': 69.08960108100574, 'nu': 0.5}. Best is trial 881 with value: 0.35916990930150405.
[I 2024-12-04 20:17:54,109] Trial 1163 finished with value: 1.0624161170688635 and parameters: {'kernel_type': 'RBF', 'length_scale': 0.0028413459198156155, 'noise_level': 2.645211867661409e-07, 'constant_value': 0.0009170716911029526, 'nu': 0.5}. Best is trial 881 with value: 0.35916990930150405.
[I 2024-12-04 20:17:54,666] Trial 1162 finished with value: 0.3592107653528403 and parameters: {'kernel_type': 'Matern', 'length_scale': 1.8719989769274554, 'noise_level': 9.930910611590435e-05, 'constant_value': 1.124949884807304, 'nu': 0.5}. Best is trial 881 with value: 0.35916990930150405.
[I 2024-12-04 20:17:56,013] Trial 1164 finished with value: 0.3592111569539918 and parameters: {'kernel_type': 'Matern', 'length_scale': 2.129175590352553, 'noise_level': 0.011611492638634641, 'constant_value': 19.148644249743075, 'nu': 0.5}. Best is trial 881 with value: 0.35916990930150405.
[I 2024-12-04 20:17:58,120] Trial 1166 finished with value: 1.0916558493882578 and parameters: {'kernel_type': 'Matern', 'length_scale': 1.1461708819071244e-05, 'noise_level': 5.79170363274854e-08, 'constant_value': 92608.6447023555, 'nu': 1.5}. Best is trial 881 with value: 0.35916990930150405.
[I 2024-12-04 20:17:59,844] Trial 1165 finished with value: 0.3592112512273176 and parameters: {'kernel_type': 'Matern', 'length_scale': 1146.8947957660619, 'noise_level': 0.07235852472671435, 'constant_value': 799.9617018836169, 'nu': 0.5}. Best is trial 881 with value: 0.35916990930150405.
[I 2024-12-04 20:18:02,620] Trial 1169 finished with value: 1.0624161172747781 and parameters: {'kernel_type': 'Matern', 'length_scale': 0.0019372539047234566, 'noise_level': 0.0011937535932327727, 'constant_value': 2.132602951865585, 'nu': 0.5}. Best is trial 881 with value: 0.35916990930150405.
[I 2024-12-04 20:18:02,707] Trial 1167 finished with value: 1.0624161173302553 and parameters: {'kernel_type': 'RBF', 'length_scale': 15373.050368766813, 'noise_level': 1.0999606199264726e-06, 'constant_value': 5497.466253956278, 'nu': 0.5}. Best is trial 881 with value: 0.35916990930150405.
[I 2024-12-04 20:18:03,453] Trial 1168 finished with value: 0.35921122743221445 and parameters: {'kernel_type': 'Matern', 'length_scale': 47.71846347441494, 'noise_level': 0.07209628137947204, 'constant_value': 134.43690426280557, 'nu': 0.5}. Best is trial 881 with value: 0.35916990930150405.
[I 2024-12-04 20:18:07,447] Trial 1171 finished with value: 1.0624161172750972 and parameters: {'kernel_type': 'Matern', 'length_scale': 25.810035333049115, 'noise_level': 0.00027270652007741836, 'constant_value': 1.4853834896759979, 'nu': 2.5}. Best is trial 881 with value: 0.35916990930150405.
[I 2024-12-04 20:18:08,389] Trial 1170 finished with value: 0.3592112391941476 and parameters: {'kernel_type': 'Matern', 'length_scale': 72.15509391147884, 'noise_level': 0.05053437464452483, 'constant_value': 632.7243724857755, 'nu': 0.5}. Best is trial 881 with value: 0.35916990930150405.
[I 2024-12-04 20:18:08,784] Trial 1172 finished with value: 0.35921005561187536 and parameters: {'kernel_type': 'Matern', 'length_scale': 0.22537483595971797, 'noise_level': 0.30846859753434847, 'constant_value': 2223.2349031006256, 'nu': 0.5}. Best is trial 881 with value: 0.35916990930150405.
[I 2024-12-04 20:18:11,886] Trial 1173 finished with value: 0.3592111626132586 and parameters: {'kernel_type': 'Matern', 'length_scale': 7.201345905175128, 'noise_level': 0.0004772188452361834, 'constant_value': 871.7238747792048, 'nu': 0.5}. Best is trial 881 with value: 0.35916990930150405.
[I 2024-12-04 20:18:13,558] Trial 1174 finished with value: 0.35921312469145183 and parameters: {'kernel_type': 'Matern', 'length_scale': 0.5462904722715681, 'noise_level': 0.9446332580175676, 'constant_value': 447.35421121679065, 'nu': 0.5}. Best is trial 881 with value: 0.35916990930150405.
[I 2024-12-04 20:18:15,537] Trial 1175 finished with value: 0.35921122116583704 and parameters: {'kernel_type': 'Matern', 'length_scale': 0.24247743600060712, 'noise_level': 0.018311869194461643, 'constant_value': 3214.201669443394, 'nu': 0.5}. Best is trial 881 with value: 0.35916990930150405.
[I 2024-12-04 20:18:16,339] Trial 1176 finished with value: 1.0624161172138045 and parameters: {'kernel_type': 'Matern', 'length_scale': 0.025119730852588736, 'noise_level': 0.3083269581043915, 'constant_value': 35.57227358257115, 'nu': 0.5}. Best is trial 881 with value: 0.35916990930150405.
[I 2024-12-04 20:18:25,605] Trial 1178 finished with value: 1.0916558353313057 and parameters: {'kernel_type': 'Matern', 'length_scale': 0.007265195867224915, 'noise_level': 0.007564246094459596, 'constant_value': 122.58046515955789, 'nu': 0.5}. Best is trial 881 with value: 0.35916990930150405.
[I 2024-12-04 20:18:27,573] Trial 1179 finished with value: 1.0624161169745623 and parameters: {'kernel_type': 'Matern', 'length_scale': 0.010872087678496, 'noise_level': 0.6292695479657981, 'constant_value': 3135.122172191537, 'nu': 0.5}. Best is trial 881 with value: 0.35916990930150405.
[I 2024-12-04 20:18:34,158] Trial 1180 finished with value: 1.062416117276473 and parameters: {'kernel_type': 'Matern', 'length_scale': 0.0075565202725902765, 'noise_level': 0.2032218518249837, 'constant_value': 630.883506707551, 'nu': 0.5}. Best is trial 881 with value: 0.35916990930150405.
[I 2024-12-04 20:18:34,162] Trial 1177 finished with value: 1.0624161171806574 and parameters: {'kernel_type': 'Matern', 'length_scale': 15082.445630384856, 'noise_level': 4.829083883621617e-10, 'constant_value': 5.181900769314173e-07, 'nu': 0.5}. Best is trial 881 with value: 0.35916990930150405.
[I 2024-12-04 20:18:37,700] Trial 1181 finished with value: 0.3592111851383551 and parameters: {'kernel_type': 'Matern', 'length_scale': 0.18013740980387466, 'noise_level': 0.5009598808110748, 'constant_value': 7032.887297495317, 'nu': 0.5}. Best is trial 881 with value: 0.35916990930150405.
[I 2024-12-04 20:18:37,776] Trial 1183 finished with value: 1.0916567285210481 and parameters: {'kernel_type': 'Matern', 'length_scale': 1.7599357319114475, 'noise_level': 0.003978193233134762, 'constant_value': 99684.11281317213, 'nu': 1.5}. Best is trial 881 with value: 0.35916990930150405.
[I 2024-12-04 20:18:41,265] Trial 1182 finished with value: 0.3592112344396734 and parameters: {'kernel_type': 'Matern', 'length_scale': 52444.68200873343, 'noise_level': 0.010086506893454602, 'constant_value': 111.344749335225, 'nu': 0.5}. Best is trial 881 with value: 0.35916990930150405.
[I 2024-12-04 20:18:41,776] Trial 1185 finished with value: 1.091655839467545 and parameters: {'kernel_type': 'Matern', 'length_scale': 0.04602634098643759, 'noise_level': 0.026982039665369734, 'constant_value': 66020.39424041519, 'nu': 0.5}. Best is trial 881 with value: 0.35916990930150405.
[I 2024-12-04 20:18:46,146] Trial 1184 finished with value: 0.3592116205791609 and parameters: {'kernel_type': 'Matern', 'length_scale': 0.08910104346984232, 'noise_level': 0.14912345766673488, 'constant_value': 4768.028448181915, 'nu': 0.5}. Best is trial 881 with value: 0.35916990930150405.
[I 2024-12-04 20:18:47,120] Trial 1187 finished with value: 0.35921295189163993 and parameters: {'kernel_type': 'Matern', 'length_scale': 0.6451229792696807, 'noise_level': 0.1668982691750498, 'constant_value': 596.9693157177221, 'nu': 0.5}. Best is trial 881 with value: 0.35916990930150405.
[I 2024-12-04 20:18:49,394] Trial 1186 finished with value: 1.0624161180817187 and parameters: {'kernel_type': 'RBF', 'length_scale': 81178.15490850568, 'noise_level': 1.6719719193303103e-09, 'constant_value': 0.021925888238797805, 'nu': 0.5}. Best is trial 881 with value: 0.35916990930150405.
[I 2024-12-04 20:18:50,261] Trial 1188 finished with value: 1.0624161164869057 and parameters: {'kernel_type': 'RBF', 'length_scale': 2.6723164569855164e-05, 'noise_level': 0.011382950002869178, 'constant_value': 14563.500721400676, 'nu': 2.5}. Best is trial 881 with value: 0.35916990930150405.
[I 2024-12-04 20:18:53,059] Trial 1191 finished with value: 1.091656704854989 and parameters: {'kernel_type': 'Matern', 'length_scale': 5.860536086484951, 'noise_level': 0.00561466260172361, 'constant_value': 8629.109726255067, 'nu': 0.5}. Best is trial 881 with value: 0.35916990930150405.
[I 2024-12-04 20:18:55,224] Trial 1190 finished with value: 0.3592112422642662 and parameters: {'kernel_type': 'Matern', 'length_scale': 0.3514623840939406, 'noise_level': 0.7655482403606291, 'constant_value': 123.54567806106346, 'nu': 0.5}. Best is trial 881 with value: 0.35916990930150405.
[I 2024-12-04 20:18:55,513] Trial 1189 finished with value: 0.4226897375530688 and parameters: {'kernel_type': 'Matern', 'length_scale': 0.3775235756792962, 'noise_level': 4.9181497590388756e-05, 'constant_value': 0.045177782607499474, 'nu': 1.5}. Best is trial 881 with value: 0.35916990930150405.
[I 2024-12-04 20:18:57,683] Trial 1192 finished with value: 0.35921122561972657 and parameters: {'kernel_type': 'Matern', 'length_scale': 0.3775592485857083, 'noise_level': 0.0731157309051727, 'constant_value': 355.4939493374717, 'nu': 0.5}. Best is trial 881 with value: 0.35916990930150405.
[I 2024-12-04 20:19:00,128] Trial 1193 finished with value: 0.35922230326176835 and parameters: {'kernel_type': 'Matern', 'length_scale': 0.36832345108966263, 'noise_level': 0.004212998125882989, 'constant_value': 2489.568469917699, 'nu': 0.5}. Best is trial 881 with value: 0.35916990930150405.
[I 2024-12-04 20:19:00,684] Trial 1194 finished with value: 0.35921158435193035 and parameters: {'kernel_type': 'Matern', 'length_scale': 105.17251710782087, 'noise_level': 0.0004972668463130932, 'constant_value': 6.401422572392864, 'nu': 0.5}. Best is trial 881 with value: 0.35916990930150405.
[I 2024-12-04 20:19:02,672] Trial 1195 finished with value: 0.3592109886617516 and parameters: {'kernel_type': 'Matern', 'length_scale': 1.294588685804684, 'noise_level': 0.5155983455034087, 'constant_value': 3614.289735874159, 'nu': 0.5}. Best is trial 881 with value: 0.35916990930150405.
[I 2024-12-04 20:19:05,932] Trial 1197 finished with value: 0.35921106230036093 and parameters: {'kernel_type': 'Matern', 'length_scale': 13.058369467625413, 'noise_level': 0.5872000789419652, 'constant_value': 800.3547575932026, 'nu': 0.5}. Best is trial 881 with value: 0.35916990930150405.
[I 2024-12-04 20:19:06,448] Trial 1196 finished with value: 0.3592112799837556 and parameters: {'kernel_type': 'Matern', 'length_scale': 0.5080456039401893, 'noise_level': 0.6877223420806879, 'constant_value': 64467.99154126761, 'nu': 0.5}. Best is trial 881 with value: 0.35916990930150405.
[I 2024-12-04 20:19:08,078] Trial 1198 finished with value: 0.35921123881562406 and parameters: {'kernel_type': 'Matern', 'length_scale': 24.264020732448046, 'noise_level': 0.03988804653305991, 'constant_value': 1801.7888925515438, 'nu': 0.5}. Best is trial 881 with value: 0.35916990930150405.
[I 2024-12-04 20:19:10,159] Trial 1199 finished with value: 1.0624161177349911 and parameters: {'kernel_type': 'Matern', 'length_scale': 0.06912450095751196, 'noise_level': 0.34818946760761926, 'constant_value': 781.5835520221697, 'nu': 2.5}. Best is trial 881 with value: 0.35916990930150405.
[I 2024-12-04 20:19:11,853] Trial 1200 finished with value: 0.3592111804120974 and parameters: {'kernel_type': 'Matern', 'length_scale': 1.3371878073433352, 'noise_level': 0.007512135630783371, 'constant_value': 3.713781534365696, 'nu': 0.5}. Best is trial 881 with value: 0.35916990930150405.
[I 2024-12-04 20:19:14,279] Trial 1201 finished with value: 0.35921122780065473 and parameters: {'kernel_type': 'Matern', 'length_scale': 0.774550942630207, 'noise_level': 0.015615124789019124, 'constant_value': 700.1620877331976, 'nu': 0.5}. Best is trial 881 with value: 0.35916990930150405.
[I 2024-12-04 20:19:17,608] Trial 1204 finished with value: 1.0916543924771702 and parameters: {'kernel_type': 'Matern', 'length_scale': 0.4604086417504623, 'noise_level': 1.107406179161861e-05, 'constant_value': 4.64631087429983, 'nu': 0.5}. Best is trial 881 with value: 0.35916990930150405.
[I 2024-12-04 20:19:18,265] Trial 1203 finished with value: 0.35921128758985044 and parameters: {'kernel_type': 'Matern', 'length_scale': 0.4828974023252014, 'noise_level': 0.012448893411461564, 'constant_value': 61717.603585244244, 'nu': 0.5}. Best is trial 881 with value: 0.35916990930150405.
[I 2024-12-04 20:19:18,592] Trial 1202 finished with value: 0.3592112026726217 and parameters: {'kernel_type': 'Matern', 'length_scale': 0.1523714232808176, 'noise_level': 0.08077076219851866, 'constant_value': 17.568608483108605, 'nu': 0.5}. Best is trial 881 with value: 0.35916990930150405.
[I 2024-12-04 20:19:21,106] Trial 1207 finished with value: 1.0916558493632096 and parameters: {'kernel_type': 'RBF', 'length_scale': 0.005191277460621386, 'noise_level': 0.006704576794976563, 'constant_value': 50.12454829112639, 'nu': 0.5}. Best is trial 881 with value: 0.35916990930150405.
[I 2024-12-04 20:19:23,287] Trial 1205 finished with value: 0.35921119873709445 and parameters: {'kernel_type': 'Matern', 'length_scale': 8.421851600110982, 'noise_level': 0.04199439804329602, 'constant_value': 58.60667950199192, 'nu': 0.5}. Best is trial 881 with value: 0.35916990930150405.
[I 2024-12-04 20:19:23,947] Trial 1206 finished with value: 0.35921123955937134 and parameters: {'kernel_type': 'Matern', 'length_scale': 736.6397296688277, 'noise_level': 0.005656483428051728, 'constant_value': 144.48361975724893, 'nu': 0.5}. Best is trial 881 with value: 0.35916990930150405.
[I 2024-12-04 20:19:27,168] Trial 1208 finished with value: 0.4195658591266859 and parameters: {'kernel_type': 'Matern', 'length_scale': 0.386467804365181, 'noise_level': 0.009976480062163956, 'constant_value': 22.031970941483273, 'nu': 2.5}. Best is trial 881 with value: 0.35916990930150405.
[I 2024-12-04 20:19:27,174] Trial 1209 finished with value: 1.0624161170490245 and parameters: {'kernel_type': 'Matern', 'length_scale': 0.0033215369993624473, 'noise_level': 0.7361416172189977, 'constant_value': 8247.4123028915, 'nu': 0.5}. Best is trial 881 with value: 0.35916990930150405.
[I 2024-12-04 20:19:28,905] Trial 1210 finished with value: 0.4286835529514581 and parameters: {'kernel_type': 'RBF', 'length_scale': 6.2391553470982295, 'noise_level': 0.004144942970403189, 'constant_value': 1149.8393717963418, 'nu': 0.5}. Best is trial 881 with value: 0.35916990930150405.
[I 2024-12-04 20:19:30,321] Trial 1211 finished with value: 1.062415378985162 and parameters: {'kernel_type': 'Matern', 'length_scale': 0.07348123713524084, 'noise_level': 0.0011051702434095782, 'constant_value': 1.677746866128318, 'nu': 0.5}. Best is trial 881 with value: 0.35916990930150405.
[I 2024-12-04 20:19:32,120] Trial 1213 finished with value: 1.0916558464211463 and parameters: {'kernel_type': 'Matern', 'length_scale': 0.12672340293512105, 'noise_level': 9.179656252264776e-07, 'constant_value': 3800.914046099641, 'nu': 0.5}. Best is trial 881 with value: 0.35916990930150405.
[I 2024-12-04 20:19:32,196] Trial 1212 finished with value: 0.3592111785211022 and parameters: {'kernel_type': 'Matern', 'length_scale': 3.941707726272155, 'noise_level': 0.8769077726551396, 'constant_value': 253.79996840576254, 'nu': 0.5}. Best is trial 881 with value: 0.35916990930150405.
[I 2024-12-04 20:19:35,190] Trial 1214 finished with value: 0.359211060563079 and parameters: {'kernel_type': 'Matern', 'length_scale': 6.718139789594757, 'noise_level': 0.00021995569304952104, 'constant_value': 98.20698801315389, 'nu': 0.5}. Best is trial 881 with value: 0.35916990930150405.
[I 2024-12-04 20:19:36,356] Trial 1216 finished with value: 0.359210254571109 and parameters: {'kernel_type': 'Matern', 'length_scale': 19.366840801237657, 'noise_level': 0.014006799901015683, 'constant_value': 143.68203681749728, 'nu': 0.5}. Best is trial 881 with value: 0.35916990930150405.
[I 2024-12-04 20:19:37,948] Trial 1215 finished with value: 0.3592100182403943 and parameters: {'kernel_type': 'Matern', 'length_scale': 200.39211465497738, 'noise_level': 0.024236200125411424, 'constant_value': 75608.26052016264, 'nu': 0.5}. Best is trial 881 with value: 0.35916990930150405.
[I 2024-12-04 20:19:40,332] Trial 1217 finished with value: 0.42269405399188126 and parameters: {'kernel_type': 'Matern', 'length_scale': 0.3271796040939111, 'noise_level': 0.049087402816312214, 'constant_value': 388.8672954912869, 'nu': 1.5}. Best is trial 881 with value: 0.35916990930150405.
[I 2024-12-04 20:19:40,999] Trial 1218 finished with value: 0.3592115320564745 and parameters: {'kernel_type': 'Matern', 'length_scale': 4.567179517504805, 'noise_level': 0.0026654981962086427, 'constant_value': 78.8182875931465, 'nu': 0.5}. Best is trial 881 with value: 0.35916990930150405.
[I 2024-12-04 20:19:45,943] Trial 1219 finished with value: 0.35921127184811025 and parameters: {'kernel_type': 'Matern', 'length_scale': 126.7021948645084, 'noise_level': 0.0013088077628746972, 'constant_value': 8699.678781117771, 'nu': 0.5}. Best is trial 881 with value: 0.35916990930150405.
[I 2024-12-04 20:19:49,427] Trial 1220 finished with value: 1.062416118549271 and parameters: {'kernel_type': 'Matern', 'length_scale': 0.006890951680193301, 'noise_level': 2.2907140844535497e-05, 'constant_value': 0.01528178622665165, 'nu': 0.5}. Best is trial 881 with value: 0.35916990930150405.
[I 2024-12-04 20:19:52,895] Trial 1222 finished with value: 0.35921113514681846 and parameters: {'kernel_type': 'Matern', 'length_scale': 207.50051261267768, 'noise_level': 0.0023015329013597132, 'constant_value': 36188.93830664584, 'nu': 0.5}. Best is trial 881 with value: 0.35916990930150405.
[I 2024-12-04 20:19:53,631] Trial 1221 finished with value: 1.0624161172692481 and parameters: {'kernel_type': 'RBF', 'length_scale': 17.284545652707585, 'noise_level': 0.0032135875771989587, 'constant_value': 3.985717493513464e-07, 'nu': 0.5}. Best is trial 881 with value: 0.35916990930150405.
[I 2024-12-04 20:19:55,018] Trial 1223 finished with value: 0.3592112332828334 and parameters: {'kernel_type': 'Matern', 'length_scale': 18.918641620484838, 'noise_level': 0.0442094856022709, 'constant_value': 17012.97360742389, 'nu': 0.5}. Best is trial 881 with value: 0.35916990930150405.
[I 2024-12-04 20:19:58,159] Trial 1224 finished with value: 0.3592111969457271 and parameters: {'kernel_type': 'Matern', 'length_scale': 32.785522928399736, 'noise_level': 0.051960003686752645, 'constant_value': 25633.760550329545, 'nu': 0.5}. Best is trial 881 with value: 0.35916990930150405.
[I 2024-12-04 20:19:59,301] Trial 1225 finished with value: 0.359211241314717 and parameters: {'kernel_type': 'Matern', 'length_scale': 574.9066485281575, 'noise_level': 0.0173003534425641, 'constant_value': 10396.20077465487, 'nu': 0.5}. Best is trial 881 with value: 0.35916990930150405.
[I 2024-12-04 20:19:59,942] Trial 1226 finished with value: 0.3592112105941408 and parameters: {'kernel_type': 'Matern', 'length_scale': 504.8324762935121, 'noise_level': 0.013708682664406434, 'constant_value': 4805.621106368428, 'nu': 0.5}. Best is trial 881 with value: 0.35916990930150405.
