[I 2024-12-04 19:47:15,690] Trial 181 finished with value: 0.14249502182319146 and parameters: {'kernel_type': 'Matern', 'length_scale': 0.855829162524539, 'noise_level': 0.0001608961740081438, 'constant_value': 88221.32537476321, 'nu': 1.5}. Best is trial 87 with value: 0.13777769741398374.
[I 2024-12-04 19:47:18,300] Trial 182 finished with value: 0.1424950428198256 and parameters: {'kernel_type': 'Matern', 'length_scale': 75.71196012853655, 'noise_level': 0.0028714736746071885, 'constant_value': 9839.688794424528, 'nu': 1.5}. Best is trial 87 with value: 0.13777769741398374.
[I 2024-12-04 19:47:19,687] Trial 184 finished with value: 0.9982171094940401 and parameters: {'kernel_type': 'Matern', 'length_scale': 4.125473732363469, 'noise_level': 2.5040606501100075e-05, 'constant_value': 18282.86774709351, 'nu': 1.5}. Best is trial 87 with value: 0.13777769741398374.
[I 2024-12-04 19:47:20,777] Trial 183 finished with value: 0.197200007856846 and parameters: {'kernel_type': 'Matern', 'length_scale': 44.227624800563206, 'noise_level': 0.10598477968572684, 'constant_value': 1.9096732730734214, 'nu': 0.5}. Best is trial 87 with value: 0.13777769741398374.
[I 2024-12-04 19:47:25,895] Trial 185 finished with value: 0.14249504322763856 and parameters: {'kernel_type': 'Matern', 'length_scale': 9.76980230708273, 'noise_level': 0.012687450432304404, 'constant_value': 12017.060991491295, 'nu': 1.5}. Best is trial 87 with value: 0.13777769741398374.
[I 2024-12-04 19:47:27,014] Trial 187 finished with value: 0.14249509969225913 and parameters: {'kernel_type': 'Matern', 'length_scale': 16.343039806477545, 'noise_level': 0.0013285422509792604, 'constant_value': 13852.013131822787, 'nu': 1.5}. Best is trial 87 with value: 0.13777769741398374.
[I 2024-12-04 19:47:32,941] Trial 186 finished with value: 0.14249502939713746 and parameters: {'kernel_type': 'Matern', 'length_scale': 2.43727188171586, 'noise_level': 0.016257996145303953, 'constant_value': 28.082690385577582, 'nu': 1.5}. Best is trial 87 with value: 0.13777769741398374.
[I 2024-12-04 19:47:34,422] Trial 188 finished with value: 0.1424950472763596 and parameters: {'kernel_type': 'Matern', 'length_scale': 0.7862607858384816, 'noise_level': 0.0007895292916658662, 'constant_value': 58979.79651190994, 'nu': 1.5}. Best is trial 87 with value: 0.13777769741398374.
[I 2024-12-04 19:47:37,484] Trial 189 finished with value: 0.1424950649265852 and parameters: {'kernel_type': 'Matern', 'length_scale': 0.15989585189521394, 'noise_level': 6.12140686033858e-08, 'constant_value': 6.965750462369234e-06, 'nu': 1.5}. Best is trial 87 with value: 0.13777769741398374.
[I 2024-12-04 19:47:40,310] Trial 190 finished with value: 0.14249505259788836 and parameters: {'kernel_type': 'Matern', 'length_scale': 18.15310585884551, 'noise_level': 0.0007316222180282816, 'constant_value': 30.955585128197402, 'nu': 1.5}. Best is trial 87 with value: 0.13777769741398374.
[I 2024-12-04 19:47:40,596] Trial 192 finished with value: 0.998216731699913 and parameters: {'kernel_type': 'Matern', 'length_scale': 0.16844893182949403, 'noise_level': 0.0028907325151430884, 'constant_value': 6448.116515054478, 'nu': 1.5}. Best is trial 87 with value: 0.13777769741398374.
[I 2024-12-04 19:47:46,405] Trial 191 finished with value: 0.14249506914406104 and parameters: {'kernel_type': 'Matern', 'length_scale': 1.8242279641591763, 'noise_level': 0.01951660321636655, 'constant_value': 84.24976424968453, 'nu': 1.5}. Best is trial 87 with value: 0.13777769741398374.
[I 2024-12-04 19:47:49,292] Trial 193 finished with value: 0.9864686818193384 and parameters: {'kernel_type': 'Matern', 'length_scale': 0.010527596633327647, 'noise_level': 0.0001814970632786499, 'constant_value': 3179.081656140451, 'nu': 1.5}. Best is trial 87 with value: 0.13777769741398374.
[I 2024-12-04 19:47:51,840] Trial 194 finished with value: 0.14249508279351078 and parameters: {'kernel_type': 'Matern', 'length_scale': 2.7136647218513503, 'noise_level': 0.1825881906509342, 'constant_value': 164.6045770983077, 'nu': 1.5}. Best is trial 87 with value: 0.13777769741398374.
[I 2024-12-04 19:47:53,487] Trial 195 finished with value: 0.14249497738105424 and parameters: {'kernel_type': 'Matern', 'length_scale': 0.6672610177675791, 'noise_level': 0.00045810016262335773, 'constant_value': 18001.446656192405, 'nu': 1.5}. Best is trial 87 with value: 0.13777769741398374.
[I 2024-12-04 19:47:54,901] Trial 196 finished with value: 0.14249481728568245 and parameters: {'kernel_type': 'Matern', 'length_scale': 45.81930578008646, 'noise_level': 0.6711887696698529, 'constant_value': 29101.330546325324, 'nu': 1.5}. Best is trial 87 with value: 0.13777769741398374.
[I 2024-12-04 19:47:56,772] Trial 197 finished with value: 0.9982167338037915 and parameters: {'kernel_type': 'Matern', 'length_scale': 1.2533365992514048e-05, 'noise_level': 3.820250102790338e-09, 'constant_value': 4835.799194682604, 'nu': 2.5}. Best is trial 87 with value: 0.13777769741398374.
[I 2024-12-04 19:47:57,649] Trial 198 finished with value: 0.9982171057539377 and parameters: {'kernel_type': 'Matern', 'length_scale': 0.7048581176374753, 'noise_level': 1.4016663564565799e-05, 'constant_value': 73623.38928108053, 'nu': 1.5}. Best is trial 87 with value: 0.13777769741398374.
[I 2024-12-04 19:48:00,353] Trial 200 finished with value: 0.9982167331288567 and parameters: {'kernel_type': 'Matern', 'length_scale': 0.004558984240182085, 'noise_level': 0.34444835882174407, 'constant_value': 2.275017871928158e-07, 'nu': 0.5}. Best is trial 87 with value: 0.13777769741398374.
[I 2024-12-04 19:48:02,691] Trial 199 finished with value: 0.14249522841227077 and parameters: {'kernel_type': 'Matern', 'length_scale': 11.548461040599413, 'noise_level': 0.10420331888230092, 'constant_value': 15196.000904348093, 'nu': 1.5}. Best is trial 87 with value: 0.13777769741398374.
[I 2024-12-04 19:48:06,643] Trial 201 finished with value: 0.9864686659743276 and parameters: {'kernel_type': 'Matern', 'length_scale': 0.08559265874310922, 'noise_level': 0.0009273203884545765, 'constant_value': 34817.394471884094, 'nu': 1.5}. Best is trial 87 with value: 0.13777769741398374.
[I 2024-12-04 19:48:06,708] Trial 202 finished with value: 0.14249492578654838 and parameters: {'kernel_type': 'Matern', 'length_scale': 46.56249522596578, 'noise_level': 0.2977311447021144, 'constant_value': 11061.464865033728, 'nu': 1.5}. Best is trial 87 with value: 0.13777769741398374.
[I 2024-12-04 19:48:09,724] Trial 203 finished with value: 0.14249483920667394 and parameters: {'kernel_type': 'Matern', 'length_scale': 913.2347779316096, 'noise_level': 0.05237046911974764, 'constant_value': 34078.5157476113, 'nu': 1.5}. Best is trial 87 with value: 0.13777769741398374.
[I 2024-12-04 19:48:12,963] Trial 205 finished with value: 0.1424944976804896 and parameters: {'kernel_type': 'Matern', 'length_scale': 74.11293522345808, 'noise_level': 0.17078446745377157, 'constant_value': 567.5536836917813, 'nu': 1.5}. Best is trial 87 with value: 0.13777769741398374.
[I 2024-12-04 19:48:15,746] Trial 204 finished with value: 0.14249507647264706 and parameters: {'kernel_type': 'Matern', 'length_scale': 4.023704492778928, 'noise_level': 0.012462349280996111, 'constant_value': 74749.78750420648, 'nu': 1.5}. Best is trial 87 with value: 0.13777769741398374.
[I 2024-12-04 19:48:17,583] Trial 206 finished with value: 0.1424950382847848 and parameters: {'kernel_type': 'Matern', 'length_scale': 4003.916537940753, 'noise_level': 0.04854829132909902, 'constant_value': 1144.4798815200527, 'nu': 1.5}. Best is trial 87 with value: 0.13777769741398374.
[I 2024-12-04 19:48:18,530] Trial 207 finished with value: 0.14249515272233101 and parameters: {'kernel_type': 'Matern', 'length_scale': 223.85193977322174, 'noise_level': 0.7472090479773514, 'constant_value': 14442.817412128621, 'nu': 1.5}. Best is trial 87 with value: 0.13777769741398374.
[I 2024-12-04 19:48:23,699] Trial 208 finished with value: 0.14249505631364032 and parameters: {'kernel_type': 'Matern', 'length_scale': 64333.07808835614, 'noise_level': 0.5856783400586063, 'constant_value': 16820.493480820576, 'nu': 1.5}. Best is trial 87 with value: 0.13777769741398374.
[I 2024-12-04 19:48:24,056] Trial 209 finished with value: 0.1424950836302728 and parameters: {'kernel_type': 'Matern', 'length_scale': 477.2165309693507, 'noise_level': 0.7122476008166745, 'constant_value': 5770.423558003571, 'nu': 1.5}. Best is trial 87 with value: 0.13777769741398374.
[I 2024-12-04 19:48:27,613] Trial 210 finished with value: 0.986468681918387 and parameters: {'kernel_type': 'Matern', 'length_scale': 12934.10185236654, 'noise_level': 0.017214318874627953, 'constant_value': 280.18548406758265, 'nu': 1.5}. Best is trial 87 with value: 0.13777769741398374.
[I 2024-12-04 19:48:31,731] Trial 211 finished with value: 0.14249507072097206 and parameters: {'kernel_type': 'Matern', 'length_scale': 0.8241785518066358, 'noise_level': 0.9330748894785679, 'constant_value': 513.8158834714225, 'nu': 1.5}. Best is trial 87 with value: 0.13777769741398374.
[I 2024-12-04 19:48:35,888] Trial 213 finished with value: 0.14249494737611734 and parameters: {'kernel_type': 'Matern', 'length_scale': 11.159249492030415, 'noise_level': 0.7465864589383094, 'constant_value': 110.25425271126383, 'nu': 1.5}. Best is trial 87 with value: 0.13777769741398374.
[I 2024-12-04 19:48:37,033] Trial 214 finished with value: 0.9864686819163176 and parameters: {'kernel_type': 'RBF', 'length_scale': 0.0004101403395074104, 'noise_level': 0.00014015905611035974, 'constant_value': 907.9228874290304, 'nu': 0.5}. Best is trial 87 with value: 0.13777769741398374.
[I 2024-12-04 19:48:38,312] Trial 212 finished with value: 0.9864686819230105 and parameters: {'kernel_type': 'RBF', 'length_scale': 36002.53442731045, 'noise_level': 2.5318859804972145e-06, 'constant_value': 5.196758061586683e-07, 'nu': 1.5}. Best is trial 87 with value: 0.13777769741398374.
[I 2024-12-04 19:48:42,333] Trial 217 finished with value: 0.9982171021216272 and parameters: {'kernel_type': 'RBF', 'length_scale': 2681.454982390462, 'noise_level': 0.004425929396039313, 'constant_value': 6.490705528152925e-07, 'nu': 2.5}. Best is trial 87 with value: 0.13777769741398374.
[I 2024-12-04 19:48:42,793] Trial 215 finished with value: 0.14249507441078094 and parameters: {'kernel_type': 'Matern', 'length_scale': 10.116806644999917, 'noise_level': 0.4917708150677434, 'constant_value': 2894.1687554947025, 'nu': 1.5}. Best is trial 87 with value: 0.13777769741398374.
[I 2024-12-04 19:48:44,286] Trial 216 finished with value: 0.1424951311224086 and parameters: {'kernel_type': 'Matern', 'length_scale': 39.223774126616355, 'noise_level': 0.5717015367774619, 'constant_value': 426.89896603322296, 'nu': 1.5}. Best is trial 87 with value: 0.13777769741398374.
[I 2024-12-04 19:48:50,381] Trial 219 finished with value: 0.99821710949404 and parameters: {'kernel_type': 'Matern', 'length_scale': 318.9836674384017, 'noise_level': 0.05250953935374652, 'constant_value': 5.776015564438681, 'nu': 1.5}. Best is trial 87 with value: 0.13777769741398374.
[I 2024-12-04 19:48:50,407] Trial 218 finished with value: 0.19720003337022735 and parameters: {'kernel_type': 'Matern', 'length_scale': 1265.8239011006815, 'noise_level': 0.03666940875866622, 'constant_value': 9568.79472359944, 'nu': 0.5}. Best is trial 87 with value: 0.13777769741398374.
[I 2024-12-04 19:48:51,624] Trial 220 finished with value: 0.14249509175705646 and parameters: {'kernel_type': 'Matern', 'length_scale': 290.90997613206224, 'noise_level': 0.2630564698986406, 'constant_value': 77.37682221601041, 'nu': 1.5}. Best is trial 87 with value: 0.13777769741398374.
[I 2024-12-04 19:48:56,607] Trial 222 finished with value: 0.14249482766112415 and parameters: {'kernel_type': 'Matern', 'length_scale': 27.37079218224752, 'noise_level': 0.15923372210885411, 'constant_value': 77047.74392081304, 'nu': 1.5}. Best is trial 87 with value: 0.13777769741398374.
[I 2024-12-04 19:48:56,739] Trial 221 finished with value: 0.14249496303817366 and parameters: {'kernel_type': 'Matern', 'length_scale': 270.97321747390475, 'noise_level': 0.7721903974869002, 'constant_value': 17941.79736822909, 'nu': 1.5}. Best is trial 87 with value: 0.13777769741398374.
[I 2024-12-04 19:48:59,012] Trial 223 finished with value: 0.1424954855945188 and parameters: {'kernel_type': 'Matern', 'length_scale': 14.403076055146006, 'noise_level': 0.06068545040940722, 'constant_value': 6.090326497446798, 'nu': 1.5}. Best is trial 87 with value: 0.13777769741398374.
[I 2024-12-04 19:48:59,478] Trial 224 finished with value: 0.9982167108181959 and parameters: {'kernel_type': 'RBF', 'length_scale': 0.010719056387335434, 'noise_level': 0.4569230879401081, 'constant_value': 1.0604613735061528e-05, 'nu': 1.5}. Best is trial 87 with value: 0.13777769741398374.
[I 2024-12-04 19:49:02,257] Trial 225 finished with value: 0.1424950700812536 and parameters: {'kernel_type': 'Matern', 'length_scale': 37.87551505553894, 'noise_level': 0.28455910576309396, 'constant_value': 27747.75744041734, 'nu': 1.5}. Best is trial 87 with value: 0.13777769741398374.
[I 2024-12-04 19:49:04,721] Trial 226 finished with value: 0.1424937057317599 and parameters: {'kernel_type': 'Matern', 'length_scale': 1162.2811293482641, 'noise_level': 0.013931971845275644, 'constant_value': 41259.675223277576, 'nu': 1.5}. Best is trial 87 with value: 0.13777769741398374.
[I 2024-12-04 19:49:08,721] Trial 228 finished with value: 0.1424950328934411 and parameters: {'kernel_type': 'Matern', 'length_scale': 308.6133398479782, 'noise_level': 0.8065735472496915, 'constant_value': 20014.788051573458, 'nu': 1.5}. Best is trial 87 with value: 0.13777769741398374.
[I 2024-12-04 19:49:11,781] Trial 229 finished with value: 0.9864686818089419 and parameters: {'kernel_type': 'RBF', 'length_scale': 40388.50668464499, 'noise_level': 1.0278655585745398e-08, 'constant_value': 12387.897937378899, 'nu': 1.5}. Best is trial 87 with value: 0.13777769741398374.
[I 2024-12-04 19:49:14,307] Trial 227 finished with value: 0.9864686819178696 and parameters: {'kernel_type': 'Matern', 'length_scale': 2083.6680078638483, 'noise_level': 2.7326606597872544e-05, 'constant_value': 3.7386872746969706e-06, 'nu': 0.5}. Best is trial 87 with value: 0.13777769741398374.
[I 2024-12-04 19:49:16,450] Trial 230 finished with value: 0.9864686819007056 and parameters: {'kernel_type': 'Matern', 'length_scale': 1.0202793635402759e-05, 'noise_level': 3.198265561486025e-10, 'constant_value': 4.573222436695997e-07, 'nu': 0.5}. Best is trial 87 with value: 0.13777769741398374.
[I 2024-12-04 19:49:17,699] Trial 231 finished with value: 0.1424951176756404 and parameters: {'kernel_type': 'Matern', 'length_scale': 119.73546856778226, 'noise_level': 0.6064942612492175, 'constant_value': 12303.597683222271, 'nu': 1.5}. Best is trial 87 with value: 0.13777769741398374.
[I 2024-12-04 19:49:20,285] Trial 232 finished with value: 0.14249509666844165 and parameters: {'kernel_type': 'Matern', 'length_scale': 28.06590324002821, 'noise_level': 0.946846774748141, 'constant_value': 78762.96117968946, 'nu': 1.5}. Best is trial 87 with value: 0.13777769741398374.
[I 2024-12-04 19:49:22,461] Trial 233 finished with value: 0.9864686818910076 and parameters: {'kernel_type': 'Matern', 'length_scale': 3087.418054093591, 'noise_level': 0.0036960064643850456, 'constant_value': 24950.252752358683, 'nu': 1.5}. Best is trial 87 with value: 0.13777769741398374.
[I 2024-12-04 19:49:25,036] Trial 234 finished with value: 0.19719965132907108 and parameters: {'kernel_type': 'Matern', 'length_scale': 0.46112758212606786, 'noise_level': 0.006734189215450254, 'constant_value': 68372.66687292766, 'nu': 0.5}. Best is trial 87 with value: 0.13777769741398374.
[I 2024-12-04 19:49:27,658] Trial 236 finished with value: 0.14771030954365436 and parameters: {'kernel_type': 'RBF', 'length_scale': 18.996023692727068, 'noise_level': 0.3268122613047091, 'constant_value': 1862.0637499060597, 'nu': 1.5}. Best is trial 87 with value: 0.13777769741398374.
[I 2024-12-04 19:49:30,538] Trial 235 finished with value: 0.14249505469983886 and parameters: {'kernel_type': 'Matern', 'length_scale': 2.6468782389498267, 'noise_level': 0.028199332175979287, 'constant_value': 44.953512111102086, 'nu': 1.5}. Best is trial 87 with value: 0.13777769741398374.
[I 2024-12-04 19:49:30,986] Trial 237 finished with value: 0.14249506102255555 and parameters: {'kernel_type': 'Matern', 'length_scale': 436.8353454422278, 'noise_level': 0.5161866216135547, 'constant_value': 33467.55257122431, 'nu': 1.5}. Best is trial 87 with value: 0.13777769741398374.
[I 2024-12-04 19:49:33,706] Trial 238 finished with value: 0.1424950618581679 and parameters: {'kernel_type': 'Matern', 'length_scale': 747.9713352845164, 'noise_level': 0.0030212132142218868, 'constant_value': 52016.40040510902, 'nu': 1.5}. Best is trial 87 with value: 0.13777769741398374.
[I 2024-12-04 19:49:36,123] Trial 240 finished with value: 0.14249511961921676 and parameters: {'kernel_type': 'Matern', 'length_scale': 32.0857858040198, 'noise_level': 0.9419349746530676, 'constant_value': 38680.53915337623, 'nu': 1.5}. Best is trial 87 with value: 0.13777769741398374.
[I 2024-12-04 19:49:36,652] Trial 239 finished with value: 0.14249506274428733 and parameters: {'kernel_type': 'Matern', 'length_scale': 604.2961190718564, 'noise_level': 0.789221625060405, 'constant_value': 311.3671293683015, 'nu': 1.5}. Best is trial 87 with value: 0.13777769741398374.
[I 2024-12-04 19:49:39,073] Trial 241 finished with value: 0.14249563983060795 and parameters: {'kernel_type': 'Matern', 'length_scale': 1495.8571198813088, 'noise_level': 0.029232927461360927, 'constant_value': 4676.631261683884, 'nu': 1.5}. Best is trial 87 with value: 0.13777769741398374.
[I 2024-12-04 19:49:41,729] Trial 242 finished with value: 0.14249506839461792 and parameters: {'kernel_type': 'Matern', 'length_scale': 6474.2727882644285, 'noise_level': 0.02935060882538069, 'constant_value': 87808.48509751692, 'nu': 1.5}. Best is trial 87 with value: 0.13777769741398374.
[I 2024-12-04 19:49:44,139] Trial 243 finished with value: 0.14249505802942336 and parameters: {'kernel_type': 'Matern', 'length_scale': 2.2155139228496563, 'noise_level': 0.3744370449246319, 'constant_value': 594.3391585097651, 'nu': 1.5}. Best is trial 87 with value: 0.13777769741398374.
[I 2024-12-04 19:49:46,308] Trial 244 finished with value: 0.14249506358144085 and parameters: {'kernel_type': 'Matern', 'length_scale': 0.3985946566683505, 'noise_level': 0.0008971066280014007, 'constant_value': 53679.40835890592, 'nu': 1.5}. Best is trial 87 with value: 0.13777769741398374.
[I 2024-12-04 19:49:49,036] Trial 246 finished with value: 0.14249519000957697 and parameters: {'kernel_type': 'Matern', 'length_scale': 339.40955187103066, 'noise_level': 0.0156902625394876, 'constant_value': 87249.52684292561, 'nu': 1.5}. Best is trial 87 with value: 0.13777769741398374.
[I 2024-12-04 19:49:51,106] Trial 245 finished with value: 0.13800685456188486 and parameters: {'kernel_type': 'Matern', 'length_scale': 47.05572694844303, 'noise_level': 0.5090949337104805, 'constant_value': 7.367951975212019, 'nu': 1.5}. Best is trial 87 with value: 0.13777769741398374.
[I 2024-12-04 19:50:00,042] Trial 247 finished with value: 0.14249504645531474 and parameters: {'kernel_type': 'Matern', 'length_scale': 5.2309695706002515, 'noise_level': 0.007935056084767451, 'constant_value': 598.3809472942205, 'nu': 1.5}. Best is trial 87 with value: 0.13777769741398374.
[I 2024-12-04 19:50:07,862] Trial 249 finished with value: 0.1424947764507058 and parameters: {'kernel_type': 'Matern', 'length_scale': 1036.490547941596, 'noise_level': 0.7292040380162684, 'constant_value': 116.49154255197521, 'nu': 1.5}. Best is trial 87 with value: 0.13777769741398374.
[I 2024-12-04 19:50:18,223] Trial 250 finished with value: 0.1424949358455506 and parameters: {'kernel_type': 'Matern', 'length_scale': 4.22202115325717, 'noise_level': 0.12854317335781093, 'constant_value': 8.162984415698181, 'nu': 1.5}. Best is trial 87 with value: 0.13777769741398374.
[I 2024-12-04 19:50:18,245] Trial 248 finished with value: 0.9864686821585458 and parameters: {'kernel_type': 'Matern', 'length_scale': 0.013227650987205776, 'noise_level': 0.025912095462496974, 'constant_value': 3.421937158922572e-05, 'nu': 1.5}. Best is trial 87 with value: 0.13777769741398374.
[I 2024-12-04 19:50:22,821] Trial 251 finished with value: 0.14249495924860897 and parameters: {'kernel_type': 'Matern', 'length_scale': 693.8065839130661, 'noise_level': 0.04609536310296523, 'constant_value': 49.12988009880447, 'nu': 1.5}. Best is trial 87 with value: 0.13777769741398374.
[I 2024-12-04 19:50:27,452] Trial 253 finished with value: 0.1377401038097946 and parameters: {'kernel_type': 'Matern', 'length_scale': 1.1484916616931484, 'noise_level': 0.47482319117313954, 'constant_value': 108.73592493242894, 'nu': 1.5}. Best is trial 253 with value: 0.1377401038097946.
[I 2024-12-04 19:50:30,736] Trial 252 finished with value: 0.14249503821815118 and parameters: {'kernel_type': 'Matern', 'length_scale': 12.042655632773423, 'noise_level': 0.791885558096757, 'constant_value': 0.655369942954164, 'nu': 1.5}. Best is trial 253 with value: 0.1377401038097946.
[I 2024-12-04 19:50:31,006] Trial 254 finished with value: 0.13754915492432768 and parameters: {'kernel_type': 'Matern', 'length_scale': 31.897563478364667, 'noise_level': 0.24521199491097823, 'constant_value': 12.427005352300206, 'nu': 1.5}. Best is trial 254 with value: 0.13754915492432768.
[I 2024-12-04 19:50:34,027] Trial 255 finished with value: 0.1424950607846287 and parameters: {'kernel_type': 'Matern', 'length_scale': 87.03893921100241, 'noise_level': 0.4097620973495942, 'constant_value': 453.35672332678075, 'nu': 1.5}. Best is trial 254 with value: 0.13754915492432768.
