[I 2024-12-04 13:34:24,797] Trial 2060 finished with value: 0.24014384780604908 and parameters: {'n_estimators': 1247, 'learning_rate': 0.0658033609431482, 'max_depth': 10, 'min_samples_split': 17, 'min_samples_leaf': 2, 'subsample': 0.700099277922468, 'max_features': 'sqrt'}. Best is trial 1137 with value: 0.19687116000636118.
[I 2024-12-04 13:34:25,293] Trial 2055 finished with value: 0.24404873761859658 and parameters: {'n_estimators': 1488, 'learning_rate': 0.08494305727601716, 'max_depth': 11, 'min_samples_split': 17, 'min_samples_leaf': 3, 'subsample': 0.6429729186227031, 'max_features': 'sqrt'}. Best is trial 1137 with value: 0.19687116000636118.
[I 2024-12-04 13:34:25,300] Trial 2062 finished with value: 0.24114365787220976 and parameters: {'n_estimators': 1105, 'learning_rate': 0.03972288723653665, 'max_depth': 10, 'min_samples_split': 16, 'min_samples_leaf': 1, 'subsample': 0.6651194513043073, 'max_features': 'sqrt'}. Best is trial 1137 with value: 0.19687116000636118.
[I 2024-12-04 13:34:34,794] Trial 2059 finished with value: 0.22319983955997022 and parameters: {'n_estimators': 1496, 'learning_rate': 0.08809696668678943, 'max_depth': 11, 'min_samples_split': 18, 'min_samples_leaf': 2, 'subsample': 0.6048922308968804, 'max_features': 'sqrt'}. Best is trial 1137 with value: 0.19687116000636118.
[I 2024-12-04 13:34:37,886] Trial 2064 finished with value: 0.2522854742490173 and parameters: {'n_estimators': 1260, 'learning_rate': 0.05516464779340874, 'max_depth': 11, 'min_samples_split': 16, 'min_samples_leaf': 3, 'subsample': 0.6037742069193849, 'max_features': 'sqrt'}. Best is trial 1137 with value: 0.19687116000636118.
[I 2024-12-04 13:34:40,513] Trial 2068 finished with value: 0.2568331986828507 and parameters: {'n_estimators': 1136, 'learning_rate': 0.04963934325557084, 'max_depth': 8, 'min_samples_split': 19, 'min_samples_leaf': 3, 'subsample': 0.6180356291689773, 'max_features': 'sqrt'}. Best is trial 1137 with value: 0.19687116000636118.
[I 2024-12-04 13:34:42,868] Trial 2065 finished with value: 0.2567129027605856 and parameters: {'n_estimators': 1291, 'learning_rate': 0.09708565021611767, 'max_depth': 11, 'min_samples_split': 20, 'min_samples_leaf': 3, 'subsample': 0.6068553745064057, 'max_features': 'sqrt'}. Best is trial 1137 with value: 0.19687116000636118.
[I 2024-12-04 13:34:48,247] Trial 2070 finished with value: 0.22633168597262515 and parameters: {'n_estimators': 1201, 'learning_rate': 0.0661030207080741, 'max_depth': 12, 'min_samples_split': 20, 'min_samples_leaf': 1, 'subsample': 0.6469838099251247, 'max_features': 'sqrt'}. Best is trial 1137 with value: 0.19687116000636118.
[I 2024-12-04 13:34:49,105] Trial 2076 finished with value: 0.3949689333509696 and parameters: {'n_estimators': 922, 'learning_rate': 0.04164554695067096, 'max_depth': 3, 'min_samples_split': 9, 'min_samples_leaf': 9, 'subsample': 0.9182365376354489, 'max_features': None}. Best is trial 1137 with value: 0.19687116000636118.
[I 2024-12-04 13:34:53,500] Trial 2072 finished with value: 0.2252593746119059 and parameters: {'n_estimators': 1216, 'learning_rate': 0.07171402910860315, 'max_depth': 10, 'min_samples_split': 17, 'min_samples_leaf': 1, 'subsample': 0.6926927191947183, 'max_features': 'sqrt'}. Best is trial 1137 with value: 0.19687116000636118.
[I 2024-12-04 13:34:53,624] Trial 2078 finished with value: 0.2286831972165549 and parameters: {'n_estimators': 854, 'learning_rate': 0.06541891619240019, 'max_depth': 12, 'min_samples_split': 18, 'min_samples_leaf': 1, 'subsample': 0.6391968055206153, 'max_features': 'sqrt'}. Best is trial 1137 with value: 0.19687116000636118.
[I 2024-12-04 13:34:54,387] Trial 2063 finished with value: 0.261481106475014 and parameters: {'n_estimators': 1368, 'learning_rate': 0.031125759169070615, 'max_depth': 12, 'min_samples_split': 15, 'min_samples_leaf': 1, 'subsample': 0.6753067056470655, 'max_features': None}. Best is trial 1137 with value: 0.19687116000636118.
[I 2024-12-04 13:34:57,065] Trial 2081 finished with value: 0.32728422312171007 and parameters: {'n_estimators': 863, 'learning_rate': 0.015180257977572335, 'max_depth': 7, 'min_samples_split': 3, 'min_samples_leaf': 2, 'subsample': 0.8071726520188857, 'max_features': 'sqrt'}. Best is trial 1137 with value: 0.19687116000636118.
[I 2024-12-04 13:34:57,071] Trial 2066 finished with value: 0.2403149755945418 and parameters: {'n_estimators': 1498, 'learning_rate': 0.09445168025561533, 'max_depth': 7, 'min_samples_split': 17, 'min_samples_leaf': 1, 'subsample': 0.615925348643689, 'max_features': 'sqrt'}. Best is trial 1137 with value: 0.19687116000636118.
[I 2024-12-04 13:34:59,211] Trial 2075 finished with value: 0.24022322454536196 and parameters: {'n_estimators': 1159, 'learning_rate': 0.061089184922063285, 'max_depth': 12, 'min_samples_split': 15, 'min_samples_leaf': 2, 'subsample': 0.685237137603477, 'max_features': 'sqrt'}. Best is trial 1137 with value: 0.19687116000636118.
[I 2024-12-04 13:35:01,171] Trial 2067 finished with value: 0.2498571956741202 and parameters: {'n_estimators': 1484, 'learning_rate': 0.09890103494135581, 'max_depth': 10, 'min_samples_split': 18, 'min_samples_leaf': 3, 'subsample': 0.6611375464552888, 'max_features': 'sqrt'}. Best is trial 1137 with value: 0.19687116000636118.
[I 2024-12-04 13:35:01,468] Trial 2086 finished with value: 0.38141845771836386 and parameters: {'n_estimators': 674, 'learning_rate': 0.08774102135239203, 'max_depth': 5, 'min_samples_split': 2, 'min_samples_leaf': 10, 'subsample': 0.8701569610577952, 'max_features': None}. Best is trial 1137 with value: 0.19687116000636118.
[I 2024-12-04 13:35:02,937] Trial 2069 finished with value: 0.21418955119897226 and parameters: {'n_estimators': 1477, 'learning_rate': 0.06504565983828932, 'max_depth': 12, 'min_samples_split': 13, 'min_samples_leaf': 1, 'subsample': 0.6008754914314195, 'max_features': 'sqrt'}. Best is trial 1137 with value: 0.19687116000636118.
[I 2024-12-04 13:35:08,136] Trial 2071 finished with value: 0.23520681475126315 and parameters: {'n_estimators': 1497, 'learning_rate': 0.09251682086180138, 'max_depth': 10, 'min_samples_split': 19, 'min_samples_leaf': 1, 'subsample': 0.6528575791049998, 'max_features': 'log2'}. Best is trial 1137 with value: 0.19687116000636118.
[I 2024-12-04 13:35:11,940] Trial 2074 finished with value: 0.20624059599305444 and parameters: {'n_estimators': 1407, 'learning_rate': 0.09523322218954057, 'max_depth': 11, 'min_samples_split': 19, 'min_samples_leaf': 1, 'subsample': 0.7006277112555808, 'max_features': 'sqrt'}. Best is trial 1137 with value: 0.19687116000636118.
[I 2024-12-04 13:35:14,037] Trial 2080 finished with value: 0.22407200468351404 and parameters: {'n_estimators': 1255, 'learning_rate': 0.07103425680179727, 'max_depth': 12, 'min_samples_split': 20, 'min_samples_leaf': 1, 'subsample': 0.6890101635716793, 'max_features': 'sqrt'}. Best is trial 1137 with value: 0.19687116000636118.
[I 2024-12-04 13:35:16,066] Trial 2077 finished with value: 0.2882622430962736 and parameters: {'n_estimators': 1210, 'learning_rate': 0.08344322286199171, 'max_depth': 12, 'min_samples_split': 19, 'min_samples_leaf': 2, 'subsample': 0.6577591350112334, 'max_features': None}. Best is trial 1137 with value: 0.19687116000636118.
[I 2024-12-04 13:35:20,403] Trial 2082 finished with value: 0.22064074343281856 and parameters: {'n_estimators': 1306, 'learning_rate': 0.09629924543075613, 'max_depth': 9, 'min_samples_split': 20, 'min_samples_leaf': 1, 'subsample': 0.6125395142199259, 'max_features': 'sqrt'}. Best is trial 1137 with value: 0.19687116000636118.
[I 2024-12-04 13:35:22,426] Trial 2105 finished with value: 0.6330218006395796 and parameters: {'n_estimators': 160, 'learning_rate': 0.023328380180957613, 'max_depth': 4, 'min_samples_split': 8, 'min_samples_leaf': 5, 'subsample': 0.6255431994057027, 'max_features': 'sqrt'}. Best is trial 1137 with value: 0.19687116000636118.
[I 2024-12-04 13:35:23,355] Trial 2079 finished with value: 0.22755326200111956 and parameters: {'n_estimators': 1472, 'learning_rate': 0.05009536016514433, 'max_depth': 10, 'min_samples_split': 11, 'min_samples_leaf': 1, 'subsample': 0.604067453836435, 'max_features': 'sqrt'}. Best is trial 1137 with value: 0.19687116000636118.
[I 2024-12-04 13:35:24,786] Trial 2084 finished with value: 0.20959770858545168 and parameters: {'n_estimators': 1313, 'learning_rate': 0.09809012269317251, 'max_depth': 11, 'min_samples_split': 14, 'min_samples_leaf': 1, 'subsample': 0.6991910154146797, 'max_features': 'sqrt'}. Best is trial 1137 with value: 0.19687116000636118.
[I 2024-12-04 13:35:25,136] Trial 2085 finished with value: 0.2450987078853 and parameters: {'n_estimators': 1272, 'learning_rate': 0.0677243320985755, 'max_depth': 10, 'min_samples_split': 20, 'min_samples_leaf': 3, 'subsample': 0.6426668906234433, 'max_features': 'sqrt'}. Best is trial 1137 with value: 0.19687116000636118.
[I 2024-12-04 13:35:33,191] Trial 2083 finished with value: 0.24312998755100973 and parameters: {'n_estimators': 1484, 'learning_rate': 0.09303619312418451, 'max_depth': 9, 'min_samples_split': 20, 'min_samples_leaf': 2, 'subsample': 0.6670554492747383, 'max_features': 'sqrt'}. Best is trial 1137 with value: 0.19687116000636118.
[I 2024-12-04 13:35:35,886] Trial 2114 finished with value: 0.667938172990762 and parameters: {'n_estimators': 176, 'learning_rate': 0.02190016740113588, 'max_depth': 4, 'min_samples_split': 6, 'min_samples_leaf': 8, 'subsample': 0.8007881092107503, 'max_features': 'sqrt'}. Best is trial 1137 with value: 0.19687116000636118.
[I 2024-12-04 13:35:38,337] Trial 2091 finished with value: 0.3248969363348166 and parameters: {'n_estimators': 1178, 'learning_rate': 0.018805569386857544, 'max_depth': 5, 'min_samples_split': 12, 'min_samples_leaf': 2, 'subsample': 0.8576465210810366, 'max_features': 'sqrt'}. Best is trial 1137 with value: 0.19687116000636118.
[I 2024-12-04 13:35:39,423] Trial 2089 finished with value: 0.2175024429408801 and parameters: {'n_estimators': 1214, 'learning_rate': 0.07008382083904348, 'max_depth': 12, 'min_samples_split': 17, 'min_samples_leaf': 1, 'subsample': 0.6657155035874945, 'max_features': 'sqrt'}. Best is trial 1137 with value: 0.19687116000636118.
[I 2024-12-04 13:35:42,361] Trial 2088 finished with value: 0.21323113069972943 and parameters: {'n_estimators': 1310, 'learning_rate': 0.09846982128352891, 'max_depth': 10, 'min_samples_split': 17, 'min_samples_leaf': 1, 'subsample': 0.6305940729848591, 'max_features': 'sqrt'}. Best is trial 1137 with value: 0.19687116000636118.
[I 2024-12-04 13:35:45,240] Trial 2103 finished with value: 0.27797602460796295 and parameters: {'n_estimators': 734, 'learning_rate': 0.055189171552501755, 'max_depth': 11, 'min_samples_split': 17, 'min_samples_leaf': 1, 'subsample': 0.607489583370781, 'max_features': 'log2'}. Best is trial 1137 with value: 0.19687116000636118.
[I 2024-12-04 13:35:47,241] Trial 2087 finished with value: 0.20325788843899 and parameters: {'n_estimators': 1485, 'learning_rate': 0.09864192472165823, 'max_depth': 11, 'min_samples_split': 18, 'min_samples_leaf': 1, 'subsample': 0.6711391055901682, 'max_features': 'sqrt'}. Best is trial 1137 with value: 0.19687116000636118.
[I 2024-12-04 13:35:49,261] Trial 2095 finished with value: 0.24425973691254863 and parameters: {'n_estimators': 1185, 'learning_rate': 0.09826788942465274, 'max_depth': 12, 'min_samples_split': 20, 'min_samples_leaf': 3, 'subsample': 0.6481171110321959, 'max_features': 'sqrt'}. Best is trial 1137 with value: 0.19687116000636118.
[I 2024-12-04 13:35:52,092] Trial 2097 finished with value: 0.2478305088326038 and parameters: {'n_estimators': 1006, 'learning_rate': 0.08949037661426983, 'max_depth': 12, 'min_samples_split': 18, 'min_samples_leaf': 1, 'subsample': 0.6035570497364415, 'max_features': None}. Best is trial 1137 with value: 0.19687116000636118.
[I 2024-12-04 13:35:58,052] Trial 2094 finished with value: 0.22237295755016784 and parameters: {'n_estimators': 1442, 'learning_rate': 0.0786488730640353, 'max_depth': 8, 'min_samples_split': 17, 'min_samples_leaf': 1, 'subsample': 0.6027828972459779, 'max_features': 'sqrt'}. Best is trial 1137 with value: 0.19687116000636118.
[I 2024-12-04 13:36:00,199] Trial 2090 finished with value: 0.2068055207731557 and parameters: {'n_estimators': 1500, 'learning_rate': 0.08924512710504742, 'max_depth': 11, 'min_samples_split': 16, 'min_samples_leaf': 1, 'subsample': 0.6881909756874189, 'max_features': 'sqrt'}. Best is trial 1137 with value: 0.19687116000636118.
[I 2024-12-04 13:36:02,133] Trial 2092 finished with value: 0.217162803309906 and parameters: {'n_estimators': 1500, 'learning_rate': 0.09595584611201717, 'max_depth': 8, 'min_samples_split': 19, 'min_samples_leaf': 1, 'subsample': 0.6126426729382567, 'max_features': 'sqrt'}. Best is trial 1137 with value: 0.19687116000636118.
[I 2024-12-04 13:36:04,109] Trial 2093 finished with value: 0.22147396272429773 and parameters: {'n_estimators': 1498, 'learning_rate': 0.06447051944008383, 'max_depth': 10, 'min_samples_split': 20, 'min_samples_leaf': 1, 'subsample': 0.6592919317563501, 'max_features': 'sqrt'}. Best is trial 1137 with value: 0.19687116000636118.
[I 2024-12-04 13:36:06,875] Trial 2106 finished with value: 0.24190204955209543 and parameters: {'n_estimators': 938, 'learning_rate': 0.05926527505681641, 'max_depth': 12, 'min_samples_split': 15, 'min_samples_leaf': 2, 'subsample': 0.6458965009588766, 'max_features': 'sqrt'}. Best is trial 1137 with value: 0.19687116000636118.
[I 2024-12-04 13:36:07,119] Trial 2115 finished with value: 0.3967422634779189 and parameters: {'n_estimators': 562, 'learning_rate': 0.022361417468427385, 'max_depth': 4, 'min_samples_split': 11, 'min_samples_leaf': 9, 'subsample': 0.9018450911567928, 'max_features': None}. Best is trial 1137 with value: 0.19687116000636118.
[I 2024-12-04 13:36:08,268] Trial 2100 finished with value: 0.2195906810754802 and parameters: {'n_estimators': 1245, 'learning_rate': 0.08011767720020997, 'max_depth': 11, 'min_samples_split': 13, 'min_samples_leaf': 1, 'subsample': 0.602034814359917, 'max_features': 'sqrt'}. Best is trial 1137 with value: 0.19687116000636118.
[I 2024-12-04 13:36:10,769] Trial 2096 finished with value: 0.24262924302456762 and parameters: {'n_estimators': 1480, 'learning_rate': 0.05194424509328509, 'max_depth': 12, 'min_samples_split': 19, 'min_samples_leaf': 1, 'subsample': 0.6954405328265709, 'max_features': 'log2'}. Best is trial 1137 with value: 0.19687116000636118.
[I 2024-12-04 13:36:14,395] Trial 2098 finished with value: 0.25573112482717564 and parameters: {'n_estimators': 1325, 'learning_rate': 0.04186600076361112, 'max_depth': 10, 'min_samples_split': 16, 'min_samples_leaf': 1, 'subsample': 0.6073434396655133, 'max_features': None}. Best is trial 1137 with value: 0.19687116000636118.
[I 2024-12-04 13:36:15,760] Trial 2099 finished with value: 0.23137994602231654 and parameters: {'n_estimators': 1398, 'learning_rate': 0.05873175887931674, 'max_depth': 10, 'min_samples_split': 16, 'min_samples_leaf': 1, 'subsample': 0.6170134354597099, 'max_features': 'sqrt'}. Best is trial 1137 with value: 0.19687116000636118.
[I 2024-12-04 13:36:19,969] Trial 2102 finished with value: 0.25222047861973157 and parameters: {'n_estimators': 1274, 'learning_rate': 0.057044399328961756, 'max_depth': 11, 'min_samples_split': 16, 'min_samples_leaf': 3, 'subsample': 0.6077029209807998, 'max_features': 'sqrt'}. Best is trial 1137 with value: 0.19687116000636118.
[I 2024-12-04 13:36:26,156] Trial 2118 finished with value: 0.30216778737673256 and parameters: {'n_estimators': 863, 'learning_rate': 0.012792599869947475, 'max_depth': 11, 'min_samples_split': 9, 'min_samples_leaf': 2, 'subsample': 0.895849535382371, 'max_features': 'sqrt'}. Best is trial 1137 with value: 0.19687116000636118.
[I 2024-12-04 13:36:29,025] Trial 2109 finished with value: 0.23216199201236712 and parameters: {'n_estimators': 1214, 'learning_rate': 0.08453008773197537, 'max_depth': 11, 'min_samples_split': 14, 'min_samples_leaf': 1, 'subsample': 0.6034100727417891, 'max_features': 'sqrt'}. Best is trial 1137 with value: 0.19687116000636118.
[I 2024-12-04 13:36:30,777] Trial 2101 finished with value: 0.21479811093195172 and parameters: {'n_estimators': 1444, 'learning_rate': 0.0841369375053986, 'max_depth': 10, 'min_samples_split': 20, 'min_samples_leaf': 1, 'subsample': 0.7789783718683005, 'max_features': 'sqrt'}. Best is trial 1137 with value: 0.19687116000636118.
[I 2024-12-04 13:36:33,354] Trial 2108 finished with value: 0.20541912240488688 and parameters: {'n_estimators': 1280, 'learning_rate': 0.09907526930723223, 'max_depth': 11, 'min_samples_split': 17, 'min_samples_leaf': 1, 'subsample': 0.6507570959719552, 'max_features': 'sqrt'}. Best is trial 1137 with value: 0.19687116000636118.
[I 2024-12-04 13:36:34,331] Trial 2111 finished with value: 0.33321717309755916 and parameters: {'n_estimators': 1225, 'learning_rate': 0.010810015207686369, 'max_depth': 11, 'min_samples_split': 5, 'min_samples_leaf': 5, 'subsample': 0.8039218035931143, 'max_features': 'sqrt'}. Best is trial 1137 with value: 0.19687116000636118.
[I 2024-12-04 13:36:36,269] Trial 2112 finished with value: 0.20660294643427862 and parameters: {'n_estimators': 1211, 'learning_rate': 0.07489204452947228, 'max_depth': 12, 'min_samples_split': 15, 'min_samples_leaf': 1, 'subsample': 0.6033475306898032, 'max_features': 'sqrt'}. Best is trial 1137 with value: 0.19687116000636118.
[I 2024-12-04 13:36:38,231] Trial 2113 finished with value: 0.2042407267034942 and parameters: {'n_estimators': 1217, 'learning_rate': 0.09927678783454068, 'max_depth': 12, 'min_samples_split': 20, 'min_samples_leaf': 1, 'subsample': 0.6805278623952982, 'max_features': 'sqrt'}. Best is trial 1137 with value: 0.19687116000636118.
[I 2024-12-04 13:36:38,242] Trial 2121 finished with value: 0.285825438425974 and parameters: {'n_estimators': 815, 'learning_rate': 0.08023091450760214, 'max_depth': 5, 'min_samples_split': 10, 'min_samples_leaf': 4, 'subsample': 0.8814583688565691, 'max_features': None}. Best is trial 1137 with value: 0.19687116000636118.
[I 2024-12-04 13:36:40,106] Trial 2107 finished with value: 0.2646008292284979 and parameters: {'n_estimators': 1424, 'learning_rate': 0.059597465454083405, 'max_depth': 10, 'min_samples_split': 15, 'min_samples_leaf': 3, 'subsample': 0.6022541641495064, 'max_features': 'sqrt'}. Best is trial 1137 with value: 0.19687116000636118.
[I 2024-12-04 13:36:42,136] Trial 2104 finished with value: 0.2627497086285007 and parameters: {'n_estimators': 1362, 'learning_rate': 0.09409330903927048, 'max_depth': 10, 'min_samples_split': 15, 'min_samples_leaf': 1, 'subsample': 0.6106145132631823, 'max_features': None}. Best is trial 1137 with value: 0.19687116000636118.
[I 2024-12-04 13:36:49,504] Trial 2110 finished with value: 0.2290318353374148 and parameters: {'n_estimators': 1471, 'learning_rate': 0.09548527467955162, 'max_depth': 9, 'min_samples_split': 17, 'min_samples_leaf': 2, 'subsample': 0.604928517869848, 'max_features': 'sqrt'}. Best is trial 1137 with value: 0.19687116000636118.
[I 2024-12-04 13:36:55,878] Trial 2119 finished with value: 0.25094659840049127 and parameters: {'n_estimators': 1285, 'learning_rate': 0.06271594509310298, 'max_depth': 12, 'min_samples_split': 18, 'min_samples_leaf': 3, 'subsample': 0.6312222502978314, 'max_features': 'sqrt'}. Best is trial 1137 with value: 0.19687116000636118.
[I 2024-12-04 13:37:01,883] Trial 2116 finished with value: 0.25126101227426817 and parameters: {'n_estimators': 1488, 'learning_rate': 0.0961953853206295, 'max_depth': 10, 'min_samples_split': 14, 'min_samples_leaf': 4, 'subsample': 0.646168549947544, 'max_features': 'sqrt'}. Best is trial 1137 with value: 0.19687116000636118.
[I 2024-12-04 13:37:03,237] Trial 2117 finished with value: 0.22218074815784272 and parameters: {'n_estimators': 1474, 'learning_rate': 0.0868099064874136, 'max_depth': 10, 'min_samples_split': 17, 'min_samples_leaf': 1, 'subsample': 0.607003924497265, 'max_features': 'sqrt'}. Best is trial 1137 with value: 0.19687116000636118.
[I 2024-12-04 13:37:08,061] Trial 2122 finished with value: 0.21084160926557197 and parameters: {'n_estimators': 1352, 'learning_rate': 0.06668453316467313, 'max_depth': 11, 'min_samples_split': 17, 'min_samples_leaf': 1, 'subsample': 0.6792969622588032, 'max_features': 'sqrt'}. Best is trial 1137 with value: 0.19687116000636118.
[I 2024-12-04 13:37:08,151] Trial 2123 finished with value: 0.22242499869350163 and parameters: {'n_estimators': 1310, 'learning_rate': 0.06596113848923922, 'max_depth': 12, 'min_samples_split': 18, 'min_samples_leaf': 1, 'subsample': 0.6004513511467839, 'max_features': 'sqrt'}. Best is trial 1137 with value: 0.19687116000636118.
[I 2024-12-04 13:37:10,175] Trial 2150 finished with value: 0.5259003908006845 and parameters: {'n_estimators': 168, 'learning_rate': 0.08690433300373586, 'max_depth': 3, 'min_samples_split': 17, 'min_samples_leaf': 9, 'subsample': 0.8600841108836266, 'max_features': 'sqrt'}. Best is trial 1137 with value: 0.19687116000636118.
[I 2024-12-04 13:37:11,788] Trial 2125 finished with value: 0.1980918634260907 and parameters: {'n_estimators': 1262, 'learning_rate': 0.09441881211769121, 'max_depth': 11, 'min_samples_split': 17, 'min_samples_leaf': 1, 'subsample': 0.6655217930391943, 'max_features': 'sqrt'}. Best is trial 1137 with value: 0.19687116000636118.
[I 2024-12-04 13:37:14,496] Trial 2120 finished with value: 0.22217254881039966 and parameters: {'n_estimators': 1498, 'learning_rate': 0.07987959614386682, 'max_depth': 9, 'min_samples_split': 14, 'min_samples_leaf': 1, 'subsample': 0.6589721783560694, 'max_features': 'sqrt'}. Best is trial 1137 with value: 0.19687116000636118.
