[I 2024-12-04 20:07:56,929] Trial 971 finished with value: 0.6710423172969247 and parameters: {'n_estimators': 251, 'max_depth': 44, 'min_samples_split': 2, 'min_samples_leaf': 2, 'max_features': 'sqrt', 'bootstrap': False, 'criterion': 'squared_error'}. Best is trial 874 with value: 0.32176430753353746.
[I 2024-12-04 20:07:57,503] Trial 972 finished with value: 0.41928619643585663 and parameters: {'n_estimators': 185, 'max_depth': 39, 'min_samples_split': 2, 'min_samples_leaf': 1, 'max_features': 'sqrt', 'bootstrap': True, 'criterion': 'squared_error'}. Best is trial 874 with value: 0.32176430753353746.
[I 2024-12-04 20:07:58,543] Trial 964 finished with value: 0.3425889065211304 and parameters: {'n_estimators': 339, 'max_depth': 50, 'min_samples_split': 2, 'min_samples_leaf': 1, 'max_features': 'sqrt', 'bootstrap': False, 'criterion': 'absolute_error'}. Best is trial 874 with value: 0.32176430753353746.
[I 2024-12-04 20:07:59,091] Trial 973 finished with value: 0.34629742294176663 and parameters: {'n_estimators': 357, 'max_depth': 42, 'min_samples_split': 2, 'min_samples_leaf': 1, 'max_features': 'sqrt', 'bootstrap': False, 'criterion': 'squared_error'}. Best is trial 874 with value: 0.32176430753353746.
[I 2024-12-04 20:07:59,759] Trial 974 finished with value: 0.3238565266737387 and parameters: {'n_estimators': 336, 'max_depth': 50, 'min_samples_split': 2, 'min_samples_leaf': 1, 'max_features': 'sqrt', 'bootstrap': False, 'criterion': 'squared_error'}. Best is trial 874 with value: 0.32176430753353746.
[I 2024-12-04 20:08:00,647] Trial 975 finished with value: 0.3871676475063564 and parameters: {'n_estimators': 401, 'max_depth': 50, 'min_samples_split': 4, 'min_samples_leaf': 1, 'max_features': 'sqrt', 'bootstrap': False, 'criterion': 'squared_error'}. Best is trial 874 with value: 0.32176430753353746.
[I 2024-12-04 20:08:01,452] Trial 977 finished with value: 0.3856650343497493 and parameters: {'n_estimators': 273, 'max_depth': 50, 'min_samples_split': 4, 'min_samples_leaf': 1, 'max_features': 'sqrt', 'bootstrap': False, 'criterion': 'squared_error'}. Best is trial 874 with value: 0.32176430753353746.
[I 2024-12-04 20:08:01,907] Trial 978 finished with value: 0.6677134494096665 and parameters: {'n_estimators': 310, 'max_depth': 49, 'min_samples_split': 2, 'min_samples_leaf': 2, 'max_features': 'sqrt', 'bootstrap': False, 'criterion': 'squared_error'}. Best is trial 874 with value: 0.32176430753353746.
[I 2024-12-04 20:08:02,814] Trial 979 finished with value: 0.3353368264970316 and parameters: {'n_estimators': 145, 'max_depth': 50, 'min_samples_split': 2, 'min_samples_leaf': 1, 'max_features': 'sqrt', 'bootstrap': False, 'criterion': 'squared_error'}. Best is trial 874 with value: 0.32176430753353746.
[I 2024-12-04 20:08:04,368] Trial 981 finished with value: 0.3578751090250646 and parameters: {'n_estimators': 349, 'max_depth': 50, 'min_samples_split': 3, 'min_samples_leaf': 1, 'max_features': 'sqrt', 'bootstrap': False, 'criterion': 'squared_error'}. Best is trial 874 with value: 0.32176430753353746.
[I 2024-12-04 20:08:04,377] Trial 980 finished with value: 0.3288011957544433 and parameters: {'n_estimators': 469, 'max_depth': 50, 'min_samples_split': 2, 'min_samples_leaf': 1, 'max_features': 'sqrt', 'bootstrap': False, 'criterion': 'squared_error'}. Best is trial 874 with value: 0.32176430753353746.
[I 2024-12-04 20:08:06,394] Trial 982 finished with value: 0.3227436309075193 and parameters: {'n_estimators': 350, 'max_depth': 50, 'min_samples_split': 2, 'min_samples_leaf': 1, 'max_features': 'sqrt', 'bootstrap': False, 'criterion': 'squared_error'}. Best is trial 874 with value: 0.32176430753353746.
[I 2024-12-04 20:08:06,400] Trial 983 finished with value: 0.3241499955982882 and parameters: {'n_estimators': 305, 'max_depth': 50, 'min_samples_split': 2, 'min_samples_leaf': 1, 'max_features': 'sqrt', 'bootstrap': False, 'criterion': 'squared_error'}. Best is trial 874 with value: 0.32176430753353746.
[I 2024-12-04 20:08:08,231] Trial 985 finished with value: 0.3240573755776583 and parameters: {'n_estimators': 243, 'max_depth': 50, 'min_samples_split': 2, 'min_samples_leaf': 1, 'max_features': 'sqrt', 'bootstrap': False, 'criterion': 'squared_error'}. Best is trial 874 with value: 0.32176430753353746.
[I 2024-12-04 20:08:13,009] Trial 984 finished with value: 1.0722028828246253 and parameters: {'n_estimators': 455, 'max_depth': 23, 'min_samples_split': 39, 'min_samples_leaf': 1, 'max_features': 'log2', 'bootstrap': False, 'criterion': 'absolute_error'}. Best is trial 874 with value: 0.32176430753353746.
[I 2024-12-04 20:08:14,363] Trial 987 finished with value: 0.7940802960523318 and parameters: {'n_estimators': 460, 'max_depth': 45, 'min_samples_split': 2, 'min_samples_leaf': 2, 'max_features': 'sqrt', 'bootstrap': True, 'criterion': 'squared_error'}. Best is trial 874 with value: 0.32176430753353746.
[I 2024-12-04 20:08:15,101] Trial 986 finished with value: 0.6192399614241422 and parameters: {'n_estimators': 325, 'max_depth': 43, 'min_samples_split': 2, 'min_samples_leaf': 1, 'max_features': 'log2', 'bootstrap': False, 'criterion': 'absolute_error'}. Best is trial 874 with value: 0.32176430753353746.
[I 2024-12-04 20:08:16,057] Trial 988 finished with value: 0.5458880097763376 and parameters: {'n_estimators': 398, 'max_depth': 25, 'min_samples_split': 3, 'min_samples_leaf': 1, 'max_features': 'sqrt', 'bootstrap': False, 'criterion': 'squared_error'}. Best is trial 874 with value: 0.32176430753353746.
[I 2024-12-04 20:08:17,303] Trial 990 finished with value: 0.6869226178857397 and parameters: {'n_estimators': 387, 'max_depth': 41, 'min_samples_split': 2, 'min_samples_leaf': 2, 'max_features': 'sqrt', 'bootstrap': False, 'criterion': 'squared_error'}. Best is trial 874 with value: 0.32176430753353746.
[I 2024-12-04 20:08:17,406] Trial 989 finished with value: 0.32465690250997753 and parameters: {'n_estimators': 427, 'max_depth': 50, 'min_samples_split': 2, 'min_samples_leaf': 1, 'max_features': 'sqrt', 'bootstrap': False, 'criterion': 'squared_error'}. Best is trial 874 with value: 0.32176430753353746.
[I 2024-12-04 20:08:18,685] Trial 992 finished with value: 0.6653393099200129 and parameters: {'n_estimators': 234, 'max_depth': 50, 'min_samples_split': 2, 'min_samples_leaf': 2, 'max_features': 'sqrt', 'bootstrap': False, 'criterion': 'squared_error'}. Best is trial 874 with value: 0.32176430753353746.
[I 2024-12-04 20:08:18,933] Trial 991 finished with value: 0.348242248130505 and parameters: {'n_estimators': 219, 'max_depth': 41, 'min_samples_split': 2, 'min_samples_leaf': 1, 'max_features': 'sqrt', 'bootstrap': False, 'criterion': 'squared_error'}. Best is trial 874 with value: 0.32176430753353746.
[I 2024-12-04 20:08:20,419] Trial 994 finished with value: 0.32864070564296705 and parameters: {'n_estimators': 168, 'max_depth': 50, 'min_samples_split': 2, 'min_samples_leaf': 1, 'max_features': 'sqrt', 'bootstrap': False, 'criterion': 'squared_error'}. Best is trial 874 with value: 0.32176430753353746.
[I 2024-12-04 20:08:20,887] Trial 993 finished with value: 0.3493861170970311 and parameters: {'n_estimators': 388, 'max_depth': 43, 'min_samples_split': 2, 'min_samples_leaf': 1, 'max_features': 'sqrt', 'bootstrap': False, 'criterion': 'squared_error'}. Best is trial 874 with value: 0.32176430753353746.
[I 2024-12-04 20:08:22,725] Trial 996 finished with value: 0.3235478435313454 and parameters: {'n_estimators': 259, 'max_depth': 50, 'min_samples_split': 2, 'min_samples_leaf': 1, 'max_features': 'sqrt', 'bootstrap': False, 'criterion': 'squared_error'}. Best is trial 874 with value: 0.32176430753353746.
[I 2024-12-04 20:08:24,577] Trial 997 finished with value: 0.391445242512043 and parameters: {'n_estimators': 534, 'max_depth': 50, 'min_samples_split': 4, 'min_samples_leaf': 1, 'max_features': 'sqrt', 'bootstrap': False, 'criterion': 'squared_error'}. Best is trial 874 with value: 0.32176430753353746.
[I 2024-12-04 20:08:27,679] Trial 998 finished with value: 0.5350296779606967 and parameters: {'n_estimators': 830, 'max_depth': 18, 'min_samples_split': 8, 'min_samples_leaf': 6, 'max_features': None, 'bootstrap': True, 'criterion': 'squared_error'}. Best is trial 874 with value: 0.32176430753353746.
[I 2024-12-04 20:08:30,158] Trial 999 finished with value: 0.3276107984118419 and parameters: {'n_estimators': 530, 'max_depth': 50, 'min_samples_split': 2, 'min_samples_leaf': 1, 'max_features': 'sqrt', 'bootstrap': False, 'criterion': 'squared_error'}. Best is trial 874 with value: 0.32176430753353746.
[I 2024-12-04 20:08:31,770] Trial 1000 finished with value: 0.698391085681962 and parameters: {'n_estimators': 573, 'max_depth': 37, 'min_samples_split': 4, 'min_samples_leaf': 1, 'max_features': 'log2', 'bootstrap': False, 'criterion': 'squared_error'}. Best is trial 874 with value: 0.32176430753353746.
[I 2024-12-04 20:08:33,328] Trial 1001 finished with value: 0.3876131222415381 and parameters: {'n_estimators': 390, 'max_depth': 50, 'min_samples_split': 4, 'min_samples_leaf': 1, 'max_features': 'sqrt', 'bootstrap': False, 'criterion': 'squared_error'}. Best is trial 874 with value: 0.32176430753353746.
[I 2024-12-04 20:08:34,594] Trial 1002 finished with value: 0.6959218774035378 and parameters: {'n_estimators': 428, 'max_depth': 26, 'min_samples_split': 16, 'min_samples_leaf': 1, 'max_features': 'sqrt', 'bootstrap': False, 'criterion': 'squared_error'}. Best is trial 874 with value: 0.32176430753353746.
[I 2024-12-04 20:08:37,221] Trial 995 finished with value: 0.7568040976559245 and parameters: {'n_estimators': 935, 'max_depth': 35, 'min_samples_split': 2, 'min_samples_leaf': 1, 'max_features': 'log2', 'bootstrap': False, 'criterion': 'absolute_error'}. Best is trial 874 with value: 0.32176430753353746.
[I 2024-12-04 20:08:38,617] Trial 1004 finished with value: 0.5438220099171425 and parameters: {'n_estimators': 260, 'max_depth': 46, 'min_samples_split': 2, 'min_samples_leaf': 1, 'max_features': 'log2', 'bootstrap': False, 'criterion': 'squared_error'}. Best is trial 874 with value: 0.32176430753353746.
[I 2024-12-04 20:08:40,838] Trial 1005 finished with value: 0.32766889548304623 and parameters: {'n_estimators': 451, 'max_depth': 50, 'min_samples_split': 2, 'min_samples_leaf': 1, 'max_features': 'sqrt', 'bootstrap': False, 'criterion': 'squared_error'}. Best is trial 874 with value: 0.32176430753353746.
[I 2024-12-04 20:08:42,638] Trial 1006 finished with value: 0.3236261716550514 and parameters: {'n_estimators': 326, 'max_depth': 50, 'min_samples_split': 2, 'min_samples_leaf': 1, 'max_features': 'sqrt', 'bootstrap': False, 'criterion': 'squared_error'}. Best is trial 874 with value: 0.32176430753353746.
[I 2024-12-04 20:08:44,728] Trial 1007 finished with value: 0.3237197440041261 and parameters: {'n_estimators': 416, 'max_depth': 50, 'min_samples_split': 2, 'min_samples_leaf': 1, 'max_features': 'sqrt', 'bootstrap': False, 'criterion': 'squared_error'}. Best is trial 874 with value: 0.32176430753353746.
[I 2024-12-04 20:08:47,455] Trial 1003 finished with value: 0.5208648314621022 and parameters: {'n_estimators': 526, 'max_depth': 19, 'min_samples_split': 6, 'min_samples_leaf': 4, 'max_features': None, 'bootstrap': True, 'criterion': 'absolute_error'}. Best is trial 874 with value: 0.32176430753353746.
[I 2024-12-04 20:08:48,817] Trial 1009 finished with value: 0.37762438571686996 and parameters: {'n_estimators': 264, 'max_depth': 44, 'min_samples_split': 3, 'min_samples_leaf': 1, 'max_features': 'sqrt', 'bootstrap': False, 'criterion': 'squared_error'}. Best is trial 874 with value: 0.32176430753353746.
[I 2024-12-04 20:08:49,891] Trial 1008 finished with value: 0.9720685357915196 and parameters: {'n_estimators': 605, 'max_depth': 37, 'min_samples_split': 2, 'min_samples_leaf': 2, 'max_features': 'sqrt', 'bootstrap': True, 'criterion': 'absolute_error'}. Best is trial 874 with value: 0.32176430753353746.
[I 2024-12-04 20:08:50,980] Trial 1011 finished with value: 0.6481409182279935 and parameters: {'n_estimators': 104, 'max_depth': 21, 'min_samples_split': 8, 'min_samples_leaf': 10, 'max_features': None, 'bootstrap': True, 'criterion': 'squared_error'}. Best is trial 874 with value: 0.32176430753353746.
[I 2024-12-04 20:08:52,195] Trial 1012 finished with value: 0.6727381842170259 and parameters: {'n_estimators': 369, 'max_depth': 50, 'min_samples_split': 2, 'min_samples_leaf': 2, 'max_features': 'sqrt', 'bootstrap': False, 'criterion': 'squared_error'}. Best is trial 874 with value: 0.32176430753353746.
[I 2024-12-04 20:08:53,148] Trial 1010 finished with value: 0.8753651009265487 and parameters: {'n_estimators': 229, 'max_depth': 41, 'min_samples_split': 28, 'min_samples_leaf': 1, 'max_features': 'log2', 'bootstrap': False, 'criterion': 'absolute_error'}. Best is trial 874 with value: 0.32176430753353746.
[I 2024-12-04 20:08:53,201] Trial 1013 finished with value: 1.2284910396368345 and parameters: {'n_estimators': 444, 'max_depth': 29, 'min_samples_split': 3, 'min_samples_leaf': 5, 'max_features': 'log2', 'bootstrap': False, 'criterion': 'squared_error'}. Best is trial 874 with value: 0.32176430753353746.
[I 2024-12-04 20:08:55,625] Trial 1014 finished with value: 0.359505719164489 and parameters: {'n_estimators': 453, 'max_depth': 41, 'min_samples_split': 2, 'min_samples_leaf': 1, 'max_features': 'sqrt', 'bootstrap': False, 'criterion': 'squared_error'}. Best is trial 874 with value: 0.32176430753353746.
[I 2024-12-04 20:08:56,824] Trial 1016 finished with value: 0.3864588511960598 and parameters: {'n_estimators': 234, 'max_depth': 49, 'min_samples_split': 4, 'min_samples_leaf': 1, 'max_features': 'sqrt', 'bootstrap': False, 'criterion': 'squared_error'}. Best is trial 874 with value: 0.32176430753353746.
[I 2024-12-04 20:08:58,690] Trial 1017 finished with value: 0.3455000485991264 and parameters: {'n_estimators': 366, 'max_depth': 42, 'min_samples_split': 2, 'min_samples_leaf': 1, 'max_features': 'sqrt', 'bootstrap': False, 'criterion': 'squared_error'}. Best is trial 874 with value: 0.32176430753353746.
[I 2024-12-04 20:09:00,562] Trial 1018 finished with value: 0.3230739760881745 and parameters: {'n_estimators': 353, 'max_depth': 50, 'min_samples_split': 2, 'min_samples_leaf': 1, 'max_features': 'sqrt', 'bootstrap': False, 'criterion': 'squared_error'}. Best is trial 874 with value: 0.32176430753353746.
[I 2024-12-04 20:09:02,576] Trial 1019 finished with value: 0.4967707335451065 and parameters: {'n_estimators': 450, 'max_depth': 50, 'min_samples_split': 2, 'min_samples_leaf': 1, 'max_features': 'log2', 'bootstrap': False, 'criterion': 'squared_error'}. Best is trial 874 with value: 0.32176430753353746.
[I 2024-12-04 20:09:03,328] Trial 1015 finished with value: 0.8696500374264998 and parameters: {'n_estimators': 987, 'max_depth': 33, 'min_samples_split': 4, 'min_samples_leaf': 1, 'max_features': 'log2', 'bootstrap': True, 'criterion': 'absolute_error'}. Best is trial 874 with value: 0.32176430753353746.
[I 2024-12-04 20:09:04,594] Trial 1021 finished with value: 0.6796780333389993 and parameters: {'n_estimators': 389, 'max_depth': 50, 'min_samples_split': 3, 'min_samples_leaf': 2, 'max_features': 'sqrt', 'bootstrap': False, 'criterion': 'squared_error'}. Best is trial 874 with value: 0.32176430753353746.
[I 2024-12-04 20:09:04,656] Trial 1020 finished with value: 1.2271786595691663 and parameters: {'n_estimators': 373, 'max_depth': 43, 'min_samples_split': 3, 'min_samples_leaf': 8, 'max_features': 'sqrt', 'bootstrap': False, 'criterion': 'absolute_error'}. Best is trial 874 with value: 0.32176430753353746.
[I 2024-12-04 20:09:05,921] Trial 1022 finished with value: 0.4130812617429621 and parameters: {'n_estimators': 206, 'max_depth': 41, 'min_samples_split': 4, 'min_samples_leaf': 1, 'max_features': 'sqrt', 'bootstrap': False, 'criterion': 'squared_error'}. Best is trial 874 with value: 0.32176430753353746.
[I 2024-12-04 20:09:07,544] Trial 1024 finished with value: 0.3255720375131862 and parameters: {'n_estimators': 279, 'max_depth': 50, 'min_samples_split': 2, 'min_samples_leaf': 1, 'max_features': 'sqrt', 'bootstrap': False, 'criterion': 'squared_error'}. Best is trial 874 with value: 0.32176430753353746.
[I 2024-12-04 20:09:07,689] Trial 1023 finished with value: 0.4339925461672973 and parameters: {'n_estimators': 252, 'max_depth': 50, 'min_samples_split': 2, 'min_samples_leaf': 1, 'max_features': None, 'bootstrap': False, 'criterion': 'squared_error'}. Best is trial 874 with value: 0.32176430753353746.
[I 2024-12-04 20:09:09,415] Trial 1025 finished with value: 0.343788702390318 and parameters: {'n_estimators': 281, 'max_depth': 43, 'min_samples_split': 2, 'min_samples_leaf': 1, 'max_features': 'sqrt', 'bootstrap': False, 'criterion': 'squared_error'}. Best is trial 874 with value: 0.32176430753353746.
[I 2024-12-04 20:09:11,158] Trial 1026 finished with value: 0.5619437433228297 and parameters: {'n_estimators': 696, 'max_depth': 37, 'min_samples_split': 10, 'min_samples_leaf': 10, 'max_features': None, 'bootstrap': False, 'criterion': 'squared_error'}. Best is trial 874 with value: 0.32176430753353746.
[I 2024-12-04 20:09:11,626] Trial 1027 finished with value: 0.32347932950710123 and parameters: {'n_estimators': 400, 'max_depth': 50, 'min_samples_split': 2, 'min_samples_leaf': 1, 'max_features': 'sqrt', 'bootstrap': False, 'criterion': 'squared_error'}. Best is trial 874 with value: 0.32176430753353746.
[I 2024-12-04 20:09:13,415] Trial 976 finished with value: 0.5231863145463785 and parameters: {'n_estimators': 668, 'max_depth': 12, 'min_samples_split': 13, 'min_samples_leaf': 1, 'max_features': None, 'bootstrap': False, 'criterion': 'absolute_error'}. Best is trial 874 with value: 0.32176430753353746.
[I 2024-12-04 20:09:15,025] Trial 1028 finished with value: 1.214145449408742 and parameters: {'n_estimators': 961, 'max_depth': 47, 'min_samples_split': 40, 'min_samples_leaf': 5, 'max_features': 'sqrt', 'bootstrap': True, 'criterion': 'absolute_error'}. Best is trial 874 with value: 0.32176430753353746.
[I 2024-12-04 20:09:15,137] Trial 1030 finished with value: 0.3935362026757781 and parameters: {'n_estimators': 408, 'max_depth': 42, 'min_samples_split': 3, 'min_samples_leaf': 1, 'max_features': 'sqrt', 'bootstrap': False, 'criterion': 'squared_error'}. Best is trial 874 with value: 0.32176430753353746.
[I 2024-12-04 20:09:16,442] Trial 1031 finished with value: 0.6811791899349993 and parameters: {'n_estimators': 376, 'max_depth': 43, 'min_samples_split': 2, 'min_samples_leaf': 2, 'max_features': 'sqrt', 'bootstrap': False, 'criterion': 'squared_error'}. Best is trial 874 with value: 0.32176430753353746.
[I 2024-12-04 20:09:16,969] Trial 1032 finished with value: 0.4009820697136623 and parameters: {'n_estimators': 300, 'max_depth': 50, 'min_samples_split': 3, 'min_samples_leaf': 1, 'max_features': 'sqrt', 'bootstrap': True, 'criterion': 'squared_error'}. Best is trial 874 with value: 0.32176430753353746.
[I 2024-12-04 20:09:17,769] Trial 1033 finished with value: 0.6632292088539646 and parameters: {'n_estimators': 308, 'max_depth': 50, 'min_samples_split': 2, 'min_samples_leaf': 2, 'max_features': 'sqrt', 'bootstrap': False, 'criterion': 'squared_error'}. Best is trial 874 with value: 0.32176430753353746.
[I 2024-12-04 20:09:18,000] Trial 1034 finished with value: 1.254902395955499 and parameters: {'n_estimators': 167, 'max_depth': 5, 'min_samples_split': 12, 'min_samples_leaf': 4, 'max_features': 'log2', 'bootstrap': True, 'criterion': 'squared_error'}. Best is trial 874 with value: 0.32176430753353746.
[I 2024-12-04 20:09:19,253] Trial 1036 finished with value: 1.1521039746898836 and parameters: {'n_estimators': 357, 'max_depth': 48, 'min_samples_split': 2, 'min_samples_leaf': 2, 'max_features': 'log2', 'bootstrap': True, 'criterion': 'squared_error'}. Best is trial 874 with value: 0.32176430753353746.
[I 2024-12-04 20:09:19,552] Trial 1035 finished with value: 0.34535031087935153 and parameters: {'n_estimators': 297, 'max_depth': 42, 'min_samples_split': 2, 'min_samples_leaf': 1, 'max_features': 'sqrt', 'bootstrap': False, 'criterion': 'squared_error'}. Best is trial 874 with value: 0.32176430753353746.
[I 2024-12-04 20:09:21,200] Trial 1038 finished with value: 0.3224600597597215 and parameters: {'n_estimators': 210, 'max_depth': 50, 'min_samples_split': 2, 'min_samples_leaf': 1, 'max_features': 'sqrt', 'bootstrap': False, 'criterion': 'squared_error'}. Best is trial 874 with value: 0.32176430753353746.
[I 2024-12-04 20:09:21,811] Trial 1037 finished with value: 0.3561545711843616 and parameters: {'n_estimators': 459, 'max_depth': 43, 'min_samples_split': 2, 'min_samples_leaf': 1, 'max_features': 'sqrt', 'bootstrap': False, 'criterion': 'squared_error'}. Best is trial 874 with value: 0.32176430753353746.
[I 2024-12-04 20:09:22,536] Trial 1039 finished with value: 0.33773741834641785 and parameters: {'n_estimators': 124, 'max_depth': 49, 'min_samples_split': 2, 'min_samples_leaf': 1, 'max_features': 'sqrt', 'bootstrap': False, 'criterion': 'squared_error'}. Best is trial 874 with value: 0.32176430753353746.
[I 2024-12-04 20:09:23,015] Trial 1040 finished with value: 1.1216923637540566 and parameters: {'n_estimators': 275, 'max_depth': 5, 'min_samples_split': 3, 'min_samples_leaf': 2, 'max_features': 'sqrt', 'bootstrap': True, 'criterion': 'squared_error'}. Best is trial 874 with value: 0.32176430753353746.
[I 2024-12-04 20:09:24,236] Trial 1041 finished with value: 1.2040504411697663 and parameters: {'n_estimators': 731, 'max_depth': 5, 'min_samples_split': 2, 'min_samples_leaf': 1, 'max_features': 'log2', 'bootstrap': False, 'criterion': 'squared_error'}. Best is trial 874 with value: 0.32176430753353746.
