[I 2024-12-04 12:22:17,951] Trial 469 finished with value: 0.39585048258849015 and parameters: {'n_estimators': 1151, 'learning_rate': 0.053663740160130535, 'max_depth': 6, 'min_samples_split': 2, 'min_samples_leaf': 3, 'subsample': 0.7241729040018571, 'max_features': None}. Best is trial 428 with value: 0.31740361133065975.
[I 2024-12-04 12:22:17,952] Trial 483 finished with value: 0.6154838259155468 and parameters: {'n_estimators': 590, 'learning_rate': 0.04357163878450264, 'max_depth': 5, 'min_samples_split': 3, 'min_samples_leaf': 4, 'subsample': 0.7134223620291975, 'max_features': 'log2'}. Best is trial 428 with value: 0.31740361133065975.
[I 2024-12-04 12:22:18,063] Trial 466 finished with value: 0.3308769582280804 and parameters: {'n_estimators': 1272, 'learning_rate': 0.09574099219562915, 'max_depth': 8, 'min_samples_split': 3, 'min_samples_leaf': 2, 'subsample': 0.7518205521441874, 'max_features': None}. Best is trial 428 with value: 0.31740361133065975.
[I 2024-12-04 12:22:20,543] Trial 472 finished with value: 0.38483033440062936 and parameters: {'n_estimators': 971, 'learning_rate': 0.08929454795740259, 'max_depth': 8, 'min_samples_split': 6, 'min_samples_leaf': 3, 'subsample': 0.6606784741455627, 'max_features': None}. Best is trial 428 with value: 0.31740361133065975.
[I 2024-12-04 12:22:21,236] Trial 477 finished with value: 0.4033963515105504 and parameters: {'n_estimators': 1042, 'learning_rate': 0.0906963364962092, 'max_depth': 3, 'min_samples_split': 6, 'min_samples_leaf': 1, 'subsample': 0.9211344272085338, 'max_features': 'sqrt'}. Best is trial 428 with value: 0.31740361133065975.
[I 2024-12-04 12:22:22,571] Trial 465 finished with value: 0.3827630797047509 and parameters: {'n_estimators': 1450, 'learning_rate': 0.09022905963371025, 'max_depth': 8, 'min_samples_split': 4, 'min_samples_leaf': 1, 'subsample': 0.7234936659196401, 'max_features': None}. Best is trial 428 with value: 0.31740361133065975.
[I 2024-12-04 12:22:24,556] Trial 475 finished with value: 0.33818297342946113 and parameters: {'n_estimators': 966, 'learning_rate': 0.08615372714066437, 'max_depth': 6, 'min_samples_split': 7, 'min_samples_leaf': 2, 'subsample': 0.6322062364807621, 'max_features': None}. Best is trial 428 with value: 0.31740361133065975.
[I 2024-12-04 12:22:25,497] Trial 487 finished with value: 0.4760911822924712 and parameters: {'n_estimators': 669, 'learning_rate': 0.023292309721113347, 'max_depth': 3, 'min_samples_split': 20, 'min_samples_leaf': 1, 'subsample': 0.9887467418335151, 'max_features': None}. Best is trial 428 with value: 0.31740361133065975.
[I 2024-12-04 12:22:26,539] Trial 468 finished with value: 0.39559732415265003 and parameters: {'n_estimators': 1479, 'learning_rate': 0.05854093773906002, 'max_depth': 7, 'min_samples_split': 4, 'min_samples_leaf': 3, 'subsample': 0.7741797610578337, 'max_features': None}. Best is trial 428 with value: 0.31740361133065975.
[I 2024-12-04 12:22:26,805] Trial 496 finished with value: 0.9560843181069159 and parameters: {'n_estimators': 385, 'learning_rate': 0.014274765289132898, 'max_depth': 5, 'min_samples_split': 18, 'min_samples_leaf': 8, 'subsample': 0.8101094672864371, 'max_features': 'log2'}. Best is trial 428 with value: 0.31740361133065975.
[I 2024-12-04 12:22:27,455] Trial 478 finished with value: 0.3924985929700673 and parameters: {'n_estimators': 1059, 'learning_rate': 0.04252089758409374, 'max_depth': 6, 'min_samples_split': 4, 'min_samples_leaf': 3, 'subsample': 0.6573613825251473, 'max_features': None}. Best is trial 428 with value: 0.31740361133065975.
[I 2024-12-04 12:22:29,432] Trial 482 finished with value: 0.409054753404721 and parameters: {'n_estimators': 967, 'learning_rate': 0.049963049797107875, 'max_depth': 5, 'min_samples_split': 5, 'min_samples_leaf': 1, 'subsample': 0.7463852430372253, 'max_features': None}. Best is trial 428 with value: 0.31740361133065975.
[I 2024-12-04 12:22:31,327] Trial 476 finished with value: 0.33940137029498996 and parameters: {'n_estimators': 1229, 'learning_rate': 0.047518123981462226, 'max_depth': 8, 'min_samples_split': 7, 'min_samples_leaf': 2, 'subsample': 0.6703875273316213, 'max_features': None}. Best is trial 428 with value: 0.31740361133065975.
[I 2024-12-04 12:22:32,224] Trial 494 finished with value: 0.4161784302480757 and parameters: {'n_estimators': 696, 'learning_rate': 0.036311242110831185, 'max_depth': 6, 'min_samples_split': 3, 'min_samples_leaf': 2, 'subsample': 0.6178271406191631, 'max_features': 'sqrt'}. Best is trial 428 with value: 0.31740361133065975.
[I 2024-12-04 12:22:33,581] Trial 480 finished with value: 0.3407825633648101 and parameters: {'n_estimators': 1123, 'learning_rate': 0.04336685320302977, 'max_depth': 6, 'min_samples_split': 7, 'min_samples_leaf': 2, 'subsample': 0.734408493831024, 'max_features': None}. Best is trial 428 with value: 0.31740361133065975.
[I 2024-12-04 12:22:36,938] Trial 484 finished with value: 0.38262551113751053 and parameters: {'n_estimators': 1068, 'learning_rate': 0.0648152262591385, 'max_depth': 8, 'min_samples_split': 5, 'min_samples_leaf': 1, 'subsample': 0.7403148365161165, 'max_features': None}. Best is trial 428 with value: 0.31740361133065975.
[I 2024-12-04 12:22:38,384] Trial 489 finished with value: 0.37673231379173916 and parameters: {'n_estimators': 1007, 'learning_rate': 0.021561673682375236, 'max_depth': 12, 'min_samples_split': 4, 'min_samples_leaf': 3, 'subsample': 0.6159150056434157, 'max_features': None}. Best is trial 428 with value: 0.31740361133065975.
[I 2024-12-04 12:22:38,827] Trial 473 finished with value: 0.3955328814708027 and parameters: {'n_estimators': 1453, 'learning_rate': 0.03486851130616707, 'max_depth': 6, 'min_samples_split': 5, 'min_samples_leaf': 3, 'subsample': 0.6954238334586561, 'max_features': None}. Best is trial 428 with value: 0.31740361133065975.
[I 2024-12-04 12:22:40,970] Trial 479 finished with value: 0.37129701808863336 and parameters: {'n_estimators': 1461, 'learning_rate': 0.06663092896439264, 'max_depth': 6, 'min_samples_split': 7, 'min_samples_leaf': 4, 'subsample': 0.6235740876077813, 'max_features': None}. Best is trial 428 with value: 0.31740361133065975.
[I 2024-12-04 12:22:42,862] Trial 488 finished with value: 0.3544915447804938 and parameters: {'n_estimators': 1038, 'learning_rate': 0.010698250085396517, 'max_depth': 12, 'min_samples_split': 4, 'min_samples_leaf': 2, 'subsample': 0.7200080609807761, 'max_features': None}. Best is trial 428 with value: 0.31740361133065975.
[I 2024-12-04 12:22:43,556] Trial 499 finished with value: 0.400237219388641 and parameters: {'n_estimators': 893, 'learning_rate': 0.06443133859180294, 'max_depth': 8, 'min_samples_split': 5, 'min_samples_leaf': 1, 'subsample': 0.6003816491469871, 'max_features': 'log2'}. Best is trial 428 with value: 0.31740361133065975.
[I 2024-12-04 12:22:43,935] Trial 498 finished with value: 0.37250682828808995 and parameters: {'n_estimators': 827, 'learning_rate': 0.07138900181722069, 'max_depth': 7, 'min_samples_split': 8, 'min_samples_leaf': 1, 'subsample': 0.681625065647569, 'max_features': None}. Best is trial 428 with value: 0.31740361133065975.
[I 2024-12-04 12:22:46,105] Trial 503 finished with value: 0.440886933120821 and parameters: {'n_estimators': 823, 'learning_rate': 0.07014382385170753, 'max_depth': 7, 'min_samples_split': 2, 'min_samples_leaf': 3, 'subsample': 0.7659386323743246, 'max_features': 'sqrt'}. Best is trial 428 with value: 0.31740361133065975.
[I 2024-12-04 12:22:46,136] Trial 495 finished with value: 0.377877337148182 and parameters: {'n_estimators': 933, 'learning_rate': 0.0726148567166441, 'max_depth': 8, 'min_samples_split': 12, 'min_samples_leaf': 5, 'subsample': 0.9415323869283987, 'max_features': None}. Best is trial 428 with value: 0.31740361133065975.
[I 2024-12-04 12:22:47,138] Trial 512 finished with value: 0.3976670935836408 and parameters: {'n_estimators': 541, 'learning_rate': 0.055804086875634505, 'max_depth': 3, 'min_samples_split': 7, 'min_samples_leaf': 2, 'subsample': 0.6135098617934005, 'max_features': None}. Best is trial 428 with value: 0.31740361133065975.
[I 2024-12-04 12:22:48,173] Trial 497 finished with value: 0.43996303825579103 and parameters: {'n_estimators': 1148, 'learning_rate': 0.011496103680757208, 'max_depth': 11, 'min_samples_split': 8, 'min_samples_leaf': 3, 'subsample': 0.7362280758588022, 'max_features': 'sqrt'}. Best is trial 428 with value: 0.31740361133065975.
[I 2024-12-04 12:22:48,425] Trial 481 finished with value: 0.3816617603591876 and parameters: {'n_estimators': 1419, 'learning_rate': 0.045059146999323646, 'max_depth': 8, 'min_samples_split': 8, 'min_samples_leaf': 1, 'subsample': 0.7299914072766334, 'max_features': None}. Best is trial 428 with value: 0.31740361133065975.
[I 2024-12-04 12:22:49,245] Trial 518 finished with value: 0.7728755350015364 and parameters: {'n_estimators': 274, 'learning_rate': 0.08562004046814554, 'max_depth': 12, 'min_samples_split': 9, 'min_samples_leaf': 9, 'subsample': 0.8455467297000724, 'max_features': 'log2'}. Best is trial 428 with value: 0.31740361133065975.
[I 2024-12-04 12:22:51,031] Trial 492 finished with value: 0.632498236081097 and parameters: {'n_estimators': 1465, 'learning_rate': 0.04545332827044377, 'max_depth': 9, 'min_samples_split': 4, 'min_samples_leaf': 9, 'subsample': 0.9615034981862711, 'max_features': 'log2'}. Best is trial 428 with value: 0.31740361133065975.
[I 2024-12-04 12:22:51,659] Trial 485 finished with value: 0.3719450094935774 and parameters: {'n_estimators': 1488, 'learning_rate': 0.07542371160469728, 'max_depth': 10, 'min_samples_split': 12, 'min_samples_leaf': 3, 'subsample': 0.7286420324830736, 'max_features': None}. Best is trial 428 with value: 0.31740361133065975.
[I 2024-12-04 12:22:52,575] Trial 500 finished with value: 0.39973258718592053 and parameters: {'n_estimators': 927, 'learning_rate': 0.09877716055831354, 'max_depth': 8, 'min_samples_split': 4, 'min_samples_leaf': 1, 'subsample': 0.7811567074914124, 'max_features': None}. Best is trial 428 with value: 0.31740361133065975.
[I 2024-12-04 12:22:52,636] Trial 507 finished with value: 0.40011301111732095 and parameters: {'n_estimators': 773, 'learning_rate': 0.0676958615242998, 'max_depth': 6, 'min_samples_split': 5, 'min_samples_leaf': 3, 'subsample': 0.7250736830352958, 'max_features': None}. Best is trial 428 with value: 0.31740361133065975.
[I 2024-12-04 12:22:55,243] Trial 510 finished with value: 0.39578893369208756 and parameters: {'n_estimators': 743, 'learning_rate': 0.08042474504720656, 'max_depth': 7, 'min_samples_split': 5, 'min_samples_leaf': 1, 'subsample': 0.6109219428557713, 'max_features': None}. Best is trial 428 with value: 0.31740361133065975.
[I 2024-12-04 12:22:55,298] Trial 490 finished with value: 0.3437086518601039 and parameters: {'n_estimators': 1209, 'learning_rate': 0.024303771549170232, 'max_depth': 12, 'min_samples_split': 5, 'min_samples_leaf': 2, 'subsample': 0.7500042443304475, 'max_features': None}. Best is trial 428 with value: 0.31740361133065975.
[I 2024-12-04 12:22:56,517] Trial 493 finished with value: 0.3366096610309968 and parameters: {'n_estimators': 1186, 'learning_rate': 0.017575295941827666, 'max_depth': 9, 'min_samples_split': 4, 'min_samples_leaf': 2, 'subsample': 0.7789547613176419, 'max_features': None}. Best is trial 428 with value: 0.31740361133065975.
[I 2024-12-04 12:22:58,204] Trial 513 finished with value: 0.4006713570771068 and parameters: {'n_estimators': 812, 'learning_rate': 0.08595095982656077, 'max_depth': 3, 'min_samples_split': 11, 'min_samples_leaf': 4, 'subsample': 0.6570728850770511, 'max_features': None}. Best is trial 428 with value: 0.31740361133065975.
[I 2024-12-04 12:22:58,702] Trial 486 finished with value: 0.39749599307506994 and parameters: {'n_estimators': 1495, 'learning_rate': 0.07085413550448241, 'max_depth': 7, 'min_samples_split': 4, 'min_samples_leaf': 3, 'subsample': 0.7146769288567876, 'max_features': None}. Best is trial 428 with value: 0.31740361133065975.
[I 2024-12-04 12:23:00,475] Trial 508 finished with value: 0.3907755676213928 and parameters: {'n_estimators': 952, 'learning_rate': 0.08022873408430119, 'max_depth': 6, 'min_samples_split': 2, 'min_samples_leaf': 1, 'subsample': 0.7095201693360729, 'max_features': None}. Best is trial 428 with value: 0.31740361133065975.
[I 2024-12-04 12:23:01,151] Trial 511 finished with value: 0.33011840895699307 and parameters: {'n_estimators': 956, 'learning_rate': 0.08108943282692647, 'max_depth': 6, 'min_samples_split': 4, 'min_samples_leaf': 2, 'subsample': 0.6387839568040206, 'max_features': None}. Best is trial 428 with value: 0.31740361133065975.
[I 2024-12-04 12:23:01,171] Trial 491 finished with value: 0.3875051150510339 and parameters: {'n_estimators': 1412, 'learning_rate': 0.051016221206723326, 'max_depth': 9, 'min_samples_split': 5, 'min_samples_leaf': 3, 'subsample': 0.6920927914661528, 'max_features': None}. Best is trial 428 with value: 0.31740361133065975.
[I 2024-12-04 12:23:02,266] Trial 501 finished with value: 0.34374801299091545 and parameters: {'n_estimators': 1162, 'learning_rate': 0.07869613376890289, 'max_depth': 9, 'min_samples_split': 2, 'min_samples_leaf': 2, 'subsample': 0.7882562475522294, 'max_features': None}. Best is trial 428 with value: 0.31740361133065975.
[I 2024-12-04 12:23:05,062] Trial 505 finished with value: 0.5428689941641897 and parameters: {'n_estimators': 1218, 'learning_rate': 0.07648935403617035, 'max_depth': 5, 'min_samples_split': 5, 'min_samples_leaf': 9, 'subsample': 0.8488762993467801, 'max_features': None}. Best is trial 428 with value: 0.31740361133065975.
[I 2024-12-04 12:23:05,114] Trial 504 finished with value: 0.391742426287251 and parameters: {'n_estimators': 1219, 'learning_rate': 0.08125141598791082, 'max_depth': 7, 'min_samples_split': 3, 'min_samples_leaf': 3, 'subsample': 0.7530154514036637, 'max_features': None}. Best is trial 428 with value: 0.31740361133065975.
[I 2024-12-04 12:23:06,459] Trial 515 finished with value: 0.39132036580956453 and parameters: {'n_estimators': 1030, 'learning_rate': 0.06687861786879132, 'max_depth': 3, 'min_samples_split': 7, 'min_samples_leaf': 2, 'subsample': 0.6633625519804828, 'max_features': None}. Best is trial 428 with value: 0.31740361133065975.
[I 2024-12-04 12:23:06,687] Trial 506 finished with value: 0.34001966636672787 and parameters: {'n_estimators': 1236, 'learning_rate': 0.05819369769346715, 'max_depth': 6, 'min_samples_split': 7, 'min_samples_leaf': 2, 'subsample': 0.778296985949695, 'max_features': None}. Best is trial 428 with value: 0.31740361133065975.
[I 2024-12-04 12:23:09,620] Trial 502 finished with value: 0.352865234809001 and parameters: {'n_estimators': 1371, 'learning_rate': 0.08972253949792496, 'max_depth': 10, 'min_samples_split': 3, 'min_samples_leaf': 2, 'subsample': 0.7276340324204321, 'max_features': None}. Best is trial 428 with value: 0.31740361133065975.
[I 2024-12-04 12:23:10,081] Trial 514 finished with value: 0.3792103344872568 and parameters: {'n_estimators': 1114, 'learning_rate': 0.08110528352981633, 'max_depth': 6, 'min_samples_split': 12, 'min_samples_leaf': 1, 'subsample': 0.6255567682714331, 'max_features': None}. Best is trial 428 with value: 0.31740361133065975.
[I 2024-12-04 12:23:14,083] Trial 519 finished with value: 0.3415150477070627 and parameters: {'n_estimators': 972, 'learning_rate': 0.08425178427873098, 'max_depth': 6, 'min_samples_split': 9, 'min_samples_leaf': 2, 'subsample': 0.6176373693024897, 'max_features': None}. Best is trial 428 with value: 0.31740361133065975.
[I 2024-12-04 12:23:14,122] Trial 537 finished with value: 0.5117941694518227 and parameters: {'n_estimators': 460, 'learning_rate': 0.052368347117186874, 'max_depth': 3, 'min_samples_split': 3, 'min_samples_leaf': 4, 'subsample': 0.9988848054070727, 'max_features': 'sqrt'}. Best is trial 428 with value: 0.31740361133065975.
[I 2024-12-04 12:23:15,703] Trial 509 finished with value: 0.3770010344865427 and parameters: {'n_estimators': 1410, 'learning_rate': 0.04037315787648884, 'max_depth': 6, 'min_samples_split': 2, 'min_samples_leaf': 1, 'subsample': 0.719217242408783, 'max_features': None}. Best is trial 428 with value: 0.31740361133065975.
[I 2024-12-04 12:23:15,708] Trial 522 finished with value: 0.3768958024633997 and parameters: {'n_estimators': 868, 'learning_rate': 0.042857411650676594, 'max_depth': 7, 'min_samples_split': 3, 'min_samples_leaf': 1, 'subsample': 0.6401613624094473, 'max_features': None}. Best is trial 428 with value: 0.31740361133065975.
[I 2024-12-04 12:23:20,451] Trial 529 finished with value: 0.3685758295854902 and parameters: {'n_estimators': 828, 'learning_rate': 0.0843959295793754, 'max_depth': 7, 'min_samples_split': 5, 'min_samples_leaf': 4, 'subsample': 0.6707377447489238, 'max_features': None}. Best is trial 428 with value: 0.31740361133065975.
[I 2024-12-04 12:23:21,772] Trial 524 finished with value: 0.3801153675450077 and parameters: {'n_estimators': 954, 'learning_rate': 0.09599670986383935, 'max_depth': 10, 'min_samples_split': 3, 'min_samples_leaf': 1, 'subsample': 0.6799109261976604, 'max_features': None}. Best is trial 428 with value: 0.31740361133065975.
[I 2024-12-04 12:23:22,880] Trial 525 finished with value: 0.4848244158207542 and parameters: {'n_estimators': 1113, 'learning_rate': 0.043468856039683625, 'max_depth': 8, 'min_samples_split': 4, 'min_samples_leaf': 4, 'subsample': 0.7556649810998498, 'max_features': 'log2'}. Best is trial 428 with value: 0.31740361133065975.
[I 2024-12-04 12:23:22,891] Trial 516 finished with value: 0.33592132974253114 and parameters: {'n_estimators': 1308, 'learning_rate': 0.057993466777139, 'max_depth': 9, 'min_samples_split': 2, 'min_samples_leaf': 2, 'subsample': 0.6750456247440522, 'max_features': None}. Best is trial 428 with value: 0.31740361133065975.
[I 2024-12-04 12:23:24,515] Trial 523 finished with value: 0.32364412661553477 and parameters: {'n_estimators': 1064, 'learning_rate': 0.06273888975441808, 'max_depth': 9, 'min_samples_split': 6, 'min_samples_leaf': 2, 'subsample': 0.6727651129710576, 'max_features': None}. Best is trial 428 with value: 0.31740361133065975.
[I 2024-12-04 12:23:25,558] Trial 520 finished with value: 0.41158421272018986 and parameters: {'n_estimators': 1304, 'learning_rate': 0.04337590164631969, 'max_depth': 3, 'min_samples_split': 3, 'min_samples_leaf': 1, 'subsample': 0.7863407685730696, 'max_features': None}. Best is trial 428 with value: 0.31740361133065975.
[I 2024-12-04 12:23:26,530] Trial 517 finished with value: 0.3898989312982775 and parameters: {'n_estimators': 1326, 'learning_rate': 0.09558792839299624, 'max_depth': 8, 'min_samples_split': 3, 'min_samples_leaf': 3, 'subsample': 0.7534270976623613, 'max_features': None}. Best is trial 428 with value: 0.31740361133065975.
[I 2024-12-04 12:23:26,545] Trial 526 finished with value: 0.5517219437725168 and parameters: {'n_estimators': 1225, 'learning_rate': 0.01515180026115743, 'max_depth': 9, 'min_samples_split': 14, 'min_samples_leaf': 3, 'subsample': 0.796924795117201, 'max_features': 'log2'}. Best is trial 428 with value: 0.31740361133065975.
[I 2024-12-04 12:23:27,448] Trial 530 finished with value: 0.3867046596147116 and parameters: {'n_estimators': 965, 'learning_rate': 0.07229846536489885, 'max_depth': 7, 'min_samples_split': 2, 'min_samples_leaf': 3, 'subsample': 0.72188499236488, 'max_features': None}. Best is trial 428 with value: 0.31740361133065975.
[I 2024-12-04 12:23:28,383] Trial 534 finished with value: 0.3920862742912385 and parameters: {'n_estimators': 846, 'learning_rate': 0.012897388025531127, 'max_depth': 9, 'min_samples_split': 2, 'min_samples_leaf': 5, 'subsample': 0.7829340533476179, 'max_features': None}. Best is trial 428 with value: 0.31740361133065975.
[I 2024-12-04 12:23:29,449] Trial 533 finished with value: 0.44544982023236135 and parameters: {'n_estimators': 923, 'learning_rate': 0.011960492686654743, 'max_depth': 4, 'min_samples_split': 13, 'min_samples_leaf': 2, 'subsample': 0.9132528422823438, 'max_features': None}. Best is trial 428 with value: 0.31740361133065975.
[I 2024-12-04 12:23:33,331] Trial 542 finished with value: 0.41755318149980664 and parameters: {'n_estimators': 900, 'learning_rate': 0.07850902665100522, 'max_depth': 5, 'min_samples_split': 7, 'min_samples_leaf': 2, 'subsample': 0.8256166950904579, 'max_features': 'log2'}. Best is trial 428 with value: 0.31740361133065975.
[I 2024-12-04 12:23:34,830] Trial 544 finished with value: 0.5095852443718608 and parameters: {'n_estimators': 887, 'learning_rate': 0.07105953118085036, 'max_depth': 7, 'min_samples_split': 8, 'min_samples_leaf': 5, 'subsample': 0.6679883961385373, 'max_features': 'log2'}. Best is trial 428 with value: 0.31740361133065975.
[I 2024-12-04 12:23:36,053] Trial 521 finished with value: 0.330079670300862 and parameters: {'n_estimators': 1491, 'learning_rate': 0.05463475208588097, 'max_depth': 9, 'min_samples_split': 8, 'min_samples_leaf': 2, 'subsample': 0.6526315839786162, 'max_features': None}. Best is trial 428 with value: 0.31740361133065975.
[I 2024-12-04 12:23:36,752] Trial 527 finished with value: 0.3266605767405123 and parameters: {'n_estimators': 1376, 'learning_rate': 0.08186861619815775, 'max_depth': 5, 'min_samples_split': 2, 'min_samples_leaf': 2, 'subsample': 0.7715513130147842, 'max_features': None}. Best is trial 428 with value: 0.31740361133065975.
[I 2024-12-04 12:23:37,511] Trial 536 finished with value: 0.3772413904963793 and parameters: {'n_estimators': 1109, 'learning_rate': 0.050112958327786464, 'max_depth': 6, 'min_samples_split': 2, 'min_samples_leaf': 1, 'subsample': 0.7596132967252334, 'max_features': None}. Best is trial 428 with value: 0.31740361133065975.
