[I 2024-12-04 12:24:51,398] Trial 2287 finished with value: 0.8960282962261056 and parameters: {'n_estimators': 773, 'max_depth': 5, 'min_samples_split': 6, 'min_samples_leaf': 2, 'max_features': 'log2', 'bootstrap': True, 'criterion': 'absolute_error'}. Best is trial 341 with value: 0.2909369124469028.
[I 2024-12-04 12:24:52,385] Trial 2274 finished with value: 0.44327446286404304 and parameters: {'n_estimators': 150, 'max_depth': 45, 'min_samples_split': 3, 'min_samples_leaf': 6, 'max_features': None, 'bootstrap': True, 'criterion': 'absolute_error'}. Best is trial 341 with value: 0.2909369124469028.
[I 2024-12-04 12:24:56,255] Trial 2294 finished with value: 0.31456651927958373 and parameters: {'n_estimators': 535, 'max_depth': 43, 'min_samples_split': 5, 'min_samples_leaf': 1, 'max_features': 'sqrt', 'bootstrap': False, 'criterion': 'squared_error'}. Best is trial 341 with value: 0.2909369124469028.
[I 2024-12-04 12:24:58,823] Trial 2300 finished with value: 0.3147225673825374 and parameters: {'n_estimators': 210, 'max_depth': 42, 'min_samples_split': 5, 'min_samples_leaf': 1, 'max_features': 'sqrt', 'bootstrap': False, 'criterion': 'squared_error'}. Best is trial 341 with value: 0.2909369124469028.
[I 2024-12-04 12:24:59,390] Trial 2298 finished with value: 0.306615060983516 and parameters: {'n_estimators': 460, 'max_depth': 44, 'min_samples_split': 4, 'min_samples_leaf': 1, 'max_features': 'sqrt', 'bootstrap': False, 'criterion': 'squared_error'}. Best is trial 341 with value: 0.2909369124469028.
[I 2024-12-04 12:25:00,281] Trial 2299 finished with value: 0.3023287174383825 and parameters: {'n_estimators': 246, 'max_depth': 42, 'min_samples_split': 3, 'min_samples_leaf': 1, 'max_features': 'sqrt', 'bootstrap': False, 'criterion': 'squared_error'}. Best is trial 341 with value: 0.2909369124469028.
[I 2024-12-04 12:25:06,581] Trial 2306 finished with value: 0.442742365322305 and parameters: {'n_estimators': 759, 'max_depth': 49, 'min_samples_split': 4, 'min_samples_leaf': 2, 'max_features': 'sqrt', 'bootstrap': False, 'criterion': 'squared_error'}. Best is trial 341 with value: 0.2909369124469028.
[I 2024-12-04 12:25:06,584] Trial 2282 finished with value: 0.793730545848337 and parameters: {'n_estimators': 774, 'max_depth': 30, 'min_samples_split': 50, 'min_samples_leaf': 2, 'max_features': 'log2', 'bootstrap': True, 'criterion': 'absolute_error'}. Best is trial 341 with value: 0.2909369124469028.
[I 2024-12-04 12:25:08,187] Trial 2296 finished with value: 0.4410907322560825 and parameters: {'n_estimators': 531, 'max_depth': 50, 'min_samples_split': 3, 'min_samples_leaf': 2, 'max_features': 'sqrt', 'bootstrap': False, 'criterion': 'squared_error'}. Best is trial 341 with value: 0.2909369124469028.
[I 2024-12-04 12:25:09,672] Trial 2292 finished with value: 0.3820027614956854 and parameters: {'n_estimators': 522, 'max_depth': 40, 'min_samples_split': 3, 'min_samples_leaf': 1, 'max_features': None, 'bootstrap': False, 'criterion': 'squared_error'}. Best is trial 341 with value: 0.2909369124469028.
[I 2024-12-04 12:25:10,302] Trial 2295 finished with value: 0.4109124105123717 and parameters: {'n_estimators': 443, 'max_depth': 44, 'min_samples_split': 34, 'min_samples_leaf': 1, 'max_features': None, 'bootstrap': False, 'criterion': 'squared_error'}. Best is trial 341 with value: 0.2909369124469028.
[I 2024-12-04 12:25:10,431] Trial 2309 finished with value: 0.44333646057281967 and parameters: {'n_estimators': 285, 'max_depth': 50, 'min_samples_split': 2, 'min_samples_leaf': 2, 'max_features': 'sqrt', 'bootstrap': False, 'criterion': 'squared_error'}. Best is trial 341 with value: 0.2909369124469028.
[I 2024-12-04 12:25:10,443] Trial 2313 finished with value: 0.48755484649114056 and parameters: {'n_estimators': 117, 'max_depth': 42, 'min_samples_split': 8, 'min_samples_leaf': 2, 'max_features': 'sqrt', 'bootstrap': True, 'criterion': 'squared_error'}. Best is trial 341 with value: 0.2909369124469028.
[I 2024-12-04 12:25:10,868] Trial 2304 finished with value: 0.4618787880107619 and parameters: {'n_estimators': 202, 'max_depth': 42, 'min_samples_split': 3, 'min_samples_leaf': 2, 'max_features': 'sqrt', 'bootstrap': False, 'criterion': 'absolute_error'}. Best is trial 341 with value: 0.2909369124469028.
[I 2024-12-04 12:25:11,916] Trial 2311 finished with value: 0.30003879847579207 and parameters: {'n_estimators': 258, 'max_depth': 50, 'min_samples_split': 4, 'min_samples_leaf': 1, 'max_features': 'sqrt', 'bootstrap': False, 'criterion': 'squared_error'}. Best is trial 341 with value: 0.2909369124469028.
[I 2024-12-04 12:25:13,991] Trial 2302 finished with value: 0.2982507933913528 and parameters: {'n_estimators': 526, 'max_depth': 50, 'min_samples_split': 2, 'min_samples_leaf': 1, 'max_features': 'sqrt', 'bootstrap': False, 'criterion': 'squared_error'}. Best is trial 341 with value: 0.2909369124469028.
[I 2024-12-04 12:25:14,051] Trial 2308 finished with value: 0.2939895783263259 and parameters: {'n_estimators': 482, 'max_depth': 50, 'min_samples_split': 3, 'min_samples_leaf': 1, 'max_features': 'sqrt', 'bootstrap': False, 'criterion': 'squared_error'}. Best is trial 341 with value: 0.2909369124469028.
[I 2024-12-04 12:25:14,740] Trial 2305 finished with value: 0.2944534896813603 and parameters: {'n_estimators': 397, 'max_depth': 50, 'min_samples_split': 3, 'min_samples_leaf': 1, 'max_features': 'sqrt', 'bootstrap': False, 'criterion': 'squared_error'}. Best is trial 341 with value: 0.2909369124469028.
[I 2024-12-04 12:25:16,920] Trial 2288 finished with value: 0.32239066099187264 and parameters: {'n_estimators': 609, 'max_depth': 40, 'min_samples_split': 3, 'min_samples_leaf': 1, 'max_features': 'sqrt', 'bootstrap': False, 'criterion': 'absolute_error'}. Best is trial 341 with value: 0.2909369124469028.
[I 2024-12-04 12:25:17,068] Trial 2307 finished with value: 0.4407456680667965 and parameters: {'n_estimators': 537, 'max_depth': 50, 'min_samples_split': 4, 'min_samples_leaf': 2, 'max_features': 'sqrt', 'bootstrap': False, 'criterion': 'squared_error'}. Best is trial 341 with value: 0.2909369124469028.
[I 2024-12-04 12:25:17,780] Trial 2286 finished with value: 0.31861996991492925 and parameters: {'n_estimators': 597, 'max_depth': 50, 'min_samples_split': 6, 'min_samples_leaf': 1, 'max_features': 'sqrt', 'bootstrap': False, 'criterion': 'absolute_error'}. Best is trial 341 with value: 0.2909369124469028.
[I 2024-12-04 12:25:18,754] Trial 2258 finished with value: 0.3378852904285227 and parameters: {'n_estimators': 408, 'max_depth': 36, 'min_samples_split': 2, 'min_samples_leaf': 1, 'max_features': None, 'bootstrap': True, 'criterion': 'absolute_error'}. Best is trial 341 with value: 0.2909369124469028.
[I 2024-12-04 12:25:21,959] Trial 2310 finished with value: 0.3072147773372822 and parameters: {'n_estimators': 616, 'max_depth': 43, 'min_samples_split': 4, 'min_samples_leaf': 1, 'max_features': 'sqrt', 'bootstrap': False, 'criterion': 'squared_error'}. Best is trial 341 with value: 0.2909369124469028.
[I 2024-12-04 12:25:22,475] Trial 2317 finished with value: 0.3082097618187749 and parameters: {'n_estimators': 306, 'max_depth': 42, 'min_samples_split': 2, 'min_samples_leaf': 1, 'max_features': 'sqrt', 'bootstrap': False, 'criterion': 'squared_error'}. Best is trial 341 with value: 0.2909369124469028.
[I 2024-12-04 12:25:24,236] Trial 2312 finished with value: 0.29959408968127577 and parameters: {'n_estimators': 746, 'max_depth': 44, 'min_samples_split': 3, 'min_samples_leaf': 1, 'max_features': 'sqrt', 'bootstrap': False, 'criterion': 'squared_error'}. Best is trial 341 with value: 0.2909369124469028.
[I 2024-12-04 12:25:24,484] Trial 2314 finished with value: 0.5656694168172124 and parameters: {'n_estimators': 116, 'max_depth': 21, 'min_samples_split': 13, 'min_samples_leaf': 15, 'max_features': None, 'bootstrap': True, 'criterion': 'absolute_error'}. Best is trial 341 with value: 0.2909369124469028.
[I 2024-12-04 12:25:26,273] Trial 2323 finished with value: 0.4444798950289396 and parameters: {'n_estimators': 679, 'max_depth': 42, 'min_samples_split': 2, 'min_samples_leaf': 2, 'max_features': 'sqrt', 'bootstrap': False, 'criterion': 'squared_error'}. Best is trial 341 with value: 0.2909369124469028.
[I 2024-12-04 12:25:26,363] Trial 2322 finished with value: 0.2997938415006862 and parameters: {'n_estimators': 195, 'max_depth': 43, 'min_samples_split': 3, 'min_samples_leaf': 1, 'max_features': 'sqrt', 'bootstrap': False, 'criterion': 'squared_error'}. Best is trial 341 with value: 0.2909369124469028.
[I 2024-12-04 12:25:26,391] Trial 2318 finished with value: 0.29897485108595245 and parameters: {'n_estimators': 213, 'max_depth': 45, 'min_samples_split': 3, 'min_samples_leaf': 1, 'max_features': 'sqrt', 'bootstrap': False, 'criterion': 'squared_error'}. Best is trial 341 with value: 0.2909369124469028.
[I 2024-12-04 12:25:26,657] Trial 2245 finished with value: 0.4435561023462109 and parameters: {'n_estimators': 513, 'max_depth': 40, 'min_samples_split': 30, 'min_samples_leaf': 2, 'max_features': None, 'bootstrap': False, 'criterion': 'absolute_error'}. Best is trial 341 with value: 0.2909369124469028.
[I 2024-12-04 12:25:27,357] Trial 2320 finished with value: 0.33349418463218744 and parameters: {'n_estimators': 352, 'max_depth': 40, 'min_samples_split': 3, 'min_samples_leaf': 1, 'max_features': 'sqrt', 'bootstrap': True, 'criterion': 'squared_error'}. Best is trial 341 with value: 0.2909369124469028.
[I 2024-12-04 12:25:27,525] Trial 2319 finished with value: 0.3261155871367622 and parameters: {'n_estimators': 199, 'max_depth': 40, 'min_samples_split': 2, 'min_samples_leaf': 1, 'max_features': 'sqrt', 'bootstrap': False, 'criterion': 'absolute_error'}. Best is trial 341 with value: 0.2909369124469028.
[I 2024-12-04 12:25:28,768] Trial 2316 finished with value: 0.4423172762034984 and parameters: {'n_estimators': 526, 'max_depth': 40, 'min_samples_split': 3, 'min_samples_leaf': 5, 'max_features': None, 'bootstrap': False, 'criterion': 'squared_error'}. Best is trial 341 with value: 0.2909369124469028.
[I 2024-12-04 12:25:29,102] Trial 2330 finished with value: 0.7866009676267307 and parameters: {'n_estimators': 128, 'max_depth': 27, 'min_samples_split': 10, 'min_samples_leaf': 2, 'max_features': 'log2', 'bootstrap': True, 'criterion': 'squared_error'}. Best is trial 341 with value: 0.2909369124469028.
[I 2024-12-04 12:25:29,761] Trial 2315 finished with value: 0.29414092378394674 and parameters: {'n_estimators': 642, 'max_depth': 50, 'min_samples_split': 3, 'min_samples_leaf': 1, 'max_features': 'sqrt', 'bootstrap': False, 'criterion': 'squared_error'}. Best is trial 341 with value: 0.2909369124469028.
[I 2024-12-04 12:25:31,744] Trial 2329 finished with value: 0.3071380895093909 and parameters: {'n_estimators': 232, 'max_depth': 43, 'min_samples_split': 4, 'min_samples_leaf': 1, 'max_features': 'sqrt', 'bootstrap': False, 'criterion': 'squared_error'}. Best is trial 341 with value: 0.2909369124469028.
[I 2024-12-04 12:25:31,807] Trial 2327 finished with value: 0.2935604999960715 and parameters: {'n_estimators': 521, 'max_depth': 50, 'min_samples_split': 3, 'min_samples_leaf': 1, 'max_features': 'sqrt', 'bootstrap': False, 'criterion': 'squared_error'}. Best is trial 341 with value: 0.2909369124469028.
[I 2024-12-04 12:25:31,971] Trial 2332 finished with value: 0.30101816816077853 and parameters: {'n_estimators': 118, 'max_depth': 42, 'min_samples_split': 3, 'min_samples_leaf': 1, 'max_features': 'sqrt', 'bootstrap': False, 'criterion': 'squared_error'}. Best is trial 341 with value: 0.2909369124469028.
[I 2024-12-04 12:25:32,246] Trial 2324 finished with value: 0.3841765061874322 and parameters: {'n_estimators': 145, 'max_depth': 50, 'min_samples_split': 4, 'min_samples_leaf': 1, 'max_features': None, 'bootstrap': False, 'criterion': 'squared_error'}. Best is trial 341 with value: 0.2909369124469028.
[I 2024-12-04 12:25:32,248] Trial 2321 finished with value: 0.2940096954816661 and parameters: {'n_estimators': 582, 'max_depth': 50, 'min_samples_split': 3, 'min_samples_leaf': 1, 'max_features': 'sqrt', 'bootstrap': False, 'criterion': 'squared_error'}. Best is trial 341 with value: 0.2909369124469028.
[I 2024-12-04 12:25:32,444] Trial 2325 finished with value: 0.30315119520241846 and parameters: {'n_estimators': 380, 'max_depth': 50, 'min_samples_split': 5, 'min_samples_leaf': 1, 'max_features': 'sqrt', 'bootstrap': False, 'criterion': 'squared_error'}. Best is trial 341 with value: 0.2909369124469028.
[I 2024-12-04 12:25:33,754] Trial 2303 finished with value: 0.5209661078149376 and parameters: {'n_estimators': 768, 'max_depth': 45, 'min_samples_split': 7, 'min_samples_leaf': 11, 'max_features': None, 'bootstrap': True, 'criterion': 'absolute_error'}. Best is trial 341 with value: 0.2909369124469028.
[I 2024-12-04 12:25:34,540] Trial 2326 finished with value: 0.31283791748513295 and parameters: {'n_estimators': 696, 'max_depth': 50, 'min_samples_split': 7, 'min_samples_leaf': 1, 'max_features': 'sqrt', 'bootstrap': False, 'criterion': 'squared_error'}. Best is trial 341 with value: 0.2909369124469028.
[I 2024-12-04 12:25:34,699] Trial 2328 finished with value: 0.46969130385502456 and parameters: {'n_estimators': 680, 'max_depth': 31, 'min_samples_split': 3, 'min_samples_leaf': 8, 'max_features': None, 'bootstrap': True, 'criterion': 'squared_error'}. Best is trial 341 with value: 0.2909369124469028.
[I 2024-12-04 12:25:36,747] Trial 2334 finished with value: 0.33594373211570333 and parameters: {'n_estimators': 604, 'max_depth': 34, 'min_samples_split': 2, 'min_samples_leaf': 1, 'max_features': 'sqrt', 'bootstrap': False, 'criterion': 'squared_error'}. Best is trial 341 with value: 0.2909369124469028.
[I 2024-12-04 12:25:37,195] Trial 2331 finished with value: 0.6983547056200381 and parameters: {'n_estimators': 875, 'max_depth': 43, 'min_samples_split': 5, 'min_samples_leaf': 2, 'max_features': 'log2', 'bootstrap': False, 'criterion': 'squared_error'}. Best is trial 341 with value: 0.2909369124469028.
[I 2024-12-04 12:25:37,776] Trial 2336 finished with value: 0.4464753145499055 and parameters: {'n_estimators': 100, 'max_depth': 42, 'min_samples_split': 4, 'min_samples_leaf': 2, 'max_features': 'sqrt', 'bootstrap': False, 'criterion': 'squared_error'}. Best is trial 341 with value: 0.2909369124469028.
[I 2024-12-04 12:25:39,369] Trial 2339 finished with value: 0.4382517317224057 and parameters: {'n_estimators': 441, 'max_depth': 50, 'min_samples_split': 6, 'min_samples_leaf': 2, 'max_features': 'sqrt', 'bootstrap': False, 'criterion': 'squared_error'}. Best is trial 341 with value: 0.2909369124469028.
[I 2024-12-04 12:25:40,107] Trial 2340 finished with value: 0.2991026196926574 and parameters: {'n_estimators': 129, 'max_depth': 50, 'min_samples_split': 2, 'min_samples_leaf': 1, 'max_features': 'sqrt', 'bootstrap': False, 'criterion': 'squared_error'}. Best is trial 341 with value: 0.2909369124469028.
[I 2024-12-04 12:25:40,972] Trial 2337 finished with value: 0.3869276743315638 and parameters: {'n_estimators': 432, 'max_depth': 50, 'min_samples_split': 4, 'min_samples_leaf': 1, 'max_features': 'log2', 'bootstrap': False, 'criterion': 'squared_error'}. Best is trial 341 with value: 0.2909369124469028.
[I 2024-12-04 12:25:41,011] Trial 2338 finished with value: 0.29453325507216355 and parameters: {'n_estimators': 291, 'max_depth': 50, 'min_samples_split': 3, 'min_samples_leaf': 1, 'max_features': 'sqrt', 'bootstrap': False, 'criterion': 'squared_error'}. Best is trial 341 with value: 0.2909369124469028.
[I 2024-12-04 12:25:43,092] Trial 2291 finished with value: 0.5289584181082382 and parameters: {'n_estimators': 386, 'max_depth': 6, 'min_samples_split': 35, 'min_samples_leaf': 1, 'max_features': None, 'bootstrap': False, 'criterion': 'absolute_error'}. Best is trial 341 with value: 0.2909369124469028.
[I 2024-12-04 12:25:43,112] Trial 2342 finished with value: 0.2956301192634303 and parameters: {'n_estimators': 272, 'max_depth': 49, 'min_samples_split': 2, 'min_samples_leaf': 1, 'max_features': 'sqrt', 'bootstrap': False, 'criterion': 'squared_error'}. Best is trial 341 with value: 0.2909369124469028.
[I 2024-12-04 12:25:44,166] Trial 2335 finished with value: 0.3859119286179686 and parameters: {'n_estimators': 348, 'max_depth': 42, 'min_samples_split': 4, 'min_samples_leaf': 1, 'max_features': None, 'bootstrap': False, 'criterion': 'squared_error'}. Best is trial 341 with value: 0.2909369124469028.
[I 2024-12-04 12:25:44,847] Trial 2346 finished with value: 0.9208136587829768 and parameters: {'n_estimators': 238, 'max_depth': 5, 'min_samples_split': 14, 'min_samples_leaf': 5, 'max_features': 'log2', 'bootstrap': False, 'criterion': 'absolute_error'}. Best is trial 341 with value: 0.2909369124469028.
[I 2024-12-04 12:25:45,531] Trial 2345 finished with value: 0.4436739926556534 and parameters: {'n_estimators': 266, 'max_depth': 50, 'min_samples_split': 3, 'min_samples_leaf': 2, 'max_features': 'sqrt', 'bootstrap': False, 'criterion': 'squared_error'}. Best is trial 341 with value: 0.2909369124469028.
[I 2024-12-04 12:25:49,870] Trial 2351 finished with value: 0.4162880261625733 and parameters: {'n_estimators': 221, 'max_depth': 47, 'min_samples_split': 4, 'min_samples_leaf': 2, 'max_features': None, 'bootstrap': False, 'criterion': 'squared_error'}. Best is trial 341 with value: 0.2909369124469028.
[I 2024-12-04 12:25:50,046] Trial 2358 finished with value: 0.3353431890303948 and parameters: {'n_estimators': 331, 'max_depth': 36, 'min_samples_split': 5, 'min_samples_leaf': 1, 'max_features': 'sqrt', 'bootstrap': False, 'criterion': 'squared_error'}. Best is trial 341 with value: 0.2909369124469028.
[I 2024-12-04 12:25:50,131] Trial 2344 finished with value: 0.44178950677494244 and parameters: {'n_estimators': 514, 'max_depth': 50, 'min_samples_split': 8, 'min_samples_leaf': 2, 'max_features': 'sqrt', 'bootstrap': False, 'criterion': 'squared_error'}. Best is trial 341 with value: 0.2909369124469028.
[I 2024-12-04 12:25:50,414] Trial 2355 finished with value: 0.6963102887361728 and parameters: {'n_estimators': 293, 'max_depth': 40, 'min_samples_split': 3, 'min_samples_leaf': 2, 'max_features': 'log2', 'bootstrap': False, 'criterion': 'squared_error'}. Best is trial 341 with value: 0.2909369124469028.
[I 2024-12-04 12:25:52,629] Trial 2353 finished with value: 0.31136206347611056 and parameters: {'n_estimators': 454, 'max_depth': 42, 'min_samples_split': 4, 'min_samples_leaf': 1, 'max_features': 'sqrt', 'bootstrap': False, 'criterion': 'squared_error'}. Best is trial 341 with value: 0.2909369124469028.
[I 2024-12-04 12:25:53,400] Trial 2343 finished with value: 0.29992876826670606 and parameters: {'n_estimators': 458, 'max_depth': 44, 'min_samples_split': 3, 'min_samples_leaf': 1, 'max_features': 'sqrt', 'bootstrap': False, 'criterion': 'squared_error'}. Best is trial 341 with value: 0.2909369124469028.
[I 2024-12-04 12:25:53,401] Trial 2352 finished with value: 0.3036836269814159 and parameters: {'n_estimators': 431, 'max_depth': 42, 'min_samples_split': 3, 'min_samples_leaf': 1, 'max_features': 'sqrt', 'bootstrap': False, 'criterion': 'squared_error'}. Best is trial 341 with value: 0.2909369124469028.
[I 2024-12-04 12:25:53,729] Trial 2356 finished with value: 0.44133445612551697 and parameters: {'n_estimators': 434, 'max_depth': 50, 'min_samples_split': 3, 'min_samples_leaf': 2, 'max_features': 'sqrt', 'bootstrap': False, 'criterion': 'squared_error'}. Best is trial 341 with value: 0.2909369124469028.
[I 2024-12-04 12:25:54,649] Trial 2341 finished with value: 0.4523241063008429 and parameters: {'n_estimators': 274, 'max_depth': 42, 'min_samples_split': 7, 'min_samples_leaf': 8, 'max_features': None, 'bootstrap': False, 'criterion': 'absolute_error'}. Best is trial 341 with value: 0.2909369124469028.
[I 2024-12-04 12:25:54,657] Trial 2362 finished with value: 0.2965795605833582 and parameters: {'n_estimators': 119, 'max_depth': 50, 'min_samples_split': 3, 'min_samples_leaf': 1, 'max_features': 'sqrt', 'bootstrap': False, 'criterion': 'squared_error'}. Best is trial 341 with value: 0.2909369124469028.
[I 2024-12-04 12:25:54,825] Trial 2349 finished with value: 0.2955576526589898 and parameters: {'n_estimators': 237, 'max_depth': 50, 'min_samples_split': 3, 'min_samples_leaf': 1, 'max_features': 'sqrt', 'bootstrap': False, 'criterion': 'squared_error'}. Best is trial 341 with value: 0.2909369124469028.
[I 2024-12-04 12:25:56,189] Trial 2359 finished with value: 0.4183978890096601 and parameters: {'n_estimators': 300, 'max_depth': 21, 'min_samples_split': 2, 'min_samples_leaf': 1, 'max_features': None, 'bootstrap': False, 'criterion': 'squared_error'}. Best is trial 341 with value: 0.2909369124469028.
[I 2024-12-04 12:25:56,217] Trial 2361 finished with value: 0.6611853951858229 and parameters: {'n_estimators': 468, 'max_depth': 47, 'min_samples_split': 14, 'min_samples_leaf': 4, 'max_features': 'sqrt', 'bootstrap': True, 'criterion': 'squared_error'}. Best is trial 341 with value: 0.2909369124469028.
[I 2024-12-04 12:25:58,112] Trial 2348 finished with value: 0.3780321676457311 and parameters: {'n_estimators': 690, 'max_depth': 50, 'min_samples_split': 2, 'min_samples_leaf': 1, 'max_features': 'log2', 'bootstrap': False, 'criterion': 'squared_error'}. Best is trial 341 with value: 0.2909369124469028.
[I 2024-12-04 12:26:01,923] Trial 2354 finished with value: 0.9155655504515642 and parameters: {'n_estimators': 821, 'max_depth': 21, 'min_samples_split': 13, 'min_samples_leaf': 4, 'max_features': 'log2', 'bootstrap': True, 'criterion': 'absolute_error'}. Best is trial 341 with value: 0.2909369124469028.
