[I 2024-12-04 11:52:00,740] Trial 80 finished with value: 0.4608356013331615 and parameters: {'max_depth': 34, 'min_samples_split': 4, 'min_samples_leaf': 1, 'max_features': 'sqrt', 'criterion': 'squared_error', 'splitter': 'best'}. Best is trial 80 with value: 0.4608356013331615.
[I 2024-12-04 11:52:00,911] Trial 89 finished with value: 0.9982171095081254 and parameters: {'max_depth': 3, 'min_samples_split': 11, 'min_samples_leaf': 10, 'max_features': 'log2', 'criterion': 'friedman_mse', 'splitter': 'best'}. Best is trial 80 with value: 0.4608356013331615.
[I 2024-12-04 11:52:01,019] Trial 77 finished with value: 0.49648306955196436 and parameters: {'max_depth': 35, 'min_samples_split': 6, 'min_samples_leaf': 1, 'max_features': 'sqrt', 'criterion': 'squared_error', 'splitter': 'best'}. Best is trial 80 with value: 0.4608356013331615.
[I 2024-12-04 11:52:01,231] Trial 83 finished with value: 0.5572111891011953 and parameters: {'max_depth': 28, 'min_samples_split': 9, 'min_samples_leaf': 1, 'max_features': 'sqrt', 'criterion': 'squared_error', 'splitter': 'best'}. Best is trial 80 with value: 0.4608356013331615.
[I 2024-12-04 11:52:01,441] Trial 67 finished with value: 0.6013237460643723 and parameters: {'max_depth': 32, 'min_samples_split': 3, 'min_samples_leaf': 3, 'max_features': 'sqrt', 'criterion': 'squared_error', 'splitter': 'best'}. Best is trial 80 with value: 0.4608356013331615.
[I 2024-12-04 11:52:01,833] Trial 84 finished with value: 0.49648306955196436 and parameters: {'max_depth': 35, 'min_samples_split': 6, 'min_samples_leaf': 1, 'max_features': 'sqrt', 'criterion': 'squared_error', 'splitter': 'best'}. Best is trial 80 with value: 0.4608356013331615.
[I 2024-12-04 11:52:02,039] Trial 79 finished with value: 0.9625068790481612 and parameters: {'max_depth': 31, 'min_samples_split': 17, 'min_samples_leaf': 5, 'max_features': 'log2', 'criterion': 'friedman_mse', 'splitter': 'random'}. Best is trial 80 with value: 0.4608356013331615.
[I 2024-12-04 11:52:02,771] Trial 82 finished with value: 0.5277805349720892 and parameters: {'max_depth': 26, 'min_samples_split': 6, 'min_samples_leaf': 1, 'max_features': 'sqrt', 'criterion': 'squared_error', 'splitter': 'best'}. Best is trial 80 with value: 0.4608356013331615.
[I 2024-12-04 11:52:03,074] Trial 88 finished with value: 0.5046594238588045 and parameters: {'max_depth': 34, 'min_samples_split': 11, 'min_samples_leaf': 1, 'max_features': 'sqrt', 'criterion': 'squared_error', 'splitter': 'best'}. Best is trial 91 with value: 0.43250115503666103.
[I 2024-12-04 11:52:03,824] Trial 86 finished with value: 0.5794287558563788 and parameters: {'max_depth': 35, 'min_samples_split': 6, 'min_samples_leaf': 1, 'max_features': 'sqrt', 'criterion': 'squared_error', 'splitter': 'random'}. Best is trial 91 with value: 0.43250115503666103.
[I 2024-12-04 11:52:03,885] Trial 85 finished with value: 0.5760333365700355 and parameters: {'max_depth': 34, 'min_samples_split': 5, 'min_samples_leaf': 1, 'max_features': 'log2', 'criterion': 'squared_error', 'splitter': 'best'}. Best is trial 91 with value: 0.43250115503666103.
[I 2024-12-04 11:52:04,108] Trial 78 finished with value: 0.47393114690358407 and parameters: {'max_depth': 33, 'min_samples_split': 10, 'min_samples_leaf': 1, 'max_features': 'sqrt', 'criterion': 'squared_error', 'splitter': 'best'}. Best is trial 91 with value: 0.43250115503666103.
[I 2024-12-04 11:52:04,514] Trial 97 finished with value: 0.47389393414562636 and parameters: {'max_depth': 32, 'min_samples_split': 10, 'min_samples_leaf': 1, 'max_features': 'sqrt', 'criterion': 'squared_error', 'splitter': 'best'}. Best is trial 91 with value: 0.43250115503666103.
[I 2024-12-04 11:52:04,635] Trial 87 finished with value: 0.7022451691006478 and parameters: {'max_depth': 33, 'min_samples_split': 4, 'min_samples_leaf': 2, 'max_features': 'sqrt', 'criterion': 'friedman_mse', 'splitter': 'random'}. Best is trial 91 with value: 0.43250115503666103.
[I 2024-12-04 11:52:05,326] Trial 100 finished with value: 0.9290874899162039 and parameters: {'max_depth': 5, 'min_samples_split': 20, 'min_samples_leaf': 10, 'max_features': 'sqrt', 'criterion': 'squared_error', 'splitter': 'best'}. Best is trial 91 with value: 0.43250115503666103.
[I 2024-12-04 11:52:05,415] Trial 102 finished with value: 0.5149867750224701 and parameters: {'max_depth': 31, 'min_samples_split': 8, 'min_samples_leaf': 1, 'max_features': 'sqrt', 'criterion': 'squared_error', 'splitter': 'best'}. Best is trial 91 with value: 0.43250115503666103.
[I 2024-12-04 11:52:05,645] Trial 91 finished with value: 0.43250115503666103 and parameters: {'max_depth': 34, 'min_samples_split': 3, 'min_samples_leaf': 1, 'max_features': 'sqrt', 'criterion': 'friedman_mse', 'splitter': 'best'}. Best is trial 91 with value: 0.43250115503666103.
[I 2024-12-04 11:52:05,665] Trial 104 finished with value: 0.483263059820054 and parameters: {'max_depth': 35, 'min_samples_split': 5, 'min_samples_leaf': 1, 'max_features': 'sqrt', 'criterion': 'friedman_mse', 'splitter': 'best'}. Best is trial 91 with value: 0.43250115503666103.
[I 2024-12-04 11:52:05,934] Trial 92 finished with value: 0.6122970500864531 and parameters: {'max_depth': 33, 'min_samples_split': 5, 'min_samples_leaf': 4, 'max_features': 'sqrt', 'criterion': 'friedman_mse', 'splitter': 'best'}. Best is trial 91 with value: 0.43250115503666103.
[I 2024-12-04 11:52:06,291] Trial 94 finished with value: 0.5670371176593827 and parameters: {'max_depth': 35, 'min_samples_split': 3, 'min_samples_leaf': 3, 'max_features': 'sqrt', 'criterion': 'absolute_error', 'splitter': 'best'}. Best is trial 91 with value: 0.43250115503666103.
[I 2024-12-04 11:52:06,411] Trial 96 finished with value: 0.6123058195588575 and parameters: {'max_depth': 24, 'min_samples_split': 10, 'min_samples_leaf': 4, 'max_features': 'sqrt', 'criterion': 'squared_error', 'splitter': 'best'}. Best is trial 91 with value: 0.43250115503666103.
[I 2024-12-04 11:52:07,104] Trial 103 finished with value: 0.5170399151403982 and parameters: {'max_depth': 34, 'min_samples_split': 2, 'min_samples_leaf': 1, 'max_features': 'sqrt', 'criterion': 'friedman_mse', 'splitter': 'best'}. Best is trial 91 with value: 0.43250115503666103.
[I 2024-12-04 11:52:07,578] Trial 93 finished with value: 0.45634040793959746 and parameters: {'max_depth': 35, 'min_samples_split': 3, 'min_samples_leaf': 1, 'max_features': 'sqrt', 'criterion': 'squared_error', 'splitter': 'best'}. Best is trial 91 with value: 0.43250115503666103.
[I 2024-12-04 11:52:11,191] Trial 95 finished with value: 0.5962481028674813 and parameters: {'max_depth': 30, 'min_samples_split': 12, 'min_samples_leaf': 4, 'max_features': 'sqrt', 'criterion': 'absolute_error', 'splitter': 'best'}. Best is trial 91 with value: 0.43250115503666103.
[I 2024-12-04 11:52:12,103] Trial 98 finished with value: 0.4692825943101316 and parameters: {'max_depth': 32, 'min_samples_split': 11, 'min_samples_leaf': 1, 'max_features': 'sqrt', 'criterion': 'squared_error', 'splitter': 'best'}. Best is trial 91 with value: 0.43250115503666103.
[I 2024-12-04 11:52:13,205] Trial 108 finished with value: 0.9877831730635036 and parameters: {'max_depth': 15, 'min_samples_split': 2, 'min_samples_leaf': 4, 'max_features': 'log2', 'criterion': 'absolute_error', 'splitter': 'best'}. Best is trial 91 with value: 0.43250115503666103.
[I 2024-12-04 11:52:13,366] Trial 106 finished with value: 0.9618554461006263 and parameters: {'max_depth': 18, 'min_samples_split': 16, 'min_samples_leaf': 7, 'max_features': 'log2', 'criterion': 'squared_error', 'splitter': 'random'}. Best is trial 91 with value: 0.43250115503666103.
[I 2024-12-04 11:52:13,826] Trial 112 finished with value: 0.9597516113963797 and parameters: {'max_depth': 4, 'min_samples_split': 3, 'min_samples_leaf': 8, 'max_features': 'sqrt', 'criterion': 'friedman_mse', 'splitter': 'random'}. Best is trial 91 with value: 0.43250115503666103.
[I 2024-12-04 11:52:13,847] Trial 99 finished with value: 0.5023968247525797 and parameters: {'max_depth': 33, 'min_samples_split': 8, 'min_samples_leaf': 1, 'max_features': 'sqrt', 'criterion': 'squared_error', 'splitter': 'best'}. Best is trial 91 with value: 0.43250115503666103.
[I 2024-12-04 11:52:14,063] Trial 101 finished with value: 0.45634040793959746 and parameters: {'max_depth': 35, 'min_samples_split': 3, 'min_samples_leaf': 1, 'max_features': 'sqrt', 'criterion': 'squared_error', 'splitter': 'best'}. Best is trial 91 with value: 0.43250115503666103.
[I 2024-12-04 11:52:15,106] Trial 119 finished with value: 0.7866914548466943 and parameters: {'max_depth': 15, 'min_samples_split': 12, 'min_samples_leaf': 8, 'max_features': 'sqrt', 'criterion': 'friedman_mse', 'splitter': 'best'}. Best is trial 91 with value: 0.43250115503666103.
[I 2024-12-04 11:52:15,452] Trial 107 finished with value: 0.6162759041297469 and parameters: {'max_depth': 27, 'min_samples_split': 11, 'min_samples_leaf': 2, 'max_features': 'sqrt', 'criterion': 'squared_error', 'splitter': 'best'}. Best is trial 91 with value: 0.43250115503666103.
[I 2024-12-04 11:52:16,824] Trial 105 finished with value: 0.5932604510569024 and parameters: {'max_depth': 35, 'min_samples_split': 9, 'min_samples_leaf': 3, 'max_features': 'sqrt', 'criterion': 'squared_error', 'splitter': 'best'}. Best is trial 91 with value: 0.43250115503666103.
[I 2024-12-04 11:52:16,841] Trial 109 finished with value: 0.6013237460643723 and parameters: {'max_depth': 33, 'min_samples_split': 2, 'min_samples_leaf': 3, 'max_features': 'sqrt', 'criterion': 'squared_error', 'splitter': 'best'}. Best is trial 91 with value: 0.43250115503666103.
[I 2024-12-04 11:52:18,807] Trial 117 finished with value: 0.5046594238588045 and parameters: {'max_depth': 34, 'min_samples_split': 11, 'min_samples_leaf': 1, 'max_features': 'sqrt', 'criterion': 'friedman_mse', 'splitter': 'best'}. Best is trial 91 with value: 0.43250115503666103.
[I 2024-12-04 11:52:18,904] Trial 110 finished with value: 0.4399442512678781 and parameters: {'max_depth': 35, 'min_samples_split': 14, 'min_samples_leaf': 1, 'max_features': 'sqrt', 'criterion': 'friedman_mse', 'splitter': 'best'}. Best is trial 91 with value: 0.43250115503666103.
[I 2024-12-04 11:52:19,217] Trial 113 finished with value: 0.690049769205312 and parameters: {'max_depth': 21, 'min_samples_split': 11, 'min_samples_leaf': 1, 'max_features': 'log2', 'criterion': 'squared_error', 'splitter': 'best'}. Best is trial 91 with value: 0.43250115503666103.
[I 2024-12-04 11:52:19,733] Trial 123 finished with value: 0.8268502795966516 and parameters: {'max_depth': 21, 'min_samples_split': 10, 'min_samples_leaf': 1, 'max_features': 'sqrt', 'criterion': 'absolute_error', 'splitter': 'random'}. Best is trial 91 with value: 0.43250115503666103.
[I 2024-12-04 11:52:19,844] Trial 90 finished with value: 0.5103528621329001 and parameters: {'max_depth': 27, 'min_samples_split': 11, 'min_samples_leaf': 1, 'max_features': 'sqrt', 'criterion': 'squared_error', 'splitter': 'best'}. Best is trial 91 with value: 0.43250115503666103.
[I 2024-12-04 11:52:20,129] Trial 125 finished with value: 0.4956835384456977 and parameters: {'max_depth': 30, 'min_samples_split': 2, 'min_samples_leaf': 1, 'max_features': 'sqrt', 'criterion': 'squared_error', 'splitter': 'best'}. Best is trial 91 with value: 0.43250115503666103.
[I 2024-12-04 11:52:20,386] Trial 116 finished with value: 0.9597516113963797 and parameters: {'max_depth': 35, 'min_samples_split': 2, 'min_samples_leaf': 10, 'max_features': 'sqrt', 'criterion': 'friedman_mse', 'splitter': 'random'}. Best is trial 91 with value: 0.43250115503666103.
[I 2024-12-04 11:52:20,855] Trial 124 finished with value: 0.5084457464831265 and parameters: {'max_depth': 34, 'min_samples_split': 9, 'min_samples_leaf': 1, 'max_features': 'sqrt', 'criterion': 'squared_error', 'splitter': 'best'}. Best is trial 91 with value: 0.43250115503666103.
[I 2024-12-04 11:52:20,881] Trial 111 finished with value: 0.5087801556889375 and parameters: {'max_depth': 33, 'min_samples_split': 4, 'min_samples_leaf': 1, 'max_features': 'sqrt', 'criterion': 'squared_error', 'splitter': 'best'}. Best is trial 91 with value: 0.43250115503666103.
[I 2024-12-04 11:52:22,312] Trial 115 finished with value: 0.5273419897492498 and parameters: {'max_depth': 35, 'min_samples_split': 15, 'min_samples_leaf': 1, 'max_features': 'sqrt', 'criterion': 'friedman_mse', 'splitter': 'best'}. Best is trial 91 with value: 0.43250115503666103.
[I 2024-12-04 11:52:22,577] Trial 114 finished with value: 0.6123058195588575 and parameters: {'max_depth': 34, 'min_samples_split': 13, 'min_samples_leaf': 4, 'max_features': 'sqrt', 'criterion': 'friedman_mse', 'splitter': 'best'}. Best is trial 91 with value: 0.43250115503666103.
[I 2024-12-04 11:52:22,740] Trial 127 finished with value: 0.4560512309740644 and parameters: {'max_depth': 33, 'min_samples_split': 3, 'min_samples_leaf': 1, 'max_features': 'sqrt', 'criterion': 'squared_error', 'splitter': 'best'}. Best is trial 91 with value: 0.43250115503666103.
[I 2024-12-04 11:52:23,010] Trial 121 finished with value: 0.5169616672710112 and parameters: {'max_depth': 33, 'min_samples_split': 2, 'min_samples_leaf': 1, 'max_features': 'sqrt', 'criterion': 'absolute_error', 'splitter': 'best'}. Best is trial 91 with value: 0.43250115503666103.
[I 2024-12-04 11:52:23,112] Trial 131 finished with value: 0.8950106185763959 and parameters: {'max_depth': 35, 'min_samples_split': 9, 'min_samples_leaf': 2, 'max_features': 'log2', 'criterion': 'friedman_mse', 'splitter': 'random'}. Best is trial 91 with value: 0.43250115503666103.
[I 2024-12-04 11:52:23,724] Trial 129 finished with value: 0.8544503264648242 and parameters: {'max_depth': 31, 'min_samples_split': 2, 'min_samples_leaf': 2, 'max_features': 'log2', 'criterion': 'friedman_mse', 'splitter': 'best'}. Best is trial 91 with value: 0.43250115503666103.
[I 2024-12-04 11:52:23,725] Trial 133 finished with value: 0.9982171095081254 and parameters: {'max_depth': 18, 'min_samples_split': 14, 'min_samples_leaf': 5, 'max_features': 'log2', 'criterion': 'friedman_mse', 'splitter': 'best'}. Best is trial 91 with value: 0.43250115503666103.
[I 2024-12-04 11:52:23,836] Trial 120 finished with value: 0.5615513230084576 and parameters: {'max_depth': 30, 'min_samples_split': 11, 'min_samples_leaf': 2, 'max_features': 'sqrt', 'criterion': 'squared_error', 'splitter': 'best'}. Best is trial 91 with value: 0.43250115503666103.
[I 2024-12-04 11:52:24,350] Trial 135 finished with value: 0.6013237460643723 and parameters: {'max_depth': 35, 'min_samples_split': 3, 'min_samples_leaf': 3, 'max_features': 'sqrt', 'criterion': 'squared_error', 'splitter': 'best'}. Best is trial 91 with value: 0.43250115503666103.
[I 2024-12-04 11:52:24,721] Trial 122 finished with value: 0.524743745773334 and parameters: {'max_depth': 31, 'min_samples_split': 11, 'min_samples_leaf': 1, 'max_features': 'sqrt', 'criterion': 'squared_error', 'splitter': 'best'}. Best is trial 91 with value: 0.43250115503666103.
[I 2024-12-04 11:52:25,811] Trial 132 finished with value: 0.46648192070200095 and parameters: {'max_depth': 34, 'min_samples_split': 5, 'min_samples_leaf': 1, 'max_features': 'sqrt', 'criterion': 'squared_error', 'splitter': 'best'}. Best is trial 91 with value: 0.43250115503666103.
[I 2024-12-04 11:52:26,746] Trial 138 finished with value: 0.49400130203858805 and parameters: {'max_depth': 31, 'min_samples_split': 3, 'min_samples_leaf': 1, 'max_features': 'sqrt', 'criterion': 'squared_error', 'splitter': 'best'}. Best is trial 91 with value: 0.43250115503666103.
[I 2024-12-04 11:52:27,597] Trial 146 finished with value: 0.47344856982335537 and parameters: {'max_depth': 35, 'min_samples_split': 12, 'min_samples_leaf': 1, 'max_features': 'sqrt', 'criterion': 'friedman_mse', 'splitter': 'best'}. Best is trial 91 with value: 0.43250115503666103.
[I 2024-12-04 11:52:28,488] Trial 137 finished with value: 0.9672233286520945 and parameters: {'max_depth': 2, 'min_samples_split': 19, 'min_samples_leaf': 6, 'max_features': 'sqrt', 'criterion': 'squared_error', 'splitter': 'random'}. Best is trial 91 with value: 0.43250115503666103.
[I 2024-12-04 11:52:28,725] Trial 139 finished with value: 0.4899680550638981 and parameters: {'max_depth': 32, 'min_samples_split': 2, 'min_samples_leaf': 1, 'max_features': 'sqrt', 'criterion': 'squared_error', 'splitter': 'best'}. Best is trial 91 with value: 0.43250115503666103.
[I 2024-12-04 11:52:28,837] Trial 130 finished with value: 0.9592348303220608 and parameters: {'max_depth': 3, 'min_samples_split': 4, 'min_samples_leaf': 4, 'max_features': 'sqrt', 'criterion': 'squared_error', 'splitter': 'best'}. Best is trial 91 with value: 0.43250115503666103.
[I 2024-12-04 11:52:29,019] Trial 141 finished with value: 0.5615465456057973 and parameters: {'max_depth': 29, 'min_samples_split': 12, 'min_samples_leaf': 2, 'max_features': 'sqrt', 'criterion': 'friedman_mse', 'splitter': 'best'}. Best is trial 91 with value: 0.43250115503666103.
[I 2024-12-04 11:52:29,054] Trial 136 finished with value: 0.8535375409234314 and parameters: {'max_depth': 33, 'min_samples_split': 20, 'min_samples_leaf': 2, 'max_features': 'log2', 'criterion': 'friedman_mse', 'splitter': 'best'}. Best is trial 91 with value: 0.43250115503666103.
[I 2024-12-04 11:52:29,266] Trial 126 finished with value: 0.5459840798044118 and parameters: {'max_depth': 34, 'min_samples_split': 13, 'min_samples_leaf': 2, 'max_features': 'sqrt', 'criterion': 'friedman_mse', 'splitter': 'best'}. Best is trial 91 with value: 0.43250115503666103.
[I 2024-12-04 11:52:29,274] Trial 145 finished with value: 0.9984670529576771 and parameters: {'max_depth': 6, 'min_samples_split': 10, 'min_samples_leaf': 10, 'max_features': 'log2', 'criterion': 'absolute_error', 'splitter': 'random'}. Best is trial 91 with value: 0.43250115503666103.
[I 2024-12-04 11:52:29,303] Trial 143 finished with value: 0.6859098086587614 and parameters: {'max_depth': 20, 'min_samples_split': 4, 'min_samples_leaf': 1, 'max_features': 'log2', 'criterion': 'squared_error', 'splitter': 'best'}. Best is trial 91 with value: 0.43250115503666103.
[I 2024-12-04 11:52:29,729] Trial 149 finished with value: 0.9624515588731141 and parameters: {'max_depth': 3, 'min_samples_split': 20, 'min_samples_leaf': 1, 'max_features': 'log2', 'criterion': 'friedman_mse', 'splitter': 'random'}. Best is trial 91 with value: 0.43250115503666103.
[I 2024-12-04 11:52:29,756] Trial 118 finished with value: 0.47495142754566344 and parameters: {'max_depth': 35, 'min_samples_split': 11, 'min_samples_leaf': 1, 'max_features': 'sqrt', 'criterion': 'squared_error', 'splitter': 'best'}. Best is trial 91 with value: 0.43250115503666103.
[I 2024-12-04 11:52:29,821] Trial 152 finished with value: 0.5478661222947624 and parameters: {'max_depth': 28, 'min_samples_split': 5, 'min_samples_leaf': 1, 'max_features': 'sqrt', 'criterion': 'friedman_mse', 'splitter': 'best'}. Best is trial 91 with value: 0.43250115503666103.
[I 2024-12-04 11:52:30,203] Trial 147 finished with value: 0.43250115503666103 and parameters: {'max_depth': 34, 'min_samples_split': 3, 'min_samples_leaf': 1, 'max_features': 'sqrt', 'criterion': 'squared_error', 'splitter': 'best'}. Best is trial 91 with value: 0.43250115503666103.
[I 2024-12-04 11:52:30,597] Trial 150 finished with value: 0.9982171095081254 and parameters: {'max_depth': 26, 'min_samples_split': 20, 'min_samples_leaf': 8, 'max_features': 'log2', 'criterion': 'friedman_mse', 'splitter': 'best'}. Best is trial 91 with value: 0.43250115503666103.
[I 2024-12-04 11:52:31,036] Trial 128 finished with value: 0.6013142233711787 and parameters: {'max_depth': 26, 'min_samples_split': 5, 'min_samples_leaf': 2, 'max_features': 'sqrt', 'criterion': 'squared_error', 'splitter': 'best'}. Best is trial 91 with value: 0.43250115503666103.
[I 2024-12-04 11:52:31,184] Trial 140 finished with value: 0.543086762165181 and parameters: {'max_depth': 35, 'min_samples_split': 11, 'min_samples_leaf': 1, 'max_features': 'log2', 'criterion': 'friedman_mse', 'splitter': 'best'}. Best is trial 91 with value: 0.43250115503666103.
[I 2024-12-04 11:52:31,185] Trial 144 finished with value: 0.5046594238588045 and parameters: {'max_depth': 34, 'min_samples_split': 11, 'min_samples_leaf': 1, 'max_features': 'sqrt', 'criterion': 'friedman_mse', 'splitter': 'best'}. Best is trial 91 with value: 0.43250115503666103.
[I 2024-12-04 11:52:31,780] Trial 154 finished with value: 0.8114443707361809 and parameters: {'max_depth': 8, 'min_samples_split': 20, 'min_samples_leaf': 1, 'max_features': 'sqrt', 'criterion': 'friedman_mse', 'splitter': 'best'}. Best is trial 91 with value: 0.43250115503666103.
[I 2024-12-04 11:52:31,892] Trial 151 finished with value: 0.48720407820762895 and parameters: {'max_depth': 29, 'min_samples_split': 12, 'min_samples_leaf': 1, 'max_features': 'sqrt', 'criterion': 'friedman_mse', 'splitter': 'best'}. Best is trial 91 with value: 0.43250115503666103.
[I 2024-12-04 11:52:33,064] Trial 142 finished with value: 0.9982171095081254 and parameters: {'max_depth': 27, 'min_samples_split': 3, 'min_samples_leaf': 8, 'max_features': 'log2', 'criterion': 'squared_error', 'splitter': 'best'}. Best is trial 91 with value: 0.43250115503666103.
[I 2024-12-04 11:52:33,416] Trial 156 finished with value: 0.5109654269115765 and parameters: {'max_depth': 35, 'min_samples_split': 2, 'min_samples_leaf': 1, 'max_features': 'sqrt', 'criterion': 'squared_error', 'splitter': 'best'}. Best is trial 91 with value: 0.43250115503666103.
[I 2024-12-04 11:52:33,456] Trial 159 finished with value: 0.9986705309945677 and parameters: {'max_depth': 3, 'min_samples_split': 6, 'min_samples_leaf': 8, 'max_features': 'log2', 'criterion': 'absolute_error', 'splitter': 'best'}. Best is trial 91 with value: 0.43250115503666103.
