[I 2024-12-04 00:07:45,987] Trial 425 finished with value: 0.24815097580342155 and parameters: {'kernel': 'rbf', 'C': 73.03712291767879, 'gamma': 0.0011335850096980526, 'epsilon': 0.013965013215070425}. Best is trial 270 with value: 0.14046642316818972.
[I 2024-12-04 00:07:46,292] Trial 419 finished with value: 0.14045935495434503 and parameters: {'kernel': 'rbf', 'C': 86.2219453819088, 'gamma': 0.008660937005337042, 'epsilon': 0.0012243131079591953}. Best is trial 419 with value: 0.14045935495434503.
[I 2024-12-04 00:07:46,753] Trial 424 finished with value: 0.14638445125980906 and parameters: {'kernel': 'rbf', 'C': 88.98739150557476, 'gamma': 0.006548240859015962, 'epsilon': 0.005437735494651141}. Best is trial 419 with value: 0.14045935495434503.
[I 2024-12-04 00:07:47,421] Trial 415 finished with value: 0.21292839271848119 and parameters: {'kernel': 'rbf', 'C': 93.3697719695379, 'gamma': 0.05914575821314802, 'epsilon': 0.002377507607981868}. Best is trial 419 with value: 0.14045935495434503.
[I 2024-12-04 00:07:47,536] Trial 427 finished with value: 0.1570804528697308 and parameters: {'kernel': 'rbf', 'C': 66.34451944640244, 'gamma': 0.005807933601964072, 'epsilon': 0.008697006850659855}. Best is trial 419 with value: 0.14045935495434503.
[I 2024-12-04 00:07:47,578] Trial 416 finished with value: 0.1559670375771944 and parameters: {'kernel': 'rbf', 'C': 96.89472631217788, 'gamma': 0.012819067134523625, 'epsilon': 0.004023470485136886}. Best is trial 419 with value: 0.14045935495434503.
[I 2024-12-04 00:07:47,895] Trial 417 finished with value: 0.18160863931110513 and parameters: {'kernel': 'rbf', 'C': 93.90299790101484, 'gamma': 0.029731086543289695, 'epsilon': 0.005822412171623996}. Best is trial 419 with value: 0.14045935495434503.
[I 2024-12-04 00:07:48,334] Trial 426 finished with value: 0.14572034504892015 and parameters: {'kernel': 'rbf', 'C': 68.2036824477028, 'gamma': 0.011729480204339757, 'epsilon': 0.00584484389225525}. Best is trial 419 with value: 0.14045935495434503.
[I 2024-12-04 00:07:48,472] Trial 431 finished with value: 0.2241665715615513 and parameters: {'kernel': 'rbf', 'C': 12.425058954766538, 'gamma': 0.009074724236876539, 'epsilon': 0.001342116672899636}. Best is trial 419 with value: 0.14045935495434503.
[I 2024-12-04 00:07:48,513] Trial 433 finished with value: 0.8714518484177615 and parameters: {'kernel': 'poly', 'C': 0.001409677566038506, 'gamma': 0.03653534490634856, 'epsilon': 0.37940592925974703}. Best is trial 419 with value: 0.14045935495434503.
[I 2024-12-04 00:07:48,977] Trial 430 finished with value: 0.16107316390687637 and parameters: {'kernel': 'rbf', 'C': 97.46579845936833, 'gamma': 0.004174343569172455, 'epsilon': 0.002459502583496394}. Best is trial 419 with value: 0.14045935495434503.
[I 2024-12-04 00:07:49,301] Trial 428 finished with value: 0.14147521660262555 and parameters: {'kernel': 'rbf', 'C': 82.50112722653122, 'gamma': 0.008857553668615646, 'epsilon': 0.0024888186929509413}. Best is trial 419 with value: 0.14045935495434503.
[I 2024-12-04 00:07:49,724] Trial 435 finished with value: 0.8871455047097809 and parameters: {'kernel': 'rbf', 'C': 0.02576810791215165, 'gamma': 0.2311602080383461, 'epsilon': 0.9001889522701587}. Best is trial 419 with value: 0.14045935495434503.
[I 2024-12-04 00:07:49,828] Trial 434 finished with value: 0.25701773978180115 and parameters: {'kernel': 'rbf', 'C': 31.314492531347728, 'gamma': 0.002155412672010085, 'epsilon': 0.0011212188778784117}. Best is trial 419 with value: 0.14045935495434503.
[I 2024-12-04 00:07:51,530] Trial 429 finished with value: 0.1404218388856788 and parameters: {'kernel': 'rbf', 'C': 91.40860281829303, 'gamma': 0.00906558420351028, 'epsilon': 0.0010127213514332868}. Best is trial 429 with value: 0.1404218388856788.
[I 2024-12-04 00:07:52,044] Trial 437 finished with value: 0.14754582614827386 and parameters: {'kernel': 'rbf', 'C': 35.106005428504055, 'gamma': 0.012522309846723527, 'epsilon': 0.001886206630310219}. Best is trial 429 with value: 0.1404218388856788.
[I 2024-12-04 00:07:52,140] Trial 438 finished with value: 0.18900084910552478 and parameters: {'kernel': 'rbf', 'C': 18.288007595901373, 'gamma': 0.009847104189016867, 'epsilon': 0.0027827674196406727}. Best is trial 429 with value: 0.1404218388856788.
[I 2024-12-04 00:07:52,275] Trial 432 finished with value: 0.16746407974252753 and parameters: {'kernel': 'rbf', 'C': 93.89107400781646, 'gamma': 0.016342848406791257, 'epsilon': 0.0018141742310262652}. Best is trial 429 with value: 0.1404218388856788.
[I 2024-12-04 00:07:52,563] Trial 440 finished with value: 0.5438265269054966 and parameters: {'kernel': 'linear', 'C': 0.005875111012760387, 'gamma': 0.1496313091658996, 'epsilon': 0.06520550167346507}. Best is trial 429 with value: 0.1404218388856788.
[I 2024-12-04 00:07:52,680] Trial 441 finished with value: 0.7052674061895654 and parameters: {'kernel': 'sigmoid', 'C': 1.1126818053160388, 'gamma': 0.0002890576482099338, 'epsilon': 0.15125769203576253}. Best is trial 429 with value: 0.1404218388856788.
[I 2024-12-04 00:07:53,402] Trial 439 finished with value: 0.205276039372274 and parameters: {'kernel': 'rbf', 'C': 36.18949651521701, 'gamma': 0.004832252754225205, 'epsilon': 0.0010106108232671505}. Best is trial 429 with value: 0.1404218388856788.
[I 2024-12-04 00:07:54,505] Trial 443 finished with value: 0.14261432770940696 and parameters: {'kernel': 'rbf', 'C': 65.84364405637581, 'gamma': 0.008441388247631024, 'epsilon': 0.0010126344487321089}. Best is trial 429 with value: 0.1404218388856788.
[I 2024-12-04 00:07:54,506] Trial 445 finished with value: 0.22222925566264895 and parameters: {'kernel': 'rbf', 'C': 73.97692334521099, 'gamma': 0.0021238143707649677, 'epsilon': 0.0012034406900453536}. Best is trial 429 with value: 0.1404218388856788.
[I 2024-12-04 00:07:54,660] Trial 78 finished with value: 0.5483484548812795 and parameters: {'kernel': 'poly', 'C': 52.47665038238672, 'gamma': 0.02261539235531881, 'epsilon': 0.045792241722915815}. Best is trial 429 with value: 0.1404218388856788.
[I 2024-12-04 00:07:55,913] Trial 442 finished with value: 0.1440162747023703 and parameters: {'kernel': 'rbf', 'C': 68.25590374090696, 'gamma': 0.011126329063780404, 'epsilon': 0.002380938329684546}. Best is trial 429 with value: 0.1404218388856788.
[I 2024-12-04 00:07:56,004] Trial 449 finished with value: 0.6973312466891403 and parameters: {'kernel': 'poly', 'C': 20.593640777195542, 'gamma': 0.006649697545228068, 'epsilon': 0.0015521378371997217}. Best is trial 429 with value: 0.1404218388856788.
[I 2024-12-04 00:07:56,038] Trial 436 finished with value: 0.34077130909711983 and parameters: {'kernel': 'linear', 'C': 1.0421391843733936, 'gamma': 0.6408352092549127, 'epsilon': 0.008934857424736773}. Best is trial 429 with value: 0.1404218388856788.
[I 2024-12-04 00:07:56,296] Trial 451 finished with value: 211.13473539660694 and parameters: {'kernel': 'sigmoid', 'C': 83.97363745329497, 'gamma': 0.002378206936762321, 'epsilon': 0.001757377777459217}. Best is trial 429 with value: 0.1404218388856788.
[I 2024-12-04 00:07:56,574] Trial 446 finished with value: 0.6032219468945721 and parameters: {'kernel': 'poly', 'C': 7.796026039207375, 'gamma': 0.015278213971807498, 'epsilon': 0.0016085675514762323}. Best is trial 429 with value: 0.1404218388856788.
[I 2024-12-04 00:07:57,133] Trial 444 finished with value: 0.2026799583438129 and parameters: {'kernel': 'rbf', 'C': 45.87699854647465, 'gamma': 0.05487129963422928, 'epsilon': 0.001412385375385504}. Best is trial 429 with value: 0.1404218388856788.
[I 2024-12-04 00:07:57,290] Trial 452 finished with value: 0.19990226089013433 and parameters: {'kernel': 'rbf', 'C': 52.94075846865243, 'gamma': 0.003808394932467869, 'epsilon': 0.0010031970092267296}. Best is trial 429 with value: 0.1404218388856788.
[I 2024-12-04 00:07:57,571] Trial 453 finished with value: 0.21297815402682713 and parameters: {'kernel': 'rbf', 'C': 5.757633537042767, 'gamma': 0.01843494818475954, 'epsilon': 0.0010306053425741736}. Best is trial 429 with value: 0.1404218388856788.
[I 2024-12-04 00:07:57,670] Trial 450 finished with value: 0.1490536368828351 and parameters: {'kernel': 'rbf', 'C': 79.50053081612225, 'gamma': 0.006127742426536762, 'epsilon': 0.001530892273888395}. Best is trial 429 with value: 0.1404218388856788.
[I 2024-12-04 00:07:58,525] Trial 456 finished with value: 0.27805577187311775 and parameters: {'kernel': 'rbf', 'C': 10.717631924780374, 'gamma': 0.0035462779457310963, 'epsilon': 0.0028308579636520037}. Best is trial 429 with value: 0.1404218388856788.
[I 2024-12-04 00:07:58,775] Trial 448 finished with value: 0.13989258940934515 and parameters: {'kernel': 'rbf', 'C': 97.70183780441288, 'gamma': 0.00808384191621168, 'epsilon': 0.0015896497877248002}. Best is trial 448 with value: 0.13989258940934515.
[I 2024-12-04 00:07:58,776] Trial 455 finished with value: 0.14889223368823812 and parameters: {'kernel': 'rbf', 'C': 42.9622117924527, 'gamma': 0.009181138257305863, 'epsilon': 0.0013727173957909526}. Best is trial 448 with value: 0.13989258940934515.
[I 2024-12-04 00:07:59,700] Trial 458 finished with value: 0.14802843170811658 and parameters: {'kernel': 'rbf', 'C': 45.904004520913276, 'gamma': 0.008837540429119804, 'epsilon': 0.0014281475571187037}. Best is trial 448 with value: 0.13989258940934515.
[I 2024-12-04 00:07:59,701] Trial 447 finished with value: 0.18180206374558422 and parameters: {'kernel': 'rbf', 'C': 89.10338487316892, 'gamma': 0.028657133749292442, 'epsilon': 0.002508147586256561}. Best is trial 448 with value: 0.13989258940934515.
[I 2024-12-04 00:08:00,487] Trial 457 finished with value: 0.14771043703208403 and parameters: {'kernel': 'rbf', 'C': 80.34292629864743, 'gamma': 0.006353898590091479, 'epsilon': 0.0027437364885610086}. Best is trial 448 with value: 0.13989258940934515.
[I 2024-12-04 00:08:00,973] Trial 460 finished with value: 0.5440401686151315 and parameters: {'kernel': 'rbf', 'C': 7.5262190826295505, 'gamma': 0.00017492155922724904, 'epsilon': 0.00291226633633558}. Best is trial 448 with value: 0.13989258940934515.
[I 2024-12-04 00:08:01,917] Trial 459 finished with value: 0.1467528086119501 and parameters: {'kernel': 'rbf', 'C': 42.37683847833187, 'gamma': 0.013486758752345736, 'epsilon': 0.0013069962363573104}. Best is trial 448 with value: 0.13989258940934515.
[I 2024-12-04 00:08:02,557] Trial 463 finished with value: 0.1483474936189631 and parameters: {'kernel': 'rbf', 'C': 47.08481072449393, 'gamma': 0.00853456554721435, 'epsilon': 0.0010178033186073127}. Best is trial 448 with value: 0.13989258940934515.
[I 2024-12-04 00:08:02,628] Trial 462 finished with value: 0.1550957659453596 and parameters: {'kernel': 'rbf', 'C': 91.68428481881526, 'gamma': 0.004943286698522312, 'epsilon': 0.0015530258849548325}. Best is trial 448 with value: 0.13989258940934515.
[I 2024-12-04 00:08:02,742] Trial 464 finished with value: 0.1729889804014667 and parameters: {'kernel': 'rbf', 'C': 15.55021492687105, 'gamma': 0.014215495593499987, 'epsilon': 0.0010232959117645532}. Best is trial 448 with value: 0.13989258940934515.
[I 2024-12-04 00:08:02,771] Trial 454 finished with value: 0.17170335378219898 and parameters: {'kernel': 'rbf', 'C': 98.97863638882029, 'gamma': 0.01946806090141265, 'epsilon': 0.0013232475589331225}. Best is trial 448 with value: 0.13989258940934515.
[I 2024-12-04 00:08:03,440] Trial 469 finished with value: 0.7945401583850241 and parameters: {'kernel': 'rbf', 'C': 0.3182125010979174, 'gamma': 0.00015648324929596133, 'epsilon': 0.010057345446666073}. Best is trial 448 with value: 0.13989258940934515.
[I 2024-12-04 00:08:03,614] Trial 461 finished with value: 0.14354590573457504 and parameters: {'kernel': 'rbf', 'C': 74.33743771039725, 'gamma': 0.011067074350612589, 'epsilon': 0.0016444284241349113}. Best is trial 448 with value: 0.13989258940934515.
[I 2024-12-04 00:08:03,615] Trial 465 finished with value: 0.14632464532311792 and parameters: {'kernel': 'rbf', 'C': 49.69427772194052, 'gamma': 0.00881069581324036, 'epsilon': 0.0013738014892039497}. Best is trial 448 with value: 0.13989258940934515.
[I 2024-12-04 00:08:03,780] Trial 468 finished with value: 35.32978619477427 and parameters: {'kernel': 'sigmoid', 'C': 1.5282265878648826, 'gamma': 0.04700247294313917, 'epsilon': 0.844837152210432}. Best is trial 448 with value: 0.13989258940934515.
[I 2024-12-04 00:08:04,308] Trial 470 finished with value: 0.37371204625659293 and parameters: {'kernel': 'rbf', 'C': 13.4913197195237, 'gamma': 0.0008565284072197478, 'epsilon': 0.0029203667678425953}. Best is trial 448 with value: 0.13989258940934515.
[I 2024-12-04 00:08:04,701] Trial 467 finished with value: 0.1405500886509388 and parameters: {'kernel': 'rbf', 'C': 94.8898858489495, 'gamma': 0.007164126131222001, 'epsilon': 0.001442952247172354}. Best is trial 448 with value: 0.13989258940934515.
[I 2024-12-04 00:08:06,493] Trial 471 finished with value: 0.14459558104602294 and parameters: {'kernel': 'rbf', 'C': 70.25472640402661, 'gamma': 0.011122782000356352, 'epsilon': 0.0010001011245501237}. Best is trial 448 with value: 0.13989258940934515.
[I 2024-12-04 00:08:06,586] Trial 127 finished with value: 0.3553384650774538 and parameters: {'kernel': 'linear', 'C': 61.102380215514366, 'gamma': 0.0034316770702331285, 'epsilon': 0.026771710064255633}. Best is trial 448 with value: 0.13989258940934515.
[I 2024-12-04 00:08:06,926] Trial 472 finished with value: 0.15431000418602644 and parameters: {'kernel': 'rbf', 'C': 96.86789829044666, 'gamma': 0.004881096420463246, 'epsilon': 0.0010906407463502086}. Best is trial 448 with value: 0.13989258940934515.
[I 2024-12-04 00:08:06,990] Trial 480 finished with value: 0.8706103533446449 and parameters: {'kernel': 'poly', 'C': 0.04358561878960709, 'gamma': 0.011325936833526106, 'epsilon': 0.009803747716934225}. Best is trial 448 with value: 0.13989258940934515.
[I 2024-12-04 00:08:07,471] Trial 473 finished with value: 0.17954118066278088 and parameters: {'kernel': 'rbf', 'C': 61.971710032840896, 'gamma': 0.0044217896974258, 'epsilon': 0.0011229583014196489}. Best is trial 448 with value: 0.13989258940934515.
[I 2024-12-04 00:08:09,027] Trial 482 finished with value: 0.20947099406931036 and parameters: {'kernel': 'rbf', 'C': 75.22849002215965, 'gamma': 0.0025633381398039064, 'epsilon': 0.001082666523526794}. Best is trial 448 with value: 0.13989258940934515.
[I 2024-12-04 00:08:09,426] Trial 474 finished with value: 0.14311985272575284 and parameters: {'kernel': 'rbf', 'C': 74.38734666541518, 'gamma': 0.007565069222909311, 'epsilon': 0.0011750117575632533}. Best is trial 448 with value: 0.13989258940934515.
[I 2024-12-04 00:08:09,891] Trial 484 finished with value: 0.30540337572269255 and parameters: {'kernel': 'rbf', 'C': 7.1124872437625175, 'gamma': 0.0031299513182729034, 'epsilon': 0.0010948780198170025}. Best is trial 448 with value: 0.13989258940934515.
[I 2024-12-04 00:08:10,315] Trial 475 finished with value: 0.20442541316186855 and parameters: {'kernel': 'rbf', 'C': 65.48110631911875, 'gamma': 0.05259551888400189, 'epsilon': 0.0015493041731143558}. Best is trial 448 with value: 0.13989258940934515.
[I 2024-12-04 00:08:10,378] Trial 477 finished with value: 0.1403579675593918 and parameters: {'kernel': 'rbf', 'C': 98.70232112229627, 'gamma': 0.008270010013580242, 'epsilon': 0.002867994863774751}. Best is trial 448 with value: 0.13989258940934515.
[I 2024-12-04 00:08:10,695] Trial 483 finished with value: 0.17960943783594996 and parameters: {'kernel': 'rbf', 'C': 6.466981137985037, 'gamma': 0.040759642595501626, 'epsilon': 0.0022874272628656037}. Best is trial 448 with value: 0.13989258940934515.
[I 2024-12-04 00:08:10,989] Trial 479 finished with value: 0.15037360833297753 and parameters: {'kernel': 'rbf', 'C': 81.92823587471084, 'gamma': 0.01255073122882807, 'epsilon': 0.0011174098092924063}. Best is trial 448 with value: 0.13989258940934515.
[I 2024-12-04 00:08:10,990] Trial 478 finished with value: 0.18805906183888146 and parameters: {'kernel': 'rbf', 'C': 98.43663420016331, 'gamma': 0.033678614370513046, 'epsilon': 0.001603541548751364}. Best is trial 448 with value: 0.13989258940934515.
[I 2024-12-04 00:08:12,116] Trial 489 finished with value: 0.33280157573832003 and parameters: {'kernel': 'linear', 'C': 0.4859789019531092, 'gamma': 0.0002278484295600593, 'epsilon': 0.03232560355450737}. Best is trial 448 with value: 0.13989258940934515.
[I 2024-12-04 00:08:12,154] Trial 488 finished with value: 0.1684705483444361 and parameters: {'kernel': 'rbf', 'C': 98.00752772537959, 'gamma': 0.0036673680747840135, 'epsilon': 0.0019146473417059524}. Best is trial 448 with value: 0.13989258940934515.
[I 2024-12-04 00:08:13,521] Trial 487 finished with value: 0.1541307520854057 and parameters: {'kernel': 'rbf', 'C': 92.77707555661402, 'gamma': 0.00504258155005883, 'epsilon': 0.001974905769317985}. Best is trial 448 with value: 0.13989258940934515.
[I 2024-12-04 00:08:13,756] Trial 494 finished with value: 0.2240268995890071 and parameters: {'kernel': 'rbf', 'C': 7.65483453927639, 'gamma': 0.013182172839957679, 'epsilon': 0.0010639300574922593}. Best is trial 448 with value: 0.13989258940934515.
[I 2024-12-04 00:08:13,912] Trial 491 finished with value: 0.1969908119351449 and parameters: {'kernel': 'rbf', 'C': 85.10130842915558, 'gamma': 0.002816251196143553, 'epsilon': 0.0017087803264127317}. Best is trial 448 with value: 0.13989258940934515.
[I 2024-12-04 00:08:14,995] Trial 493 finished with value: 0.1612742229901005 and parameters: {'kernel': 'rbf', 'C': 94.47931652418406, 'gamma': 0.00426559542548555, 'epsilon': 0.0018079963090821825}. Best is trial 448 with value: 0.13989258940934515.
[I 2024-12-04 00:08:15,274] Trial 495 finished with value: 0.302714344793742 and parameters: {'kernel': 'rbf', 'C': 10.800046307771677, 'gamma': 0.002299218791046848, 'epsilon': 0.0033406030271043996}. Best is trial 448 with value: 0.13989258940934515.
[I 2024-12-04 00:08:15,343] Trial 486 finished with value: 0.18301573943253577 and parameters: {'kernel': 'rbf', 'C': 67.07232442557181, 'gamma': 0.03160718473637432, 'epsilon': 0.0010802212870986755}. Best is trial 448 with value: 0.13989258940934515.
[I 2024-12-04 00:08:16,113] Trial 485 finished with value: 0.17188338615852788 and parameters: {'kernel': 'rbf', 'C': 96.78529722335105, 'gamma': 0.019989896149431554, 'epsilon': 0.0018682446107299974}. Best is trial 448 with value: 0.13989258940934515.
[I 2024-12-04 00:08:16,116] Trial 492 finished with value: 0.14716682395423894 and parameters: {'kernel': 'rbf', 'C': 71.67673189861836, 'gamma': 0.012392311137631127, 'epsilon': 0.00120673763627112}. Best is trial 448 with value: 0.13989258940934515.
[I 2024-12-04 00:08:16,455] Trial 498 finished with value: 0.2750485116927433 and parameters: {'kernel': 'rbf', 'C': 8.955192193031431, 'gamma': 0.004494175239622915, 'epsilon': 0.0030512816955175657}. Best is trial 448 with value: 0.13989258940934515.
[I 2024-12-04 00:08:16,603] Trial 490 finished with value: 0.17194626728948448 and parameters: {'kernel': 'rbf', 'C': 91.3198663460998, 'gamma': 0.02091163630109753, 'epsilon': 0.0026911344161115033}. Best is trial 448 with value: 0.13989258940934515.
[I 2024-12-04 00:08:16,604] Trial 496 finished with value: 0.15316845102354745 and parameters: {'kernel': 'rbf', 'C': 15.168089233861428, 'gamma': 0.025313551577451167, 'epsilon': 0.00258034931979112}. Best is trial 448 with value: 0.13989258940934515.
[I 2024-12-04 00:08:17,650] Trial 499 finished with value: 0.15982253480749142 and parameters: {'kernel': 'rbf', 'C': 87.26707159920319, 'gamma': 0.004620417905219039, 'epsilon': 0.003395804157651127}. Best is trial 448 with value: 0.13989258940934515.
[I 2024-12-04 00:08:18,414] Trial 497 finished with value: 0.1449603757012821 and parameters: {'kernel': 'rbf', 'C': 94.02992106972027, 'gamma': 0.006284220407766293, 'epsilon': 0.001972212573803678}. Best is trial 448 with value: 0.13989258940934515.
[I 2024-12-04 00:08:18,864] Trial 267 finished with value: 0.35395063286081513 and parameters: {'kernel': 'linear', 'C': 54.13568317334435, 'gamma': 0.019621466109556337, 'epsilon': 0.03340993740488099}. Best is trial 448 with value: 0.13989258940934515.
[I 2024-12-04 00:08:18,954] Trial 503 finished with value: 0.20134845640196292 and parameters: {'kernel': 'rbf', 'C': 81.06565627510186, 'gamma': 0.002716402215332133, 'epsilon': 0.0030341837941993094}. Best is trial 448 with value: 0.13989258940934515.
[I 2024-12-04 00:08:20,432] Trial 505 finished with value: 653.7773490518064 and parameters: {'kernel': 'sigmoid', 'C': 43.819748059804155, 'gamma': 0.012694520406576615, 'epsilon': 0.001247950805001654}. Best is trial 448 with value: 0.13989258940934515.
[I 2024-12-04 00:08:20,482] Trial 507 finished with value: 885.196564646896 and parameters: {'kernel': 'sigmoid', 'C': 52.04878211613389, 'gamma': 0.01607262805882783, 'epsilon': 0.0022127635051325287}. Best is trial 448 with value: 0.13989258940934515.
[I 2024-12-04 00:08:20,484] Trial 504 finished with value: 0.15177202677094934 and parameters: {'kernel': 'rbf', 'C': 67.2153055007912, 'gamma': 0.006340064898201519, 'epsilon': 0.0011330350887649608}. Best is trial 448 with value: 0.13989258940934515.
[I 2024-12-04 00:08:20,980] Trial 510 finished with value: 0.577384078876974 and parameters: {'kernel': 'sigmoid', 'C': 39.54634689965661, 'gamma': 0.00012295156056171176, 'epsilon': 0.2956722946733308}. Best is trial 448 with value: 0.13989258940934515.
[I 2024-12-04 00:08:21,810] Trial 501 finished with value: 0.17460534728504473 and parameters: {'kernel': 'rbf', 'C': 98.45190702593902, 'gamma': 0.022787075034731506, 'epsilon': 0.001515478794008456}. Best is trial 448 with value: 0.13989258940934515.
