[I 2024-12-04 19:43:23,437] Trial 107 finished with value: 0.3592157223988778 and parameters: {'kernel_type': 'Matern', 'length_scale': 0.4069058916526471, 'noise_level': 0.03665484535771419, 'constant_value': 46533.05456091194, 'nu': 0.5}. Best is trial 103 with value: 0.3592104079601842.
[I 2024-12-04 19:43:25,210] Trial 108 finished with value: 0.35921128324622886 and parameters: {'kernel_type': 'Matern', 'length_scale': 0.3317906979989776, 'noise_level': 2.4286966745337982e-05, 'constant_value': 5.896695900716651e-05, 'nu': 0.5}. Best is trial 103 with value: 0.3592104079601842.
[I 2024-12-04 19:43:26,204] Trial 109 finished with value: 0.42868351215601186 and parameters: {'kernel_type': 'RBF', 'length_scale': 1.2451689951374325, 'noise_level': 0.7567714261862046, 'constant_value': 116.24781241882629, 'nu': 0.5}. Best is trial 103 with value: 0.3592104079601842.
[I 2024-12-04 19:43:29,958] Trial 110 finished with value: 0.3592112797088157 and parameters: {'kernel_type': 'Matern', 'length_scale': 7.527411555592085, 'noise_level': 0.015147060201061349, 'constant_value': 51283.980545259205, 'nu': 0.5}. Best is trial 103 with value: 0.3592104079601842.
[I 2024-12-04 19:43:30,949] Trial 112 finished with value: 0.35921013248560313 and parameters: {'kernel_type': 'Matern', 'length_scale': 0.42187837783451754, 'noise_level': 7.812487645822212e-05, 'constant_value': 33.114781229807654, 'nu': 0.5}. Best is trial 112 with value: 0.35921013248560313.
[I 2024-12-04 19:43:31,521] Trial 111 finished with value: 0.42270169053411316 and parameters: {'kernel_type': 'Matern', 'length_scale': 2.637010119701835, 'noise_level': 0.03427445459866347, 'constant_value': 18787.79164076787, 'nu': 1.5}. Best is trial 112 with value: 0.35921013248560313.
[I 2024-12-04 19:43:33,820] Trial 114 finished with value: 1.0916559457884498 and parameters: {'kernel_type': 'Matern', 'length_scale': 1.6246653387691041, 'noise_level': 5.2674327150440634e-06, 'constant_value': 103.20443469541135, 'nu': 0.5}. Best is trial 112 with value: 0.35921013248560313.
[I 2024-12-04 19:43:35,979] Trial 115 finished with value: 0.35921124602032756 and parameters: {'kernel_type': 'Matern', 'length_scale': 1.2477436817009588, 'noise_level': 0.011534503609262486, 'constant_value': 211.26632251449934, 'nu': 0.5}. Best is trial 112 with value: 0.35921013248560313.
[I 2024-12-04 19:43:36,220] Trial 113 finished with value: 0.359211328807101 and parameters: {'kernel_type': 'Matern', 'length_scale': 0.18660481859422048, 'noise_level': 0.837857893703017, 'constant_value': 19201.381460246674, 'nu': 0.5}. Best is trial 112 with value: 0.35921013248560313.
[I 2024-12-04 19:43:38,180] Trial 116 finished with value: 1.0624161173497906 and parameters: {'kernel_type': 'Matern', 'length_scale': 0.0035449676935326974, 'noise_level': 5.450414853902857e-05, 'constant_value': 33.52471846063983, 'nu': 0.5}. Best is trial 112 with value: 0.35921013248560313.
[I 2024-12-04 19:43:41,910] Trial 118 finished with value: 0.3592112407547177 and parameters: {'kernel_type': 'Matern', 'length_scale': 25.340617450709267, 'noise_level': 0.46833622105527534, 'constant_value': 43150.73703828827, 'nu': 0.5}. Best is trial 112 with value: 0.35921013248560313.
[I 2024-12-04 19:43:43,120] Trial 119 finished with value: 0.359211471673432 and parameters: {'kernel_type': 'Matern', 'length_scale': 3.4123155209954463, 'noise_level': 0.8416401891996913, 'constant_value': 1.8082450928431297, 'nu': 0.5}. Best is trial 112 with value: 0.35921013248560313.
[I 2024-12-04 19:43:43,716] Trial 117 finished with value: 1.0624161172369202 and parameters: {'kernel_type': 'RBF', 'length_scale': 98.59939642940856, 'noise_level': 0.020358403310421495, 'constant_value': 0.00012525942677140903, 'nu': 2.5}. Best is trial 112 with value: 0.35921013248560313.
[I 2024-12-04 19:43:45,219] Trial 120 finished with value: 1.0916558493890016 and parameters: {'kernel_type': 'RBF', 'length_scale': 6.096311414611505e-05, 'noise_level': 7.667660260104236e-09, 'constant_value': 3089.678877348893, 'nu': 0.5}. Best is trial 112 with value: 0.35921013248560313.
[I 2024-12-04 19:43:48,768] Trial 121 finished with value: 1.062416117590216 and parameters: {'kernel_type': 'Matern', 'length_scale': 26.385092780682307, 'noise_level': 3.321907195913236e-05, 'constant_value': 2.8597821942285355, 'nu': 2.5}. Best is trial 112 with value: 0.35921013248560313.
[I 2024-12-04 19:43:52,429] Trial 123 finished with value: 0.35921131502316295 and parameters: {'kernel_type': 'Matern', 'length_scale': 18.647909180013894, 'noise_level': 0.00023106749469958504, 'constant_value': 0.20746427630341416, 'nu': 0.5}. Best is trial 112 with value: 0.35921013248560313.
[I 2024-12-04 19:43:54,314] Trial 122 finished with value: 1.0624161172616753 and parameters: {'kernel_type': 'RBF', 'length_scale': 2830.0696481541977, 'noise_level': 1.6294685942323687e-07, 'constant_value': 4.7154038167861374e-07, 'nu': 1.5}. Best is trial 112 with value: 0.35921013248560313.
[I 2024-12-04 19:43:55,694] Trial 125 finished with value: 1.0916558493763193 and parameters: {'kernel_type': 'Matern', 'length_scale': 0.05482654599092322, 'noise_level': 0.00018224862151757084, 'constant_value': 89695.82141254663, 'nu': 0.5}. Best is trial 112 with value: 0.35921013248560313.
[I 2024-12-04 19:43:56,005] Trial 124 finished with value: 0.41956600466888655 and parameters: {'kernel_type': 'Matern', 'length_scale': 23.85625160077662, 'noise_level': 7.143135059155309e-05, 'constant_value': 19040.36555561831, 'nu': 2.5}. Best is trial 112 with value: 0.35921013248560313.
[I 2024-12-04 19:43:59,652] Trial 126 finished with value: 1.062416117276996 and parameters: {'kernel_type': 'Matern', 'length_scale': 0.0017092439120196784, 'noise_level': 6.210585917069298e-10, 'constant_value': 0.026465776677313386, 'nu': 2.5}. Best is trial 112 with value: 0.35921013248560313.
[I 2024-12-04 19:44:00,746] Trial 127 finished with value: 0.4226880775133148 and parameters: {'kernel_type': 'Matern', 'length_scale': 3.0702853710274955, 'noise_level': 0.0003100711188834804, 'constant_value': 20.468945209109265, 'nu': 1.5}. Best is trial 112 with value: 0.35921013248560313.
[I 2024-12-04 19:44:01,248] Trial 128 finished with value: 0.35921103483060185 and parameters: {'kernel_type': 'Matern', 'length_scale': 4.185246571674562, 'noise_level': 0.00045584909489327735, 'constant_value': 1268.0306285140355, 'nu': 0.5}. Best is trial 112 with value: 0.35921013248560313.
[I 2024-12-04 19:44:03,291] Trial 129 finished with value: 1.0916557431891885 and parameters: {'kernel_type': 'Matern', 'length_scale': 0.25342525454671067, 'noise_level': 1.7185440422731808e-09, 'constant_value': 13158.100052496147, 'nu': 1.5}. Best is trial 112 with value: 0.35921013248560313.
[I 2024-12-04 19:44:04,725] Trial 131 finished with value: 1.0916566616845065 and parameters: {'kernel_type': 'Matern', 'length_scale': 974.9655837015281, 'noise_level': 1.2666942194852124e-10, 'constant_value': 2539.509176939046, 'nu': 0.5}. Best is trial 112 with value: 0.35921013248560313.
[I 2024-12-04 19:44:05,238] Trial 130 finished with value: 0.3592112918912244 and parameters: {'kernel_type': 'Matern', 'length_scale': 1.2614772635680065, 'noise_level': 0.0012388514265827182, 'constant_value': 6.911505797878698, 'nu': 0.5}. Best is trial 112 with value: 0.35921013248560313.
[I 2024-12-04 19:44:07,993] Trial 132 finished with value: 0.4286835174263318 and parameters: {'kernel_type': 'RBF', 'length_scale': 0.8409292785697063, 'noise_level': 0.06217985339659994, 'constant_value': 1168.927346238179, 'nu': 1.5}. Best is trial 112 with value: 0.35921013248560313.
[I 2024-12-04 19:44:11,326] Trial 133 finished with value: 1.0624161118928872 and parameters: {'kernel_type': 'Matern', 'length_scale': 0.054762039459055854, 'noise_level': 0.005338399115385244, 'constant_value': 0.002814571277062575, 'nu': 0.5}. Best is trial 112 with value: 0.35921013248560313.
[I 2024-12-04 19:44:11,352] Trial 134 finished with value: 0.35921111783047716 and parameters: {'kernel_type': 'Matern', 'length_scale': 3.8825838872934764, 'noise_level': 0.00861430505991578, 'constant_value': 87.08755924646469, 'nu': 0.5}. Best is trial 112 with value: 0.35921013248560313.
[I 2024-12-04 19:44:13,030] Trial 135 finished with value: 0.3592115802403608 and parameters: {'kernel_type': 'Matern', 'length_scale': 0.38512620094301053, 'noise_level': 0.00032919263746191004, 'constant_value': 175.63135449444061, 'nu': 0.5}. Best is trial 112 with value: 0.35921013248560313.
[I 2024-12-04 19:44:16,175] Trial 137 finished with value: 0.35921079987581805 and parameters: {'kernel_type': 'Matern', 'length_scale': 1.2675133094953304, 'noise_level': 0.0025883769006666848, 'constant_value': 122.18645100918722, 'nu': 0.5}. Best is trial 112 with value: 0.35921013248560313.
[I 2024-12-04 19:44:17,632] Trial 138 finished with value: 0.4286838426745982 and parameters: {'kernel_type': 'RBF', 'length_scale': 10.402930835994965, 'noise_level': 0.030724340064151756, 'constant_value': 18471.45659213739, 'nu': 0.5}. Best is trial 112 with value: 0.35921013248560313.
[I 2024-12-04 19:44:18,898] Trial 139 finished with value: 1.0916567048549848 and parameters: {'kernel_type': 'Matern', 'length_scale': 3.0004000556077584, 'noise_level': 0.006288171929494564, 'constant_value': 523.0386024040832, 'nu': 0.5}. Best is trial 112 with value: 0.35921013248560313.
[I 2024-12-04 19:44:19,496] Trial 136 finished with value: 0.3592111112777768 and parameters: {'kernel_type': 'Matern', 'length_scale': 18.446081814037726, 'noise_level': 0.8144495047740611, 'constant_value': 0.00046570697685153166, 'nu': 0.5}. Best is trial 112 with value: 0.35921013248560313.
[I 2024-12-04 19:44:22,414] Trial 140 finished with value: 0.3592108441410728 and parameters: {'kernel_type': 'Matern', 'length_scale': 2.1353182219853064, 'noise_level': 0.0011771660430313473, 'constant_value': 99.2579638492567, 'nu': 0.5}. Best is trial 112 with value: 0.35921013248560313.
[I 2024-12-04 19:44:24,251] Trial 141 finished with value: 0.3592110817008307 and parameters: {'kernel_type': 'Matern', 'length_scale': 17.155183190005754, 'noise_level': 0.6531828303026094, 'constant_value': 50.13543611491946, 'nu': 0.5}. Best is trial 112 with value: 0.35921013248560313.
[I 2024-12-04 19:44:25,636] Trial 142 finished with value: 0.35921093379780944 and parameters: {'kernel_type': 'Matern', 'length_scale': 61.74917217239229, 'noise_level': 0.07883298022035945, 'constant_value': 0.002351270066364645, 'nu': 0.5}. Best is trial 112 with value: 0.35921013248560313.
[I 2024-12-04 19:44:26,837] Trial 143 finished with value: 0.3592113651321283 and parameters: {'kernel_type': 'Matern', 'length_scale': 9.244969753722787, 'noise_level': 0.00010576057684759128, 'constant_value': 554.7240771019071, 'nu': 0.5}. Best is trial 112 with value: 0.35921013248560313.
[I 2024-12-04 19:44:33,304] Trial 145 finished with value: 1.062416117267735 and parameters: {'kernel_type': 'Matern', 'length_scale': 115.89647337192419, 'noise_level': 0.06307965251623486, 'constant_value': 0.0008031676746350201, 'nu': 0.5}. Best is trial 112 with value: 0.35921013248560313.
[I 2024-12-04 19:44:33,353] Trial 144 finished with value: 0.35921082298647966 and parameters: {'kernel_type': 'Matern', 'length_scale': 58.964643745803976, 'noise_level': 0.25440072575854894, 'constant_value': 0.00021674331157455151, 'nu': 0.5}. Best is trial 112 with value: 0.35921013248560313.
[I 2024-12-04 19:44:34,166] Trial 146 finished with value: 0.4226880484174525 and parameters: {'kernel_type': 'Matern', 'length_scale': 2.5539004892410366, 'noise_level': 0.9813664413343256, 'constant_value': 0.0015889637530837727, 'nu': 1.5}. Best is trial 112 with value: 0.35921013248560313.
[I 2024-12-04 19:44:39,615] Trial 149 finished with value: 0.3592119997949292 and parameters: {'kernel_type': 'Matern', 'length_scale': 59.78465321356664, 'noise_level': 0.02294733799841026, 'constant_value': 0.402631004350135, 'nu': 0.5}. Best is trial 112 with value: 0.35921013248560313.
[I 2024-12-04 19:44:41,297] Trial 148 finished with value: 0.359211206593801 and parameters: {'kernel_type': 'Matern', 'length_scale': 29.997486490634895, 'noise_level': 0.3996045779597832, 'constant_value': 0.0008563377508240181, 'nu': 0.5}. Best is trial 112 with value: 0.35921013248560313.
[I 2024-12-04 19:44:45,300] Trial 151 finished with value: 1.0624161172905866 and parameters: {'kernel_type': 'RBF', 'length_scale': 1.2031673200888493, 'noise_level': 2.6673776909876928e-06, 'constant_value': 0.00024414185903659334, 'nu': 1.5}. Best is trial 112 with value: 0.35921013248560313.
[I 2024-12-04 19:44:49,694] Trial 147 finished with value: 0.35921102691057366 and parameters: {'kernel_type': 'Matern', 'length_scale': 180.70151906544476, 'noise_level': 0.30024544683528653, 'constant_value': 2.8170247549117675e-06, 'nu': 0.5}. Best is trial 112 with value: 0.35921013248560313.
[I 2024-12-04 19:44:49,923] Trial 150 finished with value: 1.0624161171032442 and parameters: {'kernel_type': 'Matern', 'length_scale': 13.532763431840921, 'noise_level': 0.026616111215587983, 'constant_value': 0.00031627604172519366, 'nu': 0.5}. Best is trial 112 with value: 0.35921013248560313.
[I 2024-12-04 19:44:50,111] Trial 152 finished with value: 0.3592113032651608 and parameters: {'kernel_type': 'Matern', 'length_scale': 0.9005710390725353, 'noise_level': 4.564857680333453e-05, 'constant_value': 72.82181457127889, 'nu': 0.5}. Best is trial 112 with value: 0.35921013248560313.
[I 2024-12-04 19:44:52,970] Trial 153 finished with value: 1.0916562382280524 and parameters: {'kernel_type': 'Matern', 'length_scale': 4820.996025352292, 'noise_level': 0.19525508551780404, 'constant_value': 4.099063353887684e-06, 'nu': 0.5}. Best is trial 112 with value: 0.35921013248560313.
[I 2024-12-04 19:44:53,999] Trial 155 finished with value: 1.0624161173563136 and parameters: {'kernel_type': 'Matern', 'length_scale': 0.05265009332481603, 'noise_level': 0.0012625152408831748, 'constant_value': 3.2217466771817276, 'nu': 2.5}. Best is trial 112 with value: 0.35921013248560313.
[I 2024-12-04 19:44:58,019] Trial 154 finished with value: 1.0624161172529631 and parameters: {'kernel_type': 'Matern', 'length_scale': 21.947824875033856, 'noise_level': 0.017567330111081306, 'constant_value': 4.0049944338438044e-07, 'nu': 0.5}. Best is trial 112 with value: 0.35921013248560313.
[I 2024-12-04 19:45:01,847] Trial 157 finished with value: 0.35921089553118807 and parameters: {'kernel_type': 'Matern', 'length_scale': 116.25582387071366, 'noise_level': 0.7118804009307339, 'constant_value': 0.0021709856327025677, 'nu': 0.5}. Best is trial 112 with value: 0.35921013248560313.
[I 2024-12-04 19:45:03,500] Trial 158 finished with value: 0.35921043356193394 and parameters: {'kernel_type': 'Matern', 'length_scale': 88.42607735852462, 'noise_level': 0.29999076398752383, 'constant_value': 0.4452411673466302, 'nu': 0.5}. Best is trial 112 with value: 0.35921013248560313.
[I 2024-12-04 19:45:05,214] Trial 156 finished with value: 0.35921122729433297 and parameters: {'kernel_type': 'Matern', 'length_scale': 5.309657763577324, 'noise_level': 0.21806431098026166, 'constant_value': 6.557881248608334e-06, 'nu': 0.5}. Best is trial 112 with value: 0.35921013248560313.
[I 2024-12-04 19:45:10,837] Trial 161 finished with value: 0.35921083211760235 and parameters: {'kernel_type': 'Matern', 'length_scale': 34.42495880688499, 'noise_level': 0.07628562570178718, 'constant_value': 0.06833901872598715, 'nu': 0.5}. Best is trial 112 with value: 0.35921013248560313.
[I 2024-12-04 19:45:14,102] Trial 159 finished with value: 0.3592112662051504 and parameters: {'kernel_type': 'Matern', 'length_scale': 138.80043581298574, 'noise_level': 0.3530115872817251, 'constant_value': 0.00029364463195128337, 'nu': 0.5}. Best is trial 112 with value: 0.35921013248560313.
[I 2024-12-04 19:45:15,102] Trial 160 finished with value: 1.0624161172752393 and parameters: {'kernel_type': 'Matern', 'length_scale': 41.98526519924775, 'noise_level': 0.04618377120651925, 'constant_value': 0.002774644045189362, 'nu': 2.5}. Best is trial 112 with value: 0.35921013248560313.
[I 2024-12-04 19:45:15,207] Trial 162 finished with value: 0.35921050245046604 and parameters: {'kernel_type': 'Matern', 'length_scale': 7.103499348485878, 'noise_level': 0.556472353394532, 'constant_value': 0.18924846732172182, 'nu': 0.5}. Best is trial 112 with value: 0.35921013248560313.
[I 2024-12-04 19:45:20,227] Trial 164 finished with value: 0.35921122187310395 and parameters: {'kernel_type': 'Matern', 'length_scale': 105.38646789594961, 'noise_level': 0.06163935818810655, 'constant_value': 0.16128324525823984, 'nu': 0.5}. Best is trial 112 with value: 0.35921013248560313.
[I 2024-12-04 19:45:22,522] Trial 163 finished with value: 1.0624161172658613 and parameters: {'kernel_type': 'RBF', 'length_scale': 15.479153013839515, 'noise_level': 0.008278287790136861, 'constant_value': 0.054430792663834764, 'nu': 0.5}. Best is trial 112 with value: 0.35921013248560313.
[I 2024-12-04 19:45:22,814] Trial 165 finished with value: 1.0624161173732969 and parameters: {'kernel_type': 'RBF', 'length_scale': 98681.54081198634, 'noise_level': 8.900105083779203e-07, 'constant_value': 0.007302008577843885, 'nu': 2.5}. Best is trial 112 with value: 0.35921013248560313.
[I 2024-12-04 19:45:27,235] Trial 166 finished with value: 0.3592109900214984 and parameters: {'kernel_type': 'Matern', 'length_scale': 7.6754637512369825, 'noise_level': 0.4739358520425179, 'constant_value': 0.0005947742850812178, 'nu': 0.5}. Best is trial 112 with value: 0.35921013248560313.
[I 2024-12-04 19:45:29,213] Trial 167 finished with value: 0.35921124294773993 and parameters: {'kernel_type': 'Matern', 'length_scale': 1.2507478240674097, 'noise_level': 3.383347462948237e-09, 'constant_value': 0.04863606367322433, 'nu': 0.5}. Best is trial 112 with value: 0.35921013248560313.
[I 2024-12-04 19:45:29,818] Trial 168 finished with value: 0.35921127021742294 and parameters: {'kernel_type': 'Matern', 'length_scale': 450.0128996710467, 'noise_level': 0.46873315560924483, 'constant_value': 0.007162618646114334, 'nu': 0.5}. Best is trial 112 with value: 0.35921013248560313.
[I 2024-12-04 19:45:30,349] Trial 169 finished with value: 1.0916567201356682 and parameters: {'kernel_type': 'Matern', 'length_scale': 2328.735697406276, 'noise_level': 0.0701701028076959, 'constant_value': 2.1809883058728596e-06, 'nu': 2.5}. Best is trial 112 with value: 0.35921013248560313.
[I 2024-12-04 19:45:34,758] Trial 170 finished with value: 0.3592112415451499 and parameters: {'kernel_type': 'Matern', 'length_scale': 16.089570152547683, 'noise_level': 0.10632403251652894, 'constant_value': 0.012097716991894542, 'nu': 0.5}. Best is trial 112 with value: 0.35921013248560313.
[I 2024-12-04 19:45:36,187] Trial 172 finished with value: 0.3592110038889806 and parameters: {'kernel_type': 'Matern', 'length_scale': 281.6973593191264, 'noise_level': 0.6612395867419771, 'constant_value': 2.3125272476514342, 'nu': 0.5}. Best is trial 112 with value: 0.35921013248560313.
[I 2024-12-04 19:45:36,621] Trial 171 finished with value: 1.0624161173544235 and parameters: {'kernel_type': 'RBF', 'length_scale': 33515.51111427224, 'noise_level': 1.3083719686161926e-09, 'constant_value': 0.09044940488980041, 'nu': 1.5}. Best is trial 112 with value: 0.35921013248560313.
[I 2024-12-04 19:45:41,076] Trial 175 finished with value: 0.3592110347500368 and parameters: {'kernel_type': 'Matern', 'length_scale': 27.942075961302887, 'noise_level': 0.03762975876148745, 'constant_value': 0.3543127279441154, 'nu': 0.5}. Best is trial 112 with value: 0.35921013248560313.
[I 2024-12-04 19:45:41,919] Trial 174 finished with value: 0.35921159456680346 and parameters: {'kernel_type': 'Matern', 'length_scale': 120.18422634274928, 'noise_level': 0.3975385999537716, 'constant_value': 0.26699995732596327, 'nu': 0.5}. Best is trial 112 with value: 0.35921013248560313.
[I 2024-12-04 19:45:42,854] Trial 173 finished with value: 0.3592112380100709 and parameters: {'kernel_type': 'Matern', 'length_scale': 11.703797938246385, 'noise_level': 0.6377495147195328, 'constant_value': 0.0005247412092603022, 'nu': 0.5}. Best is trial 112 with value: 0.35921013248560313.
[I 2024-12-04 19:45:45,430] Trial 176 finished with value: 0.35921123200140065 and parameters: {'kernel_type': 'Matern', 'length_scale': 4.19226476382064, 'noise_level': 0.03794956118602614, 'constant_value': 1.6107271889749466, 'nu': 0.5}. Best is trial 112 with value: 0.35921013248560313.
[I 2024-12-04 19:45:46,756] Trial 177 finished with value: 0.35921122030945496 and parameters: {'kernel_type': 'Matern', 'length_scale': 28.34160712527594, 'noise_level': 0.09535572599133624, 'constant_value': 0.06199208686164922, 'nu': 0.5}. Best is trial 112 with value: 0.35921013248560313.
[I 2024-12-04 19:45:48,207] Trial 178 finished with value: 0.35921124825430084 and parameters: {'kernel_type': 'Matern', 'length_scale': 333.9268361743427, 'noise_level': 0.8100598591398757, 'constant_value': 0.9127285246773138, 'nu': 0.5}. Best is trial 112 with value: 0.35921013248560313.
[I 2024-12-04 19:45:50,490] Trial 179 finished with value: 0.35921116555011245 and parameters: {'kernel_type': 'Matern', 'length_scale': 9.92726694967124, 'noise_level': 0.991953533410478, 'constant_value': 0.40330800441142084, 'nu': 0.5}. Best is trial 112 with value: 0.35921013248560313.
[I 2024-12-04 19:45:51,642] Trial 180 finished with value: 0.35921121590539834 and parameters: {'kernel_type': 'Matern', 'length_scale': 16.572167797917636, 'noise_level': 0.7522168558705022, 'constant_value': 2.1295896283414466, 'nu': 0.5}. Best is trial 112 with value: 0.35921013248560313.
