[I 2024-12-04 15:26:32,052] Trial 2271 finished with value: 0.7026468135861941 and parameters: {'n_estimators': 968, 'learning_rate': 0.02825848323456148, 'max_depth': 8, 'min_samples_split': 3, 'min_samples_leaf': 7, 'subsample': 0.8034206516984767, 'max_features': 'sqrt'}. Best is trial 1435 with value: 0.45467030752684195.
[I 2024-12-04 15:26:32,459] Trial 2253 finished with value: 0.6573208979991544 and parameters: {'n_estimators': 1259, 'learning_rate': 0.07820456024883007, 'max_depth': 12, 'min_samples_split': 18, 'min_samples_leaf': 3, 'subsample': 0.9925417586060032, 'max_features': None}. Best is trial 1435 with value: 0.45467030752684195.
[I 2024-12-04 15:26:32,463] Trial 2257 finished with value: 0.47215264617949376 and parameters: {'n_estimators': 1164, 'learning_rate': 0.0698940453138449, 'max_depth': 11, 'min_samples_split': 18, 'min_samples_leaf': 1, 'subsample': 0.9998487439617724, 'max_features': None}. Best is trial 1435 with value: 0.45467030752684195.
[I 2024-12-04 15:26:32,881] Trial 2268 finished with value: 0.7584435472938065 and parameters: {'n_estimators': 1028, 'learning_rate': 0.011943572873415199, 'max_depth': 10, 'min_samples_split': 17, 'min_samples_leaf': 7, 'subsample': 0.7541511094246554, 'max_features': 'sqrt'}. Best is trial 1435 with value: 0.45467030752684195.
[I 2024-12-04 15:26:36,178] Trial 2274 finished with value: 0.6226740924945061 and parameters: {'n_estimators': 823, 'learning_rate': 0.06883160103499363, 'max_depth': 12, 'min_samples_split': 20, 'min_samples_leaf': 2, 'subsample': 0.9533342831089874, 'max_features': None}. Best is trial 1435 with value: 0.45467030752684195.
[I 2024-12-04 15:26:37,928] Trial 2275 finished with value: 0.4684684775765074 and parameters: {'n_estimators': 823, 'learning_rate': 0.06724011299748202, 'max_depth': 12, 'min_samples_split': 18, 'min_samples_leaf': 1, 'subsample': 0.9886682514172955, 'max_features': None}. Best is trial 1435 with value: 0.45467030752684195.
[I 2024-12-04 15:26:38,640] Trial 2266 finished with value: 0.6451870476421879 and parameters: {'n_estimators': 1054, 'learning_rate': 0.0942795745950191, 'max_depth': 11, 'min_samples_split': 20, 'min_samples_leaf': 3, 'subsample': 0.9998281772444673, 'max_features': None}. Best is trial 1435 with value: 0.45467030752684195.
[I 2024-12-04 15:26:38,681] Trial 2279 finished with value: 0.47511534399659594 and parameters: {'n_estimators': 733, 'learning_rate': 0.06950274642602472, 'max_depth': 12, 'min_samples_split': 18, 'min_samples_leaf': 1, 'subsample': 0.9946636537793647, 'max_features': None}. Best is trial 1435 with value: 0.45467030752684195.
[I 2024-12-04 15:26:39,145] Trial 2265 finished with value: 0.4820681077154974 and parameters: {'n_estimators': 1064, 'learning_rate': 0.03904907715293283, 'max_depth': 12, 'min_samples_split': 20, 'min_samples_leaf': 1, 'subsample': 0.9317659367568524, 'max_features': None}. Best is trial 1435 with value: 0.45467030752684195.
[I 2024-12-04 15:26:41,439] Trial 2270 finished with value: 0.47763409618662744 and parameters: {'n_estimators': 1025, 'learning_rate': 0.057429348091128415, 'max_depth': 12, 'min_samples_split': 18, 'min_samples_leaf': 1, 'subsample': 0.9934251738304372, 'max_features': None}. Best is trial 1435 with value: 0.45467030752684195.
[I 2024-12-04 15:26:42,758] Trial 2292 finished with value: 0.6308595863958206 and parameters: {'n_estimators': 439, 'learning_rate': 0.09656599831645402, 'max_depth': 12, 'min_samples_split': 18, 'min_samples_leaf': 2, 'subsample': 0.9962050569393547, 'max_features': None}. Best is trial 1435 with value: 0.45467030752684195.
[I 2024-12-04 15:26:42,872] Trial 2269 finished with value: 0.5077901288409036 and parameters: {'n_estimators': 1111, 'learning_rate': 0.048924419055641245, 'max_depth': 12, 'min_samples_split': 16, 'min_samples_leaf': 1, 'subsample': 0.9525108091263311, 'max_features': None}. Best is trial 1435 with value: 0.45467030752684195.
[I 2024-12-04 15:26:45,033] Trial 2295 finished with value: 0.8939810538422222 and parameters: {'n_estimators': 509, 'learning_rate': 0.010280905563176583, 'max_depth': 5, 'min_samples_split': 10, 'min_samples_leaf': 1, 'subsample': 0.8229029648817306, 'max_features': 'log2'}. Best is trial 1435 with value: 0.45467030752684195.
[I 2024-12-04 15:26:45,357] Trial 2280 finished with value: 0.6166656564582578 and parameters: {'n_estimators': 900, 'learning_rate': 0.04356143985091126, 'max_depth': 10, 'min_samples_split': 20, 'min_samples_leaf': 2, 'subsample': 0.9315154220435709, 'max_features': None}. Best is trial 1435 with value: 0.45467030752684195.
[I 2024-12-04 15:26:47,383] Trial 2267 finished with value: 0.6769528455658951 and parameters: {'n_estimators': 1253, 'learning_rate': 0.08257822417783797, 'max_depth': 12, 'min_samples_split': 20, 'min_samples_leaf': 3, 'subsample': 0.9219384882642337, 'max_features': None}. Best is trial 1435 with value: 0.45467030752684195.
[I 2024-12-04 15:26:47,726] Trial 2286 finished with value: 0.48224706138048395 and parameters: {'n_estimators': 671, 'learning_rate': 0.05364162801871203, 'max_depth': 12, 'min_samples_split': 20, 'min_samples_leaf': 1, 'subsample': 0.997735234956235, 'max_features': None}. Best is trial 1435 with value: 0.45467030752684195.
[I 2024-12-04 15:26:48,547] Trial 2278 finished with value: 0.5519495257027165 and parameters: {'n_estimators': 1149, 'learning_rate': 0.07462031473131012, 'max_depth': 10, 'min_samples_split': 16, 'min_samples_leaf': 1, 'subsample': 0.9136669045979655, 'max_features': 'log2'}. Best is trial 1435 with value: 0.45467030752684195.
[I 2024-12-04 15:26:48,606] Trial 2288 finished with value: 0.6749857794130286 and parameters: {'n_estimators': 814, 'learning_rate': 0.0310157489913963, 'max_depth': 6, 'min_samples_split': 14, 'min_samples_leaf': 5, 'subsample': 0.8470345269476779, 'max_features': 'sqrt'}. Best is trial 1435 with value: 0.45467030752684195.
[I 2024-12-04 15:26:49,823] Trial 2308 finished with value: 0.8776260391195513 and parameters: {'n_estimators': 172, 'learning_rate': 0.03237510467222402, 'max_depth': 8, 'min_samples_split': 12, 'min_samples_leaf': 9, 'subsample': 0.9899929295548913, 'max_features': 'sqrt'}. Best is trial 1435 with value: 0.45467030752684195.
[I 2024-12-04 15:26:51,924] Trial 2289 finished with value: 0.5046294575028623 and parameters: {'n_estimators': 717, 'learning_rate': 0.0565193216556307, 'max_depth': 10, 'min_samples_split': 17, 'min_samples_leaf': 1, 'subsample': 0.9922251774401586, 'max_features': None}. Best is trial 1435 with value: 0.45467030752684195.
[I 2024-12-04 15:26:53,652] Trial 2282 finished with value: 0.45359136528270205 and parameters: {'n_estimators': 986, 'learning_rate': 0.07358054533190757, 'max_depth': 12, 'min_samples_split': 20, 'min_samples_leaf': 1, 'subsample': 0.9902696138284672, 'max_features': None}. Best is trial 2282 with value: 0.45359136528270205.
[I 2024-12-04 15:26:55,667] Trial 2281 finished with value: 0.8279871419983189 and parameters: {'n_estimators': 1364, 'learning_rate': 0.04828025104390033, 'max_depth': 7, 'min_samples_split': 13, 'min_samples_leaf': 10, 'subsample': 0.6694026753399133, 'max_features': 'log2'}. Best is trial 2282 with value: 0.45359136528270205.
[I 2024-12-04 15:26:56,739] Trial 2294 finished with value: 0.8019202228271672 and parameters: {'n_estimators': 914, 'learning_rate': 0.07493229406825722, 'max_depth': 7, 'min_samples_split': 20, 'min_samples_leaf': 10, 'subsample': 0.9780407589753222, 'max_features': 'sqrt'}. Best is trial 2282 with value: 0.45359136528270205.
[I 2024-12-04 15:26:58,754] Trial 2293 finished with value: 0.46474627798830315 and parameters: {'n_estimators': 818, 'learning_rate': 0.09904795731127537, 'max_depth': 12, 'min_samples_split': 19, 'min_samples_leaf': 1, 'subsample': 0.9957778658911702, 'max_features': None}. Best is trial 2282 with value: 0.45359136528270205.
[I 2024-12-04 15:26:59,663] Trial 2287 finished with value: 0.6537061901265213 and parameters: {'n_estimators': 1080, 'learning_rate': 0.0670071131206863, 'max_depth': 10, 'min_samples_split': 20, 'min_samples_leaf': 3, 'subsample': 0.9264008756735522, 'max_features': None}. Best is trial 2282 with value: 0.45359136528270205.
[I 2024-12-04 15:27:00,207] Trial 2290 finished with value: 0.6443428517956258 and parameters: {'n_estimators': 1053, 'learning_rate': 0.011042881036588832, 'max_depth': 5, 'min_samples_split': 17, 'min_samples_leaf': 7, 'subsample': 0.7124440350959051, 'max_features': None}. Best is trial 2282 with value: 0.45359136528270205.
[I 2024-12-04 15:27:02,655] Trial 2285 finished with value: 0.484655908420579 and parameters: {'n_estimators': 1084, 'learning_rate': 0.06456459104812122, 'max_depth': 12, 'min_samples_split': 17, 'min_samples_leaf': 1, 'subsample': 0.98287214902469, 'max_features': None}. Best is trial 2282 with value: 0.45359136528270205.
[I 2024-12-04 15:27:03,565] Trial 2283 finished with value: 0.6639859257830271 and parameters: {'n_estimators': 1253, 'learning_rate': 0.06437771648715303, 'max_depth': 11, 'min_samples_split': 14, 'min_samples_leaf': 3, 'subsample': 0.9962465456320954, 'max_features': None}. Best is trial 2282 with value: 0.45359136528270205.
[I 2024-12-04 15:27:06,329] Trial 2312 finished with value: 0.7707956799989012 and parameters: {'n_estimators': 501, 'learning_rate': 0.09004254620231732, 'max_depth': 10, 'min_samples_split': 9, 'min_samples_leaf': 9, 'subsample': 0.7657976975432937, 'max_features': None}. Best is trial 2282 with value: 0.45359136528270205.
[I 2024-12-04 15:27:07,631] Trial 2296 finished with value: 0.6689968257104791 and parameters: {'n_estimators': 1237, 'learning_rate': 0.07412921686312554, 'max_depth': 12, 'min_samples_split': 10, 'min_samples_leaf': 5, 'subsample': 0.7737482694201219, 'max_features': 'sqrt'}. Best is trial 2282 with value: 0.45359136528270205.
[I 2024-12-04 15:27:08,078] Trial 2298 finished with value: 0.6386962274036104 and parameters: {'n_estimators': 971, 'learning_rate': 0.07096605298795025, 'max_depth': 11, 'min_samples_split': 20, 'min_samples_leaf': 3, 'subsample': 0.9993313838903276, 'max_features': None}. Best is trial 2282 with value: 0.45359136528270205.
[I 2024-12-04 15:27:09,693] Trial 2303 finished with value: 0.6509837008122709 and parameters: {'n_estimators': 898, 'learning_rate': 0.060147422697082974, 'max_depth': 12, 'min_samples_split': 20, 'min_samples_leaf': 3, 'subsample': 0.9319213073467651, 'max_features': None}. Best is trial 2282 with value: 0.45359136528270205.
[I 2024-12-04 15:27:09,982] Trial 2291 finished with value: 0.6347189410999683 and parameters: {'n_estimators': 1163, 'learning_rate': 0.05445030650113756, 'max_depth': 11, 'min_samples_split': 17, 'min_samples_leaf': 2, 'subsample': 0.9999431600721732, 'max_features': None}. Best is trial 2282 with value: 0.45359136528270205.
[I 2024-12-04 15:27:10,396] Trial 2307 finished with value: 0.6900028740457469 and parameters: {'n_estimators': 909, 'learning_rate': 0.06515084204597334, 'max_depth': 3, 'min_samples_split': 10, 'min_samples_leaf': 6, 'subsample': 0.6360687316937329, 'max_features': 'log2'}. Best is trial 2282 with value: 0.45359136528270205.
[I 2024-12-04 15:27:10,504] Trial 2297 finished with value: 0.48115138515972367 and parameters: {'n_estimators': 1070, 'learning_rate': 0.0565240944568036, 'max_depth': 10, 'min_samples_split': 20, 'min_samples_leaf': 1, 'subsample': 0.935516611123739, 'max_features': None}. Best is trial 2282 with value: 0.45359136528270205.
[I 2024-12-04 15:27:10,653] Trial 2299 finished with value: 0.6414640282441214 and parameters: {'n_estimators': 987, 'learning_rate': 0.04792180892896984, 'max_depth': 12, 'min_samples_split': 16, 'min_samples_leaf': 3, 'subsample': 0.9897550816786795, 'max_features': None}. Best is trial 2282 with value: 0.45359136528270205.
[I 2024-12-04 15:27:10,781] Trial 2300 finished with value: 0.47037123113700535 and parameters: {'n_estimators': 921, 'learning_rate': 0.04891358207337847, 'max_depth': 12, 'min_samples_split': 18, 'min_samples_leaf': 1, 'subsample': 0.996874167376271, 'max_features': None}. Best is trial 2282 with value: 0.45359136528270205.
[I 2024-12-04 15:27:11,358] Trial 2309 finished with value: 0.6358113267019269 and parameters: {'n_estimators': 759, 'learning_rate': 0.06983701002276703, 'max_depth': 10, 'min_samples_split': 20, 'min_samples_leaf': 3, 'subsample': 0.9148898435181612, 'max_features': None}. Best is trial 2282 with value: 0.45359136528270205.
[I 2024-12-04 15:27:14,102] Trial 2301 finished with value: 0.6245744405637476 and parameters: {'n_estimators': 1045, 'learning_rate': 0.05998723181286168, 'max_depth': 12, 'min_samples_split': 17, 'min_samples_leaf': 3, 'subsample': 0.9995168238375189, 'max_features': None}. Best is trial 2282 with value: 0.45359136528270205.
[I 2024-12-04 15:27:14,842] Trial 2322 finished with value: 0.48456956671390733 and parameters: {'n_estimators': 494, 'learning_rate': 0.06513579464079546, 'max_depth': 12, 'min_samples_split': 17, 'min_samples_leaf': 1, 'subsample': 0.9226012649002161, 'max_features': None}. Best is trial 2282 with value: 0.45359136528270205.
[I 2024-12-04 15:27:14,843] Trial 2313 finished with value: 0.5759891431553097 and parameters: {'n_estimators': 843, 'learning_rate': 0.016645245274522994, 'max_depth': 6, 'min_samples_split': 20, 'min_samples_leaf': 4, 'subsample': 0.7914406571837461, 'max_features': None}. Best is trial 2282 with value: 0.45359136528270205.
[I 2024-12-04 15:27:15,074] Trial 2302 finished with value: 0.5641867621851548 and parameters: {'n_estimators': 1185, 'learning_rate': 0.06679751000591155, 'max_depth': 12, 'min_samples_split': 19, 'min_samples_leaf': 1, 'subsample': 0.9972519472874741, 'max_features': 'sqrt'}. Best is trial 2282 with value: 0.45359136528270205.
[I 2024-12-04 15:27:18,001] Trial 2319 finished with value: 0.6987294953368635 and parameters: {'n_estimators': 822, 'learning_rate': 0.07897476461376274, 'max_depth': 12, 'min_samples_split': 19, 'min_samples_leaf': 5, 'subsample': 0.9953342877917304, 'max_features': 'log2'}. Best is trial 2282 with value: 0.45359136528270205.
[I 2024-12-04 15:27:18,811] Trial 2304 finished with value: 0.47219521561746003 and parameters: {'n_estimators': 1025, 'learning_rate': 0.05871993122180329, 'max_depth': 12, 'min_samples_split': 20, 'min_samples_leaf': 1, 'subsample': 0.9951001379775108, 'max_features': None}. Best is trial 2282 with value: 0.45359136528270205.
[I 2024-12-04 15:27:18,833] Trial 2306 finished with value: 0.49392238335794214 and parameters: {'n_estimators': 1038, 'learning_rate': 0.049959156219476344, 'max_depth': 10, 'min_samples_split': 20, 'min_samples_leaf': 1, 'subsample': 0.9817841215943522, 'max_features': None}. Best is trial 2282 with value: 0.45359136528270205.
[I 2024-12-04 15:27:19,686] Trial 2320 finished with value: 0.6051167207724365 and parameters: {'n_estimators': 742, 'learning_rate': 0.03899512555918308, 'max_depth': 12, 'min_samples_split': 20, 'min_samples_leaf': 3, 'subsample': 0.9943830460727214, 'max_features': None}. Best is trial 2282 with value: 0.45359136528270205.
[I 2024-12-04 15:27:20,617] Trial 2315 finished with value: 0.5107634227269741 and parameters: {'n_estimators': 873, 'learning_rate': 0.09014229980080868, 'max_depth': 10, 'min_samples_split': 13, 'min_samples_leaf': 1, 'subsample': 0.9311466445794216, 'max_features': None}. Best is trial 2282 with value: 0.45359136528270205.
[I 2024-12-04 15:27:20,629] Trial 2305 finished with value: 0.7314345007511274 and parameters: {'n_estimators': 1416, 'learning_rate': 0.0220731739092359, 'max_depth': 3, 'min_samples_split': 13, 'min_samples_leaf': 10, 'subsample': 0.8873167643408261, 'max_features': None}. Best is trial 2282 with value: 0.45359136528270205.
[I 2024-12-04 15:27:22,488] Trial 2311 finished with value: 0.6210220962447429 and parameters: {'n_estimators': 1120, 'learning_rate': 0.06385876664209472, 'max_depth': 12, 'min_samples_split': 18, 'min_samples_leaf': 2, 'subsample': 0.9282865618743025, 'max_features': None}. Best is trial 2282 with value: 0.45359136528270205.
[I 2024-12-04 15:27:22,503] Trial 2310 finished with value: 0.8065156197837655 and parameters: {'n_estimators': 1336, 'learning_rate': 0.038952423773271294, 'max_depth': 4, 'min_samples_split': 12, 'min_samples_leaf': 9, 'subsample': 0.8537416210097003, 'max_features': 'log2'}. Best is trial 2282 with value: 0.45359136528270205.
[I 2024-12-04 15:27:23,600] Trial 2316 finished with value: 0.6352091299357688 and parameters: {'n_estimators': 978, 'learning_rate': 0.07986277630143572, 'max_depth': 12, 'min_samples_split': 20, 'min_samples_leaf': 3, 'subsample': 0.9999317452632199, 'max_features': None}. Best is trial 2282 with value: 0.45359136528270205.
[I 2024-12-04 15:27:24,677] Trial 2326 finished with value: 0.5612524970514454 and parameters: {'n_estimators': 940, 'learning_rate': 0.04516173770763908, 'max_depth': 11, 'min_samples_split': 19, 'min_samples_leaf': 1, 'subsample': 0.982512051048609, 'max_features': 'log2'}. Best is trial 2282 with value: 0.45359136528270205.
[I 2024-12-04 15:27:27,120] Trial 2318 finished with value: 0.509138679367716 and parameters: {'n_estimators': 1005, 'learning_rate': 0.05790801270595989, 'max_depth': 12, 'min_samples_split': 17, 'min_samples_leaf': 1, 'subsample': 0.9936778778893586, 'max_features': None}. Best is trial 2282 with value: 0.45359136528270205.
[I 2024-12-04 15:27:27,204] Trial 2321 finished with value: 0.4905263609061107 and parameters: {'n_estimators': 951, 'learning_rate': 0.04868488113712061, 'max_depth': 12, 'min_samples_split': 20, 'min_samples_leaf': 1, 'subsample': 0.9954482724631927, 'max_features': None}. Best is trial 2282 with value: 0.45359136528270205.
[I 2024-12-04 15:27:28,725] Trial 2324 finished with value: 0.4888543786955818 and parameters: {'n_estimators': 865, 'learning_rate': 0.05344595820445898, 'max_depth': 12, 'min_samples_split': 20, 'min_samples_leaf': 1, 'subsample': 0.940450312225106, 'max_features': None}. Best is trial 2282 with value: 0.45359136528270205.
[I 2024-12-04 15:27:29,995] Trial 2317 finished with value: 0.6587523352766779 and parameters: {'n_estimators': 1152, 'learning_rate': 0.06542100187592349, 'max_depth': 11, 'min_samples_split': 17, 'min_samples_leaf': 3, 'subsample': 0.9399717950410693, 'max_features': None}. Best is trial 2282 with value: 0.45359136528270205.
[I 2024-12-04 15:27:31,103] Trial 2323 finished with value: 0.616973443491495 and parameters: {'n_estimators': 1011, 'learning_rate': 0.06782685226907065, 'max_depth': 12, 'min_samples_split': 20, 'min_samples_leaf': 2, 'subsample': 0.8998928510782895, 'max_features': None}. Best is trial 2282 with value: 0.45359136528270205.
[I 2024-12-04 15:27:31,437] Trial 2314 finished with value: 0.490973949469219 and parameters: {'n_estimators': 1260, 'learning_rate': 0.09383202007691853, 'max_depth': 12, 'min_samples_split': 16, 'min_samples_leaf': 1, 'subsample': 0.9946033897260106, 'max_features': None}. Best is trial 2282 with value: 0.45359136528270205.
[I 2024-12-04 15:27:34,519] Trial 2337 finished with value: 0.5535377994353325 and parameters: {'n_estimators': 633, 'learning_rate': 0.09449025912645072, 'max_depth': 12, 'min_samples_split': 19, 'min_samples_leaf': 1, 'subsample': 0.9936725175286237, 'max_features': 'log2'}. Best is trial 2282 with value: 0.45359136528270205.
[I 2024-12-04 15:27:35,830] Trial 2327 finished with value: 0.484206122472375 and parameters: {'n_estimators': 957, 'learning_rate': 0.06750733602285974, 'max_depth': 12, 'min_samples_split': 20, 'min_samples_leaf': 1, 'subsample': 0.9485952566717682, 'max_features': None}. Best is trial 2282 with value: 0.45359136528270205.
[I 2024-12-04 15:27:37,007] Trial 2329 finished with value: 0.4809342244302333 and parameters: {'n_estimators': 766, 'learning_rate': 0.05851247857594329, 'max_depth': 12, 'min_samples_split': 20, 'min_samples_leaf': 1, 'subsample': 0.9963086539569042, 'max_features': None}. Best is trial 2282 with value: 0.45359136528270205.
[I 2024-12-04 15:27:40,588] Trial 2325 finished with value: 0.47788227263628025 and parameters: {'n_estimators': 1188, 'learning_rate': 0.054969249898255836, 'max_depth': 11, 'min_samples_split': 20, 'min_samples_leaf': 1, 'subsample': 0.9966524892741507, 'max_features': None}. Best is trial 2282 with value: 0.45359136528270205.
[I 2024-12-04 15:27:41,609] Trial 2350 finished with value: 0.6067684813847799 and parameters: {'n_estimators': 346, 'learning_rate': 0.09599076466640531, 'max_depth': 12, 'min_samples_split': 9, 'min_samples_leaf': 4, 'subsample': 0.671386702071562, 'max_features': 'sqrt'}. Best is trial 2282 with value: 0.45359136528270205.
[I 2024-12-04 15:27:42,913] Trial 2338 finished with value: 0.7158711666488574 and parameters: {'n_estimators': 614, 'learning_rate': 0.010821100981392894, 'max_depth': 8, 'min_samples_split': 2, 'min_samples_leaf': 10, 'subsample': 0.6733536184502608, 'max_features': None}. Best is trial 2282 with value: 0.45359136528270205.
[I 2024-12-04 15:27:46,367] Trial 2328 finished with value: 0.673688767038186 and parameters: {'n_estimators': 1274, 'learning_rate': 0.07079199249260651, 'max_depth': 10, 'min_samples_split': 20, 'min_samples_leaf': 3, 'subsample': 0.9409025592863579, 'max_features': None}. Best is trial 2282 with value: 0.45359136528270205.
[I 2024-12-04 15:27:48,873] Trial 2351 finished with value: 0.7976786971968328 and parameters: {'n_estimators': 649, 'learning_rate': 0.06344032312462855, 'max_depth': 11, 'min_samples_split': 13, 'min_samples_leaf': 8, 'subsample': 0.8381601930708549, 'max_features': 'log2'}. Best is trial 2282 with value: 0.45359136528270205.
