[I 2024-12-04 13:38:07,936] Trial 2128 finished with value: 0.2648156444532107 and parameters: {'n_estimators': 1222, 'learning_rate': 0.07169051856154156, 'max_depth': 8, 'min_samples_split': 7, 'min_samples_leaf': 1, 'subsample': 0.9182465335457403, 'max_features': 'sqrt'}. Best is trial 1389 with value: 0.22332552856343169.
[I 2024-12-04 13:38:12,873] Trial 2132 finished with value: 0.2835382541255961 and parameters: {'n_estimators': 1111, 'learning_rate': 0.07839500074265819, 'max_depth': 8, 'min_samples_split': 4, 'min_samples_leaf': 2, 'subsample': 0.8318084637805723, 'max_features': 'sqrt'}. Best is trial 1389 with value: 0.22332552856343169.
[I 2024-12-04 13:38:17,069] Trial 2129 finished with value: 0.34931677772513814 and parameters: {'n_estimators': 1313, 'learning_rate': 0.06251789327515454, 'max_depth': 7, 'min_samples_split': 6, 'min_samples_leaf': 3, 'subsample': 0.6530095939850808, 'max_features': 'sqrt'}. Best is trial 1389 with value: 0.22332552856343169.
[I 2024-12-04 13:38:17,072] Trial 2136 finished with value: 0.29599318931420876 and parameters: {'n_estimators': 1006, 'learning_rate': 0.06350476841189803, 'max_depth': 11, 'min_samples_split': 19, 'min_samples_leaf': 2, 'subsample': 0.8549319088678533, 'max_features': 'sqrt'}. Best is trial 1389 with value: 0.22332552856343169.
[I 2024-12-04 13:38:24,918] Trial 2135 finished with value: 0.27703842608704643 and parameters: {'n_estimators': 1231, 'learning_rate': 0.072431155591482, 'max_depth': 6, 'min_samples_split': 6, 'min_samples_leaf': 1, 'subsample': 0.6841184210305595, 'max_features': 'sqrt'}. Best is trial 1389 with value: 0.22332552856343169.
[I 2024-12-04 13:38:25,036] Trial 2133 finished with value: 0.2445579518730639 and parameters: {'n_estimators': 1211, 'learning_rate': 0.08441457893183997, 'max_depth': 8, 'min_samples_split': 5, 'min_samples_leaf': 1, 'subsample': 0.8440240648431196, 'max_features': 'sqrt'}. Best is trial 1389 with value: 0.22332552856343169.
[I 2024-12-04 13:38:27,437] Trial 2137 finished with value: 0.26663470197481565 and parameters: {'n_estimators': 1211, 'learning_rate': 0.09287058314168999, 'max_depth': 8, 'min_samples_split': 8, 'min_samples_leaf': 1, 'subsample': 0.876402571220231, 'max_features': 'sqrt'}. Best is trial 1389 with value: 0.22332552856343169.
[I 2024-12-04 13:38:28,075] Trial 2146 finished with value: 0.2549413861837058 and parameters: {'n_estimators': 869, 'learning_rate': 0.06645265436707976, 'max_depth': 9, 'min_samples_split': 4, 'min_samples_leaf': 1, 'subsample': 0.8270503556881939, 'max_features': 'sqrt'}. Best is trial 1389 with value: 0.22332552856343169.
[I 2024-12-04 13:38:36,668] Trial 2140 finished with value: 0.23815007947372327 and parameters: {'n_estimators': 1221, 'learning_rate': 0.09994745302308054, 'max_depth': 8, 'min_samples_split': 9, 'min_samples_leaf': 1, 'subsample': 0.9387392895734865, 'max_features': 'sqrt'}. Best is trial 1389 with value: 0.22332552856343169.
[I 2024-12-04 13:38:37,361] Trial 2143 finished with value: 0.29751315392079497 and parameters: {'n_estimators': 1136, 'learning_rate': 0.0647418729102876, 'max_depth': 8, 'min_samples_split': 7, 'min_samples_leaf': 2, 'subsample': 0.9178100392922772, 'max_features': 'log2'}. Best is trial 1389 with value: 0.22332552856343169.
[I 2024-12-04 13:38:39,592] Trial 2142 finished with value: 0.34582826385581394 and parameters: {'n_estimators': 1276, 'learning_rate': 0.07182915531636526, 'max_depth': 8, 'min_samples_split': 9, 'min_samples_leaf': 3, 'subsample': 0.9384959256427746, 'max_features': 'sqrt'}. Best is trial 1389 with value: 0.22332552856343169.
[I 2024-12-04 13:38:44,071] Trial 2148 finished with value: 0.5512886702683523 and parameters: {'n_estimators': 1019, 'learning_rate': 0.04656588183877703, 'max_depth': 9, 'min_samples_split': 17, 'min_samples_leaf': 8, 'subsample': 0.9253209074694491, 'max_features': 'log2'}. Best is trial 1389 with value: 0.22332552856343169.
[I 2024-12-04 13:38:46,826] Trial 2138 finished with value: 0.24128307181491468 and parameters: {'n_estimators': 1462, 'learning_rate': 0.08727427623815417, 'max_depth': 7, 'min_samples_split': 7, 'min_samples_leaf': 1, 'subsample': 0.791640188450796, 'max_features': 'sqrt'}. Best is trial 1389 with value: 0.22332552856343169.
[I 2024-12-04 13:38:49,245] Trial 2145 finished with value: 0.35806521238959477 and parameters: {'n_estimators': 1279, 'learning_rate': 0.08822183071129028, 'max_depth': 10, 'min_samples_split': 9, 'min_samples_leaf': 3, 'subsample': 0.8808303470363905, 'max_features': 'sqrt'}. Best is trial 1389 with value: 0.22332552856343169.
[I 2024-12-04 13:38:49,462] Trial 2161 finished with value: 0.349405372749298 and parameters: {'n_estimators': 393, 'learning_rate': 0.07794510843863066, 'max_depth': 9, 'min_samples_split': 7, 'min_samples_leaf': 1, 'subsample': 0.9020144418105016, 'max_features': None}. Best is trial 1389 with value: 0.22332552856343169.
[I 2024-12-04 13:38:50,847] Trial 2147 finished with value: 0.2529424437008346 and parameters: {'n_estimators': 1161, 'learning_rate': 0.09460197717476991, 'max_depth': 8, 'min_samples_split': 3, 'min_samples_leaf': 1, 'subsample': 0.9010806186231365, 'max_features': 'sqrt'}. Best is trial 1389 with value: 0.22332552856343169.
[I 2024-12-04 13:38:50,865] Trial 2144 finished with value: 0.38156627452006286 and parameters: {'n_estimators': 1322, 'learning_rate': 0.059074284350305525, 'max_depth': 8, 'min_samples_split': 18, 'min_samples_leaf': 5, 'subsample': 0.7359770691629238, 'max_features': 'sqrt'}. Best is trial 1389 with value: 0.22332552856343169.
[I 2024-12-04 13:38:58,344] Trial 2152 finished with value: 0.25882763824162525 and parameters: {'n_estimators': 998, 'learning_rate': 0.09539626362119599, 'max_depth': 7, 'min_samples_split': 7, 'min_samples_leaf': 1, 'subsample': 0.9325751211380487, 'max_features': 'sqrt'}. Best is trial 1389 with value: 0.22332552856343169.
[I 2024-12-04 13:38:58,348] Trial 2150 finished with value: 0.25289265771564107 and parameters: {'n_estimators': 1049, 'learning_rate': 0.04938807435128887, 'max_depth': 12, 'min_samples_split': 4, 'min_samples_leaf': 1, 'subsample': 0.6647383599329219, 'max_features': 'sqrt'}. Best is trial 1389 with value: 0.22332552856343169.
[I 2024-12-04 13:38:58,353] Trial 2154 finished with value: 0.44552454813529807 and parameters: {'n_estimators': 830, 'learning_rate': 0.08808857345978079, 'max_depth': 9, 'min_samples_split': 10, 'min_samples_leaf': 8, 'subsample': 0.7235974088978293, 'max_features': None}. Best is trial 1389 with value: 0.22332552856343169.
[I 2024-12-04 13:38:59,776] Trial 2151 finished with value: 0.3005459119280719 and parameters: {'n_estimators': 1015, 'learning_rate': 0.09964958716859215, 'max_depth': 8, 'min_samples_split': 8, 'min_samples_leaf': 2, 'subsample': 0.6298716121405348, 'max_features': 'sqrt'}. Best is trial 1389 with value: 0.22332552856343169.
[I 2024-12-04 13:38:59,829] Trial 2153 finished with value: 0.23538140829551946 and parameters: {'n_estimators': 987, 'learning_rate': 0.07857138507387283, 'max_depth': 9, 'min_samples_split': 2, 'min_samples_leaf': 1, 'subsample': 0.6431451531494397, 'max_features': 'sqrt'}. Best is trial 1389 with value: 0.22332552856343169.
[I 2024-12-04 13:39:01,755] Trial 2167 finished with value: 0.36494604703407596 and parameters: {'n_estimators': 377, 'learning_rate': 0.02443623794142386, 'max_depth': 6, 'min_samples_split': 10, 'min_samples_leaf': 2, 'subsample': 0.9546632549163971, 'max_features': None}. Best is trial 1389 with value: 0.22332552856343169.
[I 2024-12-04 13:39:03,213] Trial 2160 finished with value: 0.24635559863349313 and parameters: {'n_estimators': 683, 'learning_rate': 0.0939069718019343, 'max_depth': 5, 'min_samples_split': 4, 'min_samples_leaf': 1, 'subsample': 0.7849069819832479, 'max_features': 'sqrt'}. Best is trial 1389 with value: 0.22332552856343169.
[I 2024-12-04 13:39:03,835] Trial 2157 finished with value: 0.4488909502024189 and parameters: {'n_estimators': 793, 'learning_rate': 0.04992282510207229, 'max_depth': 8, 'min_samples_split': 19, 'min_samples_leaf': 8, 'subsample': 0.9366122150296168, 'max_features': None}. Best is trial 1389 with value: 0.22332552856343169.
[I 2024-12-04 13:39:13,369] Trial 2166 finished with value: 0.425274706625957 and parameters: {'n_estimators': 579, 'learning_rate': 0.0360033474194327, 'max_depth': 7, 'min_samples_split': 17, 'min_samples_leaf': 4, 'subsample': 0.8179145058178808, 'max_features': None}. Best is trial 1389 with value: 0.22332552856343169.
[I 2024-12-04 13:39:17,448] Trial 2172 finished with value: 0.4428618715026379 and parameters: {'n_estimators': 479, 'learning_rate': 0.052052428570830554, 'max_depth': 6, 'min_samples_split': 14, 'min_samples_leaf': 7, 'subsample': 0.6475517974830541, 'max_features': None}. Best is trial 1389 with value: 0.22332552856343169.
[I 2024-12-04 13:39:18,741] Trial 2149 finished with value: 0.3634398794355776 and parameters: {'n_estimators': 1403, 'learning_rate': 0.06861143275778982, 'max_depth': 9, 'min_samples_split': 8, 'min_samples_leaf': 3, 'subsample': 0.8336055922070904, 'max_features': 'sqrt'}. Best is trial 1389 with value: 0.22332552856343169.
[I 2024-12-04 13:39:19,215] Trial 2183 finished with value: 1.2298756803510253 and parameters: {'n_estimators': 133, 'learning_rate': 0.014656121757443298, 'max_depth': 9, 'min_samples_split': 17, 'min_samples_leaf': 5, 'subsample': 0.973482850879904, 'max_features': 'log2'}. Best is trial 1389 with value: 0.22332552856343169.
[I 2024-12-04 13:39:21,779] Trial 2163 finished with value: 0.34666009198958625 and parameters: {'n_estimators': 936, 'learning_rate': 0.09688110803033925, 'max_depth': 8, 'min_samples_split': 3, 'min_samples_leaf': 3, 'subsample': 0.9033931249248026, 'max_features': 'sqrt'}. Best is trial 1389 with value: 0.22332552856343169.
[I 2024-12-04 13:39:23,581] Trial 2155 finished with value: 0.289084869573668 and parameters: {'n_estimators': 1261, 'learning_rate': 0.04263564636081972, 'max_depth': 12, 'min_samples_split': 2, 'min_samples_leaf': 2, 'subsample': 0.6336556101343452, 'max_features': 'sqrt'}. Best is trial 1389 with value: 0.22332552856343169.
[I 2024-12-04 13:39:25,009] Trial 2159 finished with value: 0.32888851114443385 and parameters: {'n_estimators': 1187, 'learning_rate': 0.08631136152691316, 'max_depth': 5, 'min_samples_split': 8, 'min_samples_leaf': 2, 'subsample': 0.8876594115115057, 'max_features': 'log2'}. Best is trial 1389 with value: 0.22332552856343169.
[I 2024-12-04 13:39:32,202] Trial 2158 finished with value: 0.28226667153528107 and parameters: {'n_estimators': 1262, 'learning_rate': 0.07316894828844939, 'max_depth': 5, 'min_samples_split': 6, 'min_samples_leaf': 2, 'subsample': 0.9040102766607757, 'max_features': 'sqrt'}. Best is trial 1389 with value: 0.22332552856343169.
[I 2024-12-04 13:39:34,848] Trial 2184 finished with value: 1.189578374186648 and parameters: {'n_estimators': 274, 'learning_rate': 0.011632393164296533, 'max_depth': 3, 'min_samples_split': 5, 'min_samples_leaf': 8, 'subsample': 0.7876074362574804, 'max_features': 'log2'}. Best is trial 1389 with value: 0.22332552856343169.
[I 2024-12-04 13:39:35,244] Trial 2165 finished with value: 0.24751887776177614 and parameters: {'n_estimators': 1024, 'learning_rate': 0.0922235365825876, 'max_depth': 9, 'min_samples_split': 7, 'min_samples_leaf': 1, 'subsample': 0.9001598687429376, 'max_features': 'sqrt'}. Best is trial 1389 with value: 0.22332552856343169.
[I 2024-12-04 13:39:36,848] Trial 2168 finished with value: 0.23888167529305204 and parameters: {'n_estimators': 986, 'learning_rate': 0.09488820855743015, 'max_depth': 9, 'min_samples_split': 6, 'min_samples_leaf': 1, 'subsample': 0.7280322551369478, 'max_features': 'sqrt'}. Best is trial 1389 with value: 0.22332552856343169.
[I 2024-12-04 13:39:36,860] Trial 2156 finished with value: 0.29641268094237877 and parameters: {'n_estimators': 1244, 'learning_rate': 0.08015418655561797, 'max_depth': 4, 'min_samples_split': 8, 'min_samples_leaf': 1, 'subsample': 0.7913008697636614, 'max_features': None}. Best is trial 1389 with value: 0.22332552856343169.
[I 2024-12-04 13:39:36,936] Trial 2162 finished with value: 0.25839633178773297 and parameters: {'n_estimators': 1026, 'learning_rate': 0.06566699738937821, 'max_depth': 9, 'min_samples_split': 8, 'min_samples_leaf': 1, 'subsample': 0.7355237770125842, 'max_features': 'sqrt'}. Best is trial 1389 with value: 0.22332552856343169.
[I 2024-12-04 13:39:50,711] Trial 2174 finished with value: 0.5781870684496229 and parameters: {'n_estimators': 1008, 'learning_rate': 0.017487690457743125, 'max_depth': 12, 'min_samples_split': 5, 'min_samples_leaf': 4, 'subsample': 0.9027630907009048, 'max_features': 'log2'}. Best is trial 1389 with value: 0.22332552856343169.
[I 2024-12-04 13:39:52,731] Trial 2173 finished with value: 0.27769198875574425 and parameters: {'n_estimators': 1078, 'learning_rate': 0.08413834302745236, 'max_depth': 8, 'min_samples_split': 5, 'min_samples_leaf': 1, 'subsample': 0.860407158913718, 'max_features': 'sqrt'}. Best is trial 1389 with value: 0.22332552856343169.
[I 2024-12-04 13:39:56,544] Trial 2193 finished with value: 0.7118873425553987 and parameters: {'n_estimators': 285, 'learning_rate': 0.0260455714549349, 'max_depth': 9, 'min_samples_split': 7, 'min_samples_leaf': 2, 'subsample': 0.9734401194236538, 'max_features': 'log2'}. Best is trial 1389 with value: 0.22332552856343169.
[I 2024-12-04 13:39:59,449] Trial 2169 finished with value: 0.45522963589336496 and parameters: {'n_estimators': 1262, 'learning_rate': 0.07742801360624367, 'max_depth': 9, 'min_samples_split': 3, 'min_samples_leaf': 8, 'subsample': 0.6066804676244363, 'max_features': 'sqrt'}. Best is trial 1389 with value: 0.22332552856343169.
[I 2024-12-04 13:39:59,588] Trial 2180 finished with value: 0.2446345044404839 and parameters: {'n_estimators': 874, 'learning_rate': 0.08959804191857644, 'max_depth': 6, 'min_samples_split': 2, 'min_samples_leaf': 1, 'subsample': 0.9171806912032295, 'max_features': 'sqrt'}. Best is trial 1389 with value: 0.22332552856343169.
[I 2024-12-04 13:40:02,221] Trial 2164 finished with value: 0.2822663111976861 and parameters: {'n_estimators': 1435, 'learning_rate': 0.08866459700325978, 'max_depth': 5, 'min_samples_split': 5, 'min_samples_leaf': 1, 'subsample': 0.9470369140849815, 'max_features': 'sqrt'}. Best is trial 1389 with value: 0.22332552856343169.
[I 2024-12-04 13:40:02,386] Trial 2171 finished with value: 0.3650548903249805 and parameters: {'n_estimators': 1270, 'learning_rate': 0.09904206630043688, 'max_depth': 9, 'min_samples_split': 5, 'min_samples_leaf': 3, 'subsample': 0.7536870565146101, 'max_features': 'sqrt'}. Best is trial 1389 with value: 0.22332552856343169.
[I 2024-12-04 13:40:06,689] Trial 2170 finished with value: 0.2968321119729543 and parameters: {'n_estimators': 1333, 'learning_rate': 0.04573948963869632, 'max_depth': 6, 'min_samples_split': 10, 'min_samples_leaf': 2, 'subsample': 0.8908399770789033, 'max_features': 'sqrt'}. Best is trial 1389 with value: 0.22332552856343169.
[I 2024-12-04 13:40:08,881] Trial 2175 finished with value: 0.29950774715133693 and parameters: {'n_estimators': 1212, 'learning_rate': 0.05956519657745262, 'max_depth': 11, 'min_samples_split': 7, 'min_samples_leaf': 2, 'subsample': 0.6689398277835605, 'max_features': 'sqrt'}. Best is trial 1389 with value: 0.22332552856343169.
[I 2024-12-04 13:40:09,245] Trial 2181 finished with value: 0.2613588441461857 and parameters: {'n_estimators': 989, 'learning_rate': 0.0502805188916647, 'max_depth': 8, 'min_samples_split': 9, 'min_samples_leaf': 1, 'subsample': 0.9410899266174856, 'max_features': 'sqrt'}. Best is trial 1389 with value: 0.22332552856343169.
[I 2024-12-04 13:40:11,968] Trial 2177 finished with value: 0.2600315724454707 and parameters: {'n_estimators': 1141, 'learning_rate': 0.03996713222831899, 'max_depth': 9, 'min_samples_split': 6, 'min_samples_leaf': 1, 'subsample': 0.8720140206730121, 'max_features': 'sqrt'}. Best is trial 1389 with value: 0.22332552856343169.
[I 2024-12-04 13:40:11,971] Trial 2178 finished with value: 0.35879052900344516 and parameters: {'n_estimators': 1059, 'learning_rate': 0.08019785146474387, 'max_depth': 6, 'min_samples_split': 3, 'min_samples_leaf': 3, 'subsample': 0.7278438337084755, 'max_features': 'sqrt'}. Best is trial 1389 with value: 0.22332552856343169.
[I 2024-12-04 13:40:15,709] Trial 2179 finished with value: 0.24387569580310892 and parameters: {'n_estimators': 1132, 'learning_rate': 0.05691228293392832, 'max_depth': 10, 'min_samples_split': 5, 'min_samples_leaf': 1, 'subsample': 0.8897408910111435, 'max_features': 'sqrt'}. Best is trial 1389 with value: 0.22332552856343169.
[I 2024-12-04 13:40:19,748] Trial 2176 finished with value: 0.3710478462781354 and parameters: {'n_estimators': 1336, 'learning_rate': 0.07705455167676657, 'max_depth': 12, 'min_samples_split': 2, 'min_samples_leaf': 4, 'subsample': 0.644543964911243, 'max_features': 'sqrt'}. Best is trial 1389 with value: 0.22332552856343169.
[I 2024-12-04 13:40:23,939] Trial 2189 finished with value: 0.5847714688872556 and parameters: {'n_estimators': 902, 'learning_rate': 0.010597394107641007, 'max_depth': 12, 'min_samples_split': 10, 'min_samples_leaf': 8, 'subsample': 0.8192901757955622, 'max_features': 'sqrt'}. Best is trial 1389 with value: 0.22332552856343169.
[I 2024-12-04 13:40:24,528] Trial 2209 finished with value: 0.3628531056288039 and parameters: {'n_estimators': 126, 'learning_rate': 0.0492334941610708, 'max_depth': 5, 'min_samples_split': 12, 'min_samples_leaf': 2, 'subsample': 0.6914993614549795, 'max_features': None}. Best is trial 1389 with value: 0.22332552856343169.
[I 2024-12-04 13:40:26,974] Trial 2187 finished with value: 0.27616861136613025 and parameters: {'n_estimators': 1032, 'learning_rate': 0.09699198565565516, 'max_depth': 8, 'min_samples_split': 7, 'min_samples_leaf': 1, 'subsample': 0.8057709343011932, 'max_features': 'sqrt'}. Best is trial 1389 with value: 0.22332552856343169.
[I 2024-12-04 13:40:33,165] Trial 2205 finished with value: 0.30601562988253356 and parameters: {'n_estimators': 448, 'learning_rate': 0.06429963716476826, 'max_depth': 6, 'min_samples_split': 8, 'min_samples_leaf': 1, 'subsample': 0.895025458431862, 'max_features': 'sqrt'}. Best is trial 1389 with value: 0.22332552856343169.
[I 2024-12-04 13:40:33,655] Trial 2188 finished with value: 0.35679128243687264 and parameters: {'n_estimators': 1081, 'learning_rate': 0.09951399498846392, 'max_depth': 12, 'min_samples_split': 5, 'min_samples_leaf': 3, 'subsample': 0.6641714771926104, 'max_features': 'sqrt'}. Best is trial 1389 with value: 0.22332552856343169.
[I 2024-12-04 13:40:33,660] Trial 2198 finished with value: 0.4300430386078958 and parameters: {'n_estimators': 685, 'learning_rate': 0.03375205561820499, 'max_depth': 3, 'min_samples_split': 9, 'min_samples_leaf': 1, 'subsample': 0.8132755049724534, 'max_features': 'sqrt'}. Best is trial 1389 with value: 0.22332552856343169.
[I 2024-12-04 13:40:36,600] Trial 2182 finished with value: 0.2513385927300472 and parameters: {'n_estimators': 1235, 'learning_rate': 0.05371652688809777, 'max_depth': 7, 'min_samples_split': 5, 'min_samples_leaf': 1, 'subsample': 0.9364535212023452, 'max_features': 'sqrt'}. Best is trial 1389 with value: 0.22332552856343169.
[I 2024-12-04 13:40:37,229] Trial 2186 finished with value: 0.35453429682974846 and parameters: {'n_estimators': 1137, 'learning_rate': 0.04691951663509406, 'max_depth': 10, 'min_samples_split': 9, 'min_samples_leaf': 3, 'subsample': 0.7574886122126795, 'max_features': 'sqrt'}. Best is trial 1389 with value: 0.22332552856343169.
[I 2024-12-04 13:40:38,427] Trial 2190 finished with value: 0.4030039398316007 and parameters: {'n_estimators': 965, 'learning_rate': 0.057690049220075534, 'max_depth': 9, 'min_samples_split': 8, 'min_samples_leaf': 3, 'subsample': 0.8828130484377231, 'max_features': None}. Best is trial 1389 with value: 0.22332552856343169.
[I 2024-12-04 13:40:43,521] Trial 2195 finished with value: 0.6159149811723083 and parameters: {'n_estimators': 980, 'learning_rate': 0.023509425117077053, 'max_depth': 5, 'min_samples_split': 9, 'min_samples_leaf': 3, 'subsample': 0.6932236952442814, 'max_features': 'log2'}. Best is trial 1389 with value: 0.22332552856343169.
[I 2024-12-04 13:40:46,324] Trial 2196 finished with value: 0.5751615867851989 and parameters: {'n_estimators': 940, 'learning_rate': 0.011048580085212992, 'max_depth': 4, 'min_samples_split': 11, 'min_samples_leaf': 1, 'subsample': 0.6137161770375705, 'max_features': 'sqrt'}. Best is trial 1389 with value: 0.22332552856343169.
[I 2024-12-04 13:40:51,375] Trial 2219 finished with value: 0.5229057971906684 and parameters: {'n_estimators': 140, 'learning_rate': 0.01250754654995286, 'max_depth': 4, 'min_samples_split': 20, 'min_samples_leaf': 1, 'subsample': 0.7082109455684624, 'max_features': None}. Best is trial 1389 with value: 0.22332552856343169.
[I 2024-12-04 13:40:52,780] Trial 2207 finished with value: 0.28782208806929316 and parameters: {'n_estimators': 639, 'learning_rate': 0.04305089662035193, 'max_depth': 5, 'min_samples_split': 5, 'min_samples_leaf': 1, 'subsample': 0.8953411189321512, 'max_features': 'sqrt'}. Best is trial 1389 with value: 0.22332552856343169.
[I 2024-12-04 13:40:58,079] Trial 2191 finished with value: 0.28130759225133656 and parameters: {'n_estimators': 1277, 'learning_rate': 0.09305406308570735, 'max_depth': 7, 'min_samples_split': 11, 'min_samples_leaf': 2, 'subsample': 0.737992842710669, 'max_features': 'sqrt'}. Best is trial 1389 with value: 0.22332552856343169.
