[I 2024-12-04 14:51:50,051] Trial 306 finished with value: 0.7212484641989546 and parameters: {'n_estimators': 224, 'max_depth': 7, 'min_samples_split': 3, 'min_samples_leaf': 6, 'max_features': None, 'bootstrap': False, 'criterion': 'squared_error'}. Best is trial 223 with value: 0.4188398890260366.
[I 2024-12-04 14:51:50,755] Trial 298 finished with value: 1.0029256538334554 and parameters: {'n_estimators': 114, 'max_depth': 45, 'min_samples_split': 3, 'min_samples_leaf': 14, 'max_features': 'sqrt', 'bootstrap': False, 'criterion': 'absolute_error'}. Best is trial 223 with value: 0.4188398890260366.
[I 2024-12-04 14:51:50,774] Trial 292 finished with value: 0.42042604295396735 and parameters: {'n_estimators': 730, 'max_depth': 38, 'min_samples_split': 2, 'min_samples_leaf': 1, 'max_features': None, 'bootstrap': True, 'criterion': 'squared_error'}. Best is trial 223 with value: 0.4188398890260366.
[I 2024-12-04 14:51:51,944] Trial 291 finished with value: 0.4653656376056255 and parameters: {'n_estimators': 751, 'max_depth': 38, 'min_samples_split': 2, 'min_samples_leaf': 2, 'max_features': None, 'bootstrap': True, 'criterion': 'squared_error'}. Best is trial 223 with value: 0.4188398890260366.
[I 2024-12-04 14:51:56,078] Trial 295 finished with value: 0.4194097913278642 and parameters: {'n_estimators': 813, 'max_depth': 39, 'min_samples_split': 2, 'min_samples_leaf': 1, 'max_features': None, 'bootstrap': True, 'criterion': 'squared_error'}. Best is trial 223 with value: 0.4188398890260366.
[I 2024-12-04 14:51:59,211] Trial 290 finished with value: 0.5103043826611627 and parameters: {'n_estimators': 992, 'max_depth': 40, 'min_samples_split': 2, 'min_samples_leaf': 1, 'max_features': 'sqrt', 'bootstrap': True, 'criterion': 'squared_error'}. Best is trial 223 with value: 0.4188398890260366.
[I 2024-12-04 14:52:00,254] Trial 287 finished with value: 0.740161228418032 and parameters: {'n_estimators': 947, 'max_depth': 45, 'min_samples_split': 38, 'min_samples_leaf': 2, 'max_features': 'sqrt', 'bootstrap': True, 'criterion': 'absolute_error'}. Best is trial 223 with value: 0.4188398890260366.
[I 2024-12-04 14:52:04,954] Trial 289 finished with value: 0.42153563586452936 and parameters: {'n_estimators': 797, 'max_depth': 34, 'min_samples_split': 2, 'min_samples_leaf': 1, 'max_features': None, 'bootstrap': True, 'criterion': 'squared_error'}. Best is trial 223 with value: 0.4188398890260366.
[I 2024-12-04 14:52:07,227] Trial 313 finished with value: 0.6915321032319335 and parameters: {'n_estimators': 476, 'max_depth': 21, 'min_samples_split': 20, 'min_samples_leaf': 1, 'max_features': 'sqrt', 'bootstrap': True, 'criterion': 'squared_error'}. Best is trial 223 with value: 0.4188398890260366.
[I 2024-12-04 14:52:07,519] Trial 297 finished with value: 0.42070837228416497 and parameters: {'n_estimators': 990, 'max_depth': 36, 'min_samples_split': 2, 'min_samples_leaf': 1, 'max_features': None, 'bootstrap': True, 'criterion': 'squared_error'}. Best is trial 223 with value: 0.4188398890260366.
[I 2024-12-04 14:52:09,060] Trial 302 finished with value: 0.4203861705044165 and parameters: {'n_estimators': 727, 'max_depth': 38, 'min_samples_split': 2, 'min_samples_leaf': 1, 'max_features': None, 'bootstrap': True, 'criterion': 'squared_error'}. Best is trial 223 with value: 0.4188398890260366.
[I 2024-12-04 14:52:09,515] Trial 293 finished with value: 0.43448189682496485 and parameters: {'n_estimators': 987, 'max_depth': 40, 'min_samples_split': 5, 'min_samples_leaf': 1, 'max_features': None, 'bootstrap': True, 'criterion': 'squared_error'}. Best is trial 223 with value: 0.4188398890260366.
[I 2024-12-04 14:52:09,915] Trial 296 finished with value: 0.419244116644287 and parameters: {'n_estimators': 895, 'max_depth': 40, 'min_samples_split': 2, 'min_samples_leaf': 1, 'max_features': None, 'bootstrap': True, 'criterion': 'squared_error'}. Best is trial 223 with value: 0.4188398890260366.
[I 2024-12-04 14:52:11,194] Trial 300 finished with value: 0.421615398705337 and parameters: {'n_estimators': 756, 'max_depth': 42, 'min_samples_split': 2, 'min_samples_leaf': 1, 'max_features': None, 'bootstrap': True, 'criterion': 'squared_error'}. Best is trial 223 with value: 0.4188398890260366.
[I 2024-12-04 14:52:12,087] Trial 307 finished with value: 0.5226008760951704 and parameters: {'n_estimators': 917, 'max_depth': 35, 'min_samples_split': 2, 'min_samples_leaf': 1, 'max_features': None, 'bootstrap': False, 'criterion': 'squared_error'}. Best is trial 223 with value: 0.4188398890260366.
[I 2024-12-04 14:52:14,650] Trial 299 finished with value: 0.42120856154909 and parameters: {'n_estimators': 843, 'max_depth': 42, 'min_samples_split': 2, 'min_samples_leaf': 1, 'max_features': None, 'bootstrap': True, 'criterion': 'squared_error'}. Best is trial 223 with value: 0.4188398890260366.
[I 2024-12-04 14:52:15,524] Trial 305 finished with value: 0.6752422077514084 and parameters: {'n_estimators': 808, 'max_depth': 35, 'min_samples_split': 4, 'min_samples_leaf': 1, 'max_features': 'log2', 'bootstrap': True, 'criterion': 'squared_error'}. Best is trial 223 with value: 0.4188398890260366.
[I 2024-12-04 14:52:15,866] Trial 303 finished with value: 0.42013010085749175 and parameters: {'n_estimators': 857, 'max_depth': 43, 'min_samples_split': 2, 'min_samples_leaf': 1, 'max_features': None, 'bootstrap': True, 'criterion': 'squared_error'}. Best is trial 223 with value: 0.4188398890260366.
[I 2024-12-04 14:52:15,994] Trial 310 finished with value: 0.4652794897654941 and parameters: {'n_estimators': 848, 'max_depth': 36, 'min_samples_split': 3, 'min_samples_leaf': 2, 'max_features': None, 'bootstrap': True, 'criterion': 'squared_error'}. Best is trial 223 with value: 0.4188398890260366.
[I 2024-12-04 14:52:19,448] Trial 314 finished with value: 0.4321362369764231 and parameters: {'n_estimators': 824, 'max_depth': 43, 'min_samples_split': 4, 'min_samples_leaf': 1, 'max_features': None, 'bootstrap': True, 'criterion': 'squared_error'}. Best is trial 223 with value: 0.4188398890260366.
[I 2024-12-04 14:52:20,464] Trial 301 finished with value: 0.41966565865955985 and parameters: {'n_estimators': 903, 'max_depth': 41, 'min_samples_split': 2, 'min_samples_leaf': 1, 'max_features': None, 'bootstrap': True, 'criterion': 'squared_error'}. Best is trial 223 with value: 0.4188398890260366.
[I 2024-12-04 14:52:22,651] Trial 316 finished with value: 0.46531325593490847 and parameters: {'n_estimators': 837, 'max_depth': 43, 'min_samples_split': 4, 'min_samples_leaf': 2, 'max_features': None, 'bootstrap': True, 'criterion': 'squared_error'}. Best is trial 223 with value: 0.4188398890260366.
[I 2024-12-04 14:52:23,103] Trial 315 finished with value: 0.46527105195747115 and parameters: {'n_estimators': 750, 'max_depth': 35, 'min_samples_split': 2, 'min_samples_leaf': 2, 'max_features': None, 'bootstrap': True, 'criterion': 'squared_error'}. Best is trial 223 with value: 0.4188398890260366.
[I 2024-12-04 14:52:24,722] Trial 312 finished with value: 0.4647430752704141 and parameters: {'n_estimators': 895, 'max_depth': 47, 'min_samples_split': 2, 'min_samples_leaf': 2, 'max_features': None, 'bootstrap': True, 'criterion': 'squared_error'}. Best is trial 223 with value: 0.4188398890260366.
[I 2024-12-04 14:52:24,735] Trial 308 finished with value: 0.42364420790324453 and parameters: {'n_estimators': 850, 'max_depth': 37, 'min_samples_split': 3, 'min_samples_leaf': 1, 'max_features': None, 'bootstrap': True, 'criterion': 'squared_error'}. Best is trial 223 with value: 0.4188398890260366.
[I 2024-12-04 14:52:25,290] Trial 311 finished with value: 0.46537784666919135 and parameters: {'n_estimators': 755, 'max_depth': 35, 'min_samples_split': 2, 'min_samples_leaf': 2, 'max_features': None, 'bootstrap': True, 'criterion': 'squared_error'}. Best is trial 223 with value: 0.4188398890260366.
[I 2024-12-04 14:52:27,904] Trial 319 finished with value: 0.9192347492990013 and parameters: {'n_estimators': 944, 'max_depth': 32, 'min_samples_split': 40, 'min_samples_leaf': 2, 'max_features': 'log2', 'bootstrap': False, 'criterion': 'absolute_error'}. Best is trial 223 with value: 0.4188398890260366.
[I 2024-12-04 14:52:30,653] Trial 318 finished with value: 0.41905297548181714 and parameters: {'n_estimators': 730, 'max_depth': 40, 'min_samples_split': 2, 'min_samples_leaf': 1, 'max_features': None, 'bootstrap': True, 'criterion': 'squared_error'}. Best is trial 223 with value: 0.4188398890260366.
[I 2024-12-04 14:52:30,679] Trial 325 finished with value: 0.9565802396203477 and parameters: {'n_estimators': 974, 'max_depth': 37, 'min_samples_split': 2, 'min_samples_leaf': 2, 'max_features': 'log2', 'bootstrap': True, 'criterion': 'squared_error'}. Best is trial 223 with value: 0.4188398890260366.
[I 2024-12-04 14:52:33,246] Trial 317 finished with value: 0.42121912746116885 and parameters: {'n_estimators': 798, 'max_depth': 37, 'min_samples_split': 2, 'min_samples_leaf': 1, 'max_features': None, 'bootstrap': True, 'criterion': 'squared_error'}. Best is trial 223 with value: 0.4188398890260366.
[I 2024-12-04 14:52:45,803] Trial 328 finished with value: 0.8521480892487884 and parameters: {'n_estimators': 275, 'max_depth': 21, 'min_samples_split': 21, 'min_samples_leaf': 1, 'max_features': 'log2', 'bootstrap': True, 'criterion': 'absolute_error'}. Best is trial 223 with value: 0.4188398890260366.
[I 2024-12-04 14:52:56,734] Trial 329 finished with value: 0.6705357688221723 and parameters: {'n_estimators': 809, 'max_depth': 11, 'min_samples_split': 13, 'min_samples_leaf': 2, 'max_features': None, 'bootstrap': False, 'criterion': 'squared_error'}. Best is trial 223 with value: 0.4188398890260366.
[I 2024-12-04 14:52:58,334] Trial 323 finished with value: 0.4194981730029092 and parameters: {'n_estimators': 850, 'max_depth': 39, 'min_samples_split': 2, 'min_samples_leaf': 1, 'max_features': None, 'bootstrap': True, 'criterion': 'squared_error'}. Best is trial 223 with value: 0.4188398890260366.
[I 2024-12-04 14:52:59,462] Trial 332 finished with value: 0.7284224966341898 and parameters: {'n_estimators': 701, 'max_depth': 50, 'min_samples_split': 2, 'min_samples_leaf': 15, 'max_features': None, 'bootstrap': False, 'criterion': 'absolute_error'}. Best is trial 223 with value: 0.4188398890260366.
[I 2024-12-04 14:52:59,991] Trial 322 finished with value: 0.41996366342218977 and parameters: {'n_estimators': 863, 'max_depth': 38, 'min_samples_split': 2, 'min_samples_leaf': 1, 'max_features': None, 'bootstrap': True, 'criterion': 'squared_error'}. Best is trial 223 with value: 0.4188398890260366.
[I 2024-12-04 14:53:01,691] Trial 294 finished with value: 0.5381155893971851 and parameters: {'n_estimators': 745, 'max_depth': 12, 'min_samples_split': 2, 'min_samples_leaf': 1, 'max_features': None, 'bootstrap': True, 'criterion': 'absolute_error'}. Best is trial 223 with value: 0.4188398890260366.
[I 2024-12-04 14:53:05,079] Trial 276 finished with value: 0.427438681987113 and parameters: {'n_estimators': 918, 'max_depth': 42, 'min_samples_split': 2, 'min_samples_leaf': 1, 'max_features': None, 'bootstrap': True, 'criterion': 'absolute_error'}. Best is trial 223 with value: 0.4188398890260366.
[I 2024-12-04 14:53:06,655] Trial 320 finished with value: 0.41937664251237444 and parameters: {'n_estimators': 851, 'max_depth': 41, 'min_samples_split': 2, 'min_samples_leaf': 1, 'max_features': None, 'bootstrap': True, 'criterion': 'squared_error'}. Best is trial 223 with value: 0.4188398890260366.
[I 2024-12-04 14:53:06,658] Trial 326 finished with value: 0.7349592492842539 and parameters: {'n_estimators': 825, 'max_depth': 14, 'min_samples_split': 15, 'min_samples_leaf': 11, 'max_features': None, 'bootstrap': False, 'criterion': 'absolute_error'}. Best is trial 223 with value: 0.4188398890260366.
[I 2024-12-04 14:53:11,564] Trial 324 finished with value: 0.4243373256470677 and parameters: {'n_estimators': 973, 'max_depth': 43, 'min_samples_split': 3, 'min_samples_leaf': 1, 'max_features': None, 'bootstrap': True, 'criterion': 'squared_error'}. Best is trial 223 with value: 0.4188398890260366.
[I 2024-12-04 14:53:15,329] Trial 321 finished with value: 0.5700772929733381 and parameters: {'n_estimators': 732, 'max_depth': 44, 'min_samples_split': 2, 'min_samples_leaf': 4, 'max_features': None, 'bootstrap': True, 'criterion': 'absolute_error'}. Best is trial 223 with value: 0.4188398890260366.
[I 2024-12-04 14:53:16,146] Trial 345 finished with value: 0.575609813155015 and parameters: {'n_estimators': 830, 'max_depth': 42, 'min_samples_split': 2, 'min_samples_leaf': 3, 'max_features': None, 'bootstrap': False, 'criterion': 'squared_error'}. Best is trial 223 with value: 0.4188398890260366.
[I 2024-12-04 14:53:16,162] Trial 338 finished with value: 0.5277051920141953 and parameters: {'n_estimators': 784, 'max_depth': 39, 'min_samples_split': 2, 'min_samples_leaf': 1, 'max_features': None, 'bootstrap': False, 'criterion': 'squared_error'}. Best is trial 223 with value: 0.4188398890260366.
[I 2024-12-04 14:53:16,400] Trial 347 finished with value: 0.9692864434082286 and parameters: {'n_estimators': 845, 'max_depth': 46, 'min_samples_split': 4, 'min_samples_leaf': 3, 'max_features': 'log2', 'bootstrap': False, 'criterion': 'squared_error'}. Best is trial 223 with value: 0.4188398890260366.
[I 2024-12-04 14:53:16,405] Trial 330 finished with value: 0.4196951079830605 and parameters: {'n_estimators': 890, 'max_depth': 41, 'min_samples_split': 2, 'min_samples_leaf': 1, 'max_features': None, 'bootstrap': True, 'criterion': 'squared_error'}. Best is trial 223 with value: 0.4188398890260366.
[I 2024-12-04 14:53:16,635] Trial 336 finished with value: 0.41950390709352836 and parameters: {'n_estimators': 771, 'max_depth': 39, 'min_samples_split': 2, 'min_samples_leaf': 1, 'max_features': None, 'bootstrap': True, 'criterion': 'squared_error'}. Best is trial 223 with value: 0.4188398890260366.
[I 2024-12-04 14:53:17,778] Trial 333 finished with value: 0.41941709665946586 and parameters: {'n_estimators': 909, 'max_depth': 40, 'min_samples_split': 2, 'min_samples_leaf': 1, 'max_features': None, 'bootstrap': True, 'criterion': 'squared_error'}. Best is trial 223 with value: 0.4188398890260366.
[I 2024-12-04 14:53:17,933] Trial 340 finished with value: 1.0475520427098222 and parameters: {'n_estimators': 920, 'max_depth': 12, 'min_samples_split': 2, 'min_samples_leaf': 6, 'max_features': 'log2', 'bootstrap': True, 'criterion': 'absolute_error'}. Best is trial 223 with value: 0.4188398890260366.
[I 2024-12-04 14:53:18,240] Trial 341 finished with value: 0.4192559993209978 and parameters: {'n_estimators': 699, 'max_depth': 40, 'min_samples_split': 2, 'min_samples_leaf': 1, 'max_features': None, 'bootstrap': True, 'criterion': 'squared_error'}. Best is trial 223 with value: 0.4188398890260366.
[I 2024-12-04 14:53:19,922] Trial 342 finished with value: 0.43432015391361706 and parameters: {'n_estimators': 742, 'max_depth': 37, 'min_samples_split': 5, 'min_samples_leaf': 1, 'max_features': None, 'bootstrap': True, 'criterion': 'squared_error'}. Best is trial 223 with value: 0.4188398890260366.
[I 2024-12-04 14:53:20,372] Trial 327 finished with value: 0.4191300532773808 and parameters: {'n_estimators': 980, 'max_depth': 40, 'min_samples_split': 2, 'min_samples_leaf': 1, 'max_features': None, 'bootstrap': True, 'criterion': 'squared_error'}. Best is trial 223 with value: 0.4188398890260366.
[I 2024-12-04 14:53:21,899] Trial 331 finished with value: 0.42420134196929177 and parameters: {'n_estimators': 835, 'max_depth': 42, 'min_samples_split': 3, 'min_samples_leaf': 1, 'max_features': None, 'bootstrap': True, 'criterion': 'squared_error'}. Best is trial 223 with value: 0.4188398890260366.
[I 2024-12-04 14:53:22,939] Trial 334 finished with value: 0.4189135616555715 and parameters: {'n_estimators': 851, 'max_depth': 40, 'min_samples_split': 2, 'min_samples_leaf': 1, 'max_features': None, 'bootstrap': True, 'criterion': 'squared_error'}. Best is trial 223 with value: 0.4188398890260366.
[I 2024-12-04 14:53:25,896] Trial 339 finished with value: 0.42063589497013976 and parameters: {'n_estimators': 946, 'max_depth': 44, 'min_samples_split': 2, 'min_samples_leaf': 1, 'max_features': None, 'bootstrap': True, 'criterion': 'squared_error'}. Best is trial 223 with value: 0.4188398890260366.
[I 2024-12-04 14:53:26,890] Trial 346 finished with value: 0.4648573991371677 and parameters: {'n_estimators': 899, 'max_depth': 40, 'min_samples_split': 2, 'min_samples_leaf': 2, 'max_features': None, 'bootstrap': True, 'criterion': 'squared_error'}. Best is trial 223 with value: 0.4188398890260366.
[I 2024-12-04 14:53:34,328] Trial 335 finished with value: 0.6500356831520314 and parameters: {'n_estimators': 709, 'max_depth': 36, 'min_samples_split': 9, 'min_samples_leaf': 7, 'max_features': None, 'bootstrap': True, 'criterion': 'absolute_error'}. Best is trial 223 with value: 0.4188398890260366.
[I 2024-12-04 14:53:39,076] Trial 343 finished with value: 0.4192574500874311 and parameters: {'n_estimators': 729, 'max_depth': 41, 'min_samples_split': 2, 'min_samples_leaf': 1, 'max_features': None, 'bootstrap': True, 'criterion': 'squared_error'}. Best is trial 223 with value: 0.4188398890260366.
[I 2024-12-04 14:53:42,702] Trial 356 finished with value: 0.6973489367767486 and parameters: {'n_estimators': 826, 'max_depth': 37, 'min_samples_split': 4, 'min_samples_leaf': 2, 'max_features': 'sqrt', 'bootstrap': True, 'criterion': 'squared_error'}. Best is trial 223 with value: 0.4188398890260366.
[I 2024-12-04 14:53:43,410] Trial 344 finished with value: 0.42033384739678886 and parameters: {'n_estimators': 973, 'max_depth': 44, 'min_samples_split': 2, 'min_samples_leaf': 1, 'max_features': None, 'bootstrap': True, 'criterion': 'squared_error'}. Best is trial 223 with value: 0.4188398890260366.
[I 2024-12-04 14:53:44,117] Trial 360 finished with value: 1.0292794898646336 and parameters: {'n_estimators': 825, 'max_depth': 43, 'min_samples_split': 18, 'min_samples_leaf': 12, 'max_features': 'sqrt', 'bootstrap': True, 'criterion': 'squared_error'}. Best is trial 223 with value: 0.4188398890260366.
[I 2024-12-04 14:53:47,301] Trial 337 finished with value: 0.5986009998848731 and parameters: {'n_estimators': 684, 'max_depth': 30, 'min_samples_split': 9, 'min_samples_leaf': 3, 'max_features': None, 'bootstrap': False, 'criterion': 'absolute_error'}. Best is trial 223 with value: 0.4188398890260366.
[I 2024-12-04 14:53:47,317] Trial 309 finished with value: 0.44485476611895186 and parameters: {'n_estimators': 800, 'max_depth': 28, 'min_samples_split': 5, 'min_samples_leaf': 1, 'max_features': None, 'bootstrap': True, 'criterion': 'absolute_error'}. Best is trial 223 with value: 0.4188398890260366.
[I 2024-12-04 14:53:47,355] Trial 350 finished with value: 0.41945728349444594 and parameters: {'n_estimators': 812, 'max_depth': 39, 'min_samples_split': 2, 'min_samples_leaf': 1, 'max_features': None, 'bootstrap': True, 'criterion': 'squared_error'}. Best is trial 223 with value: 0.4188398890260366.
[I 2024-12-04 14:53:53,195] Trial 351 finished with value: 0.41943714687127764 and parameters: {'n_estimators': 870, 'max_depth': 39, 'min_samples_split': 2, 'min_samples_leaf': 1, 'max_features': None, 'bootstrap': True, 'criterion': 'squared_error'}. Best is trial 223 with value: 0.4188398890260366.
[I 2024-12-04 14:53:54,635] Trial 358 finished with value: 0.4237126306977218 and parameters: {'n_estimators': 711, 'max_depth': 37, 'min_samples_split': 3, 'min_samples_leaf': 1, 'max_features': None, 'bootstrap': True, 'criterion': 'squared_error'}. Best is trial 223 with value: 0.4188398890260366.
[I 2024-12-04 14:54:02,509] Trial 366 finished with value: 0.7291824284449396 and parameters: {'n_estimators': 596, 'max_depth': 8, 'min_samples_split': 42, 'min_samples_leaf': 1, 'max_features': None, 'bootstrap': False, 'criterion': 'squared_error'}. Best is trial 223 with value: 0.4188398890260366.
[I 2024-12-04 14:54:04,376] Trial 354 finished with value: 0.4189857315491369 and parameters: {'n_estimators': 935, 'max_depth': 40, 'min_samples_split': 2, 'min_samples_leaf': 1, 'max_features': None, 'bootstrap': True, 'criterion': 'squared_error'}. Best is trial 223 with value: 0.4188398890260366.
[I 2024-12-04 14:54:05,169] Trial 353 finished with value: 0.4206396286936251 and parameters: {'n_estimators': 841, 'max_depth': 37, 'min_samples_split': 2, 'min_samples_leaf': 1, 'max_features': None, 'bootstrap': True, 'criterion': 'squared_error'}. Best is trial 223 with value: 0.4188398890260366.
[I 2024-12-04 14:54:05,197] Trial 352 finished with value: 0.41966362136842006 and parameters: {'n_estimators': 967, 'max_depth': 41, 'min_samples_split': 2, 'min_samples_leaf': 1, 'max_features': None, 'bootstrap': True, 'criterion': 'squared_error'}. Best is trial 223 with value: 0.4188398890260366.
[I 2024-12-04 14:54:05,206] Trial 375 finished with value: 1.0438771888366554 and parameters: {'n_estimators': 233, 'max_depth': 43, 'min_samples_split': 50, 'min_samples_leaf': 7, 'max_features': 'log2', 'bootstrap': False, 'criterion': 'absolute_error'}. Best is trial 223 with value: 0.4188398890260366.
[I 2024-12-04 14:54:05,384] Trial 359 finished with value: 0.42121912746116885 and parameters: {'n_estimators': 798, 'max_depth': 37, 'min_samples_split': 2, 'min_samples_leaf': 1, 'max_features': None, 'bootstrap': True, 'criterion': 'squared_error'}. Best is trial 223 with value: 0.4188398890260366.
[I 2024-12-04 14:54:05,940] Trial 355 finished with value: 0.42060864556232613 and parameters: {'n_estimators': 982, 'max_depth': 42, 'min_samples_split': 2, 'min_samples_leaf': 1, 'max_features': None, 'bootstrap': True, 'criterion': 'squared_error'}. Best is trial 223 with value: 0.4188398890260366.
