[I 2024-12-04 12:19:42,392] Trial 353 finished with value: 0.5437755020939191 and parameters: {'n_estimators': 418, 'learning_rate': 0.031880127673664986, 'max_depth': 9, 'min_samples_split': 5, 'min_samples_leaf': 2, 'subsample': 0.732747831639014, 'max_features': 'log2'}. Best is trial 323 with value: 0.33558594202603503.
[I 2024-12-04 12:19:42,398] Trial 328 finished with value: 0.3677104372003504 and parameters: {'n_estimators': 1012, 'learning_rate': 0.07351079998091663, 'max_depth': 7, 'min_samples_split': 10, 'min_samples_leaf': 4, 'subsample': 0.814036850712261, 'max_features': None}. Best is trial 323 with value: 0.33558594202603503.
[I 2024-12-04 12:19:45,351] Trial 336 finished with value: 0.3708249945967179 and parameters: {'n_estimators': 796, 'learning_rate': 0.08419793028786837, 'max_depth': 12, 'min_samples_split': 16, 'min_samples_leaf': 1, 'subsample': 0.7080097060148327, 'max_features': None}. Best is trial 323 with value: 0.33558594202603503.
[I 2024-12-04 12:19:45,362] Trial 347 finished with value: 0.39245324339263865 and parameters: {'n_estimators': 534, 'learning_rate': 0.018012411885847415, 'max_depth': 11, 'min_samples_split': 2, 'min_samples_leaf': 1, 'subsample': 0.7055307205252679, 'max_features': None}. Best is trial 323 with value: 0.33558594202603503.
[I 2024-12-04 12:19:45,658] Trial 344 finished with value: 0.3488275521724004 and parameters: {'n_estimators': 603, 'learning_rate': 0.0342233724459162, 'max_depth': 12, 'min_samples_split': 7, 'min_samples_leaf': 2, 'subsample': 0.6933336996716848, 'max_features': None}. Best is trial 323 with value: 0.33558594202603503.
[I 2024-12-04 12:19:47,036] Trial 339 finished with value: 0.37768787526622066 and parameters: {'n_estimators': 821, 'learning_rate': 0.03985984017209552, 'max_depth': 8, 'min_samples_split': 12, 'min_samples_leaf': 3, 'subsample': 0.7581842911567298, 'max_features': None}. Best is trial 323 with value: 0.33558594202603503.
[I 2024-12-04 12:19:49,581] Trial 355 finished with value: 0.7135205414851601 and parameters: {'n_estimators': 641, 'learning_rate': 0.0174101368911299, 'max_depth': 11, 'min_samples_split': 20, 'min_samples_leaf': 4, 'subsample': 0.8015384349888295, 'max_features': 'log2'}. Best is trial 323 with value: 0.33558594202603503.
[I 2024-12-04 12:19:50,583] Trial 327 finished with value: 0.3616971084241861 and parameters: {'n_estimators': 1213, 'learning_rate': 0.04699442052829502, 'max_depth': 12, 'min_samples_split': 3, 'min_samples_leaf': 2, 'subsample': 0.8357884925556667, 'max_features': None}. Best is trial 323 with value: 0.33558594202603503.
[I 2024-12-04 12:19:51,050] Trial 334 finished with value: 0.3830956227302574 and parameters: {'n_estimators': 1069, 'learning_rate': 0.08943400956353242, 'max_depth': 9, 'min_samples_split': 2, 'min_samples_leaf': 3, 'subsample': 0.8346621550311045, 'max_features': None}. Best is trial 323 with value: 0.33558594202603503.
[I 2024-12-04 12:19:51,285] Trial 331 finished with value: 0.3870485538529545 and parameters: {'n_estimators': 1179, 'learning_rate': 0.045798622923177615, 'max_depth': 8, 'min_samples_split': 7, 'min_samples_leaf': 3, 'subsample': 0.8441042189188906, 'max_features': None}. Best is trial 323 with value: 0.33558594202603503.
[I 2024-12-04 12:19:53,675] Trial 346 finished with value: 0.340010592556884 and parameters: {'n_estimators': 814, 'learning_rate': 0.022183295647838903, 'max_depth': 11, 'min_samples_split': 4, 'min_samples_leaf': 2, 'subsample': 0.6494488330788619, 'max_features': None}. Best is trial 323 with value: 0.33558594202603503.
[I 2024-12-04 12:19:53,676] Trial 345 finished with value: 0.3934978102151968 and parameters: {'n_estimators': 888, 'learning_rate': 0.08845597007694792, 'max_depth': 7, 'min_samples_split': 7, 'min_samples_leaf': 1, 'subsample': 0.9829701257061481, 'max_features': None}. Best is trial 323 with value: 0.33558594202603503.
[I 2024-12-04 12:19:54,921] Trial 352 finished with value: 0.43538618454569317 and parameters: {'n_estimators': 847, 'learning_rate': 0.06095482297354972, 'max_depth': 4, 'min_samples_split': 10, 'min_samples_leaf': 4, 'subsample': 0.634506486279282, 'max_features': 'sqrt'}. Best is trial 323 with value: 0.33558594202603503.
[I 2024-12-04 12:19:57,454] Trial 340 finished with value: 0.3354678567574197 and parameters: {'n_estimators': 1147, 'learning_rate': 0.069820159153159, 'max_depth': 7, 'min_samples_split': 2, 'min_samples_leaf': 2, 'subsample': 0.8143776181546954, 'max_features': None}. Best is trial 340 with value: 0.3354678567574197.
[I 2024-12-04 12:19:57,745] Trial 357 finished with value: 0.7455767427091963 and parameters: {'n_estimators': 867, 'learning_rate': 0.01076019936872928, 'max_depth': 7, 'min_samples_split': 19, 'min_samples_leaf': 10, 'subsample': 0.6255759464499357, 'max_features': 'sqrt'}. Best is trial 340 with value: 0.3354678567574197.
[I 2024-12-04 12:19:58,299] Trial 348 finished with value: 0.6553388799650995 and parameters: {'n_estimators': 1144, 'learning_rate': 0.07122277059067923, 'max_depth': 5, 'min_samples_split': 14, 'min_samples_leaf': 10, 'subsample': 0.713904027634863, 'max_features': 'log2'}. Best is trial 340 with value: 0.3354678567574197.
[I 2024-12-04 12:19:59,151] Trial 349 finished with value: 0.3444949881874403 and parameters: {'n_estimators': 866, 'learning_rate': 0.05827050513155491, 'max_depth': 10, 'min_samples_split': 9, 'min_samples_leaf': 2, 'subsample': 0.8638376448778704, 'max_features': None}. Best is trial 340 with value: 0.3354678567574197.
[I 2024-12-04 12:19:59,182] Trial 351 finished with value: 0.3782800973527891 and parameters: {'n_estimators': 883, 'learning_rate': 0.06522303162237608, 'max_depth': 10, 'min_samples_split': 6, 'min_samples_leaf': 3, 'subsample': 0.6313444536712122, 'max_features': None}. Best is trial 340 with value: 0.3354678567574197.
[I 2024-12-04 12:20:00,001] Trial 354 finished with value: 0.34423351463907653 and parameters: {'n_estimators': 900, 'learning_rate': 0.06447496469644702, 'max_depth': 12, 'min_samples_split': 13, 'min_samples_leaf': 2, 'subsample': 0.6097770554719788, 'max_features': None}. Best is trial 340 with value: 0.3354678567574197.
[I 2024-12-04 12:20:01,251] Trial 367 finished with value: 0.8004264602289968 and parameters: {'n_estimators': 486, 'learning_rate': 0.03419301666592644, 'max_depth': 11, 'min_samples_split': 11, 'min_samples_leaf': 5, 'subsample': 0.6233956919107471, 'max_features': 'log2'}. Best is trial 340 with value: 0.3354678567574197.
[I 2024-12-04 12:20:02,992] Trial 370 finished with value: 0.3809486224002946 and parameters: {'n_estimators': 410, 'learning_rate': 0.04116281293344416, 'max_depth': 10, 'min_samples_split': 9, 'min_samples_leaf': 1, 'subsample': 0.6198930085986788, 'max_features': None}. Best is trial 338 with value: 0.3285063689933007.
[I 2024-12-04 12:20:03,032] Trial 338 finished with value: 0.3285063689933007 and parameters: {'n_estimators': 1323, 'learning_rate': 0.06843306846374254, 'max_depth': 8, 'min_samples_split': 6, 'min_samples_leaf': 2, 'subsample': 0.7222730912608859, 'max_features': None}. Best is trial 341 with value: 0.32115001931817605.
[I 2024-12-04 12:20:03,063] Trial 350 finished with value: 0.3913744782356201 and parameters: {'n_estimators': 1006, 'learning_rate': 0.039585882220988626, 'max_depth': 8, 'min_samples_split': 7, 'min_samples_leaf': 1, 'subsample': 0.9768091048417454, 'max_features': None}. Best is trial 341 with value: 0.32115001931817605.
[I 2024-12-04 12:20:03,369] Trial 341 finished with value: 0.32115001931817605 and parameters: {'n_estimators': 1335, 'learning_rate': 0.07514715524262643, 'max_depth': 6, 'min_samples_split': 2, 'min_samples_leaf': 2, 'subsample': 0.7471935994040754, 'max_features': None}. Best is trial 341 with value: 0.32115001931817605.
[I 2024-12-04 12:20:05,803] Trial 356 finished with value: 0.3888899594246583 and parameters: {'n_estimators': 1135, 'learning_rate': 0.07135802236629223, 'max_depth': 12, 'min_samples_split': 9, 'min_samples_leaf': 3, 'subsample': 0.6957821035976555, 'max_features': 'sqrt'}. Best is trial 341 with value: 0.32115001931817605.
[I 2024-12-04 12:20:07,404] Trial 358 finished with value: 0.3984659065231027 and parameters: {'n_estimators': 1127, 'learning_rate': 0.05011099339431444, 'max_depth': 11, 'min_samples_split': 14, 'min_samples_leaf': 3, 'subsample': 0.6393067381398149, 'max_features': 'sqrt'}. Best is trial 341 with value: 0.32115001931817605.
[I 2024-12-04 12:20:10,769] Trial 359 finished with value: 0.41239408809174294 and parameters: {'n_estimators': 1181, 'learning_rate': 0.055071750898104954, 'max_depth': 7, 'min_samples_split': 12, 'min_samples_leaf': 4, 'subsample': 0.9848961076706582, 'max_features': 'sqrt'}. Best is trial 341 with value: 0.32115001931817605.
[I 2024-12-04 12:20:10,770] Trial 373 finished with value: 0.34845009151569833 and parameters: {'n_estimators': 514, 'learning_rate': 0.03704005640508589, 'max_depth': 12, 'min_samples_split': 9, 'min_samples_leaf': 2, 'subsample': 0.7350168416905454, 'max_features': None}. Best is trial 341 with value: 0.32115001931817605.
[I 2024-12-04 12:20:11,851] Trial 368 finished with value: 0.5144870486710573 and parameters: {'n_estimators': 881, 'learning_rate': 0.030694427993582588, 'max_depth': 9, 'min_samples_split': 10, 'min_samples_leaf': 3, 'subsample': 0.6908236497255541, 'max_features': 'log2'}. Best is trial 341 with value: 0.32115001931817605.
[I 2024-12-04 12:20:11,858] Trial 361 finished with value: 0.40701216688368347 and parameters: {'n_estimators': 1114, 'learning_rate': 0.09249797272545297, 'max_depth': 10, 'min_samples_split': 9, 'min_samples_leaf': 3, 'subsample': 0.788562979215903, 'max_features': 'sqrt'}. Best is trial 341 with value: 0.32115001931817605.
[I 2024-12-04 12:20:12,222] Trial 374 finished with value: 0.36437169290934335 and parameters: {'n_estimators': 487, 'learning_rate': 0.047555341264137505, 'max_depth': 12, 'min_samples_split': 11, 'min_samples_leaf': 3, 'subsample': 0.6554916709797766, 'max_features': None}. Best is trial 341 with value: 0.32115001931817605.
[I 2024-12-04 12:20:12,225] Trial 375 finished with value: 0.4876229292809351 and parameters: {'n_estimators': 643, 'learning_rate': 0.09626710189819333, 'max_depth': 7, 'min_samples_split': 15, 'min_samples_leaf': 4, 'subsample': 0.7529819578572431, 'max_features': 'log2'}. Best is trial 341 with value: 0.32115001931817605.
[I 2024-12-04 12:20:12,235] Trial 371 finished with value: 0.3841895740915746 and parameters: {'n_estimators': 647, 'learning_rate': 0.039350337348005346, 'max_depth': 12, 'min_samples_split': 10, 'min_samples_leaf': 5, 'subsample': 0.6502286047190442, 'max_features': None}. Best is trial 341 with value: 0.32115001931817605.
[I 2024-12-04 12:20:12,596] Trial 372 finished with value: 0.3421433080821344 and parameters: {'n_estimators': 648, 'learning_rate': 0.03479533584623435, 'max_depth': 10, 'min_samples_split': 9, 'min_samples_leaf': 2, 'subsample': 0.6670754111866221, 'max_features': None}. Best is trial 341 with value: 0.32115001931817605.
[I 2024-12-04 12:20:12,799] Trial 364 finished with value: 0.38613355473272115 and parameters: {'n_estimators': 891, 'learning_rate': 0.044284304721298094, 'max_depth': 9, 'min_samples_split': 18, 'min_samples_leaf': 1, 'subsample': 0.7654813900455757, 'max_features': None}. Best is trial 341 with value: 0.32115001931817605.
[I 2024-12-04 12:20:13,301] Trial 360 finished with value: 0.3867881462746258 and parameters: {'n_estimators': 1331, 'learning_rate': 0.0756666282977287, 'max_depth': 10, 'min_samples_split': 14, 'min_samples_leaf': 1, 'subsample': 0.6960982052201506, 'max_features': 'sqrt'}. Best is trial 341 with value: 0.32115001931817605.
[I 2024-12-04 12:20:18,199] Trial 380 finished with value: 0.3655578072882862 and parameters: {'n_estimators': 542, 'learning_rate': 0.01650761867897468, 'max_depth': 11, 'min_samples_split': 5, 'min_samples_leaf': 2, 'subsample': 0.6038196628336717, 'max_features': None}. Best is trial 341 with value: 0.32115001931817605.
[I 2024-12-04 12:20:18,344] Trial 363 finished with value: 0.4240967513708078 and parameters: {'n_estimators': 1341, 'learning_rate': 0.061109207888937735, 'max_depth': 10, 'min_samples_split': 6, 'min_samples_leaf': 3, 'subsample': 0.6136368590658344, 'max_features': 'sqrt'}. Best is trial 341 with value: 0.32115001931817605.
[I 2024-12-04 12:20:18,791] Trial 378 finished with value: 0.40043088168832314 and parameters: {'n_estimators': 733, 'learning_rate': 0.024136498944229562, 'max_depth': 10, 'min_samples_split': 6, 'min_samples_leaf': 2, 'subsample': 0.6641844554497799, 'max_features': 'sqrt'}. Best is trial 341 with value: 0.32115001931817605.
[I 2024-12-04 12:20:20,375] Trial 369 finished with value: 0.39960144428263805 and parameters: {'n_estimators': 1097, 'learning_rate': 0.04598229060084033, 'max_depth': 6, 'min_samples_split': 3, 'min_samples_leaf': 2, 'subsample': 0.8112420754648981, 'max_features': 'sqrt'}. Best is trial 341 with value: 0.32115001931817605.
[I 2024-12-04 12:20:20,602] Trial 366 finished with value: 0.46083335848330953 and parameters: {'n_estimators': 1279, 'learning_rate': 0.06369476197430383, 'max_depth': 8, 'min_samples_split': 6, 'min_samples_leaf': 3, 'subsample': 0.8949459292713893, 'max_features': 'log2'}. Best is trial 341 with value: 0.32115001931817605.
[I 2024-12-04 12:20:21,147] Trial 379 finished with value: 0.45360348398906036 and parameters: {'n_estimators': 853, 'learning_rate': 0.07140432065023608, 'max_depth': 12, 'min_samples_split': 11, 'min_samples_leaf': 3, 'subsample': 0.6497426824790277, 'max_features': 'log2'}. Best is trial 341 with value: 0.32115001931817605.
[I 2024-12-04 12:20:21,757] Trial 376 finished with value: 0.38916275479697343 and parameters: {'n_estimators': 883, 'learning_rate': 0.026201390315166325, 'max_depth': 11, 'min_samples_split': 5, 'min_samples_leaf': 3, 'subsample': 0.6703922193709448, 'max_features': None}. Best is trial 341 with value: 0.32115001931817605.
[I 2024-12-04 12:20:22,030] Trial 365 finished with value: 0.4046554963246911 and parameters: {'n_estimators': 1329, 'learning_rate': 0.03428326033907802, 'max_depth': 12, 'min_samples_split': 4, 'min_samples_leaf': 1, 'subsample': 0.6717935033616856, 'max_features': 'log2'}. Best is trial 341 with value: 0.32115001931817605.
[I 2024-12-04 12:20:23,920] Trial 362 finished with value: 0.36634077824000083 and parameters: {'n_estimators': 1381, 'learning_rate': 0.05374450484996789, 'max_depth': 8, 'min_samples_split': 9, 'min_samples_leaf': 4, 'subsample': 0.9904147422108618, 'max_features': None}. Best is trial 341 with value: 0.32115001931817605.
[I 2024-12-04 12:20:29,059] Trial 382 finished with value: 0.360409314452089 and parameters: {'n_estimators': 954, 'learning_rate': 0.07093674164837566, 'max_depth': 12, 'min_samples_split': 12, 'min_samples_leaf': 3, 'subsample': 0.6036384797986158, 'max_features': None}. Best is trial 341 with value: 0.32115001931817605.
[I 2024-12-04 12:20:30,076] Trial 406 finished with value: 0.6540642976655737 and parameters: {'n_estimators': 105, 'learning_rate': 0.036659832861354165, 'max_depth': 8, 'min_samples_split': 11, 'min_samples_leaf': 2, 'subsample': 0.6248347710337125, 'max_features': 'sqrt'}. Best is trial 341 with value: 0.32115001931817605.
[I 2024-12-04 12:20:32,344] Trial 381 finished with value: 0.3836995590026929 and parameters: {'n_estimators': 1018, 'learning_rate': 0.08427930453743299, 'max_depth': 12, 'min_samples_split': 9, 'min_samples_leaf': 3, 'subsample': 0.6135886226136823, 'max_features': None}. Best is trial 341 with value: 0.32115001931817605.
[I 2024-12-04 12:20:33,555] Trial 392 finished with value: 0.6684958303235274 and parameters: {'n_estimators': 909, 'learning_rate': 0.07415762976699236, 'max_depth': 3, 'min_samples_split': 2, 'min_samples_leaf': 8, 'subsample': 0.6366376727442972, 'max_features': 'log2'}. Best is trial 341 with value: 0.32115001931817605.
[I 2024-12-04 12:20:35,281] Trial 377 finished with value: 0.38242362078258463 and parameters: {'n_estimators': 1277, 'learning_rate': 0.04492729412417283, 'max_depth': 7, 'min_samples_split': 2, 'min_samples_leaf': 3, 'subsample': 0.8395233619944119, 'max_features': None}. Best is trial 341 with value: 0.32115001931817605.
[I 2024-12-04 12:20:36,487] Trial 387 finished with value: 0.33566165979105744 and parameters: {'n_estimators': 832, 'learning_rate': 0.023893602460084068, 'max_depth': 11, 'min_samples_split': 3, 'min_samples_leaf': 2, 'subsample': 0.6267904504537081, 'max_features': None}. Best is trial 341 with value: 0.32115001931817605.
[I 2024-12-04 12:20:37,470] Trial 383 finished with value: 0.38797821061170606 and parameters: {'n_estimators': 1113, 'learning_rate': 0.0920449812466646, 'max_depth': 6, 'min_samples_split': 5, 'min_samples_leaf': 1, 'subsample': 0.7436975054948947, 'max_features': None}. Best is trial 341 with value: 0.32115001931817605.
[I 2024-12-04 12:20:39,487] Trial 391 finished with value: 0.3428475380098635 and parameters: {'n_estimators': 830, 'learning_rate': 0.03554132285737785, 'max_depth': 11, 'min_samples_split': 20, 'min_samples_leaf': 2, 'subsample': 0.7174487223924813, 'max_features': None}. Best is trial 341 with value: 0.32115001931817605.
[I 2024-12-04 12:20:40,423] Trial 389 finished with value: 0.5551751921022738 and parameters: {'n_estimators': 1208, 'learning_rate': 0.0631194996350461, 'max_depth': 7, 'min_samples_split': 5, 'min_samples_leaf': 8, 'subsample': 0.6194855960810768, 'max_features': 'sqrt'}. Best is trial 341 with value: 0.32115001931817605.
[I 2024-12-04 12:20:42,136] Trial 386 finished with value: 0.3255249015471732 and parameters: {'n_estimators': 1141, 'learning_rate': 0.06659110723267524, 'max_depth': 8, 'min_samples_split': 2, 'min_samples_leaf': 2, 'subsample': 0.7099456493300931, 'max_features': None}. Best is trial 341 with value: 0.32115001931817605.
[I 2024-12-04 12:20:42,934] Trial 384 finished with value: 0.3732007698483406 and parameters: {'n_estimators': 1267, 'learning_rate': 0.08588011292128905, 'max_depth': 5, 'min_samples_split': 3, 'min_samples_leaf': 4, 'subsample': 0.7449446177571092, 'max_features': None}. Best is trial 341 with value: 0.32115001931817605.
[I 2024-12-04 12:20:44,571] Trial 390 finished with value: 0.37954023402883785 and parameters: {'n_estimators': 1073, 'learning_rate': 0.03305701861361766, 'max_depth': 10, 'min_samples_split': 2, 'min_samples_leaf': 1, 'subsample': 0.6353034565957845, 'max_features': None}. Best is trial 341 with value: 0.32115001931817605.
[I 2024-12-04 12:20:45,116] Trial 395 finished with value: 0.40114417960646676 and parameters: {'n_estimators': 883, 'learning_rate': 0.06766101790741197, 'max_depth': 5, 'min_samples_split': 3, 'min_samples_leaf': 3, 'subsample': 0.8963115015287441, 'max_features': None}. Best is trial 341 with value: 0.32115001931817605.
[I 2024-12-04 12:20:45,966] Trial 385 finished with value: 0.3245456253683304 and parameters: {'n_estimators': 1300, 'learning_rate': 0.04342947277989924, 'max_depth': 7, 'min_samples_split': 2, 'min_samples_leaf': 2, 'subsample': 0.6707200925912267, 'max_features': None}. Best is trial 341 with value: 0.32115001931817605.
[I 2024-12-04 12:20:45,974] Trial 402 finished with value: 0.4058110898475286 and parameters: {'n_estimators': 817, 'learning_rate': 0.09168779437971407, 'max_depth': 10, 'min_samples_split': 10, 'min_samples_leaf': 3, 'subsample': 0.6448935708505206, 'max_features': 'sqrt'}. Best is trial 341 with value: 0.32115001931817605.
[I 2024-12-04 12:20:47,768] Trial 399 finished with value: 0.3956435102193576 and parameters: {'n_estimators': 1070, 'learning_rate': 0.0968143098530034, 'max_depth': 4, 'min_samples_split': 4, 'min_samples_leaf': 2, 'subsample': 0.698928363709936, 'max_features': 'sqrt'}. Best is trial 341 with value: 0.32115001931817605.
[I 2024-12-04 12:20:51,306] Trial 394 finished with value: 0.5509877499841996 and parameters: {'n_estimators': 1123, 'learning_rate': 0.048017330725032635, 'max_depth': 6, 'min_samples_split': 14, 'min_samples_leaf': 10, 'subsample': 0.8361546915013409, 'max_features': None}. Best is trial 341 with value: 0.32115001931817605.
[I 2024-12-04 12:20:51,330] Trial 408 finished with value: 0.3463477130972901 and parameters: {'n_estimators': 688, 'learning_rate': 0.048773569191010425, 'max_depth': 11, 'min_samples_split': 11, 'min_samples_leaf': 2, 'subsample': 0.6305477534980045, 'max_features': None}. Best is trial 341 with value: 0.32115001931817605.
[I 2024-12-04 12:20:52,546] Trial 388 finished with value: 0.32931978637989656 and parameters: {'n_estimators': 1440, 'learning_rate': 0.06318623988518746, 'max_depth': 6, 'min_samples_split': 2, 'min_samples_leaf': 2, 'subsample': 0.7677093789696351, 'max_features': None}. Best is trial 341 with value: 0.32115001931817605.
[I 2024-12-04 12:20:53,604] Trial 409 finished with value: 0.34467597645977016 and parameters: {'n_estimators': 734, 'learning_rate': 0.07259461812521543, 'max_depth': 11, 'min_samples_split': 10, 'min_samples_leaf': 2, 'subsample': 0.6937504641057175, 'max_features': None}. Best is trial 341 with value: 0.32115001931817605.
[I 2024-12-04 12:20:54,402] Trial 410 finished with value: 0.44874649861790955 and parameters: {'n_estimators': 879, 'learning_rate': 0.0256426119766618, 'max_depth': 11, 'min_samples_split': 18, 'min_samples_leaf': 2, 'subsample': 0.6488795260412474, 'max_features': 'log2'}. Best is trial 341 with value: 0.32115001931817605.
[I 2024-12-04 12:20:58,057] Trial 398 finished with value: 0.3745698532832304 and parameters: {'n_estimators': 1358, 'learning_rate': 0.03872025642091592, 'max_depth': 4, 'min_samples_split': 8, 'min_samples_leaf': 2, 'subsample': 0.7209878950246605, 'max_features': None}. Best is trial 341 with value: 0.32115001931817605.
