[I 2024-12-04 15:00:40,378] Trial 601 finished with value: 0.4883034181029898 and parameters: {'kernel_type': 'Matern', 'length_scale': 722.0069340239124, 'noise_level': 0.10632767766439434, 'constant_value': 547.1022633349988, 'nu': 0.5}. Best is trial 386 with value: 0.4872991004520934.
[I 2024-12-04 15:00:41,389] Trial 602 finished with value: 0.48830342733157733 and parameters: {'kernel_type': 'Matern', 'length_scale': 92332.20655795274, 'noise_level': 0.1543332083317511, 'constant_value': 407.84783906819916, 'nu': 0.5}. Best is trial 386 with value: 0.4872991004520934.
[I 2024-12-04 15:00:42,469] Trial 606 finished with value: 1.2614110935958533 and parameters: {'kernel_type': 'Matern', 'length_scale': 28.900478686478753, 'noise_level': 0.030144438729406867, 'constant_value': 0.007075455946413794, 'nu': 0.5}. Best is trial 386 with value: 0.4872991004520934.
[I 2024-12-04 15:00:42,497] Trial 607 finished with value: 0.4883034202363033 and parameters: {'kernel_type': 'Matern', 'length_scale': 2479.130875416595, 'noise_level': 0.02041286318251818, 'constant_value': 2935.4082852184683, 'nu': 0.5}. Best is trial 386 with value: 0.4872991004520934.
[I 2024-12-04 15:00:42,634] Trial 603 finished with value: 0.4883034191308208 and parameters: {'kernel_type': 'Matern', 'length_scale': 57.71708206098029, 'noise_level': 0.0032637550303217916, 'constant_value': 70737.61834672473, 'nu': 0.5}. Best is trial 386 with value: 0.4872991004520934.
[I 2024-12-04 15:00:43,574] Trial 587 finished with value: 0.4883034734095545 and parameters: {'kernel_type': 'Matern', 'length_scale': 2591.593198722496, 'noise_level': 0.004241170661825939, 'constant_value': 75119.90966450342, 'nu': 0.5}. Best is trial 386 with value: 0.4872991004520934.
[I 2024-12-04 15:00:44,495] Trial 599 finished with value: 1.2614547868778367 and parameters: {'kernel_type': 'Matern', 'length_scale': 21.979333998191436, 'noise_level': 0.00015821444900913486, 'constant_value': 946.064667239613, 'nu': 0.5}. Best is trial 386 with value: 0.4872991004520934.
[I 2024-12-04 15:00:44,499] Trial 610 finished with value: 0.4883034296199477 and parameters: {'kernel_type': 'Matern', 'length_scale': 1569.1239646476206, 'noise_level': 0.00014863770528240612, 'constant_value': 1076.4692527612565, 'nu': 0.5}. Best is trial 386 with value: 0.4872991004520934.
[I 2024-12-04 15:00:44,621] Trial 609 finished with value: 0.48830342041019603 and parameters: {'kernel_type': 'Matern', 'length_scale': 19280.967277949774, 'noise_level': 0.7747202739616194, 'constant_value': 85646.44779593077, 'nu': 0.5}. Best is trial 386 with value: 0.4872991004520934.
[I 2024-12-04 15:00:44,625] Trial 612 finished with value: 1.2401112317989231 and parameters: {'kernel_type': 'Matern', 'length_scale': 0.03839556425387087, 'noise_level': 0.01450917697390636, 'constant_value': 363.4346438273139, 'nu': 0.5}. Best is trial 386 with value: 0.4872991004520934.
[I 2024-12-04 15:00:47,541] Trial 619 finished with value: 0.48830338158149517 and parameters: {'kernel_type': 'Matern', 'length_scale': 12.622951618279888, 'noise_level': 0.007446261087812366, 'constant_value': 1093.8371680802989, 'nu': 0.5}. Best is trial 386 with value: 0.4872991004520934.
[I 2024-12-04 15:00:49,487] Trial 613 finished with value: 1.2614547908491751 and parameters: {'kernel_type': 'Matern', 'length_scale': 268.1481384253716, 'noise_level': 5.572159447291103e-05, 'constant_value': 72631.93537620759, 'nu': 0.5}. Best is trial 386 with value: 0.4872991004520934.
[I 2024-12-04 15:00:49,743] Trial 605 finished with value: 0.6443853281580978 and parameters: {'kernel_type': 'RBF', 'length_scale': 88162.16811785754, 'noise_level': 0.46670545318893536, 'constant_value': 41609.7437508397, 'nu': 0.5}. Best is trial 386 with value: 0.4872991004520934.
[I 2024-12-04 15:00:50,317] Trial 611 finished with value: 0.4883033448034941 and parameters: {'kernel_type': 'Matern', 'length_scale': 15.980756993716907, 'noise_level': 0.04295202130444361, 'constant_value': 304.75338925930805, 'nu': 0.5}. Best is trial 386 with value: 0.4872991004520934.
[I 2024-12-04 15:00:52,881] Trial 614 finished with value: 0.4883033844608954 and parameters: {'kernel_type': 'Matern', 'length_scale': 2.4487605576097278, 'noise_level': 0.006765361504539779, 'constant_value': 194.87977577824725, 'nu': 0.5}. Best is trial 386 with value: 0.4872991004520934.
[I 2024-12-04 15:00:52,954] Trial 625 finished with value: 1.2614547953941473 and parameters: {'kernel_type': 'Matern', 'length_scale': 1.6756196982850762, 'noise_level': 0.02525263843110716, 'constant_value': 244.82881163585802, 'nu': 0.5}. Best is trial 386 with value: 0.4872991004520934.
[I 2024-12-04 15:00:53,044] Trial 620 finished with value: 0.48830341087447837 and parameters: {'kernel_type': 'Matern', 'length_scale': 35.21857921970091, 'noise_level': 0.0025404318807007433, 'constant_value': 396.18761043684134, 'nu': 0.5}. Best is trial 386 with value: 0.4872991004520934.
[I 2024-12-04 15:00:53,375] Trial 615 finished with value: 1.240111232583637 and parameters: {'kernel_type': 'RBF', 'length_scale': 328.17280182170407, 'noise_level': 0.004969346872313857, 'constant_value': 56.217923102830355, 'nu': 0.5}. Best is trial 386 with value: 0.4872991004520934.
[I 2024-12-04 15:00:53,780] Trial 629 finished with value: 0.4883034151557248 and parameters: {'kernel_type': 'Matern', 'length_scale': 76204.67644333423, 'noise_level': 0.030253489397436033, 'constant_value': 92611.6097833771, 'nu': 0.5}. Best is trial 386 with value: 0.4872991004520934.
[I 2024-12-04 15:00:53,978] Trial 628 finished with value: 0.4883034284799115 and parameters: {'kernel_type': 'Matern', 'length_scale': 90.78373725006256, 'noise_level': 0.01965538490143656, 'constant_value': 15.807760051537434, 'nu': 0.5}. Best is trial 386 with value: 0.4872991004520934.
[I 2024-12-04 15:00:54,204] Trial 616 finished with value: 0.4883034167953094 and parameters: {'kernel_type': 'Matern', 'length_scale': 502.3475506574327, 'noise_level': 0.028913578091226706, 'constant_value': 329.56431758200245, 'nu': 0.5}. Best is trial 386 with value: 0.4872991004520934.
[I 2024-12-04 15:00:54,769] Trial 627 finished with value: 0.4883034304080907 and parameters: {'kernel_type': 'Matern', 'length_scale': 1744.6595065734193, 'noise_level': 0.1804736532138133, 'constant_value': 1159.8041843960857, 'nu': 0.5}. Best is trial 386 with value: 0.4872991004520934.
[I 2024-12-04 15:00:55,148] Trial 618 finished with value: 1.261454795394147 and parameters: {'kernel_type': 'Matern', 'length_scale': 1173.612951927994, 'noise_level': 0.0345439269816991, 'constant_value': 81044.15450453703, 'nu': 0.5}. Best is trial 386 with value: 0.4872991004520934.
[I 2024-12-04 15:00:55,310] Trial 621 finished with value: 0.4883033993713184 and parameters: {'kernel_type': 'Matern', 'length_scale': 68567.64977438118, 'noise_level': 0.012825691535278506, 'constant_value': 2091.722377038634, 'nu': 0.5}. Best is trial 386 with value: 0.4872991004520934.
[I 2024-12-04 15:00:56,363] Trial 632 finished with value: 1.2614547976352477 and parameters: {'kernel_type': 'Matern', 'length_scale': 19.326381288106653, 'noise_level': 0.0001785851983469238, 'constant_value': 18257.667428632605, 'nu': 1.5}. Best is trial 386 with value: 0.4872991004520934.
[I 2024-12-04 15:00:56,665] Trial 626 finished with value: 0.4883034401625718 and parameters: {'kernel_type': 'Matern', 'length_scale': 272.9953616405192, 'noise_level': 0.013978822057508472, 'constant_value': 60991.95475170596, 'nu': 0.5}. Best is trial 386 with value: 0.4872991004520934.
[I 2024-12-04 15:00:56,910] Trial 608 finished with value: 0.566393499115335 and parameters: {'kernel_type': 'Matern', 'length_scale': 0.2380903871844155, 'noise_level': 0.0037239127821685172, 'constant_value': 5.064285783630319e-07, 'nu': 2.5}. Best is trial 386 with value: 0.4872991004520934.
[I 2024-12-04 15:00:57,040] Trial 623 finished with value: 0.5663936686173303 and parameters: {'kernel_type': 'Matern', 'length_scale': 17.35728395664884, 'noise_level': 0.003153396619882607, 'constant_value': 68129.54176427057, 'nu': 2.5}. Best is trial 386 with value: 0.4872991004520934.
[I 2024-12-04 15:00:57,474] Trial 624 finished with value: 0.48830341889178336 and parameters: {'kernel_type': 'Matern', 'length_scale': 66964.879139777, 'noise_level': 0.7869234344482463, 'constant_value': 730.8710901266128, 'nu': 0.5}. Best is trial 386 with value: 0.4872991004520934.
[I 2024-12-04 15:00:58,200] Trial 630 finished with value: 1.2401112321833634 and parameters: {'kernel_type': 'Matern', 'length_scale': 62795.809681462546, 'noise_level': 0.006272387642882175, 'constant_value': 54.47735511028489, 'nu': 1.5}. Best is trial 386 with value: 0.4872991004520934.
[I 2024-12-04 15:00:58,543] Trial 622 finished with value: 0.4883064492064359 and parameters: {'kernel_type': 'Matern', 'length_scale': 345.00357161239924, 'noise_level': 0.0010773312486587433, 'constant_value': 7.8154165857326054, 'nu': 0.5}. Best is trial 386 with value: 0.4872991004520934.
[I 2024-12-04 15:00:59,460] Trial 636 finished with value: 0.4883034212212536 and parameters: {'kernel_type': 'Matern', 'length_scale': 1980.5875651252404, 'noise_level': 0.013121366653506794, 'constant_value': 426.50361934476604, 'nu': 0.5}. Best is trial 386 with value: 0.4872991004520934.
[I 2024-12-04 15:01:00,566] Trial 634 finished with value: 1.261454276852385 and parameters: {'kernel_type': 'Matern', 'length_scale': 0.2183650777898092, 'noise_level': 1.385270363223142e-05, 'constant_value': 49054.484166246424, 'nu': 0.5}. Best is trial 386 with value: 0.4872991004520934.
[I 2024-12-04 15:01:00,848] Trial 637 finished with value: 1.2401112302885804 and parameters: {'kernel_type': 'Matern', 'length_scale': 0.04765304497053396, 'noise_level': 0.00024599173983852826, 'constant_value': 0.24342635383642597, 'nu': 0.5}. Best is trial 386 with value: 0.4872991004520934.
[I 2024-12-04 15:01:01,177] Trial 641 finished with value: 0.48830335610268477 and parameters: {'kernel_type': 'Matern', 'length_scale': 1968.3721261528146, 'noise_level': 0.032956614378362475, 'constant_value': 867.7922534296183, 'nu': 0.5}. Best is trial 386 with value: 0.4872991004520934.
[I 2024-12-04 15:01:01,576] Trial 631 finished with value: 1.240111232590679 and parameters: {'kernel_type': 'Matern', 'length_scale': 68764.3202923445, 'noise_level': 2.226399319228457e-08, 'constant_value': 2.2649258662421996, 'nu': 2.5}. Best is trial 386 with value: 0.4872991004520934.
[I 2024-12-04 15:01:01,904] Trial 633 finished with value: 0.4883034141959199 and parameters: {'kernel_type': 'Matern', 'length_scale': 1.1293454270007075, 'noise_level': 0.00018575830397218952, 'constant_value': 13.27985116467188, 'nu': 0.5}. Best is trial 386 with value: 0.4872991004520934.
[I 2024-12-04 15:01:01,918] Trial 635 finished with value: 1.261454795394147 and parameters: {'kernel_type': 'Matern', 'length_scale': 14.160133490787135, 'noise_level': 0.04710878687624197, 'constant_value': 82801.55272120067, 'nu': 0.5}. Best is trial 386 with value: 0.4872991004520934.
[I 2024-12-04 15:01:01,921] Trial 617 finished with value: 0.48830344890901844 and parameters: {'kernel_type': 'Matern', 'length_scale': 2059.0199412516004, 'noise_level': 0.7724910386583081, 'constant_value': 68406.36961245093, 'nu': 0.5}. Best is trial 386 with value: 0.4872991004520934.
[I 2024-12-04 15:01:02,920] Trial 644 finished with value: 1.2614543702026362 and parameters: {'kernel_type': 'Matern', 'length_scale': 0.0003210919307756699, 'noise_level': 1.1532849497552235e-09, 'constant_value': 2959.526730480507, 'nu': 0.5}. Best is trial 386 with value: 0.4872991004520934.
[I 2024-12-04 15:01:03,367] Trial 642 finished with value: 0.4883034641485259 and parameters: {'kernel_type': 'Matern', 'length_scale': 0.7579257809977114, 'noise_level': 0.006338171040504036, 'constant_value': 12449.82844534143, 'nu': 0.5}. Best is trial 386 with value: 0.4872991004520934.
[I 2024-12-04 15:01:04,371] Trial 643 finished with value: 1.2401112323508996 and parameters: {'kernel_type': 'RBF', 'length_scale': 678.4153386842655, 'noise_level': 0.0006866574659318399, 'constant_value': 6112.977025790169, 'nu': 0.5}. Best is trial 386 with value: 0.4872991004520934.
[I 2024-12-04 15:01:04,516] Trial 638 finished with value: 0.488303375595676 and parameters: {'kernel_type': 'Matern', 'length_scale': 0.3093761456057143, 'noise_level': 0.0004130467766815989, 'constant_value': 0.3922856114267427, 'nu': 0.5}. Best is trial 386 with value: 0.4872991004520934.
[I 2024-12-04 15:01:05,371] Trial 639 finished with value: 0.48830341833800484 and parameters: {'kernel_type': 'Matern', 'length_scale': 10.01049844438806, 'noise_level': 0.0006219392919769019, 'constant_value': 622.7084612164371, 'nu': 0.5}. Best is trial 386 with value: 0.4872991004520934.
[I 2024-12-04 15:01:06,567] Trial 647 finished with value: 1.2401112325727084 and parameters: {'kernel_type': 'Matern', 'length_scale': 92017.67060727568, 'noise_level': 0.008628875071465753, 'constant_value': 777.9713280857618, 'nu': 0.5}. Best is trial 386 with value: 0.4872991004520934.
[I 2024-12-04 15:01:07,278] Trial 640 finished with value: 1.2614524314834854 and parameters: {'kernel_type': 'RBF', 'length_scale': 0.0033367448535184395, 'noise_level': 0.016589370235745, 'constant_value': 7.147941816576096e-07, 'nu': 2.5}. Best is trial 386 with value: 0.4872991004520934.
[I 2024-12-04 15:01:08,251] Trial 646 finished with value: 0.4883034330371407 and parameters: {'kernel_type': 'Matern', 'length_scale': 1004.2870219079213, 'noise_level': 0.043401476442150186, 'constant_value': 88987.56927570989, 'nu': 0.5}. Best is trial 386 with value: 0.4872991004520934.
[I 2024-12-04 15:01:09,231] Trial 650 finished with value: 0.48830341000466637 and parameters: {'kernel_type': 'Matern', 'length_scale': 379.2292321471703, 'noise_level': 0.0010714285633655494, 'constant_value': 401.4930362753877, 'nu': 0.5}. Best is trial 386 with value: 0.4872991004520934.
[I 2024-12-04 15:01:09,679] Trial 645 finished with value: 0.4883033941385294 and parameters: {'kernel_type': 'Matern', 'length_scale': 853.5170198543073, 'noise_level': 0.0004405349533556151, 'constant_value': 485.8478231926727, 'nu': 0.5}. Best is trial 386 with value: 0.4872991004520934.
[I 2024-12-04 15:01:09,950] Trial 659 finished with value: 0.488303418302477 and parameters: {'kernel_type': 'Matern', 'length_scale': 57247.23321152458, 'noise_level': 0.01658398302886006, 'constant_value': 574.7072500632055, 'nu': 0.5}. Best is trial 386 with value: 0.4872991004520934.
[I 2024-12-04 15:01:10,038] Trial 653 finished with value: 1.2614547967484782 and parameters: {'kernel_type': 'Matern', 'length_scale': 0.5091798429409161, 'noise_level': 9.811812581979785e-10, 'constant_value': 101.45559442291312, 'nu': 2.5}. Best is trial 386 with value: 0.4872991004520934.
[I 2024-12-04 15:01:11,200] Trial 648 finished with value: 1.2401112325823576 and parameters: {'kernel_type': 'RBF', 'length_scale': 61.588305648449136, 'noise_level': 1.3404348642252038e-06, 'constant_value': 12461.777130388647, 'nu': 0.5}. Best is trial 386 with value: 0.4872991004520934.
[I 2024-12-04 15:01:11,346] Trial 656 finished with value: 0.4883034189209645 and parameters: {'kernel_type': 'Matern', 'length_scale': 1466.1990417697086, 'noise_level': 0.8975869946077699, 'constant_value': 303.92816761740994, 'nu': 0.5}. Best is trial 386 with value: 0.4872991004520934.
[I 2024-12-04 15:01:13,485] Trial 655 finished with value: 0.5273054258347627 and parameters: {'kernel_type': 'Matern', 'length_scale': 10.681385511673167, 'noise_level': 0.131324150375741, 'constant_value': 9.06830152199486, 'nu': 1.5}. Best is trial 386 with value: 0.4872991004520934.
[I 2024-12-04 15:01:13,490] Trial 651 finished with value: 0.4883034224214114 and parameters: {'kernel_type': 'Matern', 'length_scale': 92238.66704640546, 'noise_level': 0.12329827957047229, 'constant_value': 50593.414118396846, 'nu': 0.5}. Best is trial 386 with value: 0.4872991004520934.
[I 2024-12-04 15:01:14,211] Trial 664 finished with value: 0.48830341939266997 and parameters: {'kernel_type': 'Matern', 'length_scale': 6.410188171217674, 'noise_level': 0.022033476251495526, 'constant_value': 2.34565472346455, 'nu': 0.5}. Best is trial 386 with value: 0.4872991004520934.
[I 2024-12-04 15:01:14,547] Trial 657 finished with value: 0.5273054060210859 and parameters: {'kernel_type': 'Matern', 'length_scale': 9952.689763400103, 'noise_level': 0.6046601383050376, 'constant_value': 92004.0748694771, 'nu': 1.5}. Best is trial 386 with value: 0.4872991004520934.
[I 2024-12-04 15:01:14,954] Trial 654 finished with value: 1.2401112325837693 and parameters: {'kernel_type': 'Matern', 'length_scale': 0.0007801316533221714, 'noise_level': 0.00564675147090854, 'constant_value': 0.00016526961219597458, 'nu': 0.5}. Best is trial 386 with value: 0.4872991004520934.
[I 2024-12-04 15:01:15,066] Trial 649 finished with value: 1.240111232751655 and parameters: {'kernel_type': 'RBF', 'length_scale': 0.01469296108567024, 'noise_level': 0.084377717677972, 'constant_value': 0.0006154596751194155, 'nu': 0.5}. Best is trial 386 with value: 0.4872991004520934.
[I 2024-12-04 15:01:15,131] Trial 663 finished with value: 0.48830342827776785 and parameters: {'kernel_type': 'Matern', 'length_scale': 34.93409300270176, 'noise_level': 0.026139195703961948, 'constant_value': 13.854393851485803, 'nu': 0.5}. Best is trial 386 with value: 0.4872991004520934.
[I 2024-12-04 15:01:15,670] Trial 660 finished with value: 0.4883034187964422 and parameters: {'kernel_type': 'Matern', 'length_scale': 46362.878517097444, 'noise_level': 0.014564905344374808, 'constant_value': 76454.555354186, 'nu': 0.5}. Best is trial 386 with value: 0.4872991004520934.
[I 2024-12-04 15:01:18,553] Trial 662 finished with value: 0.48830341978000125 and parameters: {'kernel_type': 'Matern', 'length_scale': 1838.1604695406693, 'noise_level': 0.5816096644609, 'constant_value': 2172.451233038727, 'nu': 0.5}. Best is trial 386 with value: 0.4872991004520934.
[I 2024-12-04 15:01:18,678] Trial 658 finished with value: 0.4883034166194896 and parameters: {'kernel_type': 'Matern', 'length_scale': 14.59978852218015, 'noise_level': 0.0006094208414646989, 'constant_value': 55705.384949963125, 'nu': 0.5}. Best is trial 386 with value: 0.4872991004520934.
[I 2024-12-04 15:01:18,849] Trial 667 finished with value: 1.240111232625248 and parameters: {'kernel_type': 'Matern', 'length_scale': 97749.18986680913, 'noise_level': 0.000539513515664521, 'constant_value': 11766.185015306319, 'nu': 1.5}. Best is trial 386 with value: 0.4872991004520934.
[I 2024-12-04 15:01:18,850] Trial 661 finished with value: 0.48830340948618345 and parameters: {'kernel_type': 'Matern', 'length_scale': 190.09537119770513, 'noise_level': 0.017253237186484808, 'constant_value': 210.14643461782086, 'nu': 0.5}. Best is trial 386 with value: 0.4872991004520934.
[I 2024-12-04 15:01:18,961] Trial 668 finished with value: 0.4883034282764246 and parameters: {'kernel_type': 'Matern', 'length_scale': 7.603015682850618, 'noise_level': 0.0011287995854582164, 'constant_value': 87624.20403557071, 'nu': 0.5}. Best is trial 386 with value: 0.4872991004520934.
[I 2024-12-04 15:01:20,481] Trial 669 finished with value: 1.2401112322595769 and parameters: {'kernel_type': 'Matern', 'length_scale': 4.443980791447169e-05, 'noise_level': 0.00037145014939344667, 'constant_value': 2.779973828368076, 'nu': 1.5}. Best is trial 386 with value: 0.4872991004520934.
[I 2024-12-04 15:01:20,563] Trial 670 finished with value: 0.48830337330463464 and parameters: {'kernel_type': 'Matern', 'length_scale': 165.87506876448347, 'noise_level': 0.01165750151535807, 'constant_value': 96573.86956842791, 'nu': 0.5}. Best is trial 386 with value: 0.4872991004520934.
[I 2024-12-04 15:01:20,660] Trial 652 finished with value: 0.48830395526082276 and parameters: {'kernel_type': 'Matern', 'length_scale': 44.16822308087296, 'noise_level': 0.8264553963582314, 'constant_value': 588.2972607949907, 'nu': 0.5}. Best is trial 386 with value: 0.4872991004520934.
[I 2024-12-04 15:01:21,490] Trial 674 finished with value: 1.2401112350789003 and parameters: {'kernel_type': 'Matern', 'length_scale': 25.44779645720856, 'noise_level': 0.0002740171712951068, 'constant_value': 0.22812727795956098, 'nu': 0.5}. Best is trial 386 with value: 0.4872991004520934.
[I 2024-12-04 15:01:23,182] Trial 665 finished with value: 1.240111232589697 and parameters: {'kernel_type': 'Matern', 'length_scale': 79766.83330379214, 'noise_level': 0.009931595853196461, 'constant_value': 9.766684157232783, 'nu': 0.5}. Best is trial 386 with value: 0.4872991004520934.
[I 2024-12-04 15:01:23,442] Trial 673 finished with value: 0.48830341904144264 and parameters: {'kernel_type': 'Matern', 'length_scale': 2932.768253066579, 'noise_level': 0.009111415349602033, 'constant_value': 1598.294809066304, 'nu': 0.5}. Best is trial 386 with value: 0.4872991004520934.
[I 2024-12-04 15:01:23,455] Trial 676 finished with value: 1.2401112319473726 and parameters: {'kernel_type': 'Matern', 'length_scale': 37.487099856645244, 'noise_level': 7.000096253774696e-05, 'constant_value': 0.15299847804406072, 'nu': 0.5}. Best is trial 386 with value: 0.4872991004520934.
[I 2024-12-04 15:01:23,747] Trial 680 finished with value: 0.6443853944266822 and parameters: {'kernel_type': 'RBF', 'length_scale': 15.054074207062612, 'noise_level': 0.16298201967825432, 'constant_value': 47.94674998544597, 'nu': 1.5}. Best is trial 386 with value: 0.4872991004520934.
[I 2024-12-04 15:01:24,328] Trial 675 finished with value: 1.2614547976352422 and parameters: {'kernel_type': 'Matern', 'length_scale': 49979.044923775225, 'noise_level': 0.2542287709570886, 'constant_value': 45.36852592888764, 'nu': 2.5}. Best is trial 386 with value: 0.4872991004520934.
