[I 2024-12-04 20:55:07,641] Trial 1676 finished with value: 0.14249507135491385 and parameters: {'kernel_type': 'Matern', 'length_scale': 0.8936506601921479, 'noise_level': 0.8912163359227983, 'constant_value': 5.287631079323151, 'nu': 1.5}. Best is trial 959 with value: 0.1375110730946576.
[I 2024-12-04 20:55:10,240] Trial 1675 finished with value: 0.14249542233519877 and parameters: {'kernel_type': 'Matern', 'length_scale': 1.466469519361047, 'noise_level': 0.013205204830106291, 'constant_value': 0.07016888956038465, 'nu': 1.5}. Best is trial 959 with value: 0.1375110730946576.
[I 2024-12-04 20:55:14,339] Trial 1678 finished with value: 0.9864686819229764 and parameters: {'kernel_type': 'Matern', 'length_scale': 54.38670095344212, 'noise_level': 0.009955313792946585, 'constant_value': 0.04487064318444101, 'nu': 1.5}. Best is trial 959 with value: 0.1375110730946576.
[I 2024-12-04 20:55:15,218] Trial 1679 finished with value: 0.1424950571483734 and parameters: {'kernel_type': 'Matern', 'length_scale': 29.09694327070264, 'noise_level': 0.9286197721294006, 'constant_value': 16.955064280001434, 'nu': 1.5}. Best is trial 959 with value: 0.1375110730946576.
[I 2024-12-04 20:55:17,316] Trial 1680 finished with value: 0.1424950763306363 and parameters: {'kernel_type': 'Matern', 'length_scale': 12.769426317703909, 'noise_level': 0.010075705761841044, 'constant_value': 86.9815638687365, 'nu': 1.5}. Best is trial 959 with value: 0.1375110730946576.
[I 2024-12-04 20:55:21,220] Trial 1682 finished with value: 0.142495049348545 and parameters: {'kernel_type': 'Matern', 'length_scale': 40.32847699775191, 'noise_level': 0.019622417167995346, 'constant_value': 154.52021471339054, 'nu': 1.5}. Best is trial 959 with value: 0.1375110730946576.
[I 2024-12-04 20:55:26,163] Trial 1683 finished with value: 0.9864686819112426 and parameters: {'kernel_type': 'Matern', 'length_scale': 3535.3013190727993, 'noise_level': 0.03282135020128867, 'constant_value': 12.319441857912055, 'nu': 1.5}. Best is trial 959 with value: 0.1375110730946576.
[I 2024-12-04 20:55:26,617] Trial 1681 finished with value: 0.1424951737032818 and parameters: {'kernel_type': 'Matern', 'length_scale': 207.74707891229366, 'noise_level': 0.8034492163623823, 'constant_value': 0.03734495633809463, 'nu': 1.5}. Best is trial 959 with value: 0.1375110730946576.
[I 2024-12-04 20:55:29,002] Trial 1684 finished with value: 0.1424950338162143 and parameters: {'kernel_type': 'Matern', 'length_scale': 6.310515479187023, 'noise_level': 0.8049815842883397, 'constant_value': 0.6624216646403788, 'nu': 1.5}. Best is trial 959 with value: 0.1375110730946576.
[I 2024-12-04 20:55:29,542] Trial 1685 finished with value: 0.9982171094940401 and parameters: {'kernel_type': 'Matern', 'length_scale': 6.159829734925114, 'noise_level': 0.0024860615185131043, 'constant_value': 92722.99448795112, 'nu': 1.5}. Best is trial 959 with value: 0.1375110730946576.
[I 2024-12-04 20:55:34,302] Trial 1688 finished with value: 0.9982167338037553 and parameters: {'kernel_type': 'Matern', 'length_scale': 8.022922568323671e-05, 'noise_level': 1.8689549729011587e-10, 'constant_value': 12337.308639939838, 'nu': 0.5}. Best is trial 959 with value: 0.1375110730946576.
[I 2024-12-04 20:55:35,909] Trial 1687 finished with value: 0.14249509556746598 and parameters: {'kernel_type': 'Matern', 'length_scale': 0.5629724325681554, 'noise_level': 0.025906094167208075, 'constant_value': 262.5034974218818, 'nu': 1.5}. Best is trial 959 with value: 0.1375110730946576.
[I 2024-12-04 20:55:40,768] Trial 1689 finished with value: 0.9864686819266105 and parameters: {'kernel_type': 'Matern', 'length_scale': 0.009416799596123675, 'noise_level': 0.018996975664581663, 'constant_value': 14694.439348100024, 'nu': 1.5}. Best is trial 959 with value: 0.1375110730946576.
[I 2024-12-04 20:55:41,438] Trial 1686 finished with value: 0.1424950667820511 and parameters: {'kernel_type': 'Matern', 'length_scale': 0.4144341182693958, 'noise_level': 0.6698287040028013, 'constant_value': 217.44749909829775, 'nu': 1.5}. Best is trial 959 with value: 0.1375110730946576.
[I 2024-12-04 20:55:43,298] Trial 1690 finished with value: 0.9864686819201065 and parameters: {'kernel_type': 'Matern', 'length_scale': 1192.096899912855, 'noise_level': 0.0016775698878072878, 'constant_value': 4160.8113057721785, 'nu': 1.5}. Best is trial 959 with value: 0.1375110730946576.
[I 2024-12-04 20:55:48,914] Trial 1692 finished with value: 0.9864686819007056 and parameters: {'kernel_type': 'Matern', 'length_scale': 0.0023014879827326063, 'noise_level': 1.7728973875496064e-10, 'constant_value': 5.091585193503695e-07, 'nu': 1.5}. Best is trial 959 with value: 0.1375110730946576.
[I 2024-12-04 20:55:48,928] Trial 1691 finished with value: 0.9864686819220229 and parameters: {'kernel_type': 'Matern', 'length_scale': 5338.55557994895, 'noise_level': 0.00015965658808193066, 'constant_value': 99716.69859718447, 'nu': 1.5}. Best is trial 959 with value: 0.1375110730946576.
[I 2024-12-04 20:55:51,146] Trial 1693 finished with value: 0.14249509491910528 and parameters: {'kernel_type': 'Matern', 'length_scale': 22.7612742121215, 'noise_level': 0.9771438603946376, 'constant_value': 5.024951957412128, 'nu': 1.5}. Best is trial 959 with value: 0.1375110730946576.
[I 2024-12-04 20:55:56,314] Trial 1694 finished with value: 0.9864686819229398 and parameters: {'kernel_type': 'Matern', 'length_scale': 342.84814449946873, 'noise_level': 3.520575901941526e-07, 'constant_value': 0.005802391276573677, 'nu': 0.5}. Best is trial 959 with value: 0.1375110730946576.
[I 2024-12-04 20:55:56,556] Trial 1695 finished with value: 0.1424950736575929 and parameters: {'kernel_type': 'Matern', 'length_scale': 3.5285605813645367, 'noise_level': 0.07237355003188198, 'constant_value': 245.12025723863144, 'nu': 1.5}. Best is trial 959 with value: 0.1375110730946576.
[I 2024-12-04 20:56:04,101] Trial 1698 finished with value: 0.14249514803363864 and parameters: {'kernel_type': 'Matern', 'length_scale': 1.7202225981611572, 'noise_level': 0.002320015174923252, 'constant_value': 56.834026410540176, 'nu': 1.5}. Best is trial 959 with value: 0.1375110730946576.
[I 2024-12-04 20:56:05,339] Trial 1697 finished with value: 0.9864686819060056 and parameters: {'kernel_type': 'Matern', 'length_scale': 409.3304725878409, 'noise_level': 0.013602692624066942, 'constant_value': 0.7476878639819877, 'nu': 1.5}. Best is trial 959 with value: 0.1375110730946576.
[I 2024-12-04 20:56:07,141] Trial 1696 finished with value: 0.14249511708549428 and parameters: {'kernel_type': 'Matern', 'length_scale': 221.5865647839693, 'noise_level': 0.6285225592200305, 'constant_value': 0.0006501322790605646, 'nu': 1.5}. Best is trial 959 with value: 0.1375110730946576.
[I 2024-12-04 20:56:09,885] Trial 1699 finished with value: 0.1972000091806765 and parameters: {'kernel_type': 'Matern', 'length_scale': 6.1649782706224165, 'noise_level': 0.0005732754742995613, 'constant_value': 11985.326947470621, 'nu': 0.5}. Best is trial 959 with value: 0.1375110730946576.
[I 2024-12-04 20:56:14,259] Trial 1700 finished with value: 0.1424950634918884 and parameters: {'kernel_type': 'Matern', 'length_scale': 367.15246022398134, 'noise_level': 0.9010614989917114, 'constant_value': 4.079877188857765, 'nu': 1.5}. Best is trial 959 with value: 0.1375110730946576.
[I 2024-12-04 20:56:15,593] Trial 1701 finished with value: 0.9864686819007056 and parameters: {'kernel_type': 'Matern', 'length_scale': 0.00010145707405913864, 'noise_level': 3.1585831519098083e-10, 'constant_value': 4.698026565122794e-06, 'nu': 2.5}. Best is trial 959 with value: 0.1375110730946576.
[I 2024-12-04 20:56:16,620] Trial 1702 finished with value: 0.14771053541292412 and parameters: {'kernel_type': 'RBF', 'length_scale': 63.70044637113854, 'noise_level': 0.029460463553720458, 'constant_value': 1.1435996648106914, 'nu': 1.5}. Best is trial 959 with value: 0.1375110730946576.
[I 2024-12-04 20:56:23,331] Trial 1704 finished with value: 0.142495090300209 and parameters: {'kernel_type': 'Matern', 'length_scale': 78.96075966404025, 'noise_level': 0.03110155244353096, 'constant_value': 44.88986708461196, 'nu': 1.5}. Best is trial 959 with value: 0.1375110730946576.
[I 2024-12-04 20:56:27,328] Trial 1703 finished with value: 0.14249559158006267 and parameters: {'kernel_type': 'Matern', 'length_scale': 178.8373997516299, 'noise_level': 0.005321980529248153, 'constant_value': 318.3138182915414, 'nu': 1.5}. Best is trial 959 with value: 0.1375110730946576.
[I 2024-12-04 20:56:27,752] Trial 1705 finished with value: 0.14249499283967726 and parameters: {'kernel_type': 'Matern', 'length_scale': 0.22463728737288868, 'noise_level': 0.012221234205335808, 'constant_value': 0.1739194243242867, 'nu': 1.5}. Best is trial 959 with value: 0.1375110730946576.
[I 2024-12-04 20:56:31,483] Trial 1706 finished with value: 0.14249505753576616 and parameters: {'kernel_type': 'Matern', 'length_scale': 2.1506628395625333, 'noise_level': 0.11452664352734185, 'constant_value': 83.0191783071657, 'nu': 1.5}. Best is trial 959 with value: 0.1375110730946576.
[I 2024-12-04 20:56:33,662] Trial 1708 finished with value: 0.14249484280720778 and parameters: {'kernel_type': 'Matern', 'length_scale': 530.8436752693788, 'noise_level': 0.16837050402844753, 'constant_value': 1074.6685468568658, 'nu': 1.5}. Best is trial 959 with value: 0.1375110730946576.
[I 2024-12-04 20:56:37,973] Trial 1707 finished with value: 0.14249505139210844 and parameters: {'kernel_type': 'Matern', 'length_scale': 0.21664943140724768, 'noise_level': 0.8179382349056792, 'constant_value': 204.05479405070258, 'nu': 1.5}. Best is trial 959 with value: 0.1375110730946576.
[I 2024-12-04 20:56:40,756] Trial 1709 finished with value: 0.14249517315911597 and parameters: {'kernel_type': 'Matern', 'length_scale': 1.7285790298095602, 'noise_level': 0.01283825497426075, 'constant_value': 1.0357211582951986, 'nu': 1.5}. Best is trial 959 with value: 0.1375110730946576.
[I 2024-12-04 20:56:41,505] Trial 1710 finished with value: 0.14249492251786142 and parameters: {'kernel_type': 'Matern', 'length_scale': 2.0671518293962143, 'noise_level': 0.654906922177932, 'constant_value': 0.040333952192555284, 'nu': 1.5}. Best is trial 959 with value: 0.1375110730946576.
[I 2024-12-04 20:56:49,527] Trial 1713 finished with value: 0.14771049767451516 and parameters: {'kernel_type': 'RBF', 'length_scale': 89.81278404623964, 'noise_level': 0.9267888124958339, 'constant_value': 0.7525808315212974, 'nu': 1.5}. Best is trial 959 with value: 0.1375110730946576.
[I 2024-12-04 20:56:49,905] Trial 1712 finished with value: 0.14249506266705014 and parameters: {'kernel_type': 'Matern', 'length_scale': 0.22869262689894285, 'noise_level': 0.03391659287733026, 'constant_value': 8.030517312348376, 'nu': 1.5}. Best is trial 959 with value: 0.1375110730946576.
[I 2024-12-04 20:56:50,780] Trial 1711 finished with value: 0.14249505256886286 and parameters: {'kernel_type': 'Matern', 'length_scale': 773.8485691667605, 'noise_level': 0.9600855338461602, 'constant_value': 888.9425858970927, 'nu': 1.5}. Best is trial 959 with value: 0.1375110730946576.
[I 2024-12-04 20:56:53,673] Trial 1714 finished with value: 0.986468681930689 and parameters: {'kernel_type': 'Matern', 'length_scale': 0.0034088476973971197, 'noise_level': 0.00013081725220105017, 'constant_value': 2.7579763633833, 'nu': 1.5}. Best is trial 959 with value: 0.1375110730946576.
[I 2024-12-04 20:56:57,719] Trial 1715 finished with value: 0.1424950105683179 and parameters: {'kernel_type': 'Matern', 'length_scale': 11.558676869850796, 'noise_level': 0.028297564191970152, 'constant_value': 2.1500822320494155, 'nu': 1.5}. Best is trial 959 with value: 0.1375110730946576.
[I 2024-12-04 20:56:58,597] Trial 1716 finished with value: 0.14469885970189753 and parameters: {'kernel_type': 'Matern', 'length_scale': 0.6163794314109384, 'noise_level': 0.011568221617865559, 'constant_value': 91.46984972012467, 'nu': 2.5}. Best is trial 959 with value: 0.1375110730946576.
[I 2024-12-04 20:57:02,734] Trial 1717 finished with value: 0.9864686819206512 and parameters: {'kernel_type': 'Matern', 'length_scale': 1329.5978235368937, 'noise_level': 0.03440788114952192, 'constant_value': 2.0840346871272675, 'nu': 1.5}. Best is trial 959 with value: 0.1375110730946576.
[I 2024-12-04 20:57:06,141] Trial 1718 finished with value: 0.14249506388055042 and parameters: {'kernel_type': 'Matern', 'length_scale': 4.088944640334639, 'noise_level': 0.7186856484800228, 'constant_value': 28.6718532405319, 'nu': 1.5}. Best is trial 959 with value: 0.1375110730946576.
[I 2024-12-04 20:57:06,733] Trial 1719 finished with value: 0.1424950631993719 and parameters: {'kernel_type': 'Matern', 'length_scale': 5.4251488751106205, 'noise_level': 0.0014308204702407389, 'constant_value': 25.842022229992967, 'nu': 1.5}. Best is trial 959 with value: 0.1375110730946576.
[I 2024-12-04 20:57:10,794] Trial 1720 finished with value: 0.14249520448819394 and parameters: {'kernel_type': 'Matern', 'length_scale': 0.5374775021986895, 'noise_level': 0.009603355950516817, 'constant_value': 1916.1497472953854, 'nu': 1.5}. Best is trial 959 with value: 0.1375110730946576.
[I 2024-12-04 20:57:13,957] Trial 1721 finished with value: 0.19720001410932025 and parameters: {'kernel_type': 'Matern', 'length_scale': 0.24844259414224845, 'noise_level': 0.011636903648331445, 'constant_value': 0.08253905528221935, 'nu': 0.5}. Best is trial 959 with value: 0.1375110730946576.
[I 2024-12-04 20:57:16,489] Trial 1722 finished with value: 0.9864686819838987 and parameters: {'kernel_type': 'Matern', 'length_scale': 3384.68422755393, 'noise_level': 0.0028433154030096173, 'constant_value': 0.06759549549159033, 'nu': 0.5}. Best is trial 959 with value: 0.1375110730946576.
[I 2024-12-04 20:57:18,420] Trial 1723 finished with value: 0.14249506858933558 and parameters: {'kernel_type': 'Matern', 'length_scale': 3.486140414764945, 'noise_level': 0.6897022497901344, 'constant_value': 0.0008350336421435457, 'nu': 1.5}. Best is trial 959 with value: 0.1375110730946576.
[I 2024-12-04 20:57:22,802] Trial 1724 finished with value: 0.14249532123181477 and parameters: {'kernel_type': 'Matern', 'length_scale': 35.40924065089562, 'noise_level': 0.02231689114550242, 'constant_value': 292.98403517843116, 'nu': 1.5}. Best is trial 959 with value: 0.1375110730946576.
[I 2024-12-04 20:57:24,466] Trial 1726 finished with value: 0.9864686818986046 and parameters: {'kernel_type': 'Matern', 'length_scale': 0.007592917650879263, 'noise_level': 0.8728754687023604, 'constant_value': 39988.46711793099, 'nu': 1.5}. Best is trial 959 with value: 0.1375110730946576.
[I 2024-12-04 20:57:27,925] Trial 1725 finished with value: 0.14249493421241527 and parameters: {'kernel_type': 'Matern', 'length_scale': 56.44417143847835, 'noise_level': 0.9133132872200482, 'constant_value': 0.3251461573751108, 'nu': 1.5}. Best is trial 959 with value: 0.1375110730946576.
[I 2024-12-04 20:57:32,911] Trial 1727 finished with value: 0.14249506515747737 and parameters: {'kernel_type': 'Matern', 'length_scale': 8.943296584719421, 'noise_level': 0.9627200248530338, 'constant_value': 75.72909871128466, 'nu': 1.5}. Best is trial 959 with value: 0.1375110730946576.
[I 2024-12-04 20:57:32,913] Trial 1728 finished with value: 0.1424950561559743 and parameters: {'kernel_type': 'Matern', 'length_scale': 1.1688702334677172, 'noise_level': 0.8449455557436598, 'constant_value': 0.027302220279189143, 'nu': 1.5}. Best is trial 959 with value: 0.1375110730946576.
[I 2024-12-04 20:57:37,843] Trial 1729 finished with value: 0.9864686819372327 and parameters: {'kernel_type': 'Matern', 'length_scale': 172.92051612552427, 'noise_level': 0.00901491811766393, 'constant_value': 5.662317771813162, 'nu': 1.5}. Best is trial 959 with value: 0.1375110730946576.
[I 2024-12-04 20:57:39,402] Trial 1731 finished with value: 0.1972000377990844 and parameters: {'kernel_type': 'Matern', 'length_scale': 2.6656693481792746, 'noise_level': 0.03883702971516443, 'constant_value': 1.4366118672084474, 'nu': 0.5}. Best is trial 959 with value: 0.1375110730946576.
[I 2024-12-04 20:57:42,171] Trial 1730 finished with value: 0.19720006136361085 and parameters: {'kernel_type': 'Matern', 'length_scale': 0.14946282871187305, 'noise_level': 0.011318578932750173, 'constant_value': 225.5534326905637, 'nu': 0.5}. Best is trial 959 with value: 0.1375110730946576.
[I 2024-12-04 20:57:45,890] Trial 1733 finished with value: 0.1972000351311988 and parameters: {'kernel_type': 'Matern', 'length_scale': 88.98864743838803, 'noise_level': 0.7365539738000297, 'constant_value': 0.22802333567647223, 'nu': 0.5}. Best is trial 959 with value: 0.1375110730946576.
[I 2024-12-04 20:57:46,323] Trial 1732 finished with value: 0.1424950624423034 and parameters: {'kernel_type': 'Matern', 'length_scale': 8.567728902580154, 'noise_level': 0.021398663340368974, 'constant_value': 0.8144667973638051, 'nu': 1.5}. Best is trial 959 with value: 0.1375110730946576.
[I 2024-12-04 20:57:51,905] Trial 1735 finished with value: 0.9864686821157164 and parameters: {'kernel_type': 'Matern', 'length_scale': 0.008718193410676499, 'noise_level': 0.010810160296856743, 'constant_value': 9.767147891845353, 'nu': 1.5}. Best is trial 959 with value: 0.1375110730946576.
[I 2024-12-04 20:57:51,983] Trial 1734 finished with value: 0.1424950573316418 and parameters: {'kernel_type': 'Matern', 'length_scale': 135.64760167584896, 'noise_level': 0.9343729510998158, 'constant_value': 185.07234548286962, 'nu': 1.5}. Best is trial 959 with value: 0.1375110730946576.
[I 2024-12-04 20:57:53,274] Trial 1736 finished with value: 0.9864686814228878 and parameters: {'kernel_type': 'Matern', 'length_scale': 0.052097026164005245, 'noise_level': 0.054168400864546606, 'constant_value': 29.743971313397843, 'nu': 1.5}. Best is trial 959 with value: 0.1375110730946576.
[I 2024-12-04 20:57:59,124] Trial 1738 finished with value: 0.14249506257973443 and parameters: {'kernel_type': 'Matern', 'length_scale': 25.210234291782314, 'noise_level': 0.012892328756354293, 'constant_value': 6122.936359316643, 'nu': 1.5}. Best is trial 959 with value: 0.1375110730946576.
[I 2024-12-04 20:58:00,839] Trial 1737 finished with value: 0.14249503868874816 and parameters: {'kernel_type': 'Matern', 'length_scale': 851.1543010033587, 'noise_level': 0.9220862750274387, 'constant_value': 32.22497143233768, 'nu': 1.5}. Best is trial 959 with value: 0.1375110730946576.
[I 2024-12-04 20:58:00,947] Trial 1739 finished with value: 0.9864686819150323 and parameters: {'kernel_type': 'Matern', 'length_scale': 97.93007320223336, 'noise_level': 0.02711988733916772, 'constant_value': 0.11166525781169517, 'nu': 1.5}. Best is trial 959 with value: 0.1375110730946576.
[I 2024-12-04 20:58:05,788] Trial 1740 finished with value: 0.1424950473554351 and parameters: {'kernel_type': 'Matern', 'length_scale': 46.257929178486236, 'noise_level': 0.05368220978979431, 'constant_value': 47.64565950674124, 'nu': 1.5}. Best is trial 959 with value: 0.1375110730946576.
[I 2024-12-04 20:58:05,877] Trial 1741 finished with value: 0.9982171086389511 and parameters: {'kernel_type': 'Matern', 'length_scale': 12901.502956136948, 'noise_level': 0.0033339379731877295, 'constant_value': 3.208537979969578e-06, 'nu': 1.5}. Best is trial 959 with value: 0.1375110730946576.
[I 2024-12-04 20:58:08,434] Trial 1742 finished with value: 0.1424950684765798 and parameters: {'kernel_type': 'Matern', 'length_scale': 5.151355324551113, 'noise_level': 0.0005007823626945283, 'constant_value': 64.01133092582342, 'nu': 1.5}. Best is trial 959 with value: 0.1375110730946576.
[I 2024-12-04 20:58:10,695] Trial 1744 finished with value: 0.9864654640027188 and parameters: {'kernel_type': 'Matern', 'length_scale': 0.11828747857412997, 'noise_level': 0.03162829630357222, 'constant_value': 4798.397878043629, 'nu': 1.5}. Best is trial 959 with value: 0.1375110730946576.
[I 2024-12-04 20:58:11,453] Trial 1743 finished with value: 0.9982171094898852 and parameters: {'kernel_type': 'RBF', 'length_scale': 74609.1269503375, 'noise_level': 0.0031801142233887905, 'constant_value': 2.489307975052901e-05, 'nu': 1.5}. Best is trial 959 with value: 0.1375110730946576.
[I 2024-12-04 20:58:16,073] Trial 1745 finished with value: 0.14249503933776397 and parameters: {'kernel_type': 'Matern', 'length_scale': 1.3543183336429643, 'noise_level': 0.0034475446251893056, 'constant_value': 78901.45731045304, 'nu': 1.5}. Best is trial 959 with value: 0.1375110730946576.
[I 2024-12-04 20:58:18,646] Trial 1746 finished with value: 0.14249506123965167 and parameters: {'kernel_type': 'Matern', 'length_scale': 0.4551597417936486, 'noise_level': 0.8602691943760373, 'constant_value': 0.6312875711163052, 'nu': 1.5}. Best is trial 959 with value: 0.1375110730946576.
[I 2024-12-04 20:58:20,225] Trial 1747 finished with value: 0.1424953022858481 and parameters: {'kernel_type': 'Matern', 'length_scale': 2.8740834200959378, 'noise_level': 0.08695310081828177, 'constant_value': 339.57041845082995, 'nu': 1.5}. Best is trial 959 with value: 0.1375110730946576.
[I 2024-12-04 20:58:25,809] Trial 1750 finished with value: 0.14249506460393177 and parameters: {'kernel_type': 'Matern', 'length_scale': 1416.0404888592625, 'noise_level': 0.03380889253426154, 'constant_value': 5089.911830233278, 'nu': 1.5}. Best is trial 959 with value: 0.1375110730946576.
[I 2024-12-04 20:58:25,906] Trial 1749 finished with value: 0.14249501794400482 and parameters: {'kernel_type': 'Matern', 'length_scale': 18.167087300146356, 'noise_level': 0.031372735235841456, 'constant_value': 180.37957668723064, 'nu': 1.5}. Best is trial 959 with value: 0.1375110730946576.
