[I 2024-12-04 12:49:06,506] Trial 958 finished with value: 0.4234265182506648 and parameters: {'n_estimators': 193, 'learning_rate': 0.02061152465207181, 'max_depth': 4, 'min_samples_split': 7, 'min_samples_leaf': 1, 'subsample': 0.8085869729398296, 'max_features': None}. Best is trial 784 with value: 0.199214954455861.
[I 2024-12-04 12:49:07,295] Trial 935 finished with value: 0.23365248057721602 and parameters: {'n_estimators': 1213, 'learning_rate': 0.07593350332931975, 'max_depth': 10, 'min_samples_split': 18, 'min_samples_leaf': 2, 'subsample': 0.6854462045876869, 'max_features': 'sqrt'}. Best is trial 784 with value: 0.199214954455861.
[I 2024-12-04 12:49:08,445] Trial 953 finished with value: 0.5990607475914608 and parameters: {'n_estimators': 386, 'learning_rate': 0.07543062962246652, 'max_depth': 11, 'min_samples_split': 9, 'min_samples_leaf': 10, 'subsample': 0.6330786033444052, 'max_features': 'log2'}. Best is trial 784 with value: 0.199214954455861.
[I 2024-12-04 12:49:08,813] Trial 938 finished with value: 0.24633942482402515 and parameters: {'n_estimators': 951, 'learning_rate': 0.09425044734804193, 'max_depth': 12, 'min_samples_split': 18, 'min_samples_leaf': 3, 'subsample': 0.7043728571056355, 'max_features': 'sqrt'}. Best is trial 784 with value: 0.199214954455861.
[I 2024-12-04 12:49:10,697] Trial 933 finished with value: 0.44533402442290543 and parameters: {'n_estimators': 1401, 'learning_rate': 0.07087198788249467, 'max_depth': 7, 'min_samples_split': 6, 'min_samples_leaf': 10, 'subsample': 0.9378245162030481, 'max_features': 'log2'}. Best is trial 784 with value: 0.199214954455861.
[I 2024-12-04 12:49:11,719] Trial 944 finished with value: 0.40527784513847853 and parameters: {'n_estimators': 471, 'learning_rate': 0.010879730390222405, 'max_depth': 9, 'min_samples_split': 9, 'min_samples_leaf': 10, 'subsample': 0.7948682211684824, 'max_features': None}. Best is trial 784 with value: 0.199214954455861.
[I 2024-12-04 12:49:13,227] Trial 962 finished with value: 0.6400265276899869 and parameters: {'n_estimators': 172, 'learning_rate': 0.011531346437596242, 'max_depth': 11, 'min_samples_split': 17, 'min_samples_leaf': 5, 'subsample': 0.6554150412411108, 'max_features': 'sqrt'}. Best is trial 784 with value: 0.199214954455861.
[I 2024-12-04 12:49:14,918] Trial 936 finished with value: 0.21948419931773358 and parameters: {'n_estimators': 1145, 'learning_rate': 0.08638774386133512, 'max_depth': 9, 'min_samples_split': 18, 'min_samples_leaf': 1, 'subsample': 0.6330290414748613, 'max_features': 'sqrt'}. Best is trial 784 with value: 0.199214954455861.
[I 2024-12-04 12:49:16,690] Trial 934 finished with value: 0.26572671204275855 and parameters: {'n_estimators': 1439, 'learning_rate': 0.09047871353039051, 'max_depth': 9, 'min_samples_split': 19, 'min_samples_leaf': 4, 'subsample': 0.6210963580952498, 'max_features': 'sqrt'}. Best is trial 784 with value: 0.199214954455861.
[I 2024-12-04 12:49:20,646] Trial 968 finished with value: 0.6801871585444071 and parameters: {'n_estimators': 111, 'learning_rate': 0.020011420864757646, 'max_depth': 6, 'min_samples_split': 16, 'min_samples_leaf': 5, 'subsample': 0.7868888964617498, 'max_features': 'sqrt'}. Best is trial 784 with value: 0.199214954455861.
[I 2024-12-04 12:49:21,167] Trial 937 finished with value: 0.22212676540199747 and parameters: {'n_estimators': 1361, 'learning_rate': 0.09858157997294172, 'max_depth': 11, 'min_samples_split': 19, 'min_samples_leaf': 1, 'subsample': 0.6109503311378679, 'max_features': 'sqrt'}. Best is trial 784 with value: 0.199214954455861.
[I 2024-12-04 12:49:23,289] Trial 940 finished with value: 0.24005114224582727 and parameters: {'n_estimators': 1203, 'learning_rate': 0.04966250148973823, 'max_depth': 10, 'min_samples_split': 20, 'min_samples_leaf': 1, 'subsample': 0.6079514116015838, 'max_features': 'sqrt'}. Best is trial 784 with value: 0.199214954455861.
[I 2024-12-04 12:49:28,377] Trial 966 finished with value: 0.39741403627299504 and parameters: {'n_estimators': 347, 'learning_rate': 0.028222263721577417, 'max_depth': 3, 'min_samples_split': 7, 'min_samples_leaf': 4, 'subsample': 0.6018725071934603, 'max_features': None}. Best is trial 784 with value: 0.199214954455861.
[I 2024-12-04 12:49:31,731] Trial 945 finished with value: 0.46485928008813276 and parameters: {'n_estimators': 1034, 'learning_rate': 0.02378096956347357, 'max_depth': 4, 'min_samples_split': 8, 'min_samples_leaf': 10, 'subsample': 0.685707317810208, 'max_features': 'sqrt'}. Best is trial 784 with value: 0.199214954455861.
[I 2024-12-04 12:49:32,778] Trial 941 finished with value: 0.24669272898309266 and parameters: {'n_estimators': 1156, 'learning_rate': 0.04965002636461373, 'max_depth': 12, 'min_samples_split': 20, 'min_samples_leaf': 2, 'subsample': 0.6021464857670213, 'max_features': 'sqrt'}. Best is trial 784 with value: 0.199214954455861.
[I 2024-12-04 12:49:35,687] Trial 955 finished with value: 0.37810447289328064 and parameters: {'n_estimators': 712, 'learning_rate': 0.010379506098572824, 'max_depth': 8, 'min_samples_split': 9, 'min_samples_leaf': 8, 'subsample': 0.9299570273762419, 'max_features': None}. Best is trial 784 with value: 0.199214954455861.
[I 2024-12-04 12:49:36,709] Trial 973 finished with value: 0.7671968481711544 and parameters: {'n_estimators': 252, 'learning_rate': 0.019736474743142197, 'max_depth': 4, 'min_samples_split': 16, 'min_samples_leaf': 5, 'subsample': 0.6181556906335486, 'max_features': 'log2'}. Best is trial 784 with value: 0.199214954455861.
[I 2024-12-04 12:49:37,842] Trial 949 finished with value: 0.22207496954634715 and parameters: {'n_estimators': 1141, 'learning_rate': 0.08631696224764762, 'max_depth': 9, 'min_samples_split': 20, 'min_samples_leaf': 1, 'subsample': 0.6803127974853249, 'max_features': 'sqrt'}. Best is trial 784 with value: 0.199214954455861.
[I 2024-12-04 12:49:38,541] Trial 970 finished with value: 0.44337929436618484 and parameters: {'n_estimators': 302, 'learning_rate': 0.01753898241533484, 'max_depth': 10, 'min_samples_split': 3, 'min_samples_leaf': 4, 'subsample': 0.6145822528404467, 'max_features': 'sqrt'}. Best is trial 784 with value: 0.199214954455861.
[I 2024-12-04 12:49:39,311] Trial 939 finished with value: 0.3774818148129252 and parameters: {'n_estimators': 1432, 'learning_rate': 0.025572758203770307, 'max_depth': 7, 'min_samples_split': 14, 'min_samples_leaf': 10, 'subsample': 0.8339930925456475, 'max_features': None}. Best is trial 784 with value: 0.199214954455861.
[I 2024-12-04 12:49:39,455] Trial 974 finished with value: 0.511207175123046 and parameters: {'n_estimators': 245, 'learning_rate': 0.018651690722270214, 'max_depth': 10, 'min_samples_split': 9, 'min_samples_leaf': 1, 'subsample': 0.8350049892315378, 'max_features': 'log2'}. Best is trial 784 with value: 0.199214954455861.
[I 2024-12-04 12:49:43,099] Trial 942 finished with value: 0.21472439733270773 and parameters: {'n_estimators': 1407, 'learning_rate': 0.09246125717260503, 'max_depth': 9, 'min_samples_split': 20, 'min_samples_leaf': 1, 'subsample': 0.6864841198085463, 'max_features': 'sqrt'}. Best is trial 784 with value: 0.199214954455861.
[I 2024-12-04 12:49:47,448] Trial 948 finished with value: 0.2191168342656973 and parameters: {'n_estimators': 1305, 'learning_rate': 0.09272158744634072, 'max_depth': 10, 'min_samples_split': 18, 'min_samples_leaf': 1, 'subsample': 0.6740159860067808, 'max_features': 'sqrt'}. Best is trial 784 with value: 0.199214954455861.
[I 2024-12-04 12:49:48,847] Trial 960 finished with value: 0.22834745891103353 and parameters: {'n_estimators': 876, 'learning_rate': 0.08147552488481816, 'max_depth': 12, 'min_samples_split': 17, 'min_samples_leaf': 1, 'subsample': 0.7217644224478565, 'max_features': 'sqrt'}. Best is trial 784 with value: 0.199214954455861.
[I 2024-12-04 12:49:50,454] Trial 952 finished with value: 0.21752494195358213 and parameters: {'n_estimators': 1212, 'learning_rate': 0.0953650429475163, 'max_depth': 12, 'min_samples_split': 19, 'min_samples_leaf': 1, 'subsample': 0.6680395727102091, 'max_features': 'sqrt'}. Best is trial 784 with value: 0.199214954455861.
[I 2024-12-04 12:49:57,247] Trial 950 finished with value: 0.23277778804821184 and parameters: {'n_estimators': 1380, 'learning_rate': 0.0768700815089387, 'max_depth': 8, 'min_samples_split': 19, 'min_samples_leaf': 1, 'subsample': 0.60136819818204, 'max_features': 'sqrt'}. Best is trial 784 with value: 0.199214954455861.
[I 2024-12-04 12:49:59,340] Trial 963 finished with value: 0.2180035576168498 and parameters: {'n_estimators': 1050, 'learning_rate': 0.09893133709797683, 'max_depth': 12, 'min_samples_split': 18, 'min_samples_leaf': 1, 'subsample': 0.736181250729815, 'max_features': 'sqrt'}. Best is trial 784 with value: 0.199214954455861.
[I 2024-12-04 12:49:59,375] Trial 954 finished with value: 0.22844474330331027 and parameters: {'n_estimators': 1242, 'learning_rate': 0.0684785516939472, 'max_depth': 10, 'min_samples_split': 17, 'min_samples_leaf': 1, 'subsample': 0.6694229168027027, 'max_features': 'sqrt'}. Best is trial 784 with value: 0.199214954455861.
[I 2024-12-04 12:50:00,305] Trial 951 finished with value: 0.44846470704366104 and parameters: {'n_estimators': 1462, 'learning_rate': 0.021684742010624813, 'max_depth': 3, 'min_samples_split': 3, 'min_samples_leaf': 4, 'subsample': 0.7487946323261209, 'max_features': 'log2'}. Best is trial 784 with value: 0.199214954455861.
[I 2024-12-04 12:50:01,755] Trial 957 finished with value: 0.23951954176363238 and parameters: {'n_estimators': 1213, 'learning_rate': 0.09889570070032488, 'max_depth': 11, 'min_samples_split': 19, 'min_samples_leaf': 2, 'subsample': 0.6026953525985549, 'max_features': 'sqrt'}. Best is trial 784 with value: 0.199214954455861.
[I 2024-12-04 12:50:04,625] Trial 967 finished with value: 0.2127588874056484 and parameters: {'n_estimators': 943, 'learning_rate': 0.0817968400831192, 'max_depth': 12, 'min_samples_split': 19, 'min_samples_leaf': 1, 'subsample': 0.6543354176188978, 'max_features': 'sqrt'}. Best is trial 784 with value: 0.199214954455861.
[I 2024-12-04 12:50:04,955] Trial 961 finished with value: 0.2520632719610399 and parameters: {'n_estimators': 1139, 'learning_rate': 0.06174606560885371, 'max_depth': 10, 'min_samples_split': 20, 'min_samples_leaf': 3, 'subsample': 0.6783419703676142, 'max_features': 'sqrt'}. Best is trial 784 with value: 0.199214954455861.
[I 2024-12-04 12:50:10,050] Trial 964 finished with value: 0.21571415182509013 and parameters: {'n_estimators': 1167, 'learning_rate': 0.09934820096574443, 'max_depth': 12, 'min_samples_split': 20, 'min_samples_leaf': 1, 'subsample': 0.7058809266122749, 'max_features': 'sqrt'}. Best is trial 784 with value: 0.199214954455861.
[I 2024-12-04 12:50:11,393] Trial 956 finished with value: 0.3480866669974366 and parameters: {'n_estimators': 1177, 'learning_rate': 0.03207412407397576, 'max_depth': 10, 'min_samples_split': 3, 'min_samples_leaf': 7, 'subsample': 0.9720493675655874, 'max_features': None}. Best is trial 784 with value: 0.199214954455861.
[I 2024-12-04 12:50:11,676] Trial 959 finished with value: 0.23314624658679997 and parameters: {'n_estimators': 1311, 'learning_rate': 0.09143499662739545, 'max_depth': 10, 'min_samples_split': 18, 'min_samples_leaf': 2, 'subsample': 0.6082532268844068, 'max_features': 'sqrt'}. Best is trial 784 with value: 0.199214954455861.
[I 2024-12-04 12:50:12,154] Trial 947 finished with value: 0.25747186692551216 and parameters: {'n_estimators': 1441, 'learning_rate': 0.06388022287737724, 'max_depth': 12, 'min_samples_split': 16, 'min_samples_leaf': 1, 'subsample': 0.6964496893504847, 'max_features': None}. Best is trial 784 with value: 0.199214954455861.
[I 2024-12-04 12:50:12,158] Trial 975 finished with value: 0.23041618172163914 and parameters: {'n_estimators': 822, 'learning_rate': 0.08636473373957683, 'max_depth': 12, 'min_samples_split': 19, 'min_samples_leaf': 2, 'subsample': 0.7164225389295688, 'max_features': 'sqrt'}. Best is trial 784 with value: 0.199214954455861.
[I 2024-12-04 12:50:16,130] Trial 969 finished with value: 0.21864191219845228 and parameters: {'n_estimators': 1078, 'learning_rate': 0.08518641382419169, 'max_depth': 12, 'min_samples_split': 20, 'min_samples_leaf': 1, 'subsample': 0.7896843845013777, 'max_features': 'sqrt'}. Best is trial 784 with value: 0.199214954455861.
[I 2024-12-04 12:50:18,400] Trial 971 finished with value: 0.26647886720140707 and parameters: {'n_estimators': 1093, 'learning_rate': 0.07929523485074111, 'max_depth': 10, 'min_samples_split': 20, 'min_samples_leaf': 1, 'subsample': 0.6156890492888079, 'max_features': 'log2'}. Best is trial 784 with value: 0.199214954455861.
[I 2024-12-04 12:50:20,413] Trial 965 finished with value: 0.21993169288499256 and parameters: {'n_estimators': 1288, 'learning_rate': 0.04917771062390847, 'max_depth': 12, 'min_samples_split': 16, 'min_samples_leaf': 1, 'subsample': 0.7285195372831639, 'max_features': 'sqrt'}. Best is trial 784 with value: 0.199214954455861.
[I 2024-12-04 12:50:22,113] Trial 997 finished with value: 0.40399923686335093 and parameters: {'n_estimators': 146, 'learning_rate': 0.042042806654212075, 'max_depth': 9, 'min_samples_split': 19, 'min_samples_leaf': 3, 'subsample': 0.7480505034050801, 'max_features': 'sqrt'}. Best is trial 784 with value: 0.199214954455861.
[I 2024-12-04 12:50:24,093] Trial 978 finished with value: 0.2370778279048698 and parameters: {'n_estimators': 947, 'learning_rate': 0.09687815448292855, 'max_depth': 12, 'min_samples_split': 19, 'min_samples_leaf': 2, 'subsample': 0.6839543887434109, 'max_features': 'sqrt'}. Best is trial 784 with value: 0.199214954455861.
[I 2024-12-04 12:50:24,988] Trial 980 finished with value: 0.24075504336580325 and parameters: {'n_estimators': 834, 'learning_rate': 0.0970454707556947, 'max_depth': 11, 'min_samples_split': 19, 'min_samples_leaf': 1, 'subsample': 0.6481188812663674, 'max_features': 'sqrt'}. Best is trial 784 with value: 0.199214954455861.
[I 2024-12-04 12:50:25,334] Trial 976 finished with value: 0.28344092247479397 and parameters: {'n_estimators': 853, 'learning_rate': 0.08774067320997467, 'max_depth': 12, 'min_samples_split': 16, 'min_samples_leaf': 4, 'subsample': 0.7363795160529729, 'max_features': None}. Best is trial 784 with value: 0.199214954455861.
[I 2024-12-04 12:50:27,279] Trial 979 finished with value: 0.2547184255721313 and parameters: {'n_estimators': 953, 'learning_rate': 0.061759224291397144, 'max_depth': 11, 'min_samples_split': 16, 'min_samples_leaf': 4, 'subsample': 0.8329095585798657, 'max_features': 'sqrt'}. Best is trial 784 with value: 0.199214954455861.
[I 2024-12-04 12:50:36,689] Trial 984 finished with value: 0.23514029312419701 and parameters: {'n_estimators': 836, 'learning_rate': 0.09186375579621388, 'max_depth': 12, 'min_samples_split': 20, 'min_samples_leaf': 1, 'subsample': 0.7199529727315352, 'max_features': 'sqrt'}. Best is trial 784 with value: 0.199214954455861.
[I 2024-12-04 12:50:37,234] Trial 987 finished with value: 0.3489970716206073 and parameters: {'n_estimators': 801, 'learning_rate': 0.014929733465007441, 'max_depth': 7, 'min_samples_split': 20, 'min_samples_leaf': 3, 'subsample': 0.8834198806716774, 'max_features': 'sqrt'}. Best is trial 784 with value: 0.199214954455861.
[I 2024-12-04 12:50:38,539] Trial 972 finished with value: 0.23304336785333984 and parameters: {'n_estimators': 1407, 'learning_rate': 0.06776436969485726, 'max_depth': 10, 'min_samples_split': 18, 'min_samples_leaf': 1, 'subsample': 0.6131547411566245, 'max_features': 'sqrt'}. Best is trial 784 with value: 0.199214954455861.
[I 2024-12-04 12:50:38,617] Trial 977 finished with value: 0.23243713805118885 and parameters: {'n_estimators': 1231, 'learning_rate': 0.04724951266911215, 'max_depth': 12, 'min_samples_split': 16, 'min_samples_leaf': 1, 'subsample': 0.6313386535015936, 'max_features': 'sqrt'}. Best is trial 784 with value: 0.199214954455861.
[I 2024-12-04 12:50:40,382] Trial 981 finished with value: 0.6410698391802242 and parameters: {'n_estimators': 1107, 'learning_rate': 0.017330578836007193, 'max_depth': 3, 'min_samples_split': 18, 'min_samples_leaf': 8, 'subsample': 0.6596840512580093, 'max_features': 'log2'}. Best is trial 784 with value: 0.199214954455861.
[I 2024-12-04 12:50:42,440] Trial 982 finished with value: 0.2544207676760179 and parameters: {'n_estimators': 1081, 'learning_rate': 0.08278441835085329, 'max_depth': 9, 'min_samples_split': 12, 'min_samples_leaf': 4, 'subsample': 0.806601712804034, 'max_features': 'sqrt'}. Best is trial 784 with value: 0.199214954455861.
[I 2024-12-04 12:50:43,155] Trial 1004 finished with value: 0.6609325246429266 and parameters: {'n_estimators': 226, 'learning_rate': 0.01300328300414651, 'max_depth': 7, 'min_samples_split': 3, 'min_samples_leaf': 8, 'subsample': 0.8535376996215772, 'max_features': 'sqrt'}. Best is trial 784 with value: 0.199214954455861.
[I 2024-12-04 12:50:50,779] Trial 990 finished with value: 0.23472052542660457 and parameters: {'n_estimators': 932, 'learning_rate': 0.09979396785243705, 'max_depth': 12, 'min_samples_split': 15, 'min_samples_leaf': 2, 'subsample': 0.7970711571975161, 'max_features': 'sqrt'}. Best is trial 784 with value: 0.199214954455861.
[I 2024-12-04 12:50:55,823] Trial 994 finished with value: 0.25205691321399726 and parameters: {'n_estimators': 856, 'learning_rate': 0.06446598836132689, 'max_depth': 10, 'min_samples_split': 18, 'min_samples_leaf': 1, 'subsample': 0.7071943482909647, 'max_features': 'sqrt'}. Best is trial 784 with value: 0.199214954455861.
[I 2024-12-04 12:50:59,516] Trial 988 finished with value: 0.22437320539105124 and parameters: {'n_estimators': 1164, 'learning_rate': 0.06426288667563318, 'max_depth': 12, 'min_samples_split': 18, 'min_samples_leaf': 1, 'subsample': 0.6756449896003011, 'max_features': 'sqrt'}. Best is trial 784 with value: 0.199214954455861.
[I 2024-12-04 12:51:03,710] Trial 985 finished with value: 0.2141716741107525 and parameters: {'n_estimators': 1308, 'learning_rate': 0.08905070241113629, 'max_depth': 10, 'min_samples_split': 17, 'min_samples_leaf': 1, 'subsample': 0.6906510576096067, 'max_features': 'sqrt'}. Best is trial 784 with value: 0.199214954455861.
[I 2024-12-04 12:51:04,632] Trial 986 finished with value: 0.21521171134710335 and parameters: {'n_estimators': 1292, 'learning_rate': 0.06427775820435808, 'max_depth': 12, 'min_samples_split': 17, 'min_samples_leaf': 1, 'subsample': 0.6078080948110727, 'max_features': 'sqrt'}. Best is trial 784 with value: 0.199214954455861.
[I 2024-12-04 12:51:05,882] Trial 989 finished with value: 0.3801175028265046 and parameters: {'n_estimators': 1241, 'learning_rate': 0.060649530183510915, 'max_depth': 12, 'min_samples_split': 20, 'min_samples_leaf': 9, 'subsample': 0.9599848410417242, 'max_features': 'sqrt'}. Best is trial 784 with value: 0.199214954455861.
[I 2024-12-04 12:51:08,730] Trial 983 finished with value: 0.23115173901756117 and parameters: {'n_estimators': 1462, 'learning_rate': 0.06987529567713406, 'max_depth': 10, 'min_samples_split': 20, 'min_samples_leaf': 2, 'subsample': 0.6767550265034963, 'max_features': 'sqrt'}. Best is trial 784 with value: 0.199214954455861.
[I 2024-12-04 12:51:11,794] Trial 995 finished with value: 0.2198157825802105 and parameters: {'n_estimators': 1011, 'learning_rate': 0.09699097648854055, 'max_depth': 12, 'min_samples_split': 19, 'min_samples_leaf': 1, 'subsample': 0.6850482855287411, 'max_features': 'sqrt'}. Best is trial 784 with value: 0.199214954455861.
[I 2024-12-04 12:51:13,058] Trial 993 finished with value: 0.2144557397783053 and parameters: {'n_estimators': 1131, 'learning_rate': 0.09441598737620555, 'max_depth': 12, 'min_samples_split': 15, 'min_samples_leaf': 1, 'subsample': 0.6211173554262378, 'max_features': 'sqrt'}. Best is trial 784 with value: 0.199214954455861.
[I 2024-12-04 12:51:17,649] Trial 992 finished with value: 0.20836634581904062 and parameters: {'n_estimators': 1293, 'learning_rate': 0.09896180698997718, 'max_depth': 11, 'min_samples_split': 20, 'min_samples_leaf': 1, 'subsample': 0.6457365993308765, 'max_features': 'sqrt'}. Best is trial 784 with value: 0.199214954455861.
[I 2024-12-04 12:51:19,624] Trial 1021 finished with value: 0.8087233764765595 and parameters: {'n_estimators': 257, 'learning_rate': 0.019756937253280954, 'max_depth': 3, 'min_samples_split': 15, 'min_samples_leaf': 6, 'subsample': 0.7971013143457659, 'max_features': 'log2'}. Best is trial 784 with value: 0.199214954455861.
[I 2024-12-04 12:51:19,634] Trial 1003 finished with value: 0.23402077854248537 and parameters: {'n_estimators': 932, 'learning_rate': 0.0616626558458703, 'max_depth': 10, 'min_samples_split': 16, 'min_samples_leaf': 1, 'subsample': 0.7716510972349491, 'max_features': 'sqrt'}. Best is trial 784 with value: 0.199214954455861.
[I 2024-12-04 12:51:21,425] Trial 991 finished with value: 0.2582066649651012 and parameters: {'n_estimators': 1432, 'learning_rate': 0.09714443906636186, 'max_depth': 10, 'min_samples_split': 20, 'min_samples_leaf': 4, 'subsample': 0.6581822704721287, 'max_features': 'sqrt'}. Best is trial 784 with value: 0.199214954455861.
[I 2024-12-04 12:51:32,906] Trial 1005 finished with value: 0.2567319418013985 and parameters: {'n_estimators': 1036, 'learning_rate': 0.08755140777093263, 'max_depth': 10, 'min_samples_split': 20, 'min_samples_leaf': 3, 'subsample': 0.6090290792623688, 'max_features': 'sqrt'}. Best is trial 784 with value: 0.199214954455861.
[I 2024-12-04 12:51:36,073] Trial 1031 finished with value: 0.30932462030854563 and parameters: {'n_estimators': 145, 'learning_rate': 0.05963238223111432, 'max_depth': 9, 'min_samples_split': 17, 'min_samples_leaf': 2, 'subsample': 0.6857992737506773, 'max_features': None}. Best is trial 784 with value: 0.199214954455861.
