[I 2024-12-04 15:07:50,509] Trial 1276 finished with value: 0.4883018234778258 and parameters: {'kernel_type': 'Matern', 'length_scale': 885.0825955275457, 'noise_level': 0.6773028702697919, 'constant_value': 50.165132513320394, 'nu': 0.5}. Best is trial 386 with value: 0.4872991004520934.
[I 2024-12-04 15:07:53,005] Trial 1286 finished with value: 0.4883034181501599 and parameters: {'kernel_type': 'Matern', 'length_scale': 47130.77017935483, 'noise_level': 0.06585278787373484, 'constant_value': 93280.13824803029, 'nu': 0.5}. Best is trial 386 with value: 0.4872991004520934.
[I 2024-12-04 15:07:53,686] Trial 1279 finished with value: 1.2614547953941473 and parameters: {'kernel_type': 'Matern', 'length_scale': 1106.732963451572, 'noise_level': 0.026159930225193476, 'constant_value': 2781.196832691252, 'nu': 0.5}. Best is trial 386 with value: 0.4872991004520934.
[I 2024-12-04 15:07:53,713] Trial 1283 finished with value: 1.2614438848890874 and parameters: {'kernel_type': 'RBF', 'length_scale': 0.03769633978967697, 'noise_level': 0.3957754485592305, 'constant_value': 0.0002521344313763574, 'nu': 2.5}. Best is trial 386 with value: 0.4872991004520934.
[I 2024-12-04 15:07:54,075] Trial 1273 finished with value: 0.4883034174042257 and parameters: {'kernel_type': 'Matern', 'length_scale': 49716.1888909385, 'noise_level': 0.8517118062010226, 'constant_value': 61.78352821450385, 'nu': 0.5}. Best is trial 386 with value: 0.4872991004520934.
[I 2024-12-04 15:07:54,311] Trial 1277 finished with value: 1.2614547883193536 and parameters: {'kernel_type': 'Matern', 'length_scale': 60466.75428145694, 'noise_level': 0.5684344916622943, 'constant_value': 0.25520248042034427, 'nu': 0.5}. Best is trial 386 with value: 0.4872991004520934.
[I 2024-12-04 15:07:55,418] Trial 1280 finished with value: 0.6255548954006254 and parameters: {'kernel_type': 'RBF', 'length_scale': 1.9864973060628657, 'noise_level': 0.06905016754140259, 'constant_value': 5.25233358764713e-07, 'nu': 2.5}. Best is trial 386 with value: 0.4872991004520934.
[I 2024-12-04 15:07:56,738] Trial 1284 finished with value: 0.48830342012497313 and parameters: {'kernel_type': 'Matern', 'length_scale': 5788.572291658351, 'noise_level': 0.9789275104188558, 'constant_value': 448.90908120044145, 'nu': 0.5}. Best is trial 386 with value: 0.4872991004520934.
[I 2024-12-04 15:07:56,745] Trial 1282 finished with value: 1.2401112325847874 and parameters: {'kernel_type': 'RBF', 'length_scale': 16.863935601815346, 'noise_level': 9.152485737677055e-10, 'constant_value': 61687.34780449221, 'nu': 0.5}. Best is trial 386 with value: 0.4872991004520934.
[I 2024-12-04 15:07:57,320] Trial 1288 finished with value: 0.48830343674069426 and parameters: {'kernel_type': 'Matern', 'length_scale': 364.30112051563293, 'noise_level': 0.18806752720943595, 'constant_value': 28.208354973821145, 'nu': 0.5}. Best is trial 386 with value: 0.4872991004520934.
[I 2024-12-04 15:07:57,796] Trial 1287 finished with value: 0.48830347904989524 and parameters: {'kernel_type': 'Matern', 'length_scale': 1667.2171149174883, 'noise_level': 0.623801233037249, 'constant_value': 8.401124014896652, 'nu': 0.5}. Best is trial 386 with value: 0.4872991004520934.
[I 2024-12-04 15:08:01,319] Trial 1274 finished with value: 1.2401112327003725 and parameters: {'kernel_type': 'Matern', 'length_scale': 17845.37434867743, 'noise_level': 4.0441502773248184e-08, 'constant_value': 4.3959960037049455e-05, 'nu': 1.5}. Best is trial 386 with value: 0.4872991004520934.
[I 2024-12-04 15:08:01,417] Trial 1295 finished with value: 0.4883034106405119 and parameters: {'kernel_type': 'Matern', 'length_scale': 312.7332053232898, 'noise_level': 0.7901106109849726, 'constant_value': 0.11839942954180897, 'nu': 0.5}. Best is trial 386 with value: 0.4872991004520934.
[I 2024-12-04 15:08:01,561] Trial 1289 finished with value: 0.4883035346027626 and parameters: {'kernel_type': 'Matern', 'length_scale': 2060.965258723983, 'noise_level': 0.18378094996599267, 'constant_value': 6.8551462785294515, 'nu': 0.5}. Best is trial 386 with value: 0.4872991004520934.
[I 2024-12-04 15:08:02,340] Trial 1290 finished with value: 0.48830340746953205 and parameters: {'kernel_type': 'Matern', 'length_scale': 57.67062002503874, 'noise_level': 0.3096044409543652, 'constant_value': 0.0021048253698629205, 'nu': 0.5}. Best is trial 386 with value: 0.4872991004520934.
[I 2024-12-04 15:08:02,341] Trial 1291 finished with value: 0.5663937553509684 and parameters: {'kernel_type': 'Matern', 'length_scale': 568.5994853005682, 'noise_level': 0.8326097723102637, 'constant_value': 970.5712756786517, 'nu': 2.5}. Best is trial 386 with value: 0.4872991004520934.
[I 2024-12-04 15:08:03,332] Trial 1296 finished with value: 0.48830346876848174 and parameters: {'kernel_type': 'Matern', 'length_scale': 57063.15266689614, 'noise_level': 0.0208301007499141, 'constant_value': 2018.6814334421028, 'nu': 0.5}. Best is trial 386 with value: 0.4872991004520934.
[I 2024-12-04 15:08:04,089] Trial 1281 finished with value: 0.4883030226994309 and parameters: {'kernel_type': 'Matern', 'length_scale': 2011.295769718434, 'noise_level': 0.10672199093260035, 'constant_value': 1.2917666747360907, 'nu': 0.5}. Best is trial 386 with value: 0.4872991004520934.
[I 2024-12-04 15:08:04,595] Trial 1297 finished with value: 1.2401112325799968 and parameters: {'kernel_type': 'Matern', 'length_scale': 3344.7385804642618, 'noise_level': 0.023555839727664802, 'constant_value': 6.734835052503457, 'nu': 0.5}. Best is trial 386 with value: 0.4872991004520934.
[I 2024-12-04 15:08:05,487] Trial 1292 finished with value: 1.2401112338314895 and parameters: {'kernel_type': 'Matern', 'length_scale': 14070.723294033474, 'noise_level': 0.04251628975426426, 'constant_value': 4.009278883489048, 'nu': 0.5}. Best is trial 386 with value: 0.4872991004520934.
[I 2024-12-04 15:08:05,774] Trial 1285 finished with value: 0.48830342768583834 and parameters: {'kernel_type': 'Matern', 'length_scale': 423.26156480068363, 'noise_level': 0.033539061323087, 'constant_value': 67.78405253251098, 'nu': 0.5}. Best is trial 386 with value: 0.4872991004520934.
[I 2024-12-04 15:08:06,356] Trial 1293 finished with value: 1.2401112324944663 and parameters: {'kernel_type': 'Matern', 'length_scale': 397.5360259493052, 'noise_level': 0.006594812187108106, 'constant_value': 0.022938383660276736, 'nu': 0.5}. Best is trial 386 with value: 0.4872991004520934.
[I 2024-12-04 15:08:07,632] Trial 1303 finished with value: 0.48830341791059667 and parameters: {'kernel_type': 'Matern', 'length_scale': 1504.8398665730042, 'noise_level': 0.9503387608063606, 'constant_value': 130.8249318625223, 'nu': 0.5}. Best is trial 386 with value: 0.4872991004520934.
[I 2024-12-04 15:08:07,875] Trial 1301 finished with value: 0.4883034172336523 and parameters: {'kernel_type': 'Matern', 'length_scale': 73031.83595768212, 'noise_level': 0.8139211305857895, 'constant_value': 1322.9644112896103, 'nu': 0.5}. Best is trial 386 with value: 0.4872991004520934.
[I 2024-12-04 15:08:08,096] Trial 1300 finished with value: 0.48830341664379195 and parameters: {'kernel_type': 'Matern', 'length_scale': 2020.724720371212, 'noise_level': 0.7106645267977489, 'constant_value': 289.3826731552178, 'nu': 0.5}. Best is trial 386 with value: 0.4872991004520934.
[I 2024-12-04 15:08:09,524] Trial 1299 finished with value: 0.4883029716774547 and parameters: {'kernel_type': 'Matern', 'length_scale': 587.5467804427365, 'noise_level': 0.05342652027609137, 'constant_value': 878.4421075298487, 'nu': 0.5}. Best is trial 386 with value: 0.4872991004520934.
[I 2024-12-04 15:08:09,642] Trial 1305 finished with value: 0.4883034171584997 and parameters: {'kernel_type': 'Matern', 'length_scale': 69.96513175730546, 'noise_level': 0.12193418388238308, 'constant_value': 0.2074286917465152, 'nu': 0.5}. Best is trial 386 with value: 0.4872991004520934.
[I 2024-12-04 15:08:09,672] Trial 1294 finished with value: 1.2401112325972443 and parameters: {'kernel_type': 'Matern', 'length_scale': 61388.828390422284, 'noise_level': 0.0034757772465167217, 'constant_value': 5.639191461271706, 'nu': 0.5}. Best is trial 386 with value: 0.4872991004520934.
[I 2024-12-04 15:08:10,002] Trial 1311 finished with value: 0.4883027110302362 and parameters: {'kernel_type': 'Matern', 'length_scale': 90668.57027066681, 'noise_level': 0.004681270128149291, 'constant_value': 1973.416904006592, 'nu': 0.5}. Best is trial 386 with value: 0.4872991004520934.
[I 2024-12-04 15:08:10,701] Trial 1306 finished with value: 1.2401112299422055 and parameters: {'kernel_type': 'Matern', 'length_scale': 216.21419027837408, 'noise_level': 0.007779120198620578, 'constant_value': 1.239509280978614, 'nu': 0.5}. Best is trial 386 with value: 0.4872991004520934.
[I 2024-12-04 15:08:10,940] Trial 1298 finished with value: 0.48830342199867954 and parameters: {'kernel_type': 'Matern', 'length_scale': 94994.05588302929, 'noise_level': 0.050960178913707105, 'constant_value': 1555.5174068236274, 'nu': 0.5}. Best is trial 386 with value: 0.4872991004520934.
[I 2024-12-04 15:08:11,453] Trial 1302 finished with value: 0.48830341894481905 and parameters: {'kernel_type': 'Matern', 'length_scale': 60196.47749577323, 'noise_level': 0.005318257259155246, 'constant_value': 49752.89003123139, 'nu': 0.5}. Best is trial 386 with value: 0.4872991004520934.
[I 2024-12-04 15:08:13,161] Trial 1308 finished with value: 0.4883033735735418 and parameters: {'kernel_type': 'Matern', 'length_scale': 667.3972492851593, 'noise_level': 0.02928867795839551, 'constant_value': 5.114564278094731, 'nu': 0.5}. Best is trial 386 with value: 0.4872991004520934.
[I 2024-12-04 15:08:14,681] Trial 1316 finished with value: 1.2614503893592246 and parameters: {'kernel_type': 'RBF', 'length_scale': 0.056401517769232405, 'noise_level': 4.2447621357046844e-10, 'constant_value': 0.00016581685338653098, 'nu': 0.5}. Best is trial 386 with value: 0.4872991004520934.
[I 2024-12-04 15:08:14,810] Trial 1304 finished with value: 0.48830341373978337 and parameters: {'kernel_type': 'Matern', 'length_scale': 950.3533856064788, 'noise_level': 0.9365865340114773, 'constant_value': 1.3482003795334614, 'nu': 0.5}. Best is trial 386 with value: 0.4872991004520934.
[I 2024-12-04 15:08:15,445] Trial 1309 finished with value: 0.4883033351288319 and parameters: {'kernel_type': 'Matern', 'length_scale': 280.9213646340474, 'noise_level': 0.10510383816566767, 'constant_value': 32.39762991091382, 'nu': 0.5}. Best is trial 386 with value: 0.4872991004520934.
[I 2024-12-04 15:08:16,119] Trial 1318 finished with value: 1.261454794392091 and parameters: {'kernel_type': 'Matern', 'length_scale': 10649.740238523045, 'noise_level': 0.0001247453630346278, 'constant_value': 3358.43763541992, 'nu': 0.5}. Best is trial 386 with value: 0.4872991004520934.
[I 2024-12-04 15:08:16,268] Trial 1307 finished with value: 0.48830349097165576 and parameters: {'kernel_type': 'Matern', 'length_scale': 340.30383899035814, 'noise_level': 0.3367468519760767, 'constant_value': 0.2503126294695268, 'nu': 0.5}. Best is trial 386 with value: 0.4872991004520934.
[I 2024-12-04 15:08:17,217] Trial 1310 finished with value: 0.488303422535464 and parameters: {'kernel_type': 'Matern', 'length_scale': 933.0656482695304, 'noise_level': 0.15753164161381686, 'constant_value': 0.1455497493516845, 'nu': 0.5}. Best is trial 386 with value: 0.4872991004520934.
[I 2024-12-04 15:08:17,518] Trial 1312 finished with value: 0.4883034596859665 and parameters: {'kernel_type': 'Matern', 'length_scale': 46.064467321205164, 'noise_level': 0.030447374005603312, 'constant_value': 113.91132277288831, 'nu': 0.5}. Best is trial 386 with value: 0.4872991004520934.
[I 2024-12-04 15:08:17,523] Trial 1315 finished with value: 1.261454795394147 and parameters: {'kernel_type': 'Matern', 'length_scale': 126.40850970154278, 'noise_level': 0.036105140949175545, 'constant_value': 2024.2691434983687, 'nu': 0.5}. Best is trial 386 with value: 0.4872991004520934.
[I 2024-12-04 15:08:18,026] Trial 1317 finished with value: 0.4883034170456315 and parameters: {'kernel_type': 'Matern', 'length_scale': 218.09414532726615, 'noise_level': 0.6967501610253934, 'constant_value': 4.16504194984431, 'nu': 0.5}. Best is trial 386 with value: 0.4872991004520934.
[I 2024-12-04 15:08:18,364] Trial 1314 finished with value: 0.488303419085969 and parameters: {'kernel_type': 'Matern', 'length_scale': 290.78709037543365, 'noise_level': 0.8984401126201914, 'constant_value': 78.06657541255305, 'nu': 0.5}. Best is trial 386 with value: 0.4872991004520934.
[I 2024-12-04 15:08:18,630] Trial 1323 finished with value: 1.2401112325805224 and parameters: {'kernel_type': 'Matern', 'length_scale': 267.3029015239033, 'noise_level': 0.010556783015991767, 'constant_value': 0.5083545904001037, 'nu': 0.5}. Best is trial 386 with value: 0.4872991004520934.
[I 2024-12-04 15:08:19,084] Trial 1313 finished with value: 1.2401112325929573 and parameters: {'kernel_type': 'Matern', 'length_scale': 755.362936613096, 'noise_level': 0.05985173380825251, 'constant_value': 0.0575883146624868, 'nu': 0.5}. Best is trial 386 with value: 0.4872991004520934.
[I 2024-12-04 15:08:20,436] Trial 1322 finished with value: 0.48830333261006287 and parameters: {'kernel_type': 'Matern', 'length_scale': 37282.52226427241, 'noise_level': 0.0005503137325889803, 'constant_value': 7888.452319583647, 'nu': 0.5}. Best is trial 386 with value: 0.4872991004520934.
[I 2024-12-04 15:08:20,569] Trial 1320 finished with value: 1.2614547972621177 and parameters: {'kernel_type': 'Matern', 'length_scale': 731.446587297914, 'noise_level': 0.02986179143750206, 'constant_value': 0.00011914901716594925, 'nu': 1.5}. Best is trial 386 with value: 0.4872991004520934.
[I 2024-12-04 15:08:20,912] Trial 1329 finished with value: 1.2614528822638755 and parameters: {'kernel_type': 'RBF', 'length_scale': 0.0007511133636423404, 'noise_level': 0.5050147478743002, 'constant_value': 4.4773437661266115e-05, 'nu': 1.5}. Best is trial 386 with value: 0.4872991004520934.
[I 2024-12-04 15:08:21,485] Trial 1319 finished with value: 1.2401112286889613 and parameters: {'kernel_type': 'RBF', 'length_scale': 1.2394419681706627e-05, 'noise_level': 1.839818698320132e-10, 'constant_value': 8.232335824393866e-05, 'nu': 1.5}. Best is trial 386 with value: 0.4872991004520934.
[I 2024-12-04 15:08:23,057] Trial 1321 finished with value: 0.48830343199049264 and parameters: {'kernel_type': 'Matern', 'length_scale': 52844.260534486086, 'noise_level': 0.0004698915556272304, 'constant_value': 16885.457857829188, 'nu': 0.5}. Best is trial 386 with value: 0.4872991004520934.
[I 2024-12-04 15:08:23,321] Trial 1335 finished with value: 1.2401112303372284 and parameters: {'kernel_type': 'Matern', 'length_scale': 275.3416432625018, 'noise_level': 0.012829308765116686, 'constant_value': 88.26157206262172, 'nu': 1.5}. Best is trial 386 with value: 0.4872991004520934.
[I 2024-12-04 15:08:24,047] Trial 1324 finished with value: 0.48830341931046584 and parameters: {'kernel_type': 'Matern', 'length_scale': 257.9512519608844, 'noise_level': 0.04363554344534837, 'constant_value': 33.15370709171979, 'nu': 0.5}. Best is trial 386 with value: 0.4872991004520934.
[I 2024-12-04 15:08:24,250] Trial 1325 finished with value: 1.2401112325098176 and parameters: {'kernel_type': 'Matern', 'length_scale': 58231.3560831624, 'noise_level': 0.005099670681591598, 'constant_value': 0.01907116466234446, 'nu': 0.5}. Best is trial 386 with value: 0.4872991004520934.
[I 2024-12-04 15:08:25,508] Trial 1331 finished with value: 0.4883034119701827 and parameters: {'kernel_type': 'Matern', 'length_scale': 491.417394250145, 'noise_level': 0.029671100964609454, 'constant_value': 283.6827954852919, 'nu': 0.5}. Best is trial 386 with value: 0.4872991004520934.
[I 2024-12-04 15:08:25,714] Trial 1328 finished with value: 0.4883033852017365 and parameters: {'kernel_type': 'Matern', 'length_scale': 5892.388940183653, 'noise_level': 0.7864272009021859, 'constant_value': 0.7417094965560218, 'nu': 0.5}. Best is trial 386 with value: 0.4872991004520934.
[I 2024-12-04 15:08:26,943] Trial 1334 finished with value: 1.2401112328612653 and parameters: {'kernel_type': 'RBF', 'length_scale': 6.3773814637401625, 'noise_level': 4.0641909345642243e-07, 'constant_value': 1.1483641198416363, 'nu': 2.5}. Best is trial 386 with value: 0.4872991004520934.
[I 2024-12-04 15:08:27,143] Trial 1326 finished with value: 1.2401112325742998 and parameters: {'kernel_type': 'Matern', 'length_scale': 1712.7719139812107, 'noise_level': 0.0025901135366647975, 'constant_value': 1.30077320083874, 'nu': 0.5}. Best is trial 386 with value: 0.4872991004520934.
[I 2024-12-04 15:08:27,151] Trial 1336 finished with value: 0.48830341763924134 and parameters: {'kernel_type': 'Matern', 'length_scale': 1217.9336332209832, 'noise_level': 0.0012962254855104587, 'constant_value': 45.20463733966136, 'nu': 0.5}. Best is trial 386 with value: 0.4872991004520934.
[I 2024-12-04 15:08:27,156] Trial 1330 finished with value: 1.2401112326698036 and parameters: {'kernel_type': 'Matern', 'length_scale': 30.959995898254927, 'noise_level': 0.04749634649063126, 'constant_value': 0.00024823895602694025, 'nu': 0.5}. Best is trial 386 with value: 0.4872991004520934.
[I 2024-12-04 15:08:27,465] Trial 1332 finished with value: 1.2401112322315022 and parameters: {'kernel_type': 'Matern', 'length_scale': 5.843546444264043e-05, 'noise_level': 0.29154773833169884, 'constant_value': 12474.942564633991, 'nu': 2.5}. Best is trial 386 with value: 0.4872991004520934.
[I 2024-12-04 15:08:27,907] Trial 1333 finished with value: 1.261454690602376 and parameters: {'kernel_type': 'Matern', 'length_scale': 6573.633109286949, 'noise_level': 0.7501507708793714, 'constant_value': 0.0396023697690371, 'nu': 0.5}. Best is trial 386 with value: 0.4872991004520934.
[I 2024-12-04 15:08:29,328] Trial 1337 finished with value: 1.2614543702027647 and parameters: {'kernel_type': 'Matern', 'length_scale': 0.00021813025071606016, 'noise_level': 2.1346636184641582e-10, 'constant_value': 5.59122682899411, 'nu': 0.5}. Best is trial 386 with value: 0.4872991004520934.
[I 2024-12-04 15:08:29,332] Trial 1340 finished with value: 0.48830342688262696 and parameters: {'kernel_type': 'Matern', 'length_scale': 678.9185324634517, 'noise_level': 0.027284778624932077, 'constant_value': 399.7491146329242, 'nu': 0.5}. Best is trial 386 with value: 0.4872991004520934.
[I 2024-12-04 15:08:30,161] Trial 1327 finished with value: 1.2614547953941473 and parameters: {'kernel_type': 'Matern', 'length_scale': 209.7875989048142, 'noise_level': 0.022587159849890584, 'constant_value': 97021.21410434104, 'nu': 0.5}. Best is trial 386 with value: 0.4872991004520934.
[I 2024-12-04 15:08:31,515] Trial 1342 finished with value: 0.4883033934432499 and parameters: {'kernel_type': 'Matern', 'length_scale': 274.4865872239614, 'noise_level': 0.037218979319822015, 'constant_value': 465.52658945440317, 'nu': 0.5}. Best is trial 386 with value: 0.4872991004520934.
[I 2024-12-04 15:08:32,448] Trial 1350 finished with value: 0.48830342438043606 and parameters: {'kernel_type': 'Matern', 'length_scale': 2257.569286151072, 'noise_level': 0.016903399777704695, 'constant_value': 7177.712240251677, 'nu': 0.5}. Best is trial 386 with value: 0.4872991004520934.
[I 2024-12-04 15:08:32,450] Trial 1341 finished with value: 1.26145479763508 and parameters: {'kernel_type': 'RBF', 'length_scale': 8286.685963865799, 'noise_level': 0.9598519002459021, 'constant_value': 0.7432009952577311, 'nu': 0.5}. Best is trial 386 with value: 0.4872991004520934.
[I 2024-12-04 15:08:32,992] Trial 1345 finished with value: 1.2401112333227957 and parameters: {'kernel_type': 'RBF', 'length_scale': 227.05139345477195, 'noise_level': 0.04339076381239795, 'constant_value': 0.01773718475143212, 'nu': 0.5}. Best is trial 386 with value: 0.4872991004520934.
[I 2024-12-04 15:08:33,169] Trial 1344 finished with value: 1.2401112325740087 and parameters: {'kernel_type': 'Matern', 'length_scale': 0.02315487008078543, 'noise_level': 0.001982507799962053, 'constant_value': 3.8239959198872744, 'nu': 0.5}. Best is trial 386 with value: 0.4872991004520934.
[I 2024-12-04 15:08:33,333] Trial 1349 finished with value: 0.4883034173824674 and parameters: {'kernel_type': 'Matern', 'length_scale': 37.44835556038484, 'noise_level': 0.8239226092874512, 'constant_value': 5500.870336614131, 'nu': 0.5}. Best is trial 386 with value: 0.4872991004520934.
[I 2024-12-04 15:08:36,565] Trial 1354 finished with value: 1.2401112315356213 and parameters: {'kernel_type': 'RBF', 'length_scale': 194.34776135442067, 'noise_level': 0.0011510973544603036, 'constant_value': 0.48850427525248463, 'nu': 1.5}. Best is trial 386 with value: 0.4872991004520934.
[I 2024-12-04 15:08:36,602] Trial 1346 finished with value: 1.261454795394147 and parameters: {'kernel_type': 'Matern', 'length_scale': 14863.289797281077, 'noise_level': 0.026465093437453097, 'constant_value': 66399.44699463814, 'nu': 0.5}. Best is trial 386 with value: 0.4872991004520934.
[I 2024-12-04 15:08:36,654] Trial 1338 finished with value: 0.48830342418974115 and parameters: {'kernel_type': 'Matern', 'length_scale': 6157.4117946694905, 'noise_level': 0.005697567400386905, 'constant_value': 73288.31283391228, 'nu': 0.5}. Best is trial 386 with value: 0.4872991004520934.
[I 2024-12-04 15:08:36,874] Trial 1339 finished with value: 0.4883033928648184 and parameters: {'kernel_type': 'Matern', 'length_scale': 2694.0225047299255, 'noise_level': 0.0008131303804289388, 'constant_value': 2573.9777666982527, 'nu': 0.5}. Best is trial 386 with value: 0.4872991004520934.
[I 2024-12-04 15:08:37,707] Trial 1343 finished with value: 0.48830340769777136 and parameters: {'kernel_type': 'Matern', 'length_scale': 58.25821837070116, 'noise_level': 0.8395792694717265, 'constant_value': 23.34803200937324, 'nu': 0.5}. Best is trial 386 with value: 0.4872991004520934.
