[I 2024-12-04 15:20:22,303] Trial 2396 finished with value: 0.48830341797927534 and parameters: {'kernel_type': 'Matern', 'length_scale': 3786.1821164689245, 'noise_level': 0.0759388150391203, 'constant_value': 826.5626014649816, 'nu': 0.5}. Best is trial 386 with value: 0.4872991004520934.
[I 2024-12-04 15:20:22,910] Trial 2410 finished with value: 0.48830341783101827 and parameters: {'kernel_type': 'Matern', 'length_scale': 1385.9210892751464, 'noise_level': 0.6933338135389586, 'constant_value': 716.807767942093, 'nu': 0.5}. Best is trial 386 with value: 0.4872991004520934.
[I 2024-12-04 15:20:24,932] Trial 2398 finished with value: 0.4883034218806417 and parameters: {'kernel_type': 'Matern', 'length_scale': 130.58171373888908, 'noise_level': 0.07424939155325665, 'constant_value': 340.203983241136, 'nu': 0.5}. Best is trial 386 with value: 0.4872991004520934.
[I 2024-12-04 15:20:25,735] Trial 2409 finished with value: 0.488301920911887 and parameters: {'kernel_type': 'Matern', 'length_scale': 98.37448771002366, 'noise_level': 0.0011242823518587415, 'constant_value': 77789.5628254676, 'nu': 0.5}. Best is trial 386 with value: 0.4872991004520934.
[I 2024-12-04 15:20:27,830] Trial 2408 finished with value: 1.2401112330540776 and parameters: {'kernel_type': 'Matern', 'length_scale': 0.14782904803586533, 'noise_level': 0.0005341024157613734, 'constant_value': 1.2002164660424668e-07, 'nu': 1.5}. Best is trial 386 with value: 0.4872991004520934.
[I 2024-12-04 15:20:28,285] Trial 2405 finished with value: 1.2614486252484858 and parameters: {'kernel_type': 'Matern', 'length_scale': 157.95756249007005, 'noise_level': 0.20166683505421296, 'constant_value': 4.132327933802519e-05, 'nu': 0.5}. Best is trial 386 with value: 0.4872991004520934.
[I 2024-12-04 15:20:29,493] Trial 2393 finished with value: 0.48830324440041006 and parameters: {'kernel_type': 'Matern', 'length_scale': 1.2916932472075893, 'noise_level': 0.0078063577254948125, 'constant_value': 1482.0766924978993, 'nu': 0.5}. Best is trial 386 with value: 0.4872991004520934.
[I 2024-12-04 15:20:29,690] Trial 2416 finished with value: 0.48830340344592854 and parameters: {'kernel_type': 'Matern', 'length_scale': 37957.79825453695, 'noise_level': 0.03695739847483615, 'constant_value': 92055.82785678726, 'nu': 0.5}. Best is trial 386 with value: 0.4872991004520934.
[I 2024-12-04 15:20:30,826] Trial 2403 finished with value: 1.240111233053834 and parameters: {'kernel_type': 'Matern', 'length_scale': 89.60307489082662, 'noise_level': 0.015684449841616425, 'constant_value': 0.0009622947200000701, 'nu': 0.5}. Best is trial 386 with value: 0.4872991004520934.
[I 2024-12-04 15:20:31,153] Trial 2406 finished with value: 1.261454796981954 and parameters: {'kernel_type': 'Matern', 'length_scale': 61445.478044006035, 'noise_level': 4.481194065349342e-06, 'constant_value': 4.634522327418468e-07, 'nu': 1.5}. Best is trial 386 with value: 0.4872991004520934.
[I 2024-12-04 15:20:31,169] Trial 2407 finished with value: 1.2401112324652412 and parameters: {'kernel_type': 'RBF', 'length_scale': 0.0011535963289303057, 'noise_level': 7.612849039891583e-05, 'constant_value': 0.340492112057601, 'nu': 1.5}. Best is trial 386 with value: 0.4872991004520934.
[I 2024-12-04 15:20:31,655] Trial 2420 finished with value: 0.4883035466014656 and parameters: {'kernel_type': 'Matern', 'length_scale': 3.937059905917834, 'noise_level': 0.00337126970559826, 'constant_value': 27268.370574437646, 'nu': 0.5}. Best is trial 386 with value: 0.4872991004520934.
[I 2024-12-04 15:20:31,912] Trial 2414 finished with value: 1.2614543702027772 and parameters: {'kernel_type': 'RBF', 'length_scale': 0.004841530209154169, 'noise_level': 9.568197099206479e-07, 'constant_value': 29.813807064834165, 'nu': 0.5}. Best is trial 386 with value: 0.4872991004520934.
[I 2024-12-04 15:20:31,917] Trial 2419 finished with value: 0.4883036549330419 and parameters: {'kernel_type': 'Matern', 'length_scale': 2.3845126467421602, 'noise_level': 0.0007724217432105182, 'constant_value': 5902.770991389226, 'nu': 0.5}. Best is trial 386 with value: 0.4872991004520934.
[I 2024-12-04 15:20:33,546] Trial 2415 finished with value: 0.48830341883700995 and parameters: {'kernel_type': 'Matern', 'length_scale': 74191.70053407636, 'noise_level': 0.8963204778188211, 'constant_value': 77.6534917254768, 'nu': 0.5}. Best is trial 386 with value: 0.4872991004520934.
[I 2024-12-04 15:20:33,569] Trial 2412 finished with value: 0.4883034182102146 and parameters: {'kernel_type': 'Matern', 'length_scale': 94583.98522840376, 'noise_level': 0.885993829077084, 'constant_value': 157.43643053206367, 'nu': 0.5}. Best is trial 386 with value: 0.4872991004520934.
[I 2024-12-04 15:20:34,030] Trial 2411 finished with value: 0.48830479792124776 and parameters: {'kernel_type': 'Matern', 'length_scale': 3391.4488063851268, 'noise_level': 0.964544107395373, 'constant_value': 4631.924981579585, 'nu': 0.5}. Best is trial 386 with value: 0.4872991004520934.
[I 2024-12-04 15:20:34,206] Trial 2418 finished with value: 1.2614547542367103 and parameters: {'kernel_type': 'Matern', 'length_scale': 2.1251167689057997, 'noise_level': 1.595161386526879e-05, 'constant_value': 6276.981248690448, 'nu': 0.5}. Best is trial 386 with value: 0.4872991004520934.
[I 2024-12-04 15:20:34,377] Trial 2401 finished with value: 0.48830337435757565 and parameters: {'kernel_type': 'Matern', 'length_scale': 459.3950587621659, 'noise_level': 0.001617477733339621, 'constant_value': 201.82545007359352, 'nu': 0.5}. Best is trial 386 with value: 0.4872991004520934.
[I 2024-12-04 15:20:34,819] Trial 2423 finished with value: 0.48830311080080896 and parameters: {'kernel_type': 'Matern', 'length_scale': 40.92548598260352, 'noise_level': 0.0928996211343659, 'constant_value': 0.2702520620872927, 'nu': 0.5}. Best is trial 386 with value: 0.4872991004520934.
[I 2024-12-04 15:20:35,277] Trial 2413 finished with value: 0.488303422355544 and parameters: {'kernel_type': 'Matern', 'length_scale': 29.521450115910593, 'noise_level': 0.0010577261487049329, 'constant_value': 7849.616203968885, 'nu': 0.5}. Best is trial 386 with value: 0.4872991004520934.
[I 2024-12-04 15:20:35,456] Trial 2422 finished with value: 1.261454781059836 and parameters: {'kernel_type': 'Matern', 'length_scale': 63.91923216907544, 'noise_level': 4.263767720553931e-05, 'constant_value': 725.5194196470818, 'nu': 0.5}. Best is trial 386 with value: 0.4872991004520934.
[I 2024-12-04 15:20:36,168] Trial 2421 finished with value: 1.2614547913385576 and parameters: {'kernel_type': 'Matern', 'length_scale': 3.323811981917221, 'noise_level': 0.00035875902342983544, 'constant_value': 31075.335614311596, 'nu': 0.5}. Best is trial 386 with value: 0.4872991004520934.
[I 2024-12-04 15:20:36,169] Trial 2427 finished with value: 1.261454795394147 and parameters: {'kernel_type': 'Matern', 'length_scale': 11.706401865048303, 'noise_level': 0.035126484668019396, 'constant_value': 1200.7711289464498, 'nu': 0.5}. Best is trial 386 with value: 0.4872991004520934.
[I 2024-12-04 15:20:37,993] Trial 2424 finished with value: 1.2614547925180741 and parameters: {'kernel_type': 'Matern', 'length_scale': 1281.8396979517097, 'noise_level': 4.055048442356783e-05, 'constant_value': 67253.9534181605, 'nu': 0.5}. Best is trial 386 with value: 0.4872991004520934.
[I 2024-12-04 15:20:38,643] Trial 2433 finished with value: 1.2614547939857377 and parameters: {'kernel_type': 'Matern', 'length_scale': 136.54513725945094, 'noise_level': 0.00019820863088295364, 'constant_value': 23033.23442600157, 'nu': 0.5}. Best is trial 386 with value: 0.4872991004520934.
[I 2024-12-04 15:20:39,263] Trial 2425 finished with value: 0.4883034160115142 and parameters: {'kernel_type': 'Matern', 'length_scale': 930.9595000309523, 'noise_level': 0.001034187899281338, 'constant_value': 1539.7130682397135, 'nu': 0.5}. Best is trial 386 with value: 0.4872991004520934.
[I 2024-12-04 15:20:39,657] Trial 2417 finished with value: 0.4883032984834714 and parameters: {'kernel_type': 'Matern', 'length_scale': 80.55674898602423, 'noise_level': 0.0008844482497412746, 'constant_value': 57408.75158271018, 'nu': 0.5}. Best is trial 386 with value: 0.4872991004520934.
[I 2024-12-04 15:20:41,032] Trial 2430 finished with value: 0.4883034178154099 and parameters: {'kernel_type': 'Matern', 'length_scale': 786.8788244488833, 'noise_level': 0.00012968874433481547, 'constant_value': 162.0543581534208, 'nu': 0.5}. Best is trial 386 with value: 0.4872991004520934.
[I 2024-12-04 15:20:41,056] Trial 2431 finished with value: 0.4883034207981676 and parameters: {'kernel_type': 'Matern', 'length_scale': 21.24457089455947, 'noise_level': 0.002278679829545924, 'constant_value': 70979.63371605198, 'nu': 0.5}. Best is trial 386 with value: 0.4872991004520934.
[I 2024-12-04 15:20:43,978] Trial 2429 finished with value: 0.4883033671200338 and parameters: {'kernel_type': 'Matern', 'length_scale': 25.27732284751912, 'noise_level': 0.000954404253798145, 'constant_value': 15958.830922030133, 'nu': 0.5}. Best is trial 386 with value: 0.4872991004520934.
[I 2024-12-04 15:20:44,675] Trial 2428 finished with value: 1.2614547688929498 and parameters: {'kernel_type': 'Matern', 'length_scale': 41.69275506549063, 'noise_level': 5.1225264251810854e-05, 'constant_value': 30.97722592614331, 'nu': 0.5}. Best is trial 386 with value: 0.4872991004520934.
[I 2024-12-04 15:20:45,234] Trial 2435 finished with value: 1.261454791985743 and parameters: {'kernel_type': 'Matern', 'length_scale': 145.79855531270778, 'noise_level': 0.0001374335589738852, 'constant_value': 7086.2955236878515, 'nu': 0.5}. Best is trial 386 with value: 0.4872991004520934.
[I 2024-12-04 15:20:45,668] Trial 2426 finished with value: 0.48830352933084636 and parameters: {'kernel_type': 'Matern', 'length_scale': 227.85053038911843, 'noise_level': 0.03711645557438088, 'constant_value': 59.18375486313108, 'nu': 0.5}. Best is trial 386 with value: 0.4872991004520934.
[I 2024-12-04 15:20:46,468] Trial 2436 finished with value: 1.2401112326129216 and parameters: {'kernel_type': 'RBF', 'length_scale': 5.748278109324057e-05, 'noise_level': 2.902095187088219e-07, 'constant_value': 1.260410607554527e-05, 'nu': 1.5}. Best is trial 386 with value: 0.4872991004520934.
[I 2024-12-04 15:20:47,476] Trial 2432 finished with value: 0.4883034090500608 and parameters: {'kernel_type': 'Matern', 'length_scale': 37.8280896778644, 'noise_level': 0.03731913107925894, 'constant_value': 7.503015250620502, 'nu': 0.5}. Best is trial 386 with value: 0.4872991004520934.
[I 2024-12-04 15:20:48,716] Trial 2437 finished with value: 0.48830331039345387 and parameters: {'kernel_type': 'Matern', 'length_scale': 15.302727666720811, 'noise_level': 0.00021937376054587753, 'constant_value': 302.75954892264275, 'nu': 0.5}. Best is trial 386 with value: 0.4872991004520934.
[I 2024-12-04 15:20:48,717] Trial 2438 finished with value: 1.240111232566364 and parameters: {'kernel_type': 'Matern', 'length_scale': 91101.11436676787, 'noise_level': 0.0059730470614825235, 'constant_value': 9.670885887573911, 'nu': 0.5}. Best is trial 386 with value: 0.4872991004520934.
[I 2024-12-04 15:20:50,461] Trial 2434 finished with value: 1.2401112325519468 and parameters: {'kernel_type': 'Matern', 'length_scale': 432.01469629576144, 'noise_level': 0.03632801431520873, 'constant_value': 0.027572128886015033, 'nu': 0.5}. Best is trial 386 with value: 0.4872991004520934.
[I 2024-12-04 15:20:51,561] Trial 2446 finished with value: 0.4883034185733357 and parameters: {'kernel_type': 'Matern', 'length_scale': 88152.41085362449, 'noise_level': 0.9822731062119524, 'constant_value': 1817.495864508404, 'nu': 0.5}. Best is trial 386 with value: 0.4872991004520934.
[I 2024-12-04 15:20:51,802] Trial 2449 finished with value: 1.2401112327156085 and parameters: {'kernel_type': 'Matern', 'length_scale': 71006.03871811618, 'noise_level': 0.00045546318342365796, 'constant_value': 37.831539022980444, 'nu': 0.5}. Best is trial 386 with value: 0.4872991004520934.
[I 2024-12-04 15:20:52,913] Trial 2453 finished with value: 1.261454792791207 and parameters: {'kernel_type': 'Matern', 'length_scale': 4.579416062303432, 'noise_level': 0.0003689651685458853, 'constant_value': 32438.62316063826, 'nu': 0.5}. Best is trial 386 with value: 0.4872991004520934.
[I 2024-12-04 15:20:56,169] Trial 2441 finished with value: 0.4883034244366699 and parameters: {'kernel_type': 'Matern', 'length_scale': 272.4778390878611, 'noise_level': 0.0004134387196276455, 'constant_value': 48087.29535115472, 'nu': 0.5}. Best is trial 386 with value: 0.4872991004520934.
[I 2024-12-04 15:20:56,234] Trial 2451 finished with value: 1.2614547901108712 and parameters: {'kernel_type': 'Matern', 'length_scale': 515.9866966556675, 'noise_level': 2.038187827160548e-05, 'constant_value': 51480.2829047276, 'nu': 0.5}. Best is trial 386 with value: 0.4872991004520934.
[I 2024-12-04 15:20:56,419] Trial 2443 finished with value: 1.2401112325554764 and parameters: {'kernel_type': 'RBF', 'length_scale': 7.656015623299861e-05, 'noise_level': 7.0397023407836495e-09, 'constant_value': 0.045599460807282374, 'nu': 1.5}. Best is trial 386 with value: 0.4872991004520934.
[I 2024-12-04 15:20:56,943] Trial 2445 finished with value: 1.2401112324811794 and parameters: {'kernel_type': 'Matern', 'length_scale': 382.3237083243743, 'noise_level': 0.007624745263046519, 'constant_value': 0.0944866956573351, 'nu': 1.5}. Best is trial 386 with value: 0.4872991004520934.
[I 2024-12-04 15:20:56,944] Trial 2454 finished with value: 0.5273050628622263 and parameters: {'kernel_type': 'Matern', 'length_scale': 1705.699699331009, 'noise_level': 0.8195182928861968, 'constant_value': 72812.45112663157, 'nu': 1.5}. Best is trial 386 with value: 0.4872991004520934.
[I 2024-12-04 15:20:57,330] Trial 2442 finished with value: 0.4883032283690713 and parameters: {'kernel_type': 'Matern', 'length_scale': 44268.46149266723, 'noise_level': 0.010386294238075525, 'constant_value': 2442.9859564909907, 'nu': 0.5}. Best is trial 386 with value: 0.4872991004520934.
[I 2024-12-04 15:20:58,155] Trial 2440 finished with value: 0.4883034165221791 and parameters: {'kernel_type': 'Matern', 'length_scale': 3311.620712821985, 'noise_level': 0.03389615235857372, 'constant_value': 27.498011123994306, 'nu': 0.5}. Best is trial 386 with value: 0.4872991004520934.
[I 2024-12-04 15:20:58,158] Trial 2439 finished with value: 0.4883034195074817 and parameters: {'kernel_type': 'Matern', 'length_scale': 35.26672278460918, 'noise_level': 0.0009486772589525473, 'constant_value': 837.5310619277092, 'nu': 0.5}. Best is trial 386 with value: 0.4872991004520934.
[I 2024-12-04 15:20:59,458] Trial 2450 finished with value: 0.6443860177413769 and parameters: {'kernel_type': 'RBF', 'length_scale': 1921.3664370782647, 'noise_level': 0.11969417628627425, 'constant_value': 20.192248062073748, 'nu': 0.5}. Best is trial 386 with value: 0.4872991004520934.
[I 2024-12-04 15:21:00,456] Trial 2460 finished with value: 1.2614547953941473 and parameters: {'kernel_type': 'Matern', 'length_scale': 55.712910090403085, 'noise_level': 0.03556374415114862, 'constant_value': 94744.55776357734, 'nu': 0.5}. Best is trial 386 with value: 0.4872991004520934.
[I 2024-12-04 15:21:00,903] Trial 2448 finished with value: 1.2614547819412378 and parameters: {'kernel_type': 'Matern', 'length_scale': 9.381575595316802, 'noise_level': 7.278262346758715e-05, 'constant_value': 32653.2493980566, 'nu': 0.5}. Best is trial 386 with value: 0.4872991004520934.
[I 2024-12-04 15:21:00,908] Trial 2444 finished with value: 1.2614547866694668 and parameters: {'kernel_type': 'Matern', 'length_scale': 139.92159989486146, 'noise_level': 2.4826677652503504e-05, 'constant_value': 19862.480856227336, 'nu': 0.5}. Best is trial 386 with value: 0.4872991004520934.
[I 2024-12-04 15:21:01,564] Trial 2456 finished with value: 0.48830344052313673 and parameters: {'kernel_type': 'Matern', 'length_scale': 14.256695693514667, 'noise_level': 0.04671456875874105, 'constant_value': 4851.025365742309, 'nu': 0.5}. Best is trial 386 with value: 0.4872991004520934.
[I 2024-12-04 15:21:01,754] Trial 2447 finished with value: 0.56639340423684 and parameters: {'kernel_type': 'Matern', 'length_scale': 663.3897484931373, 'noise_level': 0.06152355222676382, 'constant_value': 68.39050618191524, 'nu': 2.5}. Best is trial 386 with value: 0.4872991004520934.
[I 2024-12-04 15:21:02,247] Trial 2462 finished with value: 0.48830342062657717 and parameters: {'kernel_type': 'Matern', 'length_scale': 30.541430994272215, 'noise_level': 0.9860010193692674, 'constant_value': 3085.0159011561586, 'nu': 0.5}. Best is trial 386 with value: 0.4872991004520934.
[I 2024-12-04 15:21:03,644] Trial 2452 finished with value: 0.4883034188466184 and parameters: {'kernel_type': 'Matern', 'length_scale': 3864.120667644943, 'noise_level': 0.9525658208082941, 'constant_value': 441.8115960266165, 'nu': 0.5}. Best is trial 386 with value: 0.4872991004520934.
[I 2024-12-04 15:21:03,941] Trial 2465 finished with value: 1.2614547827371119 and parameters: {'kernel_type': 'Matern', 'length_scale': 6.582642664768475, 'noise_level': 7.937971018752093e-05, 'constant_value': 94153.02413857885, 'nu': 0.5}. Best is trial 386 with value: 0.4872991004520934.
[I 2024-12-04 15:21:04,092] Trial 2458 finished with value: 0.48830341944162664 and parameters: {'kernel_type': 'Matern', 'length_scale': 962.1286879599093, 'noise_level': 0.0005587561801197726, 'constant_value': 2440.62569631854, 'nu': 0.5}. Best is trial 386 with value: 0.4872991004520934.
[I 2024-12-04 15:21:05,328] Trial 2455 finished with value: 0.4883033949979028 and parameters: {'kernel_type': 'Matern', 'length_scale': 2805.5371838932133, 'noise_level': 0.7588760888495145, 'constant_value': 0.017583331112223224, 'nu': 0.5}. Best is trial 386 with value: 0.4872991004520934.
[I 2024-12-04 15:21:05,670] Trial 2457 finished with value: 0.48830341790781984 and parameters: {'kernel_type': 'Matern', 'length_scale': 2748.320238669904, 'noise_level': 0.6686388439769849, 'constant_value': 0.16975346705846853, 'nu': 0.5}. Best is trial 386 with value: 0.4872991004520934.
[I 2024-12-04 15:21:05,677] Trial 2464 finished with value: 0.4883034853065263 and parameters: {'kernel_type': 'Matern', 'length_scale': 94027.48554103047, 'noise_level': 0.9455096198064941, 'constant_value': 278.19478713967504, 'nu': 0.5}. Best is trial 386 with value: 0.4872991004520934.
[I 2024-12-04 15:21:06,462] Trial 2463 finished with value: 0.48830340381751003 and parameters: {'kernel_type': 'Matern', 'length_scale': 95638.27423537488, 'noise_level': 0.01468613276055262, 'constant_value': 1165.1927932702597, 'nu': 0.5}. Best is trial 386 with value: 0.4872991004520934.
[I 2024-12-04 15:21:07,314] Trial 2461 finished with value: 1.2401112321743581 and parameters: {'kernel_type': 'Matern', 'length_scale': 97526.24049227557, 'noise_level': 0.04822428216983765, 'constant_value': 3.222045173059943, 'nu': 0.5}. Best is trial 386 with value: 0.4872991004520934.
[I 2024-12-04 15:21:08,190] Trial 2459 finished with value: 1.26145479763521 and parameters: {'kernel_type': 'Matern', 'length_scale': 5.409287108320343, 'noise_level': 0.00014825049305850713, 'constant_value': 191.14513653891825, 'nu': 1.5}. Best is trial 386 with value: 0.4872991004520934.
[I 2024-12-04 15:21:09,145] Trial 2469 finished with value: 0.4883033783342885 and parameters: {'kernel_type': 'Matern', 'length_scale': 1689.6946720472113, 'noise_level': 0.0010761122399696227, 'constant_value': 38389.321008640894, 'nu': 0.5}. Best is trial 386 with value: 0.4872991004520934.
[I 2024-12-04 15:21:09,516] Trial 2471 finished with value: 0.48830286626072905 and parameters: {'kernel_type': 'Matern', 'length_scale': 5398.765808254874, 'noise_level': 0.03701100664197565, 'constant_value': 1866.1644926578563, 'nu': 0.5}. Best is trial 386 with value: 0.4872991004520934.
[I 2024-12-04 15:21:10,516] Trial 2467 finished with value: 0.48830340571516406 and parameters: {'kernel_type': 'Matern', 'length_scale': 390.9503189437122, 'noise_level': 0.0007357518387913764, 'constant_value': 60906.35913819779, 'nu': 0.5}. Best is trial 386 with value: 0.4872991004520934.
[I 2024-12-04 15:21:12,105] Trial 2470 finished with value: 1.2614547953941473 and parameters: {'kernel_type': 'Matern', 'length_scale': 89009.74938580683, 'noise_level': 8.451145611609557e-05, 'constant_value': 70558.42873253205, 'nu': 0.5}. Best is trial 386 with value: 0.4872991004520934.
[I 2024-12-04 15:21:12,572] Trial 2468 finished with value: 0.48830331646845526 and parameters: {'kernel_type': 'Matern', 'length_scale': 18.873222141554784, 'noise_level': 0.80164529525864, 'constant_value': 0.19729152782555945, 'nu': 0.5}. Best is trial 386 with value: 0.4872991004520934.
[I 2024-12-04 15:21:12,799] Trial 2466 finished with value: 1.2401112317699317 and parameters: {'kernel_type': 'RBF', 'length_scale': 96284.37440392122, 'noise_level': 5.50469801347624e-07, 'constant_value': 0.0009593364598694835, 'nu': 2.5}. Best is trial 386 with value: 0.4872991004520934.
[I 2024-12-04 15:21:12,909] Trial 2475 finished with value: 0.4883034789685725 and parameters: {'kernel_type': 'Matern', 'length_scale': 1041.7301346996746, 'noise_level': 0.8276361880000811, 'constant_value': 12.03217035291881, 'nu': 0.5}. Best is trial 386 with value: 0.4872991004520934.
[I 2024-12-04 15:21:14,788] Trial 2473 finished with value: 0.5273054072951546 and parameters: {'kernel_type': 'Matern', 'length_scale': 184.45472159260152, 'noise_level': 0.4022918875907417, 'constant_value': 1.111073180104725, 'nu': 1.5}. Best is trial 386 with value: 0.4872991004520934.
[I 2024-12-04 15:21:14,892] Trial 2476 finished with value: 0.4883032777229485 and parameters: {'kernel_type': 'Matern', 'length_scale': 286.863809101135, 'noise_level': 0.03992347143366249, 'constant_value': 84.00467744114385, 'nu': 0.5}. Best is trial 386 with value: 0.4872991004520934.
