[I 2024-12-04 20:34:10,459] Trial 1670 finished with value: 0.4286834806596806 and parameters: {'kernel_type': 'RBF', 'length_scale': 22831.270060603485, 'noise_level': 0.30093740893128756, 'constant_value': 30234.160180794257, 'nu': 0.5}. Best is trial 881 with value: 0.35916990930150405.
[I 2024-12-04 20:34:10,462] Trial 1672 finished with value: 0.42868351601252125 and parameters: {'kernel_type': 'RBF', 'length_scale': 1.0662820086890032, 'noise_level': 0.0010318992388415643, 'constant_value': 27.43046274302939, 'nu': 2.5}. Best is trial 881 with value: 0.35916990930150405.
[I 2024-12-04 20:34:14,215] Trial 1673 finished with value: 0.3592112889588096 and parameters: {'kernel_type': 'Matern', 'length_scale': 51.02494923860524, 'noise_level': 0.004516425923588575, 'constant_value': 14.069741703829141, 'nu': 0.5}. Best is trial 881 with value: 0.35916990930150405.
[I 2024-12-04 20:34:14,613] Trial 1675 finished with value: 1.062416117274772 and parameters: {'kernel_type': 'RBF', 'length_scale': 0.007148666641792343, 'noise_level': 8.577220877355421e-05, 'constant_value': 0.0006739355319997435, 'nu': 1.5}. Best is trial 881 with value: 0.35916990930150405.
[I 2024-12-04 20:34:15,807] Trial 1674 finished with value: 0.3592112089828963 and parameters: {'kernel_type': 'Matern', 'length_scale': 25.286868310764245, 'noise_level': 0.5984795624814744, 'constant_value': 351.38681908544993, 'nu': 0.5}. Best is trial 881 with value: 0.35916990930150405.
[I 2024-12-04 20:34:19,671] Trial 1676 finished with value: 0.35921123351601314 and parameters: {'kernel_type': 'Matern', 'length_scale': 2.9016385576400556, 'noise_level': 0.9754248711513704, 'constant_value': 13.51316135655658, 'nu': 0.5}. Best is trial 881 with value: 0.35916990930150405.
[I 2024-12-04 20:34:21,605] Trial 1677 finished with value: 1.0624161172629076 and parameters: {'kernel_type': 'RBF', 'length_scale': 0.0009595525364921266, 'noise_level': 2.1074392480163363e-10, 'constant_value': 8.327274887046071e-07, 'nu': 1.5}. Best is trial 881 with value: 0.35916990930150405.
[I 2024-12-04 20:34:24,812] Trial 1679 finished with value: 0.3592112405052364 and parameters: {'kernel_type': 'Matern', 'length_scale': 901.6805054869991, 'noise_level': 0.10456636307294608, 'constant_value': 10.001480372032969, 'nu': 0.5}. Best is trial 881 with value: 0.35916990930150405.
[I 2024-12-04 20:34:26,034] Trial 1680 finished with value: 0.35921126603941306 and parameters: {'kernel_type': 'Matern', 'length_scale': 114.06515053502126, 'noise_level': 0.42149393989173833, 'constant_value': 9.40074514105264, 'nu': 0.5}. Best is trial 881 with value: 0.35916990930150405.
[I 2024-12-04 20:34:30,481] Trial 1681 finished with value: 0.3592110914221672 and parameters: {'kernel_type': 'Matern', 'length_scale': 1.0039213751916194, 'noise_level': 0.19726570761148168, 'constant_value': 28.718456222778535, 'nu': 0.5}. Best is trial 881 with value: 0.35916990930150405.
[I 2024-12-04 20:34:31,254] Trial 1682 finished with value: 0.359211238238788 and parameters: {'kernel_type': 'Matern', 'length_scale': 2016.9513928487286, 'noise_level': 0.04467587640492587, 'constant_value': 116.05823065442515, 'nu': 0.5}. Best is trial 881 with value: 0.35916990930150405.
[I 2024-12-04 20:34:31,607] Trial 1678 finished with value: 0.4286835135965561 and parameters: {'kernel_type': 'RBF', 'length_scale': 932.6182788631963, 'noise_level': 0.0016370844826694257, 'constant_value': 1.5375905668731606e-07, 'nu': 2.5}. Best is trial 881 with value: 0.35916990930150405.
[I 2024-12-04 20:34:34,575] Trial 1683 finished with value: 1.0624161172609043 and parameters: {'kernel_type': 'Matern', 'length_scale': 0.0747087996617079, 'noise_level': 0.014986763599734458, 'constant_value': 705.8653911629932, 'nu': 2.5}. Best is trial 881 with value: 0.35916990930150405.
[I 2024-12-04 20:34:35,573] Trial 1684 finished with value: 0.3592112530742597 and parameters: {'kernel_type': 'Matern', 'length_scale': 6.867350196372256, 'noise_level': 0.36210726241364616, 'constant_value': 1.2327581063554962, 'nu': 0.5}. Best is trial 881 with value: 0.35916990930150405.
[I 2024-12-04 20:34:39,154] Trial 1685 finished with value: 0.35921123913392244 and parameters: {'kernel_type': 'Matern', 'length_scale': 0.6359690092128318, 'noise_level': 3.0029594287705757e-07, 'constant_value': 1.371703718333045e-05, 'nu': 0.5}. Best is trial 881 with value: 0.35916990930150405.
[I 2024-12-04 20:34:39,158] Trial 1687 finished with value: 0.4195659092074341 and parameters: {'kernel_type': 'Matern', 'length_scale': 2.5249010671124865, 'noise_level': 0.24789602850108527, 'constant_value': 0.06032860296454522, 'nu': 2.5}. Best is trial 881 with value: 0.35916990930150405.
[I 2024-12-04 20:34:39,985] Trial 1686 finished with value: 0.35921120671310053 and parameters: {'kernel_type': 'Matern', 'length_scale': 16.238457887199527, 'noise_level': 0.8415764616086855, 'constant_value': 16.15703034105785, 'nu': 0.5}. Best is trial 881 with value: 0.35916990930150405.
[I 2024-12-04 20:34:44,000] Trial 1689 finished with value: 1.0624161172687698 and parameters: {'kernel_type': 'Matern', 'length_scale': 35.90064197476739, 'noise_level': 2.1026583050398762e-07, 'constant_value': 0.0028736416866999414, 'nu': 0.5}. Best is trial 881 with value: 0.35916990930150405.
[I 2024-12-04 20:34:44,580] Trial 1688 finished with value: 0.3592113113638398 and parameters: {'kernel_type': 'Matern', 'length_scale': 26.027365504420562, 'noise_level': 0.6813161974556404, 'constant_value': 50.982659505033844, 'nu': 0.5}. Best is trial 881 with value: 0.35916990930150405.
[I 2024-12-04 20:34:44,944] Trial 1690 finished with value: 0.35921121053598887 and parameters: {'kernel_type': 'Matern', 'length_scale': 33.35411993706041, 'noise_level': 0.0355043721904823, 'constant_value': 9.112448886750707, 'nu': 0.5}. Best is trial 881 with value: 0.35916990930150405.
[I 2024-12-04 20:34:49,727] Trial 1691 finished with value: 0.35921124667422605 and parameters: {'kernel_type': 'Matern', 'length_scale': 83692.63459042851, 'noise_level': 0.43580139393751294, 'constant_value': 78437.2210679488, 'nu': 0.5}. Best is trial 881 with value: 0.35916990930150405.
[I 2024-12-04 20:34:49,732] Trial 1693 finished with value: 0.35921118654062245 and parameters: {'kernel_type': 'Matern', 'length_scale': 4.835369424862863, 'noise_level': 0.003979258852614548, 'constant_value': 20.24062302534153, 'nu': 0.5}. Best is trial 881 with value: 0.35916990930150405.
[I 2024-12-04 20:34:49,777] Trial 1692 finished with value: 0.35921124039561836 and parameters: {'kernel_type': 'Matern', 'length_scale': 460.6529078554702, 'noise_level': 0.02507430890430303, 'constant_value': 185.60805179070687, 'nu': 0.5}. Best is trial 881 with value: 0.35916990930150405.
[I 2024-12-04 20:34:54,390] Trial 1696 finished with value: 0.3592111686655191 and parameters: {'kernel_type': 'Matern', 'length_scale': 1.7222418976773166, 'noise_level': 0.0012927174746259732, 'constant_value': 76.38121732435322, 'nu': 0.5}. Best is trial 881 with value: 0.35916990930150405.
[I 2024-12-04 20:34:54,393] Trial 1695 finished with value: 0.3592111171908424 and parameters: {'kernel_type': 'Matern', 'length_scale': 1.1986243660383264, 'noise_level': 0.04083875131007426, 'constant_value': 0.609737634174702, 'nu': 0.5}. Best is trial 881 with value: 0.35916990930150405.
[I 2024-12-04 20:34:55,955] Trial 1694 finished with value: 1.062416117337974 and parameters: {'kernel_type': 'Matern', 'length_scale': 95.0807808824755, 'noise_level': 0.013375301071239165, 'constant_value': 1.0232963525726217, 'nu': 2.5}. Best is trial 881 with value: 0.35916990930150405.
[I 2024-12-04 20:34:58,758] Trial 1698 finished with value: 1.0624161172606856 and parameters: {'kernel_type': 'Matern', 'length_scale': 0.004056849682371628, 'noise_level': 0.8865630512741688, 'constant_value': 9.986186741840536, 'nu': 2.5}. Best is trial 881 with value: 0.35916990930150405.
[I 2024-12-04 20:35:00,278] Trial 1697 finished with value: 0.35921152691983466 and parameters: {'kernel_type': 'Matern', 'length_scale': 9.419241837859303, 'noise_level': 0.016409995930942885, 'constant_value': 105.65356865521635, 'nu': 0.5}. Best is trial 881 with value: 0.35916990930150405.
[I 2024-12-04 20:35:00,369] Trial 1699 finished with value: 0.35921123193841753 and parameters: {'kernel_type': 'Matern', 'length_scale': 495.7141637255375, 'noise_level': 0.045564132735793954, 'constant_value': 67.32160069026415, 'nu': 0.5}. Best is trial 881 with value: 0.35916990930150405.
[I 2024-12-04 20:35:03,671] Trial 1702 finished with value: 1.0916558655424449 and parameters: {'kernel_type': 'Matern', 'length_scale': 2.4101192884464298, 'noise_level': 1.1001047998822075e-05, 'constant_value': 13.599134642829098, 'nu': 0.5}. Best is trial 881 with value: 0.35916990930150405.
[I 2024-12-04 20:35:06,549] Trial 1700 finished with value: 0.3592112416492962 and parameters: {'kernel_type': 'Matern', 'length_scale': 0.09843381496823389, 'noise_level': 0.0017276455220880849, 'constant_value': 0.12121766114897393, 'nu': 0.5}. Best is trial 881 with value: 0.35916990930150405.
[I 2024-12-04 20:35:06,881] Trial 1701 finished with value: 1.0624161172454383 and parameters: {'kernel_type': 'Matern', 'length_scale': 0.003711724460766211, 'noise_level': 0.0010577018166527715, 'constant_value': 48107.45334749679, 'nu': 1.5}. Best is trial 881 with value: 0.35916990930150405.
[I 2024-12-04 20:35:07,487] Trial 1703 finished with value: 1.06241611715564 and parameters: {'kernel_type': 'Matern', 'length_scale': 0.04589920475643278, 'noise_level': 0.0008423291528905976, 'constant_value': 165.24617247696176, 'nu': 0.5}. Best is trial 881 with value: 0.35916990930150405.
[I 2024-12-04 20:35:10,072] Trial 1704 finished with value: 1.0624158542325715 and parameters: {'kernel_type': 'Matern', 'length_scale': 0.06843632557036934, 'noise_level': 0.018721070555076227, 'constant_value': 16.596817810774844, 'nu': 0.5}. Best is trial 881 with value: 0.35916990930150405.
[I 2024-12-04 20:35:10,076] Trial 1706 finished with value: 1.0916567285210481 and parameters: {'kernel_type': 'Matern', 'length_scale': 0.883972486723721, 'noise_level': 0.007254642269976973, 'constant_value': 114.70806341142635, 'nu': 1.5}. Best is trial 881 with value: 0.35916990930150405.
[I 2024-12-04 20:35:12,157] Trial 1705 finished with value: 0.35921122868313715 and parameters: {'kernel_type': 'Matern', 'length_scale': 2448.210310149184, 'noise_level': 0.7325308671243844, 'constant_value': 197.28619035345596, 'nu': 0.5}. Best is trial 881 with value: 0.35916990930150405.
[I 2024-12-04 20:35:15,115] Trial 1708 finished with value: 0.3592108639324885 and parameters: {'kernel_type': 'Matern', 'length_scale': 4.067247543234861, 'noise_level': 0.019657594530465086, 'constant_value': 5.449157839779943, 'nu': 0.5}. Best is trial 881 with value: 0.35916990930150405.
[I 2024-12-04 20:35:15,938] Trial 1707 finished with value: 0.359211249706608 and parameters: {'kernel_type': 'Matern', 'length_scale': 32.39802608250674, 'noise_level': 0.01243496448697195, 'constant_value': 1.0007154916897854, 'nu': 0.5}. Best is trial 881 with value: 0.35916990930150405.
[I 2024-12-04 20:35:17,274] Trial 1709 finished with value: 0.3592112368547249 and parameters: {'kernel_type': 'Matern', 'length_scale': 3.0530952675761256, 'noise_level': 0.9840824212733232, 'constant_value': 77.52600252908712, 'nu': 0.5}. Best is trial 881 with value: 0.35916990930150405.
[I 2024-12-04 20:35:19,182] Trial 1711 finished with value: 1.0916558493888786 and parameters: {'kernel_type': 'RBF', 'length_scale': 1.130781217594948e-05, 'noise_level': 1.2009560371118164e-10, 'constant_value': 22.371292086254567, 'nu': 0.5}. Best is trial 881 with value: 0.35916990930150405.
[I 2024-12-04 20:35:20,300] Trial 1710 finished with value: 0.3592113341517607 and parameters: {'kernel_type': 'Matern', 'length_scale': 547.2682221020596, 'noise_level': 0.0030172739657167423, 'constant_value': 88.95515311916124, 'nu': 0.5}. Best is trial 881 with value: 0.35916990930150405.
[I 2024-12-04 20:35:24,085] Trial 1712 finished with value: 0.35921125082599603 and parameters: {'kernel_type': 'Matern', 'length_scale': 15.085115890443692, 'noise_level': 0.0005351930355875189, 'constant_value': 0.17774076867731842, 'nu': 0.5}. Best is trial 881 with value: 0.35916990930150405.
[I 2024-12-04 20:35:24,576] Trial 1713 finished with value: 0.359211358164515 and parameters: {'kernel_type': 'Matern', 'length_scale': 11.201681980510694, 'noise_level': 0.9263946449337986, 'constant_value': 70.97048886315245, 'nu': 0.5}. Best is trial 881 with value: 0.35916990930150405.
[I 2024-12-04 20:35:25,991] Trial 1714 finished with value: 0.35920941746102114 and parameters: {'kernel_type': 'Matern', 'length_scale': 24.23770352222347, 'noise_level': 0.0651640111193757, 'constant_value': 186.1892107230198, 'nu': 0.5}. Best is trial 881 with value: 0.35916990930150405.
[I 2024-12-04 20:35:29,528] Trial 1716 finished with value: 0.359211222653729 and parameters: {'kernel_type': 'Matern', 'length_scale': 243.1577650245687, 'noise_level': 0.686962134020674, 'constant_value': 201.07103855357798, 'nu': 0.5}. Best is trial 881 with value: 0.35916990930150405.
[I 2024-12-04 20:35:29,630] Trial 1715 finished with value: 0.3592112403887907 and parameters: {'kernel_type': 'Matern', 'length_scale': 30.670198907812736, 'noise_level': 0.0010594928802804165, 'constant_value': 44.922672447294104, 'nu': 0.5}. Best is trial 881 with value: 0.35916990930150405.
[I 2024-12-04 20:35:31,726] Trial 1717 finished with value: 0.35921509443311644 and parameters: {'kernel_type': 'Matern', 'length_scale': 70.37969378688263, 'noise_level': 0.005835482054888865, 'constant_value': 98.27840849394383, 'nu': 0.5}. Best is trial 881 with value: 0.35916990930150405.
[I 2024-12-04 20:35:35,454] Trial 1719 finished with value: 0.35921118053893325 and parameters: {'kernel_type': 'Matern', 'length_scale': 51.000041200370816, 'noise_level': 0.021184063810980328, 'constant_value': 1851.447849206841, 'nu': 0.5}. Best is trial 881 with value: 0.35916990930150405.
[I 2024-12-04 20:35:37,528] Trial 1720 finished with value: 0.35920992670761276 and parameters: {'kernel_type': 'Matern', 'length_scale': 2.6951403957959212, 'noise_level': 0.05161016952395633, 'constant_value': 83.8988011576214, 'nu': 0.5}. Best is trial 881 with value: 0.35916990930150405.
[I 2024-12-04 20:35:38,921] Trial 1718 finished with value: 0.4286836625991138 and parameters: {'kernel_type': 'RBF', 'length_scale': 17.336715296930233, 'noise_level': 0.0018000175919339622, 'constant_value': 361.05012605800556, 'nu': 0.5}. Best is trial 881 with value: 0.35916990930150405.
[I 2024-12-04 20:35:40,835] Trial 1721 finished with value: 1.0916558493900779 and parameters: {'kernel_type': 'RBF', 'length_scale': 0.1617916174825698, 'noise_level': 3.5072935140098407e-07, 'constant_value': 4.159614158857066, 'nu': 0.5}. Best is trial 881 with value: 0.35916990930150405.
[I 2024-12-04 20:35:43,175] Trial 1722 finished with value: 0.35921051736699633 and parameters: {'kernel_type': 'Matern', 'length_scale': 54.309338080828404, 'noise_level': 0.05149487493295098, 'constant_value': 3.557989995961537, 'nu': 0.5}. Best is trial 881 with value: 0.35916990930150405.
[I 2024-12-04 20:35:45,600] Trial 1723 finished with value: 0.3592112266689949 and parameters: {'kernel_type': 'Matern', 'length_scale': 248.53697936668374, 'noise_level': 0.9225713774486181, 'constant_value': 658.8521490375821, 'nu': 0.5}. Best is trial 881 with value: 0.35916990930150405.
[I 2024-12-04 20:35:46,539] Trial 1724 finished with value: 0.41956565706400484 and parameters: {'kernel_type': 'Matern', 'length_scale': 25.224911046169286, 'noise_level': 0.43825474457334795, 'constant_value': 52.162707337801415, 'nu': 2.5}. Best is trial 881 with value: 0.35916990930150405.
[I 2024-12-04 20:35:48,536] Trial 1725 finished with value: 0.3592112813503497 and parameters: {'kernel_type': 'Matern', 'length_scale': 19550.508210136923, 'noise_level': 0.023635733464427693, 'constant_value': 13.351948414625607, 'nu': 0.5}. Best is trial 881 with value: 0.35916990930150405.
[I 2024-12-04 20:35:50,297] Trial 1726 finished with value: 0.35921294025003186 and parameters: {'kernel_type': 'Matern', 'length_scale': 11.126214731344756, 'noise_level': 0.012374219123804852, 'constant_value': 21.517779063671274, 'nu': 0.5}. Best is trial 881 with value: 0.35916990930150405.
[I 2024-12-04 20:35:51,174] Trial 1728 finished with value: 1.0916567048549877 and parameters: {'kernel_type': 'Matern', 'length_scale': 2.8254675195193126, 'noise_level': 0.007447638283885638, 'constant_value': 117.90279064724791, 'nu': 0.5}. Best is trial 881 with value: 0.35916990930150405.
[I 2024-12-04 20:35:51,268] Trial 1727 finished with value: 0.3592112434433409 and parameters: {'kernel_type': 'Matern', 'length_scale': 69.37986743593892, 'noise_level': 0.07329581420820781, 'constant_value': 234.50340768126782, 'nu': 0.5}. Best is trial 881 with value: 0.35916990930150405.
[I 2024-12-04 20:35:55,806] Trial 1729 finished with value: 0.35921116510295503 and parameters: {'kernel_type': 'Matern', 'length_scale': 5.363618178001973, 'noise_level': 0.11173060070112423, 'constant_value': 196.0711632923311, 'nu': 0.5}. Best is trial 881 with value: 0.35916990930150405.
[I 2024-12-04 20:35:56,508] Trial 1730 finished with value: 0.3592112877240282 and parameters: {'kernel_type': 'Matern', 'length_scale': 42.66906907571901, 'noise_level': 0.9638908068362801, 'constant_value': 5.761729323748474, 'nu': 0.5}. Best is trial 881 with value: 0.35916990930150405.
[I 2024-12-04 20:35:56,737] Trial 1731 finished with value: 0.3592112975138422 and parameters: {'kernel_type': 'Matern', 'length_scale': 19.31308105221229, 'noise_level': 0.8492392678122253, 'constant_value': 33.069564139499306, 'nu': 0.5}. Best is trial 881 with value: 0.35916990930150405.
[I 2024-12-04 20:35:59,464] Trial 1732 finished with value: 1.0624158865254902 and parameters: {'kernel_type': 'Matern', 'length_scale': 0.06783369148860378, 'noise_level': 0.1540692610997497, 'constant_value': 337.18041656817917, 'nu': 0.5}. Best is trial 881 with value: 0.35916990930150405.
[I 2024-12-04 20:36:01,199] Trial 1734 finished with value: 0.4286834247744386 and parameters: {'kernel_type': 'RBF', 'length_scale': 110.36967245728819, 'noise_level': 0.04952986913418798, 'constant_value': 72.22898814108814, 'nu': 0.5}. Best is trial 881 with value: 0.35916990930150405.
[I 2024-12-04 20:36:01,475] Trial 1733 finished with value: 0.3592112344973893 and parameters: {'kernel_type': 'Matern', 'length_scale': 200.05230266874747, 'noise_level': 0.0007791613640747812, 'constant_value': 181.37707131226801, 'nu': 0.5}. Best is trial 881 with value: 0.35916990930150405.
[I 2024-12-04 20:36:04,580] Trial 1735 finished with value: 0.35921097989448825 and parameters: {'kernel_type': 'Matern', 'length_scale': 4.704333560251496, 'noise_level': 0.03636045610767841, 'constant_value': 297.2432913936795, 'nu': 0.5}. Best is trial 881 with value: 0.35916990930150405.
[I 2024-12-04 20:36:05,959] Trial 1736 finished with value: 0.35921125260670717 and parameters: {'kernel_type': 'Matern', 'length_scale': 3.7354540795476865, 'noise_level': 0.020009111526342747, 'constant_value': 25.80713245596465, 'nu': 0.5}. Best is trial 881 with value: 0.35916990930150405.
[I 2024-12-04 20:36:07,879] Trial 1737 finished with value: 1.0624161175034919 and parameters: {'kernel_type': 'Matern', 'length_scale': 13598.235669631502, 'noise_level': 0.001108620520655004, 'constant_value': 0.9281725146721247, 'nu': 0.5}. Best is trial 881 with value: 0.35916990930150405.
[I 2024-12-04 20:36:09,537] Trial 1739 finished with value: 1.091655849388758 and parameters: {'kernel_type': 'Matern', 'length_scale': 4.5070334425665756e-05, 'noise_level': 4.301016668718314e-08, 'constant_value': 71.50460288475612, 'nu': 2.5}. Best is trial 881 with value: 0.35916990930150405.
[I 2024-12-04 20:36:10,294] Trial 1738 finished with value: 1.0624161172549014 and parameters: {'kernel_type': 'Matern', 'length_scale': 549.7311302519456, 'noise_level': 0.010629908837705685, 'constant_value': 0.42827907258100406, 'nu': 0.5}. Best is trial 881 with value: 0.35916990930150405.
[I 2024-12-04 20:36:13,387] Trial 1740 finished with value: 0.35921127578303 and parameters: {'kernel_type': 'Matern', 'length_scale': 16297.415985570993, 'noise_level': 0.04107895427084621, 'constant_value': 442.40395889091326, 'nu': 0.5}. Best is trial 881 with value: 0.35916990930150405.
[I 2024-12-04 20:36:13,903] Trial 1742 finished with value: 1.091655849375604 and parameters: {'kernel_type': 'Matern', 'length_scale': 0.00034956148477437236, 'noise_level': 0.0001530154403360814, 'constant_value': 31537.82651164071, 'nu': 2.5}. Best is trial 881 with value: 0.35916990930150405.
[I 2024-12-04 20:36:15,118] Trial 1741 finished with value: 0.42268984696507855 and parameters: {'kernel_type': 'Matern', 'length_scale': 40.59822366344183, 'noise_level': 0.09475731173448419, 'constant_value': 4.347022378042097, 'nu': 1.5}. Best is trial 881 with value: 0.35916990930150405.
[I 2024-12-04 20:36:18,530] Trial 1743 finished with value: 0.3592110669661285 and parameters: {'kernel_type': 'Matern', 'length_scale': 72.46024027769852, 'noise_level': 0.055719297002812335, 'constant_value': 80.16535784687554, 'nu': 0.5}. Best is trial 881 with value: 0.35916990930150405.
[I 2024-12-04 20:36:21,523] Trial 1745 finished with value: 0.35921304894004796 and parameters: {'kernel_type': 'Matern', 'length_scale': 204.02624507055896, 'noise_level': 0.010748234361735104, 'constant_value': 3060.536752157825, 'nu': 0.5}. Best is trial 881 with value: 0.35916990930150405.
