[I 2024-12-04 20:00:10,563] Trial 631 finished with value: 0.3592109306678135 and parameters: {'kernel_type': 'Matern', 'length_scale': 0.5346614466876477, 'noise_level': 0.0009039538721865053, 'constant_value': 95396.44127691477, 'nu': 0.5}. Best is trial 448 with value: 0.3592093758005386.
[I 2024-12-04 20:00:12,558] Trial 632 finished with value: 0.3592105909817195 and parameters: {'kernel_type': 'Matern', 'length_scale': 7.563895959541276, 'noise_level': 0.015502173207740244, 'constant_value': 7.4118366003085345, 'nu': 0.5}. Best is trial 448 with value: 0.3592093758005386.
[I 2024-12-04 20:00:15,547] Trial 633 finished with value: 0.4226898072148974 and parameters: {'kernel_type': 'Matern', 'length_scale': 129.28714747479623, 'noise_level': 0.002840413898968353, 'constant_value': 3808.6299836729654, 'nu': 1.5}. Best is trial 448 with value: 0.3592093758005386.
[I 2024-12-04 20:00:16,021] Trial 634 finished with value: 0.35921128320757095 and parameters: {'kernel_type': 'Matern', 'length_scale': 3.584167111220532, 'noise_level': 0.7551674778056817, 'constant_value': 85448.57015543093, 'nu': 0.5}. Best is trial 448 with value: 0.3592093758005386.
[I 2024-12-04 20:00:17,454] Trial 635 finished with value: 0.35921122649484283 and parameters: {'kernel_type': 'Matern', 'length_scale': 24.48658739901378, 'noise_level': 0.08826832146071191, 'constant_value': 12.5869952894131, 'nu': 0.5}. Best is trial 448 with value: 0.3592093758005386.
[I 2024-12-04 20:00:20,291] Trial 636 finished with value: 0.3592112403747017 and parameters: {'kernel_type': 'Matern', 'length_scale': 1.4388386729958325, 'noise_level': 0.04497906750863937, 'constant_value': 13.94317011573669, 'nu': 0.5}. Best is trial 448 with value: 0.3592093758005386.
[I 2024-12-04 20:00:21,070] Trial 637 finished with value: 0.35921120072602036 and parameters: {'kernel_type': 'Matern', 'length_scale': 19.69984154542172, 'noise_level': 0.9861769550048171, 'constant_value': 0.8083472498704195, 'nu': 0.5}. Best is trial 448 with value: 0.3592093758005386.
[I 2024-12-04 20:00:24,217] Trial 638 finished with value: 1.062416117403295 and parameters: {'kernel_type': 'Matern', 'length_scale': 349.6113870435897, 'noise_level': 0.010852447582589816, 'constant_value': 0.052335252403351795, 'nu': 0.5}. Best is trial 448 with value: 0.3592093758005386.
[I 2024-12-04 20:00:25,466] Trial 639 finished with value: 0.35921110934728684 and parameters: {'kernel_type': 'Matern', 'length_scale': 10.836739986218898, 'noise_level': 0.6237363083318881, 'constant_value': 67.16331648047836, 'nu': 0.5}. Best is trial 448 with value: 0.3592093758005386.
[I 2024-12-04 20:00:25,906] Trial 640 finished with value: 0.3592111666872778 and parameters: {'kernel_type': 'Matern', 'length_scale': 1.7239548006156202, 'noise_level': 0.0138508248850351, 'constant_value': 0.025619800632989086, 'nu': 0.5}. Best is trial 448 with value: 0.3592093758005386.
[I 2024-12-04 20:00:29,647] Trial 642 finished with value: 1.0624161138492605 and parameters: {'kernel_type': 'Matern', 'length_scale': 0.03832433230783641, 'noise_level': 0.0013150956785017045, 'constant_value': 21.945261478214828, 'nu': 1.5}. Best is trial 448 with value: 0.3592093758005386.
[I 2024-12-04 20:00:30,511] Trial 641 finished with value: 0.4286825403582616 and parameters: {'kernel_type': 'RBF', 'length_scale': 376.2024517712853, 'noise_level': 0.6595870723358978, 'constant_value': 0.5142940119848813, 'nu': 1.5}. Best is trial 448 with value: 0.3592093758005386.
[I 2024-12-04 20:00:31,930] Trial 643 finished with value: 0.3592112415164109 and parameters: {'kernel_type': 'Matern', 'length_scale': 0.24404795739377533, 'noise_level': 0.0015898013932822293, 'constant_value': 1.8824986078008803, 'nu': 0.5}. Best is trial 448 with value: 0.3592093758005386.
[I 2024-12-04 20:00:34,714] Trial 644 finished with value: 0.35921171583888 and parameters: {'kernel_type': 'Matern', 'length_scale': 2.1929533535532317, 'noise_level': 0.010579529758371451, 'constant_value': 4.689670609007738, 'nu': 0.5}. Best is trial 448 with value: 0.3592093758005386.
[I 2024-12-04 20:00:36,010] Trial 645 finished with value: 0.3592111591773528 and parameters: {'kernel_type': 'Matern', 'length_scale': 1.3380202721477301, 'noise_level': 0.020637326414597302, 'constant_value': 93.16615529450634, 'nu': 0.5}. Best is trial 448 with value: 0.3592093758005386.
[I 2024-12-04 20:00:37,318] Trial 646 finished with value: 0.3592113192766773 and parameters: {'kernel_type': 'Matern', 'length_scale': 17.310290435152165, 'noise_level': 0.05651540764476492, 'constant_value': 0.42513317855969246, 'nu': 0.5}. Best is trial 448 with value: 0.3592093758005386.
[I 2024-12-04 20:00:44,873] Trial 647 finished with value: 0.35921096307025785 and parameters: {'kernel_type': 'Matern', 'length_scale': 99.32823802202911, 'noise_level': 0.7185807973448286, 'constant_value': 1.3011801602623738, 'nu': 0.5}. Best is trial 448 with value: 0.3592093758005386.
[I 2024-12-04 20:00:47,133] Trial 649 finished with value: 1.0624161172318554 and parameters: {'kernel_type': 'Matern', 'length_scale': 0.009416638222388774, 'noise_level': 0.018760234637734463, 'constant_value': 16287.845633645962, 'nu': 0.5}. Best is trial 448 with value: 0.3592093758005386.
[I 2024-12-04 20:00:48,105] Trial 648 finished with value: 1.0624161172621227 and parameters: {'kernel_type': 'Matern', 'length_scale': 489.4493858683184, 'noise_level': 0.005890264730433073, 'constant_value': 0.8914785454493743, 'nu': 1.5}. Best is trial 448 with value: 0.3592093758005386.
[I 2024-12-04 20:00:50,318] Trial 650 finished with value: 1.062416117266971 and parameters: {'kernel_type': 'RBF', 'length_scale': 0.00511868743257008, 'noise_level': 0.045868610634743436, 'constant_value': 21.857096182081772, 'nu': 1.5}. Best is trial 448 with value: 0.3592093758005386.
[I 2024-12-04 20:00:51,489] Trial 652 finished with value: 1.0916557586581124 and parameters: {'kernel_type': 'Matern', 'length_scale': 0.2004908733694455, 'noise_level': 2.228520534120172e-05, 'constant_value': 1002.4981460988463, 'nu': 0.5}. Best is trial 448 with value: 0.3592093758005386.
[I 2024-12-04 20:00:54,094] Trial 651 finished with value: 0.3592111973382303 and parameters: {'kernel_type': 'Matern', 'length_scale': 1145.1593741631305, 'noise_level': 0.13880608332936897, 'constant_value': 0.038223739687831715, 'nu': 0.5}. Best is trial 448 with value: 0.3592093758005386.
[I 2024-12-04 20:00:55,004] Trial 653 finished with value: 0.3592116697866404 and parameters: {'kernel_type': 'Matern', 'length_scale': 287.1074996959205, 'noise_level': 0.6773034434648749, 'constant_value': 27.959303178735492, 'nu': 0.5}. Best is trial 448 with value: 0.3592093758005386.
[I 2024-12-04 20:00:58,128] Trial 654 finished with value: 0.3592112374406785 and parameters: {'kernel_type': 'Matern', 'length_scale': 11.241828974787225, 'noise_level': 0.00998054298205042, 'constant_value': 1264.2714346185294, 'nu': 0.5}. Best is trial 448 with value: 0.3592093758005386.
[I 2024-12-04 20:01:02,811] Trial 656 finished with value: 1.062416117266109 and parameters: {'kernel_type': 'Matern', 'length_scale': 1885.723471094371, 'noise_level': 5.313107832812639e-06, 'constant_value': 0.0006050350506828707, 'nu': 1.5}. Best is trial 448 with value: 0.3592093758005386.
[I 2024-12-04 20:01:03,063] Trial 655 finished with value: 1.0624161172785591 and parameters: {'kernel_type': 'Matern', 'length_scale': 31.14018666646105, 'noise_level': 0.016912182879086968, 'constant_value': 0.016602412511646875, 'nu': 0.5}. Best is trial 448 with value: 0.3592093758005386.
[I 2024-12-04 20:01:07,071] Trial 659 finished with value: 1.0624150236795222 and parameters: {'kernel_type': 'Matern', 'length_scale': 0.07577734437681231, 'noise_level': 0.6010524349541455, 'constant_value': 299.17854104067396, 'nu': 0.5}. Best is trial 448 with value: 0.3592093758005386.
[I 2024-12-04 20:01:10,006] Trial 658 finished with value: 0.3592124989428245 and parameters: {'kernel_type': 'Matern', 'length_scale': 0.141464201118075, 'noise_level': 0.00011057992643311666, 'constant_value': 3.2429416869242202, 'nu': 0.5}. Best is trial 448 with value: 0.3592093758005386.
[I 2024-12-04 20:01:10,332] Trial 657 finished with value: 0.42868349947871126 and parameters: {'kernel_type': 'RBF', 'length_scale': 5.1295236004361415, 'noise_level': 0.5945820595531722, 'constant_value': 1.0709146505081828e-07, 'nu': 2.5}. Best is trial 448 with value: 0.3592093758005386.
[I 2024-12-04 20:01:12,484] Trial 660 finished with value: 1.091656727878586 and parameters: {'kernel_type': 'Matern', 'length_scale': 21496.77347432178, 'noise_level': 0.18664276803209862, 'constant_value': 1.5847285358222485, 'nu': 1.5}. Best is trial 448 with value: 0.3592093758005386.
[I 2024-12-04 20:01:14,807] Trial 661 finished with value: 0.359211245240237 and parameters: {'kernel_type': 'Matern', 'length_scale': 28.998164766559643, 'noise_level': 0.000989756743339624, 'constant_value': 1.2255200284956944, 'nu': 0.5}. Best is trial 448 with value: 0.3592093758005386.
[I 2024-12-04 20:01:16,087] Trial 663 finished with value: 0.42868351959495876 and parameters: {'kernel_type': 'RBF', 'length_scale': 0.5239560664032386, 'noise_level': 0.4450766920999513, 'constant_value': 93.55145142836557, 'nu': 0.5}. Best is trial 448 with value: 0.3592093758005386.
[I 2024-12-04 20:01:18,835] Trial 665 finished with value: 1.0916552101380834 and parameters: {'kernel_type': 'Matern', 'length_scale': 1.4210036371365327, 'noise_level': 1.4133745224407208e-06, 'constant_value': 1.919299815685183, 'nu': 0.5}. Best is trial 448 with value: 0.3592093758005386.
[I 2024-12-04 20:01:18,836] Trial 662 finished with value: 0.41956579437108243 and parameters: {'kernel_type': 'Matern', 'length_scale': 21.516772593085708, 'noise_level': 0.39207110873942913, 'constant_value': 0.00016038860893101173, 'nu': 2.5}. Best is trial 448 with value: 0.3592093758005386.
[I 2024-12-04 20:01:20,646] Trial 664 finished with value: 0.3592137773285796 and parameters: {'kernel_type': 'Matern', 'length_scale': 5124.8605324356295, 'noise_level': 0.40469820008765234, 'constant_value': 1.4423301990970447, 'nu': 0.5}. Best is trial 448 with value: 0.3592093758005386.
[I 2024-12-04 20:01:23,499] Trial 666 finished with value: 0.35921116734432934 and parameters: {'kernel_type': 'Matern', 'length_scale': 7.622346847862627, 'noise_level': 0.06290482524575257, 'constant_value': 0.6059893882354679, 'nu': 0.5}. Best is trial 448 with value: 0.3592093758005386.
[I 2024-12-04 20:01:23,870] Trial 667 finished with value: 0.35921124575813546 and parameters: {'kernel_type': 'Matern', 'length_scale': 10.76527603795282, 'noise_level': 0.7486192747462782, 'constant_value': 1.256592610966833, 'nu': 0.5}. Best is trial 448 with value: 0.3592093758005386.
[I 2024-12-04 20:01:25,637] Trial 668 finished with value: 0.35921113326546916 and parameters: {'kernel_type': 'Matern', 'length_scale': 43.56368932139782, 'noise_level': 0.01081712957338815, 'constant_value': 25.157421831528342, 'nu': 0.5}. Best is trial 448 with value: 0.3592093758005386.
[I 2024-12-04 20:01:28,014] Trial 669 finished with value: 0.3592114063820616 and parameters: {'kernel_type': 'Matern', 'length_scale': 1.0651309891263883, 'noise_level': 0.002804504856266199, 'constant_value': 178.91980525248732, 'nu': 0.5}. Best is trial 448 with value: 0.3592093758005386.
[I 2024-12-04 20:01:29,087] Trial 670 finished with value: 0.3592123485389548 and parameters: {'kernel_type': 'Matern', 'length_scale': 1106.7402262719004, 'noise_level': 0.04690917436191215, 'constant_value': 47.83212644544984, 'nu': 0.5}. Best is trial 448 with value: 0.3592093758005386.
[I 2024-12-04 20:01:29,331] Trial 671 finished with value: 1.0624161174449864 and parameters: {'kernel_type': 'Matern', 'length_scale': 64367.57671770166, 'noise_level': 1.4427012235216766e-09, 'constant_value': 16.21992789419804, 'nu': 0.5}. Best is trial 448 with value: 0.3592093758005386.
[I 2024-12-04 20:01:33,421] Trial 674 finished with value: 0.4195658475988116 and parameters: {'kernel_type': 'Matern', 'length_scale': 0.7268439013885165, 'noise_level': 0.0010724317855186087, 'constant_value': 63.0609728684197, 'nu': 2.5}. Best is trial 448 with value: 0.3592093758005386.
[I 2024-12-04 20:01:34,462] Trial 672 finished with value: 1.062416117909036 and parameters: {'kernel_type': 'Matern', 'length_scale': 284.7522041045398, 'noise_level': 0.008242209071356988, 'constant_value': 0.03990620884030414, 'nu': 0.5}. Best is trial 448 with value: 0.3592093758005386.
[I 2024-12-04 20:01:34,472] Trial 673 finished with value: 0.35921120751296765 and parameters: {'kernel_type': 'Matern', 'length_scale': 4.699140282009159, 'noise_level': 0.11103393464431793, 'constant_value': 484.0681877804386, 'nu': 0.5}. Best is trial 448 with value: 0.3592093758005386.
[I 2024-12-04 20:01:38,392] Trial 675 finished with value: 0.35921124062712134 and parameters: {'kernel_type': 'Matern', 'length_scale': 2.932007539602058, 'noise_level': 0.9669202991142815, 'constant_value': 19.959399271591437, 'nu': 0.5}. Best is trial 448 with value: 0.3592093758005386.
[I 2024-12-04 20:01:39,821] Trial 676 finished with value: 0.35921122462254074 and parameters: {'kernel_type': 'Matern', 'length_scale': 37.37447803341868, 'noise_level': 0.015362057034274084, 'constant_value': 5.617955690085739, 'nu': 0.5}. Best is trial 448 with value: 0.3592093758005386.
[I 2024-12-04 20:01:40,186] Trial 677 finished with value: 1.0624161172699944 and parameters: {'kernel_type': 'RBF', 'length_scale': 25.15055965717795, 'noise_level': 3.7011164371025734e-06, 'constant_value': 16.619187955737083, 'nu': 0.5}. Best is trial 448 with value: 0.3592093758005386.
[I 2024-12-04 20:01:44,583] Trial 680 finished with value: 0.42268978073519625 and parameters: {'kernel_type': 'Matern', 'length_scale': 7.555509329118511, 'noise_level': 0.5648284832976846, 'constant_value': 0.36980898066820334, 'nu': 1.5}. Best is trial 448 with value: 0.3592093758005386.
[I 2024-12-04 20:01:44,829] Trial 678 finished with value: 0.35921126548758614 and parameters: {'kernel_type': 'Matern', 'length_scale': 2.2471037662172098, 'noise_level': 0.030411115312811304, 'constant_value': 0.007078285483247275, 'nu': 0.5}. Best is trial 448 with value: 0.3592093758005386.
[I 2024-12-04 20:01:45,681] Trial 679 finished with value: 0.3592112709903728 and parameters: {'kernel_type': 'Matern', 'length_scale': 252.66780090034328, 'noise_level': 0.0037814075594916523, 'constant_value': 1.2232654995205159, 'nu': 0.5}. Best is trial 448 with value: 0.3592093758005386.
[I 2024-12-04 20:01:49,149] Trial 681 finished with value: 0.3592108312281625 and parameters: {'kernel_type': 'Matern', 'length_scale': 3.971856335347152, 'noise_level': 0.9776829836114853, 'constant_value': 0.05192264784931658, 'nu': 0.5}. Best is trial 448 with value: 0.3592093758005386.
[I 2024-12-04 20:01:50,262] Trial 682 finished with value: 0.35921122066168504 and parameters: {'kernel_type': 'Matern', 'length_scale': 10935.85021101532, 'noise_level': 0.5863817298047098, 'constant_value': 30.737966791807878, 'nu': 0.5}. Best is trial 448 with value: 0.3592093758005386.
[I 2024-12-04 20:01:52,230] Trial 683 finished with value: 0.35921060048893344 and parameters: {'kernel_type': 'Matern', 'length_scale': 463.49066906196737, 'noise_level': 0.6756068105309747, 'constant_value': 0.09479448519643968, 'nu': 0.5}. Best is trial 448 with value: 0.3592093758005386.
[I 2024-12-04 20:01:53,881] Trial 684 finished with value: 0.3592115203001827 and parameters: {'kernel_type': 'Matern', 'length_scale': 9.334039595964725, 'noise_level': 0.005525428391913728, 'constant_value': 0.7083614439139096, 'nu': 0.5}. Best is trial 448 with value: 0.3592093758005386.
[I 2024-12-04 20:01:56,326] Trial 685 finished with value: 0.3592112378847823 and parameters: {'kernel_type': 'Matern', 'length_scale': 117.7851558484518, 'noise_level': 0.6189999230044125, 'constant_value': 0.6717593325593285, 'nu': 0.5}. Best is trial 448 with value: 0.3592093758005386.
[I 2024-12-04 20:01:58,219] Trial 686 finished with value: 0.3592112284326805 and parameters: {'kernel_type': 'Matern', 'length_scale': 1128.7670293623437, 'noise_level': 0.14893682359729238, 'constant_value': 0.047516889507462946, 'nu': 0.5}. Best is trial 448 with value: 0.3592093758005386.
[I 2024-12-04 20:02:01,380] Trial 687 finished with value: 0.35921117271903874 and parameters: {'kernel_type': 'Matern', 'length_scale': 1365.5850995910273, 'noise_level': 0.21915017209745122, 'constant_value': 0.007090514731436743, 'nu': 0.5}. Best is trial 448 with value: 0.3592093758005386.
[I 2024-12-04 20:02:03,402] Trial 689 finished with value: 0.35920979054278196 and parameters: {'kernel_type': 'Matern', 'length_scale': 0.5429714691810513, 'noise_level': 0.04198661456721368, 'constant_value': 1489.4581158820208, 'nu': 0.5}. Best is trial 448 with value: 0.3592093758005386.
[I 2024-12-04 20:02:04,321] Trial 690 finished with value: 1.091655849319799 and parameters: {'kernel_type': 'Matern', 'length_scale': 0.0046452225147480325, 'noise_level': 0.006601086903519253, 'constant_value': 6.527141463384745, 'nu': 0.5}. Best is trial 448 with value: 0.3592093758005386.
[I 2024-12-04 20:02:11,075] Trial 692 finished with value: 1.062416117268919 and parameters: {'kernel_type': 'Matern', 'length_scale': 0.015247548093525012, 'noise_level': 0.040784361981530924, 'constant_value': 57470.31202692112, 'nu': 0.5}. Best is trial 448 with value: 0.3592093758005386.
[I 2024-12-04 20:02:11,076] Trial 691 finished with value: 0.35921108045360195 and parameters: {'kernel_type': 'Matern', 'length_scale': 0.7568597701860346, 'noise_level': 0.0034031926259841627, 'constant_value': 6770.51262084071, 'nu': 0.5}. Best is trial 448 with value: 0.3592093758005386.
[I 2024-12-04 20:02:12,514] Trial 688 finished with value: 1.0624161169552524 and parameters: {'kernel_type': 'Matern', 'length_scale': 15485.775456242185, 'noise_level': 0.18684120958854247, 'constant_value': 0.009659219240283587, 'nu': 0.5}. Best is trial 448 with value: 0.3592093758005386.
[I 2024-12-04 20:02:16,627] Trial 695 finished with value: 0.41956600372548486 and parameters: {'kernel_type': 'Matern', 'length_scale': 0.8240511344724696, 'noise_level': 0.275031884288695, 'constant_value': 243.66769580846918, 'nu': 2.5}. Best is trial 448 with value: 0.3592093758005386.
[I 2024-12-04 20:02:17,207] Trial 693 finished with value: 0.35921122019509194 and parameters: {'kernel_type': 'Matern', 'length_scale': 1.3839349468821054, 'noise_level': 0.02664290816862146, 'constant_value': 64464.541367039, 'nu': 0.5}. Best is trial 448 with value: 0.3592093758005386.
[I 2024-12-04 20:02:17,690] Trial 694 finished with value: 0.35921105994456887 and parameters: {'kernel_type': 'Matern', 'length_scale': 0.9905333828669796, 'noise_level': 0.015097030115889518, 'constant_value': 2256.2659426884534, 'nu': 0.5}. Best is trial 448 with value: 0.3592093758005386.
[I 2024-12-04 20:02:20,404] Trial 696 finished with value: 1.0624161066855176 and parameters: {'kernel_type': 'Matern', 'length_scale': 0.05612009452169608, 'noise_level': 0.0006795569943125723, 'constant_value': 63.38443049527657, 'nu': 0.5}. Best is trial 448 with value: 0.3592093758005386.
[I 2024-12-04 20:02:22,846] Trial 697 finished with value: 1.062416117179258 and parameters: {'kernel_type': 'RBF', 'length_scale': 5.126698996948782, 'noise_level': 6.073375146068296e-08, 'constant_value': 2.0977295341668123, 'nu': 2.5}. Best is trial 448 with value: 0.3592093758005386.
[I 2024-12-04 20:02:23,910] Trial 698 finished with value: 0.3592112582155165 and parameters: {'kernel_type': 'Matern', 'length_scale': 0.7173209398998034, 'noise_level': 0.3228639684331957, 'constant_value': 2039.0114712873437, 'nu': 0.5}. Best is trial 448 with value: 0.3592093758005386.
[I 2024-12-04 20:02:25,630] Trial 699 finished with value: 0.35921126398055503 and parameters: {'kernel_type': 'Matern', 'length_scale': 0.24389865763610194, 'noise_level': 0.49293685950717925, 'constant_value': 135.61819373885325, 'nu': 0.5}. Best is trial 448 with value: 0.3592093758005386.
[I 2024-12-04 20:02:27,404] Trial 701 finished with value: 1.0916567048549877 and parameters: {'kernel_type': 'Matern', 'length_scale': 1.8730444524295602, 'noise_level': 0.004733201566795956, 'constant_value': 1224.4067504666791, 'nu': 0.5}. Best is trial 448 with value: 0.3592093758005386.
[I 2024-12-04 20:02:29,588] Trial 700 finished with value: 0.35921129276886316 and parameters: {'kernel_type': 'Matern', 'length_scale': 0.15196286687986676, 'noise_level': 0.018286099237466817, 'constant_value': 47.48063959651976, 'nu': 0.5}. Best is trial 448 with value: 0.3592093758005386.
[I 2024-12-04 20:02:30,326] Trial 702 finished with value: 0.35921096417566284 and parameters: {'kernel_type': 'Matern', 'length_scale': 11.220445440895046, 'noise_level': 0.0004552727934964681, 'constant_value': 427.0384338618017, 'nu': 0.5}. Best is trial 448 with value: 0.3592093758005386.
[I 2024-12-04 20:02:33,858] Trial 703 finished with value: 0.35921121176092535 and parameters: {'kernel_type': 'Matern', 'length_scale': 13.244891687406787, 'noise_level': 0.020214039858741328, 'constant_value': 7347.558929042943, 'nu': 0.5}. Best is trial 448 with value: 0.3592093758005386.
[I 2024-12-04 20:02:37,120] Trial 704 finished with value: 0.3592112836843706 and parameters: {'kernel_type': 'Matern', 'length_scale': 143.83620081964054, 'noise_level': 0.9009655904228236, 'constant_value': 0.004596972696679277, 'nu': 0.5}. Best is trial 448 with value: 0.3592093758005386.
[I 2024-12-04 20:02:38,146] Trial 705 finished with value: 1.0624161174034104 and parameters: {'kernel_type': 'RBF', 'length_scale': 1.316143305288055e-05, 'noise_level': 1.022088539490981e-09, 'constant_value': 0.15057226976227364, 'nu': 1.5}. Best is trial 448 with value: 0.3592093758005386.
