[I 2024-12-04 12:31:07,248] Trial 479 finished with value: 0.4160720718879614 and parameters: {'n_estimators': 656, 'learning_rate': 0.020304809787549918, 'max_depth': 3, 'min_samples_split': 5, 'min_samples_leaf': 10, 'subsample': 0.9926983044567343, 'max_features': None}. Best is trial 431 with value: 0.2069782923650487.
[I 2024-12-04 12:31:10,949] Trial 465 finished with value: 0.22275479371995785 and parameters: {'n_estimators': 1435, 'learning_rate': 0.08221088827129899, 'max_depth': 12, 'min_samples_split': 15, 'min_samples_leaf': 1, 'subsample': 0.6569061700236128, 'max_features': 'sqrt'}. Best is trial 431 with value: 0.2069782923650487.
[I 2024-12-04 12:31:12,101] Trial 466 finished with value: 0.2510636867626939 and parameters: {'n_estimators': 1422, 'learning_rate': 0.06855237310911556, 'max_depth': 10, 'min_samples_split': 12, 'min_samples_leaf': 4, 'subsample': 0.7771158043485579, 'max_features': 'sqrt'}. Best is trial 431 with value: 0.2069782923650487.
[I 2024-12-04 12:31:12,105] Trial 470 finished with value: 0.2260840370998285 and parameters: {'n_estimators': 1177, 'learning_rate': 0.07427202745807762, 'max_depth': 10, 'min_samples_split': 17, 'min_samples_leaf': 1, 'subsample': 0.6067721830743497, 'max_features': 'sqrt'}. Best is trial 431 with value: 0.2069782923650487.
[I 2024-12-04 12:31:18,324] Trial 493 finished with value: 0.4182775195817983 and parameters: {'n_estimators': 281, 'learning_rate': 0.012288104107817712, 'max_depth': 9, 'min_samples_split': 20, 'min_samples_leaf': 10, 'subsample': 0.942851028883611, 'max_features': None}. Best is trial 431 with value: 0.2069782923650487.
[I 2024-12-04 12:31:20,497] Trial 472 finished with value: 0.23045975360505286 and parameters: {'n_estimators': 1327, 'learning_rate': 0.054291927661229346, 'max_depth': 11, 'min_samples_split': 13, 'min_samples_leaf': 1, 'subsample': 0.7925855268554562, 'max_features': 'sqrt'}. Best is trial 431 with value: 0.2069782923650487.
[I 2024-12-04 12:31:21,246] Trial 473 finished with value: 0.2355842111672146 and parameters: {'n_estimators': 1327, 'learning_rate': 0.09876455243186034, 'max_depth': 11, 'min_samples_split': 12, 'min_samples_leaf': 2, 'subsample': 0.7225947563329378, 'max_features': 'sqrt'}. Best is trial 431 with value: 0.2069782923650487.
[I 2024-12-04 12:31:24,433] Trial 474 finished with value: 0.21618523025935438 and parameters: {'n_estimators': 1370, 'learning_rate': 0.09898774134174362, 'max_depth': 11, 'min_samples_split': 19, 'min_samples_leaf': 1, 'subsample': 0.7927908219558714, 'max_features': 'sqrt'}. Best is trial 431 with value: 0.2069782923650487.
[I 2024-12-04 12:31:25,378] Trial 469 finished with value: 0.22468818989034733 and parameters: {'n_estimators': 1493, 'learning_rate': 0.07942575445276136, 'max_depth': 9, 'min_samples_split': 5, 'min_samples_leaf': 1, 'subsample': 0.767725769463965, 'max_features': 'sqrt'}. Best is trial 431 with value: 0.2069782923650487.
[I 2024-12-04 12:31:26,955] Trial 471 finished with value: 0.2531253944988224 and parameters: {'n_estimators': 1475, 'learning_rate': 0.08759040931173068, 'max_depth': 12, 'min_samples_split': 16, 'min_samples_leaf': 3, 'subsample': 0.8026419939942436, 'max_features': 'sqrt'}. Best is trial 431 with value: 0.2069782923650487.
[I 2024-12-04 12:31:27,415] Trial 499 finished with value: 0.373008872869694 and parameters: {'n_estimators': 344, 'learning_rate': 0.023315515073257014, 'max_depth': 8, 'min_samples_split': 20, 'min_samples_leaf': 1, 'subsample': 0.8951933750539516, 'max_features': 'sqrt'}. Best is trial 431 with value: 0.2069782923650487.
[I 2024-12-04 12:31:28,975] Trial 476 finished with value: 0.212632945144797 and parameters: {'n_estimators': 1395, 'learning_rate': 0.08172770821916203, 'max_depth': 11, 'min_samples_split': 16, 'min_samples_leaf': 1, 'subsample': 0.6123705412170108, 'max_features': 'sqrt'}. Best is trial 431 with value: 0.2069782923650487.
[I 2024-12-04 12:31:30,646] Trial 475 finished with value: 0.22536231214890629 and parameters: {'n_estimators': 1465, 'learning_rate': 0.05415358878904, 'max_depth': 12, 'min_samples_split': 14, 'min_samples_leaf': 1, 'subsample': 0.7452783336374278, 'max_features': 'sqrt'}. Best is trial 431 with value: 0.2069782923650487.
[I 2024-12-04 12:31:32,147] Trial 480 finished with value: 0.2978156670612596 and parameters: {'n_estimators': 1016, 'learning_rate': 0.012209459732598517, 'max_depth': 10, 'min_samples_split': 15, 'min_samples_leaf': 1, 'subsample': 0.7733139429149681, 'max_features': None}. Best is trial 431 with value: 0.2069782923650487.
[I 2024-12-04 12:31:33,203] Trial 500 finished with value: 0.37480606964532687 and parameters: {'n_estimators': 390, 'learning_rate': 0.013152768177140603, 'max_depth': 9, 'min_samples_split': 15, 'min_samples_leaf': 7, 'subsample': 0.7561914434982118, 'max_features': None}. Best is trial 431 with value: 0.2069782923650487.
[I 2024-12-04 12:31:35,650] Trial 504 finished with value: 0.8179441453331082 and parameters: {'n_estimators': 269, 'learning_rate': 0.022364382438007455, 'max_depth': 7, 'min_samples_split': 15, 'min_samples_leaf': 10, 'subsample': 0.9544447114475731, 'max_features': 'log2'}. Best is trial 431 with value: 0.2069782923650487.
[I 2024-12-04 12:31:36,724] Trial 478 finished with value: 0.23338615462361637 and parameters: {'n_estimators': 1485, 'learning_rate': 0.04473731629747215, 'max_depth': 12, 'min_samples_split': 10, 'min_samples_leaf': 2, 'subsample': 0.8016286503524644, 'max_features': 'sqrt'}. Best is trial 431 with value: 0.2069782923650487.
[I 2024-12-04 12:31:40,816] Trial 484 finished with value: 0.23587116012676498 and parameters: {'n_estimators': 1124, 'learning_rate': 0.0781968364291989, 'max_depth': 12, 'min_samples_split': 12, 'min_samples_leaf': 1, 'subsample': 0.8115299305925421, 'max_features': 'sqrt'}. Best is trial 431 with value: 0.2069782923650487.
[I 2024-12-04 12:31:41,523] Trial 477 finished with value: 0.265289267482502 and parameters: {'n_estimators': 1487, 'learning_rate': 0.048901711148889894, 'max_depth': 12, 'min_samples_split': 19, 'min_samples_leaf': 3, 'subsample': 0.6003012895063542, 'max_features': None}. Best is trial 431 with value: 0.2069782923650487.
[I 2024-12-04 12:31:42,114] Trial 505 finished with value: 0.34161787181002035 and parameters: {'n_estimators': 340, 'learning_rate': 0.0398772153260983, 'max_depth': 12, 'min_samples_split': 4, 'min_samples_leaf': 6, 'subsample': 0.8699848799236451, 'max_features': None}. Best is trial 431 with value: 0.2069782923650487.
[I 2024-12-04 12:31:44,454] Trial 485 finished with value: 0.238042409426904 and parameters: {'n_estimators': 1146, 'learning_rate': 0.06393873234949975, 'max_depth': 7, 'min_samples_split': 8, 'min_samples_leaf': 1, 'subsample': 0.7548880115207831, 'max_features': 'sqrt'}. Best is trial 431 with value: 0.2069782923650487.
[I 2024-12-04 12:31:49,332] Trial 483 finished with value: 0.22903047822106012 and parameters: {'n_estimators': 1353, 'learning_rate': 0.08351619491189878, 'max_depth': 11, 'min_samples_split': 12, 'min_samples_leaf': 1, 'subsample': 0.8016612851084449, 'max_features': 'sqrt'}. Best is trial 431 with value: 0.2069782923650487.
[I 2024-12-04 12:31:50,555] Trial 482 finished with value: 0.24143767420097967 and parameters: {'n_estimators': 1421, 'learning_rate': 0.06824426767198981, 'max_depth': 12, 'min_samples_split': 6, 'min_samples_leaf': 2, 'subsample': 0.7522473664685828, 'max_features': 'sqrt'}. Best is trial 431 with value: 0.2069782923650487.
[I 2024-12-04 12:31:51,442] Trial 486 finished with value: 0.22367386473321837 and parameters: {'n_estimators': 1260, 'learning_rate': 0.07579307962513372, 'max_depth': 10, 'min_samples_split': 12, 'min_samples_leaf': 1, 'subsample': 0.6406712785891068, 'max_features': 'sqrt'}. Best is trial 431 with value: 0.2069782923650487.
[I 2024-12-04 12:31:53,262] Trial 487 finished with value: 0.2200499980950957 and parameters: {'n_estimators': 1263, 'learning_rate': 0.08867843206220666, 'max_depth': 12, 'min_samples_split': 10, 'min_samples_leaf': 1, 'subsample': 0.6475285288564665, 'max_features': 'sqrt'}. Best is trial 431 with value: 0.2069782923650487.
[I 2024-12-04 12:31:55,698] Trial 481 finished with value: 0.3922649082706125 and parameters: {'n_estimators': 1488, 'learning_rate': 0.04012697955393243, 'max_depth': 3, 'min_samples_split': 11, 'min_samples_leaf': 9, 'subsample': 0.7278390079237953, 'max_features': None}. Best is trial 431 with value: 0.2069782923650487.
[I 2024-12-04 12:31:56,529] Trial 490 finished with value: 0.24108704868379152 and parameters: {'n_estimators': 1192, 'learning_rate': 0.09507796884130908, 'max_depth': 9, 'min_samples_split': 8, 'min_samples_leaf': 2, 'subsample': 0.7986553631104314, 'max_features': 'sqrt'}. Best is trial 431 with value: 0.2069782923650487.
[I 2024-12-04 12:31:57,910] Trial 496 finished with value: 0.23944705354004422 and parameters: {'n_estimators': 1042, 'learning_rate': 0.0614873904890802, 'max_depth': 8, 'min_samples_split': 4, 'min_samples_leaf': 1, 'subsample': 0.8439140540688087, 'max_features': 'sqrt'}. Best is trial 431 with value: 0.2069782923650487.
[I 2024-12-04 12:32:01,729] Trial 501 finished with value: 0.24464043349417716 and parameters: {'n_estimators': 937, 'learning_rate': 0.08373013093265327, 'max_depth': 12, 'min_samples_split': 12, 'min_samples_leaf': 3, 'subsample': 0.661222204067166, 'max_features': 'sqrt'}. Best is trial 431 with value: 0.2069782923650487.
[I 2024-12-04 12:32:02,546] Trial 488 finished with value: 0.22335524593255845 and parameters: {'n_estimators': 1449, 'learning_rate': 0.0795844280928245, 'max_depth': 10, 'min_samples_split': 18, 'min_samples_leaf': 1, 'subsample': 0.6335969870522278, 'max_features': 'sqrt'}. Best is trial 431 with value: 0.2069782923650487.
[I 2024-12-04 12:32:04,212] Trial 489 finished with value: 0.21274756496506012 and parameters: {'n_estimators': 1410, 'learning_rate': 0.09981688752162787, 'max_depth': 12, 'min_samples_split': 14, 'min_samples_leaf': 1, 'subsample': 0.6807426518412222, 'max_features': 'sqrt'}. Best is trial 431 with value: 0.2069782923650487.
[I 2024-12-04 12:32:06,114] Trial 512 finished with value: 0.5427887857894242 and parameters: {'n_estimators': 535, 'learning_rate': 0.022500815654181577, 'max_depth': 12, 'min_samples_split': 12, 'min_samples_leaf': 6, 'subsample': 0.9051747189765988, 'max_features': 'log2'}. Best is trial 431 with value: 0.2069782923650487.
[I 2024-12-04 12:32:08,111] Trial 497 finished with value: 0.24407714259753202 and parameters: {'n_estimators': 1216, 'learning_rate': 0.07371596950132996, 'max_depth': 12, 'min_samples_split': 9, 'min_samples_leaf': 3, 'subsample': 0.7510550507296445, 'max_features': 'sqrt'}. Best is trial 431 with value: 0.2069782923650487.
[I 2024-12-04 12:32:14,643] Trial 495 finished with value: 0.21369513012680524 and parameters: {'n_estimators': 1455, 'learning_rate': 0.09718819000632323, 'max_depth': 12, 'min_samples_split': 12, 'min_samples_leaf': 1, 'subsample': 0.7922954345534313, 'max_features': 'sqrt'}. Best is trial 431 with value: 0.2069782923650487.
[I 2024-12-04 12:32:14,743] Trial 494 finished with value: 0.2296548447200393 and parameters: {'n_estimators': 1496, 'learning_rate': 0.08779127012471033, 'max_depth': 8, 'min_samples_split': 10, 'min_samples_leaf': 1, 'subsample': 0.7614030390284392, 'max_features': 'sqrt'}. Best is trial 431 with value: 0.2069782923650487.
[I 2024-12-04 12:32:15,950] Trial 498 finished with value: 0.23675809688759752 and parameters: {'n_estimators': 1393, 'learning_rate': 0.07088995582857716, 'max_depth': 9, 'min_samples_split': 10, 'min_samples_leaf': 1, 'subsample': 0.7214359551738461, 'max_features': 'sqrt'}. Best is trial 431 with value: 0.2069782923650487.
[I 2024-12-04 12:32:18,171] Trial 506 finished with value: 0.3240685014046074 and parameters: {'n_estimators': 952, 'learning_rate': 0.0881048125932082, 'max_depth': 9, 'min_samples_split': 20, 'min_samples_leaf': 6, 'subsample': 0.6054113205725106, 'max_features': None}. Best is trial 431 with value: 0.2069782923650487.
[I 2024-12-04 12:32:18,198] Trial 492 finished with value: 0.26914679297817795 and parameters: {'n_estimators': 1402, 'learning_rate': 0.054952131987199185, 'max_depth': 11, 'min_samples_split': 11, 'min_samples_leaf': 1, 'subsample': 0.7617472186907537, 'max_features': None}. Best is trial 431 with value: 0.2069782923650487.
[I 2024-12-04 12:32:23,748] Trial 491 finished with value: 0.30181672503808205 and parameters: {'n_estimators': 1448, 'learning_rate': 0.07258455978844826, 'max_depth': 12, 'min_samples_split': 6, 'min_samples_leaf': 1, 'subsample': 0.7422556418366325, 'max_features': None}. Best is trial 431 with value: 0.2069782923650487.
[I 2024-12-04 12:32:23,933] Trial 502 finished with value: 0.2565838088862735 and parameters: {'n_estimators': 1434, 'learning_rate': 0.040998226939786164, 'max_depth': 12, 'min_samples_split': 7, 'min_samples_leaf': 1, 'subsample': 0.82513165684368, 'max_features': 'log2'}. Best is trial 431 with value: 0.2069782923650487.
[I 2024-12-04 12:32:26,097] Trial 507 finished with value: 0.2280698176248879 and parameters: {'n_estimators': 1179, 'learning_rate': 0.08795003219063138, 'max_depth': 10, 'min_samples_split': 20, 'min_samples_leaf': 1, 'subsample': 0.7640366472916201, 'max_features': 'sqrt'}. Best is trial 431 with value: 0.2069782923650487.
[I 2024-12-04 12:32:29,792] Trial 503 finished with value: 0.23861084993823048 and parameters: {'n_estimators': 1421, 'learning_rate': 0.09431888734879673, 'max_depth': 12, 'min_samples_split': 18, 'min_samples_leaf': 1, 'subsample': 0.6658906016438746, 'max_features': 'log2'}. Best is trial 431 with value: 0.2069782923650487.
[I 2024-12-04 12:32:30,771] Trial 508 finished with value: 0.21873922053954717 and parameters: {'n_estimators': 1199, 'learning_rate': 0.09880743892506018, 'max_depth': 12, 'min_samples_split': 15, 'min_samples_leaf': 1, 'subsample': 0.6287770258394818, 'max_features': 'sqrt'}. Best is trial 431 with value: 0.2069782923650487.
[I 2024-12-04 12:32:36,415] Trial 526 finished with value: 0.4189778170682769 and parameters: {'n_estimators': 663, 'learning_rate': 0.015166084151576728, 'max_depth': 5, 'min_samples_split': 13, 'min_samples_leaf': 2, 'subsample': 0.8367400986396241, 'max_features': 'sqrt'}. Best is trial 431 with value: 0.2069782923650487.
[I 2024-12-04 12:32:38,861] Trial 511 finished with value: 0.23023501361685703 and parameters: {'n_estimators': 1256, 'learning_rate': 0.09893777180982918, 'max_depth': 10, 'min_samples_split': 12, 'min_samples_leaf': 1, 'subsample': 0.7355602831110174, 'max_features': 'sqrt'}. Best is trial 431 with value: 0.2069782923650487.
[I 2024-12-04 12:32:40,874] Trial 513 finished with value: 0.2986613203854006 and parameters: {'n_estimators': 1090, 'learning_rate': 0.08332270912333448, 'max_depth': 12, 'min_samples_split': 13, 'min_samples_leaf': 5, 'subsample': 0.6095419588554235, 'max_features': None}. Best is trial 431 with value: 0.2069782923650487.
[I 2024-12-04 12:32:43,042] Trial 510 finished with value: 0.2468647200896343 and parameters: {'n_estimators': 1352, 'learning_rate': 0.08228087096013662, 'max_depth': 11, 'min_samples_split': 13, 'min_samples_leaf': 4, 'subsample': 0.9376148921527693, 'max_features': 'sqrt'}. Best is trial 431 with value: 0.2069782923650487.
[I 2024-12-04 12:32:44,135] Trial 515 finished with value: 0.3632428328354701 and parameters: {'n_estimators': 1083, 'learning_rate': 0.058165883477322176, 'max_depth': 9, 'min_samples_split': 10, 'min_samples_leaf': 9, 'subsample': 0.8593021748918533, 'max_features': None}. Best is trial 431 with value: 0.2069782923650487.
[I 2024-12-04 12:32:45,657] Trial 509 finished with value: 0.20551759698042563 and parameters: {'n_estimators': 1428, 'learning_rate': 0.09796576499875369, 'max_depth': 11, 'min_samples_split': 19, 'min_samples_leaf': 1, 'subsample': 0.606872816218357, 'max_features': 'sqrt'}. Best is trial 509 with value: 0.20551759698042563.
[I 2024-12-04 12:32:47,667] Trial 529 finished with value: 0.35322860821325575 and parameters: {'n_estimators': 732, 'learning_rate': 0.08307268029086225, 'max_depth': 3, 'min_samples_split': 2, 'min_samples_leaf': 1, 'subsample': 0.9678283731910008, 'max_features': 'log2'}. Best is trial 509 with value: 0.20551759698042563.
[I 2024-12-04 12:32:49,061] Trial 514 finished with value: 0.22750485787731917 and parameters: {'n_estimators': 1335, 'learning_rate': 0.06445968429449016, 'max_depth': 11, 'min_samples_split': 14, 'min_samples_leaf': 2, 'subsample': 0.6442944006869618, 'max_features': 'sqrt'}. Best is trial 509 with value: 0.20551759698042563.
[I 2024-12-04 12:32:53,318] Trial 518 finished with value: 0.22770229477974455 and parameters: {'n_estimators': 1271, 'learning_rate': 0.09049359334860667, 'max_depth': 11, 'min_samples_split': 19, 'min_samples_leaf': 2, 'subsample': 0.7909789017320673, 'max_features': 'sqrt'}. Best is trial 509 with value: 0.20551759698042563.
[I 2024-12-04 12:32:54,735] Trial 525 finished with value: 0.2322901191837303 and parameters: {'n_estimators': 988, 'learning_rate': 0.0841502193617743, 'max_depth': 11, 'min_samples_split': 10, 'min_samples_leaf': 1, 'subsample': 0.7476925965501479, 'max_features': 'sqrt'}. Best is trial 509 with value: 0.20551759698042563.
[I 2024-12-04 12:32:57,377] Trial 519 finished with value: 0.22422633789893195 and parameters: {'n_estimators': 1282, 'learning_rate': 0.09181587220959093, 'max_depth': 10, 'min_samples_split': 19, 'min_samples_leaf': 1, 'subsample': 0.7004913666694663, 'max_features': 'sqrt'}. Best is trial 509 with value: 0.20551759698042563.
[I 2024-12-04 12:32:57,469] Trial 520 finished with value: 0.2286297806934067 and parameters: {'n_estimators': 1207, 'learning_rate': 0.07923436863372438, 'max_depth': 12, 'min_samples_split': 18, 'min_samples_leaf': 1, 'subsample': 0.7532391626119357, 'max_features': 'sqrt'}. Best is trial 509 with value: 0.20551759698042563.
[I 2024-12-04 12:32:59,751] Trial 517 finished with value: 0.2333804246581894 and parameters: {'n_estimators': 1365, 'learning_rate': 0.09064113990207825, 'max_depth': 9, 'min_samples_split': 14, 'min_samples_leaf': 1, 'subsample': 0.6351358194785627, 'max_features': 'sqrt'}. Best is trial 509 with value: 0.20551759698042563.
[I 2024-12-04 12:33:02,974] Trial 516 finished with value: 0.2273479525134653 and parameters: {'n_estimators': 1474, 'learning_rate': 0.08800451289875384, 'max_depth': 11, 'min_samples_split': 12, 'min_samples_leaf': 1, 'subsample': 0.8629298401173155, 'max_features': 'sqrt'}. Best is trial 509 with value: 0.20551759698042563.
[I 2024-12-04 12:33:05,351] Trial 550 finished with value: 0.6599860175302958 and parameters: {'n_estimators': 140, 'learning_rate': 0.07193331488357828, 'max_depth': 6, 'min_samples_split': 4, 'min_samples_leaf': 6, 'subsample': 0.7594977045910024, 'max_features': 'log2'}. Best is trial 509 with value: 0.20551759698042563.
[I 2024-12-04 12:33:06,959] Trial 524 finished with value: 0.22657262715217186 and parameters: {'n_estimators': 1205, 'learning_rate': 0.08527642345919048, 'max_depth': 10, 'min_samples_split': 10, 'min_samples_leaf': 1, 'subsample': 0.7533118066880948, 'max_features': 'sqrt'}. Best is trial 509 with value: 0.20551759698042563.
[I 2024-12-04 12:33:09,776] Trial 521 finished with value: 0.25944209752565883 and parameters: {'n_estimators': 1390, 'learning_rate': 0.08634978369843385, 'max_depth': 10, 'min_samples_split': 11, 'min_samples_leaf': 3, 'subsample': 0.7157290493434959, 'max_features': 'sqrt'}. Best is trial 509 with value: 0.20551759698042563.
[I 2024-12-04 12:33:12,161] Trial 551 finished with value: 0.3672292722254265 and parameters: {'n_estimators': 208, 'learning_rate': 0.025805181392527597, 'max_depth': 9, 'min_samples_split': 4, 'min_samples_leaf': 6, 'subsample': 0.7078927190515135, 'max_features': None}. Best is trial 509 with value: 0.20551759698042563.
[I 2024-12-04 12:33:14,859] Trial 527 finished with value: 0.31181608021072216 and parameters: {'n_estimators': 1118, 'learning_rate': 0.09103261344821101, 'max_depth': 12, 'min_samples_split': 12, 'min_samples_leaf': 2, 'subsample': 0.7276087366707038, 'max_features': None}. Best is trial 509 with value: 0.20551759698042563.
[I 2024-12-04 12:33:15,382] Trial 522 finished with value: 0.2247098538323726 and parameters: {'n_estimators': 1446, 'learning_rate': 0.06360473694939545, 'max_depth': 12, 'min_samples_split': 6, 'min_samples_leaf': 1, 'subsample': 0.8249493195794049, 'max_features': 'sqrt'}. Best is trial 509 with value: 0.20551759698042563.
[I 2024-12-04 12:33:18,884] Trial 523 finished with value: 0.23679763249739647 and parameters: {'n_estimators': 1469, 'learning_rate': 0.08633767809895736, 'max_depth': 10, 'min_samples_split': 20, 'min_samples_leaf': 2, 'subsample': 0.7830655944656139, 'max_features': 'sqrt'}. Best is trial 509 with value: 0.20551759698042563.
[I 2024-12-04 12:33:23,024] Trial 556 finished with value: 0.3762876765295557 and parameters: {'n_estimators': 249, 'learning_rate': 0.08056387415510123, 'max_depth': 6, 'min_samples_split': 6, 'min_samples_leaf': 7, 'subsample': 0.9637883722166869, 'max_features': 'sqrt'}. Best is trial 509 with value: 0.20551759698042563.
[I 2024-12-04 12:33:29,087] Trial 531 finished with value: 0.22093535189138078 and parameters: {'n_estimators': 1367, 'learning_rate': 0.08517947999973678, 'max_depth': 11, 'min_samples_split': 17, 'min_samples_leaf': 1, 'subsample': 0.7030833424929721, 'max_features': 'sqrt'}. Best is trial 509 with value: 0.20551759698042563.
[I 2024-12-04 12:33:32,032] Trial 528 finished with value: 0.23503545866531908 and parameters: {'n_estimators': 1477, 'learning_rate': 0.09408336946703588, 'max_depth': 12, 'min_samples_split': 14, 'min_samples_leaf': 2, 'subsample': 0.6626300368233978, 'max_features': 'sqrt'}. Best is trial 509 with value: 0.20551759698042563.
