[I 2024-12-04 12:07:23,180] Trial 2366 finished with value: 0.8666968382247049 and parameters: {'max_depth': 35, 'min_samples_split': 2, 'min_samples_leaf': 3, 'max_features': 'sqrt', 'criterion': 'absolute_error', 'splitter': 'best'}. Best is trial 309 with value: 0.46729638362398634.
[I 2024-12-04 12:07:24,934] Trial 2358 finished with value: 1.3130149982826922 and parameters: {'max_depth': 15, 'min_samples_split': 12, 'min_samples_leaf': 10, 'max_features': 'sqrt', 'criterion': 'friedman_mse', 'splitter': 'random'}. Best is trial 309 with value: 0.46729638362398634.
[I 2024-12-04 12:07:25,317] Trial 2377 finished with value: 1.0479797941399644 and parameters: {'max_depth': 26, 'min_samples_split': 2, 'min_samples_leaf': 1, 'max_features': 'sqrt', 'criterion': 'absolute_error', 'splitter': 'best'}. Best is trial 309 with value: 0.46729638362398634.
[I 2024-12-04 12:07:25,669] Trial 2365 finished with value: 0.892506786592961 and parameters: {'max_depth': 14, 'min_samples_split': 20, 'min_samples_leaf': 5, 'max_features': 'sqrt', 'criterion': 'friedman_mse', 'splitter': 'best'}. Best is trial 309 with value: 0.46729638362398634.
[I 2024-12-04 12:07:25,713] Trial 2371 finished with value: 0.5958153346878527 and parameters: {'max_depth': 23, 'min_samples_split': 2, 'min_samples_leaf': 1, 'max_features': 'sqrt', 'criterion': 'absolute_error', 'splitter': 'best'}. Best is trial 309 with value: 0.46729638362398634.
[I 2024-12-04 12:07:25,715] Trial 2382 finished with value: 0.6553056943494796 and parameters: {'max_depth': 35, 'min_samples_split': 4, 'min_samples_leaf': 1, 'max_features': 'sqrt', 'criterion': 'absolute_error', 'splitter': 'best'}. Best is trial 309 with value: 0.46729638362398634.
[I 2024-12-04 12:07:26,313] Trial 2375 finished with value: 1.0479797941399644 and parameters: {'max_depth': 26, 'min_samples_split': 2, 'min_samples_leaf': 1, 'max_features': 'sqrt', 'criterion': 'absolute_error', 'splitter': 'best'}. Best is trial 309 with value: 0.46729638362398634.
[I 2024-12-04 12:07:27,308] Trial 2376 finished with value: 0.8666968382247049 and parameters: {'max_depth': 26, 'min_samples_split': 2, 'min_samples_leaf': 3, 'max_features': 'sqrt', 'criterion': 'absolute_error', 'splitter': 'best'}. Best is trial 309 with value: 0.46729638362398634.
[I 2024-12-04 12:07:27,618] Trial 2369 finished with value: 0.5861904649615429 and parameters: {'max_depth': 28, 'min_samples_split': 5, 'min_samples_leaf': 1, 'max_features': 'sqrt', 'criterion': 'absolute_error', 'splitter': 'best'}. Best is trial 309 with value: 0.46729638362398634.
[I 2024-12-04 12:07:29,106] Trial 2368 finished with value: 0.7169847047063859 and parameters: {'max_depth': 31, 'min_samples_split': 2, 'min_samples_leaf': 2, 'max_features': 'sqrt', 'criterion': 'absolute_error', 'splitter': 'best'}. Best is trial 309 with value: 0.46729638362398634.
[I 2024-12-04 12:07:29,124] Trial 2379 finished with value: 1.111989940503367 and parameters: {'max_depth': 29, 'min_samples_split': 5, 'min_samples_leaf': 2, 'max_features': 'sqrt', 'criterion': 'absolute_error', 'splitter': 'best'}. Best is trial 309 with value: 0.46729638362398634.
[I 2024-12-04 12:07:29,479] Trial 2378 finished with value: 0.6128215778007012 and parameters: {'max_depth': 30, 'min_samples_split': 5, 'min_samples_leaf': 1, 'max_features': 'sqrt', 'criterion': 'absolute_error', 'splitter': 'best'}. Best is trial 309 with value: 0.46729638362398634.
[I 2024-12-04 12:07:29,496] Trial 2374 finished with value: 0.46729638362398634 and parameters: {'max_depth': 31, 'min_samples_split': 2, 'min_samples_leaf': 1, 'max_features': 'sqrt', 'criterion': 'absolute_error', 'splitter': 'best'}. Best is trial 309 with value: 0.46729638362398634.
[I 2024-12-04 12:07:29,996] Trial 2393 finished with value: 0.5461587684201986 and parameters: {'max_depth': 30, 'min_samples_split': 2, 'min_samples_leaf': 1, 'max_features': 'sqrt', 'criterion': 'friedman_mse', 'splitter': 'best'}. Best is trial 309 with value: 0.46729638362398634.
[I 2024-12-04 12:07:30,725] Trial 2372 finished with value: 0.46729638362398634 and parameters: {'max_depth': 31, 'min_samples_split': 2, 'min_samples_leaf': 1, 'max_features': 'sqrt', 'criterion': 'absolute_error', 'splitter': 'best'}. Best is trial 309 with value: 0.46729638362398634.
[I 2024-12-04 12:07:30,747] Trial 2373 finished with value: 1.0235080961846112 and parameters: {'max_depth': 25, 'min_samples_split': 2, 'min_samples_leaf': 1, 'max_features': 'sqrt', 'criterion': 'absolute_error', 'splitter': 'best'}. Best is trial 309 with value: 0.46729638362398634.
[I 2024-12-04 12:07:31,637] Trial 2381 finished with value: 0.7238455884864453 and parameters: {'max_depth': 35, 'min_samples_split': 5, 'min_samples_leaf': 1, 'max_features': 'sqrt', 'criterion': 'absolute_error', 'splitter': 'best'}. Best is trial 309 with value: 0.46729638362398634.
[I 2024-12-04 12:07:31,803] Trial 2390 finished with value: 1.3014693347727373 and parameters: {'max_depth': 13, 'min_samples_split': 7, 'min_samples_leaf': 8, 'max_features': 'log2', 'criterion': 'friedman_mse', 'splitter': 'random'}. Best is trial 309 with value: 0.46729638362398634.
[I 2024-12-04 12:07:32,404] Trial 2385 finished with value: 0.46729638362398634 and parameters: {'max_depth': 31, 'min_samples_split': 2, 'min_samples_leaf': 1, 'max_features': 'sqrt', 'criterion': 'absolute_error', 'splitter': 'best'}. Best is trial 309 with value: 0.46729638362398634.
[I 2024-12-04 12:07:32,418] Trial 2392 finished with value: 0.8708264525584288 and parameters: {'max_depth': 31, 'min_samples_split': 20, 'min_samples_leaf': 6, 'max_features': 'sqrt', 'criterion': 'friedman_mse', 'splitter': 'random'}. Best is trial 309 with value: 0.46729638362398634.
[I 2024-12-04 12:07:32,573] Trial 2383 finished with value: 0.8666968382247049 and parameters: {'max_depth': 30, 'min_samples_split': 5, 'min_samples_leaf': 3, 'max_features': 'sqrt', 'criterion': 'absolute_error', 'splitter': 'best'}. Best is trial 309 with value: 0.46729638362398634.
[I 2024-12-04 12:07:33,327] Trial 2396 finished with value: 0.6732745951990393 and parameters: {'max_depth': 32, 'min_samples_split': 2, 'min_samples_leaf': 1, 'max_features': 'sqrt', 'criterion': 'absolute_error', 'splitter': 'random'}. Best is trial 309 with value: 0.46729638362398634.
[I 2024-12-04 12:07:34,284] Trial 2388 finished with value: 0.8666968382247049 and parameters: {'max_depth': 31, 'min_samples_split': 2, 'min_samples_leaf': 3, 'max_features': 'sqrt', 'criterion': 'absolute_error', 'splitter': 'best'}. Best is trial 309 with value: 0.46729638362398634.
[I 2024-12-04 12:07:34,687] Trial 2386 finished with value: 0.8666968382247049 and parameters: {'max_depth': 23, 'min_samples_split': 4, 'min_samples_leaf': 3, 'max_features': 'sqrt', 'criterion': 'absolute_error', 'splitter': 'best'}. Best is trial 309 with value: 0.46729638362398634.
[I 2024-12-04 12:07:34,697] Trial 2397 finished with value: 1.1470767797972166 and parameters: {'max_depth': 19, 'min_samples_split': 5, 'min_samples_leaf': 1, 'max_features': 'sqrt', 'criterion': 'absolute_error', 'splitter': 'best'}. Best is trial 309 with value: 0.46729638362398634.
[I 2024-12-04 12:07:35,305] Trial 2380 finished with value: 0.5209986636170143 and parameters: {'max_depth': 29, 'min_samples_split': 2, 'min_samples_leaf': 1, 'max_features': 'sqrt', 'criterion': 'absolute_error', 'splitter': 'best'}. Best is trial 309 with value: 0.46729638362398634.
[I 2024-12-04 12:07:35,390] Trial 2389 finished with value: 0.8666968382247049 and parameters: {'max_depth': 31, 'min_samples_split': 2, 'min_samples_leaf': 3, 'max_features': 'sqrt', 'criterion': 'absolute_error', 'splitter': 'best'}. Best is trial 309 with value: 0.46729638362398634.
[I 2024-12-04 12:07:35,564] Trial 2391 finished with value: 0.7238455884864453 and parameters: {'max_depth': 35, 'min_samples_split': 5, 'min_samples_leaf': 1, 'max_features': 'sqrt', 'criterion': 'absolute_error', 'splitter': 'best'}. Best is trial 309 with value: 0.46729638362398634.
[I 2024-12-04 12:07:36,200] Trial 2398 finished with value: 0.5680194359354153 and parameters: {'max_depth': 34, 'min_samples_split': 2, 'min_samples_leaf': 1, 'max_features': 'sqrt', 'criterion': 'absolute_error', 'splitter': 'best'}. Best is trial 309 with value: 0.46729638362398634.
[I 2024-12-04 12:07:36,764] Trial 2399 finished with value: 0.8666968382247049 and parameters: {'max_depth': 25, 'min_samples_split': 2, 'min_samples_leaf': 3, 'max_features': 'sqrt', 'criterion': 'absolute_error', 'splitter': 'best'}. Best is trial 309 with value: 0.46729638362398634.
[I 2024-12-04 12:07:37,265] Trial 2395 finished with value: 1.1212793074242344 and parameters: {'max_depth': 28, 'min_samples_split': 5, 'min_samples_leaf': 2, 'max_features': 'sqrt', 'criterion': 'absolute_error', 'splitter': 'best'}. Best is trial 309 with value: 0.46729638362398634.
[I 2024-12-04 12:07:37,682] Trial 2394 finished with value: 0.7188087833617175 and parameters: {'max_depth': 31, 'min_samples_split': 5, 'min_samples_leaf': 1, 'max_features': 'sqrt', 'criterion': 'absolute_error', 'splitter': 'best'}. Best is trial 309 with value: 0.46729638362398634.
[I 2024-12-04 12:07:37,717] Trial 2403 finished with value: 0.46729638362398634 and parameters: {'max_depth': 31, 'min_samples_split': 2, 'min_samples_leaf': 1, 'max_features': 'sqrt', 'criterion': 'absolute_error', 'splitter': 'best'}. Best is trial 309 with value: 0.46729638362398634.
[I 2024-12-04 12:07:38,495] Trial 2400 finished with value: 1.3014693347727373 and parameters: {'max_depth': 13, 'min_samples_split': 8, 'min_samples_leaf': 7, 'max_features': 'log2', 'criterion': 'squared_error', 'splitter': 'random'}. Best is trial 309 with value: 0.46729638362398634.
[I 2024-12-04 12:07:38,657] Trial 2384 finished with value: 0.5861904649615429 and parameters: {'max_depth': 28, 'min_samples_split': 5, 'min_samples_leaf': 1, 'max_features': 'sqrt', 'criterion': 'absolute_error', 'splitter': 'best'}. Best is trial 309 with value: 0.46729638362398634.
[I 2024-12-04 12:07:40,093] Trial 2407 finished with value: 0.5222024842783579 and parameters: {'max_depth': 35, 'min_samples_split': 2, 'min_samples_leaf': 1, 'max_features': 'sqrt', 'criterion': 'absolute_error', 'splitter': 'best'}. Best is trial 309 with value: 0.46729638362398634.
[I 2024-12-04 12:07:40,265] Trial 2404 finished with value: 1.36280343027112 and parameters: {'max_depth': 25, 'min_samples_split': 7, 'min_samples_leaf': 10, 'max_features': 'log2', 'criterion': 'absolute_error', 'splitter': 'best'}. Best is trial 309 with value: 0.46729638362398634.
[I 2024-12-04 12:07:40,625] Trial 2405 finished with value: 0.5222024842783579 and parameters: {'max_depth': 35, 'min_samples_split': 2, 'min_samples_leaf': 1, 'max_features': 'sqrt', 'criterion': 'absolute_error', 'splitter': 'best'}. Best is trial 309 with value: 0.46729638362398634.
[I 2024-12-04 12:07:40,628] Trial 2401 finished with value: 0.5209986636170143 and parameters: {'max_depth': 29, 'min_samples_split': 2, 'min_samples_leaf': 1, 'max_features': 'sqrt', 'criterion': 'absolute_error', 'splitter': 'best'}. Best is trial 309 with value: 0.46729638362398634.
[I 2024-12-04 12:07:41,369] Trial 2409 finished with value: 1.107575270643249 and parameters: {'max_depth': 31, 'min_samples_split': 5, 'min_samples_leaf': 2, 'max_features': 'sqrt', 'criterion': 'absolute_error', 'splitter': 'best'}. Best is trial 309 with value: 0.46729638362398634.
[I 2024-12-04 12:07:43,132] Trial 2387 finished with value: 0.7698922830511513 and parameters: {'max_depth': 26, 'min_samples_split': 5, 'min_samples_leaf': 1, 'max_features': 'sqrt', 'criterion': 'absolute_error', 'splitter': 'best'}. Best is trial 309 with value: 0.46729638362398634.
[I 2024-12-04 12:07:43,425] Trial 2413 finished with value: 0.8666968382247049 and parameters: {'max_depth': 31, 'min_samples_split': 5, 'min_samples_leaf': 3, 'max_features': 'sqrt', 'criterion': 'absolute_error', 'splitter': 'best'}. Best is trial 309 with value: 0.46729638362398634.
[I 2024-12-04 12:07:44,126] Trial 2412 finished with value: 0.7188087833617175 and parameters: {'max_depth': 31, 'min_samples_split': 5, 'min_samples_leaf': 1, 'max_features': 'sqrt', 'criterion': 'absolute_error', 'splitter': 'best'}. Best is trial 309 with value: 0.46729638362398634.
[I 2024-12-04 12:07:44,127] Trial 2411 finished with value: 0.6427433760061949 and parameters: {'max_depth': 34, 'min_samples_split': 4, 'min_samples_leaf': 1, 'max_features': 'log2', 'criterion': 'absolute_error', 'splitter': 'best'}. Best is trial 309 with value: 0.46729638362398634.
[I 2024-12-04 12:07:44,466] Trial 2414 finished with value: 0.5209986636170143 and parameters: {'max_depth': 29, 'min_samples_split': 2, 'min_samples_leaf': 1, 'max_features': 'sqrt', 'criterion': 'absolute_error', 'splitter': 'best'}. Best is trial 309 with value: 0.46729638362398634.
[I 2024-12-04 12:07:44,491] Trial 2402 finished with value: 0.8666968382247049 and parameters: {'max_depth': 35, 'min_samples_split': 2, 'min_samples_leaf': 3, 'max_features': 'sqrt', 'criterion': 'absolute_error', 'splitter': 'best'}. Best is trial 309 with value: 0.46729638362398634.
[I 2024-12-04 12:07:44,964] Trial 2416 finished with value: 1.292655019777175 and parameters: {'max_depth': 25, 'min_samples_split': 6, 'min_samples_leaf': 3, 'max_features': 'log2', 'criterion': 'friedman_mse', 'splitter': 'random'}. Best is trial 309 with value: 0.46729638362398634.
[I 2024-12-04 12:07:45,580] Trial 2415 finished with value: 1.2693628617232378 and parameters: {'max_depth': 26, 'min_samples_split': 17, 'min_samples_leaf': 1, 'max_features': 'log2', 'criterion': 'friedman_mse', 'splitter': 'random'}. Best is trial 309 with value: 0.46729638362398634.
[I 2024-12-04 12:07:46,052] Trial 2424 finished with value: 1.0977389566103577 and parameters: {'max_depth': 30, 'min_samples_split': 2, 'min_samples_leaf': 2, 'max_features': 'sqrt', 'criterion': 'absolute_error', 'splitter': 'best'}. Best is trial 309 with value: 0.46729638362398634.
[I 2024-12-04 12:07:46,687] Trial 2410 finished with value: 0.5861904649615429 and parameters: {'max_depth': 28, 'min_samples_split': 5, 'min_samples_leaf': 1, 'max_features': 'sqrt', 'criterion': 'absolute_error', 'splitter': 'best'}. Best is trial 309 with value: 0.46729638362398634.
[I 2024-12-04 12:07:46,904] Trial 2417 finished with value: 1.0081785092902962 and parameters: {'max_depth': 27, 'min_samples_split': 2, 'min_samples_leaf': 1, 'max_features': 'sqrt', 'criterion': 'absolute_error', 'splitter': 'best'}. Best is trial 309 with value: 0.46729638362398634.
[I 2024-12-04 12:07:47,114] Trial 2408 finished with value: 1.0977389566103577 and parameters: {'max_depth': 30, 'min_samples_split': 2, 'min_samples_leaf': 2, 'max_features': 'sqrt', 'criterion': 'absolute_error', 'splitter': 'best'}. Best is trial 309 with value: 0.46729638362398634.
[I 2024-12-04 12:07:47,862] Trial 2421 finished with value: 1.3617773369400628 and parameters: {'max_depth': 1, 'min_samples_split': 19, 'min_samples_leaf': 2, 'max_features': 'log2', 'criterion': 'absolute_error', 'splitter': 'best'}. Best is trial 309 with value: 0.46729638362398634.
[I 2024-12-04 12:07:48,311] Trial 2423 finished with value: 0.5209986636170143 and parameters: {'max_depth': 29, 'min_samples_split': 2, 'min_samples_leaf': 1, 'max_features': 'sqrt', 'criterion': 'absolute_error', 'splitter': 'best'}. Best is trial 309 with value: 0.46729638362398634.
[I 2024-12-04 12:07:48,445] Trial 2406 finished with value: 0.6242410834238855 and parameters: {'max_depth': 27, 'min_samples_split': 5, 'min_samples_leaf': 1, 'max_features': 'sqrt', 'criterion': 'absolute_error', 'splitter': 'best'}. Best is trial 309 with value: 0.46729638362398634.
[I 2024-12-04 12:07:48,876] Trial 2422 finished with value: 0.7169847047063859 and parameters: {'max_depth': 31, 'min_samples_split': 2, 'min_samples_leaf': 2, 'max_features': 'sqrt', 'criterion': 'absolute_error', 'splitter': 'best'}. Best is trial 309 with value: 0.46729638362398634.
[I 2024-12-04 12:07:50,565] Trial 2429 finished with value: 0.5222024842783579 and parameters: {'max_depth': 35, 'min_samples_split': 2, 'min_samples_leaf': 1, 'max_features': 'sqrt', 'criterion': 'absolute_error', 'splitter': 'best'}. Best is trial 309 with value: 0.46729638362398634.
[I 2024-12-04 12:07:50,877] Trial 2419 finished with value: 0.8666968382247049 and parameters: {'max_depth': 35, 'min_samples_split': 5, 'min_samples_leaf': 3, 'max_features': 'sqrt', 'criterion': 'absolute_error', 'splitter': 'best'}. Best is trial 309 with value: 0.46729638362398634.
[I 2024-12-04 12:07:51,115] Trial 2425 finished with value: 1.2752417978454849 and parameters: {'max_depth': 11, 'min_samples_split': 6, 'min_samples_leaf': 1, 'max_features': 'log2', 'criterion': 'friedman_mse', 'splitter': 'random'}. Best is trial 309 with value: 0.46729638362398634.
[I 2024-12-04 12:07:51,407] Trial 2426 finished with value: 0.5380234000646094 and parameters: {'max_depth': 30, 'min_samples_split': 2, 'min_samples_leaf': 1, 'max_features': 'sqrt', 'criterion': 'absolute_error', 'splitter': 'best'}. Best is trial 309 with value: 0.46729638362398634.
[I 2024-12-04 12:07:51,577] Trial 2427 finished with value: 0.8666968382247049 and parameters: {'max_depth': 31, 'min_samples_split': 2, 'min_samples_leaf': 3, 'max_features': 'sqrt', 'criterion': 'absolute_error', 'splitter': 'best'}. Best is trial 309 with value: 0.46729638362398634.
[I 2024-12-04 12:07:51,588] Trial 2430 finished with value: 0.8666968382247049 and parameters: {'max_depth': 23, 'min_samples_split': 2, 'min_samples_leaf': 3, 'max_features': 'sqrt', 'criterion': 'absolute_error', 'splitter': 'best'}. Best is trial 309 with value: 0.46729638362398634.
[I 2024-12-04 12:07:51,675] Trial 2428 finished with value: 1.1104329532849138 and parameters: {'max_depth': 35, 'min_samples_split': 5, 'min_samples_leaf': 2, 'max_features': 'sqrt', 'criterion': 'absolute_error', 'splitter': 'best'}. Best is trial 309 with value: 0.46729638362398634.
[I 2024-12-04 12:07:51,895] Trial 2431 finished with value: 0.7188087833617175 and parameters: {'max_depth': 31, 'min_samples_split': 5, 'min_samples_leaf': 1, 'max_features': 'sqrt', 'criterion': 'absolute_error', 'splitter': 'best'}. Best is trial 309 with value: 0.46729638362398634.
[I 2024-12-04 12:07:52,735] Trial 2437 finished with value: 0.5222024842783579 and parameters: {'max_depth': 35, 'min_samples_split': 2, 'min_samples_leaf': 1, 'max_features': 'sqrt', 'criterion': 'absolute_error', 'splitter': 'best'}. Best is trial 309 with value: 0.46729638362398634.
[I 2024-12-04 12:07:52,943] Trial 2434 finished with value: 1.0479797941399644 and parameters: {'max_depth': 26, 'min_samples_split': 2, 'min_samples_leaf': 1, 'max_features': 'sqrt', 'criterion': 'absolute_error', 'splitter': 'best'}. Best is trial 309 with value: 0.46729638362398634.
[I 2024-12-04 12:07:52,945] Trial 2435 finished with value: 1.0201410606892172 and parameters: {'max_depth': 27, 'min_samples_split': 5, 'min_samples_leaf': 3, 'max_features': 'log2', 'criterion': 'absolute_error', 'splitter': 'best'}. Best is trial 309 with value: 0.46729638362398634.
[I 2024-12-04 12:07:53,260] Trial 2418 finished with value: 0.9407564269247651 and parameters: {'max_depth': 30, 'min_samples_split': 8, 'min_samples_leaf': 1, 'max_features': 'sqrt', 'criterion': 'absolute_error', 'splitter': 'best'}. Best is trial 309 with value: 0.46729638362398634.
[I 2024-12-04 12:07:53,876] Trial 2445 finished with value: 0.7169847047063859 and parameters: {'max_depth': 31, 'min_samples_split': 2, 'min_samples_leaf': 2, 'max_features': 'sqrt', 'criterion': 'absolute_error', 'splitter': 'best'}. Best is trial 309 with value: 0.46729638362398634.
[I 2024-12-04 12:07:54,130] Trial 2436 finished with value: 0.6567233315466673 and parameters: {'max_depth': 27, 'min_samples_split': 2, 'min_samples_leaf': 2, 'max_features': 'sqrt', 'criterion': 'absolute_error', 'splitter': 'best'}. Best is trial 309 with value: 0.46729638362398634.
[I 2024-12-04 12:07:54,751] Trial 2420 finished with value: 1.2592691983902256 and parameters: {'max_depth': 26, 'min_samples_split': 16, 'min_samples_leaf': 7, 'max_features': 'sqrt', 'criterion': 'friedman_mse', 'splitter': 'best'}. Best is trial 309 with value: 0.46729638362398634.
[I 2024-12-04 12:07:56,888] Trial 2438 finished with value: 1.0235080961846112 and parameters: {'max_depth': 25, 'min_samples_split': 2, 'min_samples_leaf': 1, 'max_features': 'sqrt', 'criterion': 'absolute_error', 'splitter': 'best'}. Best is trial 309 with value: 0.46729638362398634.
[I 2024-12-04 12:07:57,400] Trial 2446 finished with value: 0.6242410834238855 and parameters: {'max_depth': 27, 'min_samples_split': 5, 'min_samples_leaf': 1, 'max_features': 'sqrt', 'criterion': 'absolute_error', 'splitter': 'best'}. Best is trial 309 with value: 0.46729638362398634.
[I 2024-12-04 12:07:57,403] Trial 2433 finished with value: 0.5222024842783579 and parameters: {'max_depth': 35, 'min_samples_split': 2, 'min_samples_leaf': 1, 'max_features': 'sqrt', 'criterion': 'absolute_error', 'splitter': 'best'}. Best is trial 309 with value: 0.46729638362398634.
[I 2024-12-04 12:07:57,700] Trial 2432 finished with value: 0.6228875839303879 and parameters: {'max_depth': 35, 'min_samples_split': 4, 'min_samples_leaf': 1, 'max_features': 'sqrt', 'criterion': 'friedman_mse', 'splitter': 'best'}. Best is trial 309 with value: 0.46729638362398634.
[I 2024-12-04 12:07:59,250] Trial 2443 finished with value: 1.3105279435582882 and parameters: {'max_depth': 6, 'min_samples_split': 8, 'min_samples_leaf': 10, 'max_features': 'sqrt', 'criterion': 'friedman_mse', 'splitter': 'best'}. Best is trial 309 with value: 0.46729638362398634.
