[I 2024-12-04 14:58:23,645] Trial 369 finished with value: 0.6443854025827706 and parameters: {'kernel_type': 'RBF', 'length_scale': 18.93087204879323, 'noise_level': 0.013722261989387837, 'constant_value': 47637.718841533846, 'nu': 0.5}. Best is trial 149 with value: 0.48830133927701114.
[I 2024-12-04 14:58:24,499] Trial 384 finished with value: 0.644385440192325 and parameters: {'kernel_type': 'RBF', 'length_scale': 102.98368798029165, 'noise_level': 0.7198286488817082, 'constant_value': 0.12950551584909425, 'nu': 0.5}. Best is trial 149 with value: 0.48830133927701114.
[I 2024-12-04 14:58:25,833] Trial 367 finished with value: 1.240111232584899 and parameters: {'kernel_type': 'Matern', 'length_scale': 13.504624028385178, 'noise_level': 0.019561408737593627, 'constant_value': 0.13881451944599107, 'nu': 2.5}. Best is trial 149 with value: 0.48830133927701114.
[I 2024-12-04 14:58:26,260] Trial 381 finished with value: 0.48830343358390543 and parameters: {'kernel_type': 'Matern', 'length_scale': 0.24120318949706704, 'noise_level': 0.6692917261227761, 'constant_value': 1.4742175207360302, 'nu': 0.5}. Best is trial 149 with value: 0.48830133927701114.
[I 2024-12-04 14:58:26,449] Trial 373 finished with value: 0.4883033936265977 and parameters: {'kernel_type': 'Matern', 'length_scale': 85308.79551115684, 'noise_level': 0.03428822529583873, 'constant_value': 91053.43412220964, 'nu': 0.5}. Best is trial 149 with value: 0.48830133927701114.
[I 2024-12-04 14:58:27,650] Trial 378 finished with value: 0.4883034099448922 and parameters: {'kernel_type': 'Matern', 'length_scale': 26.438451037090466, 'noise_level': 0.0069432714487670895, 'constant_value': 7.159881848143343, 'nu': 0.5}. Best is trial 149 with value: 0.48830133927701114.
[I 2024-12-04 14:58:30,003] Trial 382 finished with value: 1.24011123257997 and parameters: {'kernel_type': 'Matern', 'length_scale': 1.0815477675330979e-05, 'noise_level': 0.0023223172898509175, 'constant_value': 0.0003620660194418427, 'nu': 1.5}. Best is trial 386 with value: 0.4872991004520934.
[I 2024-12-04 14:58:30,275] Trial 386 finished with value: 0.4872991004520934 and parameters: {'kernel_type': 'Matern', 'length_scale': 122.97005591646763, 'noise_level': 0.4576599818038149, 'constant_value': 0.005935161554077047, 'nu': 0.5}. Best is trial 386 with value: 0.4872991004520934.
[I 2024-12-04 14:58:30,518] Trial 387 finished with value: 0.4883034643578401 and parameters: {'kernel_type': 'Matern', 'length_scale': 990.7094006320951, 'noise_level': 0.12653604181947778, 'constant_value': 0.023987889947481314, 'nu': 0.5}. Best is trial 386 with value: 0.4872991004520934.
[I 2024-12-04 14:58:32,960] Trial 388 finished with value: 0.4883054072849059 and parameters: {'kernel_type': 'Matern', 'length_scale': 74.25327126504601, 'noise_level': 0.08956504457508048, 'constant_value': 0.47892415490798296, 'nu': 0.5}. Best is trial 386 with value: 0.4872991004520934.
[I 2024-12-04 14:58:33,627] Trial 375 finished with value: 1.2401112323955263 and parameters: {'kernel_type': 'Matern', 'length_scale': 19827.82669030632, 'noise_level': 2.8560987892028657e-10, 'constant_value': 4.2138721853241025e-07, 'nu': 2.5}. Best is trial 386 with value: 0.4872991004520934.
[I 2024-12-04 14:58:33,714] Trial 394 finished with value: 0.48828964948066 and parameters: {'kernel_type': 'Matern', 'length_scale': 162.4176604736435, 'noise_level': 0.03267226696413388, 'constant_value': 23.891990415042645, 'nu': 0.5}. Best is trial 386 with value: 0.4872991004520934.
[I 2024-12-04 14:58:33,943] Trial 383 finished with value: 1.261454766271649 and parameters: {'kernel_type': 'Matern', 'length_scale': 8826.219096092638, 'noise_level': 0.27843482676592524, 'constant_value': 0.010013521287469039, 'nu': 0.5}. Best is trial 386 with value: 0.4872991004520934.
[I 2024-12-04 14:58:34,654] Trial 393 finished with value: 0.488303398223967 and parameters: {'kernel_type': 'Matern', 'length_scale': 2.224653798186302, 'noise_level': 0.04496056127969107, 'constant_value': 0.5304849635369406, 'nu': 0.5}. Best is trial 386 with value: 0.4872991004520934.
[I 2024-12-04 14:58:36,627] Trial 391 finished with value: 0.48830342344571676 and parameters: {'kernel_type': 'Matern', 'length_scale': 996.328483555902, 'noise_level': 0.0007267927708548842, 'constant_value': 57310.66028431781, 'nu': 0.5}. Best is trial 386 with value: 0.4872991004520934.
[I 2024-12-04 14:58:36,770] Trial 389 finished with value: 0.4883033547141498 and parameters: {'kernel_type': 'Matern', 'length_scale': 198.0142447911557, 'noise_level': 0.6803512934059953, 'constant_value': 0.11025262385948321, 'nu': 0.5}. Best is trial 386 with value: 0.4872991004520934.
[I 2024-12-04 14:58:37,796] Trial 380 finished with value: 1.2401112324368206 and parameters: {'kernel_type': 'Matern', 'length_scale': 89062.856577291, 'noise_level': 8.001354403952866e-08, 'constant_value': 0.00022572070404664404, 'nu': 0.5}. Best is trial 386 with value: 0.4872991004520934.
[I 2024-12-04 14:58:38,029] Trial 406 finished with value: 1.261446570711134 and parameters: {'kernel_type': 'Matern', 'length_scale': 55.97708122162724, 'noise_level': 0.48713790711575294, 'constant_value': 2.0600460457026094e-05, 'nu': 0.5}. Best is trial 386 with value: 0.4872991004520934.
[I 2024-12-04 14:58:38,292] Trial 392 finished with value: 1.2401112324897716 and parameters: {'kernel_type': 'RBF', 'length_scale': 7.344753651569073, 'noise_level': 0.00014007353891175596, 'constant_value': 1.503329147893724e-07, 'nu': 2.5}. Best is trial 386 with value: 0.4872991004520934.
[I 2024-12-04 14:58:38,583] Trial 385 finished with value: 0.48830341615043493 and parameters: {'kernel_type': 'Matern', 'length_scale': 34861.58832812991, 'noise_level': 0.0013610735955620866, 'constant_value': 98462.26559100383, 'nu': 0.5}. Best is trial 386 with value: 0.4872991004520934.
[I 2024-12-04 14:58:38,665] Trial 398 finished with value: 1.2401112312846534 and parameters: {'kernel_type': 'RBF', 'length_scale': 20.44345916779856, 'noise_level': 0.0035409754335953723, 'constant_value': 3.6645020412347233, 'nu': 0.5}. Best is trial 386 with value: 0.4872991004520934.
[I 2024-12-04 14:58:38,964] Trial 396 finished with value: 1.2401112325817285 and parameters: {'kernel_type': 'Matern', 'length_scale': 1919.7345260080026, 'noise_level': 0.0005650201831974309, 'constant_value': 3.462245869505209, 'nu': 2.5}. Best is trial 386 with value: 0.4872991004520934.
[I 2024-12-04 14:58:39,140] Trial 390 finished with value: 1.2614547976349573 and parameters: {'kernel_type': 'Matern', 'length_scale': 11865.507034378797, 'noise_level': 0.19761111502219728, 'constant_value': 0.01086715861001572, 'nu': 1.5}. Best is trial 386 with value: 0.4872991004520934.
[I 2024-12-04 14:58:40,004] Trial 395 finished with value: 1.2401112324448975 and parameters: {'kernel_type': 'Matern', 'length_scale': 35.675966480830745, 'noise_level': 0.0009709845788528987, 'constant_value': 0.3833559280404039, 'nu': 1.5}. Best is trial 386 with value: 0.4872991004520934.
[I 2024-12-04 14:58:40,558] Trial 405 finished with value: 1.240111232683514 and parameters: {'kernel_type': 'RBF', 'length_scale': 23.140940189069703, 'noise_level': 1.7272524685781356e-10, 'constant_value': 0.0001324014246155404, 'nu': 2.5}. Best is trial 386 with value: 0.4872991004520934.
[I 2024-12-04 14:58:41,918] Trial 407 finished with value: 0.4883038107696587 and parameters: {'kernel_type': 'Matern', 'length_scale': 0.9544431988043733, 'noise_level': 0.004506227425921632, 'constant_value': 0.0025468945220080805, 'nu': 0.5}. Best is trial 386 with value: 0.4872991004520934.
[I 2024-12-04 14:58:43,917] Trial 397 finished with value: 0.48830346471156194 and parameters: {'kernel_type': 'Matern', 'length_scale': 2.824396692534111, 'noise_level': 0.45411813331511997, 'constant_value': 0.0003181689871821934, 'nu': 0.5}. Best is trial 386 with value: 0.4872991004520934.
[I 2024-12-04 14:58:44,005] Trial 408 finished with value: 1.2401112318035967 and parameters: {'kernel_type': 'Matern', 'length_scale': 80.67364927552354, 'noise_level': 0.0014849373366670855, 'constant_value': 0.026903395711739535, 'nu': 0.5}. Best is trial 386 with value: 0.4872991004520934.
[I 2024-12-04 14:58:44,176] Trial 399 finished with value: 1.240111232532878 and parameters: {'kernel_type': 'Matern', 'length_scale': 14025.128096785504, 'noise_level': 0.0008331164600436536, 'constant_value': 0.00010484731437209992, 'nu': 0.5}. Best is trial 386 with value: 0.4872991004520934.
[I 2024-12-04 14:58:44,339] Trial 402 finished with value: 1.240111232579782 and parameters: {'kernel_type': 'Matern', 'length_scale': 137.97180707949084, 'noise_level': 0.0037975282103334604, 'constant_value': 0.09573087123830508, 'nu': 0.5}. Best is trial 386 with value: 0.4872991004520934.
[I 2024-12-04 14:58:44,794] Trial 400 finished with value: 1.240111232565798 and parameters: {'kernel_type': 'Matern', 'length_scale': 4455.441964330873, 'noise_level': 2.5830778795344755e-06, 'constant_value': 3548.49216786176, 'nu': 1.5}. Best is trial 386 with value: 0.4872991004520934.
[I 2024-12-04 14:58:45,098] Trial 401 finished with value: 0.48830338786221794 and parameters: {'kernel_type': 'Matern', 'length_scale': 2799.2677464246235, 'noise_level': 0.04605977867043112, 'constant_value': 638.0920993400533, 'nu': 0.5}. Best is trial 386 with value: 0.4872991004520934.
[I 2024-12-04 14:58:49,094] Trial 412 finished with value: 0.4883033999226869 and parameters: {'kernel_type': 'Matern', 'length_scale': 36037.89296561393, 'noise_level': 0.9273365226148446, 'constant_value': 24080.816091335786, 'nu': 0.5}. Best is trial 386 with value: 0.4872991004520934.
[I 2024-12-04 14:58:50,022] Trial 410 finished with value: 1.2614547976351618 and parameters: {'kernel_type': 'Matern', 'length_scale': 14067.292220757698, 'noise_level': 0.03526627740407024, 'constant_value': 0.00045503159402574217, 'nu': 2.5}. Best is trial 386 with value: 0.4872991004520934.
[I 2024-12-04 14:58:50,371] Trial 413 finished with value: 0.48830341223320567 and parameters: {'kernel_type': 'Matern', 'length_scale': 160.34255622176303, 'noise_level': 0.0416790894275585, 'constant_value': 21.228431761578886, 'nu': 0.5}. Best is trial 386 with value: 0.4872991004520934.
[I 2024-12-04 14:58:50,419] Trial 409 finished with value: 0.48830342820813116 and parameters: {'kernel_type': 'Matern', 'length_scale': 83116.92128333877, 'noise_level': 0.022405247291008106, 'constant_value': 2230.9607813075554, 'nu': 0.5}. Best is trial 386 with value: 0.4872991004520934.
[I 2024-12-04 14:58:50,433] Trial 414 finished with value: 0.48830340817794776 and parameters: {'kernel_type': 'Matern', 'length_scale': 92.9565846098268, 'noise_level': 0.00018707980279080406, 'constant_value': 165.57627898995162, 'nu': 0.5}. Best is trial 386 with value: 0.4872991004520934.
[I 2024-12-04 14:58:50,834] Trial 423 finished with value: 1.2614547974716541 and parameters: {'kernel_type': 'RBF', 'length_scale': 298.9059245352281, 'noise_level': 0.23904727140367377, 'constant_value': 0.00010923666719136132, 'nu': 0.5}. Best is trial 386 with value: 0.4872991004520934.
[I 2024-12-04 14:58:51,425] Trial 418 finished with value: 0.48830340705786734 and parameters: {'kernel_type': 'Matern', 'length_scale': 7.549658374536364, 'noise_level': 0.003590785876462708, 'constant_value': 212.7746200405427, 'nu': 0.5}. Best is trial 386 with value: 0.4872991004520934.
[I 2024-12-04 14:58:52,152] Trial 420 finished with value: 0.4883034280193016 and parameters: {'kernel_type': 'Matern', 'length_scale': 384.64347925805373, 'noise_level': 0.0405060115645129, 'constant_value': 526.6189906080823, 'nu': 0.5}. Best is trial 386 with value: 0.4872991004520934.
[I 2024-12-04 14:58:52,563] Trial 404 finished with value: 0.7431725414822505 and parameters: {'kernel_type': 'Matern', 'length_scale': 387.9667235883378, 'noise_level': 0.19581364782837055, 'constant_value': 0.0031331838356412596, 'nu': 0.5}. Best is trial 386 with value: 0.4872991004520934.
[I 2024-12-04 14:58:53,682] Trial 419 finished with value: 0.4883032587403049 and parameters: {'kernel_type': 'Matern', 'length_scale': 702.1589935935812, 'noise_level': 0.0446009243243159, 'constant_value': 37386.72864768362, 'nu': 0.5}. Best is trial 386 with value: 0.4872991004520934.
[I 2024-12-04 14:58:53,884] Trial 403 finished with value: 0.48830341684326156 and parameters: {'kernel_type': 'Matern', 'length_scale': 752.1305159376758, 'noise_level': 0.20508276433003408, 'constant_value': 0.006030159780656254, 'nu': 0.5}. Best is trial 386 with value: 0.4872991004520934.
[I 2024-12-04 14:58:54,197] Trial 411 finished with value: 0.5663936766566056 and parameters: {'kernel_type': 'Matern', 'length_scale': 2.266712672433175, 'noise_level': 0.9469879716300919, 'constant_value': 0.0007138473157275955, 'nu': 2.5}. Best is trial 386 with value: 0.4872991004520934.
[I 2024-12-04 14:58:54,790] Trial 417 finished with value: 0.48830337675194047 and parameters: {'kernel_type': 'Matern', 'length_scale': 82558.55100148871, 'noise_level': 0.00273161457463748, 'constant_value': 90432.33479084831, 'nu': 0.5}. Best is trial 386 with value: 0.4872991004520934.
[I 2024-12-04 14:58:55,662] Trial 416 finished with value: 0.48830341868047766 and parameters: {'kernel_type': 'Matern', 'length_scale': 17.859604797659024, 'noise_level': 0.6197223758905805, 'constant_value': 0.004925838389966001, 'nu': 0.5}. Best is trial 386 with value: 0.4872991004520934.
[I 2024-12-04 14:58:56,516] Trial 424 finished with value: 0.48830343109752455 and parameters: {'kernel_type': 'Matern', 'length_scale': 58.07308298434917, 'noise_level': 0.01223401593905782, 'constant_value': 67.40954102764056, 'nu': 0.5}. Best is trial 386 with value: 0.4872991004520934.
[I 2024-12-04 14:58:56,573] Trial 427 finished with value: 1.2401112272406196 and parameters: {'kernel_type': 'Matern', 'length_scale': 0.0002859977465096721, 'noise_level': 1.6320795096233183e-10, 'constant_value': 5.683295844519692e-07, 'nu': 1.5}. Best is trial 386 with value: 0.4872991004520934.
[I 2024-12-04 14:58:57,090] Trial 421 finished with value: 0.4883033064506816 and parameters: {'kernel_type': 'Matern', 'length_scale': 25619.130175799946, 'noise_level': 0.014401041499036515, 'constant_value': 51088.8875166857, 'nu': 0.5}. Best is trial 386 with value: 0.4872991004520934.
[I 2024-12-04 14:58:57,485] Trial 422 finished with value: 0.4883034193987634 and parameters: {'kernel_type': 'Matern', 'length_scale': 1.1090687622673427, 'noise_level': 9.129130357153486e-05, 'constant_value': 0.11032741094285062, 'nu': 0.5}. Best is trial 386 with value: 0.4872991004520934.
[I 2024-12-04 14:58:57,935] Trial 426 finished with value: 0.48830342095877655 and parameters: {'kernel_type': 'Matern', 'length_scale': 395.2026507038141, 'noise_level': 0.06625616912753289, 'constant_value': 79128.8150031436, 'nu': 0.5}. Best is trial 386 with value: 0.4872991004520934.
[I 2024-12-04 14:58:58,425] Trial 425 finished with value: 1.2401042588092568 and parameters: {'kernel_type': 'Matern', 'length_scale': 0.08796425049112205, 'noise_level': 0.006906126941533863, 'constant_value': 0.23159599996006686, 'nu': 0.5}. Best is trial 386 with value: 0.4872991004520934.
[I 2024-12-04 14:58:59,282] Trial 415 finished with value: 0.48830353887110545 and parameters: {'kernel_type': 'Matern', 'length_scale': 6.338605105737205, 'noise_level': 0.010900551533491466, 'constant_value': 9.883190428234391, 'nu': 0.5}. Best is trial 386 with value: 0.4872991004520934.
[I 2024-12-04 14:58:59,700] Trial 429 finished with value: 0.48830341434765784 and parameters: {'kernel_type': 'Matern', 'length_scale': 40811.645452580124, 'noise_level': 0.750613261622155, 'constant_value': 88282.97817339044, 'nu': 0.5}. Best is trial 386 with value: 0.4872991004520934.
[I 2024-12-04 14:59:00,430] Trial 430 finished with value: 0.4883036403583877 and parameters: {'kernel_type': 'Matern', 'length_scale': 84.43141941137289, 'noise_level': 0.010428035698215694, 'constant_value': 345.20455422056995, 'nu': 0.5}. Best is trial 386 with value: 0.4872991004520934.
[I 2024-12-04 14:59:01,420] Trial 431 finished with value: 1.2614543702027645 and parameters: {'kernel_type': 'RBF', 'length_scale': 2.9733687298161002e-05, 'noise_level': 8.373667469906431e-08, 'constant_value': 5.416348846056718, 'nu': 0.5}. Best is trial 386 with value: 0.4872991004520934.
[I 2024-12-04 14:59:01,421] Trial 434 finished with value: 0.48830340510297693 and parameters: {'kernel_type': 'Matern', 'length_scale': 1980.178980947337, 'noise_level': 0.007821567050314652, 'constant_value': 46072.65067626179, 'nu': 0.5}. Best is trial 386 with value: 0.4872991004520934.
[I 2024-12-04 14:59:03,785] Trial 438 finished with value: 0.4883034174937172 and parameters: {'kernel_type': 'Matern', 'length_scale': 871.231016708913, 'noise_level': 0.8921370681265532, 'constant_value': 88514.93248265047, 'nu': 0.5}. Best is trial 386 with value: 0.4872991004520934.
[I 2024-12-04 14:59:03,786] Trial 433 finished with value: 0.4883034504761831 and parameters: {'kernel_type': 'Matern', 'length_scale': 6606.847324492994, 'noise_level': 0.04502565585403519, 'constant_value': 2682.2528171885456, 'nu': 0.5}. Best is trial 386 with value: 0.4872991004520934.
[I 2024-12-04 14:59:04,482] Trial 432 finished with value: 0.4883034113482104 and parameters: {'kernel_type': 'Matern', 'length_scale': 1112.6865501277005, 'noise_level': 0.002310948358562685, 'constant_value': 26776.396730911572, 'nu': 0.5}. Best is trial 386 with value: 0.4872991004520934.
[I 2024-12-04 14:59:04,751] Trial 435 finished with value: 1.2614547683284563 and parameters: {'kernel_type': 'Matern', 'length_scale': 15672.27961525073, 'noise_level': 0.8750919429577787, 'constant_value': 2.0169554366284953e-05, 'nu': 0.5}. Best is trial 386 with value: 0.4872991004520934.
[I 2024-12-04 14:59:05,310] Trial 441 finished with value: 0.48830364629735523 and parameters: {'kernel_type': 'Matern', 'length_scale': 86.97976274674168, 'noise_level': 0.006455282667180874, 'constant_value': 78633.21774275131, 'nu': 0.5}. Best is trial 386 with value: 0.4872991004520934.
[I 2024-12-04 14:59:05,343] Trial 442 finished with value: 1.2614543581842295 and parameters: {'kernel_type': 'Matern', 'length_scale': 0.15793046220087656, 'noise_level': 3.0341683676779763e-09, 'constant_value': 62762.157847380055, 'nu': 0.5}. Best is trial 386 with value: 0.4872991004520934.
[I 2024-12-04 14:59:06,261] Trial 436 finished with value: 0.4883034183688805 and parameters: {'kernel_type': 'Matern', 'length_scale': 3910.3174837453034, 'noise_level': 0.01598348164395588, 'constant_value': 417.9417778451105, 'nu': 0.5}. Best is trial 386 with value: 0.4872991004520934.
[I 2024-12-04 14:59:06,263] Trial 437 finished with value: 0.4883034172154749 and parameters: {'kernel_type': 'Matern', 'length_scale': 88530.90445674906, 'noise_level': 0.0944298415514711, 'constant_value': 93769.35930855524, 'nu': 0.5}. Best is trial 386 with value: 0.4872991004520934.
[I 2024-12-04 14:59:06,268] Trial 445 finished with value: 0.48830341127678295 and parameters: {'kernel_type': 'Matern', 'length_scale': 1644.7474947062824, 'noise_level': 0.9132402493418187, 'constant_value': 600.1910150195257, 'nu': 0.5}. Best is trial 386 with value: 0.4872991004520934.
[I 2024-12-04 14:59:07,295] Trial 449 finished with value: 1.2401112272406196 and parameters: {'kernel_type': 'RBF', 'length_scale': 0.00037401041734314516, 'noise_level': 2.660575591893548e-06, 'constant_value': 3.524756248851466e-07, 'nu': 2.5}. Best is trial 386 with value: 0.4872991004520934.
[I 2024-12-04 14:59:07,510] Trial 428 finished with value: 0.4883035311004574 and parameters: {'kernel_type': 'Matern', 'length_scale': 2654.4938186987606, 'noise_level': 0.5782417020903987, 'constant_value': 2.1648200379322775, 'nu': 0.5}. Best is trial 386 with value: 0.4872991004520934.
[I 2024-12-04 14:59:07,603] Trial 443 finished with value: 1.2614547849895241 and parameters: {'kernel_type': 'Matern', 'length_scale': 103.9881081115898, 'noise_level': 3.6091575034711705e-05, 'constant_value': 3954.961278280913, 'nu': 0.5}. Best is trial 386 with value: 0.4872991004520934.
[I 2024-12-04 14:59:08,123] Trial 439 finished with value: 0.4883034200762639 and parameters: {'kernel_type': 'Matern', 'length_scale': 1848.9783050314038, 'noise_level': 0.017717793870978632, 'constant_value': 91690.99929592432, 'nu': 0.5}. Best is trial 386 with value: 0.4872991004520934.
[I 2024-12-04 14:59:08,847] Trial 440 finished with value: 0.48830336776286937 and parameters: {'kernel_type': 'Matern', 'length_scale': 5406.855174383457, 'noise_level': 0.04110887892329901, 'constant_value': 831.7915965954688, 'nu': 0.5}. Best is trial 386 with value: 0.4872991004520934.
[I 2024-12-04 14:59:09,097] Trial 444 finished with value: 0.48830342488757067 and parameters: {'kernel_type': 'Matern', 'length_scale': 50775.417938840255, 'noise_level': 0.010023977429432571, 'constant_value': 88274.26755158395, 'nu': 0.5}. Best is trial 386 with value: 0.4872991004520934.
[I 2024-12-04 14:59:09,626] Trial 447 finished with value: 0.488303418054325 and parameters: {'kernel_type': 'Matern', 'length_scale': 215.85998811796227, 'noise_level': 0.0003486271041806996, 'constant_value': 88.4263152423719, 'nu': 0.5}. Best is trial 386 with value: 0.4872991004520934.
[I 2024-12-04 14:59:09,901] Trial 450 finished with value: 0.4883034186333073 and parameters: {'kernel_type': 'Matern', 'length_scale': 64014.085548907475, 'noise_level': 0.0023617324727166016, 'constant_value': 60901.224328026794, 'nu': 0.5}. Best is trial 386 with value: 0.4872991004520934.
[I 2024-12-04 14:59:10,486] Trial 453 finished with value: 1.2401112325642658 and parameters: {'kernel_type': 'RBF', 'length_scale': 99877.92131987863, 'noise_level': 0.0009429707368078295, 'constant_value': 1944.1149328951135, 'nu': 0.5}. Best is trial 386 with value: 0.4872991004520934.
