[I 2024-12-03 19:11:32,458] Trial 1793 finished with value: 6.925159954950402 and parameters: {'kernel': 'sigmoid', 'C': 0.45168710096463605, 'gamma': 0.03481022239292732, 'epsilon': 0.7942276774010768}. Best is trial 345 with value: 0.13438257115663557.
[I 2024-12-03 19:11:33,388] Trial 1786 finished with value: 0.13616089761929032 and parameters: {'kernel': 'linear', 'C': 8.391561280172589, 'gamma': 0.06812240583308116, 'epsilon': 0.03058944850680912}. Best is trial 345 with value: 0.13438257115663557.
[I 2024-12-03 19:11:44,075] Trial 1785 finished with value: 0.1353988900211107 and parameters: {'kernel': 'linear', 'C': 24.18647950945504, 'gamma': 0.01806023515111278, 'epsilon': 0.030909329303681392}. Best is trial 345 with value: 0.13438257115663557.
[I 2024-12-03 19:11:45,615] Trial 1796 finished with value: 52.94054243657772 and parameters: {'kernel': 'sigmoid', 'C': 44.33776340887449, 'gamma': 0.004138093177439146, 'epsilon': 0.015570302145325262}. Best is trial 345 with value: 0.13438257115663557.
[I 2024-12-03 19:11:47,091] Trial 1723 finished with value: 0.13606150537450518 and parameters: {'kernel': 'linear', 'C': 93.17751767475836, 'gamma': 0.0032752017340746615, 'epsilon': 0.024603619793649154}. Best is trial 345 with value: 0.13438257115663557.
[I 2024-12-03 19:11:47,139] Trial 1789 finished with value: 0.1408106341995683 and parameters: {'kernel': 'linear', 'C': 93.57880606354357, 'gamma': 0.02732477496245491, 'epsilon': 0.10817300350928832}. Best is trial 345 with value: 0.13438257115663557.
[I 2024-12-03 19:11:48,100] Trial 1718 finished with value: 0.13818279576835538 and parameters: {'kernel': 'linear', 'C': 93.30828104150393, 'gamma': 0.00917573102618735, 'epsilon': 0.006397433397155777}. Best is trial 345 with value: 0.13438257115663557.
[I 2024-12-03 19:11:48,198] Trial 1736 finished with value: 0.13824415192616757 and parameters: {'kernel': 'linear', 'C': 74.6642187298345, 'gamma': 0.14452531585127493, 'epsilon': 0.01238647710582314}. Best is trial 345 with value: 0.13438257115663557.
[I 2024-12-03 19:11:49,947] Trial 1791 finished with value: 0.13567552232509694 and parameters: {'kernel': 'linear', 'C': 19.8698859030702, 'gamma': 0.01243289880581996, 'epsilon': 0.034061438173944754}. Best is trial 345 with value: 0.13438257115663557.
[I 2024-12-03 19:11:51,214] Trial 1722 finished with value: 0.13571616042130769 and parameters: {'kernel': 'linear', 'C': 93.56533554831285, 'gamma': 0.0071121994441659285, 'epsilon': 0.026235888836499514}. Best is trial 345 with value: 0.13438257115663557.
[I 2024-12-03 19:11:52,488] Trial 1803 finished with value: 1.3604113400455318 and parameters: {'kernel': 'poly', 'C': 0.001185341640860633, 'gamma': 0.0003503580465138631, 'epsilon': 0.032786251185039264}. Best is trial 345 with value: 0.13438257115663557.
[I 2024-12-03 19:11:54,560] Trial 1804 finished with value: 0.2639644209306925 and parameters: {'kernel': 'rbf', 'C': 8.654200266418428, 'gamma': 0.01939742637725237, 'epsilon': 0.04277779691107116}. Best is trial 345 with value: 0.13438257115663557.
[I 2024-12-03 19:11:59,063] Trial 1774 finished with value: 0.13739434026200914 and parameters: {'kernel': 'linear', 'C': 42.51672535593289, 'gamma': 0.058587842598200955, 'epsilon': 0.019916168844395073}. Best is trial 345 with value: 0.13438257115663557.
[I 2024-12-03 19:11:59,507] Trial 1801 finished with value: 0.13531260184408997 and parameters: {'kernel': 'linear', 'C': 17.325248593561355, 'gamma': 0.013720375904141357, 'epsilon': 0.06466032607446551}. Best is trial 345 with value: 0.13438257115663557.
[I 2024-12-03 19:12:00,571] Trial 1805 finished with value: 0.1366177614701803 and parameters: {'kernel': 'linear', 'C': 4.192270067231325, 'gamma': 0.016031810140601392, 'epsilon': 0.028750900436339627}. Best is trial 345 with value: 0.13438257115663557.
[I 2024-12-03 19:12:01,353] Trial 1729 finished with value: 0.13491138528538513 and parameters: {'kernel': 'linear', 'C': 95.98023014506084, 'gamma': 0.0002547995705412271, 'epsilon': 0.032212943703376844}. Best is trial 345 with value: 0.13438257115663557.
[I 2024-12-03 19:12:02,744] Trial 1809 finished with value: 0.18675295393431762 and parameters: {'kernel': 'linear', 'C': 3.1696931697142627, 'gamma': 0.008290318949610598, 'epsilon': 0.20265885839318423}. Best is trial 345 with value: 0.13438257115663557.
[I 2024-12-03 19:12:03,262] Trial 1747 finished with value: 0.1356616019282143 and parameters: {'kernel': 'linear', 'C': 98.20248885813092, 'gamma': 0.024307371456402615, 'epsilon': 0.03480554545265953}. Best is trial 345 with value: 0.13438257115663557.
[I 2024-12-03 19:12:04,308] Trial 1810 finished with value: 150.53101365201596 and parameters: {'kernel': 'sigmoid', 'C': 9.292661973426515, 'gamma': 0.04856964615138837, 'epsilon': 0.008251450260772276}. Best is trial 345 with value: 0.13438257115663557.
[I 2024-12-03 19:12:04,856] Trial 1788 finished with value: 0.13807171502168666 and parameters: {'kernel': 'linear', 'C': 19.991699476667243, 'gamma': 0.0014704043107768361, 'epsilon': 0.007146158633244571}. Best is trial 345 with value: 0.13438257115663557.
[I 2024-12-03 19:12:05,480] Trial 1795 finished with value: 0.1366372524964025 and parameters: {'kernel': 'linear', 'C': 25.868312782823473, 'gamma': 0.004722655747139011, 'epsilon': 0.024969960973917633}. Best is trial 345 with value: 0.13438257115663557.
[I 2024-12-03 19:12:05,735] Trial 1808 finished with value: 0.13558341199853174 and parameters: {'kernel': 'linear', 'C': 4.349772462358208, 'gamma': 0.009181295055244457, 'epsilon': 0.04751063106478663}. Best is trial 345 with value: 0.13438257115663557.
[I 2024-12-03 19:12:07,953] Trial 1815 finished with value: 1.0416190147650588 and parameters: {'kernel': 'poly', 'C': 0.857745650222205, 'gamma': 0.006816459357319176, 'epsilon': 0.007865379454507613}. Best is trial 345 with value: 0.13438257115663557.
[I 2024-12-03 19:12:09,681] Trial 1806 finished with value: 0.14500534316822258 and parameters: {'kernel': 'linear', 'C': 83.1497631784529, 'gamma': 0.0053957537718434785, 'epsilon': 0.12198925340825686}. Best is trial 345 with value: 0.13438257115663557.
[I 2024-12-03 19:12:10,253] Trial 1766 finished with value: 0.13562634813988342 and parameters: {'kernel': 'linear', 'C': 75.04256867480534, 'gamma': 0.23467468371122835, 'epsilon': 0.03728250065337967}. Best is trial 345 with value: 0.13438257115663557.
[I 2024-12-03 19:12:11,101] Trial 1756 finished with value: 0.13590909179162103 and parameters: {'kernel': 'linear', 'C': 92.09806661720252, 'gamma': 0.013335847090379303, 'epsilon': 0.03521954459857059}. Best is trial 345 with value: 0.13438257115663557.
[I 2024-12-03 19:12:12,253] Trial 1800 finished with value: 0.1383751406064206 and parameters: {'kernel': 'linear', 'C': 16.877665803961808, 'gamma': 0.005742391910295265, 'epsilon': 0.011576162565138711}. Best is trial 345 with value: 0.13438257115663557.
[I 2024-12-03 19:12:12,255] Trial 1797 finished with value: 0.13684094204676014 and parameters: {'kernel': 'linear', 'C': 21.485275761886975, 'gamma': 0.07352847135185592, 'epsilon': 0.023080649818626366}. Best is trial 345 with value: 0.13438257115663557.
[I 2024-12-03 19:12:13,984] Trial 1821 finished with value: 0.22244707730397742 and parameters: {'kernel': 'linear', 'C': 0.21619234983191873, 'gamma': 0.0032792824715652635, 'epsilon': 0.1933140609129765}. Best is trial 345 with value: 0.13438257115663557.
[I 2024-12-03 19:12:14,550] Trial 1757 finished with value: 0.13808926256360723 and parameters: {'kernel': 'linear', 'C': 93.56162452494125, 'gamma': 0.15337508291222682, 'epsilon': 0.016095809017200473}. Best is trial 345 with value: 0.13438257115663557.
[I 2024-12-03 19:12:17,433] Trial 1711 finished with value: 0.13804694020731606 and parameters: {'kernel': 'linear', 'C': 90.68292644792292, 'gamma': 0.013242342997424073, 'epsilon': 0.009969699849999996}. Best is trial 345 with value: 0.13438257115663557.
[I 2024-12-03 19:12:18,165] Trial 1807 finished with value: 0.13440127180062827 and parameters: {'kernel': 'linear', 'C': 23.761201426360838, 'gamma': 0.005830243016099072, 'epsilon': 0.0401137307841113}. Best is trial 345 with value: 0.13438257115663557.
[I 2024-12-03 19:12:21,209] Trial 1811 finished with value: 0.13556505142172007 and parameters: {'kernel': 'linear', 'C': 21.51807753601609, 'gamma': 0.002750449077908781, 'epsilon': 0.05321514977431211}. Best is trial 345 with value: 0.13438257115663557.
[I 2024-12-03 19:12:23,575] Trial 1826 finished with value: 0.2169921472168784 and parameters: {'kernel': 'linear', 'C': 6.324078647367309, 'gamma': 0.04200574204778406, 'epsilon': 0.29046172340291815}. Best is trial 345 with value: 0.13438257115663557.
[I 2024-12-03 19:12:23,850] Trial 1772 finished with value: 0.13814082045332013 and parameters: {'kernel': 'linear', 'C': 89.14535470679188, 'gamma': 0.06750120070151806, 'epsilon': 0.01612846439900611}. Best is trial 345 with value: 0.13438257115663557.
[I 2024-12-03 19:12:25,152] Trial 1771 finished with value: 0.13821007133382635 and parameters: {'kernel': 'linear', 'C': 90.46364868729496, 'gamma': 0.022009311546361664, 'epsilon': 0.015430608160438881}. Best is trial 345 with value: 0.13438257115663557.
[I 2024-12-03 19:12:25,154] Trial 1827 finished with value: 0.4357997361622899 and parameters: {'kernel': 'poly', 'C': 0.08993734439377025, 'gamma': 0.04535005418598399, 'epsilon': 0.0017013779865545444}. Best is trial 345 with value: 0.13438257115663557.
[I 2024-12-03 19:12:25,844] Trial 1828 finished with value: 0.3865621489582959 and parameters: {'kernel': 'rbf', 'C': 7.084759897314002, 'gamma': 0.0001956999992539957, 'epsilon': 0.001904319545906221}. Best is trial 345 with value: 0.13438257115663557.
[I 2024-12-03 19:12:26,211] Trial 1816 finished with value: 0.13492900070219266 and parameters: {'kernel': 'linear', 'C': 21.839252823845413, 'gamma': 0.012413283546558141, 'epsilon': 0.038369135155205986}. Best is trial 345 with value: 0.13438257115663557.
[I 2024-12-03 19:12:26,303] Trial 1781 finished with value: 0.1369283737278702 and parameters: {'kernel': 'linear', 'C': 83.89621526250525, 'gamma': 0.08529893150042163, 'epsilon': 0.023825691510549713}. Best is trial 345 with value: 0.13438257115663557.
[I 2024-12-03 19:12:26,380] Trial 1825 finished with value: 0.1372990024176833 and parameters: {'kernel': 'linear', 'C': 4.296691356364355, 'gamma': 0.0033278692392866857, 'epsilon': 0.023829349906277726}. Best is trial 345 with value: 0.13438257115663557.
[I 2024-12-03 19:12:28,484] Trial 1819 finished with value: 0.13594973096948867 and parameters: {'kernel': 'linear', 'C': 28.538682354372682, 'gamma': 0.005838499469236902, 'epsilon': 0.06871076104870878}. Best is trial 345 with value: 0.13438257115663557.
[I 2024-12-03 19:12:29,702] Trial 1834 finished with value: 0.15380942432833816 and parameters: {'kernel': 'linear', 'C': 7.507766391501425, 'gamma': 0.007928523696203171, 'epsilon': 0.15307012190098865}. Best is trial 345 with value: 0.13438257115663557.
[I 2024-12-03 19:12:29,988] Trial 1751 finished with value: 0.1353497444551132 and parameters: {'kernel': 'linear', 'C': 90.94408835463028, 'gamma': 0.06576591003942343, 'epsilon': 0.05884867692801278}. Best is trial 345 with value: 0.13438257115663557.
[I 2024-12-03 19:12:30,698] Trial 1833 finished with value: 0.1353447639399826 and parameters: {'kernel': 'linear', 'C': 3.9456545134529084, 'gamma': 0.006456153450642331, 'epsilon': 0.06420630653921232}. Best is trial 345 with value: 0.13438257115663557.
[I 2024-12-03 19:12:32,156] Trial 1794 finished with value: 0.13516950312148432 and parameters: {'kernel': 'linear', 'C': 96.01728196226746, 'gamma': 0.02275952254458211, 'epsilon': 0.05654387828130334}. Best is trial 345 with value: 0.13438257115663557.
[I 2024-12-03 19:12:33,256] Trial 1839 finished with value: 104.10022291779204 and parameters: {'kernel': 'sigmoid', 'C': 9.082298731808635, 'gamma': 0.019621916963356835, 'epsilon': 0.058999125187270005}. Best is trial 345 with value: 0.13438257115663557.
[I 2024-12-03 19:12:34,133] Trial 1838 finished with value: 0.336844376198288 and parameters: {'kernel': 'poly', 'C': 3.1446144152222293, 'gamma': 0.04894314934446916, 'epsilon': 0.032409355577592676}. Best is trial 345 with value: 0.13438257115663557.
[I 2024-12-03 19:12:35,374] Trial 1841 finished with value: 0.4301562558782782 and parameters: {'kernel': 'rbf', 'C': 0.47397580991295757, 'gamma': 0.003842729428495925, 'epsilon': 0.10397563288018258}. Best is trial 345 with value: 0.13438257115663557.
[I 2024-12-03 19:12:36,214] Trial 1831 finished with value: 0.13860599461058953 and parameters: {'kernel': 'linear', 'C': 7.105403942881852, 'gamma': 0.023131040818119827, 'epsilon': 0.01154216382825476}. Best is trial 345 with value: 0.13438257115663557.
[I 2024-12-03 19:12:36,948] Trial 1832 finished with value: 0.13575058465883177 and parameters: {'kernel': 'linear', 'C': 16.153166899617624, 'gamma': 0.04479217680205924, 'epsilon': 0.06789300516636178}. Best is trial 345 with value: 0.13438257115663557.
[I 2024-12-03 19:12:37,756] Trial 1843 finished with value: 0.17133808884480434 and parameters: {'kernel': 'rbf', 'C': 16.49591121942817, 'gamma': 0.004751192091959712, 'epsilon': 0.01128432148200126}. Best is trial 345 with value: 0.13438257115663557.
[I 2024-12-03 19:12:38,481] Trial 1829 finished with value: 0.1369139093753712 and parameters: {'kernel': 'linear', 'C': 6.687160190268789, 'gamma': 0.007138721178796995, 'epsilon': 0.02442197863979428}. Best is trial 345 with value: 0.13438257115663557.
[I 2024-12-03 19:12:38,563] Trial 1840 finished with value: 0.14019065886642798 and parameters: {'kernel': 'linear', 'C': 18.91235524046784, 'gamma': 0.014213412857319883, 'epsilon': 0.08933432387901298}. Best is trial 345 with value: 0.13438257115663557.
[I 2024-12-03 19:12:40,213] Trial 1846 finished with value: 1044.2730281076158 and parameters: {'kernel': 'sigmoid', 'C': 85.63736177772604, 'gamma': 0.02131749164714685, 'epsilon': 0.02764337353636014}. Best is trial 345 with value: 0.13438257115663557.
[I 2024-12-03 19:12:41,119] Trial 1844 finished with value: 0.13546275176786776 and parameters: {'kernel': 'linear', 'C': 3.7622023431576155, 'gamma': 0.010086938519839559, 'epsilon': 0.05373578029484785}. Best is trial 345 with value: 0.13438257115663557.
[I 2024-12-03 19:12:41,564] Trial 1830 finished with value: 0.1374343864250452 and parameters: {'kernel': 'linear', 'C': 12.58681724618638, 'gamma': 0.016407117055938888, 'epsilon': 0.019335173134196894}. Best is trial 345 with value: 0.13438257115663557.
[I 2024-12-03 19:12:42,780] Trial 1824 finished with value: 0.1378950063956752 and parameters: {'kernel': 'linear', 'C': 19.564200075747298, 'gamma': 0.0020782461614144696, 'epsilon': 0.015410963032603288}. Best is trial 345 with value: 0.13438257115663557.
[I 2024-12-03 19:12:44,584] Trial 1812 finished with value: 0.13616323133698305 and parameters: {'kernel': 'linear', 'C': 25.33184024292212, 'gamma': 0.07942811297770315, 'epsilon': 0.026552573440178414}. Best is trial 345 with value: 0.13438257115663557.
[I 2024-12-03 19:12:45,188] Trial 1787 finished with value: 0.13529966540415103 and parameters: {'kernel': 'linear', 'C': 96.1840846432157, 'gamma': 0.005157067220042834, 'epsilon': 0.05969581313837286}. Best is trial 345 with value: 0.13438257115663557.
[I 2024-12-03 19:12:46,198] Trial 1765 finished with value: 0.1384773522733451 and parameters: {'kernel': 'linear', 'C': 95.28677463571015, 'gamma': 0.06803803263138977, 'epsilon': 0.01671980960848271}. Best is trial 345 with value: 0.13438257115663557.
[I 2024-12-03 19:12:47,997] Trial 1820 finished with value: 0.13804210871894654 and parameters: {'kernel': 'linear', 'C': 24.651868498645065, 'gamma': 0.0006945000338058313, 'epsilon': 0.0074364491243206245}. Best is trial 345 with value: 0.13438257115663557.
[I 2024-12-03 19:12:48,591] Trial 1850 finished with value: 0.13671434067265956 and parameters: {'kernel': 'linear', 'C': 3.569178434376581, 'gamma': 0.008025986197600442, 'epsilon': 0.03151073960021891}. Best is trial 345 with value: 0.13438257115663557.
[I 2024-12-03 19:12:49,974] Trial 1856 finished with value: 0.4093200063094294 and parameters: {'kernel': 'poly', 'C': 74.37241763621631, 'gamma': 0.005707224843271511, 'epsilon': 0.030916224933746666}. Best is trial 345 with value: 0.13438257115663557.
[I 2024-12-03 19:12:51,405] Trial 1835 finished with value: 0.13731692050617722 and parameters: {'kernel': 'linear', 'C': 12.732303889566642, 'gamma': 0.013331533684971314, 'epsilon': 0.003387283056465573}. Best is trial 345 with value: 0.13438257115663557.
[I 2024-12-03 19:12:51,407] Trial 1759 finished with value: 0.13775924556863314 and parameters: {'kernel': 'linear', 'C': 99.90909305354364, 'gamma': 0.01028297658116889, 'epsilon': 0.013681777536860422}. Best is trial 345 with value: 0.13438257115663557.
[I 2024-12-03 19:12:52,993] Trial 1857 finished with value: 0.1358091382810322 and parameters: {'kernel': 'linear', 'C': 3.794763461655783, 'gamma': 0.015056027007515639, 'epsilon': 0.05548217324926592}. Best is trial 345 with value: 0.13438257115663557.
[I 2024-12-03 19:12:56,298] Trial 1845 finished with value: 0.13765986724214002 and parameters: {'kernel': 'linear', 'C': 99.4056936126542, 'gamma': 0.013018038205641914, 'epsilon': 0.07747418213628877}. Best is trial 345 with value: 0.13438257115663557.
[I 2024-12-03 19:12:56,460] Trial 1847 finished with value: 0.13570277564515712 and parameters: {'kernel': 'linear', 'C': 22.0662051449293, 'gamma': 0.004032333760677987, 'epsilon': 0.052936612905490586}. Best is trial 345 with value: 0.13438257115663557.
[I 2024-12-03 19:12:57,116] Trial 1842 finished with value: 0.13730391946335832 and parameters: {'kernel': 'linear', 'C': 21.66818562848652, 'gamma': 0.006161005402393287, 'epsilon': 0.01916972820393389}. Best is trial 345 with value: 0.13438257115663557.
[I 2024-12-03 19:12:58,142] Trial 1861 finished with value: 0.6422375221631744 and parameters: {'kernel': 'rbf', 'C': 0.9222103350925397, 'gamma': 0.08922472990658746, 'epsilon': 0.004597223351842263}. Best is trial 345 with value: 0.13438257115663557.
[I 2024-12-03 19:12:58,472] Trial 1859 finished with value: 0.14653367602637019 and parameters: {'kernel': 'linear', 'C': 90.3968602115584, 'gamma': 0.007981666951751168, 'epsilon': 0.13385685773395029}. Best is trial 345 with value: 0.13438257115663557.
[I 2024-12-03 19:12:59,402] Trial 1854 finished with value: 0.13537088934353383 and parameters: {'kernel': 'linear', 'C': 14.634306943887903, 'gamma': 0.014330407505261034, 'epsilon': 0.030260883726171656}. Best is trial 345 with value: 0.13438257115663557.
[I 2024-12-03 19:12:59,404] Trial 1851 finished with value: 0.13447543006204546 and parameters: {'kernel': 'linear', 'C': 16.356190558336117, 'gamma': 0.004249753730711631, 'epsilon': 0.03953583853160344}. Best is trial 345 with value: 0.13438257115663557.
[I 2024-12-03 19:13:01,294] Trial 1858 finished with value: 0.15243495317632477 and parameters: {'kernel': 'linear', 'C': 96.6721645753874, 'gamma': 0.006586609051634981, 'epsilon': 0.14914495927206153}. Best is trial 345 with value: 0.13438257115663557.
[I 2024-12-03 19:13:02,100] Trial 1866 finished with value: 0.13959488295777514 and parameters: {'kernel': 'linear', 'C': 2.3308382001906156, 'gamma': 0.0018802556182752127, 'epsilon': 0.0687939331633289}. Best is trial 345 with value: 0.13438257115663557.
[I 2024-12-03 19:13:04,216] Trial 1855 finished with value: 0.13551186120141023 and parameters: {'kernel': 'linear', 'C': 24.718518960072807, 'gamma': 0.01144796532049947, 'epsilon': 0.03201738200757162}. Best is trial 345 with value: 0.13438257115663557.
[I 2024-12-03 19:13:05,251] Trial 1848 finished with value: 0.1362893939951083 and parameters: {'kernel': 'linear', 'C': 19.551584500734336, 'gamma': 0.20645374828976265, 'epsilon': 0.024327097520992002}. Best is trial 345 with value: 0.13438257115663557.
[I 2024-12-03 19:13:06,100] Trial 1868 finished with value: 0.13546675497920793 and parameters: {'kernel': 'linear', 'C': 4.613338543862966, 'gamma': 0.002797720890376625, 'epsilon': 0.05444353829145475}. Best is trial 345 with value: 0.13438257115663557.
[I 2024-12-03 19:13:06,425] Trial 1849 finished with value: 0.13724488104686056 and parameters: {'kernel': 'linear', 'C': 16.416112621439964, 'gamma': 0.001867350696172328, 'epsilon': 0.021933288937386223}. Best is trial 345 with value: 0.13438257115663557.
[I 2024-12-03 19:13:06,846] Trial 1777 finished with value: 0.13598723439425414 and parameters: {'kernel': 'linear', 'C': 91.58231958024946, 'gamma': 0.027939753072255075, 'epsilon': 0.025423551858034056}. Best is trial 345 with value: 0.13438257115663557.
[I 2024-12-03 19:13:07,597] Trial 1867 finished with value: 0.13501146054326021 and parameters: {'kernel': 'linear', 'C': 18.01011124055027, 'gamma': 0.004029199829097231, 'epsilon': 0.06275542979008268}. Best is trial 345 with value: 0.13438257115663557.
[I 2024-12-03 19:13:08,397] Trial 1872 finished with value: 0.1424049213619836 and parameters: {'kernel': 'linear', 'C': 0.9009220217139464, 'gamma': 0.005847454943228659, 'epsilon': 0.03327622355618807}. Best is trial 345 with value: 0.13438257115663557.
[I 2024-12-03 19:13:09,725] Trial 1876 finished with value: 1.0208959153682713 and parameters: {'kernel': 'poly', 'C': 94.52700131055762, 'gamma': 0.0014991348593319034, 'epsilon': 0.03539895243809865}. Best is trial 345 with value: 0.13438257115663557.
[I 2024-12-03 19:13:10,941] Trial 1877 finished with value: 0.49824757575581946 and parameters: {'kernel': 'sigmoid', 'C': 12.737231820453552, 'gamma': 0.0011260930414105658, 'epsilon': 0.08386467916406545}. Best is trial 345 with value: 0.13438257115663557.
