[I 2024-12-04 00:38:33,028] Trial 2403 finished with value: 0.14711176346301902 and parameters: {'kernel': 'rbf', 'C': 36.80091831994966, 'gamma': 0.013514624202676424, 'epsilon': 0.0010092005492085146}. Best is trial 2284 with value: 0.13948515847988838.
[I 2024-12-04 00:38:33,207] Trial 2404 finished with value: 0.15309324306182892 and parameters: {'kernel': 'rbf', 'C': 21.37337701561989, 'gamma': 0.025286503190715813, 'epsilon': 0.0017671275874275017}. Best is trial 2284 with value: 0.13948515847988838.
[I 2024-12-04 00:38:33,501] Trial 2405 finished with value: 0.22573044448210913 and parameters: {'kernel': 'rbf', 'C': 99.43989061839753, 'gamma': 0.0014310933580745744, 'epsilon': 0.002715429616006834}. Best is trial 2284 with value: 0.13948515847988838.
[I 2024-12-04 00:38:34,789] Trial 2407 finished with value: 0.20135427997731856 and parameters: {'kernel': 'rbf', 'C': 87.31445555914709, 'gamma': 0.0025732479169509226, 'epsilon': 0.0010370968369305832}. Best is trial 2284 with value: 0.13948515847988838.
[I 2024-12-04 00:38:34,963] Trial 2406 finished with value: 0.1785421150168981 and parameters: {'kernel': 'rbf', 'C': 31.06550234636375, 'gamma': 0.007646113929704267, 'epsilon': 0.003167224073442939}. Best is trial 2284 with value: 0.13948515847988838.
[I 2024-12-04 00:38:35,640] Trial 2409 finished with value: 0.9379092056965896 and parameters: {'kernel': 'sigmoid', 'C': 0.010362828938034021, 'gamma': 0.002129078339788897, 'epsilon': 0.21471905262008453}. Best is trial 2284 with value: 0.13948515847988838.
[I 2024-12-04 00:38:36,167] Trial 2408 finished with value: 0.1532790098830341 and parameters: {'kernel': 'rbf', 'C': 78.47062579048493, 'gamma': 0.005701539574795987, 'epsilon': 0.0010061815890549455}. Best is trial 2284 with value: 0.13948515847988838.
[I 2024-12-04 00:38:37,998] Trial 2410 finished with value: 0.17972752237849138 and parameters: {'kernel': 'rbf', 'C': 93.78672516138083, 'gamma': 0.0032764244058596003, 'epsilon': 0.002974498131611401}. Best is trial 2284 with value: 0.13948515847988838.
[I 2024-12-04 00:38:38,507] Trial 2413 finished with value: 0.29616187859483967 and parameters: {'kernel': 'rbf', 'C': 15.812764122468908, 'gamma': 0.0018374209983177561, 'epsilon': 0.0028695672325699515}. Best is trial 2284 with value: 0.13948515847988838.
[I 2024-12-04 00:38:40,075] Trial 2415 finished with value: 0.2645356946920144 and parameters: {'kernel': 'rbf', 'C': 25.352642649163837, 'gamma': 0.0020984167860371872, 'epsilon': 0.0038352811330444685}. Best is trial 2284 with value: 0.13948515847988838.
[I 2024-12-04 00:38:41,040] Trial 2411 finished with value: 0.14023929702066282 and parameters: {'kernel': 'rbf', 'C': 93.03232527658102, 'gamma': 0.008788276725959582, 'epsilon': 0.0012077216749574735}. Best is trial 2284 with value: 0.13948515847988838.
[I 2024-12-04 00:38:41,918] Trial 2417 finished with value: 0.42504319749508257 and parameters: {'kernel': 'rbf', 'C': 87.58964469374328, 'gamma': 0.34875198422162257, 'epsilon': 0.0015280766722642616}. Best is trial 2284 with value: 0.13948515847988838.
[I 2024-12-04 00:38:42,021] Trial 2412 finished with value: 0.1433628991483853 and parameters: {'kernel': 'rbf', 'C': 91.50454476474518, 'gamma': 0.006711630857533035, 'epsilon': 0.00228728091659767}. Best is trial 2284 with value: 0.13948515847988838.
[I 2024-12-04 00:38:44,919] Trial 2419 finished with value: 0.6352966023357584 and parameters: {'kernel': 'poly', 'C': 98.06793850108438, 'gamma': 0.005507693157488772, 'epsilon': 0.012249266224382292}. Best is trial 2284 with value: 0.13948515847988838.
[I 2024-12-04 00:38:44,958] Trial 2418 finished with value: 0.156877876213016 and parameters: {'kernel': 'rbf', 'C': 26.9190625396731, 'gamma': 0.024915670712122775, 'epsilon': 0.0030489296846026616}. Best is trial 2284 with value: 0.13948515847988838.
[I 2024-12-04 00:38:45,589] Trial 2414 finished with value: 0.16899315616588467 and parameters: {'kernel': 'rbf', 'C': 96.46768862161944, 'gamma': 0.01621581791986279, 'epsilon': 0.0010517619891633194}. Best is trial 2284 with value: 0.13948515847988838.
[I 2024-12-04 00:38:45,737] Trial 2416 finished with value: 0.15020021087995258 and parameters: {'kernel': 'rbf', 'C': 99.08100007373636, 'gamma': 0.011658475340540183, 'epsilon': 0.004631196471862133}. Best is trial 2284 with value: 0.13948515847988838.
[I 2024-12-04 00:38:45,823] Trial 2420 finished with value: 0.9812858828490032 and parameters: {'kernel': 'poly', 'C': 15.616491743065236, 'gamma': 0.00010647990848764879, 'epsilon': 0.007174707178047267}. Best is trial 2284 with value: 0.13948515847988838.
[I 2024-12-04 00:38:46,938] Trial 2309 finished with value: 0.3538070901292991 and parameters: {'kernel': 'linear', 'C': 26.990595704018567, 'gamma': 0.00011560232007709063, 'epsilon': 0.019091407364432884}. Best is trial 2284 with value: 0.13948515847988838.
[I 2024-12-04 00:38:46,988] Trial 2421 finished with value: 0.1623341557099324 and parameters: {'kernel': 'rbf', 'C': 24.359993153008926, 'gamma': 0.011417602266292385, 'epsilon': 0.002425192600734826}. Best is trial 2284 with value: 0.13948515847988838.
[I 2024-12-04 00:38:49,894] Trial 2345 finished with value: 0.352998408887044 and parameters: {'kernel': 'linear', 'C': 16.86157531497289, 'gamma': 0.002805766787229617, 'epsilon': 0.0010782930199834118}. Best is trial 2284 with value: 0.13948515847988838.
[I 2024-12-04 00:38:50,432] Trial 2422 finished with value: 0.15646326474341024 and parameters: {'kernel': 'rbf', 'C': 95.60508201984393, 'gamma': 0.004644081336602021, 'epsilon': 0.0019252557601865002}. Best is trial 2284 with value: 0.13948515847988838.
[I 2024-12-04 00:38:50,852] Trial 2423 finished with value: 0.18489423918945513 and parameters: {'kernel': 'rbf', 'C': 25.027907978875422, 'gamma': 0.039221489842790704, 'epsilon': 0.0020511531674451983}. Best is trial 2284 with value: 0.13948515847988838.
[I 2024-12-04 00:38:51,511] Trial 2425 finished with value: 0.25224436555833546 and parameters: {'kernel': 'rbf', 'C': 25.304718016601793, 'gamma': 0.0029899643825677885, 'epsilon': 0.002492076467538322}. Best is trial 2284 with value: 0.13948515847988838.
[I 2024-12-04 00:38:52,410] Trial 2428 finished with value: 0.7921406058388252 and parameters: {'kernel': 'poly', 'C': 21.44371544995167, 'gamma': 0.0033310119335339386, 'epsilon': 0.0020480701485437068}. Best is trial 2284 with value: 0.13948515847988838.
[I 2024-12-04 00:38:52,692] Trial 2426 finished with value: 0.15343727917173092 and parameters: {'kernel': 'rbf', 'C': 95.70783837669846, 'gamma': 0.005025271155345097, 'epsilon': 0.0010769425093510785}. Best is trial 2284 with value: 0.13948515847988838.
[I 2024-12-04 00:38:53,963] Trial 2427 finished with value: 0.15247165784096603 and parameters: {'kernel': 'rbf', 'C': 93.72544752400309, 'gamma': 0.00523847410399814, 'epsilon': 0.0010435963755732285}. Best is trial 2284 with value: 0.13948515847988838.
[I 2024-12-04 00:38:56,204] Trial 2424 finished with value: 0.1703168190331028 and parameters: {'kernel': 'rbf', 'C': 92.74296182165592, 'gamma': 0.01952364773567809, 'epsilon': 0.002634113993029633}. Best is trial 2284 with value: 0.13948515847988838.
[I 2024-12-04 00:38:56,204] Trial 2431 finished with value: 0.21476885346824154 and parameters: {'kernel': 'rbf', 'C': 96.03872283152494, 'gamma': 0.0018542674578000662, 'epsilon': 0.0028973236149164726}. Best is trial 2284 with value: 0.13948515847988838.
[I 2024-12-04 00:38:56,588] Trial 2432 finished with value: 0.2527358979728726 and parameters: {'kernel': 'rbf', 'C': 24.522749822956275, 'gamma': 0.002955026015930919, 'epsilon': 0.007265909332652663}. Best is trial 2284 with value: 0.13948515847988838.
[I 2024-12-04 00:38:58,683] Trial 2434 finished with value: 0.1895992048132742 and parameters: {'kernel': 'rbf', 'C': 98.34944545813421, 'gamma': 0.0028170540234011606, 'epsilon': 0.0025035844347678113}. Best is trial 2284 with value: 0.13948515847988838.
[I 2024-12-04 00:38:58,778] Trial 2217 finished with value: 0.3527112453645928 and parameters: {'kernel': 'linear', 'C': 89.9611037359159, 'gamma': 0.017259321520947522, 'epsilon': 0.0020885361494694483}. Best is trial 2284 with value: 0.13948515847988838.
[I 2024-12-04 00:38:59,576] Trial 2438 finished with value: 0.7950049087674089 and parameters: {'kernel': 'sigmoid', 'C': 0.032565520045299674, 'gamma': 0.009875468757371454, 'epsilon': 0.8059379884207655}. Best is trial 2284 with value: 0.13948515847988838.
[I 2024-12-04 00:38:59,696] Trial 2437 finished with value: 93.55063327066188 and parameters: {'kernel': 'sigmoid', 'C': 76.22483583351631, 'gamma': 0.0016178588001413035, 'epsilon': 0.004450201404899669}. Best is trial 2284 with value: 0.13948515847988838.
[I 2024-12-04 00:39:00,082] Trial 2436 finished with value: 0.20554561924676434 and parameters: {'kernel': 'rbf', 'C': 15.415995508754348, 'gamma': 0.00944957412121713, 'epsilon': 0.0011008207584693997}. Best is trial 2284 with value: 0.13948515847988838.
[I 2024-12-04 00:39:00,567] Trial 2430 finished with value: 0.1607619633201182 and parameters: {'kernel': 'rbf', 'C': 97.19729548027443, 'gamma': 0.013872534358035343, 'epsilon': 0.0012267024809361328}. Best is trial 2284 with value: 0.13948515847988838.
[I 2024-12-04 00:39:00,573] Trial 2433 finished with value: 0.14221639639075304 and parameters: {'kernel': 'rbf', 'C': 94.54855264009589, 'gamma': 0.006826486626377212, 'epsilon': 0.0029572450404909186}. Best is trial 2284 with value: 0.13948515847988838.
[I 2024-12-04 00:39:01,736] Trial 2429 finished with value: 0.1723586078459005 and parameters: {'kernel': 'rbf', 'C': 97.07484671655384, 'gamma': 0.021182945130128247, 'epsilon': 0.002133119161330127}. Best is trial 2284 with value: 0.13948515847988838.
[I 2024-12-04 00:39:01,854] Trial 2440 finished with value: 0.6247461979092216 and parameters: {'kernel': 'linear', 'C': 0.00131802553740859, 'gamma': 0.05378189060830579, 'epsilon': 0.0929201718139713}. Best is trial 2284 with value: 0.13948515847988838.
[I 2024-12-04 00:39:02,511] Trial 2439 finished with value: 0.2425351478757213 and parameters: {'kernel': 'rbf', 'C': 28.016191884744465, 'gamma': 0.0033514081817606635, 'epsilon': 0.005247810487649651}. Best is trial 2284 with value: 0.13948515847988838.
[I 2024-12-04 00:39:03,062] Trial 2435 finished with value: 0.18316230271818984 and parameters: {'kernel': 'rbf', 'C': 97.74161247977352, 'gamma': 0.029746410949224616, 'epsilon': 0.0030054558547036357}. Best is trial 2284 with value: 0.13948515847988838.
[I 2024-12-04 00:39:03,501] Trial 2441 finished with value: 0.1562431389597969 and parameters: {'kernel': 'rbf', 'C': 26.335232335360796, 'gamma': 0.012075512917638656, 'epsilon': 0.0025283070689633286}. Best is trial 2284 with value: 0.13948515847988838.
[I 2024-12-04 00:39:04,532] Trial 2443 finished with value: 0.1894405763898311 and parameters: {'kernel': 'rbf', 'C': 4.820377916016079, 'gamma': 0.039058309146082264, 'epsilon': 0.0011822298246090713}. Best is trial 2284 with value: 0.13948515847988838.
[I 2024-12-04 00:39:04,735] Trial 2442 finished with value: 0.16378419710269193 and parameters: {'kernel': 'rbf', 'C': 18.063618366115033, 'gamma': 0.014414393444857785, 'epsilon': 0.007592658048028149}. Best is trial 2284 with value: 0.13948515847988838.
[I 2024-12-04 00:39:08,063] Trial 2448 finished with value: 142.6206700837923 and parameters: {'kernel': 'sigmoid', 'C': 11.591161912659825, 'gamma': 0.009426285671021028, 'epsilon': 0.13011295920589355}. Best is trial 2284 with value: 0.13948515847988838.
[I 2024-12-04 00:39:08,232] Trial 2446 finished with value: 0.9901400668640229 and parameters: {'kernel': 'poly', 'C': 0.0867259471828743, 'gamma': 0.0004662314777382476, 'epsilon': 0.7314265667598849}. Best is trial 2284 with value: 0.13948515847988838.
[I 2024-12-04 00:39:08,807] Trial 2447 finished with value: 0.22159084190213846 and parameters: {'kernel': 'rbf', 'C': 24.463418904859786, 'gamma': 0.005380439865670439, 'epsilon': 0.002988338943586785}. Best is trial 2284 with value: 0.13948515847988838.
[I 2024-12-04 00:39:10,015] Trial 2445 finished with value: 0.20300459383917022 and parameters: {'kernel': 'rbf', 'C': 29.478047125074767, 'gamma': 0.057181499487247815, 'epsilon': 0.0010240336579642188}. Best is trial 2284 with value: 0.13948515847988838.
[I 2024-12-04 00:39:11,067] Trial 2449 finished with value: 0.195286505331712 and parameters: {'kernel': 'rbf', 'C': 97.92702963343409, 'gamma': 0.0026177566518719064, 'epsilon': 0.0010970453656665455}. Best is trial 2284 with value: 0.13948515847988838.
[I 2024-12-04 00:39:11,462] Trial 2452 finished with value: 0.19173922339586563 and parameters: {'kernel': 'rbf', 'C': 20.596246958064857, 'gamma': 0.008762658145809036, 'epsilon': 0.0022113175726345045}. Best is trial 2284 with value: 0.13948515847988838.
[I 2024-12-04 00:39:14,181] Trial 2453 finished with value: 0.1605527180624979 and parameters: {'kernel': 'rbf', 'C': 31.72950497600955, 'gamma': 0.009266757449856474, 'epsilon': 0.001006646431907598}. Best is trial 2284 with value: 0.13948515847988838.
[I 2024-12-04 00:39:14,181] Trial 2450 finished with value: 0.16443048096484425 and parameters: {'kernel': 'rbf', 'C': 34.4633775871589, 'gamma': 0.025206546399934332, 'epsilon': 0.0010590048123498297}. Best is trial 2284 with value: 0.13948515847988838.
[I 2024-12-04 00:39:14,631] Trial 2456 finished with value: 0.2836596317500614 and parameters: {'kernel': 'rbf', 'C': 11.33276192157384, 'gamma': 0.0029535097684901903, 'epsilon': 0.001025844476102843}. Best is trial 2284 with value: 0.13948515847988838.
[I 2024-12-04 00:39:16,693] Trial 2457 finished with value: 0.2501523394290163 and parameters: {'kernel': 'rbf', 'C': 19.48154525976861, 'gamma': 0.004042327566161525, 'epsilon': 0.0028307110495603984}. Best is trial 2284 with value: 0.13948515847988838.
[I 2024-12-04 00:39:18,840] Trial 2459 finished with value: 0.2766315145935167 and parameters: {'kernel': 'rbf', 'C': 3.9261237332663566, 'gamma': 0.008932221311538417, 'epsilon': 0.0021559908994178514}. Best is trial 2284 with value: 0.13948515847988838.
[I 2024-12-04 00:39:18,844] Trial 2460 finished with value: 0.25373920637862224 and parameters: {'kernel': 'rbf', 'C': 17.79796629188435, 'gamma': 0.003989276734920146, 'epsilon': 0.0010657439137965166}. Best is trial 2284 with value: 0.13948515847988838.
[I 2024-12-04 00:39:21,944] Trial 2462 finished with value: 0.20773300597476976 and parameters: {'kernel': 'rbf', 'C': 27.189169501661723, 'gamma': 0.005965559186392882, 'epsilon': 0.002918497993418596}. Best is trial 2284 with value: 0.13948515847988838.
[I 2024-12-04 00:39:22,002] Trial 2451 finished with value: 0.2067644258944935 and parameters: {'kernel': 'rbf', 'C': 94.99763765923653, 'gamma': 0.04902897413711622, 'epsilon': 0.0025966310339071695}. Best is trial 2284 with value: 0.13948515847988838.
[I 2024-12-04 00:39:22,792] Trial 2454 finished with value: 0.17698444995346324 and parameters: {'kernel': 'rbf', 'C': 93.17982026361565, 'gamma': 0.02462008547989864, 'epsilon': 0.001910866844971305}. Best is trial 2284 with value: 0.13948515847988838.
[I 2024-12-04 00:39:22,792] Trial 2458 finished with value: 0.16233817867328765 and parameters: {'kernel': 'rbf', 'C': 92.64902223266202, 'gamma': 0.014699423964344007, 'epsilon': 0.0024425116808656877}. Best is trial 2284 with value: 0.13948515847988838.
[I 2024-12-04 00:39:23,443] Trial 2461 finished with value: 0.16847151236242727 and parameters: {'kernel': 'rbf', 'C': 27.47512968109035, 'gamma': 0.02887731996673043, 'epsilon': 0.0010060723398771585}. Best is trial 2284 with value: 0.13948515847988838.
[I 2024-12-04 00:39:25,009] Trial 2463 finished with value: 0.14749408817074738 and parameters: {'kernel': 'rbf', 'C': 24.482013405163656, 'gamma': 0.020311494078227608, 'epsilon': 0.0063256213303001865}. Best is trial 2284 with value: 0.13948515847988838.
[I 2024-12-04 00:39:26,321] Trial 2466 finished with value: 0.6713046093211358 and parameters: {'kernel': 'rbf', 'C': 1.3742134705419355, 'gamma': 0.8390258694223417, 'epsilon': 0.009586473414223607}. Best is trial 2284 with value: 0.13948515847988838.
[I 2024-12-04 00:39:28,624] Trial 2469 finished with value: 0.2492106986894913 and parameters: {'kernel': 'rbf', 'C': 99.60817457557933, 'gamma': 0.0008580524493779381, 'epsilon': 0.0030485622394968034}. Best is trial 2284 with value: 0.13948515847988838.
[I 2024-12-04 00:39:28,625] Trial 2467 finished with value: 0.34535565786938205 and parameters: {'kernel': 'rbf', 'C': 5.908114341211332, 'gamma': 0.0023101961607849466, 'epsilon': 0.002506936456824466}. Best is trial 2284 with value: 0.13948515847988838.
[I 2024-12-04 00:39:30,826] Trial 2470 finished with value: 0.9490953083427004 and parameters: {'kernel': 'sigmoid', 'C': 0.007457556407175467, 'gamma': 0.002328784136197518, 'epsilon': 0.013497331685915624}. Best is trial 2284 with value: 0.13948515847988838.
[I 2024-12-04 00:39:30,826] Trial 2464 finished with value: 0.16981233651684985 and parameters: {'kernel': 'rbf', 'C': 79.80497660105603, 'gamma': 0.019611822115649827, 'epsilon': 0.0010690130229858597}. Best is trial 2284 with value: 0.13948515847988838.
[I 2024-12-04 00:39:31,706] Trial 2468 finished with value: 0.14525936744105583 and parameters: {'kernel': 'rbf', 'C': 89.07855014187035, 'gamma': 0.006374409931213338, 'epsilon': 0.0011220610046843965}. Best is trial 2284 with value: 0.13948515847988838.
[I 2024-12-04 00:39:34,152] Trial 2472 finished with value: 0.1997467322414584 and parameters: {'kernel': 'rbf', 'C': 24.239619155839556, 'gamma': 0.007156129788853267, 'epsilon': 0.002978027790512595}. Best is trial 2284 with value: 0.13948515847988838.
[I 2024-12-04 00:39:35,194] Trial 2474 finished with value: 117.45161034224358 and parameters: {'kernel': 'sigmoid', 'C': 11.42006352012434, 'gamma': 0.007455874972126691, 'epsilon': 0.008635111940962462}. Best is trial 2284 with value: 0.13948515847988838.
[I 2024-12-04 00:39:35,195] Trial 2475 finished with value: 0.6158492031448864 and parameters: {'kernel': 'linear', 'C': 0.001533499596744811, 'gamma': 0.007533421045238199, 'epsilon': 0.0014554366956564912}. Best is trial 2284 with value: 0.13948515847988838.
[I 2024-12-04 00:39:35,288] Trial 2465 finished with value: 0.1754750158144147 and parameters: {'kernel': 'rbf', 'C': 97.65573299232997, 'gamma': 0.02334300724461541, 'epsilon': 0.0020115213389509125}. Best is trial 2284 with value: 0.13948515847988838.
[I 2024-12-04 00:39:36,440] Trial 2471 finished with value: 0.14089309912384088 and parameters: {'kernel': 'rbf', 'C': 90.14567029631114, 'gamma': 0.007747711427054342, 'epsilon': 0.0033451237995487035}. Best is trial 2284 with value: 0.13948515847988838.
[I 2024-12-04 00:39:37,282] Trial 2473 finished with value: 0.1404786608527007 and parameters: {'kernel': 'rbf', 'C': 97.89934762096507, 'gamma': 0.007153683639094983, 'epsilon': 0.0011096980543056237}. Best is trial 2284 with value: 0.13948515847988838.
[I 2024-12-04 00:39:40,146] Trial 2478 finished with value: 0.6986371870998999 and parameters: {'kernel': 'poly', 'C': 0.7650736986696373, 'gamma': 0.01890514669635199, 'epsilon': 0.16634595625421433}. Best is trial 2284 with value: 0.13948515847988838.
[I 2024-12-04 00:39:40,357] Trial 2477 finished with value: 0.14745149454620718 and parameters: {'kernel': 'rbf', 'C': 32.34187623749411, 'gamma': 0.014799688432488294, 'epsilon': 0.001007052761674107}. Best is trial 2284 with value: 0.13948515847988838.
[I 2024-12-04 00:39:40,426] Trial 2479 finished with value: 0.2283784751732745 and parameters: {'kernel': 'rbf', 'C': 20.267439412493648, 'gamma': 0.005696883976982601, 'epsilon': 0.002489899697404383}. Best is trial 2284 with value: 0.13948515847988838.
[I 2024-12-04 00:39:41,152] Trial 2480 finished with value: 0.2251482220459458 and parameters: {'kernel': 'rbf', 'C': 16.6998521381087, 'gamma': 0.006997387788914101, 'epsilon': 0.0010056101914602499}. Best is trial 2284 with value: 0.13948515847988838.
[I 2024-12-04 00:39:43,250] Trial 2481 finished with value: 0.15387232382953087 and parameters: {'kernel': 'rbf', 'C': 14.068236897741917, 'gamma': 0.02406727470895307, 'epsilon': 0.002430851433774784}. Best is trial 2284 with value: 0.13948515847988838.
[I 2024-12-04 00:39:43,339] Trial 2482 finished with value: 0.1849680058922853 and parameters: {'kernel': 'rbf', 'C': 21.82951408949748, 'gamma': 0.009025382726516607, 'epsilon': 0.0010401441872752058}. Best is trial 2284 with value: 0.13948515847988838.
[I 2024-12-04 00:39:44,527] Trial 2483 finished with value: 0.7963178295967064 and parameters: {'kernel': 'poly', 'C': 1.0350359408039398, 'gamma': 0.008910437211454035, 'epsilon': 0.001354176969142299}. Best is trial 2284 with value: 0.13948515847988838.
[I 2024-12-04 00:39:45,367] Trial 2485 finished with value: 1356.612630365397 and parameters: {'kernel': 'sigmoid', 'C': 74.73714738559134, 'gamma': 0.01900419431620604, 'epsilon': 0.0020678511953987197}. Best is trial 2284 with value: 0.13948515847988838.
[I 2024-12-04 00:39:45,878] Trial 2476 finished with value: 0.1706466624827109 and parameters: {'kernel': 'rbf', 'C': 97.3496742966987, 'gamma': 0.01867365272487328, 'epsilon': 0.0012983416450375637}. Best is trial 2284 with value: 0.13948515847988838.
[I 2024-12-04 00:39:46,980] Trial 2266 finished with value: 0.3527384222094167 and parameters: {'kernel': 'linear', 'C': 95.33255279704703, 'gamma': 0.001980520514002515, 'epsilon': 0.0018874279610263972}. Best is trial 2284 with value: 0.13948515847988838.
[I 2024-12-04 00:39:47,089] Trial 2488 finished with value: 0.4151279286614828 and parameters: {'kernel': 'rbf', 'C': 3.3510877647080637, 'gamma': 0.0018369118120396403, 'epsilon': 0.0010091176834853886}. Best is trial 2284 with value: 0.13948515847988838.
