[I 2024-12-04 14:46:39,626] Trial 37 finished with value: 0.741892300788003 and parameters: {'n_estimators': 1475, 'learning_rate': 0.022528606951844353, 'max_depth': 12, 'min_samples_split': 8, 'min_samples_leaf': 9, 'subsample': 0.9861085544249107, 'max_features': None}. Best is trial 32 with value: 0.525288982270326.
[I 2024-12-04 14:46:41,480] Trial 80 finished with value: 0.5416782210913742 and parameters: {'n_estimators': 146, 'learning_rate': 0.03008174581196057, 'max_depth': 7, 'min_samples_split': 14, 'min_samples_leaf': 4, 'subsample': 0.6580694924160312, 'max_features': None}. Best is trial 32 with value: 0.525288982270326.
[I 2024-12-04 14:46:41,661] Trial 69 finished with value: 0.5928054263658766 and parameters: {'n_estimators': 370, 'learning_rate': 0.0396579199855068, 'max_depth': 4, 'min_samples_split': 10, 'min_samples_leaf': 6, 'subsample': 0.9255348006713754, 'max_features': None}. Best is trial 32 with value: 0.525288982270326.
[I 2024-12-04 14:46:43,729] Trial 82 finished with value: 0.7455531341286269 and parameters: {'n_estimators': 147, 'learning_rate': 0.048676108253581506, 'max_depth': 4, 'min_samples_split': 5, 'min_samples_leaf': 4, 'subsample': 0.8600159055361709, 'max_features': 'sqrt'}. Best is trial 32 with value: 0.525288982270326.
[I 2024-12-04 14:46:45,708] Trial 66 finished with value: 0.5803706365794838 and parameters: {'n_estimators': 604, 'learning_rate': 0.05831250728434879, 'max_depth': 3, 'min_samples_split': 12, 'min_samples_leaf': 5, 'subsample': 0.830190649756924, 'max_features': None}. Best is trial 32 with value: 0.525288982270326.
[I 2024-12-04 14:46:47,113] Trial 64 finished with value: 0.6836773791184031 and parameters: {'n_estimators': 1195, 'learning_rate': 0.09043374445557914, 'max_depth': 10, 'min_samples_split': 18, 'min_samples_leaf': 2, 'subsample': 0.7407463621764211, 'max_features': None}. Best is trial 32 with value: 0.525288982270326.
[I 2024-12-04 14:46:47,609] Trial 76 finished with value: 0.5613342246892246 and parameters: {'n_estimators': 415, 'learning_rate': 0.013679097963779, 'max_depth': 5, 'min_samples_split': 8, 'min_samples_leaf': 5, 'subsample': 0.9762050114527535, 'max_features': None}. Best is trial 32 with value: 0.525288982270326.
[I 2024-12-04 14:46:48,016] Trial 87 finished with value: 0.5664888046001018 and parameters: {'n_estimators': 201, 'learning_rate': 0.03122523852987221, 'max_depth': 4, 'min_samples_split': 12, 'min_samples_leaf': 3, 'subsample': 0.6926979635819009, 'max_features': None}. Best is trial 32 with value: 0.525288982270326.
[I 2024-12-04 14:46:48,384] Trial 73 finished with value: 0.6250510025665047 and parameters: {'n_estimators': 627, 'learning_rate': 0.09467362231536627, 'max_depth': 11, 'min_samples_split': 18, 'min_samples_leaf': 2, 'subsample': 0.8063897864209173, 'max_features': None}. Best is trial 32 with value: 0.525288982270326.
[I 2024-12-04 14:46:49,354] Trial 86 finished with value: 0.6911285537349553 and parameters: {'n_estimators': 212, 'learning_rate': 0.040871024845751405, 'max_depth': 7, 'min_samples_split': 15, 'min_samples_leaf': 5, 'subsample': 0.6327921112915944, 'max_features': 'sqrt'}. Best is trial 32 with value: 0.525288982270326.
[I 2024-12-04 14:46:50,046] Trial 91 finished with value: 0.5646531793923716 and parameters: {'n_estimators': 154, 'learning_rate': 0.054378938622722514, 'max_depth': 8, 'min_samples_split': 11, 'min_samples_leaf': 4, 'subsample': 0.6016058472132789, 'max_features': None}. Best is trial 74 with value: 0.5106949965183317.
[I 2024-12-04 14:46:50,183] Trial 74 finished with value: 0.5106949965183317 and parameters: {'n_estimators': 792, 'learning_rate': 0.05030576621987172, 'max_depth': 10, 'min_samples_split': 18, 'min_samples_leaf': 1, 'subsample': 0.7204721802050562, 'max_features': None}. Best is trial 74 with value: 0.5106949965183317.
[I 2024-12-04 14:46:50,692] Trial 65 finished with value: 0.687481288131213 and parameters: {'n_estimators': 1278, 'learning_rate': 0.07553151545692006, 'max_depth': 11, 'min_samples_split': 17, 'min_samples_leaf': 3, 'subsample': 0.7553810322395001, 'max_features': None}. Best is trial 74 with value: 0.5106949965183317.
[I 2024-12-04 14:46:50,949] Trial 75 finished with value: 0.5129777875433773 and parameters: {'n_estimators': 739, 'learning_rate': 0.08384375211498646, 'max_depth': 10, 'min_samples_split': 20, 'min_samples_leaf': 1, 'subsample': 0.7755925856415793, 'max_features': None}. Best is trial 74 with value: 0.5106949965183317.
[I 2024-12-04 14:46:50,951] Trial 83 finished with value: 0.5580327789693684 and parameters: {'n_estimators': 381, 'learning_rate': 0.012857955681068203, 'max_depth': 3, 'min_samples_split': 14, 'min_samples_leaf': 4, 'subsample': 0.7498395397101127, 'max_features': None}. Best is trial 74 with value: 0.5106949965183317.
[I 2024-12-04 14:46:54,217] Trial 96 finished with value: 0.5942137989313662 and parameters: {'n_estimators': 127, 'learning_rate': 0.04338264972631406, 'max_depth': 3, 'min_samples_split': 11, 'min_samples_leaf': 6, 'subsample': 0.6646804365107026, 'max_features': None}. Best is trial 74 with value: 0.5106949965183317.
[I 2024-12-04 14:46:54,571] Trial 94 finished with value: 0.5579792020434111 and parameters: {'n_estimators': 129, 'learning_rate': 0.021352801207588618, 'max_depth': 6, 'min_samples_split': 20, 'min_samples_leaf': 2, 'subsample': 0.6262582396695802, 'max_features': None}. Best is trial 74 with value: 0.5106949965183317.
[I 2024-12-04 14:46:54,983] Trial 78 finished with value: 0.7026816786986663 and parameters: {'n_estimators': 821, 'learning_rate': 0.0790834188536036, 'max_depth': 4, 'min_samples_split': 8, 'min_samples_leaf': 7, 'subsample': 0.832279357598786, 'max_features': 'log2'}. Best is trial 74 with value: 0.5106949965183317.
[I 2024-12-04 14:46:57,304] Trial 77 finished with value: 0.5991919086479686 and parameters: {'n_estimators': 1030, 'learning_rate': 0.011379071979925576, 'max_depth': 7, 'min_samples_split': 5, 'min_samples_leaf': 3, 'subsample': 0.6543157516016298, 'max_features': None}. Best is trial 74 with value: 0.5106949965183317.
[I 2024-12-04 14:46:58,945] Trial 81 finished with value: 0.5734693496158698 and parameters: {'n_estimators': 795, 'learning_rate': 0.032677990436069955, 'max_depth': 8, 'min_samples_split': 6, 'min_samples_leaf': 5, 'subsample': 0.68260160834901, 'max_features': None}. Best is trial 74 with value: 0.5106949965183317.
[I 2024-12-04 14:46:59,836] Trial 88 finished with value: 0.5863512499043089 and parameters: {'n_estimators': 453, 'learning_rate': 0.018434597834332832, 'max_depth': 8, 'min_samples_split': 14, 'min_samples_leaf': 5, 'subsample': 0.6163230859844573, 'max_features': None}. Best is trial 74 with value: 0.5106949965183317.
[I 2024-12-04 14:46:59,838] Trial 89 finished with value: 0.5782348749233016 and parameters: {'n_estimators': 312, 'learning_rate': 0.014471394985681648, 'max_depth': 5, 'min_samples_split': 12, 'min_samples_leaf': 3, 'subsample': 0.9788105913976511, 'max_features': None}. Best is trial 74 with value: 0.5106949965183317.
[I 2024-12-04 14:46:59,848] Trial 92 finished with value: 0.5829673757698176 and parameters: {'n_estimators': 448, 'learning_rate': 0.01944485459230211, 'max_depth': 5, 'min_samples_split': 6, 'min_samples_leaf': 6, 'subsample': 0.9495844991262882, 'max_features': None}. Best is trial 74 with value: 0.5106949965183317.
[I 2024-12-04 14:47:00,262] Trial 90 finished with value: 1.0094531876602344 and parameters: {'n_estimators': 644, 'learning_rate': 0.010465299572530234, 'max_depth': 3, 'min_samples_split': 9, 'min_samples_leaf': 4, 'subsample': 0.841201823304051, 'max_features': 'log2'}. Best is trial 74 with value: 0.5106949965183317.
[I 2024-12-04 14:47:01,839] Trial 102 finished with value: 0.5711655840625262 and parameters: {'n_estimators': 239, 'learning_rate': 0.025788395708091345, 'max_depth': 7, 'min_samples_split': 20, 'min_samples_leaf': 3, 'subsample': 0.6807547974926256, 'max_features': None}. Best is trial 74 with value: 0.5106949965183317.
[I 2024-12-04 14:47:01,853] Trial 101 finished with value: 0.6100346882122863 and parameters: {'n_estimators': 109, 'learning_rate': 0.040980958708773135, 'max_depth': 9, 'min_samples_split': 9, 'min_samples_leaf': 6, 'subsample': 0.6306081782883047, 'max_features': None}. Best is trial 74 with value: 0.5106949965183317.
[I 2024-12-04 14:47:01,904] Trial 95 finished with value: 0.6046314835491338 and parameters: {'n_estimators': 332, 'learning_rate': 0.0607313157635087, 'max_depth': 6, 'min_samples_split': 14, 'min_samples_leaf': 3, 'subsample': 0.6430993524667992, 'max_features': None}. Best is trial 74 with value: 0.5106949965183317.
[I 2024-12-04 14:47:01,971] Trial 85 finished with value: 0.5490342318773703 and parameters: {'n_estimators': 622, 'learning_rate': 0.015722761828243836, 'max_depth': 4, 'min_samples_split': 7, 'min_samples_leaf': 4, 'subsample': 0.6692658102112363, 'max_features': None}. Best is trial 74 with value: 0.5106949965183317.
[I 2024-12-04 14:47:02,327] Trial 99 finished with value: 0.6092757504253719 and parameters: {'n_estimators': 120, 'learning_rate': 0.058599341161918526, 'max_depth': 9, 'min_samples_split': 11, 'min_samples_leaf': 6, 'subsample': 0.6646521516577847, 'max_features': None}. Best is trial 74 with value: 0.5106949965183317.
[I 2024-12-04 14:47:03,011] Trial 93 finished with value: 0.5595453708678051 and parameters: {'n_estimators': 577, 'learning_rate': 0.011506037905703639, 'max_depth': 5, 'min_samples_split': 18, 'min_samples_leaf': 5, 'subsample': 0.7507500910289254, 'max_features': None}. Best is trial 74 with value: 0.5106949965183317.
[I 2024-12-04 14:47:04,142] Trial 79 finished with value: 0.6254885566146968 and parameters: {'n_estimators': 1001, 'learning_rate': 0.018001788748247673, 'max_depth': 6, 'min_samples_split': 5, 'min_samples_leaf': 3, 'subsample': 0.8124286648599953, 'max_features': None}. Best is trial 74 with value: 0.5106949965183317.
[I 2024-12-04 14:47:05,119] Trial 104 finished with value: 0.6207950092963765 and parameters: {'n_estimators': 477, 'learning_rate': 0.07378777317880868, 'max_depth': 11, 'min_samples_split': 20, 'min_samples_leaf': 2, 'subsample': 0.6452082808609794, 'max_features': None}. Best is trial 74 with value: 0.5106949965183317.
[I 2024-12-04 14:47:05,268] Trial 100 finished with value: 0.6029966949665694 and parameters: {'n_estimators': 256, 'learning_rate': 0.010900548651190408, 'max_depth': 3, 'min_samples_split': 13, 'min_samples_leaf': 6, 'subsample': 0.6921493220120921, 'max_features': None}. Best is trial 74 with value: 0.5106949965183317.
[I 2024-12-04 14:47:05,306] Trial 84 finished with value: 0.6319707828828638 and parameters: {'n_estimators': 748, 'learning_rate': 0.011052171339657073, 'max_depth': 6, 'min_samples_split': 4, 'min_samples_leaf': 7, 'subsample': 0.6972557181514613, 'max_features': None}. Best is trial 74 with value: 0.5106949965183317.
[I 2024-12-04 14:47:08,408] Trial 107 finished with value: 0.5720654691499357 and parameters: {'n_estimators': 355, 'learning_rate': 0.016054303569139464, 'max_depth': 3, 'min_samples_split': 18, 'min_samples_leaf': 2, 'subsample': 0.627736466586046, 'max_features': None}. Best is trial 74 with value: 0.5106949965183317.
[I 2024-12-04 14:47:10,064] Trial 98 finished with value: 0.5240941134010776 and parameters: {'n_estimators': 892, 'learning_rate': 0.037518604831313807, 'max_depth': 7, 'min_samples_split': 17, 'min_samples_leaf': 1, 'subsample': 0.7354300027260546, 'max_features': None}. Best is trial 74 with value: 0.5106949965183317.
[I 2024-12-04 14:47:10,308] Trial 103 finished with value: 0.5401768421240685 and parameters: {'n_estimators': 602, 'learning_rate': 0.01933531888803308, 'max_depth': 5, 'min_samples_split': 19, 'min_samples_leaf': 1, 'subsample': 0.6285220840994736, 'max_features': None}. Best is trial 74 with value: 0.5106949965183317.
[I 2024-12-04 14:47:10,463] Trial 114 finished with value: 0.5419132381690734 and parameters: {'n_estimators': 152, 'learning_rate': 0.028920993775836217, 'max_depth': 4, 'min_samples_split': 20, 'min_samples_leaf': 4, 'subsample': 0.6201653237165462, 'max_features': None}. Best is trial 74 with value: 0.5106949965183317.
[I 2024-12-04 14:47:11,581] Trial 111 finished with value: 0.6150386572283617 and parameters: {'n_estimators': 493, 'learning_rate': 0.015815268623834193, 'max_depth': 3, 'min_samples_split': 5, 'min_samples_leaf': 2, 'subsample': 0.6855387051098181, 'max_features': None}. Best is trial 109 with value: 0.5035994322851716.
[I 2024-12-04 14:47:13,772] Trial 109 finished with value: 0.5035994322851716 and parameters: {'n_estimators': 564, 'learning_rate': 0.03156117138542652, 'max_depth': 11, 'min_samples_split': 14, 'min_samples_leaf': 1, 'subsample': 0.8164774321088937, 'max_features': None}. Best is trial 109 with value: 0.5035994322851716.
[I 2024-12-04 14:47:13,929] Trial 97 finished with value: 0.6297453123419979 and parameters: {'n_estimators': 954, 'learning_rate': 0.03828312830476079, 'max_depth': 9, 'min_samples_split': 19, 'min_samples_leaf': 2, 'subsample': 0.739345765765088, 'max_features': None}. Best is trial 109 with value: 0.5035994322851716.
[I 2024-12-04 14:47:14,410] Trial 106 finished with value: 0.6205364346775104 and parameters: {'n_estimators': 707, 'learning_rate': 0.05398984677178633, 'max_depth': 10, 'min_samples_split': 19, 'min_samples_leaf': 2, 'subsample': 0.72614983729497, 'max_features': None}. Best is trial 113 with value: 0.4836846138702707.
[I 2024-12-04 14:47:14,417] Trial 108 finished with value: 0.6906518299485551 and parameters: {'n_estimators': 983, 'learning_rate': 0.08764538306275531, 'max_depth': 11, 'min_samples_split': 19, 'min_samples_leaf': 2, 'subsample': 0.7312404550706406, 'max_features': 'sqrt'}. Best is trial 113 with value: 0.4836846138702707.
[I 2024-12-04 14:47:14,491] Trial 115 finished with value: 0.5779925532185084 and parameters: {'n_estimators': 728, 'learning_rate': 0.012821106872114345, 'max_depth': 5, 'min_samples_split': 17, 'min_samples_leaf': 5, 'subsample': 0.6579079570272222, 'max_features': None}. Best is trial 113 with value: 0.4836846138702707.
[I 2024-12-04 14:47:15,282] Trial 119 finished with value: 0.590481305779192 and parameters: {'n_estimators': 757, 'learning_rate': 0.012493186274587741, 'max_depth': 8, 'min_samples_split': 19, 'min_samples_leaf': 6, 'subsample': 0.7748650355290301, 'max_features': None}. Best is trial 113 with value: 0.4836846138702707.
[I 2024-12-04 14:47:15,292] Trial 113 finished with value: 0.4836846138702707 and parameters: {'n_estimators': 877, 'learning_rate': 0.049306640955027424, 'max_depth': 10, 'min_samples_split': 20, 'min_samples_leaf': 1, 'subsample': 0.8578080351062378, 'max_features': None}. Best is trial 113 with value: 0.4836846138702707.
[I 2024-12-04 14:47:15,294] Trial 105 finished with value: 0.5615158810640484 and parameters: {'n_estimators': 493, 'learning_rate': 0.010161405957543931, 'max_depth': 4, 'min_samples_split': 11, 'min_samples_leaf': 4, 'subsample': 0.7889491103595427, 'max_features': None}. Best is trial 113 with value: 0.4836846138702707.
[I 2024-12-04 14:47:15,862] Trial 116 finished with value: 1.0689643162689975 and parameters: {'n_estimators': 162, 'learning_rate': 0.03343021500571404, 'max_depth': 5, 'min_samples_split': 20, 'min_samples_leaf': 5, 'subsample': 0.6471915812427252, 'max_features': 'log2'}. Best is trial 113 with value: 0.4836846138702707.
[I 2024-12-04 14:47:16,803] Trial 121 finished with value: 0.5444171825475419 and parameters: {'n_estimators': 206, 'learning_rate': 0.019813615445384517, 'max_depth': 5, 'min_samples_split': 20, 'min_samples_leaf': 3, 'subsample': 0.6232346283135615, 'max_features': None}. Best is trial 113 with value: 0.4836846138702707.
[I 2024-12-04 14:47:17,194] Trial 112 finished with value: 0.6122691375428532 and parameters: {'n_estimators': 301, 'learning_rate': 0.030475507760329788, 'max_depth': 10, 'min_samples_split': 13, 'min_samples_leaf': 3, 'subsample': 0.8562204216678915, 'max_features': None}. Best is trial 113 with value: 0.4836846138702707.
[I 2024-12-04 14:47:18,152] Trial 126 finished with value: 0.577794692060902 and parameters: {'n_estimators': 251, 'learning_rate': 0.041532027595351864, 'max_depth': 3, 'min_samples_split': 20, 'min_samples_leaf': 3, 'subsample': 0.6673499430435763, 'max_features': None}. Best is trial 113 with value: 0.4836846138702707.
[I 2024-12-04 14:47:18,210] Trial 110 finished with value: 0.8053539634118633 and parameters: {'n_estimators': 973, 'learning_rate': 0.011805635899364769, 'max_depth': 3, 'min_samples_split': 16, 'min_samples_leaf': 1, 'subsample': 0.6253094359379431, 'max_features': 'log2'}. Best is trial 113 with value: 0.4836846138702707.
[I 2024-12-04 14:47:18,286] Trial 120 finished with value: 0.5790384733288056 and parameters: {'n_estimators': 600, 'learning_rate': 0.01880112121236285, 'max_depth': 10, 'min_samples_split': 16, 'min_samples_leaf': 1, 'subsample': 0.8623818298841318, 'max_features': 'sqrt'}. Best is trial 113 with value: 0.4836846138702707.
[I 2024-12-04 14:47:19,755] Trial 122 finished with value: 0.6648717763344434 and parameters: {'n_estimators': 434, 'learning_rate': 0.03471425981511107, 'max_depth': 11, 'min_samples_split': 9, 'min_samples_leaf': 2, 'subsample': 0.8750161926754603, 'max_features': None}. Best is trial 113 with value: 0.4836846138702707.
[I 2024-12-04 14:47:20,875] Trial 118 finished with value: 0.9563854253585192 and parameters: {'n_estimators': 591, 'learning_rate': 0.021948520476469228, 'max_depth': 4, 'min_samples_split': 7, 'min_samples_leaf': 5, 'subsample': 0.6095738989506863, 'max_features': 'log2'}. Best is trial 113 with value: 0.4836846138702707.
[I 2024-12-04 14:47:21,373] Trial 124 finished with value: 0.6206217813594506 and parameters: {'n_estimators': 998, 'learning_rate': 0.030138333439531335, 'max_depth': 6, 'min_samples_split': 16, 'min_samples_leaf': 2, 'subsample': 0.6079962602796702, 'max_features': None}. Best is trial 113 with value: 0.4836846138702707.
[I 2024-12-04 14:47:21,448] Trial 125 finished with value: 0.9448579443479256 and parameters: {'n_estimators': 141, 'learning_rate': 0.024763928129677468, 'max_depth': 5, 'min_samples_split': 20, 'min_samples_leaf': 4, 'subsample': 0.634614289353905, 'max_features': 'sqrt'}. Best is trial 113 with value: 0.4836846138702707.
[I 2024-12-04 14:47:21,649] Trial 117 finished with value: 0.5104223705262207 and parameters: {'n_estimators': 982, 'learning_rate': 0.06729554675479042, 'max_depth': 10, 'min_samples_split': 20, 'min_samples_leaf': 1, 'subsample': 0.8488128291690086, 'max_features': None}. Best is trial 113 with value: 0.4836846138702707.
[I 2024-12-04 14:47:24,794] Trial 133 finished with value: 0.5294039770945544 and parameters: {'n_estimators': 432, 'learning_rate': 0.025928083232140003, 'max_depth': 7, 'min_samples_split': 20, 'min_samples_leaf': 1, 'subsample': 0.6056640397756927, 'max_features': None}. Best is trial 123 with value: 0.47822716547411176.
[I 2024-12-04 14:47:25,329] Trial 129 finished with value: 0.5736847912347413 and parameters: {'n_estimators': 335, 'learning_rate': 0.02318165171836138, 'max_depth': 4, 'min_samples_split': 20, 'min_samples_leaf': 5, 'subsample': 0.6339328575159224, 'max_features': None}. Best is trial 123 with value: 0.47822716547411176.
[I 2024-12-04 14:47:25,490] Trial 128 finished with value: 0.5479873139244495 and parameters: {'n_estimators': 213, 'learning_rate': 0.028115572518660942, 'max_depth': 5, 'min_samples_split': 20, 'min_samples_leaf': 4, 'subsample': 0.6335011722470696, 'max_features': None}. Best is trial 123 with value: 0.47822716547411176.
[I 2024-12-04 14:47:25,557] Trial 123 finished with value: 0.47822716547411176 and parameters: {'n_estimators': 740, 'learning_rate': 0.03638787035704059, 'max_depth': 12, 'min_samples_split': 17, 'min_samples_leaf': 1, 'subsample': 0.8800396888461754, 'max_features': None}. Best is trial 123 with value: 0.47822716547411176.
[I 2024-12-04 14:47:27,655] Trial 131 finished with value: 0.6797001912618044 and parameters: {'n_estimators': 299, 'learning_rate': 0.04479550214190477, 'max_depth': 12, 'min_samples_split': 16, 'min_samples_leaf': 2, 'subsample': 0.8181408594687148, 'max_features': 'log2'}. Best is trial 123 with value: 0.47822716547411176.
[I 2024-12-04 14:47:29,151] Trial 135 finished with value: 0.5848908956570992 and parameters: {'n_estimators': 134, 'learning_rate': 0.03811923150854737, 'max_depth': 5, 'min_samples_split': 19, 'min_samples_leaf': 6, 'subsample': 0.6643965891545688, 'max_features': None}. Best is trial 123 with value: 0.47822716547411176.
[I 2024-12-04 14:47:30,303] Trial 134 finished with value: 0.5185136639984826 and parameters: {'n_estimators': 925, 'learning_rate': 0.03549512469142582, 'max_depth': 9, 'min_samples_split': 17, 'min_samples_leaf': 1, 'subsample': 0.8476709442094259, 'max_features': None}. Best is trial 123 with value: 0.47822716547411176.
[I 2024-12-04 14:47:31,736] Trial 127 finished with value: 0.5036442140645636 and parameters: {'n_estimators': 644, 'learning_rate': 0.06443109057854217, 'max_depth': 8, 'min_samples_split': 18, 'min_samples_leaf': 1, 'subsample': 0.8613604084324064, 'max_features': None}. Best is trial 123 with value: 0.47822716547411176.
[I 2024-12-04 14:47:35,935] Trial 150 finished with value: 0.5053761247340245 and parameters: {'n_estimators': 249, 'learning_rate': 0.07419097035272379, 'max_depth': 12, 'min_samples_split': 16, 'min_samples_leaf': 1, 'subsample': 0.9709803293758723, 'max_features': None}. Best is trial 123 with value: 0.47822716547411176.
