[I 2024-12-04 20:13:05,461] Trial 1255 finished with value: 0.8416815930662195 and parameters: {'n_estimators': 131, 'max_depth': 29, 'min_samples_split': 13, 'min_samples_leaf': 2, 'max_features': 'sqrt', 'bootstrap': True, 'criterion': 'squared_error'}. Best is trial 874 with value: 0.32176430753353746.
[I 2024-12-04 20:13:07,045] Trial 1257 finished with value: 0.4178064471360753 and parameters: {'n_estimators': 262, 'max_depth': 40, 'min_samples_split': 4, 'min_samples_leaf': 1, 'max_features': 'sqrt', 'bootstrap': False, 'criterion': 'squared_error'}. Best is trial 874 with value: 0.32176430753353746.
[I 2024-12-04 20:13:08,286] Trial 1258 finished with value: 0.6723131173859528 and parameters: {'n_estimators': 363, 'max_depth': 44, 'min_samples_split': 2, 'min_samples_leaf': 2, 'max_features': 'sqrt', 'bootstrap': False, 'criterion': 'squared_error'}. Best is trial 874 with value: 0.32176430753353746.
[I 2024-12-04 20:13:10,020] Trial 1259 finished with value: 0.39992427117693885 and parameters: {'n_estimators': 415, 'max_depth': 43, 'min_samples_split': 3, 'min_samples_leaf': 1, 'max_features': 'sqrt', 'bootstrap': False, 'criterion': 'squared_error'}. Best is trial 874 with value: 0.32176430753353746.
[I 2024-12-04 20:13:11,328] Trial 1260 finished with value: 0.6819579823579344 and parameters: {'n_estimators': 405, 'max_depth': 50, 'min_samples_split': 2, 'min_samples_leaf': 2, 'max_features': 'sqrt', 'bootstrap': False, 'criterion': 'squared_error'}. Best is trial 874 with value: 0.32176430753353746.
[I 2024-12-04 20:13:15,580] Trial 1261 finished with value: 0.43401844504572 and parameters: {'n_estimators': 432, 'max_depth': 50, 'min_samples_split': 2, 'min_samples_leaf': 1, 'max_features': None, 'bootstrap': False, 'criterion': 'squared_error'}. Best is trial 874 with value: 0.32176430753353746.
[I 2024-12-04 20:13:15,894] Trial 1256 finished with value: 0.42174263241009335 and parameters: {'n_estimators': 423, 'max_depth': 49, 'min_samples_split': 4, 'min_samples_leaf': 1, 'max_features': 'sqrt', 'bootstrap': False, 'criterion': 'absolute_error'}. Best is trial 874 with value: 0.32176430753353746.
[I 2024-12-04 20:13:18,002] Trial 1262 finished with value: 0.3246218385007584 and parameters: {'n_estimators': 430, 'max_depth': 50, 'min_samples_split': 2, 'min_samples_leaf': 1, 'max_features': 'sqrt', 'bootstrap': False, 'criterion': 'squared_error'}. Best is trial 874 with value: 0.32176430753353746.
[I 2024-12-04 20:13:18,256] Trial 1263 finished with value: 0.3656147570003811 and parameters: {'n_estimators': 566, 'max_depth': 50, 'min_samples_split': 3, 'min_samples_leaf': 1, 'max_features': 'sqrt', 'bootstrap': False, 'criterion': 'squared_error'}. Best is trial 874 with value: 0.32176430753353746.
[I 2024-12-04 20:13:20,704] Trial 1264 finished with value: 0.32807929124616225 and parameters: {'n_estimators': 504, 'max_depth': 50, 'min_samples_split': 2, 'min_samples_leaf': 1, 'max_features': 'sqrt', 'bootstrap': False, 'criterion': 'squared_error'}. Best is trial 874 with value: 0.32176430753353746.
[I 2024-12-04 20:13:22,656] Trial 1266 finished with value: 0.3239513504704164 and parameters: {'n_estimators': 356, 'max_depth': 50, 'min_samples_split': 2, 'min_samples_leaf': 1, 'max_features': 'sqrt', 'bootstrap': False, 'criterion': 'squared_error'}. Best is trial 874 with value: 0.32176430753353746.
[I 2024-12-04 20:13:24,334] Trial 1267 finished with value: 0.6188826355612205 and parameters: {'n_estimators': 320, 'max_depth': 8, 'min_samples_split': 2, 'min_samples_leaf': 9, 'max_features': None, 'bootstrap': True, 'criterion': 'squared_error'}. Best is trial 874 with value: 0.32176430753353746.
[I 2024-12-04 20:13:25,417] Trial 1268 finished with value: 0.6708426728896962 and parameters: {'n_estimators': 260, 'max_depth': 43, 'min_samples_split': 3, 'min_samples_leaf': 2, 'max_features': 'sqrt', 'bootstrap': False, 'criterion': 'squared_error'}. Best is trial 874 with value: 0.32176430753353746.
[I 2024-12-04 20:13:28,876] Trial 1225 finished with value: 0.45663426349396335 and parameters: {'n_estimators': 873, 'max_depth': 28, 'min_samples_split': 6, 'min_samples_leaf': 1, 'max_features': None, 'bootstrap': True, 'criterion': 'absolute_error'}. Best is trial 874 with value: 0.32176430753353746.
[I 2024-12-04 20:13:30,970] Trial 1270 finished with value: 0.35142872072873427 and parameters: {'n_estimators': 431, 'max_depth': 43, 'min_samples_split': 2, 'min_samples_leaf': 1, 'max_features': 'sqrt', 'bootstrap': False, 'criterion': 'squared_error'}. Best is trial 874 with value: 0.32176430753353746.
[I 2024-12-04 20:13:31,945] Trial 1271 finished with value: 1.219161030407203 and parameters: {'n_estimators': 111, 'max_depth': 43, 'min_samples_split': 6, 'min_samples_leaf': 5, 'max_features': 'sqrt', 'bootstrap': True, 'criterion': 'absolute_error'}. Best is trial 874 with value: 0.32176430753353746.
[I 2024-12-04 20:13:33,486] Trial 1272 finished with value: 0.3232518764164598 and parameters: {'n_estimators': 252, 'max_depth': 50, 'min_samples_split': 2, 'min_samples_leaf': 1, 'max_features': 'sqrt', 'bootstrap': False, 'criterion': 'squared_error'}. Best is trial 874 with value: 0.32176430753353746.
[I 2024-12-04 20:13:34,915] Trial 1273 finished with value: 0.5554251257687228 and parameters: {'n_estimators': 406, 'max_depth': 48, 'min_samples_split': 4, 'min_samples_leaf': 1, 'max_features': 'log2', 'bootstrap': False, 'criterion': 'squared_error'}. Best is trial 874 with value: 0.32176430753353746.
[I 2024-12-04 20:13:36,680] Trial 1274 finished with value: 1.1323918198075529 and parameters: {'n_estimators': 943, 'max_depth': 10, 'min_samples_split': 5, 'min_samples_leaf': 1, 'max_features': 'log2', 'bootstrap': True, 'criterion': 'squared_error'}. Best is trial 874 with value: 0.32176430753353746.
[I 2024-12-04 20:13:38,382] Trial 1275 finished with value: 0.3461793930939451 and parameters: {'n_estimators': 311, 'max_depth': 43, 'min_samples_split': 2, 'min_samples_leaf': 1, 'max_features': 'sqrt', 'bootstrap': False, 'criterion': 'squared_error'}. Best is trial 874 with value: 0.32176430753353746.
[I 2024-12-04 20:13:45,956] Trial 1276 finished with value: 0.37151551906039365 and parameters: {'n_estimators': 301, 'max_depth': 44, 'min_samples_split': 2, 'min_samples_leaf': 1, 'max_features': 'sqrt', 'bootstrap': False, 'criterion': 'absolute_error'}. Best is trial 874 with value: 0.32176430753353746.
[I 2024-12-04 20:13:47,486] Trial 1277 finished with value: 0.3867960110013145 and parameters: {'n_estimators': 376, 'max_depth': 50, 'min_samples_split': 4, 'min_samples_leaf': 1, 'max_features': 'sqrt', 'bootstrap': False, 'criterion': 'squared_error'}. Best is trial 874 with value: 0.32176430753353746.
[I 2024-12-04 20:14:18,192] Trial 1269 finished with value: 0.5109257853099672 and parameters: {'n_estimators': 856, 'max_depth': 46, 'min_samples_split': 5, 'min_samples_leaf': 3, 'max_features': None, 'bootstrap': False, 'criterion': 'absolute_error'}. Best is trial 874 with value: 0.32176430753353746.
[I 2024-12-04 20:14:20,468] Trial 1279 finished with value: 0.3290612550567856 and parameters: {'n_estimators': 467, 'max_depth': 50, 'min_samples_split': 2, 'min_samples_leaf': 1, 'max_features': 'sqrt', 'bootstrap': False, 'criterion': 'squared_error'}. Best is trial 874 with value: 0.32176430753353746.
[I 2024-12-04 20:14:33,287] Trial 1280 finished with value: 0.4453264887718348 and parameters: {'n_estimators': 555, 'max_depth': 35, 'min_samples_split': 2, 'min_samples_leaf': 1, 'max_features': 'sqrt', 'bootstrap': False, 'criterion': 'absolute_error'}. Best is trial 874 with value: 0.32176430753353746.
[I 2024-12-04 20:14:34,882] Trial 1281 finished with value: 0.3249743659709739 and parameters: {'n_estimators': 263, 'max_depth': 50, 'min_samples_split': 2, 'min_samples_leaf': 1, 'max_features': 'sqrt', 'bootstrap': False, 'criterion': 'squared_error'}. Best is trial 874 with value: 0.32176430753353746.
[I 2024-12-04 20:14:36,712] Trial 1282 finished with value: 0.3459956428408275 and parameters: {'n_estimators': 358, 'max_depth': 41, 'min_samples_split': 2, 'min_samples_leaf': 1, 'max_features': 'sqrt', 'bootstrap': False, 'criterion': 'squared_error'}. Best is trial 874 with value: 0.32176430753353746.
[I 2024-12-04 20:14:38,246] Trial 1283 finished with value: 0.5257005005048082 and parameters: {'n_estimators': 284, 'max_depth': 49, 'min_samples_split': 2, 'min_samples_leaf': 1, 'max_features': 'log2', 'bootstrap': False, 'criterion': 'squared_error'}. Best is trial 874 with value: 0.32176430753353746.
[I 2024-12-04 20:14:40,166] Trial 1284 finished with value: 0.3238915190966349 and parameters: {'n_estimators': 359, 'max_depth': 50, 'min_samples_split': 2, 'min_samples_leaf': 1, 'max_features': 'sqrt', 'bootstrap': False, 'criterion': 'squared_error'}. Best is trial 874 with value: 0.32176430753353746.
[I 2024-12-04 20:14:41,496] Trial 1285 finished with value: 0.38588638224283467 and parameters: {'n_estimators': 281, 'max_depth': 50, 'min_samples_split': 4, 'min_samples_leaf': 1, 'max_features': 'sqrt', 'bootstrap': False, 'criterion': 'squared_error'}. Best is trial 874 with value: 0.32176430753353746.
[I 2024-12-04 20:14:46,694] Trial 1278 finished with value: 0.5223086432883071 and parameters: {'n_estimators': 465, 'max_depth': 43, 'min_samples_split': 10, 'min_samples_leaf': 1, 'max_features': None, 'bootstrap': False, 'criterion': 'absolute_error'}. Best is trial 874 with value: 0.32176430753353746.
[I 2024-12-04 20:14:48,078] Trial 1287 finished with value: 0.6873247043564136 and parameters: {'n_estimators': 498, 'max_depth': 50, 'min_samples_split': 3, 'min_samples_leaf': 2, 'max_features': 'sqrt', 'bootstrap': False, 'criterion': 'squared_error'}. Best is trial 874 with value: 0.32176430753353746.
[I 2024-12-04 20:14:49,441] Trial 1288 finished with value: 0.3256729029481535 and parameters: {'n_estimators': 197, 'max_depth': 50, 'min_samples_split': 2, 'min_samples_leaf': 1, 'max_features': 'sqrt', 'bootstrap': False, 'criterion': 'squared_error'}. Best is trial 874 with value: 0.32176430753353746.
[I 2024-12-04 20:14:50,676] Trial 1289 finished with value: 0.6767972739910175 and parameters: {'n_estimators': 384, 'max_depth': 50, 'min_samples_split': 2, 'min_samples_leaf': 2, 'max_features': 'sqrt', 'bootstrap': False, 'criterion': 'squared_error'}. Best is trial 874 with value: 0.32176430753353746.
[I 2024-12-04 20:14:52,539] Trial 1290 finished with value: 0.5519049221825625 and parameters: {'n_estimators': 318, 'max_depth': 50, 'min_samples_split': 2, 'min_samples_leaf': 8, 'max_features': None, 'bootstrap': False, 'criterion': 'squared_error'}. Best is trial 874 with value: 0.32176430753353746.
[I 2024-12-04 20:14:53,415] Trial 1265 finished with value: 0.6070056070731503 and parameters: {'n_estimators': 978, 'max_depth': 8, 'min_samples_split': 41, 'min_samples_leaf': 1, 'max_features': None, 'bootstrap': False, 'criterion': 'absolute_error'}. Best is trial 874 with value: 0.32176430753353746.
[I 2024-12-04 20:14:53,475] Trial 1286 finished with value: 0.5657056525507538 and parameters: {'n_estimators': 407, 'max_depth': 11, 'min_samples_split': 3, 'min_samples_leaf': 8, 'max_features': None, 'bootstrap': False, 'criterion': 'absolute_error'}. Best is trial 874 with value: 0.32176430753353746.
[I 2024-12-04 20:14:54,557] Trial 1291 finished with value: 0.4114394615544371 and parameters: {'n_estimators': 401, 'max_depth': 42, 'min_samples_split': 4, 'min_samples_leaf': 1, 'max_features': 'sqrt', 'bootstrap': False, 'criterion': 'squared_error'}. Best is trial 874 with value: 0.32176430753353746.
[I 2024-12-04 20:14:55,511] Trial 1294 finished with value: 0.6599686957000801 and parameters: {'n_estimators': 155, 'max_depth': 50, 'min_samples_split': 2, 'min_samples_leaf': 2, 'max_features': 'sqrt', 'bootstrap': False, 'criterion': 'squared_error'}. Best is trial 874 with value: 0.32176430753353746.
[I 2024-12-04 20:14:55,630] Trial 1292 finished with value: 0.32364337564373286 and parameters: {'n_estimators': 327, 'max_depth': 50, 'min_samples_split': 2, 'min_samples_leaf': 1, 'max_features': 'sqrt', 'bootstrap': False, 'criterion': 'squared_error'}. Best is trial 874 with value: 0.32176430753353746.
[I 2024-12-04 20:14:55,932] Trial 1293 finished with value: 0.34645197998915095 and parameters: {'n_estimators': 364, 'max_depth': 41, 'min_samples_split': 2, 'min_samples_leaf': 1, 'max_features': 'sqrt', 'bootstrap': False, 'criterion': 'squared_error'}. Best is trial 874 with value: 0.32176430753353746.
[I 2024-12-04 20:14:57,050] Trial 1296 finished with value: 1.351369194862467 and parameters: {'n_estimators': 219, 'max_depth': 37, 'min_samples_split': 35, 'min_samples_leaf': 14, 'max_features': 'log2', 'bootstrap': True, 'criterion': 'absolute_error'}. Best is trial 874 with value: 0.32176430753353746.
[I 2024-12-04 20:14:58,052] Trial 1295 finished with value: 0.322241352022175 and parameters: {'n_estimators': 373, 'max_depth': 50, 'min_samples_split': 2, 'min_samples_leaf': 1, 'max_features': 'sqrt', 'bootstrap': False, 'criterion': 'squared_error'}. Best is trial 874 with value: 0.32176430753353746.
[I 2024-12-04 20:15:00,604] Trial 1299 finished with value: 0.32716886692929875 and parameters: {'n_estimators': 541, 'max_depth': 50, 'min_samples_split': 2, 'min_samples_leaf': 1, 'max_features': 'sqrt', 'bootstrap': False, 'criterion': 'squared_error'}. Best is trial 874 with value: 0.32176430753353746.
[I 2024-12-04 20:15:01,170] Trial 1298 finished with value: 0.9618928986904356 and parameters: {'n_estimators': 443, 'max_depth': 46, 'min_samples_split': 5, 'min_samples_leaf': 2, 'max_features': 'sqrt', 'bootstrap': True, 'criterion': 'absolute_error'}. Best is trial 874 with value: 0.32176430753353746.
[I 2024-12-04 20:15:03,702] Trial 1300 finished with value: 0.4294294426756899 and parameters: {'n_estimators': 308, 'max_depth': 46, 'min_samples_split': 3, 'min_samples_leaf': 1, 'max_features': None, 'bootstrap': False, 'criterion': 'squared_error'}. Best is trial 874 with value: 0.32176430753353746.
[I 2024-12-04 20:15:03,927] Trial 1301 finished with value: 0.4424204099053223 and parameters: {'n_estimators': 334, 'max_depth': 47, 'min_samples_split': 2, 'min_samples_leaf': 1, 'max_features': None, 'bootstrap': True, 'criterion': 'squared_error'}. Best is trial 874 with value: 0.32176430753353746.
[I 2024-12-04 20:15:05,207] Trial 1302 finished with value: 0.4087792915227167 and parameters: {'n_estimators': 276, 'max_depth': 42, 'min_samples_split': 4, 'min_samples_leaf': 1, 'max_features': 'sqrt', 'bootstrap': False, 'criterion': 'squared_error'}. Best is trial 874 with value: 0.32176430753353746.
[I 2024-12-04 20:15:05,742] Trial 1303 finished with value: 0.3868854059912661 and parameters: {'n_estimators': 377, 'max_depth': 50, 'min_samples_split': 4, 'min_samples_leaf': 1, 'max_features': 'sqrt', 'bootstrap': False, 'criterion': 'squared_error'}. Best is trial 874 with value: 0.32176430753353746.
[I 2024-12-04 20:15:06,582] Trial 1304 finished with value: 0.7000689744017858 and parameters: {'n_estimators': 294, 'max_depth': 27, 'min_samples_split': 2, 'min_samples_leaf': 2, 'max_features': 'sqrt', 'bootstrap': False, 'criterion': 'squared_error'}. Best is trial 874 with value: 0.32176430753353746.
[I 2024-12-04 20:15:07,628] Trial 1306 finished with value: 1.0574116917254428 and parameters: {'n_estimators': 356, 'max_depth': 50, 'min_samples_split': 3, 'min_samples_leaf': 2, 'max_features': 'log2', 'bootstrap': False, 'criterion': 'squared_error'}. Best is trial 874 with value: 0.32176430753353746.
[I 2024-12-04 20:15:10,896] Trial 1307 finished with value: 0.4341594784033842 and parameters: {'n_estimators': 312, 'max_depth': 50, 'min_samples_split': 2, 'min_samples_leaf': 1, 'max_features': None, 'bootstrap': False, 'criterion': 'squared_error'}. Best is trial 874 with value: 0.32176430753353746.
[I 2024-12-04 20:15:15,566] Trial 1305 finished with value: 0.865763296640591 and parameters: {'n_estimators': 593, 'max_depth': 33, 'min_samples_split': 8, 'min_samples_leaf': 1, 'max_features': 'log2', 'bootstrap': False, 'criterion': 'absolute_error'}. Best is trial 874 with value: 0.32176430753353746.
[I 2024-12-04 20:15:17,848] Trial 1309 finished with value: 0.32907602598923386 and parameters: {'n_estimators': 474, 'max_depth': 50, 'min_samples_split': 2, 'min_samples_leaf': 1, 'max_features': 'sqrt', 'bootstrap': False, 'criterion': 'squared_error'}. Best is trial 874 with value: 0.32176430753353746.
[I 2024-12-04 20:15:19,470] Trial 1297 finished with value: 0.4158836177036143 and parameters: {'n_estimators': 197, 'max_depth': 13, 'min_samples_split': 3, 'min_samples_leaf': 1, 'max_features': None, 'bootstrap': False, 'criterion': 'absolute_error'}. Best is trial 874 with value: 0.32176430753353746.
[I 2024-12-04 20:15:20,030] Trial 1310 finished with value: 0.32347932950710123 and parameters: {'n_estimators': 400, 'max_depth': 50, 'min_samples_split': 2, 'min_samples_leaf': 1, 'max_features': 'sqrt', 'bootstrap': False, 'criterion': 'squared_error'}. Best is trial 874 with value: 0.32176430753353746.
[I 2024-12-04 20:15:21,757] Trial 1312 finished with value: 0.3427828200446117 and parameters: {'n_estimators': 260, 'max_depth': 41, 'min_samples_split': 2, 'min_samples_leaf': 1, 'max_features': 'sqrt', 'bootstrap': False, 'criterion': 'squared_error'}. Best is trial 874 with value: 0.32176430753353746.
[I 2024-12-04 20:15:23,094] Trial 1313 finished with value: 0.5441990477495857 and parameters: {'n_estimators': 265, 'max_depth': 50, 'min_samples_split': 3, 'min_samples_leaf': 1, 'max_features': 'log2', 'bootstrap': True, 'criterion': 'squared_error'}. Best is trial 874 with value: 0.32176430753353746.
[I 2024-12-04 20:15:23,158] Trial 1311 finished with value: 0.8190576366873363 and parameters: {'n_estimators': 670, 'max_depth': 35, 'min_samples_split': 47, 'min_samples_leaf': 2, 'max_features': None, 'bootstrap': False, 'criterion': 'squared_error'}. Best is trial 874 with value: 0.32176430753353746.
[I 2024-12-04 20:15:25,261] Trial 1314 finished with value: 0.4526247125043433 and parameters: {'n_estimators': 493, 'max_depth': 50, 'min_samples_split': 4, 'min_samples_leaf': 1, 'max_features': 'sqrt', 'bootstrap': True, 'criterion': 'squared_error'}. Best is trial 874 with value: 0.32176430753353746.
[I 2024-12-04 20:15:27,757] Trial 1315 finished with value: 0.5888894650934449 and parameters: {'n_estimators': 877, 'max_depth': 15, 'min_samples_split': 2, 'min_samples_leaf': 6, 'max_features': None, 'bootstrap': False, 'criterion': 'squared_error'}. Best is trial 874 with value: 0.32176430753353746.
[I 2024-12-04 20:15:28,761] Trial 1317 finished with value: 1.2272457378682955 and parameters: {'n_estimators': 270, 'max_depth': 29, 'min_samples_split': 36, 'min_samples_leaf': 13, 'max_features': 'sqrt', 'bootstrap': True, 'criterion': 'squared_error'}. Best is trial 874 with value: 0.32176430753353746.
[I 2024-12-04 20:15:29,553] Trial 1316 finished with value: 0.8004785346067639 and parameters: {'n_estimators': 342, 'max_depth': 19, 'min_samples_split': 49, 'min_samples_leaf': 9, 'max_features': None, 'bootstrap': True, 'criterion': 'absolute_error'}. Best is trial 874 with value: 0.32176430753353746.
[I 2024-12-04 20:15:30,890] Trial 1318 finished with value: 0.5429815711599145 and parameters: {'n_estimators': 289, 'max_depth': 11, 'min_samples_split': 4, 'min_samples_leaf': 2, 'max_features': None, 'bootstrap': False, 'criterion': 'squared_error'}. Best is trial 874 with value: 0.32176430753353746.
[I 2024-12-04 20:15:31,305] Trial 1319 finished with value: 0.3593894371725505 and parameters: {'n_estimators': 358, 'max_depth': 50, 'min_samples_split': 3, 'min_samples_leaf': 1, 'max_features': 'sqrt', 'bootstrap': False, 'criterion': 'squared_error'}. Best is trial 874 with value: 0.32176430753353746.
[I 2024-12-04 20:15:32,329] Trial 1320 finished with value: 0.6756093734974616 and parameters: {'n_estimators': 345, 'max_depth': 43, 'min_samples_split': 2, 'min_samples_leaf': 2, 'max_features': 'sqrt', 'bootstrap': False, 'criterion': 'squared_error'}. Best is trial 874 with value: 0.32176430753353746.
[I 2024-12-04 20:15:33,347] Trial 1321 finished with value: 0.39066369513379273 and parameters: {'n_estimators': 349, 'max_depth': 48, 'min_samples_split': 2, 'min_samples_leaf': 1, 'max_features': 'sqrt', 'bootstrap': True, 'criterion': 'squared_error'}. Best is trial 874 with value: 0.32176430753353746.
[I 2024-12-04 20:15:34,188] Trial 1322 finished with value: 0.34449562776479226 and parameters: {'n_estimators': 287, 'max_depth': 44, 'min_samples_split': 2, 'min_samples_leaf': 1, 'max_features': 'sqrt', 'bootstrap': False, 'criterion': 'squared_error'}. Best is trial 874 with value: 0.32176430753353746.
[I 2024-12-04 20:15:34,579] Trial 1323 finished with value: 0.6586750812216163 and parameters: {'n_estimators': 283, 'max_depth': 50, 'min_samples_split': 2, 'min_samples_leaf': 2, 'max_features': 'sqrt', 'bootstrap': False, 'criterion': 'squared_error'}. Best is trial 874 with value: 0.32176430753353746.
[I 2024-12-04 20:15:35,856] Trial 1325 finished with value: 0.6688704158231653 and parameters: {'n_estimators': 345, 'max_depth': 49, 'min_samples_split': 4, 'min_samples_leaf': 2, 'max_features': 'sqrt', 'bootstrap': False, 'criterion': 'squared_error'}. Best is trial 874 with value: 0.32176430753353746.
[I 2024-12-04 20:15:35,918] Trial 1324 finished with value: 0.32354571284096106 and parameters: {'n_estimators': 262, 'max_depth': 50, 'min_samples_split': 2, 'min_samples_leaf': 1, 'max_features': 'sqrt', 'bootstrap': False, 'criterion': 'squared_error'}. Best is trial 874 with value: 0.32176430753353746.
