[I 2024-12-04 12:15:07,019] A new study created in RDB with name: Pc_gb
[I 2024-12-04 12:15:16,970] Trial 20 finished with value: 0.5102982597959926 and parameters: {'n_estimators': 161, 'learning_rate': 0.01624301950757296, 'max_depth': 11, 'min_samples_split': 20, 'min_samples_leaf': 7, 'subsample': 0.7954209922895115, 'max_features': None}. Best is trial 20 with value: 0.5102982597959926.
[I 2024-12-04 12:15:27,715] Trial 1 finished with value: 0.6396847528640911 and parameters: {'n_estimators': 1113, 'learning_rate': 0.02071163127727373, 'max_depth': 6, 'min_samples_split': 2, 'min_samples_leaf': 4, 'subsample': 0.6681848556065196, 'max_features': 'log2'}. Best is trial 20 with value: 0.5102982597959926.
[I 2024-12-04 12:15:28,428] Trial 21 finished with value: 0.7079031907108889 and parameters: {'n_estimators': 291, 'learning_rate': 0.024309246317462226, 'max_depth': 11, 'min_samples_split': 12, 'min_samples_leaf': 10, 'subsample': 0.9565814416144187, 'max_features': 'sqrt'}. Best is trial 20 with value: 0.5102982597959926.
[I 2024-12-04 12:15:29,858] Trial 7 finished with value: 0.5160995919491612 and parameters: {'n_estimators': 808, 'learning_rate': 0.030674196050483462, 'max_depth': 3, 'min_samples_split': 15, 'min_samples_leaf': 6, 'subsample': 0.9338932986320366, 'max_features': 'sqrt'}. Best is trial 20 with value: 0.5102982597959926.
[I 2024-12-04 12:15:31,536] Trial 13 finished with value: 0.5962018444487938 and parameters: {'n_estimators': 451, 'learning_rate': 0.06662371204791362, 'max_depth': 10, 'min_samples_split': 18, 'min_samples_leaf': 9, 'subsample': 0.7241377689821128, 'max_features': 'sqrt'}. Best is trial 20 with value: 0.5102982597959926.
[I 2024-12-04 12:15:33,192] Trial 15 finished with value: 0.7021018467890567 and parameters: {'n_estimators': 636, 'learning_rate': 0.012826407927481473, 'max_depth': 9, 'min_samples_split': 8, 'min_samples_leaf': 3, 'subsample': 0.644966057667636, 'max_features': 'log2'}. Best is trial 20 with value: 0.5102982597959926.
[I 2024-12-04 12:15:34,000] Trial 17 finished with value: 0.9758826426701208 and parameters: {'n_estimators': 383, 'learning_rate': 0.025429132668703426, 'max_depth': 9, 'min_samples_split': 18, 'min_samples_leaf': 9, 'subsample': 0.6335150335220509, 'max_features': 'log2'}. Best is trial 20 with value: 0.5102982597959926.
[I 2024-12-04 12:15:35,347] Trial 4 finished with value: 0.6496664048546426 and parameters: {'n_estimators': 470, 'learning_rate': 0.01648741832532856, 'max_depth': 9, 'min_samples_split': 20, 'min_samples_leaf': 8, 'subsample': 0.8217370523764961, 'max_features': 'sqrt'}. Best is trial 20 with value: 0.5102982597959926.
[I 2024-12-04 12:15:35,661] Trial 32 finished with value: 0.6013339719121052 and parameters: {'n_estimators': 392, 'learning_rate': 0.053206107606820166, 'max_depth': 6, 'min_samples_split': 13, 'min_samples_leaf': 9, 'subsample': 0.9494036812568355, 'max_features': 'sqrt'}. Best is trial 20 with value: 0.5102982597959926.
[I 2024-12-04 12:15:37,635] Trial 18 finished with value: 0.447073224090312 and parameters: {'n_estimators': 496, 'learning_rate': 0.07877347470874663, 'max_depth': 5, 'min_samples_split': 15, 'min_samples_leaf': 4, 'subsample': 0.9501933449387303, 'max_features': 'sqrt'}. Best is trial 18 with value: 0.447073224090312.
[I 2024-12-04 12:15:37,929] Trial 29 finished with value: 0.750638867145177 and parameters: {'n_estimators': 490, 'learning_rate': 0.08098359135451723, 'max_depth': 10, 'min_samples_split': 12, 'min_samples_leaf': 10, 'subsample': 0.6781821772532692, 'max_features': 'log2'}. Best is trial 18 with value: 0.447073224090312.
[I 2024-12-04 12:15:39,448] Trial 6 finished with value: 0.5865841682797112 and parameters: {'n_estimators': 710, 'learning_rate': 0.011945682984602995, 'max_depth': 4, 'min_samples_split': 10, 'min_samples_leaf': 1, 'subsample': 0.8398424205148984, 'max_features': 'sqrt'}. Best is trial 18 with value: 0.447073224090312.
[I 2024-12-04 12:15:41,204] Trial 5 finished with value: 0.5959753692013767 and parameters: {'n_estimators': 999, 'learning_rate': 0.027159000022419912, 'max_depth': 6, 'min_samples_split': 18, 'min_samples_leaf': 9, 'subsample': 0.7872436204467989, 'max_features': 'sqrt'}. Best is trial 18 with value: 0.447073224090312.
[I 2024-12-04 12:15:42,933] Trial 25 finished with value: 0.4243901042285105 and parameters: {'n_estimators': 739, 'learning_rate': 0.07392485021832602, 'max_depth': 6, 'min_samples_split': 18, 'min_samples_leaf': 5, 'subsample': 0.9749633047038702, 'max_features': 'sqrt'}. Best is trial 25 with value: 0.4243901042285105.
[I 2024-12-04 12:15:43,451] Trial 12 finished with value: 0.39536111576952204 and parameters: {'n_estimators': 1018, 'learning_rate': 0.07369456837690976, 'max_depth': 9, 'min_samples_split': 15, 'min_samples_leaf': 2, 'subsample': 0.8926809155477466, 'max_features': 'log2'}. Best is trial 12 with value: 0.39536111576952204.
[I 2024-12-04 12:15:45,560] Trial 36 finished with value: 0.5558796614811627 and parameters: {'n_estimators': 306, 'learning_rate': 0.04904400334376241, 'max_depth': 7, 'min_samples_split': 2, 'min_samples_leaf': 10, 'subsample': 0.9644433233091231, 'max_features': None}. Best is trial 12 with value: 0.39536111576952204.
[I 2024-12-04 12:15:45,603] Trial 3 finished with value: 0.7892912418435796 and parameters: {'n_estimators': 1023, 'learning_rate': 0.01619042373946913, 'max_depth': 4, 'min_samples_split': 4, 'min_samples_leaf': 6, 'subsample': 0.6726032642212822, 'max_features': 'log2'}. Best is trial 12 with value: 0.39536111576952204.
[I 2024-12-04 12:15:46,521] Trial 41 finished with value: 0.46776054353075874 and parameters: {'n_estimators': 152, 'learning_rate': 0.018995586885806166, 'max_depth': 11, 'min_samples_split': 16, 'min_samples_leaf': 6, 'subsample': 0.8909162586094838, 'max_features': None}. Best is trial 12 with value: 0.39536111576952204.
[I 2024-12-04 12:15:46,668] Trial 19 finished with value: 0.39476832672938805 and parameters: {'n_estimators': 786, 'learning_rate': 0.02822836207055697, 'max_depth': 5, 'min_samples_split': 7, 'min_samples_leaf': 5, 'subsample': 0.9778938216518303, 'max_features': None}. Best is trial 19 with value: 0.39476832672938805.
[I 2024-12-04 12:15:47,528] Trial 38 finished with value: 0.6759920604264579 and parameters: {'n_estimators': 306, 'learning_rate': 0.010009481983741356, 'max_depth': 9, 'min_samples_split': 14, 'min_samples_leaf': 3, 'subsample': 0.8905628073834811, 'max_features': 'sqrt'}. Best is trial 19 with value: 0.39476832672938805.
[I 2024-12-04 12:15:47,748] Trial 27 finished with value: 0.39259041804389044 and parameters: {'n_estimators': 732, 'learning_rate': 0.029545466620812186, 'max_depth': 10, 'min_samples_split': 9, 'min_samples_leaf': 2, 'subsample': 0.9278924382156871, 'max_features': 'sqrt'}. Best is trial 27 with value: 0.39259041804389044.
[I 2024-12-04 12:15:50,014] Trial 31 finished with value: 0.4047472503074308 and parameters: {'n_estimators': 728, 'learning_rate': 0.05624332572138356, 'max_depth': 11, 'min_samples_split': 3, 'min_samples_leaf': 7, 'subsample': 0.6829753068519798, 'max_features': None}. Best is trial 2 with value: 0.3820094141573123.
[I 2024-12-04 12:15:50,547] Trial 2 finished with value: 0.3820094141573123 and parameters: {'n_estimators': 1061, 'learning_rate': 0.031005817446956213, 'max_depth': 6, 'min_samples_split': 16, 'min_samples_leaf': 2, 'subsample': 0.9075500721750065, 'max_features': None}. Best is trial 2 with value: 0.3820094141573123.
[I 2024-12-04 12:15:51,755] Trial 44 finished with value: 0.37400374868523634 and parameters: {'n_estimators': 187, 'learning_rate': 0.05269464418125695, 'max_depth': 12, 'min_samples_split': 16, 'min_samples_leaf': 4, 'subsample': 0.7852771640586864, 'max_features': None}. Best is trial 44 with value: 0.37400374868523634.
[I 2024-12-04 12:15:51,812] Trial 11 finished with value: 0.6232397849886998 and parameters: {'n_estimators': 1290, 'learning_rate': 0.0106216427416066, 'max_depth': 4, 'min_samples_split': 11, 'min_samples_leaf': 7, 'subsample': 0.6779387606353802, 'max_features': 'sqrt'}. Best is trial 44 with value: 0.37400374868523634.
[I 2024-12-04 12:15:52,827] Trial 22 finished with value: 0.4984075561353598 and parameters: {'n_estimators': 1032, 'learning_rate': 0.03043570493020564, 'max_depth': 3, 'min_samples_split': 12, 'min_samples_leaf': 7, 'subsample': 0.9075527188411225, 'max_features': 'sqrt'}. Best is trial 44 with value: 0.37400374868523634.
[I 2024-12-04 12:15:53,528] Trial 42 finished with value: 0.517733201350135 and parameters: {'n_estimators': 320, 'learning_rate': 0.015320274278853761, 'max_depth': 10, 'min_samples_split': 20, 'min_samples_leaf': 8, 'subsample': 0.7514276343353941, 'max_features': None}. Best is trial 44 with value: 0.37400374868523634.
[I 2024-12-04 12:15:54,574] Trial 14 finished with value: 0.40558813957560513 and parameters: {'n_estimators': 856, 'learning_rate': 0.011293883090548787, 'max_depth': 7, 'min_samples_split': 11, 'min_samples_leaf': 5, 'subsample': 0.9453571142611265, 'max_features': None}. Best is trial 44 with value: 0.37400374868523634.
[I 2024-12-04 12:15:55,045] Trial 43 finished with value: 0.40583362120142696 and parameters: {'n_estimators': 327, 'learning_rate': 0.04645121683800559, 'max_depth': 7, 'min_samples_split': 15, 'min_samples_leaf': 3, 'subsample': 0.8850848669779608, 'max_features': None}. Best is trial 44 with value: 0.37400374868523634.
[I 2024-12-04 12:15:55,850] Trial 35 finished with value: 0.8074700198795729 and parameters: {'n_estimators': 623, 'learning_rate': 0.027474677759257757, 'max_depth': 12, 'min_samples_split': 17, 'min_samples_leaf': 8, 'subsample': 0.6593179933704487, 'max_features': 'log2'}. Best is trial 44 with value: 0.37400374868523634.
[I 2024-12-04 12:15:57,354] Trial 0 finished with value: 0.7472208229951638 and parameters: {'n_estimators': 1032, 'learning_rate': 0.01603768947781293, 'max_depth': 7, 'min_samples_split': 2, 'min_samples_leaf': 6, 'subsample': 0.7372156593975455, 'max_features': 'log2'}. Best is trial 44 with value: 0.37400374868523634.
[I 2024-12-04 12:15:57,686] Trial 30 finished with value: 0.658671344744785 and parameters: {'n_estimators': 1042, 'learning_rate': 0.014339433966336324, 'max_depth': 7, 'min_samples_split': 3, 'min_samples_leaf': 10, 'subsample': 0.6925326746351086, 'max_features': 'sqrt'}. Best is trial 44 with value: 0.37400374868523634.
[I 2024-12-04 12:15:57,691] Trial 34 finished with value: 0.4856935558917893 and parameters: {'n_estimators': 770, 'learning_rate': 0.08555269531706368, 'max_depth': 5, 'min_samples_split': 20, 'min_samples_leaf': 8, 'subsample': 0.81951556637295, 'max_features': 'sqrt'}. Best is trial 44 with value: 0.37400374868523634.
[I 2024-12-04 12:15:59,630] Trial 37 finished with value: 0.6508255014165005 and parameters: {'n_estimators': 708, 'learning_rate': 0.010482230751930725, 'max_depth': 7, 'min_samples_split': 13, 'min_samples_leaf': 1, 'subsample': 0.8926952128912342, 'max_features': 'log2'}. Best is trial 44 with value: 0.37400374868523634.
[I 2024-12-04 12:15:59,850] Trial 28 finished with value: 0.44063647570987 and parameters: {'n_estimators': 1022, 'learning_rate': 0.09079807282883941, 'max_depth': 9, 'min_samples_split': 4, 'min_samples_leaf': 7, 'subsample': 0.8980914619589087, 'max_features': 'sqrt'}. Best is trial 44 with value: 0.37400374868523634.
[I 2024-12-04 12:15:59,955] Trial 16 finished with value: 0.40861622933059505 and parameters: {'n_estimators': 1308, 'learning_rate': 0.01253100427009525, 'max_depth': 7, 'min_samples_split': 17, 'min_samples_leaf': 6, 'subsample': 0.7593042576737726, 'max_features': None}. Best is trial 44 with value: 0.37400374868523634.
[I 2024-12-04 12:16:01,508] Trial 10 finished with value: 0.8730743798830106 and parameters: {'n_estimators': 1245, 'learning_rate': 0.010560352943047528, 'max_depth': 8, 'min_samples_split': 17, 'min_samples_leaf': 10, 'subsample': 0.878079119157694, 'max_features': 'log2'}. Best is trial 44 with value: 0.37400374868523634.
[I 2024-12-04 12:16:01,736] Trial 9 finished with value: 0.44460245282680255 and parameters: {'n_estimators': 1188, 'learning_rate': 0.06932051024979863, 'max_depth': 3, 'min_samples_split': 5, 'min_samples_leaf': 5, 'subsample': 0.844460085219231, 'max_features': 'sqrt'}. Best is trial 44 with value: 0.37400374868523634.
[I 2024-12-04 12:16:01,818] Trial 24 finished with value: 0.5494519368535453 and parameters: {'n_estimators': 1217, 'learning_rate': 0.010831573203547221, 'max_depth': 5, 'min_samples_split': 2, 'min_samples_leaf': 7, 'subsample': 0.9142124922257353, 'max_features': 'sqrt'}. Best is trial 44 with value: 0.37400374868523634.
[I 2024-12-04 12:16:02,395] Trial 40 finished with value: 0.6097083984804068 and parameters: {'n_estimators': 779, 'learning_rate': 0.015583251909981919, 'max_depth': 3, 'min_samples_split': 3, 'min_samples_leaf': 6, 'subsample': 0.9124400700669125, 'max_features': 'sqrt'}. Best is trial 49 with value: 0.36730274894900833.
[I 2024-12-04 12:16:04,367] Trial 23 finished with value: 0.39220104032400543 and parameters: {'n_estimators': 1224, 'learning_rate': 0.02585329545513339, 'max_depth': 8, 'min_samples_split': 11, 'min_samples_leaf': 6, 'subsample': 0.77939337443223, 'max_features': None}. Best is trial 49 with value: 0.36730274894900833.
[I 2024-12-04 12:16:04,380] Trial 39 finished with value: 0.4624962350798873 and parameters: {'n_estimators': 919, 'learning_rate': 0.08209349366240049, 'max_depth': 10, 'min_samples_split': 9, 'min_samples_leaf': 8, 'subsample': 0.8134496464752414, 'max_features': 'sqrt'}. Best is trial 49 with value: 0.36730274894900833.
[I 2024-12-04 12:16:04,414] Trial 49 finished with value: 0.36730274894900833 and parameters: {'n_estimators': 335, 'learning_rate': 0.06800661579400093, 'max_depth': 12, 'min_samples_split': 17, 'min_samples_leaf': 4, 'subsample': 0.8578867898435328, 'max_features': None}. Best is trial 49 with value: 0.36730274894900833.
[I 2024-12-04 12:16:05,522] Trial 48 finished with value: 0.37992265318812096 and parameters: {'n_estimators': 604, 'learning_rate': 0.04150924719754837, 'max_depth': 12, 'min_samples_split': 11, 'min_samples_leaf': 1, 'subsample': 0.957242244839527, 'max_features': 'sqrt'}. Best is trial 49 with value: 0.36730274894900833.
[I 2024-12-04 12:16:06,412] Trial 26 finished with value: 0.44515084442176883 and parameters: {'n_estimators': 1498, 'learning_rate': 0.04593285918475812, 'max_depth': 8, 'min_samples_split': 12, 'min_samples_leaf': 7, 'subsample': 0.7905426684377144, 'max_features': 'sqrt'}. Best is trial 49 with value: 0.36730274894900833.
[I 2024-12-04 12:16:06,419] Trial 53 finished with value: 0.5523314223141823 and parameters: {'n_estimators': 260, 'learning_rate': 0.02358553642714971, 'max_depth': 11, 'min_samples_split': 6, 'min_samples_leaf': 5, 'subsample': 0.8889472670768457, 'max_features': 'sqrt'}. Best is trial 49 with value: 0.36730274894900833.
[I 2024-12-04 12:16:07,096] Trial 55 finished with value: 0.6845113593565947 and parameters: {'n_estimators': 428, 'learning_rate': 0.02976443464273277, 'max_depth': 6, 'min_samples_split': 3, 'min_samples_leaf': 4, 'subsample': 0.9898023972564249, 'max_features': 'log2'}. Best is trial 52 with value: 0.3646912366543144.
[I 2024-12-04 12:16:07,759] Trial 54 finished with value: 0.4420998948334261 and parameters: {'n_estimators': 312, 'learning_rate': 0.035429754921303305, 'max_depth': 12, 'min_samples_split': 16, 'min_samples_leaf': 3, 'subsample': 0.7736191697966358, 'max_features': 'sqrt'}. Best is trial 52 with value: 0.3646912366543144.
[I 2024-12-04 12:16:09,289] Trial 45 finished with value: 0.3877603099327996 and parameters: {'n_estimators': 1052, 'learning_rate': 0.08995207024976541, 'max_depth': 9, 'min_samples_split': 13, 'min_samples_leaf': 2, 'subsample': 0.9907259469126506, 'max_features': 'log2'}. Best is trial 52 with value: 0.3646912366543144.
[I 2024-12-04 12:16:09,513] Trial 52 finished with value: 0.3646912366543144 and parameters: {'n_estimators': 462, 'learning_rate': 0.06736398870352282, 'max_depth': 11, 'min_samples_split': 17, 'min_samples_leaf': 3, 'subsample': 0.6377205568489809, 'max_features': None}. Best is trial 52 with value: 0.3646912366543144.
[I 2024-12-04 12:16:09,655] Trial 33 finished with value: 0.42916165101024195 and parameters: {'n_estimators': 1099, 'learning_rate': 0.020836124404954998, 'max_depth': 11, 'min_samples_split': 18, 'min_samples_leaf': 8, 'subsample': 0.8931990400028214, 'max_features': None}. Best is trial 52 with value: 0.3646912366543144.
[I 2024-12-04 12:16:10,118] Trial 47 finished with value: 0.401290532904195 and parameters: {'n_estimators': 868, 'learning_rate': 0.03596115104614788, 'max_depth': 4, 'min_samples_split': 8, 'min_samples_leaf': 5, 'subsample': 0.9776752220880958, 'max_features': None}. Best is trial 52 with value: 0.3646912366543144.
[I 2024-12-04 12:16:10,783] Trial 51 finished with value: 0.43997217455631465 and parameters: {'n_estimators': 909, 'learning_rate': 0.026294755499511508, 'max_depth': 8, 'min_samples_split': 7, 'min_samples_leaf': 3, 'subsample': 0.9419994470201564, 'max_features': 'sqrt'}. Best is trial 52 with value: 0.3646912366543144.
[I 2024-12-04 12:16:10,786] Trial 61 finished with value: 0.37598970424085637 and parameters: {'n_estimators': 253, 'learning_rate': 0.07605908407157953, 'max_depth': 12, 'min_samples_split': 15, 'min_samples_leaf': 4, 'subsample': 0.8033903617551608, 'max_features': None}. Best is trial 52 with value: 0.3646912366543144.
[I 2024-12-04 12:16:11,187] Trial 8 finished with value: 0.3953875902292059 and parameters: {'n_estimators': 1459, 'learning_rate': 0.05210177789889704, 'max_depth': 11, 'min_samples_split': 8, 'min_samples_leaf': 3, 'subsample': 0.9488278941687044, 'max_features': None}. Best is trial 52 with value: 0.3646912366543144.
[I 2024-12-04 12:16:11,951] Trial 46 finished with value: 0.3879742104723831 and parameters: {'n_estimators': 1111, 'learning_rate': 0.04954609040469636, 'max_depth': 6, 'min_samples_split': 19, 'min_samples_leaf': 2, 'subsample': 0.9238284962863399, 'max_features': 'sqrt'}. Best is trial 52 with value: 0.3646912366543144.
[I 2024-12-04 12:16:14,109] Trial 67 finished with value: 0.4057793107839722 and parameters: {'n_estimators': 216, 'learning_rate': 0.032345395824141844, 'max_depth': 12, 'min_samples_split': 16, 'min_samples_leaf': 1, 'subsample': 0.8875693516255829, 'max_features': None}. Best is trial 52 with value: 0.3646912366543144.
[I 2024-12-04 12:16:15,622] Trial 57 finished with value: 0.5252095063956747 and parameters: {'n_estimators': 654, 'learning_rate': 0.02658080454992064, 'max_depth': 11, 'min_samples_split': 9, 'min_samples_leaf': 3, 'subsample': 0.9605160934884478, 'max_features': 'log2'}. Best is trial 52 with value: 0.3646912366543144.
[I 2024-12-04 12:16:16,693] Trial 58 finished with value: 0.39274885815256044 and parameters: {'n_estimators': 779, 'learning_rate': 0.021955817509331205, 'max_depth': 8, 'min_samples_split': 16, 'min_samples_leaf': 3, 'subsample': 0.8341973406574853, 'max_features': None}. Best is trial 52 with value: 0.3646912366543144.
[I 2024-12-04 12:16:17,076] Trial 59 finished with value: 0.3788408099035557 and parameters: {'n_estimators': 700, 'learning_rate': 0.04741641250263193, 'max_depth': 11, 'min_samples_split': 15, 'min_samples_leaf': 1, 'subsample': 0.993156148378098, 'max_features': 'sqrt'}. Best is trial 52 with value: 0.3646912366543144.
[I 2024-12-04 12:16:17,558] Trial 70 finished with value: 0.40533840153316353 and parameters: {'n_estimators': 218, 'learning_rate': 0.05098765340429416, 'max_depth': 11, 'min_samples_split': 13, 'min_samples_leaf': 6, 'subsample': 0.7210427226087519, 'max_features': None}. Best is trial 62 with value: 0.35179215659504387.
[I 2024-12-04 12:16:19,310] Trial 74 finished with value: 0.5520753777858922 and parameters: {'n_estimators': 525, 'learning_rate': 0.044715213037880466, 'max_depth': 11, 'min_samples_split': 18, 'min_samples_leaf': 4, 'subsample': 0.8840406320083121, 'max_features': 'log2'}. Best is trial 62 with value: 0.35179215659504387.
[I 2024-12-04 12:16:19,414] Trial 56 finished with value: 0.42748634733780866 and parameters: {'n_estimators': 920, 'learning_rate': 0.04916756502959424, 'max_depth': 5, 'min_samples_split': 15, 'min_samples_leaf': 1, 'subsample': 0.9443454255102373, 'max_features': None}. Best is trial 62 with value: 0.35179215659504387.
[I 2024-12-04 12:16:19,625] Trial 62 finished with value: 0.35179215659504387 and parameters: {'n_estimators': 482, 'learning_rate': 0.081881521092316, 'max_depth': 10, 'min_samples_split': 20, 'min_samples_leaf': 2, 'subsample': 0.8689852962009607, 'max_features': None}. Best is trial 62 with value: 0.35179215659504387.
[I 2024-12-04 12:16:19,784] Trial 65 finished with value: 0.3720945690207561 and parameters: {'n_estimators': 550, 'learning_rate': 0.08025227780275794, 'max_depth': 10, 'min_samples_split': 19, 'min_samples_leaf': 3, 'subsample': 0.6219357832456985, 'max_features': None}. Best is trial 62 with value: 0.35179215659504387.
[I 2024-12-04 12:16:19,796] Trial 69 finished with value: 0.3805644976724662 and parameters: {'n_estimators': 289, 'learning_rate': 0.05599159292263777, 'max_depth': 11, 'min_samples_split': 16, 'min_samples_leaf': 3, 'subsample': 0.7474099296528516, 'max_features': None}. Best is trial 62 with value: 0.35179215659504387.
[I 2024-12-04 12:16:19,815] Trial 60 finished with value: 0.4240628993778973 and parameters: {'n_estimators': 1016, 'learning_rate': 0.019703584820699553, 'max_depth': 11, 'min_samples_split': 12, 'min_samples_leaf': 4, 'subsample': 0.9361257395021149, 'max_features': 'sqrt'}. Best is trial 62 with value: 0.35179215659504387.
