[I 2024-12-04 12:09:35,403] Trial 1011 finished with value: 0.5265827091048159 and parameters: {'n_estimators': 117, 'max_depth': 12, 'min_samples_split': 10, 'min_samples_leaf': 1, 'max_features': None, 'bootstrap': True, 'criterion': 'absolute_error'}. Best is trial 744 with value: 0.5032383725751689.
[I 2024-12-04 12:09:35,978] Trial 1012 finished with value: 0.5136711344418808 and parameters: {'n_estimators': 100, 'max_depth': 16, 'min_samples_split': 3, 'min_samples_leaf': 1, 'max_features': None, 'bootstrap': True, 'criterion': 'absolute_error'}. Best is trial 744 with value: 0.5032383725751689.
[I 2024-12-04 12:09:36,081] Trial 997 finished with value: 0.5135117391132938 and parameters: {'n_estimators': 257, 'max_depth': 19, 'min_samples_split': 5, 'min_samples_leaf': 1, 'max_features': None, 'bootstrap': True, 'criterion': 'absolute_error'}. Best is trial 744 with value: 0.5032383725751689.
[I 2024-12-04 12:09:36,882] Trial 1019 finished with value: 1.3440961613417108 and parameters: {'n_estimators': 827, 'max_depth': 24, 'min_samples_split': 9, 'min_samples_leaf': 8, 'max_features': 'log2', 'bootstrap': False, 'criterion': 'absolute_error'}. Best is trial 744 with value: 0.5032383725751689.
[I 2024-12-04 12:09:37,453] Trial 1006 finished with value: 0.5131502780385343 and parameters: {'n_estimators': 105, 'max_depth': 14, 'min_samples_split': 4, 'min_samples_leaf': 1, 'max_features': None, 'bootstrap': True, 'criterion': 'absolute_error'}. Best is trial 744 with value: 0.5032383725751689.
[I 2024-12-04 12:09:37,454] Trial 995 finished with value: 0.5152267305304906 and parameters: {'n_estimators': 301, 'max_depth': 19, 'min_samples_split': 6, 'min_samples_leaf': 1, 'max_features': None, 'bootstrap': True, 'criterion': 'absolute_error'}. Best is trial 744 with value: 0.5032383725751689.
[I 2024-12-04 12:09:37,830] Trial 1023 finished with value: 1.18261179414877 and parameters: {'n_estimators': 619, 'max_depth': 21, 'min_samples_split': 7, 'min_samples_leaf': 3, 'max_features': 'log2', 'bootstrap': False, 'criterion': 'squared_error'}. Best is trial 744 with value: 0.5032383725751689.
[I 2024-12-04 12:09:40,490] Trial 1017 finished with value: 0.5238428764859985 and parameters: {'n_estimators': 103, 'max_depth': 10, 'min_samples_split': 3, 'min_samples_leaf': 1, 'max_features': None, 'bootstrap': True, 'criterion': 'absolute_error'}. Best is trial 744 with value: 0.5032383725751689.
[I 2024-12-04 12:09:40,726] Trial 1030 finished with value: 0.6255272669272182 and parameters: {'n_estimators': 144, 'max_depth': 39, 'min_samples_split': 18, 'min_samples_leaf': 1, 'max_features': 'sqrt', 'bootstrap': False, 'criterion': 'squared_error'}. Best is trial 744 with value: 0.5032383725751689.
[I 2024-12-04 12:09:40,938] Trial 1020 finished with value: 0.5067446851148625 and parameters: {'n_estimators': 100, 'max_depth': 18, 'min_samples_split': 5, 'min_samples_leaf': 1, 'max_features': None, 'bootstrap': True, 'criterion': 'absolute_error'}. Best is trial 744 with value: 0.5032383725751689.
[I 2024-12-04 12:09:45,992] Trial 1024 finished with value: 0.5327854808092751 and parameters: {'n_estimators': 100, 'max_depth': 18, 'min_samples_split': 16, 'min_samples_leaf': 1, 'max_features': None, 'bootstrap': True, 'criterion': 'absolute_error'}. Best is trial 744 with value: 0.5032383725751689.
[I 2024-12-04 12:09:46,487] Trial 1007 finished with value: 0.5617501615486935 and parameters: {'n_estimators': 260, 'max_depth': 20, 'min_samples_split': 4, 'min_samples_leaf': 2, 'max_features': None, 'bootstrap': True, 'criterion': 'absolute_error'}. Best is trial 744 with value: 0.5032383725751689.
[I 2024-12-04 12:09:49,651] Trial 1029 finished with value: 0.5072019171434248 and parameters: {'n_estimators': 116, 'max_depth': 18, 'min_samples_split': 4, 'min_samples_leaf': 1, 'max_features': None, 'bootstrap': True, 'criterion': 'absolute_error'}. Best is trial 744 with value: 0.5032383725751689.
[I 2024-12-04 12:09:50,713] Trial 1025 finished with value: 0.522135877421433 and parameters: {'n_estimators': 102, 'max_depth': 17, 'min_samples_split': 9, 'min_samples_leaf': 1, 'max_features': None, 'bootstrap': True, 'criterion': 'absolute_error'}. Best is trial 744 with value: 0.5032383725751689.
[I 2024-12-04 12:09:50,718] Trial 1015 finished with value: 0.5167486007850554 and parameters: {'n_estimators': 254, 'max_depth': 17, 'min_samples_split': 4, 'min_samples_leaf': 1, 'max_features': None, 'bootstrap': True, 'criterion': 'absolute_error'}. Best is trial 744 with value: 0.5032383725751689.
[I 2024-12-04 12:09:50,793] Trial 1038 finished with value: 1.1792702168912945 and parameters: {'n_estimators': 349, 'max_depth': 44, 'min_samples_split': 9, 'min_samples_leaf': 2, 'max_features': 'log2', 'bootstrap': True, 'criterion': 'squared_error'}. Best is trial 744 with value: 0.5032383725751689.
[I 2024-12-04 12:09:50,938] Trial 1013 finished with value: 0.5144509051676176 and parameters: {'n_estimators': 258, 'max_depth': 13, 'min_samples_split': 3, 'min_samples_leaf': 1, 'max_features': None, 'bootstrap': True, 'criterion': 'absolute_error'}. Best is trial 744 with value: 0.5032383725751689.
[I 2024-12-04 12:09:51,096] Trial 1021 finished with value: 0.5218918849878799 and parameters: {'n_estimators': 118, 'max_depth': 16, 'min_samples_split': 7, 'min_samples_leaf': 1, 'max_features': None, 'bootstrap': True, 'criterion': 'absolute_error'}. Best is trial 744 with value: 0.5032383725751689.
[I 2024-12-04 12:09:51,102] Trial 1022 finished with value: 0.5601464233477893 and parameters: {'n_estimators': 226, 'max_depth': 27, 'min_samples_split': 4, 'min_samples_leaf': 2, 'max_features': None, 'bootstrap': True, 'criterion': 'absolute_error'}. Best is trial 744 with value: 0.5032383725751689.
[I 2024-12-04 12:09:52,323] Trial 1033 finished with value: 0.8870435871697869 and parameters: {'n_estimators': 480, 'max_depth': 18, 'min_samples_split': 48, 'min_samples_leaf': 1, 'max_features': 'sqrt', 'bootstrap': True, 'criterion': 'absolute_error'}. Best is trial 744 with value: 0.5032383725751689.
[I 2024-12-04 12:09:52,799] Trial 1032 finished with value: 0.5602552417119709 and parameters: {'n_estimators': 165, 'max_depth': 19, 'min_samples_split': 5, 'min_samples_leaf': 2, 'max_features': None, 'bootstrap': True, 'criterion': 'absolute_error'}. Best is trial 744 with value: 0.5032383725751689.
[I 2024-12-04 12:09:52,892] Trial 1039 finished with value: 0.7485254153601636 and parameters: {'n_estimators': 302, 'max_depth': 30, 'min_samples_split': 26, 'min_samples_leaf': 1, 'max_features': 'sqrt', 'bootstrap': True, 'criterion': 'squared_error'}. Best is trial 744 with value: 0.5032383725751689.
[I 2024-12-04 12:09:53,223] Trial 1018 finished with value: 0.52187666934719 and parameters: {'n_estimators': 279, 'max_depth': 10, 'min_samples_split': 2, 'min_samples_leaf': 1, 'max_features': None, 'bootstrap': True, 'criterion': 'absolute_error'}. Best is trial 744 with value: 0.5032383725751689.
[I 2024-12-04 12:09:54,120] Trial 1031 finished with value: 0.5161687127697169 and parameters: {'n_estimators': 101, 'max_depth': 20, 'min_samples_split': 3, 'min_samples_leaf': 1, 'max_features': None, 'bootstrap': True, 'criterion': 'absolute_error'}. Best is trial 744 with value: 0.5032383725751689.
[I 2024-12-04 12:09:54,645] Trial 1014 finished with value: 0.5125493181440498 and parameters: {'n_estimators': 267, 'max_depth': 18, 'min_samples_split': 4, 'min_samples_leaf': 1, 'max_features': None, 'bootstrap': True, 'criterion': 'absolute_error'}. Best is trial 744 with value: 0.5032383725751689.
[I 2024-12-04 12:09:56,230] Trial 1037 finished with value: 0.5539850477779382 and parameters: {'n_estimators': 112, 'max_depth': 19, 'min_samples_split': 4, 'min_samples_leaf': 2, 'max_features': None, 'bootstrap': True, 'criterion': 'absolute_error'}. Best is trial 744 with value: 0.5032383725751689.
[I 2024-12-04 12:09:56,569] Trial 1028 finished with value: 0.5611004322213102 and parameters: {'n_estimators': 104, 'max_depth': 24, 'min_samples_split': 8, 'min_samples_leaf': 2, 'max_features': None, 'bootstrap': True, 'criterion': 'absolute_error'}. Best is trial 744 with value: 0.5032383725751689.
[I 2024-12-04 12:09:56,578] Trial 1027 finished with value: 0.5219897097989414 and parameters: {'n_estimators': 236, 'max_depth': 13, 'min_samples_split': 6, 'min_samples_leaf': 1, 'max_features': None, 'bootstrap': True, 'criterion': 'absolute_error'}. Best is trial 744 with value: 0.5032383725751689.
[I 2024-12-04 12:09:56,732] Trial 1042 finished with value: 0.5082671632087482 and parameters: {'n_estimators': 102, 'max_depth': 18, 'min_samples_split': 5, 'min_samples_leaf': 1, 'max_features': None, 'bootstrap': True, 'criterion': 'absolute_error'}. Best is trial 744 with value: 0.5032383725751689.
[I 2024-12-04 12:09:57,024] Trial 1036 finished with value: 1.228241944328506 and parameters: {'n_estimators': 921, 'max_depth': 7, 'min_samples_split': 33, 'min_samples_leaf': 5, 'max_features': 'log2', 'bootstrap': True, 'criterion': 'squared_error'}. Best is trial 744 with value: 0.5032383725751689.
[I 2024-12-04 12:09:59,226] Trial 1044 finished with value: 0.5085546289713334 and parameters: {'n_estimators': 100, 'max_depth': 11, 'min_samples_split': 5, 'min_samples_leaf': 1, 'max_features': None, 'bootstrap': True, 'criterion': 'absolute_error'}. Best is trial 744 with value: 0.5032383725751689.
[I 2024-12-04 12:10:00,437] Trial 1049 finished with value: 1.339476068966736 and parameters: {'n_estimators': 542, 'max_depth': 27, 'min_samples_split': 4, 'min_samples_leaf': 7, 'max_features': 'log2', 'bootstrap': False, 'criterion': 'absolute_error'}. Best is trial 744 with value: 0.5032383725751689.
[I 2024-12-04 12:10:03,249] Trial 1034 finished with value: 0.5132916331545024 and parameters: {'n_estimators': 101, 'max_depth': 15, 'min_samples_split': 4, 'min_samples_leaf': 1, 'max_features': None, 'bootstrap': True, 'criterion': 'absolute_error'}. Best is trial 744 with value: 0.5032383725751689.
[I 2024-12-04 12:10:03,792] Trial 1046 finished with value: 0.5185590114171774 and parameters: {'n_estimators': 100, 'max_depth': 25, 'min_samples_split': 3, 'min_samples_leaf': 1, 'max_features': None, 'bootstrap': True, 'criterion': 'absolute_error'}. Best is trial 744 with value: 0.5032383725751689.
[I 2024-12-04 12:10:03,934] Trial 1035 finished with value: 0.5169043638817039 and parameters: {'n_estimators': 228, 'max_depth': 23, 'min_samples_split': 4, 'min_samples_leaf': 1, 'max_features': None, 'bootstrap': True, 'criterion': 'absolute_error'}. Best is trial 744 with value: 0.5032383725751689.
[I 2024-12-04 12:10:04,834] Trial 1040 finished with value: 0.5063780355762268 and parameters: {'n_estimators': 125, 'max_depth': 19, 'min_samples_split': 5, 'min_samples_leaf': 1, 'max_features': None, 'bootstrap': True, 'criterion': 'absolute_error'}. Best is trial 744 with value: 0.5032383725751689.
[I 2024-12-04 12:10:05,930] Trial 1054 finished with value: 1.1798830235251139 and parameters: {'n_estimators': 570, 'max_depth': 47, 'min_samples_split': 7, 'min_samples_leaf': 3, 'max_features': 'log2', 'bootstrap': False, 'criterion': 'squared_error'}. Best is trial 744 with value: 0.5032383725751689.
[I 2024-12-04 12:10:06,519] Trial 1041 finished with value: 0.5132056786696232 and parameters: {'n_estimators': 101, 'max_depth': 16, 'min_samples_split': 3, 'min_samples_leaf': 1, 'max_features': None, 'bootstrap': True, 'criterion': 'absolute_error'}. Best is trial 744 with value: 0.5032383725751689.
[I 2024-12-04 12:10:06,965] Trial 1052 finished with value: 1.3467777244909036 and parameters: {'n_estimators': 836, 'max_depth': 32, 'min_samples_split': 3, 'min_samples_leaf': 12, 'max_features': 'sqrt', 'bootstrap': True, 'criterion': 'absolute_error'}. Best is trial 744 with value: 0.5032383725751689.
[I 2024-12-04 12:10:07,414] Trial 1056 finished with value: 0.8219348755063931 and parameters: {'n_estimators': 106, 'max_depth': 20, 'min_samples_split': 5, 'min_samples_leaf': 1, 'max_features': 'sqrt', 'bootstrap': True, 'criterion': 'absolute_error'}. Best is trial 744 with value: 0.5032383725751689.
[I 2024-12-04 12:10:09,242] Trial 1043 finished with value: 0.5155847476042847 and parameters: {'n_estimators': 215, 'max_depth': 25, 'min_samples_split': 5, 'min_samples_leaf': 1, 'max_features': None, 'bootstrap': True, 'criterion': 'absolute_error'}. Best is trial 744 with value: 0.5032383725751689.
[I 2024-12-04 12:10:09,651] Trial 1047 finished with value: 0.5162328098907026 and parameters: {'n_estimators': 137, 'max_depth': 23, 'min_samples_split': 5, 'min_samples_leaf': 1, 'max_features': None, 'bootstrap': True, 'criterion': 'absolute_error'}. Best is trial 744 with value: 0.5032383725751689.
[I 2024-12-04 12:10:11,775] Trial 1050 finished with value: 0.5263286707000248 and parameters: {'n_estimators': 101, 'max_depth': 23, 'min_samples_split': 3, 'min_samples_leaf': 1, 'max_features': None, 'bootstrap': True, 'criterion': 'absolute_error'}. Best is trial 744 with value: 0.5032383725751689.
[I 2024-12-04 12:10:11,782] Trial 1057 finished with value: 0.5206150139626963 and parameters: {'n_estimators': 105, 'max_depth': 16, 'min_samples_split': 7, 'min_samples_leaf': 1, 'max_features': None, 'bootstrap': True, 'criterion': 'absolute_error'}. Best is trial 744 with value: 0.5032383725751689.
[I 2024-12-04 12:10:14,418] Trial 1048 finished with value: 0.5596830601993166 and parameters: {'n_estimators': 228, 'max_depth': 14, 'min_samples_split': 5, 'min_samples_leaf': 2, 'max_features': None, 'bootstrap': True, 'criterion': 'absolute_error'}. Best is trial 744 with value: 0.5032383725751689.
[I 2024-12-04 12:10:16,089] Trial 1053 finished with value: 0.5183458396710969 and parameters: {'n_estimators': 106, 'max_depth': 11, 'min_samples_split': 3, 'min_samples_leaf': 1, 'max_features': None, 'bootstrap': True, 'criterion': 'absolute_error'}. Best is trial 744 with value: 0.5032383725751689.
[I 2024-12-04 12:10:20,838] Trial 1051 finished with value: 0.6401185081602105 and parameters: {'n_estimators': 575, 'max_depth': 28, 'min_samples_split': 2, 'min_samples_leaf': 6, 'max_features': None, 'bootstrap': True, 'criterion': 'absolute_error'}. Best is trial 744 with value: 0.5032383725751689.
[I 2024-12-04 12:10:22,600] Trial 1064 finished with value: 0.5561502639659095 and parameters: {'n_estimators': 117, 'max_depth': 22, 'min_samples_split': 5, 'min_samples_leaf': 2, 'max_features': None, 'bootstrap': True, 'criterion': 'absolute_error'}. Best is trial 744 with value: 0.5032383725751689.
[I 2024-12-04 12:10:22,879] Trial 1062 finished with value: 0.5131835622967956 and parameters: {'n_estimators': 111, 'max_depth': 23, 'min_samples_split': 5, 'min_samples_leaf': 1, 'max_features': None, 'bootstrap': True, 'criterion': 'absolute_error'}. Best is trial 744 with value: 0.5032383725751689.
[I 2024-12-04 12:10:23,484] Trial 1059 finished with value: 0.514345433106417 and parameters: {'n_estimators': 103, 'max_depth': 22, 'min_samples_split': 3, 'min_samples_leaf': 1, 'max_features': None, 'bootstrap': True, 'criterion': 'absolute_error'}. Best is trial 744 with value: 0.5032383725751689.
[I 2024-12-04 12:10:25,324] Trial 1069 finished with value: 0.525519160672524 and parameters: {'n_estimators': 176, 'max_depth': 20, 'min_samples_split': 7, 'min_samples_leaf': 1, 'max_features': None, 'bootstrap': True, 'criterion': 'squared_error'}. Best is trial 744 with value: 0.5032383725751689.
[I 2024-12-04 12:10:29,144] Trial 1071 finished with value: 0.548915933623769 and parameters: {'n_estimators': 101, 'max_depth': 13, 'min_samples_split': 4, 'min_samples_leaf': 2, 'max_features': None, 'bootstrap': True, 'criterion': 'absolute_error'}. Best is trial 744 with value: 0.5032383725751689.
[I 2024-12-04 12:10:31,906] Trial 1081 finished with value: 1.0289253489542454 and parameters: {'n_estimators': 110, 'max_depth': 21, 'min_samples_split': 7, 'min_samples_leaf': 1, 'max_features': 'log2', 'bootstrap': True, 'criterion': 'absolute_error'}. Best is trial 744 with value: 0.5032383725751689.
[I 2024-12-04 12:10:32,296] Trial 1055 finished with value: 0.5185019389135043 and parameters: {'n_estimators': 264, 'max_depth': 14, 'min_samples_split': 4, 'min_samples_leaf': 1, 'max_features': None, 'bootstrap': True, 'criterion': 'absolute_error'}. Best is trial 744 with value: 0.5032383725751689.
[I 2024-12-04 12:10:32,308] Trial 1026 finished with value: 0.624498418212874 and parameters: {'n_estimators': 984, 'max_depth': 37, 'min_samples_split': 4, 'min_samples_leaf': 5, 'max_features': None, 'bootstrap': False, 'criterion': 'absolute_error'}. Best is trial 744 with value: 0.5032383725751689.
[I 2024-12-04 12:10:32,886] Trial 1074 finished with value: 0.5088744961969905 and parameters: {'n_estimators': 100, 'max_depth': 23, 'min_samples_split': 4, 'min_samples_leaf': 1, 'max_features': None, 'bootstrap': True, 'criterion': 'absolute_error'}. Best is trial 744 with value: 0.5032383725751689.
[I 2024-12-04 12:10:34,865] Trial 1063 finished with value: 0.5231675686414516 and parameters: {'n_estimators': 285, 'max_depth': 13, 'min_samples_split': 8, 'min_samples_leaf': 1, 'max_features': None, 'bootstrap': True, 'criterion': 'absolute_error'}. Best is trial 744 with value: 0.5032383725751689.
[I 2024-12-04 12:10:38,712] Trial 1060 finished with value: 0.6318402485047092 and parameters: {'n_estimators': 330, 'max_depth': 15, 'min_samples_split': 3, 'min_samples_leaf': 2, 'max_features': None, 'bootstrap': False, 'criterion': 'absolute_error'}. Best is trial 744 with value: 0.5032383725751689.
[I 2024-12-04 12:10:39,203] Trial 1075 finished with value: 0.5302293835318527 and parameters: {'n_estimators': 106, 'max_depth': 20, 'min_samples_split': 9, 'min_samples_leaf': 1, 'max_features': None, 'bootstrap': True, 'criterion': 'absolute_error'}. Best is trial 744 with value: 0.5032383725751689.
[I 2024-12-04 12:10:39,284] Trial 1061 finished with value: 0.5207377207408455 and parameters: {'n_estimators': 265, 'max_depth': 24, 'min_samples_split': 3, 'min_samples_leaf': 1, 'max_features': None, 'bootstrap': True, 'criterion': 'absolute_error'}. Best is trial 744 with value: 0.5032383725751689.
[I 2024-12-04 12:10:40,760] Trial 1058 finished with value: 0.5213555471200928 and parameters: {'n_estimators': 289, 'max_depth': 26, 'min_samples_split': 3, 'min_samples_leaf': 1, 'max_features': None, 'bootstrap': True, 'criterion': 'absolute_error'}. Best is trial 744 with value: 0.5032383725751689.
[I 2024-12-04 12:10:41,022] Trial 1067 finished with value: 0.5357506119543202 and parameters: {'n_estimators': 263, 'max_depth': 23, 'min_samples_split': 12, 'min_samples_leaf': 1, 'max_features': None, 'bootstrap': True, 'criterion': 'absolute_error'}. Best is trial 744 with value: 0.5032383725751689.
[I 2024-12-04 12:10:41,248] Trial 1078 finished with value: 0.5561278161605107 and parameters: {'n_estimators': 110, 'max_depth': 26, 'min_samples_split': 4, 'min_samples_leaf': 2, 'max_features': None, 'bootstrap': True, 'criterion': 'absolute_error'}. Best is trial 744 with value: 0.5032383725751689.
[I 2024-12-04 12:10:42,301] Trial 1079 finished with value: 0.5084814901556046 and parameters: {'n_estimators': 104, 'max_depth': 18, 'min_samples_split': 6, 'min_samples_leaf': 1, 'max_features': None, 'bootstrap': True, 'criterion': 'absolute_error'}. Best is trial 744 with value: 0.5032383725751689.
[I 2024-12-04 12:10:43,190] Trial 1077 finished with value: 0.5124074301956045 and parameters: {'n_estimators': 100, 'max_depth': 14, 'min_samples_split': 4, 'min_samples_leaf': 1, 'max_features': None, 'bootstrap': True, 'criterion': 'absolute_error'}. Best is trial 744 with value: 0.5032383725751689.
[I 2024-12-04 12:10:43,969] Trial 1065 finished with value: 0.7334992382815042 and parameters: {'n_estimators': 754, 'max_depth': 23, 'min_samples_split': 4, 'min_samples_leaf': 1, 'max_features': 'sqrt', 'bootstrap': False, 'criterion': 'absolute_error'}. Best is trial 744 with value: 0.5032383725751689.
[I 2024-12-04 12:10:45,570] Trial 1080 finished with value: 0.9926210762537739 and parameters: {'n_estimators': 253, 'max_depth': 11, 'min_samples_split': 5, 'min_samples_leaf': 1, 'max_features': 'sqrt', 'bootstrap': True, 'criterion': 'absolute_error'}. Best is trial 744 with value: 0.5032383725751689.
[I 2024-12-04 12:10:47,050] Trial 1083 finished with value: 0.751995603732468 and parameters: {'n_estimators': 988, 'max_depth': 29, 'min_samples_split': 35, 'min_samples_leaf': 1, 'max_features': 'sqrt', 'bootstrap': True, 'criterion': 'squared_error'}. Best is trial 744 with value: 0.5032383725751689.
[I 2024-12-04 12:10:48,318] Trial 1092 finished with value: 1.1947187462324822 and parameters: {'n_estimators': 324, 'max_depth': 26, 'min_samples_split': 2, 'min_samples_leaf': 7, 'max_features': 'sqrt', 'bootstrap': True, 'criterion': 'squared_error'}. Best is trial 744 with value: 0.5032383725751689.
[I 2024-12-04 12:10:48,921] Trial 1072 finished with value: 0.5130245322476358 and parameters: {'n_estimators': 252, 'max_depth': 18, 'min_samples_split': 4, 'min_samples_leaf': 1, 'max_features': None, 'bootstrap': True, 'criterion': 'absolute_error'}. Best is trial 744 with value: 0.5032383725751689.
[I 2024-12-04 12:10:49,088] Trial 1073 finished with value: 0.5185411477835443 and parameters: {'n_estimators': 256, 'max_depth': 15, 'min_samples_split': 6, 'min_samples_leaf': 1, 'max_features': None, 'bootstrap': True, 'criterion': 'absolute_error'}. Best is trial 744 with value: 0.5032383725751689.
[I 2024-12-04 12:10:49,089] Trial 1088 finished with value: 0.5281515776804478 and parameters: {'n_estimators': 108, 'max_depth': 18, 'min_samples_split': 3, 'min_samples_leaf': 1, 'max_features': None, 'bootstrap': True, 'criterion': 'squared_error'}. Best is trial 744 with value: 0.5032383725751689.
