[I 2024-12-04 14:54:06,606] Trial 361 finished with value: 0.46478327217568155 and parameters: {'n_estimators': 887, 'max_depth': 37, 'min_samples_split': 2, 'min_samples_leaf': 2, 'max_features': None, 'bootstrap': True, 'criterion': 'squared_error'}. Best is trial 223 with value: 0.4188398890260366.
[I 2024-12-04 14:54:07,815] Trial 363 finished with value: 0.5993779489950555 and parameters: {'n_estimators': 648, 'max_depth': 29, 'min_samples_split': 2, 'min_samples_leaf': 1, 'max_features': 'sqrt', 'bootstrap': True, 'criterion': 'absolute_error'}. Best is trial 223 with value: 0.4188398890260366.
[I 2024-12-04 14:54:08,025] Trial 357 finished with value: 0.4197219708484264 and parameters: {'n_estimators': 795, 'max_depth': 41, 'min_samples_split': 2, 'min_samples_leaf': 1, 'max_features': None, 'bootstrap': True, 'criterion': 'squared_error'}. Best is trial 223 with value: 0.4188398890260366.
[I 2024-12-04 14:54:08,421] Trial 370 finished with value: 0.8696710516383107 and parameters: {'n_estimators': 478, 'max_depth': 12, 'min_samples_split': 48, 'min_samples_leaf': 4, 'max_features': 'sqrt', 'bootstrap': False, 'criterion': 'absolute_error'}. Best is trial 223 with value: 0.4188398890260366.
[I 2024-12-04 14:54:08,556] Trial 362 finished with value: 0.4204583815720645 and parameters: {'n_estimators': 793, 'max_depth': 38, 'min_samples_split': 2, 'min_samples_leaf': 1, 'max_features': None, 'bootstrap': True, 'criterion': 'squared_error'}. Best is trial 223 with value: 0.4188398890260366.
[I 2024-12-04 14:54:09,976] Trial 367 finished with value: 0.42122613094342726 and parameters: {'n_estimators': 693, 'max_depth': 36, 'min_samples_split': 2, 'min_samples_leaf': 1, 'max_features': None, 'bootstrap': True, 'criterion': 'squared_error'}. Best is trial 223 with value: 0.4188398890260366.
[I 2024-12-04 14:54:10,298] Trial 365 finished with value: 0.46525145911522564 and parameters: {'n_estimators': 1000, 'max_depth': 44, 'min_samples_split': 2, 'min_samples_leaf': 2, 'max_features': None, 'bootstrap': True, 'criterion': 'squared_error'}. Best is trial 223 with value: 0.4188398890260366.
[I 2024-12-04 14:54:10,308] Trial 368 finished with value: 0.42140056335957543 and parameters: {'n_estimators': 647, 'max_depth': 36, 'min_samples_split': 2, 'min_samples_leaf': 1, 'max_features': None, 'bootstrap': True, 'criterion': 'squared_error'}. Best is trial 223 with value: 0.4188398890260366.
[I 2024-12-04 14:54:10,322] Trial 369 finished with value: 0.4319383775438194 and parameters: {'n_estimators': 821, 'max_depth': 40, 'min_samples_split': 4, 'min_samples_leaf': 1, 'max_features': None, 'bootstrap': True, 'criterion': 'squared_error'}. Best is trial 223 with value: 0.4188398890260366.
[I 2024-12-04 14:54:10,754] Trial 371 finished with value: 0.4192559993209978 and parameters: {'n_estimators': 699, 'max_depth': 40, 'min_samples_split': 2, 'min_samples_leaf': 1, 'max_features': None, 'bootstrap': True, 'criterion': 'squared_error'}. Best is trial 223 with value: 0.4188398890260366.
[I 2024-12-04 14:54:11,965] Trial 372 finished with value: 0.9608409211111858 and parameters: {'n_estimators': 677, 'max_depth': 46, 'min_samples_split': 3, 'min_samples_leaf': 2, 'max_features': 'log2', 'bootstrap': True, 'criterion': 'squared_error'}. Best is trial 223 with value: 0.4188398890260366.
[I 2024-12-04 14:54:14,681] Trial 364 finished with value: 0.4246582732390833 and parameters: {'n_estimators': 784, 'max_depth': 44, 'min_samples_split': 3, 'min_samples_leaf': 1, 'max_features': None, 'bootstrap': True, 'criterion': 'squared_error'}. Best is trial 223 with value: 0.4188398890260366.
[I 2024-12-04 14:54:15,646] Trial 376 finished with value: 0.464551178740143 and parameters: {'n_estimators': 646, 'max_depth': 38, 'min_samples_split': 4, 'min_samples_leaf': 2, 'max_features': None, 'bootstrap': True, 'criterion': 'squared_error'}. Best is trial 223 with value: 0.4188398890260366.
[I 2024-12-04 14:54:16,105] Trial 373 finished with value: 0.4197472961731555 and parameters: {'n_estimators': 793, 'max_depth': 41, 'min_samples_split': 2, 'min_samples_leaf': 1, 'max_features': None, 'bootstrap': True, 'criterion': 'squared_error'}. Best is trial 223 with value: 0.4188398890260366.
[I 2024-12-04 14:54:17,616] Trial 374 finished with value: 0.4651862293982392 and parameters: {'n_estimators': 777, 'max_depth': 40, 'min_samples_split': 2, 'min_samples_leaf': 2, 'max_features': None, 'bootstrap': True, 'criterion': 'squared_error'}. Best is trial 223 with value: 0.4188398890260366.
[I 2024-12-04 14:54:27,362] Trial 377 finished with value: 0.4207298298992025 and parameters: {'n_estimators': 804, 'max_depth': 43, 'min_samples_split': 2, 'min_samples_leaf': 1, 'max_features': None, 'bootstrap': True, 'criterion': 'squared_error'}. Best is trial 223 with value: 0.4188398890260366.
[I 2024-12-04 14:54:29,976] Trial 384 finished with value: 0.9723185905656365 and parameters: {'n_estimators': 361, 'max_depth': 23, 'min_samples_split': 2, 'min_samples_leaf': 3, 'max_features': 'log2', 'bootstrap': False, 'criterion': 'squared_error'}. Best is trial 223 with value: 0.4188398890260366.
[I 2024-12-04 14:54:35,104] Trial 348 finished with value: 0.42821554968901265 and parameters: {'n_estimators': 688, 'max_depth': 42, 'min_samples_split': 2, 'min_samples_leaf': 1, 'max_features': None, 'bootstrap': True, 'criterion': 'absolute_error'}. Best is trial 223 with value: 0.4188398890260366.
[I 2024-12-04 14:54:35,459] Trial 381 finished with value: 0.7286324064568919 and parameters: {'n_estimators': 494, 'max_depth': 7, 'min_samples_split': 2, 'min_samples_leaf': 8, 'max_features': None, 'bootstrap': False, 'criterion': 'absolute_error'}. Best is trial 223 with value: 0.4188398890260366.
[I 2024-12-04 14:54:39,040] Trial 382 finished with value: 0.4215225494432058 and parameters: {'n_estimators': 717, 'max_depth': 42, 'min_samples_split': 2, 'min_samples_leaf': 1, 'max_features': None, 'bootstrap': True, 'criterion': 'squared_error'}. Best is trial 223 with value: 0.4188398890260366.
[I 2024-12-04 14:54:39,579] Trial 378 finished with value: 0.4203863626829484 and parameters: {'n_estimators': 973, 'max_depth': 31, 'min_samples_split': 2, 'min_samples_leaf': 1, 'max_features': None, 'bootstrap': True, 'criterion': 'squared_error'}. Best is trial 223 with value: 0.4188398890260366.
[I 2024-12-04 14:54:42,755] Trial 385 finished with value: 0.5223190543997671 and parameters: {'n_estimators': 900, 'max_depth': 37, 'min_samples_split': 5, 'min_samples_leaf': 1, 'max_features': None, 'bootstrap': False, 'criterion': 'squared_error'}. Best is trial 223 with value: 0.4188398890260366.
[I 2024-12-04 14:54:44,339] Trial 388 finished with value: 0.5055908581013039 and parameters: {'n_estimators': 687, 'max_depth': 41, 'min_samples_split': 2, 'min_samples_leaf': 1, 'max_features': 'sqrt', 'bootstrap': True, 'criterion': 'squared_error'}. Best is trial 223 with value: 0.4188398890260366.
[I 2024-12-04 14:54:45,228] Trial 380 finished with value: 0.4192984471436665 and parameters: {'n_estimators': 991, 'max_depth': 40, 'min_samples_split': 2, 'min_samples_leaf': 1, 'max_features': None, 'bootstrap': True, 'criterion': 'squared_error'}. Best is trial 223 with value: 0.4188398890260366.
[I 2024-12-04 14:54:45,450] Trial 379 finished with value: 0.4234857039240448 and parameters: {'n_estimators': 975, 'max_depth': 41, 'min_samples_split': 3, 'min_samples_leaf': 1, 'max_features': None, 'bootstrap': True, 'criterion': 'squared_error'}. Best is trial 223 with value: 0.4188398890260366.
[I 2024-12-04 14:54:46,398] Trial 395 finished with value: 0.46480477597103304 and parameters: {'n_estimators': 691, 'max_depth': 42, 'min_samples_split': 2, 'min_samples_leaf': 2, 'max_features': None, 'bootstrap': True, 'criterion': 'squared_error'}. Best is trial 223 with value: 0.4188398890260366.
[I 2024-12-04 14:54:46,399] Trial 349 finished with value: 0.43441916534220076 and parameters: {'n_estimators': 795, 'max_depth': 31, 'min_samples_split': 2, 'min_samples_leaf': 1, 'max_features': None, 'bootstrap': True, 'criterion': 'absolute_error'}. Best is trial 223 with value: 0.4188398890260366.
[I 2024-12-04 14:54:46,421] Trial 386 finished with value: 0.5942081518204995 and parameters: {'n_estimators': 927, 'max_depth': 48, 'min_samples_split': 3, 'min_samples_leaf': 1, 'max_features': 'log2', 'bootstrap': True, 'criterion': 'squared_error'}. Best is trial 223 with value: 0.4188398890260366.
[I 2024-12-04 14:54:47,399] Trial 383 finished with value: 0.43117777016989484 and parameters: {'n_estimators': 956, 'max_depth': 39, 'min_samples_split': 4, 'min_samples_leaf': 1, 'max_features': None, 'bootstrap': True, 'criterion': 'squared_error'}. Best is trial 223 with value: 0.4188398890260366.
[I 2024-12-04 14:54:47,717] Trial 389 finished with value: 0.4208420525464082 and parameters: {'n_estimators': 826, 'max_depth': 37, 'min_samples_split': 2, 'min_samples_leaf': 1, 'max_features': None, 'bootstrap': True, 'criterion': 'squared_error'}. Best is trial 223 with value: 0.4188398890260366.
[I 2024-12-04 14:54:48,175] Trial 391 finished with value: 0.4193465299501747 and parameters: {'n_estimators': 797, 'max_depth': 40, 'min_samples_split': 2, 'min_samples_leaf': 1, 'max_features': None, 'bootstrap': True, 'criterion': 'squared_error'}. Best is trial 223 with value: 0.4188398890260366.
[I 2024-12-04 14:54:49,980] Trial 392 finished with value: 0.43192740281353476 and parameters: {'n_estimators': 669, 'max_depth': 37, 'min_samples_split': 4, 'min_samples_leaf': 1, 'max_features': None, 'bootstrap': True, 'criterion': 'squared_error'}. Best is trial 223 with value: 0.4188398890260366.
[I 2024-12-04 14:54:50,555] Trial 387 finished with value: 0.4191958175014079 and parameters: {'n_estimators': 722, 'max_depth': 41, 'min_samples_split': 2, 'min_samples_leaf': 1, 'max_features': None, 'bootstrap': True, 'criterion': 'squared_error'}. Best is trial 223 with value: 0.4188398890260366.
[I 2024-12-04 14:54:50,881] Trial 393 finished with value: 0.42132198141564103 and parameters: {'n_estimators': 766, 'max_depth': 42, 'min_samples_split': 2, 'min_samples_leaf': 1, 'max_features': None, 'bootstrap': True, 'criterion': 'squared_error'}. Best is trial 223 with value: 0.4188398890260366.
[I 2024-12-04 14:54:52,409] Trial 399 finished with value: 0.4357637175827292 and parameters: {'n_estimators': 758, 'max_depth': 31, 'min_samples_split': 5, 'min_samples_leaf': 1, 'max_features': None, 'bootstrap': True, 'criterion': 'squared_error'}. Best is trial 223 with value: 0.4188398890260366.
[I 2024-12-04 14:54:52,917] Trial 390 finished with value: 0.42111633888501854 and parameters: {'n_estimators': 862, 'max_depth': 42, 'min_samples_split': 2, 'min_samples_leaf': 1, 'max_features': None, 'bootstrap': True, 'criterion': 'squared_error'}. Best is trial 223 with value: 0.4188398890260366.
[I 2024-12-04 14:54:53,590] Trial 398 finished with value: 0.6379103563167647 and parameters: {'n_estimators': 660, 'max_depth': 30, 'min_samples_split': 32, 'min_samples_leaf': 6, 'max_features': None, 'bootstrap': True, 'criterion': 'squared_error'}. Best is trial 223 with value: 0.4188398890260366.
[I 2024-12-04 14:54:55,683] Trial 407 finished with value: 0.9716865167563297 and parameters: {'n_estimators': 623, 'max_depth': 30, 'min_samples_split': 7, 'min_samples_leaf': 10, 'max_features': 'sqrt', 'bootstrap': False, 'criterion': 'squared_error'}. Best is trial 223 with value: 0.4188398890260366.
[I 2024-12-04 14:54:55,744] Trial 396 finished with value: 0.43207889853567283 and parameters: {'n_estimators': 834, 'max_depth': 33, 'min_samples_split': 4, 'min_samples_leaf': 1, 'max_features': None, 'bootstrap': True, 'criterion': 'squared_error'}. Best is trial 223 with value: 0.4188398890260366.
[I 2024-12-04 14:54:59,874] Trial 401 finished with value: 0.41967863036158704 and parameters: {'n_estimators': 886, 'max_depth': 41, 'min_samples_split': 2, 'min_samples_leaf': 1, 'max_features': None, 'bootstrap': True, 'criterion': 'squared_error'}. Best is trial 223 with value: 0.4188398890260366.
[I 2024-12-04 14:55:00,018] Trial 403 finished with value: 0.5220827018180901 and parameters: {'n_estimators': 414, 'max_depth': 44, 'min_samples_split': 2, 'min_samples_leaf': 1, 'max_features': 'sqrt', 'bootstrap': False, 'criterion': 'absolute_error'}. Best is trial 223 with value: 0.4188398890260366.
[I 2024-12-04 14:55:00,435] Trial 397 finished with value: 0.41918836886448857 and parameters: {'n_estimators': 896, 'max_depth': 40, 'min_samples_split': 2, 'min_samples_leaf': 1, 'max_features': None, 'bootstrap': True, 'criterion': 'squared_error'}. Best is trial 223 with value: 0.4188398890260366.
[I 2024-12-04 14:55:00,548] Trial 394 finished with value: 0.723168837963682 and parameters: {'n_estimators': 883, 'max_depth': 41, 'min_samples_split': 2, 'min_samples_leaf': 2, 'max_features': 'sqrt', 'bootstrap': True, 'criterion': 'absolute_error'}. Best is trial 223 with value: 0.4188398890260366.
[I 2024-12-04 14:55:00,758] Trial 404 finished with value: 0.4206825883247202 and parameters: {'n_estimators': 938, 'max_depth': 37, 'min_samples_split': 2, 'min_samples_leaf': 1, 'max_features': None, 'bootstrap': True, 'criterion': 'squared_error'}. Best is trial 223 with value: 0.4188398890260366.
[I 2024-12-04 14:55:02,662] Trial 413 finished with value: 1.0361161847553206 and parameters: {'n_estimators': 442, 'max_depth': 32, 'min_samples_split': 3, 'min_samples_leaf': 13, 'max_features': 'sqrt', 'bootstrap': True, 'criterion': 'squared_error'}. Best is trial 223 with value: 0.4188398890260366.
[I 2024-12-04 14:55:03,540] Trial 405 finished with value: 0.46510251488525867 and parameters: {'n_estimators': 763, 'max_depth': 41, 'min_samples_split': 2, 'min_samples_leaf': 2, 'max_features': None, 'bootstrap': True, 'criterion': 'squared_error'}. Best is trial 223 with value: 0.4188398890260366.
[I 2024-12-04 14:55:05,727] Trial 400 finished with value: 0.4198378365652792 and parameters: {'n_estimators': 757, 'max_depth': 39, 'min_samples_split': 2, 'min_samples_leaf': 1, 'max_features': None, 'bootstrap': True, 'criterion': 'squared_error'}. Best is trial 223 with value: 0.4188398890260366.
[I 2024-12-04 14:55:06,623] Trial 410 finished with value: 0.9047895505278241 and parameters: {'n_estimators': 205, 'max_depth': 30, 'min_samples_split': 9, 'min_samples_leaf': 4, 'max_features': 'sqrt', 'bootstrap': True, 'criterion': 'absolute_error'}. Best is trial 223 with value: 0.4188398890260366.
[I 2024-12-04 14:55:22,563] Trial 406 finished with value: 0.4207298077551881 and parameters: {'n_estimators': 967, 'max_depth': 48, 'min_samples_split': 2, 'min_samples_leaf': 1, 'max_features': None, 'bootstrap': True, 'criterion': 'squared_error'}. Best is trial 223 with value: 0.4188398890260366.
[I 2024-12-04 14:55:22,697] Trial 411 finished with value: 0.4652082279021774 and parameters: {'n_estimators': 934, 'max_depth': 35, 'min_samples_split': 2, 'min_samples_leaf': 2, 'max_features': None, 'bootstrap': True, 'criterion': 'squared_error'}. Best is trial 223 with value: 0.4188398890260366.
[I 2024-12-04 14:55:22,698] Trial 412 finished with value: 0.5272701575186779 and parameters: {'n_estimators': 704, 'max_depth': 43, 'min_samples_split': 2, 'min_samples_leaf': 1, 'max_features': None, 'bootstrap': False, 'criterion': 'squared_error'}. Best is trial 223 with value: 0.4188398890260366.
[I 2024-12-04 14:55:22,703] Trial 414 finished with value: 0.6694485973134109 and parameters: {'n_estimators': 648, 'max_depth': 35, 'min_samples_split': 3, 'min_samples_leaf': 1, 'max_features': 'log2', 'bootstrap': True, 'criterion': 'squared_error'}. Best is trial 223 with value: 0.4188398890260366.
[I 2024-12-04 14:55:22,749] Trial 416 finished with value: 0.6559035498965078 and parameters: {'n_estimators': 915, 'max_depth': 36, 'min_samples_split': 2, 'min_samples_leaf': 1, 'max_features': 'log2', 'bootstrap': True, 'criterion': 'squared_error'}. Best is trial 223 with value: 0.4188398890260366.
[I 2024-12-04 14:55:23,476] Trial 417 finished with value: 1.0551550063819681 and parameters: {'n_estimators': 804, 'max_depth': 43, 'min_samples_split': 10, 'min_samples_leaf': 9, 'max_features': 'log2', 'bootstrap': True, 'criterion': 'absolute_error'}. Best is trial 223 with value: 0.4188398890260366.
[I 2024-12-04 14:55:28,868] Trial 422 finished with value: 1.0040179677487078 and parameters: {'n_estimators': 403, 'max_depth': 37, 'min_samples_split': 42, 'min_samples_leaf': 14, 'max_features': 'sqrt', 'bootstrap': False, 'criterion': 'absolute_error'}. Best is trial 223 with value: 0.4188398890260366.
[I 2024-12-04 14:55:34,480] Trial 421 finished with value: 0.6982004557644795 and parameters: {'n_estimators': 942, 'max_depth': 34, 'min_samples_split': 2, 'min_samples_leaf': 2, 'max_features': 'sqrt', 'bootstrap': True, 'criterion': 'squared_error'}. Best is trial 223 with value: 0.4188398890260366.
[I 2024-12-04 14:55:34,489] Trial 423 finished with value: 0.4254032097349025 and parameters: {'n_estimators': 693, 'max_depth': 42, 'min_samples_split': 3, 'min_samples_leaf': 1, 'max_features': None, 'bootstrap': True, 'criterion': 'squared_error'}. Best is trial 223 with value: 0.4188398890260366.
[I 2024-12-04 14:55:34,639] Trial 418 finished with value: 0.42427500264573675 and parameters: {'n_estimators': 982, 'max_depth': 35, 'min_samples_split': 3, 'min_samples_leaf': 1, 'max_features': None, 'bootstrap': True, 'criterion': 'squared_error'}. Best is trial 223 with value: 0.4188398890260366.
[I 2024-12-04 14:55:37,566] Trial 415 finished with value: 0.7263625964291399 and parameters: {'n_estimators': 805, 'max_depth': 20, 'min_samples_split': 19, 'min_samples_leaf': 1, 'max_features': 'sqrt', 'bootstrap': True, 'criterion': 'absolute_error'}. Best is trial 223 with value: 0.4188398890260366.
[I 2024-12-04 14:55:37,704] Trial 419 finished with value: 0.4232994623935555 and parameters: {'n_estimators': 994, 'max_depth': 41, 'min_samples_split': 3, 'min_samples_leaf': 1, 'max_features': None, 'bootstrap': True, 'criterion': 'squared_error'}. Best is trial 223 with value: 0.4188398890260366.
[I 2024-12-04 14:55:38,219] Trial 424 finished with value: 0.41889165033338416 and parameters: {'n_estimators': 724, 'max_depth': 40, 'min_samples_split': 2, 'min_samples_leaf': 1, 'max_features': None, 'bootstrap': True, 'criterion': 'squared_error'}. Best is trial 223 with value: 0.4188398890260366.
[I 2024-12-04 14:55:38,264] Trial 426 finished with value: 0.48536676411918045 and parameters: {'n_estimators': 862, 'max_depth': 48, 'min_samples_split': 2, 'min_samples_leaf': 1, 'max_features': 'sqrt', 'bootstrap': True, 'criterion': 'squared_error'}. Best is trial 223 with value: 0.4188398890260366.
[I 2024-12-04 14:55:38,541] Trial 425 finished with value: 0.4213892051498981 and parameters: {'n_estimators': 765, 'max_depth': 44, 'min_samples_split': 2, 'min_samples_leaf': 1, 'max_features': None, 'bootstrap': True, 'criterion': 'squared_error'}. Best is trial 223 with value: 0.4188398890260366.
[I 2024-12-04 14:55:41,213] Trial 420 finished with value: 0.420796957806691 and parameters: {'n_estimators': 985, 'max_depth': 34, 'min_samples_split': 2, 'min_samples_leaf': 1, 'max_features': None, 'bootstrap': True, 'criterion': 'squared_error'}. Best is trial 223 with value: 0.4188398890260366.
[I 2024-12-04 14:55:41,571] Trial 439 finished with value: 0.7349756237171085 and parameters: {'n_estimators': 142, 'max_depth': 21, 'min_samples_split': 11, 'min_samples_leaf': 2, 'max_features': 'sqrt', 'bootstrap': False, 'criterion': 'absolute_error'}. Best is trial 223 with value: 0.4188398890260366.
[I 2024-12-04 14:55:42,630] Trial 408 finished with value: 0.6416200926225729 and parameters: {'n_estimators': 921, 'max_depth': 20, 'min_samples_split': 34, 'min_samples_leaf': 5, 'max_features': None, 'bootstrap': True, 'criterion': 'absolute_error'}. Best is trial 223 with value: 0.4188398890260366.
[I 2024-12-04 14:55:45,450] Trial 428 finished with value: 0.4318456996993446 and parameters: {'n_estimators': 800, 'max_depth': 42, 'min_samples_split': 4, 'min_samples_leaf': 1, 'max_features': None, 'bootstrap': True, 'criterion': 'squared_error'}. Best is trial 223 with value: 0.4188398890260366.
[I 2024-12-04 14:55:52,374] Trial 429 finished with value: 0.41938256094337595 and parameters: {'n_estimators': 938, 'max_depth': 39, 'min_samples_split': 2, 'min_samples_leaf': 1, 'max_features': None, 'bootstrap': True, 'criterion': 'squared_error'}. Best is trial 223 with value: 0.4188398890260366.
[I 2024-12-04 14:55:52,396] Trial 433 finished with value: 0.4654788984377542 and parameters: {'n_estimators': 831, 'max_depth': 41, 'min_samples_split': 4, 'min_samples_leaf': 2, 'max_features': None, 'bootstrap': True, 'criterion': 'squared_error'}. Best is trial 223 with value: 0.4188398890260366.
[I 2024-12-04 14:55:53,483] Trial 430 finished with value: 0.4216227773485567 and parameters: {'n_estimators': 803, 'max_depth': 42, 'min_samples_split': 2, 'min_samples_leaf': 1, 'max_features': None, 'bootstrap': True, 'criterion': 'squared_error'}. Best is trial 223 with value: 0.4188398890260366.
[I 2024-12-04 14:55:53,886] Trial 431 finished with value: 0.42074042754857627 and parameters: {'n_estimators': 974, 'max_depth': 36, 'min_samples_split': 2, 'min_samples_leaf': 1, 'max_features': None, 'bootstrap': True, 'criterion': 'squared_error'}. Best is trial 223 with value: 0.4188398890260366.
[I 2024-12-04 14:55:54,739] Trial 434 finished with value: 0.4193204839417548 and parameters: {'n_estimators': 780, 'max_depth': 41, 'min_samples_split': 2, 'min_samples_leaf': 1, 'max_features': None, 'bootstrap': True, 'criterion': 'squared_error'}. Best is trial 223 with value: 0.4188398890260366.
