[I 2024-12-04 12:41:36,382] Trial 1398 finished with value: 0.390469541225557 and parameters: {'n_estimators': 1233, 'learning_rate': 0.09804160835786159, 'max_depth': 9, 'min_samples_split': 4, 'min_samples_leaf': 3, 'subsample': 0.7226426463020531, 'max_features': None}. Best is trial 989 with value: 0.3092662874814911.
[I 2024-12-04 12:41:38,873] Trial 1396 finished with value: 0.31507880428240953 and parameters: {'n_estimators': 1461, 'learning_rate': 0.08758062334585813, 'max_depth': 7, 'min_samples_split': 2, 'min_samples_leaf': 2, 'subsample': 0.784235477555459, 'max_features': None}. Best is trial 989 with value: 0.3092662874814911.
[I 2024-12-04 12:41:39,066] Trial 1409 finished with value: 0.37459131700370846 and parameters: {'n_estimators': 1038, 'learning_rate': 0.07833378432807965, 'max_depth': 6, 'min_samples_split': 7, 'min_samples_leaf': 1, 'subsample': 0.6685536391474689, 'max_features': None}. Best is trial 989 with value: 0.3092662874814911.
[I 2024-12-04 12:41:40,558] Trial 1406 finished with value: 0.3944670921319038 and parameters: {'n_estimators': 1092, 'learning_rate': 0.07559074289079268, 'max_depth': 6, 'min_samples_split': 2, 'min_samples_leaf': 3, 'subsample': 0.6712119409489494, 'max_features': None}. Best is trial 989 with value: 0.3092662874814911.
[I 2024-12-04 12:41:43,160] Trial 1421 finished with value: 0.46420368115115845 and parameters: {'n_estimators': 778, 'learning_rate': 0.02651053959452512, 'max_depth': 9, 'min_samples_split': 5, 'min_samples_leaf': 7, 'subsample': 0.9655124858895254, 'max_features': 'sqrt'}. Best is trial 989 with value: 0.3092662874814911.
[I 2024-12-04 12:41:44,555] Trial 1419 finished with value: 0.5880053849587457 and parameters: {'n_estimators': 842, 'learning_rate': 0.012315431786616845, 'max_depth': 3, 'min_samples_split': 13, 'min_samples_leaf': 10, 'subsample': 0.9708312727063254, 'max_features': None}. Best is trial 989 with value: 0.3092662874814911.
[I 2024-12-04 12:41:45,516] Trial 1400 finished with value: 0.3893982210012741 and parameters: {'n_estimators': 1474, 'learning_rate': 0.08482406933763698, 'max_depth': 5, 'min_samples_split': 7, 'min_samples_leaf': 4, 'subsample': 0.651095477465825, 'max_features': None}. Best is trial 989 with value: 0.3092662874814911.
[I 2024-12-04 12:41:45,593] Trial 1405 finished with value: 0.8911523689071822 and parameters: {'n_estimators': 1471, 'learning_rate': 0.01082888520043294, 'max_depth': 4, 'min_samples_split': 20, 'min_samples_leaf': 9, 'subsample': 0.6919345227454391, 'max_features': 'log2'}. Best is trial 989 with value: 0.3092662874814911.
[I 2024-12-04 12:41:48,570] Trial 1402 finished with value: 0.3834475580621215 and parameters: {'n_estimators': 1457, 'learning_rate': 0.0898271780531527, 'max_depth': 9, 'min_samples_split': 5, 'min_samples_leaf': 1, 'subsample': 0.6855533130328351, 'max_features': None}. Best is trial 989 with value: 0.3092662874814911.
[I 2024-12-04 12:41:48,820] Trial 1407 finished with value: 0.3942600065366891 and parameters: {'n_estimators': 1347, 'learning_rate': 0.09372077064524052, 'max_depth': 6, 'min_samples_split': 5, 'min_samples_leaf': 3, 'subsample': 0.6667290883876961, 'max_features': None}. Best is trial 989 with value: 0.3092662874814911.
[I 2024-12-04 12:41:50,022] Trial 1416 finished with value: 0.3286407508125946 and parameters: {'n_estimators': 1091, 'learning_rate': 0.0777070066184099, 'max_depth': 7, 'min_samples_split': 6, 'min_samples_leaf': 2, 'subsample': 0.718878781476923, 'max_features': None}. Best is trial 989 with value: 0.3092662874814911.
[I 2024-12-04 12:41:51,752] Trial 1411 finished with value: 0.3521149871878914 and parameters: {'n_estimators': 1298, 'learning_rate': 0.09156216268256, 'max_depth': 6, 'min_samples_split': 5, 'min_samples_leaf': 1, 'subsample': 0.6703303434443101, 'max_features': None}. Best is trial 989 with value: 0.3092662874814911.
[I 2024-12-04 12:41:52,483] Trial 1412 finished with value: 0.32020905078129885 and parameters: {'n_estimators': 1291, 'learning_rate': 0.08126610414652363, 'max_depth': 5, 'min_samples_split': 5, 'min_samples_leaf': 2, 'subsample': 0.6854866208616889, 'max_features': None}. Best is trial 989 with value: 0.3092662874814911.
[I 2024-12-04 12:41:52,699] Trial 1423 finished with value: 0.33485505825029693 and parameters: {'n_estimators': 847, 'learning_rate': 0.05301725646808813, 'max_depth': 6, 'min_samples_split': 3, 'min_samples_leaf': 2, 'subsample': 0.7442302632129869, 'max_features': None}. Best is trial 989 with value: 0.3092662874814911.
[I 2024-12-04 12:41:52,719] Trial 1413 finished with value: 0.3282850733881526 and parameters: {'n_estimators': 1252, 'learning_rate': 0.09892098091970458, 'max_depth': 7, 'min_samples_split': 2, 'min_samples_leaf': 2, 'subsample': 0.6026332965674034, 'max_features': None}. Best is trial 989 with value: 0.3092662874814911.
[I 2024-12-04 12:41:54,702] Trial 1431 finished with value: 0.4096585808459517 and parameters: {'n_estimators': 689, 'learning_rate': 0.0879036864494408, 'max_depth': 9, 'min_samples_split': 3, 'min_samples_leaf': 3, 'subsample': 0.6201927148594837, 'max_features': 'sqrt'}. Best is trial 989 with value: 0.3092662874814911.
[I 2024-12-04 12:41:58,208] Trial 1417 finished with value: 0.37187697299231176 and parameters: {'n_estimators': 1292, 'learning_rate': 0.0914975468122663, 'max_depth': 8, 'min_samples_split': 2, 'min_samples_leaf': 4, 'subsample': 0.6763302963538474, 'max_features': None}. Best is trial 989 with value: 0.3092662874814911.
[I 2024-12-04 12:42:01,063] Trial 1420 finished with value: 0.3231148786907402 and parameters: {'n_estimators': 1339, 'learning_rate': 0.09310976875511494, 'max_depth': 5, 'min_samples_split': 3, 'min_samples_leaf': 2, 'subsample': 0.7736583924544377, 'max_features': None}. Best is trial 989 with value: 0.3092662874814911.
[I 2024-12-04 12:42:02,238] Trial 1427 finished with value: 0.3770425161118074 and parameters: {'n_estimators': 1030, 'learning_rate': 0.06654307594805468, 'max_depth': 6, 'min_samples_split': 2, 'min_samples_leaf': 1, 'subsample': 0.6845367031413606, 'max_features': None}. Best is trial 989 with value: 0.3092662874814911.
[I 2024-12-04 12:42:04,982] Trial 1425 finished with value: 0.46143641012900677 and parameters: {'n_estimators': 1313, 'learning_rate': 0.01793916952263326, 'max_depth': 5, 'min_samples_split': 2, 'min_samples_leaf': 4, 'subsample': 0.8067389647846267, 'max_features': 'sqrt'}. Best is trial 989 with value: 0.3092662874814911.
[I 2024-12-04 12:42:06,572] Trial 1424 finished with value: 0.5872695382302242 and parameters: {'n_estimators': 1412, 'learning_rate': 0.04462295954381413, 'max_depth': 10, 'min_samples_split': 5, 'min_samples_leaf': 9, 'subsample': 0.6217119481922786, 'max_features': 'sqrt'}. Best is trial 989 with value: 0.3092662874814911.
[I 2024-12-04 12:42:10,179] Trial 1428 finished with value: 0.6272423429463975 and parameters: {'n_estimators': 1431, 'learning_rate': 0.013753930351253496, 'max_depth': 8, 'min_samples_split': 5, 'min_samples_leaf': 9, 'subsample': 0.6543979010457444, 'max_features': 'sqrt'}. Best is trial 989 with value: 0.3092662874814911.
[I 2024-12-04 12:42:10,709] Trial 1430 finished with value: 0.6380251845017613 and parameters: {'n_estimators': 1325, 'learning_rate': 0.01704929357987463, 'max_depth': 4, 'min_samples_split': 16, 'min_samples_leaf': 10, 'subsample': 0.6696461734349889, 'max_features': 'sqrt'}. Best is trial 989 with value: 0.3092662874814911.
[I 2024-12-04 12:42:12,893] Trial 1426 finished with value: 0.3785344803414609 and parameters: {'n_estimators': 1428, 'learning_rate': 0.0977435986909753, 'max_depth': 4, 'min_samples_split': 7, 'min_samples_leaf': 4, 'subsample': 0.7469447121618151, 'max_features': None}. Best is trial 989 with value: 0.3092662874814911.
[I 2024-12-04 12:42:13,877] Trial 1434 finished with value: 0.47276837236714103 and parameters: {'n_estimators': 1206, 'learning_rate': 0.08736903006460324, 'max_depth': 8, 'min_samples_split': 2, 'min_samples_leaf': 7, 'subsample': 0.8972358540452832, 'max_features': 'log2'}. Best is trial 989 with value: 0.3092662874814911.
[I 2024-12-04 12:42:17,636] Trial 1441 finished with value: 0.3812483352408749 and parameters: {'n_estimators': 1082, 'learning_rate': 0.07416060665726083, 'max_depth': 6, 'min_samples_split': 6, 'min_samples_leaf': 1, 'subsample': 0.6988912474849814, 'max_features': 'sqrt'}. Best is trial 989 with value: 0.3092662874814911.
[I 2024-12-04 12:42:18,082] Trial 1438 finished with value: 0.388946723996055 and parameters: {'n_estimators': 1090, 'learning_rate': 0.08946904461292111, 'max_depth': 7, 'min_samples_split': 5, 'min_samples_leaf': 1, 'subsample': 0.7427893193285181, 'max_features': None}. Best is trial 989 with value: 0.3092662874814911.
[I 2024-12-04 12:42:19,658] Trial 1444 finished with value: 0.3656269065403292 and parameters: {'n_estimators': 884, 'learning_rate': 0.07341217205698815, 'max_depth': 7, 'min_samples_split': 2, 'min_samples_leaf': 4, 'subsample': 0.7770710571876311, 'max_features': None}. Best is trial 989 with value: 0.3092662874814911.
[I 2024-12-04 12:42:20,075] Trial 1429 finished with value: 0.3913591298623616 and parameters: {'n_estimators': 1478, 'learning_rate': 0.06375728333802401, 'max_depth': 6, 'min_samples_split': 3, 'min_samples_leaf': 3, 'subsample': 0.7126114356236917, 'max_features': None}. Best is trial 989 with value: 0.3092662874814911.
[I 2024-12-04 12:42:20,508] Trial 1458 finished with value: 0.5683728167547728 and parameters: {'n_estimators': 424, 'learning_rate': 0.04256967176144563, 'max_depth': 3, 'min_samples_split': 9, 'min_samples_leaf': 10, 'subsample': 0.9823718434648461, 'max_features': None}. Best is trial 989 with value: 0.3092662874814911.
[I 2024-12-04 12:42:21,995] Trial 1433 finished with value: 0.37972150845962593 and parameters: {'n_estimators': 1357, 'learning_rate': 0.09365364058876433, 'max_depth': 6, 'min_samples_split': 9, 'min_samples_leaf': 3, 'subsample': 0.6947399666422815, 'max_features': None}. Best is trial 989 with value: 0.3092662874814911.
[I 2024-12-04 12:42:22,772] Trial 1432 finished with value: 0.3235608961445812 and parameters: {'n_estimators': 1401, 'learning_rate': 0.07791654566766865, 'max_depth': 6, 'min_samples_split': 6, 'min_samples_leaf': 2, 'subsample': 0.6947863297197671, 'max_features': None}. Best is trial 989 with value: 0.3092662874814911.
[I 2024-12-04 12:42:23,173] Trial 1435 finished with value: 0.39063084972445744 and parameters: {'n_estimators': 1321, 'learning_rate': 0.05365804285059665, 'max_depth': 6, 'min_samples_split': 3, 'min_samples_leaf': 3, 'subsample': 0.6769233769470303, 'max_features': None}. Best is trial 989 with value: 0.3092662874814911.
[I 2024-12-04 12:42:23,176] Trial 1436 finished with value: 0.3802663778771775 and parameters: {'n_estimators': 1176, 'learning_rate': 0.09194685909572077, 'max_depth': 7, 'min_samples_split': 6, 'min_samples_leaf': 3, 'subsample': 0.7615069442487924, 'max_features': None}. Best is trial 989 with value: 0.3092662874814911.
[I 2024-12-04 12:42:28,881] Trial 1452 finished with value: 0.32514067312243317 and parameters: {'n_estimators': 843, 'learning_rate': 0.08752278901609607, 'max_depth': 8, 'min_samples_split': 3, 'min_samples_leaf': 2, 'subsample': 0.7671700432058863, 'max_features': None}. Best is trial 989 with value: 0.3092662874814911.
[I 2024-12-04 12:42:28,950] Trial 1437 finished with value: 0.4183224375180417 and parameters: {'n_estimators': 1298, 'learning_rate': 0.07551226808467812, 'max_depth': 7, 'min_samples_split': 2, 'min_samples_leaf': 1, 'subsample': 0.8452756207973595, 'max_features': None}. Best is trial 989 with value: 0.3092662874814911.
[I 2024-12-04 12:42:29,775] Trial 1446 finished with value: 0.38831509477098297 and parameters: {'n_estimators': 1169, 'learning_rate': 0.09521742871685254, 'max_depth': 6, 'min_samples_split': 7, 'min_samples_leaf': 3, 'subsample': 0.7844571753892355, 'max_features': None}. Best is trial 989 with value: 0.3092662874814911.
[I 2024-12-04 12:42:29,997] Trial 1439 finished with value: 0.3230147945304793 and parameters: {'n_estimators': 1345, 'learning_rate': 0.09736862629065303, 'max_depth': 7, 'min_samples_split': 2, 'min_samples_leaf': 2, 'subsample': 0.7524776321060003, 'max_features': None}. Best is trial 989 with value: 0.3092662874814911.
[I 2024-12-04 12:42:34,226] Trial 1447 finished with value: 0.38338089199847325 and parameters: {'n_estimators': 1222, 'learning_rate': 0.06259188924334501, 'max_depth': 5, 'min_samples_split': 7, 'min_samples_leaf': 1, 'subsample': 0.6765857750688, 'max_features': None}. Best is trial 989 with value: 0.3092662874814911.
[I 2024-12-04 12:42:35,758] Trial 1448 finished with value: 0.5859939894151673 and parameters: {'n_estimators': 1374, 'learning_rate': 0.03736595383596569, 'max_depth': 5, 'min_samples_split': 2, 'min_samples_leaf': 9, 'subsample': 0.8724983257387268, 'max_features': 'sqrt'}. Best is trial 989 with value: 0.3092662874814911.
[I 2024-12-04 12:42:35,758] Trial 1440 finished with value: 0.38777206940143055 and parameters: {'n_estimators': 1480, 'learning_rate': 0.07371161293283483, 'max_depth': 6, 'min_samples_split': 4, 'min_samples_leaf': 1, 'subsample': 0.757631737723528, 'max_features': None}. Best is trial 989 with value: 0.3092662874814911.
[I 2024-12-04 12:42:36,341] Trial 1463 finished with value: 0.7185406062647823 and parameters: {'n_estimators': 650, 'learning_rate': 0.011333970531801534, 'max_depth': 8, 'min_samples_split': 3, 'min_samples_leaf': 10, 'subsample': 0.8352654868986644, 'max_features': 'sqrt'}. Best is trial 989 with value: 0.3092662874814911.
[I 2024-12-04 12:42:38,029] Trial 1442 finished with value: 0.37636386807573274 and parameters: {'n_estimators': 1453, 'learning_rate': 0.08466338633108805, 'max_depth': 8, 'min_samples_split': 4, 'min_samples_leaf': 4, 'subsample': 0.7811891606405547, 'max_features': None}. Best is trial 989 with value: 0.3092662874814911.
[I 2024-12-04 12:42:38,501] Trial 1455 finished with value: 0.32869431481239564 and parameters: {'n_estimators': 1059, 'learning_rate': 0.07173995980280527, 'max_depth': 5, 'min_samples_split': 2, 'min_samples_leaf': 2, 'subsample': 0.730398036945949, 'max_features': None}. Best is trial 989 with value: 0.3092662874814911.
[I 2024-12-04 12:42:38,818] Trial 1453 finished with value: 0.33316569279802094 and parameters: {'n_estimators': 1156, 'learning_rate': 0.08194527979982158, 'max_depth': 5, 'min_samples_split': 6, 'min_samples_leaf': 2, 'subsample': 0.7554289975826731, 'max_features': None}. Best is trial 989 with value: 0.3092662874814911.
[I 2024-12-04 12:42:39,729] Trial 1451 finished with value: 0.40637178341572866 and parameters: {'n_estimators': 1226, 'learning_rate': 0.05753768205810082, 'max_depth': 4, 'min_samples_split': 7, 'min_samples_leaf': 3, 'subsample': 0.7159375891036606, 'max_features': None}. Best is trial 989 with value: 0.3092662874814911.
[I 2024-12-04 12:42:40,066] Trial 1443 finished with value: 0.3942010995179918 and parameters: {'n_estimators': 1465, 'learning_rate': 0.07200941686736385, 'max_depth': 6, 'min_samples_split': 2, 'min_samples_leaf': 1, 'subsample': 0.8212051689209391, 'max_features': None}. Best is trial 989 with value: 0.3092662874814911.
[I 2024-12-04 12:42:41,163] Trial 1445 finished with value: 0.3913636420555777 and parameters: {'n_estimators': 1478, 'learning_rate': 0.05595704894554824, 'max_depth': 5, 'min_samples_split': 2, 'min_samples_leaf': 3, 'subsample': 0.6092258598996219, 'max_features': None}. Best is trial 989 with value: 0.3092662874814911.
[I 2024-12-04 12:42:41,169] Trial 1457 finished with value: 0.3898227928064297 and parameters: {'n_estimators': 1086, 'learning_rate': 0.03129907603600888, 'max_depth': 5, 'min_samples_split': 9, 'min_samples_leaf': 3, 'subsample': 0.6574239187910156, 'max_features': None}. Best is trial 989 with value: 0.3092662874814911.
[I 2024-12-04 12:42:41,301] Trial 1450 finished with value: 0.4390086489277526 and parameters: {'n_estimators': 1329, 'learning_rate': 0.08215514200267057, 'max_depth': 3, 'min_samples_split': 16, 'min_samples_leaf': 3, 'subsample': 0.6615690580245449, 'max_features': 'sqrt'}. Best is trial 989 with value: 0.3092662874814911.
[I 2024-12-04 12:42:44,680] Trial 1459 finished with value: 0.3707719661658781 and parameters: {'n_estimators': 999, 'learning_rate': 0.05387880547806658, 'max_depth': 6, 'min_samples_split': 7, 'min_samples_leaf': 4, 'subsample': 0.7671316314305545, 'max_features': None}. Best is trial 1454 with value: 0.30763307678022894.
[I 2024-12-04 12:42:45,378] Trial 1454 finished with value: 0.30763307678022894 and parameters: {'n_estimators': 1238, 'learning_rate': 0.08914137137280047, 'max_depth': 6, 'min_samples_split': 2, 'min_samples_leaf': 2, 'subsample': 0.8722091493318835, 'max_features': None}. Best is trial 1454 with value: 0.30763307678022894.
[I 2024-12-04 12:42:45,859] Trial 1449 finished with value: 0.42287123566093604 and parameters: {'n_estimators': 1475, 'learning_rate': 0.04272462083298003, 'max_depth': 4, 'min_samples_split': 8, 'min_samples_leaf': 1, 'subsample': 0.7796559966605857, 'max_features': None}. Best is trial 1454 with value: 0.30763307678022894.
[I 2024-12-04 12:42:52,803] Trial 1470 finished with value: 0.4270465020407296 and parameters: {'n_estimators': 770, 'learning_rate': 0.0956086378098606, 'max_depth': 4, 'min_samples_split': 8, 'min_samples_leaf': 1, 'subsample': 0.6047822412189243, 'max_features': 'log2'}. Best is trial 1454 with value: 0.30763307678022894.
[I 2024-12-04 12:42:53,144] Trial 1461 finished with value: 0.5611147922456148 and parameters: {'n_estimators': 1171, 'learning_rate': 0.0401665189645903, 'max_depth': 3, 'min_samples_split': 12, 'min_samples_leaf': 10, 'subsample': 0.7608442858745955, 'max_features': None}. Best is trial 1454 with value: 0.30763307678022894.
[I 2024-12-04 12:42:54,541] Trial 1460 finished with value: 0.3291627451850894 and parameters: {'n_estimators': 1255, 'learning_rate': 0.0942159031800601, 'max_depth': 6, 'min_samples_split': 7, 'min_samples_leaf': 2, 'subsample': 0.645412262983225, 'max_features': None}. Best is trial 1454 with value: 0.30763307678022894.
[I 2024-12-04 12:42:54,617] Trial 1456 finished with value: 0.37701673164084903 and parameters: {'n_estimators': 1496, 'learning_rate': 0.09169911140634296, 'max_depth': 6, 'min_samples_split': 4, 'min_samples_leaf': 4, 'subsample': 0.7854420042891898, 'max_features': None}. Best is trial 1454 with value: 0.30763307678022894.
[I 2024-12-04 12:42:55,429] Trial 1487 finished with value: 0.8772490587024061 and parameters: {'n_estimators': 132, 'learning_rate': 0.01712367547772887, 'max_depth': 4, 'min_samples_split': 5, 'min_samples_leaf': 3, 'subsample': 0.6667391969757409, 'max_features': 'sqrt'}. Best is trial 1454 with value: 0.30763307678022894.
[I 2024-12-04 12:42:56,459] Trial 1465 finished with value: 0.536347905271729 and parameters: {'n_estimators': 1132, 'learning_rate': 0.03328372632773672, 'max_depth': 6, 'min_samples_split': 2, 'min_samples_leaf': 4, 'subsample': 0.6015378588257089, 'max_features': 'log2'}. Best is trial 1454 with value: 0.30763307678022894.
[I 2024-12-04 12:42:56,474] Trial 1469 finished with value: 0.43586987672536137 and parameters: {'n_estimators': 945, 'learning_rate': 0.0867267804370274, 'max_depth': 6, 'min_samples_split': 2, 'min_samples_leaf': 5, 'subsample': 0.6698308876759704, 'max_features': 'sqrt'}. Best is trial 1454 with value: 0.30763307678022894.
[I 2024-12-04 12:42:57,847] Trial 1484 finished with value: 0.611017916472827 and parameters: {'n_estimators': 243, 'learning_rate': 0.08628558201703154, 'max_depth': 7, 'min_samples_split': 8, 'min_samples_leaf': 9, 'subsample': 0.6867374532588987, 'max_features': 'sqrt'}. Best is trial 1454 with value: 0.30763307678022894.
[I 2024-12-04 12:42:57,953] Trial 1489 finished with value: 0.6901950537004397 and parameters: {'n_estimators': 153, 'learning_rate': 0.025704570944453442, 'max_depth': 7, 'min_samples_split': 20, 'min_samples_leaf': 4, 'subsample': 0.8821774357877281, 'max_features': 'sqrt'}. Best is trial 1454 with value: 0.30763307678022894.
[I 2024-12-04 12:43:01,016] Trial 1466 finished with value: 0.37978891297284206 and parameters: {'n_estimators': 1120, 'learning_rate': 0.0891389294428626, 'max_depth': 5, 'min_samples_split': 5, 'min_samples_leaf': 1, 'subsample': 0.6699131862804252, 'max_features': None}. Best is trial 1454 with value: 0.30763307678022894.
[I 2024-12-04 12:43:02,699] Trial 1474 finished with value: 0.43098332776764064 and parameters: {'n_estimators': 951, 'learning_rate': 0.06422259837446416, 'max_depth': 4, 'min_samples_split': 7, 'min_samples_leaf': 3, 'subsample': 0.7260622701919289, 'max_features': 'sqrt'}. Best is trial 1454 with value: 0.30763307678022894.
[I 2024-12-04 12:43:02,736] Trial 1464 finished with value: 0.3265629025822936 and parameters: {'n_estimators': 1210, 'learning_rate': 0.07242944042606796, 'max_depth': 6, 'min_samples_split': 4, 'min_samples_leaf': 2, 'subsample': 0.7466725151680761, 'max_features': None}. Best is trial 1454 with value: 0.30763307678022894.
[I 2024-12-04 12:43:05,666] Trial 1491 finished with value: 0.5500464183792585 and parameters: {'n_estimators': 336, 'learning_rate': 0.017532363371486063, 'max_depth': 3, 'min_samples_split': 3, 'min_samples_leaf': 6, 'subsample': 0.9146569665992781, 'max_features': None}. Best is trial 1454 with value: 0.30763307678022894.
[I 2024-12-04 12:43:06,509] Trial 1462 finished with value: 0.4084109182113427 and parameters: {'n_estimators': 1470, 'learning_rate': 0.0914947552448146, 'max_depth': 6, 'min_samples_split': 3, 'min_samples_leaf': 1, 'subsample': 0.73634465678172, 'max_features': None}. Best is trial 1454 with value: 0.30763307678022894.
