[I 2024-12-04 13:49:48,466] Trial 2386 finished with value: 0.23924165718874219 and parameters: {'n_estimators': 1470, 'learning_rate': 0.09822937294916166, 'max_depth': 9, 'min_samples_split': 5, 'min_samples_leaf': 1, 'subsample': 0.9255342910315175, 'max_features': 'sqrt'}. Best is trial 2314 with value: 0.22206050798261862.
[I 2024-12-04 13:49:52,597] Trial 2395 finished with value: 0.24896641388660684 and parameters: {'n_estimators': 1296, 'learning_rate': 0.07237604159194995, 'max_depth': 9, 'min_samples_split': 5, 'min_samples_leaf': 1, 'subsample': 0.7741128871045219, 'max_features': 'sqrt'}. Best is trial 2314 with value: 0.22206050798261862.
[I 2024-12-04 13:49:54,690] Trial 2392 finished with value: 0.26320463611841804 and parameters: {'n_estimators': 1381, 'learning_rate': 0.0922293663405242, 'max_depth': 3, 'min_samples_split': 5, 'min_samples_leaf': 1, 'subsample': 0.7468396589888188, 'max_features': 'sqrt'}. Best is trial 2314 with value: 0.22206050798261862.
[I 2024-12-04 13:49:54,884] Trial 2396 finished with value: 0.25998465020188277 and parameters: {'n_estimators': 1240, 'learning_rate': 0.09098182657833168, 'max_depth': 10, 'min_samples_split': 5, 'min_samples_leaf': 1, 'subsample': 0.7768066801794643, 'max_features': 'sqrt'}. Best is trial 2314 with value: 0.22206050798261862.
[I 2024-12-04 13:49:54,891] Trial 2423 finished with value: 0.5371075756952605 and parameters: {'n_estimators': 151, 'learning_rate': 0.014150456660090944, 'max_depth': 8, 'min_samples_split': 12, 'min_samples_leaf': 7, 'subsample': 0.6140028556821978, 'max_features': None}. Best is trial 2314 with value: 0.22206050798261862.
[I 2024-12-04 13:49:58,683] Trial 2398 finished with value: 0.3571488278031417 and parameters: {'n_estimators': 1265, 'learning_rate': 0.08948096313520845, 'max_depth': 9, 'min_samples_split': 6, 'min_samples_leaf': 4, 'subsample': 0.9286194868954993, 'max_features': 'log2'}. Best is trial 2314 with value: 0.22206050798261862.
[I 2024-12-04 13:49:59,225] Trial 2400 finished with value: 0.2584627532354052 and parameters: {'n_estimators': 1172, 'learning_rate': 0.09597519017789667, 'max_depth': 12, 'min_samples_split': 8, 'min_samples_leaf': 1, 'subsample': 0.9138595732631775, 'max_features': 'sqrt'}. Best is trial 2314 with value: 0.22206050798261862.
[I 2024-12-04 13:50:01,826] Trial 2393 finished with value: 0.28932355959275735 and parameters: {'n_estimators': 1464, 'learning_rate': 0.05629542526056621, 'max_depth': 7, 'min_samples_split': 2, 'min_samples_leaf': 2, 'subsample': 0.7253741492131384, 'max_features': 'sqrt'}. Best is trial 2314 with value: 0.22206050798261862.
[I 2024-12-04 13:50:07,509] Trial 2404 finished with value: 0.26062412951520125 and parameters: {'n_estimators': 1098, 'learning_rate': 0.09793906160001299, 'max_depth': 9, 'min_samples_split': 4, 'min_samples_leaf': 1, 'subsample': 0.8671475866867642, 'max_features': 'sqrt'}. Best is trial 2314 with value: 0.22206050798261862.
[I 2024-12-04 13:50:09,606] Trial 2419 finished with value: 0.42807193519134257 and parameters: {'n_estimators': 554, 'learning_rate': 0.0173295123531711, 'max_depth': 7, 'min_samples_split': 11, 'min_samples_leaf': 1, 'subsample': 0.8697231933994805, 'max_features': 'sqrt'}. Best is trial 2314 with value: 0.22206050798261862.
[I 2024-12-04 13:50:11,236] Trial 2418 finished with value: 0.3640811897840327 and parameters: {'n_estimators': 497, 'learning_rate': 0.011137027669215658, 'max_depth': 10, 'min_samples_split': 11, 'min_samples_leaf': 2, 'subsample': 0.7893284390606702, 'max_features': None}. Best is trial 2314 with value: 0.22206050798261862.
[I 2024-12-04 13:50:13,225] Trial 2402 finished with value: 0.3487261388648584 and parameters: {'n_estimators': 1283, 'learning_rate': 0.04742958164082353, 'max_depth': 12, 'min_samples_split': 6, 'min_samples_leaf': 3, 'subsample': 0.7297221199852139, 'max_features': 'sqrt'}. Best is trial 2314 with value: 0.22206050798261862.
[I 2024-12-04 13:50:14,687] Trial 2431 finished with value: 1.259815604856086 and parameters: {'n_estimators': 159, 'learning_rate': 0.010869664778038478, 'max_depth': 6, 'min_samples_split': 9, 'min_samples_leaf': 9, 'subsample': 0.8337685602424537, 'max_features': 'log2'}. Best is trial 2314 with value: 0.22206050798261862.
[I 2024-12-04 13:50:17,947] Trial 2410 finished with value: 0.243463667189475 and parameters: {'n_estimators': 1023, 'learning_rate': 0.0922855473271257, 'max_depth': 10, 'min_samples_split': 7, 'min_samples_leaf': 1, 'subsample': 0.9799613693260977, 'max_features': 'sqrt'}. Best is trial 2314 with value: 0.22206050798261862.
[I 2024-12-04 13:50:22,904] Trial 2413 finished with value: 0.36696179194345196 and parameters: {'n_estimators': 992, 'learning_rate': 0.09692244270418378, 'max_depth': 11, 'min_samples_split': 9, 'min_samples_leaf': 4, 'subsample': 0.8954293529632277, 'max_features': 'sqrt'}. Best is trial 2314 with value: 0.22206050798261862.
[I 2024-12-04 13:50:25,700] Trial 2407 finished with value: 0.36071840804680094 and parameters: {'n_estimators': 1243, 'learning_rate': 0.061711675080292586, 'max_depth': 8, 'min_samples_split': 5, 'min_samples_leaf': 3, 'subsample': 0.8122130023625146, 'max_features': 'sqrt'}. Best is trial 2314 with value: 0.22206050798261862.
[I 2024-12-04 13:50:28,544] Trial 2414 finished with value: 0.3642516171655766 and parameters: {'n_estimators': 884, 'learning_rate': 0.0514633015455661, 'max_depth': 11, 'min_samples_split': 5, 'min_samples_leaf': 1, 'subsample': 0.8558391297996081, 'max_features': None}. Best is trial 2314 with value: 0.22206050798261862.
[I 2024-12-04 13:50:31,039] Trial 2406 finished with value: 0.47590513466607937 and parameters: {'n_estimators': 1241, 'learning_rate': 0.0974227377531634, 'max_depth': 10, 'min_samples_split': 5, 'min_samples_leaf': 2, 'subsample': 0.9392550132040312, 'max_features': None}. Best is trial 2314 with value: 0.22206050798261862.
[I 2024-12-04 13:50:34,374] Trial 2412 finished with value: 0.35802895337727314 and parameters: {'n_estimators': 1216, 'learning_rate': 0.0998598382561035, 'max_depth': 7, 'min_samples_split': 6, 'min_samples_leaf': 3, 'subsample': 0.7842973914968545, 'max_features': 'sqrt'}. Best is trial 2314 with value: 0.22206050798261862.
[I 2024-12-04 13:50:39,437] Trial 2417 finished with value: 0.29689088877132447 and parameters: {'n_estimators': 1061, 'learning_rate': 0.06567631682405617, 'max_depth': 8, 'min_samples_split': 5, 'min_samples_leaf': 2, 'subsample': 0.9242919570115354, 'max_features': 'sqrt'}. Best is trial 2314 with value: 0.22206050798261862.
[I 2024-12-04 13:50:40,588] Trial 2405 finished with value: 0.3963255753895954 and parameters: {'n_estimators': 1419, 'learning_rate': 0.09080757721597027, 'max_depth': 10, 'min_samples_split': 8, 'min_samples_leaf': 3, 'subsample': 0.8264665802272155, 'max_features': None}. Best is trial 2314 with value: 0.22206050798261862.
[I 2024-12-04 13:50:44,061] Trial 2441 finished with value: 1.0374033182623117 and parameters: {'n_estimators': 280, 'learning_rate': 0.011212871087819154, 'max_depth': 3, 'min_samples_split': 7, 'min_samples_leaf': 8, 'subsample': 0.8926367149402415, 'max_features': 'sqrt'}. Best is trial 2314 with value: 0.22206050798261862.
[I 2024-12-04 13:50:46,553] Trial 2416 finished with value: 0.2485907232386516 and parameters: {'n_estimators': 1204, 'learning_rate': 0.09535574438819504, 'max_depth': 6, 'min_samples_split': 5, 'min_samples_leaf': 1, 'subsample': 0.7700516566939969, 'max_features': 'sqrt'}. Best is trial 2314 with value: 0.22206050798261862.
[I 2024-12-04 13:50:48,810] Trial 2415 finished with value: 0.2320140304724518 and parameters: {'n_estimators': 1269, 'learning_rate': 0.07733269533776939, 'max_depth': 6, 'min_samples_split': 4, 'min_samples_leaf': 1, 'subsample': 0.7620777397631695, 'max_features': 'sqrt'}. Best is trial 2314 with value: 0.22206050798261862.
[I 2024-12-04 13:50:48,815] Trial 2409 finished with value: 0.2539355787098125 and parameters: {'n_estimators': 1478, 'learning_rate': 0.04268164793240635, 'max_depth': 9, 'min_samples_split': 2, 'min_samples_leaf': 1, 'subsample': 0.6370792103501567, 'max_features': 'sqrt'}. Best is trial 2314 with value: 0.22206050798261862.
[I 2024-12-04 13:50:51,031] Trial 2421 finished with value: 0.2481186563348411 and parameters: {'n_estimators': 1021, 'learning_rate': 0.06754004261569674, 'max_depth': 9, 'min_samples_split': 5, 'min_samples_leaf': 1, 'subsample': 0.6281929194092428, 'max_features': 'sqrt'}. Best is trial 2314 with value: 0.22206050798261862.
[I 2024-12-04 13:50:52,448] Trial 2429 finished with value: 0.5807067435676528 and parameters: {'n_estimators': 792, 'learning_rate': 0.013594999587178273, 'max_depth': 4, 'min_samples_split': 4, 'min_samples_leaf': 1, 'subsample': 0.8090329682358598, 'max_features': 'sqrt'}. Best is trial 2314 with value: 0.22206050798261862.
[I 2024-12-04 13:50:52,480] Trial 2411 finished with value: 0.37126663502212176 and parameters: {'n_estimators': 1479, 'learning_rate': 0.08754012769501089, 'max_depth': 4, 'min_samples_split': 4, 'min_samples_leaf': 3, 'subsample': 0.7079756694706496, 'max_features': 'sqrt'}. Best is trial 2314 with value: 0.22206050798261862.
[I 2024-12-04 13:50:56,598] Trial 2420 finished with value: 0.35591590587920857 and parameters: {'n_estimators': 1105, 'learning_rate': 0.09585211266475376, 'max_depth': 8, 'min_samples_split': 14, 'min_samples_leaf': 3, 'subsample': 0.8632434932416169, 'max_features': 'sqrt'}. Best is trial 2314 with value: 0.22206050798261862.
[I 2024-12-04 13:50:59,791] Trial 2432 finished with value: 0.6653449342046672 and parameters: {'n_estimators': 795, 'learning_rate': 0.05812212926092371, 'max_depth': 5, 'min_samples_split': 12, 'min_samples_leaf': 8, 'subsample': 0.6072977343394219, 'max_features': 'log2'}. Best is trial 2314 with value: 0.22206050798261862.
[I 2024-12-04 13:51:01,071] Trial 2428 finished with value: 0.2868832060350627 and parameters: {'n_estimators': 983, 'learning_rate': 0.09431816785742711, 'max_depth': 10, 'min_samples_split': 12, 'min_samples_leaf': 1, 'subsample': 0.8382771652354847, 'max_features': 'sqrt'}. Best is trial 2314 with value: 0.22206050798261862.
[I 2024-12-04 13:51:09,275] Trial 2424 finished with value: 0.3346064200761186 and parameters: {'n_estimators': 1217, 'learning_rate': 0.09353073270217845, 'max_depth': 11, 'min_samples_split': 6, 'min_samples_leaf': 3, 'subsample': 0.8832865122322495, 'max_features': 'sqrt'}. Best is trial 2314 with value: 0.22206050798261862.
[I 2024-12-04 13:51:13,550] Trial 2422 finished with value: 0.2842918116283193 and parameters: {'n_estimators': 1316, 'learning_rate': 0.09811759184728686, 'max_depth': 7, 'min_samples_split': 4, 'min_samples_leaf': 1, 'subsample': 0.9376864503713167, 'max_features': 'sqrt'}. Best is trial 2314 with value: 0.22206050798261862.
[I 2024-12-04 13:51:17,917] Trial 2425 finished with value: 0.24336738760685606 and parameters: {'n_estimators': 1339, 'learning_rate': 0.061870386225535846, 'max_depth': 7, 'min_samples_split': 5, 'min_samples_leaf': 1, 'subsample': 0.8660765414879367, 'max_features': 'sqrt'}. Best is trial 2314 with value: 0.22206050798261862.
[I 2024-12-04 13:51:18,018] Trial 2427 finished with value: 0.2476982550559258 and parameters: {'n_estimators': 1284, 'learning_rate': 0.08756626641147838, 'max_depth': 8, 'min_samples_split': 5, 'min_samples_leaf': 1, 'subsample': 0.6308673182191191, 'max_features': 'sqrt'}. Best is trial 2314 with value: 0.22206050798261862.
[I 2024-12-04 13:51:22,340] Trial 2426 finished with value: 0.2542944413169682 and parameters: {'n_estimators': 1354, 'learning_rate': 0.062459640839631105, 'max_depth': 6, 'min_samples_split': 4, 'min_samples_leaf': 1, 'subsample': 0.7908947719232885, 'max_features': 'sqrt'}. Best is trial 2314 with value: 0.22206050798261862.
[I 2024-12-04 13:51:28,253] Trial 2433 finished with value: 0.294207265982793 and parameters: {'n_estimators': 1226, 'learning_rate': 0.07505088282361522, 'max_depth': 7, 'min_samples_split': 2, 'min_samples_leaf': 2, 'subsample': 0.7051864105941684, 'max_features': 'sqrt'}. Best is trial 2314 with value: 0.22206050798261862.
[I 2024-12-04 13:51:31,491] Trial 2455 finished with value: 0.41070495375169974 and parameters: {'n_estimators': 344, 'learning_rate': 0.058635431508037926, 'max_depth': 8, 'min_samples_split': 8, 'min_samples_leaf': 6, 'subsample': 0.7397945556495913, 'max_features': 'sqrt'}. Best is trial 2314 with value: 0.22206050798261862.
[I 2024-12-04 13:51:33,675] Trial 2435 finished with value: 0.27169810109064296 and parameters: {'n_estimators': 1236, 'learning_rate': 0.0942365296014477, 'max_depth': 8, 'min_samples_split': 6, 'min_samples_leaf': 1, 'subsample': 0.8543284480839128, 'max_features': 'sqrt'}. Best is trial 2314 with value: 0.22206050798261862.
[I 2024-12-04 13:51:36,457] Trial 2430 finished with value: 0.3537624582384453 and parameters: {'n_estimators': 1447, 'learning_rate': 0.07355804817646396, 'max_depth': 9, 'min_samples_split': 6, 'min_samples_leaf': 3, 'subsample': 0.8836563097000608, 'max_features': 'sqrt'}. Best is trial 2314 with value: 0.22206050798261862.
[I 2024-12-04 13:51:38,085] Trial 2463 finished with value: 1.0735883280115084 and parameters: {'n_estimators': 160, 'learning_rate': 0.015566235586437474, 'max_depth': 3, 'min_samples_split': 12, 'min_samples_leaf': 3, 'subsample': 0.682908734882238, 'max_features': 'sqrt'}. Best is trial 2314 with value: 0.22206050798261862.
[I 2024-12-04 13:51:42,616] Trial 2437 finished with value: 0.2509290743351955 and parameters: {'n_estimators': 1268, 'learning_rate': 0.0687847229184934, 'max_depth': 12, 'min_samples_split': 2, 'min_samples_leaf': 1, 'subsample': 0.6738708603531594, 'max_features': 'sqrt'}. Best is trial 2314 with value: 0.22206050798261862.
[I 2024-12-04 13:51:45,680] Trial 2438 finished with value: 0.27711994296171455 and parameters: {'n_estimators': 1305, 'learning_rate': 0.08400178163782156, 'max_depth': 7, 'min_samples_split': 2, 'min_samples_leaf': 2, 'subsample': 0.759636412517315, 'max_features': 'log2'}. Best is trial 2314 with value: 0.22206050798261862.
[I 2024-12-04 13:51:45,808] Trial 2436 finished with value: 0.24406142287772098 and parameters: {'n_estimators': 1387, 'learning_rate': 0.09003727361968993, 'max_depth': 9, 'min_samples_split': 6, 'min_samples_leaf': 1, 'subsample': 0.8639538374049268, 'max_features': 'sqrt'}. Best is trial 2314 with value: 0.22206050798261862.
[I 2024-12-04 13:51:47,580] Trial 2434 finished with value: 0.3999972714507687 and parameters: {'n_estimators': 1314, 'learning_rate': 0.07324576581242662, 'max_depth': 11, 'min_samples_split': 7, 'min_samples_leaf': 3, 'subsample': 0.6894940151390929, 'max_features': None}. Best is trial 2314 with value: 0.22206050798261862.
[I 2024-12-04 13:51:48,994] Trial 2443 finished with value: 0.3566269868256471 and parameters: {'n_estimators': 1147, 'learning_rate': 0.05773916135318315, 'max_depth': 8, 'min_samples_split': 2, 'min_samples_leaf': 3, 'subsample': 0.6544750461959968, 'max_features': 'sqrt'}. Best is trial 2314 with value: 0.22206050798261862.
[I 2024-12-04 13:51:54,813] Trial 2444 finished with value: 0.2567632755358196 and parameters: {'n_estimators': 1197, 'learning_rate': 0.09780180975073327, 'max_depth': 7, 'min_samples_split': 6, 'min_samples_leaf': 1, 'subsample': 0.8925169264486301, 'max_features': 'sqrt'}. Best is trial 2314 with value: 0.22206050798261862.
[I 2024-12-04 13:51:54,900] Trial 2439 finished with value: 0.2483788001578094 and parameters: {'n_estimators': 1337, 'learning_rate': 0.07077998359968175, 'max_depth': 6, 'min_samples_split': 2, 'min_samples_leaf': 1, 'subsample': 0.9661117699282487, 'max_features': 'sqrt'}. Best is trial 2314 with value: 0.22206050798261862.
[I 2024-12-04 13:51:58,818] Trial 2442 finished with value: 0.3077606116818218 and parameters: {'n_estimators': 1312, 'learning_rate': 0.06520070647795796, 'max_depth': 10, 'min_samples_split': 5, 'min_samples_leaf': 2, 'subsample': 0.6890184662606373, 'max_features': 'sqrt'}. Best is trial 2314 with value: 0.22206050798261862.
[I 2024-12-04 13:52:02,720] Trial 2459 finished with value: 0.8391226885742147 and parameters: {'n_estimators': 713, 'learning_rate': 0.039636114848722946, 'max_depth': 6, 'min_samples_split': 13, 'min_samples_leaf': 8, 'subsample': 0.9075422253485093, 'max_features': 'log2'}. Best is trial 2314 with value: 0.22206050798261862.
[I 2024-12-04 13:52:07,593] Trial 2440 finished with value: 0.34940830488459995 and parameters: {'n_estimators': 1395, 'learning_rate': 0.027841692369403686, 'max_depth': 9, 'min_samples_split': 5, 'min_samples_leaf': 1, 'subsample': 0.76168940222218, 'max_features': None}. Best is trial 2314 with value: 0.22206050798261862.
[I 2024-12-04 13:52:12,996] Trial 2446 finished with value: 0.28918017897772674 and parameters: {'n_estimators': 1384, 'learning_rate': 0.09830882464867365, 'max_depth': 9, 'min_samples_split': 4, 'min_samples_leaf': 2, 'subsample': 0.7677386936717933, 'max_features': 'sqrt'}. Best is trial 2314 with value: 0.22206050798261862.
[I 2024-12-04 13:52:14,131] Trial 2447 finished with value: 0.24478456241102373 and parameters: {'n_estimators': 1386, 'learning_rate': 0.09715572788502719, 'max_depth': 4, 'min_samples_split': 3, 'min_samples_leaf': 1, 'subsample': 0.6956123169928734, 'max_features': 'sqrt'}. Best is trial 2314 with value: 0.22206050798261862.
[I 2024-12-04 13:52:15,692] Trial 2456 finished with value: 0.590476540879178 and parameters: {'n_estimators': 1000, 'learning_rate': 0.016271743215964137, 'max_depth': 3, 'min_samples_split': 2, 'min_samples_leaf': 7, 'subsample': 0.6900616319655906, 'max_features': 'sqrt'}. Best is trial 2314 with value: 0.22206050798261862.
[I 2024-12-04 13:52:15,701] Trial 2445 finished with value: 0.289621243276 and parameters: {'n_estimators': 1455, 'learning_rate': 0.0838131389672766, 'max_depth': 11, 'min_samples_split': 8, 'min_samples_leaf': 2, 'subsample': 0.8529483690053765, 'max_features': 'sqrt'}. Best is trial 2314 with value: 0.22206050798261862.
[I 2024-12-04 13:52:18,261] Trial 2450 finished with value: 0.38952918857627816 and parameters: {'n_estimators': 1151, 'learning_rate': 0.09823239441281954, 'max_depth': 7, 'min_samples_split': 10, 'min_samples_leaf': 3, 'subsample': 0.6278102979422036, 'max_features': None}. Best is trial 2314 with value: 0.22206050798261862.
[I 2024-12-04 13:52:18,831] Trial 2451 finished with value: 0.3596656059314156 and parameters: {'n_estimators': 1231, 'learning_rate': 0.0959690026164061, 'max_depth': 8, 'min_samples_split': 8, 'min_samples_leaf': 3, 'subsample': 0.9420757092930675, 'max_features': 'sqrt'}. Best is trial 2314 with value: 0.22206050798261862.
[I 2024-12-04 13:52:19,317] Trial 2448 finished with value: 0.2595510457518479 and parameters: {'n_estimators': 1322, 'learning_rate': 0.07155038327037207, 'max_depth': 12, 'min_samples_split': 4, 'min_samples_leaf': 1, 'subsample': 0.823157085100045, 'max_features': 'sqrt'}. Best is trial 2314 with value: 0.22206050798261862.
[I 2024-12-04 13:52:28,779] Trial 2452 finished with value: 0.4354338794873156 and parameters: {'n_estimators': 1138, 'learning_rate': 0.024974139190050405, 'max_depth': 10, 'min_samples_split': 18, 'min_samples_leaf': 7, 'subsample': 0.6786625068469396, 'max_features': None}. Best is trial 2314 with value: 0.22206050798261862.
[I 2024-12-04 13:52:30,582] Trial 2449 finished with value: 0.3593099591155013 and parameters: {'n_estimators': 1469, 'learning_rate': 0.0740977234035001, 'max_depth': 7, 'min_samples_split': 2, 'min_samples_leaf': 3, 'subsample': 0.6634592891695921, 'max_features': 'sqrt'}. Best is trial 2314 with value: 0.22206050798261862.
[I 2024-12-04 13:52:31,104] Trial 2457 finished with value: 0.26424676714377965 and parameters: {'n_estimators': 1116, 'learning_rate': 0.09530439908844754, 'max_depth': 3, 'min_samples_split': 2, 'min_samples_leaf': 1, 'subsample': 0.7822095154220304, 'max_features': 'sqrt'}. Best is trial 2314 with value: 0.22206050798261862.
[I 2024-12-04 13:52:34,571] Trial 2469 finished with value: 0.29350724105541387 and parameters: {'n_estimators': 672, 'learning_rate': 0.08268979787577202, 'max_depth': 12, 'min_samples_split': 4, 'min_samples_leaf': 2, 'subsample': 0.6487741023564626, 'max_features': 'sqrt'}. Best is trial 2314 with value: 0.22206050798261862.
[I 2024-12-04 13:52:41,655] Trial 2460 finished with value: 0.25091887835904275 and parameters: {'n_estimators': 1216, 'learning_rate': 0.06644653640611506, 'max_depth': 12, 'min_samples_split': 7, 'min_samples_leaf': 1, 'subsample': 0.6711621787308177, 'max_features': 'sqrt'}. Best is trial 2314 with value: 0.22206050798261862.
[I 2024-12-04 13:52:43,766] Trial 2453 finished with value: 0.36101759515230414 and parameters: {'n_estimators': 1467, 'learning_rate': 0.03468014207494492, 'max_depth': 7, 'min_samples_split': 8, 'min_samples_leaf': 4, 'subsample': 0.6423645545175546, 'max_features': 'sqrt'}. Best is trial 2314 with value: 0.22206050798261862.
[I 2024-12-04 13:52:47,331] Trial 2461 finished with value: 0.3423321055837975 and parameters: {'n_estimators': 1289, 'learning_rate': 0.06120017127929012, 'max_depth': 9, 'min_samples_split': 3, 'min_samples_leaf': 3, 'subsample': 0.9245032996456992, 'max_features': 'sqrt'}. Best is trial 2314 with value: 0.22206050798261862.
[I 2024-12-04 13:52:50,015] Trial 2462 finished with value: 0.23784482221785422 and parameters: {'n_estimators': 1191, 'learning_rate': 0.05370783536977243, 'max_depth': 7, 'min_samples_split': 2, 'min_samples_leaf': 1, 'subsample': 0.6241163101993152, 'max_features': 'sqrt'}. Best is trial 2314 with value: 0.22206050798261862.
