[I 2024-12-04 12:12:40,078] Trial 1367 finished with value: 0.7043038063218594 and parameters: {'n_estimators': 153, 'max_depth': 35, 'min_samples_split': 2, 'min_samples_leaf': 2, 'max_features': 'log2', 'bootstrap': False, 'criterion': 'squared_error'}. Best is trial 341 with value: 0.2909369124469028.
[I 2024-12-04 12:12:41,229] Trial 1373 finished with value: 0.3006903775063591 and parameters: {'n_estimators': 297, 'max_depth': 43, 'min_samples_split': 3, 'min_samples_leaf': 1, 'max_features': 'sqrt', 'bootstrap': False, 'criterion': 'squared_error'}. Best is trial 341 with value: 0.2909369124469028.
[I 2024-12-04 12:12:42,260] Trial 1375 finished with value: 0.4421050733477117 and parameters: {'n_estimators': 223, 'max_depth': 50, 'min_samples_split': 2, 'min_samples_leaf': 2, 'max_features': 'sqrt', 'bootstrap': False, 'criterion': 'squared_error'}. Best is trial 341 with value: 0.2909369124469028.
[I 2024-12-04 12:12:43,978] Trial 1369 finished with value: 0.298622574932901 and parameters: {'n_estimators': 663, 'max_depth': 50, 'min_samples_split': 2, 'min_samples_leaf': 1, 'max_features': 'sqrt', 'bootstrap': False, 'criterion': 'squared_error'}. Best is trial 341 with value: 0.2909369124469028.
[I 2024-12-04 12:12:44,874] Trial 1370 finished with value: 0.9565262094809156 and parameters: {'n_estimators': 785, 'max_depth': 47, 'min_samples_split': 3, 'min_samples_leaf': 13, 'max_features': 'log2', 'bootstrap': False, 'criterion': 'squared_error'}. Best is trial 341 with value: 0.2909369124469028.
[I 2024-12-04 12:12:44,913] Trial 1377 finished with value: 0.8038000832382837 and parameters: {'n_estimators': 163, 'max_depth': 29, 'min_samples_split': 4, 'min_samples_leaf': 10, 'max_features': 'sqrt', 'bootstrap': False, 'criterion': 'squared_error'}. Best is trial 341 with value: 0.2909369124469028.
[I 2024-12-04 12:12:44,955] Trial 1371 finished with value: 0.2944764526526013 and parameters: {'n_estimators': 289, 'max_depth': 50, 'min_samples_split': 3, 'min_samples_leaf': 1, 'max_features': 'sqrt', 'bootstrap': False, 'criterion': 'squared_error'}. Best is trial 341 with value: 0.2909369124469028.
[I 2024-12-04 12:12:45,225] Trial 1358 finished with value: 0.31271998156883646 and parameters: {'n_estimators': 226, 'max_depth': 49, 'min_samples_split': 4, 'min_samples_leaf': 1, 'max_features': 'sqrt', 'bootstrap': False, 'criterion': 'absolute_error'}. Best is trial 341 with value: 0.2909369124469028.
[I 2024-12-04 12:12:46,902] Trial 1372 finished with value: 0.394975879255527 and parameters: {'n_estimators': 568, 'max_depth': 50, 'min_samples_split': 7, 'min_samples_leaf': 1, 'max_features': None, 'bootstrap': False, 'criterion': 'squared_error'}. Best is trial 341 with value: 0.2909369124469028.
[I 2024-12-04 12:12:47,838] Trial 1386 finished with value: 0.4453241061508117 and parameters: {'n_estimators': 267, 'max_depth': 44, 'min_samples_split': 4, 'min_samples_leaf': 2, 'max_features': 'sqrt', 'bootstrap': False, 'criterion': 'squared_error'}. Best is trial 341 with value: 0.2909369124469028.
[I 2024-12-04 12:12:48,151] Trial 1374 finished with value: 0.938539741223346 and parameters: {'n_estimators': 442, 'max_depth': 19, 'min_samples_split': 19, 'min_samples_leaf': 8, 'max_features': 'log2', 'bootstrap': False, 'criterion': 'absolute_error'}. Best is trial 341 with value: 0.2909369124469028.
[I 2024-12-04 12:12:48,307] Trial 1376 finished with value: 0.9079607985068494 and parameters: {'n_estimators': 493, 'max_depth': 31, 'min_samples_split': 9, 'min_samples_leaf': 4, 'max_features': 'log2', 'bootstrap': True, 'criterion': 'squared_error'}. Best is trial 341 with value: 0.2909369124469028.
[I 2024-12-04 12:12:48,934] Trial 1379 finished with value: 0.3001021486003179 and parameters: {'n_estimators': 340, 'max_depth': 50, 'min_samples_split': 4, 'min_samples_leaf': 1, 'max_features': 'sqrt', 'bootstrap': False, 'criterion': 'squared_error'}. Best is trial 341 with value: 0.2909369124469028.
[I 2024-12-04 12:12:49,965] Trial 1362 finished with value: 0.393603411588398 and parameters: {'n_estimators': 820, 'max_depth': 22, 'min_samples_split': 39, 'min_samples_leaf': 1, 'max_features': None, 'bootstrap': True, 'criterion': 'squared_error'}. Best is trial 341 with value: 0.2909369124469028.
[I 2024-12-04 12:12:50,036] Trial 1382 finished with value: 0.30378407196122914 and parameters: {'n_estimators': 299, 'max_depth': 50, 'min_samples_split': 5, 'min_samples_leaf': 1, 'max_features': 'sqrt', 'bootstrap': False, 'criterion': 'squared_error'}. Best is trial 341 with value: 0.2909369124469028.
[I 2024-12-04 12:12:50,542] Trial 1378 finished with value: 0.3057839473134726 and parameters: {'n_estimators': 267, 'max_depth': 43, 'min_samples_split': 2, 'min_samples_leaf': 1, 'max_features': 'sqrt', 'bootstrap': False, 'criterion': 'squared_error'}. Best is trial 341 with value: 0.2909369124469028.
[I 2024-12-04 12:12:51,534] Trial 1388 finished with value: 0.3022458375182393 and parameters: {'n_estimators': 108, 'max_depth': 50, 'min_samples_split': 4, 'min_samples_leaf': 1, 'max_features': 'sqrt', 'bootstrap': False, 'criterion': 'squared_error'}. Best is trial 341 with value: 0.2909369124469028.
[I 2024-12-04 12:12:53,710] Trial 1384 finished with value: 0.29873973327474435 and parameters: {'n_estimators': 283, 'max_depth': 50, 'min_samples_split': 2, 'min_samples_leaf': 1, 'max_features': 'sqrt', 'bootstrap': False, 'criterion': 'squared_error'}. Best is trial 341 with value: 0.2909369124469028.
[I 2024-12-04 12:12:53,711] Trial 1381 finished with value: 0.3079787282896873 and parameters: {'n_estimators': 254, 'max_depth': 50, 'min_samples_split': 6, 'min_samples_leaf': 1, 'max_features': 'sqrt', 'bootstrap': False, 'criterion': 'squared_error'}. Best is trial 341 with value: 0.2909369124469028.
[I 2024-12-04 12:12:53,713] Trial 1385 finished with value: 0.34086572644819696 and parameters: {'n_estimators': 425, 'max_depth': 36, 'min_samples_split': 2, 'min_samples_leaf': 1, 'max_features': 'sqrt', 'bootstrap': True, 'criterion': 'squared_error'}. Best is trial 341 with value: 0.2909369124469028.
[I 2024-12-04 12:12:54,332] Trial 1389 finished with value: 0.2988679421445903 and parameters: {'n_estimators': 231, 'max_depth': 45, 'min_samples_split': 3, 'min_samples_leaf': 1, 'max_features': 'sqrt', 'bootstrap': False, 'criterion': 'squared_error'}. Best is trial 341 with value: 0.2909369124469028.
[I 2024-12-04 12:12:55,227] Trial 1390 finished with value: 0.3181271703099343 and parameters: {'n_estimators': 449, 'max_depth': 39, 'min_samples_split': 2, 'min_samples_leaf': 1, 'max_features': 'sqrt', 'bootstrap': False, 'criterion': 'squared_error'}. Best is trial 341 with value: 0.2909369124469028.
[I 2024-12-04 12:12:55,575] Trial 1387 finished with value: 0.7040702404808624 and parameters: {'n_estimators': 149, 'max_depth': 47, 'min_samples_split': 4, 'min_samples_leaf': 2, 'max_features': 'log2', 'bootstrap': False, 'criterion': 'squared_error'}. Best is trial 341 with value: 0.2909369124469028.
[I 2024-12-04 12:12:56,685] Trial 1392 finished with value: 0.6637180607155606 and parameters: {'n_estimators': 573, 'max_depth': 47, 'min_samples_split': 47, 'min_samples_leaf': 6, 'max_features': 'sqrt', 'bootstrap': False, 'criterion': 'squared_error'}. Best is trial 341 with value: 0.2909369124469028.
[I 2024-12-04 12:12:59,103] Trial 1363 finished with value: 0.40904640760718464 and parameters: {'n_estimators': 396, 'max_depth': 44, 'min_samples_split': 2, 'min_samples_leaf': 1, 'max_features': 'log2', 'bootstrap': False, 'criterion': 'absolute_error'}. Best is trial 341 with value: 0.2909369124469028.
[I 2024-12-04 12:12:59,832] Trial 1380 finished with value: 0.8585776241727447 and parameters: {'n_estimators': 318, 'max_depth': 50, 'min_samples_split': 2, 'min_samples_leaf': 9, 'max_features': 'sqrt', 'bootstrap': True, 'criterion': 'absolute_error'}. Best is trial 341 with value: 0.2909369124469028.
[I 2024-12-04 12:13:00,654] Trial 1393 finished with value: 0.48447195014878114 and parameters: {'n_estimators': 441, 'max_depth': 8, 'min_samples_split': 8, 'min_samples_leaf': 9, 'max_features': None, 'bootstrap': True, 'criterion': 'squared_error'}. Best is trial 341 with value: 0.2909369124469028.
[I 2024-12-04 12:13:00,945] Trial 1391 finished with value: 0.3130338880877298 and parameters: {'n_estimators': 605, 'max_depth': 41, 'min_samples_split': 4, 'min_samples_leaf': 1, 'max_features': 'sqrt', 'bootstrap': False, 'criterion': 'squared_error'}. Best is trial 341 with value: 0.2909369124469028.
[I 2024-12-04 12:13:01,611] Trial 1395 finished with value: 0.37686309290239867 and parameters: {'n_estimators': 570, 'max_depth': 46, 'min_samples_split': 14, 'min_samples_leaf': 1, 'max_features': 'sqrt', 'bootstrap': True, 'criterion': 'squared_error'}. Best is trial 341 with value: 0.2909369124469028.
[I 2024-12-04 12:13:02,000] Trial 1356 finished with value: 0.4569066695456321 and parameters: {'n_estimators': 844, 'max_depth': 13, 'min_samples_split': 8, 'min_samples_leaf': 7, 'max_features': None, 'bootstrap': True, 'criterion': 'absolute_error'}. Best is trial 341 with value: 0.2909369124469028.
[I 2024-12-04 12:13:03,584] Trial 1400 finished with value: 0.6746058834297348 and parameters: {'n_estimators': 953, 'max_depth': 9, 'min_samples_split': 4, 'min_samples_leaf': 1, 'max_features': 'sqrt', 'bootstrap': False, 'criterion': 'squared_error'}. Best is trial 341 with value: 0.2909369124469028.
[I 2024-12-04 12:13:04,359] Trial 1404 finished with value: 0.29860854835461664 and parameters: {'n_estimators': 106, 'max_depth': 50, 'min_samples_split': 2, 'min_samples_leaf': 1, 'max_features': 'sqrt', 'bootstrap': False, 'criterion': 'squared_error'}. Best is trial 341 with value: 0.2909369124469028.
[I 2024-12-04 12:13:04,558] Trial 1399 finished with value: 0.44391205747018014 and parameters: {'n_estimators': 101, 'max_depth': 50, 'min_samples_split': 4, 'min_samples_leaf': 2, 'max_features': 'sqrt', 'bootstrap': False, 'criterion': 'squared_error'}. Best is trial 341 with value: 0.2909369124469028.
[I 2024-12-04 12:13:05,108] Trial 1402 finished with value: 0.4027287421726848 and parameters: {'n_estimators': 286, 'max_depth': 13, 'min_samples_split': 31, 'min_samples_leaf': 1, 'max_features': None, 'bootstrap': True, 'criterion': 'squared_error'}. Best is trial 341 with value: 0.2909369124469028.
[I 2024-12-04 12:13:05,166] Trial 1407 finished with value: 0.444690222744964 and parameters: {'n_estimators': 392, 'max_depth': 39, 'min_samples_split': 3, 'min_samples_leaf': 2, 'max_features': 'sqrt', 'bootstrap': False, 'criterion': 'squared_error'}. Best is trial 341 with value: 0.2909369124469028.
[I 2024-12-04 12:13:06,291] Trial 1394 finished with value: 0.8379865224103732 and parameters: {'n_estimators': 792, 'max_depth': 8, 'min_samples_split': 2, 'min_samples_leaf': 8, 'max_features': 'sqrt', 'bootstrap': True, 'criterion': 'squared_error'}. Best is trial 341 with value: 0.2909369124469028.
[I 2024-12-04 12:13:06,631] Trial 1396 finished with value: 0.9638509353919206 and parameters: {'n_estimators': 857, 'max_depth': 23, 'min_samples_split': 2, 'min_samples_leaf': 11, 'max_features': 'log2', 'bootstrap': True, 'criterion': 'squared_error'}. Best is trial 341 with value: 0.2909369124469028.
[I 2024-12-04 12:13:08,259] Trial 1406 finished with value: 0.3048227495331228 and parameters: {'n_estimators': 253, 'max_depth': 44, 'min_samples_split': 2, 'min_samples_leaf': 1, 'max_features': 'sqrt', 'bootstrap': False, 'criterion': 'squared_error'}. Best is trial 341 with value: 0.2909369124469028.
[I 2024-12-04 12:13:09,078] Trial 1403 finished with value: 0.693025277568737 and parameters: {'n_estimators': 319, 'max_depth': 50, 'min_samples_split': 2, 'min_samples_leaf': 2, 'max_features': 'log2', 'bootstrap': False, 'criterion': 'squared_error'}. Best is trial 341 with value: 0.2909369124469028.
[I 2024-12-04 12:13:09,690] Trial 1401 finished with value: 0.8449520372913161 and parameters: {'n_estimators': 911, 'max_depth': 24, 'min_samples_split': 6, 'min_samples_leaf': 13, 'max_features': 'sqrt', 'bootstrap': False, 'criterion': 'absolute_error'}. Best is trial 341 with value: 0.2909369124469028.
[I 2024-12-04 12:13:10,026] Trial 1408 finished with value: 0.715088543253973 and parameters: {'n_estimators': 235, 'max_depth': 49, 'min_samples_split': 2, 'min_samples_leaf': 7, 'max_features': 'sqrt', 'bootstrap': False, 'criterion': 'squared_error'}. Best is trial 341 with value: 0.2909369124469028.
[I 2024-12-04 12:13:10,115] Trial 1410 finished with value: 0.4448067355554919 and parameters: {'n_estimators': 253, 'max_depth': 44, 'min_samples_split': 2, 'min_samples_leaf': 2, 'max_features': 'sqrt', 'bootstrap': False, 'criterion': 'squared_error'}. Best is trial 341 with value: 0.2909369124469028.
[I 2024-12-04 12:13:10,188] Trial 1405 finished with value: 0.4381652051968894 and parameters: {'n_estimators': 441, 'max_depth': 49, 'min_samples_split': 6, 'min_samples_leaf': 2, 'max_features': 'sqrt', 'bootstrap': False, 'criterion': 'squared_error'}. Best is trial 341 with value: 0.2909369124469028.
[I 2024-12-04 12:13:10,408] Trial 1397 finished with value: 0.6705715333062456 and parameters: {'n_estimators': 670, 'max_depth': 18, 'min_samples_split': 5, 'min_samples_leaf': 1, 'max_features': 'log2', 'bootstrap': True, 'criterion': 'absolute_error'}. Best is trial 341 with value: 0.2909369124469028.
[I 2024-12-04 12:13:10,477] Trial 1409 finished with value: 0.3424321303937762 and parameters: {'n_estimators': 210, 'max_depth': 50, 'min_samples_split': 8, 'min_samples_leaf': 1, 'max_features': 'sqrt', 'bootstrap': True, 'criterion': 'squared_error'}. Best is trial 341 with value: 0.2909369124469028.
[I 2024-12-04 12:13:12,406] Trial 1413 finished with value: 0.3187241812101235 and parameters: {'n_estimators': 415, 'max_depth': 39, 'min_samples_split': 4, 'min_samples_leaf': 1, 'max_features': 'sqrt', 'bootstrap': False, 'criterion': 'squared_error'}. Best is trial 341 with value: 0.2909369124469028.
[I 2024-12-04 12:13:13,062] Trial 1411 finished with value: 0.42001270633499604 and parameters: {'n_estimators': 233, 'max_depth': 50, 'min_samples_split': 24, 'min_samples_leaf': 3, 'max_features': None, 'bootstrap': False, 'criterion': 'squared_error'}. Best is trial 341 with value: 0.2909369124469028.
[I 2024-12-04 12:13:13,976] Trial 1422 finished with value: 0.4422001446696889 and parameters: {'n_estimators': 105, 'max_depth': 50, 'min_samples_split': 2, 'min_samples_leaf': 2, 'max_features': 'sqrt', 'bootstrap': False, 'criterion': 'squared_error'}. Best is trial 341 with value: 0.2909369124469028.
[I 2024-12-04 12:13:14,677] Trial 1417 finished with value: 0.9482973609250925 and parameters: {'n_estimators': 233, 'max_depth': 8, 'min_samples_split': 12, 'min_samples_leaf': 10, 'max_features': 'log2', 'bootstrap': False, 'criterion': 'squared_error'}. Best is trial 341 with value: 0.2909369124469028.
[I 2024-12-04 12:13:14,745] Trial 1415 finished with value: 0.4684495937888419 and parameters: {'n_estimators': 105, 'max_depth': 39, 'min_samples_split': 3, 'min_samples_leaf': 2, 'max_features': 'sqrt', 'bootstrap': False, 'criterion': 'absolute_error'}. Best is trial 341 with value: 0.2909369124469028.
[I 2024-12-04 12:13:15,515] Trial 1423 finished with value: 0.31290652071498765 and parameters: {'n_estimators': 296, 'max_depth': 41, 'min_samples_split': 4, 'min_samples_leaf': 1, 'max_features': 'sqrt', 'bootstrap': False, 'criterion': 'squared_error'}. Best is trial 341 with value: 0.2909369124469028.
[I 2024-12-04 12:13:16,864] Trial 1424 finished with value: 0.7899214594694713 and parameters: {'n_estimators': 142, 'max_depth': 37, 'min_samples_split': 11, 'min_samples_leaf': 2, 'max_features': 'log2', 'bootstrap': True, 'criterion': 'absolute_error'}. Best is trial 341 with value: 0.2909369124469028.
[I 2024-12-04 12:13:17,054] Trial 1354 finished with value: 0.4527256935324373 and parameters: {'n_estimators': 972, 'max_depth': 26, 'min_samples_split': 45, 'min_samples_leaf': 5, 'max_features': None, 'bootstrap': True, 'criterion': 'absolute_error'}. Best is trial 341 with value: 0.2909369124469028.
[I 2024-12-04 12:13:20,069] Trial 1420 finished with value: 0.29926715305281953 and parameters: {'n_estimators': 293, 'max_depth': 50, 'min_samples_split': 4, 'min_samples_leaf': 1, 'max_features': 'sqrt', 'bootstrap': False, 'criterion': 'squared_error'}. Best is trial 341 with value: 0.2909369124469028.
[I 2024-12-04 12:13:20,547] Trial 1383 finished with value: 0.38180700477306745 and parameters: {'n_estimators': 399, 'max_depth': 41, 'min_samples_split': 6, 'min_samples_leaf': 3, 'max_features': None, 'bootstrap': True, 'criterion': 'absolute_error'}. Best is trial 341 with value: 0.2909369124469028.
[I 2024-12-04 12:13:20,553] Trial 1425 finished with value: 0.29375640261188246 and parameters: {'n_estimators': 472, 'max_depth': 50, 'min_samples_split': 3, 'min_samples_leaf': 1, 'max_features': 'sqrt', 'bootstrap': False, 'criterion': 'squared_error'}. Best is trial 341 with value: 0.2909369124469028.
[I 2024-12-04 12:13:20,681] Trial 1416 finished with value: 0.3794601097162776 and parameters: {'n_estimators': 433, 'max_depth': 35, 'min_samples_split': 3, 'min_samples_leaf': 1, 'max_features': None, 'bootstrap': False, 'criterion': 'squared_error'}. Best is trial 341 with value: 0.2909369124469028.
[I 2024-12-04 12:13:21,068] Trial 1431 finished with value: 0.29527161598233126 and parameters: {'n_estimators': 245, 'max_depth': 50, 'min_samples_split': 3, 'min_samples_leaf': 1, 'max_features': 'sqrt', 'bootstrap': False, 'criterion': 'squared_error'}. Best is trial 341 with value: 0.2909369124469028.
[I 2024-12-04 12:13:21,997] Trial 1419 finished with value: 0.3237893353147071 and parameters: {'n_estimators': 209, 'max_depth': 41, 'min_samples_split': 6, 'min_samples_leaf': 1, 'max_features': 'sqrt', 'bootstrap': False, 'criterion': 'squared_error'}. Best is trial 341 with value: 0.2909369124469028.
[I 2024-12-04 12:13:22,511] Trial 1426 finished with value: 0.3110478141499168 and parameters: {'n_estimators': 104, 'max_depth': 40, 'min_samples_split': 2, 'min_samples_leaf': 1, 'max_features': 'sqrt', 'bootstrap': False, 'criterion': 'squared_error'}. Best is trial 341 with value: 0.2909369124469028.
[I 2024-12-04 12:13:24,043] Trial 1421 finished with value: 0.36872077606337283 and parameters: {'n_estimators': 232, 'max_depth': 31, 'min_samples_split': 8, 'min_samples_leaf': 1, 'max_features': 'sqrt', 'bootstrap': False, 'criterion': 'squared_error'}. Best is trial 341 with value: 0.2909369124469028.
[I 2024-12-04 12:13:24,776] Trial 1414 finished with value: 0.29898927694525324 and parameters: {'n_estimators': 676, 'max_depth': 50, 'min_samples_split': 2, 'min_samples_leaf': 1, 'max_features': 'sqrt', 'bootstrap': False, 'criterion': 'squared_error'}. Best is trial 341 with value: 0.2909369124469028.
[I 2024-12-04 12:13:25,562] Trial 1435 finished with value: 0.3030513793448828 and parameters: {'n_estimators': 306, 'max_depth': 42, 'min_samples_split': 3, 'min_samples_leaf': 1, 'max_features': 'sqrt', 'bootstrap': False, 'criterion': 'squared_error'}. Best is trial 341 with value: 0.2909369124469028.
[I 2024-12-04 12:13:25,585] Trial 1418 finished with value: 0.4519477882271808 and parameters: {'n_estimators': 599, 'max_depth': 14, 'min_samples_split': 2, 'min_samples_leaf': 7, 'max_features': None, 'bootstrap': True, 'criterion': 'squared_error'}. Best is trial 341 with value: 0.2909369124469028.
[I 2024-12-04 12:13:25,683] Trial 1427 finished with value: 0.2942006870082492 and parameters: {'n_estimators': 415, 'max_depth': 50, 'min_samples_split': 3, 'min_samples_leaf': 1, 'max_features': 'sqrt', 'bootstrap': False, 'criterion': 'squared_error'}. Best is trial 341 with value: 0.2909369124469028.
[I 2024-12-04 12:13:26,300] Trial 1434 finished with value: 0.30003153274198474 and parameters: {'n_estimators': 281, 'max_depth': 44, 'min_samples_split': 3, 'min_samples_leaf': 1, 'max_features': 'sqrt', 'bootstrap': False, 'criterion': 'squared_error'}. Best is trial 341 with value: 0.2909369124469028.
[I 2024-12-04 12:13:26,302] Trial 1436 finished with value: 0.3007815636990655 and parameters: {'n_estimators': 121, 'max_depth': 42, 'min_samples_split': 3, 'min_samples_leaf': 1, 'max_features': 'sqrt', 'bootstrap': False, 'criterion': 'squared_error'}. Best is trial 341 with value: 0.2909369124469028.
[I 2024-12-04 12:13:26,353] Trial 1432 finished with value: 0.7024890748508545 and parameters: {'n_estimators': 901, 'max_depth': 8, 'min_samples_split': 17, 'min_samples_leaf': 1, 'max_features': 'sqrt', 'bootstrap': False, 'criterion': 'squared_error'}. Best is trial 341 with value: 0.2909369124469028.
[I 2024-12-04 12:13:27,057] Trial 1398 finished with value: 0.31668187408978615 and parameters: {'n_estimators': 548, 'max_depth': 49, 'min_samples_split': 5, 'min_samples_leaf': 1, 'max_features': 'sqrt', 'bootstrap': False, 'criterion': 'absolute_error'}. Best is trial 341 with value: 0.2909369124469028.
[I 2024-12-04 12:13:27,577] Trial 1437 finished with value: 0.44101931113167114 and parameters: {'n_estimators': 368, 'max_depth': 50, 'min_samples_split': 2, 'min_samples_leaf': 2, 'max_features': 'sqrt', 'bootstrap': False, 'criterion': 'squared_error'}. Best is trial 341 with value: 0.2909369124469028.
[I 2024-12-04 12:13:27,875] Trial 1430 finished with value: 0.3085242851723732 and parameters: {'n_estimators': 645, 'max_depth': 40, 'min_samples_split': 3, 'min_samples_leaf': 1, 'max_features': 'sqrt', 'bootstrap': False, 'criterion': 'squared_error'}. Best is trial 341 with value: 0.2909369124469028.
