[I 2024-12-04 12:16:20,136] Trial 50 finished with value: 0.3984900424111211 and parameters: {'n_estimators': 1272, 'learning_rate': 0.028434939220165673, 'max_depth': 6, 'min_samples_split': 16, 'min_samples_leaf': 3, 'subsample': 0.9647863613574531, 'max_features': None}. Best is trial 62 with value: 0.35179215659504387.
[I 2024-12-04 12:16:20,459] Trial 66 finished with value: 0.3827450220889598 and parameters: {'n_estimators': 162, 'learning_rate': 0.05007038806706547, 'max_depth': 12, 'min_samples_split': 17, 'min_samples_leaf': 4, 'subsample': 0.8905161862490868, 'max_features': None}. Best is trial 62 with value: 0.35179215659504387.
[I 2024-12-04 12:16:20,945] Trial 63 finished with value: 0.3823247242268621 and parameters: {'n_estimators': 722, 'learning_rate': 0.08514248044444551, 'max_depth': 9, 'min_samples_split': 8, 'min_samples_leaf': 1, 'subsample': 0.9863269202235937, 'max_features': 'log2'}. Best is trial 62 with value: 0.35179215659504387.
[I 2024-12-04 12:16:21,523] Trial 76 finished with value: 0.5764584321566658 and parameters: {'n_estimators': 382, 'learning_rate': 0.09012465709713008, 'max_depth': 10, 'min_samples_split': 15, 'min_samples_leaf': 5, 'subsample': 0.6118495224397569, 'max_features': 'log2'}. Best is trial 62 with value: 0.35179215659504387.
[I 2024-12-04 12:16:21,903] Trial 73 finished with value: 0.40473700799686685 and parameters: {'n_estimators': 301, 'learning_rate': 0.05611047247004506, 'max_depth': 12, 'min_samples_split': 14, 'min_samples_leaf': 6, 'subsample': 0.9110344215153867, 'max_features': None}. Best is trial 62 with value: 0.35179215659504387.
[I 2024-12-04 12:16:22,461] Trial 68 finished with value: 0.39379634080675757 and parameters: {'n_estimators': 1020, 'learning_rate': 0.0817383181900903, 'max_depth': 12, 'min_samples_split': 16, 'min_samples_leaf': 1, 'subsample': 0.9925259192518068, 'max_features': 'log2'}. Best is trial 62 with value: 0.35179215659504387.
[I 2024-12-04 12:16:22,755] Trial 78 finished with value: 0.4179440271271104 and parameters: {'n_estimators': 259, 'learning_rate': 0.03631218785910302, 'max_depth': 12, 'min_samples_split': 11, 'min_samples_leaf': 1, 'subsample': 0.9962654848719845, 'max_features': 'sqrt'}. Best is trial 62 with value: 0.35179215659504387.
[I 2024-12-04 12:16:23,511] Trial 64 finished with value: 0.4149841830715305 and parameters: {'n_estimators': 1021, 'learning_rate': 0.02223610975881528, 'max_depth': 6, 'min_samples_split': 9, 'min_samples_leaf': 7, 'subsample': 0.7615166601790909, 'max_features': None}. Best is trial 62 with value: 0.35179215659504387.
[I 2024-12-04 12:16:23,734] Trial 72 finished with value: 0.37137557566484236 and parameters: {'n_estimators': 530, 'learning_rate': 0.045479218951126534, 'max_depth': 12, 'min_samples_split': 8, 'min_samples_leaf': 1, 'subsample': 0.9013799069900926, 'max_features': 'sqrt'}. Best is trial 62 with value: 0.35179215659504387.
[I 2024-12-04 12:16:26,864] Trial 81 finished with value: 0.3813088533123506 and parameters: {'n_estimators': 304, 'learning_rate': 0.09493884247290595, 'max_depth': 12, 'min_samples_split': 16, 'min_samples_leaf': 5, 'subsample': 0.7416773634320863, 'max_features': None}. Best is trial 62 with value: 0.35179215659504387.
[I 2024-12-04 12:16:27,118] Trial 77 finished with value: 0.3692865517673866 and parameters: {'n_estimators': 847, 'learning_rate': 0.04109275288195581, 'max_depth': 12, 'min_samples_split': 17, 'min_samples_leaf': 2, 'subsample': 0.9354427299614443, 'max_features': 'sqrt'}. Best is trial 62 with value: 0.35179215659504387.
[I 2024-12-04 12:16:27,317] Trial 82 finished with value: 0.4191017654039184 and parameters: {'n_estimators': 684, 'learning_rate': 0.047462664292012235, 'max_depth': 11, 'min_samples_split': 17, 'min_samples_leaf': 3, 'subsample': 0.9502908872723869, 'max_features': 'sqrt'}. Best is trial 62 with value: 0.35179215659504387.
[I 2024-12-04 12:16:28,301] Trial 84 finished with value: 0.36800490744781467 and parameters: {'n_estimators': 516, 'learning_rate': 0.06565878641680561, 'max_depth': 9, 'min_samples_split': 19, 'min_samples_leaf': 4, 'subsample': 0.6811497843950478, 'max_features': None}. Best is trial 62 with value: 0.35179215659504387.
[I 2024-12-04 12:16:31,528] Trial 90 finished with value: 0.3608698102271286 and parameters: {'n_estimators': 200, 'learning_rate': 0.09046642092150609, 'max_depth': 12, 'min_samples_split': 16, 'min_samples_leaf': 3, 'subsample': 0.6119961837377987, 'max_features': None}. Best is trial 75 with value: 0.3356123167576939.
[I 2024-12-04 12:16:31,532] Trial 85 finished with value: 0.38263511815572815 and parameters: {'n_estimators': 497, 'learning_rate': 0.09521876833263426, 'max_depth': 11, 'min_samples_split': 14, 'min_samples_leaf': 1, 'subsample': 0.9172429605189208, 'max_features': None}. Best is trial 75 with value: 0.3356123167576939.
[I 2024-12-04 12:16:31,913] Trial 71 finished with value: 0.40677457406833645 and parameters: {'n_estimators': 1074, 'learning_rate': 0.02252849333887998, 'max_depth': 4, 'min_samples_split': 15, 'min_samples_leaf': 4, 'subsample': 0.7966177528267875, 'max_features': None}. Best is trial 75 with value: 0.3356123167576939.
[I 2024-12-04 12:16:32,315] Trial 88 finished with value: 0.3569595468730023 and parameters: {'n_estimators': 351, 'learning_rate': 0.07397096067661595, 'max_depth': 11, 'min_samples_split': 20, 'min_samples_leaf': 2, 'subsample': 0.8711651312569516, 'max_features': None}. Best is trial 75 with value: 0.3356123167576939.
[I 2024-12-04 12:16:33,053] Trial 80 finished with value: 0.41713989511162636 and parameters: {'n_estimators': 813, 'learning_rate': 0.04638954546431512, 'max_depth': 10, 'min_samples_split': 12, 'min_samples_leaf': 4, 'subsample': 0.6407611040260551, 'max_features': 'sqrt'}. Best is trial 75 with value: 0.3356123167576939.
[I 2024-12-04 12:16:33,166] Trial 75 finished with value: 0.3356123167576939 and parameters: {'n_estimators': 964, 'learning_rate': 0.08060134483356175, 'max_depth': 11, 'min_samples_split': 12, 'min_samples_leaf': 2, 'subsample': 0.6683284224111057, 'max_features': None}. Best is trial 75 with value: 0.3356123167576939.
[I 2024-12-04 12:16:34,802] Trial 96 finished with value: 0.42178430896094976 and parameters: {'n_estimators': 460, 'learning_rate': 0.05456776388206126, 'max_depth': 12, 'min_samples_split': 3, 'min_samples_leaf': 1, 'subsample': 0.9060297684303393, 'max_features': 'sqrt'}. Best is trial 75 with value: 0.3356123167576939.
[I 2024-12-04 12:16:35,693] Trial 83 finished with value: 0.36510222161925676 and parameters: {'n_estimators': 832, 'learning_rate': 0.07797624623675448, 'max_depth': 12, 'min_samples_split': 20, 'min_samples_leaf': 4, 'subsample': 0.8898784805660939, 'max_features': None}. Best is trial 75 with value: 0.3356123167576939.
[I 2024-12-04 12:16:36,052] Trial 94 finished with value: 0.4253073819283496 and parameters: {'n_estimators': 181, 'learning_rate': 0.05731654911537841, 'max_depth': 6, 'min_samples_split': 17, 'min_samples_leaf': 3, 'subsample': 0.6750292017635012, 'max_features': None}. Best is trial 75 with value: 0.3356123167576939.
[I 2024-12-04 12:16:36,172] Trial 87 finished with value: 0.3628082930148218 and parameters: {'n_estimators': 533, 'learning_rate': 0.05396012186227906, 'max_depth': 12, 'min_samples_split': 18, 'min_samples_leaf': 4, 'subsample': 0.603086912462198, 'max_features': None}. Best is trial 75 with value: 0.3356123167576939.
[I 2024-12-04 12:16:36,257] Trial 95 finished with value: 0.3785548956079354 and parameters: {'n_estimators': 440, 'learning_rate': 0.08186995986325901, 'max_depth': 10, 'min_samples_split': 20, 'min_samples_leaf': 2, 'subsample': 0.696051056986172, 'max_features': 'sqrt'}. Best is trial 75 with value: 0.3356123167576939.
[I 2024-12-04 12:16:36,994] Trial 79 finished with value: 0.37009322094744745 and parameters: {'n_estimators': 830, 'learning_rate': 0.06430613507083795, 'max_depth': 9, 'min_samples_split': 18, 'min_samples_leaf': 1, 'subsample': 0.6360307034374053, 'max_features': None}. Best is trial 75 with value: 0.3356123167576939.
[I 2024-12-04 12:16:38,169] Trial 98 finished with value: 0.37368808561246797 and parameters: {'n_estimators': 366, 'learning_rate': 0.062283703772814794, 'max_depth': 8, 'min_samples_split': 18, 'min_samples_leaf': 4, 'subsample': 0.6611891811735694, 'max_features': None}. Best is trial 75 with value: 0.3356123167576939.
[I 2024-12-04 12:16:38,170] Trial 91 finished with value: 0.3643042329360875 and parameters: {'n_estimators': 635, 'learning_rate': 0.060927347288754395, 'max_depth': 12, 'min_samples_split': 5, 'min_samples_leaf': 1, 'subsample': 0.8447825453271344, 'max_features': 'sqrt'}. Best is trial 75 with value: 0.3356123167576939.
[I 2024-12-04 12:16:40,151] Trial 97 finished with value: 0.41236454635845937 and parameters: {'n_estimators': 531, 'learning_rate': 0.06562015489393891, 'max_depth': 12, 'min_samples_split': 19, 'min_samples_leaf': 2, 'subsample': 0.7431979860596882, 'max_features': 'log2'}. Best is trial 75 with value: 0.3356123167576939.
[I 2024-12-04 12:16:40,190] Trial 99 finished with value: 0.38335399446625873 and parameters: {'n_estimators': 399, 'learning_rate': 0.06131619720386186, 'max_depth': 9, 'min_samples_split': 20, 'min_samples_leaf': 3, 'subsample': 0.6253343524516536, 'max_features': None}. Best is trial 75 with value: 0.3356123167576939.
[I 2024-12-04 12:16:40,677] Trial 102 finished with value: 0.4791317661374603 and parameters: {'n_estimators': 569, 'learning_rate': 0.0593509704793571, 'max_depth': 12, 'min_samples_split': 15, 'min_samples_leaf': 3, 'subsample': 0.7330583666129797, 'max_features': 'log2'}. Best is trial 75 with value: 0.3356123167576939.
[I 2024-12-04 12:16:40,918] Trial 89 finished with value: 0.38096246962588753 and parameters: {'n_estimators': 851, 'learning_rate': 0.037346272252883804, 'max_depth': 11, 'min_samples_split': 20, 'min_samples_leaf': 2, 'subsample': 0.8511568749379135, 'max_features': 'sqrt'}. Best is trial 75 with value: 0.3356123167576939.
[I 2024-12-04 12:16:41,419] Trial 86 finished with value: 0.35997724138406023 and parameters: {'n_estimators': 892, 'learning_rate': 0.09476097581567855, 'max_depth': 10, 'min_samples_split': 20, 'min_samples_leaf': 4, 'subsample': 0.6075914584207619, 'max_features': None}. Best is trial 75 with value: 0.3356123167576939.
[I 2024-12-04 12:16:42,052] Trial 93 finished with value: 0.39897924348440655 and parameters: {'n_estimators': 1150, 'learning_rate': 0.052554563656305675, 'max_depth': 12, 'min_samples_split': 12, 'min_samples_leaf': 4, 'subsample': 0.8633521721823094, 'max_features': 'sqrt'}. Best is trial 75 with value: 0.3356123167576939.
[I 2024-12-04 12:16:42,295] Trial 109 finished with value: 0.3995055094097113 and parameters: {'n_estimators': 311, 'learning_rate': 0.07016986884613315, 'max_depth': 12, 'min_samples_split': 14, 'min_samples_leaf': 2, 'subsample': 0.6341358962547767, 'max_features': 'sqrt'}. Best is trial 75 with value: 0.3356123167576939.
[I 2024-12-04 12:16:43,088] Trial 92 finished with value: 0.37072648849982015 and parameters: {'n_estimators': 322, 'learning_rate': 0.061958231531745435, 'max_depth': 9, 'min_samples_split': 20, 'min_samples_leaf': 2, 'subsample': 0.8974754232428699, 'max_features': None}. Best is trial 75 with value: 0.3356123167576939.
[I 2024-12-04 12:16:43,399] Trial 104 finished with value: 0.3600089550911249 and parameters: {'n_estimators': 217, 'learning_rate': 0.08843149973639629, 'max_depth': 11, 'min_samples_split': 16, 'min_samples_leaf': 3, 'subsample': 0.648165343030243, 'max_features': None}. Best is trial 75 with value: 0.3356123167576939.
[I 2024-12-04 12:16:44,531] Trial 107 finished with value: 0.37592779886076844 and parameters: {'n_estimators': 578, 'learning_rate': 0.053669212843489515, 'max_depth': 11, 'min_samples_split': 17, 'min_samples_leaf': 5, 'subsample': 0.6254658720597657, 'max_features': None}. Best is trial 75 with value: 0.3356123167576939.
[I 2024-12-04 12:16:45,428] Trial 101 finished with value: 0.36238776154171476 and parameters: {'n_estimators': 444, 'learning_rate': 0.09618423067246964, 'max_depth': 12, 'min_samples_split': 18, 'min_samples_leaf': 4, 'subsample': 0.6148075238355449, 'max_features': None}. Best is trial 75 with value: 0.3356123167576939.
[I 2024-12-04 12:16:45,431] Trial 111 finished with value: 0.36893512209697216 and parameters: {'n_estimators': 148, 'learning_rate': 0.08934641118576596, 'max_depth': 10, 'min_samples_split': 20, 'min_samples_leaf': 2, 'subsample': 0.82467337797748, 'max_features': None}. Best is trial 75 with value: 0.3356123167576939.
[I 2024-12-04 12:16:46,243] Trial 103 finished with value: 0.39113094643873 and parameters: {'n_estimators': 650, 'learning_rate': 0.07451864710104622, 'max_depth': 10, 'min_samples_split': 20, 'min_samples_leaf': 1, 'subsample': 0.8081658014241164, 'max_features': None}. Best is trial 75 with value: 0.3356123167576939.
[I 2024-12-04 12:16:48,352] Trial 115 finished with value: 0.38190045955151086 and parameters: {'n_estimators': 247, 'learning_rate': 0.05383154597143749, 'max_depth': 10, 'min_samples_split': 13, 'min_samples_leaf': 4, 'subsample': 0.612032875244765, 'max_features': None}. Best is trial 75 with value: 0.3356123167576939.
[I 2024-12-04 12:16:48,392] Trial 106 finished with value: 0.3673558117038452 and parameters: {'n_estimators': 1078, 'learning_rate': 0.07072088969729884, 'max_depth': 11, 'min_samples_split': 11, 'min_samples_leaf': 3, 'subsample': 0.6692087071570354, 'max_features': None}. Best is trial 75 with value: 0.3356123167576939.
[I 2024-12-04 12:16:49,990] Trial 114 finished with value: 0.3787476108584703 and parameters: {'n_estimators': 735, 'learning_rate': 0.0691743747222703, 'max_depth': 11, 'min_samples_split': 4, 'min_samples_leaf': 2, 'subsample': 0.7430030081841223, 'max_features': 'sqrt'}. Best is trial 75 with value: 0.3356123167576939.
[I 2024-12-04 12:16:50,724] Trial 108 finished with value: 0.37392638043115334 and parameters: {'n_estimators': 649, 'learning_rate': 0.07234140223161563, 'max_depth': 12, 'min_samples_split': 19, 'min_samples_leaf': 3, 'subsample': 0.9313839064194364, 'max_features': None}. Best is trial 75 with value: 0.3356123167576939.
[I 2024-12-04 12:16:51,081] Trial 105 finished with value: 0.4062138123301933 and parameters: {'n_estimators': 891, 'learning_rate': 0.05286519799483876, 'max_depth': 11, 'min_samples_split': 19, 'min_samples_leaf': 7, 'subsample': 0.8663167129002315, 'max_features': None}. Best is trial 75 with value: 0.3356123167576939.
[I 2024-12-04 12:16:51,083] Trial 124 finished with value: 0.3828115166002347 and parameters: {'n_estimators': 126, 'learning_rate': 0.09327779817377625, 'max_depth': 11, 'min_samples_split': 17, 'min_samples_leaf': 3, 'subsample': 0.6303686887386796, 'max_features': None}. Best is trial 75 with value: 0.3356123167576939.
[I 2024-12-04 12:16:51,885] Trial 121 finished with value: 0.3464686311346884 and parameters: {'n_estimators': 308, 'learning_rate': 0.06766551485210658, 'max_depth': 12, 'min_samples_split': 7, 'min_samples_leaf': 2, 'subsample': 0.7280721579786894, 'max_features': None}. Best is trial 75 with value: 0.3356123167576939.
[I 2024-12-04 12:16:51,888] Trial 100 finished with value: 0.3744712026980904 and parameters: {'n_estimators': 1011, 'learning_rate': 0.053099707302863466, 'max_depth': 11, 'min_samples_split': 18, 'min_samples_leaf': 5, 'subsample': 0.8902995340128457, 'max_features': None}. Best is trial 75 with value: 0.3356123167576939.
[I 2024-12-04 12:16:53,470] Trial 123 finished with value: 0.37574506368786553 and parameters: {'n_estimators': 263, 'learning_rate': 0.0933248384774828, 'max_depth': 12, 'min_samples_split': 17, 'min_samples_leaf': 1, 'subsample': 0.6182939488392193, 'max_features': None}. Best is trial 75 with value: 0.3356123167576939.
[I 2024-12-04 12:16:54,671] Trial 120 finished with value: 0.38439521054635695 and parameters: {'n_estimators': 288, 'learning_rate': 0.09519342018448045, 'max_depth': 9, 'min_samples_split': 12, 'min_samples_leaf': 3, 'subsample': 0.6908412302719574, 'max_features': None}. Best is trial 75 with value: 0.3356123167576939.
[I 2024-12-04 12:16:58,065] Trial 129 finished with value: 0.3681052823572437 and parameters: {'n_estimators': 144, 'learning_rate': 0.0787279645754987, 'max_depth': 12, 'min_samples_split': 8, 'min_samples_leaf': 2, 'subsample': 0.814985054862815, 'max_features': None}. Best is trial 75 with value: 0.3356123167576939.
[I 2024-12-04 12:16:58,768] Trial 132 finished with value: 0.4035469272555521 and parameters: {'n_estimators': 128, 'learning_rate': 0.03929166834656897, 'max_depth': 12, 'min_samples_split': 12, 'min_samples_leaf': 1, 'subsample': 0.6320582095371126, 'max_features': None}. Best is trial 75 with value: 0.3356123167576939.
[I 2024-12-04 12:16:59,253] Trial 110 finished with value: 0.38626890390451757 and parameters: {'n_estimators': 1015, 'learning_rate': 0.0797806294169499, 'max_depth': 6, 'min_samples_split': 18, 'min_samples_leaf': 5, 'subsample': 0.6296605765998331, 'max_features': None}. Best is trial 75 with value: 0.3356123167576939.
[I 2024-12-04 12:17:00,414] Trial 119 finished with value: 0.3690159450512638 and parameters: {'n_estimators': 680, 'learning_rate': 0.08283886722408892, 'max_depth': 8, 'min_samples_split': 20, 'min_samples_leaf': 5, 'subsample': 0.9672233639099967, 'max_features': None}. Best is trial 75 with value: 0.3356123167576939.
[I 2024-12-04 12:17:00,758] Trial 116 finished with value: 0.3683186112934535 and parameters: {'n_estimators': 636, 'learning_rate': 0.02719753132155913, 'max_depth': 12, 'min_samples_split': 20, 'min_samples_leaf': 3, 'subsample': 0.619920919287994, 'max_features': None}. Best is trial 75 with value: 0.3356123167576939.
[I 2024-12-04 12:17:02,442] Trial 131 finished with value: 0.3582979159290875 and parameters: {'n_estimators': 417, 'learning_rate': 0.0643311404053602, 'max_depth': 12, 'min_samples_split': 19, 'min_samples_leaf': 2, 'subsample': 0.8407427793196097, 'max_features': None}. Best is trial 75 with value: 0.3356123167576939.
[I 2024-12-04 12:17:04,176] Trial 137 finished with value: 0.3744774547737642 and parameters: {'n_estimators': 287, 'learning_rate': 0.05683277170831804, 'max_depth': 9, 'min_samples_split': 6, 'min_samples_leaf': 4, 'subsample': 0.7058640596742524, 'max_features': None}. Best is trial 75 with value: 0.3356123167576939.
[I 2024-12-04 12:17:04,270] Trial 126 finished with value: 0.3435245069702493 and parameters: {'n_estimators': 574, 'learning_rate': 0.07632722602871926, 'max_depth': 11, 'min_samples_split': 11, 'min_samples_leaf': 2, 'subsample': 0.6203423934530874, 'max_features': None}. Best is trial 75 with value: 0.3356123167576939.
[I 2024-12-04 12:17:07,461] Trial 130 finished with value: 0.357552846823023 and parameters: {'n_estimators': 507, 'learning_rate': 0.0827525970799544, 'max_depth': 12, 'min_samples_split': 20, 'min_samples_leaf': 4, 'subsample': 0.6082666042337613, 'max_features': None}. Best is trial 75 with value: 0.3356123167576939.
[I 2024-12-04 12:17:07,516] Trial 138 finished with value: 0.38155129333313487 and parameters: {'n_estimators': 523, 'learning_rate': 0.041270154857013075, 'max_depth': 12, 'min_samples_split': 7, 'min_samples_leaf': 1, 'subsample': 0.7446313080222641, 'max_features': 'sqrt'}. Best is trial 75 with value: 0.3356123167576939.
[I 2024-12-04 12:17:07,787] Trial 117 finished with value: 0.3753223485594905 and parameters: {'n_estimators': 863, 'learning_rate': 0.07829632702820001, 'max_depth': 9, 'min_samples_split': 20, 'min_samples_leaf': 4, 'subsample': 0.623687845245459, 'max_features': None}. Best is trial 75 with value: 0.3356123167576939.
[I 2024-12-04 12:17:08,092] Trial 142 finished with value: 0.42227158643143536 and parameters: {'n_estimators': 253, 'learning_rate': 0.08436939921287659, 'max_depth': 12, 'min_samples_split': 19, 'min_samples_leaf': 7, 'subsample': 0.625415996520137, 'max_features': None}. Best is trial 75 with value: 0.3356123167576939.
[I 2024-12-04 12:17:09,517] Trial 135 finished with value: 0.3446975255977918 and parameters: {'n_estimators': 432, 'learning_rate': 0.042946266309814005, 'max_depth': 11, 'min_samples_split': 2, 'min_samples_leaf': 2, 'subsample': 0.7478757031296919, 'max_features': None}. Best is trial 75 with value: 0.3356123167576939.
[I 2024-12-04 12:17:09,800] Trial 134 finished with value: 0.3747316602882488 and parameters: {'n_estimators': 415, 'learning_rate': 0.07042472508808785, 'max_depth': 11, 'min_samples_split': 6, 'min_samples_leaf': 1, 'subsample': 0.7086071426187739, 'max_features': None}. Best is trial 75 with value: 0.3356123167576939.
[I 2024-12-04 12:17:09,885] Trial 140 finished with value: 0.43305452394314325 and parameters: {'n_estimators': 428, 'learning_rate': 0.06488919193850255, 'max_depth': 10, 'min_samples_split': 11, 'min_samples_leaf': 4, 'subsample': 0.8233581143319469, 'max_features': 'sqrt'}. Best is trial 75 with value: 0.3356123167576939.
[I 2024-12-04 12:17:09,894] Trial 118 finished with value: 0.3689278383567269 and parameters: {'n_estimators': 880, 'learning_rate': 0.08334263978824344, 'max_depth': 12, 'min_samples_split': 19, 'min_samples_leaf': 4, 'subsample': 0.6048031799655491, 'max_features': None}. Best is trial 75 with value: 0.3356123167576939.
[I 2024-12-04 12:17:09,895] Trial 146 finished with value: 0.45617255787316685 and parameters: {'n_estimators': 361, 'learning_rate': 0.04704643080502884, 'max_depth': 10, 'min_samples_split': 20, 'min_samples_leaf': 1, 'subsample': 0.9003711244143798, 'max_features': 'log2'}. Best is trial 75 with value: 0.3356123167576939.
