[I 2024-12-04 15:11:55,498] Trial 1654 finished with value: 0.4883034310244486 and parameters: {'kernel_type': 'Matern', 'length_scale': 31.15002827941717, 'noise_level': 0.9606094993315971, 'constant_value': 260.25065890567555, 'nu': 0.5}. Best is trial 386 with value: 0.4872991004520934.
[I 2024-12-04 15:11:56,218] Trial 1660 finished with value: 1.2614547961306324 and parameters: {'kernel_type': 'RBF', 'length_scale': 528.9052842446112, 'noise_level': 0.003458697079503382, 'constant_value': 2.819445419030717e-05, 'nu': 0.5}. Best is trial 386 with value: 0.4872991004520934.
[I 2024-12-04 15:11:56,388] Trial 1657 finished with value: 0.48830342219039935 and parameters: {'kernel_type': 'Matern', 'length_scale': 96906.21543131398, 'noise_level': 0.8261215789798205, 'constant_value': 82.97646548697321, 'nu': 0.5}. Best is trial 386 with value: 0.4872991004520934.
[I 2024-12-04 15:11:56,543] Trial 1652 finished with value: 0.48830342285407125 and parameters: {'kernel_type': 'Matern', 'length_scale': 84446.80188232743, 'noise_level': 0.4280675749950233, 'constant_value': 2036.368261039445, 'nu': 0.5}. Best is trial 386 with value: 0.4872991004520934.
[I 2024-12-04 15:11:57,018] Trial 1662 finished with value: 0.48830341805920907 and parameters: {'kernel_type': 'Matern', 'length_scale': 20.830911358995984, 'noise_level': 0.841570896971623, 'constant_value': 70.87864850700447, 'nu': 0.5}. Best is trial 386 with value: 0.4872991004520934.
[I 2024-12-04 15:11:57,677] Trial 1658 finished with value: 1.2614547953941473 and parameters: {'kernel_type': 'Matern', 'length_scale': 16.59184447075489, 'noise_level': 0.03454426611365637, 'constant_value': 3187.9771268485592, 'nu': 0.5}. Best is trial 386 with value: 0.4872991004520934.
[I 2024-12-04 15:11:58,398] Trial 1653 finished with value: 1.240111231979307 and parameters: {'kernel_type': 'RBF', 'length_scale': 0.00038807010990772736, 'noise_level': 1.16948291115205e-10, 'constant_value': 0.12262402983002749, 'nu': 2.5}. Best is trial 386 with value: 0.4872991004520934.
[I 2024-12-04 15:11:58,600] Trial 1659 finished with value: 0.48830342377923425 and parameters: {'kernel_type': 'Matern', 'length_scale': 2439.4102757709707, 'noise_level': 0.04175884137185413, 'constant_value': 95.19510899744395, 'nu': 0.5}. Best is trial 386 with value: 0.4872991004520934.
[I 2024-12-04 15:11:58,604] Trial 1661 finished with value: 1.2614547953941468 and parameters: {'kernel_type': 'Matern', 'length_scale': 65.2310637252338, 'noise_level': 0.035060825893532495, 'constant_value': 1180.3144808621084, 'nu': 0.5}. Best is trial 386 with value: 0.4872991004520934.
[I 2024-12-04 15:11:58,975] Trial 1656 finished with value: 1.2614543702027763 and parameters: {'kernel_type': 'RBF', 'length_scale': 0.04111492429544992, 'noise_level': 9.578017264107571e-09, 'constant_value': 22.42427794862559, 'nu': 0.5}. Best is trial 386 with value: 0.4872991004520934.
[I 2024-12-04 15:11:59,434] Trial 1655 finished with value: 0.4883034259088954 and parameters: {'kernel_type': 'Matern', 'length_scale': 272.8406557640697, 'noise_level': 0.9054647792873719, 'constant_value': 29818.9435968078, 'nu': 0.5}. Best is trial 386 with value: 0.4872991004520934.
[I 2024-12-04 15:11:59,469] Trial 1651 finished with value: 0.4883034183813681 and parameters: {'kernel_type': 'Matern', 'length_scale': 485.7173754119625, 'noise_level': 0.41605212301048056, 'constant_value': 51151.557868077216, 'nu': 0.5}. Best is trial 386 with value: 0.4872991004520934.
[I 2024-12-04 15:12:01,400] Trial 1664 finished with value: 0.4883034588597141 and parameters: {'kernel_type': 'Matern', 'length_scale': 97123.76357774912, 'noise_level': 0.011889163416247583, 'constant_value': 26875.00795496479, 'nu': 0.5}. Best is trial 386 with value: 0.4872991004520934.
[I 2024-12-04 15:12:01,949] Trial 1663 finished with value: 1.2401112366447007 and parameters: {'kernel_type': 'Matern', 'length_scale': 74290.26286286778, 'noise_level': 0.0010985658378021659, 'constant_value': 75.94706671469854, 'nu': 0.5}. Best is trial 386 with value: 0.4872991004520934.
[I 2024-12-04 15:12:04,323] Trial 1666 finished with value: 0.4883034147549811 and parameters: {'kernel_type': 'Matern', 'length_scale': 4005.634088632613, 'noise_level': 0.6555742394560073, 'constant_value': 3731.488420309605, 'nu': 0.5}. Best is trial 386 with value: 0.4872991004520934.
[I 2024-12-04 15:12:04,324] Trial 1648 finished with value: 0.4883034185473387 and parameters: {'kernel_type': 'Matern', 'length_scale': 1183.7771073884214, 'noise_level': 0.9549466527341451, 'constant_value': 8485.309202978651, 'nu': 0.5}. Best is trial 386 with value: 0.4872991004520934.
[I 2024-12-04 15:12:04,711] Trial 1670 finished with value: 1.240111232449098 and parameters: {'kernel_type': 'Matern', 'length_scale': 84.03606548505554, 'noise_level': 0.017869580533793453, 'constant_value': 0.00926763643466804, 'nu': 0.5}. Best is trial 386 with value: 0.4872991004520934.
[I 2024-12-04 15:12:05,224] Trial 1665 finished with value: 0.48830340078303436 and parameters: {'kernel_type': 'Matern', 'length_scale': 85089.63847253702, 'noise_level': 0.23318359103718397, 'constant_value': 489.1537482841034, 'nu': 0.5}. Best is trial 386 with value: 0.4872991004520934.
[I 2024-12-04 15:12:08,099] Trial 1669 finished with value: 1.2614543702027645 and parameters: {'kernel_type': 'Matern', 'length_scale': 0.03554198372770334, 'noise_level': 2.859954022998558e-10, 'constant_value': 5.339737421546102, 'nu': 1.5}. Best is trial 386 with value: 0.4872991004520934.
[I 2024-12-04 15:12:08,783] Trial 1667 finished with value: 0.48830341399959243 and parameters: {'kernel_type': 'Matern', 'length_scale': 1973.6556952483108, 'noise_level': 0.046101164907641906, 'constant_value': 1518.3275520161249, 'nu': 0.5}. Best is trial 386 with value: 0.4872991004520934.
[I 2024-12-04 15:12:09,950] Trial 1674 finished with value: 0.48830334287750216 and parameters: {'kernel_type': 'Matern', 'length_scale': 640.7616681791537, 'noise_level': 0.001186216224121595, 'constant_value': 92815.91870311834, 'nu': 0.5}. Best is trial 386 with value: 0.4872991004520934.
[I 2024-12-04 15:12:10,592] Trial 1671 finished with value: 0.48830341630333246 and parameters: {'kernel_type': 'Matern', 'length_scale': 78845.5747313897, 'noise_level': 0.7073099159488974, 'constant_value': 32819.783392658464, 'nu': 0.5}. Best is trial 386 with value: 0.4872991004520934.
[I 2024-12-04 15:12:10,923] Trial 1668 finished with value: 0.4883034201688539 and parameters: {'kernel_type': 'Matern', 'length_scale': 2784.6431662353248, 'noise_level': 0.3889416385125862, 'constant_value': 84218.46484681268, 'nu': 0.5}. Best is trial 386 with value: 0.4872991004520934.
[I 2024-12-04 15:12:12,074] Trial 1679 finished with value: 0.488303454439705 and parameters: {'kernel_type': 'Matern', 'length_scale': 7791.531051184121, 'noise_level': 0.9792511833712088, 'constant_value': 2.604216959604441, 'nu': 0.5}. Best is trial 386 with value: 0.4872991004520934.
[I 2024-12-04 15:12:12,994] Trial 1672 finished with value: 0.5663935159978691 and parameters: {'kernel_type': 'Matern', 'length_scale': 62068.57556015633, 'noise_level': 0.8700059870966069, 'constant_value': 28182.17844968925, 'nu': 2.5}. Best is trial 386 with value: 0.4872991004520934.
[I 2024-12-04 15:12:13,568] Trial 1680 finished with value: 1.240111232582052 and parameters: {'kernel_type': 'RBF', 'length_scale': 24640.09771313969, 'noise_level': 6.031613029806743e-08, 'constant_value': 0.36618129905066255, 'nu': 0.5}. Best is trial 386 with value: 0.4872991004520934.
[I 2024-12-04 15:12:13,599] Trial 1678 finished with value: 0.4883033207975176 and parameters: {'kernel_type': 'Matern', 'length_scale': 45926.31928271391, 'noise_level': 0.0032002067018665043, 'constant_value': 93596.10253319622, 'nu': 0.5}. Best is trial 386 with value: 0.4872991004520934.
[I 2024-12-04 15:12:14,063] Trial 1673 finished with value: 1.261454368929716 and parameters: {'kernel_type': 'RBF', 'length_scale': 0.2428948566767648, 'noise_level': 1.9864949099073307e-06, 'constant_value': 87624.7698462558, 'nu': 1.5}. Best is trial 386 with value: 0.4872991004520934.
[I 2024-12-04 15:12:15,191] Trial 1690 finished with value: 0.48830341938967736 and parameters: {'kernel_type': 'Matern', 'length_scale': 1947.8716075111872, 'noise_level': 0.0750570342828231, 'constant_value': 893.4636600994423, 'nu': 0.5}. Best is trial 386 with value: 0.4872991004520934.
[I 2024-12-04 15:12:15,375] Trial 1675 finished with value: 1.240111232576987 and parameters: {'kernel_type': 'Matern', 'length_scale': 86759.72407313935, 'noise_level': 0.04175316165598272, 'constant_value': 38605.441509356424, 'nu': 2.5}. Best is trial 386 with value: 0.4872991004520934.
[I 2024-12-04 15:12:15,572] Trial 1677 finished with value: 1.2401112325846508 and parameters: {'kernel_type': 'RBF', 'length_scale': 1571.4703056708042, 'noise_level': 0.04582999030954936, 'constant_value': 64.77350395136618, 'nu': 0.5}. Best is trial 386 with value: 0.4872991004520934.
[I 2024-12-04 15:12:16,332] Trial 1682 finished with value: 0.48830318080493035 and parameters: {'kernel_type': 'Matern', 'length_scale': 4013.4235362013133, 'noise_level': 0.9273978190542541, 'constant_value': 1667.3454339003822, 'nu': 0.5}. Best is trial 386 with value: 0.4872991004520934.
[I 2024-12-04 15:12:17,660] Trial 1681 finished with value: 1.2401112326801147 and parameters: {'kernel_type': 'Matern', 'length_scale': 0.004945558946643869, 'noise_level': 0.0004284709243248057, 'constant_value': 0.007289239946934809, 'nu': 0.5}. Best is trial 386 with value: 0.4872991004520934.
[I 2024-12-04 15:12:17,932] Trial 1687 finished with value: 0.5273054696453425 and parameters: {'kernel_type': 'Matern', 'length_scale': 952.8039261836709, 'noise_level': 0.027224274542669832, 'constant_value': 931.5886530778097, 'nu': 1.5}. Best is trial 386 with value: 0.4872991004520934.
[I 2024-12-04 15:12:18,884] Trial 1684 finished with value: 0.4883032409582785 and parameters: {'kernel_type': 'Matern', 'length_scale': 1733.6470678896133, 'noise_level': 0.9648792008065838, 'constant_value': 0.9381262882298765, 'nu': 0.5}. Best is trial 386 with value: 0.4872991004520934.
[I 2024-12-04 15:12:19,164] Trial 1683 finished with value: 0.4883033818074344 and parameters: {'kernel_type': 'Matern', 'length_scale': 94217.12369393115, 'noise_level': 0.7258079645375803, 'constant_value': 12.821922354148102, 'nu': 0.5}. Best is trial 386 with value: 0.4872991004520934.
[I 2024-12-04 15:12:19,697] Trial 1676 finished with value: 1.2401112320853542 and parameters: {'kernel_type': 'Matern', 'length_scale': 95331.69886953347, 'noise_level': 8.402799492765238e-05, 'constant_value': 1030.912738535497, 'nu': 0.5}. Best is trial 386 with value: 0.4872991004520934.
[I 2024-12-04 15:12:20,027] Trial 1685 finished with value: 1.2401112325700803 and parameters: {'kernel_type': 'RBF', 'length_scale': 1.5542582298691752e-05, 'noise_level': 5.8706593188789956e-08, 'constant_value': 0.0008469487924703895, 'nu': 0.5}. Best is trial 386 with value: 0.4872991004520934.
[I 2024-12-04 15:12:20,307] Trial 1691 finished with value: 0.48830338999846956 and parameters: {'kernel_type': 'Matern', 'length_scale': 88409.47470972447, 'noise_level': 0.0065921623748997, 'constant_value': 61503.109456745755, 'nu': 0.5}. Best is trial 386 with value: 0.4872991004520934.
[I 2024-12-04 15:12:20,331] Trial 1688 finished with value: 0.4883034199917278 and parameters: {'kernel_type': 'Matern', 'length_scale': 89677.23220662773, 'noise_level': 0.01955947505906017, 'constant_value': 850.5314847131839, 'nu': 0.5}. Best is trial 386 with value: 0.4872991004520934.
[I 2024-12-04 15:12:23,189] Trial 1686 finished with value: 0.488303419433625 and parameters: {'kernel_type': 'Matern', 'length_scale': 994.3308547056428, 'noise_level': 0.017374288474719633, 'constant_value': 31.12225203579545, 'nu': 0.5}. Best is trial 386 with value: 0.4872991004520934.
[I 2024-12-04 15:12:23,313] Trial 1689 finished with value: 0.488303415969667 and parameters: {'kernel_type': 'Matern', 'length_scale': 3270.316653350052, 'noise_level': 0.9097986934770167, 'constant_value': 55399.65911509023, 'nu': 0.5}. Best is trial 386 with value: 0.4872991004520934.
[I 2024-12-04 15:12:24,549] Trial 1696 finished with value: 0.4883032596508123 and parameters: {'kernel_type': 'Matern', 'length_scale': 572.5047177369255, 'noise_level': 0.00045540927471359816, 'constant_value': 449.95885154136414, 'nu': 0.5}. Best is trial 386 with value: 0.4872991004520934.
[I 2024-12-04 15:12:24,902] Trial 1693 finished with value: 0.4883035467346086 and parameters: {'kernel_type': 'Matern', 'length_scale': 1647.8461391586131, 'noise_level': 0.04762344554540171, 'constant_value': 11.06249004362357, 'nu': 0.5}. Best is trial 386 with value: 0.4872991004520934.
[I 2024-12-04 15:12:26,553] Trial 1695 finished with value: 0.48830337700602217 and parameters: {'kernel_type': 'Matern', 'length_scale': 74706.44899722762, 'noise_level': 0.5823067935552345, 'constant_value': 74844.41440955483, 'nu': 0.5}. Best is trial 386 with value: 0.4872991004520934.
[I 2024-12-04 15:12:26,973] Trial 1701 finished with value: 1.2614547953941473 and parameters: {'kernel_type': 'Matern', 'length_scale': 86.30562883476831, 'noise_level': 0.028179227992769253, 'constant_value': 999.1501088252938, 'nu': 0.5}. Best is trial 386 with value: 0.4872991004520934.
[I 2024-12-04 15:12:27,520] Trial 1694 finished with value: 0.4883034177707905 and parameters: {'kernel_type': 'Matern', 'length_scale': 84981.27379455244, 'noise_level': 0.05008156294247359, 'constant_value': 761.9123607770039, 'nu': 0.5}. Best is trial 386 with value: 0.4872991004520934.
[I 2024-12-04 15:12:28,053] Trial 1692 finished with value: 0.644385347557299 and parameters: {'kernel_type': 'RBF', 'length_scale': 62491.79155459459, 'noise_level': 0.1299802979424106, 'constant_value': 19187.10032071402, 'nu': 0.5}. Best is trial 386 with value: 0.4872991004520934.
[I 2024-12-04 15:12:28,383] Trial 1699 finished with value: 0.4883033726045965 and parameters: {'kernel_type': 'Matern', 'length_scale': 55.62450555804459, 'noise_level': 0.04176644833941021, 'constant_value': 59.18123721750031, 'nu': 0.5}. Best is trial 386 with value: 0.4872991004520934.
[I 2024-12-04 15:12:29,247] Trial 1702 finished with value: 1.261454797635248 and parameters: {'kernel_type': 'Matern', 'length_scale': 76324.21108446612, 'noise_level': 0.10939948894352196, 'constant_value': 18.025592689352067, 'nu': 2.5}. Best is trial 386 with value: 0.4872991004520934.
[I 2024-12-04 15:12:29,533] Trial 1697 finished with value: 0.4883034179382822 and parameters: {'kernel_type': 'Matern', 'length_scale': 1352.4368770385906, 'noise_level': 0.7577188620412999, 'constant_value': 79.63497395132724, 'nu': 0.5}. Best is trial 386 with value: 0.4872991004520934.
[I 2024-12-04 15:12:30,121] Trial 1698 finished with value: 1.2401112323199543 and parameters: {'kernel_type': 'Matern', 'length_scale': 97166.88863613986, 'noise_level': 0.010053991538863868, 'constant_value': 387.06066426242046, 'nu': 0.5}. Best is trial 386 with value: 0.4872991004520934.
[I 2024-12-04 15:12:32,775] Trial 1713 finished with value: 0.48830336738674546 and parameters: {'kernel_type': 'Matern', 'length_scale': 1924.098159907482, 'noise_level': 0.0273768742260995, 'constant_value': 1859.4334512910946, 'nu': 0.5}. Best is trial 386 with value: 0.4872991004520934.
[I 2024-12-04 15:12:32,778] Trial 1709 finished with value: 0.48830340570261693 and parameters: {'kernel_type': 'Matern', 'length_scale': 91559.31202200592, 'noise_level': 0.9182652139401862, 'constant_value': 1047.0721554242286, 'nu': 0.5}. Best is trial 386 with value: 0.4872991004520934.
[I 2024-12-04 15:12:32,780] Trial 1706 finished with value: 1.2614543702027563 and parameters: {'kernel_type': 'Matern', 'length_scale': 0.023106944409936533, 'noise_level': 2.1710551639372847e-05, 'constant_value': 4.439298461175998, 'nu': 0.5}. Best is trial 386 with value: 0.4872991004520934.
[I 2024-12-04 15:12:33,793] Trial 1703 finished with value: 0.48830340545749396 and parameters: {'kernel_type': 'Matern', 'length_scale': 66781.22441929553, 'noise_level': 0.0584028961201464, 'constant_value': 65403.85853606267, 'nu': 0.5}. Best is trial 386 with value: 0.4872991004520934.
[I 2024-12-04 15:12:34,349] Trial 1715 finished with value: 0.4883034026719107 and parameters: {'kernel_type': 'Matern', 'length_scale': 3847.173910996589, 'noise_level': 0.04066387960074949, 'constant_value': 81729.52757922403, 'nu': 0.5}. Best is trial 386 with value: 0.4872991004520934.
[I 2024-12-04 15:12:34,932] Trial 1714 finished with value: 0.4883034538920966 and parameters: {'kernel_type': 'Matern', 'length_scale': 339.1879611712859, 'noise_level': 0.9465385443714234, 'constant_value': 57119.679634341475, 'nu': 0.5}. Best is trial 386 with value: 0.4872991004520934.
[I 2024-12-04 15:12:35,325] Trial 1710 finished with value: 1.240111231398063 and parameters: {'kernel_type': 'Matern', 'length_scale': 0.011986633827310552, 'noise_level': 0.1454009863696465, 'constant_value': 56.620281995213425, 'nu': 0.5}. Best is trial 386 with value: 0.4872991004520934.
[I 2024-12-04 15:12:35,342] Trial 1704 finished with value: 0.4883034309021988 and parameters: {'kernel_type': 'Matern', 'length_scale': 1835.17219801717, 'noise_level': 0.007298084894775896, 'constant_value': 2443.439461929856, 'nu': 0.5}. Best is trial 386 with value: 0.4872991004520934.
[I 2024-12-04 15:12:35,947] Trial 1700 finished with value: 0.4883034042718563 and parameters: {'kernel_type': 'Matern', 'length_scale': 2244.8026577642236, 'noise_level': 0.6466338545554219, 'constant_value': 92564.95123378813, 'nu': 0.5}. Best is trial 386 with value: 0.4872991004520934.
[I 2024-12-04 15:12:37,477] Trial 1707 finished with value: 1.240111234277035 and parameters: {'kernel_type': 'RBF', 'length_scale': 381.8432399998566, 'noise_level': 0.0002942713274138795, 'constant_value': 36174.201414926734, 'nu': 0.5}. Best is trial 386 with value: 0.4872991004520934.
[I 2024-12-04 15:12:38,990] Trial 1711 finished with value: 0.4883033642458293 and parameters: {'kernel_type': 'Matern', 'length_scale': 3.361569848473749, 'noise_level': 0.0009026846230470157, 'constant_value': 1.289731524271656, 'nu': 0.5}. Best is trial 386 with value: 0.4872991004520934.
[I 2024-12-04 15:12:40,508] Trial 1717 finished with value: 0.48830344653903046 and parameters: {'kernel_type': 'Matern', 'length_scale': 609.9812277303594, 'noise_level': 0.6785468380691133, 'constant_value': 21.88375473764579, 'nu': 0.5}. Best is trial 386 with value: 0.4872991004520934.
[I 2024-12-04 15:12:40,762] Trial 1708 finished with value: 0.48830342043511843 and parameters: {'kernel_type': 'Matern', 'length_scale': 2245.077083697081, 'noise_level': 0.03167834208220222, 'constant_value': 8.705789749328737, 'nu': 0.5}. Best is trial 386 with value: 0.4872991004520934.
[I 2024-12-04 15:12:40,784] Trial 1705 finished with value: 0.4883034150800855 and parameters: {'kernel_type': 'Matern', 'length_scale': 74421.5987938497, 'noise_level': 0.651321198313545, 'constant_value': 628.7215410215124, 'nu': 0.5}. Best is trial 386 with value: 0.4872991004520934.
[I 2024-12-04 15:12:40,807] Trial 1720 finished with value: 1.240111232603479 and parameters: {'kernel_type': 'Matern', 'length_scale': 94294.05026469953, 'noise_level': 0.008275739593905176, 'constant_value': 63529.59959182646, 'nu': 1.5}. Best is trial 386 with value: 0.4872991004520934.
[I 2024-12-04 15:12:42,897] Trial 1723 finished with value: 0.4883036329910263 and parameters: {'kernel_type': 'Matern', 'length_scale': 0.6195336242399558, 'noise_level': 0.014477235646585554, 'constant_value': 26.937698196259152, 'nu': 0.5}. Best is trial 386 with value: 0.4872991004520934.
[I 2024-12-04 15:12:42,902] Trial 1712 finished with value: 0.4883033509574804 and parameters: {'kernel_type': 'Matern', 'length_scale': 1.6955558223619496, 'noise_level': 0.009091404679165006, 'constant_value': 0.0010475667075603955, 'nu': 0.5}. Best is trial 386 with value: 0.4872991004520934.
[I 2024-12-04 15:12:43,813] Trial 1716 finished with value: 1.261454797635249 and parameters: {'kernel_type': 'RBF', 'length_scale': 70205.3196559309, 'noise_level': 0.04538068804291667, 'constant_value': 2.1149018276888396e-07, 'nu': 2.5}. Best is trial 386 with value: 0.4872991004520934.
[I 2024-12-04 15:12:44,028] Trial 1721 finished with value: 0.48830343575965096 and parameters: {'kernel_type': 'Matern', 'length_scale': 4968.718907316371, 'noise_level': 0.01070240392997844, 'constant_value': 1580.8207461317422, 'nu': 0.5}. Best is trial 386 with value: 0.4872991004520934.
[I 2024-12-04 15:12:44,743] Trial 1728 finished with value: 0.4883033944750967 and parameters: {'kernel_type': 'Matern', 'length_scale': 84916.93191168025, 'noise_level': 0.7451266559273306, 'constant_value': 4857.380265871195, 'nu': 0.5}. Best is trial 386 with value: 0.4872991004520934.
[I 2024-12-04 15:12:44,794] Trial 1729 finished with value: 0.488303346666734 and parameters: {'kernel_type': 'Matern', 'length_scale': 107.05038504833031, 'noise_level': 0.8000767838501597, 'constant_value': 59.98478559082896, 'nu': 0.5}. Best is trial 386 with value: 0.4872991004520934.
[I 2024-12-04 15:12:46,100] Trial 1718 finished with value: 1.192198720573301 and parameters: {'kernel_type': 'Matern', 'length_scale': 554.8613720353127, 'noise_level': 0.02234393731800754, 'constant_value': 4.4582400911549883e-05, 'nu': 0.5}. Best is trial 386 with value: 0.4872991004520934.
[I 2024-12-04 15:12:46,305] Trial 1726 finished with value: 0.4883034071701923 and parameters: {'kernel_type': 'Matern', 'length_scale': 3724.5688879569216, 'noise_level': 0.03630451634802698, 'constant_value': 60.001182137808655, 'nu': 0.5}. Best is trial 386 with value: 0.4872991004520934.
