[I 2024-12-04 20:05:02,743] Trial 781 finished with value: 0.41956571861788267 and parameters: {'kernel_type': 'Matern', 'length_scale': 29.493059943975645, 'noise_level': 0.0027192614514195365, 'constant_value': 34859.747061824535, 'nu': 2.5}. Best is trial 448 with value: 0.3592093758005386.
[I 2024-12-04 20:05:03,835] Trial 782 finished with value: 0.3592112418003003 and parameters: {'kernel_type': 'Matern', 'length_scale': 8.563669284661204, 'noise_level': 0.015048907908357294, 'constant_value': 12829.407569728897, 'nu': 0.5}. Best is trial 448 with value: 0.3592093758005386.
[I 2024-12-04 20:05:05,313] Trial 783 finished with value: 1.0916558493885595 and parameters: {'kernel_type': 'RBF', 'length_scale': 0.0037411945293756447, 'noise_level': 2.568497334128815e-10, 'constant_value': 16004.946028636434, 'nu': 0.5}. Best is trial 448 with value: 0.3592093758005386.
[I 2024-12-04 20:05:07,754] Trial 784 finished with value: 0.3592114173130414 and parameters: {'kernel_type': 'Matern', 'length_scale': 16.964792199059072, 'noise_level': 0.01469104966546627, 'constant_value': 342.87668409396434, 'nu': 0.5}. Best is trial 448 with value: 0.3592093758005386.
[I 2024-12-04 20:05:08,925] Trial 785 finished with value: 0.35921122358402024 and parameters: {'kernel_type': 'Matern', 'length_scale': 0.3997089051921172, 'noise_level': 0.05159001860677888, 'constant_value': 3687.370403617723, 'nu': 0.5}. Best is trial 448 with value: 0.3592093758005386.
[I 2024-12-04 20:05:10,264] Trial 786 finished with value: 0.3592112233426326 and parameters: {'kernel_type': 'Matern', 'length_scale': 8.798392123970485, 'noise_level': 0.04398029532427124, 'constant_value': 15.403579891334473, 'nu': 0.5}. Best is trial 448 with value: 0.3592093758005386.
[I 2024-12-04 20:05:12,444] Trial 787 finished with value: 0.35921132449643023 and parameters: {'kernel_type': 'Matern', 'length_scale': 11.595307918599733, 'noise_level': 0.06373600579876207, 'constant_value': 587.5343666298326, 'nu': 0.5}. Best is trial 448 with value: 0.3592093758005386.
[I 2024-12-04 20:05:14,436] Trial 788 finished with value: 0.3592109940868476 and parameters: {'kernel_type': 'Matern', 'length_scale': 0.9747561857208139, 'noise_level': 0.47763846652951053, 'constant_value': 1378.4822467551865, 'nu': 0.5}. Best is trial 448 with value: 0.3592093758005386.
[I 2024-12-04 20:05:14,891] Trial 789 finished with value: 0.35921106545846937 and parameters: {'kernel_type': 'Matern', 'length_scale': 1.7450829026867738, 'noise_level': 0.9235766382757888, 'constant_value': 2004.0003848217918, 'nu': 0.5}. Best is trial 448 with value: 0.3592093758005386.
[I 2024-12-04 20:05:17,370] Trial 790 finished with value: 0.35921114884669775 and parameters: {'kernel_type': 'Matern', 'length_scale': 0.33542562488966454, 'noise_level': 0.06395024484009512, 'constant_value': 6.7710823159534375, 'nu': 0.5}. Best is trial 448 with value: 0.3592093758005386.
[I 2024-12-04 20:05:19,573] Trial 792 finished with value: 0.3592112635048445 and parameters: {'kernel_type': 'Matern', 'length_scale': 404.7015471759822, 'noise_level': 0.6786254882575221, 'constant_value': 656.2901397917732, 'nu': 0.5}. Best is trial 448 with value: 0.3592093758005386.
[I 2024-12-04 20:05:19,639] Trial 791 finished with value: 0.35921117864122354 and parameters: {'kernel_type': 'Matern', 'length_scale': 9950.591047896529, 'noise_level': 0.1555437133930839, 'constant_value': 0.1633322199072768, 'nu': 0.5}. Best is trial 448 with value: 0.3592093758005386.
[I 2024-12-04 20:05:21,082] Trial 793 finished with value: 0.3592111979155053 and parameters: {'kernel_type': 'Matern', 'length_scale': 2.0246844923061005, 'noise_level': 0.9346829769286039, 'constant_value': 0.22192107050318527, 'nu': 0.5}. Best is trial 448 with value: 0.3592093758005386.
[I 2024-12-04 20:05:22,418] Trial 794 finished with value: 1.0916567048549888 and parameters: {'kernel_type': 'Matern', 'length_scale': 177.26933657230742, 'noise_level': 0.005395784027433559, 'constant_value': 8087.645922650848, 'nu': 0.5}. Best is trial 448 with value: 0.3592093758005386.
[I 2024-12-04 20:05:25,288] Trial 795 finished with value: 0.3592112495549848 and parameters: {'kernel_type': 'Matern', 'length_scale': 575.6443524174338, 'noise_level': 0.0036686867337102943, 'constant_value': 19031.520296008715, 'nu': 0.5}. Best is trial 448 with value: 0.3592093758005386.
[I 2024-12-04 20:05:27,032] Trial 796 finished with value: 0.4226887912425225 and parameters: {'kernel_type': 'Matern', 'length_scale': 70542.95013899112, 'noise_level': 0.25444351546759103, 'constant_value': 16432.578971794846, 'nu': 1.5}. Best is trial 448 with value: 0.3592093758005386.
[I 2024-12-04 20:05:27,645] Trial 797 finished with value: 0.3592112452008217 and parameters: {'kernel_type': 'Matern', 'length_scale': 28.978645743354406, 'noise_level': 0.021285902449407923, 'constant_value': 66.73924846291719, 'nu': 0.5}. Best is trial 448 with value: 0.3592093758005386.
[I 2024-12-04 20:05:30,027] Trial 798 finished with value: 0.3592112896614094 and parameters: {'kernel_type': 'Matern', 'length_scale': 2.8808419950009245, 'noise_level': 0.021593099979098983, 'constant_value': 0.0771715528555885, 'nu': 0.5}. Best is trial 448 with value: 0.3592093758005386.
[I 2024-12-04 20:05:31,487] Trial 800 finished with value: 1.0624161172413173 and parameters: {'kernel_type': 'RBF', 'length_scale': 3.26291775918155, 'noise_level': 0.0002686293712133592, 'constant_value': 0.23625764285381712, 'nu': 0.5}. Best is trial 448 with value: 0.3592093758005386.
[I 2024-12-04 20:05:31,997] Trial 799 finished with value: 0.35921123492789436 and parameters: {'kernel_type': 'Matern', 'length_scale': 10.999110238993648, 'noise_level': 0.03284988141517573, 'constant_value': 5.751650265954308, 'nu': 0.5}. Best is trial 448 with value: 0.3592093758005386.
[I 2024-12-04 20:05:34,334] Trial 803 finished with value: 1.091655849288788 and parameters: {'kernel_type': 'Matern', 'length_scale': 0.08832835982880417, 'noise_level': 0.005471183175660334, 'constant_value': 85894.65747172401, 'nu': 0.5}. Best is trial 448 with value: 0.3592093758005386.
[I 2024-12-04 20:05:37,152] Trial 802 finished with value: 0.35921124154627404 and parameters: {'kernel_type': 'Matern', 'length_scale': 18.04417582621051, 'noise_level': 0.060880711790847586, 'constant_value': 84868.75544633299, 'nu': 0.5}. Best is trial 448 with value: 0.3592093758005386.
[I 2024-12-04 20:05:37,464] Trial 801 finished with value: 0.35921123652818604 and parameters: {'kernel_type': 'Matern', 'length_scale': 0.37155170320614245, 'noise_level': 0.8702879445768946, 'constant_value': 0.002006470705616122, 'nu': 0.5}. Best is trial 448 with value: 0.3592093758005386.
[I 2024-12-04 20:05:39,563] Trial 804 finished with value: 0.35921122692357565 and parameters: {'kernel_type': 'Matern', 'length_scale': 48.76113411007311, 'noise_level': 0.07032079099683923, 'constant_value': 32.697587070164104, 'nu': 0.5}. Best is trial 448 with value: 0.3592093758005386.
[I 2024-12-04 20:05:42,935] Trial 806 finished with value: 0.35921034578891614 and parameters: {'kernel_type': 'Matern', 'length_scale': 5.20262694232822, 'noise_level': 0.6793214364393535, 'constant_value': 76628.77083316726, 'nu': 0.5}. Best is trial 448 with value: 0.3592093758005386.
[I 2024-12-04 20:05:43,464] Trial 807 finished with value: 0.3592171005886635 and parameters: {'kernel_type': 'Matern', 'length_scale': 4.917358910045352, 'noise_level': 0.019755449825503122, 'constant_value': 399.009244483709, 'nu': 0.5}. Best is trial 448 with value: 0.3592093758005386.
[I 2024-12-04 20:05:43,465] Trial 805 finished with value: 0.35921096922420676 and parameters: {'kernel_type': 'Matern', 'length_scale': 58.54107105233357, 'noise_level': 0.6224401266683621, 'constant_value': 0.00495326035409868, 'nu': 0.5}. Best is trial 448 with value: 0.3592093758005386.
[I 2024-12-04 20:05:48,015] Trial 810 finished with value: 1.0624161172301843 and parameters: {'kernel_type': 'Matern', 'length_scale': 0.024102406287132654, 'noise_level': 0.23212181653027092, 'constant_value': 50354.591321584565, 'nu': 0.5}. Best is trial 448 with value: 0.3592093758005386.
[I 2024-12-04 20:05:48,413] Trial 808 finished with value: 0.3592110848527805 and parameters: {'kernel_type': 'Matern', 'length_scale': 1.1057542623872225, 'noise_level': 0.22999177343709903, 'constant_value': 458.3317807672676, 'nu': 0.5}. Best is trial 448 with value: 0.3592093758005386.
[I 2024-12-04 20:05:49,927] Trial 809 finished with value: 0.3592112866714694 and parameters: {'kernel_type': 'Matern', 'length_scale': 8.418393043778996, 'noise_level': 0.5342749897638532, 'constant_value': 37789.994625535095, 'nu': 0.5}. Best is trial 448 with value: 0.3592093758005386.
[I 2024-12-04 20:05:52,478] Trial 811 finished with value: 0.35921142617744883 and parameters: {'kernel_type': 'Matern', 'length_scale': 14.114956234615606, 'noise_level': 0.3145195513167471, 'constant_value': 853.3419214194896, 'nu': 0.5}. Best is trial 448 with value: 0.3592093758005386.
[I 2024-12-04 20:05:53,785] Trial 812 finished with value: 0.35921124344425237 and parameters: {'kernel_type': 'Matern', 'length_scale': 11.928012714333224, 'noise_level': 0.22866306358922117, 'constant_value': 26895.55694182985, 'nu': 0.5}. Best is trial 448 with value: 0.3592093758005386.
[I 2024-12-04 20:05:54,547] Trial 813 finished with value: 0.35921135163456325 and parameters: {'kernel_type': 'Matern', 'length_scale': 8.16477919832911, 'noise_level': 0.10554720353385136, 'constant_value': 9623.8235348369, 'nu': 0.5}. Best is trial 448 with value: 0.3592093758005386.
[I 2024-12-04 20:05:58,817] Trial 814 finished with value: 1.0624161172585436 and parameters: {'kernel_type': 'RBF', 'length_scale': 2.998132776049104e-05, 'noise_level': 1.0892618936660447e-05, 'constant_value': 4.787795117413037e-06, 'nu': 0.5}. Best is trial 448 with value: 0.3592093758005386.
[I 2024-12-04 20:05:59,302] Trial 816 finished with value: 1.0624161172629214 and parameters: {'kernel_type': 'RBF', 'length_scale': 0.03170494411634141, 'noise_level': 3.7414599809239564e-08, 'constant_value': 0.0259911331185322, 'nu': 1.5}. Best is trial 448 with value: 0.3592093758005386.
[I 2024-12-04 20:05:59,559] Trial 815 finished with value: 0.35921141620321356 and parameters: {'kernel_type': 'Matern', 'length_scale': 13763.55777079505, 'noise_level': 0.6294910652317753, 'constant_value': 2.6244914923272584, 'nu': 0.5}. Best is trial 448 with value: 0.3592093758005386.
[I 2024-12-04 20:06:04,590] Trial 817 finished with value: 0.3592112207453465 and parameters: {'kernel_type': 'Matern', 'length_scale': 1518.965172527936, 'noise_level': 0.8061173866247783, 'constant_value': 42189.18695704793, 'nu': 0.5}. Best is trial 448 with value: 0.3592093758005386.
[I 2024-12-04 20:06:04,875] Trial 819 finished with value: 0.4226898693276644 and parameters: {'kernel_type': 'Matern', 'length_scale': 3.6516370994335516, 'noise_level': 0.0002218570382087807, 'constant_value': 30.062307974704012, 'nu': 1.5}. Best is trial 448 with value: 0.3592093758005386.
[I 2024-12-04 20:06:05,378] Trial 818 finished with value: 0.3592112337789394 and parameters: {'kernel_type': 'Matern', 'length_scale': 0.3191650719171394, 'noise_level': 0.13890919986697353, 'constant_value': 54035.88053781991, 'nu': 0.5}. Best is trial 448 with value: 0.3592093758005386.
[I 2024-12-04 20:06:12,670] Trial 821 finished with value: 1.0624161172679953 and parameters: {'kernel_type': 'Matern', 'length_scale': 0.01169113987067343, 'noise_level': 0.24333879959096208, 'constant_value': 4.539223879811921, 'nu': 0.5}. Best is trial 448 with value: 0.3592093758005386.
[I 2024-12-04 20:06:13,753] Trial 820 finished with value: 0.35921067737057755 and parameters: {'kernel_type': 'Matern', 'length_scale': 5.221377228470879, 'noise_level': 0.46206857768729515, 'constant_value': 18048.358846138068, 'nu': 0.5}. Best is trial 448 with value: 0.3592093758005386.
[I 2024-12-04 20:06:14,421] Trial 822 finished with value: 0.35921112990667897 and parameters: {'kernel_type': 'Matern', 'length_scale': 462.1541022021413, 'noise_level': 0.2571678521803163, 'constant_value': 0.29707564356012744, 'nu': 0.5}. Best is trial 448 with value: 0.3592093758005386.
[I 2024-12-04 20:06:18,958] Trial 825 finished with value: 0.3592112384133253 and parameters: {'kernel_type': 'Matern', 'length_scale': 0.618515819064877, 'noise_level': 0.36042706461624335, 'constant_value': 1.5616573375641774, 'nu': 0.5}. Best is trial 448 with value: 0.3592093758005386.
[I 2024-12-04 20:06:19,010] Trial 823 finished with value: 0.35921106580011974 and parameters: {'kernel_type': 'Matern', 'length_scale': 0.2903532476775792, 'noise_level': 0.05102565717363617, 'constant_value': 91829.14699898832, 'nu': 0.5}. Best is trial 448 with value: 0.3592093758005386.
[I 2024-12-04 20:06:19,174] Trial 824 finished with value: 0.35921120994842043 and parameters: {'kernel_type': 'Matern', 'length_scale': 617.1380631919815, 'noise_level': 0.06087193597209628, 'constant_value': 0.021993744958698044, 'nu': 0.5}. Best is trial 448 with value: 0.3592093758005386.
[I 2024-12-04 20:06:24,046] Trial 828 finished with value: 0.359212040010903 and parameters: {'kernel_type': 'Matern', 'length_scale': 0.8161534664307424, 'noise_level': 0.5277815367024744, 'constant_value': 791.4678137231077, 'nu': 0.5}. Best is trial 448 with value: 0.3592093758005386.
[I 2024-12-04 20:06:24,067] Trial 826 finished with value: 0.35921124895026985 and parameters: {'kernel_type': 'Matern', 'length_scale': 103.63346984357058, 'noise_level': 0.5391683438829397, 'constant_value': 90.39611499936194, 'nu': 0.5}. Best is trial 448 with value: 0.3592093758005386.
[I 2024-12-04 20:06:24,395] Trial 827 finished with value: 0.35921124330136295 and parameters: {'kernel_type': 'Matern', 'length_scale': 33.61568809218773, 'noise_level': 0.7141645426520549, 'constant_value': 28229.120880635965, 'nu': 0.5}. Best is trial 448 with value: 0.3592093758005386.
[I 2024-12-04 20:06:29,577] Trial 829 finished with value: 0.3592111913831787 and parameters: {'kernel_type': 'Matern', 'length_scale': 678.9961965425755, 'noise_level': 0.5005137705723485, 'constant_value': 1.1902463509199241, 'nu': 0.5}. Best is trial 448 with value: 0.3592093758005386.
[I 2024-12-04 20:06:29,632] Trial 830 finished with value: 0.3592111425873489 and parameters: {'kernel_type': 'Matern', 'length_scale': 3.854218589787554, 'noise_level': 0.04402952912753522, 'constant_value': 0.005177542764919236, 'nu': 0.5}. Best is trial 448 with value: 0.3592093758005386.
[I 2024-12-04 20:06:33,720] Trial 831 finished with value: 0.42868350532134525 and parameters: {'kernel_type': 'RBF', 'length_scale': 0.27317629956841344, 'noise_level': 9.028218285721323e-05, 'constant_value': 0.0013024894460860286, 'nu': 2.5}. Best is trial 448 with value: 0.3592093758005386.
[I 2024-12-04 20:06:34,601] Trial 833 finished with value: 0.4195659928870014 and parameters: {'kernel_type': 'Matern', 'length_scale': 43.31247105635156, 'noise_level': 0.14670726074858714, 'constant_value': 3.84055354863377, 'nu': 2.5}. Best is trial 448 with value: 0.3592093758005386.
[I 2024-12-04 20:06:35,694] Trial 832 finished with value: 1.0916567285245853 and parameters: {'kernel_type': 'RBF', 'length_scale': 79111.49698621884, 'noise_level': 0.002091343637620489, 'constant_value': 0.0012325145252712454, 'nu': 2.5}. Best is trial 448 with value: 0.3592093758005386.
[I 2024-12-04 20:06:39,025] Trial 835 finished with value: 1.0624161181505543 and parameters: {'kernel_type': 'Matern', 'length_scale': 0.04223818515431759, 'noise_level': 0.011828284792600004, 'constant_value': 1386.7002191465094, 'nu': 0.5}. Best is trial 448 with value: 0.3592093758005386.
[I 2024-12-04 20:06:39,302] Trial 834 finished with value: 0.35921123928603355 and parameters: {'kernel_type': 'Matern', 'length_scale': 54.48402953335766, 'noise_level': 0.14750592497011458, 'constant_value': 62150.47625578848, 'nu': 0.5}. Best is trial 448 with value: 0.3592093758005386.
[I 2024-12-04 20:06:40,538] Trial 836 finished with value: 0.35921160392593166 and parameters: {'kernel_type': 'Matern', 'length_scale': 5.2774481926175625, 'noise_level': 0.865659832386849, 'constant_value': 0.021514226709817924, 'nu': 0.5}. Best is trial 448 with value: 0.3592093758005386.
[I 2024-12-04 20:06:42,995] Trial 837 finished with value: 0.41956600509434144 and parameters: {'kernel_type': 'Matern', 'length_scale': 0.3361363916353679, 'noise_level': 0.38003965956004004, 'constant_value': 0.6359503296582847, 'nu': 2.5}. Best is trial 448 with value: 0.3592093758005386.
[I 2024-12-04 20:06:43,015] Trial 838 finished with value: 1.0624161172568645 and parameters: {'kernel_type': 'Matern', 'length_scale': 3.4196199006680576e-05, 'noise_level': 0.0003821937264871272, 'constant_value': 36.998954276538, 'nu': 0.5}. Best is trial 448 with value: 0.3592093758005386.
[I 2024-12-04 20:06:47,682] Trial 839 finished with value: 0.3592112294972603 and parameters: {'kernel_type': 'Matern', 'length_scale': 1941.6427955873332, 'noise_level': 0.8743485454563368, 'constant_value': 0.10696630491986128, 'nu': 0.5}. Best is trial 448 with value: 0.3592093758005386.
[I 2024-12-04 20:06:47,865] Trial 841 finished with value: 0.3592111794932258 and parameters: {'kernel_type': 'Matern', 'length_scale': 2.113107238138336, 'noise_level': 0.03917424294507227, 'constant_value': 1.9421796265659759, 'nu': 0.5}. Best is trial 448 with value: 0.3592093758005386.
[I 2024-12-04 20:06:49,427] Trial 840 finished with value: 0.3592110033001411 and parameters: {'kernel_type': 'Matern', 'length_scale': 0.20569961597065933, 'noise_level': 0.2521777128597714, 'constant_value': 63484.85223538637, 'nu': 0.5}. Best is trial 448 with value: 0.3592093758005386.
[I 2024-12-04 20:06:52,626] Trial 843 finished with value: 0.3592106610982969 and parameters: {'kernel_type': 'Matern', 'length_scale': 2.0231429233261995, 'noise_level': 0.864699394599837, 'constant_value': 273.77098089130374, 'nu': 0.5}. Best is trial 448 with value: 0.3592093758005386.
[I 2024-12-04 20:06:53,403] Trial 842 finished with value: 1.0624161172683797 and parameters: {'kernel_type': 'Matern', 'length_scale': 5561.555272999095, 'noise_level': 2.7147832276001284e-06, 'constant_value': 122.68369187894683, 'nu': 0.5}. Best is trial 448 with value: 0.3592093758005386.
[I 2024-12-04 20:06:54,282] Trial 844 finished with value: 0.3592112632632867 and parameters: {'kernel_type': 'Matern', 'length_scale': 2.8041660054940434, 'noise_level': 0.0012298572611553057, 'constant_value': 1780.736470561573, 'nu': 0.5}. Best is trial 448 with value: 0.3592093758005386.
[I 2024-12-04 20:06:55,244] Trial 845 finished with value: 1.0916558093274566 and parameters: {'kernel_type': 'Matern', 'length_scale': 0.00025169407856306573, 'noise_level': 0.10604132018248678, 'constant_value': 2.0825525347905165e-06, 'nu': 1.5}. Best is trial 448 with value: 0.3592093758005386.
[I 2024-12-04 20:06:58,199] Trial 846 finished with value: 1.062416117310169 and parameters: {'kernel_type': 'Matern', 'length_scale': 1809.7952128873862, 'noise_level': 0.005764509409759946, 'constant_value': 2.1590855835652083, 'nu': 0.5}. Best is trial 448 with value: 0.3592093758005386.
[I 2024-12-04 20:07:00,420] Trial 848 finished with value: 0.35921133538185496 and parameters: {'kernel_type': 'Matern', 'length_scale': 248.1529200349165, 'noise_level': 0.5788109463675749, 'constant_value': 55.71034525661665, 'nu': 0.5}. Best is trial 448 with value: 0.3592093758005386.
[I 2024-12-04 20:07:01,860] Trial 847 finished with value: 1.0624161173495783 and parameters: {'kernel_type': 'Matern', 'length_scale': 491.06160465969606, 'noise_level': 0.009051726241076839, 'constant_value': 0.01294162545504994, 'nu': 0.5}. Best is trial 448 with value: 0.3592093758005386.
[I 2024-12-04 20:07:06,213] Trial 850 finished with value: 0.41956600954714307 and parameters: {'kernel_type': 'Matern', 'length_scale': 1800.926219335913, 'noise_level': 0.2962504433749382, 'constant_value': 6349.211922596442, 'nu': 2.5}. Best is trial 448 with value: 0.3592093758005386.
[I 2024-12-04 20:07:07,203] Trial 851 finished with value: 0.3592113060417287 and parameters: {'kernel_type': 'Matern', 'length_scale': 0.6930073227149675, 'noise_level': 0.0019833134355586356, 'constant_value': 0.23240187976037466, 'nu': 0.5}. Best is trial 448 with value: 0.3592093758005386.
[I 2024-12-04 20:07:09,151] Trial 849 finished with value: 1.0624161173269686 and parameters: {'kernel_type': 'RBF', 'length_scale': 1.754049632362449e-05, 'noise_level': 0.18967350796119448, 'constant_value': 0.0004227146171652324, 'nu': 2.5}. Best is trial 448 with value: 0.3592093758005386.
[I 2024-12-04 20:07:11,261] Trial 852 finished with value: 0.3592112011568663 and parameters: {'kernel_type': 'Matern', 'length_scale': 5.645754884506409, 'noise_level': 0.0520543584672075, 'constant_value': 3.9644448396849294, 'nu': 0.5}. Best is trial 448 with value: 0.3592093758005386.
[I 2024-12-04 20:07:12,143] Trial 853 finished with value: 0.35921128028563293 and parameters: {'kernel_type': 'Matern', 'length_scale': 24.774521052728662, 'noise_level': 0.9861769769135004, 'constant_value': 34697.10079854142, 'nu': 0.5}. Best is trial 448 with value: 0.3592093758005386.
[I 2024-12-04 20:07:19,883] Trial 856 finished with value: 1.06241611748984 and parameters: {'kernel_type': 'Matern', 'length_scale': 0.013334650603656363, 'noise_level': 0.3646946575202157, 'constant_value': 397.2980161145657, 'nu': 1.5}. Best is trial 448 with value: 0.3592093758005386.
[I 2024-12-04 20:07:21,043] Trial 854 finished with value: 1.0624161174765274 and parameters: {'kernel_type': 'RBF', 'length_scale': 9837.385893793347, 'noise_level': 4.130709158727469e-10, 'constant_value': 16126.511055465386, 'nu': 2.5}. Best is trial 448 with value: 0.3592093758005386.
