[I 2024-12-04 12:04:51,972] Trial 803 finished with value: 0.2940064638123233 and parameters: {'n_estimators': 187, 'max_depth': 50, 'min_samples_split': 3, 'min_samples_leaf': 1, 'max_features': 'sqrt', 'bootstrap': False, 'criterion': 'squared_error'}. Best is trial 341 with value: 0.2909369124469028.
[I 2024-12-04 12:04:52,666] Trial 799 finished with value: 0.29508955185646657 and parameters: {'n_estimators': 273, 'max_depth': 50, 'min_samples_split': 3, 'min_samples_leaf': 1, 'max_features': 'sqrt', 'bootstrap': False, 'criterion': 'squared_error'}. Best is trial 341 with value: 0.2909369124469028.
[I 2024-12-04 12:04:53,312] Trial 790 finished with value: 0.39417860825950835 and parameters: {'n_estimators': 240, 'max_depth': 41, 'min_samples_split': 22, 'min_samples_leaf': 1, 'max_features': 'sqrt', 'bootstrap': False, 'criterion': 'absolute_error'}. Best is trial 341 with value: 0.2909369124469028.
[I 2024-12-04 12:04:53,353] Trial 775 finished with value: 0.5563949707966332 and parameters: {'n_estimators': 579, 'max_depth': 28, 'min_samples_split': 8, 'min_samples_leaf': 1, 'max_features': 'log2', 'bootstrap': False, 'criterion': 'absolute_error'}. Best is trial 341 with value: 0.2909369124469028.
[I 2024-12-04 12:04:53,747] Trial 787 finished with value: 0.2991343833875472 and parameters: {'n_estimators': 104, 'max_depth': 50, 'min_samples_split': 2, 'min_samples_leaf': 1, 'max_features': 'sqrt', 'bootstrap': False, 'criterion': 'squared_error'}. Best is trial 341 with value: 0.2909369124469028.
[I 2024-12-04 12:04:55,727] Trial 804 finished with value: 0.31043064818081034 and parameters: {'n_estimators': 193, 'max_depth': 42, 'min_samples_split': 4, 'min_samples_leaf': 1, 'max_features': 'sqrt', 'bootstrap': False, 'criterion': 'squared_error'}. Best is trial 341 with value: 0.2909369124469028.
[I 2024-12-04 12:04:56,935] Trial 809 finished with value: 0.9416727377909492 and parameters: {'n_estimators': 808, 'max_depth': 7, 'min_samples_split': 16, 'min_samples_leaf': 8, 'max_features': 'log2', 'bootstrap': False, 'criterion': 'squared_error'}. Best is trial 341 with value: 0.2909369124469028.
[I 2024-12-04 12:04:57,301] Trial 801 finished with value: 0.3067465393488457 and parameters: {'n_estimators': 243, 'max_depth': 43, 'min_samples_split': 4, 'min_samples_leaf': 1, 'max_features': 'sqrt', 'bootstrap': False, 'criterion': 'squared_error'}. Best is trial 341 with value: 0.2909369124469028.
[I 2024-12-04 12:04:58,168] Trial 802 finished with value: 0.6787792305356288 and parameters: {'n_estimators': 196, 'max_depth': 29, 'min_samples_split': 3, 'min_samples_leaf': 4, 'max_features': 'sqrt', 'bootstrap': True, 'criterion': 'absolute_error'}. Best is trial 341 with value: 0.2909369124469028.
[I 2024-12-04 12:04:58,178] Trial 798 finished with value: 0.8465372203423944 and parameters: {'n_estimators': 612, 'max_depth': 22, 'min_samples_split': 2, 'min_samples_leaf': 13, 'max_features': 'sqrt', 'bootstrap': False, 'criterion': 'absolute_error'}. Best is trial 341 with value: 0.2909369124469028.
[I 2024-12-04 12:04:59,420] Trial 813 finished with value: 0.9103646708645198 and parameters: {'n_estimators': 125, 'max_depth': 41, 'min_samples_split': 8, 'min_samples_leaf': 13, 'max_features': 'sqrt', 'bootstrap': True, 'criterion': 'absolute_error'}. Best is trial 341 with value: 0.2909369124469028.
[I 2024-12-04 12:04:59,569] Trial 811 finished with value: 0.364122673378439 and parameters: {'n_estimators': 508, 'max_depth': 29, 'min_samples_split': 2, 'min_samples_leaf': 1, 'max_features': 'sqrt', 'bootstrap': False, 'criterion': 'squared_error'}. Best is trial 341 with value: 0.2909369124469028.
[I 2024-12-04 12:04:59,728] Trial 796 finished with value: 0.4946642801576556 and parameters: {'n_estimators': 533, 'max_depth': 32, 'min_samples_split': 14, 'min_samples_leaf': 2, 'max_features': 'sqrt', 'bootstrap': True, 'criterion': 'squared_error'}. Best is trial 341 with value: 0.2909369124469028.
[I 2024-12-04 12:04:59,999] Trial 807 finished with value: 0.44078306530737016 and parameters: {'n_estimators': 632, 'max_depth': 50, 'min_samples_split': 3, 'min_samples_leaf': 2, 'max_features': 'sqrt', 'bootstrap': False, 'criterion': 'squared_error'}. Best is trial 341 with value: 0.2909369124469028.
[I 2024-12-04 12:05:00,018] Trial 814 finished with value: 0.30417217049907946 and parameters: {'n_estimators': 209, 'max_depth': 50, 'min_samples_split': 5, 'min_samples_leaf': 1, 'max_features': 'sqrt', 'bootstrap': False, 'criterion': 'squared_error'}. Best is trial 341 with value: 0.2909369124469028.
[I 2024-12-04 12:05:00,196] Trial 800 finished with value: 0.7807405908911743 and parameters: {'n_estimators': 534, 'max_depth': 14, 'min_samples_split': 2, 'min_samples_leaf': 2, 'max_features': 'log2', 'bootstrap': False, 'criterion': 'absolute_error'}. Best is trial 341 with value: 0.2909369124469028.
[I 2024-12-04 12:05:00,455] Trial 808 finished with value: 0.29399033585735895 and parameters: {'n_estimators': 189, 'max_depth': 50, 'min_samples_split': 3, 'min_samples_leaf': 1, 'max_features': 'sqrt', 'bootstrap': False, 'criterion': 'squared_error'}. Best is trial 341 with value: 0.2909369124469028.
[I 2024-12-04 12:05:01,202] Trial 805 finished with value: 0.4014407708854083 and parameters: {'n_estimators': 594, 'max_depth': 44, 'min_samples_split': 19, 'min_samples_leaf': 4, 'max_features': None, 'bootstrap': True, 'criterion': 'squared_error'}. Best is trial 341 with value: 0.2909369124469028.
[I 2024-12-04 12:05:01,797] Trial 797 finished with value: 0.49987207644546583 and parameters: {'n_estimators': 996, 'max_depth': 39, 'min_samples_split': 4, 'min_samples_leaf': 12, 'max_features': None, 'bootstrap': False, 'criterion': 'squared_error'}. Best is trial 341 with value: 0.2909369124469028.
[I 2024-12-04 12:05:02,461] Trial 818 finished with value: 0.31076397123477395 and parameters: {'n_estimators': 192, 'max_depth': 41, 'min_samples_split': 2, 'min_samples_leaf': 1, 'max_features': 'sqrt', 'bootstrap': False, 'criterion': 'squared_error'}. Best is trial 341 with value: 0.2909369124469028.
[I 2024-12-04 12:05:02,576] Trial 817 finished with value: 0.4442973888850219 and parameters: {'n_estimators': 240, 'max_depth': 46, 'min_samples_split': 2, 'min_samples_leaf': 2, 'max_features': 'sqrt', 'bootstrap': False, 'criterion': 'squared_error'}. Best is trial 341 with value: 0.2909369124469028.
[I 2024-12-04 12:05:02,985] Trial 812 finished with value: 0.3095358339969313 and parameters: {'n_estimators': 450, 'max_depth': 42, 'min_samples_split': 2, 'min_samples_leaf': 1, 'max_features': 'sqrt', 'bootstrap': False, 'criterion': 'squared_error'}. Best is trial 341 with value: 0.2909369124469028.
[I 2024-12-04 12:05:04,692] Trial 810 finished with value: 0.4447293167075675 and parameters: {'n_estimators': 230, 'max_depth': 43, 'min_samples_split': 3, 'min_samples_leaf': 2, 'max_features': 'sqrt', 'bootstrap': False, 'criterion': 'squared_error'}. Best is trial 341 with value: 0.2909369124469028.
[I 2024-12-04 12:05:04,992] Trial 820 finished with value: 0.2990839446688627 and parameters: {'n_estimators': 140, 'max_depth': 50, 'min_samples_split': 4, 'min_samples_leaf': 1, 'max_features': 'sqrt', 'bootstrap': False, 'criterion': 'squared_error'}. Best is trial 341 with value: 0.2909369124469028.
[I 2024-12-04 12:05:05,659] Trial 816 finished with value: 0.3124714932861078 and parameters: {'n_estimators': 101, 'max_depth': 42, 'min_samples_split': 4, 'min_samples_leaf': 1, 'max_features': 'sqrt', 'bootstrap': False, 'criterion': 'squared_error'}. Best is trial 341 with value: 0.2909369124469028.
[I 2024-12-04 12:05:07,655] Trial 806 finished with value: 0.3011496889265447 and parameters: {'n_estimators': 474, 'max_depth': 49, 'min_samples_split': 4, 'min_samples_leaf': 1, 'max_features': 'sqrt', 'bootstrap': False, 'criterion': 'squared_error'}. Best is trial 341 with value: 0.2909369124469028.
[I 2024-12-04 12:05:07,856] Trial 823 finished with value: 0.3000111261445527 and parameters: {'n_estimators': 260, 'max_depth': 50, 'min_samples_split': 4, 'min_samples_leaf': 1, 'max_features': 'sqrt', 'bootstrap': False, 'criterion': 'squared_error'}. Best is trial 341 with value: 0.2909369124469028.
[I 2024-12-04 12:05:08,325] Trial 827 finished with value: 0.41625645769246683 and parameters: {'n_estimators': 105, 'max_depth': 47, 'min_samples_split': 3, 'min_samples_leaf': 2, 'max_features': None, 'bootstrap': False, 'criterion': 'squared_error'}. Best is trial 341 with value: 0.2909369124469028.
[I 2024-12-04 12:05:09,852] Trial 822 finished with value: 0.44669052407094384 and parameters: {'n_estimators': 148, 'max_depth': 49, 'min_samples_split': 2, 'min_samples_leaf': 2, 'max_features': 'sqrt', 'bootstrap': False, 'criterion': 'squared_error'}. Best is trial 341 with value: 0.2909369124469028.
[I 2024-12-04 12:05:10,018] Trial 838 finished with value: 0.4448363764641883 and parameters: {'n_estimators': 174, 'max_depth': 50, 'min_samples_split': 4, 'min_samples_leaf': 2, 'max_features': 'sqrt', 'bootstrap': False, 'criterion': 'squared_error'}. Best is trial 341 with value: 0.2909369124469028.
[I 2024-12-04 12:05:10,487] Trial 836 finished with value: 0.3097510131394679 and parameters: {'n_estimators': 116, 'max_depth': 50, 'min_samples_split': 6, 'min_samples_leaf': 1, 'max_features': 'sqrt', 'bootstrap': False, 'criterion': 'squared_error'}. Best is trial 341 with value: 0.2909369124469028.
[I 2024-12-04 12:05:10,531] Trial 831 finished with value: 0.31760146227609626 and parameters: {'n_estimators': 323, 'max_depth': 43, 'min_samples_split': 6, 'min_samples_leaf': 1, 'max_features': 'sqrt', 'bootstrap': False, 'criterion': 'squared_error'}. Best is trial 341 with value: 0.2909369124469028.
[I 2024-12-04 12:05:10,818] Trial 826 finished with value: 0.30167634747556 and parameters: {'n_estimators': 365, 'max_depth': 45, 'min_samples_split': 2, 'min_samples_leaf': 1, 'max_features': 'sqrt', 'bootstrap': False, 'criterion': 'squared_error'}. Best is trial 341 with value: 0.2909369124469028.
[I 2024-12-04 12:05:11,397] Trial 824 finished with value: 0.4162995536206559 and parameters: {'n_estimators': 330, 'max_depth': 48, 'min_samples_split': 3, 'min_samples_leaf': 2, 'max_features': None, 'bootstrap': False, 'criterion': 'squared_error'}. Best is trial 341 with value: 0.2909369124469028.
[I 2024-12-04 12:05:11,804] Trial 821 finished with value: 0.5380365359266815 and parameters: {'n_estimators': 218, 'max_depth': 47, 'min_samples_split': 8, 'min_samples_leaf': 12, 'max_features': None, 'bootstrap': True, 'criterion': 'absolute_error'}. Best is trial 341 with value: 0.2909369124469028.
[I 2024-12-04 12:05:11,897] Trial 830 finished with value: 0.3118520967254375 and parameters: {'n_estimators': 102, 'max_depth': 41, 'min_samples_split': 2, 'min_samples_leaf': 1, 'max_features': 'sqrt', 'bootstrap': False, 'criterion': 'squared_error'}. Best is trial 341 with value: 0.2909369124469028.
[I 2024-12-04 12:05:12,531] Trial 828 finished with value: 0.3812556480847358 and parameters: {'n_estimators': 181, 'max_depth': 50, 'min_samples_split': 3, 'min_samples_leaf': 1, 'max_features': None, 'bootstrap': False, 'criterion': 'squared_error'}. Best is trial 341 with value: 0.2909369124469028.
[I 2024-12-04 12:05:13,685] Trial 819 finished with value: 0.34044787723314685 and parameters: {'n_estimators': 215, 'max_depth': 49, 'min_samples_split': 4, 'min_samples_leaf': 1, 'max_features': 'sqrt', 'bootstrap': True, 'criterion': 'absolute_error'}. Best is trial 341 with value: 0.2909369124469028.
[I 2024-12-04 12:05:14,816] Trial 788 finished with value: 0.4588562133392198 and parameters: {'n_estimators': 283, 'max_depth': 15, 'min_samples_split': 9, 'min_samples_leaf': 4, 'max_features': None, 'bootstrap': False, 'criterion': 'absolute_error'}. Best is trial 341 with value: 0.2909369124469028.
[I 2024-12-04 12:05:14,964] Trial 835 finished with value: 0.30256880478021236 and parameters: {'n_estimators': 242, 'max_depth': 42, 'min_samples_split': 3, 'min_samples_leaf': 1, 'max_features': 'sqrt', 'bootstrap': False, 'criterion': 'squared_error'}. Best is trial 341 with value: 0.2909369124469028.
[I 2024-12-04 12:05:15,971] Trial 833 finished with value: 0.299386006934066 and parameters: {'n_estimators': 203, 'max_depth': 43, 'min_samples_split': 3, 'min_samples_leaf': 1, 'max_features': 'sqrt', 'bootstrap': False, 'criterion': 'squared_error'}. Best is trial 341 with value: 0.2909369124469028.
[I 2024-12-04 12:05:15,979] Trial 834 finished with value: 0.2987950896138942 and parameters: {'n_estimators': 280, 'max_depth': 50, 'min_samples_split': 2, 'min_samples_leaf': 1, 'max_features': 'sqrt', 'bootstrap': False, 'criterion': 'squared_error'}. Best is trial 341 with value: 0.2909369124469028.
[I 2024-12-04 12:05:16,227] Trial 837 finished with value: 0.3002022970191509 and parameters: {'n_estimators': 257, 'max_depth': 43, 'min_samples_split': 3, 'min_samples_leaf': 1, 'max_features': 'sqrt', 'bootstrap': False, 'criterion': 'squared_error'}. Best is trial 341 with value: 0.2909369124469028.
[I 2024-12-04 12:05:16,620] Trial 846 finished with value: 0.44391205747018014 and parameters: {'n_estimators': 101, 'max_depth': 50, 'min_samples_split': 3, 'min_samples_leaf': 2, 'max_features': 'sqrt', 'bootstrap': False, 'criterion': 'squared_error'}. Best is trial 341 with value: 0.2909369124469028.
[I 2024-12-04 12:05:16,637] Trial 829 finished with value: 0.2950088377461919 and parameters: {'n_estimators': 271, 'max_depth': 50, 'min_samples_split': 3, 'min_samples_leaf': 1, 'max_features': 'sqrt', 'bootstrap': False, 'criterion': 'squared_error'}. Best is trial 341 with value: 0.2909369124469028.
[I 2024-12-04 12:05:17,282] Trial 832 finished with value: 0.47148835682038437 and parameters: {'n_estimators': 429, 'max_depth': 45, 'min_samples_split': 16, 'min_samples_leaf': 1, 'max_features': 'log2', 'bootstrap': True, 'criterion': 'squared_error'}. Best is trial 341 with value: 0.2909369124469028.
[I 2024-12-04 12:05:18,476] Trial 845 finished with value: 0.29906847277907667 and parameters: {'n_estimators': 230, 'max_depth': 50, 'min_samples_split': 2, 'min_samples_leaf': 1, 'max_features': 'sqrt', 'bootstrap': False, 'criterion': 'squared_error'}. Best is trial 341 with value: 0.2909369124469028.
[I 2024-12-04 12:05:18,728] Trial 847 finished with value: 0.29949932997069345 and parameters: {'n_estimators': 305, 'max_depth': 50, 'min_samples_split': 4, 'min_samples_leaf': 1, 'max_features': 'sqrt', 'bootstrap': False, 'criterion': 'squared_error'}. Best is trial 341 with value: 0.2909369124469028.
[I 2024-12-04 12:05:19,637] Trial 841 finished with value: 0.2982265471112633 and parameters: {'n_estimators': 318, 'max_depth': 50, 'min_samples_split': 2, 'min_samples_leaf': 1, 'max_features': 'sqrt', 'bootstrap': False, 'criterion': 'squared_error'}. Best is trial 341 with value: 0.2909369124469028.
[I 2024-12-04 12:05:19,782] Trial 850 finished with value: 0.29400313927698757 and parameters: {'n_estimators': 102, 'max_depth': 50, 'min_samples_split': 3, 'min_samples_leaf': 1, 'max_features': 'sqrt', 'bootstrap': False, 'criterion': 'squared_error'}. Best is trial 341 with value: 0.2909369124469028.
[I 2024-12-04 12:05:20,793] Trial 848 finished with value: 0.4423235973492379 and parameters: {'n_estimators': 242, 'max_depth': 50, 'min_samples_split': 6, 'min_samples_leaf': 2, 'max_features': 'sqrt', 'bootstrap': False, 'criterion': 'squared_error'}. Best is trial 341 with value: 0.2909369124469028.
[I 2024-12-04 12:05:20,794] Trial 825 finished with value: 0.30922715537642453 and parameters: {'n_estimators': 314, 'max_depth': 48, 'min_samples_split': 2, 'min_samples_leaf': 1, 'max_features': 'sqrt', 'bootstrap': False, 'criterion': 'absolute_error'}. Best is trial 341 with value: 0.2909369124469028.
[I 2024-12-04 12:05:20,938] Trial 851 finished with value: 0.30467261948861224 and parameters: {'n_estimators': 134, 'max_depth': 43, 'min_samples_split': 4, 'min_samples_leaf': 1, 'max_features': 'sqrt', 'bootstrap': False, 'criterion': 'squared_error'}. Best is trial 341 with value: 0.2909369124469028.
[I 2024-12-04 12:05:22,077] Trial 840 finished with value: 0.7879114415705611 and parameters: {'n_estimators': 953, 'max_depth': 24, 'min_samples_split': 6, 'min_samples_leaf': 2, 'max_features': 'log2', 'bootstrap': True, 'criterion': 'squared_error'}. Best is trial 341 with value: 0.2909369124469028.
[I 2024-12-04 12:05:22,083] Trial 842 finished with value: 0.7122387499384916 and parameters: {'n_estimators': 922, 'max_depth': 17, 'min_samples_split': 5, 'min_samples_leaf': 7, 'max_features': 'sqrt', 'bootstrap': False, 'criterion': 'squared_error'}. Best is trial 341 with value: 0.2909369124469028.
[I 2024-12-04 12:05:22,854] Trial 843 finished with value: 0.9170258610824816 and parameters: {'n_estimators': 462, 'max_depth': 28, 'min_samples_split': 8, 'min_samples_leaf': 6, 'max_features': 'log2', 'bootstrap': False, 'criterion': 'absolute_error'}. Best is trial 341 with value: 0.2909369124469028.
[I 2024-12-04 12:05:22,921] Trial 839 finished with value: 0.2944526424845355 and parameters: {'n_estimators': 407, 'max_depth': 50, 'min_samples_split': 3, 'min_samples_leaf': 1, 'max_features': 'sqrt', 'bootstrap': False, 'criterion': 'squared_error'}. Best is trial 341 with value: 0.2909369124469028.
[I 2024-12-04 12:05:23,915] Trial 853 finished with value: 0.2968463615289277 and parameters: {'n_estimators': 168, 'max_depth': 50, 'min_samples_split': 2, 'min_samples_leaf': 1, 'max_features': 'sqrt', 'bootstrap': False, 'criterion': 'squared_error'}. Best is trial 341 with value: 0.2909369124469028.
[I 2024-12-04 12:05:23,955] Trial 856 finished with value: 0.2984843144070667 and parameters: {'n_estimators': 173, 'max_depth': 42, 'min_samples_split': 3, 'min_samples_leaf': 1, 'max_features': 'sqrt', 'bootstrap': False, 'criterion': 'squared_error'}. Best is trial 341 with value: 0.2909369124469028.
[I 2024-12-04 12:05:24,136] Trial 852 finished with value: 0.3605790442399264 and parameters: {'n_estimators': 290, 'max_depth': 30, 'min_samples_split': 4, 'min_samples_leaf': 1, 'max_features': 'sqrt', 'bootstrap': False, 'criterion': 'squared_error'}. Best is trial 341 with value: 0.2909369124469028.
[I 2024-12-04 12:05:24,325] Trial 854 finished with value: 0.4466868356438023 and parameters: {'n_estimators': 115, 'max_depth': 42, 'min_samples_split': 3, 'min_samples_leaf': 2, 'max_features': 'sqrt', 'bootstrap': False, 'criterion': 'squared_error'}. Best is trial 341 with value: 0.2909369124469028.
[I 2024-12-04 12:05:27,273] Trial 860 finished with value: 0.3014418036642228 and parameters: {'n_estimators': 464, 'max_depth': 43, 'min_samples_split': 3, 'min_samples_leaf': 1, 'max_features': 'sqrt', 'bootstrap': False, 'criterion': 'squared_error'}. Best is trial 341 with value: 0.2909369124469028.
[I 2024-12-04 12:05:28,940] Trial 865 finished with value: 0.32611538388614375 and parameters: {'n_estimators': 236, 'max_depth': 43, 'min_samples_split': 3, 'min_samples_leaf': 1, 'max_features': 'sqrt', 'bootstrap': True, 'criterion': 'squared_error'}. Best is trial 341 with value: 0.2909369124469028.
[I 2024-12-04 12:05:28,941] Trial 859 finished with value: 0.3153842665394466 and parameters: {'n_estimators': 365, 'max_depth': 43, 'min_samples_split': 5, 'min_samples_leaf': 1, 'max_features': 'sqrt', 'bootstrap': False, 'criterion': 'squared_error'}. Best is trial 341 with value: 0.2909369124469028.
[I 2024-12-04 12:05:31,409] Trial 855 finished with value: 0.29534602590032577 and parameters: {'n_estimators': 246, 'max_depth': 50, 'min_samples_split': 3, 'min_samples_leaf': 1, 'max_features': 'sqrt', 'bootstrap': False, 'criterion': 'squared_error'}. Best is trial 341 with value: 0.2909369124469028.
[I 2024-12-04 12:05:33,938] Trial 862 finished with value: 0.8111172230269758 and parameters: {'n_estimators': 206, 'max_depth': 11, 'min_samples_split': 2, 'min_samples_leaf': 10, 'max_features': 'sqrt', 'bootstrap': False, 'criterion': 'absolute_error'}. Best is trial 341 with value: 0.2909369124469028.
[I 2024-12-04 12:05:34,914] Trial 867 finished with value: 0.44432523129318097 and parameters: {'n_estimators': 279, 'max_depth': 44, 'min_samples_split': 3, 'min_samples_leaf': 2, 'max_features': 'sqrt', 'bootstrap': False, 'criterion': 'squared_error'}. Best is trial 341 with value: 0.2909369124469028.
[I 2024-12-04 12:05:36,194] Trial 864 finished with value: 0.30637874571491425 and parameters: {'n_estimators': 679, 'max_depth': 49, 'min_samples_split': 5, 'min_samples_leaf': 1, 'max_features': 'sqrt', 'bootstrap': False, 'criterion': 'squared_error'}. Best is trial 341 with value: 0.2909369124469028.
[I 2024-12-04 12:05:36,246] Trial 870 finished with value: 0.2927723473941776 and parameters: {'n_estimators': 324, 'max_depth': 49, 'min_samples_split': 3, 'min_samples_leaf': 1, 'max_features': 'sqrt', 'bootstrap': False, 'criterion': 'squared_error'}. Best is trial 341 with value: 0.2909369124469028.
[I 2024-12-04 12:05:36,837] Trial 844 finished with value: 0.325376150258267 and parameters: {'n_estimators': 308, 'max_depth': 41, 'min_samples_split': 4, 'min_samples_leaf': 1, 'max_features': 'sqrt', 'bootstrap': False, 'criterion': 'absolute_error'}. Best is trial 341 with value: 0.2909369124469028.
[I 2024-12-04 12:05:37,357] Trial 869 finished with value: 0.29926715305281953 and parameters: {'n_estimators': 293, 'max_depth': 50, 'min_samples_split': 4, 'min_samples_leaf': 1, 'max_features': 'sqrt', 'bootstrap': False, 'criterion': 'squared_error'}. Best is trial 341 with value: 0.2909369124469028.
[I 2024-12-04 12:05:37,425] Trial 857 finished with value: 0.30011994233605743 and parameters: {'n_estimators': 229, 'max_depth': 50, 'min_samples_split': 4, 'min_samples_leaf': 1, 'max_features': 'sqrt', 'bootstrap': False, 'criterion': 'squared_error'}. Best is trial 341 with value: 0.2909369124469028.
