[I 2024-12-04 12:30:27,250] Trial 864 finished with value: 0.37164268059729333 and parameters: {'n_estimators': 1277, 'learning_rate': 0.0971758672850588, 'max_depth': 7, 'min_samples_split': 5, 'min_samples_leaf': 4, 'subsample': 0.8760133093086642, 'max_features': None}. Best is trial 428 with value: 0.31740361133065975.
[I 2024-12-04 12:30:28,157] Trial 871 finished with value: 0.33533304284991017 and parameters: {'n_estimators': 1098, 'learning_rate': 0.06787624255675456, 'max_depth': 9, 'min_samples_split': 7, 'min_samples_leaf': 2, 'subsample': 0.6531034456505228, 'max_features': None}. Best is trial 428 with value: 0.31740361133065975.
[I 2024-12-04 12:30:29,950] Trial 875 finished with value: 0.3989242625482999 and parameters: {'n_estimators': 1039, 'learning_rate': 0.08818680435020769, 'max_depth': 5, 'min_samples_split': 7, 'min_samples_leaf': 1, 'subsample': 0.7986673034628571, 'max_features': None}. Best is trial 428 with value: 0.31740361133065975.
[I 2024-12-04 12:30:30,003] Trial 887 finished with value: 0.5666887225265104 and parameters: {'n_estimators': 602, 'learning_rate': 0.013981464096276668, 'max_depth': 8, 'min_samples_split': 11, 'min_samples_leaf': 10, 'subsample': 0.7362237713952544, 'max_features': None}. Best is trial 428 with value: 0.31740361133065975.
[I 2024-12-04 12:30:30,968] Trial 870 finished with value: 0.6089889348479147 and parameters: {'n_estimators': 1444, 'learning_rate': 0.03705020146621056, 'max_depth': 4, 'min_samples_split': 8, 'min_samples_leaf': 7, 'subsample': 0.6399636497007295, 'max_features': 'log2'}. Best is trial 428 with value: 0.31740361133065975.
[I 2024-12-04 12:30:31,600] Trial 874 finished with value: 0.4023518526008141 and parameters: {'n_estimators': 1094, 'learning_rate': 0.06315677502254669, 'max_depth': 7, 'min_samples_split': 5, 'min_samples_leaf': 3, 'subsample': 0.756381225173696, 'max_features': None}. Best is trial 428 with value: 0.31740361133065975.
[I 2024-12-04 12:30:32,215] Trial 883 finished with value: 0.3832880715978381 and parameters: {'n_estimators': 786, 'learning_rate': 0.05476078265087987, 'max_depth': 8, 'min_samples_split': 2, 'min_samples_leaf': 1, 'subsample': 0.7209639802072401, 'max_features': None}. Best is trial 428 with value: 0.31740361133065975.
[I 2024-12-04 12:30:35,441] Trial 877 finished with value: 0.3280384203274968 and parameters: {'n_estimators': 1087, 'learning_rate': 0.06707348374954675, 'max_depth': 6, 'min_samples_split': 5, 'min_samples_leaf': 2, 'subsample': 0.8134741091003056, 'max_features': None}. Best is trial 428 with value: 0.31740361133065975.
[I 2024-12-04 12:30:37,001] Trial 872 finished with value: 0.3656178329134985 and parameters: {'n_estimators': 1283, 'learning_rate': 0.09512826477437679, 'max_depth': 9, 'min_samples_split': 4, 'min_samples_leaf': 1, 'subsample': 0.677566000891923, 'max_features': None}. Best is trial 428 with value: 0.31740361133065975.
[I 2024-12-04 12:30:37,009] Trial 889 finished with value: 0.8728892861269456 and parameters: {'n_estimators': 745, 'learning_rate': 0.010841806697207908, 'max_depth': 9, 'min_samples_split': 19, 'min_samples_leaf': 5, 'subsample': 0.650720839735031, 'max_features': 'log2'}. Best is trial 428 with value: 0.31740361133065975.
[I 2024-12-04 12:30:37,945] Trial 876 finished with value: 0.6542449652859972 and parameters: {'n_estimators': 1468, 'learning_rate': 0.018953173025023726, 'max_depth': 9, 'min_samples_split': 8, 'min_samples_leaf': 6, 'subsample': 0.6501979169679177, 'max_features': 'log2'}. Best is trial 428 with value: 0.31740361133065975.
[I 2024-12-04 12:30:39,447] Trial 880 finished with value: 0.40104647224985457 and parameters: {'n_estimators': 1122, 'learning_rate': 0.09875411699438424, 'max_depth': 6, 'min_samples_split': 9, 'min_samples_leaf': 1, 'subsample': 0.8349980730837924, 'max_features': None}. Best is trial 428 with value: 0.31740361133065975.
[I 2024-12-04 12:30:40,187] Trial 904 finished with value: 0.47782853427908334 and parameters: {'n_estimators': 232, 'learning_rate': 0.020515925843360223, 'max_depth': 6, 'min_samples_split': 15, 'min_samples_leaf': 6, 'subsample': 0.9151519934195417, 'max_features': None}. Best is trial 428 with value: 0.31740361133065975.
[I 2024-12-04 12:30:40,545] Trial 881 finished with value: 0.379744958171362 and parameters: {'n_estimators': 1099, 'learning_rate': 0.0910051929796084, 'max_depth': 8, 'min_samples_split': 9, 'min_samples_leaf': 3, 'subsample': 0.7706975709585265, 'max_features': None}. Best is trial 428 with value: 0.31740361133065975.
[I 2024-12-04 12:30:41,747] Trial 891 finished with value: 0.36774667270183503 and parameters: {'n_estimators': 696, 'learning_rate': 0.05533135799350386, 'max_depth': 9, 'min_samples_split': 6, 'min_samples_leaf': 1, 'subsample': 0.6102349513284823, 'max_features': None}. Best is trial 428 with value: 0.31740361133065975.
[I 2024-12-04 12:30:41,939] Trial 885 finished with value: 0.5600511478846353 and parameters: {'n_estimators': 1075, 'learning_rate': 0.020569078983707568, 'max_depth': 6, 'min_samples_split': 8, 'min_samples_leaf': 9, 'subsample': 0.6138601033753935, 'max_features': None}. Best is trial 428 with value: 0.31740361133065975.
[I 2024-12-04 12:30:41,941] Trial 907 finished with value: 0.66372596653004 and parameters: {'n_estimators': 196, 'learning_rate': 0.011043392626161197, 'max_depth': 3, 'min_samples_split': 19, 'min_samples_leaf': 5, 'subsample': 0.7083098963343867, 'max_features': None}. Best is trial 428 with value: 0.31740361133065975.
[I 2024-12-04 12:30:42,757] Trial 879 finished with value: 0.3844446676870059 and parameters: {'n_estimators': 1247, 'learning_rate': 0.07002133482415525, 'max_depth': 6, 'min_samples_split': 7, 'min_samples_leaf': 3, 'subsample': 0.6583528601267573, 'max_features': None}. Best is trial 428 with value: 0.31740361133065975.
[I 2024-12-04 12:30:45,118] Trial 878 finished with value: 0.37740767920540874 and parameters: {'n_estimators': 1160, 'learning_rate': 0.08831719239418694, 'max_depth': 8, 'min_samples_split': 11, 'min_samples_leaf': 4, 'subsample': 0.8874452863403892, 'max_features': None}. Best is trial 428 with value: 0.31740361133065975.
[I 2024-12-04 12:30:47,032] Trial 899 finished with value: 0.4616369425473177 and parameters: {'n_estimators': 635, 'learning_rate': 0.05159649658439154, 'max_depth': 5, 'min_samples_split': 20, 'min_samples_leaf': 3, 'subsample': 0.6446523115689472, 'max_features': 'sqrt'}. Best is trial 428 with value: 0.31740361133065975.
[I 2024-12-04 12:30:48,389] Trial 888 finished with value: 0.3771994382749066 and parameters: {'n_estimators': 1093, 'learning_rate': 0.06878345446171219, 'max_depth': 9, 'min_samples_split': 4, 'min_samples_leaf': 4, 'subsample': 0.6884942746201175, 'max_features': None}. Best is trial 428 with value: 0.31740361133065975.
[I 2024-12-04 12:30:48,407] Trial 882 finished with value: 0.3276400915988869 and parameters: {'n_estimators': 1263, 'learning_rate': 0.048022625938391586, 'max_depth': 8, 'min_samples_split': 2, 'min_samples_leaf': 2, 'subsample': 0.8267492286446692, 'max_features': None}. Best is trial 428 with value: 0.31740361133065975.
[I 2024-12-04 12:30:52,365] Trial 884 finished with value: 0.3903461226463561 and parameters: {'n_estimators': 1349, 'learning_rate': 0.08745522640229104, 'max_depth': 7, 'min_samples_split': 5, 'min_samples_leaf': 3, 'subsample': 0.775060562669249, 'max_features': None}. Best is trial 428 with value: 0.31740361133065975.
[I 2024-12-04 12:30:54,577] Trial 890 finished with value: 0.3802760767050918 and parameters: {'n_estimators': 1118, 'learning_rate': 0.060022304675391755, 'max_depth': 8, 'min_samples_split': 2, 'min_samples_leaf': 3, 'subsample': 0.7248220450792442, 'max_features': None}. Best is trial 428 with value: 0.31740361133065975.
[I 2024-12-04 12:30:55,854] Trial 892 finished with value: 0.4464968212885664 and parameters: {'n_estimators': 1245, 'learning_rate': 0.05362686474639657, 'max_depth': 10, 'min_samples_split': 19, 'min_samples_leaf': 7, 'subsample': 0.781432182676591, 'max_features': 'sqrt'}. Best is trial 428 with value: 0.31740361133065975.
[I 2024-12-04 12:30:56,718] Trial 898 finished with value: 0.3781233411682281 and parameters: {'n_estimators': 893, 'learning_rate': 0.0766005928674376, 'max_depth': 9, 'min_samples_split': 8, 'min_samples_leaf': 3, 'subsample': 0.693746888681459, 'max_features': None}. Best is trial 428 with value: 0.31740361133065975.
[I 2024-12-04 12:30:58,281] Trial 920 finished with value: 0.7895093091078008 and parameters: {'n_estimators': 322, 'learning_rate': 0.01056159124144775, 'max_depth': 12, 'min_samples_split': 6, 'min_samples_leaf': 2, 'subsample': 0.8070663512890748, 'max_features': 'log2'}. Best is trial 428 with value: 0.31740361133065975.
[I 2024-12-04 12:30:58,456] Trial 896 finished with value: 0.5190125975090669 and parameters: {'n_estimators': 1126, 'learning_rate': 0.03916025583963425, 'max_depth': 7, 'min_samples_split': 7, 'min_samples_leaf': 4, 'subsample': 0.6230445945842457, 'max_features': 'log2'}. Best is trial 428 with value: 0.31740361133065975.
[I 2024-12-04 12:30:58,752] Trial 893 finished with value: 0.3825650692846634 and parameters: {'n_estimators': 1090, 'learning_rate': 0.04725776913357133, 'max_depth': 10, 'min_samples_split': 6, 'min_samples_leaf': 1, 'subsample': 0.7342177076327083, 'max_features': None}. Best is trial 428 with value: 0.31740361133065975.
[I 2024-12-04 12:30:59,218] Trial 903 finished with value: 0.3895207162745512 and parameters: {'n_estimators': 787, 'learning_rate': 0.09307793937653529, 'max_depth': 8, 'min_samples_split': 12, 'min_samples_leaf': 1, 'subsample': 0.8668599039351396, 'max_features': None}. Best is trial 428 with value: 0.31740361133065975.
[I 2024-12-04 12:30:59,529] Trial 902 finished with value: 0.3715423680189746 and parameters: {'n_estimators': 1034, 'learning_rate': 0.09798739605847848, 'max_depth': 8, 'min_samples_split': 7, 'min_samples_leaf': 1, 'subsample': 0.7290199833996758, 'max_features': 'log2'}. Best is trial 428 with value: 0.31740361133065975.
[I 2024-12-04 12:31:00,406] Trial 895 finished with value: 0.4165595971988529 and parameters: {'n_estimators': 1284, 'learning_rate': 0.024614212268582424, 'max_depth': 12, 'min_samples_split': 6, 'min_samples_leaf': 5, 'subsample': 0.9471476493771177, 'max_features': 'sqrt'}. Best is trial 428 with value: 0.31740361133065975.
[I 2024-12-04 12:31:01,181] Trial 909 finished with value: 0.4189300732723006 and parameters: {'n_estimators': 772, 'learning_rate': 0.022444184334214228, 'max_depth': 4, 'min_samples_split': 3, 'min_samples_leaf': 3, 'subsample': 0.6037579548446633, 'max_features': None}. Best is trial 428 with value: 0.31740361133065975.
[I 2024-12-04 12:31:02,506] Trial 926 finished with value: 1.0269182862086383 and parameters: {'n_estimators': 137, 'learning_rate': 0.02497151272156068, 'max_depth': 3, 'min_samples_split': 10, 'min_samples_leaf': 8, 'subsample': 0.7915961883116285, 'max_features': 'log2'}. Best is trial 428 with value: 0.31740361133065975.
[I 2024-12-04 12:31:02,881] Trial 908 finished with value: 0.3811082613596189 and parameters: {'n_estimators': 750, 'learning_rate': 0.05353946354281532, 'max_depth': 8, 'min_samples_split': 8, 'min_samples_leaf': 1, 'subsample': 0.6671286080203856, 'max_features': None}. Best is trial 428 with value: 0.31740361133065975.
[I 2024-12-04 12:31:04,517] Trial 914 finished with value: 0.6701109023324363 and parameters: {'n_estimators': 750, 'learning_rate': 0.021626075052475508, 'max_depth': 3, 'min_samples_split': 13, 'min_samples_leaf': 10, 'subsample': 0.8497078886003024, 'max_features': 'sqrt'}. Best is trial 428 with value: 0.31740361133065975.
[I 2024-12-04 12:31:04,517] Trial 901 finished with value: 0.3722418184808301 and parameters: {'n_estimators': 1033, 'learning_rate': 0.06225830261293888, 'max_depth': 8, 'min_samples_split': 6, 'min_samples_leaf': 1, 'subsample': 0.6871096890544353, 'max_features': None}. Best is trial 428 with value: 0.31740361133065975.
[I 2024-12-04 12:31:05,733] Trial 924 finished with value: 0.8788927627220502 and parameters: {'n_estimators': 442, 'learning_rate': 0.011872608850920329, 'max_depth': 4, 'min_samples_split': 18, 'min_samples_leaf': 2, 'subsample': 0.7393761012487258, 'max_features': 'log2'}. Best is trial 428 with value: 0.31740361133065975.
[I 2024-12-04 12:31:07,680] Trial 900 finished with value: 0.4208554953724127 and parameters: {'n_estimators': 1310, 'learning_rate': 0.05578924174815452, 'max_depth': 5, 'min_samples_split': 2, 'min_samples_leaf': 1, 'subsample': 0.8307294368197964, 'max_features': 'log2'}. Best is trial 428 with value: 0.31740361133065975.
[I 2024-12-04 12:31:08,785] Trial 911 finished with value: 0.3865149541525373 and parameters: {'n_estimators': 813, 'learning_rate': 0.07795672756414262, 'max_depth': 8, 'min_samples_split': 6, 'min_samples_leaf': 1, 'subsample': 0.8706017333696823, 'max_features': None}. Best is trial 428 with value: 0.31740361133065975.
[I 2024-12-04 12:31:08,810] Trial 910 finished with value: 0.42803918130504476 and parameters: {'n_estimators': 1025, 'learning_rate': 0.07972963101688221, 'max_depth': 6, 'min_samples_split': 4, 'min_samples_leaf': 3, 'subsample': 0.9059304040298958, 'max_features': 'sqrt'}. Best is trial 428 with value: 0.31740361133065975.
[I 2024-12-04 12:31:09,291] Trial 906 finished with value: 0.34290305736377896 and parameters: {'n_estimators': 1066, 'learning_rate': 0.06382082922174338, 'max_depth': 6, 'min_samples_split': 9, 'min_samples_leaf': 2, 'subsample': 0.6687839327874809, 'max_features': None}. Best is trial 428 with value: 0.31740361133065975.
[I 2024-12-04 12:31:09,641] Trial 894 finished with value: 0.3790526375948095 and parameters: {'n_estimators': 1366, 'learning_rate': 0.06537956836099793, 'max_depth': 8, 'min_samples_split': 5, 'min_samples_leaf': 3, 'subsample': 0.6709199196647964, 'max_features': None}. Best is trial 428 with value: 0.31740361133065975.
[I 2024-12-04 12:31:13,197] Trial 929 finished with value: 0.5014149932421933 and parameters: {'n_estimators': 325, 'learning_rate': 0.023336609579424423, 'max_depth': 3, 'min_samples_split': 16, 'min_samples_leaf': 2, 'subsample': 0.6217125350139802, 'max_features': None}. Best is trial 428 with value: 0.31740361133065975.
[I 2024-12-04 12:31:14,358] Trial 912 finished with value: 0.33627346609937847 and parameters: {'n_estimators': 1039, 'learning_rate': 0.07844925516153632, 'max_depth': 8, 'min_samples_split': 8, 'min_samples_leaf': 2, 'subsample': 0.6205980170830692, 'max_features': None}. Best is trial 428 with value: 0.31740361133065975.
[I 2024-12-04 12:31:16,054] Trial 917 finished with value: 0.39091528050115465 and parameters: {'n_estimators': 843, 'learning_rate': 0.04838095373936744, 'max_depth': 10, 'min_samples_split': 3, 'min_samples_leaf': 3, 'subsample': 0.7354904272643448, 'max_features': None}. Best is trial 428 with value: 0.31740361133065975.
[I 2024-12-04 12:31:16,756] Trial 897 finished with value: 0.40240834021831795 and parameters: {'n_estimators': 1499, 'learning_rate': 0.07073730689931096, 'max_depth': 9, 'min_samples_split': 5, 'min_samples_leaf': 3, 'subsample': 0.7866047678126193, 'max_features': None}. Best is trial 428 with value: 0.31740361133065975.
[I 2024-12-04 12:31:16,932] Trial 925 finished with value: 0.393374273937559 and parameters: {'n_estimators': 703, 'learning_rate': 0.06193703286606647, 'max_depth': 6, 'min_samples_split': 5, 'min_samples_leaf': 3, 'subsample': 0.645406842292348, 'max_features': None}. Best is trial 428 with value: 0.31740361133065975.
[I 2024-12-04 12:31:18,968] Trial 921 finished with value: 0.3898517211428488 and parameters: {'n_estimators': 858, 'learning_rate': 0.05593102919341614, 'max_depth': 8, 'min_samples_split': 2, 'min_samples_leaf': 3, 'subsample': 0.6494870104013638, 'max_features': None}. Best is trial 428 with value: 0.31740361133065975.
[I 2024-12-04 12:31:19,130] Trial 915 finished with value: 0.7029112007506975 and parameters: {'n_estimators': 1191, 'learning_rate': 0.015244959907266792, 'max_depth': 3, 'min_samples_split': 8, 'min_samples_leaf': 10, 'subsample': 0.6312927382648256, 'max_features': 'sqrt'}. Best is trial 428 with value: 0.31740361133065975.
[I 2024-12-04 12:31:19,135] Trial 913 finished with value: 0.3290159964259052 and parameters: {'n_estimators': 1119, 'learning_rate': 0.09213885551903025, 'max_depth': 7, 'min_samples_split': 5, 'min_samples_leaf': 2, 'subsample': 0.7570048805384861, 'max_features': None}. Best is trial 428 with value: 0.31740361133065975.
[I 2024-12-04 12:31:20,527] Trial 916 finished with value: 0.37407086459120437 and parameters: {'n_estimators': 1110, 'learning_rate': 0.0773938345209013, 'max_depth': 6, 'min_samples_split': 4, 'min_samples_leaf': 1, 'subsample': 0.6772657753714264, 'max_features': None}. Best is trial 428 with value: 0.31740361133065975.
[I 2024-12-04 12:31:21,178] Trial 922 finished with value: 0.3749433450248943 and parameters: {'n_estimators': 861, 'learning_rate': 0.0572279665304297, 'max_depth': 8, 'min_samples_split': 7, 'min_samples_leaf': 3, 'subsample': 0.6282004455220456, 'max_features': None}. Best is trial 428 with value: 0.31740361133065975.
[I 2024-12-04 12:31:22,870] Trial 905 finished with value: 0.3321163873145962 and parameters: {'n_estimators': 1498, 'learning_rate': 0.06544222078664214, 'max_depth': 6, 'min_samples_split': 9, 'min_samples_leaf': 2, 'subsample': 0.6549310558539603, 'max_features': None}. Best is trial 428 with value: 0.31740361133065975.
[I 2024-12-04 12:31:25,518] Trial 923 finished with value: 0.3817247354998153 and parameters: {'n_estimators': 984, 'learning_rate': 0.04912666106141025, 'max_depth': 7, 'min_samples_split': 6, 'min_samples_leaf': 3, 'subsample': 0.6839082939510203, 'max_features': None}. Best is trial 428 with value: 0.31740361133065975.
[I 2024-12-04 12:31:27,216] Trial 918 finished with value: 0.31869735562247037 and parameters: {'n_estimators': 1128, 'learning_rate': 0.05773995807315999, 'max_depth': 8, 'min_samples_split': 6, 'min_samples_leaf': 2, 'subsample': 0.6953281593195205, 'max_features': None}. Best is trial 428 with value: 0.31740361133065975.
[I 2024-12-04 12:31:31,305] Trial 939 finished with value: 0.618809548164905 and parameters: {'n_estimators': 627, 'learning_rate': 0.041832870576806395, 'max_depth': 9, 'min_samples_split': 3, 'min_samples_leaf': 5, 'subsample': 0.7184015164576384, 'max_features': 'log2'}. Best is trial 428 with value: 0.31740361133065975.
[I 2024-12-04 12:31:32,080] Trial 953 finished with value: 0.7912800703254192 and parameters: {'n_estimators': 270, 'learning_rate': 0.015418663736422974, 'max_depth': 7, 'min_samples_split': 16, 'min_samples_leaf': 8, 'subsample': 0.7558167464915196, 'max_features': 'sqrt'}. Best is trial 428 with value: 0.31740361133065975.
[I 2024-12-04 12:31:32,136] Trial 928 finished with value: 0.3207619924416318 and parameters: {'n_estimators': 1014, 'learning_rate': 0.06333497893388267, 'max_depth': 7, 'min_samples_split': 3, 'min_samples_leaf': 2, 'subsample': 0.6594922458482763, 'max_features': None}. Best is trial 428 with value: 0.31740361133065975.
[I 2024-12-04 12:31:33,815] Trial 935 finished with value: 0.33162332975314185 and parameters: {'n_estimators': 827, 'learning_rate': 0.0655430648562141, 'max_depth': 7, 'min_samples_split': 5, 'min_samples_leaf': 2, 'subsample': 0.6547679898445129, 'max_features': None}. Best is trial 428 with value: 0.31740361133065975.
[I 2024-12-04 12:31:36,306] Trial 919 finished with value: 0.34297066180307234 and parameters: {'n_estimators': 1446, 'learning_rate': 0.09893415265890036, 'max_depth': 8, 'min_samples_split': 4, 'min_samples_leaf': 2, 'subsample': 0.7927532343392331, 'max_features': None}. Best is trial 428 with value: 0.31740361133065975.
[I 2024-12-04 12:31:38,444] Trial 927 finished with value: 0.32633213889048235 and parameters: {'n_estimators': 1214, 'learning_rate': 0.09826232898926146, 'max_depth': 8, 'min_samples_split': 6, 'min_samples_leaf': 2, 'subsample': 0.6679195030741648, 'max_features': None}. Best is trial 428 with value: 0.31740361133065975.
[I 2024-12-04 12:31:39,205] Trial 946 finished with value: 0.38257307177913397 and parameters: {'n_estimators': 624, 'learning_rate': 0.052099076591837254, 'max_depth': 8, 'min_samples_split': 2, 'min_samples_leaf': 3, 'subsample': 0.6684119917804903, 'max_features': None}. Best is trial 428 with value: 0.31740361133065975.
[I 2024-12-04 12:31:41,544] Trial 938 finished with value: 0.4145608152493414 and parameters: {'n_estimators': 1081, 'learning_rate': 0.07955306641709889, 'max_depth': 7, 'min_samples_split': 5, 'min_samples_leaf': 5, 'subsample': 0.7984792416452212, 'max_features': 'sqrt'}. Best is trial 428 with value: 0.31740361133065975.
[I 2024-12-04 12:31:41,545] Trial 933 finished with value: 0.3754808999938554 and parameters: {'n_estimators': 1049, 'learning_rate': 0.09301561896235468, 'max_depth': 6, 'min_samples_split': 2, 'min_samples_leaf': 4, 'subsample': 0.6448346419998068, 'max_features': None}. Best is trial 428 with value: 0.31740361133065975.
[I 2024-12-04 12:31:41,717] Trial 954 finished with value: 0.494118711890455 and parameters: {'n_estimators': 546, 'learning_rate': 0.07800178510891839, 'max_depth': 8, 'min_samples_split': 10, 'min_samples_leaf': 3, 'subsample': 0.6665684522661337, 'max_features': 'log2'}. Best is trial 428 with value: 0.31740361133065975.
[I 2024-12-04 12:31:41,723] Trial 932 finished with value: 0.3815998052195691 and parameters: {'n_estimators': 1066, 'learning_rate': 0.05007471925764359, 'max_depth': 9, 'min_samples_split': 2, 'min_samples_leaf': 1, 'subsample': 0.7348588379902652, 'max_features': None}. Best is trial 428 with value: 0.31740361133065975.
