[I 2024-12-04 20:29:22,769] Trial 1522 finished with value: 0.35921108201311414 and parameters: {'kernel_type': 'Matern', 'length_scale': 0.6636434110913012, 'noise_level': 0.01922988570642213, 'constant_value': 178.794073658552, 'nu': 0.5}. Best is trial 881 with value: 0.35916990930150405.
[I 2024-12-04 20:29:28,633] Trial 1524 finished with value: 1.062416117239467 and parameters: {'kernel_type': 'Matern', 'length_scale': 0.01660080983519817, 'noise_level': 0.8339786608561769, 'constant_value': 88886.37043714359, 'nu': 0.5}. Best is trial 881 with value: 0.35916990930150405.
[I 2024-12-04 20:29:29,389] Trial 1525 finished with value: 0.35921152582524624 and parameters: {'kernel_type': 'Matern', 'length_scale': 1.3392230067017006, 'noise_level': 0.8002072227025177, 'constant_value': 1.048287378606877, 'nu': 0.5}. Best is trial 881 with value: 0.35916990930150405.
[I 2024-12-04 20:29:30,773] Trial 1526 finished with value: 0.35921521791308664 and parameters: {'kernel_type': 'Matern', 'length_scale': 268.49055259707046, 'noise_level': 0.013531142071776041, 'constant_value': 299.8520137601291, 'nu': 0.5}. Best is trial 881 with value: 0.35916990930150405.
[I 2024-12-04 20:29:33,502] Trial 1527 finished with value: 0.35921126528042374 and parameters: {'kernel_type': 'Matern', 'length_scale': 1.7546513494786546, 'noise_level': 0.011200611005167206, 'constant_value': 0.16621464163677532, 'nu': 0.5}. Best is trial 881 with value: 0.35916990930150405.
[I 2024-12-04 20:29:34,793] Trial 1528 finished with value: 0.3592114870720195 and parameters: {'kernel_type': 'Matern', 'length_scale': 29.12810643744572, 'noise_level': 0.0909296524707808, 'constant_value': 1370.5811842659014, 'nu': 0.5}. Best is trial 881 with value: 0.35916990930150405.
[I 2024-12-04 20:29:36,723] Trial 1529 finished with value: 0.35921124265313037 and parameters: {'kernel_type': 'Matern', 'length_scale': 0.34001303324412807, 'noise_level': 0.00022350696463751263, 'constant_value': 15859.73944622731, 'nu': 0.5}. Best is trial 881 with value: 0.35916990930150405.
[I 2024-12-04 20:29:38,652] Trial 1531 finished with value: 1.0624161172690008 and parameters: {'kernel_type': 'Matern', 'length_scale': 0.0028119839070012117, 'noise_level': 6.041322344325409e-05, 'constant_value': 74.64914795757117, 'nu': 1.5}. Best is trial 881 with value: 0.35916990930150405.
[I 2024-12-04 20:29:42,644] Trial 1532 finished with value: 0.3592112032532502 and parameters: {'kernel_type': 'Matern', 'length_scale': 12.852963849390491, 'noise_level': 0.03214389852808138, 'constant_value': 745.7442950130206, 'nu': 0.5}. Best is trial 881 with value: 0.35916990930150405.
[I 2024-12-04 20:29:42,968] Trial 1533 finished with value: 1.0624161172560203 and parameters: {'kernel_type': 'Matern', 'length_scale': 0.040895887708437204, 'noise_level': 0.00018851102292142963, 'constant_value': 18.368871331815818, 'nu': 0.5}. Best is trial 881 with value: 0.35916990930150405.
[I 2024-12-04 20:29:43,892] Trial 1530 finished with value: 1.0624161172601951 and parameters: {'kernel_type': 'Matern', 'length_scale': 167.76751027098607, 'noise_level': 0.0005797426075530639, 'constant_value': 0.00015831502710007494, 'nu': 0.5}. Best is trial 881 with value: 0.35916990930150405.
[I 2024-12-04 20:29:47,122] Trial 1535 finished with value: 0.3592092897191609 and parameters: {'kernel_type': 'Matern', 'length_scale': 67.79553586758425, 'noise_level': 0.002822945377088987, 'constant_value': 3.5136459595166016, 'nu': 0.5}. Best is trial 881 with value: 0.35916990930150405.
[I 2024-12-04 20:29:48,288] Trial 1534 finished with value: 0.35921125038950585 and parameters: {'kernel_type': 'Matern', 'length_scale': 0.5407345259300562, 'noise_level': 0.04605429283599251, 'constant_value': 62496.90304214444, 'nu': 0.5}. Best is trial 881 with value: 0.35916990930150405.
[I 2024-12-04 20:29:48,902] Trial 1536 finished with value: 0.3592112362429643 and parameters: {'kernel_type': 'Matern', 'length_scale': 3.596272745563971, 'noise_level': 0.9403056437753101, 'constant_value': 3269.4030427552843, 'nu': 0.5}. Best is trial 881 with value: 0.35916990930150405.
[I 2024-12-04 20:29:51,695] Trial 1537 finished with value: 0.35921105420714383 and parameters: {'kernel_type': 'Matern', 'length_scale': 3.1323184446355503, 'noise_level': 0.00028410076335218953, 'constant_value': 135.38165722457364, 'nu': 0.5}. Best is trial 881 with value: 0.35916990930150405.
[I 2024-12-04 20:29:55,652] Trial 1539 finished with value: 1.0624161169759307 and parameters: {'kernel_type': 'RBF', 'length_scale': 271.44628549732374, 'noise_level': 1.3611221211367906e-06, 'constant_value': 2.022322761739135, 'nu': 2.5}. Best is trial 881 with value: 0.35916990930150405.
[I 2024-12-04 20:29:56,531] Trial 1540 finished with value: 0.3592346440450722 and parameters: {'kernel_type': 'Matern', 'length_scale': 0.21405982679154284, 'noise_level': 0.0011106616059615559, 'constant_value': 0.6491672039515263, 'nu': 0.5}. Best is trial 881 with value: 0.35916990930150405.
[I 2024-12-04 20:29:56,592] Trial 1538 finished with value: 1.0624161172311488 and parameters: {'kernel_type': 'Matern', 'length_scale': 20.289280647335712, 'noise_level': 0.0003883357228104377, 'constant_value': 1.223059224330607e-07, 'nu': 2.5}. Best is trial 881 with value: 0.35916990930150405.
[I 2024-12-04 20:30:00,145] Trial 1541 finished with value: 0.35921039621544265 and parameters: {'kernel_type': 'Matern', 'length_scale': 36.14446219257843, 'noise_level': 0.003275561166210176, 'constant_value': 3.843278246081458, 'nu': 0.5}. Best is trial 881 with value: 0.35916990930150405.
[I 2024-12-04 20:30:02,039] Trial 1542 finished with value: 0.3592115087799543 and parameters: {'kernel_type': 'Matern', 'length_scale': 61.2805939589448, 'noise_level': 0.00040298059273996133, 'constant_value': 136.4144630471119, 'nu': 0.5}. Best is trial 881 with value: 0.35916990930150405.
[I 2024-12-04 20:30:02,366] Trial 1543 finished with value: 0.35921134774781016 and parameters: {'kernel_type': 'Matern', 'length_scale': 56.804070771288465, 'noise_level': 0.0015337647917926826, 'constant_value': 35.9178030534862, 'nu': 0.5}. Best is trial 881 with value: 0.35916990930150405.
[I 2024-12-04 20:30:04,998] Trial 1544 finished with value: 0.4195665200254147 and parameters: {'kernel_type': 'Matern', 'length_scale': 11.358289490953505, 'noise_level': 0.00017255773852232684, 'constant_value': 273.0562784562796, 'nu': 2.5}. Best is trial 881 with value: 0.35916990930150405.
[I 2024-12-04 20:30:07,882] Trial 1545 finished with value: 0.35921078778047594 and parameters: {'kernel_type': 'Matern', 'length_scale': 210.8552597463232, 'noise_level': 5.774101495697974e-05, 'constant_value': 230.34048814199193, 'nu': 0.5}. Best is trial 881 with value: 0.35916990930150405.
[I 2024-12-04 20:30:08,436] Trial 1547 finished with value: 1.0916558493885071 and parameters: {'kernel_type': 'RBF', 'length_scale': 0.022289016570016584, 'noise_level': 3.155297183798836e-08, 'constant_value': 21806.199604967085, 'nu': 1.5}. Best is trial 881 with value: 0.35916990930150405.
[I 2024-12-04 20:30:08,623] Trial 1546 finished with value: 0.35921125807088516 and parameters: {'kernel_type': 'Matern', 'length_scale': 0.19528297117674592, 'noise_level': 0.017508609014601682, 'constant_value': 76.0789847684051, 'nu': 0.5}. Best is trial 881 with value: 0.35916990930150405.
[I 2024-12-04 20:30:12,720] Trial 1549 finished with value: 0.359211140318958 and parameters: {'kernel_type': 'Matern', 'length_scale': 7.765399716770054, 'noise_level': 0.9972504416794638, 'constant_value': 4977.684267046004, 'nu': 0.5}. Best is trial 881 with value: 0.35916990930150405.
[I 2024-12-04 20:30:13,886] Trial 1548 finished with value: 0.3592112926423958 and parameters: {'kernel_type': 'Matern', 'length_scale': 5229.143193230411, 'noise_level': 0.05429415338862137, 'constant_value': 8076.791364048581, 'nu': 0.5}. Best is trial 881 with value: 0.35916990930150405.
[I 2024-12-04 20:30:14,277] Trial 1550 finished with value: 0.35921057490020925 and parameters: {'kernel_type': 'Matern', 'length_scale': 1.7794643781573745, 'noise_level': 0.004819742696485009, 'constant_value': 71.1030261221051, 'nu': 0.5}. Best is trial 881 with value: 0.35916990930150405.
[I 2024-12-04 20:30:17,183] Trial 1552 finished with value: 1.091656510799527 and parameters: {'kernel_type': 'Matern', 'length_scale': 22.30736388177918, 'noise_level': 9.544440286301368e-07, 'constant_value': 1038.6681261399783, 'nu': 0.5}. Best is trial 881 with value: 0.35916990930150405.
[I 2024-12-04 20:30:18,150] Trial 1551 finished with value: 1.0624161175897344 and parameters: {'kernel_type': 'Matern', 'length_scale': 5.240764035422238, 'noise_level': 3.2882815550253315e-05, 'constant_value': 0.05928077476809045, 'nu': 0.5}. Best is trial 881 with value: 0.35916990930150405.
[I 2024-12-04 20:30:19,488] Trial 1553 finished with value: 0.3592108988896564 and parameters: {'kernel_type': 'Matern', 'length_scale': 24.55232378630072, 'noise_level': 0.00030112503809243455, 'constant_value': 12.445937655281869, 'nu': 0.5}. Best is trial 881 with value: 0.35916990930150405.
[I 2024-12-04 20:30:20,121] Trial 1554 finished with value: 1.0916567048549886 and parameters: {'kernel_type': 'Matern', 'length_scale': 84.66885040630062, 'noise_level': 0.006153793442796408, 'constant_value': 2083.7682410433686, 'nu': 0.5}. Best is trial 881 with value: 0.35916990930150405.
[I 2024-12-04 20:30:23,685] Trial 1557 finished with value: 1.0624161167221278 and parameters: {'kernel_type': 'Matern', 'length_scale': 0.00020821081253794826, 'noise_level': 0.08105927675369193, 'constant_value': 381.3835174005219, 'nu': 0.5}. Best is trial 881 with value: 0.35916990930150405.
[I 2024-12-04 20:30:25,253] Trial 1556 finished with value: 1.0624161175307427 and parameters: {'kernel_type': 'Matern', 'length_scale': 739.3087971724781, 'noise_level': 0.008541021220917738, 'constant_value': 38.30485901590262, 'nu': 1.5}. Best is trial 881 with value: 0.35916990930150405.
[I 2024-12-04 20:30:25,511] Trial 1555 finished with value: 0.35921109983126853 and parameters: {'kernel_type': 'Matern', 'length_scale': 22.324634781545033, 'noise_level': 0.012056241784513724, 'constant_value': 64029.64974289522, 'nu': 0.5}. Best is trial 881 with value: 0.35916990930150405.
[I 2024-12-04 20:30:29,512] Trial 1558 finished with value: 0.4195659595819161 and parameters: {'kernel_type': 'Matern', 'length_scale': 4.105434318209789, 'noise_level': 0.002393272214520064, 'constant_value': 80620.20139721537, 'nu': 2.5}. Best is trial 881 with value: 0.35916990930150405.
[I 2024-12-04 20:30:30,638] Trial 1559 finished with value: 1.0624161175740037 and parameters: {'kernel_type': 'RBF', 'length_scale': 16.092706894995352, 'noise_level': 2.955340135804465e-08, 'constant_value': 0.06303849810898127, 'nu': 1.5}. Best is trial 881 with value: 0.35916990930150405.
[I 2024-12-04 20:30:30,938] Trial 1560 finished with value: 0.35921120424660496 and parameters: {'kernel_type': 'Matern', 'length_scale': 0.4859187914586883, 'noise_level': 0.05250516918026602, 'constant_value': 245.7064286998553, 'nu': 0.5}. Best is trial 881 with value: 0.35916990930150405.
[I 2024-12-04 20:30:35,779] Trial 1562 finished with value: 0.3592112406800678 and parameters: {'kernel_type': 'Matern', 'length_scale': 218.95072278301956, 'noise_level': 0.0013400320525446198, 'constant_value': 7.423485705718202, 'nu': 0.5}. Best is trial 881 with value: 0.35916990930150405.
[I 2024-12-04 20:30:36,011] Trial 1563 finished with value: 0.3592111865228471 and parameters: {'kernel_type': 'Matern', 'length_scale': 4.692469156929374, 'noise_level': 0.0005685440735811187, 'constant_value': 22.07820539905075, 'nu': 0.5}. Best is trial 881 with value: 0.35916990930150405.
[I 2024-12-04 20:30:37,739] Trial 1561 finished with value: 1.06241611725833 and parameters: {'kernel_type': 'RBF', 'length_scale': 25421.78275591482, 'noise_level': 4.710125683597902e-10, 'constant_value': 27.900001338031743, 'nu': 2.5}. Best is trial 881 with value: 0.35916990930150405.
[I 2024-12-04 20:30:40,753] Trial 1564 finished with value: 0.35921507707030453 and parameters: {'kernel_type': 'Matern', 'length_scale': 8.290166445360198, 'noise_level': 0.0009600668675569278, 'constant_value': 0.25003609444324687, 'nu': 0.5}. Best is trial 881 with value: 0.35916990930150405.
[I 2024-12-04 20:30:42,055] Trial 1565 finished with value: 0.3592112141097132 and parameters: {'kernel_type': 'Matern', 'length_scale': 1652.3839037050352, 'noise_level': 0.05699986016499806, 'constant_value': 1015.0654062306916, 'nu': 0.5}. Best is trial 881 with value: 0.35916990930150405.
[I 2024-12-04 20:30:42,785] Trial 1566 finished with value: 0.3592112235687034 and parameters: {'kernel_type': 'Matern', 'length_scale': 1.2144473438762724, 'noise_level': 0.031423584984939024, 'constant_value': 26.555064230483502, 'nu': 0.5}. Best is trial 881 with value: 0.35916990930150405.
[I 2024-12-04 20:30:45,784] Trial 1567 finished with value: 0.35921129683982794 and parameters: {'kernel_type': 'Matern', 'length_scale': 168.42788631159064, 'noise_level': 0.20847656279529184, 'constant_value': 79586.0033501018, 'nu': 0.5}. Best is trial 881 with value: 0.35916990930150405.
[I 2024-12-04 20:30:46,495] Trial 1569 finished with value: 1.062416117406426 and parameters: {'kernel_type': 'Matern', 'length_scale': 4.339561556864785e-05, 'noise_level': 0.3611636472767691, 'constant_value': 0.7194315826236165, 'nu': 2.5}. Best is trial 881 with value: 0.35916990930150405.
[I 2024-12-04 20:30:49,942] Trial 1571 finished with value: 1.0916566962939702 and parameters: {'kernel_type': 'Matern', 'length_scale': 8226.799170445456, 'noise_level': 6.587339683411349e-09, 'constant_value': 80140.4230559771, 'nu': 0.5}. Best is trial 881 with value: 0.35916990930150405.
[I 2024-12-04 20:30:51,362] Trial 1570 finished with value: 0.3592112117122315 and parameters: {'kernel_type': 'Matern', 'length_scale': 5.141836355197535, 'noise_level': 0.03817300240197031, 'constant_value': 395.99190396774344, 'nu': 0.5}. Best is trial 881 with value: 0.35916990930150405.
[I 2024-12-04 20:30:51,369] Trial 1568 finished with value: 0.35921124282951117 and parameters: {'kernel_type': 'Matern', 'length_scale': 0.09691268528228277, 'noise_level': 0.00014631030998739987, 'constant_value': 2742.182934285612, 'nu': 0.5}. Best is trial 881 with value: 0.35916990930150405.
[I 2024-12-04 20:30:54,902] Trial 1572 finished with value: 0.359211214867744 and parameters: {'kernel_type': 'Matern', 'length_scale': 635.5729906881008, 'noise_level': 0.010501922993992741, 'constant_value': 157.89966031068514, 'nu': 0.5}. Best is trial 881 with value: 0.35916990930150405.
[I 2024-12-04 20:30:56,594] Trial 1573 finished with value: 1.062416117274046 and parameters: {'kernel_type': 'RBF', 'length_scale': 20.011026417973955, 'noise_level': 2.0921823285810055e-09, 'constant_value': 92551.2567837197, 'nu': 2.5}. Best is trial 881 with value: 0.35916990930150405.
[I 2024-12-04 20:30:58,412] Trial 1575 finished with value: 1.0916558114488653 and parameters: {'kernel_type': 'Matern', 'length_scale': 0.22631842412015676, 'noise_level': 4.4947266996631775e-07, 'constant_value': 22225.13822167763, 'nu': 1.5}. Best is trial 881 with value: 0.35916990930150405.
[I 2024-12-04 20:30:58,874] Trial 1574 finished with value: 0.42268991179734416 and parameters: {'kernel_type': 'Matern', 'length_scale': 44.77223043068623, 'noise_level': 0.0056429129001746535, 'constant_value': 271.74392992425544, 'nu': 1.5}. Best is trial 881 with value: 0.35916990930150405.
[I 2024-12-04 20:31:01,361] Trial 1576 finished with value: 1.0624159762683378 and parameters: {'kernel_type': 'Matern', 'length_scale': 0.0952381780129569, 'noise_level': 0.0006917608220106049, 'constant_value': 2.2864052819551315, 'nu': 1.5}. Best is trial 881 with value: 0.35916990930150405.
[I 2024-12-04 20:31:06,539] Trial 1578 finished with value: 1.0624161172745452 and parameters: {'kernel_type': 'Matern', 'length_scale': 0.011393473523046828, 'noise_level': 0.028592002626327006, 'constant_value': 624.9322460766272, 'nu': 0.5}. Best is trial 881 with value: 0.35916990930150405.
[I 2024-12-04 20:31:09,624] Trial 1579 finished with value: 0.35921125913109203 and parameters: {'kernel_type': 'Matern', 'length_scale': 1.9508801851989972, 'noise_level': 0.9247975723176417, 'constant_value': 638.0301969341199, 'nu': 0.5}. Best is trial 881 with value: 0.35916990930150405.
[I 2024-12-04 20:31:10,419] Trial 1577 finished with value: 1.0624161172447397 and parameters: {'kernel_type': 'Matern', 'length_scale': 11099.449235809956, 'noise_level': 0.0012269477655889583, 'constant_value': 0.0514761985581084, 'nu': 1.5}. Best is trial 881 with value: 0.35916990930150405.
[I 2024-12-04 20:31:11,880] Trial 1580 finished with value: 0.3592119413330264 and parameters: {'kernel_type': 'Matern', 'length_scale': 5.982208817739758, 'noise_level': 0.04540068615616873, 'constant_value': 26.25147303532641, 'nu': 0.5}. Best is trial 881 with value: 0.35916990930150405.
[I 2024-12-04 20:31:14,043] Trial 1582 finished with value: 1.0916556982732708 and parameters: {'kernel_type': 'Matern', 'length_scale': 4.088563464186762, 'noise_level': 1.7288457427144144e-05, 'constant_value': 1.044828818613937, 'nu': 0.5}. Best is trial 881 with value: 0.35916990930150405.
[I 2024-12-04 20:31:14,046] Trial 1581 finished with value: 0.3592123342300214 and parameters: {'kernel_type': 'Matern', 'length_scale': 2.0001353729968256, 'noise_level': 0.002027529795706141, 'constant_value': 2853.3797745890984, 'nu': 0.5}. Best is trial 881 with value: 0.35916990930150405.
[I 2024-12-04 20:31:16,838] Trial 1583 finished with value: 1.0624161172518187 and parameters: {'kernel_type': 'Matern', 'length_scale': 79267.5053815705, 'noise_level': 0.0033872284453667777, 'constant_value': 46.38853746559682, 'nu': 0.5}. Best is trial 881 with value: 0.35916990930150405.
[I 2024-12-04 20:31:17,950] Trial 1584 finished with value: 1.062416117087075 and parameters: {'kernel_type': 'Matern', 'length_scale': 8.993679884647691e-05, 'noise_level': 1.140703575880058e-09, 'constant_value': 0.0011021813528313063, 'nu': 2.5}. Best is trial 881 with value: 0.35916990930150405.
[I 2024-12-04 20:31:18,481] Trial 1585 finished with value: 1.0624161172024493 and parameters: {'kernel_type': 'Matern', 'length_scale': 0.0012967101275940525, 'noise_level': 0.00013762860982676874, 'constant_value': 23.716428494355856, 'nu': 2.5}. Best is trial 881 with value: 0.35916990930150405.
[I 2024-12-04 20:31:22,183] Trial 1586 finished with value: 0.41956600627783724 and parameters: {'kernel_type': 'Matern', 'length_scale': 74.31150739144624, 'noise_level': 0.016752308564630294, 'constant_value': 74.92579894145072, 'nu': 2.5}. Best is trial 881 with value: 0.35916990930150405.
[I 2024-12-04 20:31:23,006] Trial 1587 finished with value: 0.3592112219012106 and parameters: {'kernel_type': 'Matern', 'length_scale': 0.8722873875119435, 'noise_level': 0.005926128775284989, 'constant_value': 0.13533359324928756, 'nu': 0.5}. Best is trial 881 with value: 0.35916990930150405.
[I 2024-12-04 20:31:23,542] Trial 1588 finished with value: 0.3592112804032183 and parameters: {'kernel_type': 'Matern', 'length_scale': 82.21442186003826, 'noise_level': 0.0035627941098161204, 'constant_value': 3.0538262727531826, 'nu': 0.5}. Best is trial 881 with value: 0.35916990930150405.
[I 2024-12-04 20:31:27,399] Trial 1589 finished with value: 0.3592139670669202 and parameters: {'kernel_type': 'Matern', 'length_scale': 157.37285044021147, 'noise_level': 0.157392730924061, 'constant_value': 886.3860809312436, 'nu': 0.5}. Best is trial 881 with value: 0.35916990930150405.
[I 2024-12-04 20:31:28,539] Trial 1591 finished with value: 0.3592108648966902 and parameters: {'kernel_type': 'Matern', 'length_scale': 4.0311051540793, 'noise_level': 0.9913195874217094, 'constant_value': 30326.78476816607, 'nu': 0.5}. Best is trial 881 with value: 0.35916990930150405.
[I 2024-12-04 20:31:28,546] Trial 1590 finished with value: 0.35921123941563843 and parameters: {'kernel_type': 'Matern', 'length_scale': 113.1379264534254, 'noise_level': 0.00014356504594117105, 'constant_value': 8638.513695422438, 'nu': 0.5}. Best is trial 881 with value: 0.35916990930150405.
[I 2024-12-04 20:31:38,323] Trial 1592 finished with value: 0.35921123243994285 and parameters: {'kernel_type': 'Matern', 'length_scale': 1034.9819962534305, 'noise_level': 0.0020796562032016045, 'constant_value': 46.46700123774771, 'nu': 0.5}. Best is trial 881 with value: 0.35916990930150405.
[I 2024-12-04 20:31:46,338] Trial 1594 finished with value: 1.0624161172380948 and parameters: {'kernel_type': 'RBF', 'length_scale': 0.000131134965851505, 'noise_level': 0.0008437637119579558, 'constant_value': 6049.708708416366, 'nu': 1.5}. Best is trial 881 with value: 0.35916990930150405.
[I 2024-12-04 20:31:46,341] Trial 1593 finished with value: 1.0624161171003779 and parameters: {'kernel_type': 'Matern', 'length_scale': 0.010252686447625461, 'noise_level': 0.006302150223403333, 'constant_value': 0.0042879635111383405, 'nu': 0.5}. Best is trial 881 with value: 0.35916990930150405.
[I 2024-12-04 20:31:51,222] Trial 1595 finished with value: 0.42269050095757443 and parameters: {'kernel_type': 'Matern', 'length_scale': 1261.696005004069, 'noise_level': 0.11403619199928142, 'constant_value': 951.8204891748519, 'nu': 1.5}. Best is trial 881 with value: 0.35916990930150405.
[I 2024-12-04 20:31:51,774] Trial 1596 finished with value: 1.0624161172793436 and parameters: {'kernel_type': 'Matern', 'length_scale': 0.03595161261612937, 'noise_level': 0.00532253102857404, 'constant_value': 20.90861820462768, 'nu': 0.5}. Best is trial 881 with value: 0.35916990930150405.
