[I 2024-12-04 13:21:03,184] Trial 1723 finished with value: 0.21590855151804436 and parameters: {'n_estimators': 1250, 'learning_rate': 0.06808667031470829, 'max_depth': 12, 'min_samples_split': 20, 'min_samples_leaf': 1, 'subsample': 0.7118891585313917, 'max_features': 'sqrt'}. Best is trial 1137 with value: 0.19687116000636118.
[I 2024-12-04 13:21:03,259] Trial 1750 finished with value: 0.39064358992270404 and parameters: {'n_estimators': 180, 'learning_rate': 0.06283698140284506, 'max_depth': 3, 'min_samples_split': 19, 'min_samples_leaf': 2, 'subsample': 0.6954463495602716, 'max_features': None}. Best is trial 1137 with value: 0.19687116000636118.
[I 2024-12-04 13:21:04,255] Trial 1726 finished with value: 0.2447550768958961 and parameters: {'n_estimators': 1150, 'learning_rate': 0.09930975016993043, 'max_depth': 12, 'min_samples_split': 18, 'min_samples_leaf': 2, 'subsample': 0.6889997255497478, 'max_features': 'sqrt'}. Best is trial 1137 with value: 0.19687116000636118.
[I 2024-12-04 13:21:05,641] Trial 1728 finished with value: 0.2793096418299325 and parameters: {'n_estimators': 1187, 'learning_rate': 0.03415549862096121, 'max_depth': 11, 'min_samples_split': 3, 'min_samples_leaf': 2, 'subsample': 0.9220214099358929, 'max_features': 'log2'}. Best is trial 1137 with value: 0.19687116000636118.
[I 2024-12-04 13:21:10,193] Trial 1732 finished with value: 0.3669994372635076 and parameters: {'n_estimators': 975, 'learning_rate': 0.029408228545571125, 'max_depth': 3, 'min_samples_split': 16, 'min_samples_leaf': 7, 'subsample': 0.8622102158510991, 'max_features': None}. Best is trial 1137 with value: 0.19687116000636118.
[I 2024-12-04 13:21:10,212] Trial 1731 finished with value: 0.22184820419548704 and parameters: {'n_estimators': 1132, 'learning_rate': 0.0637872673313422, 'max_depth': 12, 'min_samples_split': 17, 'min_samples_leaf': 1, 'subsample': 0.6597140181087724, 'max_features': 'sqrt'}. Best is trial 1137 with value: 0.19687116000636118.
[I 2024-12-04 13:21:13,904] Trial 1729 finished with value: 0.2433619798144497 and parameters: {'n_estimators': 1206, 'learning_rate': 0.06478524852535805, 'max_depth': 11, 'min_samples_split': 17, 'min_samples_leaf': 2, 'subsample': 0.6570549568808068, 'max_features': 'sqrt'}. Best is trial 1137 with value: 0.19687116000636118.
[I 2024-12-04 13:21:13,925] Trial 1730 finished with value: 0.5193809522291779 and parameters: {'n_estimators': 1167, 'learning_rate': 0.05698907038013925, 'max_depth': 12, 'min_samples_split': 6, 'min_samples_leaf': 9, 'subsample': 0.6275449316297327, 'max_features': 'log2'}. Best is trial 1137 with value: 0.19687116000636118.
[I 2024-12-04 13:21:23,354] Trial 1733 finished with value: 0.21117155969760593 and parameters: {'n_estimators': 1273, 'learning_rate': 0.075737487379147, 'max_depth': 12, 'min_samples_split': 16, 'min_samples_leaf': 1, 'subsample': 0.7039991691174642, 'max_features': 'sqrt'}. Best is trial 1137 with value: 0.19687116000636118.
[I 2024-12-04 13:21:23,367] Trial 1751 finished with value: 0.3877841931854528 and parameters: {'n_estimators': 553, 'learning_rate': 0.047337816805339626, 'max_depth': 4, 'min_samples_split': 6, 'min_samples_leaf': 7, 'subsample': 0.8213572384785153, 'max_features': 'sqrt'}. Best is trial 1137 with value: 0.19687116000636118.
[I 2024-12-04 13:21:27,113] Trial 1736 finished with value: 0.21812788948997486 and parameters: {'n_estimators': 1297, 'learning_rate': 0.09287363960735502, 'max_depth': 11, 'min_samples_split': 17, 'min_samples_leaf': 1, 'subsample': 0.702997974206541, 'max_features': 'sqrt'}. Best is trial 1137 with value: 0.19687116000636118.
[I 2024-12-04 13:21:32,032] Trial 1738 finished with value: 0.2461856320913654 and parameters: {'n_estimators': 1302, 'learning_rate': 0.06049889681324901, 'max_depth': 12, 'min_samples_split': 15, 'min_samples_leaf': 2, 'subsample': 0.6900646137251597, 'max_features': 'sqrt'}. Best is trial 1137 with value: 0.19687116000636118.
[I 2024-12-04 13:21:32,933] Trial 1740 finished with value: 0.23141029787436776 and parameters: {'n_estimators': 1192, 'learning_rate': 0.05407343314465581, 'max_depth': 11, 'min_samples_split': 19, 'min_samples_leaf': 1, 'subsample': 0.6006723405375498, 'max_features': 'sqrt'}. Best is trial 1137 with value: 0.19687116000636118.
[I 2024-12-04 13:21:38,818] Trial 1737 finished with value: 0.22079670529982587 and parameters: {'n_estimators': 1461, 'learning_rate': 0.06064778607282382, 'max_depth': 12, 'min_samples_split': 20, 'min_samples_leaf': 1, 'subsample': 0.7426340254680198, 'max_features': 'sqrt'}. Best is trial 1137 with value: 0.19687116000636118.
[I 2024-12-04 13:21:41,474] Trial 1767 finished with value: 0.7319367592661827 and parameters: {'n_estimators': 247, 'learning_rate': 0.011358106237852843, 'max_depth': 6, 'min_samples_split': 11, 'min_samples_leaf': 1, 'subsample': 0.6396286977554063, 'max_features': 'log2'}. Best is trial 1137 with value: 0.19687116000636118.
[I 2024-12-04 13:21:43,181] Trial 1739 finished with value: 0.29282754967612074 and parameters: {'n_estimators': 1455, 'learning_rate': 0.06917432984977365, 'max_depth': 12, 'min_samples_split': 20, 'min_samples_leaf': 3, 'subsample': 0.6045686713677342, 'max_features': 'log2'}. Best is trial 1137 with value: 0.19687116000636118.
[I 2024-12-04 13:21:46,489] Trial 1759 finished with value: 0.4832397508147797 and parameters: {'n_estimators': 631, 'learning_rate': 0.016099950248372435, 'max_depth': 9, 'min_samples_split': 18, 'min_samples_leaf': 9, 'subsample': 0.7141862410976032, 'max_features': 'sqrt'}. Best is trial 1137 with value: 0.19687116000636118.
[I 2024-12-04 13:21:46,614] Trial 1745 finished with value: 0.244731036080977 and parameters: {'n_estimators': 1247, 'learning_rate': 0.059832684742563494, 'max_depth': 12, 'min_samples_split': 18, 'min_samples_leaf': 3, 'subsample': 0.7003925663783531, 'max_features': 'sqrt'}. Best is trial 1137 with value: 0.19687116000636118.
[I 2024-12-04 13:21:46,617] Trial 1748 finished with value: 0.22543108511049506 and parameters: {'n_estimators': 1117, 'learning_rate': 0.07683022050666426, 'max_depth': 12, 'min_samples_split': 20, 'min_samples_leaf': 1, 'subsample': 0.7139376538655856, 'max_features': 'sqrt'}. Best is trial 1137 with value: 0.19687116000636118.
[I 2024-12-04 13:21:50,639] Trial 1742 finished with value: 0.5354468753001452 and parameters: {'n_estimators': 1430, 'learning_rate': 0.010361013724495575, 'max_depth': 7, 'min_samples_split': 7, 'min_samples_leaf': 5, 'subsample': 0.695700397277732, 'max_features': 'log2'}. Best is trial 1137 with value: 0.19687116000636118.
[I 2024-12-04 13:21:53,786] Trial 1752 finished with value: 0.46326793708454006 and parameters: {'n_estimators': 1052, 'learning_rate': 0.03666966769277393, 'max_depth': 4, 'min_samples_split': 7, 'min_samples_leaf': 7, 'subsample': 0.7756040756216205, 'max_features': 'log2'}. Best is trial 1137 with value: 0.19687116000636118.
[I 2024-12-04 13:21:53,798] Trial 1743 finished with value: 0.25691977429994245 and parameters: {'n_estimators': 1248, 'learning_rate': 0.057655694304362314, 'max_depth': 12, 'min_samples_split': 19, 'min_samples_leaf': 1, 'subsample': 0.6648714160348794, 'max_features': None}. Best is trial 1137 with value: 0.19687116000636118.
[I 2024-12-04 13:21:53,810] Trial 1747 finished with value: 0.24745342237145412 and parameters: {'n_estimators': 1317, 'learning_rate': 0.09921953027380515, 'max_depth': 11, 'min_samples_split': 15, 'min_samples_leaf': 3, 'subsample': 0.6804107827076997, 'max_features': 'sqrt'}. Best is trial 1137 with value: 0.19687116000636118.
[I 2024-12-04 13:22:01,845] Trial 1746 finished with value: 0.2435387704403069 and parameters: {'n_estimators': 1498, 'learning_rate': 0.058323380836764485, 'max_depth': 12, 'min_samples_split': 18, 'min_samples_leaf': 3, 'subsample': 0.6596173522659657, 'max_features': 'sqrt'}. Best is trial 1137 with value: 0.19687116000636118.
[I 2024-12-04 13:22:05,802] Trial 1749 finished with value: 0.21362059442053957 and parameters: {'n_estimators': 1367, 'learning_rate': 0.08843415135298824, 'max_depth': 10, 'min_samples_split': 20, 'min_samples_leaf': 1, 'subsample': 0.7191818737010011, 'max_features': 'sqrt'}. Best is trial 1137 with value: 0.19687116000636118.
[I 2024-12-04 13:22:12,771] Trial 1760 finished with value: 0.5159765902700343 and parameters: {'n_estimators': 1014, 'learning_rate': 0.03658924523596441, 'max_depth': 7, 'min_samples_split': 19, 'min_samples_leaf': 10, 'subsample': 0.8574816711226618, 'max_features': 'log2'}. Best is trial 1137 with value: 0.19687116000636118.
[I 2024-12-04 13:22:15,098] Trial 1755 finished with value: 0.22746242842339312 and parameters: {'n_estimators': 1299, 'learning_rate': 0.0983823640012404, 'max_depth': 12, 'min_samples_split': 20, 'min_samples_leaf': 1, 'subsample': 0.6925540224263257, 'max_features': 'sqrt'}. Best is trial 1137 with value: 0.19687116000636118.
[I 2024-12-04 13:22:15,208] Trial 1754 finished with value: 0.21883036122862637 and parameters: {'n_estimators': 1251, 'learning_rate': 0.08321690271621371, 'max_depth': 12, 'min_samples_split': 15, 'min_samples_leaf': 1, 'subsample': 0.7558429932690609, 'max_features': 'sqrt'}. Best is trial 1137 with value: 0.19687116000636118.
[I 2024-12-04 13:22:17,026] Trial 1756 finished with value: 0.22902888269915803 and parameters: {'n_estimators': 1200, 'learning_rate': 0.08190978182578361, 'max_depth': 12, 'min_samples_split': 16, 'min_samples_leaf': 1, 'subsample': 0.6820687056507841, 'max_features': 'sqrt'}. Best is trial 1137 with value: 0.19687116000636118.
[I 2024-12-04 13:22:22,040] Trial 1757 finished with value: 0.21923122668979203 and parameters: {'n_estimators': 1317, 'learning_rate': 0.06190009358212895, 'max_depth': 12, 'min_samples_split': 19, 'min_samples_leaf': 1, 'subsample': 0.6033008887097141, 'max_features': 'sqrt'}. Best is trial 1137 with value: 0.19687116000636118.
[I 2024-12-04 13:22:24,944] Trial 1753 finished with value: 0.21067000880169987 and parameters: {'n_estimators': 1456, 'learning_rate': 0.09494574517260707, 'max_depth': 11, 'min_samples_split': 20, 'min_samples_leaf': 1, 'subsample': 0.607335904656057, 'max_features': 'sqrt'}. Best is trial 1137 with value: 0.19687116000636118.
[I 2024-12-04 13:22:28,476] Trial 1762 finished with value: 0.24957890159415935 and parameters: {'n_estimators': 1202, 'learning_rate': 0.06466099567985448, 'max_depth': 12, 'min_samples_split': 16, 'min_samples_leaf': 4, 'subsample': 0.7770092323215422, 'max_features': 'sqrt'}. Best is trial 1137 with value: 0.19687116000636118.
[I 2024-12-04 13:22:35,600] Trial 1758 finished with value: 0.21928130144445493 and parameters: {'n_estimators': 1484, 'learning_rate': 0.09929480146433688, 'max_depth': 9, 'min_samples_split': 17, 'min_samples_leaf': 1, 'subsample': 0.7623670094474922, 'max_features': 'sqrt'}. Best is trial 1137 with value: 0.19687116000636118.
[I 2024-12-04 13:22:36,828] Trial 1761 finished with value: 0.2919987427710919 and parameters: {'n_estimators': 1336, 'learning_rate': 0.02495246551824911, 'max_depth': 6, 'min_samples_split': 3, 'min_samples_leaf': 4, 'subsample': 0.613741600052591, 'max_features': None}. Best is trial 1137 with value: 0.19687116000636118.
[I 2024-12-04 13:22:36,830] Trial 1765 finished with value: 0.46325844160931917 and parameters: {'n_estimators': 1261, 'learning_rate': 0.03882216293861676, 'max_depth': 6, 'min_samples_split': 2, 'min_samples_leaf': 8, 'subsample': 0.820236542065554, 'max_features': 'log2'}. Best is trial 1137 with value: 0.19687116000636118.
[I 2024-12-04 13:22:39,697] Trial 1775 finished with value: 0.24109065856576767 and parameters: {'n_estimators': 948, 'learning_rate': 0.042406993286917626, 'max_depth': 11, 'min_samples_split': 16, 'min_samples_leaf': 1, 'subsample': 0.6123667674508433, 'max_features': 'sqrt'}. Best is trial 1137 with value: 0.19687116000636118.
[I 2024-12-04 13:22:39,919] Trial 1766 finished with value: 0.2173761378805253 and parameters: {'n_estimators': 1267, 'learning_rate': 0.09210821162695544, 'max_depth': 12, 'min_samples_split': 17, 'min_samples_leaf': 1, 'subsample': 0.602160009293891, 'max_features': 'sqrt'}. Best is trial 1137 with value: 0.19687116000636118.
[I 2024-12-04 13:22:42,284] Trial 1769 finished with value: 0.24789624907320504 and parameters: {'n_estimators': 1231, 'learning_rate': 0.09558071582018617, 'max_depth': 12, 'min_samples_split': 16, 'min_samples_leaf': 3, 'subsample': 0.7264138569264346, 'max_features': 'sqrt'}. Best is trial 1137 with value: 0.19687116000636118.
[I 2024-12-04 13:22:43,309] Trial 1768 finished with value: 0.22471238306923877 and parameters: {'n_estimators': 1261, 'learning_rate': 0.06790116986933505, 'max_depth': 10, 'min_samples_split': 17, 'min_samples_leaf': 1, 'subsample': 0.710754160137967, 'max_features': 'sqrt'}. Best is trial 1137 with value: 0.19687116000636118.
[I 2024-12-04 13:22:43,967] Trial 1770 finished with value: 0.22002371860767234 and parameters: {'n_estimators': 1218, 'learning_rate': 0.09342330593668079, 'max_depth': 12, 'min_samples_split': 17, 'min_samples_leaf': 1, 'subsample': 0.6681694474259241, 'max_features': 'sqrt'}. Best is trial 1137 with value: 0.19687116000636118.
[I 2024-12-04 13:22:46,168] Trial 1778 finished with value: 0.4461806283265235 and parameters: {'n_estimators': 861, 'learning_rate': 0.06450731612106546, 'max_depth': 9, 'min_samples_split': 18, 'min_samples_leaf': 7, 'subsample': 0.6095647110747517, 'max_features': 'log2'}. Best is trial 1137 with value: 0.19687116000636118.
[I 2024-12-04 13:22:46,996] Trial 1792 finished with value: 0.3832955481829752 and parameters: {'n_estimators': 298, 'learning_rate': 0.04390477747092491, 'max_depth': 10, 'min_samples_split': 20, 'min_samples_leaf': 10, 'subsample': 0.961069843043793, 'max_features': None}. Best is trial 1137 with value: 0.19687116000636118.
[I 2024-12-04 13:22:47,091] Trial 1763 finished with value: 0.21390861283739623 and parameters: {'n_estimators': 1463, 'learning_rate': 0.0717945292728963, 'max_depth': 12, 'min_samples_split': 16, 'min_samples_leaf': 1, 'subsample': 0.7802015709617101, 'max_features': 'sqrt'}. Best is trial 1137 with value: 0.19687116000636118.
[I 2024-12-04 13:22:49,029] Trial 1774 finished with value: 0.4070175185243121 and parameters: {'n_estimators': 1147, 'learning_rate': 0.015188605756863802, 'max_depth': 3, 'min_samples_split': 5, 'min_samples_leaf': 8, 'subsample': 0.6423492821739895, 'max_features': None}. Best is trial 1137 with value: 0.19687116000636118.
[I 2024-12-04 13:22:53,651] Trial 1764 finished with value: 0.3755385674466301 and parameters: {'n_estimators': 1410, 'learning_rate': 0.014131060568780352, 'max_depth': 6, 'min_samples_split': 2, 'min_samples_leaf': 8, 'subsample': 0.8323414400703337, 'max_features': None}. Best is trial 1137 with value: 0.19687116000636118.
[I 2024-12-04 13:22:55,524] Trial 1772 finished with value: 0.4979073171250715 and parameters: {'n_estimators': 1429, 'learning_rate': 0.03373275635775321, 'max_depth': 12, 'min_samples_split': 19, 'min_samples_leaf': 10, 'subsample': 0.8197879179148346, 'max_features': 'log2'}. Best is trial 1137 with value: 0.19687116000636118.
[I 2024-12-04 13:22:55,968] Trial 1771 finished with value: 0.2514838651266929 and parameters: {'n_estimators': 1461, 'learning_rate': 0.054480001582588686, 'max_depth': 10, 'min_samples_split': 20, 'min_samples_leaf': 3, 'subsample': 0.6463589562248719, 'max_features': 'sqrt'}. Best is trial 1137 with value: 0.19687116000636118.
[I 2024-12-04 13:22:59,866] Trial 1780 finished with value: 0.22696444835627166 and parameters: {'n_estimators': 1078, 'learning_rate': 0.04654702557259771, 'max_depth': 12, 'min_samples_split': 17, 'min_samples_leaf': 1, 'subsample': 0.6754572885849612, 'max_features': 'sqrt'}. Best is trial 1137 with value: 0.19687116000636118.
[I 2024-12-04 13:23:00,381] Trial 1779 finished with value: 0.2450353283860029 and parameters: {'n_estimators': 1153, 'learning_rate': 0.07574491049822984, 'max_depth': 12, 'min_samples_split': 20, 'min_samples_leaf': 3, 'subsample': 0.6774894227670161, 'max_features': 'sqrt'}. Best is trial 1137 with value: 0.19687116000636118.
[I 2024-12-04 13:23:01,652] Trial 1793 finished with value: 0.37550204402170156 and parameters: {'n_estimators': 509, 'learning_rate': 0.03119176320536291, 'max_depth': 4, 'min_samples_split': 4, 'min_samples_leaf': 2, 'subsample': 0.8141310547187004, 'max_features': 'sqrt'}. Best is trial 1137 with value: 0.19687116000636118.
[I 2024-12-04 13:23:03,721] Trial 1790 finished with value: 0.29614573762127755 and parameters: {'n_estimators': 582, 'learning_rate': 0.048689948938860764, 'max_depth': 10, 'min_samples_split': 4, 'min_samples_leaf': 4, 'subsample': 0.9482916424255876, 'max_features': None}. Best is trial 1137 with value: 0.19687116000636118.
[I 2024-12-04 13:23:04,269] Trial 1773 finished with value: 0.22123370640967926 and parameters: {'n_estimators': 1496, 'learning_rate': 0.06163913421855342, 'max_depth': 12, 'min_samples_split': 20, 'min_samples_leaf': 1, 'subsample': 0.691266330811513, 'max_features': 'sqrt'}. Best is trial 1137 with value: 0.19687116000636118.
[I 2024-12-04 13:23:04,773] Trial 1781 finished with value: 0.22022917724344743 and parameters: {'n_estimators': 1161, 'learning_rate': 0.06332801587374, 'max_depth': 11, 'min_samples_split': 17, 'min_samples_leaf': 1, 'subsample': 0.6100026870610665, 'max_features': 'sqrt'}. Best is trial 1137 with value: 0.19687116000636118.
[I 2024-12-04 13:23:05,946] Trial 1799 finished with value: 0.29966982253127517 and parameters: {'n_estimators': 165, 'learning_rate': 0.082961765996651, 'max_depth': 7, 'min_samples_split': 6, 'min_samples_leaf': 2, 'subsample': 0.9633211679379368, 'max_features': None}. Best is trial 1137 with value: 0.19687116000636118.
[I 2024-12-04 13:23:07,982] Trial 1776 finished with value: 0.21555673381146004 and parameters: {'n_estimators': 1422, 'learning_rate': 0.0960185388342761, 'max_depth': 11, 'min_samples_split': 15, 'min_samples_leaf': 1, 'subsample': 0.6006256541090444, 'max_features': 'sqrt'}. Best is trial 1137 with value: 0.19687116000636118.
[I 2024-12-04 13:23:08,683] Trial 1796 finished with value: 0.6860169132207341 and parameters: {'n_estimators': 482, 'learning_rate': 0.011638129488369618, 'max_depth': 10, 'min_samples_split': 13, 'min_samples_leaf': 5, 'subsample': 0.7922506562421007, 'max_features': 'log2'}. Best is trial 1137 with value: 0.19687116000636118.
[I 2024-12-04 13:23:09,118] Trial 1785 finished with value: 0.43876048355091923 and parameters: {'n_estimators': 1146, 'learning_rate': 0.09784886199208563, 'max_depth': 9, 'min_samples_split': 3, 'min_samples_leaf': 10, 'subsample': 0.8588266754385202, 'max_features': 'log2'}. Best is trial 1137 with value: 0.19687116000636118.
[I 2024-12-04 13:23:09,120] Trial 1798 finished with value: 0.5879308261839468 and parameters: {'n_estimators': 416, 'learning_rate': 0.014255667066710971, 'max_depth': 11, 'min_samples_split': 12, 'min_samples_leaf': 3, 'subsample': 0.6042764134005456, 'max_features': 'log2'}. Best is trial 1137 with value: 0.19687116000636118.
[I 2024-12-04 13:23:11,361] Trial 1783 finished with value: 0.2159719946657346 and parameters: {'n_estimators': 1238, 'learning_rate': 0.07289133995541199, 'max_depth': 11, 'min_samples_split': 17, 'min_samples_leaf': 1, 'subsample': 0.6878123064213544, 'max_features': 'sqrt'}. Best is trial 1137 with value: 0.19687116000636118.
[I 2024-12-04 13:23:12,031] Trial 1777 finished with value: 0.23811228207093144 and parameters: {'n_estimators': 1484, 'learning_rate': 0.09764965106734368, 'max_depth': 12, 'min_samples_split': 16, 'min_samples_leaf': 2, 'subsample': 0.7002501952070266, 'max_features': 'sqrt'}. Best is trial 1137 with value: 0.19687116000636118.
[I 2024-12-04 13:23:13,212] Trial 1806 finished with value: 0.8634565958146919 and parameters: {'n_estimators': 111, 'learning_rate': 0.041712655148681096, 'max_depth': 8, 'min_samples_split': 3, 'min_samples_leaf': 9, 'subsample': 0.9648454451675088, 'max_features': 'log2'}. Best is trial 1137 with value: 0.19687116000636118.
[I 2024-12-04 13:23:20,702] Trial 1789 finished with value: 0.34123491574657244 and parameters: {'n_estimators': 1063, 'learning_rate': 0.012694696429762897, 'max_depth': 4, 'min_samples_split': 10, 'min_samples_leaf': 4, 'subsample': 0.6533821094697455, 'max_features': None}. Best is trial 1137 with value: 0.19687116000636118.
[I 2024-12-04 13:23:21,952] Trial 1782 finished with value: 0.24477321249889897 and parameters: {'n_estimators': 1455, 'learning_rate': 0.06645547508145351, 'max_depth': 10, 'min_samples_split': 20, 'min_samples_leaf': 2, 'subsample': 0.6620108180635078, 'max_features': 'sqrt'}. Best is trial 1137 with value: 0.19687116000636118.
[I 2024-12-04 13:23:24,838] Trial 1788 finished with value: 0.21007655913184675 and parameters: {'n_estimators': 1055, 'learning_rate': 0.09814284583364001, 'max_depth': 12, 'min_samples_split': 16, 'min_samples_leaf': 1, 'subsample': 0.707342421100585, 'max_features': 'sqrt'}. Best is trial 1137 with value: 0.19687116000636118.
[I 2024-12-04 13:23:28,749] Trial 1787 finished with value: 0.3700030844358066 and parameters: {'n_estimators': 1071, 'learning_rate': 0.01881920563768432, 'max_depth': 11, 'min_samples_split': 4, 'min_samples_leaf': 9, 'subsample': 0.852611873290739, 'max_features': None}. Best is trial 1137 with value: 0.19687116000636118.
[I 2024-12-04 13:23:28,759] Trial 1791 finished with value: 0.24442681079493234 and parameters: {'n_estimators': 1189, 'learning_rate': 0.06730895968043794, 'max_depth': 12, 'min_samples_split': 14, 'min_samples_leaf': 3, 'subsample': 0.6517022171918874, 'max_features': 'sqrt'}. Best is trial 1137 with value: 0.19687116000636118.
