[I 2024-12-04 19:53:12,516] Trial 408 finished with value: 0.3592112823440812 and parameters: {'kernel_type': 'Matern', 'length_scale': 22.51822212518896, 'noise_level': 0.6645154407792953, 'constant_value': 0.02803826981196536, 'nu': 0.5}. Best is trial 199 with value: 0.3592098145876718.
[I 2024-12-04 19:53:12,527] Trial 407 finished with value: 0.3592111133446376 and parameters: {'kernel_type': 'Matern', 'length_scale': 0.22373124862900404, 'noise_level': 0.06217269258701653, 'constant_value': 38579.4552964182, 'nu': 0.5}. Best is trial 199 with value: 0.3592098145876718.
[I 2024-12-04 19:53:12,788] Trial 406 finished with value: 1.062416117288652 and parameters: {'kernel_type': 'Matern', 'length_scale': 8136.922818839589, 'noise_level': 0.03209504181934985, 'constant_value': 0.12045972117227932, 'nu': 0.5}. Best is trial 199 with value: 0.3592098145876718.
[I 2024-12-04 19:53:17,661] Trial 410 finished with value: 0.3592112405214607 and parameters: {'kernel_type': 'Matern', 'length_scale': 133.327795810527, 'noise_level': 0.7369185202094216, 'constant_value': 0.5557748110289414, 'nu': 0.5}. Best is trial 199 with value: 0.3592098145876718.
[I 2024-12-04 19:53:18,802] Trial 409 finished with value: 0.3592111950859596 and parameters: {'kernel_type': 'Matern', 'length_scale': 12.766482021272338, 'noise_level': 0.013782606515296695, 'constant_value': 730.9477591485372, 'nu': 0.5}. Best is trial 199 with value: 0.3592098145876718.
[I 2024-12-04 19:53:19,164] Trial 411 finished with value: 0.3592110331416012 and parameters: {'kernel_type': 'Matern', 'length_scale': 0.22923625608191148, 'noise_level': 0.7375259388380805, 'constant_value': 0.037153057341945225, 'nu': 0.5}. Best is trial 199 with value: 0.3592098145876718.
[I 2024-12-04 19:53:24,157] Trial 414 finished with value: 0.35921107296708826 and parameters: {'kernel_type': 'Matern', 'length_scale': 917.1469872337177, 'noise_level': 0.01157076708033379, 'constant_value': 20.25317658908436, 'nu': 0.5}. Best is trial 199 with value: 0.3592098145876718.
[I 2024-12-04 19:53:24,423] Trial 413 finished with value: 1.062416117263409 and parameters: {'kernel_type': 'Matern', 'length_scale': 62.80358421080679, 'noise_level': 1.148945222378978e-10, 'constant_value': 1.1805246814409665, 'nu': 2.5}. Best is trial 199 with value: 0.3592098145876718.
[I 2024-12-04 19:53:26,009] Trial 412 finished with value: 1.062416117266835 and parameters: {'kernel_type': 'Matern', 'length_scale': 30.186946436916134, 'noise_level': 0.0032750907509948024, 'constant_value': 0.03668739230052133, 'nu': 2.5}. Best is trial 199 with value: 0.3592098145876718.
[I 2024-12-04 19:53:29,347] Trial 415 finished with value: 0.35921059058290405 and parameters: {'kernel_type': 'Matern', 'length_scale': 9.663319080507183, 'noise_level': 0.015042911691248988, 'constant_value': 1.3901787548985278, 'nu': 0.5}. Best is trial 199 with value: 0.3592098145876718.
[I 2024-12-04 19:53:31,313] Trial 417 finished with value: 0.35920946255494596 and parameters: {'kernel_type': 'Matern', 'length_scale': 8.244929929461602, 'noise_level': 0.18275052528963273, 'constant_value': 577.1774267653195, 'nu': 0.5}. Best is trial 417 with value: 0.35920946255494596.
[I 2024-12-04 19:53:33,700] Trial 416 finished with value: 0.3592112434253696 and parameters: {'kernel_type': 'Matern', 'length_scale': 331.76202521904935, 'noise_level': 0.6722469896756603, 'constant_value': 0.0022137563921971566, 'nu': 0.5}. Best is trial 417 with value: 0.35920946255494596.
[I 2024-12-04 19:53:34,315] Trial 418 finished with value: 1.0624161169897695 and parameters: {'kernel_type': 'Matern', 'length_scale': 42.03794877591336, 'noise_level': 0.0051385394343900475, 'constant_value': 0.11566834090072058, 'nu': 0.5}. Best is trial 417 with value: 0.35920946255494596.
[I 2024-12-04 19:53:35,834] Trial 419 finished with value: 0.35921117321975976 and parameters: {'kernel_type': 'Matern', 'length_scale': 0.5440943944635934, 'noise_level': 0.0016404786642665098, 'constant_value': 12.554931035549378, 'nu': 0.5}. Best is trial 417 with value: 0.35920946255494596.
[I 2024-12-04 19:53:38,619] Trial 420 finished with value: 0.3592112471663412 and parameters: {'kernel_type': 'Matern', 'length_scale': 5.473472981689802, 'noise_level': 0.04575990848843567, 'constant_value': 163.20732237212948, 'nu': 0.5}. Best is trial 417 with value: 0.35920946255494596.
[I 2024-12-04 19:53:39,275] Trial 421 finished with value: 0.35920950131692625 and parameters: {'kernel_type': 'Matern', 'length_scale': 0.6188264879775611, 'noise_level': 0.23784073025096067, 'constant_value': 2099.8722424647726, 'nu': 0.5}. Best is trial 417 with value: 0.35920946255494596.
[I 2024-12-04 19:53:40,185] Trial 422 finished with value: 0.42868351307170127 and parameters: {'kernel_type': 'RBF', 'length_scale': 4.01792638192185, 'noise_level': 0.015411005254268915, 'constant_value': 28.300678038382454, 'nu': 0.5}. Best is trial 417 with value: 0.35920946255494596.
[I 2024-12-04 19:53:44,504] Trial 424 finished with value: 0.3592111073720783 and parameters: {'kernel_type': 'Matern', 'length_scale': 11.45834206312987, 'noise_level': 0.5403388052792811, 'constant_value': 3350.6483774793514, 'nu': 0.5}. Best is trial 417 with value: 0.35920946255494596.
[I 2024-12-04 19:53:45,692] Trial 425 finished with value: 0.3592112373570787 and parameters: {'kernel_type': 'Matern', 'length_scale': 0.6406196871695242, 'noise_level': 0.010170779265004546, 'constant_value': 1803.1923293147202, 'nu': 0.5}. Best is trial 417 with value: 0.35920946255494596.
[I 2024-12-04 19:53:46,203] Trial 423 finished with value: 1.0624161170333197 and parameters: {'kernel_type': 'RBF', 'length_scale': 384.13331579637634, 'noise_level': 6.386964185744892e-10, 'constant_value': 0.08448752343394922, 'nu': 2.5}. Best is trial 417 with value: 0.35920946255494596.
[I 2024-12-04 19:53:48,860] Trial 427 finished with value: 1.0624151875947159 and parameters: {'kernel_type': 'Matern', 'length_scale': 0.07488655519203857, 'noise_level': 0.049483234784119534, 'constant_value': 3720.364116151772, 'nu': 0.5}. Best is trial 417 with value: 0.35920946255494596.
[I 2024-12-04 19:53:50,983] Trial 426 finished with value: 0.35921120944535884 and parameters: {'kernel_type': 'Matern', 'length_scale': 0.4725232688851632, 'noise_level': 0.07402338304211442, 'constant_value': 2214.2396529384127, 'nu': 0.5}. Best is trial 417 with value: 0.35920946255494596.
[I 2024-12-04 19:53:51,923] Trial 428 finished with value: 0.35921121887747637 and parameters: {'kernel_type': 'Matern', 'length_scale': 4.954134795159411, 'noise_level': 0.01412442308189975, 'constant_value': 145.84944696445473, 'nu': 0.5}. Best is trial 417 with value: 0.35920946255494596.
[I 2024-12-04 19:53:53,839] Trial 429 finished with value: 0.3592112443534635 and parameters: {'kernel_type': 'Matern', 'length_scale': 1.6850228592587422, 'noise_level': 0.030075098960237752, 'constant_value': 9.283173934762592, 'nu': 0.5}. Best is trial 417 with value: 0.35920946255494596.
[I 2024-12-04 19:53:57,774] Trial 430 finished with value: 0.3592112382921826 and parameters: {'kernel_type': 'Matern', 'length_scale': 0.1336388666439893, 'noise_level': 0.005354535651039385, 'constant_value': 0.25899239234621857, 'nu': 0.5}. Best is trial 417 with value: 0.35920946255494596.
[I 2024-12-04 19:53:58,861] Trial 432 finished with value: 0.3592113212449107 and parameters: {'kernel_type': 'Matern', 'length_scale': 19.528636214933755, 'noise_level': 0.2592684826671823, 'constant_value': 19015.827363198416, 'nu': 0.5}. Best is trial 417 with value: 0.35920946255494596.
[I 2024-12-04 19:54:01,345] Trial 431 finished with value: 0.3592112487435013 and parameters: {'kernel_type': 'Matern', 'length_scale': 0.10677478762289137, 'noise_level': 0.9318595393006778, 'constant_value': 676.9119337307608, 'nu': 0.5}. Best is trial 417 with value: 0.35920946255494596.
[I 2024-12-04 19:54:02,235] Trial 433 finished with value: 0.42269325363907156 and parameters: {'kernel_type': 'Matern', 'length_scale': 0.4259777407346546, 'noise_level': 0.004604739360320026, 'constant_value': 737.0433228942203, 'nu': 1.5}. Best is trial 417 with value: 0.35920946255494596.
[I 2024-12-04 19:54:04,162] Trial 434 finished with value: 0.359210795802465 and parameters: {'kernel_type': 'Matern', 'length_scale': 14.173227350592441, 'noise_level': 0.0022362701352694986, 'constant_value': 0.3316747760232606, 'nu': 0.5}. Best is trial 417 with value: 0.35920946255494596.
[I 2024-12-04 19:54:07,892] Trial 435 finished with value: 0.3592112431972515 and parameters: {'kernel_type': 'Matern', 'length_scale': 2.1806589395378078, 'noise_level': 0.5491480372842489, 'constant_value': 4.0223841717608, 'nu': 0.5}. Best is trial 417 with value: 0.35920946255494596.
[I 2024-12-04 19:54:08,233] Trial 436 finished with value: 1.0624161171373236 and parameters: {'kernel_type': 'Matern', 'length_scale': 0.005436645136043221, 'noise_level': 0.0018113568288096818, 'constant_value': 507.9785229556348, 'nu': 0.5}. Best is trial 417 with value: 0.35920946255494596.
[I 2024-12-04 19:54:10,711] Trial 437 finished with value: 1.062416117258732 and parameters: {'kernel_type': 'Matern', 'length_scale': 32.62795875893453, 'noise_level': 4.5490321063885384e-06, 'constant_value': 0.05226541638600494, 'nu': 0.5}. Best is trial 417 with value: 0.35920946255494596.
[I 2024-12-04 19:54:13,161] Trial 440 finished with value: 1.091654536623407 and parameters: {'kernel_type': 'RBF', 'length_scale': 0.29001701335924096, 'noise_level': 0.399126412170103, 'constant_value': 2.4350208554847876e-05, 'nu': 1.5}. Best is trial 417 with value: 0.35920946255494596.
[I 2024-12-04 19:54:13,227] Trial 438 finished with value: 0.35921067534150913 and parameters: {'kernel_type': 'Matern', 'length_scale': 47.803607884537726, 'noise_level': 0.005113032840808924, 'constant_value': 7.87012663344984, 'nu': 0.5}. Best is trial 417 with value: 0.35920946255494596.
[I 2024-12-04 19:54:14,965] Trial 439 finished with value: 1.0624161173145106 and parameters: {'kernel_type': 'RBF', 'length_scale': 435.24817990502095, 'noise_level': 6.374357141357445e-05, 'constant_value': 5414.077816838794, 'nu': 1.5}. Best is trial 417 with value: 0.35920946255494596.
[I 2024-12-04 19:54:18,422] Trial 441 finished with value: 1.0624161175084808 and parameters: {'kernel_type': 'RBF', 'length_scale': 1.5649695227423712, 'noise_level': 1.7354787917250832e-10, 'constant_value': 0.00021400144624226296, 'nu': 1.5}. Best is trial 417 with value: 0.35920946255494596.
[I 2024-12-04 19:54:18,882] Trial 442 finished with value: 0.3592111298500825 and parameters: {'kernel_type': 'Matern', 'length_scale': 167.8862455904019, 'noise_level': 0.0020170605451490923, 'constant_value': 89.13828846785876, 'nu': 0.5}. Best is trial 417 with value: 0.35920946255494596.
[I 2024-12-04 19:54:21,653] Trial 443 finished with value: 1.0624161172629076 and parameters: {'kernel_type': 'Matern', 'length_scale': 0.0002994932289194786, 'noise_level': 1.1868774257388393e-06, 'constant_value': 4.380985691680045e-07, 'nu': 0.5}. Best is trial 417 with value: 0.35920946255494596.
[I 2024-12-04 19:54:22,984] Trial 444 finished with value: 0.4286835254592314 and parameters: {'kernel_type': 'RBF', 'length_scale': 16.100338093220344, 'noise_level': 0.10256983712441266, 'constant_value': 147.47963407761742, 'nu': 2.5}. Best is trial 417 with value: 0.35920946255494596.
[I 2024-12-04 19:54:23,881] Trial 445 finished with value: 0.3592112248076701 and parameters: {'kernel_type': 'Matern', 'length_scale': 31.35129827108824, 'noise_level': 0.0003140278344077602, 'constant_value': 0.5813595687476231, 'nu': 0.5}. Best is trial 417 with value: 0.35920946255494596.
[I 2024-12-04 19:54:25,800] Trial 447 finished with value: 1.0916558493877166 and parameters: {'kernel_type': 'RBF', 'length_scale': 0.002520037410395293, 'noise_level': 4.000238890284953e-10, 'constant_value': 2.051393962880055, 'nu': 0.5}. Best is trial 417 with value: 0.35920946255494596.
[I 2024-12-04 19:54:27,044] Trial 446 finished with value: 0.3592112591079299 and parameters: {'kernel_type': 'Matern', 'length_scale': 9.178646478767169, 'noise_level': 0.0034145848416671357, 'constant_value': 0.2888779135055061, 'nu': 0.5}. Best is trial 417 with value: 0.35920946255494596.
[I 2024-12-04 19:54:30,618] Trial 448 finished with value: 0.3592093758005386 and parameters: {'kernel_type': 'Matern', 'length_scale': 0.13747430283541215, 'noise_level': 0.0009210379105581729, 'constant_value': 7.6492935487435325, 'nu': 0.5}. Best is trial 448 with value: 0.3592093758005386.
[I 2024-12-04 19:54:31,327] Trial 449 finished with value: 0.3592112524212241 and parameters: {'kernel_type': 'Matern', 'length_scale': 11.413015192624309, 'noise_level': 0.00025595431246564377, 'constant_value': 105.7411802604989, 'nu': 0.5}. Best is trial 448 with value: 0.3592093758005386.
[I 2024-12-04 19:54:36,646] Trial 450 finished with value: 1.0624161175317663 and parameters: {'kernel_type': 'Matern', 'length_scale': 290.8433101125274, 'noise_level': 1.174235806233621e-07, 'constant_value': 0.0032024546886990734, 'nu': 2.5}. Best is trial 448 with value: 0.3592093758005386.
[I 2024-12-04 19:54:38,031] Trial 452 finished with value: 0.35921129656975787 and parameters: {'kernel_type': 'Matern', 'length_scale': 82.82920333831956, 'noise_level': 0.00018389529823695689, 'constant_value': 0.70932611912692, 'nu': 0.5}. Best is trial 448 with value: 0.3592093758005386.
[I 2024-12-04 19:54:40,432] Trial 451 finished with value: 0.35921127606532177 and parameters: {'kernel_type': 'Matern', 'length_scale': 0.07454058157548071, 'noise_level': 2.887358975691934e-05, 'constant_value': 0.5272221401526667, 'nu': 0.5}. Best is trial 448 with value: 0.3592093758005386.
[I 2024-12-04 19:54:41,836] Trial 453 finished with value: 1.0624161173423843 and parameters: {'kernel_type': 'Matern', 'length_scale': 48.29185043984924, 'noise_level': 0.0008990411593613847, 'constant_value': 0.19610505630567787, 'nu': 0.5}. Best is trial 448 with value: 0.3592093758005386.
[I 2024-12-04 19:54:42,072] Trial 454 finished with value: 1.0624160681620518 and parameters: {'kernel_type': 'Matern', 'length_scale': 0.061384558353111164, 'noise_level': 0.0001246312481293383, 'constant_value': 83.73150745591646, 'nu': 0.5}. Best is trial 448 with value: 0.3592093758005386.
[I 2024-12-04 19:54:43,627] Trial 455 finished with value: 1.0624158288388588 and parameters: {'kernel_type': 'Matern', 'length_scale': 0.06886927116468461, 'noise_level': 0.0018795521036004644, 'constant_value': 2.4250832012810286, 'nu': 0.5}. Best is trial 448 with value: 0.3592093758005386.
[I 2024-12-04 19:54:46,138] Trial 456 finished with value: 1.062416117268352 and parameters: {'kernel_type': 'Matern', 'length_scale': 91.45236510721297, 'noise_level': 0.007465857589227747, 'constant_value': 0.1385280658314696, 'nu': 0.5}. Best is trial 448 with value: 0.3592093758005386.
[I 2024-12-04 19:54:46,875] Trial 457 finished with value: 0.428683505903054 and parameters: {'kernel_type': 'RBF', 'length_scale': 29.751452929285215, 'noise_level': 0.7199516927520471, 'constant_value': 856.5783701384873, 'nu': 0.5}. Best is trial 448 with value: 0.3592093758005386.
[I 2024-12-04 19:54:49,353] Trial 458 finished with value: 0.3592112223747683 and parameters: {'kernel_type': 'Matern', 'length_scale': 43.33181308735184, 'noise_level': 0.00641022954857162, 'constant_value': 32.69420672974489, 'nu': 0.5}. Best is trial 448 with value: 0.3592093758005386.
[I 2024-12-04 19:54:52,002] Trial 459 finished with value: 0.3592112245760191 and parameters: {'kernel_type': 'Matern', 'length_scale': 0.1523415045883087, 'noise_level': 0.0002450515822372733, 'constant_value': 0.06926139211862993, 'nu': 0.5}. Best is trial 448 with value: 0.3592093758005386.
[I 2024-12-04 19:54:52,261] Trial 460 finished with value: 0.35921138394728797 and parameters: {'kernel_type': 'Matern', 'length_scale': 0.411977271875187, 'noise_level': 0.0010313878680720538, 'constant_value': 0.5915297314457062, 'nu': 0.5}. Best is trial 448 with value: 0.3592093758005386.
[I 2024-12-04 19:54:54,436] Trial 461 finished with value: 0.4226892884178675 and parameters: {'kernel_type': 'Matern', 'length_scale': 26.764773088161522, 'noise_level': 0.08022415245213114, 'constant_value': 4.092368377090877, 'nu': 1.5}. Best is trial 448 with value: 0.3592093758005386.
[I 2024-12-04 19:54:56,601] Trial 462 finished with value: 0.3592110385343482 and parameters: {'kernel_type': 'Matern', 'length_scale': 3.9524905549993585, 'noise_level': 0.7584885559502267, 'constant_value': 2704.5923128083814, 'nu': 0.5}. Best is trial 448 with value: 0.3592093758005386.
[I 2024-12-04 19:54:57,212] Trial 463 finished with value: 0.35921114988745784 and parameters: {'kernel_type': 'Matern', 'length_scale': 18.082784314156445, 'noise_level': 0.0016073610568318188, 'constant_value': 3.791513475110943, 'nu': 0.5}. Best is trial 448 with value: 0.3592093758005386.
[I 2024-12-04 19:54:57,259] Trial 464 finished with value: 1.0916558489722445 and parameters: {'kernel_type': 'Matern', 'length_scale': 0.13769466236098946, 'noise_level': 2.2624925709253567e-06, 'constant_value': 2.4685425412445623, 'nu': 1.5}. Best is trial 448 with value: 0.3592093758005386.
[I 2024-12-04 19:55:00,624] Trial 467 finished with value: 1.0624161177067162 and parameters: {'kernel_type': 'Matern', 'length_scale': 3.7597663840121873, 'noise_level': 0.0020635833143220904, 'constant_value': 0.002536562356563966, 'nu': 0.5}. Best is trial 448 with value: 0.3592093758005386.
[I 2024-12-04 19:55:00,638] Trial 466 finished with value: 1.0916558493879713 and parameters: {'kernel_type': 'Matern', 'length_scale': 1.3971858070975494e-05, 'noise_level': 1.8321736399257566e-10, 'constant_value': 381.49845415027494, 'nu': 2.5}. Best is trial 448 with value: 0.3592093758005386.
[I 2024-12-04 19:55:02,540] Trial 465 finished with value: 0.35921034629604975 and parameters: {'kernel_type': 'Matern', 'length_scale': 233.27931820305176, 'noise_level': 0.018166405778493506, 'constant_value': 0.6201367699795414, 'nu': 0.5}. Best is trial 448 with value: 0.3592093758005386.
[I 2024-12-04 19:55:05,373] Trial 469 finished with value: 0.359215581004 and parameters: {'kernel_type': 'Matern', 'length_scale': 48.247714339579915, 'noise_level': 0.0025527942881493158, 'constant_value': 9.944415709398571, 'nu': 0.5}. Best is trial 448 with value: 0.3592093758005386.
[I 2024-12-04 19:55:07,050] Trial 468 finished with value: 1.062416115961904 and parameters: {'kernel_type': 'Matern', 'length_scale': 286.3712916644797, 'noise_level': 0.001179783482366489, 'constant_value': 13.459114975352218, 'nu': 1.5}. Best is trial 448 with value: 0.3592093758005386.
[I 2024-12-04 19:55:09,288] Trial 470 finished with value: 1.0624161171607374 and parameters: {'kernel_type': 'Matern', 'length_scale': 2613.621813587049, 'noise_level': 0.0008844793271457423, 'constant_value': 0.015850594839408236, 'nu': 0.5}. Best is trial 448 with value: 0.3592093758005386.
[I 2024-12-04 19:55:10,409] Trial 472 finished with value: 1.0916558493887436 and parameters: {'kernel_type': 'RBF', 'length_scale': 3.26411175449655e-05, 'noise_level': 6.631001975525835e-08, 'constant_value': 5416.439176099228, 'nu': 1.5}. Best is trial 448 with value: 0.3592093758005386.
[I 2024-12-04 19:55:10,948] Trial 471 finished with value: 0.35921127388607815 and parameters: {'kernel_type': 'Matern', 'length_scale': 43.8785003346223, 'noise_level': 0.03861028326525222, 'constant_value': 6.663787439484351, 'nu': 0.5}. Best is trial 448 with value: 0.3592093758005386.
[I 2024-12-04 19:55:15,579] Trial 473 finished with value: 1.0624161172684479 and parameters: {'kernel_type': 'Matern', 'length_scale': 59.963918068356975, 'noise_level': 0.0035837524637421184, 'constant_value': 14.59224209278367, 'nu': 2.5}. Best is trial 448 with value: 0.3592093758005386.
[I 2024-12-04 19:55:15,592] Trial 474 finished with value: 0.3592107793714298 and parameters: {'kernel_type': 'Matern', 'length_scale': 75.50486537849255, 'noise_level': 0.013224163222655473, 'constant_value': 12.27462092081508, 'nu': 0.5}. Best is trial 448 with value: 0.3592093758005386.
[I 2024-12-04 19:55:19,591] Trial 475 finished with value: 0.35921125159644957 and parameters: {'kernel_type': 'Matern', 'length_scale': 25.169612723449138, 'noise_level': 0.012555685483991559, 'constant_value': 0.11061750325009666, 'nu': 0.5}. Best is trial 448 with value: 0.3592093758005386.
[I 2024-12-04 19:55:21,251] Trial 476 finished with value: 1.0624161173109516 and parameters: {'kernel_type': 'Matern', 'length_scale': 3225.925225582384, 'noise_level': 0.0005981503988563916, 'constant_value': 1.3755955383045497, 'nu': 0.5}. Best is trial 448 with value: 0.3592093758005386.
[I 2024-12-04 19:55:22,257] Trial 477 finished with value: 0.3592112553870928 and parameters: {'kernel_type': 'Matern', 'length_scale': 1664.1549838066794, 'noise_level': 0.009180542861236053, 'constant_value': 10.09166336633602, 'nu': 0.5}. Best is trial 448 with value: 0.3592093758005386.
[I 2024-12-04 19:55:25,374] Trial 478 finished with value: 0.3592114704919549 and parameters: {'kernel_type': 'Matern', 'length_scale': 51.27028163251176, 'noise_level': 0.018567009998739517, 'constant_value': 1154.689447489335, 'nu': 0.5}. Best is trial 448 with value: 0.3592093758005386.
[I 2024-12-04 19:55:25,906] Trial 479 finished with value: 0.35921126643949947 and parameters: {'kernel_type': 'Matern', 'length_scale': 241.54065353385747, 'noise_level': 0.010508241518887807, 'constant_value': 4.5410883714568415, 'nu': 0.5}. Best is trial 448 with value: 0.3592093758005386.
[I 2024-12-04 19:55:26,230] Trial 480 finished with value: 1.0916558493585253 and parameters: {'kernel_type': 'Matern', 'length_scale': 0.13057896811045047, 'noise_level': 2.0715047135933344e-05, 'constant_value': 105.72999752826938, 'nu': 2.5}. Best is trial 448 with value: 0.3592093758005386.
