[I 2024-12-03 18:42:42,154] Trial 239 finished with value: 0.4074957536736558 and parameters: {'kernel': 'rbf', 'C': 83.90250582563874, 'gamma': 0.1085882440776653, 'epsilon': 0.11785900484751019}. Best is trial 88 with value: 0.3542875001421725.
[I 2024-12-03 18:42:42,443] Trial 241 finished with value: 0.37693510650377277 and parameters: {'kernel': 'rbf', 'C': 70.07176111191687, 'gamma': 0.0771571656262809, 'epsilon': 0.07494965457519484}. Best is trial 88 with value: 0.3542875001421725.
[I 2024-12-03 18:42:43,098] Trial 238 finished with value: 0.393397643164685 and parameters: {'kernel': 'rbf', 'C': 68.36772364713373, 'gamma': 0.01942059811895991, 'epsilon': 0.05419740179137231}. Best is trial 88 with value: 0.3542875001421725.
[I 2024-12-03 18:42:43,115] Trial 236 finished with value: 0.36672770534359217 and parameters: {'kernel': 'rbf', 'C': 68.91111142377254, 'gamma': 0.031732612994333324, 'epsilon': 0.0685799068264522}. Best is trial 88 with value: 0.3542875001421725.
[I 2024-12-03 18:42:43,559] Trial 243 finished with value: 1.0739299150913122 and parameters: {'kernel': 'poly', 'C': 0.00182954837652293, 'gamma': 0.00010564805206542589, 'epsilon': 0.004284276465891986}. Best is trial 88 with value: 0.3542875001421725.
[I 2024-12-03 18:42:43,566] Trial 240 finished with value: 0.4361308022750521 and parameters: {'kernel': 'rbf', 'C': 10.98158056353613, 'gamma': 0.07205561757815132, 'epsilon': 0.04797210289586705}. Best is trial 88 with value: 0.3542875001421725.
[I 2024-12-03 18:42:43,760] Trial 244 finished with value: 0.3667028908767076 and parameters: {'kernel': 'rbf', 'C': 98.45742171678691, 'gamma': 0.02185230874877125, 'epsilon': 0.027540637118582772}. Best is trial 88 with value: 0.3542875001421725.
[I 2024-12-03 18:42:44,587] Trial 247 finished with value: 0.42887918484024223 and parameters: {'kernel': 'rbf', 'C': 12.24110201956514, 'gamma': 0.046800723058463105, 'epsilon': 0.12588462205020554}. Best is trial 88 with value: 0.3542875001421725.
[I 2024-12-03 18:42:45,842] Trial 249 finished with value: 0.37603702016821167 and parameters: {'kernel': 'rbf', 'C': 95.43291354587356, 'gamma': 0.06793625210510702, 'epsilon': 0.10002449218074011}. Best is trial 88 with value: 0.3542875001421725.
[I 2024-12-03 18:42:45,945] Trial 253 finished with value: 1.03988187931324 and parameters: {'kernel': 'rbf', 'C': 0.002138938348436717, 'gamma': 0.006092636230846228, 'epsilon': 0.018466817324789032}. Best is trial 88 with value: 0.3542875001421725.
[I 2024-12-03 18:42:45,950] Trial 248 finished with value: 0.4248933318894061 and parameters: {'kernel': 'rbf', 'C': 14.789571302143393, 'gamma': 0.01704928791731061, 'epsilon': 0.09716488691694879}. Best is trial 88 with value: 0.3542875001421725.
[I 2024-12-03 18:42:46,029] Trial 242 finished with value: 0.36566015644229144 and parameters: {'kernel': 'rbf', 'C': 86.95530114256584, 'gamma': 0.025611527892152222, 'epsilon': 0.10641507661236352}. Best is trial 88 with value: 0.3542875001421725.
[I 2024-12-03 18:42:46,818] Trial 246 finished with value: 1.7035605159017349 and parameters: {'kernel': 'poly', 'C': 1.6309420259086294, 'gamma': 0.0017393526866417135, 'epsilon': 0.018380872096223792}. Best is trial 88 with value: 0.3542875001421725.
[I 2024-12-03 18:42:46,957] Trial 250 finished with value: 0.3721185208748954 and parameters: {'kernel': 'rbf', 'C': 98.80570300146469, 'gamma': 0.020619971798398876, 'epsilon': 0.1840757989262066}. Best is trial 88 with value: 0.3542875001421725.
[I 2024-12-03 18:42:46,958] Trial 256 finished with value: 0.4280825088541838 and parameters: {'kernel': 'rbf', 'C': 13.781739548228728, 'gamma': 0.021325666709875155, 'epsilon': 0.23311521972223204}. Best is trial 88 with value: 0.3542875001421725.
[I 2024-12-03 18:42:46,958] Trial 252 finished with value: 0.9494001461921813 and parameters: {'kernel': 'sigmoid', 'C': 67.38781254330996, 'gamma': 0.00010660466585381853, 'epsilon': 0.0010324232534604414}. Best is trial 88 with value: 0.3542875001421725.
[I 2024-12-03 18:42:47,569] Trial 245 finished with value: 0.3784152155047952 and parameters: {'kernel': 'rbf', 'C': 45.54278488499627, 'gamma': 0.03168846808366071, 'epsilon': 0.08025514449192751}. Best is trial 88 with value: 0.3542875001421725.
[I 2024-12-03 18:42:47,695] Trial 257 finished with value: 0.40045290959020147 and parameters: {'kernel': 'rbf', 'C': 91.43525569304111, 'gamma': 0.10438664228828491, 'epsilon': 0.10050704505083281}. Best is trial 88 with value: 0.3542875001421725.
[I 2024-12-03 18:42:48,369] Trial 259 finished with value: 2.122773027071118 and parameters: {'kernel': 'poly', 'C': 0.005231177985790717, 'gamma': 0.3516725324593215, 'epsilon': 0.7207699828390555}. Best is trial 88 with value: 0.3542875001421725.
[I 2024-12-03 18:42:48,397] Trial 254 finished with value: 0.37056409091051057 and parameters: {'kernel': 'rbf', 'C': 82.63040047375337, 'gamma': 0.03786329601316332, 'epsilon': 0.029719377751740248}. Best is trial 88 with value: 0.3542875001421725.
[I 2024-12-03 18:42:48,515] Trial 258 finished with value: 0.4116271154077294 and parameters: {'kernel': 'rbf', 'C': 59.87454360146469, 'gamma': 0.01456247715532414, 'epsilon': 0.0682174855507779}. Best is trial 88 with value: 0.3542875001421725.
[I 2024-12-03 18:42:48,516] Trial 251 finished with value: 0.3919616663507737 and parameters: {'kernel': 'rbf', 'C': 97.16654861303125, 'gamma': 0.09445577034721868, 'epsilon': 0.09213105416013331}. Best is trial 88 with value: 0.3542875001421725.
[I 2024-12-03 18:42:48,614] Trial 260 finished with value: 0.3665324990905539 and parameters: {'kernel': 'rbf', 'C': 94.83011074566396, 'gamma': 0.027968666051373093, 'epsilon': 0.08746446612233513}. Best is trial 88 with value: 0.3542875001421725.
[I 2024-12-03 18:42:48,617] Trial 212 finished with value: 0.7564488351926181 and parameters: {'kernel': 'linear', 'C': 74.15972931062574, 'gamma': 0.015066675945611771, 'epsilon': 0.22346542021898064}. Best is trial 88 with value: 0.3542875001421725.
[I 2024-12-03 18:42:49,910] Trial 263 finished with value: 0.3974635439725629 and parameters: {'kernel': 'rbf', 'C': 23.142886153186986, 'gamma': 0.07481999262566967, 'epsilon': 0.15822314277454444}. Best is trial 88 with value: 0.3542875001421725.
[I 2024-12-03 18:42:50,046] Trial 264 finished with value: 0.4100075672188881 and parameters: {'kernel': 'rbf', 'C': 11.595881508964052, 'gamma': 0.005862934796233423, 'epsilon': 0.025695801668257374}. Best is trial 88 with value: 0.3542875001421725.
[I 2024-12-03 18:42:50,068] Trial 261 finished with value: 0.41403254284705915 and parameters: {'kernel': 'rbf', 'C': 95.79578801620879, 'gamma': 0.0024463903372746606, 'epsilon': 0.09685341373863554}. Best is trial 88 with value: 0.3542875001421725.
[I 2024-12-03 18:42:50,178] Trial 268 finished with value: 0.4191298364761583 and parameters: {'kernel': 'rbf', 'C': 17.28644100201195, 'gamma': 0.025439196036898985, 'epsilon': 0.13695149359423286}. Best is trial 88 with value: 0.3542875001421725.
[I 2024-12-03 18:42:50,360] Trial 270 finished with value: 0.3673713465634545 and parameters: {'kernel': 'rbf', 'C': 98.41652462799287, 'gamma': 0.02192802017817936, 'epsilon': 0.11128918288980505}. Best is trial 88 with value: 0.3542875001421725.
[I 2024-12-03 18:42:50,659] Trial 255 finished with value: 0.36525314335487713 and parameters: {'kernel': 'rbf', 'C': 63.74796605855904, 'gamma': 0.03023913054725256, 'epsilon': 0.12894574629711184}. Best is trial 88 with value: 0.3542875001421725.
[I 2024-12-03 18:42:50,886] Trial 265 finished with value: 946.7029862385266 and parameters: {'kernel': 'sigmoid', 'C': 80.67438641920096, 'gamma': 0.01006390645882432, 'epsilon': 0.03950225895253426}. Best is trial 88 with value: 0.3542875001421725.
[I 2024-12-03 18:42:51,018] Trial 266 finished with value: 0.3978636113379411 and parameters: {'kernel': 'rbf', 'C': 77.8914724189445, 'gamma': 0.015862593023725894, 'epsilon': 0.08044938964662736}. Best is trial 88 with value: 0.3542875001421725.
[I 2024-12-03 18:42:53,110] Trial 276 finished with value: 0.3636148132086077 and parameters: {'kernel': 'rbf', 'C': 92.31138348136929, 'gamma': 0.05721358127988284, 'epsilon': 0.17207169279335027}. Best is trial 88 with value: 0.3542875001421725.
[I 2024-12-03 18:42:53,800] Trial 273 finished with value: 1.0676262776761696 and parameters: {'kernel': 'sigmoid', 'C': 0.0014692123791214052, 'gamma': 0.9208065056085671, 'epsilon': 0.036380265061356346}. Best is trial 88 with value: 0.3542875001421725.
[I 2024-12-03 18:42:54,209] Trial 279 finished with value: 0.49128440542185775 and parameters: {'kernel': 'rbf', 'C': 32.785854624956286, 'gamma': 0.13461581143534138, 'epsilon': 0.279454000369714}. Best is trial 88 with value: 0.3542875001421725.
[I 2024-12-03 18:42:54,366] Trial 275 finished with value: 0.3684534675562969 and parameters: {'kernel': 'rbf', 'C': 80.19108062633654, 'gamma': 0.05265284555631068, 'epsilon': 0.2343128263234501}. Best is trial 88 with value: 0.3542875001421725.
[I 2024-12-03 18:42:54,371] Trial 269 finished with value: 0.5706726874886278 and parameters: {'kernel': 'rbf', 'C': 7.3184801220870055, 'gamma': 0.08923849688961029, 'epsilon': 0.5852188523761898}. Best is trial 88 with value: 0.3542875001421725.
[I 2024-12-03 18:42:54,814] Trial 271 finished with value: 0.6422542453813932 and parameters: {'kernel': 'rbf', 'C': 48.03085478342178, 'gamma': 0.003413858455803748, 'epsilon': 0.8556838884408192}. Best is trial 88 with value: 0.3542875001421725.
[I 2024-12-03 18:42:54,817] Trial 278 finished with value: 0.3647269008484875 and parameters: {'kernel': 'rbf', 'C': 85.96658934093593, 'gamma': 0.0338084274633643, 'epsilon': 0.12929418425503955}. Best is trial 88 with value: 0.3542875001421725.
[I 2024-12-03 18:42:54,842] Trial 274 finished with value: 0.42365163558823593 and parameters: {'kernel': 'rbf', 'C': 12.863886696992907, 'gamma': 0.06854530062528796, 'epsilon': 0.23322734292072927}. Best is trial 88 with value: 0.3542875001421725.
[I 2024-12-03 18:42:54,859] Trial 272 finished with value: 0.7973358765326952 and parameters: {'kernel': 'linear', 'C': 1.5858026601920014, 'gamma': 0.0016446992741987506, 'epsilon': 0.001083875709188929}. Best is trial 88 with value: 0.3542875001421725.
[I 2024-12-03 18:42:55,420] Trial 277 finished with value: 0.35949063496686634 and parameters: {'kernel': 'rbf', 'C': 84.04925985844231, 'gamma': 0.044548344106325924, 'epsilon': 0.24082565834464453}. Best is trial 88 with value: 0.3542875001421725.
[I 2024-12-03 18:42:55,591] Trial 267 finished with value: 0.36183137794143233 and parameters: {'kernel': 'rbf', 'C': 90.30691773978913, 'gamma': 0.040106371362858675, 'epsilon': 0.07067095215738063}. Best is trial 88 with value: 0.3542875001421725.
[I 2024-12-03 18:42:55,613] Trial 282 finished with value: 0.35486844372112186 and parameters: {'kernel': 'rbf', 'C': 97.1012055187327, 'gamma': 0.04278236771523243, 'epsilon': 0.11496478339412895}. Best is trial 88 with value: 0.3542875001421725.
[I 2024-12-03 18:42:55,773] Trial 285 finished with value: 0.7914586077194129 and parameters: {'kernel': 'linear', 'C': 0.16181980843199895, 'gamma': 0.5076435530244456, 'epsilon': 0.15217857805454593}. Best is trial 88 with value: 0.3542875001421725.
[I 2024-12-03 18:42:55,775] Trial 281 finished with value: 0.4697665939051265 and parameters: {'kernel': 'rbf', 'C': 83.01449950481536, 'gamma': 0.13719367672882812, 'epsilon': 0.20715612397780545}. Best is trial 88 with value: 0.3542875001421725.
[I 2024-12-03 18:42:55,935] Trial 284 finished with value: 1.0688467849428473 and parameters: {'kernel': 'poly', 'C': 0.0012457300106733145, 'gamma': 0.0015712400265776327, 'epsilon': 0.015923624628551052}. Best is trial 88 with value: 0.3542875001421725.
[I 2024-12-03 18:42:56,442] Trial 287 finished with value: 0.547924597668083 and parameters: {'kernel': 'rbf', 'C': 24.161083382527874, 'gamma': 0.256375800374516, 'epsilon': 0.028613561252907167}. Best is trial 88 with value: 0.3542875001421725.
[I 2024-12-03 18:42:56,457] Trial 280 finished with value: 3.284494452914587 and parameters: {'kernel': 'poly', 'C': 81.86349474848735, 'gamma': 0.029780560315411413, 'epsilon': 0.6797785374846774}. Best is trial 88 with value: 0.3542875001421725.
[I 2024-12-03 18:42:57,581] Trial 288 finished with value: 0.39369411551041505 and parameters: {'kernel': 'rbf', 'C': 89.27623910469468, 'gamma': 0.07637218191561941, 'epsilon': 0.2408321468785035}. Best is trial 88 with value: 0.3542875001421725.
[I 2024-12-03 18:42:58,117] Trial 286 finished with value: 363.0753921341981 and parameters: {'kernel': 'sigmoid', 'C': 28.43340100625216, 'gamma': 0.011664691838999326, 'epsilon': 0.17115369182227358}. Best is trial 88 with value: 0.3542875001421725.
[I 2024-12-03 18:42:58,989] Trial 291 finished with value: 0.38787398397711514 and parameters: {'kernel': 'rbf', 'C': 94.15071604367984, 'gamma': 0.08387127950750047, 'epsilon': 0.08726970650562324}. Best is trial 88 with value: 0.3542875001421725.
[I 2024-12-03 18:42:59,309] Trial 290 finished with value: 0.5319970716889812 and parameters: {'kernel': 'rbf', 'C': 98.41838000791944, 'gamma': 0.02295922608491132, 'epsilon': 0.8665775015943202}. Best is trial 88 with value: 0.3542875001421725.
[I 2024-12-03 18:42:59,720] Trial 289 finished with value: 1.0944387138714082 and parameters: {'kernel': 'rbf', 'C': 0.001213268371199877, 'gamma': 0.0005471977148853488, 'epsilon': 0.964164952022237}. Best is trial 88 with value: 0.3542875001421725.
[I 2024-12-03 18:43:00,046] Trial 295 finished with value: 0.43358305333609914 and parameters: {'kernel': 'rbf', 'C': 9.103022925216631, 'gamma': 0.03477285866364349, 'epsilon': 0.136435870388705}. Best is trial 88 with value: 0.3542875001421725.
[I 2024-12-03 18:43:00,132] Trial 294 finished with value: 0.43587922423711456 and parameters: {'kernel': 'rbf', 'C': 18.16702021396785, 'gamma': 0.012812904505876247, 'epsilon': 0.20827726634991792}. Best is trial 88 with value: 0.3542875001421725.
[I 2024-12-03 18:43:00,171] Trial 297 finished with value: 0.35877502872553546 and parameters: {'kernel': 'rbf', 'C': 72.70451870977612, 'gamma': 0.044961876889607594, 'epsilon': 0.2081015924676361}. Best is trial 88 with value: 0.3542875001421725.
[I 2024-12-03 18:43:00,403] Trial 292 finished with value: 0.36924342974164287 and parameters: {'kernel': 'rbf', 'C': 46.48701331031826, 'gamma': 0.036273561300294105, 'epsilon': 0.1536216308996035}. Best is trial 88 with value: 0.3542875001421725.
[I 2024-12-03 18:43:00,521] Trial 298 finished with value: 0.3733255649046043 and parameters: {'kernel': 'rbf', 'C': 84.74153722220562, 'gamma': 0.01874877972875285, 'epsilon': 0.18589101440582184}. Best is trial 88 with value: 0.3542875001421725.
[I 2024-12-03 18:43:01,887] Trial 304 finished with value: 0.36395673389125205 and parameters: {'kernel': 'rbf', 'C': 93.7327982244279, 'gamma': 0.05147593321604091, 'epsilon': 0.20602564289663994}. Best is trial 88 with value: 0.3542875001421725.
[I 2024-12-03 18:43:02,247] Trial 303 finished with value: 0.7007561621914309 and parameters: {'kernel': 'rbf', 'C': 25.117794016510082, 'gamma': 0.4772378905865221, 'epsilon': 0.25552478783484717}. Best is trial 88 with value: 0.3542875001421725.
[I 2024-12-03 18:43:02,297] Trial 305 finished with value: 0.3635234774051893 and parameters: {'kernel': 'rbf', 'C': 86.63595204793059, 'gamma': 0.04021741796803532, 'epsilon': 0.28061852789824104}. Best is trial 88 with value: 0.3542875001421725.
[I 2024-12-03 18:43:02,716] Trial 299 finished with value: 0.9420746397545932 and parameters: {'kernel': 'rbf', 'C': 0.04008323120092186, 'gamma': 0.00084284928514146, 'epsilon': 0.00600365366608151}. Best is trial 88 with value: 0.3542875001421725.
[I 2024-12-03 18:43:02,760] Trial 300 finished with value: 0.6049951839280293 and parameters: {'kernel': 'rbf', 'C': 16.5979846027873, 'gamma': 0.33625919964640205, 'epsilon': 0.0928377160560071}. Best is trial 88 with value: 0.3542875001421725.
[I 2024-12-03 18:43:02,852] Trial 296 finished with value: 1868.9420127417688 and parameters: {'kernel': 'sigmoid', 'C': 79.71825281598365, 'gamma': 0.272236973010753, 'epsilon': 0.13692173870104668}. Best is trial 88 with value: 0.3542875001421725.
[I 2024-12-03 18:43:02,857] Trial 302 finished with value: 1.069732195866784 and parameters: {'kernel': 'rbf', 'C': 0.002798651672175124, 'gamma': 0.775572257649368, 'epsilon': 0.008398811449448653}. Best is trial 88 with value: 0.3542875001421725.
[I 2024-12-03 18:43:03,260] Trial 293 finished with value: 0.7948591646657982 and parameters: {'kernel': 'linear', 'C': 3.2129116005706364, 'gamma': 0.2015603865389047, 'epsilon': 0.0018215547060880985}. Best is trial 88 with value: 0.3542875001421725.
[I 2024-12-03 18:43:03,421] Trial 306 finished with value: 0.3642577867239185 and parameters: {'kernel': 'rbf', 'C': 89.03237371409226, 'gamma': 0.03162256338620754, 'epsilon': 0.32749843085644104}. Best is trial 88 with value: 0.3542875001421725.
[I 2024-12-03 18:43:03,451] Trial 308 finished with value: 0.4450599748945805 and parameters: {'kernel': 'rbf', 'C': 8.188117789235498, 'gamma': 0.048709688337180417, 'epsilon': 0.32476630696701214}. Best is trial 88 with value: 0.3542875001421725.
[I 2024-12-03 18:43:03,455] Trial 307 finished with value: 0.4603257910402835 and parameters: {'kernel': 'rbf', 'C': 66.11777408296574, 'gamma': 0.08185880309335565, 'epsilon': 0.4091773095494351}. Best is trial 88 with value: 0.3542875001421725.
[I 2024-12-03 18:43:03,809] Trial 310 finished with value: 0.3915930292455769 and parameters: {'kernel': 'rbf', 'C': 27.996180235859548, 'gamma': 0.08048134247005369, 'epsilon': 0.1705008289904924}. Best is trial 88 with value: 0.3542875001421725.
[I 2024-12-03 18:43:03,810] Trial 301 finished with value: 0.40337148445523135 and parameters: {'kernel': 'rbf', 'C': 86.06525086907303, 'gamma': 0.0673066626545503, 'epsilon': 0.32163199300831924}. Best is trial 88 with value: 0.3542875001421725.
[I 2024-12-03 18:43:04,653] Trial 309 finished with value: 0.4313813779046534 and parameters: {'kernel': 'rbf', 'C': 24.979504998404202, 'gamma': 0.10343727692181195, 'epsilon': 0.200850300111013}. Best is trial 88 with value: 0.3542875001421725.
[I 2024-12-03 18:43:05,304] Trial 313 finished with value: 0.39086379879588945 and parameters: {'kernel': 'rbf', 'C': 33.023473314117986, 'gamma': 0.04316216726291728, 'epsilon': 0.35947894045422296}. Best is trial 88 with value: 0.3542875001421725.
[I 2024-12-03 18:43:05,524] Trial 317 finished with value: 0.3967781496826977 and parameters: {'kernel': 'rbf', 'C': 95.6216386089705, 'gamma': 0.008361086852519527, 'epsilon': 0.2452871616955434}. Best is trial 88 with value: 0.3542875001421725.
[I 2024-12-03 18:43:05,895] Trial 315 finished with value: 0.3857656075702227 and parameters: {'kernel': 'rbf', 'C': 39.464310675637336, 'gamma': 0.019173128773638366, 'epsilon': 0.33678628645804193}. Best is trial 88 with value: 0.3542875001421725.
[I 2024-12-03 18:43:05,984] Trial 312 finished with value: 0.5293190204554773 and parameters: {'kernel': 'rbf', 'C': 12.537217150354005, 'gamma': 0.016788462717804178, 'epsilon': 0.6718309027033426}. Best is trial 88 with value: 0.3542875001421725.
[I 2024-12-03 18:43:06,519] Trial 311 finished with value: 0.44012295801871826 and parameters: {'kernel': 'rbf', 'C': 81.68268767202274, 'gamma': 0.11252857455749361, 'epsilon': 0.21782147955052686}. Best is trial 88 with value: 0.3542875001421725.
[I 2024-12-03 18:43:06,521] Trial 321 finished with value: 0.43139285305335784 and parameters: {'kernel': 'rbf', 'C': 76.31336385417121, 'gamma': 0.014098730947928323, 'epsilon': 0.5543456717977177}. Best is trial 88 with value: 0.3542875001421725.
[I 2024-12-03 18:43:07,003] Trial 324 finished with value: 0.3758086349263989 and parameters: {'kernel': 'rbf', 'C': 42.808566852686134, 'gamma': 0.025031431542042022, 'epsilon': 0.24684581111173176}. Best is trial 88 with value: 0.3542875001421725.
[I 2024-12-03 18:43:07,667] Trial 323 finished with value: 0.3685393464384974 and parameters: {'kernel': 'rbf', 'C': 70.1098208290163, 'gamma': 0.02621324989466911, 'epsilon': 0.2624622441663267}. Best is trial 88 with value: 0.3542875001421725.
[I 2024-12-03 18:43:07,866] Trial 320 finished with value: 0.36325380604632745 and parameters: {'kernel': 'rbf', 'C': 77.0315492594834, 'gamma': 0.03272016965834532, 'epsilon': 0.3007241772324994}. Best is trial 88 with value: 0.3542875001421725.
[I 2024-12-03 18:43:07,894] Trial 325 finished with value: 0.6815682585469388 and parameters: {'kernel': 'rbf', 'C': 56.22419073494639, 'gamma': 0.1722409516185472, 'epsilon': 0.6662528627617628}. Best is trial 88 with value: 0.3542875001421725.
[I 2024-12-03 18:43:07,929] Trial 327 finished with value: 0.38183881057761193 and parameters: {'kernel': 'rbf', 'C': 91.1235033497555, 'gamma': 0.07676676386569305, 'epsilon': 0.08262153540807043}. Best is trial 88 with value: 0.3542875001421725.
[I 2024-12-03 18:43:08,276] Trial 322 finished with value: 0.7578824202882057 and parameters: {'kernel': 'rbf', 'C': 0.14989429863488257, 'gamma': 0.0033810630072411184, 'epsilon': 0.03822112207204824}. Best is trial 88 with value: 0.3542875001421725.
[I 2024-12-03 18:43:09,298] Trial 326 finished with value: 0.40723038502636094 and parameters: {'kernel': 'rbf', 'C': 97.5232417829751, 'gamma': 0.1118901432076053, 'epsilon': 0.08791953267779948}. Best is trial 88 with value: 0.3542875001421725.
[I 2024-12-03 18:43:09,590] Trial 318 finished with value: 3.085175212387874 and parameters: {'kernel': 'poly', 'C': 14.949280959693004, 'gamma': 0.011464916295497899, 'epsilon': 0.3044955108330534}. Best is trial 88 with value: 0.3542875001421725.
[I 2024-12-03 18:43:09,696] Trial 329 finished with value: 0.40111632830421756 and parameters: {'kernel': 'rbf', 'C': 20.73586628176857, 'gamma': 0.05230403832361954, 'epsilon': 0.26140251472092974}. Best is trial 88 with value: 0.3542875001421725.
