[I 2024-12-04 19:57:49,145] Trial 557 finished with value: 0.35921124016831485 and parameters: {'kernel_type': 'Matern', 'length_scale': 11657.382073133895, 'noise_level': 0.054727374657060644, 'constant_value': 86.93043381175384, 'nu': 0.5}. Best is trial 448 with value: 0.3592093758005386.
[I 2024-12-04 19:57:50,370] Trial 556 finished with value: 0.35921116513141016 and parameters: {'kernel_type': 'Matern', 'length_scale': 46890.682173901056, 'noise_level': 0.27743931950205475, 'constant_value': 0.33621224100331776, 'nu': 0.5}. Best is trial 448 with value: 0.3592093758005386.
[I 2024-12-04 19:57:53,258] Trial 558 finished with value: 1.062416117207369 and parameters: {'kernel_type': 'RBF', 'length_scale': 8.753877682980248e-05, 'noise_level': 0.01171613099656504, 'constant_value': 11046.433251757515, 'nu': 0.5}. Best is trial 448 with value: 0.3592093758005386.
[I 2024-12-04 19:57:53,873] Trial 559 finished with value: 0.3592111100052146 and parameters: {'kernel_type': 'Matern', 'length_scale': 3.5588253847246034, 'noise_level': 0.0031549057914544774, 'constant_value': 0.13889689757702584, 'nu': 0.5}. Best is trial 448 with value: 0.3592093758005386.
[I 2024-12-04 19:57:55,282] Trial 560 finished with value: 0.3592121458688123 and parameters: {'kernel_type': 'Matern', 'length_scale': 25.933323237190077, 'noise_level': 0.029836862249933177, 'constant_value': 0.4544672465820209, 'nu': 0.5}. Best is trial 448 with value: 0.3592093758005386.
[I 2024-12-04 19:57:56,388] Trial 561 finished with value: 1.0916558493697355 and parameters: {'kernel_type': 'Matern', 'length_scale': 0.07786188402080044, 'noise_level': 7.025490169303507e-10, 'constant_value': 25.683638748304098, 'nu': 0.5}. Best is trial 448 with value: 0.3592093758005386.
[I 2024-12-04 19:57:59,490] Trial 562 finished with value: 0.35921122096926883 and parameters: {'kernel_type': 'Matern', 'length_scale': 328.8303389630862, 'noise_level': 0.07979167521781874, 'constant_value': 0.32540976589262244, 'nu': 0.5}. Best is trial 448 with value: 0.3592093758005386.
[I 2024-12-04 19:58:00,340] Trial 563 finished with value: 0.3592112181633764 and parameters: {'kernel_type': 'Matern', 'length_scale': 439.6687848947136, 'noise_level': 0.99752500708008, 'constant_value': 0.27949161090043867, 'nu': 0.5}. Best is trial 448 with value: 0.3592093758005386.
[I 2024-12-04 19:58:01,195] Trial 564 finished with value: 0.3592112283531209 and parameters: {'kernel_type': 'Matern', 'length_scale': 0.6047942576820753, 'noise_level': 0.04205301512578089, 'constant_value': 5.934357526421342, 'nu': 0.5}. Best is trial 448 with value: 0.3592093758005386.
[I 2024-12-04 19:58:03,829] Trial 566 finished with value: 1.0916567285186718 and parameters: {'kernel_type': 'RBF', 'length_scale': 50841.834327707715, 'noise_level': 0.05721671865130261, 'constant_value': 9.7235068392395e-07, 'nu': 2.5}. Best is trial 448 with value: 0.3592093758005386.
[I 2024-12-04 19:58:04,278] Trial 565 finished with value: 0.3592121139351221 and parameters: {'kernel_type': 'Matern', 'length_scale': 3.5670166243348254, 'noise_level': 0.0020259091829504224, 'constant_value': 6.271795082488782, 'nu': 0.5}. Best is trial 448 with value: 0.3592093758005386.
[I 2024-12-04 19:58:04,769] Trial 567 finished with value: 1.0624161167029254 and parameters: {'kernel_type': 'Matern', 'length_scale': 492.69731440522685, 'noise_level': 0.0013377245358273517, 'constant_value': 0.862720069691099, 'nu': 0.5}. Best is trial 448 with value: 0.3592093758005386.
[I 2024-12-04 19:58:09,537] Trial 569 finished with value: 0.42868337693751307 and parameters: {'kernel_type': 'RBF', 'length_scale': 0.441211559793076, 'noise_level': 0.008535527621085696, 'constant_value': 5183.884567337769, 'nu': 0.5}. Best is trial 448 with value: 0.3592093758005386.
[I 2024-12-04 19:58:10,094] Trial 570 finished with value: 1.0624161172790807 and parameters: {'kernel_type': 'Matern', 'length_scale': 464.85774401422856, 'noise_level': 0.0006549939963997091, 'constant_value': 0.06115744614203792, 'nu': 0.5}. Best is trial 448 with value: 0.3592093758005386.
[I 2024-12-04 19:58:13,563] Trial 568 finished with value: 0.4226898559229671 and parameters: {'kernel_type': 'Matern', 'length_scale': 0.4800231280917673, 'noise_level': 2.8144932440295972e-05, 'constant_value': 1.6938132160991102e-07, 'nu': 1.5}. Best is trial 448 with value: 0.3592093758005386.
[I 2024-12-04 19:58:14,653] Trial 571 finished with value: 0.35921232434392625 and parameters: {'kernel_type': 'Matern', 'length_scale': 753.0274972804641, 'noise_level': 0.39686877874573284, 'constant_value': 0.6743320949248487, 'nu': 0.5}. Best is trial 448 with value: 0.3592093758005386.
[I 2024-12-04 19:58:15,767] Trial 572 finished with value: 0.4226897598139937 and parameters: {'kernel_type': 'Matern', 'length_scale': 41.97632950881899, 'noise_level': 0.049804439565604854, 'constant_value': 35.25226438127886, 'nu': 1.5}. Best is trial 448 with value: 0.3592093758005386.
[I 2024-12-04 19:58:18,228] Trial 573 finished with value: 0.359210888477165 and parameters: {'kernel_type': 'Matern', 'length_scale': 70.57366856645052, 'noise_level': 0.03378049355555326, 'constant_value': 2.100813068680926, 'nu': 0.5}. Best is trial 448 with value: 0.3592093758005386.
[I 2024-12-04 19:58:20,061] Trial 574 finished with value: 0.35921078167852194 and parameters: {'kernel_type': 'Matern', 'length_scale': 16.108238345644402, 'noise_level': 0.7762422215664435, 'constant_value': 765.222554873548, 'nu': 0.5}. Best is trial 448 with value: 0.3592093758005386.
[I 2024-12-04 19:58:22,085] Trial 576 finished with value: 1.0624161174085407 and parameters: {'kernel_type': 'Matern', 'length_scale': 0.00042971061892909605, 'noise_level': 0.003958087729408981, 'constant_value': 0.1214544796399345, 'nu': 0.5}. Best is trial 448 with value: 0.3592093758005386.
[I 2024-12-04 19:58:23,170] Trial 575 finished with value: 1.0624161176529734 and parameters: {'kernel_type': 'Matern', 'length_scale': 0.000810629552604736, 'noise_level': 1.0752594170901306e-06, 'constant_value': 0.8536992925086849, 'nu': 2.5}. Best is trial 448 with value: 0.3592093758005386.
[I 2024-12-04 19:58:25,464] Trial 577 finished with value: 0.3592112058262803 and parameters: {'kernel_type': 'Matern', 'length_scale': 3.301433843348969, 'noise_level': 0.26716504199680974, 'constant_value': 4788.218867635287, 'nu': 0.5}. Best is trial 448 with value: 0.3592093758005386.
[I 2024-12-04 19:58:27,097] Trial 578 finished with value: 0.3592112400584853 and parameters: {'kernel_type': 'Matern', 'length_scale': 218.90314026675725, 'noise_level': 0.17036948541424374, 'constant_value': 840.3486475015891, 'nu': 0.5}. Best is trial 448 with value: 0.3592093758005386.
[I 2024-12-04 19:58:28,409] Trial 579 finished with value: 0.3592111471836555 and parameters: {'kernel_type': 'Matern', 'length_scale': 24.922515710036066, 'noise_level': 0.20964362603343184, 'constant_value': 2215.4042459270104, 'nu': 0.5}. Best is trial 448 with value: 0.3592093758005386.
[I 2024-12-04 19:58:31,037] Trial 580 finished with value: 0.3592112451298469 and parameters: {'kernel_type': 'Matern', 'length_scale': 0.22561491968026165, 'noise_level': 0.06524969606808205, 'constant_value': 364.0691733255387, 'nu': 0.5}. Best is trial 448 with value: 0.3592093758005386.
[I 2024-12-04 19:58:33,702] Trial 582 finished with value: 0.35921126272019344 and parameters: {'kernel_type': 'Matern', 'length_scale': 26.116103211111614, 'noise_level': 0.20988724801252814, 'constant_value': 1217.178249390897, 'nu': 0.5}. Best is trial 448 with value: 0.3592093758005386.
[I 2024-12-04 19:58:35,402] Trial 583 finished with value: 0.4195657085783032 and parameters: {'kernel_type': 'Matern', 'length_scale': 15.025824592350336, 'noise_level': 0.06524081189110419, 'constant_value': 5.869832949251775, 'nu': 2.5}. Best is trial 448 with value: 0.3592093758005386.
[I 2024-12-04 19:58:36,468] Trial 581 finished with value: 1.0624161206101566 and parameters: {'kernel_type': 'Matern', 'length_scale': 17263.864838254343, 'noise_level': 6.953564879650638e-10, 'constant_value': 0.0002860197034162825, 'nu': 1.5}. Best is trial 448 with value: 0.3592093758005386.
[I 2024-12-04 19:58:38,651] Trial 584 finished with value: 0.3592099887705469 and parameters: {'kernel_type': 'Matern', 'length_scale': 5.77516896951583, 'noise_level': 0.2929025685777837, 'constant_value': 6.657899182692449, 'nu': 0.5}. Best is trial 448 with value: 0.3592093758005386.
[I 2024-12-04 19:58:39,961] Trial 585 finished with value: 0.35921178966098527 and parameters: {'kernel_type': 'Matern', 'length_scale': 1.7322737199552667, 'noise_level': 0.2794046102953276, 'constant_value': 1102.8813571232583, 'nu': 0.5}. Best is trial 448 with value: 0.3592093758005386.
[I 2024-12-04 19:58:43,217] Trial 586 finished with value: 1.0624161172629076 and parameters: {'kernel_type': 'Matern', 'length_scale': 0.000754296866583868, 'noise_level': 3.2169378040077897e-09, 'constant_value': 1.8529617304868874e-07, 'nu': 2.5}. Best is trial 448 with value: 0.3592093758005386.
[I 2024-12-04 19:58:43,757] Trial 587 finished with value: 0.35921084214437 and parameters: {'kernel_type': 'Matern', 'length_scale': 0.787269182393156, 'noise_level': 0.1616795892443067, 'constant_value': 0.2358247658147817, 'nu': 0.5}. Best is trial 448 with value: 0.3592093758005386.
[I 2024-12-04 19:58:45,340] Trial 588 finished with value: 0.35921100282890417 and parameters: {'kernel_type': 'Matern', 'length_scale': 46.75656780036508, 'noise_level': 0.4676882488529285, 'constant_value': 3.3653865481078022, 'nu': 0.5}. Best is trial 448 with value: 0.3592093758005386.
[I 2024-12-04 19:58:53,179] Trial 590 finished with value: 0.3592111446912107 and parameters: {'kernel_type': 'Matern', 'length_scale': 295.25565295158333, 'noise_level': 0.8537498020659076, 'constant_value': 2.388292238759959, 'nu': 0.5}. Best is trial 448 with value: 0.3592093758005386.
[I 2024-12-04 19:58:55,886] Trial 591 finished with value: 1.0624161172708486 and parameters: {'kernel_type': 'Matern', 'length_scale': 0.019791380116975364, 'noise_level': 3.4331201510440514e-10, 'constant_value': 0.03434775553778083, 'nu': 1.5}. Best is trial 448 with value: 0.3592093758005386.
[I 2024-12-04 19:58:57,844] Trial 589 finished with value: 1.0624161182750949 and parameters: {'kernel_type': 'RBF', 'length_scale': 16.203104117720972, 'noise_level': 5.691308621724545e-05, 'constant_value': 7.435422633348985e-07, 'nu': 1.5}. Best is trial 448 with value: 0.3592093758005386.
[I 2024-12-04 19:58:59,597] Trial 592 finished with value: 0.3592111612569766 and parameters: {'kernel_type': 'Matern', 'length_scale': 0.3650906304782793, 'noise_level': 0.6912031769799484, 'constant_value': 0.5411945144475878, 'nu': 0.5}. Best is trial 448 with value: 0.3592093758005386.
[I 2024-12-04 19:59:02,830] Trial 593 finished with value: 1.0624161174531872 and parameters: {'kernel_type': 'Matern', 'length_scale': 5021.740955260911, 'noise_level': 8.054223082222008e-10, 'constant_value': 411.55786156693534, 'nu': 1.5}. Best is trial 448 with value: 0.3592093758005386.
[I 2024-12-04 19:59:03,076] Trial 594 finished with value: 0.35921118866566926 and parameters: {'kernel_type': 'Matern', 'length_scale': 9.922658060713195, 'noise_level': 0.6047538208000023, 'constant_value': 0.904118049779175, 'nu': 0.5}. Best is trial 448 with value: 0.3592093758005386.
[I 2024-12-04 19:59:05,313] Trial 595 finished with value: 0.3592114764233194 and parameters: {'kernel_type': 'Matern', 'length_scale': 3808.9402914476495, 'noise_level': 0.7599911216168203, 'constant_value': 9.099026564815064, 'nu': 0.5}. Best is trial 448 with value: 0.3592093758005386.
[I 2024-12-04 19:59:06,189] Trial 597 finished with value: 1.0916558348837504 and parameters: {'kernel_type': 'RBF', 'length_scale': 2.1501830455096484e-05, 'noise_level': 0.1571162304899266, 'constant_value': 1.9399699294848405e-07, 'nu': 1.5}. Best is trial 448 with value: 0.3592093758005386.
[I 2024-12-04 19:59:07,665] Trial 596 finished with value: 0.35921123090242657 and parameters: {'kernel_type': 'Matern', 'length_scale': 0.8911627503355691, 'noise_level': 0.062233712405338364, 'constant_value': 14.43728794977444, 'nu': 0.5}. Best is trial 448 with value: 0.3592093758005386.
[I 2024-12-04 19:59:10,202] Trial 598 finished with value: 0.3592111852621453 and parameters: {'kernel_type': 'Matern', 'length_scale': 54.63473091995158, 'noise_level': 0.019882420162656605, 'constant_value': 3.3984023996071056, 'nu': 0.5}. Best is trial 448 with value: 0.3592093758005386.
[I 2024-12-04 19:59:11,208] Trial 599 finished with value: 0.3592112572322254 and parameters: {'kernel_type': 'Matern', 'length_scale': 265.985927659566, 'noise_level': 0.028685416702490783, 'constant_value': 27.35089325432616, 'nu': 0.5}. Best is trial 448 with value: 0.3592093758005386.
[I 2024-12-04 19:59:12,844] Trial 600 finished with value: 0.359211151638496 and parameters: {'kernel_type': 'Matern', 'length_scale': 8.673653970346901, 'noise_level': 0.061587130848850986, 'constant_value': 6.570017109089624, 'nu': 0.5}. Best is trial 448 with value: 0.3592093758005386.
[I 2024-12-04 19:59:15,074] Trial 601 finished with value: 0.35921123903170954 and parameters: {'kernel_type': 'Matern', 'length_scale': 2.7786166662856115, 'noise_level': 0.9673129612114455, 'constant_value': 0.03834950104676373, 'nu': 0.5}. Best is trial 448 with value: 0.3592093758005386.
[I 2024-12-04 19:59:17,102] Trial 603 finished with value: 1.0624161172378233 and parameters: {'kernel_type': 'Matern', 'length_scale': 0.027097430483761, 'noise_level': 0.00012808389232881896, 'constant_value': 63.61809285311743, 'nu': 0.5}. Best is trial 448 with value: 0.3592093758005386.
[I 2024-12-04 19:59:17,786] Trial 602 finished with value: 0.359211239783286 and parameters: {'kernel_type': 'Matern', 'length_scale': 0.19779326519530155, 'noise_level': 0.9873958534525963, 'constant_value': 5.803805541786368, 'nu': 0.5}. Best is trial 448 with value: 0.3592093758005386.
[I 2024-12-04 19:59:21,288] Trial 605 finished with value: 1.062416117038228 and parameters: {'kernel_type': 'RBF', 'length_scale': 0.00026683494997609597, 'noise_level': 5.512920253420532e-10, 'constant_value': 0.0001828366620383048, 'nu': 2.5}. Best is trial 448 with value: 0.3592093758005386.
[I 2024-12-04 19:59:21,294] Trial 604 finished with value: 1.062416119737861 and parameters: {'kernel_type': 'RBF', 'length_scale': 144.746132082238, 'noise_level': 0.006778408321818502, 'constant_value': 5.019417490419271, 'nu': 0.5}. Best is trial 448 with value: 0.3592093758005386.
[I 2024-12-04 19:59:23,658] Trial 606 finished with value: 1.0624161171716817 and parameters: {'kernel_type': 'Matern', 'length_scale': 1433.992968944139, 'noise_level': 0.01201753102095574, 'constant_value': 0.8540030022013225, 'nu': 0.5}. Best is trial 448 with value: 0.3592093758005386.
[I 2024-12-04 19:59:25,426] Trial 607 finished with value: 0.35921111959302043 and parameters: {'kernel_type': 'Matern', 'length_scale': 3.9386275973450355, 'noise_level': 0.02803011299645363, 'constant_value': 8.950540361058984, 'nu': 0.5}. Best is trial 448 with value: 0.3592093758005386.
[I 2024-12-04 19:59:26,725] Trial 608 finished with value: 0.35921088820169284 and parameters: {'kernel_type': 'Matern', 'length_scale': 38.343586384002, 'noise_level': 0.08025722493841188, 'constant_value': 0.13400465588240293, 'nu': 0.5}. Best is trial 448 with value: 0.3592093758005386.
[I 2024-12-04 19:59:31,282] Trial 610 finished with value: 1.06241611748812 and parameters: {'kernel_type': 'Matern', 'length_scale': 82715.00749955532, 'noise_level': 0.0017193090838891793, 'constant_value': 0.7504363675605787, 'nu': 0.5}. Best is trial 448 with value: 0.3592093758005386.
[I 2024-12-04 19:59:31,758] Trial 609 finished with value: 1.0624161172716962 and parameters: {'kernel_type': 'Matern', 'length_scale': 27914.05274682781, 'noise_level': 2.618742894027986e-08, 'constant_value': 17.884496759525685, 'nu': 2.5}. Best is trial 448 with value: 0.3592093758005386.
[I 2024-12-04 19:59:32,342] Trial 611 finished with value: 0.35921081405051647 and parameters: {'kernel_type': 'Matern', 'length_scale': 1067.011434882091, 'noise_level': 0.9782190958862209, 'constant_value': 0.4136871795384758, 'nu': 0.5}. Best is trial 448 with value: 0.3592093758005386.
[I 2024-12-04 19:59:38,286] Trial 614 finished with value: 1.0916558493892679 and parameters: {'kernel_type': 'Matern', 'length_scale': 0.011247055011443121, 'noise_level': 3.5851001017821794e-07, 'constant_value': 2.9073364284277106, 'nu': 0.5}. Best is trial 448 with value: 0.3592093758005386.
[I 2024-12-04 19:59:39,565] Trial 613 finished with value: 0.35921129104893196 and parameters: {'kernel_type': 'Matern', 'length_scale': 172.86192296588635, 'noise_level': 0.0031820516385868184, 'constant_value': 241.92001671371446, 'nu': 0.5}. Best is trial 448 with value: 0.3592093758005386.
[I 2024-12-04 19:59:39,614] Trial 612 finished with value: 0.3592113409382577 and parameters: {'kernel_type': 'Matern', 'length_scale': 51.99759256511936, 'noise_level': 0.8367873328813628, 'constant_value': 2.1698788972338927, 'nu': 0.5}. Best is trial 448 with value: 0.3592093758005386.
[I 2024-12-04 19:59:44,030] Trial 615 finished with value: 0.35921148848785583 and parameters: {'kernel_type': 'Matern', 'length_scale': 6.537359797645555, 'noise_level': 0.03908118150030415, 'constant_value': 22.482924316118694, 'nu': 0.5}. Best is trial 448 with value: 0.3592093758005386.
[I 2024-12-04 19:59:44,284] Trial 617 finished with value: 0.42269073836686283 and parameters: {'kernel_type': 'Matern', 'length_scale': 2.5060359246319788, 'noise_level': 0.05347425474350531, 'constant_value': 0.5951816239472055, 'nu': 1.5}. Best is trial 448 with value: 0.3592093758005386.
[I 2024-12-04 19:59:44,928] Trial 616 finished with value: 0.3592112854256631 and parameters: {'kernel_type': 'Matern', 'length_scale': 1.2842739278651507, 'noise_level': 0.000579961910387956, 'constant_value': 12.479556425449957, 'nu': 0.5}. Best is trial 448 with value: 0.3592093758005386.
[I 2024-12-04 19:59:48,986] Trial 618 finished with value: 0.35921120524877304 and parameters: {'kernel_type': 'Matern', 'length_scale': 66.27372418540347, 'noise_level': 0.06000169654641655, 'constant_value': 0.10443315729854548, 'nu': 0.5}. Best is trial 448 with value: 0.3592093758005386.
[I 2024-12-04 19:59:48,999] Trial 619 finished with value: 0.359211195456332 and parameters: {'kernel_type': 'Matern', 'length_scale': 1.1061569813367091, 'noise_level': 0.014320410991565181, 'constant_value': 512.1379374539048, 'nu': 0.5}. Best is trial 448 with value: 0.3592093758005386.
[I 2024-12-04 19:59:49,709] Trial 620 finished with value: 0.35921111946552026 and parameters: {'kernel_type': 'Matern', 'length_scale': 233.71329320371123, 'noise_level': 0.00036968696655881973, 'constant_value': 12.225781203256822, 'nu': 0.5}. Best is trial 448 with value: 0.3592093758005386.
[I 2024-12-04 19:59:52,468] Trial 622 finished with value: 1.091655849387768 and parameters: {'kernel_type': 'RBF', 'length_scale': 0.045602448418887324, 'noise_level': 4.860730212146765e-07, 'constant_value': 586.3182630286585, 'nu': 0.5}. Best is trial 448 with value: 0.3592093758005386.
[I 2024-12-04 19:59:55,329] Trial 621 finished with value: 0.35921190171640316 and parameters: {'kernel_type': 'Matern', 'length_scale': 1533.5971867815672, 'noise_level': 0.05101213226258985, 'constant_value': 0.2497472456924896, 'nu': 0.5}. Best is trial 448 with value: 0.3592093758005386.
[I 2024-12-04 19:59:55,458] Trial 623 finished with value: 0.359211240566342 and parameters: {'kernel_type': 'Matern', 'length_scale': 3850.5016693113366, 'noise_level': 0.04479842004178001, 'constant_value': 9.501082218526482, 'nu': 0.5}. Best is trial 448 with value: 0.3592093758005386.
[I 2024-12-04 19:59:58,778] Trial 624 finished with value: 1.062416117327436 and parameters: {'kernel_type': 'Matern', 'length_scale': 33.5167763591465, 'noise_level': 0.011898613059064133, 'constant_value': 0.05114188698813821, 'nu': 0.5}. Best is trial 448 with value: 0.3592093758005386.
[I 2024-12-04 19:59:59,893] Trial 625 finished with value: 0.35921127914620604 and parameters: {'kernel_type': 'Matern', 'length_scale': 142.3663341106486, 'noise_level': 0.0876480104400115, 'constant_value': 7.210508168975822, 'nu': 0.5}. Best is trial 448 with value: 0.3592093758005386.
[I 2024-12-04 20:00:00,434] Trial 626 finished with value: 0.35921111862691957 and parameters: {'kernel_type': 'Matern', 'length_scale': 329.2215063777, 'noise_level': 0.06157474126045965, 'constant_value': 4.032280721978499, 'nu': 0.5}. Best is trial 448 with value: 0.3592093758005386.
[I 2024-12-04 20:00:02,880] Trial 628 finished with value: 1.0624161130858885 and parameters: {'kernel_type': 'Matern', 'length_scale': 0.05342750008872616, 'noise_level': 0.0936489862019456, 'constant_value': 141.36521047174463, 'nu': 0.5}. Best is trial 448 with value: 0.3592093758005386.
[I 2024-12-04 20:00:06,013] Trial 629 finished with value: 0.35921119238252897 and parameters: {'kernel_type': 'Matern', 'length_scale': 7.44730269648103, 'noise_level': 0.6701055838680263, 'constant_value': 0.08507237471941069, 'nu': 0.5}. Best is trial 448 with value: 0.3592093758005386.
[I 2024-12-04 20:00:07,985] Trial 630 finished with value: 0.35921112306166647 and parameters: {'kernel_type': 'Matern', 'length_scale': 11.326557962812192, 'noise_level': 0.0012629344891485538, 'constant_value': 11.757966292263212, 'nu': 0.5}. Best is trial 448 with value: 0.3592093758005386.
[I 2024-12-04 20:00:08,283] Trial 627 finished with value: 0.3592111670669166 and parameters: {'kernel_type': 'Matern', 'length_scale': 0.09591320653209127, 'noise_level': 0.012905966038885984, 'constant_value': 0.5797640908802152, 'nu': 0.5}. Best is trial 448 with value: 0.3592093758005386.
