[I 2024-12-03 19:22:57,882] Trial 2386 finished with value: 0.17586617790995465 and parameters: {'kernel': 'linear', 'C': 25.649640033462912, 'gamma': 0.004526324916979487, 'epsilon': 0.19705934265019748}. Best is trial 345 with value: 0.13438257115663557.
[I 2024-12-03 19:22:58,348] Trial 2382 finished with value: 0.13630471002290978 and parameters: {'kernel': 'linear', 'C': 4.732292594682539, 'gamma': 0.015565113399742763, 'epsilon': 0.027421803802326013}. Best is trial 345 with value: 0.13438257115663557.
[I 2024-12-03 19:22:59,466] Trial 2288 finished with value: 0.13787316831663074 and parameters: {'kernel': 'linear', 'C': 99.07885411473852, 'gamma': 0.03443642601369947, 'epsilon': 0.008914411146714209}. Best is trial 345 with value: 0.13438257115663557.
[I 2024-12-03 19:22:59,618] Trial 2387 finished with value: 0.1440794792718982 and parameters: {'kernel': 'linear', 'C': 6.300560422340347, 'gamma': 0.00039327768764549527, 'epsilon': 0.11205399479000007}. Best is trial 345 with value: 0.13438257115663557.
[I 2024-12-03 19:23:00,774] Trial 2390 finished with value: 0.3099881026036671 and parameters: {'kernel': 'rbf', 'C': 3.5620197126580058, 'gamma': 0.001750856144127782, 'epsilon': 0.18880607172790084}. Best is trial 345 with value: 0.13438257115663557.
[I 2024-12-03 19:23:02,384] Trial 2384 finished with value: 0.13734100795181195 and parameters: {'kernel': 'linear', 'C': 4.376445234941416, 'gamma': 0.0002675806073993636, 'epsilon': 0.0035381683343390334}. Best is trial 345 with value: 0.13438257115663557.
[I 2024-12-03 19:23:03,393] Trial 2393 finished with value: 0.39310438517281165 and parameters: {'kernel': 'poly', 'C': 20.177092912072034, 'gamma': 0.013411474002412167, 'epsilon': 0.02893503466620872}. Best is trial 345 with value: 0.13438257115663557.
[I 2024-12-03 19:23:04,806] Trial 2395 finished with value: 0.9082690274420576 and parameters: {'kernel': 'poly', 'C': 15.465832237531444, 'gamma': 0.0007058377673614287, 'epsilon': 0.03141726795395338}. Best is trial 345 with value: 0.13438257115663557.
[I 2024-12-03 19:23:08,126] Trial 2357 finished with value: 0.13577061216113637 and parameters: {'kernel': 'linear', 'C': 94.08193881568137, 'gamma': 0.03174024358585774, 'epsilon': 0.0676313078746264}. Best is trial 345 with value: 0.13438257115663557.
[I 2024-12-03 19:23:09,550] Trial 2389 finished with value: 0.13544023070401098 and parameters: {'kernel': 'linear', 'C': 6.69793234560503, 'gamma': 0.0010776172492924826, 'epsilon': 0.03894074855274567}. Best is trial 345 with value: 0.13438257115663557.
[I 2024-12-03 19:23:10,510] Trial 2376 finished with value: 0.13788398601962937 and parameters: {'kernel': 'linear', 'C': 22.5471198374385, 'gamma': 0.01637802712964279, 'epsilon': 0.01774922963126779}. Best is trial 345 with value: 0.13438257115663557.
[I 2024-12-03 19:23:13,084] Trial 2379 finished with value: 0.13733878158088475 and parameters: {'kernel': 'linear', 'C': 25.006640618594364, 'gamma': 0.0013103188085718713, 'epsilon': 0.022574370738918405}. Best is trial 345 with value: 0.13438257115663557.
[I 2024-12-03 19:23:14,042] Trial 2398 finished with value: 0.13787638892734702 and parameters: {'kernel': 'linear', 'C': 2.006658110840464, 'gamma': 0.00045470113904062115, 'epsilon': 0.025317746830802984}. Best is trial 345 with value: 0.13438257115663557.
[I 2024-12-03 19:23:14,445] Trial 2392 finished with value: 0.1356409634143291 and parameters: {'kernel': 'linear', 'C': 14.198247621564416, 'gamma': 0.018050933280100354, 'epsilon': 0.058771288255701715}. Best is trial 345 with value: 0.13438257115663557.
[I 2024-12-03 19:23:15,982] Trial 2304 finished with value: 0.13733585021845313 and parameters: {'kernel': 'linear', 'C': 89.43882492960122, 'gamma': 0.01803944723246052, 'epsilon': 0.018270847667458692}. Best is trial 345 with value: 0.13438257115663557.
[I 2024-12-03 19:23:16,693] Trial 2402 finished with value: 0.6793889988084841 and parameters: {'kernel': 'sigmoid', 'C': 0.14368854370337947, 'gamma': 0.0034692287467939396, 'epsilon': 0.020035505194392345}. Best is trial 345 with value: 0.13438257115663557.
[I 2024-12-03 19:23:18,821] Trial 2404 finished with value: 0.14630211499937595 and parameters: {'kernel': 'linear', 'C': 5.007938668095364, 'gamma': 0.011112007643348703, 'epsilon': 0.11236337155127038}. Best is trial 345 with value: 0.13438257115663557.
[I 2024-12-03 19:23:19,437] Trial 2290 finished with value: 0.13719162286961248 and parameters: {'kernel': 'linear', 'C': 97.9800524782157, 'gamma': 0.0012378280353146829, 'epsilon': 0.019007672869243215}. Best is trial 345 with value: 0.13438257115663557.
[I 2024-12-03 19:23:21,253] Trial 2331 finished with value: 0.1355841379453502 and parameters: {'kernel': 'linear', 'C': 91.64784650556568, 'gamma': 0.13350425834890178, 'epsilon': 0.03734898301193645}. Best is trial 345 with value: 0.13438257115663557.
[I 2024-12-03 19:23:21,896] Trial 2399 finished with value: 0.1382362595191888 and parameters: {'kernel': 'linear', 'C': 31.504293153905053, 'gamma': 0.007862050172209414, 'epsilon': 0.08471152965794122}. Best is trial 345 with value: 0.13438257115663557.
[I 2024-12-03 19:23:25,767] Trial 2388 finished with value: 0.13554073782560955 and parameters: {'kernel': 'linear', 'C': 22.217617307106718, 'gamma': 0.0032052065627191603, 'epsilon': 0.03320125786944906}. Best is trial 345 with value: 0.13438257115663557.
[I 2024-12-03 19:23:26,915] Trial 2408 finished with value: 0.13746492612984904 and parameters: {'kernel': 'linear', 'C': 18.109310700924116, 'gamma': 0.003631896152625979, 'epsilon': 0.07847321471149349}. Best is trial 345 with value: 0.13438257115663557.
[I 2024-12-03 19:23:28,437] Trial 2410 finished with value: 413.87875056086585 and parameters: {'kernel': 'sigmoid', 'C': 19.288401954061843, 'gamma': 0.2934311363358153, 'epsilon': 0.0030851377259994506}. Best is trial 345 with value: 0.13438257115663557.
[I 2024-12-03 19:23:29,426] Trial 2347 finished with value: 0.13862592075270772 and parameters: {'kernel': 'linear', 'C': 96.1324270099047, 'gamma': 0.0020068613151307656, 'epsilon': 0.017061353742457}. Best is trial 345 with value: 0.13438257115663557.
[I 2024-12-03 19:23:29,591] Trial 2330 finished with value: 0.1350460332278422 and parameters: {'kernel': 'linear', 'C': 96.02645210356772, 'gamma': 0.0012870070719797036, 'epsilon': 0.02949433456132287}. Best is trial 345 with value: 0.13438257115663557.
[I 2024-12-03 19:23:31,079] Trial 2397 finished with value: 0.1367419311231192 and parameters: {'kernel': 'linear', 'C': 22.28479028535147, 'gamma': 0.0721338440628908, 'epsilon': 0.02342864472881013}. Best is trial 345 with value: 0.13438257115663557.
[I 2024-12-03 19:23:31,222] Trial 2411 finished with value: 0.14218182753995137 and parameters: {'kernel': 'linear', 'C': 4.378161710700756, 'gamma': 0.0036182047481810834, 'epsilon': 0.08415729624008242}. Best is trial 345 with value: 0.13438257115663557.
[I 2024-12-03 19:23:31,236] Trial 2400 finished with value: 0.1355766838586226 and parameters: {'kernel': 'linear', 'C': 28.06747372677568, 'gamma': 0.039361443098630974, 'epsilon': 0.05303717477931804}. Best is trial 345 with value: 0.13438257115663557.
[I 2024-12-03 19:23:32,747] Trial 2403 finished with value: 0.13767179729721674 and parameters: {'kernel': 'linear', 'C': 14.560386589483546, 'gamma': 0.0007372502881585602, 'epsilon': 0.01815375178124047}. Best is trial 345 with value: 0.13438257115663557.
[I 2024-12-03 19:23:32,747] Trial 2391 finished with value: 0.13763205438067216 and parameters: {'kernel': 'linear', 'C': 26.039372507252295, 'gamma': 0.006648495777926656, 'epsilon': 0.022569870507952682}. Best is trial 345 with value: 0.13438257115663557.
[I 2024-12-03 19:23:42,380] Trial 2406 finished with value: 0.1356473935896706 and parameters: {'kernel': 'linear', 'C': 16.378583449561397, 'gamma': 0.00041378093035009903, 'epsilon': 0.041930473316763556}. Best is trial 345 with value: 0.13438257115663557.
[I 2024-12-03 19:23:42,382] Trial 2401 finished with value: 0.1379737290704694 and parameters: {'kernel': 'linear', 'C': 15.800259522442996, 'gamma': 0.015632511838740967, 'epsilon': 0.006260251562556609}. Best is trial 345 with value: 0.13438257115663557.
[I 2024-12-03 19:23:43,850] Trial 2407 finished with value: 0.1354344732494745 and parameters: {'kernel': 'linear', 'C': 19.194512750102792, 'gamma': 0.004998438117095947, 'epsilon': 0.02881246356493322}. Best is trial 345 with value: 0.13438257115663557.
[I 2024-12-03 19:23:44,691] Trial 2418 finished with value: 0.13812192575791546 and parameters: {'kernel': 'linear', 'C': 5.186643123958866, 'gamma': 0.0020116255095840576, 'epsilon': 0.01323662162245925}. Best is trial 345 with value: 0.13438257115663557.
[I 2024-12-03 19:23:44,693] Trial 2321 finished with value: 0.13581354317564806 and parameters: {'kernel': 'linear', 'C': 93.19242834095608, 'gamma': 0.0004723394135154637, 'epsilon': 0.03581649962950063}. Best is trial 345 with value: 0.13438257115663557.
[I 2024-12-03 19:23:48,990] Trial 2414 finished with value: 0.13688533552388216 and parameters: {'kernel': 'linear', 'C': 24.600610108669375, 'gamma': 0.08476980263573254, 'epsilon': 0.04929313531455166}. Best is trial 345 with value: 0.13438257115663557.
[I 2024-12-03 19:23:49,924] Trial 2377 finished with value: 0.13650132938689138 and parameters: {'kernel': 'linear', 'C': 98.46461071726536, 'gamma': 0.0001528288199608519, 'epsilon': 0.0508586032820649}. Best is trial 345 with value: 0.13438257115663557.
[I 2024-12-03 19:23:50,628] Trial 2424 finished with value: 277.88898820539595 and parameters: {'kernel': 'sigmoid', 'C': 50.25962935591495, 'gamma': 0.009805412160578354, 'epsilon': 0.0346440236043684}. Best is trial 345 with value: 0.13438257115663557.
[I 2024-12-03 19:23:50,630] Trial 2412 finished with value: 0.1352392161454128 and parameters: {'kernel': 'linear', 'C': 21.228319219501625, 'gamma': 0.0022104341933853297, 'epsilon': 0.05896877695516154}. Best is trial 345 with value: 0.13438257115663557.
[I 2024-12-03 19:23:50,959] Trial 2423 finished with value: 0.136858096374652 and parameters: {'kernel': 'linear', 'C': 3.322384879869279, 'gamma': 0.027902331043844826, 'epsilon': 0.022903307732281573}. Best is trial 345 with value: 0.13438257115663557.
[I 2024-12-03 19:23:52,150] Trial 2385 finished with value: 0.13675465226806705 and parameters: {'kernel': 'linear', 'C': 96.92947422039043, 'gamma': 0.002692963814071255, 'epsilon': 0.050272342468175156}. Best is trial 345 with value: 0.13438257115663557.
[I 2024-12-03 19:23:55,848] Trial 2373 finished with value: 0.13513934019727195 and parameters: {'kernel': 'linear', 'C': 95.22008511383561, 'gamma': 0.0037219538130878506, 'epsilon': 0.03280558368115114}. Best is trial 345 with value: 0.13438257115663557.
[I 2024-12-03 19:23:57,135] Trial 2430 finished with value: 0.8249304839972397 and parameters: {'kernel': 'rbf', 'C': 39.195322831904114, 'gamma': 0.7234320011789909, 'epsilon': 0.018603425901216785}. Best is trial 345 with value: 0.13438257115663557.
[I 2024-12-03 19:23:57,642] Trial 2422 finished with value: 0.13598316751848058 and parameters: {'kernel': 'linear', 'C': 7.21380978738564, 'gamma': 0.001690051485308316, 'epsilon': 0.031205939702822597}. Best is trial 345 with value: 0.13438257115663557.
[I 2024-12-03 19:23:57,963] Trial 2335 finished with value: 0.13784063360008317 and parameters: {'kernel': 'linear', 'C': 99.65382673019874, 'gamma': 0.011316985215254531, 'epsilon': 0.012556331247000445}. Best is trial 345 with value: 0.13438257115663557.
[I 2024-12-03 19:23:58,804] Trial 2431 finished with value: 0.21882768262157548 and parameters: {'kernel': 'rbf', 'C': 12.245376234065695, 'gamma': 0.008720227184490796, 'epsilon': 0.06640775560490436}. Best is trial 345 with value: 0.13438257115663557.
[I 2024-12-03 19:23:59,352] Trial 2432 finished with value: 1.270713702236578 and parameters: {'kernel': 'rbf', 'C': 0.006286879459982608, 'gamma': 0.09839016709765765, 'epsilon': 0.0015893443515331133}. Best is trial 345 with value: 0.13438257115663557.
[I 2024-12-03 19:24:01,302] Trial 2426 finished with value: 0.13608063290324965 and parameters: {'kernel': 'linear', 'C': 26.01254262659229, 'gamma': 0.0037876226576270596, 'epsilon': 0.07140631895071214}. Best is trial 345 with value: 0.13438257115663557.
[I 2024-12-03 19:24:02,818] Trial 2433 finished with value: 0.13528524385499818 and parameters: {'kernel': 'linear', 'C': 6.652988864443985, 'gamma': 0.02185927879627419, 'epsilon': 0.06603572215365716}. Best is trial 345 with value: 0.13438257115663557.
[I 2024-12-03 19:24:03,970] Trial 2425 finished with value: 0.13552823596934896 and parameters: {'kernel': 'linear', 'C': 18.400754176869956, 'gamma': 0.005032474643350989, 'epsilon': 0.03353122368703181}. Best is trial 345 with value: 0.13438257115663557.
[I 2024-12-03 19:24:04,760] Trial 2366 finished with value: 0.13553097627901062 and parameters: {'kernel': 'linear', 'C': 93.71863177708072, 'gamma': 0.008813418204042753, 'epsilon': 0.02788781449489848}. Best is trial 345 with value: 0.13438257115663557.
[I 2024-12-03 19:24:04,995] Trial 2435 finished with value: 0.1432892321853367 and parameters: {'kernel': 'linear', 'C': 16.433895903991314, 'gamma': 0.18912859880066435, 'epsilon': 0.11725617062385899}. Best is trial 345 with value: 0.13438257115663557.
[I 2024-12-03 19:24:05,481] Trial 2371 finished with value: 0.137847658041002 and parameters: {'kernel': 'linear', 'C': 84.62912346467026, 'gamma': 0.00034670320068294267, 'epsilon': 0.00923867415186223}. Best is trial 345 with value: 0.13438257115663557.
[I 2024-12-03 19:24:05,535] Trial 2438 finished with value: 0.3970124534346206 and parameters: {'kernel': 'rbf', 'C': 12.46133293170354, 'gamma': 0.00010027998723713124, 'epsilon': 0.041400823136904574}. Best is trial 345 with value: 0.13438257115663557.
[I 2024-12-03 19:24:06,371] Trial 2439 finished with value: 0.9765121900011828 and parameters: {'kernel': 'poly', 'C': 28.711901857598566, 'gamma': 0.002503267094345928, 'epsilon': 0.06712206911196764}. Best is trial 345 with value: 0.13438257115663557.
[I 2024-12-03 19:24:06,774] Trial 2436 finished with value: 0.15520210700138806 and parameters: {'kernel': 'linear', 'C': 34.96316753409281, 'gamma': 0.009615781827513119, 'epsilon': 0.1569357075868334}. Best is trial 345 with value: 0.13438257115663557.
[I 2024-12-03 19:24:08,922] Trial 2360 finished with value: 0.13783854598950945 and parameters: {'kernel': 'linear', 'C': 96.95600802637313, 'gamma': 0.007596391317985591, 'epsilon': 0.008961941037012235}. Best is trial 345 with value: 0.13438257115663557.
[I 2024-12-03 19:24:09,576] Trial 2416 finished with value: 0.1379189348260209 and parameters: {'kernel': 'linear', 'C': 95.05950392704433, 'gamma': 0.0005891215796608421, 'epsilon': 0.07829519734612245}. Best is trial 345 with value: 0.13438257115663557.
[I 2024-12-03 19:24:11,185] Trial 2444 finished with value: 0.13662858927846008 and parameters: {'kernel': 'linear', 'C': 2.713255248393006, 'gamma': 0.0005386544352432981, 'epsilon': 0.05273243376923697}. Best is trial 345 with value: 0.13438257115663557.
[I 2024-12-03 19:24:11,186] Trial 2415 finished with value: 0.13652604343969768 and parameters: {'kernel': 'linear', 'C': 80.89146803357013, 'gamma': 0.0006361069447421444, 'epsilon': 0.07114035268857173}. Best is trial 345 with value: 0.13438257115663557.
[I 2024-12-03 19:24:12,742] Trial 2375 finished with value: 0.13833715690744544 and parameters: {'kernel': 'linear', 'C': 87.78355947014917, 'gamma': 0.00046115392520980575, 'epsilon': 0.016934980786085744}. Best is trial 345 with value: 0.13438257115663557.
[I 2024-12-03 19:24:12,778] Trial 2447 finished with value: 1.3609749375668232 and parameters: {'kernel': 'poly', 'C': 6.542371682144018, 'gamma': 0.00010180383357269754, 'epsilon': 0.0060964470950083645}. Best is trial 345 with value: 0.13438257115663557.
[I 2024-12-03 19:24:12,991] Trial 2448 finished with value: 0.31456164186051594 and parameters: {'kernel': 'rbf', 'C': 1.7060179228399193, 'gamma': 0.004533641877398176, 'epsilon': 0.015171970527534473}. Best is trial 345 with value: 0.13438257115663557.
[I 2024-12-03 19:24:13,994] Trial 2440 finished with value: 0.13665823489302656 and parameters: {'kernel': 'linear', 'C': 8.125689144470094, 'gamma': 0.004049429723314838, 'epsilon': 0.02644336018874851}. Best is trial 345 with value: 0.13438257115663557.
[I 2024-12-03 19:24:15,815] Trial 2450 finished with value: 1.2721239373453705 and parameters: {'kernel': 'rbf', 'C': 0.008501130152279216, 'gamma': 0.15596338371749266, 'epsilon': 0.14606134423291992}. Best is trial 345 with value: 0.13438257115663557.
[I 2024-12-03 19:24:16,803] Trial 2451 finished with value: 0.22143084143641384 and parameters: {'kernel': 'rbf', 'C': 19.536695220423727, 'gamma': 0.02175573932171594, 'epsilon': 0.019788290165646913}. Best is trial 345 with value: 0.13438257115663557.
[I 2024-12-03 19:24:18,849] Trial 2454 finished with value: 0.5196640234469699 and parameters: {'kernel': 'rbf', 'C': 18.148207568484864, 'gamma': 0.11320975585625168, 'epsilon': 0.08499241816878374}. Best is trial 345 with value: 0.13438257115663557.
[I 2024-12-03 19:24:19,398] Trial 2452 finished with value: 0.13877316445744103 and parameters: {'kernel': 'linear', 'C': 8.597014330285344, 'gamma': 0.0006670486225569623, 'epsilon': 0.0776101806798457}. Best is trial 345 with value: 0.13438257115663557.
[I 2024-12-03 19:24:21,637] Trial 2421 finished with value: 0.13743317920414824 and parameters: {'kernel': 'linear', 'C': 26.33751889922683, 'gamma': 0.006159559235117745, 'epsilon': 0.019433772874508516}. Best is trial 345 with value: 0.13438257115663557.
[I 2024-12-03 19:24:25,089] Trial 2445 finished with value: 0.13985898925729257 and parameters: {'kernel': 'linear', 'C': 76.01685231930479, 'gamma': 0.38012911544630285, 'epsilon': 0.08714074336944347}. Best is trial 345 with value: 0.13438257115663557.
[I 2024-12-03 19:24:25,228] Trial 2434 finished with value: 0.13752764416887125 and parameters: {'kernel': 'linear', 'C': 20.638807190818508, 'gamma': 0.013218889030578015, 'epsilon': 0.018315344072557627}. Best is trial 345 with value: 0.13438257115663557.
[I 2024-12-03 19:24:26,703] Trial 2458 finished with value: 1.3599940749160424 and parameters: {'kernel': 'sigmoid', 'C': 0.001375926524394465, 'gamma': 0.00015418051666807295, 'epsilon': 0.011291440273468109}. Best is trial 345 with value: 0.13438257115663557.
[I 2024-12-03 19:24:27,633] Trial 2456 finished with value: 0.1392506901361474 and parameters: {'kernel': 'linear', 'C': 14.898129079084727, 'gamma': 0.0001558216578105314, 'epsilon': 0.08430954425187834}. Best is trial 345 with value: 0.13438257115663557.
[I 2024-12-03 19:24:29,223] Trial 2461 finished with value: 1.3309904682073475 and parameters: {'kernel': 'poly', 'C': 15.73782679455765, 'gamma': 0.00028742526037467354, 'epsilon': 0.14104278975982595}. Best is trial 345 with value: 0.13438257115663557.
[I 2024-12-03 19:24:34,335] Trial 2420 finished with value: 0.13702023317697354 and parameters: {'kernel': 'linear', 'C': 94.68712686443165, 'gamma': 0.016299525981816703, 'epsilon': 0.048445811890205845}. Best is trial 345 with value: 0.13438257115663557.
[I 2024-12-03 19:24:35,890] Trial 2437 finished with value: 0.1380205881209516 and parameters: {'kernel': 'linear', 'C': 28.481230527750174, 'gamma': 0.0009241569059423107, 'epsilon': 0.014297239630061288}. Best is trial 345 with value: 0.13438257115663557.
[I 2024-12-03 19:24:38,255] Trial 2443 finished with value: 0.13676221532895563 and parameters: {'kernel': 'linear', 'C': 99.71377972744054, 'gamma': 0.03131151118431642, 'epsilon': 0.07196647322405801}. Best is trial 345 with value: 0.13438257115663557.
[I 2024-12-03 19:24:39,046] Trial 2455 finished with value: 0.13841360389306037 and parameters: {'kernel': 'linear', 'C': 98.22596509483353, 'gamma': 0.0024803907838646965, 'epsilon': 0.08242611243673378}. Best is trial 345 with value: 0.13438257115663557.
[I 2024-12-03 19:24:40,961] Trial 2464 finished with value: 0.13552064023839622 and parameters: {'kernel': 'linear', 'C': 5.918465039338932, 'gamma': 0.0016158571596120868, 'epsilon': 0.056547214830773296}. Best is trial 345 with value: 0.13438257115663557.
[I 2024-12-03 19:24:42,053] Trial 2466 finished with value: 0.14055192820689202 and parameters: {'kernel': 'linear', 'C': 1.0347101096251408, 'gamma': 0.011715345824765877, 'epsilon': 0.04085255812240753}. Best is trial 345 with value: 0.13438257115663557.
[I 2024-12-03 19:24:42,234] Trial 2396 finished with value: 0.13535355498809495 and parameters: {'kernel': 'linear', 'C': 98.61432135193945, 'gamma': 0.0008490794272788982, 'epsilon': 0.02871411830985017}. Best is trial 345 with value: 0.13438257115663557.
[I 2024-12-03 19:24:43,267] Trial 2463 finished with value: 0.13506351085013607 and parameters: {'kernel': 'linear', 'C': 16.20808414497575, 'gamma': 0.00038709921759628074, 'epsilon': 0.06154411803710091}. Best is trial 345 with value: 0.13438257115663557.
[I 2024-12-03 19:24:43,717] Trial 2459 finished with value: 0.13563570353489116 and parameters: {'kernel': 'linear', 'C': 13.170442962622529, 'gamma': 0.03113457105303428, 'epsilon': 0.03646434298119964}. Best is trial 345 with value: 0.13438257115663557.
[I 2024-12-03 19:24:45,376] Trial 2453 finished with value: 0.1356556854968563 and parameters: {'kernel': 'linear', 'C': 20.68267813542126, 'gamma': 0.11523517480615159, 'epsilon': 0.027704150385275857}. Best is trial 345 with value: 0.13438257115663557.
[I 2024-12-03 19:24:45,944] Trial 2409 finished with value: 0.13536066361085744 and parameters: {'kernel': 'linear', 'C': 87.41758444736011, 'gamma': 0.008993006011349454, 'epsilon': 0.041022257497520004}. Best is trial 345 with value: 0.13438257115663557.
