[I 2024-12-03 18:46:24,847] Trial 1271 finished with value: 0.47046553003946096 and parameters: {'kernel': 'rbf', 'C': 21.1277712277793, 'gamma': 0.02123532132222478, 'epsilon': 0.09503503341894472}. Best is trial 1119 with value: 0.4485361816812923.
[I 2024-12-03 18:46:25,081] Trial 1270 finished with value: 0.46502517013087913 and parameters: {'kernel': 'rbf', 'C': 88.94709790503214, 'gamma': 0.010174042553076561, 'epsilon': 0.05494355150493816}. Best is trial 1119 with value: 0.4485361816812923.
[I 2024-12-03 18:46:25,131] Trial 1263 finished with value: 0.6266182301265927 and parameters: {'kernel': 'rbf', 'C': 92.27081115937526, 'gamma': 0.05032760806766478, 'epsilon': 0.18277258133810698}. Best is trial 1119 with value: 0.4485361816812923.
[I 2024-12-03 18:46:25,209] Trial 1272 finished with value: 0.563393863383809 and parameters: {'kernel': 'rbf', 'C': 98.10893515115019, 'gamma': 0.03562713807581362, 'epsilon': 0.03177663063122086}. Best is trial 1119 with value: 0.4485361816812923.
[I 2024-12-03 18:46:25,231] Trial 1277 finished with value: 0.5948242535747046 and parameters: {'kernel': 'rbf', 'C': 21.355578321436216, 'gamma': 0.0030652283542138745, 'epsilon': 0.01930488779998631}. Best is trial 1119 with value: 0.4485361816812923.
[I 2024-12-03 18:46:25,529] Trial 1274 finished with value: 0.4703491124059223 and parameters: {'kernel': 'rbf', 'C': 78.48084392140076, 'gamma': 0.01684921887642807, 'epsilon': 0.12967578729205376}. Best is trial 1119 with value: 0.4485361816812923.
[I 2024-12-03 18:46:25,656] Trial 1267 finished with value: 0.5525688600690094 and parameters: {'kernel': 'rbf', 'C': 17.239084172793774, 'gamma': 0.008343456331429923, 'epsilon': 0.007673224732865295}. Best is trial 1119 with value: 0.4485361816812923.
[I 2024-12-03 18:46:26,339] Trial 1280 finished with value: 0.5468687228676324 and parameters: {'kernel': 'rbf', 'C': 89.01182417365808, 'gamma': 0.003044422286567176, 'epsilon': 0.09276907681276333}. Best is trial 1119 with value: 0.4485361816812923.
[I 2024-12-03 18:46:26,351] Trial 1278 finished with value: 0.5392992969842975 and parameters: {'kernel': 'rbf', 'C': 18.928769567608107, 'gamma': 0.008625689537538155, 'epsilon': 0.028568711665474294}. Best is trial 1119 with value: 0.4485361816812923.
[I 2024-12-03 18:46:27,085] Trial 1275 finished with value: 0.5860802802494837 and parameters: {'kernel': 'rbf', 'C': 26.011314185635918, 'gamma': 0.0028102024871931, 'epsilon': 0.12162329551206467}. Best is trial 1119 with value: 0.4485361816812923.
[I 2024-12-03 18:46:27,086] Trial 1281 finished with value: 0.5297094142408109 and parameters: {'kernel': 'rbf', 'C': 87.48178643935802, 'gamma': 0.0049638489846277785, 'epsilon': 0.192557996555196}. Best is trial 1119 with value: 0.4485361816812923.
[I 2024-12-03 18:46:27,095] Trial 1276 finished with value: 0.5432897430976298 and parameters: {'kernel': 'rbf', 'C': 86.1402028751719, 'gamma': 0.03077353112727465, 'epsilon': 0.12258864193729298}. Best is trial 1119 with value: 0.4485361816812923.
[I 2024-12-03 18:46:28,229] Trial 1282 finished with value: 0.5910661478718214 and parameters: {'kernel': 'rbf', 'C': 11.41106144240557, 'gamma': 0.005677208880457829, 'epsilon': 0.06020412112316877}. Best is trial 1119 with value: 0.4485361816812923.
[I 2024-12-03 18:46:28,379] Trial 1284 finished with value: 0.522267671755701 and parameters: {'kernel': 'rbf', 'C': 18.255268905869812, 'gamma': 0.012089874939410944, 'epsilon': 0.09332673720666297}. Best is trial 1119 with value: 0.4485361816812923.
[I 2024-12-03 18:46:28,592] Trial 1285 finished with value: 0.5731614345228015 and parameters: {'kernel': 'linear', 'C': 27.85347816449497, 'gamma': 0.011452156524370382, 'epsilon': 0.08813623375424341}. Best is trial 1119 with value: 0.4485361816812923.
[I 2024-12-03 18:46:31,935] Trial 1297 finished with value: 0.47534653571095753 and parameters: {'kernel': 'rbf', 'C': 96.69169384061495, 'gamma': 0.009036518169496821, 'epsilon': 0.16472153354433824}. Best is trial 1119 with value: 0.4485361816812923.
[I 2024-12-03 18:46:32,268] Trial 1296 finished with value: 0.48458792427158914 and parameters: {'kernel': 'rbf', 'C': 97.02516670549446, 'gamma': 0.007052219783341185, 'epsilon': 0.07563123328058893}. Best is trial 1119 with value: 0.4485361816812923.
[I 2024-12-03 18:46:32,752] Trial 1287 finished with value: 0.466489700098352 and parameters: {'kernel': 'rbf', 'C': 89.33806687683793, 'gamma': 0.02156001790174504, 'epsilon': 0.058896495359610015}. Best is trial 1119 with value: 0.4485361816812923.
[I 2024-12-03 18:46:32,921] Trial 1290 finished with value: 0.44857515712066476 and parameters: {'kernel': 'rbf', 'C': 99.0387008050095, 'gamma': 0.01228049861146916, 'epsilon': 0.08054978965032993}. Best is trial 1119 with value: 0.4485361816812923.
[I 2024-12-03 18:46:32,931] Trial 1294 finished with value: 0.5681860589542235 and parameters: {'kernel': 'rbf', 'C': 2.8158332536867885, 'gamma': 0.03409382993338363, 'epsilon': 0.021675117550921247}. Best is trial 1119 with value: 0.4485361816812923.
[I 2024-12-03 18:46:33,877] Trial 1299 finished with value: 0.49791822052244217 and parameters: {'kernel': 'rbf', 'C': 98.44269674135121, 'gamma': 0.005558843560041557, 'epsilon': 0.028369029538182555}. Best is trial 1119 with value: 0.4485361816812923.
[I 2024-12-03 18:46:34,346] Trial 1289 finished with value: 183.28352598872354 and parameters: {'kernel': 'sigmoid', 'C': 95.58189102614256, 'gamma': 0.012246931307717744, 'epsilon': 0.1712802992104367}. Best is trial 1119 with value: 0.4485361816812923.
[I 2024-12-03 18:46:34,431] Trial 1286 finished with value: 0.5547035245765538 and parameters: {'kernel': 'rbf', 'C': 90.9890927900059, 'gamma': 0.002681599296158928, 'epsilon': 0.06955462700329128}. Best is trial 1119 with value: 0.4485361816812923.
[I 2024-12-03 18:46:34,635] Trial 1279 finished with value: 0.5631933143099533 and parameters: {'kernel': 'rbf', 'C': 3.5491481984338775, 'gamma': 0.025181802764654256, 'epsilon': 0.051634076665192215}. Best is trial 1119 with value: 0.4485361816812923.
[I 2024-12-03 18:46:34,780] Trial 1295 finished with value: 0.49776710345171393 and parameters: {'kernel': 'rbf', 'C': 88.12380330880104, 'gamma': 0.009179494690645796, 'epsilon': 0.22869600153885988}. Best is trial 1119 with value: 0.4485361816812923.
[I 2024-12-03 18:46:34,973] Trial 1302 finished with value: 0.5460468258416487 and parameters: {'kernel': 'rbf', 'C': 24.15977919516883, 'gamma': 0.05823353387035582, 'epsilon': 0.16202712678314535}. Best is trial 1119 with value: 0.4485361816812923.
[I 2024-12-03 18:46:35,266] Trial 1303 finished with value: 1.1018672273685866 and parameters: {'kernel': 'poly', 'C': 57.68737658862802, 'gamma': 0.0020117120257799486, 'epsilon': 0.4827905861355104}. Best is trial 1119 with value: 0.4485361816812923.
[I 2024-12-03 18:46:35,481] Trial 1288 finished with value: 0.5219178985600071 and parameters: {'kernel': 'rbf', 'C': 19.25266655471873, 'gamma': 0.05848235955382135, 'epsilon': 0.052128295366777724}. Best is trial 1119 with value: 0.4485361816812923.
[I 2024-12-03 18:46:35,956] Trial 1306 finished with value: 0.6777941849701486 and parameters: {'kernel': 'linear', 'C': 0.05038640198155215, 'gamma': 0.004674120451798617, 'epsilon': 0.3323688437045866}. Best is trial 1119 with value: 0.4485361816812923.
[I 2024-12-03 18:46:35,959] Trial 1300 finished with value: 0.5121759087229137 and parameters: {'kernel': 'rbf', 'C': 15.225467533095546, 'gamma': 0.03228953065863085, 'epsilon': 0.3197262469349877}. Best is trial 1119 with value: 0.4485361816812923.
[I 2024-12-03 18:46:36,277] Trial 1298 finished with value: 0.49052746862545044 and parameters: {'kernel': 'rbf', 'C': 97.98022023799138, 'gamma': 0.019473062034306547, 'epsilon': 0.1184750692124314}. Best is trial 1119 with value: 0.4485361816812923.
[I 2024-12-03 18:46:36,393] Trial 1304 finished with value: 0.5040488626981464 and parameters: {'kernel': 'rbf', 'C': 21.73558664492459, 'gamma': 0.012875201525290125, 'epsilon': 0.05065275074600744}. Best is trial 1119 with value: 0.4485361816812923.
[I 2024-12-03 18:46:36,610] Trial 1305 finished with value: 0.5418663424136947 and parameters: {'kernel': 'rbf', 'C': 93.65923720838327, 'gamma': 0.003030069175899218, 'epsilon': 0.052967075407413904}. Best is trial 1119 with value: 0.4485361816812923.
[I 2024-12-03 18:46:36,949] Trial 1283 finished with value: 0.49932862204561695 and parameters: {'kernel': 'rbf', 'C': 98.86286751429691, 'gamma': 0.005439135705049006, 'epsilon': 0.02763890578856532}. Best is trial 1119 with value: 0.4485361816812923.
[I 2024-12-03 18:46:37,375] Trial 1311 finished with value: 0.5619255968022419 and parameters: {'kernel': 'linear', 'C': 6.117915090163616, 'gamma': 0.13515173142075582, 'epsilon': 0.12569164753026857}. Best is trial 1119 with value: 0.4485361816812923.
[I 2024-12-03 18:46:37,446] Trial 1293 finished with value: 0.5731871491534859 and parameters: {'kernel': 'linear', 'C': 86.41803266141073, 'gamma': 0.0062664236038000535, 'epsilon': 0.06785413810098591}. Best is trial 1119 with value: 0.4485361816812923.
[I 2024-12-03 18:46:37,451] Trial 1307 finished with value: 0.5968156981913472 and parameters: {'kernel': 'rbf', 'C': 90.78321631203094, 'gamma': 0.08968727417564538, 'epsilon': 0.16931193706482756}. Best is trial 1119 with value: 0.4485361816812923.
[I 2024-12-03 18:46:37,650] Trial 1308 finished with value: 0.574746817036564 and parameters: {'kernel': 'linear', 'C': 0.9986438436537878, 'gamma': 0.2954513846290063, 'epsilon': 0.001371700260920279}. Best is trial 1119 with value: 0.4485361816812923.
[I 2024-12-03 18:46:37,653] Trial 1309 finished with value: 0.46989395133301587 and parameters: {'kernel': 'rbf', 'C': 99.89045569862543, 'gamma': 0.008768789608407313, 'epsilon': 0.03587115782021116}. Best is trial 1119 with value: 0.4485361816812923.
[I 2024-12-03 18:46:37,662] Trial 1291 finished with value: 0.6938938792325144 and parameters: {'kernel': 'rbf', 'C': 2.8727712975916107, 'gamma': 0.008055596528400771, 'epsilon': 0.2570095533333524}. Best is trial 1119 with value: 0.4485361816812923.
[I 2024-12-03 18:46:37,697] Trial 1312 finished with value: 0.5370442497925096 and parameters: {'kernel': 'rbf', 'C': 7.011133088883785, 'gamma': 0.01704795467729796, 'epsilon': 0.1614359047959247}. Best is trial 1119 with value: 0.4485361816812923.
[I 2024-12-03 18:46:37,942] Trial 1292 finished with value: 0.4502116690079673 and parameters: {'kernel': 'rbf', 'C': 99.64621858172126, 'gamma': 0.011404330495472844, 'epsilon': 0.09707217590657767}. Best is trial 1119 with value: 0.4485361816812923.
[I 2024-12-03 18:46:37,946] Trial 1301 finished with value: 0.48317094065751387 and parameters: {'kernel': 'rbf', 'C': 92.15787238777159, 'gamma': 0.007675336187337146, 'epsilon': 0.14968765917420698}. Best is trial 1119 with value: 0.4485361816812923.
[I 2024-12-03 18:46:38,334] Trial 1310 finished with value: 0.47727967624289275 and parameters: {'kernel': 'rbf', 'C': 98.06376801892087, 'gamma': 0.01649886306342575, 'epsilon': 0.12100188605109334}. Best is trial 1119 with value: 0.4485361816812923.
[I 2024-12-03 18:46:40,246] Trial 1315 finished with value: 0.554383038385373 and parameters: {'kernel': 'rbf', 'C': 21.622267682164196, 'gamma': 0.005989117418327884, 'epsilon': 0.12355973558166827}. Best is trial 1119 with value: 0.4485361816812923.
[I 2024-12-03 18:46:41,192] Trial 1313 finished with value: 0.7219768506812463 and parameters: {'kernel': 'rbf', 'C': 13.438493078313531, 'gamma': 0.0015390811701315509, 'epsilon': 0.11634417410949682}. Best is trial 1119 with value: 0.4485361816812923.
[I 2024-12-03 18:46:41,862] Trial 1314 finished with value: 0.5427613050134055 and parameters: {'kernel': 'rbf', 'C': 82.1665489814738, 'gamma': 0.003449890116523013, 'epsilon': 0.1079195621999884}. Best is trial 1119 with value: 0.4485361816812923.
[I 2024-12-03 18:46:42,988] Trial 1321 finished with value: 0.46826928575933024 and parameters: {'kernel': 'rbf', 'C': 18.925173494617567, 'gamma': 0.02438268986402284, 'epsilon': 0.027218557854905664}. Best is trial 1119 with value: 0.4485361816812923.
[I 2024-12-03 18:46:43,691] Trial 1325 finished with value: 1.3426997774468121 and parameters: {'kernel': 'sigmoid', 'C': 0.19954637864579916, 'gamma': 0.0002321994330954618, 'epsilon': 0.00555167662157666}. Best is trial 1119 with value: 0.4485361816812923.
[I 2024-12-03 18:46:43,865] Trial 1329 finished with value: 1.3589157452604979 and parameters: {'kernel': 'rbf', 'C': 0.10482121785673769, 'gamma': 0.0001095619066366135, 'epsilon': 0.013508381332773696}. Best is trial 1119 with value: 0.4485361816812923.
[I 2024-12-03 18:46:43,919] Trial 1322 finished with value: 0.6518749955575932 and parameters: {'kernel': 'linear', 'C': 0.08963401564593519, 'gamma': 0.00026015110201513, 'epsilon': 0.049440780172590605}. Best is trial 1119 with value: 0.4485361816812923.
[I 2024-12-03 18:46:43,925] Trial 1318 finished with value: 0.5191065077902971 and parameters: {'kernel': 'rbf', 'C': 18.447255578882224, 'gamma': 0.012018291008365515, 'epsilon': 0.0507421434850139}. Best is trial 1119 with value: 0.4485361816812923.
[I 2024-12-03 18:46:44,034] Trial 1320 finished with value: 523.8370342951533 and parameters: {'kernel': 'sigmoid', 'C': 60.78956683313272, 'gamma': 0.09211004725274734, 'epsilon': 0.25928438353782635}. Best is trial 1119 with value: 0.4485361816812923.
[I 2024-12-03 18:46:44,282] Trial 1327 finished with value: 0.6247271675481341 and parameters: {'kernel': 'rbf', 'C': 93.70059510667954, 'gamma': 0.06738084096270806, 'epsilon': 0.1269115431404068}. Best is trial 1119 with value: 0.4485361816812923.
[I 2024-12-03 18:46:44,622] Trial 1330 finished with value: 0.5260147406598993 and parameters: {'kernel': 'rbf', 'C': 90.7644185845131, 'gamma': 0.004136719423306892, 'epsilon': 0.1500148181328136}. Best is trial 1119 with value: 0.4485361816812923.
[I 2024-12-03 18:46:44,627] Trial 1319 finished with value: 0.5308546349737882 and parameters: {'kernel': 'rbf', 'C': 25.619679099399608, 'gamma': 0.008144370789467394, 'epsilon': 0.04832841872050295}. Best is trial 1119 with value: 0.4485361816812923.
[I 2024-12-03 18:46:45,580] Trial 1336 finished with value: 0.6050148120363485 and parameters: {'kernel': 'rbf', 'C': 99.89522427773475, 'gamma': 0.0446654263095717, 'epsilon': 0.02143562967494461}. Best is trial 1119 with value: 0.4485361816812923.
[I 2024-12-03 18:46:45,582] Trial 1333 finished with value: 0.45870588525146566 and parameters: {'kernel': 'rbf', 'C': 90.11097586891452, 'gamma': 0.0174295205174295, 'epsilon': 0.034853749539156036}. Best is trial 1119 with value: 0.4485361816812923.
[I 2024-12-03 18:46:45,705] Trial 1340 finished with value: 0.46431809519609496 and parameters: {'kernel': 'rbf', 'C': 99.8984938687154, 'gamma': 0.01974210606027049, 'epsilon': 0.06306336593616717}. Best is trial 1119 with value: 0.4485361816812923.
[I 2024-12-03 18:46:45,770] Trial 1316 finished with value: 173.15611888806674 and parameters: {'kernel': 'sigmoid', 'C': 11.988304976612161, 'gamma': 0.3654144977118374, 'epsilon': 0.039063668229945815}. Best is trial 1119 with value: 0.4485361816812923.
[I 2024-12-03 18:46:45,802] Trial 1334 finished with value: 0.477374495426741 and parameters: {'kernel': 'rbf', 'C': 20.663808778615575, 'gamma': 0.018046060389880353, 'epsilon': 0.13369828351504381}. Best is trial 1119 with value: 0.4485361816812923.
[I 2024-12-03 18:46:45,880] Trial 1317 finished with value: 0.529400967506968 and parameters: {'kernel': 'rbf', 'C': 93.68911634011182, 'gamma': 0.022366231971502355, 'epsilon': 0.1591227606951451}. Best is trial 1119 with value: 0.4485361816812923.
[I 2024-12-03 18:46:46,168] Trial 1324 finished with value: 0.5304728047566527 and parameters: {'kernel': 'rbf', 'C': 91.12593041115912, 'gamma': 0.028526635044814473, 'epsilon': 0.0972985744724934}. Best is trial 1119 with value: 0.4485361816812923.
[I 2024-12-03 18:46:46,225] Trial 1328 finished with value: 0.7550695490255782 and parameters: {'kernel': 'linear', 'C': 0.032025529975081776, 'gamma': 0.0002740517865330539, 'epsilon': 0.012545628982257273}. Best is trial 1119 with value: 0.4485361816812923.
[I 2024-12-03 18:46:46,228] Trial 1323 finished with value: 0.5767031278930538 and parameters: {'kernel': 'rbf', 'C': 90.1578051883549, 'gamma': 0.0012146461816385777, 'epsilon': 0.16612649824515444}. Best is trial 1119 with value: 0.4485361816812923.
[I 2024-12-03 18:46:46,476] Trial 1338 finished with value: 0.49583631173885057 and parameters: {'kernel': 'rbf', 'C': 99.84777165294254, 'gamma': 0.012171959851559739, 'epsilon': 0.2317970988197139}. Best is trial 1119 with value: 0.4485361816812923.
[I 2024-12-03 18:46:47,739] Trial 1335 finished with value: 0.6198012620686598 and parameters: {'kernel': 'rbf', 'C': 17.246771950807158, 'gamma': 0.003040459620240995, 'epsilon': 0.05364817874543804}. Best is trial 1119 with value: 0.4485361816812923.
[I 2024-12-03 18:46:47,900] Trial 1341 finished with value: 0.5420746130794362 and parameters: {'kernel': 'rbf', 'C': 26.225034079958263, 'gamma': 0.05683347625844579, 'epsilon': 0.06842873590316913}. Best is trial 1119 with value: 0.4485361816812923.
[I 2024-12-03 18:46:48,054] Trial 1344 finished with value: 0.5172905783004628 and parameters: {'kernel': 'rbf', 'C': 24.107057590143206, 'gamma': 0.012702941638217247, 'epsilon': 0.23235799928080753}. Best is trial 1119 with value: 0.4485361816812923.
[I 2024-12-03 18:46:48,809] Trial 1337 finished with value: 0.9883945108971856 and parameters: {'kernel': 'poly', 'C': 0.002661747812831353, 'gamma': 0.1790821493550503, 'epsilon': 0.002244025655246379}. Best is trial 1119 with value: 0.4485361816812923.
[I 2024-12-03 18:46:48,815] Trial 1339 finished with value: 0.5132195972910785 and parameters: {'kernel': 'rbf', 'C': 22.70488352858793, 'gamma': 0.011186461043975771, 'epsilon': 0.05873274131907704}. Best is trial 1119 with value: 0.4485361816812923.
[I 2024-12-03 18:46:48,838] Trial 1332 finished with value: 0.5711846747346037 and parameters: {'kernel': 'rbf', 'C': 2.761405763614248, 'gamma': 0.03934911650005637, 'epsilon': 0.12719106775904376}. Best is trial 1119 with value: 0.4485361816812923.
[I 2024-12-03 18:46:49,790] Trial 1331 finished with value: 0.6884120356397047 and parameters: {'kernel': 'rbf', 'C': 17.008358823997426, 'gamma': 0.0016649472159777547, 'epsilon': 0.025116309360248976}. Best is trial 1119 with value: 0.4485361816812923.
[I 2024-12-03 18:46:50,567] Trial 1346 finished with value: 0.5456299739816391 and parameters: {'kernel': 'rbf', 'C': 96.66451603924408, 'gamma': 0.0028690052529777715, 'epsilon': 0.06313851334247718}. Best is trial 1119 with value: 0.4485361816812923.
[I 2024-12-03 18:46:50,974] Trial 1250 finished with value: 1.1121668732458774 and parameters: {'kernel': 'poly', 'C': 0.6740776215331689, 'gamma': 0.6389807581558014, 'epsilon': 0.005653625405682324}. Best is trial 1119 with value: 0.4485361816812923.
[I 2024-12-03 18:46:51,032] Trial 1343 finished with value: 0.5539785356550716 and parameters: {'kernel': 'rbf', 'C': 18.371622085964205, 'gamma': 0.006736595530800238, 'epsilon': 0.05387593672886064}. Best is trial 1119 with value: 0.4485361816812923.
[I 2024-12-03 18:46:51,372] Trial 1345 finished with value: 0.5556712050180694 and parameters: {'kernel': 'rbf', 'C': 16.96320448860686, 'gamma': 0.007825477856979603, 'epsilon': 0.01403023384893721}. Best is trial 1119 with value: 0.4485361816812923.
[I 2024-12-03 18:46:51,669] Trial 1347 finished with value: 0.47258424875075095 and parameters: {'kernel': 'rbf', 'C': 93.89250104249409, 'gamma': 0.011485009904135514, 'epsilon': 0.17041582941505543}. Best is trial 1119 with value: 0.4485361816812923.
[I 2024-12-03 18:46:51,800] Trial 1351 finished with value: 0.4672118708639387 and parameters: {'kernel': 'rbf', 'C': 20.199844329347044, 'gamma': 0.02580410617247798, 'epsilon': 0.032194886410103304}. Best is trial 1119 with value: 0.4485361816812923.
[I 2024-12-03 18:46:52,027] Trial 1360 finished with value: 0.4636980836163125 and parameters: {'kernel': 'rbf', 'C': 89.92657924945462, 'gamma': 0.011002690234829903, 'epsilon': 0.0273157414056904}. Best is trial 1119 with value: 0.4485361816812923.
[I 2024-12-03 18:46:52,078] Trial 1348 finished with value: 0.46877105744490033 and parameters: {'kernel': 'rbf', 'C': 91.96078017520462, 'gamma': 0.00943174984492823, 'epsilon': 0.05385329106758965}. Best is trial 1119 with value: 0.4485361816812923.
[I 2024-12-03 18:46:52,599] Trial 1342 finished with value: 0.5714526106107677 and parameters: {'kernel': 'rbf', 'C': 13.99475895137762, 'gamma': 0.005939035269479074, 'epsilon': 0.11474275412722262}. Best is trial 1119 with value: 0.4485361816812923.
[I 2024-12-03 18:46:53,784] Trial 1358 finished with value: 0.5192365064903828 and parameters: {'kernel': 'rbf', 'C': 92.92182224757873, 'gamma': 0.029272371626940095, 'epsilon': 0.05143028117914799}. Best is trial 1119 with value: 0.4485361816812923.
[I 2024-12-03 18:46:54,402] Trial 1362 finished with value: 113.75276406540921 and parameters: {'kernel': 'sigmoid', 'C': 29.593236072792624, 'gamma': 0.020420934919182215, 'epsilon': 0.05461281867734704}. Best is trial 1119 with value: 0.4485361816812923.
[I 2024-12-03 18:46:54,543] Trial 1352 finished with value: 0.4740975312499766 and parameters: {'kernel': 'rbf', 'C': 19.97083764266839, 'gamma': 0.029734966378060543, 'epsilon': 0.09389858864118415}. Best is trial 1119 with value: 0.4485361816812923.
[I 2024-12-03 18:46:54,670] Trial 1359 finished with value: 0.48707777797524715 and parameters: {'kernel': 'rbf', 'C': 97.71526083479692, 'gamma': 0.006738843377732937, 'epsilon': 0.09573480694764881}. Best is trial 1119 with value: 0.4485361816812923.
[I 2024-12-03 18:46:55,587] Trial 1355 finished with value: 0.48405614856043155 and parameters: {'kernel': 'rbf', 'C': 95.83424459977878, 'gamma': 0.01672152458992661, 'epsilon': 0.14541255076376478}. Best is trial 1119 with value: 0.4485361816812923.
