[I 2024-12-04 15:48:32,059] Trial 2425 finished with value: 0.4207602099914331 and parameters: {'n_estimators': 879, 'max_depth': 36, 'min_samples_split': 2, 'min_samples_leaf': 1, 'max_features': None, 'bootstrap': True, 'criterion': 'squared_error'}. Best is trial 1025 with value: 0.41844370194907604.
[I 2024-12-04 15:48:33,086] Trial 2429 finished with value: 0.42117991403527844 and parameters: {'n_estimators': 887, 'max_depth': 35, 'min_samples_split': 2, 'min_samples_leaf': 1, 'max_features': None, 'bootstrap': True, 'criterion': 'squared_error'}. Best is trial 1025 with value: 0.41844370194907604.
[I 2024-12-04 15:48:37,504] Trial 2436 finished with value: 0.4314140001761433 and parameters: {'n_estimators': 825, 'max_depth': 37, 'min_samples_split': 4, 'min_samples_leaf': 1, 'max_features': None, 'bootstrap': True, 'criterion': 'squared_error'}. Best is trial 1025 with value: 0.41844370194907604.
[I 2024-12-04 15:48:37,883] Trial 2438 finished with value: 0.46447161676857057 and parameters: {'n_estimators': 624, 'max_depth': 30, 'min_samples_split': 4, 'min_samples_leaf': 2, 'max_features': None, 'bootstrap': True, 'criterion': 'squared_error'}. Best is trial 1025 with value: 0.41844370194907604.
[I 2024-12-04 15:48:41,337] Trial 2430 finished with value: 0.41873679770139766 and parameters: {'n_estimators': 741, 'max_depth': 40, 'min_samples_split': 2, 'min_samples_leaf': 1, 'max_features': None, 'bootstrap': True, 'criterion': 'squared_error'}. Best is trial 1025 with value: 0.41844370194907604.
[I 2024-12-04 15:48:42,018] Trial 2433 finished with value: 0.41925809742165315 and parameters: {'n_estimators': 862, 'max_depth': 41, 'min_samples_split': 2, 'min_samples_leaf': 1, 'max_features': None, 'bootstrap': True, 'criterion': 'squared_error'}. Best is trial 1025 with value: 0.41844370194907604.
[I 2024-12-04 15:48:44,717] Trial 2440 finished with value: 0.46623775279119345 and parameters: {'n_estimators': 852, 'max_depth': 23, 'min_samples_split': 2, 'min_samples_leaf': 2, 'max_features': None, 'bootstrap': True, 'criterion': 'squared_error'}. Best is trial 1025 with value: 0.41844370194907604.
[I 2024-12-04 15:48:47,067] Trial 2456 finished with value: 1.0469872071591413 and parameters: {'n_estimators': 140, 'max_depth': 11, 'min_samples_split': 3, 'min_samples_leaf': 13, 'max_features': 'sqrt', 'bootstrap': True, 'criterion': 'squared_error'}. Best is trial 1025 with value: 0.41844370194907604.
[I 2024-12-04 15:48:51,309] Trial 2434 finished with value: 0.42413049348623116 and parameters: {'n_estimators': 933, 'max_depth': 44, 'min_samples_split': 3, 'min_samples_leaf': 1, 'max_features': None, 'bootstrap': True, 'criterion': 'squared_error'}. Best is trial 1025 with value: 0.41844370194907604.
[I 2024-12-04 15:48:51,928] Trial 2384 finished with value: 0.4309994304491251 and parameters: {'n_estimators': 821, 'max_depth': 44, 'min_samples_split': 4, 'min_samples_leaf': 1, 'max_features': None, 'bootstrap': True, 'criterion': 'absolute_error'}. Best is trial 1025 with value: 0.41844370194907604.
[I 2024-12-04 15:48:51,960] Trial 2445 finished with value: 0.8139674283514073 and parameters: {'n_estimators': 899, 'max_depth': 50, 'min_samples_split': 24, 'min_samples_leaf': 4, 'max_features': 'sqrt', 'bootstrap': False, 'criterion': 'absolute_error'}. Best is trial 1025 with value: 0.41844370194907604.
[I 2024-12-04 15:48:54,839] Trial 2442 finished with value: 0.46478322021422486 and parameters: {'n_estimators': 861, 'max_depth': 37, 'min_samples_split': 4, 'min_samples_leaf': 2, 'max_features': None, 'bootstrap': True, 'criterion': 'squared_error'}. Best is trial 1025 with value: 0.41844370194907604.
[I 2024-12-04 15:48:55,093] Trial 2452 finished with value: 0.5277933922490817 and parameters: {'n_estimators': 791, 'max_depth': 37, 'min_samples_split': 2, 'min_samples_leaf': 1, 'max_features': None, 'bootstrap': False, 'criterion': 'squared_error'}. Best is trial 1025 with value: 0.41844370194907604.
[I 2024-12-04 15:48:58,870] Trial 2439 finished with value: 0.42073530793552416 and parameters: {'n_estimators': 917, 'max_depth': 44, 'min_samples_split': 2, 'min_samples_leaf': 1, 'max_features': None, 'bootstrap': True, 'criterion': 'squared_error'}. Best is trial 1025 with value: 0.41844370194907604.
[I 2024-12-04 15:49:02,074] Trial 2454 finished with value: 0.6994425056476793 and parameters: {'n_estimators': 446, 'max_depth': 50, 'min_samples_split': 7, 'min_samples_leaf': 2, 'max_features': 'sqrt', 'bootstrap': True, 'criterion': 'squared_error'}. Best is trial 1025 with value: 0.41844370194907604.
[I 2024-12-04 15:49:02,959] Trial 2443 finished with value: 0.4189073259026137 and parameters: {'n_estimators': 871, 'max_depth': 40, 'min_samples_split': 2, 'min_samples_leaf': 1, 'max_features': None, 'bootstrap': True, 'criterion': 'squared_error'}. Best is trial 1025 with value: 0.41844370194907604.
[I 2024-12-04 15:49:02,988] Trial 2448 finished with value: 0.43116935043232146 and parameters: {'n_estimators': 863, 'max_depth': 37, 'min_samples_split': 4, 'min_samples_leaf': 1, 'max_features': None, 'bootstrap': True, 'criterion': 'squared_error'}. Best is trial 1025 with value: 0.41844370194907604.
[I 2024-12-04 15:49:03,005] Trial 2437 finished with value: 0.5825648658637655 and parameters: {'n_estimators': 931, 'max_depth': 40, 'min_samples_split': 15, 'min_samples_leaf': 1, 'max_features': 'sqrt', 'bootstrap': False, 'criterion': 'absolute_error'}. Best is trial 1025 with value: 0.41844370194907604.
[I 2024-12-04 15:49:03,012] Trial 2449 finished with value: 0.5012170771003097 and parameters: {'n_estimators': 882, 'max_depth': 42, 'min_samples_split': 2, 'min_samples_leaf': 1, 'max_features': 'sqrt', 'bootstrap': True, 'criterion': 'squared_error'}. Best is trial 1025 with value: 0.41844370194907604.
[I 2024-12-04 15:49:03,821] Trial 2447 finished with value: 0.4227489558353988 and parameters: {'n_estimators': 907, 'max_depth': 30, 'min_samples_split': 2, 'min_samples_leaf': 1, 'max_features': None, 'bootstrap': True, 'criterion': 'squared_error'}. Best is trial 1025 with value: 0.41844370194907604.
[I 2024-12-04 15:49:06,995] Trial 2410 finished with value: 0.4596394810334802 and parameters: {'n_estimators': 940, 'max_depth': 31, 'min_samples_split': 3, 'min_samples_leaf': 2, 'max_features': None, 'bootstrap': True, 'criterion': 'absolute_error'}. Best is trial 1025 with value: 0.41844370194907604.
[I 2024-12-04 15:49:07,756] Trial 2455 finished with value: 0.42155190099069945 and parameters: {'n_estimators': 758, 'max_depth': 32, 'min_samples_split': 2, 'min_samples_leaf': 1, 'max_features': None, 'bootstrap': True, 'criterion': 'squared_error'}. Best is trial 1025 with value: 0.41844370194907604.
[I 2024-12-04 15:49:09,242] Trial 2441 finished with value: 0.42105800571672974 and parameters: {'n_estimators': 976, 'max_depth': 32, 'min_samples_split': 2, 'min_samples_leaf': 1, 'max_features': None, 'bootstrap': True, 'criterion': 'squared_error'}. Best is trial 1025 with value: 0.41844370194907604.
[I 2024-12-04 15:49:10,794] Trial 2450 finished with value: 0.4653459649223876 and parameters: {'n_estimators': 938, 'max_depth': 39, 'min_samples_split': 2, 'min_samples_leaf': 2, 'max_features': None, 'bootstrap': True, 'criterion': 'squared_error'}. Best is trial 1025 with value: 0.41844370194907604.
[I 2024-12-04 15:49:10,800] Trial 2453 finished with value: 0.42027087719029804 and parameters: {'n_estimators': 854, 'max_depth': 43, 'min_samples_split': 2, 'min_samples_leaf': 1, 'max_features': None, 'bootstrap': True, 'criterion': 'squared_error'}. Best is trial 1025 with value: 0.41844370194907604.
[I 2024-12-04 15:49:11,950] Trial 2457 finished with value: 0.935449243163516 and parameters: {'n_estimators': 912, 'max_depth': 24, 'min_samples_split': 23, 'min_samples_leaf': 5, 'max_features': 'sqrt', 'bootstrap': True, 'criterion': 'absolute_error'}. Best is trial 1025 with value: 0.41844370194907604.
[I 2024-12-04 15:49:12,733] Trial 2444 finished with value: 0.42053543268420257 and parameters: {'n_estimators': 780, 'max_depth': 43, 'min_samples_split': 2, 'min_samples_leaf': 1, 'max_features': None, 'bootstrap': True, 'criterion': 'squared_error'}. Best is trial 1025 with value: 0.41844370194907604.
[I 2024-12-04 15:49:13,360] Trial 2451 finished with value: 0.4361067989807356 and parameters: {'n_estimators': 768, 'max_depth': 25, 'min_samples_split': 4, 'min_samples_leaf': 1, 'max_features': None, 'bootstrap': True, 'criterion': 'squared_error'}. Best is trial 1025 with value: 0.41844370194907604.
[I 2024-12-04 15:49:15,390] Trial 2462 finished with value: 0.49007594847743075 and parameters: {'n_estimators': 113, 'max_depth': 38, 'min_samples_split': 23, 'min_samples_leaf': 1, 'max_features': None, 'bootstrap': True, 'criterion': 'absolute_error'}. Best is trial 1025 with value: 0.41844370194907604.
[I 2024-12-04 15:49:16,077] Trial 2460 finished with value: 0.46529845715228946 and parameters: {'n_estimators': 772, 'max_depth': 43, 'min_samples_split': 2, 'min_samples_leaf': 2, 'max_features': None, 'bootstrap': True, 'criterion': 'squared_error'}. Best is trial 1025 with value: 0.41844370194907604.
[I 2024-12-04 15:49:16,299] Trial 2467 finished with value: 0.565033619047432 and parameters: {'n_estimators': 473, 'max_depth': 9, 'min_samples_split': 17, 'min_samples_leaf': 1, 'max_features': None, 'bootstrap': True, 'criterion': 'squared_error'}. Best is trial 1025 with value: 0.41844370194907604.
[I 2024-12-04 15:49:17,055] Trial 2459 finished with value: 0.4194867654720573 and parameters: {'n_estimators': 869, 'max_depth': 39, 'min_samples_split': 2, 'min_samples_leaf': 1, 'max_features': None, 'bootstrap': True, 'criterion': 'squared_error'}. Best is trial 1025 with value: 0.41844370194907604.
[I 2024-12-04 15:49:18,619] Trial 2464 finished with value: 0.6784915189930453 and parameters: {'n_estimators': 730, 'max_depth': 33, 'min_samples_split': 2, 'min_samples_leaf': 1, 'max_features': 'log2', 'bootstrap': True, 'criterion': 'squared_error'}. Best is trial 1025 with value: 0.41844370194907604.
[I 2024-12-04 15:49:22,698] Trial 2458 finished with value: 0.41989619919923427 and parameters: {'n_estimators': 790, 'max_depth': 41, 'min_samples_split': 2, 'min_samples_leaf': 1, 'max_features': None, 'bootstrap': True, 'criterion': 'squared_error'}. Best is trial 1025 with value: 0.41844370194907604.
[I 2024-12-04 15:49:24,317] Trial 2461 finished with value: 0.4197021261956105 and parameters: {'n_estimators': 904, 'max_depth': 41, 'min_samples_split': 2, 'min_samples_leaf': 1, 'max_features': None, 'bootstrap': True, 'criterion': 'squared_error'}. Best is trial 1025 with value: 0.41844370194907604.
[I 2024-12-04 15:49:24,902] Trial 2463 finished with value: 0.42208603032821784 and parameters: {'n_estimators': 726, 'max_depth': 35, 'min_samples_split': 2, 'min_samples_leaf': 1, 'max_features': None, 'bootstrap': True, 'criterion': 'squared_error'}. Best is trial 1025 with value: 0.41844370194907604.
[I 2024-12-04 15:49:28,878] Trial 2465 finished with value: 0.42384741937424264 and parameters: {'n_estimators': 800, 'max_depth': 37, 'min_samples_split': 3, 'min_samples_leaf': 1, 'max_features': None, 'bootstrap': True, 'criterion': 'squared_error'}. Best is trial 1025 with value: 0.41844370194907604.
[I 2024-12-04 15:49:33,063] Trial 2473 finished with value: 1.0127645187409586 and parameters: {'n_estimators': 899, 'max_depth': 6, 'min_samples_split': 22, 'min_samples_leaf': 2, 'max_features': 'log2', 'bootstrap': True, 'criterion': 'absolute_error'}. Best is trial 1025 with value: 0.41844370194907604.
[I 2024-12-04 15:49:34,004] Trial 2470 finished with value: 0.4652033852003223 and parameters: {'n_estimators': 851, 'max_depth': 37, 'min_samples_split': 3, 'min_samples_leaf': 2, 'max_features': None, 'bootstrap': True, 'criterion': 'squared_error'}. Best is trial 1025 with value: 0.41844370194907604.
[I 2024-12-04 15:49:34,045] Trial 2481 finished with value: 0.6804611702917371 and parameters: {'n_estimators': 182, 'max_depth': 36, 'min_samples_split': 25, 'min_samples_leaf': 11, 'max_features': None, 'bootstrap': True, 'criterion': 'squared_error'}. Best is trial 1025 with value: 0.41844370194907604.
[I 2024-12-04 15:49:36,209] Trial 2472 finished with value: 0.4655708430325588 and parameters: {'n_estimators': 831, 'max_depth': 33, 'min_samples_split': 2, 'min_samples_leaf': 2, 'max_features': None, 'bootstrap': True, 'criterion': 'squared_error'}. Best is trial 1025 with value: 0.41844370194907604.
[I 2024-12-04 15:49:36,311] Trial 2468 finished with value: 0.5959040456728354 and parameters: {'n_estimators': 877, 'max_depth': 50, 'min_samples_split': 4, 'min_samples_leaf': 1, 'max_features': 'log2', 'bootstrap': True, 'criterion': 'squared_error'}. Best is trial 1025 with value: 0.41844370194907604.
[I 2024-12-04 15:49:38,220] Trial 2466 finished with value: 0.4207379305700112 and parameters: {'n_estimators': 901, 'max_depth': 36, 'min_samples_split': 2, 'min_samples_leaf': 1, 'max_features': None, 'bootstrap': True, 'criterion': 'squared_error'}. Best is trial 1025 with value: 0.41844370194907604.
[I 2024-12-04 15:49:39,708] Trial 2469 finished with value: 0.46484217709846465 and parameters: {'n_estimators': 859, 'max_depth': 43, 'min_samples_split': 4, 'min_samples_leaf': 2, 'max_features': None, 'bootstrap': True, 'criterion': 'squared_error'}. Best is trial 1025 with value: 0.41844370194907604.
[I 2024-12-04 15:49:39,740] Trial 2480 finished with value: 0.9110564690963006 and parameters: {'n_estimators': 957, 'max_depth': 13, 'min_samples_split': 12, 'min_samples_leaf': 1, 'max_features': 'log2', 'bootstrap': True, 'criterion': 'squared_error'}. Best is trial 1025 with value: 0.41844370194907604.
[I 2024-12-04 15:49:40,129] Trial 2471 finished with value: 0.42359040369815115 and parameters: {'n_estimators': 942, 'max_depth': 41, 'min_samples_split': 3, 'min_samples_leaf': 1, 'max_features': None, 'bootstrap': True, 'criterion': 'squared_error'}. Best is trial 1025 with value: 0.41844370194907604.
[I 2024-12-04 15:49:40,860] Trial 2474 finished with value: 0.42121096105866024 and parameters: {'n_estimators': 834, 'max_depth': 47, 'min_samples_split': 2, 'min_samples_leaf': 1, 'max_features': None, 'bootstrap': True, 'criterion': 'squared_error'}. Best is trial 1025 with value: 0.41844370194907604.
[I 2024-12-04 15:49:41,387] Trial 2475 finished with value: 0.9592508631978605 and parameters: {'n_estimators': 817, 'max_depth': 41, 'min_samples_split': 6, 'min_samples_leaf': 2, 'max_features': 'log2', 'bootstrap': True, 'criterion': 'squared_error'}. Best is trial 1025 with value: 0.41844370194907604.
[I 2024-12-04 15:49:43,776] Trial 2477 finished with value: 0.5927874783567105 and parameters: {'n_estimators': 652, 'max_depth': 33, 'min_samples_split': 5, 'min_samples_leaf': 1, 'max_features': 'sqrt', 'bootstrap': True, 'criterion': 'absolute_error'}. Best is trial 1025 with value: 0.41844370194907604.
[I 2024-12-04 15:49:47,940] Trial 2478 finished with value: 0.42344444552961175 and parameters: {'n_estimators': 825, 'max_depth': 41, 'min_samples_split': 3, 'min_samples_leaf': 1, 'max_features': None, 'bootstrap': True, 'criterion': 'squared_error'}. Best is trial 1025 with value: 0.41844370194907604.
[I 2024-12-04 15:49:48,031] Trial 2446 finished with value: 0.45474144487109136 and parameters: {'n_estimators': 643, 'max_depth': 22, 'min_samples_split': 2, 'min_samples_leaf': 1, 'max_features': None, 'bootstrap': True, 'criterion': 'absolute_error'}. Best is trial 1025 with value: 0.41844370194907604.
[I 2024-12-04 15:49:48,597] Trial 2476 finished with value: 0.4320002095476994 and parameters: {'n_estimators': 819, 'max_depth': 42, 'min_samples_split': 4, 'min_samples_leaf': 1, 'max_features': None, 'bootstrap': True, 'criterion': 'squared_error'}. Best is trial 1025 with value: 0.41844370194907604.
[I 2024-12-04 15:49:48,863] Trial 2479 finished with value: 0.42160164233916625 and parameters: {'n_estimators': 925, 'max_depth': 50, 'min_samples_split': 2, 'min_samples_leaf': 1, 'max_features': None, 'bootstrap': True, 'criterion': 'squared_error'}. Best is trial 1025 with value: 0.41844370194907604.
[I 2024-12-04 15:49:49,457] Trial 2494 finished with value: 0.9493611611736379 and parameters: {'n_estimators': 188, 'max_depth': 33, 'min_samples_split': 46, 'min_samples_leaf': 5, 'max_features': 'sqrt', 'bootstrap': True, 'criterion': 'absolute_error'}. Best is trial 1025 with value: 0.41844370194907604.
[I 2024-12-04 15:49:49,973] Trial 2483 finished with value: 0.48366420484155687 and parameters: {'n_estimators': 673, 'max_depth': 50, 'min_samples_split': 2, 'min_samples_leaf': 1, 'max_features': 'sqrt', 'bootstrap': True, 'criterion': 'squared_error'}. Best is trial 1025 with value: 0.41844370194907604.
[I 2024-12-04 15:49:51,081] Trial 2488 finished with value: 0.42221166494129597 and parameters: {'n_estimators': 618, 'max_depth': 45, 'min_samples_split': 2, 'min_samples_leaf': 1, 'max_features': None, 'bootstrap': True, 'criterion': 'squared_error'}. Best is trial 1025 with value: 0.41844370194907604.
[I 2024-12-04 15:49:51,624] Trial 2485 finished with value: 0.465332291773703 and parameters: {'n_estimators': 922, 'max_depth': 46, 'min_samples_split': 2, 'min_samples_leaf': 2, 'max_features': None, 'bootstrap': True, 'criterion': 'squared_error'}. Best is trial 1025 with value: 0.41844370194907604.
[I 2024-12-04 15:49:51,983] Trial 2486 finished with value: 0.4647500845915931 and parameters: {'n_estimators': 609, 'max_depth': 50, 'min_samples_split': 2, 'min_samples_leaf': 2, 'max_features': None, 'bootstrap': True, 'criterion': 'squared_error'}. Best is trial 1025 with value: 0.41844370194907604.
[I 2024-12-04 15:49:52,759] Trial 2487 finished with value: 0.41972393001905905 and parameters: {'n_estimators': 646, 'max_depth': 40, 'min_samples_split': 2, 'min_samples_leaf': 1, 'max_features': None, 'bootstrap': True, 'criterion': 'squared_error'}. Best is trial 1025 with value: 0.41844370194907604.
[I 2024-12-04 15:49:53,072] Trial 2484 finished with value: 0.46554860759714145 and parameters: {'n_estimators': 972, 'max_depth': 44, 'min_samples_split': 2, 'min_samples_leaf': 2, 'max_features': None, 'bootstrap': True, 'criterion': 'squared_error'}. Best is trial 1025 with value: 0.41844370194907604.
[I 2024-12-04 15:49:54,220] Trial 2482 finished with value: 0.4192192142538545 and parameters: {'n_estimators': 935, 'max_depth': 39, 'min_samples_split': 2, 'min_samples_leaf': 1, 'max_features': None, 'bootstrap': True, 'criterion': 'squared_error'}. Best is trial 1025 with value: 0.41844370194907604.
[I 2024-12-04 15:49:54,599] Trial 2490 finished with value: 0.4193956764737842 and parameters: {'n_estimators': 731, 'max_depth': 41, 'min_samples_split': 2, 'min_samples_leaf': 1, 'max_features': None, 'bootstrap': True, 'criterion': 'squared_error'}. Best is trial 1025 with value: 0.41844370194907604.
[I 2024-12-04 15:49:54,599] Trial 2493 finished with value: 0.5902364768254035 and parameters: {'n_estimators': 821, 'max_depth': 47, 'min_samples_split': 2, 'min_samples_leaf': 1, 'max_features': 'log2', 'bootstrap': True, 'criterion': 'squared_error'}. Best is trial 1025 with value: 0.41844370194907604.
[I 2024-12-04 15:49:56,596] Trial 2491 finished with value: 0.43243681677058915 and parameters: {'n_estimators': 995, 'max_depth': 32, 'min_samples_split': 4, 'min_samples_leaf': 1, 'max_features': None, 'bootstrap': True, 'criterion': 'squared_error'}. Best is trial 1025 with value: 0.41844370194907604.
[I 2024-12-04 15:49:56,820] Trial 2489 finished with value: 0.41961673604645505 and parameters: {'n_estimators': 908, 'max_depth': 39, 'min_samples_split': 2, 'min_samples_leaf': 1, 'max_features': None, 'bootstrap': True, 'criterion': 'squared_error'}. Best is trial 1025 with value: 0.41844370194907604.
[I 2024-12-04 15:49:57,332] Trial 2495 finished with value: 0.4245086772411677 and parameters: {'n_estimators': 741, 'max_depth': 27, 'min_samples_split': 2, 'min_samples_leaf': 1, 'max_features': None, 'bootstrap': True, 'criterion': 'squared_error'}. Best is trial 1025 with value: 0.41844370194907604.
[I 2024-12-04 15:49:57,422] Trial 2498 finished with value: 0.42292107867540235 and parameters: {'n_estimators': 750, 'max_depth': 30, 'min_samples_split': 2, 'min_samples_leaf': 1, 'max_features': None, 'bootstrap': True, 'criterion': 'squared_error'}. Best is trial 1025 with value: 0.41844370194907604.
[I 2024-12-04 15:49:57,762] Trial 2499 finished with value: 0.4214521301577603 and parameters: {'n_estimators': 768, 'max_depth': 32, 'min_samples_split': 2, 'min_samples_leaf': 1, 'max_features': None, 'bootstrap': True, 'criterion': 'squared_error'}. Best is trial 1025 with value: 0.41844370194907604.
[I 2024-12-04 15:49:57,768] Trial 2497 finished with value: 0.4210394972634647 and parameters: {'n_estimators': 837, 'max_depth': 32, 'min_samples_split': 2, 'min_samples_leaf': 1, 'max_features': None, 'bootstrap': True, 'criterion': 'squared_error'}. Best is trial 1025 with value: 0.41844370194907604.
[I 2024-12-04 15:50:05,199] Trial 2492 finished with value: 0.5972036262156913 and parameters: {'n_estimators': 966, 'max_depth': 50, 'min_samples_split': 3, 'min_samples_leaf': 1, 'max_features': 'log2', 'bootstrap': False, 'criterion': 'absolute_error'}. Best is trial 1025 with value: 0.41844370194907604.
[I 2024-12-04 15:51:01,059] Trial 2496 finished with value: 0.42953491904522956 and parameters: {'n_estimators': 765, 'max_depth': 38, 'min_samples_split': 2, 'min_samples_leaf': 1, 'max_features': None, 'bootstrap': True, 'criterion': 'absolute_error'}. Best is trial 1025 with value: 0.41844370194907604.
