[I 2024-12-04 11:59:09,397] Trial 301 finished with value: 0.2918547308494618 and parameters: {'n_estimators': 238, 'max_depth': 48, 'min_samples_split': 3, 'min_samples_leaf': 1, 'max_features': 'sqrt', 'bootstrap': False, 'criterion': 'squared_error'}. Best is trial 301 with value: 0.2918547308494618.
[I 2024-12-04 11:59:12,798] Trial 303 finished with value: 0.2946683771492709 and parameters: {'n_estimators': 284, 'max_depth': 50, 'min_samples_split': 3, 'min_samples_leaf': 1, 'max_features': 'sqrt', 'bootstrap': False, 'criterion': 'squared_error'}. Best is trial 301 with value: 0.2918547308494618.
[I 2024-12-04 11:59:13,934] Trial 295 finished with value: 0.29261985948526215 and parameters: {'n_estimators': 160, 'max_depth': 50, 'min_samples_split': 3, 'min_samples_leaf': 1, 'max_features': 'sqrt', 'bootstrap': False, 'criterion': 'squared_error'}. Best is trial 301 with value: 0.2918547308494618.
[I 2024-12-04 11:59:14,574] Trial 250 finished with value: 0.5151554808123449 and parameters: {'n_estimators': 711, 'max_depth': 8, 'min_samples_split': 2, 'min_samples_leaf': 11, 'max_features': None, 'bootstrap': False, 'criterion': 'absolute_error'}. Best is trial 301 with value: 0.2918547308494618.
[I 2024-12-04 11:59:14,873] Trial 291 finished with value: 0.6614840244291711 and parameters: {'n_estimators': 333, 'max_depth': 11, 'min_samples_split': 31, 'min_samples_leaf': 3, 'max_features': 'sqrt', 'bootstrap': False, 'criterion': 'absolute_error'}. Best is trial 301 with value: 0.2918547308494618.
[I 2024-12-04 11:59:16,085] Trial 300 finished with value: 0.2948165872977738 and parameters: {'n_estimators': 313, 'max_depth': 50, 'min_samples_split': 3, 'min_samples_leaf': 1, 'max_features': 'sqrt', 'bootstrap': False, 'criterion': 'squared_error'}. Best is trial 301 with value: 0.2918547308494618.
[I 2024-12-04 11:59:16,577] Trial 311 finished with value: 0.8275573461993532 and parameters: {'n_estimators': 125, 'max_depth': 14, 'min_samples_split': 45, 'min_samples_leaf': 7, 'max_features': 'sqrt', 'bootstrap': True, 'criterion': 'squared_error'}. Best is trial 301 with value: 0.2918547308494618.
[I 2024-12-04 11:59:16,913] Trial 298 finished with value: 0.2956486787664481 and parameters: {'n_estimators': 306, 'max_depth': 49, 'min_samples_split': 2, 'min_samples_leaf': 1, 'max_features': 'sqrt', 'bootstrap': False, 'criterion': 'squared_error'}. Best is trial 301 with value: 0.2918547308494618.
[I 2024-12-04 11:59:18,106] Trial 313 finished with value: 0.2942687934499666 and parameters: {'n_estimators': 178, 'max_depth': 47, 'min_samples_split': 3, 'min_samples_leaf': 1, 'max_features': 'sqrt', 'bootstrap': False, 'criterion': 'squared_error'}. Best is trial 301 with value: 0.2918547308494618.
[I 2024-12-04 11:59:18,591] Trial 284 finished with value: 0.5103814040301301 and parameters: {'n_estimators': 538, 'max_depth': 44, 'min_samples_split': 5, 'min_samples_leaf': 3, 'max_features': 'sqrt', 'bootstrap': False, 'criterion': 'absolute_error'}. Best is trial 301 with value: 0.2918547308494618.
[I 2024-12-04 11:59:19,212] Trial 308 finished with value: 0.7103456210386906 and parameters: {'n_estimators': 179, 'max_depth': 47, 'min_samples_split': 5, 'min_samples_leaf': 2, 'max_features': 'log2', 'bootstrap': False, 'criterion': 'squared_error'}. Best is trial 301 with value: 0.2918547308494618.
[I 2024-12-04 11:59:19,242] Trial 299 finished with value: 0.3874505235591252 and parameters: {'n_estimators': 256, 'max_depth': 47, 'min_samples_split': 2, 'min_samples_leaf': 1, 'max_features': None, 'bootstrap': False, 'criterion': 'squared_error'}. Best is trial 301 with value: 0.2918547308494618.
[I 2024-12-04 11:59:19,474] Trial 304 finished with value: 0.38844322328551395 and parameters: {'n_estimators': 276, 'max_depth': 46, 'min_samples_split': 2, 'min_samples_leaf': 1, 'max_features': None, 'bootstrap': False, 'criterion': 'squared_error'}. Best is trial 301 with value: 0.2918547308494618.
[I 2024-12-04 11:59:19,832] Trial 315 finished with value: 0.46503519282914857 and parameters: {'n_estimators': 161, 'max_depth': 32, 'min_samples_split': 5, 'min_samples_leaf': 2, 'max_features': 'sqrt', 'bootstrap': False, 'criterion': 'squared_error'}. Best is trial 301 with value: 0.2918547308494618.
[I 2024-12-04 11:59:20,757] Trial 309 finished with value: 0.44538696735872085 and parameters: {'n_estimators': 186, 'max_depth': 50, 'min_samples_split': 4, 'min_samples_leaf': 2, 'max_features': 'sqrt', 'bootstrap': False, 'criterion': 'squared_error'}. Best is trial 301 with value: 0.2918547308494618.
[I 2024-12-04 11:59:21,637] Trial 302 finished with value: 0.29508452419916753 and parameters: {'n_estimators': 349, 'max_depth': 50, 'min_samples_split': 3, 'min_samples_leaf': 1, 'max_features': 'sqrt', 'bootstrap': False, 'criterion': 'squared_error'}. Best is trial 301 with value: 0.2918547308494618.
[I 2024-12-04 11:59:25,046] Trial 312 finished with value: 0.2996469942014034 and parameters: {'n_estimators': 321, 'max_depth': 50, 'min_samples_split': 4, 'min_samples_leaf': 1, 'max_features': 'sqrt', 'bootstrap': False, 'criterion': 'squared_error'}. Best is trial 301 with value: 0.2918547308494618.
[I 2024-12-04 11:59:26,817] Trial 314 finished with value: 0.874402470968633 and parameters: {'n_estimators': 718, 'max_depth': 13, 'min_samples_split': 5, 'min_samples_leaf': 3, 'max_features': 'log2', 'bootstrap': True, 'criterion': 'squared_error'}. Best is trial 301 with value: 0.2918547308494618.
[I 2024-12-04 11:59:27,184] Trial 319 finished with value: 0.30416416062777984 and parameters: {'n_estimators': 193, 'max_depth': 41, 'min_samples_split': 3, 'min_samples_leaf': 1, 'max_features': 'sqrt', 'bootstrap': False, 'criterion': 'squared_error'}. Best is trial 301 with value: 0.2918547308494618.
[I 2024-12-04 11:59:27,995] Trial 306 finished with value: 0.5055701685035041 and parameters: {'n_estimators': 444, 'max_depth': 35, 'min_samples_split': 23, 'min_samples_leaf': 13, 'max_features': None, 'bootstrap': False, 'criterion': 'squared_error'}. Best is trial 301 with value: 0.2918547308494618.
[I 2024-12-04 11:59:28,099] Trial 322 finished with value: 0.44454181971493584 and parameters: {'n_estimators': 192, 'max_depth': 50, 'min_samples_split': 2, 'min_samples_leaf': 2, 'max_features': 'sqrt', 'bootstrap': False, 'criterion': 'squared_error'}. Best is trial 301 with value: 0.2918547308494618.
[I 2024-12-04 11:59:28,956] Trial 316 finished with value: 0.30561276356247175 and parameters: {'n_estimators': 144, 'max_depth': 48, 'min_samples_split': 5, 'min_samples_leaf': 1, 'max_features': 'sqrt', 'bootstrap': False, 'criterion': 'squared_error'}. Best is trial 317 with value: 0.29142632980121813.
[I 2024-12-04 11:59:29,161] Trial 317 finished with value: 0.29142632980121813 and parameters: {'n_estimators': 213, 'max_depth': 48, 'min_samples_split': 3, 'min_samples_leaf': 1, 'max_features': 'sqrt', 'bootstrap': False, 'criterion': 'squared_error'}. Best is trial 317 with value: 0.29142632980121813.
[I 2024-12-04 11:59:29,588] Trial 318 finished with value: 0.44292798204928147 and parameters: {'n_estimators': 168, 'max_depth': 50, 'min_samples_split': 2, 'min_samples_leaf': 2, 'max_features': 'sqrt', 'bootstrap': False, 'criterion': 'squared_error'}. Best is trial 317 with value: 0.29142632980121813.
[I 2024-12-04 11:59:29,734] Trial 320 finished with value: 0.38765402192801096 and parameters: {'n_estimators': 113, 'max_depth': 39, 'min_samples_split': 5, 'min_samples_leaf': 1, 'max_features': None, 'bootstrap': False, 'criterion': 'squared_error'}. Best is trial 317 with value: 0.29142632980121813.
[I 2024-12-04 11:59:30,060] Trial 294 finished with value: 0.3391027766231745 and parameters: {'n_estimators': 402, 'max_depth': 43, 'min_samples_split': 2, 'min_samples_leaf': 1, 'max_features': 'sqrt', 'bootstrap': True, 'criterion': 'absolute_error'}. Best is trial 317 with value: 0.29142632980121813.
[I 2024-12-04 11:59:33,680] Trial 307 finished with value: 0.3095569234380103 and parameters: {'n_estimators': 310, 'max_depth': 48, 'min_samples_split': 2, 'min_samples_leaf': 1, 'max_features': 'sqrt', 'bootstrap': False, 'criterion': 'absolute_error'}. Best is trial 317 with value: 0.29142632980121813.
[I 2024-12-04 11:59:34,861] Trial 324 finished with value: 0.3001232437137748 and parameters: {'n_estimators': 185, 'max_depth': 50, 'min_samples_split': 4, 'min_samples_leaf': 1, 'max_features': 'sqrt', 'bootstrap': False, 'criterion': 'squared_error'}. Best is trial 317 with value: 0.29142632980121813.
[I 2024-12-04 11:59:35,125] Trial 277 finished with value: 0.6178616652203381 and parameters: {'n_estimators': 909, 'max_depth': 13, 'min_samples_split': 27, 'min_samples_leaf': 1, 'max_features': 'sqrt', 'bootstrap': True, 'criterion': 'absolute_error'}. Best is trial 317 with value: 0.29142632980121813.
[I 2024-12-04 11:59:35,500] Trial 323 finished with value: 0.81359541564645 and parameters: {'n_estimators': 248, 'max_depth': 27, 'min_samples_split': 2, 'min_samples_leaf': 3, 'max_features': 'log2', 'bootstrap': False, 'criterion': 'absolute_error'}. Best is trial 317 with value: 0.29142632980121813.
[I 2024-12-04 11:59:36,733] Trial 329 finished with value: 0.31465713740837786 and parameters: {'n_estimators': 197, 'max_depth': 41, 'min_samples_split': 4, 'min_samples_leaf': 1, 'max_features': 'sqrt', 'bootstrap': False, 'criterion': 'squared_error'}. Best is trial 317 with value: 0.29142632980121813.
[I 2024-12-04 11:59:37,458] Trial 321 finished with value: 0.2997162211532984 and parameters: {'n_estimators': 252, 'max_depth': 50, 'min_samples_split': 2, 'min_samples_leaf': 1, 'max_features': 'sqrt', 'bootstrap': False, 'criterion': 'squared_error'}. Best is trial 317 with value: 0.29142632980121813.
[I 2024-12-04 11:59:37,991] Trial 332 finished with value: 0.29795334621240466 and parameters: {'n_estimators': 126, 'max_depth': 48, 'min_samples_split': 4, 'min_samples_leaf': 1, 'max_features': 'sqrt', 'bootstrap': False, 'criterion': 'squared_error'}. Best is trial 317 with value: 0.29142632980121813.
[I 2024-12-04 11:59:39,918] Trial 326 finished with value: 0.4305852065632022 and parameters: {'n_estimators': 374, 'max_depth': 40, 'min_samples_split': 2, 'min_samples_leaf': 1, 'max_features': 'log2', 'bootstrap': False, 'criterion': 'squared_error'}. Best is trial 317 with value: 0.29142632980121813.
[I 2024-12-04 11:59:40,302] Trial 305 finished with value: 0.3229531865526312 and parameters: {'n_estimators': 455, 'max_depth': 47, 'min_samples_split': 6, 'min_samples_leaf': 1, 'max_features': 'sqrt', 'bootstrap': False, 'criterion': 'absolute_error'}. Best is trial 317 with value: 0.29142632980121813.
[I 2024-12-04 11:59:40,303] Trial 328 finished with value: 0.4436552718143113 and parameters: {'n_estimators': 357, 'max_depth': 44, 'min_samples_split': 3, 'min_samples_leaf': 2, 'max_features': 'sqrt', 'bootstrap': False, 'criterion': 'squared_error'}. Best is trial 317 with value: 0.29142632980121813.
[I 2024-12-04 11:59:42,128] Trial 327 finished with value: 0.3093830779086948 and parameters: {'n_estimators': 312, 'max_depth': 42, 'min_samples_split': 4, 'min_samples_leaf': 1, 'max_features': 'sqrt', 'bootstrap': False, 'criterion': 'squared_error'}. Best is trial 317 with value: 0.29142632980121813.
[I 2024-12-04 11:59:43,524] Trial 334 finished with value: 0.44645473955381365 and parameters: {'n_estimators': 299, 'max_depth': 40, 'min_samples_split': 5, 'min_samples_leaf': 2, 'max_features': 'sqrt', 'bootstrap': False, 'criterion': 'squared_error'}. Best is trial 317 with value: 0.29142632980121813.
[I 2024-12-04 11:59:44,052] Trial 330 finished with value: 0.35105651992415715 and parameters: {'n_estimators': 234, 'max_depth': 27, 'min_samples_split': 16, 'min_samples_leaf': 1, 'max_features': None, 'bootstrap': True, 'criterion': 'squared_error'}. Best is trial 317 with value: 0.29142632980121813.
[I 2024-12-04 11:59:45,379] Trial 331 finished with value: 0.29515636531024125 and parameters: {'n_estimators': 326, 'max_depth': 50, 'min_samples_split': 3, 'min_samples_leaf': 1, 'max_features': 'sqrt', 'bootstrap': False, 'criterion': 'squared_error'}. Best is trial 317 with value: 0.29142632980121813.
[I 2024-12-04 11:59:45,854] Trial 268 finished with value: 0.38274970770862604 and parameters: {'n_estimators': 597, 'max_depth': 33, 'min_samples_split': 2, 'min_samples_leaf': 3, 'max_features': None, 'bootstrap': True, 'criterion': 'absolute_error'}. Best is trial 317 with value: 0.29142632980121813.
[I 2024-12-04 11:59:47,718] Trial 340 finished with value: 0.2999603564242762 and parameters: {'n_estimators': 278, 'max_depth': 50, 'min_samples_split': 4, 'min_samples_leaf': 1, 'max_features': 'sqrt', 'bootstrap': False, 'criterion': 'squared_error'}. Best is trial 317 with value: 0.29142632980121813.
[I 2024-12-04 11:59:48,528] Trial 344 finished with value: 0.37810978974149784 and parameters: {'n_estimators': 184, 'max_depth': 50, 'min_samples_split': 3, 'min_samples_leaf': 1, 'max_features': 'log2', 'bootstrap': False, 'criterion': 'squared_error'}. Best is trial 317 with value: 0.29142632980121813.
[I 2024-12-04 11:59:48,568] Trial 335 finished with value: 0.29348771919201194 and parameters: {'n_estimators': 273, 'max_depth': 49, 'min_samples_split': 3, 'min_samples_leaf': 1, 'max_features': 'sqrt', 'bootstrap': False, 'criterion': 'squared_error'}. Best is trial 317 with value: 0.29142632980121813.
[I 2024-12-04 11:59:48,902] Trial 337 finished with value: 0.30267919876972443 and parameters: {'n_estimators': 349, 'max_depth': 42, 'min_samples_split': 3, 'min_samples_leaf': 1, 'max_features': 'sqrt', 'bootstrap': False, 'criterion': 'squared_error'}. Best is trial 317 with value: 0.29142632980121813.
[I 2024-12-04 11:59:50,882] Trial 341 finished with value: 0.2909369124469028 and parameters: {'n_estimators': 167, 'max_depth': 48, 'min_samples_split': 3, 'min_samples_leaf': 1, 'max_features': 'sqrt', 'bootstrap': False, 'criterion': 'squared_error'}. Best is trial 341 with value: 0.2909369124469028.
[I 2024-12-04 11:59:51,443] Trial 342 finished with value: 0.30403498719888217 and parameters: {'n_estimators': 494, 'max_depth': 50, 'min_samples_split': 5, 'min_samples_leaf': 1, 'max_features': 'sqrt', 'bootstrap': False, 'criterion': 'squared_error'}. Best is trial 341 with value: 0.2909369124469028.
[I 2024-12-04 11:59:51,720] Trial 343 finished with value: 0.30358984135273487 and parameters: {'n_estimators': 203, 'max_depth': 41, 'min_samples_split': 3, 'min_samples_leaf': 1, 'max_features': 'sqrt', 'bootstrap': False, 'criterion': 'squared_error'}. Best is trial 341 with value: 0.2909369124469028.
[I 2024-12-04 11:59:52,684] Trial 338 finished with value: 0.5147480766218246 and parameters: {'n_estimators': 218, 'max_depth': 43, 'min_samples_split': 37, 'min_samples_leaf': 1, 'max_features': 'log2', 'bootstrap': False, 'criterion': 'absolute_error'}. Best is trial 341 with value: 0.2909369124469028.
[I 2024-12-04 11:59:52,693] Trial 336 finished with value: 0.32557709293888776 and parameters: {'n_estimators': 216, 'max_depth': 48, 'min_samples_split': 3, 'min_samples_leaf': 1, 'max_features': None, 'bootstrap': True, 'criterion': 'squared_error'}. Best is trial 341 with value: 0.2909369124469028.
[I 2024-12-04 11:59:52,770] Trial 349 finished with value: 0.29210051890540173 and parameters: {'n_estimators': 236, 'max_depth': 48, 'min_samples_split': 3, 'min_samples_leaf': 1, 'max_features': 'sqrt', 'bootstrap': False, 'criterion': 'squared_error'}. Best is trial 341 with value: 0.2909369124469028.
[I 2024-12-04 11:59:53,820] Trial 348 finished with value: 0.5039521647340238 and parameters: {'n_estimators': 149, 'max_depth': 6, 'min_samples_split': 8, 'min_samples_leaf': 8, 'max_features': None, 'bootstrap': False, 'criterion': 'squared_error'}. Best is trial 341 with value: 0.2909369124469028.
[I 2024-12-04 11:59:54,090] Trial 346 finished with value: 0.2926559572848722 and parameters: {'n_estimators': 218, 'max_depth': 49, 'min_samples_split': 3, 'min_samples_leaf': 1, 'max_features': 'sqrt', 'bootstrap': False, 'criterion': 'squared_error'}. Best is trial 341 with value: 0.2909369124469028.
[I 2024-12-04 11:59:55,750] Trial 345 finished with value: 0.2942165853080455 and parameters: {'n_estimators': 405, 'max_depth': 50, 'min_samples_split': 3, 'min_samples_leaf': 1, 'max_features': 'sqrt', 'bootstrap': False, 'criterion': 'squared_error'}. Best is trial 341 with value: 0.2909369124469028.
[I 2024-12-04 11:59:57,667] Trial 355 finished with value: 0.29240503412542357 and parameters: {'n_estimators': 163, 'max_depth': 49, 'min_samples_split': 3, 'min_samples_leaf': 1, 'max_features': 'sqrt', 'bootstrap': False, 'criterion': 'squared_error'}. Best is trial 341 with value: 0.2909369124469028.
[I 2024-12-04 11:59:59,023] Trial 351 finished with value: 0.31078343793528485 and parameters: {'n_estimators': 270, 'max_depth': 41, 'min_samples_split': 2, 'min_samples_leaf': 1, 'max_features': 'sqrt', 'bootstrap': False, 'criterion': 'squared_error'}. Best is trial 341 with value: 0.2909369124469028.
[I 2024-12-04 11:59:59,292] Trial 347 finished with value: 0.2915121987724969 and parameters: {'n_estimators': 195, 'max_depth': 48, 'min_samples_split': 3, 'min_samples_leaf': 1, 'max_features': 'sqrt', 'bootstrap': False, 'criterion': 'squared_error'}. Best is trial 341 with value: 0.2909369124469028.
[I 2024-12-04 12:00:01,379] Trial 354 finished with value: 0.3498321144681663 and parameters: {'n_estimators': 165, 'max_depth': 37, 'min_samples_split': 4, 'min_samples_leaf': 1, 'max_features': 'sqrt', 'bootstrap': True, 'criterion': 'squared_error'}. Best is trial 341 with value: 0.2909369124469028.
[I 2024-12-04 12:00:04,851] Trial 359 finished with value: 0.6040884043272502 and parameters: {'n_estimators': 374, 'max_depth': 47, 'min_samples_split': 18, 'min_samples_leaf': 5, 'max_features': 'sqrt', 'bootstrap': False, 'criterion': 'squared_error'}. Best is trial 341 with value: 0.2909369124469028.
[I 2024-12-04 12:00:04,943] Trial 310 finished with value: 0.503683883643175 and parameters: {'n_estimators': 940, 'max_depth': 49, 'min_samples_split': 17, 'min_samples_leaf': 2, 'max_features': 'sqrt', 'bootstrap': True, 'criterion': 'absolute_error'}. Best is trial 341 with value: 0.2909369124469028.
[I 2024-12-04 12:00:05,263] Trial 356 finished with value: 0.4352802804065673 and parameters: {'n_estimators': 143, 'max_depth': 48, 'min_samples_split': 6, 'min_samples_leaf': 1, 'max_features': 'log2', 'bootstrap': True, 'criterion': 'absolute_error'}. Best is trial 341 with value: 0.2909369124469028.
[I 2024-12-04 12:00:05,647] Trial 358 finished with value: 0.3086615490565916 and parameters: {'n_estimators': 116, 'max_depth': 44, 'min_samples_split': 4, 'min_samples_leaf': 1, 'max_features': 'sqrt', 'bootstrap': False, 'criterion': 'squared_error'}. Best is trial 341 with value: 0.2909369124469028.
[I 2024-12-04 12:00:06,906] Trial 357 finished with value: 0.4492159638535802 and parameters: {'n_estimators': 139, 'max_depth': 42, 'min_samples_split': 4, 'min_samples_leaf': 2, 'max_features': 'sqrt', 'bootstrap': False, 'criterion': 'squared_error'}. Best is trial 341 with value: 0.2909369124469028.
[I 2024-12-04 12:00:07,170] Trial 365 finished with value: 0.29780377027751437 and parameters: {'n_estimators': 126, 'max_depth': 46, 'min_samples_split': 3, 'min_samples_leaf': 1, 'max_features': 'sqrt', 'bootstrap': False, 'criterion': 'squared_error'}. Best is trial 341 with value: 0.2909369124469028.
[I 2024-12-04 12:00:08,969] Trial 364 finished with value: 0.2979463008700916 and parameters: {'n_estimators': 193, 'max_depth': 50, 'min_samples_split': 2, 'min_samples_leaf': 1, 'max_features': 'sqrt', 'bootstrap': False, 'criterion': 'squared_error'}. Best is trial 341 with value: 0.2909369124469028.
[I 2024-12-04 12:00:08,978] Trial 350 finished with value: 0.456768743256899 and parameters: {'n_estimators': 140, 'max_depth': 8, 'min_samples_split': 39, 'min_samples_leaf': 1, 'max_features': None, 'bootstrap': True, 'criterion': 'absolute_error'}. Best is trial 341 with value: 0.2909369124469028.
[I 2024-12-04 12:00:09,878] Trial 361 finished with value: 0.2964474969692011 and parameters: {'n_estimators': 158, 'max_depth': 48, 'min_samples_split': 4, 'min_samples_leaf': 1, 'max_features': 'sqrt', 'bootstrap': False, 'criterion': 'squared_error'}. Best is trial 341 with value: 0.2909369124469028.
[I 2024-12-04 12:00:10,049] Trial 353 finished with value: 0.5744869986086601 and parameters: {'n_estimators': 953, 'max_depth': 25, 'min_samples_split': 29, 'min_samples_leaf': 3, 'max_features': 'sqrt', 'bootstrap': True, 'criterion': 'squared_error'}. Best is trial 341 with value: 0.2909369124469028.
[I 2024-12-04 12:00:10,714] Trial 363 finished with value: 0.3014074316518756 and parameters: {'n_estimators': 144, 'max_depth': 44, 'min_samples_split': 3, 'min_samples_leaf': 1, 'max_features': 'sqrt', 'bootstrap': False, 'criterion': 'squared_error'}. Best is trial 341 with value: 0.2909369124469028.
[I 2024-12-04 12:00:14,181] Trial 371 finished with value: 0.29824719282224554 and parameters: {'n_estimators': 167, 'max_depth': 50, 'min_samples_split': 4, 'min_samples_leaf': 1, 'max_features': 'sqrt', 'bootstrap': False, 'criterion': 'squared_error'}. Best is trial 341 with value: 0.2909369124469028.
[I 2024-12-04 12:00:14,182] Trial 367 finished with value: 0.8315500457743727 and parameters: {'n_estimators': 146, 'max_depth': 17, 'min_samples_split': 3, 'min_samples_leaf': 8, 'max_features': 'sqrt', 'bootstrap': True, 'criterion': 'squared_error'}. Best is trial 341 with value: 0.2909369124469028.
[I 2024-12-04 12:00:16,515] Trial 201 finished with value: 0.43358166329292214 and parameters: {'n_estimators': 560, 'max_depth': 48, 'min_samples_split': 3, 'min_samples_leaf': 1, 'max_features': None, 'bootstrap': False, 'criterion': 'absolute_error'}. Best is trial 341 with value: 0.2909369124469028.
