[I 2024-12-04 14:52:46,448] Trial 458 finished with value: 0.4898033143498269 and parameters: {'n_estimators': 1459, 'learning_rate': 0.03235520739144421, 'max_depth': 12, 'min_samples_split': 16, 'min_samples_leaf': 1, 'subsample': 0.8861100720184962, 'max_features': None}. Best is trial 419 with value: 0.4620957934013452.
[I 2024-12-04 14:52:51,304] Trial 484 finished with value: 0.48520612439977717 and parameters: {'n_estimators': 561, 'learning_rate': 0.06413451564515438, 'max_depth': 12, 'min_samples_split': 19, 'min_samples_leaf': 1, 'subsample': 0.9344600934163652, 'max_features': None}. Best is trial 419 with value: 0.4620957934013452.
[I 2024-12-04 14:52:54,192] Trial 498 finished with value: 0.7420483012793646 and parameters: {'n_estimators': 347, 'learning_rate': 0.09941472701569294, 'max_depth': 4, 'min_samples_split': 19, 'min_samples_leaf': 7, 'subsample': 0.9738010914762687, 'max_features': 'log2'}. Best is trial 419 with value: 0.4620957934013452.
[I 2024-12-04 14:52:55,142] Trial 483 finished with value: 0.5390978971100682 and parameters: {'n_estimators': 766, 'learning_rate': 0.050280237538138824, 'max_depth': 12, 'min_samples_split': 14, 'min_samples_leaf': 1, 'subsample': 0.9648329259659908, 'max_features': 'log2'}. Best is trial 419 with value: 0.4620957934013452.
[I 2024-12-04 14:52:57,176] Trial 473 finished with value: 0.7367382668467067 and parameters: {'n_estimators': 1243, 'learning_rate': 0.019927488428781698, 'max_depth': 11, 'min_samples_split': 19, 'min_samples_leaf': 7, 'subsample': 0.6579191857337261, 'max_features': 'sqrt'}. Best is trial 419 with value: 0.4620957934013452.
[I 2024-12-04 14:52:57,653] Trial 495 finished with value: 0.7415214284066901 and parameters: {'n_estimators': 549, 'learning_rate': 0.09320015676196584, 'max_depth': 4, 'min_samples_split': 18, 'min_samples_leaf': 7, 'subsample': 0.7397051813202791, 'max_features': 'sqrt'}. Best is trial 419 with value: 0.4620957934013452.
[I 2024-12-04 14:52:59,044] Trial 487 finished with value: 0.6656066125248941 and parameters: {'n_estimators': 835, 'learning_rate': 0.05109985064144108, 'max_depth': 9, 'min_samples_split': 18, 'min_samples_leaf': 2, 'subsample': 0.7970905806350983, 'max_features': 'sqrt'}. Best is trial 419 with value: 0.4620957934013452.
[I 2024-12-04 14:53:00,231] Trial 471 finished with value: 0.6248407744308407 and parameters: {'n_estimators': 1289, 'learning_rate': 0.018613883447000563, 'max_depth': 12, 'min_samples_split': 17, 'min_samples_leaf': 3, 'subsample': 0.7801042827391957, 'max_features': None}. Best is trial 419 with value: 0.4620957934013452.
[I 2024-12-04 14:53:02,401] Trial 469 finished with value: 0.5921939334506325 and parameters: {'n_estimators': 1449, 'learning_rate': 0.011650295325320716, 'max_depth': 10, 'min_samples_split': 9, 'min_samples_leaf': 6, 'subsample': 0.85314674348895, 'max_features': None}. Best is trial 419 with value: 0.4620957934013452.
[I 2024-12-04 14:53:04,071] Trial 482 finished with value: 0.7014339073116831 and parameters: {'n_estimators': 1121, 'learning_rate': 0.013235697267924083, 'max_depth': 10, 'min_samples_split': 2, 'min_samples_leaf': 7, 'subsample': 0.9783973524310058, 'max_features': 'sqrt'}. Best is trial 419 with value: 0.4620957934013452.
[I 2024-12-04 14:53:04,113] Trial 474 finished with value: 0.649717811044595 and parameters: {'n_estimators': 1454, 'learning_rate': 0.019401925242870693, 'max_depth': 12, 'min_samples_split': 16, 'min_samples_leaf': 2, 'subsample': 0.7967683436030774, 'max_features': 'sqrt'}. Best is trial 419 with value: 0.4620957934013452.
[I 2024-12-04 14:53:05,082] Trial 472 finished with value: 0.6107809544096295 and parameters: {'n_estimators': 1454, 'learning_rate': 0.0221505231581076, 'max_depth': 11, 'min_samples_split': 18, 'min_samples_leaf': 2, 'subsample': 0.9316095540954811, 'max_features': None}. Best is trial 419 with value: 0.4620957934013452.
[I 2024-12-04 14:53:06,273] Trial 489 finished with value: 0.4958049621384941 and parameters: {'n_estimators': 908, 'learning_rate': 0.06353276728626443, 'max_depth': 11, 'min_samples_split': 18, 'min_samples_leaf': 1, 'subsample': 0.8685260392326778, 'max_features': None}. Best is trial 419 with value: 0.4620957934013452.
[I 2024-12-04 14:53:06,292] Trial 479 finished with value: 0.4983270644672048 and parameters: {'n_estimators': 1204, 'learning_rate': 0.040458630021273985, 'max_depth': 8, 'min_samples_split': 19, 'min_samples_leaf': 1, 'subsample': 0.8295479628287225, 'max_features': None}. Best is trial 419 with value: 0.4620957934013452.
[I 2024-12-04 14:53:07,063] Trial 488 finished with value: 0.6277577117776865 and parameters: {'n_estimators': 972, 'learning_rate': 0.05008537014703894, 'max_depth': 11, 'min_samples_split': 19, 'min_samples_leaf': 3, 'subsample': 0.8957782193122533, 'max_features': None}. Best is trial 419 with value: 0.4620957934013452.
[I 2024-12-04 14:53:08,820] Trial 507 finished with value: 1.026351794777979 and parameters: {'n_estimators': 315, 'learning_rate': 0.010252727652512486, 'max_depth': 8, 'min_samples_split': 4, 'min_samples_leaf': 2, 'subsample': 0.7168561167836915, 'max_features': 'log2'}. Best is trial 419 with value: 0.4620957934013452.
[I 2024-12-04 14:53:09,450] Trial 470 finished with value: 0.644843506030993 and parameters: {'n_estimators': 1327, 'learning_rate': 0.04859062600248581, 'max_depth': 12, 'min_samples_split': 20, 'min_samples_leaf': 2, 'subsample': 0.9628595351313506, 'max_features': None}. Best is trial 419 with value: 0.4620957934013452.
[I 2024-12-04 14:53:10,042] Trial 490 finished with value: 0.597388846911606 and parameters: {'n_estimators': 1085, 'learning_rate': 0.04814392718766662, 'max_depth': 10, 'min_samples_split': 19, 'min_samples_leaf': 1, 'subsample': 0.8922662598538325, 'max_features': 'log2'}. Best is trial 419 with value: 0.4620957934013452.
[I 2024-12-04 14:53:10,052] Trial 475 finished with value: 0.5804584988782568 and parameters: {'n_estimators': 1447, 'learning_rate': 0.026972801357567033, 'max_depth': 4, 'min_samples_split': 6, 'min_samples_leaf': 5, 'subsample': 0.9394697748404071, 'max_features': None}. Best is trial 419 with value: 0.4620957934013452.
[I 2024-12-04 14:53:10,682] Trial 493 finished with value: 0.9276080794872488 and parameters: {'n_estimators': 1075, 'learning_rate': 0.021513338521116056, 'max_depth': 4, 'min_samples_split': 14, 'min_samples_leaf': 10, 'subsample': 0.9095329972419203, 'max_features': 'log2'}. Best is trial 419 with value: 0.4620957934013452.
[I 2024-12-04 14:53:11,478] Trial 480 finished with value: 0.6280588464642417 and parameters: {'n_estimators': 1345, 'learning_rate': 0.027898995893849355, 'max_depth': 12, 'min_samples_split': 19, 'min_samples_leaf': 2, 'subsample': 0.9448548807013842, 'max_features': 'sqrt'}. Best is trial 419 with value: 0.4620957934013452.
[I 2024-12-04 14:53:12,873] Trial 496 finished with value: 0.4789156440272462 and parameters: {'n_estimators': 878, 'learning_rate': 0.0893037667297672, 'max_depth': 12, 'min_samples_split': 20, 'min_samples_leaf': 1, 'subsample': 0.9660969762960016, 'max_features': None}. Best is trial 419 with value: 0.4620957934013452.
[I 2024-12-04 14:53:13,717] Trial 491 finished with value: 0.4917701634735371 and parameters: {'n_estimators': 1024, 'learning_rate': 0.02862188616944149, 'max_depth': 12, 'min_samples_split': 20, 'min_samples_leaf': 1, 'subsample': 0.8346420919068601, 'max_features': None}. Best is trial 419 with value: 0.4620957934013452.
[I 2024-12-04 14:53:14,931] Trial 505 finished with value: 0.9216568577284606 and parameters: {'n_estimators': 671, 'learning_rate': 0.013779672498691354, 'max_depth': 7, 'min_samples_split': 7, 'min_samples_leaf': 9, 'subsample': 0.6141453200867234, 'max_features': 'sqrt'}. Best is trial 419 with value: 0.4620957934013452.
[I 2024-12-04 14:53:14,932] Trial 513 finished with value: 1.088222139772185 and parameters: {'n_estimators': 256, 'learning_rate': 0.020939100887188533, 'max_depth': 8, 'min_samples_split': 2, 'min_samples_leaf': 6, 'subsample': 0.7164218608991862, 'max_features': 'log2'}. Best is trial 419 with value: 0.4620957934013452.
[I 2024-12-04 14:53:16,937] Trial 477 finished with value: 0.49494525109042964 and parameters: {'n_estimators': 1439, 'learning_rate': 0.014304911192029354, 'max_depth': 10, 'min_samples_split': 17, 'min_samples_leaf': 1, 'subsample': 0.8584246196459058, 'max_features': None}. Best is trial 419 with value: 0.4620957934013452.
[I 2024-12-04 14:53:18,826] Trial 494 finished with value: 0.5022906113653623 and parameters: {'n_estimators': 1143, 'learning_rate': 0.06250495578228302, 'max_depth': 10, 'min_samples_split': 19, 'min_samples_leaf': 1, 'subsample': 0.8937926156009532, 'max_features': None}. Best is trial 419 with value: 0.4620957934013452.
[I 2024-12-04 14:53:19,474] Trial 522 finished with value: 0.5827176277957079 and parameters: {'n_estimators': 137, 'learning_rate': 0.07980832006395434, 'max_depth': 12, 'min_samples_split': 20, 'min_samples_leaf': 3, 'subsample': 0.9267269630711876, 'max_features': None}. Best is trial 419 with value: 0.4620957934013452.
[I 2024-12-04 14:53:20,426] Trial 478 finished with value: 0.49202484114423567 and parameters: {'n_estimators': 1491, 'learning_rate': 0.02362984371373444, 'max_depth': 12, 'min_samples_split': 18, 'min_samples_leaf': 1, 'subsample': 0.8276876722048205, 'max_features': None}. Best is trial 419 with value: 0.4620957934013452.
[I 2024-12-04 14:53:21,041] Trial 502 finished with value: 0.4850733846769178 and parameters: {'n_estimators': 1036, 'learning_rate': 0.048212633900934436, 'max_depth': 10, 'min_samples_split': 17, 'min_samples_leaf': 1, 'subsample': 0.930001471215852, 'max_features': None}. Best is trial 419 with value: 0.4620957934013452.
[I 2024-12-04 14:53:21,051] Trial 486 finished with value: 0.48381489490288154 and parameters: {'n_estimators': 1391, 'learning_rate': 0.053038504998878785, 'max_depth': 9, 'min_samples_split': 20, 'min_samples_leaf': 1, 'subsample': 0.9904606083109015, 'max_features': None}. Best is trial 419 with value: 0.4620957934013452.
[I 2024-12-04 14:53:21,449] Trial 485 finished with value: 0.4791081238789783 and parameters: {'n_estimators': 1332, 'learning_rate': 0.022426666530304496, 'max_depth': 12, 'min_samples_split': 18, 'min_samples_leaf': 1, 'subsample': 0.9137299135688016, 'max_features': None}. Best is trial 419 with value: 0.4620957934013452.
[I 2024-12-04 14:53:23,885] Trial 501 finished with value: 0.6697764812692137 and parameters: {'n_estimators': 1407, 'learning_rate': 0.015563809291387945, 'max_depth': 12, 'min_samples_split': 16, 'min_samples_leaf': 3, 'subsample': 0.9766187586350673, 'max_features': 'log2'}. Best is trial 419 with value: 0.4620957934013452.
[I 2024-12-04 14:53:24,120] Trial 499 finished with value: 0.4850099582840883 and parameters: {'n_estimators': 1153, 'learning_rate': 0.053477916602514976, 'max_depth': 12, 'min_samples_split': 20, 'min_samples_leaf': 1, 'subsample': 0.9798919646063982, 'max_features': None}. Best is trial 419 with value: 0.4620957934013452.
[I 2024-12-04 14:53:25,018] Trial 519 finished with value: 0.5046197569461006 and parameters: {'n_estimators': 293, 'learning_rate': 0.06085489375767476, 'max_depth': 12, 'min_samples_split': 20, 'min_samples_leaf': 1, 'subsample': 0.9869259799434114, 'max_features': None}. Best is trial 419 with value: 0.4620957934013452.
[I 2024-12-04 14:53:26,818] Trial 526 finished with value: 1.0140160698634686 and parameters: {'n_estimators': 271, 'learning_rate': 0.013496231118736669, 'max_depth': 7, 'min_samples_split': 15, 'min_samples_leaf': 9, 'subsample': 0.945232978051748, 'max_features': 'sqrt'}. Best is trial 419 with value: 0.4620957934013452.
[I 2024-12-04 14:53:27,279] Trial 492 finished with value: 0.584163153611579 and parameters: {'n_estimators': 1450, 'learning_rate': 0.014405990069493658, 'max_depth': 12, 'min_samples_split': 20, 'min_samples_leaf': 2, 'subsample': 0.9369071485927565, 'max_features': None}. Best is trial 419 with value: 0.4620957934013452.
[I 2024-12-04 14:53:28,651] Trial 512 finished with value: 0.6251885801813837 and parameters: {'n_estimators': 636, 'learning_rate': 0.07520457177889903, 'max_depth': 12, 'min_samples_split': 17, 'min_samples_leaf': 4, 'subsample': 0.9830324763832563, 'max_features': None}. Best is trial 419 with value: 0.4620957934013452.
[I 2024-12-04 14:53:31,208] Trial 497 finished with value: 0.49045473992028477 and parameters: {'n_estimators': 1449, 'learning_rate': 0.014010045828195176, 'max_depth': 12, 'min_samples_split': 18, 'min_samples_leaf': 1, 'subsample': 0.9222876233348933, 'max_features': None}. Best is trial 419 with value: 0.4620957934013452.
[I 2024-12-04 14:53:32,554] Trial 510 finished with value: 0.4734679266429056 and parameters: {'n_estimators': 858, 'learning_rate': 0.063272464323578, 'max_depth': 12, 'min_samples_split': 20, 'min_samples_leaf': 1, 'subsample': 0.9144945199325047, 'max_features': None}. Best is trial 419 with value: 0.4620957934013452.
[I 2024-12-04 14:53:33,729] Trial 500 finished with value: 0.519203086558697 and parameters: {'n_estimators': 1425, 'learning_rate': 0.016516467886013235, 'max_depth': 11, 'min_samples_split': 13, 'min_samples_leaf': 1, 'subsample': 0.9619145359668052, 'max_features': None}. Best is trial 419 with value: 0.4620957934013452.
[I 2024-12-04 14:53:35,284] Trial 508 finished with value: 0.8081064187091073 and parameters: {'n_estimators': 1407, 'learning_rate': 0.08202955629947102, 'max_depth': 7, 'min_samples_split': 14, 'min_samples_leaf': 9, 'subsample': 0.9344009073762907, 'max_features': 'sqrt'}. Best is trial 419 with value: 0.4620957934013452.
[I 2024-12-04 14:53:35,296] Trial 517 finished with value: 0.6347376330978195 and parameters: {'n_estimators': 728, 'learning_rate': 0.05189722223670293, 'max_depth': 12, 'min_samples_split': 20, 'min_samples_leaf': 3, 'subsample': 0.8565767717482976, 'max_features': None}. Best is trial 419 with value: 0.4620957934013452.
[I 2024-12-04 14:53:36,768] Trial 515 finished with value: 0.48223759213887124 and parameters: {'n_estimators': 815, 'learning_rate': 0.05340503305069049, 'max_depth': 12, 'min_samples_split': 19, 'min_samples_leaf': 1, 'subsample': 0.9317659528841029, 'max_features': None}. Best is trial 419 with value: 0.4620957934013452.
[I 2024-12-04 14:53:38,617] Trial 525 finished with value: 0.6224993672689446 and parameters: {'n_estimators': 582, 'learning_rate': 0.08092832662945394, 'max_depth': 12, 'min_samples_split': 20, 'min_samples_leaf': 2, 'subsample': 0.911913479769198, 'max_features': None}. Best is trial 419 with value: 0.4620957934013452.
[I 2024-12-04 14:53:40,696] Trial 503 finished with value: 0.5987731535036259 and parameters: {'n_estimators': 1486, 'learning_rate': 0.02477249305880304, 'max_depth': 12, 'min_samples_split': 20, 'min_samples_leaf': 2, 'subsample': 0.9567678714661226, 'max_features': None}. Best is trial 419 with value: 0.4620957934013452.
[I 2024-12-04 14:53:41,879] Trial 506 finished with value: 0.5078431827818136 and parameters: {'n_estimators': 1299, 'learning_rate': 0.019386812948850342, 'max_depth': 11, 'min_samples_split': 16, 'min_samples_leaf': 1, 'subsample': 0.982002169498717, 'max_features': None}. Best is trial 419 with value: 0.4620957934013452.
[I 2024-12-04 14:53:42,303] Trial 545 finished with value: 0.9994372046839232 and parameters: {'n_estimators': 177, 'learning_rate': 0.05173821027121994, 'max_depth': 11, 'min_samples_split': 4, 'min_samples_leaf': 6, 'subsample': 0.8516503225244741, 'max_features': 'log2'}. Best is trial 419 with value: 0.4620957934013452.
[I 2024-12-04 14:53:42,433] Trial 504 finished with value: 0.5177113089922278 and parameters: {'n_estimators': 1406, 'learning_rate': 0.031595668569364126, 'max_depth': 10, 'min_samples_split': 15, 'min_samples_leaf': 1, 'subsample': 0.9847477365092309, 'max_features': None}. Best is trial 419 with value: 0.4620957934013452.
[I 2024-12-04 14:53:42,622] Trial 539 finished with value: 0.48923845345524053 and parameters: {'n_estimators': 387, 'learning_rate': 0.07545386384589371, 'max_depth': 12, 'min_samples_split': 19, 'min_samples_leaf': 1, 'subsample': 0.9577996562877296, 'max_features': None}. Best is trial 419 with value: 0.4620957934013452.
[I 2024-12-04 14:53:42,927] Trial 534 finished with value: 0.4897547171372159 and parameters: {'n_estimators': 519, 'learning_rate': 0.0900181698530035, 'max_depth': 9, 'min_samples_split': 20, 'min_samples_leaf': 1, 'subsample': 0.9917880826201599, 'max_features': None}. Best is trial 419 with value: 0.4620957934013452.
[I 2024-12-04 14:53:46,140] Trial 514 finished with value: 0.6094149760734219 and parameters: {'n_estimators': 1110, 'learning_rate': 0.03949391119287966, 'max_depth': 12, 'min_samples_split': 19, 'min_samples_leaf': 2, 'subsample': 0.903241779555691, 'max_features': None}. Best is trial 419 with value: 0.4620957934013452.
[I 2024-12-04 14:53:47,095] Trial 530 finished with value: 0.4924291424687943 and parameters: {'n_estimators': 718, 'learning_rate': 0.08635005818202633, 'max_depth': 12, 'min_samples_split': 16, 'min_samples_leaf': 1, 'subsample': 0.9068604594519173, 'max_features': None}. Best is trial 419 with value: 0.4620957934013452.
[I 2024-12-04 14:53:48,303] Trial 528 finished with value: 0.6136473945465853 and parameters: {'n_estimators': 819, 'learning_rate': 0.03909850910169409, 'max_depth': 12, 'min_samples_split': 17, 'min_samples_leaf': 3, 'subsample': 0.949626040895167, 'max_features': None}. Best is trial 419 with value: 0.4620957934013452.
[I 2024-12-04 14:53:48,372] Trial 521 finished with value: 0.6347751121160223 and parameters: {'n_estimators': 1011, 'learning_rate': 0.07803254413827114, 'max_depth': 12, 'min_samples_split': 20, 'min_samples_leaf': 4, 'subsample': 0.883214400623092, 'max_features': None}. Best is trial 419 with value: 0.4620957934013452.
[I 2024-12-04 14:53:49,445] Trial 527 finished with value: 0.6380664705027294 and parameters: {'n_estimators': 898, 'learning_rate': 0.0417390665090842, 'max_depth': 10, 'min_samples_split': 15, 'min_samples_leaf': 2, 'subsample': 0.8426233048280092, 'max_features': None}. Best is trial 419 with value: 0.4620957934013452.
[I 2024-12-04 14:53:50,449] Trial 531 finished with value: 0.49576061582813713 and parameters: {'n_estimators': 737, 'learning_rate': 0.048596274544950316, 'max_depth': 12, 'min_samples_split': 17, 'min_samples_leaf': 1, 'subsample': 0.8997493584654994, 'max_features': None}. Best is trial 419 with value: 0.4620957934013452.
[I 2024-12-04 14:53:50,475] Trial 509 finished with value: 0.5047228822328635 and parameters: {'n_estimators': 1442, 'learning_rate': 0.021811482654165115, 'max_depth': 12, 'min_samples_split': 15, 'min_samples_leaf': 1, 'subsample': 0.9549639620659821, 'max_features': None}. Best is trial 419 with value: 0.4620957934013452.
[I 2024-12-04 14:53:53,781] Trial 523 finished with value: 0.6225034774322318 and parameters: {'n_estimators': 1083, 'learning_rate': 0.07939411392934925, 'max_depth': 12, 'min_samples_split': 19, 'min_samples_leaf': 2, 'subsample': 0.9841129657195253, 'max_features': None}. Best is trial 419 with value: 0.4620957934013452.
[I 2024-12-04 14:53:54,009] Trial 529 finished with value: 0.6599489556505527 and parameters: {'n_estimators': 997, 'learning_rate': 0.09610047356702531, 'max_depth': 12, 'min_samples_split': 20, 'min_samples_leaf': 3, 'subsample': 0.9435485939424704, 'max_features': None}. Best is trial 419 with value: 0.4620957934013452.
[I 2024-12-04 14:53:54,620] Trial 532 finished with value: 0.4828656332221436 and parameters: {'n_estimators': 894, 'learning_rate': 0.07559851383136529, 'max_depth': 12, 'min_samples_split': 20, 'min_samples_leaf': 1, 'subsample': 0.9660161249231456, 'max_features': None}. Best is trial 419 with value: 0.4620957934013452.
[I 2024-12-04 14:53:54,734] Trial 520 finished with value: 0.49011576220738673 and parameters: {'n_estimators': 1126, 'learning_rate': 0.09525428103654902, 'max_depth': 11, 'min_samples_split': 17, 'min_samples_leaf': 1, 'subsample': 0.9813817566521529, 'max_features': None}. Best is trial 419 with value: 0.4620957934013452.
[I 2024-12-04 14:53:55,775] Trial 511 finished with value: 0.4907193614378444 and parameters: {'n_estimators': 1426, 'learning_rate': 0.019620594602199747, 'max_depth': 11, 'min_samples_split': 19, 'min_samples_leaf': 1, 'subsample': 0.9976594477436403, 'max_features': None}. Best is trial 419 with value: 0.4620957934013452.
[I 2024-12-04 14:53:55,940] Trial 524 finished with value: 0.7864989033814039 and parameters: {'n_estimators': 1428, 'learning_rate': 0.01156694189794682, 'max_depth': 8, 'min_samples_split': 16, 'min_samples_leaf': 10, 'subsample': 0.9603486515333601, 'max_features': 'sqrt'}. Best is trial 419 with value: 0.4620957934013452.
[I 2024-12-04 14:53:56,252] Trial 518 finished with value: 0.4937081127263646 and parameters: {'n_estimators': 1291, 'learning_rate': 0.018546867042414678, 'max_depth': 11, 'min_samples_split': 20, 'min_samples_leaf': 1, 'subsample': 0.8313436610152017, 'max_features': None}. Best is trial 419 with value: 0.4620957934013452.
[I 2024-12-04 14:53:56,677] Trial 537 finished with value: 0.5303461255515015 and parameters: {'n_estimators': 878, 'learning_rate': 0.08831612398958813, 'max_depth': 9, 'min_samples_split': 16, 'min_samples_leaf': 1, 'subsample': 0.8405792719659164, 'max_features': None}. Best is trial 419 with value: 0.4620957934013452.
[I 2024-12-04 14:53:58,681] Trial 540 finished with value: 0.47710248719720766 and parameters: {'n_estimators': 706, 'learning_rate': 0.05236473884052171, 'max_depth': 12, 'min_samples_split': 20, 'min_samples_leaf': 1, 'subsample': 0.9069752463190576, 'max_features': None}. Best is trial 419 with value: 0.4620957934013452.
