[I 2024-12-04 13:32:23,097] Trial 2001 finished with value: 0.3663744205234326 and parameters: {'n_estimators': 1170, 'learning_rate': 0.0882180398953762, 'max_depth': 8, 'min_samples_split': 6, 'min_samples_leaf': 3, 'subsample': 0.7705413377806682, 'max_features': 'sqrt'}. Best is trial 1389 with value: 0.22332552856343169.
[I 2024-12-04 13:32:23,104] Trial 2002 finished with value: 0.3634388419195031 and parameters: {'n_estimators': 1172, 'learning_rate': 0.07137110764667579, 'max_depth': 8, 'min_samples_split': 5, 'min_samples_leaf': 3, 'subsample': 0.8052561218348661, 'max_features': 'log2'}. Best is trial 1389 with value: 0.22332552856343169.
[I 2024-12-04 13:32:29,523] Trial 2021 finished with value: 0.6579174468792088 and parameters: {'n_estimators': 521, 'learning_rate': 0.06862271559538063, 'max_depth': 11, 'min_samples_split': 5, 'min_samples_leaf': 7, 'subsample': 0.6286326671423884, 'max_features': 'log2'}. Best is trial 1389 with value: 0.22332552856343169.
[I 2024-12-04 13:32:29,583] Trial 1997 finished with value: 0.2389938930396207 and parameters: {'n_estimators': 1457, 'learning_rate': 0.09705500460082164, 'max_depth': 9, 'min_samples_split': 9, 'min_samples_leaf': 1, 'subsample': 0.6648376348467981, 'max_features': 'sqrt'}. Best is trial 1389 with value: 0.22332552856343169.
[I 2024-12-04 13:32:32,833] Trial 1999 finished with value: 0.355881658735069 and parameters: {'n_estimators': 1415, 'learning_rate': 0.04181439052094874, 'max_depth': 6, 'min_samples_split': 2, 'min_samples_leaf': 3, 'subsample': 0.7562082720577339, 'max_features': 'sqrt'}. Best is trial 1389 with value: 0.22332552856343169.
[I 2024-12-04 13:32:34,882] Trial 2006 finished with value: 0.24278556443582663 and parameters: {'n_estimators': 1079, 'learning_rate': 0.0831584351652695, 'max_depth': 7, 'min_samples_split': 2, 'min_samples_leaf': 1, 'subsample': 0.8008539373301667, 'max_features': 'sqrt'}. Best is trial 1389 with value: 0.22332552856343169.
[I 2024-12-04 13:32:36,519] Trial 2003 finished with value: 0.27083488627467583 and parameters: {'n_estimators': 1278, 'learning_rate': 0.05975524191861507, 'max_depth': 12, 'min_samples_split': 6, 'min_samples_leaf': 1, 'subsample': 0.6731820474736396, 'max_features': 'sqrt'}. Best is trial 1389 with value: 0.22332552856343169.
[I 2024-12-04 13:32:38,557] Trial 2000 finished with value: 0.4585029152530694 and parameters: {'n_estimators': 1315, 'learning_rate': 0.05948698861843026, 'max_depth': 12, 'min_samples_split': 18, 'min_samples_leaf': 9, 'subsample': 0.7541708379100183, 'max_features': None}. Best is trial 1389 with value: 0.22332552856343169.
[I 2024-12-04 13:32:46,123] Trial 2005 finished with value: 0.24239526823851099 and parameters: {'n_estimators': 1323, 'learning_rate': 0.09838735284681456, 'max_depth': 7, 'min_samples_split': 4, 'min_samples_leaf': 1, 'subsample': 0.7340685660228115, 'max_features': 'sqrt'}. Best is trial 1389 with value: 0.22332552856343169.
[I 2024-12-04 13:32:52,555] Trial 2008 finished with value: 0.25355624790860926 and parameters: {'n_estimators': 1290, 'learning_rate': 0.03646858803102728, 'max_depth': 7, 'min_samples_split': 2, 'min_samples_leaf': 1, 'subsample': 0.8741549291039906, 'max_features': 'sqrt'}. Best is trial 1389 with value: 0.22332552856343169.
[I 2024-12-04 13:32:55,105] Trial 2014 finished with value: 0.29342825014811713 and parameters: {'n_estimators': 1144, 'learning_rate': 0.07047407256382722, 'max_depth': 7, 'min_samples_split': 2, 'min_samples_leaf': 2, 'subsample': 0.9420006758621498, 'max_features': 'sqrt'}. Best is trial 1389 with value: 0.22332552856343169.
[I 2024-12-04 13:32:59,255] Trial 2011 finished with value: 0.40195865122659014 and parameters: {'n_estimators': 1318, 'learning_rate': 0.041272606863624675, 'max_depth': 7, 'min_samples_split': 11, 'min_samples_leaf': 6, 'subsample': 0.6104046222547403, 'max_features': 'sqrt'}. Best is trial 1389 with value: 0.22332552856343169.
[I 2024-12-04 13:33:01,206] Trial 2020 finished with value: 0.32418254371699173 and parameters: {'n_estimators': 1065, 'learning_rate': 0.04388538449393372, 'max_depth': 10, 'min_samples_split': 3, 'min_samples_leaf': 2, 'subsample': 0.6498620016514445, 'max_features': 'log2'}. Best is trial 1389 with value: 0.22332552856343169.
[I 2024-12-04 13:33:02,388] Trial 2012 finished with value: 0.23760839059108393 and parameters: {'n_estimators': 1322, 'learning_rate': 0.09570884033866976, 'max_depth': 6, 'min_samples_split': 2, 'min_samples_leaf': 1, 'subsample': 0.9043956958819088, 'max_features': 'sqrt'}. Best is trial 1389 with value: 0.22332552856343169.
[I 2024-12-04 13:33:03,282] Trial 2037 finished with value: 0.4692755298355043 and parameters: {'n_estimators': 266, 'learning_rate': 0.05780309012716937, 'max_depth': 4, 'min_samples_split': 5, 'min_samples_leaf': 9, 'subsample': 0.9330635731738038, 'max_features': None}. Best is trial 1389 with value: 0.22332552856343169.
[I 2024-12-04 13:33:05,134] Trial 2023 finished with value: 0.4547904813374418 and parameters: {'n_estimators': 985, 'learning_rate': 0.010365833430014878, 'max_depth': 7, 'min_samples_split': 9, 'min_samples_leaf': 3, 'subsample': 0.8182319992715369, 'max_features': 'sqrt'}. Best is trial 1389 with value: 0.22332552856343169.
[I 2024-12-04 13:33:06,423] Trial 2015 finished with value: 0.23549937446673883 and parameters: {'n_estimators': 1253, 'learning_rate': 0.08684029834456833, 'max_depth': 10, 'min_samples_split': 3, 'min_samples_leaf': 1, 'subsample': 0.7330029178694796, 'max_features': 'sqrt'}. Best is trial 1389 with value: 0.22332552856343169.
[I 2024-12-04 13:33:06,431] Trial 2013 finished with value: 0.4362336416982807 and parameters: {'n_estimators': 1235, 'learning_rate': 0.09169656021769684, 'max_depth': 8, 'min_samples_split': 5, 'min_samples_leaf': 3, 'subsample': 0.9766883607039559, 'max_features': None}. Best is trial 1389 with value: 0.22332552856343169.
[I 2024-12-04 13:33:06,433] Trial 2041 finished with value: 0.6037845699023939 and parameters: {'n_estimators': 200, 'learning_rate': 0.08362107103580368, 'max_depth': 9, 'min_samples_split': 20, 'min_samples_leaf': 9, 'subsample': 0.7311379763634671, 'max_features': 'sqrt'}. Best is trial 1389 with value: 0.22332552856343169.
[I 2024-12-04 13:33:12,499] Trial 2028 finished with value: 0.539708124880002 and parameters: {'n_estimators': 788, 'learning_rate': 0.03945072105660124, 'max_depth': 11, 'min_samples_split': 9, 'min_samples_leaf': 5, 'subsample': 0.9927748782100391, 'max_features': 'log2'}. Best is trial 1389 with value: 0.22332552856343169.
[I 2024-12-04 13:33:12,981] Trial 2010 finished with value: 0.26452015240454985 and parameters: {'n_estimators': 1486, 'learning_rate': 0.04467199647260682, 'max_depth': 4, 'min_samples_split': 2, 'min_samples_leaf': 1, 'subsample': 0.7154516644704615, 'max_features': 'sqrt'}. Best is trial 1389 with value: 0.22332552856343169.
[I 2024-12-04 13:33:13,538] Trial 2016 finished with value: 0.35549104650762037 and parameters: {'n_estimators': 1362, 'learning_rate': 0.08932642384735488, 'max_depth': 8, 'min_samples_split': 2, 'min_samples_leaf': 3, 'subsample': 0.8048724359174881, 'max_features': 'sqrt'}. Best is trial 1389 with value: 0.22332552856343169.
[I 2024-12-04 13:33:16,167] Trial 2018 finished with value: 0.2632374705290318 and parameters: {'n_estimators': 1227, 'learning_rate': 0.08788174462984999, 'max_depth': 5, 'min_samples_split': 2, 'min_samples_leaf': 1, 'subsample': 0.7829537345697553, 'max_features': 'sqrt'}. Best is trial 1389 with value: 0.22332552856343169.
[I 2024-12-04 13:33:16,689] Trial 2017 finished with value: 0.49366344041534593 and parameters: {'n_estimators': 1345, 'learning_rate': 0.058921750201853, 'max_depth': 4, 'min_samples_split': 5, 'min_samples_leaf': 10, 'subsample': 0.7404152921724284, 'max_features': 'sqrt'}. Best is trial 1389 with value: 0.22332552856343169.
[I 2024-12-04 13:33:19,016] Trial 2039 finished with value: 0.8422977687068778 and parameters: {'n_estimators': 496, 'learning_rate': 0.010368150596910116, 'max_depth': 5, 'min_samples_split': 11, 'min_samples_leaf': 7, 'subsample': 0.6590043601121727, 'max_features': 'sqrt'}. Best is trial 1389 with value: 0.22332552856343169.
[I 2024-12-04 13:33:20,454] Trial 2024 finished with value: 0.24463758319415124 and parameters: {'n_estimators': 1129, 'learning_rate': 0.06234257737161861, 'max_depth': 8, 'min_samples_split': 4, 'min_samples_leaf': 1, 'subsample': 0.6634853996928184, 'max_features': 'sqrt'}. Best is trial 1389 with value: 0.22332552856343169.
[I 2024-12-04 13:33:22,895] Trial 2022 finished with value: 0.3603656993759518 and parameters: {'n_estimators': 1255, 'learning_rate': 0.03749970603395854, 'max_depth': 11, 'min_samples_split': 2, 'min_samples_leaf': 4, 'subsample': 0.6019228654413225, 'max_features': 'sqrt'}. Best is trial 1389 with value: 0.22332552856343169.
[I 2024-12-04 13:33:26,990] Trial 2019 finished with value: 0.26600395986997544 and parameters: {'n_estimators': 1492, 'learning_rate': 0.055963350198420934, 'max_depth': 6, 'min_samples_split': 8, 'min_samples_leaf': 1, 'subsample': 0.6309099193761468, 'max_features': 'sqrt'}. Best is trial 1389 with value: 0.22332552856343169.
[I 2024-12-04 13:33:28,764] Trial 2025 finished with value: 0.2399395985684853 and parameters: {'n_estimators': 1200, 'learning_rate': 0.06747581321688366, 'max_depth': 8, 'min_samples_split': 5, 'min_samples_leaf': 1, 'subsample': 0.7967148124566424, 'max_features': 'sqrt'}. Best is trial 1389 with value: 0.22332552856343169.
[I 2024-12-04 13:33:29,620] Trial 2030 finished with value: 0.3506868605602493 and parameters: {'n_estimators': 898, 'learning_rate': 0.09871701435534747, 'max_depth': 8, 'min_samples_split': 5, 'min_samples_leaf': 3, 'subsample': 0.8955586940335456, 'max_features': 'sqrt'}. Best is trial 1389 with value: 0.22332552856343169.
[I 2024-12-04 13:33:39,055] Trial 2036 finished with value: 0.45786536395678984 and parameters: {'n_estimators': 797, 'learning_rate': 0.036224059366466485, 'max_depth': 7, 'min_samples_split': 2, 'min_samples_leaf': 7, 'subsample': 0.6046806627247253, 'max_features': 'sqrt'}. Best is trial 1389 with value: 0.22332552856343169.
[I 2024-12-04 13:33:40,703] Trial 2032 finished with value: 0.2539544390513824 and parameters: {'n_estimators': 1140, 'learning_rate': 0.09715582595324739, 'max_depth': 7, 'min_samples_split': 8, 'min_samples_leaf': 1, 'subsample': 0.8541783390812262, 'max_features': 'sqrt'}. Best is trial 1389 with value: 0.22332552856343169.
[I 2024-12-04 13:33:44,490] Trial 2026 finished with value: 0.2428947744577115 and parameters: {'n_estimators': 1458, 'learning_rate': 0.09765086810351861, 'max_depth': 5, 'min_samples_split': 2, 'min_samples_leaf': 1, 'subsample': 0.7478247175904079, 'max_features': 'sqrt'}. Best is trial 1389 with value: 0.22332552856343169.
[I 2024-12-04 13:33:45,882] Trial 2031 finished with value: 0.23676742000239795 and parameters: {'n_estimators': 1214, 'learning_rate': 0.0976769555463131, 'max_depth': 6, 'min_samples_split': 5, 'min_samples_leaf': 1, 'subsample': 0.8248532497897021, 'max_features': 'sqrt'}. Best is trial 1389 with value: 0.22332552856343169.
[I 2024-12-04 13:33:47,547] Trial 2045 finished with value: 0.2551206398113287 and parameters: {'n_estimators': 609, 'learning_rate': 0.07966112200374686, 'max_depth': 8, 'min_samples_split': 3, 'min_samples_leaf': 1, 'subsample': 0.7968399775476873, 'max_features': 'sqrt'}. Best is trial 1389 with value: 0.22332552856343169.
[I 2024-12-04 13:33:48,037] Trial 2027 finished with value: 0.35931720055440364 and parameters: {'n_estimators': 1421, 'learning_rate': 0.08497010451318064, 'max_depth': 9, 'min_samples_split': 9, 'min_samples_leaf': 3, 'subsample': 0.7530242011157033, 'max_features': 'sqrt'}. Best is trial 1389 with value: 0.22332552856343169.
[I 2024-12-04 13:33:53,251] Trial 2033 finished with value: 0.3545974469440696 and parameters: {'n_estimators': 1270, 'learning_rate': 0.07293389061464259, 'max_depth': 4, 'min_samples_split': 9, 'min_samples_leaf': 3, 'subsample': 0.7858378675613819, 'max_features': 'sqrt'}. Best is trial 1389 with value: 0.22332552856343169.
[I 2024-12-04 13:33:55,810] Trial 2034 finished with value: 0.3268275103147568 and parameters: {'n_estimators': 1301, 'learning_rate': 0.05285025825633634, 'max_depth': 5, 'min_samples_split': 9, 'min_samples_leaf': 1, 'subsample': 0.8220455178565894, 'max_features': 'log2'}. Best is trial 1389 with value: 0.22332552856343169.
[I 2024-12-04 13:33:57,316] Trial 2035 finished with value: 0.27200106909096655 and parameters: {'n_estimators': 1267, 'learning_rate': 0.09014578805493076, 'max_depth': 12, 'min_samples_split': 2, 'min_samples_leaf': 1, 'subsample': 0.6103293119386926, 'max_features': 'sqrt'}. Best is trial 1389 with value: 0.22332552856343169.
[I 2024-12-04 13:33:58,316] Trial 2029 finished with value: 0.26370299024897603 and parameters: {'n_estimators': 1486, 'learning_rate': 0.043087400451267494, 'max_depth': 7, 'min_samples_split': 4, 'min_samples_leaf': 1, 'subsample': 0.6443855239783123, 'max_features': 'sqrt'}. Best is trial 1389 with value: 0.22332552856343169.
[I 2024-12-04 13:34:13,260] Trial 2048 finished with value: 0.2570545467980418 and parameters: {'n_estimators': 954, 'learning_rate': 0.09277785899510461, 'max_depth': 5, 'min_samples_split': 7, 'min_samples_leaf': 1, 'subsample': 0.8681374635504718, 'max_features': 'sqrt'}. Best is trial 1389 with value: 0.22332552856343169.
[I 2024-12-04 13:34:15,300] Trial 2038 finished with value: 0.24975541712852772 and parameters: {'n_estimators': 1441, 'learning_rate': 0.03151680722803635, 'max_depth': 12, 'min_samples_split': 4, 'min_samples_leaf': 1, 'subsample': 0.6780999140743001, 'max_features': 'sqrt'}. Best is trial 1389 with value: 0.22332552856343169.
[I 2024-12-04 13:34:16,293] Trial 2052 finished with value: 0.2392763662027864 and parameters: {'n_estimators': 804, 'learning_rate': 0.09809564643216731, 'max_depth': 6, 'min_samples_split': 5, 'min_samples_leaf': 1, 'subsample': 0.8897359565076921, 'max_features': 'sqrt'}. Best is trial 1389 with value: 0.22332552856343169.
[I 2024-12-04 13:34:21,097] Trial 2046 finished with value: 0.3995296608237997 and parameters: {'n_estimators': 1144, 'learning_rate': 0.030057743967007906, 'max_depth': 7, 'min_samples_split': 2, 'min_samples_leaf': 2, 'subsample': 0.6240773259868124, 'max_features': 'log2'}. Best is trial 1389 with value: 0.22332552856343169.
[I 2024-12-04 13:34:21,213] Trial 2044 finished with value: 0.2572337343535868 and parameters: {'n_estimators': 1265, 'learning_rate': 0.07785194615757698, 'max_depth': 8, 'min_samples_split': 7, 'min_samples_leaf': 1, 'subsample': 0.6801710856235829, 'max_features': 'sqrt'}. Best is trial 1389 with value: 0.22332552856343169.
[I 2024-12-04 13:34:23,716] Trial 2040 finished with value: 0.3379838821473788 and parameters: {'n_estimators': 1353, 'learning_rate': 0.04974767847096744, 'max_depth': 12, 'min_samples_split': 9, 'min_samples_leaf': 2, 'subsample': 0.7880861811270137, 'max_features': None}. Best is trial 1389 with value: 0.22332552856343169.
[I 2024-12-04 13:34:28,906] Trial 2051 finished with value: 0.2635231810551168 and parameters: {'n_estimators': 943, 'learning_rate': 0.09286288110822218, 'max_depth': 7, 'min_samples_split': 2, 'min_samples_leaf': 1, 'subsample': 0.9208404943929451, 'max_features': 'sqrt'}. Best is trial 1389 with value: 0.22332552856343169.
[I 2024-12-04 13:34:28,969] Trial 2054 finished with value: 0.24761663291606073 and parameters: {'n_estimators': 835, 'learning_rate': 0.09066989060143699, 'max_depth': 8, 'min_samples_split': 2, 'min_samples_leaf': 1, 'subsample': 0.6936113929938174, 'max_features': 'sqrt'}. Best is trial 1389 with value: 0.22332552856343169.
[I 2024-12-04 13:34:33,674] Trial 2043 finished with value: 0.3243157248382121 and parameters: {'n_estimators': 1493, 'learning_rate': 0.06180019103294736, 'max_depth': 12, 'min_samples_split': 5, 'min_samples_leaf': 2, 'subsample': 0.6920811845415068, 'max_features': 'sqrt'}. Best is trial 1389 with value: 0.22332552856343169.
[I 2024-12-04 13:34:34,897] Trial 2064 finished with value: 0.4369150740299757 and parameters: {'n_estimators': 608, 'learning_rate': 0.011228346831122817, 'max_depth': 12, 'min_samples_split': 16, 'min_samples_leaf': 3, 'subsample': 0.6663146783678735, 'max_features': 'sqrt'}. Best is trial 1389 with value: 0.22332552856343169.
[I 2024-12-04 13:34:36,576] Trial 2053 finished with value: 0.2406364305978663 and parameters: {'n_estimators': 1007, 'learning_rate': 0.04781308008797808, 'max_depth': 6, 'min_samples_split': 3, 'min_samples_leaf': 1, 'subsample': 0.865825401107405, 'max_features': 'sqrt'}. Best is trial 1389 with value: 0.22332552856343169.
[I 2024-12-04 13:34:36,581] Trial 2042 finished with value: 0.3281287099582999 and parameters: {'n_estimators': 1428, 'learning_rate': 0.07835637521960216, 'max_depth': 8, 'min_samples_split': 6, 'min_samples_leaf': 2, 'subsample': 0.757161092943561, 'max_features': None}. Best is trial 1389 with value: 0.22332552856343169.
[I 2024-12-04 13:34:45,135] Trial 2049 finished with value: 0.24019866082963168 and parameters: {'n_estimators': 1263, 'learning_rate': 0.09387382405888678, 'max_depth': 9, 'min_samples_split': 7, 'min_samples_leaf': 1, 'subsample': 0.776398030745166, 'max_features': 'sqrt'}. Best is trial 1389 with value: 0.22332552856343169.
[I 2024-12-04 13:34:45,927] Trial 2047 finished with value: 0.24377887021578631 and parameters: {'n_estimators': 1414, 'learning_rate': 0.09851116020151954, 'max_depth': 6, 'min_samples_split': 7, 'min_samples_leaf': 1, 'subsample': 0.709258360713572, 'max_features': 'sqrt'}. Best is trial 1389 with value: 0.22332552856343169.
[I 2024-12-04 13:34:47,363] Trial 2056 finished with value: 0.23926259138113576 and parameters: {'n_estimators': 1045, 'learning_rate': 0.09163308211348936, 'max_depth': 9, 'min_samples_split': 4, 'min_samples_leaf': 1, 'subsample': 0.9104937424524028, 'max_features': 'sqrt'}. Best is trial 1389 with value: 0.22332552856343169.
[I 2024-12-04 13:34:50,861] Trial 2079 finished with value: 0.4265425423627516 and parameters: {'n_estimators': 213, 'learning_rate': 0.06892968148100108, 'max_depth': 10, 'min_samples_split': 2, 'min_samples_leaf': 6, 'subsample': 0.7450521248697177, 'max_features': 'sqrt'}. Best is trial 1389 with value: 0.22332552856343169.
[I 2024-12-04 13:34:53,613] Trial 2050 finished with value: 0.3593177512415429 and parameters: {'n_estimators': 1346, 'learning_rate': 0.05190296220448439, 'max_depth': 12, 'min_samples_split': 7, 'min_samples_leaf': 3, 'subsample': 0.6000777255509278, 'max_features': 'sqrt'}. Best is trial 1389 with value: 0.22332552856343169.
[I 2024-12-04 13:34:57,596] Trial 2055 finished with value: 0.2427831665205077 and parameters: {'n_estimators': 1101, 'learning_rate': 0.060531708299038374, 'max_depth': 8, 'min_samples_split': 3, 'min_samples_leaf': 1, 'subsample': 0.7134696455504966, 'max_features': 'sqrt'}. Best is trial 1389 with value: 0.22332552856343169.
[I 2024-12-04 13:35:00,581] Trial 2065 finished with value: 0.43675468109779464 and parameters: {'n_estimators': 813, 'learning_rate': 0.013254147916671122, 'max_depth': 8, 'min_samples_split': 13, 'min_samples_leaf': 4, 'subsample': 0.9546201372898895, 'max_features': None}. Best is trial 1389 with value: 0.22332552856343169.
[I 2024-12-04 13:35:02,599] Trial 2066 finished with value: 0.2760932950446429 and parameters: {'n_estimators': 909, 'learning_rate': 0.0725271476448535, 'max_depth': 7, 'min_samples_split': 2, 'min_samples_leaf': 1, 'subsample': 0.8953672770711948, 'max_features': 'log2'}. Best is trial 1389 with value: 0.22332552856343169.
[I 2024-12-04 13:35:04,655] Trial 2071 finished with value: 0.35629715538378176 and parameters: {'n_estimators': 747, 'learning_rate': 0.08060291570250383, 'max_depth': 8, 'min_samples_split': 4, 'min_samples_leaf': 4, 'subsample': 0.7820121521178081, 'max_features': 'sqrt'}. Best is trial 1389 with value: 0.22332552856343169.
[I 2024-12-04 13:35:06,580] Trial 2062 finished with value: 0.35768204506232154 and parameters: {'n_estimators': 1139, 'learning_rate': 0.08609878501916987, 'max_depth': 6, 'min_samples_split': 3, 'min_samples_leaf': 3, 'subsample': 0.9035750723336224, 'max_features': 'sqrt'}. Best is trial 1389 with value: 0.22332552856343169.
[I 2024-12-04 13:35:10,460] Trial 2057 finished with value: 0.34964737996123435 and parameters: {'n_estimators': 1309, 'learning_rate': 0.06736037690062241, 'max_depth': 7, 'min_samples_split': 4, 'min_samples_leaf': 3, 'subsample': 0.727145136401471, 'max_features': 'sqrt'}. Best is trial 1389 with value: 0.22332552856343169.
[I 2024-12-04 13:35:12,119] Trial 2060 finished with value: 0.301506360578171 and parameters: {'n_estimators': 1183, 'learning_rate': 0.04837566767110674, 'max_depth': 12, 'min_samples_split': 8, 'min_samples_leaf': 2, 'subsample': 0.6626352267181932, 'max_features': 'sqrt'}. Best is trial 1389 with value: 0.22332552856343169.
[I 2024-12-04 13:35:16,033] Trial 2085 finished with value: 0.48822943668104235 and parameters: {'n_estimators': 336, 'learning_rate': 0.07992497191379468, 'max_depth': 8, 'min_samples_split': 7, 'min_samples_leaf': 10, 'subsample': 0.8545974174652675, 'max_features': 'sqrt'}. Best is trial 1389 with value: 0.22332552856343169.
[I 2024-12-04 13:35:18,620] Trial 2067 finished with value: 0.2342838544353584 and parameters: {'n_estimators': 1094, 'learning_rate': 0.07959807233351318, 'max_depth': 6, 'min_samples_split': 2, 'min_samples_leaf': 1, 'subsample': 0.8977356786607368, 'max_features': 'sqrt'}. Best is trial 1389 with value: 0.22332552856343169.
