[I 2024-12-04 12:13:28,893] Trial 1428 finished with value: 0.30341390167214616 and parameters: {'n_estimators': 618, 'max_depth': 42, 'min_samples_split': 3, 'min_samples_leaf': 1, 'max_features': 'sqrt', 'bootstrap': False, 'criterion': 'squared_error'}. Best is trial 341 with value: 0.2909369124469028.
[I 2024-12-04 12:13:30,561] Trial 1442 finished with value: 0.44127835606124893 and parameters: {'n_estimators': 248, 'max_depth': 49, 'min_samples_split': 4, 'min_samples_leaf': 2, 'max_features': 'sqrt', 'bootstrap': False, 'criterion': 'squared_error'}. Best is trial 341 with value: 0.2909369124469028.
[I 2024-12-04 12:13:30,641] Trial 1443 finished with value: 0.8755155671012402 and parameters: {'n_estimators': 270, 'max_depth': 15, 'min_samples_split': 25, 'min_samples_leaf': 10, 'max_features': 'sqrt', 'bootstrap': True, 'criterion': 'absolute_error'}. Best is trial 341 with value: 0.2909369124469028.
[I 2024-12-04 12:13:31,129] Trial 1440 finished with value: 0.30331719628692283 and parameters: {'n_estimators': 547, 'max_depth': 42, 'min_samples_split': 3, 'min_samples_leaf': 1, 'max_features': 'sqrt', 'bootstrap': False, 'criterion': 'squared_error'}. Best is trial 341 with value: 0.2909369124469028.
[I 2024-12-04 12:13:32,504] Trial 1445 finished with value: 0.29832127864371655 and parameters: {'n_estimators': 204, 'max_depth': 50, 'min_samples_split': 2, 'min_samples_leaf': 1, 'max_features': 'sqrt', 'bootstrap': False, 'criterion': 'squared_error'}. Best is trial 341 with value: 0.2909369124469028.
[I 2024-12-04 12:13:33,650] Trial 1433 finished with value: 0.4464736558281114 and parameters: {'n_estimators': 730, 'max_depth': 40, 'min_samples_split': 4, 'min_samples_leaf': 2, 'max_features': 'sqrt', 'bootstrap': False, 'criterion': 'squared_error'}. Best is trial 341 with value: 0.2909369124469028.
[I 2024-12-04 12:13:33,899] Trial 1446 finished with value: 0.2940454696603591 and parameters: {'n_estimators': 466, 'max_depth': 50, 'min_samples_split': 3, 'min_samples_leaf': 1, 'max_features': 'sqrt', 'bootstrap': False, 'criterion': 'squared_error'}. Best is trial 341 with value: 0.2909369124469028.
[I 2024-12-04 12:13:34,913] Trial 1439 finished with value: 0.3004858660234739 and parameters: {'n_estimators': 240, 'max_depth': 50, 'min_samples_split': 4, 'min_samples_leaf': 1, 'max_features': 'sqrt', 'bootstrap': False, 'criterion': 'squared_error'}. Best is trial 341 with value: 0.2909369124469028.
[I 2024-12-04 12:13:36,455] Trial 1444 finished with value: 0.292801940723135 and parameters: {'n_estimators': 161, 'max_depth': 50, 'min_samples_split': 3, 'min_samples_leaf': 1, 'max_features': 'sqrt', 'bootstrap': False, 'criterion': 'squared_error'}. Best is trial 341 with value: 0.2909369124469028.
[I 2024-12-04 12:13:37,736] Trial 1447 finished with value: 0.44430060134297616 and parameters: {'n_estimators': 405, 'max_depth': 42, 'min_samples_split': 5, 'min_samples_leaf': 2, 'max_features': 'sqrt', 'bootstrap': False, 'criterion': 'squared_error'}. Best is trial 341 with value: 0.2909369124469028.
[I 2024-12-04 12:13:39,858] Trial 1429 finished with value: 0.30383794801136804 and parameters: {'n_estimators': 391, 'max_depth': 50, 'min_samples_split': 2, 'min_samples_leaf': 1, 'max_features': 'sqrt', 'bootstrap': False, 'criterion': 'absolute_error'}. Best is trial 341 with value: 0.2909369124469028.
[I 2024-12-04 12:13:40,459] Trial 1450 finished with value: 0.30746397384446755 and parameters: {'n_estimators': 339, 'max_depth': 43, 'min_samples_split': 4, 'min_samples_leaf': 1, 'max_features': 'sqrt', 'bootstrap': False, 'criterion': 'squared_error'}. Best is trial 341 with value: 0.2909369124469028.
[I 2024-12-04 12:13:41,020] Trial 1451 finished with value: 0.8820917120565681 and parameters: {'n_estimators': 158, 'max_depth': 5, 'min_samples_split': 14, 'min_samples_leaf': 1, 'max_features': 'log2', 'bootstrap': True, 'criterion': 'absolute_error'}. Best is trial 341 with value: 0.2909369124469028.
[I 2024-12-04 12:13:41,279] Trial 1448 finished with value: 0.2980804032530766 and parameters: {'n_estimators': 363, 'max_depth': 50, 'min_samples_split': 2, 'min_samples_leaf': 1, 'max_features': 'sqrt', 'bootstrap': False, 'criterion': 'squared_error'}. Best is trial 341 with value: 0.2909369124469028.
[I 2024-12-04 12:13:42,163] Trial 1454 finished with value: 0.4415214911651834 and parameters: {'n_estimators': 468, 'max_depth': 45, 'min_samples_split': 3, 'min_samples_leaf': 2, 'max_features': 'sqrt', 'bootstrap': False, 'criterion': 'squared_error'}. Best is trial 341 with value: 0.2909369124469028.
[I 2024-12-04 12:13:43,581] Trial 1455 finished with value: 0.32993808782422374 and parameters: {'n_estimators': 295, 'max_depth': 35, 'min_samples_split': 2, 'min_samples_leaf': 1, 'max_features': 'sqrt', 'bootstrap': False, 'criterion': 'squared_error'}. Best is trial 341 with value: 0.2909369124469028.
[I 2024-12-04 12:13:44,187] Trial 1457 finished with value: 0.30532571925877006 and parameters: {'n_estimators': 198, 'max_depth': 43, 'min_samples_split': 4, 'min_samples_leaf': 1, 'max_features': 'sqrt', 'bootstrap': False, 'criterion': 'squared_error'}. Best is trial 341 with value: 0.2909369124469028.
[I 2024-12-04 12:13:44,320] Trial 1449 finished with value: 0.5149852354886455 and parameters: {'n_estimators': 193, 'max_depth': 27, 'min_samples_split': 6, 'min_samples_leaf': 14, 'max_features': None, 'bootstrap': False, 'criterion': 'absolute_error'}. Best is trial 341 with value: 0.2909369124469028.
[I 2024-12-04 12:13:45,050] Trial 1453 finished with value: 0.2996082249069212 and parameters: {'n_estimators': 242, 'max_depth': 50, 'min_samples_split': 2, 'min_samples_leaf': 1, 'max_features': 'sqrt', 'bootstrap': False, 'criterion': 'squared_error'}. Best is trial 341 with value: 0.2909369124469028.
[I 2024-12-04 12:13:45,815] Trial 1441 finished with value: 0.32866738912322546 and parameters: {'n_estimators': 884, 'max_depth': 36, 'min_samples_split': 2, 'min_samples_leaf': 1, 'max_features': 'sqrt', 'bootstrap': False, 'criterion': 'squared_error'}. Best is trial 341 with value: 0.2909369124469028.
[I 2024-12-04 12:13:45,856] Trial 1456 finished with value: 0.7949381774556985 and parameters: {'n_estimators': 921, 'max_depth': 20, 'min_samples_split': 34, 'min_samples_leaf': 2, 'max_features': 'log2', 'bootstrap': True, 'criterion': 'squared_error'}. Best is trial 341 with value: 0.2909369124469028.
[I 2024-12-04 12:13:46,274] Trial 1458 finished with value: 0.4285878307370536 and parameters: {'n_estimators': 485, 'max_depth': 40, 'min_samples_split': 40, 'min_samples_leaf': 1, 'max_features': 'sqrt', 'bootstrap': True, 'criterion': 'squared_error'}. Best is trial 341 with value: 0.2909369124469028.
[I 2024-12-04 12:13:46,359] Trial 1452 finished with value: 0.2941923373241061 and parameters: {'n_estimators': 571, 'max_depth': 50, 'min_samples_split': 3, 'min_samples_leaf': 1, 'max_features': 'sqrt', 'bootstrap': False, 'criterion': 'squared_error'}. Best is trial 341 with value: 0.2909369124469028.
[I 2024-12-04 12:13:46,756] Trial 1463 finished with value: 0.31015770831975853 and parameters: {'n_estimators': 213, 'max_depth': 44, 'min_samples_split': 5, 'min_samples_leaf': 1, 'max_features': 'sqrt', 'bootstrap': False, 'criterion': 'squared_error'}. Best is trial 341 with value: 0.2909369124469028.
[I 2024-12-04 12:13:47,042] Trial 1469 finished with value: 0.44247268571505727 and parameters: {'n_estimators': 222, 'max_depth': 50, 'min_samples_split': 3, 'min_samples_leaf': 2, 'max_features': 'sqrt', 'bootstrap': False, 'criterion': 'squared_error'}. Best is trial 341 with value: 0.2909369124469028.
[I 2024-12-04 12:13:47,163] Trial 1467 finished with value: 0.3072343667253071 and parameters: {'n_estimators': 447, 'max_depth': 43, 'min_samples_split': 2, 'min_samples_leaf': 1, 'max_features': 'sqrt', 'bootstrap': False, 'criterion': 'squared_error'}. Best is trial 341 with value: 0.2909369124469028.
[I 2024-12-04 12:13:47,933] Trial 1462 finished with value: 0.4403645434456051 and parameters: {'n_estimators': 567, 'max_depth': 50, 'min_samples_split': 3, 'min_samples_leaf': 2, 'max_features': 'sqrt', 'bootstrap': False, 'criterion': 'squared_error'}. Best is trial 341 with value: 0.2909369124469028.
[I 2024-12-04 12:13:48,558] Trial 1465 finished with value: 0.44517541383902093 and parameters: {'n_estimators': 253, 'max_depth': 42, 'min_samples_split': 3, 'min_samples_leaf': 2, 'max_features': 'sqrt', 'bootstrap': False, 'criterion': 'squared_error'}. Best is trial 341 with value: 0.2909369124469028.
[I 2024-12-04 12:13:49,091] Trial 1459 finished with value: 0.3063945006456012 and parameters: {'n_estimators': 618, 'max_depth': 49, 'min_samples_split': 5, 'min_samples_leaf': 1, 'max_features': 'sqrt', 'bootstrap': False, 'criterion': 'squared_error'}. Best is trial 341 with value: 0.2909369124469028.
[I 2024-12-04 12:13:49,134] Trial 1460 finished with value: 0.6550079456944208 and parameters: {'n_estimators': 551, 'max_depth': 40, 'min_samples_split': 37, 'min_samples_leaf': 4, 'max_features': 'sqrt', 'bootstrap': True, 'criterion': 'squared_error'}. Best is trial 341 with value: 0.2909369124469028.
[I 2024-12-04 12:13:49,269] Trial 1470 finished with value: 0.30117778962345465 and parameters: {'n_estimators': 211, 'max_depth': 44, 'min_samples_split': 3, 'min_samples_leaf': 1, 'max_features': 'sqrt', 'bootstrap': False, 'criterion': 'squared_error'}. Best is trial 341 with value: 0.2909369124469028.
[I 2024-12-04 12:13:50,447] Trial 1471 finished with value: 0.47779364221612997 and parameters: {'n_estimators': 260, 'max_depth': 39, 'min_samples_split': 5, 'min_samples_leaf': 2, 'max_features': 'sqrt', 'bootstrap': True, 'criterion': 'squared_error'}. Best is trial 341 with value: 0.2909369124469028.
[I 2024-12-04 12:13:51,928] Trial 1468 finished with value: 0.2993771932613912 and parameters: {'n_estimators': 231, 'max_depth': 50, 'min_samples_split': 2, 'min_samples_leaf': 1, 'max_features': 'sqrt', 'bootstrap': False, 'criterion': 'squared_error'}. Best is trial 341 with value: 0.2909369124469028.
[I 2024-12-04 12:13:51,994] Trial 1461 finished with value: 0.30164510518628695 and parameters: {'n_estimators': 692, 'max_depth': 50, 'min_samples_split': 4, 'min_samples_leaf': 1, 'max_features': 'sqrt', 'bootstrap': False, 'criterion': 'squared_error'}. Best is trial 341 with value: 0.2909369124469028.
[I 2024-12-04 12:13:52,450] Trial 1466 finished with value: 0.30115077199869567 and parameters: {'n_estimators': 357, 'max_depth': 43, 'min_samples_split': 3, 'min_samples_leaf': 1, 'max_features': 'sqrt', 'bootstrap': False, 'criterion': 'squared_error'}. Best is trial 341 with value: 0.2909369124469028.
[I 2024-12-04 12:13:52,571] Trial 1476 finished with value: 0.3125264920149409 and parameters: {'n_estimators': 106, 'max_depth': 42, 'min_samples_split': 4, 'min_samples_leaf': 1, 'max_features': 'sqrt', 'bootstrap': False, 'criterion': 'squared_error'}. Best is trial 341 with value: 0.2909369124469028.
[I 2024-12-04 12:13:52,723] Trial 1472 finished with value: 0.32009867499788963 and parameters: {'n_estimators': 200, 'max_depth': 45, 'min_samples_split': 2, 'min_samples_leaf': 1, 'max_features': 'sqrt', 'bootstrap': True, 'criterion': 'squared_error'}. Best is trial 341 with value: 0.2909369124469028.
[I 2024-12-04 12:13:53,254] Trial 1475 finished with value: 0.38211476561185287 and parameters: {'n_estimators': 142, 'max_depth': 42, 'min_samples_split': 3, 'min_samples_leaf': 1, 'max_features': None, 'bootstrap': False, 'criterion': 'squared_error'}. Best is trial 341 with value: 0.2909369124469028.
[I 2024-12-04 12:13:56,339] Trial 1464 finished with value: 0.3806525841784638 and parameters: {'n_estimators': 551, 'max_depth': 49, 'min_samples_split': 3, 'min_samples_leaf': 1, 'max_features': None, 'bootstrap': False, 'criterion': 'squared_error'}. Best is trial 341 with value: 0.2909369124469028.
[I 2024-12-04 12:13:57,213] Trial 1473 finished with value: 0.3503993441792367 and parameters: {'n_estimators': 736, 'max_depth': 35, 'min_samples_split': 3, 'min_samples_leaf': 1, 'max_features': 'sqrt', 'bootstrap': True, 'criterion': 'squared_error'}. Best is trial 341 with value: 0.2909369124469028.
[I 2024-12-04 12:13:57,834] Trial 1474 finished with value: 0.8609062472668764 and parameters: {'n_estimators': 821, 'max_depth': 17, 'min_samples_split': 30, 'min_samples_leaf': 10, 'max_features': 'sqrt', 'bootstrap': True, 'criterion': 'squared_error'}. Best is trial 341 with value: 0.2909369124469028.
[I 2024-12-04 12:13:58,788] Trial 1479 finished with value: 0.304490007154822 and parameters: {'n_estimators': 278, 'max_depth': 50, 'min_samples_split': 5, 'min_samples_leaf': 1, 'max_features': 'sqrt', 'bootstrap': False, 'criterion': 'squared_error'}. Best is trial 341 with value: 0.2909369124469028.
[I 2024-12-04 12:13:58,876] Trial 1478 finished with value: 0.2945891736591616 and parameters: {'n_estimators': 372, 'max_depth': 50, 'min_samples_split': 3, 'min_samples_leaf': 1, 'max_features': 'sqrt', 'bootstrap': False, 'criterion': 'squared_error'}. Best is trial 341 with value: 0.2909369124469028.
[I 2024-12-04 12:13:58,900] Trial 1481 finished with value: 0.3037090963734095 and parameters: {'n_estimators': 539, 'max_depth': 50, 'min_samples_split': 5, 'min_samples_leaf': 1, 'max_features': 'sqrt', 'bootstrap': False, 'criterion': 'squared_error'}. Best is trial 341 with value: 0.2909369124469028.
[I 2024-12-04 12:13:59,012] Trial 1485 finished with value: 0.30728516295569497 and parameters: {'n_estimators': 421, 'max_depth': 43, 'min_samples_split': 4, 'min_samples_leaf': 1, 'max_features': 'sqrt', 'bootstrap': False, 'criterion': 'squared_error'}. Best is trial 341 with value: 0.2909369124469028.
[I 2024-12-04 12:13:59,136] Trial 1486 finished with value: 0.30639545197501417 and parameters: {'n_estimators': 119, 'max_depth': 41, 'min_samples_split': 3, 'min_samples_leaf': 1, 'max_features': 'sqrt', 'bootstrap': False, 'criterion': 'squared_error'}. Best is trial 341 with value: 0.2909369124469028.
[I 2024-12-04 12:14:00,491] Trial 1489 finished with value: 0.29520979258781205 and parameters: {'n_estimators': 262, 'max_depth': 50, 'min_samples_split': 3, 'min_samples_leaf': 1, 'max_features': 'sqrt', 'bootstrap': False, 'criterion': 'squared_error'}. Best is trial 341 with value: 0.2909369124469028.
[I 2024-12-04 12:14:00,645] Trial 1480 finished with value: 0.2965795605833582 and parameters: {'n_estimators': 119, 'max_depth': 50, 'min_samples_split': 3, 'min_samples_leaf': 1, 'max_features': 'sqrt', 'bootstrap': False, 'criterion': 'squared_error'}. Best is trial 341 with value: 0.2909369124469028.
[I 2024-12-04 12:14:00,925] Trial 1483 finished with value: 0.2976686138771761 and parameters: {'n_estimators': 118, 'max_depth': 49, 'min_samples_split': 3, 'min_samples_leaf': 1, 'max_features': 'sqrt', 'bootstrap': False, 'criterion': 'squared_error'}. Best is trial 341 with value: 0.2909369124469028.
[I 2024-12-04 12:14:01,617] Trial 1487 finished with value: 0.3001061208932088 and parameters: {'n_estimators': 212, 'max_depth': 50, 'min_samples_split': 4, 'min_samples_leaf': 1, 'max_features': 'sqrt', 'bootstrap': False, 'criterion': 'squared_error'}. Best is trial 341 with value: 0.2909369124469028.
[I 2024-12-04 12:14:01,705] Trial 1493 finished with value: 0.2969085457274613 and parameters: {'n_estimators': 123, 'max_depth': 50, 'min_samples_split': 3, 'min_samples_leaf': 1, 'max_features': 'sqrt', 'bootstrap': False, 'criterion': 'squared_error'}. Best is trial 341 with value: 0.2909369124469028.
[I 2024-12-04 12:14:03,300] Trial 1484 finished with value: 0.9439793498871817 and parameters: {'n_estimators': 367, 'max_depth': 39, 'min_samples_split': 30, 'min_samples_leaf': 6, 'max_features': 'log2', 'bootstrap': True, 'criterion': 'absolute_error'}. Best is trial 341 with value: 0.2909369124469028.
[I 2024-12-04 12:14:03,368] Trial 1490 finished with value: 0.4451455101185653 and parameters: {'n_estimators': 236, 'max_depth': 43, 'min_samples_split': 3, 'min_samples_leaf': 2, 'max_features': 'sqrt', 'bootstrap': False, 'criterion': 'squared_error'}. Best is trial 341 with value: 0.2909369124469028.
[I 2024-12-04 12:14:04,750] Trial 1494 finished with value: 0.3099005014789971 and parameters: {'n_estimators': 479, 'max_depth': 42, 'min_samples_split': 2, 'min_samples_leaf': 1, 'max_features': 'sqrt', 'bootstrap': False, 'criterion': 'squared_error'}. Best is trial 341 with value: 0.2909369124469028.
[I 2024-12-04 12:14:06,850] Trial 1491 finished with value: 0.4163018753356005 and parameters: {'n_estimators': 340, 'max_depth': 41, 'min_samples_split': 3, 'min_samples_leaf': 2, 'max_features': None, 'bootstrap': False, 'criterion': 'squared_error'}. Best is trial 341 with value: 0.2909369124469028.
[I 2024-12-04 12:14:07,431] Trial 1496 finished with value: 0.44381311463150874 and parameters: {'n_estimators': 606, 'max_depth': 41, 'min_samples_split': 3, 'min_samples_leaf': 2, 'max_features': 'sqrt', 'bootstrap': False, 'criterion': 'squared_error'}. Best is trial 341 with value: 0.2909369124469028.
[I 2024-12-04 12:14:07,519] Trial 1492 finished with value: 0.30468343031243383 and parameters: {'n_estimators': 254, 'max_depth': 44, 'min_samples_split': 2, 'min_samples_leaf': 1, 'max_features': 'sqrt', 'bootstrap': False, 'criterion': 'squared_error'}. Best is trial 341 with value: 0.2909369124469028.
[I 2024-12-04 12:14:08,306] Trial 1501 finished with value: 0.3403385931141601 and parameters: {'n_estimators': 262, 'max_depth': 33, 'min_samples_split': 4, 'min_samples_leaf': 1, 'max_features': 'sqrt', 'bootstrap': False, 'criterion': 'squared_error'}. Best is trial 341 with value: 0.2909369124469028.
[I 2024-12-04 12:14:08,309] Trial 1499 finished with value: 0.31734517223135056 and parameters: {'n_estimators': 249, 'max_depth': 49, 'min_samples_split': 3, 'min_samples_leaf': 1, 'max_features': 'sqrt', 'bootstrap': True, 'criterion': 'squared_error'}. Best is trial 341 with value: 0.2909369124469028.
[I 2024-12-04 12:14:09,819] Trial 1477 finished with value: 0.3061622799102656 and parameters: {'n_estimators': 349, 'max_depth': 43, 'min_samples_split': 2, 'min_samples_leaf': 1, 'max_features': 'sqrt', 'bootstrap': False, 'criterion': 'squared_error'}. Best is trial 341 with value: 0.2909369124469028.
[I 2024-12-04 12:14:10,767] Trial 1488 finished with value: 0.4408047418740122 and parameters: {'n_estimators': 448, 'max_depth': 50, 'min_samples_split': 3, 'min_samples_leaf': 2, 'max_features': 'sqrt', 'bootstrap': False, 'criterion': 'squared_error'}. Best is trial 341 with value: 0.2909369124469028.
[I 2024-12-04 12:14:10,827] Trial 1495 finished with value: 0.32417241153340054 and parameters: {'n_estimators': 499, 'max_depth': 41, 'min_samples_split': 6, 'min_samples_leaf': 1, 'max_features': 'sqrt', 'bootstrap': False, 'criterion': 'squared_error'}. Best is trial 341 with value: 0.2909369124469028.
[I 2024-12-04 12:14:12,366] Trial 1505 finished with value: 0.30598254447259404 and parameters: {'n_estimators': 157, 'max_depth': 50, 'min_samples_split': 6, 'min_samples_leaf': 1, 'max_features': 'sqrt', 'bootstrap': False, 'criterion': 'squared_error'}. Best is trial 341 with value: 0.2909369124469028.
[I 2024-12-04 12:14:12,486] Trial 1497 finished with value: 0.8862019397167671 and parameters: {'n_estimators': 414, 'max_depth': 13, 'min_samples_split': 50, 'min_samples_leaf': 12, 'max_features': 'sqrt', 'bootstrap': True, 'criterion': 'squared_error'}. Best is trial 341 with value: 0.2909369124469028.
[I 2024-12-04 12:14:13,826] Trial 1502 finished with value: 0.29491605096074963 and parameters: {'n_estimators': 319, 'max_depth': 50, 'min_samples_split': 3, 'min_samples_leaf': 1, 'max_features': 'sqrt', 'bootstrap': False, 'criterion': 'squared_error'}. Best is trial 341 with value: 0.2909369124469028.
[I 2024-12-04 12:14:14,485] Trial 1500 finished with value: 0.3117601316444936 and parameters: {'n_estimators': 418, 'max_depth': 44, 'min_samples_split': 5, 'min_samples_leaf': 1, 'max_features': 'sqrt', 'bootstrap': False, 'criterion': 'squared_error'}. Best is trial 341 with value: 0.2909369124469028.
[I 2024-12-04 12:14:16,342] Trial 1305 finished with value: 0.4439574081429352 and parameters: {'n_estimators': 740, 'max_depth': 12, 'min_samples_split': 3, 'min_samples_leaf': 1, 'max_features': None, 'bootstrap': False, 'criterion': 'absolute_error'}. Best is trial 341 with value: 0.2909369124469028.
[I 2024-12-04 12:14:16,539] Trial 1508 finished with value: 0.3897184960736308 and parameters: {'n_estimators': 141, 'max_depth': 49, 'min_samples_split': 3, 'min_samples_leaf': 1, 'max_features': 'log2', 'bootstrap': False, 'criterion': 'squared_error'}. Best is trial 341 with value: 0.2909369124469028.
[I 2024-12-04 12:14:18,761] Trial 1507 finished with value: 0.44731689196457136 and parameters: {'n_estimators': 193, 'max_depth': 43, 'min_samples_split': 2, 'min_samples_leaf': 2, 'max_features': 'sqrt', 'bootstrap': False, 'criterion': 'squared_error'}. Best is trial 341 with value: 0.2909369124469028.
[I 2024-12-04 12:14:19,003] Trial 1503 finished with value: 0.8936903002444394 and parameters: {'n_estimators': 651, 'max_depth': 6, 'min_samples_split': 7, 'min_samples_leaf': 4, 'max_features': 'log2', 'bootstrap': False, 'criterion': 'squared_error'}. Best is trial 341 with value: 0.2909369124469028.
[I 2024-12-04 12:14:19,300] Trial 1510 finished with value: 0.2992792077985154 and parameters: {'n_estimators': 664, 'max_depth': 45, 'min_samples_split': 3, 'min_samples_leaf': 1, 'max_features': 'sqrt', 'bootstrap': False, 'criterion': 'squared_error'}. Best is trial 341 with value: 0.2909369124469028.
