[I 2024-12-04 12:21:01,253] Trial 403 finished with value: 0.32494765440577855 and parameters: {'n_estimators': 1104, 'learning_rate': 0.09508410844360188, 'max_depth': 6, 'min_samples_split': 5, 'min_samples_leaf': 2, 'subsample': 0.8720795662077925, 'max_features': None}. Best is trial 341 with value: 0.32115001931817605.
[I 2024-12-04 12:21:02,246] Trial 396 finished with value: 0.6846156733752514 and parameters: {'n_estimators': 1457, 'learning_rate': 0.011854651244239109, 'max_depth': 11, 'min_samples_split': 5, 'min_samples_leaf': 6, 'subsample': 0.9100049047843202, 'max_features': 'log2'}. Best is trial 341 with value: 0.32115001931817605.
[I 2024-12-04 12:21:02,707] Trial 397 finished with value: 0.3924982383757448 and parameters: {'n_estimators': 1270, 'learning_rate': 0.05341272538344328, 'max_depth': 8, 'min_samples_split': 5, 'min_samples_leaf': 1, 'subsample': 0.7892439086293072, 'max_features': None}. Best is trial 341 with value: 0.32115001931817605.
[I 2024-12-04 12:21:03,150] Trial 418 finished with value: 0.3806559366676531 and parameters: {'n_estimators': 717, 'learning_rate': 0.02330577995445886, 'max_depth': 12, 'min_samples_split': 3, 'min_samples_leaf': 5, 'subsample': 0.6686028624975684, 'max_features': None}. Best is trial 341 with value: 0.32115001931817605.
[I 2024-12-04 12:21:03,193] Trial 412 finished with value: 0.36679649076705867 and parameters: {'n_estimators': 984, 'learning_rate': 0.04290287127548038, 'max_depth': 12, 'min_samples_split': 17, 'min_samples_leaf': 3, 'subsample': 0.609564480494533, 'max_features': None}. Best is trial 341 with value: 0.32115001931817605.
[I 2024-12-04 12:21:04,037] Trial 415 finished with value: 0.3793990795475999 and parameters: {'n_estimators': 925, 'learning_rate': 0.07018412451972286, 'max_depth': 5, 'min_samples_split': 3, 'min_samples_leaf': 4, 'subsample': 0.772055378094405, 'max_features': None}. Best is trial 341 with value: 0.32115001931817605.
[I 2024-12-04 12:21:04,957] Trial 413 finished with value: 0.3689714959232451 and parameters: {'n_estimators': 1151, 'learning_rate': 0.06482383026694816, 'max_depth': 11, 'min_samples_split': 9, 'min_samples_leaf': 1, 'subsample': 0.720501912930049, 'max_features': 'sqrt'}. Best is trial 341 with value: 0.32115001931817605.
[I 2024-12-04 12:21:05,102] Trial 393 finished with value: 0.39878537930468094 and parameters: {'n_estimators': 1380, 'learning_rate': 0.06674799264094558, 'max_depth': 10, 'min_samples_split': 6, 'min_samples_leaf': 1, 'subsample': 0.7511551904988435, 'max_features': None}. Best is trial 341 with value: 0.32115001931817605.
[I 2024-12-04 12:21:06,279] Trial 405 finished with value: 0.37671763531048386 and parameters: {'n_estimators': 1281, 'learning_rate': 0.06509261329777541, 'max_depth': 8, 'min_samples_split': 5, 'min_samples_leaf': 5, 'subsample': 0.6744799197458828, 'max_features': None}. Best is trial 341 with value: 0.32115001931817605.
[I 2024-12-04 12:21:06,598] Trial 414 finished with value: 0.4680656483936961 and parameters: {'n_estimators': 1188, 'learning_rate': 0.09691973816993885, 'max_depth': 6, 'min_samples_split': 2, 'min_samples_leaf': 3, 'subsample': 0.7891696790655978, 'max_features': 'log2'}. Best is trial 341 with value: 0.32115001931817605.
[I 2024-12-04 12:21:08,536] Trial 401 finished with value: 0.34173288277458996 and parameters: {'n_estimators': 1455, 'learning_rate': 0.049735201670753806, 'max_depth': 7, 'min_samples_split': 8, 'min_samples_leaf': 2, 'subsample': 0.6765349793317413, 'max_features': None}. Best is trial 341 with value: 0.32115001931817605.
[I 2024-12-04 12:21:08,536] Trial 407 finished with value: 0.3820069964078889 and parameters: {'n_estimators': 1334, 'learning_rate': 0.09491312104422518, 'max_depth': 6, 'min_samples_split': 3, 'min_samples_leaf': 1, 'subsample': 0.687448480474935, 'max_features': None}. Best is trial 341 with value: 0.32115001931817605.
[I 2024-12-04 12:21:09,438] Trial 422 finished with value: 0.37635577684173244 and parameters: {'n_estimators': 703, 'learning_rate': 0.03837063986799284, 'max_depth': 12, 'min_samples_split': 11, 'min_samples_leaf': 1, 'subsample': 0.6930287037901239, 'max_features': None}. Best is trial 341 with value: 0.32115001931817605.
[I 2024-12-04 12:21:10,097] Trial 404 finished with value: 0.37691359161611127 and parameters: {'n_estimators': 1361, 'learning_rate': 0.07514156219547255, 'max_depth': 5, 'min_samples_split': 4, 'min_samples_leaf': 4, 'subsample': 0.8784175097261049, 'max_features': None}. Best is trial 341 with value: 0.32115001931817605.
[I 2024-12-04 12:21:10,824] Trial 400 finished with value: 0.3395914432627264 and parameters: {'n_estimators': 1499, 'learning_rate': 0.051306874408779665, 'max_depth': 10, 'min_samples_split': 12, 'min_samples_leaf': 2, 'subsample': 0.707191273239725, 'max_features': None}. Best is trial 341 with value: 0.32115001931817605.
[I 2024-12-04 12:21:11,110] Trial 423 finished with value: 0.39523700209445467 and parameters: {'n_estimators': 705, 'learning_rate': 0.022112221601587993, 'max_depth': 8, 'min_samples_split': 20, 'min_samples_leaf': 1, 'subsample': 0.7247159469941314, 'max_features': None}. Best is trial 341 with value: 0.32115001931817605.
[I 2024-12-04 12:21:11,587] Trial 417 finished with value: 0.38962445454385486 and parameters: {'n_estimators': 895, 'learning_rate': 0.08544448642601121, 'max_depth': 11, 'min_samples_split': 9, 'min_samples_leaf': 3, 'subsample': 0.8418583433518346, 'max_features': None}. Best is trial 341 with value: 0.32115001931817605.
[I 2024-12-04 12:21:13,107] Trial 426 finished with value: 0.4156964491367069 and parameters: {'n_estimators': 861, 'learning_rate': 0.026345166360604275, 'max_depth': 12, 'min_samples_split': 9, 'min_samples_leaf': 1, 'subsample': 0.6221627293408707, 'max_features': 'log2'}. Best is trial 341 with value: 0.32115001931817605.
[I 2024-12-04 12:21:13,108] Trial 416 finished with value: 0.3702376614031604 and parameters: {'n_estimators': 1101, 'learning_rate': 0.08846605197932719, 'max_depth': 8, 'min_samples_split': 5, 'min_samples_leaf': 4, 'subsample': 0.779841237059124, 'max_features': None}. Best is trial 341 with value: 0.32115001931817605.
[I 2024-12-04 12:21:15,010] Trial 425 finished with value: 0.39166387101867256 and parameters: {'n_estimators': 823, 'learning_rate': 0.024206481540646432, 'max_depth': 9, 'min_samples_split': 2, 'min_samples_leaf': 3, 'subsample': 0.6496093621559903, 'max_features': None}. Best is trial 341 with value: 0.32115001931817605.
[I 2024-12-04 12:21:15,444] Trial 421 finished with value: 0.3191792617682284 and parameters: {'n_estimators': 966, 'learning_rate': 0.07337917904978279, 'max_depth': 7, 'min_samples_split': 5, 'min_samples_leaf': 2, 'subsample': 0.6417569951365966, 'max_features': None}. Best is trial 421 with value: 0.3191792617682284.
[I 2024-12-04 12:21:16,314] Trial 411 finished with value: 0.3483976680816124 and parameters: {'n_estimators': 1404, 'learning_rate': 0.08013481895180821, 'max_depth': 9, 'min_samples_split': 2, 'min_samples_leaf': 2, 'subsample': 0.882340762971085, 'max_features': None}. Best is trial 421 with value: 0.3191792617682284.
[I 2024-12-04 12:21:16,318] Trial 420 finished with value: 0.36894079205066804 and parameters: {'n_estimators': 1010, 'learning_rate': 0.06775791393354735, 'max_depth': 11, 'min_samples_split': 20, 'min_samples_leaf': 3, 'subsample': 0.7309199283181632, 'max_features': None}. Best is trial 421 with value: 0.3191792617682284.
[I 2024-12-04 12:21:21,133] Trial 431 finished with value: 0.3798237657682136 and parameters: {'n_estimators': 773, 'learning_rate': 0.022255153659914012, 'max_depth': 11, 'min_samples_split': 2, 'min_samples_leaf': 1, 'subsample': 0.6069895482091593, 'max_features': None}. Best is trial 421 with value: 0.3191792617682284.
[I 2024-12-04 12:21:21,182] Trial 419 finished with value: 0.40923788866173466 and parameters: {'n_estimators': 1257, 'learning_rate': 0.09058630193992799, 'max_depth': 6, 'min_samples_split': 3, 'min_samples_leaf': 1, 'subsample': 0.8346632690370352, 'max_features': None}. Best is trial 421 with value: 0.3191792617682284.
[I 2024-12-04 12:21:21,903] Trial 437 finished with value: 0.38219461603593813 and parameters: {'n_estimators': 459, 'learning_rate': 0.035147531245599856, 'max_depth': 9, 'min_samples_split': 8, 'min_samples_leaf': 3, 'subsample': 0.6711891238741804, 'max_features': None}. Best is trial 421 with value: 0.3191792617682284.
[I 2024-12-04 12:21:25,828] Trial 428 finished with value: 0.31740361133065975 and parameters: {'n_estimators': 1035, 'learning_rate': 0.05071947891410652, 'max_depth': 7, 'min_samples_split': 3, 'min_samples_leaf': 2, 'subsample': 0.6923953144045234, 'max_features': None}. Best is trial 428 with value: 0.31740361133065975.
[I 2024-12-04 12:21:26,714] Trial 424 finished with value: 0.4121790532534508 and parameters: {'n_estimators': 1461, 'learning_rate': 0.030696419566217853, 'max_depth': 5, 'min_samples_split': 2, 'min_samples_leaf': 2, 'subsample': 0.6138844590470995, 'max_features': 'sqrt'}. Best is trial 428 with value: 0.31740361133065975.
[I 2024-12-04 12:21:27,324] Trial 427 finished with value: 0.48903028990119984 and parameters: {'n_estimators': 1481, 'learning_rate': 0.05807712622148387, 'max_depth': 3, 'min_samples_split': 19, 'min_samples_leaf': 5, 'subsample': 0.9614440448879747, 'max_features': 'log2'}. Best is trial 428 with value: 0.31740361133065975.
[I 2024-12-04 12:21:29,308] Trial 429 finished with value: 0.39925600418470875 and parameters: {'n_estimators': 1166, 'learning_rate': 0.04849244670572613, 'max_depth': 5, 'min_samples_split': 2, 'min_samples_leaf': 1, 'subsample': 0.6468579250707561, 'max_features': None}. Best is trial 428 with value: 0.31740361133065975.
[I 2024-12-04 12:21:35,353] Trial 435 finished with value: 0.38281860199570245 and parameters: {'n_estimators': 1004, 'learning_rate': 0.0859226018785134, 'max_depth': 6, 'min_samples_split': 6, 'min_samples_leaf': 3, 'subsample': 0.8428000405327895, 'max_features': None}. Best is trial 428 with value: 0.31740361133065975.
[I 2024-12-04 12:21:37,795] Trial 434 finished with value: 0.3869217865881989 and parameters: {'n_estimators': 1118, 'learning_rate': 0.045563804420718966, 'max_depth': 8, 'min_samples_split': 2, 'min_samples_leaf': 1, 'subsample': 0.7053491686994781, 'max_features': None}. Best is trial 428 with value: 0.31740361133065975.
[I 2024-12-04 12:21:37,833] Trial 430 finished with value: 0.4001485716958464 and parameters: {'n_estimators': 1432, 'learning_rate': 0.07232394886256995, 'max_depth': 5, 'min_samples_split': 2, 'min_samples_leaf': 3, 'subsample': 0.8158557602952787, 'max_features': None}. Best is trial 428 with value: 0.31740361133065975.
[I 2024-12-04 12:21:38,991] Trial 432 finished with value: 0.3380562381315127 and parameters: {'n_estimators': 1356, 'learning_rate': 0.09468137428471549, 'max_depth': 8, 'min_samples_split': 2, 'min_samples_leaf': 2, 'subsample': 0.7387626553160482, 'max_features': None}. Best is trial 428 with value: 0.31740361133065975.
[I 2024-12-04 12:21:42,233] Trial 438 finished with value: 0.40055352140134665 and parameters: {'n_estimators': 1370, 'learning_rate': 0.09792382432196227, 'max_depth': 6, 'min_samples_split': 4, 'min_samples_leaf': 4, 'subsample': 0.8770391776771818, 'max_features': 'sqrt'}. Best is trial 428 with value: 0.31740361133065975.
[I 2024-12-04 12:21:44,168] Trial 433 finished with value: 0.38817356588030166 and parameters: {'n_estimators': 1405, 'learning_rate': 0.030783094104450615, 'max_depth': 9, 'min_samples_split': 2, 'min_samples_leaf': 3, 'subsample': 0.7471327278365477, 'max_features': None}. Best is trial 428 with value: 0.31740361133065975.
[I 2024-12-04 12:21:47,267] Trial 450 finished with value: 0.35153244829816066 and parameters: {'n_estimators': 1095, 'learning_rate': 0.08795136455060683, 'max_depth': 12, 'min_samples_split': 9, 'min_samples_leaf': 1, 'subsample': 0.6180026016070969, 'max_features': 'sqrt'}. Best is trial 428 with value: 0.31740361133065975.
[I 2024-12-04 12:21:47,310] Trial 455 finished with value: 0.36621602236297457 and parameters: {'n_estimators': 797, 'learning_rate': 0.02913613351316734, 'max_depth': 11, 'min_samples_split': 20, 'min_samples_leaf': 3, 'subsample': 0.6991270778070755, 'max_features': None}. Best is trial 428 with value: 0.31740361133065975.
[I 2024-12-04 12:21:48,600] Trial 436 finished with value: 0.41281085811899243 and parameters: {'n_estimators': 1303, 'learning_rate': 0.026360308855778558, 'max_depth': 5, 'min_samples_split': 2, 'min_samples_leaf': 3, 'subsample': 0.793363338569255, 'max_features': None}. Best is trial 428 with value: 0.31740361133065975.
[I 2024-12-04 12:21:48,808] Trial 440 finished with value: 0.4047762912729338 and parameters: {'n_estimators': 1299, 'learning_rate': 0.02886635154917977, 'max_depth': 6, 'min_samples_split': 11, 'min_samples_leaf': 1, 'subsample': 0.7015287139343294, 'max_features': None}. Best is trial 428 with value: 0.31740361133065975.
[I 2024-12-04 12:21:48,810] Trial 452 finished with value: 0.39636942411023085 and parameters: {'n_estimators': 994, 'learning_rate': 0.045714148509282196, 'max_depth': 4, 'min_samples_split': 6, 'min_samples_leaf': 5, 'subsample': 0.6492871708094292, 'max_features': None}. Best is trial 428 with value: 0.31740361133065975.
[I 2024-12-04 12:21:48,831] Trial 462 finished with value: 0.38389110382799313 and parameters: {'n_estimators': 627, 'learning_rate': 0.05249274085019305, 'max_depth': 6, 'min_samples_split': 8, 'min_samples_leaf': 4, 'subsample': 0.6268571746633383, 'max_features': None}. Best is trial 428 with value: 0.31740361133065975.
[I 2024-12-04 12:21:49,807] Trial 454 finished with value: 0.34000592100371535 and parameters: {'n_estimators': 951, 'learning_rate': 0.07015122193577468, 'max_depth': 6, 'min_samples_split': 6, 'min_samples_leaf': 2, 'subsample': 0.6569329260991837, 'max_features': None}. Best is trial 428 with value: 0.31740361133065975.
[I 2024-12-04 12:21:50,969] Trial 439 finished with value: 0.3642435820915001 and parameters: {'n_estimators': 1396, 'learning_rate': 0.06354098539401774, 'max_depth': 7, 'min_samples_split': 4, 'min_samples_leaf': 1, 'subsample': 0.6021996810323045, 'max_features': None}. Best is trial 428 with value: 0.31740361133065975.
[I 2024-12-04 12:21:51,464] Trial 441 finished with value: 0.3834534548190435 and parameters: {'n_estimators': 1329, 'learning_rate': 0.08570732286906693, 'max_depth': 8, 'min_samples_split': 11, 'min_samples_leaf': 1, 'subsample': 0.6865038733840944, 'max_features': None}. Best is trial 428 with value: 0.31740361133065975.
[I 2024-12-04 12:21:51,746] Trial 448 finished with value: 0.44372262339107865 and parameters: {'n_estimators': 1289, 'learning_rate': 0.07447051805357013, 'max_depth': 9, 'min_samples_split': 3, 'min_samples_leaf': 3, 'subsample': 0.6450396201945698, 'max_features': 'log2'}. Best is trial 428 with value: 0.31740361133065975.
[I 2024-12-04 12:21:52,032] Trial 442 finished with value: 0.33000193945353373 and parameters: {'n_estimators': 1307, 'learning_rate': 0.04678252761307041, 'max_depth': 7, 'min_samples_split': 5, 'min_samples_leaf': 2, 'subsample': 0.7101390798180172, 'max_features': None}. Best is trial 428 with value: 0.31740361133065975.
[I 2024-12-04 12:21:53,668] Trial 447 finished with value: 0.48794374354790626 and parameters: {'n_estimators': 1474, 'learning_rate': 0.04666252572378093, 'max_depth': 10, 'min_samples_split': 11, 'min_samples_leaf': 5, 'subsample': 0.6902208650596435, 'max_features': 'log2'}. Best is trial 428 with value: 0.31740361133065975.
[I 2024-12-04 12:21:54,013] Trial 444 finished with value: 0.35641865758652924 and parameters: {'n_estimators': 1330, 'learning_rate': 0.09065354372104241, 'max_depth': 5, 'min_samples_split': 10, 'min_samples_leaf': 2, 'subsample': 0.9276789248381565, 'max_features': None}. Best is trial 428 with value: 0.31740361133065975.
[I 2024-12-04 12:21:56,668] Trial 453 finished with value: 0.40935568208195355 and parameters: {'n_estimators': 1084, 'learning_rate': 0.07572933936531173, 'max_depth': 7, 'min_samples_split': 2, 'min_samples_leaf': 1, 'subsample': 0.8551370713660658, 'max_features': None}. Best is trial 428 with value: 0.31740361133065975.
[I 2024-12-04 12:21:56,669] Trial 445 finished with value: 0.3694399792856778 and parameters: {'n_estimators': 1337, 'learning_rate': 0.050452515927674524, 'max_depth': 8, 'min_samples_split': 11, 'min_samples_leaf': 3, 'subsample': 0.7038154342572918, 'max_features': None}. Best is trial 428 with value: 0.31740361133065975.
[I 2024-12-04 12:21:56,909] Trial 443 finished with value: 0.39348379593342375 and parameters: {'n_estimators': 1480, 'learning_rate': 0.031023952642606347, 'max_depth': 7, 'min_samples_split': 2, 'min_samples_leaf': 3, 'subsample': 0.6313844128156056, 'max_features': None}. Best is trial 428 with value: 0.31740361133065975.
[I 2024-12-04 12:21:58,107] Trial 458 finished with value: 0.40399441749738396 and parameters: {'n_estimators': 1215, 'learning_rate': 0.024337451523509718, 'max_depth': 10, 'min_samples_split': 2, 'min_samples_leaf': 2, 'subsample': 0.6498449609065082, 'max_features': 'sqrt'}. Best is trial 428 with value: 0.31740361133065975.
[I 2024-12-04 12:21:58,194] Trial 449 finished with value: 0.36204165938613914 and parameters: {'n_estimators': 1292, 'learning_rate': 0.052095713138015975, 'max_depth': 11, 'min_samples_split': 11, 'min_samples_leaf': 1, 'subsample': 0.6631098717197271, 'max_features': None}. Best is trial 428 with value: 0.31740361133065975.
[I 2024-12-04 12:21:59,926] Trial 463 finished with value: 0.3630866909621837 and parameters: {'n_estimators': 1078, 'learning_rate': 0.07632165477528242, 'max_depth': 8, 'min_samples_split': 5, 'min_samples_leaf': 1, 'subsample': 0.7163084863920486, 'max_features': 'sqrt'}. Best is trial 428 with value: 0.31740361133065975.
[I 2024-12-04 12:22:00,641] Trial 456 finished with value: 0.3769522576604724 and parameters: {'n_estimators': 1205, 'learning_rate': 0.02651218425564679, 'max_depth': 8, 'min_samples_split': 9, 'min_samples_leaf': 4, 'subsample': 0.671901327178446, 'max_features': None}. Best is trial 428 with value: 0.31740361133065975.
[I 2024-12-04 12:22:02,448] Trial 446 finished with value: 0.32598272360336056 and parameters: {'n_estimators': 1499, 'learning_rate': 0.06107907568972563, 'max_depth': 8, 'min_samples_split': 7, 'min_samples_leaf': 2, 'subsample': 0.7110204492116364, 'max_features': None}. Best is trial 428 with value: 0.31740361133065975.
[I 2024-12-04 12:22:03,608] Trial 459 finished with value: 0.36920697083824894 and parameters: {'n_estimators': 1196, 'learning_rate': 0.02974845035319221, 'max_depth': 10, 'min_samples_split': 20, 'min_samples_leaf': 3, 'subsample': 0.8640839288287967, 'max_features': None}. Best is trial 428 with value: 0.31740361133065975.
[I 2024-12-04 12:22:04,019] Trial 457 finished with value: 0.38319628981460907 and parameters: {'n_estimators': 1293, 'learning_rate': 0.09063308195151813, 'max_depth': 7, 'min_samples_split': 7, 'min_samples_leaf': 3, 'subsample': 0.8176536471849664, 'max_features': None}. Best is trial 428 with value: 0.31740361133065975.
[I 2024-12-04 12:22:04,329] Trial 461 finished with value: 0.34083703030502205 and parameters: {'n_estimators': 1060, 'learning_rate': 0.017300645053283107, 'max_depth': 11, 'min_samples_split': 5, 'min_samples_leaf': 2, 'subsample': 0.7313087930208128, 'max_features': None}. Best is trial 428 with value: 0.31740361133065975.
[I 2024-12-04 12:22:05,664] Trial 460 finished with value: 0.3874080415122791 and parameters: {'n_estimators': 1156, 'learning_rate': 0.06897116034829066, 'max_depth': 7, 'min_samples_split': 2, 'min_samples_leaf': 3, 'subsample': 0.6259307188679306, 'max_features': None}. Best is trial 428 with value: 0.31740361133065975.
[I 2024-12-04 12:22:06,539] Trial 451 finished with value: 0.36007527332011574 and parameters: {'n_estimators': 1497, 'learning_rate': 0.03927419245862065, 'max_depth': 9, 'min_samples_split': 14, 'min_samples_leaf': 4, 'subsample': 0.6873308428314776, 'max_features': None}. Best is trial 428 with value: 0.31740361133065975.
[I 2024-12-04 12:22:08,517] Trial 474 finished with value: 0.7971235075253493 and parameters: {'n_estimators': 636, 'learning_rate': 0.012988438096656769, 'max_depth': 11, 'min_samples_split': 2, 'min_samples_leaf': 4, 'subsample': 0.669783302723416, 'max_features': 'log2'}. Best is trial 428 with value: 0.31740361133065975.
[I 2024-12-04 12:22:08,537] Trial 464 finished with value: 0.3790417790899824 and parameters: {'n_estimators': 960, 'learning_rate': 0.045330331733607086, 'max_depth': 8, 'min_samples_split': 3, 'min_samples_leaf': 3, 'subsample': 0.747150677539654, 'max_features': None}. Best is trial 428 with value: 0.31740361133065975.
[I 2024-12-04 12:22:14,133] Trial 467 finished with value: 0.4129332233816102 and parameters: {'n_estimators': 1437, 'learning_rate': 0.04944891038945901, 'max_depth': 6, 'min_samples_split': 6, 'min_samples_leaf': 1, 'subsample': 0.6475304343773305, 'max_features': 'log2'}. Best is trial 428 with value: 0.31740361133065975.
[I 2024-12-04 12:22:15,417] Trial 471 finished with value: 0.3263236056760845 and parameters: {'n_estimators': 855, 'learning_rate': 0.0826002917704472, 'max_depth': 7, 'min_samples_split': 3, 'min_samples_leaf': 2, 'subsample': 0.7545012569446381, 'max_features': None}. Best is trial 428 with value: 0.31740361133065975.
[I 2024-12-04 12:22:16,472] Trial 470 finished with value: 0.3842022568371983 and parameters: {'n_estimators': 900, 'learning_rate': 0.08545430154447335, 'max_depth': 7, 'min_samples_split': 3, 'min_samples_leaf': 3, 'subsample': 0.8089271515152766, 'max_features': None}. Best is trial 428 with value: 0.31740361133065975.
