[I 2024-12-04 15:29:21,962] Trial 1719 finished with value: 0.4202296337523686 and parameters: {'n_estimators': 751, 'max_depth': 38, 'min_samples_split': 2, 'min_samples_leaf': 1, 'max_features': None, 'bootstrap': True, 'criterion': 'squared_error'}. Best is trial 1025 with value: 0.41844370194907604.
[I 2024-12-04 15:29:22,070] Trial 1713 finished with value: 0.46493471551253607 and parameters: {'n_estimators': 684, 'max_depth': 34, 'min_samples_split': 4, 'min_samples_leaf': 2, 'max_features': None, 'bootstrap': True, 'criterion': 'squared_error'}. Best is trial 1025 with value: 0.41844370194907604.
[I 2024-12-04 15:29:22,477] Trial 1722 finished with value: 0.41898398053926494 and parameters: {'n_estimators': 729, 'max_depth': 40, 'min_samples_split': 2, 'min_samples_leaf': 1, 'max_features': None, 'bootstrap': True, 'criterion': 'squared_error'}. Best is trial 1025 with value: 0.41844370194907604.
[I 2024-12-04 15:29:22,803] Trial 1712 finished with value: 0.7076702556871204 and parameters: {'n_estimators': 860, 'max_depth': 34, 'min_samples_split': 2, 'min_samples_leaf': 1, 'max_features': 'log2', 'bootstrap': True, 'criterion': 'absolute_error'}. Best is trial 1025 with value: 0.41844370194907604.
[I 2024-12-04 15:29:26,044] Trial 1718 finished with value: 0.4217472019837048 and parameters: {'n_estimators': 753, 'max_depth': 47, 'min_samples_split': 2, 'min_samples_leaf': 1, 'max_features': None, 'bootstrap': True, 'criterion': 'squared_error'}. Best is trial 1025 with value: 0.41844370194907604.
[I 2024-12-04 15:29:26,687] Trial 1725 finished with value: 0.43124421745281905 and parameters: {'n_estimators': 772, 'max_depth': 37, 'min_samples_split': 4, 'min_samples_leaf': 1, 'max_features': None, 'bootstrap': True, 'criterion': 'squared_error'}. Best is trial 1025 with value: 0.41844370194907604.
[I 2024-12-04 15:29:26,689] Trial 1724 finished with value: 0.4310023915324088 and parameters: {'n_estimators': 763, 'max_depth': 41, 'min_samples_split': 4, 'min_samples_leaf': 1, 'max_features': None, 'bootstrap': True, 'criterion': 'squared_error'}. Best is trial 1025 with value: 0.41844370194907604.
[I 2024-12-04 15:29:36,477] Trial 1727 finished with value: 0.421738446329953 and parameters: {'n_estimators': 753, 'max_depth': 42, 'min_samples_split': 2, 'min_samples_leaf': 1, 'max_features': None, 'bootstrap': True, 'criterion': 'squared_error'}. Best is trial 1025 with value: 0.41844370194907604.
[I 2024-12-04 15:29:37,406] Trial 1733 finished with value: 0.8158620586848765 and parameters: {'n_estimators': 519, 'max_depth': 10, 'min_samples_split': 10, 'min_samples_leaf': 1, 'max_features': 'sqrt', 'bootstrap': False, 'criterion': 'squared_error'}. Best is trial 1025 with value: 0.41844370194907604.
[I 2024-12-04 15:29:42,238] Trial 1732 finished with value: 0.42039586456267397 and parameters: {'n_estimators': 705, 'max_depth': 36, 'min_samples_split': 2, 'min_samples_leaf': 1, 'max_features': None, 'bootstrap': True, 'criterion': 'squared_error'}. Best is trial 1025 with value: 0.41844370194907604.
[I 2024-12-04 15:29:43,624] Trial 1726 finished with value: 0.46485664625132284 and parameters: {'n_estimators': 736, 'max_depth': 41, 'min_samples_split': 2, 'min_samples_leaf': 2, 'max_features': None, 'bootstrap': True, 'criterion': 'squared_error'}. Best is trial 1025 with value: 0.41844370194907604.
[I 2024-12-04 15:29:46,262] Trial 1736 finished with value: 0.41953577386057256 and parameters: {'n_estimators': 806, 'max_depth': 39, 'min_samples_split': 2, 'min_samples_leaf': 1, 'max_features': None, 'bootstrap': True, 'criterion': 'squared_error'}. Best is trial 1025 with value: 0.41844370194907604.
[I 2024-12-04 15:29:46,572] Trial 1734 finished with value: 0.4653290245424368 and parameters: {'n_estimators': 827, 'max_depth': 40, 'min_samples_split': 3, 'min_samples_leaf': 2, 'max_features': None, 'bootstrap': True, 'criterion': 'squared_error'}. Best is trial 1025 with value: 0.41844370194907604.
[I 2024-12-04 15:29:46,606] Trial 1730 finished with value: 0.44019937870683484 and parameters: {'n_estimators': 809, 'max_depth': 22, 'min_samples_split': 4, 'min_samples_leaf': 1, 'max_features': None, 'bootstrap': True, 'criterion': 'squared_error'}. Best is trial 1025 with value: 0.41844370194907604.
[I 2024-12-04 15:29:47,694] Trial 1741 finished with value: 0.4235964474323695 and parameters: {'n_estimators': 544, 'max_depth': 34, 'min_samples_split': 2, 'min_samples_leaf': 1, 'max_features': None, 'bootstrap': True, 'criterion': 'squared_error'}. Best is trial 1025 with value: 0.41844370194907604.
[I 2024-12-04 15:29:48,551] Trial 1714 finished with value: 0.7480515927196874 and parameters: {'n_estimators': 381, 'max_depth': 6, 'min_samples_split': 2, 'min_samples_leaf': 1, 'max_features': None, 'bootstrap': False, 'criterion': 'absolute_error'}. Best is trial 1025 with value: 0.41844370194907604.
[I 2024-12-04 15:29:48,708] Trial 1739 finished with value: 0.4237904985692915 and parameters: {'n_estimators': 532, 'max_depth': 42, 'min_samples_split': 2, 'min_samples_leaf': 1, 'max_features': None, 'bootstrap': True, 'criterion': 'squared_error'}. Best is trial 1025 with value: 0.41844370194907604.
[I 2024-12-04 15:29:48,917] Trial 1737 finished with value: 0.4207925868772394 and parameters: {'n_estimators': 589, 'max_depth': 41, 'min_samples_split': 2, 'min_samples_leaf': 1, 'max_features': None, 'bootstrap': True, 'criterion': 'squared_error'}. Best is trial 1025 with value: 0.41844370194907604.
[I 2024-12-04 15:29:49,164] Trial 1735 finished with value: 0.4649309936476603 and parameters: {'n_estimators': 857, 'max_depth': 35, 'min_samples_split': 4, 'min_samples_leaf': 2, 'max_features': None, 'bootstrap': True, 'criterion': 'squared_error'}. Best is trial 1025 with value: 0.41844370194907604.
[I 2024-12-04 15:29:49,877] Trial 1731 finished with value: 0.4325963205656858 and parameters: {'n_estimators': 817, 'max_depth': 33, 'min_samples_split': 4, 'min_samples_leaf': 1, 'max_features': None, 'bootstrap': True, 'criterion': 'squared_error'}. Best is trial 1025 with value: 0.41844370194907604.
[I 2024-12-04 15:29:51,192] Trial 1729 finished with value: 0.4218004492504351 and parameters: {'n_estimators': 792, 'max_depth': 35, 'min_samples_split': 2, 'min_samples_leaf': 1, 'max_features': None, 'bootstrap': True, 'criterion': 'squared_error'}. Best is trial 1025 with value: 0.41844370194907604.
[I 2024-12-04 15:29:51,770] Trial 1752 finished with value: 1.0345012172605226 and parameters: {'n_estimators': 796, 'max_depth': 5, 'min_samples_split': 2, 'min_samples_leaf': 4, 'max_features': 'log2', 'bootstrap': False, 'criterion': 'squared_error'}. Best is trial 1025 with value: 0.41844370194907604.
[I 2024-12-04 15:29:52,082] Trial 1738 finished with value: 0.42173116677156486 and parameters: {'n_estimators': 718, 'max_depth': 44, 'min_samples_split': 2, 'min_samples_leaf': 1, 'max_features': None, 'bootstrap': True, 'criterion': 'squared_error'}. Best is trial 1025 with value: 0.41844370194907604.
[I 2024-12-04 15:29:53,510] Trial 1745 finished with value: 0.42117016628784726 and parameters: {'n_estimators': 638, 'max_depth': 38, 'min_samples_split': 2, 'min_samples_leaf': 1, 'max_features': None, 'bootstrap': True, 'criterion': 'squared_error'}. Best is trial 1025 with value: 0.41844370194907604.
[I 2024-12-04 15:29:53,511] Trial 1740 finished with value: 0.46495042138202297 and parameters: {'n_estimators': 672, 'max_depth': 39, 'min_samples_split': 3, 'min_samples_leaf': 2, 'max_features': None, 'bootstrap': True, 'criterion': 'squared_error'}. Best is trial 1025 with value: 0.41844370194907604.
[I 2024-12-04 15:29:53,582] Trial 1742 finished with value: 0.420677283314501 and parameters: {'n_estimators': 692, 'max_depth': 39, 'min_samples_split': 2, 'min_samples_leaf': 1, 'max_features': None, 'bootstrap': True, 'criterion': 'squared_error'}. Best is trial 1025 with value: 0.41844370194907604.
[I 2024-12-04 15:29:54,303] Trial 1743 finished with value: 0.46500179273664 and parameters: {'n_estimators': 683, 'max_depth': 32, 'min_samples_split': 3, 'min_samples_leaf': 2, 'max_features': None, 'bootstrap': True, 'criterion': 'squared_error'}. Best is trial 1025 with value: 0.41844370194907604.
[I 2024-12-04 15:29:55,592] Trial 1748 finished with value: 0.5300191800523288 and parameters: {'n_estimators': 304, 'max_depth': 50, 'min_samples_split': 5, 'min_samples_leaf': 1, 'max_features': 'sqrt', 'bootstrap': False, 'criterion': 'absolute_error'}. Best is trial 1025 with value: 0.41844370194907604.
[I 2024-12-04 15:29:58,890] Trial 1746 finished with value: 0.46454846820247603 and parameters: {'n_estimators': 728, 'max_depth': 34, 'min_samples_split': 2, 'min_samples_leaf': 2, 'max_features': None, 'bootstrap': True, 'criterion': 'squared_error'}. Best is trial 1025 with value: 0.41844370194907604.
[I 2024-12-04 15:30:00,097] Trial 1747 finished with value: 0.4331796334308836 and parameters: {'n_estimators': 584, 'max_depth': 47, 'min_samples_split': 4, 'min_samples_leaf': 1, 'max_features': None, 'bootstrap': True, 'criterion': 'squared_error'}. Best is trial 1025 with value: 0.41844370194907604.
[I 2024-12-04 15:30:02,746] Trial 1758 finished with value: 1.0416748746430904 and parameters: {'n_estimators': 448, 'max_depth': 36, 'min_samples_split': 10, 'min_samples_leaf': 14, 'max_features': 'sqrt', 'bootstrap': True, 'criterion': 'squared_error'}. Best is trial 1025 with value: 0.41844370194907604.
[I 2024-12-04 15:30:05,075] Trial 1754 finished with value: 0.500498423830757 and parameters: {'n_estimators': 777, 'max_depth': 43, 'min_samples_split': 2, 'min_samples_leaf': 1, 'max_features': 'sqrt', 'bootstrap': True, 'criterion': 'squared_error'}. Best is trial 1025 with value: 0.41844370194907604.
[I 2024-12-04 15:30:05,576] Trial 1757 finished with value: 0.5720286384169374 and parameters: {'n_estimators': 965, 'max_depth': 28, 'min_samples_split': 6, 'min_samples_leaf': 2, 'max_features': None, 'bootstrap': False, 'criterion': 'squared_error'}. Best is trial 1025 with value: 0.41844370194907604.
[I 2024-12-04 15:30:06,182] Trial 1749 finished with value: 0.41896745136998864 and parameters: {'n_estimators': 716, 'max_depth': 41, 'min_samples_split': 2, 'min_samples_leaf': 1, 'max_features': None, 'bootstrap': True, 'criterion': 'squared_error'}. Best is trial 1025 with value: 0.41844370194907604.
[I 2024-12-04 15:30:07,558] Trial 1751 finished with value: 0.42426115637921585 and parameters: {'n_estimators': 735, 'max_depth': 45, 'min_samples_split': 3, 'min_samples_leaf': 1, 'max_features': None, 'bootstrap': True, 'criterion': 'squared_error'}. Best is trial 1025 with value: 0.41844370194907604.
[I 2024-12-04 15:30:08,331] Trial 1753 finished with value: 0.421859067427235 and parameters: {'n_estimators': 676, 'max_depth': 34, 'min_samples_split': 2, 'min_samples_leaf': 1, 'max_features': None, 'bootstrap': True, 'criterion': 'squared_error'}. Best is trial 1025 with value: 0.41844370194907604.
[I 2024-12-04 15:30:13,006] Trial 1755 finished with value: 0.43178754522394047 and parameters: {'n_estimators': 685, 'max_depth': 38, 'min_samples_split': 4, 'min_samples_leaf': 1, 'max_features': None, 'bootstrap': True, 'criterion': 'squared_error'}. Best is trial 1025 with value: 0.41844370194907604.
[I 2024-12-04 15:30:24,140] Trial 1750 finished with value: 0.4647497696210496 and parameters: {'n_estimators': 608, 'max_depth': 42, 'min_samples_split': 2, 'min_samples_leaf': 2, 'max_features': None, 'bootstrap': True, 'criterion': 'squared_error'}. Best is trial 1025 with value: 0.41844370194907604.
[I 2024-12-04 15:30:28,852] Trial 1759 finished with value: 0.421784060497075 and parameters: {'n_estimators': 717, 'max_depth': 44, 'min_samples_split': 2, 'min_samples_leaf': 1, 'max_features': None, 'bootstrap': True, 'criterion': 'squared_error'}. Best is trial 1025 with value: 0.41844370194907604.
[I 2024-12-04 15:30:29,139] Trial 1764 finished with value: 0.42091160943441314 and parameters: {'n_estimators': 704, 'max_depth': 34, 'min_samples_split': 2, 'min_samples_leaf': 1, 'max_features': None, 'bootstrap': True, 'criterion': 'squared_error'}. Best is trial 1025 with value: 0.41844370194907604.
[I 2024-12-04 15:30:29,592] Trial 1762 finished with value: 0.422027827389168 and parameters: {'n_estimators': 699, 'max_depth': 42, 'min_samples_split': 2, 'min_samples_leaf': 1, 'max_features': None, 'bootstrap': True, 'criterion': 'squared_error'}. Best is trial 1025 with value: 0.41844370194907604.
[I 2024-12-04 15:30:30,091] Trial 1763 finished with value: 0.4214535205554519 and parameters: {'n_estimators': 676, 'max_depth': 31, 'min_samples_split': 2, 'min_samples_leaf': 1, 'max_features': None, 'bootstrap': True, 'criterion': 'squared_error'}. Best is trial 1025 with value: 0.41844370194907604.
[I 2024-12-04 15:30:30,104] Trial 1760 finished with value: 0.4219465674041581 and parameters: {'n_estimators': 707, 'max_depth': 35, 'min_samples_split': 2, 'min_samples_leaf': 1, 'max_features': None, 'bootstrap': True, 'criterion': 'squared_error'}. Best is trial 1025 with value: 0.41844370194907604.
[I 2024-12-04 15:30:31,606] Trial 1770 finished with value: 0.7388964494230408 and parameters: {'n_estimators': 632, 'max_depth': 26, 'min_samples_split': 2, 'min_samples_leaf': 1, 'max_features': 'log2', 'bootstrap': True, 'criterion': 'squared_error'}. Best is trial 1025 with value: 0.41844370194907604.
[I 2024-12-04 15:30:32,020] Trial 1767 finished with value: 0.431835757883031 and parameters: {'n_estimators': 750, 'max_depth': 43, 'min_samples_split': 4, 'min_samples_leaf': 1, 'max_features': None, 'bootstrap': True, 'criterion': 'squared_error'}. Best is trial 1025 with value: 0.41844370194907604.
[I 2024-12-04 15:30:32,351] Trial 1769 finished with value: 0.421302340299384 and parameters: {'n_estimators': 775, 'max_depth': 45, 'min_samples_split': 2, 'min_samples_leaf': 1, 'max_features': None, 'bootstrap': True, 'criterion': 'squared_error'}. Best is trial 1025 with value: 0.41844370194907604.
[I 2024-12-04 15:30:32,379] Trial 1761 finished with value: 0.42014927757351067 and parameters: {'n_estimators': 744, 'max_depth': 38, 'min_samples_split': 2, 'min_samples_leaf': 1, 'max_features': None, 'bootstrap': True, 'criterion': 'squared_error'}. Best is trial 1025 with value: 0.41844370194907604.
[I 2024-12-04 15:30:32,387] Trial 1772 finished with value: 0.46492504499895937 and parameters: {'n_estimators': 694, 'max_depth': 47, 'min_samples_split': 2, 'min_samples_leaf': 2, 'max_features': None, 'bootstrap': True, 'criterion': 'squared_error'}. Best is trial 1025 with value: 0.41844370194907604.
[I 2024-12-04 15:30:32,412] Trial 1765 finished with value: 0.42384028641953697 and parameters: {'n_estimators': 796, 'max_depth': 41, 'min_samples_split': 3, 'min_samples_leaf': 1, 'max_features': None, 'bootstrap': True, 'criterion': 'squared_error'}. Best is trial 1025 with value: 0.41844370194907604.
[I 2024-12-04 15:30:32,765] Trial 1773 finished with value: 0.422468349750217 and parameters: {'n_estimators': 583, 'max_depth': 43, 'min_samples_split': 2, 'min_samples_leaf': 1, 'max_features': None, 'bootstrap': True, 'criterion': 'squared_error'}. Best is trial 1025 with value: 0.41844370194907604.
[I 2024-12-04 15:30:33,510] Trial 1776 finished with value: 0.42085891795067387 and parameters: {'n_estimators': 601, 'max_depth': 48, 'min_samples_split': 2, 'min_samples_leaf': 1, 'max_features': None, 'bootstrap': True, 'criterion': 'squared_error'}. Best is trial 1025 with value: 0.41844370194907604.
[I 2024-12-04 15:30:34,706] Trial 1768 finished with value: 0.5109579900041507 and parameters: {'n_estimators': 577, 'max_depth': 42, 'min_samples_split': 3, 'min_samples_leaf': 1, 'max_features': 'sqrt', 'bootstrap': True, 'criterion': 'squared_error'}. Best is trial 1025 with value: 0.41844370194907604.
[I 2024-12-04 15:30:34,953] Trial 1766 finished with value: 0.42072105048499514 and parameters: {'n_estimators': 754, 'max_depth': 43, 'min_samples_split': 2, 'min_samples_leaf': 1, 'max_features': None, 'bootstrap': True, 'criterion': 'squared_error'}. Best is trial 1025 with value: 0.41844370194907604.
[I 2024-12-04 15:30:35,047] Trial 1771 finished with value: 0.4234293058438201 and parameters: {'n_estimators': 763, 'max_depth': 37, 'min_samples_split': 3, 'min_samples_leaf': 1, 'max_features': None, 'bootstrap': True, 'criterion': 'squared_error'}. Best is trial 1025 with value: 0.41844370194907604.
[I 2024-12-04 15:30:36,072] Trial 1774 finished with value: 0.43330026038245273 and parameters: {'n_estimators': 566, 'max_depth': 37, 'min_samples_split': 4, 'min_samples_leaf': 1, 'max_features': None, 'bootstrap': True, 'criterion': 'squared_error'}. Best is trial 1025 with value: 0.41844370194907604.
[I 2024-12-04 15:30:37,291] Trial 1785 finished with value: 0.8654244658247897 and parameters: {'n_estimators': 630, 'max_depth': 26, 'min_samples_split': 4, 'min_samples_leaf': 4, 'max_features': 'sqrt', 'bootstrap': True, 'criterion': 'squared_error'}. Best is trial 1025 with value: 0.41844370194907604.
[I 2024-12-04 15:30:37,472] Trial 1777 finished with value: 0.6128986387250729 and parameters: {'n_estimators': 818, 'max_depth': 45, 'min_samples_split': 2, 'min_samples_leaf': 2, 'max_features': None, 'bootstrap': False, 'criterion': 'squared_error'}. Best is trial 1025 with value: 0.41844370194907604.
[I 2024-12-04 15:30:38,281] Trial 1775 finished with value: 0.41896745136998864 and parameters: {'n_estimators': 716, 'max_depth': 41, 'min_samples_split': 2, 'min_samples_leaf': 1, 'max_features': None, 'bootstrap': True, 'criterion': 'squared_error'}. Best is trial 1025 with value: 0.41844370194907604.
[I 2024-12-04 15:30:42,952] Trial 1781 finished with value: 0.4648439517154568 and parameters: {'n_estimators': 731, 'max_depth': 38, 'min_samples_split': 2, 'min_samples_leaf': 2, 'max_features': None, 'bootstrap': True, 'criterion': 'squared_error'}. Best is trial 1025 with value: 0.41844370194907604.
[I 2024-12-04 15:30:42,953] Trial 1780 finished with value: 0.6964779844831966 and parameters: {'n_estimators': 745, 'max_depth': 48, 'min_samples_split': 2, 'min_samples_leaf': 2, 'max_features': 'sqrt', 'bootstrap': True, 'criterion': 'squared_error'}. Best is trial 1025 with value: 0.41844370194907604.
[I 2024-12-04 15:30:42,996] Trial 1756 finished with value: 0.46160842400550645 and parameters: {'n_estimators': 593, 'max_depth': 40, 'min_samples_split': 2, 'min_samples_leaf': 2, 'max_features': None, 'bootstrap': True, 'criterion': 'absolute_error'}. Best is trial 1025 with value: 0.41844370194907604.
[I 2024-12-04 15:30:43,589] Trial 1779 finished with value: 0.46542748983895543 and parameters: {'n_estimators': 783, 'max_depth': 43, 'min_samples_split': 2, 'min_samples_leaf': 2, 'max_features': None, 'bootstrap': True, 'criterion': 'squared_error'}. Best is trial 1025 with value: 0.41844370194907604.
[I 2024-12-04 15:30:48,644] Trial 1778 finished with value: 0.596973059168649 and parameters: {'n_estimators': 357, 'max_depth': 32, 'min_samples_split': 5, 'min_samples_leaf': 1, 'max_features': 'sqrt', 'bootstrap': True, 'criterion': 'absolute_error'}. Best is trial 1025 with value: 0.41844370194907604.
[I 2024-12-04 15:30:51,057] Trial 1783 finished with value: 0.5273286592087583 and parameters: {'n_estimators': 665, 'max_depth': 42, 'min_samples_split': 2, 'min_samples_leaf': 1, 'max_features': None, 'bootstrap': False, 'criterion': 'squared_error'}. Best is trial 1025 with value: 0.41844370194907604.
[I 2024-12-04 15:30:54,687] Trial 1787 finished with value: 0.4243443357210302 and parameters: {'n_estimators': 761, 'max_depth': 42, 'min_samples_split': 3, 'min_samples_leaf': 1, 'max_features': None, 'bootstrap': True, 'criterion': 'squared_error'}. Best is trial 1025 with value: 0.41844370194907604.
[I 2024-12-04 15:30:56,786] Trial 1782 finished with value: 0.4312525651034047 and parameters: {'n_estimators': 774, 'max_depth': 50, 'min_samples_split': 4, 'min_samples_leaf': 1, 'max_features': None, 'bootstrap': True, 'criterion': 'squared_error'}. Best is trial 1025 with value: 0.41844370194907604.
[I 2024-12-04 15:30:57,985] Trial 1786 finished with value: 0.41874650258116564 and parameters: {'n_estimators': 771, 'max_depth': 40, 'min_samples_split': 2, 'min_samples_leaf': 1, 'max_features': None, 'bootstrap': True, 'criterion': 'squared_error'}. Best is trial 1025 with value: 0.41844370194907604.
[I 2024-12-04 15:31:02,420] Trial 1744 finished with value: 0.42998477478342606 and parameters: {'n_estimators': 674, 'max_depth': 38, 'min_samples_split': 3, 'min_samples_leaf': 1, 'max_features': None, 'bootstrap': True, 'criterion': 'absolute_error'}. Best is trial 1025 with value: 0.41844370194907604.
[I 2024-12-04 15:31:04,291] Trial 1799 finished with value: 0.591848466944533 and parameters: {'n_estimators': 624, 'max_depth': 48, 'min_samples_split': 2, 'min_samples_leaf': 1, 'max_features': 'log2', 'bootstrap': True, 'criterion': 'squared_error'}. Best is trial 1025 with value: 0.41844370194907604.
[I 2024-12-04 15:31:07,871] Trial 1790 finished with value: 0.4195846903024833 and parameters: {'n_estimators': 680, 'max_depth': 40, 'min_samples_split': 2, 'min_samples_leaf': 1, 'max_features': None, 'bootstrap': True, 'criterion': 'squared_error'}. Best is trial 1025 with value: 0.41844370194907604.
[I 2024-12-04 15:31:09,456] Trial 1801 finished with value: 0.6283721809485643 and parameters: {'n_estimators': 764, 'max_depth': 40, 'min_samples_split': 2, 'min_samples_leaf': 1, 'max_features': 'log2', 'bootstrap': True, 'criterion': 'squared_error'}. Best is trial 1025 with value: 0.41844370194907604.
