[I 2024-12-04 11:55:33,248] Trial 687 finished with value: 0.6481536807148809 and parameters: {'max_depth': 29, 'min_samples_split': 4, 'min_samples_leaf': 1, 'max_features': 'sqrt', 'criterion': 'squared_error', 'splitter': 'best'}. Best is trial 368 with value: 0.6055877317086851.
[I 2024-12-04 11:55:34,347] Trial 699 finished with value: 0.8266069286848198 and parameters: {'max_depth': 35, 'min_samples_split': 10, 'min_samples_leaf': 2, 'max_features': 'sqrt', 'criterion': 'friedman_mse', 'splitter': 'best'}. Best is trial 368 with value: 0.6055877317086851.
[I 2024-12-04 11:55:34,719] Trial 702 finished with value: 0.8241861685151659 and parameters: {'max_depth': 28, 'min_samples_split': 3, 'min_samples_leaf': 2, 'max_features': 'sqrt', 'criterion': 'squared_error', 'splitter': 'best'}. Best is trial 368 with value: 0.6055877317086851.
[I 2024-12-04 11:55:34,824] Trial 697 finished with value: 0.9051828340522402 and parameters: {'max_depth': 10, 'min_samples_split': 10, 'min_samples_leaf': 3, 'max_features': 'sqrt', 'criterion': 'squared_error', 'splitter': 'random'}. Best is trial 368 with value: 0.6055877317086851.
[I 2024-12-04 11:55:35,038] Trial 703 finished with value: 0.6168491636226803 and parameters: {'max_depth': 33, 'min_samples_split': 7, 'min_samples_leaf': 1, 'max_features': 'sqrt', 'criterion': 'squared_error', 'splitter': 'best'}. Best is trial 368 with value: 0.6055877317086851.
[I 2024-12-04 11:55:35,960] Trial 694 finished with value: 0.7271069002219231 and parameters: {'max_depth': 33, 'min_samples_split': 5, 'min_samples_leaf': 1, 'max_features': 'sqrt', 'criterion': 'squared_error', 'splitter': 'best'}. Best is trial 368 with value: 0.6055877317086851.
[I 2024-12-04 11:55:36,083] Trial 692 finished with value: 1.0889499681006756 and parameters: {'max_depth': 4, 'min_samples_split': 17, 'min_samples_leaf': 2, 'max_features': 'log2', 'criterion': 'friedman_mse', 'splitter': 'random'}. Best is trial 368 with value: 0.6055877317086851.
[I 2024-12-04 11:55:36,336] Trial 706 finished with value: 0.658104097326617 and parameters: {'max_depth': 29, 'min_samples_split': 8, 'min_samples_leaf': 1, 'max_features': 'sqrt', 'criterion': 'squared_error', 'splitter': 'best'}. Best is trial 368 with value: 0.6055877317086851.
[I 2024-12-04 11:55:36,732] Trial 705 finished with value: 0.6619865771466347 and parameters: {'max_depth': 29, 'min_samples_split': 3, 'min_samples_leaf': 1, 'max_features': 'sqrt', 'criterion': 'squared_error', 'splitter': 'best'}. Best is trial 368 with value: 0.6055877317086851.
[I 2024-12-04 11:55:37,270] Trial 701 finished with value: 0.6548912683909761 and parameters: {'max_depth': 29, 'min_samples_split': 5, 'min_samples_leaf': 1, 'max_features': 'sqrt', 'criterion': 'squared_error', 'splitter': 'best'}. Best is trial 368 with value: 0.6055877317086851.
[I 2024-12-04 11:55:38,237] Trial 713 finished with value: 0.8131482590578788 and parameters: {'max_depth': 25, 'min_samples_split': 10, 'min_samples_leaf': 3, 'max_features': 'sqrt', 'criterion': 'friedman_mse', 'splitter': 'best'}. Best is trial 368 with value: 0.6055877317086851.
[I 2024-12-04 11:55:38,336] Trial 691 finished with value: 0.8225022089543504 and parameters: {'max_depth': 26, 'min_samples_split': 6, 'min_samples_leaf': 2, 'max_features': 'sqrt', 'criterion': 'squared_error', 'splitter': 'best'}. Best is trial 368 with value: 0.6055877317086851.
[I 2024-12-04 11:55:38,402] Trial 700 finished with value: 0.8266069286848198 and parameters: {'max_depth': 35, 'min_samples_split': 9, 'min_samples_leaf': 2, 'max_features': 'sqrt', 'criterion': 'squared_error', 'splitter': 'best'}. Best is trial 368 with value: 0.6055877317086851.
[I 2024-12-04 11:55:38,559] Trial 717 finished with value: 0.6897370689523286 and parameters: {'max_depth': 34, 'min_samples_split': 10, 'min_samples_leaf': 1, 'max_features': 'sqrt', 'criterion': 'squared_error', 'splitter': 'best'}. Best is trial 368 with value: 0.6055877317086851.
[I 2024-12-04 11:55:38,996] Trial 707 finished with value: 1.0816149376799358 and parameters: {'max_depth': 33, 'min_samples_split': 7, 'min_samples_leaf': 6, 'max_features': 'sqrt', 'criterion': 'squared_error', 'splitter': 'random'}. Best is trial 368 with value: 0.6055877317086851.
[I 2024-12-04 11:55:39,292] Trial 719 finished with value: 1.0909840109486761 and parameters: {'max_depth': 27, 'min_samples_split': 12, 'min_samples_leaf': 5, 'max_features': 'log2', 'criterion': 'friedman_mse', 'splitter': 'random'}. Best is trial 368 with value: 0.6055877317086851.
[I 2024-12-04 11:55:39,680] Trial 704 finished with value: 0.8241861685151659 and parameters: {'max_depth': 34, 'min_samples_split': 4, 'min_samples_leaf': 2, 'max_features': 'sqrt', 'criterion': 'squared_error', 'splitter': 'best'}. Best is trial 368 with value: 0.6055877317086851.
[I 2024-12-04 11:55:39,761] Trial 708 finished with value: 0.7242053946898249 and parameters: {'max_depth': 30, 'min_samples_split': 7, 'min_samples_leaf': 1, 'max_features': 'sqrt', 'criterion': 'squared_error', 'splitter': 'best'}. Best is trial 368 with value: 0.6055877317086851.
[I 2024-12-04 11:55:40,353] Trial 711 finished with value: 1.0909840109486761 and parameters: {'max_depth': 15, 'min_samples_split': 19, 'min_samples_leaf': 6, 'max_features': 'log2', 'criterion': 'squared_error', 'splitter': 'random'}. Best is trial 368 with value: 0.6055877317086851.
[I 2024-12-04 11:55:40,745] Trial 710 finished with value: 0.7987748637010382 and parameters: {'max_depth': 29, 'min_samples_split': 7, 'min_samples_leaf': 3, 'max_features': 'sqrt', 'criterion': 'squared_error', 'splitter': 'best'}. Best is trial 368 with value: 0.6055877317086851.
[I 2024-12-04 11:55:40,896] Trial 714 finished with value: 0.8131482590578788 and parameters: {'max_depth': 26, 'min_samples_split': 10, 'min_samples_leaf': 3, 'max_features': 'sqrt', 'criterion': 'squared_error', 'splitter': 'best'}. Best is trial 368 with value: 0.6055877317086851.
[I 2024-12-04 11:55:41,019] Trial 709 finished with value: 0.7044023234155515 and parameters: {'max_depth': 35, 'min_samples_split': 2, 'min_samples_leaf': 1, 'max_features': 'sqrt', 'criterion': 'squared_error', 'splitter': 'best'}. Best is trial 368 with value: 0.6055877317086851.
[I 2024-12-04 11:55:41,219] Trial 715 finished with value: 0.8056989539390975 and parameters: {'max_depth': 28, 'min_samples_split': 8, 'min_samples_leaf': 3, 'max_features': 'sqrt', 'criterion': 'squared_error', 'splitter': 'best'}. Best is trial 368 with value: 0.6055877317086851.
[I 2024-12-04 11:55:41,455] Trial 720 finished with value: 0.6460053267613093 and parameters: {'max_depth': 33, 'min_samples_split': 6, 'min_samples_leaf': 1, 'max_features': 'sqrt', 'criterion': 'squared_error', 'splitter': 'best'}. Best is trial 368 with value: 0.6055877317086851.
[I 2024-12-04 11:55:41,966] Trial 718 finished with value: 0.6871396815024795 and parameters: {'max_depth': 35, 'min_samples_split': 8, 'min_samples_leaf': 1, 'max_features': 'log2', 'criterion': 'friedman_mse', 'splitter': 'best'}. Best is trial 368 with value: 0.6055877317086851.
[I 2024-12-04 11:55:42,310] Trial 688 finished with value: 0.8155592466194738 and parameters: {'max_depth': 25, 'min_samples_split': 12, 'min_samples_leaf': 1, 'max_features': 'sqrt', 'criterion': 'friedman_mse', 'splitter': 'random'}. Best is trial 368 with value: 0.6055877317086851.
[I 2024-12-04 11:55:42,745] Trial 721 finished with value: 1.092723027538113 and parameters: {'max_depth': 30, 'min_samples_split': 8, 'min_samples_leaf': 10, 'max_features': 'log2', 'criterion': 'friedman_mse', 'splitter': 'random'}. Best is trial 368 with value: 0.6055877317086851.
[I 2024-12-04 11:55:42,905] Trial 726 finished with value: 0.6893071375758707 and parameters: {'max_depth': 33, 'min_samples_split': 8, 'min_samples_leaf': 1, 'max_features': 'sqrt', 'criterion': 'squared_error', 'splitter': 'best'}. Best is trial 368 with value: 0.6055877317086851.
[I 2024-12-04 11:55:43,000] Trial 727 finished with value: 0.8101385948198155 and parameters: {'max_depth': 31, 'min_samples_split': 5, 'min_samples_leaf': 3, 'max_features': 'sqrt', 'criterion': 'squared_error', 'splitter': 'best'}. Best is trial 368 with value: 0.6055877317086851.
[I 2024-12-04 11:55:43,003] Trial 723 finished with value: 0.6935908088501267 and parameters: {'max_depth': 35, 'min_samples_split': 10, 'min_samples_leaf': 1, 'max_features': 'sqrt', 'criterion': 'friedman_mse', 'splitter': 'best'}. Best is trial 368 with value: 0.6055877317086851.
[I 2024-12-04 11:55:43,133] Trial 712 finished with value: 0.8125271942876539 and parameters: {'max_depth': 35, 'min_samples_split': 11, 'min_samples_leaf': 3, 'max_features': 'sqrt', 'criterion': 'friedman_mse', 'splitter': 'best'}. Best is trial 368 with value: 0.6055877317086851.
[I 2024-12-04 11:55:43,721] Trial 724 finished with value: 0.6893071375758707 and parameters: {'max_depth': 33, 'min_samples_split': 8, 'min_samples_leaf': 1, 'max_features': 'sqrt', 'criterion': 'friedman_mse', 'splitter': 'best'}. Best is trial 368 with value: 0.6055877317086851.
[I 2024-12-04 11:55:43,764] Trial 732 finished with value: 0.6379386941389483 and parameters: {'max_depth': 34, 'min_samples_split': 12, 'min_samples_leaf': 1, 'max_features': 'sqrt', 'criterion': 'squared_error', 'splitter': 'best'}. Best is trial 368 with value: 0.6055877317086851.
[I 2024-12-04 11:55:44,119] Trial 728 finished with value: 1.0753381761853185 and parameters: {'max_depth': 7, 'min_samples_split': 11, 'min_samples_leaf': 8, 'max_features': 'log2', 'criterion': 'absolute_error', 'splitter': 'random'}. Best is trial 368 with value: 0.6055877317086851.
[I 2024-12-04 11:55:44,196] Trial 716 finished with value: 0.676636829282285 and parameters: {'max_depth': 35, 'min_samples_split': 6, 'min_samples_leaf': 1, 'max_features': 'sqrt', 'criterion': 'squared_error', 'splitter': 'best'}. Best is trial 368 with value: 0.6055877317086851.
[I 2024-12-04 11:55:46,464] Trial 730 finished with value: 0.6774751628355143 and parameters: {'max_depth': 29, 'min_samples_split': 11, 'min_samples_leaf': 1, 'max_features': 'sqrt', 'criterion': 'friedman_mse', 'splitter': 'best'}. Best is trial 368 with value: 0.6055877317086851.
[I 2024-12-04 11:55:46,498] Trial 725 finished with value: 1.0737980062946832 and parameters: {'max_depth': 15, 'min_samples_split': 8, 'min_samples_leaf': 2, 'max_features': 'log2', 'criterion': 'absolute_error', 'splitter': 'random'}. Best is trial 368 with value: 0.6055877317086851.
[I 2024-12-04 11:55:46,903] Trial 731 finished with value: 0.7318251625114702 and parameters: {'max_depth': 28, 'min_samples_split': 11, 'min_samples_leaf': 1, 'max_features': 'sqrt', 'criterion': 'friedman_mse', 'splitter': 'best'}. Best is trial 368 with value: 0.6055877317086851.
[I 2024-12-04 11:55:47,633] Trial 734 finished with value: 1.092723027538113 and parameters: {'max_depth': 14, 'min_samples_split': 3, 'min_samples_leaf': 9, 'max_features': 'log2', 'criterion': 'squared_error', 'splitter': 'random'}. Best is trial 368 with value: 0.6055877317086851.
[I 2024-12-04 11:55:47,733] Trial 729 finished with value: 0.8101385948198155 and parameters: {'max_depth': 28, 'min_samples_split': 3, 'min_samples_leaf': 3, 'max_features': 'sqrt', 'criterion': 'squared_error', 'splitter': 'best'}. Best is trial 368 with value: 0.6055877317086851.
[I 2024-12-04 11:55:47,780] Trial 740 finished with value: 0.8131482590578788 and parameters: {'max_depth': 29, 'min_samples_split': 10, 'min_samples_leaf': 3, 'max_features': 'sqrt', 'criterion': 'friedman_mse', 'splitter': 'best'}. Best is trial 368 with value: 0.6055877317086851.
[I 2024-12-04 11:55:48,376] Trial 738 finished with value: 0.6789669071314235 and parameters: {'max_depth': 31, 'min_samples_split': 10, 'min_samples_leaf': 1, 'max_features': 'sqrt', 'criterion': 'friedman_mse', 'splitter': 'best'}. Best is trial 368 with value: 0.6055877317086851.
[I 2024-12-04 11:55:48,899] Trial 739 finished with value: 0.75038357711146 and parameters: {'max_depth': 35, 'min_samples_split': 9, 'min_samples_leaf': 1, 'max_features': 'sqrt', 'criterion': 'absolute_error', 'splitter': 'best'}. Best is trial 368 with value: 0.6055877317086851.
[I 2024-12-04 11:55:50,024] Trial 745 finished with value: 0.8056989539390975 and parameters: {'max_depth': 35, 'min_samples_split': 8, 'min_samples_leaf': 3, 'max_features': 'sqrt', 'criterion': 'friedman_mse', 'splitter': 'best'}. Best is trial 368 with value: 0.6055877317086851.
[I 2024-12-04 11:55:50,238] Trial 737 finished with value: 0.8266069286848198 and parameters: {'max_depth': 35, 'min_samples_split': 9, 'min_samples_leaf': 2, 'max_features': 'sqrt', 'criterion': 'friedman_mse', 'splitter': 'best'}. Best is trial 368 with value: 0.6055877317086851.
[I 2024-12-04 11:55:50,242] Trial 735 finished with value: 0.6657045440033218 and parameters: {'max_depth': 35, 'min_samples_split': 12, 'min_samples_leaf': 1, 'max_features': 'sqrt', 'criterion': 'friedman_mse', 'splitter': 'best'}. Best is trial 368 with value: 0.6055877317086851.
[I 2024-12-04 11:55:50,302] Trial 741 finished with value: 0.8105579954451577 and parameters: {'max_depth': 35, 'min_samples_split': 12, 'min_samples_leaf': 3, 'max_features': 'sqrt', 'criterion': 'friedman_mse', 'splitter': 'best'}. Best is trial 368 with value: 0.6055877317086851.
[I 2024-12-04 11:55:50,644] Trial 733 finished with value: 0.7138190412335051 and parameters: {'max_depth': 22, 'min_samples_split': 11, 'min_samples_leaf': 1, 'max_features': 'sqrt', 'criterion': 'friedman_mse', 'splitter': 'best'}. Best is trial 368 with value: 0.6055877317086851.
[I 2024-12-04 11:55:50,954] Trial 742 finished with value: 1.0575494527178286 and parameters: {'max_depth': 4, 'min_samples_split': 16, 'min_samples_leaf': 10, 'max_features': 'sqrt', 'criterion': 'squared_error', 'splitter': 'best'}. Best is trial 368 with value: 0.6055877317086851.
[I 2024-12-04 11:55:51,272] Trial 747 finished with value: 0.6570109226401653 and parameters: {'max_depth': 35, 'min_samples_split': 11, 'min_samples_leaf': 1, 'max_features': 'sqrt', 'criterion': 'squared_error', 'splitter': 'best'}. Best is trial 368 with value: 0.6055877317086851.
[I 2024-12-04 11:55:51,541] Trial 746 finished with value: 0.825562298787238 and parameters: {'max_depth': 27, 'min_samples_split': 13, 'min_samples_leaf': 3, 'max_features': 'sqrt', 'criterion': 'friedman_mse', 'splitter': 'best'}. Best is trial 368 with value: 0.6055877317086851.
[I 2024-12-04 11:55:51,744] Trial 754 finished with value: 0.864825587828492 and parameters: {'max_depth': 24, 'min_samples_split': 9, 'min_samples_leaf': 1, 'max_features': 'log2', 'criterion': 'absolute_error', 'splitter': 'best'}. Best is trial 368 with value: 0.6055877317086851.
[I 2024-12-04 11:55:51,819] Trial 744 finished with value: 0.7242053946898249 and parameters: {'max_depth': 30, 'min_samples_split': 7, 'min_samples_leaf': 1, 'max_features': 'sqrt', 'criterion': 'squared_error', 'splitter': 'best'}. Best is trial 368 with value: 0.6055877317086851.
[I 2024-12-04 11:55:51,821] Trial 749 finished with value: 0.676636829282285 and parameters: {'max_depth': 35, 'min_samples_split': 6, 'min_samples_leaf': 1, 'max_features': 'sqrt', 'criterion': 'friedman_mse', 'splitter': 'best'}. Best is trial 368 with value: 0.6055877317086851.
[I 2024-12-04 11:55:52,181] Trial 736 finished with value: 1.0816149376799358 and parameters: {'max_depth': 35, 'min_samples_split': 13, 'min_samples_leaf': 7, 'max_features': 'sqrt', 'criterion': 'friedman_mse', 'splitter': 'random'}. Best is trial 368 with value: 0.6055877317086851.
[I 2024-12-04 11:55:52,184] Trial 755 finished with value: 0.7114266712285047 and parameters: {'max_depth': 29, 'min_samples_split': 10, 'min_samples_leaf': 1, 'max_features': 'sqrt', 'criterion': 'friedman_mse', 'splitter': 'best'}. Best is trial 368 with value: 0.6055877317086851.
[I 2024-12-04 11:55:52,207] Trial 753 finished with value: 0.6945768284293156 and parameters: {'max_depth': 35, 'min_samples_split': 9, 'min_samples_leaf': 1, 'max_features': 'sqrt', 'criterion': 'friedman_mse', 'splitter': 'best'}. Best is trial 368 with value: 0.6055877317086851.
[I 2024-12-04 11:55:52,794] Trial 743 finished with value: 0.8098314010610103 and parameters: {'max_depth': 24, 'min_samples_split': 12, 'min_samples_leaf': 3, 'max_features': 'sqrt', 'criterion': 'friedman_mse', 'splitter': 'best'}. Best is trial 368 with value: 0.6055877317086851.
[I 2024-12-04 11:55:53,414] Trial 752 finished with value: 0.6789802738421568 and parameters: {'max_depth': 35, 'min_samples_split': 13, 'min_samples_leaf': 1, 'max_features': 'sqrt', 'criterion': 'friedman_mse', 'splitter': 'best'}. Best is trial 368 with value: 0.6055877317086851.
[I 2024-12-04 11:55:53,448] Trial 722 finished with value: 0.6369615919324941 and parameters: {'max_depth': 33, 'min_samples_split': 11, 'min_samples_leaf': 1, 'max_features': 'sqrt', 'criterion': 'friedman_mse', 'splitter': 'best'}. Best is trial 368 with value: 0.6055877317086851.
[I 2024-12-04 11:55:54,773] Trial 748 finished with value: 0.59023342761678 and parameters: {'max_depth': 35, 'min_samples_split': 4, 'min_samples_leaf': 1, 'max_features': 'sqrt', 'criterion': 'squared_error', 'splitter': 'best'}. Best is trial 748 with value: 0.59023342761678.
[I 2024-12-04 11:55:54,953] Trial 761 finished with value: 0.8266069286848198 and parameters: {'max_depth': 28, 'min_samples_split': 9, 'min_samples_leaf': 2, 'max_features': 'sqrt', 'criterion': 'friedman_mse', 'splitter': 'best'}. Best is trial 748 with value: 0.59023342761678.
[I 2024-12-04 11:55:55,291] Trial 750 finished with value: 0.7114266712285047 and parameters: {'max_depth': 29, 'min_samples_split': 10, 'min_samples_leaf': 1, 'max_features': 'sqrt', 'criterion': 'friedman_mse', 'splitter': 'best'}. Best is trial 748 with value: 0.59023342761678.
[I 2024-12-04 11:55:55,569] Trial 760 finished with value: 0.8225022089543504 and parameters: {'max_depth': 19, 'min_samples_split': 6, 'min_samples_leaf': 2, 'max_features': 'sqrt', 'criterion': 'squared_error', 'splitter': 'best'}. Best is trial 748 with value: 0.59023342761678.
[I 2024-12-04 11:55:55,906] Trial 756 finished with value: 0.7460534600209753 and parameters: {'max_depth': 24, 'min_samples_split': 8, 'min_samples_leaf': 1, 'max_features': 'sqrt', 'criterion': 'squared_error', 'splitter': 'best'}. Best is trial 748 with value: 0.59023342761678.
[I 2024-12-04 11:55:56,849] Trial 759 finished with value: 1.0816149376799358 and parameters: {'max_depth': 3, 'min_samples_split': 5, 'min_samples_leaf': 10, 'max_features': 'sqrt', 'criterion': 'squared_error', 'splitter': 'random'}. Best is trial 748 with value: 0.59023342761678.
[I 2024-12-04 11:55:56,851] Trial 765 finished with value: 0.8241861685151659 and parameters: {'max_depth': 33, 'min_samples_split': 4, 'min_samples_leaf': 2, 'max_features': 'sqrt', 'criterion': 'squared_error', 'splitter': 'best'}. Best is trial 748 with value: 0.59023342761678.
[I 2024-12-04 11:55:57,182] Trial 751 finished with value: 0.7155658808975296 and parameters: {'max_depth': 35, 'min_samples_split': 17, 'min_samples_leaf': 1, 'max_features': 'sqrt', 'criterion': 'squared_error', 'splitter': 'best'}. Best is trial 748 with value: 0.59023342761678.
[I 2024-12-04 11:55:58,225] Trial 757 finished with value: 0.7201117731780649 and parameters: {'max_depth': 34, 'min_samples_split': 5, 'min_samples_leaf': 1, 'max_features': 'log2', 'criterion': 'squared_error', 'splitter': 'best'}. Best is trial 748 with value: 0.59023342761678.
[I 2024-12-04 11:55:59,264] Trial 778 finished with value: 0.5980192198974836 and parameters: {'max_depth': 33, 'min_samples_split': 2, 'min_samples_leaf': 1, 'max_features': 'sqrt', 'criterion': 'squared_error', 'splitter': 'best'}. Best is trial 748 with value: 0.59023342761678.
[I 2024-12-04 11:55:59,265] Trial 762 finished with value: 0.7722845288492907 and parameters: {'max_depth': 30, 'min_samples_split': 8, 'min_samples_leaf': 1, 'max_features': 'sqrt', 'criterion': 'squared_error', 'splitter': 'best'}. Best is trial 748 with value: 0.59023342761678.
[I 2024-12-04 11:55:59,293] Trial 772 finished with value: 0.8241861685151659 and parameters: {'max_depth': 34, 'min_samples_split': 2, 'min_samples_leaf': 2, 'max_features': 'sqrt', 'criterion': 'squared_error', 'splitter': 'best'}. Best is trial 748 with value: 0.59023342761678.
[I 2024-12-04 11:55:59,668] Trial 769 finished with value: 0.7893318859106303 and parameters: {'max_depth': 28, 'min_samples_split': 3, 'min_samples_leaf': 1, 'max_features': 'sqrt', 'criterion': 'squared_error', 'splitter': 'best'}. Best is trial 748 with value: 0.59023342761678.
[I 2024-12-04 11:55:59,835] Trial 773 finished with value: 0.8350385818246564 and parameters: {'max_depth': 25, 'min_samples_split': 5, 'min_samples_leaf': 2, 'max_features': 'sqrt', 'criterion': 'absolute_error', 'splitter': 'best'}. Best is trial 748 with value: 0.59023342761678.
[I 2024-12-04 11:55:59,862] Trial 767 finished with value: 1.0816149376799358 and parameters: {'max_depth': 30, 'min_samples_split': 6, 'min_samples_leaf': 6, 'max_features': 'sqrt', 'criterion': 'friedman_mse', 'splitter': 'random'}. Best is trial 748 with value: 0.59023342761678.
[I 2024-12-04 11:56:00,486] Trial 775 finished with value: 0.8391355810268111 and parameters: {'max_depth': 30, 'min_samples_split': 8, 'min_samples_leaf': 2, 'max_features': 'sqrt', 'criterion': 'friedman_mse', 'splitter': 'best'}. Best is trial 748 with value: 0.59023342761678.
[I 2024-12-04 11:56:00,869] Trial 768 finished with value: 0.8101385948198155 and parameters: {'max_depth': 26, 'min_samples_split': 3, 'min_samples_leaf': 3, 'max_features': 'sqrt', 'criterion': 'squared_error', 'splitter': 'best'}. Best is trial 748 with value: 0.59023342761678.
