[I 2024-12-04 13:02:54,338] Trial 1343 finished with value: 0.4870997564928468 and parameters: {'n_estimators': 907, 'learning_rate': 0.015309088728897344, 'max_depth': 5, 'min_samples_split': 16, 'min_samples_leaf': 10, 'subsample': 0.8013318302775925, 'max_features': None}. Best is trial 621 with value: 0.2256726988932517.
[I 2024-12-04 13:02:56,866] Trial 1356 finished with value: 0.9001017757355118 and parameters: {'n_estimators': 481, 'learning_rate': 0.057604113415150225, 'max_depth': 12, 'min_samples_split': 19, 'min_samples_leaf': 10, 'subsample': 0.8011045642195932, 'max_features': 'log2'}. Best is trial 621 with value: 0.2256726988932517.
[I 2024-12-04 13:03:00,773] Trial 1331 finished with value: 0.4307420087601343 and parameters: {'n_estimators': 1364, 'learning_rate': 0.012180972917540743, 'max_depth': 12, 'min_samples_split': 18, 'min_samples_leaf': 4, 'subsample': 0.8615779013404381, 'max_features': None}. Best is trial 621 with value: 0.2256726988932517.
[I 2024-12-04 13:03:11,109] Trial 1342 finished with value: 0.249118154033056 and parameters: {'n_estimators': 1273, 'learning_rate': 0.0410119885067952, 'max_depth': 7, 'min_samples_split': 3, 'min_samples_leaf': 1, 'subsample': 0.6580079679240355, 'max_features': 'sqrt'}. Best is trial 621 with value: 0.2256726988932517.
[I 2024-12-04 13:03:12,961] Trial 1339 finished with value: 0.3689421919766503 and parameters: {'n_estimators': 1466, 'learning_rate': 0.07565873899703288, 'max_depth': 9, 'min_samples_split': 3, 'min_samples_leaf': 3, 'subsample': 0.653918528193935, 'max_features': 'sqrt'}. Best is trial 621 with value: 0.2256726988932517.
[I 2024-12-04 13:03:14,725] Trial 1340 finished with value: 0.4500711611179514 and parameters: {'n_estimators': 1465, 'learning_rate': 0.010521788064020751, 'max_depth': 7, 'min_samples_split': 20, 'min_samples_leaf': 6, 'subsample': 0.7040817033997205, 'max_features': 'sqrt'}. Best is trial 621 with value: 0.2256726988932517.
[I 2024-12-04 13:03:19,836] Trial 1347 finished with value: 0.24372497556891506 and parameters: {'n_estimators': 1285, 'learning_rate': 0.06330689971359918, 'max_depth': 10, 'min_samples_split': 4, 'min_samples_leaf': 1, 'subsample': 0.6010876005963642, 'max_features': 'sqrt'}. Best is trial 621 with value: 0.2256726988932517.
[I 2024-12-04 13:03:20,951] Trial 1341 finished with value: 0.39783880114853143 and parameters: {'n_estimators': 1486, 'learning_rate': 0.05798626023362704, 'max_depth': 12, 'min_samples_split': 9, 'min_samples_leaf': 7, 'subsample': 0.8872272363697424, 'max_features': 'sqrt'}. Best is trial 621 with value: 0.2256726988932517.
[I 2024-12-04 13:03:22,565] Trial 1357 finished with value: 0.5058857050376271 and parameters: {'n_estimators': 907, 'learning_rate': 0.012408625292170475, 'max_depth': 5, 'min_samples_split': 20, 'min_samples_leaf': 1, 'subsample': 0.9946434676842149, 'max_features': 'sqrt'}. Best is trial 621 with value: 0.2256726988932517.
[I 2024-12-04 13:03:24,543] Trial 1348 finished with value: 0.2655606379306389 and parameters: {'n_estimators': 1231, 'learning_rate': 0.07920055991998308, 'max_depth': 8, 'min_samples_split': 6, 'min_samples_leaf': 1, 'subsample': 0.8941229812300394, 'max_features': 'sqrt'}. Best is trial 621 with value: 0.2256726988932517.
[I 2024-12-04 13:03:24,692] Trial 1355 finished with value: 0.24006484073840106 and parameters: {'n_estimators': 960, 'learning_rate': 0.08659247900572264, 'max_depth': 8, 'min_samples_split': 3, 'min_samples_leaf': 1, 'subsample': 0.7032339599947036, 'max_features': 'sqrt'}. Best is trial 621 with value: 0.2256726988932517.
[I 2024-12-04 13:03:24,697] Trial 1345 finished with value: 0.6168214424388193 and parameters: {'n_estimators': 1398, 'learning_rate': 0.01490190364566796, 'max_depth': 9, 'min_samples_split': 2, 'min_samples_leaf': 5, 'subsample': 0.8107587383393773, 'max_features': 'log2'}. Best is trial 621 with value: 0.2256726988932517.
[I 2024-12-04 13:03:27,158] Trial 1366 finished with value: 0.7504291900017648 and parameters: {'n_estimators': 654, 'learning_rate': 0.08020955361911106, 'max_depth': 6, 'min_samples_split': 7, 'min_samples_leaf': 10, 'subsample': 0.6322021511402375, 'max_features': 'log2'}. Best is trial 621 with value: 0.2256726988932517.
[I 2024-12-04 13:03:30,985] Trial 1344 finished with value: 0.25784347997729734 and parameters: {'n_estimators': 1499, 'learning_rate': 0.09998308595041178, 'max_depth': 7, 'min_samples_split': 5, 'min_samples_leaf': 1, 'subsample': 0.7563627605108412, 'max_features': 'sqrt'}. Best is trial 621 with value: 0.2256726988932517.
[I 2024-12-04 13:03:33,171] Trial 1358 finished with value: 0.3288669292392188 and parameters: {'n_estimators': 1016, 'learning_rate': 0.03955769617987324, 'max_depth': 10, 'min_samples_split': 8, 'min_samples_leaf': 2, 'subsample': 0.6433799559506616, 'max_features': 'log2'}. Best is trial 621 with value: 0.2256726988932517.
[I 2024-12-04 13:03:34,314] Trial 1349 finished with value: 0.26295587688097716 and parameters: {'n_estimators': 1331, 'learning_rate': 0.05495222017017144, 'max_depth': 10, 'min_samples_split': 10, 'min_samples_leaf': 1, 'subsample': 0.7426058144094644, 'max_features': 'sqrt'}. Best is trial 621 with value: 0.2256726988932517.
[I 2024-12-04 13:03:40,125] Trial 1351 finished with value: 0.4923317562295155 and parameters: {'n_estimators': 1451, 'learning_rate': 0.010261520715037244, 'max_depth': 9, 'min_samples_split': 2, 'min_samples_leaf': 8, 'subsample': 0.9444377217403788, 'max_features': 'sqrt'}. Best is trial 621 with value: 0.2256726988932517.
[I 2024-12-04 13:03:40,612] Trial 1353 finished with value: 0.2349584395686488 and parameters: {'n_estimators': 1341, 'learning_rate': 0.09721954817040261, 'max_depth': 7, 'min_samples_split': 3, 'min_samples_leaf': 1, 'subsample': 0.8538166636622468, 'max_features': 'sqrt'}. Best is trial 621 with value: 0.2256726988932517.
[I 2024-12-04 13:03:41,957] Trial 1350 finished with value: 0.32621728442566683 and parameters: {'n_estimators': 1316, 'learning_rate': 0.048392741380859895, 'max_depth': 7, 'min_samples_split': 6, 'min_samples_leaf': 1, 'subsample': 0.8123575310746748, 'max_features': None}. Best is trial 621 with value: 0.2256726988932517.
[I 2024-12-04 13:03:44,297] Trial 1359 finished with value: 0.25151651420345156 and parameters: {'n_estimators': 1181, 'learning_rate': 0.05017482015583728, 'max_depth': 5, 'min_samples_split': 2, 'min_samples_leaf': 1, 'subsample': 0.8606591141945173, 'max_features': 'sqrt'}. Best is trial 621 with value: 0.2256726988932517.
[I 2024-12-04 13:03:44,725] Trial 1362 finished with value: 0.3019470102852277 and parameters: {'n_estimators': 1085, 'learning_rate': 0.09665316238045679, 'max_depth': 10, 'min_samples_split': 6, 'min_samples_leaf': 2, 'subsample': 0.7294291815980342, 'max_features': 'log2'}. Best is trial 621 with value: 0.2256726988932517.
[I 2024-12-04 13:03:45,704] Trial 1374 finished with value: 0.47070077627646395 and parameters: {'n_estimators': 681, 'learning_rate': 0.01748261881075886, 'max_depth': 9, 'min_samples_split': 3, 'min_samples_leaf': 7, 'subsample': 0.8981824026225219, 'max_features': 'sqrt'}. Best is trial 621 with value: 0.2256726988932517.
[I 2024-12-04 13:03:50,235] Trial 1352 finished with value: 0.2632593301658037 and parameters: {'n_estimators': 1466, 'learning_rate': 0.07136376830408156, 'max_depth': 7, 'min_samples_split': 2, 'min_samples_leaf': 1, 'subsample': 0.9052188214568991, 'max_features': 'sqrt'}. Best is trial 621 with value: 0.2256726988932517.
[I 2024-12-04 13:03:51,728] Trial 1354 finished with value: 0.2854668016482858 and parameters: {'n_estimators': 1455, 'learning_rate': 0.05475900797934708, 'max_depth': 7, 'min_samples_split': 5, 'min_samples_leaf': 2, 'subsample': 0.8638422812097649, 'max_features': 'sqrt'}. Best is trial 621 with value: 0.2256726988932517.
[I 2024-12-04 13:03:54,385] Trial 1361 finished with value: 0.23631987293720552 and parameters: {'n_estimators': 1279, 'learning_rate': 0.06485493691348673, 'max_depth': 7, 'min_samples_split': 2, 'min_samples_leaf': 1, 'subsample': 0.8452708364379534, 'max_features': 'sqrt'}. Best is trial 621 with value: 0.2256726988932517.
[I 2024-12-04 13:03:59,296] Trial 1365 finished with value: 0.26082886080097445 and parameters: {'n_estimators': 1164, 'learning_rate': 0.06415683715471891, 'max_depth': 7, 'min_samples_split': 7, 'min_samples_leaf': 1, 'subsample': 0.6910815590024829, 'max_features': 'sqrt'}. Best is trial 621 with value: 0.2256726988932517.
[I 2024-12-04 13:04:00,406] Trial 1368 finished with value: 0.2732409194780323 and parameters: {'n_estimators': 1136, 'learning_rate': 0.06898855848493361, 'max_depth': 5, 'min_samples_split': 9, 'min_samples_leaf': 1, 'subsample': 0.8559155903432274, 'max_features': 'sqrt'}. Best is trial 621 with value: 0.2256726988932517.
[I 2024-12-04 13:04:02,699] Trial 1367 finished with value: 0.36541323247412205 and parameters: {'n_estimators': 1241, 'learning_rate': 0.07447180247289242, 'max_depth': 7, 'min_samples_split': 6, 'min_samples_leaf': 3, 'subsample': 0.8645321369708718, 'max_features': 'sqrt'}. Best is trial 621 with value: 0.2256726988932517.
[I 2024-12-04 13:04:05,146] Trial 1376 finished with value: 0.36280062943970964 and parameters: {'n_estimators': 791, 'learning_rate': 0.09082459687658452, 'max_depth': 7, 'min_samples_split': 5, 'min_samples_leaf': 4, 'subsample': 0.9146440419499982, 'max_features': 'sqrt'}. Best is trial 621 with value: 0.2256726988932517.
[I 2024-12-04 13:04:06,929] Trial 1372 finished with value: 0.4363460464639957 and parameters: {'n_estimators': 1000, 'learning_rate': 0.010818009685158371, 'max_depth': 10, 'min_samples_split': 7, 'min_samples_leaf': 5, 'subsample': 0.7456651323960984, 'max_features': None}. Best is trial 621 with value: 0.2256726988932517.
[I 2024-12-04 13:04:09,012] Trial 1363 finished with value: 0.36513528933367356 and parameters: {'n_estimators': 1482, 'learning_rate': 0.07217352560670502, 'max_depth': 7, 'min_samples_split': 3, 'min_samples_leaf': 4, 'subsample': 0.7837562174447462, 'max_features': 'sqrt'}. Best is trial 621 with value: 0.2256726988932517.
[I 2024-12-04 13:04:11,894] Trial 1364 finished with value: 0.24040205012069096 and parameters: {'n_estimators': 1465, 'learning_rate': 0.0530930020789265, 'max_depth': 7, 'min_samples_split': 2, 'min_samples_leaf': 1, 'subsample': 0.868239845266475, 'max_features': 'sqrt'}. Best is trial 621 with value: 0.2256726988932517.
[I 2024-12-04 13:04:13,234] Trial 1375 finished with value: 0.4069355738482114 and parameters: {'n_estimators': 973, 'learning_rate': 0.09294604874402601, 'max_depth': 5, 'min_samples_split': 9, 'min_samples_leaf': 5, 'subsample': 0.928205217423943, 'max_features': 'log2'}. Best is trial 621 with value: 0.2256726988932517.
[I 2024-12-04 13:04:14,881] Trial 1369 finished with value: 0.25069795603739453 and parameters: {'n_estimators': 1332, 'learning_rate': 0.09003458353921488, 'max_depth': 7, 'min_samples_split': 3, 'min_samples_leaf': 1, 'subsample': 0.7766992585396586, 'max_features': 'sqrt'}. Best is trial 621 with value: 0.2256726988932517.
[I 2024-12-04 13:04:15,213] Trial 1370 finished with value: 0.3690006158555041 and parameters: {'n_estimators': 1331, 'learning_rate': 0.09763902285496658, 'max_depth': 3, 'min_samples_split': 2, 'min_samples_leaf': 5, 'subsample': 0.9083720888135113, 'max_features': 'sqrt'}. Best is trial 621 with value: 0.2256726988932517.
[I 2024-12-04 13:04:23,611] Trial 1387 finished with value: 0.4342498508727964 and parameters: {'n_estimators': 678, 'learning_rate': 0.0955414742277579, 'max_depth': 6, 'min_samples_split': 14, 'min_samples_leaf': 8, 'subsample': 0.7127924673903494, 'max_features': 'sqrt'}. Best is trial 621 with value: 0.2256726988932517.
[I 2024-12-04 13:04:24,075] Trial 1393 finished with value: 0.4528433008083605 and parameters: {'n_estimators': 395, 'learning_rate': 0.018700850392163005, 'max_depth': 12, 'min_samples_split': 13, 'min_samples_leaf': 5, 'subsample': 0.9277694180335361, 'max_features': None}. Best is trial 621 with value: 0.2256726988932517.
[I 2024-12-04 13:04:27,083] Trial 1373 finished with value: 0.24364440864230938 and parameters: {'n_estimators': 1407, 'learning_rate': 0.06897375539253577, 'max_depth': 8, 'min_samples_split': 6, 'min_samples_leaf': 1, 'subsample': 0.7334445463171722, 'max_features': 'sqrt'}. Best is trial 621 with value: 0.2256726988932517.
[I 2024-12-04 13:04:28,472] Trial 1371 finished with value: 0.7260380367921687 and parameters: {'n_estimators': 1494, 'learning_rate': 0.040688569804007764, 'max_depth': 9, 'min_samples_split': 3, 'min_samples_leaf': 10, 'subsample': 0.6523177471219546, 'max_features': 'log2'}. Best is trial 621 with value: 0.2256726988932517.
[I 2024-12-04 13:04:30,340] Trial 1397 finished with value: 0.6266753631021116 and parameters: {'n_estimators': 395, 'learning_rate': 0.019032506518235293, 'max_depth': 7, 'min_samples_split': 11, 'min_samples_leaf': 6, 'subsample': 0.7682982372921903, 'max_features': 'sqrt'}. Best is trial 621 with value: 0.2256726988932517.
[I 2024-12-04 13:04:30,377] Trial 1378 finished with value: 0.24825391578807537 and parameters: {'n_estimators': 1088, 'learning_rate': 0.08615829011494412, 'max_depth': 8, 'min_samples_split': 4, 'min_samples_leaf': 1, 'subsample': 0.843754004229514, 'max_features': 'sqrt'}. Best is trial 621 with value: 0.2256726988932517.
[I 2024-12-04 13:04:36,073] Trial 1379 finished with value: 0.3676830708635018 and parameters: {'n_estimators': 1142, 'learning_rate': 0.08031716844676028, 'max_depth': 7, 'min_samples_split': 11, 'min_samples_leaf': 4, 'subsample': 0.761447856501671, 'max_features': 'sqrt'}. Best is trial 621 with value: 0.2256726988932517.
[I 2024-12-04 13:04:40,403] Trial 1394 finished with value: 0.4166957255119488 and parameters: {'n_estimators': 598, 'learning_rate': 0.0866035191254083, 'max_depth': 7, 'min_samples_split': 8, 'min_samples_leaf': 4, 'subsample': 0.7964889156038311, 'max_features': None}. Best is trial 621 with value: 0.2256726988932517.
[I 2024-12-04 13:04:43,057] Trial 1377 finished with value: 0.28225333884745396 and parameters: {'n_estimators': 1403, 'learning_rate': 0.07407275140800322, 'max_depth': 8, 'min_samples_split': 2, 'min_samples_leaf': 2, 'subsample': 0.7044912997254327, 'max_features': 'log2'}. Best is trial 621 with value: 0.2256726988932517.
[I 2024-12-04 13:04:48,013] Trial 1391 finished with value: 0.8376686429481878 and parameters: {'n_estimators': 863, 'learning_rate': 0.013216466883831454, 'max_depth': 5, 'min_samples_split': 8, 'min_samples_leaf': 4, 'subsample': 0.7960785479222442, 'max_features': 'log2'}. Best is trial 621 with value: 0.2256726988932517.
[I 2024-12-04 13:04:51,173] Trial 1384 finished with value: 0.29107871744447594 and parameters: {'n_estimators': 1234, 'learning_rate': 0.07666752843211745, 'max_depth': 8, 'min_samples_split': 2, 'min_samples_leaf': 1, 'subsample': 0.8397395827531288, 'max_features': 'sqrt'}. Best is trial 621 with value: 0.2256726988932517.
[I 2024-12-04 13:04:54,925] Trial 1415 finished with value: 1.0173812998219198 and parameters: {'n_estimators': 143, 'learning_rate': 0.031423522983496883, 'max_depth': 4, 'min_samples_split': 18, 'min_samples_leaf': 10, 'subsample': 0.7170756388142094, 'max_features': 'sqrt'}. Best is trial 621 with value: 0.2256726988932517.
[I 2024-12-04 13:04:57,465] Trial 1383 finished with value: 0.33486852274336093 and parameters: {'n_estimators': 1412, 'learning_rate': 0.0660270436476421, 'max_depth': 7, 'min_samples_split': 4, 'min_samples_leaf': 3, 'subsample': 0.8378566051436349, 'max_features': 'sqrt'}. Best is trial 621 with value: 0.2256726988932517.
[I 2024-12-04 13:04:59,694] Trial 1382 finished with value: 0.47564247873104365 and parameters: {'n_estimators': 1217, 'learning_rate': 0.0762802591657611, 'max_depth': 12, 'min_samples_split': 10, 'min_samples_leaf': 10, 'subsample': 0.7703718142927665, 'max_features': None}. Best is trial 621 with value: 0.2256726988932517.
[I 2024-12-04 13:05:01,276] Trial 1416 finished with value: 0.4073181261640854 and parameters: {'n_estimators': 147, 'learning_rate': 0.05368238016562132, 'max_depth': 11, 'min_samples_split': 15, 'min_samples_leaf': 1, 'subsample': 0.7502835449075342, 'max_features': 'sqrt'}. Best is trial 621 with value: 0.2256726988932517.
[I 2024-12-04 13:05:02,505] Trial 1380 finished with value: 0.2549959409376292 and parameters: {'n_estimators': 1492, 'learning_rate': 0.08214913521309124, 'max_depth': 8, 'min_samples_split': 8, 'min_samples_leaf': 1, 'subsample': 0.7868997233530886, 'max_features': 'sqrt'}. Best is trial 621 with value: 0.2256726988932517.
[I 2024-12-04 13:05:03,603] Trial 1381 finished with value: 0.23786378754486712 and parameters: {'n_estimators': 1442, 'learning_rate': 0.06263827339008875, 'max_depth': 9, 'min_samples_split': 5, 'min_samples_leaf': 1, 'subsample': 0.7701349545870024, 'max_features': 'sqrt'}. Best is trial 621 with value: 0.2256726988932517.
[I 2024-12-04 13:05:03,916] Trial 1388 finished with value: 0.2546340898699018 and parameters: {'n_estimators': 1166, 'learning_rate': 0.058332821552175285, 'max_depth': 7, 'min_samples_split': 8, 'min_samples_leaf': 1, 'subsample': 0.8286059555457577, 'max_features': 'sqrt'}. Best is trial 621 with value: 0.2256726988932517.
[I 2024-12-04 13:05:06,306] Trial 1385 finished with value: 0.24831345324557277 and parameters: {'n_estimators': 1389, 'learning_rate': 0.09843876636253428, 'max_depth': 6, 'min_samples_split': 7, 'min_samples_leaf': 1, 'subsample': 0.7798652583562623, 'max_features': 'sqrt'}. Best is trial 621 with value: 0.2256726988932517.
[I 2024-12-04 13:05:06,319] Trial 1392 finished with value: 0.27544991111891687 and parameters: {'n_estimators': 1149, 'learning_rate': 0.09626284608595058, 'max_depth': 8, 'min_samples_split': 2, 'min_samples_leaf': 1, 'subsample': 0.8120323991613094, 'max_features': 'sqrt'}. Best is trial 621 with value: 0.2256726988932517.
[I 2024-12-04 13:05:09,838] Trial 1386 finished with value: 0.3481240650318282 and parameters: {'n_estimators': 1431, 'learning_rate': 0.04285315335993494, 'max_depth': 7, 'min_samples_split': 5, 'min_samples_leaf': 3, 'subsample': 0.764791454599317, 'max_features': 'sqrt'}. Best is trial 621 with value: 0.2256726988932517.
[I 2024-12-04 13:05:10,993] Trial 1390 finished with value: 0.2490923677795776 and parameters: {'n_estimators': 1326, 'learning_rate': 0.04940559267072641, 'max_depth': 5, 'min_samples_split': 3, 'min_samples_leaf': 1, 'subsample': 0.7826126645169372, 'max_features': 'sqrt'}. Best is trial 621 with value: 0.2256726988932517.
[I 2024-12-04 13:05:18,227] Trial 1406 finished with value: 0.3724191056519374 and parameters: {'n_estimators': 882, 'learning_rate': 0.09524378900283595, 'max_depth': 7, 'min_samples_split': 5, 'min_samples_leaf': 4, 'subsample': 0.8455621796225525, 'max_features': 'log2'}. Best is trial 621 with value: 0.2256726988932517.
[I 2024-12-04 13:05:18,871] Trial 1407 finished with value: 0.3472710113233777 and parameters: {'n_estimators': 812, 'learning_rate': 0.09907989861480059, 'max_depth': 8, 'min_samples_split': 6, 'min_samples_leaf': 3, 'subsample': 0.6683218781884686, 'max_features': 'sqrt'}. Best is trial 621 with value: 0.2256726988932517.
[I 2024-12-04 13:05:21,255] Trial 1402 finished with value: 0.36199844793969216 and parameters: {'n_estimators': 1084, 'learning_rate': 0.0674384338544616, 'max_depth': 7, 'min_samples_split': 4, 'min_samples_leaf': 4, 'subsample': 0.7431135042651836, 'max_features': 'sqrt'}. Best is trial 621 with value: 0.2256726988932517.
[I 2024-12-04 13:05:23,824] Trial 1389 finished with value: 0.22332552856343169 and parameters: {'n_estimators': 1485, 'learning_rate': 0.07348145529761203, 'max_depth': 6, 'min_samples_split': 2, 'min_samples_leaf': 1, 'subsample': 0.7523549746328456, 'max_features': 'sqrt'}. Best is trial 1389 with value: 0.22332552856343169.
[I 2024-12-04 13:05:30,467] Trial 1395 finished with value: 0.3631920018842693 and parameters: {'n_estimators': 1470, 'learning_rate': 0.05124591311330982, 'max_depth': 9, 'min_samples_split': 2, 'min_samples_leaf': 3, 'subsample': 0.770403532388406, 'max_features': 'sqrt'}. Best is trial 1389 with value: 0.22332552856343169.
[I 2024-12-04 13:05:32,014] Trial 1414 finished with value: 0.9971537763464694 and parameters: {'n_estimators': 788, 'learning_rate': 0.019513151082641775, 'max_depth': 4, 'min_samples_split': 16, 'min_samples_leaf': 10, 'subsample': 0.9314377195066699, 'max_features': 'log2'}. Best is trial 1389 with value: 0.22332552856343169.
[I 2024-12-04 13:05:33,781] Trial 1404 finished with value: 0.2792344486473295 and parameters: {'n_estimators': 1199, 'learning_rate': 0.09298693201177477, 'max_depth': 7, 'min_samples_split': 7, 'min_samples_leaf': 1, 'subsample': 0.8911786463912245, 'max_features': 'sqrt'}. Best is trial 1389 with value: 0.22332552856343169.
[I 2024-12-04 13:05:36,262] Trial 1396 finished with value: 0.29464323605193815 and parameters: {'n_estimators': 1484, 'learning_rate': 0.06074755265203028, 'max_depth': 7, 'min_samples_split': 2, 'min_samples_leaf': 2, 'subsample': 0.8133779349139123, 'max_features': 'sqrt'}. Best is trial 1389 with value: 0.22332552856343169.
[I 2024-12-04 13:05:37,821] Trial 1405 finished with value: 0.27736727269723604 and parameters: {'n_estimators': 1169, 'learning_rate': 0.08996024612038875, 'max_depth': 9, 'min_samples_split': 8, 'min_samples_leaf': 1, 'subsample': 0.7928798899800255, 'max_features': 'sqrt'}. Best is trial 1389 with value: 0.22332552856343169.
[I 2024-12-04 13:05:37,953] Trial 1400 finished with value: 0.3925854329036964 and parameters: {'n_estimators': 1359, 'learning_rate': 0.0714533465493314, 'max_depth': 6, 'min_samples_split': 3, 'min_samples_leaf': 5, 'subsample': 0.8554445497098291, 'max_features': 'log2'}. Best is trial 1389 with value: 0.22332552856343169.
