[I 2024-12-04 20:03:40,574] Trial 556 finished with value: 0.14249517929654243 and parameters: {'kernel_type': 'Matern', 'length_scale': 0.30674416852784064, 'noise_level': 0.016820376117232912, 'constant_value': 22.30744515460442, 'nu': 1.5}. Best is trial 254 with value: 0.13754915492432768.
[I 2024-12-04 20:03:41,959] Trial 557 finished with value: 0.14249497855139442 and parameters: {'kernel_type': 'Matern', 'length_scale': 208.75117010822945, 'noise_level': 0.9017259769240134, 'constant_value': 88838.76264052419, 'nu': 1.5}. Best is trial 254 with value: 0.13754915492432768.
[I 2024-12-04 20:03:44,274] Trial 558 finished with value: 0.1424950072074045 and parameters: {'kernel_type': 'Matern', 'length_scale': 31165.200442399884, 'noise_level': 0.1707212263042732, 'constant_value': 77296.53369634786, 'nu': 1.5}. Best is trial 254 with value: 0.13754915492432768.
[I 2024-12-04 20:03:49,493] Trial 561 finished with value: 0.9864686818933599 and parameters: {'kernel_type': 'Matern', 'length_scale': 0.0004936423025177957, 'noise_level': 3.5339922469091698e-09, 'constant_value': 0.0003495136124933762, 'nu': 1.5}. Best is trial 254 with value: 0.13754915492432768.
[I 2024-12-04 20:03:50,228] Trial 560 finished with value: 0.1424950636853437 and parameters: {'kernel_type': 'Matern', 'length_scale': 280.8545212118038, 'noise_level': 0.02928848422062632, 'constant_value': 25.969187750386123, 'nu': 1.5}. Best is trial 254 with value: 0.13754915492432768.
[I 2024-12-04 20:03:55,024] Trial 559 finished with value: 0.14249508195004526 and parameters: {'kernel_type': 'Matern', 'length_scale': 1.9073036821140519, 'noise_level': 0.9802155729634304, 'constant_value': 31.175109886218724, 'nu': 1.5}. Best is trial 254 with value: 0.13754915492432768.
[I 2024-12-04 20:03:56,610] Trial 562 finished with value: 0.14249506339764664 and parameters: {'kernel_type': 'Matern', 'length_scale': 24.977507140530218, 'noise_level': 0.031104295609151834, 'constant_value': 3.3867908315623367, 'nu': 1.5}. Best is trial 254 with value: 0.13754915492432768.
[I 2024-12-04 20:03:57,280] Trial 563 finished with value: 0.1424950605164447 and parameters: {'kernel_type': 'Matern', 'length_scale': 12.350268720808764, 'noise_level': 0.011954322508104034, 'constant_value': 306.1181486531037, 'nu': 1.5}. Best is trial 254 with value: 0.13754915492432768.
[I 2024-12-04 20:04:01,649] Trial 565 finished with value: 0.1424950013721407 and parameters: {'kernel_type': 'Matern', 'length_scale': 573.0788739563534, 'noise_level': 0.024513141231013547, 'constant_value': 1173.0066080016127, 'nu': 1.5}. Best is trial 254 with value: 0.13754915492432768.
[I 2024-12-04 20:04:02,342] Trial 564 finished with value: 0.14249506481875196 and parameters: {'kernel_type': 'Matern', 'length_scale': 4.411767692818944, 'noise_level': 0.027067034105623767, 'constant_value': 2464.3884014880773, 'nu': 1.5}. Best is trial 254 with value: 0.13754915492432768.
[I 2024-12-04 20:04:03,336] Trial 566 finished with value: 0.14249503209638126 and parameters: {'kernel_type': 'Matern', 'length_scale': 83.02642722657863, 'noise_level': 0.011984683727880668, 'constant_value': 83127.21714058483, 'nu': 1.5}. Best is trial 254 with value: 0.13754915492432768.
[I 2024-12-04 20:04:08,139] Trial 567 finished with value: 0.1424950697431775 and parameters: {'kernel_type': 'Matern', 'length_scale': 0.5283756080255407, 'noise_level': 0.02183207331350207, 'constant_value': 1123.7087109902536, 'nu': 1.5}. Best is trial 254 with value: 0.13754915492432768.
[I 2024-12-04 20:04:09,398] Trial 569 finished with value: 0.14249506500798356 and parameters: {'kernel_type': 'Matern', 'length_scale': 840.2164832222961, 'noise_level': 0.8243925724717744, 'constant_value': 185.62387207479765, 'nu': 1.5}. Best is trial 254 with value: 0.13754915492432768.
[I 2024-12-04 20:04:09,956] Trial 568 finished with value: 0.1424950686864676 and parameters: {'kernel_type': 'Matern', 'length_scale': 7.696974378314435, 'noise_level': 0.0004777217897273151, 'constant_value': 0.883184097247341, 'nu': 1.5}. Best is trial 254 with value: 0.13754915492432768.
[I 2024-12-04 20:04:15,401] Trial 570 finished with value: 0.14249505924989075 and parameters: {'kernel_type': 'Matern', 'length_scale': 0.3432930217629901, 'noise_level': 0.021538003568315534, 'constant_value': 0.2026225821254806, 'nu': 1.5}. Best is trial 254 with value: 0.13754915492432768.
[I 2024-12-04 20:04:16,129] Trial 571 finished with value: 0.14249501496845537 and parameters: {'kernel_type': 'Matern', 'length_scale': 51.85514234632444, 'noise_level': 0.6743460727536248, 'constant_value': 7.705123464986514, 'nu': 1.5}. Best is trial 254 with value: 0.13754915492432768.
[I 2024-12-04 20:04:19,859] Trial 572 finished with value: 0.14249500369346202 and parameters: {'kernel_type': 'Matern', 'length_scale': 5.481137707971165, 'noise_level': 0.9653662973130325, 'constant_value': 491.3584310187991, 'nu': 1.5}. Best is trial 254 with value: 0.13754915492432768.
[I 2024-12-04 20:04:21,071] Trial 573 finished with value: 0.1424950630055374 and parameters: {'kernel_type': 'Matern', 'length_scale': 88.4175063535181, 'noise_level': 0.014178191343668213, 'constant_value': 404.50004286366743, 'nu': 1.5}. Best is trial 254 with value: 0.13754915492432768.
[I 2024-12-04 20:04:25,712] Trial 574 finished with value: 0.9864686819543442 and parameters: {'kernel_type': 'RBF', 'length_scale': 0.0001995276126947725, 'noise_level': 0.004784273071507117, 'constant_value': 9.547076080647042e-06, 'nu': 0.5}. Best is trial 254 with value: 0.13754915492432768.
[I 2024-12-04 20:04:27,960] Trial 575 finished with value: 0.1424951584753865 and parameters: {'kernel_type': 'Matern', 'length_scale': 425.4280328428802, 'noise_level': 0.4367361059629751, 'constant_value': 1.0796932376355555, 'nu': 1.5}. Best is trial 254 with value: 0.13754915492432768.
[I 2024-12-04 20:04:31,322] Trial 577 finished with value: 0.9864686819232581 and parameters: {'kernel_type': 'Matern', 'length_scale': 1709.5918899663072, 'noise_level': 0.0007660585539396182, 'constant_value': 99453.69343204993, 'nu': 1.5}. Best is trial 254 with value: 0.13754915492432768.
[I 2024-12-04 20:04:31,593] Trial 576 finished with value: 0.14249505965764617 and parameters: {'kernel_type': 'Matern', 'length_scale': 1.0188372411781252, 'noise_level': 0.04102743178635963, 'constant_value': 2.3216275923424026, 'nu': 1.5}. Best is trial 254 with value: 0.13754915492432768.
[I 2024-12-04 20:04:40,708] Trial 578 finished with value: 0.14249505651317235 and parameters: {'kernel_type': 'Matern', 'length_scale': 1.1987574828699876, 'noise_level': 0.0172041581358635, 'constant_value': 473.8875449303729, 'nu': 1.5}. Best is trial 254 with value: 0.13754915492432768.
[I 2024-12-04 20:04:40,747] Trial 579 finished with value: 0.9864686819203864 and parameters: {'kernel_type': 'Matern', 'length_scale': 0.017495535336194693, 'noise_level': 0.06974831154301546, 'constant_value': 4.932448322953955, 'nu': 2.5}. Best is trial 254 with value: 0.13754915492432768.
[I 2024-12-04 20:04:45,672] Trial 582 finished with value: 0.9864686819139729 and parameters: {'kernel_type': 'RBF', 'length_scale': 0.00034670688610128177, 'noise_level': 0.03331501771741324, 'constant_value': 646.1460059578894, 'nu': 1.5}. Best is trial 254 with value: 0.13754915492432768.
[I 2024-12-04 20:04:47,456] Trial 580 finished with value: 0.1424951271805701 and parameters: {'kernel_type': 'Matern', 'length_scale': 0.14729145194814405, 'noise_level': 0.5944722005958204, 'constant_value': 6519.2310390071025, 'nu': 1.5}. Best is trial 254 with value: 0.13754915492432768.
[I 2024-12-04 20:04:48,298] Trial 581 finished with value: 0.14469881219368474 and parameters: {'kernel_type': 'Matern', 'length_scale': 7702.318189872712, 'noise_level': 0.32089038861873675, 'constant_value': 17.420775288623656, 'nu': 2.5}. Best is trial 254 with value: 0.13754915492432768.
[I 2024-12-04 20:04:52,174] Trial 583 finished with value: 0.14249506339952808 and parameters: {'kernel_type': 'Matern', 'length_scale': 582.9962589031808, 'noise_level': 0.03427937285155309, 'constant_value': 90.8644601232269, 'nu': 1.5}. Best is trial 254 with value: 0.13754915492432768.
[I 2024-12-04 20:04:52,997] Trial 584 finished with value: 0.14469881981151472 and parameters: {'kernel_type': 'Matern', 'length_scale': 21.991135335969663, 'noise_level': 0.016208556563667008, 'constant_value': 41796.8126450261, 'nu': 2.5}. Best is trial 254 with value: 0.13754915492432768.
[I 2024-12-04 20:04:54,411] Trial 585 finished with value: 0.14249535180992376 and parameters: {'kernel_type': 'Matern', 'length_scale': 851.1334114658664, 'noise_level': 0.7799170682597066, 'constant_value': 213.32025913531444, 'nu': 1.5}. Best is trial 254 with value: 0.13754915492432768.
[I 2024-12-04 20:04:58,496] Trial 586 finished with value: 0.14249510769090062 and parameters: {'kernel_type': 'Matern', 'length_scale': 191.43530953198538, 'noise_level': 0.8771257062519484, 'constant_value': 14765.447388867695, 'nu': 1.5}. Best is trial 254 with value: 0.13754915492432768.
[I 2024-12-04 20:05:00,037] Trial 587 finished with value: 0.1424950791156767 and parameters: {'kernel_type': 'Matern', 'length_scale': 20.849418882991255, 'noise_level': 0.009737054734182734, 'constant_value': 1211.5430675744449, 'nu': 1.5}. Best is trial 254 with value: 0.13754915492432768.
[I 2024-12-04 20:05:05,774] Trial 589 finished with value: 0.9864686819230086 and parameters: {'kernel_type': 'Matern', 'length_scale': 0.04018928387844504, 'noise_level': 0.859128062396556, 'constant_value': 20.734004032425236, 'nu': 1.5}. Best is trial 254 with value: 0.13754915492432768.
[I 2024-12-04 20:05:05,819] Trial 588 finished with value: 0.14249488693290968 and parameters: {'kernel_type': 'Matern', 'length_scale': 0.31827762849478236, 'noise_level': 0.35544824821125065, 'constant_value': 9.284495797642709, 'nu': 1.5}. Best is trial 254 with value: 0.13754915492432768.
[I 2024-12-04 20:05:09,373] Trial 590 finished with value: 0.14249506082150248 and parameters: {'kernel_type': 'Matern', 'length_scale': 8.986119737374386, 'noise_level': 0.03166536489732764, 'constant_value': 1.9160087473652985, 'nu': 1.5}. Best is trial 254 with value: 0.13754915492432768.
[I 2024-12-04 20:05:11,623] Trial 591 finished with value: 0.14249463429371587 and parameters: {'kernel_type': 'Matern', 'length_scale': 3.758350639206489, 'noise_level': 0.5806720408905933, 'constant_value': 75909.40111994706, 'nu': 1.5}. Best is trial 254 with value: 0.13754915492432768.
[I 2024-12-04 20:05:12,181] Trial 592 finished with value: 0.14249533827475 and parameters: {'kernel_type': 'Matern', 'length_scale': 8.42984583501653, 'noise_level': 0.8736991030731168, 'constant_value': 65313.51375012332, 'nu': 1.5}. Best is trial 254 with value: 0.13754915492432768.
[I 2024-12-04 20:05:22,918] Trial 593 finished with value: 0.14249911271050383 and parameters: {'kernel_type': 'Matern', 'length_scale': 5829.036232793932, 'noise_level': 0.7774801747711161, 'constant_value': 32652.058517857455, 'nu': 1.5}. Best is trial 254 with value: 0.13754915492432768.
[I 2024-12-04 20:05:23,161] Trial 594 finished with value: 0.9864686819059203 and parameters: {'kernel_type': 'Matern', 'length_scale': 0.016429161200394626, 'noise_level': 0.02881195772884932, 'constant_value': 90441.86144156184, 'nu': 1.5}. Best is trial 254 with value: 0.13754915492432768.
[I 2024-12-04 20:05:25,286] Trial 595 finished with value: 0.9864686819311055 and parameters: {'kernel_type': 'Matern', 'length_scale': 0.04544497542277614, 'noise_level': 0.8987724324750973, 'constant_value': 13520.230465697388, 'nu': 1.5}. Best is trial 254 with value: 0.13754915492432768.
[I 2024-12-04 20:05:30,946] Trial 596 finished with value: 0.14249525878896727 and parameters: {'kernel_type': 'Matern', 'length_scale': 3.2916198198856055, 'noise_level': 0.8366845817537982, 'constant_value': 12158.231966490712, 'nu': 1.5}. Best is trial 254 with value: 0.13754915492432768.
[I 2024-12-04 20:05:31,702] Trial 598 finished with value: 0.14249541042042513 and parameters: {'kernel_type': 'Matern', 'length_scale': 328.7208088698247, 'noise_level': 0.004479009030830904, 'constant_value': 82782.96135748562, 'nu': 1.5}. Best is trial 254 with value: 0.13754915492432768.
[I 2024-12-04 20:05:31,747] Trial 597 finished with value: 0.14249506294395375 and parameters: {'kernel_type': 'Matern', 'length_scale': 0.30548442080900495, 'noise_level': 0.8411264995111065, 'constant_value': 25588.196149985386, 'nu': 1.5}. Best is trial 254 with value: 0.13754915492432768.
[I 2024-12-04 20:05:39,103] Trial 601 finished with value: 0.14469876135014906 and parameters: {'kernel_type': 'Matern', 'length_scale': 31.536098321056066, 'noise_level': 0.7217895853700612, 'constant_value': 3270.538697103177, 'nu': 2.5}. Best is trial 254 with value: 0.13754915492432768.
[I 2024-12-04 20:05:39,159] Trial 600 finished with value: 0.1424950792719881 and parameters: {'kernel_type': 'Matern', 'length_scale': 11.81063989300397, 'noise_level': 0.10099086514281685, 'constant_value': 3947.024065453169, 'nu': 1.5}. Best is trial 254 with value: 0.13754915492432768.
[I 2024-12-04 20:05:39,764] Trial 599 finished with value: 0.9864686819261336 and parameters: {'kernel_type': 'Matern', 'length_scale': 701.8965666208236, 'noise_level': 0.018005741799354213, 'constant_value': 0.18353038959933982, 'nu': 1.5}. Best is trial 254 with value: 0.13754915492432768.
[I 2024-12-04 20:05:46,722] Trial 604 finished with value: 0.14249419064804836 and parameters: {'kernel_type': 'Matern', 'length_scale': 4.575972010854634, 'noise_level': 0.6947122218726131, 'constant_value': 11633.635480448922, 'nu': 1.5}. Best is trial 254 with value: 0.13754915492432768.
[I 2024-12-04 20:05:47,412] Trial 602 finished with value: 0.14249514631594376 and parameters: {'kernel_type': 'Matern', 'length_scale': 113.63238373584306, 'noise_level': 0.04104129406511532, 'constant_value': 85378.46598545402, 'nu': 1.5}. Best is trial 254 with value: 0.13754915492432768.
[I 2024-12-04 20:05:48,563] Trial 603 finished with value: 0.14249486097667338 and parameters: {'kernel_type': 'Matern', 'length_scale': 7.9804574056432065, 'noise_level': 0.00717585308971727, 'constant_value': 93138.71209352839, 'nu': 1.5}. Best is trial 254 with value: 0.13754915492432768.
[I 2024-12-04 20:05:51,542] Trial 605 finished with value: 0.998216733803986 and parameters: {'kernel_type': 'RBF', 'length_scale': 0.0002458481907370763, 'noise_level': 3.0130487566699537e-10, 'constant_value': 301.8015292167335, 'nu': 0.5}. Best is trial 254 with value: 0.13754915492432768.
[I 2024-12-04 20:05:54,952] Trial 606 finished with value: 0.14249478084087405 and parameters: {'kernel_type': 'Matern', 'length_scale': 20.02294694347971, 'noise_level': 0.5935093297138853, 'constant_value': 3.8946234541912768, 'nu': 1.5}. Best is trial 254 with value: 0.13754915492432768.
[I 2024-12-04 20:05:57,683] Trial 607 finished with value: 0.14249504430338514 and parameters: {'kernel_type': 'Matern', 'length_scale': 0.28503466959798057, 'noise_level': 0.7978249229673998, 'constant_value': 4063.06898557408, 'nu': 1.5}. Best is trial 254 with value: 0.13754915492432768.
[I 2024-12-04 20:06:02,126] Trial 608 finished with value: 0.14771037907167678 and parameters: {'kernel_type': 'RBF', 'length_scale': 17.615615152329937, 'noise_level': 0.31021742684612036, 'constant_value': 0.0005338404093137112, 'nu': 1.5}. Best is trial 254 with value: 0.13754915492432768.
[I 2024-12-04 20:06:02,622] Trial 609 finished with value: 0.14249506320185515 and parameters: {'kernel_type': 'Matern', 'length_scale': 0.7076346382429365, 'noise_level': 0.6319496972612647, 'constant_value': 47472.29165751786, 'nu': 1.5}. Best is trial 254 with value: 0.13754915492432768.
[I 2024-12-04 20:06:07,616] Trial 610 finished with value: 0.14249508798224975 and parameters: {'kernel_type': 'Matern', 'length_scale': 19.517289330849717, 'noise_level': 0.4006925599888176, 'constant_value': 137.03323491119676, 'nu': 1.5}. Best is trial 254 with value: 0.13754915492432768.
[I 2024-12-04 20:06:09,378] Trial 612 finished with value: 0.14249510891567402 and parameters: {'kernel_type': 'Matern', 'length_scale': 0.7409709803479676, 'noise_level': 0.0313152039444114, 'constant_value': 46847.257200886226, 'nu': 1.5}. Best is trial 254 with value: 0.13754915492432768.
[I 2024-12-04 20:06:10,884] Trial 611 finished with value: 0.13827080322500696 and parameters: {'kernel_type': 'Matern', 'length_scale': 4.437690474998527, 'noise_level': 0.6981745349939352, 'constant_value': 2233.9924133671684, 'nu': 1.5}. Best is trial 254 with value: 0.13754915492432768.
[I 2024-12-04 20:06:14,877] Trial 613 finished with value: 0.9864686819071987 and parameters: {'kernel_type': 'Matern', 'length_scale': 634.497057204549, 'noise_level': 3.452928725802214e-06, 'constant_value': 4.753815302195188, 'nu': 2.5}. Best is trial 254 with value: 0.13754915492432768.
[I 2024-12-04 20:06:16,175] Trial 614 finished with value: 0.14249572968519716 and parameters: {'kernel_type': 'Matern', 'length_scale': 108.56211666404182, 'noise_level': 0.9997583741779481, 'constant_value': 2314.624115819685, 'nu': 1.5}. Best is trial 254 with value: 0.13754915492432768.
[I 2024-12-04 20:06:23,192] Trial 615 finished with value: 0.14249504750473493 and parameters: {'kernel_type': 'Matern', 'length_scale': 26.395086563802792, 'noise_level': 0.15416627057348378, 'constant_value': 62.162746857409445, 'nu': 1.5}. Best is trial 254 with value: 0.13754915492432768.
[I 2024-12-04 20:06:23,730] Trial 616 finished with value: 0.1375127577189955 and parameters: {'kernel_type': 'Matern', 'length_scale': 9.671647931048991, 'noise_level': 0.26672938357743103, 'constant_value': 217.10164671022935, 'nu': 1.5}. Best is trial 616 with value: 0.1375127577189955.
[I 2024-12-04 20:06:25,448] Trial 617 finished with value: 0.9864686820326102 and parameters: {'kernel_type': 'Matern', 'length_scale': 9383.704615341221, 'noise_level': 2.4331182414595185e-07, 'constant_value': 0.3147783034159148, 'nu': 1.5}. Best is trial 616 with value: 0.1375127577189955.
[I 2024-12-04 20:06:31,723] Trial 618 finished with value: 0.14249505030256449 and parameters: {'kernel_type': 'Matern', 'length_scale': 1.157688455916383, 'noise_level': 0.8418048778131916, 'constant_value': 193.776508068969, 'nu': 1.5}. Best is trial 616 with value: 0.1375127577189955.
[I 2024-12-04 20:06:31,736] Trial 619 finished with value: 0.14249510308964441 and parameters: {'kernel_type': 'Matern', 'length_scale': 8.342555089535063, 'noise_level': 0.8079993953686223, 'constant_value': 6845.112409018518, 'nu': 1.5}. Best is trial 616 with value: 0.1375127577189955.
[I 2024-12-04 20:06:34,674] Trial 620 finished with value: 0.986468681918934 and parameters: {'kernel_type': 'RBF', 'length_scale': 2645.809828270166, 'noise_level': 0.00242439044047575, 'constant_value': 2.0191003115844355, 'nu': 1.5}. Best is trial 616 with value: 0.1375127577189955.
[I 2024-12-04 20:06:39,784] Trial 622 finished with value: 0.9864686819175307 and parameters: {'kernel_type': 'Matern', 'length_scale': 0.0719956746409943, 'noise_level': 0.000349724531385524, 'constant_value': 0.00043530387493575433, 'nu': 2.5}. Best is trial 616 with value: 0.1375127577189955.
[I 2024-12-04 20:06:42,055] Trial 623 finished with value: 0.1424950533227303 and parameters: {'kernel_type': 'Matern', 'length_scale': 0.4751659531824466, 'noise_level': 0.04352834553712376, 'constant_value': 3985.2110342983447, 'nu': 1.5}. Best is trial 616 with value: 0.1375127577189955.
[I 2024-12-04 20:06:47,289] Trial 621 finished with value: 0.9864686819240633 and parameters: {'kernel_type': 'RBF', 'length_scale': 54896.706533866825, 'noise_level': 6.984957102004707e-09, 'constant_value': 1.883763773684068e-05, 'nu': 1.5}. Best is trial 616 with value: 0.1375127577189955.
[I 2024-12-04 20:06:48,600] Trial 624 finished with value: 0.14249512650824428 and parameters: {'kernel_type': 'Matern', 'length_scale': 4.591914768616399, 'noise_level': 0.9509954452294417, 'constant_value': 10965.949135670036, 'nu': 1.5}. Best is trial 616 with value: 0.1375127577189955.
[I 2024-12-04 20:06:51,256] Trial 625 finished with value: 0.14249506052839497 and parameters: {'kernel_type': 'Matern', 'length_scale': 13.928549312107572, 'noise_level': 0.7142602326053417, 'constant_value': 14.537674475574565, 'nu': 1.5}. Best is trial 616 with value: 0.1375127577189955.
[I 2024-12-04 20:06:53,591] Trial 626 finished with value: 0.14249484121857275 and parameters: {'kernel_type': 'Matern', 'length_scale': 1.957185241423695, 'noise_level': 0.3182150111117447, 'constant_value': 92318.94487889657, 'nu': 1.5}. Best is trial 616 with value: 0.1375127577189955.
[I 2024-12-04 20:06:57,717] Trial 628 finished with value: 0.9982170973818545 and parameters: {'kernel_type': 'Matern', 'length_scale': 3578.17539230396, 'noise_level': 0.1036666276023611, 'constant_value': 0.0024716828883326967, 'nu': 1.5}. Best is trial 616 with value: 0.1375127577189955.
[I 2024-12-04 20:06:58,783] Trial 627 finished with value: 0.9864686821854074 and parameters: {'kernel_type': 'Matern', 'length_scale': 831.3429500085493, 'noise_level': 3.109141746189332e-06, 'constant_value': 0.00017308737753880544, 'nu': 2.5}. Best is trial 616 with value: 0.1375127577189955.
[I 2024-12-04 20:07:02,182] Trial 629 finished with value: 0.14249505599906379 and parameters: {'kernel_type': 'Matern', 'length_scale': 0.9859265511106379, 'noise_level': 0.12581792774330702, 'constant_value': 951.9173476145177, 'nu': 1.5}. Best is trial 616 with value: 0.1375127577189955.
[I 2024-12-04 20:07:03,014] Trial 630 finished with value: 0.14771027496281183 and parameters: {'kernel_type': 'RBF', 'length_scale': 1.104552363935568, 'noise_level': 0.16171529221183412, 'constant_value': 5274.2263667508305, 'nu': 1.5}. Best is trial 616 with value: 0.1375127577189955.
