[I 2024-12-04 20:22:22,247] Trial 1300 finished with value: 0.35921124127386506 and parameters: {'kernel_type': 'Matern', 'length_scale': 11.768536702594076, 'noise_level': 0.5015106929341896, 'constant_value': 136.84084560465863, 'nu': 0.5}. Best is trial 881 with value: 0.35916990930150405.
[I 2024-12-04 20:22:26,750] Trial 1303 finished with value: 0.35921215587880856 and parameters: {'kernel_type': 'Matern', 'length_scale': 8.881222330527013, 'noise_level': 0.0025568905555888297, 'constant_value': 1.6105790899524195, 'nu': 0.5}. Best is trial 881 with value: 0.35916990930150405.
[I 2024-12-04 20:22:26,751] Trial 1302 finished with value: 0.35921399373537916 and parameters: {'kernel_type': 'Matern', 'length_scale': 896.1059583066321, 'noise_level': 0.29785533749284915, 'constant_value': 47660.17967185146, 'nu': 0.5}. Best is trial 881 with value: 0.35916990930150405.
[I 2024-12-04 20:22:27,152] Trial 1304 finished with value: 0.35921103040957714 and parameters: {'kernel_type': 'Matern', 'length_scale': 7.259406871171308, 'noise_level': 0.01579795733589403, 'constant_value': 16.554636535651877, 'nu': 0.5}. Best is trial 881 with value: 0.35916990930150405.
[I 2024-12-04 20:22:30,561] Trial 1305 finished with value: 1.0624161171352537 and parameters: {'kernel_type': 'RBF', 'length_scale': 0.00022896429927381736, 'noise_level': 1.3586791415915166e-10, 'constant_value': 0.0012297637286467302, 'nu': 0.5}. Best is trial 881 with value: 0.35916990930150405.
[I 2024-12-04 20:22:31,153] Trial 1307 finished with value: 1.0624161177947262 and parameters: {'kernel_type': 'Matern', 'length_scale': 1.4864847989860084e-05, 'noise_level': 8.924734877806475e-09, 'constant_value': 0.001980104370733418, 'nu': 1.5}. Best is trial 881 with value: 0.35916990930150405.
[I 2024-12-04 20:22:32,233] Trial 1306 finished with value: 0.3592110192778077 and parameters: {'kernel_type': 'Matern', 'length_scale': 1.3379667207304464, 'noise_level': 0.22107055004435847, 'constant_value': 18.111836489369427, 'nu': 0.5}. Best is trial 881 with value: 0.35916990930150405.
[I 2024-12-04 20:22:34,756] Trial 1308 finished with value: 1.0916558493888984 and parameters: {'kernel_type': 'Matern', 'length_scale': 0.019919779620692062, 'noise_level': 5.878171326400176e-06, 'constant_value': 52.684059143710606, 'nu': 0.5}. Best is trial 881 with value: 0.35916990930150405.
[I 2024-12-04 20:22:37,644] Trial 1310 finished with value: 0.359211053811846 and parameters: {'kernel_type': 'Matern', 'length_scale': 2.8923328409971694, 'noise_level': 0.8449266367461813, 'constant_value': 537.9571763708317, 'nu': 0.5}. Best is trial 881 with value: 0.35916990930150405.
[I 2024-12-04 20:22:41,424] Trial 1311 finished with value: 1.062416117267975 and parameters: {'kernel_type': 'RBF', 'length_scale': 33719.82764924965, 'noise_level': 1.868718254127624e-07, 'constant_value': 0.31570156372278635, 'nu': 1.5}. Best is trial 881 with value: 0.35916990930150405.
[I 2024-12-04 20:22:43,600] Trial 1309 finished with value: 1.062416118064846 and parameters: {'kernel_type': 'Matern', 'length_scale': 1.3748229226244138e-05, 'noise_level': 1.7810193877502047e-06, 'constant_value': 0.6489832747534988, 'nu': 1.5}. Best is trial 881 with value: 0.35916990930150405.
[I 2024-12-04 20:22:45,267] Trial 1312 finished with value: 1.0624161181350842 and parameters: {'kernel_type': 'Matern', 'length_scale': 75054.64097105704, 'noise_level': 2.9929100407002754e-08, 'constant_value': 0.02104129857433455, 'nu': 2.5}. Best is trial 881 with value: 0.35916990930150405.
[I 2024-12-04 20:22:46,056] Trial 1313 finished with value: 0.41956614275775916 and parameters: {'kernel_type': 'Matern', 'length_scale': 6.608808771295744, 'noise_level': 0.005954357756603276, 'constant_value': 13.199961359661662, 'nu': 2.5}. Best is trial 881 with value: 0.35916990930150405.
[I 2024-12-04 20:22:48,218] Trial 1314 finished with value: 0.3592116800100798 and parameters: {'kernel_type': 'Matern', 'length_scale': 237.2886158826519, 'noise_level': 0.021265972901404553, 'constant_value': 648.3995296421033, 'nu': 0.5}. Best is trial 881 with value: 0.35916990930150405.
[I 2024-12-04 20:22:50,348] Trial 1315 finished with value: 0.4286836469465149 and parameters: {'kernel_type': 'RBF', 'length_scale': 812.4203092688116, 'noise_level': 0.8370881513715976, 'constant_value': 704.8700916918384, 'nu': 0.5}. Best is trial 881 with value: 0.35916990930150405.
[I 2024-12-04 20:22:52,877] Trial 1316 finished with value: 0.35921123941597266 and parameters: {'kernel_type': 'Matern', 'length_scale': 76.94355913632393, 'noise_level': 0.008316598226882592, 'constant_value': 25.871061102205264, 'nu': 0.5}. Best is trial 881 with value: 0.35916990930150405.
[I 2024-12-04 20:22:52,880] Trial 1317 finished with value: 1.0624161172876543 and parameters: {'kernel_type': 'Matern', 'length_scale': 0.022570801460299304, 'noise_level': 0.8839953717524518, 'constant_value': 1317.913323497943, 'nu': 0.5}. Best is trial 881 with value: 0.35916990930150405.
[I 2024-12-04 20:22:56,243] Trial 1318 finished with value: 0.41956601462299936 and parameters: {'kernel_type': 'Matern', 'length_scale': 4.467159297759643, 'noise_level': 0.49673987478323306, 'constant_value': 172.42367710129832, 'nu': 2.5}. Best is trial 881 with value: 0.35916990930150405.
[I 2024-12-04 20:22:57,344] Trial 1319 finished with value: 0.3592112169340448 and parameters: {'kernel_type': 'Matern', 'length_scale': 57.59932252010163, 'noise_level': 0.0005732011220283042, 'constant_value': 10.967007155083108, 'nu': 0.5}. Best is trial 881 with value: 0.35916990930150405.
[I 2024-12-04 20:22:59,796] Trial 1321 finished with value: 1.091655849389763 and parameters: {'kernel_type': 'RBF', 'length_scale': 5.7339161509597245, 'noise_level': 1.5974104922674953e-10, 'constant_value': 26416.477214016253, 'nu': 1.5}. Best is trial 881 with value: 0.35916990930150405.
[I 2024-12-04 20:23:02,293] Trial 1320 finished with value: 1.0624161173077666 and parameters: {'kernel_type': 'RBF', 'length_scale': 5045.840044940953, 'noise_level': 1.006719163813694e-10, 'constant_value': 0.0003579274989346713, 'nu': 2.5}. Best is trial 881 with value: 0.35916990930150405.
[I 2024-12-04 20:23:03,225] Trial 1322 finished with value: 0.35921126479365784 and parameters: {'kernel_type': 'Matern', 'length_scale': 0.19420869882896472, 'noise_level': 0.011921401022078783, 'constant_value': 1.3711113984125811, 'nu': 0.5}. Best is trial 881 with value: 0.35916990930150405.
[I 2024-12-04 20:23:04,997] Trial 1323 finished with value: 0.3592112408015846 and parameters: {'kernel_type': 'Matern', 'length_scale': 253.34463360808195, 'noise_level': 0.6092274715139326, 'constant_value': 272.58579060158763, 'nu': 0.5}. Best is trial 881 with value: 0.35916990930150405.
[I 2024-12-04 20:23:06,270] Trial 1324 finished with value: 1.0624161175966595 and parameters: {'kernel_type': 'Matern', 'length_scale': 17399.67755950537, 'noise_level': 6.318329121881775e-05, 'constant_value': 87.47057448700073, 'nu': 0.5}. Best is trial 881 with value: 0.35916990930150405.
[I 2024-12-04 20:23:07,714] Trial 1325 finished with value: 0.35921124946056504 and parameters: {'kernel_type': 'Matern', 'length_scale': 32.78630897106937, 'noise_level': 0.008019051645581938, 'constant_value': 3.57035834322681, 'nu': 0.5}. Best is trial 881 with value: 0.35916990930150405.
[I 2024-12-04 20:23:09,819] Trial 1326 finished with value: 0.35921118312416384 and parameters: {'kernel_type': 'Matern', 'length_scale': 1.4840561701049966, 'noise_level': 0.9105398808214816, 'constant_value': 18.048877334999972, 'nu': 0.5}. Best is trial 881 with value: 0.35916990930150405.
[I 2024-12-04 20:23:12,127] Trial 1327 finished with value: 0.3592108014471118 and parameters: {'kernel_type': 'Matern', 'length_scale': 0.18196486200719614, 'noise_level': 0.0003089292420903669, 'constant_value': 5.7071839835493305, 'nu': 0.5}. Best is trial 881 with value: 0.35916990930150405.
[I 2024-12-04 20:23:13,326] Trial 1328 finished with value: 0.35921194664280065 and parameters: {'kernel_type': 'Matern', 'length_scale': 157.59038465196252, 'noise_level': 0.001805740765874463, 'constant_value': 1.2634117463399146, 'nu': 0.5}. Best is trial 881 with value: 0.35916990930150405.
[I 2024-12-04 20:23:15,926] Trial 1329 finished with value: 0.4195660647302298 and parameters: {'kernel_type': 'Matern', 'length_scale': 13.669397888643422, 'noise_level': 0.012904216549587798, 'constant_value': 1258.907595362956, 'nu': 2.5}. Best is trial 881 with value: 0.35916990930150405.
[I 2024-12-04 20:23:17,893] Trial 1331 finished with value: 0.35921133092790236 and parameters: {'kernel_type': 'Matern', 'length_scale': 1.2088927525059494, 'noise_level': 0.0004268318668993475, 'constant_value': 1173.693758021794, 'nu': 0.5}. Best is trial 881 with value: 0.35916990930150405.
[I 2024-12-04 20:23:19,323] Trial 1332 finished with value: 1.0916558493884632 and parameters: {'kernel_type': 'RBF', 'length_scale': 0.0006749956329536617, 'noise_level': 4.14013641003929e-10, 'constant_value': 28252.22357380165, 'nu': 2.5}. Best is trial 881 with value: 0.35916990930150405.
[I 2024-12-04 20:23:22,216] Trial 1330 finished with value: 0.4286835160562983 and parameters: {'kernel_type': 'RBF', 'length_scale': 1.0934529760591067, 'noise_level': 0.002030268674749322, 'constant_value': 0.0037009376911966633, 'nu': 0.5}. Best is trial 881 with value: 0.35916990930150405.
[I 2024-12-04 20:23:22,898] Trial 1334 finished with value: 1.0624156487942937 and parameters: {'kernel_type': 'Matern', 'length_scale': 0.07121967221893011, 'noise_level': 0.018820174171671644, 'constant_value': 751.5029738399418, 'nu': 0.5}. Best is trial 881 with value: 0.35916990930150405.
[I 2024-12-04 20:23:22,899] Trial 1333 finished with value: 0.359211334315222 and parameters: {'kernel_type': 'Matern', 'length_scale': 25.63083615819551, 'noise_level': 0.7403644729506875, 'constant_value': 359.0770546822455, 'nu': 0.5}. Best is trial 881 with value: 0.35916990930150405.
[I 2024-12-04 20:23:26,281] Trial 1335 finished with value: 0.35921117687672965 and parameters: {'kernel_type': 'Matern', 'length_scale': 50.41792906662812, 'noise_level': 0.01837902280033006, 'constant_value': 2790.099408097504, 'nu': 0.5}. Best is trial 881 with value: 0.35916990930150405.
[I 2024-12-04 20:23:28,043] Trial 1336 finished with value: 0.3592112577024895 and parameters: {'kernel_type': 'Matern', 'length_scale': 910.2276193239836, 'noise_level': 0.0007533967846273925, 'constant_value': 33.580449979074416, 'nu': 0.5}. Best is trial 881 with value: 0.35916990930150405.
[I 2024-12-04 20:23:28,558] Trial 1337 finished with value: 0.35921125283164484 and parameters: {'kernel_type': 'Matern', 'length_scale': 54.15031794258361, 'noise_level': 0.016599307905688483, 'constant_value': 37.125113604877505, 'nu': 0.5}. Best is trial 881 with value: 0.35916990930150405.
[I 2024-12-04 20:23:29,813] Trial 1338 finished with value: 0.3592551266179947 and parameters: {'kernel_type': 'Matern', 'length_scale': 2.6767672298821723, 'noise_level': 0.6071319791656774, 'constant_value': 98648.253970161, 'nu': 0.5}. Best is trial 881 with value: 0.35916990930150405.
[I 2024-12-04 20:23:34,984] Trial 1341 finished with value: 0.3592112490175702 and parameters: {'kernel_type': 'Matern', 'length_scale': 0.3255283069567428, 'noise_level': 0.015164118951345234, 'constant_value': 3.127525206253725, 'nu': 0.5}. Best is trial 881 with value: 0.35916990930150405.
[I 2024-12-04 20:23:35,052] Trial 1339 finished with value: 1.0624161165209665 and parameters: {'kernel_type': 'RBF', 'length_scale': 107.47212213351969, 'noise_level': 0.00036359069730795395, 'constant_value': 6.623850294674122, 'nu': 0.5}. Best is trial 881 with value: 0.35916990930150405.
[I 2024-12-04 20:23:35,908] Trial 1340 finished with value: 0.3592112523771261 and parameters: {'kernel_type': 'Matern', 'length_scale': 0.1063477524864703, 'noise_level': 0.5775196154483162, 'constant_value': 3126.3676264418878, 'nu': 0.5}. Best is trial 881 with value: 0.35916990930150405.
[I 2024-12-04 20:23:38,343] Trial 1343 finished with value: 1.091655734587105 and parameters: {'kernel_type': 'Matern', 'length_scale': 1.1917253189184496, 'noise_level': 2.1964859478963595e-06, 'constant_value': 58.801721324634094, 'nu': 0.5}. Best is trial 881 with value: 0.35916990930150405.
[I 2024-12-04 20:23:40,402] Trial 1342 finished with value: 0.3592112435760304 and parameters: {'kernel_type': 'Matern', 'length_scale': 1.078573273064909, 'noise_level': 0.018358078652207926, 'constant_value': 2.169030864349795, 'nu': 0.5}. Best is trial 881 with value: 0.35916990930150405.
[I 2024-12-04 20:23:42,150] Trial 1344 finished with value: 0.35921123800583576 and parameters: {'kernel_type': 'Matern', 'length_scale': 1.4854827834146784, 'noise_level': 0.0001915922147624314, 'constant_value': 0.025822702408546845, 'nu': 0.5}. Best is trial 881 with value: 0.35916990930150405.
[I 2024-12-04 20:23:43,898] Trial 1345 finished with value: 0.3592111657245999 and parameters: {'kernel_type': 'Matern', 'length_scale': 60.54403431311799, 'noise_level': 0.0016412613725610395, 'constant_value': 1675.7340821951052, 'nu': 0.5}. Best is trial 881 with value: 0.35916990930150405.
[I 2024-12-04 20:23:47,612] Trial 1347 finished with value: 1.0624161172708122 and parameters: {'kernel_type': 'Matern', 'length_scale': 0.021148567278665757, 'noise_level': 0.00032340291840693213, 'constant_value': 872.8932082048798, 'nu': 0.5}. Best is trial 881 with value: 0.35916990930150405.
[I 2024-12-04 20:23:49,128] Trial 1346 finished with value: 0.42268980746265455 and parameters: {'kernel_type': 'Matern', 'length_scale': 24.34846911063031, 'noise_level': 0.026497172357801368, 'constant_value': 8154.891632930277, 'nu': 1.5}. Best is trial 881 with value: 0.35916990930150405.
[I 2024-12-04 20:23:50,483] Trial 1348 finished with value: 1.0624161172988786 and parameters: {'kernel_type': 'Matern', 'length_scale': 672.0570738420811, 'noise_level': 0.0009908609487622128, 'constant_value': 0.27403371727825104, 'nu': 0.5}. Best is trial 881 with value: 0.35916990930150405.
[I 2024-12-04 20:23:53,237] Trial 1349 finished with value: 0.4226898319416535 and parameters: {'kernel_type': 'Matern', 'length_scale': 6.972159431653883, 'noise_level': 0.012456752675176793, 'constant_value': 17.140540922238575, 'nu': 1.5}. Best is trial 881 with value: 0.35916990930150405.
[I 2024-12-04 20:23:54,658] Trial 1350 finished with value: 0.3592112338035243 and parameters: {'kernel_type': 'Matern', 'length_scale': 90.95197239901391, 'noise_level': 0.4482844339085509, 'constant_value': 67864.40103399938, 'nu': 0.5}. Best is trial 881 with value: 0.35916990930150405.
[I 2024-12-04 20:23:56,230] Trial 1351 finished with value: 0.35921124275594324 and parameters: {'kernel_type': 'Matern', 'length_scale': 2.69667924494665, 'noise_level': 0.016656603105533074, 'constant_value': 375.72634461214994, 'nu': 0.5}. Best is trial 881 with value: 0.35916990930150405.
[I 2024-12-04 20:23:59,348] Trial 1352 finished with value: 0.4286835126753734 and parameters: {'kernel_type': 'RBF', 'length_scale': 174.59080824763916, 'noise_level': 0.009028067940379187, 'constant_value': 20392.59548438181, 'nu': 0.5}. Best is trial 881 with value: 0.35916990930150405.
[I 2024-12-04 20:24:00,082] Trial 1353 finished with value: 0.35921118487654397 and parameters: {'kernel_type': 'Matern', 'length_scale': 520.6405045592852, 'noise_level': 0.6977457363477443, 'constant_value': 208.44803682631192, 'nu': 0.5}. Best is trial 881 with value: 0.35916990930150405.
[I 2024-12-04 20:24:01,671] Trial 1354 finished with value: 0.35921130154078434 and parameters: {'kernel_type': 'Matern', 'length_scale': 67.63411694446215, 'noise_level': 0.029647194874816176, 'constant_value': 42.15348497988993, 'nu': 0.5}. Best is trial 881 with value: 0.35916990930150405.
[I 2024-12-04 20:24:04,415] Trial 1355 finished with value: 0.3592112484569614 and parameters: {'kernel_type': 'Matern', 'length_scale': 1.8411013961532399, 'noise_level': 0.0006171538284488666, 'constant_value': 43.594393539539965, 'nu': 0.5}. Best is trial 881 with value: 0.35916990930150405.
[I 2024-12-04 20:24:04,694] Trial 1356 finished with value: 0.35921114883934424 and parameters: {'kernel_type': 'Matern', 'length_scale': 3.339085485700161, 'noise_level': 0.9095702279759077, 'constant_value': 2442.972537868078, 'nu': 0.5}. Best is trial 881 with value: 0.35916990930150405.
[I 2024-12-04 20:24:05,601] Trial 1357 finished with value: 1.0624161173873121 and parameters: {'kernel_type': 'Matern', 'length_scale': 0.03875700552574038, 'noise_level': 0.01882073951128208, 'constant_value': 276.11548697943005, 'nu': 0.5}. Best is trial 881 with value: 0.35916990930150405.
[I 2024-12-04 20:24:12,174] Trial 1358 finished with value: 1.0624161174439435 and parameters: {'kernel_type': 'Matern', 'length_scale': 0.019557153026234345, 'noise_level': 0.004849876707654181, 'constant_value': 1.7773542208881103, 'nu': 2.5}. Best is trial 881 with value: 0.35916990930150405.
[I 2024-12-04 20:24:14,416] Trial 1359 finished with value: 0.3592109864397825 and parameters: {'kernel_type': 'Matern', 'length_scale': 28.869551601747286, 'noise_level': 0.0038948686530715514, 'constant_value': 6.311546783422619, 'nu': 0.5}. Best is trial 881 with value: 0.35916990930150405.
[I 2024-12-04 20:24:16,977] Trial 1360 finished with value: 0.41956601522090187 and parameters: {'kernel_type': 'Matern', 'length_scale': 3729.1777539701193, 'noise_level': 0.05985447913990773, 'constant_value': 72234.88794680643, 'nu': 2.5}. Best is trial 881 with value: 0.35916990930150405.
[I 2024-12-04 20:24:18,068] Trial 1361 finished with value: 0.3592112438654746 and parameters: {'kernel_type': 'Matern', 'length_scale': 1723.6496336220696, 'noise_level': 0.0037625697180165784, 'constant_value': 1383.0342956944912, 'nu': 0.5}. Best is trial 881 with value: 0.35916990930150405.
[I 2024-12-04 20:24:20,638] Trial 1362 finished with value: 0.359211227844745 and parameters: {'kernel_type': 'Matern', 'length_scale': 0.24887102990448554, 'noise_level': 0.03364512886774814, 'constant_value': 2623.567481071455, 'nu': 0.5}. Best is trial 881 with value: 0.35916990930150405.
[I 2024-12-04 20:24:22,187] Trial 1364 finished with value: 0.42868351329269394 and parameters: {'kernel_type': 'RBF', 'length_scale': 20.123521601607912, 'noise_level': 0.06070193641241186, 'constant_value': 224.34615616710076, 'nu': 0.5}. Best is trial 881 with value: 0.35916990930150405.
[I 2024-12-04 20:24:22,568] Trial 1363 finished with value: 0.35921121174906157 and parameters: {'kernel_type': 'Matern', 'length_scale': 16.38594017730266, 'noise_level': 0.033946923277590774, 'constant_value': 8.183788482051066, 'nu': 0.5}. Best is trial 881 with value: 0.35916990930150405.
[I 2024-12-04 20:24:26,481] Trial 1365 finished with value: 1.0916558493887853 and parameters: {'kernel_type': 'Matern', 'length_scale': 0.012187325224641464, 'noise_level': 2.2744491864707064e-10, 'constant_value': 145.1858714809768, 'nu': 1.5}. Best is trial 881 with value: 0.35916990930150405.
[I 2024-12-04 20:24:29,451] Trial 1366 finished with value: 0.3592112834465318 and parameters: {'kernel_type': 'Matern', 'length_scale': 2414.4601190779413, 'noise_level': 0.03493124641630838, 'constant_value': 33.84394658314236, 'nu': 0.5}. Best is trial 881 with value: 0.35916990930150405.
[I 2024-12-04 20:24:29,455] Trial 1367 finished with value: 0.359210859928295 and parameters: {'kernel_type': 'Matern', 'length_scale': 11.691733011257673, 'noise_level': 0.0046259295984486404, 'constant_value': 1051.9214828526217, 'nu': 0.5}. Best is trial 881 with value: 0.35916990930150405.
[I 2024-12-04 20:24:31,132] Trial 1368 finished with value: 0.3592114459256084 and parameters: {'kernel_type': 'Matern', 'length_scale': 7.828157223944066, 'noise_level': 0.06012816172818899, 'constant_value': 7.239139644789636, 'nu': 0.5}. Best is trial 881 with value: 0.35916990930150405.
[I 2024-12-04 20:24:33,125] Trial 1370 finished with value: 1.0916564980898391 and parameters: {'kernel_type': 'Matern', 'length_scale': 3.517139655087606, 'noise_level': 1.0756733352486915e-05, 'constant_value': 93190.2140918162, 'nu': 0.5}. Best is trial 881 with value: 0.35916990930150405.
[I 2024-12-04 20:24:33,687] Trial 1369 finished with value: 1.0624161204938716 and parameters: {'kernel_type': 'Matern', 'length_scale': 0.0010429224843966618, 'noise_level': 0.01188022001717458, 'constant_value': 14968.709045404412, 'nu': 0.5}. Best is trial 881 with value: 0.35916990930150405.
[I 2024-12-04 20:24:36,561] Trial 1371 finished with value: 0.35921106772876826 and parameters: {'kernel_type': 'Matern', 'length_scale': 0.8156309316857567, 'noise_level': 0.027741371980628943, 'constant_value': 36.7256793009871, 'nu': 0.5}. Best is trial 881 with value: 0.35916990930150405.
[I 2024-12-04 20:24:38,983] Trial 1372 finished with value: 0.3592110794351453 and parameters: {'kernel_type': 'Matern', 'length_scale': 183.6034051565742, 'noise_level': 0.0045185017639378915, 'constant_value': 89375.13565009438, 'nu': 0.5}. Best is trial 881 with value: 0.35916990930150405.
[I 2024-12-04 20:24:40,022] Trial 1373 finished with value: 1.0624161172266031 and parameters: {'kernel_type': 'RBF', 'length_scale': 11.01941067052233, 'noise_level': 4.975016912006577e-07, 'constant_value': 6.044692468035639e-07, 'nu': 2.5}. Best is trial 881 with value: 0.35916990930150405.
[I 2024-12-04 20:24:41,746] Trial 1374 finished with value: 0.3592113597177487 and parameters: {'kernel_type': 'Matern', 'length_scale': 0.3178772905377078, 'noise_level': 0.8585413415908935, 'constant_value': 33.97084153349234, 'nu': 0.5}. Best is trial 881 with value: 0.35916990930150405.
