[I 2024-12-04 15:32:40,769] Trial 2226 finished with value: 0.13435430157031858 and parameters: {'kernel_type': 'Matern', 'length_scale': 18.800309557171754, 'noise_level': 0.007253133709445944, 'constant_value': 96661.35781893531, 'nu': 1.5}. Best is trial 1985 with value: 0.134351948015208.
[I 2024-12-04 15:32:41,289] Trial 2238 finished with value: 0.13435439194836307 and parameters: {'kernel_type': 'Matern', 'length_scale': 138.5871988733094, 'noise_level': 0.0017227931402418984, 'constant_value': 2157.544969207768, 'nu': 1.5}. Best is trial 1985 with value: 0.134351948015208.
[I 2024-12-04 15:32:41,490] Trial 2235 finished with value: 0.14859828475199188 and parameters: {'kernel_type': 'Matern', 'length_scale': 373.71053181143884, 'noise_level': 0.03665530457772809, 'constant_value': 65247.39434995067, 'nu': 2.5}. Best is trial 1985 with value: 0.134351948015208.
[I 2024-12-04 15:32:42,775] Trial 2228 finished with value: 0.134354292163276 and parameters: {'kernel_type': 'Matern', 'length_scale': 147.49936457990057, 'noise_level': 0.0016400249530129968, 'constant_value': 44635.07256313336, 'nu': 1.5}. Best is trial 1985 with value: 0.134351948015208.
[I 2024-12-04 15:32:45,302] Trial 2222 finished with value: 0.13435437204433906 and parameters: {'kernel_type': 'Matern', 'length_scale': 259.85253758003853, 'noise_level': 0.03835566004918624, 'constant_value': 3067.946907791602, 'nu': 1.5}. Best is trial 1985 with value: 0.134351948015208.
[I 2024-12-04 15:32:45,305] Trial 2224 finished with value: 0.13435441902028214 and parameters: {'kernel_type': 'Matern', 'length_scale': 8.445990106501167, 'noise_level': 0.004257870950888642, 'constant_value': 61604.243367488096, 'nu': 1.5}. Best is trial 1985 with value: 0.134351948015208.
[I 2024-12-04 15:32:47,475] Trial 2225 finished with value: 0.1343544010878541 and parameters: {'kernel_type': 'Matern', 'length_scale': 17.156443827341633, 'noise_level': 0.0033623161301419083, 'constant_value': 759.6548646242833, 'nu': 1.5}. Best is trial 1985 with value: 0.134351948015208.
[I 2024-12-04 15:32:49,267] Trial 2234 finished with value: 0.1343545374227996 and parameters: {'kernel_type': 'Matern', 'length_scale': 68.91338576064304, 'noise_level': 0.04069207789047672, 'constant_value': 99259.23970383151, 'nu': 1.5}. Best is trial 1985 with value: 0.134351948015208.
[I 2024-12-04 15:32:51,910] Trial 2231 finished with value: 0.13435437992838578 and parameters: {'kernel_type': 'Matern', 'length_scale': 1282.6829829031697, 'noise_level': 0.014957433028359972, 'constant_value': 55618.25444437972, 'nu': 1.5}. Best is trial 1985 with value: 0.134351948015208.
[I 2024-12-04 15:32:52,185] Trial 2242 finished with value: 0.1343544942823084 and parameters: {'kernel_type': 'Matern', 'length_scale': 6.798498087446162, 'noise_level': 0.004793387445281342, 'constant_value': 99523.8996053041, 'nu': 1.5}. Best is trial 1985 with value: 0.134351948015208.
[I 2024-12-04 15:32:52,262] Trial 2237 finished with value: 0.1343547066187084 and parameters: {'kernel_type': 'Matern', 'length_scale': 4.879285005141574, 'noise_level': 0.0005484132299432284, 'constant_value': 10637.28355668144, 'nu': 1.5}. Best is trial 1985 with value: 0.134351948015208.
[I 2024-12-04 15:32:53,631] Trial 2232 finished with value: 0.13435460098400967 and parameters: {'kernel_type': 'Matern', 'length_scale': 5.367131284784982, 'noise_level': 0.00010144660063520378, 'constant_value': 96141.65740483545, 'nu': 1.5}. Best is trial 1985 with value: 0.134351948015208.
[I 2024-12-04 15:32:53,638] Trial 2239 finished with value: 0.13435437610096823 and parameters: {'kernel_type': 'Matern', 'length_scale': 32.11200739706397, 'noise_level': 0.0004813239130659664, 'constant_value': 64212.38552990183, 'nu': 1.5}. Best is trial 1985 with value: 0.134351948015208.
[I 2024-12-04 15:32:53,739] Trial 2227 finished with value: 0.13435437125291927 and parameters: {'kernel_type': 'Matern', 'length_scale': 225.75392014112606, 'noise_level': 0.01345927429342168, 'constant_value': 2673.853789202888, 'nu': 1.5}. Best is trial 1985 with value: 0.134351948015208.
[I 2024-12-04 15:32:53,883] Trial 2236 finished with value: 0.13435438473339895 and parameters: {'kernel_type': 'Matern', 'length_scale': 287.71497857529306, 'noise_level': 0.00694173618075193, 'constant_value': 76396.07971656766, 'nu': 1.5}. Best is trial 1985 with value: 0.134351948015208.
[I 2024-12-04 15:32:54,174] Trial 2233 finished with value: 0.13435304930005101 and parameters: {'kernel_type': 'Matern', 'length_scale': 14.809279509617683, 'noise_level': 0.012298043763388595, 'constant_value': 79560.04325365319, 'nu': 1.5}. Best is trial 1985 with value: 0.134351948015208.
[I 2024-12-04 15:32:55,856] Trial 2240 finished with value: 0.13435439744828928 and parameters: {'kernel_type': 'Matern', 'length_scale': 15.068781176943558, 'noise_level': 0.3186456767660023, 'constant_value': 96037.79979679541, 'nu': 1.5}. Best is trial 1985 with value: 0.134351948015208.
[I 2024-12-04 15:32:55,968] Trial 2245 finished with value: 1.2693635028569847 and parameters: {'kernel_type': 'Matern', 'length_scale': 0.011616301072028887, 'noise_level': 0.00441562195602158, 'constant_value': 10625.45268773106, 'nu': 1.5}. Best is trial 1985 with value: 0.134351948015208.
[I 2024-12-04 15:32:56,838] Trial 2243 finished with value: 1.269363502856961 and parameters: {'kernel_type': 'Matern', 'length_scale': 0.04890750099133984, 'noise_level': 0.023991313202868673, 'constant_value': 81027.83834268787, 'nu': 1.5}. Best is trial 1985 with value: 0.134351948015208.
[I 2024-12-04 15:32:56,889] Trial 2246 finished with value: 0.13435439854544567 and parameters: {'kernel_type': 'Matern', 'length_scale': 0.5896647256270268, 'noise_level': 0.014197286435339901, 'constant_value': 2685.1206404001305, 'nu': 1.5}. Best is trial 1985 with value: 0.134351948015208.
[I 2024-12-04 15:32:57,534] Trial 2241 finished with value: 0.151672950461508 and parameters: {'kernel_type': 'RBF', 'length_scale': 36.59812541259743, 'noise_level': 0.021379779332950745, 'constant_value': 76257.65275379067, 'nu': 1.5}. Best is trial 1985 with value: 0.134351948015208.
[I 2024-12-04 15:32:58,202] Trial 2244 finished with value: 0.13435382983921748 and parameters: {'kernel_type': 'Matern', 'length_scale': 5.244173656758321, 'noise_level': 0.3799787896193224, 'constant_value': 61988.79501486921, 'nu': 1.5}. Best is trial 1985 with value: 0.134351948015208.
[I 2024-12-04 15:33:02,419] Trial 2251 finished with value: 0.1343542391976494 and parameters: {'kernel_type': 'Matern', 'length_scale': 1.3622071239739502, 'noise_level': 0.0016791476243972075, 'constant_value': 49323.41658820143, 'nu': 1.5}. Best is trial 1985 with value: 0.134351948015208.
[I 2024-12-04 15:33:02,437] Trial 2248 finished with value: 0.13435435954850158 and parameters: {'kernel_type': 'Matern', 'length_scale': 2.849212603458846, 'noise_level': 0.15624140055903665, 'constant_value': 67186.46885851497, 'nu': 1.5}. Best is trial 1985 with value: 0.134351948015208.
[I 2024-12-04 15:33:03,147] Trial 2252 finished with value: 0.13435436013464078 and parameters: {'kernel_type': 'Matern', 'length_scale': 4.11940054744566, 'noise_level': 0.00038136386803465475, 'constant_value': 466.4859494724474, 'nu': 1.5}. Best is trial 1985 with value: 0.134351948015208.
[I 2024-12-04 15:33:03,423] Trial 2256 finished with value: 0.13435439107051772 and parameters: {'kernel_type': 'Matern', 'length_scale': 5.741576244592775, 'noise_level': 0.014377030713322327, 'constant_value': 43511.76481991085, 'nu': 1.5}. Best is trial 1985 with value: 0.134351948015208.
[I 2024-12-04 15:33:04,452] Trial 2253 finished with value: 0.17251040269692386 and parameters: {'kernel_type': 'Matern', 'length_scale': 11.308941484001346, 'noise_level': 0.007039736536659438, 'constant_value': 18097.741903273105, 'nu': 0.5}. Best is trial 1985 with value: 0.134351948015208.
[I 2024-12-04 15:33:05,216] Trial 2247 finished with value: 0.13435440810811675 and parameters: {'kernel_type': 'Matern', 'length_scale': 2.0043083519697125, 'noise_level': 0.5807727073679996, 'constant_value': 1887.096858982657, 'nu': 1.5}. Best is trial 1985 with value: 0.134351948015208.
[I 2024-12-04 15:33:09,055] Trial 2249 finished with value: 1.2693635027362626 and parameters: {'kernel_type': 'Matern', 'length_scale': 0.0670028191056011, 'noise_level': 0.08135502094303446, 'constant_value': 8098.0339410447295, 'nu': 1.5}. Best is trial 1985 with value: 0.134351948015208.
[I 2024-12-04 15:33:09,057] Trial 2255 finished with value: 1.2693635028568373 and parameters: {'kernel_type': 'RBF', 'length_scale': 0.012491117893957758, 'noise_level': 0.35304229773816975, 'constant_value': 197.26990769452058, 'nu': 1.5}. Best is trial 1985 with value: 0.134351948015208.
[I 2024-12-04 15:33:09,067] Trial 2254 finished with value: 0.1343544000991686 and parameters: {'kernel_type': 'Matern', 'length_scale': 1.0573166877151818, 'noise_level': 0.03525809967190546, 'constant_value': 59962.65631559003, 'nu': 1.5}. Best is trial 1985 with value: 0.134351948015208.
[I 2024-12-04 15:33:09,067] Trial 2260 finished with value: 0.13435439898247253 and parameters: {'kernel_type': 'Matern', 'length_scale': 1.1722170165157815, 'noise_level': 0.08053196554444886, 'constant_value': 11306.26550530211, 'nu': 1.5}. Best is trial 1985 with value: 0.134351948015208.
[I 2024-12-04 15:33:10,768] Trial 2250 finished with value: 0.13435440625979878 and parameters: {'kernel_type': 'Matern', 'length_scale': 0.9604068546516747, 'noise_level': 0.7635320292110087, 'constant_value': 19733.593229181657, 'nu': 1.5}. Best is trial 1985 with value: 0.134351948015208.
[I 2024-12-04 15:33:16,374] Trial 2264 finished with value: 0.13435438735735578 and parameters: {'kernel_type': 'Matern', 'length_scale': 1.79627854061063, 'noise_level': 0.27181663715201426, 'constant_value': 97773.89674778025, 'nu': 1.5}. Best is trial 1985 with value: 0.134351948015208.
[I 2024-12-04 15:33:18,296] Trial 2261 finished with value: 0.13435439124618528 and parameters: {'kernel_type': 'Matern', 'length_scale': 7.309993342384883, 'noise_level': 0.5013671315413913, 'constant_value': 902.1630655695327, 'nu': 1.5}. Best is trial 1985 with value: 0.134351948015208.
[I 2024-12-04 15:33:24,940] Trial 2266 finished with value: 0.1343544006646666 and parameters: {'kernel_type': 'Matern', 'length_scale': 7.0910427014732536, 'noise_level': 0.9019291803778203, 'constant_value': 18160.00476375988, 'nu': 1.5}. Best is trial 1985 with value: 0.134351948015208.
[I 2024-12-04 15:33:25,275] Trial 2271 finished with value: 1.269363502857661 and parameters: {'kernel_type': 'Matern', 'length_scale': 0.013344950557657064, 'noise_level': 0.13086482105206135, 'constant_value': 55637.29510948863, 'nu': 1.5}. Best is trial 1985 with value: 0.134351948015208.
[I 2024-12-04 15:33:28,096] Trial 2270 finished with value: 0.15167300464908545 and parameters: {'kernel_type': 'RBF', 'length_scale': 35.600244501508335, 'noise_level': 0.9257192058798922, 'constant_value': 83523.71398512644, 'nu': 1.5}. Best is trial 1985 with value: 0.134351948015208.
[I 2024-12-04 15:33:28,652] Trial 2268 finished with value: 1.269363502856953 and parameters: {'kernel_type': 'RBF', 'length_scale': 5.957643449480868e-05, 'noise_level': 0.0014029399158639248, 'constant_value': 6.949368692568313, 'nu': 2.5}. Best is trial 1985 with value: 0.134351948015208.
[I 2024-12-04 15:33:28,866] Trial 2259 finished with value: 0.13435477430875442 and parameters: {'kernel_type': 'Matern', 'length_scale': 2.300250725128786, 'noise_level': 0.11505842646942264, 'constant_value': 58803.57865448101, 'nu': 1.5}. Best is trial 1985 with value: 0.134351948015208.
[I 2024-12-04 15:33:29,954] Trial 2257 finished with value: 0.13435437499863107 and parameters: {'kernel_type': 'Matern', 'length_scale': 14.18400870266432, 'noise_level': 0.34569994022727746, 'constant_value': 4070.6231792917833, 'nu': 1.5}. Best is trial 1985 with value: 0.134351948015208.
[I 2024-12-04 15:33:30,257] Trial 2265 finished with value: 1.269363502856921 and parameters: {'kernel_type': 'Matern', 'length_scale': 0.01982659011624284, 'noise_level': 0.001444413548475825, 'constant_value': 126.83929678193226, 'nu': 2.5}. Best is trial 1985 with value: 0.134351948015208.
[I 2024-12-04 15:33:33,348] Trial 2274 finished with value: 0.13435439969035995 and parameters: {'kernel_type': 'Matern', 'length_scale': 10.116368338319724, 'noise_level': 0.9518529983834553, 'constant_value': 75743.59796508779, 'nu': 1.5}. Best is trial 1985 with value: 0.134351948015208.
[I 2024-12-04 15:33:34,636] Trial 2275 finished with value: 0.1343542586950247 and parameters: {'kernel_type': 'Matern', 'length_scale': 14.369220575385729, 'noise_level': 0.2034522126773736, 'constant_value': 17187.111121455866, 'nu': 1.5}. Best is trial 1985 with value: 0.134351948015208.
[I 2024-12-04 15:33:34,939] Trial 2258 finished with value: 0.13435439435725663 and parameters: {'kernel_type': 'Matern', 'length_scale': 7.955294822096705, 'noise_level': 0.04786862973794674, 'constant_value': 3317.678374416175, 'nu': 1.5}. Best is trial 1985 with value: 0.134351948015208.
[I 2024-12-04 15:33:35,012] Trial 2263 finished with value: 0.13435435327469825 and parameters: {'kernel_type': 'Matern', 'length_scale': 4.342043932341757, 'noise_level': 0.06172552866227309, 'constant_value': 3535.8765452883977, 'nu': 1.5}. Best is trial 1985 with value: 0.134351948015208.
[I 2024-12-04 15:33:36,268] Trial 2277 finished with value: 1.2693635028757975 and parameters: {'kernel_type': 'Matern', 'length_scale': 0.023991197483981007, 'noise_level': 0.0018190669139699662, 'constant_value': 99856.13246646736, 'nu': 1.5}. Best is trial 1985 with value: 0.134351948015208.
[I 2024-12-04 15:33:36,466] Trial 2273 finished with value: 0.1343543747285342 and parameters: {'kernel_type': 'Matern', 'length_scale': 6.327888022935818, 'noise_level': 0.02794971623603483, 'constant_value': 89910.2712772275, 'nu': 1.5}. Best is trial 1985 with value: 0.134351948015208.
[I 2024-12-04 15:33:36,495] Trial 2269 finished with value: 0.13435424056539055 and parameters: {'kernel_type': 'Matern', 'length_scale': 4.894251763527286, 'noise_level': 0.5859402272327413, 'constant_value': 34541.98233540292, 'nu': 1.5}. Best is trial 1985 with value: 0.134351948015208.
[I 2024-12-04 15:33:36,902] Trial 2267 finished with value: 0.13435418799616772 and parameters: {'kernel_type': 'Matern', 'length_scale': 168.01204166126206, 'noise_level': 0.06278117695432665, 'constant_value': 56992.97576787783, 'nu': 1.5}. Best is trial 1985 with value: 0.134351948015208.
[I 2024-12-04 15:33:38,267] Trial 2278 finished with value: 0.13435417273804906 and parameters: {'kernel_type': 'Matern', 'length_scale': 105.23670324092325, 'noise_level': 0.0274529971986865, 'constant_value': 71153.61542889626, 'nu': 1.5}. Best is trial 1985 with value: 0.134351948015208.
[I 2024-12-04 15:33:40,571] Trial 2284 finished with value: 0.13435431665242875 and parameters: {'kernel_type': 'Matern', 'length_scale': 27.40359560286628, 'noise_level': 0.03257983009338807, 'constant_value': 64767.37026803299, 'nu': 1.5}. Best is trial 1985 with value: 0.134351948015208.
[I 2024-12-04 15:33:40,595] Trial 2280 finished with value: 0.13435440049178218 and parameters: {'kernel_type': 'Matern', 'length_scale': 52.786523162591415, 'noise_level': 0.01967541560801552, 'constant_value': 76546.21450955751, 'nu': 1.5}. Best is trial 1985 with value: 0.134351948015208.
[I 2024-12-04 15:33:41,467] Trial 2279 finished with value: 0.1343544176547876 and parameters: {'kernel_type': 'Matern', 'length_scale': 36.73231930033554, 'noise_level': 0.005196281073137098, 'constant_value': 96270.89480777457, 'nu': 1.5}. Best is trial 1985 with value: 0.134351948015208.
[I 2024-12-04 15:33:41,714] Trial 2276 finished with value: 0.13435429595511103 and parameters: {'kernel_type': 'Matern', 'length_scale': 87.66376681484562, 'noise_level': 0.8651001434565588, 'constant_value': 12510.989925646523, 'nu': 1.5}. Best is trial 1985 with value: 0.134351948015208.
[I 2024-12-04 15:33:43,209] Trial 2286 finished with value: 0.13435439675426947 and parameters: {'kernel_type': 'Matern', 'length_scale': 5.981354660387221, 'noise_level': 0.19798673418795365, 'constant_value': 97786.53248557793, 'nu': 1.5}. Best is trial 1985 with value: 0.134351948015208.
[I 2024-12-04 15:33:44,988] Trial 2291 finished with value: 1.269363502685509 and parameters: {'kernel_type': 'Matern', 'length_scale': 0.06805102354707093, 'noise_level': 0.7218325393281995, 'constant_value': 12999.25442178974, 'nu': 1.5}. Best is trial 1985 with value: 0.134351948015208.
[I 2024-12-04 15:33:45,291] Trial 2272 finished with value: 0.13435442667789047 and parameters: {'kernel_type': 'Matern', 'length_scale': 0.23608289184016915, 'noise_level': 0.018838133420226423, 'constant_value': 85140.10891862742, 'nu': 1.5}. Best is trial 1985 with value: 0.134351948015208.
[I 2024-12-04 15:33:45,292] Trial 2262 finished with value: 0.1343543562408046 and parameters: {'kernel_type': 'Matern', 'length_scale': 0.14220862981340104, 'noise_level': 0.17140871186742077, 'constant_value': 2780.429638083382, 'nu': 1.5}. Best is trial 1985 with value: 0.134351948015208.
[I 2024-12-04 15:33:46,578] Trial 2288 finished with value: 0.13435439157230109 and parameters: {'kernel_type': 'Matern', 'length_scale': 0.5033445348716947, 'noise_level': 0.001960100874380676, 'constant_value': 5089.10100288882, 'nu': 1.5}. Best is trial 1985 with value: 0.134351948015208.
[I 2024-12-04 15:33:48,046] Trial 2287 finished with value: 1.3007745979657548 and parameters: {'kernel_type': 'Matern', 'length_scale': 2.5774681062174367, 'noise_level': 0.0010403122477779685, 'constant_value': 76780.33282795186, 'nu': 1.5}. Best is trial 1985 with value: 0.134351948015208.
[I 2024-12-04 15:33:49,638] Trial 2285 finished with value: 1.269363502848449 and parameters: {'kernel_type': 'Matern', 'length_scale': 0.060888709482530154, 'noise_level': 0.014097818193441622, 'constant_value': 89477.03773112064, 'nu': 1.5}. Best is trial 1985 with value: 0.134351948015208.
[I 2024-12-04 15:33:50,835] Trial 2283 finished with value: 0.14859826439118057 and parameters: {'kernel_type': 'Matern', 'length_scale': 0.2605271369455177, 'noise_level': 0.05642489598509278, 'constant_value': 49005.36069166279, 'nu': 2.5}. Best is trial 1985 with value: 0.134351948015208.
[I 2024-12-04 15:33:51,621] Trial 2293 finished with value: 0.13435439665985527 and parameters: {'kernel_type': 'Matern', 'length_scale': 14.918365905678414, 'noise_level': 0.005793876064156474, 'constant_value': 76176.95819670642, 'nu': 1.5}. Best is trial 1985 with value: 0.134351948015208.
[I 2024-12-04 15:33:51,623] Trial 2289 finished with value: 1.269363502856623 and parameters: {'kernel_type': 'Matern', 'length_scale': 82293.15523483796, 'noise_level': 2.6484378753036522e-05, 'constant_value': 1.0342333386574964, 'nu': 0.5}. Best is trial 1985 with value: 0.134351948015208.
[I 2024-12-04 15:33:52,771] Trial 2281 finished with value: 1.2693635028569827 and parameters: {'kernel_type': 'Matern', 'length_scale': 0.004610754316280178, 'noise_level': 0.40722937770620843, 'constant_value': 493.91623538751486, 'nu': 2.5}. Best is trial 1985 with value: 0.134351948015208.
[I 2024-12-04 15:33:53,611] Trial 2290 finished with value: 1.269363502848747 and parameters: {'kernel_type': 'Matern', 'length_scale': 6.777260471589764e-05, 'noise_level': 1.293789294712285e-05, 'constant_value': 0.00015416639092264418, 'nu': 1.5}. Best is trial 1985 with value: 0.134351948015208.
[I 2024-12-04 15:33:54,204] Trial 2292 finished with value: 0.1343543978229333 and parameters: {'kernel_type': 'Matern', 'length_scale': 0.844989935188104, 'noise_level': 0.15375312888562281, 'constant_value': 97897.2606321688, 'nu': 1.5}. Best is trial 1985 with value: 0.134351948015208.
[I 2024-12-04 15:33:54,204] Trial 2294 finished with value: 0.13435430778485577 and parameters: {'kernel_type': 'Matern', 'length_scale': 159.5033931939138, 'noise_level': 0.27498535182328715, 'constant_value': 94231.38605331599, 'nu': 1.5}. Best is trial 1985 with value: 0.134351948015208.
[I 2024-12-04 15:33:57,861] Trial 2282 finished with value: 0.13435442823934965 and parameters: {'kernel_type': 'Matern', 'length_scale': 7.591704622844308, 'noise_level': 0.8345660945762156, 'constant_value': 6245.652882807614, 'nu': 1.5}. Best is trial 1985 with value: 0.134351948015208.
[I 2024-12-04 15:33:57,877] Trial 2301 finished with value: 0.13435440009557184 and parameters: {'kernel_type': 'Matern', 'length_scale': 0.41423682766933095, 'noise_level': 0.0024785224688482505, 'constant_value': 2277.664713917237, 'nu': 1.5}. Best is trial 1985 with value: 0.134351948015208.
[I 2024-12-04 15:33:59,406] Trial 2303 finished with value: 0.1343544067925144 and parameters: {'kernel_type': 'Matern', 'length_scale': 0.8801336276625895, 'noise_level': 0.07384746744542581, 'constant_value': 1458.0800426922867, 'nu': 1.5}. Best is trial 1985 with value: 0.134351948015208.
[I 2024-12-04 15:33:59,736] Trial 2295 finished with value: 0.13435440328772946 and parameters: {'kernel_type': 'Matern', 'length_scale': 1.0664267753890717, 'noise_level': 0.002039684839770158, 'constant_value': 91039.62231721327, 'nu': 1.5}. Best is trial 1985 with value: 0.134351948015208.
[I 2024-12-04 15:33:59,763] Trial 2298 finished with value: 0.1485982725036874 and parameters: {'kernel_type': 'Matern', 'length_scale': 5.395234276464255, 'noise_level': 0.006965842287541416, 'constant_value': 12639.57098207032, 'nu': 2.5}. Best is trial 1985 with value: 0.134351948015208.
[I 2024-12-04 15:34:01,823] Trial 2302 finished with value: 0.1343544027095092 and parameters: {'kernel_type': 'Matern', 'length_scale': 1.2944122889559824, 'noise_level': 0.004319386395705657, 'constant_value': 68427.84124833692, 'nu': 1.5}. Best is trial 1985 with value: 0.134351948015208.
