[I 2024-12-04 15:24:53,498] Trial 1782 finished with value: 0.13435440553404318 and parameters: {'kernel_type': 'Matern', 'length_scale': 15.084090289389131, 'noise_level': 0.006425832195371399, 'constant_value': 70229.49865427335, 'nu': 1.5}. Best is trial 1456 with value: 0.13435337537029549.
[I 2024-12-04 15:24:55,066] Trial 1785 finished with value: 0.13435435172609872 and parameters: {'kernel_type': 'Matern', 'length_scale': 9.958994030242646, 'noise_level': 0.10517503898213265, 'constant_value': 79678.96283356898, 'nu': 1.5}. Best is trial 1456 with value: 0.13435337537029549.
[I 2024-12-04 15:24:58,956] Trial 1791 finished with value: 0.13435440321551947 and parameters: {'kernel_type': 'Matern', 'length_scale': 6.3825316940298835, 'noise_level': 0.0006567143926311455, 'constant_value': 1165.3842956618962, 'nu': 1.5}. Best is trial 1456 with value: 0.13435337537029549.
[I 2024-12-04 15:24:59,732] Trial 1777 finished with value: 0.13435424604582785 and parameters: {'kernel_type': 'Matern', 'length_scale': 7.757819405971247, 'noise_level': 0.021106345118314013, 'constant_value': 37.05434727359613, 'nu': 1.5}. Best is trial 1456 with value: 0.13435337537029549.
[I 2024-12-04 15:24:59,732] Trial 1788 finished with value: 0.13435439794102005 and parameters: {'kernel_type': 'Matern', 'length_scale': 8.597743270020601, 'noise_level': 0.002033380016995238, 'constant_value': 516.1999218554607, 'nu': 1.5}. Best is trial 1456 with value: 0.13435337537029549.
[I 2024-12-04 15:25:00,607] Trial 1792 finished with value: 0.151673023324422 and parameters: {'kernel_type': 'RBF', 'length_scale': 6.607572118280673, 'noise_level': 0.07829279802436201, 'constant_value': 153.13528850782285, 'nu': 1.5}. Best is trial 1456 with value: 0.13435337537029549.
[I 2024-12-04 15:25:02,101] Trial 1787 finished with value: 0.13435439142844183 and parameters: {'kernel_type': 'Matern', 'length_scale': 327.50274141410483, 'noise_level': 0.010609946934927573, 'constant_value': 1057.6459156369824, 'nu': 1.5}. Best is trial 1456 with value: 0.13435337537029549.
[I 2024-12-04 15:25:02,694] Trial 1786 finished with value: 0.15167294787037422 and parameters: {'kernel_type': 'RBF', 'length_scale': 395.60606753742593, 'noise_level': 0.08102156439656437, 'constant_value': 73850.75937760937, 'nu': 1.5}. Best is trial 1456 with value: 0.13435337537029549.
[I 2024-12-04 15:25:06,009] Trial 1798 finished with value: 0.1343543327006755 and parameters: {'kernel_type': 'Matern', 'length_scale': 254.4417991394969, 'noise_level': 0.18705563708271442, 'constant_value': 7.684566634249804, 'nu': 1.5}. Best is trial 1456 with value: 0.13435337537029549.
[I 2024-12-04 15:25:06,182] Trial 1797 finished with value: 0.13435439639324895 and parameters: {'kernel_type': 'Matern', 'length_scale': 3828.3872054779804, 'noise_level': 0.027557758808560564, 'constant_value': 131.79668320426669, 'nu': 1.5}. Best is trial 1456 with value: 0.13435337537029549.
[I 2024-12-04 15:25:09,024] Trial 1793 finished with value: 1.2693635028568175 and parameters: {'kernel_type': 'Matern', 'length_scale': 241.6203932979768, 'noise_level': 0.0018156116669378218, 'constant_value': 10.501685580436634, 'nu': 1.5}. Best is trial 1456 with value: 0.13435337537029549.
[I 2024-12-04 15:25:11,299] Trial 1790 finished with value: 0.13435428018138768 and parameters: {'kernel_type': 'Matern', 'length_scale': 47.58048224872332, 'noise_level': 0.005985991735075885, 'constant_value': 85010.34150947577, 'nu': 1.5}. Best is trial 1456 with value: 0.13435337537029549.
[I 2024-12-04 15:25:11,413] Trial 1783 finished with value: 0.1343544435352577 and parameters: {'kernel_type': 'Matern', 'length_scale': 616.7676798136148, 'noise_level': 0.9818102367686501, 'constant_value': 31.028719492613327, 'nu': 1.5}. Best is trial 1456 with value: 0.13435337537029549.
[I 2024-12-04 15:25:11,536] Trial 1784 finished with value: 0.15167297558180554 and parameters: {'kernel_type': 'RBF', 'length_scale': 0.3018860898545988, 'noise_level': 7.392536215003387e-05, 'constant_value': 0.032985357602414195, 'nu': 2.5}. Best is trial 1456 with value: 0.13435337537029549.
[I 2024-12-04 15:25:11,894] Trial 1796 finished with value: 0.13435435851675706 and parameters: {'kernel_type': 'Matern', 'length_scale': 5047.233753425933, 'noise_level': 0.039673405278812725, 'constant_value': 123.78433924916698, 'nu': 1.5}. Best is trial 1456 with value: 0.13435337537029549.
[I 2024-12-04 15:25:12,931] Trial 1800 finished with value: 0.13435423308911823 and parameters: {'kernel_type': 'Matern', 'length_scale': 129.415509355158, 'noise_level': 0.017822621866965448, 'constant_value': 7.4856756416429, 'nu': 1.5}. Best is trial 1456 with value: 0.13435337537029549.
[I 2024-12-04 15:25:14,221] Trial 1804 finished with value: 0.13435442923310006 and parameters: {'kernel_type': 'Matern', 'length_scale': 3.89270564574303, 'noise_level': 0.06926476460253533, 'constant_value': 1.3980170519424082, 'nu': 1.5}. Best is trial 1456 with value: 0.13435337537029549.
[I 2024-12-04 15:25:15,385] Trial 1799 finished with value: 1.3007745975853586 and parameters: {'kernel_type': 'Matern', 'length_scale': 14550.248695051248, 'noise_level': 0.8520115738224201, 'constant_value': 0.0005982331055586377, 'nu': 1.5}. Best is trial 1456 with value: 0.13435337537029549.
[I 2024-12-04 15:25:15,923] Trial 1811 finished with value: 0.13435432921359358 and parameters: {'kernel_type': 'Matern', 'length_scale': 5.378049872225694, 'noise_level': 0.1911684897717704, 'constant_value': 1.830990746448205, 'nu': 1.5}. Best is trial 1456 with value: 0.13435337537029549.
[I 2024-12-04 15:25:16,017] Trial 1789 finished with value: 0.13435392865738285 and parameters: {'kernel_type': 'Matern', 'length_scale': 9465.700688815898, 'noise_level': 0.14307299957039943, 'constant_value': 15.90194480456574, 'nu': 1.5}. Best is trial 1456 with value: 0.13435337537029549.
[I 2024-12-04 15:25:17,918] Trial 1802 finished with value: 1.300774596803366 and parameters: {'kernel_type': 'Matern', 'length_scale': 9631.999727976561, 'noise_level': 0.2733158068329362, 'constant_value': 0.12699262488021817, 'nu': 1.5}. Best is trial 1456 with value: 0.13435337537029549.
[I 2024-12-04 15:25:18,504] Trial 1794 finished with value: 0.13435439148294387 and parameters: {'kernel_type': 'Matern', 'length_scale': 4555.704099005439, 'noise_level': 0.21429139498610816, 'constant_value': 1.0598963193886577, 'nu': 1.5}. Best is trial 1456 with value: 0.13435337537029549.
[I 2024-12-04 15:25:19,962] Trial 1801 finished with value: 1.269363502851223 and parameters: {'kernel_type': 'Matern', 'length_scale': 8211.07446627385, 'noise_level': 0.007230444983535248, 'constant_value': 2.900892358926825, 'nu': 1.5}. Best is trial 1456 with value: 0.13435337537029549.
[I 2024-12-04 15:25:20,267] Trial 1812 finished with value: 0.13435439095930304 and parameters: {'kernel_type': 'Matern', 'length_scale': 65.643659410151, 'noise_level': 0.07620909473179492, 'constant_value': 12.754997708950551, 'nu': 1.5}. Best is trial 1456 with value: 0.13435337537029549.
[I 2024-12-04 15:25:21,063] Trial 1795 finished with value: 1.2693635028567143 and parameters: {'kernel_type': 'Matern', 'length_scale': 1443.7034007975578, 'noise_level': 0.0009457864883849049, 'constant_value': 16.30469612808963, 'nu': 1.5}. Best is trial 1456 with value: 0.13435337537029549.
[I 2024-12-04 15:25:22,405] Trial 1803 finished with value: 0.13435439809358948 and parameters: {'kernel_type': 'Matern', 'length_scale': 541.2240981568953, 'noise_level': 0.12871310385085008, 'constant_value': 1.1277999420765443, 'nu': 1.5}. Best is trial 1456 with value: 0.13435337537029549.
[I 2024-12-04 15:25:22,411] Trial 1809 finished with value: 0.13435445634877544 and parameters: {'kernel_type': 'Matern', 'length_scale': 191.36934835666634, 'noise_level': 0.0400456066192948, 'constant_value': 39.55287825483998, 'nu': 1.5}. Best is trial 1456 with value: 0.13435337537029549.
[I 2024-12-04 15:25:22,455] Trial 1807 finished with value: 0.13435435479537125 and parameters: {'kernel_type': 'Matern', 'length_scale': 1372.1823937520282, 'noise_level': 0.19144889317712654, 'constant_value': 0.8693338999282605, 'nu': 1.5}. Best is trial 1456 with value: 0.13435337537029549.
[I 2024-12-04 15:25:23,454] Trial 1810 finished with value: 0.1343543772206446 and parameters: {'kernel_type': 'Matern', 'length_scale': 13.945178225927567, 'noise_level': 0.9540928953883936, 'constant_value': 38.76448129421483, 'nu': 1.5}. Best is trial 1456 with value: 0.13435337537029549.
[I 2024-12-04 15:25:27,600] Trial 1806 finished with value: 0.13435440169455218 and parameters: {'kernel_type': 'Matern', 'length_scale': 816.9818757805152, 'noise_level': 0.0203508884479196, 'constant_value': 16.80324850639218, 'nu': 1.5}. Best is trial 1456 with value: 0.13435337537029549.
[I 2024-12-04 15:25:27,982] Trial 1817 finished with value: 1.2693635028538972 and parameters: {'kernel_type': 'Matern', 'length_scale': 17424.316622015132, 'noise_level': 0.029150772131401045, 'constant_value': 932.9560845198229, 'nu': 1.5}. Best is trial 1456 with value: 0.13435337537029549.
[I 2024-12-04 15:25:27,983] Trial 1815 finished with value: 1.3007745979573229 and parameters: {'kernel_type': 'Matern', 'length_scale': 71154.4728687089, 'noise_level': 0.20898103436495163, 'constant_value': 0.538537909486817, 'nu': 1.5}. Best is trial 1456 with value: 0.13435337537029549.
[I 2024-12-04 15:25:29,423] Trial 1805 finished with value: 0.13435440055996933 and parameters: {'kernel_type': 'Matern', 'length_scale': 1025.649807922226, 'noise_level': 0.018845838407438177, 'constant_value': 52.96621694794088, 'nu': 1.5}. Best is trial 1456 with value: 0.13435337537029549.
[I 2024-12-04 15:25:30,348] Trial 1814 finished with value: 1.269363502857193 and parameters: {'kernel_type': 'Matern', 'length_scale': 143.476206107742, 'noise_level': 0.0037383034221262087, 'constant_value': 0.3305768214280413, 'nu': 1.5}. Best is trial 1456 with value: 0.13435337537029549.
[I 2024-12-04 15:25:32,158] Trial 1813 finished with value: 1.3007745973417402 and parameters: {'kernel_type': 'Matern', 'length_scale': 11622.249949743613, 'noise_level': 0.14843213541980718, 'constant_value': 0.020100505696854343, 'nu': 1.5}. Best is trial 1456 with value: 0.13435337537029549.
[I 2024-12-04 15:25:33,074] Trial 1816 finished with value: 1.269363502857539 and parameters: {'kernel_type': 'Matern', 'length_scale': 2657.168585826289, 'noise_level': 0.003999707894260063, 'constant_value': 38.79840451103017, 'nu': 1.5}. Best is trial 1456 with value: 0.13435337537029549.
[I 2024-12-04 15:25:33,415] Trial 1808 finished with value: 0.13435437246908533 and parameters: {'kernel_type': 'Matern', 'length_scale': 78.71664111310785, 'noise_level': 0.962056715204671, 'constant_value': 0.041175359226243054, 'nu': 1.5}. Best is trial 1456 with value: 0.13435337537029549.
[I 2024-12-04 15:25:39,560] Trial 1820 finished with value: 0.13435439883601022 and parameters: {'kernel_type': 'Matern', 'length_scale': 37684.60157786834, 'noise_level': 0.4879200281302737, 'constant_value': 144.50423312040067, 'nu': 1.5}. Best is trial 1456 with value: 0.13435337537029549.
[I 2024-12-04 15:25:40,568] Trial 1818 finished with value: 0.1343547910836446 and parameters: {'kernel_type': 'Matern', 'length_scale': 1275.7918720814523, 'noise_level': 0.060414840500706155, 'constant_value': 15.178138710576446, 'nu': 1.5}. Best is trial 1456 with value: 0.13435337537029549.
[I 2024-12-04 15:25:41,531] Trial 1824 finished with value: 0.1343543760520892 and parameters: {'kernel_type': 'Matern', 'length_scale': 0.33284471428376955, 'noise_level': 0.0003018611898452637, 'constant_value': 73651.68132348915, 'nu': 1.5}. Best is trial 1456 with value: 0.13435337537029549.
[I 2024-12-04 15:25:42,569] Trial 1826 finished with value: 0.1725103999364769 and parameters: {'kernel_type': 'Matern', 'length_scale': 87.61844304997416, 'noise_level': 2.2289081721290346e-10, 'constant_value': 64.81103090151558, 'nu': 0.5}. Best is trial 1456 with value: 0.13435337537029549.
[I 2024-12-04 15:25:44,490] Trial 1828 finished with value: 1.2693635028569799 and parameters: {'kernel_type': 'Matern', 'length_scale': 5991.370646456856, 'noise_level': 0.0018403180933233513, 'constant_value': 370.1554951245541, 'nu': 1.5}. Best is trial 1456 with value: 0.13435337537029549.
[I 2024-12-04 15:25:45,337] Trial 1819 finished with value: 0.13435441452898575 and parameters: {'kernel_type': 'Matern', 'length_scale': 1.0834960787620267, 'noise_level': 0.008805513509821892, 'constant_value': 1630.0088507182993, 'nu': 1.5}. Best is trial 1456 with value: 0.13435337537029549.
[I 2024-12-04 15:25:46,862] Trial 1821 finished with value: 1.3007745978533984 and parameters: {'kernel_type': 'Matern', 'length_scale': 27923.124535499865, 'noise_level': 0.22005837749926366, 'constant_value': 0.44915334534259077, 'nu': 1.5}. Best is trial 1456 with value: 0.13435337537029549.
[I 2024-12-04 15:25:47,067] Trial 1822 finished with value: 1.2693635028563173 and parameters: {'kernel_type': 'Matern', 'length_scale': 2018.4471367941044, 'noise_level': 0.009712256145746721, 'constant_value': 2.031991221259451, 'nu': 1.5}. Best is trial 1456 with value: 0.13435337537029549.
[I 2024-12-04 15:25:49,000] Trial 1827 finished with value: 1.3007745979552607 and parameters: {'kernel_type': 'Matern', 'length_scale': 67747.27978906721, 'noise_level': 0.21820206932067027, 'constant_value': 0.7937706999904403, 'nu': 1.5}. Best is trial 1456 with value: 0.13435337537029549.
[I 2024-12-04 15:25:49,724] Trial 1825 finished with value: 1.2693635028610122 and parameters: {'kernel_type': 'Matern', 'length_scale': 6383.854177950638, 'noise_level': 0.061116142898873835, 'constant_value': 5.401111453169633, 'nu': 1.5}. Best is trial 1456 with value: 0.13435337537029549.
[I 2024-12-04 15:25:50,360] Trial 1823 finished with value: 1.2693635028566401 and parameters: {'kernel_type': 'Matern', 'length_scale': 11037.307579255814, 'noise_level': 0.0588790528574134, 'constant_value': 6.707198142186492, 'nu': 1.5}. Best is trial 1456 with value: 0.13435337537029549.
[I 2024-12-04 15:25:50,908] Trial 1841 finished with value: 1.2693635028573371 and parameters: {'kernel_type': 'RBF', 'length_scale': 0.0001603101417012648, 'noise_level': 0.6536955640425202, 'constant_value': 86566.85097840714, 'nu': 2.5}. Best is trial 1456 with value: 0.13435337537029549.
[I 2024-12-04 15:25:51,070] Trial 1838 finished with value: 0.13435439934803112 and parameters: {'kernel_type': 'Matern', 'length_scale': 1051.8485009428466, 'noise_level': 0.4173800027704747, 'constant_value': 89.15428537868067, 'nu': 1.5}. Best is trial 1456 with value: 0.13435337537029549.
[I 2024-12-04 15:25:51,276] Trial 1830 finished with value: 0.1343541024043638 and parameters: {'kernel_type': 'Matern', 'length_scale': 21590.12032260671, 'noise_level': 0.0638145771584799, 'constant_value': 157.8298051166942, 'nu': 1.5}. Best is trial 1456 with value: 0.13435337537029549.
[I 2024-12-04 15:25:52,634] Trial 1834 finished with value: 1.2693635028569827 and parameters: {'kernel_type': 'Matern', 'length_scale': 14860.93295004738, 'noise_level': 0.0037275443969812245, 'constant_value': 1.045552385789856, 'nu': 1.5}. Best is trial 1456 with value: 0.13435337537029549.
[I 2024-12-04 15:25:52,635] Trial 1831 finished with value: 1.3007739972352783 and parameters: {'kernel_type': 'Matern', 'length_scale': 12365.867682651426, 'noise_level': 0.7282219185173032, 'constant_value': 3.7370866834780716, 'nu': 1.5}. Best is trial 1456 with value: 0.13435337537029549.
[I 2024-12-04 15:25:54,292] Trial 1833 finished with value: 0.13435440649302505 and parameters: {'kernel_type': 'Matern', 'length_scale': 414.29736093501543, 'noise_level': 1.8661070908920347e-05, 'constant_value': 67260.02384788096, 'nu': 1.5}. Best is trial 1456 with value: 0.13435337537029549.
[I 2024-12-04 15:25:54,455] Trial 1837 finished with value: 0.13435467313145877 and parameters: {'kernel_type': 'Matern', 'length_scale': 536.6477511206533, 'noise_level': 0.45366458895677847, 'constant_value': 47.417221146022285, 'nu': 1.5}. Best is trial 1456 with value: 0.13435337537029549.
[I 2024-12-04 15:25:54,462] Trial 1829 finished with value: 1.3007739235934925 and parameters: {'kernel_type': 'Matern', 'length_scale': 3.443531325863246e-05, 'noise_level': 1.2253215859183826e-09, 'constant_value': 2897.5618757073153, 'nu': 1.5}. Best is trial 1456 with value: 0.13435337537029549.
[I 2024-12-04 15:25:59,997] Trial 1842 finished with value: 0.13435439909444588 and parameters: {'kernel_type': 'Matern', 'length_scale': 783.8386331986273, 'noise_level': 0.00028758669163916136, 'constant_value': 2800.3208107343767, 'nu': 1.5}. Best is trial 1456 with value: 0.13435337537029549.
[I 2024-12-04 15:26:00,055] Trial 1835 finished with value: 1.2693635028567096 and parameters: {'kernel_type': 'Matern', 'length_scale': 2543.9324326457736, 'noise_level': 0.031721268871582824, 'constant_value': 5.256310777169156, 'nu': 1.5}. Best is trial 1456 with value: 0.13435337537029549.
[I 2024-12-04 15:26:01,454] Trial 1832 finished with value: 0.13435440068273571 and parameters: {'kernel_type': 'Matern', 'length_scale': 40.38387590311945, 'noise_level': 0.00017955086292770816, 'constant_value': 2173.340034189402, 'nu': 1.5}. Best is trial 1456 with value: 0.13435337537029549.
[I 2024-12-04 15:26:04,082] Trial 1846 finished with value: 1.2693635028570258 and parameters: {'kernel_type': 'Matern', 'length_scale': 52434.46879777942, 'noise_level': 2.9913797730878052e-05, 'constant_value': 0.4897837175357982, 'nu': 1.5}. Best is trial 1456 with value: 0.13435337537029549.
[I 2024-12-04 15:26:05,480] Trial 1843 finished with value: 0.13435439782774025 and parameters: {'kernel_type': 'Matern', 'length_scale': 582.2476223270651, 'noise_level': 0.9398043126174364, 'constant_value': 169.732724657001, 'nu': 1.5}. Best is trial 1456 with value: 0.13435337537029549.
[I 2024-12-04 15:26:06,397] Trial 1847 finished with value: 0.13435441060602893 and parameters: {'kernel_type': 'Matern', 'length_scale': 0.9287295570641342, 'noise_level': 0.007729044660209032, 'constant_value': 2461.0115018441807, 'nu': 1.5}. Best is trial 1456 with value: 0.13435337537029549.
[I 2024-12-04 15:26:06,469] Trial 1849 finished with value: 0.13435398666431644 and parameters: {'kernel_type': 'Matern', 'length_scale': 1.0629448594656308, 'noise_level': 0.020322338180367706, 'constant_value': 1512.569112080753, 'nu': 1.5}. Best is trial 1456 with value: 0.13435337537029549.
[I 2024-12-04 15:26:06,962] Trial 1839 finished with value: 1.269363502857027 and parameters: {'kernel_type': 'Matern', 'length_scale': 2800.0505675028767, 'noise_level': 0.03476324371466646, 'constant_value': 20.310494717974684, 'nu': 1.5}. Best is trial 1456 with value: 0.13435337537029549.
[I 2024-12-04 15:26:07,189] Trial 1840 finished with value: 0.13435437814984225 and parameters: {'kernel_type': 'Matern', 'length_scale': 2.452768791355895, 'noise_level': 0.00027212262187344523, 'constant_value': 98970.07443639287, 'nu': 1.5}. Best is trial 1456 with value: 0.13435337537029549.
[I 2024-12-04 15:26:11,816] Trial 1855 finished with value: 1.269363502311338 and parameters: {'kernel_type': 'Matern', 'length_scale': 0.07136673005913202, 'noise_level': 0.030707614392103143, 'constant_value': 65124.761983265045, 'nu': 1.5}. Best is trial 1456 with value: 0.13435337537029549.
[I 2024-12-04 15:26:12,058] Trial 1850 finished with value: 0.1343543917800423 and parameters: {'kernel_type': 'Matern', 'length_scale': 37.602026500254155, 'noise_level': 0.033625131804445804, 'constant_value': 3092.889008754869, 'nu': 1.5}. Best is trial 1456 with value: 0.13435337537029549.
[I 2024-12-04 15:26:12,065] Trial 1854 finished with value: 0.1343543927092606 and parameters: {'kernel_type': 'Matern', 'length_scale': 6.361361508112945, 'noise_level': 0.0057022161825556325, 'constant_value': 2523.6024789674034, 'nu': 1.5}. Best is trial 1456 with value: 0.13435337537029549.
[I 2024-12-04 15:26:12,491] Trial 1851 finished with value: 0.1343548315749662 and parameters: {'kernel_type': 'Matern', 'length_scale': 414.9270404963757, 'noise_level': 0.0026851051360169335, 'constant_value': 3572.3362434035566, 'nu': 1.5}. Best is trial 1456 with value: 0.13435337537029549.
[I 2024-12-04 15:26:12,496] Trial 1836 finished with value: 0.1343543992929545 and parameters: {'kernel_type': 'Matern', 'length_scale': 28989.54509460175, 'noise_level': 0.5432871654868606, 'constant_value': 32.202855549932394, 'nu': 1.5}. Best is trial 1456 with value: 0.13435337537029549.
[I 2024-12-04 15:26:13,151] Trial 1845 finished with value: 0.15167298469194937 and parameters: {'kernel_type': 'RBF', 'length_scale': 46134.48056535385, 'noise_level': 0.04304015190848577, 'constant_value': 9.56704325450102, 'nu': 1.5}. Best is trial 1456 with value: 0.13435337537029549.
[I 2024-12-04 15:26:16,253] Trial 1856 finished with value: 1.269363502855832 and parameters: {'kernel_type': 'Matern', 'length_scale': 0.05662374534761066, 'noise_level': 0.5057049244824566, 'constant_value': 1194.427683059585, 'nu': 1.5}. Best is trial 1456 with value: 0.13435337537029549.
[I 2024-12-04 15:26:19,838] Trial 1857 finished with value: 0.1343544037948138 and parameters: {'kernel_type': 'Matern', 'length_scale': 226.5918624394619, 'noise_level': 0.8158669411609855, 'constant_value': 381.9838896543856, 'nu': 1.5}. Best is trial 1456 with value: 0.13435337537029549.
[I 2024-12-04 15:26:21,173] Trial 1863 finished with value: 0.13435440107314792 and parameters: {'kernel_type': 'Matern', 'length_scale': 9.133163081016965, 'noise_level': 0.09093608420232352, 'constant_value': 2503.8747080835774, 'nu': 1.5}. Best is trial 1456 with value: 0.13435337537029549.
