[I 2024-12-04 00:25:17,070] Trial 1633 finished with value: 0.1848628331280756 and parameters: {'kernel': 'rbf', 'C': 23.380199308713227, 'gamma': 0.03980141813310108, 'epsilon': 0.008243793699314363}. Best is trial 1479 with value: 0.13978216740910654.
[I 2024-12-04 00:25:17,095] Trial 1634 finished with value: 0.21061668919276993 and parameters: {'kernel': 'rbf', 'C': 43.45055733472932, 'gamma': 0.00383228901195958, 'epsilon': 0.010041522846966893}. Best is trial 1479 with value: 0.13978216740910654.
[I 2024-12-04 00:25:17,622] Trial 1632 finished with value: 0.1450556840331208 and parameters: {'kernel': 'rbf', 'C': 83.88816378762893, 'gamma': 0.011394614053560938, 'epsilon': 0.0026633831126244784}. Best is trial 1479 with value: 0.13978216740910654.
[I 2024-12-04 00:25:18,451] Trial 1631 finished with value: 0.14542307902680188 and parameters: {'kernel': 'rbf', 'C': 99.0359752893562, 'gamma': 0.010883626716833192, 'epsilon': 0.0011788160689748873}. Best is trial 1479 with value: 0.13978216740910654.
[I 2024-12-04 00:25:19,773] Trial 1635 finished with value: 0.14097819011785062 and parameters: {'kernel': 'rbf', 'C': 98.57930655505125, 'gamma': 0.006981789440474015, 'epsilon': 0.002848115896627573}. Best is trial 1479 with value: 0.13978216740910654.
[I 2024-12-04 00:25:20,040] Trial 1637 finished with value: 0.3532945479960545 and parameters: {'kernel': 'linear', 'C': 0.20772808209534838, 'gamma': 0.05676399418504569, 'epsilon': 0.002473238245222365}. Best is trial 1479 with value: 0.13978216740910654.
[I 2024-12-04 00:25:21,642] Trial 1636 finished with value: 0.17181635712331977 and parameters: {'kernel': 'rbf', 'C': 26.640953063479017, 'gamma': 0.030760681081234736, 'epsilon': 0.0027804547301272446}. Best is trial 1479 with value: 0.13978216740910654.
[I 2024-12-04 00:25:22,610] Trial 1641 finished with value: 0.25354996214580244 and parameters: {'kernel': 'rbf', 'C': 20.534658883064488, 'gamma': 0.003453615532186424, 'epsilon': 0.006786191734610429}. Best is trial 1479 with value: 0.13978216740910654.
[I 2024-12-04 00:25:23,902] Trial 1639 finished with value: 0.16858407870906664 and parameters: {'kernel': 'rbf', 'C': 91.7735367643042, 'gamma': 0.02007816136290877, 'epsilon': 0.008203200560215411}. Best is trial 1479 with value: 0.13978216740910654.
[I 2024-12-04 00:25:24,677] Trial 1640 finished with value: 0.14283481945474652 and parameters: {'kernel': 'rbf', 'C': 99.16109945472111, 'gamma': 0.007186669737654733, 'epsilon': 0.01009425805986946}. Best is trial 1479 with value: 0.13978216740910654.
[I 2024-12-04 00:25:24,679] Trial 1643 finished with value: 0.9975150752391756 and parameters: {'kernel': 'sigmoid', 'C': 0.004638098049616834, 'gamma': 0.00012002679337383772, 'epsilon': 0.21178327292918478}. Best is trial 1479 with value: 0.13978216740910654.
[I 2024-12-04 00:25:26,486] Trial 1644 finished with value: 0.2624825130053124 and parameters: {'kernel': 'rbf', 'C': 21.115341680096204, 'gamma': 0.0027863622568854484, 'epsilon': 0.0010246205970726578}. Best is trial 1479 with value: 0.13978216740910654.
[I 2024-12-04 00:25:27,762] Trial 1642 finished with value: 0.1585770488560578 and parameters: {'kernel': 'rbf', 'C': 94.83651136578241, 'gamma': 0.013570706889403225, 'epsilon': 0.0023254010697736013}. Best is trial 1479 with value: 0.13978216740910654.
[I 2024-12-04 00:25:28,032] Trial 1645 finished with value: 0.23990446633463489 and parameters: {'kernel': 'rbf', 'C': 18.99552319789665, 'gamma': 0.005025277128169357, 'epsilon': 0.0010488809593712327}. Best is trial 1479 with value: 0.13978216740910654.
[I 2024-12-04 00:25:29,490] Trial 1646 finished with value: 0.14858766745190116 and parameters: {'kernel': 'rbf', 'C': 97.30858060776536, 'gamma': 0.00567217738180561, 'epsilon': 0.0017309166183685052}. Best is trial 1479 with value: 0.13978216740910654.
[I 2024-12-04 00:25:30,712] Trial 1647 finished with value: 0.17462315162751962 and parameters: {'kernel': 'rbf', 'C': 95.65292786310641, 'gamma': 0.003455527318776567, 'epsilon': 0.006627932194195755}. Best is trial 1479 with value: 0.13978216740910654.
[I 2024-12-04 00:25:31,907] Trial 1649 finished with value: 0.17492096082884961 and parameters: {'kernel': 'rbf', 'C': 14.9487356725239, 'gamma': 0.014212344745631132, 'epsilon': 0.0010725871065370978}. Best is trial 1479 with value: 0.13978216740910654.
[I 2024-12-04 00:25:33,168] Trial 1648 finished with value: 0.1482287521568088 and parameters: {'kernel': 'rbf', 'C': 96.23198755434214, 'gamma': 0.005771951008601612, 'epsilon': 0.0020295390983106716}. Best is trial 1479 with value: 0.13978216740910654.
[I 2024-12-04 00:25:33,756] Trial 1651 finished with value: 0.2501931084102191 and parameters: {'kernel': 'rbf', 'C': 95.7232587390013, 'gamma': 0.0008745257425837706, 'epsilon': 0.0012655734188515913}. Best is trial 1479 with value: 0.13978216740910654.
[I 2024-12-04 00:25:39,258] Trial 1653 finished with value: 0.14507922384929817 and parameters: {'kernel': 'rbf', 'C': 92.85216169290445, 'gamma': 0.006289312948018545, 'epsilon': 0.0010581157232535852}. Best is trial 1479 with value: 0.13978216740910654.
[I 2024-12-04 00:25:41,409] Trial 1652 finished with value: 0.17087781335752883 and parameters: {'kernel': 'rbf', 'C': 97.1521750516497, 'gamma': 0.020476113297918937, 'epsilon': 0.0045340905127834044}. Best is trial 1479 with value: 0.13978216740910654.
[I 2024-12-04 00:25:45,634] Trial 1654 finished with value: 0.21026166012617376 and parameters: {'kernel': 'rbf', 'C': 97.41999178202201, 'gamma': 0.05187605684548359, 'epsilon': 0.0023187967201012062}. Best is trial 1479 with value: 0.13978216740910654.
[I 2024-12-04 00:25:46,770] Trial 1656 finished with value: 0.20966582670070658 and parameters: {'kernel': 'rbf', 'C': 23.052595947398242, 'gamma': 0.0665659856185887, 'epsilon': 0.00392436463670254}. Best is trial 1479 with value: 0.13978216740910654.
[I 2024-12-04 00:25:49,044] Trial 1657 finished with value: 0.16204672781634138 and parameters: {'kernel': 'rbf', 'C': 17.38719118264138, 'gamma': 0.01514448269823058, 'epsilon': 0.006372197459417414}. Best is trial 1479 with value: 0.13978216740910654.
[I 2024-12-04 00:25:52,509] Trial 1659 finished with value: 0.18206407742513286 and parameters: {'kernel': 'rbf', 'C': 24.396975609350864, 'gamma': 0.008700571625533527, 'epsilon': 0.003906760667381468}. Best is trial 1479 with value: 0.13978216740910654.
[I 2024-12-04 00:25:54,610] Trial 1655 finished with value: 0.5305585361812111 and parameters: {'kernel': 'poly', 'C': 49.60514494412267, 'gamma': 0.0126769332773617, 'epsilon': 0.009206512287874514}. Best is trial 1479 with value: 0.13978216740910654.
[I 2024-12-04 00:25:57,087] Trial 1658 finished with value: 0.18098132482733878 and parameters: {'kernel': 'rbf', 'C': 82.98721080599391, 'gamma': 0.028392385709201936, 'epsilon': 0.0010261451907585455}. Best is trial 1479 with value: 0.13978216740910654.
[I 2024-12-04 00:25:57,889] Trial 1660 finished with value: 0.14994580040371083 and parameters: {'kernel': 'rbf', 'C': 94.64597262666278, 'gamma': 0.005684897562904751, 'epsilon': 0.0033181977283367587}. Best is trial 1479 with value: 0.13978216740910654.
[I 2024-12-04 00:25:58,473] Trial 1661 finished with value: 0.16595480328854761 and parameters: {'kernel': 'rbf', 'C': 27.499938109253385, 'gamma': 0.009678947435472719, 'epsilon': 0.002763270923840556}. Best is trial 1479 with value: 0.13978216740910654.
[I 2024-12-04 00:26:00,241] Trial 1662 finished with value: 0.20231946081237362 and parameters: {'kernel': 'rbf', 'C': 22.667661382463887, 'gamma': 0.0072981954375000374, 'epsilon': 0.002748636304943362}. Best is trial 1479 with value: 0.13978216740910654.
[I 2024-12-04 00:26:02,146] Trial 1664 finished with value: 0.21619886406332442 and parameters: {'kernel': 'rbf', 'C': 20.015723569230403, 'gamma': 0.006861600845248283, 'epsilon': 0.0024648250552884005}. Best is trial 1479 with value: 0.13978216740910654.
[I 2024-12-04 00:26:07,477] Trial 1663 finished with value: 0.17500155102500883 and parameters: {'kernel': 'rbf', 'C': 91.65357607773997, 'gamma': 0.023669364354885706, 'epsilon': 0.0026575091424317753}. Best is trial 1479 with value: 0.13978216740910654.
[I 2024-12-04 00:26:09,914] Trial 1667 finished with value: 0.8546261022340221 and parameters: {'kernel': 'sigmoid', 'C': 0.02331123390105239, 'gamma': 0.03333191302994997, 'epsilon': 0.001914731406039083}. Best is trial 1479 with value: 0.13978216740910654.
[I 2024-12-04 00:26:11,464] Trial 365 finished with value: 0.6980571530582421 and parameters: {'kernel': 'poly', 'C': 90.76231293664087, 'gamma': 0.028919546517924437, 'epsilon': 0.029578045777430974}. Best is trial 1479 with value: 0.13978216740910654.
[I 2024-12-04 00:26:12,477] Trial 1665 finished with value: 0.20476287696121565 and parameters: {'kernel': 'rbf', 'C': 99.58823897322321, 'gamma': 0.04661107677042982, 'epsilon': 0.0035258105404204314}. Best is trial 1479 with value: 0.13978216740910654.
[I 2024-12-04 00:26:12,692] Trial 1666 finished with value: 0.17209856247127056 and parameters: {'kernel': 'rbf', 'C': 97.25151510452456, 'gamma': 0.020627456640168594, 'epsilon': 0.0010651421474604055}. Best is trial 1479 with value: 0.13978216740910654.
[I 2024-12-04 00:26:12,891] Trial 1669 finished with value: 0.27911648002909534 and parameters: {'kernel': 'rbf', 'C': 27.232120506048606, 'gamma': 0.0015008619796207721, 'epsilon': 0.0024236392152584153}. Best is trial 1479 with value: 0.13978216740910654.
[I 2024-12-04 00:26:12,992] Trial 1437 finished with value: 0.352496228708375 and parameters: {'kernel': 'linear', 'C': 88.8005559108948, 'gamma': 0.013641834081246003, 'epsilon': 0.001127883097574249}. Best is trial 1479 with value: 0.13978216740910654.
[I 2024-12-04 00:26:13,565] Trial 1668 finished with value: 0.1977726430380839 and parameters: {'kernel': 'rbf', 'C': 94.17301900109771, 'gamma': 0.002587977921969262, 'epsilon': 0.00123590148193671}. Best is trial 1479 with value: 0.13978216740910654.
[I 2024-12-04 00:26:14,411] Trial 1670 finished with value: 265.39916781506315 and parameters: {'kernel': 'sigmoid', 'C': 16.865380792945988, 'gamma': 0.013927795092892558, 'epsilon': 0.0022565388474738955}. Best is trial 1479 with value: 0.13978216740910654.
[I 2024-12-04 00:26:15,598] Trial 1671 finished with value: 0.2634026500610681 and parameters: {'kernel': 'rbf', 'C': 16.82966893546463, 'gamma': 0.0032990543154783887, 'epsilon': 0.0026167331779129387}. Best is trial 1479 with value: 0.13978216740910654.
[I 2024-12-04 00:26:17,028] Trial 1672 finished with value: 0.18831561235037397 and parameters: {'kernel': 'rbf', 'C': 73.80630983680281, 'gamma': 0.0034702150243751512, 'epsilon': 0.0010089577110427564}. Best is trial 1479 with value: 0.13978216740910654.
[I 2024-12-04 00:26:17,731] Trial 1675 finished with value: 0.23121785825517932 and parameters: {'kernel': 'rbf', 'C': 88.69877992497945, 'gamma': 0.0014348428744650951, 'epsilon': 0.0029556979189068176}. Best is trial 1479 with value: 0.13978216740910654.
[I 2024-12-04 00:26:18,508] Trial 1674 finished with value: 0.18424790516029238 and parameters: {'kernel': 'rbf', 'C': 98.85872225350148, 'gamma': 0.0030036367728260393, 'epsilon': 0.003869431037228659}. Best is trial 1479 with value: 0.13978216740910654.
[I 2024-12-04 00:26:18,509] Trial 1676 finished with value: 0.2542771973538646 and parameters: {'kernel': 'rbf', 'C': 17.98121814429753, 'gamma': 0.003895732344520046, 'epsilon': 0.0011046644790530405}. Best is trial 1479 with value: 0.13978216740910654.
[I 2024-12-04 00:26:19,088] Trial 1673 finished with value: 0.1409090125437149 and parameters: {'kernel': 'rbf', 'C': 97.70500968396591, 'gamma': 0.008473332362058586, 'epsilon': 0.005449680240126164}. Best is trial 1479 with value: 0.13978216740910654.
[I 2024-12-04 00:26:20,367] Trial 1677 finished with value: 0.15040844924554686 and parameters: {'kernel': 'rbf', 'C': 18.55360400133604, 'gamma': 0.02371040180367438, 'epsilon': 0.0010932863233671314}. Best is trial 1479 with value: 0.13978216740910654.
[I 2024-12-04 00:26:21,040] Trial 1678 finished with value: 0.17630142414362662 and parameters: {'kernel': 'rbf', 'C': 99.62066627871678, 'gamma': 0.0032787478048287846, 'epsilon': 0.002655008498302159}. Best is trial 1479 with value: 0.13978216740910654.
[I 2024-12-04 00:26:21,793] Trial 1679 finished with value: 0.2111329726290362 and parameters: {'kernel': 'rbf', 'C': 16.53499879863477, 'gamma': 0.008468656224828657, 'epsilon': 0.0020194793678996385}. Best is trial 1479 with value: 0.13978216740910654.
[I 2024-12-04 00:26:22,616] Trial 1680 finished with value: 0.19057767981947835 and parameters: {'kernel': 'rbf', 'C': 33.67983338992453, 'gamma': 0.0062177675701183144, 'epsilon': 0.0023970291781170907}. Best is trial 1479 with value: 0.13978216740910654.
[I 2024-12-04 00:26:24,177] Trial 1681 finished with value: 0.6041205345764522 and parameters: {'kernel': 'poly', 'C': 64.7711476566666, 'gamma': 0.007508037061152265, 'epsilon': 0.002892328076553204}. Best is trial 1479 with value: 0.13978216740910654.
[I 2024-12-04 00:26:25,327] Trial 1685 finished with value: 0.30717738964035707 and parameters: {'kernel': 'rbf', 'C': 6.168227011423585, 'gamma': 0.0034686337125341246, 'epsilon': 0.005231635005536532}. Best is trial 1479 with value: 0.13978216740910654.
[I 2024-12-04 00:26:26,000] Trial 1686 finished with value: 0.36929786833831846 and parameters: {'kernel': 'rbf', 'C': 9.612038767952907, 'gamma': 0.0746306491443607, 'epsilon': 0.49274403203990713}. Best is trial 1479 with value: 0.13978216740910654.
[I 2024-12-04 00:26:26,075] Trial 1684 finished with value: 0.15837083867073593 and parameters: {'kernel': 'rbf', 'C': 20.12487302774463, 'gamma': 0.028255507610159745, 'epsilon': 0.0027322064710639717}. Best is trial 1479 with value: 0.13978216740910654.
[I 2024-12-04 00:26:26,600] Trial 1682 finished with value: 0.14378819738996687 and parameters: {'kernel': 'rbf', 'C': 95.52902577327808, 'gamma': 0.006429631306166988, 'epsilon': 0.0019256913442799273}. Best is trial 1479 with value: 0.13978216740910654.
[I 2024-12-04 00:26:27,575] Trial 1687 finished with value: 97.93406146723909 and parameters: {'kernel': 'sigmoid', 'C': 95.89808504602644, 'gamma': 0.001474827678007887, 'epsilon': 0.0012114813702600437}. Best is trial 1479 with value: 0.13978216740910654.
[I 2024-12-04 00:26:27,749] Trial 1683 finished with value: 0.23720996046491427 and parameters: {'kernel': 'rbf', 'C': 90.3477984798231, 'gamma': 0.09955007616827923, 'epsilon': 0.00101960006761782}. Best is trial 1479 with value: 0.13978216740910654.
[I 2024-12-04 00:26:31,011] Trial 1582 finished with value: 0.5845722215460681 and parameters: {'kernel': 'poly', 'C': 86.66838172453008, 'gamma': 0.01913507149289024, 'epsilon': 0.001062029702380208}. Best is trial 1479 with value: 0.13978216740910654.
[I 2024-12-04 00:26:31,581] Trial 1689 finished with value: 0.14720030912513465 and parameters: {'kernel': 'rbf', 'C': 34.06806608546727, 'gamma': 0.015419793189548914, 'epsilon': 0.002452381399936537}. Best is trial 1479 with value: 0.13978216740910654.
[I 2024-12-04 00:26:32,165] Trial 1688 finished with value: 0.1567554413936703 and parameters: {'kernel': 'rbf', 'C': 87.38715498212416, 'gamma': 0.01370068425003534, 'epsilon': 0.00309901658961652}. Best is trial 1479 with value: 0.13978216740910654.
[I 2024-12-04 00:26:32,166] Trial 1690 finished with value: 0.18293076815340376 and parameters: {'kernel': 'rbf', 'C': 94.38465336079184, 'gamma': 0.0031439332142304253, 'epsilon': 0.0010675879817946114}. Best is trial 1479 with value: 0.13978216740910654.
[I 2024-12-04 00:26:33,713] Trial 1691 finished with value: 0.14635096575560605 and parameters: {'kernel': 'rbf', 'C': 95.45601201477523, 'gamma': 0.011144251090315256, 'epsilon': 0.002418397646380544}. Best is trial 1479 with value: 0.13978216740910654.
[I 2024-12-04 00:26:33,834] Trial 1692 finished with value: 0.1423759781595484 and parameters: {'kernel': 'rbf', 'C': 90.07535871253887, 'gamma': 0.010275547040730646, 'epsilon': 0.0010549611567995316}. Best is trial 1479 with value: 0.13978216740910654.
[I 2024-12-04 00:26:34,443] Trial 1693 finished with value: 0.15107982482086077 and parameters: {'kernel': 'rbf', 'C': 17.482355319305785, 'gamma': 0.01997750117085396, 'epsilon': 0.0010307552493420344}. Best is trial 1479 with value: 0.13978216740910654.
[I 2024-12-04 00:26:35,314] Trial 1695 finished with value: 0.3539527502933446 and parameters: {'kernel': 'rbf', 'C': 2.4015353835302506, 'gamma': 0.004427416793316385, 'epsilon': 0.001042658822179311}. Best is trial 1479 with value: 0.13978216740910654.
[I 2024-12-04 00:26:36,794] Trial 1698 finished with value: 0.19335585262694535 and parameters: {'kernel': 'rbf', 'C': 4.341193528785957, 'gamma': 0.044538994702249424, 'epsilon': 0.003972973634945028}. Best is trial 1479 with value: 0.13978216740910654.
[I 2024-12-04 00:26:36,796] Trial 1699 finished with value: 0.9981929388560289 and parameters: {'kernel': 'poly', 'C': 0.015459484614132438, 'gamma': 0.0003130590268669597, 'epsilon': 0.1225808476414502}. Best is trial 1479 with value: 0.13978216740910654.
[I 2024-12-04 00:26:37,944] Trial 1696 finished with value: 0.14061022625981687 and parameters: {'kernel': 'rbf', 'C': 92.36986525057235, 'gamma': 0.007249574826208693, 'epsilon': 0.0013220765689352105}. Best is trial 1479 with value: 0.13978216740910654.
[I 2024-12-04 00:26:38,448] Trial 1694 finished with value: 0.18610625709064987 and parameters: {'kernel': 'rbf', 'C': 92.15277207582685, 'gamma': 0.03279825430501242, 'epsilon': 0.0024638247589402304}. Best is trial 1479 with value: 0.13978216740910654.
[I 2024-12-04 00:26:39,065] Trial 1700 finished with value: 0.1601626070251367 and parameters: {'kernel': 'rbf', 'C': 17.944809012115787, 'gamma': 0.015374094893608345, 'epsilon': 0.0011048214123958056}. Best is trial 1479 with value: 0.13978216740910654.
[I 2024-12-04 00:26:39,371] Trial 1702 finished with value: 0.3628231814204981 and parameters: {'kernel': 'rbf', 'C': 17.33278501008438, 'gamma': 0.0007942451487268361, 'epsilon': 0.0010434844396318452}. Best is trial 1479 with value: 0.13978216740910654.
[I 2024-12-04 00:26:39,862] Trial 1701 finished with value: 0.21505215792298696 and parameters: {'kernel': 'rbf', 'C': 91.48664634604695, 'gamma': 0.001982285520417341, 'epsilon': 0.0010338383369228453}. Best is trial 1479 with value: 0.13978216740910654.
[I 2024-12-04 00:26:40,352] Trial 1703 finished with value: 0.24543361351214898 and parameters: {'kernel': 'rbf', 'C': 24.00461384138382, 'gamma': 0.0037004610655067085, 'epsilon': 0.005237940387011666}. Best is trial 1479 with value: 0.13978216740910654.
[I 2024-12-04 00:26:40,453] Trial 1697 finished with value: 0.1504803849838744 and parameters: {'kernel': 'rbf', 'C': 99.94604260978662, 'gamma': 0.011618383371796409, 'epsilon': 0.002275275032610025}. Best is trial 1479 with value: 0.13978216740910654.
[I 2024-12-04 00:26:42,441] Trial 1705 finished with value: 0.24541011043827501 and parameters: {'kernel': 'rbf', 'C': 7.721391219898346, 'gamma': 0.009760352242749432, 'epsilon': 0.001007078930705735}. Best is trial 1479 with value: 0.13978216740910654.
[I 2024-12-04 00:26:42,610] Trial 1704 finished with value: 0.15545429925601972 and parameters: {'kernel': 'rbf', 'C': 92.448603549719, 'gamma': 0.004865066220725375, 'epsilon': 0.002957402431327034}. Best is trial 1479 with value: 0.13978216740910654.
[I 2024-12-04 00:26:42,617] Trial 1706 finished with value: 0.31333783682981314 and parameters: {'kernel': 'rbf', 'C': 19.447780313770803, 'gamma': 0.16768707232629385, 'epsilon': 0.09281548977209457}. Best is trial 1479 with value: 0.13978216740910654.
[I 2024-12-04 00:26:44,034] Trial 1707 finished with value: 0.24508904552617602 and parameters: {'kernel': 'rbf', 'C': 14.81221490029594, 'gamma': 0.005664511149901146, 'epsilon': 0.0022438533795044405}. Best is trial 1479 with value: 0.13978216740910654.
[I 2024-12-04 00:26:44,996] Trial 1708 finished with value: 0.227560902698331 and parameters: {'kernel': 'rbf', 'C': 17.337807798877325, 'gamma': 0.006598836753391718, 'epsilon': 0.003245147147531506}. Best is trial 1479 with value: 0.13978216740910654.
[I 2024-12-04 00:26:45,413] Trial 1709 finished with value: 1.5120354578514257 and parameters: {'kernel': 'sigmoid', 'C': 5.471071588351995, 'gamma': 0.0010224424750355002, 'epsilon': 0.001136904570944187}. Best is trial 1479 with value: 0.13978216740910654.
[I 2024-12-04 00:26:47,076] Trial 1710 finished with value: 0.18794347040115233 and parameters: {'kernel': 'rbf', 'C': 98.827220297666, 'gamma': 0.002858610644396629, 'epsilon': 0.007107834318142342}. Best is trial 1479 with value: 0.13978216740910654.
[I 2024-12-04 00:26:47,508] Trial 1711 finished with value: 0.16630731557721104 and parameters: {'kernel': 'rbf', 'C': 19.295714573916047, 'gamma': 0.013032604290087273, 'epsilon': 0.007103571802755756}. Best is trial 1479 with value: 0.13978216740910654.
[I 2024-12-04 00:26:48,411] Trial 1713 finished with value: 0.25295531424044293 and parameters: {'kernel': 'rbf', 'C': 22.785419889651646, 'gamma': 0.0032450898430311068, 'epsilon': 0.0020440386236054756}. Best is trial 1479 with value: 0.13978216740910654.
[I 2024-12-04 00:26:50,435] Trial 1714 finished with value: 0.21390152518240987 and parameters: {'kernel': 'rbf', 'C': 22.398612584094785, 'gamma': 0.006443906757002584, 'epsilon': 0.002571997668651325}. Best is trial 1479 with value: 0.13978216740910654.
[I 2024-12-04 00:26:50,464] Trial 1638 finished with value: 0.3528843236137329 and parameters: {'kernel': 'linear', 'C': 19.857797899854443, 'gamma': 0.014049008995677157, 'epsilon': 0.0011701394527885622}. Best is trial 1479 with value: 0.13978216740910654.
[I 2024-12-04 00:26:51,028] Trial 1716 finished with value: 0.17914608898504647 and parameters: {'kernel': 'rbf', 'C': 19.293442448926363, 'gamma': 0.010746576414389157, 'epsilon': 0.006974704183544401}. Best is trial 1479 with value: 0.13978216740910654.
