[I 2024-12-04 13:26:15,502] Trial 1860 finished with value: 0.3641254799339399 and parameters: {'n_estimators': 1113, 'learning_rate': 0.04816599052143143, 'max_depth': 7, 'min_samples_split': 18, 'min_samples_leaf': 7, 'subsample': 0.6945803627373358, 'max_features': 'sqrt'}. Best is trial 1137 with value: 0.19687116000636118.
[I 2024-12-04 13:26:25,493] Trial 1883 finished with value: 0.2950493150775831 and parameters: {'n_estimators': 456, 'learning_rate': 0.02375813615989014, 'max_depth': 10, 'min_samples_split': 20, 'min_samples_leaf': 1, 'subsample': 0.7399891934009077, 'max_features': None}. Best is trial 1137 with value: 0.19687116000636118.
[I 2024-12-04 13:26:27,291] Trial 1863 finished with value: 0.2339942337129859 and parameters: {'n_estimators': 1211, 'learning_rate': 0.0973041301155069, 'max_depth': 12, 'min_samples_split': 20, 'min_samples_leaf': 2, 'subsample': 0.6770192343671168, 'max_features': 'sqrt'}. Best is trial 1137 with value: 0.19687116000636118.
[I 2024-12-04 13:26:29,795] Trial 1856 finished with value: 0.21048850616403342 and parameters: {'n_estimators': 1462, 'learning_rate': 0.09896515072608854, 'max_depth': 12, 'min_samples_split': 17, 'min_samples_leaf': 1, 'subsample': 0.7152123637464689, 'max_features': 'sqrt'}. Best is trial 1137 with value: 0.19687116000636118.
[I 2024-12-04 13:26:31,957] Trial 1866 finished with value: 0.2372880762369691 and parameters: {'n_estimators': 1179, 'learning_rate': 0.06600806121378158, 'max_depth': 10, 'min_samples_split': 20, 'min_samples_leaf': 1, 'subsample': 0.6774460724966376, 'max_features': 'sqrt'}. Best is trial 1137 with value: 0.19687116000636118.
[I 2024-12-04 13:26:32,969] Trial 1859 finished with value: 0.2119230052900022 and parameters: {'n_estimators': 1491, 'learning_rate': 0.08872829930003516, 'max_depth': 10, 'min_samples_split': 16, 'min_samples_leaf': 1, 'subsample': 0.711657071778667, 'max_features': 'sqrt'}. Best is trial 1137 with value: 0.19687116000636118.
[I 2024-12-04 13:26:34,231] Trial 1867 finished with value: 0.2238037428768143 and parameters: {'n_estimators': 1189, 'learning_rate': 0.0609874261723503, 'max_depth': 11, 'min_samples_split': 15, 'min_samples_leaf': 1, 'subsample': 0.6613933356001124, 'max_features': 'sqrt'}. Best is trial 1137 with value: 0.19687116000636118.
[I 2024-12-04 13:26:34,246] Trial 1870 finished with value: 0.23354341945051238 and parameters: {'n_estimators': 1147, 'learning_rate': 0.09713162592740959, 'max_depth': 10, 'min_samples_split': 15, 'min_samples_leaf': 2, 'subsample': 0.6700159534306683, 'max_features': 'sqrt'}. Best is trial 1137 with value: 0.19687116000636118.
[I 2024-12-04 13:26:38,721] Trial 1861 finished with value: 0.23449585999862768 and parameters: {'n_estimators': 1470, 'learning_rate': 0.09783326501290046, 'max_depth': 12, 'min_samples_split': 15, 'min_samples_leaf': 2, 'subsample': 0.6009500490375286, 'max_features': 'sqrt'}. Best is trial 1137 with value: 0.19687116000636118.
[I 2024-12-04 13:26:39,802] Trial 1868 finished with value: 0.23990560185032414 and parameters: {'n_estimators': 1206, 'learning_rate': 0.08406647428021743, 'max_depth': 12, 'min_samples_split': 17, 'min_samples_leaf': 2, 'subsample': 0.6026183730679429, 'max_features': 'sqrt'}. Best is trial 1137 with value: 0.19687116000636118.
[I 2024-12-04 13:26:44,147] Trial 1888 finished with value: 0.38681665212374217 and parameters: {'n_estimators': 449, 'learning_rate': 0.019461348142915398, 'max_depth': 8, 'min_samples_split': 14, 'min_samples_leaf': 4, 'subsample': 0.8491687441761488, 'max_features': 'sqrt'}. Best is trial 1137 with value: 0.19687116000636118.
[I 2024-12-04 13:26:48,002] Trial 1871 finished with value: 0.22121006237029567 and parameters: {'n_estimators': 1232, 'learning_rate': 0.08988446381461294, 'max_depth': 10, 'min_samples_split': 15, 'min_samples_leaf': 1, 'subsample': 0.6012815061557413, 'max_features': 'sqrt'}. Best is trial 1137 with value: 0.19687116000636118.
[I 2024-12-04 13:26:48,030] Trial 1865 finished with value: 0.2929604920415786 and parameters: {'n_estimators': 1326, 'learning_rate': 0.09824966153547549, 'max_depth': 12, 'min_samples_split': 17, 'min_samples_leaf': 4, 'subsample': 0.6165577972619994, 'max_features': None}. Best is trial 1137 with value: 0.19687116000636118.
[I 2024-12-04 13:26:50,589] Trial 1876 finished with value: 0.3471993004899573 and parameters: {'n_estimators': 1145, 'learning_rate': 0.025216016081310084, 'max_depth': 12, 'min_samples_split': 6, 'min_samples_leaf': 6, 'subsample': 0.6722876523869948, 'max_features': 'sqrt'}. Best is trial 1137 with value: 0.19687116000636118.
[I 2024-12-04 13:26:53,552] Trial 1873 finished with value: 0.20695004379234755 and parameters: {'n_estimators': 1292, 'learning_rate': 0.06490301266807531, 'max_depth': 12, 'min_samples_split': 19, 'min_samples_leaf': 1, 'subsample': 0.6762317944076995, 'max_features': 'sqrt'}. Best is trial 1137 with value: 0.19687116000636118.
[I 2024-12-04 13:26:54,415] Trial 1898 finished with value: 0.7416922059019904 and parameters: {'n_estimators': 246, 'learning_rate': 0.020108380434013137, 'max_depth': 5, 'min_samples_split': 2, 'min_samples_leaf': 4, 'subsample': 0.6014475283694392, 'max_features': 'log2'}. Best is trial 1137 with value: 0.19687116000636118.
[I 2024-12-04 13:26:56,573] Trial 1887 finished with value: 0.454885643330464 and parameters: {'n_estimators': 820, 'learning_rate': 0.03239226173069403, 'max_depth': 3, 'min_samples_split': 12, 'min_samples_leaf': 9, 'subsample': 0.7855144101325637, 'max_features': 'sqrt'}. Best is trial 1137 with value: 0.19687116000636118.
[I 2024-12-04 13:26:58,643] Trial 1872 finished with value: 0.4194386938163334 and parameters: {'n_estimators': 1400, 'learning_rate': 0.019576542928343165, 'max_depth': 5, 'min_samples_split': 2, 'min_samples_leaf': 9, 'subsample': 0.9112440064348062, 'max_features': 'sqrt'}. Best is trial 1137 with value: 0.19687116000636118.
[I 2024-12-04 13:27:02,513] Trial 1877 finished with value: 0.22227014912404675 and parameters: {'n_estimators': 1311, 'learning_rate': 0.07085483718274212, 'max_depth': 10, 'min_samples_split': 18, 'min_samples_leaf': 1, 'subsample': 0.6044338471233758, 'max_features': 'sqrt'}. Best is trial 1137 with value: 0.19687116000636118.
[I 2024-12-04 13:27:02,583] Trial 1874 finished with value: 0.20998643482928928 and parameters: {'n_estimators': 1398, 'learning_rate': 0.05850284490603875, 'max_depth': 12, 'min_samples_split': 17, 'min_samples_leaf': 1, 'subsample': 0.6637010603393028, 'max_features': 'sqrt'}. Best is trial 1137 with value: 0.19687116000636118.
[I 2024-12-04 13:27:08,445] Trial 1875 finished with value: 0.22868405567592917 and parameters: {'n_estimators': 1488, 'learning_rate': 0.05957394581527894, 'max_depth': 12, 'min_samples_split': 14, 'min_samples_leaf': 1, 'subsample': 0.6884680491987191, 'max_features': 'sqrt'}. Best is trial 1137 with value: 0.19687116000636118.
[I 2024-12-04 13:27:08,448] Trial 1902 finished with value: 0.3563809179168686 and parameters: {'n_estimators': 262, 'learning_rate': 0.024530638035924788, 'max_depth': 10, 'min_samples_split': 20, 'min_samples_leaf': 6, 'subsample': 0.658486629081036, 'max_features': None}. Best is trial 1137 with value: 0.19687116000636118.
[I 2024-12-04 13:27:10,935] Trial 1880 finished with value: 0.2576592772670447 and parameters: {'n_estimators': 1335, 'learning_rate': 0.055920518426215336, 'max_depth': 10, 'min_samples_split': 15, 'min_samples_leaf': 3, 'subsample': 0.7255264252523317, 'max_features': 'sqrt'}. Best is trial 1137 with value: 0.19687116000636118.
[I 2024-12-04 13:27:15,629] Trial 1878 finished with value: 0.21628812517981755 and parameters: {'n_estimators': 1455, 'learning_rate': 0.07456890347688168, 'max_depth': 12, 'min_samples_split': 18, 'min_samples_leaf': 1, 'subsample': 0.6780833404591801, 'max_features': 'sqrt'}. Best is trial 1137 with value: 0.19687116000636118.
[I 2024-12-04 13:27:20,613] Trial 1913 finished with value: 0.33857715241729175 and parameters: {'n_estimators': 171, 'learning_rate': 0.06402223318869148, 'max_depth': 8, 'min_samples_split': 15, 'min_samples_leaf': 2, 'subsample': 0.6447223397158816, 'max_features': 'sqrt'}. Best is trial 1137 with value: 0.19687116000636118.
[I 2024-12-04 13:27:21,526] Trial 1881 finished with value: 0.260171027305019 and parameters: {'n_estimators': 1487, 'learning_rate': 0.09410846076270302, 'max_depth': 10, 'min_samples_split': 17, 'min_samples_leaf': 3, 'subsample': 0.6393969907778826, 'max_features': 'sqrt'}. Best is trial 1137 with value: 0.19687116000636118.
[I 2024-12-04 13:27:22,617] Trial 1882 finished with value: 0.21853063443445297 and parameters: {'n_estimators': 1488, 'learning_rate': 0.09623218680175889, 'max_depth': 12, 'min_samples_split': 17, 'min_samples_leaf': 1, 'subsample': 0.6216474202642674, 'max_features': 'sqrt'}. Best is trial 1137 with value: 0.19687116000636118.
[I 2024-12-04 13:27:24,675] Trial 1884 finished with value: 0.24381464084811308 and parameters: {'n_estimators': 1342, 'learning_rate': 0.0944197868941327, 'max_depth': 12, 'min_samples_split': 18, 'min_samples_leaf': 3, 'subsample': 0.6764784247296227, 'max_features': 'sqrt'}. Best is trial 1137 with value: 0.19687116000636118.
[I 2024-12-04 13:27:28,036] Trial 1885 finished with value: 0.30644735948834306 and parameters: {'n_estimators': 1161, 'learning_rate': 0.01692988021530241, 'max_depth': 11, 'min_samples_split': 9, 'min_samples_leaf': 5, 'subsample': 0.8337364837018583, 'max_features': None}. Best is trial 1137 with value: 0.19687116000636118.
[I 2024-12-04 13:27:28,532] Trial 1894 finished with value: 0.4411223432925549 and parameters: {'n_estimators': 1033, 'learning_rate': 0.031723507061924436, 'max_depth': 8, 'min_samples_split': 17, 'min_samples_leaf': 5, 'subsample': 0.6051357412690406, 'max_features': 'log2'}. Best is trial 1137 with value: 0.19687116000636118.
[I 2024-12-04 13:27:29,863] Trial 1893 finished with value: 0.3872309052756749 and parameters: {'n_estimators': 1024, 'learning_rate': 0.048224824444727886, 'max_depth': 6, 'min_samples_split': 19, 'min_samples_leaf': 8, 'subsample': 0.9179240115773628, 'max_features': 'sqrt'}. Best is trial 1137 with value: 0.19687116000636118.
[I 2024-12-04 13:27:32,053] Trial 1886 finished with value: 0.32898535981885385 and parameters: {'n_estimators': 1423, 'learning_rate': 0.069282610329251, 'max_depth': 10, 'min_samples_split': 19, 'min_samples_leaf': 5, 'subsample': 0.7251983538954976, 'max_features': 'log2'}. Best is trial 1137 with value: 0.19687116000636118.
[I 2024-12-04 13:27:36,153] Trial 1895 finished with value: 0.25079344839445983 and parameters: {'n_estimators': 1046, 'learning_rate': 0.09415021298483714, 'max_depth': 12, 'min_samples_split': 14, 'min_samples_leaf': 3, 'subsample': 0.615687862254337, 'max_features': 'sqrt'}. Best is trial 1137 with value: 0.19687116000636118.
[I 2024-12-04 13:27:46,526] Trial 1889 finished with value: 0.24914412802424382 and parameters: {'n_estimators': 1456, 'learning_rate': 0.09921602781708833, 'max_depth': 12, 'min_samples_split': 15, 'min_samples_leaf': 3, 'subsample': 0.6696317963260033, 'max_features': 'sqrt'}. Best is trial 1137 with value: 0.19687116000636118.
[I 2024-12-04 13:27:50,784] Trial 1890 finished with value: 0.2171514643558602 and parameters: {'n_estimators': 1481, 'learning_rate': 0.08239827201740611, 'max_depth': 12, 'min_samples_split': 14, 'min_samples_leaf': 1, 'subsample': 0.6093852205976127, 'max_features': 'sqrt'}. Best is trial 1137 with value: 0.19687116000636118.
[I 2024-12-04 13:27:52,205] Trial 1900 finished with value: 0.6525548949430557 and parameters: {'n_estimators': 1182, 'learning_rate': 0.013890912881701805, 'max_depth': 12, 'min_samples_split': 10, 'min_samples_leaf': 10, 'subsample': 0.7473246560003647, 'max_features': 'log2'}. Best is trial 1137 with value: 0.19687116000636118.
[I 2024-12-04 13:27:52,951] Trial 1891 finished with value: 0.22898853468030586 and parameters: {'n_estimators': 1495, 'learning_rate': 0.08147607817786069, 'max_depth': 12, 'min_samples_split': 20, 'min_samples_leaf': 2, 'subsample': 0.6894925474180303, 'max_features': 'sqrt'}. Best is trial 1137 with value: 0.19687116000636118.
[I 2024-12-04 13:27:55,805] Trial 1892 finished with value: 0.20376927482303664 and parameters: {'n_estimators': 1500, 'learning_rate': 0.09167435952563063, 'max_depth': 9, 'min_samples_split': 20, 'min_samples_leaf': 1, 'subsample': 0.6260341837395692, 'max_features': 'sqrt'}. Best is trial 1137 with value: 0.19687116000636118.
[I 2024-12-04 13:27:58,170] Trial 1899 finished with value: 0.24749206548704353 and parameters: {'n_estimators': 1203, 'learning_rate': 0.09962303216606387, 'max_depth': 10, 'min_samples_split': 16, 'min_samples_leaf': 2, 'subsample': 0.6411834680359213, 'max_features': 'sqrt'}. Best is trial 1137 with value: 0.19687116000636118.
[I 2024-12-04 13:27:59,779] Trial 1901 finished with value: 0.20860240268453656 and parameters: {'n_estimators': 1245, 'learning_rate': 0.0898050614110872, 'max_depth': 12, 'min_samples_split': 17, 'min_samples_leaf': 1, 'subsample': 0.6689766011246371, 'max_features': 'sqrt'}. Best is trial 1137 with value: 0.19687116000636118.
[I 2024-12-04 13:27:59,792] Trial 1903 finished with value: 0.2205387566126584 and parameters: {'n_estimators': 1172, 'learning_rate': 0.0972352082268118, 'max_depth': 11, 'min_samples_split': 15, 'min_samples_leaf': 1, 'subsample': 0.6733429791030507, 'max_features': 'sqrt'}. Best is trial 1137 with value: 0.19687116000636118.
[I 2024-12-04 13:28:01,890] Trial 1897 finished with value: 0.2109379849416365 and parameters: {'n_estimators': 1434, 'learning_rate': 0.07811078945207306, 'max_depth': 12, 'min_samples_split': 15, 'min_samples_leaf': 1, 'subsample': 0.7093633206235441, 'max_features': 'sqrt'}. Best is trial 1137 with value: 0.19687116000636118.
[I 2024-12-04 13:28:02,977] Trial 1896 finished with value: 0.23277054637819317 and parameters: {'n_estimators': 1471, 'learning_rate': 0.09272312575924753, 'max_depth': 12, 'min_samples_split': 20, 'min_samples_leaf': 2, 'subsample': 0.7457743950041191, 'max_features': 'sqrt'}. Best is trial 1137 with value: 0.19687116000636118.
[I 2024-12-04 13:28:07,990] Trial 1906 finished with value: 0.23037278190022006 and parameters: {'n_estimators': 1213, 'learning_rate': 0.05499819749387892, 'max_depth': 12, 'min_samples_split': 13, 'min_samples_leaf': 1, 'subsample': 0.6098658710178928, 'max_features': 'sqrt'}. Best is trial 1137 with value: 0.19687116000636118.
[I 2024-12-04 13:28:16,724] Trial 1904 finished with value: 0.24233130064902506 and parameters: {'n_estimators': 1483, 'learning_rate': 0.06924001570910852, 'max_depth': 10, 'min_samples_split': 18, 'min_samples_leaf': 2, 'subsample': 0.6893178386128416, 'max_features': 'sqrt'}. Best is trial 1137 with value: 0.19687116000636118.
[I 2024-12-04 13:28:20,618] Trial 1905 finished with value: 0.2343718753661684 and parameters: {'n_estimators': 1485, 'learning_rate': 0.061615607007036804, 'max_depth': 9, 'min_samples_split': 17, 'min_samples_leaf': 1, 'subsample': 0.682409282863092, 'max_features': 'sqrt'}. Best is trial 1137 with value: 0.19687116000636118.
[I 2024-12-04 13:28:20,648] Trial 1908 finished with value: 0.39664355862503015 and parameters: {'n_estimators': 1298, 'learning_rate': 0.023460745105381854, 'max_depth': 4, 'min_samples_split': 2, 'min_samples_leaf': 10, 'subsample': 0.7645781708378899, 'max_features': None}. Best is trial 1137 with value: 0.19687116000636118.
[I 2024-12-04 13:28:23,365] Trial 1915 finished with value: 0.23084790852152048 and parameters: {'n_estimators': 1208, 'learning_rate': 0.08093107116245198, 'max_depth': 12, 'min_samples_split': 17, 'min_samples_leaf': 1, 'subsample': 0.6542455379116899, 'max_features': 'log2'}. Best is trial 1137 with value: 0.19687116000636118.
[I 2024-12-04 13:28:24,242] Trial 1907 finished with value: 0.24659096137281952 and parameters: {'n_estimators': 1496, 'learning_rate': 0.06532972894086299, 'max_depth': 10, 'min_samples_split': 13, 'min_samples_leaf': 3, 'subsample': 0.6319214638273764, 'max_features': 'sqrt'}. Best is trial 1137 with value: 0.19687116000636118.
[I 2024-12-04 13:28:26,274] Trial 1916 finished with value: 0.2386824192259974 and parameters: {'n_estimators': 1193, 'learning_rate': 0.057983971370846876, 'max_depth': 12, 'min_samples_split': 17, 'min_samples_leaf': 2, 'subsample': 0.6767985402330534, 'max_features': 'sqrt'}. Best is trial 1137 with value: 0.19687116000636118.
[I 2024-12-04 13:28:27,667] Trial 1909 finished with value: 0.25276935276401447 and parameters: {'n_estimators': 1475, 'learning_rate': 0.09543734672101924, 'max_depth': 11, 'min_samples_split': 14, 'min_samples_leaf': 3, 'subsample': 0.6688287584237715, 'max_features': 'sqrt'}. Best is trial 1137 with value: 0.19687116000636118.
[I 2024-12-04 13:28:30,460] Trial 1926 finished with value: 0.32715033319590214 and parameters: {'n_estimators': 918, 'learning_rate': 0.07354517380577075, 'max_depth': 7, 'min_samples_split': 13, 'min_samples_leaf': 5, 'subsample': 0.9453264462108661, 'max_features': 'log2'}. Best is trial 1137 with value: 0.19687116000636118.
[I 2024-12-04 13:28:30,473] Trial 1917 finished with value: 0.22464274898349668 and parameters: {'n_estimators': 1234, 'learning_rate': 0.08741133772130287, 'max_depth': 10, 'min_samples_split': 16, 'min_samples_leaf': 1, 'subsample': 0.6844432865469439, 'max_features': 'sqrt'}. Best is trial 1137 with value: 0.19687116000636118.
[I 2024-12-04 13:28:30,482] Trial 1911 finished with value: 0.22549179924798482 and parameters: {'n_estimators': 1428, 'learning_rate': 0.04241005705221491, 'max_depth': 10, 'min_samples_split': 16, 'min_samples_leaf': 1, 'subsample': 0.7340382382434557, 'max_features': 'sqrt'}. Best is trial 1137 with value: 0.19687116000636118.
[I 2024-12-04 13:28:30,722] Trial 1912 finished with value: 0.24986567165297163 and parameters: {'n_estimators': 1417, 'learning_rate': 0.0722804125010522, 'max_depth': 12, 'min_samples_split': 20, 'min_samples_leaf': 3, 'subsample': 0.602188055955977, 'max_features': 'sqrt'}. Best is trial 1137 with value: 0.19687116000636118.
[I 2024-12-04 13:28:33,567] Trial 1920 finished with value: 0.24960407353375053 and parameters: {'n_estimators': 1129, 'learning_rate': 0.09990338002398991, 'max_depth': 11, 'min_samples_split': 16, 'min_samples_leaf': 3, 'subsample': 0.6119440021085567, 'max_features': 'sqrt'}. Best is trial 1137 with value: 0.19687116000636118.
[I 2024-12-04 13:28:36,632] Trial 1923 finished with value: 0.3804244586048932 and parameters: {'n_estimators': 989, 'learning_rate': 0.06753720588639388, 'max_depth': 4, 'min_samples_split': 16, 'min_samples_leaf': 9, 'subsample': 0.986943905693326, 'max_features': None}. Best is trial 1137 with value: 0.19687116000636118.
[I 2024-12-04 13:28:41,634] Trial 1910 finished with value: 0.26060864942031947 and parameters: {'n_estimators': 1486, 'learning_rate': 0.06947511900539534, 'max_depth': 9, 'min_samples_split': 16, 'min_samples_leaf': 1, 'subsample': 0.7248055652344041, 'max_features': None}. Best is trial 1137 with value: 0.19687116000636118.
[I 2024-12-04 13:28:41,720] Trial 1914 finished with value: 0.2356382088648159 and parameters: {'n_estimators': 1489, 'learning_rate': 0.07227482603622243, 'max_depth': 10, 'min_samples_split': 18, 'min_samples_leaf': 2, 'subsample': 0.6099669757422752, 'max_features': 'sqrt'}. Best is trial 1137 with value: 0.19687116000636118.
[I 2024-12-04 13:28:46,278] Trial 1918 finished with value: 0.22367331846085084 and parameters: {'n_estimators': 1429, 'learning_rate': 0.09841142809767733, 'max_depth': 9, 'min_samples_split': 17, 'min_samples_leaf': 1, 'subsample': 0.6764835588399715, 'max_features': 'sqrt'}. Best is trial 1137 with value: 0.19687116000636118.
[I 2024-12-04 13:28:47,041] Trial 1919 finished with value: 0.2285336199822462 and parameters: {'n_estimators': 1390, 'learning_rate': 0.05564057731865669, 'max_depth': 10, 'min_samples_split': 16, 'min_samples_leaf': 1, 'subsample': 0.6262882135757175, 'max_features': 'sqrt'}. Best is trial 1137 with value: 0.19687116000636118.
[I 2024-12-04 13:28:49,882] Trial 1925 finished with value: 0.2076075226016086 and parameters: {'n_estimators': 1271, 'learning_rate': 0.07252634814602346, 'max_depth': 12, 'min_samples_split': 20, 'min_samples_leaf': 1, 'subsample': 0.6106759647469234, 'max_features': 'sqrt'}. Best is trial 1137 with value: 0.19687116000636118.
[I 2024-12-04 13:28:50,038] Trial 1924 finished with value: 0.22206090797126335 and parameters: {'n_estimators': 1287, 'learning_rate': 0.07034954300807335, 'max_depth': 12, 'min_samples_split': 19, 'min_samples_leaf': 1, 'subsample': 0.62965430463397, 'max_features': 'sqrt'}. Best is trial 1137 with value: 0.19687116000636118.
[I 2024-12-04 13:28:52,866] Trial 1933 finished with value: 0.2550326605268 and parameters: {'n_estimators': 848, 'learning_rate': 0.08510895823262855, 'max_depth': 8, 'min_samples_split': 12, 'min_samples_leaf': 1, 'subsample': 0.7287061985239174, 'max_features': 'log2'}. Best is trial 1137 with value: 0.19687116000636118.
[I 2024-12-04 13:28:55,924] Trial 1942 finished with value: 0.35568155962416637 and parameters: {'n_estimators': 423, 'learning_rate': 0.01949606259534725, 'max_depth': 11, 'min_samples_split': 2, 'min_samples_leaf': 4, 'subsample': 0.8161075461132544, 'max_features': 'sqrt'}. Best is trial 1137 with value: 0.19687116000636118.
[I 2024-12-04 13:29:01,438] Trial 1921 finished with value: 0.38049893052922684 and parameters: {'n_estimators': 1454, 'learning_rate': 0.08306873387720753, 'max_depth': 9, 'min_samples_split': 14, 'min_samples_leaf': 10, 'subsample': 0.7311599379066955, 'max_features': None}. Best is trial 1137 with value: 0.19687116000636118.
