[I 2024-12-04 11:52:51,600] Trial 228 finished with value: 0.7082626802070764 and parameters: {'max_depth': 24, 'min_samples_split': 3, 'min_samples_leaf': 1, 'max_features': 'sqrt', 'criterion': 'squared_error', 'splitter': 'best'}. Best is trial 181 with value: 0.6095141852505885.
[I 2024-12-04 11:52:51,646] Trial 241 finished with value: 0.679321659918252 and parameters: {'max_depth': 30, 'min_samples_split': 12, 'min_samples_leaf': 1, 'max_features': 'sqrt', 'criterion': 'friedman_mse', 'splitter': 'best'}. Best is trial 181 with value: 0.6095141852505885.
[I 2024-12-04 11:52:51,662] Trial 236 finished with value: 0.6379386941389483 and parameters: {'max_depth': 34, 'min_samples_split': 12, 'min_samples_leaf': 1, 'max_features': 'sqrt', 'criterion': 'friedman_mse', 'splitter': 'best'}. Best is trial 181 with value: 0.6095141852505885.
[I 2024-12-04 11:52:51,860] Trial 240 finished with value: 0.6379386941389483 and parameters: {'max_depth': 34, 'min_samples_split': 12, 'min_samples_leaf': 1, 'max_features': 'sqrt', 'criterion': 'friedman_mse', 'splitter': 'best'}. Best is trial 181 with value: 0.6095141852505885.
[I 2024-12-04 11:52:52,225] Trial 235 finished with value: 0.631283584632792 and parameters: {'max_depth': 26, 'min_samples_split': 11, 'min_samples_leaf': 1, 'max_features': 'sqrt', 'criterion': 'friedman_mse', 'splitter': 'best'}. Best is trial 181 with value: 0.6095141852505885.
[I 2024-12-04 11:52:52,267] Trial 233 finished with value: 0.6862313348684029 and parameters: {'max_depth': 29, 'min_samples_split': 12, 'min_samples_leaf': 1, 'max_features': 'sqrt', 'criterion': 'friedman_mse', 'splitter': 'best'}. Best is trial 181 with value: 0.6095141852505885.
[I 2024-12-04 11:52:53,322] Trial 230 finished with value: 0.7235062702460188 and parameters: {'max_depth': 34, 'min_samples_split': 11, 'min_samples_leaf': 1, 'max_features': 'sqrt', 'criterion': 'friedman_mse', 'splitter': 'best'}. Best is trial 181 with value: 0.6095141852505885.
[I 2024-12-04 11:52:53,607] Trial 246 finished with value: 1.0801610136515951 and parameters: {'max_depth': 4, 'min_samples_split': 8, 'min_samples_leaf': 1, 'max_features': 'sqrt', 'criterion': 'friedman_mse', 'splitter': 'random'}. Best is trial 181 with value: 0.6095141852505885.
[I 2024-12-04 11:52:54,333] Trial 245 finished with value: 0.7062300016802785 and parameters: {'max_depth': 22, 'min_samples_split': 10, 'min_samples_leaf': 1, 'max_features': 'sqrt', 'criterion': 'friedman_mse', 'splitter': 'best'}. Best is trial 181 with value: 0.6095141852505885.
[I 2024-12-04 11:52:54,714] Trial 234 finished with value: 0.6945768284293156 and parameters: {'max_depth': 35, 'min_samples_split': 9, 'min_samples_leaf': 1, 'max_features': 'sqrt', 'criterion': 'friedman_mse', 'splitter': 'best'}. Best is trial 181 with value: 0.6095141852505885.
[I 2024-12-04 11:52:54,762] Trial 237 finished with value: 0.6379386941389483 and parameters: {'max_depth': 34, 'min_samples_split': 12, 'min_samples_leaf': 1, 'max_features': 'sqrt', 'criterion': 'friedman_mse', 'splitter': 'best'}. Best is trial 181 with value: 0.6095141852505885.
[I 2024-12-04 11:52:54,874] Trial 243 finished with value: 0.7246766212139164 and parameters: {'max_depth': 32, 'min_samples_split': 12, 'min_samples_leaf': 1, 'max_features': 'sqrt', 'criterion': 'friedman_mse', 'splitter': 'best'}. Best is trial 181 with value: 0.6095141852505885.
[I 2024-12-04 11:52:55,416] Trial 244 finished with value: 0.8105579954451577 and parameters: {'max_depth': 30, 'min_samples_split': 12, 'min_samples_leaf': 3, 'max_features': 'sqrt', 'criterion': 'friedman_mse', 'splitter': 'best'}. Best is trial 181 with value: 0.6095141852505885.
[I 2024-12-04 11:52:55,946] Trial 239 finished with value: 0.7310409829645067 and parameters: {'max_depth': 26, 'min_samples_split': 12, 'min_samples_leaf': 1, 'max_features': 'sqrt', 'criterion': 'friedman_mse', 'splitter': 'best'}. Best is trial 181 with value: 0.6095141852505885.
[I 2024-12-04 11:52:56,825] Trial 238 finished with value: 0.6935736941658859 and parameters: {'max_depth': 27, 'min_samples_split': 13, 'min_samples_leaf': 1, 'max_features': 'sqrt', 'criterion': 'friedman_mse', 'splitter': 'best'}. Best is trial 181 with value: 0.6095141852505885.
[I 2024-12-04 11:52:57,421] Trial 250 finished with value: 1.091656728529238 and parameters: {'max_depth': 17, 'min_samples_split': 12, 'min_samples_leaf': 8, 'max_features': 'log2', 'criterion': 'squared_error', 'splitter': 'best'}. Best is trial 181 with value: 0.6095141852505885.
[I 2024-12-04 11:52:57,501] Trial 242 finished with value: 0.692210687036355 and parameters: {'max_depth': 33, 'min_samples_split': 12, 'min_samples_leaf': 1, 'max_features': 'sqrt', 'criterion': 'friedman_mse', 'splitter': 'best'}. Best is trial 181 with value: 0.6095141852505885.
[I 2024-12-04 11:52:57,508] Trial 251 finished with value: 0.7023216453774249 and parameters: {'max_depth': 32, 'min_samples_split': 13, 'min_samples_leaf': 1, 'max_features': 'sqrt', 'criterion': 'friedman_mse', 'splitter': 'best'}. Best is trial 181 with value: 0.6095141852505885.
[I 2024-12-04 11:52:57,642] Trial 252 finished with value: 1.092257372628799 and parameters: {'max_depth': 5, 'min_samples_split': 2, 'min_samples_leaf': 4, 'max_features': 'log2', 'criterion': 'friedman_mse', 'splitter': 'random'}. Best is trial 181 with value: 0.6095141852505885.
[I 2024-12-04 11:52:57,780] Trial 253 finished with value: 0.6722406757321361 and parameters: {'max_depth': 25, 'min_samples_split': 2, 'min_samples_leaf': 1, 'max_features': 'sqrt', 'criterion': 'friedman_mse', 'splitter': 'best'}. Best is trial 181 with value: 0.6095141852505885.
[I 2024-12-04 11:52:58,079] Trial 249 finished with value: 0.6935908088501267 and parameters: {'max_depth': 35, 'min_samples_split': 10, 'min_samples_leaf': 1, 'max_features': 'sqrt', 'criterion': 'friedman_mse', 'splitter': 'best'}. Best is trial 181 with value: 0.6095141852505885.
[I 2024-12-04 11:52:58,080] Trial 260 finished with value: 0.7005261425796804 and parameters: {'max_depth': 28, 'min_samples_split': 10, 'min_samples_leaf': 1, 'max_features': 'sqrt', 'criterion': 'friedman_mse', 'splitter': 'best'}. Best is trial 181 with value: 0.6095141852505885.
[I 2024-12-04 11:52:58,106] Trial 248 finished with value: 0.7533482403327884 and parameters: {'max_depth': 30, 'min_samples_split': 14, 'min_samples_leaf': 1, 'max_features': 'log2', 'criterion': 'friedman_mse', 'splitter': 'best'}. Best is trial 181 with value: 0.6095141852505885.
[I 2024-12-04 11:52:58,338] Trial 261 finished with value: 0.8088890579258617 and parameters: {'max_depth': 33, 'min_samples_split': 12, 'min_samples_leaf': 5, 'max_features': 'sqrt', 'criterion': 'squared_error', 'splitter': 'best'}. Best is trial 181 with value: 0.6095141852505885.
[I 2024-12-04 11:52:58,556] Trial 259 finished with value: 0.8137608958686491 and parameters: {'max_depth': 35, 'min_samples_split': 12, 'min_samples_leaf': 2, 'max_features': 'sqrt', 'criterion': 'friedman_mse', 'splitter': 'best'}. Best is trial 181 with value: 0.6095141852505885.
[I 2024-12-04 11:52:58,868] Trial 257 finished with value: 0.8266069286848198 and parameters: {'max_depth': 26, 'min_samples_split': 9, 'min_samples_leaf': 2, 'max_features': 'sqrt', 'criterion': 'friedman_mse', 'splitter': 'best'}. Best is trial 181 with value: 0.6095141852505885.
[I 2024-12-04 11:52:59,313] Trial 247 finished with value: 0.6702654654144604 and parameters: {'max_depth': 35, 'min_samples_split': 14, 'min_samples_leaf': 1, 'max_features': 'sqrt', 'criterion': 'friedman_mse', 'splitter': 'best'}. Best is trial 181 with value: 0.6095141852505885.
[I 2024-12-04 11:52:59,796] Trial 262 finished with value: 0.6897370689523286 and parameters: {'max_depth': 34, 'min_samples_split': 10, 'min_samples_leaf': 1, 'max_features': 'sqrt', 'criterion': 'friedman_mse', 'splitter': 'best'}. Best is trial 181 with value: 0.6095141852505885.
[I 2024-12-04 11:53:00,320] Trial 256 finished with value: 0.8784319831978802 and parameters: {'max_depth': 16, 'min_samples_split': 12, 'min_samples_leaf': 10, 'max_features': 'sqrt', 'criterion': 'squared_error', 'splitter': 'best'}. Best is trial 181 with value: 0.6095141852505885.
[I 2024-12-04 11:53:00,382] Trial 254 finished with value: 0.7023216453774249 and parameters: {'max_depth': 32, 'min_samples_split': 13, 'min_samples_leaf': 1, 'max_features': 'sqrt', 'criterion': 'friedman_mse', 'splitter': 'best'}. Best is trial 181 with value: 0.6095141852505885.
[I 2024-12-04 11:53:00,573] Trial 268 finished with value: 1.0473457812578062 and parameters: {'max_depth': 6, 'min_samples_split': 13, 'min_samples_leaf': 3, 'max_features': 'sqrt', 'criterion': 'absolute_error', 'splitter': 'random'}. Best is trial 181 with value: 0.6095141852505885.
[I 2024-12-04 11:53:00,827] Trial 258 finished with value: 0.6956327471838119 and parameters: {'max_depth': 25, 'min_samples_split': 12, 'min_samples_leaf': 1, 'max_features': 'sqrt', 'criterion': 'friedman_mse', 'splitter': 'best'}. Best is trial 181 with value: 0.6095141852505885.
[I 2024-12-04 11:53:01,164] Trial 263 finished with value: 0.6935908088501267 and parameters: {'max_depth': 35, 'min_samples_split': 10, 'min_samples_leaf': 1, 'max_features': 'sqrt', 'criterion': 'friedman_mse', 'splitter': 'best'}. Best is trial 181 with value: 0.6095141852505885.
[I 2024-12-04 11:53:01,183] Trial 255 finished with value: 0.8131482590578788 and parameters: {'max_depth': 27, 'min_samples_split': 10, 'min_samples_leaf': 3, 'max_features': 'sqrt', 'criterion': 'friedman_mse', 'splitter': 'best'}. Best is trial 181 with value: 0.6095141852505885.
[I 2024-12-04 11:53:02,115] Trial 266 finished with value: 0.6574307891866741 and parameters: {'max_depth': 27, 'min_samples_split': 10, 'min_samples_leaf': 1, 'max_features': 'sqrt', 'criterion': 'friedman_mse', 'splitter': 'best'}. Best is trial 181 with value: 0.6095141852505885.
[I 2024-12-04 11:53:04,530] Trial 271 finished with value: 0.6657045440033218 and parameters: {'max_depth': 35, 'min_samples_split': 12, 'min_samples_leaf': 1, 'max_features': 'sqrt', 'criterion': 'friedman_mse', 'splitter': 'best'}. Best is trial 181 with value: 0.6095141852505885.
[I 2024-12-04 11:53:05,042] Trial 279 finished with value: 0.7005261425796804 and parameters: {'max_depth': 28, 'min_samples_split': 10, 'min_samples_leaf': 1, 'max_features': 'sqrt', 'criterion': 'friedman_mse', 'splitter': 'best'}. Best is trial 181 with value: 0.6095141852505885.
[I 2024-12-04 11:53:05,051] Trial 267 finished with value: 1.0703780509708551 and parameters: {'max_depth': 13, 'min_samples_split': 20, 'min_samples_leaf': 5, 'max_features': 'log2', 'criterion': 'absolute_error', 'splitter': 'best'}. Best is trial 181 with value: 0.6095141852505885.
[I 2024-12-04 11:53:05,412] Trial 265 finished with value: 1.092723027538113 and parameters: {'max_depth': 17, 'min_samples_split': 17, 'min_samples_leaf': 10, 'max_features': 'log2', 'criterion': 'squared_error', 'splitter': 'random'}. Best is trial 181 with value: 0.6095141852505885.
[I 2024-12-04 11:53:05,413] Trial 276 finished with value: 0.7006537577616888 and parameters: {'max_depth': 25, 'min_samples_split': 16, 'min_samples_leaf': 1, 'max_features': 'sqrt', 'criterion': 'friedman_mse', 'splitter': 'best'}. Best is trial 181 with value: 0.6095141852505885.
[I 2024-12-04 11:53:05,734] Trial 269 finished with value: 0.9449188483277082 and parameters: {'max_depth': 34, 'min_samples_split': 12, 'min_samples_leaf': 3, 'max_features': 'log2', 'criterion': 'friedman_mse', 'splitter': 'best'}. Best is trial 181 with value: 0.6095141852505885.
[I 2024-12-04 11:53:06,050] Trial 283 finished with value: 0.9041722436759626 and parameters: {'max_depth': 28, 'min_samples_split': 14, 'min_samples_leaf': 10, 'max_features': 'sqrt', 'criterion': 'absolute_error', 'splitter': 'best'}. Best is trial 181 with value: 0.6095141852505885.
[I 2024-12-04 11:53:06,200] Trial 281 finished with value: 0.7241223131723469 and parameters: {'max_depth': 23, 'min_samples_split': 9, 'min_samples_leaf': 1, 'max_features': 'sqrt', 'criterion': 'friedman_mse', 'splitter': 'best'}. Best is trial 181 with value: 0.6095141852505885.
[I 2024-12-04 11:53:06,771] Trial 280 finished with value: 0.8137608958686491 and parameters: {'max_depth': 29, 'min_samples_split': 11, 'min_samples_leaf': 2, 'max_features': 'sqrt', 'criterion': 'friedman_mse', 'splitter': 'best'}. Best is trial 181 with value: 0.6095141852505885.
[I 2024-12-04 11:53:07,214] Trial 272 finished with value: 0.8133724389224859 and parameters: {'max_depth': 25, 'min_samples_split': 14, 'min_samples_leaf': 1, 'max_features': 'sqrt', 'criterion': 'friedman_mse', 'splitter': 'random'}. Best is trial 181 with value: 0.6095141852505885.
[I 2024-12-04 11:53:07,298] Trial 273 finished with value: 0.6599142051111299 and parameters: {'max_depth': 28, 'min_samples_split': 2, 'min_samples_leaf': 1, 'max_features': 'sqrt', 'criterion': 'friedman_mse', 'splitter': 'best'}. Best is trial 181 with value: 0.6095141852505885.
[I 2024-12-04 11:53:07,803] Trial 264 finished with value: 0.8131482590578788 and parameters: {'max_depth': 34, 'min_samples_split': 10, 'min_samples_leaf': 3, 'max_features': 'sqrt', 'criterion': 'friedman_mse', 'splitter': 'best'}. Best is trial 181 with value: 0.6095141852505885.
[I 2024-12-04 11:53:08,118] Trial 270 finished with value: 0.6928309661951679 and parameters: {'max_depth': 27, 'min_samples_split': 11, 'min_samples_leaf': 1, 'max_features': 'sqrt', 'criterion': 'friedman_mse', 'splitter': 'best'}. Best is trial 181 with value: 0.6095141852505885.
[I 2024-12-04 11:53:08,281] Trial 275 finished with value: 0.7722845288492907 and parameters: {'max_depth': 30, 'min_samples_split': 8, 'min_samples_leaf': 1, 'max_features': 'sqrt', 'criterion': 'friedman_mse', 'splitter': 'best'}. Best is trial 181 with value: 0.6095141852505885.
[I 2024-12-04 11:53:09,457] Trial 292 finished with value: 0.7722845288492907 and parameters: {'max_depth': 30, 'min_samples_split': 8, 'min_samples_leaf': 1, 'max_features': 'sqrt', 'criterion': 'friedman_mse', 'splitter': 'best'}. Best is trial 181 with value: 0.6095141852505885.
[I 2024-12-04 11:53:09,658] Trial 282 finished with value: 0.8515865665329203 and parameters: {'max_depth': 16, 'min_samples_split': 3, 'min_samples_leaf': 5, 'max_features': 'sqrt', 'criterion': 'squared_error', 'splitter': 'best'}. Best is trial 181 with value: 0.6095141852505885.
[I 2024-12-04 11:53:09,660] Trial 274 finished with value: 0.8264940032263876 and parameters: {'max_depth': 22, 'min_samples_split': 8, 'min_samples_leaf': 2, 'max_features': 'sqrt', 'criterion': 'friedman_mse', 'splitter': 'random'}. Best is trial 181 with value: 0.6095141852505885.
[I 2024-12-04 11:53:09,766] Trial 277 finished with value: 0.7957607517832435 and parameters: {'max_depth': 26, 'min_samples_split': 2, 'min_samples_leaf': 1, 'max_features': 'sqrt', 'criterion': 'friedman_mse', 'splitter': 'best'}. Best is trial 181 with value: 0.6095141852505885.
[I 2024-12-04 11:53:09,863] Trial 291 finished with value: 0.8013857394543201 and parameters: {'max_depth': 24, 'min_samples_split': 4, 'min_samples_leaf': 3, 'max_features': 'sqrt', 'criterion': 'friedman_mse', 'splitter': 'best'}. Best is trial 181 with value: 0.6095141852505885.
[I 2024-12-04 11:53:10,308] Trial 278 finished with value: 0.6724429399742451 and parameters: {'max_depth': 27, 'min_samples_split': 14, 'min_samples_leaf': 1, 'max_features': 'sqrt', 'criterion': 'friedman_mse', 'splitter': 'best'}. Best is trial 181 with value: 0.6095141852505885.
[I 2024-12-04 11:53:10,433] Trial 288 finished with value: 1.0740768482351102 and parameters: {'max_depth': 9, 'min_samples_split': 8, 'min_samples_leaf': 6, 'max_features': 'log2', 'criterion': 'absolute_error', 'splitter': 'best'}. Best is trial 181 with value: 0.6095141852505885.
[I 2024-12-04 11:53:10,570] Trial 285 finished with value: 0.8101385948198155 and parameters: {'max_depth': 30, 'min_samples_split': 3, 'min_samples_leaf': 3, 'max_features': 'sqrt', 'criterion': 'friedman_mse', 'splitter': 'best'}. Best is trial 181 with value: 0.6095141852505885.
[I 2024-12-04 11:53:11,551] Trial 297 finished with value: 0.6960703836181407 and parameters: {'max_depth': 32, 'min_samples_split': 2, 'min_samples_leaf': 1, 'max_features': 'sqrt', 'criterion': 'friedman_mse', 'splitter': 'best'}. Best is trial 181 with value: 0.6095141852505885.
[I 2024-12-04 11:53:11,862] Trial 289 finished with value: 0.7396106613462233 and parameters: {'max_depth': 30, 'min_samples_split': 5, 'min_samples_leaf': 1, 'max_features': 'sqrt', 'criterion': 'absolute_error', 'splitter': 'best'}. Best is trial 181 with value: 0.6095141852505885.
[I 2024-12-04 11:53:12,084] Trial 286 finished with value: 0.6902141202180059 and parameters: {'max_depth': 31, 'min_samples_split': 3, 'min_samples_leaf': 1, 'max_features': 'sqrt', 'criterion': 'friedman_mse', 'splitter': 'best'}. Best is trial 181 with value: 0.6095141852505885.
[I 2024-12-04 11:53:12,166] Trial 295 finished with value: 1.092257372628799 and parameters: {'max_depth': 13, 'min_samples_split': 6, 'min_samples_leaf': 4, 'max_features': 'log2', 'criterion': 'squared_error', 'splitter': 'random'}. Best is trial 181 with value: 0.6095141852505885.
[I 2024-12-04 11:53:12,492] Trial 293 finished with value: 0.6416220728212735 and parameters: {'max_depth': 29, 'min_samples_split': 2, 'min_samples_leaf': 1, 'max_features': 'sqrt', 'criterion': 'friedman_mse', 'splitter': 'best'}. Best is trial 181 with value: 0.6095141852505885.
[I 2024-12-04 11:53:13,205] Trial 299 finished with value: 0.7007608286806496 and parameters: {'max_depth': 30, 'min_samples_split': 14, 'min_samples_leaf': 1, 'max_features': 'sqrt', 'criterion': 'friedman_mse', 'splitter': 'best'}. Best is trial 181 with value: 0.6095141852505885.
[I 2024-12-04 11:53:13,307] Trial 284 finished with value: 1.092723027538113 and parameters: {'max_depth': 3, 'min_samples_split': 14, 'min_samples_leaf': 8, 'max_features': 'log2', 'criterion': 'friedman_mse', 'splitter': 'random'}. Best is trial 181 with value: 0.6095141852505885.
[I 2024-12-04 11:53:13,642] Trial 296 finished with value: 1.0526690128917084 and parameters: {'max_depth': 6, 'min_samples_split': 10, 'min_samples_leaf': 4, 'max_features': 'sqrt', 'criterion': 'absolute_error', 'splitter': 'best'}. Best is trial 181 with value: 0.6095141852505885.
[I 2024-12-04 11:53:13,919] Trial 294 finished with value: 0.7958664622562024 and parameters: {'max_depth': 33, 'min_samples_split': 4, 'min_samples_leaf': 1, 'max_features': 'sqrt', 'criterion': 'friedman_mse', 'splitter': 'best'}. Best is trial 181 with value: 0.6095141852505885.
[I 2024-12-04 11:53:14,547] Trial 308 finished with value: 0.7222286893478446 and parameters: {'max_depth': 28, 'min_samples_split': 12, 'min_samples_leaf': 1, 'max_features': 'sqrt', 'criterion': 'friedman_mse', 'splitter': 'best'}. Best is trial 181 with value: 0.6095141852505885.
[I 2024-12-04 11:53:14,793] Trial 303 finished with value: 0.7707260549816972 and parameters: {'max_depth': 19, 'min_samples_split': 11, 'min_samples_leaf': 1, 'max_features': 'log2', 'criterion': 'friedman_mse', 'splitter': 'best'}. Best is trial 181 with value: 0.6095141852505885.
[I 2024-12-04 11:53:14,897] Trial 287 finished with value: 0.8105579954451577 and parameters: {'max_depth': 28, 'min_samples_split': 12, 'min_samples_leaf': 3, 'max_features': 'sqrt', 'criterion': 'friedman_mse', 'splitter': 'best'}. Best is trial 181 with value: 0.6095141852505885.
[I 2024-12-04 11:53:15,117] Trial 290 finished with value: 0.6889323634393683 and parameters: {'max_depth': 30, 'min_samples_split': 11, 'min_samples_leaf': 1, 'max_features': 'sqrt', 'criterion': 'friedman_mse', 'splitter': 'best'}. Best is trial 181 with value: 0.6095141852505885.
[I 2024-12-04 11:53:15,726] Trial 304 finished with value: 0.6720793313335733 and parameters: {'max_depth': 24, 'min_samples_split': 7, 'min_samples_leaf': 1, 'max_features': 'sqrt', 'criterion': 'friedman_mse', 'splitter': 'best'}. Best is trial 181 with value: 0.6095141852505885.
[I 2024-12-04 11:53:15,801] Trial 298 finished with value: 0.6570109226401653 and parameters: {'max_depth': 35, 'min_samples_split': 11, 'min_samples_leaf': 1, 'max_features': 'sqrt', 'criterion': 'friedman_mse', 'splitter': 'best'}. Best is trial 181 with value: 0.6095141852505885.
[I 2024-12-04 11:53:15,999] Trial 310 finished with value: 1.075383350593605 and parameters: {'max_depth': 31, 'min_samples_split': 13, 'min_samples_leaf': 9, 'max_features': 'sqrt', 'criterion': 'absolute_error', 'splitter': 'random'}. Best is trial 181 with value: 0.6095141852505885.
[I 2024-12-04 11:53:16,117] Trial 307 finished with value: 0.8266069286848198 and parameters: {'max_depth': 27, 'min_samples_split': 10, 'min_samples_leaf': 2, 'max_features': 'sqrt', 'criterion': 'squared_error', 'splitter': 'best'}. Best is trial 181 with value: 0.6095141852505885.
[I 2024-12-04 11:53:16,415] Trial 311 finished with value: 0.825562298787238 and parameters: {'max_depth': 34, 'min_samples_split': 13, 'min_samples_leaf': 3, 'max_features': 'sqrt', 'criterion': 'friedman_mse', 'splitter': 'best'}. Best is trial 181 with value: 0.6095141852505885.
[I 2024-12-04 11:53:16,424] Trial 301 finished with value: 0.679321659918252 and parameters: {'max_depth': 30, 'min_samples_split': 12, 'min_samples_leaf': 1, 'max_features': 'sqrt', 'criterion': 'friedman_mse', 'splitter': 'best'}. Best is trial 181 with value: 0.6095141852505885.
[I 2024-12-04 11:53:16,858] Trial 302 finished with value: 0.6862313348684029 and parameters: {'max_depth': 29, 'min_samples_split': 12, 'min_samples_leaf': 1, 'max_features': 'sqrt', 'criterion': 'friedman_mse', 'splitter': 'best'}. Best is trial 181 with value: 0.6095141852505885.
