[I 2024-12-04 20:50:11,265] Trial 2189 finished with value: 1.091656704854989 and parameters: {'kernel_type': 'Matern', 'length_scale': 3.1817722666469983, 'noise_level': 0.006120263872695168, 'constant_value': 1297.673230278696, 'nu': 0.5}. Best is trial 1997 with value: 0.359156695282073.
[I 2024-12-04 20:50:13,524] Trial 2190 finished with value: 1.0916567158299615 and parameters: {'kernel_type': 'Matern', 'length_scale': 1.2662379079687716, 'noise_level': 2.455640230571852e-08, 'constant_value': 28.214251411458726, 'nu': 1.5}. Best is trial 1997 with value: 0.359156695282073.
[I 2024-12-04 20:50:14,895] Trial 2192 finished with value: 0.3592029977553648 and parameters: {'kernel_type': 'Matern', 'length_scale': 21.825890568634595, 'noise_level': 0.053428309174681624, 'constant_value': 888.2403627255414, 'nu': 0.5}. Best is trial 1997 with value: 0.359156695282073.
[I 2024-12-04 20:50:14,984] Trial 2191 finished with value: 0.3592097074799138 and parameters: {'kernel_type': 'Matern', 'length_scale': 34.95543278589935, 'noise_level': 0.02347538628926085, 'constant_value': 13.02883764852123, 'nu': 0.5}. Best is trial 1997 with value: 0.359156695282073.
[I 2024-12-04 20:50:18,427] Trial 2193 finished with value: 0.41956638354686676 and parameters: {'kernel_type': 'Matern', 'length_scale': 18.621694332953773, 'noise_level': 0.022029910581871988, 'constant_value': 543.1895759929407, 'nu': 2.5}. Best is trial 1997 with value: 0.359156695282073.
[I 2024-12-04 20:50:18,649] Trial 2194 finished with value: 1.0916553669334914 and parameters: {'kernel_type': 'RBF', 'length_scale': 0.028354295476692687, 'noise_level': 0.04420196428793513, 'constant_value': 3.164365147940211e-06, 'nu': 2.5}. Best is trial 1997 with value: 0.359156695282073.
[I 2024-12-04 20:50:20,417] Trial 2195 finished with value: 0.3592112080833288 and parameters: {'kernel_type': 'Matern', 'length_scale': 83.83235402115838, 'noise_level': 0.02264212934752756, 'constant_value': 282.7318609811662, 'nu': 0.5}. Best is trial 1997 with value: 0.359156695282073.
[I 2024-12-04 20:50:23,681] Trial 2198 finished with value: 1.0916567269610957 and parameters: {'kernel_type': 'Matern', 'length_scale': 0.6283628599058521, 'noise_level': 8.416595060490116e-05, 'constant_value': 89443.52140856472, 'nu': 1.5}. Best is trial 1997 with value: 0.359156695282073.
[I 2024-12-04 20:50:23,753] Trial 2196 finished with value: 0.35921123756212686 and parameters: {'kernel_type': 'Matern', 'length_scale': 327.90119585422366, 'noise_level': 0.0019509050245690549, 'constant_value': 1492.3351176786882, 'nu': 0.5}. Best is trial 1997 with value: 0.359156695282073.
[I 2024-12-04 20:50:24,700] Trial 2197 finished with value: 0.42269006947306625 and parameters: {'kernel_type': 'Matern', 'length_scale': 115.67486645162548, 'noise_level': 0.02964008142130407, 'constant_value': 258.1709331877863, 'nu': 1.5}. Best is trial 1997 with value: 0.359156695282073.
[I 2024-12-04 20:50:28,816] Trial 2199 finished with value: 0.35921131398818457 and parameters: {'kernel_type': 'Matern', 'length_scale': 304.03567366064703, 'noise_level': 0.009043467375765573, 'constant_value': 470.8459463630534, 'nu': 0.5}. Best is trial 1997 with value: 0.359156695282073.
[I 2024-12-04 20:50:29,401] Trial 2200 finished with value: 1.0624161173911806 and parameters: {'kernel_type': 'RBF', 'length_scale': 16.557828422070763, 'noise_level': 0.00012998071991618173, 'constant_value': 44.891798547673126, 'nu': 0.5}. Best is trial 1997 with value: 0.359156695282073.
[I 2024-12-04 20:50:30,552] Trial 2201 finished with value: 0.3592112182385281 and parameters: {'kernel_type': 'Matern', 'length_scale': 14.79934585795916, 'noise_level': 0.00029351669187281096, 'constant_value': 72.98761621599392, 'nu': 0.5}. Best is trial 1997 with value: 0.359156695282073.
[I 2024-12-04 20:50:34,914] Trial 2203 finished with value: 0.359211229348766 and parameters: {'kernel_type': 'Matern', 'length_scale': 304.812867393533, 'noise_level': 0.04909395914421687, 'constant_value': 393.07098427960557, 'nu': 0.5}. Best is trial 1997 with value: 0.359156695282073.
[I 2024-12-04 20:50:35,100] Trial 2202 finished with value: 0.3592111970464212 and parameters: {'kernel_type': 'Matern', 'length_scale': 32.96469178093609, 'noise_level': 0.010887496802499258, 'constant_value': 603.7503325703839, 'nu': 0.5}. Best is trial 1997 with value: 0.359156695282073.
[I 2024-12-04 20:50:35,714] Trial 2204 finished with value: 0.35921134378461517 and parameters: {'kernel_type': 'Matern', 'length_scale': 81.10064884049594, 'noise_level': 0.013055786288702841, 'constant_value': 64.8878254930352, 'nu': 0.5}. Best is trial 1997 with value: 0.359156695282073.
[I 2024-12-04 20:50:39,965] Trial 2205 finished with value: 0.35921128193177443 and parameters: {'kernel_type': 'Matern', 'length_scale': 7.6394222675973955, 'noise_level': 0.012419302661234548, 'constant_value': 19.183918527525954, 'nu': 0.5}. Best is trial 1997 with value: 0.359156695282073.
[I 2024-12-04 20:50:39,966] Trial 2207 finished with value: 0.35921069062847105 and parameters: {'kernel_type': 'Matern', 'length_scale': 25.04629777851254, 'noise_level': 0.0006095249916902037, 'constant_value': 10.669640997409967, 'nu': 0.5}. Best is trial 1997 with value: 0.359156695282073.
[I 2024-12-04 20:50:40,957] Trial 2206 finished with value: 0.3592112451392022 and parameters: {'kernel_type': 'Matern', 'length_scale': 46.88516749521447, 'noise_level': 0.04010956833200479, 'constant_value': 3349.5804021839967, 'nu': 0.5}. Best is trial 1997 with value: 0.359156695282073.
[I 2024-12-04 20:50:44,979] Trial 2208 finished with value: 0.359211248226654 and parameters: {'kernel_type': 'Matern', 'length_scale': 25.01411733382938, 'noise_level': 0.002511583761571281, 'constant_value': 1749.8197602475752, 'nu': 0.5}. Best is trial 1997 with value: 0.359156695282073.
[I 2024-12-04 20:50:45,200] Trial 2209 finished with value: 0.35921120750446806 and parameters: {'kernel_type': 'Matern', 'length_scale': 43.644103453908855, 'noise_level': 0.0035691861327976407, 'constant_value': 73945.06072654786, 'nu': 0.5}. Best is trial 1997 with value: 0.359156695282073.
[I 2024-12-04 20:50:45,835] Trial 2210 finished with value: 0.35921129826957154 and parameters: {'kernel_type': 'Matern', 'length_scale': 3.1508815341966554, 'noise_level': 0.00045725471050115366, 'constant_value': 4.202638462417625, 'nu': 0.5}. Best is trial 1997 with value: 0.359156695282073.
[I 2024-12-04 20:50:49,135] Trial 2211 finished with value: 0.3592124167989793 and parameters: {'kernel_type': 'Matern', 'length_scale': 19.949472599352234, 'noise_level': 0.06129254012495183, 'constant_value': 6312.743532772788, 'nu': 0.5}. Best is trial 1997 with value: 0.359156695282073.
[I 2024-12-04 20:50:50,346] Trial 2213 finished with value: 1.0624161172724633 and parameters: {'kernel_type': 'Matern', 'length_scale': 11407.074548833538, 'noise_level': 0.0016317266860692463, 'constant_value': 15.183428190487849, 'nu': 0.5}. Best is trial 1997 with value: 0.359156695282073.
[I 2024-12-04 20:50:50,347] Trial 2212 finished with value: 0.35921057290107794 and parameters: {'kernel_type': 'Matern', 'length_scale': 7.687456757245485, 'noise_level': 0.002814274447804328, 'constant_value': 28.98997592823741, 'nu': 0.5}. Best is trial 1997 with value: 0.359156695282073.
[I 2024-12-04 20:50:53,624] Trial 2215 finished with value: 1.062416117264446 and parameters: {'kernel_type': 'RBF', 'length_scale': 0.04120516789876725, 'noise_level': 0.7039374857512717, 'constant_value': 182.66309290286395, 'nu': 0.5}. Best is trial 1997 with value: 0.359156695282073.
[I 2024-12-04 20:50:54,358] Trial 2214 finished with value: 0.3592115818264802 and parameters: {'kernel_type': 'Matern', 'length_scale': 118.61234250046984, 'noise_level': 0.37540216590137254, 'constant_value': 8742.31224244149, 'nu': 0.5}. Best is trial 1997 with value: 0.359156695282073.
[I 2024-12-04 20:50:56,553] Trial 2216 finished with value: 0.422689542844467 and parameters: {'kernel_type': 'Matern', 'length_scale': 859.1836281121128, 'noise_level': 0.5693987341937393, 'constant_value': 11183.357817608761, 'nu': 1.5}. Best is trial 1997 with value: 0.359156695282073.
[I 2024-12-04 20:51:00,818] Trial 2218 finished with value: 1.0624149885201792 and parameters: {'kernel_type': 'RBF', 'length_scale': 16.885781405678284, 'noise_level': 0.08218236728930624, 'constant_value': 0.13084955376999616, 'nu': 0.5}. Best is trial 1997 with value: 0.359156695282073.
[I 2024-12-04 20:51:01,215] Trial 2217 finished with value: 0.359211242279644 and parameters: {'kernel_type': 'Matern', 'length_scale': 58.88472594532894, 'noise_level': 0.05232734256443154, 'constant_value': 968.6967463814271, 'nu': 0.5}. Best is trial 1997 with value: 0.359156695282073.
[I 2024-12-04 20:51:03,255] Trial 2219 finished with value: 0.35921121552401647 and parameters: {'kernel_type': 'Matern', 'length_scale': 3413.9736252488897, 'noise_level': 0.016953373420076474, 'constant_value': 1019.1858362136522, 'nu': 0.5}. Best is trial 1997 with value: 0.359156695282073.
[I 2024-12-04 20:51:05,940] Trial 2221 finished with value: 0.3592114045779428 and parameters: {'kernel_type': 'Matern', 'length_scale': 111.39171541932576, 'noise_level': 0.8500803641761255, 'constant_value': 11600.704583586725, 'nu': 0.5}. Best is trial 1997 with value: 0.359156695282073.
[I 2024-12-04 20:51:06,398] Trial 2220 finished with value: 0.3592114518265941 and parameters: {'kernel_type': 'Matern', 'length_scale': 81.70037269546964, 'noise_level': 0.014916604197044579, 'constant_value': 100.34290824369903, 'nu': 0.5}. Best is trial 1997 with value: 0.359156695282073.
[I 2024-12-04 20:51:08,271] Trial 2222 finished with value: 0.3592112201817525 and parameters: {'kernel_type': 'Matern', 'length_scale': 24.234624476097817, 'noise_level': 0.0026612380243850684, 'constant_value': 100.97676339700568, 'nu': 0.5}. Best is trial 1997 with value: 0.359156695282073.
[I 2024-12-04 20:51:10,749] Trial 2224 finished with value: 0.3592112799250716 and parameters: {'kernel_type': 'Matern', 'length_scale': 9.381924307178911, 'noise_level': 0.00983931818001956, 'constant_value': 1.2480262909364495, 'nu': 0.5}. Best is trial 1997 with value: 0.359156695282073.
[I 2024-12-04 20:51:11,772] Trial 2223 finished with value: 0.35921120867156137 and parameters: {'kernel_type': 'Matern', 'length_scale': 11.565321444915826, 'noise_level': 0.03657101656497684, 'constant_value': 959.0797335188506, 'nu': 0.5}. Best is trial 1997 with value: 0.359156695282073.
[I 2024-12-04 20:51:13,330] Trial 2225 finished with value: 0.359211154902252 and parameters: {'kernel_type': 'Matern', 'length_scale': 12.658831676789855, 'noise_level': 0.05922288387033643, 'constant_value': 38.436130551720126, 'nu': 0.5}. Best is trial 1997 with value: 0.359156695282073.
[I 2024-12-04 20:51:16,463] Trial 2227 finished with value: 0.3592113364838219 and parameters: {'kernel_type': 'Matern', 'length_scale': 5.123224138820596, 'noise_level': 0.01302311083607809, 'constant_value': 13.374971555889621, 'nu': 0.5}. Best is trial 1997 with value: 0.359156695282073.
[I 2024-12-04 20:51:19,636] Trial 2226 finished with value: 0.35921122725696386 and parameters: {'kernel_type': 'Matern', 'length_scale': 0.10018865227633253, 'noise_level': 0.00017125257283912303, 'constant_value': 0.375452684612947, 'nu': 0.5}. Best is trial 1997 with value: 0.359156695282073.
[I 2024-12-04 20:51:20,048] Trial 2228 finished with value: 0.3592112826858531 and parameters: {'kernel_type': 'Matern', 'length_scale': 62.45835467699791, 'noise_level': 0.010341936553491117, 'constant_value': 68010.1481984927, 'nu': 0.5}. Best is trial 1997 with value: 0.359156695282073.
[I 2024-12-04 20:51:21,435] Trial 2229 finished with value: 0.35921129809000135 and parameters: {'kernel_type': 'Matern', 'length_scale': 840.973044881497, 'noise_level': 0.001072964040295522, 'constant_value': 867.8822219672411, 'nu': 0.5}. Best is trial 1997 with value: 0.359156695282073.
[I 2024-12-04 20:51:24,687] Trial 2231 finished with value: 1.0624161174218634 and parameters: {'kernel_type': 'RBF', 'length_scale': 0.011983985467281397, 'noise_level': 4.773955329209536e-06, 'constant_value': 0.00010811883686078031, 'nu': 2.5}. Best is trial 1997 with value: 0.359156695282073.
[I 2024-12-04 20:51:25,078] Trial 2230 finished with value: 0.35921102652651454 and parameters: {'kernel_type': 'Matern', 'length_scale': 28.25533194463615, 'noise_level': 0.017010858709846963, 'constant_value': 50.14731433983531, 'nu': 0.5}. Best is trial 1997 with value: 0.359156695282073.
[I 2024-12-04 20:51:26,885] Trial 2232 finished with value: 0.3592111690543627 and parameters: {'kernel_type': 'Matern', 'length_scale': 15.827015214671382, 'noise_level': 0.04986537672711994, 'constant_value': 1125.6415885651138, 'nu': 0.5}. Best is trial 1997 with value: 0.359156695282073.
[I 2024-12-04 20:51:29,599] Trial 2234 finished with value: 0.359211185905851 and parameters: {'kernel_type': 'Matern', 'length_scale': 123.45165491057544, 'noise_level': 0.052065918477678795, 'constant_value': 8.583277766571726, 'nu': 0.5}. Best is trial 1997 with value: 0.359156695282073.
[I 2024-12-04 20:51:30,332] Trial 2235 finished with value: 1.0624161172636848 and parameters: {'kernel_type': 'RBF', 'length_scale': 0.005830692179022277, 'noise_level': 0.002399579663968009, 'constant_value': 0.1034653576614146, 'nu': 2.5}. Best is trial 1997 with value: 0.359156695282073.
[I 2024-12-04 20:51:30,750] Trial 2233 finished with value: 0.4226899192278811 and parameters: {'kernel_type': 'Matern', 'length_scale': 11.496301246802462, 'noise_level': 0.017529982491253263, 'constant_value': 2684.9211417093397, 'nu': 1.5}. Best is trial 1997 with value: 0.359156695282073.
[I 2024-12-04 20:51:34,677] Trial 2236 finished with value: 0.35921110159365216 and parameters: {'kernel_type': 'Matern', 'length_scale': 1450.7513828348126, 'noise_level': 0.00036082457309925294, 'constant_value': 45.30312417576207, 'nu': 0.5}. Best is trial 1997 with value: 0.359156695282073.
[I 2024-12-04 20:51:34,683] Trial 2237 finished with value: 0.3592111067395977 and parameters: {'kernel_type': 'Matern', 'length_scale': 2.407170705339015, 'noise_level': 0.062475778110171645, 'constant_value': 1576.7728978168132, 'nu': 0.5}. Best is trial 1997 with value: 0.359156695282073.
[I 2024-12-04 20:51:35,629] Trial 2238 finished with value: 0.41956595993607354 and parameters: {'kernel_type': 'Matern', 'length_scale': 7.557321513876593, 'noise_level': 0.0003735652746835089, 'constant_value': 16.141579182888332, 'nu': 2.5}. Best is trial 1997 with value: 0.359156695282073.
[I 2024-12-04 20:51:38,895] Trial 2239 finished with value: 0.3591953644283946 and parameters: {'kernel_type': 'Matern', 'length_scale': 10.392799403026213, 'noise_level': 0.00025040308026326154, 'constant_value': 1830.8535408344985, 'nu': 0.5}. Best is trial 1997 with value: 0.359156695282073.
[I 2024-12-04 20:51:40,531] Trial 2241 finished with value: 0.3592112392716482 and parameters: {'kernel_type': 'Matern', 'length_scale': 0.7764702351647237, 'noise_level': 0.019559559475331834, 'constant_value': 18.880683068916664, 'nu': 0.5}. Best is trial 1997 with value: 0.359156695282073.
[I 2024-12-04 20:51:41,049] Trial 2240 finished with value: 0.3592112729568697 and parameters: {'kernel_type': 'Matern', 'length_scale': 1197.260959752679, 'noise_level': 6.736536175456047e-05, 'constant_value': 16474.20554663512, 'nu': 0.5}. Best is trial 1997 with value: 0.359156695282073.
[I 2024-12-04 20:51:42,773] Trial 2242 finished with value: 1.0916557259234934 and parameters: {'kernel_type': 'Matern', 'length_scale': 0.20989085046262096, 'noise_level': 8.845728204885684e-05, 'constant_value': 52706.051049676185, 'nu': 0.5}. Best is trial 1997 with value: 0.359156695282073.
[I 2024-12-04 20:51:44,113] Trial 2243 finished with value: 1.0916566548488589 and parameters: {'kernel_type': 'Matern', 'length_scale': 113.9678258476697, 'noise_level': 1.8918894597671e-05, 'constant_value': 44312.21518669501, 'nu': 0.5}. Best is trial 1997 with value: 0.359156695282073.
[I 2024-12-04 20:51:44,384] Trial 2244 finished with value: 1.0916565855744507 and parameters: {'kernel_type': 'Matern', 'length_scale': 69.47299807913681, 'noise_level': 8.895372810990379e-08, 'constant_value': 2349.370739952208, 'nu': 0.5}. Best is trial 1997 with value: 0.359156695282073.
[I 2024-12-04 20:51:46,519] Trial 2245 finished with value: 1.0624161172792994 and parameters: {'kernel_type': 'RBF', 'length_scale': 0.002005694179069303, 'noise_level': 0.0013990684469748415, 'constant_value': 0.1255035318913447, 'nu': 1.5}. Best is trial 1997 with value: 0.359156695282073.
[I 2024-12-04 20:51:49,225] Trial 2246 finished with value: 0.3592112672574726 and parameters: {'kernel_type': 'Matern', 'length_scale': 2.4151928768967816, 'noise_level': 8.82004832426393e-05, 'constant_value': 24.19479036837606, 'nu': 0.5}. Best is trial 1997 with value: 0.359156695282073.
[I 2024-12-04 20:51:49,439] Trial 2247 finished with value: 0.35921123889370343 and parameters: {'kernel_type': 'Matern', 'length_scale': 7.3853830453875755, 'noise_level': 0.0005248093304618116, 'constant_value': 199.4793760238526, 'nu': 0.5}. Best is trial 1997 with value: 0.359156695282073.
[I 2024-12-04 20:51:54,008] Trial 2248 finished with value: 0.3592113887642926 and parameters: {'kernel_type': 'Matern', 'length_scale': 27.95322032341564, 'noise_level': 0.00025490613378072044, 'constant_value': 0.31202834597002793, 'nu': 0.5}. Best is trial 1997 with value: 0.359156695282073.
[I 2024-12-04 20:51:54,013] Trial 2249 finished with value: 0.3592112302811176 and parameters: {'kernel_type': 'Matern', 'length_scale': 18.662054863548995, 'noise_level': 8.406189807563112e-05, 'constant_value': 18396.28270759989, 'nu': 0.5}. Best is trial 1997 with value: 0.359156695282073.
[I 2024-12-04 20:51:55,960] Trial 2250 finished with value: 0.3592112340237131 and parameters: {'kernel_type': 'Matern', 'length_scale': 608.5605289409675, 'noise_level': 0.00015392460078995712, 'constant_value': 1908.5578641788848, 'nu': 0.5}. Best is trial 1997 with value: 0.359156695282073.
[I 2024-12-04 20:51:57,559] Trial 2252 finished with value: 1.0916563978140028 and parameters: {'kernel_type': 'Matern', 'length_scale': 1.891421961962994, 'noise_level': 7.1372838516516295e-06, 'constant_value': 34490.442762858125, 'nu': 0.5}. Best is trial 1997 with value: 0.359156695282073.
[I 2024-12-04 20:51:59,855] Trial 2251 finished with value: 0.3592112405668129 and parameters: {'kernel_type': 'Matern', 'length_scale': 1.561015095171851, 'noise_level': 9.486167604260487e-05, 'constant_value': 330.22206373487364, 'nu': 0.5}. Best is trial 1997 with value: 0.359156695282073.
[I 2024-12-04 20:52:01,582] Trial 2253 finished with value: 0.35921151324378875 and parameters: {'kernel_type': 'Matern', 'length_scale': 10.927343855635469, 'noise_level': 4.493402022133066e-05, 'constant_value': 384.77102386335673, 'nu': 0.5}. Best is trial 1997 with value: 0.359156695282073.
[I 2024-12-04 20:52:03,665] Trial 2254 finished with value: 0.35921116294947575 and parameters: {'kernel_type': 'Matern', 'length_scale': 4.126257525950515, 'noise_level': 0.0007906485779251385, 'constant_value': 17.802212654123878, 'nu': 0.5}. Best is trial 1997 with value: 0.359156695282073.
[I 2024-12-04 20:52:06,105] Trial 2255 finished with value: 1.0624161171622732 and parameters: {'kernel_type': 'RBF', 'length_scale': 0.08364856072246489, 'noise_level': 0.10144538959798047, 'constant_value': 1315.0660094652108, 'nu': 2.5}. Best is trial 1997 with value: 0.359156695282073.
[I 2024-12-04 20:52:09,877] Trial 2257 finished with value: 0.35921123912325065 and parameters: {'kernel_type': 'Matern', 'length_scale': 243.970033757535, 'noise_level': 0.00018182948978476824, 'constant_value': 225.67447387199368, 'nu': 0.5}. Best is trial 1997 with value: 0.359156695282073.
[I 2024-12-04 20:52:10,000] Trial 2258 finished with value: 1.0916564866648426 and parameters: {'kernel_type': 'Matern', 'length_scale': 34.53423730525299, 'noise_level': 1.7428040090062742e-05, 'constant_value': 28.409661369234293, 'nu': 0.5}. Best is trial 1997 with value: 0.359156695282073.
[I 2024-12-04 20:52:10,243] Trial 2256 finished with value: 0.41956600509981234 and parameters: {'kernel_type': 'Matern', 'length_scale': 36.62018930849122, 'noise_level': 0.017059883194495612, 'constant_value': 22738.20511585378, 'nu': 2.5}. Best is trial 1997 with value: 0.359156695282073.
[I 2024-12-04 20:52:15,453] Trial 2260 finished with value: 0.35921107529367796 and parameters: {'kernel_type': 'Matern', 'length_scale': 0.8347982679114855, 'noise_level': 0.00020847777056662347, 'constant_value': 610.594490357986, 'nu': 0.5}. Best is trial 1997 with value: 0.359156695282073.
[I 2024-12-04 20:52:15,547] Trial 2259 finished with value: 0.35921624913532185 and parameters: {'kernel_type': 'Matern', 'length_scale': 13.771908670950458, 'noise_level': 6.20652292573245e-05, 'constant_value': 222.6402901456312, 'nu': 0.5}. Best is trial 1997 with value: 0.359156695282073.
[I 2024-12-04 20:52:18,380] Trial 2261 finished with value: 1.0624161172674913 and parameters: {'kernel_type': 'RBF', 'length_scale': 94467.66774439829, 'noise_level': 2.0904655564431443e-05, 'constant_value': 1.487158164633794, 'nu': 2.5}. Best is trial 1997 with value: 0.359156695282073.
[I 2024-12-04 20:52:20,590] Trial 2263 finished with value: 0.35921144322563026 and parameters: {'kernel_type': 'Matern', 'length_scale': 36.725971318998155, 'noise_level': 0.00011812775667591922, 'constant_value': 2364.067511820387, 'nu': 0.5}. Best is trial 1997 with value: 0.359156695282073.
