[I 2024-12-04 15:07:21,403] Trial 875 finished with value: 1.0346245494168334 and parameters: {'n_estimators': 812, 'max_depth': 50, 'min_samples_split': 2, 'min_samples_leaf': 15, 'max_features': 'sqrt', 'bootstrap': True, 'criterion': 'absolute_error'}. Best is trial 590 with value: 0.4185444504443197.
[I 2024-12-04 15:07:23,069] Trial 865 finished with value: 0.7350665928053828 and parameters: {'n_estimators': 594, 'max_depth': 6, 'min_samples_split': 29, 'min_samples_leaf': 6, 'max_features': None, 'bootstrap': False, 'criterion': 'absolute_error'}. Best is trial 590 with value: 0.4185444504443197.
[I 2024-12-04 15:07:23,129] Trial 860 finished with value: 0.67717665716635 and parameters: {'n_estimators': 913, 'max_depth': 25, 'min_samples_split': 26, 'min_samples_leaf': 1, 'max_features': 'sqrt', 'bootstrap': False, 'criterion': 'absolute_error'}. Best is trial 590 with value: 0.4185444504443197.
[I 2024-12-04 15:07:23,633] Trial 879 finished with value: 0.532854945612845 and parameters: {'n_estimators': 634, 'max_depth': 50, 'min_samples_split': 2, 'min_samples_leaf': 1, 'max_features': None, 'bootstrap': False, 'criterion': 'squared_error'}. Best is trial 590 with value: 0.4185444504443197.
[I 2024-12-04 15:07:23,673] Trial 856 finished with value: 0.46531449170754197 and parameters: {'n_estimators': 997, 'max_depth': 40, 'min_samples_split': 2, 'min_samples_leaf': 2, 'max_features': None, 'bootstrap': True, 'criterion': 'squared_error'}. Best is trial 590 with value: 0.4185444504443197.
[I 2024-12-04 15:07:23,748] Trial 868 finished with value: 0.4949612550297123 and parameters: {'n_estimators': 998, 'max_depth': 45, 'min_samples_split': 2, 'min_samples_leaf': 1, 'max_features': 'sqrt', 'bootstrap': True, 'criterion': 'squared_error'}. Best is trial 590 with value: 0.4185444504443197.
[I 2024-12-04 15:07:24,668] Trial 876 finished with value: 0.5365990612090313 and parameters: {'n_estimators': 593, 'max_depth': 30, 'min_samples_split': 2, 'min_samples_leaf': 1, 'max_features': 'sqrt', 'bootstrap': False, 'criterion': 'squared_error'}. Best is trial 590 with value: 0.4185444504443197.
[I 2024-12-04 15:07:25,696] Trial 848 finished with value: 0.5320929491218064 and parameters: {'n_estimators': 516, 'max_depth': 33, 'min_samples_split': 40, 'min_samples_leaf': 1, 'max_features': None, 'bootstrap': True, 'criterion': 'absolute_error'}. Best is trial 590 with value: 0.4185444504443197.
[I 2024-12-04 15:07:27,240] Trial 867 finished with value: 0.46521933854283026 and parameters: {'n_estimators': 768, 'max_depth': 43, 'min_samples_split': 2, 'min_samples_leaf': 2, 'max_features': None, 'bootstrap': True, 'criterion': 'squared_error'}. Best is trial 590 with value: 0.4185444504443197.
[I 2024-12-04 15:07:27,429] Trial 866 finished with value: 0.41959945605785803 and parameters: {'n_estimators': 848, 'max_depth': 39, 'min_samples_split': 2, 'min_samples_leaf': 1, 'max_features': None, 'bootstrap': True, 'criterion': 'squared_error'}. Best is trial 590 with value: 0.4185444504443197.
[I 2024-12-04 15:07:31,482] Trial 872 finished with value: 0.4651660086940688 and parameters: {'n_estimators': 935, 'max_depth': 34, 'min_samples_split': 4, 'min_samples_leaf': 2, 'max_features': None, 'bootstrap': True, 'criterion': 'squared_error'}. Best is trial 590 with value: 0.4185444504443197.
[I 2024-12-04 15:07:33,732] Trial 877 finished with value: 0.5002042146599085 and parameters: {'n_estimators': 759, 'max_depth': 43, 'min_samples_split': 2, 'min_samples_leaf': 1, 'max_features': 'sqrt', 'bootstrap': True, 'criterion': 'squared_error'}. Best is trial 590 with value: 0.4185444504443197.
[I 2024-12-04 15:07:38,074] Trial 880 finished with value: 0.42156636597661046 and parameters: {'n_estimators': 627, 'max_depth': 36, 'min_samples_split': 2, 'min_samples_leaf': 1, 'max_features': None, 'bootstrap': True, 'criterion': 'squared_error'}. Best is trial 590 with value: 0.4185444504443197.
[I 2024-12-04 15:07:46,960] Trial 882 finished with value: 0.43123316701169434 and parameters: {'n_estimators': 853, 'max_depth': 44, 'min_samples_split': 4, 'min_samples_leaf': 1, 'max_features': None, 'bootstrap': True, 'criterion': 'squared_error'}. Best is trial 590 with value: 0.4185444504443197.
[I 2024-12-04 15:07:50,190] Trial 884 finished with value: 0.4322043258080647 and parameters: {'n_estimators': 652, 'max_depth': 35, 'min_samples_split': 4, 'min_samples_leaf': 1, 'max_features': None, 'bootstrap': True, 'criterion': 'squared_error'}. Best is trial 590 with value: 0.4185444504443197.
[I 2024-12-04 15:07:50,479] Trial 889 finished with value: 0.607837735408133 and parameters: {'n_estimators': 696, 'max_depth': 43, 'min_samples_split': 2, 'min_samples_leaf': 1, 'max_features': 'log2', 'bootstrap': True, 'criterion': 'squared_error'}. Best is trial 590 with value: 0.4185444504443197.
[I 2024-12-04 15:07:51,306] Trial 898 finished with value: 0.8862691899380398 and parameters: {'n_estimators': 319, 'max_depth': 8, 'min_samples_split': 2, 'min_samples_leaf': 1, 'max_features': 'sqrt', 'bootstrap': False, 'criterion': 'absolute_error'}. Best is trial 590 with value: 0.4185444504443197.
[I 2024-12-04 15:07:53,287] Trial 892 finished with value: 1.0596937230785517 and parameters: {'n_estimators': 546, 'max_depth': 48, 'min_samples_split': 2, 'min_samples_leaf': 8, 'max_features': 'log2', 'bootstrap': False, 'criterion': 'squared_error'}. Best is trial 590 with value: 0.4185444504443197.
[I 2024-12-04 15:07:53,301] Trial 881 finished with value: 0.4205408622408434 and parameters: {'n_estimators': 858, 'max_depth': 36, 'min_samples_split': 2, 'min_samples_leaf': 1, 'max_features': None, 'bootstrap': True, 'criterion': 'squared_error'}. Best is trial 590 with value: 0.4185444504443197.
[I 2024-12-04 15:07:53,352] Trial 886 finished with value: 0.42158834426011355 and parameters: {'n_estimators': 684, 'max_depth': 43, 'min_samples_split': 2, 'min_samples_leaf': 1, 'max_features': None, 'bootstrap': True, 'criterion': 'squared_error'}. Best is trial 590 with value: 0.4185444504443197.
[I 2024-12-04 15:07:54,253] Trial 883 finished with value: 0.4215337197897101 and parameters: {'n_estimators': 894, 'max_depth': 49, 'min_samples_split': 2, 'min_samples_leaf': 1, 'max_features': None, 'bootstrap': True, 'criterion': 'squared_error'}. Best is trial 590 with value: 0.4185444504443197.
[I 2024-12-04 15:07:54,729] Trial 897 finished with value: 0.9845114589060917 and parameters: {'n_estimators': 806, 'max_depth': 12, 'min_samples_split': 5, 'min_samples_leaf': 11, 'max_features': 'sqrt', 'bootstrap': False, 'criterion': 'absolute_error'}. Best is trial 590 with value: 0.4185444504443197.
[I 2024-12-04 15:07:56,890] Trial 906 finished with value: 0.9005397583936555 and parameters: {'n_estimators': 200, 'max_depth': 15, 'min_samples_split': 32, 'min_samples_leaf': 1, 'max_features': 'log2', 'bootstrap': False, 'criterion': 'squared_error'}. Best is trial 590 with value: 0.4185444504443197.
[I 2024-12-04 15:07:56,893] Trial 887 finished with value: 0.4194017712636209 and parameters: {'n_estimators': 754, 'max_depth': 41, 'min_samples_split': 2, 'min_samples_leaf': 1, 'max_features': None, 'bootstrap': True, 'criterion': 'squared_error'}. Best is trial 590 with value: 0.4185444504443197.
[I 2024-12-04 15:07:57,117] Trial 888 finished with value: 0.41981285492333326 and parameters: {'n_estimators': 791, 'max_depth': 41, 'min_samples_split': 2, 'min_samples_leaf': 1, 'max_features': None, 'bootstrap': True, 'criterion': 'squared_error'}. Best is trial 590 with value: 0.4185444504443197.
[I 2024-12-04 15:07:57,668] Trial 905 finished with value: 1.0725693446863431 and parameters: {'n_estimators': 269, 'max_depth': 19, 'min_samples_split': 2, 'min_samples_leaf': 11, 'max_features': 'log2', 'bootstrap': True, 'criterion': 'squared_error'}. Best is trial 590 with value: 0.4185444504443197.
[I 2024-12-04 15:07:59,007] Trial 893 finished with value: 0.4318901849781398 and parameters: {'n_estimators': 650, 'max_depth': 44, 'min_samples_split': 4, 'min_samples_leaf': 1, 'max_features': None, 'bootstrap': True, 'criterion': 'squared_error'}. Best is trial 590 with value: 0.4185444504443197.
[I 2024-12-04 15:08:06,275] Trial 901 finished with value: 0.5234680666359277 and parameters: {'n_estimators': 963, 'max_depth': 30, 'min_samples_split': 2, 'min_samples_leaf': 1, 'max_features': None, 'bootstrap': False, 'criterion': 'squared_error'}. Best is trial 590 with value: 0.4185444504443197.
[I 2024-12-04 15:08:06,295] Trial 885 finished with value: 0.42003432577204347 and parameters: {'n_estimators': 991, 'max_depth': 43, 'min_samples_split': 2, 'min_samples_leaf': 1, 'max_features': None, 'bootstrap': True, 'criterion': 'squared_error'}. Best is trial 590 with value: 0.4185444504443197.
[I 2024-12-04 15:08:11,310] Trial 895 finished with value: 0.4650292570520363 and parameters: {'n_estimators': 856, 'max_depth': 40, 'min_samples_split': 4, 'min_samples_leaf': 2, 'max_features': None, 'bootstrap': True, 'criterion': 'squared_error'}. Best is trial 590 with value: 0.4185444504443197.
[I 2024-12-04 15:08:15,434] Trial 915 finished with value: 0.7238730171979699 and parameters: {'n_estimators': 522, 'max_depth': 37, 'min_samples_split': 34, 'min_samples_leaf': 1, 'max_features': 'log2', 'bootstrap': False, 'criterion': 'squared_error'}. Best is trial 590 with value: 0.4185444504443197.
[I 2024-12-04 15:08:15,449] Trial 890 finished with value: 0.42400236641152306 and parameters: {'n_estimators': 853, 'max_depth': 38, 'min_samples_split': 3, 'min_samples_leaf': 1, 'max_features': None, 'bootstrap': True, 'criterion': 'squared_error'}. Best is trial 590 with value: 0.4185444504443197.
[I 2024-12-04 15:08:16,328] Trial 909 finished with value: 0.9625225432548035 and parameters: {'n_estimators': 303, 'max_depth': 11, 'min_samples_split': 2, 'min_samples_leaf': 2, 'max_features': 'log2', 'bootstrap': False, 'criterion': 'absolute_error'}. Best is trial 590 with value: 0.4185444504443197.
[I 2024-12-04 15:08:16,821] Trial 900 finished with value: 0.4653425920188191 and parameters: {'n_estimators': 816, 'max_depth': 37, 'min_samples_split': 2, 'min_samples_leaf': 2, 'max_features': None, 'bootstrap': True, 'criterion': 'squared_error'}. Best is trial 590 with value: 0.4185444504443197.
[I 2024-12-04 15:08:17,561] Trial 896 finished with value: 0.42152850162673816 and parameters: {'n_estimators': 754, 'max_depth': 33, 'min_samples_split': 2, 'min_samples_leaf': 1, 'max_features': None, 'bootstrap': True, 'criterion': 'squared_error'}. Best is trial 590 with value: 0.4185444504443197.
[I 2024-12-04 15:08:18,716] Trial 894 finished with value: 0.4313928174530513 and parameters: {'n_estimators': 984, 'max_depth': 40, 'min_samples_split': 4, 'min_samples_leaf': 1, 'max_features': None, 'bootstrap': True, 'criterion': 'squared_error'}. Best is trial 590 with value: 0.4185444504443197.
[I 2024-12-04 15:08:19,456] Trial 903 finished with value: 0.4649385367571575 and parameters: {'n_estimators': 678, 'max_depth': 48, 'min_samples_split': 3, 'min_samples_leaf': 2, 'max_features': None, 'bootstrap': True, 'criterion': 'squared_error'}. Best is trial 590 with value: 0.4185444504443197.
[I 2024-12-04 15:08:19,839] Trial 873 finished with value: 0.4355132529800861 and parameters: {'n_estimators': 689, 'max_depth': 31, 'min_samples_split': 2, 'min_samples_leaf': 1, 'max_features': None, 'bootstrap': True, 'criterion': 'absolute_error'}. Best is trial 590 with value: 0.4185444504443197.
[I 2024-12-04 15:08:19,840] Trial 911 finished with value: 1.0386719675964038 and parameters: {'n_estimators': 804, 'max_depth': 32, 'min_samples_split': 3, 'min_samples_leaf': 14, 'max_features': 'sqrt', 'bootstrap': True, 'criterion': 'squared_error'}. Best is trial 590 with value: 0.4185444504443197.
[I 2024-12-04 15:08:19,843] Trial 904 finished with value: 0.4231239152098572 and parameters: {'n_estimators': 539, 'max_depth': 43, 'min_samples_split': 2, 'min_samples_leaf': 1, 'max_features': None, 'bootstrap': True, 'criterion': 'squared_error'}. Best is trial 590 with value: 0.4185444504443197.
[I 2024-12-04 15:08:20,890] Trial 913 finished with value: 0.6024280829279358 and parameters: {'n_estimators': 230, 'max_depth': 34, 'min_samples_split': 14, 'min_samples_leaf': 1, 'max_features': 'sqrt', 'bootstrap': True, 'criterion': 'squared_error'}. Best is trial 590 with value: 0.4185444504443197.
[I 2024-12-04 15:08:22,323] Trial 899 finished with value: 0.5151364035542141 and parameters: {'n_estimators': 967, 'max_depth': 42, 'min_samples_split': 4, 'min_samples_leaf': 1, 'max_features': None, 'bootstrap': False, 'criterion': 'squared_error'}. Best is trial 590 with value: 0.4185444504443197.
[I 2024-12-04 15:08:24,270] Trial 902 finished with value: 0.4205912667180175 and parameters: {'n_estimators': 989, 'max_depth': 42, 'min_samples_split': 2, 'min_samples_leaf': 1, 'max_features': None, 'bootstrap': True, 'criterion': 'squared_error'}. Best is trial 590 with value: 0.4185444504443197.
[I 2024-12-04 15:08:25,004] Trial 874 finished with value: 0.4592361038750321 and parameters: {'n_estimators': 843, 'max_depth': 35, 'min_samples_split': 2, 'min_samples_leaf': 2, 'max_features': None, 'bootstrap': True, 'criterion': 'absolute_error'}. Best is trial 590 with value: 0.4185444504443197.
[I 2024-12-04 15:08:26,243] Trial 891 finished with value: 0.7334959374518232 and parameters: {'n_estimators': 828, 'max_depth': 31, 'min_samples_split': 5, 'min_samples_leaf': 2, 'max_features': 'sqrt', 'bootstrap': True, 'criterion': 'absolute_error'}. Best is trial 590 with value: 0.4185444504443197.
[I 2024-12-04 15:08:29,561] Trial 853 finished with value: 0.4287685441745641 and parameters: {'n_estimators': 870, 'max_depth': 37, 'min_samples_split': 3, 'min_samples_leaf': 1, 'max_features': None, 'bootstrap': True, 'criterion': 'absolute_error'}. Best is trial 590 with value: 0.4185444504443197.
[I 2024-12-04 15:08:31,509] Trial 918 finished with value: 0.678095582611128 and parameters: {'n_estimators': 775, 'max_depth': 33, 'min_samples_split': 2, 'min_samples_leaf': 1, 'max_features': 'log2', 'bootstrap': True, 'criterion': 'squared_error'}. Best is trial 590 with value: 0.4185444504443197.
[I 2024-12-04 15:08:32,645] Trial 878 finished with value: 0.4600136169547029 and parameters: {'n_estimators': 953, 'max_depth': 38, 'min_samples_split': 2, 'min_samples_leaf': 2, 'max_features': None, 'bootstrap': True, 'criterion': 'absolute_error'}. Best is trial 590 with value: 0.4185444504443197.
[I 2024-12-04 15:08:40,143] Trial 917 finished with value: 0.42162132976125244 and parameters: {'n_estimators': 663, 'max_depth': 37, 'min_samples_split': 2, 'min_samples_leaf': 1, 'max_features': None, 'bootstrap': True, 'criterion': 'squared_error'}. Best is trial 590 with value: 0.4185444504443197.
[I 2024-12-04 15:08:40,539] Trial 929 finished with value: 1.050479493873395 and parameters: {'n_estimators': 354, 'max_depth': 38, 'min_samples_split': 6, 'min_samples_leaf': 8, 'max_features': 'log2', 'bootstrap': True, 'criterion': 'absolute_error'}. Best is trial 590 with value: 0.4185444504443197.
[I 2024-12-04 15:08:40,711] Trial 925 finished with value: 1.0642864513206618 and parameters: {'n_estimators': 973, 'max_depth': 35, 'min_samples_split': 3, 'min_samples_leaf': 10, 'max_features': 'log2', 'bootstrap': False, 'criterion': 'squared_error'}. Best is trial 590 with value: 0.4185444504443197.
[I 2024-12-04 15:08:42,050] Trial 907 finished with value: 0.4213925138275158 and parameters: {'n_estimators': 891, 'max_depth': 32, 'min_samples_split': 2, 'min_samples_leaf': 1, 'max_features': None, 'bootstrap': True, 'criterion': 'squared_error'}. Best is trial 590 with value: 0.4185444504443197.
[I 2024-12-04 15:08:45,955] Trial 921 finished with value: 0.41963965460828057 and parameters: {'n_estimators': 649, 'max_depth': 41, 'min_samples_split': 2, 'min_samples_leaf': 1, 'max_features': None, 'bootstrap': True, 'criterion': 'squared_error'}. Best is trial 590 with value: 0.4185444504443197.
[I 2024-12-04 15:08:47,847] Trial 914 finished with value: 0.4188736550401998 and parameters: {'n_estimators': 838, 'max_depth': 40, 'min_samples_split': 2, 'min_samples_leaf': 1, 'max_features': None, 'bootstrap': True, 'criterion': 'squared_error'}. Best is trial 590 with value: 0.4185444504443197.
[I 2024-12-04 15:08:51,517] Trial 922 finished with value: 0.4321954026314924 and parameters: {'n_estimators': 817, 'max_depth': 43, 'min_samples_split': 4, 'min_samples_leaf': 1, 'max_features': None, 'bootstrap': True, 'criterion': 'squared_error'}. Best is trial 590 with value: 0.4185444504443197.
[I 2024-12-04 15:08:54,724] Trial 919 finished with value: 0.4209648104406171 and parameters: {'n_estimators': 797, 'max_depth': 43, 'min_samples_split': 2, 'min_samples_leaf': 1, 'max_features': None, 'bootstrap': True, 'criterion': 'squared_error'}. Best is trial 590 with value: 0.4185444504443197.
[I 2024-12-04 15:08:55,894] Trial 910 finished with value: 0.46246011602435044 and parameters: {'n_estimators': 526, 'max_depth': 49, 'min_samples_split': 2, 'min_samples_leaf': 2, 'max_features': None, 'bootstrap': True, 'criterion': 'absolute_error'}. Best is trial 590 with value: 0.4185444504443197.
[I 2024-12-04 15:08:56,419] Trial 930 finished with value: 0.7185598062819593 and parameters: {'n_estimators': 843, 'max_depth': 35, 'min_samples_split': 44, 'min_samples_leaf': 2, 'max_features': 'sqrt', 'bootstrap': True, 'criterion': 'squared_error'}. Best is trial 590 with value: 0.4185444504443197.
[I 2024-12-04 15:08:57,890] Trial 923 finished with value: 0.4654306713631751 and parameters: {'n_estimators': 824, 'max_depth': 46, 'min_samples_split': 2, 'min_samples_leaf': 2, 'max_features': None, 'bootstrap': True, 'criterion': 'squared_error'}. Best is trial 590 with value: 0.4185444504443197.
[I 2024-12-04 15:08:57,901] Trial 920 finished with value: 0.711016530871449 and parameters: {'n_estimators': 990, 'max_depth': 31, 'min_samples_split': 3, 'min_samples_leaf': 1, 'max_features': 'log2', 'bootstrap': False, 'criterion': 'absolute_error'}. Best is trial 590 with value: 0.4185444504443197.
[I 2024-12-04 15:08:58,798] Trial 912 finished with value: 0.4209389385333963 and parameters: {'n_estimators': 976, 'max_depth': 35, 'min_samples_split': 2, 'min_samples_leaf': 1, 'max_features': None, 'bootstrap': True, 'criterion': 'squared_error'}. Best is trial 590 with value: 0.4185444504443197.
[I 2024-12-04 15:09:05,757] Trial 933 finished with value: 0.4649739942271298 and parameters: {'n_estimators': 666, 'max_depth': 37, 'min_samples_split': 2, 'min_samples_leaf': 2, 'max_features': None, 'bootstrap': True, 'criterion': 'squared_error'}. Best is trial 590 with value: 0.4185444504443197.
[I 2024-12-04 15:09:06,829] Trial 924 finished with value: 0.4208452713408661 and parameters: {'n_estimators': 830, 'max_depth': 37, 'min_samples_split': 2, 'min_samples_leaf': 1, 'max_features': None, 'bootstrap': True, 'criterion': 'squared_error'}. Best is trial 590 with value: 0.4185444504443197.
[I 2024-12-04 15:09:06,831] Trial 932 finished with value: 0.4647228113128575 and parameters: {'n_estimators': 891, 'max_depth': 33, 'min_samples_split': 2, 'min_samples_leaf': 2, 'max_features': None, 'bootstrap': True, 'criterion': 'squared_error'}. Best is trial 590 with value: 0.4185444504443197.
[I 2024-12-04 15:09:10,746] Trial 928 finished with value: 0.43102999752277416 and parameters: {'n_estimators': 763, 'max_depth': 37, 'min_samples_split': 4, 'min_samples_leaf': 1, 'max_features': None, 'bootstrap': True, 'criterion': 'squared_error'}. Best is trial 590 with value: 0.4185444504443197.
[I 2024-12-04 15:09:11,349] Trial 938 finished with value: 0.41892040074572634 and parameters: {'n_estimators': 725, 'max_depth': 40, 'min_samples_split': 2, 'min_samples_leaf': 1, 'max_features': None, 'bootstrap': True, 'criterion': 'squared_error'}. Best is trial 590 with value: 0.4185444504443197.
[I 2024-12-04 15:09:11,538] Trial 931 finished with value: 0.4196977872065803 and parameters: {'n_estimators': 660, 'max_depth': 40, 'min_samples_split': 2, 'min_samples_leaf': 1, 'max_features': None, 'bootstrap': True, 'criterion': 'squared_error'}. Best is trial 590 with value: 0.4185444504443197.
[I 2024-12-04 15:09:12,730] Trial 927 finished with value: 0.465328887375918 and parameters: {'n_estimators': 991, 'max_depth': 42, 'min_samples_split': 2, 'min_samples_leaf': 2, 'max_features': None, 'bootstrap': True, 'criterion': 'squared_error'}. Best is trial 590 with value: 0.4185444504443197.
[I 2024-12-04 15:09:13,482] Trial 934 finished with value: 0.42144351118326145 and parameters: {'n_estimators': 814, 'max_depth': 44, 'min_samples_split': 2, 'min_samples_leaf': 1, 'max_features': None, 'bootstrap': True, 'criterion': 'squared_error'}. Best is trial 590 with value: 0.4185444504443197.
[I 2024-12-04 15:09:14,540] Trial 935 finished with value: 0.42234363809387265 and parameters: {'n_estimators': 723, 'max_depth': 50, 'min_samples_split': 2, 'min_samples_leaf': 1, 'max_features': None, 'bootstrap': True, 'criterion': 'squared_error'}. Best is trial 590 with value: 0.4185444504443197.
[I 2024-12-04 15:09:21,353] Trial 946 finished with value: 0.5281100549277269 and parameters: {'n_estimators': 816, 'max_depth': 43, 'min_samples_split': 2, 'min_samples_leaf': 1, 'max_features': None, 'bootstrap': False, 'criterion': 'squared_error'}. Best is trial 590 with value: 0.4185444504443197.
[I 2024-12-04 15:09:21,445] Trial 937 finished with value: 0.43219883753940164 and parameters: {'n_estimators': 868, 'max_depth': 33, 'min_samples_split': 4, 'min_samples_leaf': 1, 'max_features': None, 'bootstrap': True, 'criterion': 'squared_error'}. Best is trial 590 with value: 0.4185444504443197.
