[I 2024-12-04 12:44:33,874] Trial 1535 finished with value: 0.3666949254381436 and parameters: {'n_estimators': 1247, 'learning_rate': 0.07178516218650502, 'max_depth': 7, 'min_samples_split': 2, 'min_samples_leaf': 4, 'subsample': 0.8089105241979415, 'max_features': None}. Best is trial 1454 with value: 0.30763307678022894.
[I 2024-12-04 12:44:34,566] Trial 1543 finished with value: 0.40703266021737383 and parameters: {'n_estimators': 1043, 'learning_rate': 0.06788026136301292, 'max_depth': 7, 'min_samples_split': 8, 'min_samples_leaf': 2, 'subsample': 0.9335369939760974, 'max_features': 'log2'}. Best is trial 1454 with value: 0.30763307678022894.
[I 2024-12-04 12:44:34,820] Trial 1536 finished with value: 0.3742978972535577 and parameters: {'n_estimators': 1405, 'learning_rate': 0.09378513265143111, 'max_depth': 7, 'min_samples_split': 2, 'min_samples_leaf': 2, 'subsample': 0.7344431251188507, 'max_features': 'sqrt'}. Best is trial 1454 with value: 0.30763307678022894.
[I 2024-12-04 12:44:36,127] Trial 1531 finished with value: 0.3775897045038271 and parameters: {'n_estimators': 1457, 'learning_rate': 0.08779308472118112, 'max_depth': 7, 'min_samples_split': 5, 'min_samples_leaf': 1, 'subsample': 0.7048570858445629, 'max_features': None}. Best is trial 1454 with value: 0.30763307678022894.
[I 2024-12-04 12:44:37,921] Trial 1550 finished with value: 0.6784516016482047 and parameters: {'n_estimators': 801, 'learning_rate': 0.04242197414334637, 'max_depth': 10, 'min_samples_split': 20, 'min_samples_leaf': 8, 'subsample': 0.7925135641093951, 'max_features': 'log2'}. Best is trial 1454 with value: 0.30763307678022894.
[I 2024-12-04 12:44:40,312] Trial 1546 finished with value: 0.38704528232601176 and parameters: {'n_estimators': 1137, 'learning_rate': 0.0612198586359192, 'max_depth': 7, 'min_samples_split': 2, 'min_samples_leaf': 2, 'subsample': 0.884683364407092, 'max_features': 'sqrt'}. Best is trial 1454 with value: 0.30763307678022894.
[I 2024-12-04 12:44:40,315] Trial 1549 finished with value: 0.38379727015179604 and parameters: {'n_estimators': 910, 'learning_rate': 0.030574302505997488, 'max_depth': 6, 'min_samples_split': 2, 'min_samples_leaf': 1, 'subsample': 0.661836342032213, 'max_features': None}. Best is trial 1454 with value: 0.30763307678022894.
[I 2024-12-04 12:44:41,895] Trial 1539 finished with value: 0.38117057605981197 and parameters: {'n_estimators': 1318, 'learning_rate': 0.0990503438145576, 'max_depth': 6, 'min_samples_split': 2, 'min_samples_leaf': 3, 'subsample': 0.7346061637267806, 'max_features': None}. Best is trial 1454 with value: 0.30763307678022894.
[I 2024-12-04 12:44:41,989] Trial 1541 finished with value: 0.38840221495478355 and parameters: {'n_estimators': 1241, 'learning_rate': 0.06678087957180966, 'max_depth': 6, 'min_samples_split': 2, 'min_samples_leaf': 3, 'subsample': 0.8902725422536484, 'max_features': None}. Best is trial 1454 with value: 0.30763307678022894.
[I 2024-12-04 12:44:42,523] Trial 1545 finished with value: 0.3834053003596958 and parameters: {'n_estimators': 1096, 'learning_rate': 0.08756722243641472, 'max_depth': 7, 'min_samples_split': 8, 'min_samples_leaf': 6, 'subsample': 0.6927506628800902, 'max_features': None}. Best is trial 1454 with value: 0.30763307678022894.
[I 2024-12-04 12:44:43,687] Trial 1552 finished with value: 0.3262680847413273 and parameters: {'n_estimators': 906, 'learning_rate': 0.09920983296962257, 'max_depth': 5, 'min_samples_split': 5, 'min_samples_leaf': 2, 'subsample': 0.7094555260165103, 'max_features': None}. Best is trial 1454 with value: 0.30763307678022894.
[I 2024-12-04 12:44:45,824] Trial 1568 finished with value: 0.6990228907089459 and parameters: {'n_estimators': 409, 'learning_rate': 0.01727533485097531, 'max_depth': 3, 'min_samples_split': 20, 'min_samples_leaf': 1, 'subsample': 0.8174033574740274, 'max_features': 'sqrt'}. Best is trial 1454 with value: 0.30763307678022894.
[I 2024-12-04 12:44:49,563] Trial 1544 finished with value: 0.36564087228979275 and parameters: {'n_estimators': 1287, 'learning_rate': 0.060851404957309785, 'max_depth': 3, 'min_samples_split': 5, 'min_samples_leaf': 2, 'subsample': 0.7106341181796318, 'max_features': None}. Best is trial 1454 with value: 0.30763307678022894.
[I 2024-12-04 12:44:51,895] Trial 1548 finished with value: 0.4268878608594442 and parameters: {'n_estimators': 1461, 'learning_rate': 0.053823380320265755, 'max_depth': 6, 'min_samples_split': 5, 'min_samples_leaf': 3, 'subsample': 0.7181234080553445, 'max_features': 'sqrt'}. Best is trial 1454 with value: 0.30763307678022894.
[I 2024-12-04 12:44:51,954] Trial 1573 finished with value: 0.4246005315937877 and parameters: {'n_estimators': 428, 'learning_rate': 0.0527942944987526, 'max_depth': 6, 'min_samples_split': 11, 'min_samples_leaf': 1, 'subsample': 0.8076140305411085, 'max_features': 'sqrt'}. Best is trial 1454 with value: 0.30763307678022894.
[I 2024-12-04 12:44:54,464] Trial 1572 finished with value: 0.370024648450633 and parameters: {'n_estimators': 463, 'learning_rate': 0.08975427500695556, 'max_depth': 7, 'min_samples_split': 3, 'min_samples_leaf': 1, 'subsample': 0.6008092174156134, 'max_features': None}. Best is trial 1454 with value: 0.30763307678022894.
[I 2024-12-04 12:44:54,473] Trial 1555 finished with value: 0.3914394253541575 and parameters: {'n_estimators': 1102, 'learning_rate': 0.0895385711059459, 'max_depth': 5, 'min_samples_split': 2, 'min_samples_leaf': 3, 'subsample': 0.9092150033035253, 'max_features': None}. Best is trial 1454 with value: 0.30763307678022894.
[I 2024-12-04 12:44:55,067] Trial 1553 finished with value: 0.3964049696214946 and parameters: {'n_estimators': 1127, 'learning_rate': 0.058784633497868284, 'max_depth': 6, 'min_samples_split': 6, 'min_samples_leaf': 1, 'subsample': 0.9071669037286969, 'max_features': None}. Best is trial 1454 with value: 0.30763307678022894.
[I 2024-12-04 12:44:55,098] Trial 1551 finished with value: 0.5459885807876238 and parameters: {'n_estimators': 1305, 'learning_rate': 0.06249702918261543, 'max_depth': 3, 'min_samples_split': 20, 'min_samples_leaf': 9, 'subsample': 0.9384422824812613, 'max_features': None}. Best is trial 1454 with value: 0.30763307678022894.
[I 2024-12-04 12:44:57,145] Trial 1575 finished with value: 0.6285949951733757 and parameters: {'n_estimators': 521, 'learning_rate': 0.04089475719898102, 'max_depth': 9, 'min_samples_split': 7, 'min_samples_leaf': 10, 'subsample': 0.7264372126682648, 'max_features': 'sqrt'}. Best is trial 1454 with value: 0.30763307678022894.
[I 2024-12-04 12:45:00,055] Trial 1559 finished with value: 0.39093455814063943 and parameters: {'n_estimators': 1045, 'learning_rate': 0.09635369103572702, 'max_depth': 6, 'min_samples_split': 6, 'min_samples_leaf': 1, 'subsample': 0.7328364500304303, 'max_features': None}. Best is trial 1454 with value: 0.30763307678022894.
[I 2024-12-04 12:45:01,362] Trial 1557 finished with value: 0.44412871433414697 and parameters: {'n_estimators': 1419, 'learning_rate': 0.06805130706593697, 'max_depth': 4, 'min_samples_split': 2, 'min_samples_leaf': 5, 'subsample': 0.8220177256774789, 'max_features': 'sqrt'}. Best is trial 1454 with value: 0.30763307678022894.
[I 2024-12-04 12:45:02,834] Trial 1571 finished with value: 0.39347987662973133 and parameters: {'n_estimators': 756, 'learning_rate': 0.0952804853689954, 'max_depth': 5, 'min_samples_split': 4, 'min_samples_leaf': 1, 'subsample': 0.7044475505423268, 'max_features': None}. Best is trial 1454 with value: 0.30763307678022894.
[I 2024-12-04 12:45:02,838] Trial 1558 finished with value: 0.38629382340572604 and parameters: {'n_estimators': 1293, 'learning_rate': 0.09943110741325221, 'max_depth': 4, 'min_samples_split': 2, 'min_samples_leaf': 4, 'subsample': 0.6024332781735748, 'max_features': None}. Best is trial 1454 with value: 0.30763307678022894.
[I 2024-12-04 12:45:06,214] Trial 1565 finished with value: 0.37752131451393917 and parameters: {'n_estimators': 1099, 'learning_rate': 0.0993712783351996, 'max_depth': 6, 'min_samples_split': 6, 'min_samples_leaf': 5, 'subsample': 0.8305718717492419, 'max_features': None}. Best is trial 1454 with value: 0.30763307678022894.
[I 2024-12-04 12:45:06,735] Trial 1564 finished with value: 0.3948712721321547 and parameters: {'n_estimators': 1199, 'learning_rate': 0.05491638749611281, 'max_depth': 5, 'min_samples_split': 7, 'min_samples_leaf': 3, 'subsample': 0.6591436575995732, 'max_features': None}. Best is trial 1454 with value: 0.30763307678022894.
[I 2024-12-04 12:45:07,328] Trial 1563 finished with value: 0.37388412114463476 and parameters: {'n_estimators': 1187, 'learning_rate': 0.06564533439486032, 'max_depth': 7, 'min_samples_split': 8, 'min_samples_leaf': 3, 'subsample': 0.7485180313395293, 'max_features': None}. Best is trial 1454 with value: 0.30763307678022894.
[I 2024-12-04 12:45:09,042] Trial 1562 finished with value: 0.33231258866004254 and parameters: {'n_estimators': 1269, 'learning_rate': 0.07652887445202994, 'max_depth': 5, 'min_samples_split': 4, 'min_samples_leaf': 2, 'subsample': 0.7101269223858733, 'max_features': None}. Best is trial 1454 with value: 0.30763307678022894.
[I 2024-12-04 12:45:09,275] Trial 1569 finished with value: 0.4541566425077206 and parameters: {'n_estimators': 1193, 'learning_rate': 0.08848123449649696, 'max_depth': 7, 'min_samples_split': 6, 'min_samples_leaf': 3, 'subsample': 0.7076535120774708, 'max_features': 'log2'}. Best is trial 1454 with value: 0.30763307678022894.
[I 2024-12-04 12:45:10,600] Trial 1556 finished with value: 0.3926219203347513 and parameters: {'n_estimators': 1438, 'learning_rate': 0.09526478227815727, 'max_depth': 7, 'min_samples_split': 2, 'min_samples_leaf': 1, 'subsample': 0.7852259371017122, 'max_features': None}. Best is trial 1454 with value: 0.30763307678022894.
[I 2024-12-04 12:45:13,680] Trial 1566 finished with value: 0.3775600590257424 and parameters: {'n_estimators': 1440, 'learning_rate': 0.09940210301053147, 'max_depth': 8, 'min_samples_split': 5, 'min_samples_leaf': 2, 'subsample': 0.7853903293317192, 'max_features': 'log2'}. Best is trial 1454 with value: 0.30763307678022894.
[I 2024-12-04 12:45:14,095] Trial 1561 finished with value: 0.3844095563273196 and parameters: {'n_estimators': 1456, 'learning_rate': 0.09766420724856595, 'max_depth': 6, 'min_samples_split': 7, 'min_samples_leaf': 1, 'subsample': 0.7236635663349523, 'max_features': None}. Best is trial 1454 with value: 0.30763307678022894.
[I 2024-12-04 12:45:17,221] Trial 1570 finished with value: 0.3886072666711216 and parameters: {'n_estimators': 1185, 'learning_rate': 0.060893983799044614, 'max_depth': 8, 'min_samples_split': 5, 'min_samples_leaf': 3, 'subsample': 0.7499929969815776, 'max_features': None}. Best is trial 1454 with value: 0.30763307678022894.
[I 2024-12-04 12:45:19,602] Trial 1576 finished with value: 0.38446399549110905 and parameters: {'n_estimators': 1061, 'learning_rate': 0.049830663119802096, 'max_depth': 7, 'min_samples_split': 9, 'min_samples_leaf': 1, 'subsample': 0.762086797801852, 'max_features': None}. Best is trial 1454 with value: 0.30763307678022894.
[I 2024-12-04 12:45:20,093] Trial 1591 finished with value: 0.33900440485380506 and parameters: {'n_estimators': 572, 'learning_rate': 0.06308370387240911, 'max_depth': 6, 'min_samples_split': 3, 'min_samples_leaf': 2, 'subsample': 0.6622756503512408, 'max_features': None}. Best is trial 1454 with value: 0.30763307678022894.
[I 2024-12-04 12:45:21,635] Trial 1567 finished with value: 0.39558101524491807 and parameters: {'n_estimators': 1492, 'learning_rate': 0.0944977416715356, 'max_depth': 6, 'min_samples_split': 6, 'min_samples_leaf': 3, 'subsample': 0.6301399751866777, 'max_features': None}. Best is trial 1454 with value: 0.30763307678022894.
[I 2024-12-04 12:45:22,809] Trial 1577 finished with value: 0.3839129519550606 and parameters: {'n_estimators': 1090, 'learning_rate': 0.09903599559452243, 'max_depth': 8, 'min_samples_split': 6, 'min_samples_leaf': 3, 'subsample': 0.778071286174273, 'max_features': None}. Best is trial 1454 with value: 0.30763307678022894.
[I 2024-12-04 12:45:26,566] Trial 1579 finished with value: 0.322487657269934 and parameters: {'n_estimators': 1198, 'learning_rate': 0.09928046861444585, 'max_depth': 6, 'min_samples_split': 3, 'min_samples_leaf': 2, 'subsample': 0.7103857703804252, 'max_features': None}. Best is trial 1454 with value: 0.30763307678022894.
[I 2024-12-04 12:45:27,095] Trial 1581 finished with value: 0.4373673697754623 and parameters: {'n_estimators': 1293, 'learning_rate': 0.08139859963441205, 'max_depth': 4, 'min_samples_split': 6, 'min_samples_leaf': 3, 'subsample': 0.6378984143214442, 'max_features': 'sqrt'}. Best is trial 1454 with value: 0.30763307678022894.
[I 2024-12-04 12:45:28,608] Trial 1594 finished with value: 0.3746397729425183 and parameters: {'n_estimators': 697, 'learning_rate': 0.09660396984542041, 'max_depth': 8, 'min_samples_split': 3, 'min_samples_leaf': 3, 'subsample': 0.6557622255200513, 'max_features': None}. Best is trial 1454 with value: 0.30763307678022894.
[I 2024-12-04 12:45:29,909] Trial 1574 finished with value: 0.34419042152274804 and parameters: {'n_estimators': 1451, 'learning_rate': 0.06968307695172407, 'max_depth': 6, 'min_samples_split': 8, 'min_samples_leaf': 2, 'subsample': 0.6979732861296434, 'max_features': None}. Best is trial 1454 with value: 0.30763307678022894.
[I 2024-12-04 12:45:31,001] Trial 1587 finished with value: 0.3659810563721905 and parameters: {'n_estimators': 1059, 'learning_rate': 0.08892052943540023, 'max_depth': 6, 'min_samples_split': 2, 'min_samples_leaf': 1, 'subsample': 0.6536074497364187, 'max_features': None}. Best is trial 1454 with value: 0.30763307678022894.
[I 2024-12-04 12:45:31,375] Trial 1593 finished with value: 0.494440103886489 and parameters: {'n_estimators': 960, 'learning_rate': 0.030108734168712126, 'max_depth': 4, 'min_samples_split': 10, 'min_samples_leaf': 6, 'subsample': 0.6350160017001565, 'max_features': 'sqrt'}. Best is trial 1454 with value: 0.30763307678022894.
[I 2024-12-04 12:45:31,459] Trial 1589 finished with value: 0.3693601127389437 and parameters: {'n_estimators': 905, 'learning_rate': 0.09909873397361282, 'max_depth': 6, 'min_samples_split': 2, 'min_samples_leaf': 4, 'subsample': 0.8120879994676379, 'max_features': None}. Best is trial 1454 with value: 0.30763307678022894.
[I 2024-12-04 12:45:33,651] Trial 1586 finished with value: 0.33109614813683896 and parameters: {'n_estimators': 1148, 'learning_rate': 0.08695892979281739, 'max_depth': 6, 'min_samples_split': 2, 'min_samples_leaf': 2, 'subsample': 0.66572131426317, 'max_features': None}. Best is trial 1454 with value: 0.30763307678022894.
[I 2024-12-04 12:45:34,311] Trial 1582 finished with value: 0.32948318593750403 and parameters: {'n_estimators': 1259, 'learning_rate': 0.060802256159370925, 'max_depth': 6, 'min_samples_split': 6, 'min_samples_leaf': 2, 'subsample': 0.6969076016940011, 'max_features': None}. Best is trial 1454 with value: 0.30763307678022894.
[I 2024-12-04 12:45:36,779] Trial 1588 finished with value: 0.3975062864427175 and parameters: {'n_estimators': 1273, 'learning_rate': 0.06915624889439995, 'max_depth': 4, 'min_samples_split': 5, 'min_samples_leaf': 1, 'subsample': 0.858389038314553, 'max_features': 'sqrt'}. Best is trial 1454 with value: 0.30763307678022894.
[I 2024-12-04 12:45:37,108] Trial 1590 finished with value: 0.3483686080075097 and parameters: {'n_estimators': 1028, 'learning_rate': 0.09659796179196325, 'max_depth': 8, 'min_samples_split': 3, 'min_samples_leaf': 2, 'subsample': 0.6689252635871346, 'max_features': None}. Best is trial 1454 with value: 0.30763307678022894.
[I 2024-12-04 12:45:37,799] Trial 1580 finished with value: 0.3836091446615167 and parameters: {'n_estimators': 1414, 'learning_rate': 0.0967096348950241, 'max_depth': 8, 'min_samples_split': 6, 'min_samples_leaf': 3, 'subsample': 0.6279835201645453, 'max_features': None}. Best is trial 1454 with value: 0.30763307678022894.
[I 2024-12-04 12:45:38,399] Trial 1583 finished with value: 0.3403417410174429 and parameters: {'n_estimators': 1450, 'learning_rate': 0.09886653556819558, 'max_depth': 3, 'min_samples_split': 5, 'min_samples_leaf': 2, 'subsample': 0.7410231720574524, 'max_features': None}. Best is trial 1454 with value: 0.30763307678022894.
[I 2024-12-04 12:45:38,696] Trial 1592 finished with value: 0.37336882022599405 and parameters: {'n_estimators': 1000, 'learning_rate': 0.09477659397127758, 'max_depth': 8, 'min_samples_split': 8, 'min_samples_leaf': 1, 'subsample': 0.6855470898216824, 'max_features': None}. Best is trial 1454 with value: 0.30763307678022894.
[I 2024-12-04 12:45:39,824] Trial 1578 finished with value: 0.3950888698688679 and parameters: {'n_estimators': 1494, 'learning_rate': 0.09949032530346474, 'max_depth': 11, 'min_samples_split': 4, 'min_samples_leaf': 4, 'subsample': 0.6780384911004097, 'max_features': None}. Best is trial 1454 with value: 0.30763307678022894.
[I 2024-12-04 12:45:40,909] Trial 1600 finished with value: 0.42385672160942933 and parameters: {'n_estimators': 753, 'learning_rate': 0.06321457171551954, 'max_depth': 6, 'min_samples_split': 5, 'min_samples_leaf': 1, 'subsample': 0.821269687143596, 'max_features': None}. Best is trial 1454 with value: 0.30763307678022894.
[I 2024-12-04 12:45:41,104] Trial 1595 finished with value: 0.31729198031368105 and parameters: {'n_estimators': 999, 'learning_rate': 0.06646916805903302, 'max_depth': 7, 'min_samples_split': 2, 'min_samples_leaf': 2, 'subsample': 0.7660458710211728, 'max_features': None}. Best is trial 1454 with value: 0.30763307678022894.
[I 2024-12-04 12:45:41,547] Trial 1604 finished with value: 0.3271835010092265 and parameters: {'n_estimators': 719, 'learning_rate': 0.0900019156881807, 'max_depth': 7, 'min_samples_split': 3, 'min_samples_leaf': 2, 'subsample': 0.6942167805953702, 'max_features': None}. Best is trial 1454 with value: 0.30763307678022894.
[I 2024-12-04 12:45:41,780] Trial 1585 finished with value: 0.38426744950701236 and parameters: {'n_estimators': 1413, 'learning_rate': 0.09169544830743578, 'max_depth': 6, 'min_samples_split': 3, 'min_samples_leaf': 3, 'subsample': 0.8503966944715576, 'max_features': None}. Best is trial 1454 with value: 0.30763307678022894.
[I 2024-12-04 12:45:44,363] Trial 1584 finished with value: 0.3344752670342377 and parameters: {'n_estimators': 1462, 'learning_rate': 0.08604855662951369, 'max_depth': 8, 'min_samples_split': 2, 'min_samples_leaf': 2, 'subsample': 0.7452192464129326, 'max_features': None}. Best is trial 1454 with value: 0.30763307678022894.
[I 2024-12-04 12:45:45,379] Trial 1599 finished with value: 0.3972802092857778 and parameters: {'n_estimators': 1003, 'learning_rate': 0.09855738845517749, 'max_depth': 4, 'min_samples_split': 7, 'min_samples_leaf': 1, 'subsample': 0.8989758447249505, 'max_features': None}. Best is trial 1454 with value: 0.30763307678022894.
[I 2024-12-04 12:45:47,898] Trial 1602 finished with value: 0.39057679687395175 and parameters: {'n_estimators': 911, 'learning_rate': 0.019501902997486435, 'max_depth': 6, 'min_samples_split': 18, 'min_samples_leaf': 4, 'subsample': 0.9486666396170113, 'max_features': None}. Best is trial 1454 with value: 0.30763307678022894.
[I 2024-12-04 12:45:48,835] Trial 1606 finished with value: 0.3938931066957408 and parameters: {'n_estimators': 779, 'learning_rate': 0.09842902380224165, 'max_depth': 6, 'min_samples_split': 4, 'min_samples_leaf': 3, 'subsample': 0.6045430170452344, 'max_features': None}. Best is trial 1454 with value: 0.30763307678022894.
[I 2024-12-04 12:45:49,913] Trial 1596 finished with value: 0.40099648954264683 and parameters: {'n_estimators': 1375, 'learning_rate': 0.06172103634879224, 'max_depth': 3, 'min_samples_split': 9, 'min_samples_leaf': 3, 'subsample': 0.6332398084063432, 'max_features': None}. Best is trial 1454 with value: 0.30763307678022894.
[I 2024-12-04 12:45:54,320] Trial 1612 finished with value: 0.3993083782438403 and parameters: {'n_estimators': 697, 'learning_rate': 0.09864250016736174, 'max_depth': 7, 'min_samples_split': 2, 'min_samples_leaf': 3, 'subsample': 0.6070519110629262, 'max_features': None}. Best is trial 1454 with value: 0.30763307678022894.
[I 2024-12-04 12:45:54,399] Trial 1597 finished with value: 0.37379423758864216 and parameters: {'n_estimators': 1329, 'learning_rate': 0.098624365907544, 'max_depth': 8, 'min_samples_split': 12, 'min_samples_leaf': 3, 'subsample': 0.721233535140031, 'max_features': None}. Best is trial 1454 with value: 0.30763307678022894.
[I 2024-12-04 12:45:55,756] Trial 1624 finished with value: 0.6474923470773749 and parameters: {'n_estimators': 215, 'learning_rate': 0.046445807655301555, 'max_depth': 10, 'min_samples_split': 13, 'min_samples_leaf': 3, 'subsample': 0.9839164709141136, 'max_features': 'log2'}. Best is trial 1454 with value: 0.30763307678022894.
[I 2024-12-04 12:45:57,238] Trial 1601 finished with value: 0.3839706914883627 and parameters: {'n_estimators': 1253, 'learning_rate': 0.096281768204504, 'max_depth': 7, 'min_samples_split': 6, 'min_samples_leaf': 1, 'subsample': 0.721691830927587, 'max_features': None}. Best is trial 1454 with value: 0.30763307678022894.
[I 2024-12-04 12:45:57,405] Trial 1603 finished with value: 0.3774249721054008 and parameters: {'n_estimators': 1225, 'learning_rate': 0.07115848301863949, 'max_depth': 7, 'min_samples_split': 3, 'min_samples_leaf': 5, 'subsample': 0.7004552067775864, 'max_features': None}. Best is trial 1454 with value: 0.30763307678022894.
[I 2024-12-04 12:46:01,123] Trial 1598 finished with value: 0.36541682964950895 and parameters: {'n_estimators': 1486, 'learning_rate': 0.04658174856980533, 'max_depth': 8, 'min_samples_split': 2, 'min_samples_leaf': 1, 'subsample': 0.6092593385581463, 'max_features': None}. Best is trial 1454 with value: 0.30763307678022894.
