[I 2024-12-04 13:18:25,148] Trial 1675 finished with value: 0.3456861375446642 and parameters: {'n_estimators': 752, 'learning_rate': 0.07457184146423064, 'max_depth': 10, 'min_samples_split': 11, 'min_samples_leaf': 7, 'subsample': 0.7291706651622056, 'max_features': 'sqrt'}. Best is trial 1137 with value: 0.19687116000636118.
[I 2024-12-04 13:18:27,670] Trial 1686 finished with value: 0.4971657266499816 and parameters: {'n_estimators': 374, 'learning_rate': 0.02712572149994365, 'max_depth': 12, 'min_samples_split': 2, 'min_samples_leaf': 4, 'subsample': 0.7935587743037942, 'max_features': 'log2'}. Best is trial 1137 with value: 0.19687116000636118.
[I 2024-12-04 13:18:29,315] Trial 1663 finished with value: 0.23506838576987185 and parameters: {'n_estimators': 1443, 'learning_rate': 0.09930051785208611, 'max_depth': 10, 'min_samples_split': 16, 'min_samples_leaf': 1, 'subsample': 0.6011839778132702, 'max_features': 'sqrt'}. Best is trial 1137 with value: 0.19687116000636118.
[I 2024-12-04 13:18:32,590] Trial 1664 finished with value: 0.22984320594440297 and parameters: {'n_estimators': 1479, 'learning_rate': 0.08414635106151724, 'max_depth': 11, 'min_samples_split': 17, 'min_samples_leaf': 1, 'subsample': 0.6201668468308187, 'max_features': 'sqrt'}. Best is trial 1137 with value: 0.19687116000636118.
[I 2024-12-04 13:18:37,285] Trial 1668 finished with value: 0.20362741109477625 and parameters: {'n_estimators': 1226, 'learning_rate': 0.09174191926047667, 'max_depth': 12, 'min_samples_split': 15, 'min_samples_leaf': 1, 'subsample': 0.7001918300474151, 'max_features': 'sqrt'}. Best is trial 1137 with value: 0.19687116000636118.
[I 2024-12-04 13:18:37,391] Trial 1671 finished with value: 0.21665588188814885 and parameters: {'n_estimators': 1124, 'learning_rate': 0.05892678568184026, 'max_depth': 12, 'min_samples_split': 18, 'min_samples_leaf': 1, 'subsample': 0.6254797385593477, 'max_features': 'sqrt'}. Best is trial 1137 with value: 0.19687116000636118.
[I 2024-12-04 13:18:38,193] Trial 1666 finished with value: 0.21863116898060161 and parameters: {'n_estimators': 1427, 'learning_rate': 0.09885058802116407, 'max_depth': 12, 'min_samples_split': 17, 'min_samples_leaf': 1, 'subsample': 0.6057158606158404, 'max_features': 'sqrt'}. Best is trial 1137 with value: 0.19687116000636118.
[I 2024-12-04 13:18:44,287] Trial 1691 finished with value: 0.2960752672546334 and parameters: {'n_estimators': 405, 'learning_rate': 0.08274231768467881, 'max_depth': 5, 'min_samples_split': 5, 'min_samples_leaf': 1, 'subsample': 0.6116172382723981, 'max_features': 'sqrt'}. Best is trial 1137 with value: 0.19687116000636118.
[I 2024-12-04 13:18:45,872] Trial 1667 finished with value: 0.27991153644898076 and parameters: {'n_estimators': 1422, 'learning_rate': 0.05564561755255627, 'max_depth': 6, 'min_samples_split': 16, 'min_samples_leaf': 1, 'subsample': 0.8795864127949463, 'max_features': 'log2'}. Best is trial 1137 with value: 0.19687116000636118.
[I 2024-12-04 13:18:49,063] Trial 1699 finished with value: 0.4612345324974076 and parameters: {'n_estimators': 186, 'learning_rate': 0.052808960539241265, 'max_depth': 10, 'min_samples_split': 5, 'min_samples_leaf': 3, 'subsample': 0.85423464751475, 'max_features': 'log2'}. Best is trial 1137 with value: 0.19687116000636118.
[I 2024-12-04 13:18:49,132] Trial 1669 finished with value: 0.22002738397979257 and parameters: {'n_estimators': 1379, 'learning_rate': 0.09931814894876477, 'max_depth': 12, 'min_samples_split': 17, 'min_samples_leaf': 1, 'subsample': 0.6100427186130362, 'max_features': 'sqrt'}. Best is trial 1137 with value: 0.19687116000636118.
[I 2024-12-04 13:18:49,160] Trial 1682 finished with value: 0.2576278768219129 and parameters: {'n_estimators': 834, 'learning_rate': 0.09958019776041409, 'max_depth': 8, 'min_samples_split': 14, 'min_samples_leaf': 3, 'subsample': 0.6712844544568994, 'max_features': 'sqrt'}. Best is trial 1137 with value: 0.19687116000636118.
[I 2024-12-04 13:18:52,129] Trial 1670 finished with value: 0.23052577408096792 and parameters: {'n_estimators': 1379, 'learning_rate': 0.070394787404133, 'max_depth': 12, 'min_samples_split': 19, 'min_samples_leaf': 1, 'subsample': 0.7123476214119419, 'max_features': 'sqrt'}. Best is trial 1137 with value: 0.19687116000636118.
[I 2024-12-04 13:18:52,448] Trial 1674 finished with value: 0.2489165684768794 and parameters: {'n_estimators': 1183, 'learning_rate': 0.06469329810835217, 'max_depth': 12, 'min_samples_split': 16, 'min_samples_leaf': 3, 'subsample': 0.6240635245424455, 'max_features': 'sqrt'}. Best is trial 1137 with value: 0.19687116000636118.
[I 2024-12-04 13:19:01,810] Trial 1676 finished with value: 0.2139997477232768 and parameters: {'n_estimators': 1289, 'learning_rate': 0.06177765891836072, 'max_depth': 12, 'min_samples_split': 18, 'min_samples_leaf': 1, 'subsample': 0.689825360711746, 'max_features': 'sqrt'}. Best is trial 1137 with value: 0.19687116000636118.
[I 2024-12-04 13:19:04,778] Trial 1672 finished with value: 0.22355585986839538 and parameters: {'n_estimators': 1460, 'learning_rate': 0.07698854660812984, 'max_depth': 11, 'min_samples_split': 17, 'min_samples_leaf': 1, 'subsample': 0.6005538820526944, 'max_features': 'sqrt'}. Best is trial 1137 with value: 0.19687116000636118.
[I 2024-12-04 13:19:08,217] Trial 1673 finished with value: 0.34023509991903356 and parameters: {'n_estimators': 1466, 'learning_rate': 0.03806541498959221, 'max_depth': 4, 'min_samples_split': 11, 'min_samples_leaf': 6, 'subsample': 0.9022925538076058, 'max_features': 'sqrt'}. Best is trial 1137 with value: 0.19687116000636118.
[I 2024-12-04 13:19:13,634] Trial 1678 finished with value: 0.23357154989168538 and parameters: {'n_estimators': 1250, 'learning_rate': 0.05949024260018874, 'max_depth': 12, 'min_samples_split': 15, 'min_samples_leaf': 2, 'subsample': 0.6565907067752587, 'max_features': 'sqrt'}. Best is trial 1137 with value: 0.19687116000636118.
[I 2024-12-04 13:19:15,915] Trial 1680 finished with value: 0.2164623602661824 and parameters: {'n_estimators': 1216, 'learning_rate': 0.07886122627076489, 'max_depth': 12, 'min_samples_split': 17, 'min_samples_leaf': 1, 'subsample': 0.6027349226084525, 'max_features': 'sqrt'}. Best is trial 1137 with value: 0.19687116000636118.
[I 2024-12-04 13:19:17,678] Trial 1684 finished with value: 0.20425718508479476 and parameters: {'n_estimators': 1197, 'learning_rate': 0.06808854018424795, 'max_depth': 12, 'min_samples_split': 18, 'min_samples_leaf': 1, 'subsample': 0.6674645048344551, 'max_features': 'sqrt'}. Best is trial 1137 with value: 0.19687116000636118.
[I 2024-12-04 13:19:19,272] Trial 1679 finished with value: 0.24577258567799776 and parameters: {'n_estimators': 1477, 'learning_rate': 0.0640888953693151, 'max_depth': 10, 'min_samples_split': 19, 'min_samples_leaf': 3, 'subsample': 0.6065641275813825, 'max_features': 'sqrt'}. Best is trial 1137 with value: 0.19687116000636118.
[I 2024-12-04 13:19:19,310] Trial 1677 finished with value: 0.252393032399769 and parameters: {'n_estimators': 1483, 'learning_rate': 0.08457969303062313, 'max_depth': 12, 'min_samples_split': 16, 'min_samples_leaf': 3, 'subsample': 0.6000293987772509, 'max_features': 'sqrt'}. Best is trial 1137 with value: 0.19687116000636118.
[I 2024-12-04 13:19:21,059] Trial 1694 finished with value: 0.23716553327445858 and parameters: {'n_estimators': 951, 'learning_rate': 0.09978905370889478, 'max_depth': 10, 'min_samples_split': 19, 'min_samples_leaf': 1, 'subsample': 0.7312795507681581, 'max_features': 'sqrt'}. Best is trial 1137 with value: 0.19687116000636118.
[I 2024-12-04 13:19:22,909] Trial 1687 finished with value: 0.22779883079618746 and parameters: {'n_estimators': 1066, 'learning_rate': 0.06585188211069619, 'max_depth': 10, 'min_samples_split': 16, 'min_samples_leaf': 1, 'subsample': 0.6824734953025359, 'max_features': 'sqrt'}. Best is trial 1137 with value: 0.19687116000636118.
[I 2024-12-04 13:19:27,299] Trial 1692 finished with value: 0.21814685702334535 and parameters: {'n_estimators': 1101, 'learning_rate': 0.08595135236554169, 'max_depth': 12, 'min_samples_split': 17, 'min_samples_leaf': 1, 'subsample': 0.6003612887037167, 'max_features': 'sqrt'}. Best is trial 1137 with value: 0.19687116000636118.
[I 2024-12-04 13:19:27,300] Trial 1683 finished with value: 0.2197765668051461 and parameters: {'n_estimators': 1456, 'learning_rate': 0.09355018811849883, 'max_depth': 12, 'min_samples_split': 18, 'min_samples_leaf': 1, 'subsample': 0.69873379452267, 'max_features': 'sqrt'}. Best is trial 1137 with value: 0.19687116000636118.
[I 2024-12-04 13:19:27,337] Trial 1681 finished with value: 0.25040810842375344 and parameters: {'n_estimators': 1369, 'learning_rate': 0.05846614027253526, 'max_depth': 12, 'min_samples_split': 20, 'min_samples_leaf': 3, 'subsample': 0.6424415918805008, 'max_features': 'sqrt'}. Best is trial 1137 with value: 0.19687116000636118.
[I 2024-12-04 13:19:31,861] Trial 1701 finished with value: 0.3591120775669091 and parameters: {'n_estimators': 741, 'learning_rate': 0.03131400400150588, 'max_depth': 8, 'min_samples_split': 8, 'min_samples_leaf': 2, 'subsample': 0.6079465433252506, 'max_features': 'log2'}. Best is trial 1137 with value: 0.19687116000636118.
[I 2024-12-04 13:19:34,013] Trial 1688 finished with value: 0.21050663906003042 and parameters: {'n_estimators': 1328, 'learning_rate': 0.05448226196186059, 'max_depth': 12, 'min_samples_split': 18, 'min_samples_leaf': 1, 'subsample': 0.6021578376547599, 'max_features': 'sqrt'}. Best is trial 1137 with value: 0.19687116000636118.
[I 2024-12-04 13:19:35,787] Trial 1685 finished with value: 0.2180773286556019 and parameters: {'n_estimators': 1454, 'learning_rate': 0.059210162857042545, 'max_depth': 12, 'min_samples_split': 19, 'min_samples_leaf': 1, 'subsample': 0.6590558270395408, 'max_features': 'sqrt'}. Best is trial 1137 with value: 0.19687116000636118.
[I 2024-12-04 13:19:38,932] Trial 1689 finished with value: 0.5183083516928355 and parameters: {'n_estimators': 1389, 'learning_rate': 0.010397917212231407, 'max_depth': 4, 'min_samples_split': 14, 'min_samples_leaf': 3, 'subsample': 0.9418976671742794, 'max_features': 'log2'}. Best is trial 1137 with value: 0.19687116000636118.
[I 2024-12-04 13:19:41,852] Trial 1695 finished with value: 0.2510160900308422 and parameters: {'n_estimators': 1271, 'learning_rate': 0.08130626989602595, 'max_depth': 12, 'min_samples_split': 20, 'min_samples_leaf': 3, 'subsample': 0.6137988646394275, 'max_features': 'sqrt'}. Best is trial 1137 with value: 0.19687116000636118.
[I 2024-12-04 13:19:42,224] Trial 1709 finished with value: 0.3677704294006645 and parameters: {'n_estimators': 595, 'learning_rate': 0.030794924739272464, 'max_depth': 11, 'min_samples_split': 18, 'min_samples_leaf': 6, 'subsample': 0.6654677233889685, 'max_features': 'sqrt'}. Best is trial 1137 with value: 0.19687116000636118.
[I 2024-12-04 13:19:45,822] Trial 1690 finished with value: 0.21411604631517875 and parameters: {'n_estimators': 1491, 'learning_rate': 0.09656208565291786, 'max_depth': 10, 'min_samples_split': 17, 'min_samples_leaf': 1, 'subsample': 0.6185106478996475, 'max_features': 'sqrt'}. Best is trial 1137 with value: 0.19687116000636118.
[I 2024-12-04 13:19:46,130] Trial 1714 finished with value: 0.4353515329683558 and parameters: {'n_estimators': 361, 'learning_rate': 0.025908560708445875, 'max_depth': 3, 'min_samples_split': 16, 'min_samples_leaf': 10, 'subsample': 0.6907807515765017, 'max_features': None}. Best is trial 1137 with value: 0.19687116000636118.
[I 2024-12-04 13:19:49,844] Trial 1693 finished with value: 0.3036704324713116 and parameters: {'n_estimators': 1288, 'learning_rate': 0.020008758233209367, 'max_depth': 9, 'min_samples_split': 9, 'min_samples_leaf': 5, 'subsample': 0.6903634090216362, 'max_features': None}. Best is trial 1137 with value: 0.19687116000636118.
[I 2024-12-04 13:19:52,206] Trial 1698 finished with value: 0.22725262594379755 and parameters: {'n_estimators': 1197, 'learning_rate': 0.0937238261040639, 'max_depth': 12, 'min_samples_split': 20, 'min_samples_leaf': 1, 'subsample': 0.7417401354886312, 'max_features': 'sqrt'}. Best is trial 1137 with value: 0.19687116000636118.
[I 2024-12-04 13:19:52,306] Trial 1696 finished with value: 0.22570391441658022 and parameters: {'n_estimators': 1285, 'learning_rate': 0.058730747574401554, 'max_depth': 12, 'min_samples_split': 20, 'min_samples_leaf': 1, 'subsample': 0.7739436198109806, 'max_features': 'sqrt'}. Best is trial 1137 with value: 0.19687116000636118.
[I 2024-12-04 13:19:52,356] Trial 1700 finished with value: 0.2504910582732919 and parameters: {'n_estimators': 1074, 'learning_rate': 0.05349268451833682, 'max_depth': 11, 'min_samples_split': 15, 'min_samples_leaf': 3, 'subsample': 0.6883900637418076, 'max_features': 'sqrt'}. Best is trial 1137 with value: 0.19687116000636118.
[I 2024-12-04 13:20:03,748] Trial 1702 finished with value: 0.24991768336598016 and parameters: {'n_estimators': 1253, 'learning_rate': 0.0991894141046859, 'max_depth': 11, 'min_samples_split': 16, 'min_samples_leaf': 3, 'subsample': 0.6613297718677607, 'max_features': 'sqrt'}. Best is trial 1137 with value: 0.19687116000636118.
[I 2024-12-04 13:20:04,900] Trial 1697 finished with value: 0.2065023159430073 and parameters: {'n_estimators': 1472, 'learning_rate': 0.059563380525651556, 'max_depth': 12, 'min_samples_split': 16, 'min_samples_leaf': 1, 'subsample': 0.6103376507261337, 'max_features': 'sqrt'}. Best is trial 1137 with value: 0.19687116000636118.
[I 2024-12-04 13:20:08,801] Trial 1708 finished with value: 0.24605696319395148 and parameters: {'n_estimators': 1099, 'learning_rate': 0.07532078496773108, 'max_depth': 11, 'min_samples_split': 15, 'min_samples_leaf': 3, 'subsample': 0.7420837046674057, 'max_features': 'sqrt'}. Best is trial 1137 with value: 0.19687116000636118.
[I 2024-12-04 13:20:11,413] Trial 1703 finished with value: 0.23811758808008143 and parameters: {'n_estimators': 1325, 'learning_rate': 0.060986039241542736, 'max_depth': 12, 'min_samples_split': 14, 'min_samples_leaf': 3, 'subsample': 0.7108208037956553, 'max_features': 'sqrt'}. Best is trial 1137 with value: 0.19687116000636118.
[I 2024-12-04 13:20:13,291] Trial 1734 finished with value: 0.44606827379998815 and parameters: {'n_estimators': 143, 'learning_rate': 0.017333997192726543, 'max_depth': 8, 'min_samples_split': 3, 'min_samples_leaf': 10, 'subsample': 0.6579139863151362, 'max_features': None}. Best is trial 1137 with value: 0.19687116000636118.
[I 2024-12-04 13:20:14,145] Trial 1706 finished with value: 0.23688460581894524 and parameters: {'n_estimators': 1203, 'learning_rate': 0.06147485204222791, 'max_depth': 12, 'min_samples_split': 14, 'min_samples_leaf': 1, 'subsample': 0.7502581041902622, 'max_features': 'sqrt'}. Best is trial 1137 with value: 0.19687116000636118.
[I 2024-12-04 13:20:15,617] Trial 1721 finished with value: 0.35368553784156476 and parameters: {'n_estimators': 580, 'learning_rate': 0.04685356278665401, 'max_depth': 7, 'min_samples_split': 8, 'min_samples_leaf': 1, 'subsample': 0.9551425867928042, 'max_features': 'log2'}. Best is trial 1137 with value: 0.19687116000636118.
[I 2024-12-04 13:20:19,196] Trial 1705 finished with value: 0.24890777588986854 and parameters: {'n_estimators': 1223, 'learning_rate': 0.057032879837956046, 'max_depth': 10, 'min_samples_split': 17, 'min_samples_leaf': 2, 'subsample': 0.7870413023580125, 'max_features': 'sqrt'}. Best is trial 1137 with value: 0.19687116000636118.
[I 2024-12-04 13:20:20,980] Trial 1704 finished with value: 0.2128885656512803 and parameters: {'n_estimators': 1419, 'learning_rate': 0.09308259880814322, 'max_depth': 12, 'min_samples_split': 17, 'min_samples_leaf': 1, 'subsample': 0.7099461330572242, 'max_features': 'sqrt'}. Best is trial 1137 with value: 0.19687116000636118.
[I 2024-12-04 13:20:23,385] Trial 1735 finished with value: 0.6902810484809648 and parameters: {'n_estimators': 211, 'learning_rate': 0.05194770450897237, 'max_depth': 3, 'min_samples_split': 17, 'min_samples_leaf': 6, 'subsample': 0.7928370968772324, 'max_features': 'log2'}. Best is trial 1137 with value: 0.19687116000636118.
[I 2024-12-04 13:20:25,194] Trial 1715 finished with value: 0.22126087807872213 and parameters: {'n_estimators': 988, 'learning_rate': 0.07445347923552832, 'max_depth': 12, 'min_samples_split': 17, 'min_samples_leaf': 1, 'subsample': 0.6809447712092073, 'max_features': 'sqrt'}. Best is trial 1137 with value: 0.19687116000636118.
[I 2024-12-04 13:20:25,824] Trial 1712 finished with value: 0.22493724239881244 and parameters: {'n_estimators': 1174, 'learning_rate': 0.06020126558777316, 'max_depth': 12, 'min_samples_split': 13, 'min_samples_leaf': 1, 'subsample': 0.6872827326133446, 'max_features': 'sqrt'}. Best is trial 1137 with value: 0.19687116000636118.
[I 2024-12-04 13:20:32,115] Trial 1707 finished with value: 0.43168946573574907 and parameters: {'n_estimators': 1482, 'learning_rate': 0.010432305283375012, 'max_depth': 3, 'min_samples_split': 14, 'min_samples_leaf': 5, 'subsample': 0.8585509128282198, 'max_features': 'sqrt'}. Best is trial 1137 with value: 0.19687116000636118.
[I 2024-12-04 13:20:37,979] Trial 1710 finished with value: 0.23457148273571216 and parameters: {'n_estimators': 1475, 'learning_rate': 0.08354560264234918, 'max_depth': 12, 'min_samples_split': 16, 'min_samples_leaf': 2, 'subsample': 0.7357513853885296, 'max_features': 'sqrt'}. Best is trial 1137 with value: 0.19687116000636118.
[I 2024-12-04 13:20:40,242] Trial 1711 finished with value: 0.25764905021571627 and parameters: {'n_estimators': 1468, 'learning_rate': 0.05952145927034489, 'max_depth': 10, 'min_samples_split': 19, 'min_samples_leaf': 3, 'subsample': 0.7269765716734686, 'max_features': 'sqrt'}. Best is trial 1137 with value: 0.19687116000636118.
[I 2024-12-04 13:20:40,269] Trial 1727 finished with value: 0.46392602381769543 and parameters: {'n_estimators': 751, 'learning_rate': 0.05010205550376098, 'max_depth': 11, 'min_samples_split': 5, 'min_samples_leaf': 6, 'subsample': 0.6304844528595845, 'max_features': 'log2'}. Best is trial 1137 with value: 0.19687116000636118.
[I 2024-12-04 13:20:40,383] Trial 1741 finished with value: 0.5958397262208511 and parameters: {'n_estimators': 274, 'learning_rate': 0.023115046190889093, 'max_depth': 5, 'min_samples_split': 8, 'min_samples_leaf': 1, 'subsample': 0.7853976251003761, 'max_features': 'log2'}. Best is trial 1137 with value: 0.19687116000636118.
[I 2024-12-04 13:20:40,903] Trial 1716 finished with value: 0.24541991514126824 and parameters: {'n_estimators': 1172, 'learning_rate': 0.06754617696774386, 'max_depth': 11, 'min_samples_split': 18, 'min_samples_leaf': 3, 'subsample': 0.6956545321177852, 'max_features': 'sqrt'}. Best is trial 1137 with value: 0.19687116000636118.
[I 2024-12-04 13:20:46,060] Trial 1744 finished with value: 0.9148100914936573 and parameters: {'n_estimators': 194, 'learning_rate': 0.011316850338701851, 'max_depth': 5, 'min_samples_split': 20, 'min_samples_leaf': 7, 'subsample': 0.6104981769614689, 'max_features': 'log2'}. Best is trial 1137 with value: 0.19687116000636118.
[I 2024-12-04 13:20:46,170] Trial 1717 finished with value: 0.22006406100494041 and parameters: {'n_estimators': 1192, 'learning_rate': 0.09158950211981515, 'max_depth': 12, 'min_samples_split': 13, 'min_samples_leaf': 1, 'subsample': 0.6007230960051874, 'max_features': 'sqrt'}. Best is trial 1137 with value: 0.19687116000636118.
[I 2024-12-04 13:20:46,906] Trial 1718 finished with value: 0.2119137761272915 and parameters: {'n_estimators': 1199, 'learning_rate': 0.07633145895553352, 'max_depth': 12, 'min_samples_split': 15, 'min_samples_leaf': 1, 'subsample': 0.6347927866071594, 'max_features': 'sqrt'}. Best is trial 1137 with value: 0.19687116000636118.
[I 2024-12-04 13:20:50,206] Trial 1720 finished with value: 0.23100777517152615 and parameters: {'n_estimators': 1085, 'learning_rate': 0.09697971839289592, 'max_depth': 12, 'min_samples_split': 16, 'min_samples_leaf': 2, 'subsample': 0.6739663319833147, 'max_features': 'sqrt'}. Best is trial 1137 with value: 0.19687116000636118.
[I 2024-12-04 13:20:50,211] Trial 1722 finished with value: 0.24909633315555832 and parameters: {'n_estimators': 1123, 'learning_rate': 0.05885102569108493, 'max_depth': 12, 'min_samples_split': 20, 'min_samples_leaf': 2, 'subsample': 0.6020392912121755, 'max_features': 'sqrt'}. Best is trial 1137 with value: 0.19687116000636118.
[I 2024-12-04 13:20:52,907] Trial 1713 finished with value: 0.21167048157375568 and parameters: {'n_estimators': 1477, 'learning_rate': 0.09950872639875616, 'max_depth': 12, 'min_samples_split': 19, 'min_samples_leaf': 1, 'subsample': 0.6729060530492063, 'max_features': 'sqrt'}. Best is trial 1137 with value: 0.19687116000636118.
[I 2024-12-04 13:20:52,940] Trial 1725 finished with value: 0.2214552470944334 and parameters: {'n_estimators': 1060, 'learning_rate': 0.09782377731665169, 'max_depth': 12, 'min_samples_split': 14, 'min_samples_leaf': 1, 'subsample': 0.6708787616726475, 'max_features': 'sqrt'}. Best is trial 1137 with value: 0.19687116000636118.
[I 2024-12-04 13:20:58,508] Trial 1724 finished with value: 0.26601348830212573 and parameters: {'n_estimators': 1144, 'learning_rate': 0.060968878983776655, 'max_depth': 12, 'min_samples_split': 19, 'min_samples_leaf': 2, 'subsample': 0.684107600340236, 'max_features': 'log2'}. Best is trial 1137 with value: 0.19687116000636118.
[I 2024-12-04 13:20:58,526] Trial 1719 finished with value: 0.21916943464821545 and parameters: {'n_estimators': 1322, 'learning_rate': 0.07104902500027649, 'max_depth': 12, 'min_samples_split': 14, 'min_samples_leaf': 1, 'subsample': 0.6868547424917626, 'max_features': 'sqrt'}. Best is trial 1137 with value: 0.19687116000636118.
