[I 2024-12-04 12:03:50,919] Trial 586 finished with value: 0.5579743473077294 and parameters: {'n_estimators': 102, 'max_depth': 17, 'min_samples_split': 3, 'min_samples_leaf': 2, 'max_features': None, 'bootstrap': True, 'criterion': 'absolute_error'}. Best is trial 306 with value: 0.5054021215392881.
[I 2024-12-04 12:03:51,675] Trial 591 finished with value: 0.55401566298637 and parameters: {'n_estimators': 101, 'max_depth': 15, 'min_samples_split': 5, 'min_samples_leaf': 2, 'max_features': None, 'bootstrap': True, 'criterion': 'absolute_error'}. Best is trial 306 with value: 0.5054021215392881.
[I 2024-12-04 12:03:51,758] Trial 588 finished with value: 0.5168310800719098 and parameters: {'n_estimators': 125, 'max_depth': 16, 'min_samples_split': 3, 'min_samples_leaf': 1, 'max_features': None, 'bootstrap': True, 'criterion': 'absolute_error'}. Best is trial 306 with value: 0.5054021215392881.
[I 2024-12-04 12:03:51,933] Trial 584 finished with value: 0.5136538642444273 and parameters: {'n_estimators': 141, 'max_depth': 21, 'min_samples_split': 5, 'min_samples_leaf': 1, 'max_features': None, 'bootstrap': True, 'criterion': 'absolute_error'}. Best is trial 306 with value: 0.5054021215392881.
[I 2024-12-04 12:03:52,060] Trial 577 finished with value: 0.5563232549758536 and parameters: {'n_estimators': 290, 'max_depth': 23, 'min_samples_split': 7, 'min_samples_leaf': 2, 'max_features': None, 'bootstrap': True, 'criterion': 'absolute_error'}. Best is trial 306 with value: 0.5054021215392881.
[I 2024-12-04 12:03:53,171] Trial 592 finished with value: 1.19715534825651 and parameters: {'n_estimators': 221, 'max_depth': 7, 'min_samples_split': 20, 'min_samples_leaf': 3, 'max_features': 'sqrt', 'bootstrap': True, 'criterion': 'absolute_error'}. Best is trial 306 with value: 0.5054021215392881.
[I 2024-12-04 12:03:53,568] Trial 589 finished with value: 0.5102952589545787 and parameters: {'n_estimators': 107, 'max_depth': 20, 'min_samples_split': 4, 'min_samples_leaf': 1, 'max_features': None, 'bootstrap': True, 'criterion': 'absolute_error'}. Best is trial 306 with value: 0.5054021215392881.
[I 2024-12-04 12:03:53,572] Trial 570 finished with value: 0.5202895751505091 and parameters: {'n_estimators': 258, 'max_depth': 21, 'min_samples_split': 3, 'min_samples_leaf': 1, 'max_features': None, 'bootstrap': True, 'criterion': 'absolute_error'}. Best is trial 306 with value: 0.5054021215392881.
[I 2024-12-04 12:03:53,666] Trial 571 finished with value: 0.5143658150982394 and parameters: {'n_estimators': 287, 'max_depth': 17, 'min_samples_split': 4, 'min_samples_leaf': 1, 'max_features': None, 'bootstrap': True, 'criterion': 'absolute_error'}. Best is trial 306 with value: 0.5054021215392881.
[I 2024-12-04 12:03:54,103] Trial 583 finished with value: 1.2885450942884935 and parameters: {'n_estimators': 704, 'max_depth': 21, 'min_samples_split': 45, 'min_samples_leaf': 2, 'max_features': 'log2', 'bootstrap': True, 'criterion': 'absolute_error'}. Best is trial 306 with value: 0.5054021215392881.
[I 2024-12-04 12:03:54,394] Trial 581 finished with value: 0.5216080462450388 and parameters: {'n_estimators': 158, 'max_depth': 15, 'min_samples_split': 7, 'min_samples_leaf': 1, 'max_features': None, 'bootstrap': True, 'criterion': 'absolute_error'}. Best is trial 306 with value: 0.5054021215392881.
[I 2024-12-04 12:03:55,624] Trial 585 finished with value: 1.2278968424355414 and parameters: {'n_estimators': 837, 'max_depth': 9, 'min_samples_split': 5, 'min_samples_leaf': 5, 'max_features': 'log2', 'bootstrap': True, 'criterion': 'squared_error'}. Best is trial 306 with value: 0.5054021215392881.
[I 2024-12-04 12:03:56,358] Trial 593 finished with value: 0.5076098788974869 and parameters: {'n_estimators': 106, 'max_depth': 14, 'min_samples_split': 5, 'min_samples_leaf': 1, 'max_features': None, 'bootstrap': True, 'criterion': 'absolute_error'}. Best is trial 306 with value: 0.5054021215392881.
[I 2024-12-04 12:03:56,418] Trial 582 finished with value: 0.5244961736614842 and parameters: {'n_estimators': 118, 'max_depth': 35, 'min_samples_split': 3, 'min_samples_leaf': 1, 'max_features': None, 'bootstrap': True, 'criterion': 'absolute_error'}. Best is trial 306 with value: 0.5054021215392881.
[I 2024-12-04 12:03:57,582] Trial 580 finished with value: 0.5144646912023834 and parameters: {'n_estimators': 212, 'max_depth': 18, 'min_samples_split': 5, 'min_samples_leaf': 1, 'max_features': None, 'bootstrap': True, 'criterion': 'absolute_error'}. Best is trial 306 with value: 0.5054021215392881.
[I 2024-12-04 12:03:57,836] Trial 597 finished with value: 1.041321881054894 and parameters: {'n_estimators': 835, 'max_depth': 5, 'min_samples_split': 9, 'min_samples_leaf': 2, 'max_features': 'sqrt', 'bootstrap': False, 'criterion': 'squared_error'}. Best is trial 306 with value: 0.5054021215392881.
[I 2024-12-04 12:03:58,866] Trial 595 finished with value: 0.5563232468498152 and parameters: {'n_estimators': 134, 'max_depth': 24, 'min_samples_split': 6, 'min_samples_leaf': 2, 'max_features': None, 'bootstrap': True, 'criterion': 'absolute_error'}. Best is trial 306 with value: 0.5054021215392881.
[I 2024-12-04 12:03:58,867] Trial 600 finished with value: 1.3323218866984476 and parameters: {'n_estimators': 234, 'max_depth': 15, 'min_samples_split': 5, 'min_samples_leaf': 13, 'max_features': 'sqrt', 'bootstrap': False, 'criterion': 'absolute_error'}. Best is trial 306 with value: 0.5054021215392881.
[I 2024-12-04 12:03:59,348] Trial 594 finished with value: 0.5104591408418374 and parameters: {'n_estimators': 112, 'max_depth': 16, 'min_samples_split': 5, 'min_samples_leaf': 1, 'max_features': None, 'bootstrap': True, 'criterion': 'absolute_error'}. Best is trial 306 with value: 0.5054021215392881.
[I 2024-12-04 12:03:59,497] Trial 587 finished with value: 0.5139586144788937 and parameters: {'n_estimators': 112, 'max_depth': 14, 'min_samples_split': 4, 'min_samples_leaf': 1, 'max_features': None, 'bootstrap': True, 'criterion': 'absolute_error'}. Best is trial 306 with value: 0.5054021215392881.
[I 2024-12-04 12:03:59,535] Trial 599 finished with value: 1.3252247066882428 and parameters: {'n_estimators': 736, 'max_depth': 17, 'min_samples_split': 2, 'min_samples_leaf': 9, 'max_features': 'sqrt', 'bootstrap': True, 'criterion': 'absolute_error'}. Best is trial 306 with value: 0.5054021215392881.
[I 2024-12-04 12:04:01,839] Trial 601 finished with value: 0.5617681595318488 and parameters: {'n_estimators': 117, 'max_depth': 32, 'min_samples_split': 4, 'min_samples_leaf': 2, 'max_features': None, 'bootstrap': True, 'criterion': 'absolute_error'}. Best is trial 306 with value: 0.5054021215392881.
[I 2024-12-04 12:04:02,279] Trial 602 finished with value: 1.1360699278182078 and parameters: {'n_estimators': 786, 'max_depth': 44, 'min_samples_split': 19, 'min_samples_leaf': 4, 'max_features': 'sqrt', 'bootstrap': False, 'criterion': 'absolute_error'}. Best is trial 306 with value: 0.5054021215392881.
[I 2024-12-04 12:04:02,935] Trial 590 finished with value: 0.538860518645554 and parameters: {'n_estimators': 176, 'max_depth': 14, 'min_samples_split': 6, 'min_samples_leaf': 1, 'max_features': None, 'bootstrap': False, 'criterion': 'absolute_error'}. Best is trial 306 with value: 0.5054021215392881.
[I 2024-12-04 12:04:03,778] Trial 604 finished with value: 1.314220043840439 and parameters: {'n_estimators': 427, 'max_depth': 46, 'min_samples_split': 5, 'min_samples_leaf': 10, 'max_features': 'sqrt', 'bootstrap': False, 'criterion': 'absolute_error'}. Best is trial 306 with value: 0.5054021215392881.
[I 2024-12-04 12:04:06,321] Trial 598 finished with value: 0.5423117251471614 and parameters: {'n_estimators': 251, 'max_depth': 10, 'min_samples_split': 15, 'min_samples_leaf': 1, 'max_features': None, 'bootstrap': True, 'criterion': 'absolute_error'}. Best is trial 306 with value: 0.5054021215392881.
[I 2024-12-04 12:04:06,743] Trial 613 finished with value: 0.5273616537006571 and parameters: {'n_estimators': 102, 'max_depth': 12, 'min_samples_split': 2, 'min_samples_leaf': 1, 'max_features': None, 'bootstrap': True, 'criterion': 'squared_error'}. Best is trial 306 with value: 0.5054021215392881.
[I 2024-12-04 12:04:08,688] Trial 614 finished with value: 0.510902153937382 and parameters: {'n_estimators': 111, 'max_depth': 13, 'min_samples_split': 4, 'min_samples_leaf': 1, 'max_features': None, 'bootstrap': True, 'criterion': 'absolute_error'}. Best is trial 306 with value: 0.5054021215392881.
[I 2024-12-04 12:04:11,503] Trial 609 finished with value: 0.5076307817949018 and parameters: {'n_estimators': 108, 'max_depth': 17, 'min_samples_split': 5, 'min_samples_leaf': 1, 'max_features': None, 'bootstrap': True, 'criterion': 'absolute_error'}. Best is trial 306 with value: 0.5054021215392881.
[I 2024-12-04 12:04:11,749] Trial 596 finished with value: 0.5591559149895211 and parameters: {'n_estimators': 199, 'max_depth': 37, 'min_samples_split': 6, 'min_samples_leaf': 2, 'max_features': None, 'bootstrap': True, 'criterion': 'absolute_error'}. Best is trial 306 with value: 0.5054021215392881.
[I 2024-12-04 12:04:13,223] Trial 607 finished with value: 0.5131062056352075 and parameters: {'n_estimators': 124, 'max_depth': 15, 'min_samples_split': 4, 'min_samples_leaf': 1, 'max_features': None, 'bootstrap': True, 'criterion': 'absolute_error'}. Best is trial 306 with value: 0.5054021215392881.
[I 2024-12-04 12:04:13,584] Trial 612 finished with value: 0.5199071593623923 and parameters: {'n_estimators': 123, 'max_depth': 16, 'min_samples_split': 7, 'min_samples_leaf': 1, 'max_features': None, 'bootstrap': True, 'criterion': 'absolute_error'}. Best is trial 306 with value: 0.5054021215392881.
[I 2024-12-04 12:04:15,978] Trial 611 finished with value: 0.5113214839333734 and parameters: {'n_estimators': 104, 'max_depth': 29, 'min_samples_split': 5, 'min_samples_leaf': 1, 'max_features': None, 'bootstrap': True, 'criterion': 'absolute_error'}. Best is trial 306 with value: 0.5054021215392881.
[I 2024-12-04 12:04:16,490] Trial 610 finished with value: 0.5182363748677833 and parameters: {'n_estimators': 106, 'max_depth': 12, 'min_samples_split': 3, 'min_samples_leaf': 1, 'max_features': None, 'bootstrap': True, 'criterion': 'absolute_error'}. Best is trial 306 with value: 0.5054021215392881.
[I 2024-12-04 12:04:16,493] Trial 603 finished with value: 0.5298348132710452 and parameters: {'n_estimators': 249, 'max_depth': 8, 'min_samples_split': 3, 'min_samples_leaf': 1, 'max_features': None, 'bootstrap': True, 'criterion': 'absolute_error'}. Best is trial 306 with value: 0.5054021215392881.
[I 2024-12-04 12:04:19,410] Trial 622 finished with value: 0.5136113450083714 and parameters: {'n_estimators': 105, 'max_depth': 15, 'min_samples_split': 4, 'min_samples_leaf': 1, 'max_features': None, 'bootstrap': True, 'criterion': 'absolute_error'}. Best is trial 306 with value: 0.5054021215392881.
[I 2024-12-04 12:04:19,517] Trial 615 finished with value: 0.516371264975641 and parameters: {'n_estimators': 130, 'max_depth': 8, 'min_samples_split': 4, 'min_samples_leaf': 1, 'max_features': None, 'bootstrap': True, 'criterion': 'absolute_error'}. Best is trial 306 with value: 0.5054021215392881.
[I 2024-12-04 12:04:20,807] Trial 619 finished with value: 0.5145784227432862 and parameters: {'n_estimators': 103, 'max_depth': 26, 'min_samples_split': 4, 'min_samples_leaf': 1, 'max_features': None, 'bootstrap': True, 'criterion': 'absolute_error'}. Best is trial 306 with value: 0.5054021215392881.
[I 2024-12-04 12:04:23,344] Trial 621 finished with value: 0.8457658464623099 and parameters: {'n_estimators': 304, 'max_depth': 17, 'min_samples_split': 8, 'min_samples_leaf': 1, 'max_features': 'sqrt', 'bootstrap': True, 'criterion': 'absolute_error'}. Best is trial 306 with value: 0.5054021215392881.
[I 2024-12-04 12:04:23,788] Trial 634 finished with value: 1.1352830753101546 and parameters: {'n_estimators': 301, 'max_depth': 5, 'min_samples_split': 8, 'min_samples_leaf': 4, 'max_features': 'sqrt', 'bootstrap': True, 'criterion': 'squared_error'}. Best is trial 306 with value: 0.5054021215392881.
[I 2024-12-04 12:04:24,029] Trial 626 finished with value: 0.5088744961969905 and parameters: {'n_estimators': 100, 'max_depth': 23, 'min_samples_split': 4, 'min_samples_leaf': 1, 'max_features': None, 'bootstrap': True, 'criterion': 'absolute_error'}. Best is trial 306 with value: 0.5054021215392881.
[I 2024-12-04 12:04:24,145] Trial 616 finished with value: 0.5102553368654532 and parameters: {'n_estimators': 116, 'max_depth': 18, 'min_samples_split': 5, 'min_samples_leaf': 1, 'max_features': None, 'bootstrap': True, 'criterion': 'absolute_error'}. Best is trial 306 with value: 0.5054021215392881.
[I 2024-12-04 12:04:24,242] Trial 628 finished with value: 0.5531441990609822 and parameters: {'n_estimators': 101, 'max_depth': 18, 'min_samples_split': 4, 'min_samples_leaf': 2, 'max_features': None, 'bootstrap': True, 'criterion': 'absolute_error'}. Best is trial 306 with value: 0.5054021215392881.
[I 2024-12-04 12:04:24,258] Trial 617 finished with value: 0.5309443837604165 and parameters: {'n_estimators': 276, 'max_depth': 7, 'min_samples_split': 4, 'min_samples_leaf': 1, 'max_features': None, 'bootstrap': True, 'criterion': 'absolute_error'}. Best is trial 306 with value: 0.5054021215392881.
[I 2024-12-04 12:04:24,470] Trial 620 finished with value: 0.5223797300333566 and parameters: {'n_estimators': 101, 'max_depth': 11, 'min_samples_split': 8, 'min_samples_leaf': 1, 'max_features': None, 'bootstrap': True, 'criterion': 'absolute_error'}. Best is trial 306 with value: 0.5054021215392881.
[I 2024-12-04 12:04:25,757] Trial 625 finished with value: 0.8300342183574488 and parameters: {'n_estimators': 502, 'max_depth': 50, 'min_samples_split': 37, 'min_samples_leaf': 1, 'max_features': 'log2', 'bootstrap': False, 'criterion': 'absolute_error'}. Best is trial 306 with value: 0.5054021215392881.
[I 2024-12-04 12:04:26,116] Trial 608 finished with value: 0.5556435180639244 and parameters: {'n_estimators': 326, 'max_depth': 12, 'min_samples_split': 4, 'min_samples_leaf': 2, 'max_features': None, 'bootstrap': True, 'criterion': 'absolute_error'}. Best is trial 306 with value: 0.5054021215392881.
[I 2024-12-04 12:04:27,470] Trial 629 finished with value: 0.8811074918315205 and parameters: {'n_estimators': 216, 'max_depth': 33, 'min_samples_split': 4, 'min_samples_leaf': 1, 'max_features': 'log2', 'bootstrap': True, 'criterion': 'absolute_error'}. Best is trial 306 with value: 0.5054021215392881.
[I 2024-12-04 12:04:29,073] Trial 606 finished with value: 0.5182093663805677 and parameters: {'n_estimators': 270, 'max_depth': 29, 'min_samples_split': 4, 'min_samples_leaf': 1, 'max_features': None, 'bootstrap': True, 'criterion': 'absolute_error'}. Best is trial 306 with value: 0.5054021215392881.
[I 2024-12-04 12:04:30,402] Trial 635 finished with value: 1.0692433009244249 and parameters: {'n_estimators': 123, 'max_depth': 16, 'min_samples_split': 5, 'min_samples_leaf': 1, 'max_features': 'log2', 'bootstrap': True, 'criterion': 'absolute_error'}. Best is trial 306 with value: 0.5054021215392881.
[I 2024-12-04 12:04:32,757] Trial 632 finished with value: 0.5166655844063898 and parameters: {'n_estimators': 109, 'max_depth': 22, 'min_samples_split': 2, 'min_samples_leaf': 1, 'max_features': None, 'bootstrap': True, 'criterion': 'absolute_error'}. Best is trial 306 with value: 0.5054021215392881.
[I 2024-12-04 12:04:34,605] Trial 631 finished with value: 0.5165314357816111 and parameters: {'n_estimators': 151, 'max_depth': 19, 'min_samples_split': 2, 'min_samples_leaf': 1, 'max_features': None, 'bootstrap': True, 'criterion': 'absolute_error'}. Best is trial 306 with value: 0.5054021215392881.
[I 2024-12-04 12:04:35,076] Trial 630 finished with value: 0.5146820551268031 and parameters: {'n_estimators': 118, 'max_depth': 19, 'min_samples_split': 6, 'min_samples_leaf': 1, 'max_features': None, 'bootstrap': True, 'criterion': 'absolute_error'}. Best is trial 306 with value: 0.5054021215392881.
[I 2024-12-04 12:04:36,160] Trial 618 finished with value: 0.5220701299284217 and parameters: {'n_estimators': 260, 'max_depth': 14, 'min_samples_split': 7, 'min_samples_leaf': 1, 'max_features': None, 'bootstrap': True, 'criterion': 'absolute_error'}. Best is trial 306 with value: 0.5054021215392881.
[I 2024-12-04 12:04:36,308] Trial 575 finished with value: 0.5624769323513207 and parameters: {'n_estimators': 954, 'max_depth': 21, 'min_samples_split': 6, 'min_samples_leaf': 2, 'max_features': None, 'bootstrap': True, 'criterion': 'absolute_error'}. Best is trial 306 with value: 0.5054021215392881.
[I 2024-12-04 12:04:36,728] Trial 641 finished with value: 1.0665685690511422 and parameters: {'n_estimators': 130, 'max_depth': 13, 'min_samples_split': 6, 'min_samples_leaf': 2, 'max_features': 'sqrt', 'bootstrap': True, 'criterion': 'absolute_error'}. Best is trial 306 with value: 0.5054021215392881.
[I 2024-12-04 12:04:37,330] Trial 605 finished with value: 0.5617331028736102 and parameters: {'n_estimators': 222, 'max_depth': 29, 'min_samples_split': 4, 'min_samples_leaf': 1, 'max_features': None, 'bootstrap': False, 'criterion': 'absolute_error'}. Best is trial 306 with value: 0.5054021215392881.
[I 2024-12-04 12:04:38,106] Trial 642 finished with value: 0.62503979853845 and parameters: {'n_estimators': 214, 'max_depth': 12, 'min_samples_split': 3, 'min_samples_leaf': 2, 'max_features': None, 'bootstrap': False, 'criterion': 'squared_error'}. Best is trial 306 with value: 0.5054021215392881.
[I 2024-12-04 12:04:38,407] Trial 645 finished with value: 0.9693674944509377 and parameters: {'n_estimators': 109, 'max_depth': 16, 'min_samples_split': 3, 'min_samples_leaf': 2, 'max_features': 'sqrt', 'bootstrap': True, 'criterion': 'squared_error'}. Best is trial 306 with value: 0.5054021215392881.
[I 2024-12-04 12:04:38,441] Trial 648 finished with value: 0.5550308929240334 and parameters: {'n_estimators': 146, 'max_depth': 18, 'min_samples_split': 4, 'min_samples_leaf': 2, 'max_features': None, 'bootstrap': True, 'criterion': 'squared_error'}. Best is trial 306 with value: 0.5054021215392881.
[I 2024-12-04 12:04:39,441] Trial 640 finished with value: 0.5255140687768515 and parameters: {'n_estimators': 107, 'max_depth': 24, 'min_samples_split': 3, 'min_samples_leaf': 1, 'max_features': None, 'bootstrap': True, 'criterion': 'absolute_error'}. Best is trial 306 with value: 0.5054021215392881.
[I 2024-12-04 12:04:39,830] Trial 623 finished with value: 0.5269567560029081 and parameters: {'n_estimators': 312, 'max_depth': 10, 'min_samples_split': 8, 'min_samples_leaf': 1, 'max_features': None, 'bootstrap': True, 'criterion': 'absolute_error'}. Best is trial 306 with value: 0.5054021215392881.
[I 2024-12-04 12:04:39,833] Trial 651 finished with value: 1.231073290932181 and parameters: {'n_estimators': 590, 'max_depth': 46, 'min_samples_split': 2, 'min_samples_leaf': 10, 'max_features': 'log2', 'bootstrap': False, 'criterion': 'squared_error'}. Best is trial 306 with value: 0.5054021215392881.
[I 2024-12-04 12:04:40,025] Trial 639 finished with value: 0.5146437004907923 and parameters: {'n_estimators': 105, 'max_depth': 22, 'min_samples_split': 4, 'min_samples_leaf': 1, 'max_features': None, 'bootstrap': True, 'criterion': 'absolute_error'}. Best is trial 306 with value: 0.5054021215392881.
[I 2024-12-04 12:04:40,139] Trial 638 finished with value: 0.5167095825775158 and parameters: {'n_estimators': 120, 'max_depth': 22, 'min_samples_split': 4, 'min_samples_leaf': 1, 'max_features': None, 'bootstrap': True, 'criterion': 'absolute_error'}. Best is trial 306 with value: 0.5054021215392881.
[I 2024-12-04 12:04:40,166] Trial 637 finished with value: 0.5107566944825894 and parameters: {'n_estimators': 110, 'max_depth': 15, 'min_samples_split': 5, 'min_samples_leaf': 1, 'max_features': None, 'bootstrap': True, 'criterion': 'absolute_error'}. Best is trial 306 with value: 0.5054021215392881.
[I 2024-12-04 12:04:40,668] Trial 633 finished with value: 0.5210954687641917 and parameters: {'n_estimators': 239, 'max_depth': 22, 'min_samples_split': 4, 'min_samples_leaf': 1, 'max_features': None, 'bootstrap': True, 'criterion': 'absolute_error'}. Best is trial 306 with value: 0.5054021215392881.
[I 2024-12-04 12:04:41,035] Trial 649 finished with value: 0.5196264858285198 and parameters: {'n_estimators': 106, 'max_depth': 13, 'min_samples_split': 8, 'min_samples_leaf': 1, 'max_features': None, 'bootstrap': True, 'criterion': 'absolute_error'}. Best is trial 306 with value: 0.5054021215392881.
[I 2024-12-04 12:04:41,314] Trial 627 finished with value: 0.5160521219880011 and parameters: {'n_estimators': 276, 'max_depth': 21, 'min_samples_split': 6, 'min_samples_leaf': 1, 'max_features': None, 'bootstrap': True, 'criterion': 'absolute_error'}. Best is trial 306 with value: 0.5054021215392881.
[I 2024-12-04 12:04:43,494] Trial 644 finished with value: 0.5510120462996473 and parameters: {'n_estimators': 101, 'max_depth': 12, 'min_samples_split': 3, 'min_samples_leaf': 2, 'max_features': None, 'bootstrap': True, 'criterion': 'absolute_error'}. Best is trial 306 with value: 0.5054021215392881.
[I 2024-12-04 12:04:43,523] Trial 636 finished with value: 0.5212957031640156 and parameters: {'n_estimators': 160, 'max_depth': 22, 'min_samples_split': 4, 'min_samples_leaf': 1, 'max_features': None, 'bootstrap': True, 'criterion': 'absolute_error'}. Best is trial 306 with value: 0.5054021215392881.
[I 2024-12-04 12:04:43,977] Trial 647 finished with value: 0.5098167873890999 and parameters: {'n_estimators': 102, 'max_depth': 36, 'min_samples_split': 5, 'min_samples_leaf': 1, 'max_features': None, 'bootstrap': True, 'criterion': 'absolute_error'}. Best is trial 306 with value: 0.5054021215392881.
