[I 2024-12-04 00:20:40,134] Trial 1376 finished with value: 0.24013246355819481 and parameters: {'kernel': 'rbf', 'C': 12.929936858453647, 'gamma': 0.006962953305078186, 'epsilon': 0.0010428162827405237}. Best is trial 973 with value: 0.1397919550170376.
[I 2024-12-04 00:20:40,188] Trial 1375 finished with value: 0.17479021206823933 and parameters: {'kernel': 'rbf', 'C': 90.79878829030815, 'gamma': 0.0035721772181913527, 'epsilon': 0.0028661423708719116}. Best is trial 973 with value: 0.1397919550170376.
[I 2024-12-04 00:20:41,540] Trial 1372 finished with value: 0.5391102502194377 and parameters: {'kernel': 'linear', 'C': 71.59699094011678, 'gamma': 0.01125172396794015, 'epsilon': 0.9236030352361223}. Best is trial 973 with value: 0.1397919550170376.
[I 2024-12-04 00:20:41,574] Trial 1379 finished with value: 0.8672222701540416 and parameters: {'kernel': 'sigmoid', 'C': 0.014447143315751806, 'gamma': 0.08701944807347341, 'epsilon': 0.8650537037199904}. Best is trial 973 with value: 0.1397919550170376.
[I 2024-12-04 00:20:43,245] Trial 1377 finished with value: 0.5986958469084185 and parameters: {'kernel': 'poly', 'C': 56.31798668594419, 'gamma': 0.008101417336745317, 'epsilon': 0.0010136407447123594}. Best is trial 973 with value: 0.1397919550170376.
[I 2024-12-04 00:20:43,911] Trial 1378 finished with value: 0.17709770645068537 and parameters: {'kernel': 'rbf', 'C': 29.520359382205775, 'gamma': 0.03330093299574585, 'epsilon': 0.007917489597586586}. Best is trial 973 with value: 0.1397919550170376.
[I 2024-12-04 00:20:44,872] Trial 1381 finished with value: 0.22763853545318477 and parameters: {'kernel': 'rbf', 'C': 22.13843950215535, 'gamma': 0.005335273073846045, 'epsilon': 0.002431987334142697}. Best is trial 973 with value: 0.1397919550170376.
[I 2024-12-04 00:20:46,601] Trial 1383 finished with value: 0.20057658698315964 and parameters: {'kernel': 'rbf', 'C': 97.61101632183599, 'gamma': 0.0023705706158991197, 'epsilon': 0.003917457957528068}. Best is trial 973 with value: 0.1397919550170376.
[I 2024-12-04 00:20:46,603] Trial 1382 finished with value: 0.2311854309628534 and parameters: {'kernel': 'rbf', 'C': 13.5329323557441, 'gamma': 0.09361853541967113, 'epsilon': 0.0011951066351341278}. Best is trial 973 with value: 0.1397919550170376.
[I 2024-12-04 00:20:47,249] Trial 1041 finished with value: 0.3534643389826677 and parameters: {'kernel': 'linear', 'C': 91.7562251076621, 'gamma': 0.013412478634720242, 'epsilon': 0.005116940521345448}. Best is trial 973 with value: 0.1397919550170376.
[I 2024-12-04 00:20:48,405] Trial 1384 finished with value: 0.6137856447926865 and parameters: {'kernel': 'poly', 'C': 7.0241977587094375, 'gamma': 0.014948268801407125, 'epsilon': 0.011818882388177809}. Best is trial 973 with value: 0.1397919550170376.
[I 2024-12-04 00:20:49,503] Trial 1141 finished with value: 0.3524923575529509 and parameters: {'kernel': 'linear', 'C': 53.046724227972646, 'gamma': 0.009078501530807767, 'epsilon': 0.0010165286947459895}. Best is trial 973 with value: 0.1397919550170376.
[I 2024-12-04 00:20:50,876] Trial 1388 finished with value: 0.2237401592886439 and parameters: {'kernel': 'rbf', 'C': 17.834826741930318, 'gamma': 0.006744911132790557, 'epsilon': 0.0010410815617289293}. Best is trial 973 with value: 0.1397919550170376.
[I 2024-12-04 00:20:50,912] Trial 1387 finished with value: 0.1595087015007296 and parameters: {'kernel': 'rbf', 'C': 17.15623960502734, 'gamma': 0.03020102398183055, 'epsilon': 0.002949925715250817}. Best is trial 973 with value: 0.1397919550170376.
[I 2024-12-04 00:20:50,913] Trial 1386 finished with value: 0.17830567601536454 and parameters: {'kernel': 'rbf', 'C': 22.410728921141693, 'gamma': 0.03602457971779234, 'epsilon': 0.001993979051542134}. Best is trial 973 with value: 0.1397919550170376.
[I 2024-12-04 00:20:52,415] Trial 1389 finished with value: 0.15886955593475954 and parameters: {'kernel': 'rbf', 'C': 98.20721620974693, 'gamma': 0.0043349039169041596, 'epsilon': 0.003198147503766522}. Best is trial 973 with value: 0.1397919550170376.
[I 2024-12-04 00:20:54,154] Trial 1385 finished with value: 0.19470498688166876 and parameters: {'kernel': 'rbf', 'C': 98.80279439945365, 'gamma': 0.03875818455580551, 'epsilon': 0.002674236803151656}. Best is trial 973 with value: 0.1397919550170376.
[I 2024-12-04 00:20:54,311] Trial 1392 finished with value: 0.15469941213013727 and parameters: {'kernel': 'rbf', 'C': 22.76135846179633, 'gamma': 0.014109729863827282, 'epsilon': 0.0024244873345981525}. Best is trial 973 with value: 0.1397919550170376.
[I 2024-12-04 00:20:54,878] Trial 1391 finished with value: 0.17503510221096685 and parameters: {'kernel': 'rbf', 'C': 20.39933412166965, 'gamma': 0.03483718210981611, 'epsilon': 0.0024062610941923556}. Best is trial 973 with value: 0.1397919550170376.
[I 2024-12-04 00:20:55,834] Trial 1393 finished with value: 0.14828618037966407 and parameters: {'kernel': 'rbf', 'C': 24.33335163468984, 'gamma': 0.017129247429890096, 'epsilon': 0.0010318158110533347}. Best is trial 973 with value: 0.1397919550170376.
[I 2024-12-04 00:20:56,773] Trial 1390 finished with value: 0.15972651775370322 and parameters: {'kernel': 'rbf', 'C': 85.16170717110921, 'gamma': 0.01469924000136443, 'epsilon': 0.002555461988973025}. Best is trial 973 with value: 0.1397919550170376.
[I 2024-12-04 00:20:57,450] Trial 1395 finished with value: 0.1618618965026908 and parameters: {'kernel': 'rbf', 'C': 11.00704209440978, 'gamma': 0.024854315591974867, 'epsilon': 0.0010613453250462343}. Best is trial 973 with value: 0.1397919550170376.
[I 2024-12-04 00:20:57,451] Trial 1394 finished with value: 0.1979425609809491 and parameters: {'kernel': 'rbf', 'C': 94.43777504590177, 'gamma': 0.0025767987083260904, 'epsilon': 0.0022256235150476845}. Best is trial 973 with value: 0.1397919550170376.
[I 2024-12-04 00:20:59,861] Trial 1399 finished with value: 0.3178009804092176 and parameters: {'kernel': 'rbf', 'C': 3.378001286611716, 'gamma': 0.005128098407697083, 'epsilon': 0.0030683883025676767}. Best is trial 973 with value: 0.1397919550170376.
[I 2024-12-04 00:21:00,910] Trial 1397 finished with value: 0.1567195046889849 and parameters: {'kernel': 'rbf', 'C': 90.71688887043483, 'gamma': 0.013428857643743108, 'epsilon': 0.003575572717017268}. Best is trial 973 with value: 0.1397919550170376.
[I 2024-12-04 00:21:00,988] Trial 1398 finished with value: 0.15503685849452872 and parameters: {'kernel': 'rbf', 'C': 92.67646629063556, 'gamma': 0.004838190529191869, 'epsilon': 0.004020563394394203}. Best is trial 973 with value: 0.1397919550170376.
[I 2024-12-04 00:21:04,382] Trial 1400 finished with value: 0.17525468704849423 and parameters: {'kernel': 'rbf', 'C': 90.11615740162276, 'gamma': 0.02393046468722457, 'epsilon': 0.002331774022916001}. Best is trial 973 with value: 0.1397919550170376.
[I 2024-12-04 00:21:04,515] Trial 1401 finished with value: 0.14479957529928297 and parameters: {'kernel': 'rbf', 'C': 80.19949170038593, 'gamma': 0.006797796714441418, 'epsilon': 0.0010318561016447382}. Best is trial 973 with value: 0.1397919550170376.
[I 2024-12-04 00:21:06,218] Trial 1405 finished with value: 0.9633510058692669 and parameters: {'kernel': 'poly', 'C': 51.325584867868926, 'gamma': 0.00014456120022366092, 'epsilon': 0.2994881585129839}. Best is trial 973 with value: 0.1397919550170376.
[I 2024-12-04 00:21:06,645] Trial 1402 finished with value: 0.14100268266583435 and parameters: {'kernel': 'rbf', 'C': 85.73078145514143, 'gamma': 0.007474046713221049, 'epsilon': 0.001126116326439462}. Best is trial 973 with value: 0.1397919550170376.
[I 2024-12-04 00:21:07,037] Trial 1404 finished with value: 0.20645100181405965 and parameters: {'kernel': 'rbf', 'C': 15.393133744813596, 'gamma': 0.009384869933422343, 'epsilon': 0.0034936114974343196}. Best is trial 973 with value: 0.1397919550170376.
[I 2024-12-04 00:21:08,425] Trial 1406 finished with value: 0.2988665228972179 and parameters: {'kernel': 'rbf', 'C': 14.37148045134636, 'gamma': 0.0019251473404671173, 'epsilon': 0.0010252641274630817}. Best is trial 973 with value: 0.1397919550170376.
[I 2024-12-04 00:21:09,042] Trial 1407 finished with value: 143.27173878289122 and parameters: {'kernel': 'sigmoid', 'C': 8.877838544026098, 'gamma': 0.014681837182045672, 'epsilon': 0.003655931661836999}. Best is trial 973 with value: 0.1397919550170376.
[I 2024-12-04 00:21:10,600] Trial 1409 finished with value: 0.24231228502917146 and parameters: {'kernel': 'rbf', 'C': 21.461870671692804, 'gamma': 0.004338467182819201, 'epsilon': 0.0010252228535578257}. Best is trial 973 with value: 0.1397919550170376.
[I 2024-12-04 00:21:11,740] Trial 1410 finished with value: 0.20480797434788195 and parameters: {'kernel': 'rbf', 'C': 72.87045220167688, 'gamma': 0.002815332008996291, 'epsilon': 0.001098385241863703}. Best is trial 973 with value: 0.1397919550170376.
[I 2024-12-04 00:21:12,484] Trial 554 finished with value: 0.6156447240107505 and parameters: {'kernel': 'poly', 'C': 35.94829206895852, 'gamma': 0.029945802698500223, 'epsilon': 0.0015074946275044263}. Best is trial 973 with value: 0.1397919550170376.
[I 2024-12-04 00:21:12,599] Trial 1411 finished with value: 0.7141291962925478 and parameters: {'kernel': 'rbf', 'C': 0.023480274541349294, 'gamma': 0.07698777261669458, 'epsilon': 0.0014467060544204847}. Best is trial 973 with value: 0.1397919550170376.
[I 2024-12-04 00:21:12,743] Trial 1408 finished with value: 0.1479288773454002 and parameters: {'kernel': 'rbf', 'C': 75.16080491166208, 'gamma': 0.012401693225954314, 'epsilon': 0.0010004845256062892}. Best is trial 973 with value: 0.1397919550170376.
[I 2024-12-04 00:21:14,108] Trial 1412 finished with value: 0.771005656216988 and parameters: {'kernel': 'rbf', 'C': 0.308271975662789, 'gamma': 0.7714790939571318, 'epsilon': 0.028152522422665575}. Best is trial 973 with value: 0.1397919550170376.
[I 2024-12-04 00:21:15,327] Trial 668 finished with value: 0.6666570108340375 and parameters: {'kernel': 'poly', 'C': 96.92840597238383, 'gamma': 0.0245533363114804, 'epsilon': 0.0030743046676461293}. Best is trial 973 with value: 0.1397919550170376.
[I 2024-12-04 00:21:15,329] Trial 1414 finished with value: 0.25001818353976807 and parameters: {'kernel': 'rbf', 'C': 19.17538066961308, 'gamma': 0.00414048138892165, 'epsilon': 0.006508653879023171}. Best is trial 973 with value: 0.1397919550170376.
[I 2024-12-04 00:21:15,661] Trial 1413 finished with value: 0.17795312740311187 and parameters: {'kernel': 'rbf', 'C': 20.106830909917377, 'gamma': 0.010592824448676425, 'epsilon': 0.007302779571339465}. Best is trial 973 with value: 0.1397919550170376.
[I 2024-12-04 00:21:16,870] Trial 1416 finished with value: 0.6718738627660021 and parameters: {'kernel': 'poly', 'C': 14.615835828608482, 'gamma': 0.008518072290577388, 'epsilon': 0.003571507602927927}. Best is trial 973 with value: 0.1397919550170376.
[I 2024-12-04 00:21:17,815] Trial 1415 finished with value: 0.1398266295139967 and parameters: {'kernel': 'rbf', 'C': 93.94473268803321, 'gamma': 0.00853395028961476, 'epsilon': 0.0012685721953783896}. Best is trial 973 with value: 0.1397919550170376.
[I 2024-12-04 00:21:19,705] Trial 1417 finished with value: 0.14086919694938124 and parameters: {'kernel': 'rbf', 'C': 98.71655997602734, 'gamma': 0.008257561804660408, 'epsilon': 0.005337279425574629}. Best is trial 973 with value: 0.1397919550170376.
[I 2024-12-04 00:21:20,191] Trial 1083 finished with value: 0.3534912415226468 and parameters: {'kernel': 'linear', 'C': 95.66145647190791, 'gamma': 0.002542035753216018, 'epsilon': 0.002941069607309271}. Best is trial 973 with value: 0.1397919550170376.
[I 2024-12-04 00:21:20,834] Trial 1421 finished with value: 0.1968220613303276 and parameters: {'kernel': 'rbf', 'C': 94.81640265192372, 'gamma': 0.002615223342149405, 'epsilon': 0.0011694742406379184}. Best is trial 973 with value: 0.1397919550170376.
[I 2024-12-04 00:21:21,881] Trial 1419 finished with value: 0.15273731662066325 and parameters: {'kernel': 'rbf', 'C': 78.7858110477673, 'gamma': 0.01324750011775956, 'epsilon': 0.002813257319324314}. Best is trial 973 with value: 0.1397919550170376.
[I 2024-12-04 00:21:22,020] Trial 1422 finished with value: 0.29925975108700514 and parameters: {'kernel': 'rbf', 'C': 22.30605605503204, 'gamma': 0.0013398758074185122, 'epsilon': 0.003484249418299165}. Best is trial 973 with value: 0.1397919550170376.
[I 2024-12-04 00:21:22,021] Trial 1418 finished with value: 0.17515191057210305 and parameters: {'kernel': 'rbf', 'C': 93.14882339803661, 'gamma': 0.023567313887554345, 'epsilon': 0.0019715200507504876}. Best is trial 973 with value: 0.1397919550170376.
[I 2024-12-04 00:21:22,867] Trial 1420 finished with value: 0.16651872933330933 and parameters: {'kernel': 'rbf', 'C': 93.0051279831949, 'gamma': 0.016120972241380933, 'epsilon': 0.0021706115502615007}. Best is trial 973 with value: 0.1397919550170376.
[I 2024-12-04 00:21:22,969] Trial 1423 finished with value: 0.25105933657031587 and parameters: {'kernel': 'rbf', 'C': 30.108069268053963, 'gamma': 0.002580295052867533, 'epsilon': 0.0023491379600313104}. Best is trial 973 with value: 0.1397919550170376.
[I 2024-12-04 00:21:24,075] Trial 1425 finished with value: 0.4902308059789551 and parameters: {'kernel': 'linear', 'C': 0.012472308156694561, 'gamma': 0.0008880192553799487, 'epsilon': 0.16846441514141947}. Best is trial 973 with value: 0.1397919550170376.
[I 2024-12-04 00:21:24,817] Trial 1424 finished with value: 0.1466484753849067 and parameters: {'kernel': 'rbf', 'C': 88.89188962544434, 'gamma': 0.006416321858769602, 'epsilon': 0.00798342686747974}. Best is trial 973 with value: 0.1397919550170376.
[I 2024-12-04 00:21:24,912] Trial 1427 finished with value: 1.7753441278381623 and parameters: {'kernel': 'sigmoid', 'C': 0.3955722889208954, 'gamma': 0.005044557874196508, 'epsilon': 0.001479341730026622}. Best is trial 973 with value: 0.1397919550170376.
[I 2024-12-04 00:21:25,319] Trial 1426 finished with value: 0.2165799205630492 and parameters: {'kernel': 'rbf', 'C': 93.96769420565923, 'gamma': 0.001797396945268484, 'epsilon': 0.008422794604450988}. Best is trial 973 with value: 0.1397919550170376.
[I 2024-12-04 00:21:26,005] Trial 1429 finished with value: 1357.6643789375958 and parameters: {'kernel': 'sigmoid', 'C': 69.82088900044072, 'gamma': 0.022612331359220743, 'epsilon': 0.0012277706028078642}. Best is trial 973 with value: 0.1397919550170376.
[I 2024-12-04 00:21:26,432] Trial 1428 finished with value: 0.19586310498039838 and parameters: {'kernel': 'rbf', 'C': 16.61617327671537, 'gamma': 0.009867885004920002, 'epsilon': 0.0032419544118620198}. Best is trial 973 with value: 0.1397919550170376.
[I 2024-12-04 00:21:28,891] Trial 1431 finished with value: 0.24341730870136194 and parameters: {'kernel': 'rbf', 'C': 20.461165338626007, 'gamma': 0.004424157751558919, 'epsilon': 0.0026282670035761508}. Best is trial 973 with value: 0.1397919550170376.
[I 2024-12-04 00:21:28,908] Trial 1433 finished with value: 0.7130511231560984 and parameters: {'kernel': 'rbf', 'C': 56.82232226070156, 'gamma': 0.9977783831389139, 'epsilon': 0.002677721874653327}. Best is trial 973 with value: 0.1397919550170376.
[I 2024-12-04 00:21:29,283] Trial 1434 finished with value: 0.6495526420704225 and parameters: {'kernel': 'rbf', 'C': 0.03000181093574611, 'gamma': 0.030412471050683145, 'epsilon': 0.09085530462945686}. Best is trial 973 with value: 0.1397919550170376.
[I 2024-12-04 00:21:29,825] Trial 1432 finished with value: 0.16233627063903797 and parameters: {'kernel': 'rbf', 'C': 25.71606705545787, 'gamma': 0.02732604515392321, 'epsilon': 0.0010080374592191337}. Best is trial 973 with value: 0.1397919550170376.
[I 2024-12-04 00:21:29,826] Trial 1430 finished with value: 0.17518002780632905 and parameters: {'kernel': 'rbf', 'C': 88.2130968387097, 'gamma': 0.024046433051206483, 'epsilon': 0.0022252465216691278}. Best is trial 973 with value: 0.1397919550170376.
[I 2024-12-04 00:21:29,986] Trial 1348 finished with value: 0.35253279091159245 and parameters: {'kernel': 'linear', 'C': 22.05912051034927, 'gamma': 0.007260450647494117, 'epsilon': 0.0012595211000545805}. Best is trial 973 with value: 0.1397919550170376.
[I 2024-12-04 00:21:31,976] Trial 1435 finished with value: 0.1410955164456145 and parameters: {'kernel': 'rbf', 'C': 91.23010423262066, 'gamma': 0.007133937611978387, 'epsilon': 0.0011155028856203305}. Best is trial 973 with value: 0.1397919550170376.
[I 2024-12-04 00:21:32,236] Trial 1436 finished with value: 0.1957037056280613 and parameters: {'kernel': 'rbf', 'C': 22.50586347138882, 'gamma': 0.00791618581023024, 'epsilon': 0.0025474890248444585}. Best is trial 973 with value: 0.1397919550170376.
[I 2024-12-04 00:21:34,691] Trial 1440 finished with value: 0.20581716375328993 and parameters: {'kernel': 'rbf', 'C': 19.503215726612737, 'gamma': 0.007878578241743536, 'epsilon': 0.002632946793812498}. Best is trial 973 with value: 0.1397919550170376.
[I 2024-12-04 00:21:35,815] Trial 1441 finished with value: 0.15047158207806163 and parameters: {'kernel': 'rbf', 'C': 20.93965231358913, 'gamma': 0.016818812419692287, 'epsilon': 0.0026764257278444827}. Best is trial 973 with value: 0.1397919550170376.
[I 2024-12-04 00:21:36,558] Trial 1438 finished with value: 0.5727509302611585 and parameters: {'kernel': 'poly', 'C': 8.8604042131332, 'gamma': 0.017213073057940377, 'epsilon': 0.0010920991981466014}. Best is trial 973 with value: 0.1397919550170376.
[I 2024-12-04 00:21:36,559] Trial 1439 finished with value: 0.17316388509902986 and parameters: {'kernel': 'rbf', 'C': 34.36182789045436, 'gamma': 0.029847876896540403, 'epsilon': 0.00703433401798387}. Best is trial 973 with value: 0.1397919550170376.
[I 2024-12-04 00:21:38,125] Trial 1444 finished with value: 0.22541069644233278 and parameters: {'kernel': 'rbf', 'C': 82.4018898022235, 'gamma': 0.0017295147555048609, 'epsilon': 0.0010145623298439587}. Best is trial 973 with value: 0.1397919550170376.
[I 2024-12-04 00:21:39,922] Trial 1445 finished with value: 0.260053392592186 and parameters: {'kernel': 'rbf', 'C': 25.451673330279043, 'gamma': 0.1295003769154261, 'epsilon': 0.0010129996993352257}. Best is trial 973 with value: 0.1397919550170376.
[I 2024-12-04 00:21:43,776] Trial 1449 finished with value: 0.2804345263766883 and parameters: {'kernel': 'rbf', 'C': 28.20007963612473, 'gamma': 0.0014226510127027061, 'epsilon': 0.002759756820629333}. Best is trial 973 with value: 0.1397919550170376.
[I 2024-12-04 00:21:44,549] Trial 1447 finished with value: 0.16798356652072274 and parameters: {'kernel': 'rbf', 'C': 96.46468885768125, 'gamma': 0.01681596933257578, 'epsilon': 0.0032756190636078412}. Best is trial 973 with value: 0.1397919550170376.
[I 2024-12-04 00:21:46,628] Trial 1446 finished with value: 0.170528219195083 and parameters: {'kernel': 'rbf', 'C': 94.10187198857616, 'gamma': 0.018819959758880636, 'epsilon': 0.0011020605373565225}. Best is trial 973 with value: 0.1397919550170376.
[I 2024-12-04 00:21:47,879] Trial 1450 finished with value: 0.15767454834607997 and parameters: {'kernel': 'rbf', 'C': 19.741640517687475, 'gamma': 0.015012002730670776, 'epsilon': 0.0011066156173346459}. Best is trial 973 with value: 0.1397919550170376.
[I 2024-12-04 00:21:49,353] Trial 1451 finished with value: 0.15396581653499092 and parameters: {'kernel': 'rbf', 'C': 97.19611057563938, 'gamma': 0.004857571330370507, 'epsilon': 0.002174858260415293}. Best is trial 973 with value: 0.1397919550170376.
[I 2024-12-04 00:21:50,399] Trial 1452 finished with value: 0.18173424042885722 and parameters: {'kernel': 'rbf', 'C': 16.97866951464766, 'gamma': 0.01145112193221189, 'epsilon': 0.002942685662916609}. Best is trial 973 with value: 0.1397919550170376.
[I 2024-12-04 00:21:50,448] Trial 1453 finished with value: 0.9653685685076799 and parameters: {'kernel': 'poly', 'C': 0.020785761234792807, 'gamma': 0.002196585173319463, 'epsilon': 0.01019669542459112}. Best is trial 973 with value: 0.1397919550170376.
[I 2024-12-04 00:21:51,539] Trial 1454 finished with value: 2.0369250242549417 and parameters: {'kernel': 'sigmoid', 'C': 0.1169351563372978, 'gamma': 0.023610635467106386, 'epsilon': 0.38057819006499277}. Best is trial 973 with value: 0.1397919550170376.
[I 2024-12-04 00:21:56,033] Trial 1455 finished with value: 0.1466003494017856 and parameters: {'kernel': 'rbf', 'C': 98.04987515101152, 'gamma': 0.00593725504334064, 'epsilon': 0.002008240492209458}. Best is trial 973 with value: 0.1397919550170376.
[I 2024-12-04 00:21:59,030] Trial 1458 finished with value: 0.22807023515111785 and parameters: {'kernel': 'rbf', 'C': 27.747644185869746, 'gamma': 0.00438075872033174, 'epsilon': 0.0029668453190169657}. Best is trial 973 with value: 0.1397919550170376.
[I 2024-12-04 00:22:00,413] Trial 1457 finished with value: 0.17142299812835984 and parameters: {'kernel': 'rbf', 'C': 93.75993394469923, 'gamma': 0.020672670820189656, 'epsilon': 0.0034972457388024424}. Best is trial 973 with value: 0.1397919550170376.
[I 2024-12-04 00:22:02,602] Trial 1456 finished with value: 0.20088910299718535 and parameters: {'kernel': 'rbf', 'C': 99.84575223096903, 'gamma': 0.04286307620622123, 'epsilon': 0.0018095568919851005}. Best is trial 973 with value: 0.1397919550170376.
[I 2024-12-04 00:22:02,759] Trial 1460 finished with value: 0.5892960118803396 and parameters: {'kernel': 'linear', 'C': 0.0023725967649504496, 'gamma': 0.006880869844440993, 'epsilon': 0.019853239765177912}. Best is trial 973 with value: 0.1397919550170376.
[I 2024-12-04 00:22:04,277] Trial 1366 finished with value: 0.5648160345616416 and parameters: {'kernel': 'poly', 'C': 85.58872339645222, 'gamma': 0.01707670102711363, 'epsilon': 0.00398777626806465}. Best is trial 973 with value: 0.1397919550170376.
