[I 2024-12-04 12:28:20,579] Trial 392 finished with value: 0.23951711664576433 and parameters: {'n_estimators': 1445, 'learning_rate': 0.09987237803126703, 'max_depth': 11, 'min_samples_split': 9, 'min_samples_leaf': 1, 'subsample': 0.7206974504928175, 'max_features': 'sqrt'}. Best is trial 259 with value: 0.21062976081411197.
[I 2024-12-04 12:28:23,154] Trial 405 finished with value: 0.2605739385722808 and parameters: {'n_estimators': 758, 'learning_rate': 0.08119085254431206, 'max_depth': 11, 'min_samples_split': 19, 'min_samples_leaf': 1, 'subsample': 0.7744154142550035, 'max_features': None}. Best is trial 259 with value: 0.21062976081411197.
[I 2024-12-04 12:28:23,259] Trial 394 finished with value: 0.2559432740994336 and parameters: {'n_estimators': 1455, 'learning_rate': 0.08795808755587578, 'max_depth': 12, 'min_samples_split': 15, 'min_samples_leaf': 3, 'subsample': 0.6994206822222454, 'max_features': 'sqrt'}. Best is trial 259 with value: 0.21062976081411197.
[I 2024-12-04 12:28:29,071] Trial 395 finished with value: 0.21652835039054755 and parameters: {'n_estimators': 1448, 'learning_rate': 0.06700039282958034, 'max_depth': 11, 'min_samples_split': 12, 'min_samples_leaf': 1, 'subsample': 0.7834520656684495, 'max_features': 'sqrt'}. Best is trial 259 with value: 0.21062976081411197.
[I 2024-12-04 12:28:31,560] Trial 415 finished with value: 0.45493506119225685 and parameters: {'n_estimators': 745, 'learning_rate': 0.03635055985852517, 'max_depth': 4, 'min_samples_split': 2, 'min_samples_leaf': 10, 'subsample': 0.6469771986619897, 'max_features': 'sqrt'}. Best is trial 259 with value: 0.21062976081411197.
[I 2024-12-04 12:28:33,701] Trial 399 finished with value: 0.42543752659209655 and parameters: {'n_estimators': 1475, 'learning_rate': 0.017972841905733908, 'max_depth': 10, 'min_samples_split': 2, 'min_samples_leaf': 10, 'subsample': 0.812508660150882, 'max_features': 'sqrt'}. Best is trial 259 with value: 0.21062976081411197.
[I 2024-12-04 12:28:40,479] Trial 410 finished with value: 0.2584536671789387 and parameters: {'n_estimators': 1050, 'learning_rate': 0.062793611302229, 'max_depth': 10, 'min_samples_split': 15, 'min_samples_leaf': 3, 'subsample': 0.6544982300038943, 'max_features': 'sqrt'}. Best is trial 259 with value: 0.21062976081411197.
[I 2024-12-04 12:28:43,211] Trial 412 finished with value: 0.22477549233747732 and parameters: {'n_estimators': 1031, 'learning_rate': 0.09277946349627055, 'max_depth': 10, 'min_samples_split': 19, 'min_samples_leaf': 1, 'subsample': 0.7208338991008894, 'max_features': 'sqrt'}. Best is trial 259 with value: 0.21062976081411197.
[I 2024-12-04 12:28:45,392] Trial 400 finished with value: 0.2268038301449403 and parameters: {'n_estimators': 1481, 'learning_rate': 0.07570448354926783, 'max_depth': 12, 'min_samples_split': 14, 'min_samples_leaf': 1, 'subsample': 0.8268890353590548, 'max_features': 'sqrt'}. Best is trial 259 with value: 0.21062976081411197.
[I 2024-12-04 12:28:46,002] Trial 407 finished with value: 0.2464123872853808 and parameters: {'n_estimators': 1270, 'learning_rate': 0.09747708455247871, 'max_depth': 10, 'min_samples_split': 13, 'min_samples_leaf': 2, 'subsample': 0.7888313592887447, 'max_features': 'sqrt'}. Best is trial 259 with value: 0.21062976081411197.
[I 2024-12-04 12:28:47,236] Trial 406 finished with value: 0.23777180440808998 and parameters: {'n_estimators': 1260, 'learning_rate': 0.09468939623322727, 'max_depth': 12, 'min_samples_split': 8, 'min_samples_leaf': 1, 'subsample': 0.7919312257659896, 'max_features': 'sqrt'}. Best is trial 259 with value: 0.21062976081411197.
[I 2024-12-04 12:28:50,312] Trial 402 finished with value: 0.21898708414923376 and parameters: {'n_estimators': 1481, 'learning_rate': 0.0427832812214744, 'max_depth': 12, 'min_samples_split': 9, 'min_samples_leaf': 1, 'subsample': 0.7365006332816207, 'max_features': 'sqrt'}. Best is trial 259 with value: 0.21062976081411197.
[I 2024-12-04 12:28:55,393] Trial 408 finished with value: 0.23617208207404772 and parameters: {'n_estimators': 1371, 'learning_rate': 0.04800486892784329, 'max_depth': 12, 'min_samples_split': 13, 'min_samples_leaf': 1, 'subsample': 0.6902868961123068, 'max_features': 'sqrt'}. Best is trial 259 with value: 0.21062976081411197.
[I 2024-12-04 12:28:57,246] Trial 434 finished with value: 0.33667513747137273 and parameters: {'n_estimators': 494, 'learning_rate': 0.02742046926438317, 'max_depth': 9, 'min_samples_split': 11, 'min_samples_leaf': 5, 'subsample': 0.9882291380892438, 'max_features': 'sqrt'}. Best is trial 259 with value: 0.21062976081411197.
[I 2024-12-04 12:29:02,785] Trial 404 finished with value: 0.2623527929852574 and parameters: {'n_estimators': 1472, 'learning_rate': 0.09943448221437916, 'max_depth': 9, 'min_samples_split': 14, 'min_samples_leaf': 1, 'subsample': 0.7651641529790155, 'max_features': None}. Best is trial 259 with value: 0.21062976081411197.
[I 2024-12-04 12:29:04,802] Trial 419 finished with value: 0.229562804759897 and parameters: {'n_estimators': 1167, 'learning_rate': 0.058308202150856525, 'max_depth': 12, 'min_samples_split': 13, 'min_samples_leaf': 1, 'subsample': 0.6099089142224434, 'max_features': 'sqrt'}. Best is trial 259 with value: 0.21062976081411197.
[I 2024-12-04 12:29:05,818] Trial 420 finished with value: 0.21084831323399963 and parameters: {'n_estimators': 1155, 'learning_rate': 0.09127839997783986, 'max_depth': 12, 'min_samples_split': 11, 'min_samples_leaf': 1, 'subsample': 0.7634872518834744, 'max_features': 'sqrt'}. Best is trial 259 with value: 0.21062976081411197.
[I 2024-12-04 12:29:05,830] Trial 416 finished with value: 0.21345324339894226 and parameters: {'n_estimators': 1301, 'learning_rate': 0.09797702825437966, 'max_depth': 10, 'min_samples_split': 18, 'min_samples_leaf': 1, 'subsample': 0.7700315217858739, 'max_features': 'sqrt'}. Best is trial 259 with value: 0.21062976081411197.
[I 2024-12-04 12:29:07,202] Trial 413 finished with value: 0.230114774764149 and parameters: {'n_estimators': 1414, 'learning_rate': 0.0910745990049338, 'max_depth': 9, 'min_samples_split': 12, 'min_samples_leaf': 1, 'subsample': 0.7713647838072804, 'max_features': 'sqrt'}. Best is trial 259 with value: 0.21062976081411197.
[I 2024-12-04 12:29:11,288] Trial 417 finished with value: 0.2904543369539945 and parameters: {'n_estimators': 1125, 'learning_rate': 0.09162102243968358, 'max_depth': 12, 'min_samples_split': 8, 'min_samples_leaf': 1, 'subsample': 0.8968449198246531, 'max_features': None}. Best is trial 259 with value: 0.21062976081411197.
[I 2024-12-04 12:29:11,803] Trial 424 finished with value: 0.23895912242463863 and parameters: {'n_estimators': 1063, 'learning_rate': 0.0622116302138162, 'max_depth': 11, 'min_samples_split': 17, 'min_samples_leaf': 1, 'subsample': 0.6117663470316101, 'max_features': 'sqrt'}. Best is trial 259 with value: 0.21062976081411197.
[I 2024-12-04 12:29:12,218] Trial 421 finished with value: 0.22870169498718526 and parameters: {'n_estimators': 1169, 'learning_rate': 0.0782238920016509, 'max_depth': 11, 'min_samples_split': 15, 'min_samples_leaf': 1, 'subsample': 0.7158802020166659, 'max_features': 'sqrt'}. Best is trial 259 with value: 0.21062976081411197.
[I 2024-12-04 12:29:13,742] Trial 414 finished with value: 0.21049829021122501 and parameters: {'n_estimators': 1499, 'learning_rate': 0.09700603004212298, 'max_depth': 10, 'min_samples_split': 11, 'min_samples_leaf': 1, 'subsample': 0.7390684503675475, 'max_features': 'sqrt'}. Best is trial 414 with value: 0.21049829021122501.
[I 2024-12-04 12:29:14,170] Trial 428 finished with value: 0.2419979426754533 and parameters: {'n_estimators': 950, 'learning_rate': 0.08503884631993444, 'max_depth': 12, 'min_samples_split': 5, 'min_samples_leaf': 1, 'subsample': 0.7727298735061452, 'max_features': 'sqrt'}. Best is trial 414 with value: 0.21049829021122501.
[I 2024-12-04 12:29:16,630] Trial 422 finished with value: 0.21492046604774526 and parameters: {'n_estimators': 1204, 'learning_rate': 0.08525054157920031, 'max_depth': 9, 'min_samples_split': 7, 'min_samples_leaf': 1, 'subsample': 0.8221673734302829, 'max_features': 'sqrt'}. Best is trial 414 with value: 0.21049829021122501.
[I 2024-12-04 12:29:17,843] Trial 425 finished with value: 0.21260774290342788 and parameters: {'n_estimators': 1099, 'learning_rate': 0.09757805667417303, 'max_depth': 12, 'min_samples_split': 12, 'min_samples_leaf': 1, 'subsample': 0.6759742331402001, 'max_features': 'sqrt'}. Best is trial 414 with value: 0.21049829021122501.
[I 2024-12-04 12:29:21,228] Trial 418 finished with value: 0.21859002809917574 and parameters: {'n_estimators': 1454, 'learning_rate': 0.0767824801096427, 'max_depth': 12, 'min_samples_split': 6, 'min_samples_leaf': 1, 'subsample': 0.7671955624263314, 'max_features': 'sqrt'}. Best is trial 414 with value: 0.21049829021122501.
[I 2024-12-04 12:29:21,230] Trial 449 finished with value: 0.33956287061599477 and parameters: {'n_estimators': 115, 'learning_rate': 0.05235750054091821, 'max_depth': 11, 'min_samples_split': 14, 'min_samples_leaf': 5, 'subsample': 0.8236890759191633, 'max_features': None}. Best is trial 414 with value: 0.21049829021122501.
[I 2024-12-04 12:29:25,936] Trial 433 finished with value: 0.22695138420258146 and parameters: {'n_estimators': 1023, 'learning_rate': 0.0881614475570481, 'max_depth': 9, 'min_samples_split': 14, 'min_samples_leaf': 1, 'subsample': 0.6442808061453822, 'max_features': 'sqrt'}. Best is trial 414 with value: 0.21049829021122501.
[I 2024-12-04 12:29:31,912] Trial 426 finished with value: 0.21260905717600598 and parameters: {'n_estimators': 1359, 'learning_rate': 0.09620800088286521, 'max_depth': 12, 'min_samples_split': 14, 'min_samples_leaf': 1, 'subsample': 0.640293440901632, 'max_features': 'sqrt'}. Best is trial 414 with value: 0.21049829021122501.
[I 2024-12-04 12:29:34,402] Trial 431 finished with value: 0.2069782923650487 and parameters: {'n_estimators': 1194, 'learning_rate': 0.08318575192961594, 'max_depth': 11, 'min_samples_split': 16, 'min_samples_leaf': 1, 'subsample': 0.6382272670247529, 'max_features': 'sqrt'}. Best is trial 431 with value: 0.2069782923650487.
[I 2024-12-04 12:29:38,002] Trial 427 finished with value: 0.2511249551616831 and parameters: {'n_estimators': 1402, 'learning_rate': 0.08439825533645552, 'max_depth': 10, 'min_samples_split': 18, 'min_samples_leaf': 4, 'subsample': 0.6188246338804902, 'max_features': 'sqrt'}. Best is trial 431 with value: 0.2069782923650487.
[I 2024-12-04 12:29:40,087] Trial 423 finished with value: 0.2591549386437958 and parameters: {'n_estimators': 1360, 'learning_rate': 0.04919579775189634, 'max_depth': 12, 'min_samples_split': 15, 'min_samples_leaf': 1, 'subsample': 0.8240019332009225, 'max_features': None}. Best is trial 431 with value: 0.2069782923650487.
[I 2024-12-04 12:29:42,118] Trial 432 finished with value: 0.2238939698106117 and parameters: {'n_estimators': 1327, 'learning_rate': 0.067771446642657, 'max_depth': 11, 'min_samples_split': 18, 'min_samples_leaf': 1, 'subsample': 0.6121737134684955, 'max_features': 'sqrt'}. Best is trial 431 with value: 0.2069782923650487.
[I 2024-12-04 12:29:43,619] Trial 429 finished with value: 0.23511226261966559 and parameters: {'n_estimators': 1431, 'learning_rate': 0.07978360762807599, 'max_depth': 7, 'min_samples_split': 19, 'min_samples_leaf': 1, 'subsample': 0.8337602044513311, 'max_features': 'sqrt'}. Best is trial 431 with value: 0.2069782923650487.
[I 2024-12-04 12:29:44,647] Trial 430 finished with value: 0.21624288984032117 and parameters: {'n_estimators': 1398, 'learning_rate': 0.08754945419567682, 'max_depth': 11, 'min_samples_split': 11, 'min_samples_leaf': 1, 'subsample': 0.8307481286764258, 'max_features': 'sqrt'}. Best is trial 431 with value: 0.2069782923650487.
[I 2024-12-04 12:29:53,609] Trial 435 finished with value: 0.2260257114820449 and parameters: {'n_estimators': 1435, 'learning_rate': 0.09448424081993682, 'max_depth': 9, 'min_samples_split': 9, 'min_samples_leaf': 1, 'subsample': 0.8084102060468044, 'max_features': 'sqrt'}. Best is trial 431 with value: 0.2069782923650487.
[I 2024-12-04 12:29:55,457] Trial 437 finished with value: 0.21933117540702127 and parameters: {'n_estimators': 1387, 'learning_rate': 0.09600533265620015, 'max_depth': 10, 'min_samples_split': 17, 'min_samples_leaf': 1, 'subsample': 0.618637264145224, 'max_features': 'sqrt'}. Best is trial 431 with value: 0.2069782923650487.
[I 2024-12-04 12:29:56,442] Trial 443 finished with value: 0.2808667149130701 and parameters: {'n_estimators': 963, 'learning_rate': 0.05201018873995348, 'max_depth': 10, 'min_samples_split': 15, 'min_samples_leaf': 2, 'subsample': 0.6660115265605394, 'max_features': None}. Best is trial 431 with value: 0.2069782923650487.
[I 2024-12-04 12:29:56,986] Trial 453 finished with value: 0.42551419774858146 and parameters: {'n_estimators': 588, 'learning_rate': 0.05700992896530935, 'max_depth': 8, 'min_samples_split': 9, 'min_samples_leaf': 7, 'subsample': 0.9709323799366851, 'max_features': 'log2'}. Best is trial 431 with value: 0.2069782923650487.
[I 2024-12-04 12:29:58,252] Trial 436 finished with value: 0.21623959414205718 and parameters: {'n_estimators': 1440, 'learning_rate': 0.08359015336960725, 'max_depth': 11, 'min_samples_split': 13, 'min_samples_leaf': 1, 'subsample': 0.7575039377641387, 'max_features': 'sqrt'}. Best is trial 431 with value: 0.2069782923650487.
[I 2024-12-04 12:29:59,793] Trial 440 finished with value: 0.2364556044257002 and parameters: {'n_estimators': 1193, 'learning_rate': 0.05255716351360828, 'max_depth': 10, 'min_samples_split': 12, 'min_samples_leaf': 1, 'subsample': 0.7266185493346239, 'max_features': 'sqrt'}. Best is trial 431 with value: 0.2069782923650487.
[I 2024-12-04 12:30:01,539] Trial 442 finished with value: 0.2336144377124484 and parameters: {'n_estimators': 1160, 'learning_rate': 0.03996024297708223, 'max_depth': 12, 'min_samples_split': 9, 'min_samples_leaf': 1, 'subsample': 0.7879877254676003, 'max_features': 'sqrt'}. Best is trial 431 with value: 0.2069782923650487.
[I 2024-12-04 12:30:08,832] Trial 438 finished with value: 0.2369671305815292 and parameters: {'n_estimators': 1463, 'learning_rate': 0.05813819567667842, 'max_depth': 10, 'min_samples_split': 16, 'min_samples_leaf': 2, 'subsample': 0.8249143485094278, 'max_features': 'sqrt'}. Best is trial 431 with value: 0.2069782923650487.
[I 2024-12-04 12:30:11,425] Trial 441 finished with value: 0.2268797374972878 and parameters: {'n_estimators': 1378, 'learning_rate': 0.05328100840950187, 'max_depth': 10, 'min_samples_split': 9, 'min_samples_leaf': 1, 'subsample': 0.7511536152196483, 'max_features': 'sqrt'}. Best is trial 431 with value: 0.2069782923650487.
[I 2024-12-04 12:30:12,553] Trial 439 finished with value: 0.24574404899539998 and parameters: {'n_estimators': 1457, 'learning_rate': 0.09895498541743784, 'max_depth': 12, 'min_samples_split': 10, 'min_samples_leaf': 2, 'subsample': 0.7875996247221775, 'max_features': 'sqrt'}. Best is trial 431 with value: 0.2069782923650487.
[I 2024-12-04 12:30:17,560] Trial 444 finished with value: 0.24533762246817406 and parameters: {'n_estimators': 1329, 'learning_rate': 0.03853515728844176, 'max_depth': 11, 'min_samples_split': 9, 'min_samples_leaf': 2, 'subsample': 0.811429315265391, 'max_features': 'sqrt'}. Best is trial 431 with value: 0.2069782923650487.
[I 2024-12-04 12:30:26,061] Trial 445 finished with value: 0.22291244089426657 and parameters: {'n_estimators': 1445, 'learning_rate': 0.07388425543788389, 'max_depth': 12, 'min_samples_split': 10, 'min_samples_leaf': 1, 'subsample': 0.7236642596833129, 'max_features': 'sqrt'}. Best is trial 431 with value: 0.2069782923650487.
[I 2024-12-04 12:30:32,022] Trial 447 finished with value: 0.273599397195201 and parameters: {'n_estimators': 1399, 'learning_rate': 0.09707589805513588, 'max_depth': 9, 'min_samples_split': 16, 'min_samples_leaf': 3, 'subsample': 0.8205683808145456, 'max_features': 'log2'}. Best is trial 431 with value: 0.2069782923650487.
[I 2024-12-04 12:30:35,208] Trial 446 finished with value: 0.24602019454654805 and parameters: {'n_estimators': 1479, 'learning_rate': 0.028063657100946836, 'max_depth': 12, 'min_samples_split': 8, 'min_samples_leaf': 2, 'subsample': 0.7462108740087608, 'max_features': 'sqrt'}. Best is trial 431 with value: 0.2069782923650487.
[I 2024-12-04 12:30:37,851] Trial 461 finished with value: 0.23609270914076272 and parameters: {'n_estimators': 998, 'learning_rate': 0.0637560872705275, 'max_depth': 12, 'min_samples_split': 11, 'min_samples_leaf': 1, 'subsample': 0.7182744711004915, 'max_features': 'sqrt'}. Best is trial 431 with value: 0.2069782923650487.
[I 2024-12-04 12:30:39,253] Trial 456 finished with value: 0.3639160202664059 and parameters: {'n_estimators': 1134, 'learning_rate': 0.015254237081362233, 'max_depth': 6, 'min_samples_split': 11, 'min_samples_leaf': 6, 'subsample': 0.9594913831181718, 'max_features': 'sqrt'}. Best is trial 431 with value: 0.2069782923650487.
[I 2024-12-04 12:30:40,325] Trial 450 finished with value: 0.22463186859550643 and parameters: {'n_estimators': 1346, 'learning_rate': 0.08240180117473891, 'max_depth': 10, 'min_samples_split': 16, 'min_samples_leaf': 1, 'subsample': 0.7963476274765141, 'max_features': 'sqrt'}. Best is trial 431 with value: 0.2069782923650487.
[I 2024-12-04 12:30:41,694] Trial 467 finished with value: 0.2350248911301838 and parameters: {'n_estimators': 804, 'learning_rate': 0.08292775937424829, 'max_depth': 12, 'min_samples_split': 15, 'min_samples_leaf': 1, 'subsample': 0.7110425189707349, 'max_features': 'sqrt'}. Best is trial 431 with value: 0.2069782923650487.
[I 2024-12-04 12:30:42,061] Trial 448 finished with value: 0.2524419311364482 and parameters: {'n_estimators': 1479, 'learning_rate': 0.028012991373174374, 'max_depth': 11, 'min_samples_split': 12, 'min_samples_leaf': 2, 'subsample': 0.6306777347053568, 'max_features': 'sqrt'}. Best is trial 431 with value: 0.2069782923650487.
[I 2024-12-04 12:30:43,169] Trial 458 finished with value: 0.25015092615169493 and parameters: {'n_estimators': 1146, 'learning_rate': 0.08842147950200405, 'max_depth': 11, 'min_samples_split': 13, 'min_samples_leaf': 3, 'subsample': 0.7278632643479716, 'max_features': 'sqrt'}. Best is trial 431 with value: 0.2069782923650487.
[I 2024-12-04 12:30:43,492] Trial 451 finished with value: 0.27965046204672867 and parameters: {'n_estimators': 1371, 'learning_rate': 0.04839311456324315, 'max_depth': 12, 'min_samples_split': 11, 'min_samples_leaf': 5, 'subsample': 0.6774928921103835, 'max_features': 'sqrt'}. Best is trial 431 with value: 0.2069782923650487.
[I 2024-12-04 12:30:49,102] Trial 455 finished with value: 0.2595507391226512 and parameters: {'n_estimators': 1356, 'learning_rate': 0.05467846441284568, 'max_depth': 9, 'min_samples_split': 9, 'min_samples_leaf': 3, 'subsample': 0.6970912678362423, 'max_features': 'sqrt'}. Best is trial 431 with value: 0.2069782923650487.
[I 2024-12-04 12:30:49,119] Trial 459 finished with value: 0.2332327966311575 and parameters: {'n_estimators': 1233, 'learning_rate': 0.066882250431359, 'max_depth': 11, 'min_samples_split': 11, 'min_samples_leaf': 1, 'subsample': 0.7244682557334042, 'max_features': 'sqrt'}. Best is trial 431 with value: 0.2069782923650487.
[I 2024-12-04 12:30:53,951] Trial 460 finished with value: 0.32765746717718025 and parameters: {'n_estimators': 1321, 'learning_rate': 0.044540201990473066, 'max_depth': 4, 'min_samples_split': 9, 'min_samples_leaf': 5, 'subsample': 0.6111103205822992, 'max_features': 'sqrt'}. Best is trial 431 with value: 0.2069782923650487.
[I 2024-12-04 12:30:54,063] Trial 452 finished with value: 0.26413834998659014 and parameters: {'n_estimators': 1483, 'learning_rate': 0.09672265955807786, 'max_depth': 7, 'min_samples_split': 9, 'min_samples_leaf': 1, 'subsample': 0.7203804598199561, 'max_features': 'log2'}. Best is trial 431 with value: 0.2069782923650487.
[I 2024-12-04 12:30:55,519] Trial 454 finished with value: 0.2290336065772446 and parameters: {'n_estimators': 1478, 'learning_rate': 0.09488724807799462, 'max_depth': 10, 'min_samples_split': 14, 'min_samples_leaf': 1, 'subsample': 0.7170210467990797, 'max_features': 'sqrt'}. Best is trial 431 with value: 0.2069782923650487.
[I 2024-12-04 12:30:55,523] Trial 464 finished with value: 0.24874260189837968 and parameters: {'n_estimators': 1121, 'learning_rate': 0.07590294052092324, 'max_depth': 12, 'min_samples_split': 5, 'min_samples_leaf': 4, 'subsample': 0.72662839360098, 'max_features': 'sqrt'}. Best is trial 431 with value: 0.2069782923650487.
[I 2024-12-04 12:30:57,492] Trial 462 finished with value: 0.23866406004895271 and parameters: {'n_estimators': 1297, 'learning_rate': 0.09497325831575348, 'max_depth': 12, 'min_samples_split': 17, 'min_samples_leaf': 2, 'subsample': 0.6743794081938648, 'max_features': 'sqrt'}. Best is trial 431 with value: 0.2069782923650487.
[I 2024-12-04 12:30:58,525] Trial 463 finished with value: 0.21965709966689992 and parameters: {'n_estimators': 1232, 'learning_rate': 0.0996935901584831, 'max_depth': 12, 'min_samples_split': 12, 'min_samples_leaf': 2, 'subsample': 0.6954168763685317, 'max_features': 'sqrt'}. Best is trial 431 with value: 0.2069782923650487.
[I 2024-12-04 12:30:58,529] Trial 457 finished with value: 0.2584873735310641 and parameters: {'n_estimators': 1410, 'learning_rate': 0.06381372777455158, 'max_depth': 12, 'min_samples_split': 2, 'min_samples_leaf': 1, 'subsample': 0.770427795236589, 'max_features': 'sqrt'}. Best is trial 431 with value: 0.2069782923650487.
[I 2024-12-04 12:31:04,921] Trial 468 finished with value: 0.24976511801447684 and parameters: {'n_estimators': 1113, 'learning_rate': 0.0996916565801653, 'max_depth': 11, 'min_samples_split': 10, 'min_samples_leaf': 2, 'subsample': 0.648887610980254, 'max_features': 'sqrt'}. Best is trial 431 with value: 0.2069782923650487.
