[I 2024-12-04 14:57:38,638] Trial 301 finished with value: 0.4883034029059683 and parameters: {'kernel_type': 'Matern', 'length_scale': 1.7620028056759394, 'noise_level': 0.8550716649167356, 'constant_value': 955.7463075871565, 'nu': 0.5}. Best is trial 149 with value: 0.48830133927701114.
[I 2024-12-04 14:57:38,978] Trial 303 finished with value: 0.48830340640026637 and parameters: {'kernel_type': 'Matern', 'length_scale': 0.09827254481214168, 'noise_level': 0.9760636089312296, 'constant_value': 485.47235166868364, 'nu': 0.5}. Best is trial 149 with value: 0.48830133927701114.
[I 2024-12-04 14:57:39,638] Trial 302 finished with value: 0.4883034203847209 and parameters: {'kernel_type': 'Matern', 'length_scale': 27835.73964620073, 'noise_level': 0.0010912530745215588, 'constant_value': 36150.24115359312, 'nu': 0.5}. Best is trial 149 with value: 0.48830133927701114.
[I 2024-12-04 14:57:39,857] Trial 306 finished with value: 1.2401112325498151 and parameters: {'kernel_type': 'RBF', 'length_scale': 0.00032803047127598817, 'noise_level': 2.761465371942761e-10, 'constant_value': 0.49315041539666304, 'nu': 1.5}. Best is trial 149 with value: 0.48830133927701114.
[I 2024-12-04 14:57:39,908] Trial 305 finished with value: 1.2401112325824504 and parameters: {'kernel_type': 'Matern', 'length_scale': 67640.72313743073, 'noise_level': 0.038959245707813665, 'constant_value': 71429.51471861907, 'nu': 1.5}. Best is trial 149 with value: 0.48830133927701114.
[I 2024-12-04 14:57:41,407] Trial 311 finished with value: 1.2614547953941473 and parameters: {'kernel_type': 'Matern', 'length_scale': 3110.1362269846854, 'noise_level': 0.02283348563571809, 'constant_value': 70265.9182894412, 'nu': 0.5}. Best is trial 149 with value: 0.48830133927701114.
[I 2024-12-04 14:57:41,457] Trial 300 finished with value: 0.48830341033003755 and parameters: {'kernel_type': 'Matern', 'length_scale': 5828.626670663969, 'noise_level': 0.548161108261491, 'constant_value': 39582.48740311162, 'nu': 0.5}. Best is trial 149 with value: 0.48830133927701114.
[I 2024-12-04 14:57:41,555] Trial 307 finished with value: 0.488303412743546 and parameters: {'kernel_type': 'Matern', 'length_scale': 1.0612114464745643, 'noise_level': 0.09246961517916617, 'constant_value': 34348.64145569668, 'nu': 0.5}. Best is trial 149 with value: 0.48830133927701114.
[I 2024-12-04 14:57:41,944] Trial 304 finished with value: 1.2401112325728743 and parameters: {'kernel_type': 'Matern', 'length_scale': 0.01230344374478199, 'noise_level': 0.22567440961250673, 'constant_value': 86859.99943894437, 'nu': 0.5}. Best is trial 149 with value: 0.48830133927701114.
[I 2024-12-04 14:57:44,065] Trial 309 finished with value: 0.4883035052283959 and parameters: {'kernel_type': 'Matern', 'length_scale': 13.752516439427964, 'noise_level': 0.00234888811500027, 'constant_value': 11176.554897660988, 'nu': 0.5}. Best is trial 149 with value: 0.48830133927701114.
[I 2024-12-04 14:57:44,934] Trial 320 finished with value: 1.2614543702023575 and parameters: {'kernel_type': 'Matern', 'length_scale': 0.0003179791235292708, 'noise_level': 0.9228737376954763, 'constant_value': 3.9586060217731725e-07, 'nu': 0.5}. Best is trial 149 with value: 0.48830133927701114.
[I 2024-12-04 14:57:45,175] Trial 312 finished with value: 0.4883034188029046 and parameters: {'kernel_type': 'Matern', 'length_scale': 31322.259959304803, 'noise_level': 0.5526807520811937, 'constant_value': 84316.91282195627, 'nu': 0.5}. Best is trial 149 with value: 0.48830133927701114.
[I 2024-12-04 14:57:45,931] Trial 314 finished with value: 0.48830348851336947 and parameters: {'kernel_type': 'Matern', 'length_scale': 89853.67225711238, 'noise_level': 0.019898323242645146, 'constant_value': 7790.567030127533, 'nu': 0.5}. Best is trial 149 with value: 0.48830133927701114.
[I 2024-12-04 14:57:46,063] Trial 323 finished with value: 0.4883034199691033 and parameters: {'kernel_type': 'Matern', 'length_scale': 41774.77214398713, 'noise_level': 0.5242341330628293, 'constant_value': 247.96240143464817, 'nu': 0.5}. Best is trial 149 with value: 0.48830133927701114.
[I 2024-12-04 14:57:46,940] Trial 318 finished with value: 0.48830343211125066 and parameters: {'kernel_type': 'Matern', 'length_scale': 99621.39119740226, 'noise_level': 0.045565419589122524, 'constant_value': 1406.8379708386472, 'nu': 0.5}. Best is trial 149 with value: 0.48830133927701114.
[I 2024-12-04 14:57:47,140] Trial 319 finished with value: 1.2614529808281463 and parameters: {'kernel_type': 'RBF', 'length_scale': 4.9449093570918985e-05, 'noise_level': 0.0008864489413901098, 'constant_value': 0.015099195810553032, 'nu': 0.5}. Best is trial 149 with value: 0.48830133927701114.
[I 2024-12-04 14:57:47,246] Trial 308 finished with value: 0.4883034208230775 and parameters: {'kernel_type': 'Matern', 'length_scale': 11120.759368697725, 'noise_level': 0.015647230060311886, 'constant_value': 64365.08162775449, 'nu': 0.5}. Best is trial 149 with value: 0.48830133927701114.
[I 2024-12-04 14:57:48,158] Trial 326 finished with value: 0.4883034259867099 and parameters: {'kernel_type': 'Matern', 'length_scale': 21.23740175955114, 'noise_level': 0.05410708801113369, 'constant_value': 3494.2944784962187, 'nu': 0.5}. Best is trial 149 with value: 0.48830133927701114.
[I 2024-12-04 14:57:48,162] Trial 316 finished with value: 0.488303418578012 and parameters: {'kernel_type': 'Matern', 'length_scale': 13.361837262931454, 'noise_level': 0.012928613817177173, 'constant_value': 95267.74017823105, 'nu': 0.5}. Best is trial 149 with value: 0.48830133927701114.
[I 2024-12-04 14:57:50,229] Trial 331 finished with value: 0.4883034182714762 and parameters: {'kernel_type': 'Matern', 'length_scale': 95698.94405353139, 'noise_level': 0.3056462057415514, 'constant_value': 26117.473981094055, 'nu': 0.5}. Best is trial 149 with value: 0.48830133927701114.
[I 2024-12-04 14:57:50,533] Trial 317 finished with value: 0.4883034225644161 and parameters: {'kernel_type': 'Matern', 'length_scale': 45.420963975879324, 'noise_level': 0.2828230388364225, 'constant_value': 82930.9099089778, 'nu': 0.5}. Best is trial 149 with value: 0.48830133927701114.
[I 2024-12-04 14:57:51,864] Trial 310 finished with value: 0.4883034153207737 and parameters: {'kernel_type': 'Matern', 'length_scale': 1.5207257733637078, 'noise_level': 0.07253100702711464, 'constant_value': 745.4630524448363, 'nu': 0.5}. Best is trial 149 with value: 0.48830133927701114.
[I 2024-12-04 14:57:52,400] Trial 325 finished with value: 0.5273056470126858 and parameters: {'kernel_type': 'Matern', 'length_scale': 0.525822089846839, 'noise_level': 0.44574604800251977, 'constant_value': 1.6148204981409464, 'nu': 1.5}. Best is trial 149 with value: 0.48830133927701114.
[I 2024-12-04 14:57:52,885] Trial 322 finished with value: 1.2401112325528048 and parameters: {'kernel_type': 'Matern', 'length_scale': 5057.556485116367, 'noise_level': 0.00011130224395400572, 'constant_value': 192.3000362233195, 'nu': 0.5}. Best is trial 149 with value: 0.48830133927701114.
[I 2024-12-04 14:57:53,260] Trial 315 finished with value: 0.6443853539632306 and parameters: {'kernel_type': 'RBF', 'length_scale': 0.26366326458895034, 'noise_level': 1.516506887825589e-07, 'constant_value': 0.003247540206349975, 'nu': 2.5}. Best is trial 149 with value: 0.48830133927701114.
[I 2024-12-04 14:57:53,520] Trial 327 finished with value: 0.4883034232163732 and parameters: {'kernel_type': 'Matern', 'length_scale': 98789.80379773358, 'noise_level': 0.025282161025388366, 'constant_value': 35186.7512962639, 'nu': 0.5}. Best is trial 149 with value: 0.48830133927701114.
[I 2024-12-04 14:57:53,824] Trial 328 finished with value: 0.5663937773728412 and parameters: {'kernel_type': 'Matern', 'length_scale': 221.82203786229533, 'noise_level': 0.04985628393698413, 'constant_value': 9078.450868016072, 'nu': 2.5}. Best is trial 149 with value: 0.48830133927701114.
[I 2024-12-04 14:57:55,933] Trial 321 finished with value: 0.48830335113731405 and parameters: {'kernel_type': 'Matern', 'length_scale': 83.73474243955974, 'noise_level': 0.22438291432385352, 'constant_value': 0.673177351280731, 'nu': 0.5}. Best is trial 149 with value: 0.48830133927701114.
[I 2024-12-04 14:57:56,746] Trial 324 finished with value: 0.4883032551352258 and parameters: {'kernel_type': 'Matern', 'length_scale': 318.4120388449987, 'noise_level': 0.008858876662641912, 'constant_value': 598.9991581728694, 'nu': 0.5}. Best is trial 149 with value: 0.48830133927701114.
[I 2024-12-04 14:57:56,788] Trial 337 finished with value: 0.4883035421029458 and parameters: {'kernel_type': 'Matern', 'length_scale': 5999.833903397277, 'noise_level': 0.021185308646166672, 'constant_value': 78399.73846066465, 'nu': 0.5}. Best is trial 149 with value: 0.48830133927701114.
[I 2024-12-04 14:57:58,131] Trial 330 finished with value: 0.6443854064731868 and parameters: {'kernel_type': 'RBF', 'length_scale': 0.3222293302908242, 'noise_level': 0.06597247182815602, 'constant_value': 80.22946697347733, 'nu': 0.5}. Best is trial 149 with value: 0.48830133927701114.
[I 2024-12-04 14:57:58,246] Trial 329 finished with value: 0.4883053262132758 and parameters: {'kernel_type': 'Matern', 'length_scale': 324.7832312917772, 'noise_level': 0.0009869329571534436, 'constant_value': 1384.8792669086095, 'nu': 0.5}. Best is trial 149 with value: 0.48830133927701114.
[I 2024-12-04 14:57:58,445] Trial 313 finished with value: 0.6443887182111364 and parameters: {'kernel_type': 'RBF', 'length_scale': 26810.204891284204, 'noise_level': 0.6126671991888358, 'constant_value': 76412.48373153956, 'nu': 0.5}. Best is trial 149 with value: 0.48830133927701114.
[I 2024-12-04 14:57:59,242] Trial 339 finished with value: 0.48830338319527294 and parameters: {'kernel_type': 'Matern', 'length_scale': 1629.447774269504, 'noise_level': 0.946402173557651, 'constant_value': 1024.3644945447143, 'nu': 0.5}. Best is trial 149 with value: 0.48830133927701114.
[I 2024-12-04 14:57:59,937] Trial 336 finished with value: 0.48830343304318874 and parameters: {'kernel_type': 'Matern', 'length_scale': 45.37189649801833, 'noise_level': 0.33859444472275435, 'constant_value': 3.0189442246138936, 'nu': 0.5}. Best is trial 149 with value: 0.48830133927701114.
[I 2024-12-04 14:58:00,766] Trial 332 finished with value: 0.5273053791412741 and parameters: {'kernel_type': 'Matern', 'length_scale': 0.6447081247471077, 'noise_level': 8.554192493610146e-10, 'constant_value': 0.0003021485936545471, 'nu': 1.5}. Best is trial 149 with value: 0.48830133927701114.
[I 2024-12-04 14:58:01,100] Trial 341 finished with value: 0.4883034191717383 and parameters: {'kernel_type': 'Matern', 'length_scale': 2590.015965047828, 'noise_level': 0.9039505147862328, 'constant_value': 47775.576567936485, 'nu': 0.5}. Best is trial 149 with value: 0.48830133927701114.
[I 2024-12-04 14:58:01,493] Trial 334 finished with value: 1.2614547953941475 and parameters: {'kernel_type': 'Matern', 'length_scale': 40.088612741927264, 'noise_level': 0.02551075702863711, 'constant_value': 74.06583218270457, 'nu': 0.5}. Best is trial 149 with value: 0.48830133927701114.
[I 2024-12-04 14:58:01,944] Trial 338 finished with value: 1.2401112327015236 and parameters: {'kernel_type': 'Matern', 'length_scale': 46.24708652990433, 'noise_level': 0.002314406826543044, 'constant_value': 0.06231443075583301, 'nu': 0.5}. Best is trial 149 with value: 0.48830133927701114.
[I 2024-12-04 14:58:02,082] Trial 333 finished with value: 0.4883034590746281 and parameters: {'kernel_type': 'Matern', 'length_scale': 55.38558321898226, 'noise_level': 0.015383112140471026, 'constant_value': 57.54208129642624, 'nu': 0.5}. Best is trial 149 with value: 0.48830133927701114.
[I 2024-12-04 14:58:02,361] Trial 335 finished with value: 0.48830340937914557 and parameters: {'kernel_type': 'Matern', 'length_scale': 1265.5413270144493, 'noise_level': 0.010677599304719272, 'constant_value': 96.94378426218141, 'nu': 0.5}. Best is trial 149 with value: 0.48830133927701114.
[I 2024-12-04 14:58:04,001] Trial 342 finished with value: 1.240111232167153 and parameters: {'kernel_type': 'RBF', 'length_scale': 75859.90667323221, 'noise_level': 1.5996002987086912e-06, 'constant_value': 0.0010893198971023534, 'nu': 0.5}. Best is trial 149 with value: 0.48830133927701114.
[I 2024-12-04 14:58:04,269] Trial 345 finished with value: 0.48830347524419027 and parameters: {'kernel_type': 'Matern', 'length_scale': 8.921080312513563, 'noise_level': 0.26031643029551693, 'constant_value': 0.7623938352743764, 'nu': 0.5}. Best is trial 149 with value: 0.48830133927701114.
[I 2024-12-04 14:58:04,480] Trial 340 finished with value: 0.4883032533641432 and parameters: {'kernel_type': 'Matern', 'length_scale': 15.657755393938437, 'noise_level': 0.018639072996872612, 'constant_value': 0.23960285396304457, 'nu': 0.5}. Best is trial 149 with value: 0.48830133927701114.
[I 2024-12-04 14:58:04,715] Trial 351 finished with value: 0.4883033476490191 and parameters: {'kernel_type': 'Matern', 'length_scale': 316.8911699033656, 'noise_level': 0.6019196833017837, 'constant_value': 0.21060931599256902, 'nu': 0.5}. Best is trial 149 with value: 0.48830133927701114.
[I 2024-12-04 14:58:05,603] Trial 346 finished with value: 0.5273054583128509 and parameters: {'kernel_type': 'Matern', 'length_scale': 182.9591845877847, 'noise_level': 0.002121019002058735, 'constant_value': 3948.1227739559777, 'nu': 1.5}. Best is trial 149 with value: 0.48830133927701114.
[I 2024-12-04 14:58:05,819] Trial 350 finished with value: 1.261454797635082 and parameters: {'kernel_type': 'RBF', 'length_scale': 97666.04320883338, 'noise_level': 2.4972157060734355e-07, 'constant_value': 1.838872855919333e-05, 'nu': 1.5}. Best is trial 149 with value: 0.48830133927701114.
[I 2024-12-04 14:58:06,818] Trial 349 finished with value: 0.4883034233751306 and parameters: {'kernel_type': 'Matern', 'length_scale': 1772.8641045246193, 'noise_level': 0.005620599611788105, 'constant_value': 1048.3343875004775, 'nu': 0.5}. Best is trial 149 with value: 0.48830133927701114.
[I 2024-12-04 14:58:07,056] Trial 348 finished with value: 0.4883034041358665 and parameters: {'kernel_type': 'Matern', 'length_scale': 2268.227666682801, 'noise_level': 0.0016785861917168272, 'constant_value': 854.404870619983, 'nu': 0.5}. Best is trial 149 with value: 0.48830133927701114.
[I 2024-12-04 14:58:07,069] Trial 347 finished with value: 0.48830342742640365 and parameters: {'kernel_type': 'Matern', 'length_scale': 1062.8277978151243, 'noise_level': 0.004924755335087768, 'constant_value': 657.4212572593393, 'nu': 0.5}. Best is trial 149 with value: 0.48830133927701114.
[I 2024-12-04 14:58:08,076] Trial 344 finished with value: 0.48830328140487833 and parameters: {'kernel_type': 'Matern', 'length_scale': 15785.411367535256, 'noise_level': 0.018083664114834325, 'constant_value': 99909.63846299144, 'nu': 0.5}. Best is trial 149 with value: 0.48830133927701114.
[I 2024-12-04 14:58:08,545] Trial 355 finished with value: 1.2401112320993146 and parameters: {'kernel_type': 'Matern', 'length_scale': 14.167967316379864, 'noise_level': 0.0063728920070224016, 'constant_value': 0.06220625579581641, 'nu': 0.5}. Best is trial 149 with value: 0.48830133927701114.
[I 2024-12-04 14:58:09,909] Trial 361 finished with value: 1.2614186637359786 and parameters: {'kernel_type': 'Matern', 'length_scale': 182.0262897826023, 'noise_level': 0.007159411421688615, 'constant_value': 0.004834733077004937, 'nu': 0.5}. Best is trial 149 with value: 0.48830133927701114.
[I 2024-12-04 14:58:09,911] Trial 353 finished with value: 0.4883034201855635 and parameters: {'kernel_type': 'Matern', 'length_scale': 64976.195661083504, 'noise_level': 0.4082755063753192, 'constant_value': 4023.1052686284033, 'nu': 0.5}. Best is trial 149 with value: 0.48830133927701114.
[I 2024-12-04 14:58:10,244] Trial 352 finished with value: 0.48830341917648773 and parameters: {'kernel_type': 'Matern', 'length_scale': 1.7468027048026085, 'noise_level': 0.008260508125393418, 'constant_value': 0.10096700001716445, 'nu': 0.5}. Best is trial 149 with value: 0.48830133927701114.
[I 2024-12-04 14:58:10,281] Trial 343 finished with value: 0.6443853265917519 and parameters: {'kernel_type': 'RBF', 'length_scale': 483.20819871168425, 'noise_level': 0.18991713228036927, 'constant_value': 370.99895310910443, 'nu': 2.5}. Best is trial 149 with value: 0.48830133927701114.
[I 2024-12-04 14:58:10,585] Trial 354 finished with value: 1.2401112327149746 and parameters: {'kernel_type': 'Matern', 'length_scale': 3.108724739095153e-05, 'noise_level': 2.114414039883064e-06, 'constant_value': 0.023464711096836833, 'nu': 1.5}. Best is trial 149 with value: 0.48830133927701114.
[I 2024-12-04 14:58:11,305] Trial 356 finished with value: 0.4883034789555495 and parameters: {'kernel_type': 'Matern', 'length_scale': 16.695975453667607, 'noise_level': 0.3404107748725257, 'constant_value': 0.04059425638407482, 'nu': 0.5}. Best is trial 149 with value: 0.48830133927701114.
[I 2024-12-04 14:58:13,964] Trial 357 finished with value: 0.48830341959324836 and parameters: {'kernel_type': 'Matern', 'length_scale': 44.17697284314752, 'noise_level': 0.21071499672062344, 'constant_value': 1.4906120602961945, 'nu': 0.5}. Best is trial 149 with value: 0.48830133927701114.
[I 2024-12-04 14:58:14,327] Trial 358 finished with value: 1.2401112325782149 and parameters: {'kernel_type': 'Matern', 'length_scale': 73334.97936449313, 'noise_level': 0.001892898236861032, 'constant_value': 61025.84480794208, 'nu': 2.5}. Best is trial 149 with value: 0.48830133927701114.
[I 2024-12-04 14:58:15,787] Trial 365 finished with value: 1.240111232578161 and parameters: {'kernel_type': 'Matern', 'length_scale': 3260.6985317068907, 'noise_level': 0.03583135293689634, 'constant_value': 0.7259516257678036, 'nu': 0.5}. Best is trial 149 with value: 0.48830133927701114.
[I 2024-12-04 14:58:16,237] Trial 368 finished with value: 0.4883035153420236 and parameters: {'kernel_type': 'Matern', 'length_scale': 51.486615919024594, 'noise_level': 0.4666661190041736, 'constant_value': 31.846355203032946, 'nu': 0.5}. Best is trial 149 with value: 0.48830133927701114.
[I 2024-12-04 14:58:17,203] Trial 360 finished with value: 0.48830339779891285 and parameters: {'kernel_type': 'Matern', 'length_scale': 100.96199052708806, 'noise_level': 0.04388843499818425, 'constant_value': 0.35653449772486684, 'nu': 0.5}. Best is trial 149 with value: 0.48830133927701114.
[I 2024-12-04 14:58:17,473] Trial 363 finished with value: 0.4883033063621391 and parameters: {'kernel_type': 'Matern', 'length_scale': 442.2872337267393, 'noise_level': 0.2567827074231198, 'constant_value': 0.010299164474710373, 'nu': 0.5}. Best is trial 149 with value: 0.48830133927701114.
[I 2024-12-04 14:58:17,919] Trial 370 finished with value: 0.4883034168187302 and parameters: {'kernel_type': 'Matern', 'length_scale': 164.49467108723803, 'noise_level': 0.11889831367637646, 'constant_value': 0.022173748444533552, 'nu': 0.5}. Best is trial 149 with value: 0.48830133927701114.
[I 2024-12-04 14:58:18,744] Trial 362 finished with value: 1.2614547976351718 and parameters: {'kernel_type': 'Matern', 'length_scale': 28944.76843798173, 'noise_level': 8.372340096506372e-05, 'constant_value': 1.0481975423729422e-05, 'nu': 1.5}. Best is trial 149 with value: 0.48830133927701114.
[I 2024-12-04 14:58:18,834] Trial 359 finished with value: 0.566393783897352 and parameters: {'kernel_type': 'Matern', 'length_scale': 343.9639589584918, 'noise_level': 0.26754740330386795, 'constant_value': 90.36644661407246, 'nu': 2.5}. Best is trial 149 with value: 0.48830133927701114.
[I 2024-12-04 14:58:20,404] Trial 364 finished with value: 0.4883034157329936 and parameters: {'kernel_type': 'Matern', 'length_scale': 34328.31251692486, 'noise_level': 0.0005412774154266073, 'constant_value': 12242.911117244696, 'nu': 0.5}. Best is trial 149 with value: 0.48830133927701114.
[I 2024-12-04 14:58:20,687] Trial 372 finished with value: 1.2401112329732866 and parameters: {'kernel_type': 'Matern', 'length_scale': 2.3717745455472508, 'noise_level': 0.00019716112421604715, 'constant_value': 0.0039928876166545535, 'nu': 0.5}. Best is trial 149 with value: 0.48830133927701114.
[I 2024-12-04 14:58:21,010] Trial 374 finished with value: 0.48830348332266954 and parameters: {'kernel_type': 'Matern', 'length_scale': 1169.1050911359437, 'noise_level': 0.9304351891989185, 'constant_value': 10.325919153024893, 'nu': 0.5}. Best is trial 149 with value: 0.48830133927701114.
[I 2024-12-04 14:58:21,265] Trial 371 finished with value: 0.4883034191911937 and parameters: {'kernel_type': 'Matern', 'length_scale': 549.2355863299047, 'noise_level': 0.004212501382951825, 'constant_value': 46096.35079299099, 'nu': 0.5}. Best is trial 149 with value: 0.48830133927701114.
[I 2024-12-04 14:58:21,861] Trial 366 finished with value: 1.2614263551468632 and parameters: {'kernel_type': 'Matern', 'length_scale': 87.04105861788679, 'noise_level': 0.8678093414205915, 'constant_value': 9.985349080364352e-05, 'nu': 0.5}. Best is trial 149 with value: 0.48830133927701114.
[I 2024-12-04 14:58:21,999] Trial 376 finished with value: 0.4883033999844911 and parameters: {'kernel_type': 'Matern', 'length_scale': 157.19916406612037, 'noise_level': 0.7780630927151772, 'constant_value': 0.07388492252513719, 'nu': 0.5}. Best is trial 149 with value: 0.48830133927701114.
[I 2024-12-04 14:58:22,521] Trial 377 finished with value: 0.4883035562548158 and parameters: {'kernel_type': 'Matern', 'length_scale': 50.438625457442186, 'noise_level': 0.005643191463275869, 'constant_value': 0.9492170446976295, 'nu': 0.5}. Best is trial 149 with value: 0.48830133927701114.
[I 2024-12-04 14:58:23,280] Trial 379 finished with value: 1.2614543695939204 and parameters: {'kernel_type': 'Matern', 'length_scale': 0.1471387709331717, 'noise_level': 4.6072564927736015e-05, 'constant_value': 25939.759437240904, 'nu': 1.5}. Best is trial 149 with value: 0.48830133927701114.
