[I 2024-12-04 12:27:50,254] Trial 735 finished with value: 0.3795129809141052 and parameters: {'n_estimators': 1324, 'learning_rate': 0.03101019096312968, 'max_depth': 7, 'min_samples_split': 8, 'min_samples_leaf': 3, 'subsample': 0.7843467309072338, 'max_features': None}. Best is trial 428 with value: 0.31740361133065975.
[I 2024-12-04 12:27:50,612] Trial 737 finished with value: 0.32540665667468804 and parameters: {'n_estimators': 1173, 'learning_rate': 0.06528798655512086, 'max_depth': 7, 'min_samples_split': 5, 'min_samples_leaf': 2, 'subsample': 0.6708924964116934, 'max_features': None}. Best is trial 428 with value: 0.31740361133065975.
[I 2024-12-04 12:27:50,987] Trial 736 finished with value: 0.3784328687365008 and parameters: {'n_estimators': 1288, 'learning_rate': 0.03788380087688942, 'max_depth': 9, 'min_samples_split': 2, 'min_samples_leaf': 3, 'subsample': 0.6080316848348558, 'max_features': None}. Best is trial 428 with value: 0.31740361133065975.
[I 2024-12-04 12:27:51,577] Trial 750 finished with value: 0.40564402231424074 and parameters: {'n_estimators': 769, 'learning_rate': 0.03328954717637343, 'max_depth': 5, 'min_samples_split': 7, 'min_samples_leaf': 1, 'subsample': 0.7294832330355557, 'max_features': None}. Best is trial 428 with value: 0.31740361133065975.
[I 2024-12-04 12:27:51,592] Trial 742 finished with value: 0.4255918880429693 and parameters: {'n_estimators': 881, 'learning_rate': 0.03234908324314136, 'max_depth': 12, 'min_samples_split': 3, 'min_samples_leaf': 8, 'subsample': 0.9738495691508325, 'max_features': None}. Best is trial 428 with value: 0.31740361133065975.
[I 2024-12-04 12:27:52,191] Trial 743 finished with value: 0.4346675458724452 and parameters: {'n_estimators': 1110, 'learning_rate': 0.09304033375643038, 'max_depth': 3, 'min_samples_split': 4, 'min_samples_leaf': 1, 'subsample': 0.9721021875666949, 'max_features': 'log2'}. Best is trial 428 with value: 0.31740361133065975.
[I 2024-12-04 12:27:53,343] Trial 741 finished with value: 0.418590473384677 and parameters: {'n_estimators': 1124, 'learning_rate': 0.05197140315735147, 'max_depth': 4, 'min_samples_split': 2, 'min_samples_leaf': 3, 'subsample': 0.7330035580320761, 'max_features': None}. Best is trial 428 with value: 0.31740361133065975.
[I 2024-12-04 12:27:53,358] Trial 768 finished with value: 0.7206739782074644 and parameters: {'n_estimators': 144, 'learning_rate': 0.05125906094177261, 'max_depth': 12, 'min_samples_split': 4, 'min_samples_leaf': 10, 'subsample': 0.8911098166878242, 'max_features': 'sqrt'}. Best is trial 428 with value: 0.31740361133065975.
[I 2024-12-04 12:27:53,877] Trial 751 finished with value: 0.8539150678526433 and parameters: {'n_estimators': 879, 'learning_rate': 0.01082568156494093, 'max_depth': 5, 'min_samples_split': 18, 'min_samples_leaf': 6, 'subsample': 0.7208363452193884, 'max_features': 'log2'}. Best is trial 428 with value: 0.31740361133065975.
[I 2024-12-04 12:27:57,399] Trial 740 finished with value: 0.3824106928014869 and parameters: {'n_estimators': 1018, 'learning_rate': 0.09052175211768682, 'max_depth': 5, 'min_samples_split': 10, 'min_samples_leaf': 3, 'subsample': 0.8859345300295545, 'max_features': None}. Best is trial 428 with value: 0.31740361133065975.
[I 2024-12-04 12:27:58,100] Trial 757 finished with value: 0.3883058945412094 and parameters: {'n_estimators': 690, 'learning_rate': 0.05125472545926307, 'max_depth': 6, 'min_samples_split': 2, 'min_samples_leaf': 1, 'subsample': 0.7030788666704718, 'max_features': None}. Best is trial 428 with value: 0.31740361133065975.
[I 2024-12-04 12:27:59,002] Trial 770 finished with value: 0.7627308308103866 and parameters: {'n_estimators': 198, 'learning_rate': 0.018876654964620265, 'max_depth': 8, 'min_samples_split': 12, 'min_samples_leaf': 1, 'subsample': 0.980573224732995, 'max_features': 'log2'}. Best is trial 428 with value: 0.31740361133065975.
[I 2024-12-04 12:27:59,448] Trial 748 finished with value: 0.3427924094831667 and parameters: {'n_estimators': 904, 'learning_rate': 0.041279932228382304, 'max_depth': 7, 'min_samples_split': 7, 'min_samples_leaf': 2, 'subsample': 0.7119282992111624, 'max_features': None}. Best is trial 428 with value: 0.31740361133065975.
[I 2024-12-04 12:28:00,429] Trial 752 finished with value: 0.33043440164488097 and parameters: {'n_estimators': 1035, 'learning_rate': 0.09888456100831534, 'max_depth': 5, 'min_samples_split': 3, 'min_samples_leaf': 2, 'subsample': 0.8926139878340006, 'max_features': None}. Best is trial 428 with value: 0.31740361133065975.
[I 2024-12-04 12:28:01,634] Trial 746 finished with value: 0.3696682725400532 and parameters: {'n_estimators': 1094, 'learning_rate': 0.03804166902261131, 'max_depth': 9, 'min_samples_split': 7, 'min_samples_leaf': 4, 'subsample': 0.6050307079338696, 'max_features': None}. Best is trial 428 with value: 0.31740361133065975.
[I 2024-12-04 12:28:02,217] Trial 739 finished with value: 0.39074070770470765 and parameters: {'n_estimators': 1451, 'learning_rate': 0.051062772135565086, 'max_depth': 7, 'min_samples_split': 2, 'min_samples_leaf': 3, 'subsample': 0.7362540941330602, 'max_features': None}. Best is trial 428 with value: 0.31740361133065975.
[I 2024-12-04 12:28:02,460] Trial 738 finished with value: 0.3843325070952757 and parameters: {'n_estimators': 1476, 'learning_rate': 0.0661764865854292, 'max_depth': 7, 'min_samples_split': 3, 'min_samples_leaf': 3, 'subsample': 0.8427081559483139, 'max_features': None}. Best is trial 428 with value: 0.31740361133065975.
[I 2024-12-04 12:28:02,989] Trial 745 finished with value: 0.3827955708589273 and parameters: {'n_estimators': 1228, 'learning_rate': 0.07202435699748772, 'max_depth': 7, 'min_samples_split': 9, 'min_samples_leaf': 1, 'subsample': 0.881901619560239, 'max_features': None}. Best is trial 428 with value: 0.31740361133065975.
[I 2024-12-04 12:28:05,085] Trial 763 finished with value: 0.33221587142004566 and parameters: {'n_estimators': 899, 'learning_rate': 0.04262318798446033, 'max_depth': 7, 'min_samples_split': 4, 'min_samples_leaf': 2, 'subsample': 0.718719627644461, 'max_features': None}. Best is trial 428 with value: 0.31740361133065975.
[I 2024-12-04 12:28:05,348] Trial 753 finished with value: 0.649477701800873 and parameters: {'n_estimators': 1342, 'learning_rate': 0.010688029261178917, 'max_depth': 6, 'min_samples_split': 4, 'min_samples_leaf': 10, 'subsample': 0.8272816528064186, 'max_features': 'sqrt'}. Best is trial 428 with value: 0.31740361133065975.
[I 2024-12-04 12:28:07,107] Trial 756 finished with value: 0.4177852811023497 and parameters: {'n_estimators': 960, 'learning_rate': 0.05256548676244077, 'max_depth': 7, 'min_samples_split': 4, 'min_samples_leaf': 1, 'subsample': 0.9404708939602211, 'max_features': None}. Best is trial 428 with value: 0.31740361133065975.
[I 2024-12-04 12:28:07,311] Trial 749 finished with value: 0.3708679102663629 and parameters: {'n_estimators': 1205, 'learning_rate': 0.09548410709036187, 'max_depth': 6, 'min_samples_split': 6, 'min_samples_leaf': 4, 'subsample': 0.7216960439461589, 'max_features': None}. Best is trial 428 with value: 0.31740361133065975.
[I 2024-12-04 12:28:07,731] Trial 754 finished with value: 0.31916474142672824 and parameters: {'n_estimators': 1127, 'learning_rate': 0.09058327656718751, 'max_depth': 7, 'min_samples_split': 6, 'min_samples_leaf': 2, 'subsample': 0.7574746058858987, 'max_features': None}. Best is trial 428 with value: 0.31740361133065975.
[I 2024-12-04 12:28:07,732] Trial 759 finished with value: 0.5046495927855004 and parameters: {'n_estimators': 1294, 'learning_rate': 0.011035981505298614, 'max_depth': 5, 'min_samples_split': 20, 'min_samples_leaf': 3, 'subsample': 0.920448834208121, 'max_features': 'sqrt'}. Best is trial 428 with value: 0.31740361133065975.
[I 2024-12-04 12:28:10,309] Trial 764 finished with value: 0.3232690345170967 and parameters: {'n_estimators': 846, 'learning_rate': 0.05589354708976529, 'max_depth': 8, 'min_samples_split': 2, 'min_samples_leaf': 2, 'subsample': 0.7207922827944822, 'max_features': None}. Best is trial 428 with value: 0.31740361133065975.
[I 2024-12-04 12:28:11,218] Trial 744 finished with value: 0.3686970757439036 and parameters: {'n_estimators': 1275, 'learning_rate': 0.09303363259390104, 'max_depth': 6, 'min_samples_split': 9, 'min_samples_leaf': 3, 'subsample': 0.8295677288211231, 'max_features': None}. Best is trial 428 with value: 0.31740361133065975.
[I 2024-12-04 12:28:12,332] Trial 761 finished with value: 0.3693258206983427 and parameters: {'n_estimators': 1163, 'learning_rate': 0.07302492757501138, 'max_depth': 7, 'min_samples_split': 8, 'min_samples_leaf': 1, 'subsample': 0.7146568629757134, 'max_features': None}. Best is trial 428 with value: 0.31740361133065975.
[I 2024-12-04 12:28:12,432] Trial 755 finished with value: 0.3810141761134399 and parameters: {'n_estimators': 1331, 'learning_rate': 0.0828922991507428, 'max_depth': 8, 'min_samples_split': 9, 'min_samples_leaf': 3, 'subsample': 0.6043795888446711, 'max_features': None}. Best is trial 428 with value: 0.31740361133065975.
[I 2024-12-04 12:28:14,343] Trial 760 finished with value: 0.3233411988994139 and parameters: {'n_estimators': 1296, 'learning_rate': 0.09095240927904578, 'max_depth': 6, 'min_samples_split': 6, 'min_samples_leaf': 2, 'subsample': 0.8145862470821452, 'max_features': None}. Best is trial 428 with value: 0.31740361133065975.
[I 2024-12-04 12:28:14,490] Trial 767 finished with value: 0.6918277294390797 and parameters: {'n_estimators': 972, 'learning_rate': 0.01580831541237736, 'max_depth': 3, 'min_samples_split': 14, 'min_samples_leaf': 2, 'subsample': 0.6361260915276836, 'max_features': 'log2'}. Best is trial 428 with value: 0.31740361133065975.
[I 2024-12-04 12:28:16,265] Trial 758 finished with value: 0.3735650453242844 and parameters: {'n_estimators': 1456, 'learning_rate': 0.04464430277941547, 'max_depth': 7, 'min_samples_split': 13, 'min_samples_leaf': 3, 'subsample': 0.6305019147667065, 'max_features': None}. Best is trial 428 with value: 0.31740361133065975.
[I 2024-12-04 12:28:19,254] Trial 765 finished with value: 0.4774332449342833 and parameters: {'n_estimators': 1353, 'learning_rate': 0.04867104604455949, 'max_depth': 3, 'min_samples_split': 15, 'min_samples_leaf': 8, 'subsample': 0.884926273667344, 'max_features': 'sqrt'}. Best is trial 428 with value: 0.31740361133065975.
[I 2024-12-04 12:28:20,563] Trial 766 finished with value: 0.38409411201366883 and parameters: {'n_estimators': 1214, 'learning_rate': 0.043383862110003286, 'max_depth': 8, 'min_samples_split': 3, 'min_samples_leaf': 3, 'subsample': 0.697401158361221, 'max_features': None}. Best is trial 428 with value: 0.31740361133065975.
[I 2024-12-04 12:28:24,422] Trial 769 finished with value: 0.3211246444371658 and parameters: {'n_estimators': 1112, 'learning_rate': 0.06801696383885326, 'max_depth': 8, 'min_samples_split': 6, 'min_samples_leaf': 2, 'subsample': 0.6679521543095752, 'max_features': None}. Best is trial 428 with value: 0.31740361133065975.
[I 2024-12-04 12:28:26,225] Trial 773 finished with value: 0.4281122680150566 and parameters: {'n_estimators': 1090, 'learning_rate': 0.046287877691961014, 'max_depth': 8, 'min_samples_split': 2, 'min_samples_leaf': 1, 'subsample': 0.6550240384640402, 'max_features': 'log2'}. Best is trial 428 with value: 0.31740361133065975.
[I 2024-12-04 12:28:30,518] Trial 775 finished with value: 0.3777982594351115 and parameters: {'n_estimators': 882, 'learning_rate': 0.02859036287129813, 'max_depth': 8, 'min_samples_split': 3, 'min_samples_leaf': 4, 'subsample': 0.7335828585845697, 'max_features': None}. Best is trial 428 with value: 0.31740361133065975.
[I 2024-12-04 12:28:31,881] Trial 783 finished with value: 0.3922144937965416 and parameters: {'n_estimators': 731, 'learning_rate': 0.0563301383506226, 'max_depth': 9, 'min_samples_split': 3, 'min_samples_leaf': 2, 'subsample': 0.6573419378774716, 'max_features': 'sqrt'}. Best is trial 428 with value: 0.31740361133065975.
[I 2024-12-04 12:28:32,900] Trial 784 finished with value: 0.4007635068379998 and parameters: {'n_estimators': 721, 'learning_rate': 0.041528023558053226, 'max_depth': 6, 'min_samples_split': 5, 'min_samples_leaf': 3, 'subsample': 0.6958316381873308, 'max_features': None}. Best is trial 428 with value: 0.31740361133065975.
[I 2024-12-04 12:28:35,659] Trial 799 finished with value: 0.41805585771417986 and parameters: {'n_estimators': 412, 'learning_rate': 0.010349696450267665, 'max_depth': 11, 'min_samples_split': 14, 'min_samples_leaf': 5, 'subsample': 0.8310269101828673, 'max_features': None}. Best is trial 428 with value: 0.31740361133065975.
[I 2024-12-04 12:28:35,961] Trial 771 finished with value: 0.40964058801133846 and parameters: {'n_estimators': 1473, 'learning_rate': 0.0610932381263031, 'max_depth': 7, 'min_samples_split': 2, 'min_samples_leaf': 1, 'subsample': 0.8127761732821399, 'max_features': 'sqrt'}. Best is trial 428 with value: 0.31740361133065975.
[I 2024-12-04 12:28:36,620] Trial 786 finished with value: 0.34845436618892217 and parameters: {'n_estimators': 820, 'learning_rate': 0.09670439494512055, 'max_depth': 8, 'min_samples_split': 5, 'min_samples_leaf': 2, 'subsample': 0.7106929389830509, 'max_features': None}. Best is trial 428 with value: 0.31740361133065975.
[I 2024-12-04 12:28:36,816] Trial 774 finished with value: 0.32917822994158696 and parameters: {'n_estimators': 1312, 'learning_rate': 0.08736677601994093, 'max_depth': 7, 'min_samples_split': 3, 'min_samples_leaf': 2, 'subsample': 0.691920496188516, 'max_features': None}. Best is trial 428 with value: 0.31740361133065975.
[I 2024-12-04 12:28:36,818] Trial 788 finished with value: 0.41931031458611157 and parameters: {'n_estimators': 825, 'learning_rate': 0.04149153903948803, 'max_depth': 8, 'min_samples_split': 19, 'min_samples_leaf': 4, 'subsample': 0.7737891035535459, 'max_features': 'sqrt'}. Best is trial 428 with value: 0.31740361133065975.
[I 2024-12-04 12:28:38,307] Trial 779 finished with value: 0.3852738747815786 and parameters: {'n_estimators': 1111, 'learning_rate': 0.05162074586724389, 'max_depth': 6, 'min_samples_split': 2, 'min_samples_leaf': 3, 'subsample': 0.6044889027049771, 'max_features': None}. Best is trial 428 with value: 0.31740361133065975.
[I 2024-12-04 12:28:38,687] Trial 772 finished with value: 0.3928442405136529 and parameters: {'n_estimators': 1399, 'learning_rate': 0.03110716030712318, 'max_depth': 5, 'min_samples_split': 6, 'min_samples_leaf': 1, 'subsample': 0.6496010208154618, 'max_features': None}. Best is trial 428 with value: 0.31740361133065975.
[I 2024-12-04 12:28:40,267] Trial 796 finished with value: 0.5661669316744457 and parameters: {'n_estimators': 556, 'learning_rate': 0.01564870150146777, 'max_depth': 5, 'min_samples_split': 20, 'min_samples_leaf': 9, 'subsample': 0.6959117565953599, 'max_features': None}. Best is trial 428 with value: 0.31740361133065975.
[I 2024-12-04 12:28:40,556] Trial 791 finished with value: 0.39585961798049113 and parameters: {'n_estimators': 751, 'learning_rate': 0.07289658991293409, 'max_depth': 7, 'min_samples_split': 4, 'min_samples_leaf': 1, 'subsample': 0.7555857769322553, 'max_features': None}. Best is trial 428 with value: 0.31740361133065975.
[I 2024-12-04 12:28:40,567] Trial 780 finished with value: 0.37340022921593313 and parameters: {'n_estimators': 1135, 'learning_rate': 0.06948236272725003, 'max_depth': 5, 'min_samples_split': 6, 'min_samples_leaf': 4, 'subsample': 0.818700706562016, 'max_features': None}. Best is trial 428 with value: 0.31740361133065975.
[I 2024-12-04 12:28:40,776] Trial 777 finished with value: 0.34515068400950044 and parameters: {'n_estimators': 1371, 'learning_rate': 0.0933255727704914, 'max_depth': 3, 'min_samples_split': 5, 'min_samples_leaf': 2, 'subsample': 0.925214583310043, 'max_features': None}. Best is trial 428 with value: 0.31740361133065975.
[I 2024-12-04 12:28:40,785] Trial 795 finished with value: 0.741470516738023 and parameters: {'n_estimators': 788, 'learning_rate': 0.03724698457515189, 'max_depth': 7, 'min_samples_split': 15, 'min_samples_leaf': 9, 'subsample': 0.7155463198885109, 'max_features': 'log2'}. Best is trial 428 with value: 0.31740361133065975.
[I 2024-12-04 12:28:43,250] Trial 787 finished with value: 0.3423365371849874 and parameters: {'n_estimators': 982, 'learning_rate': 0.035022553258278716, 'max_depth': 6, 'min_samples_split': 2, 'min_samples_leaf': 2, 'subsample': 0.8043758811685674, 'max_features': None}. Best is trial 428 with value: 0.31740361133065975.
[I 2024-12-04 12:28:45,779] Trial 776 finished with value: 0.33940824534427017 and parameters: {'n_estimators': 1429, 'learning_rate': 0.05722517158763202, 'max_depth': 6, 'min_samples_split': 8, 'min_samples_leaf': 2, 'subsample': 0.6810974713121126, 'max_features': None}. Best is trial 428 with value: 0.31740361133065975.
[I 2024-12-04 12:28:47,588] Trial 782 finished with value: 0.33390160140036146 and parameters: {'n_estimators': 1275, 'learning_rate': 0.06008668174690458, 'max_depth': 7, 'min_samples_split': 2, 'min_samples_leaf': 2, 'subsample': 0.6813786553269318, 'max_features': None}. Best is trial 428 with value: 0.31740361133065975.
[I 2024-12-04 12:28:48,139] Trial 785 finished with value: 0.3938100030671825 and parameters: {'n_estimators': 1200, 'learning_rate': 0.09945666731185042, 'max_depth': 6, 'min_samples_split': 5, 'min_samples_leaf': 3, 'subsample': 0.842258484449054, 'max_features': None}. Best is trial 428 with value: 0.31740361133065975.
[I 2024-12-04 12:28:51,222] Trial 778 finished with value: 0.40608577333154583 and parameters: {'n_estimators': 1383, 'learning_rate': 0.06962395877304235, 'max_depth': 6, 'min_samples_split': 6, 'min_samples_leaf': 1, 'subsample': 0.8528299009950184, 'max_features': None}. Best is trial 428 with value: 0.31740361133065975.
[I 2024-12-04 12:28:51,253] Trial 794 finished with value: 0.3406765414767538 and parameters: {'n_estimators': 929, 'learning_rate': 0.06518664134038693, 'max_depth': 9, 'min_samples_split': 2, 'min_samples_leaf': 2, 'subsample': 0.7558888025600304, 'max_features': None}. Best is trial 428 with value: 0.31740361133065975.
[I 2024-12-04 12:28:51,742] Trial 798 finished with value: 0.3799560489241308 and parameters: {'n_estimators': 869, 'learning_rate': 0.05724579148581821, 'max_depth': 9, 'min_samples_split': 4, 'min_samples_leaf': 5, 'subsample': 0.7758289004854096, 'max_features': None}. Best is trial 428 with value: 0.31740361133065975.
[I 2024-12-04 12:28:52,279] Trial 781 finished with value: 0.32780886209079285 and parameters: {'n_estimators': 1473, 'learning_rate': 0.09498641330278118, 'max_depth': 8, 'min_samples_split': 2, 'min_samples_leaf': 2, 'subsample': 0.6280398868708525, 'max_features': None}. Best is trial 428 with value: 0.31740361133065975.
[I 2024-12-04 12:28:53,130] Trial 790 finished with value: 0.37122121556002263 and parameters: {'n_estimators': 1130, 'learning_rate': 0.08945791692076464, 'max_depth': 8, 'min_samples_split': 10, 'min_samples_leaf': 1, 'subsample': 0.7475744011477381, 'max_features': None}. Best is trial 428 with value: 0.31740361133065975.
[I 2024-12-04 12:28:55,419] Trial 800 finished with value: 0.38037943148864845 and parameters: {'n_estimators': 996, 'learning_rate': 0.08881673761522965, 'max_depth': 6, 'min_samples_split': 7, 'min_samples_leaf': 1, 'subsample': 0.7007891867067566, 'max_features': None}. Best is trial 428 with value: 0.31740361133065975.
[I 2024-12-04 12:28:57,467] Trial 821 finished with value: 0.893847085073477 and parameters: {'n_estimators': 170, 'learning_rate': 0.02035976943180907, 'max_depth': 5, 'min_samples_split': 13, 'min_samples_leaf': 10, 'subsample': 0.9245494290839771, 'max_features': 'sqrt'}. Best is trial 428 with value: 0.31740361133065975.
[I 2024-12-04 12:28:58,526] Trial 793 finished with value: 0.3233222759893821 and parameters: {'n_estimators': 1217, 'learning_rate': 0.09117038718888441, 'max_depth': 7, 'min_samples_split': 6, 'min_samples_leaf': 2, 'subsample': 0.8103029020604124, 'max_features': None}. Best is trial 428 with value: 0.31740361133065975.
[I 2024-12-04 12:29:00,145] Trial 804 finished with value: 0.3336532006971647 and parameters: {'n_estimators': 855, 'learning_rate': 0.05963564642592182, 'max_depth': 8, 'min_samples_split': 10, 'min_samples_leaf': 2, 'subsample': 0.6174410957427822, 'max_features': None}. Best is trial 428 with value: 0.31740361133065975.
[I 2024-12-04 12:29:00,165] Trial 792 finished with value: 0.40625685995705135 and parameters: {'n_estimators': 1314, 'learning_rate': 0.08905783450700545, 'max_depth': 4, 'min_samples_split': 7, 'min_samples_leaf': 3, 'subsample': 0.8154725523554055, 'max_features': None}. Best is trial 428 with value: 0.31740361133065975.
[I 2024-12-04 12:29:00,198] Trial 789 finished with value: 0.3720493750598545 and parameters: {'n_estimators': 1369, 'learning_rate': 0.06891897054422921, 'max_depth': 4, 'min_samples_split': 8, 'min_samples_leaf': 2, 'subsample': 0.875536196631907, 'max_features': None}. Best is trial 428 with value: 0.31740361133065975.
[I 2024-12-04 12:29:03,738] Trial 797 finished with value: 0.37586816960549374 and parameters: {'n_estimators': 1244, 'learning_rate': 0.09186574993022985, 'max_depth': 6, 'min_samples_split': 8, 'min_samples_leaf': 3, 'subsample': 0.7408418111383116, 'max_features': None}. Best is trial 428 with value: 0.31740361133065975.
[I 2024-12-04 12:29:03,763] Trial 806 finished with value: 0.4418734092972925 and parameters: {'n_estimators': 1033, 'learning_rate': 0.0777310685174742, 'max_depth': 4, 'min_samples_split': 11, 'min_samples_leaf': 3, 'subsample': 0.7818623824875084, 'max_features': 'sqrt'}. Best is trial 428 with value: 0.31740361133065975.
