[I 2024-12-04 15:20:17,845] Trial 1932 finished with value: 0.6633417691121836 and parameters: {'n_estimators': 1085, 'learning_rate': 0.03881684364344836, 'max_depth': 3, 'min_samples_split': 11, 'min_samples_leaf': 2, 'subsample': 0.8354189357644191, 'max_features': 'sqrt'}. Best is trial 1435 with value: 0.45467030752684195.
[I 2024-12-04 15:20:17,860] Trial 1938 finished with value: 0.48677118680368053 and parameters: {'n_estimators': 714, 'learning_rate': 0.06285801003314286, 'max_depth': 12, 'min_samples_split': 18, 'min_samples_leaf': 1, 'subsample': 0.9953337919710163, 'max_features': None}. Best is trial 1435 with value: 0.45467030752684195.
[I 2024-12-04 15:20:18,137] Trial 1933 finished with value: 0.6534627422732828 and parameters: {'n_estimators': 1044, 'learning_rate': 0.09424265665004761, 'max_depth': 10, 'min_samples_split': 20, 'min_samples_leaf': 2, 'subsample': 0.9973487232791208, 'max_features': 'sqrt'}. Best is trial 1435 with value: 0.45467030752684195.
[I 2024-12-04 15:20:19,130] Trial 1936 finished with value: 0.46944598314869407 and parameters: {'n_estimators': 827, 'learning_rate': 0.09570441129156433, 'max_depth': 12, 'min_samples_split': 20, 'min_samples_leaf': 1, 'subsample': 0.9856114950529773, 'max_features': None}. Best is trial 1435 with value: 0.45467030752684195.
[I 2024-12-04 15:20:19,477] Trial 1943 finished with value: 0.6255634049325052 and parameters: {'n_estimators': 643, 'learning_rate': 0.06258385315222019, 'max_depth': 12, 'min_samples_split': 16, 'min_samples_leaf': 3, 'subsample': 0.9162686306680998, 'max_features': None}. Best is trial 1435 with value: 0.45467030752684195.
[I 2024-12-04 15:20:20,179] Trial 1934 finished with value: 0.5762471389188265 and parameters: {'n_estimators': 1086, 'learning_rate': 0.06703345416047062, 'max_depth': 12, 'min_samples_split': 20, 'min_samples_leaf': 1, 'subsample': 0.9909405781568842, 'max_features': 'log2'}. Best is trial 1435 with value: 0.45467030752684195.
[I 2024-12-04 15:20:30,716] Trial 1948 finished with value: 0.744024930294021 and parameters: {'n_estimators': 904, 'learning_rate': 0.06450492311283956, 'max_depth': 10, 'min_samples_split': 13, 'min_samples_leaf': 2, 'subsample': 0.9569336773807854, 'max_features': None}. Best is trial 1435 with value: 0.45467030752684195.
[I 2024-12-04 15:20:33,223] Trial 1937 finished with value: 0.6560676232947189 and parameters: {'n_estimators': 1322, 'learning_rate': 0.08376693620244689, 'max_depth': 12, 'min_samples_split': 20, 'min_samples_leaf': 3, 'subsample': 0.9992957699591332, 'max_features': None}. Best is trial 1435 with value: 0.45467030752684195.
[I 2024-12-04 15:20:34,274] Trial 1949 finished with value: 0.5131806941009902 and parameters: {'n_estimators': 935, 'learning_rate': 0.0955913722540901, 'max_depth': 11, 'min_samples_split': 16, 'min_samples_leaf': 1, 'subsample': 0.9948127145670419, 'max_features': None}. Best is trial 1435 with value: 0.45467030752684195.
[I 2024-12-04 15:20:35,127] Trial 1951 finished with value: 0.6552483605432323 and parameters: {'n_estimators': 1159, 'learning_rate': 0.02998533522407927, 'max_depth': 12, 'min_samples_split': 17, 'min_samples_leaf': 2, 'subsample': 0.6110940093720503, 'max_features': 'log2'}. Best is trial 1435 with value: 0.45467030752684195.
[I 2024-12-04 15:20:35,751] Trial 1945 finished with value: 0.6269659461971534 and parameters: {'n_estimators': 1155, 'learning_rate': 0.06886231311294604, 'max_depth': 12, 'min_samples_split': 18, 'min_samples_leaf': 2, 'subsample': 0.9046228003144043, 'max_features': None}. Best is trial 1435 with value: 0.45467030752684195.
[I 2024-12-04 15:20:36,494] Trial 1950 finished with value: 0.6801101516777897 and parameters: {'n_estimators': 1161, 'learning_rate': 0.046141079329788656, 'max_depth': 4, 'min_samples_split': 3, 'min_samples_leaf': 7, 'subsample': 0.8889882926985777, 'max_features': None}. Best is trial 1435 with value: 0.45467030752684195.
[I 2024-12-04 15:20:37,308] Trial 1942 finished with value: 0.6619202356146704 and parameters: {'n_estimators': 1274, 'learning_rate': 0.05710981513366937, 'max_depth': 10, 'min_samples_split': 16, 'min_samples_leaf': 3, 'subsample': 0.9746478523138852, 'max_features': None}. Best is trial 1435 with value: 0.45467030752684195.
[I 2024-12-04 15:20:39,134] Trial 1946 finished with value: 0.47852357563283765 and parameters: {'n_estimators': 1136, 'learning_rate': 0.06084758174747668, 'max_depth': 11, 'min_samples_split': 20, 'min_samples_leaf': 1, 'subsample': 0.9923659737303686, 'max_features': None}. Best is trial 1435 with value: 0.45467030752684195.
[I 2024-12-04 15:20:40,049] Trial 1954 finished with value: 0.6723390556688845 and parameters: {'n_estimators': 933, 'learning_rate': 0.09783153649214431, 'max_depth': 12, 'min_samples_split': 16, 'min_samples_leaf': 3, 'subsample': 0.9845517085836215, 'max_features': None}. Best is trial 1435 with value: 0.45467030752684195.
[I 2024-12-04 15:20:40,632] Trial 1964 finished with value: 0.5983895335417975 and parameters: {'n_estimators': 898, 'learning_rate': 0.0929049910700313, 'max_depth': 10, 'min_samples_split': 20, 'min_samples_leaf': 1, 'subsample': 0.9952281362732673, 'max_features': 'log2'}. Best is trial 1435 with value: 0.45467030752684195.
[I 2024-12-04 15:20:41,942] Trial 1952 finished with value: 0.46770918909971404 and parameters: {'n_estimators': 1024, 'learning_rate': 0.09148623532716339, 'max_depth': 12, 'min_samples_split': 20, 'min_samples_leaf': 1, 'subsample': 0.9817137210610168, 'max_features': None}. Best is trial 1435 with value: 0.45467030752684195.
[I 2024-12-04 15:20:42,080] Trial 1957 finished with value: 0.485783474230989 and parameters: {'n_estimators': 892, 'learning_rate': 0.04156806291609603, 'max_depth': 12, 'min_samples_split': 20, 'min_samples_leaf': 1, 'subsample': 0.9938557228178087, 'max_features': None}. Best is trial 1435 with value: 0.45467030752684195.
[I 2024-12-04 15:20:45,027] Trial 1947 finished with value: 0.4783577832885164 and parameters: {'n_estimators': 1287, 'learning_rate': 0.09779270805573699, 'max_depth': 10, 'min_samples_split': 17, 'min_samples_leaf': 1, 'subsample': 0.9464908735898732, 'max_features': None}. Best is trial 1435 with value: 0.45467030752684195.
[I 2024-12-04 15:20:45,891] Trial 1956 finished with value: 0.5005424601627897 and parameters: {'n_estimators': 992, 'learning_rate': 0.08359876023975205, 'max_depth': 10, 'min_samples_split': 17, 'min_samples_leaf': 1, 'subsample': 0.9923556782341212, 'max_features': None}. Best is trial 1435 with value: 0.45467030752684195.
[I 2024-12-04 15:20:47,228] Trial 1970 finished with value: 0.7932158721109873 and parameters: {'n_estimators': 962, 'learning_rate': 0.037309824838577275, 'max_depth': 12, 'min_samples_split': 20, 'min_samples_leaf': 10, 'subsample': 0.8298385569882012, 'max_features': 'sqrt'}. Best is trial 1435 with value: 0.45467030752684195.
[I 2024-12-04 15:20:48,490] Trial 1953 finished with value: 0.5245591924942414 and parameters: {'n_estimators': 1198, 'learning_rate': 0.09456262517520368, 'max_depth': 12, 'min_samples_split': 16, 'min_samples_leaf': 1, 'subsample': 0.9039688183277071, 'max_features': None}. Best is trial 1435 with value: 0.45467030752684195.
[I 2024-12-04 15:20:49,659] Trial 1961 finished with value: 0.48989495961065505 and parameters: {'n_estimators': 963, 'learning_rate': 0.05776863665328558, 'max_depth': 10, 'min_samples_split': 17, 'min_samples_leaf': 1, 'subsample': 0.9477023264886079, 'max_features': None}. Best is trial 1435 with value: 0.45467030752684195.
[I 2024-12-04 15:20:49,924] Trial 1959 finished with value: 0.5216590000840509 and parameters: {'n_estimators': 1005, 'learning_rate': 0.07625127940841968, 'max_depth': 10, 'min_samples_split': 16, 'min_samples_leaf': 1, 'subsample': 0.9990351454957466, 'max_features': None}. Best is trial 1435 with value: 0.45467030752684195.
[I 2024-12-04 15:20:53,005] Trial 1955 finished with value: 0.49485594053170545 and parameters: {'n_estimators': 1246, 'learning_rate': 0.0765644674118772, 'max_depth': 12, 'min_samples_split': 17, 'min_samples_leaf': 1, 'subsample': 0.9994766457875442, 'max_features': None}. Best is trial 1435 with value: 0.45467030752684195.
[I 2024-12-04 15:20:53,067] Trial 1962 finished with value: 0.6365006252248372 and parameters: {'n_estimators': 1043, 'learning_rate': 0.07272038904817509, 'max_depth': 12, 'min_samples_split': 17, 'min_samples_leaf': 2, 'subsample': 0.9135192026854024, 'max_features': None}. Best is trial 1435 with value: 0.45467030752684195.
[I 2024-12-04 15:20:53,639] Trial 1985 finished with value: 0.689405601788078 and parameters: {'n_estimators': 313, 'learning_rate': 0.025101440996972858, 'max_depth': 3, 'min_samples_split': 10, 'min_samples_leaf': 9, 'subsample': 0.7472780187462253, 'max_features': None}. Best is trial 1435 with value: 0.45467030752684195.
[I 2024-12-04 15:20:53,738] Trial 1958 finished with value: 0.46950676862737484 and parameters: {'n_estimators': 1168, 'learning_rate': 0.06088174481425423, 'max_depth': 12, 'min_samples_split': 19, 'min_samples_leaf': 1, 'subsample': 0.9924965284925523, 'max_features': None}. Best is trial 1435 with value: 0.45467030752684195.
[I 2024-12-04 15:20:56,242] Trial 1968 finished with value: 0.4681917194288673 and parameters: {'n_estimators': 946, 'learning_rate': 0.08476423486115095, 'max_depth': 12, 'min_samples_split': 20, 'min_samples_leaf': 1, 'subsample': 0.9927568387305026, 'max_features': None}. Best is trial 1435 with value: 0.45467030752684195.
[I 2024-12-04 15:20:57,896] Trial 1972 finished with value: 0.47592265792038535 and parameters: {'n_estimators': 979, 'learning_rate': 0.06070267311524993, 'max_depth': 12, 'min_samples_split': 20, 'min_samples_leaf': 1, 'subsample': 0.8989924755612199, 'max_features': None}. Best is trial 1435 with value: 0.45467030752684195.
[I 2024-12-04 15:20:57,914] Trial 1969 finished with value: 0.4838153186405372 and parameters: {'n_estimators': 974, 'learning_rate': 0.0511900741360561, 'max_depth': 12, 'min_samples_split': 20, 'min_samples_leaf': 1, 'subsample': 0.9982993702515555, 'max_features': None}. Best is trial 1435 with value: 0.45467030752684195.
[I 2024-12-04 15:20:57,923] Trial 1960 finished with value: 0.6650198945891949 and parameters: {'n_estimators': 1205, 'learning_rate': 0.08288253049981742, 'max_depth': 10, 'min_samples_split': 14, 'min_samples_leaf': 3, 'subsample': 0.995961925195519, 'max_features': None}. Best is trial 1435 with value: 0.45467030752684195.
[I 2024-12-04 15:20:58,526] Trial 1966 finished with value: 0.639063936598218 and parameters: {'n_estimators': 1125, 'learning_rate': 0.08571481202546119, 'max_depth': 10, 'min_samples_split': 20, 'min_samples_leaf': 2, 'subsample': 0.9991199446671993, 'max_features': None}. Best is trial 1435 with value: 0.45467030752684195.
[I 2024-12-04 15:20:59,645] Trial 1973 finished with value: 0.48386216862758763 and parameters: {'n_estimators': 1002, 'learning_rate': 0.09570769000829533, 'max_depth': 10, 'min_samples_split': 20, 'min_samples_leaf': 1, 'subsample': 0.9755441232436228, 'max_features': None}. Best is trial 1435 with value: 0.45467030752684195.
[I 2024-12-04 15:21:00,570] Trial 1963 finished with value: 0.4672749122588633 and parameters: {'n_estimators': 1157, 'learning_rate': 0.06803146507957096, 'max_depth': 12, 'min_samples_split': 20, 'min_samples_leaf': 1, 'subsample': 0.9512402887139819, 'max_features': None}. Best is trial 1435 with value: 0.45467030752684195.
[I 2024-12-04 15:21:00,830] Trial 1982 finished with value: 0.8549477366778009 and parameters: {'n_estimators': 638, 'learning_rate': 0.024014233789686763, 'max_depth': 10, 'min_samples_split': 12, 'min_samples_leaf': 8, 'subsample': 0.8918577100848077, 'max_features': 'log2'}. Best is trial 1435 with value: 0.45467030752684195.
[I 2024-12-04 15:21:02,612] Trial 1967 finished with value: 0.4714571037998631 and parameters: {'n_estimators': 1085, 'learning_rate': 0.06945678841858267, 'max_depth': 12, 'min_samples_split': 17, 'min_samples_leaf': 1, 'subsample': 0.9315391169707516, 'max_features': None}. Best is trial 1435 with value: 0.45467030752684195.
[I 2024-12-04 15:21:05,808] Trial 1965 finished with value: 0.4917236715930238 and parameters: {'n_estimators': 1306, 'learning_rate': 0.09382412588729384, 'max_depth': 10, 'min_samples_split': 20, 'min_samples_leaf': 1, 'subsample': 0.9976761466260322, 'max_features': None}. Best is trial 1435 with value: 0.45467030752684195.
[I 2024-12-04 15:21:05,810] Trial 1975 finished with value: 0.6382015905901371 and parameters: {'n_estimators': 911, 'learning_rate': 0.052683788105097766, 'max_depth': 11, 'min_samples_split': 17, 'min_samples_leaf': 3, 'subsample': 0.9453154886382659, 'max_features': None}. Best is trial 1435 with value: 0.45467030752684195.
[I 2024-12-04 15:21:05,853] Trial 1981 finished with value: 0.5857599229639142 and parameters: {'n_estimators': 869, 'learning_rate': 0.01054279742301245, 'max_depth': 9, 'min_samples_split': 15, 'min_samples_leaf': 1, 'subsample': 0.6423600026579172, 'max_features': 'sqrt'}. Best is trial 1435 with value: 0.45467030752684195.
[I 2024-12-04 15:21:06,547] Trial 1974 finished with value: 0.7514105646892638 and parameters: {'n_estimators': 1386, 'learning_rate': 0.06009293551819241, 'max_depth': 3, 'min_samples_split': 11, 'min_samples_leaf': 10, 'subsample': 0.9930301698848752, 'max_features': None}. Best is trial 1435 with value: 0.45467030752684195.
[I 2024-12-04 15:21:08,353] Trial 1971 finished with value: 0.48520632653557305 and parameters: {'n_estimators': 1237, 'learning_rate': 0.07263717766301733, 'max_depth': 12, 'min_samples_split': 18, 'min_samples_leaf': 1, 'subsample': 0.8989479388458409, 'max_features': None}. Best is trial 1435 with value: 0.45467030752684195.
[I 2024-12-04 15:21:10,929] Trial 1980 finished with value: 0.648000596713716 and parameters: {'n_estimators': 851, 'learning_rate': 0.06199875840861547, 'max_depth': 12, 'min_samples_split': 17, 'min_samples_leaf': 3, 'subsample': 0.9618497460992581, 'max_features': None}. Best is trial 1435 with value: 0.45467030752684195.
[I 2024-12-04 15:21:15,571] Trial 1987 finished with value: 0.4965803524884727 and parameters: {'n_estimators': 834, 'learning_rate': 0.050506802264082405, 'max_depth': 10, 'min_samples_split': 17, 'min_samples_leaf': 1, 'subsample': 0.9910350872394511, 'max_features': None}. Best is trial 1435 with value: 0.45467030752684195.
[I 2024-12-04 15:21:16,385] Trial 1983 finished with value: 0.49361834945480215 and parameters: {'n_estimators': 951, 'learning_rate': 0.07551535263427697, 'max_depth': 12, 'min_samples_split': 17, 'min_samples_leaf': 1, 'subsample': 0.9950149711136953, 'max_features': None}. Best is trial 1435 with value: 0.45467030752684195.
[I 2024-12-04 15:21:18,280] Trial 1986 finished with value: 0.4990106244322591 and parameters: {'n_estimators': 927, 'learning_rate': 0.09144241379490811, 'max_depth': 12, 'min_samples_split': 14, 'min_samples_leaf': 1, 'subsample': 0.9934185017102884, 'max_features': None}. Best is trial 1435 with value: 0.45467030752684195.
[I 2024-12-04 15:21:18,683] Trial 1979 finished with value: 0.4625944713821376 and parameters: {'n_estimators': 1108, 'learning_rate': 0.059819915168845765, 'max_depth': 12, 'min_samples_split': 20, 'min_samples_leaf': 1, 'subsample': 0.9910672562475853, 'max_features': None}. Best is trial 1435 with value: 0.45467030752684195.
[I 2024-12-04 15:21:19,116] Trial 1977 finished with value: 0.6687086779363057 and parameters: {'n_estimators': 1249, 'learning_rate': 0.06881132023508817, 'max_depth': 11, 'min_samples_split': 17, 'min_samples_leaf': 3, 'subsample': 0.9128312866631012, 'max_features': None}. Best is trial 1435 with value: 0.45467030752684195.
[I 2024-12-04 15:21:19,234] Trial 1988 finished with value: 0.6512847040672297 and parameters: {'n_estimators': 1215, 'learning_rate': 0.09408576983058559, 'max_depth': 11, 'min_samples_split': 20, 'min_samples_leaf': 5, 'subsample': 0.9976703510892369, 'max_features': 'sqrt'}. Best is trial 1435 with value: 0.45467030752684195.
[I 2024-12-04 15:21:21,473] Trial 2000 finished with value: 0.6221683884062805 and parameters: {'n_estimators': 563, 'learning_rate': 0.05955492933484566, 'max_depth': 12, 'min_samples_split': 20, 'min_samples_leaf': 3, 'subsample': 0.8979138764521918, 'max_features': None}. Best is trial 1435 with value: 0.45467030752684195.
[I 2024-12-04 15:21:21,798] Trial 1994 finished with value: 0.714785194418085 and parameters: {'n_estimators': 835, 'learning_rate': 0.010325981120492664, 'max_depth': 11, 'min_samples_split': 18, 'min_samples_leaf': 9, 'subsample': 0.6647440514554946, 'max_features': None}. Best is trial 1435 with value: 0.45467030752684195.
[I 2024-12-04 15:21:22,367] Trial 1990 finished with value: 0.6240722535312366 and parameters: {'n_estimators': 895, 'learning_rate': 0.05518287630624072, 'max_depth': 12, 'min_samples_split': 20, 'min_samples_leaf': 2, 'subsample': 0.9956198545892486, 'max_features': None}. Best is trial 1435 with value: 0.45467030752684195.
[I 2024-12-04 15:21:23,378] Trial 1976 finished with value: 0.6963359719954528 and parameters: {'n_estimators': 1439, 'learning_rate': 0.05694690997485263, 'max_depth': 10, 'min_samples_split': 18, 'min_samples_leaf': 7, 'subsample': 0.9202073581367544, 'max_features': None}. Best is trial 1435 with value: 0.45467030752684195.
[I 2024-12-04 15:21:25,258] Trial 1989 finished with value: 0.6322138449361203 and parameters: {'n_estimators': 1028, 'learning_rate': 0.05427715061467006, 'max_depth': 10, 'min_samples_split': 19, 'min_samples_leaf': 3, 'subsample': 0.985902220002543, 'max_features': None}. Best is trial 1435 with value: 0.45467030752684195.
[I 2024-12-04 15:21:25,731] Trial 1993 finished with value: 0.49550921185562113 and parameters: {'n_estimators': 856, 'learning_rate': 0.06263733659718902, 'max_depth': 11, 'min_samples_split': 16, 'min_samples_leaf': 1, 'subsample': 0.9307787662383042, 'max_features': None}. Best is trial 1435 with value: 0.45467030752684195.
[I 2024-12-04 15:21:26,330] Trial 1984 finished with value: 0.5011334018942515 and parameters: {'n_estimators': 1196, 'learning_rate': 0.06555253225436952, 'max_depth': 12, 'min_samples_split': 20, 'min_samples_leaf': 1, 'subsample': 0.9294460391639274, 'max_features': None}. Best is trial 1435 with value: 0.45467030752684195.
[I 2024-12-04 15:21:27,825] Trial 1991 finished with value: 0.5321277239208797 and parameters: {'n_estimators': 1338, 'learning_rate': 0.06641887269965832, 'max_depth': 8, 'min_samples_split': 12, 'min_samples_leaf': 1, 'subsample': 0.9988731205322856, 'max_features': 'sqrt'}. Best is trial 1435 with value: 0.45467030752684195.
[I 2024-12-04 15:21:29,084] Trial 1978 finished with value: 0.5161559871306647 and parameters: {'n_estimators': 1458, 'learning_rate': 0.08792950943491998, 'max_depth': 8, 'min_samples_split': 17, 'min_samples_leaf': 1, 'subsample': 0.9851466900652278, 'max_features': None}. Best is trial 1435 with value: 0.45467030752684195.
[I 2024-12-04 15:21:29,933] Trial 1998 finished with value: 0.524436467047105 and parameters: {'n_estimators': 776, 'learning_rate': 0.09469221541052579, 'max_depth': 12, 'min_samples_split': 16, 'min_samples_leaf': 1, 'subsample': 0.9985940508854682, 'max_features': None}. Best is trial 1435 with value: 0.45467030752684195.
[I 2024-12-04 15:21:31,035] Trial 1992 finished with value: 0.6599791333196924 and parameters: {'n_estimators': 1096, 'learning_rate': 0.08624061435975308, 'max_depth': 10, 'min_samples_split': 17, 'min_samples_leaf': 3, 'subsample': 0.9824012291921623, 'max_features': None}. Best is trial 1435 with value: 0.45467030752684195.
[I 2024-12-04 15:21:32,547] Trial 1996 finished with value: 0.4907254280660958 and parameters: {'n_estimators': 931, 'learning_rate': 0.07736848261826605, 'max_depth': 12, 'min_samples_split': 17, 'min_samples_leaf': 1, 'subsample': 0.9931572136809176, 'max_features': None}. Best is trial 1435 with value: 0.45467030752684195.
[I 2024-12-04 15:21:33,192] Trial 2020 finished with value: 0.9493455794831769 and parameters: {'n_estimators': 207, 'learning_rate': 0.01049557627656397, 'max_depth': 11, 'min_samples_split': 2, 'min_samples_leaf': 6, 'subsample': 0.9363306121816073, 'max_features': 'sqrt'}. Best is trial 1435 with value: 0.45467030752684195.
[I 2024-12-04 15:21:34,238] Trial 2015 finished with value: 0.8495315191713503 and parameters: {'n_estimators': 356, 'learning_rate': 0.016364493146345308, 'max_depth': 12, 'min_samples_split': 8, 'min_samples_leaf': 2, 'subsample': 0.8387989901834001, 'max_features': 'log2'}. Best is trial 1435 with value: 0.45467030752684195.
[I 2024-12-04 15:21:36,339] Trial 1995 finished with value: 0.6316073945616327 and parameters: {'n_estimators': 1109, 'learning_rate': 0.05697730459861032, 'max_depth': 11, 'min_samples_split': 17, 'min_samples_leaf': 3, 'subsample': 0.9877949071118968, 'max_features': None}. Best is trial 1435 with value: 0.45467030752684195.
[I 2024-12-04 15:21:38,084] Trial 1999 finished with value: 0.5173620300623127 and parameters: {'n_estimators': 1099, 'learning_rate': 0.0810359001167559, 'max_depth': 7, 'min_samples_split': 20, 'min_samples_leaf': 1, 'subsample': 0.8881373157429571, 'max_features': None}. Best is trial 1435 with value: 0.45467030752684195.
[I 2024-12-04 15:21:38,147] Trial 2001 finished with value: 0.4992216511961916 and parameters: {'n_estimators': 944, 'learning_rate': 0.09492593740361822, 'max_depth': 11, 'min_samples_split': 17, 'min_samples_leaf': 1, 'subsample': 0.9984849993425754, 'max_features': None}. Best is trial 1435 with value: 0.45467030752684195.
