[I 2024-12-04 12:26:52,600] Trial 2425 finished with value: 0.30077609814746925 and parameters: {'n_estimators': 563, 'max_depth': 50, 'min_samples_split': 4, 'min_samples_leaf': 1, 'max_features': 'sqrt', 'bootstrap': False, 'criterion': 'squared_error'}. Best is trial 341 with value: 0.2909369124469028.
[I 2024-12-04 12:26:52,607] Trial 2433 finished with value: 0.4423753457060144 and parameters: {'n_estimators': 493, 'max_depth': 44, 'min_samples_split': 3, 'min_samples_leaf': 2, 'max_features': 'sqrt', 'bootstrap': False, 'criterion': 'squared_error'}. Best is trial 341 with value: 0.2909369124469028.
[I 2024-12-04 12:26:52,616] Trial 2426 finished with value: 0.3070531161291374 and parameters: {'n_estimators': 494, 'max_depth': 44, 'min_samples_split': 4, 'min_samples_leaf': 1, 'max_features': 'sqrt', 'bootstrap': False, 'criterion': 'squared_error'}. Best is trial 341 with value: 0.2909369124469028.
[I 2024-12-04 12:26:53,292] Trial 2439 finished with value: 0.4469927414688744 and parameters: {'n_estimators': 205, 'max_depth': 44, 'min_samples_split': 3, 'min_samples_leaf': 2, 'max_features': 'sqrt', 'bootstrap': False, 'criterion': 'squared_error'}. Best is trial 341 with value: 0.2909369124469028.
[I 2024-12-04 12:26:54,794] Trial 2435 finished with value: 0.307179748876508 and parameters: {'n_estimators': 124, 'max_depth': 44, 'min_samples_split': 4, 'min_samples_leaf': 1, 'max_features': 'sqrt', 'bootstrap': False, 'criterion': 'squared_error'}. Best is trial 341 with value: 0.2909369124469028.
[I 2024-12-04 12:26:55,023] Trial 2438 finished with value: 0.4419892617442103 and parameters: {'n_estimators': 103, 'max_depth': 49, 'min_samples_split': 3, 'min_samples_leaf': 2, 'max_features': 'sqrt', 'bootstrap': False, 'criterion': 'squared_error'}. Best is trial 341 with value: 0.2909369124469028.
[I 2024-12-04 12:26:55,357] Trial 2434 finished with value: 0.33357075432671085 and parameters: {'n_estimators': 505, 'max_depth': 34, 'min_samples_split': 3, 'min_samples_leaf': 1, 'max_features': 'sqrt', 'bootstrap': False, 'criterion': 'squared_error'}. Best is trial 341 with value: 0.2909369124469028.
[I 2024-12-04 12:26:55,366] Trial 2432 finished with value: 0.3119461784694236 and parameters: {'n_estimators': 680, 'max_depth': 41, 'min_samples_split': 2, 'min_samples_leaf': 1, 'max_features': 'sqrt', 'bootstrap': False, 'criterion': 'squared_error'}. Best is trial 341 with value: 0.2909369124469028.
[I 2024-12-04 12:26:55,531] Trial 2437 finished with value: 0.9532731424808637 and parameters: {'n_estimators': 435, 'max_depth': 11, 'min_samples_split': 34, 'min_samples_leaf': 8, 'max_features': 'log2', 'bootstrap': True, 'criterion': 'absolute_error'}. Best is trial 341 with value: 0.2909369124469028.
[I 2024-12-04 12:26:56,762] Trial 2430 finished with value: 0.3065000001060615 and parameters: {'n_estimators': 699, 'max_depth': 43, 'min_samples_split': 2, 'min_samples_leaf': 1, 'max_features': 'sqrt', 'bootstrap': False, 'criterion': 'squared_error'}. Best is trial 341 with value: 0.2909369124469028.
[I 2024-12-04 12:26:58,236] Trial 2436 finished with value: 0.44391723115464155 and parameters: {'n_estimators': 312, 'max_depth': 50, 'min_samples_split': 4, 'min_samples_leaf': 2, 'max_features': 'sqrt', 'bootstrap': False, 'criterion': 'squared_error'}. Best is trial 341 with value: 0.2909369124469028.
[I 2024-12-04 12:26:58,363] Trial 2423 finished with value: 0.3401592595402604 and parameters: {'n_estimators': 413, 'max_depth': 38, 'min_samples_split': 5, 'min_samples_leaf': 1, 'max_features': 'sqrt', 'bootstrap': False, 'criterion': 'absolute_error'}. Best is trial 341 with value: 0.2909369124469028.
[I 2024-12-04 12:27:00,068] Trial 2429 finished with value: 0.3105441681079465 and parameters: {'n_estimators': 313, 'max_depth': 44, 'min_samples_split': 5, 'min_samples_leaf': 1, 'max_features': 'sqrt', 'bootstrap': False, 'criterion': 'squared_error'}. Best is trial 341 with value: 0.2909369124469028.
[I 2024-12-04 12:27:01,662] Trial 2444 finished with value: 0.3198597504244039 and parameters: {'n_estimators': 114, 'max_depth': 49, 'min_samples_split': 3, 'min_samples_leaf': 1, 'max_features': 'sqrt', 'bootstrap': True, 'criterion': 'squared_error'}. Best is trial 341 with value: 0.2909369124469028.
[I 2024-12-04 12:27:01,662] Trial 2440 finished with value: 0.31806926113912287 and parameters: {'n_estimators': 682, 'max_depth': 42, 'min_samples_split': 5, 'min_samples_leaf': 1, 'max_features': 'sqrt', 'bootstrap': False, 'criterion': 'squared_error'}. Best is trial 341 with value: 0.2909369124469028.
[I 2024-12-04 12:27:01,767] Trial 2448 finished with value: 0.6649368401790382 and parameters: {'n_estimators': 457, 'max_depth': 47, 'min_samples_split': 2, 'min_samples_leaf': 6, 'max_features': 'sqrt', 'bootstrap': False, 'criterion': 'squared_error'}. Best is trial 341 with value: 0.2909369124469028.
[I 2024-12-04 12:27:02,010] Trial 2442 finished with value: 0.29974931597364246 and parameters: {'n_estimators': 288, 'max_depth': 50, 'min_samples_split': 4, 'min_samples_leaf': 1, 'max_features': 'sqrt', 'bootstrap': False, 'criterion': 'squared_error'}. Best is trial 341 with value: 0.2909369124469028.
[I 2024-12-04 12:27:02,476] Trial 2443 finished with value: 0.30670970970201866 and parameters: {'n_estimators': 321, 'max_depth': 43, 'min_samples_split': 4, 'min_samples_leaf': 1, 'max_features': 'sqrt', 'bootstrap': False, 'criterion': 'squared_error'}. Best is trial 341 with value: 0.2909369124469028.
[I 2024-12-04 12:27:05,396] Trial 2446 finished with value: 0.31238977500907716 and parameters: {'n_estimators': 425, 'max_depth': 41, 'min_samples_split': 2, 'min_samples_leaf': 1, 'max_features': 'sqrt', 'bootstrap': False, 'criterion': 'squared_error'}. Best is trial 341 with value: 0.2909369124469028.
[I 2024-12-04 12:27:06,982] Trial 2449 finished with value: 0.30003879847579207 and parameters: {'n_estimators': 258, 'max_depth': 50, 'min_samples_split': 4, 'min_samples_leaf': 1, 'max_features': 'sqrt', 'bootstrap': False, 'criterion': 'squared_error'}. Best is trial 341 with value: 0.2909369124469028.
[I 2024-12-04 12:27:10,082] Trial 2441 finished with value: 0.29827670866010725 and parameters: {'n_estimators': 628, 'max_depth': 50, 'min_samples_split': 2, 'min_samples_leaf': 1, 'max_features': 'sqrt', 'bootstrap': False, 'criterion': 'squared_error'}. Best is trial 341 with value: 0.2909369124469028.
[I 2024-12-04 12:27:10,907] Trial 2450 finished with value: 0.2983691485789962 and parameters: {'n_estimators': 536, 'max_depth': 50, 'min_samples_split': 2, 'min_samples_leaf': 1, 'max_features': 'sqrt', 'bootstrap': False, 'criterion': 'squared_error'}. Best is trial 341 with value: 0.2909369124469028.
[I 2024-12-04 12:27:11,611] Trial 2456 finished with value: 0.30240863828205816 and parameters: {'n_estimators': 435, 'max_depth': 43, 'min_samples_split': 3, 'min_samples_leaf': 1, 'max_features': 'sqrt', 'bootstrap': False, 'criterion': 'squared_error'}. Best is trial 341 with value: 0.2909369124469028.
[I 2024-12-04 12:27:12,002] Trial 2451 finished with value: 0.30172501884605685 and parameters: {'n_estimators': 347, 'max_depth': 43, 'min_samples_split': 3, 'min_samples_leaf': 1, 'max_features': 'sqrt', 'bootstrap': False, 'criterion': 'squared_error'}. Best is trial 341 with value: 0.2909369124469028.
[I 2024-12-04 12:27:13,659] Trial 2447 finished with value: 0.7255419712347383 and parameters: {'n_estimators': 830, 'max_depth': 36, 'min_samples_split': 36, 'min_samples_leaf': 5, 'max_features': 'sqrt', 'bootstrap': True, 'criterion': 'squared_error'}. Best is trial 341 with value: 0.2909369124469028.
[I 2024-12-04 12:27:13,962] Trial 2457 finished with value: 0.29784440383406136 and parameters: {'n_estimators': 361, 'max_depth': 50, 'min_samples_split': 2, 'min_samples_leaf': 1, 'max_features': 'sqrt', 'bootstrap': False, 'criterion': 'squared_error'}. Best is trial 341 with value: 0.2909369124469028.
[I 2024-12-04 12:27:14,012] Trial 2454 finished with value: 0.29512794366973066 and parameters: {'n_estimators': 259, 'max_depth': 50, 'min_samples_split': 3, 'min_samples_leaf': 1, 'max_features': 'sqrt', 'bootstrap': False, 'criterion': 'squared_error'}. Best is trial 341 with value: 0.2909369124469028.
[I 2024-12-04 12:27:14,377] Trial 2460 finished with value: 0.29941194104638025 and parameters: {'n_estimators': 236, 'max_depth': 50, 'min_samples_split': 2, 'min_samples_leaf': 1, 'max_features': 'sqrt', 'bootstrap': False, 'criterion': 'squared_error'}. Best is trial 341 with value: 0.2909369124469028.
[I 2024-12-04 12:27:15,364] Trial 2452 finished with value: 0.44248795133896934 and parameters: {'n_estimators': 380, 'max_depth': 45, 'min_samples_split': 2, 'min_samples_leaf': 2, 'max_features': 'sqrt', 'bootstrap': False, 'criterion': 'squared_error'}. Best is trial 341 with value: 0.2909369124469028.
[I 2024-12-04 12:27:16,834] Trial 2455 finished with value: 0.3673936933889234 and parameters: {'n_estimators': 510, 'max_depth': 41, 'min_samples_split': 16, 'min_samples_leaf': 1, 'max_features': 'sqrt', 'bootstrap': False, 'criterion': 'squared_error'}. Best is trial 341 with value: 0.2909369124469028.
[I 2024-12-04 12:27:17,486] Trial 2445 finished with value: 0.7094476665203321 and parameters: {'n_estimators': 751, 'max_depth': 47, 'min_samples_split': 4, 'min_samples_leaf': 2, 'max_features': 'log2', 'bootstrap': False, 'criterion': 'absolute_error'}. Best is trial 341 with value: 0.2909369124469028.
[I 2024-12-04 12:27:17,595] Trial 2459 finished with value: 0.4744447349158699 and parameters: {'n_estimators': 585, 'max_depth': 36, 'min_samples_split': 5, 'min_samples_leaf': 1, 'max_features': 'log2', 'bootstrap': False, 'criterion': 'squared_error'}. Best is trial 341 with value: 0.2909369124469028.
[I 2024-12-04 12:27:19,659] Trial 2453 finished with value: 0.6726386978739625 and parameters: {'n_estimators': 587, 'max_depth': 10, 'min_samples_split': 6, 'min_samples_leaf': 2, 'max_features': 'sqrt', 'bootstrap': False, 'criterion': 'absolute_error'}. Best is trial 341 with value: 0.2909369124469028.
[I 2024-12-04 12:27:21,305] Trial 2471 finished with value: 0.3030208526121872 and parameters: {'n_estimators': 100, 'max_depth': 44, 'min_samples_split': 3, 'min_samples_leaf': 1, 'max_features': 'sqrt', 'bootstrap': False, 'criterion': 'squared_error'}. Best is trial 341 with value: 0.2909369124469028.
[I 2024-12-04 12:27:21,574] Trial 2462 finished with value: 0.9558686661457512 and parameters: {'n_estimators': 109, 'max_depth': 28, 'min_samples_split': 4, 'min_samples_leaf': 7, 'max_features': 'log2', 'bootstrap': True, 'criterion': 'absolute_error'}. Best is trial 341 with value: 0.2909369124469028.
[I 2024-12-04 12:27:22,228] Trial 2458 finished with value: 0.30158335753082993 and parameters: {'n_estimators': 635, 'max_depth': 43, 'min_samples_split': 3, 'min_samples_leaf': 1, 'max_features': 'sqrt', 'bootstrap': False, 'criterion': 'squared_error'}. Best is trial 341 with value: 0.2909369124469028.
[I 2024-12-04 12:27:22,249] Trial 2467 finished with value: 0.8227860400086616 and parameters: {'n_estimators': 881, 'max_depth': 8, 'min_samples_split': 13, 'min_samples_leaf': 1, 'max_features': 'log2', 'bootstrap': False, 'criterion': 'squared_error'}. Best is trial 341 with value: 0.2909369124469028.
[I 2024-12-04 12:27:23,242] Trial 2469 finished with value: 0.3008809080227728 and parameters: {'n_estimators': 565, 'max_depth': 49, 'min_samples_split': 4, 'min_samples_leaf': 1, 'max_features': 'sqrt', 'bootstrap': False, 'criterion': 'squared_error'}. Best is trial 341 with value: 0.2909369124469028.
[I 2024-12-04 12:27:23,792] Trial 2465 finished with value: 0.5625649824207605 and parameters: {'n_estimators': 105, 'max_depth': 17, 'min_samples_split': 33, 'min_samples_leaf': 1, 'max_features': 'sqrt', 'bootstrap': False, 'criterion': 'absolute_error'}. Best is trial 341 with value: 0.2909369124469028.
[I 2024-12-04 12:27:26,823] Trial 2466 finished with value: 0.3003208340248558 and parameters: {'n_estimators': 376, 'max_depth': 44, 'min_samples_split': 3, 'min_samples_leaf': 1, 'max_features': 'sqrt', 'bootstrap': False, 'criterion': 'squared_error'}. Best is trial 341 with value: 0.2909369124469028.
[I 2024-12-04 12:27:26,871] Trial 2464 finished with value: 0.30765748248803204 and parameters: {'n_estimators': 102, 'max_depth': 44, 'min_samples_split': 4, 'min_samples_leaf': 1, 'max_features': 'sqrt', 'bootstrap': False, 'criterion': 'squared_error'}. Best is trial 341 with value: 0.2909369124469028.
[I 2024-12-04 12:27:28,786] Trial 2473 finished with value: 0.3166306337887551 and parameters: {'n_estimators': 552, 'max_depth': 44, 'min_samples_split': 6, 'min_samples_leaf': 1, 'max_features': 'sqrt', 'bootstrap': False, 'criterion': 'squared_error'}. Best is trial 341 with value: 0.2909369124469028.
[I 2024-12-04 12:27:30,135] Trial 2477 finished with value: 0.44091223952226016 and parameters: {'n_estimators': 369, 'max_depth': 50, 'min_samples_split': 2, 'min_samples_leaf': 2, 'max_features': 'sqrt', 'bootstrap': False, 'criterion': 'squared_error'}. Best is trial 341 with value: 0.2909369124469028.
[I 2024-12-04 12:27:30,426] Trial 2470 finished with value: 0.46837985684372085 and parameters: {'n_estimators': 679, 'max_depth': 39, 'min_samples_split': 41, 'min_samples_leaf': 8, 'max_features': None, 'bootstrap': False, 'criterion': 'squared_error'}. Best is trial 341 with value: 0.2909369124469028.
[I 2024-12-04 12:27:30,560] Trial 2475 finished with value: 0.30057402783509213 and parameters: {'n_estimators': 533, 'max_depth': 50, 'min_samples_split': 4, 'min_samples_leaf': 1, 'max_features': 'sqrt', 'bootstrap': False, 'criterion': 'squared_error'}. Best is trial 341 with value: 0.2909369124469028.
[I 2024-12-04 12:27:30,568] Trial 2476 finished with value: 0.44036185613040485 and parameters: {'n_estimators': 500, 'max_depth': 50, 'min_samples_split': 3, 'min_samples_leaf': 2, 'max_features': 'sqrt', 'bootstrap': False, 'criterion': 'squared_error'}. Best is trial 341 with value: 0.2909369124469028.
[I 2024-12-04 12:27:30,725] Trial 2478 finished with value: 0.380824720043409 and parameters: {'n_estimators': 393, 'max_depth': 50, 'min_samples_split': 3, 'min_samples_leaf': 1, 'max_features': None, 'bootstrap': False, 'criterion': 'squared_error'}. Best is trial 341 with value: 0.2909369124469028.
[I 2024-12-04 12:27:31,155] Trial 2461 finished with value: 0.309498930782246 and parameters: {'n_estimators': 308, 'max_depth': 48, 'min_samples_split': 2, 'min_samples_leaf': 1, 'max_features': 'sqrt', 'bootstrap': False, 'criterion': 'absolute_error'}. Best is trial 341 with value: 0.2909369124469028.
[I 2024-12-04 12:27:31,634] Trial 2468 finished with value: 0.30372660070225804 and parameters: {'n_estimators': 308, 'max_depth': 44, 'min_samples_split': 2, 'min_samples_leaf': 1, 'max_features': 'sqrt', 'bootstrap': False, 'criterion': 'squared_error'}. Best is trial 341 with value: 0.2909369124469028.
[I 2024-12-04 12:27:32,625] Trial 2474 finished with value: 0.2949853077357228 and parameters: {'n_estimators': 367, 'max_depth': 50, 'min_samples_split': 3, 'min_samples_leaf': 1, 'max_features': 'sqrt', 'bootstrap': False, 'criterion': 'squared_error'}. Best is trial 341 with value: 0.2909369124469028.
[I 2024-12-04 12:27:33,344] Trial 2482 finished with value: 0.3003817281785222 and parameters: {'n_estimators': 517, 'max_depth': 50, 'min_samples_split': 4, 'min_samples_leaf': 1, 'max_features': 'sqrt', 'bootstrap': False, 'criterion': 'squared_error'}. Best is trial 341 with value: 0.2909369124469028.
[I 2024-12-04 12:27:33,654] Trial 2479 finished with value: 0.3079577158291148 and parameters: {'n_estimators': 256, 'max_depth': 50, 'min_samples_split': 6, 'min_samples_leaf': 1, 'max_features': 'sqrt', 'bootstrap': False, 'criterion': 'squared_error'}. Best is trial 341 with value: 0.2909369124469028.
[I 2024-12-04 12:27:33,740] Trial 2481 finished with value: 0.9484170820888564 and parameters: {'n_estimators': 314, 'max_depth': 6, 'min_samples_split': 45, 'min_samples_leaf': 11, 'max_features': 'log2', 'bootstrap': False, 'criterion': 'absolute_error'}. Best is trial 341 with value: 0.2909369124469028.
[I 2024-12-04 12:27:34,801] Trial 2484 finished with value: 0.30468406782978424 and parameters: {'n_estimators': 245, 'max_depth': 50, 'min_samples_split': 5, 'min_samples_leaf': 1, 'max_features': 'sqrt', 'bootstrap': False, 'criterion': 'squared_error'}. Best is trial 341 with value: 0.2909369124469028.
[I 2024-12-04 12:27:35,100] Trial 2463 finished with value: 0.7405015313097055 and parameters: {'n_estimators': 976, 'max_depth': 30, 'min_samples_split': 42, 'min_samples_leaf': 5, 'max_features': 'sqrt', 'bootstrap': True, 'criterion': 'absolute_error'}. Best is trial 341 with value: 0.2909369124469028.
[I 2024-12-04 12:27:35,536] Trial 2472 finished with value: 0.3229769924854426 and parameters: {'n_estimators': 232, 'max_depth': 37, 'min_samples_split': 2, 'min_samples_leaf': 1, 'max_features': 'sqrt', 'bootstrap': False, 'criterion': 'squared_error'}. Best is trial 341 with value: 0.2909369124469028.
[I 2024-12-04 12:27:35,755] Trial 2483 finished with value: 0.43894982295705587 and parameters: {'n_estimators': 637, 'max_depth': 50, 'min_samples_split': 6, 'min_samples_leaf': 2, 'max_features': 'sqrt', 'bootstrap': False, 'criterion': 'squared_error'}. Best is trial 341 with value: 0.2909369124469028.
[I 2024-12-04 12:27:36,203] Trial 2480 finished with value: 0.8242723624589099 and parameters: {'n_estimators': 249, 'max_depth': 11, 'min_samples_split': 24, 'min_samples_leaf': 11, 'max_features': 'sqrt', 'bootstrap': False, 'criterion': 'absolute_error'}. Best is trial 341 with value: 0.2909369124469028.
[I 2024-12-04 12:27:36,221] Trial 2488 finished with value: 0.29332690053597826 and parameters: {'n_estimators': 181, 'max_depth': 50, 'min_samples_split': 3, 'min_samples_leaf': 1, 'max_features': 'sqrt', 'bootstrap': False, 'criterion': 'squared_error'}. Best is trial 341 with value: 0.2909369124469028.
[I 2024-12-04 12:27:37,016] Trial 2487 finished with value: 0.34343022664877665 and parameters: {'n_estimators': 182, 'max_depth': 34, 'min_samples_split': 5, 'min_samples_leaf': 1, 'max_features': 'sqrt', 'bootstrap': False, 'criterion': 'squared_error'}. Best is trial 341 with value: 0.2909369124469028.
[I 2024-12-04 12:27:37,023] Trial 2486 finished with value: 0.30418148530546135 and parameters: {'n_estimators': 204, 'max_depth': 44, 'min_samples_split': 2, 'min_samples_leaf': 1, 'max_features': 'sqrt', 'bootstrap': False, 'criterion': 'squared_error'}. Best is trial 341 with value: 0.2909369124469028.
[I 2024-12-04 12:27:37,024] Trial 2491 finished with value: 0.44595520080086354 and parameters: {'n_estimators': 221, 'max_depth': 43, 'min_samples_split': 5, 'min_samples_leaf': 2, 'max_features': 'sqrt', 'bootstrap': False, 'criterion': 'squared_error'}. Best is trial 341 with value: 0.2909369124469028.
[I 2024-12-04 12:27:37,180] Trial 2492 finished with value: 0.9113101109003103 and parameters: {'n_estimators': 133, 'max_depth': 36, 'min_samples_split': 3, 'min_samples_leaf': 4, 'max_features': 'log2', 'bootstrap': True, 'criterion': 'squared_error'}. Best is trial 341 with value: 0.2909369124469028.
[I 2024-12-04 12:27:37,296] Trial 2485 finished with value: 0.3015752230410765 and parameters: {'n_estimators': 623, 'max_depth': 43, 'min_samples_split': 3, 'min_samples_leaf': 1, 'max_features': 'sqrt', 'bootstrap': False, 'criterion': 'squared_error'}. Best is trial 341 with value: 0.2909369124469028.
[I 2024-12-04 12:27:38,227] Trial 2490 finished with value: 0.2970147752164296 and parameters: {'n_estimators': 175, 'max_depth': 50, 'min_samples_split': 2, 'min_samples_leaf': 1, 'max_features': 'sqrt', 'bootstrap': False, 'criterion': 'squared_error'}. Best is trial 341 with value: 0.2909369124469028.
[I 2024-12-04 12:27:38,876] Trial 2489 finished with value: 0.44494463256460975 and parameters: {'n_estimators': 237, 'max_depth': 45, 'min_samples_split': 3, 'min_samples_leaf': 2, 'max_features': 'sqrt', 'bootstrap': False, 'criterion': 'squared_error'}. Best is trial 341 with value: 0.2909369124469028.
[I 2024-12-04 12:27:39,087] Trial 2498 finished with value: 0.44384641231101435 and parameters: {'n_estimators': 161, 'max_depth': 50, 'min_samples_split': 5, 'min_samples_leaf': 2, 'max_features': 'sqrt', 'bootstrap': False, 'criterion': 'squared_error'}. Best is trial 341 with value: 0.2909369124469028.
[I 2024-12-04 12:27:39,165] Trial 2497 finished with value: 0.3381903021176949 and parameters: {'n_estimators': 104, 'max_depth': 47, 'min_samples_split': 11, 'min_samples_leaf': 1, 'max_features': 'sqrt', 'bootstrap': False, 'criterion': 'squared_error'}. Best is trial 341 with value: 0.2909369124469028.
[I 2024-12-04 12:27:39,337] Trial 2499 finished with value: 0.4436542211178629 and parameters: {'n_estimators': 221, 'max_depth': 50, 'min_samples_split': 5, 'min_samples_leaf': 2, 'max_features': 'sqrt', 'bootstrap': False, 'criterion': 'squared_error'}. Best is trial 341 with value: 0.2909369124469028.
[I 2024-12-04 12:27:39,769] Trial 2496 finished with value: 0.4453849773078191 and parameters: {'n_estimators': 720, 'max_depth': 42, 'min_samples_split': 2, 'min_samples_leaf': 2, 'max_features': 'sqrt', 'bootstrap': False, 'criterion': 'squared_error'}. Best is trial 341 with value: 0.2909369124469028.
[I 2024-12-04 12:27:40,637] Trial 2494 finished with value: 0.2983020848551239 and parameters: {'n_estimators': 650, 'max_depth': 50, 'min_samples_split': 2, 'min_samples_leaf': 1, 'max_features': 'sqrt', 'bootstrap': False, 'criterion': 'squared_error'}. Best is trial 341 with value: 0.2909369124469028.
