[I 2024-12-04 12:28:56,594] Trial 474 finished with value: 0.2548512279617715 and parameters: {'n_estimators': 1109, 'learning_rate': 0.028878686261300173, 'max_depth': 12, 'min_samples_split': 3, 'min_samples_leaf': 1, 'subsample': 0.6608537670270815, 'max_features': 'sqrt'}. Best is trial 360 with value: 0.2288165351387474.
[I 2024-12-04 12:28:56,602] Trial 461 finished with value: 0.47397839929076807 and parameters: {'n_estimators': 1457, 'learning_rate': 0.019698625048863716, 'max_depth': 9, 'min_samples_split': 2, 'min_samples_leaf': 9, 'subsample': 0.6154098339213644, 'max_features': None}. Best is trial 360 with value: 0.2288165351387474.
[I 2024-12-04 12:28:56,624] Trial 465 finished with value: 0.24613457089822888 and parameters: {'n_estimators': 1417, 'learning_rate': 0.06436812756544218, 'max_depth': 9, 'min_samples_split': 5, 'min_samples_leaf': 1, 'subsample': 0.6382630949328849, 'max_features': 'sqrt'}. Best is trial 360 with value: 0.2288165351387474.
[I 2024-12-04 12:28:58,196] Trial 483 finished with value: 0.40456013144710523 and parameters: {'n_estimators': 513, 'learning_rate': 0.09981244096373873, 'max_depth': 12, 'min_samples_split': 16, 'min_samples_leaf': 5, 'subsample': 0.6086963950245612, 'max_features': None}. Best is trial 360 with value: 0.2288165351387474.
[I 2024-12-04 12:28:58,539] Trial 464 finished with value: 0.36129036341970666 and parameters: {'n_estimators': 1490, 'learning_rate': 0.06699750399272718, 'max_depth': 12, 'min_samples_split': 3, 'min_samples_leaf': 3, 'subsample': 0.653597480763607, 'max_features': 'sqrt'}. Best is trial 360 with value: 0.2288165351387474.
[I 2024-12-04 12:29:00,088] Trial 476 finished with value: 0.4843113509096424 and parameters: {'n_estimators': 1019, 'learning_rate': 0.016459328215405446, 'max_depth': 6, 'min_samples_split': 10, 'min_samples_leaf': 9, 'subsample': 0.8618878729038102, 'max_features': None}. Best is trial 360 with value: 0.2288165351387474.
[I 2024-12-04 12:29:00,105] Trial 466 finished with value: 0.24669356988805322 and parameters: {'n_estimators': 1428, 'learning_rate': 0.05303926340204761, 'max_depth': 11, 'min_samples_split': 5, 'min_samples_leaf': 1, 'subsample': 0.6955266621999596, 'max_features': 'sqrt'}. Best is trial 360 with value: 0.2288165351387474.
[I 2024-12-04 12:29:00,341] Trial 493 finished with value: 1.1649280076502708 and parameters: {'n_estimators': 304, 'learning_rate': 0.016964942652057807, 'max_depth': 6, 'min_samples_split': 6, 'min_samples_leaf': 8, 'subsample': 0.9417711220876411, 'max_features': 'log2'}. Best is trial 360 with value: 0.2288165351387474.
[I 2024-12-04 12:29:03,036] Trial 473 finished with value: 0.3405529738428699 and parameters: {'n_estimators': 1120, 'learning_rate': 0.0349297172992329, 'max_depth': 10, 'min_samples_split': 3, 'min_samples_leaf': 1, 'subsample': 0.6828689541446065, 'max_features': None}. Best is trial 360 with value: 0.2288165351387474.
[I 2024-12-04 12:29:03,356] Trial 469 finished with value: 0.3461704679323232 and parameters: {'n_estimators': 1237, 'learning_rate': 0.05300234738624563, 'max_depth': 8, 'min_samples_split': 4, 'min_samples_leaf': 1, 'subsample': 0.8972681805152403, 'max_features': None}. Best is trial 360 with value: 0.2288165351387474.
[I 2024-12-04 12:29:06,358] Trial 494 finished with value: 0.5087879004395919 and parameters: {'n_estimators': 252, 'learning_rate': 0.02046881774999346, 'max_depth': 4, 'min_samples_split': 12, 'min_samples_leaf': 9, 'subsample': 0.6273975677403613, 'max_features': None}. Best is trial 360 with value: 0.2288165351387474.
[I 2024-12-04 12:29:07,233] Trial 490 finished with value: 0.3007303572079109 and parameters: {'n_estimators': 498, 'learning_rate': 0.07454727770672803, 'max_depth': 8, 'min_samples_split': 2, 'min_samples_leaf': 2, 'subsample': 0.6352301764288024, 'max_features': 'sqrt'}. Best is trial 360 with value: 0.2288165351387474.
[I 2024-12-04 12:29:08,446] Trial 496 finished with value: 0.5280353507720464 and parameters: {'n_estimators': 350, 'learning_rate': 0.06950295768248631, 'max_depth': 8, 'min_samples_split': 3, 'min_samples_leaf': 3, 'subsample': 0.6502456023885494, 'max_features': 'log2'}. Best is trial 360 with value: 0.2288165351387474.
[I 2024-12-04 12:29:12,489] Trial 485 finished with value: 1.1187395059360008 and parameters: {'n_estimators': 741, 'learning_rate': 0.010865592711906413, 'max_depth': 5, 'min_samples_split': 17, 'min_samples_leaf': 9, 'subsample': 0.6937423327939303, 'max_features': 'log2'}. Best is trial 360 with value: 0.2288165351387474.
[I 2024-12-04 12:29:14,646] Trial 479 finished with value: 0.29227946944622757 and parameters: {'n_estimators': 1039, 'learning_rate': 0.028099248297005438, 'max_depth': 11, 'min_samples_split': 3, 'min_samples_leaf': 2, 'subsample': 0.7368420797771074, 'max_features': 'sqrt'}. Best is trial 360 with value: 0.2288165351387474.
[I 2024-12-04 12:29:15,338] Trial 478 finished with value: 0.24801207209307571 and parameters: {'n_estimators': 1258, 'learning_rate': 0.03794652341623303, 'max_depth': 8, 'min_samples_split': 3, 'min_samples_leaf': 1, 'subsample': 0.8222661590666985, 'max_features': 'sqrt'}. Best is trial 360 with value: 0.2288165351387474.
[I 2024-12-04 12:29:15,668] Trial 472 finished with value: 0.25178226742939175 and parameters: {'n_estimators': 1464, 'learning_rate': 0.07060006370058561, 'max_depth': 11, 'min_samples_split': 6, 'min_samples_leaf': 1, 'subsample': 0.6150571035744009, 'max_features': 'sqrt'}. Best is trial 360 with value: 0.2288165351387474.
[I 2024-12-04 12:29:22,379] Trial 475 finished with value: 0.29021841026235723 and parameters: {'n_estimators': 1500, 'learning_rate': 0.03295895458842374, 'max_depth': 12, 'min_samples_split': 2, 'min_samples_leaf': 2, 'subsample': 0.6069556046095399, 'max_features': 'sqrt'}. Best is trial 360 with value: 0.2288165351387474.
[I 2024-12-04 12:29:28,533] Trial 482 finished with value: 0.6364230942481507 and parameters: {'n_estimators': 1242, 'learning_rate': 0.013332250168005783, 'max_depth': 5, 'min_samples_split': 14, 'min_samples_leaf': 9, 'subsample': 0.6378790905815199, 'max_features': 'sqrt'}. Best is trial 360 with value: 0.2288165351387474.
[I 2024-12-04 12:29:29,310] Trial 505 finished with value: 0.554731853660325 and parameters: {'n_estimators': 161, 'learning_rate': 0.01125151376626009, 'max_depth': 12, 'min_samples_split': 4, 'min_samples_leaf': 10, 'subsample': 0.9461951324016459, 'max_features': None}. Best is trial 360 with value: 0.2288165351387474.
[I 2024-12-04 12:29:30,783] Trial 502 finished with value: 0.7995972401580852 and parameters: {'n_estimators': 475, 'learning_rate': 0.021106306627829422, 'max_depth': 3, 'min_samples_split': 14, 'min_samples_leaf': 9, 'subsample': 0.8203644035373381, 'max_features': 'sqrt'}. Best is trial 360 with value: 0.2288165351387474.
[I 2024-12-04 12:29:32,441] Trial 511 finished with value: 0.5811251026616747 and parameters: {'n_estimators': 202, 'learning_rate': 0.039938606619594405, 'max_depth': 11, 'min_samples_split': 16, 'min_samples_leaf': 7, 'subsample': 0.7686808847614701, 'max_features': 'sqrt'}. Best is trial 360 with value: 0.2288165351387474.
[I 2024-12-04 12:29:34,479] Trial 495 finished with value: 0.25057744720247543 and parameters: {'n_estimators': 885, 'learning_rate': 0.07102583219862144, 'max_depth': 6, 'min_samples_split': 3, 'min_samples_leaf': 1, 'subsample': 0.8340468625849238, 'max_features': 'sqrt'}. Best is trial 360 with value: 0.2288165351387474.
[I 2024-12-04 12:29:40,878] Trial 488 finished with value: 0.2906307999544194 and parameters: {'n_estimators': 1232, 'learning_rate': 0.06309326001197249, 'max_depth': 12, 'min_samples_split': 2, 'min_samples_leaf': 2, 'subsample': 0.7486880013444256, 'max_features': 'sqrt'}. Best is trial 360 with value: 0.2288165351387474.
[I 2024-12-04 12:29:42,089] Trial 481 finished with value: 0.24164285293808474 and parameters: {'n_estimators': 1486, 'learning_rate': 0.052407460810697706, 'max_depth': 10, 'min_samples_split': 2, 'min_samples_leaf': 1, 'subsample': 0.634666670810971, 'max_features': 'sqrt'}. Best is trial 360 with value: 0.2288165351387474.
[I 2024-12-04 12:29:44,767] Trial 487 finished with value: 0.26253238163798664 and parameters: {'n_estimators': 1325, 'learning_rate': 0.07288600745453953, 'max_depth': 9, 'min_samples_split': 2, 'min_samples_leaf': 1, 'subsample': 0.8911323450999058, 'max_features': 'sqrt'}. Best is trial 360 with value: 0.2288165351387474.
[I 2024-12-04 12:29:44,835] Trial 484 finished with value: 0.3709372869949624 and parameters: {'n_estimators': 1451, 'learning_rate': 0.0450202175872718, 'max_depth': 7, 'min_samples_split': 3, 'min_samples_leaf': 4, 'subsample': 0.6050269997945585, 'max_features': 'sqrt'}. Best is trial 360 with value: 0.2288165351387474.
[I 2024-12-04 12:29:48,199] Trial 497 finished with value: 0.28786033260509586 and parameters: {'n_estimators': 1081, 'learning_rate': 0.05694084008932403, 'max_depth': 12, 'min_samples_split': 8, 'min_samples_leaf': 2, 'subsample': 0.7333424235948309, 'max_features': 'sqrt'}. Best is trial 360 with value: 0.2288165351387474.
[I 2024-12-04 12:29:48,211] Trial 489 finished with value: 0.28583790995008845 and parameters: {'n_estimators': 1340, 'learning_rate': 0.040252203272612995, 'max_depth': 9, 'min_samples_split': 3, 'min_samples_leaf': 2, 'subsample': 0.6097532986629386, 'max_features': 'sqrt'}. Best is trial 360 with value: 0.2288165351387474.
[I 2024-12-04 12:29:50,105] Trial 512 finished with value: 0.36841714182077445 and parameters: {'n_estimators': 560, 'learning_rate': 0.0771073822887124, 'max_depth': 6, 'min_samples_split': 2, 'min_samples_leaf': 4, 'subsample': 0.7493570654748919, 'max_features': 'sqrt'}. Best is trial 360 with value: 0.2288165351387474.
[I 2024-12-04 12:29:50,138] Trial 486 finished with value: 0.35659670678893673 and parameters: {'n_estimators': 1481, 'learning_rate': 0.05792391454498984, 'max_depth': 9, 'min_samples_split': 3, 'min_samples_leaf': 3, 'subsample': 0.6996168738237548, 'max_features': 'sqrt'}. Best is trial 360 with value: 0.2288165351387474.
[I 2024-12-04 12:29:51,800] Trial 516 finished with value: 0.4113821468196974 and parameters: {'n_estimators': 374, 'learning_rate': 0.034672345229800026, 'max_depth': 4, 'min_samples_split': 8, 'min_samples_leaf': 3, 'subsample': 0.8930597875916695, 'max_features': None}. Best is trial 360 with value: 0.2288165351387474.
[I 2024-12-04 12:29:55,109] Trial 492 finished with value: 0.2763126036848808 and parameters: {'n_estimators': 1356, 'learning_rate': 0.056707368010174904, 'max_depth': 9, 'min_samples_split': 4, 'min_samples_leaf': 2, 'subsample': 0.7594490261649215, 'max_features': 'sqrt'}. Best is trial 360 with value: 0.2288165351387474.
[I 2024-12-04 12:29:58,114] Trial 501 finished with value: 0.38491082421384065 and parameters: {'n_estimators': 919, 'learning_rate': 0.09742471314026635, 'max_depth': 9, 'min_samples_split': 15, 'min_samples_leaf': 3, 'subsample': 0.7501757373678021, 'max_features': None}. Best is trial 360 with value: 0.2288165351387474.
[I 2024-12-04 12:29:58,212] Trial 491 finished with value: 0.24581054224967014 and parameters: {'n_estimators': 1461, 'learning_rate': 0.05340415785503552, 'max_depth': 7, 'min_samples_split': 2, 'min_samples_leaf': 1, 'subsample': 0.602027876788826, 'max_features': 'sqrt'}. Best is trial 360 with value: 0.2288165351387474.
[I 2024-12-04 12:30:01,382] Trial 499 finished with value: 0.24603541066457393 and parameters: {'n_estimators': 1183, 'learning_rate': 0.07590220151783002, 'max_depth': 12, 'min_samples_split': 2, 'min_samples_leaf': 1, 'subsample': 0.7001583144256386, 'max_features': 'sqrt'}. Best is trial 360 with value: 0.2288165351387474.
[I 2024-12-04 12:30:04,008] Trial 500 finished with value: 0.25945833761060144 and parameters: {'n_estimators': 1249, 'learning_rate': 0.05422950379973483, 'max_depth': 11, 'min_samples_split': 5, 'min_samples_leaf': 1, 'subsample': 0.6620257468098356, 'max_features': 'sqrt'}. Best is trial 360 with value: 0.2288165351387474.
[I 2024-12-04 12:30:08,054] Trial 498 finished with value: 0.2776775737629559 and parameters: {'n_estimators': 1449, 'learning_rate': 0.08624804516809932, 'max_depth': 9, 'min_samples_split': 3, 'min_samples_leaf': 1, 'subsample': 0.7255870755056951, 'max_features': 'sqrt'}. Best is trial 360 with value: 0.2288165351387474.
[I 2024-12-04 12:30:10,179] Trial 515 finished with value: 1.0656223496480821 and parameters: {'n_estimators': 803, 'learning_rate': 0.012393816041628931, 'max_depth': 4, 'min_samples_split': 8, 'min_samples_leaf': 8, 'subsample': 0.832502571755344, 'max_features': 'log2'}. Best is trial 360 with value: 0.2288165351387474.
[I 2024-12-04 12:30:11,363] Trial 506 finished with value: 0.2650301044841155 and parameters: {'n_estimators': 1078, 'learning_rate': 0.06486675928921862, 'max_depth': 7, 'min_samples_split': 2, 'min_samples_leaf': 1, 'subsample': 0.7894502245533477, 'max_features': 'sqrt'}. Best is trial 360 with value: 0.2288165351387474.
[I 2024-12-04 12:30:13,749] Trial 525 finished with value: 0.4784019846666987 and parameters: {'n_estimators': 463, 'learning_rate': 0.036434815125712526, 'max_depth': 12, 'min_samples_split': 17, 'min_samples_leaf': 9, 'subsample': 0.9014204673266787, 'max_features': None}. Best is trial 360 with value: 0.2288165351387474.
[I 2024-12-04 12:30:13,832] Trial 527 finished with value: 0.8589588539153796 and parameters: {'n_estimators': 458, 'learning_rate': 0.05666061065745537, 'max_depth': 5, 'min_samples_split': 19, 'min_samples_leaf': 8, 'subsample': 0.6609363855316444, 'max_features': 'log2'}. Best is trial 360 with value: 0.2288165351387474.
[I 2024-12-04 12:30:13,840] Trial 508 finished with value: 0.2619999707772833 and parameters: {'n_estimators': 1114, 'learning_rate': 0.049686636359284206, 'max_depth': 12, 'min_samples_split': 5, 'min_samples_leaf': 1, 'subsample': 0.708391796511441, 'max_features': 'sqrt'}. Best is trial 360 with value: 0.2288165351387474.
[I 2024-12-04 12:30:19,334] Trial 509 finished with value: 0.2562370879668588 and parameters: {'n_estimators': 1184, 'learning_rate': 0.05415872883845818, 'max_depth': 7, 'min_samples_split': 2, 'min_samples_leaf': 1, 'subsample': 0.7093575259171984, 'max_features': 'log2'}. Best is trial 360 with value: 0.2288165351387474.
[I 2024-12-04 12:30:20,886] Trial 507 finished with value: 0.25009816698708276 and parameters: {'n_estimators': 1121, 'learning_rate': 0.059559255014963966, 'max_depth': 10, 'min_samples_split': 3, 'min_samples_leaf': 1, 'subsample': 0.6916371851227247, 'max_features': 'sqrt'}. Best is trial 360 with value: 0.2288165351387474.
[I 2024-12-04 12:30:21,753] Trial 504 finished with value: 0.23606200714183553 and parameters: {'n_estimators': 1354, 'learning_rate': 0.05364632968730029, 'max_depth': 12, 'min_samples_split': 4, 'min_samples_leaf': 1, 'subsample': 0.6985067100440586, 'max_features': 'sqrt'}. Best is trial 360 with value: 0.2288165351387474.
[I 2024-12-04 12:30:22,645] Trial 503 finished with value: 0.24101067680209803 and parameters: {'n_estimators': 1371, 'learning_rate': 0.09837736327155726, 'max_depth': 7, 'min_samples_split': 2, 'min_samples_leaf': 1, 'subsample': 0.6210470258005854, 'max_features': 'sqrt'}. Best is trial 360 with value: 0.2288165351387474.
[I 2024-12-04 12:30:23,808] Trial 531 finished with value: 0.7954202023824588 and parameters: {'n_estimators': 439, 'learning_rate': 0.011906911243311048, 'max_depth': 10, 'min_samples_split': 19, 'min_samples_leaf': 9, 'subsample': 0.9252010525499392, 'max_features': 'sqrt'}. Best is trial 360 with value: 0.2288165351387474.
[I 2024-12-04 12:30:28,876] Trial 517 finished with value: 0.2450548849510585 and parameters: {'n_estimators': 1060, 'learning_rate': 0.09298338401505657, 'max_depth': 6, 'min_samples_split': 4, 'min_samples_leaf': 1, 'subsample': 0.6138003459932487, 'max_features': 'sqrt'}. Best is trial 360 with value: 0.2288165351387474.
[I 2024-12-04 12:30:29,405] Trial 528 finished with value: 0.7536818487214529 and parameters: {'n_estimators': 673, 'learning_rate': 0.011919986586054396, 'max_depth': 8, 'min_samples_split': 15, 'min_samples_leaf': 2, 'subsample': 0.9199980917270507, 'max_features': 'log2'}. Best is trial 360 with value: 0.2288165351387474.
[I 2024-12-04 12:30:29,407] Trial 541 finished with value: 1.2264657689590122 and parameters: {'n_estimators': 124, 'learning_rate': 0.011120422783509571, 'max_depth': 4, 'min_samples_split': 20, 'min_samples_leaf': 4, 'subsample': 0.9930632152286207, 'max_features': 'log2'}. Best is trial 360 with value: 0.2288165351387474.
[I 2024-12-04 12:30:34,436] Trial 530 finished with value: 0.45639105763416626 and parameters: {'n_estimators': 664, 'learning_rate': 0.08644399052893564, 'max_depth': 4, 'min_samples_split': 7, 'min_samples_leaf': 9, 'subsample': 0.9685776736607707, 'max_features': 'sqrt'}. Best is trial 360 with value: 0.2288165351387474.
[I 2024-12-04 12:30:34,503] Trial 519 finished with value: 0.3630777739588752 and parameters: {'n_estimators': 1017, 'learning_rate': 0.06966560487110744, 'max_depth': 9, 'min_samples_split': 2, 'min_samples_leaf': 1, 'subsample': 0.784411135399728, 'max_features': None}. Best is trial 360 with value: 0.2288165351387474.
[I 2024-12-04 12:30:36,013] Trial 518 finished with value: 0.24971310382603806 and parameters: {'n_estimators': 1212, 'learning_rate': 0.09952072641583065, 'max_depth': 5, 'min_samples_split': 6, 'min_samples_leaf': 1, 'subsample': 0.6717946899372065, 'max_features': 'sqrt'}. Best is trial 360 with value: 0.2288165351387474.
[I 2024-12-04 12:30:40,358] Trial 523 finished with value: 0.4314374079138319 and parameters: {'n_estimators': 1011, 'learning_rate': 0.03386950156524142, 'max_depth': 8, 'min_samples_split': 19, 'min_samples_leaf': 6, 'subsample': 0.8757726443446483, 'max_features': None}. Best is trial 360 with value: 0.2288165351387474.
[I 2024-12-04 12:30:40,398] Trial 510 finished with value: 0.24361036132427347 and parameters: {'n_estimators': 1400, 'learning_rate': 0.04579596087657127, 'max_depth': 8, 'min_samples_split': 5, 'min_samples_leaf': 1, 'subsample': 0.714743194851399, 'max_features': 'sqrt'}. Best is trial 360 with value: 0.2288165351387474.
[I 2024-12-04 12:30:44,629] Trial 514 finished with value: 0.3641409687238866 and parameters: {'n_estimators': 1363, 'learning_rate': 0.01694970182630086, 'max_depth': 3, 'min_samples_split': 5, 'min_samples_leaf': 2, 'subsample': 0.6619462322627191, 'max_features': None}. Best is trial 360 with value: 0.2288165351387474.
[I 2024-12-04 12:30:44,641] Trial 520 finished with value: 0.38893678832357165 and parameters: {'n_estimators': 1129, 'learning_rate': 0.0937365197133648, 'max_depth': 8, 'min_samples_split': 4, 'min_samples_leaf': 2, 'subsample': 0.6243484397668494, 'max_features': None}. Best is trial 360 with value: 0.2288165351387474.
[I 2024-12-04 12:30:47,989] Trial 513 finished with value: 0.24489282365535728 and parameters: {'n_estimators': 1478, 'learning_rate': 0.05159169389291308, 'max_depth': 11, 'min_samples_split': 4, 'min_samples_leaf': 1, 'subsample': 0.7073199857881428, 'max_features': 'sqrt'}. Best is trial 360 with value: 0.2288165351387474.
[I 2024-12-04 12:30:58,332] Trial 521 finished with value: 0.25636333348487056 and parameters: {'n_estimators': 1478, 'learning_rate': 0.05398729658812496, 'max_depth': 12, 'min_samples_split': 6, 'min_samples_leaf': 1, 'subsample': 0.7726133190770188, 'max_features': 'sqrt'}. Best is trial 360 with value: 0.2288165351387474.
[I 2024-12-04 12:30:59,573] Trial 522 finished with value: 0.376128943027065 and parameters: {'n_estimators': 1494, 'learning_rate': 0.031684804282115626, 'max_depth': 11, 'min_samples_split': 8, 'min_samples_leaf': 5, 'subsample': 0.6870205280289483, 'max_features': 'sqrt'}. Best is trial 360 with value: 0.2288165351387474.
[I 2024-12-04 12:31:03,791] Trial 526 finished with value: 0.24289335426160216 and parameters: {'n_estimators': 1328, 'learning_rate': 0.06030166590706344, 'max_depth': 9, 'min_samples_split': 3, 'min_samples_leaf': 1, 'subsample': 0.6555478582275034, 'max_features': 'sqrt'}. Best is trial 360 with value: 0.2288165351387474.
[I 2024-12-04 12:31:07,871] Trial 544 finished with value: 0.41243839136212623 and parameters: {'n_estimators': 741, 'learning_rate': 0.02916151477155847, 'max_depth': 5, 'min_samples_split': 16, 'min_samples_leaf': 5, 'subsample': 0.6232813555523008, 'max_features': None}. Best is trial 360 with value: 0.2288165351387474.
[I 2024-12-04 12:31:11,000] Trial 556 finished with value: 0.4772125968753202 and parameters: {'n_estimators': 441, 'learning_rate': 0.0409392145053044, 'max_depth': 9, 'min_samples_split': 12, 'min_samples_leaf': 2, 'subsample': 0.624329985970471, 'max_features': 'log2'}. Best is trial 360 with value: 0.2288165351387474.
[I 2024-12-04 12:31:11,865] Trial 529 finished with value: 0.23224761537854138 and parameters: {'n_estimators': 1388, 'learning_rate': 0.0606282875451806, 'max_depth': 10, 'min_samples_split': 3, 'min_samples_leaf': 1, 'subsample': 0.6259846779199056, 'max_features': 'sqrt'}. Best is trial 360 with value: 0.2288165351387474.
[I 2024-12-04 12:31:15,173] Trial 524 finished with value: 0.42880898767584535 and parameters: {'n_estimators': 1489, 'learning_rate': 0.044079398202951335, 'max_depth': 8, 'min_samples_split': 8, 'min_samples_leaf': 7, 'subsample': 0.7270506199612783, 'max_features': None}. Best is trial 360 with value: 0.2288165351387474.
[I 2024-12-04 12:31:16,606] Trial 542 finished with value: 0.9823759729033468 and parameters: {'n_estimators': 985, 'learning_rate': 0.01215878357941838, 'max_depth': 3, 'min_samples_split': 10, 'min_samples_leaf': 4, 'subsample': 0.644734300199528, 'max_features': 'log2'}. Best is trial 360 with value: 0.2288165351387474.
