[I 2024-12-04 00:18:59,878] Trial 1288 finished with value: 0.1482074459724464 and parameters: {'kernel': 'rbf', 'C': 90.72612253827147, 'gamma': 0.011554692789231697, 'epsilon': 0.004013937203126562}. Best is trial 973 with value: 0.1397919550170376.
[I 2024-12-04 00:19:01,059] Trial 1291 finished with value: 0.21623157978249258 and parameters: {'kernel': 'rbf', 'C': 16.516731370124006, 'gamma': 0.008000882044275204, 'epsilon': 0.0011751880983792578}. Best is trial 973 with value: 0.1397919550170376.
[I 2024-12-04 00:19:01,243] Trial 1289 finished with value: 0.2306394493117911 and parameters: {'kernel': 'rbf', 'C': 91.96614846382607, 'gamma': 0.09062640069233366, 'epsilon': 0.0021366604905127913}. Best is trial 973 with value: 0.1397919550170376.
[I 2024-12-04 00:19:03,509] Trial 1294 finished with value: 0.3785677353596787 and parameters: {'kernel': 'linear', 'C': 0.06937829996276922, 'gamma': 0.02511265089451535, 'epsilon': 0.023976465859377495}. Best is trial 973 with value: 0.1397919550170376.
[I 2024-12-04 00:19:03,988] Trial 1292 finished with value: 0.14781726399526612 and parameters: {'kernel': 'rbf', 'C': 26.799761311739008, 'gamma': 0.018359185117959555, 'epsilon': 0.0010367123644594398}. Best is trial 973 with value: 0.1397919550170376.
[I 2024-12-04 00:19:06,161] Trial 1295 finished with value: 2.532359251296838 and parameters: {'kernel': 'sigmoid', 'C': 1.1903358479050015, 'gamma': 0.0028003015570132786, 'epsilon': 0.07622871063980707}. Best is trial 973 with value: 0.1397919550170376.
[I 2024-12-04 00:19:08,419] Trial 1293 finished with value: 0.168675350395408 and parameters: {'kernel': 'rbf', 'C': 68.60731138256193, 'gamma': 0.020165707493138067, 'epsilon': 0.0010000111152592825}. Best is trial 973 with value: 0.1397919550170376.
[I 2024-12-04 00:19:08,456] Trial 1297 finished with value: 0.2603255606952758 and parameters: {'kernel': 'rbf', 'C': 8.88076648657301, 'gamma': 0.006288673539742153, 'epsilon': 0.001056084740777964}. Best is trial 973 with value: 0.1397919550170376.
[I 2024-12-04 00:19:08,509] Trial 1296 finished with value: 0.21882146856677298 and parameters: {'kernel': 'rbf', 'C': 7.18902945845492, 'gamma': 0.07964996348469254, 'epsilon': 0.002720504632199292}. Best is trial 973 with value: 0.1397919550170376.
[I 2024-12-04 00:19:11,374] Trial 1299 finished with value: 0.22916531604800824 and parameters: {'kernel': 'rbf', 'C': 18.286092294554752, 'gamma': 0.006169851314487663, 'epsilon': 0.00260694792892583}. Best is trial 973 with value: 0.1397919550170376.
[I 2024-12-04 00:19:12,978] Trial 1300 finished with value: 0.1642009099311312 and parameters: {'kernel': 'rbf', 'C': 94.8400805813236, 'gamma': 0.004022967648176341, 'epsilon': 0.0017896828452253844}. Best is trial 973 with value: 0.1397919550170376.
[I 2024-12-04 00:19:14,622] Trial 1301 finished with value: 0.19256356755879978 and parameters: {'kernel': 'rbf', 'C': 32.433382742666446, 'gamma': 0.0062069258266278515, 'epsilon': 0.001053879961734934}. Best is trial 973 with value: 0.1397919550170376.
[I 2024-12-04 00:19:15,431] Trial 1140 finished with value: 0.35282081554264966 and parameters: {'kernel': 'linear', 'C': 29.924439037806074, 'gamma': 0.029144309955775848, 'epsilon': 0.0022368210258635404}. Best is trial 973 with value: 0.1397919550170376.
[I 2024-12-04 00:19:16,493] Trial 1298 finished with value: 0.1685601922257501 and parameters: {'kernel': 'rbf', 'C': 90.54299755364904, 'gamma': 0.019238800227832177, 'epsilon': 0.004268811171863457}. Best is trial 973 with value: 0.1397919550170376.
[I 2024-12-04 00:19:17,073] Trial 1303 finished with value: 0.3421593064681631 and parameters: {'kernel': 'rbf', 'C': 19.049608956878842, 'gamma': 0.0009523975991421452, 'epsilon': 0.0030918253721095835}. Best is trial 973 with value: 0.1397919550170376.
[I 2024-12-04 00:19:17,477] Trial 1304 finished with value: 0.9431655636054177 and parameters: {'kernel': 'sigmoid', 'C': 0.003931899131301425, 'gamma': 0.007553635254128503, 'epsilon': 0.13921608733056226}. Best is trial 973 with value: 0.1397919550170376.
[I 2024-12-04 00:19:19,684] Trial 1306 finished with value: 0.448603103675646 and parameters: {'kernel': 'rbf', 'C': 35.77221521833622, 'gamma': 0.0001655831082616476, 'epsilon': 0.0014318402663278306}. Best is trial 973 with value: 0.1397919550170376.
[I 2024-12-04 00:19:19,689] Trial 1307 finished with value: 0.9839510055864501 and parameters: {'kernel': 'rbf', 'C': 0.005023049571558485, 'gamma': 0.0005269023448678878, 'epsilon': 0.13986213467186678}. Best is trial 973 with value: 0.1397919550170376.
[I 2024-12-04 00:19:20,782] Trial 1305 finished with value: 0.17038315140083699 and parameters: {'kernel': 'rbf', 'C': 98.02264583204918, 'gamma': 0.0035697489298644994, 'epsilon': 0.0010255872004870177}. Best is trial 973 with value: 0.1397919550170376.
[I 2024-12-04 00:19:21,230] Trial 1302 finished with value: 0.18438988916950666 and parameters: {'kernel': 'rbf', 'C': 91.11118878591765, 'gamma': 0.03079824325098911, 'epsilon': 0.0010098223600888846}. Best is trial 973 with value: 0.1397919550170376.
[I 2024-12-04 00:19:21,582] Trial 1308 finished with value: 0.35649828303417597 and parameters: {'kernel': 'linear', 'C': 0.38792917731912824, 'gamma': 0.05206227930601837, 'epsilon': 0.48657024031537344}. Best is trial 973 with value: 0.1397919550170376.
[I 2024-12-04 00:19:24,077] Trial 1311 finished with value: 0.3143861030068916 and parameters: {'kernel': 'rbf', 'C': 30.653944881148043, 'gamma': 0.0008392581069883664, 'epsilon': 0.0010327342702347738}. Best is trial 973 with value: 0.1397919550170376.
[I 2024-12-04 00:19:25,738] Trial 1309 finished with value: 0.14047679797886753 and parameters: {'kernel': 'rbf', 'C': 96.01947055466688, 'gamma': 0.009042246836726256, 'epsilon': 0.0010978353458118329}. Best is trial 973 with value: 0.1397919550170376.
[I 2024-12-04 00:19:26,188] Trial 1310 finished with value: 0.14103065750251537 and parameters: {'kernel': 'rbf', 'C': 93.30057403330032, 'gamma': 0.009908874753732384, 'epsilon': 0.0031323637344128703}. Best is trial 973 with value: 0.1397919550170376.
[I 2024-12-04 00:19:27,049] Trial 1313 finished with value: 0.1786573929958489 and parameters: {'kernel': 'rbf', 'C': 23.499897004128155, 'gamma': 0.009219927793661606, 'epsilon': 0.0011024447474692976}. Best is trial 973 with value: 0.1397919550170376.
[I 2024-12-04 00:19:29,919] Trial 1314 finished with value: 0.14920927555269037 and parameters: {'kernel': 'rbf', 'C': 93.45687196051284, 'gamma': 0.005688830661254762, 'epsilon': 0.0013567528241058419}. Best is trial 973 with value: 0.1397919550170376.
[I 2024-12-04 00:19:31,845] Trial 1316 finished with value: 0.19825433479733326 and parameters: {'kernel': 'rbf', 'C': 20.954145924900246, 'gamma': 0.052210817486202134, 'epsilon': 0.0020717495272776264}. Best is trial 973 with value: 0.1397919550170376.
[I 2024-12-04 00:19:33,152] Trial 1315 finished with value: 0.14736217686984768 and parameters: {'kernel': 'rbf', 'C': 77.65690748417708, 'gamma': 0.01215505874594966, 'epsilon': 0.0011036212310607002}. Best is trial 973 with value: 0.1397919550170376.
[I 2024-12-04 00:19:38,206] Trial 1319 finished with value: 0.14162031608502318 and parameters: {'kernel': 'rbf', 'C': 75.65487356312173, 'gamma': 0.007993257859460312, 'epsilon': 0.0011657388005655545}. Best is trial 973 with value: 0.1397919550170376.
[I 2024-12-04 00:19:38,343] Trial 1317 finished with value: 0.18609130938376167 and parameters: {'kernel': 'rbf', 'C': 96.08140944410319, 'gamma': 0.03227010766808563, 'epsilon': 0.0020059950158998648}. Best is trial 973 with value: 0.1397919550170376.
[I 2024-12-04 00:19:39,485] Trial 1318 finished with value: 0.15630210537982353 and parameters: {'kernel': 'rbf', 'C': 97.29243326876176, 'gamma': 0.012831447998790753, 'epsilon': 0.0015503267245948857}. Best is trial 973 with value: 0.1397919550170376.
[I 2024-12-04 00:19:40,671] Trial 1321 finished with value: 0.9193250505501859 and parameters: {'kernel': 'rbf', 'C': 0.10463759857144568, 'gamma': 0.00012351211889311732, 'epsilon': 0.0018351318264001124}. Best is trial 973 with value: 0.1397919550170376.
[I 2024-12-04 00:19:41,854] Trial 1322 finished with value: 0.9576032126843906 and parameters: {'kernel': 'poly', 'C': 0.03002708443430721, 'gamma': 0.0031583394340006206, 'epsilon': 0.13101958173747416}. Best is trial 973 with value: 0.1397919550170376.
[I 2024-12-04 00:19:43,407] Trial 1323 finished with value: 0.24443858287541104 and parameters: {'kernel': 'rbf', 'C': 23.679457263758273, 'gamma': 0.003822076357738837, 'epsilon': 0.00203907357989637}. Best is trial 973 with value: 0.1397919550170376.
[I 2024-12-04 00:19:45,833] Trial 1320 finished with value: 0.18782163663125107 and parameters: {'kernel': 'rbf', 'C': 98.10685301660618, 'gamma': 0.033721823393956636, 'epsilon': 0.0029590745580531782}. Best is trial 973 with value: 0.1397919550170376.
[I 2024-12-04 00:19:46,684] Trial 1325 finished with value: 0.17276955901343066 and parameters: {'kernel': 'rbf', 'C': 18.152136693363897, 'gamma': 0.012384470559228781, 'epsilon': 0.0014090870526060045}. Best is trial 973 with value: 0.1397919550170376.
[I 2024-12-04 00:19:47,737] Trial 1326 finished with value: 0.8649728054843341 and parameters: {'kernel': 'poly', 'C': 11.72623345665894, 'gamma': 0.0018924112200319452, 'epsilon': 0.0010413847934928348}. Best is trial 973 with value: 0.1397919550170376.
[I 2024-12-04 00:19:49,778] Trial 1328 finished with value: 23.79483029752741 and parameters: {'kernel': 'sigmoid', 'C': 1.0064808226351867, 'gamma': 0.052847351119293506, 'epsilon': 0.01730735956549621}. Best is trial 973 with value: 0.1397919550170376.
[I 2024-12-04 00:19:51,667] Trial 1327 finished with value: 0.1461410170809354 and parameters: {'kernel': 'rbf', 'C': 98.8212511956658, 'gamma': 0.00597844658218307, 'epsilon': 0.0020205398150361965}. Best is trial 973 with value: 0.1397919550170376.
[I 2024-12-04 00:19:51,902] Trial 1287 finished with value: 0.3516331068054425 and parameters: {'kernel': 'linear', 'C': 10.975151380387237, 'gamma': 0.06351310916848561, 'epsilon': 0.011392397941232608}. Best is trial 973 with value: 0.1397919550170376.
[I 2024-12-04 00:19:54,073] Trial 1330 finished with value: 0.993960842257871 and parameters: {'kernel': 'rbf', 'C': 0.0034416713588414556, 'gamma': 0.0002101716629359279, 'epsilon': 0.005890936524024464}. Best is trial 973 with value: 0.1397919550170376.
[I 2024-12-04 00:19:55,884] Trial 1228 finished with value: 0.524877855360959 and parameters: {'kernel': 'poly', 'C': 8.259779630905971, 'gamma': 0.03554088666901511, 'epsilon': 0.052343884232722}. Best is trial 973 with value: 0.1397919550170376.
[I 2024-12-04 00:19:56,878] Trial 1329 finished with value: 0.168721337585121 and parameters: {'kernel': 'rbf', 'C': 96.50198674201576, 'gamma': 0.01794809519343487, 'epsilon': 0.0028083631918963724}. Best is trial 973 with value: 0.1397919550170376.
[I 2024-12-04 00:19:57,379] Trial 1331 finished with value: 0.14073571406750965 and parameters: {'kernel': 'rbf', 'C': 79.49640406475069, 'gamma': 0.008228308467988613, 'epsilon': 0.0010481263967672132}. Best is trial 973 with value: 0.1397919550170376.
[I 2024-12-04 00:19:57,927] Trial 1332 finished with value: 0.15043613198587363 and parameters: {'kernel': 'rbf', 'C': 18.09040296057396, 'gamma': 0.022780037227152335, 'epsilon': 0.0010275541204878902}. Best is trial 973 with value: 0.1397919550170376.
[I 2024-12-04 00:20:00,593] Trial 1336 finished with value: 0.2611655254676631 and parameters: {'kernel': 'rbf', 'C': 99.05886120271846, 'gamma': 0.0006855935646997407, 'epsilon': 0.0011919645794800909}. Best is trial 973 with value: 0.1397919550170376.
[I 2024-12-04 00:20:01,533] Trial 1333 finished with value: 0.140883371677228 and parameters: {'kernel': 'rbf', 'C': 87.46998317987835, 'gamma': 0.00929487208867673, 'epsilon': 0.0011182438107755913}. Best is trial 973 with value: 0.1397919550170376.
[I 2024-12-04 00:20:01,820] Trial 1335 finished with value: 0.14907635533525718 and parameters: {'kernel': 'rbf', 'C': 88.70124885179865, 'gamma': 0.0058373380107542144, 'epsilon': 0.0010566505200224553}. Best is trial 973 with value: 0.1397919550170376.
[I 2024-12-04 00:20:02,644] Trial 1334 finished with value: 0.14030636213018036 and parameters: {'kernel': 'rbf', 'C': 94.45350288853078, 'gamma': 0.007498449580755367, 'epsilon': 0.001178828615252424}. Best is trial 973 with value: 0.1397919550170376.
[I 2024-12-04 00:20:03,427] Trial 1337 finished with value: 0.21966266991847305 and parameters: {'kernel': 'rbf', 'C': 92.34840745458142, 'gamma': 0.0017278891305109658, 'epsilon': 0.007538890011318861}. Best is trial 973 with value: 0.1397919550170376.
[I 2024-12-04 00:20:05,023] Trial 1338 finished with value: 0.30195792305023983 and parameters: {'kernel': 'rbf', 'C': 2.0502073742395526, 'gamma': 0.010884972126463555, 'epsilon': 0.004500566270803293}. Best is trial 973 with value: 0.1397919550170376.
[I 2024-12-04 00:20:05,290] Trial 1340 finished with value: 0.4959190408162345 and parameters: {'kernel': 'rbf', 'C': 2.3165456102369326, 'gamma': 0.0009927416734744048, 'epsilon': 0.0030433131660945615}. Best is trial 973 with value: 0.1397919550170376.
[I 2024-12-04 00:20:05,770] Trial 1339 finished with value: 0.25101547006710023 and parameters: {'kernel': 'rbf', 'C': 14.257850888338185, 'gamma': 0.005221066053468621, 'epsilon': 0.0010708541005352021}. Best is trial 973 with value: 0.1397919550170376.
[I 2024-12-04 00:20:06,188] Trial 1341 finished with value: 0.3324263210537103 and parameters: {'kernel': 'rbf', 'C': 13.118044822928836, 'gamma': 0.0014197871853201286, 'epsilon': 0.001161655375281558}. Best is trial 973 with value: 0.1397919550170376.
[I 2024-12-04 00:20:07,579] Trial 1342 finished with value: 0.35770747356336463 and parameters: {'kernel': 'linear', 'C': 0.13591034880226888, 'gamma': 0.0017045193216991131, 'epsilon': 0.004876869149015528}. Best is trial 973 with value: 0.1397919550170376.
[I 2024-12-04 00:20:08,909] Trial 1344 finished with value: 0.2370187364353275 and parameters: {'kernel': 'rbf', 'C': 3.3400384458918126, 'gamma': 0.021727612266127884, 'epsilon': 0.002210566111809832}. Best is trial 973 with value: 0.1397919550170376.
[I 2024-12-04 00:20:09,879] Trial 1345 finished with value: 0.21288490331798282 and parameters: {'kernel': 'rbf', 'C': 24.256152568852716, 'gamma': 0.006141985687966026, 'epsilon': 0.00332938172974285}. Best is trial 973 with value: 0.1397919550170376.
[I 2024-12-04 00:20:10,501] Trial 1346 finished with value: 0.19326197906921708 and parameters: {'kernel': 'rbf', 'C': 13.391988662106083, 'gamma': 0.012024445185078718, 'epsilon': 0.002550334091192666}. Best is trial 973 with value: 0.1397919550170376.
[I 2024-12-04 00:20:13,148] Trial 1349 finished with value: 0.2301503154764869 and parameters: {'kernel': 'rbf', 'C': 34.257914509539894, 'gamma': 0.003595657501017483, 'epsilon': 0.0010780924774316167}. Best is trial 973 with value: 0.1397919550170376.
[I 2024-12-04 00:20:13,150] Trial 1343 finished with value: 0.22627059167592692 and parameters: {'kernel': 'rbf', 'C': 99.36105485555954, 'gamma': 0.08391203883028894, 'epsilon': 0.0010551720256690243}. Best is trial 973 with value: 0.1397919550170376.
[I 2024-12-04 00:20:16,901] Trial 1350 finished with value: 0.14793392908720127 and parameters: {'kernel': 'rbf', 'C': 29.77079919200456, 'gamma': 0.014455776252319934, 'epsilon': 0.0010587980254418976}. Best is trial 973 with value: 0.1397919550170376.
[I 2024-12-04 00:20:16,939] Trial 1347 finished with value: 0.16787589321976995 and parameters: {'kernel': 'rbf', 'C': 83.92278894288042, 'gamma': 0.01744899221961714, 'epsilon': 0.0010308188825741721}. Best is trial 973 with value: 0.1397919550170376.
[I 2024-12-04 00:20:18,590] Trial 1200 finished with value: 0.3524019716768587 and parameters: {'kernel': 'linear', 'C': 51.311757634557324, 'gamma': 0.0025357777760154935, 'epsilon': 0.0011339789155433513}. Best is trial 973 with value: 0.1397919550170376.
[I 2024-12-04 00:20:19,376] Trial 1353 finished with value: 0.28665134597356323 and parameters: {'kernel': 'rbf', 'C': 15.033197053210651, 'gamma': 0.0022152205467052765, 'epsilon': 0.0011615323762978606}. Best is trial 973 with value: 0.1397919550170376.
[I 2024-12-04 00:20:19,744] Trial 1352 finished with value: 0.22950582278975065 and parameters: {'kernel': 'rbf', 'C': 93.12668019964786, 'gamma': 0.0014168090738701346, 'epsilon': 0.001755464439296131}. Best is trial 973 with value: 0.1397919550170376.
[I 2024-12-04 00:20:20,399] Trial 1354 finished with value: 0.9895659040625353 and parameters: {'kernel': 'poly', 'C': 8.22389484388722, 'gamma': 0.00010468239356532238, 'epsilon': 0.04659613325814322}. Best is trial 973 with value: 0.1397919550170376.
[I 2024-12-04 00:20:20,932] Trial 1351 finished with value: 0.1643917758103032 and parameters: {'kernel': 'rbf', 'C': 93.1035870075794, 'gamma': 0.01517795777317693, 'epsilon': 0.001158916468625609}. Best is trial 973 with value: 0.1397919550170376.
[I 2024-12-04 00:20:21,759] Trial 1356 finished with value: 2110.7698141652672 and parameters: {'kernel': 'sigmoid', 'C': 83.40136625739414, 'gamma': 0.24145039608872196, 'epsilon': 0.034829586392626566}. Best is trial 973 with value: 0.1397919550170376.
[I 2024-12-04 00:20:23,257] Trial 1355 finished with value: 0.1456668336357824 and parameters: {'kernel': 'rbf', 'C': 97.40103865859146, 'gamma': 0.006061025218680276, 'epsilon': 0.00122349787819308}. Best is trial 973 with value: 0.1397919550170376.
[I 2024-12-04 00:20:23,747] Trial 1359 finished with value: 434.1709952703397 and parameters: {'kernel': 'sigmoid', 'C': 43.55840495711727, 'gamma': 0.007196110983691566, 'epsilon': 0.0010513633450055545}. Best is trial 973 with value: 0.1397919550170376.
[I 2024-12-04 00:20:24,855] Trial 1358 finished with value: 0.17679179710279364 and parameters: {'kernel': 'rbf', 'C': 93.62831417237153, 'gamma': 0.0034106891810166914, 'epsilon': 0.003228442068767779}. Best is trial 973 with value: 0.1397919550170376.
[I 2024-12-04 00:20:24,923] Trial 1357 finished with value: 0.1443379823364505 and parameters: {'kernel': 'rbf', 'C': 97.92910077907901, 'gamma': 0.006223039673564999, 'epsilon': 0.0010126342495600455}. Best is trial 973 with value: 0.1397919550170376.
[I 2024-12-04 00:20:26,260] Trial 1360 finished with value: 0.2310157149218634 and parameters: {'kernel': 'rbf', 'C': 16.210364045714247, 'gamma': 0.006621575569364356, 'epsilon': 0.0010506412860201235}. Best is trial 973 with value: 0.1397919550170376.
[I 2024-12-04 00:20:26,410] Trial 1361 finished with value: 0.9488212488087691 and parameters: {'kernel': 'sigmoid', 'C': 0.0021376187752547822, 'gamma': 0.025275681055787907, 'epsilon': 0.0032665707394315515}. Best is trial 973 with value: 0.1397919550170376.
[I 2024-12-04 00:20:27,951] Trial 1362 finished with value: 0.15924212120546596 and parameters: {'kernel': 'rbf', 'C': 21.358873287921647, 'gamma': 0.01347787670819292, 'epsilon': 0.009956834475563472}. Best is trial 973 with value: 0.1397919550170376.
[I 2024-12-04 00:20:28,237] Trial 1364 finished with value: 0.33113454539498166 and parameters: {'kernel': 'linear', 'C': 0.5788328307125008, 'gamma': 0.7663724226026633, 'epsilon': 0.3912041953346794}. Best is trial 973 with value: 0.1397919550170376.
[I 2024-12-04 00:20:29,105] Trial 1363 finished with value: 0.14815309604022556 and parameters: {'kernel': 'rbf', 'C': 22.39817462715289, 'gamma': 0.01929844833612496, 'epsilon': 0.002417945715918071}. Best is trial 973 with value: 0.1397919550170376.
[I 2024-12-04 00:20:31,424] Trial 1367 finished with value: 0.20449430382078743 and parameters: {'kernel': 'rbf', 'C': 94.69099725301501, 'gamma': 0.002279134042418457, 'epsilon': 0.0017379815477837292}. Best is trial 973 with value: 0.1397919550170376.
[I 2024-12-04 00:20:32,093] Trial 1324 finished with value: 0.3525824621482503 and parameters: {'kernel': 'linear', 'C': 11.532134884799214, 'gamma': 0.037155833015315304, 'epsilon': 0.0011048368008735405}. Best is trial 973 with value: 0.1397919550170376.
[I 2024-12-04 00:20:32,094] Trial 1368 finished with value: 0.19683587689933313 and parameters: {'kernel': 'rbf', 'C': 24.156518443073566, 'gamma': 0.007442891206229564, 'epsilon': 0.0030653549718601516}. Best is trial 973 with value: 0.1397919550170376.
[I 2024-12-04 00:20:33,713] Trial 1365 finished with value: 0.16975892975422313 and parameters: {'kernel': 'rbf', 'C': 85.94632176686316, 'gamma': 0.018535173543737463, 'epsilon': 0.0011147810100525137}. Best is trial 973 with value: 0.1397919550170376.
[I 2024-12-04 00:20:34,450] Trial 1369 finished with value: 0.2254934513489612 and parameters: {'kernel': 'rbf', 'C': 82.36765167401512, 'gamma': 0.001724956551237531, 'epsilon': 0.0010631088586886613}. Best is trial 973 with value: 0.1397919550170376.
[I 2024-12-04 00:20:35,486] Trial 1371 finished with value: 0.19588110722595334 and parameters: {'kernel': 'rbf', 'C': 21.954879815409317, 'gamma': 0.008138241222270852, 'epsilon': 0.0051527203684477605}. Best is trial 973 with value: 0.1397919550170376.
[I 2024-12-04 00:20:36,981] Trial 1373 finished with value: 0.23949651848554224 and parameters: {'kernel': 'rbf', 'C': 19.221307067384476, 'gamma': 0.0050051460903463045, 'epsilon': 0.0021042280289590726}. Best is trial 973 with value: 0.1397919550170376.
[I 2024-12-04 00:20:37,923] Trial 1374 finished with value: 462.805456628408 and parameters: {'kernel': 'sigmoid', 'C': 24.354121452906202, 'gamma': 0.0209145682070715, 'epsilon': 0.008990587361858345}. Best is trial 973 with value: 0.1397919550170376.
[I 2024-12-04 00:20:38,783] Trial 1370 finished with value: 0.1689672188942602 and parameters: {'kernel': 'rbf', 'C': 95.4109351687323, 'gamma': 0.01633027861164337, 'epsilon': 0.0010119003785285833}. Best is trial 973 with value: 0.1397919550170376.
