[I 2024-12-04 15:34:57,602] Trial 1884 finished with value: 0.43342214145164026 and parameters: {'n_estimators': 741, 'max_depth': 34, 'min_samples_split': 2, 'min_samples_leaf': 1, 'max_features': None, 'bootstrap': True, 'criterion': 'absolute_error'}. Best is trial 1025 with value: 0.41844370194907604.
[I 2024-12-04 15:34:58,269] Trial 1926 finished with value: 0.4249247017812928 and parameters: {'n_estimators': 751, 'max_depth': 43, 'min_samples_split': 3, 'min_samples_leaf': 1, 'max_features': None, 'bootstrap': True, 'criterion': 'squared_error'}. Best is trial 1025 with value: 0.41844370194907604.
[I 2024-12-04 15:34:58,411] Trial 1937 finished with value: 0.46488043177864513 and parameters: {'n_estimators': 687, 'max_depth': 36, 'min_samples_split': 2, 'min_samples_leaf': 2, 'max_features': None, 'bootstrap': True, 'criterion': 'squared_error'}. Best is trial 1025 with value: 0.41844370194907604.
[I 2024-12-04 15:35:01,549] Trial 1932 finished with value: 0.46521993827941105 and parameters: {'n_estimators': 773, 'max_depth': 37, 'min_samples_split': 2, 'min_samples_leaf': 2, 'max_features': None, 'bootstrap': True, 'criterion': 'squared_error'}. Best is trial 1025 with value: 0.41844370194907604.
[I 2024-12-04 15:35:01,816] Trial 1941 finished with value: 0.4406865973510938 and parameters: {'n_estimators': 550, 'max_depth': 23, 'min_samples_split': 4, 'min_samples_leaf': 1, 'max_features': None, 'bootstrap': True, 'criterion': 'squared_error'}. Best is trial 1025 with value: 0.41844370194907604.
[I 2024-12-04 15:35:01,919] Trial 1944 finished with value: 0.5925709111072835 and parameters: {'n_estimators': 748, 'max_depth': 48, 'min_samples_split': 3, 'min_samples_leaf': 1, 'max_features': 'log2', 'bootstrap': True, 'criterion': 'squared_error'}. Best is trial 1025 with value: 0.41844370194907604.
[I 2024-12-04 15:35:02,111] Trial 1934 finished with value: 0.41913524385906337 and parameters: {'n_estimators': 787, 'max_depth': 40, 'min_samples_split': 2, 'min_samples_leaf': 1, 'max_features': None, 'bootstrap': True, 'criterion': 'squared_error'}. Best is trial 1025 with value: 0.41844370194907604.
[I 2024-12-04 15:35:02,460] Trial 1954 finished with value: 0.5608078424691147 and parameters: {'n_estimators': 113, 'max_depth': 21, 'min_samples_split': 2, 'min_samples_leaf': 3, 'max_features': None, 'bootstrap': False, 'criterion': 'squared_error'}. Best is trial 1025 with value: 0.41844370194907604.
[I 2024-12-04 15:35:05,487] Trial 1936 finished with value: 0.4212082704071938 and parameters: {'n_estimators': 768, 'max_depth': 33, 'min_samples_split': 2, 'min_samples_leaf': 1, 'max_features': None, 'bootstrap': True, 'criterion': 'squared_error'}. Best is trial 1025 with value: 0.41844370194907604.
[I 2024-12-04 15:35:05,947] Trial 1953 finished with value: 1.0388288286659502 and parameters: {'n_estimators': 346, 'max_depth': 37, 'min_samples_split': 21, 'min_samples_leaf': 5, 'max_features': 'log2', 'bootstrap': False, 'criterion': 'squared_error'}. Best is trial 1025 with value: 0.41844370194907604.
[I 2024-12-04 15:35:06,351] Trial 1938 finished with value: 0.5047937062447543 and parameters: {'n_estimators': 787, 'max_depth': 41, 'min_samples_split': 2, 'min_samples_leaf': 1, 'max_features': 'sqrt', 'bootstrap': True, 'criterion': 'squared_error'}. Best is trial 1025 with value: 0.41844370194907604.
[I 2024-12-04 15:35:07,801] Trial 1939 finished with value: 0.42068693958973014 and parameters: {'n_estimators': 804, 'max_depth': 36, 'min_samples_split': 2, 'min_samples_leaf': 1, 'max_features': None, 'bootstrap': True, 'criterion': 'squared_error'}. Best is trial 1025 with value: 0.41844370194907604.
[I 2024-12-04 15:35:09,042] Trial 1943 finished with value: 0.42132759503571326 and parameters: {'n_estimators': 772, 'max_depth': 45, 'min_samples_split': 2, 'min_samples_leaf': 1, 'max_features': None, 'bootstrap': True, 'criterion': 'squared_error'}. Best is trial 1025 with value: 0.41844370194907604.
[I 2024-12-04 15:35:14,254] Trial 1951 finished with value: 0.46623524138933414 and parameters: {'n_estimators': 547, 'max_depth': 45, 'min_samples_split': 2, 'min_samples_leaf': 2, 'max_features': None, 'bootstrap': True, 'criterion': 'squared_error'}. Best is trial 1025 with value: 0.41844370194907604.
[I 2024-12-04 15:35:14,519] Trial 1942 finished with value: 0.4240523334598965 and parameters: {'n_estimators': 785, 'max_depth': 45, 'min_samples_split': 3, 'min_samples_leaf': 1, 'max_features': None, 'bootstrap': True, 'criterion': 'squared_error'}. Best is trial 1025 with value: 0.41844370194907604.
[I 2024-12-04 15:35:16,574] Trial 1947 finished with value: 0.9258703548177835 and parameters: {'n_estimators': 937, 'max_depth': 6, 'min_samples_split': 2, 'min_samples_leaf': 1, 'max_features': 'sqrt', 'bootstrap': False, 'criterion': 'absolute_error'}. Best is trial 1025 with value: 0.41844370194907604.
[I 2024-12-04 15:35:21,590] Trial 1966 finished with value: 1.057516485057734 and parameters: {'n_estimators': 131, 'max_depth': 38, 'min_samples_split': 11, 'min_samples_leaf': 5, 'max_features': 'log2', 'bootstrap': True, 'criterion': 'squared_error'}. Best is trial 1025 with value: 0.41844370194907604.
[I 2024-12-04 15:35:21,928] Trial 1946 finished with value: 0.465474199656873 and parameters: {'n_estimators': 804, 'max_depth': 46, 'min_samples_split': 2, 'min_samples_leaf': 2, 'max_features': None, 'bootstrap': True, 'criterion': 'squared_error'}. Best is trial 1025 with value: 0.41844370194907604.
[I 2024-12-04 15:35:22,404] Trial 1955 finished with value: 0.5278360509548116 and parameters: {'n_estimators': 718, 'max_depth': 38, 'min_samples_split': 2, 'min_samples_leaf': 1, 'max_features': None, 'bootstrap': False, 'criterion': 'squared_error'}. Best is trial 1025 with value: 0.41844370194907604.
[I 2024-12-04 15:35:24,524] Trial 1952 finished with value: 0.4653832515844141 and parameters: {'n_estimators': 815, 'max_depth': 47, 'min_samples_split': 4, 'min_samples_leaf': 2, 'max_features': None, 'bootstrap': True, 'criterion': 'squared_error'}. Best is trial 1025 with value: 0.41844370194907604.
[I 2024-12-04 15:35:25,821] Trial 1949 finished with value: 0.4197472961731555 and parameters: {'n_estimators': 793, 'max_depth': 41, 'min_samples_split': 2, 'min_samples_leaf': 1, 'max_features': None, 'bootstrap': True, 'criterion': 'squared_error'}. Best is trial 1025 with value: 0.41844370194907604.
[I 2024-12-04 15:35:27,458] Trial 1957 finished with value: 0.42220816532325006 and parameters: {'n_estimators': 638, 'max_depth': 42, 'min_samples_split': 2, 'min_samples_leaf': 1, 'max_features': None, 'bootstrap': True, 'criterion': 'squared_error'}. Best is trial 1025 with value: 0.41844370194907604.
[I 2024-12-04 15:35:29,426] Trial 1958 finished with value: 0.432274963992542 and parameters: {'n_estimators': 746, 'max_depth': 33, 'min_samples_split': 4, 'min_samples_leaf': 1, 'max_features': None, 'bootstrap': True, 'criterion': 'squared_error'}. Best is trial 1025 with value: 0.41844370194907604.
[I 2024-12-04 15:35:29,724] Trial 1948 finished with value: 0.42554320182585925 and parameters: {'n_estimators': 655, 'max_depth': 38, 'min_samples_split': 3, 'min_samples_leaf': 1, 'max_features': None, 'bootstrap': True, 'criterion': 'squared_error'}. Best is trial 1025 with value: 0.41844370194907604.
[I 2024-12-04 15:35:30,021] Trial 1950 finished with value: 0.4228055032799861 and parameters: {'n_estimators': 628, 'max_depth': 44, 'min_samples_split': 2, 'min_samples_leaf': 1, 'max_features': None, 'bootstrap': True, 'criterion': 'squared_error'}. Best is trial 1025 with value: 0.41844370194907604.
[I 2024-12-04 15:35:30,438] Trial 1930 finished with value: 0.460810385235435 and parameters: {'n_estimators': 750, 'max_depth': 45, 'min_samples_split': 2, 'min_samples_leaf': 2, 'max_features': None, 'bootstrap': True, 'criterion': 'absolute_error'}. Best is trial 1025 with value: 0.41844370194907604.
[I 2024-12-04 15:35:31,084] Trial 1959 finished with value: 0.4245393322295966 and parameters: {'n_estimators': 771, 'max_depth': 42, 'min_samples_split': 3, 'min_samples_leaf': 1, 'max_features': None, 'bootstrap': True, 'criterion': 'squared_error'}. Best is trial 1025 with value: 0.41844370194907604.
[I 2024-12-04 15:35:31,090] Trial 1961 finished with value: 0.6973811306245676 and parameters: {'n_estimators': 814, 'max_depth': 38, 'min_samples_split': 2, 'min_samples_leaf': 2, 'max_features': 'sqrt', 'bootstrap': True, 'criterion': 'squared_error'}. Best is trial 1025 with value: 0.41844370194907604.
[I 2024-12-04 15:35:31,173] Trial 1956 finished with value: 0.4318557308102735 and parameters: {'n_estimators': 802, 'max_depth': 42, 'min_samples_split': 4, 'min_samples_leaf': 1, 'max_features': None, 'bootstrap': True, 'criterion': 'squared_error'}. Best is trial 1025 with value: 0.41844370194907604.
[I 2024-12-04 15:35:31,964] Trial 1965 finished with value: 0.4207816771920338 and parameters: {'n_estimators': 715, 'max_depth': 34, 'min_samples_split': 2, 'min_samples_leaf': 1, 'max_features': None, 'bootstrap': True, 'criterion': 'squared_error'}. Best is trial 1025 with value: 0.41844370194907604.
[I 2024-12-04 15:35:33,285] Trial 1962 finished with value: 0.42067502640356996 and parameters: {'n_estimators': 766, 'max_depth': 37, 'min_samples_split': 2, 'min_samples_leaf': 1, 'max_features': None, 'bootstrap': True, 'criterion': 'squared_error'}. Best is trial 1025 with value: 0.41844370194907604.
[I 2024-12-04 15:35:36,758] Trial 1960 finished with value: 0.4649827870985787 and parameters: {'n_estimators': 765, 'max_depth': 39, 'min_samples_split': 2, 'min_samples_leaf': 2, 'max_features': None, 'bootstrap': True, 'criterion': 'squared_error'}. Best is trial 1025 with value: 0.41844370194907604.
[I 2024-12-04 15:35:38,508] Trial 1973 finished with value: 0.9753607184993681 and parameters: {'n_estimators': 309, 'max_depth': 43, 'min_samples_split': 14, 'min_samples_leaf': 3, 'max_features': 'log2', 'bootstrap': False, 'criterion': 'absolute_error'}. Best is trial 1025 with value: 0.41844370194907604.
[I 2024-12-04 15:35:40,690] Trial 1969 finished with value: 0.6427988127669785 and parameters: {'n_estimators': 581, 'max_depth': 37, 'min_samples_split': 2, 'min_samples_leaf': 1, 'max_features': 'log2', 'bootstrap': True, 'criterion': 'squared_error'}. Best is trial 1025 with value: 0.41844370194907604.
[I 2024-12-04 15:35:40,785] Trial 1977 finished with value: 0.7318398279721176 and parameters: {'n_estimators': 120, 'max_depth': 7, 'min_samples_split': 2, 'min_samples_leaf': 1, 'max_features': None, 'bootstrap': False, 'criterion': 'squared_error'}. Best is trial 1025 with value: 0.41844370194907604.
[I 2024-12-04 15:35:41,476] Trial 1967 finished with value: 0.42042302015363436 and parameters: {'n_estimators': 776, 'max_depth': 36, 'min_samples_split': 2, 'min_samples_leaf': 1, 'max_features': None, 'bootstrap': True, 'criterion': 'squared_error'}. Best is trial 1025 with value: 0.41844370194907604.
[I 2024-12-04 15:35:43,212] Trial 1963 finished with value: 0.46536160705194646 and parameters: {'n_estimators': 751, 'max_depth': 34, 'min_samples_split': 4, 'min_samples_leaf': 2, 'max_features': None, 'bootstrap': True, 'criterion': 'squared_error'}. Best is trial 1025 with value: 0.41844370194907604.
[I 2024-12-04 15:35:45,030] Trial 1964 finished with value: 0.42065416378623666 and parameters: {'n_estimators': 825, 'max_depth': 36, 'min_samples_split': 2, 'min_samples_leaf': 1, 'max_features': None, 'bootstrap': True, 'criterion': 'squared_error'}. Best is trial 1025 with value: 0.41844370194907604.
[I 2024-12-04 15:35:46,900] Trial 1972 finished with value: 0.42234670335514357 and parameters: {'n_estimators': 693, 'max_depth': 42, 'min_samples_split': 2, 'min_samples_leaf': 1, 'max_features': None, 'bootstrap': True, 'criterion': 'squared_error'}. Best is trial 1025 with value: 0.41844370194907604.
[I 2024-12-04 15:35:50,101] Trial 1968 finished with value: 0.41944732125108575 and parameters: {'n_estimators': 828, 'max_depth': 41, 'min_samples_split': 2, 'min_samples_leaf': 1, 'max_features': None, 'bootstrap': True, 'criterion': 'squared_error'}. Best is trial 1025 with value: 0.41844370194907604.
[I 2024-12-04 15:35:56,053] Trial 1974 finished with value: 0.422483667774117 and parameters: {'n_estimators': 630, 'max_depth': 32, 'min_samples_split': 2, 'min_samples_leaf': 1, 'max_features': None, 'bootstrap': True, 'criterion': 'squared_error'}. Best is trial 1025 with value: 0.41844370194907604.
[I 2024-12-04 15:35:56,808] Trial 1975 finished with value: 0.4243768616019664 and parameters: {'n_estimators': 811, 'max_depth': 42, 'min_samples_split': 3, 'min_samples_leaf': 1, 'max_features': None, 'bootstrap': True, 'criterion': 'squared_error'}. Best is trial 1025 with value: 0.41844370194907604.
[I 2024-12-04 15:35:56,813] Trial 1976 finished with value: 0.4318877187591122 and parameters: {'n_estimators': 771, 'max_depth': 43, 'min_samples_split': 4, 'min_samples_leaf': 1, 'max_features': None, 'bootstrap': True, 'criterion': 'squared_error'}. Best is trial 1025 with value: 0.41844370194907604.
[I 2024-12-04 15:35:57,368] Trial 1970 finished with value: 0.4213704720808425 and parameters: {'n_estimators': 809, 'max_depth': 45, 'min_samples_split': 2, 'min_samples_leaf': 1, 'max_features': None, 'bootstrap': True, 'criterion': 'squared_error'}. Best is trial 1025 with value: 0.41844370194907604.
[I 2024-12-04 15:35:57,440] Trial 1978 finished with value: 0.46468628673416734 and parameters: {'n_estimators': 688, 'max_depth': 48, 'min_samples_split': 2, 'min_samples_leaf': 2, 'max_features': None, 'bootstrap': True, 'criterion': 'squared_error'}. Best is trial 1025 with value: 0.41844370194907604.
[I 2024-12-04 15:36:00,270] Trial 1971 finished with value: 0.42139977432787734 and parameters: {'n_estimators': 837, 'max_depth': 47, 'min_samples_split': 2, 'min_samples_leaf': 1, 'max_features': None, 'bootstrap': True, 'criterion': 'squared_error'}. Best is trial 1025 with value: 0.41844370194907604.
[I 2024-12-04 15:36:04,732] Trial 1979 finished with value: 0.6130508536715054 and parameters: {'n_estimators': 702, 'max_depth': 43, 'min_samples_split': 2, 'min_samples_leaf': 2, 'max_features': None, 'bootstrap': False, 'criterion': 'squared_error'}. Best is trial 1025 with value: 0.41844370194907604.
[I 2024-12-04 15:36:06,157] Trial 1993 finished with value: 1.0155268619674191 and parameters: {'n_estimators': 285, 'max_depth': 27, 'min_samples_split': 17, 'min_samples_leaf': 3, 'max_features': 'log2', 'bootstrap': True, 'criterion': 'absolute_error'}. Best is trial 1025 with value: 0.41844370194907604.
[I 2024-12-04 15:36:08,462] Trial 1982 finished with value: 0.46532151687100815 and parameters: {'n_estimators': 817, 'max_depth': 40, 'min_samples_split': 2, 'min_samples_leaf': 2, 'max_features': None, 'bootstrap': True, 'criterion': 'squared_error'}. Best is trial 1025 with value: 0.41844370194907604.
[I 2024-12-04 15:36:08,544] Trial 1983 finished with value: 0.46544665915620687 and parameters: {'n_estimators': 832, 'max_depth': 40, 'min_samples_split': 2, 'min_samples_leaf': 2, 'max_features': None, 'bootstrap': True, 'criterion': 'squared_error'}. Best is trial 1025 with value: 0.41844370194907604.
[I 2024-12-04 15:36:09,931] Trial 1985 finished with value: 0.465453065474986 and parameters: {'n_estimators': 810, 'max_depth': 36, 'min_samples_split': 2, 'min_samples_leaf': 2, 'max_features': None, 'bootstrap': True, 'criterion': 'squared_error'}. Best is trial 1025 with value: 0.41844370194907604.
[I 2024-12-04 15:36:26,524] Trial 1992 finished with value: 0.4248305479241159 and parameters: {'n_estimators': 655, 'max_depth': 39, 'min_samples_split': 3, 'min_samples_leaf': 1, 'max_features': None, 'bootstrap': True, 'criterion': 'squared_error'}. Best is trial 1025 with value: 0.41844370194907604.
[I 2024-12-04 15:36:27,114] Trial 1996 finished with value: 0.703423744892084 and parameters: {'n_estimators': 969, 'max_depth': 31, 'min_samples_split': 6, 'min_samples_leaf': 1, 'max_features': 'log2', 'bootstrap': False, 'criterion': 'squared_error'}. Best is trial 1025 with value: 0.41844370194907604.
[I 2024-12-04 15:36:27,129] Trial 1998 finished with value: 0.46436660777571026 and parameters: {'n_estimators': 628, 'max_depth': 39, 'min_samples_split': 2, 'min_samples_leaf': 2, 'max_features': None, 'bootstrap': True, 'criterion': 'squared_error'}. Best is trial 1025 with value: 0.41844370194907604.
[I 2024-12-04 15:36:30,136] Trial 1981 finished with value: 0.4246207776902844 and parameters: {'n_estimators': 825, 'max_depth': 36, 'min_samples_split': 3, 'min_samples_leaf': 1, 'max_features': None, 'bootstrap': True, 'criterion': 'squared_error'}. Best is trial 1025 with value: 0.41844370194907604.
[I 2024-12-04 15:36:30,506] Trial 1994 finished with value: 0.7150084096042194 and parameters: {'n_estimators': 803, 'max_depth': 45, 'min_samples_split': 5, 'min_samples_leaf': 11, 'max_features': None, 'bootstrap': False, 'criterion': 'squared_error'}. Best is trial 1025 with value: 0.41844370194907604.
[I 2024-12-04 15:36:30,507] Trial 1989 finished with value: 0.42618609469336177 and parameters: {'n_estimators': 814, 'max_depth': 30, 'min_samples_split': 3, 'min_samples_leaf': 1, 'max_features': None, 'bootstrap': True, 'criterion': 'squared_error'}. Best is trial 1025 with value: 0.41844370194907604.
[I 2024-12-04 15:36:30,512] Trial 1990 finished with value: 0.41885049591349155 and parameters: {'n_estimators': 812, 'max_depth': 40, 'min_samples_split': 2, 'min_samples_leaf': 1, 'max_features': None, 'bootstrap': True, 'criterion': 'squared_error'}. Best is trial 1025 with value: 0.41844370194907604.
[I 2024-12-04 15:36:33,057] Trial 1940 finished with value: 0.4290953214755671 and parameters: {'n_estimators': 771, 'max_depth': 43, 'min_samples_split': 2, 'min_samples_leaf': 1, 'max_features': None, 'bootstrap': True, 'criterion': 'absolute_error'}. Best is trial 1025 with value: 0.41844370194907604.
[I 2024-12-04 15:36:35,483] Trial 1987 finished with value: 0.4217741626580871 and parameters: {'n_estimators': 808, 'max_depth': 49, 'min_samples_split': 2, 'min_samples_leaf': 1, 'max_features': None, 'bootstrap': True, 'criterion': 'squared_error'}. Best is trial 1025 with value: 0.41844370194907604.
[I 2024-12-04 15:36:38,324] Trial 2001 finished with value: 0.4217751040850087 and parameters: {'n_estimators': 680, 'max_depth': 43, 'min_samples_split': 2, 'min_samples_leaf': 1, 'max_features': None, 'bootstrap': True, 'criterion': 'squared_error'}. Best is trial 1025 with value: 0.41844370194907604.
[I 2024-12-04 15:36:38,876] Trial 1995 finished with value: 0.4235010350604691 and parameters: {'n_estimators': 763, 'max_depth': 25, 'min_samples_split': 2, 'min_samples_leaf': 1, 'max_features': None, 'bootstrap': True, 'criterion': 'squared_error'}. Best is trial 1025 with value: 0.41844370194907604.
[I 2024-12-04 15:36:39,084] Trial 1988 finished with value: 0.42293077275386953 and parameters: {'n_estimators': 813, 'max_depth': 28, 'min_samples_split': 2, 'min_samples_leaf': 1, 'max_features': None, 'bootstrap': True, 'criterion': 'squared_error'}. Best is trial 1025 with value: 0.41844370194907604.
[I 2024-12-04 15:36:41,943] Trial 2003 finished with value: 0.5301879848578441 and parameters: {'n_estimators': 751, 'max_depth': 47, 'min_samples_split': 2, 'min_samples_leaf': 1, 'max_features': None, 'bootstrap': False, 'criterion': 'squared_error'}. Best is trial 1025 with value: 0.41844370194907604.
[I 2024-12-04 15:36:41,957] Trial 1984 finished with value: 0.670221511239537 and parameters: {'n_estimators': 883, 'max_depth': 50, 'min_samples_split': 10, 'min_samples_leaf': 9, 'max_features': None, 'bootstrap': True, 'criterion': 'absolute_error'}. Best is trial 1025 with value: 0.41844370194907604.
[I 2024-12-04 15:36:43,300] Trial 1999 finished with value: 1.0340246892267626 and parameters: {'n_estimators': 641, 'max_depth': 29, 'min_samples_split': 33, 'min_samples_leaf': 5, 'max_features': 'log2', 'bootstrap': False, 'criterion': 'absolute_error'}. Best is trial 1025 with value: 0.41844370194907604.
[I 2024-12-04 15:36:44,133] Trial 2009 finished with value: 0.596139853164799 and parameters: {'n_estimators': 422, 'max_depth': 29, 'min_samples_split': 43, 'min_samples_leaf': 1, 'max_features': None, 'bootstrap': False, 'criterion': 'squared_error'}. Best is trial 1025 with value: 0.41844370194907604.
[I 2024-12-04 15:36:44,144] Trial 1997 finished with value: 0.42127051840993723 and parameters: {'n_estimators': 689, 'max_depth': 37, 'min_samples_split': 2, 'min_samples_leaf': 1, 'max_features': None, 'bootstrap': True, 'criterion': 'squared_error'}. Best is trial 1025 with value: 0.41844370194907604.
[I 2024-12-04 15:36:45,154] Trial 2007 finished with value: 0.6678378565662674 and parameters: {'n_estimators': 780, 'max_depth': 35, 'min_samples_split': 3, 'min_samples_leaf': 1, 'max_features': 'log2', 'bootstrap': True, 'criterion': 'squared_error'}. Best is trial 1025 with value: 0.41844370194907604.
[I 2024-12-04 15:36:45,901] Trial 2000 finished with value: 0.4194988743520389 and parameters: {'n_estimators': 761, 'max_depth': 39, 'min_samples_split': 2, 'min_samples_leaf': 1, 'max_features': None, 'bootstrap': True, 'criterion': 'squared_error'}. Best is trial 1025 with value: 0.41844370194907604.
[I 2024-12-04 15:36:49,823] Trial 2002 finished with value: 0.4323523780652347 and parameters: {'n_estimators': 657, 'max_depth': 42, 'min_samples_split': 4, 'min_samples_leaf': 1, 'max_features': None, 'bootstrap': True, 'criterion': 'squared_error'}. Best is trial 1025 with value: 0.41844370194907604.
