[I 2024-12-03 19:17:36,142] Trial 1918 finished with value: 0.5042104353714822 and parameters: {'kernel': 'rbf', 'C': 3.9148057105110103, 'gamma': 0.11612547458481857, 'epsilon': 0.10701584793769518}. Best is trial 88 with value: 0.3542875001421725.
[I 2024-12-03 19:17:37,358] Trial 1919 finished with value: 0.4304981367582845 and parameters: {'kernel': 'rbf', 'C': 83.65742508916236, 'gamma': 0.0023643336092371743, 'epsilon': 0.21994453058056548}. Best is trial 88 with value: 0.3542875001421725.
[I 2024-12-03 19:17:38,561] Trial 1920 finished with value: 0.4047109284521379 and parameters: {'kernel': 'rbf', 'C': 16.708309961209462, 'gamma': 0.06231259880383661, 'epsilon': 0.18384683590559758}. Best is trial 88 with value: 0.3542875001421725.
[I 2024-12-03 19:17:40,135] Trial 1880 finished with value: 0.7898000787812048 and parameters: {'kernel': 'linear', 'C': 38.67124731656859, 'gamma': 0.02289052739383165, 'epsilon': 0.08501643031221241}. Best is trial 88 with value: 0.3542875001421725.
[I 2024-12-03 19:17:40,171] Trial 1921 finished with value: 0.40195747075134963 and parameters: {'kernel': 'rbf', 'C': 98.91660035961854, 'gamma': 0.004995612480138493, 'epsilon': 0.06004534634960261}. Best is trial 88 with value: 0.3542875001421725.
[I 2024-12-03 19:17:41,902] Trial 1896 finished with value: 0.7219823636758484 and parameters: {'kernel': 'linear', 'C': 99.22953768701876, 'gamma': 0.15992315303167465, 'epsilon': 0.32338337044932625}. Best is trial 88 with value: 0.3542875001421725.
[I 2024-12-03 19:17:42,057] Trial 1922 finished with value: 0.5370315105847474 and parameters: {'kernel': 'rbf', 'C': 98.92215192854802, 'gamma': 0.21672466194160261, 'epsilon': 0.15565012274388007}. Best is trial 88 with value: 0.3542875001421725.
[I 2024-12-03 19:17:43,171] Trial 1923 finished with value: 0.37534892052062635 and parameters: {'kernel': 'rbf', 'C': 94.40006369434084, 'gamma': 0.06792171052215015, 'epsilon': 0.1316098430482148}. Best is trial 88 with value: 0.3542875001421725.
[I 2024-12-03 19:17:44,289] Trial 1924 finished with value: 0.3912640943228506 and parameters: {'kernel': 'rbf', 'C': 99.37102598261055, 'gamma': 0.015191686919621453, 'epsilon': 0.07372588244353559}. Best is trial 88 with value: 0.3542875001421725.
[I 2024-12-03 19:17:44,418] Trial 1925 finished with value: 0.37111740722400943 and parameters: {'kernel': 'rbf', 'C': 99.59926772885034, 'gamma': 0.021845926062709412, 'epsilon': 0.18022546549840093}. Best is trial 88 with value: 0.3542875001421725.
[I 2024-12-03 19:17:45,610] Trial 1926 finished with value: 0.4146637502464869 and parameters: {'kernel': 'rbf', 'C': 99.07677325807524, 'gamma': 0.11653217615915337, 'epsilon': 0.1040326916569289}. Best is trial 88 with value: 0.3542875001421725.
[I 2024-12-03 19:17:47,378] Trial 1928 finished with value: 0.36414603450302657 and parameters: {'kernel': 'rbf', 'C': 91.40924730846484, 'gamma': 0.03179313697979497, 'epsilon': 0.32203522807624685}. Best is trial 88 with value: 0.3542875001421725.
[I 2024-12-03 19:17:47,545] Trial 1927 finished with value: 0.37975723311535964 and parameters: {'kernel': 'rbf', 'C': 96.19432494394567, 'gamma': 0.054996450032823926, 'epsilon': 0.021221428799227057}. Best is trial 88 with value: 0.3542875001421725.
[I 2024-12-03 19:17:48,181] Trial 1929 finished with value: 0.3881689290083712 and parameters: {'kernel': 'rbf', 'C': 25.6914611607262, 'gamma': 0.05889544841589607, 'epsilon': 0.05040062047947155}. Best is trial 88 with value: 0.3542875001421725.
[I 2024-12-03 19:17:49,113] Trial 1931 finished with value: 0.44000927724122785 and parameters: {'kernel': 'rbf', 'C': 23.973347211095234, 'gamma': 0.11954807307354597, 'epsilon': 0.14889268528546418}. Best is trial 88 with value: 0.3542875001421725.
[I 2024-12-03 19:17:49,551] Trial 1930 finished with value: 0.40482269336481086 and parameters: {'kernel': 'rbf', 'C': 21.201703907696782, 'gamma': 0.08973348985960124, 'epsilon': 0.09170074781839765}. Best is trial 88 with value: 0.3542875001421725.
[I 2024-12-03 19:17:49,683] Trial 1102 finished with value: 14.352805093247529 and parameters: {'kernel': 'poly', 'C': 0.4041120618478098, 'gamma': 0.6678697682393491, 'epsilon': 0.140262677686177}. Best is trial 88 with value: 0.3542875001421725.
[I 2024-12-03 19:17:50,117] Trial 1932 finished with value: 0.4050173950532333 and parameters: {'kernel': 'rbf', 'C': 19.385347569875265, 'gamma': 0.030508399559242096, 'epsilon': 0.34815552290421886}. Best is trial 88 with value: 0.3542875001421725.
[I 2024-12-03 19:17:50,951] Trial 1915 finished with value: 0.78944372573098 and parameters: {'kernel': 'linear', 'C': 15.994717143867902, 'gamma': 0.044735815242563884, 'epsilon': 0.08716963377024801}. Best is trial 88 with value: 0.3542875001421725.
[I 2024-12-03 19:17:51,100] Trial 1933 finished with value: 0.4004924498245919 and parameters: {'kernel': 'rbf', 'C': 97.49024566351835, 'gamma': 0.10413019350503055, 'epsilon': 0.03822280429341151}. Best is trial 88 with value: 0.3542875001421725.
[I 2024-12-03 19:17:51,668] Trial 1934 finished with value: 0.36119619925011054 and parameters: {'kernel': 'rbf', 'C': 99.54512706806558, 'gamma': 0.05108687483826987, 'epsilon': 0.1326307832405443}. Best is trial 88 with value: 0.3542875001421725.
[I 2024-12-03 19:17:52,178] Trial 1935 finished with value: 0.3809196985018489 and parameters: {'kernel': 'rbf', 'C': 95.13379754218138, 'gamma': 0.026961436881712493, 'epsilon': 0.4097786121312085}. Best is trial 88 with value: 0.3542875001421725.
[I 2024-12-03 19:17:53,463] Trial 1937 finished with value: 0.3912914276526033 and parameters: {'kernel': 'rbf', 'C': 24.90279408576052, 'gamma': 0.06591737983511209, 'epsilon': 0.10062872061736257}. Best is trial 88 with value: 0.3542875001421725.
[I 2024-12-03 19:17:53,523] Trial 1936 finished with value: 0.4179049437370855 and parameters: {'kernel': 'rbf', 'C': 20.601543847358972, 'gamma': 0.030968616415515515, 'epsilon': 0.08214794579412156}. Best is trial 88 with value: 0.3542875001421725.
[I 2024-12-03 19:17:53,862] Trial 1938 finished with value: 0.5650988708878169 and parameters: {'kernel': 'rbf', 'C': 18.56358687545987, 'gamma': 0.14034426891429605, 'epsilon': 0.4602121290334364}. Best is trial 88 with value: 0.3542875001421725.
[I 2024-12-03 19:17:55,441] Trial 1940 finished with value: 0.4145280813139442 and parameters: {'kernel': 'rbf', 'C': 16.36735146361864, 'gamma': 0.04909012818509337, 'epsilon': 0.09393071640857813}. Best is trial 88 with value: 0.3542875001421725.
[I 2024-12-03 19:17:55,632] Trial 1939 finished with value: 0.4195995233255038 and parameters: {'kernel': 'rbf', 'C': 29.49687337716583, 'gamma': 0.026786522671050386, 'epsilon': 0.03054768181821075}. Best is trial 88 with value: 0.3542875001421725.
[I 2024-12-03 19:17:56,182] Trial 1941 finished with value: 0.4915858205768751 and parameters: {'kernel': 'rbf', 'C': 2.598314488686467, 'gamma': 0.024956542120936794, 'epsilon': 0.2863073433694744}. Best is trial 88 with value: 0.3542875001421725.
[I 2024-12-03 19:17:57,108] Trial 1942 finished with value: 0.37461049588730444 and parameters: {'kernel': 'rbf', 'C': 95.41702371677108, 'gamma': 0.019045798830612484, 'epsilon': 0.14507983553438009}. Best is trial 88 with value: 0.3542875001421725.
[I 2024-12-03 19:17:57,553] Trial 1944 finished with value: 0.4177743383606932 and parameters: {'kernel': 'rbf', 'C': 24.61484707861272, 'gamma': 0.01846354017843265, 'epsilon': 0.10763605212111305}. Best is trial 88 with value: 0.3542875001421725.
[I 2024-12-03 19:17:58,551] Trial 1945 finished with value: 2.0239286482983254 and parameters: {'kernel': 'poly', 'C': 70.1652620299576, 'gamma': 0.015526269886146346, 'epsilon': 0.6983017774045275}. Best is trial 88 with value: 0.3542875001421725.
[I 2024-12-03 19:17:58,674] Trial 1946 finished with value: 0.4002348222697651 and parameters: {'kernel': 'rbf', 'C': 98.89470129914764, 'gamma': 0.10452112649362916, 'epsilon': 0.07007777418708014}. Best is trial 88 with value: 0.3542875001421725.
[I 2024-12-03 19:17:59,465] Trial 1947 finished with value: 0.3843924092385476 and parameters: {'kernel': 'rbf', 'C': 99.34965166720941, 'gamma': 0.014940357639644443, 'epsilon': 0.154631649501103}. Best is trial 88 with value: 0.3542875001421725.
[I 2024-12-03 19:17:59,551] Trial 1948 finished with value: 0.4996421540486358 and parameters: {'kernel': 'rbf', 'C': 21.242876182794646, 'gamma': 0.14637353786497137, 'epsilon': 0.26093738503326547}. Best is trial 88 with value: 0.3542875001421725.
[I 2024-12-03 19:18:00,632] Trial 1949 finished with value: 0.4361557882234163 and parameters: {'kernel': 'rbf', 'C': 16.576640606619087, 'gamma': 0.015361954015692124, 'epsilon': 0.21315214590383794}. Best is trial 88 with value: 0.3542875001421725.
[I 2024-12-03 19:18:00,633] Trial 1943 finished with value: 0.8636250666170445 and parameters: {'kernel': 'linear', 'C': 83.047287825936, 'gamma': 0.0505891988293872, 'epsilon': 0.8858061406253417}. Best is trial 88 with value: 0.3542875001421725.
[I 2024-12-03 19:18:01,462] Trial 1950 finished with value: 0.3750050746518468 and parameters: {'kernel': 'rbf', 'C': 95.02209644946768, 'gamma': 0.01911304386915816, 'epsilon': 0.16091029489501688}. Best is trial 88 with value: 0.3542875001421725.
[I 2024-12-03 19:18:02,653] Trial 1952 finished with value: 0.48234249814375046 and parameters: {'kernel': 'rbf', 'C': 2.7572377101725536, 'gamma': 0.04615174498099225, 'epsilon': 0.03382058485117807}. Best is trial 88 with value: 0.3542875001421725.
[I 2024-12-03 19:18:02,770] Trial 1951 finished with value: 0.46844510125756705 and parameters: {'kernel': 'rbf', 'C': 2.8224115883219856, 'gamma': 0.03164823409709517, 'epsilon': 0.04424345034492605}. Best is trial 88 with value: 0.3542875001421725.
[I 2024-12-03 19:18:04,184] Trial 1953 finished with value: 0.4227449575009179 and parameters: {'kernel': 'rbf', 'C': 26.420444964954065, 'gamma': 0.11782956619454636, 'epsilon': 0.05395889366893584}. Best is trial 88 with value: 0.3542875001421725.
[I 2024-12-03 19:18:04,265] Trial 1954 finished with value: 0.5209431991453994 and parameters: {'kernel': 'rbf', 'C': 30.507861923401318, 'gamma': 0.18748053019748162, 'epsilon': 0.1962425141836032}. Best is trial 88 with value: 0.3542875001421725.
[I 2024-12-03 19:18:05,254] Trial 1955 finished with value: 0.4180820760875032 and parameters: {'kernel': 'rbf', 'C': 22.251428932653095, 'gamma': 0.03463769628154564, 'epsilon': 0.04840288121083634}. Best is trial 88 with value: 0.3542875001421725.
[I 2024-12-03 19:18:05,844] Trial 1956 finished with value: 0.42665298211981767 and parameters: {'kernel': 'rbf', 'C': 21.147653563222534, 'gamma': 0.01731762694175077, 'epsilon': 0.03999819304357001}. Best is trial 88 with value: 0.3542875001421725.
[I 2024-12-03 19:18:06,576] Trial 1959 finished with value: 0.4316558732115909 and parameters: {'kernel': 'rbf', 'C': 19.35786419680102, 'gamma': 0.04091952406962191, 'epsilon': 0.45565460825069193}. Best is trial 88 with value: 0.3542875001421725.
[I 2024-12-03 19:18:07,642] Trial 1958 finished with value: 506.95513504444847 and parameters: {'kernel': 'sigmoid', 'C': 23.89467893639321, 'gamma': 0.038397485429373567, 'epsilon': 0.0841022649514595}. Best is trial 88 with value: 0.3542875001421725.
[I 2024-12-03 19:18:08,142] Trial 1961 finished with value: 0.8808104467166245 and parameters: {'kernel': 'linear', 'C': 0.002597597739780916, 'gamma': 0.0003755437247960321, 'epsilon': 0.0016238316678147003}. Best is trial 88 with value: 0.3542875001421725.
[I 2024-12-03 19:18:08,143] Trial 1960 finished with value: 0.3883013703770136 and parameters: {'kernel': 'rbf', 'C': 99.6769089352604, 'gamma': 0.01262842723435644, 'epsilon': 0.21559460897792518}. Best is trial 88 with value: 0.3542875001421725.
[I 2024-12-03 19:18:09,335] Trial 1962 finished with value: 0.638549120915695 and parameters: {'kernel': 'rbf', 'C': 13.480133733960521, 'gamma': 0.00026614273808499544, 'epsilon': 0.023148400700117654}. Best is trial 88 with value: 0.3542875001421725.
[I 2024-12-03 19:18:10,111] Trial 1963 finished with value: 0.904318218962208 and parameters: {'kernel': 'linear', 'C': 0.00164044916696161, 'gamma': 0.0008731717616147102, 'epsilon': 0.0520455299558917}. Best is trial 88 with value: 0.3542875001421725.
[I 2024-12-03 19:18:11,184] Trial 1964 finished with value: 0.7803506327980522 and parameters: {'kernel': 'rbf', 'C': 28.381572071665005, 'gamma': 0.7317625586134966, 'epsilon': 0.20155236029483792}. Best is trial 88 with value: 0.3542875001421725.
[I 2024-12-03 19:18:12,012] Trial 1966 finished with value: 1985.655413021856 and parameters: {'kernel': 'sigmoid', 'C': 91.46991776687962, 'gamma': 0.18134482263353247, 'epsilon': 0.07514954078922077}. Best is trial 88 with value: 0.3542875001421725.
[I 2024-12-03 19:18:12,496] Trial 1967 finished with value: 0.38525203723278273 and parameters: {'kernel': 'rbf', 'C': 90.10524978619955, 'gamma': 0.06900117409033357, 'epsilon': 0.2455307529007034}. Best is trial 88 with value: 0.3542875001421725.
[I 2024-12-03 19:18:13,595] Trial 1968 finished with value: 0.5316913045281538 and parameters: {'kernel': 'rbf', 'C': 26.096384246616857, 'gamma': 0.23430412139822268, 'epsilon': 0.03453149277816618}. Best is trial 88 with value: 0.3542875001421725.
[I 2024-12-03 19:18:14,173] Trial 1969 finished with value: 0.39804475143489954 and parameters: {'kernel': 'rbf', 'C': 23.360037347931645, 'gamma': 0.04043289087518381, 'epsilon': 0.11250709255175004}. Best is trial 88 with value: 0.3542875001421725.
[I 2024-12-03 19:18:15,094] Trial 1970 finished with value: 0.3680401005028642 and parameters: {'kernel': 'rbf', 'C': 98.61087739651542, 'gamma': 0.02699819798697577, 'epsilon': 0.052442111813876625}. Best is trial 88 with value: 0.3542875001421725.
[I 2024-12-03 19:18:15,417] Trial 1971 finished with value: 0.4654955787375889 and parameters: {'kernel': 'rbf', 'C': 91.72420870866088, 'gamma': 0.1544671493315221, 'epsilon': 0.11893755400998375}. Best is trial 88 with value: 0.3542875001421725.
[I 2024-12-03 19:18:16,871] Trial 1973 finished with value: 0.38080105301772055 and parameters: {'kernel': 'rbf', 'C': 32.09073762016899, 'gamma': 0.03219302936215384, 'epsilon': 0.2060389676943492}. Best is trial 88 with value: 0.3542875001421725.
[I 2024-12-03 19:18:17,067] Trial 1972 finished with value: 2.7706305855658773 and parameters: {'kernel': 'poly', 'C': 9.117024369978731, 'gamma': 0.014667085924493034, 'epsilon': 0.10301311073204915}. Best is trial 88 with value: 0.3542875001421725.
[I 2024-12-03 19:18:17,365] Trial 1974 finished with value: 0.3819130949739781 and parameters: {'kernel': 'rbf', 'C': 93.20743130891572, 'gamma': 0.06389168571095881, 'epsilon': 0.2540424545926585}. Best is trial 88 with value: 0.3542875001421725.
[I 2024-12-03 19:18:19,018] Trial 1975 finished with value: 1.7209655328485023 and parameters: {'kernel': 'poly', 'C': 0.116240199618921, 'gamma': 0.018852877509471146, 'epsilon': 0.0012218453702937076}. Best is trial 88 with value: 0.3542875001421725.
[I 2024-12-03 19:18:19,020] Trial 1976 finished with value: 0.45358222678088317 and parameters: {'kernel': 'rbf', 'C': 5.342922414183137, 'gamma': 0.0073995599366625175, 'epsilon': 0.12364344289612907}. Best is trial 88 with value: 0.3542875001421725.
[I 2024-12-03 19:18:21,311] Trial 1977 finished with value: 0.3778373118042856 and parameters: {'kernel': 'rbf', 'C': 94.44145145639744, 'gamma': 0.06312336175638002, 'epsilon': 0.0457369189101661}. Best is trial 88 with value: 0.3542875001421725.
[I 2024-12-03 19:18:21,994] Trial 1978 finished with value: 0.3853110395350897 and parameters: {'kernel': 'rbf', 'C': 24.355661151436742, 'gamma': 0.04571414600988149, 'epsilon': 0.16570980756548007}. Best is trial 88 with value: 0.3542875001421725.
[I 2024-12-03 19:18:22,267] Trial 1979 finished with value: 1676.1353487204653 and parameters: {'kernel': 'sigmoid', 'C': 91.30992218026458, 'gamma': 0.024351279443671017, 'epsilon': 0.06576268759178612}. Best is trial 88 with value: 0.3542875001421725.
[I 2024-12-03 19:18:22,700] Trial 1980 finished with value: 0.5814535526364448 and parameters: {'kernel': 'rbf', 'C': 29.932320374368913, 'gamma': 0.1419801698268734, 'epsilon': 0.49913698472729795}. Best is trial 88 with value: 0.3542875001421725.
[I 2024-12-03 19:18:24,302] Trial 1982 finished with value: 0.3559065776064717 and parameters: {'kernel': 'rbf', 'C': 90.24689681866661, 'gamma': 0.0458521547399241, 'epsilon': 0.18306261415811861}. Best is trial 88 with value: 0.3542875001421725.
[I 2024-12-03 19:18:24,776] Trial 1981 finished with value: 0.5980810679569188 and parameters: {'kernel': 'rbf', 'C': 97.09556403242922, 'gamma': 0.3227488147878713, 'epsilon': 0.09570352812739374}. Best is trial 88 with value: 0.3542875001421725.
[I 2024-12-03 19:18:24,795] Trial 1983 finished with value: 0.4611000402984682 and parameters: {'kernel': 'rbf', 'C': 16.547663973082592, 'gamma': 0.024159561193637654, 'epsilon': 0.5314409212587022}. Best is trial 88 with value: 0.3542875001421725.
[I 2024-12-03 19:18:25,643] Trial 1984 finished with value: 0.4473251637176435 and parameters: {'kernel': 'rbf', 'C': 37.45323660590162, 'gamma': 0.03303787486960997, 'epsilon': 0.5779623803462922}. Best is trial 88 with value: 0.3542875001421725.
[I 2024-12-03 19:18:27,076] Trial 1985 finished with value: 0.424625653053645 and parameters: {'kernel': 'rbf', 'C': 93.35224039848735, 'gamma': 0.03200107667981925, 'epsilon': 0.5480860306964476}. Best is trial 88 with value: 0.3542875001421725.
[I 2024-12-03 19:18:27,388] Trial 1986 finished with value: 0.3888672321054217 and parameters: {'kernel': 'rbf', 'C': 20.126502469796865, 'gamma': 0.008632635233299976, 'epsilon': 0.09866934174045461}. Best is trial 88 with value: 0.3542875001421725.
[I 2024-12-03 19:18:27,637] Trial 1987 finished with value: 0.4474118445245076 and parameters: {'kernel': 'rbf', 'C': 94.26141048135538, 'gamma': 0.1084181432141076, 'epsilon': 0.2564381711027193}. Best is trial 88 with value: 0.3542875001421725.
[I 2024-12-03 19:18:28,673] Trial 1988 finished with value: 0.4112944559736817 and parameters: {'kernel': 'rbf', 'C': 17.89364175250105, 'gamma': 0.025129405168310283, 'epsilon': 0.2111737930299125}. Best is trial 88 with value: 0.3542875001421725.
[I 2024-12-03 19:18:29,722] Trial 1990 finished with value: 0.504676816546514 and parameters: {'kernel': 'rbf', 'C': 92.08968554126434, 'gamma': 0.1250816254227197, 'epsilon': 0.3503660191782556}. Best is trial 88 with value: 0.3542875001421725.
[I 2024-12-03 19:18:29,781] Trial 1989 finished with value: 0.36635248979524637 and parameters: {'kernel': 'rbf', 'C': 94.8200672008262, 'gamma': 0.024838847041355347, 'epsilon': 0.2875765859267502}. Best is trial 88 with value: 0.3542875001421725.
[I 2024-12-03 19:18:31,496] Trial 1992 finished with value: 0.46087168345827706 and parameters: {'kernel': 'rbf', 'C': 22.070770737615685, 'gamma': 0.12452733281788408, 'epsilon': 0.20579990063170006}. Best is trial 88 with value: 0.3542875001421725.
[I 2024-12-03 19:18:31,670] Trial 1993 finished with value: 0.48222946083537904 and parameters: {'kernel': 'rbf', 'C': 4.1119525433513235, 'gamma': 0.07280151575568763, 'epsilon': 0.2657745339539138}. Best is trial 88 with value: 0.3542875001421725.
[I 2024-12-03 19:18:33,222] Trial 1994 finished with value: 0.36849190603152465 and parameters: {'kernel': 'rbf', 'C': 81.23937518440432, 'gamma': 0.027962613322817253, 'epsilon': 0.2312612110435127}. Best is trial 88 with value: 0.3542875001421725.
[I 2024-12-03 19:18:33,254] Trial 1995 finished with value: 0.43183670337555796 and parameters: {'kernel': 'rbf', 'C': 20.639285053469617, 'gamma': 0.010475991849512445, 'epsilon': 0.23221881350843646}. Best is trial 88 with value: 0.3542875001421725.
[I 2024-12-03 19:18:34,863] Trial 1997 finished with value: 0.5090831875272924 and parameters: {'kernel': 'rbf', 'C': 35.15490462545859, 'gamma': 0.007707211999787641, 'epsilon': 0.6348988865456219}. Best is trial 88 with value: 0.3542875001421725.
[I 2024-12-03 19:18:35,258] Trial 1996 finished with value: 0.45625622506051 and parameters: {'kernel': 'rbf', 'C': 96.45177437166576, 'gamma': 0.13956533149575148, 'epsilon': 0.15444729327153695}. Best is trial 88 with value: 0.3542875001421725.
[I 2024-12-03 19:18:36,391] Trial 1998 finished with value: 0.36978121911088085 and parameters: {'kernel': 'rbf', 'C': 97.15558974830611, 'gamma': 0.02600095222894685, 'epsilon': 0.19154263621392464}. Best is trial 88 with value: 0.3542875001421725.
[I 2024-12-03 19:18:36,954] Trial 1999 finished with value: 0.4207236833197149 and parameters: {'kernel': 'rbf', 'C': 21.043223450109224, 'gamma': 0.019897962763530716, 'epsilon': 0.11921923031794446}. Best is trial 88 with value: 0.3542875001421725.
[I 2024-12-03 19:18:38,887] Trial 2001 finished with value: 307.53156606869544 and parameters: {'kernel': 'sigmoid', 'C': 18.1518316150907, 'gamma': 0.019640925703256273, 'epsilon': 0.20988199772788352}. Best is trial 88 with value: 0.3542875001421725.
[I 2024-12-03 19:18:39,296] Trial 2000 finished with value: 0.7989919772961607 and parameters: {'kernel': 'linear', 'C': 1.1568299336657824, 'gamma': 0.009804605560428503, 'epsilon': 0.0074415094366414355}. Best is trial 88 with value: 0.3542875001421725.
[I 2024-12-03 19:18:40,088] Trial 2002 finished with value: 0.6805916746511083 and parameters: {'kernel': 'rbf', 'C': 94.23092999957497, 'gamma': 0.22510856528456658, 'epsilon': 0.5887379295417047}. Best is trial 88 with value: 0.3542875001421725.
[I 2024-12-03 19:18:41,065] Trial 2003 finished with value: 0.36195811043906034 and parameters: {'kernel': 'rbf', 'C': 94.69316356678313, 'gamma': 0.03583070699940694, 'epsilon': 0.13001626714010198}. Best is trial 88 with value: 0.3542875001421725.
