[I 2024-12-04 12:16:26,108] Trial 1653 finished with value: 0.91680432572883 and parameters: {'n_estimators': 122, 'max_depth': 19, 'min_samples_split': 11, 'min_samples_leaf': 4, 'max_features': 'log2', 'bootstrap': True, 'criterion': 'absolute_error'}. Best is trial 341 with value: 0.2909369124469028.
[I 2024-12-04 12:16:26,837] Trial 1648 finished with value: 0.9179236569168482 and parameters: {'n_estimators': 242, 'max_depth': 38, 'min_samples_split': 42, 'min_samples_leaf': 15, 'max_features': 'sqrt', 'bootstrap': True, 'criterion': 'absolute_error'}. Best is trial 341 with value: 0.2909369124469028.
[I 2024-12-04 12:16:28,650] Trial 1652 finished with value: 0.44910613081427714 and parameters: {'n_estimators': 128, 'max_depth': 45, 'min_samples_split': 3, 'min_samples_leaf': 2, 'max_features': 'sqrt', 'bootstrap': False, 'criterion': 'squared_error'}. Best is trial 341 with value: 0.2909369124469028.
[I 2024-12-04 12:16:29,772] Trial 1649 finished with value: 0.3003277914993144 and parameters: {'n_estimators': 311, 'max_depth': 45, 'min_samples_split': 2, 'min_samples_leaf': 1, 'max_features': 'sqrt', 'bootstrap': False, 'criterion': 'squared_error'}. Best is trial 341 with value: 0.2909369124469028.
[I 2024-12-04 12:16:31,153] Trial 1654 finished with value: 0.41082729861318495 and parameters: {'n_estimators': 642, 'max_depth': 45, 'min_samples_split': 4, 'min_samples_leaf': 1, 'max_features': 'log2', 'bootstrap': False, 'criterion': 'squared_error'}. Best is trial 341 with value: 0.2909369124469028.
[I 2024-12-04 12:16:31,544] Trial 1661 finished with value: 0.30173104700625164 and parameters: {'n_estimators': 229, 'max_depth': 47, 'min_samples_split': 2, 'min_samples_leaf': 1, 'max_features': 'sqrt', 'bootstrap': False, 'criterion': 'squared_error'}. Best is trial 341 with value: 0.2909369124469028.
[I 2024-12-04 12:16:32,767] Trial 1663 finished with value: 0.4415530040567471 and parameters: {'n_estimators': 566, 'max_depth': 47, 'min_samples_split': 3, 'min_samples_leaf': 2, 'max_features': 'sqrt', 'bootstrap': False, 'criterion': 'squared_error'}. Best is trial 341 with value: 0.2909369124469028.
[I 2024-12-04 12:16:32,922] Trial 1659 finished with value: 0.8479886087684929 and parameters: {'n_estimators': 947, 'max_depth': 37, 'min_samples_split': 13, 'min_samples_leaf': 9, 'max_features': 'sqrt', 'bootstrap': True, 'criterion': 'squared_error'}. Best is trial 341 with value: 0.2909369124469028.
[I 2024-12-04 12:16:33,042] Trial 1665 finished with value: 0.29432756774787006 and parameters: {'n_estimators': 419, 'max_depth': 50, 'min_samples_split': 3, 'min_samples_leaf': 1, 'max_features': 'sqrt', 'bootstrap': False, 'criterion': 'squared_error'}. Best is trial 341 with value: 0.2909369124469028.
[I 2024-12-04 12:16:33,988] Trial 1657 finished with value: 0.31812785931161974 and parameters: {'n_estimators': 248, 'max_depth': 44, 'min_samples_split': 6, 'min_samples_leaf': 1, 'max_features': 'sqrt', 'bootstrap': False, 'criterion': 'squared_error'}. Best is trial 341 with value: 0.2909369124469028.
[I 2024-12-04 12:16:34,507] Trial 1656 finished with value: 0.398452735695987 and parameters: {'n_estimators': 391, 'max_depth': 49, 'min_samples_split': 4, 'min_samples_leaf': 1, 'max_features': 'log2', 'bootstrap': True, 'criterion': 'squared_error'}. Best is trial 341 with value: 0.2909369124469028.
[I 2024-12-04 12:16:35,880] Trial 1664 finished with value: 0.3069387464767411 and parameters: {'n_estimators': 225, 'max_depth': 43, 'min_samples_split': 4, 'min_samples_leaf': 1, 'max_features': 'sqrt', 'bootstrap': False, 'criterion': 'squared_error'}. Best is trial 341 with value: 0.2909369124469028.
[I 2024-12-04 12:16:36,159] Trial 1658 finished with value: 0.3073133682336935 and parameters: {'n_estimators': 626, 'max_depth': 43, 'min_samples_split': 4, 'min_samples_leaf': 1, 'max_features': 'sqrt', 'bootstrap': False, 'criterion': 'squared_error'}. Best is trial 341 with value: 0.2909369124469028.
[I 2024-12-04 12:16:38,735] Trial 1662 finished with value: 0.3202255826831203 and parameters: {'n_estimators': 626, 'max_depth': 38, 'min_samples_split': 2, 'min_samples_leaf': 1, 'max_features': 'sqrt', 'bootstrap': False, 'criterion': 'squared_error'}. Best is trial 341 with value: 0.2909369124469028.
[I 2024-12-04 12:16:38,984] Trial 1578 finished with value: 0.3580204678561894 and parameters: {'n_estimators': 583, 'max_depth': 19, 'min_samples_split': 3, 'min_samples_leaf': 1, 'max_features': None, 'bootstrap': True, 'criterion': 'absolute_error'}. Best is trial 341 with value: 0.2909369124469028.
[I 2024-12-04 12:16:39,911] Trial 1660 finished with value: 0.3156926188037351 and parameters: {'n_estimators': 505, 'max_depth': 48, 'min_samples_split': 2, 'min_samples_leaf': 1, 'max_features': 'sqrt', 'bootstrap': True, 'criterion': 'squared_error'}. Best is trial 341 with value: 0.2909369124469028.
[I 2024-12-04 12:16:41,051] Trial 1667 finished with value: 0.2962911794193516 and parameters: {'n_estimators': 438, 'max_depth': 49, 'min_samples_split': 2, 'min_samples_leaf': 1, 'max_features': 'sqrt', 'bootstrap': False, 'criterion': 'squared_error'}. Best is trial 341 with value: 0.2909369124469028.
[I 2024-12-04 12:16:42,420] Trial 1670 finished with value: 0.3192073997561537 and parameters: {'n_estimators': 104, 'max_depth': 44, 'min_samples_split': 6, 'min_samples_leaf': 1, 'max_features': 'sqrt', 'bootstrap': False, 'criterion': 'squared_error'}. Best is trial 341 with value: 0.2909369124469028.
[I 2024-12-04 12:16:42,621] Trial 1668 finished with value: 0.3848308863569323 and parameters: {'n_estimators': 274, 'max_depth': 47, 'min_samples_split': 25, 'min_samples_leaf': 3, 'max_features': None, 'bootstrap': True, 'criterion': 'squared_error'}. Best is trial 341 with value: 0.2909369124469028.
[I 2024-12-04 12:16:45,121] Trial 1666 finished with value: 0.2996738489564369 and parameters: {'n_estimators': 286, 'max_depth': 50, 'min_samples_split': 4, 'min_samples_leaf': 1, 'max_features': 'sqrt', 'bootstrap': False, 'criterion': 'squared_error'}. Best is trial 341 with value: 0.2909369124469028.
[I 2024-12-04 12:16:46,484] Trial 1669 finished with value: 0.30062747084475583 and parameters: {'n_estimators': 624, 'max_depth': 49, 'min_samples_split': 4, 'min_samples_leaf': 1, 'max_features': 'sqrt', 'bootstrap': False, 'criterion': 'squared_error'}. Best is trial 341 with value: 0.2909369124469028.
[I 2024-12-04 12:16:47,952] Trial 1675 finished with value: 0.2940334594037301 and parameters: {'n_estimators': 560, 'max_depth': 50, 'min_samples_split': 3, 'min_samples_leaf': 1, 'max_features': 'sqrt', 'bootstrap': False, 'criterion': 'squared_error'}. Best is trial 341 with value: 0.2909369124469028.
[I 2024-12-04 12:16:48,823] Trial 1678 finished with value: 0.2990133789146533 and parameters: {'n_estimators': 123, 'max_depth': 46, 'min_samples_split': 3, 'min_samples_leaf': 1, 'max_features': 'sqrt', 'bootstrap': False, 'criterion': 'squared_error'}. Best is trial 341 with value: 0.2909369124469028.
[I 2024-12-04 12:16:50,726] Trial 1681 finished with value: 0.4453241061508117 and parameters: {'n_estimators': 267, 'max_depth': 44, 'min_samples_split': 3, 'min_samples_leaf': 2, 'max_features': 'sqrt', 'bootstrap': False, 'criterion': 'squared_error'}. Best is trial 341 with value: 0.2909369124469028.
[I 2024-12-04 12:16:51,467] Trial 1671 finished with value: 0.29309534678801585 and parameters: {'n_estimators': 875, 'max_depth': 50, 'min_samples_split': 3, 'min_samples_leaf': 1, 'max_features': 'sqrt', 'bootstrap': False, 'criterion': 'squared_error'}. Best is trial 341 with value: 0.2909369124469028.
[I 2024-12-04 12:16:51,510] Trial 1677 finished with value: 0.3931378389304173 and parameters: {'n_estimators': 529, 'max_depth': 50, 'min_samples_split': 5, 'min_samples_leaf': 1, 'max_features': 'log2', 'bootstrap': False, 'criterion': 'squared_error'}. Best is trial 341 with value: 0.2909369124469028.
[I 2024-12-04 12:16:52,796] Trial 1680 finished with value: 0.29409254747552094 and parameters: {'n_estimators': 537, 'max_depth': 50, 'min_samples_split': 3, 'min_samples_leaf': 1, 'max_features': 'sqrt', 'bootstrap': False, 'criterion': 'squared_error'}. Best is trial 341 with value: 0.2909369124469028.
[I 2024-12-04 12:16:55,416] Trial 1676 finished with value: 0.5780924003217937 and parameters: {'n_estimators': 174, 'max_depth': 18, 'min_samples_split': 21, 'min_samples_leaf': 2, 'max_features': 'sqrt', 'bootstrap': True, 'criterion': 'absolute_error'}. Best is trial 341 with value: 0.2909369124469028.
[I 2024-12-04 12:16:55,722] Trial 1689 finished with value: 0.4427146486910674 and parameters: {'n_estimators': 239, 'max_depth': 50, 'min_samples_split': 4, 'min_samples_leaf': 2, 'max_features': 'sqrt', 'bootstrap': False, 'criterion': 'squared_error'}. Best is trial 341 with value: 0.2909369124469028.
[I 2024-12-04 12:16:56,140] Trial 1672 finished with value: 0.3335824029086228 and parameters: {'n_estimators': 278, 'max_depth': 48, 'min_samples_split': 9, 'min_samples_leaf': 1, 'max_features': 'sqrt', 'bootstrap': False, 'criterion': 'absolute_error'}. Best is trial 341 with value: 0.2909369124469028.
[I 2024-12-04 12:16:56,289] Trial 1683 finished with value: 0.29506484487507983 and parameters: {'n_estimators': 258, 'max_depth': 50, 'min_samples_split': 3, 'min_samples_leaf': 1, 'max_features': 'sqrt', 'bootstrap': False, 'criterion': 'squared_error'}. Best is trial 341 with value: 0.2909369124469028.
[I 2024-12-04 12:16:56,522] Trial 1684 finished with value: 0.302513183454388 and parameters: {'n_estimators': 293, 'max_depth': 42, 'min_samples_split': 3, 'min_samples_leaf': 1, 'max_features': 'sqrt', 'bootstrap': False, 'criterion': 'squared_error'}. Best is trial 341 with value: 0.2909369124469028.
[I 2024-12-04 12:16:56,804] Trial 1603 finished with value: 0.44646920259403805 and parameters: {'n_estimators': 729, 'max_depth': 17, 'min_samples_split': 28, 'min_samples_leaf': 4, 'max_features': None, 'bootstrap': False, 'criterion': 'absolute_error'}. Best is trial 341 with value: 0.2909369124469028.
[I 2024-12-04 12:16:56,835] Trial 1687 finished with value: 0.3011310763433816 and parameters: {'n_estimators': 288, 'max_depth': 43, 'min_samples_split': 3, 'min_samples_leaf': 1, 'max_features': 'sqrt', 'bootstrap': False, 'criterion': 'squared_error'}. Best is trial 341 with value: 0.2909369124469028.
[I 2024-12-04 12:16:56,889] Trial 1644 finished with value: 0.40156110927792105 and parameters: {'n_estimators': 337, 'max_depth': 10, 'min_samples_split': 2, 'min_samples_leaf': 1, 'max_features': None, 'bootstrap': True, 'criterion': 'absolute_error'}. Best is trial 341 with value: 0.2909369124469028.
[I 2024-12-04 12:16:57,279] Trial 1688 finished with value: 0.29970897464755186 and parameters: {'n_estimators': 255, 'max_depth': 50, 'min_samples_split': 2, 'min_samples_leaf': 1, 'max_features': 'sqrt', 'bootstrap': False, 'criterion': 'squared_error'}. Best is trial 341 with value: 0.2909369124469028.
[I 2024-12-04 12:16:58,533] Trial 1682 finished with value: 0.29430254727056154 and parameters: {'n_estimators': 442, 'max_depth': 50, 'min_samples_split': 3, 'min_samples_leaf': 1, 'max_features': 'sqrt', 'bootstrap': False, 'criterion': 'squared_error'}. Best is trial 341 with value: 0.2909369124469028.
[I 2024-12-04 12:16:58,693] Trial 1692 finished with value: 0.2945467660135172 and parameters: {'n_estimators': 278, 'max_depth': 50, 'min_samples_split': 3, 'min_samples_leaf': 1, 'max_features': 'sqrt', 'bootstrap': False, 'criterion': 'squared_error'}. Best is trial 341 with value: 0.2909369124469028.
[I 2024-12-04 12:17:00,455] Trial 1690 finished with value: 0.307383765905745 and parameters: {'n_estimators': 114, 'max_depth': 41, 'min_samples_split': 3, 'min_samples_leaf': 1, 'max_features': 'sqrt', 'bootstrap': False, 'criterion': 'squared_error'}. Best is trial 341 with value: 0.2909369124469028.
[I 2024-12-04 12:17:01,287] Trial 1691 finished with value: 0.3079577158291148 and parameters: {'n_estimators': 256, 'max_depth': 50, 'min_samples_split': 6, 'min_samples_leaf': 1, 'max_features': 'sqrt', 'bootstrap': False, 'criterion': 'squared_error'}. Best is trial 341 with value: 0.2909369124469028.
[I 2024-12-04 12:17:01,495] Trial 1686 finished with value: 0.4403490207286439 and parameters: {'n_estimators': 550, 'max_depth': 50, 'min_samples_split': 2, 'min_samples_leaf': 2, 'max_features': 'sqrt', 'bootstrap': False, 'criterion': 'squared_error'}. Best is trial 341 with value: 0.2909369124469028.
[I 2024-12-04 12:17:02,520] Trial 1693 finished with value: 0.29847756343400517 and parameters: {'n_estimators': 290, 'max_depth': 50, 'min_samples_split': 2, 'min_samples_leaf': 1, 'max_features': 'sqrt', 'bootstrap': False, 'criterion': 'squared_error'}. Best is trial 341 with value: 0.2909369124469028.
[I 2024-12-04 12:17:03,434] Trial 1685 finished with value: 0.50449177964045 and parameters: {'n_estimators': 503, 'max_depth': 50, 'min_samples_split': 17, 'min_samples_leaf': 11, 'max_features': None, 'bootstrap': False, 'criterion': 'squared_error'}. Best is trial 341 with value: 0.2909369124469028.
[I 2024-12-04 12:17:04,638] Trial 1694 finished with value: 0.44057353623733764 and parameters: {'n_estimators': 579, 'max_depth': 50, 'min_samples_split': 3, 'min_samples_leaf': 2, 'max_features': 'sqrt', 'bootstrap': False, 'criterion': 'squared_error'}. Best is trial 341 with value: 0.2909369124469028.
[I 2024-12-04 12:17:06,206] Trial 1674 finished with value: 0.4676904341367047 and parameters: {'n_estimators': 611, 'max_depth': 50, 'min_samples_split': 16, 'min_samples_leaf': 1, 'max_features': 'log2', 'bootstrap': True, 'criterion': 'absolute_error'}. Best is trial 341 with value: 0.2909369124469028.
[I 2024-12-04 12:17:08,443] Trial 1698 finished with value: 0.4381921466999354 and parameters: {'n_estimators': 470, 'max_depth': 50, 'min_samples_split': 5, 'min_samples_leaf': 2, 'max_features': 'sqrt', 'bootstrap': False, 'criterion': 'squared_error'}. Best is trial 341 with value: 0.2909369124469028.
[I 2024-12-04 12:17:08,631] Trial 1703 finished with value: 0.45034539098886656 and parameters: {'n_estimators': 120, 'max_depth': 47, 'min_samples_split': 3, 'min_samples_leaf': 2, 'max_features': 'sqrt', 'bootstrap': False, 'criterion': 'squared_error'}. Best is trial 341 with value: 0.2909369124469028.
[I 2024-12-04 12:17:09,542] Trial 1699 finished with value: 0.3012480104470905 and parameters: {'n_estimators': 128, 'max_depth': 45, 'min_samples_split': 2, 'min_samples_leaf': 1, 'max_features': 'sqrt', 'bootstrap': False, 'criterion': 'squared_error'}. Best is trial 341 with value: 0.2909369124469028.
[I 2024-12-04 12:17:10,434] Trial 1695 finished with value: 0.3108845072614585 and parameters: {'n_estimators': 774, 'max_depth': 39, 'min_samples_split': 3, 'min_samples_leaf': 1, 'max_features': 'sqrt', 'bootstrap': False, 'criterion': 'squared_error'}. Best is trial 341 with value: 0.2909369124469028.
[I 2024-12-04 12:17:11,082] Trial 1700 finished with value: 0.3073471912663629 and parameters: {'n_estimators': 634, 'max_depth': 44, 'min_samples_split': 4, 'min_samples_leaf': 1, 'max_features': 'sqrt', 'bootstrap': False, 'criterion': 'squared_error'}. Best is trial 341 with value: 0.2909369124469028.
[I 2024-12-04 12:17:11,195] Trial 1704 finished with value: 0.2939713538392429 and parameters: {'n_estimators': 637, 'max_depth': 50, 'min_samples_split': 3, 'min_samples_leaf': 1, 'max_features': 'sqrt', 'bootstrap': False, 'criterion': 'squared_error'}. Best is trial 341 with value: 0.2909369124469028.
[I 2024-12-04 12:17:11,763] Trial 1697 finished with value: 0.30253742625930125 and parameters: {'n_estimators': 668, 'max_depth': 43, 'min_samples_split': 3, 'min_samples_leaf': 1, 'max_features': 'sqrt', 'bootstrap': False, 'criterion': 'squared_error'}. Best is trial 341 with value: 0.2909369124469028.
[I 2024-12-04 12:17:12,287] Trial 1707 finished with value: 0.5979035041703625 and parameters: {'n_estimators': 764, 'max_depth': 23, 'min_samples_split': 4, 'min_samples_leaf': 1, 'max_features': 'log2', 'bootstrap': True, 'criterion': 'squared_error'}. Best is trial 341 with value: 0.2909369124469028.
[I 2024-12-04 12:17:12,616] Trial 1706 finished with value: 0.4430708441213323 and parameters: {'n_estimators': 478, 'max_depth': 41, 'min_samples_split': 3, 'min_samples_leaf': 2, 'max_features': 'sqrt', 'bootstrap': False, 'criterion': 'squared_error'}. Best is trial 341 with value: 0.2909369124469028.
[I 2024-12-04 12:17:12,696] Trial 1634 finished with value: 0.4040572554896581 and parameters: {'n_estimators': 658, 'max_depth': 48, 'min_samples_split': 37, 'min_samples_leaf': 2, 'max_features': None, 'bootstrap': True, 'criterion': 'absolute_error'}. Best is trial 341 with value: 0.2909369124469028.
[I 2024-12-04 12:17:12,937] Trial 1705 finished with value: 0.30633753159018 and parameters: {'n_estimators': 372, 'max_depth': 43, 'min_samples_split': 2, 'min_samples_leaf': 1, 'max_features': 'sqrt', 'bootstrap': False, 'criterion': 'squared_error'}. Best is trial 341 with value: 0.2909369124469028.
[I 2024-12-04 12:17:13,479] Trial 1696 finished with value: 0.48134721609846776 and parameters: {'n_estimators': 506, 'max_depth': 48, 'min_samples_split': 3, 'min_samples_leaf': 2, 'max_features': 'sqrt', 'bootstrap': True, 'criterion': 'squared_error'}. Best is trial 341 with value: 0.2909369124469028.
[I 2024-12-04 12:17:13,555] Trial 1713 finished with value: 0.31599307920297254 and parameters: {'n_estimators': 220, 'max_depth': 43, 'min_samples_split': 5, 'min_samples_leaf': 1, 'max_features': 'sqrt', 'bootstrap': False, 'criterion': 'squared_error'}. Best is trial 341 with value: 0.2909369124469028.
[I 2024-12-04 12:17:14,417] Trial 1702 finished with value: 0.7320966377951246 and parameters: {'n_estimators': 546, 'max_depth': 29, 'min_samples_split': 6, 'min_samples_leaf': 5, 'max_features': 'sqrt', 'bootstrap': True, 'criterion': 'squared_error'}. Best is trial 341 with value: 0.2909369124469028.
[I 2024-12-04 12:17:15,618] Trial 1673 finished with value: 0.3351399960279452 and parameters: {'n_estimators': 668, 'max_depth': 44, 'min_samples_split': 2, 'min_samples_leaf': 1, 'max_features': 'sqrt', 'bootstrap': True, 'criterion': 'absolute_error'}. Best is trial 341 with value: 0.2909369124469028.
[I 2024-12-04 12:17:16,679] Trial 1711 finished with value: 0.4128968027765416 and parameters: {'n_estimators': 351, 'max_depth': 50, 'min_samples_split': 5, 'min_samples_leaf': 2, 'max_features': None, 'bootstrap': False, 'criterion': 'squared_error'}. Best is trial 341 with value: 0.2909369124469028.
[I 2024-12-04 12:17:16,737] Trial 1714 finished with value: 0.30654229922385423 and parameters: {'n_estimators': 542, 'max_depth': 50, 'min_samples_split': 6, 'min_samples_leaf': 1, 'max_features': 'sqrt', 'bootstrap': False, 'criterion': 'squared_error'}. Best is trial 341 with value: 0.2909369124469028.
[I 2024-12-04 12:17:16,834] Trial 1701 finished with value: 0.945417507237803 and parameters: {'n_estimators': 186, 'max_depth': 10, 'min_samples_split': 3, 'min_samples_leaf': 9, 'max_features': 'log2', 'bootstrap': False, 'criterion': 'squared_error'}. Best is trial 341 with value: 0.2909369124469028.
[I 2024-12-04 12:17:17,714] Trial 1712 finished with value: 0.2939895783263259 and parameters: {'n_estimators': 482, 'max_depth': 50, 'min_samples_split': 3, 'min_samples_leaf': 1, 'max_features': 'sqrt', 'bootstrap': False, 'criterion': 'squared_error'}. Best is trial 341 with value: 0.2909369124469028.
[I 2024-12-04 12:17:18,285] Trial 1679 finished with value: 0.5152862701323825 and parameters: {'n_estimators': 889, 'max_depth': 18, 'min_samples_split': 2, 'min_samples_leaf': 1, 'max_features': 'sqrt', 'bootstrap': True, 'criterion': 'absolute_error'}. Best is trial 341 with value: 0.2909369124469028.
[I 2024-12-04 12:17:18,294] Trial 1710 finished with value: 0.3463192263050378 and parameters: {'n_estimators': 105, 'max_depth': 23, 'min_samples_split': 7, 'min_samples_leaf': 1, 'max_features': None, 'bootstrap': True, 'criterion': 'squared_error'}. Best is trial 341 with value: 0.2909369124469028.
[I 2024-12-04 12:17:18,588] Trial 1715 finished with value: 0.7911352905777159 and parameters: {'n_estimators': 149, 'max_depth': 26, 'min_samples_split': 47, 'min_samples_leaf': 2, 'max_features': 'log2', 'bootstrap': True, 'criterion': 'squared_error'}. Best is trial 341 with value: 0.2909369124469028.
[I 2024-12-04 12:17:19,639] Trial 1709 finished with value: 0.6377303189502487 and parameters: {'n_estimators': 171, 'max_depth': 19, 'min_samples_split': 2, 'min_samples_leaf': 1, 'max_features': 'log2', 'bootstrap': False, 'criterion': 'squared_error'}. Best is trial 341 with value: 0.2909369124469028.
[I 2024-12-04 12:17:22,504] Trial 1718 finished with value: 0.29963422532608797 and parameters: {'n_estimators': 194, 'max_depth': 50, 'min_samples_split': 4, 'min_samples_leaf': 1, 'max_features': 'sqrt', 'bootstrap': False, 'criterion': 'squared_error'}. Best is trial 341 with value: 0.2909369124469028.
[I 2024-12-04 12:17:23,487] Trial 1721 finished with value: 0.3150520684980487 and parameters: {'n_estimators': 464, 'max_depth': 40, 'min_samples_split': 2, 'min_samples_leaf': 1, 'max_features': 'sqrt', 'bootstrap': False, 'criterion': 'squared_error'}. Best is trial 341 with value: 0.2909369124469028.
[I 2024-12-04 12:17:23,899] Trial 1708 finished with value: 0.321530489787355 and parameters: {'n_estimators': 206, 'max_depth': 40, 'min_samples_split': 3, 'min_samples_leaf': 1, 'max_features': 'sqrt', 'bootstrap': False, 'criterion': 'absolute_error'}. Best is trial 341 with value: 0.2909369124469028.
