[I 2024-12-04 14:53:52,234] A new study created in RDB with name: Vc_gpr
[I 2024-12-04 14:54:02,592] Trial 2 finished with value: 1.3007745979612582 and parameters: {'kernel_type': 'Matern', 'length_scale': 4.684004475534893, 'noise_level': 1.6004858057046211e-09, 'constant_value': 7249.588401754309, 'nu': 1.5}. Best is trial 3 with value: 1.3007739235931424.
[I 2024-12-04 14:54:04,928] Trial 7 finished with value: 1.300774597962834 and parameters: {'kernel_type': 'RBF', 'length_scale': 49605.54023300015, 'noise_level': 0.01672594478658035, 'constant_value': 1.1594854447483773e-06, 'nu': 0.5}. Best is trial 3 with value: 1.3007739235931424.
[I 2024-12-04 14:54:08,090] Trial 3 finished with value: 1.3007739235931424 and parameters: {'kernel_type': 'Matern', 'length_scale': 0.00024214948492187088, 'noise_level': 7.089990174336401e-07, 'constant_value': 39965.003395832806, 'nu': 1.5}. Best is trial 3 with value: 1.3007739235931424.
[I 2024-12-04 14:54:11,272] Trial 23 finished with value: 1.269363502851914 and parameters: {'kernel_type': 'RBF', 'length_scale': 0.0057564471684913065, 'noise_level': 0.00025425889693642177, 'constant_value': 16.505123136950502, 'nu': 2.5}. Best is trial 23 with value: 1.269363502851914.
[I 2024-12-04 14:54:13,233] Trial 8 finished with value: 1.3007739235938907 and parameters: {'kernel_type': 'Matern', 'length_scale': 0.0015826660553306762, 'noise_level': 3.7721107346217954e-10, 'constant_value': 578.9863429870551, 'nu': 1.5}. Best is trial 23 with value: 1.269363502851914.
[I 2024-12-04 14:54:13,312] Trial 9 finished with value: 1.2693635028614438 and parameters: {'kernel_type': 'Matern', 'length_scale': 5.3896702111600576e-05, 'noise_level': 6.327802074360653e-06, 'constant_value': 0.0015446807318735664, 'nu': 0.5}. Best is trial 23 with value: 1.269363502851914.
[I 2024-12-04 14:54:16,621] Trial 20 finished with value: 1.2693635028570136 and parameters: {'kernel_type': 'RBF', 'length_scale': 0.03720584939807127, 'noise_level': 7.889063634393991e-10, 'constant_value': 0.14773106898831095, 'nu': 0.5}. Best is trial 23 with value: 1.269363502851914.
[I 2024-12-04 14:54:17,669] Trial 11 finished with value: 1.269363502856988 and parameters: {'kernel_type': 'Matern', 'length_scale': 0.0003708589393297784, 'noise_level': 0.0006537170823969171, 'constant_value': 117.52050923653478, 'nu': 2.5}. Best is trial 23 with value: 1.269363502851914.
[I 2024-12-04 14:54:17,672] Trial 1 finished with value: 1.2693635028579988 and parameters: {'kernel_type': 'RBF', 'length_scale': 716.0745307370007, 'noise_level': 9.05923125581725e-10, 'constant_value': 0.005896073697267939, 'nu': 0.5}. Best is trial 23 with value: 1.269363502851914.
[I 2024-12-04 14:54:18,666] Trial 10 finished with value: 1.2693635028632617 and parameters: {'kernel_type': 'RBF', 'length_scale': 0.027763614346808633, 'noise_level': 5.939330887011226e-06, 'constant_value': 0.026503364534292365, 'nu': 0.5}. Best is trial 29 with value: 0.15167297514460432.
[I 2024-12-04 14:54:19,553] Trial 29 finished with value: 0.15167297514460432 and parameters: {'kernel_type': 'RBF', 'length_scale': 72.90839312076082, 'noise_level': 0.04727678758489071, 'constant_value': 6765.726896262216, 'nu': 2.5}. Best is trial 29 with value: 0.15167297514460432.
[I 2024-12-04 14:54:20,366] Trial 22 finished with value: 1.2693635028574328 and parameters: {'kernel_type': 'RBF', 'length_scale': 0.1140195753556418, 'noise_level': 0.8848031174578437, 'constant_value': 10496.108597202807, 'nu': 1.5}. Best is trial 29 with value: 0.15167297514460432.
[I 2024-12-04 14:54:20,367] Trial 24 finished with value: 1.2693635028536343 and parameters: {'kernel_type': 'Matern', 'length_scale': 0.007924039574830545, 'noise_level': 0.00154009396080281, 'constant_value': 23.095680527635988, 'nu': 2.5}. Best is trial 29 with value: 0.15167297514460432.
[I 2024-12-04 14:54:20,386] Trial 25 finished with value: 0.17251040220247427 and parameters: {'kernel_type': 'Matern', 'length_scale': 2.045680806516358, 'noise_level': 1.276396853495102e-09, 'constant_value': 18.243827381999118, 'nu': 0.5}. Best is trial 29 with value: 0.15167297514460432.
[I 2024-12-04 14:54:20,625] Trial 18 finished with value: 1.2693635028577015 and parameters: {'kernel_type': 'RBF', 'length_scale': 0.0003015469480211471, 'noise_level': 4.350356877905541e-07, 'constant_value': 0.0007094880452127259, 'nu': 2.5}. Best is trial 29 with value: 0.15167297514460432.
[I 2024-12-04 14:54:21,178] Trial 5 finished with value: 1.3007745968987618 and parameters: {'kernel_type': 'RBF', 'length_scale': 8025.459283540255, 'noise_level': 0.004640134778664199, 'constant_value': 0.0012387165592423024, 'nu': 2.5}. Best is trial 29 with value: 0.15167297514460432.
[I 2024-12-04 14:54:22,167] Trial 28 finished with value: 1.269363502856304 and parameters: {'kernel_type': 'RBF', 'length_scale': 217.0479824725836, 'noise_level': 3.0693778934477814e-06, 'constant_value': 16.350215093656203, 'nu': 2.5}. Best is trial 29 with value: 0.15167297514460432.
[I 2024-12-04 14:54:22,559] Trial 14 finished with value: 1.2693635028594878 and parameters: {'kernel_type': 'Matern', 'length_scale': 446.6258337933048, 'noise_level': 3.0684284369150153e-06, 'constant_value': 40.4416569745208, 'nu': 2.5}. Best is trial 29 with value: 0.15167297514460432.
[I 2024-12-04 14:54:22,762] Trial 4 finished with value: 0.17251036986021817 and parameters: {'kernel_type': 'Matern', 'length_scale': 0.0903609687458709, 'noise_level': 1.20048507427284e-10, 'constant_value': 0.0019128297681901259, 'nu': 0.5}. Best is trial 29 with value: 0.15167297514460432.
[I 2024-12-04 14:54:23,585] Trial 0 finished with value: 1.269363502856963 and parameters: {'kernel_type': 'Matern', 'length_scale': 313.3000168983197, 'noise_level': 2.141998084044128e-06, 'constant_value': 0.0077258841541113, 'nu': 1.5}. Best is trial 29 with value: 0.15167297514460432.
[I 2024-12-04 14:54:23,643] Trial 15 finished with value: 1.269363502857028 and parameters: {'kernel_type': 'Matern', 'length_scale': 64.48828343559657, 'noise_level': 0.0007797747315306704, 'constant_value': 0.007739379031595531, 'nu': 2.5}. Best is trial 29 with value: 0.15167297514460432.
[I 2024-12-04 14:54:23,644] Trial 19 finished with value: 0.19858455241931727 and parameters: {'kernel_type': 'Matern', 'length_scale': 0.1762741361956235, 'noise_level': 0.03550069957225744, 'constant_value': 194.20065806460542, 'nu': 2.5}. Best is trial 29 with value: 0.15167297514460432.
[I 2024-12-04 14:54:25,485] Trial 12 finished with value: 1.2693635028672035 and parameters: {'kernel_type': 'RBF', 'length_scale': 1643.9235575624145, 'noise_level': 7.644282411821153e-07, 'constant_value': 1.2728342013269721e-05, 'nu': 2.5}. Best is trial 29 with value: 0.15167297514460432.
[I 2024-12-04 14:54:25,856] Trial 30 finished with value: 0.1516729795891097 and parameters: {'kernel_type': 'RBF', 'length_scale': 40.430818325617864, 'noise_level': 0.00013412361516444384, 'constant_value': 3875.5180970872234, 'nu': 0.5}. Best is trial 29 with value: 0.15167297514460432.
[I 2024-12-04 14:54:27,282] Trial 16 finished with value: 0.134354396824582 and parameters: {'kernel_type': 'Matern', 'length_scale': 5.085515088638232, 'noise_level': 5.110324167214016e-05, 'constant_value': 6.230404407201605e-05, 'nu': 1.5}. Best is trial 16 with value: 0.134354396824582.
[I 2024-12-04 14:54:29,968] Trial 31 finished with value: 1.2693635028571228 and parameters: {'kernel_type': 'Matern', 'length_scale': 0.0008807146907909923, 'noise_level': 0.09578994728272751, 'constant_value': 52.76618823772574, 'nu': 2.5}. Best is trial 16 with value: 0.134354396824582.
[I 2024-12-04 14:54:30,254] Trial 26 finished with value: 1.2693635028535148 and parameters: {'kernel_type': 'RBF', 'length_scale': 0.015051640469892151, 'noise_level': 0.17028006167578047, 'constant_value': 29418.244945430873, 'nu': 1.5}. Best is trial 16 with value: 0.134354396824582.
[I 2024-12-04 14:54:30,449] Trial 13 finished with value: 1.2693635028569792 and parameters: {'kernel_type': 'Matern', 'length_scale': 45601.36891439623, 'noise_level': 3.271476264260902e-09, 'constant_value': 0.0030598228656791354, 'nu': 0.5}. Best is trial 16 with value: 0.134354396824582.
[I 2024-12-04 14:54:31,766] Trial 17 finished with value: 1.269363502856974 and parameters: {'kernel_type': 'RBF', 'length_scale': 3553.068252667814, 'noise_level': 1.0129191500636792e-07, 'constant_value': 7.791866200490923e-07, 'nu': 0.5}. Best is trial 16 with value: 0.134354396824582.
[I 2024-12-04 14:54:32,702] Trial 6 finished with value: 0.14859827217049812 and parameters: {'kernel_type': 'Matern', 'length_scale': 0.14076195240240832, 'noise_level': 0.0004478833478182724, 'constant_value': 23648.572547611348, 'nu': 2.5}. Best is trial 16 with value: 0.134354396824582.
[I 2024-12-04 14:54:37,464] Trial 27 finished with value: 1.2693635028571046 and parameters: {'kernel_type': 'Matern', 'length_scale': 3.0389480237500997e-05, 'noise_level': 3.132290391429191e-05, 'constant_value': 1.9036335199941794e-05, 'nu': 2.5}. Best is trial 16 with value: 0.134354396824582.
[I 2024-12-04 14:54:38,408] Trial 34 finished with value: 1.3007739235930675 and parameters: {'kernel_type': 'RBF', 'length_scale': 0.016857612361127306, 'noise_level': 1.2343143023083382e-06, 'constant_value': 65901.44176595563, 'nu': 0.5}. Best is trial 16 with value: 0.134354396824582.
[I 2024-12-04 14:54:38,412] Trial 32 finished with value: 1.2693635028536134 and parameters: {'kernel_type': 'Matern', 'length_scale': 0.007035754059072939, 'noise_level': 2.740305703910446e-10, 'constant_value': 0.0005297032351591921, 'nu': 2.5}. Best is trial 16 with value: 0.134354396824582.
[I 2024-12-04 14:54:39,794] Trial 42 finished with value: 0.15167288418209524 and parameters: {'kernel_type': 'RBF', 'length_scale': 67921.52275510386, 'noise_level': 0.02977099016017734, 'constant_value': 95344.54901971202, 'nu': 2.5}. Best is trial 16 with value: 0.134354396824582.
[I 2024-12-04 14:54:41,199] Trial 33 finished with value: 0.15167299463283232 and parameters: {'kernel_type': 'RBF', 'length_scale': 1049.9087406263156, 'noise_level': 0.0007985843657861078, 'constant_value': 41169.350993152955, 'nu': 0.5}. Best is trial 16 with value: 0.134354396824582.
[I 2024-12-04 14:54:42,109] Trial 40 finished with value: 1.2693635028558623 and parameters: {'kernel_type': 'RBF', 'length_scale': 254.97852865931577, 'noise_level': 5.286454994951527e-06, 'constant_value': 3.4293634174879193, 'nu': 0.5}. Best is trial 16 with value: 0.134354396824582.
[I 2024-12-04 14:54:43,055] Trial 36 finished with value: 0.15167296034081743 and parameters: {'kernel_type': 'RBF', 'length_scale': 3.9065079952105197, 'noise_level': 0.01330691017944223, 'constant_value': 61.438810448005164, 'nu': 0.5}. Best is trial 16 with value: 0.134354396824582.
[I 2024-12-04 14:54:44,370] Trial 35 finished with value: 0.15167296993964174 and parameters: {'kernel_type': 'RBF', 'length_scale': 5200.521335524803, 'noise_level': 0.049051609191802785, 'constant_value': 420.13571946041105, 'nu': 2.5}. Best is trial 16 with value: 0.134354396824582.
[I 2024-12-04 14:54:47,278] Trial 21 finished with value: 0.15167300755121893 and parameters: {'kernel_type': 'RBF', 'length_scale': 0.9883054183415803, 'noise_level': 1.260739493852819e-09, 'constant_value': 2.9783660360637123e-07, 'nu': 0.5}. Best is trial 16 with value: 0.134354396824582.
[I 2024-12-04 14:54:50,884] Trial 44 finished with value: 1.269363502858138 and parameters: {'kernel_type': 'RBF', 'length_scale': 130.62376804230826, 'noise_level': 0.0002738619524790507, 'constant_value': 0.0006406473159201795, 'nu': 1.5}. Best is trial 16 with value: 0.134354396824582.
[I 2024-12-04 14:54:51,761] Trial 54 finished with value: 0.15167302720568526 and parameters: {'kernel_type': 'RBF', 'length_scale': 0.44706912219604034, 'noise_level': 0.0028504077378638084, 'constant_value': 0.9908955319640546, 'nu': 0.5}. Best is trial 16 with value: 0.134354396824582.
[I 2024-12-04 14:54:52,860] Trial 52 finished with value: 1.3007739078060876 and parameters: {'kernel_type': 'Matern', 'length_scale': 0.21833263959676277, 'noise_level': 1.1585554009425433e-06, 'constant_value': 19353.717638870625, 'nu': 2.5}. Best is trial 16 with value: 0.134354396824582.
[I 2024-12-04 14:54:53,018] Trial 48 finished with value: 1.2693635028582362 and parameters: {'kernel_type': 'RBF', 'length_scale': 8.93056463676968, 'noise_level': 9.8652172149198e-06, 'constant_value': 218.62409318807386, 'nu': 1.5}. Best is trial 49 with value: 0.13435423034437025.
[I 2024-12-04 14:54:53,304] Trial 46 finished with value: 1.269363497575921 and parameters: {'kernel_type': 'Matern', 'length_scale': 0.05327512190846444, 'noise_level': 0.0004791833501482869, 'constant_value': 24761.045022918293, 'nu': 0.5}. Best is trial 49 with value: 0.13435423034437025.
[I 2024-12-04 14:54:53,894] Trial 41 finished with value: 1.2693634346380132 and parameters: {'kernel_type': 'RBF', 'length_scale': 0.1756162562342254, 'noise_level': 0.011626594444281352, 'constant_value': 0.2362698573442022, 'nu': 0.5}. Best is trial 49 with value: 0.13435423034437025.
[I 2024-12-04 14:54:53,902] Trial 49 finished with value: 0.13435423034437025 and parameters: {'kernel_type': 'Matern', 'length_scale': 373.1890656814046, 'noise_level': 0.04385316375234794, 'constant_value': 1.4798859793742736, 'nu': 1.5}. Best is trial 49 with value: 0.13435423034437025.
[I 2024-12-04 14:54:54,573] Trial 39 finished with value: 0.17251040319426186 and parameters: {'kernel_type': 'Matern', 'length_scale': 0.253844238579499, 'noise_level': 7.50938440843955e-07, 'constant_value': 2.8398523807610908e-05, 'nu': 0.5}. Best is trial 49 with value: 0.13435423034437025.
[I 2024-12-04 14:54:54,909] Trial 47 finished with value: 1.2693635028569907 and parameters: {'kernel_type': 'RBF', 'length_scale': 48135.88385123672, 'noise_level': 0.0020609037785169287, 'constant_value': 66425.8229979587, 'nu': 2.5}. Best is trial 49 with value: 0.13435423034437025.
[I 2024-12-04 14:54:55,842] Trial 53 finished with value: 0.15167296778183728 and parameters: {'kernel_type': 'RBF', 'length_scale': 0.2733886356498142, 'noise_level': 0.05209281395770606, 'constant_value': 15630.087069863506, 'nu': 2.5}. Best is trial 49 with value: 0.13435423034437025.
[I 2024-12-04 14:54:58,393] Trial 37 finished with value: 1.3007745979694112 and parameters: {'kernel_type': 'Matern', 'length_scale': 0.7426783744998263, 'noise_level': 0.0011528895383324394, 'constant_value': 93693.23071848197, 'nu': 2.5}. Best is trial 49 with value: 0.13435423034437025.
[I 2024-12-04 14:54:59,151] Trial 45 finished with value: 0.1485981909475726 and parameters: {'kernel_type': 'Matern', 'length_scale': 8322.523736809719, 'noise_level': 0.6139025831284574, 'constant_value': 13215.560857191947, 'nu': 2.5}. Best is trial 49 with value: 0.13435423034437025.
[I 2024-12-04 14:54:59,623] Trial 51 finished with value: 0.15167297764098753 and parameters: {'kernel_type': 'RBF', 'length_scale': 43500.782095739785, 'noise_level': 0.5649259771164103, 'constant_value': 5865.408971355901, 'nu': 1.5}. Best is trial 49 with value: 0.13435423034437025.
[I 2024-12-04 14:54:59,695] Trial 38 finished with value: 0.13435446925636366 and parameters: {'kernel_type': 'Matern', 'length_scale': 4.090411057799103, 'noise_level': 7.689108442140485e-05, 'constant_value': 4.226201145509689e-06, 'nu': 1.5}. Best is trial 49 with value: 0.13435423034437025.
[I 2024-12-04 14:55:01,156] Trial 61 finished with value: 1.3007571157919289 and parameters: {'kernel_type': 'Matern', 'length_scale': 133.9475463240253, 'noise_level': 0.2015484142497824, 'constant_value': 4.1855418807717e-05, 'nu': 1.5}. Best is trial 49 with value: 0.13435423034437025.
[I 2024-12-04 14:55:01,368] Trial 56 finished with value: 0.1343543436485697 and parameters: {'kernel_type': 'Matern', 'length_scale': 1.0604119818067215, 'noise_level': 9.607963785723089e-06, 'constant_value': 0.030668552299900235, 'nu': 1.5}. Best is trial 49 with value: 0.13435423034437025.
[I 2024-12-04 14:55:02,021] Trial 58 finished with value: 1.3007745833037894 and parameters: {'kernel_type': 'RBF', 'length_scale': 18606.981091129714, 'noise_level': 0.21438828173352606, 'constant_value': 12.190112541472509, 'nu': 2.5}. Best is trial 49 with value: 0.13435423034437025.
[I 2024-12-04 14:55:03,311] Trial 60 finished with value: 1.3007723267672857 and parameters: {'kernel_type': 'Matern', 'length_scale': 0.06811488558634747, 'noise_level': 0.4535994384862387, 'constant_value': 3.3622183921535714e-05, 'nu': 1.5}. Best is trial 49 with value: 0.13435423034437025.
[I 2024-12-04 14:55:03,693] Trial 57 finished with value: 1.3007745979681908 and parameters: {'kernel_type': 'RBF', 'length_scale': 70064.80069049008, 'noise_level': 0.09900840173717076, 'constant_value': 1.2678400387865802, 'nu': 2.5}. Best is trial 49 with value: 0.13435423034437025.
[I 2024-12-04 14:55:03,700] Trial 50 finished with value: 0.17251040282631624 and parameters: {'kernel_type': 'Matern', 'length_scale': 141.13778456900138, 'noise_level': 0.0067229967940041595, 'constant_value': 465.7132401301237, 'nu': 0.5}. Best is trial 49 with value: 0.13435423034437025.
[I 2024-12-04 14:55:03,917] Trial 55 finished with value: 0.15167297683241773 and parameters: {'kernel_type': 'RBF', 'length_scale': 29148.5117968306, 'noise_level': 0.4145943680105452, 'constant_value': 12356.938995554146, 'nu': 2.5}. Best is trial 49 with value: 0.13435423034437025.
[I 2024-12-04 14:55:06,425] Trial 63 finished with value: 0.13435449436649763 and parameters: {'kernel_type': 'Matern', 'length_scale': 3.5225169379221253, 'noise_level': 0.2213415947516081, 'constant_value': 54.52462600944704, 'nu': 1.5}. Best is trial 49 with value: 0.13435423034437025.
[I 2024-12-04 14:55:07,656] Trial 59 finished with value: 1.2693635028585633 and parameters: {'kernel_type': 'Matern', 'length_scale': 121.15381003822593, 'noise_level': 1.0504021112800018e-07, 'constant_value': 0.0004962510184339774, 'nu': 1.5}. Best is trial 49 with value: 0.13435423034437025.
[I 2024-12-04 14:55:10,594] Trial 68 finished with value: 0.14859827380467963 and parameters: {'kernel_type': 'Matern', 'length_scale': 1136.1586782485604, 'noise_level': 0.4966851639404131, 'constant_value': 967.6886082121374, 'nu': 2.5}. Best is trial 49 with value: 0.13435423034437025.
[I 2024-12-04 14:55:11,064] Trial 64 finished with value: 0.1485982753816246 and parameters: {'kernel_type': 'Matern', 'length_scale': 4986.903381134409, 'noise_level': 0.2463643843810254, 'constant_value': 6097.470131020165, 'nu': 2.5}. Best is trial 49 with value: 0.13435423034437025.
[I 2024-12-04 14:55:17,786] Trial 72 finished with value: 0.13435450348257533 and parameters: {'kernel_type': 'Matern', 'length_scale': 3.345208323197918, 'noise_level': 8.573055695875104e-08, 'constant_value': 0.7399293825974225, 'nu': 1.5}. Best is trial 49 with value: 0.13435423034437025.
[I 2024-12-04 14:55:18,285] Trial 65 finished with value: 1.269363502856147 and parameters: {'kernel_type': 'Matern', 'length_scale': 17.869270219427044, 'noise_level': 8.7523722495393e-05, 'constant_value': 0.005050691084792378, 'nu': 1.5}. Best is trial 49 with value: 0.13435423034437025.
[I 2024-12-04 14:55:18,419] Trial 67 finished with value: 1.3007745723089446 and parameters: {'kernel_type': 'Matern', 'length_scale': 0.4867862042195485, 'noise_level': 0.00025821609618677976, 'constant_value': 4.7195677464642457e-07, 'nu': 1.5}. Best is trial 49 with value: 0.13435423034437025.
[I 2024-12-04 14:55:18,500] Trial 69 finished with value: 0.13435440413039085 and parameters: {'kernel_type': 'Matern', 'length_scale': 0.4316878149002269, 'noise_level': 9.639248720164682e-06, 'constant_value': 5.323115714154353e-07, 'nu': 1.5}. Best is trial 49 with value: 0.13435423034437025.
[I 2024-12-04 14:55:18,523] Trial 66 finished with value: 0.1485982876509839 and parameters: {'kernel_type': 'Matern', 'length_scale': 24855.463600527695, 'noise_level': 0.6901095711589033, 'constant_value': 541.8837859652809, 'nu': 2.5}. Best is trial 49 with value: 0.13435423034437025.
[I 2024-12-04 14:55:20,680] Trial 79 finished with value: 1.2693635028569563 and parameters: {'kernel_type': 'Matern', 'length_scale': 0.004047850154703174, 'noise_level': 0.002753370243327689, 'constant_value': 21749.028021208047, 'nu': 1.5}. Best is trial 49 with value: 0.13435423034437025.
[I 2024-12-04 14:55:21,613] Trial 76 finished with value: 1.2693635028569408 and parameters: {'kernel_type': 'Matern', 'length_scale': 0.001147178211872726, 'noise_level': 1.0419789319908362e-05, 'constant_value': 0.0017136244255775458, 'nu': 1.5}. Best is trial 49 with value: 0.13435423034437025.
[I 2024-12-04 14:55:22,048] Trial 74 finished with value: 0.1343543977676481 and parameters: {'kernel_type': 'Matern', 'length_scale': 14.129399164402344, 'noise_level': 0.23268293318608013, 'constant_value': 16562.0888940289, 'nu': 1.5}. Best is trial 49 with value: 0.13435423034437025.
[I 2024-12-04 14:55:24,458] Trial 43 finished with value: 1.269363502857061 and parameters: {'kernel_type': 'Matern', 'length_scale': 98768.92590064002, 'noise_level': 8.858266823889627e-07, 'constant_value': 0.00023122950925518927, 'nu': 2.5}. Best is trial 49 with value: 0.13435423034437025.
[I 2024-12-04 14:55:24,660] Trial 83 finished with value: 0.13435439760801188 and parameters: {'kernel_type': 'Matern', 'length_scale': 8.133638825907456, 'noise_level': 0.03479384252844332, 'constant_value': 3.145998457018065, 'nu': 1.5}. Best is trial 49 with value: 0.13435423034437025.
[I 2024-12-04 14:55:24,669] Trial 62 finished with value: 0.1343544029324233 and parameters: {'kernel_type': 'Matern', 'length_scale': 8461.603137498725, 'noise_level': 0.3811257886745796, 'constant_value': 4.148084665861144, 'nu': 1.5}. Best is trial 49 with value: 0.13435423034437025.
