[I 2024-12-04 12:01:50,091] Trial 435 finished with value: 0.6038952979159389 and parameters: {'n_estimators': 104, 'max_depth': 29, 'min_samples_split': 6, 'min_samples_leaf': 2, 'max_features': None, 'bootstrap': False, 'criterion': 'absolute_error'}. Best is trial 306 with value: 0.5054021215392881.
[I 2024-12-04 12:01:50,370] Trial 443 finished with value: 1.0275148728464323 and parameters: {'n_estimators': 950, 'max_depth': 12, 'min_samples_split': 14, 'min_samples_leaf': 1, 'max_features': 'log2', 'bootstrap': False, 'criterion': 'squared_error'}. Best is trial 306 with value: 0.5054021215392881.
[I 2024-12-04 12:01:50,407] Trial 423 finished with value: 0.5158865708064599 and parameters: {'n_estimators': 297, 'max_depth': 20, 'min_samples_split': 6, 'min_samples_leaf': 1, 'max_features': None, 'bootstrap': True, 'criterion': 'absolute_error'}. Best is trial 306 with value: 0.5054021215392881.
[I 2024-12-04 12:01:50,613] Trial 438 finished with value: 0.5213302198149112 and parameters: {'n_estimators': 162, 'max_depth': 22, 'min_samples_split': 3, 'min_samples_leaf': 1, 'max_features': None, 'bootstrap': True, 'criterion': 'absolute_error'}. Best is trial 306 with value: 0.5054021215392881.
[I 2024-12-04 12:01:50,774] Trial 442 finished with value: 0.5218706049758063 and parameters: {'n_estimators': 111, 'max_depth': 15, 'min_samples_split': 8, 'min_samples_leaf': 1, 'max_features': None, 'bootstrap': True, 'criterion': 'absolute_error'}. Best is trial 306 with value: 0.5054021215392881.
[I 2024-12-04 12:01:51,775] Trial 412 finished with value: 0.5140744390411349 and parameters: {'n_estimators': 359, 'max_depth': 17, 'min_samples_split': 4, 'min_samples_leaf': 1, 'max_features': None, 'bootstrap': True, 'criterion': 'absolute_error'}. Best is trial 306 with value: 0.5054021215392881.
[I 2024-12-04 12:01:52,358] Trial 436 finished with value: 0.5141769643320308 and parameters: {'n_estimators': 111, 'max_depth': 15, 'min_samples_split': 4, 'min_samples_leaf': 1, 'max_features': None, 'bootstrap': True, 'criterion': 'absolute_error'}. Best is trial 306 with value: 0.5054021215392881.
[I 2024-12-04 12:01:53,223] Trial 439 finished with value: 0.5663880951007294 and parameters: {'n_estimators': 142, 'max_depth': 6, 'min_samples_split': 6, 'min_samples_leaf': 2, 'max_features': None, 'bootstrap': True, 'criterion': 'absolute_error'}. Best is trial 306 with value: 0.5054021215392881.
[I 2024-12-04 12:01:54,648] Trial 447 finished with value: 0.5113466713364033 and parameters: {'n_estimators': 128, 'max_depth': 14, 'min_samples_split': 4, 'min_samples_leaf': 1, 'max_features': None, 'bootstrap': True, 'criterion': 'absolute_error'}. Best is trial 306 with value: 0.5054021215392881.
[I 2024-12-04 12:01:56,431] Trial 445 finished with value: 0.522289930157121 and parameters: {'n_estimators': 112, 'max_depth': 13, 'min_samples_split': 7, 'min_samples_leaf': 1, 'max_features': None, 'bootstrap': True, 'criterion': 'absolute_error'}. Best is trial 306 with value: 0.5054021215392881.
[I 2024-12-04 12:01:57,982] Trial 444 finished with value: 0.5114236643743681 and parameters: {'n_estimators': 108, 'max_depth': 24, 'min_samples_split': 4, 'min_samples_leaf': 1, 'max_features': None, 'bootstrap': True, 'criterion': 'absolute_error'}. Best is trial 306 with value: 0.5054021215392881.
[I 2024-12-04 12:02:00,345] Trial 452 finished with value: 1.3403578752450807 and parameters: {'n_estimators': 972, 'max_depth': 29, 'min_samples_split': 31, 'min_samples_leaf': 5, 'max_features': 'log2', 'bootstrap': True, 'criterion': 'absolute_error'}. Best is trial 306 with value: 0.5054021215392881.
[I 2024-12-04 12:02:01,348] Trial 453 finished with value: 0.5457498848522653 and parameters: {'n_estimators': 156, 'max_depth': 24, 'min_samples_split': 12, 'min_samples_leaf': 2, 'max_features': None, 'bootstrap': True, 'criterion': 'squared_error'}. Best is trial 306 with value: 0.5054021215392881.
[I 2024-12-04 12:02:01,354] Trial 450 finished with value: 0.5576658646652851 and parameters: {'n_estimators': 210, 'max_depth': 29, 'min_samples_split': 5, 'min_samples_leaf': 2, 'max_features': None, 'bootstrap': True, 'criterion': 'absolute_error'}. Best is trial 306 with value: 0.5054021215392881.
[I 2024-12-04 12:02:06,583] Trial 437 finished with value: 0.542844827675929 and parameters: {'n_estimators': 276, 'max_depth': 28, 'min_samples_split': 16, 'min_samples_leaf': 1, 'max_features': None, 'bootstrap': True, 'criterion': 'absolute_error'}. Best is trial 306 with value: 0.5054021215392881.
[I 2024-12-04 12:02:07,184] Trial 456 finished with value: 0.5128344143474234 and parameters: {'n_estimators': 100, 'max_depth': 15, 'min_samples_split': 2, 'min_samples_leaf': 1, 'max_features': None, 'bootstrap': True, 'criterion': 'absolute_error'}. Best is trial 306 with value: 0.5054021215392881.
[I 2024-12-04 12:02:07,326] Trial 458 finished with value: 0.5505502226490455 and parameters: {'n_estimators': 107, 'max_depth': 13, 'min_samples_split': 5, 'min_samples_leaf': 2, 'max_features': None, 'bootstrap': True, 'criterion': 'absolute_error'}. Best is trial 306 with value: 0.5054021215392881.
[I 2024-12-04 12:02:07,397] Trial 446 finished with value: 0.6582467180549741 and parameters: {'n_estimators': 359, 'max_depth': 50, 'min_samples_split': 13, 'min_samples_leaf': 4, 'max_features': None, 'bootstrap': False, 'criterion': 'absolute_error'}. Best is trial 306 with value: 0.5054021215392881.
[I 2024-12-04 12:02:08,905] Trial 455 finished with value: 0.5060858922773923 and parameters: {'n_estimators': 132, 'max_depth': 19, 'min_samples_split': 5, 'min_samples_leaf': 1, 'max_features': None, 'bootstrap': True, 'criterion': 'absolute_error'}. Best is trial 306 with value: 0.5054021215392881.
[I 2024-12-04 12:02:09,484] Trial 454 finished with value: 0.5583618398084886 and parameters: {'n_estimators': 153, 'max_depth': 19, 'min_samples_split': 7, 'min_samples_leaf': 2, 'max_features': None, 'bootstrap': True, 'criterion': 'absolute_error'}. Best is trial 306 with value: 0.5054021215392881.
[I 2024-12-04 12:02:09,489] Trial 457 finished with value: 0.5313970399630119 and parameters: {'n_estimators': 108, 'max_depth': 23, 'min_samples_split': 12, 'min_samples_leaf': 1, 'max_features': None, 'bootstrap': True, 'criterion': 'absolute_error'}. Best is trial 306 with value: 0.5054021215392881.
[I 2024-12-04 12:02:10,839] Trial 451 finished with value: 0.520736200650889 and parameters: {'n_estimators': 219, 'max_depth': 31, 'min_samples_split': 7, 'min_samples_leaf': 1, 'max_features': None, 'bootstrap': True, 'criterion': 'absolute_error'}. Best is trial 306 with value: 0.5054021215392881.
[I 2024-12-04 12:02:12,217] Trial 467 finished with value: 0.5590719482074571 and parameters: {'n_estimators': 110, 'max_depth': 27, 'min_samples_split': 3, 'min_samples_leaf': 2, 'max_features': None, 'bootstrap': True, 'criterion': 'absolute_error'}. Best is trial 306 with value: 0.5054021215392881.
[I 2024-12-04 12:02:13,223] Trial 448 finished with value: 0.5130371679312388 and parameters: {'n_estimators': 302, 'max_depth': 15, 'min_samples_split': 3, 'min_samples_leaf': 1, 'max_features': None, 'bootstrap': True, 'criterion': 'absolute_error'}. Best is trial 306 with value: 0.5054021215392881.
[I 2024-12-04 12:02:13,315] Trial 459 finished with value: 0.7970854529655971 and parameters: {'n_estimators': 140, 'max_depth': 21, 'min_samples_split': 4, 'min_samples_leaf': 1, 'max_features': 'sqrt', 'bootstrap': True, 'criterion': 'absolute_error'}. Best is trial 306 with value: 0.5054021215392881.
[I 2024-12-04 12:02:13,664] Trial 465 finished with value: 0.8913011290822073 and parameters: {'n_estimators': 105, 'max_depth': 16, 'min_samples_split': 5, 'min_samples_leaf': 1, 'max_features': 'sqrt', 'bootstrap': True, 'criterion': 'absolute_error'}. Best is trial 306 with value: 0.5054021215392881.
[I 2024-12-04 12:02:16,465] Trial 449 finished with value: 0.5147312991855766 and parameters: {'n_estimators': 260, 'max_depth': 8, 'min_samples_split': 6, 'min_samples_leaf': 1, 'max_features': None, 'bootstrap': False, 'criterion': 'absolute_error'}. Best is trial 306 with value: 0.5054021215392881.
[I 2024-12-04 12:02:17,520] Trial 466 finished with value: 1.3001068749018116 and parameters: {'n_estimators': 567, 'max_depth': 32, 'min_samples_split': 2, 'min_samples_leaf': 3, 'max_features': 'log2', 'bootstrap': False, 'criterion': 'absolute_error'}. Best is trial 306 with value: 0.5054021215392881.
[I 2024-12-04 12:02:18,531] Trial 464 finished with value: 0.5177356961285214 and parameters: {'n_estimators': 126, 'max_depth': 21, 'min_samples_split': 3, 'min_samples_leaf': 1, 'max_features': None, 'bootstrap': True, 'criterion': 'absolute_error'}. Best is trial 306 with value: 0.5054021215392881.
[I 2024-12-04 12:02:20,497] Trial 472 finished with value: 0.5135378722859151 and parameters: {'n_estimators': 123, 'max_depth': 21, 'min_samples_split': 5, 'min_samples_leaf': 1, 'max_features': None, 'bootstrap': True, 'criterion': 'absolute_error'}. Best is trial 306 with value: 0.5054021215392881.
[I 2024-12-04 12:02:21,072] Trial 461 finished with value: 0.5128542287571659 and parameters: {'n_estimators': 128, 'max_depth': 17, 'min_samples_split': 4, 'min_samples_leaf': 1, 'max_features': None, 'bootstrap': True, 'criterion': 'absolute_error'}. Best is trial 306 with value: 0.5054021215392881.
[I 2024-12-04 12:02:21,318] Trial 471 finished with value: 0.5551205882263935 and parameters: {'n_estimators': 112, 'max_depth': 15, 'min_samples_split': 4, 'min_samples_leaf': 2, 'max_features': None, 'bootstrap': True, 'criterion': 'absolute_error'}. Best is trial 306 with value: 0.5054021215392881.
[I 2024-12-04 12:02:21,806] Trial 476 finished with value: 1.3534329679538852 and parameters: {'n_estimators': 282, 'max_depth': 43, 'min_samples_split': 42, 'min_samples_leaf': 13, 'max_features': 'sqrt', 'bootstrap': True, 'criterion': 'absolute_error'}. Best is trial 306 with value: 0.5054021215392881.
[I 2024-12-04 12:02:23,194] Trial 430 finished with value: 0.5594279660730783 and parameters: {'n_estimators': 361, 'max_depth': 21, 'min_samples_split': 4, 'min_samples_leaf': 1, 'max_features': None, 'bootstrap': False, 'criterion': 'absolute_error'}. Best is trial 306 with value: 0.5054021215392881.
[I 2024-12-04 12:02:24,124] Trial 470 finished with value: 0.5139436145040457 and parameters: {'n_estimators': 106, 'max_depth': 21, 'min_samples_split': 4, 'min_samples_leaf': 1, 'max_features': None, 'bootstrap': True, 'criterion': 'absolute_error'}. Best is trial 306 with value: 0.5054021215392881.
[I 2024-12-04 12:02:25,522] Trial 468 finished with value: 0.5071764451737801 and parameters: {'n_estimators': 107, 'max_depth': 14, 'min_samples_split': 5, 'min_samples_leaf': 1, 'max_features': None, 'bootstrap': True, 'criterion': 'absolute_error'}. Best is trial 306 with value: 0.5054021215392881.
[I 2024-12-04 12:02:25,742] Trial 463 finished with value: 0.5120381150272052 and parameters: {'n_estimators': 262, 'max_depth': 19, 'min_samples_split': 4, 'min_samples_leaf': 1, 'max_features': None, 'bootstrap': True, 'criterion': 'absolute_error'}. Best is trial 306 with value: 0.5054021215392881.
[I 2024-12-04 12:02:26,712] Trial 460 finished with value: 0.5178065965790786 and parameters: {'n_estimators': 235, 'max_depth': 24, 'min_samples_split': 5, 'min_samples_leaf': 1, 'max_features': None, 'bootstrap': True, 'criterion': 'absolute_error'}. Best is trial 306 with value: 0.5054021215392881.
[I 2024-12-04 12:02:27,644] Trial 413 finished with value: 0.5590394530198245 and parameters: {'n_estimators': 550, 'max_depth': 30, 'min_samples_split': 2, 'min_samples_leaf': 1, 'max_features': None, 'bootstrap': False, 'criterion': 'absolute_error'}. Best is trial 306 with value: 0.5054021215392881.
[I 2024-12-04 12:02:28,609] Trial 485 finished with value: 1.043765416030524 and parameters: {'n_estimators': 113, 'max_depth': 18, 'min_samples_split': 6, 'min_samples_leaf': 1, 'max_features': 'log2', 'bootstrap': True, 'criterion': 'absolute_error'}. Best is trial 306 with value: 0.5054021215392881.
[I 2024-12-04 12:02:28,778] Trial 480 finished with value: 0.5528836419885498 and parameters: {'n_estimators': 101, 'max_depth': 5, 'min_samples_split': 6, 'min_samples_leaf': 1, 'max_features': None, 'bootstrap': True, 'criterion': 'absolute_error'}. Best is trial 306 with value: 0.5054021215392881.
[I 2024-12-04 12:02:29,775] Trial 487 finished with value: 1.0631295432027528 and parameters: {'n_estimators': 238, 'max_depth': 12, 'min_samples_split': 4, 'min_samples_leaf': 1, 'max_features': 'log2', 'bootstrap': True, 'criterion': 'squared_error'}. Best is trial 306 with value: 0.5054021215392881.
[I 2024-12-04 12:02:29,776] Trial 483 finished with value: 0.6915824485268331 and parameters: {'n_estimators': 124, 'max_depth': 37, 'min_samples_split': 7, 'min_samples_leaf': 1, 'max_features': 'sqrt', 'bootstrap': True, 'criterion': 'absolute_error'}. Best is trial 306 with value: 0.5054021215392881.
[I 2024-12-04 12:02:29,836] Trial 475 finished with value: 0.508504756191631 and parameters: {'n_estimators': 102, 'max_depth': 24, 'min_samples_split': 5, 'min_samples_leaf': 1, 'max_features': None, 'bootstrap': True, 'criterion': 'absolute_error'}. Best is trial 306 with value: 0.5054021215392881.
[I 2024-12-04 12:02:30,488] Trial 484 finished with value: 1.2874868821741832 and parameters: {'n_estimators': 144, 'max_depth': 33, 'min_samples_split': 6, 'min_samples_leaf': 2, 'max_features': 'log2', 'bootstrap': True, 'criterion': 'absolute_error'}. Best is trial 306 with value: 0.5054021215392881.
[I 2024-12-04 12:02:33,138] Trial 477 finished with value: 0.5565324533867632 and parameters: {'n_estimators': 305, 'max_depth': 12, 'min_samples_split': 3, 'min_samples_leaf': 2, 'max_features': None, 'bootstrap': True, 'criterion': 'absolute_error'}. Best is trial 306 with value: 0.5054021215392881.
[I 2024-12-04 12:02:33,142] Trial 481 finished with value: 0.5083438031274529 and parameters: {'n_estimators': 125, 'max_depth': 17, 'min_samples_split': 5, 'min_samples_leaf': 1, 'max_features': None, 'bootstrap': True, 'criterion': 'absolute_error'}. Best is trial 306 with value: 0.5054021215392881.
[I 2024-12-04 12:02:33,176] Trial 473 finished with value: 0.5224367476803651 and parameters: {'n_estimators': 277, 'max_depth': 17, 'min_samples_split': 8, 'min_samples_leaf': 1, 'max_features': None, 'bootstrap': True, 'criterion': 'absolute_error'}. Best is trial 306 with value: 0.5054021215392881.
[I 2024-12-04 12:02:33,562] Trial 474 finished with value: 0.5128549777753301 and parameters: {'n_estimators': 109, 'max_depth': 17, 'min_samples_split': 4, 'min_samples_leaf': 1, 'max_features': None, 'bootstrap': True, 'criterion': 'absolute_error'}. Best is trial 306 with value: 0.5054021215392881.
[I 2024-12-04 12:02:33,903] Trial 478 finished with value: 1.20462576634404 and parameters: {'n_estimators': 905, 'max_depth': 35, 'min_samples_split': 13, 'min_samples_leaf': 8, 'max_features': 'sqrt', 'bootstrap': True, 'criterion': 'squared_error'}. Best is trial 306 with value: 0.5054021215392881.
[I 2024-12-04 12:02:37,110] Trial 482 finished with value: 0.5748537893477141 and parameters: {'n_estimators': 124, 'max_depth': 18, 'min_samples_split': 4, 'min_samples_leaf': 1, 'max_features': None, 'bootstrap': False, 'criterion': 'absolute_error'}. Best is trial 306 with value: 0.5054021215392881.
[I 2024-12-04 12:02:37,177] Trial 405 finished with value: 0.698243356494987 and parameters: {'n_estimators': 933, 'max_depth': 44, 'min_samples_split': 43, 'min_samples_leaf': 1, 'max_features': None, 'bootstrap': True, 'criterion': 'absolute_error'}. Best is trial 306 with value: 0.5054021215392881.
[I 2024-12-04 12:02:39,127] Trial 486 finished with value: 0.526691713745438 and parameters: {'n_estimators': 988, 'max_depth': 18, 'min_samples_split': 11, 'min_samples_leaf': 1, 'max_features': None, 'bootstrap': True, 'criterion': 'squared_error'}. Best is trial 306 with value: 0.5054021215392881.
[I 2024-12-04 12:02:39,476] Trial 462 finished with value: 0.5483325367891021 and parameters: {'n_estimators': 249, 'max_depth': 27, 'min_samples_split': 25, 'min_samples_leaf': 1, 'max_features': None, 'bootstrap': False, 'criterion': 'absolute_error'}. Best is trial 306 with value: 0.5054021215392881.
[I 2024-12-04 12:02:42,591] Trial 469 finished with value: 0.5682656439759933 and parameters: {'n_estimators': 794, 'max_depth': 49, 'min_samples_split': 11, 'min_samples_leaf': 3, 'max_features': None, 'bootstrap': True, 'criterion': 'absolute_error'}. Best is trial 306 with value: 0.5054021215392881.
[I 2024-12-04 12:02:42,602] Trial 496 finished with value: 0.5134521168259147 and parameters: {'n_estimators': 106, 'max_depth': 26, 'min_samples_split': 5, 'min_samples_leaf': 1, 'max_features': None, 'bootstrap': True, 'criterion': 'absolute_error'}. Best is trial 306 with value: 0.5054021215392881.
[I 2024-12-04 12:02:43,224] Trial 491 finished with value: 1.2315078548067206 and parameters: {'n_estimators': 141, 'max_depth': 37, 'min_samples_split': 26, 'min_samples_leaf': 9, 'max_features': 'log2', 'bootstrap': False, 'criterion': 'squared_error'}. Best is trial 306 with value: 0.5054021215392881.
[I 2024-12-04 12:02:44,042] Trial 488 finished with value: 0.8386751137509343 and parameters: {'n_estimators': 519, 'max_depth': 36, 'min_samples_split': 14, 'min_samples_leaf': 1, 'max_features': 'log2', 'bootstrap': False, 'criterion': 'absolute_error'}. Best is trial 306 with value: 0.5054021215392881.
[I 2024-12-04 12:02:44,133] Trial 493 finished with value: 0.5224210006557114 and parameters: {'n_estimators': 112, 'max_depth': 11, 'min_samples_split': 7, 'min_samples_leaf': 1, 'max_features': None, 'bootstrap': True, 'criterion': 'absolute_error'}. Best is trial 306 with value: 0.5054021215392881.
[I 2024-12-04 12:02:44,705] Trial 479 finished with value: 0.5503783451831235 and parameters: {'n_estimators': 991, 'max_depth': 28, 'min_samples_split': 6, 'min_samples_leaf': 2, 'max_features': None, 'bootstrap': True, 'criterion': 'squared_error'}. Best is trial 306 with value: 0.5054021215392881.
[I 2024-12-04 12:02:45,607] Trial 500 finished with value: 1.311697658581445 and parameters: {'n_estimators': 518, 'max_depth': 39, 'min_samples_split': 18, 'min_samples_leaf': 10, 'max_features': 'sqrt', 'bootstrap': False, 'criterion': 'absolute_error'}. Best is trial 306 with value: 0.5054021215392881.
[I 2024-12-04 12:02:45,746] Trial 503 finished with value: 0.8151794133303368 and parameters: {'n_estimators': 278, 'max_depth': 18, 'min_samples_split': 3, 'min_samples_leaf': 12, 'max_features': None, 'bootstrap': True, 'criterion': 'squared_error'}. Best is trial 306 with value: 0.5054021215392881.
[I 2024-12-04 12:02:46,691] Trial 489 finished with value: 0.5209922999190025 and parameters: {'n_estimators': 298, 'max_depth': 10, 'min_samples_split': 3, 'min_samples_leaf': 1, 'max_features': None, 'bootstrap': True, 'criterion': 'absolute_error'}. Best is trial 306 with value: 0.5054021215392881.
[I 2024-12-04 12:02:47,315] Trial 490 finished with value: 0.5245629290578389 and parameters: {'n_estimators': 202, 'max_depth': 27, 'min_samples_split': 8, 'min_samples_leaf': 1, 'max_features': None, 'bootstrap': True, 'criterion': 'absolute_error'}. Best is trial 306 with value: 0.5054021215392881.
[I 2024-12-04 12:02:50,369] Trial 501 finished with value: 0.5199115685714141 and parameters: {'n_estimators': 127, 'max_depth': 15, 'min_samples_split': 7, 'min_samples_leaf': 1, 'max_features': None, 'bootstrap': True, 'criterion': 'absolute_error'}. Best is trial 306 with value: 0.5054021215392881.
[I 2024-12-04 12:02:51,623] Trial 498 finished with value: 0.5068916871151098 and parameters: {'n_estimators': 134, 'max_depth': 16, 'min_samples_split': 4, 'min_samples_leaf': 1, 'max_features': None, 'bootstrap': True, 'criterion': 'absolute_error'}. Best is trial 306 with value: 0.5054021215392881.
[I 2024-12-04 12:02:52,071] Trial 494 finished with value: 0.5126543392132242 and parameters: {'n_estimators': 313, 'max_depth': 13, 'min_samples_split': 5, 'min_samples_leaf': 1, 'max_features': None, 'bootstrap': True, 'criterion': 'absolute_error'}. Best is trial 306 with value: 0.5054021215392881.
[I 2024-12-04 12:02:52,222] Trial 504 finished with value: 1.1494844700956395 and parameters: {'n_estimators': 391, 'max_depth': 11, 'min_samples_split': 4, 'min_samples_leaf': 1, 'max_features': 'log2', 'bootstrap': True, 'criterion': 'absolute_error'}. Best is trial 306 with value: 0.5054021215392881.
[I 2024-12-04 12:02:52,433] Trial 495 finished with value: 0.5150866310501854 and parameters: {'n_estimators': 292, 'max_depth': 12, 'min_samples_split': 5, 'min_samples_leaf': 1, 'max_features': None, 'bootstrap': True, 'criterion': 'absolute_error'}. Best is trial 306 with value: 0.5054021215392881.
[I 2024-12-04 12:02:52,921] Trial 505 finished with value: 0.5580342290290925 and parameters: {'n_estimators': 116, 'max_depth': 15, 'min_samples_split': 7, 'min_samples_leaf': 2, 'max_features': None, 'bootstrap': True, 'criterion': 'absolute_error'}. Best is trial 306 with value: 0.5054021215392881.
[I 2024-12-04 12:02:52,963] Trial 492 finished with value: 0.517986586030697 and parameters: {'n_estimators': 242, 'max_depth': 28, 'min_samples_split': 3, 'min_samples_leaf': 1, 'max_features': None, 'bootstrap': True, 'criterion': 'absolute_error'}. Best is trial 306 with value: 0.5054021215392881.
[I 2024-12-04 12:02:53,832] Trial 513 finished with value: 0.6006291735164444 and parameters: {'n_estimators': 371, 'max_depth': 46, 'min_samples_split': 21, 'min_samples_leaf': 5, 'max_features': None, 'bootstrap': True, 'criterion': 'squared_error'}. Best is trial 306 with value: 0.5054021215392881.
