[I 2024-12-04 12:27:35,303] Trial 2235 finished with value: 0.5135669064875595 and parameters: {'n_estimators': 109, 'max_depth': 17, 'min_samples_split': 6, 'min_samples_leaf': 1, 'max_features': None, 'bootstrap': True, 'criterion': 'absolute_error'}. Best is trial 1749 with value: 0.502720715661024.
[I 2024-12-04 12:27:35,582] Trial 2238 finished with value: 0.5062205029163291 and parameters: {'n_estimators': 103, 'max_depth': 19, 'min_samples_split': 4, 'min_samples_leaf': 1, 'max_features': None, 'bootstrap': True, 'criterion': 'absolute_error'}. Best is trial 1749 with value: 0.502720715661024.
[I 2024-12-04 12:27:37,129] Trial 2240 finished with value: 1.2236150328051776 and parameters: {'n_estimators': 744, 'max_depth': 30, 'min_samples_split': 6, 'min_samples_leaf': 2, 'max_features': 'log2', 'bootstrap': False, 'criterion': 'absolute_error'}. Best is trial 1749 with value: 0.502720715661024.
[I 2024-12-04 12:27:38,745] Trial 2239 finished with value: 0.5169405408550228 and parameters: {'n_estimators': 108, 'max_depth': 20, 'min_samples_split': 3, 'min_samples_leaf': 1, 'max_features': None, 'bootstrap': True, 'criterion': 'absolute_error'}. Best is trial 1749 with value: 0.502720715661024.
[I 2024-12-04 12:27:39,260] Trial 2237 finished with value: 0.613052529053995 and parameters: {'n_estimators': 797, 'max_depth': 40, 'min_samples_split': 42, 'min_samples_leaf': 6, 'max_features': None, 'bootstrap': False, 'criterion': 'squared_error'}. Best is trial 1749 with value: 0.502720715661024.
[I 2024-12-04 12:27:39,945] Trial 2229 finished with value: 0.5173172781150037 and parameters: {'n_estimators': 239, 'max_depth': 21, 'min_samples_split': 5, 'min_samples_leaf': 1, 'max_features': None, 'bootstrap': True, 'criterion': 'absolute_error'}. Best is trial 1749 with value: 0.502720715661024.
[I 2024-12-04 12:27:39,947] Trial 2254 finished with value: 1.114800406754128 and parameters: {'n_estimators': 123, 'max_depth': 14, 'min_samples_split': 2, 'min_samples_leaf': 1, 'max_features': 'log2', 'bootstrap': True, 'criterion': 'absolute_error'}. Best is trial 1749 with value: 0.502720715661024.
[I 2024-12-04 12:27:39,994] Trial 2245 finished with value: 0.5520191697433301 and parameters: {'n_estimators': 110, 'max_depth': 8, 'min_samples_split': 4, 'min_samples_leaf': 2, 'max_features': None, 'bootstrap': True, 'criterion': 'absolute_error'}. Best is trial 1749 with value: 0.502720715661024.
[I 2024-12-04 12:27:40,433] Trial 2241 finished with value: 0.6532524443948657 and parameters: {'n_estimators': 217, 'max_depth': 23, 'min_samples_split': 21, 'min_samples_leaf': 6, 'max_features': None, 'bootstrap': True, 'criterion': 'absolute_error'}. Best is trial 1749 with value: 0.502720715661024.
[I 2024-12-04 12:27:44,356] Trial 2242 finished with value: 0.6147691814663462 and parameters: {'n_estimators': 104, 'max_depth': 9, 'min_samples_split': 4, 'min_samples_leaf': 2, 'max_features': None, 'bootstrap': False, 'criterion': 'absolute_error'}. Best is trial 1749 with value: 0.502720715661024.
[I 2024-12-04 12:27:45,901] Trial 2252 finished with value: 1.2171437979119495 and parameters: {'n_estimators': 256, 'max_depth': 22, 'min_samples_split': 45, 'min_samples_leaf': 7, 'max_features': 'log2', 'bootstrap': False, 'criterion': 'squared_error'}. Best is trial 1749 with value: 0.502720715661024.
[I 2024-12-04 12:27:46,208] Trial 2214 finished with value: 0.7181472502928933 and parameters: {'n_estimators': 814, 'max_depth': 29, 'min_samples_split': 35, 'min_samples_leaf': 3, 'max_features': None, 'bootstrap': False, 'criterion': 'absolute_error'}. Best is trial 1749 with value: 0.502720715661024.
[I 2024-12-04 12:27:46,886] Trial 2246 finished with value: 0.5178610332676103 and parameters: {'n_estimators': 138, 'max_depth': 10, 'min_samples_split': 4, 'min_samples_leaf': 1, 'max_features': None, 'bootstrap': True, 'criterion': 'absolute_error'}. Best is trial 1749 with value: 0.502720715661024.
[I 2024-12-04 12:27:48,539] Trial 2249 finished with value: 0.6054404147139094 and parameters: {'n_estimators': 117, 'max_depth': 27, 'min_samples_split': 7, 'min_samples_leaf': 2, 'max_features': None, 'bootstrap': False, 'criterion': 'absolute_error'}. Best is trial 1749 with value: 0.502720715661024.
[I 2024-12-04 12:27:49,036] Trial 2232 finished with value: 0.5217009254191323 and parameters: {'n_estimators': 264, 'max_depth': 28, 'min_samples_split': 4, 'min_samples_leaf': 1, 'max_features': None, 'bootstrap': True, 'criterion': 'absolute_error'}. Best is trial 1749 with value: 0.502720715661024.
[I 2024-12-04 12:27:49,059] Trial 2209 finished with value: 0.5664962750316251 and parameters: {'n_estimators': 885, 'max_depth': 45, 'min_samples_split': 2, 'min_samples_leaf': 3, 'max_features': None, 'bootstrap': True, 'criterion': 'absolute_error'}. Best is trial 1749 with value: 0.502720715661024.
[I 2024-12-04 12:27:50,066] Trial 2248 finished with value: 1.0397995467379741 and parameters: {'n_estimators': 730, 'max_depth': 19, 'min_samples_split': 2, 'min_samples_leaf': 3, 'max_features': 'sqrt', 'bootstrap': True, 'criterion': 'squared_error'}. Best is trial 1749 with value: 0.502720715661024.
[I 2024-12-04 12:27:50,769] Trial 2243 finished with value: 0.5193435338253197 and parameters: {'n_estimators': 253, 'max_depth': 11, 'min_samples_split': 6, 'min_samples_leaf': 1, 'max_features': None, 'bootstrap': True, 'criterion': 'absolute_error'}. Best is trial 1749 with value: 0.502720715661024.
[I 2024-12-04 12:27:52,485] Trial 2244 finished with value: 0.5222503677696234 and parameters: {'n_estimators': 296, 'max_depth': 9, 'min_samples_split': 3, 'min_samples_leaf': 1, 'max_features': None, 'bootstrap': True, 'criterion': 'absolute_error'}. Best is trial 1749 with value: 0.502720715661024.
[I 2024-12-04 12:27:52,837] Trial 2257 finished with value: 1.0223773491264125 and parameters: {'n_estimators': 203, 'max_depth': 14, 'min_samples_split': 2, 'min_samples_leaf': 2, 'max_features': 'sqrt', 'bootstrap': True, 'criterion': 'absolute_error'}. Best is trial 1749 with value: 0.502720715661024.
[I 2024-12-04 12:27:54,265] Trial 2261 finished with value: 0.5810846762113924 and parameters: {'n_estimators': 102, 'max_depth': 5, 'min_samples_split': 3, 'min_samples_leaf': 2, 'max_features': None, 'bootstrap': True, 'criterion': 'absolute_error'}. Best is trial 1749 with value: 0.502720715661024.
[I 2024-12-04 12:27:55,287] Trial 2253 finished with value: 1.1380256650946665 and parameters: {'n_estimators': 871, 'max_depth': 11, 'min_samples_split': 2, 'min_samples_leaf': 1, 'max_features': 'log2', 'bootstrap': False, 'criterion': 'absolute_error'}. Best is trial 1749 with value: 0.502720715661024.
[I 2024-12-04 12:27:57,688] Trial 2258 finished with value: 0.520059232203566 and parameters: {'n_estimators': 261, 'max_depth': 11, 'min_samples_split': 6, 'min_samples_leaf': 1, 'max_features': None, 'bootstrap': True, 'criterion': 'absolute_error'}. Best is trial 1749 with value: 0.502720715661024.
[I 2024-12-04 12:27:57,717] Trial 2247 finished with value: 0.5390958304408909 and parameters: {'n_estimators': 279, 'max_depth': 6, 'min_samples_split': 3, 'min_samples_leaf': 1, 'max_features': None, 'bootstrap': True, 'criterion': 'absolute_error'}. Best is trial 1749 with value: 0.502720715661024.
[I 2024-12-04 12:27:57,721] Trial 2256 finished with value: 0.5338674695428219 and parameters: {'n_estimators': 128, 'max_depth': 7, 'min_samples_split': 3, 'min_samples_leaf': 1, 'max_features': None, 'bootstrap': True, 'criterion': 'absolute_error'}. Best is trial 1749 with value: 0.502720715661024.
[I 2024-12-04 12:27:57,735] Trial 2263 finished with value: 0.5137127339633514 and parameters: {'n_estimators': 102, 'max_depth': 17, 'min_samples_split': 4, 'min_samples_leaf': 1, 'max_features': None, 'bootstrap': True, 'criterion': 'absolute_error'}. Best is trial 1749 with value: 0.502720715661024.
[I 2024-12-04 12:27:58,164] Trial 2259 finished with value: 0.571132432729496 and parameters: {'n_estimators': 966, 'max_depth': 38, 'min_samples_split': 20, 'min_samples_leaf': 4, 'max_features': None, 'bootstrap': True, 'criterion': 'squared_error'}. Best is trial 1749 with value: 0.502720715661024.
[I 2024-12-04 12:27:58,881] Trial 2271 finished with value: 1.2310670652650146 and parameters: {'n_estimators': 120, 'max_depth': 7, 'min_samples_split': 5, 'min_samples_leaf': 1, 'max_features': 'log2', 'bootstrap': True, 'criterion': 'absolute_error'}. Best is trial 1749 with value: 0.502720715661024.
[I 2024-12-04 12:27:58,887] Trial 2251 finished with value: 0.5229852974130289 and parameters: {'n_estimators': 250, 'max_depth': 9, 'min_samples_split': 4, 'min_samples_leaf': 1, 'max_features': None, 'bootstrap': True, 'criterion': 'absolute_error'}. Best is trial 1749 with value: 0.502720715661024.
[I 2024-12-04 12:27:59,051] Trial 2255 finished with value: 0.520217746405886 and parameters: {'n_estimators': 186, 'max_depth': 12, 'min_samples_split': 3, 'min_samples_leaf': 1, 'max_features': None, 'bootstrap': True, 'criterion': 'absolute_error'}. Best is trial 1749 with value: 0.502720715661024.
[I 2024-12-04 12:27:59,215] Trial 2268 finished with value: 1.1002227885084468 and parameters: {'n_estimators': 453, 'max_depth': 7, 'min_samples_split': 2, 'min_samples_leaf': 1, 'max_features': 'sqrt', 'bootstrap': True, 'criterion': 'absolute_error'}. Best is trial 1749 with value: 0.502720715661024.
[I 2024-12-04 12:27:59,519] Trial 2267 finished with value: 1.261166816800004 and parameters: {'n_estimators': 147, 'max_depth': 50, 'min_samples_split': 4, 'min_samples_leaf': 15, 'max_features': 'log2', 'bootstrap': True, 'criterion': 'squared_error'}. Best is trial 1749 with value: 0.502720715661024.
[I 2024-12-04 12:27:59,729] Trial 2250 finished with value: 1.104663707499198 and parameters: {'n_estimators': 961, 'max_depth': 16, 'min_samples_split': 35, 'min_samples_leaf': 1, 'max_features': 'log2', 'bootstrap': True, 'criterion': 'absolute_error'}. Best is trial 1749 with value: 0.502720715661024.
[I 2024-12-04 12:28:00,735] Trial 2265 finished with value: 0.5560918579349325 and parameters: {'n_estimators': 239, 'max_depth': 15, 'min_samples_split': 3, 'min_samples_leaf': 2, 'max_features': None, 'bootstrap': True, 'criterion': 'absolute_error'}. Best is trial 1749 with value: 0.502720715661024.
[I 2024-12-04 12:28:00,967] Trial 2262 finished with value: 0.5164123644955725 and parameters: {'n_estimators': 114, 'max_depth': 11, 'min_samples_split': 6, 'min_samples_leaf': 1, 'max_features': None, 'bootstrap': True, 'criterion': 'absolute_error'}. Best is trial 1749 with value: 0.502720715661024.
[I 2024-12-04 12:28:00,974] Trial 2269 finished with value: 0.5195816904201984 and parameters: {'n_estimators': 104, 'max_depth': 19, 'min_samples_split': 4, 'min_samples_leaf': 1, 'max_features': None, 'bootstrap': True, 'criterion': 'squared_error'}. Best is trial 1749 with value: 0.502720715661024.
[I 2024-12-04 12:28:01,383] Trial 2260 finished with value: 0.5271753940918718 and parameters: {'n_estimators': 275, 'max_depth': 12, 'min_samples_split': 3, 'min_samples_leaf': 1, 'max_features': None, 'bootstrap': True, 'criterion': 'squared_error'}. Best is trial 1749 with value: 0.502720715661024.
[I 2024-12-04 12:28:01,746] Trial 2274 finished with value: 0.953371091814613 and parameters: {'n_estimators': 109, 'max_depth': 15, 'min_samples_split': 3, 'min_samples_leaf': 2, 'max_features': 'sqrt', 'bootstrap': False, 'criterion': 'absolute_error'}. Best is trial 1749 with value: 0.502720715661024.
[I 2024-12-04 12:28:02,325] Trial 2264 finished with value: 0.5162835468595638 and parameters: {'n_estimators': 210, 'max_depth': 12, 'min_samples_split': 5, 'min_samples_leaf': 1, 'max_features': None, 'bootstrap': True, 'criterion': 'absolute_error'}. Best is trial 1749 with value: 0.502720715661024.
[I 2024-12-04 12:28:03,928] Trial 2276 finished with value: 0.5127463076098161 and parameters: {'n_estimators': 122, 'max_depth': 8, 'min_samples_split': 4, 'min_samples_leaf': 1, 'max_features': None, 'bootstrap': True, 'criterion': 'absolute_error'}. Best is trial 1749 with value: 0.502720715661024.
[I 2024-12-04 12:28:05,873] Trial 2284 finished with value: 0.7235137606142275 and parameters: {'n_estimators': 324, 'max_depth': 6, 'min_samples_split': 22, 'min_samples_leaf': 14, 'max_features': None, 'bootstrap': False, 'criterion': 'squared_error'}. Best is trial 1749 with value: 0.502720715661024.
[I 2024-12-04 12:28:07,692] Trial 2277 finished with value: 0.9137593682165751 and parameters: {'n_estimators': 192, 'max_depth': 14, 'min_samples_split': 7, 'min_samples_leaf': 1, 'max_features': 'sqrt', 'bootstrap': True, 'criterion': 'absolute_error'}. Best is trial 1749 with value: 0.502720715661024.
[I 2024-12-04 12:28:09,701] Trial 2275 finished with value: 0.73913345983214 and parameters: {'n_estimators': 275, 'max_depth': 24, 'min_samples_split': 3, 'min_samples_leaf': 1, 'max_features': 'sqrt', 'bootstrap': True, 'criterion': 'absolute_error'}. Best is trial 1749 with value: 0.502720715661024.
[I 2024-12-04 12:28:11,388] Trial 2272 finished with value: 0.5244789191155548 and parameters: {'n_estimators': 235, 'max_depth': 11, 'min_samples_split': 7, 'min_samples_leaf': 1, 'max_features': None, 'bootstrap': True, 'criterion': 'absolute_error'}. Best is trial 1749 with value: 0.502720715661024.
[I 2024-12-04 12:28:11,946] Trial 2273 finished with value: 0.5132030302932757 and parameters: {'n_estimators': 103, 'max_depth': 21, 'min_samples_split': 6, 'min_samples_leaf': 1, 'max_features': None, 'bootstrap': True, 'criterion': 'absolute_error'}. Best is trial 1749 with value: 0.502720715661024.
[I 2024-12-04 12:28:12,964] Trial 2280 finished with value: 1.226684616589496 and parameters: {'n_estimators': 608, 'max_depth': 35, 'min_samples_split': 14, 'min_samples_leaf': 4, 'max_features': 'sqrt', 'bootstrap': True, 'criterion': 'absolute_error'}. Best is trial 1749 with value: 0.502720715661024.
[I 2024-12-04 12:28:13,317] Trial 2281 finished with value: 0.5299127416207879 and parameters: {'n_estimators': 117, 'max_depth': 8, 'min_samples_split': 7, 'min_samples_leaf': 1, 'max_features': None, 'bootstrap': True, 'criterion': 'absolute_error'}. Best is trial 1749 with value: 0.502720715661024.
[I 2024-12-04 12:28:13,900] Trial 2266 finished with value: 0.514205250400166 and parameters: {'n_estimators': 177, 'max_depth': 50, 'min_samples_split': 16, 'min_samples_leaf': 1, 'max_features': None, 'bootstrap': False, 'criterion': 'absolute_error'}. Best is trial 1749 with value: 0.502720715661024.
[I 2024-12-04 12:28:14,075] Trial 2270 finished with value: 0.516740086852318 and parameters: {'n_estimators': 267, 'max_depth': 12, 'min_samples_split': 6, 'min_samples_leaf': 1, 'max_features': None, 'bootstrap': True, 'criterion': 'absolute_error'}. Best is trial 1749 with value: 0.502720715661024.
[I 2024-12-04 12:28:14,735] Trial 2278 finished with value: 0.5596182753851702 and parameters: {'n_estimators': 251, 'max_depth': 18, 'min_samples_split': 3, 'min_samples_leaf': 2, 'max_features': None, 'bootstrap': True, 'criterion': 'absolute_error'}. Best is trial 1749 with value: 0.502720715661024.
[I 2024-12-04 12:28:15,561] Trial 2291 finished with value: 0.5571386909407426 and parameters: {'n_estimators': 110, 'max_depth': 15, 'min_samples_split': 6, 'min_samples_leaf': 2, 'max_features': None, 'bootstrap': True, 'criterion': 'absolute_error'}. Best is trial 1749 with value: 0.502720715661024.
[I 2024-12-04 12:28:15,921] Trial 2297 finished with value: 0.5832337138516784 and parameters: {'n_estimators': 117, 'max_depth': 5, 'min_samples_split': 7, 'min_samples_leaf': 2, 'max_features': None, 'bootstrap': True, 'criterion': 'absolute_error'}. Best is trial 1749 with value: 0.502720715661024.
[I 2024-12-04 12:28:18,459] Trial 2298 finished with value: 0.9298743354426634 and parameters: {'n_estimators': 119, 'max_depth': 14, 'min_samples_split': 5, 'min_samples_leaf': 1, 'max_features': 'sqrt', 'bootstrap': True, 'criterion': 'absolute_error'}. Best is trial 1749 with value: 0.502720715661024.
[I 2024-12-04 12:28:18,918] Trial 2293 finished with value: 0.5212937764608886 and parameters: {'n_estimators': 114, 'max_depth': 15, 'min_samples_split': 7, 'min_samples_leaf': 1, 'max_features': None, 'bootstrap': True, 'criterion': 'absolute_error'}. Best is trial 1749 with value: 0.502720715661024.
[I 2024-12-04 12:28:19,049] Trial 2282 finished with value: 1.0972762702064212 and parameters: {'n_estimators': 367, 'max_depth': 29, 'min_samples_split': 6, 'min_samples_leaf': 2, 'max_features': 'log2', 'bootstrap': False, 'criterion': 'squared_error'}. Best is trial 1749 with value: 0.502720715661024.
[I 2024-12-04 12:28:19,178] Trial 2285 finished with value: 0.5254661100384975 and parameters: {'n_estimators': 111, 'max_depth': 7, 'min_samples_split': 5, 'min_samples_leaf': 1, 'max_features': None, 'bootstrap': True, 'criterion': 'absolute_error'}. Best is trial 1749 with value: 0.502720715661024.
[I 2024-12-04 12:28:20,273] Trial 2292 finished with value: 0.5240833176181583 and parameters: {'n_estimators': 104, 'max_depth': 7, 'min_samples_split': 5, 'min_samples_leaf': 1, 'max_features': None, 'bootstrap': True, 'criterion': 'absolute_error'}. Best is trial 1749 with value: 0.502720715661024.
[I 2024-12-04 12:28:20,985] Trial 2279 finished with value: 0.5165298552760471 and parameters: {'n_estimators': 254, 'max_depth': 18, 'min_samples_split': 5, 'min_samples_leaf': 1, 'max_features': None, 'bootstrap': True, 'criterion': 'absolute_error'}. Best is trial 1749 with value: 0.502720715661024.
[I 2024-12-04 12:28:21,141] Trial 2294 finished with value: 0.5093816082995811 and parameters: {'n_estimators': 103, 'max_depth': 11, 'min_samples_split': 5, 'min_samples_leaf': 1, 'max_features': None, 'bootstrap': True, 'criterion': 'absolute_error'}. Best is trial 1749 with value: 0.502720715661024.
[I 2024-12-04 12:28:22,028] Trial 2289 finished with value: 0.5128130354827264 and parameters: {'n_estimators': 108, 'max_depth': 17, 'min_samples_split': 6, 'min_samples_leaf': 1, 'max_features': None, 'bootstrap': True, 'criterion': 'absolute_error'}. Best is trial 1749 with value: 0.502720715661024.
[I 2024-12-04 12:28:22,302] Trial 2290 finished with value: 0.5112694792921137 and parameters: {'n_estimators': 109, 'max_depth': 12, 'min_samples_split': 4, 'min_samples_leaf': 1, 'max_features': None, 'bootstrap': True, 'criterion': 'absolute_error'}. Best is trial 1749 with value: 0.502720715661024.
[I 2024-12-04 12:28:22,790] Trial 2286 finished with value: 0.5639495420883148 and parameters: {'n_estimators': 291, 'max_depth': 6, 'min_samples_split': 4, 'min_samples_leaf': 2, 'max_features': None, 'bootstrap': True, 'criterion': 'absolute_error'}. Best is trial 1749 with value: 0.502720715661024.
[I 2024-12-04 12:28:23,591] Trial 2287 finished with value: 0.550680598565085 and parameters: {'n_estimators': 307, 'max_depth': 9, 'min_samples_split': 3, 'min_samples_leaf': 2, 'max_features': None, 'bootstrap': True, 'criterion': 'absolute_error'}. Best is trial 1749 with value: 0.502720715661024.
[I 2024-12-04 12:28:24,048] Trial 2302 finished with value: 0.5548864176089879 and parameters: {'n_estimators': 100, 'max_depth': 24, 'min_samples_split': 2, 'min_samples_leaf': 2, 'max_features': None, 'bootstrap': True, 'criterion': 'absolute_error'}. Best is trial 1749 with value: 0.502720715661024.
[I 2024-12-04 12:28:24,056] Trial 2296 finished with value: 1.1843590886896365 and parameters: {'n_estimators': 883, 'max_depth': 13, 'min_samples_split': 13, 'min_samples_leaf': 2, 'max_features': 'log2', 'bootstrap': True, 'criterion': 'squared_error'}. Best is trial 1749 with value: 0.502720715661024.
[I 2024-12-04 12:28:24,080] Trial 2306 finished with value: 1.1180999433309473 and parameters: {'n_estimators': 101, 'max_depth': 16, 'min_samples_split': 9, 'min_samples_leaf': 1, 'max_features': 'log2', 'bootstrap': True, 'criterion': 'absolute_error'}. Best is trial 1749 with value: 0.502720715661024.
[I 2024-12-04 12:28:24,487] Trial 2300 finished with value: 0.5565467592938533 and parameters: {'n_estimators': 111, 'max_depth': 14, 'min_samples_split': 5, 'min_samples_leaf': 2, 'max_features': None, 'bootstrap': True, 'criterion': 'absolute_error'}. Best is trial 1749 with value: 0.502720715661024.
[I 2024-12-04 12:28:24,756] Trial 2307 finished with value: 0.5388811829442935 and parameters: {'n_estimators': 114, 'max_depth': 8, 'min_samples_split': 3, 'min_samples_leaf': 1, 'max_features': None, 'bootstrap': True, 'criterion': 'squared_error'}. Best is trial 1749 with value: 0.502720715661024.
[I 2024-12-04 12:28:24,756] Trial 2295 finished with value: 1.2142388197029024 and parameters: {'n_estimators': 905, 'max_depth': 45, 'min_samples_split': 46, 'min_samples_leaf': 9, 'max_features': 'sqrt', 'bootstrap': True, 'criterion': 'squared_error'}. Best is trial 1749 with value: 0.502720715661024.
[I 2024-12-04 12:28:25,195] Trial 2301 finished with value: 0.5314863484137543 and parameters: {'n_estimators': 105, 'max_depth': 7, 'min_samples_split': 3, 'min_samples_leaf': 1, 'max_features': None, 'bootstrap': True, 'criterion': 'absolute_error'}. Best is trial 1749 with value: 0.502720715661024.
[I 2024-12-04 12:28:25,921] Trial 2303 finished with value: 0.5302293835318527 and parameters: {'n_estimators': 106, 'max_depth': 20, 'min_samples_split': 9, 'min_samples_leaf': 1, 'max_features': None, 'bootstrap': True, 'criterion': 'absolute_error'}. Best is trial 1749 with value: 0.502720715661024.
[I 2024-12-04 12:28:26,591] Trial 2288 finished with value: 0.5150029966489985 and parameters: {'n_estimators': 211, 'max_depth': 13, 'min_samples_split': 4, 'min_samples_leaf': 1, 'max_features': None, 'bootstrap': True, 'criterion': 'absolute_error'}. Best is trial 1749 with value: 0.502720715661024.
