[I 2024-12-04 12:23:42,460] Trial 2214 finished with value: 0.32282847086819255 and parameters: {'n_estimators': 755, 'max_depth': 43, 'min_samples_split': 7, 'min_samples_leaf': 1, 'max_features': 'sqrt', 'bootstrap': False, 'criterion': 'squared_error'}. Best is trial 341 with value: 0.2909369124469028.
[I 2024-12-04 12:23:44,731] Trial 2206 finished with value: 0.7129103635421107 and parameters: {'n_estimators': 810, 'max_depth': 37, 'min_samples_split': 10, 'min_samples_leaf': 2, 'max_features': 'log2', 'bootstrap': False, 'criterion': 'absolute_error'}. Best is trial 341 with value: 0.2909369124469028.
[I 2024-12-04 12:23:46,285] Trial 2217 finished with value: 0.3000641764665084 and parameters: {'n_estimators': 851, 'max_depth': 44, 'min_samples_split': 3, 'min_samples_leaf': 1, 'max_features': 'sqrt', 'bootstrap': False, 'criterion': 'squared_error'}. Best is trial 341 with value: 0.2909369124469028.
[I 2024-12-04 12:23:46,415] Trial 2230 finished with value: 0.6260268661255076 and parameters: {'n_estimators': 110, 'max_depth': 12, 'min_samples_split': 3, 'min_samples_leaf': 1, 'max_features': 'sqrt', 'bootstrap': True, 'criterion': 'squared_error'}. Best is trial 341 with value: 0.2909369124469028.
[I 2024-12-04 12:23:46,513] Trial 2198 finished with value: 0.7153534815951907 and parameters: {'n_estimators': 987, 'max_depth': 35, 'min_samples_split': 37, 'min_samples_leaf': 2, 'max_features': 'log2', 'bootstrap': False, 'criterion': 'absolute_error'}. Best is trial 341 with value: 0.2909369124469028.
[I 2024-12-04 12:23:46,755] Trial 2220 finished with value: 0.2970394040068874 and parameters: {'n_estimators': 597, 'max_depth': 49, 'min_samples_split': 2, 'min_samples_leaf': 1, 'max_features': 'sqrt', 'bootstrap': False, 'criterion': 'squared_error'}. Best is trial 341 with value: 0.2909369124469028.
[I 2024-12-04 12:23:46,755] Trial 2223 finished with value: 0.3006526449654263 and parameters: {'n_estimators': 266, 'max_depth': 43, 'min_samples_split': 3, 'min_samples_leaf': 1, 'max_features': 'sqrt', 'bootstrap': False, 'criterion': 'squared_error'}. Best is trial 341 with value: 0.2909369124469028.
[I 2024-12-04 12:23:47,400] Trial 2222 finished with value: 0.3011206112252929 and parameters: {'n_estimators': 664, 'max_depth': 50, 'min_samples_split': 4, 'min_samples_leaf': 1, 'max_features': 'sqrt', 'bootstrap': False, 'criterion': 'squared_error'}. Best is trial 341 with value: 0.2909369124469028.
[I 2024-12-04 12:23:49,234] Trial 2227 finished with value: 0.4455574540450146 and parameters: {'n_estimators': 688, 'max_depth': 41, 'min_samples_split': 3, 'min_samples_leaf': 2, 'max_features': 'sqrt', 'bootstrap': False, 'criterion': 'squared_error'}. Best is trial 341 with value: 0.2909369124469028.
[I 2024-12-04 12:23:49,255] Trial 2231 finished with value: 0.2951813348875504 and parameters: {'n_estimators': 356, 'max_depth': 50, 'min_samples_split': 3, 'min_samples_leaf': 1, 'max_features': 'sqrt', 'bootstrap': False, 'criterion': 'squared_error'}. Best is trial 341 with value: 0.2909369124469028.
[I 2024-12-04 12:23:49,261] Trial 2188 finished with value: 0.3108118927667207 and parameters: {'n_estimators': 806, 'max_depth': 44, 'min_samples_split': 2, 'min_samples_leaf': 1, 'max_features': 'sqrt', 'bootstrap': False, 'criterion': 'absolute_error'}. Best is trial 341 with value: 0.2909369124469028.
[I 2024-12-04 12:23:49,435] Trial 2239 finished with value: 0.4549711831469729 and parameters: {'n_estimators': 146, 'max_depth': 38, 'min_samples_split': 3, 'min_samples_leaf': 2, 'max_features': 'sqrt', 'bootstrap': False, 'criterion': 'squared_error'}. Best is trial 341 with value: 0.2909369124469028.
[I 2024-12-04 12:23:49,557] Trial 2224 finished with value: 0.443653229260458 and parameters: {'n_estimators': 961, 'max_depth': 49, 'min_samples_split': 6, 'min_samples_leaf': 2, 'max_features': 'sqrt', 'bootstrap': False, 'criterion': 'squared_error'}. Best is trial 341 with value: 0.2909369124469028.
[I 2024-12-04 12:23:49,688] Trial 2233 finished with value: 0.2949853077357228 and parameters: {'n_estimators': 367, 'max_depth': 50, 'min_samples_split': 3, 'min_samples_leaf': 1, 'max_features': 'sqrt', 'bootstrap': False, 'criterion': 'squared_error'}. Best is trial 341 with value: 0.2909369124469028.
[I 2024-12-04 12:23:51,988] Trial 2234 finished with value: 0.444935999932232 and parameters: {'n_estimators': 328, 'max_depth': 45, 'min_samples_split': 3, 'min_samples_leaf': 2, 'max_features': 'sqrt', 'bootstrap': False, 'criterion': 'squared_error'}. Best is trial 341 with value: 0.2909369124469028.
[I 2024-12-04 12:23:52,091] Trial 2237 finished with value: 0.44473893403442166 and parameters: {'n_estimators': 289, 'max_depth': 46, 'min_samples_split': 2, 'min_samples_leaf': 2, 'max_features': 'sqrt', 'bootstrap': False, 'criterion': 'squared_error'}. Best is trial 341 with value: 0.2909369124469028.
[I 2024-12-04 12:23:52,108] Trial 2232 finished with value: 0.30784697089855156 and parameters: {'n_estimators': 264, 'max_depth': 42, 'min_samples_split': 2, 'min_samples_leaf': 1, 'max_features': 'sqrt', 'bootstrap': False, 'criterion': 'squared_error'}. Best is trial 341 with value: 0.2909369124469028.
[I 2024-12-04 12:23:54,797] Trial 2226 finished with value: 0.30161381642887647 and parameters: {'n_estimators': 586, 'max_depth': 43, 'min_samples_split': 3, 'min_samples_leaf': 1, 'max_features': 'sqrt', 'bootstrap': False, 'criterion': 'squared_error'}. Best is trial 341 with value: 0.2909369124469028.
[I 2024-12-04 12:23:59,752] Trial 2196 finished with value: 0.3491579391826159 and parameters: {'n_estimators': 267, 'max_depth': 32, 'min_samples_split': 12, 'min_samples_leaf': 1, 'max_features': None, 'bootstrap': True, 'criterion': 'absolute_error'}. Best is trial 341 with value: 0.2909369124469028.
[I 2024-12-04 12:24:01,026] Trial 2229 finished with value: 0.4445700680207301 and parameters: {'n_estimators': 283, 'max_depth': 43, 'min_samples_split': 2, 'min_samples_leaf': 2, 'max_features': 'sqrt', 'bootstrap': False, 'criterion': 'squared_error'}. Best is trial 341 with value: 0.2909369124469028.
[I 2024-12-04 12:24:02,820] Trial 2228 finished with value: 0.46936986007714315 and parameters: {'n_estimators': 276, 'max_depth': 50, 'min_samples_split': 42, 'min_samples_leaf': 7, 'max_features': None, 'bootstrap': True, 'criterion': 'absolute_error'}. Best is trial 341 with value: 0.2909369124469028.
[I 2024-12-04 12:24:03,019] Trial 2244 finished with value: 0.41629132185388606 and parameters: {'n_estimators': 409, 'max_depth': 50, 'min_samples_split': 2, 'min_samples_leaf': 2, 'max_features': None, 'bootstrap': False, 'criterion': 'squared_error'}. Best is trial 341 with value: 0.2909369124469028.
[I 2024-12-04 12:24:05,677] Trial 2242 finished with value: 0.3116024975522305 and parameters: {'n_estimators': 235, 'max_depth': 48, 'min_samples_split': 3, 'min_samples_leaf': 1, 'max_features': 'sqrt', 'bootstrap': False, 'criterion': 'absolute_error'}. Best is trial 341 with value: 0.2909369124469028.
[I 2024-12-04 12:24:05,678] Trial 2238 finished with value: 0.29398154445365043 and parameters: {'n_estimators': 666, 'max_depth': 50, 'min_samples_split': 3, 'min_samples_leaf': 1, 'max_features': 'sqrt', 'bootstrap': False, 'criterion': 'squared_error'}. Best is trial 341 with value: 0.2909369124469028.
[I 2024-12-04 12:24:05,868] Trial 2251 finished with value: 0.29426760806916946 and parameters: {'n_estimators': 385, 'max_depth': 50, 'min_samples_split': 3, 'min_samples_leaf': 1, 'max_features': 'sqrt', 'bootstrap': False, 'criterion': 'squared_error'}. Best is trial 341 with value: 0.2909369124469028.
[I 2024-12-04 12:24:05,881] Trial 2253 finished with value: 0.32465093551209495 and parameters: {'n_estimators': 216, 'max_depth': 40, 'min_samples_split': 6, 'min_samples_leaf': 1, 'max_features': 'sqrt', 'bootstrap': False, 'criterion': 'squared_error'}. Best is trial 341 with value: 0.2909369124469028.
[I 2024-12-04 12:24:05,938] Trial 2240 finished with value: 0.2992815420628435 and parameters: {'n_estimators': 708, 'max_depth': 50, 'min_samples_split': 2, 'min_samples_leaf': 1, 'max_features': 'sqrt', 'bootstrap': False, 'criterion': 'squared_error'}. Best is trial 341 with value: 0.2909369124469028.
[I 2024-12-04 12:24:05,986] Trial 2243 finished with value: 0.3281354914173265 and parameters: {'n_estimators': 339, 'max_depth': 36, 'min_samples_split': 2, 'min_samples_leaf': 1, 'max_features': 'sqrt', 'bootstrap': False, 'criterion': 'squared_error'}. Best is trial 341 with value: 0.2909369124469028.
[I 2024-12-04 12:24:06,399] Trial 2212 finished with value: 0.5149076640587242 and parameters: {'n_estimators': 721, 'max_depth': 29, 'min_samples_split': 12, 'min_samples_leaf': 14, 'max_features': None, 'bootstrap': False, 'criterion': 'absolute_error'}. Best is trial 341 with value: 0.2909369124469028.
[I 2024-12-04 12:24:08,021] Trial 2250 finished with value: 0.2979810387607541 and parameters: {'n_estimators': 500, 'max_depth': 50, 'min_samples_split': 2, 'min_samples_leaf': 1, 'max_features': 'sqrt', 'bootstrap': False, 'criterion': 'squared_error'}. Best is trial 341 with value: 0.2909369124469028.
[I 2024-12-04 12:24:08,289] Trial 2241 finished with value: 0.39174683307545005 and parameters: {'n_estimators': 949, 'max_depth': 48, 'min_samples_split': 2, 'min_samples_leaf': 1, 'max_features': 'log2', 'bootstrap': False, 'criterion': 'squared_error'}. Best is trial 341 with value: 0.2909369124469028.
[I 2024-12-04 12:24:08,809] Trial 2235 finished with value: 0.32193016382857376 and parameters: {'n_estimators': 600, 'max_depth': 50, 'min_samples_split': 4, 'min_samples_leaf': 1, 'max_features': 'sqrt', 'bootstrap': True, 'criterion': 'squared_error'}. Best is trial 341 with value: 0.2909369124469028.
[I 2024-12-04 12:24:08,816] Trial 2248 finished with value: 0.299386006934066 and parameters: {'n_estimators': 203, 'max_depth': 43, 'min_samples_split': 3, 'min_samples_leaf': 1, 'max_features': 'sqrt', 'bootstrap': False, 'criterion': 'squared_error'}. Best is trial 341 with value: 0.2909369124469028.
[I 2024-12-04 12:24:08,843] Trial 2236 finished with value: 0.383744291944279 and parameters: {'n_estimators': 679, 'max_depth': 45, 'min_samples_split': 4, 'min_samples_leaf': 1, 'max_features': None, 'bootstrap': False, 'criterion': 'squared_error'}. Best is trial 341 with value: 0.2909369124469028.
[I 2024-12-04 12:24:08,868] Trial 2249 finished with value: 0.3222646310868636 and parameters: {'n_estimators': 604, 'max_depth': 43, 'min_samples_split': 7, 'min_samples_leaf': 1, 'max_features': 'sqrt', 'bootstrap': False, 'criterion': 'squared_error'}. Best is trial 341 with value: 0.2909369124469028.
[I 2024-12-04 12:24:09,570] Trial 2247 finished with value: 0.44179543351873624 and parameters: {'n_estimators': 515, 'max_depth': 46, 'min_samples_split': 4, 'min_samples_leaf': 2, 'max_features': 'sqrt', 'bootstrap': False, 'criterion': 'squared_error'}. Best is trial 341 with value: 0.2909369124469028.
[I 2024-12-04 12:24:10,623] Trial 2255 finished with value: 0.9576963004264707 and parameters: {'n_estimators': 227, 'max_depth': 19, 'min_samples_split': 49, 'min_samples_leaf': 15, 'max_features': 'log2', 'bootstrap': False, 'criterion': 'squared_error'}. Best is trial 341 with value: 0.2909369124469028.
[I 2024-12-04 12:24:10,813] Trial 2257 finished with value: 0.2996899773413278 and parameters: {'n_estimators': 218, 'max_depth': 50, 'min_samples_split': 4, 'min_samples_leaf': 1, 'max_features': 'sqrt', 'bootstrap': False, 'criterion': 'squared_error'}. Best is trial 341 with value: 0.2909369124469028.
[I 2024-12-04 12:24:11,422] Trial 2252 finished with value: 0.2995081957481541 and parameters: {'n_estimators': 233, 'max_depth': 50, 'min_samples_split': 2, 'min_samples_leaf': 1, 'max_features': 'sqrt', 'bootstrap': False, 'criterion': 'squared_error'}. Best is trial 341 with value: 0.2909369124469028.
[I 2024-12-04 12:24:11,655] Trial 2259 finished with value: 0.30415531769706344 and parameters: {'n_estimators': 439, 'max_depth': 50, 'min_samples_split': 5, 'min_samples_leaf': 1, 'max_features': 'sqrt', 'bootstrap': False, 'criterion': 'squared_error'}. Best is trial 341 with value: 0.2909369124469028.
[I 2024-12-04 12:24:11,797] Trial 2256 finished with value: 0.4635193203488483 and parameters: {'n_estimators': 607, 'max_depth': 41, 'min_samples_split': 7, 'min_samples_leaf': 1, 'max_features': 'log2', 'bootstrap': True, 'criterion': 'squared_error'}. Best is trial 341 with value: 0.2909369124469028.
[I 2024-12-04 12:24:12,324] Trial 2254 finished with value: 0.32908728664566467 and parameters: {'n_estimators': 407, 'max_depth': 39, 'min_samples_split': 6, 'min_samples_leaf': 1, 'max_features': 'sqrt', 'bootstrap': False, 'criterion': 'squared_error'}. Best is trial 341 with value: 0.2909369124469028.
[I 2024-12-04 12:24:12,731] Trial 2263 finished with value: 0.3006847825243702 and parameters: {'n_estimators': 275, 'max_depth': 44, 'min_samples_split': 3, 'min_samples_leaf': 1, 'max_features': 'sqrt', 'bootstrap': False, 'criterion': 'squared_error'}. Best is trial 341 with value: 0.2909369124469028.
[I 2024-12-04 12:24:14,729] Trial 2246 finished with value: 0.3300278227570568 and parameters: {'n_estimators': 896, 'max_depth': 40, 'min_samples_split': 2, 'min_samples_leaf': 1, 'max_features': 'sqrt', 'bootstrap': True, 'criterion': 'squared_error'}. Best is trial 341 with value: 0.2909369124469028.
[I 2024-12-04 12:24:14,986] Trial 2262 finished with value: 0.937287346891394 and parameters: {'n_estimators': 336, 'max_depth': 42, 'min_samples_split': 6, 'min_samples_leaf': 5, 'max_features': 'log2', 'bootstrap': True, 'criterion': 'absolute_error'}. Best is trial 341 with value: 0.2909369124469028.
[I 2024-12-04 12:24:15,051] Trial 2261 finished with value: 0.3053848267598914 and parameters: {'n_estimators': 593, 'max_depth': 41, 'min_samples_split': 3, 'min_samples_leaf': 1, 'max_features': 'sqrt', 'bootstrap': False, 'criterion': 'squared_error'}. Best is trial 341 with value: 0.2909369124469028.
[I 2024-12-04 12:24:18,404] Trial 2264 finished with value: 0.29968841148061404 and parameters: {'n_estimators': 280, 'max_depth': 50, 'min_samples_split': 4, 'min_samples_leaf': 1, 'max_features': 'sqrt', 'bootstrap': False, 'criterion': 'squared_error'}. Best is trial 341 with value: 0.2909369124469028.
[I 2024-12-04 12:24:19,576] Trial 2266 finished with value: 0.30183685399750176 and parameters: {'n_estimators': 589, 'max_depth': 43, 'min_samples_split': 3, 'min_samples_leaf': 1, 'max_features': 'sqrt', 'bootstrap': False, 'criterion': 'squared_error'}. Best is trial 341 with value: 0.2909369124469028.
[I 2024-12-04 12:24:22,028] Trial 2272 finished with value: 0.4442997775787461 and parameters: {'n_estimators': 524, 'max_depth': 41, 'min_samples_split': 3, 'min_samples_leaf': 2, 'max_features': 'sqrt', 'bootstrap': False, 'criterion': 'squared_error'}. Best is trial 341 with value: 0.2909369124469028.
[I 2024-12-04 12:24:25,344] Trial 2260 finished with value: 0.3404648596957255 and parameters: {'n_estimators': 226, 'max_depth': 41, 'min_samples_split': 7, 'min_samples_leaf': 1, 'max_features': 'sqrt', 'bootstrap': False, 'criterion': 'absolute_error'}. Best is trial 341 with value: 0.2909369124469028.
[I 2024-12-04 12:24:25,589] Trial 2265 finished with value: 0.4429281874963885 and parameters: {'n_estimators': 604, 'max_depth': 42, 'min_samples_split': 4, 'min_samples_leaf': 2, 'max_features': 'sqrt', 'bootstrap': False, 'criterion': 'squared_error'}. Best is trial 341 with value: 0.2909369124469028.
[I 2024-12-04 12:24:25,919] Trial 2271 finished with value: 0.29951162958605476 and parameters: {'n_estimators': 469, 'max_depth': 44, 'min_samples_split': 3, 'min_samples_leaf': 1, 'max_features': 'sqrt', 'bootstrap': False, 'criterion': 'squared_error'}. Best is trial 341 with value: 0.2909369124469028.
[I 2024-12-04 12:24:27,291] Trial 2278 finished with value: 0.29440665854901127 and parameters: {'n_estimators': 396, 'max_depth': 50, 'min_samples_split': 3, 'min_samples_leaf': 1, 'max_features': 'sqrt', 'bootstrap': False, 'criterion': 'squared_error'}. Best is trial 341 with value: 0.2909369124469028.
[I 2024-12-04 12:24:27,292] Trial 2269 finished with value: 0.30668884916092803 and parameters: {'n_estimators': 455, 'max_depth': 43, 'min_samples_split': 2, 'min_samples_leaf': 1, 'max_features': 'sqrt', 'bootstrap': False, 'criterion': 'squared_error'}. Best is trial 341 with value: 0.2909369124469028.
[I 2024-12-04 12:24:28,820] Trial 2268 finished with value: 0.30101587409228986 and parameters: {'n_estimators': 266, 'max_depth': 44, 'min_samples_split': 3, 'min_samples_leaf': 1, 'max_features': 'sqrt', 'bootstrap': False, 'criterion': 'squared_error'}. Best is trial 341 with value: 0.2909369124469028.
[I 2024-12-04 12:24:29,260] Trial 2277 finished with value: 0.4449186985731519 and parameters: {'n_estimators': 229, 'max_depth': 43, 'min_samples_split': 4, 'min_samples_leaf': 2, 'max_features': 'sqrt', 'bootstrap': False, 'criterion': 'squared_error'}. Best is trial 341 with value: 0.2909369124469028.
[I 2024-12-04 12:24:29,345] Trial 2281 finished with value: 0.314563933325448 and parameters: {'n_estimators': 269, 'max_depth': 50, 'min_samples_split': 2, 'min_samples_leaf': 1, 'max_features': 'sqrt', 'bootstrap': True, 'criterion': 'squared_error'}. Best is trial 341 with value: 0.2909369124469028.
[I 2024-12-04 12:24:30,974] Trial 2270 finished with value: 0.4451158934299576 and parameters: {'n_estimators': 263, 'max_depth': 44, 'min_samples_split': 4, 'min_samples_leaf': 2, 'max_features': 'sqrt', 'bootstrap': False, 'criterion': 'squared_error'}. Best is trial 341 with value: 0.2909369124469028.
[I 2024-12-04 12:24:33,736] Trial 2279 finished with value: 0.971177009375207 and parameters: {'n_estimators': 908, 'max_depth': 17, 'min_samples_split': 5, 'min_samples_leaf': 15, 'max_features': 'log2', 'bootstrap': True, 'criterion': 'squared_error'}. Best is trial 341 with value: 0.2909369124469028.
[I 2024-12-04 12:24:34,466] Trial 2275 finished with value: 0.2985022387724662 and parameters: {'n_estimators': 643, 'max_depth': 50, 'min_samples_split': 2, 'min_samples_leaf': 1, 'max_features': 'sqrt', 'bootstrap': False, 'criterion': 'squared_error'}. Best is trial 341 with value: 0.2909369124469028.
[I 2024-12-04 12:24:38,416] Trial 2284 finished with value: 0.4431722785805405 and parameters: {'n_estimators': 317, 'max_depth': 50, 'min_samples_split': 3, 'min_samples_leaf': 2, 'max_features': 'sqrt', 'bootstrap': False, 'criterion': 'squared_error'}. Best is trial 341 with value: 0.2909369124469028.
[I 2024-12-04 12:24:40,619] Trial 2289 finished with value: 0.3051387892721305 and parameters: {'n_estimators': 249, 'max_depth': 44, 'min_samples_split': 2, 'min_samples_leaf': 1, 'max_features': 'sqrt', 'bootstrap': False, 'criterion': 'squared_error'}. Best is trial 341 with value: 0.2909369124469028.
[I 2024-12-04 12:24:42,446] Trial 2280 finished with value: 0.7446707633192192 and parameters: {'n_estimators': 661, 'max_depth': 17, 'min_samples_split': 7, 'min_samples_leaf': 5, 'max_features': 'sqrt', 'bootstrap': True, 'criterion': 'absolute_error'}. Best is trial 341 with value: 0.2909369124469028.
[I 2024-12-04 12:24:43,155] Trial 2273 finished with value: 0.4162829205199525 and parameters: {'n_estimators': 813, 'max_depth': 43, 'min_samples_split': 2, 'min_samples_leaf': 2, 'max_features': None, 'bootstrap': False, 'criterion': 'squared_error'}. Best is trial 341 with value: 0.2909369124469028.
[I 2024-12-04 12:24:43,757] Trial 2285 finished with value: 0.4714939504120448 and parameters: {'n_estimators': 690, 'max_depth': 5, 'min_samples_split': 3, 'min_samples_leaf': 3, 'max_features': None, 'bootstrap': True, 'criterion': 'squared_error'}. Best is trial 341 with value: 0.2909369124469028.
[I 2024-12-04 12:24:46,851] Trial 2276 finished with value: 0.4211519706157295 and parameters: {'n_estimators': 492, 'max_depth': 42, 'min_samples_split': 2, 'min_samples_leaf': 1, 'max_features': 'log2', 'bootstrap': False, 'criterion': 'squared_error'}. Best is trial 341 with value: 0.2909369124469028.
[I 2024-12-04 12:24:46,991] Trial 2293 finished with value: 0.3046999020797068 and parameters: {'n_estimators': 159, 'max_depth': 44, 'min_samples_split': 4, 'min_samples_leaf': 1, 'max_features': 'sqrt', 'bootstrap': False, 'criterion': 'squared_error'}. Best is trial 341 with value: 0.2909369124469028.
[I 2024-12-04 12:24:46,996] Trial 2290 finished with value: 0.9554933160511914 and parameters: {'n_estimators': 983, 'max_depth': 10, 'min_samples_split': 41, 'min_samples_leaf': 12, 'max_features': 'log2', 'bootstrap': False, 'criterion': 'absolute_error'}. Best is trial 341 with value: 0.2909369124469028.
[I 2024-12-04 12:24:47,864] Trial 2283 finished with value: 0.29851449420436144 and parameters: {'n_estimators': 289, 'max_depth': 50, 'min_samples_split': 2, 'min_samples_leaf': 1, 'max_features': 'sqrt', 'bootstrap': False, 'criterion': 'squared_error'}. Best is trial 341 with value: 0.2909369124469028.
[I 2024-12-04 12:24:50,155] Trial 2301 finished with value: 0.4466509987078517 and parameters: {'n_estimators': 102, 'max_depth': 45, 'min_samples_split': 2, 'min_samples_leaf': 2, 'max_features': 'sqrt', 'bootstrap': False, 'criterion': 'squared_error'}. Best is trial 341 with value: 0.2909369124469028.
[I 2024-12-04 12:24:51,394] Trial 2297 finished with value: 0.3004931646250534 and parameters: {'n_estimators': 239, 'max_depth': 50, 'min_samples_split': 4, 'min_samples_leaf': 1, 'max_features': 'sqrt', 'bootstrap': False, 'criterion': 'squared_error'}. Best is trial 341 with value: 0.2909369124469028.
