[I 2024-12-03 19:15:37,997] Trial 2046 finished with value: 0.39714196667776797 and parameters: {'kernel': 'linear', 'C': 0.0028925950201328073, 'gamma': 0.005685220207154083, 'epsilon': 0.11596772232032858}. Best is trial 345 with value: 0.13438257115663557.
[I 2024-12-03 19:15:38,511] Trial 2006 finished with value: 0.13834786461809423 and parameters: {'kernel': 'linear', 'C': 27.60959492989783, 'gamma': 0.0007808088440665791, 'epsilon': 0.009596940318228945}. Best is trial 345 with value: 0.13438257115663557.
[I 2024-12-03 19:15:38,512] Trial 1893 finished with value: 0.13821923553244084 and parameters: {'kernel': 'linear', 'C': 87.81436245093917, 'gamma': 0.00043444268062898926, 'epsilon': 0.011905417827132987}. Best is trial 345 with value: 0.13438257115663557.
[I 2024-12-03 19:15:38,658] Trial 2021 finished with value: 0.1389931287800064 and parameters: {'kernel': 'linear', 'C': 78.12539315328678, 'gamma': 0.05478775220239736, 'epsilon': 0.08442748222020088}. Best is trial 345 with value: 0.13438257115663557.
[I 2024-12-03 19:15:40,534] Trial 2044 finished with value: 0.14153409401253092 and parameters: {'kernel': 'linear', 'C': 15.169065352712328, 'gamma': 0.09543380631087235, 'epsilon': 0.09604191264379965}. Best is trial 345 with value: 0.13438257115663557.
[I 2024-12-03 19:15:40,535] Trial 2048 finished with value: 0.40251716435814755 and parameters: {'kernel': 'poly', 'C': 0.0012595530900032259, 'gamma': 0.3106546026430446, 'epsilon': 0.2176886863804668}. Best is trial 345 with value: 0.13438257115663557.
[I 2024-12-03 19:15:40,702] Trial 2043 finished with value: 0.4405881524043723 and parameters: {'kernel': 'poly', 'C': 7.0815130222863125, 'gamma': 0.090106542797241, 'epsilon': 0.23819680716167418}. Best is trial 345 with value: 0.13438257115663557.
[I 2024-12-03 19:15:41,703] Trial 2030 finished with value: 0.13551481799383341 and parameters: {'kernel': 'linear', 'C': 12.855215090138875, 'gamma': 0.0628121854057894, 'epsilon': 0.03121888106579789}. Best is trial 345 with value: 0.13438257115663557.
[I 2024-12-03 19:15:42,101] Trial 2050 finished with value: 0.15459778225490056 and parameters: {'kernel': 'linear', 'C': 2.993816517543465, 'gamma': 0.16273516794149917, 'epsilon': 0.11399150613320518}. Best is trial 345 with value: 0.13438257115663557.
[I 2024-12-03 19:15:44,079] Trial 2052 finished with value: 0.141313162236187 and parameters: {'kernel': 'linear', 'C': 11.216675185463385, 'gamma': 0.05784731749870276, 'epsilon': 0.09363605695055921}. Best is trial 345 with value: 0.13438257115663557.
[I 2024-12-03 19:15:45,407] Trial 2054 finished with value: 0.136847229686814 and parameters: {'kernel': 'linear', 'C': 2.262507490174596, 'gamma': 0.020800191667043243, 'epsilon': 0.04634675447919793}. Best is trial 345 with value: 0.13438257115663557.
[I 2024-12-03 19:15:45,407] Trial 2032 finished with value: 0.13598887972641696 and parameters: {'kernel': 'linear', 'C': 11.619475578272638, 'gamma': 0.1119731736512447, 'epsilon': 0.03133881628160217}. Best is trial 345 with value: 0.13438257115663557.
[I 2024-12-03 19:15:46,352] Trial 2040 finished with value: 0.13650553656779127 and parameters: {'kernel': 'linear', 'C': 23.28181204500938, 'gamma': 0.02607964698642532, 'epsilon': 0.05095070387155555}. Best is trial 345 with value: 0.13438257115663557.
[I 2024-12-03 19:15:46,670] Trial 2056 finished with value: 0.1577540677243848 and parameters: {'kernel': 'linear', 'C': 15.680027717551141, 'gamma': 0.01641866324626493, 'epsilon': 0.16538270766967825}. Best is trial 345 with value: 0.13438257115663557.
[I 2024-12-03 19:15:48,128] Trial 2058 finished with value: 0.13695100284837652 and parameters: {'kernel': 'linear', 'C': 8.622731121742115, 'gamma': 0.03650296002446709, 'epsilon': 0.07426510251385107}. Best is trial 345 with value: 0.13438257115663557.
[I 2024-12-03 19:15:50,463] Trial 2047 finished with value: 0.13966829673688363 and parameters: {'kernel': 'linear', 'C': 92.06289658028564, 'gamma': 0.00020368163567937344, 'epsilon': 0.08713390361778192}. Best is trial 345 with value: 0.13438257115663557.
[I 2024-12-03 19:15:51,203] Trial 2060 finished with value: 0.13993291797582783 and parameters: {'kernel': 'linear', 'C': 14.515346958935062, 'gamma': 0.015764511872091484, 'epsilon': 0.08966338277208653}. Best is trial 345 with value: 0.13438257115663557.
[I 2024-12-03 19:15:52,045] Trial 2064 finished with value: 0.38422963728782955 and parameters: {'kernel': 'poly', 'C': 87.73206332094333, 'gamma': 0.008078479551685388, 'epsilon': 0.12328263696741494}. Best is trial 345 with value: 0.13438257115663557.
[I 2024-12-03 19:15:52,145] Trial 2045 finished with value: 0.13690234439072557 and parameters: {'kernel': 'linear', 'C': 18.732386392000315, 'gamma': 0.08238421428663296, 'epsilon': 0.04937418824568885}. Best is trial 345 with value: 0.13438257115663557.
[I 2024-12-03 19:15:52,614] Trial 2057 finished with value: 0.13591999700934929 and parameters: {'kernel': 'linear', 'C': 12.468050680471906, 'gamma': 0.13339377330300528, 'epsilon': 0.05661497321733457}. Best is trial 345 with value: 0.13438257115663557.
[I 2024-12-03 19:15:52,769] Trial 2053 finished with value: 0.1384336838204101 and parameters: {'kernel': 'linear', 'C': 7.954784881458542, 'gamma': 0.09509692904610222, 'epsilon': 0.011777091683266652}. Best is trial 345 with value: 0.13438257115663557.
[I 2024-12-03 19:15:54,608] Trial 2066 finished with value: 0.15645542756236175 and parameters: {'kernel': 'linear', 'C': 1.8933384179601311, 'gamma': 0.017058827604187463, 'epsilon': 0.11544486716905442}. Best is trial 345 with value: 0.13438257115663557.
[I 2024-12-03 19:15:54,872] Trial 2067 finished with value: 0.14090481788990983 and parameters: {'kernel': 'rbf', 'C': 88.80477340310928, 'gamma': 0.002524458379302154, 'epsilon': 0.03741328530597836}. Best is trial 345 with value: 0.13438257115663557.
[I 2024-12-03 19:15:55,294] Trial 2068 finished with value: 0.22777813747382405 and parameters: {'kernel': 'linear', 'C': 2.6548091060412626, 'gamma': 0.003848827725527515, 'epsilon': 0.2842445332153603}. Best is trial 345 with value: 0.13438257115663557.
[I 2024-12-03 19:15:55,451] Trial 2069 finished with value: 0.544583856198075 and parameters: {'kernel': 'sigmoid', 'C': 19.447551874113067, 'gamma': 0.00102296430333427, 'epsilon': 0.014681386952572914}. Best is trial 345 with value: 0.13438257115663557.
[I 2024-12-03 19:15:57,167] Trial 2071 finished with value: 1.0218202627251924 and parameters: {'kernel': 'rbf', 'C': 0.025216705079667476, 'gamma': 0.006257466520640819, 'epsilon': 0.1977202513977086}. Best is trial 345 with value: 0.13438257115663557.
[I 2024-12-03 19:15:58,185] Trial 2065 finished with value: 0.14948318906898464 and parameters: {'kernel': 'linear', 'C': 98.48128666968285, 'gamma': 0.02341658154692134, 'epsilon': 0.14216817004259846}. Best is trial 345 with value: 0.13438257115663557.
[I 2024-12-03 19:15:59,143] Trial 2034 finished with value: 0.13711072266751537 and parameters: {'kernel': 'linear', 'C': 49.579309584920004, 'gamma': 0.00016057753231263493, 'epsilon': 0.047126907462599385}. Best is trial 345 with value: 0.13438257115663557.
[I 2024-12-03 19:15:59,724] Trial 2059 finished with value: 0.13579089958105955 and parameters: {'kernel': 'linear', 'C': 9.613889378375525, 'gamma': 0.04108908408452475, 'epsilon': 0.058075543361083094}. Best is trial 345 with value: 0.13438257115663557.
[I 2024-12-03 19:16:00,024] Trial 2074 finished with value: 0.14312527266810146 and parameters: {'kernel': 'linear', 'C': 5.960521492645467, 'gamma': 0.0068760780765442595, 'epsilon': 0.08776327512545082}. Best is trial 345 with value: 0.13438257115663557.
[I 2024-12-03 19:16:00,354] Trial 2051 finished with value: 0.1362720459372863 and parameters: {'kernel': 'linear', 'C': 26.977320335413825, 'gamma': 0.04803115670130702, 'epsilon': 0.04304855060189937}. Best is trial 345 with value: 0.13438257115663557.
[I 2024-12-03 19:16:04,654] Trial 2073 finished with value: 0.13571520946380203 and parameters: {'kernel': 'linear', 'C': 7.233753133631767, 'gamma': 0.023162654428995694, 'epsilon': 0.037001432614747254}. Best is trial 345 with value: 0.13438257115663557.
[I 2024-12-03 19:16:04,970] Trial 1980 finished with value: 0.13484658404039482 and parameters: {'kernel': 'linear', 'C': 85.34715760901567, 'gamma': 0.09958784859716006, 'epsilon': 0.039620375870285295}. Best is trial 345 with value: 0.13438257115663557.
[I 2024-12-03 19:16:05,982] Trial 1969 finished with value: 0.13574999121294024 and parameters: {'kernel': 'linear', 'C': 97.98014158916973, 'gamma': 0.0064305517781324435, 'epsilon': 0.02609921952820477}. Best is trial 345 with value: 0.13438257115663557.
[I 2024-12-03 19:16:05,992] Trial 2075 finished with value: 0.15994486596646243 and parameters: {'kernel': 'linear', 'C': 25.29479391330897, 'gamma': 0.005798306275479471, 'epsilon': 0.16719502790790017}. Best is trial 345 with value: 0.13438257115663557.
[I 2024-12-03 19:16:06,206] Trial 2080 finished with value: 0.23549731517641245 and parameters: {'kernel': 'rbf', 'C': 65.38917065175369, 'gamma': 0.0002820188645603355, 'epsilon': 0.033834412595646436}. Best is trial 345 with value: 0.13438257115663557.
[I 2024-12-03 19:16:07,583] Trial 2003 finished with value: 0.13490482174620158 and parameters: {'kernel': 'linear', 'C': 93.39596391005927, 'gamma': 0.011525510596323939, 'epsilon': 0.06204112273701895}. Best is trial 345 with value: 0.13438257115663557.
[I 2024-12-03 19:16:07,819] Trial 2082 finished with value: 0.3832825531596643 and parameters: {'kernel': 'sigmoid', 'C': 36.786297209756526, 'gamma': 0.00010392901486784778, 'epsilon': 0.029497475587876517}. Best is trial 345 with value: 0.13438257115663557.
[I 2024-12-03 19:16:08,138] Trial 1995 finished with value: 0.13558805727780174 and parameters: {'kernel': 'linear', 'C': 93.2779926126784, 'gamma': 0.002959174705226545, 'epsilon': 0.03400316796728895}. Best is trial 345 with value: 0.13438257115663557.
[I 2024-12-03 19:16:10,897] Trial 2084 finished with value: 0.13998924827630774 and parameters: {'kernel': 'linear', 'C': 17.11171715092094, 'gamma': 0.049913497637893184, 'epsilon': 0.09074832010450429}. Best is trial 345 with value: 0.13438257115663557.
[I 2024-12-03 19:16:11,669] Trial 2086 finished with value: 0.13637759997553411 and parameters: {'kernel': 'linear', 'C': 3.4696399926969907, 'gamma': 0.007708184657318464, 'epsilon': 0.04637738397905631}. Best is trial 345 with value: 0.13438257115663557.
[I 2024-12-03 19:16:12,273] Trial 2062 finished with value: 0.13790264196870852 and parameters: {'kernel': 'linear', 'C': 16.615450331619222, 'gamma': 0.6065141321544103, 'epsilon': 0.0132424288124429}. Best is trial 345 with value: 0.13438257115663557.
[I 2024-12-03 19:16:12,664] Trial 2085 finished with value: 0.13676719893230754 and parameters: {'kernel': 'linear', 'C': 3.55196069086237, 'gamma': 0.008050418927178277, 'epsilon': 0.022912104536100812}. Best is trial 345 with value: 0.13438257115663557.
[I 2024-12-03 19:16:13,087] Trial 2089 finished with value: 0.22592066776498967 and parameters: {'kernel': 'rbf', 'C': 17.914694197155974, 'gamma': 0.01083805074519932, 'epsilon': 0.17253717220785506}. Best is trial 345 with value: 0.13438257115663557.
[I 2024-12-03 19:16:14,202] Trial 1968 finished with value: 0.13771798134624752 and parameters: {'kernel': 'linear', 'C': 84.82767382114197, 'gamma': 0.0020480306023077837, 'epsilon': 0.014050302574883022}. Best is trial 345 with value: 0.13438257115663557.
[I 2024-12-03 19:16:14,572] Trial 1974 finished with value: 0.13464988725312027 and parameters: {'kernel': 'linear', 'C': 94.87069842227083, 'gamma': 0.0012217172394389374, 'epsilon': 0.03151116685628864}. Best is trial 345 with value: 0.13438257115663557.
[I 2024-12-03 19:16:18,053] Trial 2019 finished with value: 0.13469775389179695 and parameters: {'kernel': 'linear', 'C': 85.466116222411, 'gamma': 0.15884886107058224, 'epsilon': 0.03073312309719146}. Best is trial 345 with value: 0.13438257115663557.
[I 2024-12-03 19:16:20,687] Trial 2072 finished with value: 0.1378649479495391 and parameters: {'kernel': 'linear', 'C': 16.72839436874105, 'gamma': 0.014411547606069016, 'epsilon': 0.01313486710634792}. Best is trial 345 with value: 0.13438257115663557.
[I 2024-12-03 19:16:21,044] Trial 2094 finished with value: 0.13493716669927452 and parameters: {'kernel': 'linear', 'C': 11.425625174465056, 'gamma': 0.0005098002708590469, 'epsilon': 0.06353675148836345}. Best is trial 345 with value: 0.13438257115663557.
[I 2024-12-03 19:16:21,732] Trial 2087 finished with value: 0.13699302002015626 and parameters: {'kernel': 'linear', 'C': 22.904579768253363, 'gamma': 0.016549126894584286, 'epsilon': 0.04468367566747236}. Best is trial 345 with value: 0.13438257115663557.
[I 2024-12-03 19:16:26,109] Trial 2031 finished with value: 0.1379886148777293 and parameters: {'kernel': 'linear', 'C': 40.988490208463666, 'gamma': 0.00017604549030592357, 'epsilon': 0.0075031244128572205}. Best is trial 345 with value: 0.13438257115663557.
[I 2024-12-03 19:16:28,179] Trial 2061 finished with value: 0.137740403360812 and parameters: {'kernel': 'linear', 'C': 28.47674768713954, 'gamma': 0.00041027498603397015, 'epsilon': 0.01765609314141554}. Best is trial 345 with value: 0.13438257115663557.
[I 2024-12-03 19:16:28,214] Trial 2092 finished with value: 0.1361933377251215 and parameters: {'kernel': 'linear', 'C': 17.066431285653227, 'gamma': 0.009055610558602751, 'epsilon': 0.051183264419505124}. Best is trial 345 with value: 0.13438257115663557.
[I 2024-12-03 19:16:29,817] Trial 2038 finished with value: 0.13565974167066133 and parameters: {'kernel': 'linear', 'C': 49.07846031655685, 'gamma': 0.00011440651743975294, 'epsilon': 0.027488067002667104}. Best is trial 345 with value: 0.13438257115663557.
[I 2024-12-03 19:16:30,199] Trial 2101 finished with value: 0.8264417629895895 and parameters: {'kernel': 'poly', 'C': 0.041198908696879026, 'gamma': 0.008915468199729729, 'epsilon': 0.770244279345166}. Best is trial 345 with value: 0.13438257115663557.
[I 2024-12-03 19:16:30,347] Trial 2063 finished with value: 0.13826350133116563 and parameters: {'kernel': 'linear', 'C': 45.42387966118948, 'gamma': 0.0003452731921370948, 'epsilon': 0.01661241342391476}. Best is trial 345 with value: 0.13438257115663557.
[I 2024-12-03 19:16:31,251] Trial 2083 finished with value: 0.1354417671712768 and parameters: {'kernel': 'linear', 'C': 20.12180086269442, 'gamma': 0.013101619568028263, 'epsilon': 0.028105340061894368}. Best is trial 345 with value: 0.13438257115663557.
[I 2024-12-03 19:16:34,217] Trial 2095 finished with value: 0.13538140042002025 and parameters: {'kernel': 'linear', 'C': 18.817317956798153, 'gamma': 0.8913010576213812, 'epsilon': 0.028889044152042135}. Best is trial 345 with value: 0.13438257115663557.
[I 2024-12-03 19:16:36,448] Trial 2055 finished with value: 0.13552897088986665 and parameters: {'kernel': 'linear', 'C': 63.6083461071385, 'gamma': 0.00028802640766239, 'epsilon': 0.03443195210990024}. Best is trial 345 with value: 0.13438257115663557.
[I 2024-12-03 19:16:44,251] Trial 2107 finished with value: 0.13597528550839355 and parameters: {'kernel': 'linear', 'C': 9.822799553328007, 'gamma': 0.44011439292030524, 'epsilon': 0.030185439868327047}. Best is trial 345 with value: 0.13438257115663557.
[I 2024-12-03 19:16:46,216] Trial 1414 finished with value: 0.34525236834563117 and parameters: {'kernel': 'poly', 'C': 0.9656374796935768, 'gamma': 0.4789404843179825, 'epsilon': 0.01997585773821334}. Best is trial 345 with value: 0.13438257115663557.
[I 2024-12-03 19:16:46,258] Trial 2009 finished with value: 0.13725290000881474 and parameters: {'kernel': 'linear', 'C': 96.7249528897032, 'gamma': 0.004424958541336772, 'epsilon': 0.01878785988249464}. Best is trial 345 with value: 0.13438257115663557.
[I 2024-12-03 19:16:46,578] Trial 2007 finished with value: 0.1358512987945511 and parameters: {'kernel': 'linear', 'C': 96.0043782857104, 'gamma': 0.005902018077724296, 'epsilon': 0.02557753354981944}. Best is trial 345 with value: 0.13438257115663557.
[I 2024-12-03 19:16:46,768] Trial 2091 finished with value: 0.13671557000462817 and parameters: {'kernel': 'linear', 'C': 96.37922352326815, 'gamma': 0.0004588043816954428, 'epsilon': 0.07170214128870502}. Best is trial 345 with value: 0.13438257115663557.
[I 2024-12-03 19:16:48,349] Trial 2102 finished with value: 0.1353659943919173 and parameters: {'kernel': 'linear', 'C': 20.578178930066905, 'gamma': 0.15526559537356963, 'epsilon': 0.05359443311227785}. Best is trial 345 with value: 0.13438257115663557.
[I 2024-12-03 19:16:56,815] Trial 2088 finished with value: 0.13775437114791952 and parameters: {'kernel': 'linear', 'C': 28.34029644931223, 'gamma': 0.00018308662588449847, 'epsilon': 0.0013777957593531767}. Best is trial 345 with value: 0.13438257115663557.
[I 2024-12-03 19:16:59,712] Trial 2093 finished with value: 0.13787022612444885 and parameters: {'kernel': 'linear', 'C': 38.66802422550888, 'gamma': 0.0007242732884422997, 'epsilon': 0.012872908837636223}. Best is trial 345 with value: 0.13438257115663557.
[I 2024-12-03 19:17:00,218] Trial 2081 finished with value: 0.1362722433346486 and parameters: {'kernel': 'linear', 'C': 80.19853011102855, 'gamma': 0.0006762608356430832, 'epsilon': 0.042654791364538494}. Best is trial 345 with value: 0.13438257115663557.
[I 2024-12-03 19:17:01,558] Trial 2078 finished with value: 0.13527132051132526 and parameters: {'kernel': 'linear', 'C': 75.39795633919522, 'gamma': 0.000336781376208237, 'epsilon': 0.05924094292090664}. Best is trial 345 with value: 0.13438257115663557.
[I 2024-12-03 19:17:02,847] Trial 2117 finished with value: 0.575793752145783 and parameters: {'kernel': 'rbf', 'C': 56.99411468822665, 'gamma': 0.16094179960426547, 'epsilon': 0.027402910414961994}. Best is trial 345 with value: 0.13438257115663557.
[I 2024-12-03 19:17:05,356] Trial 2049 finished with value: 0.13824427819131813 and parameters: {'kernel': 'linear', 'C': 64.74409843097624, 'gamma': 0.0001521680585210538, 'epsilon': 0.010430935371317}. Best is trial 345 with value: 0.13438257115663557.
[I 2024-12-03 19:17:11,424] Trial 2099 finished with value: 0.13525649692204736 and parameters: {'kernel': 'linear', 'C': 76.9644762509457, 'gamma': 0.0904280301883405, 'epsilon': 0.05737314969006648}. Best is trial 345 with value: 0.13438257115663557.
[I 2024-12-03 19:17:16,466] Trial 2103 finished with value: 0.13747543549211 and parameters: {'kernel': 'linear', 'C': 31.919869735644152, 'gamma': 0.2298670179881773, 'epsilon': 0.00431246799878832}. Best is trial 345 with value: 0.13438257115663557.
[I 2024-12-03 19:17:17,434] Trial 2070 finished with value: 0.13822187424338458 and parameters: {'kernel': 'linear', 'C': 89.88717137311387, 'gamma': 0.03570099779788052, 'epsilon': 0.017208871677844188}. Best is trial 345 with value: 0.13438257115663557.
[I 2024-12-03 19:17:18,402] Trial 2096 finished with value: 0.13774280613361028 and parameters: {'kernel': 'linear', 'C': 46.94934626146908, 'gamma': 0.13501968736094758, 'epsilon': 0.013838459501854508}. Best is trial 345 with value: 0.13438257115663557.
[I 2024-12-03 19:17:19,169] Trial 2076 finished with value: 0.13543579570597983 and parameters: {'kernel': 'linear', 'C': 73.2389404716775, 'gamma': 0.019743926082010213, 'epsilon': 0.03352920382663931}. Best is trial 345 with value: 0.13438257115663557.
[I 2024-12-03 19:17:22,276] Trial 2097 finished with value: 0.13528876423998326 and parameters: {'kernel': 'linear', 'C': 56.57801306283739, 'gamma': 0.2126126034233353, 'epsilon': 0.058207743189571934}. Best is trial 345 with value: 0.13438257115663557.
[I 2024-12-03 19:17:23,453] Trial 2125 finished with value: 789.3353163524362 and parameters: {'kernel': 'sigmoid', 'C': 49.114529631156245, 'gamma': 0.11031434785744268, 'epsilon': 0.12887482183854468}. Best is trial 345 with value: 0.13438257115663557.
[I 2024-12-03 19:17:28,526] Trial 2126 finished with value: 0.13672951356974852 and parameters: {'kernel': 'linear', 'C': 7.283704974785274, 'gamma': 0.0006411419297728257, 'epsilon': 0.04828519676460227}. Best is trial 345 with value: 0.13438257115663557.
[I 2024-12-03 19:17:29,648] Trial 2114 finished with value: 0.13588151009398144 and parameters: {'kernel': 'linear', 'C': 37.33512507706183, 'gamma': 0.10145451453678017, 'epsilon': 0.04181492655238824}. Best is trial 345 with value: 0.13438257115663557.
[I 2024-12-03 19:17:30,413] Trial 2119 finished with value: 0.14111411849604247 and parameters: {'kernel': 'linear', 'C': 99.05479604899536, 'gamma': 0.08720553209620839, 'epsilon': 0.09115869476704244}. Best is trial 345 with value: 0.13438257115663557.
[I 2024-12-03 19:17:33,458] Trial 2128 finished with value: 0.13690965421173254 and parameters: {'kernel': 'linear', 'C': 2.276150649630984, 'gamma': 0.0017532227660098294, 'epsilon': 0.040823937086844515}. Best is trial 345 with value: 0.13438257115663557.
[I 2024-12-03 19:17:34,282] Trial 2129 finished with value: 0.15065317048449162 and parameters: {'kernel': 'linear', 'C': 28.625415075303536, 'gamma': 0.00038806097674711474, 'epsilon': 0.14657881878024442}. Best is trial 345 with value: 0.13438257115663557.
[I 2024-12-03 19:17:35,162] Trial 2110 finished with value: 0.1355882731783518 and parameters: {'kernel': 'linear', 'C': 38.11184796235759, 'gamma': 0.372416806643832, 'epsilon': 0.02761737404549874}. Best is trial 345 with value: 0.13438257115663557.
[I 2024-12-03 19:17:35,723] Trial 2122 finished with value: 0.13559207728714928 and parameters: {'kernel': 'linear', 'C': 20.03957226284795, 'gamma': 0.0005094065466558312, 'epsilon': 0.027679458388609083}. Best is trial 345 with value: 0.13438257115663557.
[I 2024-12-03 19:17:35,723] Trial 2131 finished with value: 1.2734498965355112 and parameters: {'kernel': 'poly', 'C': 96.36953619664611, 'gamma': 0.00021403195944834892, 'epsilon': 0.06151094358929201}. Best is trial 345 with value: 0.13438257115663557.
