[I 2024-12-04 12:43:06,822] Trial 1475 finished with value: 0.37657113651789326 and parameters: {'n_estimators': 898, 'learning_rate': 0.07782685317412608, 'max_depth': 6, 'min_samples_split': 6, 'min_samples_leaf': 3, 'subsample': 0.6784718575902646, 'max_features': None}. Best is trial 1454 with value: 0.30763307678022894.
[I 2024-12-04 12:43:07,610] Trial 1495 finished with value: 0.7132289529356132 and parameters: {'n_estimators': 144, 'learning_rate': 0.04843228399374465, 'max_depth': 9, 'min_samples_split': 16, 'min_samples_leaf': 9, 'subsample': 0.7480480909941349, 'max_features': 'sqrt'}. Best is trial 1454 with value: 0.30763307678022894.
[I 2024-12-04 12:43:08,068] Trial 1467 finished with value: 0.3895276810782077 and parameters: {'n_estimators': 1214, 'learning_rate': 0.08717761728871222, 'max_depth': 6, 'min_samples_split': 4, 'min_samples_leaf': 1, 'subsample': 0.7792783468991604, 'max_features': None}. Best is trial 1454 with value: 0.30763307678022894.
[I 2024-12-04 12:43:08,356] Trial 1476 finished with value: 0.4191106539249788 and parameters: {'n_estimators': 1063, 'learning_rate': 0.03222768738610375, 'max_depth': 3, 'min_samples_split': 19, 'min_samples_leaf': 5, 'subsample': 0.9996233610027896, 'max_features': None}. Best is trial 1454 with value: 0.30763307678022894.
[I 2024-12-04 12:43:08,358] Trial 1468 finished with value: 0.44699231281346585 and parameters: {'n_estimators': 1378, 'learning_rate': 0.011971569336773657, 'max_depth': 11, 'min_samples_split': 3, 'min_samples_leaf': 5, 'subsample': 0.8911199571724868, 'max_features': 'sqrt'}. Best is trial 1454 with value: 0.30763307678022894.
[I 2024-12-04 12:43:08,360] Trial 1473 finished with value: 0.40536687116676606 and parameters: {'n_estimators': 1106, 'learning_rate': 0.09719651559177994, 'max_depth': 3, 'min_samples_split': 3, 'min_samples_leaf': 4, 'subsample': 0.7227639578207495, 'max_features': None}. Best is trial 1454 with value: 0.30763307678022894.
[I 2024-12-04 12:43:12,961] Trial 1472 finished with value: 0.3925303997045902 and parameters: {'n_estimators': 1348, 'learning_rate': 0.08521857794596485, 'max_depth': 5, 'min_samples_split': 6, 'min_samples_leaf': 3, 'subsample': 0.7221767250308967, 'max_features': None}. Best is trial 1454 with value: 0.30763307678022894.
[I 2024-12-04 12:43:13,787] Trial 1471 finished with value: 0.38681836391898694 and parameters: {'n_estimators': 1308, 'learning_rate': 0.08407649128933721, 'max_depth': 4, 'min_samples_split': 7, 'min_samples_leaf': 1, 'subsample': 0.6694239855984967, 'max_features': None}. Best is trial 1454 with value: 0.30763307678022894.
[I 2024-12-04 12:43:15,184] Trial 1499 finished with value: 0.708840965763126 and parameters: {'n_estimators': 382, 'learning_rate': 0.015331468689936921, 'max_depth': 12, 'min_samples_split': 10, 'min_samples_leaf': 9, 'subsample': 0.925377711313969, 'max_features': 'sqrt'}. Best is trial 1454 with value: 0.30763307678022894.
[I 2024-12-04 12:43:15,281] Trial 1502 finished with value: 0.8745129769602654 and parameters: {'n_estimators': 261, 'learning_rate': 0.047953255819664836, 'max_depth': 8, 'min_samples_split': 10, 'min_samples_leaf': 9, 'subsample': 0.7936514040359767, 'max_features': 'log2'}. Best is trial 1454 with value: 0.30763307678022894.
[I 2024-12-04 12:43:16,785] Trial 1479 finished with value: 0.3961643551602986 and parameters: {'n_estimators': 1004, 'learning_rate': 0.04952907585160103, 'max_depth': 7, 'min_samples_split': 3, 'min_samples_leaf': 1, 'subsample': 0.7870689280254594, 'max_features': None}. Best is trial 1454 with value: 0.30763307678022894.
[I 2024-12-04 12:43:17,560] Trial 1482 finished with value: 0.3438957477665941 and parameters: {'n_estimators': 856, 'learning_rate': 0.08600587045271221, 'max_depth': 7, 'min_samples_split': 2, 'min_samples_leaf': 2, 'subsample': 0.8207204456893797, 'max_features': None}. Best is trial 1454 with value: 0.30763307678022894.
[I 2024-12-04 12:43:18,181] Trial 1494 finished with value: 0.4035806162829296 and parameters: {'n_estimators': 557, 'learning_rate': 0.08761139714469642, 'max_depth': 4, 'min_samples_split': 18, 'min_samples_leaf': 3, 'subsample': 0.7155089542134867, 'max_features': None}. Best is trial 1454 with value: 0.30763307678022894.
[I 2024-12-04 12:43:23,590] Trial 1478 finished with value: 0.4172684698888096 and parameters: {'n_estimators': 1452, 'learning_rate': 0.09249178063033842, 'max_depth': 5, 'min_samples_split': 3, 'min_samples_leaf': 2, 'subsample': 0.7073740466548392, 'max_features': 'log2'}. Best is trial 1454 with value: 0.30763307678022894.
[I 2024-12-04 12:43:24,146] Trial 1477 finished with value: 0.36830185975894836 and parameters: {'n_estimators': 1401, 'learning_rate': 0.08793225264576472, 'max_depth': 6, 'min_samples_split': 2, 'min_samples_leaf': 4, 'subsample': 0.8367223249612619, 'max_features': None}. Best is trial 1454 with value: 0.30763307678022894.
[I 2024-12-04 12:43:24,160] Trial 1480 finished with value: 0.40023118424392146 and parameters: {'n_estimators': 1290, 'learning_rate': 0.0918322171337819, 'max_depth': 8, 'min_samples_split': 4, 'min_samples_leaf': 1, 'subsample': 0.7996149212141102, 'max_features': None}. Best is trial 1454 with value: 0.30763307678022894.
[I 2024-12-04 12:43:25,640] Trial 1488 finished with value: 0.38493615499498945 and parameters: {'n_estimators': 948, 'learning_rate': 0.07110231891468832, 'max_depth': 5, 'min_samples_split': 2, 'min_samples_leaf': 1, 'subsample': 0.8786026409618789, 'max_features': None}. Best is trial 1454 with value: 0.30763307678022894.
[I 2024-12-04 12:43:26,657] Trial 1481 finished with value: 0.4980391108938659 and parameters: {'n_estimators': 1425, 'learning_rate': 0.06591788112730522, 'max_depth': 11, 'min_samples_split': 18, 'min_samples_leaf': 6, 'subsample': 0.6555749212433166, 'max_features': 'log2'}. Best is trial 1454 with value: 0.30763307678022894.
[I 2024-12-04 12:43:30,189] Trial 1483 finished with value: 0.41987835459114337 and parameters: {'n_estimators': 1209, 'learning_rate': 0.06489754059598474, 'max_depth': 5, 'min_samples_split': 3, 'min_samples_leaf': 1, 'subsample': 0.9331872389960433, 'max_features': None}. Best is trial 1454 with value: 0.30763307678022894.
[I 2024-12-04 12:43:33,611] Trial 1492 finished with value: 0.39040523963416435 and parameters: {'n_estimators': 1107, 'learning_rate': 0.06901350746082491, 'max_depth': 6, 'min_samples_split': 4, 'min_samples_leaf': 3, 'subsample': 0.856673895226302, 'max_features': None}. Best is trial 1454 with value: 0.30763307678022894.
[I 2024-12-04 12:43:34,988] Trial 1498 finished with value: 0.5497398916975256 and parameters: {'n_estimators': 1082, 'learning_rate': 0.04915227336344207, 'max_depth': 4, 'min_samples_split': 19, 'min_samples_leaf': 8, 'subsample': 0.6838985417262224, 'max_features': 'sqrt'}. Best is trial 1454 with value: 0.30763307678022894.
[I 2024-12-04 12:43:35,712] Trial 1490 finished with value: 0.3964926415382658 and parameters: {'n_estimators': 1194, 'learning_rate': 0.08579169684952642, 'max_depth': 7, 'min_samples_split': 2, 'min_samples_leaf': 1, 'subsample': 0.8549279506259846, 'max_features': None}. Best is trial 1454 with value: 0.30763307678022894.
[I 2024-12-04 12:43:35,998] Trial 1493 finished with value: 0.3825911119314219 and parameters: {'n_estimators': 1118, 'learning_rate': 0.0730297769884349, 'max_depth': 7, 'min_samples_split': 4, 'min_samples_leaf': 3, 'subsample': 0.972595575052658, 'max_features': None}. Best is trial 1454 with value: 0.30763307678022894.
[I 2024-12-04 12:43:36,212] Trial 1485 finished with value: 0.38397054559756927 and parameters: {'n_estimators': 1346, 'learning_rate': 0.08696658212780534, 'max_depth': 6, 'min_samples_split': 7, 'min_samples_leaf': 1, 'subsample': 0.7687226208292096, 'max_features': None}. Best is trial 1454 with value: 0.30763307678022894.
[I 2024-12-04 12:43:39,568] Trial 1497 finished with value: 0.32881415005191084 and parameters: {'n_estimators': 1124, 'learning_rate': 0.080841371951688, 'max_depth': 7, 'min_samples_split': 6, 'min_samples_leaf': 2, 'subsample': 0.6998234222503411, 'max_features': None}. Best is trial 1454 with value: 0.30763307678022894.
[I 2024-12-04 12:43:39,569] Trial 1486 finished with value: 0.32678717442945304 and parameters: {'n_estimators': 1444, 'learning_rate': 0.04905006246837005, 'max_depth': 7, 'min_samples_split': 2, 'min_samples_leaf': 2, 'subsample': 0.921904032001686, 'max_features': None}. Best is trial 1454 with value: 0.30763307678022894.
[I 2024-12-04 12:43:40,369] Trial 1501 finished with value: 0.42270563510319026 and parameters: {'n_estimators': 1212, 'learning_rate': 0.08991043247960102, 'max_depth': 6, 'min_samples_split': 4, 'min_samples_leaf': 1, 'subsample': 0.8220505473520608, 'max_features': 'log2'}. Best is trial 1454 with value: 0.30763307678022894.
[I 2024-12-04 12:43:43,341] Trial 1496 finished with value: 0.3932676590599956 and parameters: {'n_estimators': 1320, 'learning_rate': 0.09099126429895334, 'max_depth': 5, 'min_samples_split': 2, 'min_samples_leaf': 3, 'subsample': 0.9116338918500909, 'max_features': None}. Best is trial 1454 with value: 0.30763307678022894.
[I 2024-12-04 12:43:43,652] Trial 1510 finished with value: 0.8317651066520251 and parameters: {'n_estimators': 958, 'learning_rate': 0.015439338418196941, 'max_depth': 7, 'min_samples_split': 14, 'min_samples_leaf': 9, 'subsample': 0.8666706424098787, 'max_features': 'log2'}. Best is trial 1454 with value: 0.30763307678022894.
[I 2024-12-04 12:43:46,763] Trial 1503 finished with value: 0.32923327600436136 and parameters: {'n_estimators': 1146, 'learning_rate': 0.052689427263672546, 'max_depth': 5, 'min_samples_split': 3, 'min_samples_leaf': 2, 'subsample': 0.8564294432135933, 'max_features': None}. Best is trial 1454 with value: 0.30763307678022894.
[I 2024-12-04 12:43:48,781] Trial 1511 finished with value: 0.602015385206025 and parameters: {'n_estimators': 1177, 'learning_rate': 0.08621820960695654, 'max_depth': 12, 'min_samples_split': 18, 'min_samples_leaf': 9, 'subsample': 0.8586940550421425, 'max_features': 'log2'}. Best is trial 1454 with value: 0.30763307678022894.
[I 2024-12-04 12:43:49,327] Trial 1513 finished with value: 0.5418215692036641 and parameters: {'n_estimators': 763, 'learning_rate': 0.010322255109430575, 'max_depth': 10, 'min_samples_split': 14, 'min_samples_leaf': 8, 'subsample': 0.6111429872355519, 'max_features': None}. Best is trial 1454 with value: 0.30763307678022894.
[I 2024-12-04 12:43:51,268] Trial 1533 finished with value: 0.41911153010480146 and parameters: {'n_estimators': 137, 'learning_rate': 0.06702290478283433, 'max_depth': 6, 'min_samples_split': 8, 'min_samples_leaf': 4, 'subsample': 0.6757567797165644, 'max_features': None}. Best is trial 1454 with value: 0.30763307678022894.
[I 2024-12-04 12:43:52,420] Trial 1521 finished with value: 0.43515398763711544 and parameters: {'n_estimators': 733, 'learning_rate': 0.0932366058708158, 'max_depth': 3, 'min_samples_split': 6, 'min_samples_leaf': 3, 'subsample': 0.8234803060934802, 'max_features': None}. Best is trial 1454 with value: 0.30763307678022894.
[I 2024-12-04 12:43:52,970] Trial 1506 finished with value: 0.4525730403911167 and parameters: {'n_estimators': 1341, 'learning_rate': 0.08613552507860281, 'max_depth': 5, 'min_samples_split': 3, 'min_samples_leaf': 3, 'subsample': 0.883939237787204, 'max_features': 'log2'}. Best is trial 1454 with value: 0.30763307678022894.
[I 2024-12-04 12:43:55,214] Trial 1500 finished with value: 0.33463675097497564 and parameters: {'n_estimators': 1496, 'learning_rate': 0.09159077056991749, 'max_depth': 5, 'min_samples_split': 2, 'min_samples_leaf': 2, 'subsample': 0.7204914172828958, 'max_features': None}. Best is trial 1454 with value: 0.30763307678022894.
[I 2024-12-04 12:43:57,486] Trial 1507 finished with value: 0.40392551457912895 and parameters: {'n_estimators': 1220, 'learning_rate': 0.06939471853776759, 'max_depth': 5, 'min_samples_split': 2, 'min_samples_leaf': 3, 'subsample': 0.7826097639498059, 'max_features': None}. Best is trial 1454 with value: 0.30763307678022894.
[I 2024-12-04 12:43:57,974] Trial 1515 finished with value: 0.3978333212132235 and parameters: {'n_estimators': 1076, 'learning_rate': 0.06966621192807447, 'max_depth': 4, 'min_samples_split': 6, 'min_samples_leaf': 3, 'subsample': 0.6807010812771018, 'max_features': None}. Best is trial 1454 with value: 0.30763307678022894.
[I 2024-12-04 12:43:59,487] Trial 1505 finished with value: 0.3848382975293199 and parameters: {'n_estimators': 1404, 'learning_rate': 0.07189120184252505, 'max_depth': 5, 'min_samples_split': 5, 'min_samples_leaf': 3, 'subsample': 0.9636474134380647, 'max_features': None}. Best is trial 1454 with value: 0.30763307678022894.
[I 2024-12-04 12:44:00,117] Trial 1530 finished with value: 0.9462018528490831 and parameters: {'n_estimators': 555, 'learning_rate': 0.014730329539984939, 'max_depth': 11, 'min_samples_split': 7, 'min_samples_leaf': 9, 'subsample': 0.6400759002728014, 'max_features': 'log2'}. Best is trial 1454 with value: 0.30763307678022894.
[I 2024-12-04 12:44:00,176] Trial 1504 finished with value: 0.34728878028648685 and parameters: {'n_estimators': 1354, 'learning_rate': 0.05964618918930206, 'max_depth': 6, 'min_samples_split': 2, 'min_samples_leaf': 2, 'subsample': 0.6971124727358875, 'max_features': None}. Best is trial 1454 with value: 0.30763307678022894.
[I 2024-12-04 12:44:00,891] Trial 1532 finished with value: 0.39474087781960393 and parameters: {'n_estimators': 507, 'learning_rate': 0.06568940256962127, 'max_depth': 8, 'min_samples_split': 7, 'min_samples_leaf': 1, 'subsample': 0.657043380223756, 'max_features': 'sqrt'}. Best is trial 1454 with value: 0.30763307678022894.
[I 2024-12-04 12:44:01,605] Trial 1509 finished with value: 0.3227796705234814 and parameters: {'n_estimators': 1244, 'learning_rate': 0.08773703026858698, 'max_depth': 6, 'min_samples_split': 3, 'min_samples_leaf': 2, 'subsample': 0.8054891494284532, 'max_features': None}. Best is trial 1454 with value: 0.30763307678022894.
[I 2024-12-04 12:44:04,068] Trial 1516 finished with value: 0.38740260855776043 and parameters: {'n_estimators': 1121, 'learning_rate': 0.09591047889578948, 'max_depth': 7, 'min_samples_split': 2, 'min_samples_leaf': 3, 'subsample': 0.7346761000009222, 'max_features': None}. Best is trial 1454 with value: 0.30763307678022894.
[I 2024-12-04 12:44:06,697] Trial 1520 finished with value: 0.335347466681697 and parameters: {'n_estimators': 1139, 'learning_rate': 0.09004112172483311, 'max_depth': 4, 'min_samples_split': 3, 'min_samples_leaf': 2, 'subsample': 0.6157956175696796, 'max_features': None}. Best is trial 1454 with value: 0.30763307678022894.
[I 2024-12-04 12:44:06,777] Trial 1517 finished with value: 0.32645512321058934 and parameters: {'n_estimators': 1172, 'learning_rate': 0.08169111290097243, 'max_depth': 6, 'min_samples_split': 4, 'min_samples_leaf': 2, 'subsample': 0.8947810890253666, 'max_features': None}. Best is trial 1454 with value: 0.30763307678022894.
[I 2024-12-04 12:44:06,785] Trial 1519 finished with value: 0.3322612408464378 and parameters: {'n_estimators': 1177, 'learning_rate': 0.09745536824411596, 'max_depth': 5, 'min_samples_split': 4, 'min_samples_leaf': 2, 'subsample': 0.6819525563336898, 'max_features': None}. Best is trial 1454 with value: 0.30763307678022894.
[I 2024-12-04 12:44:08,417] Trial 1512 finished with value: 0.33149529213526163 and parameters: {'n_estimators': 1313, 'learning_rate': 0.08355156964289406, 'max_depth': 7, 'min_samples_split': 3, 'min_samples_leaf': 2, 'subsample': 0.9180571039871989, 'max_features': None}. Best is trial 1454 with value: 0.30763307678022894.
[I 2024-12-04 12:44:08,659] Trial 1508 finished with value: 0.40775072815073765 and parameters: {'n_estimators': 1380, 'learning_rate': 0.09659946662378611, 'max_depth': 11, 'min_samples_split': 11, 'min_samples_leaf': 6, 'subsample': 0.9554935717155835, 'max_features': None}. Best is trial 1454 with value: 0.30763307678022894.
[I 2024-12-04 12:44:09,956] Trial 1538 finished with value: 0.4025548621745191 and parameters: {'n_estimators': 431, 'learning_rate': 0.07042929870223069, 'max_depth': 6, 'min_samples_split': 2, 'min_samples_leaf': 3, 'subsample': 0.6999474852302933, 'max_features': None}. Best is trial 1454 with value: 0.30763307678022894.
[I 2024-12-04 12:44:10,534] Trial 1514 finished with value: 0.32155254867797034 and parameters: {'n_estimators': 1353, 'learning_rate': 0.08151962128530979, 'max_depth': 7, 'min_samples_split': 2, 'min_samples_leaf': 2, 'subsample': 0.9003890126098547, 'max_features': None}. Best is trial 1454 with value: 0.30763307678022894.
[I 2024-12-04 12:44:10,692] Trial 1528 finished with value: 0.7255729739589329 and parameters: {'n_estimators': 989, 'learning_rate': 0.011102103201182706, 'max_depth': 7, 'min_samples_split': 9, 'min_samples_leaf': 5, 'subsample': 0.977657119992863, 'max_features': 'log2'}. Best is trial 1454 with value: 0.30763307678022894.
[I 2024-12-04 12:44:13,289] Trial 1523 finished with value: 0.429599646376536 and parameters: {'n_estimators': 1212, 'learning_rate': 0.0937579854024115, 'max_depth': 4, 'min_samples_split': 4, 'min_samples_leaf': 1, 'subsample': 0.8252808504132131, 'max_features': None}. Best is trial 1454 with value: 0.30763307678022894.
[I 2024-12-04 12:44:13,839] Trial 1522 finished with value: 0.3256565685806786 and parameters: {'n_estimators': 1232, 'learning_rate': 0.09147090108453639, 'max_depth': 6, 'min_samples_split': 2, 'min_samples_leaf': 2, 'subsample': 0.7563511966740766, 'max_features': None}. Best is trial 1454 with value: 0.30763307678022894.
[I 2024-12-04 12:44:14,042] Trial 1518 finished with value: 0.3975565463790294 and parameters: {'n_estimators': 1395, 'learning_rate': 0.09897950906860019, 'max_depth': 5, 'min_samples_split': 4, 'min_samples_leaf': 3, 'subsample': 0.7062793971697496, 'max_features': None}. Best is trial 1454 with value: 0.30763307678022894.
[I 2024-12-04 12:44:16,316] Trial 1526 finished with value: 0.5776659331031366 and parameters: {'n_estimators': 1222, 'learning_rate': 0.0671835330405571, 'max_depth': 12, 'min_samples_split': 11, 'min_samples_leaf': 10, 'subsample': 0.923117041155887, 'max_features': 'sqrt'}. Best is trial 1454 with value: 0.30763307678022894.
[I 2024-12-04 12:44:18,727] Trial 1524 finished with value: 0.39491026508776267 and parameters: {'n_estimators': 1300, 'learning_rate': 0.09983919017433907, 'max_depth': 5, 'min_samples_split': 2, 'min_samples_leaf': 1, 'subsample': 0.8543690480465512, 'max_features': None}. Best is trial 1454 with value: 0.30763307678022894.
[I 2024-12-04 12:44:19,125] Trial 1554 finished with value: 0.6531896520779881 and parameters: {'n_estimators': 100, 'learning_rate': 0.08742790733930007, 'max_depth': 4, 'min_samples_split': 14, 'min_samples_leaf': 5, 'subsample': 0.6597130433519129, 'max_features': 'sqrt'}. Best is trial 1454 with value: 0.30763307678022894.
[I 2024-12-04 12:44:20,670] Trial 1527 finished with value: 0.3935452527160456 and parameters: {'n_estimators': 1118, 'learning_rate': 0.07568404451580689, 'max_depth': 7, 'min_samples_split': 2, 'min_samples_leaf': 3, 'subsample': 0.8349823826068151, 'max_features': None}. Best is trial 1454 with value: 0.30763307678022894.
[I 2024-12-04 12:44:21,988] Trial 1529 finished with value: 0.33441251138567335 and parameters: {'n_estimators': 1151, 'learning_rate': 0.09943254369120472, 'max_depth': 5, 'min_samples_split': 4, 'min_samples_leaf': 2, 'subsample': 0.6969797630571702, 'max_features': None}. Best is trial 1454 with value: 0.30763307678022894.
[I 2024-12-04 12:44:24,869] Trial 1525 finished with value: 0.39394770553733244 and parameters: {'n_estimators': 1403, 'learning_rate': 0.09759369995055996, 'max_depth': 6, 'min_samples_split': 6, 'min_samples_leaf': 3, 'subsample': 0.6695907774758019, 'max_features': None}. Best is trial 1454 with value: 0.30763307678022894.
[I 2024-12-04 12:44:24,976] Trial 1534 finished with value: 0.39030445547521353 and parameters: {'n_estimators': 1040, 'learning_rate': 0.059294884849598786, 'max_depth': 6, 'min_samples_split': 5, 'min_samples_leaf': 3, 'subsample': 0.7636833248102542, 'max_features': None}. Best is trial 1454 with value: 0.30763307678022894.
[I 2024-12-04 12:44:25,793] Trial 1542 finished with value: 0.640759319554611 and parameters: {'n_estimators': 816, 'learning_rate': 0.023754562621144747, 'max_depth': 8, 'min_samples_split': 2, 'min_samples_leaf': 5, 'subsample': 0.8845912725377372, 'max_features': 'log2'}. Best is trial 1454 with value: 0.30763307678022894.
[I 2024-12-04 12:44:27,956] Trial 1537 finished with value: 0.3688346046996043 and parameters: {'n_estimators': 985, 'learning_rate': 0.08039817174079292, 'max_depth': 7, 'min_samples_split': 7, 'min_samples_leaf': 4, 'subsample': 0.7418994752734622, 'max_features': None}. Best is trial 1454 with value: 0.30763307678022894.
[I 2024-12-04 12:44:28,480] Trial 1560 finished with value: 1.002616028287215 and parameters: {'n_estimators': 183, 'learning_rate': 0.010532734018267985, 'max_depth': 8, 'min_samples_split': 6, 'min_samples_leaf': 5, 'subsample': 0.812151846399421, 'max_features': 'log2'}. Best is trial 1454 with value: 0.30763307678022894.
[I 2024-12-04 12:44:32,498] Trial 1540 finished with value: 0.3905834672963918 and parameters: {'n_estimators': 1024, 'learning_rate': 0.036693462844621445, 'max_depth': 7, 'min_samples_split': 5, 'min_samples_leaf': 3, 'subsample': 0.7048369304766473, 'max_features': None}. Best is trial 1454 with value: 0.30763307678022894.
[I 2024-12-04 12:44:33,129] Trial 1547 finished with value: 0.386405604213023 and parameters: {'n_estimators': 736, 'learning_rate': 0.06454542380260918, 'max_depth': 6, 'min_samples_split': 7, 'min_samples_leaf': 1, 'subsample': 0.6973296215683467, 'max_features': None}. Best is trial 1454 with value: 0.30763307678022894.
