[I 2024-12-04 20:56:47,378] Trial 2411 finished with value: 0.35921122970567165 and parameters: {'kernel_type': 'Matern', 'length_scale': 4303.247653555991, 'noise_level': 0.00012521491796042933, 'constant_value': 649.5376276464485, 'nu': 0.5}. Best is trial 1997 with value: 0.359156695282073.
[I 2024-12-04 20:56:52,058] Trial 2412 finished with value: 0.35921125281911354 and parameters: {'kernel_type': 'Matern', 'length_scale': 13094.445488796462, 'noise_level': 0.0005992962133482388, 'constant_value': 65468.7174295368, 'nu': 0.5}. Best is trial 1997 with value: 0.359156695282073.
[I 2024-12-04 20:56:52,682] Trial 2413 finished with value: 1.0624161172863735 and parameters: {'kernel_type': 'Matern', 'length_scale': 89857.86027324371, 'noise_level': 2.144542836596462e-05, 'constant_value': 548.9965593647383, 'nu': 0.5}. Best is trial 1997 with value: 0.359156695282073.
[I 2024-12-04 20:56:53,486] Trial 2414 finished with value: 1.0624161172591375 and parameters: {'kernel_type': 'Matern', 'length_scale': 8831.947506932338, 'noise_level': 0.0020687490881895294, 'constant_value': 86409.51997400103, 'nu': 2.5}. Best is trial 1997 with value: 0.359156695282073.
[I 2024-12-04 20:56:55,515] Trial 2415 finished with value: 1.0916567048549912 and parameters: {'kernel_type': 'Matern', 'length_scale': 61694.87128752997, 'noise_level': 3.3948661257807786e-06, 'constant_value': 36850.56792534234, 'nu': 0.5}. Best is trial 1997 with value: 0.359156695282073.
[I 2024-12-04 20:56:57,681] Trial 2416 finished with value: 0.3592112523194876 and parameters: {'kernel_type': 'Matern', 'length_scale': 67.76028730414535, 'noise_level': 0.00019126317682060132, 'constant_value': 23704.914865360613, 'nu': 0.5}. Best is trial 1997 with value: 0.359156695282073.
[I 2024-12-04 20:56:58,968] Trial 2418 finished with value: 1.0916566872581022 and parameters: {'kernel_type': 'Matern', 'length_scale': 111.56786102886802, 'noise_level': 4.0388649770772554e-05, 'constant_value': 31247.80588171323, 'nu': 0.5}. Best is trial 1997 with value: 0.359156695282073.
[I 2024-12-04 20:56:59,322] Trial 2417 finished with value: 0.3592112366328433 and parameters: {'kernel_type': 'Matern', 'length_scale': 272.93972124810307, 'noise_level': 8.131601813322622e-05, 'constant_value': 2318.280162744799, 'nu': 0.5}. Best is trial 1997 with value: 0.359156695282073.
[I 2024-12-04 20:57:01,177] Trial 2419 finished with value: 1.0916566929859453 and parameters: {'kernel_type': 'Matern', 'length_scale': 6480.601706748031, 'noise_level': 3.027530098251481e-06, 'constant_value': 26840.34388047134, 'nu': 0.5}. Best is trial 1997 with value: 0.359156695282073.
[I 2024-12-04 20:57:04,038] Trial 2420 finished with value: 0.3592112178318727 and parameters: {'kernel_type': 'Matern', 'length_scale': 1691.7460536437186, 'noise_level': 0.00043574008089161074, 'constant_value': 34989.64613277384, 'nu': 0.5}. Best is trial 1997 with value: 0.359156695282073.
[I 2024-12-04 20:57:04,725] Trial 2421 finished with value: 0.3592116907752511 and parameters: {'kernel_type': 'Matern', 'length_scale': 2603.668024939096, 'noise_level': 0.0033864150162659277, 'constant_value': 88569.10875824503, 'nu': 0.5}. Best is trial 1997 with value: 0.359156695282073.
[I 2024-12-04 20:57:06,116] Trial 2422 finished with value: 0.35921126653091795 and parameters: {'kernel_type': 'Matern', 'length_scale': 109.86826898056893, 'noise_level': 0.001192465252809182, 'constant_value': 29187.62415618987, 'nu': 0.5}. Best is trial 1997 with value: 0.359156695282073.
[I 2024-12-04 20:57:08,062] Trial 2423 finished with value: 1.0916567282141776 and parameters: {'kernel_type': 'Matern', 'length_scale': 16712.338290162003, 'noise_level': 0.0003831683669186334, 'constant_value': 3.253002911007246e-07, 'nu': 2.5}. Best is trial 1997 with value: 0.359156695282073.
[I 2024-12-04 20:57:09,096] Trial 2424 finished with value: 1.0916566498255658 and parameters: {'kernel_type': 'Matern', 'length_scale': 948.4891702834058, 'noise_level': 1.3965499951748126e-05, 'constant_value': 276.9798783069013, 'nu': 0.5}. Best is trial 1997 with value: 0.359156695282073.
[I 2024-12-04 20:57:09,932] Trial 2425 finished with value: 1.0916566986904 and parameters: {'kernel_type': 'Matern', 'length_scale': 2535.9034086983793, 'noise_level': 2.4202861449986353e-05, 'constant_value': 22980.71814456108, 'nu': 0.5}. Best is trial 1997 with value: 0.359156695282073.
[I 2024-12-04 20:57:13,241] Trial 2427 finished with value: 1.0624161173872393 and parameters: {'kernel_type': 'Matern', 'length_scale': 88587.32583999465, 'noise_level': 0.00018715267693127818, 'constant_value': 110.06224187337587, 'nu': 0.5}. Best is trial 1997 with value: 0.359156695282073.
[I 2024-12-04 20:57:13,566] Trial 2428 finished with value: 1.0916565567930163 and parameters: {'kernel_type': 'Matern', 'length_scale': 60.0649226974965, 'noise_level': 1.1801082421050781e-05, 'constant_value': 320.5265172134756, 'nu': 0.5}. Best is trial 1997 with value: 0.359156695282073.
[I 2024-12-04 20:57:15,198] Trial 2426 finished with value: 0.3592107230067347 and parameters: {'kernel_type': 'Matern', 'length_scale': 6261.5077085768435, 'noise_level': 0.00017744852491636536, 'constant_value': 31970.313036132407, 'nu': 0.5}. Best is trial 1997 with value: 0.359156695282073.
[I 2024-12-04 20:57:20,862] Trial 2429 finished with value: 1.091656667564727 and parameters: {'kernel_type': 'Matern', 'length_scale': 1201.9858687938056, 'noise_level': 2.7772113367138123e-06, 'constant_value': 4250.631476094083, 'nu': 0.5}. Best is trial 1997 with value: 0.359156695282073.
[I 2024-12-04 20:57:25,789] Trial 2430 finished with value: 1.0624161176411917 and parameters: {'kernel_type': 'Matern', 'length_scale': 0.00949968889379036, 'noise_level': 0.0002885593064084489, 'constant_value': 1277.707654034509, 'nu': 0.5}. Best is trial 1997 with value: 0.359156695282073.
[I 2024-12-04 20:57:29,379] Trial 2431 finished with value: 1.0624161172602244 and parameters: {'kernel_type': 'Matern', 'length_scale': 25.69659581315988, 'noise_level': 2.3133624294083584e-10, 'constant_value': 0.0004636814610632694, 'nu': 2.5}. Best is trial 1997 with value: 0.359156695282073.
[I 2024-12-04 20:57:30,425] Trial 2432 finished with value: 0.35921123490987195 and parameters: {'kernel_type': 'Matern', 'length_scale': 96885.3099656034, 'noise_level': 6.07955684582215e-05, 'constant_value': 3812.0943800822943, 'nu': 0.5}. Best is trial 1997 with value: 0.359156695282073.
[I 2024-12-04 20:57:32,008] Trial 2433 finished with value: 0.35921136401765436 and parameters: {'kernel_type': 'Matern', 'length_scale': 5291.0495757505205, 'noise_level': 9.428106070877828e-05, 'constant_value': 51635.67022481243, 'nu': 0.5}. Best is trial 1997 with value: 0.359156695282073.
[I 2024-12-04 20:57:34,856] Trial 2434 finished with value: 0.35921123452066656 and parameters: {'kernel_type': 'Matern', 'length_scale': 322.24553381117016, 'noise_level': 0.0002444779208621313, 'constant_value': 9982.37817608448, 'nu': 0.5}. Best is trial 1997 with value: 0.359156695282073.
[I 2024-12-04 20:57:36,432] Trial 2435 finished with value: 0.35921105021385585 and parameters: {'kernel_type': 'Matern', 'length_scale': 6623.835025945277, 'noise_level': 0.0700031589589865, 'constant_value': 56927.29145560201, 'nu': 0.5}. Best is trial 1997 with value: 0.359156695282073.
[I 2024-12-04 20:57:37,201] Trial 2436 finished with value: 0.35921124289911116 and parameters: {'kernel_type': 'Matern', 'length_scale': 130.1511771687671, 'noise_level': 0.001400491181909863, 'constant_value': 11893.161889686884, 'nu': 0.5}. Best is trial 1997 with value: 0.359156695282073.
[I 2024-12-04 20:57:37,864] Trial 2437 finished with value: 1.0916566226271207 and parameters: {'kernel_type': 'Matern', 'length_scale': 2.770802014145, 'noise_level': 5.019620532439245e-05, 'constant_value': 88828.75183341272, 'nu': 0.5}. Best is trial 1997 with value: 0.359156695282073.
[I 2024-12-04 20:57:43,265] Trial 2440 finished with value: 0.3592097325980547 and parameters: {'kernel_type': 'Matern', 'length_scale': 4.098441844890955, 'noise_level': 9.238888742138208e-05, 'constant_value': 1316.6170619417364, 'nu': 0.5}. Best is trial 1997 with value: 0.359156695282073.
[I 2024-12-04 20:57:43,682] Trial 2439 finished with value: 1.0624161172544382 and parameters: {'kernel_type': 'Matern', 'length_scale': 6317.093291781504, 'noise_level': 5.333096563164644e-06, 'constant_value': 14224.34017351623, 'nu': 1.5}. Best is trial 1997 with value: 0.359156695282073.
[I 2024-12-04 20:57:45,136] Trial 2438 finished with value: 1.0624161174594309 and parameters: {'kernel_type': 'Matern', 'length_scale': 0.003304331248863827, 'noise_level': 0.0001905085245105037, 'constant_value': 9777.014980869544, 'nu': 0.5}. Best is trial 1997 with value: 0.359156695282073.
[I 2024-12-04 20:57:46,861] Trial 2442 finished with value: 1.09165661571789 and parameters: {'kernel_type': 'Matern', 'length_scale': 68.47497078573946, 'noise_level': 1.140428153934933e-05, 'constant_value': 22000.54035787814, 'nu': 0.5}. Best is trial 1997 with value: 0.359156695282073.
[I 2024-12-04 20:57:49,009] Trial 2441 finished with value: 0.35921119747298663 and parameters: {'kernel_type': 'Matern', 'length_scale': 910.438042280616, 'noise_level': 6.836263458582714e-05, 'constant_value': 87818.34592821645, 'nu': 0.5}. Best is trial 1997 with value: 0.359156695282073.
[I 2024-12-04 20:57:50,163] Trial 2444 finished with value: 1.0916567048549886 and parameters: {'kernel_type': 'Matern', 'length_scale': 20692.940587664943, 'noise_level': 2.3917640382812843e-05, 'constant_value': 49714.46460858489, 'nu': 0.5}. Best is trial 1997 with value: 0.359156695282073.
[I 2024-12-04 20:57:50,244] Trial 2443 finished with value: 0.3592104163923642 and parameters: {'kernel_type': 'Matern', 'length_scale': 1584.830167494598, 'noise_level': 0.00012584070920351682, 'constant_value': 452.9008866694961, 'nu': 0.5}. Best is trial 1997 with value: 0.359156695282073.
[I 2024-12-04 20:57:55,505] Trial 2446 finished with value: 0.3592112153260353 and parameters: {'kernel_type': 'Matern', 'length_scale': 927.0752665537858, 'noise_level': 8.172077879154087e-05, 'constant_value': 2468.1846860114656, 'nu': 0.5}. Best is trial 1997 with value: 0.359156695282073.
[I 2024-12-04 20:57:56,159] Trial 2447 finished with value: 0.35921127271259673 and parameters: {'kernel_type': 'Matern', 'length_scale': 2468.114382471925, 'noise_level': 0.00039050313943540853, 'constant_value': 48594.75812436809, 'nu': 0.5}. Best is trial 1997 with value: 0.359156695282073.
[I 2024-12-04 20:57:56,261] Trial 2445 finished with value: 0.4226897352437352 and parameters: {'kernel_type': 'Matern', 'length_scale': 144.79810056639914, 'noise_level': 0.0004861470830577775, 'constant_value': 81418.3660865492, 'nu': 1.5}. Best is trial 1997 with value: 0.359156695282073.
[I 2024-12-04 20:58:00,528] Trial 2448 finished with value: 0.3592112760142832 and parameters: {'kernel_type': 'Matern', 'length_scale': 23.337555012441474, 'noise_level': 0.00010782310236174446, 'constant_value': 2683.67214437305, 'nu': 0.5}. Best is trial 1997 with value: 0.359156695282073.
[I 2024-12-04 20:58:01,385] Trial 2449 finished with value: 0.3592108612363954 and parameters: {'kernel_type': 'Matern', 'length_scale': 45.415144159259086, 'noise_level': 0.0034370088061296843, 'constant_value': 76877.25973346861, 'nu': 0.5}. Best is trial 1997 with value: 0.359156695282073.
[I 2024-12-04 20:58:01,773] Trial 2450 finished with value: 0.3592110939633759 and parameters: {'kernel_type': 'Matern', 'length_scale': 357.52883270275265, 'noise_level': 8.177655674946224e-05, 'constant_value': 35272.334218450575, 'nu': 0.5}. Best is trial 1997 with value: 0.359156695282073.
[I 2024-12-04 20:58:05,908] Trial 2451 finished with value: 0.35921124078024724 and parameters: {'kernel_type': 'Matern', 'length_scale': 1004.6386364081615, 'noise_level': 0.0027218557298648517, 'constant_value': 74490.36455839693, 'nu': 0.5}. Best is trial 1997 with value: 0.359156695282073.
[I 2024-12-04 20:58:06,519] Trial 2452 finished with value: 0.3592111793082985 and parameters: {'kernel_type': 'Matern', 'length_scale': 490.01136575842185, 'noise_level': 0.00022234136022730613, 'constant_value': 443.0518305585199, 'nu': 0.5}. Best is trial 1997 with value: 0.359156695282073.
[I 2024-12-04 20:58:07,944] Trial 2453 finished with value: 0.35921134724254794 and parameters: {'kernel_type': 'Matern', 'length_scale': 82551.18537429869, 'noise_level': 0.0028186140049803396, 'constant_value': 50608.19363218491, 'nu': 0.5}. Best is trial 1997 with value: 0.359156695282073.
[I 2024-12-04 20:58:09,787] Trial 2455 finished with value: 1.0916558493773711 and parameters: {'kernel_type': 'Matern', 'length_scale': 0.06716085304883518, 'noise_level': 0.00016650924009517054, 'constant_value': 40913.75252163178, 'nu': 0.5}. Best is trial 1997 with value: 0.359156695282073.
[I 2024-12-04 20:58:10,784] Trial 2454 finished with value: 0.35921105610900145 and parameters: {'kernel_type': 'Matern', 'length_scale': 1.4538831797901872, 'noise_level': 0.00023832472078772255, 'constant_value': 4449.352221286246, 'nu': 0.5}. Best is trial 1997 with value: 0.359156695282073.
[I 2024-12-04 20:58:13,229] Trial 2456 finished with value: 1.0624161172684947 and parameters: {'kernel_type': 'Matern', 'length_scale': 1290.5064849527064, 'noise_level': 6.964144179956709e-06, 'constant_value': 84129.13714192863, 'nu': 2.5}. Best is trial 1997 with value: 0.359156695282073.
[I 2024-12-04 20:58:14,010] Trial 2458 finished with value: 1.0916562167802812 and parameters: {'kernel_type': 'Matern', 'length_scale': 5.077654874622161, 'noise_level': 2.241284961306248e-06, 'constant_value': 62.304250080332466, 'nu': 0.5}. Best is trial 1997 with value: 0.359156695282073.
[I 2024-12-04 20:58:15,097] Trial 2457 finished with value: 0.359211243665223 and parameters: {'kernel_type': 'Matern', 'length_scale': 181.48028859313217, 'noise_level': 0.0002512065889933979, 'constant_value': 52465.68766822117, 'nu': 0.5}. Best is trial 1997 with value: 0.359156695282073.
[I 2024-12-04 20:58:19,100] Trial 2460 finished with value: 0.35921124551261724 and parameters: {'kernel_type': 'Matern', 'length_scale': 9.358568138217796, 'noise_level': 0.0015368462482051612, 'constant_value': 18239.753332968696, 'nu': 0.5}. Best is trial 1997 with value: 0.359156695282073.
[I 2024-12-04 20:58:19,518] Trial 2461 finished with value: 1.062416117603261 and parameters: {'kernel_type': 'RBF', 'length_scale': 0.058065061376075415, 'noise_level': 0.00845759307493592, 'constant_value': 58730.25640196763, 'nu': 0.5}. Best is trial 1997 with value: 0.359156695282073.
[I 2024-12-04 20:58:22,403] Trial 2462 finished with value: 1.0916567283079528 and parameters: {'kernel_type': 'Matern', 'length_scale': 5.245847228703561, 'noise_level': 1.2826872581929755e-06, 'constant_value': 1725.7325161521999, 'nu': 2.5}. Best is trial 1997 with value: 0.359156695282073.
[I 2024-12-04 20:58:22,493] Trial 2459 finished with value: 1.0624161172681457 and parameters: {'kernel_type': 'RBF', 'length_scale': 0.006406584318372163, 'noise_level': 0.0004684461344787498, 'constant_value': 1.313409529099393e-07, 'nu': 0.5}. Best is trial 1997 with value: 0.359156695282073.
[I 2024-12-04 20:58:24,495] Trial 2463 finished with value: 0.35921120400837625 and parameters: {'kernel_type': 'Matern', 'length_scale': 7.763540500936406, 'noise_level': 0.0015978347035014591, 'constant_value': 43591.65408364514, 'nu': 0.5}. Best is trial 1997 with value: 0.359156695282073.
[I 2024-12-04 20:58:29,200] Trial 2465 finished with value: 0.3592113152171031 and parameters: {'kernel_type': 'Matern', 'length_scale': 111.53076880774292, 'noise_level': 0.00013579782398282872, 'constant_value': 1093.2735626154872, 'nu': 0.5}. Best is trial 1997 with value: 0.359156695282073.
[I 2024-12-04 20:58:30,799] Trial 2466 finished with value: 0.35921122074689554 and parameters: {'kernel_type': 'Matern', 'length_scale': 34.65349743850167, 'noise_level': 7.108782427864441e-05, 'constant_value': 129.3631329094639, 'nu': 0.5}. Best is trial 1997 with value: 0.359156695282073.
[I 2024-12-04 20:58:31,427] Trial 2464 finished with value: 1.0624161173808528 and parameters: {'kernel_type': 'Matern', 'length_scale': 80632.12333408583, 'noise_level': 0.00027728274463985434, 'constant_value': 1.0619215286065564e-06, 'nu': 0.5}. Best is trial 1997 with value: 0.359156695282073.
[I 2024-12-04 20:58:33,459] Trial 2467 finished with value: 0.35921105654295193 and parameters: {'kernel_type': 'Matern', 'length_scale': 2.3804161312391967, 'noise_level': 0.0002970739062497254, 'constant_value': 11868.08401027781, 'nu': 0.5}. Best is trial 1997 with value: 0.359156695282073.
[I 2024-12-04 20:58:36,919] Trial 2469 finished with value: 0.3592106964720132 and parameters: {'kernel_type': 'Matern', 'length_scale': 1230.305068347679, 'noise_level': 0.0005660338797697381, 'constant_value': 46859.01733779763, 'nu': 0.5}. Best is trial 1997 with value: 0.359156695282073.
[I 2024-12-04 20:58:37,433] Trial 2468 finished with value: 0.35921124141961686 and parameters: {'kernel_type': 'Matern', 'length_scale': 56.043388160381966, 'noise_level': 0.008080893325372897, 'constant_value': 86498.57669941575, 'nu': 0.5}. Best is trial 1997 with value: 0.359156695282073.
[I 2024-12-04 20:58:39,353] Trial 2470 finished with value: 0.3592112411397308 and parameters: {'kernel_type': 'Matern', 'length_scale': 230.1601934572388, 'noise_level': 0.00047125053231388323, 'constant_value': 55907.711070231955, 'nu': 0.5}. Best is trial 1997 with value: 0.359156695282073.
[I 2024-12-04 20:58:40,740] Trial 2472 finished with value: 1.0916559103563528 and parameters: {'kernel_type': 'Matern', 'length_scale': 0.6217649019426734, 'noise_level': 4.2716334823039115e-05, 'constant_value': 912.5457727147683, 'nu': 0.5}. Best is trial 1997 with value: 0.359156695282073.
[I 2024-12-04 20:58:41,956] Trial 2471 finished with value: 0.35921097917797085 and parameters: {'kernel_type': 'Matern', 'length_scale': 0.6237398808607824, 'noise_level': 9.010050409963887e-05, 'constant_value': 3452.611512028066, 'nu': 0.5}. Best is trial 1997 with value: 0.359156695282073.
[I 2024-12-04 20:58:46,209] Trial 2473 finished with value: 0.419566566181005 and parameters: {'kernel_type': 'Matern', 'length_scale': 1.2337526314753344, 'noise_level': 0.00034371311884531585, 'constant_value': 2899.5083236930436, 'nu': 2.5}. Best is trial 1997 with value: 0.359156695282073.
[I 2024-12-04 20:58:47,779] Trial 2474 finished with value: 1.0624161170714241 and parameters: {'kernel_type': 'Matern', 'length_scale': 0.029068811412607934, 'noise_level': 0.0009914263350332619, 'constant_value': 12630.089993263813, 'nu': 0.5}. Best is trial 1997 with value: 0.359156695282073.
[I 2024-12-04 20:58:48,490] Trial 2475 finished with value: 0.35921123938147304 and parameters: {'kernel_type': 'Matern', 'length_scale': 4219.310061603331, 'noise_level': 0.008358492653355865, 'constant_value': 529.2957690385706, 'nu': 0.5}. Best is trial 1997 with value: 0.359156695282073.
[I 2024-12-04 20:58:51,793] Trial 2476 finished with value: 0.35921150312917294 and parameters: {'kernel_type': 'Matern', 'length_scale': 101.77544467044441, 'noise_level': 3.920904943741081e-05, 'constant_value': 838.180882852101, 'nu': 0.5}. Best is trial 1997 with value: 0.359156695282073.
[I 2024-12-04 20:58:51,907] Trial 2478 finished with value: 1.0916566527770835 and parameters: {'kernel_type': 'Matern', 'length_scale': 268.4341507752332, 'noise_level': 3.938664766050439e-06, 'constant_value': 76847.605261433, 'nu': 0.5}. Best is trial 1997 with value: 0.359156695282073.
[I 2024-12-04 20:58:54,236] Trial 2477 finished with value: 0.3592112535652016 and parameters: {'kernel_type': 'Matern', 'length_scale': 17.794889062814057, 'noise_level': 0.0028559954029618484, 'constant_value': 80948.23000579284, 'nu': 0.5}. Best is trial 1997 with value: 0.359156695282073.
[I 2024-12-04 20:58:59,581] Trial 2480 finished with value: 0.4286835382332303 and parameters: {'kernel_type': 'RBF', 'length_scale': 18.24068497786418, 'noise_level': 0.0002537208063439092, 'constant_value': 3928.3845100117983, 'nu': 0.5}. Best is trial 1997 with value: 0.359156695282073.
[I 2024-12-04 20:59:00,376] Trial 2479 finished with value: 1.062416117276933 and parameters: {'kernel_type': 'RBF', 'length_scale': 0.057183841429095675, 'noise_level': 1.4442968884984624e-05, 'constant_value': 2.0701392614242033e-07, 'nu': 2.5}. Best is trial 1997 with value: 0.359156695282073.
[I 2024-12-04 20:59:02,317] Trial 2481 finished with value: 1.0624161140529618 and parameters: {'kernel_type': 'RBF', 'length_scale': 3570.314221742202, 'noise_level': 4.386950639087535e-06, 'constant_value': 15742.426074747593, 'nu': 0.5}. Best is trial 1997 with value: 0.359156695282073.
[I 2024-12-04 20:59:04,347] Trial 2483 finished with value: 1.0624161172983038 and parameters: {'kernel_type': 'Matern', 'length_scale': 4535.795222271125, 'noise_level': 0.00012062839968669231, 'constant_value': 21.5882462068116, 'nu': 0.5}. Best is trial 1997 with value: 0.359156695282073.
[I 2024-12-04 20:59:04,734] Trial 2482 finished with value: 0.3592112319363158 and parameters: {'kernel_type': 'Matern', 'length_scale': 36.1549244620688, 'noise_level': 0.0011452065911488566, 'constant_value': 87122.62724061424, 'nu': 0.5}. Best is trial 1997 with value: 0.359156695282073.
[I 2024-12-04 20:59:05,892] Trial 2484 finished with value: 1.0916565687305022 and parameters: {'kernel_type': 'Matern', 'length_scale': 7.8263303466699625, 'noise_level': 3.8658424636962266e-05, 'constant_value': 320.56990094022075, 'nu': 0.5}. Best is trial 1997 with value: 0.359156695282073.
