[I 2024-12-04 15:36:32,338] Trial 2449 finished with value: 0.13435434726146298 and parameters: {'kernel_type': 'Matern', 'length_scale': 101.0184022171318, 'noise_level': 0.03843923432332798, 'constant_value': 83108.62496763968, 'nu': 1.5}. Best is trial 1985 with value: 0.134351948015208.
[I 2024-12-04 15:36:33,699] Trial 2453 finished with value: 1.2693635028569823 and parameters: {'kernel_type': 'Matern', 'length_scale': 15.668347960303198, 'noise_level': 0.00015445705533307375, 'constant_value': 0.0014616970221866714, 'nu': 0.5}. Best is trial 1985 with value: 0.134351948015208.
[I 2024-12-04 15:36:35,284] Trial 2456 finished with value: 0.1516729802378226 and parameters: {'kernel_type': 'RBF', 'length_scale': 183.43199049984483, 'noise_level': 0.029990709596617673, 'constant_value': 4385.644070061272, 'nu': 1.5}. Best is trial 1985 with value: 0.134351948015208.
[I 2024-12-04 15:36:35,535] Trial 2443 finished with value: 0.1343543387504754 and parameters: {'kernel_type': 'Matern', 'length_scale': 2.279583615688494, 'noise_level': 0.8263512102505203, 'constant_value': 69874.30651891294, 'nu': 1.5}. Best is trial 1985 with value: 0.134351948015208.
[I 2024-12-04 15:36:36,206] Trial 2454 finished with value: 0.13435439768124885 and parameters: {'kernel_type': 'Matern', 'length_scale': 132.44992367594077, 'noise_level': 0.7312683220827877, 'constant_value': 3382.1512558747695, 'nu': 1.5}. Best is trial 1985 with value: 0.134351948015208.
[I 2024-12-04 15:36:37,881] Trial 2460 finished with value: 0.13435439756627843 and parameters: {'kernel_type': 'Matern', 'length_scale': 519.872571017702, 'noise_level': 0.16989152306713234, 'constant_value': 576.9056265860896, 'nu': 1.5}. Best is trial 1985 with value: 0.134351948015208.
[I 2024-12-04 15:36:38,049] Trial 2459 finished with value: 0.17251040227863096 and parameters: {'kernel_type': 'Matern', 'length_scale': 1289.443232073506, 'noise_level': 0.0001258582702692222, 'constant_value': 8560.365523021208, 'nu': 0.5}. Best is trial 1985 with value: 0.134351948015208.
[I 2024-12-04 15:36:38,454] Trial 2457 finished with value: 0.13435439608852334 and parameters: {'kernel_type': 'Matern', 'length_scale': 4429.449816776766, 'noise_level': 0.15402323167733506, 'constant_value': 428.16943833137606, 'nu': 1.5}. Best is trial 1985 with value: 0.134351948015208.
[I 2024-12-04 15:36:39,387] Trial 2461 finished with value: 0.15167301104608125 and parameters: {'kernel_type': 'RBF', 'length_scale': 36.109266307652646, 'noise_level': 0.42705148537135784, 'constant_value': 31.494618480658524, 'nu': 1.5}. Best is trial 1985 with value: 0.134351948015208.
[I 2024-12-04 15:36:39,391] Trial 2455 finished with value: 0.13435441805873297 and parameters: {'kernel_type': 'Matern', 'length_scale': 5.619933125860646, 'noise_level': 0.4882420507865829, 'constant_value': 85307.44764550906, 'nu': 1.5}. Best is trial 1985 with value: 0.134351948015208.
[I 2024-12-04 15:36:40,000] Trial 2458 finished with value: 0.1343544558442321 and parameters: {'kernel_type': 'Matern', 'length_scale': 162.03141411317034, 'noise_level': 0.8889315767099059, 'constant_value': 2241.309812150789, 'nu': 1.5}. Best is trial 1985 with value: 0.134351948015208.
[I 2024-12-04 15:36:42,875] Trial 2462 finished with value: 0.13435437710595724 and parameters: {'kernel_type': 'Matern', 'length_scale': 117.71975043494596, 'noise_level': 0.1567470988528996, 'constant_value': 2293.146259225174, 'nu': 1.5}. Best is trial 1985 with value: 0.134351948015208.
[I 2024-12-04 15:36:45,837] Trial 2471 finished with value: 0.13435439994702283 and parameters: {'kernel_type': 'Matern', 'length_scale': 3357.5828002749495, 'noise_level': 0.1566607091838312, 'constant_value': 64466.52668968139, 'nu': 1.5}. Best is trial 1985 with value: 0.134351948015208.
[I 2024-12-04 15:36:47,478] Trial 2463 finished with value: 0.13435453179775608 and parameters: {'kernel_type': 'Matern', 'length_scale': 10868.660710807802, 'noise_level': 0.7282853975294927, 'constant_value': 5473.565673009614, 'nu': 1.5}. Best is trial 1985 with value: 0.134351948015208.
[I 2024-12-04 15:36:49,954] Trial 2464 finished with value: 0.13435442102128173 and parameters: {'kernel_type': 'Matern', 'length_scale': 14.290736168119443, 'noise_level': 0.4183406478794724, 'constant_value': 93271.05881571896, 'nu': 1.5}. Best is trial 1985 with value: 0.134351948015208.
[I 2024-12-04 15:36:50,101] Trial 2467 finished with value: 0.13435440301654578 and parameters: {'kernel_type': 'Matern', 'length_scale': 1.968418842720166, 'noise_level': 0.8634491597916172, 'constant_value': 6343.513507523374, 'nu': 1.5}. Best is trial 1985 with value: 0.134351948015208.
[I 2024-12-04 15:36:50,188] Trial 2469 finished with value: 0.13435397398041027 and parameters: {'kernel_type': 'Matern', 'length_scale': 126.05049432478215, 'noise_level': 0.5057156283851315, 'constant_value': 64435.1768793301, 'nu': 1.5}. Best is trial 1985 with value: 0.134351948015208.
[I 2024-12-04 15:36:50,634] Trial 2466 finished with value: 1.269363502857275 and parameters: {'kernel_type': 'Matern', 'length_scale': 3692.800363014419, 'noise_level': 0.013558594024138582, 'constant_value': 46.641634774074085, 'nu': 1.5}. Best is trial 1985 with value: 0.134351948015208.
[I 2024-12-04 15:36:50,897] Trial 2473 finished with value: 0.13435443249717582 and parameters: {'kernel_type': 'Matern', 'length_scale': 271.88612085284393, 'noise_level': 0.03245592165127334, 'constant_value': 49187.16539638286, 'nu': 1.5}. Best is trial 1985 with value: 0.134351948015208.
[I 2024-12-04 15:36:52,244] Trial 2468 finished with value: 0.17251039053982575 and parameters: {'kernel_type': 'Matern', 'length_scale': 78.81774554889043, 'noise_level': 0.0983475382049949, 'constant_value': 77327.26648221731, 'nu': 0.5}. Best is trial 1985 with value: 0.134351948015208.
[I 2024-12-04 15:36:53,860] Trial 2470 finished with value: 0.1516729759571435 and parameters: {'kernel_type': 'RBF', 'length_scale': 1345.727961655094, 'noise_level': 0.22147082496141993, 'constant_value': 20587.472314424293, 'nu': 1.5}. Best is trial 1985 with value: 0.134351948015208.
[I 2024-12-04 15:36:54,107] Trial 2465 finished with value: 0.1343541321096381 and parameters: {'kernel_type': 'Matern', 'length_scale': 289.6169485747698, 'noise_level': 0.967137329786039, 'constant_value': 5197.8685512448155, 'nu': 1.5}. Best is trial 1985 with value: 0.134351948015208.
[I 2024-12-04 15:36:55,339] Trial 2475 finished with value: 0.13435439050519626 and parameters: {'kernel_type': 'Matern', 'length_scale': 480.7451455851151, 'noise_level': 0.6740927855867795, 'constant_value': 211.7022161812799, 'nu': 1.5}. Best is trial 1985 with value: 0.134351948015208.
[I 2024-12-04 15:36:55,368] Trial 2450 finished with value: 1.269363502857327 and parameters: {'kernel_type': 'Matern', 'length_scale': 5120.12795368141, 'noise_level': 0.0029107032309299754, 'constant_value': 4.423260116627625, 'nu': 2.5}. Best is trial 1985 with value: 0.134351948015208.
[I 2024-12-04 15:36:56,086] Trial 2479 finished with value: 0.13435440187924383 and parameters: {'kernel_type': 'Matern', 'length_scale': 39.745356104550964, 'noise_level': 0.6937466912156005, 'constant_value': 2089.546398749109, 'nu': 1.5}. Best is trial 1985 with value: 0.134351948015208.
[I 2024-12-04 15:36:56,740] Trial 2474 finished with value: 0.13435440700240137 and parameters: {'kernel_type': 'Matern', 'length_scale': 4.404383316530706, 'noise_level': 0.7235145387274784, 'constant_value': 1365.38990298486, 'nu': 1.5}. Best is trial 1985 with value: 0.134351948015208.
[I 2024-12-04 15:36:56,932] Trial 2476 finished with value: 0.13435411222875265 and parameters: {'kernel_type': 'Matern', 'length_scale': 748.8788292342507, 'noise_level': 0.027182934846767762, 'constant_value': 84254.54678152726, 'nu': 1.5}. Best is trial 1985 with value: 0.134351948015208.
[I 2024-12-04 15:36:57,312] Trial 2477 finished with value: 0.13435434190828566 and parameters: {'kernel_type': 'Matern', 'length_scale': 46.4468344032289, 'noise_level': 0.6277724754210315, 'constant_value': 82595.30028975572, 'nu': 1.5}. Best is trial 1985 with value: 0.134351948015208.
[I 2024-12-04 15:36:58,235] Trial 2472 finished with value: 0.13435436004996973 and parameters: {'kernel_type': 'Matern', 'length_scale': 1922.3758845756442, 'noise_level': 0.044495556275671894, 'constant_value': 1981.902642130704, 'nu': 1.5}. Best is trial 1985 with value: 0.134351948015208.
[I 2024-12-04 15:36:58,645] Trial 2480 finished with value: 1.2693635028569479 and parameters: {'kernel_type': 'Matern', 'length_scale': 0.0026451259352457536, 'noise_level': 2.0393807329307848e-10, 'constant_value': 0.6089942240905996, 'nu': 0.5}. Best is trial 1985 with value: 0.134351948015208.
[I 2024-12-04 15:36:59,596] Trial 2486 finished with value: 0.13435433430735153 and parameters: {'kernel_type': 'Matern', 'length_scale': 449.7069955451381, 'noise_level': 0.8880881066586287, 'constant_value': 41568.294370803334, 'nu': 1.5}. Best is trial 1985 with value: 0.134351948015208.
[I 2024-12-04 15:36:59,598] Trial 2484 finished with value: 0.1343543957729026 and parameters: {'kernel_type': 'Matern', 'length_scale': 5.594544068305324, 'noise_level': 0.02499050264944895, 'constant_value': 90229.56110633802, 'nu': 1.5}. Best is trial 1985 with value: 0.134351948015208.
[I 2024-12-04 15:37:01,478] Trial 2483 finished with value: 0.13435441748073945 and parameters: {'kernel_type': 'Matern', 'length_scale': 49.05642204730817, 'noise_level': 0.08958306217599486, 'constant_value': 80918.19589575542, 'nu': 1.5}. Best is trial 1985 with value: 0.134351948015208.
[I 2024-12-04 15:37:01,714] Trial 2481 finished with value: 0.1343546929792442 and parameters: {'kernel_type': 'Matern', 'length_scale': 39.967404803936034, 'noise_level': 0.10109209843864939, 'constant_value': 78188.01120407206, 'nu': 1.5}. Best is trial 1985 with value: 0.134351948015208.
[I 2024-12-04 15:37:01,718] Trial 2485 finished with value: 1.2693635028564532 and parameters: {'kernel_type': 'RBF', 'length_scale': 51.490395888826946, 'noise_level': 7.0640130842755145e-06, 'constant_value': 266.63473677012723, 'nu': 2.5}. Best is trial 1985 with value: 0.134351948015208.
[I 2024-12-04 15:37:03,743] Trial 2489 finished with value: 0.1343544931174287 and parameters: {'kernel_type': 'Matern', 'length_scale': 274.2369286120953, 'noise_level': 0.0023834590476857526, 'constant_value': 4972.293789442161, 'nu': 1.5}. Best is trial 1985 with value: 0.134351948015208.
[I 2024-12-04 15:37:04,154] Trial 2488 finished with value: 0.13435441481627153 and parameters: {'kernel_type': 'Matern', 'length_scale': 359.8211928358159, 'noise_level': 0.010018570322266723, 'constant_value': 3592.591282569012, 'nu': 1.5}. Best is trial 1985 with value: 0.134351948015208.
[I 2024-12-04 15:37:05,689] Trial 2478 finished with value: 0.13435432909328499 and parameters: {'kernel_type': 'Matern', 'length_scale': 922.5620703333163, 'noise_level': 0.729781517608285, 'constant_value': 1831.0558128740117, 'nu': 1.5}. Best is trial 1985 with value: 0.134351948015208.
[I 2024-12-04 15:37:06,416] Trial 2482 finished with value: 0.1343538461478175 and parameters: {'kernel_type': 'Matern', 'length_scale': 173.61380242664106, 'noise_level': 0.0006372549236865269, 'constant_value': 80381.98004728228, 'nu': 1.5}. Best is trial 1985 with value: 0.134351948015208.
[I 2024-12-04 15:37:06,531] Trial 2491 finished with value: 0.13435477019062603 and parameters: {'kernel_type': 'Matern', 'length_scale': 347.00395117243465, 'noise_level': 0.001734287335044549, 'constant_value': 618.6792080478273, 'nu': 1.5}. Best is trial 1985 with value: 0.134351948015208.
[I 2024-12-04 15:37:07,032] Trial 2493 finished with value: 0.13435452493204578 and parameters: {'kernel_type': 'Matern', 'length_scale': 39.235772726054336, 'noise_level': 0.01690830184429849, 'constant_value': 518.7021460306358, 'nu': 1.5}. Best is trial 1985 with value: 0.134351948015208.
[I 2024-12-04 15:37:07,102] Trial 2487 finished with value: 1.2693635028570702 and parameters: {'kernel_type': 'Matern', 'length_scale': 19557.078374597888, 'noise_level': 7.320243906425827e-05, 'constant_value': 96634.23166395717, 'nu': 1.5}. Best is trial 1985 with value: 0.134351948015208.
[I 2024-12-04 15:37:07,935] Trial 2490 finished with value: 0.1343543991974458 and parameters: {'kernel_type': 'Matern', 'length_scale': 17.269929497151733, 'noise_level': 0.4462043342645647, 'constant_value': 98595.73851618603, 'nu': 1.5}. Best is trial 1985 with value: 0.134351948015208.
[I 2024-12-04 15:37:08,968] Trial 2496 finished with value: 0.1485982672295154 and parameters: {'kernel_type': 'Matern', 'length_scale': 8.406577935312272, 'noise_level': 0.9405844056110778, 'constant_value': 158.4743008020332, 'nu': 2.5}. Best is trial 1985 with value: 0.134351948015208.
[I 2024-12-04 15:37:09,082] Trial 2497 finished with value: 0.1343541958809132 and parameters: {'kernel_type': 'Matern', 'length_scale': 371.8266593463942, 'noise_level': 0.316811143510423, 'constant_value': 78431.79744223955, 'nu': 1.5}. Best is trial 1985 with value: 0.134351948015208.
[I 2024-12-04 15:37:09,820] Trial 2498 finished with value: 0.1343543823518376 and parameters: {'kernel_type': 'Matern', 'length_scale': 1937.7353607262307, 'noise_level': 0.960176986322471, 'constant_value': 38.48703872820745, 'nu': 1.5}. Best is trial 1985 with value: 0.134351948015208.
[I 2024-12-04 15:37:09,993] Trial 2494 finished with value: 0.13435446080094096 and parameters: {'kernel_type': 'Matern', 'length_scale': 508.6020602772819, 'noise_level': 0.003344419123169327, 'constant_value': 635.6750816409932, 'nu': 1.5}. Best is trial 1985 with value: 0.134351948015208.
[I 2024-12-04 15:37:09,997] Trial 2495 finished with value: 0.13435440458539757 and parameters: {'kernel_type': 'Matern', 'length_scale': 26770.043391513376, 'noise_level': 0.112270997140251, 'constant_value': 3945.772794790886, 'nu': 1.5}. Best is trial 1985 with value: 0.134351948015208.
[I 2024-12-04 15:37:10,066] Trial 2492 finished with value: 0.1485982610079365 and parameters: {'kernel_type': 'Matern', 'length_scale': 15.794126517493925, 'noise_level': 0.9250500997664174, 'constant_value': 49740.36931742756, 'nu': 2.5}. Best is trial 1985 with value: 0.134351948015208.
[I 2024-12-04 15:37:11,044] Trial 2499 finished with value: 0.1343543243603153 and parameters: {'kernel_type': 'Matern', 'length_scale': 14.69197395426746, 'noise_level': 0.006794345282732345, 'constant_value': 2640.149546883231, 'nu': 1.5}. Best is trial 1985 with value: 0.134351948015208.
