[I 2024-12-04 20:09:26,707] Trial 1043 finished with value: 0.8119877272066308 and parameters: {'n_estimators': 385, 'max_depth': 47, 'min_samples_split': 43, 'min_samples_leaf': 2, 'max_features': None, 'bootstrap': False, 'criterion': 'squared_error'}. Best is trial 874 with value: 0.32176430753353746.
[I 2024-12-04 20:09:26,769] Trial 1042 finished with value: 0.5761084174717649 and parameters: {'n_estimators': 828, 'max_depth': 8, 'min_samples_split': 17, 'min_samples_leaf': 7, 'max_features': None, 'bootstrap': False, 'criterion': 'squared_error'}. Best is trial 874 with value: 0.32176430753353746.
[I 2024-12-04 20:09:27,954] Trial 1045 finished with value: 1.2167997818009286 and parameters: {'n_estimators': 264, 'max_depth': 49, 'min_samples_split': 31, 'min_samples_leaf': 4, 'max_features': 'log2', 'bootstrap': False, 'criterion': 'squared_error'}. Best is trial 874 with value: 0.32176430753353746.
[I 2024-12-04 20:09:29,149] Trial 1046 finished with value: 0.38398388142292894 and parameters: {'n_estimators': 153, 'max_depth': 39, 'min_samples_split': 2, 'min_samples_leaf': 1, 'max_features': 'sqrt', 'bootstrap': False, 'criterion': 'squared_error'}. Best is trial 874 with value: 0.32176430753353746.
[I 2024-12-04 20:09:30,483] Trial 1047 finished with value: 0.5724833917023353 and parameters: {'n_estimators': 166, 'max_depth': 41, 'min_samples_split': 8, 'min_samples_leaf': 7, 'max_features': None, 'bootstrap': False, 'criterion': 'squared_error'}. Best is trial 874 with value: 0.32176430753353746.
[I 2024-12-04 20:09:36,179] Trial 1029 finished with value: 0.5245840598829656 and parameters: {'n_estimators': 982, 'max_depth': 45, 'min_samples_split': 10, 'min_samples_leaf': 4, 'max_features': None, 'bootstrap': True, 'criterion': 'absolute_error'}. Best is trial 874 with value: 0.32176430753353746.
[I 2024-12-04 20:09:37,468] Trial 1048 finished with value: 1.1235031797835366 and parameters: {'n_estimators': 931, 'max_depth': 16, 'min_samples_split': 2, 'min_samples_leaf': 1, 'max_features': 'log2', 'bootstrap': True, 'criterion': 'absolute_error'}. Best is trial 874 with value: 0.32176430753353746.
[I 2024-12-04 20:09:37,519] Trial 1049 finished with value: 0.35703311249675856 and parameters: {'n_estimators': 261, 'max_depth': 50, 'min_samples_split': 3, 'min_samples_leaf': 1, 'max_features': 'sqrt', 'bootstrap': False, 'criterion': 'squared_error'}. Best is trial 874 with value: 0.32176430753353746.
[I 2024-12-04 20:09:39,103] Trial 1051 finished with value: 0.3348366309678425 and parameters: {'n_estimators': 156, 'max_depth': 50, 'min_samples_split': 2, 'min_samples_leaf': 1, 'max_features': 'sqrt', 'bootstrap': False, 'criterion': 'squared_error'}. Best is trial 874 with value: 0.32176430753353746.
[I 2024-12-04 20:09:40,053] Trial 1052 finished with value: 0.6630881982844804 and parameters: {'n_estimators': 170, 'max_depth': 41, 'min_samples_split': 4, 'min_samples_leaf': 2, 'max_features': 'sqrt', 'bootstrap': False, 'criterion': 'squared_error'}. Best is trial 874 with value: 0.32176430753353746.
[I 2024-12-04 20:09:41,647] Trial 1053 finished with value: 0.34418795400479457 and parameters: {'n_estimators': 277, 'max_depth': 43, 'min_samples_split': 2, 'min_samples_leaf': 1, 'max_features': 'sqrt', 'bootstrap': False, 'criterion': 'squared_error'}. Best is trial 874 with value: 0.32176430753353746.
[I 2024-12-04 20:09:43,309] Trial 1054 finished with value: 0.3572108593225525 and parameters: {'n_estimators': 301, 'max_depth': 50, 'min_samples_split': 3, 'min_samples_leaf': 1, 'max_features': 'sqrt', 'bootstrap': False, 'criterion': 'squared_error'}. Best is trial 874 with value: 0.32176430753353746.
[I 2024-12-04 20:09:44,194] Trial 1055 finished with value: 0.6290148286637864 and parameters: {'n_estimators': 134, 'max_depth': 49, 'min_samples_split': 2, 'min_samples_leaf': 2, 'max_features': 'sqrt', 'bootstrap': False, 'criterion': 'squared_error'}. Best is trial 874 with value: 0.32176430753353746.
[I 2024-12-04 20:09:45,274] Trial 1056 finished with value: 0.6650905270099021 and parameters: {'n_estimators': 267, 'max_depth': 50, 'min_samples_split': 4, 'min_samples_leaf': 2, 'max_features': 'sqrt', 'bootstrap': False, 'criterion': 'squared_error'}. Best is trial 874 with value: 0.32176430753353746.
[I 2024-12-04 20:09:46,385] Trial 1057 finished with value: 0.3379319529379726 and parameters: {'n_estimators': 123, 'max_depth': 50, 'min_samples_split': 2, 'min_samples_leaf': 1, 'max_features': 'sqrt', 'bootstrap': False, 'criterion': 'squared_error'}. Best is trial 874 with value: 0.32176430753353746.
[I 2024-12-04 20:09:48,245] Trial 1058 finished with value: 0.32271586016174714 and parameters: {'n_estimators': 347, 'max_depth': 50, 'min_samples_split': 2, 'min_samples_leaf': 1, 'max_features': 'sqrt', 'bootstrap': False, 'criterion': 'squared_error'}. Best is trial 874 with value: 0.32176430753353746.
[I 2024-12-04 20:09:49,047] Trial 1059 finished with value: 1.119479501766975 and parameters: {'n_estimators': 124, 'max_depth': 22, 'min_samples_split': 35, 'min_samples_leaf': 2, 'max_features': 'log2', 'bootstrap': False, 'criterion': 'squared_error'}. Best is trial 874 with value: 0.32176430753353746.
[I 2024-12-04 20:09:50,776] Trial 1060 finished with value: 0.3477106984591345 and parameters: {'n_estimators': 268, 'max_depth': 42, 'min_samples_split': 2, 'min_samples_leaf': 1, 'max_features': 'sqrt', 'bootstrap': False, 'criterion': 'squared_error'}. Best is trial 874 with value: 0.32176430753353746.
[I 2024-12-04 20:09:51,865] Trial 1061 finished with value: 0.996231485645184 and parameters: {'n_estimators': 420, 'max_depth': 10, 'min_samples_split': 10, 'min_samples_leaf': 3, 'max_features': 'sqrt', 'bootstrap': False, 'criterion': 'squared_error'}. Best is trial 874 with value: 0.32176430753353746.
[I 2024-12-04 20:09:54,828] Trial 1062 finished with value: 0.4293890846459296 and parameters: {'n_estimators': 316, 'max_depth': 39, 'min_samples_split': 4, 'min_samples_leaf': 1, 'max_features': None, 'bootstrap': False, 'criterion': 'squared_error'}. Best is trial 874 with value: 0.32176430753353746.
[I 2024-12-04 20:09:54,833] Trial 1044 finished with value: 0.5314221485019719 and parameters: {'n_estimators': 443, 'max_depth': 27, 'min_samples_split': 7, 'min_samples_leaf': 3, 'max_features': None, 'bootstrap': False, 'criterion': 'absolute_error'}. Best is trial 874 with value: 0.32176430753353746.
[I 2024-12-04 20:09:56,410] Trial 1063 finished with value: 0.38555454504398623 and parameters: {'n_estimators': 275, 'max_depth': 50, 'min_samples_split': 4, 'min_samples_leaf': 1, 'max_features': 'sqrt', 'bootstrap': False, 'criterion': 'squared_error'}. Best is trial 874 with value: 0.32176430753353746.
[I 2024-12-04 20:09:56,928] Trial 1064 finished with value: 0.324995418506334 and parameters: {'n_estimators': 264, 'max_depth': 50, 'min_samples_split': 2, 'min_samples_leaf': 1, 'max_features': 'sqrt', 'bootstrap': False, 'criterion': 'squared_error'}. Best is trial 874 with value: 0.32176430753353746.
[I 2024-12-04 20:09:58,053] Trial 1065 finished with value: 1.0155204463609664 and parameters: {'n_estimators': 659, 'max_depth': 19, 'min_samples_split': 9, 'min_samples_leaf': 5, 'max_features': 'sqrt', 'bootstrap': False, 'criterion': 'squared_error'}. Best is trial 874 with value: 0.32176430753353746.
[I 2024-12-04 20:09:58,347] Trial 1050 finished with value: 0.5103470254288495 and parameters: {'n_estimators': 687, 'max_depth': 32, 'min_samples_split': 12, 'min_samples_leaf': 3, 'max_features': None, 'bootstrap': True, 'criterion': 'absolute_error'}. Best is trial 874 with value: 0.32176430753353746.
[I 2024-12-04 20:09:59,459] Trial 1068 finished with value: 0.6913573408636077 and parameters: {'n_estimators': 248, 'max_depth': 39, 'min_samples_split': 2, 'min_samples_leaf': 2, 'max_features': 'sqrt', 'bootstrap': False, 'criterion': 'squared_error'}. Best is trial 874 with value: 0.32176430753353746.
[I 2024-12-04 20:09:59,595] Trial 1067 finished with value: 0.3257811434012207 and parameters: {'n_estimators': 227, 'max_depth': 50, 'min_samples_split': 2, 'min_samples_leaf': 1, 'max_features': 'sqrt', 'bootstrap': False, 'criterion': 'squared_error'}. Best is trial 874 with value: 0.32176430753353746.
[I 2024-12-04 20:10:02,075] Trial 1069 finished with value: 0.7660807579822192 and parameters: {'n_estimators': 161, 'max_depth': 29, 'min_samples_split': 12, 'min_samples_leaf': 1, 'max_features': 'sqrt', 'bootstrap': True, 'criterion': 'absolute_error'}. Best is trial 874 with value: 0.32176430753353746.
[I 2024-12-04 20:10:04,021] Trial 1071 finished with value: 0.32303015618779657 and parameters: {'n_estimators': 368, 'max_depth': 50, 'min_samples_split': 2, 'min_samples_leaf': 1, 'max_features': 'sqrt', 'bootstrap': False, 'criterion': 'squared_error'}. Best is trial 874 with value: 0.32176430753353746.
[I 2024-12-04 20:10:05,187] Trial 1072 finished with value: 0.38929351840088827 and parameters: {'n_estimators': 203, 'max_depth': 50, 'min_samples_split': 4, 'min_samples_leaf': 1, 'max_features': 'sqrt', 'bootstrap': False, 'criterion': 'squared_error'}. Best is trial 874 with value: 0.32176430753353746.
[I 2024-12-04 20:10:06,671] Trial 1073 finished with value: 0.32611182154263 and parameters: {'n_estimators': 232, 'max_depth': 50, 'min_samples_split': 2, 'min_samples_leaf': 1, 'max_features': 'sqrt', 'bootstrap': False, 'criterion': 'squared_error'}. Best is trial 874 with value: 0.32176430753353746.
[I 2024-12-04 20:10:09,410] Trial 1070 finished with value: 0.5668586941624981 and parameters: {'n_estimators': 173, 'max_depth': 38, 'min_samples_split': 12, 'min_samples_leaf': 4, 'max_features': None, 'bootstrap': False, 'criterion': 'absolute_error'}. Best is trial 874 with value: 0.32176430753353746.
[I 2024-12-04 20:10:09,946] Trial 1074 finished with value: 0.7289616465474812 and parameters: {'n_estimators': 996, 'max_depth': 10, 'min_samples_split': 22, 'min_samples_leaf': 13, 'max_features': None, 'bootstrap': True, 'criterion': 'squared_error'}. Best is trial 874 with value: 0.32176430753353746.
[I 2024-12-04 20:10:10,468] Trial 1066 finished with value: 0.35870530622191743 and parameters: {'n_estimators': 522, 'max_depth': 49, 'min_samples_split': 2, 'min_samples_leaf': 1, 'max_features': 'sqrt', 'bootstrap': False, 'criterion': 'absolute_error'}. Best is trial 874 with value: 0.32176430753353746.
[I 2024-12-04 20:10:11,131] Trial 1075 finished with value: 0.3224299793878773 and parameters: {'n_estimators': 209, 'max_depth': 50, 'min_samples_split': 2, 'min_samples_leaf': 1, 'max_features': 'sqrt', 'bootstrap': False, 'criterion': 'squared_error'}. Best is trial 874 with value: 0.32176430753353746.
[I 2024-12-04 20:10:11,539] Trial 1076 finished with value: 0.38884258024709994 and parameters: {'n_estimators': 210, 'max_depth': 41, 'min_samples_split': 3, 'min_samples_leaf': 1, 'max_features': 'sqrt', 'bootstrap': False, 'criterion': 'squared_error'}. Best is trial 874 with value: 0.32176430753353746.
[I 2024-12-04 20:10:12,287] Trial 1077 finished with value: 0.3695923051269573 and parameters: {'n_estimators': 249, 'max_depth': 49, 'min_samples_split': 2, 'min_samples_leaf': 1, 'max_features': 'sqrt', 'bootstrap': True, 'criterion': 'squared_error'}. Best is trial 874 with value: 0.32176430753353746.
[I 2024-12-04 20:10:12,350] Trial 1078 finished with value: 0.3848706636102428 and parameters: {'n_estimators': 134, 'max_depth': 46, 'min_samples_split': 3, 'min_samples_leaf': 1, 'max_features': 'sqrt', 'bootstrap': False, 'criterion': 'squared_error'}. Best is trial 874 with value: 0.32176430753353746.
[I 2024-12-04 20:10:13,136] Trial 1079 finished with value: 0.38398388142292894 and parameters: {'n_estimators': 153, 'max_depth': 39, 'min_samples_split': 2, 'min_samples_leaf': 1, 'max_features': 'sqrt', 'bootstrap': False, 'criterion': 'squared_error'}. Best is trial 874 with value: 0.32176430753353746.
[I 2024-12-04 20:10:14,148] Trial 1080 finished with value: 1.070253543994278 and parameters: {'n_estimators': 546, 'max_depth': 41, 'min_samples_split': 2, 'min_samples_leaf': 2, 'max_features': 'log2', 'bootstrap': False, 'criterion': 'squared_error'}. Best is trial 874 with value: 0.32176430753353746.
[I 2024-12-04 20:10:14,703] Trial 1082 finished with value: 0.3379319529379726 and parameters: {'n_estimators': 123, 'max_depth': 50, 'min_samples_split': 2, 'min_samples_leaf': 1, 'max_features': 'sqrt', 'bootstrap': False, 'criterion': 'squared_error'}. Best is trial 874 with value: 0.32176430753353746.
[I 2024-12-04 20:10:15,228] Trial 1083 finished with value: 0.6423102320520276 and parameters: {'n_estimators': 128, 'max_depth': 42, 'min_samples_split': 2, 'min_samples_leaf': 2, 'max_features': 'sqrt', 'bootstrap': False, 'criterion': 'squared_error'}. Best is trial 874 with value: 0.32176430753353746.
[I 2024-12-04 20:10:16,558] Trial 1085 finished with value: 0.3754027215782743 and parameters: {'n_estimators': 121, 'max_depth': 50, 'min_samples_split': 3, 'min_samples_leaf': 1, 'max_features': 'sqrt', 'bootstrap': False, 'criterion': 'squared_error'}. Best is trial 874 with value: 0.32176430753353746.
[I 2024-12-04 20:10:17,154] Trial 1084 finished with value: 0.8225369673054169 and parameters: {'n_estimators': 825, 'max_depth': 17, 'min_samples_split': 12, 'min_samples_leaf': 1, 'max_features': 'sqrt', 'bootstrap': True, 'criterion': 'squared_error'}. Best is trial 874 with value: 0.32176430753353746.
[I 2024-12-04 20:10:18,192] Trial 1086 finished with value: 0.3238511379007708 and parameters: {'n_estimators': 207, 'max_depth': 50, 'min_samples_split': 2, 'min_samples_leaf': 1, 'max_features': 'sqrt', 'bootstrap': False, 'criterion': 'squared_error'}. Best is trial 874 with value: 0.32176430753353746.
[I 2024-12-04 20:10:18,659] Trial 1087 finished with value: 0.3504691461975463 and parameters: {'n_estimators': 185, 'max_depth': 43, 'min_samples_split': 2, 'min_samples_leaf': 1, 'max_features': 'sqrt', 'bootstrap': False, 'criterion': 'squared_error'}. Best is trial 874 with value: 0.32176430753353746.
[I 2024-12-04 20:10:19,488] Trial 1081 finished with value: 1.0842602459234276 and parameters: {'n_estimators': 997, 'max_depth': 42, 'min_samples_split': 2, 'min_samples_leaf': 3, 'max_features': 'sqrt', 'bootstrap': True, 'criterion': 'absolute_error'}. Best is trial 874 with value: 0.32176430753353746.
[I 2024-12-04 20:10:20,130] Trial 1089 finished with value: 0.6595988593971566 and parameters: {'n_estimators': 287, 'max_depth': 49, 'min_samples_split': 2, 'min_samples_leaf': 2, 'max_features': 'sqrt', 'bootstrap': False, 'criterion': 'squared_error'}. Best is trial 874 with value: 0.32176430753353746.
[I 2024-12-04 20:10:20,313] Trial 1088 finished with value: 0.324995418506334 and parameters: {'n_estimators': 264, 'max_depth': 50, 'min_samples_split': 2, 'min_samples_leaf': 1, 'max_features': 'sqrt', 'bootstrap': False, 'criterion': 'squared_error'}. Best is trial 874 with value: 0.32176430753353746.
[I 2024-12-04 20:10:20,739] Trial 1090 finished with value: 0.6556689043435737 and parameters: {'n_estimators': 206, 'max_depth': 50, 'min_samples_split': 2, 'min_samples_leaf': 2, 'max_features': 'sqrt', 'bootstrap': False, 'criterion': 'squared_error'}. Best is trial 874 with value: 0.32176430753353746.
[I 2024-12-04 20:10:22,757] Trial 1093 finished with value: 0.3857206824547974 and parameters: {'n_estimators': 251, 'max_depth': 50, 'min_samples_split': 4, 'min_samples_leaf': 1, 'max_features': 'sqrt', 'bootstrap': False, 'criterion': 'squared_error'}. Best is trial 874 with value: 0.32176430753353746.
[I 2024-12-04 20:10:23,006] Trial 1092 finished with value: 0.34495609390511517 and parameters: {'n_estimators': 353, 'max_depth': 42, 'min_samples_split': 2, 'min_samples_leaf': 1, 'max_features': 'sqrt', 'bootstrap': False, 'criterion': 'squared_error'}. Best is trial 874 with value: 0.32176430753353746.
[I 2024-12-04 20:10:24,256] Trial 1094 finished with value: 0.6665081203515549 and parameters: {'n_estimators': 342, 'max_depth': 50, 'min_samples_split': 2, 'min_samples_leaf': 2, 'max_features': 'sqrt', 'bootstrap': False, 'criterion': 'squared_error'}. Best is trial 874 with value: 0.32176430753353746.
[I 2024-12-04 20:10:25,786] Trial 1096 finished with value: 0.3248116102756343 and parameters: {'n_estimators': 241, 'max_depth': 50, 'min_samples_split': 2, 'min_samples_leaf': 1, 'max_features': 'sqrt', 'bootstrap': False, 'criterion': 'squared_error'}. Best is trial 874 with value: 0.32176430753353746.
[I 2024-12-04 20:10:28,191] Trial 1095 finished with value: 0.46649471876685494 and parameters: {'n_estimators': 943, 'max_depth': 30, 'min_samples_split': 7, 'min_samples_leaf': 1, 'max_features': None, 'bootstrap': True, 'criterion': 'squared_error'}. Best is trial 874 with value: 0.32176430753353746.
[I 2024-12-04 20:10:30,535] Trial 1097 finished with value: 0.43407247642652047 and parameters: {'n_estimators': 461, 'max_depth': 50, 'min_samples_split': 2, 'min_samples_leaf': 1, 'max_features': None, 'bootstrap': False, 'criterion': 'squared_error'}. Best is trial 874 with value: 0.32176430753353746.
[I 2024-12-04 20:10:31,866] Trial 1099 finished with value: 0.5403473576350031 and parameters: {'n_estimators': 220, 'max_depth': 48, 'min_samples_split': 2, 'min_samples_leaf': 1, 'max_features': 'log2', 'bootstrap': False, 'criterion': 'squared_error'}. Best is trial 874 with value: 0.32176430753353746.
[I 2024-12-04 20:10:32,985] Trial 1100 finished with value: 0.6667303778270132 and parameters: {'n_estimators': 292, 'max_depth': 42, 'min_samples_split': 2, 'min_samples_leaf': 2, 'max_features': 'sqrt', 'bootstrap': False, 'criterion': 'squared_error'}. Best is trial 874 with value: 0.32176430753353746.
[I 2024-12-04 20:10:33,627] Trial 1098 finished with value: 0.41617471039295717 and parameters: {'n_estimators': 202, 'max_depth': 48, 'min_samples_split': 4, 'min_samples_leaf': 1, 'max_features': 'sqrt', 'bootstrap': False, 'criterion': 'absolute_error'}. Best is trial 874 with value: 0.32176430753353746.
[I 2024-12-04 20:10:34,577] Trial 1101 finished with value: 0.3435338091501839 and parameters: {'n_estimators': 222, 'max_depth': 43, 'min_samples_split': 2, 'min_samples_leaf': 1, 'max_features': 'sqrt', 'bootstrap': False, 'criterion': 'squared_error'}. Best is trial 874 with value: 0.32176430753353746.
[I 2024-12-04 20:10:35,186] Trial 1102 finished with value: 0.4107412534273165 and parameters: {'n_estimators': 336, 'max_depth': 43, 'min_samples_split': 4, 'min_samples_leaf': 1, 'max_features': 'sqrt', 'bootstrap': False, 'criterion': 'squared_error'}. Best is trial 874 with value: 0.32176430753353746.
[I 2024-12-04 20:10:35,958] Trial 1103 finished with value: 0.3360053527829583 and parameters: {'n_estimators': 128, 'max_depth': 50, 'min_samples_split': 2, 'min_samples_leaf': 1, 'max_features': 'sqrt', 'bootstrap': False, 'criterion': 'squared_error'}. Best is trial 874 with value: 0.32176430753353746.
[I 2024-12-04 20:10:37,418] Trial 1104 finished with value: 0.32339470343049653 and parameters: {'n_estimators': 411, 'max_depth': 50, 'min_samples_split': 2, 'min_samples_leaf': 1, 'max_features': 'sqrt', 'bootstrap': False, 'criterion': 'squared_error'}. Best is trial 874 with value: 0.32176430753353746.
[I 2024-12-04 20:10:37,423] Trial 1105 finished with value: 0.3233955423288008 and parameters: {'n_estimators': 249, 'max_depth': 50, 'min_samples_split': 2, 'min_samples_leaf': 1, 'max_features': 'sqrt', 'bootstrap': False, 'criterion': 'squared_error'}. Best is trial 874 with value: 0.32176430753353746.
[I 2024-12-04 20:10:38,986] Trial 1107 finished with value: 0.6796780333389993 and parameters: {'n_estimators': 389, 'max_depth': 50, 'min_samples_split': 4, 'min_samples_leaf': 2, 'max_features': 'sqrt', 'bootstrap': False, 'criterion': 'squared_error'}. Best is trial 874 with value: 0.32176430753353746.
[I 2024-12-04 20:10:40,351] Trial 1108 finished with value: 1.3237842164491436 and parameters: {'n_estimators': 426, 'max_depth': 5, 'min_samples_split': 2, 'min_samples_leaf': 4, 'max_features': 'log2', 'bootstrap': True, 'criterion': 'absolute_error'}. Best is trial 874 with value: 0.32176430753353746.
[I 2024-12-04 20:10:41,952] Trial 1109 finished with value: 0.32502848393502454 and parameters: {'n_estimators': 267, 'max_depth': 50, 'min_samples_split': 2, 'min_samples_leaf': 1, 'max_features': 'sqrt', 'bootstrap': False, 'criterion': 'squared_error'}. Best is trial 874 with value: 0.32176430753353746.
[I 2024-12-04 20:10:42,761] Trial 1106 finished with value: 0.8795349555173089 and parameters: {'n_estimators': 320, 'max_depth': 45, 'min_samples_split': 3, 'min_samples_leaf': 2, 'max_features': 'sqrt', 'bootstrap': False, 'criterion': 'absolute_error'}. Best is trial 874 with value: 0.32176430753353746.
[I 2024-12-04 20:10:43,695] Trial 1110 finished with value: 0.411408009026992 and parameters: {'n_estimators': 400, 'max_depth': 42, 'min_samples_split': 4, 'min_samples_leaf': 1, 'max_features': 'sqrt', 'bootstrap': False, 'criterion': 'squared_error'}. Best is trial 874 with value: 0.32176430753353746.
[I 2024-12-04 20:10:44,613] Trial 1111 finished with value: 0.34571299411546524 and parameters: {'n_estimators': 287, 'max_depth': 42, 'min_samples_split': 2, 'min_samples_leaf': 1, 'max_features': 'sqrt', 'bootstrap': False, 'criterion': 'squared_error'}. Best is trial 874 with value: 0.32176430753353746.
[I 2024-12-04 20:10:45,664] Trial 1112 finished with value: 1.2944725595657685 and parameters: {'n_estimators': 527, 'max_depth': 46, 'min_samples_split': 3, 'min_samples_leaf': 3, 'max_features': 'log2', 'bootstrap': True, 'criterion': 'absolute_error'}. Best is trial 874 with value: 0.32176430753353746.
