[I 2024-12-04 19:53:52,985] Trial 331 finished with value: 0.19720006956580954 and parameters: {'kernel_type': 'Matern', 'length_scale': 60.2090066173254, 'noise_level': 0.4543613692966698, 'constant_value': 96604.53324714364, 'nu': 0.5}. Best is trial 254 with value: 0.13754915492432768.
[I 2024-12-04 19:53:55,950] Trial 332 finished with value: 0.14249505958407313 and parameters: {'kernel_type': 'Matern', 'length_scale': 10.993246964552728, 'noise_level': 0.14989624851765884, 'constant_value': 57616.71960786104, 'nu': 1.5}. Best is trial 254 with value: 0.13754915492432768.
[I 2024-12-04 19:53:56,058] Trial 333 finished with value: 0.14249506347338664 and parameters: {'kernel_type': 'Matern', 'length_scale': 539.7942424297187, 'noise_level': 0.07085415552406843, 'constant_value': 12647.866809137644, 'nu': 1.5}. Best is trial 254 with value: 0.13754915492432768.
[I 2024-12-04 19:53:58,775] Trial 334 finished with value: 0.14249543582290558 and parameters: {'kernel_type': 'Matern', 'length_scale': 17.29460225663253, 'noise_level': 0.8005611377607269, 'constant_value': 16218.934217857493, 'nu': 1.5}. Best is trial 254 with value: 0.13754915492432768.
[I 2024-12-04 19:54:02,534] Trial 336 finished with value: 0.14249506425707797 and parameters: {'kernel_type': 'Matern', 'length_scale': 18.458811089440484, 'noise_level': 0.7930492372972205, 'constant_value': 77612.65538508462, 'nu': 1.5}. Best is trial 254 with value: 0.13754915492432768.
[I 2024-12-04 19:54:02,636] Trial 335 finished with value: 0.14249506944520499 and parameters: {'kernel_type': 'Matern', 'length_scale': 4627.780403588512, 'noise_level': 0.759559133088267, 'constant_value': 22750.1851735828, 'nu': 1.5}. Best is trial 254 with value: 0.13754915492432768.
[I 2024-12-04 19:54:08,264] Trial 337 finished with value: 0.14249453999971096 and parameters: {'kernel_type': 'Matern', 'length_scale': 11.660515420847023, 'noise_level': 0.3183323271796867, 'constant_value': 2214.469748168494, 'nu': 1.5}. Best is trial 254 with value: 0.13754915492432768.
[I 2024-12-04 19:54:10,962] Trial 338 finished with value: 0.986468681915794 and parameters: {'kernel_type': 'RBF', 'length_scale': 328.6480503159546, 'noise_level': 0.001481351922065572, 'constant_value': 1.5026824230367075, 'nu': 0.5}. Best is trial 254 with value: 0.13754915492432768.
[I 2024-12-04 19:54:10,987] Trial 339 finished with value: 0.9864686819221851 and parameters: {'kernel_type': 'RBF', 'length_scale': 0.0025061110015098587, 'noise_level': 0.012838953581398577, 'constant_value': 0.006054378409742636, 'nu': 2.5}. Best is trial 254 with value: 0.13754915492432768.
[I 2024-12-04 19:54:17,754] Trial 342 finished with value: 0.1424950808216631 and parameters: {'kernel_type': 'Matern', 'length_scale': 289.7943156489651, 'noise_level': 0.017216662725481096, 'constant_value': 80800.12671235144, 'nu': 1.5}. Best is trial 254 with value: 0.13754915492432768.
[I 2024-12-04 19:54:18,249] Trial 341 finished with value: 0.142494991971295 and parameters: {'kernel_type': 'Matern', 'length_scale': 4.542974202018687, 'noise_level': 0.09453796506778075, 'constant_value': 20893.614102113355, 'nu': 1.5}. Best is trial 254 with value: 0.13754915492432768.
[I 2024-12-04 19:54:18,892] Trial 340 finished with value: 0.9864686819231675 and parameters: {'kernel_type': 'Matern', 'length_scale': 0.0006283674912695252, 'noise_level': 4.312209625013447e-08, 'constant_value': 0.2963286565103263, 'nu': 2.5}. Best is trial 254 with value: 0.13754915492432768.
[I 2024-12-04 19:54:22,706] Trial 343 finished with value: 0.14249550361323812 and parameters: {'kernel_type': 'Matern', 'length_scale': 466.3061441896851, 'noise_level': 0.09251032028780876, 'constant_value': 74819.01210133733, 'nu': 1.5}. Best is trial 254 with value: 0.13754915492432768.
[I 2024-12-04 19:54:26,119] Trial 345 finished with value: 0.1446988130434058 and parameters: {'kernel_type': 'Matern', 'length_scale': 208.4286999949113, 'noise_level': 0.311398369361179, 'constant_value': 89784.05773569073, 'nu': 2.5}. Best is trial 254 with value: 0.13754915492432768.
[I 2024-12-04 19:54:26,136] Trial 344 finished with value: 0.14771043706983017 and parameters: {'kernel_type': 'RBF', 'length_scale': 366.83606106616025, 'noise_level': 0.06564467893816983, 'constant_value': 9.015939874512439, 'nu': 2.5}. Best is trial 254 with value: 0.13754915492432768.
[I 2024-12-04 19:54:29,904] Trial 346 finished with value: 0.14249506370631254 and parameters: {'kernel_type': 'Matern', 'length_scale': 22.97548928562654, 'noise_level': 0.024083658836828708, 'constant_value': 58438.149008746324, 'nu': 1.5}. Best is trial 254 with value: 0.13754915492432768.
[I 2024-12-04 19:54:30,995] Trial 348 finished with value: 0.9982167338036849 and parameters: {'kernel_type': 'Matern', 'length_scale': 4.906705254668763e-05, 'noise_level': 2.527649859532255e-10, 'constant_value': 52570.73636016436, 'nu': 1.5}. Best is trial 254 with value: 0.13754915492432768.
[I 2024-12-04 19:54:33,555] Trial 347 finished with value: 0.9864686819206775 and parameters: {'kernel_type': 'RBF', 'length_scale': 0.00021851720491786712, 'noise_level': 4.215384357543287e-08, 'constant_value': 2.3683815824758762e-05, 'nu': 0.5}. Best is trial 254 with value: 0.13754915492432768.
[I 2024-12-04 19:54:35,379] Trial 349 finished with value: 0.1477101627389568 and parameters: {'kernel_type': 'RBF', 'length_scale': 4.507183148511632, 'noise_level': 0.11359126428701381, 'constant_value': 55201.483593230245, 'nu': 1.5}. Best is trial 254 with value: 0.13754915492432768.
[I 2024-12-04 19:54:39,895] Trial 351 finished with value: 0.14249506338022108 and parameters: {'kernel_type': 'Matern', 'length_scale': 4.425130875484378, 'noise_level': 0.5129801666169066, 'constant_value': 87877.3126357692, 'nu': 1.5}. Best is trial 254 with value: 0.13754915492432768.
[I 2024-12-04 19:54:41,065] Trial 350 finished with value: 0.9864686819226579 and parameters: {'kernel_type': 'RBF', 'length_scale': 263.05432956793476, 'noise_level': 3.3757695840470715e-06, 'constant_value': 0.06972185734082587, 'nu': 2.5}. Best is trial 254 with value: 0.13754915492432768.
[I 2024-12-04 19:54:46,630] Trial 352 finished with value: 0.1424952634832287 and parameters: {'kernel_type': 'Matern', 'length_scale': 213.4793384670281, 'noise_level': 0.04310713838280197, 'constant_value': 73575.44702158029, 'nu': 1.5}. Best is trial 254 with value: 0.13754915492432768.
[I 2024-12-04 19:54:48,384] Trial 353 finished with value: 0.14249506662488293 and parameters: {'kernel_type': 'Matern', 'length_scale': 3.978613927253533, 'noise_level': 0.00725334136069999, 'constant_value': 0.439169167495609, 'nu': 1.5}. Best is trial 254 with value: 0.13754915492432768.
[I 2024-12-04 19:54:49,495] Trial 354 finished with value: 0.9864686822147574 and parameters: {'kernel_type': 'Matern', 'length_scale': 4133.156587730759, 'noise_level': 0.011857530596060957, 'constant_value': 1273.8080429443053, 'nu': 1.5}. Best is trial 254 with value: 0.13754915492432768.
[I 2024-12-04 19:54:52,847] Trial 355 finished with value: 0.1424950660037184 and parameters: {'kernel_type': 'Matern', 'length_scale': 343.2457078307359, 'noise_level': 0.606904857406433, 'constant_value': 52361.01320960757, 'nu': 1.5}. Best is trial 254 with value: 0.13754915492432768.
[I 2024-12-04 19:54:55,199] Trial 357 finished with value: 0.1424947009859473 and parameters: {'kernel_type': 'Matern', 'length_scale': 36.448265825468745, 'noise_level': 0.5299523424760859, 'constant_value': 99365.86705833455, 'nu': 1.5}. Best is trial 254 with value: 0.13754915492432768.
[I 2024-12-04 19:54:55,463] Trial 356 finished with value: 0.14249508133739372 and parameters: {'kernel_type': 'Matern', 'length_scale': 989.323533649149, 'noise_level': 0.4688188307455608, 'constant_value': 657.8410759845053, 'nu': 1.5}. Best is trial 254 with value: 0.13754915492432768.
[I 2024-12-04 19:55:00,750] Trial 359 finished with value: 0.1424949781555664 and parameters: {'kernel_type': 'Matern', 'length_scale': 88.64405236833166, 'noise_level': 0.23267968223089142, 'constant_value': 48494.84830549109, 'nu': 1.5}. Best is trial 254 with value: 0.13754915492432768.
[I 2024-12-04 19:55:05,011] Trial 358 finished with value: 0.14249506533270606 and parameters: {'kernel_type': 'Matern', 'length_scale': 0.14914306673816607, 'noise_level': 0.011222182784613276, 'constant_value': 18.41582230713, 'nu': 1.5}. Best is trial 254 with value: 0.13754915492432768.
[I 2024-12-04 19:55:07,338] Trial 361 finished with value: 0.9864686819186039 and parameters: {'kernel_type': 'Matern', 'length_scale': 22414.950204802528, 'noise_level': 0.0007210576017785194, 'constant_value': 49635.77964635344, 'nu': 1.5}. Best is trial 254 with value: 0.13754915492432768.
[I 2024-12-04 19:55:09,099] Trial 360 finished with value: 0.9864686819103 and parameters: {'kernel_type': 'Matern', 'length_scale': 1992.2703376248842, 'noise_level': 0.0003495145561859227, 'constant_value': 0.008671345083337032, 'nu': 1.5}. Best is trial 254 with value: 0.13754915492432768.
[I 2024-12-04 19:55:12,785] Trial 363 finished with value: 0.9864686819221613 and parameters: {'kernel_type': 'RBF', 'length_scale': 3.9591238397948794, 'noise_level': 0.001037653534101972, 'constant_value': 0.2068763579952827, 'nu': 1.5}. Best is trial 254 with value: 0.13754915492432768.
[I 2024-12-04 19:55:13,058] Trial 362 finished with value: 0.1424949070476789 and parameters: {'kernel_type': 'Matern', 'length_scale': 6.761965284281338, 'noise_level': 0.028347089226902728, 'constant_value': 89604.63660547948, 'nu': 1.5}. Best is trial 254 with value: 0.13754915492432768.
[I 2024-12-04 19:55:18,173] Trial 365 finished with value: 0.14249506328804032 and parameters: {'kernel_type': 'Matern', 'length_scale': 9.498841051219955, 'noise_level': 0.09482033610813176, 'constant_value': 90447.62355284303, 'nu': 1.5}. Best is trial 254 with value: 0.13754915492432768.
[I 2024-12-04 19:55:18,206] Trial 364 finished with value: 0.998217088301307 and parameters: {'kernel_type': 'Matern', 'length_scale': 0.8473624407092467, 'noise_level': 0.0010531827022110451, 'constant_value': 2.4614135729442617e-05, 'nu': 1.5}. Best is trial 254 with value: 0.13754915492432768.
[I 2024-12-04 19:55:18,991] Trial 366 finished with value: 0.14249507864770672 and parameters: {'kernel_type': 'Matern', 'length_scale': 195.85499837473026, 'noise_level': 0.38212976442203195, 'constant_value': 91194.55457729378, 'nu': 1.5}. Best is trial 254 with value: 0.13754915492432768.
[I 2024-12-04 19:55:24,699] Trial 367 finished with value: 0.1424948512903392 and parameters: {'kernel_type': 'Matern', 'length_scale': 60.32455355219052, 'noise_level': 0.010037266013106233, 'constant_value': 147.90885653595637, 'nu': 1.5}. Best is trial 254 with value: 0.13754915492432768.
[I 2024-12-04 19:55:27,355] Trial 369 finished with value: 0.14249420632194376 and parameters: {'kernel_type': 'Matern', 'length_scale': 4.148871723341695, 'noise_level': 0.01639638985044505, 'constant_value': 5.11729250212047, 'nu': 1.5}. Best is trial 254 with value: 0.13754915492432768.
[I 2024-12-04 19:55:32,269] Trial 368 finished with value: 0.14249506560678385 and parameters: {'kernel_type': 'Matern', 'length_scale': 0.18527406663935045, 'noise_level': 0.732005014931064, 'constant_value': 6779.022868176723, 'nu': 1.5}. Best is trial 254 with value: 0.13754915492432768.
[I 2024-12-04 19:55:34,872] Trial 371 finished with value: 0.13792795657639964 and parameters: {'kernel_type': 'Matern', 'length_scale': 12.190143728327739, 'noise_level': 0.038488897839623115, 'constant_value': 78.46815348472788, 'nu': 1.5}. Best is trial 254 with value: 0.13754915492432768.
[I 2024-12-04 19:55:35,418] Trial 370 finished with value: 0.9864686819893953 and parameters: {'kernel_type': 'Matern', 'length_scale': 1260.5087686065997, 'noise_level': 0.0022991451826118153, 'constant_value': 15.837776016894518, 'nu': 1.5}. Best is trial 254 with value: 0.13754915492432768.
[I 2024-12-04 19:55:43,338] Trial 374 finished with value: 0.9864686819171606 and parameters: {'kernel_type': 'Matern', 'length_scale': 4.58211968291696, 'noise_level': 0.008550903239788618, 'constant_value': 0.040673091447662096, 'nu': 1.5}. Best is trial 254 with value: 0.13754915492432768.
[I 2024-12-04 19:55:43,372] Trial 373 finished with value: 0.14249506251541433 and parameters: {'kernel_type': 'Matern', 'length_scale': 1.9795512043687564, 'noise_level': 0.0006986750634118091, 'constant_value': 3.0963177979037133, 'nu': 1.5}. Best is trial 254 with value: 0.13754915492432768.
[I 2024-12-04 19:55:44,460] Trial 372 finished with value: 0.9864686819214936 and parameters: {'kernel_type': 'Matern', 'length_scale': 75.8048699373477, 'noise_level': 0.014072629410589834, 'constant_value': 0.9288708695865092, 'nu': 1.5}. Best is trial 254 with value: 0.13754915492432768.
[I 2024-12-04 19:55:49,838] Trial 376 finished with value: 0.1424950618758985 and parameters: {'kernel_type': 'Matern', 'length_scale': 11.892912046620486, 'noise_level': 0.003287812657586311, 'constant_value': 10.591844169199488, 'nu': 1.5}. Best is trial 254 with value: 0.13754915492432768.
[I 2024-12-04 19:55:51,310] Trial 375 finished with value: 0.14249530786736084 and parameters: {'kernel_type': 'Matern', 'length_scale': 0.7666992450699112, 'noise_level': 0.01885084416775564, 'constant_value': 0.423400719537979, 'nu': 1.5}. Best is trial 254 with value: 0.13754915492432768.
[I 2024-12-04 19:55:53,135] Trial 377 finished with value: 0.1424950653238692 and parameters: {'kernel_type': 'Matern', 'length_scale': 4.3747124181361485, 'noise_level': 0.02426477062550092, 'constant_value': 4.977047444472161, 'nu': 1.5}. Best is trial 254 with value: 0.13754915492432768.
[I 2024-12-04 19:55:57,636] Trial 379 finished with value: 0.9864686819764017 and parameters: {'kernel_type': 'Matern', 'length_scale': 150.74475353962802, 'noise_level': 0.0026332333741463467, 'constant_value': 65.67902540295371, 'nu': 1.5}. Best is trial 254 with value: 0.13754915492432768.
[I 2024-12-04 19:56:00,648] Trial 378 finished with value: 0.14771036988046762 and parameters: {'kernel_type': 'RBF', 'length_scale': 84005.15342169687, 'noise_level': 0.11479905097656706, 'constant_value': 211.11326555942046, 'nu': 0.5}. Best is trial 254 with value: 0.13754915492432768.
[I 2024-12-04 19:56:02,821] Trial 380 finished with value: 0.142494827027821 and parameters: {'kernel_type': 'Matern', 'length_scale': 1.2732180577680963, 'noise_level': 0.03774467444009871, 'constant_value': 25.380537579313312, 'nu': 1.5}. Best is trial 254 with value: 0.13754915492432768.
[I 2024-12-04 19:56:05,818] Trial 381 finished with value: 0.9864686819186345 and parameters: {'kernel_type': 'Matern', 'length_scale': 553.4822115833884, 'noise_level': 0.0008427891408287101, 'constant_value': 0.019422578080999002, 'nu': 0.5}. Best is trial 254 with value: 0.13754915492432768.
[I 2024-12-04 19:56:07,352] Trial 383 finished with value: 0.9982167338037744 and parameters: {'kernel_type': 'RBF', 'length_scale': 2.0763861434599313e-05, 'noise_level': 2.215470642083104e-09, 'constant_value': 7332.845348181364, 'nu': 2.5}. Best is trial 254 with value: 0.13754915492432768.
[I 2024-12-04 19:56:11,697] Trial 384 finished with value: 0.14249504966795182 and parameters: {'kernel_type': 'Matern', 'length_scale': 0.9815565691255127, 'noise_level': 0.02071312552141136, 'constant_value': 263.696936725051, 'nu': 1.5}. Best is trial 254 with value: 0.13754915492432768.
[I 2024-12-04 19:56:12,243] Trial 382 finished with value: 0.1424951607965425 and parameters: {'kernel_type': 'Matern', 'length_scale': 101.52638252876508, 'noise_level': 0.3539831785376752, 'constant_value': 0.10798197365661762, 'nu': 1.5}. Best is trial 254 with value: 0.13754915492432768.
[I 2024-12-04 19:56:13,761] Trial 385 finished with value: 0.14771000274576448 and parameters: {'kernel_type': 'RBF', 'length_scale': 302.5720254372755, 'noise_level': 0.15827143660455067, 'constant_value': 33.77512754221913, 'nu': 1.5}. Best is trial 254 with value: 0.13754915492432768.
[I 2024-12-04 19:56:18,355] Trial 386 finished with value: 0.14249515378681268 and parameters: {'kernel_type': 'Matern', 'length_scale': 0.7107616353794659, 'noise_level': 0.05494582055465514, 'constant_value': 222.74517447774042, 'nu': 1.5}. Best is trial 254 with value: 0.13754915492432768.
[I 2024-12-04 19:56:19,868] Trial 387 finished with value: 0.1972001041465635 and parameters: {'kernel_type': 'Matern', 'length_scale': 34495.12439722976, 'noise_level': 0.4282448535677829, 'constant_value': 49803.283176249824, 'nu': 0.5}. Best is trial 254 with value: 0.13754915492432768.
[I 2024-12-04 19:56:22,760] Trial 388 finished with value: 0.1424947169369498 and parameters: {'kernel_type': 'Matern', 'length_scale': 0.39825258386352275, 'noise_level': 0.011446813160910136, 'constant_value': 2.4674260324937323, 'nu': 1.5}. Best is trial 254 with value: 0.13754915492432768.
[I 2024-12-04 19:56:26,562] Trial 389 finished with value: 0.14249508615368747 and parameters: {'kernel_type': 'Matern', 'length_scale': 1.4869476599909186, 'noise_level': 0.017903554787837152, 'constant_value': 31.25066538227012, 'nu': 1.5}. Best is trial 254 with value: 0.13754915492432768.
[I 2024-12-04 19:56:28,334] Trial 390 finished with value: 0.1424948336728015 and parameters: {'kernel_type': 'Matern', 'length_scale': 8.848644577730118, 'noise_level': 0.014240352384560161, 'constant_value': 18.226186462910885, 'nu': 1.5}. Best is trial 254 with value: 0.13754915492432768.
[I 2024-12-04 19:56:33,791] Trial 393 finished with value: 0.14469892722862537 and parameters: {'kernel_type': 'Matern', 'length_scale': 3.9690407963598124, 'noise_level': 0.4442653879761671, 'constant_value': 552.5043247345459, 'nu': 2.5}. Best is trial 254 with value: 0.13754915492432768.
[I 2024-12-04 19:56:33,883] Trial 392 finished with value: 0.14249506842695905 and parameters: {'kernel_type': 'Matern', 'length_scale': 0.4215020021575373, 'noise_level': 0.04420454714403201, 'constant_value': 0.017438369226577394, 'nu': 1.5}. Best is trial 254 with value: 0.13754915492432768.
[I 2024-12-04 19:56:37,580] Trial 391 finished with value: 0.14249514723829282 and parameters: {'kernel_type': 'Matern', 'length_scale': 0.12000762284138276, 'noise_level': 0.06082823562276112, 'constant_value': 2.1893279539212647, 'nu': 1.5}. Best is trial 254 with value: 0.13754915492432768.
[I 2024-12-04 19:56:38,446] Trial 394 finished with value: 0.9864656189560055 and parameters: {'kernel_type': 'Matern', 'length_scale': 0.11737826761660813, 'noise_level': 0.3215246962598325, 'constant_value': 1.9574622580048766, 'nu': 1.5}. Best is trial 254 with value: 0.13754915492432768.
[I 2024-12-04 19:56:38,518] Trial 395 finished with value: 0.9864686819220322 and parameters: {'kernel_type': 'Matern', 'length_scale': 0.056503349791747225, 'noise_level': 0.004301897565597548, 'constant_value': 12.673119631123797, 'nu': 1.5}. Best is trial 254 with value: 0.13754915492432768.
[I 2024-12-04 19:56:44,663] Trial 396 finished with value: 0.1424950376633389 and parameters: {'kernel_type': 'Matern', 'length_scale': 1.0284548960082731, 'noise_level': 0.2266974808071222, 'constant_value': 0.6282179343371267, 'nu': 1.5}. Best is trial 254 with value: 0.13754915492432768.
[I 2024-12-04 19:56:44,983] Trial 397 finished with value: 0.1424950513434163 and parameters: {'kernel_type': 'Matern', 'length_scale': 14.526180513708274, 'noise_level': 0.09145202360590111, 'constant_value': 2.9512182714875954, 'nu': 1.5}. Best is trial 254 with value: 0.13754915492432768.
[I 2024-12-04 19:56:46,947] Trial 398 finished with value: 0.1424950624279399 and parameters: {'kernel_type': 'Matern', 'length_scale': 1.3779951174301277, 'noise_level': 0.02787105770117688, 'constant_value': 10.755392559565788, 'nu': 1.5}. Best is trial 254 with value: 0.13754915492432768.
[I 2024-12-04 19:56:48,254] Trial 400 finished with value: 0.9982050014260173 and parameters: {'kernel_type': 'Matern', 'length_scale': 0.2741697601692506, 'noise_level': 0.0026891401222304758, 'constant_value': 4.865583455723619, 'nu': 1.5}. Best is trial 254 with value: 0.13754915492432768.
[I 2024-12-04 19:56:48,628] Trial 399 finished with value: 0.9982167338040426 and parameters: {'kernel_type': 'RBF', 'length_scale': 0.0007387991596185603, 'noise_level': 4.2581665089853764e-07, 'constant_value': 5.890866789151241, 'nu': 1.5}. Best is trial 254 with value: 0.13754915492432768.
[I 2024-12-04 19:56:55,248] Trial 403 finished with value: 0.19720005555998196 and parameters: {'kernel_type': 'Matern', 'length_scale': 1.0428465045971274, 'noise_level': 0.0023865942727848343, 'constant_value': 4.290961398982971, 'nu': 0.5}. Best is trial 254 with value: 0.13754915492432768.
[I 2024-12-04 19:56:56,421] Trial 401 finished with value: 0.14249499246090624 and parameters: {'kernel_type': 'Matern', 'length_scale': 0.9120802297612384, 'noise_level': 0.20632339112549286, 'constant_value': 424.9600436254777, 'nu': 1.5}. Best is trial 254 with value: 0.13754915492432768.
[I 2024-12-04 19:57:03,015] Trial 404 finished with value: 0.9864686821869895 and parameters: {'kernel_type': 'Matern', 'length_scale': 0.011476977940881285, 'noise_level': 2.385453585996553e-10, 'constant_value': 9.789204007500941e-05, 'nu': 2.5}. Best is trial 254 with value: 0.13754915492432768.
[I 2024-12-04 19:57:03,171] Trial 402 finished with value: 0.1424950009785482 and parameters: {'kernel_type': 'Matern', 'length_scale': 6.297859478770086, 'noise_level': 0.7942042034138901, 'constant_value': 13.907449977792618, 'nu': 1.5}. Best is trial 254 with value: 0.13754915492432768.
[I 2024-12-04 19:57:04,963] Trial 405 finished with value: 0.1424950933618616 and parameters: {'kernel_type': 'Matern', 'length_scale': 31.599591079338623, 'noise_level': 0.11220146214964113, 'constant_value': 48.795159674442445, 'nu': 1.5}. Best is trial 254 with value: 0.13754915492432768.
