[I 2024-12-04 14:59:11,941] Trial 446 finished with value: 0.4883034194452585 and parameters: {'kernel_type': 'Matern', 'length_scale': 1695.1325161561476, 'noise_level': 0.04310333355464409, 'constant_value': 26650.754374923352, 'nu': 0.5}. Best is trial 386 with value: 0.4872991004520934.
[I 2024-12-04 14:59:13,809] Trial 458 finished with value: 1.2401112325096528 and parameters: {'kernel_type': 'RBF', 'length_scale': 8128.840685436558, 'noise_level': 0.004310105799043322, 'constant_value': 77434.64633465889, 'nu': 0.5}. Best is trial 386 with value: 0.4872991004520934.
[I 2024-12-04 14:59:13,811] Trial 448 finished with value: 0.5273053838695506 and parameters: {'kernel_type': 'Matern', 'length_scale': 2515.7064875790725, 'noise_level': 0.07572405768400134, 'constant_value': 1378.1691478648158, 'nu': 1.5}. Best is trial 386 with value: 0.4872991004520934.
[I 2024-12-04 14:59:13,816] Trial 452 finished with value: 0.4883034068372759 and parameters: {'kernel_type': 'Matern', 'length_scale': 33.43667026791664, 'noise_level': 0.9561749972070229, 'constant_value': 83.014867613549, 'nu': 0.5}. Best is trial 386 with value: 0.4872991004520934.
[I 2024-12-04 14:59:14,291] Trial 459 finished with value: 1.261454795394147 and parameters: {'kernel_type': 'Matern', 'length_scale': 1016.6692061328431, 'noise_level': 0.03658078644093378, 'constant_value': 88141.77917628761, 'nu': 0.5}. Best is trial 386 with value: 0.4872991004520934.
[I 2024-12-04 14:59:14,662] Trial 460 finished with value: 0.4883030433766579 and parameters: {'kernel_type': 'Matern', 'length_scale': 37321.49712394021, 'noise_level': 0.008248572588295191, 'constant_value': 465.558292306958, 'nu': 0.5}. Best is trial 386 with value: 0.4872991004520934.
[I 2024-12-04 14:59:14,664] Trial 462 finished with value: 0.4883034175645938 and parameters: {'kernel_type': 'Matern', 'length_scale': 341.1308245030207, 'noise_level': 0.14264875120795392, 'constant_value': 606.8707576167662, 'nu': 0.5}. Best is trial 386 with value: 0.4872991004520934.
[I 2024-12-04 14:59:16,196] Trial 463 finished with value: 0.4883034223894429 and parameters: {'kernel_type': 'Matern', 'length_scale': 68950.81736802413, 'noise_level': 0.11957023545699895, 'constant_value': 164.5612577326075, 'nu': 0.5}. Best is trial 386 with value: 0.4872991004520934.
[I 2024-12-04 14:59:16,631] Trial 456 finished with value: 0.48830334405333375 and parameters: {'kernel_type': 'Matern', 'length_scale': 42.265069778535995, 'noise_level': 0.0011143832539249263, 'constant_value': 6.705299592697502, 'nu': 0.5}. Best is trial 386 with value: 0.4872991004520934.
[I 2024-12-04 14:59:18,103] Trial 461 finished with value: 1.240111232367757 and parameters: {'kernel_type': 'RBF', 'length_scale': 65848.74297958384, 'noise_level': 1.0311476716319451e-09, 'constant_value': 271.2643435187978, 'nu': 1.5}. Best is trial 386 with value: 0.4872991004520934.
[I 2024-12-04 14:59:18,838] Trial 454 finished with value: 0.5663956746351139 and parameters: {'kernel_type': 'Matern', 'length_scale': 73640.44564804937, 'noise_level': 0.24129976903617603, 'constant_value': 99194.21506447488, 'nu': 2.5}. Best is trial 386 with value: 0.4872991004520934.
[I 2024-12-04 14:59:20,356] Trial 469 finished with value: 1.240111232483732 and parameters: {'kernel_type': 'Matern', 'length_scale': 57701.33607360023, 'noise_level': 0.004284705954005653, 'constant_value': 141.854096440541, 'nu': 0.5}. Best is trial 386 with value: 0.4872991004520934.
[I 2024-12-04 14:59:20,665] Trial 451 finished with value: 0.48830341645805847 and parameters: {'kernel_type': 'Matern', 'length_scale': 87519.61455544755, 'noise_level': 0.03917707945586971, 'constant_value': 15595.30688236487, 'nu': 0.5}. Best is trial 386 with value: 0.4872991004520934.
[I 2024-12-04 14:59:20,683] Trial 466 finished with value: 1.24011123288217 and parameters: {'kernel_type': 'Matern', 'length_scale': 10827.015012739392, 'noise_level': 0.0005564160343091964, 'constant_value': 80.64736884616696, 'nu': 0.5}. Best is trial 386 with value: 0.4872991004520934.
[I 2024-12-04 14:59:21,491] Trial 455 finished with value: 1.2614547976352326 and parameters: {'kernel_type': 'RBF', 'length_scale': 24454.99042895895, 'noise_level': 0.03800670762552715, 'constant_value': 0.517459139529637, 'nu': 1.5}. Best is trial 386 with value: 0.4872991004520934.
[I 2024-12-04 14:59:21,493] Trial 465 finished with value: 0.4883034176856203 and parameters: {'kernel_type': 'Matern', 'length_scale': 70655.91575318866, 'noise_level': 0.01840767894214166, 'constant_value': 514.5988267149029, 'nu': 0.5}. Best is trial 386 with value: 0.4872991004520934.
[I 2024-12-04 14:59:22,446] Trial 470 finished with value: 1.2401112246674473 and parameters: {'kernel_type': 'Matern', 'length_scale': 99345.99851044404, 'noise_level': 0.00010551910589736902, 'constant_value': 351.7704190001783, 'nu': 0.5}. Best is trial 386 with value: 0.4872991004520934.
[I 2024-12-04 14:59:23,304] Trial 471 finished with value: 0.4883034351665278 and parameters: {'kernel_type': 'Matern', 'length_scale': 17.472641682467675, 'noise_level': 0.002303546618182966, 'constant_value': 4594.545758821178, 'nu': 0.5}. Best is trial 386 with value: 0.4872991004520934.
[I 2024-12-04 14:59:24,383] Trial 474 finished with value: 0.4883034150905972 and parameters: {'kernel_type': 'Matern', 'length_scale': 1185.8301735875723, 'noise_level': 0.34978525036895824, 'constant_value': 2748.161977518351, 'nu': 0.5}. Best is trial 386 with value: 0.4872991004520934.
[I 2024-12-04 14:59:24,440] Trial 457 finished with value: 0.488303411535559 and parameters: {'kernel_type': 'Matern', 'length_scale': 56904.17810161855, 'noise_level': 0.11028258991449733, 'constant_value': 96747.25924959008, 'nu': 0.5}. Best is trial 386 with value: 0.4872991004520934.
[I 2024-12-04 14:59:26,970] Trial 464 finished with value: 0.4883034087518785 and parameters: {'kernel_type': 'Matern', 'length_scale': 3509.339501560082, 'noise_level': 0.0009947561713280245, 'constant_value': 59923.79712048137, 'nu': 0.5}. Best is trial 386 with value: 0.4872991004520934.
[I 2024-12-04 14:59:26,971] Trial 475 finished with value: 0.4883034088286928 and parameters: {'kernel_type': 'Matern', 'length_scale': 8885.126679976473, 'noise_level': 0.0004888599344482588, 'constant_value': 79525.95302146947, 'nu': 0.5}. Best is trial 386 with value: 0.4872991004520934.
[I 2024-12-04 14:59:27,649] Trial 477 finished with value: 0.48830341842026265 and parameters: {'kernel_type': 'Matern', 'length_scale': 98838.45087664794, 'noise_level': 0.22024870089002688, 'constant_value': 1349.9404919915016, 'nu': 0.5}. Best is trial 386 with value: 0.4872991004520934.
[I 2024-12-04 14:59:28,227] Trial 476 finished with value: 0.4883034116632243 and parameters: {'kernel_type': 'Matern', 'length_scale': 2715.9727676129896, 'noise_level': 0.002318789002524752, 'constant_value': 257.7286153970632, 'nu': 0.5}. Best is trial 386 with value: 0.4872991004520934.
[I 2024-12-04 14:59:28,602] Trial 481 finished with value: 0.48830341915800823 and parameters: {'kernel_type': 'Matern', 'length_scale': 8.07670638311141, 'noise_level': 0.8732736804531926, 'constant_value': 17.402970755896735, 'nu': 0.5}. Best is trial 386 with value: 0.4872991004520934.
[I 2024-12-04 14:59:28,777] Trial 467 finished with value: 0.48830341855910875 and parameters: {'kernel_type': 'Matern', 'length_scale': 7096.192483624775, 'noise_level': 0.0021537446649813998, 'constant_value': 512.5647558152281, 'nu': 0.5}. Best is trial 386 with value: 0.4872991004520934.
[I 2024-12-04 14:59:29,287] Trial 479 finished with value: 0.4883044842148246 and parameters: {'kernel_type': 'Matern', 'length_scale': 160.347402102845, 'noise_level': 0.10517437639450186, 'constant_value': 1753.783201351435, 'nu': 0.5}. Best is trial 386 with value: 0.4872991004520934.
[I 2024-12-04 14:59:29,984] Trial 483 finished with value: 1.2614543702025236 and parameters: {'kernel_type': 'RBF', 'length_scale': 0.09868620399684806, 'noise_level': 1.4188756612007666e-05, 'constant_value': 10.52456277710937, 'nu': 2.5}. Best is trial 386 with value: 0.4872991004520934.
[I 2024-12-04 14:59:30,362] Trial 485 finished with value: 0.48830269251099534 and parameters: {'kernel_type': 'Matern', 'length_scale': 1951.5095895043848, 'noise_level': 0.0639743535011684, 'constant_value': 64554.7087156967, 'nu': 0.5}. Best is trial 386 with value: 0.4872991004520934.
[I 2024-12-04 14:59:31,750] Trial 472 finished with value: 0.4883003816802555 and parameters: {'kernel_type': 'Matern', 'length_scale': 80312.7299124334, 'noise_level': 0.9276265251597597, 'constant_value': 17917.495319273406, 'nu': 0.5}. Best is trial 386 with value: 0.4872991004520934.
[I 2024-12-04 14:59:32,536] Trial 488 finished with value: 1.2401112328204391 and parameters: {'kernel_type': 'Matern', 'length_scale': 1122.1910036074094, 'noise_level': 0.002098470834471645, 'constant_value': 0.4156494448330457, 'nu': 0.5}. Best is trial 386 with value: 0.4872991004520934.
[I 2024-12-04 14:59:32,823] Trial 489 finished with value: 0.4883033755679629 and parameters: {'kernel_type': 'Matern', 'length_scale': 817.8494704210707, 'noise_level': 0.01398126775908823, 'constant_value': 352.95965760102865, 'nu': 0.5}. Best is trial 386 with value: 0.4872991004520934.
[I 2024-12-04 14:59:33,046] Trial 478 finished with value: 1.2401112325503318 and parameters: {'kernel_type': 'Matern', 'length_scale': 12178.851394700689, 'noise_level': 4.868670506019088e-10, 'constant_value': 4481.55443721483, 'nu': 2.5}. Best is trial 386 with value: 0.4872991004520934.
[I 2024-12-04 14:59:33,049] Trial 468 finished with value: 0.4883038225896071 and parameters: {'kernel_type': 'Matern', 'length_scale': 274.2227817197469, 'noise_level': 0.8911655430377777, 'constant_value': 35874.10360707717, 'nu': 0.5}. Best is trial 386 with value: 0.4872991004520934.
[I 2024-12-04 14:59:33,482] Trial 486 finished with value: 0.5273053404863848 and parameters: {'kernel_type': 'Matern', 'length_scale': 5.224454401957308, 'noise_level': 0.002614676948335508, 'constant_value': 213.152117470596, 'nu': 1.5}. Best is trial 386 with value: 0.4872991004520934.
[I 2024-12-04 14:59:33,484] Trial 473 finished with value: 1.2401112325270243 and parameters: {'kernel_type': 'Matern', 'length_scale': 919.2617279279101, 'noise_level': 0.01805980685777685, 'constant_value': 0.0007942521842990806, 'nu': 0.5}. Best is trial 386 with value: 0.4872991004520934.
[I 2024-12-04 14:59:33,956] Trial 480 finished with value: 1.2614492883430926 and parameters: {'kernel_type': 'Matern', 'length_scale': 0.4046119870361935, 'noise_level': 0.027298846363862022, 'constant_value': 27.507854420368776, 'nu': 0.5}. Best is trial 386 with value: 0.4872991004520934.
[I 2024-12-04 14:59:35,022] Trial 487 finished with value: 1.2401112332750381 and parameters: {'kernel_type': 'Matern', 'length_scale': 5920.664562449648, 'noise_level': 0.0009906859281915887, 'constant_value': 6740.457177723336, 'nu': 1.5}. Best is trial 386 with value: 0.4872991004520934.
[I 2024-12-04 14:59:35,358] Trial 497 finished with value: 0.48830340651860316 and parameters: {'kernel_type': 'Matern', 'length_scale': 15498.16401042413, 'noise_level': 0.436722137899414, 'constant_value': 2861.8503380948873, 'nu': 0.5}. Best is trial 386 with value: 0.4872991004520934.
[I 2024-12-04 14:59:35,925] Trial 484 finished with value: 0.48830341588736575 and parameters: {'kernel_type': 'Matern', 'length_scale': 1557.0493635712774, 'noise_level': 0.18614055986437916, 'constant_value': 4208.0687664674115, 'nu': 0.5}. Best is trial 386 with value: 0.4872991004520934.
[I 2024-12-04 14:59:36,506] Trial 493 finished with value: 0.4883034652178161 and parameters: {'kernel_type': 'Matern', 'length_scale': 7153.7408428410945, 'noise_level': 0.7323256932825114, 'constant_value': 4403.526923181402, 'nu': 0.5}. Best is trial 386 with value: 0.4872991004520934.
[I 2024-12-04 14:59:36,948] Trial 490 finished with value: 0.4883032935809632 and parameters: {'kernel_type': 'Matern', 'length_scale': 1721.7243961577808, 'noise_level': 0.04940865426077342, 'constant_value': 14276.608675001635, 'nu': 0.5}. Best is trial 386 with value: 0.4872991004520934.
[I 2024-12-04 14:59:37,008] Trial 496 finished with value: 0.48830341316905573 and parameters: {'kernel_type': 'Matern', 'length_scale': 30613.503726616418, 'noise_level': 0.9419061024459511, 'constant_value': 29955.979879733677, 'nu': 0.5}. Best is trial 386 with value: 0.4872991004520934.
[I 2024-12-04 14:59:37,227] Trial 494 finished with value: 0.48830342795535714 and parameters: {'kernel_type': 'Matern', 'length_scale': 54478.78022517886, 'noise_level': 0.21888574253472784, 'constant_value': 5812.886722537973, 'nu': 0.5}. Best is trial 386 with value: 0.4872991004520934.
[I 2024-12-04 14:59:37,298] Trial 492 finished with value: 1.2401112323145391 and parameters: {'kernel_type': 'RBF', 'length_scale': 1.0518286742698006e-05, 'noise_level': 0.0002173588413181901, 'constant_value': 3.520514583981812e-07, 'nu': 0.5}. Best is trial 386 with value: 0.4872991004520934.
[I 2024-12-04 14:59:38,232] Trial 482 finished with value: 1.2401112326276855 and parameters: {'kernel_type': 'Matern', 'length_scale': 1441.030709861947, 'noise_level': 0.01184462923836238, 'constant_value': 6.2415410523419865, 'nu': 0.5}. Best is trial 386 with value: 0.4872991004520934.
[I 2024-12-04 14:59:38,277] Trial 502 finished with value: 1.261454795394147 and parameters: {'kernel_type': 'Matern', 'length_scale': 175.35173293212216, 'noise_level': 0.030936367876233717, 'constant_value': 87058.18870821894, 'nu': 0.5}. Best is trial 386 with value: 0.4872991004520934.
[I 2024-12-04 14:59:38,400] Trial 498 finished with value: 1.2614547953941466 and parameters: {'kernel_type': 'Matern', 'length_scale': 48.31642038617936, 'noise_level': 0.04082887211050717, 'constant_value': 96365.66630745007, 'nu': 0.5}. Best is trial 386 with value: 0.4872991004520934.
[I 2024-12-04 14:59:38,845] Trial 491 finished with value: 0.48830341886493284 and parameters: {'kernel_type': 'Matern', 'length_scale': 6313.094938544739, 'noise_level': 0.19153383488802922, 'constant_value': 88235.8979487354, 'nu': 0.5}. Best is trial 386 with value: 0.4872991004520934.
[I 2024-12-04 14:59:39,441] Trial 499 finished with value: 0.4883034100841709 and parameters: {'kernel_type': 'Matern', 'length_scale': 92541.15346368148, 'noise_level': 0.6237745760684849, 'constant_value': 43262.15601499546, 'nu': 0.5}. Best is trial 386 with value: 0.4872991004520934.
[I 2024-12-04 14:59:39,963] Trial 495 finished with value: 0.48830340777073117 and parameters: {'kernel_type': 'Matern', 'length_scale': 13150.171625487907, 'noise_level': 0.002419030673996375, 'constant_value': 73216.91704315842, 'nu': 0.5}. Best is trial 386 with value: 0.4872991004520934.
[I 2024-12-04 14:59:41,541] Trial 500 finished with value: 0.4883034522531944 and parameters: {'kernel_type': 'Matern', 'length_scale': 21305.78897870669, 'noise_level': 0.018536896963796096, 'constant_value': 84572.01416227497, 'nu': 0.5}. Best is trial 386 with value: 0.4872991004520934.
[I 2024-12-04 14:59:43,616] Trial 504 finished with value: 1.2614543673945153 and parameters: {'kernel_type': 'Matern', 'length_scale': 0.18953091644189785, 'noise_level': 9.724342809411294e-05, 'constant_value': 57.910709143827255, 'nu': 2.5}. Best is trial 386 with value: 0.4872991004520934.
[I 2024-12-04 14:59:44,739] Trial 510 finished with value: 0.4883034228262921 and parameters: {'kernel_type': 'Matern', 'length_scale': 5786.483460859257, 'noise_level': 0.00865850572103651, 'constant_value': 56924.779391589545, 'nu': 0.5}. Best is trial 386 with value: 0.4872991004520934.
[I 2024-12-04 14:59:46,618] Trial 506 finished with value: 0.488303401449369 and parameters: {'kernel_type': 'Matern', 'length_scale': 95787.23625199287, 'noise_level': 0.8559669850052266, 'constant_value': 1024.90349548535, 'nu': 0.5}. Best is trial 386 with value: 0.4872991004520934.
[I 2024-12-04 14:59:46,674] Trial 505 finished with value: 0.4883034300367744 and parameters: {'kernel_type': 'Matern', 'length_scale': 65527.98494995328, 'noise_level': 0.8270430754629324, 'constant_value': 39722.80418596088, 'nu': 0.5}. Best is trial 386 with value: 0.4872991004520934.
[I 2024-12-04 14:59:46,867] Trial 501 finished with value: 0.5663937149423107 and parameters: {'kernel_type': 'Matern', 'length_scale': 435.76838479032585, 'noise_level': 0.8349623705624628, 'constant_value': 29737.525148319026, 'nu': 2.5}. Best is trial 386 with value: 0.4872991004520934.
[I 2024-12-04 14:59:47,287] Trial 508 finished with value: 1.261454795394147 and parameters: {'kernel_type': 'Matern', 'length_scale': 6782.989766363067, 'noise_level': 0.037841069978551065, 'constant_value': 90233.66492309916, 'nu': 0.5}. Best is trial 386 with value: 0.4872991004520934.
[I 2024-12-04 14:59:47,896] Trial 514 finished with value: 0.48830648460458653 and parameters: {'kernel_type': 'Matern', 'length_scale': 1209.169703048928, 'noise_level': 0.0038930243293939706, 'constant_value': 74826.51890368864, 'nu': 0.5}. Best is trial 386 with value: 0.4872991004520934.
[I 2024-12-04 14:59:47,903] Trial 509 finished with value: 0.4883034186597347 and parameters: {'kernel_type': 'Matern', 'length_scale': 37496.89455650823, 'noise_level': 0.005929953563030228, 'constant_value': 1637.8139469074388, 'nu': 0.5}. Best is trial 386 with value: 0.4872991004520934.
[I 2024-12-04 14:59:48,143] Trial 507 finished with value: 0.48830337534299856 and parameters: {'kernel_type': 'Matern', 'length_scale': 77893.26108655822, 'noise_level': 0.003943153888292988, 'constant_value': 79995.4356985992, 'nu': 0.5}. Best is trial 386 with value: 0.4872991004520934.
[I 2024-12-04 14:59:48,891] Trial 503 finished with value: 0.48830342036222707 and parameters: {'kernel_type': 'Matern', 'length_scale': 305.5821177035664, 'noise_level': 0.014595907705575123, 'constant_value': 1644.4040688394482, 'nu': 0.5}. Best is trial 386 with value: 0.4872991004520934.
[I 2024-12-04 14:59:49,656] Trial 518 finished with value: 0.4883034203456425 and parameters: {'kernel_type': 'Matern', 'length_scale': 1080.3538066743558, 'noise_level': 0.04211732973964684, 'constant_value': 53556.6848747719, 'nu': 0.5}. Best is trial 386 with value: 0.4872991004520934.
[I 2024-12-04 14:59:49,769] Trial 515 finished with value: 1.2614543702029393 and parameters: {'kernel_type': 'Matern', 'length_scale': 0.002896085123618178, 'noise_level': 1.9646306069205076e-07, 'constant_value': 1.4721202448922857, 'nu': 0.5}. Best is trial 386 with value: 0.4872991004520934.
[I 2024-12-04 14:59:49,772] Trial 511 finished with value: 0.4883034028247203 and parameters: {'kernel_type': 'Matern', 'length_scale': 1953.1806564447218, 'noise_level': 0.04531957285581742, 'constant_value': 87952.15785410212, 'nu': 0.5}. Best is trial 386 with value: 0.4872991004520934.
[I 2024-12-04 14:59:51,088] Trial 513 finished with value: 0.4883033973356664 and parameters: {'kernel_type': 'Matern', 'length_scale': 7184.733788155652, 'noise_level': 0.012861374987818383, 'constant_value': 274.4740313731441, 'nu': 0.5}. Best is trial 386 with value: 0.4872991004520934.
[I 2024-12-04 14:59:51,239] Trial 512 finished with value: 0.4883034145362727 and parameters: {'kernel_type': 'Matern', 'length_scale': 13930.261401321692, 'noise_level': 0.03885679126157322, 'constant_value': 85753.17415278054, 'nu': 0.5}. Best is trial 386 with value: 0.4872991004520934.
[I 2024-12-04 14:59:51,795] Trial 516 finished with value: 1.2401112325787391 and parameters: {'kernel_type': 'Matern', 'length_scale': 23685.082798012645, 'noise_level': 1.0768687036488884e-10, 'constant_value': 0.047950746126601974, 'nu': 0.5}. Best is trial 386 with value: 0.4872991004520934.
[I 2024-12-04 14:59:52,062] Trial 524 finished with value: 0.4883034201474525 and parameters: {'kernel_type': 'Matern', 'length_scale': 19226.25827274914, 'noise_level': 0.9093595362775901, 'constant_value': 76370.0792480511, 'nu': 0.5}. Best is trial 386 with value: 0.4872991004520934.
[I 2024-12-04 14:59:52,497] Trial 520 finished with value: 0.48830343284114086 and parameters: {'kernel_type': 'Matern', 'length_scale': 917.1858198180696, 'noise_level': 0.6601737247684878, 'constant_value': 15574.812903755621, 'nu': 0.5}. Best is trial 386 with value: 0.4872991004520934.
[I 2024-12-04 14:59:52,781] Trial 521 finished with value: 1.2401112318819667 and parameters: {'kernel_type': 'RBF', 'length_scale': 0.001870768513798282, 'noise_level': 0.20651557695814696, 'constant_value': 1.4983009421906675, 'nu': 1.5}. Best is trial 386 with value: 0.4872991004520934.
[I 2024-12-04 14:59:52,931] Trial 523 finished with value: 0.4883032158903113 and parameters: {'kernel_type': 'Matern', 'length_scale': 96.63402192102483, 'noise_level': 0.0006997624104039382, 'constant_value': 30048.60926816139, 'nu': 0.5}. Best is trial 386 with value: 0.4872991004520934.
[I 2024-12-04 14:59:52,939] Trial 517 finished with value: 0.48830345963019584 and parameters: {'kernel_type': 'Matern', 'length_scale': 73884.55093577468, 'noise_level': 0.01857016636158111, 'constant_value': 62714.39420864677, 'nu': 0.5}. Best is trial 386 with value: 0.4872991004520934.
[I 2024-12-04 14:59:55,365] Trial 530 finished with value: 0.4883034086564011 and parameters: {'kernel_type': 'Matern', 'length_scale': 93504.2214036809, 'noise_level': 0.0028263333268507954, 'constant_value': 2365.9999803693204, 'nu': 0.5}. Best is trial 386 with value: 0.4872991004520934.
[I 2024-12-04 14:59:56,813] Trial 527 finished with value: 1.2614547976352444 and parameters: {'kernel_type': 'Matern', 'length_scale': 51450.68201711642, 'noise_level': 0.0006056766527246669, 'constant_value': 2.1680818157952876e-07, 'nu': 2.5}. Best is trial 386 with value: 0.4872991004520934.
