[I 2024-12-04 20:18:13,973] Trial 1466 finished with value: 1.3212286757090923 and parameters: {'n_estimators': 701, 'max_depth': 20, 'min_samples_split': 2, 'min_samples_leaf': 4, 'max_features': 'log2', 'bootstrap': True, 'criterion': 'absolute_error'}. Best is trial 874 with value: 0.32176430753353746.
[I 2024-12-04 20:18:15,664] Trial 1467 finished with value: 0.3282120580338851 and parameters: {'n_estimators': 501, 'max_depth': 50, 'min_samples_split': 2, 'min_samples_leaf': 1, 'max_features': 'sqrt', 'bootstrap': False, 'criterion': 'squared_error'}. Best is trial 874 with value: 0.32176430753353746.
[I 2024-12-04 20:18:16,009] Trial 1470 finished with value: 0.6703529389078952 and parameters: {'n_estimators': 360, 'max_depth': 50, 'min_samples_split': 2, 'min_samples_leaf': 2, 'max_features': 'sqrt', 'bootstrap': False, 'criterion': 'squared_error'}. Best is trial 874 with value: 0.32176430753353746.
[I 2024-12-04 20:18:16,138] Trial 1469 finished with value: 1.2349190061912907 and parameters: {'n_estimators': 662, 'max_depth': 23, 'min_samples_split': 13, 'min_samples_leaf': 3, 'max_features': 'log2', 'bootstrap': True, 'criterion': 'squared_error'}. Best is trial 874 with value: 0.32176430753353746.
[I 2024-12-04 20:18:17,739] Trial 1472 finished with value: 0.6665083472103499 and parameters: {'n_estimators': 352, 'max_depth': 50, 'min_samples_split': 2, 'min_samples_leaf': 2, 'max_features': 'sqrt', 'bootstrap': False, 'criterion': 'squared_error'}. Best is trial 874 with value: 0.32176430753353746.
[I 2024-12-04 20:18:17,807] Trial 1471 finished with value: 0.3874845445630392 and parameters: {'n_estimators': 373, 'max_depth': 41, 'min_samples_split': 3, 'min_samples_leaf': 1, 'max_features': 'sqrt', 'bootstrap': False, 'criterion': 'squared_error'}. Best is trial 874 with value: 0.32176430753353746.
[I 2024-12-04 20:18:18,302] Trial 1473 finished with value: 0.34525003431060913 and parameters: {'n_estimators': 254, 'max_depth': 43, 'min_samples_split': 2, 'min_samples_leaf': 1, 'max_features': 'sqrt', 'bootstrap': False, 'criterion': 'squared_error'}. Best is trial 874 with value: 0.32176430753353746.
[I 2024-12-04 20:18:20,223] Trial 1474 finished with value: 0.34558821784683763 and parameters: {'n_estimators': 318, 'max_depth': 43, 'min_samples_split': 2, 'min_samples_leaf': 1, 'max_features': 'sqrt', 'bootstrap': False, 'criterion': 'squared_error'}. Best is trial 874 with value: 0.32176430753353746.
[I 2024-12-04 20:18:20,285] Trial 1476 finished with value: 0.4072477242177531 and parameters: {'n_estimators': 283, 'max_depth': 43, 'min_samples_split': 4, 'min_samples_leaf': 1, 'max_features': 'sqrt', 'bootstrap': False, 'criterion': 'squared_error'}. Best is trial 874 with value: 0.32176430753353746.
[I 2024-12-04 20:18:20,290] Trial 1475 finished with value: 1.3475628358526017 and parameters: {'n_estimators': 830, 'max_depth': 33, 'min_samples_split': 14, 'min_samples_leaf': 15, 'max_features': 'log2', 'bootstrap': True, 'criterion': 'absolute_error'}. Best is trial 874 with value: 0.32176430753353746.
[I 2024-12-04 20:18:22,063] Trial 1477 finished with value: 0.38555454504398623 and parameters: {'n_estimators': 275, 'max_depth': 50, 'min_samples_split': 4, 'min_samples_leaf': 1, 'max_features': 'sqrt', 'bootstrap': False, 'criterion': 'squared_error'}. Best is trial 874 with value: 0.32176430753353746.
[I 2024-12-04 20:18:23,781] Trial 1478 finished with value: 0.3280097600123337 and parameters: {'n_estimators': 569, 'max_depth': 50, 'min_samples_split': 2, 'min_samples_leaf': 1, 'max_features': 'sqrt', 'bootstrap': False, 'criterion': 'squared_error'}. Best is trial 874 with value: 0.32176430753353746.
[I 2024-12-04 20:18:25,614] Trial 1481 finished with value: 0.323547281469707 and parameters: {'n_estimators': 328, 'max_depth': 50, 'min_samples_split': 2, 'min_samples_leaf': 1, 'max_features': 'sqrt', 'bootstrap': False, 'criterion': 'squared_error'}. Best is trial 874 with value: 0.32176430753353746.
[I 2024-12-04 20:18:26,882] Trial 1482 finished with value: 1.0686739923261952 and parameters: {'n_estimators': 592, 'max_depth': 49, 'min_samples_split': 2, 'min_samples_leaf': 2, 'max_features': 'log2', 'bootstrap': False, 'criterion': 'squared_error'}. Best is trial 874 with value: 0.32176430753353746.
[I 2024-12-04 20:18:26,950] Trial 1480 finished with value: 0.42582718533293595 and parameters: {'n_estimators': 566, 'max_depth': 47, 'min_samples_split': 4, 'min_samples_leaf': 1, 'max_features': None, 'bootstrap': False, 'criterion': 'squared_error'}. Best is trial 874 with value: 0.32176430753353746.
[I 2024-12-04 20:18:28,362] Trial 1483 finished with value: 1.0891983623599837 and parameters: {'n_estimators': 505, 'max_depth': 6, 'min_samples_split': 21, 'min_samples_leaf': 1, 'max_features': 'sqrt', 'bootstrap': False, 'criterion': 'squared_error'}. Best is trial 874 with value: 0.32176430753353746.
[I 2024-12-04 20:18:29,444] Trial 1484 finished with value: 0.3668935761998502 and parameters: {'n_estimators': 470, 'max_depth': 50, 'min_samples_split': 3, 'min_samples_leaf': 1, 'max_features': 'sqrt', 'bootstrap': False, 'criterion': 'squared_error'}. Best is trial 874 with value: 0.32176430753353746.
[I 2024-12-04 20:18:30,591] Trial 1485 finished with value: 0.34628975873012824 and parameters: {'n_estimators': 349, 'max_depth': 43, 'min_samples_split': 2, 'min_samples_leaf': 1, 'max_features': 'sqrt', 'bootstrap': False, 'criterion': 'squared_error'}. Best is trial 874 with value: 0.32176430753353746.
[I 2024-12-04 20:18:31,910] Trial 1486 finished with value: 1.3323590968147903 and parameters: {'n_estimators': 937, 'max_depth': 11, 'min_samples_split': 2, 'min_samples_leaf': 6, 'max_features': 'log2', 'bootstrap': True, 'criterion': 'absolute_error'}. Best is trial 874 with value: 0.32176430753353746.
[I 2024-12-04 20:18:32,492] Trial 1487 finished with value: 0.49785105703562915 and parameters: {'n_estimators': 542, 'max_depth': 50, 'min_samples_split': 9, 'min_samples_leaf': 1, 'max_features': 'sqrt', 'bootstrap': False, 'criterion': 'squared_error'}. Best is trial 874 with value: 0.32176430753353746.
[I 2024-12-04 20:18:34,045] Trial 1489 finished with value: 0.3869326583581918 and parameters: {'n_estimators': 292, 'max_depth': 42, 'min_samples_split': 3, 'min_samples_leaf': 1, 'max_features': 'sqrt', 'bootstrap': False, 'criterion': 'squared_error'}. Best is trial 874 with value: 0.32176430753353746.
[I 2024-12-04 20:18:35,490] Trial 1490 finished with value: 0.3840789144792058 and parameters: {'n_estimators': 320, 'max_depth': 50, 'min_samples_split': 4, 'min_samples_leaf': 1, 'max_features': 'sqrt', 'bootstrap': False, 'criterion': 'squared_error'}. Best is trial 874 with value: 0.32176430753353746.
[I 2024-12-04 20:18:35,564] Trial 1488 finished with value: 0.4272230004788841 and parameters: {'n_estimators': 387, 'max_depth': 50, 'min_samples_split': 4, 'min_samples_leaf': 1, 'max_features': None, 'bootstrap': False, 'criterion': 'squared_error'}. Best is trial 874 with value: 0.32176430753353746.
[I 2024-12-04 20:18:37,240] Trial 1491 finished with value: 0.6866825146851132 and parameters: {'n_estimators': 530, 'max_depth': 43, 'min_samples_split': 4, 'min_samples_leaf': 2, 'max_features': 'sqrt', 'bootstrap': False, 'criterion': 'squared_error'}. Best is trial 874 with value: 0.32176430753353746.
[I 2024-12-04 20:18:38,057] Trial 1492 finished with value: 0.32355801632855424 and parameters: {'n_estimators': 362, 'max_depth': 50, 'min_samples_split': 2, 'min_samples_leaf': 1, 'max_features': 'sqrt', 'bootstrap': False, 'criterion': 'squared_error'}. Best is trial 874 with value: 0.32176430753353746.
[I 2024-12-04 20:18:39,311] Trial 1493 finished with value: 0.5402392649950297 and parameters: {'n_estimators': 512, 'max_depth': 50, 'min_samples_split': 3, 'min_samples_leaf': 1, 'max_features': 'log2', 'bootstrap': False, 'criterion': 'squared_error'}. Best is trial 874 with value: 0.32176430753353746.
[I 2024-12-04 20:18:39,610] Trial 1494 finished with value: 0.3844915096177595 and parameters: {'n_estimators': 331, 'max_depth': 50, 'min_samples_split': 4, 'min_samples_leaf': 1, 'max_features': 'sqrt', 'bootstrap': False, 'criterion': 'squared_error'}. Best is trial 874 with value: 0.32176430753353746.
[I 2024-12-04 20:18:40,694] Trial 1495 finished with value: 0.6555648926458091 and parameters: {'n_estimators': 294, 'max_depth': 50, 'min_samples_split': 2, 'min_samples_leaf': 2, 'max_features': 'sqrt', 'bootstrap': False, 'criterion': 'squared_error'}. Best is trial 874 with value: 0.32176430753353746.
[I 2024-12-04 20:18:41,691] Trial 1497 finished with value: 1.2751075253801278 and parameters: {'n_estimators': 391, 'max_depth': 49, 'min_samples_split': 2, 'min_samples_leaf': 14, 'max_features': 'log2', 'bootstrap': False, 'criterion': 'squared_error'}. Best is trial 874 with value: 0.32176430753353746.
[I 2024-12-04 20:18:41,698] Trial 1496 finished with value: 0.48455993505498296 and parameters: {'n_estimators': 497, 'max_depth': 32, 'min_samples_split': 4, 'min_samples_leaf': 1, 'max_features': 'sqrt', 'bootstrap': False, 'criterion': 'squared_error'}. Best is trial 874 with value: 0.32176430753353746.
[I 2024-12-04 20:18:44,143] Trial 1498 finished with value: 0.3482683300720088 and parameters: {'n_estimators': 399, 'max_depth': 44, 'min_samples_split': 2, 'min_samples_leaf': 1, 'max_features': 'sqrt', 'bootstrap': False, 'criterion': 'squared_error'}. Best is trial 874 with value: 0.32176430753353746.
[I 2024-12-04 20:18:44,296] Trial 1499 finished with value: 0.3245307017075229 and parameters: {'n_estimators': 432, 'max_depth': 50, 'min_samples_split': 2, 'min_samples_leaf': 1, 'max_features': 'sqrt', 'bootstrap': False, 'criterion': 'squared_error'}. Best is trial 874 with value: 0.32176430753353746.
[I 2024-12-04 20:18:45,685] Trial 1500 finished with value: 0.3571043459829578 and parameters: {'n_estimators': 263, 'max_depth': 50, 'min_samples_split': 3, 'min_samples_leaf': 1, 'max_features': 'sqrt', 'bootstrap': False, 'criterion': 'squared_error'}. Best is trial 874 with value: 0.32176430753353746.
[I 2024-12-04 20:18:46,245] Trial 1501 finished with value: 0.3434414716147236 and parameters: {'n_estimators': 282, 'max_depth': 43, 'min_samples_split': 2, 'min_samples_leaf': 1, 'max_features': 'sqrt', 'bootstrap': False, 'criterion': 'squared_error'}. Best is trial 874 with value: 0.32176430753353746.
[I 2024-12-04 20:18:47,653] Trial 1502 finished with value: 0.3244407680139701 and parameters: {'n_estimators': 286, 'max_depth': 50, 'min_samples_split': 2, 'min_samples_leaf': 1, 'max_features': 'sqrt', 'bootstrap': False, 'criterion': 'squared_error'}. Best is trial 874 with value: 0.32176430753353746.
[I 2024-12-04 20:18:49,007] Trial 1503 finished with value: 0.32730437541277996 and parameters: {'n_estimators': 516, 'max_depth': 50, 'min_samples_split': 2, 'min_samples_leaf': 1, 'max_features': 'sqrt', 'bootstrap': False, 'criterion': 'squared_error'}. Best is trial 874 with value: 0.32176430753353746.
[I 2024-12-04 20:18:50,693] Trial 1504 finished with value: 0.43586350888781483 and parameters: {'n_estimators': 273, 'max_depth': 39, 'min_samples_split': 2, 'min_samples_leaf': 1, 'max_features': None, 'bootstrap': False, 'criterion': 'squared_error'}. Best is trial 874 with value: 0.32176430753353746.
[I 2024-12-04 20:18:51,030] Trial 1505 finished with value: 0.4176818884851132 and parameters: {'n_estimators': 549, 'max_depth': 42, 'min_samples_split': 4, 'min_samples_leaf': 1, 'max_features': 'sqrt', 'bootstrap': False, 'criterion': 'squared_error'}. Best is trial 874 with value: 0.32176430753353746.
[I 2024-12-04 20:18:52,585] Trial 1506 finished with value: 0.5268403645412381 and parameters: {'n_estimators': 502, 'max_depth': 39, 'min_samples_split': 5, 'min_samples_leaf': 1, 'max_features': 'sqrt', 'bootstrap': True, 'criterion': 'squared_error'}. Best is trial 874 with value: 0.32176430753353746.
[I 2024-12-04 20:18:53,379] Trial 1507 finished with value: 0.3235015797135766 and parameters: {'n_estimators': 360, 'max_depth': 50, 'min_samples_split': 2, 'min_samples_leaf': 1, 'max_features': 'sqrt', 'bootstrap': False, 'criterion': 'squared_error'}. Best is trial 874 with value: 0.32176430753353746.
[I 2024-12-04 20:18:54,754] Trial 1509 finished with value: 0.6886780449414948 and parameters: {'n_estimators': 424, 'max_depth': 43, 'min_samples_split': 2, 'min_samples_leaf': 2, 'max_features': 'sqrt', 'bootstrap': False, 'criterion': 'squared_error'}. Best is trial 874 with value: 0.32176430753353746.
[I 2024-12-04 20:18:55,284] Trial 1508 finished with value: 0.3632570456179719 and parameters: {'n_estimators': 517, 'max_depth': 41, 'min_samples_split': 2, 'min_samples_leaf': 1, 'max_features': 'sqrt', 'bootstrap': False, 'criterion': 'squared_error'}. Best is trial 874 with value: 0.32176430753353746.
[I 2024-12-04 20:18:56,677] Trial 1510 finished with value: 0.41055977117271913 and parameters: {'n_estimators': 358, 'max_depth': 43, 'min_samples_split': 4, 'min_samples_leaf': 1, 'max_features': 'sqrt', 'bootstrap': False, 'criterion': 'squared_error'}. Best is trial 874 with value: 0.32176430753353746.
[I 2024-12-04 20:18:57,151] Trial 1511 finished with value: 0.3854175600115222 and parameters: {'n_estimators': 344, 'max_depth': 50, 'min_samples_split': 4, 'min_samples_leaf': 1, 'max_features': 'sqrt', 'bootstrap': False, 'criterion': 'squared_error'}. Best is trial 874 with value: 0.32176430753353746.
[I 2024-12-04 20:18:58,566] Trial 1512 finished with value: 0.3242568274330358 and parameters: {'n_estimators': 288, 'max_depth': 50, 'min_samples_split': 2, 'min_samples_leaf': 1, 'max_features': 'sqrt', 'bootstrap': False, 'criterion': 'squared_error'}. Best is trial 874 with value: 0.32176430753353746.
[I 2024-12-04 20:18:59,049] Trial 1513 finished with value: 0.32504112217435555 and parameters: {'n_estimators': 268, 'max_depth': 50, 'min_samples_split': 2, 'min_samples_leaf': 1, 'max_features': 'sqrt', 'bootstrap': False, 'criterion': 'squared_error'}. Best is trial 874 with value: 0.32176430753353746.
[I 2024-12-04 20:18:59,883] Trial 1514 finished with value: 0.6666538836234163 and parameters: {'n_estimators': 229, 'max_depth': 50, 'min_samples_split': 4, 'min_samples_leaf': 2, 'max_features': 'sqrt', 'bootstrap': False, 'criterion': 'squared_error'}. Best is trial 874 with value: 0.32176430753353746.
[I 2024-12-04 20:19:01,448] Trial 1515 finished with value: 0.3221053321576918 and parameters: {'n_estimators': 371, 'max_depth': 50, 'min_samples_split': 2, 'min_samples_leaf': 1, 'max_features': 'sqrt', 'bootstrap': False, 'criterion': 'squared_error'}. Best is trial 874 with value: 0.32176430753353746.
[I 2024-12-04 20:19:01,784] Trial 1516 finished with value: 1.3395790796381133 and parameters: {'n_estimators': 941, 'max_depth': 50, 'min_samples_split': 20, 'min_samples_leaf': 12, 'max_features': 'log2', 'bootstrap': False, 'criterion': 'absolute_error'}. Best is trial 874 with value: 0.32176430753353746.
[I 2024-12-04 20:19:03,123] Trial 1517 finished with value: 0.4540071828582979 and parameters: {'n_estimators': 338, 'max_depth': 48, 'min_samples_split': 4, 'min_samples_leaf': 1, 'max_features': 'sqrt', 'bootstrap': True, 'criterion': 'squared_error'}. Best is trial 874 with value: 0.32176430753353746.
[I 2024-12-04 20:19:03,654] Trial 1518 finished with value: 0.3871057330903949 and parameters: {'n_estimators': 396, 'max_depth': 50, 'min_samples_split': 4, 'min_samples_leaf': 1, 'max_features': 'sqrt', 'bootstrap': False, 'criterion': 'squared_error'}. Best is trial 874 with value: 0.32176430753353746.
[I 2024-12-04 20:19:05,173] Trial 1520 finished with value: 0.6931480188171077 and parameters: {'n_estimators': 464, 'max_depth': 44, 'min_samples_split': 4, 'min_samples_leaf': 2, 'max_features': 'sqrt', 'bootstrap': False, 'criterion': 'squared_error'}. Best is trial 874 with value: 0.32176430753353746.
[I 2024-12-04 20:19:05,437] Trial 1519 finished with value: 0.5567442015496128 and parameters: {'n_estimators': 380, 'max_depth': 9, 'min_samples_split': 17, 'min_samples_leaf': 3, 'max_features': None, 'bootstrap': False, 'criterion': 'squared_error'}. Best is trial 874 with value: 0.32176430753353746.
[I 2024-12-04 20:19:06,702] Trial 1521 finished with value: 0.7847700801359192 and parameters: {'n_estimators': 318, 'max_depth': 43, 'min_samples_split': 2, 'min_samples_leaf': 2, 'max_features': 'sqrt', 'bootstrap': True, 'criterion': 'squared_error'}. Best is trial 874 with value: 0.32176430753353746.
[I 2024-12-04 20:19:07,289] Trial 1522 finished with value: 0.6759119318264215 and parameters: {'n_estimators': 558, 'max_depth': 50, 'min_samples_split': 2, 'min_samples_leaf': 2, 'max_features': 'sqrt', 'bootstrap': False, 'criterion': 'squared_error'}. Best is trial 874 with value: 0.32176430753353746.
[I 2024-12-04 20:19:08,896] Trial 1523 finished with value: 0.3658121227627695 and parameters: {'n_estimators': 442, 'max_depth': 50, 'min_samples_split': 3, 'min_samples_leaf': 1, 'max_features': 'sqrt', 'bootstrap': False, 'criterion': 'squared_error'}. Best is trial 874 with value: 0.32176430753353746.
[I 2024-12-04 20:19:10,008] Trial 1525 finished with value: 0.6168567233935668 and parameters: {'n_estimators': 177, 'max_depth': 41, 'min_samples_split': 3, 'min_samples_leaf': 1, 'max_features': 'log2', 'bootstrap': False, 'criterion': 'squared_error'}. Best is trial 874 with value: 0.32176430753353746.
[I 2024-12-04 20:19:10,171] Trial 1524 finished with value: 0.3512366733846054 and parameters: {'n_estimators': 579, 'max_depth': 43, 'min_samples_split': 2, 'min_samples_leaf': 1, 'max_features': 'sqrt', 'bootstrap': False, 'criterion': 'squared_error'}. Best is trial 874 with value: 0.32176430753353746.
[I 2024-12-04 20:19:11,415] Trial 1526 finished with value: 0.6739239873348507 and parameters: {'n_estimators': 370, 'max_depth': 50, 'min_samples_split': 3, 'min_samples_leaf': 2, 'max_features': 'sqrt', 'bootstrap': False, 'criterion': 'squared_error'}. Best is trial 874 with value: 0.32176430753353746.
[I 2024-12-04 20:19:11,483] Trial 1527 finished with value: 0.6595120714577776 and parameters: {'n_estimators': 280, 'max_depth': 50, 'min_samples_split': 2, 'min_samples_leaf': 2, 'max_features': 'sqrt', 'bootstrap': False, 'criterion': 'squared_error'}. Best is trial 874 with value: 0.32176430753353746.
[I 2024-12-04 20:19:13,317] Trial 1529 finished with value: 1.2209831746176547 and parameters: {'n_estimators': 705, 'max_depth': 10, 'min_samples_split': 5, 'min_samples_leaf': 11, 'max_features': 'sqrt', 'bootstrap': True, 'criterion': 'squared_error'}. Best is trial 874 with value: 0.32176430753353746.
[I 2024-12-04 20:19:14,704] Trial 1528 finished with value: 0.3273602170193953 and parameters: {'n_estimators': 588, 'max_depth': 50, 'min_samples_split': 2, 'min_samples_leaf': 1, 'max_features': 'sqrt', 'bootstrap': False, 'criterion': 'squared_error'}. Best is trial 874 with value: 0.32176430753353746.
[I 2024-12-04 20:19:15,791] Trial 1530 finished with value: 0.32854986135059616 and parameters: {'n_estimators': 460, 'max_depth': 50, 'min_samples_split': 2, 'min_samples_leaf': 1, 'max_features': 'sqrt', 'bootstrap': False, 'criterion': 'squared_error'}. Best is trial 874 with value: 0.32176430753353746.
[I 2024-12-04 20:19:16,955] Trial 1531 finished with value: 0.3488615948145862 and parameters: {'n_estimators': 398, 'max_depth': 43, 'min_samples_split': 2, 'min_samples_leaf': 1, 'max_features': 'sqrt', 'bootstrap': False, 'criterion': 'squared_error'}. Best is trial 874 with value: 0.32176430753353746.
[I 2024-12-04 20:19:17,672] Trial 1532 finished with value: 0.39129694523872743 and parameters: {'n_estimators': 375, 'max_depth': 42, 'min_samples_split': 3, 'min_samples_leaf': 1, 'max_features': 'sqrt', 'bootstrap': False, 'criterion': 'squared_error'}. Best is trial 874 with value: 0.32176430753353746.
[I 2024-12-04 20:19:18,414] Trial 1533 finished with value: 0.6666605303630969 and parameters: {'n_estimators': 328, 'max_depth': 50, 'min_samples_split': 3, 'min_samples_leaf': 2, 'max_features': 'sqrt', 'bootstrap': False, 'criterion': 'squared_error'}. Best is trial 874 with value: 0.32176430753353746.
[I 2024-12-04 20:19:19,778] Trial 1534 finished with value: 0.3235267978441661 and parameters: {'n_estimators': 332, 'max_depth': 50, 'min_samples_split': 2, 'min_samples_leaf': 1, 'max_features': 'sqrt', 'bootstrap': False, 'criterion': 'squared_error'}. Best is trial 874 with value: 0.32176430753353746.
[I 2024-12-04 20:19:20,698] Trial 1535 finished with value: 0.35122751899655197 and parameters: {'n_estimators': 414, 'max_depth': 43, 'min_samples_split': 2, 'min_samples_leaf': 1, 'max_features': 'sqrt', 'bootstrap': False, 'criterion': 'squared_error'}. Best is trial 874 with value: 0.32176430753353746.
[I 2024-12-04 20:19:21,685] Trial 1536 finished with value: 0.32463168002449716 and parameters: {'n_estimators': 292, 'max_depth': 50, 'min_samples_split': 2, 'min_samples_leaf': 1, 'max_features': 'sqrt', 'bootstrap': False, 'criterion': 'squared_error'}. Best is trial 874 with value: 0.32176430753353746.
[I 2024-12-04 20:19:22,162] Trial 1537 finished with value: 0.3785850381038727 and parameters: {'n_estimators': 248, 'max_depth': 44, 'min_samples_split': 3, 'min_samples_leaf': 1, 'max_features': 'sqrt', 'bootstrap': False, 'criterion': 'squared_error'}. Best is trial 874 with value: 0.32176430753353746.
[I 2024-12-04 20:19:22,889] Trial 1538 finished with value: 1.2498079858527673 and parameters: {'n_estimators': 434, 'max_depth': 11, 'min_samples_split': 8, 'min_samples_leaf': 6, 'max_features': 'log2', 'bootstrap': False, 'criterion': 'squared_error'}. Best is trial 874 with value: 0.32176430753353746.
