[I 2024-12-04 20:15:38,108] Trial 1327 finished with value: 0.37383633748954503 and parameters: {'n_estimators': 418, 'max_depth': 50, 'min_samples_split': 2, 'min_samples_leaf': 1, 'max_features': 'sqrt', 'bootstrap': True, 'criterion': 'squared_error'}. Best is trial 874 with value: 0.32176430753353746.
[I 2024-12-04 20:15:38,579] Trial 1326 finished with value: 0.3293902338927606 and parameters: {'n_estimators': 475, 'max_depth': 50, 'min_samples_split': 2, 'min_samples_leaf': 1, 'max_features': 'sqrt', 'bootstrap': False, 'criterion': 'squared_error'}. Best is trial 874 with value: 0.32176430753353746.
[I 2024-12-04 20:15:40,115] Trial 1328 finished with value: 0.39690213768519367 and parameters: {'n_estimators': 446, 'max_depth': 41, 'min_samples_split': 3, 'min_samples_leaf': 1, 'max_features': 'sqrt', 'bootstrap': False, 'criterion': 'squared_error'}. Best is trial 874 with value: 0.32176430753353746.
[I 2024-12-04 20:15:40,924] Trial 1329 finished with value: 0.32223445889143093 and parameters: {'n_estimators': 372, 'max_depth': 50, 'min_samples_split': 2, 'min_samples_leaf': 1, 'max_features': 'sqrt', 'bootstrap': False, 'criterion': 'squared_error'}. Best is trial 874 with value: 0.32176430753353746.
[I 2024-12-04 20:15:41,758] Trial 1330 finished with value: 0.7515366259744181 and parameters: {'n_estimators': 518, 'max_depth': 47, 'min_samples_split': 11, 'min_samples_leaf': 2, 'max_features': 'sqrt', 'bootstrap': False, 'criterion': 'squared_error'}. Best is trial 874 with value: 0.32176430753353746.
[I 2024-12-04 20:15:43,174] Trial 1331 finished with value: 0.3492284629982575 and parameters: {'n_estimators': 411, 'max_depth': 42, 'min_samples_split': 2, 'min_samples_leaf': 1, 'max_features': 'sqrt', 'bootstrap': False, 'criterion': 'squared_error'}. Best is trial 874 with value: 0.32176430753353746.
[I 2024-12-04 20:15:43,652] Trial 1332 finished with value: 0.34649588914928947 and parameters: {'n_estimators': 338, 'max_depth': 42, 'min_samples_split': 2, 'min_samples_leaf': 1, 'max_features': 'sqrt', 'bootstrap': False, 'criterion': 'squared_error'}. Best is trial 874 with value: 0.32176430753353746.
[I 2024-12-04 20:15:44,842] Trial 1333 finished with value: 0.6901234989305581 and parameters: {'n_estimators': 491, 'max_depth': 50, 'min_samples_split': 2, 'min_samples_leaf': 2, 'max_features': 'sqrt', 'bootstrap': False, 'criterion': 'squared_error'}. Best is trial 874 with value: 0.32176430753353746.
[I 2024-12-04 20:15:45,328] Trial 1334 finished with value: 0.3838706123322496 and parameters: {'n_estimators': 298, 'max_depth': 50, 'min_samples_split': 4, 'min_samples_leaf': 1, 'max_features': 'sqrt', 'bootstrap': False, 'criterion': 'squared_error'}. Best is trial 874 with value: 0.32176430753353746.
[I 2024-12-04 20:15:47,339] Trial 1335 finished with value: 0.3288512324323899 and parameters: {'n_estimators': 465, 'max_depth': 50, 'min_samples_split': 2, 'min_samples_leaf': 1, 'max_features': 'sqrt', 'bootstrap': False, 'criterion': 'squared_error'}. Best is trial 874 with value: 0.32176430753353746.
[I 2024-12-04 20:15:47,755] Trial 1336 finished with value: 0.32814906184384507 and parameters: {'n_estimators': 441, 'max_depth': 50, 'min_samples_split': 2, 'min_samples_leaf': 1, 'max_features': 'sqrt', 'bootstrap': False, 'criterion': 'squared_error'}. Best is trial 874 with value: 0.32176430753353746.
[I 2024-12-04 20:15:49,099] Trial 1337 finished with value: 0.41108407576712497 and parameters: {'n_estimators': 380, 'max_depth': 42, 'min_samples_split': 4, 'min_samples_leaf': 1, 'max_features': 'sqrt', 'bootstrap': False, 'criterion': 'squared_error'}. Best is trial 874 with value: 0.32176430753353746.
[I 2024-12-04 20:15:49,229] Trial 1338 finished with value: 0.6916946177748857 and parameters: {'n_estimators': 452, 'max_depth': 50, 'min_samples_split': 2, 'min_samples_leaf': 2, 'max_features': 'sqrt', 'bootstrap': False, 'criterion': 'squared_error'}. Best is trial 874 with value: 0.32176430753353746.
[I 2024-12-04 20:15:51,093] Trial 1340 finished with value: 0.32354571284096106 and parameters: {'n_estimators': 262, 'max_depth': 50, 'min_samples_split': 2, 'min_samples_leaf': 1, 'max_features': 'sqrt', 'bootstrap': False, 'criterion': 'squared_error'}. Best is trial 874 with value: 0.32176430753353746.
[I 2024-12-04 20:15:52,809] Trial 1339 finished with value: 0.5373563594146787 and parameters: {'n_estimators': 478, 'max_depth': 47, 'min_samples_split': 2, 'min_samples_leaf': 2, 'max_features': None, 'bootstrap': False, 'criterion': 'squared_error'}. Best is trial 874 with value: 0.32176430753353746.
[I 2024-12-04 20:15:53,344] Trial 1341 finished with value: 0.5773012117175153 and parameters: {'n_estimators': 509, 'max_depth': 43, 'min_samples_split': 2, 'min_samples_leaf': 1, 'max_features': 'log2', 'bootstrap': False, 'criterion': 'squared_error'}. Best is trial 874 with value: 0.32176430753353746.
[I 2024-12-04 20:15:54,336] Trial 1342 finished with value: 0.3506949565331324 and parameters: {'n_estimators': 175, 'max_depth': 43, 'min_samples_split': 2, 'min_samples_leaf': 1, 'max_features': 'sqrt', 'bootstrap': False, 'criterion': 'squared_error'}. Best is trial 874 with value: 0.32176430753353746.
[I 2024-12-04 20:15:54,625] Trial 1343 finished with value: 0.6603474833277372 and parameters: {'n_estimators': 293, 'max_depth': 48, 'min_samples_split': 4, 'min_samples_leaf': 2, 'max_features': 'sqrt', 'bootstrap': False, 'criterion': 'squared_error'}. Best is trial 874 with value: 0.32176430753353746.
[I 2024-12-04 20:15:56,484] Trial 1345 finished with value: 0.32431641896818875 and parameters: {'n_estimators': 291, 'max_depth': 50, 'min_samples_split': 2, 'min_samples_leaf': 1, 'max_features': 'sqrt', 'bootstrap': False, 'criterion': 'squared_error'}. Best is trial 874 with value: 0.32176430753353746.
[I 2024-12-04 20:15:56,791] Trial 1344 finished with value: 0.3286664680299348 and parameters: {'n_estimators': 464, 'max_depth': 50, 'min_samples_split': 2, 'min_samples_leaf': 1, 'max_features': 'sqrt', 'bootstrap': False, 'criterion': 'squared_error'}. Best is trial 874 with value: 0.32176430753353746.
[I 2024-12-04 20:15:58,559] Trial 1347 finished with value: 0.3242568274330358 and parameters: {'n_estimators': 288, 'max_depth': 50, 'min_samples_split': 2, 'min_samples_leaf': 1, 'max_features': 'sqrt', 'bootstrap': False, 'criterion': 'squared_error'}. Best is trial 874 with value: 0.32176430753353746.
[I 2024-12-04 20:15:59,183] Trial 1346 finished with value: 1.0606493880518704 and parameters: {'n_estimators': 255, 'max_depth': 31, 'min_samples_split': 2, 'min_samples_leaf': 4, 'max_features': 'sqrt', 'bootstrap': False, 'criterion': 'absolute_error'}. Best is trial 874 with value: 0.32176430753353746.
[I 2024-12-04 20:16:00,014] Trial 1348 finished with value: 0.3348366309678425 and parameters: {'n_estimators': 156, 'max_depth': 50, 'min_samples_split': 2, 'min_samples_leaf': 1, 'max_features': 'sqrt', 'bootstrap': False, 'criterion': 'squared_error'}. Best is trial 874 with value: 0.32176430753353746.
[I 2024-12-04 20:16:00,576] Trial 1349 finished with value: 0.6771942660461661 and parameters: {'n_estimators': 362, 'max_depth': 43, 'min_samples_split': 2, 'min_samples_leaf': 2, 'max_features': 'sqrt', 'bootstrap': False, 'criterion': 'squared_error'}. Best is trial 874 with value: 0.32176430753353746.
[I 2024-12-04 20:16:01,915] Trial 1350 finished with value: 0.37807864978012423 and parameters: {'n_estimators': 389, 'max_depth': 44, 'min_samples_split': 3, 'min_samples_leaf': 1, 'max_features': 'sqrt', 'bootstrap': False, 'criterion': 'squared_error'}. Best is trial 874 with value: 0.32176430753353746.
[I 2024-12-04 20:16:01,919] Trial 1351 finished with value: 0.39533607886175415 and parameters: {'n_estimators': 248, 'max_depth': 44, 'min_samples_split': 4, 'min_samples_leaf': 1, 'max_features': 'sqrt', 'bootstrap': False, 'criterion': 'squared_error'}. Best is trial 874 with value: 0.32176430753353746.
[I 2024-12-04 20:16:03,627] Trial 1353 finished with value: 1.229894889856792 and parameters: {'n_estimators': 518, 'max_depth': 45, 'min_samples_split': 14, 'min_samples_leaf': 13, 'max_features': 'sqrt', 'bootstrap': True, 'criterion': 'squared_error'}. Best is trial 874 with value: 0.32176430753353746.
[I 2024-12-04 20:16:04,444] Trial 1352 finished with value: 0.36768114652356154 and parameters: {'n_estimators': 488, 'max_depth': 50, 'min_samples_split': 3, 'min_samples_leaf': 1, 'max_features': 'sqrt', 'bootstrap': False, 'criterion': 'squared_error'}. Best is trial 874 with value: 0.32176430753353746.
[I 2024-12-04 20:16:05,549] Trial 1354 finished with value: 0.904131012222113 and parameters: {'n_estimators': 536, 'max_depth': 11, 'min_samples_split': 2, 'min_samples_leaf': 1, 'max_features': 'sqrt', 'bootstrap': True, 'criterion': 'squared_error'}. Best is trial 874 with value: 0.32176430753353746.
[I 2024-12-04 20:16:07,359] Trial 1355 finished with value: 0.3650282267131416 and parameters: {'n_estimators': 619, 'max_depth': 40, 'min_samples_split': 2, 'min_samples_leaf': 1, 'max_features': 'sqrt', 'bootstrap': False, 'criterion': 'squared_error'}. Best is trial 874 with value: 0.32176430753353746.
[I 2024-12-04 20:16:07,757] Trial 1356 finished with value: 0.3509916616437919 and parameters: {'n_estimators': 426, 'max_depth': 43, 'min_samples_split': 2, 'min_samples_leaf': 1, 'max_features': 'sqrt', 'bootstrap': False, 'criterion': 'squared_error'}. Best is trial 874 with value: 0.32176430753353746.
[I 2024-12-04 20:16:09,926] Trial 1358 finished with value: 0.3221053321576918 and parameters: {'n_estimators': 371, 'max_depth': 50, 'min_samples_split': 2, 'min_samples_leaf': 1, 'max_features': 'sqrt', 'bootstrap': False, 'criterion': 'squared_error'}. Best is trial 874 with value: 0.32176430753353746.
[I 2024-12-04 20:16:10,989] Trial 1359 finished with value: 0.6671611343733426 and parameters: {'n_estimators': 226, 'max_depth': 50, 'min_samples_split': 3, 'min_samples_leaf': 2, 'max_features': 'sqrt', 'bootstrap': False, 'criterion': 'squared_error'}. Best is trial 874 with value: 0.32176430753353746.
[I 2024-12-04 20:16:12,508] Trial 1360 finished with value: 1.0313333889622118 and parameters: {'n_estimators': 808, 'max_depth': 19, 'min_samples_split': 28, 'min_samples_leaf': 1, 'max_features': 'log2', 'bootstrap': False, 'criterion': 'squared_error'}. Best is trial 874 with value: 0.32176430753353746.
[I 2024-12-04 20:16:12,561] Trial 1357 finished with value: 0.5444629461643763 and parameters: {'n_estimators': 777, 'max_depth': 25, 'min_samples_split': 6, 'min_samples_leaf': 2, 'max_features': None, 'bootstrap': False, 'criterion': 'squared_error'}. Best is trial 874 with value: 0.32176430753353746.
[I 2024-12-04 20:16:14,369] Trial 1362 finished with value: 0.6889982385915769 and parameters: {'n_estimators': 477, 'max_depth': 50, 'min_samples_split': 2, 'min_samples_leaf': 2, 'max_features': 'sqrt', 'bootstrap': False, 'criterion': 'squared_error'}. Best is trial 874 with value: 0.32176430753353746.
[I 2024-12-04 20:16:16,301] Trial 1363 finished with value: 0.3670837351195108 and parameters: {'n_estimators': 464, 'max_depth': 50, 'min_samples_split': 3, 'min_samples_leaf': 1, 'max_features': 'sqrt', 'bootstrap': False, 'criterion': 'squared_error'}. Best is trial 874 with value: 0.32176430753353746.
[I 2024-12-04 20:16:17,442] Trial 1364 finished with value: 0.370247621879025 and parameters: {'n_estimators': 129, 'max_depth': 41, 'min_samples_split': 2, 'min_samples_leaf': 1, 'max_features': 'sqrt', 'bootstrap': False, 'criterion': 'squared_error'}. Best is trial 874 with value: 0.32176430753353746.
[I 2024-12-04 20:16:19,233] Trial 1365 finished with value: 0.34665957179412477 and parameters: {'n_estimators': 312, 'max_depth': 42, 'min_samples_split': 2, 'min_samples_leaf': 1, 'max_features': 'sqrt', 'bootstrap': False, 'criterion': 'squared_error'}. Best is trial 874 with value: 0.32176430753353746.
[I 2024-12-04 20:16:19,459] Trial 1361 finished with value: 0.41279915930162686 and parameters: {'n_estimators': 944, 'max_depth': 15, 'min_samples_split': 2, 'min_samples_leaf': 1, 'max_features': None, 'bootstrap': False, 'criterion': 'squared_error'}. Best is trial 874 with value: 0.32176430753353746.
[I 2024-12-04 20:16:20,932] Trial 1366 finished with value: 0.3777829912213415 and parameters: {'n_estimators': 333, 'max_depth': 44, 'min_samples_split': 3, 'min_samples_leaf': 1, 'max_features': 'sqrt', 'bootstrap': False, 'criterion': 'squared_error'}. Best is trial 874 with value: 0.32176430753353746.
[I 2024-12-04 20:16:22,657] Trial 1368 finished with value: 0.3856460025046458 and parameters: {'n_estimators': 341, 'max_depth': 50, 'min_samples_split': 4, 'min_samples_leaf': 1, 'max_features': 'sqrt', 'bootstrap': False, 'criterion': 'squared_error'}. Best is trial 874 with value: 0.32176430753353746.
[I 2024-12-04 20:16:23,732] Trial 1369 finished with value: 0.6780745075298064 and parameters: {'n_estimators': 226, 'max_depth': 42, 'min_samples_split': 2, 'min_samples_leaf': 2, 'max_features': 'sqrt', 'bootstrap': False, 'criterion': 'squared_error'}. Best is trial 874 with value: 0.32176430753353746.
[I 2024-12-04 20:16:23,998] Trial 1367 finished with value: 0.594777958369256 and parameters: {'n_estimators': 269, 'max_depth': 37, 'min_samples_split': 7, 'min_samples_leaf': 7, 'max_features': None, 'bootstrap': True, 'criterion': 'absolute_error'}. Best is trial 874 with value: 0.32176430753353746.
[I 2024-12-04 20:16:26,129] Trial 1370 finished with value: 0.32470043509365365 and parameters: {'n_estimators': 434, 'max_depth': 50, 'min_samples_split': 2, 'min_samples_leaf': 1, 'max_features': 'sqrt', 'bootstrap': False, 'criterion': 'squared_error'}. Best is trial 874 with value: 0.32176430753353746.
[I 2024-12-04 20:16:26,472] Trial 1371 finished with value: 0.32437708925814235 and parameters: {'n_estimators': 357, 'max_depth': 50, 'min_samples_split': 2, 'min_samples_leaf': 1, 'max_features': 'sqrt', 'bootstrap': False, 'criterion': 'squared_error'}. Best is trial 874 with value: 0.32176430753353746.
[I 2024-12-04 20:16:27,760] Trial 1372 finished with value: 1.2400215819361213 and parameters: {'n_estimators': 864, 'max_depth': 19, 'min_samples_split': 14, 'min_samples_leaf': 5, 'max_features': 'log2', 'bootstrap': False, 'criterion': 'squared_error'}. Best is trial 874 with value: 0.32176430753353746.
[I 2024-12-04 20:16:28,843] Trial 1373 finished with value: 0.4150651168389084 and parameters: {'n_estimators': 469, 'max_depth': 43, 'min_samples_split': 4, 'min_samples_leaf': 1, 'max_features': 'sqrt', 'bootstrap': False, 'criterion': 'squared_error'}. Best is trial 874 with value: 0.32176430753353746.
[I 2024-12-04 20:16:30,191] Trial 1375 finished with value: 0.5478059123869085 and parameters: {'n_estimators': 218, 'max_depth': 40, 'min_samples_split': 6, 'min_samples_leaf': 1, 'max_features': 'sqrt', 'bootstrap': True, 'criterion': 'squared_error'}. Best is trial 874 with value: 0.32176430753353746.
[I 2024-12-04 20:16:30,750] Trial 1374 finished with value: 0.8220049475260576 and parameters: {'n_estimators': 511, 'max_depth': 48, 'min_samples_split': 50, 'min_samples_leaf': 8, 'max_features': None, 'bootstrap': False, 'criterion': 'squared_error'}. Best is trial 874 with value: 0.32176430753353746.
[I 2024-12-04 20:16:31,227] Trial 1308 finished with value: 0.5264259865527814 and parameters: {'n_estimators': 983, 'max_depth': 18, 'min_samples_split': 2, 'min_samples_leaf': 2, 'max_features': None, 'bootstrap': False, 'criterion': 'absolute_error'}. Best is trial 874 with value: 0.32176430753353746.
[I 2024-12-04 20:16:32,433] Trial 1377 finished with value: 0.33638168634443355 and parameters: {'n_estimators': 149, 'max_depth': 50, 'min_samples_split': 2, 'min_samples_leaf': 1, 'max_features': 'sqrt', 'bootstrap': False, 'criterion': 'squared_error'}. Best is trial 874 with value: 0.32176430753353746.
[I 2024-12-04 20:16:32,603] Trial 1376 finished with value: 0.34514725890490106 and parameters: {'n_estimators': 309, 'max_depth': 43, 'min_samples_split': 2, 'min_samples_leaf': 1, 'max_features': 'sqrt', 'bootstrap': False, 'criterion': 'squared_error'}. Best is trial 874 with value: 0.32176430753353746.
[I 2024-12-04 20:16:33,413] Trial 1378 finished with value: 0.3586539856357815 and parameters: {'n_estimators': 369, 'max_depth': 50, 'min_samples_split': 3, 'min_samples_leaf': 1, 'max_features': 'sqrt', 'bootstrap': False, 'criterion': 'squared_error'}. Best is trial 874 with value: 0.32176430753353746.
[I 2024-12-04 20:16:35,009] Trial 1380 finished with value: 0.3474523316741647 and parameters: {'n_estimators': 379, 'max_depth': 42, 'min_samples_split': 2, 'min_samples_leaf': 1, 'max_features': 'sqrt', 'bootstrap': False, 'criterion': 'squared_error'}. Best is trial 874 with value: 0.32176430753353746.
[I 2024-12-04 20:16:35,573] Trial 1381 finished with value: 0.32257382998279355 and parameters: {'n_estimators': 346, 'max_depth': 50, 'min_samples_split': 2, 'min_samples_leaf': 1, 'max_features': 'sqrt', 'bootstrap': False, 'criterion': 'squared_error'}. Best is trial 874 with value: 0.32176430753353746.
[I 2024-12-04 20:16:36,985] Trial 1382 finished with value: 0.3594397907860568 and parameters: {'n_estimators': 381, 'max_depth': 50, 'min_samples_split': 3, 'min_samples_leaf': 1, 'max_features': 'sqrt', 'bootstrap': False, 'criterion': 'squared_error'}. Best is trial 874 with value: 0.32176430753353746.
[I 2024-12-04 20:16:37,572] Trial 1383 finished with value: 0.38914508291846045 and parameters: {'n_estimators': 433, 'max_depth': 50, 'min_samples_split': 4, 'min_samples_leaf': 1, 'max_features': 'sqrt', 'bootstrap': False, 'criterion': 'squared_error'}. Best is trial 874 with value: 0.32176430753353746.
[I 2024-12-04 20:16:38,602] Trial 1384 finished with value: 0.6860193837105371 and parameters: {'n_estimators': 413, 'max_depth': 44, 'min_samples_split': 2, 'min_samples_leaf': 2, 'max_features': 'sqrt', 'bootstrap': False, 'criterion': 'squared_error'}. Best is trial 874 with value: 0.32176430753353746.
[I 2024-12-04 20:16:40,005] Trial 1385 finished with value: 0.3488615948145862 and parameters: {'n_estimators': 398, 'max_depth': 43, 'min_samples_split': 2, 'min_samples_leaf': 1, 'max_features': 'sqrt', 'bootstrap': False, 'criterion': 'squared_error'}. Best is trial 874 with value: 0.32176430753353746.
[I 2024-12-04 20:16:41,138] Trial 1387 finished with value: 1.1737624800956992 and parameters: {'n_estimators': 513, 'max_depth': 31, 'min_samples_split': 5, 'min_samples_leaf': 10, 'max_features': 'sqrt', 'bootstrap': False, 'criterion': 'squared_error'}. Best is trial 874 with value: 0.32176430753353746.
[I 2024-12-04 20:16:42,909] Trial 1379 finished with value: 0.39962711769618026 and parameters: {'n_estimators': 396, 'max_depth': 42, 'min_samples_split': 2, 'min_samples_leaf': 1, 'max_features': 'sqrt', 'bootstrap': False, 'criterion': 'absolute_error'}. Best is trial 874 with value: 0.32176430753353746.
[I 2024-12-04 20:16:43,944] Trial 1389 finished with value: 1.2635535796288608 and parameters: {'n_estimators': 156, 'max_depth': 10, 'min_samples_split': 50, 'min_samples_leaf': 7, 'max_features': 'sqrt', 'bootstrap': True, 'criterion': 'absolute_error'}. Best is trial 874 with value: 0.32176430753353746.
[I 2024-12-04 20:16:44,786] Trial 1388 finished with value: 0.5808471846403019 and parameters: {'n_estimators': 134, 'max_depth': 24, 'min_samples_split': 36, 'min_samples_leaf': 11, 'max_features': None, 'bootstrap': False, 'criterion': 'absolute_error'}. Best is trial 874 with value: 0.32176430753353746.
[I 2024-12-04 20:16:46,226] Trial 1391 finished with value: 0.6903036833034496 and parameters: {'n_estimators': 468, 'max_depth': 50, 'min_samples_split': 2, 'min_samples_leaf': 2, 'max_features': 'sqrt', 'bootstrap': False, 'criterion': 'squared_error'}. Best is trial 874 with value: 0.32176430753353746.
[I 2024-12-04 20:16:46,729] Trial 1390 finished with value: 0.3447639082132699 and parameters: {'n_estimators': 507, 'max_depth': 45, 'min_samples_split': 2, 'min_samples_leaf': 1, 'max_features': 'sqrt', 'bootstrap': False, 'criterion': 'squared_error'}. Best is trial 874 with value: 0.32176430753353746.
[I 2024-12-04 20:16:48,599] Trial 1392 finished with value: 0.32434316916125766 and parameters: {'n_estimators': 423, 'max_depth': 50, 'min_samples_split': 2, 'min_samples_leaf': 1, 'max_features': 'sqrt', 'bootstrap': False, 'criterion': 'squared_error'}. Best is trial 874 with value: 0.32176430753353746.
[I 2024-12-04 20:16:49,086] Trial 1386 finished with value: 0.8649983088675314 and parameters: {'n_estimators': 752, 'max_depth': 30, 'min_samples_split': 35, 'min_samples_leaf': 1, 'max_features': 'sqrt', 'bootstrap': True, 'criterion': 'absolute_error'}. Best is trial 874 with value: 0.32176430753353746.
[I 2024-12-04 20:16:50,106] Trial 1394 finished with value: 0.6647040024238601 and parameters: {'n_estimators': 269, 'max_depth': 50, 'min_samples_split': 2, 'min_samples_leaf': 2, 'max_features': 'sqrt', 'bootstrap': False, 'criterion': 'squared_error'}. Best is trial 874 with value: 0.32176430753353746.
[I 2024-12-04 20:16:50,787] Trial 1395 finished with value: 1.2675224945060215 and parameters: {'n_estimators': 992, 'max_depth': 29, 'min_samples_split': 7, 'min_samples_leaf': 10, 'max_features': 'log2', 'bootstrap': False, 'criterion': 'squared_error'}. Best is trial 874 with value: 0.32176430753353746.
[I 2024-12-04 20:16:52,257] Trial 1397 finished with value: 0.6890568527873224 and parameters: {'n_estimators': 431, 'max_depth': 43, 'min_samples_split': 2, 'min_samples_leaf': 2, 'max_features': 'sqrt', 'bootstrap': False, 'criterion': 'squared_error'}. Best is trial 874 with value: 0.32176430753353746.
