[I 2024-12-04 12:02:54,762] Trial 1782 finished with value: 0.8101385948198155 and parameters: {'max_depth': 29, 'min_samples_split': 5, 'min_samples_leaf': 3, 'max_features': 'sqrt', 'criterion': 'squared_error', 'splitter': 'best'}. Best is trial 838 with value: 0.5900375110830633.
[I 2024-12-04 12:02:54,934] Trial 1772 finished with value: 0.713722108439527 and parameters: {'max_depth': 35, 'min_samples_split': 3, 'min_samples_leaf': 1, 'max_features': 'sqrt', 'criterion': 'squared_error', 'splitter': 'best'}. Best is trial 838 with value: 0.5900375110830633.
[I 2024-12-04 12:02:55,477] Trial 1778 finished with value: 1.092723027538113 and parameters: {'max_depth': 5, 'min_samples_split': 2, 'min_samples_leaf': 8, 'max_features': 'log2', 'criterion': 'friedman_mse', 'splitter': 'random'}. Best is trial 838 with value: 0.5900375110830633.
[I 2024-12-04 12:02:55,962] Trial 1762 finished with value: 0.7044023234155515 and parameters: {'max_depth': 35, 'min_samples_split': 2, 'min_samples_leaf': 1, 'max_features': 'sqrt', 'criterion': 'squared_error', 'splitter': 'best'}. Best is trial 838 with value: 0.5900375110830633.
[I 2024-12-04 12:02:56,199] Trial 1773 finished with value: 0.7044023234155515 and parameters: {'max_depth': 35, 'min_samples_split': 2, 'min_samples_leaf': 1, 'max_features': 'sqrt', 'criterion': 'squared_error', 'splitter': 'best'}. Best is trial 838 with value: 0.5900375110830633.
[I 2024-12-04 12:02:56,503] Trial 1776 finished with value: 0.7291342883560936 and parameters: {'max_depth': 35, 'min_samples_split': 5, 'min_samples_leaf': 1, 'max_features': 'sqrt', 'criterion': 'squared_error', 'splitter': 'best'}. Best is trial 838 with value: 0.5900375110830633.
[I 2024-12-04 12:02:56,779] Trial 1779 finished with value: 0.8101385948198155 and parameters: {'max_depth': 35, 'min_samples_split': 4, 'min_samples_leaf': 3, 'max_features': 'sqrt', 'criterion': 'squared_error', 'splitter': 'best'}. Best is trial 838 with value: 0.5900375110830633.
[I 2024-12-04 12:02:57,183] Trial 1777 finished with value: 0.7135166658905429 and parameters: {'max_depth': 29, 'min_samples_split': 6, 'min_samples_leaf': 1, 'max_features': 'sqrt', 'criterion': 'squared_error', 'splitter': 'best'}. Best is trial 838 with value: 0.5900375110830633.
[I 2024-12-04 12:02:57,351] Trial 1789 finished with value: 0.8267129210278911 and parameters: {'max_depth': 22, 'min_samples_split': 2, 'min_samples_leaf': 3, 'max_features': 'sqrt', 'criterion': 'squared_error', 'splitter': 'best'}. Best is trial 838 with value: 0.5900375110830633.
[I 2024-12-04 12:02:57,995] Trial 1768 finished with value: 0.8101385948198155 and parameters: {'max_depth': 35, 'min_samples_split': 6, 'min_samples_leaf': 3, 'max_features': 'sqrt', 'criterion': 'squared_error', 'splitter': 'best'}. Best is trial 838 with value: 0.5900375110830633.
[I 2024-12-04 12:02:58,095] Trial 1781 finished with value: 0.774293158467234 and parameters: {'max_depth': 33, 'min_samples_split': 2, 'min_samples_leaf': 3, 'max_features': 'sqrt', 'criterion': 'absolute_error', 'splitter': 'best'}. Best is trial 838 with value: 0.5900375110830633.
[I 2024-12-04 12:02:58,579] Trial 1783 finished with value: 1.0732740793523414 and parameters: {'max_depth': 25, 'min_samples_split': 20, 'min_samples_leaf': 3, 'max_features': 'log2', 'criterion': 'absolute_error', 'splitter': 'best'}. Best is trial 838 with value: 0.5900375110830633.
[I 2024-12-04 12:02:59,094] Trial 1793 finished with value: 0.8241861685151659 and parameters: {'max_depth': 30, 'min_samples_split': 4, 'min_samples_leaf': 2, 'max_features': 'sqrt', 'criterion': 'squared_error', 'splitter': 'best'}. Best is trial 838 with value: 0.5900375110830633.
[I 2024-12-04 12:02:59,279] Trial 1787 finished with value: 1.0872882124005998 and parameters: {'max_depth': 7, 'min_samples_split': 12, 'min_samples_leaf': 2, 'max_features': 'log2', 'criterion': 'absolute_error', 'splitter': 'random'}. Best is trial 838 with value: 0.5900375110830633.
[I 2024-12-04 12:02:59,558] Trial 1774 finished with value: 0.8606038828695697 and parameters: {'max_depth': 35, 'min_samples_split': 4, 'min_samples_leaf': 2, 'max_features': 'log2', 'criterion': 'squared_error', 'splitter': 'best'}. Best is trial 838 with value: 0.5900375110830633.
[I 2024-12-04 12:02:59,583] Trial 1786 finished with value: 0.7722845288492907 and parameters: {'max_depth': 30, 'min_samples_split': 8, 'min_samples_leaf': 1, 'max_features': 'sqrt', 'criterion': 'squared_error', 'splitter': 'best'}. Best is trial 838 with value: 0.5900375110830633.
[I 2024-12-04 12:02:59,619] Trial 1784 finished with value: 0.6777561409658496 and parameters: {'max_depth': 30, 'min_samples_split': 5, 'min_samples_leaf': 1, 'max_features': 'sqrt', 'criterion': 'squared_error', 'splitter': 'best'}. Best is trial 838 with value: 0.5900375110830633.
[I 2024-12-04 12:03:00,153] Trial 1790 finished with value: 0.8304971398187618 and parameters: {'max_depth': 26, 'min_samples_split': 2, 'min_samples_leaf': 2, 'max_features': 'sqrt', 'criterion': 'squared_error', 'splitter': 'random'}. Best is trial 838 with value: 0.5900375110830633.
[I 2024-12-04 12:03:00,178] Trial 1794 finished with value: 0.7030091902207406 and parameters: {'max_depth': 35, 'min_samples_split': 7, 'min_samples_leaf': 1, 'max_features': 'sqrt', 'criterion': 'squared_error', 'splitter': 'best'}. Best is trial 838 with value: 0.5900375110830633.
[I 2024-12-04 12:03:00,181] Trial 1792 finished with value: 0.7044023234155515 and parameters: {'max_depth': 35, 'min_samples_split': 2, 'min_samples_leaf': 1, 'max_features': 'sqrt', 'criterion': 'squared_error', 'splitter': 'best'}. Best is trial 838 with value: 0.5900375110830633.
[I 2024-12-04 12:03:00,699] Trial 1775 finished with value: 0.8209492412990053 and parameters: {'max_depth': 35, 'min_samples_split': 7, 'min_samples_leaf': 2, 'max_features': 'sqrt', 'criterion': 'squared_error', 'splitter': 'best'}. Best is trial 838 with value: 0.5900375110830633.
[I 2024-12-04 12:03:00,717] Trial 1798 finished with value: 0.8101385948198155 and parameters: {'max_depth': 30, 'min_samples_split': 4, 'min_samples_leaf': 3, 'max_features': 'sqrt', 'criterion': 'squared_error', 'splitter': 'best'}. Best is trial 838 with value: 0.5900375110830633.
[I 2024-12-04 12:03:01,993] Trial 1791 finished with value: 0.6945768284293156 and parameters: {'max_depth': 35, 'min_samples_split': 9, 'min_samples_leaf': 1, 'max_features': 'sqrt', 'criterion': 'squared_error', 'splitter': 'best'}. Best is trial 838 with value: 0.5900375110830633.
[I 2024-12-04 12:03:01,994] Trial 1797 finished with value: 1.0909840109486761 and parameters: {'max_depth': 20, 'min_samples_split': 2, 'min_samples_leaf': 6, 'max_features': 'log2', 'criterion': 'friedman_mse', 'splitter': 'random'}. Best is trial 838 with value: 0.5900375110830633.
[I 2024-12-04 12:03:02,414] Trial 1795 finished with value: 0.6777561409658496 and parameters: {'max_depth': 30, 'min_samples_split': 5, 'min_samples_leaf': 1, 'max_features': 'sqrt', 'criterion': 'squared_error', 'splitter': 'best'}. Best is trial 838 with value: 0.5900375110830633.
[I 2024-12-04 12:03:02,422] Trial 1785 finished with value: 0.6481536807148809 and parameters: {'max_depth': 29, 'min_samples_split': 4, 'min_samples_leaf': 1, 'max_features': 'sqrt', 'criterion': 'squared_error', 'splitter': 'best'}. Best is trial 838 with value: 0.5900375110830633.
[I 2024-12-04 12:03:02,982] Trial 1796 finished with value: 0.8101385948198155 and parameters: {'max_depth': 35, 'min_samples_split': 4, 'min_samples_leaf': 3, 'max_features': 'sqrt', 'criterion': 'squared_error', 'splitter': 'best'}. Best is trial 838 with value: 0.5900375110830633.
[I 2024-12-04 12:03:03,343] Trial 1802 finished with value: 0.8300015320785108 and parameters: {'max_depth': 29, 'min_samples_split': 5, 'min_samples_leaf': 2, 'max_features': 'sqrt', 'criterion': 'squared_error', 'splitter': 'best'}. Best is trial 838 with value: 0.5900375110830633.
[I 2024-12-04 12:03:04,296] Trial 1801 finished with value: 0.713722108439527 and parameters: {'max_depth': 35, 'min_samples_split': 3, 'min_samples_leaf': 1, 'max_features': 'sqrt', 'criterion': 'squared_error', 'splitter': 'best'}. Best is trial 838 with value: 0.5900375110830633.
[I 2024-12-04 12:03:04,766] Trial 1803 finished with value: 0.7291342883560936 and parameters: {'max_depth': 35, 'min_samples_split': 5, 'min_samples_leaf': 1, 'max_features': 'sqrt', 'criterion': 'squared_error', 'splitter': 'best'}. Best is trial 838 with value: 0.5900375110830633.
[I 2024-12-04 12:03:05,249] Trial 1808 finished with value: 1.074761472342103 and parameters: {'max_depth': 35, 'min_samples_split': 4, 'min_samples_leaf': 4, 'max_features': 'log2', 'criterion': 'absolute_error', 'splitter': 'random'}. Best is trial 838 with value: 0.5900375110830633.
[I 2024-12-04 12:03:06,592] Trial 1810 finished with value: 0.81109550174734 and parameters: {'max_depth': 33, 'min_samples_split': 2, 'min_samples_leaf': 1, 'max_features': 'sqrt', 'criterion': 'friedman_mse', 'splitter': 'random'}. Best is trial 838 with value: 0.5900375110830633.
[I 2024-12-04 12:03:07,196] Trial 1814 finished with value: 0.8101385948198155 and parameters: {'max_depth': 35, 'min_samples_split': 5, 'min_samples_leaf': 3, 'max_features': 'sqrt', 'criterion': 'squared_error', 'splitter': 'best'}. Best is trial 838 with value: 0.5900375110830633.
[I 2024-12-04 12:03:07,281] Trial 1811 finished with value: 0.7291342883560936 and parameters: {'max_depth': 35, 'min_samples_split': 5, 'min_samples_leaf': 1, 'max_features': 'sqrt', 'criterion': 'squared_error', 'splitter': 'best'}. Best is trial 838 with value: 0.5900375110830633.
[I 2024-12-04 12:03:08,218] Trial 1800 finished with value: 0.7797638791915277 and parameters: {'max_depth': 31, 'min_samples_split': 5, 'min_samples_leaf': 1, 'max_features': 'sqrt', 'criterion': 'squared_error', 'splitter': 'random'}. Best is trial 838 with value: 0.5900375110830633.
[I 2024-12-04 12:03:09,594] Trial 1788 finished with value: 0.6361563548204678 and parameters: {'max_depth': 30, 'min_samples_split': 4, 'min_samples_leaf': 1, 'max_features': 'sqrt', 'criterion': 'squared_error', 'splitter': 'best'}. Best is trial 838 with value: 0.5900375110830633.
[I 2024-12-04 12:03:09,729] Trial 1804 finished with value: 0.8101385948198155 and parameters: {'max_depth': 29, 'min_samples_split': 2, 'min_samples_leaf': 3, 'max_features': 'sqrt', 'criterion': 'squared_error', 'splitter': 'best'}. Best is trial 838 with value: 0.5900375110830633.
[I 2024-12-04 12:03:10,283] Trial 1818 finished with value: 0.8198815063079533 and parameters: {'max_depth': 29, 'min_samples_split': 7, 'min_samples_leaf': 3, 'max_features': 'sqrt', 'criterion': 'absolute_error', 'splitter': 'best'}. Best is trial 838 with value: 0.5900375110830633.
[I 2024-12-04 12:03:10,561] Trial 1815 finished with value: 0.676636829282285 and parameters: {'max_depth': 35, 'min_samples_split': 6, 'min_samples_leaf': 1, 'max_features': 'sqrt', 'criterion': 'squared_error', 'splitter': 'best'}. Best is trial 838 with value: 0.5900375110830633.
[I 2024-12-04 12:03:10,745] Trial 1812 finished with value: 0.8241861685151659 and parameters: {'max_depth': 35, 'min_samples_split': 4, 'min_samples_leaf': 2, 'max_features': 'sqrt', 'criterion': 'squared_error', 'splitter': 'best'}. Best is trial 838 with value: 0.5900375110830633.
[I 2024-12-04 12:03:11,872] Trial 1825 finished with value: 0.59023342761678 and parameters: {'max_depth': 35, 'min_samples_split': 4, 'min_samples_leaf': 1, 'max_features': 'sqrt', 'criterion': 'squared_error', 'splitter': 'best'}. Best is trial 838 with value: 0.5900375110830633.
[I 2024-12-04 12:03:11,974] Trial 1820 finished with value: 0.713722108439527 and parameters: {'max_depth': 35, 'min_samples_split': 3, 'min_samples_leaf': 1, 'max_features': 'sqrt', 'criterion': 'squared_error', 'splitter': 'best'}. Best is trial 838 with value: 0.5900375110830633.
[I 2024-12-04 12:03:12,200] Trial 1806 finished with value: 0.59023342761678 and parameters: {'max_depth': 35, 'min_samples_split': 4, 'min_samples_leaf': 1, 'max_features': 'sqrt', 'criterion': 'squared_error', 'splitter': 'best'}. Best is trial 838 with value: 0.5900375110830633.
[I 2024-12-04 12:03:12,265] Trial 1807 finished with value: 0.8963492261327596 and parameters: {'max_depth': 8, 'min_samples_split': 10, 'min_samples_leaf': 1, 'max_features': 'sqrt', 'criterion': 'friedman_mse', 'splitter': 'best'}. Best is trial 838 with value: 0.5900375110830633.
[I 2024-12-04 12:03:12,733] Trial 1813 finished with value: 0.7960286527551925 and parameters: {'max_depth': 35, 'min_samples_split': 5, 'min_samples_leaf': 1, 'max_features': 'sqrt', 'criterion': 'squared_error', 'splitter': 'random'}. Best is trial 838 with value: 0.5900375110830633.
[I 2024-12-04 12:03:12,740] Trial 1824 finished with value: 0.6945768284293156 and parameters: {'max_depth': 35, 'min_samples_split': 9, 'min_samples_leaf': 1, 'max_features': 'sqrt', 'criterion': 'squared_error', 'splitter': 'best'}. Best is trial 838 with value: 0.5900375110830633.
[I 2024-12-04 12:03:12,872] Trial 1816 finished with value: 0.7526666415734802 and parameters: {'max_depth': 35, 'min_samples_split': 7, 'min_samples_leaf': 1, 'max_features': 'sqrt', 'criterion': 'absolute_error', 'splitter': 'best'}. Best is trial 838 with value: 0.5900375110830633.
[I 2024-12-04 12:03:12,955] Trial 1805 finished with value: 0.6416220728212735 and parameters: {'max_depth': 29, 'min_samples_split': 2, 'min_samples_leaf': 1, 'max_features': 'sqrt', 'criterion': 'squared_error', 'splitter': 'best'}. Best is trial 838 with value: 0.5900375110830633.
[I 2024-12-04 12:03:13,159] Trial 1799 finished with value: 0.6296640809588671 and parameters: {'max_depth': 30, 'min_samples_split': 3, 'min_samples_leaf': 1, 'max_features': 'sqrt', 'criterion': 'squared_error', 'splitter': 'best'}. Best is trial 838 with value: 0.5900375110830633.
[I 2024-12-04 12:03:13,313] Trial 1827 finished with value: 1.0859331338976363 and parameters: {'max_depth': 7, 'min_samples_split': 9, 'min_samples_leaf': 5, 'max_features': 'sqrt', 'criterion': 'friedman_mse', 'splitter': 'random'}. Best is trial 838 with value: 0.5900375110830633.
[I 2024-12-04 12:03:13,431] Trial 1826 finished with value: 0.7123634661440924 and parameters: {'max_depth': 22, 'min_samples_split': 5, 'min_samples_leaf': 1, 'max_features': 'sqrt', 'criterion': 'squared_error', 'splitter': 'best'}. Best is trial 838 with value: 0.5900375110830633.
[I 2024-12-04 12:03:13,565] Trial 1821 finished with value: 0.7722845288492907 and parameters: {'max_depth': 30, 'min_samples_split': 8, 'min_samples_leaf': 1, 'max_features': 'sqrt', 'criterion': 'squared_error', 'splitter': 'best'}. Best is trial 838 with value: 0.5900375110830633.
[I 2024-12-04 12:03:13,823] Trial 1823 finished with value: 0.8101385948198155 and parameters: {'max_depth': 35, 'min_samples_split': 5, 'min_samples_leaf': 3, 'max_features': 'sqrt', 'criterion': 'squared_error', 'splitter': 'best'}. Best is trial 838 with value: 0.5900375110830633.
[I 2024-12-04 12:03:13,826] Trial 1822 finished with value: 0.6671320020529113 and parameters: {'max_depth': 30, 'min_samples_split': 6, 'min_samples_leaf': 1, 'max_features': 'sqrt', 'criterion': 'squared_error', 'splitter': 'best'}. Best is trial 838 with value: 0.5900375110830633.
[I 2024-12-04 12:03:13,896] Trial 1819 finished with value: 0.8101385948198155 and parameters: {'max_depth': 35, 'min_samples_split': 2, 'min_samples_leaf': 3, 'max_features': 'sqrt', 'criterion': 'squared_error', 'splitter': 'best'}. Best is trial 838 with value: 0.5900375110830633.
[I 2024-12-04 12:03:14,679] Trial 1817 finished with value: 0.8241861685151659 and parameters: {'max_depth': 29, 'min_samples_split': 2, 'min_samples_leaf': 2, 'max_features': 'sqrt', 'criterion': 'squared_error', 'splitter': 'best'}. Best is trial 838 with value: 0.5900375110830633.
[I 2024-12-04 12:03:14,780] Trial 1809 finished with value: 0.59023342761678 and parameters: {'max_depth': 35, 'min_samples_split': 4, 'min_samples_leaf': 1, 'max_features': 'sqrt', 'criterion': 'squared_error', 'splitter': 'best'}. Best is trial 838 with value: 0.5900375110830633.
[I 2024-12-04 12:03:15,018] Trial 1828 finished with value: 0.7291342883560936 and parameters: {'max_depth': 35, 'min_samples_split': 5, 'min_samples_leaf': 1, 'max_features': 'sqrt', 'criterion': 'squared_error', 'splitter': 'best'}. Best is trial 838 with value: 0.5900375110830633.
[I 2024-12-04 12:03:16,819] Trial 1829 finished with value: 0.716860153973057 and parameters: {'max_depth': 31, 'min_samples_split': 2, 'min_samples_leaf': 1, 'max_features': 'sqrt', 'criterion': 'squared_error', 'splitter': 'best'}. Best is trial 838 with value: 0.5900375110830633.
[I 2024-12-04 12:03:17,375] Trial 1831 finished with value: 1.0675246405133478 and parameters: {'max_depth': 2, 'min_samples_split': 7, 'min_samples_leaf': 10, 'max_features': 'sqrt', 'criterion': 'friedman_mse', 'splitter': 'best'}. Best is trial 838 with value: 0.5900375110830633.
[I 2024-12-04 12:03:17,570] Trial 1830 finished with value: 0.7987748637010382 and parameters: {'max_depth': 29, 'min_samples_split': 7, 'min_samples_leaf': 3, 'max_features': 'sqrt', 'criterion': 'squared_error', 'splitter': 'best'}. Best is trial 838 with value: 0.5900375110830633.
[I 2024-12-04 12:03:17,585] Trial 1833 finished with value: 0.676636829282285 and parameters: {'max_depth': 35, 'min_samples_split': 6, 'min_samples_leaf': 1, 'max_features': 'sqrt', 'criterion': 'squared_error', 'splitter': 'best'}. Best is trial 838 with value: 0.5900375110830633.
[I 2024-12-04 12:03:18,540] Trial 1832 finished with value: 0.7231530055805183 and parameters: {'max_depth': 30, 'min_samples_split': 2, 'min_samples_leaf': 1, 'max_features': 'sqrt', 'criterion': 'squared_error', 'splitter': 'best'}. Best is trial 838 with value: 0.5900375110830633.
[I 2024-12-04 12:03:18,759] Trial 1834 finished with value: 1.091656728529238 and parameters: {'max_depth': 8, 'min_samples_split': 9, 'min_samples_leaf': 10, 'max_features': 'log2', 'criterion': 'squared_error', 'splitter': 'best'}. Best is trial 838 with value: 0.5900375110830633.
[I 2024-12-04 12:03:19,525] Trial 1839 finished with value: 0.7013604087888767 and parameters: {'max_depth': 35, 'min_samples_split': 4, 'min_samples_leaf': 1, 'max_features': 'log2', 'criterion': 'squared_error', 'splitter': 'best'}. Best is trial 838 with value: 0.5900375110830633.
[I 2024-12-04 12:03:21,303] Trial 1838 finished with value: 0.7044023234155515 and parameters: {'max_depth': 35, 'min_samples_split': 2, 'min_samples_leaf': 1, 'max_features': 'sqrt', 'criterion': 'squared_error', 'splitter': 'best'}. Best is trial 838 with value: 0.5900375110830633.
[I 2024-12-04 12:03:21,489] Trial 1836 finished with value: 0.7044023234155515 and parameters: {'max_depth': 35, 'min_samples_split': 2, 'min_samples_leaf': 1, 'max_features': 'sqrt', 'criterion': 'squared_error', 'splitter': 'best'}. Best is trial 838 with value: 0.5900375110830633.
[I 2024-12-04 12:03:21,565] Trial 1845 finished with value: 0.6548912683909761 and parameters: {'max_depth': 29, 'min_samples_split': 5, 'min_samples_leaf': 1, 'max_features': 'sqrt', 'criterion': 'friedman_mse', 'splitter': 'best'}. Best is trial 838 with value: 0.5900375110830633.
[I 2024-12-04 12:03:21,740] Trial 1842 finished with value: 0.8300015320785108 and parameters: {'max_depth': 35, 'min_samples_split': 5, 'min_samples_leaf': 2, 'max_features': 'sqrt', 'criterion': 'squared_error', 'splitter': 'best'}. Best is trial 838 with value: 0.5900375110830633.
[I 2024-12-04 12:03:21,974] Trial 1837 finished with value: 0.7044023234155515 and parameters: {'max_depth': 35, 'min_samples_split': 2, 'min_samples_leaf': 1, 'max_features': 'sqrt', 'criterion': 'squared_error', 'splitter': 'best'}. Best is trial 838 with value: 0.5900375110830633.
[I 2024-12-04 12:03:23,120] Trial 1844 finished with value: 0.8922728876838094 and parameters: {'max_depth': 29, 'min_samples_split': 8, 'min_samples_leaf': 3, 'max_features': 'sqrt', 'criterion': 'squared_error', 'splitter': 'random'}. Best is trial 838 with value: 0.5900375110830633.
[I 2024-12-04 12:03:24,951] Trial 1835 finished with value: 0.7030091902207406 and parameters: {'max_depth': 35, 'min_samples_split': 7, 'min_samples_leaf': 1, 'max_features': 'sqrt', 'criterion': 'squared_error', 'splitter': 'best'}. Best is trial 838 with value: 0.5900375110830633.
[I 2024-12-04 12:03:25,102] Trial 1852 finished with value: 0.7943281291666109 and parameters: {'max_depth': 22, 'min_samples_split': 5, 'min_samples_leaf': 1, 'max_features': 'sqrt', 'criterion': 'squared_error', 'splitter': 'random'}. Best is trial 838 with value: 0.5900375110830633.
[I 2024-12-04 12:03:25,515] Trial 1849 finished with value: 0.7482013871683771 and parameters: {'max_depth': 35, 'min_samples_split': 2, 'min_samples_leaf': 1, 'max_features': 'sqrt', 'criterion': 'absolute_error', 'splitter': 'best'}. Best is trial 838 with value: 0.5900375110830633.
[I 2024-12-04 12:03:26,070] Trial 1840 finished with value: 0.8101385948198155 and parameters: {'max_depth': 30, 'min_samples_split': 6, 'min_samples_leaf': 3, 'max_features': 'sqrt', 'criterion': 'squared_error', 'splitter': 'best'}. Best is trial 838 with value: 0.5900375110830633.
[I 2024-12-04 12:03:26,072] Trial 1846 finished with value: 0.7291342883560936 and parameters: {'max_depth': 35, 'min_samples_split': 5, 'min_samples_leaf': 1, 'max_features': 'sqrt', 'criterion': 'squared_error', 'splitter': 'best'}. Best is trial 838 with value: 0.5900375110830633.
[I 2024-12-04 12:03:26,291] Trial 1855 finished with value: 0.6671320020529113 and parameters: {'max_depth': 30, 'min_samples_split': 6, 'min_samples_leaf': 1, 'max_features': 'sqrt', 'criterion': 'squared_error', 'splitter': 'best'}. Best is trial 838 with value: 0.5900375110830633.
