[I 2024-12-04 11:59:43,179] Trial 302 finished with value: 1.0442631611409916 and parameters: {'n_estimators': 359, 'max_depth': 5, 'min_samples_split': 2, 'min_samples_leaf': 1, 'max_features': 'sqrt', 'bootstrap': False, 'criterion': 'squared_error'}. Best is trial 170 with value: 0.5079262681451786.
[I 2024-12-04 11:59:43,682] Trial 301 finished with value: 1.2190875046931895 and parameters: {'n_estimators': 126, 'max_depth': 22, 'min_samples_split': 6, 'min_samples_leaf': 2, 'max_features': 'log2', 'bootstrap': False, 'criterion': 'absolute_error'}. Best is trial 170 with value: 0.5079262681451786.
[I 2024-12-04 11:59:44,441] Trial 283 finished with value: 0.5270333430519201 and parameters: {'n_estimators': 982, 'max_depth': 19, 'min_samples_split': 10, 'min_samples_leaf': 1, 'max_features': None, 'bootstrap': True, 'criterion': 'squared_error'}. Best is trial 170 with value: 0.5079262681451786.
[I 2024-12-04 11:59:44,455] Trial 296 finished with value: 0.5110248686868749 and parameters: {'n_estimators': 112, 'max_depth': 23, 'min_samples_split': 6, 'min_samples_leaf': 1, 'max_features': None, 'bootstrap': True, 'criterion': 'absolute_error'}. Best is trial 170 with value: 0.5079262681451786.
[I 2024-12-04 11:59:44,810] Trial 294 finished with value: 0.5200084344676982 and parameters: {'n_estimators': 109, 'max_depth': 20, 'min_samples_split': 8, 'min_samples_leaf': 1, 'max_features': None, 'bootstrap': True, 'criterion': 'absolute_error'}. Best is trial 170 with value: 0.5079262681451786.
[I 2024-12-04 11:59:45,251] Trial 295 finished with value: 0.511815263123688 and parameters: {'n_estimators': 120, 'max_depth': 18, 'min_samples_split': 6, 'min_samples_leaf': 1, 'max_features': None, 'bootstrap': True, 'criterion': 'absolute_error'}. Best is trial 170 with value: 0.5079262681451786.
[I 2024-12-04 11:59:45,716] Trial 293 finished with value: 0.5615554452103965 and parameters: {'n_estimators': 977, 'max_depth': 15, 'min_samples_split': 5, 'min_samples_leaf': 1, 'max_features': None, 'bootstrap': False, 'criterion': 'squared_error'}. Best is trial 170 with value: 0.5079262681451786.
[I 2024-12-04 11:59:46,471] Trial 305 finished with value: 0.6108134438087222 and parameters: {'n_estimators': 125, 'max_depth': 33, 'min_samples_split': 23, 'min_samples_leaf': 2, 'max_features': None, 'bootstrap': False, 'criterion': 'squared_error'}. Best is trial 170 with value: 0.5079262681451786.
[I 2024-12-04 11:59:46,962] Trial 246 finished with value: 0.51525589810642 and parameters: {'n_estimators': 951, 'max_depth': 11, 'min_samples_split': 2, 'min_samples_leaf': 1, 'max_features': None, 'bootstrap': True, 'criterion': 'absolute_error'}. Best is trial 170 with value: 0.5079262681451786.
[I 2024-12-04 11:59:48,150] Trial 289 finished with value: 0.5199261102588558 and parameters: {'n_estimators': 172, 'max_depth': 17, 'min_samples_split': 7, 'min_samples_leaf': 1, 'max_features': None, 'bootstrap': True, 'criterion': 'absolute_error'}. Best is trial 170 with value: 0.5079262681451786.
[I 2024-12-04 11:59:49,527] Trial 298 finished with value: 0.5258535956682969 and parameters: {'n_estimators': 106, 'max_depth': 7, 'min_samples_split': 4, 'min_samples_leaf': 1, 'max_features': None, 'bootstrap': True, 'criterion': 'absolute_error'}. Best is trial 170 with value: 0.5079262681451786.
[I 2024-12-04 11:59:50,598] Trial 288 finished with value: 0.5127868008542443 and parameters: {'n_estimators': 966, 'max_depth': 19, 'min_samples_split': 4, 'min_samples_leaf': 1, 'max_features': None, 'bootstrap': True, 'criterion': 'squared_error'}. Best is trial 170 with value: 0.5079262681451786.
[I 2024-12-04 11:59:55,468] Trial 306 finished with value: 0.5054021215392881 and parameters: {'n_estimators': 123, 'max_depth': 19, 'min_samples_split': 4, 'min_samples_leaf': 1, 'max_features': None, 'bootstrap': True, 'criterion': 'absolute_error'}. Best is trial 306 with value: 0.5054021215392881.
[I 2024-12-04 11:59:56,626] Trial 304 finished with value: 0.5182934466672181 and parameters: {'n_estimators': 156, 'max_depth': 11, 'min_samples_split': 3, 'min_samples_leaf': 1, 'max_features': None, 'bootstrap': True, 'criterion': 'absolute_error'}. Best is trial 306 with value: 0.5054021215392881.
[I 2024-12-04 11:59:57,408] Trial 309 finished with value: 0.5145936451695153 and parameters: {'n_estimators': 115, 'max_depth': 14, 'min_samples_split': 4, 'min_samples_leaf': 1, 'max_features': None, 'bootstrap': True, 'criterion': 'absolute_error'}. Best is trial 306 with value: 0.5054021215392881.
[I 2024-12-04 11:59:58,478] Trial 299 finished with value: 0.8655806504611554 and parameters: {'n_estimators': 649, 'max_depth': 30, 'min_samples_split': 21, 'min_samples_leaf': 2, 'max_features': 'sqrt', 'bootstrap': False, 'criterion': 'absolute_error'}. Best is trial 306 with value: 0.5054021215392881.
[I 2024-12-04 11:59:58,511] Trial 303 finished with value: 0.51751771182621 and parameters: {'n_estimators': 171, 'max_depth': 12, 'min_samples_split': 6, 'min_samples_leaf': 1, 'max_features': None, 'bootstrap': True, 'criterion': 'absolute_error'}. Best is trial 306 with value: 0.5054021215392881.
[I 2024-12-04 12:00:00,316] Trial 317 finished with value: 0.5514490864529131 and parameters: {'n_estimators': 107, 'max_depth': 13, 'min_samples_split': 10, 'min_samples_leaf': 2, 'max_features': None, 'bootstrap': True, 'criterion': 'absolute_error'}. Best is trial 306 with value: 0.5054021215392881.
[I 2024-12-04 12:00:00,738] Trial 300 finished with value: 0.5147790359877153 and parameters: {'n_estimators': 145, 'max_depth': 17, 'min_samples_split': 4, 'min_samples_leaf': 1, 'max_features': None, 'bootstrap': True, 'criterion': 'absolute_error'}. Best is trial 306 with value: 0.5054021215392881.
[I 2024-12-04 12:00:01,008] Trial 312 finished with value: 0.7619087280352609 and parameters: {'n_estimators': 128, 'max_depth': 20, 'min_samples_split': 3, 'min_samples_leaf': 1, 'max_features': 'sqrt', 'bootstrap': False, 'criterion': 'absolute_error'}. Best is trial 306 with value: 0.5054021215392881.
[I 2024-12-04 12:00:04,786] Trial 310 finished with value: 0.5170081404735883 and parameters: {'n_estimators': 195, 'max_depth': 17, 'min_samples_split': 4, 'min_samples_leaf': 1, 'max_features': None, 'bootstrap': True, 'criterion': 'absolute_error'}. Best is trial 306 with value: 0.5054021215392881.
[I 2024-12-04 12:00:07,474] Trial 314 finished with value: 0.8938469589049004 and parameters: {'n_estimators': 266, 'max_depth': 14, 'min_samples_split': 3, 'min_samples_leaf': 1, 'max_features': 'sqrt', 'bootstrap': True, 'criterion': 'absolute_error'}. Best is trial 306 with value: 0.5054021215392881.
[I 2024-12-04 12:00:07,833] Trial 307 finished with value: 0.5238418438752993 and parameters: {'n_estimators': 178, 'max_depth': 20, 'min_samples_split': 8, 'min_samples_leaf': 1, 'max_features': None, 'bootstrap': True, 'criterion': 'absolute_error'}. Best is trial 306 with value: 0.5054021215392881.
[I 2024-12-04 12:00:10,124] Trial 308 finished with value: 0.55205873193411 and parameters: {'n_estimators': 1000, 'max_depth': 21, 'min_samples_split': 2, 'min_samples_leaf': 2, 'max_features': None, 'bootstrap': True, 'criterion': 'squared_error'}. Best is trial 306 with value: 0.5054021215392881.
[I 2024-12-04 12:00:10,318] Trial 323 finished with value: 1.3326558241521795 and parameters: {'n_estimators': 734, 'max_depth': 39, 'min_samples_split': 3, 'min_samples_leaf': 15, 'max_features': 'sqrt', 'bootstrap': False, 'criterion': 'absolute_error'}. Best is trial 306 with value: 0.5054021215392881.
[I 2024-12-04 12:00:12,005] Trial 326 finished with value: 0.5093371739466989 and parameters: {'n_estimators': 107, 'max_depth': 30, 'min_samples_split': 4, 'min_samples_leaf': 1, 'max_features': None, 'bootstrap': True, 'criterion': 'absolute_error'}. Best is trial 306 with value: 0.5054021215392881.
[I 2024-12-04 12:00:12,035] Trial 313 finished with value: 0.5576565685122071 and parameters: {'n_estimators': 333, 'max_depth': 18, 'min_samples_split': 7, 'min_samples_leaf': 2, 'max_features': None, 'bootstrap': True, 'criterion': 'absolute_error'}. Best is trial 306 with value: 0.5054021215392881.
[I 2024-12-04 12:00:12,836] Trial 320 finished with value: 0.8150914402265402 and parameters: {'n_estimators': 989, 'max_depth': 16, 'min_samples_split': 4, 'min_samples_leaf': 1, 'max_features': 'sqrt', 'bootstrap': True, 'criterion': 'squared_error'}. Best is trial 306 with value: 0.5054021215392881.
[I 2024-12-04 12:00:13,109] Trial 256 finished with value: 0.5155534552437303 and parameters: {'n_estimators': 1000, 'max_depth': 16, 'min_samples_split': 2, 'min_samples_leaf': 1, 'max_features': None, 'bootstrap': True, 'criterion': 'absolute_error'}. Best is trial 306 with value: 0.5054021215392881.
[I 2024-12-04 12:00:13,156] Trial 319 finished with value: 0.5395202452244793 and parameters: {'n_estimators': 147, 'max_depth': 20, 'min_samples_split': 6, 'min_samples_leaf': 1, 'max_features': None, 'bootstrap': False, 'criterion': 'absolute_error'}. Best is trial 306 with value: 0.5054021215392881.
[I 2024-12-04 12:00:13,201] Trial 322 finished with value: 0.5081258455508303 and parameters: {'n_estimators': 140, 'max_depth': 16, 'min_samples_split': 4, 'min_samples_leaf': 1, 'max_features': None, 'bootstrap': True, 'criterion': 'absolute_error'}. Best is trial 306 with value: 0.5054021215392881.
[I 2024-12-04 12:00:15,587] Trial 315 finished with value: 0.5174430860653269 and parameters: {'n_estimators': 922, 'max_depth': 13, 'min_samples_split': 4, 'min_samples_leaf': 1, 'max_features': None, 'bootstrap': True, 'criterion': 'squared_error'}. Best is trial 306 with value: 0.5054021215392881.
[I 2024-12-04 12:00:16,700] Trial 321 finished with value: 0.5159888925564592 and parameters: {'n_estimators': 951, 'max_depth': 13, 'min_samples_split': 4, 'min_samples_leaf': 1, 'max_features': None, 'bootstrap': True, 'criterion': 'squared_error'}. Best is trial 306 with value: 0.5054021215392881.
[I 2024-12-04 12:00:16,712] Trial 311 finished with value: 0.5156713828345195 and parameters: {'n_estimators': 975, 'max_depth': 15, 'min_samples_split': 2, 'min_samples_leaf': 1, 'max_features': None, 'bootstrap': True, 'criterion': 'squared_error'}. Best is trial 306 with value: 0.5054021215392881.
[I 2024-12-04 12:00:17,077] Trial 316 finished with value: 0.5144556692125845 and parameters: {'n_estimators': 999, 'max_depth': 22, 'min_samples_split': 4, 'min_samples_leaf': 1, 'max_features': None, 'bootstrap': True, 'criterion': 'squared_error'}. Best is trial 306 with value: 0.5054021215392881.
[I 2024-12-04 12:00:18,338] Trial 331 finished with value: 0.5230684289759445 and parameters: {'n_estimators': 100, 'max_depth': 16, 'min_samples_split': 8, 'min_samples_leaf': 1, 'max_features': None, 'bootstrap': True, 'criterion': 'absolute_error'}. Best is trial 306 with value: 0.5054021215392881.
[I 2024-12-04 12:00:18,654] Trial 330 finished with value: 0.5178125295766459 and parameters: {'n_estimators': 126, 'max_depth': 26, 'min_samples_split': 6, 'min_samples_leaf': 1, 'max_features': None, 'bootstrap': True, 'criterion': 'absolute_error'}. Best is trial 306 with value: 0.5054021215392881.
[I 2024-12-04 12:00:18,656] Trial 333 finished with value: 0.5557588364199685 and parameters: {'n_estimators': 109, 'max_depth': 5, 'min_samples_split': 3, 'min_samples_leaf': 1, 'max_features': None, 'bootstrap': False, 'criterion': 'absolute_error'}. Best is trial 306 with value: 0.5054021215392881.
[I 2024-12-04 12:00:18,941] Trial 327 finished with value: 0.5103118520424398 and parameters: {'n_estimators': 119, 'max_depth': 18, 'min_samples_split': 5, 'min_samples_leaf': 1, 'max_features': None, 'bootstrap': True, 'criterion': 'absolute_error'}. Best is trial 306 with value: 0.5054021215392881.
[I 2024-12-04 12:00:19,067] Trial 337 finished with value: 0.9504392499575847 and parameters: {'n_estimators': 117, 'max_depth': 25, 'min_samples_split': 2, 'min_samples_leaf': 1, 'max_features': 'log2', 'bootstrap': True, 'criterion': 'absolute_error'}. Best is trial 306 with value: 0.5054021215392881.
[I 2024-12-04 12:00:19,090] Trial 328 finished with value: 0.6220567677877658 and parameters: {'n_estimators': 601, 'max_depth': 8, 'min_samples_split': 2, 'min_samples_leaf': 6, 'max_features': None, 'bootstrap': True, 'criterion': 'squared_error'}. Best is trial 306 with value: 0.5054021215392881.
[I 2024-12-04 12:00:19,709] Trial 339 finished with value: 1.1815436696522308 and parameters: {'n_estimators': 478, 'max_depth': 8, 'min_samples_split': 2, 'min_samples_leaf': 3, 'max_features': 'log2', 'bootstrap': False, 'criterion': 'squared_error'}. Best is trial 306 with value: 0.5054021215392881.
[I 2024-12-04 12:00:20,323] Trial 336 finished with value: 0.8223350414347229 and parameters: {'n_estimators': 151, 'max_depth': 20, 'min_samples_split': 9, 'min_samples_leaf': 1, 'max_features': 'sqrt', 'bootstrap': True, 'criterion': 'absolute_error'}. Best is trial 306 with value: 0.5054021215392881.
[I 2024-12-04 12:00:20,358] Trial 338 finished with value: 1.241614291580692 and parameters: {'n_estimators': 383, 'max_depth': 28, 'min_samples_split': 9, 'min_samples_leaf': 9, 'max_features': 'log2', 'bootstrap': True, 'criterion': 'squared_error'}. Best is trial 306 with value: 0.5054021215392881.
[I 2024-12-04 12:00:20,973] Trial 341 finished with value: 1.2907051999708563 and parameters: {'n_estimators': 174, 'max_depth': 17, 'min_samples_split': 4, 'min_samples_leaf': 2, 'max_features': 'log2', 'bootstrap': True, 'criterion': 'absolute_error'}. Best is trial 306 with value: 0.5054021215392881.
[I 2024-12-04 12:00:21,221] Trial 329 finished with value: 0.5125535479612958 and parameters: {'n_estimators': 132, 'max_depth': 21, 'min_samples_split': 5, 'min_samples_leaf': 1, 'max_features': None, 'bootstrap': True, 'criterion': 'absolute_error'}. Best is trial 306 with value: 0.5054021215392881.
[I 2024-12-04 12:00:21,391] Trial 332 finished with value: 1.1355390879278653 and parameters: {'n_estimators': 899, 'max_depth': 35, 'min_samples_split': 21, 'min_samples_leaf': 3, 'max_features': 'sqrt', 'bootstrap': True, 'criterion': 'absolute_error'}. Best is trial 306 with value: 0.5054021215392881.
[I 2024-12-04 12:00:23,077] Trial 334 finished with value: 0.6394062072702805 and parameters: {'n_estimators': 254, 'max_depth': 12, 'min_samples_split': 5, 'min_samples_leaf': 3, 'max_features': None, 'bootstrap': False, 'criterion': 'absolute_error'}. Best is trial 306 with value: 0.5054021215392881.
[I 2024-12-04 12:00:23,833] Trial 335 finished with value: 0.506937513226965 and parameters: {'n_estimators': 130, 'max_depth': 16, 'min_samples_split': 4, 'min_samples_leaf': 1, 'max_features': None, 'bootstrap': True, 'criterion': 'absolute_error'}. Best is trial 306 with value: 0.5054021215392881.
[I 2024-12-04 12:00:24,484] Trial 347 finished with value: 0.6122792441913655 and parameters: {'n_estimators': 494, 'max_depth': 39, 'min_samples_split': 32, 'min_samples_leaf': 6, 'max_features': None, 'bootstrap': False, 'criterion': 'squared_error'}. Best is trial 306 with value: 0.5054021215392881.
[I 2024-12-04 12:00:24,520] Trial 343 finished with value: 0.5617671969788728 and parameters: {'n_estimators': 120, 'max_depth': 25, 'min_samples_split': 3, 'min_samples_leaf': 2, 'max_features': None, 'bootstrap': True, 'criterion': 'absolute_error'}. Best is trial 306 with value: 0.5054021215392881.
[I 2024-12-04 12:00:24,976] Trial 324 finished with value: 0.5506158870412435 and parameters: {'n_estimators': 908, 'max_depth': 20, 'min_samples_split': 4, 'min_samples_leaf': 2, 'max_features': None, 'bootstrap': True, 'criterion': 'squared_error'}. Best is trial 306 with value: 0.5054021215392881.
[I 2024-12-04 12:00:27,780] Trial 325 finished with value: 0.5160900027117415 and parameters: {'n_estimators': 128, 'max_depth': 17, 'min_samples_split': 3, 'min_samples_leaf': 1, 'max_features': None, 'bootstrap': True, 'criterion': 'absolute_error'}. Best is trial 306 with value: 0.5054021215392881.
[I 2024-12-04 12:00:28,071] Trial 344 finished with value: 0.5223832505087503 and parameters: {'n_estimators': 101, 'max_depth': 26, 'min_samples_split': 2, 'min_samples_leaf': 1, 'max_features': None, 'bootstrap': True, 'criterion': 'absolute_error'}. Best is trial 306 with value: 0.5054021215392881.
[I 2024-12-04 12:00:32,152] Trial 346 finished with value: 1.262577546647124 and parameters: {'n_estimators': 486, 'max_depth': 48, 'min_samples_split': 2, 'min_samples_leaf': 5, 'max_features': 'sqrt', 'bootstrap': True, 'criterion': 'absolute_error'}. Best is trial 306 with value: 0.5054021215392881.
[I 2024-12-04 12:00:32,811] Trial 349 finished with value: 1.3683119838585953 and parameters: {'n_estimators': 465, 'max_depth': 46, 'min_samples_split': 11, 'min_samples_leaf': 13, 'max_features': 'log2', 'bootstrap': True, 'criterion': 'absolute_error'}. Best is trial 306 with value: 0.5054021215392881.
[I 2024-12-04 12:00:34,625] Trial 342 finished with value: 0.5105143811157499 and parameters: {'n_estimators': 103, 'max_depth': 22, 'min_samples_split': 5, 'min_samples_leaf': 1, 'max_features': None, 'bootstrap': True, 'criterion': 'absolute_error'}. Best is trial 306 with value: 0.5054021215392881.
[I 2024-12-04 12:00:35,294] Trial 351 finished with value: 0.5142690724910803 and parameters: {'n_estimators': 133, 'max_depth': 21, 'min_samples_split': 6, 'min_samples_leaf': 1, 'max_features': None, 'bootstrap': True, 'criterion': 'absolute_error'}. Best is trial 306 with value: 0.5054021215392881.
[I 2024-12-04 12:00:35,700] Trial 352 finished with value: 0.5110741706063487 and parameters: {'n_estimators': 100, 'max_depth': 12, 'min_samples_split': 6, 'min_samples_leaf': 1, 'max_features': None, 'bootstrap': True, 'criterion': 'absolute_error'}. Best is trial 306 with value: 0.5054021215392881.
[I 2024-12-04 12:00:36,272] Trial 345 finished with value: 0.5134104235770837 and parameters: {'n_estimators': 156, 'max_depth': 25, 'min_samples_split': 5, 'min_samples_leaf': 1, 'max_features': None, 'bootstrap': True, 'criterion': 'absolute_error'}. Best is trial 306 with value: 0.5054021215392881.
[I 2024-12-04 12:00:38,655] Trial 356 finished with value: 1.32895119087824 and parameters: {'n_estimators': 507, 'max_depth': 8, 'min_samples_split': 2, 'min_samples_leaf': 3, 'max_features': 'log2', 'bootstrap': True, 'criterion': 'absolute_error'}. Best is trial 306 with value: 0.5054021215392881.
[I 2024-12-04 12:00:38,895] Trial 367 finished with value: 0.6853302556923232 and parameters: {'n_estimators': 545, 'max_depth': 45, 'min_samples_split': 4, 'min_samples_leaf': 1, 'max_features': 'log2', 'bootstrap': False, 'criterion': 'squared_error'}. Best is trial 306 with value: 0.5054021215392881.
[I 2024-12-04 12:00:39,321] Trial 350 finished with value: 0.5135952486179722 and parameters: {'n_estimators': 128, 'max_depth': 19, 'min_samples_split': 6, 'min_samples_leaf': 1, 'max_features': None, 'bootstrap': True, 'criterion': 'absolute_error'}. Best is trial 306 with value: 0.5054021215392881.
[I 2024-12-04 12:00:39,439] Trial 359 finished with value: 0.5185521157133357 and parameters: {'n_estimators': 131, 'max_depth': 16, 'min_samples_split': 3, 'min_samples_leaf': 1, 'max_features': None, 'bootstrap': True, 'criterion': 'absolute_error'}. Best is trial 306 with value: 0.5054021215392881.
[I 2024-12-04 12:00:39,724] Trial 348 finished with value: 0.5174480890028084 and parameters: {'n_estimators': 170, 'max_depth': 12, 'min_samples_split': 4, 'min_samples_leaf': 1, 'max_features': None, 'bootstrap': True, 'criterion': 'absolute_error'}. Best is trial 306 with value: 0.5054021215392881.
[I 2024-12-04 12:00:39,759] Trial 360 finished with value: 0.5604084668552347 and parameters: {'n_estimators': 171, 'max_depth': 29, 'min_samples_split': 9, 'min_samples_leaf': 2, 'max_features': None, 'bootstrap': True, 'criterion': 'absolute_error'}. Best is trial 306 with value: 0.5054021215392881.
[I 2024-12-04 12:00:39,903] Trial 358 finished with value: 0.5539383802723852 and parameters: {'n_estimators': 104, 'max_depth': 10, 'min_samples_split': 2, 'min_samples_leaf': 2, 'max_features': None, 'bootstrap': True, 'criterion': 'absolute_error'}. Best is trial 306 with value: 0.5054021215392881.
[I 2024-12-04 12:00:40,712] Trial 357 finished with value: 0.549810587478437 and parameters: {'n_estimators': 114, 'max_depth': 9, 'min_samples_split': 4, 'min_samples_leaf': 2, 'max_features': None, 'bootstrap': True, 'criterion': 'absolute_error'}. Best is trial 306 with value: 0.5054021215392881.
[I 2024-12-04 12:00:41,348] Trial 353 finished with value: 0.5639766275542996 and parameters: {'n_estimators': 165, 'max_depth': 6, 'min_samples_split': 4, 'min_samples_leaf': 2, 'max_features': None, 'bootstrap': True, 'criterion': 'absolute_error'}. Best is trial 306 with value: 0.5054021215392881.
[I 2024-12-04 12:00:47,608] Trial 361 finished with value: 0.5131205478287131 and parameters: {'n_estimators': 105, 'max_depth': 32, 'min_samples_split': 4, 'min_samples_leaf': 1, 'max_features': None, 'bootstrap': True, 'criterion': 'absolute_error'}. Best is trial 306 with value: 0.5054021215392881.
[I 2024-12-04 12:00:47,769] Trial 340 finished with value: 0.520514747654779 and parameters: {'n_estimators': 305, 'max_depth': 11, 'min_samples_split': 7, 'min_samples_leaf': 1, 'max_features': None, 'bootstrap': True, 'criterion': 'absolute_error'}. Best is trial 306 with value: 0.5054021215392881.
[I 2024-12-04 12:00:48,126] Trial 363 finished with value: 0.5110873669071618 and parameters: {'n_estimators': 121, 'max_depth': 14, 'min_samples_split': 4, 'min_samples_leaf': 1, 'max_features': None, 'bootstrap': True, 'criterion': 'absolute_error'}. Best is trial 306 with value: 0.5054021215392881.
