[I 2024-12-04 12:29:44,402] Trial 2380 finished with value: 0.5585672037918525 and parameters: {'n_estimators': 113, 'max_depth': 10, 'min_samples_split': 3, 'min_samples_leaf': 1, 'max_features': None, 'bootstrap': False, 'criterion': 'absolute_error'}. Best is trial 1749 with value: 0.502720715661024.
[I 2024-12-04 12:29:44,763] Trial 2371 finished with value: 0.5239744812306234 and parameters: {'n_estimators': 279, 'max_depth': 10, 'min_samples_split': 7, 'min_samples_leaf': 1, 'max_features': None, 'bootstrap': True, 'criterion': 'absolute_error'}. Best is trial 1749 with value: 0.502720715661024.
[I 2024-12-04 12:29:46,800] Trial 2387 finished with value: 1.1030175656342684 and parameters: {'n_estimators': 133, 'max_depth': 15, 'min_samples_split': 4, 'min_samples_leaf': 1, 'max_features': 'log2', 'bootstrap': True, 'criterion': 'absolute_error'}. Best is trial 1749 with value: 0.502720715661024.
[I 2024-12-04 12:29:47,819] Trial 2382 finished with value: 0.5499985047254398 and parameters: {'n_estimators': 102, 'max_depth': 6, 'min_samples_split': 8, 'min_samples_leaf': 1, 'max_features': None, 'bootstrap': True, 'criterion': 'absolute_error'}. Best is trial 1749 with value: 0.502720715661024.
[I 2024-12-04 12:29:48,034] Trial 2377 finished with value: 0.6402893439337074 and parameters: {'n_estimators': 687, 'max_depth': 44, 'min_samples_split': 9, 'min_samples_leaf': 2, 'max_features': None, 'bootstrap': False, 'criterion': 'squared_error'}. Best is trial 1749 with value: 0.502720715661024.
[I 2024-12-04 12:29:48,375] Trial 2370 finished with value: 0.5150009586036788 and parameters: {'n_estimators': 254, 'max_depth': 16, 'min_samples_split': 4, 'min_samples_leaf': 1, 'max_features': None, 'bootstrap': True, 'criterion': 'absolute_error'}. Best is trial 1749 with value: 0.502720715661024.
[I 2024-12-04 12:29:50,211] Trial 2379 finished with value: 0.5612570192632713 and parameters: {'n_estimators': 230, 'max_depth': 19, 'min_samples_split': 6, 'min_samples_leaf': 2, 'max_features': None, 'bootstrap': True, 'criterion': 'absolute_error'}. Best is trial 1749 with value: 0.502720715661024.
[I 2024-12-04 12:29:50,212] Trial 2389 finished with value: 0.552270187803369 and parameters: {'n_estimators': 101, 'max_depth': 10, 'min_samples_split': 4, 'min_samples_leaf': 2, 'max_features': None, 'bootstrap': True, 'criterion': 'absolute_error'}. Best is trial 1749 with value: 0.502720715661024.
[I 2024-12-04 12:29:50,477] Trial 2385 finished with value: 0.6192513017568669 and parameters: {'n_estimators': 717, 'max_depth': 8, 'min_samples_split': 4, 'min_samples_leaf': 4, 'max_features': None, 'bootstrap': False, 'criterion': 'squared_error'}. Best is trial 1749 with value: 0.502720715661024.
[I 2024-12-04 12:29:51,047] Trial 2384 finished with value: 0.532471051436033 and parameters: {'n_estimators': 121, 'max_depth': 24, 'min_samples_split': 7, 'min_samples_leaf': 1, 'max_features': None, 'bootstrap': False, 'criterion': 'absolute_error'}. Best is trial 1749 with value: 0.502720715661024.
[I 2024-12-04 12:29:52,373] Trial 2386 finished with value: 0.5112325473723004 and parameters: {'n_estimators': 102, 'max_depth': 19, 'min_samples_split': 6, 'min_samples_leaf': 1, 'max_features': None, 'bootstrap': True, 'criterion': 'absolute_error'}. Best is trial 1749 with value: 0.502720715661024.
[I 2024-12-04 12:29:54,902] Trial 2390 finished with value: 0.5104335833783954 and parameters: {'n_estimators': 109, 'max_depth': 23, 'min_samples_split': 4, 'min_samples_leaf': 1, 'max_features': None, 'bootstrap': True, 'criterion': 'absolute_error'}. Best is trial 1749 with value: 0.502720715661024.
[I 2024-12-04 12:29:57,898] Trial 2391 finished with value: 0.5235691821785284 and parameters: {'n_estimators': 102, 'max_depth': 16, 'min_samples_split': 8, 'min_samples_leaf': 1, 'max_features': None, 'bootstrap': True, 'criterion': 'absolute_error'}. Best is trial 1749 with value: 0.502720715661024.
[I 2024-12-04 12:30:02,721] Trial 2396 finished with value: 0.5159588284249879 and parameters: {'n_estimators': 117, 'max_depth': 15, 'min_samples_split': 6, 'min_samples_leaf': 1, 'max_features': None, 'bootstrap': True, 'criterion': 'absolute_error'}. Best is trial 1749 with value: 0.502720715661024.
[I 2024-12-04 12:30:03,867] Trial 2398 finished with value: 0.5190574459169847 and parameters: {'n_estimators': 106, 'max_depth': 22, 'min_samples_split': 7, 'min_samples_leaf': 1, 'max_features': None, 'bootstrap': True, 'criterion': 'absolute_error'}. Best is trial 1749 with value: 0.502720715661024.
[I 2024-12-04 12:30:04,742] Trial 2383 finished with value: 0.5226532050584545 and parameters: {'n_estimators': 280, 'max_depth': 24, 'min_samples_split': 7, 'min_samples_leaf': 1, 'max_features': None, 'bootstrap': True, 'criterion': 'absolute_error'}. Best is trial 1749 with value: 0.502720715661024.
[I 2024-12-04 12:30:05,851] Trial 2394 finished with value: 0.5118858955290164 and parameters: {'n_estimators': 230, 'max_depth': 19, 'min_samples_split': 5, 'min_samples_leaf': 1, 'max_features': None, 'bootstrap': True, 'criterion': 'absolute_error'}. Best is trial 1749 with value: 0.502720715661024.
[I 2024-12-04 12:30:05,914] Trial 2403 finished with value: 0.5814183720549826 and parameters: {'n_estimators': 102, 'max_depth': 19, 'min_samples_split': 31, 'min_samples_leaf': 2, 'max_features': None, 'bootstrap': False, 'criterion': 'absolute_error'}. Best is trial 1749 with value: 0.502720715661024.
[I 2024-12-04 12:30:06,065] Trial 2400 finished with value: 0.5165888279536898 and parameters: {'n_estimators': 107, 'max_depth': 10, 'min_samples_split': 4, 'min_samples_leaf': 1, 'max_features': None, 'bootstrap': True, 'criterion': 'absolute_error'}. Best is trial 1749 with value: 0.502720715661024.
[I 2024-12-04 12:30:07,654] Trial 2395 finished with value: 0.5186844920343855 and parameters: {'n_estimators': 226, 'max_depth': 14, 'min_samples_split': 4, 'min_samples_leaf': 1, 'max_features': None, 'bootstrap': True, 'criterion': 'absolute_error'}. Best is trial 1749 with value: 0.502720715661024.
[I 2024-12-04 12:30:08,548] Trial 2404 finished with value: 0.523448408964301 and parameters: {'n_estimators': 100, 'max_depth': 11, 'min_samples_split': 8, 'min_samples_leaf': 1, 'max_features': None, 'bootstrap': True, 'criterion': 'absolute_error'}. Best is trial 1749 with value: 0.502720715661024.
[I 2024-12-04 12:30:09,457] Trial 2401 finished with value: 0.5140010062615848 and parameters: {'n_estimators': 117, 'max_depth': 24, 'min_samples_split': 4, 'min_samples_leaf': 1, 'max_features': None, 'bootstrap': True, 'criterion': 'absolute_error'}. Best is trial 1749 with value: 0.502720715661024.
[I 2024-12-04 12:30:09,797] Trial 2375 finished with value: 0.5427527149828606 and parameters: {'n_estimators': 440, 'max_depth': 13, 'min_samples_split': 10, 'min_samples_leaf': 1, 'max_features': None, 'bootstrap': False, 'criterion': 'absolute_error'}. Best is trial 1749 with value: 0.502720715661024.
[I 2024-12-04 12:30:11,147] Trial 2406 finished with value: 0.5589890570341172 and parameters: {'n_estimators': 110, 'max_depth': 13, 'min_samples_split': 7, 'min_samples_leaf': 2, 'max_features': None, 'bootstrap': True, 'criterion': 'absolute_error'}. Best is trial 1749 with value: 0.502720715661024.
[I 2024-12-04 12:30:11,521] Trial 2393 finished with value: 0.5163822473904819 and parameters: {'n_estimators': 224, 'max_depth': 18, 'min_samples_split': 5, 'min_samples_leaf': 1, 'max_features': None, 'bootstrap': True, 'criterion': 'absolute_error'}. Best is trial 1749 with value: 0.502720715661024.
[I 2024-12-04 12:30:11,950] Trial 2399 finished with value: 0.5588902825727604 and parameters: {'n_estimators': 243, 'max_depth': 18, 'min_samples_split': 3, 'min_samples_leaf': 2, 'max_features': None, 'bootstrap': True, 'criterion': 'absolute_error'}. Best is trial 1749 with value: 0.502720715661024.
[I 2024-12-04 12:30:12,073] Trial 2405 finished with value: 0.5526288116168626 and parameters: {'n_estimators': 103, 'max_depth': 19, 'min_samples_split': 11, 'min_samples_leaf': 2, 'max_features': None, 'bootstrap': True, 'criterion': 'absolute_error'}. Best is trial 1749 with value: 0.502720715661024.
[I 2024-12-04 12:30:12,858] Trial 2408 finished with value: 1.2229828075310023 and parameters: {'n_estimators': 495, 'max_depth': 10, 'min_samples_split': 45, 'min_samples_leaf': 4, 'max_features': 'log2', 'bootstrap': True, 'criterion': 'squared_error'}. Best is trial 1749 with value: 0.502720715661024.
[I 2024-12-04 12:30:12,859] Trial 2413 finished with value: 0.5165770012202684 and parameters: {'n_estimators': 102, 'max_depth': 17, 'min_samples_split': 3, 'min_samples_leaf': 1, 'max_features': None, 'bootstrap': True, 'criterion': 'absolute_error'}. Best is trial 1749 with value: 0.502720715661024.
[I 2024-12-04 12:30:13,241] Trial 2392 finished with value: 0.5260957944240375 and parameters: {'n_estimators': 233, 'max_depth': 20, 'min_samples_split': 7, 'min_samples_leaf': 1, 'max_features': None, 'bootstrap': True, 'criterion': 'absolute_error'}. Best is trial 1749 with value: 0.502720715661024.
[I 2024-12-04 12:30:13,562] Trial 2411 finished with value: 0.7220660327892098 and parameters: {'n_estimators': 104, 'max_depth': 23, 'min_samples_split': 2, 'min_samples_leaf': 1, 'max_features': 'sqrt', 'bootstrap': True, 'criterion': 'absolute_error'}. Best is trial 1749 with value: 0.502720715661024.
[I 2024-12-04 12:30:13,978] Trial 2414 finished with value: 0.5127037853536638 and parameters: {'n_estimators': 109, 'max_depth': 16, 'min_samples_split': 6, 'min_samples_leaf': 1, 'max_features': None, 'bootstrap': True, 'criterion': 'absolute_error'}. Best is trial 1749 with value: 0.502720715661024.
[I 2024-12-04 12:30:14,697] Trial 2409 finished with value: 0.5585323011279821 and parameters: {'n_estimators': 228, 'max_depth': 13, 'min_samples_split': 6, 'min_samples_leaf': 2, 'max_features': None, 'bootstrap': True, 'criterion': 'absolute_error'}. Best is trial 1749 with value: 0.502720715661024.
[I 2024-12-04 12:30:14,762] Trial 2402 finished with value: 0.557960419484558 and parameters: {'n_estimators': 283, 'max_depth': 5, 'min_samples_split': 6, 'min_samples_leaf': 1, 'max_features': None, 'bootstrap': True, 'criterion': 'absolute_error'}. Best is trial 1749 with value: 0.502720715661024.
[I 2024-12-04 12:30:15,760] Trial 2422 finished with value: 1.2889528886010928 and parameters: {'n_estimators': 111, 'max_depth': 16, 'min_samples_split': 6, 'min_samples_leaf': 2, 'max_features': 'log2', 'bootstrap': True, 'criterion': 'absolute_error'}. Best is trial 1749 with value: 0.502720715661024.
[I 2024-12-04 12:30:16,201] Trial 2407 finished with value: 0.5959224200737177 and parameters: {'n_estimators': 769, 'max_depth': 36, 'min_samples_split': 29, 'min_samples_leaf': 1, 'max_features': None, 'bootstrap': False, 'criterion': 'squared_error'}. Best is trial 1749 with value: 0.502720715661024.
[I 2024-12-04 12:30:16,281] Trial 2397 finished with value: 0.588341702985017 and parameters: {'n_estimators': 562, 'max_depth': 46, 'min_samples_split': 5, 'min_samples_leaf': 4, 'max_features': None, 'bootstrap': True, 'criterion': 'absolute_error'}. Best is trial 1749 with value: 0.502720715661024.
[I 2024-12-04 12:30:17,231] Trial 2412 finished with value: 0.522609710241268 and parameters: {'n_estimators': 102, 'max_depth': 27, 'min_samples_split': 8, 'min_samples_leaf': 1, 'max_features': None, 'bootstrap': True, 'criterion': 'absolute_error'}. Best is trial 1749 with value: 0.502720715661024.
[I 2024-12-04 12:30:19,040] Trial 2415 finished with value: 1.2159676332987972 and parameters: {'n_estimators': 656, 'max_depth': 9, 'min_samples_split': 47, 'min_samples_leaf': 1, 'max_features': 'log2', 'bootstrap': False, 'criterion': 'absolute_error'}. Best is trial 1749 with value: 0.502720715661024.
[I 2024-12-04 12:30:19,073] Trial 2420 finished with value: 0.8177807125507658 and parameters: {'n_estimators': 203, 'max_depth': 30, 'min_samples_split': 2, 'min_samples_leaf': 1, 'max_features': 'log2', 'bootstrap': True, 'criterion': 'squared_error'}. Best is trial 1749 with value: 0.502720715661024.
[I 2024-12-04 12:30:19,421] Trial 2417 finished with value: 0.5110741706063487 and parameters: {'n_estimators': 100, 'max_depth': 12, 'min_samples_split': 6, 'min_samples_leaf': 1, 'max_features': None, 'bootstrap': True, 'criterion': 'absolute_error'}. Best is trial 1749 with value: 0.502720715661024.
[I 2024-12-04 12:30:19,677] Trial 2410 finished with value: 0.5555779049865698 and parameters: {'n_estimators': 109, 'max_depth': 16, 'min_samples_split': 2, 'min_samples_leaf': 2, 'max_features': None, 'bootstrap': True, 'criterion': 'absolute_error'}. Best is trial 1749 with value: 0.502720715661024.
[I 2024-12-04 12:30:22,391] Trial 2419 finished with value: 0.5583256970478722 and parameters: {'n_estimators': 221, 'max_depth': 29, 'min_samples_split': 4, 'min_samples_leaf': 2, 'max_features': None, 'bootstrap': True, 'criterion': 'absolute_error'}. Best is trial 1749 with value: 0.502720715661024.
[I 2024-12-04 12:30:23,558] Trial 2416 finished with value: 0.5580988452588016 and parameters: {'n_estimators': 103, 'max_depth': 24, 'min_samples_split': 4, 'min_samples_leaf': 2, 'max_features': None, 'bootstrap': True, 'criterion': 'absolute_error'}. Best is trial 1749 with value: 0.502720715661024.
[I 2024-12-04 12:30:25,772] Trial 2427 finished with value: 0.5149181576752471 and parameters: {'n_estimators': 100, 'max_depth': 13, 'min_samples_split': 6, 'min_samples_leaf': 1, 'max_features': None, 'bootstrap': True, 'criterion': 'absolute_error'}. Best is trial 1749 with value: 0.502720715661024.
[I 2024-12-04 12:30:31,414] Trial 2429 finished with value: 0.5095861565072765 and parameters: {'n_estimators': 108, 'max_depth': 15, 'min_samples_split': 5, 'min_samples_leaf': 1, 'max_features': None, 'bootstrap': True, 'criterion': 'absolute_error'}. Best is trial 1749 with value: 0.502720715661024.
[I 2024-12-04 12:30:34,488] Trial 2418 finished with value: 0.5162011209074823 and parameters: {'n_estimators': 242, 'max_depth': 20, 'min_samples_split': 4, 'min_samples_leaf': 1, 'max_features': None, 'bootstrap': True, 'criterion': 'absolute_error'}. Best is trial 1749 with value: 0.502720715661024.
[I 2024-12-04 12:30:36,962] Trial 2424 finished with value: 0.5185664969048743 and parameters: {'n_estimators': 106, 'max_depth': 20, 'min_samples_split': 3, 'min_samples_leaf': 1, 'max_features': None, 'bootstrap': True, 'criterion': 'absolute_error'}. Best is trial 1749 with value: 0.502720715661024.
[I 2024-12-04 12:30:37,060] Trial 2430 finished with value: 0.5565474474980926 and parameters: {'n_estimators': 114, 'max_depth': 23, 'min_samples_split': 6, 'min_samples_leaf': 2, 'max_features': None, 'bootstrap': True, 'criterion': 'absolute_error'}. Best is trial 1749 with value: 0.502720715661024.
[I 2024-12-04 12:30:37,112] Trial 2437 finished with value: 0.5129734122517284 and parameters: {'n_estimators': 109, 'max_depth': 28, 'min_samples_split': 5, 'min_samples_leaf': 1, 'max_features': None, 'bootstrap': True, 'criterion': 'absolute_error'}. Best is trial 1749 with value: 0.502720715661024.
[I 2024-12-04 12:30:37,605] Trial 2439 finished with value: 1.0320714458048832 and parameters: {'n_estimators': 429, 'max_depth': 18, 'min_samples_split': 7, 'min_samples_leaf': 3, 'max_features': 'sqrt', 'bootstrap': False, 'criterion': 'absolute_error'}. Best is trial 1749 with value: 0.502720715661024.
[I 2024-12-04 12:30:39,488] Trial 2421 finished with value: 0.5605965268333449 and parameters: {'n_estimators': 223, 'max_depth': 20, 'min_samples_split': 6, 'min_samples_leaf': 2, 'max_features': None, 'bootstrap': True, 'criterion': 'absolute_error'}. Best is trial 1749 with value: 0.502720715661024.
[I 2024-12-04 12:30:39,765] Trial 2425 finished with value: 0.5190674168349596 and parameters: {'n_estimators': 212, 'max_depth': 26, 'min_samples_split': 5, 'min_samples_leaf': 1, 'max_features': None, 'bootstrap': True, 'criterion': 'absolute_error'}. Best is trial 1749 with value: 0.502720715661024.
[I 2024-12-04 12:30:39,770] Trial 2440 finished with value: 0.949488796703958 and parameters: {'n_estimators': 941, 'max_depth': 8, 'min_samples_split': 33, 'min_samples_leaf': 1, 'max_features': 'sqrt', 'bootstrap': False, 'criterion': 'squared_error'}. Best is trial 1749 with value: 0.502720715661024.
[I 2024-12-04 12:30:40,152] Trial 2432 finished with value: 0.5177626704386762 and parameters: {'n_estimators': 104, 'max_depth': 12, 'min_samples_split': 3, 'min_samples_leaf': 1, 'max_features': None, 'bootstrap': True, 'criterion': 'absolute_error'}. Best is trial 1749 with value: 0.502720715661024.
[I 2024-12-04 12:30:41,229] Trial 2434 finished with value: 0.6827677861660933 and parameters: {'n_estimators': 359, 'max_depth': 50, 'min_samples_split': 16, 'min_samples_leaf': 1, 'max_features': 'sqrt', 'bootstrap': True, 'criterion': 'absolute_error'}. Best is trial 1749 with value: 0.502720715661024.
[I 2024-12-04 12:30:41,253] Trial 2423 finished with value: 0.5188982729649977 and parameters: {'n_estimators': 242, 'max_depth': 27, 'min_samples_split': 4, 'min_samples_leaf': 1, 'max_features': None, 'bootstrap': True, 'criterion': 'absolute_error'}. Best is trial 1749 with value: 0.502720715661024.
[I 2024-12-04 12:30:42,193] Trial 2431 finished with value: 0.5124107590621455 and parameters: {'n_estimators': 105, 'max_depth': 19, 'min_samples_split': 6, 'min_samples_leaf': 1, 'max_features': None, 'bootstrap': True, 'criterion': 'absolute_error'}. Best is trial 1749 with value: 0.502720715661024.
[I 2024-12-04 12:30:42,462] Trial 2428 finished with value: 0.5180942762704925 and parameters: {'n_estimators': 238, 'max_depth': 23, 'min_samples_split': 4, 'min_samples_leaf': 1, 'max_features': None, 'bootstrap': True, 'criterion': 'absolute_error'}. Best is trial 1749 with value: 0.502720715661024.
[I 2024-12-04 12:30:43,033] Trial 2447 finished with value: 1.2325877566412062 and parameters: {'n_estimators': 274, 'max_depth': 10, 'min_samples_split': 2, 'min_samples_leaf': 5, 'max_features': 'log2', 'bootstrap': True, 'criterion': 'squared_error'}. Best is trial 1749 with value: 0.502720715661024.
[I 2024-12-04 12:30:43,061] Trial 2345 finished with value: 0.8275415496317119 and parameters: {'n_estimators': 856, 'max_depth': 46, 'min_samples_split': 47, 'min_samples_leaf': 1, 'max_features': None, 'bootstrap': False, 'criterion': 'absolute_error'}. Best is trial 1749 with value: 0.502720715661024.
[I 2024-12-04 12:30:43,775] Trial 2426 finished with value: 0.5168651180348593 and parameters: {'n_estimators': 266, 'max_depth': 16, 'min_samples_split': 6, 'min_samples_leaf': 1, 'max_features': None, 'bootstrap': True, 'criterion': 'absolute_error'}. Best is trial 1749 with value: 0.502720715661024.
[I 2024-12-04 12:30:43,799] Trial 2438 finished with value: 0.5078352017710269 and parameters: {'n_estimators': 102, 'max_depth': 18, 'min_samples_split': 6, 'min_samples_leaf': 1, 'max_features': None, 'bootstrap': True, 'criterion': 'absolute_error'}. Best is trial 1749 with value: 0.502720715661024.
[I 2024-12-04 12:30:46,751] Trial 2443 finished with value: 0.5055932410128694 and parameters: {'n_estimators': 104, 'max_depth': 19, 'min_samples_split': 4, 'min_samples_leaf': 1, 'max_features': None, 'bootstrap': True, 'criterion': 'absolute_error'}. Best is trial 1749 with value: 0.502720715661024.
[I 2024-12-04 12:30:48,581] Trial 2435 finished with value: 0.5115911983732585 and parameters: {'n_estimators': 113, 'max_depth': 13, 'min_samples_split': 3, 'min_samples_leaf': 1, 'max_features': None, 'bootstrap': True, 'criterion': 'absolute_error'}. Best is trial 1749 with value: 0.502720715661024.
[I 2024-12-04 12:30:51,076] Trial 2444 finished with value: 0.5588689215626604 and parameters: {'n_estimators': 119, 'max_depth': 5, 'min_samples_split': 3, 'min_samples_leaf': 1, 'max_features': None, 'bootstrap': True, 'criterion': 'absolute_error'}. Best is trial 1749 with value: 0.502720715661024.
[I 2024-12-04 12:30:51,921] Trial 2442 finished with value: 0.5168619495158036 and parameters: {'n_estimators': 232, 'max_depth': 21, 'min_samples_split': 5, 'min_samples_leaf': 1, 'max_features': None, 'bootstrap': True, 'criterion': 'absolute_error'}. Best is trial 1749 with value: 0.502720715661024.
[I 2024-12-04 12:30:51,966] Trial 2441 finished with value: 0.5175198816319307 and parameters: {'n_estimators': 241, 'max_depth': 21, 'min_samples_split': 5, 'min_samples_leaf': 1, 'max_features': None, 'bootstrap': True, 'criterion': 'absolute_error'}. Best is trial 1749 with value: 0.502720715661024.
[I 2024-12-04 12:30:51,984] Trial 2436 finished with value: 0.5150288119601544 and parameters: {'n_estimators': 270, 'max_depth': 15, 'min_samples_split': 4, 'min_samples_leaf': 1, 'max_features': None, 'bootstrap': True, 'criterion': 'absolute_error'}. Best is trial 1749 with value: 0.502720715661024.
[I 2024-12-04 12:30:54,828] Trial 2461 finished with value: 0.5180042228759151 and parameters: {'n_estimators': 200, 'max_depth': 14, 'min_samples_split': 5, 'min_samples_leaf': 1, 'max_features': None, 'bootstrap': True, 'criterion': 'squared_error'}. Best is trial 1749 with value: 0.502720715661024.
[I 2024-12-04 12:30:55,296] Trial 2451 finished with value: 0.5138262261492976 and parameters: {'n_estimators': 113, 'max_depth': 21, 'min_samples_split': 4, 'min_samples_leaf': 1, 'max_features': None, 'bootstrap': True, 'criterion': 'absolute_error'}. Best is trial 1749 with value: 0.502720715661024.
[I 2024-12-04 12:30:55,733] Trial 2454 finished with value: 0.5872982830924124 and parameters: {'n_estimators': 260, 'max_depth': 26, 'min_samples_split': 48, 'min_samples_leaf': 1, 'max_features': None, 'bootstrap': True, 'criterion': 'squared_error'}. Best is trial 1749 with value: 0.502720715661024.
