[I 2024-12-04 12:18:09,779] Trial 1577 finished with value: 0.5173447375761578 and parameters: {'n_estimators': 104, 'max_depth': 18, 'min_samples_split': 3, 'min_samples_leaf': 1, 'max_features': None, 'bootstrap': True, 'criterion': 'absolute_error'}. Best is trial 744 with value: 0.5032383725751689.
[I 2024-12-04 12:18:11,000] Trial 1576 finished with value: 0.5198620136082645 and parameters: {'n_estimators': 254, 'max_depth': 12, 'min_samples_split': 3, 'min_samples_leaf': 1, 'max_features': None, 'bootstrap': True, 'criterion': 'absolute_error'}. Best is trial 744 with value: 0.5032383725751689.
[I 2024-12-04 12:18:11,001] Trial 1604 finished with value: 1.1788046715632847 and parameters: {'n_estimators': 118, 'max_depth': 12, 'min_samples_split': 2, 'min_samples_leaf': 2, 'max_features': 'log2', 'bootstrap': True, 'criterion': 'squared_error'}. Best is trial 744 with value: 0.5032383725751689.
[I 2024-12-04 12:18:12,552] Trial 1586 finished with value: 0.5099521135314633 and parameters: {'n_estimators': 112, 'max_depth': 24, 'min_samples_split': 5, 'min_samples_leaf': 1, 'max_features': None, 'bootstrap': True, 'criterion': 'absolute_error'}. Best is trial 744 with value: 0.5032383725751689.
[I 2024-12-04 12:18:15,197] Trial 1599 finished with value: 1.1098068224552113 and parameters: {'n_estimators': 121, 'max_depth': 22, 'min_samples_split': 20, 'min_samples_leaf': 2, 'max_features': 'log2', 'bootstrap': False, 'criterion': 'squared_error'}. Best is trial 744 with value: 0.5032383725751689.
[I 2024-12-04 12:18:16,267] Trial 1583 finished with value: 0.5543466802663889 and parameters: {'n_estimators': 253, 'max_depth': 9, 'min_samples_split': 4, 'min_samples_leaf': 2, 'max_features': None, 'bootstrap': True, 'criterion': 'absolute_error'}. Best is trial 744 with value: 0.5032383725751689.
[I 2024-12-04 12:18:16,971] Trial 1596 finished with value: 0.5095997593850908 and parameters: {'n_estimators': 114, 'max_depth': 20, 'min_samples_split': 5, 'min_samples_leaf': 1, 'max_features': None, 'bootstrap': True, 'criterion': 'absolute_error'}. Best is trial 744 with value: 0.5032383725751689.
[I 2024-12-04 12:18:17,040] Trial 1602 finished with value: 1.079043076506212 and parameters: {'n_estimators': 219, 'max_depth': 18, 'min_samples_split': 12, 'min_samples_leaf': 1, 'max_features': 'log2', 'bootstrap': True, 'criterion': 'absolute_error'}. Best is trial 744 with value: 0.5032383725751689.
[I 2024-12-04 12:18:17,073] Trial 1593 finished with value: 0.5074477492295305 and parameters: {'n_estimators': 100, 'max_depth': 24, 'min_samples_split': 5, 'min_samples_leaf': 1, 'max_features': None, 'bootstrap': True, 'criterion': 'absolute_error'}. Best is trial 744 with value: 0.5032383725751689.
[I 2024-12-04 12:18:17,075] Trial 1598 finished with value: 0.5542154998909752 and parameters: {'n_estimators': 100, 'max_depth': 27, 'min_samples_split': 5, 'min_samples_leaf': 2, 'max_features': None, 'bootstrap': True, 'criterion': 'absolute_error'}. Best is trial 744 with value: 0.5032383725751689.
[I 2024-12-04 12:18:17,251] Trial 1595 finished with value: 0.5581120796546832 and parameters: {'n_estimators': 102, 'max_depth': 18, 'min_samples_split': 6, 'min_samples_leaf': 2, 'max_features': None, 'bootstrap': True, 'criterion': 'absolute_error'}. Best is trial 744 with value: 0.5032383725751689.
[I 2024-12-04 12:18:17,285] Trial 1591 finished with value: 0.5071764451737801 and parameters: {'n_estimators': 107, 'max_depth': 14, 'min_samples_split': 5, 'min_samples_leaf': 1, 'max_features': None, 'bootstrap': True, 'criterion': 'absolute_error'}. Best is trial 744 with value: 0.5032383725751689.
[I 2024-12-04 12:18:18,532] Trial 1588 finished with value: 0.554446049736522 and parameters: {'n_estimators': 241, 'max_depth': 14, 'min_samples_split': 4, 'min_samples_leaf': 2, 'max_features': None, 'bootstrap': True, 'criterion': 'absolute_error'}. Best is trial 744 with value: 0.5032383725751689.
[I 2024-12-04 12:18:18,643] Trial 1600 finished with value: 0.5209775576515572 and parameters: {'n_estimators': 170, 'max_depth': 19, 'min_samples_split': 4, 'min_samples_leaf': 1, 'max_features': None, 'bootstrap': True, 'criterion': 'squared_error'}. Best is trial 744 with value: 0.5032383725751689.
[I 2024-12-04 12:18:20,677] Trial 1603 finished with value: 1.1400389688214374 and parameters: {'n_estimators': 366, 'max_depth': 28, 'min_samples_split': 29, 'min_samples_leaf': 3, 'max_features': 'sqrt', 'bootstrap': True, 'criterion': 'absolute_error'}. Best is trial 744 with value: 0.5032383725751689.
[I 2024-12-04 12:18:21,003] Trial 1601 finished with value: 0.5222831343220203 and parameters: {'n_estimators': 117, 'max_depth': 9, 'min_samples_split': 3, 'min_samples_leaf': 1, 'max_features': None, 'bootstrap': True, 'criterion': 'absolute_error'}. Best is trial 744 with value: 0.5032383725751689.
[I 2024-12-04 12:18:21,707] Trial 1592 finished with value: 0.5751857621302844 and parameters: {'n_estimators': 398, 'max_depth': 5, 'min_samples_split': 10, 'min_samples_leaf': 2, 'max_features': None, 'bootstrap': True, 'criterion': 'absolute_error'}. Best is trial 744 with value: 0.5032383725751689.
[I 2024-12-04 12:18:23,871] Trial 1587 finished with value: 0.5222762576004747 and parameters: {'n_estimators': 261, 'max_depth': 22, 'min_samples_split': 4, 'min_samples_leaf': 1, 'max_features': None, 'bootstrap': True, 'criterion': 'absolute_error'}. Best is trial 744 with value: 0.5032383725751689.
[I 2024-12-04 12:18:24,364] Trial 1605 finished with value: 0.5562275025419592 and parameters: {'n_estimators': 103, 'max_depth': 18, 'min_samples_split': 4, 'min_samples_leaf': 2, 'max_features': None, 'bootstrap': True, 'criterion': 'absolute_error'}. Best is trial 744 with value: 0.5032383725751689.
[I 2024-12-04 12:18:24,598] Trial 1607 finished with value: 1.0210320300957982 and parameters: {'n_estimators': 121, 'max_depth': 11, 'min_samples_split': 3, 'min_samples_leaf': 1, 'max_features': 'sqrt', 'bootstrap': True, 'criterion': 'absolute_error'}. Best is trial 744 with value: 0.5032383725751689.
[I 2024-12-04 12:18:24,992] Trial 1609 finished with value: 0.8407566924306282 and parameters: {'n_estimators': 153, 'max_depth': 17, 'min_samples_split': 3, 'min_samples_leaf': 1, 'max_features': 'sqrt', 'bootstrap': True, 'criterion': 'absolute_error'}. Best is trial 744 with value: 0.5032383725751689.
[I 2024-12-04 12:18:25,017] Trial 1590 finished with value: 0.5250701319213519 and parameters: {'n_estimators': 259, 'max_depth': 19, 'min_samples_split': 8, 'min_samples_leaf': 1, 'max_features': None, 'bootstrap': True, 'criterion': 'absolute_error'}. Best is trial 744 with value: 0.5032383725751689.
[I 2024-12-04 12:18:25,824] Trial 1618 finished with value: 1.354552842012287 and parameters: {'n_estimators': 214, 'max_depth': 19, 'min_samples_split': 3, 'min_samples_leaf': 7, 'max_features': 'log2', 'bootstrap': True, 'criterion': 'absolute_error'}. Best is trial 744 with value: 0.5032383725751689.
[I 2024-12-04 12:18:26,665] Trial 1619 finished with value: 1.2266813285253688 and parameters: {'n_estimators': 295, 'max_depth': 45, 'min_samples_split': 9, 'min_samples_leaf': 11, 'max_features': 'log2', 'bootstrap': False, 'criterion': 'squared_error'}. Best is trial 744 with value: 0.5032383725751689.
[I 2024-12-04 12:18:27,541] Trial 1614 finished with value: 1.3524927602235413 and parameters: {'n_estimators': 158, 'max_depth': 14, 'min_samples_split': 16, 'min_samples_leaf': 5, 'max_features': 'log2', 'bootstrap': True, 'criterion': 'absolute_error'}. Best is trial 744 with value: 0.5032383725751689.
[I 2024-12-04 12:18:30,156] Trial 1625 finished with value: 1.0209646889166448 and parameters: {'n_estimators': 111, 'max_depth': 15, 'min_samples_split': 5, 'min_samples_leaf': 1, 'max_features': 'log2', 'bootstrap': True, 'criterion': 'squared_error'}. Best is trial 744 with value: 0.5032383725751689.
[I 2024-12-04 12:18:32,228] Trial 1612 finished with value: 0.5158072125230585 and parameters: {'n_estimators': 112, 'max_depth': 22, 'min_samples_split': 4, 'min_samples_leaf': 1, 'max_features': None, 'bootstrap': True, 'criterion': 'absolute_error'}. Best is trial 744 with value: 0.5032383725751689.
[I 2024-12-04 12:18:34,007] Trial 1616 finished with value: 0.5198050529934313 and parameters: {'n_estimators': 106, 'max_depth': 25, 'min_samples_split': 3, 'min_samples_leaf': 1, 'max_features': None, 'bootstrap': True, 'criterion': 'absolute_error'}. Best is trial 744 with value: 0.5032383725751689.
[I 2024-12-04 12:18:34,832] Trial 1626 finished with value: 0.6065807903859857 and parameters: {'n_estimators': 481, 'max_depth': 29, 'min_samples_split': 2, 'min_samples_leaf': 5, 'max_features': None, 'bootstrap': True, 'criterion': 'squared_error'}. Best is trial 744 with value: 0.5032383725751689.
[I 2024-12-04 12:18:34,939] Trial 1597 finished with value: 0.521300174242397 and parameters: {'n_estimators': 292, 'max_depth': 26, 'min_samples_split': 3, 'min_samples_leaf': 1, 'max_features': None, 'bootstrap': True, 'criterion': 'absolute_error'}. Best is trial 744 with value: 0.5032383725751689.
[I 2024-12-04 12:18:36,134] Trial 1627 finished with value: 1.328905324976983 and parameters: {'n_estimators': 122, 'max_depth': 26, 'min_samples_split': 2, 'min_samples_leaf': 3, 'max_features': 'log2', 'bootstrap': True, 'criterion': 'absolute_error'}. Best is trial 744 with value: 0.5032383725751689.
[I 2024-12-04 12:18:37,587] Trial 1623 finished with value: 0.5180178136834725 and parameters: {'n_estimators': 102, 'max_depth': 27, 'min_samples_split': 2, 'min_samples_leaf': 1, 'max_features': None, 'bootstrap': True, 'criterion': 'absolute_error'}. Best is trial 744 with value: 0.5032383725751689.
[I 2024-12-04 12:18:37,709] Trial 1594 finished with value: 0.5624285160541794 and parameters: {'n_estimators': 283, 'max_depth': 20, 'min_samples_split': 3, 'min_samples_leaf': 1, 'max_features': None, 'bootstrap': False, 'criterion': 'absolute_error'}. Best is trial 744 with value: 0.5032383725751689.
[I 2024-12-04 12:18:37,718] Trial 1628 finished with value: 0.7576098411143763 and parameters: {'n_estimators': 910, 'max_depth': 35, 'min_samples_split': 9, 'min_samples_leaf': 2, 'max_features': 'sqrt', 'bootstrap': False, 'criterion': 'squared_error'}. Best is trial 744 with value: 0.5032383725751689.
[I 2024-12-04 12:18:38,179] Trial 1610 finished with value: 0.5180565448127175 and parameters: {'n_estimators': 254, 'max_depth': 15, 'min_samples_split': 6, 'min_samples_leaf': 1, 'max_features': None, 'bootstrap': True, 'criterion': 'absolute_error'}. Best is trial 744 with value: 0.5032383725751689.
[I 2024-12-04 12:18:38,313] Trial 1608 finished with value: 0.5603235953736869 and parameters: {'n_estimators': 104, 'max_depth': 29, 'min_samples_split': 4, 'min_samples_leaf': 1, 'max_features': None, 'bootstrap': False, 'criterion': 'absolute_error'}. Best is trial 744 with value: 0.5032383725751689.
[I 2024-12-04 12:18:38,773] Trial 1620 finished with value: 0.5042334918958918 and parameters: {'n_estimators': 101, 'max_depth': 19, 'min_samples_split': 4, 'min_samples_leaf': 1, 'max_features': None, 'bootstrap': True, 'criterion': 'absolute_error'}. Best is trial 744 with value: 0.5032383725751689.
[I 2024-12-04 12:18:39,183] Trial 1630 finished with value: 1.3655341015864115 and parameters: {'n_estimators': 119, 'max_depth': 6, 'min_samples_split': 2, 'min_samples_leaf': 10, 'max_features': 'log2', 'bootstrap': True, 'criterion': 'absolute_error'}. Best is trial 744 with value: 0.5032383725751689.
[I 2024-12-04 12:18:40,079] Trial 1613 finished with value: 0.5606494198935978 and parameters: {'n_estimators': 265, 'max_depth': 19, 'min_samples_split': 6, 'min_samples_leaf': 2, 'max_features': None, 'bootstrap': True, 'criterion': 'absolute_error'}. Best is trial 744 with value: 0.5032383725751689.
[I 2024-12-04 12:18:41,008] Trial 1629 finished with value: 0.5524844181237553 and parameters: {'n_estimators': 128, 'max_depth': 19, 'min_samples_split': 3, 'min_samples_leaf': 2, 'max_features': None, 'bootstrap': True, 'criterion': 'absolute_error'}. Best is trial 744 with value: 0.5032383725751689.
[I 2024-12-04 12:18:44,514] Trial 1617 finished with value: 0.5266328548138943 and parameters: {'n_estimators': 246, 'max_depth': 10, 'min_samples_split': 7, 'min_samples_leaf': 1, 'max_features': None, 'bootstrap': True, 'criterion': 'absolute_error'}. Best is trial 744 with value: 0.5032383725751689.
[I 2024-12-04 12:18:45,419] Trial 1606 finished with value: 0.5157017691630745 and parameters: {'n_estimators': 266, 'max_depth': 22, 'min_samples_split': 2, 'min_samples_leaf': 1, 'max_features': None, 'bootstrap': True, 'criterion': 'absolute_error'}. Best is trial 744 with value: 0.5032383725751689.
[I 2024-12-04 12:18:45,421] Trial 1615 finished with value: 0.5106295465129338 and parameters: {'n_estimators': 272, 'max_depth': 19, 'min_samples_split': 5, 'min_samples_leaf': 1, 'max_features': None, 'bootstrap': True, 'criterion': 'absolute_error'}. Best is trial 744 with value: 0.5032383725751689.
[I 2024-12-04 12:18:45,678] Trial 1611 finished with value: 0.5194319625188335 and parameters: {'n_estimators': 301, 'max_depth': 20, 'min_samples_split': 3, 'min_samples_leaf': 1, 'max_features': None, 'bootstrap': True, 'criterion': 'absolute_error'}. Best is trial 744 with value: 0.5032383725751689.
[I 2024-12-04 12:18:47,057] Trial 1633 finished with value: 0.5063196381047045 and parameters: {'n_estimators': 104, 'max_depth': 14, 'min_samples_split': 5, 'min_samples_leaf': 1, 'max_features': None, 'bootstrap': True, 'criterion': 'absolute_error'}. Best is trial 744 with value: 0.5032383725751689.
[I 2024-12-04 12:18:47,809] Trial 1636 finished with value: 0.5300568006332549 and parameters: {'n_estimators': 302, 'max_depth': 13, 'min_samples_split': 13, 'min_samples_leaf': 1, 'max_features': None, 'bootstrap': True, 'criterion': 'squared_error'}. Best is trial 744 with value: 0.5032383725751689.
[I 2024-12-04 12:18:49,536] Trial 1632 finished with value: 0.5192726400409885 and parameters: {'n_estimators': 112, 'max_depth': 19, 'min_samples_split': 3, 'min_samples_leaf': 1, 'max_features': None, 'bootstrap': True, 'criterion': 'absolute_error'}. Best is trial 744 with value: 0.5032383725751689.
[I 2024-12-04 12:18:49,780] Trial 1642 finished with value: 1.289997671436967 and parameters: {'n_estimators': 108, 'max_depth': 17, 'min_samples_split': 3, 'min_samples_leaf': 2, 'max_features': 'log2', 'bootstrap': True, 'criterion': 'absolute_error'}. Best is trial 744 with value: 0.5032383725751689.
[I 2024-12-04 12:18:50,169] Trial 1640 finished with value: 1.016197022367608 and parameters: {'n_estimators': 240, 'max_depth': 20, 'min_samples_split': 3, 'min_samples_leaf': 1, 'max_features': 'log2', 'bootstrap': True, 'criterion': 'absolute_error'}. Best is trial 744 with value: 0.5032383725751689.
[I 2024-12-04 12:18:51,336] Trial 1639 finished with value: 0.5059767742913834 and parameters: {'n_estimators': 105, 'max_depth': 19, 'min_samples_split': 4, 'min_samples_leaf': 1, 'max_features': None, 'bootstrap': True, 'criterion': 'absolute_error'}. Best is trial 744 with value: 0.5032383725751689.
[I 2024-12-04 12:18:51,412] Trial 1635 finished with value: 0.5138269351367676 and parameters: {'n_estimators': 107, 'max_depth': 15, 'min_samples_split': 3, 'min_samples_leaf': 1, 'max_features': None, 'bootstrap': True, 'criterion': 'absolute_error'}. Best is trial 744 with value: 0.5032383725751689.
[I 2024-12-04 12:18:52,758] Trial 1622 finished with value: 0.5240563488481214 and parameters: {'n_estimators': 230, 'max_depth': 10, 'min_samples_split': 2, 'min_samples_leaf': 1, 'max_features': None, 'bootstrap': True, 'criterion': 'absolute_error'}. Best is trial 744 with value: 0.5032383725751689.
[I 2024-12-04 12:18:54,932] Trial 1621 finished with value: 0.5151743516491838 and parameters: {'n_estimators': 276, 'max_depth': 12, 'min_samples_split': 4, 'min_samples_leaf': 1, 'max_features': None, 'bootstrap': True, 'criterion': 'absolute_error'}. Best is trial 744 with value: 0.5032383725751689.
[I 2024-12-04 12:18:56,510] Trial 1638 finished with value: 0.5539988518550484 and parameters: {'n_estimators': 133, 'max_depth': 19, 'min_samples_split': 17, 'min_samples_leaf': 2, 'max_features': None, 'bootstrap': True, 'criterion': 'absolute_error'}. Best is trial 744 with value: 0.5032383725751689.
[I 2024-12-04 12:18:56,528] Trial 1641 finished with value: 0.5085652913837736 and parameters: {'n_estimators': 112, 'max_depth': 12, 'min_samples_split': 2, 'min_samples_leaf': 1, 'max_features': None, 'bootstrap': True, 'criterion': 'absolute_error'}. Best is trial 744 with value: 0.5032383725751689.
[I 2024-12-04 12:19:00,234] Trial 1634 finished with value: 0.5148258287962068 and parameters: {'n_estimators': 222, 'max_depth': 20, 'min_samples_split': 4, 'min_samples_leaf': 1, 'max_features': None, 'bootstrap': True, 'criterion': 'absolute_error'}. Best is trial 744 with value: 0.5032383725751689.
[I 2024-12-04 12:19:00,251] Trial 1654 finished with value: 0.5328763941511017 and parameters: {'n_estimators': 106, 'max_depth': 8, 'min_samples_split': 9, 'min_samples_leaf': 1, 'max_features': None, 'bootstrap': True, 'criterion': 'absolute_error'}. Best is trial 744 with value: 0.5032383725751689.
[I 2024-12-04 12:19:00,355] Trial 1643 finished with value: 0.5508494445631599 and parameters: {'n_estimators': 212, 'max_depth': 6, 'min_samples_split': 9, 'min_samples_leaf': 1, 'max_features': None, 'bootstrap': True, 'criterion': 'absolute_error'}. Best is trial 744 with value: 0.5032383725751689.
[I 2024-12-04 12:19:01,222] Trial 1649 finished with value: 0.7158227850262824 and parameters: {'n_estimators': 471, 'max_depth': 7, 'min_samples_split': 2, 'min_samples_leaf': 14, 'max_features': None, 'bootstrap': False, 'criterion': 'squared_error'}. Best is trial 744 with value: 0.5032383725751689.
[I 2024-12-04 12:19:01,506] Trial 1637 finished with value: 0.5307899945373175 and parameters: {'n_estimators': 248, 'max_depth': 24, 'min_samples_split': 9, 'min_samples_leaf': 1, 'max_features': None, 'bootstrap': True, 'criterion': 'absolute_error'}. Best is trial 744 with value: 0.5032383725751689.
[I 2024-12-04 12:19:01,600] Trial 1650 finished with value: 0.5482967726718058 and parameters: {'n_estimators': 108, 'max_depth': 8, 'min_samples_split': 5, 'min_samples_leaf': 2, 'max_features': None, 'bootstrap': True, 'criterion': 'absolute_error'}. Best is trial 744 with value: 0.5032383725751689.
[I 2024-12-04 12:19:01,823] Trial 1656 finished with value: 1.3541592957450022 and parameters: {'n_estimators': 810, 'max_depth': 12, 'min_samples_split': 2, 'min_samples_leaf': 14, 'max_features': 'log2', 'bootstrap': False, 'criterion': 'absolute_error'}. Best is trial 744 with value: 0.5032383725751689.
[I 2024-12-04 12:19:02,883] Trial 1631 finished with value: 0.5137005214067965 and parameters: {'n_estimators': 254, 'max_depth': 18, 'min_samples_split': 4, 'min_samples_leaf': 1, 'max_features': None, 'bootstrap': True, 'criterion': 'absolute_error'}. Best is trial 744 with value: 0.5032383725751689.
[I 2024-12-04 12:19:03,538] Trial 1648 finished with value: 0.5180138253811624 and parameters: {'n_estimators': 102, 'max_depth': 10, 'min_samples_split': 5, 'min_samples_leaf': 1, 'max_features': None, 'bootstrap': True, 'criterion': 'absolute_error'}. Best is trial 744 with value: 0.5032383725751689.
[I 2024-12-04 12:19:04,093] Trial 1647 finished with value: 0.515821385654112 and parameters: {'n_estimators': 106, 'max_depth': 17, 'min_samples_split': 2, 'min_samples_leaf': 1, 'max_features': None, 'bootstrap': True, 'criterion': 'absolute_error'}. Best is trial 744 with value: 0.5032383725751689.
[I 2024-12-04 12:19:04,094] Trial 1651 finished with value: 0.5142120130393766 and parameters: {'n_estimators': 122, 'max_depth': 17, 'min_samples_split': 6, 'min_samples_leaf': 1, 'max_features': None, 'bootstrap': True, 'criterion': 'absolute_error'}. Best is trial 744 with value: 0.5032383725751689.
[I 2024-12-04 12:19:04,324] Trial 1644 finished with value: 0.525236983134626 and parameters: {'n_estimators': 205, 'max_depth': 8, 'min_samples_split': 5, 'min_samples_leaf': 1, 'max_features': None, 'bootstrap': True, 'criterion': 'absolute_error'}. Best is trial 744 with value: 0.5032383725751689.
[I 2024-12-04 12:19:05,100] Trial 1645 finished with value: 0.5584859482577446 and parameters: {'n_estimators': 236, 'max_depth': 16, 'min_samples_split': 5, 'min_samples_leaf': 2, 'max_features': None, 'bootstrap': True, 'criterion': 'absolute_error'}. Best is trial 744 with value: 0.5032383725751689.
[I 2024-12-04 12:19:05,192] Trial 1652 finished with value: 0.556655577464209 and parameters: {'n_estimators': 104, 'max_depth': 31, 'min_samples_split': 3, 'min_samples_leaf': 2, 'max_features': None, 'bootstrap': True, 'criterion': 'absolute_error'}. Best is trial 744 with value: 0.5032383725751689.
[I 2024-12-04 12:19:05,497] Trial 1657 finished with value: 0.5117328967858922 and parameters: {'n_estimators': 114, 'max_depth': 13, 'min_samples_split': 3, 'min_samples_leaf': 1, 'max_features': None, 'bootstrap': True, 'criterion': 'absolute_error'}. Best is trial 744 with value: 0.5032383725751689.
[I 2024-12-04 12:19:06,315] Trial 1660 finished with value: 0.5128459370847996 and parameters: {'n_estimators': 105, 'max_depth': 20, 'min_samples_split': 6, 'min_samples_leaf': 1, 'max_features': None, 'bootstrap': True, 'criterion': 'absolute_error'}. Best is trial 744 with value: 0.5032383725751689.
[I 2024-12-04 12:19:06,617] Trial 1655 finished with value: 0.624639428101508 and parameters: {'n_estimators': 289, 'max_depth': 20, 'min_samples_split': 13, 'min_samples_leaf': 1, 'max_features': None, 'bootstrap': False, 'criterion': 'squared_error'}. Best is trial 744 with value: 0.5032383725751689.
