[I 2024-12-04 12:54:02,653] Trial 2005 finished with value: 0.34564534439492867 and parameters: {'n_estimators': 1253, 'learning_rate': 0.05391134008499467, 'max_depth': 6, 'min_samples_split': 9, 'min_samples_leaf': 2, 'subsample': 0.6249279695980579, 'max_features': None}. Best is trial 1454 with value: 0.30763307678022894.
[I 2024-12-04 12:54:05,923] Trial 2021 finished with value: 0.38936494906299135 and parameters: {'n_estimators': 609, 'learning_rate': 0.05268271220600518, 'max_depth': 7, 'min_samples_split': 2, 'min_samples_leaf': 3, 'subsample': 0.8047510238505036, 'max_features': None}. Best is trial 1454 with value: 0.30763307678022894.
[I 2024-12-04 12:54:08,469] Trial 2010 finished with value: 0.3758561873581456 and parameters: {'n_estimators': 1172, 'learning_rate': 0.05035219551671251, 'max_depth': 9, 'min_samples_split': 7, 'min_samples_leaf': 1, 'subsample': 0.6704027120671927, 'max_features': None}. Best is trial 1454 with value: 0.30763307678022894.
[I 2024-12-04 12:54:09,050] Trial 2016 finished with value: 0.36297368420060583 and parameters: {'n_estimators': 966, 'learning_rate': 0.09198465810283571, 'max_depth': 8, 'min_samples_split': 6, 'min_samples_leaf': 4, 'subsample': 0.6019115494061863, 'max_features': None}. Best is trial 1454 with value: 0.30763307678022894.
[I 2024-12-04 12:54:09,051] Trial 2006 finished with value: 0.3728052066295816 and parameters: {'n_estimators': 1310, 'learning_rate': 0.05709424127559686, 'max_depth': 9, 'min_samples_split': 6, 'min_samples_leaf': 3, 'subsample': 0.6367343776211257, 'max_features': None}. Best is trial 1454 with value: 0.30763307678022894.
[I 2024-12-04 12:54:12,052] Trial 2025 finished with value: 0.3920311116516855 and parameters: {'n_estimators': 657, 'learning_rate': 0.09733319366254817, 'max_depth': 6, 'min_samples_split': 2, 'min_samples_leaf': 1, 'subsample': 0.7490450975748969, 'max_features': None}. Best is trial 1454 with value: 0.30763307678022894.
[I 2024-12-04 12:54:12,071] Trial 2015 finished with value: 0.33933940310441846 and parameters: {'n_estimators': 1073, 'learning_rate': 0.047599359119031244, 'max_depth': 6, 'min_samples_split': 6, 'min_samples_leaf': 2, 'subsample': 0.6136642103960167, 'max_features': None}. Best is trial 1454 with value: 0.30763307678022894.
[I 2024-12-04 12:54:13,338] Trial 2013 finished with value: 0.3776441862743159 and parameters: {'n_estimators': 1357, 'learning_rate': 0.08760604840561804, 'max_depth': 6, 'min_samples_split': 3, 'min_samples_leaf': 1, 'subsample': 0.914301702772687, 'max_features': 'sqrt'}. Best is trial 1454 with value: 0.30763307678022894.
[I 2024-12-04 12:54:14,303] Trial 2012 finished with value: 0.3746392555604015 and parameters: {'n_estimators': 1213, 'learning_rate': 0.06683428351536858, 'max_depth': 10, 'min_samples_split': 2, 'min_samples_leaf': 1, 'subsample': 0.6097417342858472, 'max_features': None}. Best is trial 1454 with value: 0.30763307678022894.
[I 2024-12-04 12:54:15,227] Trial 2019 finished with value: 0.3169191033660051 and parameters: {'n_estimators': 938, 'learning_rate': 0.09540338777750428, 'max_depth': 7, 'min_samples_split': 3, 'min_samples_leaf': 2, 'subsample': 0.7588177455431672, 'max_features': None}. Best is trial 1454 with value: 0.30763307678022894.
[I 2024-12-04 12:54:16,908] Trial 2017 finished with value: 0.39518910128047724 and parameters: {'n_estimators': 1114, 'learning_rate': 0.06732842729666103, 'max_depth': 9, 'min_samples_split': 3, 'min_samples_leaf': 3, 'subsample': 0.6190387202412351, 'max_features': None}. Best is trial 1454 with value: 0.30763307678022894.
[I 2024-12-04 12:54:16,910] Trial 2009 finished with value: 0.37158154187619424 and parameters: {'n_estimators': 1437, 'learning_rate': 0.019662360274168955, 'max_depth': 8, 'min_samples_split': 8, 'min_samples_leaf': 4, 'subsample': 0.612647427726711, 'max_features': None}. Best is trial 1454 with value: 0.30763307678022894.
[I 2024-12-04 12:54:19,842] Trial 2018 finished with value: 0.33024574800694156 and parameters: {'n_estimators': 1097, 'learning_rate': 0.07354194785885206, 'max_depth': 10, 'min_samples_split': 7, 'min_samples_leaf': 2, 'subsample': 0.7300109337033313, 'max_features': None}. Best is trial 1454 with value: 0.30763307678022894.
[I 2024-12-04 12:54:20,526] Trial 2011 finished with value: 0.3784826408652891 and parameters: {'n_estimators': 1418, 'learning_rate': 0.06195541090465129, 'max_depth': 8, 'min_samples_split': 9, 'min_samples_leaf': 4, 'subsample': 0.6094527546026592, 'max_features': None}. Best is trial 1454 with value: 0.30763307678022894.
[I 2024-12-04 12:54:22,986] Trial 2014 finished with value: 0.33687430499520543 and parameters: {'n_estimators': 1342, 'learning_rate': 0.04290227994460249, 'max_depth': 8, 'min_samples_split': 6, 'min_samples_leaf': 2, 'subsample': 0.6066071664266314, 'max_features': None}. Best is trial 1454 with value: 0.30763307678022894.
[I 2024-12-04 12:54:24,459] Trial 2036 finished with value: 0.6036701188808383 and parameters: {'n_estimators': 736, 'learning_rate': 0.015115602015764522, 'max_depth': 6, 'min_samples_split': 5, 'min_samples_leaf': 1, 'subsample': 0.8770178450971725, 'max_features': 'log2'}. Best is trial 1454 with value: 0.30763307678022894.
[I 2024-12-04 12:54:24,943] Trial 2027 finished with value: 0.38323003382975407 and parameters: {'n_estimators': 880, 'learning_rate': 0.06614139114270373, 'max_depth': 7, 'min_samples_split': 7, 'min_samples_leaf': 1, 'subsample': 0.7549889808545266, 'max_features': None}. Best is trial 1454 with value: 0.30763307678022894.
[I 2024-12-04 12:54:26,089] Trial 2020 finished with value: 0.36580096723705896 and parameters: {'n_estimators': 1254, 'learning_rate': 0.05331333241566337, 'max_depth': 8, 'min_samples_split': 11, 'min_samples_leaf': 3, 'subsample': 0.6012706160878898, 'max_features': None}. Best is trial 1454 with value: 0.30763307678022894.
[I 2024-12-04 12:54:28,795] Trial 2024 finished with value: 0.3901223739709825 and parameters: {'n_estimators': 1207, 'learning_rate': 0.03033606908970753, 'max_depth': 8, 'min_samples_split': 3, 'min_samples_leaf': 2, 'subsample': 0.6131153401631082, 'max_features': 'sqrt'}. Best is trial 1454 with value: 0.30763307678022894.
[I 2024-12-04 12:54:29,910] Trial 2041 finished with value: 0.4348347247206788 and parameters: {'n_estimators': 702, 'learning_rate': 0.03810952328963804, 'max_depth': 4, 'min_samples_split': 8, 'min_samples_leaf': 1, 'subsample': 0.609659469169483, 'max_features': 'sqrt'}. Best is trial 1454 with value: 0.30763307678022894.
[I 2024-12-04 12:54:30,216] Trial 2022 finished with value: 0.37344391904477003 and parameters: {'n_estimators': 1254, 'learning_rate': 0.05420631496478308, 'max_depth': 7, 'min_samples_split': 2, 'min_samples_leaf': 5, 'subsample': 0.6039533905115553, 'max_features': None}. Best is trial 1454 with value: 0.30763307678022894.
[I 2024-12-04 12:54:30,222] Trial 2042 finished with value: 0.39502671100300546 and parameters: {'n_estimators': 593, 'learning_rate': 0.054128412506627886, 'max_depth': 8, 'min_samples_split': 2, 'min_samples_leaf': 1, 'subsample': 0.7384798273347575, 'max_features': None}. Best is trial 1454 with value: 0.30763307678022894.
[I 2024-12-04 12:54:31,971] Trial 2032 finished with value: 0.5052607819839017 and parameters: {'n_estimators': 1116, 'learning_rate': 0.044349177464142735, 'max_depth': 8, 'min_samples_split': 2, 'min_samples_leaf': 4, 'subsample': 0.6569610790102884, 'max_features': 'log2'}. Best is trial 1454 with value: 0.30763307678022894.
[I 2024-12-04 12:54:34,827] Trial 2053 finished with value: 0.5740462096436694 and parameters: {'n_estimators': 306, 'learning_rate': 0.0651483105729305, 'max_depth': 10, 'min_samples_split': 6, 'min_samples_leaf': 7, 'subsample': 0.6094281733063597, 'max_features': 'sqrt'}. Best is trial 1454 with value: 0.30763307678022894.
[I 2024-12-04 12:54:36,339] Trial 2034 finished with value: 0.4823005407126805 and parameters: {'n_estimators': 1197, 'learning_rate': 0.05246694991227197, 'max_depth': 9, 'min_samples_split': 13, 'min_samples_leaf': 4, 'subsample': 0.6152575343863944, 'max_features': 'log2'}. Best is trial 1454 with value: 0.30763307678022894.
[I 2024-12-04 12:54:37,259] Trial 2031 finished with value: 0.4609590325000296 and parameters: {'n_estimators': 1266, 'learning_rate': 0.05106886687812238, 'max_depth': 8, 'min_samples_split': 4, 'min_samples_leaf': 3, 'subsample': 0.675143983607071, 'max_features': 'log2'}. Best is trial 1454 with value: 0.30763307678022894.
[I 2024-12-04 12:54:37,274] Trial 2029 finished with value: 0.36978726817052093 and parameters: {'n_estimators': 1194, 'learning_rate': 0.05901034744248579, 'max_depth': 9, 'min_samples_split': 6, 'min_samples_leaf': 1, 'subsample': 0.621233483678236, 'max_features': None}. Best is trial 1454 with value: 0.30763307678022894.
[I 2024-12-04 12:54:37,277] Trial 2057 finished with value: 0.9864787801549951 and parameters: {'n_estimators': 261, 'learning_rate': 0.0218753022164676, 'max_depth': 9, 'min_samples_split': 14, 'min_samples_leaf': 10, 'subsample': 0.6839550891517631, 'max_features': 'log2'}. Best is trial 1454 with value: 0.30763307678022894.
[I 2024-12-04 12:54:37,280] Trial 2033 finished with value: 0.39214428144518076 and parameters: {'n_estimators': 1079, 'learning_rate': 0.058282447024340905, 'max_depth': 7, 'min_samples_split': 5, 'min_samples_leaf': 3, 'subsample': 0.654264066977245, 'max_features': None}. Best is trial 1454 with value: 0.30763307678022894.
[I 2024-12-04 12:54:37,971] Trial 2035 finished with value: 0.3291948156382943 and parameters: {'n_estimators': 1067, 'learning_rate': 0.06952240077847696, 'max_depth': 5, 'min_samples_split': 2, 'min_samples_leaf': 2, 'subsample': 0.7534325469384073, 'max_features': None}. Best is trial 1454 with value: 0.30763307678022894.
[I 2024-12-04 12:54:38,929] Trial 2051 finished with value: 0.42363173474668964 and parameters: {'n_estimators': 506, 'learning_rate': 0.01843310631219529, 'max_depth': 10, 'min_samples_split': 12, 'min_samples_leaf': 1, 'subsample': 0.9777083665499292, 'max_features': 'sqrt'}. Best is trial 1454 with value: 0.30763307678022894.
[I 2024-12-04 12:54:39,428] Trial 2058 finished with value: 0.8155677749684784 and parameters: {'n_estimators': 321, 'learning_rate': 0.06006159417625005, 'max_depth': 5, 'min_samples_split': 16, 'min_samples_leaf': 10, 'subsample': 0.7112143771725191, 'max_features': 'log2'}. Best is trial 1454 with value: 0.30763307678022894.
[I 2024-12-04 12:54:41,733] Trial 2047 finished with value: 0.3775860240037293 and parameters: {'n_estimators': 658, 'learning_rate': 0.09668987624819476, 'max_depth': 7, 'min_samples_split': 4, 'min_samples_leaf': 1, 'subsample': 0.6312956927248655, 'max_features': None}. Best is trial 1454 with value: 0.30763307678022894.
[I 2024-12-04 12:54:41,734] Trial 2030 finished with value: 0.3733644580389805 and parameters: {'n_estimators': 1327, 'learning_rate': 0.06472801907486139, 'max_depth': 8, 'min_samples_split': 6, 'min_samples_leaf': 4, 'subsample': 0.6040483529329465, 'max_features': None}. Best is trial 1454 with value: 0.30763307678022894.
[I 2024-12-04 12:54:42,337] Trial 2043 finished with value: 0.3912374859667964 and parameters: {'n_estimators': 929, 'learning_rate': 0.06924386593269624, 'max_depth': 5, 'min_samples_split': 2, 'min_samples_leaf': 1, 'subsample': 0.7936936148027078, 'max_features': None}. Best is trial 1454 with value: 0.30763307678022894.
[I 2024-12-04 12:54:45,605] Trial 2045 finished with value: 0.3772147491749493 and parameters: {'n_estimators': 834, 'learning_rate': 0.05912567037698164, 'max_depth': 7, 'min_samples_split': 2, 'min_samples_leaf': 1, 'subsample': 0.6454028157586846, 'max_features': None}. Best is trial 1454 with value: 0.30763307678022894.
[I 2024-12-04 12:54:46,544] Trial 2046 finished with value: 0.4207255539270579 and parameters: {'n_estimators': 1005, 'learning_rate': 0.0666373925466335, 'max_depth': 8, 'min_samples_split': 2, 'min_samples_leaf': 3, 'subsample': 0.686472033610328, 'max_features': 'sqrt'}. Best is trial 1454 with value: 0.30763307678022894.
[I 2024-12-04 12:54:48,366] Trial 2038 finished with value: 0.6440641769510418 and parameters: {'n_estimators': 1442, 'learning_rate': 0.02085400766765608, 'max_depth': 7, 'min_samples_split': 20, 'min_samples_leaf': 6, 'subsample': 0.7239019707129488, 'max_features': 'log2'}. Best is trial 1454 with value: 0.30763307678022894.
[I 2024-12-04 12:54:49,030] Trial 2054 finished with value: 0.41397391047009047 and parameters: {'n_estimators': 672, 'learning_rate': 0.09724006280553565, 'max_depth': 9, 'min_samples_split': 3, 'min_samples_leaf': 1, 'subsample': 0.8539036761354492, 'max_features': None}. Best is trial 1454 with value: 0.30763307678022894.
[I 2024-12-04 12:54:49,867] Trial 2055 finished with value: 0.6290234789162914 and parameters: {'n_estimators': 681, 'learning_rate': 0.03973870589706532, 'max_depth': 3, 'min_samples_split': 10, 'min_samples_leaf': 9, 'subsample': 0.7408676745627286, 'max_features': 'sqrt'}. Best is trial 1454 with value: 0.30763307678022894.
[I 2024-12-04 12:54:52,244] Trial 2044 finished with value: 0.6298811181805807 and parameters: {'n_estimators': 1308, 'learning_rate': 0.013611622897061615, 'max_depth': 8, 'min_samples_split': 19, 'min_samples_leaf': 8, 'subsample': 0.6130789726165964, 'max_features': 'sqrt'}. Best is trial 1454 with value: 0.30763307678022894.
[I 2024-12-04 12:54:52,989] Trial 2064 finished with value: 0.629398897266594 and parameters: {'n_estimators': 566, 'learning_rate': 0.049978797040284344, 'max_depth': 6, 'min_samples_split': 12, 'min_samples_leaf': 10, 'subsample': 0.6455774919490115, 'max_features': 'sqrt'}. Best is trial 1454 with value: 0.30763307678022894.
[I 2024-12-04 12:54:53,884] Trial 2039 finished with value: 0.33248210937928163 and parameters: {'n_estimators': 1454, 'learning_rate': 0.09937666749703526, 'max_depth': 5, 'min_samples_split': 3, 'min_samples_leaf': 2, 'subsample': 0.6627035698467363, 'max_features': None}. Best is trial 1454 with value: 0.30763307678022894.
[I 2024-12-04 12:54:54,949] Trial 2037 finished with value: 0.3234473593573726 and parameters: {'n_estimators': 1450, 'learning_rate': 0.07178841947025837, 'max_depth': 7, 'min_samples_split': 2, 'min_samples_leaf': 2, 'subsample': 0.8029553678751856, 'max_features': None}. Best is trial 1454 with value: 0.30763307678022894.
[I 2024-12-04 12:54:55,909] Trial 2049 finished with value: 0.33706648011125945 and parameters: {'n_estimators': 1077, 'learning_rate': 0.09858365015955418, 'max_depth': 5, 'min_samples_split': 6, 'min_samples_leaf': 2, 'subsample': 0.7958532454115425, 'max_features': None}. Best is trial 1454 with value: 0.30763307678022894.
[I 2024-12-04 12:54:56,265] Trial 2062 finished with value: 0.4327974839826736 and parameters: {'n_estimators': 781, 'learning_rate': 0.04120574756050357, 'max_depth': 9, 'min_samples_split': 16, 'min_samples_leaf': 2, 'subsample': 0.7160082679187159, 'max_features': 'log2'}. Best is trial 1454 with value: 0.30763307678022894.
[I 2024-12-04 12:54:57,371] Trial 2048 finished with value: 0.3696027557356592 and parameters: {'n_estimators': 1059, 'learning_rate': 0.09798179472189462, 'max_depth': 8, 'min_samples_split': 5, 'min_samples_leaf': 1, 'subsample': 0.7541650092693207, 'max_features': None}. Best is trial 1454 with value: 0.30763307678022894.
[I 2024-12-04 12:54:57,600] Trial 2040 finished with value: 0.3301875936514686 and parameters: {'n_estimators': 1491, 'learning_rate': 0.06474650339221422, 'max_depth': 8, 'min_samples_split': 4, 'min_samples_leaf': 2, 'subsample': 0.6239269188333988, 'max_features': None}. Best is trial 1454 with value: 0.30763307678022894.
[I 2024-12-04 12:54:57,602] Trial 2065 finished with value: 0.49017797081563225 and parameters: {'n_estimators': 724, 'learning_rate': 0.05499399202415139, 'max_depth': 4, 'min_samples_split': 10, 'min_samples_leaf': 8, 'subsample': 0.8790787064340864, 'max_features': 'sqrt'}. Best is trial 1454 with value: 0.30763307678022894.
[I 2024-12-04 12:54:59,653] Trial 2061 finished with value: 0.4111436896943136 and parameters: {'n_estimators': 742, 'learning_rate': 0.06833185187804758, 'max_depth': 5, 'min_samples_split': 4, 'min_samples_leaf': 3, 'subsample': 0.8349412222458155, 'max_features': None}. Best is trial 1454 with value: 0.30763307678022894.
[I 2024-12-04 12:55:04,975] Trial 2063 finished with value: 0.41472091802897615 and parameters: {'n_estimators': 938, 'learning_rate': 0.06327360117862009, 'max_depth': 4, 'min_samples_split': 6, 'min_samples_leaf': 3, 'subsample': 0.7701074459050111, 'max_features': None}. Best is trial 1454 with value: 0.30763307678022894.
[I 2024-12-04 12:55:05,741] Trial 2050 finished with value: 0.41008277793118014 and parameters: {'n_estimators': 1296, 'learning_rate': 0.04480127954121877, 'max_depth': 8, 'min_samples_split': 3, 'min_samples_leaf': 1, 'subsample': 0.7632715293624626, 'max_features': None}. Best is trial 1454 with value: 0.30763307678022894.
[I 2024-12-04 12:55:06,156] Trial 2060 finished with value: 0.3306864638661734 and parameters: {'n_estimators': 992, 'learning_rate': 0.07314067712612105, 'max_depth': 8, 'min_samples_split': 5, 'min_samples_leaf': 2, 'subsample': 0.7758119870025241, 'max_features': None}. Best is trial 1454 with value: 0.30763307678022894.
[I 2024-12-04 12:55:07,329] Trial 2056 finished with value: 0.38681940115010344 and parameters: {'n_estimators': 1185, 'learning_rate': 0.026621080676770457, 'max_depth': 9, 'min_samples_split': 7, 'min_samples_leaf': 1, 'subsample': 0.6741519068112435, 'max_features': None}. Best is trial 1454 with value: 0.30763307678022894.
[I 2024-12-04 12:55:09,212] Trial 2052 finished with value: 0.40572374995087657 and parameters: {'n_estimators': 1412, 'learning_rate': 0.09923335282096593, 'max_depth': 4, 'min_samples_split': 2, 'min_samples_leaf': 1, 'subsample': 0.7767447972023889, 'max_features': None}. Best is trial 1454 with value: 0.30763307678022894.
[I 2024-12-04 12:55:09,503] Trial 2072 finished with value: 0.6877445970382987 and parameters: {'n_estimators': 756, 'learning_rate': 0.06334840121805758, 'max_depth': 9, 'min_samples_split': 20, 'min_samples_leaf': 10, 'subsample': 0.6887358031473837, 'max_features': 'log2'}. Best is trial 1454 with value: 0.30763307678022894.
[I 2024-12-04 12:55:11,586] Trial 2059 finished with value: 0.33435593044361056 and parameters: {'n_estimators': 1210, 'learning_rate': 0.06783511812731935, 'max_depth': 7, 'min_samples_split': 4, 'min_samples_leaf': 2, 'subsample': 0.7424672061415714, 'max_features': None}. Best is trial 1454 with value: 0.30763307678022894.
[I 2024-12-04 12:55:12,181] Trial 2088 finished with value: 0.4576540494450178 and parameters: {'n_estimators': 227, 'learning_rate': 0.0836300016936313, 'max_depth': 3, 'min_samples_split': 7, 'min_samples_leaf': 7, 'subsample': 0.9937764266262096, 'max_features': None}. Best is trial 1454 with value: 0.30763307678022894.
[I 2024-12-04 12:55:17,682] Trial 2071 finished with value: 0.5620806509030085 and parameters: {'n_estimators': 933, 'learning_rate': 0.05752894284677876, 'max_depth': 9, 'min_samples_split': 6, 'min_samples_leaf': 10, 'subsample': 0.6951495752322416, 'max_features': None}. Best is trial 1454 with value: 0.30763307678022894.
[I 2024-12-04 12:55:19,017] Trial 2070 finished with value: 0.3612472906503129 and parameters: {'n_estimators': 991, 'learning_rate': 0.07440111781358741, 'max_depth': 7, 'min_samples_split': 4, 'min_samples_leaf': 4, 'subsample': 0.8046982215230347, 'max_features': None}. Best is trial 1454 with value: 0.30763307678022894.
[I 2024-12-04 12:55:20,024] Trial 2069 finished with value: 0.3979854347532032 and parameters: {'n_estimators': 1034, 'learning_rate': 0.08201407604288667, 'max_depth': 8, 'min_samples_split': 2, 'min_samples_leaf': 3, 'subsample': 0.7946846909902531, 'max_features': None}. Best is trial 1454 with value: 0.30763307678022894.
[I 2024-12-04 12:55:20,480] Trial 2097 finished with value: 0.8140298044699239 and parameters: {'n_estimators': 293, 'learning_rate': 0.015178071568164283, 'max_depth': 9, 'min_samples_split': 16, 'min_samples_leaf': 10, 'subsample': 0.8464304942650502, 'max_features': 'sqrt'}. Best is trial 1454 with value: 0.30763307678022894.
[I 2024-12-04 12:55:20,484] Trial 2075 finished with value: 0.3953404654336207 and parameters: {'n_estimators': 889, 'learning_rate': 0.09083861188013206, 'max_depth': 7, 'min_samples_split': 2, 'min_samples_leaf': 3, 'subsample': 0.739919869996127, 'max_features': None}. Best is trial 1454 with value: 0.30763307678022894.
[I 2024-12-04 12:55:21,863] Trial 2066 finished with value: 0.3714680310464573 and parameters: {'n_estimators': 1165, 'learning_rate': 0.06145734792827145, 'max_depth': 8, 'min_samples_split': 5, 'min_samples_leaf': 4, 'subsample': 0.8185414318008645, 'max_features': None}. Best is trial 1454 with value: 0.30763307678022894.
[I 2024-12-04 12:55:23,371] Trial 2096 finished with value: 0.43834270567876604 and parameters: {'n_estimators': 289, 'learning_rate': 0.01677324806910284, 'max_depth': 8, 'min_samples_split': 15, 'min_samples_leaf': 3, 'subsample': 0.8517694623715144, 'max_features': None}. Best is trial 1454 with value: 0.30763307678022894.
[I 2024-12-04 12:55:24,476] Trial 2077 finished with value: 0.4732865305542453 and parameters: {'n_estimators': 1100, 'learning_rate': 0.08555799301655599, 'max_depth': 6, 'min_samples_split': 19, 'min_samples_leaf': 7, 'subsample': 0.9259159108971151, 'max_features': 'log2'}. Best is trial 1454 with value: 0.30763307678022894.
[I 2024-12-04 12:55:25,610] Trial 2067 finished with value: 0.4090676555141213 and parameters: {'n_estimators': 1040, 'learning_rate': 0.07153262148193763, 'max_depth': 7, 'min_samples_split': 3, 'min_samples_leaf': 1, 'subsample': 0.8279353545952014, 'max_features': None}. Best is trial 1454 with value: 0.30763307678022894.
