[I 2024-12-03 18:49:50,287] Trial 766 finished with value: 1.354673753383488 and parameters: {'kernel': 'poly', 'C': 0.020582970232169793, 'gamma': 0.0016023836930191854, 'epsilon': 0.0011399852398636307}. Best is trial 345 with value: 0.13438257115663557.
[I 2024-12-03 18:49:50,410] Trial 726 finished with value: 0.1376121590330906 and parameters: {'kernel': 'linear', 'C': 28.243189797191956, 'gamma': 0.0001423902822634822, 'epsilon': 0.01961165887082754}. Best is trial 345 with value: 0.13438257115663557.
[I 2024-12-03 18:49:56,243] Trial 754 finished with value: 0.1354124011297004 and parameters: {'kernel': 'linear', 'C': 10.551992017729235, 'gamma': 0.002595362654279677, 'epsilon': 0.029356094662324684}. Best is trial 345 with value: 0.13438257115663557.
[I 2024-12-03 18:49:56,780] Trial 677 finished with value: 0.1353808113320422 and parameters: {'kernel': 'linear', 'C': 96.72509029778806, 'gamma': 0.00013062771945821942, 'epsilon': 0.057746880465730295}. Best is trial 345 with value: 0.13438257115663557.
[I 2024-12-03 18:49:57,993] Trial 771 finished with value: 1.3574289725852322 and parameters: {'kernel': 'sigmoid', 'C': 0.004087476216739593, 'gamma': 0.0003965637396426977, 'epsilon': 0.014461534541338318}. Best is trial 345 with value: 0.13438257115663557.
[I 2024-12-03 18:49:58,957] Trial 772 finished with value: 1.1383840436841266 and parameters: {'kernel': 'sigmoid', 'C': 0.0386534215602442, 'gamma': 0.025179327319076766, 'epsilon': 0.5965467463855197}. Best is trial 345 with value: 0.13438257115663557.
[I 2024-12-03 18:49:59,374] Trial 758 finished with value: 0.1380062271006092 and parameters: {'kernel': 'linear', 'C': 14.654098612305694, 'gamma': 0.02987812301854228, 'epsilon': 0.016921552380053325}. Best is trial 345 with value: 0.13438257115663557.
[I 2024-12-03 18:49:59,701] Trial 668 finished with value: 0.1351404953131756 and parameters: {'kernel': 'linear', 'C': 94.67468205517848, 'gamma': 0.0003527966198941773, 'epsilon': 0.03285842740986986}. Best is trial 345 with value: 0.13438257115663557.
[I 2024-12-03 18:49:59,789] Trial 767 finished with value: 0.1482349238489957 and parameters: {'kernel': 'linear', 'C': 87.35288124599347, 'gamma': 0.006698587647892509, 'epsilon': 0.1389018330689848}. Best is trial 345 with value: 0.13438257115663557.
[I 2024-12-03 18:50:01,184] Trial 715 finished with value: 0.13575170925660382 and parameters: {'kernel': 'linear', 'C': 82.31160280768881, 'gamma': 0.010592040439613147, 'epsilon': 0.06756505739082821}. Best is trial 345 with value: 0.13438257115663557.
[I 2024-12-03 18:50:02,121] Trial 777 finished with value: 0.19255324858649853 and parameters: {'kernel': 'linear', 'C': 4.808665112516466, 'gamma': 0.0018184009808035228, 'epsilon': 0.24051110634759343}. Best is trial 345 with value: 0.13438257115663557.
[I 2024-12-03 18:50:08,142] Trial 760 finished with value: 0.13510039536006732 and parameters: {'kernel': 'linear', 'C': 26.742839036901138, 'gamma': 0.0021159932672436257, 'epsilon': 0.03041246992211128}. Best is trial 345 with value: 0.13438257115663557.
[I 2024-12-03 18:50:09,147] Trial 779 finished with value: 0.3589044781509426 and parameters: {'kernel': 'rbf', 'C': 1.8465866962508026, 'gamma': 0.001115764526595846, 'epsilon': 0.06703091796229829}. Best is trial 345 with value: 0.13438257115663557.
[I 2024-12-03 18:50:09,378] Trial 773 finished with value: 0.13595866077875765 and parameters: {'kernel': 'linear', 'C': 11.585623424096854, 'gamma': 0.0007919493257223734, 'epsilon': 0.054265695728925555}. Best is trial 345 with value: 0.13438257115663557.
[I 2024-12-03 18:50:14,532] Trial 734 finished with value: 0.13634874172087463 and parameters: {'kernel': 'linear', 'C': 68.8739012271089, 'gamma': 0.00016117926448457466, 'epsilon': 0.042986920191749524}. Best is trial 345 with value: 0.13438257115663557.
[I 2024-12-03 18:50:16,459] Trial 781 finished with value: 0.1365303606026564 and parameters: {'kernel': 'linear', 'C': 7.167533497244351, 'gamma': 0.0008056845109806356, 'epsilon': 0.04431500986178236}. Best is trial 345 with value: 0.13438257115663557.
[I 2024-12-03 18:50:18,882] Trial 765 finished with value: 0.1379818835744716 and parameters: {'kernel': 'linear', 'C': 19.863122161712347, 'gamma': 0.004007250929717434, 'epsilon': 0.014449061905952522}. Best is trial 345 with value: 0.13438257115663557.
[I 2024-12-03 18:50:18,942] Trial 658 finished with value: 0.13555284680581234 and parameters: {'kernel': 'linear', 'C': 95.90990296997603, 'gamma': 0.0005088885875838605, 'epsilon': 0.02685213512131275}. Best is trial 345 with value: 0.13438257115663557.
[I 2024-12-03 18:50:19,974] Trial 780 finished with value: 0.13563886727078323 and parameters: {'kernel': 'linear', 'C': 13.305601353960116, 'gamma': 0.002826250923389953, 'epsilon': 0.057183685020746305}. Best is trial 345 with value: 0.13438257115663557.
[I 2024-12-03 18:50:19,976] Trial 769 finished with value: 0.13745344587723052 and parameters: {'kernel': 'linear', 'C': 28.75523642343839, 'gamma': 0.00872676453394447, 'epsilon': 0.0223928124785239}. Best is trial 345 with value: 0.13438257115663557.
[I 2024-12-03 18:50:20,442] Trial 784 finished with value: 1.3406570382300091 and parameters: {'kernel': 'rbf', 'C': 0.0013709781376378427, 'gamma': 0.206628756266485, 'epsilon': 0.29248974139317274}. Best is trial 345 with value: 0.13438257115663557.
[I 2024-12-03 18:50:23,078] Trial 785 finished with value: 0.1362407468337869 and parameters: {'kernel': 'linear', 'C': 4.44596286402852, 'gamma': 0.00010343240028903294, 'epsilon': 0.0452782898744547}. Best is trial 345 with value: 0.13438257115663557.
[I 2024-12-03 18:50:23,704] Trial 787 finished with value: 0.147794645223161 and parameters: {'kernel': 'linear', 'C': 16.16178762726034, 'gamma': 0.002319922311913975, 'epsilon': 0.13181317523624536}. Best is trial 345 with value: 0.13438257115663557.
[I 2024-12-03 18:50:23,897] Trial 770 finished with value: 0.13798358812763709 and parameters: {'kernel': 'linear', 'C': 21.347255686484907, 'gamma': 0.017374448734086913, 'epsilon': 0.015312441249382141}. Best is trial 345 with value: 0.13438257115663557.
[I 2024-12-03 18:50:24,846] Trial 786 finished with value: 0.13881007156167877 and parameters: {'kernel': 'linear', 'C': 1.5816132802471654, 'gamma': 0.010339373900254674, 'epsilon': 0.0112832059335167}. Best is trial 345 with value: 0.13438257115663557.
[I 2024-12-03 18:50:24,908] Trial 687 finished with value: 0.1354524708974249 and parameters: {'kernel': 'linear', 'C': 95.79679243057335, 'gamma': 0.006272080720386755, 'epsilon': 0.03352795917963694}. Best is trial 345 with value: 0.13438257115663557.
[I 2024-12-03 18:50:25,818] Trial 789 finished with value: 0.14648927874993356 and parameters: {'kernel': 'linear', 'C': 16.98785212803265, 'gamma': 0.0006204669066373152, 'epsilon': 0.12946188358585842}. Best is trial 345 with value: 0.13438257115663557.
[I 2024-12-03 18:50:26,087] Trial 742 finished with value: 0.13711795711597188 and parameters: {'kernel': 'linear', 'C': 90.93583793783806, 'gamma': 0.0014687944457859158, 'epsilon': 0.07460520128124373}. Best is trial 345 with value: 0.13438257115663557.
[I 2024-12-03 18:50:27,027] Trial 795 finished with value: 1.3098495346475048 and parameters: {'kernel': 'rbf', 'C': 0.011151834585922275, 'gamma': 0.00015753975761022797, 'epsilon': 0.7983685743575923}. Best is trial 345 with value: 0.13438257115663557.
[I 2024-12-03 18:50:28,687] Trial 794 finished with value: 0.14145909091476372 and parameters: {'kernel': 'linear', 'C': 1.0632000495714697, 'gamma': 0.0001712700240228371, 'epsilon': 0.006805628942842742}. Best is trial 345 with value: 0.13438257115663557.
[I 2024-12-03 18:50:29,716] Trial 665 finished with value: 0.13597054422215862 and parameters: {'kernel': 'linear', 'C': 98.66125828363876, 'gamma': 0.002984854134214218, 'epsilon': 0.025116560325203176}. Best is trial 345 with value: 0.13438257115663557.
[I 2024-12-03 18:50:29,839] Trial 782 finished with value: 0.1354256102313209 and parameters: {'kernel': 'linear', 'C': 24.84982681785335, 'gamma': 0.001597594562995167, 'epsilon': 0.031284759763849736}. Best is trial 345 with value: 0.13438257115663557.
[I 2024-12-03 18:50:30,707] Trial 681 finished with value: 0.138064737737066 and parameters: {'kernel': 'linear', 'C': 99.2195255461551, 'gamma': 0.0007620142299748527, 'epsilon': 0.015324916368139232}. Best is trial 345 with value: 0.13438257115663557.
[I 2024-12-03 18:50:30,732] Trial 797 finished with value: 0.15163449033812268 and parameters: {'kernel': 'linear', 'C': 2.3450186184832487, 'gamma': 0.0007986683063393015, 'epsilon': 0.09861176850593435}. Best is trial 345 with value: 0.13438257115663557.
[I 2024-12-03 18:50:30,733] Trial 788 finished with value: 0.1376919006344812 and parameters: {'kernel': 'linear', 'C': 57.41777520202608, 'gamma': 0.0038815282612541945, 'epsilon': 0.07734397096419428}. Best is trial 345 with value: 0.13438257115663557.
[I 2024-12-03 18:50:31,841] Trial 753 finished with value: 0.13593923815685746 and parameters: {'kernel': 'linear', 'C': 92.85215386445648, 'gamma': 0.0026971061436951538, 'epsilon': 0.05252771142587057}. Best is trial 345 with value: 0.13438257115663557.
[I 2024-12-03 18:50:33,226] Trial 783 finished with value: 0.13508742478863908 and parameters: {'kernel': 'linear', 'C': 23.72499859132178, 'gamma': 0.006359322760766321, 'epsilon': 0.041234560484583446}. Best is trial 345 with value: 0.13438257115663557.
[I 2024-12-03 18:50:33,228] Trial 768 finished with value: 0.13705010119117736 and parameters: {'kernel': 'linear', 'C': 52.79603919610366, 'gamma': 0.007264915477965964, 'epsilon': 0.04538238144823181}. Best is trial 345 with value: 0.13438257115663557.
[I 2024-12-03 18:50:34,597] Trial 805 finished with value: 1.3337358920743807 and parameters: {'kernel': 'rbf', 'C': 0.012062018086766074, 'gamma': 0.0004709484783131418, 'epsilon': 0.0010548773438062349}. Best is trial 345 with value: 0.13438257115663557.
[I 2024-12-03 18:50:35,050] Trial 774 finished with value: 0.1380091314779032 and parameters: {'kernel': 'linear', 'C': 16.530952986437576, 'gamma': 0.0013199722974798983, 'epsilon': 0.006684559173976461}. Best is trial 345 with value: 0.13438257115663557.
[I 2024-12-03 18:50:35,977] Trial 800 finished with value: 0.13730429403176253 and parameters: {'kernel': 'linear', 'C': 2.5482518988849474, 'gamma': 0.00225819385516562, 'epsilon': 0.02666901978670093}. Best is trial 345 with value: 0.13438257115663557.
[I 2024-12-03 18:50:36,110] Trial 801 finished with value: 0.13777436833566103 and parameters: {'kernel': 'linear', 'C': 2.8337691945022434, 'gamma': 0.0004559540606149285, 'epsilon': 0.014398059514177206}. Best is trial 345 with value: 0.13438257115663557.
[I 2024-12-03 18:50:38,048] Trial 809 finished with value: 0.1490757246035455 and parameters: {'kernel': 'linear', 'C': 2.698068598874234, 'gamma': 0.005597591396036406, 'epsilon': 0.09275709155851178}. Best is trial 345 with value: 0.13438257115663557.
[I 2024-12-03 18:50:39,377] Trial 806 finished with value: 0.1411472796024692 and parameters: {'kernel': 'linear', 'C': 15.995062186367973, 'gamma': 0.001106317586761517, 'epsilon': 0.10880552483277955}. Best is trial 345 with value: 0.13438257115663557.
[I 2024-12-03 18:50:40,273] Trial 762 finished with value: 0.13701146767595831 and parameters: {'kernel': 'linear', 'C': 96.9907165369672, 'gamma': 0.0010574829751025902, 'epsilon': 0.046523864077386366}. Best is trial 345 with value: 0.13438257115663557.
[I 2024-12-03 18:50:41,615] Trial 747 finished with value: 0.138475797237202 and parameters: {'kernel': 'linear', 'C': 60.30087874275581, 'gamma': 0.011712726453807665, 'epsilon': 0.015474439513569254}. Best is trial 345 with value: 0.13438257115663557.
[I 2024-12-03 18:50:41,997] Trial 799 finished with value: 0.13574353099492406 and parameters: {'kernel': 'linear', 'C': 11.502974712669157, 'gamma': 0.0003920669751952038, 'epsilon': 0.03161525316712061}. Best is trial 345 with value: 0.13438257115663557.
[I 2024-12-03 18:50:44,041] Trial 790 finished with value: 0.1376735323195463 and parameters: {'kernel': 'linear', 'C': 13.241027447201011, 'gamma': 0.010615366948848994, 'epsilon': 0.018369074740655356}. Best is trial 345 with value: 0.13438257115663557.
[I 2024-12-03 18:50:45,005] Trial 802 finished with value: 0.13581579942936547 and parameters: {'kernel': 'linear', 'C': 10.126320601711978, 'gamma': 0.01749418010790311, 'epsilon': 0.03643275947573201}. Best is trial 345 with value: 0.13438257115663557.
[I 2024-12-03 18:50:45,302] Trial 803 finished with value: 0.13541666350338627 and parameters: {'kernel': 'linear', 'C': 26.946997029734224, 'gamma': 0.004795064992427955, 'epsilon': 0.053575832457896135}. Best is trial 345 with value: 0.13438257115663557.
[I 2024-12-03 18:50:45,319] Trial 815 finished with value: 0.17223474882718728 and parameters: {'kernel': 'linear', 'C': 1.2361064248003426, 'gamma': 0.00010435159087526573, 'epsilon': 0.15310779745833947}. Best is trial 345 with value: 0.13438257115663557.
[I 2024-12-03 18:50:48,655] Trial 811 finished with value: 0.13622141731022894 and parameters: {'kernel': 'linear', 'C': 12.84581963760089, 'gamma': 0.0004433877587806643, 'epsilon': 0.054633631919066596}. Best is trial 345 with value: 0.13438257115663557.
[I 2024-12-03 18:50:52,476] Trial 817 finished with value: 0.13653157354284876 and parameters: {'kernel': 'linear', 'C': 4.449040395722691, 'gamma': 0.019299891423872957, 'epsilon': 0.02917582512900261}. Best is trial 345 with value: 0.13438257115663557.
[I 2024-12-03 18:50:55,645] Trial 746 finished with value: 0.13476925974367107 and parameters: {'kernel': 'linear', 'C': 88.02045487052122, 'gamma': 0.007240409673275624, 'epsilon': 0.03082100524948512}. Best is trial 345 with value: 0.13438257115663557.
[I 2024-12-03 18:50:57,756] Trial 813 finished with value: 0.13539196797254036 and parameters: {'kernel': 'linear', 'C': 17.270649677989066, 'gamma': 0.004355268645329671, 'epsilon': 0.030434935188375235}. Best is trial 345 with value: 0.13438257115663557.
[I 2024-12-03 18:50:59,615] Trial 807 finished with value: 0.1385869864573373 and parameters: {'kernel': 'linear', 'C': 15.51214505986116, 'gamma': 0.0001156971574412972, 'epsilon': 0.011966251209819171}. Best is trial 345 with value: 0.13438257115663557.
[I 2024-12-03 18:50:59,792] Trial 814 finished with value: 0.13529337483043757 and parameters: {'kernel': 'linear', 'C': 29.772683812221683, 'gamma': 0.011013449574243444, 'epsilon': 0.05995721765730719}. Best is trial 345 with value: 0.13438257115663557.
[I 2024-12-03 18:51:01,311] Trial 808 finished with value: 0.1363814432818995 and parameters: {'kernel': 'linear', 'C': 19.41967528417763, 'gamma': 0.00040870355167881733, 'epsilon': 0.025891104878079732}. Best is trial 345 with value: 0.13438257115663557.
[I 2024-12-03 18:51:02,898] Trial 816 finished with value: 0.13558826671270166 and parameters: {'kernel': 'linear', 'C': 16.77938754239119, 'gamma': 0.000822510734062031, 'epsilon': 0.032984257026052156}. Best is trial 345 with value: 0.13438257115663557.
[I 2024-12-03 18:51:06,320] Trial 748 finished with value: 0.13853781542293725 and parameters: {'kernel': 'linear', 'C': 86.30345400294891, 'gamma': 0.006782322545610794, 'epsilon': 0.01067333242452074}. Best is trial 345 with value: 0.13438257115663557.
[I 2024-12-03 18:51:10,881] Trial 819 finished with value: 0.13553897049690097 and parameters: {'kernel': 'linear', 'C': 20.962915619373984, 'gamma': 0.018615518033153977, 'epsilon': 0.027781653221342087}. Best is trial 345 with value: 0.13438257115663557.
[I 2024-12-03 18:51:11,921] Trial 764 finished with value: 0.13513602771651625 and parameters: {'kernel': 'linear', 'C': 86.56009362592553, 'gamma': 0.00321140814824198, 'epsilon': 0.0332664334242202}. Best is trial 345 with value: 0.13438257115663557.
[I 2024-12-03 18:51:12,357] Trial 716 finished with value: 0.13564959507915567 and parameters: {'kernel': 'linear', 'C': 91.35861850892952, 'gamma': 0.0016483712853295625, 'epsilon': 0.026799229673891794}. Best is trial 345 with value: 0.13438257115663557.
[I 2024-12-03 18:51:12,902] Trial 828 finished with value: 0.15350230753054986 and parameters: {'kernel': 'linear', 'C': 4.991965573859797, 'gamma': 0.019791465779413556, 'epsilon': 0.13457491671690353}. Best is trial 345 with value: 0.13438257115663557.
[I 2024-12-03 18:51:14,100] Trial 830 finished with value: 0.18080236071458122 and parameters: {'kernel': 'rbf', 'C': 41.97046665976394, 'gamma': 0.009923276630540526, 'epsilon': 0.0392370387776653}. Best is trial 345 with value: 0.13438257115663557.
[I 2024-12-03 18:51:15,399] Trial 744 finished with value: 0.13564075326125546 and parameters: {'kernel': 'linear', 'C': 98.99708931605575, 'gamma': 0.01134347546994159, 'epsilon': 0.02683299955988172}. Best is trial 345 with value: 0.13438257115663557.
[I 2024-12-03 18:51:15,643] Trial 832 finished with value: 0.5002364207526715 and parameters: {'kernel': 'rbf', 'C': 56.76108746647761, 'gamma': 0.10754913149638515, 'epsilon': 0.014008377995591837}. Best is trial 345 with value: 0.13438257115663557.
[I 2024-12-03 18:51:16,541] Trial 831 finished with value: 0.34440443976248025 and parameters: {'kernel': 'poly', 'C': 80.73957119034938, 'gamma': 0.017620592738691127, 'epsilon': 0.024322792868293256}. Best is trial 345 with value: 0.13438257115663557.
[I 2024-12-03 18:51:16,981] Trial 834 finished with value: 11.429719513569493 and parameters: {'kernel': 'sigmoid', 'C': 12.134161591278552, 'gamma': 0.003764847047667158, 'epsilon': 0.0380164188973805}. Best is trial 345 with value: 0.13438257115663557.
[I 2024-12-03 18:51:18,366] Trial 829 finished with value: 0.14215949473289316 and parameters: {'kernel': 'linear', 'C': 18.329718853345614, 'gamma': 0.00597292670171461, 'epsilon': 0.09388280668906768}. Best is trial 345 with value: 0.13438257115663557.
[I 2024-12-03 18:51:20,272] Trial 825 finished with value: 0.13657869618353133 and parameters: {'kernel': 'linear', 'C': 17.479078364973407, 'gamma': 0.005456842632406878, 'epsilon': 0.023716868913992026}. Best is trial 345 with value: 0.13438257115663557.
[I 2024-12-03 18:51:20,693] Trial 775 finished with value: 0.13659757897958505 and parameters: {'kernel': 'linear', 'C': 83.20259114715637, 'gamma': 0.009169581828490482, 'epsilon': 0.024719196898957713}. Best is trial 345 with value: 0.13438257115663557.
[I 2024-12-03 18:51:21,633] Trial 833 finished with value: 0.13566786826778987 and parameters: {'kernel': 'linear', 'C': 6.941986223383776, 'gamma': 0.0033194368085675166, 'epsilon': 0.057085070999086905}. Best is trial 345 with value: 0.13438257115663557.
[I 2024-12-03 18:51:22,572] Trial 750 finished with value: 0.13560893113357705 and parameters: {'kernel': 'linear', 'C': 93.27516562729147, 'gamma': 0.007421990504580217, 'epsilon': 0.027046620660134857}. Best is trial 345 with value: 0.13438257115663557.
[I 2024-12-03 18:51:23,434] Trial 796 finished with value: 0.1352564514855436 and parameters: {'kernel': 'linear', 'C': 80.75121291207061, 'gamma': 0.005138406133287178, 'epsilon': 0.05949912972863293}. Best is trial 345 with value: 0.13438257115663557.
[I 2024-12-03 18:51:23,465] Trial 840 finished with value: 127.06472770215926 and parameters: {'kernel': 'sigmoid', 'C': 13.98347255220187, 'gamma': 0.015045283537196915, 'epsilon': 0.008508653844371288}. Best is trial 345 with value: 0.13438257115663557.
[I 2024-12-03 18:51:23,688] Trial 818 finished with value: 0.13587648352958343 and parameters: {'kernel': 'linear', 'C': 25.07183928867238, 'gamma': 0.00010818694638909483, 'epsilon': 0.03552692905572265}. Best is trial 345 with value: 0.13438257115663557.
[I 2024-12-03 18:51:23,962] Trial 810 finished with value: 0.13519377877185493 and parameters: {'kernel': 'linear', 'C': 76.47410107698536, 'gamma': 0.012814800285340579, 'epsilon': 0.06053056991638195}. Best is trial 345 with value: 0.13438257115663557.
[I 2024-12-03 18:51:24,113] Trial 745 finished with value: 0.13819735166812633 and parameters: {'kernel': 'linear', 'C': 86.04940489071694, 'gamma': 0.002148227851550639, 'epsilon': 0.010267392474030251}. Best is trial 345 with value: 0.13438257115663557.
[I 2024-12-03 18:51:24,574] Trial 841 finished with value: 1.2015388887250575 and parameters: {'kernel': 'poly', 'C': 32.49186341451658, 'gamma': 0.0003758604252339601, 'epsilon': 0.004650475754269544}. Best is trial 345 with value: 0.13438257115663557.
[I 2024-12-03 18:51:25,844] Trial 842 finished with value: 0.4264739983443483 and parameters: {'kernel': 'poly', 'C': 30.10564425120233, 'gamma': 0.011028527867948423, 'epsilon': 0.505048533416492}. Best is trial 345 with value: 0.13438257115663557.
[I 2024-12-03 18:51:26,754] Trial 846 finished with value: 22.517460425569926 and parameters: {'kernel': 'sigmoid', 'C': 1.0504875339483408, 'gamma': 0.26586383217240206, 'epsilon': 0.00207169780933424}. Best is trial 345 with value: 0.13438257115663557.
[I 2024-12-03 18:51:26,755] Trial 847 finished with value: 1.1263877218107012 and parameters: {'kernel': 'sigmoid', 'C': 0.1107027612556316, 'gamma': 0.0008263568207911962, 'epsilon': 0.0014532527033898268}. Best is trial 345 with value: 0.13438257115663557.
[I 2024-12-03 18:51:27,685] Trial 848 finished with value: 151.9692999934547 and parameters: {'kernel': 'sigmoid', 'C': 87.99713901772952, 'gamma': 0.004923029217949825, 'epsilon': 0.027622023092876122}. Best is trial 345 with value: 0.13438257115663557.
[I 2024-12-03 18:51:28,295] Trial 849 finished with value: 4.36125075509634 and parameters: {'kernel': 'sigmoid', 'C': 16.571904439856908, 'gamma': 0.0024126720873320472, 'epsilon': 0.32566399407148977}. Best is trial 345 with value: 0.13438257115663557.
[I 2024-12-03 18:51:29,489] Trial 851 finished with value: 0.3879249879187359 and parameters: {'kernel': 'sigmoid', 'C': 36.130327189370206, 'gamma': 0.00010931129684911853, 'epsilon': 0.19564916568995203}. Best is trial 345 with value: 0.13438257115663557.
