[I 2024-12-04 00:33:06,079] Trial 2063 finished with value: 0.35180052122495725 and parameters: {'kernel': 'rbf', 'C': 4.132667957112886, 'gamma': 0.0028506000148515818, 'epsilon': 0.0034772066813755598}. Best is trial 1479 with value: 0.13978216740910654.
[I 2024-12-04 00:33:06,149] Trial 2064 finished with value: 0.38978202579597476 and parameters: {'kernel': 'rbf', 'C': 3.789352044308641, 'gamma': 0.0020742875728625492, 'epsilon': 0.002816151454673393}. Best is trial 1479 with value: 0.13978216740910654.
[I 2024-12-04 00:33:06,945] Trial 2062 finished with value: 0.610987747631542 and parameters: {'kernel': 'poly', 'C': 15.312989143460092, 'gamma': 0.01170315173592303, 'epsilon': 0.001135818781364719}. Best is trial 1479 with value: 0.13978216740910654.
[I 2024-12-04 00:33:07,341] Trial 2065 finished with value: 0.20775524210285337 and parameters: {'kernel': 'rbf', 'C': 95.9945848724034, 'gamma': 0.002141921101234655, 'epsilon': 0.0023785416736707486}. Best is trial 1479 with value: 0.13978216740910654.
[I 2024-12-04 00:33:07,975] Trial 2066 finished with value: 0.7596633411915442 and parameters: {'kernel': 'poly', 'C': 28.524982251119415, 'gamma': 0.00401421141301215, 'epsilon': 0.0032012766058185445}. Best is trial 1479 with value: 0.13978216740910654.
[I 2024-12-04 00:33:10,371] Trial 2070 finished with value: 0.28067978022044676 and parameters: {'kernel': 'rbf', 'C': 14.226436058248394, 'gamma': 0.0025189259575009275, 'epsilon': 0.00822228567567444}. Best is trial 1479 with value: 0.13978216740910654.
[I 2024-12-04 00:33:10,409] Trial 2068 finished with value: 0.183732068745818 and parameters: {'kernel': 'rbf', 'C': 22.222506642302676, 'gamma': 0.039727887568179264, 'epsilon': 0.002312537495064949}. Best is trial 1479 with value: 0.13978216740910654.
[I 2024-12-04 00:33:10,410] Trial 2067 finished with value: 0.14080039082858356 and parameters: {'kernel': 'rbf', 'C': 81.38766944091557, 'gamma': 0.008915204012123805, 'epsilon': 0.0010340638565860601}. Best is trial 1479 with value: 0.13978216740910654.
[I 2024-12-04 00:33:10,865] Trial 1744 finished with value: 0.3533138894780856 and parameters: {'kernel': 'linear', 'C': 87.48254527695107, 'gamma': 0.0031242480364752773, 'epsilon': 0.002818576057703071}. Best is trial 1479 with value: 0.13978216740910654.
[I 2024-12-04 00:33:10,865] Trial 2069 finished with value: 0.14897789256430796 and parameters: {'kernel': 'rbf', 'C': 21.794506928893462, 'gamma': 0.021539313427251832, 'epsilon': 0.0010608031644422295}. Best is trial 1479 with value: 0.13978216740910654.
[I 2024-12-04 00:33:14,011] Trial 2073 finished with value: 0.25105092890262254 and parameters: {'kernel': 'rbf', 'C': 4.221609626365321, 'gamma': 0.014015341702080486, 'epsilon': 0.004381351795595194}. Best is trial 1479 with value: 0.13978216740910654.
[I 2024-12-04 00:33:14,629] Trial 2075 finished with value: 0.26602507373994233 and parameters: {'kernel': 'rbf', 'C': 18.608994635943816, 'gamma': 0.002882464029278172, 'epsilon': 0.0010193715193354408}. Best is trial 1479 with value: 0.13978216740910654.
[I 2024-12-04 00:33:14,826] Trial 1851 finished with value: 0.35246611269843525 and parameters: {'kernel': 'linear', 'C': 59.56820625977079, 'gamma': 0.004327791391358914, 'epsilon': 0.0010188841135591034}. Best is trial 1479 with value: 0.13978216740910654.
[I 2024-12-04 00:33:15,010] Trial 2071 finished with value: 0.14048410238728876 and parameters: {'kernel': 'rbf', 'C': 94.54130034635169, 'gamma': 0.007473483257097853, 'epsilon': 0.0025329775430363763}. Best is trial 1479 with value: 0.13978216740910654.
[I 2024-12-04 00:33:15,054] Trial 2074 finished with value: 0.15309875039578247 and parameters: {'kernel': 'rbf', 'C': 15.947589118028787, 'gamma': 0.020225339250541673, 'epsilon': 0.0028217561050251985}. Best is trial 1479 with value: 0.13978216740910654.
[I 2024-12-04 00:33:16,810] Trial 2072 finished with value: 0.14309897543368444 and parameters: {'kernel': 'rbf', 'C': 89.80629251968742, 'gamma': 0.010580629738567436, 'epsilon': 0.0010687041116627456}. Best is trial 1479 with value: 0.13978216740910654.
[I 2024-12-04 00:33:16,811] Trial 2076 finished with value: 0.2392826589118041 and parameters: {'kernel': 'rbf', 'C': 22.51359980130496, 'gamma': 0.004390001810458226, 'epsilon': 0.0010244951413504108}. Best is trial 1479 with value: 0.13978216740910654.
[I 2024-12-04 00:33:18,419] Trial 2077 finished with value: 0.15632797293498427 and parameters: {'kernel': 'rbf', 'C': 27.243602774385735, 'gamma': 0.011524890003813612, 'epsilon': 0.0010196082464864332}. Best is trial 1479 with value: 0.13978216740910654.
[I 2024-12-04 00:33:18,849] Trial 2080 finished with value: 0.7428919187611559 and parameters: {'kernel': 'poly', 'C': 0.28351285480488764, 'gamma': 0.020747182169428054, 'epsilon': 0.030640926867942387}. Best is trial 1479 with value: 0.13978216740910654.
[I 2024-12-04 00:33:18,986] Trial 2078 finished with value: 0.1697216131898408 and parameters: {'kernel': 'rbf', 'C': 20.10595358816195, 'gamma': 0.011968434009088345, 'epsilon': 0.0026939341977900177}. Best is trial 1479 with value: 0.13978216740910654.
[I 2024-12-04 00:33:19,262] Trial 2079 finished with value: 0.18698289630270648 and parameters: {'kernel': 'rbf', 'C': 25.83722647186744, 'gamma': 0.00800344997938872, 'epsilon': 0.00591005006609366}. Best is trial 1479 with value: 0.13978216740910654.
[I 2024-12-04 00:33:20,683] Trial 2081 finished with value: 0.1907740784332892 and parameters: {'kernel': 'rbf', 'C': 98.85867426962236, 'gamma': 0.0027651137154727852, 'epsilon': 0.0032000332018539018}. Best is trial 1479 with value: 0.13978216740910654.
[I 2024-12-04 00:33:21,815] Trial 2082 finished with value: 0.18003145884036117 and parameters: {'kernel': 'rbf', 'C': 30.85414577660867, 'gamma': 0.034425986321197165, 'epsilon': 0.002321186790227222}. Best is trial 1479 with value: 0.13978216740910654.
[I 2024-12-04 00:33:21,815] Trial 2083 finished with value: 0.17832464924329244 and parameters: {'kernel': 'rbf', 'C': 16.397529840589574, 'gamma': 0.012376373564989933, 'epsilon': 0.0010583657002238794}. Best is trial 1479 with value: 0.13978216740910654.
[I 2024-12-04 00:33:22,648] Trial 2086 finished with value: 0.308237940103198 and parameters: {'kernel': 'rbf', 'C': 3.768299332098715, 'gamma': 0.005327154926051475, 'epsilon': 0.0031609800032947385}. Best is trial 1479 with value: 0.13978216740910654.
[I 2024-12-04 00:33:22,729] Trial 2084 finished with value: 0.2023513284031096 and parameters: {'kernel': 'rbf', 'C': 91.83069257119269, 'gamma': 0.002358556999637172, 'epsilon': 0.008476293736403103}. Best is trial 1479 with value: 0.13978216740910654.
[I 2024-12-04 00:33:23,081] Trial 2085 finished with value: 0.19794888265266541 and parameters: {'kernel': 'rbf', 'C': 98.35138463438632, 'gamma': 0.0024940484990881974, 'epsilon': 0.003383133254022547}. Best is trial 1479 with value: 0.13978216740910654.
[I 2024-12-04 00:33:25,034] Trial 2087 finished with value: 0.15047518247796912 and parameters: {'kernel': 'rbf', 'C': 96.64457269696449, 'gamma': 0.00542873859846823, 'epsilon': 0.003678109137462681}. Best is trial 1479 with value: 0.13978216740910654.
[I 2024-12-04 00:33:25,336] Trial 2089 finished with value: 0.22219756009231278 and parameters: {'kernel': 'rbf', 'C': 23.25311991831175, 'gamma': 0.005556768642794489, 'epsilon': 0.0025546260177290903}. Best is trial 1479 with value: 0.13978216740910654.
[I 2024-12-04 00:33:25,663] Trial 2088 finished with value: 0.15534769972355256 and parameters: {'kernel': 'rbf', 'C': 89.44140847905236, 'gamma': 0.005031353210913489, 'epsilon': 0.0010198072588007837}. Best is trial 1479 with value: 0.13978216740910654.
[I 2024-12-04 00:33:27,635] Trial 2091 finished with value: 0.1490888269656277 and parameters: {'kernel': 'rbf', 'C': 22.094806946318784, 'gamma': 0.021882275571646338, 'epsilon': 0.002618744178456723}. Best is trial 1479 with value: 0.13978216740910654.
[I 2024-12-04 00:33:28,856] Trial 2092 finished with value: 0.1436664197600678 and parameters: {'kernel': 'rbf', 'C': 74.80407839266306, 'gamma': 0.0073843301945327, 'epsilon': 0.0010247606380009685}. Best is trial 1479 with value: 0.13978216740910654.
[I 2024-12-04 00:33:29,578] Trial 2096 finished with value: 0.7991149033873094 and parameters: {'kernel': 'sigmoid', 'C': 4.919807468674203, 'gamma': 0.0006670567015410774, 'epsilon': 0.8399064623633173}. Best is trial 1479 with value: 0.13978216740910654.
[I 2024-12-04 00:33:30,515] Trial 2090 finished with value: 0.15013686593312645 and parameters: {'kernel': 'rbf', 'C': 95.10366264972427, 'gamma': 0.01181157199641965, 'epsilon': 0.006069858260238083}. Best is trial 1479 with value: 0.13978216740910654.
[I 2024-12-04 00:33:31,759] Trial 1985 finished with value: 0.3529411620376131 and parameters: {'kernel': 'linear', 'C': 22.698322412647777, 'gamma': 0.00817617407094191, 'epsilon': 0.002564077781579997}. Best is trial 1479 with value: 0.13978216740910654.
[I 2024-12-04 00:33:32,497] Trial 2095 finished with value: 0.1397968690702673 and parameters: {'kernel': 'rbf', 'C': 95.8384286112207, 'gamma': 0.008661073363496717, 'epsilon': 0.0010051349306693846}. Best is trial 1479 with value: 0.13978216740910654.
[I 2024-12-04 00:33:33,665] Trial 2099 finished with value: 0.19187315083755713 and parameters: {'kernel': 'rbf', 'C': 22.73729112371356, 'gamma': 0.008127781742686711, 'epsilon': 0.0010352295839228432}. Best is trial 1479 with value: 0.13978216740910654.
[I 2024-12-04 00:33:34,260] Trial 936 finished with value: 0.643701471820314 and parameters: {'kernel': 'poly', 'C': 9.642827882521622, 'gamma': 0.05025349636672318, 'epsilon': 0.0025678780280115744}. Best is trial 1479 with value: 0.13978216740910654.
[I 2024-12-04 00:33:35,229] Trial 2101 finished with value: 0.31663753556984087 and parameters: {'kernel': 'rbf', 'C': 14.602109473575213, 'gamma': 0.001522972898164544, 'epsilon': 0.001086357328906774}. Best is trial 1479 with value: 0.13978216740910654.
[I 2024-12-04 00:33:35,230] Trial 2093 finished with value: 0.19293135883740925 and parameters: {'kernel': 'rbf', 'C': 92.79644324162032, 'gamma': 0.03806748344184942, 'epsilon': 0.0012668238927648528}. Best is trial 1479 with value: 0.13978216740910654.
[I 2024-12-04 00:33:36,075] Trial 2102 finished with value: 0.24535268610507321 and parameters: {'kernel': 'rbf', 'C': 15.794840167167624, 'gamma': 0.005337559552211571, 'epsilon': 0.0010103768190099654}. Best is trial 1479 with value: 0.13978216740910654.
[I 2024-12-04 00:33:36,551] Trial 2098 finished with value: 0.18329167803369828 and parameters: {'kernel': 'rbf', 'C': 92.07343344464964, 'gamma': 0.03017793645580788, 'epsilon': 0.002654052186148459}. Best is trial 1479 with value: 0.13978216740910654.
[I 2024-12-04 00:33:38,225] Trial 2103 finished with value: 0.1482935610183052 and parameters: {'kernel': 'rbf', 'C': 22.542769943694456, 'gamma': 0.019202391002666176, 'epsilon': 0.0010834653208308623}. Best is trial 1479 with value: 0.13978216740910654.
[I 2024-12-04 00:33:39,201] Trial 2100 finished with value: 0.18825438964271876 and parameters: {'kernel': 'rbf', 'C': 92.43807034263585, 'gamma': 0.034556861556348566, 'epsilon': 0.0014964834798619619}. Best is trial 1479 with value: 0.13978216740910654.
[I 2024-12-04 00:33:39,203] Trial 2107 finished with value: 0.9981120244060548 and parameters: {'kernel': 'poly', 'C': 0.2738685364745748, 'gamma': 0.00014665117481589467, 'epsilon': 0.16378664141862273}. Best is trial 1479 with value: 0.13978216740910654.
[I 2024-12-04 00:33:39,258] Trial 2105 finished with value: 0.1477269065930042 and parameters: {'kernel': 'rbf', 'C': 25.570695924050263, 'gamma': 0.017489600716327946, 'epsilon': 0.0025902807034082825}. Best is trial 1479 with value: 0.13978216740910654.
[I 2024-12-04 00:33:40,156] Trial 2104 finished with value: 0.1570453175449838 and parameters: {'kernel': 'rbf', 'C': 90.36012166941794, 'gamma': 0.00478216032208882, 'epsilon': 0.002444566081981976}. Best is trial 1479 with value: 0.13978216740910654.
[I 2024-12-04 00:33:41,862] Trial 2108 finished with value: 0.16397672460519505 and parameters: {'kernel': 'rbf', 'C': 97.23411882612423, 'gamma': 0.003944898817583331, 'epsilon': 0.0011517832603937504}. Best is trial 1479 with value: 0.13978216740910654.
[I 2024-12-04 00:33:42,049] Trial 2106 finished with value: 0.14556574345191417 and parameters: {'kernel': 'rbf', 'C': 98.48718787506775, 'gamma': 0.01087449972691445, 'epsilon': 0.003192728205516904}. Best is trial 1479 with value: 0.13978216740910654.
[I 2024-12-04 00:33:42,407] Trial 2110 finished with value: 0.28887717927668566 and parameters: {'kernel': 'rbf', 'C': 10.525526249577483, 'gamma': 0.002903201254258601, 'epsilon': 0.0010045532123488345}. Best is trial 1479 with value: 0.13978216740910654.
[I 2024-12-04 00:33:44,414] Trial 2013 finished with value: 0.3528043653308676 and parameters: {'kernel': 'linear', 'C': 18.567219917165623, 'gamma': 0.0010484546594758844, 'epsilon': 0.001107937063889687}. Best is trial 1479 with value: 0.13978216740910654.
[I 2024-12-04 00:33:45,000] Trial 2112 finished with value: 0.16949178451246824 and parameters: {'kernel': 'rbf', 'C': 79.47890899705799, 'gamma': 0.004204606430246833, 'epsilon': 0.0010557251759045893}. Best is trial 1479 with value: 0.13978216740910654.
[I 2024-12-04 00:33:46,584] Trial 2114 finished with value: 0.15231629962199827 and parameters: {'kernel': 'rbf', 'C': 20.563870781114925, 'gamma': 0.01639404025605087, 'epsilon': 0.001034252803128775}. Best is trial 1479 with value: 0.13978216740910654.
[I 2024-12-04 00:33:46,750] Trial 2111 finished with value: 0.21194327909014746 and parameters: {'kernel': 'rbf', 'C': 87.10560959307088, 'gamma': 0.05603013926551021, 'epsilon': 0.0010443886577168966}. Best is trial 1479 with value: 0.13978216740910654.
[I 2024-12-04 00:33:47,431] Trial 2116 finished with value: 0.20761150769030656 and parameters: {'kernel': 'rbf', 'C': 18.599613789623458, 'gamma': 0.008005026846117922, 'epsilon': 0.0024214327475899243}. Best is trial 1479 with value: 0.13978216740910654.
[I 2024-12-04 00:33:48,000] Trial 2117 finished with value: 0.24525077438584947 and parameters: {'kernel': 'rbf', 'C': 3.9413529007056645, 'gamma': 0.016665345991920426, 'epsilon': 0.002334811706879507}. Best is trial 1479 with value: 0.13978216740910654.
[I 2024-12-04 00:33:49,755] Trial 2119 finished with value: 0.27926632984907235 and parameters: {'kernel': 'rbf', 'C': 87.91071054132229, 'gamma': 0.0005555173729871958, 'epsilon': 0.008490632992495525}. Best is trial 1479 with value: 0.13978216740910654.
[I 2024-12-04 00:33:49,791] Trial 2113 finished with value: 0.19312809175263335 and parameters: {'kernel': 'rbf', 'C': 98.93273067181192, 'gamma': 0.03756806447017121, 'epsilon': 0.002412020208269158}. Best is trial 1479 with value: 0.13978216740910654.
[I 2024-12-04 00:33:51,991] Trial 2121 finished with value: 0.14946990679798908 and parameters: {'kernel': 'rbf', 'C': 98.26808325821125, 'gamma': 0.0055269596397570404, 'epsilon': 0.0016268718851141252}. Best is trial 1479 with value: 0.13978216740910654.
[I 2024-12-04 00:33:53,055] Trial 2118 finished with value: 0.17592623539967742 and parameters: {'kernel': 'rbf', 'C': 77.31957324710118, 'gamma': 0.025112639455125357, 'epsilon': 0.0010144604321578536}. Best is trial 1479 with value: 0.13978216740910654.
[I 2024-12-04 00:33:56,078] Trial 2123 finished with value: 0.1509479338952628 and parameters: {'kernel': 'rbf', 'C': 92.142906589606, 'gamma': 0.012077643056166442, 'epsilon': 0.0032149149331124342}. Best is trial 1479 with value: 0.13978216740910654.
[I 2024-12-04 00:33:56,321] Trial 2120 finished with value: 0.18090422692350594 and parameters: {'kernel': 'rbf', 'C': 96.30659871363902, 'gamma': 0.028016802005583152, 'epsilon': 0.0048939649212762166}. Best is trial 1479 with value: 0.13978216740910654.
[I 2024-12-04 00:33:57,512] Trial 2124 finished with value: 0.16365918207342703 and parameters: {'kernel': 'rbf', 'C': 95.68367884062334, 'gamma': 0.014871675446607044, 'epsilon': 0.0024411610067430214}. Best is trial 1479 with value: 0.13978216740910654.
[I 2024-12-04 00:33:59,845] Trial 2128 finished with value: 210.0265456839964 and parameters: {'kernel': 'sigmoid', 'C': 20.542917861587462, 'gamma': 0.0073860882315758564, 'epsilon': 0.002483715900459818}. Best is trial 1479 with value: 0.13978216740910654.
[I 2024-12-04 00:34:00,111] Trial 2125 finished with value: 0.15550256458108794 and parameters: {'kernel': 'rbf', 'C': 92.24187189351625, 'gamma': 0.012893751460800964, 'epsilon': 0.001088567431883736}. Best is trial 1479 with value: 0.13978216740910654.
[I 2024-12-04 00:34:01,010] Trial 2126 finished with value: 0.1497653997005702 and parameters: {'kernel': 'rbf', 'C': 30.824044602961145, 'gamma': 0.01967207580413537, 'epsilon': 0.0010278277883051146}. Best is trial 1479 with value: 0.13978216740910654.
[I 2024-12-04 00:34:02,769] Trial 2130 finished with value: 0.27310876525455197 and parameters: {'kernel': 'rbf', 'C': 14.86749037021413, 'gamma': 0.002948115104729398, 'epsilon': 0.002486562372740612}. Best is trial 1479 with value: 0.13978216740910654.
[I 2024-12-04 00:34:05,329] Trial 2132 finished with value: 0.2895133900703529 and parameters: {'kernel': 'rbf', 'C': 18.8645212400053, 'gamma': 0.0017539052332544325, 'epsilon': 0.002451837325790083}. Best is trial 1479 with value: 0.13978216740910654.
[I 2024-12-04 00:34:05,366] Trial 2129 finished with value: 0.14056498849945168 and parameters: {'kernel': 'rbf', 'C': 99.10140422056857, 'gamma': 0.008370933376700059, 'epsilon': 0.003817628378124093}. Best is trial 1479 with value: 0.13978216740910654.
[I 2024-12-04 00:34:06,595] Trial 2127 finished with value: 0.18047338773471505 and parameters: {'kernel': 'rbf', 'C': 94.91653861193724, 'gamma': 0.026897383241036348, 'epsilon': 0.001046337586894271}. Best is trial 1479 with value: 0.13978216740910654.
[I 2024-12-04 00:34:08,901] Trial 2131 finished with value: 0.15804539807314463 and parameters: {'kernel': 'rbf', 'C': 98.38292020929453, 'gamma': 0.013110223876121678, 'epsilon': 0.001383422711308114}. Best is trial 1479 with value: 0.13978216740910654.
[I 2024-12-04 00:34:09,639] Trial 2134 finished with value: 0.18647324286314954 and parameters: {'kernel': 'rbf', 'C': 96.51492923185383, 'gamma': 0.0029574710421109447, 'epsilon': 0.0032146179687310697}. Best is trial 1479 with value: 0.13978216740910654.
[I 2024-12-04 00:34:11,989] Trial 2136 finished with value: 0.1697521586315017 and parameters: {'kernel': 'rbf', 'C': 20.149205403348454, 'gamma': 0.011960944546983342, 'epsilon': 0.0027059453746618753}. Best is trial 1479 with value: 0.13978216740910654.
[I 2024-12-04 00:34:12,245] Trial 2137 finished with value: 0.2843892999327158 and parameters: {'kernel': 'rbf', 'C': 4.260167028102101, 'gamma': 0.007038843626238901, 'epsilon': 0.0021279766015722297}. Best is trial 1479 with value: 0.13978216740910654.
[I 2024-12-04 00:34:12,319] Trial 2133 finished with value: 0.2101538988549381 and parameters: {'kernel': 'rbf', 'C': 97.9516641661741, 'gamma': 0.05546234734824703, 'epsilon': 0.007154268761184518}. Best is trial 1479 with value: 0.13978216740910654.
[I 2024-12-04 00:34:12,321] Trial 2135 finished with value: 0.14118146345023644 and parameters: {'kernel': 'rbf', 'C': 78.65578380290177, 'gamma': 0.009098350225725905, 'epsilon': 0.0010004609395892353}. Best is trial 1479 with value: 0.13978216740910654.
[I 2024-12-04 00:34:15,670] Trial 2141 finished with value: 439.1410944798063 and parameters: {'kernel': 'sigmoid', 'C': 93.56985288291426, 'gamma': 0.0035851408042080228, 'epsilon': 0.0012388411384330023}. Best is trial 1479 with value: 0.13978216740910654.
[I 2024-12-04 00:34:17,252] Trial 2139 finished with value: 0.1500462113422762 and parameters: {'kernel': 'rbf', 'C': 24.366135331999843, 'gamma': 0.02226605959643035, 'epsilon': 0.0023095762232684717}. Best is trial 1479 with value: 0.13978216740910654.
[I 2024-12-04 00:34:18,647] Trial 2138 finished with value: 0.14077145426556154 and parameters: {'kernel': 'rbf', 'C': 82.615399125291, 'gamma': 0.008384435044638929, 'epsilon': 0.0010805281488726153}. Best is trial 1479 with value: 0.13978216740910654.
[I 2024-12-04 00:34:18,799] Trial 2140 finished with value: 0.1400348584236056 and parameters: {'kernel': 'rbf', 'C': 90.86191547846099, 'gamma': 0.008436340637445796, 'epsilon': 0.001079461940583564}. Best is trial 1479 with value: 0.13978216740910654.
[I 2024-12-04 00:34:20,191] Trial 2143 finished with value: 0.2197679844456739 and parameters: {'kernel': 'rbf', 'C': 19.532486374887704, 'gamma': 0.006826809837198108, 'epsilon': 0.006046428725634843}. Best is trial 1479 with value: 0.13978216740910654.
[I 2024-12-04 00:34:21,596] Trial 2145 finished with value: 0.2783819874089143 and parameters: {'kernel': 'rbf', 'C': 27.165171971939333, 'gamma': 0.0015267165932822228, 'epsilon': 0.0016109725825472496}. Best is trial 1479 with value: 0.13978216740910654.
[I 2024-12-04 00:34:21,894] Trial 2144 finished with value: 0.22342074192488462 and parameters: {'kernel': 'rbf', 'C': 99.90611041076131, 'gamma': 0.0015249122624241137, 'epsilon': 0.0011618456150062435}. Best is trial 1479 with value: 0.13978216740910654.
[I 2024-12-04 00:34:22,201] Trial 2097 finished with value: 0.5634272451131052 and parameters: {'kernel': 'poly', 'C': 95.90891170105746, 'gamma': 0.015905136071081058, 'epsilon': 0.0014389639971120129}. Best is trial 1479 with value: 0.13978216740910654.
[I 2024-12-04 00:34:23,383] Trial 2146 finished with value: 0.20075764922870315 and parameters: {'kernel': 'rbf', 'C': 36.0531306472295, 'gamma': 0.005137802820378081, 'epsilon': 0.001052765081768346}. Best is trial 1479 with value: 0.13978216740910654.
[I 2024-12-04 00:34:23,477] Trial 2142 finished with value: 0.2124738086508913 and parameters: {'kernel': 'rbf', 'C': 92.11044413425407, 'gamma': 0.058853246307995565, 'epsilon': 0.003114131916816564}. Best is trial 1479 with value: 0.13978216740910654.
