[I 2024-12-04 20:21:42,204] Trial 1682 finished with value: 0.34274173051854434 and parameters: {'n_estimators': 293, 'max_depth': 43, 'min_samples_split': 2, 'min_samples_leaf': 1, 'max_features': 'sqrt', 'bootstrap': False, 'criterion': 'squared_error'}. Best is trial 1631 with value: 0.32128932742921457.
[I 2024-12-04 20:21:44,559] Trial 1683 finished with value: 0.5665867272395887 and parameters: {'n_estimators': 637, 'max_depth': 7, 'min_samples_split': 22, 'min_samples_leaf': 1, 'max_features': None, 'bootstrap': True, 'criterion': 'squared_error'}. Best is trial 1631 with value: 0.32128932742921457.
[I 2024-12-04 20:21:46,207] Trial 1684 finished with value: 0.3457863781865051 and parameters: {'n_estimators': 285, 'max_depth': 42, 'min_samples_split': 2, 'min_samples_leaf': 1, 'max_features': 'sqrt', 'bootstrap': False, 'criterion': 'squared_error'}. Best is trial 1631 with value: 0.32128932742921457.
[I 2024-12-04 20:21:48,059] Trial 1685 finished with value: 0.4052615628208669 and parameters: {'n_estimators': 341, 'max_depth': 33, 'min_samples_split': 2, 'min_samples_leaf': 1, 'max_features': 'sqrt', 'bootstrap': False, 'criterion': 'squared_error'}. Best is trial 1631 with value: 0.32128932742921457.
[I 2024-12-04 20:21:49,285] Trial 1686 finished with value: 0.6660010459487863 and parameters: {'n_estimators': 339, 'max_depth': 50, 'min_samples_split': 2, 'min_samples_leaf': 2, 'max_features': 'sqrt', 'bootstrap': False, 'criterion': 'squared_error'}. Best is trial 1631 with value: 0.32128932742921457.
[I 2024-12-04 20:21:50,308] Trial 1679 finished with value: 0.6533902627660958 and parameters: {'n_estimators': 548, 'max_depth': 43, 'min_samples_split': 2, 'min_samples_leaf': 14, 'max_features': None, 'bootstrap': False, 'criterion': 'absolute_error'}. Best is trial 1631 with value: 0.32128932742921457.
[I 2024-12-04 20:21:51,285] Trial 1687 finished with value: 0.3920139919700365 and parameters: {'n_estimators': 465, 'max_depth': 50, 'min_samples_split': 4, 'min_samples_leaf': 1, 'max_features': 'sqrt', 'bootstrap': False, 'criterion': 'squared_error'}. Best is trial 1631 with value: 0.32128932742921457.
[I 2024-12-04 20:21:52,094] Trial 1688 finished with value: 0.3231412696563741 and parameters: {'n_estimators': 224, 'max_depth': 50, 'min_samples_split': 2, 'min_samples_leaf': 1, 'max_features': 'sqrt', 'bootstrap': False, 'criterion': 'squared_error'}. Best is trial 1631 with value: 0.32128932742921457.
[I 2024-12-04 20:21:53,381] Trial 1690 finished with value: 0.6689529198279663 and parameters: {'n_estimators': 343, 'max_depth': 44, 'min_samples_split': 4, 'min_samples_leaf': 2, 'max_features': 'sqrt', 'bootstrap': False, 'criterion': 'squared_error'}. Best is trial 1631 with value: 0.32128932742921457.
[I 2024-12-04 20:21:54,883] Trial 1691 finished with value: 0.623267845077559 and parameters: {'n_estimators': 251, 'max_depth': 22, 'min_samples_split': 31, 'min_samples_leaf': 2, 'max_features': None, 'bootstrap': True, 'criterion': 'squared_error'}. Best is trial 1631 with value: 0.32128932742921457.
[I 2024-12-04 20:21:56,180] Trial 1689 finished with value: 0.43396247980591496 and parameters: {'n_estimators': 449, 'max_depth': 50, 'min_samples_split': 2, 'min_samples_leaf': 1, 'max_features': None, 'bootstrap': False, 'criterion': 'squared_error'}. Best is trial 1631 with value: 0.32128932742921457.
[I 2024-12-04 20:21:56,965] Trial 1681 finished with value: 0.5801510949300911 and parameters: {'n_estimators': 670, 'max_depth': 49, 'min_samples_split': 6, 'min_samples_leaf': 9, 'max_features': None, 'bootstrap': False, 'criterion': 'absolute_error'}. Best is trial 1631 with value: 0.32128932742921457.
[I 2024-12-04 20:21:57,324] Trial 1692 finished with value: 0.7312952076058751 and parameters: {'n_estimators': 940, 'max_depth': 25, 'min_samples_split': 2, 'min_samples_leaf': 2, 'max_features': 'sqrt', 'bootstrap': False, 'criterion': 'squared_error'}. Best is trial 1631 with value: 0.32128932742921457.
[I 2024-12-04 20:21:58,675] Trial 1693 finished with value: 0.74126083168356 and parameters: {'n_estimators': 448, 'max_depth': 50, 'min_samples_split': 13, 'min_samples_leaf': 14, 'max_features': None, 'bootstrap': True, 'criterion': 'squared_error'}. Best is trial 1631 with value: 0.32128932742921457.
[I 2024-12-04 20:21:59,590] Trial 1695 finished with value: 0.3774428129070053 and parameters: {'n_estimators': 309, 'max_depth': 44, 'min_samples_split': 3, 'min_samples_leaf': 1, 'max_features': 'sqrt', 'bootstrap': False, 'criterion': 'squared_error'}. Best is trial 1631 with value: 0.32128932742921457.
[I 2024-12-04 20:21:59,932] Trial 1694 finished with value: 0.4578975138948155 and parameters: {'n_estimators': 517, 'max_depth': 30, 'min_samples_split': 2, 'min_samples_leaf': 1, 'max_features': 'sqrt', 'bootstrap': False, 'criterion': 'squared_error'}. Best is trial 1631 with value: 0.32128932742921457.
[I 2024-12-04 20:22:01,248] Trial 1698 finished with value: 0.33516635624148966 and parameters: {'n_estimators': 150, 'max_depth': 50, 'min_samples_split': 2, 'min_samples_leaf': 1, 'max_features': 'sqrt', 'bootstrap': False, 'criterion': 'squared_error'}. Best is trial 1631 with value: 0.32128932742921457.
[I 2024-12-04 20:22:02,554] Trial 1699 finished with value: 0.6816002620428996 and parameters: {'n_estimators': 404, 'max_depth': 50, 'min_samples_split': 2, 'min_samples_leaf': 2, 'max_features': 'sqrt', 'bootstrap': False, 'criterion': 'squared_error'}. Best is trial 1631 with value: 0.32128932742921457.
[I 2024-12-04 20:22:04,200] Trial 1700 finished with value: 0.3434414716147236 and parameters: {'n_estimators': 282, 'max_depth': 43, 'min_samples_split': 2, 'min_samples_leaf': 1, 'max_features': 'sqrt', 'bootstrap': False, 'criterion': 'squared_error'}. Best is trial 1631 with value: 0.32128932742921457.
[I 2024-12-04 20:22:05,871] Trial 1701 finished with value: 0.39758786599464946 and parameters: {'n_estimators': 365, 'max_depth': 43, 'min_samples_split': 3, 'min_samples_leaf': 1, 'max_features': 'sqrt', 'bootstrap': False, 'criterion': 'squared_error'}. Best is trial 1631 with value: 0.32128932742921457.
[I 2024-12-04 20:22:07,918] Trial 1702 finished with value: 0.32432958404010126 and parameters: {'n_estimators': 308, 'max_depth': 50, 'min_samples_split': 2, 'min_samples_leaf': 1, 'max_features': 'sqrt', 'bootstrap': False, 'criterion': 'squared_error'}. Best is trial 1631 with value: 0.32128932742921457.
[I 2024-12-04 20:22:08,944] Trial 1703 finished with value: 1.2761699830423059 and parameters: {'n_estimators': 264, 'max_depth': 24, 'min_samples_split': 46, 'min_samples_leaf': 13, 'max_features': 'log2', 'bootstrap': False, 'criterion': 'squared_error'}. Best is trial 1631 with value: 0.32128932742921457.
[I 2024-12-04 20:22:10,522] Trial 1696 finished with value: 0.542906261202627 and parameters: {'n_estimators': 595, 'max_depth': 49, 'min_samples_split': 2, 'min_samples_leaf': 1, 'max_features': 'log2', 'bootstrap': False, 'criterion': 'absolute_error'}. Best is trial 1631 with value: 0.32128932742921457.
[I 2024-12-04 20:22:11,387] Trial 1704 finished with value: 0.32257382998279355 and parameters: {'n_estimators': 346, 'max_depth': 50, 'min_samples_split': 2, 'min_samples_leaf': 1, 'max_features': 'sqrt', 'bootstrap': False, 'criterion': 'squared_error'}. Best is trial 1631 with value: 0.32128932742921457.
[I 2024-12-04 20:22:12,324] Trial 1705 finished with value: 0.3566044265708879 and parameters: {'n_estimators': 270, 'max_depth': 50, 'min_samples_split': 3, 'min_samples_leaf': 1, 'max_features': 'sqrt', 'bootstrap': False, 'criterion': 'squared_error'}. Best is trial 1631 with value: 0.32128932742921457.
[I 2024-12-04 20:22:13,037] Trial 1697 finished with value: 0.5754471174700652 and parameters: {'n_estimators': 159, 'max_depth': 30, 'min_samples_split': 37, 'min_samples_leaf': 2, 'max_features': None, 'bootstrap': False, 'criterion': 'absolute_error'}. Best is trial 1631 with value: 0.32128932742921457.
[I 2024-12-04 20:22:14,189] Trial 1706 finished with value: 0.32795152554709356 and parameters: {'n_estimators': 443, 'max_depth': 50, 'min_samples_split': 2, 'min_samples_leaf': 1, 'max_features': 'sqrt', 'bootstrap': False, 'criterion': 'squared_error'}. Best is trial 1631 with value: 0.32128932742921457.
[I 2024-12-04 20:22:14,575] Trial 1707 finished with value: 0.35818753698814004 and parameters: {'n_estimators': 376, 'max_depth': 50, 'min_samples_split': 3, 'min_samples_leaf': 1, 'max_features': 'sqrt', 'bootstrap': False, 'criterion': 'squared_error'}. Best is trial 1631 with value: 0.32128932742921457.
[I 2024-12-04 20:22:15,266] Trial 1708 finished with value: 0.34581388504122035 and parameters: {'n_estimators': 248, 'max_depth': 43, 'min_samples_split': 2, 'min_samples_leaf': 1, 'max_features': 'sqrt', 'bootstrap': False, 'criterion': 'squared_error'}. Best is trial 1631 with value: 0.32128932742921457.
[I 2024-12-04 20:22:16,458] Trial 1710 finished with value: 0.6688811506663483 and parameters: {'n_estimators': 299, 'max_depth': 42, 'min_samples_split': 2, 'min_samples_leaf': 2, 'max_features': 'sqrt', 'bootstrap': False, 'criterion': 'squared_error'}. Best is trial 1631 with value: 0.32128932742921457.
[I 2024-12-04 20:22:16,839] Trial 1709 finished with value: 0.3251493599904596 and parameters: {'n_estimators': 283, 'max_depth': 50, 'min_samples_split': 2, 'min_samples_leaf': 1, 'max_features': 'sqrt', 'bootstrap': False, 'criterion': 'squared_error'}. Best is trial 1631 with value: 0.32128932742921457.
[I 2024-12-04 20:22:18,122] Trial 1711 finished with value: 0.3245816351681366 and parameters: {'n_estimators': 433, 'max_depth': 50, 'min_samples_split': 2, 'min_samples_leaf': 1, 'max_features': 'sqrt', 'bootstrap': False, 'criterion': 'squared_error'}. Best is trial 1631 with value: 0.32128932742921457.
[I 2024-12-04 20:22:18,954] Trial 1713 finished with value: 0.32482465918889764 and parameters: {'n_estimators': 193, 'max_depth': 50, 'min_samples_split': 2, 'min_samples_leaf': 1, 'max_features': 'sqrt', 'bootstrap': False, 'criterion': 'squared_error'}. Best is trial 1631 with value: 0.32128932742921457.
[I 2024-12-04 20:22:19,196] Trial 1712 finished with value: 0.3221369243160699 and parameters: {'n_estimators': 348, 'max_depth': 50, 'min_samples_split': 2, 'min_samples_leaf': 1, 'max_features': 'sqrt', 'bootstrap': False, 'criterion': 'squared_error'}. Best is trial 1631 with value: 0.32128932742921457.
[I 2024-12-04 20:22:20,871] Trial 1715 finished with value: 0.6852727781020602 and parameters: {'n_estimators': 510, 'max_depth': 50, 'min_samples_split': 2, 'min_samples_leaf': 2, 'max_features': 'sqrt', 'bootstrap': False, 'criterion': 'squared_error'}. Best is trial 1631 with value: 0.32128932742921457.
[I 2024-12-04 20:22:22,085] Trial 1716 finished with value: 0.8668098406860214 and parameters: {'n_estimators': 938, 'max_depth': 26, 'min_samples_split': 3, 'min_samples_leaf': 1, 'max_features': 'log2', 'bootstrap': True, 'criterion': 'squared_error'}. Best is trial 1631 with value: 0.32128932742921457.
[I 2024-12-04 20:22:22,725] Trial 1717 finished with value: 0.3876131222415381 and parameters: {'n_estimators': 390, 'max_depth': 50, 'min_samples_split': 4, 'min_samples_leaf': 1, 'max_features': 'sqrt', 'bootstrap': False, 'criterion': 'squared_error'}. Best is trial 1631 with value: 0.32128932742921457.
[I 2024-12-04 20:22:24,021] Trial 1719 finished with value: 0.663691472558903 and parameters: {'n_estimators': 271, 'max_depth': 50, 'min_samples_split': 2, 'min_samples_leaf': 2, 'max_features': 'sqrt', 'bootstrap': False, 'criterion': 'squared_error'}. Best is trial 1631 with value: 0.32128932742921457.
[I 2024-12-04 20:22:24,894] Trial 1718 finished with value: 0.35721270295181085 and parameters: {'n_estimators': 482, 'max_depth': 42, 'min_samples_split': 2, 'min_samples_leaf': 1, 'max_features': 'sqrt', 'bootstrap': False, 'criterion': 'squared_error'}. Best is trial 1631 with value: 0.32128932742921457.
[I 2024-12-04 20:22:24,950] Trial 1720 finished with value: 0.8134851749208081 and parameters: {'n_estimators': 113, 'max_depth': 45, 'min_samples_split': 5, 'min_samples_leaf': 2, 'max_features': 'sqrt', 'bootstrap': True, 'criterion': 'squared_error'}. Best is trial 1631 with value: 0.32128932742921457.
[I 2024-12-04 20:22:26,322] Trial 1721 finished with value: 0.4135104164660742 and parameters: {'n_estimators': 222, 'max_depth': 41, 'min_samples_split': 4, 'min_samples_leaf': 1, 'max_features': 'sqrt', 'bootstrap': False, 'criterion': 'squared_error'}. Best is trial 1631 with value: 0.32128932742921457.
[I 2024-12-04 20:22:26,635] Trial 1722 finished with value: 0.40949012052437894 and parameters: {'n_estimators': 250, 'max_depth': 42, 'min_samples_split': 4, 'min_samples_leaf': 1, 'max_features': 'sqrt', 'bootstrap': False, 'criterion': 'squared_error'}. Best is trial 1631 with value: 0.32128932742921457.
[I 2024-12-04 20:22:28,654] Trial 1723 finished with value: 0.3516594578821244 and parameters: {'n_estimators': 429, 'max_depth': 43, 'min_samples_split': 2, 'min_samples_leaf': 1, 'max_features': 'sqrt', 'bootstrap': False, 'criterion': 'squared_error'}. Best is trial 1631 with value: 0.32128932742921457.
[I 2024-12-04 20:22:29,627] Trial 1724 finished with value: 1.2409009701268945 and parameters: {'n_estimators': 489, 'max_depth': 8, 'min_samples_split': 4, 'min_samples_leaf': 1, 'max_features': 'log2', 'bootstrap': True, 'criterion': 'absolute_error'}. Best is trial 1631 with value: 0.32128932742921457.
[I 2024-12-04 20:22:30,510] Trial 1725 finished with value: 0.8126301031870539 and parameters: {'n_estimators': 101, 'max_depth': 32, 'min_samples_split': 2, 'min_samples_leaf': 1, 'max_features': 'log2', 'bootstrap': True, 'criterion': 'absolute_error'}. Best is trial 1631 with value: 0.32128932742921457.
[I 2024-12-04 20:22:30,511] Trial 1714 finished with value: 0.5423617683084411 and parameters: {'n_estimators': 564, 'max_depth': 32, 'min_samples_split': 4, 'min_samples_leaf': 5, 'max_features': None, 'bootstrap': True, 'criterion': 'absolute_error'}. Best is trial 1631 with value: 0.32128932742921457.
[I 2024-12-04 20:22:31,859] Trial 1727 finished with value: 0.6651027974088184 and parameters: {'n_estimators': 196, 'max_depth': 43, 'min_samples_split': 3, 'min_samples_leaf': 2, 'max_features': 'sqrt', 'bootstrap': False, 'criterion': 'squared_error'}. Best is trial 1631 with value: 0.32128932742921457.
[I 2024-12-04 20:22:32,458] Trial 1726 finished with value: 0.3277836498543059 and parameters: {'n_estimators': 453, 'max_depth': 50, 'min_samples_split': 2, 'min_samples_leaf': 1, 'max_features': 'sqrt', 'bootstrap': False, 'criterion': 'squared_error'}. Best is trial 1631 with value: 0.32128932742921457.
[I 2024-12-04 20:22:33,559] Trial 1728 finished with value: 1.1662322216857468 and parameters: {'n_estimators': 426, 'max_depth': 29, 'min_samples_split': 15, 'min_samples_leaf': 4, 'max_features': 'sqrt', 'bootstrap': True, 'criterion': 'absolute_error'}. Best is trial 1631 with value: 0.32128932742921457.
[I 2024-12-04 20:22:33,800] Trial 1729 finished with value: 0.38660284658212096 and parameters: {'n_estimators': 366, 'max_depth': 50, 'min_samples_split': 4, 'min_samples_leaf': 1, 'max_features': 'sqrt', 'bootstrap': False, 'criterion': 'squared_error'}. Best is trial 1631 with value: 0.32128932742921457.
[I 2024-12-04 20:22:35,045] Trial 1730 finished with value: 0.32362107296092046 and parameters: {'n_estimators': 315, 'max_depth': 50, 'min_samples_split': 2, 'min_samples_leaf': 1, 'max_features': 'sqrt', 'bootstrap': False, 'criterion': 'squared_error'}. Best is trial 1631 with value: 0.32128932742921457.
[I 2024-12-04 20:22:35,914] Trial 1731 finished with value: 0.8325268429719873 and parameters: {'n_estimators': 572, 'max_depth': 45, 'min_samples_split': 44, 'min_samples_leaf': 1, 'max_features': 'log2', 'bootstrap': True, 'criterion': 'squared_error'}. Best is trial 1631 with value: 0.32128932742921457.
[I 2024-12-04 20:22:37,246] Trial 1732 finished with value: 0.710890285498441 and parameters: {'n_estimators': 708, 'max_depth': 40, 'min_samples_split': 12, 'min_samples_leaf': 12, 'max_features': None, 'bootstrap': True, 'criterion': 'squared_error'}. Best is trial 1631 with value: 0.32128932742921457.
[I 2024-12-04 20:22:37,417] Trial 1734 finished with value: 0.32295525909093026 and parameters: {'n_estimators': 208, 'max_depth': 50, 'min_samples_split': 2, 'min_samples_leaf': 1, 'max_features': 'sqrt', 'bootstrap': False, 'criterion': 'squared_error'}. Best is trial 1631 with value: 0.32128932742921457.
[I 2024-12-04 20:22:39,460] Trial 1735 finished with value: 0.3907102316009277 and parameters: {'n_estimators': 570, 'max_depth': 50, 'min_samples_split': 4, 'min_samples_leaf': 1, 'max_features': 'sqrt', 'bootstrap': False, 'criterion': 'squared_error'}. Best is trial 1631 with value: 0.32128932742921457.
[I 2024-12-04 20:22:39,796] Trial 1736 finished with value: 0.322241352022175 and parameters: {'n_estimators': 373, 'max_depth': 50, 'min_samples_split': 2, 'min_samples_leaf': 1, 'max_features': 'sqrt', 'bootstrap': False, 'criterion': 'squared_error'}. Best is trial 1631 with value: 0.32128932742921457.
[I 2024-12-04 20:22:41,002] Trial 1737 finished with value: 0.694648922705303 and parameters: {'n_estimators': 416, 'max_depth': 41, 'min_samples_split': 3, 'min_samples_leaf': 2, 'max_features': 'sqrt', 'bootstrap': False, 'criterion': 'squared_error'}. Best is trial 1631 with value: 0.32128932742921457.
[I 2024-12-04 20:22:43,464] Trial 1739 finished with value: 0.35445586141796964 and parameters: {'n_estimators': 531, 'max_depth': 43, 'min_samples_split': 2, 'min_samples_leaf': 1, 'max_features': 'sqrt', 'bootstrap': False, 'criterion': 'squared_error'}. Best is trial 1631 with value: 0.32128932742921457.
[I 2024-12-04 20:22:44,523] Trial 1740 finished with value: 0.3903824585366123 and parameters: {'n_estimators': 131, 'max_depth': 50, 'min_samples_split': 4, 'min_samples_leaf': 1, 'max_features': 'sqrt', 'bootstrap': False, 'criterion': 'squared_error'}. Best is trial 1631 with value: 0.32128932742921457.
[I 2024-12-04 20:22:45,779] Trial 1741 finished with value: 0.6663909192947454 and parameters: {'n_estimators': 347, 'max_depth': 50, 'min_samples_split': 2, 'min_samples_leaf': 2, 'max_features': 'sqrt', 'bootstrap': False, 'criterion': 'squared_error'}. Best is trial 1631 with value: 0.32128932742921457.
[I 2024-12-04 20:22:46,655] Trial 1742 finished with value: 1.21186941244989 and parameters: {'n_estimators': 160, 'max_depth': 15, 'min_samples_split': 12, 'min_samples_leaf': 14, 'max_features': 'sqrt', 'bootstrap': False, 'criterion': 'squared_error'}. Best is trial 1631 with value: 0.32128932742921457.
[I 2024-12-04 20:22:47,780] Trial 1733 finished with value: 0.3982927749082585 and parameters: {'n_estimators': 490, 'max_depth': 42, 'min_samples_split': 2, 'min_samples_leaf': 1, 'max_features': 'sqrt', 'bootstrap': False, 'criterion': 'absolute_error'}. Best is trial 1631 with value: 0.32128932742921457.
[I 2024-12-04 20:22:47,781] Trial 1738 finished with value: 0.5716065518763049 and parameters: {'n_estimators': 453, 'max_depth': 9, 'min_samples_split': 2, 'min_samples_leaf': 6, 'max_features': None, 'bootstrap': True, 'criterion': 'absolute_error'}. Best is trial 1631 with value: 0.32128932742921457.
[I 2024-12-04 20:22:48,255] Trial 1743 finished with value: 0.9569574779913221 and parameters: {'n_estimators': 474, 'max_depth': 26, 'min_samples_split': 2, 'min_samples_leaf': 3, 'max_features': 'sqrt', 'bootstrap': True, 'criterion': 'squared_error'}. Best is trial 1631 with value: 0.32128932742921457.
[I 2024-12-04 20:22:50,139] Trial 1744 finished with value: 0.38523122143292005 and parameters: {'n_estimators': 337, 'max_depth': 46, 'min_samples_split': 2, 'min_samples_leaf': 1, 'max_features': 'sqrt', 'bootstrap': True, 'criterion': 'squared_error'}. Best is trial 1631 with value: 0.32128932742921457.
[I 2024-12-04 20:22:50,463] Trial 1745 finished with value: 0.3217891260846757 and parameters: {'n_estimators': 377, 'max_depth': 50, 'min_samples_split': 2, 'min_samples_leaf': 1, 'max_features': 'sqrt', 'bootstrap': False, 'criterion': 'squared_error'}. Best is trial 1631 with value: 0.32128932742921457.
[I 2024-12-04 20:22:51,538] Trial 1746 finished with value: 0.32814106858951464 and parameters: {'n_estimators': 502, 'max_depth': 50, 'min_samples_split': 2, 'min_samples_leaf': 1, 'max_features': 'sqrt', 'bootstrap': False, 'criterion': 'squared_error'}. Best is trial 1631 with value: 0.32128932742921457.
[I 2024-12-04 20:22:52,600] Trial 1747 finished with value: 0.36677264147625843 and parameters: {'n_estimators': 511, 'max_depth': 50, 'min_samples_split': 3, 'min_samples_leaf': 1, 'max_features': 'sqrt', 'bootstrap': False, 'criterion': 'squared_error'}. Best is trial 1631 with value: 0.32128932742921457.
[I 2024-12-04 20:22:52,608] Trial 1749 finished with value: 1.0532699658875595 and parameters: {'n_estimators': 284, 'max_depth': 45, 'min_samples_split': 2, 'min_samples_leaf': 2, 'max_features': 'log2', 'bootstrap': False, 'criterion': 'squared_error'}. Best is trial 1631 with value: 0.32128932742921457.
[I 2024-12-04 20:22:53,534] Trial 1748 finished with value: 0.3288011957544433 and parameters: {'n_estimators': 469, 'max_depth': 50, 'min_samples_split': 2, 'min_samples_leaf': 1, 'max_features': 'sqrt', 'bootstrap': False, 'criterion': 'squared_error'}. Best is trial 1631 with value: 0.32128932742921457.
[I 2024-12-04 20:22:55,421] Trial 1752 finished with value: 0.6832377251519474 and parameters: {'n_estimators': 617, 'max_depth': 42, 'min_samples_split': 2, 'min_samples_leaf': 2, 'max_features': 'sqrt', 'bootstrap': False, 'criterion': 'squared_error'}. Best is trial 1631 with value: 0.32128932742921457.
