[I 2024-12-04 15:14:23,370] Trial 1872 finished with value: 0.6443851501572699 and parameters: {'kernel_type': 'RBF', 'length_scale': 84204.77757126017, 'noise_level': 0.09575510003372509, 'constant_value': 55367.24222869227, 'nu': 0.5}. Best is trial 386 with value: 0.4872991004520934.
[I 2024-12-04 15:14:23,544] Trial 1859 finished with value: 0.4883032840175948 and parameters: {'kernel_type': 'Matern', 'length_scale': 9014.466191404705, 'noise_level': 0.6703534885868393, 'constant_value': 77355.9240555558, 'nu': 0.5}. Best is trial 386 with value: 0.4872991004520934.
[I 2024-12-04 15:14:26,566] Trial 1886 finished with value: 0.48830341849734965 and parameters: {'kernel_type': 'Matern', 'length_scale': 85504.83049687035, 'noise_level': 0.8735108751719065, 'constant_value': 3007.5033431725265, 'nu': 0.5}. Best is trial 386 with value: 0.4872991004520934.
[I 2024-12-04 15:14:26,686] Trial 1871 finished with value: 0.48830341909502406 and parameters: {'kernel_type': 'Matern', 'length_scale': 183.98002561148144, 'noise_level': 0.012136378283513678, 'constant_value': 92429.98876570491, 'nu': 0.5}. Best is trial 386 with value: 0.4872991004520934.
[I 2024-12-04 15:14:28,136] Trial 1877 finished with value: 0.5663936735845692 and parameters: {'kernel_type': 'Matern', 'length_scale': 6082.35536098866, 'noise_level': 0.5728045555631295, 'constant_value': 586.106634941655, 'nu': 2.5}. Best is trial 386 with value: 0.4872991004520934.
[I 2024-12-04 15:14:28,610] Trial 1878 finished with value: 0.4883033487239816 and parameters: {'kernel_type': 'Matern', 'length_scale': 4431.630106258198, 'noise_level': 0.01144965846804175, 'constant_value': 71256.76619692818, 'nu': 0.5}. Best is trial 386 with value: 0.4872991004520934.
[I 2024-12-04 15:14:29,351] Trial 1885 finished with value: 0.4883033457546048 and parameters: {'kernel_type': 'Matern', 'length_scale': 698.4099068173675, 'noise_level': 0.7477625819874507, 'constant_value': 3375.668428767908, 'nu': 0.5}. Best is trial 386 with value: 0.4872991004520934.
[I 2024-12-04 15:14:29,960] Trial 1882 finished with value: 1.2401112311111826 and parameters: {'kernel_type': 'Matern', 'length_scale': 29.322334879942307, 'noise_level': 1.2053466037289533e-09, 'constant_value': 0.0003282677812654135, 'nu': 1.5}. Best is trial 386 with value: 0.4872991004520934.
[I 2024-12-04 15:14:30,462] Trial 1888 finished with value: 1.24011123203837 and parameters: {'kernel_type': 'Matern', 'length_scale': 56773.492743040086, 'noise_level': 0.0001460281595969843, 'constant_value': 0.295376520666182, 'nu': 0.5}. Best is trial 386 with value: 0.4872991004520934.
[I 2024-12-04 15:14:30,739] Trial 1883 finished with value: 1.2401112327169466 and parameters: {'kernel_type': 'RBF', 'length_scale': 19532.470439791847, 'noise_level': 6.256538327341076e-09, 'constant_value': 0.37715033480868787, 'nu': 1.5}. Best is trial 386 with value: 0.4872991004520934.
[I 2024-12-04 15:14:31,491] Trial 1884 finished with value: 0.48830343461896303 and parameters: {'kernel_type': 'Matern', 'length_scale': 5882.314795891015, 'noise_level': 0.8738243521630857, 'constant_value': 84173.83491311199, 'nu': 0.5}. Best is trial 386 with value: 0.4872991004520934.
[I 2024-12-04 15:14:32,137] Trial 1887 finished with value: 1.24011123247939 and parameters: {'kernel_type': 'Matern', 'length_scale': 35.9782490612184, 'noise_level': 0.01385394873584196, 'constant_value': 0.0042985852890483, 'nu': 0.5}. Best is trial 386 with value: 0.4872991004520934.
[I 2024-12-04 15:14:33,021] Trial 1881 finished with value: 1.2614547303171213 and parameters: {'kernel_type': 'Matern', 'length_scale': 5766.75721018966, 'noise_level': 0.6284792306215196, 'constant_value': 0.01813894162493639, 'nu': 0.5}. Best is trial 386 with value: 0.4872991004520934.
[I 2024-12-04 15:14:33,045] Trial 1893 finished with value: 0.4883033770381362 and parameters: {'kernel_type': 'Matern', 'length_scale': 64113.88248634043, 'noise_level': 0.3997911525307643, 'constant_value': 92477.87281466002, 'nu': 0.5}. Best is trial 386 with value: 0.4872991004520934.
[I 2024-12-04 15:14:33,698] Trial 1879 finished with value: 0.48830344395214875 and parameters: {'kernel_type': 'Matern', 'length_scale': 57729.00441861932, 'noise_level': 0.9686338525141354, 'constant_value': 6362.264105968785, 'nu': 0.5}. Best is trial 386 with value: 0.4872991004520934.
[I 2024-12-04 15:14:36,461] Trial 1891 finished with value: 0.4883035455074733 and parameters: {'kernel_type': 'Matern', 'length_scale': 97397.17264962563, 'noise_level': 0.791291211979841, 'constant_value': 213.11699055305547, 'nu': 0.5}. Best is trial 386 with value: 0.4872991004520934.
[I 2024-12-04 15:14:37,518] Trial 1892 finished with value: 0.5273053713057816 and parameters: {'kernel_type': 'Matern', 'length_scale': 30029.181942115352, 'noise_level': 0.42391727040206795, 'constant_value': 4311.055367342083, 'nu': 1.5}. Best is trial 386 with value: 0.4872991004520934.
[I 2024-12-04 15:14:37,793] Trial 1897 finished with value: 0.48830296052658945 and parameters: {'kernel_type': 'Matern', 'length_scale': 74376.63864162832, 'noise_level': 0.009284136189157851, 'constant_value': 2824.039785271373, 'nu': 0.5}. Best is trial 386 with value: 0.4872991004520934.
[I 2024-12-04 15:14:37,801] Trial 1894 finished with value: 1.2401112326905048 and parameters: {'kernel_type': 'RBF', 'length_scale': 35157.25010696947, 'noise_level': 1.0223322938945578e-05, 'constant_value': 0.00036085350525674883, 'nu': 1.5}. Best is trial 386 with value: 0.4872991004520934.
[I 2024-12-04 15:14:38,352] Trial 1900 finished with value: 0.4883034189325521 and parameters: {'kernel_type': 'Matern', 'length_scale': 93099.06230925697, 'noise_level': 0.6063709173271586, 'constant_value': 377.50474350943887, 'nu': 0.5}. Best is trial 386 with value: 0.4872991004520934.
[I 2024-12-04 15:14:38,835] Trial 1889 finished with value: 0.48830342320444886 and parameters: {'kernel_type': 'Matern', 'length_scale': 12.620411824339412, 'noise_level': 0.7960040214688141, 'constant_value': 0.0053189430615437515, 'nu': 0.5}. Best is trial 386 with value: 0.4872991004520934.
[I 2024-12-04 15:14:40,109] Trial 1898 finished with value: 0.5273055322929205 and parameters: {'kernel_type': 'Matern', 'length_scale': 29784.754618683783, 'noise_level': 0.40145056961909265, 'constant_value': 46339.8859574494, 'nu': 1.5}. Best is trial 386 with value: 0.4872991004520934.
[I 2024-12-04 15:14:40,279] Trial 1896 finished with value: 1.2401112324602137 and parameters: {'kernel_type': 'RBF', 'length_scale': 1.792042341507665e-05, 'noise_level': 1.1959366300200126e-10, 'constant_value': 1.5299345223296676e-05, 'nu': 0.5}. Best is trial 386 with value: 0.4872991004520934.
[I 2024-12-04 15:14:40,705] Trial 1895 finished with value: 0.4883034192504417 and parameters: {'kernel_type': 'Matern', 'length_scale': 3827.4673535491706, 'noise_level': 0.9240395317752629, 'constant_value': 12243.089729696476, 'nu': 0.5}. Best is trial 386 with value: 0.4872991004520934.
[I 2024-12-04 15:14:41,805] Trial 1890 finished with value: 1.2401112317006884 and parameters: {'kernel_type': 'Matern', 'length_scale': 1575.82653079452, 'noise_level': 0.013439313391128962, 'constant_value': 3.887175913231831, 'nu': 0.5}. Best is trial 386 with value: 0.4872991004520934.
[I 2024-12-04 15:14:41,830] Trial 1908 finished with value: 1.2401112331202606 and parameters: {'kernel_type': 'Matern', 'length_scale': 75175.31705220044, 'noise_level': 0.0007714820154761612, 'constant_value': 88.94276895077132, 'nu': 0.5}. Best is trial 386 with value: 0.4872991004520934.
[I 2024-12-04 15:14:43,941] Trial 1901 finished with value: 1.2614547953941473 and parameters: {'kernel_type': 'Matern', 'length_scale': 36.55271259508214, 'noise_level': 0.035220033544879334, 'constant_value': 68425.90985063826, 'nu': 0.5}. Best is trial 386 with value: 0.4872991004520934.
[I 2024-12-04 15:14:44,487] Trial 1913 finished with value: 0.4883034215725497 and parameters: {'kernel_type': 'Matern', 'length_scale': 0.5400136303394986, 'noise_level': 0.0011185714260298035, 'constant_value': 0.008513987717468046, 'nu': 0.5}. Best is trial 386 with value: 0.4872991004520934.
[I 2024-12-04 15:14:44,803] Trial 1906 finished with value: 1.2401112324644183 and parameters: {'kernel_type': 'Matern', 'length_scale': 74507.01895578907, 'noise_level': 0.017096519667558815, 'constant_value': 16.803005079764496, 'nu': 0.5}. Best is trial 386 with value: 0.4872991004520934.
[I 2024-12-04 15:14:44,821] Trial 1899 finished with value: 0.4883033823755078 and parameters: {'kernel_type': 'Matern', 'length_scale': 2120.5694143956293, 'noise_level': 0.05739438742810991, 'constant_value': 1487.745503465057, 'nu': 0.5}. Best is trial 386 with value: 0.4872991004520934.
[I 2024-12-04 15:14:45,055] Trial 1909 finished with value: 0.48830334518436225 and parameters: {'kernel_type': 'Matern', 'length_scale': 89526.91859104595, 'noise_level': 0.008509518926748451, 'constant_value': 1085.956640345556, 'nu': 0.5}. Best is trial 386 with value: 0.4872991004520934.
[I 2024-12-04 15:14:46,267] Trial 1914 finished with value: 1.2401112403126147 and parameters: {'kernel_type': 'Matern', 'length_scale': 0.026122664128846246, 'noise_level': 0.027449970733694165, 'constant_value': 0.24423858313335914, 'nu': 0.5}. Best is trial 386 with value: 0.4872991004520934.
[I 2024-12-04 15:14:46,618] Trial 1905 finished with value: 1.2401112299007857 and parameters: {'kernel_type': 'RBF', 'length_scale': 16.667634142178606, 'noise_level': 1.5078440991420434e-06, 'constant_value': 0.020092459956662104, 'nu': 0.5}. Best is trial 386 with value: 0.4872991004520934.
[I 2024-12-04 15:14:47,535] Trial 1902 finished with value: 0.4883034175413273 and parameters: {'kernel_type': 'Matern', 'length_scale': 1147.803067960911, 'noise_level': 0.9350491598137455, 'constant_value': 85953.05091142494, 'nu': 0.5}. Best is trial 386 with value: 0.4872991004520934.
[I 2024-12-04 15:14:50,128] Trial 1903 finished with value: 1.240111232603411 and parameters: {'kernel_type': 'RBF', 'length_scale': 2.392419981520102, 'noise_level': 3.254651128718126e-05, 'constant_value': 0.1696760737729074, 'nu': 1.5}. Best is trial 386 with value: 0.4872991004520934.
[I 2024-12-04 15:14:50,130] Trial 1915 finished with value: 0.48830342584379127 and parameters: {'kernel_type': 'Matern', 'length_scale': 6800.415409960091, 'noise_level': 0.013298108784153589, 'constant_value': 9896.102734913378, 'nu': 0.5}. Best is trial 386 with value: 0.4872991004520934.
[I 2024-12-04 15:14:51,047] Trial 1918 finished with value: 0.48830339830391795 and parameters: {'kernel_type': 'Matern', 'length_scale': 95052.80090771704, 'noise_level': 0.8848035590447052, 'constant_value': 280.7640097608861, 'nu': 0.5}. Best is trial 386 with value: 0.4872991004520934.
[I 2024-12-04 15:14:51,900] Trial 1910 finished with value: 0.4883034305239324 and parameters: {'kernel_type': 'Matern', 'length_scale': 2523.877800664243, 'noise_level': 0.8130007188680068, 'constant_value': 8222.215464162246, 'nu': 0.5}. Best is trial 386 with value: 0.4872991004520934.
[I 2024-12-04 15:14:51,948] Trial 1907 finished with value: 0.4883032764969112 and parameters: {'kernel_type': 'Matern', 'length_scale': 78099.97998956793, 'noise_level': 0.02796336077589576, 'constant_value': 89152.3765977363, 'nu': 0.5}. Best is trial 386 with value: 0.4872991004520934.
[I 2024-12-04 15:14:52,022] Trial 1916 finished with value: 0.4883034179887725 and parameters: {'kernel_type': 'Matern', 'length_scale': 51237.80655746787, 'noise_level': 0.05414319590388912, 'constant_value': 76522.37722978086, 'nu': 0.5}. Best is trial 386 with value: 0.4872991004520934.
[I 2024-12-04 15:14:52,327] Trial 1911 finished with value: 0.6443853452921077 and parameters: {'kernel_type': 'RBF', 'length_scale': 11.349153861223055, 'noise_level': 0.9898013112194957, 'constant_value': 90898.50197504282, 'nu': 0.5}. Best is trial 386 with value: 0.4872991004520934.
[I 2024-12-04 15:14:53,394] Trial 1912 finished with value: 0.48830343602511994 and parameters: {'kernel_type': 'Matern', 'length_scale': 36215.73115950746, 'noise_level': 0.000355630739206925, 'constant_value': 3.5859911187565737e-07, 'nu': 0.5}. Best is trial 386 with value: 0.4872991004520934.
[I 2024-12-04 15:14:53,717] Trial 1921 finished with value: 0.4883034043696698 and parameters: {'kernel_type': 'Matern', 'length_scale': 740.2331037917821, 'noise_level': 0.023399672491908687, 'constant_value': 43.25945462859819, 'nu': 0.5}. Best is trial 386 with value: 0.4872991004520934.
[I 2024-12-04 15:14:54,075] Trial 1919 finished with value: 0.48830312605662524 and parameters: {'kernel_type': 'Matern', 'length_scale': 609.6632278106732, 'noise_level': 0.0006593552983426229, 'constant_value': 68520.11174739317, 'nu': 0.5}. Best is trial 386 with value: 0.4872991004520934.
[I 2024-12-04 15:14:55,251] Trial 1904 finished with value: 0.6443855748078676 and parameters: {'kernel_type': 'RBF', 'length_scale': 2347.5091347215007, 'noise_level': 0.924630123742182, 'constant_value': 103.39446627374654, 'nu': 0.5}. Best is trial 386 with value: 0.4872991004520934.
[I 2024-12-04 15:14:55,821] Trial 1917 finished with value: 0.48830343050751923 and parameters: {'kernel_type': 'Matern', 'length_scale': 2376.7523709034967, 'noise_level': 0.0006415146517733355, 'constant_value': 1097.168958493521, 'nu': 0.5}. Best is trial 386 with value: 0.4872991004520934.
[I 2024-12-04 15:14:56,301] Trial 1922 finished with value: 0.4883039145175448 and parameters: {'kernel_type': 'Matern', 'length_scale': 4.718702212582569, 'noise_level': 0.03470377955915081, 'constant_value': 3.6121489803230467, 'nu': 0.5}. Best is trial 386 with value: 0.4872991004520934.
[I 2024-12-04 15:14:57,319] Trial 1927 finished with value: 0.48830342477373934 and parameters: {'kernel_type': 'Matern', 'length_scale': 92160.65808258126, 'noise_level': 0.7379605489033683, 'constant_value': 7645.34575576101, 'nu': 0.5}. Best is trial 386 with value: 0.4872991004520934.
[I 2024-12-04 15:14:57,913] Trial 1924 finished with value: 0.5663937044885612 and parameters: {'kernel_type': 'Matern', 'length_scale': 3256.1827891329413, 'noise_level': 0.04304860905014653, 'constant_value': 64731.007695791544, 'nu': 2.5}. Best is trial 386 with value: 0.4872991004520934.
[I 2024-12-04 15:14:58,069] Trial 1920 finished with value: 0.48830341963918833 and parameters: {'kernel_type': 'Matern', 'length_scale': 0.3400333696373993, 'noise_level': 0.1618550976085852, 'constant_value': 0.007004568347928937, 'nu': 0.5}. Best is trial 386 with value: 0.4872991004520934.
[I 2024-12-04 15:14:58,611] Trial 1923 finished with value: 0.4883033173857788 and parameters: {'kernel_type': 'Matern', 'length_scale': 1350.8014670532527, 'noise_level': 0.02114810086909364, 'constant_value': 0.0007777895195213417, 'nu': 0.5}. Best is trial 386 with value: 0.4872991004520934.
[I 2024-12-04 15:14:59,136] Trial 1931 finished with value: 0.4883034199722555 and parameters: {'kernel_type': 'Matern', 'length_scale': 6315.4834900857795, 'noise_level': 0.016660240276897324, 'constant_value': 40.945116846835795, 'nu': 0.5}. Best is trial 386 with value: 0.4872991004520934.
[I 2024-12-04 15:15:00,201] Trial 1928 finished with value: 0.4883034192861901 and parameters: {'kernel_type': 'Matern', 'length_scale': 4603.337990173282, 'noise_level': 0.8192706772304345, 'constant_value': 127.54755269709787, 'nu': 0.5}. Best is trial 386 with value: 0.4872991004520934.
[I 2024-12-04 15:15:00,506] Trial 1926 finished with value: 0.4883034188574889 and parameters: {'kernel_type': 'Matern', 'length_scale': 99074.13420028036, 'noise_level': 0.5777841646883375, 'constant_value': 17003.206257562728, 'nu': 0.5}. Best is trial 386 with value: 0.4872991004520934.
[I 2024-12-04 15:15:01,020] Trial 1930 finished with value: 0.4883034198791531 and parameters: {'kernel_type': 'Matern', 'length_scale': 6202.449041393914, 'noise_level': 0.010723004557993819, 'constant_value': 1174.3351163110622, 'nu': 0.5}. Best is trial 386 with value: 0.4872991004520934.
[I 2024-12-04 15:15:01,502] Trial 1937 finished with value: 0.488303409851277 and parameters: {'kernel_type': 'Matern', 'length_scale': 4996.691915109392, 'noise_level': 0.8046937535942634, 'constant_value': 1562.2885467621832, 'nu': 0.5}. Best is trial 386 with value: 0.4872991004520934.
[I 2024-12-04 15:15:03,835] Trial 1932 finished with value: 0.4883034207394976 and parameters: {'kernel_type': 'Matern', 'length_scale': 3960.679433495037, 'noise_level': 0.054761547648180614, 'constant_value': 729.4013925428873, 'nu': 0.5}. Best is trial 386 with value: 0.4872991004520934.
[I 2024-12-04 15:15:03,912] Trial 1936 finished with value: 0.4883034867339402 and parameters: {'kernel_type': 'Matern', 'length_scale': 1245.8929779953776, 'noise_level': 0.7866476307941697, 'constant_value': 0.13761589348281916, 'nu': 0.5}. Best is trial 386 with value: 0.4872991004520934.
[I 2024-12-04 15:15:04,598] Trial 1934 finished with value: 0.4883034623373614 and parameters: {'kernel_type': 'Matern', 'length_scale': 83175.47747798168, 'noise_level': 0.00327399292329273, 'constant_value': 86551.57770698711, 'nu': 0.5}. Best is trial 386 with value: 0.4872991004520934.
[I 2024-12-04 15:15:06,080] Trial 1940 finished with value: 0.48830345257543 and parameters: {'kernel_type': 'Matern', 'length_scale': 11465.171622253078, 'noise_level': 0.8360241417873115, 'constant_value': 60103.75952255633, 'nu': 0.5}. Best is trial 386 with value: 0.4872991004520934.
[I 2024-12-04 15:15:06,500] Trial 1944 finished with value: 0.4883034100624642 and parameters: {'kernel_type': 'Matern', 'length_scale': 1160.7083848031532, 'noise_level': 0.955865423153432, 'constant_value': 148.11346843628527, 'nu': 0.5}. Best is trial 386 with value: 0.4872991004520934.
[I 2024-12-04 15:15:06,504] Trial 1933 finished with value: 1.24011123252954 and parameters: {'kernel_type': 'Matern', 'length_scale': 275.72485716383227, 'noise_level': 0.00031320962914226547, 'constant_value': 0.20026199441394, 'nu': 0.5}. Best is trial 386 with value: 0.4872991004520934.
[I 2024-12-04 15:15:07,556] Trial 1939 finished with value: 0.488303445214976 and parameters: {'kernel_type': 'Matern', 'length_scale': 158.62233043099448, 'noise_level': 0.015906799900939125, 'constant_value': 82240.19063364792, 'nu': 0.5}. Best is trial 386 with value: 0.4872991004520934.
[I 2024-12-04 15:15:07,562] Trial 1929 finished with value: 1.2401112325811 and parameters: {'kernel_type': 'Matern', 'length_scale': 93587.09651811783, 'noise_level': 0.042645295509332326, 'constant_value': 59.12178549336276, 'nu': 0.5}. Best is trial 386 with value: 0.4872991004520934.
[I 2024-12-04 15:15:07,573] Trial 1935 finished with value: 0.48830341872975236 and parameters: {'kernel_type': 'Matern', 'length_scale': 896.1794051034165, 'noise_level': 0.003261625620133808, 'constant_value': 59780.53812163255, 'nu': 0.5}. Best is trial 386 with value: 0.4872991004520934.
[I 2024-12-04 15:15:07,578] Trial 1941 finished with value: 0.4883032069720606 and parameters: {'kernel_type': 'Matern', 'length_scale': 0.35586122762945505, 'noise_level': 0.0008818605562741427, 'constant_value': 30.914167814799896, 'nu': 0.5}. Best is trial 386 with value: 0.4872991004520934.
[I 2024-12-04 15:15:07,904] Trial 1948 finished with value: 1.2614526706875069 and parameters: {'kernel_type': 'Matern', 'length_scale': 1.4960788841348876e-05, 'noise_level': 0.01878242448511473, 'constant_value': 7.513175692376554e-07, 'nu': 0.5}. Best is trial 386 with value: 0.4872991004520934.
[I 2024-12-04 15:15:12,275] Trial 1925 finished with value: 0.48830337903336163 and parameters: {'kernel_type': 'Matern', 'length_scale': 119.24496757832146, 'noise_level': 0.89802489629088, 'constant_value': 0.5621612106141995, 'nu': 0.5}. Best is trial 386 with value: 0.4872991004520934.
[I 2024-12-04 15:15:12,284] Trial 1938 finished with value: 1.2614547953941477 and parameters: {'kernel_type': 'Matern', 'length_scale': 37.03148808554213, 'noise_level': 0.022529452089925274, 'constant_value': 539.341450572869, 'nu': 0.5}. Best is trial 386 with value: 0.4872991004520934.
[I 2024-12-04 15:15:12,289] Trial 1946 finished with value: 0.4883032465434028 and parameters: {'kernel_type': 'Matern', 'length_scale': 0.16281841215510967, 'noise_level': 0.5775800027971805, 'constant_value': 2214.2432009669874, 'nu': 0.5}. Best is trial 386 with value: 0.4872991004520934.
[I 2024-12-04 15:15:12,782] Trial 1942 finished with value: 0.4883034195440883 and parameters: {'kernel_type': 'Matern', 'length_scale': 71592.84927831171, 'noise_level': 0.01241836089986822, 'constant_value': 99500.52813524353, 'nu': 0.5}. Best is trial 386 with value: 0.4872991004520934.
[I 2024-12-04 15:15:14,287] Trial 1952 finished with value: 0.5663942921288235 and parameters: {'kernel_type': 'Matern', 'length_scale': 7.756868235795084, 'noise_level': 0.012199342085848922, 'constant_value': 3.140076773870348, 'nu': 2.5}. Best is trial 386 with value: 0.4872991004520934.
[I 2024-12-04 15:15:14,664] Trial 1951 finished with value: 0.4883031413537894 and parameters: {'kernel_type': 'Matern', 'length_scale': 93892.6578790994, 'noise_level': 0.03151430885363029, 'constant_value': 514.8236459152645, 'nu': 0.5}. Best is trial 386 with value: 0.4872991004520934.
[I 2024-12-04 15:15:15,069] Trial 1956 finished with value: 0.4883034190195556 and parameters: {'kernel_type': 'Matern', 'length_scale': 160.40542081403711, 'noise_level': 0.856318974436773, 'constant_value': 873.0825358165232, 'nu': 0.5}. Best is trial 386 with value: 0.4872991004520934.
[I 2024-12-04 15:15:15,402] Trial 1949 finished with value: 0.48830341477401656 and parameters: {'kernel_type': 'Matern', 'length_scale': 82102.61607404971, 'noise_level': 0.7772658184711688, 'constant_value': 717.9908334614164, 'nu': 0.5}. Best is trial 386 with value: 0.4872991004520934.
