[I 2024-12-04 00:36:42,841] Trial 2315 finished with value: 0.16161617222158345 and parameters: {'kernel': 'rbf', 'C': 83.88677108901025, 'gamma': 0.0152368204437174, 'epsilon': 0.0010571454882573159}. Best is trial 2284 with value: 0.13948515847988838.
[I 2024-12-04 00:36:43,531] Trial 2319 finished with value: 0.1788128068079118 and parameters: {'kernel': 'rbf', 'C': 22.844649420847883, 'gamma': 0.036086622584519105, 'epsilon': 0.0010696345866689234}. Best is trial 2284 with value: 0.13948515847988838.
[I 2024-12-04 00:36:45,558] Trial 2321 finished with value: 0.26190529891952746 and parameters: {'kernel': 'rbf', 'C': 21.544902979979863, 'gamma': 0.0027608610826671542, 'epsilon': 0.0010002525245635784}. Best is trial 2284 with value: 0.13948515847988838.
[I 2024-12-04 00:36:45,918] Trial 2322 finished with value: 0.2596691140091041 and parameters: {'kernel': 'rbf', 'C': 16.20222532464219, 'gamma': 0.0037556560177464376, 'epsilon': 0.001085457599323403}. Best is trial 2284 with value: 0.13948515847988838.
[I 2024-12-04 00:36:48,308] Trial 2320 finished with value: 0.19753544571383624 and parameters: {'kernel': 'rbf', 'C': 22.202450641248625, 'gamma': 0.05091411082230322, 'epsilon': 0.0010278785013646814}. Best is trial 2284 with value: 0.13948515847988838.
[I 2024-12-04 00:36:49,475] Trial 2323 finished with value: 0.14505124838783934 and parameters: {'kernel': 'rbf', 'C': 98.66508684589377, 'gamma': 0.006485346999128129, 'epsilon': 0.00453649671067816}. Best is trial 2284 with value: 0.13948515847988838.
[I 2024-12-04 00:36:50,509] Trial 2326 finished with value: 144.8494687742937 and parameters: {'kernel': 'sigmoid', 'C': 31.57956455091894, 'gamma': 0.003534195141570451, 'epsilon': 0.0010164778924465704}. Best is trial 2284 with value: 0.13948515847988838.
[I 2024-12-04 00:36:51,258] Trial 2325 finished with value: 0.15049601012956926 and parameters: {'kernel': 'rbf', 'C': 97.71981372406276, 'gamma': 0.0053822210795187045, 'epsilon': 0.0011603157280892773}. Best is trial 2284 with value: 0.13948515847988838.
[I 2024-12-04 00:36:53,357] Trial 2324 finished with value: 0.14062338640063782 and parameters: {'kernel': 'rbf', 'C': 98.44004892852053, 'gamma': 0.009394920684883117, 'epsilon': 0.0012239661129730948}. Best is trial 2284 with value: 0.13948515847988838.
[I 2024-12-04 00:36:54,700] Trial 2331 finished with value: 0.44135844075579916 and parameters: {'kernel': 'linear', 'C': 0.8245761635555121, 'gamma': 0.0006953394993573851, 'epsilon': 0.7903944491059285}. Best is trial 2284 with value: 0.13948515847988838.
[I 2024-12-04 00:36:54,702] Trial 2329 finished with value: 0.16818091363074641 and parameters: {'kernel': 'rbf', 'C': 16.44957939549403, 'gamma': 0.01460838158777511, 'epsilon': 0.0021055008804329}. Best is trial 2284 with value: 0.13948515847988838.
[I 2024-12-04 00:36:56,772] Trial 2328 finished with value: 0.14671329676525416 and parameters: {'kernel': 'rbf', 'C': 87.38192734352944, 'gamma': 0.0061914527420913554, 'epsilon': 0.0012535982535691918}. Best is trial 2284 with value: 0.13948515847988838.
[I 2024-12-04 00:36:58,525] Trial 2333 finished with value: 0.39760537419834424 and parameters: {'kernel': 'linear', 'C': 0.05419851746823276, 'gamma': 0.009728957298166467, 'epsilon': 0.17928943179178528}. Best is trial 2284 with value: 0.13948515847988838.
[I 2024-12-04 00:36:58,527] Trial 2334 finished with value: 0.6023096938707478 and parameters: {'kernel': 'linear', 'C': 0.0019404897201995392, 'gamma': 0.0009468460509689969, 'epsilon': 0.05396512506815841}. Best is trial 2284 with value: 0.13948515847988838.
[I 2024-12-04 00:36:59,537] Trial 2332 finished with value: 0.1864764549586846 and parameters: {'kernel': 'rbf', 'C': 98.49281903255769, 'gamma': 0.0029280016447679204, 'epsilon': 0.0013045666514851734}. Best is trial 2284 with value: 0.13948515847988838.
[I 2024-12-04 00:37:01,893] Trial 2330 finished with value: 0.1587658492760409 and parameters: {'kernel': 'rbf', 'C': 93.8753454236439, 'gamma': 0.013745368070056128, 'epsilon': 0.0030044897701451494}. Best is trial 2284 with value: 0.13948515847988838.
[I 2024-12-04 00:37:04,296] Trial 2336 finished with value: 0.20525285865998993 and parameters: {'kernel': 'rbf', 'C': 98.0016936609147, 'gamma': 0.0021979204817812468, 'epsilon': 0.001069919792840673}. Best is trial 2284 with value: 0.13948515847988838.
[I 2024-12-04 00:37:04,558] Trial 2338 finished with value: 0.22519602501028682 and parameters: {'kernel': 'rbf', 'C': 6.03347811382656, 'gamma': 0.015468648210857439, 'epsilon': 0.0010264467812799972}. Best is trial 2284 with value: 0.13948515847988838.
[I 2024-12-04 00:37:05,678] Trial 2335 finished with value: 0.13982103114307293 and parameters: {'kernel': 'rbf', 'C': 99.41592150069397, 'gamma': 0.007882540261498455, 'epsilon': 0.0010052848507904027}. Best is trial 2284 with value: 0.13948515847988838.
[I 2024-12-04 00:37:06,764] Trial 2057 finished with value: 0.3524567026973094 and parameters: {'kernel': 'linear', 'C': 45.02946989699847, 'gamma': 0.08983675255663474, 'epsilon': 0.0010099403592419346}. Best is trial 2284 with value: 0.13948515847988838.
[I 2024-12-04 00:37:07,794] Trial 2339 finished with value: 0.17464120042911555 and parameters: {'kernel': 'rbf', 'C': 95.05638501371958, 'gamma': 0.003461383995659502, 'epsilon': 0.002369896768903254}. Best is trial 2284 with value: 0.13948515847988838.
[I 2024-12-04 00:37:07,795] Trial 2337 finished with value: 0.14446386170020917 and parameters: {'kernel': 'rbf', 'C': 92.14237948509816, 'gamma': 0.011022933521091528, 'epsilon': 0.002160866360470416}. Best is trial 2284 with value: 0.13948515847988838.
[I 2024-12-04 00:37:08,266] Trial 2341 finished with value: 999.4231827787486 and parameters: {'kernel': 'sigmoid', 'C': 94.75773107682404, 'gamma': 0.007670043925937798, 'epsilon': 0.0012081821691225418}. Best is trial 2284 with value: 0.13948515847988838.
[I 2024-12-04 00:37:11,015] Trial 2340 finished with value: 0.20031645051200309 and parameters: {'kernel': 'rbf', 'C': 19.280911628410372, 'gamma': 0.05478773712705155, 'epsilon': 0.001034842022206307}. Best is trial 2284 with value: 0.13948515847988838.
[I 2024-12-04 00:37:14,618] Trial 2342 finished with value: 0.16369118073342048 and parameters: {'kernel': 'rbf', 'C': 84.49141587178262, 'gamma': 0.015951764768370142, 'epsilon': 0.0010399344111427164}. Best is trial 2284 with value: 0.13948515847988838.
[I 2024-12-04 00:37:14,709] Trial 2347 finished with value: 0.35440040276028084 and parameters: {'kernel': 'rbf', 'C': 19.585388576387093, 'gamma': 0.0008038185318667734, 'epsilon': 0.0012295430123048475}. Best is trial 2284 with value: 0.13948515847988838.
[I 2024-12-04 00:37:16,126] Trial 2344 finished with value: 0.14337608530095322 and parameters: {'kernel': 'rbf', 'C': 96.33132197154917, 'gamma': 0.0064346955845151375, 'epsilon': 0.0010990565556014459}. Best is trial 2284 with value: 0.13948515847988838.
[I 2024-12-04 00:37:18,541] Trial 2349 finished with value: 0.19372741868671148 and parameters: {'kernel': 'rbf', 'C': 16.127598167668776, 'gamma': 0.010294353323806228, 'epsilon': 0.0011707729185926}. Best is trial 2284 with value: 0.13948515847988838.
[I 2024-12-04 00:37:20,455] Trial 2343 finished with value: 0.19164010294157388 and parameters: {'kernel': 'rbf', 'C': 97.1184156460854, 'gamma': 0.03638300727218588, 'epsilon': 0.0010345676991931597}. Best is trial 2284 with value: 0.13948515847988838.
[I 2024-12-04 00:37:22,611] Trial 2348 finished with value: 0.14228374334036928 and parameters: {'kernel': 'rbf', 'C': 99.1886410950575, 'gamma': 0.006494808385508909, 'epsilon': 0.0010647417344064791}. Best is trial 2284 with value: 0.13948515847988838.
[I 2024-12-04 00:37:23,246] Trial 2351 finished with value: 0.1991894978578971 and parameters: {'kernel': 'rbf', 'C': 92.44723962629436, 'gamma': 0.002567471440391948, 'epsilon': 0.0011607449164160607}. Best is trial 2284 with value: 0.13948515847988838.
[I 2024-12-04 00:37:24,955] Trial 2352 finished with value: 0.5195809065886814 and parameters: {'kernel': 'rbf', 'C': 0.11768020694850624, 'gamma': 0.02327901500845225, 'epsilon': 0.012880015517939663}. Best is trial 2284 with value: 0.13948515847988838.
[I 2024-12-04 00:37:26,654] Trial 2350 finished with value: 0.16924121170854844 and parameters: {'kernel': 'rbf', 'C': 90.27233490824393, 'gamma': 0.0188138268717426, 'epsilon': 0.002397879572520996}. Best is trial 2284 with value: 0.13948515847988838.
[I 2024-12-04 00:37:26,690] Trial 2354 finished with value: 0.3226730392251604 and parameters: {'kernel': 'rbf', 'C': 18.21182947326912, 'gamma': 0.0012010586087802975, 'epsilon': 0.0019664979999130788}. Best is trial 2284 with value: 0.13948515847988838.
[I 2024-12-04 00:37:29,933] Trial 2356 finished with value: 0.2735240688460482 and parameters: {'kernel': 'rbf', 'C': 21.84010147488498, 'gamma': 0.0019857609199648526, 'epsilon': 0.001042734915721434}. Best is trial 2284 with value: 0.13948515847988838.
[I 2024-12-04 00:37:29,997] Trial 2357 finished with value: 0.25434747588826007 and parameters: {'kernel': 'rbf', 'C': 29.234740015680796, 'gamma': 0.0024183483932241558, 'epsilon': 0.0025463040057853675}. Best is trial 2284 with value: 0.13948515847988838.
[I 2024-12-04 00:37:31,988] Trial 2355 finished with value: 0.24401845083865495 and parameters: {'kernel': 'rbf', 'C': 98.54005683882748, 'gamma': 0.1083329107434755, 'epsilon': 0.0028281040587492404}. Best is trial 2284 with value: 0.13948515847988838.
[I 2024-12-04 00:37:33,552] Trial 2359 finished with value: 0.29058861932813185 and parameters: {'kernel': 'rbf', 'C': 4.9550560148190765, 'gamma': 0.0056055981400558695, 'epsilon': 0.0028405791857254816}. Best is trial 2284 with value: 0.13948515847988838.
[I 2024-12-04 00:37:33,572] Trial 2358 finished with value: 0.7748872365535284 and parameters: {'kernel': 'poly', 'C': 0.00331777699990454, 'gamma': 0.07326416435686113, 'epsilon': 0.0055873291158556925}. Best is trial 2284 with value: 0.13948515847988838.
[I 2024-12-04 00:37:34,775] Trial 2353 finished with value: 0.1785521837415708 and parameters: {'kernel': 'rbf', 'C': 91.17252824208545, 'gamma': 0.02583824934608331, 'epsilon': 0.0010873371411738383}. Best is trial 2284 with value: 0.13948515847988838.
[I 2024-12-04 00:37:36,407] Trial 2360 finished with value: 0.20353366242454662 and parameters: {'kernel': 'rbf', 'C': 95.73958054980132, 'gamma': 0.002287044327541017, 'epsilon': 0.0029310397595990554}. Best is trial 2284 with value: 0.13948515847988838.
[I 2024-12-04 00:37:38,198] Trial 2362 finished with value: 0.16368084854021442 and parameters: {'kernel': 'rbf', 'C': 20.232979315403917, 'gamma': 0.013197042385996501, 'epsilon': 0.0010186211264388357}. Best is trial 2284 with value: 0.13948515847988838.
[I 2024-12-04 00:37:43,044] Trial 2361 finished with value: 0.16551584247152834 and parameters: {'kernel': 'rbf', 'C': 95.26337649631444, 'gamma': 0.0157548677023463, 'epsilon': 0.003215671345381087}. Best is trial 2284 with value: 0.13948515847988838.
[I 2024-12-04 00:37:43,430] Trial 2306 finished with value: 0.35087870824816353 and parameters: {'kernel': 'linear', 'C': 12.525793145419671, 'gamma': 0.8872000938453698, 'epsilon': 0.004753662877976088}. Best is trial 2284 with value: 0.13948515847988838.
[I 2024-12-04 00:37:45,158] Trial 2363 finished with value: 0.15754509565827002 and parameters: {'kernel': 'rbf', 'C': 96.24637467746838, 'gamma': 0.013063456067919525, 'epsilon': 0.0010001961699968383}. Best is trial 2284 with value: 0.13948515847988838.
[I 2024-12-04 00:37:46,559] Trial 2364 finished with value: 0.16469809835706362 and parameters: {'kernel': 'rbf', 'C': 97.77620631502487, 'gamma': 0.014855821071373338, 'epsilon': 0.0010332867253503787}. Best is trial 2284 with value: 0.13948515847988838.
[I 2024-12-04 00:37:46,561] Trial 2367 finished with value: 0.9329508259341833 and parameters: {'kernel': 'rbf', 'C': 0.10062084114949907, 'gamma': 0.9645858487450141, 'epsilon': 0.34979217516924493}. Best is trial 2284 with value: 0.13948515847988838.
[I 2024-12-04 00:37:46,922] Trial 2366 finished with value: 0.218690030049728 and parameters: {'kernel': 'rbf', 'C': 21.94106568121525, 'gamma': 0.00607655479116276, 'epsilon': 0.0010428196538388615}. Best is trial 2284 with value: 0.13948515847988838.
[I 2024-12-04 00:37:49,341] Trial 2368 finished with value: 0.1504199620649624 and parameters: {'kernel': 'rbf', 'C': 22.22218594895382, 'gamma': 0.01584131216156646, 'epsilon': 0.007339082782520267}. Best is trial 2284 with value: 0.13948515847988838.
[I 2024-12-04 00:37:50,915] Trial 2365 finished with value: 0.1900668396306145 and parameters: {'kernel': 'rbf', 'C': 89.47049906782267, 'gamma': 0.036164240035001585, 'epsilon': 0.0010535802804766863}. Best is trial 2284 with value: 0.13948515847988838.
[I 2024-12-04 00:37:53,088] Trial 2372 finished with value: 0.9116940701147895 and parameters: {'kernel': 'rbf', 'C': 0.06710019293403453, 'gamma': 0.00043265235240231626, 'epsilon': 0.9713947860864494}. Best is trial 2284 with value: 0.13948515847988838.
[I 2024-12-04 00:37:54,653] Trial 2371 finished with value: 0.14132146824156316 and parameters: {'kernel': 'rbf', 'C': 90.16227689877991, 'gamma': 0.0072823859332892225, 'epsilon': 0.0027789645425721514}. Best is trial 2284 with value: 0.13948515847988838.
[I 2024-12-04 00:37:56,165] Trial 2244 finished with value: 0.3529954175967978 and parameters: {'kernel': 'linear', 'C': 31.704289343860165, 'gamma': 0.013744660691057719, 'epsilon': 0.0010368112502264152}. Best is trial 2284 with value: 0.13948515847988838.
[I 2024-12-04 00:37:56,751] Trial 2374 finished with value: 0.2533426231153393 and parameters: {'kernel': 'rbf', 'C': 22.876392446005667, 'gamma': 0.0031977384051328785, 'epsilon': 0.002612783260771392}. Best is trial 2284 with value: 0.13948515847988838.
[I 2024-12-04 00:37:57,277] Trial 2375 finished with value: 0.29926238791356913 and parameters: {'kernel': 'rbf', 'C': 31.873514958622202, 'gamma': 0.0009930682655041355, 'epsilon': 0.0010321156739082481}. Best is trial 2284 with value: 0.13948515847988838.
[I 2024-12-04 00:37:57,545] Trial 2373 finished with value: 0.1539985796992119 and parameters: {'kernel': 'rbf', 'C': 97.13867032049671, 'gamma': 0.004932321139904092, 'epsilon': 0.0010655158373812194}. Best is trial 2284 with value: 0.13948515847988838.
[I 2024-12-04 00:37:58,428] Trial 2376 finished with value: 0.20112001992279063 and parameters: {'kernel': 'rbf', 'C': 4.3552791664313295, 'gamma': 0.05914552614881931, 'epsilon': 0.0023688164856705256}. Best is trial 2284 with value: 0.13948515847988838.
[I 2024-12-04 00:38:00,316] Trial 2379 finished with value: 0.2672497032348341 and parameters: {'kernel': 'rbf', 'C': 25.501836588755207, 'gamma': 0.0019624974452860052, 'epsilon': 0.003319190224153918}. Best is trial 2284 with value: 0.13948515847988838.
[I 2024-12-04 00:38:01,521] Trial 2380 finished with value: 0.20092102545907642 and parameters: {'kernel': 'rbf', 'C': 15.377204523621424, 'gamma': 0.009934960779129628, 'epsilon': 0.00261541686227261}. Best is trial 2284 with value: 0.13948515847988838.
[I 2024-12-04 00:38:01,668] Trial 2378 finished with value: 0.15413873743913656 and parameters: {'kernel': 'rbf', 'C': 21.781572608613427, 'gamma': 0.025463379106556567, 'epsilon': 0.0010027034921427298}. Best is trial 2284 with value: 0.13948515847988838.
[I 2024-12-04 00:38:04,211] Trial 2377 finished with value: 0.18111685080602113 and parameters: {'kernel': 'rbf', 'C': 96.90675559625817, 'gamma': 0.02803229675278855, 'epsilon': 0.0045895345839394065}. Best is trial 2284 with value: 0.13948515847988838.
[I 2024-12-04 00:38:06,604] Trial 2384 finished with value: 0.28080730898830103 and parameters: {'kernel': 'rbf', 'C': 3.534702551290773, 'gamma': 0.009003530924734727, 'epsilon': 0.002249963589482143}. Best is trial 2284 with value: 0.13948515847988838.
[I 2024-12-04 00:38:07,565] Trial 2382 finished with value: 0.16032205412319853 and parameters: {'kernel': 'rbf', 'C': 99.20014508811958, 'gamma': 0.013952669549415733, 'epsilon': 0.0039246501330497865}. Best is trial 2284 with value: 0.13948515847988838.
[I 2024-12-04 00:38:07,689] Trial 2383 finished with value: 0.15705127625396584 and parameters: {'kernel': 'rbf', 'C': 91.78713657250873, 'gamma': 0.013420592292024811, 'epsilon': 0.002821434358004324}. Best is trial 2284 with value: 0.13948515847988838.
[I 2024-12-04 00:38:09,812] Trial 2386 finished with value: 168.75513916041595 and parameters: {'kernel': 'sigmoid', 'C': 7.0472571393531735, 'gamma': 0.060555305556966255, 'epsilon': 0.0012856847665157429}. Best is trial 2284 with value: 0.13948515847988838.
[I 2024-12-04 00:38:12,381] Trial 2388 finished with value: 0.23531098424300767 and parameters: {'kernel': 'rbf', 'C': 99.63621943672297, 'gamma': 0.0011822361692869245, 'epsilon': 0.0012224120964112006}. Best is trial 2284 with value: 0.13948515847988838.
[I 2024-12-04 00:38:13,112] Trial 2327 finished with value: 0.3518391206041145 and parameters: {'kernel': 'linear', 'C': 13.280152904314484, 'gamma': 0.004023417785113875, 'epsilon': 0.0027370164654272455}. Best is trial 2284 with value: 0.13948515847988838.
[I 2024-12-04 00:38:14,437] Trial 2389 finished with value: 573.2222454921022 and parameters: {'kernel': 'sigmoid', 'C': 33.60165353890285, 'gamma': 0.01615484729065728, 'epsilon': 0.0022452889974521827}. Best is trial 2284 with value: 0.13948515847988838.
[I 2024-12-04 00:38:16,031] Trial 2390 finished with value: 0.22820315370350797 and parameters: {'kernel': 'rbf', 'C': 17.42391612597685, 'gamma': 0.006449855072824174, 'epsilon': 0.0010754056355640204}. Best is trial 2284 with value: 0.13948515847988838.
[I 2024-12-04 00:38:17,317] Trial 2391 finished with value: 0.22507874476234865 and parameters: {'kernel': 'rbf', 'C': 23.3433089817688, 'gamma': 0.005283801653040261, 'epsilon': 0.0022235311460352043}. Best is trial 2284 with value: 0.13948515847988838.
[I 2024-12-04 00:38:19,665] Trial 2392 finished with value: 0.15677156559892907 and parameters: {'kernel': 'rbf', 'C': 25.758350299908688, 'gamma': 0.01211041047421735, 'epsilon': 0.0020341621183635468}. Best is trial 2284 with value: 0.13948515847988838.
[I 2024-12-04 00:38:20,475] Trial 2393 finished with value: 0.20258856742218911 and parameters: {'kernel': 'rbf', 'C': 17.465178789338847, 'gamma': 0.008833152075298114, 'epsilon': 0.0010601073651345713}. Best is trial 2284 with value: 0.13948515847988838.
[I 2024-12-04 00:38:21,885] Trial 2385 finished with value: 0.5219817255853147 and parameters: {'kernel': 'poly', 'C': 3.2665033589623858, 'gamma': 0.033628521262596044, 'epsilon': 0.0044210643590902165}. Best is trial 2284 with value: 0.13948515847988838.
[I 2024-12-04 00:38:22,050] Trial 2394 finished with value: 0.8244489175979445 and parameters: {'kernel': 'poly', 'C': 0.01641709452315232, 'gamma': 0.026790861495202167, 'epsilon': 0.029388000658624375}. Best is trial 2284 with value: 0.13948515847988838.
[I 2024-12-04 00:38:24,181] Trial 2395 finished with value: 0.25448454777364315 and parameters: {'kernel': 'rbf', 'C': 29.399573108437934, 'gamma': 0.0024036321725918186, 'epsilon': 0.0010155527350114077}. Best is trial 2284 with value: 0.13948515847988838.
[I 2024-12-04 00:38:25,416] Trial 2370 finished with value: 0.5325308173139118 and parameters: {'kernel': 'poly', 'C': 98.68541219290577, 'gamma': 0.013289737639012514, 'epsilon': 0.0026642363362814883}. Best is trial 2284 with value: 0.13948515847988838.
[I 2024-12-04 00:38:27,055] Trial 2397 finished with value: 0.1968194049536866 and parameters: {'kernel': 'rbf', 'C': 23.334300288912345, 'gamma': 0.050477359714695434, 'epsilon': 0.0036639943038185106}. Best is trial 2284 with value: 0.13948515847988838.
[I 2024-12-04 00:38:27,127] Trial 2398 finished with value: 0.22362001791464467 and parameters: {'kernel': 'rbf', 'C': 85.52794152836174, 'gamma': 0.0017615131668114235, 'epsilon': 0.0010342882611048814}. Best is trial 2284 with value: 0.13948515847988838.
[I 2024-12-04 00:38:28,031] Trial 2202 finished with value: 0.35342147820167824 and parameters: {'kernel': 'linear', 'C': 91.41385201099231, 'gamma': 0.007815927216470564, 'epsilon': 0.0065302465614213686}. Best is trial 2284 with value: 0.13948515847988838.
[I 2024-12-04 00:38:29,343] Trial 2122 finished with value: 0.3543998481905441 and parameters: {'kernel': 'linear', 'C': 82.63311680890135, 'gamma': 0.0012641335799657642, 'epsilon': 0.003985315516240104}. Best is trial 2284 with value: 0.13948515847988838.
[I 2024-12-04 00:38:29,391] Trial 2396 finished with value: 0.18129460717314405 and parameters: {'kernel': 'rbf', 'C': 98.86403896179272, 'gamma': 0.027674962863381815, 'epsilon': 0.0031403071607018465}. Best is trial 2284 with value: 0.13948515847988838.
[I 2024-12-04 00:38:29,659] Trial 2399 finished with value: 0.18319403524725583 and parameters: {'kernel': 'rbf', 'C': 28.417619379496035, 'gamma': 0.036908830342098915, 'epsilon': 0.0026138439125415374}. Best is trial 2284 with value: 0.13948515847988838.
[I 2024-12-04 00:38:30,228] Trial 2401 finished with value: 0.17046964812474283 and parameters: {'kernel': 'rbf', 'C': 22.194590108301007, 'gamma': 0.010834862418938773, 'epsilon': 0.002739965421317503}. Best is trial 2284 with value: 0.13948515847988838.
[I 2024-12-04 00:38:30,577] Trial 2402 finished with value: 0.228291397419982 and parameters: {'kernel': 'rbf', 'C': 18.840439415522972, 'gamma': 0.006034383843619777, 'epsilon': 0.0010435766186177693}. Best is trial 2284 with value: 0.13948515847988838.
[I 2024-12-04 00:38:31,412] Trial 2400 finished with value: 0.14454267900331663 and parameters: {'kernel': 'rbf', 'C': 87.95741839359108, 'gamma': 0.006617934588172213, 'epsilon': 0.0023223562423962635}. Best is trial 2284 with value: 0.13948515847988838.
