[I 2024-12-04 13:14:36,891] Trial 1607 finished with value: 0.6398458660314603 and parameters: {'n_estimators': 974, 'learning_rate': 0.016006111802878857, 'max_depth': 11, 'min_samples_split': 13, 'min_samples_leaf': 10, 'subsample': 0.7329006297886683, 'max_features': 'sqrt'}. Best is trial 1389 with value: 0.22332552856343169.
[I 2024-12-04 13:14:39,443] Trial 1596 finished with value: 0.2570111097685909 and parameters: {'n_estimators': 1476, 'learning_rate': 0.06811593756772574, 'max_depth': 11, 'min_samples_split': 4, 'min_samples_leaf': 1, 'subsample': 0.6004562131744162, 'max_features': 'log2'}. Best is trial 1389 with value: 0.22332552856343169.
[I 2024-12-04 13:14:39,595] Trial 1601 finished with value: 0.35440519979602825 and parameters: {'n_estimators': 1300, 'learning_rate': 0.06178388376763648, 'max_depth': 6, 'min_samples_split': 2, 'min_samples_leaf': 3, 'subsample': 0.7322519559962684, 'max_features': 'sqrt'}. Best is trial 1389 with value: 0.22332552856343169.
[I 2024-12-04 13:14:40,061] Trial 1598 finished with value: 0.29555555183322635 and parameters: {'n_estimators': 1486, 'learning_rate': 0.037310179053749955, 'max_depth': 11, 'min_samples_split': 7, 'min_samples_leaf': 2, 'subsample': 0.6006259614393475, 'max_features': 'sqrt'}. Best is trial 1389 with value: 0.22332552856343169.
[I 2024-12-04 13:14:43,123] Trial 1630 finished with value: 1.2666686347260476 and parameters: {'n_estimators': 105, 'learning_rate': 0.012390963335011856, 'max_depth': 10, 'min_samples_split': 5, 'min_samples_leaf': 9, 'subsample': 0.8088030374613427, 'max_features': 'log2'}. Best is trial 1389 with value: 0.22332552856343169.
[I 2024-12-04 13:14:49,885] Trial 1603 finished with value: 0.4005752733620255 and parameters: {'n_estimators': 1257, 'learning_rate': 0.013353633230946753, 'max_depth': 3, 'min_samples_split': 11, 'min_samples_leaf': 3, 'subsample': 0.8192040049577299, 'max_features': None}. Best is trial 1389 with value: 0.22332552856343169.
[I 2024-12-04 13:15:00,778] Trial 1616 finished with value: 0.24771512901087028 and parameters: {'n_estimators': 1035, 'learning_rate': 0.07952041873301084, 'max_depth': 7, 'min_samples_split': 7, 'min_samples_leaf': 1, 'subsample': 0.883287337474955, 'max_features': 'sqrt'}. Best is trial 1389 with value: 0.22332552856343169.
[I 2024-12-04 13:15:03,457] Trial 1608 finished with value: 0.2365330490973411 and parameters: {'n_estimators': 1366, 'learning_rate': 0.062864063567052, 'max_depth': 6, 'min_samples_split': 2, 'min_samples_leaf': 1, 'subsample': 0.803550234136132, 'max_features': 'sqrt'}. Best is trial 1389 with value: 0.22332552856343169.
[I 2024-12-04 13:15:09,043] Trial 1628 finished with value: 0.2845090675687102 and parameters: {'n_estimators': 677, 'learning_rate': 0.08848520712499648, 'max_depth': 8, 'min_samples_split': 4, 'min_samples_leaf': 1, 'subsample': 0.8259466870231151, 'max_features': 'log2'}. Best is trial 1389 with value: 0.22332552856343169.
[I 2024-12-04 13:15:12,023] Trial 1612 finished with value: 0.23817234243674723 and parameters: {'n_estimators': 1345, 'learning_rate': 0.08878316949578957, 'max_depth': 6, 'min_samples_split': 14, 'min_samples_leaf': 1, 'subsample': 0.8078464987683676, 'max_features': 'sqrt'}. Best is trial 1389 with value: 0.22332552856343169.
[I 2024-12-04 13:15:12,040] Trial 1617 finished with value: 0.2578419047178162 and parameters: {'n_estimators': 1144, 'learning_rate': 0.059882322434625844, 'max_depth': 6, 'min_samples_split': 5, 'min_samples_leaf': 1, 'subsample': 0.8516775952023727, 'max_features': 'sqrt'}. Best is trial 1389 with value: 0.22332552856343169.
[I 2024-12-04 13:15:12,056] Trial 1609 finished with value: 0.24616760424848194 and parameters: {'n_estimators': 1455, 'learning_rate': 0.07550931230483185, 'max_depth': 8, 'min_samples_split': 4, 'min_samples_leaf': 1, 'subsample': 0.8693684759142684, 'max_features': 'sqrt'}. Best is trial 1389 with value: 0.22332552856343169.
[I 2024-12-04 13:15:14,568] Trial 1614 finished with value: 0.3497499033672953 and parameters: {'n_estimators': 1237, 'learning_rate': 0.08126465455851288, 'max_depth': 8, 'min_samples_split': 2, 'min_samples_leaf': 3, 'subsample': 0.795443811492426, 'max_features': 'sqrt'}. Best is trial 1389 with value: 0.22332552856343169.
[I 2024-12-04 13:15:18,554] Trial 1618 finished with value: 0.2584696302821346 and parameters: {'n_estimators': 1188, 'learning_rate': 0.06520770732972382, 'max_depth': 5, 'min_samples_split': 2, 'min_samples_leaf': 1, 'subsample': 0.7536619278441475, 'max_features': 'sqrt'}. Best is trial 1389 with value: 0.22332552856343169.
[I 2024-12-04 13:15:18,566] Trial 1611 finished with value: 0.28711903854941273 and parameters: {'n_estimators': 1459, 'learning_rate': 0.0756431157500175, 'max_depth': 4, 'min_samples_split': 8, 'min_samples_leaf': 1, 'subsample': 0.674705846137359, 'max_features': 'sqrt'}. Best is trial 1389 with value: 0.22332552856343169.
[I 2024-12-04 13:15:22,322] Trial 1624 finished with value: 0.2394065579636753 and parameters: {'n_estimators': 923, 'learning_rate': 0.08170391219863272, 'max_depth': 10, 'min_samples_split': 3, 'min_samples_leaf': 1, 'subsample': 0.7554913369599701, 'max_features': 'sqrt'}. Best is trial 1389 with value: 0.22332552856343169.
[I 2024-12-04 13:15:27,704] Trial 1620 finished with value: 0.24783961070864416 and parameters: {'n_estimators': 1183, 'learning_rate': 0.06954270718856917, 'max_depth': 7, 'min_samples_split': 6, 'min_samples_leaf': 1, 'subsample': 0.7681104262695599, 'max_features': 'sqrt'}. Best is trial 1389 with value: 0.22332552856343169.
[I 2024-12-04 13:15:27,740] Trial 1619 finished with value: 0.3175840078100633 and parameters: {'n_estimators': 1055, 'learning_rate': 0.06845537734651858, 'max_depth': 11, 'min_samples_split': 20, 'min_samples_leaf': 2, 'subsample': 0.6100650167447671, 'max_features': None}. Best is trial 1389 with value: 0.22332552856343169.
[I 2024-12-04 13:15:30,401] Trial 1643 finished with value: 0.8904870434583095 and parameters: {'n_estimators': 353, 'learning_rate': 0.04796667085684268, 'max_depth': 9, 'min_samples_split': 7, 'min_samples_leaf': 8, 'subsample': 0.9856054003459513, 'max_features': 'log2'}. Best is trial 1389 with value: 0.22332552856343169.
[I 2024-12-04 13:15:33,626] Trial 1622 finished with value: 0.23427104238737131 and parameters: {'n_estimators': 1103, 'learning_rate': 0.07932786980089766, 'max_depth': 11, 'min_samples_split': 5, 'min_samples_leaf': 1, 'subsample': 0.6687768992189008, 'max_features': 'sqrt'}. Best is trial 1389 with value: 0.22332552856343169.
[I 2024-12-04 13:15:36,377] Trial 1627 finished with value: 0.48722277454744956 and parameters: {'n_estimators': 958, 'learning_rate': 0.06205081391988696, 'max_depth': 6, 'min_samples_split': 6, 'min_samples_leaf': 9, 'subsample': 0.6361080432003825, 'max_features': 'sqrt'}. Best is trial 1389 with value: 0.22332552856343169.
[I 2024-12-04 13:15:39,980] Trial 1613 finished with value: 0.3387047084568324 and parameters: {'n_estimators': 1470, 'learning_rate': 0.0772051321101147, 'max_depth': 8, 'min_samples_split': 4, 'min_samples_leaf': 1, 'subsample': 0.8566437213817322, 'max_features': None}. Best is trial 1389 with value: 0.22332552856343169.
[I 2024-12-04 13:15:44,971] Trial 1625 finished with value: 0.25815400515698855 and parameters: {'n_estimators': 1155, 'learning_rate': 0.06248879505777908, 'max_depth': 7, 'min_samples_split': 4, 'min_samples_leaf': 1, 'subsample': 0.9809545271229143, 'max_features': 'sqrt'}. Best is trial 1389 with value: 0.22332552856343169.
[I 2024-12-04 13:15:45,804] Trial 1621 finished with value: 0.22880528053725918 and parameters: {'n_estimators': 1476, 'learning_rate': 0.055643704856909386, 'max_depth': 10, 'min_samples_split': 2, 'min_samples_leaf': 1, 'subsample': 0.6799331949657663, 'max_features': 'sqrt'}. Best is trial 1389 with value: 0.22332552856343169.
[I 2024-12-04 13:15:47,984] Trial 1634 finished with value: 0.256343829055837 and parameters: {'n_estimators': 942, 'learning_rate': 0.08985796275905863, 'max_depth': 8, 'min_samples_split': 7, 'min_samples_leaf': 1, 'subsample': 0.6869014388632352, 'max_features': 'sqrt'}. Best is trial 1389 with value: 0.22332552856343169.
[I 2024-12-04 13:15:48,482] Trial 1637 finished with value: 1.0185908848365741 and parameters: {'n_estimators': 805, 'learning_rate': 0.015004616195020264, 'max_depth': 10, 'min_samples_split': 6, 'min_samples_leaf': 8, 'subsample': 0.9059861352728797, 'max_features': 'log2'}. Best is trial 1389 with value: 0.22332552856343169.
[I 2024-12-04 13:15:55,914] Trial 1623 finished with value: 0.35683513079628176 and parameters: {'n_estimators': 1445, 'learning_rate': 0.05716570642175756, 'max_depth': 8, 'min_samples_split': 8, 'min_samples_leaf': 3, 'subsample': 0.7171742329443257, 'max_features': 'sqrt'}. Best is trial 1389 with value: 0.22332552856343169.
[I 2024-12-04 13:15:58,351] Trial 1631 finished with value: 0.5119307491099656 and parameters: {'n_estimators': 1290, 'learning_rate': 0.03906342880296281, 'max_depth': 4, 'min_samples_split': 13, 'min_samples_leaf': 5, 'subsample': 0.9046968135912641, 'max_features': 'log2'}. Best is trial 1389 with value: 0.22332552856343169.
[I 2024-12-04 13:15:59,354] Trial 1638 finished with value: 0.2785260952421789 and parameters: {'n_estimators': 911, 'learning_rate': 0.09359078232996376, 'max_depth': 7, 'min_samples_split': 5, 'min_samples_leaf': 2, 'subsample': 0.8992652010096117, 'max_features': 'sqrt'}. Best is trial 1389 with value: 0.22332552856343169.
[I 2024-12-04 13:16:01,318] Trial 1626 finished with value: 0.2872275835489071 and parameters: {'n_estimators': 1399, 'learning_rate': 0.06420113222730402, 'max_depth': 10, 'min_samples_split': 6, 'min_samples_leaf': 2, 'subsample': 0.6937327987275385, 'max_features': 'sqrt'}. Best is trial 1389 with value: 0.22332552856343169.
[I 2024-12-04 13:16:04,388] Trial 1629 finished with value: 0.29252127131758177 and parameters: {'n_estimators': 1363, 'learning_rate': 0.07281897365270057, 'max_depth': 11, 'min_samples_split': 6, 'min_samples_leaf': 1, 'subsample': 0.7300012773536555, 'max_features': 'sqrt'}. Best is trial 1389 with value: 0.22332552856343169.
[I 2024-12-04 13:16:10,327] Trial 1633 finished with value: 0.24376147380045873 and parameters: {'n_estimators': 1314, 'learning_rate': 0.03878640257377992, 'max_depth': 12, 'min_samples_split': 4, 'min_samples_leaf': 1, 'subsample': 0.6116690219796806, 'max_features': 'sqrt'}. Best is trial 1389 with value: 0.22332552856343169.
[I 2024-12-04 13:16:15,608] Trial 1647 finished with value: 0.3918497465880309 and parameters: {'n_estimators': 758, 'learning_rate': 0.02623718496739204, 'max_depth': 4, 'min_samples_split': 14, 'min_samples_leaf': 1, 'subsample': 0.615019759362331, 'max_features': 'sqrt'}. Best is trial 1389 with value: 0.22332552856343169.
[I 2024-12-04 13:16:15,726] Trial 1635 finished with value: 0.24976776284294236 and parameters: {'n_estimators': 1253, 'learning_rate': 0.09165826289620034, 'max_depth': 5, 'min_samples_split': 6, 'min_samples_leaf': 1, 'subsample': 0.7664671799396765, 'max_features': 'sqrt'}. Best is trial 1389 with value: 0.22332552856343169.
[I 2024-12-04 13:16:17,181] Trial 1632 finished with value: 0.36451818447508644 and parameters: {'n_estimators': 1459, 'learning_rate': 0.09744391210342447, 'max_depth': 3, 'min_samples_split': 6, 'min_samples_leaf': 4, 'subsample': 0.7262445549790747, 'max_features': 'sqrt'}. Best is trial 1389 with value: 0.22332552856343169.
[I 2024-12-04 13:16:22,962] Trial 1641 finished with value: 0.2862299441088616 and parameters: {'n_estimators': 1198, 'learning_rate': 0.05450403549007207, 'max_depth': 6, 'min_samples_split': 2, 'min_samples_leaf': 2, 'subsample': 0.6967798873391116, 'max_features': 'sqrt'}. Best is trial 1389 with value: 0.22332552856343169.
[I 2024-12-04 13:16:23,768] Trial 1642 finished with value: 0.2519908940598774 and parameters: {'n_estimators': 1219, 'learning_rate': 0.097653461095247, 'max_depth': 6, 'min_samples_split': 5, 'min_samples_leaf': 1, 'subsample': 0.8773804513664483, 'max_features': 'sqrt'}. Best is trial 1389 with value: 0.22332552856343169.
[I 2024-12-04 13:16:25,211] Trial 1636 finished with value: 0.26219409174173935 and parameters: {'n_estimators': 1406, 'learning_rate': 0.07247875147881636, 'max_depth': 9, 'min_samples_split': 7, 'min_samples_leaf': 1, 'subsample': 0.820393685108691, 'max_features': 'sqrt'}. Best is trial 1389 with value: 0.22332552856343169.
[I 2024-12-04 13:16:28,671] Trial 1644 finished with value: 0.3564643810407478 and parameters: {'n_estimators': 1145, 'learning_rate': 0.08202229498593742, 'max_depth': 10, 'min_samples_split': 6, 'min_samples_leaf': 3, 'subsample': 0.6762044120376568, 'max_features': 'sqrt'}. Best is trial 1389 with value: 0.22332552856343169.
[I 2024-12-04 13:16:33,443] Trial 1639 finished with value: 0.35640662664759476 and parameters: {'n_estimators': 1385, 'learning_rate': 0.06106309143942017, 'max_depth': 9, 'min_samples_split': 2, 'min_samples_leaf': 3, 'subsample': 0.8745031021509411, 'max_features': 'sqrt'}. Best is trial 1389 with value: 0.22332552856343169.
[I 2024-12-04 13:16:33,583] Trial 1645 finished with value: 0.25802591065900343 and parameters: {'n_estimators': 1139, 'learning_rate': 0.06410817518131061, 'max_depth': 10, 'min_samples_split': 6, 'min_samples_leaf': 1, 'subsample': 0.9290682681805953, 'max_features': 'sqrt'}. Best is trial 1389 with value: 0.22332552856343169.
[I 2024-12-04 13:16:36,055] Trial 1640 finished with value: 0.3649498780308956 and parameters: {'n_estimators': 1494, 'learning_rate': 0.07798512924030279, 'max_depth': 5, 'min_samples_split': 2, 'min_samples_leaf': 4, 'subsample': 0.8496586175709986, 'max_features': 'sqrt'}. Best is trial 1389 with value: 0.22332552856343169.
[I 2024-12-04 13:16:47,642] Trial 1662 finished with value: 0.43559812850552526 and parameters: {'n_estimators': 654, 'learning_rate': 0.05892519717747192, 'max_depth': 11, 'min_samples_split': 10, 'min_samples_leaf': 5, 'subsample': 0.9443616674639954, 'max_features': None}. Best is trial 1389 with value: 0.22332552856343169.
[I 2024-12-04 13:16:49,855] Trial 1646 finished with value: 0.24627382965243955 and parameters: {'n_estimators': 1268, 'learning_rate': 0.09862872563062225, 'max_depth': 8, 'min_samples_split': 5, 'min_samples_leaf': 1, 'subsample': 0.7672010836894663, 'max_features': 'sqrt'}. Best is trial 1389 with value: 0.22332552856343169.
[I 2024-12-04 13:17:00,317] Trial 1657 finished with value: 0.23813940725577953 and parameters: {'n_estimators': 1079, 'learning_rate': 0.06737886181561717, 'max_depth': 8, 'min_samples_split': 7, 'min_samples_leaf': 1, 'subsample': 0.8319375958009453, 'max_features': 'sqrt'}. Best is trial 1389 with value: 0.22332552856343169.
[I 2024-12-04 13:17:04,473] Trial 1648 finished with value: 0.2768715275302208 and parameters: {'n_estimators': 1467, 'learning_rate': 0.08986015970045957, 'max_depth': 10, 'min_samples_split': 14, 'min_samples_leaf': 1, 'subsample': 0.7330744155138449, 'max_features': 'sqrt'}. Best is trial 1389 with value: 0.22332552856343169.
[I 2024-12-04 13:17:06,080] Trial 1649 finished with value: 0.4508859424428185 and parameters: {'n_estimators': 1475, 'learning_rate': 0.022517647757259018, 'max_depth': 8, 'min_samples_split': 2, 'min_samples_leaf': 4, 'subsample': 0.9816913110717685, 'max_features': 'log2'}. Best is trial 1389 with value: 0.22332552856343169.
[I 2024-12-04 13:17:10,236] Trial 1656 finished with value: 0.250950207030242 and parameters: {'n_estimators': 1230, 'learning_rate': 0.05850296064120834, 'max_depth': 7, 'min_samples_split': 2, 'min_samples_leaf': 1, 'subsample': 0.9143603538535982, 'max_features': 'sqrt'}. Best is trial 1389 with value: 0.22332552856343169.
[I 2024-12-04 13:17:10,247] Trial 1650 finished with value: 0.3627406114907201 and parameters: {'n_estimators': 1487, 'learning_rate': 0.06527331335889981, 'max_depth': 6, 'min_samples_split': 4, 'min_samples_leaf': 4, 'subsample': 0.9483939776422622, 'max_features': 'sqrt'}. Best is trial 1389 with value: 0.22332552856343169.
[I 2024-12-04 13:17:12,596] Trial 1651 finished with value: 0.35300399586070763 and parameters: {'n_estimators': 1456, 'learning_rate': 0.06649578368452315, 'max_depth': 8, 'min_samples_split': 5, 'min_samples_leaf': 3, 'subsample': 0.746622219492746, 'max_features': 'sqrt'}. Best is trial 1389 with value: 0.22332552856343169.
[I 2024-12-04 13:17:12,763] Trial 1652 finished with value: 0.2545739001205111 and parameters: {'n_estimators': 1420, 'learning_rate': 0.045732141233408435, 'max_depth': 6, 'min_samples_split': 7, 'min_samples_leaf': 1, 'subsample': 0.8098852962223956, 'max_features': 'sqrt'}. Best is trial 1389 with value: 0.22332552856343169.
[I 2024-12-04 13:17:15,974] Trial 1653 finished with value: 0.2564802153898603 and parameters: {'n_estimators': 1352, 'learning_rate': 0.07170315932508607, 'max_depth': 5, 'min_samples_split': 2, 'min_samples_leaf': 1, 'subsample': 0.746049956300442, 'max_features': 'sqrt'}. Best is trial 1389 with value: 0.22332552856343169.
[I 2024-12-04 13:17:16,079] Trial 1660 finished with value: 0.25466449290825116 and parameters: {'n_estimators': 1152, 'learning_rate': 0.0560190801239963, 'max_depth': 11, 'min_samples_split': 4, 'min_samples_leaf': 1, 'subsample': 0.6622339463692739, 'max_features': 'sqrt'}. Best is trial 1389 with value: 0.22332552856343169.
[I 2024-12-04 13:17:18,945] Trial 1655 finished with value: 0.2919047395782795 and parameters: {'n_estimators': 1362, 'learning_rate': 0.05872938979616184, 'max_depth': 5, 'min_samples_split': 2, 'min_samples_leaf': 1, 'subsample': 0.7329419293686145, 'max_features': 'sqrt'}. Best is trial 1389 with value: 0.22332552856343169.
[I 2024-12-04 13:17:19,297] Trial 1654 finished with value: 0.2516228275404961 and parameters: {'n_estimators': 1406, 'learning_rate': 0.06017409553195891, 'max_depth': 11, 'min_samples_split': 4, 'min_samples_leaf': 1, 'subsample': 0.6030722371849246, 'max_features': 'sqrt'}. Best is trial 1389 with value: 0.22332552856343169.
[I 2024-12-04 13:17:19,739] Trial 1658 finished with value: 0.34589815447351424 and parameters: {'n_estimators': 1290, 'learning_rate': 0.0876683690565082, 'max_depth': 6, 'min_samples_split': 3, 'min_samples_leaf': 3, 'subsample': 0.7811255078109446, 'max_features': 'sqrt'}. Best is trial 1389 with value: 0.22332552856343169.
[I 2024-12-04 13:17:23,457] Trial 1677 finished with value: 0.36630807779381785 and parameters: {'n_estimators': 495, 'learning_rate': 0.031727985209524266, 'max_depth': 6, 'min_samples_split': 19, 'min_samples_leaf': 1, 'subsample': 0.7536701616094245, 'max_features': 'sqrt'}. Best is trial 1389 with value: 0.22332552856343169.
[I 2024-12-04 13:17:26,882] Trial 1661 finished with value: 0.23794499372089384 and parameters: {'n_estimators': 1259, 'learning_rate': 0.0994521958542006, 'max_depth': 7, 'min_samples_split': 2, 'min_samples_leaf': 1, 'subsample': 0.7876207483349813, 'max_features': 'sqrt'}. Best is trial 1389 with value: 0.22332552856343169.
[I 2024-12-04 13:17:28,998] Trial 1659 finished with value: 0.24938294289823612 and parameters: {'n_estimators': 1352, 'learning_rate': 0.06737458386861109, 'max_depth': 8, 'min_samples_split': 4, 'min_samples_leaf': 1, 'subsample': 0.8456396416350304, 'max_features': 'sqrt'}. Best is trial 1389 with value: 0.22332552856343169.
[I 2024-12-04 13:17:34,802] Trial 1663 finished with value: 0.2966588083713284 and parameters: {'n_estimators': 1198, 'learning_rate': 0.05451428309288452, 'max_depth': 10, 'min_samples_split': 3, 'min_samples_leaf': 2, 'subsample': 0.7073833834973219, 'max_features': 'sqrt'}. Best is trial 1389 with value: 0.22332552856343169.
[I 2024-12-04 13:17:41,136] Trial 1670 finished with value: 0.28955069321111193 and parameters: {'n_estimators': 1167, 'learning_rate': 0.053280987901206577, 'max_depth': 12, 'min_samples_split': 2, 'min_samples_leaf': 2, 'subsample': 0.6706851214855403, 'max_features': 'sqrt'}. Best is trial 1389 with value: 0.22332552856343169.
[I 2024-12-04 13:17:41,687] Trial 1665 finished with value: 0.3535322014051241 and parameters: {'n_estimators': 1402, 'learning_rate': 0.04748842151076092, 'max_depth': 9, 'min_samples_split': 3, 'min_samples_leaf': 3, 'subsample': 0.6584231335031517, 'max_features': 'sqrt'}. Best is trial 1389 with value: 0.22332552856343169.
[I 2024-12-04 13:17:44,933] Trial 1664 finished with value: 0.2665697127027257 and parameters: {'n_estimators': 1437, 'learning_rate': 0.06253339490409714, 'max_depth': 7, 'min_samples_split': 6, 'min_samples_leaf': 1, 'subsample': 0.8465509021318528, 'max_features': 'sqrt'}. Best is trial 1389 with value: 0.22332552856343169.
[I 2024-12-04 13:17:50,346] Trial 1667 finished with value: 0.35332628394132554 and parameters: {'n_estimators': 1462, 'learning_rate': 0.051260227977005406, 'max_depth': 11, 'min_samples_split': 3, 'min_samples_leaf': 3, 'subsample': 0.7144063700682606, 'max_features': 'sqrt'}. Best is trial 1389 with value: 0.22332552856343169.
[I 2024-12-04 13:17:50,459] Trial 1666 finished with value: 0.24594370783419073 and parameters: {'n_estimators': 1498, 'learning_rate': 0.04147171201078664, 'max_depth': 7, 'min_samples_split': 4, 'min_samples_leaf': 1, 'subsample': 0.7541569331106772, 'max_features': 'sqrt'}. Best is trial 1389 with value: 0.22332552856343169.
[I 2024-12-04 13:17:54,562] Trial 1674 finished with value: 0.36331669183075627 and parameters: {'n_estimators': 1209, 'learning_rate': 0.06735363769451545, 'max_depth': 12, 'min_samples_split': 4, 'min_samples_leaf': 3, 'subsample': 0.6103478540870775, 'max_features': 'sqrt'}. Best is trial 1389 with value: 0.22332552856343169.
