[I 2024-12-03 19:24:14,404] Trial 2266 finished with value: 0.46781127374267434 and parameters: {'kernel': 'rbf', 'C': 96.71728522172923, 'gamma': 0.09983115349655892, 'epsilon': 0.354030637436921}. Best is trial 88 with value: 0.3542875001421725.
[I 2024-12-03 19:24:15,666] Trial 2267 finished with value: 0.6901996078452055 and parameters: {'kernel': 'rbf', 'C': 4.598440601704577, 'gamma': 0.0003689350487926052, 'epsilon': 0.006110306405867411}. Best is trial 88 with value: 0.3542875001421725.
[I 2024-12-03 19:24:17,152] Trial 2268 finished with value: 0.39099455184676246 and parameters: {'kernel': 'rbf', 'C': 93.89156546958205, 'gamma': 0.09142681289009617, 'epsilon': 0.08533809569701302}. Best is trial 88 with value: 0.3542875001421725.
[I 2024-12-03 19:24:18,317] Trial 2269 finished with value: 0.40582589833657284 and parameters: {'kernel': 'rbf', 'C': 27.931831402228593, 'gamma': 0.017683696777562315, 'epsilon': 0.3727024544416499}. Best is trial 88 with value: 0.3542875001421725.
[I 2024-12-03 19:24:19,924] Trial 2270 finished with value: 0.42895094284267 and parameters: {'kernel': 'rbf', 'C': 20.01750062846567, 'gamma': 0.0970362268662615, 'epsilon': 0.2136782564112315}. Best is trial 88 with value: 0.3542875001421725.
[I 2024-12-03 19:24:42,496] Trial 2199 finished with value: 0.7622827058611119 and parameters: {'kernel': 'linear', 'C': 98.26679893619468, 'gamma': 0.04285063971626239, 'epsilon': 0.15409285238777098}. Best is trial 88 with value: 0.3542875001421725.
[I 2024-12-03 19:24:43,814] Trial 2272 finished with value: 1.0273812554222583 and parameters: {'kernel': 'sigmoid', 'C': 0.0025031914780575806, 'gamma': 0.034844997789718196, 'epsilon': 0.3442663016072272}. Best is trial 88 with value: 0.3542875001421725.
[I 2024-12-03 19:24:45,222] Trial 2273 finished with value: 0.422462260371397 and parameters: {'kernel': 'rbf', 'C': 25.220821991196544, 'gamma': 0.0175800499925862, 'epsilon': 0.10571360004137746}. Best is trial 88 with value: 0.3542875001421725.
[I 2024-12-03 19:24:47,471] Trial 2274 finished with value: 0.36261613824769406 and parameters: {'kernel': 'rbf', 'C': 93.0349790738773, 'gamma': 0.037387905967804246, 'epsilon': 0.08052574751546093}. Best is trial 88 with value: 0.3542875001421725.
[I 2024-12-03 19:24:54,984] Trial 2275 finished with value: 0.7849771441065646 and parameters: {'kernel': 'linear', 'C': 8.100324672533393, 'gamma': 0.01978706656176531, 'epsilon': 0.11859047915415048}. Best is trial 88 with value: 0.3542875001421725.
[I 2024-12-03 19:24:56,418] Trial 2276 finished with value: 460.2413178364825 and parameters: {'kernel': 'sigmoid', 'C': 44.27595449723889, 'gamma': 0.00839557734572088, 'epsilon': 0.013151369463956371}. Best is trial 88 with value: 0.3542875001421725.
[I 2024-12-03 19:25:02,532] Trial 2277 finished with value: 3.0991967946972863 and parameters: {'kernel': 'poly', 'C': 15.410945542868374, 'gamma': 0.013287657997953171, 'epsilon': 0.23056745629881711}. Best is trial 88 with value: 0.3542875001421725.
[I 2024-12-03 19:25:03,993] Trial 2278 finished with value: 0.40027152903997576 and parameters: {'kernel': 'rbf', 'C': 20.87926334286388, 'gamma': 0.07468573735359343, 'epsilon': 0.08881892424713583}. Best is trial 88 with value: 0.3542875001421725.
[I 2024-12-03 19:25:04,842] Trial 2271 finished with value: 1.0353306180151287 and parameters: {'kernel': 'poly', 'C': 84.38471259607414, 'gamma': 0.03731661635806497, 'epsilon': 0.32067994969183117}. Best is trial 88 with value: 0.3542875001421725.
[I 2024-12-03 19:25:05,749] Trial 2279 finished with value: 0.40423411907857615 and parameters: {'kernel': 'rbf', 'C': 23.57311775471861, 'gamma': 0.03205251486018752, 'epsilon': 0.13292827143799493}. Best is trial 88 with value: 0.3542875001421725.
[I 2024-12-03 19:25:06,585] Trial 2280 finished with value: 0.4441998869587063 and parameters: {'kernel': 'rbf', 'C': 90.77605749772623, 'gamma': 0.005915350900845592, 'epsilon': 0.16060153809845637}. Best is trial 88 with value: 0.3542875001421725.
[I 2024-12-03 19:25:07,534] Trial 2281 finished with value: 0.38739782492391456 and parameters: {'kernel': 'rbf', 'C': 96.50233753059474, 'gamma': 0.016245537484064217, 'epsilon': 0.07278683893825276}. Best is trial 88 with value: 0.3542875001421725.
[I 2024-12-03 19:25:08,107] Trial 2282 finished with value: 0.4036486303208963 and parameters: {'kernel': 'rbf', 'C': 24.61284687664356, 'gamma': 0.0259967610876415, 'epsilon': 0.17489061129431113}. Best is trial 88 with value: 0.3542875001421725.
[I 2024-12-03 19:25:08,857] Trial 2283 finished with value: 0.8678935766382058 and parameters: {'kernel': 'linear', 'C': 0.0020038740649961817, 'gamma': 0.0012086877769195707, 'epsilon': 0.8317840010976758}. Best is trial 88 with value: 0.3542875001421725.
[I 2024-12-03 19:25:09,836] Trial 2284 finished with value: 0.38892328443235696 and parameters: {'kernel': 'rbf', 'C': 27.399035460785292, 'gamma': 0.03861758102236343, 'epsilon': 0.12620036100482232}. Best is trial 88 with value: 0.3542875001421725.
[I 2024-12-03 19:25:10,432] Trial 2285 finished with value: 0.6960901258001551 and parameters: {'kernel': 'rbf', 'C': 95.63338278252358, 'gamma': 0.4706194192661034, 'epsilon': 0.24595577123564236}. Best is trial 88 with value: 0.3542875001421725.
[I 2024-12-03 19:25:11,164] Trial 2286 finished with value: 0.40243622363877446 and parameters: {'kernel': 'rbf', 'C': 25.18419731765897, 'gamma': 0.05356676438699809, 'epsilon': 0.3328435168769356}. Best is trial 88 with value: 0.3542875001421725.
[I 2024-12-03 19:25:12,182] Trial 2287 finished with value: 262.08672109012434 and parameters: {'kernel': 'sigmoid', 'C': 19.76644145748968, 'gamma': 0.012487887690445818, 'epsilon': 0.13802518208015466}. Best is trial 88 with value: 0.3542875001421725.
[I 2024-12-03 19:25:13,305] Trial 2288 finished with value: 0.4672603236746008 and parameters: {'kernel': 'rbf', 'C': 6.798585831997837, 'gamma': 0.09300018786351061, 'epsilon': 0.061443891639554826}. Best is trial 88 with value: 0.3542875001421725.
[I 2024-12-03 19:25:14,837] Trial 2290 finished with value: 0.8882766345810595 and parameters: {'kernel': 'linear', 'C': 0.0024242330383411376, 'gamma': 0.057741776153505876, 'epsilon': 0.013087864474758628}. Best is trial 88 with value: 0.3542875001421725.
[I 2024-12-03 19:25:16,411] Trial 2291 finished with value: 0.36608532605798927 and parameters: {'kernel': 'rbf', 'C': 92.56260580784287, 'gamma': 0.024056547834391557, 'epsilon': 0.1025561680719988}. Best is trial 88 with value: 0.3542875001421725.
[I 2024-12-03 19:25:17,042] Trial 2198 finished with value: 1.0115061491375161 and parameters: {'kernel': 'poly', 'C': 1.7506833468212053, 'gamma': 0.07887935780975135, 'epsilon': 0.001018537452308977}. Best is trial 88 with value: 0.3542875001421725.
[I 2024-12-03 19:25:18,315] Trial 2292 finished with value: 0.36094311916703253 and parameters: {'kernel': 'rbf', 'C': 99.39504375014306, 'gamma': 0.03953062873794856, 'epsilon': 0.26434724517118613}. Best is trial 88 with value: 0.3542875001421725.
[I 2024-12-03 19:25:19,901] Trial 2293 finished with value: 0.8682033063355588 and parameters: {'kernel': 'linear', 'C': 0.017922635577056235, 'gamma': 0.01471490443510709, 'epsilon': 0.0016518741116972847}. Best is trial 88 with value: 0.3542875001421725.
[I 2024-12-03 19:25:21,166] Trial 2294 finished with value: 0.3995223409500767 and parameters: {'kernel': 'rbf', 'C': 23.08052369171735, 'gamma': 0.07564295548808175, 'epsilon': 0.0246313136723113}. Best is trial 88 with value: 0.3542875001421725.
[I 2024-12-03 19:25:21,351] Trial 2295 finished with value: 0.4372171919114744 and parameters: {'kernel': 'rbf', 'C': 6.667883113713557, 'gamma': 0.008899533547194628, 'epsilon': 0.1540822609633884}. Best is trial 88 with value: 0.3542875001421725.
[I 2024-12-03 19:25:23,048] Trial 2296 finished with value: 0.385510935847181 and parameters: {'kernel': 'rbf', 'C': 27.14005321123744, 'gamma': 0.044143179317595975, 'epsilon': 0.11780899423178193}. Best is trial 88 with value: 0.3542875001421725.
[I 2024-12-03 19:25:23,081] Trial 2297 finished with value: 0.39091366105391634 and parameters: {'kernel': 'rbf', 'C': 22.428215974370204, 'gamma': 0.04024616136724227, 'epsilon': 0.2608981623598073}. Best is trial 88 with value: 0.3542875001421725.
[I 2024-12-03 19:25:24,977] Trial 2298 finished with value: 0.6048002064736135 and parameters: {'kernel': 'rbf', 'C': 16.115401580396956, 'gamma': 0.32569905609821737, 'epsilon': 0.12793947364269917}. Best is trial 88 with value: 0.3542875001421725.
[I 2024-12-03 19:25:25,427] Trial 2299 finished with value: 0.429974968186639 and parameters: {'kernel': 'rbf', 'C': 92.94843856365608, 'gamma': 0.1254718054062032, 'epsilon': 0.12345143398226682}. Best is trial 88 with value: 0.3542875001421725.
[I 2024-12-03 19:25:27,209] Trial 2301 finished with value: 0.3627450353855646 and parameters: {'kernel': 'rbf', 'C': 95.11126603425633, 'gamma': 0.05576771908983647, 'epsilon': 0.17266431187038855}. Best is trial 88 with value: 0.3542875001421725.
[I 2024-12-03 19:25:27,246] Trial 2300 finished with value: 0.4130441471776945 and parameters: {'kernel': 'rbf', 'C': 30.803741245196917, 'gamma': 0.030013010727291383, 'epsilon': 0.02597727334575313}. Best is trial 88 with value: 0.3542875001421725.
[I 2024-12-03 19:25:27,247] Trial 2289 finished with value: 0.7918150463241528 and parameters: {'kernel': 'linear', 'C': 14.565061001111713, 'gamma': 0.07373501611859154, 'epsilon': 0.0809235095247149}. Best is trial 88 with value: 0.3542875001421725.
[I 2024-12-03 19:25:29,219] Trial 2302 finished with value: 0.41611390842083623 and parameters: {'kernel': 'rbf', 'C': 24.785095354054967, 'gamma': 0.005918462179485774, 'epsilon': 0.18733403403358403}. Best is trial 88 with value: 0.3542875001421725.
[I 2024-12-03 19:25:29,351] Trial 2303 finished with value: 0.4206172252915058 and parameters: {'kernel': 'rbf', 'C': 20.108409242724857, 'gamma': 0.021217607712387652, 'epsilon': 0.09315129926221663}. Best is trial 88 with value: 0.3542875001421725.
[I 2024-12-03 19:25:30,815] Trial 2304 finished with value: 0.4064709126445317 and parameters: {'kernel': 'rbf', 'C': 96.65980494023317, 'gamma': 0.01191812866372295, 'epsilon': 0.040823710835567226}. Best is trial 88 with value: 0.3542875001421725.
[I 2024-12-03 19:25:30,841] Trial 2305 finished with value: 0.4109969073759613 and parameters: {'kernel': 'rbf', 'C': 32.0546849587995, 'gamma': 0.08934845463691646, 'epsilon': 0.20644473684325626}. Best is trial 88 with value: 0.3542875001421725.
[I 2024-12-03 19:25:31,708] Trial 2306 finished with value: 0.4469395861308941 and parameters: {'kernel': 'rbf', 'C': 18.6510531452312, 'gamma': 0.014625590186944199, 'epsilon': 0.4201928250853868}. Best is trial 88 with value: 0.3542875001421725.
[I 2024-12-03 19:25:32,769] Trial 2307 finished with value: 0.3730165359679215 and parameters: {'kernel': 'rbf', 'C': 93.72374529893017, 'gamma': 0.0602823489889993, 'epsilon': 0.2151620677527117}. Best is trial 88 with value: 0.3542875001421725.
[I 2024-12-03 19:25:33,215] Trial 2308 finished with value: 0.46394621830702937 and parameters: {'kernel': 'rbf', 'C': 28.825782573127764, 'gamma': 0.16138920538555762, 'epsilon': 0.043718020511613255}. Best is trial 88 with value: 0.3542875001421725.
[I 2024-12-03 19:25:33,216] Trial 2246 finished with value: 0.7680244649456722 and parameters: {'kernel': 'linear', 'C': 95.33219314818383, 'gamma': 0.008526963523666206, 'epsilon': 0.14613182382129875}. Best is trial 88 with value: 0.3542875001421725.
[I 2024-12-03 19:25:33,770] Trial 2309 finished with value: 1165.2609469013264 and parameters: {'kernel': 'sigmoid', 'C': 73.60229729528453, 'gamma': 0.0164977454631467, 'epsilon': 0.11622256272609549}. Best is trial 88 with value: 0.3542875001421725.
[I 2024-12-03 19:25:35,609] Trial 2310 finished with value: 0.4475744794547694 and parameters: {'kernel': 'rbf', 'C': 83.7963851710934, 'gamma': 0.1485548484076833, 'epsilon': 0.057084271628697406}. Best is trial 88 with value: 0.3542875001421725.
[I 2024-12-03 19:25:35,681] Trial 2311 finished with value: 0.40063305897686113 and parameters: {'kernel': 'rbf', 'C': 97.10744435531053, 'gamma': 0.008614688437553494, 'epsilon': 0.23355977207511552}. Best is trial 88 with value: 0.3542875001421725.
[I 2024-12-03 19:25:36,309] Trial 2313 finished with value: 1.048883746522506 and parameters: {'kernel': 'rbf', 'C': 0.02872679753458335, 'gamma': 0.9266187473093699, 'epsilon': 0.09849896962216259}. Best is trial 88 with value: 0.3542875001421725.
[I 2024-12-03 19:25:38,017] Trial 2314 finished with value: 0.7949374014703615 and parameters: {'kernel': 'rbf', 'C': 0.30100128095164663, 'gamma': 0.0010371785088847249, 'epsilon': 0.28118630075830886}. Best is trial 88 with value: 0.3542875001421725.
[I 2024-12-03 19:25:38,654] Trial 2316 finished with value: 0.4030309698313794 and parameters: {'kernel': 'rbf', 'C': 96.02877270542423, 'gamma': 0.02660040242422314, 'epsilon': 0.5087360551886145}. Best is trial 88 with value: 0.3542875001421725.
[I 2024-12-03 19:25:38,870] Trial 2315 finished with value: 0.4134863051856563 and parameters: {'kernel': 'rbf', 'C': 21.83961650723575, 'gamma': 0.01420805639413451, 'epsilon': 0.03876811350565342}. Best is trial 88 with value: 0.3542875001421725.
[I 2024-12-03 19:25:39,690] Trial 2317 finished with value: 486.96876622937225 and parameters: {'kernel': 'sigmoid', 'C': 88.04986117974826, 'gamma': 0.0039897776850117694, 'epsilon': 0.40514151164737366}. Best is trial 88 with value: 0.3542875001421725.
[I 2024-12-03 19:25:41,528] Trial 2320 finished with value: 0.4971588686045879 and parameters: {'kernel': 'rbf', 'C': 25.497344211887867, 'gamma': 0.10120159597805141, 'epsilon': 0.4162871562367852}. Best is trial 88 with value: 0.3542875001421725.
[I 2024-12-03 19:25:41,561] Trial 2318 finished with value: 0.3660945752547181 and parameters: {'kernel': 'rbf', 'C': 97.38110620077349, 'gamma': 0.04887982875433839, 'epsilon': 0.04304084800705691}. Best is trial 88 with value: 0.3542875001421725.
[I 2024-12-03 19:25:43,282] Trial 2321 finished with value: 0.43062241722932215 and parameters: {'kernel': 'rbf', 'C': 21.09381336531508, 'gamma': 0.10281415458422084, 'epsilon': 0.1924829360092358}. Best is trial 88 with value: 0.3542875001421725.
[I 2024-12-03 19:25:44,780] Trial 2323 finished with value: 0.47275758268991575 and parameters: {'kernel': 'rbf', 'C': 4.301400052667941, 'gamma': 0.06153882783260955, 'epsilon': 0.08037890482144949}. Best is trial 88 with value: 0.3542875001421725.
[I 2024-12-03 19:25:45,684] Trial 2322 finished with value: 0.4101218838555195 and parameters: {'kernel': 'rbf', 'C': 65.63834890332699, 'gamma': 0.01871975520011441, 'epsilon': 0.005446354503361978}. Best is trial 88 with value: 0.3542875001421725.
[I 2024-12-03 19:25:46,899] Trial 2324 finished with value: 0.37002760267618734 and parameters: {'kernel': 'rbf', 'C': 99.30153724237164, 'gamma': 0.020252286825849366, 'epsilon': 0.05690036012184886}. Best is trial 88 with value: 0.3542875001421725.
[I 2024-12-03 19:25:47,440] Trial 2325 finished with value: 0.39290083903847606 and parameters: {'kernel': 'rbf', 'C': 21.823421787661392, 'gamma': 0.059587838502984505, 'epsilon': 0.07957302056631814}. Best is trial 88 with value: 0.3542875001421725.
[I 2024-12-03 19:25:47,726] Trial 2319 finished with value: 0.7428541534154408 and parameters: {'kernel': 'linear', 'C': 30.913419231415084, 'gamma': 0.07579861037518931, 'epsilon': 0.487443413564825}. Best is trial 88 with value: 0.3542875001421725.
[I 2024-12-03 19:25:48,208] Trial 2326 finished with value: 0.6129819933553248 and parameters: {'kernel': 'rbf', 'C': 93.22195586165448, 'gamma': 0.3265590489937011, 'epsilon': 0.16786856418570714}. Best is trial 88 with value: 0.3542875001421725.
[I 2024-12-03 19:25:49,074] Trial 2327 finished with value: 0.3714225236646249 and parameters: {'kernel': 'rbf', 'C': 98.016483263834, 'gamma': 0.02435896077104431, 'epsilon': 0.19015332868920176}. Best is trial 88 with value: 0.3542875001421725.
[I 2024-12-03 19:25:50,315] Trial 2328 finished with value: 0.3571116720957648 and parameters: {'kernel': 'rbf', 'C': 96.98209319993722, 'gamma': 0.04037839991235115, 'epsilon': 0.22588726352898222}. Best is trial 88 with value: 0.3542875001421725.
[I 2024-12-03 19:25:50,500] Trial 2329 finished with value: 0.3644423941105354 and parameters: {'kernel': 'rbf', 'C': 91.31604417724728, 'gamma': 0.059619327799947025, 'epsilon': 0.14658854291928164}. Best is trial 88 with value: 0.3542875001421725.
[I 2024-12-03 19:25:52,304] Trial 2332 finished with value: 0.47569279520634433 and parameters: {'kernel': 'rbf', 'C': 4.7047660922880645, 'gamma': 0.04143263921563516, 'epsilon': 0.4237882595641938}. Best is trial 88 with value: 0.3542875001421725.
[I 2024-12-03 19:25:52,335] Trial 2331 finished with value: 0.37433448413331144 and parameters: {'kernel': 'rbf', 'C': 97.27952698418133, 'gamma': 0.05732185621891518, 'epsilon': 0.06064897273045446}. Best is trial 88 with value: 0.3542875001421725.
[I 2024-12-03 19:25:54,108] Trial 2333 finished with value: 0.5296046965287771 and parameters: {'kernel': 'rbf', 'C': 21.534173882485767, 'gamma': 0.20266743143426524, 'epsilon': 0.17615801804216777}. Best is trial 88 with value: 0.3542875001421725.
[I 2024-12-03 19:25:54,258] Trial 2334 finished with value: 0.7864296208783074 and parameters: {'kernel': 'rbf', 'C': 0.04032607079437022, 'gamma': 0.012940616721014545, 'epsilon': 0.2378356451245084}. Best is trial 88 with value: 0.3542875001421725.
[I 2024-12-03 19:25:55,712] Trial 2335 finished with value: 0.4193633298322663 and parameters: {'kernel': 'rbf', 'C': 25.211586237958716, 'gamma': 0.017977529366646077, 'epsilon': 0.10236813151975106}. Best is trial 88 with value: 0.3542875001421725.
[I 2024-12-03 19:25:56,296] Trial 2336 finished with value: 0.3946349119756624 and parameters: {'kernel': 'rbf', 'C': 20.03935387770308, 'gamma': 0.007541964299456698, 'epsilon': 0.06760690736516853}. Best is trial 88 with value: 0.3542875001421725.
[I 2024-12-03 19:25:57,333] Trial 2337 finished with value: 0.4382864686832485 and parameters: {'kernel': 'rbf', 'C': 98.45266210285506, 'gamma': 0.14321945191207006, 'epsilon': 0.03090900674864532}. Best is trial 88 with value: 0.3542875001421725.
[I 2024-12-03 19:25:58,511] Trial 2338 finished with value: 0.38213868070180745 and parameters: {'kernel': 'rbf', 'C': 95.00315204253754, 'gamma': 0.016823356831549646, 'epsilon': 0.13059610266549732}. Best is trial 88 with value: 0.3542875001421725.
[I 2024-12-03 19:25:59,393] Trial 2339 finished with value: 0.38822211472635215 and parameters: {'kernel': 'rbf', 'C': 28.39613639814842, 'gamma': 0.06847659985510059, 'epsilon': 0.04829729972189592}. Best is trial 88 with value: 0.3542875001421725.
[I 2024-12-03 19:26:00,201] Trial 2340 finished with value: 0.3868421489964221 and parameters: {'kernel': 'rbf', 'C': 92.5828738208783, 'gamma': 0.08670977756949473, 'epsilon': 0.12264914589984342}. Best is trial 88 with value: 0.3542875001421725.
[I 2024-12-03 19:26:00,782] Trial 2341 finished with value: 0.40245823231966005 and parameters: {'kernel': 'rbf', 'C': 23.7042600441231, 'gamma': 0.018820161896040646, 'epsilon': 0.2566192469542516}. Best is trial 88 with value: 0.3542875001421725.
[I 2024-12-03 19:26:02,224] Trial 2343 finished with value: 0.42598875326037006 and parameters: {'kernel': 'rbf', 'C': 20.993952744368197, 'gamma': 0.018941178071630826, 'epsilon': 0.1169867226800201}. Best is trial 88 with value: 0.3542875001421725.
[I 2024-12-03 19:26:03,720] Trial 2344 finished with value: 0.3933743862203134 and parameters: {'kernel': 'rbf', 'C': 27.1583511621918, 'gamma': 0.04064436268261418, 'epsilon': 0.0773633046618884}. Best is trial 88 with value: 0.3542875001421725.
[I 2024-12-03 19:26:04,999] Trial 2345 finished with value: 0.47584259950415464 and parameters: {'kernel': 'rbf', 'C': 3.889367244712505, 'gamma': 0.06670573757640343, 'epsilon': 0.12844963850537988}. Best is trial 88 with value: 0.3542875001421725.
[I 2024-12-03 19:26:06,456] Trial 2346 finished with value: 0.3728460947804462 and parameters: {'kernel': 'rbf', 'C': 88.92702532531894, 'gamma': 0.020656525811446672, 'epsilon': 0.12818108812996773}. Best is trial 88 with value: 0.3542875001421725.
[I 2024-12-03 19:26:08,128] Trial 2347 finished with value: 0.4017850759139173 and parameters: {'kernel': 'rbf', 'C': 23.76381238280838, 'gamma': 0.004292072008585048, 'epsilon': 0.047010787844867785}. Best is trial 88 with value: 0.3542875001421725.
[I 2024-12-03 19:26:09,455] Trial 2348 finished with value: 0.8515308439522496 and parameters: {'kernel': 'linear', 'C': 0.0420825539709234, 'gamma': 0.00030391340132445474, 'epsilon': 0.04483905717989388}. Best is trial 88 with value: 0.3542875001421725.
[I 2024-12-03 19:26:10,539] Trial 2349 finished with value: 0.764856751217116 and parameters: {'kernel': 'rbf', 'C': 16.428992284582275, 'gamma': 0.00011436465055710381, 'epsilon': 0.7179823866660684}. Best is trial 88 with value: 0.3542875001421725.
[I 2024-12-03 19:26:12,161] Trial 2350 finished with value: 0.3545514964323786 and parameters: {'kernel': 'rbf', 'C': 91.19586207640819, 'gamma': 0.04840922227214101, 'epsilon': 0.11161877428998229}. Best is trial 88 with value: 0.3542875001421725.
[I 2024-12-03 19:26:13,664] Trial 2351 finished with value: 0.36714489758153174 and parameters: {'kernel': 'rbf', 'C': 99.91428482281381, 'gamma': 0.05423113342521913, 'epsilon': 0.08808723437380693}. Best is trial 88 with value: 0.3542875001421725.
[I 2024-12-03 19:26:15,357] Trial 2352 finished with value: 0.3627292436138449 and parameters: {'kernel': 'rbf', 'C': 95.6541685747849, 'gamma': 0.04070735910514673, 'epsilon': 0.061291652102575936}. Best is trial 88 with value: 0.3542875001421725.
