[I 2024-12-04 14:51:35,076] Trial 404 finished with value: 0.4877877750146776 and parameters: {'n_estimators': 806, 'learning_rate': 0.052064239608385, 'max_depth': 10, 'min_samples_split': 20, 'min_samples_leaf': 1, 'subsample': 0.9883681486899892, 'max_features': None}. Best is trial 343 with value: 0.46471393404590294.
[I 2024-12-04 14:51:36,351] Trial 403 finished with value: 0.6417481522537968 and parameters: {'n_estimators': 822, 'learning_rate': 0.08283891785851437, 'max_depth': 11, 'min_samples_split': 20, 'min_samples_leaf': 3, 'subsample': 0.9523722874279258, 'max_features': None}. Best is trial 343 with value: 0.46471393404590294.
[I 2024-12-04 14:51:36,424] Trial 401 finished with value: 0.4936290029379173 and parameters: {'n_estimators': 886, 'learning_rate': 0.04179464413166504, 'max_depth': 10, 'min_samples_split': 20, 'min_samples_leaf': 1, 'subsample': 0.9058772656088373, 'max_features': None}. Best is trial 343 with value: 0.46471393404590294.
[I 2024-12-04 14:51:36,717] Trial 410 finished with value: 0.6477650560526687 and parameters: {'n_estimators': 864, 'learning_rate': 0.02681714408238349, 'max_depth': 12, 'min_samples_split': 9, 'min_samples_leaf': 2, 'subsample': 0.6666094880418976, 'max_features': 'log2'}. Best is trial 343 with value: 0.46471393404590294.
[I 2024-12-04 14:51:37,246] Trial 391 finished with value: 0.4859792723550311 and parameters: {'n_estimators': 1236, 'learning_rate': 0.031407029366102575, 'max_depth': 12, 'min_samples_split': 20, 'min_samples_leaf': 1, 'subsample': 0.9573767170951156, 'max_features': None}. Best is trial 343 with value: 0.46471393404590294.
[I 2024-12-04 14:51:41,172] Trial 431 finished with value: 0.7149861902519077 and parameters: {'n_estimators': 238, 'learning_rate': 0.05289729194614853, 'max_depth': 12, 'min_samples_split': 15, 'min_samples_leaf': 7, 'subsample': 0.9636283221480935, 'max_features': 'sqrt'}. Best is trial 343 with value: 0.46471393404590294.
[I 2024-12-04 14:51:42,359] Trial 418 finished with value: 0.4866040071059465 and parameters: {'n_estimators': 581, 'learning_rate': 0.04715206873403878, 'max_depth': 11, 'min_samples_split': 20, 'min_samples_leaf': 1, 'subsample': 0.9806109094697733, 'max_features': None}. Best is trial 343 with value: 0.46471393404590294.
[I 2024-12-04 14:51:43,594] Trial 435 finished with value: 0.5689809712573096 and parameters: {'n_estimators': 134, 'learning_rate': 0.03924929237347915, 'max_depth': 11, 'min_samples_split': 16, 'min_samples_leaf': 3, 'subsample': 0.937558831778692, 'max_features': None}. Best is trial 343 with value: 0.46471393404590294.
[I 2024-12-04 14:51:44,102] Trial 413 finished with value: 0.6633039067347511 and parameters: {'n_estimators': 1073, 'learning_rate': 0.035103193911028265, 'max_depth': 9, 'min_samples_split': 14, 'min_samples_leaf': 2, 'subsample': 0.9073116871393894, 'max_features': 'log2'}. Best is trial 343 with value: 0.46471393404590294.
[I 2024-12-04 14:51:45,077] Trial 398 finished with value: 0.649627452441953 and parameters: {'n_estimators': 1346, 'learning_rate': 0.038373662397767606, 'max_depth': 12, 'min_samples_split': 13, 'min_samples_leaf': 2, 'subsample': 0.7444805051707384, 'max_features': None}. Best is trial 343 with value: 0.46471393404590294.
[I 2024-12-04 14:51:46,889] Trial 415 finished with value: 0.720855972480956 and parameters: {'n_estimators': 1043, 'learning_rate': 0.05881407153362286, 'max_depth': 12, 'min_samples_split': 18, 'min_samples_leaf': 7, 'subsample': 0.7610946036244959, 'max_features': 'log2'}. Best is trial 343 with value: 0.46471393404590294.
[I 2024-12-04 14:51:47,960] Trial 417 finished with value: 0.47689799561006163 and parameters: {'n_estimators': 754, 'learning_rate': 0.05108173447848756, 'max_depth': 12, 'min_samples_split': 18, 'min_samples_leaf': 1, 'subsample': 0.9678287571437812, 'max_features': None}. Best is trial 343 with value: 0.46471393404590294.
[I 2024-12-04 14:51:48,092] Trial 409 finished with value: 0.4890456052360525 and parameters: {'n_estimators': 1098, 'learning_rate': 0.03138670866750738, 'max_depth': 11, 'min_samples_split': 20, 'min_samples_leaf': 1, 'subsample': 0.7418696550314954, 'max_features': None}. Best is trial 343 with value: 0.46471393404590294.
[I 2024-12-04 14:51:48,577] Trial 399 finished with value: 0.6133263119342504 and parameters: {'n_estimators': 1411, 'learning_rate': 0.04104898462498214, 'max_depth': 10, 'min_samples_split': 18, 'min_samples_leaf': 4, 'subsample': 0.7968120630869351, 'max_features': None}. Best is trial 343 with value: 0.46471393404590294.
[I 2024-12-04 14:51:48,697] Trial 419 finished with value: 0.4620957934013452 and parameters: {'n_estimators': 715, 'learning_rate': 0.08048570616017961, 'max_depth': 12, 'min_samples_split': 19, 'min_samples_leaf': 1, 'subsample': 0.9950754357428702, 'max_features': None}. Best is trial 419 with value: 0.4620957934013452.
[I 2024-12-04 14:51:48,699] Trial 407 finished with value: 0.795332204157091 and parameters: {'n_estimators': 1385, 'learning_rate': 0.06487819193388117, 'max_depth': 11, 'min_samples_split': 14, 'min_samples_leaf': 8, 'subsample': 0.6447859895809547, 'max_features': 'sqrt'}. Best is trial 419 with value: 0.4620957934013452.
[I 2024-12-04 14:51:50,442] Trial 422 finished with value: 0.5128902675544978 and parameters: {'n_estimators': 722, 'learning_rate': 0.08711576449516499, 'max_depth': 10, 'min_samples_split': 20, 'min_samples_leaf': 1, 'subsample': 0.9507224101701091, 'max_features': None}. Best is trial 419 with value: 0.4620957934013452.
[I 2024-12-04 14:51:51,635] Trial 420 finished with value: 0.5358407649729843 and parameters: {'n_estimators': 939, 'learning_rate': 0.08097688288201732, 'max_depth': 9, 'min_samples_split': 18, 'min_samples_leaf': 1, 'subsample': 0.9914673627057234, 'max_features': 'sqrt'}. Best is trial 419 with value: 0.4620957934013452.
[I 2024-12-04 14:51:52,760] Trial 428 finished with value: 0.5032016900996465 and parameters: {'n_estimators': 610, 'learning_rate': 0.05357952103569871, 'max_depth': 11, 'min_samples_split': 17, 'min_samples_leaf': 1, 'subsample': 0.9823198244864071, 'max_features': None}. Best is trial 419 with value: 0.4620957934013452.
[I 2024-12-04 14:51:56,721] Trial 405 finished with value: 0.6350063371589586 and parameters: {'n_estimators': 1461, 'learning_rate': 0.029344069947719174, 'max_depth': 12, 'min_samples_split': 20, 'min_samples_leaf': 3, 'subsample': 0.893588363216929, 'max_features': None}. Best is trial 419 with value: 0.4620957934013452.
[I 2024-12-04 14:51:58,846] Trial 416 finished with value: 0.4793562017323099 and parameters: {'n_estimators': 1140, 'learning_rate': 0.02996347572221935, 'max_depth': 12, 'min_samples_split': 19, 'min_samples_leaf': 1, 'subsample': 0.8701657954516353, 'max_features': None}. Best is trial 419 with value: 0.4620957934013452.
[I 2024-12-04 14:51:59,103] Trial 411 finished with value: 0.4999114962750393 and parameters: {'n_estimators': 1404, 'learning_rate': 0.02980661648442321, 'max_depth': 11, 'min_samples_split': 19, 'min_samples_leaf': 1, 'subsample': 0.8236781070423829, 'max_features': None}. Best is trial 419 with value: 0.4620957934013452.
[I 2024-12-04 14:51:59,554] Trial 432 finished with value: 0.5531086600799424 and parameters: {'n_estimators': 867, 'learning_rate': 0.04697143341641976, 'max_depth': 12, 'min_samples_split': 20, 'min_samples_leaf': 1, 'subsample': 0.9684919157378749, 'max_features': 'sqrt'}. Best is trial 419 with value: 0.4620957934013452.
[I 2024-12-04 14:52:02,328] Trial 424 finished with value: 0.4789899498251668 and parameters: {'n_estimators': 1004, 'learning_rate': 0.05550944395309825, 'max_depth': 10, 'min_samples_split': 19, 'min_samples_leaf': 1, 'subsample': 0.9342549042523447, 'max_features': None}. Best is trial 419 with value: 0.4620957934013452.
[I 2024-12-04 14:52:03,125] Trial 426 finished with value: 0.6362821728961 and parameters: {'n_estimators': 977, 'learning_rate': 0.029874601273831854, 'max_depth': 12, 'min_samples_split': 11, 'min_samples_leaf': 4, 'subsample': 0.9325517932747016, 'max_features': None}. Best is trial 419 with value: 0.4620957934013452.
[I 2024-12-04 14:52:03,494] Trial 429 finished with value: 0.4729911931603944 and parameters: {'n_estimators': 928, 'learning_rate': 0.0421202707306945, 'max_depth': 12, 'min_samples_split': 20, 'min_samples_leaf': 1, 'subsample': 0.8982996660546658, 'max_features': None}. Best is trial 419 with value: 0.4620957934013452.
[I 2024-12-04 14:52:03,735] Trial 414 finished with value: 0.48009838943522487 and parameters: {'n_estimators': 1480, 'learning_rate': 0.023138009011907535, 'max_depth': 12, 'min_samples_split': 19, 'min_samples_leaf': 1, 'subsample': 0.8946972890690613, 'max_features': None}. Best is trial 419 with value: 0.4620957934013452.
[I 2024-12-04 14:52:04,355] Trial 437 finished with value: 0.5751121131334582 and parameters: {'n_estimators': 857, 'learning_rate': 0.04227041982822081, 'max_depth': 12, 'min_samples_split': 15, 'min_samples_leaf': 1, 'subsample': 0.8145149941428784, 'max_features': 'log2'}. Best is trial 419 with value: 0.4620957934013452.
[I 2024-12-04 14:52:07,897] Trial 425 finished with value: 0.4765750997327673 and parameters: {'n_estimators': 1096, 'learning_rate': 0.044380366161845014, 'max_depth': 12, 'min_samples_split': 20, 'min_samples_leaf': 1, 'subsample': 0.9029587423549366, 'max_features': None}. Best is trial 419 with value: 0.4620957934013452.
[I 2024-12-04 14:52:07,905] Trial 421 finished with value: 0.6448480176560423 and parameters: {'n_estimators': 1310, 'learning_rate': 0.049413180543230115, 'max_depth': 12, 'min_samples_split': 18, 'min_samples_leaf': 2, 'subsample': 0.8204643718015895, 'max_features': None}. Best is trial 419 with value: 0.4620957934013452.
[I 2024-12-04 14:52:08,079] Trial 448 finished with value: 0.9444329197106704 and parameters: {'n_estimators': 585, 'learning_rate': 0.011691691035352902, 'max_depth': 12, 'min_samples_split': 19, 'min_samples_leaf': 9, 'subsample': 0.7617684231057253, 'max_features': 'sqrt'}. Best is trial 419 with value: 0.4620957934013452.
[I 2024-12-04 14:52:11,617] Trial 442 finished with value: 0.6018499503814609 and parameters: {'n_estimators': 762, 'learning_rate': 0.045141612959597906, 'max_depth': 12, 'min_samples_split': 20, 'min_samples_leaf': 2, 'subsample': 0.9006661074028498, 'max_features': None}. Best is trial 419 with value: 0.4620957934013452.
[I 2024-12-04 14:52:14,164] Trial 434 finished with value: 0.6074162340889214 and parameters: {'n_estimators': 1185, 'learning_rate': 0.027367746782390127, 'max_depth': 12, 'min_samples_split': 20, 'min_samples_leaf': 3, 'subsample': 0.9784637996617701, 'max_features': None}. Best is trial 419 with value: 0.4620957934013452.
[I 2024-12-04 14:52:14,805] Trial 439 finished with value: 0.5553621045287389 and parameters: {'n_estimators': 1361, 'learning_rate': 0.02469013183585467, 'max_depth': 11, 'min_samples_split': 13, 'min_samples_leaf': 1, 'subsample': 0.8921789813637827, 'max_features': 'log2'}. Best is trial 419 with value: 0.4620957934013452.
[I 2024-12-04 14:52:15,813] Trial 445 finished with value: 0.4964158985554165 and parameters: {'n_estimators': 909, 'learning_rate': 0.04290098484060547, 'max_depth': 11, 'min_samples_split': 19, 'min_samples_leaf': 1, 'subsample': 0.9346943517132064, 'max_features': None}. Best is trial 419 with value: 0.4620957934013452.
[I 2024-12-04 14:52:15,814] Trial 446 finished with value: 0.6311574656056463 and parameters: {'n_estimators': 862, 'learning_rate': 0.06426115797218629, 'max_depth': 12, 'min_samples_split': 16, 'min_samples_leaf': 2, 'subsample': 0.9893266871132396, 'max_features': None}. Best is trial 419 with value: 0.4620957934013452.
[I 2024-12-04 14:52:16,150] Trial 450 finished with value: 0.4648960951330387 and parameters: {'n_estimators': 783, 'learning_rate': 0.07361202866051302, 'max_depth': 12, 'min_samples_split': 20, 'min_samples_leaf': 1, 'subsample': 0.9918436416385615, 'max_features': None}. Best is trial 419 with value: 0.4620957934013452.
[I 2024-12-04 14:52:16,515] Trial 452 finished with value: 0.8414912510396738 and parameters: {'n_estimators': 1012, 'learning_rate': 0.03582257769061663, 'max_depth': 4, 'min_samples_split': 14, 'min_samples_leaf': 9, 'subsample': 0.6465493316769044, 'max_features': 'log2'}. Best is trial 419 with value: 0.4620957934013452.
[I 2024-12-04 14:52:16,769] Trial 460 finished with value: 0.888192777878413 and parameters: {'n_estimators': 281, 'learning_rate': 0.054724555109077415, 'max_depth': 6, 'min_samples_split': 15, 'min_samples_leaf': 9, 'subsample': 0.7784718400045915, 'max_features': 'log2'}. Best is trial 419 with value: 0.4620957934013452.
[I 2024-12-04 14:52:17,705] Trial 430 finished with value: 0.5031654212302723 and parameters: {'n_estimators': 1385, 'learning_rate': 0.04666851504910207, 'max_depth': 12, 'min_samples_split': 16, 'min_samples_leaf': 1, 'subsample': 0.9178305334357253, 'max_features': None}. Best is trial 419 with value: 0.4620957934013452.
[I 2024-12-04 14:52:18,239] Trial 443 finished with value: 0.5868793348123656 and parameters: {'n_estimators': 1091, 'learning_rate': 0.047489362583283505, 'max_depth': 11, 'min_samples_split': 20, 'min_samples_leaf': 5, 'subsample': 0.8897185810874154, 'max_features': None}. Best is trial 419 with value: 0.4620957934013452.
[I 2024-12-04 14:52:18,514] Trial 451 finished with value: 0.4902927793067452 and parameters: {'n_estimators': 834, 'learning_rate': 0.04932577575089292, 'max_depth': 12, 'min_samples_split': 20, 'min_samples_leaf': 1, 'subsample': 0.951403949300734, 'max_features': None}. Best is trial 419 with value: 0.4620957934013452.
[I 2024-12-04 14:52:20,178] Trial 441 finished with value: 0.6305304769880942 and parameters: {'n_estimators': 1097, 'learning_rate': 0.03887341460609359, 'max_depth': 12, 'min_samples_split': 15, 'min_samples_leaf': 2, 'subsample': 0.9555829826338765, 'max_features': None}. Best is trial 419 with value: 0.4620957934013452.
[I 2024-12-04 14:52:20,285] Trial 453 finished with value: 0.657254945665479 and parameters: {'n_estimators': 1092, 'learning_rate': 0.07542584669743066, 'max_depth': 12, 'min_samples_split': 17, 'min_samples_leaf': 2, 'subsample': 0.9972440561286705, 'max_features': 'log2'}. Best is trial 419 with value: 0.4620957934013452.
[I 2024-12-04 14:52:20,584] Trial 449 finished with value: 0.6269795068867171 and parameters: {'n_estimators': 990, 'learning_rate': 0.045702086932466406, 'max_depth': 12, 'min_samples_split': 20, 'min_samples_leaf': 2, 'subsample': 0.9923210333873614, 'max_features': None}. Best is trial 419 with value: 0.4620957934013452.
[I 2024-12-04 14:52:20,592] Trial 427 finished with value: 0.6067958594863192 and parameters: {'n_estimators': 1493, 'learning_rate': 0.013995432083202542, 'max_depth': 12, 'min_samples_split': 15, 'min_samples_leaf': 2, 'subsample': 0.9207974951461142, 'max_features': None}. Best is trial 419 with value: 0.4620957934013452.
[I 2024-12-04 14:52:20,636] Trial 436 finished with value: 0.48719425378646725 and parameters: {'n_estimators': 1317, 'learning_rate': 0.022753487973462598, 'max_depth': 11, 'min_samples_split': 19, 'min_samples_leaf': 1, 'subsample': 0.901632417849877, 'max_features': None}. Best is trial 419 with value: 0.4620957934013452.
[I 2024-12-04 14:52:21,477] Trial 466 finished with value: 0.638838480505854 and parameters: {'n_estimators': 231, 'learning_rate': 0.010636185224022075, 'max_depth': 12, 'min_samples_split': 11, 'min_samples_leaf': 10, 'subsample': 0.944854960486304, 'max_features': None}. Best is trial 419 with value: 0.4620957934013452.
[I 2024-12-04 14:52:21,489] Trial 433 finished with value: 0.6842208433027922 and parameters: {'n_estimators': 1435, 'learning_rate': 0.028575988790491332, 'max_depth': 12, 'min_samples_split': 15, 'min_samples_leaf': 8, 'subsample': 0.7130768990066533, 'max_features': None}. Best is trial 419 with value: 0.4620957934013452.
[I 2024-12-04 14:52:22,283] Trial 438 finished with value: 0.48475588418023724 and parameters: {'n_estimators': 1346, 'learning_rate': 0.029474498330761316, 'max_depth': 11, 'min_samples_split': 18, 'min_samples_leaf': 1, 'subsample': 0.9311442728381149, 'max_features': None}. Best is trial 419 with value: 0.4620957934013452.
[I 2024-12-04 14:52:23,172] Trial 455 finished with value: 0.4938644742684868 and parameters: {'n_estimators': 729, 'learning_rate': 0.044506135520906064, 'max_depth': 12, 'min_samples_split': 17, 'min_samples_leaf': 1, 'subsample': 0.9971799203060254, 'max_features': None}. Best is trial 419 with value: 0.4620957934013452.
[I 2024-12-04 14:52:23,417] Trial 447 finished with value: 0.4896191849922602 and parameters: {'n_estimators': 1099, 'learning_rate': 0.022499163863958678, 'max_depth': 12, 'min_samples_split': 17, 'min_samples_leaf': 1, 'subsample': 0.957172160599025, 'max_features': None}. Best is trial 419 with value: 0.4620957934013452.
[I 2024-12-04 14:52:23,586] Trial 440 finished with value: 0.4793053894742343 and parameters: {'n_estimators': 1332, 'learning_rate': 0.031516434535130484, 'max_depth': 12, 'min_samples_split': 20, 'min_samples_leaf': 1, 'subsample': 0.9791791604292048, 'max_features': None}. Best is trial 419 with value: 0.4620957934013452.
[I 2024-12-04 14:52:24,827] Trial 465 finished with value: 0.48138938524656 and parameters: {'n_estimators': 415, 'learning_rate': 0.07782661486323031, 'max_depth': 12, 'min_samples_split': 20, 'min_samples_leaf': 1, 'subsample': 0.9652860387394072, 'max_features': None}. Best is trial 419 with value: 0.4620957934013452.
[I 2024-12-04 14:52:29,164] Trial 444 finished with value: 0.6304074082492079 and parameters: {'n_estimators': 1491, 'learning_rate': 0.039266391948828236, 'max_depth': 8, 'min_samples_split': 17, 'min_samples_leaf': 3, 'subsample': 0.9533135411369987, 'max_features': None}. Best is trial 419 with value: 0.4620957934013452.
[I 2024-12-04 14:52:34,193] Trial 456 finished with value: 0.4897762319871152 and parameters: {'n_estimators': 1209, 'learning_rate': 0.03844900959094971, 'max_depth': 12, 'min_samples_split': 17, 'min_samples_leaf': 1, 'subsample': 0.9193652416774443, 'max_features': None}. Best is trial 419 with value: 0.4620957934013452.
[I 2024-12-04 14:52:35,219] Trial 457 finished with value: 0.6490269690921066 and parameters: {'n_estimators': 1412, 'learning_rate': 0.04182785032553602, 'max_depth': 12, 'min_samples_split': 19, 'min_samples_leaf': 2, 'subsample': 0.8425169174452964, 'max_features': 'log2'}. Best is trial 419 with value: 0.4620957934013452.
[I 2024-12-04 14:52:36,009] Trial 467 finished with value: 0.8194805219584435 and parameters: {'n_estimators': 933, 'learning_rate': 0.049611713281738176, 'max_depth': 8, 'min_samples_split': 10, 'min_samples_leaf': 7, 'subsample': 0.61603648381815, 'max_features': 'log2'}. Best is trial 419 with value: 0.4620957934013452.
[I 2024-12-04 14:52:36,982] Trial 463 finished with value: 0.7097857529271445 and parameters: {'n_estimators': 1067, 'learning_rate': 0.03910747545266988, 'max_depth': 11, 'min_samples_split': 3, 'min_samples_leaf': 6, 'subsample': 0.986882360919676, 'max_features': 'log2'}. Best is trial 419 with value: 0.4620957934013452.
[I 2024-12-04 14:52:37,753] Trial 476 finished with value: 0.5390447493257204 and parameters: {'n_estimators': 239, 'learning_rate': 0.010573106310298576, 'max_depth': 11, 'min_samples_split': 6, 'min_samples_leaf': 1, 'subsample': 0.9093417026290213, 'max_features': None}. Best is trial 419 with value: 0.4620957934013452.
[I 2024-12-04 14:52:38,328] Trial 454 finished with value: 0.4826819144465323 and parameters: {'n_estimators': 1459, 'learning_rate': 0.017270732945295752, 'max_depth': 12, 'min_samples_split': 17, 'min_samples_leaf': 1, 'subsample': 0.9662968601257418, 'max_features': None}. Best is trial 419 with value: 0.4620957934013452.
[I 2024-12-04 14:52:40,005] Trial 461 finished with value: 0.5959704354362784 and parameters: {'n_estimators': 1126, 'learning_rate': 0.02592854834684607, 'max_depth': 12, 'min_samples_split': 20, 'min_samples_leaf': 2, 'subsample': 0.8583204895853526, 'max_features': None}. Best is trial 419 with value: 0.4620957934013452.
[I 2024-12-04 14:52:40,011] Trial 481 finished with value: 0.9708660227540341 and parameters: {'n_estimators': 356, 'learning_rate': 0.08088149703517929, 'max_depth': 12, 'min_samples_split': 19, 'min_samples_leaf': 8, 'subsample': 0.7023889762763801, 'max_features': 'log2'}. Best is trial 419 with value: 0.4620957934013452.
[I 2024-12-04 14:52:43,065] Trial 468 finished with value: 0.6274146994258049 and parameters: {'n_estimators': 780, 'learning_rate': 0.07834884823808513, 'max_depth': 12, 'min_samples_split': 20, 'min_samples_leaf': 2, 'subsample': 0.9743046299426247, 'max_features': None}. Best is trial 419 with value: 0.4620957934013452.
[I 2024-12-04 14:52:43,523] Trial 462 finished with value: 0.5517530620430159 and parameters: {'n_estimators': 1336, 'learning_rate': 0.014328418677010672, 'max_depth': 11, 'min_samples_split': 20, 'min_samples_leaf': 1, 'subsample': 0.8893794157366096, 'max_features': 'sqrt'}. Best is trial 419 with value: 0.4620957934013452.
[I 2024-12-04 14:52:44,513] Trial 459 finished with value: 0.48893475777387874 and parameters: {'n_estimators': 1286, 'learning_rate': 0.0520818880792565, 'max_depth': 12, 'min_samples_split': 18, 'min_samples_leaf': 1, 'subsample': 0.8679133828855036, 'max_features': None}. Best is trial 419 with value: 0.4620957934013452.
[I 2024-12-04 14:52:44,525] Trial 464 finished with value: 0.6833529726400374 and parameters: {'n_estimators': 1405, 'learning_rate': 0.039850326837837714, 'max_depth': 3, 'min_samples_split': 9, 'min_samples_leaf': 5, 'subsample': 0.6922353286006143, 'max_features': 'log2'}. Best is trial 419 with value: 0.4620957934013452.
