[I 2024-12-04 12:34:26,682] Trial 1080 finished with value: 0.43149484019893414 and parameters: {'n_estimators': 627, 'learning_rate': 0.09757395371575624, 'max_depth': 8, 'min_samples_split': 3, 'min_samples_leaf': 2, 'subsample': 0.6314669996984557, 'max_features': 'log2'}. Best is trial 989 with value: 0.3092662874814911.
[I 2024-12-04 12:34:31,431] Trial 1069 finished with value: 0.4298350048082491 and parameters: {'n_estimators': 1178, 'learning_rate': 0.023983902742771686, 'max_depth': 3, 'min_samples_split': 9, 'min_samples_leaf': 6, 'subsample': 0.8223576016261241, 'max_features': None}. Best is trial 989 with value: 0.3092662874814911.
[I 2024-12-04 12:34:31,842] Trial 1072 finished with value: 0.3264789803149661 and parameters: {'n_estimators': 1009, 'learning_rate': 0.07910249507292892, 'max_depth': 7, 'min_samples_split': 4, 'min_samples_leaf': 2, 'subsample': 0.6728473819341104, 'max_features': None}. Best is trial 989 with value: 0.3092662874814911.
[I 2024-12-04 12:34:32,269] Trial 1093 finished with value: 0.7241139511239347 and parameters: {'n_estimators': 234, 'learning_rate': 0.017010961205092285, 'max_depth': 12, 'min_samples_split': 8, 'min_samples_leaf': 7, 'subsample': 0.7415749633424813, 'max_features': 'sqrt'}. Best is trial 989 with value: 0.3092662874814911.
[I 2024-12-04 12:34:33,283] Trial 1094 finished with value: 0.7148837125597031 and parameters: {'n_estimators': 352, 'learning_rate': 0.08523019942724543, 'max_depth': 3, 'min_samples_split': 11, 'min_samples_leaf': 8, 'subsample': 0.6052546346142528, 'max_features': 'log2'}. Best is trial 989 with value: 0.3092662874814911.
[I 2024-12-04 12:34:36,740] Trial 1076 finished with value: 0.3683931446141274 and parameters: {'n_estimators': 1063, 'learning_rate': 0.09695134054244817, 'max_depth': 3, 'min_samples_split': 8, 'min_samples_leaf': 2, 'subsample': 0.7138700906342809, 'max_features': None}. Best is trial 989 with value: 0.3092662874814911.
[I 2024-12-04 12:34:36,882] Trial 1073 finished with value: 0.40092910627411726 and parameters: {'n_estimators': 1161, 'learning_rate': 0.09467571839251444, 'max_depth': 7, 'min_samples_split': 2, 'min_samples_leaf': 3, 'subsample': 0.6284261060100695, 'max_features': None}. Best is trial 989 with value: 0.3092662874814911.
[I 2024-12-04 12:34:37,687] Trial 1078 finished with value: 0.5031464946895174 and parameters: {'n_estimators': 1122, 'learning_rate': 0.02271109543778015, 'max_depth': 7, 'min_samples_split': 14, 'min_samples_leaf': 8, 'subsample': 0.8716330806185514, 'max_features': 'sqrt'}. Best is trial 989 with value: 0.3092662874814911.
[I 2024-12-04 12:34:38,548] Trial 1086 finished with value: 0.38383085594479754 and parameters: {'n_estimators': 790, 'learning_rate': 0.09942547111854666, 'max_depth': 5, 'min_samples_split': 2, 'min_samples_leaf': 4, 'subsample': 0.7387996328271151, 'max_features': None}. Best is trial 989 with value: 0.3092662874814911.
[I 2024-12-04 12:34:39,397] Trial 1079 finished with value: 0.38981788272772394 and parameters: {'n_estimators': 967, 'learning_rate': 0.07540846644556118, 'max_depth': 6, 'min_samples_split': 8, 'min_samples_leaf': 1, 'subsample': 0.7666894426373742, 'max_features': None}. Best is trial 989 with value: 0.3092662874814911.
[I 2024-12-04 12:34:41,965] Trial 1108 finished with value: 1.056425861602818 and parameters: {'n_estimators': 132, 'learning_rate': 0.012859458789238783, 'max_depth': 5, 'min_samples_split': 8, 'min_samples_leaf': 10, 'subsample': 0.8842817981183926, 'max_features': 'log2'}. Best is trial 989 with value: 0.3092662874814911.
[I 2024-12-04 12:34:43,129] Trial 1081 finished with value: 0.4012617716892157 and parameters: {'n_estimators': 1066, 'learning_rate': 0.06261535050566695, 'max_depth': 6, 'min_samples_split': 6, 'min_samples_leaf': 3, 'subsample': 0.6155160208786113, 'max_features': None}. Best is trial 989 with value: 0.3092662874814911.
[I 2024-12-04 12:34:47,671] Trial 1074 finished with value: 0.40094696697297355 and parameters: {'n_estimators': 1409, 'learning_rate': 0.08161105068011092, 'max_depth': 5, 'min_samples_split': 2, 'min_samples_leaf': 3, 'subsample': 0.6658293373404478, 'max_features': None}. Best is trial 989 with value: 0.3092662874814911.
[I 2024-12-04 12:34:47,941] Trial 1087 finished with value: 0.331221621954156 and parameters: {'n_estimators': 1020, 'learning_rate': 0.09949889271584778, 'max_depth': 6, 'min_samples_split': 3, 'min_samples_leaf': 2, 'subsample': 0.7904411124290538, 'max_features': None}. Best is trial 989 with value: 0.3092662874814911.
[I 2024-12-04 12:34:50,150] Trial 1085 finished with value: 0.4047188250972624 and parameters: {'n_estimators': 1164, 'learning_rate': 0.09018126945345543, 'max_depth': 5, 'min_samples_split': 4, 'min_samples_leaf': 3, 'subsample': 0.7440759103749084, 'max_features': None}. Best is trial 989 with value: 0.3092662874814911.
[I 2024-12-04 12:34:51,442] Trial 1075 finished with value: 0.33915676281017054 and parameters: {'n_estimators': 1499, 'learning_rate': 0.0916608315163721, 'max_depth': 8, 'min_samples_split': 3, 'min_samples_leaf': 2, 'subsample': 0.6637828720926199, 'max_features': None}. Best is trial 989 with value: 0.3092662874814911.
[I 2024-12-04 12:34:52,209] Trial 1082 finished with value: 0.5693252437877441 and parameters: {'n_estimators': 1298, 'learning_rate': 0.023692751276233284, 'max_depth': 12, 'min_samples_split': 17, 'min_samples_leaf': 10, 'subsample': 0.6255107025709847, 'max_features': None}. Best is trial 989 with value: 0.3092662874814911.
[I 2024-12-04 12:34:52,797] Trial 1100 finished with value: 0.415216763739885 and parameters: {'n_estimators': 578, 'learning_rate': 0.09787921196729434, 'max_depth': 8, 'min_samples_split': 3, 'min_samples_leaf': 1, 'subsample': 0.7776310495406921, 'max_features': None}. Best is trial 989 with value: 0.3092662874814911.
[I 2024-12-04 12:34:54,979] Trial 1084 finished with value: 0.3203029152063136 and parameters: {'n_estimators': 1251, 'learning_rate': 0.09491129455342383, 'max_depth': 7, 'min_samples_split': 2, 'min_samples_leaf': 2, 'subsample': 0.7054047546530875, 'max_features': None}. Best is trial 989 with value: 0.3092662874814911.
[I 2024-12-04 12:34:56,439] Trial 1083 finished with value: 0.3740824242163054 and parameters: {'n_estimators': 1360, 'learning_rate': 0.09641583499954809, 'max_depth': 7, 'min_samples_split': 5, 'min_samples_leaf': 4, 'subsample': 0.6596224334175559, 'max_features': None}. Best is trial 989 with value: 0.3092662874814911.
[I 2024-12-04 12:34:56,881] Trial 1104 finished with value: 0.4024329276221074 and parameters: {'n_estimators': 746, 'learning_rate': 0.062059090658423265, 'max_depth': 6, 'min_samples_split': 3, 'min_samples_leaf': 1, 'subsample': 0.7359460579096928, 'max_features': 'sqrt'}. Best is trial 989 with value: 0.3092662874814911.
[I 2024-12-04 12:34:58,328] Trial 1099 finished with value: 0.37320071526170495 and parameters: {'n_estimators': 780, 'learning_rate': 0.0860802668551693, 'max_depth': 8, 'min_samples_split': 3, 'min_samples_leaf': 4, 'subsample': 0.7434826208765479, 'max_features': None}. Best is trial 989 with value: 0.3092662874814911.
[I 2024-12-04 12:35:00,505] Trial 1090 finished with value: 0.4566849026045952 and parameters: {'n_estimators': 1438, 'learning_rate': 0.09379891030680843, 'max_depth': 7, 'min_samples_split': 2, 'min_samples_leaf': 5, 'subsample': 0.6229487130612831, 'max_features': 'log2'}. Best is trial 989 with value: 0.3092662874814911.
[I 2024-12-04 12:35:02,836] Trial 1102 finished with value: 0.40296721074522734 and parameters: {'n_estimators': 879, 'learning_rate': 0.053129136741713434, 'max_depth': 5, 'min_samples_split': 2, 'min_samples_leaf': 3, 'subsample': 0.7116281360964356, 'max_features': None}. Best is trial 989 with value: 0.3092662874814911.
[I 2024-12-04 12:35:04,098] Trial 1088 finished with value: 0.37853356958670514 and parameters: {'n_estimators': 1407, 'learning_rate': 0.05917350022323666, 'max_depth': 7, 'min_samples_split': 2, 'min_samples_leaf': 3, 'subsample': 0.7737314429462627, 'max_features': None}. Best is trial 989 with value: 0.3092662874814911.
[I 2024-12-04 12:35:05,157] Trial 1089 finished with value: 0.380539627186835 and parameters: {'n_estimators': 1416, 'learning_rate': 0.08133187748560666, 'max_depth': 5, 'min_samples_split': 2, 'min_samples_leaf': 5, 'subsample': 0.6225321181181143, 'max_features': None}. Best is trial 989 with value: 0.3092662874814911.
[I 2024-12-04 12:35:07,200] Trial 1115 finished with value: 0.3955519731606778 and parameters: {'n_estimators': 640, 'learning_rate': 0.09701542304789129, 'max_depth': 6, 'min_samples_split': 2, 'min_samples_leaf': 3, 'subsample': 0.7975077681492836, 'max_features': None}. Best is trial 989 with value: 0.3092662874814911.
[I 2024-12-04 12:35:08,988] Trial 1098 finished with value: 0.5512110165591134 and parameters: {'n_estimators': 1194, 'learning_rate': 0.01622008300258803, 'max_depth': 6, 'min_samples_split': 17, 'min_samples_leaf': 9, 'subsample': 0.7716792515001474, 'max_features': None}. Best is trial 989 with value: 0.3092662874814911.
[I 2024-12-04 12:35:08,998] Trial 1091 finished with value: 0.39525748145287515 and parameters: {'n_estimators': 1459, 'learning_rate': 0.08514097301348006, 'max_depth': 7, 'min_samples_split': 2, 'min_samples_leaf': 3, 'subsample': 0.659428069074849, 'max_features': None}. Best is trial 989 with value: 0.3092662874814911.
[I 2024-12-04 12:35:09,673] Trial 1110 finished with value: 0.33255971131002193 and parameters: {'n_estimators': 828, 'learning_rate': 0.07551845724017286, 'max_depth': 7, 'min_samples_split': 3, 'min_samples_leaf': 2, 'subsample': 0.7334819542882994, 'max_features': None}. Best is trial 989 with value: 0.3092662874814911.
[I 2024-12-04 12:35:09,934] Trial 1113 finished with value: 0.330857859453467 and parameters: {'n_estimators': 774, 'learning_rate': 0.06204253371626342, 'max_depth': 7, 'min_samples_split': 2, 'min_samples_leaf': 2, 'subsample': 0.7021095104842907, 'max_features': None}. Best is trial 989 with value: 0.3092662874814911.
[I 2024-12-04 12:35:10,902] Trial 1092 finished with value: 0.3303620116758574 and parameters: {'n_estimators': 1473, 'learning_rate': 0.05926602249638765, 'max_depth': 7, 'min_samples_split': 4, 'min_samples_leaf': 2, 'subsample': 0.6504861783236949, 'max_features': None}. Best is trial 989 with value: 0.3092662874814911.
[I 2024-12-04 12:35:10,907] Trial 1097 finished with value: 0.38195409469271996 and parameters: {'n_estimators': 1327, 'learning_rate': 0.05156769056074937, 'max_depth': 6, 'min_samples_split': 3, 'min_samples_leaf': 1, 'subsample': 0.6193548050664235, 'max_features': None}. Best is trial 989 with value: 0.3092662874814911.
[I 2024-12-04 12:35:12,572] Trial 1101 finished with value: 0.534337864980848 and parameters: {'n_estimators': 1339, 'learning_rate': 0.024654725946681038, 'max_depth': 4, 'min_samples_split': 3, 'min_samples_leaf': 7, 'subsample': 0.6604260703192414, 'max_features': 'sqrt'}. Best is trial 989 with value: 0.3092662874814911.
[I 2024-12-04 12:35:12,780] Trial 1111 finished with value: 0.3977882502734903 and parameters: {'n_estimators': 872, 'learning_rate': 0.08207221704643669, 'max_depth': 5, 'min_samples_split': 2, 'min_samples_leaf': 3, 'subsample': 0.6699320874913732, 'max_features': None}. Best is trial 989 with value: 0.3092662874814911.
[I 2024-12-04 12:35:13,177] Trial 1103 finished with value: 0.4128077088779283 and parameters: {'n_estimators': 1080, 'learning_rate': 0.07296966181643491, 'max_depth': 7, 'min_samples_split': 4, 'min_samples_leaf': 1, 'subsample': 0.7810108313038109, 'max_features': None}. Best is trial 989 with value: 0.3092662874814911.
[I 2024-12-04 12:35:14,890] Trial 1095 finished with value: 0.3325532633345614 and parameters: {'n_estimators': 1479, 'learning_rate': 0.09873567281182082, 'max_depth': 7, 'min_samples_split': 5, 'min_samples_leaf': 2, 'subsample': 0.7222669605752592, 'max_features': None}. Best is trial 989 with value: 0.3092662874814911.
[I 2024-12-04 12:35:15,065] Trial 1096 finished with value: 0.3705442171253536 and parameters: {'n_estimators': 1403, 'learning_rate': 0.09695848542971852, 'max_depth': 5, 'min_samples_split': 4, 'min_samples_leaf': 1, 'subsample': 0.6955934080812092, 'max_features': None}. Best is trial 989 with value: 0.3092662874814911.
[I 2024-12-04 12:35:16,336] Trial 1130 finished with value: 0.8374034480463131 and parameters: {'n_estimators': 239, 'learning_rate': 0.011717606539484208, 'max_depth': 10, 'min_samples_split': 16, 'min_samples_leaf': 6, 'subsample': 0.6058125198015946, 'max_features': 'sqrt'}. Best is trial 989 with value: 0.3092662874814911.
[I 2024-12-04 12:35:18,849] Trial 1120 finished with value: 0.31657190129065993 and parameters: {'n_estimators': 670, 'learning_rate': 0.0974649444889382, 'max_depth': 7, 'min_samples_split': 2, 'min_samples_leaf': 2, 'subsample': 0.6269604066131119, 'max_features': None}. Best is trial 989 with value: 0.3092662874814911.
[I 2024-12-04 12:35:20,051] Trial 1117 finished with value: 0.3158167261040928 and parameters: {'n_estimators': 846, 'learning_rate': 0.08315855581000008, 'max_depth': 6, 'min_samples_split': 4, 'min_samples_leaf': 2, 'subsample': 0.709447478341723, 'max_features': None}. Best is trial 989 with value: 0.3092662874814911.
[I 2024-12-04 12:35:20,055] Trial 1116 finished with value: 0.4108276555523845 and parameters: {'n_estimators': 835, 'learning_rate': 0.0999303952760783, 'max_depth': 6, 'min_samples_split': 4, 'min_samples_leaf': 1, 'subsample': 0.7986052411856166, 'max_features': None}. Best is trial 989 with value: 0.3092662874814911.
[I 2024-12-04 12:35:21,149] Trial 1122 finished with value: 0.5532699396968139 and parameters: {'n_estimators': 684, 'learning_rate': 0.010955865184325307, 'max_depth': 8, 'min_samples_split': 13, 'min_samples_leaf': 9, 'subsample': 0.9551823769802843, 'max_features': None}. Best is trial 989 with value: 0.3092662874814911.
[I 2024-12-04 12:35:22,621] Trial 1109 finished with value: 0.4695963318488617 and parameters: {'n_estimators': 1442, 'learning_rate': 0.015927912515031218, 'max_depth': 6, 'min_samples_split': 4, 'min_samples_leaf': 1, 'subsample': 0.9295632370233196, 'max_features': 'log2'}. Best is trial 989 with value: 0.3092662874814911.
[I 2024-12-04 12:35:22,628] Trial 1105 finished with value: 0.3918943388396472 and parameters: {'n_estimators': 1302, 'learning_rate': 0.06862420215078359, 'max_depth': 7, 'min_samples_split': 2, 'min_samples_leaf': 3, 'subsample': 0.7365089480763101, 'max_features': None}. Best is trial 989 with value: 0.3092662874814911.
[I 2024-12-04 12:35:24,193] Trial 1112 finished with value: 0.3699851732593309 and parameters: {'n_estimators': 1415, 'learning_rate': 0.06555336432536431, 'max_depth': 6, 'min_samples_split': 7, 'min_samples_leaf': 2, 'subsample': 0.6329701421090296, 'max_features': 'sqrt'}. Best is trial 989 with value: 0.3092662874814911.
[I 2024-12-04 12:35:26,855] Trial 1107 finished with value: 0.3621057737072964 and parameters: {'n_estimators': 1498, 'learning_rate': 0.07297487566881522, 'max_depth': 6, 'min_samples_split': 3, 'min_samples_leaf': 1, 'subsample': 0.6280805579570532, 'max_features': None}. Best is trial 989 with value: 0.3092662874814911.
[I 2024-12-04 12:35:27,069] Trial 1106 finished with value: 0.366714728419298 and parameters: {'n_estimators': 1436, 'learning_rate': 0.049384001538217245, 'max_depth': 6, 'min_samples_split': 3, 'min_samples_leaf': 4, 'subsample': 0.6624179846843348, 'max_features': None}. Best is trial 989 with value: 0.3092662874814911.
[I 2024-12-04 12:35:29,125] Trial 1118 finished with value: 0.37684946595946417 and parameters: {'n_estimators': 1042, 'learning_rate': 0.0978744182780777, 'max_depth': 6, 'min_samples_split': 2, 'min_samples_leaf': 1, 'subsample': 0.7694617851870869, 'max_features': None}. Best is trial 989 with value: 0.3092662874814911.
[I 2024-12-04 12:35:30,311] Trial 1119 finished with value: 0.3950059577935554 and parameters: {'n_estimators': 1062, 'learning_rate': 0.07025228582027085, 'max_depth': 5, 'min_samples_split': 2, 'min_samples_leaf': 3, 'subsample': 0.6943011157076509, 'max_features': None}. Best is trial 989 with value: 0.3092662874814911.
[I 2024-12-04 12:35:32,941] Trial 1114 finished with value: 0.32486230969913477 and parameters: {'n_estimators': 1481, 'learning_rate': 0.08740183142034882, 'max_depth': 5, 'min_samples_split': 3, 'min_samples_leaf': 2, 'subsample': 0.6436580126952298, 'max_features': None}. Best is trial 989 with value: 0.3092662874814911.
[I 2024-12-04 12:35:33,163] Trial 1123 finished with value: 0.33914455265727816 and parameters: {'n_estimators': 987, 'learning_rate': 0.05522447077088109, 'max_depth': 6, 'min_samples_split': 3, 'min_samples_leaf': 2, 'subsample': 0.8154896528630055, 'max_features': None}. Best is trial 989 with value: 0.3092662874814911.
[I 2024-12-04 12:35:36,288] Trial 1124 finished with value: 0.39701126084994603 and parameters: {'n_estimators': 1091, 'learning_rate': 0.09129986610999663, 'max_depth': 6, 'min_samples_split': 4, 'min_samples_leaf': 1, 'subsample': 0.70552115025697, 'max_features': None}. Best is trial 989 with value: 0.3092662874814911.
[I 2024-12-04 12:35:37,251] Trial 1121 finished with value: 0.38641289138785223 and parameters: {'n_estimators': 1231, 'learning_rate': 0.08848477334086138, 'max_depth': 7, 'min_samples_split': 5, 'min_samples_leaf': 1, 'subsample': 0.6675744657601904, 'max_features': None}. Best is trial 989 with value: 0.3092662874814911.
[I 2024-12-04 12:35:38,744] Trial 1125 finished with value: 0.7559182710570983 and parameters: {'n_estimators': 1359, 'learning_rate': 0.017366979716219182, 'max_depth': 7, 'min_samples_split': 3, 'min_samples_leaf': 10, 'subsample': 0.9166128339308255, 'max_features': 'log2'}. Best is trial 989 with value: 0.3092662874814911.
[I 2024-12-04 12:35:38,831] Trial 1139 finished with value: 0.3385851769577358 and parameters: {'n_estimators': 548, 'learning_rate': 0.09662529442587994, 'max_depth': 8, 'min_samples_split': 8, 'min_samples_leaf': 2, 'subsample': 0.6046261668208077, 'max_features': None}. Best is trial 989 with value: 0.3092662874814911.
[I 2024-12-04 12:35:39,729] Trial 1147 finished with value: 0.40522370740250235 and parameters: {'n_estimators': 216, 'learning_rate': 0.059197578050565275, 'max_depth': 8, 'min_samples_split': 2, 'min_samples_leaf': 3, 'subsample': 0.6467774388745245, 'max_features': None}. Best is trial 989 with value: 0.3092662874814911.
[I 2024-12-04 12:35:42,181] Trial 1143 finished with value: 0.3642191696406832 and parameters: {'n_estimators': 471, 'learning_rate': 0.07353127964470724, 'max_depth': 6, 'min_samples_split': 2, 'min_samples_leaf': 1, 'subsample': 0.6024884857225052, 'max_features': None}. Best is trial 989 with value: 0.3092662874814911.
[I 2024-12-04 12:35:42,186] Trial 1126 finished with value: 0.32640615390625555 and parameters: {'n_estimators': 1185, 'learning_rate': 0.09788691712758485, 'max_depth': 7, 'min_samples_split': 4, 'min_samples_leaf': 2, 'subsample': 0.6878790137306993, 'max_features': None}. Best is trial 989 with value: 0.3092662874814911.
[I 2024-12-04 12:35:43,528] Trial 1141 finished with value: 0.3997202116137897 and parameters: {'n_estimators': 638, 'learning_rate': 0.09844672573699695, 'max_depth': 5, 'min_samples_split': 6, 'min_samples_leaf': 3, 'subsample': 0.6346852440138477, 'max_features': None}. Best is trial 989 with value: 0.3092662874814911.
[I 2024-12-04 12:35:44,221] Trial 1129 finished with value: 0.3225057272253598 and parameters: {'n_estimators': 1121, 'learning_rate': 0.09855855781686952, 'max_depth': 5, 'min_samples_split': 2, 'min_samples_leaf': 2, 'subsample': 0.6978447040009659, 'max_features': None}. Best is trial 989 with value: 0.3092662874814911.
[I 2024-12-04 12:35:47,810] Trial 1134 finished with value: 0.37809494399593846 and parameters: {'n_estimators': 1000, 'learning_rate': 0.09840912041839922, 'max_depth': 6, 'min_samples_split': 3, 'min_samples_leaf': 1, 'subsample': 0.660945605110294, 'max_features': None}. Best is trial 989 with value: 0.3092662874814911.
[I 2024-12-04 12:35:48,411] Trial 1159 finished with value: 0.9846196770323635 and parameters: {'n_estimators': 159, 'learning_rate': 0.016440073056275154, 'max_depth': 8, 'min_samples_split': 19, 'min_samples_leaf': 5, 'subsample': 0.7666986709859935, 'max_features': 'log2'}. Best is trial 989 with value: 0.3092662874814911.
[I 2024-12-04 12:35:49,040] Trial 1138 finished with value: 0.37531558074686977 and parameters: {'n_estimators': 850, 'learning_rate': 0.06447605143337287, 'max_depth': 6, 'min_samples_split': 2, 'min_samples_leaf': 1, 'subsample': 0.6271890126127299, 'max_features': None}. Best is trial 989 with value: 0.3092662874814911.
[I 2024-12-04 12:35:49,326] Trial 1149 finished with value: 0.6146064165013784 and parameters: {'n_estimators': 586, 'learning_rate': 0.03345102016524539, 'max_depth': 5, 'min_samples_split': 20, 'min_samples_leaf': 9, 'subsample': 0.8569157942368224, 'max_features': 'sqrt'}. Best is trial 989 with value: 0.3092662874814911.
[I 2024-12-04 12:35:50,619] Trial 1127 finished with value: 0.3263002972615736 and parameters: {'n_estimators': 1342, 'learning_rate': 0.09643169405722413, 'max_depth': 7, 'min_samples_split': 4, 'min_samples_leaf': 2, 'subsample': 0.6533236879646418, 'max_features': None}. Best is trial 989 with value: 0.3092662874814911.
[I 2024-12-04 12:35:50,717] Trial 1128 finished with value: 0.3910750307171458 and parameters: {'n_estimators': 1285, 'learning_rate': 0.06643088665969013, 'max_depth': 6, 'min_samples_split': 3, 'min_samples_leaf': 3, 'subsample': 0.7623919909631574, 'max_features': None}. Best is trial 989 with value: 0.3092662874814911.
