[I 2024-12-04 20:40:18,549] Trial 1377 finished with value: 0.9864686819234193 and parameters: {'kernel_type': 'Matern', 'length_scale': 9.771683346579525, 'noise_level': 1.4938144435136217e-10, 'constant_value': 0.005225750554902294, 'nu': 2.5}. Best is trial 959 with value: 0.1375110730946576.
[I 2024-12-04 20:40:21,656] Trial 1379 finished with value: 0.9982167338024032 and parameters: {'kernel_type': 'RBF', 'length_scale': 0.002046089397874293, 'noise_level': 8.373353918537939e-05, 'constant_value': 65248.04951741706, 'nu': 0.5}. Best is trial 959 with value: 0.1375110730946576.
[I 2024-12-04 20:40:24,858] Trial 1378 finished with value: 0.14249507747833376 and parameters: {'kernel_type': 'Matern', 'length_scale': 0.3290901454192746, 'noise_level': 0.001146350851000066, 'constant_value': 281.57129844259515, 'nu': 1.5}. Best is trial 959 with value: 0.1375110730946576.
[I 2024-12-04 20:40:25,930] Trial 1381 finished with value: 0.998216733803921 and parameters: {'kernel_type': 'RBF', 'length_scale': 0.0038705816704904944, 'noise_level': 1.2177114101830052e-08, 'constant_value': 35279.46926011308, 'nu': 1.5}. Best is trial 959 with value: 0.1375110730946576.
[I 2024-12-04 20:40:25,991] Trial 1380 finished with value: 0.14249506167258208 and parameters: {'kernel_type': 'Matern', 'length_scale': 1.5954986757820497, 'noise_level': 0.05923449794671591, 'constant_value': 0.7862344156965652, 'nu': 1.5}. Best is trial 959 with value: 0.1375110730946576.
[I 2024-12-04 20:40:32,672] Trial 1382 finished with value: 0.1424951571167417 and parameters: {'kernel_type': 'Matern', 'length_scale': 4.67753646744826, 'noise_level': 0.0440148305002605, 'constant_value': 112.34591203541979, 'nu': 1.5}. Best is trial 959 with value: 0.1375110730946576.
[I 2024-12-04 20:40:33,340] Trial 1383 finished with value: 0.14249506206645893 and parameters: {'kernel_type': 'Matern', 'length_scale': 34.612270496350895, 'noise_level': 0.01717579204520776, 'constant_value': 50.91903592150074, 'nu': 1.5}. Best is trial 959 with value: 0.1375110730946576.
[I 2024-12-04 20:40:36,095] Trial 1384 finished with value: 0.14249467157560156 and parameters: {'kernel_type': 'Matern', 'length_scale': 35.471933502628694, 'noise_level': 0.036840602083996116, 'constant_value': 33.82821675695301, 'nu': 1.5}. Best is trial 959 with value: 0.1375110730946576.
[I 2024-12-04 20:40:39,180] Trial 1386 finished with value: 0.9864686819228022 and parameters: {'kernel_type': 'Matern', 'length_scale': 0.006184760213806829, 'noise_level': 0.631281287188936, 'constant_value': 12.62014118375046, 'nu': 1.5}. Best is trial 959 with value: 0.1375110730946576.
[I 2024-12-04 20:40:42,592] Trial 1385 finished with value: 0.14249486391508018 and parameters: {'kernel_type': 'Matern', 'length_scale': 0.24106401566838312, 'noise_level': 0.027011573668407323, 'constant_value': 173.32860667261664, 'nu': 1.5}. Best is trial 959 with value: 0.1375110730946576.
[I 2024-12-04 20:40:45,531] Trial 1388 finished with value: 0.14249511070940502 and parameters: {'kernel_type': 'Matern', 'length_scale': 4127.649306431464, 'noise_level': 0.09476832047706546, 'constant_value': 24.06719111196844, 'nu': 1.5}. Best is trial 959 with value: 0.1375110730946576.
[I 2024-12-04 20:40:48,068] Trial 1387 finished with value: 0.9864686819186287 and parameters: {'kernel_type': 'Matern', 'length_scale': 1695.9005133542794, 'noise_level': 0.006155908641125844, 'constant_value': 3.1875001428575507, 'nu': 1.5}. Best is trial 959 with value: 0.1375110730946576.
[I 2024-12-04 20:40:51,428] Trial 1389 finished with value: 0.9864686819230072 and parameters: {'kernel_type': 'Matern', 'length_scale': 89221.97950022233, 'noise_level': 7.645105984854278e-10, 'constant_value': 0.11754011610419235, 'nu': 0.5}. Best is trial 959 with value: 0.1375110730946576.
[I 2024-12-04 20:40:52,860] Trial 1390 finished with value: 0.1424962319321727 and parameters: {'kernel_type': 'Matern', 'length_scale': 7.967535626170905, 'noise_level': 0.040033241551623765, 'constant_value': 54.94210516531763, 'nu': 1.5}. Best is trial 959 with value: 0.1375110730946576.
[I 2024-12-04 20:40:54,133] Trial 1391 finished with value: 0.142495036160623 and parameters: {'kernel_type': 'Matern', 'length_scale': 693.2314263246842, 'noise_level': 0.1234833710911826, 'constant_value': 2599.3554766626785, 'nu': 1.5}. Best is trial 959 with value: 0.1375110730946576.
[I 2024-12-04 20:40:55,951] Trial 1392 finished with value: 0.9982167338040159 and parameters: {'kernel_type': 'RBF', 'length_scale': 0.025331667223210386, 'noise_level': 1.770426943052003e-06, 'constant_value': 33.71300527401195, 'nu': 0.5}. Best is trial 959 with value: 0.1375110730946576.
[I 2024-12-04 20:40:58,639] Trial 1394 finished with value: 0.9982167338041036 and parameters: {'kernel_type': 'RBF', 'length_scale': 9.015485828609663e-05, 'noise_level': 6.962664437124597e-09, 'constant_value': 1.432193560740173, 'nu': 0.5}. Best is trial 959 with value: 0.1375110730946576.
[I 2024-12-04 20:41:02,602] Trial 1395 finished with value: 0.14249518071884168 and parameters: {'kernel_type': 'Matern', 'length_scale': 220.95141360033318, 'noise_level': 0.6719778159353013, 'constant_value': 784.8418111288779, 'nu': 1.5}. Best is trial 959 with value: 0.1375110730946576.
[I 2024-12-04 20:41:03,838] Trial 1393 finished with value: 0.1424944727905253 and parameters: {'kernel_type': 'Matern', 'length_scale': 32.51018292689111, 'noise_level': 0.023833391491247476, 'constant_value': 0.296072382827123, 'nu': 1.5}. Best is trial 959 with value: 0.1375110730946576.
[I 2024-12-04 20:41:05,290] Trial 1396 finished with value: 0.14249511495898143 and parameters: {'kernel_type': 'Matern', 'length_scale': 16.308556957660596, 'noise_level': 0.0436236976063302, 'constant_value': 51059.06996845674, 'nu': 1.5}. Best is trial 959 with value: 0.1375110730946576.
[I 2024-12-04 20:41:09,197] Trial 1397 finished with value: 0.9864686819226303 and parameters: {'kernel_type': 'Matern', 'length_scale': 395.09917336879187, 'noise_level': 0.0009348570626596149, 'constant_value': 254.71415956786092, 'nu': 1.5}. Best is trial 959 with value: 0.1375110730946576.
[I 2024-12-04 20:41:14,475] Trial 1399 finished with value: 0.14249505353741423 and parameters: {'kernel_type': 'Matern', 'length_scale': 191.65376567294138, 'noise_level': 0.07895291264385375, 'constant_value': 0.8713808321133765, 'nu': 1.5}. Best is trial 959 with value: 0.1375110730946576.
[I 2024-12-04 20:41:16,082] Trial 1398 finished with value: 0.14249484783420982 and parameters: {'kernel_type': 'Matern', 'length_scale': 1.6218404334520997, 'noise_level': 0.2308873314780852, 'constant_value': 0.05153170199143128, 'nu': 1.5}. Best is trial 959 with value: 0.1375110730946576.
[I 2024-12-04 20:41:16,513] Trial 1400 finished with value: 0.14249547144779676 and parameters: {'kernel_type': 'Matern', 'length_scale': 8.806182912002978, 'noise_level': 0.007875286851578279, 'constant_value': 4.7874283648373614, 'nu': 1.5}. Best is trial 959 with value: 0.1375110730946576.
[I 2024-12-04 20:41:25,261] Trial 1402 finished with value: 0.1424948877080113 and parameters: {'kernel_type': 'Matern', 'length_scale': 209.57491460862468, 'noise_level': 0.048293794931943454, 'constant_value': 0.7247867110265239, 'nu': 1.5}. Best is trial 959 with value: 0.1375110730946576.
[I 2024-12-04 20:41:26,041] Trial 1401 finished with value: 0.9864686819229992 and parameters: {'kernel_type': 'Matern', 'length_scale': 11.569140492687593, 'noise_level': 0.0018589980135375963, 'constant_value': 0.00032676575155945385, 'nu': 1.5}. Best is trial 959 with value: 0.1375110730946576.
[I 2024-12-04 20:41:27,286] Trial 1403 finished with value: 0.9864686819307825 and parameters: {'kernel_type': 'RBF', 'length_scale': 1014.2637037608612, 'noise_level': 1.8083827284148136e-07, 'constant_value': 1790.3018574518749, 'nu': 2.5}. Best is trial 959 with value: 0.1375110730946576.
[I 2024-12-04 20:41:32,990] Trial 1406 finished with value: 0.9864686819234778 and parameters: {'kernel_type': 'RBF', 'length_scale': 0.0036637320546290004, 'noise_level': 6.558669169323288e-07, 'constant_value': 5.620013667624699e-05, 'nu': 2.5}. Best is trial 959 with value: 0.1375110730946576.
[I 2024-12-04 20:41:33,779] Trial 1404 finished with value: 0.14249488737057192 and parameters: {'kernel_type': 'Matern', 'length_scale': 1.7107433379040367, 'noise_level': 0.026561160267543987, 'constant_value': 0.003953770843407885, 'nu': 1.5}. Best is trial 959 with value: 0.1375110730946576.
[I 2024-12-04 20:41:37,396] Trial 1405 finished with value: 0.9864686819151063 and parameters: {'kernel_type': 'Matern', 'length_scale': 584.5343294062592, 'noise_level': 0.010513624678016004, 'constant_value': 0.015236260201210786, 'nu': 1.5}. Best is trial 959 with value: 0.1375110730946576.
[I 2024-12-04 20:41:38,812] Trial 1407 finished with value: 0.9864686820402447 and parameters: {'kernel_type': 'Matern', 'length_scale': 13.111397361292202, 'noise_level': 5.513868769791993e-05, 'constant_value': 0.01689470988641807, 'nu': 1.5}. Best is trial 959 with value: 0.1375110730946576.
[I 2024-12-04 20:41:44,433] Trial 1408 finished with value: 0.1424952419113464 and parameters: {'kernel_type': 'Matern', 'length_scale': 31.06626674555502, 'noise_level': 0.2587313532659153, 'constant_value': 0.015403402032950026, 'nu': 1.5}. Best is trial 959 with value: 0.1375110730946576.
[I 2024-12-04 20:41:48,560] Trial 1409 finished with value: 0.1446988090262798 and parameters: {'kernel_type': 'Matern', 'length_scale': 0.13080260627477594, 'noise_level': 9.188974197412579e-06, 'constant_value': 2.8620538470842374e-07, 'nu': 2.5}. Best is trial 959 with value: 0.1375110730946576.
[I 2024-12-04 20:41:53,681] Trial 1410 finished with value: 0.9864686819405409 and parameters: {'kernel_type': 'Matern', 'length_scale': 64.29924657010213, 'noise_level': 0.004299429586704722, 'constant_value': 0.06570145899013735, 'nu': 1.5}. Best is trial 959 with value: 0.1375110730946576.
[I 2024-12-04 20:41:55,891] Trial 1412 finished with value: 0.14249506274878856 and parameters: {'kernel_type': 'Matern', 'length_scale': 1.4597626251143923, 'noise_level': 0.047833329305919686, 'constant_value': 0.09573476490593773, 'nu': 1.5}. Best is trial 959 with value: 0.1375110730946576.
[I 2024-12-04 20:41:56,540] Trial 1411 finished with value: 0.986468681945631 and parameters: {'kernel_type': 'RBF', 'length_scale': 15.155005731460191, 'noise_level': 2.1724373874786894e-05, 'constant_value': 4.827632386731844e-07, 'nu': 2.5}. Best is trial 959 with value: 0.1375110730946576.
[I 2024-12-04 20:42:03,388] Trial 1414 finished with value: 0.14249495135304208 and parameters: {'kernel_type': 'Matern', 'length_scale': 1.2285321861328682, 'noise_level': 0.05487667894385498, 'constant_value': 0.10198928728049603, 'nu': 1.5}. Best is trial 959 with value: 0.1375110730946576.
[I 2024-12-04 20:42:04,605] Trial 1413 finished with value: 0.14249506390583783 and parameters: {'kernel_type': 'Matern', 'length_scale': 20.950274391021082, 'noise_level': 0.034393388462397076, 'constant_value': 0.13820181320423497, 'nu': 1.5}. Best is trial 959 with value: 0.1375110730946576.
[I 2024-12-04 20:42:09,131] Trial 1415 finished with value: 0.9864686819226305 and parameters: {'kernel_type': 'Matern', 'length_scale': 253.30640907407582, 'noise_level': 0.03158903421962161, 'constant_value': 0.029436715555857175, 'nu': 1.5}. Best is trial 959 with value: 0.1375110730946576.
[I 2024-12-04 20:42:09,682] Trial 1416 finished with value: 0.9864683674305204 and parameters: {'kernel_type': 'Matern', 'length_scale': 5.199349864559558, 'noise_level': 0.004577042094899957, 'constant_value': 0.22007215587335702, 'nu': 1.5}. Best is trial 959 with value: 0.1375110730946576.
[I 2024-12-04 20:42:11,270] Trial 1417 finished with value: 0.1477103609963188 and parameters: {'kernel_type': 'RBF', 'length_scale': 255.89655903674205, 'noise_level': 0.3633701896384775, 'constant_value': 8306.338173517523, 'nu': 1.5}. Best is trial 959 with value: 0.1375110730946576.
[I 2024-12-04 20:42:15,137] Trial 1418 finished with value: 0.14771037459974956 and parameters: {'kernel_type': 'RBF', 'length_scale': 0.9422961503394652, 'noise_level': 0.9370089314115279, 'constant_value': 545.5551724799544, 'nu': 1.5}. Best is trial 959 with value: 0.1375110730946576.
[I 2024-12-04 20:42:18,908] Trial 1420 finished with value: 0.1424950884934832 and parameters: {'kernel_type': 'Matern', 'length_scale': 1.7158773701878802, 'noise_level': 0.9551994500853567, 'constant_value': 5.832257333389711, 'nu': 1.5}. Best is trial 959 with value: 0.1375110730946576.
[I 2024-12-04 20:42:19,718] Trial 1421 finished with value: 0.9982165923384225 and parameters: {'kernel_type': 'Matern', 'length_scale': 24.417615076884964, 'noise_level': 7.46493506817619e-10, 'constant_value': 24.174398591290306, 'nu': 0.5}. Best is trial 959 with value: 0.1375110730946576.
[I 2024-12-04 20:42:20,588] Trial 1419 finished with value: 0.13821333517700582 and parameters: {'kernel_type': 'Matern', 'length_scale': 2.081255892498952, 'noise_level': 0.8105249248242412, 'constant_value': 0.821578526079636, 'nu': 1.5}. Best is trial 959 with value: 0.1375110730946576.
[I 2024-12-04 20:42:23,224] Trial 1422 finished with value: 0.9982167338040346 and parameters: {'kernel_type': 'RBF', 'length_scale': 5.758212998731208e-05, 'noise_level': 9.528358421803097e-09, 'constant_value': 9.392585123056255, 'nu': 2.5}. Best is trial 959 with value: 0.1375110730946576.
[I 2024-12-04 20:42:27,511] Trial 1423 finished with value: 0.9864686816651145 and parameters: {'kernel_type': 'Matern', 'length_scale': 244.60355081597194, 'noise_level': 0.00013201803927286886, 'constant_value': 0.6963229048937136, 'nu': 1.5}. Best is trial 959 with value: 0.1375110730946576.
[I 2024-12-04 20:42:28,309] Trial 1424 finished with value: 0.14249506358718964 and parameters: {'kernel_type': 'Matern', 'length_scale': 2.1742006869532338, 'noise_level': 0.2602075656663749, 'constant_value': 0.05732632340816055, 'nu': 1.5}. Best is trial 959 with value: 0.1375110730946576.
[I 2024-12-04 20:42:31,066] Trial 1426 finished with value: 0.9982074601480984 and parameters: {'kernel_type': 'Matern', 'length_scale': 0.3288891615177668, 'noise_level': 0.4798024507645107, 'constant_value': 0.00013099618805640194, 'nu': 1.5}. Best is trial 959 with value: 0.1375110730946576.
[I 2024-12-04 20:42:37,631] Trial 1427 finished with value: 0.14249506327450664 and parameters: {'kernel_type': 'Matern', 'length_scale': 0.39009156831917563, 'noise_level': 0.005274380132246035, 'constant_value': 9.917136084386696, 'nu': 1.5}. Best is trial 959 with value: 0.1375110730946576.
[I 2024-12-04 20:42:37,833] Trial 1425 finished with value: 0.1424951368194834 and parameters: {'kernel_type': 'Matern', 'length_scale': 0.12624126275860745, 'noise_level': 0.044437397531737956, 'constant_value': 65.40676845301185, 'nu': 1.5}. Best is trial 959 with value: 0.1375110730946576.
[I 2024-12-04 20:42:51,991] Trial 1428 finished with value: 0.9864686830727459 and parameters: {'kernel_type': 'Matern', 'length_scale': 0.02501953900715533, 'noise_level': 0.10851565436378656, 'constant_value': 0.0034767079718850996, 'nu': 1.5}. Best is trial 959 with value: 0.1375110730946576.
[I 2024-12-04 20:42:55,231] Trial 1429 finished with value: 0.1424951465919146 and parameters: {'kernel_type': 'Matern', 'length_scale': 0.18650375731257593, 'noise_level': 0.5876558684250418, 'constant_value': 0.8792492534139249, 'nu': 1.5}. Best is trial 959 with value: 0.1375110730946576.
[I 2024-12-04 20:42:55,522] Trial 1430 finished with value: 0.9864686819243562 and parameters: {'kernel_type': 'Matern', 'length_scale': 10302.125969129966, 'noise_level': 4.77392930434496e-10, 'constant_value': 0.3962392891395767, 'nu': 2.5}. Best is trial 959 with value: 0.1375110730946576.
[I 2024-12-04 20:43:01,684] Trial 1431 finished with value: 0.9864686820117939 and parameters: {'kernel_type': 'Matern', 'length_scale': 7.306052313651065, 'noise_level': 0.0014942026896660459, 'constant_value': 0.0004164459347473253, 'nu': 0.5}. Best is trial 959 with value: 0.1375110730946576.
[I 2024-12-04 20:43:03,671] Trial 1432 finished with value: 0.14249506363106668 and parameters: {'kernel_type': 'Matern', 'length_scale': 1.1882032009884613, 'noise_level': 0.9063074019549852, 'constant_value': 603.2091949324063, 'nu': 1.5}. Best is trial 959 with value: 0.1375110730946576.
[I 2024-12-04 20:43:07,980] Trial 1434 finished with value: 0.9864686780412044 and parameters: {'kernel_type': 'Matern', 'length_scale': 0.07976692301919781, 'noise_level': 0.9166763925563934, 'constant_value': 0.39432765100996836, 'nu': 1.5}. Best is trial 959 with value: 0.1375110730946576.
[I 2024-12-04 20:43:09,585] Trial 1433 finished with value: 0.9864686819207087 and parameters: {'kernel_type': 'Matern', 'length_scale': 60702.92259657306, 'noise_level': 9.187903408521894e-10, 'constant_value': 2.5795409623005907e-05, 'nu': 0.5}. Best is trial 959 with value: 0.1375110730946576.
[I 2024-12-04 20:43:12,702] Trial 1435 finished with value: 0.1377044708106642 and parameters: {'kernel_type': 'Matern', 'length_scale': 6.411965800561729, 'noise_level': 0.7405591780170401, 'constant_value': 0.08430438299764612, 'nu': 1.5}. Best is trial 959 with value: 0.1375110730946576.
[I 2024-12-04 20:43:15,133] Trial 1436 finished with value: 0.14249504545429842 and parameters: {'kernel_type': 'Matern', 'length_scale': 8.18726808795579, 'noise_level': 0.8178175925152652, 'constant_value': 10.806843241596415, 'nu': 1.5}. Best is trial 959 with value: 0.1375110730946576.
[I 2024-12-04 20:43:18,607] Trial 1437 finished with value: 0.14249479886587324 and parameters: {'kernel_type': 'Matern', 'length_scale': 0.33324222571294926, 'noise_level': 0.5373427223608067, 'constant_value': 0.04060051427679881, 'nu': 1.5}. Best is trial 959 with value: 0.1375110730946576.
[I 2024-12-04 20:43:22,003] Trial 1438 finished with value: 0.14249500988610664 and parameters: {'kernel_type': 'Matern', 'length_scale': 0.28672328604189645, 'noise_level': 0.6220939383418305, 'constant_value': 0.09607155730919129, 'nu': 1.5}. Best is trial 959 with value: 0.1375110730946576.
[I 2024-12-04 20:43:22,893] Trial 1439 finished with value: 0.1424950554966105 and parameters: {'kernel_type': 'Matern', 'length_scale': 36.80864498807919, 'noise_level': 0.8292536961094817, 'constant_value': 0.10023634176025864, 'nu': 1.5}. Best is trial 959 with value: 0.1375110730946576.
[I 2024-12-04 20:43:30,414] Trial 1441 finished with value: 0.14249510175081653 and parameters: {'kernel_type': 'Matern', 'length_scale': 2.1188718507625635, 'noise_level': 0.39916571479313745, 'constant_value': 0.028537070237810387, 'nu': 1.5}. Best is trial 959 with value: 0.1375110730946576.
[I 2024-12-04 20:43:31,503] Trial 1440 finished with value: 0.14249521067735677 and parameters: {'kernel_type': 'Matern', 'length_scale': 8.69530865192533, 'noise_level': 0.05235084181321177, 'constant_value': 0.06853148949717432, 'nu': 1.5}. Best is trial 959 with value: 0.1375110730946576.
[I 2024-12-04 20:43:33,468] Trial 1442 finished with value: 0.9864686817815832 and parameters: {'kernel_type': 'Matern', 'length_scale': 36765.70588618921, 'noise_level': 0.00028160837137930413, 'constant_value': 17.95975089533156, 'nu': 2.5}. Best is trial 959 with value: 0.1375110730946576.
[I 2024-12-04 20:43:40,449] Trial 1443 finished with value: 0.1424950506225924 and parameters: {'kernel_type': 'Matern', 'length_scale': 0.27223138333387303, 'noise_level': 0.8144785755335087, 'constant_value': 2.2319480541897674, 'nu': 1.5}. Best is trial 959 with value: 0.1375110730946576.
[I 2024-12-04 20:43:41,808] Trial 1445 finished with value: 0.14249518233959182 and parameters: {'kernel_type': 'Matern', 'length_scale': 22.55519758722937, 'noise_level': 0.30542368507477213, 'constant_value': 12.106336355386253, 'nu': 1.5}. Best is trial 959 with value: 0.1375110730946576.
[I 2024-12-04 20:43:42,885] Trial 1444 finished with value: 0.14249505386884756 and parameters: {'kernel_type': 'Matern', 'length_scale': 30.223950279132104, 'noise_level': 0.12337778004580684, 'constant_value': 0.05501356481299199, 'nu': 1.5}. Best is trial 959 with value: 0.1375110730946576.
[I 2024-12-04 20:43:48,603] Trial 1446 finished with value: 0.14249506579519425 and parameters: {'kernel_type': 'Matern', 'length_scale': 5.239350345907918, 'noise_level': 0.7948916690974378, 'constant_value': 0.04676515981852325, 'nu': 1.5}. Best is trial 959 with value: 0.1375110730946576.
[I 2024-12-04 20:43:52,198] Trial 1448 finished with value: 0.14249506087849395 and parameters: {'kernel_type': 'Matern', 'length_scale': 18.242554862340015, 'noise_level': 0.5554681900691328, 'constant_value': 0.02636866636760534, 'nu': 1.5}. Best is trial 959 with value: 0.1375110730946576.
[I 2024-12-04 20:43:55,044] Trial 1447 finished with value: 0.14249510725801248 and parameters: {'kernel_type': 'Matern', 'length_scale': 0.6199153709225114, 'noise_level': 0.8015850715413554, 'constant_value': 0.6230731027196076, 'nu': 1.5}. Best is trial 959 with value: 0.1375110730946576.
[I 2024-12-04 20:43:56,812] Trial 1449 finished with value: 0.14249505593389475 and parameters: {'kernel_type': 'Matern', 'length_scale': 3.5153026997951415, 'noise_level': 0.6574516890831976, 'constant_value': 3.401121936407931, 'nu': 1.5}. Best is trial 959 with value: 0.1375110730946576.
[I 2024-12-04 20:44:04,433] Trial 1452 finished with value: 0.14249517883922208 and parameters: {'kernel_type': 'Matern', 'length_scale': 4.2960823687537975, 'noise_level': 0.3385276213320666, 'constant_value': 0.002567533142921761, 'nu': 1.5}. Best is trial 959 with value: 0.1375110730946576.
