[I 2024-12-04 15:16:06,919] Trial 2029 finished with value: 0.4883034283334868 and parameters: {'kernel_type': 'Matern', 'length_scale': 6914.678249890278, 'noise_level': 0.9006827680252102, 'constant_value': 884.3559870797516, 'nu': 0.5}. Best is trial 386 with value: 0.4872991004520934.
[I 2024-12-04 15:16:07,174] Trial 2035 finished with value: 0.48830342310876723 and parameters: {'kernel_type': 'Matern', 'length_scale': 3286.4026481903447, 'noise_level': 0.04424391332272443, 'constant_value': 1335.6592131166806, 'nu': 0.5}. Best is trial 386 with value: 0.4872991004520934.
[I 2024-12-04 15:16:07,551] Trial 2031 finished with value: 0.48830341706207353 and parameters: {'kernel_type': 'Matern', 'length_scale': 4164.102827028123, 'noise_level': 0.014866730973783758, 'constant_value': 1419.1318664962523, 'nu': 0.5}. Best is trial 386 with value: 0.4872991004520934.
[I 2024-12-04 15:16:07,553] Trial 2016 finished with value: 0.48830608512267276 and parameters: {'kernel_type': 'Matern', 'length_scale': 6973.5315351109375, 'noise_level': 0.8281831541129295, 'constant_value': 669.7263855150001, 'nu': 0.5}. Best is trial 386 with value: 0.4872991004520934.
[I 2024-12-04 15:16:07,977] Trial 2023 finished with value: 0.48830341819068085 and parameters: {'kernel_type': 'Matern', 'length_scale': 141.35481746328293, 'noise_level': 0.8340595694804116, 'constant_value': 88092.7020726233, 'nu': 0.5}. Best is trial 386 with value: 0.4872991004520934.
[I 2024-12-04 15:16:08,968] Trial 2034 finished with value: 0.4883034217480164 and parameters: {'kernel_type': 'Matern', 'length_scale': 69257.03601072129, 'noise_level': 0.0071329282619602054, 'constant_value': 75112.35381529259, 'nu': 0.5}. Best is trial 386 with value: 0.4872991004520934.
[I 2024-12-04 15:16:09,264] Trial 2037 finished with value: 0.48830327281327013 and parameters: {'kernel_type': 'Matern', 'length_scale': 98416.63785609484, 'noise_level': 0.15049628665450637, 'constant_value': 49809.8353578549, 'nu': 0.5}. Best is trial 386 with value: 0.4872991004520934.
[I 2024-12-04 15:16:11,258] Trial 2027 finished with value: 0.48830344936101533 and parameters: {'kernel_type': 'Matern', 'length_scale': 95455.6176034618, 'noise_level': 0.7785363545594115, 'constant_value': 74794.11851627796, 'nu': 0.5}. Best is trial 386 with value: 0.4872991004520934.
[I 2024-12-04 15:16:11,460] Trial 2024 finished with value: 0.48830341022072576 and parameters: {'kernel_type': 'Matern', 'length_scale': 6050.761285610598, 'noise_level': 0.8915030335592672, 'constant_value': 593.6421613563347, 'nu': 0.5}. Best is trial 386 with value: 0.4872991004520934.
[I 2024-12-04 15:16:12,013] Trial 2025 finished with value: 0.4883034188295776 and parameters: {'kernel_type': 'Matern', 'length_scale': 73724.57696888562, 'noise_level': 0.9405098542760244, 'constant_value': 47.304175860526485, 'nu': 0.5}. Best is trial 386 with value: 0.4872991004520934.
[I 2024-12-04 15:16:13,949] Trial 2033 finished with value: 0.48830342011454075 and parameters: {'kernel_type': 'Matern', 'length_scale': 2406.799085168569, 'noise_level': 0.01683135552369255, 'constant_value': 94656.98793868351, 'nu': 0.5}. Best is trial 386 with value: 0.4872991004520934.
[I 2024-12-04 15:16:14,226] Trial 2036 finished with value: 1.240111232458854 and parameters: {'kernel_type': 'Matern', 'length_scale': 4029.028981183466, 'noise_level': 0.014603721653924682, 'constant_value': 5.818626025290783, 'nu': 0.5}. Best is trial 386 with value: 0.4872991004520934.
[I 2024-12-04 15:16:14,545] Trial 2041 finished with value: 0.48830342501746454 and parameters: {'kernel_type': 'Matern', 'length_scale': 2814.587810298639, 'noise_level': 0.9094426753714882, 'constant_value': 573.6389191007038, 'nu': 0.5}. Best is trial 386 with value: 0.4872991004520934.
[I 2024-12-04 15:16:14,596] Trial 2032 finished with value: 1.2401112325671428 and parameters: {'kernel_type': 'Matern', 'length_scale': 28067.150353284844, 'noise_level': 0.0015722545989360097, 'constant_value': 7.884233366516939, 'nu': 1.5}. Best is trial 386 with value: 0.4872991004520934.
[I 2024-12-04 15:16:16,931] Trial 2038 finished with value: 1.2614547953941473 and parameters: {'kernel_type': 'Matern', 'length_scale': 392.23976853214555, 'noise_level': 0.027746056682477198, 'constant_value': 880.3857211675692, 'nu': 0.5}. Best is trial 386 with value: 0.4872991004520934.
[I 2024-12-04 15:16:17,099] Trial 2043 finished with value: 1.240111232620413 and parameters: {'kernel_type': 'Matern', 'length_scale': 89824.97779984905, 'noise_level': 0.022064650547944036, 'constant_value': 31.453828197704865, 'nu': 0.5}. Best is trial 386 with value: 0.4872991004520934.
[I 2024-12-04 15:16:17,276] Trial 2044 finished with value: 0.4883032980630886 and parameters: {'kernel_type': 'Matern', 'length_scale': 58.79702337616803, 'noise_level': 0.9978104143307681, 'constant_value': 2.9103857928108554, 'nu': 0.5}. Best is trial 386 with value: 0.4872991004520934.
[I 2024-12-04 15:16:18,413] Trial 2040 finished with value: 0.4883034206114679 and parameters: {'kernel_type': 'Matern', 'length_scale': 2224.7934513042323, 'noise_level': 0.0014421839733961513, 'constant_value': 2946.496785750874, 'nu': 0.5}. Best is trial 386 with value: 0.4872991004520934.
[I 2024-12-04 15:16:20,115] Trial 2048 finished with value: 1.261454792512136 and parameters: {'kernel_type': 'Matern', 'length_scale': 99981.2407509626, 'noise_level': 0.07133388731734118, 'constant_value': 0.11558180015600324, 'nu': 0.5}. Best is trial 386 with value: 0.4872991004520934.
[I 2024-12-04 15:16:20,511] Trial 2053 finished with value: 0.488303430455891 and parameters: {'kernel_type': 'Matern', 'length_scale': 85.1411250505423, 'noise_level': 0.015699736231951655, 'constant_value': 733.4019214824297, 'nu': 0.5}. Best is trial 386 with value: 0.4872991004520934.
[I 2024-12-04 15:16:21,616] Trial 2045 finished with value: 0.5663939178859266 and parameters: {'kernel_type': 'Matern', 'length_scale': 39.00048724480307, 'noise_level': 0.1645261536172573, 'constant_value': 34713.376605197096, 'nu': 2.5}. Best is trial 386 with value: 0.4872991004520934.
[I 2024-12-04 15:16:21,623] Trial 2039 finished with value: 0.4883034188773606 and parameters: {'kernel_type': 'Matern', 'length_scale': 7114.887371817132, 'noise_level': 0.024439061407054555, 'constant_value': 859.177339604699, 'nu': 0.5}. Best is trial 386 with value: 0.4872991004520934.
[I 2024-12-04 15:16:21,746] Trial 2049 finished with value: 0.4883033684093786 and parameters: {'kernel_type': 'Matern', 'length_scale': 2028.7015910075309, 'noise_level': 0.005895599089296552, 'constant_value': 74223.45404858392, 'nu': 0.5}. Best is trial 386 with value: 0.4872991004520934.
[I 2024-12-04 15:16:22,488] Trial 2050 finished with value: 1.2614547953941473 and parameters: {'kernel_type': 'Matern', 'length_scale': 10.434489292987516, 'noise_level': 0.0006095421520434281, 'constant_value': 85265.5673570728, 'nu': 0.5}. Best is trial 386 with value: 0.4872991004520934.
[I 2024-12-04 15:16:23,898] Trial 2054 finished with value: 0.4883034151870548 and parameters: {'kernel_type': 'Matern', 'length_scale': 1220.1611109177031, 'noise_level': 0.014657427952514542, 'constant_value': 85195.9422427874, 'nu': 0.5}. Best is trial 386 with value: 0.4872991004520934.
[I 2024-12-04 15:16:23,903] Trial 2047 finished with value: 0.48830341846443553 and parameters: {'kernel_type': 'Matern', 'length_scale': 216.29818408875605, 'noise_level': 0.845566496390899, 'constant_value': 431.927720959424, 'nu': 0.5}. Best is trial 386 with value: 0.4872991004520934.
[I 2024-12-04 15:16:24,197] Trial 2060 finished with value: 0.4883035001237658 and parameters: {'kernel_type': 'Matern', 'length_scale': 2453.81428021206, 'noise_level': 0.7564570121326392, 'constant_value': 84813.49756148773, 'nu': 0.5}. Best is trial 386 with value: 0.4872991004520934.
[I 2024-12-04 15:16:24,243] Trial 2046 finished with value: 1.240111232356294 and parameters: {'kernel_type': 'Matern', 'length_scale': 50052.03426786848, 'noise_level': 0.003753860044311561, 'constant_value': 47007.80235923379, 'nu': 2.5}. Best is trial 386 with value: 0.4872991004520934.
[I 2024-12-04 15:16:25,092] Trial 2051 finished with value: 0.6443853117783065 and parameters: {'kernel_type': 'RBF', 'length_scale': 6.163131981407784, 'noise_level': 0.004613806910328978, 'constant_value': 26262.63770436746, 'nu': 0.5}. Best is trial 386 with value: 0.4872991004520934.
[I 2024-12-04 15:16:25,849] Trial 2055 finished with value: 0.48830342806833066 and parameters: {'kernel_type': 'Matern', 'length_scale': 94613.25450857889, 'noise_level': 0.0400135371696104, 'constant_value': 536.2146316815665, 'nu': 0.5}. Best is trial 386 with value: 0.4872991004520934.
[I 2024-12-04 15:16:26,348] Trial 2059 finished with value: 1.2614547953941473 and parameters: {'kernel_type': 'Matern', 'length_scale': 128.14949008147698, 'noise_level': 0.03198339163479917, 'constant_value': 96827.75538034359, 'nu': 0.5}. Best is trial 386 with value: 0.4872991004520934.
[I 2024-12-04 15:16:26,430] Trial 2057 finished with value: 0.4883034128303257 and parameters: {'kernel_type': 'Matern', 'length_scale': 87451.64887574162, 'noise_level': 0.21716957325909123, 'constant_value': 62386.666253535346, 'nu': 0.5}. Best is trial 386 with value: 0.4872991004520934.
[I 2024-12-04 15:16:27,054] Trial 2042 finished with value: 0.4883034194455308 and parameters: {'kernel_type': 'Matern', 'length_scale': 3621.8349861442503, 'noise_level': 0.0003157525658903148, 'constant_value': 88484.5939859909, 'nu': 0.5}. Best is trial 386 with value: 0.4872991004520934.
[I 2024-12-04 15:16:27,866] Trial 2052 finished with value: 0.4883034152793461 and parameters: {'kernel_type': 'Matern', 'length_scale': 42.482665205347864, 'noise_level': 0.04159774065031495, 'constant_value': 1363.8827838996713, 'nu': 0.5}. Best is trial 386 with value: 0.4872991004520934.
[I 2024-12-04 15:16:30,600] Trial 2061 finished with value: 0.4883034152457558 and parameters: {'kernel_type': 'Matern', 'length_scale': 3329.755223853535, 'noise_level': 0.05079605180142865, 'constant_value': 671.6684106100827, 'nu': 0.5}. Best is trial 386 with value: 0.4872991004520934.
[I 2024-12-04 15:16:30,676] Trial 2058 finished with value: 0.4883034177738998 and parameters: {'kernel_type': 'Matern', 'length_scale': 7639.824537971534, 'noise_level': 0.012391498074079443, 'constant_value': 1516.0956487569424, 'nu': 0.5}. Best is trial 386 with value: 0.4872991004520934.
[I 2024-12-04 15:16:30,929] Trial 2056 finished with value: 1.2614546630188692 and parameters: {'kernel_type': 'Matern', 'length_scale': 1750.154124706056, 'noise_level': 0.4439337083421296, 'constant_value': 1.8023738554170206, 'nu': 2.5}. Best is trial 386 with value: 0.4872991004520934.
[I 2024-12-04 15:16:31,847] Trial 2065 finished with value: 0.48830341836412516 and parameters: {'kernel_type': 'Matern', 'length_scale': 4782.8448180613395, 'noise_level': 0.0120897133321159, 'constant_value': 1552.9415060210647, 'nu': 0.5}. Best is trial 386 with value: 0.4872991004520934.
[I 2024-12-04 15:16:32,509] Trial 2063 finished with value: 0.4883033640810115 and parameters: {'kernel_type': 'Matern', 'length_scale': 85808.4135362702, 'noise_level': 0.0038323068962535832, 'constant_value': 96432.94265611, 'nu': 0.5}. Best is trial 386 with value: 0.4872991004520934.
[I 2024-12-04 15:16:32,854] Trial 2072 finished with value: 0.48830301208345833 and parameters: {'kernel_type': 'Matern', 'length_scale': 5627.963866124803, 'noise_level': 0.778392079870701, 'constant_value': 15.1544093767855, 'nu': 0.5}. Best is trial 386 with value: 0.4872991004520934.
[I 2024-12-04 15:16:32,872] Trial 2066 finished with value: 0.48830339163195396 and parameters: {'kernel_type': 'Matern', 'length_scale': 1.1945469735780403, 'noise_level': 0.7626032654258035, 'constant_value': 1495.5901249050517, 'nu': 0.5}. Best is trial 386 with value: 0.4872991004520934.
[I 2024-12-04 15:16:33,113] Trial 2069 finished with value: 1.261454795069617 and parameters: {'kernel_type': 'Matern', 'length_scale': 4421.686947876135, 'noise_level': 9.74116197140996e-05, 'constant_value': 97666.6025398339, 'nu': 0.5}. Best is trial 386 with value: 0.4872991004520934.
[I 2024-12-04 15:16:34,838] Trial 2070 finished with value: 1.2614543702026677 and parameters: {'kernel_type': 'Matern', 'length_scale': 0.002353448624495399, 'noise_level': 1.0541198753234086e-10, 'constant_value': 651.700299419913, 'nu': 2.5}. Best is trial 386 with value: 0.4872991004520934.
[I 2024-12-04 15:16:35,532] Trial 2062 finished with value: 0.48830460466570763 and parameters: {'kernel_type': 'Matern', 'length_scale': 6663.155013551353, 'noise_level': 0.03246039397635637, 'constant_value': 1768.156359675345, 'nu': 0.5}. Best is trial 386 with value: 0.4872991004520934.
[I 2024-12-04 15:16:36,995] Trial 2075 finished with value: 0.48830341516433207 and parameters: {'kernel_type': 'Matern', 'length_scale': 2458.8248537322283, 'noise_level': 0.8169614276699708, 'constant_value': 1665.336892416308, 'nu': 0.5}. Best is trial 386 with value: 0.4872991004520934.
[I 2024-12-04 15:16:37,279] Trial 2067 finished with value: 0.5663936701643391 and parameters: {'kernel_type': 'Matern', 'length_scale': 3654.346144452631, 'noise_level': 0.7935749368196953, 'constant_value': 34648.118053065446, 'nu': 2.5}. Best is trial 386 with value: 0.4872991004520934.
[I 2024-12-04 15:16:37,516] Trial 2077 finished with value: 0.48830342392357823 and parameters: {'kernel_type': 'Matern', 'length_scale': 92808.39773887304, 'noise_level': 0.011406890428295832, 'constant_value': 1177.088942484445, 'nu': 0.5}. Best is trial 386 with value: 0.4872991004520934.
[I 2024-12-04 15:16:38,488] Trial 2064 finished with value: 0.48830347029722926 and parameters: {'kernel_type': 'Matern', 'length_scale': 1758.4292968273844, 'noise_level': 0.04923528799423105, 'constant_value': 223.26975302689146, 'nu': 0.5}. Best is trial 386 with value: 0.4872991004520934.
[I 2024-12-04 15:16:39,608] Trial 2068 finished with value: 1.2401112361764206 and parameters: {'kernel_type': 'Matern', 'length_scale': 5454.780425108081, 'noise_level': 0.03129572070055047, 'constant_value': 1103.507461580322, 'nu': 1.5}. Best is trial 386 with value: 0.4872991004520934.
[I 2024-12-04 15:16:40,040] Trial 2079 finished with value: 0.4883034150806165 and parameters: {'kernel_type': 'Matern', 'length_scale': 33.06885051113533, 'noise_level': 0.6589202582854227, 'constant_value': 672.5799657539281, 'nu': 0.5}. Best is trial 386 with value: 0.4872991004520934.
[I 2024-12-04 15:16:40,141] Trial 2073 finished with value: 0.48830347007185615 and parameters: {'kernel_type': 'Matern', 'length_scale': 8.350774992095578, 'noise_level': 0.41173503839754433, 'constant_value': 1.134150716380856e-06, 'nu': 0.5}. Best is trial 386 with value: 0.4872991004520934.
[I 2024-12-04 15:16:40,305] Trial 2074 finished with value: 0.5663937180298375 and parameters: {'kernel_type': 'Matern', 'length_scale': 84695.716930029, 'noise_level': 0.3970649653273554, 'constant_value': 18212.133078761206, 'nu': 2.5}. Best is trial 386 with value: 0.4872991004520934.
[I 2024-12-04 15:16:40,423] Trial 2071 finished with value: 0.48830342119717957 and parameters: {'kernel_type': 'Matern', 'length_scale': 97583.1339620355, 'noise_level': 0.4629237737944271, 'constant_value': 26270.95934133338, 'nu': 0.5}. Best is trial 386 with value: 0.4872991004520934.
[I 2024-12-04 15:16:42,109] Trial 2078 finished with value: 0.48830350240549836 and parameters: {'kernel_type': 'Matern', 'length_scale': 1027.9381735379304, 'noise_level': 0.0004611669263711344, 'constant_value': 32.04651972655147, 'nu': 0.5}. Best is trial 386 with value: 0.4872991004520934.
[I 2024-12-04 15:16:43,054] Trial 2087 finished with value: 1.2614547976352477 and parameters: {'kernel_type': 'Matern', 'length_scale': 80616.94220275234, 'noise_level': 0.03298283328034198, 'constant_value': 208.15526710099044, 'nu': 1.5}. Best is trial 386 with value: 0.4872991004520934.
[I 2024-12-04 15:16:44,275] Trial 2083 finished with value: 1.2401112359949502 and parameters: {'kernel_type': 'Matern', 'length_scale': 99094.14019870697, 'noise_level': 0.0007702249857942577, 'constant_value': 271.55600690528905, 'nu': 0.5}. Best is trial 386 with value: 0.4872991004520934.
[I 2024-12-04 15:16:44,770] Trial 2085 finished with value: 0.48830341785644843 and parameters: {'kernel_type': 'Matern', 'length_scale': 239.21969818263955, 'noise_level': 0.09657334858305464, 'constant_value': 54.349056858261164, 'nu': 0.5}. Best is trial 386 with value: 0.4872991004520934.
[I 2024-12-04 15:16:45,569] Trial 2080 finished with value: 0.4883034078794093 and parameters: {'kernel_type': 'Matern', 'length_scale': 1293.026069123895, 'noise_level': 0.010130655230036027, 'constant_value': 97219.47526209593, 'nu': 0.5}. Best is trial 386 with value: 0.4872991004520934.
[I 2024-12-04 15:16:46,019] Trial 2081 finished with value: 0.4883034114862128 and parameters: {'kernel_type': 'Matern', 'length_scale': 12.978894834318986, 'noise_level': 0.8375477187866305, 'constant_value': 523.5030517416077, 'nu': 0.5}. Best is trial 386 with value: 0.4872991004520934.
[I 2024-12-04 15:16:46,112] Trial 2076 finished with value: 0.4883034163192606 and parameters: {'kernel_type': 'Matern', 'length_scale': 365.35116125307707, 'noise_level': 0.9124895915087275, 'constant_value': 56232.52281105599, 'nu': 0.5}. Best is trial 386 with value: 0.4872991004520934.
[I 2024-12-04 15:16:46,557] Trial 2082 finished with value: 0.4883034250736924 and parameters: {'kernel_type': 'Matern', 'length_scale': 98342.52278232285, 'noise_level': 0.9053279228820158, 'constant_value': 2.997691481569137, 'nu': 0.5}. Best is trial 386 with value: 0.4872991004520934.
[I 2024-12-04 15:16:46,673] Trial 2084 finished with value: 0.5663939164517028 and parameters: {'kernel_type': 'Matern', 'length_scale': 251.51354585191896, 'noise_level': 0.9508094863212392, 'constant_value': 65.73493264015023, 'nu': 2.5}. Best is trial 386 with value: 0.4872991004520934.
[I 2024-12-04 15:16:46,701] Trial 2088 finished with value: 0.4883034153084527 and parameters: {'kernel_type': 'Matern', 'length_scale': 43404.25167258335, 'noise_level': 0.8460111724380448, 'constant_value': 701.7638522800771, 'nu': 0.5}. Best is trial 386 with value: 0.4872991004520934.
[I 2024-12-04 15:16:48,986] Trial 2086 finished with value: 1.2401112326360901 and parameters: {'kernel_type': 'Matern', 'length_scale': 43.682755560142034, 'noise_level': 1.3298190018922202e-08, 'constant_value': 0.004409150231131493, 'nu': 0.5}. Best is trial 386 with value: 0.4872991004520934.
[I 2024-12-04 15:16:49,038] Trial 2089 finished with value: 0.4883036552455612 and parameters: {'kernel_type': 'Matern', 'length_scale': 61234.0440048385, 'noise_level': 0.024159088903093352, 'constant_value': 70225.79308104837, 'nu': 0.5}. Best is trial 386 with value: 0.4872991004520934.
[I 2024-12-04 15:16:49,594] Trial 2090 finished with value: 0.48830341804895644 and parameters: {'kernel_type': 'Matern', 'length_scale': 2462.8679575016167, 'noise_level': 0.749852421414893, 'constant_value': 76817.23856412477, 'nu': 0.5}. Best is trial 386 with value: 0.4872991004520934.
[I 2024-12-04 15:16:50,736] Trial 2094 finished with value: 0.6443853746886415 and parameters: {'kernel_type': 'RBF', 'length_scale': 0.5487752083271191, 'noise_level': 0.00047872021717272487, 'constant_value': 528.8916486196392, 'nu': 2.5}. Best is trial 386 with value: 0.4872991004520934.
[I 2024-12-04 15:16:51,011] Trial 2093 finished with value: 1.2614058157950154 and parameters: {'kernel_type': 'Matern', 'length_scale': 3365.8056094274907, 'noise_level': 0.006203299940266361, 'constant_value': 0.0241221239520571, 'nu': 0.5}. Best is trial 386 with value: 0.4872991004520934.
[I 2024-12-04 15:16:51,057] Trial 2095 finished with value: 0.48830301202602 and parameters: {'kernel_type': 'Matern', 'length_scale': 82167.82783829131, 'noise_level': 0.042333413133635145, 'constant_value': 2188.0876701201787, 'nu': 0.5}. Best is trial 386 with value: 0.4872991004520934.
[I 2024-12-04 15:16:51,382] Trial 2098 finished with value: 1.240111232583897 and parameters: {'kernel_type': 'RBF', 'length_scale': 2575.779009369699, 'noise_level': 0.012521003269740878, 'constant_value': 701.3868375653724, 'nu': 0.5}. Best is trial 386 with value: 0.4872991004520934.
[I 2024-12-04 15:16:52,453] Trial 2099 finished with value: 0.4883034174741854 and parameters: {'kernel_type': 'Matern', 'length_scale': 8534.775460822024, 'noise_level': 0.9299401251432122, 'constant_value': 72516.09496194759, 'nu': 0.5}. Best is trial 386 with value: 0.4872991004520934.
[I 2024-12-04 15:16:54,501] Trial 2096 finished with value: 0.4883034203665834 and parameters: {'kernel_type': 'Matern', 'length_scale': 5645.646741871332, 'noise_level': 0.03378741846166771, 'constant_value': 1528.1748286557847, 'nu': 0.5}. Best is trial 386 with value: 0.4872991004520934.
[I 2024-12-04 15:16:56,493] Trial 2103 finished with value: 0.48830341908311203 and parameters: {'kernel_type': 'Matern', 'length_scale': 92494.52946647152, 'noise_level': 0.07390323111445445, 'constant_value': 81286.60285389697, 'nu': 0.5}. Best is trial 386 with value: 0.4872991004520934.
[I 2024-12-04 15:16:56,495] Trial 2092 finished with value: 0.4883034070916085 and parameters: {'kernel_type': 'Matern', 'length_scale': 961.895621730427, 'noise_level': 0.9878213578868836, 'constant_value': 83829.2475972264, 'nu': 0.5}. Best is trial 386 with value: 0.4872991004520934.
[I 2024-12-04 15:16:58,960] Trial 2107 finished with value: 1.2401112325684593 and parameters: {'kernel_type': 'Matern', 'length_scale': 6728.787380003197, 'noise_level': 0.02921909839803235, 'constant_value': 13.574064025407123, 'nu': 0.5}. Best is trial 386 with value: 0.4872991004520934.
