[I 2024-12-03 19:19:21,407] Trial 2190 finished with value: 0.13615915032450082 and parameters: {'kernel': 'linear', 'C': 89.74489463294847, 'gamma': 0.0012281295577610072, 'epsilon': 0.05165565282483534}. Best is trial 345 with value: 0.13438257115663557.
[I 2024-12-03 19:19:23,702] Trial 2219 finished with value: 0.1408638241520331 and parameters: {'kernel': 'linear', 'C': 6.291065418154637, 'gamma': 0.005311502435492828, 'epsilon': 0.08171694288979964}. Best is trial 345 with value: 0.13438257115663557.
[I 2024-12-03 19:19:24,189] Trial 2150 finished with value: 0.13761942899175722 and parameters: {'kernel': 'linear', 'C': 79.64540812331008, 'gamma': 0.00046803117158677923, 'epsilon': 0.0219441000400479}. Best is trial 345 with value: 0.13438257115663557.
[I 2024-12-03 19:19:24,190] Trial 2210 finished with value: 0.1372897119950403 and parameters: {'kernel': 'linear', 'C': 12.307408585617805, 'gamma': 0.0009653677485937667, 'epsilon': 0.019782668642845346}. Best is trial 345 with value: 0.13438257115663557.
[I 2024-12-03 19:19:24,903] Trial 2218 finished with value: 0.13604866968258175 and parameters: {'kernel': 'linear', 'C': 5.265047863959469, 'gamma': 0.002689032815245116, 'epsilon': 0.031805862772678696}. Best is trial 345 with value: 0.13438257115663557.
[I 2024-12-03 19:19:26,095] Trial 2123 finished with value: 0.1376978139551934 and parameters: {'kernel': 'linear', 'C': 99.40440835038326, 'gamma': 0.06979489472429694, 'epsilon': 0.013847791095595008}. Best is trial 345 with value: 0.13438257115663557.
[I 2024-12-03 19:19:26,675] Trial 2215 finished with value: 0.1349823373375725 and parameters: {'kernel': 'linear', 'C': 13.530222939119282, 'gamma': 0.0005489889808427116, 'epsilon': 0.03922948581023211}. Best is trial 345 with value: 0.13438257115663557.
[I 2024-12-03 19:19:26,996] Trial 2134 finished with value: 0.13786071886975798 and parameters: {'kernel': 'linear', 'C': 81.26302014153727, 'gamma': 0.0007632591662284444, 'epsilon': 0.012664382715674516}. Best is trial 345 with value: 0.13438257115663557.
[I 2024-12-03 19:19:28,391] Trial 2221 finished with value: 0.1376049632669581 and parameters: {'kernel': 'linear', 'C': 2.0312339814430875, 'gamma': 0.00025633666759504556, 'epsilon': 0.037910642801475256}. Best is trial 345 with value: 0.13438257115663557.
[I 2024-12-03 19:19:33,595] Trial 2223 finished with value: 0.13814814632156913 and parameters: {'kernel': 'linear', 'C': 5.5528692087702005, 'gamma': 0.007737286299232676, 'epsilon': 0.014420004463543476}. Best is trial 345 with value: 0.13438257115663557.
[I 2024-12-03 19:19:33,597] Trial 2168 finished with value: 0.135722823589772 and parameters: {'kernel': 'linear', 'C': 86.45383249380725, 'gamma': 0.0009150418374693506, 'epsilon': 0.03663828623460523}. Best is trial 345 with value: 0.13438257115663557.
[I 2024-12-03 19:19:34,753] Trial 2214 finished with value: 0.13760318601891228 and parameters: {'kernel': 'linear', 'C': 16.704033405959052, 'gamma': 0.0027980983768586963, 'epsilon': 0.018591516479147294}. Best is trial 345 with value: 0.13438257115663557.
[I 2024-12-03 19:19:37,528] Trial 2178 finished with value: 0.1348021792911698 and parameters: {'kernel': 'linear', 'C': 82.791337247828, 'gamma': 0.0004356785481504547, 'epsilon': 0.03248398993791793}. Best is trial 345 with value: 0.13438257115663557.
[I 2024-12-03 19:19:37,789] Trial 2220 finished with value: 0.13561768632594762 and parameters: {'kernel': 'linear', 'C': 14.309170389680855, 'gamma': 0.0007895236164212322, 'epsilon': 0.03243148407665125}. Best is trial 345 with value: 0.13438257115663557.
[I 2024-12-03 19:19:38,984] Trial 2231 finished with value: 5.571025783583127 and parameters: {'kernel': 'sigmoid', 'C': 2.0474603758864793, 'gamma': 0.006455994102262504, 'epsilon': 0.05590468505431723}. Best is trial 345 with value: 0.13438257115663557.
[I 2024-12-03 19:19:39,300] Trial 2147 finished with value: 0.13674136646423765 and parameters: {'kernel': 'linear', 'C': 87.6812118234004, 'gamma': 0.00011884862709961361, 'epsilon': 0.023769337345986335}. Best is trial 345 with value: 0.13438257115663557.
[I 2024-12-03 19:19:40,178] Trial 2230 finished with value: 0.13636811559398718 and parameters: {'kernel': 'linear', 'C': 5.631227944334606, 'gamma': 0.005839419755715514, 'epsilon': 0.04915094199823284}. Best is trial 345 with value: 0.13438257115663557.
[I 2024-12-03 19:19:41,248] Trial 2232 finished with value: 0.14467050860101477 and parameters: {'kernel': 'linear', 'C': 9.364005172553252, 'gamma': 0.0027866132355665145, 'epsilon': 0.11876530173604274}. Best is trial 345 with value: 0.13438257115663557.
[I 2024-12-03 19:19:43,024] Trial 2226 finished with value: 0.13802849498335695 and parameters: {'kernel': 'linear', 'C': 13.522430376856141, 'gamma': 0.11351971232885755, 'epsilon': 0.016580093909440107}. Best is trial 345 with value: 0.13438257115663557.
[I 2024-12-03 19:19:43,575] Trial 2151 finished with value: 0.1353265623747361 and parameters: {'kernel': 'linear', 'C': 96.60519822063117, 'gamma': 0.02842212776356157, 'epsilon': 0.04105925246913022}. Best is trial 345 with value: 0.13438257115663557.
[I 2024-12-03 19:19:46,380] Trial 2234 finished with value: 0.16191930414961941 and parameters: {'kernel': 'linear', 'C': 95.70217577799424, 'gamma': 0.0011533256119083647, 'epsilon': 0.16913284050681607}. Best is trial 345 with value: 0.13438257115663557.
[I 2024-12-03 19:19:47,818] Trial 2185 finished with value: 0.13484450839779563 and parameters: {'kernel': 'linear', 'C': 94.62836952967201, 'gamma': 0.0007536954986460719, 'epsilon': 0.029909690210174474}. Best is trial 345 with value: 0.13438257115663557.
[I 2024-12-03 19:19:49,290] Trial 2225 finished with value: 0.1353488336025356 and parameters: {'kernel': 'linear', 'C': 20.74523590132037, 'gamma': 0.009605123331228045, 'epsilon': 0.029024274268268202}. Best is trial 345 with value: 0.13438257115663557.
[I 2024-12-03 19:19:52,093] Trial 2194 finished with value: 0.1370648241216298 and parameters: {'kernel': 'linear', 'C': 91.49934613648843, 'gamma': 0.00047180886864264267, 'epsilon': 0.04604353218774247}. Best is trial 345 with value: 0.13438257115663557.
[I 2024-12-03 19:19:57,603] Trial 2124 finished with value: 0.13814387209571807 and parameters: {'kernel': 'linear', 'C': 87.91923108490107, 'gamma': 0.04762739373047387, 'epsilon': 0.007565866951904466}. Best is trial 345 with value: 0.13438257115663557.
[I 2024-12-03 19:19:59,555] Trial 2242 finished with value: 0.1397897293701351 and parameters: {'kernel': 'linear', 'C': 29.123981576844585, 'gamma': 0.00029965415361056015, 'epsilon': 0.08749554178974006}. Best is trial 345 with value: 0.13438257115663557.
[I 2024-12-03 19:20:01,990] Trial 2203 finished with value: 0.13786707474921892 and parameters: {'kernel': 'linear', 'C': 58.463161689770494, 'gamma': 0.00058757133137091, 'epsilon': 0.00547221591049466}. Best is trial 345 with value: 0.13438257115663557.
[I 2024-12-03 19:20:02,900] Trial 2229 finished with value: 0.1373336308545605 and parameters: {'kernel': 'linear', 'C': 19.044494473342304, 'gamma': 0.0012444028769631394, 'epsilon': 0.019565223503618015}. Best is trial 345 with value: 0.13438257115663557.
[I 2024-12-03 19:20:03,229] Trial 2239 finished with value: 0.13701242266013758 and parameters: {'kernel': 'linear', 'C': 26.50270041048135, 'gamma': 0.0043838857901234395, 'epsilon': 0.04553988563146157}. Best is trial 345 with value: 0.13438257115663557.
[I 2024-12-03 19:20:04,180] Trial 2244 finished with value: 0.14066810552850312 and parameters: {'kernel': 'linear', 'C': 21.514019282157573, 'gamma': 0.007445148424591187, 'epsilon': 0.10021530345937579}. Best is trial 345 with value: 0.13438257115663557.
[I 2024-12-03 19:20:05,909] Trial 2201 finished with value: 0.1350603301654534 and parameters: {'kernel': 'linear', 'C': 74.18891597040007, 'gamma': 0.06668928875010273, 'epsilon': 0.03981992203779529}. Best is trial 345 with value: 0.13438257115663557.
[I 2024-12-03 19:20:07,096] Trial 2249 finished with value: 0.3849767204839849 and parameters: {'kernel': 'sigmoid', 'C': 7.001630263854924, 'gamma': 0.0006102569229915183, 'epsilon': 0.03065729623622384}. Best is trial 345 with value: 0.13438257115663557.
[I 2024-12-03 19:20:07,921] Trial 2237 finished with value: 0.13496024509961346 and parameters: {'kernel': 'linear', 'C': 27.678291312235668, 'gamma': 0.0020645695970325693, 'epsilon': 0.0404123409299229}. Best is trial 345 with value: 0.13438257115663557.
[I 2024-12-03 19:20:08,744] Trial 2245 finished with value: 0.13697045213784992 and parameters: {'kernel': 'linear', 'C': 6.282540397432561, 'gamma': 0.00021527355037792955, 'epsilon': 0.022997837101698573}. Best is trial 345 with value: 0.13438257115663557.
[I 2024-12-03 19:20:08,747] Trial 2235 finished with value: 0.13548569907304314 and parameters: {'kernel': 'linear', 'C': 21.678074688473473, 'gamma': 0.025880046709918447, 'epsilon': 0.02810119784802108}. Best is trial 345 with value: 0.13438257115663557.
[I 2024-12-03 19:20:09,361] Trial 2251 finished with value: 1.362480446881602 and parameters: {'kernel': 'poly', 'C': 0.924675168845712, 'gamma': 0.00012989102780739284, 'epsilon': 0.003491703496778961}. Best is trial 345 with value: 0.13438257115663557.
[I 2024-12-03 19:20:11,521] Trial 2253 finished with value: 0.2727354616287837 and parameters: {'kernel': 'rbf', 'C': 10.833429041731032, 'gamma': 0.02641863440100214, 'epsilon': 0.006218631077434074}. Best is trial 345 with value: 0.13438257115663557.
[I 2024-12-03 19:20:14,682] Trial 2224 finished with value: 0.13791288000383572 and parameters: {'kernel': 'linear', 'C': 23.212697296866633, 'gamma': 0.007543060513060738, 'epsilon': 0.006162368253882374}. Best is trial 345 with value: 0.13438257115663557.
[I 2024-12-03 19:20:17,433] Trial 2240 finished with value: 0.13789321184725137 and parameters: {'kernel': 'linear', 'C': 20.45430276014087, 'gamma': 0.02452672777924459, 'epsilon': 0.015758245399897234}. Best is trial 345 with value: 0.13438257115663557.
[I 2024-12-03 19:20:18,388] Trial 2241 finished with value: 0.13795894312852897 and parameters: {'kernel': 'linear', 'C': 18.461182092498312, 'gamma': 0.002556191108034345, 'epsilon': 0.013289442940835228}. Best is trial 345 with value: 0.13438257115663557.
[I 2024-12-03 19:20:19,255] Trial 2257 finished with value: 519.2152562197899 and parameters: {'kernel': 'sigmoid', 'C': 84.25719780232437, 'gamma': 0.010674792454994803, 'epsilon': 0.012223476935612933}. Best is trial 345 with value: 0.13438257115663557.
[I 2024-12-03 19:20:19,308] Trial 2227 finished with value: 0.1370419539909836 and parameters: {'kernel': 'linear', 'C': 88.0755343845381, 'gamma': 0.0574969861189519, 'epsilon': 0.04608390720828261}. Best is trial 345 with value: 0.13438257115663557.
[I 2024-12-03 19:20:21,038] Trial 2243 finished with value: 0.13800550899817665 and parameters: {'kernel': 'linear', 'C': 23.446916060196656, 'gamma': 0.006543699506662219, 'epsilon': 0.016655572621378758}. Best is trial 345 with value: 0.13438257115663557.
[I 2024-12-03 19:20:22,195] Trial 2261 finished with value: 0.19091873536914178 and parameters: {'kernel': 'rbf', 'C': 57.67847822152407, 'gamma': 0.0007576907560947392, 'epsilon': 0.05947928465339048}. Best is trial 345 with value: 0.13438257115663557.
[I 2024-12-03 19:20:22,989] Trial 2255 finished with value: 0.1406753624283108 and parameters: {'kernel': 'linear', 'C': 22.528558530219534, 'gamma': 0.0015196829845275162, 'epsilon': 0.09829542276181272}. Best is trial 345 with value: 0.13438257115663557.
[I 2024-12-03 19:20:23,124] Trial 2252 finished with value: 0.1357501160188483 and parameters: {'kernel': 'linear', 'C': 12.485412784493663, 'gamma': 0.2897798346346706, 'epsilon': 0.03406895423892999}. Best is trial 345 with value: 0.13438257115663557.
[I 2024-12-03 19:20:24,437] Trial 2259 finished with value: 0.34589103271546245 and parameters: {'kernel': 'poly', 'C': 10.300526451945313, 'gamma': 0.04026997179993179, 'epsilon': 0.0553248395698198}. Best is trial 345 with value: 0.13438257115663557.
[I 2024-12-03 19:20:24,643] Trial 2263 finished with value: 150.8404490816059 and parameters: {'kernel': 'sigmoid', 'C': 8.631231459533028, 'gamma': 0.14221087512011696, 'epsilon': 0.052789653717297345}. Best is trial 345 with value: 0.13438257115663557.
[I 2024-12-03 19:20:26,151] Trial 2265 finished with value: 0.16504765374180078 and parameters: {'kernel': 'linear', 'C': 0.9172827153579121, 'gamma': 0.004385097369324139, 'epsilon': 0.1151872088016171}. Best is trial 345 with value: 0.13438257115663557.
[I 2024-12-03 19:20:27,494] Trial 2267 finished with value: 1.3596890480650046 and parameters: {'kernel': 'poly', 'C': 0.16308621787340558, 'gamma': 0.00041842207163791847, 'epsilon': 0.03465167918444598}. Best is trial 345 with value: 0.13438257115663557.
[I 2024-12-03 19:20:28,804] Trial 2189 finished with value: 0.13563350686377054 and parameters: {'kernel': 'linear', 'C': 97.35112410341821, 'gamma': 0.0698678876365522, 'epsilon': 0.027716657136552424}. Best is trial 345 with value: 0.13438257115663557.
[I 2024-12-03 19:20:28,806] Trial 2262 finished with value: 0.14195472034815243 and parameters: {'kernel': 'linear', 'C': 28.25599686369031, 'gamma': 0.02056116724446796, 'epsilon': 0.1126782431655445}. Best is trial 345 with value: 0.13438257115663557.
[I 2024-12-03 19:20:30,099] Trial 2268 finished with value: 0.14167978592983074 and parameters: {'kernel': 'linear', 'C': 0.9255249254529007, 'gamma': 0.004681576866841587, 'epsilon': 0.02152810153087195}. Best is trial 345 with value: 0.13438257115663557.
[I 2024-12-03 19:20:34,099] Trial 2209 finished with value: 0.13494214781588582 and parameters: {'kernel': 'linear', 'C': 94.65679030655241, 'gamma': 0.0007203432798337972, 'epsilon': 0.03911706491976729}. Best is trial 345 with value: 0.13438257115663557.
[I 2024-12-03 19:20:34,101] Trial 2271 finished with value: 0.34450090117815907 and parameters: {'kernel': 'poly', 'C': 0.2136891925884272, 'gamma': 0.13245938273805688, 'epsilon': 0.02862058384494926}. Best is trial 345 with value: 0.13438257115663557.
[I 2024-12-03 19:20:35,604] Trial 2273 finished with value: 3.3092682598274914 and parameters: {'kernel': 'sigmoid', 'C': 0.1251544191915613, 'gamma': 0.5909687461362068, 'epsilon': 0.20687810589939243}. Best is trial 345 with value: 0.13438257115663557.
[I 2024-12-03 19:20:36,964] Trial 2274 finished with value: 4.389749607135657 and parameters: {'kernel': 'sigmoid', 'C': 17.168556436536342, 'gamma': 0.0022582774330778725, 'epsilon': 0.026262158532697553}. Best is trial 345 with value: 0.13438257115663557.
[I 2024-12-03 19:20:36,966] Trial 2207 finished with value: 0.13583413720805262 and parameters: {'kernel': 'linear', 'C': 88.25227986605823, 'gamma': 0.08709247781617331, 'epsilon': 0.02611185051058668}. Best is trial 345 with value: 0.13438257115663557.
[I 2024-12-03 19:20:38,175] Trial 2186 finished with value: 0.1381788341790738 and parameters: {'kernel': 'linear', 'C': 94.05350098953532, 'gamma': 0.2300005675705187, 'epsilon': 0.014732444219162104}. Best is trial 345 with value: 0.13438257115663557.
[I 2024-12-03 19:20:38,696] Trial 2217 finished with value: 0.13781632058073393 and parameters: {'kernel': 'linear', 'C': 71.52067755850553, 'gamma': 0.0002778552974998905, 'epsilon': 0.013661136381262018}. Best is trial 345 with value: 0.13438257115663557.
[I 2024-12-03 19:20:38,932] Trial 2270 finished with value: 0.13661337721430605 and parameters: {'kernel': 'linear', 'C': 13.3530483247672, 'gamma': 0.0040252837021423115, 'epsilon': 0.050477822834608804}. Best is trial 345 with value: 0.13438257115663557.
[I 2024-12-03 19:20:40,816] Trial 1792 finished with value: 0.337072644699186 and parameters: {'kernel': 'poly', 'C': 75.67727671786179, 'gamma': 0.11253291380762498, 'epsilon': 0.07867257993863182}. Best is trial 345 with value: 0.13438257115663557.
[I 2024-12-03 19:20:41,128] Trial 2275 finished with value: 0.17042669303796007 and parameters: {'kernel': 'linear', 'C': 23.214004623824565, 'gamma': 0.2724775338373876, 'epsilon': 0.18597024706011578}. Best is trial 345 with value: 0.13438257115663557.
[I 2024-12-03 19:20:41,129] Trial 2188 finished with value: 0.13900054161799896 and parameters: {'kernel': 'linear', 'C': 86.86373421220172, 'gamma': 0.6176565757465774, 'epsilon': 0.01104826195016874}. Best is trial 345 with value: 0.13438257115663557.
[I 2024-12-03 19:20:41,196] Trial 2277 finished with value: 0.16175262378124824 and parameters: {'kernel': 'linear', 'C': 3.706543914957675, 'gamma': 0.004405264719466885, 'epsilon': 0.14813168536165008}. Best is trial 345 with value: 0.13438257115663557.
[I 2024-12-03 19:20:43,076] Trial 2256 finished with value: 0.13533363968561704 and parameters: {'kernel': 'linear', 'C': 22.143476268511712, 'gamma': 0.0024165804290555534, 'epsilon': 0.0302730481178092}. Best is trial 345 with value: 0.13438257115663557.
[I 2024-12-03 19:20:43,934] Trial 2206 finished with value: 0.13786578943346964 and parameters: {'kernel': 'linear', 'C': 98.67365947502043, 'gamma': 0.001002233627295064, 'epsilon': 0.009028661551141548}. Best is trial 345 with value: 0.13438257115663557.
[I 2024-12-03 19:20:46,306] Trial 2272 finished with value: 0.13604960248054931 and parameters: {'kernel': 'linear', 'C': 14.382850556300445, 'gamma': 0.0015509597754111313, 'epsilon': 0.05606411449742362}. Best is trial 345 with value: 0.13438257115663557.
[I 2024-12-03 19:20:47,116] Trial 2283 finished with value: 0.13616346261556153 and parameters: {'kernel': 'linear', 'C': 3.294047377699649, 'gamma': 0.014685079056161015, 'epsilon': 0.0429715328090267}. Best is trial 345 with value: 0.13438257115663557.
[I 2024-12-03 19:20:48,220] Trial 2266 finished with value: 0.1356001869094264 and parameters: {'kernel': 'linear', 'C': 22.161889859665227, 'gamma': 0.01546123916943888, 'epsilon': 0.03682551110252604}. Best is trial 345 with value: 0.13438257115663557.
[I 2024-12-03 19:20:48,819] Trial 2282 finished with value: 0.14107100892917987 and parameters: {'kernel': 'linear', 'C': 13.570181521299467, 'gamma': 0.0002959340469365848, 'epsilon': 0.09756044226315641}. Best is trial 345 with value: 0.13438257115663557.
[I 2024-12-03 19:20:49,756] Trial 2281 finished with value: 0.13602811990488411 and parameters: {'kernel': 'linear', 'C': 5.405210977823921, 'gamma': 0.011406113630021837, 'epsilon': 0.03518815312911151}. Best is trial 345 with value: 0.13438257115663557.
[I 2024-12-03 19:20:50,010] Trial 2233 finished with value: 0.13671320596886574 and parameters: {'kernel': 'linear', 'C': 92.30183439806284, 'gamma': 0.0021080580456508606, 'epsilon': 0.02330099962854516}. Best is trial 345 with value: 0.13438257115663557.
[I 2024-12-03 19:20:53,507] Trial 2287 finished with value: 0.13797194455067477 and parameters: {'kernel': 'linear', 'C': 4.516768904737728, 'gamma': 0.003656340485911902, 'epsilon': 0.012749268617150481}. Best is trial 345 with value: 0.13438257115663557.
[I 2024-12-03 19:20:54,331] Trial 2279 finished with value: 0.1377748686931551 and parameters: {'kernel': 'linear', 'C': 15.57986416944313, 'gamma': 0.00044564200201037456, 'epsilon': 0.017701426294391552}. Best is trial 345 with value: 0.13438257115663557.
[I 2024-12-03 19:20:54,906] Trial 2292 finished with value: 0.25863326978965373 and parameters: {'kernel': 'linear', 'C': 0.03727778783816522, 'gamma': 0.011226202995826792, 'epsilon': 0.076583583138956}. Best is trial 345 with value: 0.13438257115663557.
[I 2024-12-03 19:20:55,093] Trial 2291 finished with value: 0.13549310454519092 and parameters: {'kernel': 'linear', 'C': 6.074888231366008, 'gamma': 0.0003277385182023455, 'epsilon': 0.0503298124760085}. Best is trial 345 with value: 0.13438257115663557.
[I 2024-12-03 19:20:56,156] Trial 2289 finished with value: 0.14716393162989538 and parameters: {'kernel': 'linear', 'C': 88.44511328706712, 'gamma': 0.0023488052171792887, 'epsilon': 0.13593307521501571}. Best is trial 345 with value: 0.13438257115663557.
[I 2024-12-03 19:20:56,262] Trial 2293 finished with value: 0.1772470951909564 and parameters: {'kernel': 'rbf', 'C': 45.135030975587405, 'gamma': 0.013833749729395528, 'epsilon': 0.032665497055308655}. Best is trial 345 with value: 0.13438257115663557.
[I 2024-12-03 19:20:57,860] Trial 2238 finished with value: 0.1357273831764982 and parameters: {'kernel': 'linear', 'C': 71.394173833984, 'gamma': 0.000125431407201147, 'epsilon': 0.03525336255692039}. Best is trial 345 with value: 0.13438257115663557.
[I 2024-12-03 19:21:00,573] Trial 2296 finished with value: 0.13540448497239746 and parameters: {'kernel': 'linear', 'C': 4.028351066846954, 'gamma': 0.00276521673125615, 'epsilon': 0.05409884127730401}. Best is trial 345 with value: 0.13438257115663557.
[I 2024-12-03 19:21:02,153] Trial 2286 finished with value: 0.1350282540799425 and parameters: {'kernel': 'linear', 'C': 23.67626173246033, 'gamma': 0.012758296467413457, 'epsilon': 0.06199567006567176}. Best is trial 345 with value: 0.13438257115663557.
[I 2024-12-03 19:21:05,808] Trial 2269 finished with value: 0.13793896081091556 and parameters: {'kernel': 'linear', 'C': 23.091575195221665, 'gamma': 0.014337414010139306, 'epsilon': 0.015330706780229667}. Best is trial 345 with value: 0.13438257115663557.
[I 2024-12-03 19:21:08,077] Trial 2278 finished with value: 0.13487705122493487 and parameters: {'kernel': 'linear', 'C': 23.037159466256934, 'gamma': 0.005483902861305244, 'epsilon': 0.03973353699469508}. Best is trial 345 with value: 0.13438257115663557.
[I 2024-12-03 19:21:11,313] Trial 2297 finished with value: 0.13654802546130534 and parameters: {'kernel': 'linear', 'C': 25.237409217774992, 'gamma': 0.0012093271494382776, 'epsilon': 0.05011873433127631}. Best is trial 345 with value: 0.13438257115663557.
