[I 2024-12-03 18:44:02,255] Trial 837 finished with value: 0.5058692140727121 and parameters: {'kernel': 'rbf', 'C': 16.149616393711845, 'gamma': 0.01603868085795865, 'epsilon': 0.13656050794662858}. Best is trial 482 with value: 0.4491649651596098.
[I 2024-12-03 18:44:02,828] Trial 842 finished with value: 0.4678972925672449 and parameters: {'kernel': 'rbf', 'C': 97.7014845276516, 'gamma': 0.008839508963580284, 'epsilon': 0.06643655496676705}. Best is trial 482 with value: 0.4491649651596098.
[I 2024-12-03 18:44:03,339] Trial 843 finished with value: 0.5387590206264722 and parameters: {'kernel': 'rbf', 'C': 85.75300381482418, 'gamma': 0.0036930305336477266, 'epsilon': 0.11844966732602732}. Best is trial 482 with value: 0.4491649651596098.
[I 2024-12-03 18:44:03,678] Trial 833 finished with value: 0.5827654528155434 and parameters: {'kernel': 'rbf', 'C': 66.39152274715346, 'gamma': 0.001966991360940606, 'epsilon': 0.025567609737870565}. Best is trial 482 with value: 0.4491649651596098.
[I 2024-12-03 18:44:04,201] Trial 827 finished with value: 0.5368936474952409 and parameters: {'kernel': 'rbf', 'C': 97.7354706201103, 'gamma': 0.0034054147308738205, 'epsilon': 0.017745512936398197}. Best is trial 482 with value: 0.4491649651596098.
[I 2024-12-03 18:44:04,206] Trial 828 finished with value: 24.01945097235491 and parameters: {'kernel': 'sigmoid', 'C': 12.578212115287105, 'gamma': 0.012490973568679977, 'epsilon': 0.028519326922423142}. Best is trial 482 with value: 0.4491649651596098.
[I 2024-12-03 18:44:04,729] Trial 840 finished with value: 0.6550341895405896 and parameters: {'kernel': 'rbf', 'C': 95.8850206292071, 'gamma': 0.06190488916868994, 'epsilon': 0.08116323690737204}. Best is trial 482 with value: 0.4491649651596098.
[I 2024-12-03 18:44:04,822] Trial 838 finished with value: 0.4636309998452855 and parameters: {'kernel': 'rbf', 'C': 84.66359455449754, 'gamma': 0.010874701711494898, 'epsilon': 0.04018333314281587}. Best is trial 482 with value: 0.4491649651596098.
[I 2024-12-03 18:44:04,826] Trial 846 finished with value: 0.4793442768323717 and parameters: {'kernel': 'rbf', 'C': 98.69798788900371, 'gamma': 0.007277831031656263, 'epsilon': 0.05556220405409604}. Best is trial 482 with value: 0.4491649651596098.
[I 2024-12-03 18:44:05,018] Trial 847 finished with value: 0.5915454826813993 and parameters: {'kernel': 'rbf', 'C': 16.326138026727808, 'gamma': 0.10083211264930834, 'epsilon': 0.02516338837105109}. Best is trial 482 with value: 0.4491649651596098.
[I 2024-12-03 18:44:05,395] Trial 841 finished with value: 1.2001819050912905 and parameters: {'kernel': 'sigmoid', 'C': 9.697488480380825, 'gamma': 0.0038693873059256535, 'epsilon': 0.12603094538208626}. Best is trial 482 with value: 0.4491649651596098.
[I 2024-12-03 18:44:06,188] Trial 852 finished with value: 0.5627777618044306 and parameters: {'kernel': 'rbf', 'C': 90.96097684519475, 'gamma': 0.002189971130704901, 'epsilon': 0.03910314534194467}. Best is trial 482 with value: 0.4491649651596098.
[I 2024-12-03 18:44:06,190] Trial 850 finished with value: 0.5110204345933121 and parameters: {'kernel': 'rbf', 'C': 96.05623819180403, 'gamma': 0.004343273970043904, 'epsilon': 0.039912412211392904}. Best is trial 482 with value: 0.4491649651596098.
[I 2024-12-03 18:44:06,212] Trial 849 finished with value: 0.780967071469517 and parameters: {'kernel': 'poly', 'C': 92.75144634518682, 'gamma': 0.022124207288112176, 'epsilon': 0.030323806402296268}. Best is trial 482 with value: 0.4491649651596098.
[I 2024-12-03 18:44:06,389] Trial 844 finished with value: 0.49302306016544994 and parameters: {'kernel': 'rbf', 'C': 17.173780323311355, 'gamma': 0.017375473646825734, 'epsilon': 0.06011870353398132}. Best is trial 482 with value: 0.4491649651596098.
[I 2024-12-03 18:44:06,831] Trial 848 finished with value: 0.9192011536643937 and parameters: {'kernel': 'linear', 'C': 0.0014432028361058274, 'gamma': 0.18432934207237137, 'epsilon': 0.03801376897859231}. Best is trial 482 with value: 0.4491649651596098.
[I 2024-12-03 18:44:07,044] Trial 857 finished with value: 0.48034805429820787 and parameters: {'kernel': 'rbf', 'C': 14.265133145794985, 'gamma': 0.0257117071279884, 'epsilon': 0.017405687125766116}. Best is trial 482 with value: 0.4491649651596098.
[I 2024-12-03 18:44:07,639] Trial 845 finished with value: 0.5868516012613918 and parameters: {'kernel': 'rbf', 'C': 20.591725518931923, 'gamma': 0.003557385214699332, 'epsilon': 0.05129511879722663}. Best is trial 482 with value: 0.4491649651596098.
[I 2024-12-03 18:44:08,350] Trial 860 finished with value: 0.5907893191295883 and parameters: {'kernel': 'rbf', 'C': 88.81452656605481, 'gamma': 0.0933127940949918, 'epsilon': 0.18894462175487622}. Best is trial 482 with value: 0.4491649651596098.
[I 2024-12-03 18:44:08,633] Trial 853 finished with value: 0.5732228329929523 and parameters: {'kernel': 'linear', 'C': 26.207001380619737, 'gamma': 0.0841213122729437, 'epsilon': 0.06057708712160545}. Best is trial 482 with value: 0.4491649651596098.
[I 2024-12-03 18:44:08,863] Trial 854 finished with value: 0.5486074911291596 and parameters: {'kernel': 'rbf', 'C': 86.59089421460604, 'gamma': 0.03316441593226547, 'epsilon': 0.11055286253084663}. Best is trial 482 with value: 0.4491649651596098.
[I 2024-12-03 18:44:09,988] Trial 865 finished with value: 0.4692893643753632 and parameters: {'kernel': 'rbf', 'C': 18.474468224697954, 'gamma': 0.03253223693191455, 'epsilon': 0.036471312386654194}. Best is trial 482 with value: 0.4491649651596098.
[I 2024-12-03 18:44:10,152] Trial 859 finished with value: 0.6215642071448677 and parameters: {'kernel': 'rbf', 'C': 98.45514572130031, 'gamma': 0.048441282317301826, 'epsilon': 0.016566193357846305}. Best is trial 482 with value: 0.4491649651596098.
[I 2024-12-03 18:44:10,221] Trial 862 finished with value: 8.158759226252428 and parameters: {'kernel': 'sigmoid', 'C': 82.41575304913268, 'gamma': 0.0033969492596766402, 'epsilon': 0.13182960648103317}. Best is trial 482 with value: 0.4491649651596098.
[I 2024-12-03 18:44:10,434] Trial 851 finished with value: 1.3737577911809613 and parameters: {'kernel': 'poly', 'C': 0.3821798538921895, 'gamma': 0.00020045022886823827, 'epsilon': 0.005610530600605904}. Best is trial 482 with value: 0.4491649651596098.
[I 2024-12-03 18:44:11,312] Trial 856 finished with value: 0.6135891524807611 and parameters: {'kernel': 'rbf', 'C': 97.50333242947438, 'gamma': 0.0029701247454503614, 'epsilon': 0.7482290735003999}. Best is trial 482 with value: 0.4491649651596098.
[I 2024-12-03 18:44:11,313] Trial 863 finished with value: 0.5404873689628017 and parameters: {'kernel': 'rbf', 'C': 23.146034376990265, 'gamma': 0.008321095874383693, 'epsilon': 0.32628450488796634}. Best is trial 482 with value: 0.4491649651596098.
[I 2024-12-03 18:44:11,624] Trial 869 finished with value: 0.48856165704998605 and parameters: {'kernel': 'rbf', 'C': 21.0534138855868, 'gamma': 0.015485553271213303, 'epsilon': 0.11294844603749041}. Best is trial 482 with value: 0.4491649651596098.
[I 2024-12-03 18:44:11,764] Trial 861 finished with value: 0.48424141182975167 and parameters: {'kernel': 'rbf', 'C': 93.4241056790264, 'gamma': 0.024734072201129033, 'epsilon': 0.03295731582573678}. Best is trial 482 with value: 0.4491649651596098.
[I 2024-12-03 18:44:11,819] Trial 855 finished with value: 0.46413695076660605 and parameters: {'kernel': 'rbf', 'C': 94.88645431662079, 'gamma': 0.010106574231160256, 'epsilon': 0.04105151604365261}. Best is trial 482 with value: 0.4491649651596098.
[I 2024-12-03 18:44:12,059] Trial 19 finished with value: 1.0964265935551853 and parameters: {'kernel': 'poly', 'C': 3.661949920308643, 'gamma': 0.9898058262989458, 'epsilon': 0.016964849779255692}. Best is trial 482 with value: 0.4491649651596098.
[I 2024-12-03 18:44:13,070] Trial 873 finished with value: 0.5403407891579299 and parameters: {'kernel': 'rbf', 'C': 22.042758912485986, 'gamma': 0.006950360007767896, 'epsilon': 0.1543500388312608}. Best is trial 482 with value: 0.4491649651596098.
[I 2024-12-03 18:44:13,440] Trial 871 finished with value: 0.5152303341839553 and parameters: {'kernel': 'rbf', 'C': 15.788559714636753, 'gamma': 0.014225719562291714, 'epsilon': 0.054937689582913056}. Best is trial 482 with value: 0.4491649651596098.
[I 2024-12-03 18:44:13,905] Trial 864 finished with value: 0.580039925414916 and parameters: {'kernel': 'rbf', 'C': 17.420422021498062, 'gamma': 0.004427444396843212, 'epsilon': 0.10476567669855634}. Best is trial 482 with value: 0.4491649651596098.
[I 2024-12-03 18:44:14,124] Trial 858 finished with value: 0.5319365593155578 and parameters: {'kernel': 'rbf', 'C': 16.61993828983592, 'gamma': 0.01130512690354634, 'epsilon': 0.11072420433362366}. Best is trial 482 with value: 0.4491649651596098.
[I 2024-12-03 18:44:14,277] Trial 880 finished with value: 0.5266962177805569 and parameters: {'kernel': 'rbf', 'C': 23.89449532448554, 'gamma': 0.048103674401880514, 'epsilon': 0.13273417847365182}. Best is trial 482 with value: 0.4491649651596098.
[I 2024-12-03 18:44:14,842] Trial 870 finished with value: 0.5502926437175588 and parameters: {'kernel': 'rbf', 'C': 12.07406875133988, 'gamma': 0.009664891183444744, 'epsilon': 0.0368664123493699}. Best is trial 482 with value: 0.4491649651596098.
[I 2024-12-03 18:44:15,038] Trial 866 finished with value: 0.46675201278842 and parameters: {'kernel': 'rbf', 'C': 85.85773417539906, 'gamma': 0.010782141677188405, 'epsilon': 0.15796924888856784}. Best is trial 482 with value: 0.4491649651596098.
[I 2024-12-03 18:44:15,341] Trial 867 finished with value: 1.2579763731210116 and parameters: {'kernel': 'sigmoid', 'C': 0.5124344709136514, 'gamma': 0.0003294734952414863, 'epsilon': 0.19408063201506615}. Best is trial 482 with value: 0.4491649651596098.
[I 2024-12-03 18:44:15,519] Trial 877 finished with value: 0.5709751087523992 and parameters: {'kernel': 'rbf', 'C': 90.99637909318056, 'gamma': 0.038852281399173426, 'epsilon': 0.041515807963229866}. Best is trial 482 with value: 0.4491649651596098.
[I 2024-12-03 18:44:16,208] Trial 884 finished with value: 0.4996370016388234 and parameters: {'kernel': 'rbf', 'C': 96.72547669820511, 'gamma': 0.023420888093576737, 'epsilon': 0.09091795350442979}. Best is trial 482 with value: 0.4491649651596098.
[I 2024-12-03 18:44:16,336] Trial 872 finished with value: 0.47823711829943305 and parameters: {'kernel': 'rbf', 'C': 84.92758493132968, 'gamma': 0.00898327085072433, 'epsilon': 0.1645748261409921}. Best is trial 482 with value: 0.4491649651596098.
[I 2024-12-03 18:44:16,432] Trial 881 finished with value: 1.1412450226184954 and parameters: {'kernel': 'sigmoid', 'C': 0.058053871423288314, 'gamma': 0.04014558450243216, 'epsilon': 0.004016114200174947}. Best is trial 482 with value: 0.4491649651596098.
[I 2024-12-03 18:44:16,447] Trial 876 finished with value: 0.5382199806642851 and parameters: {'kernel': 'rbf', 'C': 20.022448707670357, 'gamma': 0.06068231678398971, 'epsilon': 0.09528551238736377}. Best is trial 482 with value: 0.4491649651596098.
[I 2024-12-03 18:44:16,695] Trial 879 finished with value: 0.46453631504298676 and parameters: {'kernel': 'rbf', 'C': 85.68608044517086, 'gamma': 0.00985591763428896, 'epsilon': 0.07177207136521511}. Best is trial 482 with value: 0.4491649651596098.
[I 2024-12-03 18:44:16,814] Trial 887 finished with value: 0.48605096603903913 and parameters: {'kernel': 'rbf', 'C': 14.60254053649042, 'gamma': 0.022673467929449936, 'epsilon': 0.018359814135312406}. Best is trial 482 with value: 0.4491649651596098.
[I 2024-12-03 18:44:16,905] Trial 885 finished with value: 0.46124194339725216 and parameters: {'kernel': 'rbf', 'C': 99.32609454816374, 'gamma': 0.016441485708489377, 'epsilon': 0.08990526178546308}. Best is trial 482 with value: 0.4491649651596098.
[I 2024-12-03 18:44:17,139] Trial 883 finished with value: 0.6873554310234427 and parameters: {'kernel': 'rbf', 'C': 19.01952893796222, 'gamma': 0.0015555209216058508, 'epsilon': 0.05668733977762888}. Best is trial 482 with value: 0.4491649651596098.
[I 2024-12-03 18:44:17,186] Trial 882 finished with value: 654.6225656145846 and parameters: {'kernel': 'sigmoid', 'C': 95.85743646949531, 'gamma': 0.051197564453822134, 'epsilon': 0.06248086727159003}. Best is trial 482 with value: 0.4491649651596098.
[I 2024-12-03 18:44:17,194] Trial 868 finished with value: 0.49390745820469245 and parameters: {'kernel': 'rbf', 'C': 98.88724344643937, 'gamma': 0.005519246037193802, 'epsilon': 0.05183519913088291}. Best is trial 482 with value: 0.4491649651596098.
[I 2024-12-03 18:44:17,205] Trial 878 finished with value: 0.47326592759592484 and parameters: {'kernel': 'rbf', 'C': 31.266466943090332, 'gamma': 0.031151469788925905, 'epsilon': 0.07146390302892593}. Best is trial 482 with value: 0.4491649651596098.
[I 2024-12-03 18:44:17,367] Trial 874 finished with value: 0.552838177139093 and parameters: {'kernel': 'linear', 'C': 89.1093156404879, 'gamma': 0.026958822875685625, 'epsilon': 0.01036089053818728}. Best is trial 482 with value: 0.4491649651596098.
[I 2024-12-03 18:44:17,550] Trial 875 finished with value: 0.5799679918345457 and parameters: {'kernel': 'linear', 'C': 18.090447946289537, 'gamma': 0.003930749595880032, 'epsilon': 0.15560752598534153}. Best is trial 482 with value: 0.4491649651596098.
[I 2024-12-03 18:44:17,570] Trial 888 finished with value: 0.4629819161329239 and parameters: {'kernel': 'rbf', 'C': 88.7832249616931, 'gamma': 0.013722738686470929, 'epsilon': 0.01483281956202279}. Best is trial 482 with value: 0.4491649651596098.
[I 2024-12-03 18:44:17,848] Trial 886 finished with value: 0.6308283471133173 and parameters: {'kernel': 'rbf', 'C': 1.5618868482151242, 'gamma': 0.03674460503342246, 'epsilon': 0.06106335845628269}. Best is trial 482 with value: 0.4491649651596098.
[I 2024-12-03 18:44:17,886] Trial 891 finished with value: 0.5684162814267572 and parameters: {'kernel': 'rbf', 'C': 92.6622751502318, 'gamma': 0.001636389195211671, 'epsilon': 0.06564635924641829}. Best is trial 482 with value: 0.4491649651596098.
[I 2024-12-03 18:44:19,478] Trial 889 finished with value: 0.5043924273611514 and parameters: {'kernel': 'rbf', 'C': 27.44260102293829, 'gamma': 0.01141361211024854, 'epsilon': 0.0322148866411769}. Best is trial 482 with value: 0.4491649651596098.
[I 2024-12-03 18:44:20,755] Trial 895 finished with value: 0.4583936103701213 and parameters: {'kernel': 'rbf', 'C': 98.98170324636432, 'gamma': 0.01690809833840766, 'epsilon': 0.08185522846046225}. Best is trial 482 with value: 0.4491649651596098.
[I 2024-12-03 18:44:21,662] Trial 896 finished with value: 0.628606880478753 and parameters: {'kernel': 'rbf', 'C': 90.96933640848926, 'gamma': 0.05226458667309017, 'epsilon': 0.06318964535906242}. Best is trial 482 with value: 0.4491649651596098.
[I 2024-12-03 18:44:22,456] Trial 898 finished with value: 0.532741365746181 and parameters: {'kernel': 'rbf', 'C': 29.44555677204938, 'gamma': 0.007220105649450955, 'epsilon': 0.04821377335628362}. Best is trial 482 with value: 0.4491649651596098.
[I 2024-12-03 18:44:22,639] Trial 892 finished with value: 0.5402457019543392 and parameters: {'kernel': 'rbf', 'C': 17.37272694666456, 'gamma': 0.008795396177717858, 'epsilon': 0.09251871511739142}. Best is trial 482 with value: 0.4491649651596098.
[I 2024-12-03 18:44:22,833] Trial 899 finished with value: 0.5346329136850154 and parameters: {'kernel': 'rbf', 'C': 97.01124660854859, 'gamma': 0.003702000059969858, 'epsilon': 0.13908745929269534}. Best is trial 482 with value: 0.4491649651596098.
[I 2024-12-03 18:44:22,899] Trial 894 finished with value: 0.5393128192626908 and parameters: {'kernel': 'rbf', 'C': 14.952506818790516, 'gamma': 0.0714749083991457, 'epsilon': 0.062228100455571415}. Best is trial 482 with value: 0.4491649651596098.
[I 2024-12-03 18:44:22,973] Trial 906 finished with value: 0.5021974645176053 and parameters: {'kernel': 'rbf', 'C': 83.32438459079738, 'gamma': 0.006017545142870416, 'epsilon': 0.14203521017918844}. Best is trial 482 with value: 0.4491649651596098.
[I 2024-12-03 18:44:23,096] Trial 901 finished with value: 0.4764509726708986 and parameters: {'kernel': 'rbf', 'C': 75.12564988485362, 'gamma': 0.009533869143160735, 'epsilon': 0.02134220405835166}. Best is trial 482 with value: 0.4491649651596098.
[I 2024-12-03 18:44:24,368] Trial 890 finished with value: 0.4737068138493185 and parameters: {'kernel': 'rbf', 'C': 19.661639131040495, 'gamma': 0.023981935863050998, 'epsilon': 0.0725196711144498}. Best is trial 482 with value: 0.4491649651596098.
[I 2024-12-03 18:44:24,494] Trial 909 finished with value: 0.5149707293654884 and parameters: {'kernel': 'rbf', 'C': 23.779001491848735, 'gamma': 0.011009459669273877, 'epsilon': 0.023103728695468333}. Best is trial 482 with value: 0.4491649651596098.
[I 2024-12-03 18:44:24,882] Trial 905 finished with value: 0.7082304297161547 and parameters: {'kernel': 'rbf', 'C': 2.631536680409191, 'gamma': 0.00914154259930441, 'epsilon': 0.06674405683385276}. Best is trial 482 with value: 0.4491649651596098.
[I 2024-12-03 18:44:25,363] Trial 900 finished with value: 0.4549037812888473 and parameters: {'kernel': 'rbf', 'C': 89.60301132943171, 'gamma': 0.011957651567462839, 'epsilon': 0.053987107634060415}. Best is trial 482 with value: 0.4491649651596098.
[I 2024-12-03 18:44:25,492] Trial 916 finished with value: 0.9927736302960826 and parameters: {'kernel': 'poly', 'C': 93.4340250836476, 'gamma': 0.005632682814236889, 'epsilon': 0.10923003639234084}. Best is trial 482 with value: 0.4491649651596098.
[I 2024-12-03 18:44:25,625] Trial 897 finished with value: 0.5057374732255948 and parameters: {'kernel': 'rbf', 'C': 98.22904388527698, 'gamma': 0.027381343617986047, 'epsilon': 0.04538675497609683}. Best is trial 482 with value: 0.4491649651596098.
[I 2024-12-03 18:44:25,951] Trial 920 finished with value: 0.47570086599807654 and parameters: {'kernel': 'rbf', 'C': 23.50857767884334, 'gamma': 0.016802445772770392, 'epsilon': 0.11521988841420441}. Best is trial 482 with value: 0.4491649651596098.
[I 2024-12-03 18:44:26,133] Trial 910 finished with value: 0.4920863995090516 and parameters: {'kernel': 'rbf', 'C': 96.36457057011431, 'gamma': 0.005894041684266375, 'epsilon': 0.04700084405353574}. Best is trial 482 with value: 0.4491649651596098.
[I 2024-12-03 18:44:26,190] Trial 902 finished with value: 0.49063197690339583 and parameters: {'kernel': 'rbf', 'C': 18.503943073756272, 'gamma': 0.028737093327238856, 'epsilon': 0.2214356035290397}. Best is trial 482 with value: 0.4491649651596098.
[I 2024-12-03 18:44:26,342] Trial 917 finished with value: 0.47138120486029805 and parameters: {'kernel': 'rbf', 'C': 21.70174187906822, 'gamma': 0.019112321144269126, 'epsilon': 0.0565121287289908}. Best is trial 482 with value: 0.4491649651596098.
[I 2024-12-03 18:44:26,510] Trial 903 finished with value: 0.47122001411711995 and parameters: {'kernel': 'rbf', 'C': 23.747878483715464, 'gamma': 0.01842652963722819, 'epsilon': 0.06250125432959679}. Best is trial 482 with value: 0.4491649651596098.
[I 2024-12-03 18:44:26,759] Trial 922 finished with value: 0.5570326066932569 and parameters: {'kernel': 'rbf', 'C': 19.165722179766636, 'gamma': 0.006118792326982583, 'epsilon': 0.06450373634763003}. Best is trial 482 with value: 0.4491649651596098.
[I 2024-12-03 18:44:26,942] Trial 893 finished with value: 1.3667686456603494 and parameters: {'kernel': 'poly', 'C': 35.29960915193601, 'gamma': 0.00012267186422783763, 'epsilon': 0.04852021404875992}. Best is trial 482 with value: 0.4491649651596098.
[I 2024-12-03 18:44:26,944] Trial 913 finished with value: 0.6607284145721013 and parameters: {'kernel': 'rbf', 'C': 94.31531411679781, 'gamma': 0.06422444607871702, 'epsilon': 0.06128703032131773}. Best is trial 482 with value: 0.4491649651596098.
[I 2024-12-03 18:44:26,958] Trial 914 finished with value: 0.5142057970614795 and parameters: {'kernel': 'rbf', 'C': 98.2440352177713, 'gamma': 0.026214152152827637, 'epsilon': 0.07938222928568693}. Best is trial 482 with value: 0.4491649651596098.
[I 2024-12-03 18:44:28,318] Trial 911 finished with value: 0.4991776053121749 and parameters: {'kernel': 'rbf', 'C': 99.44795539847922, 'gamma': 0.006136697070463446, 'epsilon': 0.15200444683543696}. Best is trial 482 with value: 0.4491649651596098.
[I 2024-12-03 18:44:28,333] Trial 908 finished with value: 0.4817629798839331 and parameters: {'kernel': 'rbf', 'C': 98.69023944197927, 'gamma': 0.0071192207645479535, 'epsilon': 0.06338233811958995}. Best is trial 482 with value: 0.4491649651596098.
[I 2024-12-03 18:44:28,678] Trial 912 finished with value: 0.5687939179220471 and parameters: {'kernel': 'rbf', 'C': 79.43220455731054, 'gamma': 0.03946866931222554, 'epsilon': 0.346732993762075}. Best is trial 482 with value: 0.4491649651596098.
[I 2024-12-03 18:44:28,710] Trial 915 finished with value: 0.53266439269522 and parameters: {'kernel': 'rbf', 'C': 95.37720440038885, 'gamma': 0.023149619011980205, 'epsilon': 0.24916539789640443}. Best is trial 482 with value: 0.4491649651596098.
[I 2024-12-03 18:44:30,068] Trial 918 finished with value: 0.6243428217240286 and parameters: {'kernel': 'rbf', 'C': 14.23311861913227, 'gamma': 0.0033575382432116715, 'epsilon': 0.1385472705633057}. Best is trial 482 with value: 0.4491649651596098.
[I 2024-12-03 18:44:31,048] Trial 921 finished with value: 0.5289523260698568 and parameters: {'kernel': 'rbf', 'C': 18.924344531643747, 'gamma': 0.011006036285144866, 'epsilon': 0.021034498190176287}. Best is trial 482 with value: 0.4491649651596098.
[I 2024-12-03 18:44:32,904] Trial 904 finished with value: 0.4589322085207409 and parameters: {'kernel': 'rbf', 'C': 97.42160366998506, 'gamma': 0.009944048395743676, 'epsilon': 0.10321330778485847}. Best is trial 482 with value: 0.4491649651596098.
