[I 2024-12-04 11:54:37,271] Trial 543 finished with value: 0.6897370689523286 and parameters: {'max_depth': 34, 'min_samples_split': 10, 'min_samples_leaf': 1, 'max_features': 'sqrt', 'criterion': 'friedman_mse', 'splitter': 'best'}. Best is trial 368 with value: 0.6055877317086851.
[I 2024-12-04 11:54:37,531] Trial 534 finished with value: 0.6789802738421568 and parameters: {'max_depth': 35, 'min_samples_split': 13, 'min_samples_leaf': 1, 'max_features': 'sqrt', 'criterion': 'friedman_mse', 'splitter': 'best'}. Best is trial 368 with value: 0.6055877317086851.
[I 2024-12-04 11:54:38,295] Trial 542 finished with value: 1.0909840109486761 and parameters: {'max_depth': 17, 'min_samples_split': 9, 'min_samples_leaf': 7, 'max_features': 'log2', 'criterion': 'squared_error', 'splitter': 'random'}. Best is trial 368 with value: 0.6055877317086851.
[I 2024-12-04 11:54:38,691] Trial 532 finished with value: 0.7235062702460188 and parameters: {'max_depth': 34, 'min_samples_split': 11, 'min_samples_leaf': 1, 'max_features': 'sqrt', 'criterion': 'friedman_mse', 'splitter': 'best'}. Best is trial 368 with value: 0.6055877317086851.
[I 2024-12-04 11:54:38,856] Trial 548 finished with value: 0.8101385948198155 and parameters: {'max_depth': 35, 'min_samples_split': 5, 'min_samples_leaf': 3, 'max_features': 'sqrt', 'criterion': 'friedman_mse', 'splitter': 'best'}. Best is trial 368 with value: 0.6055877317086851.
[I 2024-12-04 11:54:38,860] Trial 541 finished with value: 0.6702654654144604 and parameters: {'max_depth': 35, 'min_samples_split': 14, 'min_samples_leaf': 1, 'max_features': 'sqrt', 'criterion': 'friedman_mse', 'splitter': 'best'}. Best is trial 368 with value: 0.6055877317086851.
[I 2024-12-04 11:54:39,717] Trial 549 finished with value: 0.825562298787238 and parameters: {'max_depth': 35, 'min_samples_split': 13, 'min_samples_leaf': 3, 'max_features': 'sqrt', 'criterion': 'friedman_mse', 'splitter': 'best'}. Best is trial 368 with value: 0.6055877317086851.
[I 2024-12-04 11:54:39,797] Trial 546 finished with value: 0.6694087139298565 and parameters: {'max_depth': 29, 'min_samples_split': 9, 'min_samples_leaf': 1, 'max_features': 'sqrt', 'criterion': 'friedman_mse', 'splitter': 'best'}. Best is trial 368 with value: 0.6055877317086851.
[I 2024-12-04 11:54:39,826] Trial 539 finished with value: 0.8101109109766473 and parameters: {'max_depth': 19, 'min_samples_split': 10, 'min_samples_leaf': 5, 'max_features': 'sqrt', 'criterion': 'squared_error', 'splitter': 'best'}. Best is trial 368 with value: 0.6055877317086851.
[I 2024-12-04 11:54:42,235] Trial 555 finished with value: 0.8131482590578788 and parameters: {'max_depth': 30, 'min_samples_split': 10, 'min_samples_leaf': 3, 'max_features': 'sqrt', 'criterion': 'friedman_mse', 'splitter': 'best'}. Best is trial 368 with value: 0.6055877317086851.
[I 2024-12-04 11:54:42,545] Trial 553 finished with value: 0.8922728876838094 and parameters: {'max_depth': 28, 'min_samples_split': 12, 'min_samples_leaf': 3, 'max_features': 'sqrt', 'criterion': 'friedman_mse', 'splitter': 'random'}. Best is trial 368 with value: 0.6055877317086851.
[I 2024-12-04 11:54:43,417] Trial 556 finished with value: 0.8131482590578788 and parameters: {'max_depth': 35, 'min_samples_split': 10, 'min_samples_leaf': 3, 'max_features': 'sqrt', 'criterion': 'friedman_mse', 'splitter': 'best'}. Best is trial 368 with value: 0.6055877317086851.
[I 2024-12-04 11:54:43,553] Trial 544 finished with value: 0.6369615919324941 and parameters: {'max_depth': 33, 'min_samples_split': 11, 'min_samples_leaf': 1, 'max_features': 'sqrt', 'criterion': 'friedman_mse', 'splitter': 'best'}. Best is trial 368 with value: 0.6055877317086851.
[I 2024-12-04 11:54:43,808] Trial 561 finished with value: 0.8241861685151659 and parameters: {'max_depth': 28, 'min_samples_split': 4, 'min_samples_leaf': 2, 'max_features': 'sqrt', 'criterion': 'friedman_mse', 'splitter': 'best'}. Best is trial 368 with value: 0.6055877317086851.
[I 2024-12-04 11:54:43,860] Trial 564 finished with value: 1.075383350593605 and parameters: {'max_depth': 20, 'min_samples_split': 3, 'min_samples_leaf': 6, 'max_features': 'sqrt', 'criterion': 'absolute_error', 'splitter': 'random'}. Best is trial 368 with value: 0.6055877317086851.
[I 2024-12-04 11:54:44,040] Trial 559 finished with value: 1.092257372628799 and parameters: {'max_depth': 31, 'min_samples_split': 4, 'min_samples_leaf': 4, 'max_features': 'log2', 'criterion': 'friedman_mse', 'splitter': 'random'}. Best is trial 368 with value: 0.6055877317086851.
[I 2024-12-04 11:54:44,049] Trial 552 finished with value: 0.6995519727819436 and parameters: {'max_depth': 28, 'min_samples_split': 9, 'min_samples_leaf': 1, 'max_features': 'sqrt', 'criterion': 'friedman_mse', 'splitter': 'best'}. Best is trial 368 with value: 0.6055877317086851.
[I 2024-12-04 11:54:44,058] Trial 551 finished with value: 0.6751711748370238 and parameters: {'max_depth': 32, 'min_samples_split': 10, 'min_samples_leaf': 1, 'max_features': 'sqrt', 'criterion': 'friedman_mse', 'splitter': 'best'}. Best is trial 368 with value: 0.6055877317086851.
[I 2024-12-04 11:54:44,062] Trial 565 finished with value: 0.7044023234155515 and parameters: {'max_depth': 35, 'min_samples_split': 2, 'min_samples_leaf': 1, 'max_features': 'sqrt', 'criterion': 'squared_error', 'splitter': 'best'}. Best is trial 368 with value: 0.6055877317086851.
[I 2024-12-04 11:54:44,255] Trial 563 finished with value: 0.9449188483277082 and parameters: {'max_depth': 25, 'min_samples_split': 15, 'min_samples_leaf': 3, 'max_features': 'log2', 'criterion': 'friedman_mse', 'splitter': 'best'}. Best is trial 368 with value: 0.6055877317086851.
[I 2024-12-04 11:54:44,705] Trial 545 finished with value: 0.8056989539390975 and parameters: {'max_depth': 33, 'min_samples_split': 8, 'min_samples_leaf': 3, 'max_features': 'sqrt', 'criterion': 'friedman_mse', 'splitter': 'best'}. Best is trial 368 with value: 0.6055877317086851.
[I 2024-12-04 11:54:45,104] Trial 567 finished with value: 1.091656728529238 and parameters: {'max_depth': 5, 'min_samples_split': 13, 'min_samples_leaf': 7, 'max_features': 'log2', 'criterion': 'squared_error', 'splitter': 'best'}. Best is trial 368 with value: 0.6055877317086851.
[I 2024-12-04 11:54:45,105] Trial 554 finished with value: 0.7235062702460188 and parameters: {'max_depth': 34, 'min_samples_split': 11, 'min_samples_leaf': 1, 'max_features': 'sqrt', 'criterion': 'friedman_mse', 'splitter': 'best'}. Best is trial 368 with value: 0.6055877317086851.
[I 2024-12-04 11:54:45,110] Trial 550 finished with value: 0.8228668341371398 and parameters: {'max_depth': 35, 'min_samples_split': 2, 'min_samples_leaf': 5, 'max_features': 'sqrt', 'criterion': 'squared_error', 'splitter': 'best'}. Best is trial 368 with value: 0.6055877317086851.
[I 2024-12-04 11:54:45,255] Trial 560 finished with value: 0.6211247384218127 and parameters: {'max_depth': 31, 'min_samples_split': 12, 'min_samples_leaf': 1, 'max_features': 'sqrt', 'criterion': 'friedman_mse', 'splitter': 'best'}. Best is trial 368 with value: 0.6055877317086851.
[I 2024-12-04 11:54:45,530] Trial 562 finished with value: 0.6631704266526797 and parameters: {'max_depth': 33, 'min_samples_split': 13, 'min_samples_leaf': 1, 'max_features': 'sqrt', 'criterion': 'friedman_mse', 'splitter': 'best'}. Best is trial 368 with value: 0.6055877317086851.
[I 2024-12-04 11:54:45,725] Trial 557 finished with value: 0.9449188483277082 and parameters: {'max_depth': 34, 'min_samples_split': 10, 'min_samples_leaf': 3, 'max_features': 'log2', 'criterion': 'friedman_mse', 'splitter': 'best'}. Best is trial 368 with value: 0.6055877317086851.
[I 2024-12-04 11:54:46,142] Trial 570 finished with value: 0.8084175061392889 and parameters: {'max_depth': 19, 'min_samples_split': 2, 'min_samples_leaf': 1, 'max_features': 'sqrt', 'criterion': 'friedman_mse', 'splitter': 'random'}. Best is trial 368 with value: 0.6055877317086851.
[I 2024-12-04 11:54:46,565] Trial 571 finished with value: 0.6861073677411083 and parameters: {'max_depth': 33, 'min_samples_split': 14, 'min_samples_leaf': 1, 'max_features': 'sqrt', 'criterion': 'squared_error', 'splitter': 'best'}. Best is trial 368 with value: 0.6055877317086851.
[I 2024-12-04 11:54:46,892] Trial 572 finished with value: 0.6935908088501267 and parameters: {'max_depth': 35, 'min_samples_split': 10, 'min_samples_leaf': 1, 'max_features': 'sqrt', 'criterion': 'friedman_mse', 'splitter': 'best'}. Best is trial 368 with value: 0.6055877317086851.
[I 2024-12-04 11:54:46,930] Trial 566 finished with value: 0.8137608958686491 and parameters: {'max_depth': 35, 'min_samples_split': 11, 'min_samples_leaf': 2, 'max_features': 'sqrt', 'criterion': 'friedman_mse', 'splitter': 'best'}. Best is trial 368 with value: 0.6055877317086851.
[I 2024-12-04 11:54:47,367] Trial 558 finished with value: 0.6481536807148809 and parameters: {'max_depth': 29, 'min_samples_split': 4, 'min_samples_leaf': 1, 'max_features': 'sqrt', 'criterion': 'friedman_mse', 'splitter': 'best'}. Best is trial 368 with value: 0.6055877317086851.
[I 2024-12-04 11:54:47,780] Trial 569 finished with value: 1.0309869847349449 and parameters: {'max_depth': 21, 'min_samples_split': 3, 'min_samples_leaf': 1, 'max_features': 'log2', 'criterion': 'friedman_mse', 'splitter': 'random'}. Best is trial 368 with value: 0.6055877317086851.
[I 2024-12-04 11:54:48,181] Trial 568 finished with value: 0.6965652804653477 and parameters: {'max_depth': 34, 'min_samples_split': 14, 'min_samples_leaf': 1, 'max_features': 'sqrt', 'criterion': 'friedman_mse', 'splitter': 'best'}. Best is trial 368 with value: 0.6055877317086851.
[I 2024-12-04 11:54:48,317] Trial 575 finished with value: 0.825562298787238 and parameters: {'max_depth': 26, 'min_samples_split': 14, 'min_samples_leaf': 3, 'max_features': 'sqrt', 'criterion': 'squared_error', 'splitter': 'best'}. Best is trial 368 with value: 0.6055877317086851.
[I 2024-12-04 11:54:48,344] Trial 576 finished with value: 0.7183531396419776 and parameters: {'max_depth': 31, 'min_samples_split': 13, 'min_samples_leaf': 1, 'max_features': 'sqrt', 'criterion': 'friedman_mse', 'splitter': 'best'}. Best is trial 368 with value: 0.6055877317086851.
[I 2024-12-04 11:54:48,524] Trial 573 finished with value: 1.0703780509708551 and parameters: {'max_depth': 26, 'min_samples_split': 7, 'min_samples_leaf': 5, 'max_features': 'log2', 'criterion': 'absolute_error', 'splitter': 'best'}. Best is trial 368 with value: 0.6055877317086851.
[I 2024-12-04 11:54:50,240] Trial 574 finished with value: 0.825562298787238 and parameters: {'max_depth': 28, 'min_samples_split': 14, 'min_samples_leaf': 3, 'max_features': 'sqrt', 'criterion': 'friedman_mse', 'splitter': 'best'}. Best is trial 368 with value: 0.6055877317086851.
[I 2024-12-04 11:54:51,357] Trial 578 finished with value: 1.091656728529238 and parameters: {'max_depth': 30, 'min_samples_split': 20, 'min_samples_leaf': 6, 'max_features': 'log2', 'criterion': 'squared_error', 'splitter': 'best'}. Best is trial 368 with value: 0.6055877317086851.
[I 2024-12-04 11:54:51,900] Trial 577 finished with value: 0.8197632085734636 and parameters: {'max_depth': 35, 'min_samples_split': 13, 'min_samples_leaf': 2, 'max_features': 'sqrt', 'criterion': 'friedman_mse', 'splitter': 'best'}. Best is trial 368 with value: 0.6055877317086851.
[I 2024-12-04 11:54:52,574] Trial 579 finished with value: 0.7222286893478446 and parameters: {'max_depth': 28, 'min_samples_split': 12, 'min_samples_leaf': 1, 'max_features': 'sqrt', 'criterion': 'friedman_mse', 'splitter': 'best'}. Best is trial 368 with value: 0.6055877317086851.
[I 2024-12-04 11:54:52,820] Trial 583 finished with value: 1.0837913044064313 and parameters: {'max_depth': 1, 'min_samples_split': 11, 'min_samples_leaf': 8, 'max_features': 'sqrt', 'criterion': 'absolute_error', 'splitter': 'random'}. Best is trial 368 with value: 0.6055877317086851.
[I 2024-12-04 11:54:53,184] Trial 588 finished with value: 0.6379386941389483 and parameters: {'max_depth': 34, 'min_samples_split': 12, 'min_samples_leaf': 1, 'max_features': 'sqrt', 'criterion': 'friedman_mse', 'splitter': 'best'}. Best is trial 368 with value: 0.6055877317086851.
[I 2024-12-04 11:54:53,410] Trial 580 finished with value: 0.7859749854567036 and parameters: {'max_depth': 28, 'min_samples_split': 12, 'min_samples_leaf': 1, 'max_features': 'sqrt', 'criterion': 'absolute_error', 'splitter': 'best'}. Best is trial 368 with value: 0.6055877317086851.
[I 2024-12-04 11:54:53,616] Trial 592 finished with value: 0.8125271942876539 and parameters: {'max_depth': 30, 'min_samples_split': 11, 'min_samples_leaf': 3, 'max_features': 'sqrt', 'criterion': 'friedman_mse', 'splitter': 'best'}. Best is trial 368 with value: 0.6055877317086851.
[I 2024-12-04 11:54:53,760] Trial 587 finished with value: 0.6935736941658859 and parameters: {'max_depth': 27, 'min_samples_split': 13, 'min_samples_leaf': 1, 'max_features': 'sqrt', 'criterion': 'squared_error', 'splitter': 'best'}. Best is trial 368 with value: 0.6055877317086851.
[I 2024-12-04 11:54:54,228] Trial 586 finished with value: 0.7007608286806496 and parameters: {'max_depth': 30, 'min_samples_split': 14, 'min_samples_leaf': 1, 'max_features': 'sqrt', 'criterion': 'friedman_mse', 'splitter': 'best'}. Best is trial 368 with value: 0.6055877317086851.
[I 2024-12-04 11:54:54,230] Trial 585 finished with value: 0.6379386941389483 and parameters: {'max_depth': 34, 'min_samples_split': 12, 'min_samples_leaf': 1, 'max_features': 'sqrt', 'criterion': 'friedman_mse', 'splitter': 'best'}. Best is trial 368 with value: 0.6055877317086851.
[I 2024-12-04 11:54:54,977] Trial 582 finished with value: 0.7246766212139164 and parameters: {'max_depth': 32, 'min_samples_split': 12, 'min_samples_leaf': 1, 'max_features': 'sqrt', 'criterion': 'friedman_mse', 'splitter': 'best'}. Best is trial 368 with value: 0.6055877317086851.
[I 2024-12-04 11:54:55,326] Trial 593 finished with value: 0.6965652804653477 and parameters: {'max_depth': 34, 'min_samples_split': 14, 'min_samples_leaf': 1, 'max_features': 'sqrt', 'criterion': 'friedman_mse', 'splitter': 'best'}. Best is trial 368 with value: 0.6055877317086851.
[I 2024-12-04 11:54:55,401] Trial 584 finished with value: 0.747459965363377 and parameters: {'max_depth': 32, 'min_samples_split': 11, 'min_samples_leaf': 1, 'max_features': 'log2', 'criterion': 'friedman_mse', 'splitter': 'best'}. Best is trial 368 with value: 0.6055877317086851.
[I 2024-12-04 11:54:55,479] Trial 581 finished with value: 0.6570109226401653 and parameters: {'max_depth': 35, 'min_samples_split': 11, 'min_samples_leaf': 1, 'max_features': 'sqrt', 'criterion': 'friedman_mse', 'splitter': 'best'}. Best is trial 368 with value: 0.6055877317086851.
[I 2024-12-04 11:54:56,545] Trial 594 finished with value: 0.8137608958686491 and parameters: {'max_depth': 35, 'min_samples_split': 12, 'min_samples_leaf': 2, 'max_features': 'sqrt', 'criterion': 'friedman_mse', 'splitter': 'best'}. Best is trial 368 with value: 0.6055877317086851.
[I 2024-12-04 11:54:56,635] Trial 591 finished with value: 0.6631704266526797 and parameters: {'max_depth': 33, 'min_samples_split': 13, 'min_samples_leaf': 1, 'max_features': 'sqrt', 'criterion': 'friedman_mse', 'splitter': 'best'}. Best is trial 368 with value: 0.6055877317086851.
[I 2024-12-04 11:54:56,636] Trial 600 finished with value: 0.6965652804653477 and parameters: {'max_depth': 34, 'min_samples_split': 14, 'min_samples_leaf': 1, 'max_features': 'sqrt', 'criterion': 'friedman_mse', 'splitter': 'best'}. Best is trial 368 with value: 0.6055877317086851.
[I 2024-12-04 11:54:56,925] Trial 597 finished with value: 1.0816149376799358 and parameters: {'max_depth': 30, 'min_samples_split': 12, 'min_samples_leaf': 9, 'max_features': 'sqrt', 'criterion': 'squared_error', 'splitter': 'random'}. Best is trial 368 with value: 0.6055877317086851.
[I 2024-12-04 11:54:57,236] Trial 589 finished with value: 0.7789148703629525 and parameters: {'max_depth': 32, 'min_samples_split': 13, 'min_samples_leaf': 1, 'max_features': 'sqrt', 'criterion': 'friedman_mse', 'splitter': 'random'}. Best is trial 368 with value: 0.6055877317086851.
[I 2024-12-04 11:54:57,722] Trial 603 finished with value: 0.8163908890442707 and parameters: {'max_depth': 35, 'min_samples_split': 16, 'min_samples_leaf': 3, 'max_features': 'sqrt', 'criterion': 'friedman_mse', 'splitter': 'best'}. Best is trial 368 with value: 0.6055877317086851.
[I 2024-12-04 11:54:57,934] Trial 599 finished with value: 0.68655352883041 and parameters: {'max_depth': 30, 'min_samples_split': 13, 'min_samples_leaf': 1, 'max_features': 'sqrt', 'criterion': 'friedman_mse', 'splitter': 'best'}. Best is trial 368 with value: 0.6055877317086851.
[I 2024-12-04 11:54:58,332] Trial 601 finished with value: 0.8882027686672493 and parameters: {'max_depth': 33, 'min_samples_split': 9, 'min_samples_leaf': 7, 'max_features': 'sqrt', 'criterion': 'absolute_error', 'splitter': 'best'}. Best is trial 368 with value: 0.6055877317086851.
[I 2024-12-04 11:54:58,339] Trial 590 finished with value: 0.6657045440033218 and parameters: {'max_depth': 35, 'min_samples_split': 12, 'min_samples_leaf': 1, 'max_features': 'sqrt', 'criterion': 'friedman_mse', 'splitter': 'best'}. Best is trial 368 with value: 0.6055877317086851.
[I 2024-12-04 11:54:58,758] Trial 598 finished with value: 0.6379386941389483 and parameters: {'max_depth': 34, 'min_samples_split': 12, 'min_samples_leaf': 1, 'max_features': 'sqrt', 'criterion': 'friedman_mse', 'splitter': 'best'}. Best is trial 368 with value: 0.6055877317086851.
[I 2024-12-04 11:54:58,845] Trial 605 finished with value: 1.0921060730368772 and parameters: {'max_depth': 2, 'min_samples_split': 7, 'min_samples_leaf': 4, 'max_features': 'log2', 'criterion': 'squared_error', 'splitter': 'random'}. Best is trial 368 with value: 0.6055877317086851.
[I 2024-12-04 11:54:59,107] Trial 604 finished with value: 1.0740768482351102 and parameters: {'max_depth': 18, 'min_samples_split': 15, 'min_samples_leaf': 7, 'max_features': 'log2', 'criterion': 'absolute_error', 'splitter': 'best'}. Best is trial 368 with value: 0.6055877317086851.
[I 2024-12-04 11:54:59,169] Trial 595 finished with value: 1.075383350593605 and parameters: {'max_depth': 18, 'min_samples_split': 9, 'min_samples_leaf': 9, 'max_features': 'sqrt', 'criterion': 'absolute_error', 'splitter': 'random'}. Best is trial 368 with value: 0.6055877317086851.
[I 2024-12-04 11:54:59,831] Trial 608 finished with value: 0.6702654654144604 and parameters: {'max_depth': 35, 'min_samples_split': 14, 'min_samples_leaf': 1, 'max_features': 'sqrt', 'criterion': 'friedman_mse', 'splitter': 'best'}. Best is trial 368 with value: 0.6055877317086851.
[I 2024-12-04 11:55:00,422] Trial 606 finished with value: 1.075383350593605 and parameters: {'max_depth': 17, 'min_samples_split': 16, 'min_samples_leaf': 7, 'max_features': 'sqrt', 'criterion': 'absolute_error', 'splitter': 'random'}. Best is trial 368 with value: 0.6055877317086851.
[I 2024-12-04 11:55:00,837] Trial 607 finished with value: 0.8345781205487174 and parameters: {'max_depth': 35, 'min_samples_split': 14, 'min_samples_leaf': 4, 'max_features': 'sqrt', 'criterion': 'absolute_error', 'splitter': 'best'}. Best is trial 368 with value: 0.6055877317086851.
[I 2024-12-04 11:55:00,838] Trial 596 finished with value: 0.8125271942876539 and parameters: {'max_depth': 35, 'min_samples_split': 11, 'min_samples_leaf': 3, 'max_features': 'sqrt', 'criterion': 'friedman_mse', 'splitter': 'best'}. Best is trial 368 with value: 0.6055877317086851.
[I 2024-12-04 11:55:01,138] Trial 611 finished with value: 0.825562298787238 and parameters: {'max_depth': 31, 'min_samples_split': 14, 'min_samples_leaf': 3, 'max_features': 'sqrt', 'criterion': 'friedman_mse', 'splitter': 'best'}. Best is trial 368 with value: 0.6055877317086851.
[I 2024-12-04 11:55:01,524] Trial 615 finished with value: 1.091656728529238 and parameters: {'max_depth': 33, 'min_samples_split': 4, 'min_samples_leaf': 6, 'max_features': 'log2', 'criterion': 'friedman_mse', 'splitter': 'best'}. Best is trial 368 with value: 0.6055877317086851.
[I 2024-12-04 11:55:01,539] Trial 613 finished with value: 0.6935908088501267 and parameters: {'max_depth': 35, 'min_samples_split': 10, 'min_samples_leaf': 1, 'max_features': 'sqrt', 'criterion': 'friedman_mse', 'splitter': 'best'}. Best is trial 368 with value: 0.6055877317086851.
[I 2024-12-04 11:55:02,912] Trial 610 finished with value: 0.6570109226401653 and parameters: {'max_depth': 35, 'min_samples_split': 11, 'min_samples_leaf': 1, 'max_features': 'sqrt', 'criterion': 'friedman_mse', 'splitter': 'best'}. Best is trial 368 with value: 0.6055877317086851.
[I 2024-12-04 11:55:02,913] Trial 616 finished with value: 0.6379386941389483 and parameters: {'max_depth': 34, 'min_samples_split': 12, 'min_samples_leaf': 1, 'max_features': 'sqrt', 'criterion': 'friedman_mse', 'splitter': 'best'}. Best is trial 368 with value: 0.6055877317086851.
[I 2024-12-04 11:55:03,529] Trial 622 finished with value: 1.0844620460096857 and parameters: {'max_depth': 3, 'min_samples_split': 2, 'min_samples_leaf': 5, 'max_features': 'log2', 'criterion': 'squared_error', 'splitter': 'best'}. Best is trial 368 with value: 0.6055877317086851.
[I 2024-12-04 11:55:03,857] Trial 609 finished with value: 0.6711157030813905 and parameters: {'max_depth': 34, 'min_samples_split': 13, 'min_samples_leaf': 1, 'max_features': 'sqrt', 'criterion': 'friedman_mse', 'splitter': 'best'}. Best is trial 368 with value: 0.6055877317086851.
[I 2024-12-04 11:55:04,000] Trial 620 finished with value: 0.8197632085734636 and parameters: {'max_depth': 35, 'min_samples_split': 14, 'min_samples_leaf': 2, 'max_features': 'sqrt', 'criterion': 'friedman_mse', 'splitter': 'best'}. Best is trial 368 with value: 0.6055877317086851.
