[I 2024-12-04 13:35:18,705] Trial 2058 finished with value: 0.2436450055128277 and parameters: {'n_estimators': 1454, 'learning_rate': 0.08285712596460558, 'max_depth': 8, 'min_samples_split': 6, 'min_samples_leaf': 1, 'subsample': 0.7996921382479785, 'max_features': 'sqrt'}. Best is trial 1389 with value: 0.22332552856343169.
[I 2024-12-04 13:35:22,103] Trial 2084 finished with value: 0.6245681035951952 and parameters: {'n_estimators': 478, 'learning_rate': 0.029538181649729277, 'max_depth': 12, 'min_samples_split': 2, 'min_samples_leaf': 9, 'subsample': 0.6029071218022592, 'max_features': 'sqrt'}. Best is trial 1389 with value: 0.22332552856343169.
[I 2024-12-04 13:35:22,315] Trial 2059 finished with value: 0.24210127629485578 and parameters: {'n_estimators': 1460, 'learning_rate': 0.04318365195790556, 'max_depth': 10, 'min_samples_split': 3, 'min_samples_leaf': 1, 'subsample': 0.6988840911911094, 'max_features': 'sqrt'}. Best is trial 1389 with value: 0.22332552856343169.
[I 2024-12-04 13:35:29,645] Trial 2061 finished with value: 0.3563934476047234 and parameters: {'n_estimators': 1496, 'learning_rate': 0.09934240947068741, 'max_depth': 7, 'min_samples_split': 6, 'min_samples_leaf': 3, 'subsample': 0.8001939848625871, 'max_features': 'sqrt'}. Best is trial 1389 with value: 0.22332552856343169.
[I 2024-12-04 13:35:33,890] Trial 2068 finished with value: 0.23408369087980913 and parameters: {'n_estimators': 1283, 'learning_rate': 0.0706028174158117, 'max_depth': 8, 'min_samples_split': 7, 'min_samples_leaf': 1, 'subsample': 0.8419718762876753, 'max_features': 'sqrt'}. Best is trial 1389 with value: 0.22332552856343169.
[I 2024-12-04 13:35:37,046] Trial 2078 finished with value: 0.25083044481271805 and parameters: {'n_estimators': 932, 'learning_rate': 0.05887746607011846, 'max_depth': 7, 'min_samples_split': 3, 'min_samples_leaf': 1, 'subsample': 0.8018900243329395, 'max_features': 'sqrt'}. Best is trial 1389 with value: 0.22332552856343169.
[I 2024-12-04 13:35:38,611] Trial 2063 finished with value: 0.24235943611839408 and parameters: {'n_estimators': 1453, 'learning_rate': 0.07734624505177323, 'max_depth': 12, 'min_samples_split': 8, 'min_samples_leaf': 1, 'subsample': 0.6303461760574403, 'max_features': 'sqrt'}. Best is trial 1389 with value: 0.22332552856343169.
[I 2024-12-04 13:35:42,044] Trial 2075 finished with value: 0.35914949374563754 and parameters: {'n_estimators': 1144, 'learning_rate': 0.044663074137948275, 'max_depth': 7, 'min_samples_split': 2, 'min_samples_leaf': 3, 'subsample': 0.9481791059521566, 'max_features': 'sqrt'}. Best is trial 1389 with value: 0.22332552856343169.
[I 2024-12-04 13:35:45,364] Trial 2081 finished with value: 0.2804858325908095 and parameters: {'n_estimators': 904, 'learning_rate': 0.06872384011227307, 'max_depth': 5, 'min_samples_split': 8, 'min_samples_leaf': 1, 'subsample': 0.6875171713798257, 'max_features': 'sqrt'}. Best is trial 1389 with value: 0.22332552856343169.
[I 2024-12-04 13:35:46,566] Trial 2069 finished with value: 0.3597108730555323 and parameters: {'n_estimators': 1378, 'learning_rate': 0.07118495343964844, 'max_depth': 8, 'min_samples_split': 4, 'min_samples_leaf': 3, 'subsample': 0.7295368646136654, 'max_features': 'sqrt'}. Best is trial 1389 with value: 0.22332552856343169.
[I 2024-12-04 13:35:49,083] Trial 2073 finished with value: 0.3560032445731702 and parameters: {'n_estimators': 1278, 'learning_rate': 0.06690346248607514, 'max_depth': 9, 'min_samples_split': 5, 'min_samples_leaf': 3, 'subsample': 0.8030267958469768, 'max_features': 'sqrt'}. Best is trial 1389 with value: 0.22332552856343169.
[I 2024-12-04 13:35:49,083] Trial 2070 finished with value: 0.24364144374949082 and parameters: {'n_estimators': 1458, 'learning_rate': 0.04972320471236797, 'max_depth': 12, 'min_samples_split': 7, 'min_samples_leaf': 1, 'subsample': 0.6249653515780148, 'max_features': 'sqrt'}. Best is trial 1389 with value: 0.22332552856343169.
[I 2024-12-04 13:35:51,770] Trial 2087 finished with value: 0.43967596021904093 and parameters: {'n_estimators': 745, 'learning_rate': 0.03860869641681951, 'max_depth': 7, 'min_samples_split': 13, 'min_samples_leaf': 7, 'subsample': 0.8128092531752121, 'max_features': None}. Best is trial 1389 with value: 0.22332552856343169.
[I 2024-12-04 13:35:51,773] Trial 2093 finished with value: 0.3346493590640595 and parameters: {'n_estimators': 529, 'learning_rate': 0.07734123807633263, 'max_depth': 4, 'min_samples_split': 4, 'min_samples_leaf': 1, 'subsample': 0.8854234857566327, 'max_features': None}. Best is trial 1389 with value: 0.22332552856343169.
[I 2024-12-04 13:35:54,114] Trial 2080 finished with value: 0.29694480146717805 and parameters: {'n_estimators': 1079, 'learning_rate': 0.09266475605935406, 'max_depth': 10, 'min_samples_split': 4, 'min_samples_leaf': 2, 'subsample': 0.749668068226114, 'max_features': 'sqrt'}. Best is trial 1389 with value: 0.22332552856343169.
[I 2024-12-04 13:35:54,464] Trial 2077 finished with value: 0.35220459106307206 and parameters: {'n_estimators': 1215, 'learning_rate': 0.09892144155925879, 'max_depth': 8, 'min_samples_split': 2, 'min_samples_leaf': 3, 'subsample': 0.8902159264671055, 'max_features': 'sqrt'}. Best is trial 1389 with value: 0.22332552856343169.
[I 2024-12-04 13:35:56,716] Trial 2072 finished with value: 0.24240137034151432 and parameters: {'n_estimators': 1493, 'learning_rate': 0.07978003924449033, 'max_depth': 8, 'min_samples_split': 2, 'min_samples_leaf': 1, 'subsample': 0.7680463269913703, 'max_features': 'sqrt'}. Best is trial 1389 with value: 0.22332552856343169.
[I 2024-12-04 13:36:02,026] Trial 2076 finished with value: 0.24889891205416007 and parameters: {'n_estimators': 1219, 'learning_rate': 0.05546845733653695, 'max_depth': 6, 'min_samples_split': 3, 'min_samples_leaf': 1, 'subsample': 0.7585499114471279, 'max_features': 'sqrt'}. Best is trial 1389 with value: 0.22332552856343169.
[I 2024-12-04 13:36:02,681] Trial 2100 finished with value: 0.5333369395224657 and parameters: {'n_estimators': 455, 'learning_rate': 0.02628865395172252, 'max_depth': 12, 'min_samples_split': 9, 'min_samples_leaf': 2, 'subsample': 0.7521580980179391, 'max_features': 'log2'}. Best is trial 1389 with value: 0.22332552856343169.
[I 2024-12-04 13:36:03,138] Trial 2088 finished with value: 0.26282943235163053 and parameters: {'n_estimators': 939, 'learning_rate': 0.0978869092293802, 'max_depth': 7, 'min_samples_split': 6, 'min_samples_leaf': 1, 'subsample': 0.9374072624407922, 'max_features': 'sqrt'}. Best is trial 1389 with value: 0.22332552856343169.
[I 2024-12-04 13:36:03,877] Trial 2086 finished with value: 0.2586584636585756 and parameters: {'n_estimators': 941, 'learning_rate': 0.08846409496877053, 'max_depth': 7, 'min_samples_split': 5, 'min_samples_leaf': 1, 'subsample': 0.907990655417808, 'max_features': 'sqrt'}. Best is trial 1389 with value: 0.22332552856343169.
[I 2024-12-04 13:36:05,850] Trial 2074 finished with value: 0.2660008635113664 and parameters: {'n_estimators': 1449, 'learning_rate': 0.09639203914580735, 'max_depth': 8, 'min_samples_split': 6, 'min_samples_leaf': 1, 'subsample': 0.7383413133947798, 'max_features': 'sqrt'}. Best is trial 1389 with value: 0.22332552856343169.
[I 2024-12-04 13:36:07,523] Trial 2082 finished with value: 0.26130060287653833 and parameters: {'n_estimators': 1157, 'learning_rate': 0.05405206844203401, 'max_depth': 7, 'min_samples_split': 2, 'min_samples_leaf': 1, 'subsample': 0.8424483654350412, 'max_features': 'sqrt'}. Best is trial 1389 with value: 0.22332552856343169.
[I 2024-12-04 13:36:12,223] Trial 2098 finished with value: 0.3562358327393822 and parameters: {'n_estimators': 696, 'learning_rate': 0.05596755949237932, 'max_depth': 7, 'min_samples_split': 4, 'min_samples_leaf': 3, 'subsample': 0.8458339831599716, 'max_features': 'sqrt'}. Best is trial 1389 with value: 0.22332552856343169.
[I 2024-12-04 13:36:21,658] Trial 2101 finished with value: 0.41839846623357574 and parameters: {'n_estimators': 715, 'learning_rate': 0.01520551486762322, 'max_depth': 7, 'min_samples_split': 3, 'min_samples_leaf': 2, 'subsample': 0.7163701119122153, 'max_features': 'sqrt'}. Best is trial 1389 with value: 0.22332552856343169.
[I 2024-12-04 13:36:22,353] Trial 2091 finished with value: 0.4240057900406548 and parameters: {'n_estimators': 1057, 'learning_rate': 0.041102899469130476, 'max_depth': 8, 'min_samples_split': 16, 'min_samples_leaf': 5, 'subsample': 0.7283619939568022, 'max_features': None}. Best is trial 1389 with value: 0.22332552856343169.
[I 2024-12-04 13:36:27,126] Trial 2083 finished with value: 0.38352045095461423 and parameters: {'n_estimators': 1358, 'learning_rate': 0.013658050618278829, 'max_depth': 10, 'min_samples_split': 5, 'min_samples_leaf': 1, 'subsample': 0.9805014283205856, 'max_features': None}. Best is trial 1389 with value: 0.22332552856343169.
[I 2024-12-04 13:36:27,212] Trial 2097 finished with value: 0.9232042065411603 and parameters: {'n_estimators': 1071, 'learning_rate': 0.012082283878384432, 'max_depth': 11, 'min_samples_split': 16, 'min_samples_leaf': 8, 'subsample': 0.9950878880205016, 'max_features': 'log2'}. Best is trial 1389 with value: 0.22332552856343169.
[I 2024-12-04 13:36:31,919] Trial 2094 finished with value: 0.29128096129863384 and parameters: {'n_estimators': 1180, 'learning_rate': 0.07455996466721641, 'max_depth': 6, 'min_samples_split': 10, 'min_samples_leaf': 2, 'subsample': 0.7222315352445915, 'max_features': 'sqrt'}. Best is trial 1389 with value: 0.22332552856343169.
[I 2024-12-04 13:36:37,064] Trial 2089 finished with value: 0.40915955570788276 and parameters: {'n_estimators': 1481, 'learning_rate': 0.08737092178802078, 'max_depth': 12, 'min_samples_split': 19, 'min_samples_leaf': 6, 'subsample': 0.8863406092656506, 'max_features': 'sqrt'}. Best is trial 1389 with value: 0.22332552856343169.
[I 2024-12-04 13:36:40,148] Trial 2096 finished with value: 0.3887215989903036 and parameters: {'n_estimators': 1241, 'learning_rate': 0.0960885382136353, 'max_depth': 10, 'min_samples_split': 8, 'min_samples_leaf': 3, 'subsample': 0.6123796710102895, 'max_features': 'sqrt'}. Best is trial 1389 with value: 0.22332552856343169.
[I 2024-12-04 13:36:41,652] Trial 2095 finished with value: 0.2417546112967583 and parameters: {'n_estimators': 1293, 'learning_rate': 0.08880017308198541, 'max_depth': 7, 'min_samples_split': 5, 'min_samples_leaf': 1, 'subsample': 0.906954072307555, 'max_features': 'sqrt'}. Best is trial 1389 with value: 0.22332552856343169.
[I 2024-12-04 13:36:42,667] Trial 2099 finished with value: 0.23162954534703353 and parameters: {'n_estimators': 1146, 'learning_rate': 0.07487823212618332, 'max_depth': 8, 'min_samples_split': 6, 'min_samples_leaf': 1, 'subsample': 0.8715323127451785, 'max_features': 'sqrt'}. Best is trial 1389 with value: 0.22332552856343169.
[I 2024-12-04 13:36:43,162] Trial 2112 finished with value: 0.3676559194636027 and parameters: {'n_estimators': 616, 'learning_rate': 0.08535630564313189, 'max_depth': 8, 'min_samples_split': 5, 'min_samples_leaf': 3, 'subsample': 0.9686633591186363, 'max_features': 'sqrt'}. Best is trial 1389 with value: 0.22332552856343169.
[I 2024-12-04 13:36:45,428] Trial 2106 finished with value: 0.7349417794270752 and parameters: {'n_estimators': 921, 'learning_rate': 0.026460266276259328, 'max_depth': 3, 'min_samples_split': 10, 'min_samples_leaf': 7, 'subsample': 0.9649837520226889, 'max_features': 'log2'}. Best is trial 1389 with value: 0.22332552856343169.
[I 2024-12-04 13:36:47,213] Trial 2110 finished with value: 0.5012043499620201 and parameters: {'n_estimators': 715, 'learning_rate': 0.02867758272026435, 'max_depth': 12, 'min_samples_split': 4, 'min_samples_leaf': 10, 'subsample': 0.9644520742422396, 'max_features': 'sqrt'}. Best is trial 1389 with value: 0.22332552856343169.
[I 2024-12-04 13:36:49,182] Trial 2090 finished with value: 0.434273824785694 and parameters: {'n_estimators': 1463, 'learning_rate': 0.03459943921185944, 'max_depth': 8, 'min_samples_split': 8, 'min_samples_leaf': 6, 'subsample': 0.9934237041001649, 'max_features': None}. Best is trial 1389 with value: 0.22332552856343169.
[I 2024-12-04 13:36:49,186] Trial 2092 finished with value: 0.26412904016238936 and parameters: {'n_estimators': 1466, 'learning_rate': 0.06630124752781216, 'max_depth': 12, 'min_samples_split': 4, 'min_samples_leaf': 1, 'subsample': 0.6546053045523675, 'max_features': 'sqrt'}. Best is trial 1389 with value: 0.22332552856343169.
[I 2024-12-04 13:36:50,713] Trial 2103 finished with value: 0.4276976159717664 and parameters: {'n_estimators': 1133, 'learning_rate': 0.057212889473489396, 'max_depth': 3, 'min_samples_split': 5, 'min_samples_leaf': 2, 'subsample': 0.9993303042757, 'max_features': 'log2'}. Best is trial 1389 with value: 0.22332552856343169.
[I 2024-12-04 13:36:57,250] Trial 2102 finished with value: 0.4098493935319398 and parameters: {'n_estimators': 1153, 'learning_rate': 0.056923791541809196, 'max_depth': 12, 'min_samples_split': 2, 'min_samples_leaf': 4, 'subsample': 0.6420988805418394, 'max_features': None}. Best is trial 1389 with value: 0.22332552856343169.
[I 2024-12-04 13:36:59,799] Trial 2107 finished with value: 0.2650313167636509 and parameters: {'n_estimators': 1033, 'learning_rate': 0.08840549478718894, 'max_depth': 10, 'min_samples_split': 6, 'min_samples_leaf': 1, 'subsample': 0.8593161636378466, 'max_features': 'sqrt'}. Best is trial 1389 with value: 0.22332552856343169.
[I 2024-12-04 13:37:04,566] Trial 2105 finished with value: 0.2447575823554876 and parameters: {'n_estimators': 1219, 'learning_rate': 0.08193162234493895, 'max_depth': 8, 'min_samples_split': 3, 'min_samples_leaf': 1, 'subsample': 0.764296757973903, 'max_features': 'sqrt'}. Best is trial 1389 with value: 0.22332552856343169.
[I 2024-12-04 13:37:08,830] Trial 2104 finished with value: 0.26579568399817993 and parameters: {'n_estimators': 1310, 'learning_rate': 0.05165346371553257, 'max_depth': 8, 'min_samples_split': 9, 'min_samples_leaf': 1, 'subsample': 0.8066340563450942, 'max_features': 'sqrt'}. Best is trial 1389 with value: 0.22332552856343169.
[I 2024-12-04 13:37:09,656] Trial 2111 finished with value: 0.2512404591408167 and parameters: {'n_estimators': 993, 'learning_rate': 0.039727328355367915, 'max_depth': 12, 'min_samples_split': 6, 'min_samples_leaf': 1, 'subsample': 0.6790906430959017, 'max_features': 'sqrt'}. Best is trial 1389 with value: 0.22332552856343169.
[I 2024-12-04 13:37:14,818] Trial 2108 finished with value: 0.35125741054045656 and parameters: {'n_estimators': 1202, 'learning_rate': 0.06332068319738965, 'max_depth': 4, 'min_samples_split': 5, 'min_samples_leaf': 3, 'subsample': 0.6621609930622787, 'max_features': 'sqrt'}. Best is trial 1389 with value: 0.22332552856343169.
[I 2024-12-04 13:37:15,488] Trial 2121 finished with value: 0.42121419749245737 and parameters: {'n_estimators': 739, 'learning_rate': 0.025234490255466455, 'max_depth': 6, 'min_samples_split': 7, 'min_samples_leaf': 4, 'subsample': 0.6697231461967649, 'max_features': None}. Best is trial 1389 with value: 0.22332552856343169.
[I 2024-12-04 13:37:18,038] Trial 2126 finished with value: 0.26771248910512063 and parameters: {'n_estimators': 635, 'learning_rate': 0.09342711131601117, 'max_depth': 8, 'min_samples_split': 2, 'min_samples_leaf': 1, 'subsample': 0.8465475548979361, 'max_features': 'sqrt'}. Best is trial 1389 with value: 0.22332552856343169.
[I 2024-12-04 13:37:25,857] Trial 2141 finished with value: 0.8912291886646575 and parameters: {'n_estimators': 152, 'learning_rate': 0.022470668727269435, 'max_depth': 8, 'min_samples_split': 7, 'min_samples_leaf': 7, 'subsample': 0.8793363291365572, 'max_features': 'sqrt'}. Best is trial 1389 with value: 0.22332552856343169.
[I 2024-12-04 13:37:29,526] Trial 2123 finished with value: 0.3985035876255085 and parameters: {'n_estimators': 863, 'learning_rate': 0.09267489774916501, 'max_depth': 7, 'min_samples_split': 6, 'min_samples_leaf': 2, 'subsample': 0.9072359732288136, 'max_features': None}. Best is trial 1389 with value: 0.22332552856343169.
[I 2024-12-04 13:37:35,010] Trial 2109 finished with value: 0.24049364918869473 and parameters: {'n_estimators': 1472, 'learning_rate': 0.08671775439776191, 'max_depth': 5, 'min_samples_split': 3, 'min_samples_leaf': 1, 'subsample': 0.8476714598270076, 'max_features': 'sqrt'}. Best is trial 1389 with value: 0.22332552856343169.
[I 2024-12-04 13:37:38,216] Trial 2119 finished with value: 0.2888222021303193 and parameters: {'n_estimators': 1161, 'learning_rate': 0.056755211266484494, 'max_depth': 7, 'min_samples_split': 2, 'min_samples_leaf': 1, 'subsample': 0.9158561651452516, 'max_features': 'sqrt'}. Best is trial 1389 with value: 0.22332552856343169.
[I 2024-12-04 13:37:38,315] Trial 2115 finished with value: 0.3397098290174761 and parameters: {'n_estimators': 1316, 'learning_rate': 0.0964120689799639, 'max_depth': 10, 'min_samples_split': 3, 'min_samples_leaf': 3, 'subsample': 0.7753744539035038, 'max_features': 'sqrt'}. Best is trial 1389 with value: 0.22332552856343169.
[I 2024-12-04 13:37:42,747] Trial 2127 finished with value: 0.26442163289955894 and parameters: {'n_estimators': 970, 'learning_rate': 0.09919159196875581, 'max_depth': 6, 'min_samples_split': 7, 'min_samples_leaf': 1, 'subsample': 0.7679006952326736, 'max_features': 'sqrt'}. Best is trial 1389 with value: 0.22332552856343169.
[I 2024-12-04 13:37:42,763] Trial 2113 finished with value: 0.25751817916245956 and parameters: {'n_estimators': 1386, 'learning_rate': 0.056018007117237936, 'max_depth': 6, 'min_samples_split': 3, 'min_samples_leaf': 1, 'subsample': 0.7954484929753558, 'max_features': 'sqrt'}. Best is trial 1389 with value: 0.22332552856343169.
[I 2024-12-04 13:37:44,489] Trial 2114 finished with value: 0.2519203352228241 and parameters: {'n_estimators': 1440, 'learning_rate': 0.03773088532532747, 'max_depth': 5, 'min_samples_split': 2, 'min_samples_leaf': 1, 'subsample': 0.8250251880925072, 'max_features': 'sqrt'}. Best is trial 1389 with value: 0.22332552856343169.
[I 2024-12-04 13:37:46,216] Trial 2134 finished with value: 0.4409050642755569 and parameters: {'n_estimators': 645, 'learning_rate': 0.03441090900139372, 'max_depth': 7, 'min_samples_split': 7, 'min_samples_leaf': 8, 'subsample': 0.9941629725318198, 'max_features': 'sqrt'}. Best is trial 1389 with value: 0.22332552856343169.
[I 2024-12-04 13:37:52,227] Trial 2117 finished with value: 0.29009019266060276 and parameters: {'n_estimators': 1347, 'learning_rate': 0.054873487645951825, 'max_depth': 6, 'min_samples_split': 8, 'min_samples_leaf': 1, 'subsample': 0.6126208927188684, 'max_features': 'log2'}. Best is trial 1389 with value: 0.22332552856343169.
[I 2024-12-04 13:37:54,120] Trial 2139 finished with value: 0.3157860846415736 and parameters: {'n_estimators': 592, 'learning_rate': 0.07145989625256675, 'max_depth': 9, 'min_samples_split': 11, 'min_samples_leaf': 1, 'subsample': 0.6277665281024424, 'max_features': None}. Best is trial 1389 with value: 0.22332552856343169.
[I 2024-12-04 13:37:54,227] Trial 2120 finished with value: 0.26645247256370486 and parameters: {'n_estimators': 1381, 'learning_rate': 0.0364512026205583, 'max_depth': 7, 'min_samples_split': 2, 'min_samples_leaf': 1, 'subsample': 0.7905488973300776, 'max_features': 'sqrt'}. Best is trial 1389 with value: 0.22332552856343169.
[I 2024-12-04 13:37:54,268] Trial 2130 finished with value: 0.3562103196711704 and parameters: {'n_estimators': 929, 'learning_rate': 0.07615813238179599, 'max_depth': 7, 'min_samples_split': 8, 'min_samples_leaf': 3, 'subsample': 0.8565319952952601, 'max_features': 'sqrt'}. Best is trial 1389 with value: 0.22332552856343169.
[I 2024-12-04 13:37:54,878] Trial 2125 finished with value: 0.2846846796945992 and parameters: {'n_estimators': 1212, 'learning_rate': 0.03591602534862468, 'max_depth': 8, 'min_samples_split': 4, 'min_samples_leaf': 1, 'subsample': 0.8080098015510391, 'max_features': 'log2'}. Best is trial 1389 with value: 0.22332552856343169.
[I 2024-12-04 13:38:01,831] Trial 2122 finished with value: 0.348902063994048 and parameters: {'n_estimators': 1420, 'learning_rate': 0.06594390814108538, 'max_depth': 6, 'min_samples_split': 4, 'min_samples_leaf': 3, 'subsample': 0.7820605395665072, 'max_features': 'sqrt'}. Best is trial 1389 with value: 0.22332552856343169.
[I 2024-12-04 13:38:01,850] Trial 2116 finished with value: 0.40969115882485985 and parameters: {'n_estimators': 1358, 'learning_rate': 0.04568692519779661, 'max_depth': 6, 'min_samples_split': 7, 'min_samples_leaf': 4, 'subsample': 0.6217054062127071, 'max_features': None}. Best is trial 1389 with value: 0.22332552856343169.
[I 2024-12-04 13:38:04,706] Trial 2118 finished with value: 0.2432362799719612 and parameters: {'n_estimators': 1484, 'learning_rate': 0.042060706958844, 'max_depth': 9, 'min_samples_split': 2, 'min_samples_leaf': 1, 'subsample': 0.7102841079288973, 'max_features': 'sqrt'}. Best is trial 1389 with value: 0.22332552856343169.
[I 2024-12-04 13:38:06,549] Trial 2131 finished with value: 0.27505582105414544 and parameters: {'n_estimators': 1052, 'learning_rate': 0.06700832952517724, 'max_depth': 8, 'min_samples_split': 8, 'min_samples_leaf': 1, 'subsample': 0.865717599635128, 'max_features': 'sqrt'}. Best is trial 1389 with value: 0.22332552856343169.
[I 2024-12-04 13:38:07,800] Trial 2124 finished with value: 0.3527990131547434 and parameters: {'n_estimators': 1335, 'learning_rate': 0.07001132824410305, 'max_depth': 8, 'min_samples_split': 5, 'min_samples_leaf': 1, 'subsample': 0.9918754917907606, 'max_features': None}. Best is trial 1389 with value: 0.22332552856343169.
