[I 2024-12-04 15:15:35,973] Trial 1674 finished with value: 0.48829945187398505 and parameters: {'n_estimators': 803, 'learning_rate': 0.07225152984488993, 'max_depth': 10, 'min_samples_split': 20, 'min_samples_leaf': 1, 'subsample': 0.9480624576604243, 'max_features': None}. Best is trial 1435 with value: 0.45467030752684195.
[I 2024-12-04 15:15:36,298] Trial 1668 finished with value: 0.6571472264620497 and parameters: {'n_estimators': 973, 'learning_rate': 0.09634129855862944, 'max_depth': 12, 'min_samples_split': 17, 'min_samples_leaf': 2, 'subsample': 0.9421802486124089, 'max_features': None}. Best is trial 1435 with value: 0.45467030752684195.
[I 2024-12-04 15:15:37,348] Trial 1692 finished with value: 0.6348680081498711 and parameters: {'n_estimators': 353, 'learning_rate': 0.07030765436412191, 'max_depth': 11, 'min_samples_split': 7, 'min_samples_leaf': 3, 'subsample': 0.813611660831333, 'max_features': None}. Best is trial 1435 with value: 0.45467030752684195.
[I 2024-12-04 15:15:37,957] Trial 1666 finished with value: 0.5339325389506139 and parameters: {'n_estimators': 1133, 'learning_rate': 0.09053836568234054, 'max_depth': 12, 'min_samples_split': 14, 'min_samples_leaf': 1, 'subsample': 0.9280862324336341, 'max_features': None}. Best is trial 1435 with value: 0.45467030752684195.
[I 2024-12-04 15:15:39,741] Trial 1667 finished with value: 0.6102577493534208 and parameters: {'n_estimators': 1142, 'learning_rate': 0.08814849995514369, 'max_depth': 12, 'min_samples_split': 18, 'min_samples_leaf': 2, 'subsample': 0.9438082768341086, 'max_features': None}. Best is trial 1435 with value: 0.45467030752684195.
[I 2024-12-04 15:15:39,741] Trial 1688 finished with value: 0.5969470407445273 and parameters: {'n_estimators': 444, 'learning_rate': 0.09399352968063804, 'max_depth': 12, 'min_samples_split': 8, 'min_samples_leaf': 4, 'subsample': 0.7884138586996219, 'max_features': None}. Best is trial 1435 with value: 0.45467030752684195.
[I 2024-12-04 15:15:40,557] Trial 1677 finished with value: 0.6451038299375602 and parameters: {'n_estimators': 763, 'learning_rate': 0.07924738348049892, 'max_depth': 11, 'min_samples_split': 20, 'min_samples_leaf': 2, 'subsample': 0.8602094064630126, 'max_features': None}. Best is trial 1435 with value: 0.45467030752684195.
[I 2024-12-04 15:15:41,399] Trial 1683 finished with value: 0.5929711428213736 and parameters: {'n_estimators': 652, 'learning_rate': 0.06978932028924738, 'max_depth': 12, 'min_samples_split': 19, 'min_samples_leaf': 2, 'subsample': 0.985676876695511, 'max_features': None}. Best is trial 1435 with value: 0.45467030752684195.
[I 2024-12-04 15:15:44,612] Trial 1670 finished with value: 0.4963560999572111 and parameters: {'n_estimators': 1101, 'learning_rate': 0.09932260209747146, 'max_depth': 11, 'min_samples_split': 17, 'min_samples_leaf': 1, 'subsample': 0.9518588587316414, 'max_features': None}. Best is trial 1435 with value: 0.45467030752684195.
[I 2024-12-04 15:15:45,229] Trial 1685 finished with value: 0.6567948825920753 and parameters: {'n_estimators': 704, 'learning_rate': 0.09467166014471916, 'max_depth': 12, 'min_samples_split': 20, 'min_samples_leaf': 3, 'subsample': 0.9587163098808744, 'max_features': None}. Best is trial 1435 with value: 0.45467030752684195.
[I 2024-12-04 15:15:45,230] Trial 1695 finished with value: 0.7886125163084183 and parameters: {'n_estimators': 592, 'learning_rate': 0.018664600864000833, 'max_depth': 4, 'min_samples_split': 20, 'min_samples_leaf': 1, 'subsample': 0.9089529600873082, 'max_features': 'log2'}. Best is trial 1435 with value: 0.45467030752684195.
[I 2024-12-04 15:15:46,136] Trial 1675 finished with value: 0.4649180395880312 and parameters: {'n_estimators': 917, 'learning_rate': 0.07909637082742348, 'max_depth': 12, 'min_samples_split': 18, 'min_samples_leaf': 1, 'subsample': 0.9293306835491746, 'max_features': None}. Best is trial 1435 with value: 0.45467030752684195.
[I 2024-12-04 15:15:46,416] Trial 1681 finished with value: 0.49473516801535017 and parameters: {'n_estimators': 882, 'learning_rate': 0.09990488141931676, 'max_depth': 12, 'min_samples_split': 17, 'min_samples_leaf': 1, 'subsample': 0.9058123399376339, 'max_features': None}. Best is trial 1435 with value: 0.45467030752684195.
[I 2024-12-04 15:15:47,755] Trial 1682 finished with value: 0.6396730031523831 and parameters: {'n_estimators': 853, 'learning_rate': 0.08902963671953852, 'max_depth': 11, 'min_samples_split': 20, 'min_samples_leaf': 2, 'subsample': 0.9867556219049763, 'max_features': None}. Best is trial 1435 with value: 0.45467030752684195.
[I 2024-12-04 15:15:48,184] Trial 1694 finished with value: 0.6220469721439877 and parameters: {'n_estimators': 705, 'learning_rate': 0.03086475383825277, 'max_depth': 6, 'min_samples_split': 19, 'min_samples_leaf': 1, 'subsample': 0.8221495863081991, 'max_features': 'log2'}. Best is trial 1435 with value: 0.45467030752684195.
[I 2024-12-04 15:15:49,129] Trial 1686 finished with value: 0.6269453916623656 and parameters: {'n_estimators': 747, 'learning_rate': 0.061738736418364845, 'max_depth': 9, 'min_samples_split': 20, 'min_samples_leaf': 2, 'subsample': 0.9754490068168556, 'max_features': None}. Best is trial 1435 with value: 0.45467030752684195.
[I 2024-12-04 15:15:50,294] Trial 1679 finished with value: 0.6451610184378715 and parameters: {'n_estimators': 1024, 'learning_rate': 0.09330755265637836, 'max_depth': 11, 'min_samples_split': 20, 'min_samples_leaf': 2, 'subsample': 0.9174789021922574, 'max_features': None}. Best is trial 1435 with value: 0.45467030752684195.
[I 2024-12-04 15:15:51,193] Trial 1690 finished with value: 0.6268085038636103 and parameters: {'n_estimators': 717, 'learning_rate': 0.09379762881997909, 'max_depth': 12, 'min_samples_split': 20, 'min_samples_leaf': 2, 'subsample': 0.961085515308197, 'max_features': None}. Best is trial 1435 with value: 0.45467030752684195.
[I 2024-12-04 15:15:51,462] Trial 1711 finished with value: 0.6786031041338211 and parameters: {'n_estimators': 264, 'learning_rate': 0.03357079507321446, 'max_depth': 9, 'min_samples_split': 3, 'min_samples_leaf': 5, 'subsample': 0.8997753808141693, 'max_features': 'sqrt'}. Best is trial 1435 with value: 0.45467030752684195.
[I 2024-12-04 15:15:53,372] Trial 1673 finished with value: 0.5101978936512835 and parameters: {'n_estimators': 1140, 'learning_rate': 0.09445466850007556, 'max_depth': 12, 'min_samples_split': 16, 'min_samples_leaf': 1, 'subsample': 0.9539093887089575, 'max_features': None}. Best is trial 1435 with value: 0.45467030752684195.
[I 2024-12-04 15:15:53,373] Trial 1684 finished with value: 0.6265752963200782 and parameters: {'n_estimators': 892, 'learning_rate': 0.07329063571207788, 'max_depth': 10, 'min_samples_split': 20, 'min_samples_leaf': 2, 'subsample': 0.9905477881623177, 'max_features': None}. Best is trial 1435 with value: 0.45467030752684195.
[I 2024-12-04 15:15:53,974] Trial 1687 finished with value: 0.6051105095618289 and parameters: {'n_estimators': 863, 'learning_rate': 0.07680727075085819, 'max_depth': 12, 'min_samples_split': 20, 'min_samples_leaf': 2, 'subsample': 0.9857073225734144, 'max_features': None}. Best is trial 1435 with value: 0.45467030752684195.
[I 2024-12-04 15:15:54,876] Trial 1689 finished with value: 0.4719293648927005 and parameters: {'n_estimators': 847, 'learning_rate': 0.07241586919030589, 'max_depth': 12, 'min_samples_split': 20, 'min_samples_leaf': 1, 'subsample': 0.9691733089338755, 'max_features': None}. Best is trial 1435 with value: 0.45467030752684195.
[I 2024-12-04 15:15:55,893] Trial 1691 finished with value: 0.4836881892141633 and parameters: {'n_estimators': 831, 'learning_rate': 0.06544822719710258, 'max_depth': 10, 'min_samples_split': 20, 'min_samples_leaf': 1, 'subsample': 0.888252413917255, 'max_features': None}. Best is trial 1435 with value: 0.45467030752684195.
[I 2024-12-04 15:15:57,669] Trial 1703 finished with value: 0.7762596697803249 and parameters: {'n_estimators': 634, 'learning_rate': 0.07180187758467417, 'max_depth': 9, 'min_samples_split': 10, 'min_samples_leaf': 10, 'subsample': 0.6261956991421178, 'max_features': None}. Best is trial 1435 with value: 0.45467030752684195.
[I 2024-12-04 15:15:57,671] Trial 1698 finished with value: 0.4650283818718188 and parameters: {'n_estimators': 695, 'learning_rate': 0.09439894446662563, 'max_depth': 12, 'min_samples_split': 20, 'min_samples_leaf': 1, 'subsample': 0.986184018155855, 'max_features': None}. Best is trial 1435 with value: 0.45467030752684195.
[I 2024-12-04 15:15:58,287] Trial 1700 finished with value: 0.9096766607969391 and parameters: {'n_estimators': 773, 'learning_rate': 0.011431182473262077, 'max_depth': 9, 'min_samples_split': 16, 'min_samples_leaf': 3, 'subsample': 0.6218133908005559, 'max_features': 'log2'}. Best is trial 1435 with value: 0.45467030752684195.
[I 2024-12-04 15:16:01,966] Trial 1697 finished with value: 0.48750464535786986 and parameters: {'n_estimators': 886, 'learning_rate': 0.09439312514188687, 'max_depth': 10, 'min_samples_split': 19, 'min_samples_leaf': 1, 'subsample': 0.9645856335471823, 'max_features': None}. Best is trial 1435 with value: 0.45467030752684195.
[I 2024-12-04 15:16:03,292] Trial 1696 finished with value: 0.47252572489232597 and parameters: {'n_estimators': 973, 'learning_rate': 0.07833081075116721, 'max_depth': 12, 'min_samples_split': 20, 'min_samples_leaf': 1, 'subsample': 0.9469719380216897, 'max_features': None}. Best is trial 1435 with value: 0.45467030752684195.
[I 2024-12-04 15:16:04,000] Trial 1701 finished with value: 0.48562577201016827 and parameters: {'n_estimators': 799, 'learning_rate': 0.09957824862282323, 'max_depth': 12, 'min_samples_split': 19, 'min_samples_leaf': 1, 'subsample': 0.9122290846926169, 'max_features': None}. Best is trial 1435 with value: 0.45467030752684195.
[I 2024-12-04 15:16:05,105] Trial 1708 finished with value: 0.4908231835724517 and parameters: {'n_estimators': 640, 'learning_rate': 0.06776039058976788, 'max_depth': 11, 'min_samples_split': 19, 'min_samples_leaf': 1, 'subsample': 0.9946307966538913, 'max_features': None}. Best is trial 1435 with value: 0.45467030752684195.
[I 2024-12-04 15:16:06,152] Trial 1702 finished with value: 0.6442448531984022 and parameters: {'n_estimators': 847, 'learning_rate': 0.0724103552537873, 'max_depth': 12, 'min_samples_split': 19, 'min_samples_leaf': 3, 'subsample': 0.9015489887477067, 'max_features': None}. Best is trial 1435 with value: 0.45467030752684195.
[I 2024-12-04 15:16:07,412] Trial 1699 finished with value: 0.632629573542405 and parameters: {'n_estimators': 918, 'learning_rate': 0.05342905940462605, 'max_depth': 10, 'min_samples_split': 20, 'min_samples_leaf': 2, 'subsample': 0.999849690663291, 'max_features': None}. Best is trial 1435 with value: 0.45467030752684195.
[I 2024-12-04 15:16:07,965] Trial 1706 finished with value: 0.49062655407209405 and parameters: {'n_estimators': 758, 'learning_rate': 0.06530185117325894, 'max_depth': 11, 'min_samples_split': 17, 'min_samples_leaf': 1, 'subsample': 0.9871574964110057, 'max_features': None}. Best is trial 1435 with value: 0.45467030752684195.
[I 2024-12-04 15:16:08,017] Trial 1693 finished with value: 0.6625361107869538 and parameters: {'n_estimators': 1451, 'learning_rate': 0.03968469505202721, 'max_depth': 12, 'min_samples_split': 14, 'min_samples_leaf': 2, 'subsample': 0.7804128234437103, 'max_features': 'log2'}. Best is trial 1435 with value: 0.45467030752684195.
[I 2024-12-04 15:16:08,018] Trial 1705 finished with value: 0.5079506924771487 and parameters: {'n_estimators': 779, 'learning_rate': 0.05772322852312771, 'max_depth': 12, 'min_samples_split': 16, 'min_samples_leaf': 1, 'subsample': 0.9965902126215764, 'max_features': None}. Best is trial 1435 with value: 0.45467030752684195.
[I 2024-12-04 15:16:11,591] Trial 1704 finished with value: 0.7597006441334075 and parameters: {'n_estimators': 1052, 'learning_rate': 0.04702891623889227, 'max_depth': 6, 'min_samples_split': 7, 'min_samples_leaf': 10, 'subsample': 0.7000465423783634, 'max_features': None}. Best is trial 1435 with value: 0.45467030752684195.
[I 2024-12-04 15:16:13,684] Trial 1710 finished with value: 0.8327777984988416 and parameters: {'n_estimators': 1049, 'learning_rate': 0.05704192755826916, 'max_depth': 5, 'min_samples_split': 5, 'min_samples_leaf': 10, 'subsample': 0.9923715383929339, 'max_features': 'sqrt'}. Best is trial 1435 with value: 0.45467030752684195.
[I 2024-12-04 15:16:13,939] Trial 1713 finished with value: 0.6741283284594238 and parameters: {'n_estimators': 861, 'learning_rate': 0.061061200082473004, 'max_depth': 10, 'min_samples_split': 16, 'min_samples_leaf': 2, 'subsample': 0.9929805366419172, 'max_features': 'log2'}. Best is trial 1435 with value: 0.45467030752684195.
[I 2024-12-04 15:16:15,175] Trial 1715 finished with value: 0.4788815915340613 and parameters: {'n_estimators': 680, 'learning_rate': 0.09413841563863952, 'max_depth': 12, 'min_samples_split': 20, 'min_samples_leaf': 1, 'subsample': 0.9214303406516537, 'max_features': None}. Best is trial 1435 with value: 0.45467030752684195.
[I 2024-12-04 15:16:16,779] Trial 1712 finished with value: 0.6337466131843945 and parameters: {'n_estimators': 812, 'learning_rate': 0.08465207448386679, 'max_depth': 11, 'min_samples_split': 20, 'min_samples_leaf': 2, 'subsample': 0.9977674922834496, 'max_features': None}. Best is trial 1435 with value: 0.45467030752684195.
[I 2024-12-04 15:16:19,007] Trial 1707 finished with value: 0.698183677333887 and parameters: {'n_estimators': 1075, 'learning_rate': 0.0988851654618386, 'max_depth': 12, 'min_samples_split': 16, 'min_samples_leaf': 4, 'subsample': 0.9976693638956845, 'max_features': None}. Best is trial 1435 with value: 0.45467030752684195.
[I 2024-12-04 15:16:22,073] Trial 1735 finished with value: 0.5994405360946626 and parameters: {'n_estimators': 404, 'learning_rate': 0.053101409368160414, 'max_depth': 11, 'min_samples_split': 20, 'min_samples_leaf': 3, 'subsample': 0.9830986691834621, 'max_features': None}. Best is trial 1435 with value: 0.45467030752684195.
[I 2024-12-04 15:16:22,137] Trial 1714 finished with value: 0.5300807821511843 and parameters: {'n_estimators': 924, 'learning_rate': 0.09656918151209457, 'max_depth': 12, 'min_samples_split': 14, 'min_samples_leaf': 1, 'subsample': 0.9415921745255272, 'max_features': None}. Best is trial 1435 with value: 0.45467030752684195.
[I 2024-12-04 15:16:24,217] Trial 1718 finished with value: 0.644694459364512 and parameters: {'n_estimators': 885, 'learning_rate': 0.06719572066166299, 'max_depth': 12, 'min_samples_split': 19, 'min_samples_leaf': 3, 'subsample': 0.9263210642893467, 'max_features': None}. Best is trial 1435 with value: 0.45467030752684195.
[I 2024-12-04 15:16:25,603] Trial 1719 finished with value: 0.6405184506424844 and parameters: {'n_estimators': 903, 'learning_rate': 0.09966070827793136, 'max_depth': 12, 'min_samples_split': 18, 'min_samples_leaf': 3, 'subsample': 0.9994564779569638, 'max_features': None}. Best is trial 1435 with value: 0.45467030752684195.
[I 2024-12-04 15:16:26,239] Trial 1716 finished with value: 0.6408615201761294 and parameters: {'n_estimators': 966, 'learning_rate': 0.09583208335004154, 'max_depth': 11, 'min_samples_split': 20, 'min_samples_leaf': 2, 'subsample': 0.9966974559792707, 'max_features': None}. Best is trial 1435 with value: 0.45467030752684195.
[I 2024-12-04 15:16:27,053] Trial 1709 finished with value: 0.5019644311691577 and parameters: {'n_estimators': 1243, 'learning_rate': 0.02265666247363014, 'max_depth': 12, 'min_samples_split': 15, 'min_samples_leaf': 1, 'subsample': 0.8437731054368076, 'max_features': None}. Best is trial 1435 with value: 0.45467030752684195.
[I 2024-12-04 15:16:27,057] Trial 1720 finished with value: 0.5193208075132028 and parameters: {'n_estimators': 839, 'learning_rate': 0.09907162139999556, 'max_depth': 10, 'min_samples_split': 16, 'min_samples_leaf': 1, 'subsample': 0.9778415701169338, 'max_features': None}. Best is trial 1435 with value: 0.45467030752684195.
[I 2024-12-04 15:16:27,789] Trial 1722 finished with value: 0.5117162929118261 and parameters: {'n_estimators': 861, 'learning_rate': 0.09558930346134309, 'max_depth': 10, 'min_samples_split': 16, 'min_samples_leaf': 1, 'subsample': 0.9851922039608724, 'max_features': None}. Best is trial 1435 with value: 0.45467030752684195.
[I 2024-12-04 15:16:28,162] Trial 1724 finished with value: 0.47492683501606714 and parameters: {'n_estimators': 837, 'learning_rate': 0.07380469949399238, 'max_depth': 12, 'min_samples_split': 20, 'min_samples_leaf': 1, 'subsample': 0.9650888887124499, 'max_features': None}. Best is trial 1435 with value: 0.45467030752684195.
[I 2024-12-04 15:16:29,714] Trial 1730 finished with value: 0.5876913615507964 and parameters: {'n_estimators': 914, 'learning_rate': 0.01875230619305938, 'max_depth': 6, 'min_samples_split': 19, 'min_samples_leaf': 1, 'subsample': 0.6838560348316304, 'max_features': 'sqrt'}. Best is trial 1435 with value: 0.45467030752684195.
[I 2024-12-04 15:16:29,948] Trial 1717 finished with value: 0.5084479823291606 and parameters: {'n_estimators': 1140, 'learning_rate': 0.08976854216182659, 'max_depth': 6, 'min_samples_split': 14, 'min_samples_leaf': 1, 'subsample': 0.9515885838632911, 'max_features': None}. Best is trial 1435 with value: 0.45467030752684195.
[I 2024-12-04 15:16:32,182] Trial 1741 finished with value: 0.6012958948740181 and parameters: {'n_estimators': 563, 'learning_rate': 0.09195594856398297, 'max_depth': 12, 'min_samples_split': 20, 'min_samples_leaf': 4, 'subsample': 0.9275377367672445, 'max_features': 'log2'}. Best is trial 1435 with value: 0.45467030752684195.
[I 2024-12-04 15:16:32,455] Trial 1725 finished with value: 0.4942461133991456 and parameters: {'n_estimators': 910, 'learning_rate': 0.08852282935169842, 'max_depth': 11, 'min_samples_split': 20, 'min_samples_leaf': 1, 'subsample': 0.9904420616217636, 'max_features': None}. Best is trial 1435 with value: 0.45467030752684195.
[I 2024-12-04 15:16:32,462] Trial 1723 finished with value: 0.4855823635916882 and parameters: {'n_estimators': 907, 'learning_rate': 0.0905378887290714, 'max_depth': 10, 'min_samples_split': 20, 'min_samples_leaf': 1, 'subsample': 0.9684327355433889, 'max_features': None}. Best is trial 1435 with value: 0.45467030752684195.
[I 2024-12-04 15:16:32,866] Trial 1728 finished with value: 0.460003878379747 and parameters: {'n_estimators': 828, 'learning_rate': 0.08182221642276442, 'max_depth': 12, 'min_samples_split': 19, 'min_samples_leaf': 1, 'subsample': 0.9864574783366047, 'max_features': None}. Best is trial 1435 with value: 0.45467030752684195.
[I 2024-12-04 15:16:33,676] Trial 1738 finished with value: 0.6184316076287978 and parameters: {'n_estimators': 614, 'learning_rate': 0.0579205983957724, 'max_depth': 11, 'min_samples_split': 15, 'min_samples_leaf': 2, 'subsample': 0.9216048853500403, 'max_features': None}. Best is trial 1435 with value: 0.45467030752684195.
[I 2024-12-04 15:16:33,993] Trial 1721 finished with value: 0.6906254675968356 and parameters: {'n_estimators': 1075, 'learning_rate': 0.08806101678624306, 'max_depth': 10, 'min_samples_split': 20, 'min_samples_leaf': 2, 'subsample': 0.9517539540191504, 'max_features': None}. Best is trial 1435 with value: 0.45467030752684195.
[I 2024-12-04 15:16:34,467] Trial 1729 finished with value: 0.6628531641946879 and parameters: {'n_estimators': 878, 'learning_rate': 0.08880770771112721, 'max_depth': 12, 'min_samples_split': 17, 'min_samples_leaf': 2, 'subsample': 0.9798961946083699, 'max_features': None}. Best is trial 1435 with value: 0.45467030752684195.
[I 2024-12-04 15:16:35,379] Trial 1727 finished with value: 0.4681715673069936 and parameters: {'n_estimators': 916, 'learning_rate': 0.09173025065263193, 'max_depth': 12, 'min_samples_split': 17, 'min_samples_leaf': 1, 'subsample': 0.9339577119372998, 'max_features': None}. Best is trial 1435 with value: 0.45467030752684195.
[I 2024-12-04 15:16:36,224] Trial 1734 finished with value: 0.6636662750148616 and parameters: {'n_estimators': 1016, 'learning_rate': 0.07693105472609477, 'max_depth': 10, 'min_samples_split': 20, 'min_samples_leaf': 5, 'subsample': 0.6055890084987317, 'max_features': 'log2'}. Best is trial 1435 with value: 0.45467030752684195.
[I 2024-12-04 15:16:36,521] Trial 1743 finished with value: 0.4852361568575594 and parameters: {'n_estimators': 557, 'learning_rate': 0.05425293701977822, 'max_depth': 11, 'min_samples_split': 20, 'min_samples_leaf': 1, 'subsample': 0.9951576948335941, 'max_features': None}. Best is trial 1435 with value: 0.45467030752684195.
[I 2024-12-04 15:16:37,034] Trial 1740 finished with value: 0.6272859751871187 and parameters: {'n_estimators': 658, 'learning_rate': 0.07467318522375183, 'max_depth': 11, 'min_samples_split': 20, 'min_samples_leaf': 3, 'subsample': 0.9196860724217328, 'max_features': None}. Best is trial 1435 with value: 0.45467030752684195.
[I 2024-12-04 15:16:37,732] Trial 1726 finished with value: 0.6574020519702776 and parameters: {'n_estimators': 1267, 'learning_rate': 0.015464149588219404, 'max_depth': 12, 'min_samples_split': 7, 'min_samples_leaf': 2, 'subsample': 0.6936629888583223, 'max_features': 'log2'}. Best is trial 1435 with value: 0.45467030752684195.
[I 2024-12-04 15:16:38,380] Trial 1736 finished with value: 0.6261595676736831 and parameters: {'n_estimators': 824, 'learning_rate': 0.05388414962465032, 'max_depth': 12, 'min_samples_split': 19, 'min_samples_leaf': 3, 'subsample': 0.9616410956294726, 'max_features': None}. Best is trial 1435 with value: 0.45467030752684195.
[I 2024-12-04 15:16:40,785] Trial 1739 finished with value: 0.48810388458250686 and parameters: {'n_estimators': 820, 'learning_rate': 0.09119219299698302, 'max_depth': 10, 'min_samples_split': 20, 'min_samples_leaf': 1, 'subsample': 0.9931729307799183, 'max_features': None}. Best is trial 1435 with value: 0.45467030752684195.
