[I 2024-12-04 13:23:28,841] Trial 1786 finished with value: 0.2149024149667006 and parameters: {'n_estimators': 1487, 'learning_rate': 0.06515907227593455, 'max_depth': 11, 'min_samples_split': 14, 'min_samples_leaf': 1, 'subsample': 0.6111833796050642, 'max_features': 'sqrt'}. Best is trial 1137 with value: 0.19687116000636118.
[I 2024-12-04 13:23:29,911] Trial 1784 finished with value: 0.21625553753150523 and parameters: {'n_estimators': 1475, 'learning_rate': 0.0989334543209954, 'max_depth': 12, 'min_samples_split': 18, 'min_samples_leaf': 1, 'subsample': 0.6081100058177775, 'max_features': 'sqrt'}. Best is trial 1137 with value: 0.19687116000636118.
[I 2024-12-04 13:23:37,252] Trial 1812 finished with value: 0.4407312797648609 and parameters: {'n_estimators': 296, 'learning_rate': 0.03791673050255565, 'max_depth': 6, 'min_samples_split': 19, 'min_samples_leaf': 8, 'subsample': 0.9500035047109299, 'max_features': 'sqrt'}. Best is trial 1137 with value: 0.19687116000636118.
[I 2024-12-04 13:23:43,309] Trial 1805 finished with value: 0.5703523053529669 and parameters: {'n_estimators': 710, 'learning_rate': 0.012400027582137313, 'max_depth': 9, 'min_samples_split': 19, 'min_samples_leaf': 5, 'subsample': 0.9089389299151818, 'max_features': 'log2'}. Best is trial 1137 with value: 0.19687116000636118.
[I 2024-12-04 13:23:45,460] Trial 1795 finished with value: 0.20913245701828972 and parameters: {'n_estimators': 1264, 'learning_rate': 0.08600259127031826, 'max_depth': 10, 'min_samples_split': 18, 'min_samples_leaf': 1, 'subsample': 0.6039656928113463, 'max_features': 'sqrt'}. Best is trial 1137 with value: 0.19687116000636118.
[I 2024-12-04 13:23:45,463] Trial 1794 finished with value: 0.24496126706032195 and parameters: {'n_estimators': 1295, 'learning_rate': 0.05533443444405838, 'max_depth': 12, 'min_samples_split': 17, 'min_samples_leaf': 2, 'subsample': 0.6067923774021884, 'max_features': 'sqrt'}. Best is trial 1137 with value: 0.19687116000636118.
[I 2024-12-04 13:23:47,002] Trial 1803 finished with value: 0.6063769069538515 and parameters: {'n_estimators': 988, 'learning_rate': 0.019701195977001987, 'max_depth': 7, 'min_samples_split': 15, 'min_samples_leaf': 9, 'subsample': 0.6855600430155517, 'max_features': 'log2'}. Best is trial 1137 with value: 0.19687116000636118.
[I 2024-12-04 13:23:55,639] Trial 1818 finished with value: 0.552341089840264 and parameters: {'n_estimators': 439, 'learning_rate': 0.035520061861572416, 'max_depth': 6, 'min_samples_split': 18, 'min_samples_leaf': 7, 'subsample': 0.9771051059220951, 'max_features': 'log2'}. Best is trial 1137 with value: 0.19687116000636118.
[I 2024-12-04 13:23:55,658] Trial 1797 finished with value: 0.32326912261456386 and parameters: {'n_estimators': 1311, 'learning_rate': 0.01615906458833426, 'max_depth': 12, 'min_samples_split': 20, 'min_samples_leaf': 2, 'subsample': 0.9363876540398425, 'max_features': 'log2'}. Best is trial 1137 with value: 0.19687116000636118.
[I 2024-12-04 13:23:58,314] Trial 1804 finished with value: 0.25868935589563447 and parameters: {'n_estimators': 1140, 'learning_rate': 0.08653391889882593, 'max_depth': 11, 'min_samples_split': 16, 'min_samples_leaf': 3, 'subsample': 0.6491673417065058, 'max_features': 'sqrt'}. Best is trial 1137 with value: 0.19687116000636118.
[I 2024-12-04 13:24:02,785] Trial 1800 finished with value: 0.2574278896462043 and parameters: {'n_estimators': 1292, 'learning_rate': 0.092011580748726, 'max_depth': 11, 'min_samples_split': 20, 'min_samples_leaf': 3, 'subsample': 0.6733850461997511, 'max_features': 'sqrt'}. Best is trial 1137 with value: 0.19687116000636118.
[I 2024-12-04 13:24:03,401] Trial 1801 finished with value: 0.21840603923024213 and parameters: {'n_estimators': 1339, 'learning_rate': 0.06780677913056565, 'max_depth': 11, 'min_samples_split': 15, 'min_samples_leaf': 1, 'subsample': 0.7017497917634571, 'max_features': 'sqrt'}. Best is trial 1137 with value: 0.19687116000636118.
[I 2024-12-04 13:24:11,608] Trial 1807 finished with value: 0.2164687042161426 and parameters: {'n_estimators': 1230, 'learning_rate': 0.07230483561102764, 'max_depth': 10, 'min_samples_split': 19, 'min_samples_leaf': 1, 'subsample': 0.6079209534987962, 'max_features': 'sqrt'}. Best is trial 1137 with value: 0.19687116000636118.
[I 2024-12-04 13:24:15,362] Trial 1811 finished with value: 0.22179953577925132 and parameters: {'n_estimators': 1140, 'learning_rate': 0.09922225302013268, 'max_depth': 11, 'min_samples_split': 19, 'min_samples_leaf': 1, 'subsample': 0.600418431394556, 'max_features': 'sqrt'}. Best is trial 1137 with value: 0.19687116000636118.
[I 2024-12-04 13:24:19,984] Trial 1835 finished with value: 0.3971839172121457 and parameters: {'n_estimators': 298, 'learning_rate': 0.04411069944062881, 'max_depth': 6, 'min_samples_split': 11, 'min_samples_leaf': 7, 'subsample': 0.968765603937317, 'max_features': 'sqrt'}. Best is trial 1137 with value: 0.19687116000636118.
[I 2024-12-04 13:24:20,930] Trial 1808 finished with value: 0.23580356328086977 and parameters: {'n_estimators': 1324, 'learning_rate': 0.09717245209781157, 'max_depth': 12, 'min_samples_split': 13, 'min_samples_leaf': 2, 'subsample': 0.6071321218355711, 'max_features': 'sqrt'}. Best is trial 1137 with value: 0.19687116000636118.
[I 2024-12-04 13:24:22,381] Trial 1802 finished with value: 0.2337936844530935 and parameters: {'n_estimators': 1493, 'learning_rate': 0.08671078094668448, 'max_depth': 10, 'min_samples_split': 18, 'min_samples_leaf': 1, 'subsample': 0.705560628689311, 'max_features': 'sqrt'}. Best is trial 1137 with value: 0.19687116000636118.
[I 2024-12-04 13:24:26,602] Trial 1841 finished with value: 0.4971822060979451 and parameters: {'n_estimators': 114, 'learning_rate': 0.011898244469341089, 'max_depth': 12, 'min_samples_split': 13, 'min_samples_leaf': 7, 'subsample': 0.7670918870893867, 'max_features': None}. Best is trial 1137 with value: 0.19687116000636118.
[I 2024-12-04 13:24:29,137] Trial 1819 finished with value: 0.2970014494919416 and parameters: {'n_estimators': 1040, 'learning_rate': 0.012333023542833606, 'max_depth': 11, 'min_samples_split': 14, 'min_samples_leaf': 1, 'subsample': 0.6493200819156983, 'max_features': 'sqrt'}. Best is trial 1137 with value: 0.19687116000636118.
[I 2024-12-04 13:24:29,237] Trial 1817 finished with value: 0.2105157970879676 and parameters: {'n_estimators': 1153, 'learning_rate': 0.06814712827776007, 'max_depth': 12, 'min_samples_split': 16, 'min_samples_leaf': 1, 'subsample': 0.7263786926698239, 'max_features': 'sqrt'}. Best is trial 1137 with value: 0.19687116000636118.
[I 2024-12-04 13:24:31,584] Trial 1833 finished with value: 0.6549453562375983 and parameters: {'n_estimators': 605, 'learning_rate': 0.010324185198962619, 'max_depth': 5, 'min_samples_split': 16, 'min_samples_leaf': 5, 'subsample': 0.979929903050659, 'max_features': 'log2'}. Best is trial 1137 with value: 0.19687116000636118.
[I 2024-12-04 13:24:33,819] Trial 1813 finished with value: 0.2593262041071902 and parameters: {'n_estimators': 1326, 'learning_rate': 0.08359949083842085, 'max_depth': 12, 'min_samples_split': 15, 'min_samples_leaf': 2, 'subsample': 0.7473113055696016, 'max_features': 'log2'}. Best is trial 1137 with value: 0.19687116000636118.
[I 2024-12-04 13:24:35,394] Trial 1828 finished with value: 0.27889984081667973 and parameters: {'n_estimators': 684, 'learning_rate': 0.0449114303609409, 'max_depth': 9, 'min_samples_split': 2, 'min_samples_leaf': 1, 'subsample': 0.6003776543503218, 'max_features': None}. Best is trial 1137 with value: 0.19687116000636118.
[I 2024-12-04 13:24:36,746] Trial 1809 finished with value: 0.2474575442153007 and parameters: {'n_estimators': 1411, 'learning_rate': 0.09281126478318465, 'max_depth': 10, 'min_samples_split': 18, 'min_samples_leaf': 3, 'subsample': 0.6904269286136809, 'max_features': 'sqrt'}. Best is trial 1137 with value: 0.19687116000636118.
[I 2024-12-04 13:24:39,037] Trial 1843 finished with value: 0.8565566060515504 and parameters: {'n_estimators': 175, 'learning_rate': 0.01661079565181425, 'max_depth': 6, 'min_samples_split': 2, 'min_samples_leaf': 7, 'subsample': 0.7754222139804452, 'max_features': 'log2'}. Best is trial 1137 with value: 0.19687116000636118.
[I 2024-12-04 13:24:44,698] Trial 1831 finished with value: 0.302447260674749 and parameters: {'n_estimators': 739, 'learning_rate': 0.015883148397376645, 'max_depth': 9, 'min_samples_split': 8, 'min_samples_leaf': 1, 'subsample': 0.8151176603155504, 'max_features': None}. Best is trial 1137 with value: 0.19687116000636118.
[I 2024-12-04 13:24:49,833] Trial 1814 finished with value: 0.2940946857091082 and parameters: {'n_estimators': 1480, 'learning_rate': 0.09603145880854916, 'max_depth': 12, 'min_samples_split': 17, 'min_samples_leaf': 4, 'subsample': 0.6112667083812187, 'max_features': 'log2'}. Best is trial 1137 with value: 0.19687116000636118.
[I 2024-12-04 13:24:49,863] Trial 1816 finished with value: 0.22713843853974772 and parameters: {'n_estimators': 1384, 'learning_rate': 0.09390260913806055, 'max_depth': 10, 'min_samples_split': 20, 'min_samples_leaf': 1, 'subsample': 0.7033834391397297, 'max_features': 'sqrt'}. Best is trial 1137 with value: 0.19687116000636118.
[I 2024-12-04 13:24:52,480] Trial 1851 finished with value: 0.4225636852508511 and parameters: {'n_estimators': 115, 'learning_rate': 0.0583718123640541, 'max_depth': 3, 'min_samples_split': 10, 'min_samples_leaf': 1, 'subsample': 0.7530818712521048, 'max_features': None}. Best is trial 1137 with value: 0.19687116000636118.
[I 2024-12-04 13:24:52,665] Trial 1820 finished with value: 0.22297976932936223 and parameters: {'n_estimators': 1295, 'learning_rate': 0.05902029520497479, 'max_depth': 12, 'min_samples_split': 14, 'min_samples_leaf': 1, 'subsample': 0.6723752367093154, 'max_features': 'sqrt'}. Best is trial 1137 with value: 0.19687116000636118.
[I 2024-12-04 13:24:52,683] Trial 1824 finished with value: 0.2250088296058863 and parameters: {'n_estimators': 1228, 'learning_rate': 0.060559137919636956, 'max_depth': 12, 'min_samples_split': 15, 'min_samples_leaf': 1, 'subsample': 0.6582346741553943, 'max_features': 'sqrt'}. Best is trial 1137 with value: 0.19687116000636118.
[I 2024-12-04 13:24:53,962] Trial 1815 finished with value: 0.24203313482872402 and parameters: {'n_estimators': 1442, 'learning_rate': 0.06142091430532527, 'max_depth': 12, 'min_samples_split': 20, 'min_samples_leaf': 3, 'subsample': 0.7294323361018709, 'max_features': 'sqrt'}. Best is trial 1137 with value: 0.19687116000636118.
[I 2024-12-04 13:24:56,340] Trial 1825 finished with value: 0.27904759334308576 and parameters: {'n_estimators': 1220, 'learning_rate': 0.04276878498826916, 'max_depth': 12, 'min_samples_split': 16, 'min_samples_leaf': 2, 'subsample': 0.6018720247826156, 'max_features': 'log2'}. Best is trial 1137 with value: 0.19687116000636118.
[I 2024-12-04 13:24:58,081] Trial 1822 finished with value: 0.2184188835904529 and parameters: {'n_estimators': 1447, 'learning_rate': 0.09977163716151155, 'max_depth': 10, 'min_samples_split': 20, 'min_samples_leaf': 1, 'subsample': 0.6316547885278683, 'max_features': 'sqrt'}. Best is trial 1137 with value: 0.19687116000636118.
[I 2024-12-04 13:24:58,927] Trial 1846 finished with value: 0.36415508390583323 and parameters: {'n_estimators': 363, 'learning_rate': 0.032545120655163365, 'max_depth': 12, 'min_samples_split': 16, 'min_samples_leaf': 1, 'subsample': 0.9087037289172801, 'max_features': 'log2'}. Best is trial 1137 with value: 0.19687116000636118.
[I 2024-12-04 13:25:03,390] Trial 1810 finished with value: 0.24234595544259596 and parameters: {'n_estimators': 1465, 'learning_rate': 0.06047848800979595, 'max_depth': 12, 'min_samples_split': 17, 'min_samples_leaf': 3, 'subsample': 0.6020331264453299, 'max_features': 'sqrt'}. Best is trial 1137 with value: 0.19687116000636118.
[I 2024-12-04 13:25:04,840] Trial 1823 finished with value: 0.22682536267127384 and parameters: {'n_estimators': 1396, 'learning_rate': 0.06800822409100442, 'max_depth': 10, 'min_samples_split': 17, 'min_samples_leaf': 1, 'subsample': 0.6015414283448703, 'max_features': 'sqrt'}. Best is trial 1137 with value: 0.19687116000636118.
[I 2024-12-04 13:25:06,701] Trial 1821 finished with value: 0.21016937163920585 and parameters: {'n_estimators': 1335, 'learning_rate': 0.06109577702304627, 'max_depth': 12, 'min_samples_split': 17, 'min_samples_leaf': 1, 'subsample': 0.6779497932288877, 'max_features': 'sqrt'}. Best is trial 1137 with value: 0.19687116000636118.
[I 2024-12-04 13:25:09,630] Trial 1834 finished with value: 0.22154370240722956 and parameters: {'n_estimators': 1136, 'learning_rate': 0.09092348604966555, 'max_depth': 12, 'min_samples_split': 17, 'min_samples_leaf': 1, 'subsample': 0.6813063118049255, 'max_features': 'sqrt'}. Best is trial 1137 with value: 0.19687116000636118.
[I 2024-12-04 13:25:09,667] Trial 1832 finished with value: 0.23190934251836076 and parameters: {'n_estimators': 1177, 'learning_rate': 0.09735121423209528, 'max_depth': 12, 'min_samples_split': 17, 'min_samples_leaf': 2, 'subsample': 0.6622166936011255, 'max_features': 'sqrt'}. Best is trial 1137 with value: 0.19687116000636118.
[I 2024-12-04 13:25:14,302] Trial 1826 finished with value: 0.2419554795458881 and parameters: {'n_estimators': 1497, 'learning_rate': 0.09362731165446633, 'max_depth': 11, 'min_samples_split': 20, 'min_samples_leaf': 2, 'subsample': 0.60773861107517, 'max_features': 'sqrt'}. Best is trial 1137 with value: 0.19687116000636118.
[I 2024-12-04 13:25:14,581] Trial 1858 finished with value: 0.4425167225571396 and parameters: {'n_estimators': 158, 'learning_rate': 0.029383398895154948, 'max_depth': 10, 'min_samples_split': 8, 'min_samples_leaf': 4, 'subsample': 0.7223194883810865, 'max_features': 'sqrt'}. Best is trial 1137 with value: 0.19687116000636118.
[I 2024-12-04 13:25:14,587] Trial 1827 finished with value: 0.21921507816001934 and parameters: {'n_estimators': 1432, 'learning_rate': 0.05882503030050275, 'max_depth': 12, 'min_samples_split': 18, 'min_samples_leaf': 1, 'subsample': 0.6247181431409509, 'max_features': 'sqrt'}. Best is trial 1137 with value: 0.19687116000636118.
[I 2024-12-04 13:25:14,600] Trial 1847 finished with value: 0.2815812621228571 and parameters: {'n_estimators': 549, 'learning_rate': 0.09323248820312818, 'max_depth': 12, 'min_samples_split': 11, 'min_samples_leaf': 4, 'subsample': 0.8695038456049258, 'max_features': None}. Best is trial 1137 with value: 0.19687116000636118.
[I 2024-12-04 13:25:21,141] Trial 1829 finished with value: 0.22827834173764988 and parameters: {'n_estimators': 1495, 'learning_rate': 0.053270172246906694, 'max_depth': 11, 'min_samples_split': 19, 'min_samples_leaf': 1, 'subsample': 0.616348579379674, 'max_features': 'sqrt'}. Best is trial 1137 with value: 0.19687116000636118.
[I 2024-12-04 13:25:24,914] Trial 1839 finished with value: 0.24646778551073423 and parameters: {'n_estimators': 1259, 'learning_rate': 0.07950771263331573, 'max_depth': 12, 'min_samples_split': 16, 'min_samples_leaf': 3, 'subsample': 0.6644139515958307, 'max_features': 'sqrt'}. Best is trial 1137 with value: 0.19687116000636118.
[I 2024-12-04 13:25:25,958] Trial 1830 finished with value: 0.21084855571513259 and parameters: {'n_estimators': 1491, 'learning_rate': 0.09595215131343995, 'max_depth': 12, 'min_samples_split': 13, 'min_samples_leaf': 1, 'subsample': 0.6358020480209364, 'max_features': 'sqrt'}. Best is trial 1137 with value: 0.19687116000636118.
[I 2024-12-04 13:25:28,195] Trial 1864 finished with value: 0.47466024081431113 and parameters: {'n_estimators': 163, 'learning_rate': 0.07158541567899451, 'max_depth': 11, 'min_samples_split': 4, 'min_samples_leaf': 10, 'subsample': 0.7706234042332166, 'max_features': 'sqrt'}. Best is trial 1137 with value: 0.19687116000636118.
[I 2024-12-04 13:25:33,360] Trial 1836 finished with value: 0.23653527139797767 and parameters: {'n_estimators': 1498, 'learning_rate': 0.052481155915401666, 'max_depth': 10, 'min_samples_split': 14, 'min_samples_leaf': 1, 'subsample': 0.6631516638876971, 'max_features': 'sqrt'}. Best is trial 1137 with value: 0.19687116000636118.
[I 2024-12-04 13:25:34,129] Trial 1842 finished with value: 0.2490653906533164 and parameters: {'n_estimators': 1156, 'learning_rate': 0.07817802991070323, 'max_depth': 12, 'min_samples_split': 19, 'min_samples_leaf': 3, 'subsample': 0.7643716011305011, 'max_features': 'sqrt'}. Best is trial 1137 with value: 0.19687116000636118.
[I 2024-12-04 13:25:35,763] Trial 1837 finished with value: 0.20034330947851725 and parameters: {'n_estimators': 1495, 'learning_rate': 0.08468816654702774, 'max_depth': 11, 'min_samples_split': 18, 'min_samples_leaf': 1, 'subsample': 0.6097355273515658, 'max_features': 'sqrt'}. Best is trial 1137 with value: 0.19687116000636118.
[I 2024-12-04 13:25:36,266] Trial 1838 finished with value: 0.25929873567941764 and parameters: {'n_estimators': 1495, 'learning_rate': 0.05476706002188269, 'max_depth': 10, 'min_samples_split': 9, 'min_samples_leaf': 4, 'subsample': 0.607075971407064, 'max_features': 'sqrt'}. Best is trial 1137 with value: 0.19687116000636118.
[I 2024-12-04 13:25:41,314] Trial 1840 finished with value: 0.19994001939855807 and parameters: {'n_estimators': 1400, 'learning_rate': 0.092531281914139, 'max_depth': 12, 'min_samples_split': 20, 'min_samples_leaf': 1, 'subsample': 0.6980362061517451, 'max_features': 'sqrt'}. Best is trial 1137 with value: 0.19687116000636118.
[I 2024-12-04 13:25:41,673] Trial 1845 finished with value: 0.4751126517397867 and parameters: {'n_estimators': 1232, 'learning_rate': 0.011442228471801071, 'max_depth': 7, 'min_samples_split': 17, 'min_samples_leaf': 10, 'subsample': 0.7487326442271567, 'max_features': 'sqrt'}. Best is trial 1137 with value: 0.19687116000636118.
[I 2024-12-04 13:25:44,533] Trial 1844 finished with value: 0.21949814946732013 and parameters: {'n_estimators': 1300, 'learning_rate': 0.07719878185648228, 'max_depth': 12, 'min_samples_split': 20, 'min_samples_leaf': 1, 'subsample': 0.7141653802319372, 'max_features': 'sqrt'}. Best is trial 1137 with value: 0.19687116000636118.
[I 2024-12-04 13:25:51,784] Trial 1857 finished with value: 0.42373151847582485 and parameters: {'n_estimators': 845, 'learning_rate': 0.08682252744421684, 'max_depth': 5, 'min_samples_split': 11, 'min_samples_leaf': 8, 'subsample': 0.8527658466123098, 'max_features': 'log2'}. Best is trial 1137 with value: 0.19687116000636118.
[I 2024-12-04 13:25:56,833] Trial 1853 finished with value: 0.2540410436310793 and parameters: {'n_estimators': 1206, 'learning_rate': 0.05564157032931463, 'max_depth': 10, 'min_samples_split': 13, 'min_samples_leaf': 2, 'subsample': 0.6043850628604017, 'max_features': 'sqrt'}. Best is trial 1137 with value: 0.19687116000636118.
[I 2024-12-04 13:25:58,510] Trial 1869 finished with value: 0.4019444213739112 and parameters: {'n_estimators': 466, 'learning_rate': 0.010931028268554606, 'max_depth': 4, 'min_samples_split': 16, 'min_samples_leaf': 2, 'subsample': 0.8185688664436657, 'max_features': None}. Best is trial 1137 with value: 0.19687116000636118.
[I 2024-12-04 13:25:58,520] Trial 1849 finished with value: 0.363295659856637 and parameters: {'n_estimators': 1179, 'learning_rate': 0.07658279333810655, 'max_depth': 7, 'min_samples_split': 2, 'min_samples_leaf': 8, 'subsample': 0.9835357906512208, 'max_features': None}. Best is trial 1137 with value: 0.19687116000636118.
[I 2024-12-04 13:26:03,034] Trial 1848 finished with value: 0.23971378096582133 and parameters: {'n_estimators': 1460, 'learning_rate': 0.09836384591100639, 'max_depth': 10, 'min_samples_split': 18, 'min_samples_leaf': 2, 'subsample': 0.69981688677394, 'max_features': 'sqrt'}. Best is trial 1137 with value: 0.19687116000636118.
[I 2024-12-04 13:26:09,469] Trial 1855 finished with value: 0.22166024424613076 and parameters: {'n_estimators': 1255, 'learning_rate': 0.09028303129970225, 'max_depth': 12, 'min_samples_split': 13, 'min_samples_leaf': 1, 'subsample': 0.6968377721079596, 'max_features': 'sqrt'}. Best is trial 1137 with value: 0.19687116000636118.
[I 2024-12-04 13:26:09,511] Trial 1854 finished with value: 0.23629409573425678 and parameters: {'n_estimators': 1263, 'learning_rate': 0.09386698296482567, 'max_depth': 12, 'min_samples_split': 15, 'min_samples_leaf': 2, 'subsample': 0.7170634937795564, 'max_features': 'sqrt'}. Best is trial 1137 with value: 0.19687116000636118.
[I 2024-12-04 13:26:10,734] Trial 1862 finished with value: 0.300186686052443 and parameters: {'n_estimators': 1004, 'learning_rate': 0.06219323704005742, 'max_depth': 7, 'min_samples_split': 5, 'min_samples_leaf': 5, 'subsample': 0.9909615071246966, 'max_features': 'sqrt'}. Best is trial 1137 with value: 0.19687116000636118.
[I 2024-12-04 13:26:10,740] Trial 1850 finished with value: 0.2204526760754334 and parameters: {'n_estimators': 1483, 'learning_rate': 0.09473227333377482, 'max_depth': 11, 'min_samples_split': 17, 'min_samples_leaf': 1, 'subsample': 0.6045032085082745, 'max_features': 'sqrt'}. Best is trial 1137 with value: 0.19687116000636118.
[I 2024-12-04 13:26:12,311] Trial 1879 finished with value: 0.5296909158219387 and parameters: {'n_estimators': 407, 'learning_rate': 0.013467903716551545, 'max_depth': 5, 'min_samples_split': 10, 'min_samples_leaf': 6, 'subsample': 0.7083759801190148, 'max_features': 'sqrt'}. Best is trial 1137 with value: 0.19687116000636118.
[I 2024-12-04 13:26:14,070] Trial 1852 finished with value: 0.20657287065224864 and parameters: {'n_estimators': 1476, 'learning_rate': 0.07509708218033527, 'max_depth': 12, 'min_samples_split': 20, 'min_samples_leaf': 1, 'subsample': 0.753275803425991, 'max_features': 'sqrt'}. Best is trial 1137 with value: 0.19687116000636118.
