[I 2024-12-04 12:54:13,776] Trial 1063 finished with value: 0.23515939231713823 and parameters: {'n_estimators': 1499, 'learning_rate': 0.04469902539158816, 'max_depth': 10, 'min_samples_split': 20, 'min_samples_leaf': 1, 'subsample': 0.6445113183886174, 'max_features': 'sqrt'}. Best is trial 784 with value: 0.199214954455861.
[I 2024-12-04 12:54:14,915] Trial 1070 finished with value: 0.2215223329370872 and parameters: {'n_estimators': 1184, 'learning_rate': 0.09446731737703393, 'max_depth': 11, 'min_samples_split': 18, 'min_samples_leaf': 1, 'subsample': 0.722484763106624, 'max_features': 'sqrt'}. Best is trial 784 with value: 0.199214954455861.
[I 2024-12-04 12:54:18,163] Trial 1066 finished with value: 0.34896109627470034 and parameters: {'n_estimators': 1406, 'learning_rate': 0.015779853628321423, 'max_depth': 3, 'min_samples_split': 2, 'min_samples_leaf': 5, 'subsample': 0.91462465464033, 'max_features': None}. Best is trial 784 with value: 0.199214954455861.
[I 2024-12-04 12:54:20,692] Trial 1098 finished with value: 0.43680046155038776 and parameters: {'n_estimators': 160, 'learning_rate': 0.04093237647121952, 'max_depth': 11, 'min_samples_split': 5, 'min_samples_leaf': 1, 'subsample': 0.7216766508203609, 'max_features': 'log2'}. Best is trial 784 with value: 0.199214954455861.
[I 2024-12-04 12:54:22,193] Trial 1074 finished with value: 0.24103306940794456 and parameters: {'n_estimators': 1036, 'learning_rate': 0.08617726440591367, 'max_depth': 12, 'min_samples_split': 15, 'min_samples_leaf': 1, 'subsample': 0.6138027612043039, 'max_features': None}. Best is trial 784 with value: 0.199214954455861.
[I 2024-12-04 12:54:25,245] Trial 1078 finished with value: 0.22136716609373794 and parameters: {'n_estimators': 1046, 'learning_rate': 0.09705183351195966, 'max_depth': 12, 'min_samples_split': 20, 'min_samples_leaf': 1, 'subsample': 0.6187102876099346, 'max_features': 'sqrt'}. Best is trial 784 with value: 0.199214954455861.
[I 2024-12-04 12:54:28,615] Trial 1091 finished with value: 0.36232331660233336 and parameters: {'n_estimators': 510, 'learning_rate': 0.01764440750722392, 'max_depth': 5, 'min_samples_split': 4, 'min_samples_leaf': 5, 'subsample': 0.819314005469703, 'max_features': None}. Best is trial 784 with value: 0.199214954455861.
[I 2024-12-04 12:54:29,954] Trial 1075 finished with value: 0.25505275176322956 and parameters: {'n_estimators': 1255, 'learning_rate': 0.06806513966420381, 'max_depth': 12, 'min_samples_split': 19, 'min_samples_leaf': 4, 'subsample': 0.6153996760075465, 'max_features': 'sqrt'}. Best is trial 784 with value: 0.199214954455861.
[I 2024-12-04 12:54:30,814] Trial 1069 finished with value: 0.24625855502833863 and parameters: {'n_estimators': 1413, 'learning_rate': 0.09100149647913114, 'max_depth': 10, 'min_samples_split': 18, 'min_samples_leaf': 1, 'subsample': 0.6010255764776726, 'max_features': None}. Best is trial 784 with value: 0.199214954455861.
[I 2024-12-04 12:54:33,598] Trial 1076 finished with value: 0.2190537587678369 and parameters: {'n_estimators': 1289, 'learning_rate': 0.09856583775334433, 'max_depth': 8, 'min_samples_split': 18, 'min_samples_leaf': 1, 'subsample': 0.6135644133026574, 'max_features': 'sqrt'}. Best is trial 784 with value: 0.199214954455861.
[I 2024-12-04 12:54:36,197] Trial 1081 finished with value: 0.24170817784376147 and parameters: {'n_estimators': 1120, 'learning_rate': 0.0978871631085104, 'max_depth': 12, 'min_samples_split': 17, 'min_samples_leaf': 2, 'subsample': 0.7439835296418948, 'max_features': 'sqrt'}. Best is trial 784 with value: 0.199214954455861.
[I 2024-12-04 12:54:37,303] Trial 1072 finished with value: 0.31642491377128334 and parameters: {'n_estimators': 1455, 'learning_rate': 0.035905901457970055, 'max_depth': 3, 'min_samples_split': 19, 'min_samples_leaf': 3, 'subsample': 0.7182518884011004, 'max_features': 'sqrt'}. Best is trial 784 with value: 0.199214954455861.
[I 2024-12-04 12:54:37,589] Trial 1079 finished with value: 0.3942997747835527 and parameters: {'n_estimators': 1213, 'learning_rate': 0.013853490033243028, 'max_depth': 6, 'min_samples_split': 7, 'min_samples_leaf': 6, 'subsample': 0.6476738171013975, 'max_features': 'sqrt'}. Best is trial 784 with value: 0.199214954455861.
[I 2024-12-04 12:54:43,076] Trial 1073 finished with value: 0.24843454941413587 and parameters: {'n_estimators': 1489, 'learning_rate': 0.06716993097318126, 'max_depth': 12, 'min_samples_split': 15, 'min_samples_leaf': 3, 'subsample': 0.7490662968017913, 'max_features': 'sqrt'}. Best is trial 784 with value: 0.199214954455861.
[I 2024-12-04 12:54:44,780] Trial 1082 finished with value: 0.24967067486110422 and parameters: {'n_estimators': 1184, 'learning_rate': 0.05557303044107161, 'max_depth': 12, 'min_samples_split': 15, 'min_samples_leaf': 3, 'subsample': 0.6089515425901668, 'max_features': 'sqrt'}. Best is trial 784 with value: 0.199214954455861.
[I 2024-12-04 12:54:45,391] Trial 1077 finished with value: 0.2347815124312862 and parameters: {'n_estimators': 1418, 'learning_rate': 0.09068768252183577, 'max_depth': 12, 'min_samples_split': 19, 'min_samples_leaf': 3, 'subsample': 0.709294377895313, 'max_features': 'sqrt'}. Best is trial 784 with value: 0.199214954455861.
[I 2024-12-04 12:54:50,986] Trial 1093 finished with value: 0.493226877302325 and parameters: {'n_estimators': 848, 'learning_rate': 0.010812517159045621, 'max_depth': 5, 'min_samples_split': 17, 'min_samples_leaf': 7, 'subsample': 0.6976732561220411, 'max_features': 'sqrt'}. Best is trial 784 with value: 0.199214954455861.
[I 2024-12-04 12:54:53,694] Trial 1105 finished with value: 0.695327299719142 and parameters: {'n_estimators': 414, 'learning_rate': 0.0119372006667246, 'max_depth': 3, 'min_samples_split': 5, 'min_samples_leaf': 9, 'subsample': 0.733932342365089, 'max_features': 'sqrt'}. Best is trial 784 with value: 0.199214954455861.
[I 2024-12-04 12:55:01,912] Trial 1090 finished with value: 0.28107316716465375 and parameters: {'n_estimators': 1108, 'learning_rate': 0.05284679136215568, 'max_depth': 8, 'min_samples_split': 11, 'min_samples_leaf': 1, 'subsample': 0.8460657870025027, 'max_features': 'log2'}. Best is trial 784 with value: 0.199214954455861.
[I 2024-12-04 12:55:02,797] Trial 1087 finished with value: 0.2320164611048345 and parameters: {'n_estimators': 1280, 'learning_rate': 0.09622585615578871, 'max_depth': 10, 'min_samples_split': 20, 'min_samples_leaf': 1, 'subsample': 0.7024746428032439, 'max_features': 'sqrt'}. Best is trial 784 with value: 0.199214954455861.
[I 2024-12-04 12:55:03,746] Trial 1083 finished with value: 0.2133702573309046 and parameters: {'n_estimators': 1455, 'learning_rate': 0.08922099174281373, 'max_depth': 11, 'min_samples_split': 18, 'min_samples_leaf': 1, 'subsample': 0.6886585852329725, 'max_features': 'sqrt'}. Best is trial 784 with value: 0.199214954455861.
[I 2024-12-04 12:55:03,752] Trial 1100 finished with value: 0.4950334086820022 and parameters: {'n_estimators': 772, 'learning_rate': 0.019999454946515675, 'max_depth': 8, 'min_samples_split': 13, 'min_samples_leaf': 6, 'subsample': 0.9657512177322478, 'max_features': 'log2'}. Best is trial 784 with value: 0.199214954455861.
[I 2024-12-04 12:55:07,923] Trial 1085 finished with value: 0.24644798593846381 and parameters: {'n_estimators': 1447, 'learning_rate': 0.09356737872428333, 'max_depth': 11, 'min_samples_split': 15, 'min_samples_leaf': 3, 'subsample': 0.6127375614537134, 'max_features': 'sqrt'}. Best is trial 784 with value: 0.199214954455861.
[I 2024-12-04 12:55:09,589] Trial 1084 finished with value: 0.2160337216878668 and parameters: {'n_estimators': 1491, 'learning_rate': 0.08807613324335033, 'max_depth': 10, 'min_samples_split': 18, 'min_samples_leaf': 1, 'subsample': 0.6362926390414912, 'max_features': 'sqrt'}. Best is trial 784 with value: 0.199214954455861.
[I 2024-12-04 12:55:11,497] Trial 1086 finished with value: 0.23379791259587127 and parameters: {'n_estimators': 1420, 'learning_rate': 0.09388626927429149, 'max_depth': 12, 'min_samples_split': 20, 'min_samples_leaf': 2, 'subsample': 0.7238217653266967, 'max_features': 'sqrt'}. Best is trial 784 with value: 0.199214954455861.
[I 2024-12-04 12:55:11,583] Trial 1088 finished with value: 0.23500674592177634 and parameters: {'n_estimators': 1343, 'learning_rate': 0.07111083060987844, 'max_depth': 9, 'min_samples_split': 19, 'min_samples_leaf': 1, 'subsample': 0.6812657660444716, 'max_features': 'sqrt'}. Best is trial 784 with value: 0.199214954455861.
[I 2024-12-04 12:55:18,334] Trial 1092 finished with value: 0.3053495523021186 and parameters: {'n_estimators': 1286, 'learning_rate': 0.014114988248671162, 'max_depth': 9, 'min_samples_split': 10, 'min_samples_leaf': 4, 'subsample': 0.8000619604813245, 'max_features': 'sqrt'}. Best is trial 784 with value: 0.199214954455861.
[I 2024-12-04 12:55:20,936] Trial 1089 finished with value: 0.263299434336985 and parameters: {'n_estimators': 1487, 'learning_rate': 0.09598104234969458, 'max_depth': 10, 'min_samples_split': 18, 'min_samples_leaf': 2, 'subsample': 0.6130970796178918, 'max_features': 'log2'}. Best is trial 784 with value: 0.199214954455861.
[I 2024-12-04 12:55:22,584] Trial 1094 finished with value: 0.2169830499867909 and parameters: {'n_estimators': 1255, 'learning_rate': 0.09728704047667941, 'max_depth': 12, 'min_samples_split': 9, 'min_samples_leaf': 1, 'subsample': 0.7034070808109871, 'max_features': 'sqrt'}. Best is trial 784 with value: 0.199214954455861.
[I 2024-12-04 12:55:23,398] Trial 1104 finished with value: 0.31164158267158315 and parameters: {'n_estimators': 935, 'learning_rate': 0.08252844489174956, 'max_depth': 11, 'min_samples_split': 20, 'min_samples_leaf': 4, 'subsample': 0.6946653428592964, 'max_features': 'log2'}. Best is trial 784 with value: 0.199214954455861.
[I 2024-12-04 12:55:23,723] Trial 1109 finished with value: 0.7539976851675272 and parameters: {'n_estimators': 740, 'learning_rate': 0.011832324891158066, 'max_depth': 12, 'min_samples_split': 8, 'min_samples_leaf': 8, 'subsample': 0.6610929007261005, 'max_features': 'log2'}. Best is trial 784 with value: 0.199214954455861.
[I 2024-12-04 12:55:25,128] Trial 1102 finished with value: 0.24858114566137088 and parameters: {'n_estimators': 1015, 'learning_rate': 0.07598186682343491, 'max_depth': 12, 'min_samples_split': 11, 'min_samples_leaf': 3, 'subsample': 0.7439194429127446, 'max_features': 'sqrt'}. Best is trial 784 with value: 0.199214954455861.
[I 2024-12-04 12:55:25,559] Trial 1117 finished with value: 0.3393852166173155 and parameters: {'n_estimators': 436, 'learning_rate': 0.05529547187525944, 'max_depth': 11, 'min_samples_split': 10, 'min_samples_leaf': 7, 'subsample': 0.7185362641632745, 'max_features': None}. Best is trial 784 with value: 0.199214954455861.
[I 2024-12-04 12:55:26,485] Trial 1099 finished with value: 0.2312486761544018 and parameters: {'n_estimators': 1140, 'learning_rate': 0.06476052142195696, 'max_depth': 9, 'min_samples_split': 20, 'min_samples_leaf': 1, 'subsample': 0.6902271662714557, 'max_features': 'sqrt'}. Best is trial 784 with value: 0.199214954455861.
[I 2024-12-04 12:55:27,132] Trial 1096 finished with value: 0.24702505504302907 and parameters: {'n_estimators': 1266, 'learning_rate': 0.09168031641742196, 'max_depth': 9, 'min_samples_split': 20, 'min_samples_leaf': 2, 'subsample': 0.7015929977196211, 'max_features': 'sqrt'}. Best is trial 784 with value: 0.199214954455861.
[I 2024-12-04 12:55:36,413] Trial 1095 finished with value: 0.21671714803890768 and parameters: {'n_estimators': 1458, 'learning_rate': 0.09386524486298589, 'max_depth': 8, 'min_samples_split': 19, 'min_samples_leaf': 1, 'subsample': 0.619063933283049, 'max_features': 'sqrt'}. Best is trial 784 with value: 0.199214954455861.
[I 2024-12-04 12:55:40,647] Trial 1097 finished with value: 0.20090122418684575 and parameters: {'n_estimators': 1492, 'learning_rate': 0.09808600163815089, 'max_depth': 10, 'min_samples_split': 19, 'min_samples_leaf': 1, 'subsample': 0.6521228240175683, 'max_features': 'sqrt'}. Best is trial 784 with value: 0.199214954455861.
[I 2024-12-04 12:55:42,071] Trial 1124 finished with value: 0.29101054622367895 and parameters: {'n_estimators': 382, 'learning_rate': 0.07034745042116275, 'max_depth': 6, 'min_samples_split': 7, 'min_samples_leaf': 1, 'subsample': 0.7886199495923931, 'max_features': None}. Best is trial 784 with value: 0.199214954455861.
[I 2024-12-04 12:55:43,413] Trial 1101 finished with value: 0.4307690151147888 and parameters: {'n_estimators': 1385, 'learning_rate': 0.0162534981510633, 'max_depth': 8, 'min_samples_split': 8, 'min_samples_leaf': 10, 'subsample': 0.8891391768684462, 'max_features': 'sqrt'}. Best is trial 784 with value: 0.199214954455861.
[I 2024-12-04 12:55:44,751] Trial 1106 finished with value: 0.2415156484960415 and parameters: {'n_estimators': 1210, 'learning_rate': 0.07423473028183149, 'max_depth': 12, 'min_samples_split': 17, 'min_samples_leaf': 3, 'subsample': 0.6713901309482307, 'max_features': 'sqrt'}. Best is trial 784 with value: 0.199214954455861.
[I 2024-12-04 12:55:47,036] Trial 1112 finished with value: 0.2682777187218765 and parameters: {'n_estimators': 976, 'learning_rate': 0.08063380846122582, 'max_depth': 12, 'min_samples_split': 20, 'min_samples_leaf': 2, 'subsample': 0.738307911625374, 'max_features': 'log2'}. Best is trial 784 with value: 0.199214954455861.
[I 2024-12-04 12:55:48,187] Trial 1107 finished with value: 0.3750376242963971 and parameters: {'n_estimators': 1266, 'learning_rate': 0.06692301954723687, 'max_depth': 5, 'min_samples_split': 13, 'min_samples_leaf': 7, 'subsample': 0.998710149930236, 'max_features': 'log2'}. Best is trial 784 with value: 0.199214954455861.
[I 2024-12-04 12:55:48,859] Trial 1108 finished with value: 0.20852309450908973 and parameters: {'n_estimators': 1175, 'learning_rate': 0.09700162393160712, 'max_depth': 10, 'min_samples_split': 19, 'min_samples_leaf': 1, 'subsample': 0.6569623450783599, 'max_features': 'sqrt'}. Best is trial 784 with value: 0.199214954455861.
[I 2024-12-04 12:55:54,891] Trial 1103 finished with value: 0.23039706960932016 and parameters: {'n_estimators': 1469, 'learning_rate': 0.09497185026519758, 'max_depth': 10, 'min_samples_split': 19, 'min_samples_leaf': 2, 'subsample': 0.6707480733037593, 'max_features': 'sqrt'}. Best is trial 784 with value: 0.199214954455861.
[I 2024-12-04 12:55:56,843] Trial 1110 finished with value: 0.22324041615940962 and parameters: {'n_estimators': 1258, 'learning_rate': 0.07619971117874025, 'max_depth': 10, 'min_samples_split': 20, 'min_samples_leaf': 1, 'subsample': 0.6118119459491153, 'max_features': 'sqrt'}. Best is trial 784 with value: 0.199214954455861.
[I 2024-12-04 12:55:58,958] Trial 1126 finished with value: 0.3746067320077862 and parameters: {'n_estimators': 655, 'learning_rate': 0.03787554426689898, 'max_depth': 7, 'min_samples_split': 19, 'min_samples_leaf': 3, 'subsample': 0.750871870122921, 'max_features': 'log2'}. Best is trial 784 with value: 0.199214954455861.
[I 2024-12-04 12:55:59,810] Trial 1113 finished with value: 0.21428213501841342 and parameters: {'n_estimators': 1223, 'learning_rate': 0.0915443651754409, 'max_depth': 12, 'min_samples_split': 16, 'min_samples_leaf': 1, 'subsample': 0.632818168932197, 'max_features': 'sqrt'}. Best is trial 784 with value: 0.199214954455861.
[I 2024-12-04 12:56:01,319] Trial 1118 finished with value: 0.23072577980610784 and parameters: {'n_estimators': 1074, 'learning_rate': 0.09882271285399678, 'max_depth': 12, 'min_samples_split': 16, 'min_samples_leaf': 2, 'subsample': 0.6894840882151696, 'max_features': 'sqrt'}. Best is trial 784 with value: 0.199214954455861.
[I 2024-12-04 12:56:07,007] Trial 1115 finished with value: 0.23312605205730125 and parameters: {'n_estimators': 1244, 'learning_rate': 0.0948735210510304, 'max_depth': 12, 'min_samples_split': 16, 'min_samples_leaf': 1, 'subsample': 0.708894807853058, 'max_features': 'sqrt'}. Best is trial 784 with value: 0.199214954455861.
[I 2024-12-04 12:56:11,209] Trial 1131 finished with value: 0.4678261379468879 and parameters: {'n_estimators': 642, 'learning_rate': 0.040354017636902835, 'max_depth': 3, 'min_samples_split': 7, 'min_samples_leaf': 1, 'subsample': 0.8988384477203847, 'max_features': 'log2'}. Best is trial 784 with value: 0.199214954455861.
[I 2024-12-04 12:56:11,966] Trial 1111 finished with value: 0.2526322003593907 and parameters: {'n_estimators': 1486, 'learning_rate': 0.0768902704879552, 'max_depth': 10, 'min_samples_split': 20, 'min_samples_leaf': 2, 'subsample': 0.6994961780382263, 'max_features': 'sqrt'}. Best is trial 784 with value: 0.199214954455861.
[I 2024-12-04 12:56:16,354] Trial 1116 finished with value: 0.22713414991896536 and parameters: {'n_estimators': 1437, 'learning_rate': 0.09420816134366944, 'max_depth': 9, 'min_samples_split': 20, 'min_samples_leaf': 1, 'subsample': 0.6244088826676178, 'max_features': 'sqrt'}. Best is trial 784 with value: 0.199214954455861.
[I 2024-12-04 12:56:18,224] Trial 1140 finished with value: 0.3118815331175724 and parameters: {'n_estimators': 400, 'learning_rate': 0.021275475052585636, 'max_depth': 11, 'min_samples_split': 11, 'min_samples_leaf': 4, 'subsample': 0.6047030310463382, 'max_features': None}. Best is trial 784 with value: 0.199214954455861.
[I 2024-12-04 12:56:18,266] Trial 1114 finished with value: 0.2101739206582162 and parameters: {'n_estimators': 1445, 'learning_rate': 0.0889751011824628, 'max_depth': 12, 'min_samples_split': 20, 'min_samples_leaf': 1, 'subsample': 0.7276212192174056, 'max_features': 'sqrt'}. Best is trial 784 with value: 0.199214954455861.
[I 2024-12-04 12:56:20,793] Trial 1122 finished with value: 0.242558861133953 and parameters: {'n_estimators': 1167, 'learning_rate': 0.09178054431500692, 'max_depth': 10, 'min_samples_split': 20, 'min_samples_leaf': 2, 'subsample': 0.6366879171439876, 'max_features': 'sqrt'}. Best is trial 784 with value: 0.199214954455861.
[I 2024-12-04 12:56:23,972] Trial 1121 finished with value: 0.2282705520667237 and parameters: {'n_estimators': 1260, 'learning_rate': 0.08295696788838614, 'max_depth': 10, 'min_samples_split': 15, 'min_samples_leaf': 1, 'subsample': 0.7426394378660272, 'max_features': 'sqrt'}. Best is trial 784 with value: 0.199214954455861.
[I 2024-12-04 12:56:27,908] Trial 1127 finished with value: 0.2301894094610065 and parameters: {'n_estimators': 1147, 'learning_rate': 0.09329899402576629, 'max_depth': 10, 'min_samples_split': 20, 'min_samples_leaf': 1, 'subsample': 0.6646682233134845, 'max_features': 'sqrt'}. Best is trial 784 with value: 0.199214954455861.
[I 2024-12-04 12:56:30,055] Trial 1119 finished with value: 0.2526719755249255 and parameters: {'n_estimators': 1428, 'learning_rate': 0.037350201652357175, 'max_depth': 12, 'min_samples_split': 17, 'min_samples_leaf': 3, 'subsample': 0.7957498901317338, 'max_features': 'sqrt'}. Best is trial 784 with value: 0.199214954455861.
[I 2024-12-04 12:56:30,071] Trial 1123 finished with value: 0.22203819911222242 and parameters: {'n_estimators': 1257, 'learning_rate': 0.08251518175108967, 'max_depth': 10, 'min_samples_split': 9, 'min_samples_leaf': 1, 'subsample': 0.7867465755727484, 'max_features': 'sqrt'}. Best is trial 784 with value: 0.199214954455861.
[I 2024-12-04 12:56:34,983] Trial 1125 finished with value: 0.2429986918219205 and parameters: {'n_estimators': 1322, 'learning_rate': 0.05552556290013874, 'max_depth': 12, 'min_samples_split': 18, 'min_samples_leaf': 1, 'subsample': 0.7096500083004664, 'max_features': 'log2'}. Best is trial 784 with value: 0.199214954455861.
[I 2024-12-04 12:56:36,487] Trial 1120 finished with value: 0.29016769883772175 and parameters: {'n_estimators': 1288, 'learning_rate': 0.019401868925775285, 'max_depth': 9, 'min_samples_split': 7, 'min_samples_leaf': 2, 'subsample': 0.9392150051721009, 'max_features': None}. Best is trial 784 with value: 0.199214954455861.
[I 2024-12-04 12:56:37,357] Trial 1128 finished with value: 0.257892883981854 and parameters: {'n_estimators': 1246, 'learning_rate': 0.09562355217841587, 'max_depth': 11, 'min_samples_split': 16, 'min_samples_leaf': 3, 'subsample': 0.73876275189502, 'max_features': 'sqrt'}. Best is trial 784 with value: 0.199214954455861.
[I 2024-12-04 12:56:39,251] Trial 1130 finished with value: 0.2309022742087373 and parameters: {'n_estimators': 1173, 'learning_rate': 0.06164033583674923, 'max_depth': 12, 'min_samples_split': 10, 'min_samples_leaf': 1, 'subsample': 0.7048789797882313, 'max_features': 'sqrt'}. Best is trial 784 with value: 0.199214954455861.
[I 2024-12-04 12:56:43,135] Trial 1134 finished with value: 0.22419236216028862 and parameters: {'n_estimators': 1142, 'learning_rate': 0.09678266588880596, 'max_depth': 10, 'min_samples_split': 13, 'min_samples_leaf': 1, 'subsample': 0.6618983221527515, 'max_features': 'sqrt'}. Best is trial 784 with value: 0.199214954455861.
[I 2024-12-04 12:56:44,602] Trial 1132 finished with value: 0.2536937281240256 and parameters: {'n_estimators': 1231, 'learning_rate': 0.0681431913406971, 'max_depth': 11, 'min_samples_split': 12, 'min_samples_leaf': 3, 'subsample': 0.7502191694809288, 'max_features': 'sqrt'}. Best is trial 784 with value: 0.199214954455861.
[I 2024-12-04 12:56:44,617] Trial 1136 finished with value: 0.3314223318851351 and parameters: {'n_estimators': 1123, 'learning_rate': 0.05207673472405503, 'max_depth': 11, 'min_samples_split': 11, 'min_samples_leaf': 5, 'subsample': 0.9305470237401836, 'max_features': 'log2'}. Best is trial 784 with value: 0.199214954455861.
[I 2024-12-04 12:56:57,359] Trial 1141 finished with value: 0.37137714141498657 and parameters: {'n_estimators': 1143, 'learning_rate': 0.09988979663072572, 'max_depth': 6, 'min_samples_split': 15, 'min_samples_leaf': 8, 'subsample': 0.8965074434891543, 'max_features': 'sqrt'}. Best is trial 784 with value: 0.199214954455861.
