[I 2024-12-03 18:50:20,746] Trial 1968 finished with value: 0.457703393030015 and parameters: {'kernel': 'rbf', 'C': 95.54622645062202, 'gamma': 0.011538149121110034, 'epsilon': 0.04844010009204276}. Best is trial 1119 with value: 0.4485361816812923.
[I 2024-12-03 18:50:20,749] Trial 1955 finished with value: 0.6265403494261846 and parameters: {'kernel': 'rbf', 'C': 96.25192292044828, 'gamma': 0.24167911038342277, 'epsilon': 0.14182722540816792}. Best is trial 1119 with value: 0.4485361816812923.
[I 2024-12-03 18:50:21,112] Trial 1966 finished with value: 0.5358335914657862 and parameters: {'kernel': 'rbf', 'C': 19.14172898307496, 'gamma': 0.008868452125722808, 'epsilon': 0.048777690923847414}. Best is trial 1119 with value: 0.4485361816812923.
[I 2024-12-03 18:50:22,492] Trial 1962 finished with value: 0.4719274757592681 and parameters: {'kernel': 'rbf', 'C': 21.713875318635626, 'gamma': 0.03195326156739044, 'epsilon': 0.0659319219096991}. Best is trial 1119 with value: 0.4485361816812923.
[I 2024-12-03 18:50:22,785] Trial 1967 finished with value: 0.4863168769561085 and parameters: {'kernel': 'rbf', 'C': 26.767803936838124, 'gamma': 0.014622216271891862, 'epsilon': 0.019111205549930364}. Best is trial 1119 with value: 0.4485361816812923.
[I 2024-12-03 18:50:23,522] Trial 1963 finished with value: 0.4844852277058903 and parameters: {'kernel': 'rbf', 'C': 21.980947105612177, 'gamma': 0.03515256431306189, 'epsilon': 0.11346558483125237}. Best is trial 1119 with value: 0.4485361816812923.
[I 2024-12-03 18:50:23,885] Trial 1969 finished with value: 1.3149541482475247 and parameters: {'kernel': 'sigmoid', 'C': 0.010330956122869451, 'gamma': 0.16118404859388508, 'epsilon': 0.0136215562394657}. Best is trial 1119 with value: 0.4485361816812923.
[I 2024-12-03 18:50:23,996] Trial 1979 finished with value: 0.5285435161875498 and parameters: {'kernel': 'rbf', 'C': 99.95774495260984, 'gamma': 0.010093597836845542, 'epsilon': 0.30710798910181525}. Best is trial 1119 with value: 0.4485361816812923.
[I 2024-12-03 18:50:24,022] Trial 1965 finished with value: 0.6299471374674921 and parameters: {'kernel': 'rbf', 'C': 99.08836068464198, 'gamma': 0.05029724599995752, 'epsilon': 0.026599037219567436}. Best is trial 1119 with value: 0.4485361816812923.
[I 2024-12-03 18:50:24,314] Trial 1973 finished with value: 0.5925583771498399 and parameters: {'kernel': 'rbf', 'C': 20.904554825487512, 'gamma': 0.0031135411942909193, 'epsilon': 0.10902593376904886}. Best is trial 1119 with value: 0.4485361816812923.
[I 2024-12-03 18:50:24,655] Trial 1982 finished with value: 0.49832888850358903 and parameters: {'kernel': 'rbf', 'C': 20.892703549386198, 'gamma': 0.014211563217145588, 'epsilon': 0.12241933450803753}. Best is trial 1119 with value: 0.4485361816812923.
[I 2024-12-03 18:50:24,661] Trial 1980 finished with value: 0.5069696937128698 and parameters: {'kernel': 'rbf', 'C': 9.864229483654512, 'gamma': 0.026499553872380566, 'epsilon': 0.2599634791292786}. Best is trial 1119 with value: 0.4485361816812923.
[I 2024-12-03 18:50:24,682] Trial 1974 finished with value: 1.3287336879901555 and parameters: {'kernel': 'rbf', 'C': 0.025711093932669744, 'gamma': 0.4294114595051482, 'epsilon': 0.001609349168378241}. Best is trial 1119 with value: 0.4485361816812923.
[I 2024-12-03 18:50:25,941] Trial 1961 finished with value: 0.46991698867683307 and parameters: {'kernel': 'rbf', 'C': 97.80612597718104, 'gamma': 0.008859877813079012, 'epsilon': 0.05244993916656591}. Best is trial 1119 with value: 0.4485361816812923.
[I 2024-12-03 18:50:25,942] Trial 1975 finished with value: 0.7615408730526844 and parameters: {'kernel': 'linear', 'C': 0.025717228715059635, 'gamma': 0.5666308090047696, 'epsilon': 0.009310519008129063}. Best is trial 1119 with value: 0.4485361816812923.
[I 2024-12-03 18:50:26,357] Trial 1976 finished with value: 0.45779543915824134 and parameters: {'kernel': 'rbf', 'C': 93.99712698778116, 'gamma': 0.01796108648289818, 'epsilon': 0.06703970834422437}. Best is trial 1119 with value: 0.4485361816812923.
[I 2024-12-03 18:50:26,529] Trial 1983 finished with value: 0.4506344411977617 and parameters: {'kernel': 'rbf', 'C': 97.92378750623973, 'gamma': 0.011416290708675333, 'epsilon': 0.06777261138904613}. Best is trial 1119 with value: 0.4485361816812923.
[I 2024-12-03 18:50:26,580] Trial 1981 finished with value: 0.7425113531219809 and parameters: {'kernel': 'rbf', 'C': 4.407559688943562, 'gamma': 0.003657388145306651, 'epsilon': 0.06272481310382176}. Best is trial 1119 with value: 0.4485361816812923.
[I 2024-12-03 18:50:26,955] Trial 1978 finished with value: 0.7834771491368683 and parameters: {'kernel': 'rbf', 'C': 4.480031503362736, 'gamma': 0.15491136230411373, 'epsilon': 0.9970987621228393}. Best is trial 1119 with value: 0.4485361816812923.
[I 2024-12-03 18:50:27,081] Trial 1971 finished with value: 0.6651643359890279 and parameters: {'kernel': 'rbf', 'C': 1.6306528002698324, 'gamma': 0.02434279545533449, 'epsilon': 0.002987725891582997}. Best is trial 1119 with value: 0.4485361816812923.
[I 2024-12-03 18:50:28,258] Trial 1986 finished with value: 0.5551654878682943 and parameters: {'kernel': 'rbf', 'C': 4.478455744169256, 'gamma': 0.022779307434448958, 'epsilon': 0.04981284594460787}. Best is trial 1119 with value: 0.4485361816812923.
[I 2024-12-03 18:50:28,267] Trial 1993 finished with value: 0.5756435971421753 and parameters: {'kernel': 'rbf', 'C': 92.71531015686321, 'gamma': 0.03951418509908661, 'epsilon': 0.13430861102024863}. Best is trial 1119 with value: 0.4485361816812923.
[I 2024-12-03 18:50:28,681] Trial 1977 finished with value: 0.632717011954063 and parameters: {'kernel': 'linear', 'C': 0.9903669928338303, 'gamma': 0.4403514881207636, 'epsilon': 0.8107200932520464}. Best is trial 1119 with value: 0.4485361816812923.
[I 2024-12-03 18:50:29,466] Trial 1996 finished with value: 0.46769715815096785 and parameters: {'kernel': 'rbf', 'C': 98.48395688125724, 'gamma': 0.009789978072099161, 'epsilon': 0.02062586586412248}. Best is trial 1119 with value: 0.4485361816812923.
[I 2024-12-03 18:50:29,551] Trial 1987 finished with value: 0.5789826143872968 and parameters: {'kernel': 'rbf', 'C': 93.63124541165132, 'gamma': 0.04164181291618462, 'epsilon': 0.09587651801421673}. Best is trial 1119 with value: 0.4485361816812923.
[I 2024-12-03 18:50:29,902] Trial 1992 finished with value: 0.5342603709378099 and parameters: {'kernel': 'rbf', 'C': 15.406673992189706, 'gamma': 0.01208076828691239, 'epsilon': 0.26499631003232765}. Best is trial 1119 with value: 0.4485361816812923.
[I 2024-12-03 18:50:30,275] Trial 1985 finished with value: 0.570885320420561 and parameters: {'kernel': 'linear', 'C': 9.082560486159716, 'gamma': 0.0034610308399797953, 'epsilon': 0.09727572446730505}. Best is trial 1119 with value: 0.4485361816812923.
[I 2024-12-03 18:50:30,563] Trial 1995 finished with value: 0.6592930100351039 and parameters: {'kernel': 'rbf', 'C': 97.98733737000443, 'gamma': 0.0558317688522118, 'epsilon': 0.028903098879585306}. Best is trial 1119 with value: 0.4485361816812923.
[I 2024-12-03 18:50:30,615] Trial 1997 finished with value: 0.4604451689312574 and parameters: {'kernel': 'rbf', 'C': 99.08716135334723, 'gamma': 0.009269357191905152, 'epsilon': 0.12557104974240121}. Best is trial 1119 with value: 0.4485361816812923.
[I 2024-12-03 18:50:31,087] Trial 1988 finished with value: 0.525830230786516 and parameters: {'kernel': 'rbf', 'C': 22.861528149256873, 'gamma': 0.05568166952130929, 'epsilon': 0.05179238348256292}. Best is trial 1119 with value: 0.4485361816812923.
[I 2024-12-03 18:50:31,315] Trial 1972 finished with value: 0.5199402079399172 and parameters: {'kernel': 'rbf', 'C': 23.750314818575973, 'gamma': 0.010206411674589369, 'epsilon': 0.024161298119173485}. Best is trial 1119 with value: 0.4485361816812923.
[I 2024-12-03 18:50:31,355] Trial 1990 finished with value: 0.5908010170375335 and parameters: {'kernel': 'rbf', 'C': 97.91856255874247, 'gamma': 0.044245336909601155, 'epsilon': 0.07566166843750004}. Best is trial 1119 with value: 0.4485361816812923.
[I 2024-12-03 18:50:31,555] Trial 1991 finished with value: 0.5278995051276734 and parameters: {'kernel': 'rbf', 'C': 21.312451845112903, 'gamma': 0.009767089674042176, 'epsilon': 0.06157417177445761}. Best is trial 1119 with value: 0.4485361816812923.
[I 2024-12-03 18:50:31,800] Trial 1999 finished with value: 0.5823986974921433 and parameters: {'kernel': 'rbf', 'C': 20.77534858945665, 'gamma': 0.0039503269063546455, 'epsilon': 0.04028801378877991}. Best is trial 1119 with value: 0.4485361816812923.
[I 2024-12-03 18:50:32,219] Trial 1984 finished with value: 0.5624970995880012 and parameters: {'kernel': 'linear', 'C': 84.81301370868479, 'gamma': 0.007819168331067886, 'epsilon': 0.03139523143325874}. Best is trial 1119 with value: 0.4485361816812923.
[I 2024-12-03 18:50:32,290] Trial 2003 finished with value: 0.5394005216078919 and parameters: {'kernel': 'rbf', 'C': 19.597059672350298, 'gamma': 0.008919858583686116, 'epsilon': 0.1560375449774728}. Best is trial 1119 with value: 0.4485361816812923.
[I 2024-12-03 18:50:33,412] Trial 2001 finished with value: 0.7696986394262997 and parameters: {'kernel': 'sigmoid', 'C': 4.712076813076874, 'gamma': 0.0022251422518418875, 'epsilon': 0.2994732810195146}. Best is trial 1119 with value: 0.4485361816812923.
[I 2024-12-03 18:50:34,171] Trial 1994 finished with value: 0.4786361686918494 and parameters: {'kernel': 'rbf', 'C': 25.221308716537497, 'gamma': 0.016606668080967866, 'epsilon': 0.019156398615868472}. Best is trial 1119 with value: 0.4485361816812923.
[I 2024-12-03 18:50:34,653] Trial 2000 finished with value: 0.5665208053315365 and parameters: {'kernel': 'linear', 'C': 10.288017762033236, 'gamma': 0.044224052410665064, 'epsilon': 0.11963887251045774}. Best is trial 1119 with value: 0.4485361816812923.
[I 2024-12-03 18:50:34,653] Trial 2006 finished with value: 0.47009348461494127 and parameters: {'kernel': 'rbf', 'C': 21.43911053172658, 'gamma': 0.0235870472190352, 'epsilon': 0.06466699666211266}. Best is trial 1119 with value: 0.4485361816812923.
[I 2024-12-03 18:50:34,698] Trial 1989 finished with value: 0.49466554953965475 and parameters: {'kernel': 'rbf', 'C': 96.7595045101557, 'gamma': 0.009838622234870963, 'epsilon': 0.22339739717178814}. Best is trial 1119 with value: 0.4485361816812923.
[I 2024-12-03 18:50:34,980] Trial 2002 finished with value: 0.5055065748637231 and parameters: {'kernel': 'rbf', 'C': 89.5503369651086, 'gamma': 0.00465982091331062, 'epsilon': 0.06801328037719004}. Best is trial 1119 with value: 0.4485361816812923.
[I 2024-12-03 18:50:35,098] Trial 2013 finished with value: 0.5332357882168082 and parameters: {'kernel': 'rbf', 'C': 27.78430220071598, 'gamma': 0.007167233323089319, 'epsilon': 0.08781739882264028}. Best is trial 1119 with value: 0.4485361816812923.
[I 2024-12-03 18:50:35,473] Trial 2005 finished with value: 0.5348023987004472 and parameters: {'kernel': 'rbf', 'C': 27.598819764471084, 'gamma': 0.007301258922637778, 'epsilon': 0.07657340000433072}. Best is trial 1119 with value: 0.4485361816812923.
[I 2024-12-03 18:50:35,476] Trial 2012 finished with value: 0.7717158254705117 and parameters: {'kernel': 'poly', 'C': 98.971882345493, 'gamma': 0.015438248443138649, 'epsilon': 0.02615995338601617}. Best is trial 1119 with value: 0.4485361816812923.
[I 2024-12-03 18:50:35,488] Trial 2008 finished with value: 341.34190222291545 and parameters: {'kernel': 'sigmoid', 'C': 59.42543662023899, 'gamma': 0.036336655881561486, 'epsilon': 0.04848850211248323}. Best is trial 1119 with value: 0.4485361816812923.
[I 2024-12-03 18:50:35,491] Trial 2010 finished with value: 0.4845695677781619 and parameters: {'kernel': 'rbf', 'C': 97.01427062096627, 'gamma': 0.007130693049353556, 'epsilon': 0.028974813305954483}. Best is trial 1119 with value: 0.4485361816812923.
[I 2024-12-03 18:50:35,834] Trial 1998 finished with value: 0.5626735579812225 and parameters: {'kernel': 'rbf', 'C': 22.708151865726354, 'gamma': 0.004757330747271548, 'epsilon': 0.07329816801955592}. Best is trial 1119 with value: 0.4485361816812923.
[I 2024-12-03 18:50:36,117] Trial 2004 finished with value: 0.5783455789374475 and parameters: {'kernel': 'rbf', 'C': 91.6877907452448, 'gamma': 0.04042818337761393, 'epsilon': 0.0499458890919009}. Best is trial 1119 with value: 0.4485361816812923.
[I 2024-12-03 18:50:36,680] Trial 2009 finished with value: 0.49017795939922404 and parameters: {'kernel': 'rbf', 'C': 96.6539919919487, 'gamma': 0.018105726896976263, 'epsilon': 0.13127985715278062}. Best is trial 1119 with value: 0.4485361816812923.
[I 2024-12-03 18:50:37,030] Trial 2011 finished with value: 0.5746685821652686 and parameters: {'kernel': 'rbf', 'C': 24.916854895439787, 'gamma': 0.08117674488686294, 'epsilon': 0.28883126819123}. Best is trial 1119 with value: 0.4485361816812923.
[I 2024-12-03 18:50:38,212] Trial 2014 finished with value: 0.5417506664673711 and parameters: {'kernel': 'rbf', 'C': 22.90984198111899, 'gamma': 0.06083444758597316, 'epsilon': 0.051751278051220984}. Best is trial 1119 with value: 0.4485361816812923.
[I 2024-12-03 18:50:39,003] Trial 2024 finished with value: 0.460081650400624 and parameters: {'kernel': 'rbf', 'C': 96.3879095643756, 'gamma': 0.017907475595914275, 'epsilon': 0.03671333880662565}. Best is trial 1119 with value: 0.4485361816812923.
[I 2024-12-03 18:50:39,016] Trial 2015 finished with value: 0.5108514538394687 and parameters: {'kernel': 'rbf', 'C': 6.142784251749717, 'gamma': 0.04436641347248184, 'epsilon': 0.017395348347490867}. Best is trial 1119 with value: 0.4485361816812923.
[I 2024-12-03 18:50:39,024] Trial 2021 finished with value: 0.6459862767632122 and parameters: {'kernel': 'rbf', 'C': 95.32092509217479, 'gamma': 0.054014111726379675, 'epsilon': 0.0592369428717768}. Best is trial 1119 with value: 0.4485361816812923.
[I 2024-12-03 18:50:39,307] Trial 2022 finished with value: 4.1942506513706945 and parameters: {'kernel': 'sigmoid', 'C': 0.343938100762568, 'gamma': 0.5953860751481181, 'epsilon': 0.07034824036957296}. Best is trial 1119 with value: 0.4485361816812923.
[I 2024-12-03 18:50:39,477] Trial 2007 finished with value: 0.4843946375596591 and parameters: {'kernel': 'rbf', 'C': 96.95164869536958, 'gamma': 0.016344284535428535, 'epsilon': 0.15029683784037043}. Best is trial 1119 with value: 0.4485361816812923.
[I 2024-12-03 18:50:39,519] Trial 2020 finished with value: 0.455800125450402 and parameters: {'kernel': 'rbf', 'C': 96.74194712066696, 'gamma': 0.01424350870360858, 'epsilon': 0.039472581824597404}. Best is trial 1119 with value: 0.4485361816812923.
[I 2024-12-03 18:50:39,551] Trial 2019 finished with value: 0.567571893357388 and parameters: {'kernel': 'rbf', 'C': 88.56876857640944, 'gamma': 0.001505464382117666, 'epsilon': 0.13109814725986346}. Best is trial 1119 with value: 0.4485361816812923.
[I 2024-12-03 18:50:39,838] Trial 2023 finished with value: 0.6076540949890534 and parameters: {'kernel': 'rbf', 'C': 18.07098321773267, 'gamma': 0.003140888939801105, 'epsilon': 0.024343121257078503}. Best is trial 1119 with value: 0.4485361816812923.
[I 2024-12-03 18:50:39,839] Trial 2027 finished with value: 0.9973860115653898 and parameters: {'kernel': 'rbf', 'C': 0.26887250950994374, 'gamma': 0.0019758368850546827, 'epsilon': 0.3309327975747996}. Best is trial 1119 with value: 0.4485361816812923.
[I 2024-12-03 18:50:40,415] Trial 2026 finished with value: 0.46768600543539607 and parameters: {'kernel': 'rbf', 'C': 21.05954432041479, 'gamma': 0.021125374088300848, 'epsilon': 0.035144768655883854}. Best is trial 1119 with value: 0.4485361816812923.
[I 2024-12-03 18:50:41,489] Trial 2016 finished with value: 0.580970975274807 and parameters: {'kernel': 'rbf', 'C': 87.39172478361358, 'gamma': 0.0018919538636830283, 'epsilon': 0.010063949219584468}. Best is trial 1119 with value: 0.4485361816812923.
[I 2024-12-03 18:50:42,434] Trial 2029 finished with value: 0.5644990925670527 and parameters: {'kernel': 'rbf', 'C': 5.43707173356804, 'gamma': 0.014026954815423882, 'epsilon': 0.0775905914884745}. Best is trial 1119 with value: 0.4485361816812923.
[I 2024-12-03 18:50:42,949] Trial 2017 finished with value: 0.5889838970507417 and parameters: {'kernel': 'rbf', 'C': 26.906545798281876, 'gamma': 0.0026252193383970316, 'epsilon': 0.10249692858200338}. Best is trial 1119 with value: 0.4485361816812923.
[I 2024-12-03 18:50:42,952] Trial 2025 finished with value: 0.5324872946969453 and parameters: {'kernel': 'rbf', 'C': 18.194696218568765, 'gamma': 0.009943191868242779, 'epsilon': 0.10435207826648805}. Best is trial 1119 with value: 0.4485361816812923.
[I 2024-12-03 18:50:43,215] Trial 2040 finished with value: 1.0949012055420217 and parameters: {'kernel': 'poly', 'C': 0.013169534864178266, 'gamma': 0.05464055323942707, 'epsilon': 0.01531864230402459}. Best is trial 1119 with value: 0.4485361816812923.
[I 2024-12-03 18:50:43,216] Trial 2030 finished with value: 0.6005421001590835 and parameters: {'kernel': 'rbf', 'C': 94.9187212581776, 'gamma': 0.11753399395142688, 'epsilon': 0.34727608218358064}. Best is trial 1119 with value: 0.4485361816812923.
[I 2024-12-03 18:50:44,496] Trial 2031 finished with value: 7.12993615564303 and parameters: {'kernel': 'sigmoid', 'C': 1.257819443640635, 'gamma': 0.03553827595301404, 'epsilon': 0.001422627721336881}. Best is trial 1119 with value: 0.4485361816812923.
[I 2024-12-03 18:50:45,052] Trial 2041 finished with value: 1.0468149898433285 and parameters: {'kernel': 'poly', 'C': 98.97271407064207, 'gamma': 0.00377335155216788, 'epsilon': 0.07575055069961587}. Best is trial 1119 with value: 0.4485361816812923.
[I 2024-12-03 18:50:45,117] Trial 2042 finished with value: 205.55291416746934 and parameters: {'kernel': 'sigmoid', 'C': 78.27880030092345, 'gamma': 0.015062730281417087, 'epsilon': 0.14768511028592263}. Best is trial 1119 with value: 0.4485361816812923.
[I 2024-12-03 18:50:45,246] Trial 2033 finished with value: 0.5678714810141802 and parameters: {'kernel': 'rbf', 'C': 89.16420942306759, 'gamma': 0.002096870206134989, 'epsilon': 0.0394412880212774}. Best is trial 1119 with value: 0.4485361816812923.
[I 2024-12-03 18:50:45,253] Trial 2045 finished with value: 0.5357066347624726 and parameters: {'kernel': 'rbf', 'C': 23.964141248626287, 'gamma': 0.010835958384264047, 'epsilon': 0.2534942380848785}. Best is trial 1119 with value: 0.4485361816812923.
[I 2024-12-03 18:50:45,257] Trial 2028 finished with value: 0.48235348396255795 and parameters: {'kernel': 'rbf', 'C': 94.39711272314048, 'gamma': 0.007214523628984364, 'epsilon': 0.04298689017643532}. Best is trial 1119 with value: 0.4485361816812923.
[I 2024-12-03 18:50:45,477] Trial 2018 finished with value: 0.45843635345086226 and parameters: {'kernel': 'rbf', 'C': 99.45336585617413, 'gamma': 0.00978183144732718, 'epsilon': 0.08744400955924815}. Best is trial 1119 with value: 0.4485361816812923.
[I 2024-12-03 18:50:45,589] Trial 2035 finished with value: 0.5558123960079804 and parameters: {'kernel': 'rbf', 'C': 92.1911855087636, 'gamma': 0.0024854827389013566, 'epsilon': 0.07333764734370418}. Best is trial 1119 with value: 0.4485361816812923.
[I 2024-12-03 18:50:46,019] Trial 2044 finished with value: 0.5049304991616004 and parameters: {'kernel': 'rbf', 'C': 98.6590732307669, 'gamma': 0.004585860168091648, 'epsilon': 0.045525668542494034}. Best is trial 1119 with value: 0.4485361816812923.
[I 2024-12-03 18:50:46,128] Trial 2036 finished with value: 86.44247027597623 and parameters: {'kernel': 'sigmoid', 'C': 98.8003019247814, 'gamma': 0.007999237305733107, 'epsilon': 0.08728629781027039}. Best is trial 1119 with value: 0.4485361816812923.
[I 2024-12-03 18:50:46,375] Trial 2043 finished with value: 0.4709646564933705 and parameters: {'kernel': 'rbf', 'C': 21.62216085724022, 'gamma': 0.028714747582981728, 'epsilon': 0.12695251655838596}. Best is trial 1119 with value: 0.4485361816812923.
[I 2024-12-03 18:50:46,996] Trial 2046 finished with value: 0.9199432237106469 and parameters: {'kernel': 'poly', 'C': 75.7308515101484, 'gamma': 0.055125050454813786, 'epsilon': 0.23637406508591996}. Best is trial 1119 with value: 0.4485361816812923.
[I 2024-12-03 18:50:47,188] Trial 2051 finished with value: 0.5579038744001502 and parameters: {'kernel': 'rbf', 'C': 94.65343527259671, 'gamma': 0.029914750611432287, 'epsilon': 0.3173709015898751}. Best is trial 1119 with value: 0.4485361816812923.
[I 2024-12-03 18:50:47,326] Trial 2039 finished with value: 0.5117531720001004 and parameters: {'kernel': 'rbf', 'C': 98.48327291776968, 'gamma': 0.025410854192518154, 'epsilon': 0.08529207958407413}. Best is trial 1119 with value: 0.4485361816812923.
[I 2024-12-03 18:50:47,327] Trial 2038 finished with value: 0.5458136172834404 and parameters: {'kernel': 'rbf', 'C': 20.82845180044001, 'gamma': 0.006910724798268804, 'epsilon': 0.10180940078012228}. Best is trial 1119 with value: 0.4485361816812923.
[I 2024-12-03 18:50:47,578] Trial 2032 finished with value: 0.6325215312823959 and parameters: {'kernel': 'rbf', 'C': 94.57862434471545, 'gamma': 0.05126682996078977, 'epsilon': 0.10044739569807701}. Best is trial 1119 with value: 0.4485361816812923.
[I 2024-12-03 18:50:47,579] Trial 2037 finished with value: 0.4678845687069317 and parameters: {'kernel': 'rbf', 'C': 19.491431715953482, 'gamma': 0.022312260119202364, 'epsilon': 0.037098584265439855}. Best is trial 1119 with value: 0.4485361816812923.
[I 2024-12-03 18:50:48,200] Trial 2034 finished with value: 0.4956900802508577 and parameters: {'kernel': 'rbf', 'C': 15.820985502181808, 'gamma': 0.0178970836741913, 'epsilon': 0.049949970271205964}. Best is trial 1119 with value: 0.4485361816812923.
[I 2024-12-03 18:50:48,600] Trial 2054 finished with value: 0.5375094635427144 and parameters: {'kernel': 'rbf', 'C': 27.715416932383107, 'gamma': 0.0067573069164668055, 'epsilon': 0.06912246281201359}. Best is trial 1119 with value: 0.4485361816812923.
