[I 2024-12-04 20:36:23,824] Trial 1744 finished with value: 0.3592111601843357 and parameters: {'kernel_type': 'Matern', 'length_scale': 0.14335910403812238, 'noise_level': 0.11761690657145185, 'constant_value': 39.7759854945085, 'nu': 0.5}. Best is trial 881 with value: 0.35916990930150405.
[I 2024-12-04 20:36:26,974] Trial 1747 finished with value: 0.3592109664020621 and parameters: {'kernel_type': 'Matern', 'length_scale': 331.1687963142271, 'noise_level': 0.008707953288172789, 'constant_value': 6.158547017279848, 'nu': 0.5}. Best is trial 881 with value: 0.35916990930150405.
[I 2024-12-04 20:36:27,215] Trial 1746 finished with value: 1.0624161172692912 and parameters: {'kernel_type': 'RBF', 'length_scale': 4.1747307180341614e-05, 'noise_level': 0.0011267745781111257, 'constant_value': 0.00014389494354010625, 'nu': 1.5}. Best is trial 881 with value: 0.35916990930150405.
[I 2024-12-04 20:36:28,541] Trial 1748 finished with value: 0.35921115814266863 and parameters: {'kernel_type': 'Matern', 'length_scale': 3.1402327567467667, 'noise_level': 0.0003754186911863661, 'constant_value': 583.5361216588335, 'nu': 0.5}. Best is trial 881 with value: 0.35916990930150405.
[I 2024-12-04 20:36:30,903] Trial 1750 finished with value: 1.0916558493884911 and parameters: {'kernel_type': 'RBF', 'length_scale': 0.005177428949277908, 'noise_level': 1.80280286971095e-05, 'constant_value': 44.85680953512133, 'nu': 0.5}. Best is trial 881 with value: 0.35916990930150405.
[I 2024-12-04 20:36:31,994] Trial 1749 finished with value: 0.3592106614717961 and parameters: {'kernel_type': 'Matern', 'length_scale': 6.295185138910723, 'noise_level': 0.03639820288445763, 'constant_value': 167.60716991778042, 'nu': 0.5}. Best is trial 881 with value: 0.35916990930150405.
[I 2024-12-04 20:36:33,533] Trial 1751 finished with value: 0.35921122241639586 and parameters: {'kernel_type': 'Matern', 'length_scale': 22.504433155619203, 'noise_level': 0.0008271059335260763, 'constant_value': 3075.33806561461, 'nu': 0.5}. Best is trial 881 with value: 0.35916990930150405.
[I 2024-12-04 20:36:36,157] Trial 1752 finished with value: 0.3592113187823479 and parameters: {'kernel_type': 'Matern', 'length_scale': 0.24229201763906807, 'noise_level': 0.0038037752186583333, 'constant_value': 119.76778467212266, 'nu': 0.5}. Best is trial 881 with value: 0.35916990930150405.
[I 2024-12-04 20:36:37,405] Trial 1753 finished with value: 0.3592112562931437 and parameters: {'kernel_type': 'Matern', 'length_scale': 7.179447669064586, 'noise_level': 0.8577908560268465, 'constant_value': 4.786918781464755, 'nu': 0.5}. Best is trial 881 with value: 0.35916990930150405.
[I 2024-12-04 20:36:38,650] Trial 1754 finished with value: 1.0624161174099347 and parameters: {'kernel_type': 'RBF', 'length_scale': 2.0505380495231027e-05, 'noise_level': 1.6957138455361966e-08, 'constant_value': 0.040658538029995646, 'nu': 0.5}. Best is trial 881 with value: 0.35916990930150405.
[I 2024-12-04 20:36:41,611] Trial 1755 finished with value: 1.0624161172679798 and parameters: {'kernel_type': 'Matern', 'length_scale': 666.2128856968692, 'noise_level': 2.0332591024386917e-10, 'constant_value': 26738.18094120538, 'nu': 2.5}. Best is trial 881 with value: 0.35916990930150405.
[I 2024-12-04 20:36:42,531] Trial 1756 finished with value: 0.35921126665869735 and parameters: {'kernel_type': 'Matern', 'length_scale': 876.3241306217392, 'noise_level': 0.031989712221569495, 'constant_value': 344.01667585826516, 'nu': 0.5}. Best is trial 881 with value: 0.35916990930150405.
[I 2024-12-04 20:36:43,943] Trial 1757 finished with value: 0.359211154075906 and parameters: {'kernel_type': 'Matern', 'length_scale': 77.93972700803643, 'noise_level': 0.06230535582094479, 'constant_value': 1519.821732037316, 'nu': 0.5}. Best is trial 881 with value: 0.35916990930150405.
[I 2024-12-04 20:36:45,891] Trial 1758 finished with value: 0.3592111298812424 and parameters: {'kernel_type': 'Matern', 'length_scale': 55.620782736661695, 'noise_level': 0.0005101593339496436, 'constant_value': 7.78692232560023, 'nu': 0.5}. Best is trial 881 with value: 0.35916990930150405.
[I 2024-12-04 20:36:49,038] Trial 1760 finished with value: 0.3592112358463204 and parameters: {'kernel_type': 'Matern', 'length_scale': 6.660908451896086, 'noise_level': 0.03878983112724001, 'constant_value': 13.364090135228995, 'nu': 0.5}. Best is trial 881 with value: 0.35916990930150405.
[I 2024-12-04 20:36:50,853] Trial 1761 finished with value: 0.35921083155840294 and parameters: {'kernel_type': 'Matern', 'length_scale': 0.4303408838893724, 'noise_level': 0.003961177902282133, 'constant_value': 232.0241928098581, 'nu': 0.5}. Best is trial 881 with value: 0.35916990930150405.
[I 2024-12-04 20:36:51,721] Trial 1759 finished with value: 0.4226897112407707 and parameters: {'kernel_type': 'Matern', 'length_scale': 505.52246914044144, 'noise_level': 0.004163972807894219, 'constant_value': 22235.939544010515, 'nu': 1.5}. Best is trial 881 with value: 0.35916990930150405.
[I 2024-12-04 20:36:54,000] Trial 1762 finished with value: 0.35920955007224614 and parameters: {'kernel_type': 'Matern', 'length_scale': 2.636276943763542, 'noise_level': 0.8784332917009843, 'constant_value': 336.9086372022811, 'nu': 0.5}. Best is trial 881 with value: 0.35916990930150405.
[I 2024-12-04 20:36:57,052] Trial 1765 finished with value: 1.062416118194218 and parameters: {'kernel_type': 'Matern', 'length_scale': 0.028162084988482494, 'noise_level': 0.430153911774321, 'constant_value': 173.5387025487776, 'nu': 0.5}. Best is trial 881 with value: 0.35916990930150405.
[I 2024-12-04 20:36:57,291] Trial 1764 finished with value: 0.3592110990362819 and parameters: {'kernel_type': 'Matern', 'length_scale': 18.935444833017346, 'noise_level': 0.8149531996219337, 'constant_value': 354.33058877146806, 'nu': 0.5}. Best is trial 881 with value: 0.35916990930150405.
[I 2024-12-04 20:36:58,081] Trial 1763 finished with value: 1.062416117312276 and parameters: {'kernel_type': 'Matern', 'length_scale': 580.6673599960999, 'noise_level': 2.7436691317062992e-05, 'constant_value': 10.587986200538511, 'nu': 0.5}. Best is trial 881 with value: 0.35916990930150405.
[I 2024-12-04 20:37:01,072] Trial 1766 finished with value: 0.3592112461785922 and parameters: {'kernel_type': 'Matern', 'length_scale': 1.0846848796737363, 'noise_level': 0.29717493072281176, 'constant_value': 483.2323701446831, 'nu': 0.5}. Best is trial 881 with value: 0.35916990930150405.
[I 2024-12-04 20:37:02,053] Trial 1767 finished with value: 0.35921127677807063 and parameters: {'kernel_type': 'Matern', 'length_scale': 4.492136182588265, 'noise_level': 0.781651512265213, 'constant_value': 108.60497012456655, 'nu': 0.5}. Best is trial 881 with value: 0.35916990930150405.
[I 2024-12-04 20:37:05,695] Trial 1770 finished with value: 1.062414743893951 and parameters: {'kernel_type': 'Matern', 'length_scale': 0.07707260162128213, 'noise_level': 0.1946948829022894, 'constant_value': 463.61945827581525, 'nu': 0.5}. Best is trial 881 with value: 0.35916990930150405.
[I 2024-12-04 20:37:06,683] Trial 1768 finished with value: 1.0624161172675077 and parameters: {'kernel_type': 'Matern', 'length_scale': 3.212990557927059e-05, 'noise_level': 0.16700686345964433, 'constant_value': 0.00012528049696742958, 'nu': 0.5}. Best is trial 881 with value: 0.35916990930150405.
[I 2024-12-04 20:37:07,103] Trial 1769 finished with value: 0.4226897227037459 and parameters: {'kernel_type': 'Matern', 'length_scale': 30.403789895394592, 'noise_level': 0.44620319008672504, 'constant_value': 138.63453038254437, 'nu': 1.5}. Best is trial 881 with value: 0.35916990930150405.
[I 2024-12-04 20:37:12,465] Trial 1773 finished with value: 0.35921128811257064 and parameters: {'kernel_type': 'Matern', 'length_scale': 0.7830264155544318, 'noise_level': 0.7628256219231119, 'constant_value': 69.79152821885637, 'nu': 0.5}. Best is trial 881 with value: 0.35916990930150405.
[I 2024-12-04 20:37:13,609] Trial 1772 finished with value: 0.35921124090783113 and parameters: {'kernel_type': 'Matern', 'length_scale': 0.21924285783604347, 'noise_level': 0.37131512651402687, 'constant_value': 878.9886893091024, 'nu': 0.5}. Best is trial 881 with value: 0.35916990930150405.
[I 2024-12-04 20:37:14,382] Trial 1771 finished with value: 0.35921123514870645 and parameters: {'kernel_type': 'Matern', 'length_scale': 0.09989784858866174, 'noise_level': 0.026070108782557347, 'constant_value': 1405.817730522005, 'nu': 0.5}. Best is trial 881 with value: 0.35916990930150405.
[I 2024-12-04 20:37:17,703] Trial 1774 finished with value: 0.35921124132293875 and parameters: {'kernel_type': 'Matern', 'length_scale': 22.788027702801788, 'noise_level': 0.10217264553071274, 'constant_value': 506.2059075301619, 'nu': 0.5}. Best is trial 881 with value: 0.35916990930150405.
[I 2024-12-04 20:37:19,193] Trial 1776 finished with value: 0.35921125766567913 and parameters: {'kernel_type': 'Matern', 'length_scale': 0.781339596214438, 'noise_level': 0.6799597384424445, 'constant_value': 353.526911166937, 'nu': 0.5}. Best is trial 881 with value: 0.35916990930150405.
[I 2024-12-04 20:37:19,197] Trial 1775 finished with value: 0.3592112328404581 and parameters: {'kernel_type': 'Matern', 'length_scale': 0.3041401289913928, 'noise_level': 0.5716991045012262, 'constant_value': 212.3880195917058, 'nu': 0.5}. Best is trial 881 with value: 0.35916990930150405.
[I 2024-12-04 20:37:24,318] Trial 1779 finished with value: 0.3592114161684921 and parameters: {'kernel_type': 'Matern', 'length_scale': 17.472680444147056, 'noise_level': 0.6173712416573456, 'constant_value': 211.5673009669305, 'nu': 0.5}. Best is trial 881 with value: 0.35916990930150405.
[I 2024-12-04 20:37:27,486] Trial 1777 finished with value: 1.0624161172698172 and parameters: {'kernel_type': 'Matern', 'length_scale': 0.00029810873660271947, 'noise_level': 0.0005983291385556702, 'constant_value': 2.0155114622420674e-07, 'nu': 1.5}. Best is trial 881 with value: 0.35916990930150405.
[I 2024-12-04 20:37:28,730] Trial 1778 finished with value: 1.078339724329804 and parameters: {'kernel_type': 'Matern', 'length_scale': 0.03413528602077635, 'noise_level': 6.540410780194002e-07, 'constant_value': 3.89304552808561, 'nu': 0.5}. Best is trial 881 with value: 0.35916990930150405.
[I 2024-12-04 20:37:29,265] Trial 1780 finished with value: 0.35921072716545543 and parameters: {'kernel_type': 'Matern', 'length_scale': 6.325439206216307, 'noise_level': 0.8972144303848296, 'constant_value': 673.4764566773597, 'nu': 0.5}. Best is trial 881 with value: 0.35916990930150405.
[I 2024-12-04 20:37:32,964] Trial 1781 finished with value: 0.3592112476989429 and parameters: {'kernel_type': 'Matern', 'length_scale': 1.3691160166433698, 'noise_level': 0.66018609201521, 'constant_value': 2.4368388595452646, 'nu': 0.5}. Best is trial 881 with value: 0.35916990930150405.
[I 2024-12-04 20:37:34,128] Trial 1783 finished with value: 0.359211711010898 and parameters: {'kernel_type': 'Matern', 'length_scale': 44.444143357086936, 'noise_level': 0.6382479842844526, 'constant_value': 1058.3452025298423, 'nu': 0.5}. Best is trial 881 with value: 0.35916990930150405.
[I 2024-12-04 20:37:37,426] Trial 1782 finished with value: 0.4195660631721927 and parameters: {'kernel_type': 'Matern', 'length_scale': 0.22731647395934415, 'noise_level': 3.144212893865526e-05, 'constant_value': 9.286187240822184e-06, 'nu': 2.5}. Best is trial 881 with value: 0.35916990930150405.
[I 2024-12-04 20:37:37,636] Trial 1784 finished with value: 0.35921100716232646 and parameters: {'kernel_type': 'Matern', 'length_scale': 0.4629572877048233, 'noise_level': 0.8734088523351828, 'constant_value': 112.8776237257586, 'nu': 0.5}. Best is trial 881 with value: 0.35916990930150405.
[I 2024-12-04 20:37:38,130] Trial 1785 finished with value: 1.0624161172667306 and parameters: {'kernel_type': 'Matern', 'length_scale': 0.0012498405263581796, 'noise_level': 0.0006478066650569528, 'constant_value': 68.3300692094246, 'nu': 0.5}. Best is trial 881 with value: 0.35916990930150405.
[I 2024-12-04 20:37:41,862] Trial 1788 finished with value: 1.091656498344747 and parameters: {'kernel_type': 'Matern', 'length_scale': 19.68595766275645, 'noise_level': 1.4183302568575849e-05, 'constant_value': 292.26573958877515, 'nu': 0.5}. Best is trial 881 with value: 0.35916990930150405.
[I 2024-12-04 20:37:41,942] Trial 1786 finished with value: 0.3591703505950139 and parameters: {'kernel_type': 'Matern', 'length_scale': 9.239112386408175, 'noise_level': 0.013264456658624173, 'constant_value': 4047.3209869470797, 'nu': 0.5}. Best is trial 881 with value: 0.35916990930150405.
[I 2024-12-04 20:37:43,314] Trial 1787 finished with value: 0.35921122753762297 and parameters: {'kernel_type': 'Matern', 'length_scale': 547.9853249607004, 'noise_level': 0.015821972201502478, 'constant_value': 67296.24763143466, 'nu': 0.5}. Best is trial 881 with value: 0.35916990930150405.
[I 2024-12-04 20:37:46,205] Trial 1789 finished with value: 0.3592112581057347 and parameters: {'kernel_type': 'Matern', 'length_scale': 0.7419916360575093, 'noise_level': 0.00038181694693726026, 'constant_value': 11529.418754569479, 'nu': 0.5}. Best is trial 881 with value: 0.35916990930150405.
[I 2024-12-04 20:37:47,126] Trial 1790 finished with value: 0.35921133261822485 and parameters: {'kernel_type': 'Matern', 'length_scale': 2.033926254791256, 'noise_level': 0.050217422263305625, 'constant_value': 3072.0241984290456, 'nu': 0.5}. Best is trial 881 with value: 0.35916990930150405.
[I 2024-12-04 20:37:49,570] Trial 1791 finished with value: 0.35921034207702623 and parameters: {'kernel_type': 'Matern', 'length_scale': 3.3133843295595162, 'noise_level': 0.012122688545652193, 'constant_value': 1966.6771605216823, 'nu': 0.5}. Best is trial 881 with value: 0.35916990930150405.
[I 2024-12-04 20:37:51,452] Trial 1792 finished with value: 0.3592112722798575 and parameters: {'kernel_type': 'Matern', 'length_scale': 23.896164280237617, 'noise_level': 0.002936881268829961, 'constant_value': 90264.60148408709, 'nu': 0.5}. Best is trial 881 with value: 0.35916990930150405.
[I 2024-12-04 20:37:53,979] Trial 1793 finished with value: 0.35921130753211594 and parameters: {'kernel_type': 'Matern', 'length_scale': 0.20897716957935694, 'noise_level': 0.04852800904782642, 'constant_value': 41.89119233345215, 'nu': 0.5}. Best is trial 881 with value: 0.35916990930150405.
[I 2024-12-04 20:37:57,200] Trial 1794 finished with value: 1.0624161172279976 and parameters: {'kernel_type': 'Matern', 'length_scale': 72736.19430205987, 'noise_level': 6.020118721311577e-06, 'constant_value': 2.069867484024025, 'nu': 1.5}. Best is trial 881 with value: 0.35916990930150405.
[I 2024-12-04 20:37:59,069] Trial 1796 finished with value: 0.35920973016494234 and parameters: {'kernel_type': 'Matern', 'length_scale': 5.804026654793134, 'noise_level': 0.021223775833076945, 'constant_value': 5576.980640659158, 'nu': 0.5}. Best is trial 881 with value: 0.35916990930150405.
[I 2024-12-04 20:38:01,902] Trial 1795 finished with value: 1.06241611726377 and parameters: {'kernel_type': 'Matern', 'length_scale': 64844.62925104618, 'noise_level': 1.574684431782092e-08, 'constant_value': 3.1480141648724034e-07, 'nu': 1.5}. Best is trial 881 with value: 0.35916990930150405.
[I 2024-12-04 20:38:02,433] Trial 1797 finished with value: 0.35921138021254917 and parameters: {'kernel_type': 'Matern', 'length_scale': 316.1144077134148, 'noise_level': 0.8294231061200379, 'constant_value': 960.9264626269841, 'nu': 0.5}. Best is trial 881 with value: 0.35916990930150405.
[I 2024-12-04 20:38:03,439] Trial 1798 finished with value: 0.3592192282203797 and parameters: {'kernel_type': 'Matern', 'length_scale': 0.5954850922818492, 'noise_level': 0.0026858756997232016, 'constant_value': 11175.587538955118, 'nu': 0.5}. Best is trial 881 with value: 0.35916990930150405.
[I 2024-12-04 20:38:07,304] Trial 1799 finished with value: 0.359211292705147 and parameters: {'kernel_type': 'Matern', 'length_scale': 0.2583593196382966, 'noise_level': 0.05337680177041209, 'constant_value': 437.9919357539457, 'nu': 0.5}. Best is trial 881 with value: 0.35916990930150405.
[I 2024-12-04 20:38:07,873] Trial 1801 finished with value: 0.35921144114847847 and parameters: {'kernel_type': 'Matern', 'length_scale': 1.1902990926145027, 'noise_level': 0.0031612950422592427, 'constant_value': 24962.68880213181, 'nu': 0.5}. Best is trial 881 with value: 0.35916990930150405.
[I 2024-12-04 20:38:15,116] Trial 1802 finished with value: 0.4286835178663192 and parameters: {'kernel_type': 'RBF', 'length_scale': 10.125678397798357, 'noise_level': 0.16899582044015746, 'constant_value': 5786.112969172174, 'nu': 0.5}. Best is trial 881 with value: 0.35916990930150405.
[I 2024-12-04 20:38:15,896] Trial 1803 finished with value: 1.0624161179007394 and parameters: {'kernel_type': 'Matern', 'length_scale': 0.006720762582779663, 'noise_level': 0.7800784621338666, 'constant_value': 23.7606002949246, 'nu': 0.5}. Best is trial 881 with value: 0.35916990930150405.
[I 2024-12-04 20:38:16,451] Trial 1800 finished with value: 1.0624161172791737 and parameters: {'kernel_type': 'RBF', 'length_scale': 20226.500189140206, 'noise_level': 1.6651474850530748e-07, 'constant_value': 1.1167844222390418e-07, 'nu': 0.5}. Best is trial 881 with value: 0.35916990930150405.
[I 2024-12-04 20:38:20,227] Trial 1804 finished with value: 1.062415859884234 and parameters: {'kernel_type': 'Matern', 'length_scale': 0.06832933659591107, 'noise_level': 0.0028407375279839234, 'constant_value': 32510.385623512982, 'nu': 0.5}. Best is trial 881 with value: 0.35916990930150405.
[I 2024-12-04 20:38:21,378] Trial 1805 finished with value: 0.35921132789188864 and parameters: {'kernel_type': 'Matern', 'length_scale': 13.006984876660864, 'noise_level': 0.035915753446238444, 'constant_value': 8698.63572495499, 'nu': 0.5}. Best is trial 881 with value: 0.35916990930150405.
[I 2024-12-04 20:38:25,681] Trial 1806 finished with value: 0.3592112333316944 and parameters: {'kernel_type': 'Matern', 'length_scale': 0.4038318092931572, 'noise_level': 0.0051094266462407955, 'constant_value': 3924.936599140902, 'nu': 0.5}. Best is trial 881 with value: 0.35916990930150405.
[I 2024-12-04 20:38:27,149] Trial 1808 finished with value: 0.35921128394847657 and parameters: {'kernel_type': 'Matern', 'length_scale': 96.6078946320011, 'noise_level': 0.050424817898126174, 'constant_value': 17967.901365601767, 'nu': 0.5}. Best is trial 881 with value: 0.35916990930150405.
[I 2024-12-04 20:38:30,687] Trial 1807 finished with value: 1.0624161172386593 and parameters: {'kernel_type': 'RBF', 'length_scale': 44124.25791245944, 'noise_level': 5.826146395699534e-08, 'constant_value': 0.00012073794897027684, 'nu': 1.5}. Best is trial 881 with value: 0.35916990930150405.
[I 2024-12-04 20:38:31,018] Trial 1809 finished with value: 0.35921099013435137 and parameters: {'kernel_type': 'Matern', 'length_scale': 232.0609657010221, 'noise_level': 0.00032524130431493646, 'constant_value': 68798.67537501859, 'nu': 0.5}. Best is trial 881 with value: 0.35916990930150405.
[I 2024-12-04 20:38:32,167] Trial 1810 finished with value: 0.3592110489883046 and parameters: {'kernel_type': 'Matern', 'length_scale': 1.8106252040908977, 'noise_level': 0.056743436157668733, 'constant_value': 19053.740763821916, 'nu': 0.5}. Best is trial 881 with value: 0.35916990930150405.
[I 2024-12-04 20:38:35,483] Trial 1812 finished with value: 0.35921127479073356 and parameters: {'kernel_type': 'Matern', 'length_scale': 12.174838085547808, 'noise_level': 0.00437150551086852, 'constant_value': 17247.842556443826, 'nu': 0.5}. Best is trial 881 with value: 0.35916990930150405.
[I 2024-12-04 20:38:35,820] Trial 1811 finished with value: 0.3592131439780572 and parameters: {'kernel_type': 'Matern', 'length_scale': 113.11554725225166, 'noise_level': 0.7770867973929061, 'constant_value': 6787.977360865701, 'nu': 0.5}. Best is trial 881 with value: 0.35916990930150405.
[I 2024-12-04 20:38:40,082] Trial 1813 finished with value: 0.3592112482898121 and parameters: {'kernel_type': 'Matern', 'length_scale': 0.14073030297037217, 'noise_level': 0.011386557671955334, 'constant_value': 42939.2039769385, 'nu': 0.5}. Best is trial 881 with value: 0.35916990930150405.
[I 2024-12-04 20:38:40,912] Trial 1815 finished with value: 0.35921073400948716 and parameters: {'kernel_type': 'Matern', 'length_scale': 0.3876622825281429, 'noise_level': 0.025331985658325982, 'constant_value': 2069.20172996688, 'nu': 0.5}. Best is trial 881 with value: 0.35916990930150405.
[I 2024-12-04 20:38:41,732] Trial 1814 finished with value: 0.4195659763493116 and parameters: {'kernel_type': 'Matern', 'length_scale': 0.30165378960998745, 'noise_level': 0.4809175479695668, 'constant_value': 170.1176329169093, 'nu': 2.5}. Best is trial 881 with value: 0.35916990930150405.
[I 2024-12-04 20:38:45,044] Trial 1816 finished with value: 0.3592112158493792 and parameters: {'kernel_type': 'Matern', 'length_scale': 1.3112177627236292, 'noise_level': 0.9158442821846167, 'constant_value': 1306.4850538075113, 'nu': 0.5}. Best is trial 881 with value: 0.35916990930150405.
[I 2024-12-04 20:38:47,072] Trial 1817 finished with value: 0.35921122082034185 and parameters: {'kernel_type': 'Matern', 'length_scale': 48382.36953703863, 'noise_level': 0.00047006717909691103, 'constant_value': 1332.8163915250063, 'nu': 0.5}. Best is trial 881 with value: 0.35916990930150405.
[I 2024-12-04 20:38:48,085] Trial 1818 finished with value: 0.35921111458643257 and parameters: {'kernel_type': 'Matern', 'length_scale': 0.3131539112626387, 'noise_level': 0.0274817291064511, 'constant_value': 3751.671238619654, 'nu': 0.5}. Best is trial 881 with value: 0.35916990930150405.
