[I 2024-12-04 15:22:23,787] Trial 1436 finished with value: 0.42047422076235 and parameters: {'n_estimators': 775, 'max_depth': 48, 'min_samples_split': 2, 'min_samples_leaf': 1, 'max_features': None, 'bootstrap': True, 'criterion': 'squared_error'}. Best is trial 1025 with value: 0.41844370194907604.
[I 2024-12-04 15:22:24,394] Trial 1442 finished with value: 0.7761568838911438 and parameters: {'n_estimators': 858, 'max_depth': 14, 'min_samples_split': 24, 'min_samples_leaf': 1, 'max_features': 'sqrt', 'bootstrap': True, 'criterion': 'squared_error'}. Best is trial 1025 with value: 0.41844370194907604.
[I 2024-12-04 15:22:25,641] Trial 1440 finished with value: 0.6496023366509117 and parameters: {'n_estimators': 340, 'max_depth': 41, 'min_samples_split': 32, 'min_samples_leaf': 2, 'max_features': 'sqrt', 'bootstrap': False, 'criterion': 'squared_error'}. Best is trial 1025 with value: 0.41844370194907604.
[I 2024-12-04 15:22:34,075] Trial 1439 finished with value: 0.43239562944938414 and parameters: {'n_estimators': 642, 'max_depth': 40, 'min_samples_split': 4, 'min_samples_leaf': 1, 'max_features': None, 'bootstrap': True, 'criterion': 'squared_error'}. Best is trial 1025 with value: 0.41844370194907604.
[I 2024-12-04 15:22:34,570] Trial 1428 finished with value: 0.5468106243195422 and parameters: {'n_estimators': 988, 'max_depth': 43, 'min_samples_split': 4, 'min_samples_leaf': 1, 'max_features': 'sqrt', 'bootstrap': True, 'criterion': 'absolute_error'}. Best is trial 1025 with value: 0.41844370194907604.
[I 2024-12-04 15:22:34,801] Trial 1443 finished with value: 0.4213466881737741 and parameters: {'n_estimators': 793, 'max_depth': 33, 'min_samples_split': 2, 'min_samples_leaf': 1, 'max_features': None, 'bootstrap': True, 'criterion': 'squared_error'}. Best is trial 1025 with value: 0.41844370194907604.
[I 2024-12-04 15:22:37,879] Trial 1451 finished with value: 0.5238528490487094 and parameters: {'n_estimators': 483, 'max_depth': 42, 'min_samples_split': 5, 'min_samples_leaf': 1, 'max_features': None, 'bootstrap': False, 'criterion': 'squared_error'}. Best is trial 1025 with value: 0.41844370194907604.
[I 2024-12-04 15:22:40,136] Trial 1435 finished with value: 0.700007852178508 and parameters: {'n_estimators': 323, 'max_depth': 8, 'min_samples_split': 3, 'min_samples_leaf': 3, 'max_features': None, 'bootstrap': False, 'criterion': 'absolute_error'}. Best is trial 1025 with value: 0.41844370194907604.
[I 2024-12-04 15:22:42,142] Trial 1447 finished with value: 0.43105732356902565 and parameters: {'n_estimators': 827, 'max_depth': 39, 'min_samples_split': 4, 'min_samples_leaf': 1, 'max_features': None, 'bootstrap': True, 'criterion': 'squared_error'}. Best is trial 1025 with value: 0.41844370194907604.
[I 2024-12-04 15:22:42,325] Trial 1448 finished with value: 0.42067502640356996 and parameters: {'n_estimators': 766, 'max_depth': 37, 'min_samples_split': 2, 'min_samples_leaf': 1, 'max_features': None, 'bootstrap': True, 'criterion': 'squared_error'}. Best is trial 1025 with value: 0.41844370194907604.
[I 2024-12-04 15:22:42,915] Trial 1441 finished with value: 0.4257117706311274 and parameters: {'n_estimators': 609, 'max_depth': 34, 'min_samples_split': 3, 'min_samples_leaf': 1, 'max_features': None, 'bootstrap': True, 'criterion': 'squared_error'}. Best is trial 1025 with value: 0.41844370194907604.
[I 2024-12-04 15:22:46,462] Trial 1446 finished with value: 0.42213694514954153 and parameters: {'n_estimators': 686, 'max_depth': 42, 'min_samples_split': 2, 'min_samples_leaf': 1, 'max_features': None, 'bootstrap': True, 'criterion': 'squared_error'}. Best is trial 1025 with value: 0.41844370194907604.
[I 2024-12-04 15:22:46,705] Trial 1445 finished with value: 0.46490479234187465 and parameters: {'n_estimators': 740, 'max_depth': 32, 'min_samples_split': 4, 'min_samples_leaf': 2, 'max_features': None, 'bootstrap': True, 'criterion': 'squared_error'}. Best is trial 1025 with value: 0.41844370194907604.
[I 2024-12-04 15:22:51,705] Trial 1452 finished with value: 0.6608244281586861 and parameters: {'n_estimators': 582, 'max_depth': 43, 'min_samples_split': 4, 'min_samples_leaf': 8, 'max_features': None, 'bootstrap': True, 'criterion': 'absolute_error'}. Best is trial 1025 with value: 0.41844370194907604.
[I 2024-12-04 15:22:55,467] Trial 1454 finished with value: 0.46528590336222225 and parameters: {'n_estimators': 835, 'max_depth': 43, 'min_samples_split': 2, 'min_samples_leaf': 2, 'max_features': None, 'bootstrap': True, 'criterion': 'squared_error'}. Best is trial 1025 with value: 0.41844370194907604.
[I 2024-12-04 15:22:55,986] Trial 1449 finished with value: 0.4229227621400729 and parameters: {'n_estimators': 738, 'max_depth': 30, 'min_samples_split': 2, 'min_samples_leaf': 1, 'max_features': None, 'bootstrap': True, 'criterion': 'squared_error'}. Best is trial 1025 with value: 0.41844370194907604.
[I 2024-12-04 15:22:55,991] Trial 1450 finished with value: 0.46542988201830315 and parameters: {'n_estimators': 826, 'max_depth': 37, 'min_samples_split': 2, 'min_samples_leaf': 2, 'max_features': None, 'bootstrap': True, 'criterion': 'squared_error'}. Best is trial 1025 with value: 0.41844370194907604.
[I 2024-12-04 15:22:57,824] Trial 1456 finished with value: 0.41969616055121756 and parameters: {'n_estimators': 638, 'max_depth': 41, 'min_samples_split': 2, 'min_samples_leaf': 1, 'max_features': None, 'bootstrap': True, 'criterion': 'squared_error'}. Best is trial 1025 with value: 0.41844370194907604.
[I 2024-12-04 15:22:59,094] Trial 1461 finished with value: 0.4646300532056985 and parameters: {'n_estimators': 615, 'max_depth': 38, 'min_samples_split': 2, 'min_samples_leaf': 2, 'max_features': None, 'bootstrap': True, 'criterion': 'squared_error'}. Best is trial 1025 with value: 0.41844370194907604.
[I 2024-12-04 15:22:59,732] Trial 1460 finished with value: 0.533618131762347 and parameters: {'n_estimators': 765, 'max_depth': 25, 'min_samples_split': 2, 'min_samples_leaf': 1, 'max_features': None, 'bootstrap': False, 'criterion': 'squared_error'}. Best is trial 1025 with value: 0.41844370194907604.
[I 2024-12-04 15:23:01,202] Trial 1457 finished with value: 0.4215776246015264 and parameters: {'n_estimators': 755, 'max_depth': 42, 'min_samples_split': 2, 'min_samples_leaf': 1, 'max_features': None, 'bootstrap': True, 'criterion': 'squared_error'}. Best is trial 1025 with value: 0.41844370194907604.
[I 2024-12-04 15:23:01,925] Trial 1462 finished with value: 0.6257352360315365 and parameters: {'n_estimators': 806, 'max_depth': 41, 'min_samples_split': 2, 'min_samples_leaf': 1, 'max_features': 'log2', 'bootstrap': True, 'criterion': 'squared_error'}. Best is trial 1025 with value: 0.41844370194907604.
[I 2024-12-04 15:23:02,838] Trial 1469 finished with value: 0.48874960371842247 and parameters: {'n_estimators': 785, 'max_depth': 40, 'min_samples_split': 2, 'min_samples_leaf': 1, 'max_features': 'sqrt', 'bootstrap': False, 'criterion': 'squared_error'}. Best is trial 1025 with value: 0.41844370194907604.
[I 2024-12-04 15:23:03,747] Trial 1453 finished with value: 0.4195430035192546 and parameters: {'n_estimators': 720, 'max_depth': 39, 'min_samples_split': 2, 'min_samples_leaf': 1, 'max_features': None, 'bootstrap': True, 'criterion': 'squared_error'}. Best is trial 1025 with value: 0.41844370194907604.
[I 2024-12-04 15:23:04,771] Trial 1458 finished with value: 0.4241819217576239 and parameters: {'n_estimators': 792, 'max_depth': 39, 'min_samples_split': 3, 'min_samples_leaf': 1, 'max_features': None, 'bootstrap': True, 'criterion': 'squared_error'}. Best is trial 1025 with value: 0.41844370194907604.
[I 2024-12-04 15:23:05,029] Trial 1468 finished with value: 0.6981136241216224 and parameters: {'n_estimators': 717, 'max_depth': 39, 'min_samples_split': 2, 'min_samples_leaf': 2, 'max_features': 'sqrt', 'bootstrap': True, 'criterion': 'squared_error'}. Best is trial 1025 with value: 0.41844370194907604.
[I 2024-12-04 15:23:06,838] Trial 1455 finished with value: 0.4260903922213272 and parameters: {'n_estimators': 830, 'max_depth': 29, 'min_samples_split': 3, 'min_samples_leaf': 1, 'max_features': None, 'bootstrap': True, 'criterion': 'squared_error'}. Best is trial 1025 with value: 0.41844370194907604.
[I 2024-12-04 15:23:07,904] Trial 1465 finished with value: 0.5239096843996663 and parameters: {'n_estimators': 870, 'max_depth': 36, 'min_samples_split': 2, 'min_samples_leaf': 1, 'max_features': None, 'bootstrap': False, 'criterion': 'squared_error'}. Best is trial 1025 with value: 0.41844370194907604.
[I 2024-12-04 15:23:08,108] Trial 1459 finished with value: 0.4320549092695161 and parameters: {'n_estimators': 832, 'max_depth': 36, 'min_samples_split': 4, 'min_samples_leaf': 1, 'max_features': None, 'bootstrap': True, 'criterion': 'squared_error'}. Best is trial 1025 with value: 0.41844370194907604.
[I 2024-12-04 15:23:08,881] Trial 1464 finished with value: 0.42182556183276476 and parameters: {'n_estimators': 729, 'max_depth': 44, 'min_samples_split': 2, 'min_samples_leaf': 1, 'max_features': None, 'bootstrap': True, 'criterion': 'squared_error'}. Best is trial 1025 with value: 0.41844370194907604.
[I 2024-12-04 15:23:10,905] Trial 1463 finished with value: 0.4208452713408661 and parameters: {'n_estimators': 830, 'max_depth': 37, 'min_samples_split': 2, 'min_samples_leaf': 1, 'max_features': None, 'bootstrap': True, 'criterion': 'squared_error'}. Best is trial 1025 with value: 0.41844370194907604.
[I 2024-12-04 15:23:12,260] Trial 1467 finished with value: 0.4652167359225536 and parameters: {'n_estimators': 849, 'max_depth': 34, 'min_samples_split': 2, 'min_samples_leaf': 2, 'max_features': None, 'bootstrap': True, 'criterion': 'squared_error'}. Best is trial 1025 with value: 0.41844370194907604.
[I 2024-12-04 15:23:13,131] Trial 1466 finished with value: 0.9231415349501209 and parameters: {'n_estimators': 948, 'max_depth': 7, 'min_samples_split': 42, 'min_samples_leaf': 2, 'max_features': 'sqrt', 'bootstrap': True, 'criterion': 'absolute_error'}. Best is trial 1025 with value: 0.41844370194907604.
[I 2024-12-04 15:23:15,217] Trial 1470 finished with value: 0.42440292120481865 and parameters: {'n_estimators': 645, 'max_depth': 40, 'min_samples_split': 3, 'min_samples_leaf': 1, 'max_features': None, 'bootstrap': True, 'criterion': 'squared_error'}. Best is trial 1025 with value: 0.41844370194907604.
[I 2024-12-04 15:23:16,990] Trial 1472 finished with value: 0.4218831677662311 and parameters: {'n_estimators': 791, 'max_depth': 35, 'min_samples_split': 2, 'min_samples_leaf': 1, 'max_features': None, 'bootstrap': True, 'criterion': 'squared_error'}. Best is trial 1025 with value: 0.41844370194907604.
[I 2024-12-04 15:23:17,646] Trial 1478 finished with value: 0.7086356298151333 and parameters: {'n_estimators': 152, 'max_depth': 28, 'min_samples_split': 3, 'min_samples_leaf': 15, 'max_features': None, 'bootstrap': False, 'criterion': 'squared_error'}. Best is trial 1025 with value: 0.41844370194907604.
[I 2024-12-04 15:23:21,287] Trial 1471 finished with value: 0.46518705651303527 and parameters: {'n_estimators': 845, 'max_depth': 45, 'min_samples_split': 2, 'min_samples_leaf': 2, 'max_features': None, 'bootstrap': True, 'criterion': 'squared_error'}. Best is trial 1025 with value: 0.41844370194907604.
[I 2024-12-04 15:23:21,724] Trial 1474 finished with value: 0.4247119339379501 and parameters: {'n_estimators': 816, 'max_depth': 44, 'min_samples_split': 3, 'min_samples_leaf': 1, 'max_features': None, 'bootstrap': True, 'criterion': 'squared_error'}. Best is trial 1025 with value: 0.41844370194907604.
[I 2024-12-04 15:23:22,207] Trial 1476 finished with value: 0.42421884013288386 and parameters: {'n_estimators': 629, 'max_depth': 28, 'min_samples_split': 2, 'min_samples_leaf': 1, 'max_features': None, 'bootstrap': True, 'criterion': 'squared_error'}. Best is trial 1025 with value: 0.41844370194907604.
[I 2024-12-04 15:23:22,916] Trial 1486 finished with value: 0.7781296444724481 and parameters: {'n_estimators': 587, 'max_depth': 35, 'min_samples_split': 20, 'min_samples_leaf': 4, 'max_features': 'sqrt', 'bootstrap': False, 'criterion': 'squared_error'}. Best is trial 1025 with value: 0.41844370194907604.
[I 2024-12-04 15:23:23,008] Trial 1489 finished with value: 0.9039052044457662 and parameters: {'n_estimators': 449, 'max_depth': 22, 'min_samples_split': 6, 'min_samples_leaf': 2, 'max_features': 'log2', 'bootstrap': False, 'criterion': 'squared_error'}. Best is trial 1025 with value: 0.41844370194907604.
[I 2024-12-04 15:23:23,195] Trial 1437 finished with value: 0.4603405018226621 and parameters: {'n_estimators': 795, 'max_depth': 39, 'min_samples_split': 2, 'min_samples_leaf': 2, 'max_features': None, 'bootstrap': True, 'criterion': 'absolute_error'}. Best is trial 1025 with value: 0.41844370194907604.
[I 2024-12-04 15:23:24,798] Trial 1477 finished with value: 0.42126361722991695 and parameters: {'n_estimators': 675, 'max_depth': 38, 'min_samples_split': 2, 'min_samples_leaf': 1, 'max_features': None, 'bootstrap': True, 'criterion': 'squared_error'}. Best is trial 1025 with value: 0.41844370194907604.
[I 2024-12-04 15:23:26,056] Trial 1473 finished with value: 0.42397247154481094 and parameters: {'n_estimators': 855, 'max_depth': 42, 'min_samples_split': 3, 'min_samples_leaf': 1, 'max_features': None, 'bootstrap': True, 'criterion': 'squared_error'}. Best is trial 1025 with value: 0.41844370194907604.
[I 2024-12-04 15:23:27,962] Trial 1492 finished with value: 1.0429093987844107 and parameters: {'n_estimators': 201, 'max_depth': 6, 'min_samples_split': 31, 'min_samples_leaf': 4, 'max_features': 'log2', 'bootstrap': True, 'criterion': 'absolute_error'}. Best is trial 1025 with value: 0.41844370194907604.
[I 2024-12-04 15:23:28,056] Trial 1475 finished with value: 0.42165647473753465 and parameters: {'n_estimators': 754, 'max_depth': 42, 'min_samples_split': 2, 'min_samples_leaf': 1, 'max_features': None, 'bootstrap': True, 'criterion': 'squared_error'}. Best is trial 1025 with value: 0.41844370194907604.
[I 2024-12-04 15:23:31,675] Trial 1479 finished with value: 0.4208484525968846 and parameters: {'n_estimators': 865, 'max_depth': 33, 'min_samples_split': 2, 'min_samples_leaf': 1, 'max_features': None, 'bootstrap': True, 'criterion': 'squared_error'}. Best is trial 1025 with value: 0.41844370194907604.
[I 2024-12-04 15:23:32,529] Trial 1480 finished with value: 0.4655287693774981 and parameters: {'n_estimators': 785, 'max_depth': 40, 'min_samples_split': 2, 'min_samples_leaf': 2, 'max_features': None, 'bootstrap': True, 'criterion': 'squared_error'}. Best is trial 1025 with value: 0.41844370194907604.
[I 2024-12-04 15:23:39,399] Trial 1484 finished with value: 0.6131233833689761 and parameters: {'n_estimators': 672, 'max_depth': 49, 'min_samples_split': 3, 'min_samples_leaf': 2, 'max_features': None, 'bootstrap': False, 'criterion': 'squared_error'}. Best is trial 1025 with value: 0.41844370194907604.
[I 2024-12-04 15:23:41,595] Trial 1483 finished with value: 0.4188536682588814 and parameters: {'n_estimators': 782, 'max_depth': 40, 'min_samples_split': 2, 'min_samples_leaf': 1, 'max_features': None, 'bootstrap': True, 'criterion': 'squared_error'}. Best is trial 1025 with value: 0.41844370194907604.
[I 2024-12-04 15:23:42,735] Trial 1487 finished with value: 0.4209449811347231 and parameters: {'n_estimators': 798, 'max_depth': 48, 'min_samples_split': 2, 'min_samples_leaf': 1, 'max_features': None, 'bootstrap': True, 'criterion': 'squared_error'}. Best is trial 1025 with value: 0.41844370194907604.
[I 2024-12-04 15:23:43,905] Trial 1481 finished with value: 0.46462543736191453 and parameters: {'n_estimators': 880, 'max_depth': 45, 'min_samples_split': 4, 'min_samples_leaf': 2, 'max_features': None, 'bootstrap': True, 'criterion': 'squared_error'}. Best is trial 1025 with value: 0.41844370194907604.
[I 2024-12-04 15:23:44,442] Trial 1490 finished with value: 0.4197748452720573 and parameters: {'n_estimators': 822, 'max_depth': 39, 'min_samples_split': 2, 'min_samples_leaf': 1, 'max_features': None, 'bootstrap': True, 'criterion': 'squared_error'}. Best is trial 1025 with value: 0.41844370194907604.
[I 2024-12-04 15:23:46,173] Trial 1496 finished with value: 0.7059039639040493 and parameters: {'n_estimators': 829, 'max_depth': 30, 'min_samples_split': 2, 'min_samples_leaf': 1, 'max_features': 'log2', 'bootstrap': True, 'criterion': 'squared_error'}. Best is trial 1025 with value: 0.41844370194907604.
[I 2024-12-04 15:23:47,216] Trial 1498 finished with value: 1.0513505978219548 and parameters: {'n_estimators': 699, 'max_depth': 48, 'min_samples_split': 7, 'min_samples_leaf': 6, 'max_features': 'log2', 'bootstrap': False, 'criterion': 'squared_error'}. Best is trial 1025 with value: 0.41844370194907604.
[I 2024-12-04 15:23:47,367] Trial 1482 finished with value: 0.4645571926237126 and parameters: {'n_estimators': 613, 'max_depth': 41, 'min_samples_split': 2, 'min_samples_leaf': 2, 'max_features': None, 'bootstrap': True, 'criterion': 'squared_error'}. Best is trial 1025 with value: 0.41844370194907604.
[I 2024-12-04 15:23:49,096] Trial 1485 finished with value: 0.731890824588691 and parameters: {'n_estimators': 672, 'max_depth': 24, 'min_samples_split': 33, 'min_samples_leaf': 10, 'max_features': None, 'bootstrap': False, 'criterion': 'absolute_error'}. Best is trial 1025 with value: 0.41844370194907604.
[I 2024-12-04 15:23:49,100] Trial 1495 finished with value: 0.5319203359661242 and parameters: {'n_estimators': 725, 'max_depth': 45, 'min_samples_split': 2, 'min_samples_leaf': 1, 'max_features': None, 'bootstrap': False, 'criterion': 'squared_error'}. Best is trial 1025 with value: 0.41844370194907604.
[I 2024-12-04 15:23:53,222] Trial 1488 finished with value: 0.43173741940711013 and parameters: {'n_estimators': 797, 'max_depth': 38, 'min_samples_split': 4, 'min_samples_leaf': 1, 'max_features': None, 'bootstrap': True, 'criterion': 'squared_error'}. Best is trial 1025 with value: 0.41844370194907604.
[I 2024-12-04 15:23:56,910] Trial 1494 finished with value: 0.7292958537826101 and parameters: {'n_estimators': 745, 'max_depth': 26, 'min_samples_split': 9, 'min_samples_leaf': 12, 'max_features': None, 'bootstrap': False, 'criterion': 'absolute_error'}. Best is trial 1025 with value: 0.41844370194907604.
[I 2024-12-04 15:23:58,573] Trial 1497 finished with value: 0.42270596578988123 and parameters: {'n_estimators': 654, 'max_depth': 35, 'min_samples_split': 2, 'min_samples_leaf': 1, 'max_features': None, 'bootstrap': True, 'criterion': 'squared_error'}. Best is trial 1025 with value: 0.41844370194907604.
[I 2024-12-04 15:23:59,543] Trial 1491 finished with value: 0.43132845623097704 and parameters: {'n_estimators': 822, 'max_depth': 39, 'min_samples_split': 4, 'min_samples_leaf': 1, 'max_features': None, 'bootstrap': True, 'criterion': 'squared_error'}. Best is trial 1025 with value: 0.41844370194907604.
[I 2024-12-04 15:24:02,967] Trial 1493 finished with value: 0.42014742660087384 and parameters: {'n_estimators': 878, 'max_depth': 38, 'min_samples_split': 2, 'min_samples_leaf': 1, 'max_features': None, 'bootstrap': True, 'criterion': 'squared_error'}. Best is trial 1025 with value: 0.41844370194907604.
[I 2024-12-04 15:24:03,340] Trial 1499 finished with value: 0.42114601794986023 and parameters: {'n_estimators': 867, 'max_depth': 42, 'min_samples_split': 2, 'min_samples_leaf': 1, 'max_features': None, 'bootstrap': True, 'criterion': 'squared_error'}. Best is trial 1025 with value: 0.41844370194907604.
[I 2024-12-04 15:24:03,353] Trial 1500 finished with value: 0.42125482963922156 and parameters: {'n_estimators': 811, 'max_depth': 45, 'min_samples_split': 2, 'min_samples_leaf': 1, 'max_features': None, 'bootstrap': True, 'criterion': 'squared_error'}. Best is trial 1025 with value: 0.41844370194907604.
[I 2024-12-04 15:24:03,823] Trial 1508 finished with value: 0.42473573497055894 and parameters: {'n_estimators': 617, 'max_depth': 41, 'min_samples_split': 3, 'min_samples_leaf': 1, 'max_features': None, 'bootstrap': True, 'criterion': 'squared_error'}. Best is trial 1025 with value: 0.41844370194907604.
[I 2024-12-04 15:24:03,824] Trial 1503 finished with value: 0.4213669640133991 and parameters: {'n_estimators': 611, 'max_depth': 43, 'min_samples_split': 2, 'min_samples_leaf': 1, 'max_features': None, 'bootstrap': True, 'criterion': 'squared_error'}. Best is trial 1025 with value: 0.41844370194907604.
[I 2024-12-04 15:24:04,706] Trial 1444 finished with value: 0.4308866262251273 and parameters: {'n_estimators': 768, 'max_depth': 39, 'min_samples_split': 2, 'min_samples_leaf': 1, 'max_features': None, 'bootstrap': True, 'criterion': 'absolute_error'}. Best is trial 1025 with value: 0.41844370194907604.
[I 2024-12-04 15:24:05,037] Trial 1509 finished with value: 0.7043326895414194 and parameters: {'n_estimators': 432, 'max_depth': 48, 'min_samples_split': 2, 'min_samples_leaf': 15, 'max_features': None, 'bootstrap': True, 'criterion': 'absolute_error'}. Best is trial 1025 with value: 0.41844370194907604.
[I 2024-12-04 15:24:06,345] Trial 1501 finished with value: 0.46532672279457726 and parameters: {'n_estimators': 819, 'max_depth': 31, 'min_samples_split': 2, 'min_samples_leaf': 2, 'max_features': None, 'bootstrap': True, 'criterion': 'squared_error'}. Best is trial 1025 with value: 0.41844370194907604.
[I 2024-12-04 15:24:07,972] Trial 1511 finished with value: 0.6986801461116043 and parameters: {'n_estimators': 618, 'max_depth': 47, 'min_samples_split': 26, 'min_samples_leaf': 1, 'max_features': 'log2', 'bootstrap': False, 'criterion': 'absolute_error'}. Best is trial 1025 with value: 0.41844370194907604.
