[I 2024-12-04 14:59:21,365] Trial 309 finished with value: 1.3007739123004562 and parameters: {'kernel_type': 'Matern', 'length_scale': 0.1882011138422761, 'noise_level': 0.0009856717529281185, 'constant_value': 42.27754043362238, 'nu': 1.5}. Best is trial 276 with value: 0.13435392997433446.
[I 2024-12-04 14:59:21,581] Trial 300 finished with value: 1.269363502852541 and parameters: {'kernel_type': 'Matern', 'length_scale': 0.025487011136792095, 'noise_level': 1.1293047029251018e-05, 'constant_value': 0.01356610575481875, 'nu': 0.5}. Best is trial 276 with value: 0.13435392997433446.
[I 2024-12-04 14:59:22,261] Trial 305 finished with value: 0.1343544176807714 and parameters: {'kernel_type': 'Matern', 'length_scale': 0.8567990991487616, 'noise_level': 8.577873717645228e-08, 'constant_value': 0.8784822580169432, 'nu': 1.5}. Best is trial 276 with value: 0.13435392997433446.
[I 2024-12-04 14:59:22,445] Trial 302 finished with value: 0.14859826944372861 and parameters: {'kernel_type': 'Matern', 'length_scale': 3.194417490288056, 'noise_level': 6.111226802200076e-06, 'constant_value': 86.70824054124982, 'nu': 2.5}. Best is trial 276 with value: 0.13435392997433446.
[I 2024-12-04 14:59:22,529] Trial 308 finished with value: 0.13435440545699281 and parameters: {'kernel_type': 'Matern', 'length_scale': 10.181984003392333, 'noise_level': 0.8598802325067894, 'constant_value': 142.53586697894042, 'nu': 1.5}. Best is trial 276 with value: 0.13435392997433446.
[I 2024-12-04 14:59:23,228] Trial 301 finished with value: 0.13435451686741137 and parameters: {'kernel_type': 'Matern', 'length_scale': 65.96412954192746, 'noise_level': 8.349908850585536e-10, 'constant_value': 160.83589308356196, 'nu': 1.5}. Best is trial 276 with value: 0.13435392997433446.
[I 2024-12-04 14:59:24,044] Trial 299 finished with value: 1.2693635028569124 and parameters: {'kernel_type': 'Matern', 'length_scale': 414.9969190154645, 'noise_level': 0.05975781025931048, 'constant_value': 0.017678559730269817, 'nu': 1.5}. Best is trial 276 with value: 0.13435392997433446.
[I 2024-12-04 14:59:24,045] Trial 307 finished with value: 0.134354704681521 and parameters: {'kernel_type': 'Matern', 'length_scale': 7.507316203459335, 'noise_level': 0.04072269847090819, 'constant_value': 79664.26291156604, 'nu': 1.5}. Best is trial 276 with value: 0.13435392997433446.
[I 2024-12-04 14:59:24,521] Trial 295 finished with value: 0.13435440814947558 and parameters: {'kernel_type': 'Matern', 'length_scale': 1.295396553149039, 'noise_level': 0.34561382669889457, 'constant_value': 42.972936174978216, 'nu': 1.5}. Best is trial 276 with value: 0.13435392997433446.
[I 2024-12-04 14:59:24,770] Trial 303 finished with value: 0.1343543984023352 and parameters: {'kernel_type': 'Matern', 'length_scale': 6.701713470585418, 'noise_level': 0.0003772653833095642, 'constant_value': 3643.139296517327, 'nu': 1.5}. Best is trial 276 with value: 0.13435392997433446.
[I 2024-12-04 14:59:25,112] Trial 306 finished with value: 1.300773892365193 and parameters: {'kernel_type': 'Matern', 'length_scale': 0.216631110950738, 'noise_level': 9.814642339285063e-06, 'constant_value': 1388.7161137347648, 'nu': 1.5}. Best is trial 276 with value: 0.13435392997433446.
[I 2024-12-04 14:59:27,600] Trial 314 finished with value: 0.13435440114851604 and parameters: {'kernel_type': 'Matern', 'length_scale': 0.30532091500449904, 'noise_level': 0.0007841965064060514, 'constant_value': 59.05835636605828, 'nu': 1.5}. Best is trial 276 with value: 0.13435392997433446.
[I 2024-12-04 14:59:28,137] Trial 312 finished with value: 0.1516729687539294 and parameters: {'kernel_type': 'RBF', 'length_scale': 2.291564305396833, 'noise_level': 0.00036990692737392963, 'constant_value': 1.169229055401641, 'nu': 1.5}. Best is trial 276 with value: 0.13435392997433446.
[I 2024-12-04 14:59:28,773] Trial 315 finished with value: 0.13435441773227608 and parameters: {'kernel_type': 'Matern', 'length_scale': 0.9618211720303693, 'noise_level': 0.002679322034562689, 'constant_value': 18759.656039768666, 'nu': 1.5}. Best is trial 276 with value: 0.13435392997433446.
[I 2024-12-04 14:59:31,291] Trial 317 finished with value: 0.13435440512344202 and parameters: {'kernel_type': 'Matern', 'length_scale': 9.7654446949445, 'noise_level': 0.013017861107326069, 'constant_value': 17.937139164787713, 'nu': 1.5}. Best is trial 276 with value: 0.13435392997433446.
[I 2024-12-04 14:59:33,475] Trial 316 finished with value: 0.13435433749229067 and parameters: {'kernel_type': 'Matern', 'length_scale': 0.773340702664986, 'noise_level': 0.0003536586382673174, 'constant_value': 362.3870702187148, 'nu': 1.5}. Best is trial 276 with value: 0.13435392997433446.
[I 2024-12-04 14:59:36,193] Trial 311 finished with value: 1.2693635028569137 and parameters: {'kernel_type': 'Matern', 'length_scale': 0.007620472660321607, 'noise_level': 0.09440990330567421, 'constant_value': 49646.73248299841, 'nu': 2.5}. Best is trial 276 with value: 0.13435392997433446.
[I 2024-12-04 14:59:36,657] Trial 318 finished with value: 0.13435442182390908 and parameters: {'kernel_type': 'Matern', 'length_scale': 25.99602711305154, 'noise_level': 0.11528766286610215, 'constant_value': 0.05277913840467538, 'nu': 1.5}. Best is trial 276 with value: 0.13435392997433446.
[I 2024-12-04 14:59:36,674] Trial 321 finished with value: 1.3007736822015958 and parameters: {'kernel_type': 'Matern', 'length_scale': 0.781910243953014, 'noise_level': 1.6342346252987844e-06, 'constant_value': 197.0793650566352, 'nu': 0.5}. Best is trial 276 with value: 0.13435392997433446.
[I 2024-12-04 14:59:37,070] Trial 313 finished with value: 0.13435437154724936 and parameters: {'kernel_type': 'Matern', 'length_scale': 8.410265839414276, 'noise_level': 0.38761851338469283, 'constant_value': 0.1269576006575957, 'nu': 1.5}. Best is trial 276 with value: 0.13435392997433446.
[I 2024-12-04 14:59:37,273] Trial 310 finished with value: 0.15167297526177992 and parameters: {'kernel_type': 'RBF', 'length_scale': 0.4649083372000038, 'noise_level': 7.740948903134452e-08, 'constant_value': 0.7833846523877807, 'nu': 1.5}. Best is trial 276 with value: 0.13435392997433446.
[I 2024-12-04 14:59:39,155] Trial 323 finished with value: 0.13435440415202746 and parameters: {'kernel_type': 'Matern', 'length_scale': 7.2633175255317886, 'noise_level': 9.043095829851212e-05, 'constant_value': 85859.48419299742, 'nu': 1.5}. Best is trial 276 with value: 0.13435392997433446.
[I 2024-12-04 14:59:39,899] Trial 326 finished with value: 0.13435439996629667 and parameters: {'kernel_type': 'Matern', 'length_scale': 5.975992875159356, 'noise_level': 0.01951966286342761, 'constant_value': 2471.323333662126, 'nu': 1.5}. Best is trial 276 with value: 0.13435392997433446.
[I 2024-12-04 14:59:40,493] Trial 320 finished with value: 1.269363502856971 and parameters: {'kernel_type': 'Matern', 'length_scale': 0.007800821070405351, 'noise_level': 0.370330788937638, 'constant_value': 37307.18955240084, 'nu': 1.5}. Best is trial 276 with value: 0.13435392997433446.
[I 2024-12-04 14:59:40,550] Trial 322 finished with value: 0.13435395282675777 and parameters: {'kernel_type': 'Matern', 'length_scale': 56.905731634266104, 'noise_level': 0.004761944001730759, 'constant_value': 862.2926040071025, 'nu': 1.5}. Best is trial 276 with value: 0.13435392997433446.
[I 2024-12-04 14:59:40,918] Trial 319 finished with value: 0.1343542857104797 and parameters: {'kernel_type': 'Matern', 'length_scale': 1.8262446052473598, 'noise_level': 0.00019989862526940356, 'constant_value': 911.424758963171, 'nu': 1.5}. Best is trial 276 with value: 0.13435392997433446.
[I 2024-12-04 14:59:41,037] Trial 304 finished with value: 0.13435450446942396 and parameters: {'kernel_type': 'Matern', 'length_scale': 39.61690543174607, 'noise_level': 0.35037000992898804, 'constant_value': 2.543510478074568, 'nu': 1.5}. Best is trial 276 with value: 0.13435392997433446.
[I 2024-12-04 14:59:43,431] Trial 328 finished with value: 1.269363502857502 and parameters: {'kernel_type': 'Matern', 'length_scale': 0.021263470724519708, 'noise_level': 1.0842976368815698e-07, 'constant_value': 1.3915111415826735, 'nu': 2.5}. Best is trial 276 with value: 0.13435392997433446.
[I 2024-12-04 14:59:47,075] Trial 334 finished with value: 1.300774597082982 and parameters: {'kernel_type': 'RBF', 'length_scale': 0.7269404905877087, 'noise_level': 4.963428197006259e-10, 'constant_value': 3563.6739636519796, 'nu': 1.5}. Best is trial 276 with value: 0.13435392997433446.
[I 2024-12-04 14:59:47,777] Trial 331 finished with value: 0.13435439806237712 and parameters: {'kernel_type': 'Matern', 'length_scale': 0.36399164091736574, 'noise_level': 0.00010048802124300728, 'constant_value': 43387.977093562025, 'nu': 1.5}. Best is trial 276 with value: 0.13435392997433446.
[I 2024-12-04 14:59:50,360] Trial 325 finished with value: 0.17251040111380977 and parameters: {'kernel_type': 'Matern', 'length_scale': 8.101574199852898, 'noise_level': 0.001494758479682465, 'constant_value': 6226.792965012453, 'nu': 0.5}. Best is trial 276 with value: 0.13435392997433446.
[I 2024-12-04 14:59:50,763] Trial 333 finished with value: 0.1343544104355037 and parameters: {'kernel_type': 'Matern', 'length_scale': 0.8462831378291729, 'noise_level': 0.001862493285116812, 'constant_value': 477.2935683372432, 'nu': 1.5}. Best is trial 276 with value: 0.13435392997433446.
[I 2024-12-04 14:59:51,352] Trial 329 finished with value: 0.13435439915139988 and parameters: {'kernel_type': 'Matern', 'length_scale': 5.58007718110116, 'noise_level': 0.0010346228308598339, 'constant_value': 21.460693599896718, 'nu': 1.5}. Best is trial 276 with value: 0.13435392997433446.
[I 2024-12-04 14:59:52,301] Trial 332 finished with value: 0.1343543994150767 and parameters: {'kernel_type': 'Matern', 'length_scale': 6.523361351884033, 'noise_level': 0.00014831527065545342, 'constant_value': 232.26838862197633, 'nu': 1.5}. Best is trial 276 with value: 0.13435392997433446.
[I 2024-12-04 14:59:57,464] Trial 336 finished with value: 0.1343543998431032 and parameters: {'kernel_type': 'Matern', 'length_scale': 103.0001620585302, 'noise_level': 0.0006219610325531228, 'constant_value': 16.84631329088032, 'nu': 1.5}. Best is trial 276 with value: 0.13435392997433446.
[I 2024-12-04 14:59:57,616] Trial 339 finished with value: 0.1343543874824337 and parameters: {'kernel_type': 'Matern', 'length_scale': 0.325937177990852, 'noise_level': 0.00019060263881799362, 'constant_value': 737.0962190323874, 'nu': 1.5}. Best is trial 276 with value: 0.13435392997433446.
[I 2024-12-04 14:59:58,610] Trial 327 finished with value: 0.13435456058228115 and parameters: {'kernel_type': 'Matern', 'length_scale': 1.1074400543771277, 'noise_level': 1.0084135279515857e-10, 'constant_value': 46.175211264206254, 'nu': 1.5}. Best is trial 276 with value: 0.13435392997433446.
[I 2024-12-04 14:59:59,679] Trial 343 finished with value: 0.13435443128439176 and parameters: {'kernel_type': 'Matern', 'length_scale': 24.626892358931784, 'noise_level': 2.7619953977899983e-05, 'constant_value': 1728.5930967031522, 'nu': 1.5}. Best is trial 276 with value: 0.13435392997433446.
[I 2024-12-04 14:59:59,714] Trial 330 finished with value: 0.13435440632713583 and parameters: {'kernel_type': 'Matern', 'length_scale': 5.114403769029294, 'noise_level': 7.289333740994076e-05, 'constant_value': 161.00055847206536, 'nu': 1.5}. Best is trial 276 with value: 0.13435392997433446.
[I 2024-12-04 15:00:00,410] Trial 337 finished with value: 0.1516729742240828 and parameters: {'kernel_type': 'RBF', 'length_scale': 7.217473760414962, 'noise_level': 0.7631164028334863, 'constant_value': 0.0015534027212282095, 'nu': 0.5}. Best is trial 276 with value: 0.13435392997433446.
[I 2024-12-04 15:00:00,888] Trial 342 finished with value: 0.13435440106256072 and parameters: {'kernel_type': 'Matern', 'length_scale': 487.22261838601173, 'noise_level': 3.3803164408268475e-05, 'constant_value': 33067.32799808488, 'nu': 1.5}. Best is trial 276 with value: 0.13435392997433446.
[I 2024-12-04 15:00:02,216] Trial 348 finished with value: 1.2693635028568606 and parameters: {'kernel_type': 'RBF', 'length_scale': 0.00012553849528958226, 'noise_level': 0.29338762697686716, 'constant_value': 82.42004028797611, 'nu': 2.5}. Best is trial 276 with value: 0.13435392997433446.
[I 2024-12-04 15:00:03,949] Trial 345 finished with value: 0.17251040263713763 and parameters: {'kernel_type': 'Matern', 'length_scale': 14.313452766506417, 'noise_level': 0.12907211589583473, 'constant_value': 20.616858029336356, 'nu': 0.5}. Best is trial 276 with value: 0.13435392997433446.
[I 2024-12-04 15:00:03,971] Trial 335 finished with value: 0.13435416919228627 and parameters: {'kernel_type': 'Matern', 'length_scale': 0.9082179043885432, 'noise_level': 0.0026261497957694537, 'constant_value': 83333.57610527586, 'nu': 1.5}. Best is trial 276 with value: 0.13435392997433446.
[I 2024-12-04 15:00:06,143] Trial 338 finished with value: 0.17251040268757006 and parameters: {'kernel_type': 'Matern', 'length_scale': 12.483219759641072, 'noise_level': 0.39554700500005746, 'constant_value': 0.00024356936162321438, 'nu': 0.5}. Best is trial 276 with value: 0.13435392997433446.
[I 2024-12-04 15:00:07,144] Trial 352 finished with value: 0.1343543814576291 and parameters: {'kernel_type': 'Matern', 'length_scale': 0.5044783697102438, 'noise_level': 0.5357183576975557, 'constant_value': 96709.43283735862, 'nu': 1.5}. Best is trial 276 with value: 0.13435392997433446.
[I 2024-12-04 15:00:07,588] Trial 355 finished with value: 0.1343543554519453 and parameters: {'kernel_type': 'Matern', 'length_scale': 0.6492873393229378, 'noise_level': 0.0006321634207807907, 'constant_value': 1355.1562685089898, 'nu': 1.5}. Best is trial 276 with value: 0.13435392997433446.
[I 2024-12-04 15:00:08,720] Trial 346 finished with value: 1.2693635028573742 and parameters: {'kernel_type': 'Matern', 'length_scale': 5345.634213494733, 'noise_level': 1.1191529042272725e-09, 'constant_value': 96332.11540664831, 'nu': 1.5}. Best is trial 276 with value: 0.13435392997433446.
[I 2024-12-04 15:00:08,776] Trial 356 finished with value: 0.13435441465128295 and parameters: {'kernel_type': 'Matern', 'length_scale': 5.411745820052349, 'noise_level': 0.0036501983102871704, 'constant_value': 27067.45174240105, 'nu': 1.5}. Best is trial 276 with value: 0.13435392997433446.
[I 2024-12-04 15:00:09,576] Trial 350 finished with value: 0.13435439926926904 and parameters: {'kernel_type': 'Matern', 'length_scale': 143.2923475398086, 'noise_level': 2.431661055046246e-09, 'constant_value': 4770.004776614655, 'nu': 1.5}. Best is trial 276 with value: 0.13435392997433446.
[I 2024-12-04 15:00:10,049] Trial 340 finished with value: 0.15167296890787807 and parameters: {'kernel_type': 'RBF', 'length_scale': 636.0567251974841, 'noise_level': 0.0010158497264595406, 'constant_value': 1804.1235064492412, 'nu': 1.5}. Best is trial 276 with value: 0.13435392997433446.
[I 2024-12-04 15:00:12,021] Trial 358 finished with value: 1.2693635028569745 and parameters: {'kernel_type': 'Matern', 'length_scale': 259.7075445011263, 'noise_level': 5.971205029248732e-06, 'constant_value': 42.32720924082005, 'nu': 1.5}. Best is trial 276 with value: 0.13435392997433446.
[I 2024-12-04 15:00:13,143] Trial 341 finished with value: 1.2693635028572121 and parameters: {'kernel_type': 'RBF', 'length_scale': 7.095507204278736e-05, 'noise_level': 0.0003825519578660979, 'constant_value': 3.7813832244751146e-07, 'nu': 0.5}. Best is trial 276 with value: 0.13435392997433446.
[I 2024-12-04 15:00:14,760] Trial 344 finished with value: 0.13435429226519793 and parameters: {'kernel_type': 'Matern', 'length_scale': 0.23297158764484022, 'noise_level': 0.003718510915864207, 'constant_value': 76.93404407960173, 'nu': 1.5}. Best is trial 276 with value: 0.13435392997433446.
[I 2024-12-04 15:00:16,137] Trial 349 finished with value: 0.13435438912156403 and parameters: {'kernel_type': 'Matern', 'length_scale': 12.36873334902716, 'noise_level': 0.0021596075626868446, 'constant_value': 470.40384848351965, 'nu': 1.5}. Best is trial 276 with value: 0.13435392997433446.
[I 2024-12-04 15:00:17,026] Trial 351 finished with value: 0.14859827028488284 and parameters: {'kernel_type': 'Matern', 'length_scale': 7.238476595055329, 'noise_level': 0.5206083212395993, 'constant_value': 162.3662551839138, 'nu': 2.5}. Best is trial 276 with value: 0.13435392997433446.
[I 2024-12-04 15:00:20,092] Trial 324 finished with value: 0.1725104026783494 and parameters: {'kernel_type': 'Matern', 'length_scale': 0.11572954389592617, 'noise_level': 0.7910719838049158, 'constant_value': 0.004979981875942376, 'nu': 0.5}. Best is trial 276 with value: 0.13435392997433446.
[I 2024-12-04 15:00:20,429] Trial 360 finished with value: 0.13435447558233543 and parameters: {'kernel_type': 'Matern', 'length_scale': 0.688050696101852, 'noise_level': 0.06664397097506727, 'constant_value': 77056.6468154463, 'nu': 1.5}. Best is trial 276 with value: 0.13435392997433446.
[I 2024-12-04 15:00:23,667] Trial 362 finished with value: 0.1343543078814258 and parameters: {'kernel_type': 'Matern', 'length_scale': 0.47286053007948964, 'noise_level': 0.009148478977721539, 'constant_value': 86.38032950394977, 'nu': 1.5}. Best is trial 276 with value: 0.13435392997433446.
[I 2024-12-04 15:00:23,672] Trial 354 finished with value: 0.15167298648022512 and parameters: {'kernel_type': 'RBF', 'length_scale': 0.7803670665083314, 'noise_level': 0.011923101712361436, 'constant_value': 24685.33227072009, 'nu': 1.5}. Best is trial 276 with value: 0.13435392997433446.
[I 2024-12-04 15:00:23,783] Trial 347 finished with value: 1.269363502856912 and parameters: {'kernel_type': 'Matern', 'length_scale': 1842.1692128819338, 'noise_level': 0.011855275977902105, 'constant_value': 0.20635529320579313, 'nu': 1.5}. Best is trial 276 with value: 0.13435392997433446.
[I 2024-12-04 15:00:25,791] Trial 353 finished with value: 1.269363493289299 and parameters: {'kernel_type': 'Matern', 'length_scale': 0.08139304643851009, 'noise_level': 0.00043441816123310933, 'constant_value': 38809.11914348563, 'nu': 1.5}. Best is trial 276 with value: 0.13435392997433446.
[I 2024-12-04 15:00:26,753] Trial 357 finished with value: 0.13435441150296604 and parameters: {'kernel_type': 'Matern', 'length_scale': 0.20158676815884233, 'noise_level': 0.02105429593039412, 'constant_value': 23683.21742012195, 'nu': 1.5}. Best is trial 276 with value: 0.13435392997433446.
[I 2024-12-04 15:00:28,395] Trial 369 finished with value: 0.13435439928514972 and parameters: {'kernel_type': 'Matern', 'length_scale': 27.014082328926502, 'noise_level': 0.003935786541138916, 'constant_value': 180.41546027718215, 'nu': 1.5}. Best is trial 276 with value: 0.13435392997433446.
[I 2024-12-04 15:00:28,424] Trial 364 finished with value: 0.13435440535857732 and parameters: {'kernel_type': 'Matern', 'length_scale': 34.14997088496869, 'noise_level': 0.0008095817889701535, 'constant_value': 80041.01368146011, 'nu': 1.5}. Best is trial 276 with value: 0.13435392997433446.
[I 2024-12-04 15:00:29,113] Trial 363 finished with value: 0.1343543975944532 and parameters: {'kernel_type': 'Matern', 'length_scale': 2.1159503722169624, 'noise_level': 0.00048249626561758414, 'constant_value': 18608.145008025942, 'nu': 1.5}. Best is trial 276 with value: 0.13435392997433446.
[I 2024-12-04 15:00:29,411] Trial 365 finished with value: 0.13435439574222002 and parameters: {'kernel_type': 'Matern', 'length_scale': 1.02157049547967, 'noise_level': 0.2377484846933026, 'constant_value': 87722.83627008267, 'nu': 1.5}. Best is trial 276 with value: 0.13435392997433446.
[I 2024-12-04 15:00:30,487] Trial 367 finished with value: 1.2693635028568893 and parameters: {'kernel_type': 'Matern', 'length_scale': 0.01350473410605649, 'noise_level': 0.4301726397151083, 'constant_value': 20.53529422744944, 'nu': 1.5}. Best is trial 276 with value: 0.13435392997433446.
[I 2024-12-04 15:00:31,710] Trial 370 finished with value: 1.269363423058638 and parameters: {'kernel_type': 'Matern', 'length_scale': 0.10545838037592939, 'noise_level': 0.0006058742787157335, 'constant_value': 584.7434296867768, 'nu': 2.5}. Best is trial 276 with value: 0.13435392997433446.
[I 2024-12-04 15:00:33,259] Trial 375 finished with value: 0.13435433509980646 and parameters: {'kernel_type': 'Matern', 'length_scale': 63.00576327420685, 'noise_level': 3.1544268925521916e-07, 'constant_value': 234.13777477216067, 'nu': 1.5}. Best is trial 276 with value: 0.13435392997433446.
[I 2024-12-04 15:00:33,839] Trial 366 finished with value: 0.13435440086155317 and parameters: {'kernel_type': 'Matern', 'length_scale': 7.354729537761251, 'noise_level': 0.013942680215092158, 'constant_value': 54.89830864242471, 'nu': 1.5}. Best is trial 276 with value: 0.13435392997433446.
[I 2024-12-04 15:00:34,297] Trial 359 finished with value: 0.1343543994548277 and parameters: {'kernel_type': 'Matern', 'length_scale': 0.2814974788001244, 'noise_level': 0.0007165667337901347, 'constant_value': 62966.94210474373, 'nu': 1.5}. Best is trial 276 with value: 0.13435392997433446.
[I 2024-12-04 15:00:35,759] Trial 377 finished with value: 1.269363502851402 and parameters: {'kernel_type': 'Matern', 'length_scale': 0.00017526147477001517, 'noise_level': 6.196726107330457e-10, 'constant_value': 0.11106218421664728, 'nu': 1.5}. Best is trial 276 with value: 0.13435392997433446.
[I 2024-12-04 15:00:37,470] Trial 376 finished with value: 1.2693633101043436 and parameters: {'kernel_type': 'Matern', 'length_scale': 0.09555935481510931, 'noise_level': 0.014700298160389223, 'constant_value': 1634.1223913735419, 'nu': 1.5}. Best is trial 276 with value: 0.13435392997433446.
