[I 2024-12-03 18:51:20,436] Trial 2124 finished with value: 1.2994640238043824 and parameters: {'kernel': 'rbf', 'C': 0.030557715638201498, 'gamma': 0.0003922522908763904, 'epsilon': 0.5780016834173142}. Best is trial 1119 with value: 0.4485361816812923.
[I 2024-12-03 18:51:20,604] Trial 2138 finished with value: 0.6301470803076685 and parameters: {'kernel': 'rbf', 'C': 93.38590880694368, 'gamma': 0.054775425554894376, 'epsilon': 0.16241099565893555}. Best is trial 1119 with value: 0.4485361816812923.
[I 2024-12-03 18:51:20,868] Trial 2129 finished with value: 0.48701076374484814 and parameters: {'kernel': 'rbf', 'C': 18.883745227571954, 'gamma': 0.017537379289321905, 'epsilon': 0.08594182846626028}. Best is trial 1119 with value: 0.4485361816812923.
[I 2024-12-03 18:51:20,871] Trial 2153 finished with value: 27.058475998730174 and parameters: {'kernel': 'sigmoid', 'C': 25.158004904076186, 'gamma': 0.009103912774170693, 'epsilon': 0.32419742258491346}. Best is trial 1119 with value: 0.4485361816812923.
[I 2024-12-03 18:51:21,489] Trial 2135 finished with value: 0.4904843670914245 and parameters: {'kernel': 'rbf', 'C': 97.72211774879555, 'gamma': 0.02460840712541596, 'epsilon': 0.057128285074980044}. Best is trial 1119 with value: 0.4485361816812923.
[I 2024-12-03 18:51:21,661] Trial 2145 finished with value: 0.4584802467307099 and parameters: {'kernel': 'rbf', 'C': 96.79527639757198, 'gamma': 0.01483584436767123, 'epsilon': 0.028351149537819066}. Best is trial 1119 with value: 0.4485361816812923.
[I 2024-12-03 18:51:21,662] Trial 2151 finished with value: 0.46718584086965037 and parameters: {'kernel': 'rbf', 'C': 23.350631846712762, 'gamma': 0.023850272208816407, 'epsilon': 0.024229830633208632}. Best is trial 1119 with value: 0.4485361816812923.
[I 2024-12-03 18:51:21,786] Trial 2149 finished with value: 0.5144058426448149 and parameters: {'kernel': 'rbf', 'C': 19.911215517299787, 'gamma': 0.04919399854981035, 'epsilon': 0.10819872595603909}. Best is trial 1119 with value: 0.4485361816812923.
[I 2024-12-03 18:51:21,955] Trial 2143 finished with value: 0.5409603126560869 and parameters: {'kernel': 'rbf', 'C': 17.417694077225327, 'gamma': 0.017074364894874818, 'epsilon': 0.49461101159123694}. Best is trial 1119 with value: 0.4485361816812923.
[I 2024-12-03 18:51:21,956] Trial 2147 finished with value: 0.6980285843313985 and parameters: {'kernel': 'rbf', 'C': 21.91680523114181, 'gamma': 0.001252474564734272, 'epsilon': 0.08745898065397253}. Best is trial 1119 with value: 0.4485361816812923.
[I 2024-12-03 18:51:22,018] Trial 2144 finished with value: 0.5724879799660689 and parameters: {'kernel': 'rbf', 'C': 20.133653363593787, 'gamma': 0.004410822410144668, 'epsilon': 0.05873903516749092}. Best is trial 1119 with value: 0.4485361816812923.
[I 2024-12-03 18:51:22,019] Trial 2152 finished with value: 0.5883358387561864 and parameters: {'kernel': 'rbf', 'C': 18.281714515249863, 'gamma': 0.0034645727755242637, 'epsilon': 0.19805697755534238}. Best is trial 1119 with value: 0.4485361816812923.
[I 2024-12-03 18:51:22,371] Trial 2148 finished with value: 0.5434802716330074 and parameters: {'kernel': 'rbf', 'C': 90.32244279748902, 'gamma': 0.0031905057844040055, 'epsilon': 0.019972290453506045}. Best is trial 1119 with value: 0.4485361816812923.
[I 2024-12-03 18:51:23,161] Trial 2142 finished with value: 0.4670491966073075 and parameters: {'kernel': 'rbf', 'C': 18.981307484590896, 'gamma': 0.027094938260675435, 'epsilon': 0.04631497567452875}. Best is trial 1119 with value: 0.4485361816812923.
[I 2024-12-03 18:51:23,898] Trial 2146 finished with value: 7.063042187908062 and parameters: {'kernel': 'sigmoid', 'C': 0.6472099936726566, 'gamma': 0.7057707028136901, 'epsilon': 0.0016615363815369732}. Best is trial 1119 with value: 0.4485361816812923.
[I 2024-12-03 18:51:23,899] Trial 2154 finished with value: 0.4784517721157505 and parameters: {'kernel': 'rbf', 'C': 99.9323789840662, 'gamma': 0.007382386552278666, 'epsilon': 0.05885104075442028}. Best is trial 1119 with value: 0.4485361816812923.
[I 2024-12-03 18:51:26,543] Trial 2159 finished with value: 0.5563028193480324 and parameters: {'kernel': 'rbf', 'C': 3.4784726726078294, 'gamma': 0.034013479018514176, 'epsilon': 0.13711777365059644}. Best is trial 1119 with value: 0.4485361816812923.
[I 2024-12-03 18:51:26,643] Trial 2162 finished with value: 0.4640613725595659 and parameters: {'kernel': 'rbf', 'C': 22.798889608322874, 'gamma': 0.021688301259921848, 'epsilon': 0.11984158309282644}. Best is trial 1119 with value: 0.4485361816812923.
[I 2024-12-03 18:51:26,851] Trial 2140 finished with value: 0.5824861771303965 and parameters: {'kernel': 'rbf', 'C': 21.017847056600687, 'gamma': 0.003604102312667255, 'epsilon': 0.019219604188813966}. Best is trial 1119 with value: 0.4485361816812923.
[I 2024-12-03 18:51:27,055] Trial 2156 finished with value: 0.6092393620177319 and parameters: {'kernel': 'rbf', 'C': 26.012174065820293, 'gamma': 0.17949711185319625, 'epsilon': 0.04432035153004191}. Best is trial 1119 with value: 0.4485361816812923.
[I 2024-12-03 18:51:27,409] Trial 2161 finished with value: 0.7843429739006338 and parameters: {'kernel': 'linear', 'C': 0.009423924321293495, 'gamma': 0.5936725532500785, 'epsilon': 0.04652488426995725}. Best is trial 1119 with value: 0.4485361816812923.
[I 2024-12-03 18:51:28,286] Trial 2155 finished with value: 0.5670725413603002 and parameters: {'kernel': 'rbf', 'C': 95.77625431173823, 'gamma': 0.03660962762196673, 'epsilon': 0.06311340493211225}. Best is trial 1119 with value: 0.4485361816812923.
[I 2024-12-03 18:51:28,515] Trial 2168 finished with value: 0.5528543778704041 and parameters: {'kernel': 'rbf', 'C': 24.082339112755868, 'gamma': 0.005629781037033181, 'epsilon': 0.10257117915787643}. Best is trial 1119 with value: 0.4485361816812923.
[I 2024-12-03 18:51:29,618] Trial 2169 finished with value: 0.474317596793839 and parameters: {'kernel': 'rbf', 'C': 91.70917739633249, 'gamma': 0.00892087810490759, 'epsilon': 0.01964864595738847}. Best is trial 1119 with value: 0.4485361816812923.
[I 2024-12-03 18:51:30,469] Trial 2158 finished with value: 0.8117274166543382 and parameters: {'kernel': 'sigmoid', 'C': 42.13891051387184, 'gamma': 0.00011184082401045717, 'epsilon': 0.012682501218637484}. Best is trial 1119 with value: 0.4485361816812923.
[I 2024-12-03 18:51:30,858] Trial 2177 finished with value: 0.49351128856234805 and parameters: {'kernel': 'rbf', 'C': 18.585118792224588, 'gamma': 0.01596139926954719, 'epsilon': 0.15720852048045286}. Best is trial 1119 with value: 0.4485361816812923.
[I 2024-12-03 18:51:30,961] Trial 2170 finished with value: 0.4937285875858634 and parameters: {'kernel': 'rbf', 'C': 96.85640677084965, 'gamma': 0.005688146942305893, 'epsilon': 0.044639697396668274}. Best is trial 1119 with value: 0.4485361816812923.
[I 2024-12-03 18:51:31,042] Trial 2164 finished with value: 0.48253994535349237 and parameters: {'kernel': 'rbf', 'C': 22.447859166845525, 'gamma': 0.015582802002229407, 'epsilon': 0.158059486147319}. Best is trial 1119 with value: 0.4485361816812923.
[I 2024-12-03 18:51:31,043] Trial 2157 finished with value: 1.3690976279859621 and parameters: {'kernel': 'rbf', 'C': 0.011049547607510828, 'gamma': 0.00027150708087937914, 'epsilon': 0.008979768196221575}. Best is trial 1119 with value: 0.4485361816812923.
[I 2024-12-03 18:51:31,804] Trial 2160 finished with value: 1.368141810076859 and parameters: {'kernel': 'poly', 'C': 0.24070217445660572, 'gamma': 0.00012487884493185748, 'epsilon': 0.04403508409378892}. Best is trial 1119 with value: 0.4485361816812923.
[I 2024-12-03 18:51:32,281] Trial 2178 finished with value: 0.46333505115741225 and parameters: {'kernel': 'rbf', 'C': 23.255965460793274, 'gamma': 0.02318414654841436, 'epsilon': 0.046816703178993335}. Best is trial 1119 with value: 0.4485361816812923.
[I 2024-12-03 18:51:32,662] Trial 2165 finished with value: 0.5674537563753222 and parameters: {'kernel': 'linear', 'C': 6.578992155690937, 'gamma': 0.011801101936028742, 'epsilon': 0.04571874733728958}. Best is trial 1119 with value: 0.4485361816812923.
[I 2024-12-03 18:51:32,949] Trial 2175 finished with value: 0.5777221918061627 and parameters: {'kernel': 'rbf', 'C': 25.311799196854132, 'gamma': 0.0032470651869284627, 'epsilon': 0.14635996862051665}. Best is trial 1119 with value: 0.4485361816812923.
[I 2024-12-03 18:51:33,061] Trial 2150 finished with value: 0.4959390603823408 and parameters: {'kernel': 'rbf', 'C': 95.64066308210286, 'gamma': 0.018359709935260426, 'epsilon': 0.14895957071573737}. Best is trial 1119 with value: 0.4485361816812923.
[I 2024-12-03 18:51:33,235] Trial 2167 finished with value: 0.49420517018764465 and parameters: {'kernel': 'rbf', 'C': 26.639161348142697, 'gamma': 0.01232817874906644, 'epsilon': 0.06489451233068169}. Best is trial 1119 with value: 0.4485361816812923.
[I 2024-12-03 18:51:33,622] Trial 2176 finished with value: 0.5023789085192976 and parameters: {'kernel': 'rbf', 'C': 26.138940140942346, 'gamma': 0.04601808492974801, 'epsilon': 0.05299610157935038}. Best is trial 1119 with value: 0.4485361816812923.
[I 2024-12-03 18:51:33,841] Trial 2163 finished with value: 0.6431274614748189 and parameters: {'kernel': 'rbf', 'C': 21.396480564205923, 'gamma': 0.0020374754969880735, 'epsilon': 0.07396052250403914}. Best is trial 1119 with value: 0.4485361816812923.
[I 2024-12-03 18:51:33,843] Trial 2172 finished with value: 0.6616989205981422 and parameters: {'kernel': 'rbf', 'C': 3.3297059772619804, 'gamma': 0.009059653965814738, 'epsilon': 0.21666289234661082}. Best is trial 1119 with value: 0.4485361816812923.
[I 2024-12-03 18:51:33,848] Trial 2171 finished with value: 0.6633063233891822 and parameters: {'kernel': 'linear', 'C': 0.07312669753352309, 'gamma': 0.03927886841296367, 'epsilon': 0.005196108703975208}. Best is trial 1119 with value: 0.4485361816812923.
[I 2024-12-03 18:51:34,258] Trial 2173 finished with value: 1.3736525258183925 and parameters: {'kernel': 'poly', 'C': 15.18609346698903, 'gamma': 0.0001000180370185171, 'epsilon': 0.008658890413349305}. Best is trial 1119 with value: 0.4485361816812923.
[I 2024-12-03 18:51:34,293] Trial 2179 finished with value: 0.7548278566545226 and parameters: {'kernel': 'rbf', 'C': 3.921371556279013, 'gamma': 0.003735339472808168, 'epsilon': 0.0313642474057734}. Best is trial 1119 with value: 0.4485361816812923.
[I 2024-12-03 18:51:34,823] Trial 2174 finished with value: 0.46518385507695925 and parameters: {'kernel': 'rbf', 'C': 91.17216715047672, 'gamma': 0.009088333721731056, 'epsilon': 0.08884018868269719}. Best is trial 1119 with value: 0.4485361816812923.
[I 2024-12-03 18:51:34,825] Trial 2166 finished with value: 1.3718994271031113 and parameters: {'kernel': 'poly', 'C': 0.0014946465695784006, 'gamma': 0.00011244781610175923, 'epsilon': 0.018165243101771762}. Best is trial 1119 with value: 0.4485361816812923.
[I 2024-12-03 18:51:34,829] Trial 2184 finished with value: 0.532258313485347 and parameters: {'kernel': 'rbf', 'C': 20.344923345528922, 'gamma': 0.009700841788919678, 'epsilon': 0.02223732618282648}. Best is trial 1119 with value: 0.4485361816812923.
[I 2024-12-03 18:51:35,904] Trial 2182 finished with value: 0.5735784600587477 and parameters: {'kernel': 'rbf', 'C': 81.28773297334169, 'gamma': 0.0015609245638235861, 'epsilon': 0.10013616306134583}. Best is trial 1119 with value: 0.4485361816812923.
[I 2024-12-03 18:51:36,271] Trial 2180 finished with value: 0.4837358164160526 and parameters: {'kernel': 'rbf', 'C': 23.77103699322703, 'gamma': 0.015143653719998248, 'epsilon': 0.06451745430648498}. Best is trial 1119 with value: 0.4485361816812923.
[I 2024-12-03 18:51:37,894] Trial 2183 finished with value: 0.4606646681731362 and parameters: {'kernel': 'rbf', 'C': 96.07468227400334, 'gamma': 0.0167336158351326, 'epsilon': 0.022423110678213638}. Best is trial 1119 with value: 0.4485361816812923.
[I 2024-12-03 18:51:38,035] Trial 2181 finished with value: 0.4699389611181291 and parameters: {'kernel': 'rbf', 'C': 97.64228589805599, 'gamma': 0.020709957902921104, 'epsilon': 0.0230568250169883}. Best is trial 1119 with value: 0.4485361816812923.
[I 2024-12-03 18:51:38,092] Trial 2191 finished with value: 0.4770166909864099 and parameters: {'kernel': 'rbf', 'C': 97.54965894412835, 'gamma': 0.007610410271004807, 'epsilon': 0.08295112362583602}. Best is trial 1119 with value: 0.4485361816812923.
[I 2024-12-03 18:51:38,120] Trial 2188 finished with value: 0.4991885831694685 and parameters: {'kernel': 'rbf', 'C': 87.12269110438467, 'gamma': 0.005299092221345685, 'epsilon': 0.05486328241788765}. Best is trial 1119 with value: 0.4485361816812923.
[I 2024-12-03 18:51:38,772] Trial 2186 finished with value: 0.6396635037432655 and parameters: {'kernel': 'rbf', 'C': 96.96378646755319, 'gamma': 0.08169880136144926, 'epsilon': 0.01601947221836877}. Best is trial 1119 with value: 0.4485361816812923.
[I 2024-12-03 18:51:39,078] Trial 2187 finished with value: 0.5635950903300839 and parameters: {'kernel': 'rbf', 'C': 20.07361550365833, 'gamma': 0.07402974177672368, 'epsilon': 0.018485659778667257}. Best is trial 1119 with value: 0.4485361816812923.
[I 2024-12-03 18:51:39,136] Trial 2192 finished with value: 1.314038175612867 and parameters: {'kernel': 'poly', 'C': 4.228064464739195, 'gamma': 0.00047003715661198805, 'epsilon': 0.5978549735546785}. Best is trial 1119 with value: 0.4485361816812923.
[I 2024-12-03 18:51:39,471] Trial 2194 finished with value: 0.7742187101644694 and parameters: {'kernel': 'poly', 'C': 14.702112512976196, 'gamma': 0.05524766222539398, 'epsilon': 0.0819491967636043}. Best is trial 1119 with value: 0.4485361816812923.
[I 2024-12-03 18:51:39,698] Trial 2193 finished with value: 0.4632814942545131 and parameters: {'kernel': 'rbf', 'C': 27.890162859399673, 'gamma': 0.019104339149754464, 'epsilon': 0.10197704051579792}. Best is trial 1119 with value: 0.4485361816812923.
[I 2024-12-03 18:51:40,511] Trial 2201 finished with value: 0.5008953597902686 and parameters: {'kernel': 'rbf', 'C': 98.1898605825881, 'gamma': 0.021190175012285976, 'epsilon': 0.11443617459416756}. Best is trial 1119 with value: 0.4485361816812923.
[I 2024-12-03 18:51:40,795] Trial 2195 finished with value: 0.4808342572424304 and parameters: {'kernel': 'rbf', 'C': 95.55424862642361, 'gamma': 0.013800484625587837, 'epsilon': 0.18627298065310435}. Best is trial 1119 with value: 0.4485361816812923.
[I 2024-12-03 18:51:40,956] Trial 2189 finished with value: 0.5441080019029524 and parameters: {'kernel': 'rbf', 'C': 89.67690517183584, 'gamma': 0.0030377196077006285, 'epsilon': 0.04331157081975226}. Best is trial 1119 with value: 0.4485361816812923.
[I 2024-12-03 18:51:41,938] Trial 2199 finished with value: 0.5081287224310447 and parameters: {'kernel': 'rbf', 'C': 94.92620911143251, 'gamma': 0.0044364539195206635, 'epsilon': 0.08842707254672184}. Best is trial 1119 with value: 0.4485361816812923.
[I 2024-12-03 18:51:41,939] Trial 2204 finished with value: 0.47101384748941283 and parameters: {'kernel': 'rbf', 'C': 19.33102014983265, 'gamma': 0.028286958019284086, 'epsilon': 0.06266072047666522}. Best is trial 1119 with value: 0.4485361816812923.
[I 2024-12-03 18:51:42,026] Trial 2202 finished with value: 0.5345130705760383 and parameters: {'kernel': 'rbf', 'C': 87.62989542834057, 'gamma': 0.0036213900852854397, 'epsilon': 0.10199065350389903}. Best is trial 1119 with value: 0.4485361816812923.
[I 2024-12-03 18:51:42,214] Trial 2203 finished with value: 0.6200408097314175 and parameters: {'kernel': 'rbf', 'C': 90.89343376636181, 'gamma': 0.0682920305432301, 'epsilon': 0.13788374985051338}. Best is trial 1119 with value: 0.4485361816812923.
[I 2024-12-03 18:51:42,835] Trial 2206 finished with value: 0.5664347103570803 and parameters: {'kernel': 'rbf', 'C': 83.64518232100015, 'gamma': 0.0031220857488992726, 'epsilon': 0.2437140292335606}. Best is trial 1119 with value: 0.4485361816812923.
[I 2024-12-03 18:51:42,940] Trial 2190 finished with value: 0.5260648476770406 and parameters: {'kernel': 'rbf', 'C': 98.8226184720693, 'gamma': 0.0035387813873646373, 'epsilon': 0.052849809061374736}. Best is trial 1119 with value: 0.4485361816812923.
[I 2024-12-03 18:51:44,200] Trial 2207 finished with value: 0.569039954458807 and parameters: {'kernel': 'linear', 'C': 63.861011477189514, 'gamma': 0.3158452961831304, 'epsilon': 0.10308019004134786}. Best is trial 1119 with value: 0.4485361816812923.
[I 2024-12-03 18:51:44,614] Trial 2185 finished with value: 0.5980369201673464 and parameters: {'kernel': 'rbf', 'C': 99.21084190104321, 'gamma': 0.045351371377044175, 'epsilon': 0.07108450815435625}. Best is trial 1119 with value: 0.4485361816812923.
[I 2024-12-03 18:51:44,639] Trial 2198 finished with value: 0.46373737164276174 and parameters: {'kernel': 'rbf', 'C': 30.271356008619787, 'gamma': 0.017409597567131892, 'epsilon': 0.043885075154801854}. Best is trial 1119 with value: 0.4485361816812923.
[I 2024-12-03 18:51:44,757] Trial 2197 finished with value: 0.5317464405899531 and parameters: {'kernel': 'rbf', 'C': 98.45912821843272, 'gamma': 0.028493760423095666, 'epsilon': 0.07910040020627498}. Best is trial 1119 with value: 0.4485361816812923.
[I 2024-12-03 18:51:45,223] Trial 2210 finished with value: 0.5498585076327916 and parameters: {'kernel': 'rbf', 'C': 26.829881284837693, 'gamma': 0.008408751457352022, 'epsilon': 0.29996234576838987}. Best is trial 1119 with value: 0.4485361816812923.
[I 2024-12-03 18:51:45,224] Trial 2196 finished with value: 0.4897116347147714 and parameters: {'kernel': 'rbf', 'C': 24.983160766766463, 'gamma': 0.013566411258393174, 'epsilon': 0.06527845247293634}. Best is trial 1119 with value: 0.4485361816812923.
[I 2024-12-03 18:51:45,567] Trial 2200 finished with value: 0.5600752501618854 and parameters: {'kernel': 'linear', 'C': 19.024696751682693, 'gamma': 0.010592484809479842, 'epsilon': 0.025803603051873663}. Best is trial 1119 with value: 0.4485361816812923.
[I 2024-12-03 18:51:46,285] Trial 2208 finished with value: 0.5873866695936609 and parameters: {'kernel': 'linear', 'C': 0.4073729198733131, 'gamma': 0.002932476079372612, 'epsilon': 0.1290464942943429}. Best is trial 1119 with value: 0.4485361816812923.
[I 2024-12-03 18:51:46,595] Trial 2211 finished with value: 0.4860001702541378 and parameters: {'kernel': 'rbf', 'C': 18.627596934369564, 'gamma': 0.025943535854615993, 'epsilon': 0.2144836163504528}. Best is trial 1119 with value: 0.4485361816812923.
[I 2024-12-03 18:51:46,609] Trial 2209 finished with value: 0.5195066071719099 and parameters: {'kernel': 'rbf', 'C': 20.704693751588216, 'gamma': 0.011069299635230864, 'epsilon': 0.0396615826187609}. Best is trial 1119 with value: 0.4485361816812923.
[I 2024-12-03 18:51:46,674] Trial 2215 finished with value: 0.5642000657530064 and parameters: {'kernel': 'rbf', 'C': 4.423086535433421, 'gamma': 0.01945019098943582, 'epsilon': 0.031341779064794496}. Best is trial 1119 with value: 0.4485361816812923.
[I 2024-12-03 18:51:46,867] Trial 2212 finished with value: 0.6060296584273911 and parameters: {'kernel': 'rbf', 'C': 23.921171802900794, 'gamma': 0.0024688331898738486, 'epsilon': 0.026884362931868938}. Best is trial 1119 with value: 0.4485361816812923.
[I 2024-12-03 18:51:46,868] Trial 2214 finished with value: 0.5435788261799424 and parameters: {'kernel': 'rbf', 'C': 19.140029133027095, 'gamma': 0.0073619575546648545, 'epsilon': 0.16174468090773614}. Best is trial 1119 with value: 0.4485361816812923.
[I 2024-12-03 18:51:47,080] Trial 2217 finished with value: 0.5225357281216909 and parameters: {'kernel': 'rbf', 'C': 28.848862022861276, 'gamma': 0.008269970729814901, 'epsilon': 0.06988448186447581}. Best is trial 1119 with value: 0.4485361816812923.
[I 2024-12-03 18:51:48,358] Trial 2220 finished with value: 0.5500545094226607 and parameters: {'kernel': 'rbf', 'C': 95.13871970566385, 'gamma': 0.032706945337309556, 'epsilon': 0.05584511660777609}. Best is trial 1119 with value: 0.4485361816812923.
[I 2024-12-03 18:51:48,556] Trial 2224 finished with value: 0.4863471342773244 and parameters: {'kernel': 'rbf', 'C': 29.764034211711323, 'gamma': 0.013433564111534681, 'epsilon': 0.02493027595701988}. Best is trial 1119 with value: 0.4485361816812923.
[I 2024-12-03 18:51:48,626] Trial 2205 finished with value: 0.5572615106990859 and parameters: {'kernel': 'rbf', 'C': 94.70062885738895, 'gamma': 0.003361175218047125, 'epsilon': 0.2220550622632682}. Best is trial 1119 with value: 0.4485361816812923.
[I 2024-12-03 18:51:48,770] Trial 2216 finished with value: 0.4753622825329176 and parameters: {'kernel': 'rbf', 'C': 20.83367535372832, 'gamma': 0.03176613494927828, 'epsilon': 0.11132540160439082}. Best is trial 1119 with value: 0.4485361816812923.
[I 2024-12-03 18:51:48,774] Trial 2222 finished with value: 0.6403284156554118 and parameters: {'kernel': 'rbf', 'C': 5.540149465462163, 'gamma': 0.007492599363491475, 'epsilon': 0.09300867972878925}. Best is trial 1119 with value: 0.4485361816812923.
[I 2024-12-03 18:51:49,354] Trial 2221 finished with value: 0.45186117926823627 and parameters: {'kernel': 'rbf', 'C': 93.60800836181157, 'gamma': 0.015325762673287223, 'epsilon': 0.04873638946294268}. Best is trial 1119 with value: 0.4485361816812923.
[I 2024-12-03 18:51:50,098] Trial 2219 finished with value: 0.505570801243506 and parameters: {'kernel': 'rbf', 'C': 93.33847997347839, 'gamma': 0.006420144496862, 'epsilon': 0.1803353582790296}. Best is trial 1119 with value: 0.4485361816812923.
[I 2024-12-03 18:51:50,437] Trial 2228 finished with value: 0.5701367500522192 and parameters: {'kernel': 'linear', 'C': 2.8110499650229923, 'gamma': 0.0002565515081940592, 'epsilon': 0.010360350838914623}. Best is trial 1119 with value: 0.4485361816812923.
