[I 2024-12-04 15:18:45,078] Trial 1289 finished with value: 0.4194047468001175 and parameters: {'n_estimators': 979, 'max_depth': 39, 'min_samples_split': 2, 'min_samples_leaf': 1, 'max_features': None, 'bootstrap': True, 'criterion': 'squared_error'}. Best is trial 1025 with value: 0.41844370194907604.
[I 2024-12-04 15:18:51,096] Trial 1303 finished with value: 0.46680099770279 and parameters: {'n_estimators': 133, 'max_depth': 32, 'min_samples_split': 5, 'min_samples_leaf': 2, 'max_features': None, 'bootstrap': True, 'criterion': 'absolute_error'}. Best is trial 1025 with value: 0.41844370194907604.
[I 2024-12-04 15:18:58,923] Trial 1293 finished with value: 0.46530873830325176 and parameters: {'n_estimators': 997, 'max_depth': 45, 'min_samples_split': 2, 'min_samples_leaf': 2, 'max_features': None, 'bootstrap': True, 'criterion': 'squared_error'}. Best is trial 1025 with value: 0.41844370194907604.
[I 2024-12-04 15:19:03,493] Trial 1305 finished with value: 0.5064063441317441 and parameters: {'n_estimators': 831, 'max_depth': 47, 'min_samples_split': 4, 'min_samples_leaf': 1, 'max_features': 'sqrt', 'bootstrap': True, 'criterion': 'squared_error'}. Best is trial 1025 with value: 0.41844370194907604.
[I 2024-12-04 15:19:03,519] Trial 1299 finished with value: 0.46535843861203346 and parameters: {'n_estimators': 940, 'max_depth': 35, 'min_samples_split': 4, 'min_samples_leaf': 2, 'max_features': None, 'bootstrap': True, 'criterion': 'squared_error'}. Best is trial 1025 with value: 0.41844370194907604.
[I 2024-12-04 15:19:03,591] Trial 1309 finished with value: 0.43121400120071435 and parameters: {'n_estimators': 862, 'max_depth': 48, 'min_samples_split': 4, 'min_samples_leaf': 1, 'max_features': None, 'bootstrap': True, 'criterion': 'squared_error'}. Best is trial 1025 with value: 0.41844370194907604.
[I 2024-12-04 15:19:09,295] Trial 1320 finished with value: 1.0676305447595402 and parameters: {'n_estimators': 113, 'max_depth': 23, 'min_samples_split': 12, 'min_samples_leaf': 12, 'max_features': 'log2', 'bootstrap': True, 'criterion': 'squared_error'}. Best is trial 1025 with value: 0.41844370194907604.
[I 2024-12-04 15:19:09,865] Trial 1310 finished with value: 0.6340891130343229 and parameters: {'n_estimators': 252, 'max_depth': 13, 'min_samples_split': 33, 'min_samples_leaf': 2, 'max_features': None, 'bootstrap': False, 'criterion': 'absolute_error'}. Best is trial 1025 with value: 0.41844370194907604.
[I 2024-12-04 15:19:10,077] Trial 1308 finished with value: 0.6984440246741759 and parameters: {'n_estimators': 917, 'max_depth': 30, 'min_samples_split': 21, 'min_samples_leaf': 14, 'max_features': None, 'bootstrap': True, 'criterion': 'squared_error'}. Best is trial 1025 with value: 0.41844370194907604.
[I 2024-12-04 15:19:12,336] Trial 1304 finished with value: 0.4314150805670019 and parameters: {'n_estimators': 748, 'max_depth': 38, 'min_samples_split': 4, 'min_samples_leaf': 1, 'max_features': None, 'bootstrap': True, 'criterion': 'squared_error'}. Best is trial 1025 with value: 0.41844370194907604.
[I 2024-12-04 15:19:12,336] Trial 1322 finished with value: 1.0570583519848122 and parameters: {'n_estimators': 223, 'max_depth': 46, 'min_samples_split': 3, 'min_samples_leaf': 14, 'max_features': 'log2', 'bootstrap': False, 'criterion': 'absolute_error'}. Best is trial 1025 with value: 0.41844370194907604.
[I 2024-12-04 15:19:13,020] Trial 1301 finished with value: 0.4203550275165622 and parameters: {'n_estimators': 995, 'max_depth': 42, 'min_samples_split': 2, 'min_samples_leaf': 1, 'max_features': None, 'bootstrap': True, 'criterion': 'squared_error'}. Best is trial 1025 with value: 0.41844370194907604.
[I 2024-12-04 15:19:13,454] Trial 1292 finished with value: 0.4206518822407028 and parameters: {'n_estimators': 896, 'max_depth': 37, 'min_samples_split': 2, 'min_samples_leaf': 1, 'max_features': None, 'bootstrap': True, 'criterion': 'squared_error'}. Best is trial 1025 with value: 0.41844370194907604.
[I 2024-12-04 15:19:13,985] Trial 1311 finished with value: 0.8342448672363416 and parameters: {'n_estimators': 631, 'max_depth': 11, 'min_samples_split': 2, 'min_samples_leaf': 1, 'max_features': 'sqrt', 'bootstrap': True, 'criterion': 'absolute_error'}. Best is trial 1025 with value: 0.41844370194907604.
[I 2024-12-04 15:19:14,266] Trial 1302 finished with value: 0.4205507241053656 and parameters: {'n_estimators': 860, 'max_depth': 36, 'min_samples_split': 2, 'min_samples_leaf': 1, 'max_features': None, 'bootstrap': True, 'criterion': 'squared_error'}. Best is trial 1025 with value: 0.41844370194907604.
[I 2024-12-04 15:19:15,886] Trial 1307 finished with value: 0.42392086753919583 and parameters: {'n_estimators': 989, 'max_depth': 45, 'min_samples_split': 3, 'min_samples_leaf': 1, 'max_features': None, 'bootstrap': True, 'criterion': 'squared_error'}. Best is trial 1025 with value: 0.41844370194907604.
[I 2024-12-04 15:19:16,057] Trial 1298 finished with value: 0.42010891242338055 and parameters: {'n_estimators': 903, 'max_depth': 38, 'min_samples_split': 2, 'min_samples_leaf': 1, 'max_features': None, 'bootstrap': True, 'criterion': 'squared_error'}. Best is trial 1025 with value: 0.41844370194907604.
[I 2024-12-04 15:19:16,331] Trial 1316 finished with value: 0.5374777568153776 and parameters: {'n_estimators': 973, 'max_depth': 31, 'min_samples_split': 4, 'min_samples_leaf': 1, 'max_features': 'sqrt', 'bootstrap': False, 'criterion': 'squared_error'}. Best is trial 1025 with value: 0.41844370194907604.
[I 2024-12-04 15:19:18,211] Trial 1297 finished with value: 0.41987770960688675 and parameters: {'n_estimators': 996, 'max_depth': 43, 'min_samples_split': 2, 'min_samples_leaf': 1, 'max_features': None, 'bootstrap': True, 'criterion': 'squared_error'}. Best is trial 1025 with value: 0.41844370194907604.
[I 2024-12-04 15:19:18,823] Trial 1315 finished with value: 0.5392531765349883 and parameters: {'n_estimators': 960, 'max_depth': 34, 'min_samples_split': 3, 'min_samples_leaf': 1, 'max_features': 'sqrt', 'bootstrap': True, 'criterion': 'squared_error'}. Best is trial 1025 with value: 0.41844370194907604.
[I 2024-12-04 15:19:21,844] Trial 1314 finished with value: 0.42163664278303725 and parameters: {'n_estimators': 804, 'max_depth': 42, 'min_samples_split': 2, 'min_samples_leaf': 1, 'max_features': None, 'bootstrap': True, 'criterion': 'squared_error'}. Best is trial 1025 with value: 0.41844370194907604.
[I 2024-12-04 15:19:22,223] Trial 1317 finished with value: 0.46557614110699297 and parameters: {'n_estimators': 806, 'max_depth': 36, 'min_samples_split': 2, 'min_samples_leaf': 2, 'max_features': None, 'bootstrap': True, 'criterion': 'squared_error'}. Best is trial 1025 with value: 0.41844370194907604.
[I 2024-12-04 15:19:25,440] Trial 1329 finished with value: 0.7119155051862621 and parameters: {'n_estimators': 129, 'max_depth': 20, 'min_samples_split': 24, 'min_samples_leaf': 13, 'max_features': None, 'bootstrap': False, 'criterion': 'squared_error'}. Best is trial 1025 with value: 0.41844370194907604.
[I 2024-12-04 15:19:27,830] Trial 1319 finished with value: 0.5282671288745816 and parameters: {'n_estimators': 817, 'max_depth': 41, 'min_samples_split': 2, 'min_samples_leaf': 1, 'max_features': None, 'bootstrap': False, 'criterion': 'squared_error'}. Best is trial 1025 with value: 0.41844370194907604.
[I 2024-12-04 15:19:28,430] Trial 1313 finished with value: 0.4220683555911762 and parameters: {'n_estimators': 792, 'max_depth': 50, 'min_samples_split': 2, 'min_samples_leaf': 1, 'max_features': None, 'bootstrap': True, 'criterion': 'squared_error'}. Best is trial 1025 with value: 0.41844370194907604.
[I 2024-12-04 15:19:30,320] Trial 1318 finished with value: 0.4322756301074532 and parameters: {'n_estimators': 773, 'max_depth': 31, 'min_samples_split': 4, 'min_samples_leaf': 1, 'max_features': None, 'bootstrap': True, 'criterion': 'squared_error'}. Best is trial 1025 with value: 0.41844370194907604.
[I 2024-12-04 15:19:30,745] Trial 1321 finished with value: 1.0008083575672573 and parameters: {'n_estimators': 949, 'max_depth': 13, 'min_samples_split': 40, 'min_samples_leaf': 14, 'max_features': 'sqrt', 'bootstrap': False, 'criterion': 'absolute_error'}. Best is trial 1025 with value: 0.41844370194907604.
[I 2024-12-04 15:19:32,448] Trial 1332 finished with value: 0.47982421403914594 and parameters: {'n_estimators': 267, 'max_depth': 15, 'min_samples_split': 7, 'min_samples_leaf': 1, 'max_features': None, 'bootstrap': True, 'criterion': 'squared_error'}. Best is trial 1025 with value: 0.41844370194907604.
[I 2024-12-04 15:19:36,929] Trial 1295 finished with value: 0.4594407264610764 and parameters: {'n_estimators': 831, 'max_depth': 50, 'min_samples_split': 2, 'min_samples_leaf': 2, 'max_features': None, 'bootstrap': True, 'criterion': 'absolute_error'}. Best is trial 1025 with value: 0.41844370194907604.
[I 2024-12-04 15:19:36,986] Trial 1306 finished with value: 0.526098375894848 and parameters: {'n_estimators': 899, 'max_depth': 16, 'min_samples_split': 6, 'min_samples_leaf': 3, 'max_features': None, 'bootstrap': True, 'criterion': 'absolute_error'}. Best is trial 1025 with value: 0.41844370194907604.
[I 2024-12-04 15:19:42,942] Trial 1323 finished with value: 0.4654075675034404 and parameters: {'n_estimators': 991, 'max_depth': 33, 'min_samples_split': 2, 'min_samples_leaf': 2, 'max_features': None, 'bootstrap': True, 'criterion': 'squared_error'}. Best is trial 1025 with value: 0.41844370194907604.
[I 2024-12-04 15:19:44,657] Trial 1344 finished with value: 0.555860865553277 and parameters: {'n_estimators': 131, 'max_depth': 35, 'min_samples_split': 19, 'min_samples_leaf': 1, 'max_features': None, 'bootstrap': False, 'criterion': 'squared_error'}. Best is trial 1025 with value: 0.41844370194907604.
[I 2024-12-04 15:19:44,724] Trial 1333 finished with value: 0.7357518780451876 and parameters: {'n_estimators': 698, 'max_depth': 41, 'min_samples_split': 47, 'min_samples_leaf': 1, 'max_features': 'log2', 'bootstrap': True, 'criterion': 'squared_error'}. Best is trial 1025 with value: 0.41844370194907604.
[I 2024-12-04 15:19:46,109] Trial 1327 finished with value: 0.4213943050870696 and parameters: {'n_estimators': 789, 'max_depth': 37, 'min_samples_split': 2, 'min_samples_leaf': 1, 'max_features': None, 'bootstrap': True, 'criterion': 'squared_error'}. Best is trial 1025 with value: 0.41844370194907604.
[I 2024-12-04 15:19:48,668] Trial 1326 finished with value: 0.46521183595057564 and parameters: {'n_estimators': 777, 'max_depth': 39, 'min_samples_split': 2, 'min_samples_leaf': 2, 'max_features': None, 'bootstrap': True, 'criterion': 'squared_error'}. Best is trial 1025 with value: 0.41844370194907604.
[I 2024-12-04 15:19:48,867] Trial 1328 finished with value: 0.4212456204297145 and parameters: {'n_estimators': 717, 'max_depth': 32, 'min_samples_split': 2, 'min_samples_leaf': 1, 'max_features': None, 'bootstrap': True, 'criterion': 'squared_error'}. Best is trial 1025 with value: 0.41844370194907604.
[I 2024-12-04 15:19:52,733] Trial 1325 finished with value: 0.42047434904042696 and parameters: {'n_estimators': 986, 'max_depth': 36, 'min_samples_split': 2, 'min_samples_leaf': 1, 'max_features': None, 'bootstrap': True, 'criterion': 'squared_error'}. Best is trial 1025 with value: 0.41844370194907604.
[I 2024-12-04 15:19:52,886] Trial 1324 finished with value: 0.4206565144984661 and parameters: {'n_estimators': 995, 'max_depth': 37, 'min_samples_split': 2, 'min_samples_leaf': 1, 'max_features': None, 'bootstrap': True, 'criterion': 'squared_error'}. Best is trial 1025 with value: 0.41844370194907604.
[I 2024-12-04 15:19:56,095] Trial 1330 finished with value: 0.6309306658508025 and parameters: {'n_estimators': 990, 'max_depth': 41, 'min_samples_split': 3, 'min_samples_leaf': 1, 'max_features': 'log2', 'bootstrap': True, 'criterion': 'squared_error'}. Best is trial 1025 with value: 0.41844370194907604.
[I 2024-12-04 15:19:58,108] Trial 1296 finished with value: 0.4335955849457529 and parameters: {'n_estimators': 706, 'max_depth': 39, 'min_samples_split': 4, 'min_samples_leaf': 1, 'max_features': None, 'bootstrap': True, 'criterion': 'absolute_error'}. Best is trial 1025 with value: 0.41844370194907604.
[I 2024-12-04 15:19:58,215] Trial 1334 finished with value: 0.42424904803765545 and parameters: {'n_estimators': 820, 'max_depth': 39, 'min_samples_split': 3, 'min_samples_leaf': 1, 'max_features': None, 'bootstrap': True, 'criterion': 'squared_error'}. Best is trial 1025 with value: 0.41844370194907604.
[I 2024-12-04 15:20:01,002] Trial 1331 finished with value: 0.42067785016555753 and parameters: {'n_estimators': 826, 'max_depth': 43, 'min_samples_split': 2, 'min_samples_leaf': 1, 'max_features': None, 'bootstrap': True, 'criterion': 'squared_error'}. Best is trial 1025 with value: 0.41844370194907604.
[I 2024-12-04 15:20:02,719] Trial 1336 finished with value: 0.4227883453532208 and parameters: {'n_estimators': 697, 'max_depth': 35, 'min_samples_split': 2, 'min_samples_leaf': 1, 'max_features': None, 'bootstrap': True, 'criterion': 'squared_error'}. Best is trial 1025 with value: 0.41844370194907604.
[I 2024-12-04 15:20:05,809] Trial 1335 finished with value: 0.4207101141737157 and parameters: {'n_estimators': 806, 'max_depth': 43, 'min_samples_split': 2, 'min_samples_leaf': 1, 'max_features': None, 'bootstrap': True, 'criterion': 'squared_error'}. Best is trial 1025 with value: 0.41844370194907604.
[I 2024-12-04 15:20:08,067] Trial 1341 finished with value: 0.8365841630246743 and parameters: {'n_estimators': 450, 'max_depth': 24, 'min_samples_split': 49, 'min_samples_leaf': 1, 'max_features': 'log2', 'bootstrap': False, 'criterion': 'absolute_error'}. Best is trial 1025 with value: 0.41844370194907604.
[I 2024-12-04 15:20:08,073] Trial 1348 finished with value: 0.7281095530169986 and parameters: {'n_estimators': 959, 'max_depth': 22, 'min_samples_split': 3, 'min_samples_leaf': 2, 'max_features': 'sqrt', 'bootstrap': True, 'criterion': 'squared_error'}. Best is trial 1025 with value: 0.41844370194907604.
[I 2024-12-04 15:20:10,390] Trial 1342 finished with value: 0.4202938890507573 and parameters: {'n_estimators': 739, 'max_depth': 38, 'min_samples_split': 2, 'min_samples_leaf': 1, 'max_features': None, 'bootstrap': True, 'criterion': 'squared_error'}. Best is trial 1025 with value: 0.41844370194907604.
[I 2024-12-04 15:20:12,458] Trial 1352 finished with value: 0.7316760291739242 and parameters: {'n_estimators': 732, 'max_depth': 5, 'min_samples_split': 4, 'min_samples_leaf': 14, 'max_features': None, 'bootstrap': False, 'criterion': 'squared_error'}. Best is trial 1025 with value: 0.41844370194907604.
[I 2024-12-04 15:20:13,326] Trial 1339 finished with value: 0.42409644065189794 and parameters: {'n_estimators': 997, 'max_depth': 43, 'min_samples_split': 3, 'min_samples_leaf': 1, 'max_features': None, 'bootstrap': True, 'criterion': 'squared_error'}. Best is trial 1025 with value: 0.41844370194907604.
[I 2024-12-04 15:20:13,391] Trial 1338 finished with value: 0.4653178993477386 and parameters: {'n_estimators': 1000, 'max_depth': 36, 'min_samples_split': 3, 'min_samples_leaf': 2, 'max_features': None, 'bootstrap': True, 'criterion': 'squared_error'}. Best is trial 1025 with value: 0.41844370194907604.
[I 2024-12-04 15:20:13,709] Trial 1343 finished with value: 0.4245733015426469 and parameters: {'n_estimators': 825, 'max_depth': 35, 'min_samples_split': 3, 'min_samples_leaf': 1, 'max_features': None, 'bootstrap': True, 'criterion': 'squared_error'}. Best is trial 1025 with value: 0.41844370194907604.
[I 2024-12-04 15:20:15,099] Trial 1356 finished with value: 1.061346767125168 and parameters: {'n_estimators': 617, 'max_depth': 34, 'min_samples_split': 14, 'min_samples_leaf': 6, 'max_features': 'log2', 'bootstrap': True, 'criterion': 'squared_error'}. Best is trial 1025 with value: 0.41844370194907604.
[I 2024-12-04 15:20:16,257] Trial 1345 finished with value: 0.42386176240654816 and parameters: {'n_estimators': 793, 'max_depth': 40, 'min_samples_split': 3, 'min_samples_leaf': 1, 'max_features': None, 'bootstrap': True, 'criterion': 'squared_error'}. Best is trial 1025 with value: 0.41844370194907604.
[I 2024-12-04 15:20:17,307] Trial 1346 finished with value: 0.46489976832219276 and parameters: {'n_estimators': 700, 'max_depth': 43, 'min_samples_split': 2, 'min_samples_leaf': 2, 'max_features': None, 'bootstrap': True, 'criterion': 'squared_error'}. Best is trial 1025 with value: 0.41844370194907604.
[I 2024-12-04 15:20:18,123] Trial 1347 finished with value: 0.46531988586045075 and parameters: {'n_estimators': 837, 'max_depth': 40, 'min_samples_split': 3, 'min_samples_leaf': 2, 'max_features': None, 'bootstrap': True, 'criterion': 'squared_error'}. Best is trial 1025 with value: 0.41844370194907604.
[I 2024-12-04 15:20:21,186] Trial 1353 finished with value: 0.9885694051985217 and parameters: {'n_estimators': 993, 'max_depth': 13, 'min_samples_split': 28, 'min_samples_leaf': 3, 'max_features': 'log2', 'bootstrap': False, 'criterion': 'absolute_error'}. Best is trial 1025 with value: 0.41844370194907604.
[I 2024-12-04 15:20:25,528] Trial 1349 finished with value: 0.41920258062126453 and parameters: {'n_estimators': 819, 'max_depth': 40, 'min_samples_split': 2, 'min_samples_leaf': 1, 'max_features': None, 'bootstrap': True, 'criterion': 'squared_error'}. Best is trial 1025 with value: 0.41844370194907604.
[I 2024-12-04 15:20:26,153] Trial 1312 finished with value: 0.4310094757569132 and parameters: {'n_estimators': 745, 'max_depth': 36, 'min_samples_split': 2, 'min_samples_leaf': 1, 'max_features': None, 'bootstrap': True, 'criterion': 'absolute_error'}. Best is trial 1025 with value: 0.41844370194907604.
[I 2024-12-04 15:20:26,830] Trial 1361 finished with value: 1.0205159940042632 and parameters: {'n_estimators': 731, 'max_depth': 40, 'min_samples_split': 2, 'min_samples_leaf': 3, 'max_features': 'log2', 'bootstrap': True, 'criterion': 'squared_error'}. Best is trial 1025 with value: 0.41844370194907604.
[I 2024-12-04 15:20:28,030] Trial 1357 finished with value: 0.4649497230162539 and parameters: {'n_estimators': 678, 'max_depth': 38, 'min_samples_split': 4, 'min_samples_leaf': 2, 'max_features': None, 'bootstrap': True, 'criterion': 'squared_error'}. Best is trial 1025 with value: 0.41844370194907604.
[I 2024-12-04 15:20:28,530] Trial 1354 finished with value: 0.5108792662498605 and parameters: {'n_estimators': 905, 'max_depth': 39, 'min_samples_split': 2, 'min_samples_leaf': 1, 'max_features': 'sqrt', 'bootstrap': True, 'criterion': 'squared_error'}. Best is trial 1025 with value: 0.41844370194907604.
[I 2024-12-04 15:20:30,598] Trial 1351 finished with value: 0.4315736663809876 and parameters: {'n_estimators': 765, 'max_depth': 43, 'min_samples_split': 4, 'min_samples_leaf': 1, 'max_features': None, 'bootstrap': True, 'criterion': 'squared_error'}. Best is trial 1025 with value: 0.41844370194907604.
[I 2024-12-04 15:20:31,415] Trial 1358 finished with value: 0.4644697130431884 and parameters: {'n_estimators': 711, 'max_depth': 43, 'min_samples_split': 4, 'min_samples_leaf': 2, 'max_features': None, 'bootstrap': True, 'criterion': 'squared_error'}. Best is trial 1025 with value: 0.41844370194907604.
[I 2024-12-04 15:20:31,621] Trial 1350 finished with value: 0.41918836886448857 and parameters: {'n_estimators': 896, 'max_depth': 40, 'min_samples_split': 2, 'min_samples_leaf': 1, 'max_features': None, 'bootstrap': True, 'criterion': 'squared_error'}. Best is trial 1025 with value: 0.41844370194907604.
[I 2024-12-04 15:20:32,063] Trial 1362 finished with value: 0.6129863239634338 and parameters: {'n_estimators': 891, 'max_depth': 39, 'min_samples_split': 3, 'min_samples_leaf': 2, 'max_features': None, 'bootstrap': False, 'criterion': 'squared_error'}. Best is trial 1025 with value: 0.41844370194907604.
[I 2024-12-04 15:20:36,205] Trial 1355 finished with value: 0.4213654336068172 and parameters: {'n_estimators': 779, 'max_depth': 44, 'min_samples_split': 2, 'min_samples_leaf': 1, 'max_features': None, 'bootstrap': True, 'criterion': 'squared_error'}. Best is trial 1025 with value: 0.41844370194907604.
[I 2024-12-04 15:20:40,039] Trial 1359 finished with value: 0.4327637356306284 and parameters: {'n_estimators': 969, 'max_depth': 32, 'min_samples_split': 4, 'min_samples_leaf': 1, 'max_features': None, 'bootstrap': True, 'criterion': 'squared_error'}. Best is trial 1025 with value: 0.41844370194907604.
[I 2024-12-04 15:20:43,863] Trial 1360 finished with value: 0.46485616128985346 and parameters: {'n_estimators': 858, 'max_depth': 42, 'min_samples_split': 2, 'min_samples_leaf': 2, 'max_features': None, 'bootstrap': True, 'criterion': 'squared_error'}. Best is trial 1025 with value: 0.41844370194907604.
[I 2024-12-04 15:20:49,180] Trial 1364 finished with value: 0.4216058969463401 and parameters: {'n_estimators': 664, 'max_depth': 37, 'min_samples_split': 2, 'min_samples_leaf': 1, 'max_features': None, 'bootstrap': True, 'criterion': 'squared_error'}. Best is trial 1025 with value: 0.41844370194907604.
[I 2024-12-04 15:20:52,406] Trial 1367 finished with value: 0.42143622131763936 and parameters: {'n_estimators': 804, 'max_depth': 47, 'min_samples_split': 2, 'min_samples_leaf': 1, 'max_features': None, 'bootstrap': True, 'criterion': 'squared_error'}. Best is trial 1025 with value: 0.41844370194907604.
[I 2024-12-04 15:20:58,656] Trial 1365 finished with value: 0.42131663086880144 and parameters: {'n_estimators': 836, 'max_depth': 47, 'min_samples_split': 2, 'min_samples_leaf': 1, 'max_features': None, 'bootstrap': True, 'criterion': 'squared_error'}. Best is trial 1025 with value: 0.41844370194907604.
