[I 2024-12-04 15:03:23,685] Trial 726 finished with value: 0.7127850469131322 and parameters: {'n_estimators': 858, 'max_depth': 19, 'min_samples_split': 3, 'min_samples_leaf': 14, 'max_features': None, 'bootstrap': False, 'criterion': 'squared_error'}. Best is trial 590 with value: 0.4185444504443197.
[I 2024-12-04 15:03:24,784] Trial 731 finished with value: 0.7906015718680612 and parameters: {'n_estimators': 598, 'max_depth': 41, 'min_samples_split': 14, 'min_samples_leaf': 3, 'max_features': 'sqrt', 'bootstrap': True, 'criterion': 'squared_error'}. Best is trial 590 with value: 0.4185444504443197.
[I 2024-12-04 15:03:25,342] Trial 715 finished with value: 0.41955050849142195 and parameters: {'n_estimators': 995, 'max_depth': 38, 'min_samples_split': 2, 'min_samples_leaf': 1, 'max_features': None, 'bootstrap': True, 'criterion': 'squared_error'}. Best is trial 590 with value: 0.4185444504443197.
[I 2024-12-04 15:03:28,076] Trial 718 finished with value: 0.46471433804544293 and parameters: {'n_estimators': 864, 'max_depth': 40, 'min_samples_split': 2, 'min_samples_leaf': 2, 'max_features': None, 'bootstrap': True, 'criterion': 'squared_error'}. Best is trial 590 with value: 0.4185444504443197.
[I 2024-12-04 15:03:29,069] Trial 729 finished with value: 0.4233181709484922 and parameters: {'n_estimators': 534, 'max_depth': 38, 'min_samples_split': 2, 'min_samples_leaf': 1, 'max_features': None, 'bootstrap': True, 'criterion': 'squared_error'}. Best is trial 590 with value: 0.4185444504443197.
[I 2024-12-04 15:03:29,079] Trial 727 finished with value: 0.4217258340795129 and parameters: {'n_estimators': 574, 'max_depth': 39, 'min_samples_split': 2, 'min_samples_leaf': 1, 'max_features': None, 'bootstrap': True, 'criterion': 'squared_error'}. Best is trial 590 with value: 0.4185444504443197.
[I 2024-12-04 15:03:29,164] Trial 723 finished with value: 0.4248602333974893 and parameters: {'n_estimators': 822, 'max_depth': 49, 'min_samples_split': 3, 'min_samples_leaf': 1, 'max_features': None, 'bootstrap': True, 'criterion': 'squared_error'}. Best is trial 590 with value: 0.4185444504443197.
[I 2024-12-04 15:03:33,775] Trial 721 finished with value: 0.4346160745674053 and parameters: {'n_estimators': 976, 'max_depth': 49, 'min_samples_split': 5, 'min_samples_leaf': 1, 'max_features': None, 'bootstrap': True, 'criterion': 'squared_error'}. Best is trial 590 with value: 0.4185444504443197.
[I 2024-12-04 15:03:33,800] Trial 728 finished with value: 0.4190319244555838 and parameters: {'n_estimators': 830, 'max_depth': 40, 'min_samples_split': 2, 'min_samples_leaf': 1, 'max_features': None, 'bootstrap': True, 'criterion': 'squared_error'}. Best is trial 590 with value: 0.4185444504443197.
[I 2024-12-04 15:03:35,920] Trial 735 finished with value: 0.5171955687232901 and parameters: {'n_estimators': 682, 'max_depth': 41, 'min_samples_split': 4, 'min_samples_leaf': 1, 'max_features': None, 'bootstrap': False, 'criterion': 'squared_error'}. Best is trial 590 with value: 0.4185444504443197.
[I 2024-12-04 15:03:45,618] Trial 738 finished with value: 0.49354007813342843 and parameters: {'n_estimators': 684, 'max_depth': 47, 'min_samples_split': 3, 'min_samples_leaf': 1, 'max_features': 'sqrt', 'bootstrap': True, 'criterion': 'squared_error'}. Best is trial 590 with value: 0.4185444504443197.
[I 2024-12-04 15:03:48,792] Trial 733 finished with value: 0.4971375711856516 and parameters: {'n_estimators': 837, 'max_depth': 50, 'min_samples_split': 30, 'min_samples_leaf': 1, 'max_features': None, 'bootstrap': True, 'criterion': 'squared_error'}. Best is trial 590 with value: 0.4185444504443197.
[I 2024-12-04 15:03:55,620] Trial 732 finished with value: 0.4650255043648204 and parameters: {'n_estimators': 906, 'max_depth': 50, 'min_samples_split': 2, 'min_samples_leaf': 2, 'max_features': None, 'bootstrap': True, 'criterion': 'squared_error'}. Best is trial 590 with value: 0.4185444504443197.
[I 2024-12-04 15:03:55,630] Trial 739 finished with value: 0.75725050462295 and parameters: {'n_estimators': 499, 'max_depth': 17, 'min_samples_split': 26, 'min_samples_leaf': 1, 'max_features': 'sqrt', 'bootstrap': False, 'criterion': 'absolute_error'}. Best is trial 590 with value: 0.4185444504443197.
[I 2024-12-04 15:03:56,275] Trial 736 finished with value: 0.4214164032961143 and parameters: {'n_estimators': 819, 'max_depth': 34, 'min_samples_split': 2, 'min_samples_leaf': 1, 'max_features': None, 'bootstrap': True, 'criterion': 'squared_error'}. Best is trial 590 with value: 0.4185444504443197.
[I 2024-12-04 15:03:56,486] Trial 742 finished with value: 0.43254384520009537 and parameters: {'n_estimators': 623, 'max_depth': 40, 'min_samples_split': 4, 'min_samples_leaf': 1, 'max_features': None, 'bootstrap': True, 'criterion': 'squared_error'}. Best is trial 590 with value: 0.4185444504443197.
[I 2024-12-04 15:03:57,049] Trial 734 finished with value: 0.42068767085488384 and parameters: {'n_estimators': 861, 'max_depth': 44, 'min_samples_split': 2, 'min_samples_leaf': 1, 'max_features': None, 'bootstrap': True, 'criterion': 'squared_error'}. Best is trial 590 with value: 0.4185444504443197.
[I 2024-12-04 15:03:58,319] Trial 686 finished with value: 0.5638550395208946 and parameters: {'n_estimators': 921, 'max_depth': 39, 'min_samples_split': 4, 'min_samples_leaf': 2, 'max_features': None, 'bootstrap': False, 'criterion': 'absolute_error'}. Best is trial 590 with value: 0.4185444504443197.
[I 2024-12-04 15:03:59,629] Trial 740 finished with value: 0.4252331803052795 and parameters: {'n_estimators': 695, 'max_depth': 38, 'min_samples_split': 3, 'min_samples_leaf': 1, 'max_features': None, 'bootstrap': True, 'criterion': 'squared_error'}. Best is trial 590 with value: 0.4185444504443197.
[I 2024-12-04 15:04:01,197] Trial 690 finished with value: 0.5327217804998217 and parameters: {'n_estimators': 938, 'max_depth': 32, 'min_samples_split': 40, 'min_samples_leaf': 1, 'max_features': None, 'bootstrap': True, 'criterion': 'absolute_error'}. Best is trial 590 with value: 0.4185444504443197.
[I 2024-12-04 15:04:02,152] Trial 747 finished with value: 0.6439244209753222 and parameters: {'n_estimators': 702, 'max_depth': 38, 'min_samples_split': 2, 'min_samples_leaf': 1, 'max_features': 'log2', 'bootstrap': True, 'criterion': 'squared_error'}. Best is trial 590 with value: 0.4185444504443197.
[I 2024-12-04 15:04:02,161] Trial 741 finished with value: 0.43175193095742587 and parameters: {'n_estimators': 797, 'max_depth': 37, 'min_samples_split': 4, 'min_samples_leaf': 1, 'max_features': None, 'bootstrap': True, 'criterion': 'squared_error'}. Best is trial 590 with value: 0.4185444504443197.
[I 2024-12-04 15:04:02,605] Trial 748 finished with value: 0.8404738396426525 and parameters: {'n_estimators': 722, 'max_depth': 13, 'min_samples_split': 7, 'min_samples_leaf': 3, 'max_features': 'sqrt', 'bootstrap': True, 'criterion': 'squared_error'}. Best is trial 590 with value: 0.4185444504443197.
[I 2024-12-04 15:04:02,606] Trial 737 finished with value: 0.4197069558857658 and parameters: {'n_estimators': 988, 'max_depth': 38, 'min_samples_split': 2, 'min_samples_leaf': 1, 'max_features': None, 'bootstrap': True, 'criterion': 'squared_error'}. Best is trial 590 with value: 0.4185444504443197.
[I 2024-12-04 15:04:02,617] Trial 754 finished with value: 0.8610567469578467 and parameters: {'n_estimators': 350, 'max_depth': 48, 'min_samples_split': 3, 'min_samples_leaf': 5, 'max_features': 'sqrt', 'bootstrap': False, 'criterion': 'absolute_error'}. Best is trial 590 with value: 0.4185444504443197.
[I 2024-12-04 15:04:02,690] Trial 746 finished with value: 0.464600354234124 and parameters: {'n_estimators': 654, 'max_depth': 34, 'min_samples_split': 2, 'min_samples_leaf': 2, 'max_features': None, 'bootstrap': True, 'criterion': 'squared_error'}. Best is trial 590 with value: 0.4185444504443197.
[I 2024-12-04 15:04:02,725] Trial 750 finished with value: 0.4241239861886912 and parameters: {'n_estimators': 588, 'max_depth': 44, 'min_samples_split': 2, 'min_samples_leaf': 1, 'max_features': None, 'bootstrap': True, 'criterion': 'squared_error'}. Best is trial 590 with value: 0.4185444504443197.
[I 2024-12-04 15:04:03,228] Trial 744 finished with value: 0.4192824937660168 and parameters: {'n_estimators': 776, 'max_depth': 41, 'min_samples_split': 2, 'min_samples_leaf': 1, 'max_features': None, 'bootstrap': True, 'criterion': 'squared_error'}. Best is trial 590 with value: 0.4185444504443197.
[I 2024-12-04 15:04:03,314] Trial 749 finished with value: 0.46436350531247994 and parameters: {'n_estimators': 620, 'max_depth': 41, 'min_samples_split': 2, 'min_samples_leaf': 2, 'max_features': None, 'bootstrap': True, 'criterion': 'squared_error'}. Best is trial 590 with value: 0.4185444504443197.
[I 2024-12-04 15:04:06,404] Trial 743 finished with value: 0.4194172910952349 and parameters: {'n_estimators': 768, 'max_depth': 41, 'min_samples_split': 2, 'min_samples_leaf': 1, 'max_features': None, 'bootstrap': True, 'criterion': 'squared_error'}. Best is trial 590 with value: 0.4185444504443197.
[I 2024-12-04 15:04:10,843] Trial 745 finished with value: 0.41972802247413205 and parameters: {'n_estimators': 979, 'max_depth': 38, 'min_samples_split': 2, 'min_samples_leaf': 1, 'max_features': None, 'bootstrap': True, 'criterion': 'squared_error'}. Best is trial 590 with value: 0.4185444504443197.
[I 2024-12-04 15:04:11,378] Trial 752 finished with value: 0.41919551002895555 and parameters: {'n_estimators': 712, 'max_depth': 41, 'min_samples_split': 2, 'min_samples_leaf': 1, 'max_features': None, 'bootstrap': True, 'criterion': 'squared_error'}. Best is trial 590 with value: 0.4185444504443197.
[I 2024-12-04 15:04:12,045] Trial 756 finished with value: 0.42042004339133904 and parameters: {'n_estimators': 727, 'max_depth': 36, 'min_samples_split': 2, 'min_samples_leaf': 1, 'max_features': None, 'bootstrap': True, 'criterion': 'squared_error'}. Best is trial 590 with value: 0.4185444504443197.
[I 2024-12-04 15:04:12,167] Trial 755 finished with value: 0.4195328796437978 and parameters: {'n_estimators': 781, 'max_depth': 39, 'min_samples_split': 2, 'min_samples_leaf': 1, 'max_features': None, 'bootstrap': True, 'criterion': 'squared_error'}. Best is trial 590 with value: 0.4185444504443197.
[I 2024-12-04 15:04:15,477] Trial 758 finished with value: 0.6350271696692932 and parameters: {'n_estimators': 879, 'max_depth': 7, 'min_samples_split': 48, 'min_samples_leaf': 1, 'max_features': None, 'bootstrap': True, 'criterion': 'squared_error'}. Best is trial 590 with value: 0.4185444504443197.
[I 2024-12-04 15:04:15,654] Trial 753 finished with value: 0.46531777838609295 and parameters: {'n_estimators': 752, 'max_depth': 36, 'min_samples_split': 4, 'min_samples_leaf': 2, 'max_features': None, 'bootstrap': True, 'criterion': 'squared_error'}. Best is trial 590 with value: 0.4185444504443197.
[I 2024-12-04 15:04:15,669] Trial 700 finished with value: 0.4296897093639314 and parameters: {'n_estimators': 794, 'max_depth': 38, 'min_samples_split': 2, 'min_samples_leaf': 1, 'max_features': None, 'bootstrap': True, 'criterion': 'absolute_error'}. Best is trial 590 with value: 0.4185444504443197.
[I 2024-12-04 15:04:15,997] Trial 751 finished with value: 0.4265324009071697 and parameters: {'n_estimators': 795, 'max_depth': 30, 'min_samples_split': 3, 'min_samples_leaf': 1, 'max_features': None, 'bootstrap': True, 'criterion': 'squared_error'}. Best is trial 590 with value: 0.4185444504443197.
[I 2024-12-04 15:04:19,632] Trial 769 finished with value: 0.9461860855154436 and parameters: {'n_estimators': 188, 'max_depth': 48, 'min_samples_split': 5, 'min_samples_leaf': 5, 'max_features': 'sqrt', 'bootstrap': True, 'criterion': 'absolute_error'}. Best is trial 590 with value: 0.4185444504443197.
[I 2024-12-04 15:04:20,532] Trial 761 finished with value: 0.4643481236584287 and parameters: {'n_estimators': 714, 'max_depth': 41, 'min_samples_split': 2, 'min_samples_leaf': 2, 'max_features': None, 'bootstrap': True, 'criterion': 'squared_error'}. Best is trial 590 with value: 0.4185444504443197.
[I 2024-12-04 15:04:21,393] Trial 759 finished with value: 0.8927746665420994 and parameters: {'n_estimators': 548, 'max_depth': 37, 'min_samples_split': 47, 'min_samples_leaf': 4, 'max_features': 'sqrt', 'bootstrap': True, 'criterion': 'absolute_error'}. Best is trial 590 with value: 0.4185444504443197.
[I 2024-12-04 15:04:24,565] Trial 757 finished with value: 0.9536158528866047 and parameters: {'n_estimators': 759, 'max_depth': 5, 'min_samples_split': 25, 'min_samples_leaf': 1, 'max_features': 'sqrt', 'bootstrap': False, 'criterion': 'absolute_error'}. Best is trial 590 with value: 0.4185444504443197.
[I 2024-12-04 15:04:25,667] Trial 771 finished with value: 1.0457567491522983 and parameters: {'n_estimators': 596, 'max_depth': 14, 'min_samples_split': 5, 'min_samples_leaf': 4, 'max_features': 'log2', 'bootstrap': True, 'criterion': 'squared_error'}. Best is trial 590 with value: 0.4185444504443197.
[I 2024-12-04 15:04:26,651] Trial 764 finished with value: 0.6137825508224687 and parameters: {'n_estimators': 788, 'max_depth': 41, 'min_samples_split': 5, 'min_samples_leaf': 2, 'max_features': None, 'bootstrap': False, 'criterion': 'squared_error'}. Best is trial 590 with value: 0.4185444504443197.
[I 2024-12-04 15:04:27,591] Trial 763 finished with value: 0.42176300494759106 and parameters: {'n_estimators': 776, 'max_depth': 46, 'min_samples_split': 2, 'min_samples_leaf': 1, 'max_features': None, 'bootstrap': True, 'criterion': 'squared_error'}. Best is trial 590 with value: 0.4185444504443197.
[I 2024-12-04 15:04:28,030] Trial 762 finished with value: 0.4216078285881277 and parameters: {'n_estimators': 816, 'max_depth': 47, 'min_samples_split': 2, 'min_samples_leaf': 1, 'max_features': None, 'bootstrap': True, 'criterion': 'squared_error'}. Best is trial 590 with value: 0.4185444504443197.
[I 2024-12-04 15:04:29,313] Trial 770 finished with value: 1.0138253627934775 and parameters: {'n_estimators': 551, 'max_depth': 6, 'min_samples_split': 4, 'min_samples_leaf': 2, 'max_features': 'log2', 'bootstrap': True, 'criterion': 'absolute_error'}. Best is trial 590 with value: 0.4185444504443197.
[I 2024-12-04 15:04:30,571] Trial 767 finished with value: 0.41961501783948046 and parameters: {'n_estimators': 646, 'max_depth': 41, 'min_samples_split': 2, 'min_samples_leaf': 1, 'max_features': None, 'bootstrap': True, 'criterion': 'squared_error'}. Best is trial 590 with value: 0.4185444504443197.
[I 2024-12-04 15:04:31,207] Trial 782 finished with value: 0.7461507097231163 and parameters: {'n_estimators': 233, 'max_depth': 5, 'min_samples_split': 7, 'min_samples_leaf': 2, 'max_features': None, 'bootstrap': False, 'criterion': 'squared_error'}. Best is trial 590 with value: 0.4185444504443197.
[I 2024-12-04 15:04:33,024] Trial 772 finished with value: 0.41943776603664606 and parameters: {'n_estimators': 624, 'max_depth': 40, 'min_samples_split': 2, 'min_samples_leaf': 1, 'max_features': None, 'bootstrap': True, 'criterion': 'squared_error'}. Best is trial 590 with value: 0.4185444504443197.
[I 2024-12-04 15:04:39,049] Trial 766 finished with value: 0.4648510803168377 and parameters: {'n_estimators': 611, 'max_depth': 41, 'min_samples_split': 4, 'min_samples_leaf': 2, 'max_features': None, 'bootstrap': True, 'criterion': 'squared_error'}. Best is trial 590 with value: 0.4185444504443197.
[I 2024-12-04 15:04:40,669] Trial 774 finished with value: 0.42074939178705856 and parameters: {'n_estimators': 785, 'max_depth': 36, 'min_samples_split': 2, 'min_samples_leaf': 1, 'max_features': None, 'bootstrap': True, 'criterion': 'squared_error'}. Best is trial 590 with value: 0.4185444504443197.
[I 2024-12-04 15:04:41,699] Trial 765 finished with value: 0.4219142050694507 and parameters: {'n_estimators': 666, 'max_depth': 43, 'min_samples_split': 2, 'min_samples_leaf': 1, 'max_features': None, 'bootstrap': True, 'criterion': 'squared_error'}. Best is trial 590 with value: 0.4185444504443197.
[I 2024-12-04 15:04:42,062] Trial 775 finished with value: 0.895561292973421 and parameters: {'n_estimators': 897, 'max_depth': 49, 'min_samples_split': 2, 'min_samples_leaf': 6, 'max_features': 'sqrt', 'bootstrap': False, 'criterion': 'absolute_error'}. Best is trial 590 with value: 0.4185444504443197.
[I 2024-12-04 15:04:42,466] Trial 780 finished with value: 0.43154572109421585 and parameters: {'n_estimators': 777, 'max_depth': 42, 'min_samples_split': 4, 'min_samples_leaf': 1, 'max_features': None, 'bootstrap': True, 'criterion': 'squared_error'}. Best is trial 590 with value: 0.4185444504443197.
[I 2024-12-04 15:04:44,305] Trial 778 finished with value: 0.42118207959845905 and parameters: {'n_estimators': 683, 'max_depth': 36, 'min_samples_split': 2, 'min_samples_leaf': 1, 'max_features': None, 'bootstrap': True, 'criterion': 'squared_error'}. Best is trial 590 with value: 0.4185444504443197.
[I 2024-12-04 15:04:44,326] Trial 768 finished with value: 0.43098440163350954 and parameters: {'n_estimators': 769, 'max_depth': 39, 'min_samples_split': 4, 'min_samples_leaf': 1, 'max_features': None, 'bootstrap': True, 'criterion': 'squared_error'}. Best is trial 590 with value: 0.4185444504443197.
[I 2024-12-04 15:04:44,569] Trial 773 finished with value: 0.4196501389591272 and parameters: {'n_estimators': 710, 'max_depth': 39, 'min_samples_split': 2, 'min_samples_leaf': 1, 'max_features': None, 'bootstrap': True, 'criterion': 'squared_error'}. Best is trial 590 with value: 0.4185444504443197.
[I 2024-12-04 15:04:48,945] Trial 781 finished with value: 0.42605336825236684 and parameters: {'n_estimators': 601, 'max_depth': 48, 'min_samples_split': 3, 'min_samples_leaf': 1, 'max_features': None, 'bootstrap': True, 'criterion': 'squared_error'}. Best is trial 590 with value: 0.4185444504443197.
[I 2024-12-04 15:04:49,641] Trial 777 finished with value: 0.4655459158346526 and parameters: {'n_estimators': 804, 'max_depth': 29, 'min_samples_split': 2, 'min_samples_leaf': 2, 'max_features': None, 'bootstrap': True, 'criterion': 'squared_error'}. Best is trial 590 with value: 0.4185444504443197.
[I 2024-12-04 15:04:52,077] Trial 776 finished with value: 0.4657604954297933 and parameters: {'n_estimators': 788, 'max_depth': 33, 'min_samples_split': 2, 'min_samples_leaf': 2, 'max_features': None, 'bootstrap': True, 'criterion': 'squared_error'}. Best is trial 590 with value: 0.4185444504443197.
[I 2024-12-04 15:04:53,150] Trial 779 finished with value: 0.7730238118384004 and parameters: {'n_estimators': 952, 'max_depth': 27, 'min_samples_split': 3, 'min_samples_leaf': 3, 'max_features': 'sqrt', 'bootstrap': False, 'criterion': 'absolute_error'}. Best is trial 590 with value: 0.4185444504443197.
[I 2024-12-04 15:04:54,403] Trial 783 finished with value: 0.4646441920361108 and parameters: {'n_estimators': 729, 'max_depth': 41, 'min_samples_split': 2, 'min_samples_leaf': 2, 'max_features': None, 'bootstrap': True, 'criterion': 'squared_error'}. Best is trial 590 with value: 0.4185444504443197.
[I 2024-12-04 15:04:59,654] Trial 788 finished with value: 0.42658418040272666 and parameters: {'n_estimators': 534, 'max_depth': 28, 'min_samples_split': 2, 'min_samples_leaf': 1, 'max_features': None, 'bootstrap': True, 'criterion': 'squared_error'}. Best is trial 590 with value: 0.4185444504443197.
[I 2024-12-04 15:05:02,528] Trial 786 finished with value: 0.9682707315413309 and parameters: {'n_estimators': 679, 'max_depth': 28, 'min_samples_split': 18, 'min_samples_leaf': 2, 'max_features': 'log2', 'bootstrap': True, 'criterion': 'absolute_error'}. Best is trial 590 with value: 0.4185444504443197.
[I 2024-12-04 15:05:02,529] Trial 791 finished with value: 0.647890587013987 and parameters: {'n_estimators': 850, 'max_depth': 40, 'min_samples_split': 4, 'min_samples_leaf': 1, 'max_features': 'log2', 'bootstrap': True, 'criterion': 'squared_error'}. Best is trial 590 with value: 0.4185444504443197.
[I 2024-12-04 15:05:02,958] Trial 784 finished with value: 0.42007620212438984 and parameters: {'n_estimators': 771, 'max_depth': 38, 'min_samples_split': 2, 'min_samples_leaf': 1, 'max_features': None, 'bootstrap': True, 'criterion': 'squared_error'}. Best is trial 590 with value: 0.4185444504443197.
[I 2024-12-04 15:05:02,959] Trial 793 finished with value: 0.6133874131467091 and parameters: {'n_estimators': 562, 'max_depth': 41, 'min_samples_split': 2, 'min_samples_leaf': 2, 'max_features': None, 'bootstrap': False, 'criterion': 'squared_error'}. Best is trial 590 with value: 0.4185444504443197.
[I 2024-12-04 15:05:03,356] Trial 800 finished with value: 0.7042022645924833 and parameters: {'n_estimators': 271, 'max_depth': 12, 'min_samples_split': 2, 'min_samples_leaf': 15, 'max_features': None, 'bootstrap': True, 'criterion': 'absolute_error'}. Best is trial 590 with value: 0.4185444504443197.
[I 2024-12-04 15:05:04,895] Trial 801 finished with value: 0.7203358109022565 and parameters: {'n_estimators': 548, 'max_depth': 7, 'min_samples_split': 24, 'min_samples_leaf': 4, 'max_features': None, 'bootstrap': False, 'criterion': 'squared_error'}. Best is trial 590 with value: 0.4185444504443197.
[I 2024-12-04 15:05:05,069] Trial 798 finished with value: 0.9579478270782759 and parameters: {'n_estimators': 833, 'max_depth': 48, 'min_samples_split': 2, 'min_samples_leaf': 2, 'max_features': 'log2', 'bootstrap': True, 'criterion': 'squared_error'}. Best is trial 590 with value: 0.4185444504443197.
[I 2024-12-04 15:05:05,691] Trial 792 finished with value: 0.4217590823977101 and parameters: {'n_estimators': 710, 'max_depth': 46, 'min_samples_split': 2, 'min_samples_leaf': 1, 'max_features': None, 'bootstrap': True, 'criterion': 'squared_error'}. Best is trial 590 with value: 0.4185444504443197.
