[I 2024-12-04 20:33:40,007] Trial 2317 finished with value: 0.32885328744861403 and parameters: {'n_estimators': 484, 'max_depth': 50, 'min_samples_split': 2, 'min_samples_leaf': 1, 'max_features': 'sqrt', 'bootstrap': False, 'criterion': 'squared_error'}. Best is trial 1631 with value: 0.32128932742921457.
[I 2024-12-04 20:33:42,410] Trial 2322 finished with value: 1.2334709219459523 and parameters: {'n_estimators': 677, 'max_depth': 21, 'min_samples_split': 2, 'min_samples_leaf': 13, 'max_features': 'sqrt', 'bootstrap': True, 'criterion': 'squared_error'}. Best is trial 1631 with value: 0.32128932742921457.
[I 2024-12-04 20:33:42,411] Trial 2321 finished with value: 1.1682926305070174 and parameters: {'n_estimators': 761, 'max_depth': 38, 'min_samples_split': 3, 'min_samples_leaf': 2, 'max_features': 'log2', 'bootstrap': True, 'criterion': 'squared_error'}. Best is trial 1631 with value: 0.32128932742921457.
[I 2024-12-04 20:33:44,008] Trial 2323 finished with value: 0.6666564045233554 and parameters: {'n_estimators': 336, 'max_depth': 50, 'min_samples_split': 2, 'min_samples_leaf': 2, 'max_features': 'sqrt', 'bootstrap': False, 'criterion': 'squared_error'}. Best is trial 1631 with value: 0.32128932742921457.
[I 2024-12-04 20:33:45,287] Trial 2324 finished with value: 0.5373604508102592 and parameters: {'n_estimators': 258, 'max_depth': 42, 'min_samples_split': 2, 'min_samples_leaf': 2, 'max_features': None, 'bootstrap': False, 'criterion': 'squared_error'}. Best is trial 1631 with value: 0.32128932742921457.
[I 2024-12-04 20:33:46,631] Trial 2326 finished with value: 0.7937279381300599 and parameters: {'n_estimators': 359, 'max_depth': 40, 'min_samples_split': 2, 'min_samples_leaf': 2, 'max_features': 'sqrt', 'bootstrap': True, 'criterion': 'squared_error'}. Best is trial 1631 with value: 0.32128932742921457.
[I 2024-12-04 20:33:48,421] Trial 2325 finished with value: 0.4356859078391424 and parameters: {'n_estimators': 417, 'max_depth': 40, 'min_samples_split': 2, 'min_samples_leaf': 1, 'max_features': None, 'bootstrap': False, 'criterion': 'squared_error'}. Best is trial 1631 with value: 0.32128932742921457.
[I 2024-12-04 20:33:50,531] Trial 2328 finished with value: 0.3233404761379171 and parameters: {'n_estimators': 396, 'max_depth': 50, 'min_samples_split': 2, 'min_samples_leaf': 1, 'max_features': 'sqrt', 'bootstrap': False, 'criterion': 'squared_error'}. Best is trial 1631 with value: 0.32128932742921457.
[I 2024-12-04 20:33:51,733] Trial 2329 finished with value: 0.6760689963248838 and parameters: {'n_estimators': 312, 'max_depth': 42, 'min_samples_split': 2, 'min_samples_leaf': 2, 'max_features': 'sqrt', 'bootstrap': False, 'criterion': 'squared_error'}. Best is trial 1631 with value: 0.32128932742921457.
[I 2024-12-04 20:33:53,348] Trial 2330 finished with value: 0.3453333647683432 and parameters: {'n_estimators': 255, 'max_depth': 43, 'min_samples_split': 2, 'min_samples_leaf': 1, 'max_features': 'sqrt', 'bootstrap': False, 'criterion': 'squared_error'}. Best is trial 1631 with value: 0.32128932742921457.
[I 2024-12-04 20:33:55,554] Trial 2331 finished with value: 0.4994278162515064 and parameters: {'n_estimators': 436, 'max_depth': 40, 'min_samples_split': 11, 'min_samples_leaf': 3, 'max_features': None, 'bootstrap': True, 'criterion': 'squared_error'}. Best is trial 1631 with value: 0.32128932742921457.
[I 2024-12-04 20:33:56,925] Trial 2332 finished with value: 0.38574163898701297 and parameters: {'n_estimators': 266, 'max_depth': 50, 'min_samples_split': 4, 'min_samples_leaf': 1, 'max_features': 'sqrt', 'bootstrap': False, 'criterion': 'squared_error'}. Best is trial 1631 with value: 0.32128932742921457.
[I 2024-12-04 20:33:58,321] Trial 2327 finished with value: 0.34306351817134606 and parameters: {'n_estimators': 450, 'max_depth': 50, 'min_samples_split': 2, 'min_samples_leaf': 1, 'max_features': 'sqrt', 'bootstrap': False, 'criterion': 'absolute_error'}. Best is trial 1631 with value: 0.32128932742921457.
[I 2024-12-04 20:33:58,395] Trial 2333 finished with value: 0.6852747794955344 and parameters: {'n_estimators': 506, 'max_depth': 50, 'min_samples_split': 2, 'min_samples_leaf': 2, 'max_features': 'sqrt', 'bootstrap': False, 'criterion': 'squared_error'}. Best is trial 1631 with value: 0.32128932742921457.
[I 2024-12-04 20:33:59,906] Trial 2335 finished with value: 0.6629730186667114 and parameters: {'n_estimators': 258, 'max_depth': 50, 'min_samples_split': 2, 'min_samples_leaf': 2, 'max_features': 'sqrt', 'bootstrap': False, 'criterion': 'squared_error'}. Best is trial 1631 with value: 0.32128932742921457.
[I 2024-12-04 20:34:00,439] Trial 2334 finished with value: 0.3554719550576387 and parameters: {'n_estimators': 317, 'max_depth': 50, 'min_samples_split': 3, 'min_samples_leaf': 1, 'max_features': 'sqrt', 'bootstrap': False, 'criterion': 'squared_error'}. Best is trial 1631 with value: 0.32128932742921457.
[I 2024-12-04 20:34:02,088] Trial 2336 finished with value: 0.347429488067566 and parameters: {'n_estimators': 356, 'max_depth': 43, 'min_samples_split': 2, 'min_samples_leaf': 1, 'max_features': 'sqrt', 'bootstrap': False, 'criterion': 'squared_error'}. Best is trial 1631 with value: 0.32128932742921457.
[I 2024-12-04 20:34:03,792] Trial 2338 finished with value: 0.3251924253615176 and parameters: {'n_estimators': 265, 'max_depth': 50, 'min_samples_split': 2, 'min_samples_leaf': 1, 'max_features': 'sqrt', 'bootstrap': False, 'criterion': 'squared_error'}. Best is trial 1631 with value: 0.32128932742921457.
[I 2024-12-04 20:34:03,882] Trial 2337 finished with value: 0.43407479478960664 and parameters: {'n_estimators': 300, 'max_depth': 50, 'min_samples_split': 2, 'min_samples_leaf': 1, 'max_features': None, 'bootstrap': False, 'criterion': 'squared_error'}. Best is trial 1631 with value: 0.32128932742921457.
[I 2024-12-04 20:34:05,728] Trial 2340 finished with value: 0.3844109898783354 and parameters: {'n_estimators': 296, 'max_depth': 50, 'min_samples_split': 4, 'min_samples_leaf': 1, 'max_features': 'sqrt', 'bootstrap': False, 'criterion': 'squared_error'}. Best is trial 1631 with value: 0.32128932742921457.
[I 2024-12-04 20:34:06,900] Trial 2341 finished with value: 1.0563578286041675 and parameters: {'n_estimators': 364, 'max_depth': 49, 'min_samples_split': 2, 'min_samples_leaf': 2, 'max_features': 'log2', 'bootstrap': False, 'criterion': 'squared_error'}. Best is trial 1631 with value: 0.32128932742921457.
[I 2024-12-04 20:34:07,269] Trial 2339 finished with value: 0.3286210744876124 and parameters: {'n_estimators': 611, 'max_depth': 50, 'min_samples_split': 2, 'min_samples_leaf': 1, 'max_features': 'sqrt', 'bootstrap': False, 'criterion': 'squared_error'}. Best is trial 1631 with value: 0.32128932742921457.
[I 2024-12-04 20:34:08,992] Trial 2342 finished with value: 0.34580382695138095 and parameters: {'n_estimators': 328, 'max_depth': 42, 'min_samples_split': 2, 'min_samples_leaf': 1, 'max_features': 'sqrt', 'bootstrap': False, 'criterion': 'squared_error'}. Best is trial 1631 with value: 0.32128932742921457.
[I 2024-12-04 20:34:10,133] Trial 2343 finished with value: 0.3545946239129441 and parameters: {'n_estimators': 529, 'max_depth': 43, 'min_samples_split': 2, 'min_samples_leaf': 1, 'max_features': 'sqrt', 'bootstrap': False, 'criterion': 'squared_error'}. Best is trial 1631 with value: 0.32128932742921457.
[I 2024-12-04 20:34:10,792] Trial 2344 finished with value: 0.35548712016562395 and parameters: {'n_estimators': 315, 'max_depth': 50, 'min_samples_split': 3, 'min_samples_leaf': 1, 'max_features': 'sqrt', 'bootstrap': False, 'criterion': 'squared_error'}. Best is trial 1631 with value: 0.32128932742921457.
[I 2024-12-04 20:34:12,388] Trial 2346 finished with value: 1.2403227956803042 and parameters: {'n_estimators': 846, 'max_depth': 18, 'min_samples_split': 2, 'min_samples_leaf': 5, 'max_features': 'log2', 'bootstrap': False, 'criterion': 'squared_error'}. Best is trial 1631 with value: 0.32128932742921457.
[I 2024-12-04 20:34:12,464] Trial 2345 finished with value: 0.36174196910278955 and parameters: {'n_estimators': 419, 'max_depth': 50, 'min_samples_split': 3, 'min_samples_leaf': 1, 'max_features': 'sqrt', 'bootstrap': False, 'criterion': 'squared_error'}. Best is trial 1631 with value: 0.32128932742921457.
[I 2024-12-04 20:34:14,759] Trial 2348 finished with value: 0.34717800135021326 and parameters: {'n_estimators': 358, 'max_depth': 43, 'min_samples_split': 2, 'min_samples_leaf': 1, 'max_features': 'sqrt', 'bootstrap': False, 'criterion': 'squared_error'}. Best is trial 1631 with value: 0.32128932742921457.
[I 2024-12-04 20:34:14,851] Trial 2347 finished with value: 0.32299895226731473 and parameters: {'n_estimators': 393, 'max_depth': 50, 'min_samples_split': 2, 'min_samples_leaf': 1, 'max_features': 'sqrt', 'bootstrap': False, 'criterion': 'squared_error'}. Best is trial 1631 with value: 0.32128932742921457.
[I 2024-12-04 20:34:16,460] Trial 2350 finished with value: 0.6566246553346522 and parameters: {'n_estimators': 295, 'max_depth': 50, 'min_samples_split': 2, 'min_samples_leaf': 2, 'max_features': 'sqrt', 'bootstrap': False, 'criterion': 'squared_error'}. Best is trial 1631 with value: 0.32128932742921457.
[I 2024-12-04 20:34:18,143] Trial 2351 finished with value: 0.34540956987867705 and parameters: {'n_estimators': 271, 'max_depth': 43, 'min_samples_split': 2, 'min_samples_leaf': 1, 'max_features': 'sqrt', 'bootstrap': False, 'criterion': 'squared_error'}. Best is trial 1631 with value: 0.32128932742921457.
[I 2024-12-04 20:34:19,405] Trial 2352 finished with value: 0.5435923881420457 and parameters: {'n_estimators': 139, 'max_depth': 48, 'min_samples_split': 11, 'min_samples_leaf': 1, 'max_features': 'sqrt', 'bootstrap': False, 'criterion': 'squared_error'}. Best is trial 1631 with value: 0.32128932742921457.
[I 2024-12-04 20:34:20,574] Trial 2353 finished with value: 1.2786107118543175 and parameters: {'n_estimators': 594, 'max_depth': 35, 'min_samples_split': 9, 'min_samples_leaf': 15, 'max_features': 'log2', 'bootstrap': False, 'criterion': 'squared_error'}. Best is trial 1631 with value: 0.32128932742921457.
[I 2024-12-04 20:34:22,636] Trial 2354 finished with value: 0.38719324082613393 and parameters: {'n_estimators': 504, 'max_depth': 44, 'min_samples_split': 3, 'min_samples_leaf': 1, 'max_features': 'sqrt', 'bootstrap': False, 'criterion': 'squared_error'}. Best is trial 1631 with value: 0.32128932742921457.
[I 2024-12-04 20:34:24,578] Trial 2355 finished with value: 0.3223313558641211 and parameters: {'n_estimators': 340, 'max_depth': 50, 'min_samples_split': 2, 'min_samples_leaf': 1, 'max_features': 'sqrt', 'bootstrap': False, 'criterion': 'squared_error'}. Best is trial 1631 with value: 0.32128932742921457.
[I 2024-12-04 20:34:26,960] Trial 2356 finished with value: 0.3286664680299348 and parameters: {'n_estimators': 464, 'max_depth': 50, 'min_samples_split': 2, 'min_samples_leaf': 1, 'max_features': 'sqrt', 'bootstrap': False, 'criterion': 'squared_error'}. Best is trial 1631 with value: 0.32128932742921457.
[I 2024-12-04 20:34:29,167] Trial 2349 finished with value: 0.8837445385057611 and parameters: {'n_estimators': 810, 'max_depth': 46, 'min_samples_split': 26, 'min_samples_leaf': 1, 'max_features': 'log2', 'bootstrap': False, 'criterion': 'absolute_error'}. Best is trial 1631 with value: 0.32128932742921457.
[I 2024-12-04 20:34:29,748] Trial 2357 finished with value: 1.2802869756462036 and parameters: {'n_estimators': 986, 'max_depth': 49, 'min_samples_split': 2, 'min_samples_leaf': 12, 'max_features': 'sqrt', 'bootstrap': False, 'criterion': 'absolute_error'}. Best is trial 1631 with value: 0.32128932742921457.
[I 2024-12-04 20:34:31,387] Trial 2359 finished with value: 0.6904367321018474 and parameters: {'n_estimators': 516, 'max_depth': 42, 'min_samples_split': 4, 'min_samples_leaf': 2, 'max_features': 'sqrt', 'bootstrap': False, 'criterion': 'squared_error'}. Best is trial 1631 with value: 0.32128932742921457.
[I 2024-12-04 20:34:31,466] Trial 2358 finished with value: 0.3468953388765213 and parameters: {'n_estimators': 354, 'max_depth': 43, 'min_samples_split': 2, 'min_samples_leaf': 1, 'max_features': 'sqrt', 'bootstrap': False, 'criterion': 'squared_error'}. Best is trial 1631 with value: 0.32128932742921457.
[I 2024-12-04 20:34:33,244] Trial 2361 finished with value: 0.6925176463857973 and parameters: {'n_estimators': 474, 'max_depth': 43, 'min_samples_split': 2, 'min_samples_leaf': 2, 'max_features': 'sqrt', 'bootstrap': False, 'criterion': 'squared_error'}. Best is trial 1631 with value: 0.32128932742921457.
[I 2024-12-04 20:34:35,188] Trial 2362 finished with value: 0.43729834553214186 and parameters: {'n_estimators': 416, 'max_depth': 31, 'min_samples_split': 2, 'min_samples_leaf': 1, 'max_features': 'sqrt', 'bootstrap': False, 'criterion': 'squared_error'}. Best is trial 1631 with value: 0.32128932742921457.
[I 2024-12-04 20:34:36,887] Trial 2360 finished with value: 0.9221319154183586 and parameters: {'n_estimators': 374, 'max_depth': 27, 'min_samples_split': 50, 'min_samples_leaf': 1, 'max_features': 'sqrt', 'bootstrap': True, 'criterion': 'absolute_error'}. Best is trial 1631 with value: 0.32128932742921457.
[I 2024-12-04 20:34:37,928] Trial 2363 finished with value: 0.3288151073516544 and parameters: {'n_estimators': 499, 'max_depth': 50, 'min_samples_split': 2, 'min_samples_leaf': 1, 'max_features': 'sqrt', 'bootstrap': False, 'criterion': 'squared_error'}. Best is trial 1631 with value: 0.32128932742921457.
[I 2024-12-04 20:34:39,276] Trial 2364 finished with value: 0.32369937626844103 and parameters: {'n_estimators': 391, 'max_depth': 50, 'min_samples_split': 2, 'min_samples_leaf': 1, 'max_features': 'sqrt', 'bootstrap': False, 'criterion': 'squared_error'}. Best is trial 1631 with value: 0.32128932742921457.
[I 2024-12-04 20:34:39,916] Trial 2365 finished with value: 0.42836192159097275 and parameters: {'n_estimators': 472, 'max_depth': 40, 'min_samples_split': 4, 'min_samples_leaf': 1, 'max_features': 'sqrt', 'bootstrap': False, 'criterion': 'squared_error'}. Best is trial 1631 with value: 0.32128932742921457.
[I 2024-12-04 20:34:40,982] Trial 2366 finished with value: 0.6727381842170259 and parameters: {'n_estimators': 369, 'max_depth': 50, 'min_samples_split': 2, 'min_samples_leaf': 2, 'max_features': 'sqrt', 'bootstrap': False, 'criterion': 'squared_error'}. Best is trial 1631 with value: 0.32128932742921457.
[I 2024-12-04 20:34:42,314] Trial 2367 finished with value: 0.3235015797135766 and parameters: {'n_estimators': 360, 'max_depth': 50, 'min_samples_split': 2, 'min_samples_leaf': 1, 'max_features': 'sqrt', 'bootstrap': False, 'criterion': 'squared_error'}. Best is trial 1631 with value: 0.32128932742921457.
[I 2024-12-04 20:34:43,329] Trial 2368 finished with value: 0.32284333741137333 and parameters: {'n_estimators': 379, 'max_depth': 50, 'min_samples_split': 2, 'min_samples_leaf': 1, 'max_features': 'sqrt', 'bootstrap': False, 'criterion': 'squared_error'}. Best is trial 1631 with value: 0.32128932742921457.
[I 2024-12-04 20:34:44,317] Trial 2369 finished with value: 0.3865790898716905 and parameters: {'n_estimators': 364, 'max_depth': 50, 'min_samples_split': 4, 'min_samples_leaf': 1, 'max_features': 'sqrt', 'bootstrap': False, 'criterion': 'squared_error'}. Best is trial 1631 with value: 0.32128932742921457.
[I 2024-12-04 20:34:45,902] Trial 2370 finished with value: 0.39065039498106097 and parameters: {'n_estimators': 625, 'max_depth': 50, 'min_samples_split': 4, 'min_samples_leaf': 1, 'max_features': 'sqrt', 'bootstrap': False, 'criterion': 'squared_error'}. Best is trial 1631 with value: 0.32128932742921457.
[I 2024-12-04 20:34:47,106] Trial 2371 finished with value: 0.3554309716646234 and parameters: {'n_estimators': 525, 'max_depth': 42, 'min_samples_split': 2, 'min_samples_leaf': 1, 'max_features': 'sqrt', 'bootstrap': False, 'criterion': 'squared_error'}. Best is trial 1631 with value: 0.32128932742921457.
[I 2024-12-04 20:34:47,953] Trial 2372 finished with value: 0.3884110632862664 and parameters: {'n_estimators': 426, 'max_depth': 50, 'min_samples_split': 4, 'min_samples_leaf': 1, 'max_features': 'sqrt', 'bootstrap': False, 'criterion': 'squared_error'}. Best is trial 1631 with value: 0.32128932742921457.
[I 2024-12-04 20:34:48,952] Trial 2373 finished with value: 0.6916512663011058 and parameters: {'n_estimators': 461, 'max_depth': 50, 'min_samples_split': 2, 'min_samples_leaf': 2, 'max_features': 'sqrt', 'bootstrap': False, 'criterion': 'squared_error'}. Best is trial 1631 with value: 0.32128932742921457.
[I 2024-12-04 20:34:50,153] Trial 2374 finished with value: 1.2639614250319529 and parameters: {'n_estimators': 964, 'max_depth': 18, 'min_samples_split': 16, 'min_samples_leaf': 6, 'max_features': 'log2', 'bootstrap': True, 'criterion': 'squared_error'}. Best is trial 1631 with value: 0.32128932742921457.
[I 2024-12-04 20:34:51,357] Trial 2375 finished with value: 0.3235529079870083 and parameters: {'n_estimators': 337, 'max_depth': 50, 'min_samples_split': 2, 'min_samples_leaf': 1, 'max_features': 'sqrt', 'bootstrap': False, 'criterion': 'squared_error'}. Best is trial 1631 with value: 0.32128932742921457.
[I 2024-12-04 20:34:52,903] Trial 2376 finished with value: 0.3550541190800238 and parameters: {'n_estimators': 522, 'max_depth': 43, 'min_samples_split': 2, 'min_samples_leaf': 1, 'max_features': 'sqrt', 'bootstrap': False, 'criterion': 'squared_error'}. Best is trial 1631 with value: 0.32128932742921457.
[I 2024-12-04 20:34:52,981] Trial 2377 finished with value: 0.3991954545361543 and parameters: {'n_estimators': 329, 'max_depth': 43, 'min_samples_split': 3, 'min_samples_leaf': 1, 'max_features': 'sqrt', 'bootstrap': False, 'criterion': 'squared_error'}. Best is trial 1631 with value: 0.32128932742921457.
[I 2024-12-04 20:34:54,984] Trial 2379 finished with value: 1.1500466263208 and parameters: {'n_estimators': 821, 'max_depth': 44, 'min_samples_split': 12, 'min_samples_leaf': 9, 'max_features': 'sqrt', 'bootstrap': False, 'criterion': 'squared_error'}. Best is trial 1631 with value: 0.32128932742921457.
[I 2024-12-04 20:34:57,239] Trial 2380 finished with value: 0.3408226095256355 and parameters: {'n_estimators': 437, 'max_depth': 45, 'min_samples_split': 2, 'min_samples_leaf': 1, 'max_features': 'sqrt', 'bootstrap': False, 'criterion': 'squared_error'}. Best is trial 1631 with value: 0.32128932742921457.
[I 2024-12-04 20:34:57,697] Trial 2378 finished with value: 0.42926994051649575 and parameters: {'n_estimators': 455, 'max_depth': 50, 'min_samples_split': 3, 'min_samples_leaf': 1, 'max_features': None, 'bootstrap': False, 'criterion': 'squared_error'}. Best is trial 1631 with value: 0.32128932742921457.
[I 2024-12-04 20:34:59,079] Trial 2381 finished with value: 1.173155623450748 and parameters: {'n_estimators': 627, 'max_depth': 40, 'min_samples_split': 9, 'min_samples_leaf': 2, 'max_features': 'log2', 'bootstrap': True, 'criterion': 'squared_error'}. Best is trial 1631 with value: 0.32128932742921457.
[I 2024-12-04 20:35:00,585] Trial 2382 finished with value: 0.3278115791098966 and parameters: {'n_estimators': 449, 'max_depth': 50, 'min_samples_split': 2, 'min_samples_leaf': 1, 'max_features': 'sqrt', 'bootstrap': False, 'criterion': 'squared_error'}. Best is trial 1631 with value: 0.32128932742921457.
[I 2024-12-04 20:35:02,093] Trial 2384 finished with value: 0.40780319597236975 and parameters: {'n_estimators': 325, 'max_depth': 42, 'min_samples_split': 4, 'min_samples_leaf': 1, 'max_features': 'sqrt', 'bootstrap': False, 'criterion': 'squared_error'}. Best is trial 1631 with value: 0.32128932742921457.
[I 2024-12-04 20:35:02,613] Trial 2320 finished with value: 0.5540696335297476 and parameters: {'n_estimators': 848, 'max_depth': 7, 'min_samples_split': 7, 'min_samples_leaf': 1, 'max_features': None, 'bootstrap': False, 'criterion': 'absolute_error'}. Best is trial 1631 with value: 0.32128932742921457.
[I 2024-12-04 20:35:03,809] Trial 2385 finished with value: 0.6831748175883336 and parameters: {'n_estimators': 400, 'max_depth': 50, 'min_samples_split': 4, 'min_samples_leaf': 2, 'max_features': 'sqrt', 'bootstrap': False, 'criterion': 'squared_error'}. Best is trial 1631 with value: 0.32128932742921457.
[I 2024-12-04 20:35:05,009] Trial 2386 finished with value: 0.3239513504704164 and parameters: {'n_estimators': 356, 'max_depth': 50, 'min_samples_split': 2, 'min_samples_leaf': 1, 'max_features': 'sqrt', 'bootstrap': False, 'criterion': 'squared_error'}. Best is trial 1631 with value: 0.32128932742921457.
[I 2024-12-04 20:35:05,646] Trial 2387 finished with value: 0.3560278202396374 and parameters: {'n_estimators': 323, 'max_depth': 50, 'min_samples_split': 3, 'min_samples_leaf': 1, 'max_features': 'sqrt', 'bootstrap': False, 'criterion': 'squared_error'}. Best is trial 1631 with value: 0.32128932742921457.
[I 2024-12-04 20:35:06,218] Trial 2383 finished with value: 0.7432141330336841 and parameters: {'n_estimators': 650, 'max_depth': 14, 'min_samples_split': 4, 'min_samples_leaf': 12, 'max_features': None, 'bootstrap': True, 'criterion': 'absolute_error'}. Best is trial 1631 with value: 0.32128932742921457.
[I 2024-12-04 20:35:06,673] Trial 2388 finished with value: 0.8104576139651317 and parameters: {'n_estimators': 106, 'max_depth': 45, 'min_samples_split': 38, 'min_samples_leaf': 1, 'max_features': None, 'bootstrap': False, 'criterion': 'squared_error'}. Best is trial 1631 with value: 0.32128932742921457.
[I 2024-12-04 20:35:07,846] Trial 2389 finished with value: 0.701186346479875 and parameters: {'n_estimators': 373, 'max_depth': 33, 'min_samples_split': 2, 'min_samples_leaf': 2, 'max_features': 'sqrt', 'bootstrap': False, 'criterion': 'squared_error'}. Best is trial 1631 with value: 0.32128932742921457.
