[I 2024-12-04 11:51:30,383] A new study created in RDB with name: Tc_dt
[I 2024-12-04 11:51:34,041] Trial 6 finished with value: 0.998127234894583 and parameters: {'max_depth': 30, 'min_samples_split': 12, 'min_samples_leaf': 10, 'max_features': 'log2', 'criterion': 'squared_error', 'splitter': 'random'}. Best is trial 14 with value: 0.8136104269214312.
[I 2024-12-04 11:51:34,364] Trial 14 finished with value: 0.8136104269214312 and parameters: {'max_depth': 6, 'min_samples_split': 3, 'min_samples_leaf': 2, 'max_features': 'sqrt', 'criterion': 'friedman_mse', 'splitter': 'random'}. Best is trial 14 with value: 0.8136104269214312.
[I 2024-12-04 11:51:34,588] Trial 0 finished with value: 0.8147441264758328 and parameters: {'max_depth': 9, 'min_samples_split': 13, 'min_samples_leaf': 2, 'max_features': 'sqrt', 'criterion': 'friedman_mse', 'splitter': 'best'}. Best is trial 14 with value: 0.8136104269214312.
[I 2024-12-04 11:51:35,138] Trial 16 finished with value: 0.9254388779931642 and parameters: {'max_depth': 6, 'min_samples_split': 7, 'min_samples_leaf': 4, 'max_features': 'sqrt', 'criterion': 'friedman_mse', 'splitter': 'random'}. Best is trial 3 with value: 0.6122970500864531.
[I 2024-12-04 11:51:35,578] Trial 13 finished with value: 0.7053925734892873 and parameters: {'max_depth': 12, 'min_samples_split': 10, 'min_samples_leaf': 1, 'max_features': 'sqrt', 'criterion': 'absolute_error', 'splitter': 'best'}. Best is trial 3 with value: 0.6122970500864531.
[I 2024-12-04 11:51:35,833] Trial 2 finished with value: 0.998127234894583 and parameters: {'max_depth': 20, 'min_samples_split': 12, 'min_samples_leaf': 10, 'max_features': 'log2', 'criterion': 'friedman_mse', 'splitter': 'random'}. Best is trial 3 with value: 0.6122970500864531.
[I 2024-12-04 11:51:36,074] Trial 3 finished with value: 0.6122970500864531 and parameters: {'max_depth': 25, 'min_samples_split': 4, 'min_samples_leaf': 4, 'max_features': 'sqrt', 'criterion': 'squared_error', 'splitter': 'best'}. Best is trial 3 with value: 0.6122970500864531.
[I 2024-12-04 11:51:37,454] Trial 9 finished with value: 0.9984670529576771 and parameters: {'max_depth': 27, 'min_samples_split': 8, 'min_samples_leaf': 8, 'max_features': 'log2', 'criterion': 'absolute_error', 'splitter': 'random'}. Best is trial 3 with value: 0.6122970500864531.
[I 2024-12-04 11:51:37,540] Trial 7 finished with value: 0.6993859008636415 and parameters: {'max_depth': 17, 'min_samples_split': 5, 'min_samples_leaf': 6, 'max_features': 'sqrt', 'criterion': 'squared_error', 'splitter': 'best'}. Best is trial 3 with value: 0.6122970500864531.
[I 2024-12-04 11:51:37,929] Trial 24 finished with value: 0.9571428051540888 and parameters: {'max_depth': 4, 'min_samples_split': 12, 'min_samples_leaf': 7, 'max_features': 'sqrt', 'criterion': 'absolute_error', 'splitter': 'best'}. Best is trial 3 with value: 0.6122970500864531.
[I 2024-12-04 11:51:37,938] Trial 21 finished with value: 0.6255389426566114 and parameters: {'max_depth': 25, 'min_samples_split': 16, 'min_samples_leaf': 1, 'max_features': 'sqrt', 'criterion': 'absolute_error', 'splitter': 'best'}. Best is trial 3 with value: 0.6122970500864531.
[I 2024-12-04 11:51:38,134] Trial 5 finished with value: 0.9672606808904554 and parameters: {'max_depth': 11, 'min_samples_split': 4, 'min_samples_leaf': 7, 'max_features': 'sqrt', 'criterion': 'absolute_error', 'splitter': 'random'}. Best is trial 3 with value: 0.6122970500864531.
[I 2024-12-04 11:51:38,292] Trial 28 finished with value: 0.7921957921338103 and parameters: {'max_depth': 35, 'min_samples_split': 18, 'min_samples_leaf': 8, 'max_features': 'sqrt', 'criterion': 'absolute_error', 'splitter': 'best'}. Best is trial 3 with value: 0.6122970500864531.
[I 2024-12-04 11:51:38,340] Trial 10 finished with value: 0.9592348303220608 and parameters: {'max_depth': 3, 'min_samples_split': 16, 'min_samples_leaf': 3, 'max_features': 'sqrt', 'criterion': 'squared_error', 'splitter': 'best'}. Best is trial 3 with value: 0.6122970500864531.
[I 2024-12-04 11:51:38,821] Trial 4 finished with value: 0.9025786389791691 and parameters: {'max_depth': 9, 'min_samples_split': 15, 'min_samples_leaf': 2, 'max_features': 'log2', 'criterion': 'absolute_error', 'splitter': 'random'}. Best is trial 3 with value: 0.6122970500864531.
[I 2024-12-04 11:51:39,567] Trial 15 finished with value: 0.9597516113963797 and parameters: {'max_depth': 19, 'min_samples_split': 20, 'min_samples_leaf': 9, 'max_features': 'sqrt', 'criterion': 'squared_error', 'splitter': 'random'}. Best is trial 12 with value: 0.5520365748377991.
[I 2024-12-04 11:51:39,872] Trial 12 finished with value: 0.5520365748377991 and parameters: {'max_depth': 24, 'min_samples_split': 3, 'min_samples_leaf': 1, 'max_features': 'sqrt', 'criterion': 'friedman_mse', 'splitter': 'best'}. Best is trial 8 with value: 0.4856187310523648.
[I 2024-12-04 11:51:40,491] Trial 8 finished with value: 0.4856187310523648 and parameters: {'max_depth': 34, 'min_samples_split': 13, 'min_samples_leaf': 1, 'max_features': 'sqrt', 'criterion': 'squared_error', 'splitter': 'best'}. Best is trial 8 with value: 0.4856187310523648.
[I 2024-12-04 11:51:40,616] Trial 11 finished with value: 0.9986705309945677 and parameters: {'max_depth': 21, 'min_samples_split': 17, 'min_samples_leaf': 7, 'max_features': 'log2', 'criterion': 'absolute_error', 'splitter': 'best'}. Best is trial 8 with value: 0.4856187310523648.
[I 2024-12-04 11:51:40,991] Trial 25 finished with value: 0.9627087678848097 and parameters: {'max_depth': 11, 'min_samples_split': 14, 'min_samples_leaf': 5, 'max_features': 'log2', 'criterion': 'absolute_error', 'splitter': 'random'}. Best is trial 8 with value: 0.4856187310523648.
[I 2024-12-04 11:51:41,149] Trial 17 finished with value: 0.9672606808904554 and parameters: {'max_depth': 4, 'min_samples_split': 15, 'min_samples_leaf': 7, 'max_features': 'sqrt', 'criterion': 'absolute_error', 'splitter': 'random'}. Best is trial 8 with value: 0.4856187310523648.
[I 2024-12-04 11:51:41,510] Trial 20 finished with value: 0.5791329763390185 and parameters: {'max_depth': 20, 'min_samples_split': 2, 'min_samples_leaf': 1, 'max_features': 'sqrt', 'criterion': 'friedman_mse', 'splitter': 'best'}. Best is trial 8 with value: 0.4856187310523648.
[I 2024-12-04 11:51:41,887] Trial 1 finished with value: 0.5457671470124494 and parameters: {'max_depth': 31, 'min_samples_split': 12, 'min_samples_leaf': 2, 'max_features': 'sqrt', 'criterion': 'squared_error', 'splitter': 'best'}. Best is trial 8 with value: 0.4856187310523648.
[I 2024-12-04 11:51:42,312] Trial 27 finished with value: 0.8950106185763959 and parameters: {'max_depth': 15, 'min_samples_split': 11, 'min_samples_leaf': 3, 'max_features': 'log2', 'criterion': 'friedman_mse', 'splitter': 'random'}. Best is trial 8 with value: 0.4856187310523648.
[I 2024-12-04 11:51:42,385] Trial 31 finished with value: 0.6108494050281353 and parameters: {'max_depth': 25, 'min_samples_split': 2, 'min_samples_leaf': 2, 'max_features': 'sqrt', 'criterion': 'friedman_mse', 'splitter': 'best'}. Best is trial 8 with value: 0.4856187310523648.
[I 2024-12-04 11:51:42,750] Trial 23 finished with value: 0.8532774108231377 and parameters: {'max_depth': 20, 'min_samples_split': 17, 'min_samples_leaf': 4, 'max_features': 'sqrt', 'criterion': 'absolute_error', 'splitter': 'random'}. Best is trial 8 with value: 0.4856187310523648.
[I 2024-12-04 11:51:43,025] Trial 26 finished with value: 0.4893880153830252 and parameters: {'max_depth': 34, 'min_samples_split': 16, 'min_samples_leaf': 1, 'max_features': 'sqrt', 'criterion': 'squared_error', 'splitter': 'best'}. Best is trial 8 with value: 0.4856187310523648.
[I 2024-12-04 11:51:43,747] Trial 18 finished with value: 0.7844362007659383 and parameters: {'max_depth': 19, 'min_samples_split': 2, 'min_samples_leaf': 7, 'max_features': 'sqrt', 'criterion': 'absolute_error', 'splitter': 'best'}. Best is trial 8 with value: 0.4856187310523648.
[I 2024-12-04 11:51:44,072] Trial 22 finished with value: 0.9768226224263046 and parameters: {'max_depth': 1, 'min_samples_split': 2, 'min_samples_leaf': 2, 'max_features': 'sqrt', 'criterion': 'absolute_error', 'splitter': 'best'}. Best is trial 8 with value: 0.4856187310523648.
[I 2024-12-04 11:51:44,193] Trial 30 finished with value: 0.8528917785452107 and parameters: {'max_depth': 34, 'min_samples_split': 2, 'min_samples_leaf': 3, 'max_features': 'log2', 'criterion': 'squared_error', 'splitter': 'best'}. Best is trial 8 with value: 0.4856187310523648.
[I 2024-12-04 11:51:44,542] Trial 19 finished with value: 0.9672606808904554 and parameters: {'max_depth': 15, 'min_samples_split': 8, 'min_samples_leaf': 9, 'max_features': 'sqrt', 'criterion': 'absolute_error', 'splitter': 'random'}. Best is trial 41 with value: 0.47393114690358407.
[I 2024-12-04 11:51:45,477] Trial 41 finished with value: 0.47393114690358407 and parameters: {'max_depth': 33, 'min_samples_split': 10, 'min_samples_leaf': 1, 'max_features': 'sqrt', 'criterion': 'squared_error', 'splitter': 'best'}. Best is trial 40 with value: 0.4615785299849214.
[I 2024-12-04 11:51:45,723] Trial 40 finished with value: 0.4615785299849214 and parameters: {'max_depth': 35, 'min_samples_split': 10, 'min_samples_leaf': 1, 'max_features': 'sqrt', 'criterion': 'friedman_mse', 'splitter': 'best'}. Best is trial 40 with value: 0.4615785299849214.
[I 2024-12-04 11:51:45,797] Trial 44 finished with value: 0.572384168373952 and parameters: {'max_depth': 24, 'min_samples_split': 13, 'min_samples_leaf': 1, 'max_features': 'sqrt', 'criterion': 'squared_error', 'splitter': 'best'}. Best is trial 40 with value: 0.4615785299849214.
[I 2024-12-04 11:51:45,802] Trial 33 finished with value: 0.584300197786044 and parameters: {'max_depth': 35, 'min_samples_split': 17, 'min_samples_leaf': 3, 'max_features': 'sqrt', 'criterion': 'squared_error', 'splitter': 'best'}. Best is trial 40 with value: 0.4615785299849214.
[I 2024-12-04 11:51:46,299] Trial 35 finished with value: 0.8558428381311738 and parameters: {'max_depth': 33, 'min_samples_split': 14, 'min_samples_leaf': 3, 'max_features': 'log2', 'criterion': 'squared_error', 'splitter': 'best'}. Best is trial 40 with value: 0.4615785299849214.
[I 2024-12-04 11:51:46,395] Trial 29 finished with value: 0.6122970500864531 and parameters: {'max_depth': 30, 'min_samples_split': 8, 'min_samples_leaf': 4, 'max_features': 'sqrt', 'criterion': 'squared_error', 'splitter': 'best'}. Best is trial 40 with value: 0.4615785299849214.
[I 2024-12-04 11:51:47,050] Trial 36 finished with value: 0.5858505599509766 and parameters: {'max_depth': 35, 'min_samples_split': 10, 'min_samples_leaf': 3, 'max_features': 'sqrt', 'criterion': 'friedman_mse', 'splitter': 'best'}. Best is trial 40 with value: 0.4615785299849214.
[I 2024-12-04 11:51:47,094] Trial 50 finished with value: 0.5615513230084576 and parameters: {'max_depth': 30, 'min_samples_split': 10, 'min_samples_leaf': 2, 'max_features': 'sqrt', 'criterion': 'friedman_mse', 'splitter': 'best'}. Best is trial 40 with value: 0.4615785299849214.
[I 2024-12-04 11:51:47,116] Trial 37 finished with value: 0.524743745773334 and parameters: {'max_depth': 31, 'min_samples_split': 11, 'min_samples_leaf': 1, 'max_features': 'sqrt', 'criterion': 'squared_error', 'splitter': 'best'}. Best is trial 40 with value: 0.4615785299849214.
[I 2024-12-04 11:51:47,319] Trial 32 finished with value: 0.7085709199360362 and parameters: {'max_depth': 33, 'min_samples_split': 13, 'min_samples_leaf': 2, 'max_features': 'sqrt', 'criterion': 'squared_error', 'splitter': 'random'}. Best is trial 40 with value: 0.4615785299849214.
[I 2024-12-04 11:51:48,246] Trial 34 finished with value: 0.5220453594633404 and parameters: {'max_depth': 29, 'min_samples_split': 14, 'min_samples_leaf': 1, 'max_features': 'sqrt', 'criterion': 'friedman_mse', 'splitter': 'best'}. Best is trial 40 with value: 0.4615785299849214.
[I 2024-12-04 11:51:48,319] Trial 39 finished with value: 0.8950106185763959 and parameters: {'max_depth': 35, 'min_samples_split': 9, 'min_samples_leaf': 2, 'max_features': 'log2', 'criterion': 'squared_error', 'splitter': 'random'}. Best is trial 40 with value: 0.4615785299849214.
[I 2024-12-04 11:51:48,320] Trial 46 finished with value: 0.464037521734687 and parameters: {'max_depth': 32, 'min_samples_split': 7, 'min_samples_leaf': 1, 'max_features': 'sqrt', 'criterion': 'squared_error', 'splitter': 'best'}. Best is trial 40 with value: 0.4615785299849214.
[I 2024-12-04 11:51:48,324] Trial 45 finished with value: 0.6111702909856213 and parameters: {'max_depth': 32, 'min_samples_split': 9, 'min_samples_leaf': 1, 'max_features': 'log2', 'criterion': 'absolute_error', 'splitter': 'best'}. Best is trial 40 with value: 0.4615785299849214.
[I 2024-12-04 11:51:49,117] Trial 49 finished with value: 0.599456244739525 and parameters: {'max_depth': 32, 'min_samples_split': 8, 'min_samples_leaf': 1, 'max_features': 'sqrt', 'criterion': 'absolute_error', 'splitter': 'best'}. Best is trial 40 with value: 0.4615785299849214.
[I 2024-12-04 11:51:49,634] Trial 57 finished with value: 0.8459501508715142 and parameters: {'max_depth': 28, 'min_samples_split': 10, 'min_samples_leaf': 2, 'max_features': 'log2', 'criterion': 'friedman_mse', 'splitter': 'best'}. Best is trial 40 with value: 0.4615785299849214.
[I 2024-12-04 11:51:49,900] Trial 42 finished with value: 0.5985672451752339 and parameters: {'max_depth': 30, 'min_samples_split': 12, 'min_samples_leaf': 1, 'max_features': 'sqrt', 'criterion': 'friedman_mse', 'splitter': 'random'}. Best is trial 40 with value: 0.4615785299849214.
[I 2024-12-04 11:51:50,205] Trial 48 finished with value: 0.5728355783602134 and parameters: {'max_depth': 32, 'min_samples_split': 12, 'min_samples_leaf': 2, 'max_features': 'sqrt', 'criterion': 'squared_error', 'splitter': 'best'}. Best is trial 40 with value: 0.4615785299849214.
[I 2024-12-04 11:51:50,336] Trial 53 finished with value: 0.8459501508715142 and parameters: {'max_depth': 29, 'min_samples_split': 11, 'min_samples_leaf': 2, 'max_features': 'log2', 'criterion': 'friedman_mse', 'splitter': 'best'}. Best is trial 40 with value: 0.4615785299849214.
[I 2024-12-04 11:51:50,353] Trial 43 finished with value: 0.6136645518931785 and parameters: {'max_depth': 30, 'min_samples_split': 8, 'min_samples_leaf': 1, 'max_features': 'sqrt', 'criterion': 'absolute_error', 'splitter': 'best'}. Best is trial 40 with value: 0.4615785299849214.
[I 2024-12-04 11:51:50,510] Trial 55 finished with value: 0.5723335982999247 and parameters: {'max_depth': 35, 'min_samples_split': 7, 'min_samples_leaf': 2, 'max_features': 'sqrt', 'criterion': 'squared_error', 'splitter': 'best'}. Best is trial 40 with value: 0.4615785299849214.
[I 2024-12-04 11:51:51,544] Trial 52 finished with value: 0.7141198961329461 and parameters: {'max_depth': 27, 'min_samples_split': 5, 'min_samples_leaf': 2, 'max_features': 'sqrt', 'criterion': 'squared_error', 'splitter': 'random'}. Best is trial 40 with value: 0.4615785299849214.
[I 2024-12-04 11:51:51,551] Trial 56 finished with value: 0.483263059820054 and parameters: {'max_depth': 35, 'min_samples_split': 5, 'min_samples_leaf': 1, 'max_features': 'sqrt', 'criterion': 'squared_error', 'splitter': 'best'}. Best is trial 40 with value: 0.4615785299849214.
[I 2024-12-04 11:51:53,244] Trial 51 finished with value: 0.536924320260066 and parameters: {'max_depth': 35, 'min_samples_split': 19, 'min_samples_leaf': 1, 'max_features': 'sqrt', 'criterion': 'friedman_mse', 'splitter': 'best'}. Best is trial 40 with value: 0.4615785299849214.
[I 2024-12-04 11:51:53,815] Trial 64 finished with value: 0.529040529724078 and parameters: {'max_depth': 33, 'min_samples_split': 15, 'min_samples_leaf': 1, 'max_features': 'sqrt', 'criterion': 'squared_error', 'splitter': 'best'}. Best is trial 40 with value: 0.4615785299849214.
[I 2024-12-04 11:51:54,971] Trial 58 finished with value: 0.9982171095081254 and parameters: {'max_depth': 20, 'min_samples_split': 13, 'min_samples_leaf': 10, 'max_features': 'log2', 'criterion': 'squared_error', 'splitter': 'best'}. Best is trial 40 with value: 0.4615785299849214.
[I 2024-12-04 11:51:55,108] Trial 54 finished with value: 0.9951113949916897 and parameters: {'max_depth': 3, 'min_samples_split': 17, 'min_samples_leaf': 1, 'max_features': 'log2', 'criterion': 'squared_error', 'splitter': 'best'}. Best is trial 40 with value: 0.4615785299849214.
[I 2024-12-04 11:51:55,147] Trial 38 finished with value: 0.5219692402050379 and parameters: {'max_depth': 29, 'min_samples_split': 6, 'min_samples_leaf': 1, 'max_features': 'sqrt', 'criterion': 'squared_error', 'splitter': 'best'}. Best is trial 40 with value: 0.4615785299849214.
[I 2024-12-04 11:51:55,158] Trial 63 finished with value: 0.5631049438224518 and parameters: {'max_depth': 35, 'min_samples_split': 8, 'min_samples_leaf': 2, 'max_features': 'sqrt', 'criterion': 'squared_error', 'splitter': 'best'}. Best is trial 40 with value: 0.4615785299849214.
[I 2024-12-04 11:51:55,753] Trial 47 finished with value: 0.47388125769898354 and parameters: {'max_depth': 34, 'min_samples_split': 7, 'min_samples_leaf': 1, 'max_features': 'sqrt', 'criterion': 'squared_error', 'splitter': 'best'}. Best is trial 40 with value: 0.4615785299849214.
[I 2024-12-04 11:51:55,951] Trial 59 finished with value: 0.4956835384456977 and parameters: {'max_depth': 30, 'min_samples_split': 2, 'min_samples_leaf': 1, 'max_features': 'sqrt', 'criterion': 'squared_error', 'splitter': 'best'}. Best is trial 40 with value: 0.4615785299849214.
[I 2024-12-04 11:51:56,040] Trial 70 finished with value: 0.9982171095081254 and parameters: {'max_depth': 15, 'min_samples_split': 6, 'min_samples_leaf': 6, 'max_features': 'log2', 'criterion': 'friedman_mse', 'splitter': 'best'}. Best is trial 40 with value: 0.4615785299849214.
[I 2024-12-04 11:51:56,133] Trial 65 finished with value: 0.5023968247525797 and parameters: {'max_depth': 33, 'min_samples_split': 8, 'min_samples_leaf': 1, 'max_features': 'sqrt', 'criterion': 'friedman_mse', 'splitter': 'best'}. Best is trial 40 with value: 0.4615785299849214.
[I 2024-12-04 11:51:56,159] Trial 71 finished with value: 0.5946665656163351 and parameters: {'max_depth': 34, 'min_samples_split': 16, 'min_samples_leaf': 1, 'max_features': 'sqrt', 'criterion': 'absolute_error', 'splitter': 'best'}. Best is trial 40 with value: 0.4615785299849214.
[I 2024-12-04 11:51:56,384] Trial 61 finished with value: 0.5965665531113545 and parameters: {'max_depth': 28, 'min_samples_split': 18, 'min_samples_leaf': 1, 'max_features': 'sqrt', 'criterion': 'squared_error', 'splitter': 'best'}. Best is trial 40 with value: 0.4615785299849214.
[I 2024-12-04 11:51:56,630] Trial 62 finished with value: 0.9618554461006263 and parameters: {'max_depth': 2, 'min_samples_split': 13, 'min_samples_leaf': 7, 'max_features': 'log2', 'criterion': 'squared_error', 'splitter': 'random'}. Best is trial 40 with value: 0.4615785299849214.
[I 2024-12-04 11:51:57,145] Trial 68 finished with value: 0.5414785383435796 and parameters: {'max_depth': 33, 'min_samples_split': 10, 'min_samples_leaf': 1, 'max_features': 'log2', 'criterion': 'squared_error', 'splitter': 'best'}. Best is trial 40 with value: 0.4615785299849214.
[I 2024-12-04 11:51:57,250] Trial 73 finished with value: 0.733378088237453 and parameters: {'max_depth': 32, 'min_samples_split': 9, 'min_samples_leaf': 4, 'max_features': 'sqrt', 'criterion': 'absolute_error', 'splitter': 'random'}. Best is trial 40 with value: 0.4615785299849214.
[I 2024-12-04 11:51:57,891] Trial 60 finished with value: 0.8950106185763959 and parameters: {'max_depth': 12, 'min_samples_split': 2, 'min_samples_leaf': 3, 'max_features': 'log2', 'criterion': 'squared_error', 'splitter': 'random'}. Best is trial 40 with value: 0.4615785299849214.
[I 2024-12-04 11:51:58,098] Trial 72 finished with value: 0.6519234402708987 and parameters: {'max_depth': 27, 'min_samples_split': 19, 'min_samples_leaf': 1, 'max_features': 'log2', 'criterion': 'squared_error', 'splitter': 'best'}. Best is trial 40 with value: 0.4615785299849214.
[I 2024-12-04 11:51:58,104] Trial 66 finished with value: 0.483263059820054 and parameters: {'max_depth': 35, 'min_samples_split': 5, 'min_samples_leaf': 1, 'max_features': 'sqrt', 'criterion': 'squared_error', 'splitter': 'best'}. Best is trial 40 with value: 0.4615785299849214.
[I 2024-12-04 11:51:58,105] Trial 69 finished with value: 0.9395422579867189 and parameters: {'max_depth': 4, 'min_samples_split': 12, 'min_samples_leaf': 1, 'max_features': 'sqrt', 'criterion': 'squared_error', 'splitter': 'random'}. Best is trial 40 with value: 0.4615785299849214.
[I 2024-12-04 11:51:58,407] Trial 81 finished with value: 0.9597516113963797 and parameters: {'max_depth': 22, 'min_samples_split': 4, 'min_samples_leaf': 8, 'max_features': 'sqrt', 'criterion': 'squared_error', 'splitter': 'random'}. Best is trial 40 with value: 0.4615785299849214.
[I 2024-12-04 11:51:58,660] Trial 74 finished with value: 0.4731246660157492 and parameters: {'max_depth': 33, 'min_samples_split': 9, 'min_samples_leaf': 1, 'max_features': 'sqrt', 'criterion': 'squared_error', 'splitter': 'best'}. Best is trial 40 with value: 0.4615785299849214.
[I 2024-12-04 11:51:59,858] Trial 76 finished with value: 0.9597516113963797 and parameters: {'max_depth': 34, 'min_samples_split': 9, 'min_samples_leaf': 8, 'max_features': 'sqrt', 'criterion': 'squared_error', 'splitter': 'random'}. Best is trial 80 with value: 0.4608356013331615.
[I 2024-12-04 11:52:00,247] Trial 75 finished with value: 0.6283477646326019 and parameters: {'max_depth': 24, 'min_samples_split': 16, 'min_samples_leaf': 1, 'max_features': 'sqrt', 'criterion': 'squared_error', 'splitter': 'random'}. Best is trial 80 with value: 0.4608356013331615.
