[I 2024-12-04 14:49:22,180] Trial 269 finished with value: 0.592369280736354 and parameters: {'n_estimators': 1024, 'learning_rate': 0.016334886568694237, 'max_depth': 11, 'min_samples_split': 19, 'min_samples_leaf': 1, 'subsample': 0.8908901399801485, 'max_features': 'log2'}. Best is trial 167 with value: 0.47128001676423487.
[I 2024-12-04 14:49:24,546] Trial 289 finished with value: 0.49621941343117876 and parameters: {'n_estimators': 302, 'learning_rate': 0.02541090680112586, 'max_depth': 12, 'min_samples_split': 15, 'min_samples_leaf': 1, 'subsample': 0.997462163040506, 'max_features': None}. Best is trial 167 with value: 0.47128001676423487.
[I 2024-12-04 14:49:24,583] Trial 271 finished with value: 0.5106156125618391 and parameters: {'n_estimators': 834, 'learning_rate': 0.019946635345604508, 'max_depth': 12, 'min_samples_split': 14, 'min_samples_leaf': 1, 'subsample': 0.9619997598483335, 'max_features': None}. Best is trial 167 with value: 0.47128001676423487.
[I 2024-12-04 14:49:30,435] Trial 274 finished with value: 0.49442402511824024 and parameters: {'n_estimators': 920, 'learning_rate': 0.06280253593713256, 'max_depth': 12, 'min_samples_split': 16, 'min_samples_leaf': 1, 'subsample': 0.8994401779611961, 'max_features': None}. Best is trial 167 with value: 0.47128001676423487.
[I 2024-12-04 14:49:30,613] Trial 276 finished with value: 0.4825382434351794 and parameters: {'n_estimators': 728, 'learning_rate': 0.08794740758225927, 'max_depth': 10, 'min_samples_split': 20, 'min_samples_leaf': 1, 'subsample': 0.9866987022149274, 'max_features': None}. Best is trial 167 with value: 0.47128001676423487.
[I 2024-12-04 14:49:31,909] Trial 287 finished with value: 0.5806156353531986 and parameters: {'n_estimators': 578, 'learning_rate': 0.026668993817333016, 'max_depth': 12, 'min_samples_split': 17, 'min_samples_leaf': 2, 'subsample': 0.9120761182282207, 'max_features': None}. Best is trial 167 with value: 0.47128001676423487.
[I 2024-12-04 14:49:32,783] Trial 284 finished with value: 0.4867056524905531 and parameters: {'n_estimators': 605, 'learning_rate': 0.04504409134305838, 'max_depth': 10, 'min_samples_split': 20, 'min_samples_leaf': 1, 'subsample': 0.9693085872809727, 'max_features': None}. Best is trial 167 with value: 0.47128001676423487.
[I 2024-12-04 14:49:33,412] Trial 278 finished with value: 0.5131995475665833 and parameters: {'n_estimators': 738, 'learning_rate': 0.02251044637671143, 'max_depth': 10, 'min_samples_split': 16, 'min_samples_leaf': 1, 'subsample': 0.7715198194965666, 'max_features': None}. Best is trial 167 with value: 0.47128001676423487.
[I 2024-12-04 14:49:33,902] Trial 272 finished with value: 0.48831209244820645 and parameters: {'n_estimators': 1034, 'learning_rate': 0.08763820923909332, 'max_depth': 10, 'min_samples_split': 16, 'min_samples_leaf': 1, 'subsample': 0.9506598524855633, 'max_features': None}. Best is trial 167 with value: 0.47128001676423487.
[I 2024-12-04 14:49:35,076] Trial 282 finished with value: 0.4935157556940477 and parameters: {'n_estimators': 818, 'learning_rate': 0.05385764366421626, 'max_depth': 12, 'min_samples_split': 19, 'min_samples_leaf': 1, 'subsample': 0.8426557952433131, 'max_features': None}. Best is trial 167 with value: 0.47128001676423487.
[I 2024-12-04 14:49:35,762] Trial 286 finished with value: 0.6952484787299101 and parameters: {'n_estimators': 783, 'learning_rate': 0.09817122021009096, 'max_depth': 7, 'min_samples_split': 15, 'min_samples_leaf': 3, 'subsample': 0.8692641879072345, 'max_features': None}. Best is trial 167 with value: 0.47128001676423487.
[I 2024-12-04 14:49:36,398] Trial 293 finished with value: 0.49248585904914854 and parameters: {'n_estimators': 561, 'learning_rate': 0.03722329662297167, 'max_depth': 11, 'min_samples_split': 19, 'min_samples_leaf': 1, 'subsample': 0.8933252673152341, 'max_features': None}. Best is trial 167 with value: 0.47128001676423487.
[I 2024-12-04 14:49:37,144] Trial 275 finished with value: 0.5066580810399702 and parameters: {'n_estimators': 981, 'learning_rate': 0.08309362648228599, 'max_depth': 10, 'min_samples_split': 19, 'min_samples_leaf': 1, 'subsample': 0.9221459308077491, 'max_features': None}. Best is trial 167 with value: 0.47128001676423487.
[I 2024-12-04 14:49:37,741] Trial 299 finished with value: 0.7333352534596441 and parameters: {'n_estimators': 574, 'learning_rate': 0.0204261186646821, 'max_depth': 9, 'min_samples_split': 19, 'min_samples_leaf': 2, 'subsample': 0.7378782629042395, 'max_features': 'log2'}. Best is trial 167 with value: 0.47128001676423487.
[I 2024-12-04 14:49:38,973] Trial 300 finished with value: 0.8491011421432512 and parameters: {'n_estimators': 573, 'learning_rate': 0.0451710960011692, 'max_depth': 11, 'min_samples_split': 12, 'min_samples_leaf': 9, 'subsample': 0.9533012739486078, 'max_features': 'log2'}. Best is trial 167 with value: 0.47128001676423487.
[I 2024-12-04 14:49:39,017] Trial 285 finished with value: 0.5113060494957858 and parameters: {'n_estimators': 874, 'learning_rate': 0.031038781407352917, 'max_depth': 9, 'min_samples_split': 19, 'min_samples_leaf': 1, 'subsample': 0.8445533054637885, 'max_features': None}. Best is trial 167 with value: 0.47128001676423487.
[I 2024-12-04 14:49:39,051] Trial 280 finished with value: 0.49752505279756265 and parameters: {'n_estimators': 1028, 'learning_rate': 0.07617631747812979, 'max_depth': 8, 'min_samples_split': 19, 'min_samples_leaf': 1, 'subsample': 0.9588771533905562, 'max_features': None}. Best is trial 167 with value: 0.47128001676423487.
[I 2024-12-04 14:49:39,581] Trial 288 finished with value: 0.6289367508285069 and parameters: {'n_estimators': 790, 'learning_rate': 0.031150828467759985, 'max_depth': 11, 'min_samples_split': 16, 'min_samples_leaf': 3, 'subsample': 0.8060106581061339, 'max_features': None}. Best is trial 167 with value: 0.47128001676423487.
[I 2024-12-04 14:49:40,890] Trial 273 finished with value: 0.49079352969946666 and parameters: {'n_estimators': 1309, 'learning_rate': 0.016637728449301583, 'max_depth': 8, 'min_samples_split': 19, 'min_samples_leaf': 1, 'subsample': 0.9905581897425892, 'max_features': None}. Best is trial 167 with value: 0.47128001676423487.
[I 2024-12-04 14:49:40,892] Trial 268 finished with value: 0.6262996340343513 and parameters: {'n_estimators': 1361, 'learning_rate': 0.013531224117024844, 'max_depth': 10, 'min_samples_split': 14, 'min_samples_leaf': 2, 'subsample': 0.9157269743053976, 'max_features': None}. Best is trial 167 with value: 0.47128001676423487.
[I 2024-12-04 14:49:43,852] Trial 298 finished with value: 0.4912143961935765 and parameters: {'n_estimators': 683, 'learning_rate': 0.024397251176644198, 'max_depth': 12, 'min_samples_split': 19, 'min_samples_leaf': 1, 'subsample': 0.9535353025406844, 'max_features': None}. Best is trial 167 with value: 0.47128001676423487.
[I 2024-12-04 14:49:43,924] Trial 297 finished with value: 0.5454896957570359 and parameters: {'n_estimators': 952, 'learning_rate': 0.04161194510693615, 'max_depth': 10, 'min_samples_split': 16, 'min_samples_leaf': 1, 'subsample': 0.9839025851461698, 'max_features': 'sqrt'}. Best is trial 167 with value: 0.47128001676423487.
[I 2024-12-04 14:49:45,652] Trial 279 finished with value: 0.6683892384466463 and parameters: {'n_estimators': 1372, 'learning_rate': 0.036989154798174266, 'max_depth': 12, 'min_samples_split': 20, 'min_samples_leaf': 3, 'subsample': 0.9695312547672537, 'max_features': 'log2'}. Best is trial 167 with value: 0.47128001676423487.
[I 2024-12-04 14:49:46,676] Trial 292 finished with value: 0.5002478826709494 and parameters: {'n_estimators': 911, 'learning_rate': 0.02648291922925847, 'max_depth': 11, 'min_samples_split': 17, 'min_samples_leaf': 1, 'subsample': 0.850932880578395, 'max_features': None}. Best is trial 167 with value: 0.47128001676423487.
[I 2024-12-04 14:49:46,720] Trial 296 finished with value: 0.5938308234624984 and parameters: {'n_estimators': 798, 'learning_rate': 0.023449148089874472, 'max_depth': 11, 'min_samples_split': 19, 'min_samples_leaf': 2, 'subsample': 0.9782508891528887, 'max_features': None}. Best is trial 167 with value: 0.47128001676423487.
[I 2024-12-04 14:49:47,368] Trial 290 finished with value: 0.6422941960463182 and parameters: {'n_estimators': 900, 'learning_rate': 0.05166555739952989, 'max_depth': 10, 'min_samples_split': 20, 'min_samples_leaf': 2, 'subsample': 0.8929269629287812, 'max_features': None}. Best is trial 167 with value: 0.47128001676423487.
[I 2024-12-04 14:49:48,893] Trial 301 finished with value: 0.653033302927956 and parameters: {'n_estimators': 801, 'learning_rate': 0.0881782541527202, 'max_depth': 10, 'min_samples_split': 20, 'min_samples_leaf': 3, 'subsample': 0.8990449256921892, 'max_features': None}. Best is trial 167 with value: 0.47128001676423487.
[I 2024-12-04 14:49:50,956] Trial 294 finished with value: 0.4783332988443164 and parameters: {'n_estimators': 992, 'learning_rate': 0.03271534965091822, 'max_depth': 12, 'min_samples_split': 20, 'min_samples_leaf': 1, 'subsample': 0.9158595893511687, 'max_features': None}. Best is trial 167 with value: 0.47128001676423487.
[I 2024-12-04 14:49:51,841] Trial 281 finished with value: 0.5902638664158675 and parameters: {'n_estimators': 1243, 'learning_rate': 0.023373961997295176, 'max_depth': 12, 'min_samples_split': 20, 'min_samples_leaf': 2, 'subsample': 0.9394118839355138, 'max_features': None}. Best is trial 167 with value: 0.47128001676423487.
[I 2024-12-04 14:49:52,052] Trial 277 finished with value: 0.4842029495666644 and parameters: {'n_estimators': 1299, 'learning_rate': 0.022814727857541746, 'max_depth': 12, 'min_samples_split': 17, 'min_samples_leaf': 1, 'subsample': 0.9490831209648192, 'max_features': None}. Best is trial 167 with value: 0.47128001676423487.
[I 2024-12-04 14:49:52,864] Trial 303 finished with value: 0.4776337174056489 and parameters: {'n_estimators': 788, 'learning_rate': 0.04779229757342612, 'max_depth': 12, 'min_samples_split': 20, 'min_samples_leaf': 1, 'subsample': 0.9419401246689257, 'max_features': None}. Best is trial 167 with value: 0.47128001676423487.
[I 2024-12-04 14:49:54,546] Trial 283 finished with value: 0.4943337557773906 and parameters: {'n_estimators': 1256, 'learning_rate': 0.0976989514106163, 'max_depth': 12, 'min_samples_split': 20, 'min_samples_leaf': 1, 'subsample': 0.9149841498921973, 'max_features': None}. Best is trial 167 with value: 0.47128001676423487.
[I 2024-12-04 14:49:54,620] Trial 295 finished with value: 0.4902537693228467 and parameters: {'n_estimators': 993, 'learning_rate': 0.02444736284416979, 'max_depth': 10, 'min_samples_split': 17, 'min_samples_leaf': 1, 'subsample': 0.9956171419343489, 'max_features': None}. Best is trial 167 with value: 0.47128001676423487.
[I 2024-12-04 14:49:55,660] Trial 304 finished with value: 0.6312441317206787 and parameters: {'n_estimators': 691, 'learning_rate': 0.07805366490629798, 'max_depth': 9, 'min_samples_split': 17, 'min_samples_leaf': 4, 'subsample': 0.9792915399823978, 'max_features': None}. Best is trial 167 with value: 0.47128001676423487.
[I 2024-12-04 14:49:56,766] Trial 315 finished with value: 0.5174909703675395 and parameters: {'n_estimators': 409, 'learning_rate': 0.06679630291431347, 'max_depth': 5, 'min_samples_split': 20, 'min_samples_leaf': 1, 'subsample': 0.8965132229747923, 'max_features': None}. Best is trial 167 with value: 0.47128001676423487.
[I 2024-12-04 14:49:57,272] Trial 313 finished with value: 0.49626335028785945 and parameters: {'n_estimators': 498, 'learning_rate': 0.0509255061755424, 'max_depth': 9, 'min_samples_split': 20, 'min_samples_leaf': 1, 'subsample': 0.9487054968348122, 'max_features': None}. Best is trial 167 with value: 0.47128001676423487.
[I 2024-12-04 14:49:57,318] Trial 291 finished with value: 0.6794145896503685 and parameters: {'n_estimators': 1331, 'learning_rate': 0.033863160412899385, 'max_depth': 5, 'min_samples_split': 2, 'min_samples_leaf': 7, 'subsample': 0.7118664798913061, 'max_features': None}. Best is trial 167 with value: 0.47128001676423487.
[I 2024-12-04 14:49:58,062] Trial 306 finished with value: 0.4899325254856226 and parameters: {'n_estimators': 674, 'learning_rate': 0.03467059671335854, 'max_depth': 9, 'min_samples_split': 18, 'min_samples_leaf': 1, 'subsample': 0.9999036876579402, 'max_features': None}. Best is trial 167 with value: 0.47128001676423487.
[I 2024-12-04 14:50:00,535] Trial 312 finished with value: 0.6257471988928135 and parameters: {'n_estimators': 575, 'learning_rate': 0.09716053293022542, 'max_depth': 12, 'min_samples_split': 20, 'min_samples_leaf': 2, 'subsample': 0.9792812786488001, 'max_features': None}. Best is trial 167 with value: 0.47128001676423487.
[I 2024-12-04 14:50:01,302] Trial 318 finished with value: 0.5054302232547047 and parameters: {'n_estimators': 513, 'learning_rate': 0.08215090054941228, 'max_depth': 7, 'min_samples_split': 20, 'min_samples_leaf': 1, 'subsample': 0.9743392157792066, 'max_features': None}. Best is trial 167 with value: 0.47128001676423487.
[I 2024-12-04 14:50:02,909] Trial 305 finished with value: 0.5052444301712413 and parameters: {'n_estimators': 865, 'learning_rate': 0.01997236623607093, 'max_depth': 10, 'min_samples_split': 16, 'min_samples_leaf': 1, 'subsample': 0.8860933326180052, 'max_features': None}. Best is trial 167 with value: 0.47128001676423487.
[I 2024-12-04 14:50:04,209] Trial 333 finished with value: 1.0836510769510665 and parameters: {'n_estimators': 221, 'learning_rate': 0.010579401134669012, 'max_depth': 8, 'min_samples_split': 4, 'min_samples_leaf': 9, 'subsample': 0.8206016829104195, 'max_features': 'sqrt'}. Best is trial 167 with value: 0.47128001676423487.
[I 2024-12-04 14:50:04,835] Trial 302 finished with value: 0.49112106483827284 and parameters: {'n_estimators': 1153, 'learning_rate': 0.017578827518620745, 'max_depth': 10, 'min_samples_split': 20, 'min_samples_leaf': 1, 'subsample': 0.9488451308936665, 'max_features': None}. Best is trial 167 with value: 0.47128001676423487.
[I 2024-12-04 14:50:06,220] Trial 311 finished with value: 0.6123486953624941 and parameters: {'n_estimators': 783, 'learning_rate': 0.05539286081886113, 'max_depth': 11, 'min_samples_split': 18, 'min_samples_leaf': 2, 'subsample': 0.9378797710855782, 'max_features': None}. Best is trial 167 with value: 0.47128001676423487.
[I 2024-12-04 14:50:08,552] Trial 322 finished with value: 0.6003965241025739 and parameters: {'n_estimators': 778, 'learning_rate': 0.012984855631018338, 'max_depth': 6, 'min_samples_split': 7, 'min_samples_leaf': 1, 'subsample': 0.9184313623020766, 'max_features': 'sqrt'}. Best is trial 167 with value: 0.47128001676423487.
[I 2024-12-04 14:50:10,160] Trial 307 finished with value: 0.5236081152612698 and parameters: {'n_estimators': 1029, 'learning_rate': 0.06549185180507348, 'max_depth': 11, 'min_samples_split': 14, 'min_samples_leaf': 1, 'subsample': 0.8823557803679294, 'max_features': None}. Best is trial 167 with value: 0.47128001676423487.
[I 2024-12-04 14:50:10,412] Trial 327 finished with value: 0.6627424270333379 and parameters: {'n_estimators': 698, 'learning_rate': 0.045465031951831165, 'max_depth': 12, 'min_samples_split': 17, 'min_samples_leaf': 3, 'subsample': 0.9113691002802747, 'max_features': 'sqrt'}. Best is trial 167 with value: 0.47128001676423487.
[I 2024-12-04 14:50:11,092] Trial 326 finished with value: 0.49709496266006853 and parameters: {'n_estimators': 638, 'learning_rate': 0.03800069804440955, 'max_depth': 10, 'min_samples_split': 20, 'min_samples_leaf': 1, 'subsample': 0.9022345663828688, 'max_features': None}. Best is trial 167 with value: 0.47128001676423487.
[I 2024-12-04 14:50:12,362] Trial 321 finished with value: 0.6459839456254535 and parameters: {'n_estimators': 776, 'learning_rate': 0.0931768896084239, 'max_depth': 9, 'min_samples_split': 20, 'min_samples_leaf': 2, 'subsample': 0.9968423949663634, 'max_features': None}. Best is trial 167 with value: 0.47128001676423487.
[I 2024-12-04 14:50:13,019] Trial 336 finished with value: 0.823119171497643 and parameters: {'n_estimators': 426, 'learning_rate': 0.02776341106109451, 'max_depth': 9, 'min_samples_split': 20, 'min_samples_leaf': 10, 'subsample': 0.8218151870746375, 'max_features': 'sqrt'}. Best is trial 167 with value: 0.47128001676423487.
[I 2024-12-04 14:50:14,521] Trial 320 finished with value: 0.49815111544870566 and parameters: {'n_estimators': 848, 'learning_rate': 0.08393394379741842, 'max_depth': 11, 'min_samples_split': 18, 'min_samples_leaf': 1, 'subsample': 0.9791038554531128, 'max_features': None}. Best is trial 167 with value: 0.47128001676423487.
[I 2024-12-04 14:50:15,299] Trial 308 finished with value: 0.5154817823156518 and parameters: {'n_estimators': 1147, 'learning_rate': 0.06903263987078923, 'max_depth': 10, 'min_samples_split': 12, 'min_samples_leaf': 1, 'subsample': 0.9896357026458151, 'max_features': None}. Best is trial 167 with value: 0.47128001676423487.
[I 2024-12-04 14:50:15,314] Trial 325 finished with value: 0.49676923938460193 and parameters: {'n_estimators': 740, 'learning_rate': 0.03272138700016716, 'max_depth': 12, 'min_samples_split': 19, 'min_samples_leaf': 1, 'subsample': 0.8693577692889747, 'max_features': None}. Best is trial 167 with value: 0.47128001676423487.
[I 2024-12-04 14:50:16,443] Trial 324 finished with value: 0.8012445151717259 and parameters: {'n_estimators': 955, 'learning_rate': 0.018385683388738007, 'max_depth': 12, 'min_samples_split': 2, 'min_samples_leaf': 8, 'subsample': 0.6574420346050953, 'max_features': 'sqrt'}. Best is trial 167 with value: 0.47128001676423487.
[I 2024-12-04 14:50:17,160] Trial 314 finished with value: 0.6704815248261843 and parameters: {'n_estimators': 1308, 'learning_rate': 0.016941292408712737, 'max_depth': 6, 'min_samples_split': 19, 'min_samples_leaf': 2, 'subsample': 0.9618344284493986, 'max_features': 'log2'}. Best is trial 167 with value: 0.47128001676423487.
[I 2024-12-04 14:50:17,164] Trial 309 finished with value: 0.51429162268998 and parameters: {'n_estimators': 1188, 'learning_rate': 0.08201161287680125, 'max_depth': 10, 'min_samples_split': 14, 'min_samples_leaf': 1, 'subsample': 0.9753883324583287, 'max_features': None}. Best is trial 167 with value: 0.47128001676423487.
[I 2024-12-04 14:50:18,070] Trial 323 finished with value: 0.5952520824791693 and parameters: {'n_estimators': 1083, 'learning_rate': 0.09950697755287825, 'max_depth': 9, 'min_samples_split': 19, 'min_samples_leaf': 1, 'subsample': 0.7851147070402797, 'max_features': 'log2'}. Best is trial 167 with value: 0.47128001676423487.
[I 2024-12-04 14:50:18,402] Trial 310 finished with value: 0.6138878122671094 and parameters: {'n_estimators': 1203, 'learning_rate': 0.022058507249868298, 'max_depth': 9, 'min_samples_split': 20, 'min_samples_leaf': 4, 'subsample': 0.9593650996361822, 'max_features': None}. Best is trial 167 with value: 0.47128001676423487.
[I 2024-12-04 14:50:18,956] Trial 317 finished with value: 0.49311103342627055 and parameters: {'n_estimators': 1084, 'learning_rate': 0.014948045084357618, 'max_depth': 7, 'min_samples_split': 20, 'min_samples_leaf': 1, 'subsample': 0.9998079634987286, 'max_features': None}. Best is trial 167 with value: 0.47128001676423487.
[I 2024-12-04 14:50:22,075] Trial 316 finished with value: 0.7671981636143017 and parameters: {'n_estimators': 1237, 'learning_rate': 0.04391830148917278, 'max_depth': 7, 'min_samples_split': 17, 'min_samples_leaf': 10, 'subsample': 0.7264319575883832, 'max_features': None}. Best is trial 167 with value: 0.47128001676423487.
[I 2024-12-04 14:50:22,564] Trial 328 finished with value: 0.5079564752612978 and parameters: {'n_estimators': 826, 'learning_rate': 0.053847698421637634, 'max_depth': 9, 'min_samples_split': 19, 'min_samples_leaf': 1, 'subsample': 0.9868205547010687, 'max_features': None}. Best is trial 167 with value: 0.47128001676423487.
[I 2024-12-04 14:50:22,996] Trial 331 finished with value: 0.47415601385465306 and parameters: {'n_estimators': 800, 'learning_rate': 0.050154125669406434, 'max_depth': 12, 'min_samples_split': 20, 'min_samples_leaf': 1, 'subsample': 0.9372870143041636, 'max_features': None}. Best is trial 167 with value: 0.47128001676423487.
[I 2024-12-04 14:50:24,851] Trial 334 finished with value: 0.7379588644169787 and parameters: {'n_estimators': 821, 'learning_rate': 0.033589551671421, 'max_depth': 7, 'min_samples_split': 18, 'min_samples_leaf': 10, 'subsample': 0.9764787624741177, 'max_features': None}. Best is trial 167 with value: 0.47128001676423487.
[I 2024-12-04 14:50:26,863] Trial 319 finished with value: 0.49860032810858135 and parameters: {'n_estimators': 1315, 'learning_rate': 0.020641357517372564, 'max_depth': 7, 'min_samples_split': 18, 'min_samples_leaf': 1, 'subsample': 0.9858326874329717, 'max_features': None}. Best is trial 167 with value: 0.47128001676423487.
[I 2024-12-04 14:50:27,337] Trial 329 finished with value: 0.4730437956691336 and parameters: {'n_estimators': 953, 'learning_rate': 0.03639553831289353, 'max_depth': 12, 'min_samples_split': 20, 'min_samples_leaf': 1, 'subsample': 0.9478846882941179, 'max_features': None}. Best is trial 167 with value: 0.47128001676423487.
[I 2024-12-04 14:50:29,359] Trial 330 finished with value: 0.6568793156453064 and parameters: {'n_estimators': 1201, 'learning_rate': 0.023767226072471937, 'max_depth': 9, 'min_samples_split': 20, 'min_samples_leaf': 3, 'subsample': 0.9459968909419334, 'max_features': 'sqrt'}. Best is trial 167 with value: 0.47128001676423487.
[I 2024-12-04 14:50:29,371] Trial 338 finished with value: 0.5509199908525824 and parameters: {'n_estimators': 996, 'learning_rate': 0.02217456833047338, 'max_depth': 11, 'min_samples_split': 18, 'min_samples_leaf': 1, 'subsample': 0.8215512034794499, 'max_features': 'sqrt'}. Best is trial 167 with value: 0.47128001676423487.
