[I 2024-12-04 12:14:06,056] Trial 1291 finished with value: 0.5520722342259035 and parameters: {'n_estimators': 300, 'max_depth': 21, 'min_samples_split': 10, 'min_samples_leaf': 2, 'max_features': None, 'bootstrap': True, 'criterion': 'absolute_error'}. Best is trial 744 with value: 0.5032383725751689.
[I 2024-12-04 12:14:06,724] Trial 1292 finished with value: 0.5182967171008961 and parameters: {'n_estimators': 225, 'max_depth': 14, 'min_samples_split': 4, 'min_samples_leaf': 1, 'max_features': None, 'bootstrap': True, 'criterion': 'absolute_error'}. Best is trial 744 with value: 0.5032383725751689.
[I 2024-12-04 12:14:06,760] Trial 1313 finished with value: 1.162262825612068 and parameters: {'n_estimators': 112, 'max_depth': 22, 'min_samples_split': 3, 'min_samples_leaf': 3, 'max_features': 'sqrt', 'bootstrap': True, 'criterion': 'absolute_error'}. Best is trial 744 with value: 0.5032383725751689.
[I 2024-12-04 12:14:09,065] Trial 1305 finished with value: 0.557980854730647 and parameters: {'n_estimators': 119, 'max_depth': 20, 'min_samples_split': 4, 'min_samples_leaf': 2, 'max_features': None, 'bootstrap': True, 'criterion': 'absolute_error'}. Best is trial 744 with value: 0.5032383725751689.
[I 2024-12-04 12:14:09,635] Trial 1289 finished with value: 0.5100092408742488 and parameters: {'n_estimators': 267, 'max_depth': 19, 'min_samples_split': 4, 'min_samples_leaf': 1, 'max_features': None, 'bootstrap': True, 'criterion': 'absolute_error'}. Best is trial 744 with value: 0.5032383725751689.
[I 2024-12-04 12:14:10,625] Trial 1307 finished with value: 1.3158253090463587 and parameters: {'n_estimators': 706, 'max_depth': 49, 'min_samples_split': 18, 'min_samples_leaf': 8, 'max_features': 'sqrt', 'bootstrap': True, 'criterion': 'absolute_error'}. Best is trial 744 with value: 0.5032383725751689.
[I 2024-12-04 12:14:10,655] Trial 1300 finished with value: 0.5283173070063941 and parameters: {'n_estimators': 103, 'max_depth': 23, 'min_samples_split': 3, 'min_samples_leaf': 1, 'max_features': None, 'bootstrap': True, 'criterion': 'absolute_error'}. Best is trial 744 with value: 0.5032383725751689.
[I 2024-12-04 12:14:13,928] Trial 1311 finished with value: 0.515256522600747 and parameters: {'n_estimators': 103, 'max_depth': 13, 'min_samples_split': 2, 'min_samples_leaf': 1, 'max_features': None, 'bootstrap': True, 'criterion': 'absolute_error'}. Best is trial 744 with value: 0.5032383725751689.
[I 2024-12-04 12:14:15,027] Trial 1309 finished with value: 0.726976446214933 and parameters: {'n_estimators': 297, 'max_depth': 23, 'min_samples_split': 2, 'min_samples_leaf': 1, 'max_features': 'sqrt', 'bootstrap': True, 'criterion': 'absolute_error'}. Best is trial 744 with value: 0.5032383725751689.
[I 2024-12-04 12:14:15,096] Trial 1295 finished with value: 0.506935893118795 and parameters: {'n_estimators': 104, 'max_depth': 18, 'min_samples_split': 5, 'min_samples_leaf': 1, 'max_features': None, 'bootstrap': True, 'criterion': 'absolute_error'}. Best is trial 744 with value: 0.5032383725751689.
[I 2024-12-04 12:14:15,146] Trial 1317 finished with value: 1.229811824169682 and parameters: {'n_estimators': 373, 'max_depth': 13, 'min_samples_split': 2, 'min_samples_leaf': 12, 'max_features': 'log2', 'bootstrap': False, 'criterion': 'squared_error'}. Best is trial 744 with value: 0.5032383725751689.
[I 2024-12-04 12:14:15,189] Trial 1298 finished with value: 0.5622122755700167 and parameters: {'n_estimators': 265, 'max_depth': 18, 'min_samples_split': 6, 'min_samples_leaf': 2, 'max_features': None, 'bootstrap': True, 'criterion': 'absolute_error'}. Best is trial 744 with value: 0.5032383725751689.
[I 2024-12-04 12:14:15,202] Trial 1316 finished with value: 0.7668341340427552 and parameters: {'n_estimators': 330, 'max_depth': 27, 'min_samples_split': 4, 'min_samples_leaf': 2, 'max_features': 'sqrt', 'bootstrap': False, 'criterion': 'squared_error'}. Best is trial 744 with value: 0.5032383725751689.
[I 2024-12-04 12:14:15,718] Trial 1315 finished with value: 0.5589307041234105 and parameters: {'n_estimators': 118, 'max_depth': 10, 'min_samples_split': 3, 'min_samples_leaf': 1, 'max_features': None, 'bootstrap': False, 'criterion': 'absolute_error'}. Best is trial 744 with value: 0.5032383725751689.
[I 2024-12-04 12:14:17,393] Trial 1302 finished with value: 0.5540207377262147 and parameters: {'n_estimators': 302, 'max_depth': 15, 'min_samples_split': 3, 'min_samples_leaf': 2, 'max_features': None, 'bootstrap': True, 'criterion': 'absolute_error'}. Best is trial 744 with value: 0.5032383725751689.
[I 2024-12-04 12:14:19,380] Trial 1310 finished with value: 0.559211179512841 and parameters: {'n_estimators': 102, 'max_depth': 27, 'min_samples_split': 4, 'min_samples_leaf': 2, 'max_features': None, 'bootstrap': True, 'criterion': 'absolute_error'}. Best is trial 744 with value: 0.5032383725751689.
[I 2024-12-04 12:14:19,418] Trial 1321 finished with value: 0.5524399465791463 and parameters: {'n_estimators': 115, 'max_depth': 13, 'min_samples_split': 4, 'min_samples_leaf': 2, 'max_features': None, 'bootstrap': True, 'criterion': 'absolute_error'}. Best is trial 744 with value: 0.5032383725751689.
[I 2024-12-04 12:14:20,741] Trial 1319 finished with value: 1.2354603022518422 and parameters: {'n_estimators': 737, 'max_depth': 8, 'min_samples_split': 45, 'min_samples_leaf': 6, 'max_features': 'sqrt', 'bootstrap': False, 'criterion': 'absolute_error'}. Best is trial 744 with value: 0.5032383725751689.
[I 2024-12-04 12:14:22,007] Trial 1323 finished with value: 0.5124074983111786 and parameters: {'n_estimators': 100, 'max_depth': 21, 'min_samples_split': 6, 'min_samples_leaf': 1, 'max_features': None, 'bootstrap': True, 'criterion': 'absolute_error'}. Best is trial 744 with value: 0.5032383725751689.
[I 2024-12-04 12:14:22,875] Trial 1312 finished with value: 0.5178188030567117 and parameters: {'n_estimators': 236, 'max_depth': 17, 'min_samples_split': 5, 'min_samples_leaf': 1, 'max_features': None, 'bootstrap': True, 'criterion': 'absolute_error'}. Best is trial 744 with value: 0.5032383725751689.
[I 2024-12-04 12:14:22,926] Trial 1308 finished with value: 0.5105596616638134 and parameters: {'n_estimators': 103, 'max_depth': 13, 'min_samples_split': 4, 'min_samples_leaf': 1, 'max_features': None, 'bootstrap': True, 'criterion': 'absolute_error'}. Best is trial 744 with value: 0.5032383725751689.
[I 2024-12-04 12:14:23,709] Trial 1303 finished with value: 0.5175145018744728 and parameters: {'n_estimators': 225, 'max_depth': 15, 'min_samples_split': 3, 'min_samples_leaf': 1, 'max_features': None, 'bootstrap': True, 'criterion': 'absolute_error'}. Best is trial 744 with value: 0.5032383725751689.
[I 2024-12-04 12:14:23,718] Trial 1322 finished with value: 0.5111490488779115 and parameters: {'n_estimators': 110, 'max_depth': 23, 'min_samples_split': 4, 'min_samples_leaf': 1, 'max_features': None, 'bootstrap': True, 'criterion': 'absolute_error'}. Best is trial 744 with value: 0.5032383725751689.
[I 2024-12-04 12:14:24,078] Trial 1326 finished with value: 0.90168214140651 and parameters: {'n_estimators': 184, 'max_depth': 17, 'min_samples_split': 29, 'min_samples_leaf': 1, 'max_features': 'sqrt', 'bootstrap': True, 'criterion': 'absolute_error'}. Best is trial 744 with value: 0.5032383725751689.
[I 2024-12-04 12:14:27,477] Trial 1325 finished with value: 0.5602132643712964 and parameters: {'n_estimators': 109, 'max_depth': 18, 'min_samples_split': 6, 'min_samples_leaf': 2, 'max_features': None, 'bootstrap': True, 'criterion': 'absolute_error'}. Best is trial 744 with value: 0.5032383725751689.
[I 2024-12-04 12:14:27,673] Trial 1306 finished with value: 0.52475667238221 and parameters: {'n_estimators': 264, 'max_depth': 26, 'min_samples_split': 7, 'min_samples_leaf': 1, 'max_features': None, 'bootstrap': True, 'criterion': 'absolute_error'}. Best is trial 744 with value: 0.5032383725751689.
[I 2024-12-04 12:14:29,381] Trial 1320 finished with value: 0.9184789155848923 and parameters: {'n_estimators': 359, 'max_depth': 50, 'min_samples_split': 39, 'min_samples_leaf': 11, 'max_features': None, 'bootstrap': True, 'criterion': 'absolute_error'}. Best is trial 744 with value: 0.5032383725751689.
[I 2024-12-04 12:14:30,131] Trial 1327 finished with value: 0.5170679164818847 and parameters: {'n_estimators': 101, 'max_depth': 20, 'min_samples_split': 8, 'min_samples_leaf': 1, 'max_features': None, 'bootstrap': True, 'criterion': 'absolute_error'}. Best is trial 744 with value: 0.5032383725751689.
[I 2024-12-04 12:14:30,683] Trial 1340 finished with value: 0.6600082440529011 and parameters: {'n_estimators': 133, 'max_depth': 46, 'min_samples_split': 31, 'min_samples_leaf': 8, 'max_features': None, 'bootstrap': False, 'criterion': 'squared_error'}. Best is trial 744 with value: 0.5032383725751689.
[I 2024-12-04 12:14:30,811] Trial 1330 finished with value: 0.5127391873287046 and parameters: {'n_estimators': 108, 'max_depth': 23, 'min_samples_split': 5, 'min_samples_leaf': 1, 'max_features': None, 'bootstrap': True, 'criterion': 'absolute_error'}. Best is trial 744 with value: 0.5032383725751689.
[I 2024-12-04 12:14:31,277] Trial 1314 finished with value: 0.5178753188669524 and parameters: {'n_estimators': 248, 'max_depth': 15, 'min_samples_split': 3, 'min_samples_leaf': 1, 'max_features': None, 'bootstrap': True, 'criterion': 'absolute_error'}. Best is trial 744 with value: 0.5032383725751689.
[I 2024-12-04 12:14:31,301] Trial 1333 finished with value: 1.0262281104551971 and parameters: {'n_estimators': 155, 'max_depth': 20, 'min_samples_split': 5, 'min_samples_leaf': 1, 'max_features': 'log2', 'bootstrap': True, 'criterion': 'absolute_error'}. Best is trial 744 with value: 0.5032383725751689.
[I 2024-12-04 12:14:32,767] Trial 1334 finished with value: 0.5559653449811138 and parameters: {'n_estimators': 101, 'max_depth': 14, 'min_samples_split': 2, 'min_samples_leaf': 2, 'max_features': None, 'bootstrap': True, 'criterion': 'absolute_error'}. Best is trial 744 with value: 0.5032383725751689.
[I 2024-12-04 12:14:32,972] Trial 1329 finished with value: 0.6158407373067672 and parameters: {'n_estimators': 104, 'max_depth': 20, 'min_samples_split': 5, 'min_samples_leaf': 2, 'max_features': None, 'bootstrap': False, 'criterion': 'absolute_error'}. Best is trial 744 with value: 0.5032383725751689.
[I 2024-12-04 12:14:34,133] Trial 1324 finished with value: 0.5278268871990287 and parameters: {'n_estimators': 227, 'max_depth': 17, 'min_samples_split': 11, 'min_samples_leaf': 1, 'max_features': None, 'bootstrap': True, 'criterion': 'absolute_error'}. Best is trial 744 with value: 0.5032383725751689.
[I 2024-12-04 12:14:34,449] Trial 1290 finished with value: 0.5120542790197873 and parameters: {'n_estimators': 493, 'max_depth': 13, 'min_samples_split': 2, 'min_samples_leaf': 1, 'max_features': None, 'bootstrap': True, 'criterion': 'absolute_error'}. Best is trial 744 with value: 0.5032383725751689.
[I 2024-12-04 12:14:34,568] Trial 1332 finished with value: 0.5155500423828573 and parameters: {'n_estimators': 111, 'max_depth': 17, 'min_samples_split': 3, 'min_samples_leaf': 1, 'max_features': None, 'bootstrap': True, 'criterion': 'absolute_error'}. Best is trial 744 with value: 0.5032383725751689.
[I 2024-12-04 12:14:35,279] Trial 1318 finished with value: 0.5191763629335068 and parameters: {'n_estimators': 295, 'max_depth': 29, 'min_samples_split': 4, 'min_samples_leaf': 1, 'max_features': None, 'bootstrap': True, 'criterion': 'absolute_error'}. Best is trial 744 with value: 0.5032383725751689.
[I 2024-12-04 12:14:36,366] Trial 1337 finished with value: 0.5104606462079334 and parameters: {'n_estimators': 106, 'max_depth': 13, 'min_samples_split': 4, 'min_samples_leaf': 1, 'max_features': None, 'bootstrap': True, 'criterion': 'absolute_error'}. Best is trial 744 with value: 0.5032383725751689.
[I 2024-12-04 12:14:36,758] Trial 1341 finished with value: 1.3556665442927072 and parameters: {'n_estimators': 712, 'max_depth': 46, 'min_samples_split': 31, 'min_samples_leaf': 9, 'max_features': 'log2', 'bootstrap': True, 'criterion': 'absolute_error'}. Best is trial 744 with value: 0.5032383725751689.
[I 2024-12-04 12:14:37,138] Trial 1336 finished with value: 0.5226636634200098 and parameters: {'n_estimators': 236, 'max_depth': 18, 'min_samples_split': 2, 'min_samples_leaf': 1, 'max_features': None, 'bootstrap': True, 'criterion': 'squared_error'}. Best is trial 744 with value: 0.5032383725751689.
[I 2024-12-04 12:14:37,855] Trial 1343 finished with value: 0.510432934944429 and parameters: {'n_estimators': 102, 'max_depth': 21, 'min_samples_split': 5, 'min_samples_leaf': 1, 'max_features': None, 'bootstrap': True, 'criterion': 'absolute_error'}. Best is trial 744 with value: 0.5032383725751689.
[I 2024-12-04 12:14:48,043] Trial 1331 finished with value: 0.5199015700408353 and parameters: {'n_estimators': 271, 'max_depth': 23, 'min_samples_split': 5, 'min_samples_leaf': 1, 'max_features': None, 'bootstrap': True, 'criterion': 'absolute_error'}. Best is trial 744 with value: 0.5032383725751689.
[I 2024-12-04 12:14:48,133] Trial 1347 finished with value: 0.6381220085102268 and parameters: {'n_estimators': 921, 'max_depth': 5, 'min_samples_split': 12, 'min_samples_leaf': 3, 'max_features': None, 'bootstrap': False, 'criterion': 'squared_error'}. Best is trial 744 with value: 0.5032383725751689.
[I 2024-12-04 12:14:50,832] Trial 1356 finished with value: 0.5519220348615936 and parameters: {'n_estimators': 105, 'max_depth': 11, 'min_samples_split': 5, 'min_samples_leaf': 2, 'max_features': None, 'bootstrap': True, 'criterion': 'absolute_error'}. Best is trial 744 with value: 0.5032383725751689.
[I 2024-12-04 12:14:50,849] Trial 1346 finished with value: 0.514177516607845 and parameters: {'n_estimators': 101, 'max_depth': 13, 'min_samples_split': 6, 'min_samples_leaf': 1, 'max_features': None, 'bootstrap': True, 'criterion': 'absolute_error'}. Best is trial 744 with value: 0.5032383725751689.
[I 2024-12-04 12:14:50,869] Trial 1350 finished with value: 0.5184412751604076 and parameters: {'n_estimators': 112, 'max_depth': 20, 'min_samples_split': 3, 'min_samples_leaf': 1, 'max_features': None, 'bootstrap': True, 'criterion': 'absolute_error'}. Best is trial 744 with value: 0.5032383725751689.
[I 2024-12-04 12:14:52,237] Trial 1348 finished with value: 0.5232657574189424 and parameters: {'n_estimators': 107, 'max_depth': 17, 'min_samples_split': 9, 'min_samples_leaf': 1, 'max_features': None, 'bootstrap': True, 'criterion': 'absolute_error'}. Best is trial 744 with value: 0.5032383725751689.
[I 2024-12-04 12:14:52,527] Trial 1352 finished with value: 0.5054810116490839 and parameters: {'n_estimators': 111, 'max_depth': 19, 'min_samples_split': 5, 'min_samples_leaf': 1, 'max_features': None, 'bootstrap': True, 'criterion': 'absolute_error'}. Best is trial 744 with value: 0.5032383725751689.
[I 2024-12-04 12:14:52,838] Trial 1335 finished with value: 0.5169643604293962 and parameters: {'n_estimators': 262, 'max_depth': 14, 'min_samples_split': 5, 'min_samples_leaf': 1, 'max_features': None, 'bootstrap': True, 'criterion': 'absolute_error'}. Best is trial 744 with value: 0.5032383725751689.
[I 2024-12-04 12:14:52,854] Trial 1338 finished with value: 0.5254883644145665 and parameters: {'n_estimators': 241, 'max_depth': 16, 'min_samples_split': 8, 'min_samples_leaf': 1, 'max_features': None, 'bootstrap': True, 'criterion': 'absolute_error'}. Best is trial 744 with value: 0.5032383725751689.
[I 2024-12-04 12:14:52,861] Trial 1349 finished with value: 0.5157923849286531 and parameters: {'n_estimators': 116, 'max_depth': 17, 'min_samples_split': 6, 'min_samples_leaf': 1, 'max_features': None, 'bootstrap': True, 'criterion': 'absolute_error'}. Best is trial 744 with value: 0.5032383725751689.
[I 2024-12-04 12:14:53,092] Trial 1339 finished with value: 0.6453604249647197 and parameters: {'n_estimators': 673, 'max_depth': 43, 'min_samples_split': 14, 'min_samples_leaf': 1, 'max_features': 'sqrt', 'bootstrap': False, 'criterion': 'absolute_error'}. Best is trial 744 with value: 0.5032383725751689.
[I 2024-12-04 12:14:55,494] Trial 1344 finished with value: 0.5145036613435843 and parameters: {'n_estimators': 256, 'max_depth': 18, 'min_samples_split': 4, 'min_samples_leaf': 1, 'max_features': None, 'bootstrap': True, 'criterion': 'absolute_error'}. Best is trial 744 with value: 0.5032383725751689.
[I 2024-12-04 12:14:56,171] Trial 1345 finished with value: 0.5279305255873544 and parameters: {'n_estimators': 242, 'max_depth': 24, 'min_samples_split': 8, 'min_samples_leaf': 1, 'max_features': None, 'bootstrap': True, 'criterion': 'absolute_error'}. Best is trial 744 with value: 0.5032383725751689.
[I 2024-12-04 12:14:56,584] Trial 1342 finished with value: 0.6245263651559042 and parameters: {'n_estimators': 472, 'max_depth': 31, 'min_samples_split': 2, 'min_samples_leaf': 5, 'max_features': None, 'bootstrap': False, 'criterion': 'absolute_error'}. Best is trial 744 with value: 0.5032383725751689.
[I 2024-12-04 12:14:56,726] Trial 1367 finished with value: 0.9710010356252977 and parameters: {'n_estimators': 112, 'max_depth': 28, 'min_samples_split': 16, 'min_samples_leaf': 1, 'max_features': 'log2', 'bootstrap': True, 'criterion': 'absolute_error'}. Best is trial 744 with value: 0.5032383725751689.
[I 2024-12-04 12:14:56,923] Trial 1361 finished with value: 0.5503047877260933 and parameters: {'n_estimators': 107, 'max_depth': 13, 'min_samples_split': 3, 'min_samples_leaf': 2, 'max_features': None, 'bootstrap': True, 'criterion': 'absolute_error'}. Best is trial 744 with value: 0.5032383725751689.
[I 2024-12-04 12:14:59,293] Trial 1351 finished with value: 0.5163075466291295 and parameters: {'n_estimators': 219, 'max_depth': 18, 'min_samples_split': 5, 'min_samples_leaf': 1, 'max_features': None, 'bootstrap': True, 'criterion': 'absolute_error'}. Best is trial 744 with value: 0.5032383725751689.
[I 2024-12-04 12:14:59,504] Trial 1364 finished with value: 0.5138095293014411 and parameters: {'n_estimators': 110, 'max_depth': 23, 'min_samples_split': 5, 'min_samples_leaf': 1, 'max_features': None, 'bootstrap': True, 'criterion': 'absolute_error'}. Best is trial 744 with value: 0.5032383725751689.
[I 2024-12-04 12:15:00,362] Trial 1328 finished with value: 0.6944669989966553 and parameters: {'n_estimators': 406, 'max_depth': 43, 'min_samples_split': 44, 'min_samples_leaf': 1, 'max_features': None, 'bootstrap': True, 'criterion': 'absolute_error'}. Best is trial 744 with value: 0.5032383725751689.
[I 2024-12-04 12:15:00,716] Trial 1353 finished with value: 0.5559474623795041 and parameters: {'n_estimators': 118, 'max_depth': 16, 'min_samples_split': 4, 'min_samples_leaf': 2, 'max_features': None, 'bootstrap': True, 'criterion': 'absolute_error'}. Best is trial 744 with value: 0.5032383725751689.
[I 2024-12-04 12:15:00,929] Trial 1359 finished with value: 1.193163784024085 and parameters: {'n_estimators': 811, 'max_depth': 13, 'min_samples_split': 5, 'min_samples_leaf': 5, 'max_features': 'sqrt', 'bootstrap': False, 'criterion': 'absolute_error'}. Best is trial 744 with value: 0.5032383725751689.
[I 2024-12-04 12:15:01,195] Trial 1365 finished with value: 0.7473723351096097 and parameters: {'n_estimators': 891, 'max_depth': 19, 'min_samples_split': 18, 'min_samples_leaf': 1, 'max_features': 'sqrt', 'bootstrap': False, 'criterion': 'squared_error'}. Best is trial 744 with value: 0.5032383725751689.
[I 2024-12-04 12:15:04,063] Trial 1357 finished with value: 0.5626049691500803 and parameters: {'n_estimators': 265, 'max_depth': 25, 'min_samples_split': 5, 'min_samples_leaf': 2, 'max_features': None, 'bootstrap': True, 'criterion': 'absolute_error'}. Best is trial 744 with value: 0.5032383725751689.
[I 2024-12-04 12:15:04,993] Trial 1370 finished with value: 0.8829305131905564 and parameters: {'n_estimators': 515, 'max_depth': 16, 'min_samples_split': 9, 'min_samples_leaf': 3, 'max_features': 'sqrt', 'bootstrap': False, 'criterion': 'squared_error'}. Best is trial 744 with value: 0.5032383725751689.
[I 2024-12-04 12:15:05,806] Trial 1354 finished with value: 0.5216234742428326 and parameters: {'n_estimators': 209, 'max_depth': 23, 'min_samples_split': 2, 'min_samples_leaf': 1, 'max_features': None, 'bootstrap': True, 'criterion': 'absolute_error'}. Best is trial 744 with value: 0.5032383725751689.
[I 2024-12-04 12:15:07,295] Trial 1366 finished with value: 0.5357978845025241 and parameters: {'n_estimators': 126, 'max_depth': 30, 'min_samples_split': 14, 'min_samples_leaf': 1, 'max_features': None, 'bootstrap': True, 'criterion': 'absolute_error'}. Best is trial 744 with value: 0.5032383725751689.
[I 2024-12-04 12:15:08,473] Trial 1372 finished with value: 0.5548200336534305 and parameters: {'n_estimators': 102, 'max_depth': 21, 'min_samples_split': 4, 'min_samples_leaf': 2, 'max_features': None, 'bootstrap': True, 'criterion': 'absolute_error'}. Best is trial 744 with value: 0.5032383725751689.
[I 2024-12-04 12:15:08,473] Trial 1358 finished with value: 0.5193170652549949 and parameters: {'n_estimators': 131, 'max_depth': 19, 'min_samples_split': 3, 'min_samples_leaf': 1, 'max_features': None, 'bootstrap': True, 'criterion': 'absolute_error'}. Best is trial 744 with value: 0.5032383725751689.
[I 2024-12-04 12:15:12,660] Trial 1363 finished with value: 0.5600437483433771 and parameters: {'n_estimators': 236, 'max_depth': 23, 'min_samples_split': 3, 'min_samples_leaf': 2, 'max_features': None, 'bootstrap': True, 'criterion': 'absolute_error'}. Best is trial 744 with value: 0.5032383725751689.
[I 2024-12-04 12:15:13,585] Trial 1369 finished with value: 0.5579656638775919 and parameters: {'n_estimators': 251, 'max_depth': 22, 'min_samples_split': 3, 'min_samples_leaf': 2, 'max_features': None, 'bootstrap': True, 'criterion': 'absolute_error'}. Best is trial 744 with value: 0.5032383725751689.
