[I 2024-12-04 13:05:08,037] Trial 1330 finished with value: 0.22908033191193483 and parameters: {'n_estimators': 1339, 'learning_rate': 0.06068499702145362, 'max_depth': 10, 'min_samples_split': 14, 'min_samples_leaf': 1, 'subsample': 0.6042142628648762, 'max_features': 'sqrt'}. Best is trial 1137 with value: 0.19687116000636118.
[I 2024-12-04 13:05:09,927] Trial 1346 finished with value: 0.29402956173660577 and parameters: {'n_estimators': 656, 'learning_rate': 0.01705364619867414, 'max_depth': 11, 'min_samples_split': 4, 'min_samples_leaf': 2, 'subsample': 0.6918713153462304, 'max_features': None}. Best is trial 1137 with value: 0.19687116000636118.
[I 2024-12-04 13:05:13,958] Trial 1331 finished with value: 0.2127404736508445 and parameters: {'n_estimators': 1311, 'learning_rate': 0.08478978362714967, 'max_depth': 11, 'min_samples_split': 15, 'min_samples_leaf': 1, 'subsample': 0.6068118000142254, 'max_features': 'sqrt'}. Best is trial 1137 with value: 0.19687116000636118.
[I 2024-12-04 13:05:17,575] Trial 1329 finished with value: 0.21945767200167307 and parameters: {'n_estimators': 1488, 'learning_rate': 0.08325287967961872, 'max_depth': 11, 'min_samples_split': 13, 'min_samples_leaf': 1, 'subsample': 0.6020498419194494, 'max_features': 'sqrt'}. Best is trial 1137 with value: 0.19687116000636118.
[I 2024-12-04 13:05:21,512] Trial 1357 finished with value: 0.7038100424912561 and parameters: {'n_estimators': 539, 'learning_rate': 0.010449595511991613, 'max_depth': 4, 'min_samples_split': 3, 'min_samples_leaf': 4, 'subsample': 0.8812980934969654, 'max_features': 'log2'}. Best is trial 1137 with value: 0.19687116000636118.
[I 2024-12-04 13:05:27,425] Trial 1336 finished with value: 0.25314146363057893 and parameters: {'n_estimators': 1471, 'learning_rate': 0.0764419136442903, 'max_depth': 12, 'min_samples_split': 17, 'min_samples_leaf': 3, 'subsample': 0.7022315170840474, 'max_features': 'sqrt'}. Best is trial 1137 with value: 0.19687116000636118.
[I 2024-12-04 13:05:29,635] Trial 1337 finished with value: 0.21198642393776038 and parameters: {'n_estimators': 1465, 'learning_rate': 0.07699805844223087, 'max_depth': 11, 'min_samples_split': 16, 'min_samples_leaf': 1, 'subsample': 0.6120948217937923, 'max_features': 'sqrt'}. Best is trial 1137 with value: 0.19687116000636118.
[I 2024-12-04 13:05:29,656] Trial 1339 finished with value: 0.25685419612329013 and parameters: {'n_estimators': 1464, 'learning_rate': 0.05736013710724159, 'max_depth': 11, 'min_samples_split': 15, 'min_samples_leaf': 3, 'subsample': 0.6108946217050144, 'max_features': 'sqrt'}. Best is trial 1137 with value: 0.19687116000636118.
[I 2024-12-04 13:05:31,286] Trial 1333 finished with value: 0.37441497231224785 and parameters: {'n_estimators': 1406, 'learning_rate': 0.013834669092143426, 'max_depth': 12, 'min_samples_split': 19, 'min_samples_leaf': 10, 'subsample': 0.993445819713054, 'max_features': None}. Best is trial 1137 with value: 0.19687116000636118.
[I 2024-12-04 13:05:31,750] Trial 1338 finished with value: 0.21490105388317582 and parameters: {'n_estimators': 1491, 'learning_rate': 0.08294273493312014, 'max_depth': 12, 'min_samples_split': 20, 'min_samples_leaf': 1, 'subsample': 0.6461113193877349, 'max_features': 'sqrt'}. Best is trial 1137 with value: 0.19687116000636118.
[I 2024-12-04 13:05:31,756] Trial 1340 finished with value: 0.23236416113054295 and parameters: {'n_estimators': 1458, 'learning_rate': 0.06273022272397834, 'max_depth': 10, 'min_samples_split': 18, 'min_samples_leaf': 1, 'subsample': 0.6094834283488451, 'max_features': 'sqrt'}. Best is trial 1137 with value: 0.19687116000636118.
[I 2024-12-04 13:05:35,634] Trial 1344 finished with value: 0.24266935309499957 and parameters: {'n_estimators': 1259, 'learning_rate': 0.06688856400494474, 'max_depth': 12, 'min_samples_split': 16, 'min_samples_leaf': 3, 'subsample': 0.6379403135829428, 'max_features': 'sqrt'}. Best is trial 1137 with value: 0.19687116000636118.
[I 2024-12-04 13:05:41,372] Trial 1341 finished with value: 0.22276842432068755 and parameters: {'n_estimators': 1483, 'learning_rate': 0.06058812726499318, 'max_depth': 12, 'min_samples_split': 18, 'min_samples_leaf': 1, 'subsample': 0.6956351972427838, 'max_features': 'sqrt'}. Best is trial 1137 with value: 0.19687116000636118.
[I 2024-12-04 13:05:41,981] Trial 1371 finished with value: 0.43858886166283007 and parameters: {'n_estimators': 132, 'learning_rate': 0.07776001877883507, 'max_depth': 4, 'min_samples_split': 11, 'min_samples_leaf': 3, 'subsample': 0.7473687093703948, 'max_features': 'sqrt'}. Best is trial 1137 with value: 0.19687116000636118.
[I 2024-12-04 13:05:42,109] Trial 1343 finished with value: 0.2022051797630636 and parameters: {'n_estimators': 1423, 'learning_rate': 0.09307445908499716, 'max_depth': 12, 'min_samples_split': 15, 'min_samples_leaf': 1, 'subsample': 0.6024689669918578, 'max_features': 'sqrt'}. Best is trial 1137 with value: 0.19687116000636118.
[I 2024-12-04 13:05:42,996] Trial 1345 finished with value: 0.21805431420304672 and parameters: {'n_estimators': 1322, 'learning_rate': 0.059982364246995386, 'max_depth': 11, 'min_samples_split': 16, 'min_samples_leaf': 1, 'subsample': 0.6418799633224544, 'max_features': 'sqrt'}. Best is trial 1137 with value: 0.19687116000636118.
[I 2024-12-04 13:05:49,859] Trial 1350 finished with value: 0.38817790644533945 and parameters: {'n_estimators': 1104, 'learning_rate': 0.011689104849642027, 'max_depth': 10, 'min_samples_split': 12, 'min_samples_leaf': 9, 'subsample': 0.6775342294948304, 'max_features': None}. Best is trial 1137 with value: 0.19687116000636118.
[I 2024-12-04 13:05:53,867] Trial 1348 finished with value: 0.20543650342601966 and parameters: {'n_estimators': 1404, 'learning_rate': 0.09971866643454175, 'max_depth': 11, 'min_samples_split': 17, 'min_samples_leaf': 1, 'subsample': 0.6941082229023651, 'max_features': 'sqrt'}. Best is trial 1137 with value: 0.19687116000636118.
[I 2024-12-04 13:05:53,912] Trial 1374 finished with value: 0.3665055398750307 and parameters: {'n_estimators': 207, 'learning_rate': 0.02355378781516832, 'max_depth': 10, 'min_samples_split': 18, 'min_samples_leaf': 6, 'subsample': 0.8066257342822543, 'max_features': None}. Best is trial 1137 with value: 0.19687116000636118.
[I 2024-12-04 13:05:55,173] Trial 1362 finished with value: 0.6999538971859022 and parameters: {'n_estimators': 951, 'learning_rate': 0.01223258855361291, 'max_depth': 5, 'min_samples_split': 20, 'min_samples_leaf': 10, 'subsample': 0.9555328841481217, 'max_features': 'log2'}. Best is trial 1137 with value: 0.19687116000636118.
[I 2024-12-04 13:05:58,883] Trial 1351 finished with value: 0.24550344910447744 and parameters: {'n_estimators': 1394, 'learning_rate': 0.07988863934093818, 'max_depth': 12, 'min_samples_split': 14, 'min_samples_leaf': 2, 'subsample': 0.6112595013466172, 'max_features': 'sqrt'}. Best is trial 1137 with value: 0.19687116000636118.
[I 2024-12-04 13:05:59,039] Trial 1353 finished with value: 0.3855441800134658 and parameters: {'n_estimators': 1275, 'learning_rate': 0.04415957433025066, 'max_depth': 12, 'min_samples_split': 7, 'min_samples_leaf': 9, 'subsample': 0.9130510917418376, 'max_features': 'sqrt'}. Best is trial 1137 with value: 0.19687116000636118.
[I 2024-12-04 13:06:00,912] Trial 1349 finished with value: 0.22488718501970692 and parameters: {'n_estimators': 1481, 'learning_rate': 0.06481318019461346, 'max_depth': 11, 'min_samples_split': 16, 'min_samples_leaf': 1, 'subsample': 0.6799665078227459, 'max_features': 'sqrt'}. Best is trial 1137 with value: 0.19687116000636118.
[I 2024-12-04 13:06:05,337] Trial 1355 finished with value: 0.2157979892284752 and parameters: {'n_estimators': 1319, 'learning_rate': 0.053850350089548776, 'max_depth': 12, 'min_samples_split': 20, 'min_samples_leaf': 1, 'subsample': 0.717802064399355, 'max_features': 'sqrt'}. Best is trial 1137 with value: 0.19687116000636118.
[I 2024-12-04 13:06:05,351] Trial 1354 finished with value: 0.21137147595790093 and parameters: {'n_estimators': 1387, 'learning_rate': 0.09666486135368747, 'max_depth': 12, 'min_samples_split': 17, 'min_samples_leaf': 1, 'subsample': 0.6259722614493956, 'max_features': 'sqrt'}. Best is trial 1137 with value: 0.19687116000636118.
[I 2024-12-04 13:06:07,668] Trial 1352 finished with value: 0.22642948219265147 and parameters: {'n_estimators': 1475, 'learning_rate': 0.09308623072673572, 'max_depth': 11, 'min_samples_split': 19, 'min_samples_leaf': 2, 'subsample': 0.6054471177282429, 'max_features': 'sqrt'}. Best is trial 1137 with value: 0.19687116000636118.
[I 2024-12-04 13:06:07,962] Trial 1360 finished with value: 0.2265304374241828 and parameters: {'n_estimators': 1236, 'learning_rate': 0.05375677508384391, 'max_depth': 12, 'min_samples_split': 17, 'min_samples_leaf': 1, 'subsample': 0.6320439581145944, 'max_features': 'sqrt'}. Best is trial 1137 with value: 0.19687116000636118.
[I 2024-12-04 13:06:12,467] Trial 1361 finished with value: 0.20469438504972412 and parameters: {'n_estimators': 1263, 'learning_rate': 0.08534068805267486, 'max_depth': 12, 'min_samples_split': 16, 'min_samples_leaf': 1, 'subsample': 0.6509134954678977, 'max_features': 'sqrt'}. Best is trial 1137 with value: 0.19687116000636118.
[I 2024-12-04 13:06:13,171] Trial 1356 finished with value: 0.22849226477142331 and parameters: {'n_estimators': 1429, 'learning_rate': 0.06344138917675395, 'max_depth': 12, 'min_samples_split': 14, 'min_samples_leaf': 2, 'subsample': 0.6086996486573414, 'max_features': 'sqrt'}. Best is trial 1137 with value: 0.19687116000636118.
[I 2024-12-04 13:06:16,878] Trial 1369 finished with value: 0.25720974219876647 and parameters: {'n_estimators': 1003, 'learning_rate': 0.06436663132802761, 'max_depth': 10, 'min_samples_split': 19, 'min_samples_leaf': 3, 'subsample': 0.6606621131600802, 'max_features': 'sqrt'}. Best is trial 1137 with value: 0.19687116000636118.
[I 2024-12-04 13:06:19,037] Trial 1358 finished with value: 0.2391002345157873 and parameters: {'n_estimators': 1497, 'learning_rate': 0.08902612037650354, 'max_depth': 12, 'min_samples_split': 16, 'min_samples_leaf': 2, 'subsample': 0.6754873478116035, 'max_features': 'sqrt'}. Best is trial 1137 with value: 0.19687116000636118.
[I 2024-12-04 13:06:19,108] Trial 1359 finished with value: 0.34781089351069594 and parameters: {'n_estimators': 1498, 'learning_rate': 0.056688287282249256, 'max_depth': 10, 'min_samples_split': 14, 'min_samples_leaf': 5, 'subsample': 0.6321449607586864, 'max_features': 'log2'}. Best is trial 1137 with value: 0.19687116000636118.
[I 2024-12-04 13:06:22,807] Trial 1363 finished with value: 0.2430135049321103 and parameters: {'n_estimators': 1473, 'learning_rate': 0.06669278331598683, 'max_depth': 12, 'min_samples_split': 15, 'min_samples_leaf': 3, 'subsample': 0.6542793704894061, 'max_features': 'sqrt'}. Best is trial 1137 with value: 0.19687116000636118.
[I 2024-12-04 13:06:25,617] Trial 1364 finished with value: 0.22698263790351028 and parameters: {'n_estimators': 1409, 'learning_rate': 0.07517683696561953, 'max_depth': 12, 'min_samples_split': 17, 'min_samples_leaf': 1, 'subsample': 0.6653367094065825, 'max_features': 'sqrt'}. Best is trial 1137 with value: 0.19687116000636118.
[I 2024-12-04 13:06:29,110] Trial 1365 finished with value: 0.20639510710271253 and parameters: {'n_estimators': 1463, 'learning_rate': 0.09097876087988958, 'max_depth': 12, 'min_samples_split': 16, 'min_samples_leaf': 1, 'subsample': 0.6217791581935355, 'max_features': 'sqrt'}. Best is trial 1137 with value: 0.19687116000636118.
[I 2024-12-04 13:06:31,154] Trial 1366 finished with value: 0.2112040140536616 and parameters: {'n_estimators': 1478, 'learning_rate': 0.058509409230163165, 'max_depth': 12, 'min_samples_split': 15, 'min_samples_leaf': 1, 'subsample': 0.6171699065296611, 'max_features': 'sqrt'}. Best is trial 1137 with value: 0.19687116000636118.
[I 2024-12-04 13:06:32,088] Trial 1367 finished with value: 0.23149727360138753 and parameters: {'n_estimators': 1472, 'learning_rate': 0.059564045844139074, 'max_depth': 12, 'min_samples_split': 17, 'min_samples_leaf': 2, 'subsample': 0.6035238976700686, 'max_features': 'sqrt'}. Best is trial 1137 with value: 0.19687116000636118.
[I 2024-12-04 13:06:34,772] Trial 1368 finished with value: 0.2275669207258467 and parameters: {'n_estimators': 1477, 'learning_rate': 0.08500751275681295, 'max_depth': 12, 'min_samples_split': 19, 'min_samples_leaf': 2, 'subsample': 0.6128203474164651, 'max_features': 'sqrt'}. Best is trial 1137 with value: 0.19687116000636118.
[I 2024-12-04 13:06:39,308] Trial 1370 finished with value: 0.2210144173829885 and parameters: {'n_estimators': 1482, 'learning_rate': 0.07119332068046037, 'max_depth': 10, 'min_samples_split': 17, 'min_samples_leaf': 1, 'subsample': 0.6420785999018254, 'max_features': 'sqrt'}. Best is trial 1137 with value: 0.19687116000636118.
[I 2024-12-04 13:06:42,653] Trial 1376 finished with value: 0.24626439990196997 and parameters: {'n_estimators': 1231, 'learning_rate': 0.0996439883910866, 'max_depth': 12, 'min_samples_split': 17, 'min_samples_leaf': 2, 'subsample': 0.6097090327908666, 'max_features': 'sqrt'}. Best is trial 1137 with value: 0.19687116000636118.
[I 2024-12-04 13:06:44,391] Trial 1373 finished with value: 0.28400331311258137 and parameters: {'n_estimators': 1245, 'learning_rate': 0.07124591092797783, 'max_depth': 12, 'min_samples_split': 16, 'min_samples_leaf': 3, 'subsample': 0.6361308615967458, 'max_features': None}. Best is trial 1137 with value: 0.19687116000636118.
[I 2024-12-04 13:06:45,270] Trial 1380 finished with value: 0.5633123815421245 and parameters: {'n_estimators': 1144, 'learning_rate': 0.030747929126737548, 'max_depth': 4, 'min_samples_split': 9, 'min_samples_leaf': 9, 'subsample': 0.63406444122197, 'max_features': 'log2'}. Best is trial 1137 with value: 0.19687116000636118.
[I 2024-12-04 13:06:49,095] Trial 1399 finished with value: 0.4071230138568224 and parameters: {'n_estimators': 521, 'learning_rate': 0.01920560312481667, 'max_depth': 6, 'min_samples_split': 4, 'min_samples_leaf': 5, 'subsample': 0.8444208700831192, 'max_features': 'sqrt'}. Best is trial 1137 with value: 0.19687116000636118.
[I 2024-12-04 13:06:51,871] Trial 1372 finished with value: 0.2848396944975355 and parameters: {'n_estimators': 1309, 'learning_rate': 0.012764007087127851, 'max_depth': 12, 'min_samples_split': 13, 'min_samples_leaf': 2, 'subsample': 0.9266410199064219, 'max_features': None}. Best is trial 1137 with value: 0.19687116000636118.
[I 2024-12-04 13:06:52,362] Trial 1377 finished with value: 0.2564008631852376 and parameters: {'n_estimators': 1423, 'learning_rate': 0.05639698226202048, 'max_depth': 12, 'min_samples_split': 20, 'min_samples_leaf': 4, 'subsample': 0.7007763433596911, 'max_features': 'sqrt'}. Best is trial 1137 with value: 0.19687116000636118.
[I 2024-12-04 13:06:54,041] Trial 1375 finished with value: 0.23372848694404597 and parameters: {'n_estimators': 1498, 'learning_rate': 0.09034633362968607, 'max_depth': 12, 'min_samples_split': 20, 'min_samples_leaf': 2, 'subsample': 0.6598115351168001, 'max_features': 'sqrt'}. Best is trial 1137 with value: 0.19687116000636118.
[I 2024-12-04 13:06:58,403] Trial 1385 finished with value: 0.2393913301503907 and parameters: {'n_estimators': 1202, 'learning_rate': 0.07662347080634192, 'max_depth': 12, 'min_samples_split': 16, 'min_samples_leaf': 3, 'subsample': 0.6004681217279753, 'max_features': 'sqrt'}. Best is trial 1137 with value: 0.19687116000636118.
[I 2024-12-04 13:07:03,256] Trial 1379 finished with value: 0.2480856377337971 and parameters: {'n_estimators': 1490, 'learning_rate': 0.09892354406592727, 'max_depth': 11, 'min_samples_split': 12, 'min_samples_leaf': 3, 'subsample': 0.6117087866902212, 'max_features': 'sqrt'}. Best is trial 1137 with value: 0.19687116000636118.
[I 2024-12-04 13:07:05,142] Trial 1381 finished with value: 0.23356575082412867 and parameters: {'n_estimators': 1500, 'learning_rate': 0.07828107430511277, 'max_depth': 10, 'min_samples_split': 15, 'min_samples_leaf': 1, 'subsample': 0.722322766677803, 'max_features': 'log2'}. Best is trial 1137 with value: 0.19687116000636118.
[I 2024-12-04 13:07:06,839] Trial 1382 finished with value: 0.24546778877193368 and parameters: {'n_estimators': 1491, 'learning_rate': 0.06895500424205611, 'max_depth': 11, 'min_samples_split': 15, 'min_samples_leaf': 3, 'subsample': 0.6031766800594098, 'max_features': 'sqrt'}. Best is trial 1137 with value: 0.19687116000636118.
[I 2024-12-04 13:07:08,536] Trial 1384 finished with value: 0.21446160956280308 and parameters: {'n_estimators': 1404, 'learning_rate': 0.09432904619903237, 'max_depth': 12, 'min_samples_split': 15, 'min_samples_leaf': 1, 'subsample': 0.6169399273767324, 'max_features': 'sqrt'}. Best is trial 1137 with value: 0.19687116000636118.
[I 2024-12-04 13:07:08,951] Trial 1387 finished with value: 0.2542873236602263 and parameters: {'n_estimators': 1318, 'learning_rate': 0.09678365400371589, 'max_depth': 10, 'min_samples_split': 14, 'min_samples_leaf': 3, 'subsample': 0.608004697283254, 'max_features': 'sqrt'}. Best is trial 1137 with value: 0.19687116000636118.
[I 2024-12-04 13:07:10,783] Trial 1383 finished with value: 0.29796768664088435 and parameters: {'n_estimators': 1262, 'learning_rate': 0.024365207994654168, 'max_depth': 12, 'min_samples_split': 2, 'min_samples_leaf': 5, 'subsample': 0.7971358011570472, 'max_features': None}. Best is trial 1137 with value: 0.19687116000636118.
[I 2024-12-04 13:07:12,127] Trial 1378 finished with value: 0.25058498451398675 and parameters: {'n_estimators': 1417, 'learning_rate': 0.0988644537620871, 'max_depth': 12, 'min_samples_split': 20, 'min_samples_leaf': 1, 'subsample': 0.6361374602775713, 'max_features': None}. Best is trial 1137 with value: 0.19687116000636118.
[I 2024-12-04 13:07:15,497] Trial 1390 finished with value: 0.23746728903901757 and parameters: {'n_estimators': 1307, 'learning_rate': 0.0964289770466152, 'max_depth': 10, 'min_samples_split': 16, 'min_samples_leaf': 2, 'subsample': 0.6060621975360688, 'max_features': 'sqrt'}. Best is trial 1137 with value: 0.19687116000636118.
[I 2024-12-04 13:07:18,375] Trial 1386 finished with value: 0.2104891434841465 and parameters: {'n_estimators': 1480, 'learning_rate': 0.06809462807747502, 'max_depth': 12, 'min_samples_split': 16, 'min_samples_leaf': 1, 'subsample': 0.6361052359166656, 'max_features': 'sqrt'}. Best is trial 1137 with value: 0.19687116000636118.
[I 2024-12-04 13:07:18,387] Trial 1395 finished with value: 0.22579695167231367 and parameters: {'n_estimators': 1190, 'learning_rate': 0.08922629265439978, 'max_depth': 12, 'min_samples_split': 15, 'min_samples_leaf': 1, 'subsample': 0.6056060335691771, 'max_features': 'sqrt'}. Best is trial 1137 with value: 0.19687116000636118.
[I 2024-12-04 13:07:19,472] Trial 1392 finished with value: 0.2358450067777426 and parameters: {'n_estimators': 1298, 'learning_rate': 0.09148587848176978, 'max_depth': 12, 'min_samples_split': 16, 'min_samples_leaf': 2, 'subsample': 0.6010227344453186, 'max_features': 'sqrt'}. Best is trial 1137 with value: 0.19687116000636118.
[I 2024-12-04 13:07:20,295] Trial 1388 finished with value: 0.24653369838863043 and parameters: {'n_estimators': 1450, 'learning_rate': 0.09501685202624637, 'max_depth': 11, 'min_samples_split': 15, 'min_samples_leaf': 2, 'subsample': 0.607266467132489, 'max_features': 'sqrt'}. Best is trial 1137 with value: 0.19687116000636118.
[I 2024-12-04 13:07:20,715] Trial 1394 finished with value: 0.2927511046444114 and parameters: {'n_estimators': 1082, 'learning_rate': 0.0103465125236615, 'max_depth': 11, 'min_samples_split': 3, 'min_samples_leaf': 3, 'subsample': 0.8377231427761754, 'max_features': None}. Best is trial 1137 with value: 0.19687116000636118.
[I 2024-12-04 13:07:24,567] Trial 1389 finished with value: 0.2411945610546148 and parameters: {'n_estimators': 1475, 'learning_rate': 0.09925146913330497, 'max_depth': 12, 'min_samples_split': 18, 'min_samples_leaf': 3, 'subsample': 0.6035262603418655, 'max_features': 'sqrt'}. Best is trial 1137 with value: 0.19687116000636118.
[I 2024-12-04 13:07:31,279] Trial 1393 finished with value: 0.20296569743825396 and parameters: {'n_estimators': 1451, 'learning_rate': 0.09714262173941118, 'max_depth': 10, 'min_samples_split': 17, 'min_samples_leaf': 1, 'subsample': 0.6120976281098657, 'max_features': 'sqrt'}. Best is trial 1137 with value: 0.19687116000636118.
[I 2024-12-04 13:07:32,106] Trial 1397 finished with value: 0.21798764924647104 and parameters: {'n_estimators': 1392, 'learning_rate': 0.06830157818204251, 'max_depth': 12, 'min_samples_split': 16, 'min_samples_leaf': 1, 'subsample': 0.6145983676705108, 'max_features': 'sqrt'}. Best is trial 1137 with value: 0.19687116000636118.
[I 2024-12-04 13:07:34,932] Trial 1396 finished with value: 0.24548495100844542 and parameters: {'n_estimators': 1444, 'learning_rate': 0.07198812182695113, 'max_depth': 12, 'min_samples_split': 17, 'min_samples_leaf': 3, 'subsample': 0.7045397134382574, 'max_features': 'sqrt'}. Best is trial 1137 with value: 0.19687116000636118.
[I 2024-12-04 13:07:35,787] Trial 1391 finished with value: 0.26654175932491475 and parameters: {'n_estimators': 1396, 'learning_rate': 0.07384679514085132, 'max_depth': 12, 'min_samples_split': 14, 'min_samples_leaf': 1, 'subsample': 0.629474915273005, 'max_features': None}. Best is trial 1137 with value: 0.19687116000636118.
[I 2024-12-04 13:07:40,669] Trial 1398 finished with value: 0.2138110882361372 and parameters: {'n_estimators': 1453, 'learning_rate': 0.09526090197842824, 'max_depth': 11, 'min_samples_split': 15, 'min_samples_leaf': 1, 'subsample': 0.6852853320285899, 'max_features': 'sqrt'}. Best is trial 1137 with value: 0.19687116000636118.
