[I 2024-12-04 15:26:03,423] Trial 1570 finished with value: 0.4236293243463019 and parameters: {'n_estimators': 868, 'max_depth': 39, 'min_samples_split': 3, 'min_samples_leaf': 1, 'max_features': None, 'bootstrap': True, 'criterion': 'squared_error'}. Best is trial 1025 with value: 0.41844370194907604.
[I 2024-12-04 15:26:04,120] Trial 1577 finished with value: 0.4653832515844141 and parameters: {'n_estimators': 815, 'max_depth': 43, 'min_samples_split': 4, 'min_samples_leaf': 2, 'max_features': None, 'bootstrap': True, 'criterion': 'squared_error'}. Best is trial 1025 with value: 0.41844370194907604.
[I 2024-12-04 15:26:06,195] Trial 1584 finished with value: 0.6129589719659241 and parameters: {'n_estimators': 789, 'max_depth': 37, 'min_samples_split': 2, 'min_samples_leaf': 2, 'max_features': None, 'bootstrap': False, 'criterion': 'squared_error'}. Best is trial 1025 with value: 0.41844370194907604.
[I 2024-12-04 15:26:07,469] Trial 1591 finished with value: 1.0651573294269687 and parameters: {'n_estimators': 226, 'max_depth': 13, 'min_samples_split': 5, 'min_samples_leaf': 15, 'max_features': 'log2', 'bootstrap': True, 'criterion': 'absolute_error'}. Best is trial 1025 with value: 0.41844370194907604.
[I 2024-12-04 15:26:07,576] Trial 1582 finished with value: 0.4197047435874112 and parameters: {'n_estimators': 711, 'max_depth': 39, 'min_samples_split': 2, 'min_samples_leaf': 1, 'max_features': None, 'bootstrap': True, 'criterion': 'squared_error'}. Best is trial 1025 with value: 0.41844370194907604.
[I 2024-12-04 15:26:09,302] Trial 1590 finished with value: 0.9616375801198846 and parameters: {'n_estimators': 530, 'max_depth': 16, 'min_samples_split': 3, 'min_samples_leaf': 6, 'max_features': 'sqrt', 'bootstrap': True, 'criterion': 'absolute_error'}. Best is trial 1025 with value: 0.41844370194907604.
[I 2024-12-04 15:26:09,316] Trial 1587 finished with value: 0.5859984831480348 and parameters: {'n_estimators': 277, 'max_depth': 50, 'min_samples_split': 21, 'min_samples_leaf': 1, 'max_features': 'sqrt', 'bootstrap': True, 'criterion': 'absolute_error'}. Best is trial 1025 with value: 0.41844370194907604.
[I 2024-12-04 15:26:09,330] Trial 1581 finished with value: 0.42026278436942455 and parameters: {'n_estimators': 980, 'max_depth': 31, 'min_samples_split': 2, 'min_samples_leaf': 1, 'max_features': None, 'bootstrap': True, 'criterion': 'squared_error'}. Best is trial 1025 with value: 0.41844370194907604.
[I 2024-12-04 15:26:09,696] Trial 1579 finished with value: 0.4210659970399282 and parameters: {'n_estimators': 880, 'max_depth': 35, 'min_samples_split': 2, 'min_samples_leaf': 1, 'max_features': None, 'bootstrap': True, 'criterion': 'squared_error'}. Best is trial 1025 with value: 0.41844370194907604.
[I 2024-12-04 15:26:09,905] Trial 1580 finished with value: 0.4214992191126046 and parameters: {'n_estimators': 805, 'max_depth': 42, 'min_samples_split': 2, 'min_samples_leaf': 1, 'max_features': None, 'bootstrap': True, 'criterion': 'squared_error'}. Best is trial 1025 with value: 0.41844370194907604.
[I 2024-12-04 15:26:10,810] Trial 1593 finished with value: 0.6155949721747126 and parameters: {'n_estimators': 643, 'max_depth': 7, 'min_samples_split': 30, 'min_samples_leaf': 2, 'max_features': None, 'bootstrap': True, 'criterion': 'squared_error'}. Best is trial 1025 with value: 0.41844370194907604.
[I 2024-12-04 15:26:13,584] Trial 1585 finished with value: 0.43245489452329694 and parameters: {'n_estimators': 845, 'max_depth': 34, 'min_samples_split': 4, 'min_samples_leaf': 1, 'max_features': None, 'bootstrap': True, 'criterion': 'squared_error'}. Best is trial 1025 with value: 0.41844370194907604.
[I 2024-12-04 15:26:14,128] Trial 1540 finished with value: 0.4299317148305731 and parameters: {'n_estimators': 736, 'max_depth': 43, 'min_samples_split': 2, 'min_samples_leaf': 1, 'max_features': None, 'bootstrap': True, 'criterion': 'absolute_error'}. Best is trial 1025 with value: 0.41844370194907604.
[I 2024-12-04 15:26:14,380] Trial 1592 finished with value: 0.8122091873593169 and parameters: {'n_estimators': 634, 'max_depth': 11, 'min_samples_split': 2, 'min_samples_leaf': 2, 'max_features': 'sqrt', 'bootstrap': False, 'criterion': 'squared_error'}. Best is trial 1025 with value: 0.41844370194907604.
[I 2024-12-04 15:26:15,708] Trial 1598 finished with value: 0.42306443816962097 and parameters: {'n_estimators': 511, 'max_depth': 36, 'min_samples_split': 2, 'min_samples_leaf': 1, 'max_features': None, 'bootstrap': True, 'criterion': 'squared_error'}. Best is trial 1025 with value: 0.41844370194907604.
[I 2024-12-04 15:26:15,740] Trial 1575 finished with value: 0.531219895295887 and parameters: {'n_estimators': 831, 'max_depth': 44, 'min_samples_split': 2, 'min_samples_leaf': 1, 'max_features': 'sqrt', 'bootstrap': True, 'criterion': 'absolute_error'}. Best is trial 1025 with value: 0.41844370194907604.
[I 2024-12-04 15:26:15,895] Trial 1586 finished with value: 0.46483911781071696 and parameters: {'n_estimators': 679, 'max_depth': 41, 'min_samples_split': 2, 'min_samples_leaf': 2, 'max_features': None, 'bootstrap': True, 'criterion': 'squared_error'}. Best is trial 1025 with value: 0.41844370194907604.
[I 2024-12-04 15:26:17,326] Trial 1594 finished with value: 0.4233589719524027 and parameters: {'n_estimators': 585, 'max_depth': 34, 'min_samples_split': 2, 'min_samples_leaf': 1, 'max_features': None, 'bootstrap': True, 'criterion': 'squared_error'}. Best is trial 1025 with value: 0.41844370194907604.
[I 2024-12-04 15:26:17,899] Trial 1588 finished with value: 0.4237930013301911 and parameters: {'n_estimators': 847, 'max_depth': 39, 'min_samples_split': 3, 'min_samples_leaf': 1, 'max_features': None, 'bootstrap': True, 'criterion': 'squared_error'}. Best is trial 1025 with value: 0.41844370194907604.
[I 2024-12-04 15:26:19,414] Trial 1595 finished with value: 0.4653736288723266 and parameters: {'n_estimators': 811, 'max_depth': 40, 'min_samples_split': 2, 'min_samples_leaf': 2, 'max_features': None, 'bootstrap': True, 'criterion': 'squared_error'}. Best is trial 1025 with value: 0.41844370194907604.
[I 2024-12-04 15:26:25,390] Trial 1601 finished with value: 0.42287557922592567 and parameters: {'n_estimators': 641, 'max_depth': 44, 'min_samples_split': 2, 'min_samples_leaf': 1, 'max_features': None, 'bootstrap': True, 'criterion': 'squared_error'}. Best is trial 1025 with value: 0.41844370194907604.
[I 2024-12-04 15:26:26,690] Trial 1600 finished with value: 0.5231208149169801 and parameters: {'n_estimators': 555, 'max_depth': 36, 'min_samples_split': 2, 'min_samples_leaf': 1, 'max_features': None, 'bootstrap': False, 'criterion': 'squared_error'}. Best is trial 1025 with value: 0.41844370194907604.
[I 2024-12-04 15:26:26,774] Trial 1599 finished with value: 0.43092855475772235 and parameters: {'n_estimators': 718, 'max_depth': 41, 'min_samples_split': 4, 'min_samples_leaf': 1, 'max_features': None, 'bootstrap': True, 'criterion': 'squared_error'}. Best is trial 1025 with value: 0.41844370194907604.
[I 2024-12-04 15:26:30,074] Trial 1596 finished with value: 0.41930447054932707 and parameters: {'n_estimators': 866, 'max_depth': 41, 'min_samples_split': 2, 'min_samples_leaf': 1, 'max_features': None, 'bootstrap': True, 'criterion': 'squared_error'}. Best is trial 1025 with value: 0.41844370194907604.
[I 2024-12-04 15:26:32,280] Trial 1606 finished with value: 0.542705923460307 and parameters: {'n_estimators': 762, 'max_depth': 39, 'min_samples_split': 28, 'min_samples_leaf': 3, 'max_features': None, 'bootstrap': True, 'criterion': 'squared_error'}. Best is trial 1025 with value: 0.41844370194907604.
[I 2024-12-04 15:26:36,789] Trial 1603 finished with value: 0.421200807022841 and parameters: {'n_estimators': 746, 'max_depth': 33, 'min_samples_split': 2, 'min_samples_leaf': 1, 'max_features': None, 'bootstrap': True, 'criterion': 'squared_error'}. Best is trial 1025 with value: 0.41844370194907604.
[I 2024-12-04 15:26:37,585] Trial 1605 finished with value: 0.4203706728823648 and parameters: {'n_estimators': 822, 'max_depth': 38, 'min_samples_split': 2, 'min_samples_leaf': 1, 'max_features': None, 'bootstrap': True, 'criterion': 'squared_error'}. Best is trial 1025 with value: 0.41844370194907604.
[I 2024-12-04 15:26:37,869] Trial 1616 finished with value: 0.9587125204933915 and parameters: {'n_estimators': 707, 'max_depth': 43, 'min_samples_split': 2, 'min_samples_leaf': 2, 'max_features': 'log2', 'bootstrap': True, 'criterion': 'squared_error'}. Best is trial 1025 with value: 0.41844370194907604.
[I 2024-12-04 15:26:43,101] Trial 1609 finished with value: 0.465020741740086 and parameters: {'n_estimators': 764, 'max_depth': 30, 'min_samples_split': 2, 'min_samples_leaf': 2, 'max_features': None, 'bootstrap': True, 'criterion': 'squared_error'}. Best is trial 1025 with value: 0.41844370194907604.
[I 2024-12-04 15:26:46,336] Trial 1620 finished with value: 0.637415943581053 and parameters: {'n_estimators': 566, 'max_depth': 39, 'min_samples_split': 2, 'min_samples_leaf': 2, 'max_features': 'sqrt', 'bootstrap': False, 'criterion': 'squared_error'}. Best is trial 1025 with value: 0.41844370194907604.
[I 2024-12-04 15:26:46,357] Trial 1612 finished with value: 0.7260802929261818 and parameters: {'n_estimators': 322, 'max_depth': 44, 'min_samples_split': 4, 'min_samples_leaf': 10, 'max_features': None, 'bootstrap': False, 'criterion': 'absolute_error'}. Best is trial 1025 with value: 0.41844370194907604.
[I 2024-12-04 15:26:46,759] Trial 1608 finished with value: 0.42198309776141396 and parameters: {'n_estimators': 746, 'max_depth': 49, 'min_samples_split': 2, 'min_samples_leaf': 1, 'max_features': None, 'bootstrap': True, 'criterion': 'squared_error'}. Best is trial 1025 with value: 0.41844370194907604.
[I 2024-12-04 15:26:51,156] Trial 1617 finished with value: 0.6414938278582194 and parameters: {'n_estimators': 830, 'max_depth': 40, 'min_samples_split': 3, 'min_samples_leaf': 1, 'max_features': 'log2', 'bootstrap': True, 'criterion': 'squared_error'}. Best is trial 1025 with value: 0.41844370194907604.
[I 2024-12-04 15:26:51,574] Trial 1607 finished with value: 0.46513629748247304 and parameters: {'n_estimators': 915, 'max_depth': 50, 'min_samples_split': 3, 'min_samples_leaf': 2, 'max_features': None, 'bootstrap': True, 'criterion': 'squared_error'}. Best is trial 1025 with value: 0.41844370194907604.
[I 2024-12-04 15:26:54,693] Trial 1618 finished with value: 0.5320780807589858 and parameters: {'n_estimators': 886, 'max_depth': 45, 'min_samples_split': 2, 'min_samples_leaf': 1, 'max_features': None, 'bootstrap': False, 'criterion': 'squared_error'}. Best is trial 1025 with value: 0.41844370194907604.
[I 2024-12-04 15:26:55,360] Trial 1627 finished with value: 0.8999991185901172 and parameters: {'n_estimators': 540, 'max_depth': 7, 'min_samples_split': 8, 'min_samples_leaf': 1, 'max_features': 'sqrt', 'bootstrap': True, 'criterion': 'squared_error'}. Best is trial 1025 with value: 0.41844370194907604.
[I 2024-12-04 15:26:58,704] Trial 1604 finished with value: 0.42123296558872597 and parameters: {'n_estimators': 836, 'max_depth': 42, 'min_samples_split': 2, 'min_samples_leaf': 1, 'max_features': None, 'bootstrap': True, 'criterion': 'squared_error'}. Best is trial 1025 with value: 0.41844370194907604.
[I 2024-12-04 15:26:59,115] Trial 1629 finished with value: 0.9929307991516899 and parameters: {'n_estimators': 429, 'max_depth': 50, 'min_samples_split': 10, 'min_samples_leaf': 11, 'max_features': 'sqrt', 'bootstrap': False, 'criterion': 'squared_error'}. Best is trial 1025 with value: 0.41844370194907604.
[I 2024-12-04 15:27:01,765] Trial 1623 finished with value: 0.694070444572707 and parameters: {'n_estimators': 549, 'max_depth': 36, 'min_samples_split': 5, 'min_samples_leaf': 2, 'max_features': 'sqrt', 'bootstrap': False, 'criterion': 'absolute_error'}. Best is trial 1025 with value: 0.41844370194907604.
[I 2024-12-04 15:27:03,196] Trial 1614 finished with value: 0.4320774406807005 and parameters: {'n_estimators': 889, 'max_depth': 43, 'min_samples_split': 4, 'min_samples_leaf': 1, 'max_features': None, 'bootstrap': True, 'criterion': 'squared_error'}. Best is trial 1025 with value: 0.41844370194907604.
[I 2024-12-04 15:27:04,714] Trial 1611 finished with value: 0.46545128317609924 and parameters: {'n_estimators': 992, 'max_depth': 40, 'min_samples_split': 2, 'min_samples_leaf': 2, 'max_features': None, 'bootstrap': True, 'criterion': 'squared_error'}. Best is trial 1025 with value: 0.41844370194907604.
[I 2024-12-04 15:27:05,220] Trial 1615 finished with value: 0.4315348548279549 and parameters: {'n_estimators': 869, 'max_depth': 41, 'min_samples_split': 4, 'min_samples_leaf': 1, 'max_features': None, 'bootstrap': True, 'criterion': 'squared_error'}. Best is trial 1025 with value: 0.41844370194907604.
[I 2024-12-04 15:27:06,069] Trial 1619 finished with value: 0.42398943157458974 and parameters: {'n_estimators': 968, 'max_depth': 37, 'min_samples_split': 3, 'min_samples_leaf': 1, 'max_features': None, 'bootstrap': True, 'criterion': 'squared_error'}. Best is trial 1025 with value: 0.41844370194907604.
[I 2024-12-04 15:27:08,441] Trial 1621 finished with value: 0.42042604295396735 and parameters: {'n_estimators': 730, 'max_depth': 38, 'min_samples_split': 2, 'min_samples_leaf': 1, 'max_features': None, 'bootstrap': True, 'criterion': 'squared_error'}. Best is trial 1025 with value: 0.41844370194907604.
[I 2024-12-04 15:27:08,948] Trial 1624 finished with value: 0.46460720753129325 and parameters: {'n_estimators': 708, 'max_depth': 38, 'min_samples_split': 2, 'min_samples_leaf': 2, 'max_features': None, 'bootstrap': True, 'criterion': 'squared_error'}. Best is trial 1025 with value: 0.41844370194907604.
[I 2024-12-04 15:27:09,059] Trial 1622 finished with value: 0.4243086972099779 and parameters: {'n_estimators': 693, 'max_depth': 40, 'min_samples_split': 3, 'min_samples_leaf': 1, 'max_features': None, 'bootstrap': True, 'criterion': 'squared_error'}. Best is trial 1025 with value: 0.41844370194907604.
[I 2024-12-04 15:27:09,060] Trial 1638 finished with value: 0.5254737735850425 and parameters: {'n_estimators': 136, 'max_depth': 29, 'min_samples_split': 2, 'min_samples_leaf': 1, 'max_features': None, 'bootstrap': False, 'criterion': 'squared_error'}. Best is trial 1025 with value: 0.41844370194907604.
[I 2024-12-04 15:27:13,269] Trial 1613 finished with value: 0.4187205755539451 and parameters: {'n_estimators': 772, 'max_depth': 40, 'min_samples_split': 2, 'min_samples_leaf': 1, 'max_features': None, 'bootstrap': True, 'criterion': 'squared_error'}. Best is trial 1025 with value: 0.41844370194907604.
[I 2024-12-04 15:27:15,113] Trial 1628 finished with value: 0.6419787962172963 and parameters: {'n_estimators': 733, 'max_depth': 36, 'min_samples_split': 2, 'min_samples_leaf': 7, 'max_features': None, 'bootstrap': True, 'criterion': 'squared_error'}. Best is trial 1025 with value: 0.41844370194907604.
[I 2024-12-04 15:27:16,098] Trial 1639 finished with value: 0.7042544264413614 and parameters: {'n_estimators': 219, 'max_depth': 46, 'min_samples_split': 25, 'min_samples_leaf': 1, 'max_features': 'log2', 'bootstrap': False, 'criterion': 'absolute_error'}. Best is trial 1025 with value: 0.41844370194907604.
[I 2024-12-04 15:27:18,622] Trial 1641 finished with value: 1.0557561535436688 and parameters: {'n_estimators': 171, 'max_depth': 26, 'min_samples_split': 40, 'min_samples_leaf': 11, 'max_features': 'log2', 'bootstrap': False, 'criterion': 'absolute_error'}. Best is trial 1025 with value: 0.41844370194907604.
[I 2024-12-04 15:27:19,332] Trial 1632 finished with value: 0.46476320152474376 and parameters: {'n_estimators': 861, 'max_depth': 38, 'min_samples_split': 2, 'min_samples_leaf': 2, 'max_features': None, 'bootstrap': True, 'criterion': 'squared_error'}. Best is trial 1025 with value: 0.41844370194907604.
[I 2024-12-04 15:27:20,580] Trial 1610 finished with value: 0.46321160682615786 and parameters: {'n_estimators': 623, 'max_depth': 27, 'min_samples_split': 4, 'min_samples_leaf': 2, 'max_features': None, 'bootstrap': True, 'criterion': 'absolute_error'}. Best is trial 1025 with value: 0.41844370194907604.
[I 2024-12-04 15:27:20,974] Trial 1630 finished with value: 0.419306755406553 and parameters: {'n_estimators': 855, 'max_depth': 39, 'min_samples_split': 2, 'min_samples_leaf': 1, 'max_features': None, 'bootstrap': True, 'criterion': 'squared_error'}. Best is trial 1025 with value: 0.41844370194907604.
[I 2024-12-04 15:27:23,078] Trial 1625 finished with value: 0.42102381747731127 and parameters: {'n_estimators': 867, 'max_depth': 35, 'min_samples_split': 2, 'min_samples_leaf': 1, 'max_features': None, 'bootstrap': True, 'criterion': 'squared_error'}. Best is trial 1025 with value: 0.41844370194907604.
[I 2024-12-04 15:27:23,779] Trial 1634 finished with value: 0.4645011634521377 and parameters: {'n_estimators': 619, 'max_depth': 36, 'min_samples_split': 4, 'min_samples_leaf': 2, 'max_features': None, 'bootstrap': True, 'criterion': 'squared_error'}. Best is trial 1025 with value: 0.41844370194907604.
[I 2024-12-04 15:27:24,237] Trial 1626 finished with value: 0.42093808221619977 and parameters: {'n_estimators': 909, 'max_depth': 44, 'min_samples_split': 2, 'min_samples_leaf': 1, 'max_features': None, 'bootstrap': True, 'criterion': 'squared_error'}. Best is trial 1025 with value: 0.41844370194907604.
[I 2024-12-04 15:27:24,292] Trial 1648 finished with value: 0.6216358494260749 and parameters: {'n_estimators': 142, 'max_depth': 47, 'min_samples_split': 8, 'min_samples_leaf': 1, 'max_features': 'log2', 'bootstrap': False, 'criterion': 'squared_error'}. Best is trial 1025 with value: 0.41844370194907604.
[I 2024-12-04 15:27:24,305] Trial 1636 finished with value: 0.4196216398233679 and parameters: {'n_estimators': 643, 'max_depth': 41, 'min_samples_split': 2, 'min_samples_leaf': 1, 'max_features': None, 'bootstrap': True, 'criterion': 'squared_error'}. Best is trial 1025 with value: 0.41844370194907604.
[I 2024-12-04 15:27:24,620] Trial 1635 finished with value: 0.6160688407192547 and parameters: {'n_estimators': 474, 'max_depth': 42, 'min_samples_split': 36, 'min_samples_leaf': 1, 'max_features': 'sqrt', 'bootstrap': False, 'criterion': 'absolute_error'}. Best is trial 1025 with value: 0.41844370194907604.
[I 2024-12-04 15:27:26,198] Trial 1631 finished with value: 0.42085987900960625 and parameters: {'n_estimators': 986, 'max_depth': 35, 'min_samples_split': 2, 'min_samples_leaf': 1, 'max_features': None, 'bootstrap': True, 'criterion': 'squared_error'}. Best is trial 1025 with value: 0.41844370194907604.
[I 2024-12-04 15:27:27,319] Trial 1633 finished with value: 0.42241186521937973 and parameters: {'n_estimators': 658, 'max_depth': 45, 'min_samples_split': 2, 'min_samples_leaf': 1, 'max_features': None, 'bootstrap': True, 'criterion': 'squared_error'}. Best is trial 1025 with value: 0.41844370194907604.
[I 2024-12-04 15:27:29,839] Trial 1644 finished with value: 0.4329085927945405 and parameters: {'n_estimators': 678, 'max_depth': 31, 'min_samples_split': 4, 'min_samples_leaf': 1, 'max_features': None, 'bootstrap': True, 'criterion': 'squared_error'}. Best is trial 1025 with value: 0.41844370194907604.
[I 2024-12-04 15:27:30,008] Trial 1649 finished with value: 1.0318310303060942 and parameters: {'n_estimators': 496, 'max_depth': 45, 'min_samples_split': 39, 'min_samples_leaf': 5, 'max_features': 'log2', 'bootstrap': False, 'criterion': 'absolute_error'}. Best is trial 1025 with value: 0.41844370194907604.
[I 2024-12-04 15:27:30,010] Trial 1645 finished with value: 1.0559227810697285 and parameters: {'n_estimators': 524, 'max_depth': 34, 'min_samples_split': 4, 'min_samples_leaf': 13, 'max_features': 'log2', 'bootstrap': False, 'criterion': 'absolute_error'}. Best is trial 1025 with value: 0.41844370194907604.
[I 2024-12-04 15:27:30,231] Trial 1637 finished with value: 0.4317042581654024 and parameters: {'n_estimators': 785, 'max_depth': 40, 'min_samples_split': 4, 'min_samples_leaf': 1, 'max_features': None, 'bootstrap': True, 'criterion': 'squared_error'}. Best is trial 1025 with value: 0.41844370194907604.
[I 2024-12-04 15:27:35,203] Trial 1643 finished with value: 0.4334889588904912 and parameters: {'n_estimators': 630, 'max_depth': 34, 'min_samples_split': 4, 'min_samples_leaf': 1, 'max_features': None, 'bootstrap': True, 'criterion': 'squared_error'}. Best is trial 1025 with value: 0.41844370194907604.
[I 2024-12-04 15:27:35,945] Trial 1640 finished with value: 0.4229623054687191 and parameters: {'n_estimators': 627, 'max_depth': 35, 'min_samples_split': 2, 'min_samples_leaf': 1, 'max_features': None, 'bootstrap': True, 'criterion': 'squared_error'}. Best is trial 1025 with value: 0.41844370194907604.
[I 2024-12-04 15:27:37,834] Trial 1654 finished with value: 0.7119155051862616 and parameters: {'n_estimators': 437, 'max_depth': 19, 'min_samples_split': 2, 'min_samples_leaf': 13, 'max_features': None, 'bootstrap': False, 'criterion': 'squared_error'}. Best is trial 1025 with value: 0.41844370194907604.
[I 2024-12-04 15:27:39,997] Trial 1642 finished with value: 0.42411481566502046 and parameters: {'n_estimators': 1000, 'max_depth': 42, 'min_samples_split': 3, 'min_samples_leaf': 1, 'max_features': None, 'bootstrap': True, 'criterion': 'squared_error'}. Best is trial 1025 with value: 0.41844370194907604.
[I 2024-12-04 15:27:41,241] Trial 1647 finished with value: 0.422515024685956 and parameters: {'n_estimators': 677, 'max_depth': 42, 'min_samples_split': 2, 'min_samples_leaf': 1, 'max_features': None, 'bootstrap': True, 'criterion': 'squared_error'}. Best is trial 1025 with value: 0.41844370194907604.
