[I 2024-12-04 12:12:01,001] Trial 1157 finished with value: 0.5536805695328607 and parameters: {'n_estimators': 123, 'max_depth': 8, 'min_samples_split': 9, 'min_samples_leaf': 2, 'max_features': None, 'bootstrap': True, 'criterion': 'absolute_error'}. Best is trial 744 with value: 0.5032383725751689.
[I 2024-12-04 12:12:01,224] Trial 1128 finished with value: 0.5187393284063574 and parameters: {'n_estimators': 266, 'max_depth': 21, 'min_samples_split': 4, 'min_samples_leaf': 1, 'max_features': None, 'bootstrap': True, 'criterion': 'absolute_error'}. Best is trial 744 with value: 0.5032383725751689.
[I 2024-12-04 12:12:01,457] Trial 1150 finished with value: 0.5199676393157637 and parameters: {'n_estimators': 107, 'max_depth': 23, 'min_samples_split': 2, 'min_samples_leaf': 1, 'max_features': None, 'bootstrap': True, 'criterion': 'absolute_error'}. Best is trial 744 with value: 0.5032383725751689.
[I 2024-12-04 12:12:03,684] Trial 1158 finished with value: 0.5154091978094528 and parameters: {'n_estimators': 100, 'max_depth': 14, 'min_samples_split': 7, 'min_samples_leaf': 1, 'max_features': None, 'bootstrap': True, 'criterion': 'absolute_error'}. Best is trial 744 with value: 0.5032383725751689.
[I 2024-12-04 12:12:03,837] Trial 1166 finished with value: 0.9318433629484132 and parameters: {'n_estimators': 276, 'max_depth': 22, 'min_samples_split': 5, 'min_samples_leaf': 1, 'max_features': 'log2', 'bootstrap': True, 'criterion': 'squared_error'}. Best is trial 744 with value: 0.5032383725751689.
[I 2024-12-04 12:12:04,602] Trial 1162 finished with value: 1.2575026545316608 and parameters: {'n_estimators': 769, 'max_depth': 31, 'min_samples_split': 7, 'min_samples_leaf': 7, 'max_features': 'sqrt', 'bootstrap': False, 'criterion': 'absolute_error'}. Best is trial 744 with value: 0.5032383725751689.
[I 2024-12-04 12:12:05,315] Trial 1164 finished with value: 0.5803596929520969 and parameters: {'n_estimators': 396, 'max_depth': 5, 'min_samples_split': 8, 'min_samples_leaf': 2, 'max_features': None, 'bootstrap': True, 'criterion': 'squared_error'}. Best is trial 744 with value: 0.5032383725751689.
[I 2024-12-04 12:12:05,557] Trial 1129 finished with value: 0.5170404806004694 and parameters: {'n_estimators': 313, 'max_depth': 24, 'min_samples_split': 6, 'min_samples_leaf': 1, 'max_features': None, 'bootstrap': True, 'criterion': 'absolute_error'}. Best is trial 744 with value: 0.5032383725751689.
[I 2024-12-04 12:12:05,558] Trial 1143 finished with value: 0.5173945085543007 and parameters: {'n_estimators': 250, 'max_depth': 22, 'min_samples_split': 5, 'min_samples_leaf': 1, 'max_features': None, 'bootstrap': True, 'criterion': 'absolute_error'}. Best is trial 744 with value: 0.5032383725751689.
[I 2024-12-04 12:12:05,702] Trial 1141 finished with value: 0.5188514713757276 and parameters: {'n_estimators': 273, 'max_depth': 24, 'min_samples_split': 3, 'min_samples_leaf': 1, 'max_features': None, 'bootstrap': True, 'criterion': 'absolute_error'}. Best is trial 744 with value: 0.5032383725751689.
[I 2024-12-04 12:12:09,920] Trial 1160 finished with value: 0.5583471687906338 and parameters: {'n_estimators': 221, 'max_depth': 17, 'min_samples_split': 3, 'min_samples_leaf': 2, 'max_features': None, 'bootstrap': True, 'criterion': 'absolute_error'}. Best is trial 744 with value: 0.5032383725751689.
[I 2024-12-04 12:12:10,434] Trial 1163 finished with value: 0.5462187629619464 and parameters: {'n_estimators': 267, 'max_depth': 6, 'min_samples_split': 2, 'min_samples_leaf': 1, 'max_features': None, 'bootstrap': True, 'criterion': 'squared_error'}. Best is trial 744 with value: 0.5032383725751689.
[I 2024-12-04 12:12:11,553] Trial 1165 finished with value: 0.5117108869357366 and parameters: {'n_estimators': 103, 'max_depth': 17, 'min_samples_split': 6, 'min_samples_leaf': 1, 'max_features': None, 'bootstrap': True, 'criterion': 'absolute_error'}. Best is trial 744 with value: 0.5032383725751689.
[I 2024-12-04 12:12:13,122] Trial 1174 finished with value: 0.5174267076147001 and parameters: {'n_estimators': 130, 'max_depth': 14, 'min_samples_split': 5, 'min_samples_leaf': 1, 'max_features': None, 'bootstrap': True, 'criterion': 'squared_error'}. Best is trial 744 with value: 0.5032383725751689.
[I 2024-12-04 12:12:13,124] Trial 1173 finished with value: 1.3468238317943437 and parameters: {'n_estimators': 896, 'max_depth': 39, 'min_samples_split': 10, 'min_samples_leaf': 6, 'max_features': 'log2', 'bootstrap': True, 'criterion': 'absolute_error'}. Best is trial 744 with value: 0.5032383725751689.
[I 2024-12-04 12:12:14,983] Trial 1169 finished with value: 0.513838554681238 and parameters: {'n_estimators': 109, 'max_depth': 12, 'min_samples_split': 6, 'min_samples_leaf': 1, 'max_features': None, 'bootstrap': True, 'criterion': 'absolute_error'}. Best is trial 744 with value: 0.5032383725751689.
[I 2024-12-04 12:12:15,105] Trial 1161 finished with value: 0.5193116330065938 and parameters: {'n_estimators': 243, 'max_depth': 11, 'min_samples_split': 5, 'min_samples_leaf': 1, 'max_features': None, 'bootstrap': True, 'criterion': 'absolute_error'}. Best is trial 744 with value: 0.5032383725751689.
[I 2024-12-04 12:12:16,221] Trial 1167 finished with value: 0.906658058110431 and parameters: {'n_estimators': 106, 'max_depth': 15, 'min_samples_split': 4, 'min_samples_leaf': 1, 'max_features': 'sqrt', 'bootstrap': True, 'criterion': 'absolute_error'}. Best is trial 744 with value: 0.5032383725751689.
[I 2024-12-04 12:12:16,630] Trial 1183 finished with value: 0.7713265967921005 and parameters: {'n_estimators': 108, 'max_depth': 49, 'min_samples_split': 47, 'min_samples_leaf': 2, 'max_features': 'sqrt', 'bootstrap': False, 'criterion': 'squared_error'}. Best is trial 744 with value: 0.5032383725751689.
[I 2024-12-04 12:12:17,013] Trial 1175 finished with value: 0.5108321532161716 and parameters: {'n_estimators': 112, 'max_depth': 16, 'min_samples_split': 2, 'min_samples_leaf': 1, 'max_features': None, 'bootstrap': True, 'criterion': 'absolute_error'}. Best is trial 744 with value: 0.5032383725751689.
[I 2024-12-04 12:12:17,017] Trial 1159 finished with value: 0.5125661793307674 and parameters: {'n_estimators': 253, 'max_depth': 19, 'min_samples_split': 5, 'min_samples_leaf': 1, 'max_features': None, 'bootstrap': True, 'criterion': 'absolute_error'}. Best is trial 744 with value: 0.5032383725751689.
[I 2024-12-04 12:12:17,298] Trial 1168 finished with value: 0.5069330053806245 and parameters: {'n_estimators': 103, 'max_depth': 14, 'min_samples_split': 5, 'min_samples_leaf': 1, 'max_features': None, 'bootstrap': True, 'criterion': 'absolute_error'}. Best is trial 744 with value: 0.5032383725751689.
[I 2024-12-04 12:12:17,299] Trial 1170 finished with value: 0.5059759562911091 and parameters: {'n_estimators': 108, 'max_depth': 19, 'min_samples_split': 4, 'min_samples_leaf': 1, 'max_features': None, 'bootstrap': True, 'criterion': 'absolute_error'}. Best is trial 744 with value: 0.5032383725751689.
[I 2024-12-04 12:12:17,584] Trial 1181 finished with value: 0.5508784855706024 and parameters: {'n_estimators': 264, 'max_depth': 17, 'min_samples_split': 3, 'min_samples_leaf': 2, 'max_features': None, 'bootstrap': True, 'criterion': 'squared_error'}. Best is trial 744 with value: 0.5032383725751689.
[I 2024-12-04 12:12:19,136] Trial 1176 finished with value: 0.5068664239452706 and parameters: {'n_estimators': 101, 'max_depth': 24, 'min_samples_split': 5, 'min_samples_leaf': 1, 'max_features': None, 'bootstrap': True, 'criterion': 'absolute_error'}. Best is trial 744 with value: 0.5032383725751689.
[I 2024-12-04 12:12:19,534] Trial 1185 finished with value: 0.9068516036628029 and parameters: {'n_estimators': 122, 'max_depth': 27, 'min_samples_split': 3, 'min_samples_leaf': 1, 'max_features': 'log2', 'bootstrap': True, 'criterion': 'absolute_error'}. Best is trial 744 with value: 0.5032383725751689.
[I 2024-12-04 12:12:27,673] Trial 1179 finished with value: 0.5568275409582215 and parameters: {'n_estimators': 119, 'max_depth': 18, 'min_samples_split': 5, 'min_samples_leaf': 2, 'max_features': None, 'bootstrap': True, 'criterion': 'absolute_error'}. Best is trial 744 with value: 0.5032383725751689.
[I 2024-12-04 12:12:28,870] Trial 1184 finished with value: 0.5534282204114344 and parameters: {'n_estimators': 973, 'max_depth': 39, 'min_samples_split': 24, 'min_samples_leaf': 1, 'max_features': None, 'bootstrap': True, 'criterion': 'squared_error'}. Best is trial 744 with value: 0.5032383725751689.
[I 2024-12-04 12:12:32,101] Trial 1171 finished with value: 0.518183238023283 and parameters: {'n_estimators': 266, 'max_depth': 24, 'min_samples_split': 4, 'min_samples_leaf': 1, 'max_features': None, 'bootstrap': True, 'criterion': 'absolute_error'}. Best is trial 744 with value: 0.5032383725751689.
[I 2024-12-04 12:12:32,218] Trial 1187 finished with value: 1.1595892558967913 and parameters: {'n_estimators': 263, 'max_depth': 7, 'min_samples_split': 2, 'min_samples_leaf': 5, 'max_features': 'sqrt', 'bootstrap': True, 'criterion': 'squared_error'}. Best is trial 744 with value: 0.5032383725751689.
[I 2024-12-04 12:12:33,085] Trial 1204 finished with value: 1.0928008962959028 and parameters: {'n_estimators': 108, 'max_depth': 16, 'min_samples_split': 3, 'min_samples_leaf': 1, 'max_features': 'log2', 'bootstrap': True, 'criterion': 'absolute_error'}. Best is trial 744 with value: 0.5032383725751689.
[I 2024-12-04 12:12:33,218] Trial 1177 finished with value: 0.5200169500690386 and parameters: {'n_estimators': 262, 'max_depth': 21, 'min_samples_split': 3, 'min_samples_leaf': 1, 'max_features': None, 'bootstrap': True, 'criterion': 'absolute_error'}. Best is trial 744 with value: 0.5032383725751689.
[I 2024-12-04 12:12:34,603] Trial 1178 finished with value: 0.5184802542996839 and parameters: {'n_estimators': 247, 'max_depth': 16, 'min_samples_split': 2, 'min_samples_leaf': 1, 'max_features': None, 'bootstrap': True, 'criterion': 'absolute_error'}. Best is trial 744 with value: 0.5032383725751689.
[I 2024-12-04 12:12:34,819] Trial 1192 finished with value: 0.5133851808810628 and parameters: {'n_estimators': 106, 'max_depth': 17, 'min_samples_split': 4, 'min_samples_leaf': 1, 'max_features': None, 'bootstrap': True, 'criterion': 'absolute_error'}. Best is trial 744 with value: 0.5032383725751689.
[I 2024-12-04 12:12:35,755] Trial 1188 finished with value: 0.5186630799638859 and parameters: {'n_estimators': 130, 'max_depth': 18, 'min_samples_split': 3, 'min_samples_leaf': 1, 'max_features': None, 'bootstrap': True, 'criterion': 'absolute_error'}. Best is trial 744 with value: 0.5032383725751689.
[I 2024-12-04 12:12:35,767] Trial 1191 finished with value: 0.5250114279686696 and parameters: {'n_estimators': 116, 'max_depth': 26, 'min_samples_split': 7, 'min_samples_leaf': 1, 'max_features': None, 'bootstrap': True, 'criterion': 'absolute_error'}. Best is trial 744 with value: 0.5032383725751689.
[I 2024-12-04 12:12:36,319] Trial 1180 finished with value: 0.5179941363464179 and parameters: {'n_estimators': 266, 'max_depth': 17, 'min_samples_split': 6, 'min_samples_leaf': 1, 'max_features': None, 'bootstrap': True, 'criterion': 'absolute_error'}. Best is trial 744 with value: 0.5032383725751689.
[I 2024-12-04 12:12:37,129] Trial 1200 finished with value: 0.5556535150156625 and parameters: {'n_estimators': 103, 'max_depth': 22, 'min_samples_split': 4, 'min_samples_leaf': 2, 'max_features': None, 'bootstrap': True, 'criterion': 'absolute_error'}. Best is trial 744 with value: 0.5032383725751689.
[I 2024-12-04 12:12:37,754] Trial 1189 finished with value: 0.5599665144912948 and parameters: {'n_estimators': 222, 'max_depth': 26, 'min_samples_split': 3, 'min_samples_leaf': 2, 'max_features': None, 'bootstrap': True, 'criterion': 'absolute_error'}. Best is trial 744 with value: 0.5032383725751689.
[I 2024-12-04 12:12:37,803] Trial 1193 finished with value: 1.294722076333651 and parameters: {'n_estimators': 887, 'max_depth': 8, 'min_samples_split': 3, 'min_samples_leaf': 2, 'max_features': 'log2', 'bootstrap': True, 'criterion': 'absolute_error'}. Best is trial 744 with value: 0.5032383725751689.
[I 2024-12-04 12:12:37,994] Trial 1206 finished with value: 1.1437550046666112 and parameters: {'n_estimators': 874, 'max_depth': 44, 'min_samples_split': 32, 'min_samples_leaf': 8, 'max_features': 'sqrt', 'bootstrap': False, 'criterion': 'squared_error'}. Best is trial 744 with value: 0.5032383725751689.
[I 2024-12-04 12:12:38,566] Trial 1182 finished with value: 0.5160533184670119 and parameters: {'n_estimators': 281, 'max_depth': 17, 'min_samples_split': 3, 'min_samples_leaf': 1, 'max_features': None, 'bootstrap': True, 'criterion': 'absolute_error'}. Best is trial 744 with value: 0.5032383725751689.
[I 2024-12-04 12:12:38,601] Trial 1172 finished with value: 0.514071782624873 and parameters: {'n_estimators': 515, 'max_depth': 15, 'min_samples_split': 6, 'min_samples_leaf': 1, 'max_features': None, 'bootstrap': True, 'criterion': 'absolute_error'}. Best is trial 744 with value: 0.5032383725751689.
[I 2024-12-04 12:12:38,765] Trial 1186 finished with value: 0.5170774246799689 and parameters: {'n_estimators': 227, 'max_depth': 23, 'min_samples_split': 4, 'min_samples_leaf': 1, 'max_features': None, 'bootstrap': True, 'criterion': 'absolute_error'}. Best is trial 744 with value: 0.5032383725751689.
[I 2024-12-04 12:12:38,766] Trial 1195 finished with value: 0.5209998276831322 and parameters: {'n_estimators': 118, 'max_depth': 33, 'min_samples_split': 3, 'min_samples_leaf': 1, 'max_features': None, 'bootstrap': True, 'criterion': 'absolute_error'}. Best is trial 744 with value: 0.5032383725751689.
[I 2024-12-04 12:12:38,844] Trial 1194 finished with value: 0.5601877758450348 and parameters: {'n_estimators': 104, 'max_depth': 20, 'min_samples_split': 8, 'min_samples_leaf': 2, 'max_features': None, 'bootstrap': True, 'criterion': 'absolute_error'}. Best is trial 744 with value: 0.5032383725751689.
[I 2024-12-04 12:12:42,113] Trial 1190 finished with value: 0.5279721806952862 and parameters: {'n_estimators': 184, 'max_depth': 30, 'min_samples_split': 9, 'min_samples_leaf': 1, 'max_features': None, 'bootstrap': True, 'criterion': 'absolute_error'}. Best is trial 744 with value: 0.5032383725751689.
[I 2024-12-04 12:12:45,701] Trial 1196 finished with value: 0.5231779469801666 and parameters: {'n_estimators': 158, 'max_depth': 27, 'min_samples_split': 3, 'min_samples_leaf': 1, 'max_features': None, 'bootstrap': True, 'criterion': 'absolute_error'}. Best is trial 744 with value: 0.5032383725751689.
[I 2024-12-04 12:12:45,768] Trial 1209 finished with value: 0.5512480954360357 and parameters: {'n_estimators': 131, 'max_depth': 10, 'min_samples_split': 3, 'min_samples_leaf': 2, 'max_features': None, 'bootstrap': True, 'criterion': 'absolute_error'}. Best is trial 744 with value: 0.5032383725751689.
[I 2024-12-04 12:12:47,292] Trial 1205 finished with value: 0.5137678914849252 and parameters: {'n_estimators': 133, 'max_depth': 29, 'min_samples_split': 5, 'min_samples_leaf': 1, 'max_features': None, 'bootstrap': True, 'criterion': 'absolute_error'}. Best is trial 744 with value: 0.5032383725751689.
[I 2024-12-04 12:12:48,217] Trial 1198 finished with value: 0.6194202648070032 and parameters: {'n_estimators': 115, 'max_depth': 30, 'min_samples_split': 3, 'min_samples_leaf': 2, 'max_features': None, 'bootstrap': False, 'criterion': 'absolute_error'}. Best is trial 744 with value: 0.5032383725751689.
[I 2024-12-04 12:12:50,448] Trial 1216 finished with value: 1.3276041204140538 and parameters: {'n_estimators': 582, 'max_depth': 9, 'min_samples_split': 13, 'min_samples_leaf': 3, 'max_features': 'log2', 'bootstrap': True, 'criterion': 'absolute_error'}. Best is trial 744 with value: 0.5032383725751689.
[I 2024-12-04 12:12:51,000] Trial 1203 finished with value: 0.5096980582128315 and parameters: {'n_estimators': 100, 'max_depth': 30, 'min_samples_split': 4, 'min_samples_leaf': 1, 'max_features': None, 'bootstrap': True, 'criterion': 'absolute_error'}. Best is trial 744 with value: 0.5032383725751689.
[I 2024-12-04 12:12:51,777] Trial 1202 finished with value: 0.5264985234653632 and parameters: {'n_estimators': 224, 'max_depth': 9, 'min_samples_split': 2, 'min_samples_leaf': 1, 'max_features': None, 'bootstrap': False, 'criterion': 'absolute_error'}. Best is trial 744 with value: 0.5032383725751689.
[I 2024-12-04 12:12:51,847] Trial 1197 finished with value: 0.5139963165790445 and parameters: {'n_estimators': 114, 'max_depth': 26, 'min_samples_split': 5, 'min_samples_leaf': 1, 'max_features': None, 'bootstrap': True, 'criterion': 'absolute_error'}. Best is trial 744 with value: 0.5032383725751689.
[I 2024-12-04 12:12:51,911] Trial 1201 finished with value: 0.5137461937608366 and parameters: {'n_estimators': 128, 'max_depth': 25, 'min_samples_split': 6, 'min_samples_leaf': 1, 'max_features': None, 'bootstrap': True, 'criterion': 'absolute_error'}. Best is trial 744 with value: 0.5032383725751689.
[I 2024-12-04 12:12:52,168] Trial 1218 finished with value: 0.5554989186986631 and parameters: {'n_estimators': 108, 'max_depth': 26, 'min_samples_split': 2, 'min_samples_leaf': 2, 'max_features': None, 'bootstrap': True, 'criterion': 'absolute_error'}. Best is trial 744 with value: 0.5032383725751689.
[I 2024-12-04 12:12:52,567] Trial 1212 finished with value: 0.5152568982929154 and parameters: {'n_estimators': 102, 'max_depth': 15, 'min_samples_split': 4, 'min_samples_leaf': 1, 'max_features': None, 'bootstrap': True, 'criterion': 'absolute_error'}. Best is trial 744 with value: 0.5032383725751689.
[I 2024-12-04 12:12:52,952] Trial 1211 finished with value: 0.5153389276653101 and parameters: {'n_estimators': 113, 'max_depth': 22, 'min_samples_split': 6, 'min_samples_leaf': 1, 'max_features': None, 'bootstrap': True, 'criterion': 'absolute_error'}. Best is trial 744 with value: 0.5032383725751689.
[I 2024-12-04 12:12:53,479] Trial 1207 finished with value: 0.5067722196406412 and parameters: {'n_estimators': 116, 'max_depth': 19, 'min_samples_split': 4, 'min_samples_leaf': 1, 'max_features': None, 'bootstrap': True, 'criterion': 'absolute_error'}. Best is trial 744 with value: 0.5032383725751689.
[I 2024-12-04 12:12:54,151] Trial 1214 finished with value: 1.2995891456880482 and parameters: {'n_estimators': 445, 'max_depth': 34, 'min_samples_split': 34, 'min_samples_leaf': 3, 'max_features': 'log2', 'bootstrap': False, 'criterion': 'absolute_error'}. Best is trial 744 with value: 0.5032383725751689.
[I 2024-12-04 12:12:54,273] Trial 1215 finished with value: 0.7672437835856825 and parameters: {'n_estimators': 246, 'max_depth': 23, 'min_samples_split': 5, 'min_samples_leaf': 1, 'max_features': 'sqrt', 'bootstrap': True, 'criterion': 'absolute_error'}. Best is trial 744 with value: 0.5032383725751689.
[I 2024-12-04 12:12:54,395] Trial 1220 finished with value: 1.255564244808825 and parameters: {'n_estimators': 568, 'max_depth': 12, 'min_samples_split': 3, 'min_samples_leaf': 13, 'max_features': 'log2', 'bootstrap': True, 'criterion': 'squared_error'}. Best is trial 744 with value: 0.5032383725751689.
[I 2024-12-04 12:12:55,695] Trial 1210 finished with value: 0.5191127947748057 and parameters: {'n_estimators': 233, 'max_depth': 11, 'min_samples_split': 5, 'min_samples_leaf': 1, 'max_features': None, 'bootstrap': True, 'criterion': 'absolute_error'}. Best is trial 744 with value: 0.5032383725751689.
[I 2024-12-04 12:12:57,614] Trial 1222 finished with value: 0.8680318964245126 and parameters: {'n_estimators': 121, 'max_depth': 16, 'min_samples_split': 13, 'min_samples_leaf': 1, 'max_features': 'sqrt', 'bootstrap': True, 'criterion': 'squared_error'}. Best is trial 744 with value: 0.5032383725751689.
[I 2024-12-04 12:12:57,632] Trial 1221 finished with value: 1.3418633844531247 and parameters: {'n_estimators': 865, 'max_depth': 13, 'min_samples_split': 33, 'min_samples_leaf': 7, 'max_features': 'log2', 'bootstrap': False, 'criterion': 'absolute_error'}. Best is trial 744 with value: 0.5032383725751689.
[I 2024-12-04 12:12:57,903] Trial 1228 finished with value: 1.0459371455483981 and parameters: {'n_estimators': 661, 'max_depth': 41, 'min_samples_split': 3, 'min_samples_leaf': 3, 'max_features': 'sqrt', 'bootstrap': True, 'criterion': 'squared_error'}. Best is trial 744 with value: 0.5032383725751689.
[I 2024-12-04 12:13:02,030] Trial 1199 finished with value: 0.5257586592954564 and parameters: {'n_estimators': 257, 'max_depth': 24, 'min_samples_split': 7, 'min_samples_leaf': 1, 'max_features': None, 'bootstrap': True, 'criterion': 'absolute_error'}. Best is trial 744 with value: 0.5032383725751689.
[I 2024-12-04 12:13:02,573] Trial 1223 finished with value: 0.5194348831574157 and parameters: {'n_estimators': 122, 'max_depth': 20, 'min_samples_split': 3, 'min_samples_leaf': 1, 'max_features': None, 'bootstrap': True, 'criterion': 'absolute_error'}. Best is trial 744 with value: 0.5032383725751689.
[I 2024-12-04 12:13:04,060] Trial 1208 finished with value: 0.5572879983408877 and parameters: {'n_estimators': 209, 'max_depth': 29, 'min_samples_split': 2, 'min_samples_leaf': 1, 'max_features': None, 'bootstrap': False, 'criterion': 'absolute_error'}. Best is trial 744 with value: 0.5032383725751689.
[I 2024-12-04 12:13:04,061] Trial 1227 finished with value: 0.5101351711586378 and parameters: {'n_estimators': 101, 'max_depth': 25, 'min_samples_split': 4, 'min_samples_leaf': 1, 'max_features': None, 'bootstrap': True, 'criterion': 'absolute_error'}. Best is trial 744 with value: 0.5032383725751689.
[I 2024-12-04 12:13:04,061] Trial 1217 finished with value: 0.5564661457796204 and parameters: {'n_estimators': 263, 'max_depth': 15, 'min_samples_split': 3, 'min_samples_leaf': 2, 'max_features': None, 'bootstrap': True, 'criterion': 'absolute_error'}. Best is trial 744 with value: 0.5032383725751689.
