[I 2024-12-04 13:45:28,867] Trial 2319 finished with value: 0.23978800981976045 and parameters: {'n_estimators': 1492, 'learning_rate': 0.08027885973845264, 'max_depth': 10, 'min_samples_split': 20, 'min_samples_leaf': 2, 'subsample': 0.6896741872701921, 'max_features': 'sqrt'}. Best is trial 1137 with value: 0.19687116000636118.
[I 2024-12-04 13:45:32,661] Trial 2321 finished with value: 0.2149250534659341 and parameters: {'n_estimators': 1452, 'learning_rate': 0.09886315056061906, 'max_depth': 11, 'min_samples_split': 16, 'min_samples_leaf': 1, 'subsample': 0.7843981313527923, 'max_features': 'sqrt'}. Best is trial 1137 with value: 0.19687116000636118.
[I 2024-12-04 13:45:34,296] Trial 2331 finished with value: 0.31605805255815417 and parameters: {'n_estimators': 952, 'learning_rate': 0.030345550068606536, 'max_depth': 9, 'min_samples_split': 17, 'min_samples_leaf': 1, 'subsample': 0.70590834481564, 'max_features': 'log2'}. Best is trial 1137 with value: 0.19687116000636118.
[I 2024-12-04 13:45:42,564] Trial 2326 finished with value: 0.298760744994419 and parameters: {'n_estimators': 1354, 'learning_rate': 0.030153261658830574, 'max_depth': 9, 'min_samples_split': 2, 'min_samples_leaf': 2, 'subsample': 0.6458409662223501, 'max_features': 'log2'}. Best is trial 1137 with value: 0.19687116000636118.
[I 2024-12-04 13:45:44,896] Trial 2328 finished with value: 0.20376901224234334 and parameters: {'n_estimators': 1278, 'learning_rate': 0.09857774574234218, 'max_depth': 12, 'min_samples_split': 20, 'min_samples_leaf': 1, 'subsample': 0.6093576249242122, 'max_features': 'sqrt'}. Best is trial 1137 with value: 0.19687116000636118.
[I 2024-12-04 13:45:46,616] Trial 2324 finished with value: 0.20378724070477977 and parameters: {'n_estimators': 1444, 'learning_rate': 0.09775351538335854, 'max_depth': 12, 'min_samples_split': 18, 'min_samples_leaf': 1, 'subsample': 0.7514110509142422, 'max_features': 'sqrt'}. Best is trial 1137 with value: 0.19687116000636118.
[I 2024-12-04 13:45:48,218] Trial 2325 finished with value: 0.27064221388633863 and parameters: {'n_estimators': 1443, 'learning_rate': 0.05716836685221488, 'max_depth': 8, 'min_samples_split': 19, 'min_samples_leaf': 4, 'subsample': 0.6023935259486761, 'max_features': 'sqrt'}. Best is trial 1137 with value: 0.19687116000636118.
[I 2024-12-04 13:45:48,223] Trial 2342 finished with value: 0.5183800137331603 and parameters: {'n_estimators': 716, 'learning_rate': 0.012283628214483174, 'max_depth': 3, 'min_samples_split': 16, 'min_samples_leaf': 6, 'subsample': 0.8892732784729449, 'max_features': 'sqrt'}. Best is trial 1137 with value: 0.19687116000636118.
[I 2024-12-04 13:45:52,370] Trial 2330 finished with value: 0.3363118374372358 and parameters: {'n_estimators': 1305, 'learning_rate': 0.04299087612376618, 'max_depth': 7, 'min_samples_split': 10, 'min_samples_leaf': 5, 'subsample': 0.9408126496254536, 'max_features': 'log2'}. Best is trial 1137 with value: 0.19687116000636118.
[I 2024-12-04 13:45:54,648] Trial 2359 finished with value: 0.632663222583679 and parameters: {'n_estimators': 112, 'learning_rate': 0.041123675947265785, 'max_depth': 3, 'min_samples_split': 8, 'min_samples_leaf': 7, 'subsample': 0.9590717880929431, 'max_features': 'sqrt'}. Best is trial 1137 with value: 0.19687116000636118.
[I 2024-12-04 13:45:59,985] Trial 2334 finished with value: 0.24826989016346077 and parameters: {'n_estimators': 1212, 'learning_rate': 0.058326982334518954, 'max_depth': 10, 'min_samples_split': 17, 'min_samples_leaf': 2, 'subsample': 0.7179794970037577, 'max_features': 'sqrt'}. Best is trial 1137 with value: 0.19687116000636118.
[I 2024-12-04 13:46:04,747] Trial 2340 finished with value: 0.2962013054898108 and parameters: {'n_estimators': 931, 'learning_rate': 0.021327258951687644, 'max_depth': 8, 'min_samples_split': 2, 'min_samples_leaf': 1, 'subsample': 0.8632572352741603, 'max_features': None}. Best is trial 1137 with value: 0.19687116000636118.
[I 2024-12-04 13:46:06,972] Trial 2332 finished with value: 0.31769612819954024 and parameters: {'n_estimators': 1435, 'learning_rate': 0.022314036889295754, 'max_depth': 8, 'min_samples_split': 18, 'min_samples_leaf': 1, 'subsample': 0.7514933184381846, 'max_features': 'log2'}. Best is trial 1137 with value: 0.19687116000636118.
[I 2024-12-04 13:46:10,527] Trial 2335 finished with value: 0.25318291532875253 and parameters: {'n_estimators': 1294, 'learning_rate': 0.05730749087708241, 'max_depth': 12, 'min_samples_split': 20, 'min_samples_leaf': 3, 'subsample': 0.6731235503589964, 'max_features': 'sqrt'}. Best is trial 1137 with value: 0.19687116000636118.
[I 2024-12-04 13:46:13,492] Trial 2333 finished with value: 0.22384931439646102 and parameters: {'n_estimators': 1481, 'learning_rate': 0.0864622031246172, 'max_depth': 11, 'min_samples_split': 15, 'min_samples_leaf': 1, 'subsample': 0.6050434703514057, 'max_features': 'sqrt'}. Best is trial 1137 with value: 0.19687116000636118.
[I 2024-12-04 13:46:18,869] Trial 2349 finished with value: 0.23385367318089453 and parameters: {'n_estimators': 969, 'learning_rate': 0.06404188910523388, 'max_depth': 10, 'min_samples_split': 20, 'min_samples_leaf': 1, 'subsample': 0.6237630291028505, 'max_features': 'sqrt'}. Best is trial 1137 with value: 0.19687116000636118.
[I 2024-12-04 13:46:21,061] Trial 2341 finished with value: 0.2166503586081297 and parameters: {'n_estimators': 1197, 'learning_rate': 0.0682347050343179, 'max_depth': 12, 'min_samples_split': 17, 'min_samples_leaf': 1, 'subsample': 0.682997345812728, 'max_features': 'sqrt'}. Best is trial 1137 with value: 0.19687116000636118.
[I 2024-12-04 13:46:21,069] Trial 2337 finished with value: 0.227036435523449 and parameters: {'n_estimators': 1339, 'learning_rate': 0.09992761798154494, 'max_depth': 10, 'min_samples_split': 18, 'min_samples_leaf': 1, 'subsample': 0.6407510471862716, 'max_features': 'sqrt'}. Best is trial 1137 with value: 0.19687116000636118.
[I 2024-12-04 13:46:27,449] Trial 2336 finished with value: 0.22004887712216345 and parameters: {'n_estimators': 1500, 'learning_rate': 0.08734684102133951, 'max_depth': 10, 'min_samples_split': 20, 'min_samples_leaf': 1, 'subsample': 0.6959001213835138, 'max_features': 'sqrt'}. Best is trial 1137 with value: 0.19687116000636118.
[I 2024-12-04 13:46:28,410] Trial 2347 finished with value: 0.3789901102432224 and parameters: {'n_estimators': 1072, 'learning_rate': 0.010678290565523768, 'max_depth': 4, 'min_samples_split': 13, 'min_samples_leaf': 6, 'subsample': 0.9385415199650793, 'max_features': None}. Best is trial 1137 with value: 0.19687116000636118.
[I 2024-12-04 13:46:30,359] Trial 2355 finished with value: 0.21867734530271404 and parameters: {'n_estimators': 930, 'learning_rate': 0.09055400238886273, 'max_depth': 10, 'min_samples_split': 17, 'min_samples_leaf': 1, 'subsample': 0.6241173936705382, 'max_features': 'sqrt'}. Best is trial 1137 with value: 0.19687116000636118.
[I 2024-12-04 13:46:31,861] Trial 2338 finished with value: 0.2770211635065554 and parameters: {'n_estimators': 1483, 'learning_rate': 0.09149204988036924, 'max_depth': 11, 'min_samples_split': 17, 'min_samples_leaf': 3, 'subsample': 0.6885153790733229, 'max_features': 'log2'}. Best is trial 1137 with value: 0.19687116000636118.
[I 2024-12-04 13:46:32,434] Trial 2339 finished with value: 0.22184131773626647 and parameters: {'n_estimators': 1431, 'learning_rate': 0.061625149297213605, 'max_depth': 12, 'min_samples_split': 17, 'min_samples_leaf': 1, 'subsample': 0.6634663547383536, 'max_features': 'sqrt'}. Best is trial 1137 with value: 0.19687116000636118.
[I 2024-12-04 13:46:35,233] Trial 2354 finished with value: 0.21579467223667642 and parameters: {'n_estimators': 1011, 'learning_rate': 0.08760237424442872, 'max_depth': 12, 'min_samples_split': 20, 'min_samples_leaf': 1, 'subsample': 0.682513966643817, 'max_features': 'sqrt'}. Best is trial 1137 with value: 0.19687116000636118.
[I 2024-12-04 13:46:37,827] Trial 2360 finished with value: 0.35218406880881936 and parameters: {'n_estimators': 684, 'learning_rate': 0.0935480594874983, 'max_depth': 9, 'min_samples_split': 18, 'min_samples_leaf': 8, 'subsample': 0.8070519825678099, 'max_features': None}. Best is trial 1137 with value: 0.19687116000636118.
[I 2024-12-04 13:46:41,178] Trial 2350 finished with value: 0.20845298742578824 and parameters: {'n_estimators': 1243, 'learning_rate': 0.09876424146812446, 'max_depth': 10, 'min_samples_split': 20, 'min_samples_leaf': 1, 'subsample': 0.730985857769054, 'max_features': 'sqrt'}. Best is trial 1137 with value: 0.19687116000636118.
[I 2024-12-04 13:46:41,887] Trial 2351 finished with value: 0.21631795813411195 and parameters: {'n_estimators': 1239, 'learning_rate': 0.0829495841192765, 'max_depth': 12, 'min_samples_split': 17, 'min_samples_leaf': 1, 'subsample': 0.6580041818696313, 'max_features': 'sqrt'}. Best is trial 1137 with value: 0.19687116000636118.
[I 2024-12-04 13:46:44,001] Trial 2343 finished with value: 0.24244489045129444 and parameters: {'n_estimators': 1491, 'learning_rate': 0.06362805651365953, 'max_depth': 12, 'min_samples_split': 20, 'min_samples_leaf': 3, 'subsample': 0.6490550816691114, 'max_features': 'sqrt'}. Best is trial 1137 with value: 0.19687116000636118.
[I 2024-12-04 13:46:45,659] Trial 2345 finished with value: 0.22836777865898983 and parameters: {'n_estimators': 1461, 'learning_rate': 0.08805146677934447, 'max_depth': 12, 'min_samples_split': 20, 'min_samples_leaf': 1, 'subsample': 0.7003815778627807, 'max_features': 'sqrt'}. Best is trial 1137 with value: 0.19687116000636118.
[I 2024-12-04 13:46:47,232] Trial 2372 finished with value: 0.3534874558918603 and parameters: {'n_estimators': 281, 'learning_rate': 0.03856018794101838, 'max_depth': 7, 'min_samples_split': 16, 'min_samples_leaf': 6, 'subsample': 0.7444236137799716, 'max_features': None}. Best is trial 1137 with value: 0.19687116000636118.
[I 2024-12-04 13:46:49,477] Trial 2346 finished with value: 0.21044989768613748 and parameters: {'n_estimators': 1475, 'learning_rate': 0.0832774056307713, 'max_depth': 12, 'min_samples_split': 19, 'min_samples_leaf': 1, 'subsample': 0.643427240843456, 'max_features': 'sqrt'}. Best is trial 1137 with value: 0.19687116000636118.
[I 2024-12-04 13:46:49,483] Trial 2356 finished with value: 0.2576822045331096 and parameters: {'n_estimators': 1192, 'learning_rate': 0.09852053646688819, 'max_depth': 9, 'min_samples_split': 20, 'min_samples_leaf': 3, 'subsample': 0.6428344904537145, 'max_features': 'sqrt'}. Best is trial 1137 with value: 0.19687116000636118.
[I 2024-12-04 13:46:51,004] Trial 2348 finished with value: 0.22615681647029195 and parameters: {'n_estimators': 1499, 'learning_rate': 0.0718882363109167, 'max_depth': 10, 'min_samples_split': 19, 'min_samples_leaf': 1, 'subsample': 0.6826141029037845, 'max_features': 'sqrt'}. Best is trial 1137 with value: 0.19687116000636118.
[I 2024-12-04 13:46:51,893] Trial 2371 finished with value: 0.46172540560647063 and parameters: {'n_estimators': 461, 'learning_rate': 0.027882251892619295, 'max_depth': 11, 'min_samples_split': 2, 'min_samples_leaf': 9, 'subsample': 0.6925197489706384, 'max_features': 'sqrt'}. Best is trial 1137 with value: 0.19687116000636118.
[I 2024-12-04 13:46:55,404] Trial 2344 finished with value: 0.2923408919540186 and parameters: {'n_estimators': 1487, 'learning_rate': 0.0994958833362851, 'max_depth': 10, 'min_samples_split': 18, 'min_samples_leaf': 3, 'subsample': 0.6415622040540563, 'max_features': None}. Best is trial 1137 with value: 0.19687116000636118.
[I 2024-12-04 13:46:55,462] Trial 2358 finished with value: 0.2211752438763892 and parameters: {'n_estimators': 1239, 'learning_rate': 0.06658196018922419, 'max_depth': 12, 'min_samples_split': 20, 'min_samples_leaf': 1, 'subsample': 0.6901013877030804, 'max_features': 'sqrt'}. Best is trial 1137 with value: 0.19687116000636118.
[I 2024-12-04 13:46:55,470] Trial 2352 finished with value: 0.236772294029971 and parameters: {'n_estimators': 1447, 'learning_rate': 0.09002382712078537, 'max_depth': 10, 'min_samples_split': 19, 'min_samples_leaf': 1, 'subsample': 0.6018556726183664, 'max_features': 'sqrt'}. Best is trial 1137 with value: 0.19687116000636118.
[I 2024-12-04 13:46:59,377] Trial 2361 finished with value: 0.23449159599830605 and parameters: {'n_estimators': 1018, 'learning_rate': 0.09423284291505975, 'max_depth': 11, 'min_samples_split': 20, 'min_samples_leaf': 1, 'subsample': 0.6008095866569785, 'max_features': 'sqrt'}. Best is trial 1137 with value: 0.19687116000636118.
[I 2024-12-04 13:47:00,292] Trial 2353 finished with value: 0.21112431600053866 and parameters: {'n_estimators': 1499, 'learning_rate': 0.09345747238837711, 'max_depth': 10, 'min_samples_split': 20, 'min_samples_leaf': 1, 'subsample': 0.6586086318909017, 'max_features': 'sqrt'}. Best is trial 1137 with value: 0.19687116000636118.
[I 2024-12-04 13:47:09,144] Trial 2357 finished with value: 0.22769266584694836 and parameters: {'n_estimators': 1486, 'learning_rate': 0.06421303890834235, 'max_depth': 10, 'min_samples_split': 18, 'min_samples_leaf': 1, 'subsample': 0.6630505845713854, 'max_features': 'sqrt'}. Best is trial 1137 with value: 0.19687116000636118.
[I 2024-12-04 13:47:13,434] Trial 2370 finished with value: 0.33618767208442396 and parameters: {'n_estimators': 860, 'learning_rate': 0.08106116356061917, 'max_depth': 6, 'min_samples_split': 15, 'min_samples_leaf': 7, 'subsample': 0.7649798443125713, 'max_features': None}. Best is trial 1137 with value: 0.19687116000636118.
[I 2024-12-04 13:47:13,963] Trial 2362 finished with value: 0.22301258054627998 and parameters: {'n_estimators': 1302, 'learning_rate': 0.06716530579558629, 'max_depth': 12, 'min_samples_split': 17, 'min_samples_leaf': 2, 'subsample': 0.77383637276753, 'max_features': 'sqrt'}. Best is trial 1137 with value: 0.19687116000636118.
[I 2024-12-04 13:47:13,965] Trial 2364 finished with value: 0.2511435252485547 and parameters: {'n_estimators': 1233, 'learning_rate': 0.09883762928371531, 'max_depth': 12, 'min_samples_split': 16, 'min_samples_leaf': 3, 'subsample': 0.7416454586374696, 'max_features': 'sqrt'}. Best is trial 1137 with value: 0.19687116000636118.
[I 2024-12-04 13:47:13,992] Trial 2363 finished with value: 0.43494692647290306 and parameters: {'n_estimators': 1305, 'learning_rate': 0.04170547422216485, 'max_depth': 5, 'min_samples_split': 15, 'min_samples_leaf': 10, 'subsample': 0.7220776348740695, 'max_features': 'sqrt'}. Best is trial 1137 with value: 0.19687116000636118.
[I 2024-12-04 13:47:17,766] Trial 2365 finished with value: 0.22969833852083574 and parameters: {'n_estimators': 1322, 'learning_rate': 0.08139220951417965, 'max_depth': 12, 'min_samples_split': 20, 'min_samples_leaf': 2, 'subsample': 0.6181886831582046, 'max_features': 'sqrt'}. Best is trial 1137 with value: 0.19687116000636118.
[I 2024-12-04 13:47:18,558] Trial 2374 finished with value: 0.3552656385000334 and parameters: {'n_estimators': 792, 'learning_rate': 0.023808683520773404, 'max_depth': 8, 'min_samples_split': 4, 'min_samples_leaf': 7, 'subsample': 0.9916121456436988, 'max_features': 'sqrt'}. Best is trial 1137 with value: 0.19687116000636118.
[I 2024-12-04 13:47:22,562] Trial 2366 finished with value: 0.24804954405757526 and parameters: {'n_estimators': 1345, 'learning_rate': 0.09171146837738833, 'max_depth': 10, 'min_samples_split': 16, 'min_samples_leaf': 2, 'subsample': 0.8478842371309883, 'max_features': 'sqrt'}. Best is trial 1137 with value: 0.19687116000636118.
[I 2024-12-04 13:47:22,564] Trial 2369 finished with value: 0.22184254908970052 and parameters: {'n_estimators': 1168, 'learning_rate': 0.07662291644203154, 'max_depth': 12, 'min_samples_split': 19, 'min_samples_leaf': 1, 'subsample': 0.6022050591572358, 'max_features': 'sqrt'}. Best is trial 1137 with value: 0.19687116000636118.
[I 2024-12-04 13:47:32,305] Trial 2367 finished with value: 0.2617715921311541 and parameters: {'n_estimators': 1383, 'learning_rate': 0.0992618415428581, 'max_depth': 10, 'min_samples_split': 17, 'min_samples_leaf': 4, 'subsample': 0.7818758819172029, 'max_features': 'sqrt'}. Best is trial 1137 with value: 0.19687116000636118.
[I 2024-12-04 13:47:34,282] Trial 2368 finished with value: 0.21928756159071747 and parameters: {'n_estimators': 1406, 'learning_rate': 0.08379165996759268, 'max_depth': 12, 'min_samples_split': 15, 'min_samples_leaf': 1, 'subsample': 0.8413388412792686, 'max_features': 'sqrt'}. Best is trial 1137 with value: 0.19687116000636118.
[I 2024-12-04 13:47:36,901] Trial 2391 finished with value: 0.6454283163139214 and parameters: {'n_estimators': 397, 'learning_rate': 0.03678390441779412, 'max_depth': 11, 'min_samples_split': 20, 'min_samples_leaf': 9, 'subsample': 0.6657532953754169, 'max_features': 'log2'}. Best is trial 1137 with value: 0.19687116000636118.
[I 2024-12-04 13:47:41,129] Trial 2373 finished with value: 0.2376072859247536 and parameters: {'n_estimators': 1282, 'learning_rate': 0.0805557952883819, 'max_depth': 11, 'min_samples_split': 19, 'min_samples_leaf': 2, 'subsample': 0.8338547269029659, 'max_features': 'sqrt'}. Best is trial 1137 with value: 0.19687116000636118.
[I 2024-12-04 13:47:52,568] Trial 2378 finished with value: 0.2169203496652545 and parameters: {'n_estimators': 1242, 'learning_rate': 0.0927956092483252, 'max_depth': 12, 'min_samples_split': 17, 'min_samples_leaf': 1, 'subsample': 0.6091972982863771, 'max_features': 'sqrt'}. Best is trial 1137 with value: 0.19687116000636118.
[I 2024-12-04 13:47:53,098] Trial 2394 finished with value: 0.32050753915922864 and parameters: {'n_estimators': 591, 'learning_rate': 0.017392986461960136, 'max_depth': 11, 'min_samples_split': 18, 'min_samples_leaf': 3, 'subsample': 0.7127805726267229, 'max_features': 'sqrt'}. Best is trial 1137 with value: 0.19687116000636118.
[I 2024-12-04 13:47:54,268] Trial 2406 finished with value: 0.32218273957330257 and parameters: {'n_estimators': 182, 'learning_rate': 0.0377965618332651, 'max_depth': 12, 'min_samples_split': 4, 'min_samples_leaf': 1, 'subsample': 0.8678188292169414, 'max_features': 'sqrt'}. Best is trial 1137 with value: 0.19687116000636118.
[I 2024-12-04 13:47:56,961] Trial 2375 finished with value: 0.27823048869862116 and parameters: {'n_estimators': 1323, 'learning_rate': 0.09277910109826787, 'max_depth': 5, 'min_samples_split': 18, 'min_samples_leaf': 3, 'subsample': 0.6030870774327071, 'max_features': None}. Best is trial 1137 with value: 0.19687116000636118.
[I 2024-12-04 13:48:01,907] Trial 2377 finished with value: 0.24773328331492708 and parameters: {'n_estimators': 1364, 'learning_rate': 0.09493601792611597, 'max_depth': 12, 'min_samples_split': 18, 'min_samples_leaf': 3, 'subsample': 0.782063682212478, 'max_features': 'sqrt'}. Best is trial 1137 with value: 0.19687116000636118.
[I 2024-12-04 13:48:02,665] Trial 2380 finished with value: 0.21936242229824618 and parameters: {'n_estimators': 1323, 'learning_rate': 0.09200856814298, 'max_depth': 11, 'min_samples_split': 20, 'min_samples_leaf': 1, 'subsample': 0.6464393237067292, 'max_features': 'sqrt'}. Best is trial 1137 with value: 0.19687116000636118.
[I 2024-12-04 13:48:04,760] Trial 2376 finished with value: 0.262930019203462 and parameters: {'n_estimators': 1486, 'learning_rate': 0.09612558896418548, 'max_depth': 9, 'min_samples_split': 16, 'min_samples_leaf': 3, 'subsample': 0.6022251707076914, 'max_features': 'sqrt'}. Best is trial 1137 with value: 0.19687116000636118.
[I 2024-12-04 13:48:06,866] Trial 2386 finished with value: 0.2776961106097753 and parameters: {'n_estimators': 1113, 'learning_rate': 0.09948307078689923, 'max_depth': 12, 'min_samples_split': 15, 'min_samples_leaf': 3, 'subsample': 0.6146379646537444, 'max_features': 'log2'}. Best is trial 1137 with value: 0.19687116000636118.
[I 2024-12-04 13:48:09,848] Trial 2385 finished with value: 0.2506914752389858 and parameters: {'n_estimators': 1207, 'learning_rate': 0.06997010312999398, 'max_depth': 11, 'min_samples_split': 16, 'min_samples_leaf': 3, 'subsample': 0.6096666152250474, 'max_features': 'sqrt'}. Best is trial 1137 with value: 0.19687116000636118.
[I 2024-12-04 13:48:12,965] Trial 2403 finished with value: 0.3501659431525276 and parameters: {'n_estimators': 572, 'learning_rate': 0.06074924533905009, 'max_depth': 3, 'min_samples_split': 7, 'min_samples_leaf': 4, 'subsample': 0.737151759721307, 'max_features': 'sqrt'}. Best is trial 1137 with value: 0.19687116000636118.
[I 2024-12-04 13:48:14,627] Trial 2384 finished with value: 0.21431080445267503 and parameters: {'n_estimators': 1247, 'learning_rate': 0.06330146196977113, 'max_depth': 12, 'min_samples_split': 17, 'min_samples_leaf': 1, 'subsample': 0.8017765546966109, 'max_features': 'sqrt'}. Best is trial 1137 with value: 0.19687116000636118.
[I 2024-12-04 13:48:14,672] Trial 2379 finished with value: 0.2101681962544445 and parameters: {'n_estimators': 1487, 'learning_rate': 0.07775267243856532, 'max_depth': 12, 'min_samples_split': 19, 'min_samples_leaf': 1, 'subsample': 0.7250680472940247, 'max_features': 'sqrt'}. Best is trial 1137 with value: 0.19687116000636118.
[I 2024-12-04 13:48:15,973] Trial 2381 finished with value: 0.24605150722045188 and parameters: {'n_estimators': 1443, 'learning_rate': 0.09953379551370496, 'max_depth': 12, 'min_samples_split': 18, 'min_samples_leaf': 3, 'subsample': 0.6164449142348156, 'max_features': 'sqrt'}. Best is trial 1137 with value: 0.19687116000636118.
[I 2024-12-04 13:48:18,639] Trial 2382 finished with value: 0.21648824419158666 and parameters: {'n_estimators': 1444, 'learning_rate': 0.09914123288632339, 'max_depth': 12, 'min_samples_split': 17, 'min_samples_leaf': 1, 'subsample': 0.6065665115983815, 'max_features': 'sqrt'}. Best is trial 1137 with value: 0.19687116000636118.
