[I 2024-12-03 18:44:11,363] Trial 504 finished with value: 953.2155191445022 and parameters: {'kernel': 'sigmoid', 'C': 80.61573229692965, 'gamma': 0.01019309740606803, 'epsilon': 0.16480098965064222}. Best is trial 88 with value: 0.3542875001421725.
[I 2024-12-03 18:44:12,062] Trial 507 finished with value: 0.36625424342860485 and parameters: {'kernel': 'rbf', 'C': 93.92581639290951, 'gamma': 0.05860734754347306, 'epsilon': 0.17925629259742684}. Best is trial 88 with value: 0.3542875001421725.
[I 2024-12-03 18:44:12,130] Trial 512 finished with value: 0.4329065684759011 and parameters: {'kernel': 'rbf', 'C': 14.459656760442051, 'gamma': 0.0280799058349202, 'epsilon': 0.05218782080372366}. Best is trial 88 with value: 0.3542875001421725.
[I 2024-12-03 18:44:13,192] Trial 511 finished with value: 0.5326262288616229 and parameters: {'kernel': 'rbf', 'C': 12.99285104417363, 'gamma': 0.21028154868614227, 'epsilon': 0.1397536758008734}. Best is trial 88 with value: 0.3542875001421725.
[I 2024-12-03 18:44:13,665] Trial 516 finished with value: 2433.842762962022 and parameters: {'kernel': 'sigmoid', 'C': 94.58377766886282, 'gamma': 0.34062915367443963, 'epsilon': 0.4323670470616543}. Best is trial 88 with value: 0.3542875001421725.
[I 2024-12-03 18:44:13,665] Trial 513 finished with value: 0.5127553800719875 and parameters: {'kernel': 'rbf', 'C': 14.435796972563372, 'gamma': 0.04222792867751764, 'epsilon': 0.648413931291919}. Best is trial 88 with value: 0.3542875001421725.
[I 2024-12-03 18:44:14,400] Trial 90 finished with value: 0.7419671636494745 and parameters: {'kernel': 'poly', 'C': 68.57651733650128, 'gamma': 0.016709722873339404, 'epsilon': 0.00682352050066189}. Best is trial 88 with value: 0.3542875001421725.
[I 2024-12-03 18:44:14,771] Trial 515 finished with value: 0.8569496011473492 and parameters: {'kernel': 'linear', 'C': 0.0017173483200722526, 'gamma': 0.00031968478006855477, 'epsilon': 0.464698736202137}. Best is trial 88 with value: 0.3542875001421725.
[I 2024-12-03 18:44:14,880] Trial 519 finished with value: 1.071519315434754 and parameters: {'kernel': 'poly', 'C': 0.09815887667211357, 'gamma': 0.00028787289529034956, 'epsilon': 0.006277275434751734}. Best is trial 88 with value: 0.3542875001421725.
[I 2024-12-03 18:44:15,244] Trial 514 finished with value: 1.073231378775486 and parameters: {'kernel': 'sigmoid', 'C': 0.0021587027540421015, 'gamma': 0.0001139887394475191, 'epsilon': 0.0014500999281652509}. Best is trial 88 with value: 0.3542875001421725.
[I 2024-12-03 18:44:15,512] Trial 518 finished with value: 0.41711170565472677 and parameters: {'kernel': 'rbf', 'C': 93.30408574086684, 'gamma': 0.003405038511825006, 'epsilon': 0.09470123395159816}. Best is trial 88 with value: 0.3542875001421725.
[I 2024-12-03 18:44:15,637] Trial 521 finished with value: 172.33473357299889 and parameters: {'kernel': 'sigmoid', 'C': 18.522284700308276, 'gamma': 0.007201120452012298, 'epsilon': 0.7586233838113793}. Best is trial 88 with value: 0.3542875001421725.
[I 2024-12-03 18:44:16,086] Trial 522 finished with value: 0.39840761272750524 and parameters: {'kernel': 'rbf', 'C': 22.859487224011882, 'gamma': 0.06394569155707319, 'epsilon': 0.21240540480607245}. Best is trial 88 with value: 0.3542875001421725.
[I 2024-12-03 18:44:16,087] Trial 520 finished with value: 0.4214739814082636 and parameters: {'kernel': 'rbf', 'C': 15.859980065219931, 'gamma': 0.029238434239176513, 'epsilon': 0.1262909400459638}. Best is trial 88 with value: 0.3542875001421725.
[I 2024-12-03 18:44:17,220] Trial 523 finished with value: 0.36560384436515475 and parameters: {'kernel': 'rbf', 'C': 86.8154743235582, 'gamma': 0.027721897584332147, 'epsilon': 0.12076047896497866}. Best is trial 88 with value: 0.3542875001421725.
[I 2024-12-03 18:44:17,555] Trial 525 finished with value: 0.6140988304247218 and parameters: {'kernel': 'rbf', 'C': 93.86839638005468, 'gamma': 0.3635889075018395, 'epsilon': 0.05527767722178177}. Best is trial 88 with value: 0.3542875001421725.
[I 2024-12-03 18:44:17,648] Trial 526 finished with value: 0.36049751869489866 and parameters: {'kernel': 'rbf', 'C': 85.54486589262795, 'gamma': 0.03576762175193368, 'epsilon': 0.23205151360185336}. Best is trial 88 with value: 0.3542875001421725.
[I 2024-12-03 18:44:18,284] Trial 450 finished with value: 0.7701386094737073 and parameters: {'kernel': 'linear', 'C': 25.53505679514182, 'gamma': 0.10315740408446798, 'epsilon': 0.17978898437369706}. Best is trial 88 with value: 0.3542875001421725.
[I 2024-12-03 18:44:18,615] Trial 524 finished with value: 0.38285724891298156 and parameters: {'kernel': 'rbf', 'C': 93.58926236751782, 'gamma': 0.07665044897807695, 'epsilon': 0.10162305360052598}. Best is trial 88 with value: 0.3542875001421725.
[I 2024-12-03 18:44:18,616] Trial 517 finished with value: 1.7185906574644887 and parameters: {'kernel': 'poly', 'C': 91.47054429676037, 'gamma': 0.012984596952264402, 'epsilon': 0.11990705167249942}. Best is trial 88 with value: 0.3542875001421725.
[I 2024-12-03 18:44:18,718] Trial 528 finished with value: 0.5039476066704347 and parameters: {'kernel': 'rbf', 'C': 96.90647507311837, 'gamma': 0.08374052989456787, 'epsilon': 0.5038450399651632}. Best is trial 88 with value: 0.3542875001421725.
[I 2024-12-03 18:44:19,631] Trial 531 finished with value: 0.5430812398251385 and parameters: {'kernel': 'rbf', 'C': 82.5344724822287, 'gamma': 0.016524037997425186, 'epsilon': 0.8123009238731408}. Best is trial 88 with value: 0.3542875001421725.
[I 2024-12-03 18:44:20,368] Trial 529 finished with value: 0.41213429625976555 and parameters: {'kernel': 'rbf', 'C': 17.340288955088617, 'gamma': 0.02303554830812289, 'epsilon': 0.2060819607446434}. Best is trial 88 with value: 0.3542875001421725.
[I 2024-12-03 18:44:20,925] Trial 532 finished with value: 0.3736584027814678 and parameters: {'kernel': 'rbf', 'C': 65.17982844215479, 'gamma': 0.019708809044657005, 'epsilon': 0.23396626581055469}. Best is trial 88 with value: 0.3542875001421725.
[I 2024-12-03 18:44:21,092] Trial 533 finished with value: 0.8272377331978561 and parameters: {'kernel': 'linear', 'C': 0.08324174333763726, 'gamma': 0.15964598186503956, 'epsilon': 0.0013808150604488988}. Best is trial 88 with value: 0.3542875001421725.
[I 2024-12-03 18:44:21,533] Trial 530 finished with value: 0.8434563620485291 and parameters: {'kernel': 'linear', 'C': 37.82953437225032, 'gamma': 0.004193652888595577, 'epsilon': 0.7184475246134309}. Best is trial 88 with value: 0.3542875001421725.
[I 2024-12-03 18:44:21,676] Trial 537 finished with value: 0.4545123771107692 and parameters: {'kernel': 'rbf', 'C': 92.31933392211059, 'gamma': 0.12520909465485672, 'epsilon': 0.207781007166275}. Best is trial 88 with value: 0.3542875001421725.
[I 2024-12-03 18:44:21,761] Trial 527 finished with value: 0.46111606128324895 and parameters: {'kernel': 'rbf', 'C': 20.01293365258065, 'gamma': 0.10072528777820637, 'epsilon': 0.30491788077222765}. Best is trial 88 with value: 0.3542875001421725.
[I 2024-12-03 18:44:22,511] Trial 536 finished with value: 0.3742182060324243 and parameters: {'kernel': 'rbf', 'C': 75.20661253231837, 'gamma': 0.03641098537623258, 'epsilon': 0.35045672967835106}. Best is trial 88 with value: 0.3542875001421725.
[I 2024-12-03 18:44:22,696] Trial 367 finished with value: 0.8026438247739937 and parameters: {'kernel': 'linear', 'C': 76.46425324160444, 'gamma': 0.10209039952703423, 'epsilon': 0.061583450318032716}. Best is trial 88 with value: 0.3542875001421725.
[I 2024-12-03 18:44:22,807] Trial 538 finished with value: 0.4307746411379899 and parameters: {'kernel': 'rbf', 'C': 12.167170988741294, 'gamma': 0.059020803133345685, 'epsilon': 0.316488134347686}. Best is trial 88 with value: 0.3542875001421725.
[I 2024-12-03 18:44:22,848] Trial 534 finished with value: 0.3797965605223502 and parameters: {'kernel': 'rbf', 'C': 99.97386006667575, 'gamma': 0.014738862310248435, 'epsilon': 0.1720879519301877}. Best is trial 88 with value: 0.3542875001421725.
[I 2024-12-03 18:44:23,739] Trial 422 finished with value: 0.7860675074598312 and parameters: {'kernel': 'linear', 'C': 61.083509113519675, 'gamma': 0.019271500905031772, 'epsilon': 0.13271539532417442}. Best is trial 88 with value: 0.3542875001421725.
[I 2024-12-03 18:44:25,119] Trial 540 finished with value: 0.39284944640276476 and parameters: {'kernel': 'rbf', 'C': 83.08939166544754, 'gamma': 0.01384347704960977, 'epsilon': 0.16539486639012116}. Best is trial 88 with value: 0.3542875001421725.
[I 2024-12-03 18:44:25,336] Trial 543 finished with value: 0.37029795031770557 and parameters: {'kernel': 'rbf', 'C': 93.61763060764136, 'gamma': 0.0230246605223672, 'epsilon': 0.20773945207799832}. Best is trial 88 with value: 0.3542875001421725.
[I 2024-12-03 18:44:25,888] Trial 541 finished with value: 0.4150760334111265 and parameters: {'kernel': 'rbf', 'C': 15.010856677336104, 'gamma': 0.08167794752135212, 'epsilon': 0.04897130480832912}. Best is trial 88 with value: 0.3542875001421725.
[I 2024-12-03 18:44:26,277] Trial 542 finished with value: 0.6737922692061921 and parameters: {'kernel': 'rbf', 'C': 0.6052264128358954, 'gamma': 0.007608631103327301, 'epsilon': 0.6661881919091668}. Best is trial 88 with value: 0.3542875001421725.
[I 2024-12-03 18:44:26,303] Trial 547 finished with value: 0.46194686573271126 and parameters: {'kernel': 'rbf', 'C': 92.8610622411159, 'gamma': 0.12755421186482796, 'epsilon': 0.22056171383380854}. Best is trial 88 with value: 0.3542875001421725.
[I 2024-12-03 18:44:26,335] Trial 544 finished with value: 0.41698740362680603 and parameters: {'kernel': 'rbf', 'C': 15.534733384839273, 'gamma': 0.030205442695802, 'epsilon': 0.18141815463691865}. Best is trial 88 with value: 0.3542875001421725.
[I 2024-12-03 18:44:26,613] Trial 545 finished with value: 0.39722641817695786 and parameters: {'kernel': 'rbf', 'C': 23.500747821441674, 'gamma': 0.07801193400271203, 'epsilon': 0.14504536987323238}. Best is trial 88 with value: 0.3542875001421725.
[I 2024-12-03 18:44:26,868] Trial 546 finished with value: 0.40983664204752046 and parameters: {'kernel': 'rbf', 'C': 13.235575358454764, 'gamma': 0.007371197686252592, 'epsilon': 0.0534265547603839}. Best is trial 88 with value: 0.3542875001421725.
[I 2024-12-03 18:44:27,738] Trial 548 finished with value: 0.4301919380934044 and parameters: {'kernel': 'rbf', 'C': 13.06920665128965, 'gamma': 0.10256896050924587, 'epsilon': 0.06457510011538475}. Best is trial 88 with value: 0.3542875001421725.
[I 2024-12-03 18:44:28,686] Trial 552 finished with value: 0.36780811479078007 and parameters: {'kernel': 'rbf', 'C': 90.53035199248008, 'gamma': 0.030381652103959447, 'epsilon': 0.1734530175428383}. Best is trial 88 with value: 0.3542875001421725.
[I 2024-12-03 18:44:29,531] Trial 550 finished with value: 271.68436255202784 and parameters: {'kernel': 'sigmoid', 'C': 13.099793146927636, 'gamma': 0.08877508007530864, 'epsilon': 0.1339702982521658}. Best is trial 88 with value: 0.3542875001421725.
[I 2024-12-03 18:44:29,923] Trial 551 finished with value: 0.4338322520366901 and parameters: {'kernel': 'rbf', 'C': 90.20728822558571, 'gamma': 0.13518415121449515, 'epsilon': 0.07619881636578525}. Best is trial 88 with value: 0.3542875001421725.
[I 2024-12-03 18:44:30,409] Trial 553 finished with value: 0.8935004962716139 and parameters: {'kernel': 'linear', 'C': 0.0016712024305808573, 'gamma': 0.3615857567375781, 'epsilon': 0.18317757550657324}. Best is trial 88 with value: 0.3542875001421725.
[I 2024-12-03 18:44:30,837] Trial 549 finished with value: 0.3554053151986412 and parameters: {'kernel': 'rbf', 'C': 84.63541398340845, 'gamma': 0.04483864511458237, 'epsilon': 0.14509733664269817}. Best is trial 88 with value: 0.3542875001421725.
[I 2024-12-03 18:44:30,914] Trial 554 finished with value: 0.36766326313893266 and parameters: {'kernel': 'rbf', 'C': 93.23892592311381, 'gamma': 0.0289043508209554, 'epsilon': 0.050431832726106865}. Best is trial 88 with value: 0.3542875001421725.
[I 2024-12-03 18:44:31,361] Trial 556 finished with value: 0.5220520410483027 and parameters: {'kernel': 'rbf', 'C': 98.70455603277557, 'gamma': 0.180371615618084, 'epsilon': 0.22300644412841333}. Best is trial 88 with value: 0.3542875001421725.
[I 2024-12-03 18:44:31,841] Trial 558 finished with value: 0.8031549614033421 and parameters: {'kernel': 'linear', 'C': 0.3982084551325796, 'gamma': 0.00018455333907006232, 'epsilon': 0.042718684570296254}. Best is trial 88 with value: 0.3542875001421725.
[I 2024-12-03 18:44:32,106] Trial 559 finished with value: 0.47979981689298523 and parameters: {'kernel': 'rbf', 'C': 9.756003047852602, 'gamma': 0.020506411531112982, 'epsilon': 0.5182799173791405}. Best is trial 88 with value: 0.3542875001421725.
[I 2024-12-03 18:44:32,253] Trial 500 finished with value: 0.7860565340690496 and parameters: {'kernel': 'poly', 'C': 25.430984371962925, 'gamma': 0.03511017360470454, 'epsilon': 0.18361970337843975}. Best is trial 88 with value: 0.3542875001421725.
[I 2024-12-03 18:44:33,205] Trial 555 finished with value: 0.39054081132478935 and parameters: {'kernel': 'rbf', 'C': 88.42631881620501, 'gamma': 0.07424141449116126, 'epsilon': 0.01520593292099433}. Best is trial 88 with value: 0.3542875001421725.
[I 2024-12-03 18:44:33,644] Trial 560 finished with value: 0.5543489923776516 and parameters: {'kernel': 'rbf', 'C': 0.6761445158875797, 'gamma': 0.06970292019028927, 'epsilon': 0.0827039849209658}. Best is trial 88 with value: 0.3542875001421725.
[I 2024-12-03 18:44:33,856] Trial 562 finished with value: 0.40137908213747514 and parameters: {'kernel': 'rbf', 'C': 97.1705637148138, 'gamma': 0.02856631131806296, 'epsilon': 0.48292723619672234}. Best is trial 88 with value: 0.3542875001421725.
[I 2024-12-03 18:44:33,975] Trial 535 finished with value: 0.7989177506922613 and parameters: {'kernel': 'linear', 'C': 12.595013172156786, 'gamma': 0.8289935668249322, 'epsilon': 0.024477573660746904}. Best is trial 88 with value: 0.3542875001421725.
[I 2024-12-03 18:44:34,089] Trial 563 finished with value: 3.8725965134981757 and parameters: {'kernel': 'sigmoid', 'C': 0.16504344959705186, 'gamma': 0.15530414385761993, 'epsilon': 0.3418344100179367}. Best is trial 88 with value: 0.3542875001421725.
[I 2024-12-03 18:44:34,321] Trial 566 finished with value: 0.40438603731383677 and parameters: {'kernel': 'rbf', 'C': 18.772015814099717, 'gamma': 0.07583189443847856, 'epsilon': 0.13973949585896522}. Best is trial 88 with value: 0.3542875001421725.
[I 2024-12-03 18:44:34,322] Trial 564 finished with value: 0.40618736268705247 and parameters: {'kernel': 'rbf', 'C': 15.905817386421498, 'gamma': 0.050752730917317135, 'epsilon': 0.16789503594072683}. Best is trial 88 with value: 0.3542875001421725.
[I 2024-12-03 18:44:35,853] Trial 567 finished with value: 0.40194589505489914 and parameters: {'kernel': 'rbf', 'C': 27.718203820704975, 'gamma': 0.009101360528568974, 'epsilon': 0.11058341390304366}. Best is trial 88 with value: 0.3542875001421725.
[I 2024-12-03 18:44:35,858] Trial 565 finished with value: 0.4431904444359519 and parameters: {'kernel': 'rbf', 'C': 94.40750128203483, 'gamma': 0.11819713967321556, 'epsilon': 0.20251817536483732}. Best is trial 88 with value: 0.3542875001421725.
[I 2024-12-03 18:44:36,489] Trial 569 finished with value: 0.41466951526182266 and parameters: {'kernel': 'rbf', 'C': 21.98958997273307, 'gamma': 0.0362458333169205, 'epsilon': 0.4162685986313584}. Best is trial 88 with value: 0.3542875001421725.
[I 2024-12-03 18:44:36,808] Trial 568 finished with value: 0.4355704334587967 and parameters: {'kernel': 'rbf', 'C': 20.200331429661112, 'gamma': 0.015846174684610047, 'epsilon': 0.14518247361536196}. Best is trial 88 with value: 0.3542875001421725.
[I 2024-12-03 18:44:37,046] Trial 572 finished with value: 0.357452703304235 and parameters: {'kernel': 'rbf', 'C': 97.7040350581501, 'gamma': 0.039577653201554465, 'epsilon': 0.237707282751702}. Best is trial 88 with value: 0.3542875001421725.
[I 2024-12-03 18:44:37,547] Trial 571 finished with value: 0.3791930044448394 and parameters: {'kernel': 'rbf', 'C': 89.26898742780755, 'gamma': 0.07342119247741571, 'epsilon': 0.17842445695221573}. Best is trial 88 with value: 0.3542875001421725.
[I 2024-12-03 18:44:37,686] Trial 573 finished with value: 0.37779154387798625 and parameters: {'kernel': 'rbf', 'C': 97.54405674758594, 'gamma': 0.06917021167689866, 'epsilon': 0.10742959649493973}. Best is trial 88 with value: 0.3542875001421725.
[I 2024-12-03 18:44:38,177] Trial 570 finished with value: 0.4050664000064782 and parameters: {'kernel': 'rbf', 'C': 38.77125566036932, 'gamma': 0.03704971782758311, 'epsilon': 0.44516665492686264}. Best is trial 88 with value: 0.3542875001421725.
[I 2024-12-03 18:44:38,680] Trial 445 finished with value: 0.7801212462490789 and parameters: {'kernel': 'linear', 'C': 97.699383643992, 'gamma': 0.00011337693865615532, 'epsilon': 0.14041091547255097}. Best is trial 88 with value: 0.3542875001421725.
[I 2024-12-03 18:44:38,960] Trial 576 finished with value: 0.36939187044663424 and parameters: {'kernel': 'rbf', 'C': 94.30187254785852, 'gamma': 0.0638408095094566, 'epsilon': 0.1508933718295684}. Best is trial 88 with value: 0.3542875001421725.
[I 2024-12-03 18:44:39,189] Trial 575 finished with value: 0.5027096256064808 and parameters: {'kernel': 'rbf', 'C': 76.29604213446595, 'gamma': 0.10316352072443795, 'epsilon': 0.42502841020398685}. Best is trial 88 with value: 0.3542875001421725.
[I 2024-12-03 18:44:39,226] Trial 577 finished with value: 0.3697048408159172 and parameters: {'kernel': 'rbf', 'C': 83.89718918097269, 'gamma': 0.023093842883476188, 'epsilon': 0.20082640900805682}. Best is trial 88 with value: 0.3542875001421725.
[I 2024-12-03 18:44:39,354] Trial 574 finished with value: 0.6059359286817709 and parameters: {'kernel': 'rbf', 'C': 88.79795774139407, 'gamma': 0.06744152970789895, 'epsilon': 0.7546176122996897}. Best is trial 88 with value: 0.3542875001421725.
[I 2024-12-03 18:44:39,466] Trial 580 finished with value: 0.40306691042359255 and parameters: {'kernel': 'rbf', 'C': 89.9966466177011, 'gamma': 0.01092588583974652, 'epsilon': 0.1823792499964827}. Best is trial 88 with value: 0.3542875001421725.
[I 2024-12-03 18:44:39,805] Trial 578 finished with value: 0.4046453931667899 and parameters: {'kernel': 'rbf', 'C': 23.24438344474536, 'gamma': 0.02066994380911799, 'epsilon': 0.2175116286903181}. Best is trial 88 with value: 0.3542875001421725.
[I 2024-12-03 18:44:41,235] Trial 584 finished with value: 166.11404844668306 and parameters: {'kernel': 'sigmoid', 'C': 8.9053733514556, 'gamma': 0.17170073792678822, 'epsilon': 0.015131916925000665}. Best is trial 88 with value: 0.3542875001421725.
[I 2024-12-03 18:44:41,351] Trial 581 finished with value: 0.8496749711301566 and parameters: {'kernel': 'rbf', 'C': 83.25573663889492, 'gamma': 0.82753814409862, 'epsilon': 0.41708841885935466}. Best is trial 88 with value: 0.3542875001421725.
[I 2024-12-03 18:44:42,075] Trial 579 finished with value: 0.3861443743828856 and parameters: {'kernel': 'rbf', 'C': 98.124215655871, 'gamma': 0.012039673074783373, 'epsilon': 0.39929481277688983}. Best is trial 88 with value: 0.3542875001421725.
[I 2024-12-03 18:44:42,359] Trial 582 finished with value: 0.4188408671371855 and parameters: {'kernel': 'rbf', 'C': 95.7598030069616, 'gamma': 0.10100994525075624, 'epsilon': 0.20326756235535984}. Best is trial 88 with value: 0.3542875001421725.
[I 2024-12-03 18:44:43,045] Trial 586 finished with value: 0.36988003280804105 and parameters: {'kernel': 'rbf', 'C': 94.28451587237811, 'gamma': 0.021985180273346252, 'epsilon': 0.14948053468473027}. Best is trial 88 with value: 0.3542875001421725.
[I 2024-12-03 18:44:43,276] Trial 583 finished with value: 0.39698187458861545 and parameters: {'kernel': 'rbf', 'C': 95.18055241844135, 'gamma': 0.035234785904824255, 'epsilon': 0.430248927628831}. Best is trial 88 with value: 0.3542875001421725.
[I 2024-12-03 18:44:43,316] Trial 589 finished with value: 0.42833944459072854 and parameters: {'kernel': 'rbf', 'C': 12.61202073222851, 'gamma': 0.09618993328335122, 'epsilon': 0.10364653341273644}. Best is trial 88 with value: 0.3542875001421725.
[I 2024-12-03 18:44:43,976] Trial 587 finished with value: 0.4420123733729662 and parameters: {'kernel': 'rbf', 'C': 16.697149825956302, 'gamma': 0.10215837682850074, 'epsilon': 0.22717580607437596}. Best is trial 88 with value: 0.3542875001421725.
[I 2024-12-03 18:44:44,144] Trial 588 finished with value: 0.35978276013578525 and parameters: {'kernel': 'rbf', 'C': 87.31758109398578, 'gamma': 0.03937822614972037, 'epsilon': 0.13024289062207428}. Best is trial 88 with value: 0.3542875001421725.
[I 2024-12-03 18:44:44,144] Trial 592 finished with value: 0.3760925633189032 and parameters: {'kernel': 'rbf', 'C': 80.82116398883478, 'gamma': 0.06260417993488361, 'epsilon': 0.22850542224550074}. Best is trial 88 with value: 0.3542875001421725.
[I 2024-12-03 18:44:44,804] Trial 595 finished with value: 0.39229845478305636 and parameters: {'kernel': 'rbf', 'C': 22.664837149460272, 'gamma': 0.03543478939512012, 'epsilon': 0.20431457226875968}. Best is trial 88 with value: 0.3542875001421725.
[I 2024-12-03 18:44:44,805] Trial 593 finished with value: 0.39364130731644514 and parameters: {'kernel': 'rbf', 'C': 22.046155961145704, 'gamma': 0.03380172826872552, 'epsilon': 0.26407060003436195}. Best is trial 88 with value: 0.3542875001421725.
[I 2024-12-03 18:44:45,785] Trial 590 finished with value: 0.3800353085405675 and parameters: {'kernel': 'rbf', 'C': 98.5445527063357, 'gamma': 0.017749556382065598, 'epsilon': 0.04724799828954004}. Best is trial 88 with value: 0.3542875001421725.
[I 2024-12-03 18:44:46,302] Trial 594 finished with value: 0.6257547482520079 and parameters: {'kernel': 'rbf', 'C': 15.458064785525364, 'gamma': 0.38189681848680124, 'epsilon': 0.07577470638133038}. Best is trial 88 with value: 0.3542875001421725.
