[I 2024-12-04 15:35:17,961] Trial 2372 finished with value: 0.13435441231859668 and parameters: {'kernel_type': 'Matern', 'length_scale': 331.66296892628293, 'noise_level': 0.057472722050336926, 'constant_value': 1448.1020735856714, 'nu': 1.5}. Best is trial 1985 with value: 0.134351948015208.
[I 2024-12-04 15:35:18,907] Trial 2377 finished with value: 1.2693634886507517 and parameters: {'kernel_type': 'Matern', 'length_scale': 0.08300880158941464, 'noise_level': 0.880079319998802, 'constant_value': 371.11958017670366, 'nu': 1.5}. Best is trial 1985 with value: 0.134351948015208.
[I 2024-12-04 15:35:19,438] Trial 2378 finished with value: 0.13435439978591657 and parameters: {'kernel_type': 'Matern', 'length_scale': 1527.6153013076173, 'noise_level': 0.018150496063426034, 'constant_value': 86638.74325094486, 'nu': 1.5}. Best is trial 1985 with value: 0.134351948015208.
[I 2024-12-04 15:35:21,280] Trial 2376 finished with value: 0.13435443201982566 and parameters: {'kernel_type': 'Matern', 'length_scale': 217.0302121029547, 'noise_level': 0.811017416214497, 'constant_value': 93312.71365857184, 'nu': 1.5}. Best is trial 1985 with value: 0.134351948015208.
[I 2024-12-04 15:35:23,153] Trial 2384 finished with value: 0.13435438131888397 and parameters: {'kernel_type': 'Matern', 'length_scale': 119.50542054033632, 'noise_level': 0.9955140616411359, 'constant_value': 220.6752463248731, 'nu': 1.5}. Best is trial 1985 with value: 0.134351948015208.
[I 2024-12-04 15:35:24,161] Trial 2375 finished with value: 0.13435439386117756 and parameters: {'kernel_type': 'Matern', 'length_scale': 2318.418177444244, 'noise_level': 0.7030340700181512, 'constant_value': 883.2852902094717, 'nu': 1.5}. Best is trial 1985 with value: 0.134351948015208.
[I 2024-12-04 15:35:25,854] Trial 2379 finished with value: 0.13435439761458404 and parameters: {'kernel_type': 'Matern', 'length_scale': 27.371521156126963, 'noise_level': 0.004808504498092412, 'constant_value': 93649.94448154695, 'nu': 1.5}. Best is trial 1985 with value: 0.134351948015208.
[I 2024-12-04 15:35:26,446] Trial 2386 finished with value: 0.13435439888776193 and parameters: {'kernel_type': 'Matern', 'length_scale': 2.4870718898208577, 'noise_level': 0.11884461843225604, 'constant_value': 1938.5196466374937, 'nu': 1.5}. Best is trial 1985 with value: 0.134351948015208.
[I 2024-12-04 15:35:27,351] Trial 2382 finished with value: 0.14859826835244655 and parameters: {'kernel_type': 'Matern', 'length_scale': 3.1912223432464497, 'noise_level': 0.2104465721822332, 'constant_value': 4479.844056186151, 'nu': 2.5}. Best is trial 1985 with value: 0.134351948015208.
[I 2024-12-04 15:35:27,657] Trial 2385 finished with value: 0.13435439890221415 and parameters: {'kernel_type': 'Matern', 'length_scale': 54.57599914627445, 'noise_level': 0.04988416675963569, 'constant_value': 3026.264824964441, 'nu': 1.5}. Best is trial 1985 with value: 0.134351948015208.
[I 2024-12-04 15:35:27,905] Trial 2383 finished with value: 0.13435438667933183 and parameters: {'kernel_type': 'Matern', 'length_scale': 34.182067598387405, 'noise_level': 0.036558194219770815, 'constant_value': 3455.971705903279, 'nu': 1.5}. Best is trial 1985 with value: 0.134351948015208.
[I 2024-12-04 15:35:28,337] Trial 2391 finished with value: 0.15167300444740292 and parameters: {'kernel_type': 'RBF', 'length_scale': 597.1572635788359, 'noise_level': 0.005121728423715981, 'constant_value': 82539.09617956431, 'nu': 1.5}. Best is trial 1985 with value: 0.134351948015208.
[I 2024-12-04 15:35:28,351] Trial 2381 finished with value: 0.13435440294770518 and parameters: {'kernel_type': 'Matern', 'length_scale': 5.064982634814624, 'noise_level': 0.029206687116092693, 'constant_value': 1350.679467611501, 'nu': 1.5}. Best is trial 1985 with value: 0.134351948015208.
[I 2024-12-04 15:35:29,358] Trial 2387 finished with value: 0.13435441996623465 and parameters: {'kernel_type': 'Matern', 'length_scale': 31.24283653725564, 'noise_level': 0.0010451976049533729, 'constant_value': 548.322690634151, 'nu': 1.5}. Best is trial 1985 with value: 0.134351948015208.
[I 2024-12-04 15:35:34,233] Trial 2390 finished with value: 0.17251038650850015 and parameters: {'kernel_type': 'Matern', 'length_scale': 7.525553106093172, 'noise_level': 0.00014040371492579862, 'constant_value': 4481.256996428238, 'nu': 0.5}. Best is trial 1985 with value: 0.134351948015208.
[I 2024-12-04 15:35:34,790] Trial 2392 finished with value: 1.3007745979657548 and parameters: {'kernel_type': 'Matern', 'length_scale': 17.727537417155016, 'noise_level': 0.001097496379371464, 'constant_value': 2012.800420782424, 'nu': 1.5}. Best is trial 1985 with value: 0.134351948015208.
[I 2024-12-04 15:35:37,403] Trial 2394 finished with value: 0.13435440282850059 and parameters: {'kernel_type': 'Matern', 'length_scale': 153.93371933974043, 'noise_level': 0.03688900407381314, 'constant_value': 49930.72693362001, 'nu': 1.5}. Best is trial 1985 with value: 0.134351948015208.
[I 2024-12-04 15:35:38,195] Trial 2403 finished with value: 0.13435442751433577 and parameters: {'kernel_type': 'Matern', 'length_scale': 235.54279957468302, 'noise_level': 0.0017265286813156742, 'constant_value': 2891.269611502488, 'nu': 1.5}. Best is trial 1985 with value: 0.134351948015208.
[I 2024-12-04 15:35:38,682] Trial 2397 finished with value: 0.13435438156878932 and parameters: {'kernel_type': 'Matern', 'length_scale': 13.985417002799332, 'noise_level': 0.7378665385489752, 'constant_value': 1791.7582127006701, 'nu': 1.5}. Best is trial 1985 with value: 0.134351948015208.
[I 2024-12-04 15:35:40,627] Trial 2404 finished with value: 0.1343539007390576 and parameters: {'kernel_type': 'Matern', 'length_scale': 169.46004585127199, 'noise_level': 0.03893580731384581, 'constant_value': 95221.29080014076, 'nu': 1.5}. Best is trial 1985 with value: 0.134351948015208.
[I 2024-12-04 15:35:41,514] Trial 2393 finished with value: 0.1343543085985999 and parameters: {'kernel_type': 'Matern', 'length_scale': 47.94930730311507, 'noise_level': 0.00308586605721835, 'constant_value': 73942.91635997135, 'nu': 1.5}. Best is trial 1985 with value: 0.134351948015208.
[I 2024-12-04 15:35:41,955] Trial 2388 finished with value: 1.3007745974137697 and parameters: {'kernel_type': 'RBF', 'length_scale': 12570.83525242771, 'noise_level': 0.02049582538794398, 'constant_value': 0.09168100126301269, 'nu': 2.5}. Best is trial 1985 with value: 0.134351948015208.
[I 2024-12-04 15:35:42,198] Trial 2389 finished with value: 1.269363502853309 and parameters: {'kernel_type': 'Matern', 'length_scale': 88137.1714899482, 'noise_level': 4.598298841081685e-08, 'constant_value': 1.176930380151474e-05, 'nu': 2.5}. Best is trial 1985 with value: 0.134351948015208.
[I 2024-12-04 15:35:42,249] Trial 2395 finished with value: 0.13435439269256752 and parameters: {'kernel_type': 'Matern', 'length_scale': 1252.6891299207748, 'noise_level': 0.007634740368309543, 'constant_value': 647.3967222724223, 'nu': 1.5}. Best is trial 1985 with value: 0.134351948015208.
[I 2024-12-04 15:35:42,696] Trial 2399 finished with value: 0.13435437401613945 and parameters: {'kernel_type': 'Matern', 'length_scale': 122.03912528440065, 'noise_level': 0.17050544174961102, 'constant_value': 98348.17894517684, 'nu': 1.5}. Best is trial 1985 with value: 0.134351948015208.
[I 2024-12-04 15:35:44,204] Trial 2400 finished with value: 0.1343540108806965 and parameters: {'kernel_type': 'Matern', 'length_scale': 422.7050010179844, 'noise_level': 0.0014560087274486226, 'constant_value': 423.4665309426927, 'nu': 1.5}. Best is trial 1985 with value: 0.134351948015208.
[I 2024-12-04 15:35:45,514] Trial 2405 finished with value: 0.13435440021658643 and parameters: {'kernel_type': 'Matern', 'length_scale': 2.0318639360230843, 'noise_level': 0.05829489921851869, 'constant_value': 938.3494004717056, 'nu': 1.5}. Best is trial 1985 with value: 0.134351948015208.
[I 2024-12-04 15:35:45,572] Trial 2396 finished with value: 0.13435394440499054 and parameters: {'kernel_type': 'Matern', 'length_scale': 23.83652415950015, 'noise_level': 0.08551432598078687, 'constant_value': 94448.79905788506, 'nu': 1.5}. Best is trial 1985 with value: 0.134351948015208.
[I 2024-12-04 15:35:46,476] Trial 2409 finished with value: 0.13435439843579616 and parameters: {'kernel_type': 'Matern', 'length_scale': 0.5839306387453514, 'noise_level': 0.6316758896489527, 'constant_value': 89972.83145069385, 'nu': 1.5}. Best is trial 1985 with value: 0.134351948015208.
[I 2024-12-04 15:35:46,482] Trial 2402 finished with value: 0.1343543977658562 and parameters: {'kernel_type': 'Matern', 'length_scale': 15.514368399606518, 'noise_level': 0.08009404190319855, 'constant_value': 927.5211809988601, 'nu': 1.5}. Best is trial 1985 with value: 0.134351948015208.
[I 2024-12-04 15:35:46,502] Trial 2398 finished with value: 1.300774597967891 and parameters: {'kernel_type': 'RBF', 'length_scale': 67105.94693936854, 'noise_level': 0.17344667024915914, 'constant_value': 0.003231998961653682, 'nu': 0.5}. Best is trial 1985 with value: 0.134351948015208.
[I 2024-12-04 15:35:47,794] Trial 2407 finished with value: 0.13435438595820098 and parameters: {'kernel_type': 'Matern', 'length_scale': 7.663370881087616, 'noise_level': 0.08397598435417024, 'constant_value': 1717.2423330859556, 'nu': 1.5}. Best is trial 1985 with value: 0.134351948015208.
[I 2024-12-04 15:35:50,178] Trial 2412 finished with value: 1.2693635028562118 and parameters: {'kernel_type': 'RBF', 'length_scale': 0.05090315040926972, 'noise_level': 0.0007269600957628113, 'constant_value': 288.103298819422, 'nu': 1.5}. Best is trial 1985 with value: 0.134351948015208.
[I 2024-12-04 15:35:52,456] Trial 2408 finished with value: 0.13435440254645867 and parameters: {'kernel_type': 'Matern', 'length_scale': 0.9679149172727103, 'noise_level': 0.0048986993059974525, 'constant_value': 54.249300605783304, 'nu': 1.5}. Best is trial 1985 with value: 0.134351948015208.
[I 2024-12-04 15:35:54,573] Trial 2406 finished with value: 1.2693635028570156 and parameters: {'kernel_type': 'Matern', 'length_scale': 40293.75172548518, 'noise_level': 0.0002634659416069824, 'constant_value': 133.7207449970916, 'nu': 1.5}. Best is trial 1985 with value: 0.134351948015208.
[I 2024-12-04 15:35:55,180] Trial 2411 finished with value: 0.1343543609751105 and parameters: {'kernel_type': 'Matern', 'length_scale': 837.3752609197808, 'noise_level': 0.031194653261483025, 'constant_value': 59806.052250384426, 'nu': 1.5}. Best is trial 1985 with value: 0.134351948015208.
[I 2024-12-04 15:35:55,776] Trial 2418 finished with value: 0.134354386733711 and parameters: {'kernel_type': 'Matern', 'length_scale': 1011.4884931501198, 'noise_level': 0.07515264455876425, 'constant_value': 44362.1098036531, 'nu': 1.5}. Best is trial 1985 with value: 0.134351948015208.
[I 2024-12-04 15:35:56,987] Trial 2420 finished with value: 0.1343543978814466 and parameters: {'kernel_type': 'Matern', 'length_scale': 10016.465774247094, 'noise_level': 0.020683391011190617, 'constant_value': 899.8461355683773, 'nu': 1.5}. Best is trial 1985 with value: 0.134351948015208.
[I 2024-12-04 15:35:57,005] Trial 2401 finished with value: 0.13435449975208685 and parameters: {'kernel_type': 'Matern', 'length_scale': 0.48049203216611835, 'noise_level': 0.0977299641109909, 'constant_value': 334.8115082181735, 'nu': 1.5}. Best is trial 1985 with value: 0.134351948015208.
[I 2024-12-04 15:35:57,927] Trial 2415 finished with value: 0.13435439484280476 and parameters: {'kernel_type': 'Matern', 'length_scale': 29.71896977910374, 'noise_level': 0.37019420552205623, 'constant_value': 3214.2356443541307, 'nu': 1.5}. Best is trial 1985 with value: 0.134351948015208.
[I 2024-12-04 15:35:58,730] Trial 2410 finished with value: 0.13435439995312207 and parameters: {'kernel_type': 'Matern', 'length_scale': 807.1760793585916, 'noise_level': 0.008364380714729969, 'constant_value': 73524.18228583653, 'nu': 1.5}. Best is trial 1985 with value: 0.134351948015208.
[I 2024-12-04 15:36:02,871] Trial 2419 finished with value: 0.13435445922295106 and parameters: {'kernel_type': 'Matern', 'length_scale': 2004.8559498485224, 'noise_level': 0.10270342959043378, 'constant_value': 50544.13681524684, 'nu': 1.5}. Best is trial 1985 with value: 0.134351948015208.
[I 2024-12-04 15:36:03,212] Trial 2422 finished with value: 0.13435439997359527 and parameters: {'kernel_type': 'Matern', 'length_scale': 526.7357466388717, 'noise_level': 0.0464358610954917, 'constant_value': 1348.0661672378471, 'nu': 1.5}. Best is trial 1985 with value: 0.134351948015208.
[I 2024-12-04 15:36:03,214] Trial 2423 finished with value: 0.1343543729045444 and parameters: {'kernel_type': 'Matern', 'length_scale': 3.747710421941389, 'noise_level': 0.7709688501947803, 'constant_value': 94477.75707288207, 'nu': 1.5}. Best is trial 1985 with value: 0.134351948015208.
[I 2024-12-04 15:36:03,409] Trial 2414 finished with value: 0.13435444317780157 and parameters: {'kernel_type': 'Matern', 'length_scale': 1123.7216564560654, 'noise_level': 0.0275828832366313, 'constant_value': 1455.0256531095247, 'nu': 1.5}. Best is trial 1985 with value: 0.134351948015208.
[I 2024-12-04 15:36:04,613] Trial 2413 finished with value: 0.13435402600800359 and parameters: {'kernel_type': 'Matern', 'length_scale': 3465.071012950856, 'noise_level': 0.5277552698578906, 'constant_value': 9167.188641645378, 'nu': 1.5}. Best is trial 1985 with value: 0.134351948015208.
[I 2024-12-04 15:36:05,417] Trial 2421 finished with value: 0.13435439904854282 and parameters: {'kernel_type': 'Matern', 'length_scale': 494.060145044251, 'noise_level': 0.07361161516713241, 'constant_value': 29393.797747271696, 'nu': 1.5}. Best is trial 1985 with value: 0.134351948015208.
[I 2024-12-04 15:36:05,779] Trial 2426 finished with value: 0.1343544468209798 and parameters: {'kernel_type': 'Matern', 'length_scale': 431.0531986594087, 'noise_level': 0.07886214147191684, 'constant_value': 77436.66143668898, 'nu': 1.5}. Best is trial 1985 with value: 0.134351948015208.
[I 2024-12-04 15:36:08,669] Trial 2429 finished with value: 0.13435434567455112 and parameters: {'kernel_type': 'Matern', 'length_scale': 65.1076496875171, 'noise_level': 0.030471071732766808, 'constant_value': 66338.22095543605, 'nu': 1.5}. Best is trial 1985 with value: 0.134351948015208.
[I 2024-12-04 15:36:08,827] Trial 2428 finished with value: 0.1343544030921743 and parameters: {'kernel_type': 'Matern', 'length_scale': 712.4019347002237, 'noise_level': 0.002283354680155695, 'constant_value': 97042.75244089832, 'nu': 1.5}. Best is trial 1985 with value: 0.134351948015208.
[I 2024-12-04 15:36:09,027] Trial 2435 finished with value: 0.13435443491484048 and parameters: {'kernel_type': 'Matern', 'length_scale': 100.15257299758414, 'noise_level': 0.027708827958829164, 'constant_value': 70400.84371494308, 'nu': 1.5}. Best is trial 1985 with value: 0.134351948015208.
[I 2024-12-04 15:36:10,201] Trial 2427 finished with value: 0.13435422789101992 and parameters: {'kernel_type': 'Matern', 'length_scale': 211.79116794885982, 'noise_level': 0.9616411110246718, 'constant_value': 226.84601030941545, 'nu': 1.5}. Best is trial 1985 with value: 0.134351948015208.
[I 2024-12-04 15:36:10,560] Trial 2417 finished with value: 0.13435440390506978 and parameters: {'kernel_type': 'Matern', 'length_scale': 1.7575852166392838, 'noise_level': 0.07977675561970443, 'constant_value': 64473.10111280646, 'nu': 1.5}. Best is trial 1985 with value: 0.134351948015208.
[I 2024-12-04 15:36:11,926] Trial 2430 finished with value: 0.13435408203578994 and parameters: {'kernel_type': 'Matern', 'length_scale': 42.261864023283756, 'noise_level': 0.029727108326172754, 'constant_value': 96590.76128598167, 'nu': 1.5}. Best is trial 1985 with value: 0.134351948015208.
[I 2024-12-04 15:36:12,581] Trial 2431 finished with value: 0.1343543995409984 and parameters: {'kernel_type': 'Matern', 'length_scale': 44.4787111672737, 'noise_level': 0.6342892510779231, 'constant_value': 1273.507923361242, 'nu': 1.5}. Best is trial 1985 with value: 0.134351948015208.
[I 2024-12-04 15:36:12,614] Trial 2433 finished with value: 0.17251040234589995 and parameters: {'kernel_type': 'Matern', 'length_scale': 36.69874727795184, 'noise_level': 0.21337259394831168, 'constant_value': 56856.54980778493, 'nu': 0.5}. Best is trial 1985 with value: 0.134351948015208.
[I 2024-12-04 15:36:13,391] Trial 2425 finished with value: 0.13435437796982544 and parameters: {'kernel_type': 'Matern', 'length_scale': 1968.93504651428, 'noise_level': 0.23351749042840603, 'constant_value': 3528.300035823749, 'nu': 1.5}. Best is trial 1985 with value: 0.134351948015208.
[I 2024-12-04 15:36:13,415] Trial 2416 finished with value: 0.13435462512872667 and parameters: {'kernel_type': 'Matern', 'length_scale': 226.34922330969906, 'noise_level': 0.0027309053883400104, 'constant_value': 59534.7104860119, 'nu': 1.5}. Best is trial 1985 with value: 0.134351948015208.
[I 2024-12-04 15:36:15,823] Trial 2437 finished with value: 0.1343544010695909 and parameters: {'kernel_type': 'Matern', 'length_scale': 37.698155862336435, 'noise_level': 0.0997242275678402, 'constant_value': 57994.90070399265, 'nu': 1.5}. Best is trial 1985 with value: 0.134351948015208.
[I 2024-12-04 15:36:16,756] Trial 2436 finished with value: 0.13435361865147866 and parameters: {'kernel_type': 'Matern', 'length_scale': 124.94052192139948, 'noise_level': 0.40552245192926123, 'constant_value': 29671.51119642984, 'nu': 1.5}. Best is trial 1985 with value: 0.134351948015208.
[I 2024-12-04 15:36:16,967] Trial 2438 finished with value: 0.13435440480545277 and parameters: {'kernel_type': 'Matern', 'length_scale': 238.29376405606556, 'noise_level': 0.9861623914936224, 'constant_value': 6411.446240696041, 'nu': 1.5}. Best is trial 1985 with value: 0.134351948015208.
[I 2024-12-04 15:36:17,432] Trial 2424 finished with value: 0.13435438534600017 and parameters: {'kernel_type': 'Matern', 'length_scale': 41.60828906930598, 'noise_level': 0.21466166668849074, 'constant_value': 88557.10094484652, 'nu': 1.5}. Best is trial 1985 with value: 0.134351948015208.
[I 2024-12-04 15:36:18,155] Trial 2432 finished with value: 0.1343543996862416 and parameters: {'kernel_type': 'Matern', 'length_scale': 1188.180268413001, 'noise_level': 0.00927203486323469, 'constant_value': 79434.02155429035, 'nu': 1.5}. Best is trial 1985 with value: 0.134351948015208.
[I 2024-12-04 15:36:19,608] Trial 2445 finished with value: 0.1343543884250063 and parameters: {'kernel_type': 'Matern', 'length_scale': 4141.898952569607, 'noise_level': 0.026848831156008456, 'constant_value': 73130.40992041436, 'nu': 1.5}. Best is trial 1985 with value: 0.134351948015208.
[I 2024-12-04 15:36:21,859] Trial 2444 finished with value: 0.1343543902056738 and parameters: {'kernel_type': 'Matern', 'length_scale': 220.4887059257051, 'noise_level': 0.1104704525376594, 'constant_value': 1074.2777186056328, 'nu': 1.5}. Best is trial 1985 with value: 0.134351948015208.
[I 2024-12-04 15:36:24,279] Trial 2446 finished with value: 0.13435440003281376 and parameters: {'kernel_type': 'Matern', 'length_scale': 4.139876338058554, 'noise_level': 0.006900161982490194, 'constant_value': 94857.45411801874, 'nu': 1.5}. Best is trial 1985 with value: 0.134351948015208.
[I 2024-12-04 15:36:25,228] Trial 2448 finished with value: 0.13435439989608988 and parameters: {'kernel_type': 'Matern', 'length_scale': 168.64829706235523, 'noise_level': 0.29785015090365285, 'constant_value': 84893.45360263338, 'nu': 1.5}. Best is trial 1985 with value: 0.134351948015208.
[I 2024-12-04 15:36:26,634] Trial 2442 finished with value: 0.1343545052567255 and parameters: {'kernel_type': 'Matern', 'length_scale': 3506.854134740074, 'noise_level': 0.7570770865721331, 'constant_value': 77970.74280614345, 'nu': 1.5}. Best is trial 1985 with value: 0.134351948015208.
[I 2024-12-04 15:36:26,642] Trial 2452 finished with value: 0.13435440011958197 and parameters: {'kernel_type': 'Matern', 'length_scale': 870.1264099807996, 'noise_level': 0.07081658618712694, 'constant_value': 97889.29106851142, 'nu': 1.5}. Best is trial 1985 with value: 0.134351948015208.
[I 2024-12-04 15:36:28,195] Trial 2440 finished with value: 0.13435439863796342 and parameters: {'kernel_type': 'Matern', 'length_scale': 14.092768282330127, 'noise_level': 0.6433723247029189, 'constant_value': 48049.99849451989, 'nu': 1.5}. Best is trial 1985 with value: 0.134351948015208.
[I 2024-12-04 15:36:28,809] Trial 2447 finished with value: 0.14859827388660266 and parameters: {'kernel_type': 'Matern', 'length_scale': 201.78880148222004, 'noise_level': 0.2911969474695189, 'constant_value': 3475.593551891221, 'nu': 2.5}. Best is trial 1985 with value: 0.134351948015208.
[I 2024-12-04 15:36:29,789] Trial 2441 finished with value: 0.1343543867310486 and parameters: {'kernel_type': 'Matern', 'length_scale': 581.5576179618344, 'noise_level': 0.0020318046589282287, 'constant_value': 339.71474716699004, 'nu': 1.5}. Best is trial 1985 with value: 0.134351948015208.
[I 2024-12-04 15:36:29,981] Trial 2434 finished with value: 0.13435439155779919 and parameters: {'kernel_type': 'Matern', 'length_scale': 106.30743174962689, 'noise_level': 0.020704254464244985, 'constant_value': 93413.09840053735, 'nu': 1.5}. Best is trial 1985 with value: 0.134351948015208.
[I 2024-12-04 15:36:30,004] Trial 2451 finished with value: 0.13435438793819016 and parameters: {'kernel_type': 'Matern', 'length_scale': 1171.1330018422932, 'noise_level': 0.7369963309021692, 'constant_value': 30231.148237951715, 'nu': 1.5}. Best is trial 1985 with value: 0.134351948015208.
[I 2024-12-04 15:36:30,011] Trial 2439 finished with value: 0.14859827814492835 and parameters: {'kernel_type': 'Matern', 'length_scale': 0.3661936047332501, 'noise_level': 1.037153804211673e-09, 'constant_value': 0.014173432977389178, 'nu': 2.5}. Best is trial 1985 with value: 0.134351948015208.
