[I 2024-12-04 15:03:43,049] Trial 893 finished with value: 0.48830337525905415 and parameters: {'kernel_type': 'Matern', 'length_scale': 1295.6221521602956, 'noise_level': 0.01901881708849207, 'constant_value': 55.89020012874087, 'nu': 0.5}. Best is trial 386 with value: 0.4872991004520934.
[I 2024-12-04 15:03:44,167] Trial 899 finished with value: 0.4883034164008605 and parameters: {'kernel_type': 'Matern', 'length_scale': 6329.946551249441, 'noise_level': 0.8605578875481483, 'constant_value': 198.09201008587917, 'nu': 0.5}. Best is trial 386 with value: 0.4872991004520934.
[I 2024-12-04 15:03:44,760] Trial 910 finished with value: 1.2614547953941468 and parameters: {'kernel_type': 'Matern', 'length_scale': 57.573930795753554, 'noise_level': 0.02341915776871763, 'constant_value': 890.7736563133711, 'nu': 0.5}. Best is trial 386 with value: 0.4872991004520934.
[I 2024-12-04 15:03:44,787] Trial 911 finished with value: 0.4883034185070009 and parameters: {'kernel_type': 'Matern', 'length_scale': 1323.6864774168923, 'noise_level': 0.013307463895247312, 'constant_value': 408.6969620410671, 'nu': 0.5}. Best is trial 386 with value: 0.4872991004520934.
[I 2024-12-04 15:03:45,921] Trial 904 finished with value: 0.48830341762556634 and parameters: {'kernel_type': 'Matern', 'length_scale': 471.36019959658717, 'noise_level': 0.7855170890718081, 'constant_value': 255.0470419958104, 'nu': 0.5}. Best is trial 386 with value: 0.4872991004520934.
[I 2024-12-04 15:03:47,142] Trial 912 finished with value: 0.4883033372332681 and parameters: {'kernel_type': 'Matern', 'length_scale': 598.1512625322773, 'noise_level': 0.429064168028112, 'constant_value': 372.05733682707927, 'nu': 0.5}. Best is trial 386 with value: 0.4872991004520934.
[I 2024-12-04 15:03:47,182] Trial 901 finished with value: 0.4883034271694683 and parameters: {'kernel_type': 'Matern', 'length_scale': 381.411347094985, 'noise_level': 0.9279265485674476, 'constant_value': 3210.831046443739, 'nu': 0.5}. Best is trial 386 with value: 0.4872991004520934.
[I 2024-12-04 15:03:48,027] Trial 913 finished with value: 0.48830341862961124 and parameters: {'kernel_type': 'Matern', 'length_scale': 818.9448210571715, 'noise_level': 0.9042070450215933, 'constant_value': 41384.63922626782, 'nu': 0.5}. Best is trial 386 with value: 0.4872991004520934.
[I 2024-12-04 15:03:48,659] Trial 898 finished with value: 0.48830336986122624 and parameters: {'kernel_type': 'Matern', 'length_scale': 110.72543148065094, 'noise_level': 0.8249195852172386, 'constant_value': 6.549336761701255, 'nu': 0.5}. Best is trial 386 with value: 0.4872991004520934.
[I 2024-12-04 15:03:49,275] Trial 906 finished with value: 0.48830341887022516 and parameters: {'kernel_type': 'Matern', 'length_scale': 98058.57615291452, 'noise_level': 0.07798949758491437, 'constant_value': 1575.4156043353346, 'nu': 0.5}. Best is trial 386 with value: 0.4872991004520934.
[I 2024-12-04 15:03:50,305] Trial 915 finished with value: 0.4883034164362087 and parameters: {'kernel_type': 'Matern', 'length_scale': 979.7048596542759, 'noise_level': 0.0016873626384480826, 'constant_value': 1855.2898751025123, 'nu': 0.5}. Best is trial 386 with value: 0.4872991004520934.
[I 2024-12-04 15:03:51,407] Trial 905 finished with value: 1.261454795394147 and parameters: {'kernel_type': 'Matern', 'length_scale': 336.31918166082505, 'noise_level': 0.026382530985995804, 'constant_value': 1685.1724069335996, 'nu': 0.5}. Best is trial 386 with value: 0.4872991004520934.
[I 2024-12-04 15:03:52,660] Trial 909 finished with value: 0.48830367502889777 and parameters: {'kernel_type': 'Matern', 'length_scale': 1770.2752608535168, 'noise_level': 0.007295855695102952, 'constant_value': 2840.500690750053, 'nu': 0.5}. Best is trial 386 with value: 0.4872991004520934.
[I 2024-12-04 15:03:52,917] Trial 908 finished with value: 0.4883033828050492 and parameters: {'kernel_type': 'Matern', 'length_scale': 37.25392258251597, 'noise_level': 0.013340376639384385, 'constant_value': 9612.48036149775, 'nu': 0.5}. Best is trial 386 with value: 0.4872991004520934.
[I 2024-12-04 15:03:53,120] Trial 916 finished with value: 1.2401112330747188 and parameters: {'kernel_type': 'Matern', 'length_scale': 75972.74718741256, 'noise_level': 0.002694327166594448, 'constant_value': 453.97650742090894, 'nu': 0.5}. Best is trial 386 with value: 0.4872991004520934.
[I 2024-12-04 15:03:54,705] Trial 917 finished with value: 0.5663942870919334 and parameters: {'kernel_type': 'Matern', 'length_scale': 21.06898723428467, 'noise_level': 0.18077162097784036, 'constant_value': 27684.499506463275, 'nu': 2.5}. Best is trial 386 with value: 0.4872991004520934.
[I 2024-12-04 15:03:54,845] Trial 907 finished with value: 0.48830341757591855 and parameters: {'kernel_type': 'Matern', 'length_scale': 622.6493390746233, 'noise_level': 0.8790762436980201, 'constant_value': 31987.60347334475, 'nu': 0.5}. Best is trial 386 with value: 0.4872991004520934.
[I 2024-12-04 15:03:54,931] Trial 914 finished with value: 0.6443852267484275 and parameters: {'kernel_type': 'RBF', 'length_scale': 45711.652923162204, 'noise_level': 0.3898863006956944, 'constant_value': 25243.0600555638, 'nu': 2.5}. Best is trial 386 with value: 0.4872991004520934.
[I 2024-12-04 15:03:55,063] Trial 920 finished with value: 0.48830339818232416 and parameters: {'kernel_type': 'Matern', 'length_scale': 2073.8018462464775, 'noise_level': 0.9146467871604218, 'constant_value': 890.6576319198143, 'nu': 0.5}. Best is trial 386 with value: 0.4872991004520934.
[I 2024-12-04 15:03:55,485] Trial 919 finished with value: 0.4883034226781672 and parameters: {'kernel_type': 'Matern', 'length_scale': 849.2398164267471, 'noise_level': 0.5817661532619671, 'constant_value': 4127.708947071196, 'nu': 0.5}. Best is trial 386 with value: 0.4872991004520934.
[I 2024-12-04 15:03:55,737] Trial 923 finished with value: 0.48830340820238033 and parameters: {'kernel_type': 'Matern', 'length_scale': 751.5765406084608, 'noise_level': 0.9121700217901461, 'constant_value': 751.0840600870625, 'nu': 0.5}. Best is trial 386 with value: 0.4872991004520934.
[I 2024-12-04 15:03:56,449] Trial 921 finished with value: 0.48830342561110013 and parameters: {'kernel_type': 'Matern', 'length_scale': 33308.52357481522, 'noise_level': 0.9277689975153847, 'constant_value': 2846.3325995267087, 'nu': 0.5}. Best is trial 386 with value: 0.4872991004520934.
[I 2024-12-04 15:03:56,928] Trial 925 finished with value: 1.261454795394147 and parameters: {'kernel_type': 'Matern', 'length_scale': 11.208509806919853, 'noise_level': 0.016353146152130352, 'constant_value': 78756.14023998208, 'nu': 0.5}. Best is trial 386 with value: 0.4872991004520934.
[I 2024-12-04 15:03:58,585] Trial 928 finished with value: 1.2401112322977803 and parameters: {'kernel_type': 'Matern', 'length_scale': 854.6734858321408, 'noise_level': 0.012514756195808519, 'constant_value': 2781.8930482477654, 'nu': 2.5}. Best is trial 386 with value: 0.4872991004520934.
[I 2024-12-04 15:03:59,044] Trial 933 finished with value: 0.4883034167042119 and parameters: {'kernel_type': 'Matern', 'length_scale': 4180.102558499376, 'noise_level': 0.020974419590640784, 'constant_value': 782.3823203539675, 'nu': 0.5}. Best is trial 386 with value: 0.4872991004520934.
[I 2024-12-04 15:03:59,413] Trial 918 finished with value: 1.240111233010061 and parameters: {'kernel_type': 'Matern', 'length_scale': 4.1577058589640665e-05, 'noise_level': 8.28428547690566e-07, 'constant_value': 0.029889123385380294, 'nu': 2.5}. Best is trial 386 with value: 0.4872991004520934.
[I 2024-12-04 15:04:00,306] Trial 927 finished with value: 1.2614547773006866 and parameters: {'kernel_type': 'Matern', 'length_scale': 3.240467485342928, 'noise_level': 7.40263673945297e-05, 'constant_value': 71976.86543143727, 'nu': 0.5}. Best is trial 386 with value: 0.4872991004520934.
[I 2024-12-04 15:04:00,541] Trial 929 finished with value: 0.4883037116832137 and parameters: {'kernel_type': 'Matern', 'length_scale': 86605.08453397376, 'noise_level': 0.8401676541573456, 'constant_value': 31782.375383834595, 'nu': 0.5}. Best is trial 386 with value: 0.4872991004520934.
[I 2024-12-04 15:04:00,612] Trial 936 finished with value: 0.4883034157379461 and parameters: {'kernel_type': 'Matern', 'length_scale': 731.4835148206707, 'noise_level': 0.00710266924472684, 'constant_value': 76064.74351270725, 'nu': 0.5}. Best is trial 386 with value: 0.4872991004520934.
[I 2024-12-04 15:04:01,114] Trial 922 finished with value: 0.4883036493044321 and parameters: {'kernel_type': 'Matern', 'length_scale': 1148.7165866001103, 'noise_level': 0.016493304462711012, 'constant_value': 74777.06349723409, 'nu': 0.5}. Best is trial 386 with value: 0.4872991004520934.
[I 2024-12-04 15:04:01,313] Trial 924 finished with value: 1.2401112325845285 and parameters: {'kernel_type': 'Matern', 'length_scale': 0.00011593976553691491, 'noise_level': 1.2882497164117957e-09, 'constant_value': 0.005096509927005413, 'nu': 2.5}. Best is trial 386 with value: 0.4872991004520934.
[I 2024-12-04 15:04:01,897] Trial 932 finished with value: 1.2614543702020935 and parameters: {'kernel_type': 'RBF', 'length_scale': 7.014485160668011e-05, 'noise_level': 0.00015489361477260698, 'constant_value': 26209.389214616993, 'nu': 2.5}. Best is trial 386 with value: 0.4872991004520934.
[I 2024-12-04 15:04:02,355] Trial 943 finished with value: 1.2401112349317214 and parameters: {'kernel_type': 'Matern', 'length_scale': 0.00123090098616967, 'noise_level': 0.005694456205677461, 'constant_value': 0.7494881774462309, 'nu': 0.5}. Best is trial 386 with value: 0.4872991004520934.
[I 2024-12-04 15:04:03,642] Trial 934 finished with value: 0.4883037323134368 and parameters: {'kernel_type': 'Matern', 'length_scale': 12.971957550345019, 'noise_level': 0.8298903783535304, 'constant_value': 238.75508408252003, 'nu': 0.5}. Best is trial 386 with value: 0.4872991004520934.
[I 2024-12-04 15:04:03,930] Trial 937 finished with value: 0.48830198051405316 and parameters: {'kernel_type': 'Matern', 'length_scale': 323.9325640176979, 'noise_level': 0.929978590507703, 'constant_value': 409.9139443755178, 'nu': 0.5}. Best is trial 386 with value: 0.4872991004520934.
[I 2024-12-04 15:04:05,123] Trial 926 finished with value: 0.48830341990509757 and parameters: {'kernel_type': 'Matern', 'length_scale': 29065.395749178384, 'noise_level': 0.9123822968538796, 'constant_value': 1842.1942837820989, 'nu': 0.5}. Best is trial 386 with value: 0.4872991004520934.
[I 2024-12-04 15:04:06,332] Trial 939 finished with value: 0.48830330247471093 and parameters: {'kernel_type': 'Matern', 'length_scale': 559.7690749714452, 'noise_level': 0.03740764269889424, 'constant_value': 8.667314544642831, 'nu': 0.5}. Best is trial 386 with value: 0.4872991004520934.
[I 2024-12-04 15:04:06,484] Trial 930 finished with value: 1.2614547953941473 and parameters: {'kernel_type': 'Matern', 'length_scale': 24.3795490327868, 'noise_level': 0.019909842368799852, 'constant_value': 4030.7583496467378, 'nu': 0.5}. Best is trial 386 with value: 0.4872991004520934.
[I 2024-12-04 15:04:06,496] Trial 945 finished with value: 1.2614547976350254 and parameters: {'kernel_type': 'Matern', 'length_scale': 4.7541390635771466, 'noise_level': 1.6136748942941152e-05, 'constant_value': 12015.95707818063, 'nu': 2.5}. Best is trial 386 with value: 0.4872991004520934.
[I 2024-12-04 15:04:07,107] Trial 935 finished with value: 0.48830340070609735 and parameters: {'kernel_type': 'Matern', 'length_scale': 11.98777087548743, 'noise_level': 0.4321877103877839, 'constant_value': 6.3079627171238295, 'nu': 0.5}. Best is trial 386 with value: 0.4872991004520934.
[I 2024-12-04 15:04:07,228] Trial 940 finished with value: 1.240111232580505 and parameters: {'kernel_type': 'Matern', 'length_scale': 272.9302756028569, 'noise_level': 6.082941299417265e-07, 'constant_value': 0.0011016225743442896, 'nu': 2.5}. Best is trial 386 with value: 0.4872991004520934.
[I 2024-12-04 15:04:07,299] Trial 931 finished with value: 0.48830342109159697 and parameters: {'kernel_type': 'Matern', 'length_scale': 77269.39183299037, 'noise_level': 0.7081203851250325, 'constant_value': 15.701940648713988, 'nu': 0.5}. Best is trial 386 with value: 0.4872991004520934.
[I 2024-12-04 15:04:07,635] Trial 941 finished with value: 0.4883032559498857 and parameters: {'kernel_type': 'Matern', 'length_scale': 43.882248404870126, 'noise_level': 0.03257189439672195, 'constant_value': 6.8718671694875075, 'nu': 0.5}. Best is trial 386 with value: 0.4872991004520934.
[I 2024-12-04 15:04:09,472] Trial 946 finished with value: 1.2614547960906448 and parameters: {'kernel_type': 'Matern', 'length_scale': 274.9651797177629, 'noise_level': 0.212091546995463, 'constant_value': 0.004529927141199496, 'nu': 2.5}. Best is trial 386 with value: 0.4872991004520934.
[I 2024-12-04 15:04:10,232] Trial 942 finished with value: 1.2401112326971582 and parameters: {'kernel_type': 'Matern', 'length_scale': 1896.283635863543, 'noise_level': 0.0252279710473979, 'constant_value': 1.4278760425799963, 'nu': 0.5}. Best is trial 386 with value: 0.4872991004520934.
[I 2024-12-04 15:04:10,730] Trial 947 finished with value: 0.4883034062868536 and parameters: {'kernel_type': 'Matern', 'length_scale': 114.80192679231239, 'noise_level': 0.2856714847832605, 'constant_value': 55.63154737604382, 'nu': 0.5}. Best is trial 386 with value: 0.4872991004520934.
[I 2024-12-04 15:04:10,830] Trial 938 finished with value: 1.2401112326805173 and parameters: {'kernel_type': 'RBF', 'length_scale': 0.0002282227806116738, 'noise_level': 4.6219051119955507e-10, 'constant_value': 0.00834383310959578, 'nu': 0.5}. Best is trial 386 with value: 0.4872991004520934.
[I 2024-12-04 15:04:11,020] Trial 948 finished with value: 1.240111232568484 and parameters: {'kernel_type': 'RBF', 'length_scale': 3.963351227353082, 'noise_level': 1.4752105848739225e-05, 'constant_value': 0.00023609353607418246, 'nu': 2.5}. Best is trial 386 with value: 0.4872991004520934.
[I 2024-12-04 15:04:11,069] Trial 949 finished with value: 0.4883033123579557 and parameters: {'kernel_type': 'Matern', 'length_scale': 939.9535391275939, 'noise_level': 0.4771532532099813, 'constant_value': 186.10682421000791, 'nu': 0.5}. Best is trial 386 with value: 0.4872991004520934.
[I 2024-12-04 15:04:14,162] Trial 944 finished with value: 0.4883035321196077 and parameters: {'kernel_type': 'Matern', 'length_scale': 62314.664000938326, 'noise_level': 0.04387262985539359, 'constant_value': 1269.4612452586468, 'nu': 0.5}. Best is trial 386 with value: 0.4872991004520934.
[I 2024-12-04 15:04:14,948] Trial 955 finished with value: 0.4883034191035895 and parameters: {'kernel_type': 'Matern', 'length_scale': 30.383802680529875, 'noise_level': 0.011499659310038803, 'constant_value': 226.98762976448006, 'nu': 0.5}. Best is trial 386 with value: 0.4872991004520934.
[I 2024-12-04 15:04:15,322] Trial 958 finished with value: 0.4883033633661377 and parameters: {'kernel_type': 'Matern', 'length_scale': 2202.9133743678285, 'noise_level': 0.003245375047324133, 'constant_value': 1273.3125069169673, 'nu': 0.5}. Best is trial 386 with value: 0.4872991004520934.
[I 2024-12-04 15:04:15,661] Trial 950 finished with value: 0.4883034145809333 and parameters: {'kernel_type': 'Matern', 'length_scale': 6092.5425724825, 'noise_level': 0.010308581107772536, 'constant_value': 4358.228219116572, 'nu': 0.5}. Best is trial 386 with value: 0.4872991004520934.
[I 2024-12-04 15:04:17,210] Trial 952 finished with value: 0.4883034149635447 and parameters: {'kernel_type': 'Matern', 'length_scale': 73789.7026696228, 'noise_level': 0.9324707957468354, 'constant_value': 12473.176402791734, 'nu': 0.5}. Best is trial 386 with value: 0.4872991004520934.
[I 2024-12-04 15:04:17,681] Trial 962 finished with value: 0.4883034071251529 and parameters: {'kernel_type': 'Matern', 'length_scale': 8116.948894578008, 'noise_level': 0.8605092328988184, 'constant_value': 378.50501365796566, 'nu': 0.5}. Best is trial 386 with value: 0.4872991004520934.
[I 2024-12-04 15:04:17,954] Trial 954 finished with value: 0.48830410301193594 and parameters: {'kernel_type': 'Matern', 'length_scale': 94.27687394062669, 'noise_level': 0.5401420525784333, 'constant_value': 7.853689142124863, 'nu': 0.5}. Best is trial 386 with value: 0.4872991004520934.
[I 2024-12-04 15:04:18,168] Trial 959 finished with value: 0.48830342109594393 and parameters: {'kernel_type': 'Matern', 'length_scale': 581.7850807649113, 'noise_level': 0.03400219031501161, 'constant_value': 14.520576515914886, 'nu': 0.5}. Best is trial 386 with value: 0.4872991004520934.
[I 2024-12-04 15:04:18,171] Trial 957 finished with value: 1.2401112326742691 and parameters: {'kernel_type': 'Matern', 'length_scale': 96747.72791880759, 'noise_level': 0.018605425355799152, 'constant_value': 151.3339116532257, 'nu': 0.5}. Best is trial 386 with value: 0.4872991004520934.
[I 2024-12-04 15:04:20,399] Trial 956 finished with value: 0.48830341753949474 and parameters: {'kernel_type': 'Matern', 'length_scale': 502.18260408090214, 'noise_level': 0.023351986954912918, 'constant_value': 136.60806952624935, 'nu': 0.5}. Best is trial 386 with value: 0.4872991004520934.
[I 2024-12-04 15:04:20,889] Trial 960 finished with value: 1.2401112325647232 and parameters: {'kernel_type': 'Matern', 'length_scale': 0.003665831747291053, 'noise_level': 0.06280692090631364, 'constant_value': 13.521306083100859, 'nu': 2.5}. Best is trial 386 with value: 0.4872991004520934.
[I 2024-12-04 15:04:21,036] Trial 967 finished with value: 0.48830341935624966 and parameters: {'kernel_type': 'Matern', 'length_scale': 647.3564835784154, 'noise_level': 0.02164945087927351, 'constant_value': 1025.0176143382694, 'nu': 0.5}. Best is trial 386 with value: 0.4872991004520934.
[I 2024-12-04 15:04:21,256] Trial 964 finished with value: 0.488303414660258 and parameters: {'kernel_type': 'Matern', 'length_scale': 2178.3866409468424, 'noise_level': 0.9620261823234457, 'constant_value': 34528.830347840914, 'nu': 0.5}. Best is trial 386 with value: 0.4872991004520934.
[I 2024-12-04 15:04:22,299] Trial 969 finished with value: 0.4883034382759559 and parameters: {'kernel_type': 'Matern', 'length_scale': 33.485823802196016, 'noise_level': 0.6377473406499753, 'constant_value': 1566.3066813125554, 'nu': 0.5}. Best is trial 386 with value: 0.4872991004520934.
[I 2024-12-04 15:04:22,773] Trial 974 finished with value: 0.4883034194533004 and parameters: {'kernel_type': 'Matern', 'length_scale': 94458.7308873146, 'noise_level': 0.07322697143962882, 'constant_value': 29247.154685730682, 'nu': 0.5}. Best is trial 386 with value: 0.4872991004520934.
[I 2024-12-04 15:04:22,942] Trial 953 finished with value: 0.48830342438997426 and parameters: {'kernel_type': 'Matern', 'length_scale': 8697.373520414925, 'noise_level': 0.01768774461321251, 'constant_value': 74241.93110984478, 'nu': 0.5}. Best is trial 386 with value: 0.4872991004520934.
[I 2024-12-04 15:04:23,569] Trial 951 finished with value: 1.2401112334009325 and parameters: {'kernel_type': 'Matern', 'length_scale': 0.015313509115451332, 'noise_level': 1.5869879727040526e-05, 'constant_value': 0.0002519389678714114, 'nu': 0.5}. Best is trial 386 with value: 0.4872991004520934.
[I 2024-12-04 15:04:25,783] Trial 963 finished with value: 1.2401112330325608 and parameters: {'kernel_type': 'RBF', 'length_scale': 3897.796528814093, 'noise_level': 5.245936928623758e-05, 'constant_value': 2.4592378230080303e-07, 'nu': 1.5}. Best is trial 386 with value: 0.4872991004520934.
[I 2024-12-04 15:04:26,357] Trial 976 finished with value: 1.2614547976352095 and parameters: {'kernel_type': 'RBF', 'length_scale': 77235.93404360245, 'noise_level': 0.5000136012878147, 'constant_value': 1748.5955289190242, 'nu': 0.5}. Best is trial 386 with value: 0.4872991004520934.
[I 2024-12-04 15:04:26,371] Trial 973 finished with value: 0.48830342239726554 and parameters: {'kernel_type': 'Matern', 'length_scale': 43.02528197997803, 'noise_level': 0.003992014623001596, 'constant_value': 1863.3264443908524, 'nu': 0.5}. Best is trial 386 with value: 0.4872991004520934.
[I 2024-12-04 15:04:26,701] Trial 961 finished with value: 0.48830337850726674 and parameters: {'kernel_type': 'Matern', 'length_scale': 679.6606032227679, 'noise_level': 0.8203269141317192, 'constant_value': 7.131744699232393, 'nu': 0.5}. Best is trial 386 with value: 0.4872991004520934.
[I 2024-12-04 15:04:27,653] Trial 971 finished with value: 0.4883036308187221 and parameters: {'kernel_type': 'Matern', 'length_scale': 1132.4207075351633, 'noise_level': 0.6296070588019557, 'constant_value': 50.073703652072695, 'nu': 0.5}. Best is trial 386 with value: 0.4872991004520934.
[I 2024-12-04 15:04:28,045] Trial 979 finished with value: 0.488303426156137 and parameters: {'kernel_type': 'Matern', 'length_scale': 25.05280966941308, 'noise_level': 0.8273242764199346, 'constant_value': 2715.5706048697057, 'nu': 0.5}. Best is trial 386 with value: 0.4872991004520934.
[I 2024-12-04 15:04:28,049] Trial 972 finished with value: 0.4883034129609792 and parameters: {'kernel_type': 'Matern', 'length_scale': 55.435829393468396, 'noise_level': 0.013163554499110868, 'constant_value': 3100.7448728257, 'nu': 0.5}. Best is trial 386 with value: 0.4872991004520934.
[I 2024-12-04 15:04:28,521] Trial 966 finished with value: 0.488303418871829 and parameters: {'kernel_type': 'Matern', 'length_scale': 25032.61312042131, 'noise_level': 0.005447080595523245, 'constant_value': 2131.550100159219, 'nu': 0.5}. Best is trial 386 with value: 0.4872991004520934.
[I 2024-12-04 15:04:28,949] Trial 980 finished with value: 1.2614547942038756 and parameters: {'kernel_type': 'Matern', 'length_scale': 1067.5905762694433, 'noise_level': 0.00012042139646585279, 'constant_value': 21030.4572786943, 'nu': 0.5}. Best is trial 386 with value: 0.4872991004520934.
