[I 2024-12-04 14:53:59,475] Trial 538 finished with value: 0.6379440084659044 and parameters: {'n_estimators': 914, 'learning_rate': 0.03708574663224422, 'max_depth': 12, 'min_samples_split': 20, 'min_samples_leaf': 3, 'subsample': 0.8841422284549344, 'max_features': None}. Best is trial 419 with value: 0.4620957934013452.
[I 2024-12-04 14:53:59,477] Trial 547 finished with value: 1.0719392048562169 and parameters: {'n_estimators': 554, 'learning_rate': 0.015343246591665818, 'max_depth': 3, 'min_samples_split': 11, 'min_samples_leaf': 10, 'subsample': 0.9773464014470665, 'max_features': 'log2'}. Best is trial 419 with value: 0.4620957934013452.
[I 2024-12-04 14:53:59,815] Trial 516 finished with value: 0.640394578983726 and parameters: {'n_estimators': 1494, 'learning_rate': 0.03767850331943172, 'max_depth': 10, 'min_samples_split': 20, 'min_samples_leaf': 2, 'subsample': 0.892587215453216, 'max_features': None}. Best is trial 419 with value: 0.4620957934013452.
[I 2024-12-04 14:54:01,085] Trial 543 finished with value: 0.7053446989881039 and parameters: {'n_estimators': 714, 'learning_rate': 0.07917250698746167, 'max_depth': 12, 'min_samples_split': 4, 'min_samples_leaf': 2, 'subsample': 0.7290210363777686, 'max_features': None}. Best is trial 419 with value: 0.4620957934013452.
[I 2024-12-04 14:54:01,422] Trial 542 finished with value: 0.47106897296543476 and parameters: {'n_estimators': 737, 'learning_rate': 0.06733952903682923, 'max_depth': 12, 'min_samples_split': 20, 'min_samples_leaf': 1, 'subsample': 0.9567941937034239, 'max_features': None}. Best is trial 419 with value: 0.4620957934013452.
[I 2024-12-04 14:54:03,275] Trial 544 finished with value: 0.823309349422376 and parameters: {'n_estimators': 911, 'learning_rate': 0.07069533858336728, 'max_depth': 4, 'min_samples_split': 13, 'min_samples_leaf': 10, 'subsample': 0.9177058863740046, 'max_features': 'log2'}. Best is trial 419 with value: 0.4620957934013452.
[I 2024-12-04 14:54:03,804] Trial 554 finished with value: 1.0813853874426311 and parameters: {'n_estimators': 513, 'learning_rate': 0.01578761784036287, 'max_depth': 7, 'min_samples_split': 9, 'min_samples_leaf': 8, 'subsample': 0.834369062322908, 'max_features': 'log2'}. Best is trial 419 with value: 0.4620957934013452.
[I 2024-12-04 14:54:06,364] Trial 541 finished with value: 0.5944630300585673 and parameters: {'n_estimators': 976, 'learning_rate': 0.03950529033053819, 'max_depth': 12, 'min_samples_split': 20, 'min_samples_leaf': 2, 'subsample': 0.928962592692891, 'max_features': None}. Best is trial 419 with value: 0.4620957934013452.
[I 2024-12-04 14:54:09,664] Trial 553 finished with value: 0.4793771077816836 and parameters: {'n_estimators': 664, 'learning_rate': 0.04297978064644215, 'max_depth': 12, 'min_samples_split': 20, 'min_samples_leaf': 1, 'subsample': 0.9345056966311318, 'max_features': None}. Best is trial 419 with value: 0.4620957934013452.
[I 2024-12-04 14:54:11,019] Trial 536 finished with value: 0.4806804724073878 and parameters: {'n_estimators': 1345, 'learning_rate': 0.02831402577599167, 'max_depth': 12, 'min_samples_split': 19, 'min_samples_leaf': 1, 'subsample': 0.8567495178328411, 'max_features': None}. Best is trial 419 with value: 0.4620957934013452.
[I 2024-12-04 14:54:11,077] Trial 533 finished with value: 0.49969583029677767 and parameters: {'n_estimators': 1441, 'learning_rate': 0.019582534947551102, 'max_depth': 12, 'min_samples_split': 15, 'min_samples_leaf': 1, 'subsample': 0.8490839031814781, 'max_features': None}. Best is trial 419 with value: 0.4620957934013452.
[I 2024-12-04 14:54:11,456] Trial 551 finished with value: 0.5127022173451301 and parameters: {'n_estimators': 763, 'learning_rate': 0.09959899754340987, 'max_depth': 11, 'min_samples_split': 17, 'min_samples_leaf': 1, 'subsample': 0.9915038468971156, 'max_features': None}. Best is trial 419 with value: 0.4620957934013452.
[I 2024-12-04 14:54:14,426] Trial 535 finished with value: 0.6525950003684793 and parameters: {'n_estimators': 1454, 'learning_rate': 0.016911577766528362, 'max_depth': 12, 'min_samples_split': 16, 'min_samples_leaf': 4, 'subsample': 0.9924465300781783, 'max_features': None}. Best is trial 419 with value: 0.4620957934013452.
[I 2024-12-04 14:54:17,366] Trial 552 finished with value: 0.5009178241970529 and parameters: {'n_estimators': 940, 'learning_rate': 0.06768824303835612, 'max_depth': 11, 'min_samples_split': 19, 'min_samples_leaf': 1, 'subsample': 0.8803044357249494, 'max_features': None}. Best is trial 419 with value: 0.4620957934013452.
[I 2024-12-04 14:54:17,975] Trial 558 finished with value: 0.47672855303400463 and parameters: {'n_estimators': 760, 'learning_rate': 0.06482540711995328, 'max_depth': 12, 'min_samples_split': 20, 'min_samples_leaf': 1, 'subsample': 0.9689289892581865, 'max_features': None}. Best is trial 419 with value: 0.4620957934013452.
[I 2024-12-04 14:54:18,295] Trial 562 finished with value: 0.8120501373740734 and parameters: {'n_estimators': 755, 'learning_rate': 0.020652856234189595, 'max_depth': 9, 'min_samples_split': 7, 'min_samples_leaf': 4, 'subsample': 0.9528574256795114, 'max_features': 'log2'}. Best is trial 419 with value: 0.4620957934013452.
[I 2024-12-04 14:54:19,107] Trial 548 finished with value: 0.6833363964090721 and parameters: {'n_estimators': 1242, 'learning_rate': 0.07556730098091753, 'max_depth': 10, 'min_samples_split': 17, 'min_samples_leaf': 3, 'subsample': 0.8598610176373404, 'max_features': 'sqrt'}. Best is trial 419 with value: 0.4620957934013452.
[I 2024-12-04 14:54:19,560] Trial 559 finished with value: 0.6222923553683378 and parameters: {'n_estimators': 806, 'learning_rate': 0.06496915805558828, 'max_depth': 12, 'min_samples_split': 20, 'min_samples_leaf': 4, 'subsample': 0.9850800485439264, 'max_features': None}. Best is trial 419 with value: 0.4620957934013452.
[I 2024-12-04 14:54:19,848] Trial 546 finished with value: 0.6684299461530114 and parameters: {'n_estimators': 1471, 'learning_rate': 0.09336639971782262, 'max_depth': 12, 'min_samples_split': 6, 'min_samples_leaf': 3, 'subsample': 0.7898580346309473, 'max_features': 'log2'}. Best is trial 419 with value: 0.4620957934013452.
[I 2024-12-04 14:54:20,403] Trial 556 finished with value: 0.5706462000447666 and parameters: {'n_estimators': 974, 'learning_rate': 0.06006286718048798, 'max_depth': 5, 'min_samples_split': 15, 'min_samples_leaf': 5, 'subsample': 0.6674078135870163, 'max_features': None}. Best is trial 419 with value: 0.4620957934013452.
[I 2024-12-04 14:54:20,411] Trial 564 finished with value: 0.632270523769136 and parameters: {'n_estimators': 738, 'learning_rate': 0.04137072630579982, 'max_depth': 6, 'min_samples_split': 19, 'min_samples_leaf': 3, 'subsample': 0.6573420384174791, 'max_features': 'sqrt'}. Best is trial 419 with value: 0.4620957934013452.
[I 2024-12-04 14:54:20,932] Trial 550 finished with value: 0.6900304830087649 and parameters: {'n_estimators': 1225, 'learning_rate': 0.03818790470514929, 'max_depth': 6, 'min_samples_split': 8, 'min_samples_leaf': 2, 'subsample': 0.9382146084049522, 'max_features': 'log2'}. Best is trial 419 with value: 0.4620957934013452.
[I 2024-12-04 14:54:23,666] Trial 561 finished with value: 0.6187720147135741 and parameters: {'n_estimators': 815, 'learning_rate': 0.06980874896932535, 'max_depth': 12, 'min_samples_split': 20, 'min_samples_leaf': 2, 'subsample': 0.9049868724370083, 'max_features': None}. Best is trial 419 with value: 0.4620957934013452.
[I 2024-12-04 14:54:24,131] Trial 549 finished with value: 0.6297352579589766 and parameters: {'n_estimators': 1395, 'learning_rate': 0.012208330501058635, 'max_depth': 8, 'min_samples_split': 14, 'min_samples_leaf': 1, 'subsample': 0.6109030287638869, 'max_features': 'log2'}. Best is trial 419 with value: 0.4620957934013452.
[I 2024-12-04 14:54:25,273] Trial 555 finished with value: 0.5139623177521327 and parameters: {'n_estimators': 1027, 'learning_rate': 0.027809867079603805, 'max_depth': 12, 'min_samples_split': 14, 'min_samples_leaf': 1, 'subsample': 0.8064563581124367, 'max_features': None}. Best is trial 419 with value: 0.4620957934013452.
[I 2024-12-04 14:54:25,755] Trial 565 finished with value: 0.5020385438198358 and parameters: {'n_estimators': 773, 'learning_rate': 0.04992082863958456, 'max_depth': 11, 'min_samples_split': 19, 'min_samples_leaf': 1, 'subsample': 0.8548197685460489, 'max_features': None}. Best is trial 419 with value: 0.4620957934013452.
[I 2024-12-04 14:54:28,230] Trial 567 finished with value: 0.48022533959324454 and parameters: {'n_estimators': 749, 'learning_rate': 0.07930635230604863, 'max_depth': 12, 'min_samples_split': 17, 'min_samples_leaf': 1, 'subsample': 0.9929779917245967, 'max_features': None}. Best is trial 419 with value: 0.4620957934013452.
[I 2024-12-04 14:54:30,110] Trial 560 finished with value: 0.47976729497167975 and parameters: {'n_estimators': 1005, 'learning_rate': 0.05404875240572109, 'max_depth': 12, 'min_samples_split': 17, 'min_samples_leaf': 1, 'subsample': 0.9410630836412307, 'max_features': None}. Best is trial 419 with value: 0.4620957934013452.
[I 2024-12-04 14:54:30,554] Trial 590 finished with value: 0.5698960582117083 and parameters: {'n_estimators': 106, 'learning_rate': 0.04831156723443737, 'max_depth': 11, 'min_samples_split': 7, 'min_samples_leaf': 1, 'subsample': 0.6761009198653594, 'max_features': 'sqrt'}. Best is trial 419 with value: 0.4620957934013452.
[I 2024-12-04 14:54:31,330] Trial 557 finished with value: 0.47402203049451275 and parameters: {'n_estimators': 1191, 'learning_rate': 0.033589818521829976, 'max_depth': 12, 'min_samples_split': 20, 'min_samples_leaf': 1, 'subsample': 0.8968406741087918, 'max_features': None}. Best is trial 419 with value: 0.4620957934013452.
[I 2024-12-04 14:54:32,575] Trial 580 finished with value: 0.4965276888606392 and parameters: {'n_estimators': 535, 'learning_rate': 0.0335209354398426, 'max_depth': 12, 'min_samples_split': 20, 'min_samples_leaf': 1, 'subsample': 0.9676002327281652, 'max_features': None}. Best is trial 419 with value: 0.4620957934013452.
[I 2024-12-04 14:54:32,929] Trial 591 finished with value: 1.2319387297004063 and parameters: {'n_estimators': 141, 'learning_rate': 0.011408145644465822, 'max_depth': 11, 'min_samples_split': 20, 'min_samples_leaf': 6, 'subsample': 0.6417857069853318, 'max_features': 'log2'}. Best is trial 419 with value: 0.4620957934013452.
[I 2024-12-04 14:54:34,575] Trial 572 finished with value: 0.4896629231557638 and parameters: {'n_estimators': 747, 'learning_rate': 0.05814357817207115, 'max_depth': 12, 'min_samples_split': 19, 'min_samples_leaf': 1, 'subsample': 0.8894204388842512, 'max_features': None}. Best is trial 419 with value: 0.4620957934013452.
[I 2024-12-04 14:54:34,623] Trial 569 finished with value: 0.8800655870221962 and parameters: {'n_estimators': 1002, 'learning_rate': 0.010391122374947551, 'max_depth': 4, 'min_samples_split': 14, 'min_samples_leaf': 8, 'subsample': 0.604986343444998, 'max_features': 'sqrt'}. Best is trial 419 with value: 0.4620957934013452.
[I 2024-12-04 14:54:35,683] Trial 571 finished with value: 0.4758585701918264 and parameters: {'n_estimators': 890, 'learning_rate': 0.051480235696271005, 'max_depth': 12, 'min_samples_split': 20, 'min_samples_leaf': 1, 'subsample': 0.9219474405955432, 'max_features': None}. Best is trial 419 with value: 0.4620957934013452.
[I 2024-12-04 14:54:36,718] Trial 576 finished with value: 0.6253233302153707 and parameters: {'n_estimators': 794, 'learning_rate': 0.09367506897912932, 'max_depth': 12, 'min_samples_split': 20, 'min_samples_leaf': 2, 'subsample': 0.9356730247221058, 'max_features': None}. Best is trial 419 with value: 0.4620957934013452.
[I 2024-12-04 14:54:36,723] Trial 568 finished with value: 0.48581546783769874 and parameters: {'n_estimators': 1023, 'learning_rate': 0.04016039111893402, 'max_depth': 12, 'min_samples_split': 20, 'min_samples_leaf': 1, 'subsample': 0.9515088587368766, 'max_features': None}. Best is trial 419 with value: 0.4620957934013452.
[I 2024-12-04 14:54:38,086] Trial 592 finished with value: 0.767512559892758 and parameters: {'n_estimators': 276, 'learning_rate': 0.04392065382140145, 'max_depth': 12, 'min_samples_split': 14, 'min_samples_leaf': 8, 'subsample': 0.6868137525099876, 'max_features': 'sqrt'}. Best is trial 419 with value: 0.4620957934013452.
[I 2024-12-04 14:54:38,716] Trial 575 finished with value: 0.5060877720792574 and parameters: {'n_estimators': 871, 'learning_rate': 0.0780717476002351, 'max_depth': 12, 'min_samples_split': 19, 'min_samples_leaf': 1, 'subsample': 0.906689777911501, 'max_features': None}. Best is trial 419 with value: 0.4620957934013452.
[I 2024-12-04 14:54:39,990] Trial 579 finished with value: 0.6871787410262199 and parameters: {'n_estimators': 880, 'learning_rate': 0.08459456846740196, 'max_depth': 12, 'min_samples_split': 20, 'min_samples_leaf': 3, 'subsample': 0.9902058657700713, 'max_features': 'sqrt'}. Best is trial 419 with value: 0.4620957934013452.
[I 2024-12-04 14:54:40,360] Trial 573 finished with value: 0.8800947886111355 and parameters: {'n_estimators': 1128, 'learning_rate': 0.016862130146245248, 'max_depth': 7, 'min_samples_split': 9, 'min_samples_leaf': 7, 'subsample': 0.8536958349461582, 'max_features': 'log2'}. Best is trial 419 with value: 0.4620957934013452.
[I 2024-12-04 14:54:40,361] Trial 566 finished with value: 0.8124938223202269 and parameters: {'n_estimators': 1177, 'learning_rate': 0.07081070646992633, 'max_depth': 5, 'min_samples_split': 20, 'min_samples_leaf': 8, 'subsample': 0.6190426653532997, 'max_features': 'log2'}. Best is trial 419 with value: 0.4620957934013452.
[I 2024-12-04 14:54:42,655] Trial 582 finished with value: 0.6097658952897784 and parameters: {'n_estimators': 662, 'learning_rate': 0.03592307933499495, 'max_depth': 12, 'min_samples_split': 15, 'min_samples_leaf': 2, 'subsample': 0.9242969027102274, 'max_features': None}. Best is trial 419 with value: 0.4620957934013452.
[I 2024-12-04 14:54:42,895] Trial 570 finished with value: 0.48485347238285675 and parameters: {'n_estimators': 1109, 'learning_rate': 0.0709489860523922, 'max_depth': 12, 'min_samples_split': 20, 'min_samples_leaf': 1, 'subsample': 0.8848197541161966, 'max_features': None}. Best is trial 419 with value: 0.4620957934013452.
[I 2024-12-04 14:54:43,729] Trial 586 finished with value: 0.6718538803502413 and parameters: {'n_estimators': 670, 'learning_rate': 0.04480678837619089, 'max_depth': 11, 'min_samples_split': 20, 'min_samples_leaf': 2, 'subsample': 0.8475032798239011, 'max_features': 'log2'}. Best is trial 419 with value: 0.4620957934013452.
[I 2024-12-04 14:54:45,813] Trial 583 finished with value: 0.48394879635411103 and parameters: {'n_estimators': 703, 'learning_rate': 0.05088871785597387, 'max_depth': 12, 'min_samples_split': 18, 'min_samples_leaf': 1, 'subsample': 0.8976521858976773, 'max_features': None}. Best is trial 419 with value: 0.4620957934013452.
[I 2024-12-04 14:54:46,651] Trial 599 finished with value: 0.7033384433179855 and parameters: {'n_estimators': 274, 'learning_rate': 0.014373607604310615, 'max_depth': 6, 'min_samples_split': 9, 'min_samples_leaf': 10, 'subsample': 0.6109230624529727, 'max_features': None}. Best is trial 419 with value: 0.4620957934013452.
[I 2024-12-04 14:54:46,653] Trial 602 finished with value: 0.7003806207223829 and parameters: {'n_estimators': 180, 'learning_rate': 0.024562507110830988, 'max_depth': 10, 'min_samples_split': 13, 'min_samples_leaf': 10, 'subsample': 0.7165109072997726, 'max_features': None}. Best is trial 419 with value: 0.4620957934013452.
[I 2024-12-04 14:54:47,230] Trial 563 finished with value: 0.4858377350201664 and parameters: {'n_estimators': 1467, 'learning_rate': 0.023273626623236978, 'max_depth': 10, 'min_samples_split': 20, 'min_samples_leaf': 1, 'subsample': 0.8982441349635846, 'max_features': None}. Best is trial 419 with value: 0.4620957934013452.
[I 2024-12-04 14:54:48,720] Trial 574 finished with value: 0.6990309413760065 and parameters: {'n_estimators': 1289, 'learning_rate': 0.08710404888958578, 'max_depth': 4, 'min_samples_split': 7, 'min_samples_leaf': 7, 'subsample': 0.746411867537768, 'max_features': None}. Best is trial 419 with value: 0.4620957934013452.
[I 2024-12-04 14:54:49,147] Trial 577 finished with value: 0.6470243885885093 and parameters: {'n_estimators': 1410, 'learning_rate': 0.09269954898389957, 'max_depth': 4, 'min_samples_split': 7, 'min_samples_leaf': 6, 'subsample': 0.9723894388417142, 'max_features': 'sqrt'}. Best is trial 419 with value: 0.4620957934013452.
[I 2024-12-04 14:54:49,758] Trial 593 finished with value: 0.6513210732231132 and parameters: {'n_estimators': 689, 'learning_rate': 0.045370861987857745, 'max_depth': 12, 'min_samples_split': 20, 'min_samples_leaf': 2, 'subsample': 0.8803837918220195, 'max_features': 'sqrt'}. Best is trial 419 with value: 0.4620957934013452.
[I 2024-12-04 14:54:49,951] Trial 578 finished with value: 0.5466871660427923 and parameters: {'n_estimators': 1323, 'learning_rate': 0.04548483161990629, 'max_depth': 11, 'min_samples_split': 20, 'min_samples_leaf': 1, 'subsample': 0.9392775768366319, 'max_features': 'sqrt'}. Best is trial 419 with value: 0.4620957934013452.
[I 2024-12-04 14:54:51,153] Trial 595 finished with value: 0.4845610287613178 and parameters: {'n_estimators': 596, 'learning_rate': 0.07726530237028663, 'max_depth': 12, 'min_samples_split': 20, 'min_samples_leaf': 1, 'subsample': 0.9009554529676413, 'max_features': None}. Best is trial 419 with value: 0.4620957934013452.
[I 2024-12-04 14:54:51,158] Trial 589 finished with value: 0.4799538125902812 and parameters: {'n_estimators': 773, 'learning_rate': 0.06350195500013915, 'max_depth': 12, 'min_samples_split': 18, 'min_samples_leaf': 1, 'subsample': 0.9878683375511453, 'max_features': None}. Best is trial 419 with value: 0.4620957934013452.
[I 2024-12-04 14:54:51,497] Trial 588 finished with value: 0.49384237345825 and parameters: {'n_estimators': 777, 'learning_rate': 0.0408884374011236, 'max_depth': 12, 'min_samples_split': 19, 'min_samples_leaf': 1, 'subsample': 0.9084347207219265, 'max_features': None}. Best is trial 419 with value: 0.4620957934013452.
[I 2024-12-04 14:54:51,690] Trial 585 finished with value: 0.4958870690703765 and parameters: {'n_estimators': 916, 'learning_rate': 0.050013312169095596, 'max_depth': 12, 'min_samples_split': 17, 'min_samples_leaf': 1, 'subsample': 0.9120498723651853, 'max_features': None}. Best is trial 419 with value: 0.4620957934013452.
[I 2024-12-04 14:54:53,943] Trial 584 finished with value: 0.5005383967319823 and parameters: {'n_estimators': 1251, 'learning_rate': 0.09140477688847552, 'max_depth': 10, 'min_samples_split': 5, 'min_samples_leaf': 1, 'subsample': 0.7265219859554894, 'max_features': 'sqrt'}. Best is trial 419 with value: 0.4620957934013452.
[I 2024-12-04 14:54:56,279] Trial 587 finished with value: 0.4659681421553142 and parameters: {'n_estimators': 995, 'learning_rate': 0.06065625888241916, 'max_depth': 12, 'min_samples_split': 17, 'min_samples_leaf': 1, 'subsample': 0.96796112565595, 'max_features': None}. Best is trial 419 with value: 0.4620957934013452.
[I 2024-12-04 14:54:56,286] Trial 594 finished with value: 0.47936966471329046 and parameters: {'n_estimators': 915, 'learning_rate': 0.04092618952783116, 'max_depth': 12, 'min_samples_split': 20, 'min_samples_leaf': 1, 'subsample': 0.9335737857815041, 'max_features': None}. Best is trial 419 with value: 0.4620957934013452.
[I 2024-12-04 14:54:56,909] Trial 581 finished with value: 0.4891809295475796 and parameters: {'n_estimators': 1398, 'learning_rate': 0.04216142562751518, 'max_depth': 11, 'min_samples_split': 20, 'min_samples_leaf': 1, 'subsample': 0.8837298037823031, 'max_features': None}. Best is trial 419 with value: 0.4620957934013452.
[I 2024-12-04 14:54:56,926] Trial 597 finished with value: 0.4777970810552823 and parameters: {'n_estimators': 829, 'learning_rate': 0.0865283281949337, 'max_depth': 11, 'min_samples_split': 20, 'min_samples_leaf': 1, 'subsample': 0.9668027466755978, 'max_features': None}. Best is trial 419 with value: 0.4620957934013452.
[I 2024-12-04 14:54:58,491] Trial 596 finished with value: 0.48888191697669925 and parameters: {'n_estimators': 881, 'learning_rate': 0.048659164763518815, 'max_depth': 12, 'min_samples_split': 20, 'min_samples_leaf': 1, 'subsample': 0.8445994026522923, 'max_features': None}. Best is trial 419 with value: 0.4620957934013452.
[I 2024-12-04 14:54:59,037] Trial 605 finished with value: 0.4875382956747545 and parameters: {'n_estimators': 629, 'learning_rate': 0.05177144586301097, 'max_depth': 12, 'min_samples_split': 18, 'min_samples_leaf': 1, 'subsample': 0.9681486336811431, 'max_features': None}. Best is trial 419 with value: 0.4620957934013452.
[I 2024-12-04 14:55:00,250] Trial 598 finished with value: 0.7888620807388133 and parameters: {'n_estimators': 1110, 'learning_rate': 0.06425095276405651, 'max_depth': 8, 'min_samples_split': 9, 'min_samples_leaf': 9, 'subsample': 0.8651158939483798, 'max_features': 'log2'}. Best is trial 419 with value: 0.4620957934013452.
[I 2024-12-04 14:55:01,999] Trial 603 finished with value: 0.45955205541891275 and parameters: {'n_estimators': 848, 'learning_rate': 0.07927134927222014, 'max_depth': 12, 'min_samples_split': 20, 'min_samples_leaf': 1, 'subsample': 0.9738750358589197, 'max_features': None}. Best is trial 603 with value: 0.45955205541891275.
[I 2024-12-04 14:55:02,011] Trial 601 finished with value: 0.6295985891591565 and parameters: {'n_estimators': 793, 'learning_rate': 0.0700496612266251, 'max_depth': 12, 'min_samples_split': 20, 'min_samples_leaf': 3, 'subsample': 0.9975344364948019, 'max_features': None}. Best is trial 603 with value: 0.45955205541891275.
