[I 2024-12-04 19:55:06,290] Trial 251 finished with value: 0.35891131830853185 and parameters: {'n_estimators': 789, 'max_depth': 41, 'min_samples_split': 2, 'min_samples_leaf': 1, 'max_features': 'sqrt', 'bootstrap': False, 'criterion': 'squared_error'}. Best is trial 193 with value: 0.3224133091717219.
[I 2024-12-04 19:55:07,767] Trial 255 finished with value: 1.2110257108465494 and parameters: {'n_estimators': 455, 'max_depth': 47, 'min_samples_split': 3, 'min_samples_leaf': 4, 'max_features': 'log2', 'bootstrap': False, 'criterion': 'squared_error'}. Best is trial 193 with value: 0.3224133091717219.
[I 2024-12-04 19:55:08,861] Trial 256 finished with value: 0.8426785096639144 and parameters: {'n_estimators': 194, 'max_depth': 45, 'min_samples_split': 6, 'min_samples_leaf': 3, 'max_features': 'sqrt', 'bootstrap': False, 'criterion': 'squared_error'}. Best is trial 193 with value: 0.3224133091717219.
[I 2024-12-04 19:55:10,238] Trial 253 finished with value: 0.32693733912941525 and parameters: {'n_estimators': 861, 'max_depth': 50, 'min_samples_split': 2, 'min_samples_leaf': 1, 'max_features': 'sqrt', 'bootstrap': False, 'criterion': 'squared_error'}. Best is trial 193 with value: 0.3224133091717219.
[I 2024-12-04 19:55:10,251] Trial 254 finished with value: 0.3360222920197527 and parameters: {'n_estimators': 817, 'max_depth': 48, 'min_samples_split': 2, 'min_samples_leaf': 1, 'max_features': 'sqrt', 'bootstrap': False, 'criterion': 'squared_error'}. Best is trial 193 with value: 0.3224133091717219.
[I 2024-12-04 19:55:10,685] Trial 257 finished with value: 0.6759297848431524 and parameters: {'n_estimators': 732, 'max_depth': 50, 'min_samples_split': 2, 'min_samples_leaf': 2, 'max_features': 'sqrt', 'bootstrap': False, 'criterion': 'squared_error'}. Best is trial 193 with value: 0.3224133091717219.
[I 2024-12-04 19:55:14,331] Trial 259 finished with value: 0.3261938039351605 and parameters: {'n_estimators': 778, 'max_depth': 50, 'min_samples_split': 2, 'min_samples_leaf': 1, 'max_features': 'sqrt', 'bootstrap': False, 'criterion': 'squared_error'}. Best is trial 193 with value: 0.3224133091717219.
[I 2024-12-04 19:55:14,611] Trial 260 finished with value: 0.3262172424097927 and parameters: {'n_estimators': 794, 'max_depth': 50, 'min_samples_split': 2, 'min_samples_leaf': 1, 'max_features': 'sqrt', 'bootstrap': False, 'criterion': 'squared_error'}. Best is trial 193 with value: 0.3224133091717219.
[I 2024-12-04 19:55:15,061] Trial 258 finished with value: 0.327136408525843 and parameters: {'n_estimators': 982, 'max_depth': 50, 'min_samples_split': 2, 'min_samples_leaf': 1, 'max_features': 'sqrt', 'bootstrap': False, 'criterion': 'squared_error'}. Best is trial 193 with value: 0.3224133091717219.
[I 2024-12-04 19:55:16,984] Trial 261 finished with value: 0.3365152591621166 and parameters: {'n_estimators': 421, 'max_depth': 48, 'min_samples_split': 2, 'min_samples_leaf': 1, 'max_features': 'sqrt', 'bootstrap': False, 'criterion': 'squared_error'}. Best is trial 193 with value: 0.3224133091717219.
[I 2024-12-04 19:55:17,302] Trial 263 finished with value: 0.5880525955257062 and parameters: {'n_estimators': 404, 'max_depth': 8, 'min_samples_split': 11, 'min_samples_leaf': 11, 'max_features': None, 'bootstrap': False, 'criterion': 'squared_error'}. Best is trial 193 with value: 0.3224133091717219.
[I 2024-12-04 19:55:18,535] Trial 262 finished with value: 0.3518147478599998 and parameters: {'n_estimators': 798, 'max_depth': 42, 'min_samples_split': 2, 'min_samples_leaf': 1, 'max_features': 'sqrt', 'bootstrap': False, 'criterion': 'squared_error'}. Best is trial 193 with value: 0.3224133091717219.
[I 2024-12-04 19:55:19,061] Trial 264 finished with value: 0.3242568274330358 and parameters: {'n_estimators': 288, 'max_depth': 50, 'min_samples_split': 2, 'min_samples_leaf': 1, 'max_features': 'sqrt', 'bootstrap': False, 'criterion': 'squared_error'}. Best is trial 193 with value: 0.3224133091717219.
[I 2024-12-04 19:55:20,366] Trial 265 finished with value: 1.298341984191387 and parameters: {'n_estimators': 815, 'max_depth': 37, 'min_samples_split': 2, 'min_samples_leaf': 3, 'max_features': 'log2', 'bootstrap': True, 'criterion': 'absolute_error'}. Best is trial 193 with value: 0.3224133091717219.
[I 2024-12-04 19:55:22,150] Trial 268 finished with value: 0.32246671764803314 and parameters: {'n_estimators': 341, 'max_depth': 50, 'min_samples_split': 2, 'min_samples_leaf': 1, 'max_features': 'sqrt', 'bootstrap': False, 'criterion': 'squared_error'}. Best is trial 193 with value: 0.3224133091717219.
[I 2024-12-04 19:55:23,553] Trial 269 finished with value: 0.46873861841975584 and parameters: {'n_estimators': 411, 'max_depth': 50, 'min_samples_split': 7, 'min_samples_leaf': 1, 'max_features': 'sqrt', 'bootstrap': False, 'criterion': 'squared_error'}. Best is trial 193 with value: 0.3224133091717219.
[I 2024-12-04 19:55:24,494] Trial 270 finished with value: 1.2284331188388036 and parameters: {'n_estimators': 324, 'max_depth': 43, 'min_samples_split': 6, 'min_samples_leaf': 15, 'max_features': 'sqrt', 'bootstrap': True, 'criterion': 'squared_error'}. Best is trial 193 with value: 0.3224133091717219.
[I 2024-12-04 19:55:25,393] Trial 271 finished with value: 0.5244527362776998 and parameters: {'n_estimators': 153, 'max_depth': 50, 'min_samples_split': 6, 'min_samples_leaf': 1, 'max_features': 'sqrt', 'bootstrap': True, 'criterion': 'squared_error'}. Best is trial 193 with value: 0.3224133091717219.
[I 2024-12-04 19:55:26,735] Trial 272 finished with value: 1.318294900940831 and parameters: {'n_estimators': 457, 'max_depth': 40, 'min_samples_split': 14, 'min_samples_leaf': 4, 'max_features': 'log2', 'bootstrap': True, 'criterion': 'absolute_error'}. Best is trial 193 with value: 0.3224133091717219.
[I 2024-12-04 19:55:28,314] Trial 273 finished with value: 0.38021705618029455 and parameters: {'n_estimators': 355, 'max_depth': 49, 'min_samples_split': 2, 'min_samples_leaf': 1, 'max_features': 'sqrt', 'bootstrap': True, 'criterion': 'squared_error'}. Best is trial 193 with value: 0.3224133091717219.
[I 2024-12-04 19:55:29,820] Trial 274 finished with value: 0.3581633023807213 and parameters: {'n_estimators': 354, 'max_depth': 50, 'min_samples_split': 3, 'min_samples_leaf': 1, 'max_features': 'sqrt', 'bootstrap': False, 'criterion': 'squared_error'}. Best is trial 193 with value: 0.3224133091717219.
[I 2024-12-04 19:55:30,910] Trial 275 finished with value: 0.6695623820505234 and parameters: {'n_estimators': 346, 'max_depth': 48, 'min_samples_split': 2, 'min_samples_leaf': 2, 'max_features': 'sqrt', 'bootstrap': False, 'criterion': 'squared_error'}. Best is trial 193 with value: 0.3224133091717219.
[I 2024-12-04 19:55:32,029] Trial 266 finished with value: 1.0337448052238338 and parameters: {'n_estimators': 898, 'max_depth': 31, 'min_samples_split': 46, 'min_samples_leaf': 1, 'max_features': 'log2', 'bootstrap': False, 'criterion': 'absolute_error'}. Best is trial 193 with value: 0.3224133091717219.
[I 2024-12-04 19:55:34,036] Trial 277 finished with value: 0.7764423252110286 and parameters: {'n_estimators': 910, 'max_depth': 23, 'min_samples_split': 9, 'min_samples_leaf': 2, 'max_features': 'sqrt', 'bootstrap': False, 'criterion': 'squared_error'}. Best is trial 193 with value: 0.3224133091717219.
[I 2024-12-04 19:55:34,812] Trial 276 finished with value: 1.207154253715253 and parameters: {'n_estimators': 1000, 'max_depth': 22, 'min_samples_split': 7, 'min_samples_leaf': 5, 'max_features': 'sqrt', 'bootstrap': True, 'criterion': 'absolute_error'}. Best is trial 193 with value: 0.3224133091717219.
[I 2024-12-04 19:55:36,656] Trial 279 finished with value: 0.33133718585326843 and parameters: {'n_estimators': 358, 'max_depth': 48, 'min_samples_split': 2, 'min_samples_leaf': 1, 'max_features': 'sqrt', 'bootstrap': False, 'criterion': 'squared_error'}. Best is trial 193 with value: 0.3224133091717219.
[I 2024-12-04 19:55:36,853] Trial 278 finished with value: 1.287578460854358 and parameters: {'n_estimators': 613, 'max_depth': 9, 'min_samples_split': 25, 'min_samples_leaf': 3, 'max_features': 'log2', 'bootstrap': False, 'criterion': 'absolute_error'}. Best is trial 193 with value: 0.3224133091717219.
[I 2024-12-04 19:55:38,517] Trial 280 finished with value: 0.32351132331643373 and parameters: {'n_estimators': 321, 'max_depth': 50, 'min_samples_split': 2, 'min_samples_leaf': 1, 'max_features': 'sqrt', 'bootstrap': False, 'criterion': 'squared_error'}. Best is trial 193 with value: 0.3224133091717219.
[I 2024-12-04 19:55:38,562] Trial 281 finished with value: 0.37281579866060877 and parameters: {'n_estimators': 384, 'max_depth': 47, 'min_samples_split': 3, 'min_samples_leaf': 1, 'max_features': 'sqrt', 'bootstrap': False, 'criterion': 'squared_error'}. Best is trial 193 with value: 0.3224133091717219.
[I 2024-12-04 19:55:39,961] Trial 283 finished with value: 0.6741692956628076 and parameters: {'n_estimators': 368, 'max_depth': 50, 'min_samples_split': 4, 'min_samples_leaf': 2, 'max_features': 'sqrt', 'bootstrap': False, 'criterion': 'squared_error'}. Best is trial 193 with value: 0.3224133091717219.
[I 2024-12-04 19:55:40,639] Trial 282 finished with value: 0.32311294493510684 and parameters: {'n_estimators': 343, 'max_depth': 49, 'min_samples_split': 2, 'min_samples_leaf': 1, 'max_features': 'sqrt', 'bootstrap': False, 'criterion': 'squared_error'}. Best is trial 193 with value: 0.3224133091717219.
[I 2024-12-04 19:55:41,406] Trial 285 finished with value: 1.1912455294212327 and parameters: {'n_estimators': 125, 'max_depth': 45, 'min_samples_split': 32, 'min_samples_leaf': 11, 'max_features': 'sqrt', 'bootstrap': False, 'criterion': 'squared_error'}. Best is trial 193 with value: 0.3224133091717219.
[I 2024-12-04 19:55:41,515] Trial 284 finished with value: 0.680274928553715 and parameters: {'n_estimators': 561, 'max_depth': 36, 'min_samples_split': 2, 'min_samples_leaf': 2, 'max_features': 'sqrt', 'bootstrap': False, 'criterion': 'squared_error'}. Best is trial 193 with value: 0.3224133091717219.
[I 2024-12-04 19:55:42,744] Trial 286 finished with value: 0.6595988593971566 and parameters: {'n_estimators': 287, 'max_depth': 49, 'min_samples_split': 3, 'min_samples_leaf': 2, 'max_features': 'sqrt', 'bootstrap': False, 'criterion': 'squared_error'}. Best is trial 193 with value: 0.3224133091717219.
[I 2024-12-04 19:55:44,749] Trial 287 finished with value: 0.5433007350699849 and parameters: {'n_estimators': 931, 'max_depth': 5, 'min_samples_split': 5, 'min_samples_leaf': 5, 'max_features': None, 'bootstrap': True, 'criterion': 'squared_error'}. Best is trial 193 with value: 0.3224133091717219.
[I 2024-12-04 19:55:44,770] Trial 267 finished with value: 0.5750864614509512 and parameters: {'n_estimators': 579, 'max_depth': 5, 'min_samples_split': 4, 'min_samples_leaf': 4, 'max_features': None, 'bootstrap': False, 'criterion': 'absolute_error'}. Best is trial 193 with value: 0.3224133091717219.
[I 2024-12-04 19:55:44,776] Trial 288 finished with value: 0.32450015819517236 and parameters: {'n_estimators': 391, 'max_depth': 49, 'min_samples_split': 2, 'min_samples_leaf': 1, 'max_features': 'sqrt', 'bootstrap': False, 'criterion': 'squared_error'}. Best is trial 193 with value: 0.3224133091717219.
[I 2024-12-04 19:55:47,152] Trial 289 finished with value: 0.3343107324216457 and parameters: {'n_estimators': 388, 'max_depth': 48, 'min_samples_split': 2, 'min_samples_leaf': 1, 'max_features': 'sqrt', 'bootstrap': False, 'criterion': 'squared_error'}. Best is trial 193 with value: 0.3224133091717219.
[I 2024-12-04 19:55:47,220] Trial 291 finished with value: 1.0571810058408395 and parameters: {'n_estimators': 181, 'max_depth': 22, 'min_samples_split': 2, 'min_samples_leaf': 4, 'max_features': 'sqrt', 'bootstrap': True, 'criterion': 'squared_error'}. Best is trial 193 with value: 0.3224133091717219.
[I 2024-12-04 19:55:47,770] Trial 290 finished with value: 0.32483388742597485 and parameters: {'n_estimators': 324, 'max_depth': 49, 'min_samples_split': 2, 'min_samples_leaf': 1, 'max_features': 'sqrt', 'bootstrap': False, 'criterion': 'squared_error'}. Best is trial 193 with value: 0.3224133091717219.
[I 2024-12-04 19:55:49,821] Trial 293 finished with value: 0.3335248699055253 and parameters: {'n_estimators': 400, 'max_depth': 48, 'min_samples_split': 2, 'min_samples_leaf': 1, 'max_features': 'sqrt', 'bootstrap': False, 'criterion': 'squared_error'}. Best is trial 193 with value: 0.3224133091717219.
[I 2024-12-04 19:55:49,869] Trial 294 finished with value: 0.37375461839230834 and parameters: {'n_estimators': 349, 'max_depth': 38, 'min_samples_split': 2, 'min_samples_leaf': 1, 'max_features': 'sqrt', 'bootstrap': False, 'criterion': 'squared_error'}. Best is trial 193 with value: 0.3224133091717219.
[I 2024-12-04 19:55:51,096] Trial 295 finished with value: 0.6665081203515549 and parameters: {'n_estimators': 342, 'max_depth': 50, 'min_samples_split': 2, 'min_samples_leaf': 2, 'max_features': 'sqrt', 'bootstrap': False, 'criterion': 'squared_error'}. Best is trial 193 with value: 0.3224133091717219.
[I 2024-12-04 19:55:51,716] Trial 296 finished with value: 0.32774850911474934 and parameters: {'n_estimators': 238, 'max_depth': 49, 'min_samples_split': 2, 'min_samples_leaf': 1, 'max_features': 'sqrt', 'bootstrap': False, 'criterion': 'squared_error'}. Best is trial 193 with value: 0.3224133091717219.
[I 2024-12-04 19:55:52,436] Trial 297 finished with value: 0.9589763294192706 and parameters: {'n_estimators': 389, 'max_depth': 41, 'min_samples_split': 4, 'min_samples_leaf': 3, 'max_features': 'sqrt', 'bootstrap': True, 'criterion': 'squared_error'}. Best is trial 193 with value: 0.3224133091717219.
[I 2024-12-04 19:55:53,775] Trial 298 finished with value: 0.3299796700620097 and parameters: {'n_estimators': 322, 'max_depth': 48, 'min_samples_split': 2, 'min_samples_leaf': 1, 'max_features': 'sqrt', 'bootstrap': False, 'criterion': 'squared_error'}. Best is trial 193 with value: 0.3224133091717219.
[I 2024-12-04 19:55:54,467] Trial 299 finished with value: 0.330572786046868 and parameters: {'n_estimators': 354, 'max_depth': 48, 'min_samples_split': 2, 'min_samples_leaf': 1, 'max_features': 'sqrt', 'bootstrap': False, 'criterion': 'squared_error'}. Best is trial 193 with value: 0.3224133091717219.
[I 2024-12-04 19:55:55,853] Trial 300 finished with value: 0.3281690728779351 and parameters: {'n_estimators': 370, 'max_depth': 46, 'min_samples_split': 2, 'min_samples_leaf': 1, 'max_features': 'sqrt', 'bootstrap': False, 'criterion': 'squared_error'}. Best is trial 193 with value: 0.3224133091717219.
[I 2024-12-04 19:55:56,067] Trial 301 finished with value: 0.3709302441613933 and parameters: {'n_estimators': 356, 'max_depth': 48, 'min_samples_split': 3, 'min_samples_leaf': 1, 'max_features': 'sqrt', 'bootstrap': False, 'criterion': 'squared_error'}. Best is trial 193 with value: 0.3224133091717219.
[I 2024-12-04 19:55:57,960] Trial 302 finished with value: 0.32558829582418214 and parameters: {'n_estimators': 432, 'max_depth': 49, 'min_samples_split': 2, 'min_samples_leaf': 1, 'max_features': 'sqrt', 'bootstrap': False, 'criterion': 'squared_error'}. Best is trial 193 with value: 0.3224133091717219.
[I 2024-12-04 19:55:58,087] Trial 303 finished with value: 0.9279372883100087 and parameters: {'n_estimators': 141, 'max_depth': 46, 'min_samples_split': 21, 'min_samples_leaf': 1, 'max_features': 'log2', 'bootstrap': True, 'criterion': 'absolute_error'}. Best is trial 193 with value: 0.3224133091717219.
[I 2024-12-04 19:56:00,397] Trial 305 finished with value: 0.33734403771426885 and parameters: {'n_estimators': 406, 'max_depth': 45, 'min_samples_split': 2, 'min_samples_leaf': 1, 'max_features': 'sqrt', 'bootstrap': False, 'criterion': 'squared_error'}. Best is trial 193 with value: 0.3224133091717219.
[I 2024-12-04 19:56:01,868] Trial 306 finished with value: 0.45884728805907854 and parameters: {'n_estimators': 436, 'max_depth': 37, 'min_samples_split': 5, 'min_samples_leaf': 1, 'max_features': 'sqrt', 'bootstrap': False, 'criterion': 'squared_error'}. Best is trial 193 with value: 0.3224133091717219.
[I 2024-12-04 19:56:04,042] Trial 307 finished with value: 0.3433048157036419 and parameters: {'n_estimators': 460, 'max_depth': 47, 'min_samples_split': 2, 'min_samples_leaf': 1, 'max_features': 'sqrt', 'bootstrap': False, 'criterion': 'squared_error'}. Best is trial 193 with value: 0.3224133091717219.
[I 2024-12-04 19:56:05,652] Trial 304 finished with value: 0.4826966752798004 and parameters: {'n_estimators': 999, 'max_depth': 50, 'min_samples_split': 5, 'min_samples_leaf': 1, 'max_features': None, 'bootstrap': False, 'criterion': 'squared_error'}. Best is trial 193 with value: 0.3224133091717219.
[I 2024-12-04 19:56:05,664] Trial 308 finished with value: 0.3245596338563133 and parameters: {'n_estimators': 309, 'max_depth': 49, 'min_samples_split': 2, 'min_samples_leaf': 1, 'max_features': 'sqrt', 'bootstrap': False, 'criterion': 'squared_error'}. Best is trial 193 with value: 0.3224133091717219.
[I 2024-12-04 19:56:06,988] Trial 310 finished with value: 0.3877792073710451 and parameters: {'n_estimators': 181, 'max_depth': 50, 'min_samples_split': 4, 'min_samples_leaf': 1, 'max_features': 'sqrt', 'bootstrap': False, 'criterion': 'squared_error'}. Best is trial 193 with value: 0.3224133091717219.
[I 2024-12-04 19:56:07,199] Trial 309 finished with value: 0.365424600807968 and parameters: {'n_estimators': 261, 'max_depth': 49, 'min_samples_split': 3, 'min_samples_leaf': 1, 'max_features': 'sqrt', 'bootstrap': False, 'criterion': 'squared_error'}. Best is trial 193 with value: 0.3224133091717219.
[I 2024-12-04 19:56:08,406] Trial 292 finished with value: 0.573937378380735 and parameters: {'n_estimators': 169, 'max_depth': 47, 'min_samples_split': 34, 'min_samples_leaf': 1, 'max_features': None, 'bootstrap': False, 'criterion': 'absolute_error'}. Best is trial 193 with value: 0.3224133091717219.
[I 2024-12-04 19:56:09,231] Trial 311 finished with value: 0.4411974894815413 and parameters: {'n_estimators': 201, 'max_depth': 47, 'min_samples_split': 2, 'min_samples_leaf': 1, 'max_features': None, 'bootstrap': True, 'criterion': 'squared_error'}. Best is trial 193 with value: 0.3224133091717219.
[I 2024-12-04 19:56:09,249] Trial 312 finished with value: 0.9446360328336998 and parameters: {'n_estimators': 822, 'max_depth': 38, 'min_samples_split': 2, 'min_samples_leaf': 3, 'max_features': 'sqrt', 'bootstrap': True, 'criterion': 'squared_error'}. Best is trial 193 with value: 0.3224133091717219.
[I 2024-12-04 19:56:09,588] Trial 313 finished with value: 0.6660090878801594 and parameters: {'n_estimators': 255, 'max_depth': 49, 'min_samples_split': 2, 'min_samples_leaf': 2, 'max_features': 'sqrt', 'bootstrap': False, 'criterion': 'squared_error'}. Best is trial 193 with value: 0.3224133091717219.
[I 2024-12-04 19:56:12,365] Trial 314 finished with value: 1.2276578128060707 and parameters: {'n_estimators': 677, 'max_depth': 27, 'min_samples_split': 4, 'min_samples_leaf': 8, 'max_features': 'sqrt', 'bootstrap': False, 'criterion': 'absolute_error'}. Best is trial 193 with value: 0.3224133091717219.
[I 2024-12-04 19:56:12,485] Trial 316 finished with value: 1.2649682823678596 and parameters: {'n_estimators': 509, 'max_depth': 31, 'min_samples_split': 14, 'min_samples_leaf': 3, 'max_features': 'log2', 'bootstrap': False, 'criterion': 'absolute_error'}. Best is trial 193 with value: 0.3224133091717219.
[I 2024-12-04 19:56:12,734] Trial 315 finished with value: 0.42673799784211364 and parameters: {'n_estimators': 327, 'max_depth': 46, 'min_samples_split': 4, 'min_samples_leaf': 1, 'max_features': None, 'bootstrap': False, 'criterion': 'squared_error'}. Best is trial 193 with value: 0.3224133091717219.
[I 2024-12-04 19:56:14,299] Trial 318 finished with value: 1.2139179286654604 and parameters: {'n_estimators': 267, 'max_depth': 21, 'min_samples_split': 39, 'min_samples_leaf': 5, 'max_features': 'sqrt', 'bootstrap': True, 'criterion': 'absolute_error'}. Best is trial 193 with value: 0.3224133091717219.
[I 2024-12-04 19:56:14,720] Trial 317 finished with value: 0.4977914985846766 and parameters: {'n_estimators': 455, 'max_depth': 50, 'min_samples_split': 2, 'min_samples_leaf': 1, 'max_features': 'log2', 'bootstrap': False, 'criterion': 'squared_error'}. Best is trial 193 with value: 0.3224133091717219.
[I 2024-12-04 19:56:15,051] Trial 319 finished with value: 0.3342342370376711 and parameters: {'n_estimators': 345, 'max_depth': 45, 'min_samples_split': 2, 'min_samples_leaf': 1, 'max_features': 'sqrt', 'bootstrap': False, 'criterion': 'squared_error'}. Best is trial 193 with value: 0.3224133091717219.
[I 2024-12-04 19:56:16,155] Trial 320 finished with value: 0.35698839651814723 and parameters: {'n_estimators': 343, 'max_depth': 50, 'min_samples_split': 3, 'min_samples_leaf': 1, 'max_features': 'sqrt', 'bootstrap': False, 'criterion': 'squared_error'}. Best is trial 193 with value: 0.3224133091717219.
[I 2024-12-04 19:56:16,842] Trial 321 finished with value: 0.32448300084995413 and parameters: {'n_estimators': 321, 'max_depth': 49, 'min_samples_split': 2, 'min_samples_leaf': 1, 'max_features': 'sqrt', 'bootstrap': False, 'criterion': 'squared_error'}. Best is trial 193 with value: 0.3224133091717219.
[I 2024-12-04 19:56:16,971] Trial 322 finished with value: 0.3314068162357239 and parameters: {'n_estimators': 273, 'max_depth': 48, 'min_samples_split': 2, 'min_samples_leaf': 1, 'max_features': 'sqrt', 'bootstrap': False, 'criterion': 'squared_error'}. Best is trial 193 with value: 0.3224133091717219.
[I 2024-12-04 19:56:18,657] Trial 323 finished with value: 0.3230739760881745 and parameters: {'n_estimators': 353, 'max_depth': 50, 'min_samples_split': 2, 'min_samples_leaf': 1, 'max_features': 'sqrt', 'bootstrap': False, 'criterion': 'squared_error'}. Best is trial 193 with value: 0.3224133091717219.
