[I 2024-12-04 12:15:14,299] Trial 1368 finished with value: 0.8438438319257182 and parameters: {'n_estimators': 534, 'max_depth': 36, 'min_samples_split': 3, 'min_samples_leaf': 2, 'max_features': 'sqrt', 'bootstrap': False, 'criterion': 'absolute_error'}. Best is trial 744 with value: 0.5032383725751689.
[I 2024-12-04 12:15:14,305] Trial 1383 finished with value: 1.2938869252835232 and parameters: {'n_estimators': 197, 'max_depth': 27, 'min_samples_split': 49, 'min_samples_leaf': 2, 'max_features': 'log2', 'bootstrap': True, 'criterion': 'absolute_error'}. Best is trial 744 with value: 0.5032383725751689.
[I 2024-12-04 12:15:14,942] Trial 1360 finished with value: 0.5176070362168449 and parameters: {'n_estimators': 282, 'max_depth': 27, 'min_samples_split': 5, 'min_samples_leaf': 1, 'max_features': None, 'bootstrap': True, 'criterion': 'absolute_error'}. Best is trial 744 with value: 0.5032383725751689.
[I 2024-12-04 12:15:16,259] Trial 1377 finished with value: 0.5105161362181976 and parameters: {'n_estimators': 109, 'max_depth': 20, 'min_samples_split': 4, 'min_samples_leaf': 1, 'max_features': None, 'bootstrap': True, 'criterion': 'absolute_error'}. Best is trial 744 with value: 0.5032383725751689.
[I 2024-12-04 12:15:17,630] Trial 1384 finished with value: 0.9014948765009938 and parameters: {'n_estimators': 219, 'max_depth': 14, 'min_samples_split': 2, 'min_samples_leaf': 1, 'max_features': 'sqrt', 'bootstrap': True, 'criterion': 'absolute_error'}. Best is trial 744 with value: 0.5032383725751689.
[I 2024-12-04 12:15:19,302] Trial 1376 finished with value: 0.5175709544655602 and parameters: {'n_estimators': 110, 'max_depth': 18, 'min_samples_split': 3, 'min_samples_leaf': 1, 'max_features': None, 'bootstrap': True, 'criterion': 'absolute_error'}. Best is trial 744 with value: 0.5032383725751689.
[I 2024-12-04 12:15:21,980] Trial 1380 finished with value: 0.5143922351219583 and parameters: {'n_estimators': 109, 'max_depth': 16, 'min_samples_split': 3, 'min_samples_leaf': 1, 'max_features': None, 'bootstrap': True, 'criterion': 'absolute_error'}. Best is trial 744 with value: 0.5032383725751689.
[I 2024-12-04 12:15:22,074] Trial 1379 finished with value: 0.5326061043301132 and parameters: {'n_estimators': 104, 'max_depth': 23, 'min_samples_split': 11, 'min_samples_leaf': 1, 'max_features': None, 'bootstrap': True, 'criterion': 'absolute_error'}. Best is trial 744 with value: 0.5032383725751689.
[I 2024-12-04 12:15:24,159] Trial 1371 finished with value: 0.5148423786676093 and parameters: {'n_estimators': 237, 'max_depth': 16, 'min_samples_split': 4, 'min_samples_leaf': 1, 'max_features': None, 'bootstrap': True, 'criterion': 'absolute_error'}. Best is trial 744 with value: 0.5032383725751689.
[I 2024-12-04 12:15:24,384] Trial 1381 finished with value: 0.5656438985628256 and parameters: {'n_estimators': 117, 'max_depth': 19, 'min_samples_split': 2, 'min_samples_leaf': 1, 'max_features': None, 'bootstrap': False, 'criterion': 'absolute_error'}. Best is trial 744 with value: 0.5032383725751689.
[I 2024-12-04 12:15:24,752] Trial 1382 finished with value: 1.2905827216179624 and parameters: {'n_estimators': 156, 'max_depth': 12, 'min_samples_split': 5, 'min_samples_leaf': 2, 'max_features': 'log2', 'bootstrap': True, 'criterion': 'absolute_error'}. Best is trial 744 with value: 0.5032383725751689.
[I 2024-12-04 12:15:24,754] Trial 1355 finished with value: 0.6245116290461351 and parameters: {'n_estimators': 663, 'max_depth': 25, 'min_samples_split': 6, 'min_samples_leaf': 5, 'max_features': None, 'bootstrap': False, 'criterion': 'absolute_error'}. Best is trial 744 with value: 0.5032383725751689.
[I 2024-12-04 12:15:24,899] Trial 1362 finished with value: 0.6428537082442448 and parameters: {'n_estimators': 825, 'max_depth': 50, 'min_samples_split': 8, 'min_samples_leaf': 1, 'max_features': 'sqrt', 'bootstrap': True, 'criterion': 'absolute_error'}. Best is trial 744 with value: 0.5032383725751689.
[I 2024-12-04 12:15:26,291] Trial 1386 finished with value: 0.5134484997385901 and parameters: {'n_estimators': 100, 'max_depth': 26, 'min_samples_split': 3, 'min_samples_leaf': 1, 'max_features': None, 'bootstrap': True, 'criterion': 'absolute_error'}. Best is trial 744 with value: 0.5032383725751689.
[I 2024-12-04 12:15:26,641] Trial 1389 finished with value: 0.5082997373355078 and parameters: {'n_estimators': 101, 'max_depth': 25, 'min_samples_split': 5, 'min_samples_leaf': 1, 'max_features': None, 'bootstrap': True, 'criterion': 'absolute_error'}. Best is trial 744 with value: 0.5032383725751689.
[I 2024-12-04 12:15:27,055] Trial 1373 finished with value: 0.5168860142117854 and parameters: {'n_estimators': 234, 'max_depth': 21, 'min_samples_split': 5, 'min_samples_leaf': 1, 'max_features': None, 'bootstrap': True, 'criterion': 'absolute_error'}. Best is trial 744 with value: 0.5032383725751689.
[I 2024-12-04 12:15:27,057] Trial 1393 finished with value: 0.7558674559933669 and parameters: {'n_estimators': 261, 'max_depth': 20, 'min_samples_split': 37, 'min_samples_leaf': 1, 'max_features': 'sqrt', 'bootstrap': False, 'criterion': 'squared_error'}. Best is trial 744 with value: 0.5032383725751689.
[I 2024-12-04 12:15:27,779] Trial 1378 finished with value: 0.5220974522543014 and parameters: {'n_estimators': 296, 'max_depth': 10, 'min_samples_split': 2, 'min_samples_leaf': 1, 'max_features': None, 'bootstrap': True, 'criterion': 'absolute_error'}. Best is trial 744 with value: 0.5032383725751689.
[I 2024-12-04 12:15:28,214] Trial 1375 finished with value: 0.5232714269390508 and parameters: {'n_estimators': 237, 'max_depth': 27, 'min_samples_split': 3, 'min_samples_leaf': 1, 'max_features': None, 'bootstrap': True, 'criterion': 'absolute_error'}. Best is trial 744 with value: 0.5032383725751689.
[I 2024-12-04 12:15:29,707] Trial 1388 finished with value: 0.5051882006729784 and parameters: {'n_estimators': 102, 'max_depth': 19, 'min_samples_split': 5, 'min_samples_leaf': 1, 'max_features': None, 'bootstrap': True, 'criterion': 'absolute_error'}. Best is trial 744 with value: 0.5032383725751689.
[I 2024-12-04 12:15:29,845] Trial 1374 finished with value: 0.524783817942199 and parameters: {'n_estimators': 227, 'max_depth': 12, 'min_samples_split': 8, 'min_samples_leaf': 1, 'max_features': None, 'bootstrap': True, 'criterion': 'absolute_error'}. Best is trial 744 with value: 0.5032383725751689.
[I 2024-12-04 12:15:30,966] Trial 1396 finished with value: 1.2574841714450091 and parameters: {'n_estimators': 207, 'max_depth': 11, 'min_samples_split': 40, 'min_samples_leaf': 7, 'max_features': 'sqrt', 'bootstrap': False, 'criterion': 'absolute_error'}. Best is trial 744 with value: 0.5032383725751689.
[I 2024-12-04 12:15:31,580] Trial 1404 finished with value: 1.354144034356417 and parameters: {'n_estimators': 195, 'max_depth': 18, 'min_samples_split': 2, 'min_samples_leaf': 12, 'max_features': 'log2', 'bootstrap': False, 'criterion': 'absolute_error'}. Best is trial 744 with value: 0.5032383725751689.
[I 2024-12-04 12:15:34,261] Trial 1390 finished with value: 0.5603468709785004 and parameters: {'n_estimators': 263, 'max_depth': 14, 'min_samples_split': 8, 'min_samples_leaf': 2, 'max_features': None, 'bootstrap': True, 'criterion': 'absolute_error'}. Best is trial 744 with value: 0.5032383725751689.
[I 2024-12-04 12:15:34,969] Trial 1395 finished with value: 0.5590068884727212 and parameters: {'n_estimators': 102, 'max_depth': 19, 'min_samples_split': 7, 'min_samples_leaf': 2, 'max_features': None, 'bootstrap': True, 'criterion': 'absolute_error'}. Best is trial 744 with value: 0.5032383725751689.
[I 2024-12-04 12:15:35,776] Trial 1398 finished with value: 0.5079565495697672 and parameters: {'n_estimators': 103, 'max_depth': 18, 'min_samples_split': 6, 'min_samples_leaf': 1, 'max_features': None, 'bootstrap': True, 'criterion': 'absolute_error'}. Best is trial 744 with value: 0.5032383725751689.
[I 2024-12-04 12:15:37,224] Trial 1397 finished with value: 0.5530593751327416 and parameters: {'n_estimators': 994, 'max_depth': 21, 'min_samples_split': 20, 'min_samples_leaf': 3, 'max_features': None, 'bootstrap': True, 'criterion': 'squared_error'}. Best is trial 744 with value: 0.5032383725751689.
[I 2024-12-04 12:15:38,444] Trial 1409 finished with value: 0.8281541367012815 and parameters: {'n_estimators': 176, 'max_depth': 16, 'min_samples_split': 3, 'min_samples_leaf': 1, 'max_features': 'sqrt', 'bootstrap': True, 'criterion': 'squared_error'}. Best is trial 744 with value: 0.5032383725751689.
[I 2024-12-04 12:15:39,333] Trial 1385 finished with value: 0.5155518285354243 and parameters: {'n_estimators': 290, 'max_depth': 11, 'min_samples_split': 4, 'min_samples_leaf': 1, 'max_features': None, 'bootstrap': True, 'criterion': 'absolute_error'}. Best is trial 744 with value: 0.5032383725751689.
[I 2024-12-04 12:15:39,606] Trial 1399 finished with value: 0.5596885388453259 and parameters: {'n_estimators': 254, 'max_depth': 18, 'min_samples_split': 4, 'min_samples_leaf': 2, 'max_features': None, 'bootstrap': True, 'criterion': 'absolute_error'}. Best is trial 744 with value: 0.5032383725751689.
[I 2024-12-04 12:15:39,747] Trial 1387 finished with value: 0.5275237301030545 and parameters: {'n_estimators': 230, 'max_depth': 23, 'min_samples_split': 9, 'min_samples_leaf': 1, 'max_features': None, 'bootstrap': False, 'criterion': 'absolute_error'}. Best is trial 744 with value: 0.5032383725751689.
[I 2024-12-04 12:15:40,114] Trial 1394 finished with value: 0.5253606935793428 and parameters: {'n_estimators': 214, 'max_depth': 8, 'min_samples_split': 2, 'min_samples_leaf': 1, 'max_features': None, 'bootstrap': True, 'criterion': 'absolute_error'}. Best is trial 744 with value: 0.5032383725751689.
[I 2024-12-04 12:15:41,529] Trial 1411 finished with value: 1.3566051911349746 and parameters: {'n_estimators': 252, 'max_depth': 21, 'min_samples_split': 7, 'min_samples_leaf': 14, 'max_features': 'sqrt', 'bootstrap': True, 'criterion': 'absolute_error'}. Best is trial 744 with value: 0.5032383725751689.
[I 2024-12-04 12:15:42,176] Trial 1405 finished with value: 0.5165051047896151 and parameters: {'n_estimators': 106, 'max_depth': 24, 'min_samples_split': 6, 'min_samples_leaf': 1, 'max_features': None, 'bootstrap': True, 'criterion': 'absolute_error'}. Best is trial 744 with value: 0.5032383725751689.
[I 2024-12-04 12:15:42,237] Trial 1410 finished with value: 1.213851313295131 and parameters: {'n_estimators': 406, 'max_depth': 10, 'min_samples_split': 22, 'min_samples_leaf': 5, 'max_features': 'log2', 'bootstrap': False, 'criterion': 'squared_error'}. Best is trial 744 with value: 0.5032383725751689.
[I 2024-12-04 12:15:42,239] Trial 1400 finished with value: 0.5610078023721629 and parameters: {'n_estimators': 104, 'max_depth': 33, 'min_samples_split': 7, 'min_samples_leaf': 2, 'max_features': None, 'bootstrap': True, 'criterion': 'absolute_error'}. Best is trial 744 with value: 0.5032383725751689.
[I 2024-12-04 12:15:43,735] Trial 1406 finished with value: 1.298579017140565 and parameters: {'n_estimators': 967, 'max_depth': 34, 'min_samples_split': 4, 'min_samples_leaf': 3, 'max_features': 'log2', 'bootstrap': False, 'criterion': 'absolute_error'}. Best is trial 744 with value: 0.5032383725751689.
[I 2024-12-04 12:15:43,940] Trial 1391 finished with value: 0.5156152707467254 and parameters: {'n_estimators': 257, 'max_depth': 16, 'min_samples_split': 4, 'min_samples_leaf': 1, 'max_features': None, 'bootstrap': True, 'criterion': 'absolute_error'}. Best is trial 744 with value: 0.5032383725751689.
[I 2024-12-04 12:15:44,153] Trial 1413 finished with value: 0.7168032225427521 and parameters: {'n_estimators': 117, 'max_depth': 27, 'min_samples_split': 3, 'min_samples_leaf': 1, 'max_features': 'sqrt', 'bootstrap': True, 'criterion': 'absolute_error'}. Best is trial 744 with value: 0.5032383725751689.
[I 2024-12-04 12:15:44,181] Trial 1407 finished with value: 0.5161687127697169 and parameters: {'n_estimators': 101, 'max_depth': 20, 'min_samples_split': 3, 'min_samples_leaf': 1, 'max_features': None, 'bootstrap': True, 'criterion': 'absolute_error'}. Best is trial 744 with value: 0.5032383725751689.
[I 2024-12-04 12:15:44,317] Trial 1412 finished with value: 0.5272634981965213 and parameters: {'n_estimators': 117, 'max_depth': 22, 'min_samples_split': 3, 'min_samples_leaf': 1, 'max_features': None, 'bootstrap': True, 'criterion': 'squared_error'}. Best is trial 744 with value: 0.5032383725751689.
[I 2024-12-04 12:15:47,847] Trial 1403 finished with value: 0.5204542512537201 and parameters: {'n_estimators': 187, 'max_depth': 26, 'min_samples_split': 5, 'min_samples_leaf': 1, 'max_features': None, 'bootstrap': True, 'criterion': 'absolute_error'}. Best is trial 744 with value: 0.5032383725751689.
[I 2024-12-04 12:15:50,158] Trial 1401 finished with value: 0.5312223218395087 and parameters: {'n_estimators': 241, 'max_depth': 20, 'min_samples_split': 9, 'min_samples_leaf': 1, 'max_features': None, 'bootstrap': True, 'criterion': 'absolute_error'}. Best is trial 744 with value: 0.5032383725751689.
[I 2024-12-04 12:15:51,010] Trial 1408 finished with value: 1.3510301624049312 and parameters: {'n_estimators': 990, 'max_depth': 19, 'min_samples_split': 11, 'min_samples_leaf': 13, 'max_features': 'sqrt', 'bootstrap': True, 'criterion': 'absolute_error'}. Best is trial 744 with value: 0.5032383725751689.
[I 2024-12-04 12:15:53,975] Trial 1415 finished with value: 0.5265180779556056 and parameters: {'n_estimators': 100, 'max_depth': 24, 'min_samples_split': 10, 'min_samples_leaf': 1, 'max_features': None, 'bootstrap': True, 'criterion': 'absolute_error'}. Best is trial 744 with value: 0.5032383725751689.
[I 2024-12-04 12:15:54,114] Trial 1414 finished with value: 0.8774510123876789 and parameters: {'n_estimators': 647, 'max_depth': 19, 'min_samples_split': 48, 'min_samples_leaf': 15, 'max_features': None, 'bootstrap': False, 'criterion': 'absolute_error'}. Best is trial 744 with value: 0.5032383725751689.
[I 2024-12-04 12:15:55,617] Trial 1422 finished with value: 0.5119479380345372 and parameters: {'n_estimators': 101, 'max_depth': 17, 'min_samples_split': 4, 'min_samples_leaf': 1, 'max_features': None, 'bootstrap': True, 'criterion': 'absolute_error'}. Best is trial 744 with value: 0.5032383725751689.
[I 2024-12-04 12:15:58,132] Trial 1416 finished with value: 0.5127319849945609 and parameters: {'n_estimators': 224, 'max_depth': 18, 'min_samples_split': 4, 'min_samples_leaf': 1, 'max_features': None, 'bootstrap': True, 'criterion': 'absolute_error'}. Best is trial 744 with value: 0.5032383725751689.
[I 2024-12-04 12:15:58,455] Trial 1392 finished with value: 0.5624044574604146 and parameters: {'n_estimators': 336, 'max_depth': 24, 'min_samples_split': 4, 'min_samples_leaf': 1, 'max_features': None, 'bootstrap': False, 'criterion': 'absolute_error'}. Best is trial 744 with value: 0.5032383725751689.
[I 2024-12-04 12:15:58,501] Trial 1424 finished with value: 0.9528452796875048 and parameters: {'n_estimators': 370, 'max_depth': 23, 'min_samples_split': 2, 'min_samples_leaf': 1, 'max_features': 'log2', 'bootstrap': True, 'criterion': 'absolute_error'}. Best is trial 744 with value: 0.5032383725751689.
[I 2024-12-04 12:15:58,775] Trial 1419 finished with value: 0.5065438829011432 and parameters: {'n_estimators': 104, 'max_depth': 17, 'min_samples_split': 5, 'min_samples_leaf': 1, 'max_features': None, 'bootstrap': True, 'criterion': 'absolute_error'}. Best is trial 744 with value: 0.5032383725751689.
[I 2024-12-04 12:15:59,519] Trial 1426 finished with value: 0.5094924648788315 and parameters: {'n_estimators': 100, 'max_depth': 22, 'min_samples_split': 5, 'min_samples_leaf': 1, 'max_features': None, 'bootstrap': True, 'criterion': 'absolute_error'}. Best is trial 744 with value: 0.5032383725751689.
[I 2024-12-04 12:16:00,283] Trial 1433 finished with value: 1.2321704373703541 and parameters: {'n_estimators': 654, 'max_depth': 38, 'min_samples_split': 29, 'min_samples_leaf': 11, 'max_features': 'log2', 'bootstrap': False, 'criterion': 'squared_error'}. Best is trial 744 with value: 0.5032383725751689.
[I 2024-12-04 12:16:00,284] Trial 1402 finished with value: 0.5228435208849557 and parameters: {'n_estimators': 247, 'max_depth': 20, 'min_samples_split': 3, 'min_samples_leaf': 1, 'max_features': None, 'bootstrap': True, 'criterion': 'absolute_error'}. Best is trial 744 with value: 0.5032383725751689.
[I 2024-12-04 12:16:00,288] Trial 1425 finished with value: 0.5114752678695069 and parameters: {'n_estimators': 114, 'max_depth': 23, 'min_samples_split': 4, 'min_samples_leaf': 1, 'max_features': None, 'bootstrap': True, 'criterion': 'absolute_error'}. Best is trial 744 with value: 0.5032383725751689.
[I 2024-12-04 12:16:01,373] Trial 1435 finished with value: 0.5533786279475558 and parameters: {'n_estimators': 102, 'max_depth': 19, 'min_samples_split': 4, 'min_samples_leaf': 2, 'max_features': None, 'bootstrap': True, 'criterion': 'absolute_error'}. Best is trial 744 with value: 0.5032383725751689.
[I 2024-12-04 12:16:03,680] Trial 1423 finished with value: 0.5200456500131467 and parameters: {'n_estimators': 103, 'max_depth': 25, 'min_samples_split': 3, 'min_samples_leaf': 1, 'max_features': None, 'bootstrap': True, 'criterion': 'absolute_error'}. Best is trial 744 with value: 0.5032383725751689.
[I 2024-12-04 12:16:03,683] Trial 1437 finished with value: 1.199933072040885 and parameters: {'n_estimators': 106, 'max_depth': 48, 'min_samples_split': 10, 'min_samples_leaf': 6, 'max_features': 'sqrt', 'bootstrap': True, 'criterion': 'squared_error'}. Best is trial 744 with value: 0.5032383725751689.
[I 2024-12-04 12:16:03,969] Trial 1427 finished with value: 0.5170499209953409 and parameters: {'n_estimators': 119, 'max_depth': 14, 'min_samples_split': 2, 'min_samples_leaf': 1, 'max_features': None, 'bootstrap': True, 'criterion': 'absolute_error'}. Best is trial 744 with value: 0.5032383725751689.
[I 2024-12-04 12:16:05,427] Trial 1420 finished with value: 0.5156425236445559 and parameters: {'n_estimators': 228, 'max_depth': 20, 'min_samples_split': 4, 'min_samples_leaf': 1, 'max_features': None, 'bootstrap': True, 'criterion': 'absolute_error'}. Best is trial 744 with value: 0.5032383725751689.
[I 2024-12-04 12:16:06,175] Trial 1418 finished with value: 0.7042170900047499 and parameters: {'n_estimators': 459, 'max_depth': 27, 'min_samples_split': 45, 'min_samples_leaf': 3, 'max_features': None, 'bootstrap': True, 'criterion': 'absolute_error'}. Best is trial 744 with value: 0.5032383725751689.
[I 2024-12-04 12:16:07,623] Trial 1436 finished with value: 1.0767407081441023 and parameters: {'n_estimators': 110, 'max_depth': 10, 'min_samples_split': 5, 'min_samples_leaf': 1, 'max_features': 'sqrt', 'bootstrap': True, 'criterion': 'absolute_error'}. Best is trial 744 with value: 0.5032383725751689.
[I 2024-12-04 12:16:07,817] Trial 1417 finished with value: 0.5194134186675264 and parameters: {'n_estimators': 265, 'max_depth': 20, 'min_samples_split': 6, 'min_samples_leaf': 1, 'max_features': None, 'bootstrap': True, 'criterion': 'absolute_error'}. Best is trial 744 with value: 0.5032383725751689.
[I 2024-12-04 12:16:09,397] Trial 1442 finished with value: 1.2202925367350423 and parameters: {'n_estimators': 443, 'max_depth': 50, 'min_samples_split': 14, 'min_samples_leaf': 2, 'max_features': 'log2', 'bootstrap': False, 'criterion': 'absolute_error'}. Best is trial 744 with value: 0.5032383725751689.
[I 2024-12-04 12:16:09,461] Trial 1441 finished with value: 0.925381594156964 and parameters: {'n_estimators': 356, 'max_depth': 18, 'min_samples_split': 49, 'min_samples_leaf': 2, 'max_features': 'sqrt', 'bootstrap': True, 'criterion': 'squared_error'}. Best is trial 744 with value: 0.5032383725751689.
[I 2024-12-04 12:16:11,076] Trial 1434 finished with value: 0.5162554725125845 and parameters: {'n_estimators': 103, 'max_depth': 17, 'min_samples_split': 3, 'min_samples_leaf': 1, 'max_features': None, 'bootstrap': True, 'criterion': 'absolute_error'}. Best is trial 744 with value: 0.5032383725751689.
[I 2024-12-04 12:16:11,655] Trial 1443 finished with value: 0.6335238449917284 and parameters: {'n_estimators': 641, 'max_depth': 48, 'min_samples_split': 6, 'min_samples_leaf': 1, 'max_features': 'sqrt', 'bootstrap': True, 'criterion': 'squared_error'}. Best is trial 744 with value: 0.5032383725751689.
[I 2024-12-04 12:16:12,542] Trial 1432 finished with value: 0.5617231820651902 and parameters: {'n_estimators': 231, 'max_depth': 19, 'min_samples_split': 6, 'min_samples_leaf': 2, 'max_features': None, 'bootstrap': True, 'criterion': 'absolute_error'}. Best is trial 744 with value: 0.5032383725751689.
[I 2024-12-04 12:16:13,293] Trial 1444 finished with value: 1.016638376039499 and parameters: {'n_estimators': 281, 'max_depth': 17, 'min_samples_split': 32, 'min_samples_leaf': 1, 'max_features': 'log2', 'bootstrap': True, 'criterion': 'squared_error'}. Best is trial 744 with value: 0.5032383725751689.
[I 2024-12-04 12:16:13,872] Trial 1440 finished with value: 0.5391485525973958 and parameters: {'n_estimators': 105, 'max_depth': 10, 'min_samples_split': 13, 'min_samples_leaf': 1, 'max_features': None, 'bootstrap': True, 'criterion': 'absolute_error'}. Best is trial 744 with value: 0.5032383725751689.
[I 2024-12-04 12:16:14,029] Trial 1421 finished with value: 0.5611415150920657 and parameters: {'n_estimators': 459, 'max_depth': 31, 'min_samples_split': 4, 'min_samples_leaf': 2, 'max_features': None, 'bootstrap': True, 'criterion': 'absolute_error'}. Best is trial 744 with value: 0.5032383725751689.
[I 2024-12-04 12:16:16,126] Trial 1428 finished with value: 0.8084919308904942 and parameters: {'n_estimators': 894, 'max_depth': 20, 'min_samples_split': 3, 'min_samples_leaf': 12, 'max_features': None, 'bootstrap': True, 'criterion': 'squared_error'}. Best is trial 744 with value: 0.5032383725751689.
