[I 2024-12-04 12:00:19,739] Trial 370 finished with value: 0.30379774200339194 and parameters: {'n_estimators': 215, 'max_depth': 49, 'min_samples_split': 4, 'min_samples_leaf': 1, 'max_features': 'sqrt', 'bootstrap': False, 'criterion': 'squared_error'}. Best is trial 341 with value: 0.2909369124469028.
[I 2024-12-04 12:00:19,965] Trial 372 finished with value: 0.4449435695951237 and parameters: {'n_estimators': 246, 'max_depth': 44, 'min_samples_split': 3, 'min_samples_leaf': 2, 'max_features': 'sqrt', 'bootstrap': False, 'criterion': 'squared_error'}. Best is trial 341 with value: 0.2909369124469028.
[I 2024-12-04 12:00:20,044] Trial 375 finished with value: 0.3856777692477851 and parameters: {'n_estimators': 152, 'max_depth': 48, 'min_samples_split': 6, 'min_samples_leaf': 1, 'max_features': None, 'bootstrap': False, 'criterion': 'squared_error'}. Best is trial 341 with value: 0.2909369124469028.
[I 2024-12-04 12:00:20,053] Trial 366 finished with value: 0.2999321603023074 and parameters: {'n_estimators': 123, 'max_depth': 48, 'min_samples_split': 2, 'min_samples_leaf': 1, 'max_features': 'sqrt', 'bootstrap': False, 'criterion': 'squared_error'}. Best is trial 341 with value: 0.2909369124469028.
[I 2024-12-04 12:00:20,183] Trial 369 finished with value: 0.3182384438946659 and parameters: {'n_estimators': 310, 'max_depth': 48, 'min_samples_split': 3, 'min_samples_leaf': 1, 'max_features': 'sqrt', 'bootstrap': True, 'criterion': 'squared_error'}. Best is trial 341 with value: 0.2909369124469028.
[I 2024-12-04 12:00:20,204] Trial 373 finished with value: 0.803292596613906 and parameters: {'n_estimators': 862, 'max_depth': 19, 'min_samples_split': 30, 'min_samples_leaf': 3, 'max_features': 'log2', 'bootstrap': False, 'criterion': 'squared_error'}. Best is trial 341 with value: 0.2909369124469028.
[I 2024-12-04 12:00:22,754] Trial 333 finished with value: 0.4020342184288626 and parameters: {'n_estimators': 228, 'max_depth': 40, 'min_samples_split': 43, 'min_samples_leaf': 1, 'max_features': None, 'bootstrap': True, 'criterion': 'absolute_error'}. Best is trial 341 with value: 0.2909369124469028.
[I 2024-12-04 12:00:23,790] Trial 380 finished with value: 0.30066164651653515 and parameters: {'n_estimators': 225, 'max_depth': 50, 'min_samples_split': 4, 'min_samples_leaf': 1, 'max_features': 'sqrt', 'bootstrap': False, 'criterion': 'squared_error'}. Best is trial 341 with value: 0.2909369124469028.
[I 2024-12-04 12:00:24,204] Trial 378 finished with value: 0.44852313651405035 and parameters: {'n_estimators': 147, 'max_depth': 44, 'min_samples_split': 3, 'min_samples_leaf': 2, 'max_features': 'sqrt', 'bootstrap': False, 'criterion': 'squared_error'}. Best is trial 341 with value: 0.2909369124469028.
[I 2024-12-04 12:00:24,524] Trial 379 finished with value: 0.30218570402130535 and parameters: {'n_estimators': 133, 'max_depth': 45, 'min_samples_split': 3, 'min_samples_leaf': 1, 'max_features': 'sqrt', 'bootstrap': False, 'criterion': 'squared_error'}. Best is trial 341 with value: 0.2909369124469028.
[I 2024-12-04 12:00:25,352] Trial 382 finished with value: 0.31715434938090126 and parameters: {'n_estimators': 175, 'max_depth': 50, 'min_samples_split': 9, 'min_samples_leaf': 1, 'max_features': 'sqrt', 'bootstrap': False, 'criterion': 'squared_error'}. Best is trial 341 with value: 0.2909369124469028.
[I 2024-12-04 12:00:26,872] Trial 377 finished with value: 0.8819115512543302 and parameters: {'n_estimators': 322, 'max_depth': 14, 'min_samples_split': 2, 'min_samples_leaf': 11, 'max_features': 'sqrt', 'bootstrap': True, 'criterion': 'absolute_error'}. Best is trial 341 with value: 0.2909369124469028.
[I 2024-12-04 12:00:28,343] Trial 381 finished with value: 0.29586272479414893 and parameters: {'n_estimators': 104, 'max_depth': 48, 'min_samples_split': 3, 'min_samples_leaf': 1, 'max_features': 'sqrt', 'bootstrap': False, 'criterion': 'squared_error'}. Best is trial 341 with value: 0.2909369124469028.
[I 2024-12-04 12:00:28,637] Trial 368 finished with value: 0.5400525756627831 and parameters: {'n_estimators': 958, 'max_depth': 31, 'min_samples_split': 4, 'min_samples_leaf': 13, 'max_features': None, 'bootstrap': True, 'criterion': 'squared_error'}. Best is trial 341 with value: 0.2909369124469028.
[I 2024-12-04 12:00:28,918] Trial 376 finished with value: 0.7711387519001426 and parameters: {'n_estimators': 826, 'max_depth': 14, 'min_samples_split': 4, 'min_samples_leaf': 2, 'max_features': 'log2', 'bootstrap': False, 'criterion': 'squared_error'}. Best is trial 341 with value: 0.2909369124469028.
[I 2024-12-04 12:00:32,722] Trial 385 finished with value: 0.29941194104638025 and parameters: {'n_estimators': 236, 'max_depth': 50, 'min_samples_split': 2, 'min_samples_leaf': 1, 'max_features': 'sqrt', 'bootstrap': False, 'criterion': 'squared_error'}. Best is trial 341 with value: 0.2909369124469028.
[I 2024-12-04 12:00:33,455] Trial 383 finished with value: 0.32505489369599444 and parameters: {'n_estimators': 254, 'max_depth': 39, 'min_samples_split': 5, 'min_samples_leaf': 1, 'max_features': 'sqrt', 'bootstrap': False, 'criterion': 'squared_error'}. Best is trial 341 with value: 0.2909369124469028.
[I 2024-12-04 12:00:34,296] Trial 388 finished with value: 0.48708410578766254 and parameters: {'n_estimators': 107, 'max_depth': 47, 'min_samples_split': 3, 'min_samples_leaf': 2, 'max_features': 'sqrt', 'bootstrap': True, 'criterion': 'squared_error'}. Best is trial 341 with value: 0.2909369124469028.
[I 2024-12-04 12:00:35,611] Trial 386 finished with value: 0.2927184412508162 and parameters: {'n_estimators': 153, 'max_depth': 50, 'min_samples_split': 3, 'min_samples_leaf': 1, 'max_features': 'sqrt', 'bootstrap': False, 'criterion': 'squared_error'}. Best is trial 341 with value: 0.2909369124469028.
[I 2024-12-04 12:00:38,105] Trial 384 finished with value: 0.4401363563736242 and parameters: {'n_estimators': 387, 'max_depth': 49, 'min_samples_split': 3, 'min_samples_leaf': 2, 'max_features': 'sqrt', 'bootstrap': False, 'criterion': 'squared_error'}. Best is trial 341 with value: 0.2909369124469028.
[I 2024-12-04 12:00:38,693] Trial 374 finished with value: 0.3240586354015877 and parameters: {'n_estimators': 189, 'max_depth': 41, 'min_samples_split': 4, 'min_samples_leaf': 1, 'max_features': 'sqrt', 'bootstrap': False, 'criterion': 'absolute_error'}. Best is trial 341 with value: 0.2909369124469028.
[I 2024-12-04 12:00:39,678] Trial 389 finished with value: 0.44128986634981954 and parameters: {'n_estimators': 354, 'max_depth': 49, 'min_samples_split': 4, 'min_samples_leaf': 2, 'max_features': 'sqrt', 'bootstrap': False, 'criterion': 'squared_error'}. Best is trial 341 with value: 0.2909369124469028.
[I 2024-12-04 12:00:42,782] Trial 393 finished with value: 0.9551141110911484 and parameters: {'n_estimators': 882, 'max_depth': 49, 'min_samples_split': 13, 'min_samples_leaf': 8, 'max_features': 'log2', 'bootstrap': True, 'criterion': 'squared_error'}. Best is trial 341 with value: 0.2909369124469028.
[I 2024-12-04 12:00:42,787] Trial 394 finished with value: 0.44642316708641716 and parameters: {'n_estimators': 211, 'max_depth': 11, 'min_samples_split': 47, 'min_samples_leaf': 4, 'max_features': None, 'bootstrap': False, 'criterion': 'squared_error'}. Best is trial 341 with value: 0.2909369124469028.
[I 2024-12-04 12:00:45,303] Trial 352 finished with value: 0.4575845962776394 and parameters: {'n_estimators': 470, 'max_depth': 31, 'min_samples_split': 33, 'min_samples_leaf': 6, 'max_features': None, 'bootstrap': False, 'criterion': 'absolute_error'}. Best is trial 341 with value: 0.2909369124469028.
[I 2024-12-04 12:00:45,835] Trial 391 finished with value: 0.30686684442075735 and parameters: {'n_estimators': 263, 'max_depth': 40, 'min_samples_split': 3, 'min_samples_leaf': 1, 'max_features': 'sqrt', 'bootstrap': False, 'criterion': 'squared_error'}. Best is trial 341 with value: 0.2909369124469028.
[I 2024-12-04 12:00:46,156] Trial 362 finished with value: 0.5107938197015919 and parameters: {'n_estimators': 650, 'max_depth': 15, 'min_samples_split': 31, 'min_samples_leaf': 10, 'max_features': None, 'bootstrap': True, 'criterion': 'absolute_error'}. Best is trial 341 with value: 0.2909369124469028.
[I 2024-12-04 12:00:48,617] Trial 403 finished with value: 0.29990829593598095 and parameters: {'n_estimators': 215, 'max_depth': 50, 'min_samples_split': 4, 'min_samples_leaf': 1, 'max_features': 'sqrt', 'bootstrap': False, 'criterion': 'squared_error'}. Best is trial 341 with value: 0.2909369124469028.
[I 2024-12-04 12:00:49,106] Trial 396 finished with value: 0.29412721759185473 and parameters: {'n_estimators': 129, 'max_depth': 48, 'min_samples_split': 3, 'min_samples_leaf': 1, 'max_features': 'sqrt', 'bootstrap': False, 'criterion': 'squared_error'}. Best is trial 341 with value: 0.2909369124469028.
[I 2024-12-04 12:00:49,341] Trial 261 finished with value: 0.398202561412286 and parameters: {'n_estimators': 952, 'max_depth': 10, 'min_samples_split': 5, 'min_samples_leaf': 1, 'max_features': None, 'bootstrap': True, 'criterion': 'absolute_error'}. Best is trial 341 with value: 0.2909369124469028.
[I 2024-12-04 12:00:52,476] Trial 401 finished with value: 0.3045671263428312 and parameters: {'n_estimators': 102, 'max_depth': 49, 'min_samples_split': 4, 'min_samples_leaf': 1, 'max_features': 'sqrt', 'bootstrap': False, 'criterion': 'squared_error'}. Best is trial 341 with value: 0.2909369124469028.
[I 2024-12-04 12:00:53,200] Trial 398 finished with value: 0.29843921545228713 and parameters: {'n_estimators': 114, 'max_depth': 49, 'min_samples_split': 3, 'min_samples_leaf': 1, 'max_features': 'sqrt', 'bootstrap': False, 'criterion': 'squared_error'}. Best is trial 341 with value: 0.2909369124469028.
[I 2024-12-04 12:00:53,384] Trial 406 finished with value: 0.4503270142735642 and parameters: {'n_estimators': 121, 'max_depth': 49, 'min_samples_split': 8, 'min_samples_leaf': 2, 'max_features': 'sqrt', 'bootstrap': False, 'criterion': 'squared_error'}. Best is trial 341 with value: 0.2909369124469028.
[I 2024-12-04 12:00:53,957] Trial 402 finished with value: 0.91608223261236 and parameters: {'n_estimators': 703, 'max_depth': 48, 'min_samples_split': 10, 'min_samples_leaf': 6, 'max_features': 'log2', 'bootstrap': False, 'criterion': 'squared_error'}. Best is trial 341 with value: 0.2909369124469028.
[I 2024-12-04 12:00:55,938] Trial 408 finished with value: 0.30113995161531837 and parameters: {'n_estimators': 128, 'max_depth': 50, 'min_samples_split': 4, 'min_samples_leaf': 1, 'max_features': 'sqrt', 'bootstrap': False, 'criterion': 'squared_error'}. Best is trial 341 with value: 0.2909369124469028.
[I 2024-12-04 12:00:56,057] Trial 404 finished with value: 0.2953632908300322 and parameters: {'n_estimators': 345, 'max_depth': 50, 'min_samples_split': 3, 'min_samples_leaf': 1, 'max_features': 'sqrt', 'bootstrap': False, 'criterion': 'squared_error'}. Best is trial 341 with value: 0.2909369124469028.
[I 2024-12-04 12:00:56,158] Trial 397 finished with value: 0.8620966858923844 and parameters: {'n_estimators': 625, 'max_depth': 49, 'min_samples_split': 12, 'min_samples_leaf': 15, 'max_features': 'sqrt', 'bootstrap': False, 'criterion': 'absolute_error'}. Best is trial 341 with value: 0.2909369124469028.
[I 2024-12-04 12:00:56,699] Trial 325 finished with value: 0.3852260904693439 and parameters: {'n_estimators': 757, 'max_depth': 45, 'min_samples_split': 10, 'min_samples_leaf': 3, 'max_features': None, 'bootstrap': True, 'criterion': 'absolute_error'}. Best is trial 341 with value: 0.2909369124469028.
[I 2024-12-04 12:00:57,478] Trial 405 finished with value: 0.2956114912692976 and parameters: {'n_estimators': 282, 'max_depth': 49, 'min_samples_split': 2, 'min_samples_leaf': 1, 'max_features': 'sqrt', 'bootstrap': False, 'criterion': 'squared_error'}. Best is trial 341 with value: 0.2909369124469028.
[I 2024-12-04 12:00:57,831] Trial 411 finished with value: 0.4408085291337127 and parameters: {'n_estimators': 111, 'max_depth': 50, 'min_samples_split': 4, 'min_samples_leaf': 2, 'max_features': 'sqrt', 'bootstrap': False, 'criterion': 'squared_error'}. Best is trial 341 with value: 0.2909369124469028.
[I 2024-12-04 12:00:57,875] Trial 360 finished with value: 0.445186344692913 and parameters: {'n_estimators': 604, 'max_depth': 37, 'min_samples_split': 48, 'min_samples_leaf': 4, 'max_features': None, 'bootstrap': True, 'criterion': 'absolute_error'}. Best is trial 341 with value: 0.2909369124469028.
[I 2024-12-04 12:00:57,885] Trial 409 finished with value: 0.3012587265288262 and parameters: {'n_estimators': 116, 'max_depth': 48, 'min_samples_split': 2, 'min_samples_leaf': 1, 'max_features': 'sqrt', 'bootstrap': False, 'criterion': 'squared_error'}. Best is trial 341 with value: 0.2909369124469028.
[I 2024-12-04 12:01:00,444] Trial 414 finished with value: 0.3596059935353807 and parameters: {'n_estimators': 100, 'max_depth': 30, 'min_samples_split': 2, 'min_samples_leaf': 1, 'max_features': 'sqrt', 'bootstrap': False, 'criterion': 'squared_error'}. Best is trial 341 with value: 0.2909369124469028.
[I 2024-12-04 12:01:00,862] Trial 400 finished with value: 0.38472429720281565 and parameters: {'n_estimators': 402, 'max_depth': 37, 'min_samples_split': 6, 'min_samples_leaf': 1, 'max_features': None, 'bootstrap': False, 'criterion': 'squared_error'}. Best is trial 341 with value: 0.2909369124469028.
[I 2024-12-04 12:01:02,070] Trial 392 finished with value: 0.6779495924560279 and parameters: {'n_estimators': 601, 'max_depth': 33, 'min_samples_split': 26, 'min_samples_leaf': 6, 'max_features': 'sqrt', 'bootstrap': False, 'criterion': 'absolute_error'}. Best is trial 341 with value: 0.2909369124469028.
[I 2024-12-04 12:01:02,227] Trial 413 finished with value: 0.4489026346401608 and parameters: {'n_estimators': 124, 'max_depth': 40, 'min_samples_split': 2, 'min_samples_leaf': 2, 'max_features': 'sqrt', 'bootstrap': False, 'criterion': 'squared_error'}. Best is trial 341 with value: 0.2909369124469028.
[I 2024-12-04 12:01:02,485] Trial 387 finished with value: 0.4739417940185084 and parameters: {'n_estimators': 373, 'max_depth': 10, 'min_samples_split': 25, 'min_samples_leaf': 8, 'max_features': None, 'bootstrap': False, 'criterion': 'absolute_error'}. Best is trial 341 with value: 0.2909369124469028.
[I 2024-12-04 12:01:04,107] Trial 418 finished with value: 0.2937901564965287 and parameters: {'n_estimators': 139, 'max_depth': 50, 'min_samples_split': 3, 'min_samples_leaf': 1, 'max_features': 'sqrt', 'bootstrap': False, 'criterion': 'squared_error'}. Best is trial 341 with value: 0.2909369124469028.
[I 2024-12-04 12:01:05,782] Trial 258 finished with value: 0.4426087284946927 and parameters: {'n_estimators': 647, 'max_depth': 35, 'min_samples_split': 40, 'min_samples_leaf': 1, 'max_features': None, 'bootstrap': False, 'criterion': 'absolute_error'}. Best is trial 341 with value: 0.2909369124469028.
[I 2024-12-04 12:01:05,906] Trial 407 finished with value: 0.4163122489394938 and parameters: {'n_estimators': 299, 'max_depth': 43, 'min_samples_split': 4, 'min_samples_leaf': 2, 'max_features': None, 'bootstrap': False, 'criterion': 'squared_error'}. Best is trial 341 with value: 0.2909369124469028.
[I 2024-12-04 12:01:07,791] Trial 416 finished with value: 0.3173969691194147 and parameters: {'n_estimators': 220, 'max_depth': 39, 'min_samples_split': 2, 'min_samples_leaf': 1, 'max_features': 'sqrt', 'bootstrap': False, 'criterion': 'squared_error'}. Best is trial 341 with value: 0.2909369124469028.
[I 2024-12-04 12:01:07,805] Trial 417 finished with value: 0.31950439887971094 and parameters: {'n_estimators': 343, 'max_depth': 41, 'min_samples_split': 5, 'min_samples_leaf': 1, 'max_features': 'sqrt', 'bootstrap': False, 'criterion': 'squared_error'}. Best is trial 341 with value: 0.2909369124469028.
[I 2024-12-04 12:01:07,829] Trial 410 finished with value: 0.31075913666131544 and parameters: {'n_estimators': 253, 'max_depth': 41, 'min_samples_split': 2, 'min_samples_leaf': 1, 'max_features': 'sqrt', 'bootstrap': False, 'criterion': 'squared_error'}. Best is trial 341 with value: 0.2909369124469028.
[I 2024-12-04 12:01:09,305] Trial 395 finished with value: 0.802684428609083 and parameters: {'n_estimators': 950, 'max_depth': 28, 'min_samples_split': 11, 'min_samples_leaf': 3, 'max_features': 'log2', 'bootstrap': False, 'criterion': 'absolute_error'}. Best is trial 341 with value: 0.2909369124469028.
[I 2024-12-04 12:01:09,481] Trial 422 finished with value: 0.5439538674007751 and parameters: {'n_estimators': 189, 'max_depth': 28, 'min_samples_split': 36, 'min_samples_leaf': 13, 'max_features': None, 'bootstrap': True, 'criterion': 'squared_error'}. Best is trial 341 with value: 0.2909369124469028.
[I 2024-12-04 12:01:11,087] Trial 423 finished with value: 0.3037075540711571 and parameters: {'n_estimators': 119, 'max_depth': 50, 'min_samples_split': 5, 'min_samples_leaf': 1, 'max_features': 'sqrt', 'bootstrap': False, 'criterion': 'squared_error'}. Best is trial 341 with value: 0.2909369124469028.
[I 2024-12-04 12:01:11,307] Trial 424 finished with value: 0.9237231693808307 and parameters: {'n_estimators': 437, 'max_depth': 25, 'min_samples_split': 13, 'min_samples_leaf': 7, 'max_features': 'log2', 'bootstrap': False, 'criterion': 'squared_error'}. Best is trial 341 with value: 0.2909369124469028.
[I 2024-12-04 12:01:11,350] Trial 238 finished with value: 0.33103280202001095 and parameters: {'n_estimators': 971, 'max_depth': 41, 'min_samples_split': 4, 'min_samples_leaf': 1, 'max_features': None, 'bootstrap': True, 'criterion': 'absolute_error'}. Best is trial 341 with value: 0.2909369124469028.
[I 2024-12-04 12:01:12,615] Trial 430 finished with value: 0.29734934020946374 and parameters: {'n_estimators': 183, 'max_depth': 50, 'min_samples_split': 2, 'min_samples_leaf': 1, 'max_features': 'sqrt', 'bootstrap': False, 'criterion': 'squared_error'}. Best is trial 341 with value: 0.2909369124469028.
[I 2024-12-04 12:01:12,867] Trial 429 finished with value: 0.42463628460207775 and parameters: {'n_estimators': 126, 'max_depth': 12, 'min_samples_split': 2, 'min_samples_leaf': 5, 'max_features': None, 'bootstrap': True, 'criterion': 'squared_error'}. Best is trial 341 with value: 0.2909369124469028.
[I 2024-12-04 12:01:13,076] Trial 421 finished with value: 0.29518625982515956 and parameters: {'n_estimators': 327, 'max_depth': 50, 'min_samples_split': 3, 'min_samples_leaf': 1, 'max_features': 'sqrt', 'bootstrap': False, 'criterion': 'squared_error'}. Best is trial 341 with value: 0.2909369124469028.
[I 2024-12-04 12:01:13,991] Trial 425 finished with value: 0.3108471652203261 and parameters: {'n_estimators': 131, 'max_depth': 49, 'min_samples_split': 4, 'min_samples_leaf': 1, 'max_features': 'sqrt', 'bootstrap': False, 'criterion': 'absolute_error'}. Best is trial 341 with value: 0.2909369124469028.
[I 2024-12-04 12:01:14,008] Trial 412 finished with value: 0.6219586113136389 and parameters: {'n_estimators': 396, 'max_depth': 24, 'min_samples_split': 18, 'min_samples_leaf': 1, 'max_features': 'log2', 'bootstrap': True, 'criterion': 'absolute_error'}. Best is trial 341 with value: 0.2909369124469028.
[I 2024-12-04 12:01:14,165] Trial 428 finished with value: 0.29424172030748447 and parameters: {'n_estimators': 106, 'max_depth': 50, 'min_samples_split': 3, 'min_samples_leaf': 1, 'max_features': 'sqrt', 'bootstrap': False, 'criterion': 'squared_error'}. Best is trial 341 with value: 0.2909369124469028.
[I 2024-12-04 12:01:14,763] Trial 419 finished with value: 0.6832618743475886 and parameters: {'n_estimators': 217, 'max_depth': 9, 'min_samples_split': 9, 'min_samples_leaf': 1, 'max_features': 'sqrt', 'bootstrap': False, 'criterion': 'absolute_error'}. Best is trial 341 with value: 0.2909369124469028.
[I 2024-12-04 12:01:14,805] Trial 432 finished with value: 0.29407173570881406 and parameters: {'n_estimators': 190, 'max_depth': 50, 'min_samples_split': 3, 'min_samples_leaf': 1, 'max_features': 'sqrt', 'bootstrap': False, 'criterion': 'squared_error'}. Best is trial 341 with value: 0.2909369124469028.
[I 2024-12-04 12:01:14,945] Trial 434 finished with value: 0.29878450527997863 and parameters: {'n_estimators': 174, 'max_depth': 42, 'min_samples_split': 3, 'min_samples_leaf': 1, 'max_features': 'sqrt', 'bootstrap': False, 'criterion': 'squared_error'}. Best is trial 341 with value: 0.2909369124469028.
[I 2024-12-04 12:01:15,127] Trial 427 finished with value: 0.3771436415399305 and parameters: {'n_estimators': 337, 'max_depth': 50, 'min_samples_split': 3, 'min_samples_leaf': 1, 'max_features': 'log2', 'bootstrap': False, 'criterion': 'squared_error'}. Best is trial 341 with value: 0.2909369124469028.
[I 2024-12-04 12:01:16,469] Trial 431 finished with value: 0.29232052109686535 and parameters: {'n_estimators': 154, 'max_depth': 49, 'min_samples_split': 3, 'min_samples_leaf': 1, 'max_features': 'sqrt', 'bootstrap': False, 'criterion': 'squared_error'}. Best is trial 341 with value: 0.2909369124469028.
[I 2024-12-04 12:01:16,871] Trial 437 finished with value: 0.3268744674180987 and parameters: {'n_estimators': 188, 'max_depth': 39, 'min_samples_split': 5, 'min_samples_leaf': 1, 'max_features': 'sqrt', 'bootstrap': False, 'criterion': 'squared_error'}. Best is trial 341 with value: 0.2909369124469028.
[I 2024-12-04 12:01:17,334] Trial 443 finished with value: 0.3047013942125433 and parameters: {'n_estimators': 109, 'max_depth': 49, 'min_samples_split': 4, 'min_samples_leaf': 1, 'max_features': 'sqrt', 'bootstrap': False, 'criterion': 'squared_error'}. Best is trial 341 with value: 0.2909369124469028.
[I 2024-12-04 12:01:17,343] Trial 415 finished with value: 0.5432420914022713 and parameters: {'n_estimators': 458, 'max_depth': 5, 'min_samples_split': 2, 'min_samples_leaf': 12, 'max_features': None, 'bootstrap': True, 'criterion': 'absolute_error'}. Best is trial 341 with value: 0.2909369124469028.
