[I 2024-12-04 20:26:59,434] Trial 1451 finished with value: 0.35921124085103034 and parameters: {'kernel_type': 'Matern', 'length_scale': 50.1658947017044, 'noise_level': 0.8342652522467309, 'constant_value': 16109.599554854341, 'nu': 0.5}. Best is trial 881 with value: 0.35916990930150405.
[I 2024-12-04 20:27:01,309] Trial 1450 finished with value: 0.4286835140233293 and parameters: {'kernel_type': 'RBF', 'length_scale': 0.9871061403173288, 'noise_level': 5.259058979533993e-05, 'constant_value': 16.451999024808295, 'nu': 0.5}. Best is trial 881 with value: 0.35916990930150405.
[I 2024-12-04 20:27:03,284] Trial 1449 finished with value: 0.35921234808597746 and parameters: {'kernel_type': 'Matern', 'length_scale': 0.09104715662219921, 'noise_level': 3.910444872685978e-05, 'constant_value': 0.08027339797961566, 'nu': 0.5}. Best is trial 881 with value: 0.35916990930150405.
[I 2024-12-04 20:27:04,851] Trial 1452 finished with value: 0.35921125677630467 and parameters: {'kernel_type': 'Matern', 'length_scale': 34.69987587429243, 'noise_level': 0.9745881778734383, 'constant_value': 13.177166095163015, 'nu': 0.5}. Best is trial 881 with value: 0.35916990930150405.
[I 2024-12-04 20:27:07,402] Trial 1453 finished with value: 0.359211251943435 and parameters: {'kernel_type': 'Matern', 'length_scale': 5401.036963140244, 'noise_level': 0.7293654890649183, 'constant_value': 1.2219229704513799, 'nu': 0.5}. Best is trial 881 with value: 0.35916990930150405.
[I 2024-12-04 20:27:07,488] Trial 1454 finished with value: 1.0916567284756367 and parameters: {'kernel_type': 'Matern', 'length_scale': 4.31036664663303, 'noise_level': 3.315587551491945e-05, 'constant_value': 999.887467947763, 'nu': 1.5}. Best is trial 881 with value: 0.35916990930150405.
[I 2024-12-04 20:27:10,671] Trial 1455 finished with value: 0.3592115393159131 and parameters: {'kernel_type': 'Matern', 'length_scale': 1031.2782696436018, 'noise_level': 0.00031210290876880877, 'constant_value': 65.54390125657189, 'nu': 0.5}. Best is trial 881 with value: 0.35916990930150405.
[I 2024-12-04 20:27:11,409] Trial 1457 finished with value: 1.0624161174288298 and parameters: {'kernel_type': 'Matern', 'length_scale': 0.03712600821271121, 'noise_level': 0.025347147751832787, 'constant_value': 257.5107306862974, 'nu': 0.5}. Best is trial 881 with value: 0.35916990930150405.
[I 2024-12-04 20:27:13,256] Trial 1456 finished with value: 0.35921133750777584 and parameters: {'kernel_type': 'Matern', 'length_scale': 1.3757425457809098, 'noise_level': 0.023077413083883044, 'constant_value': 1145.4145855286095, 'nu': 0.5}. Best is trial 881 with value: 0.35916990930150405.
[I 2024-12-04 20:27:16,677] Trial 1459 finished with value: 0.3592112120969984 and parameters: {'kernel_type': 'Matern', 'length_scale': 13.031082525301585, 'noise_level': 0.000636226348471325, 'constant_value': 1.0595302868027516, 'nu': 0.5}. Best is trial 881 with value: 0.35916990930150405.
[I 2024-12-04 20:27:16,851] Trial 1458 finished with value: 1.0624161172685103 and parameters: {'kernel_type': 'Matern', 'length_scale': 1733.8048469059522, 'noise_level': 0.010462722725790673, 'constant_value': 0.1016477684467637, 'nu': 0.5}. Best is trial 881 with value: 0.35916990930150405.
[I 2024-12-04 20:27:18,635] Trial 1460 finished with value: 0.3592112172479542 and parameters: {'kernel_type': 'Matern', 'length_scale': 222.25442687466344, 'noise_level': 0.8545464083429939, 'constant_value': 932.4020390667982, 'nu': 0.5}. Best is trial 881 with value: 0.35916990930150405.
[I 2024-12-04 20:27:22,371] Trial 1461 finished with value: 0.359211967248116 and parameters: {'kernel_type': 'Matern', 'length_scale': 48.87674702795459, 'noise_level': 0.017662964703844847, 'constant_value': 547.7205452117338, 'nu': 0.5}. Best is trial 881 with value: 0.35916990930150405.
[I 2024-12-04 20:27:22,465] Trial 1463 finished with value: 1.0624161172772049 and parameters: {'kernel_type': 'Matern', 'length_scale': 0.003666653328872119, 'noise_level': 0.8366806444621588, 'constant_value': 18698.672195370706, 'nu': 2.5}. Best is trial 881 with value: 0.35916990930150405.
[I 2024-12-04 20:27:23,055] Trial 1462 finished with value: 1.062416117416109 and parameters: {'kernel_type': 'Matern', 'length_scale': 88.83754888582139, 'noise_level': 0.002292445259715401, 'constant_value': 0.347336052553862, 'nu': 1.5}. Best is trial 881 with value: 0.35916990930150405.
[I 2024-12-04 20:27:27,424] Trial 1464 finished with value: 0.35920786338203226 and parameters: {'kernel_type': 'Matern', 'length_scale': 661.6207023001516, 'noise_level': 0.023901351470896393, 'constant_value': 898.664370892784, 'nu': 0.5}. Best is trial 881 with value: 0.35916990930150405.
[I 2024-12-04 20:27:27,591] Trial 1465 finished with value: 0.35921126477082566 and parameters: {'kernel_type': 'Matern', 'length_scale': 16.6956634128476, 'noise_level': 0.06179221058467002, 'constant_value': 2.9332760140876775, 'nu': 0.5}. Best is trial 881 with value: 0.35916990930150405.
[I 2024-12-04 20:27:30,884] Trial 1466 finished with value: 0.35921140382179073 and parameters: {'kernel_type': 'Matern', 'length_scale': 0.1366312266529941, 'noise_level': 0.06471733463509727, 'constant_value': 9641.68821018733, 'nu': 0.5}. Best is trial 881 with value: 0.35916990930150405.
[I 2024-12-04 20:27:32,994] Trial 1467 finished with value: 0.35921116175217166 and parameters: {'kernel_type': 'Matern', 'length_scale': 4194.038208406081, 'noise_level': 0.005885921815523235, 'constant_value': 871.3358374469093, 'nu': 0.5}. Best is trial 881 with value: 0.35916990930150405.
[I 2024-12-04 20:27:33,180] Trial 1468 finished with value: 0.3592112168918585 and parameters: {'kernel_type': 'Matern', 'length_scale': 43.73984595691403, 'noise_level': 0.034708884796554255, 'constant_value': 59230.142409935776, 'nu': 0.5}. Best is trial 881 with value: 0.35916990930150405.
[I 2024-12-04 20:27:36,183] Trial 1469 finished with value: 0.35921123263358135 and parameters: {'kernel_type': 'Matern', 'length_scale': 339.81934201049813, 'noise_level': 0.0006984700673555883, 'constant_value': 308.6963772346313, 'nu': 0.5}. Best is trial 881 with value: 0.35916990930150405.
[I 2024-12-04 20:27:38,066] Trial 1471 finished with value: 0.3592112409193756 and parameters: {'kernel_type': 'Matern', 'length_scale': 981.4094380578044, 'noise_level': 0.00321346974164723, 'constant_value': 11477.82829260014, 'nu': 0.5}. Best is trial 881 with value: 0.35916990930150405.
[I 2024-12-04 20:27:39,223] Trial 1470 finished with value: 0.3592112912196695 and parameters: {'kernel_type': 'Matern', 'length_scale': 1420.3996279732633, 'noise_level': 0.015343653020076481, 'constant_value': 24918.134144041964, 'nu': 0.5}. Best is trial 881 with value: 0.35916990930150405.
[I 2024-12-04 20:27:41,864] Trial 1472 finished with value: 0.359211222218508 and parameters: {'kernel_type': 'Matern', 'length_scale': 15721.266345809227, 'noise_level': 0.0036892533343208457, 'constant_value': 44502.53513478099, 'nu': 0.5}. Best is trial 881 with value: 0.35916990930150405.
[I 2024-12-04 20:27:43,068] Trial 1473 finished with value: 0.3592111477741426 and parameters: {'kernel_type': 'Matern', 'length_scale': 2.0084687954130036, 'noise_level': 0.0009465786950586487, 'constant_value': 298.29809058981397, 'nu': 0.5}. Best is trial 881 with value: 0.35916990930150405.
[I 2024-12-04 20:27:44,928] Trial 1474 finished with value: 0.35921123989773507 and parameters: {'kernel_type': 'Matern', 'length_scale': 1565.9137808641308, 'noise_level': 0.00038993902520706, 'constant_value': 38.18885698951892, 'nu': 0.5}. Best is trial 881 with value: 0.35916990930150405.
[I 2024-12-04 20:27:48,067] Trial 1475 finished with value: 0.359211231685224 and parameters: {'kernel_type': 'Matern', 'length_scale': 33859.09243137718, 'noise_level': 0.005511536826875305, 'constant_value': 270.8148293531526, 'nu': 0.5}. Best is trial 881 with value: 0.35916990930150405.
[I 2024-12-04 20:27:48,662] Trial 1476 finished with value: 0.35921127007351944 and parameters: {'kernel_type': 'Matern', 'length_scale': 51.92771472685621, 'noise_level': 0.00604480545122559, 'constant_value': 86.78273426914666, 'nu': 0.5}. Best is trial 881 with value: 0.35916990930150405.
[I 2024-12-04 20:27:50,575] Trial 1477 finished with value: 0.3592113393129728 and parameters: {'kernel_type': 'Matern', 'length_scale': 180.79065273203855, 'noise_level': 0.14761029076824633, 'constant_value': 2834.324809303788, 'nu': 0.5}. Best is trial 881 with value: 0.35916990930150405.
[I 2024-12-04 20:27:51,902] Trial 1479 finished with value: 1.062416117881199 and parameters: {'kernel_type': 'RBF', 'length_scale': 0.0025516957824347234, 'noise_level': 0.007022892443295533, 'constant_value': 0.0765345039804976, 'nu': 0.5}. Best is trial 881 with value: 0.35916990930150405.
[I 2024-12-04 20:27:53,993] Trial 1478 finished with value: 0.3592115118674762 and parameters: {'kernel_type': 'Matern', 'length_scale': 117.1493532044401, 'noise_level': 0.032464844008698056, 'constant_value': 1096.5108417308047, 'nu': 0.5}. Best is trial 881 with value: 0.35916990930150405.
[I 2024-12-04 20:27:55,146] Trial 1480 finished with value: 0.3592114249143729 and parameters: {'kernel_type': 'Matern', 'length_scale': 0.8304679659878221, 'noise_level': 0.05881710118344338, 'constant_value': 67.57421228082966, 'nu': 0.5}. Best is trial 881 with value: 0.35916990930150405.
[I 2024-12-04 20:27:58,307] Trial 1481 finished with value: 0.3592112403704742 and parameters: {'kernel_type': 'Matern', 'length_scale': 3451.7323618971186, 'noise_level': 0.0003852094031380037, 'constant_value': 10077.78383439782, 'nu': 0.5}. Best is trial 881 with value: 0.35916990930150405.
[I 2024-12-04 20:27:58,660] Trial 1482 finished with value: 0.3592111938772524 and parameters: {'kernel_type': 'Matern', 'length_scale': 133.3070401383315, 'noise_level': 0.02897573208216037, 'constant_value': 227.9746465455177, 'nu': 0.5}. Best is trial 881 with value: 0.35916990930150405.
[I 2024-12-04 20:28:00,225] Trial 1483 finished with value: 0.3592112865997784 and parameters: {'kernel_type': 'Matern', 'length_scale': 53.68143898772976, 'noise_level': 0.0002758724002651648, 'constant_value': 320.5572890506725, 'nu': 0.5}. Best is trial 881 with value: 0.35916990930150405.
[I 2024-12-04 20:28:02,850] Trial 1484 finished with value: 0.35921174551109153 and parameters: {'kernel_type': 'Matern', 'length_scale': 8.023109436839716, 'noise_level': 0.0005690536665548752, 'constant_value': 9.775454568586106, 'nu': 0.5}. Best is trial 881 with value: 0.35916990930150405.
[I 2024-12-04 20:28:04,303] Trial 1485 finished with value: 0.35921125368826834 and parameters: {'kernel_type': 'Matern', 'length_scale': 1798.4801523748583, 'noise_level': 0.004266914045676486, 'constant_value': 874.9694145025842, 'nu': 0.5}. Best is trial 881 with value: 0.35916990930150405.
[I 2024-12-04 20:28:05,728] Trial 1486 finished with value: 0.3592112624010598 and parameters: {'kernel_type': 'Matern', 'length_scale': 2.2348364168829242, 'noise_level': 0.0037853190783825683, 'constant_value': 71895.14170967616, 'nu': 0.5}. Best is trial 881 with value: 0.35916990930150405.
[I 2024-12-04 20:28:08,002] Trial 1488 finished with value: 1.0624161143558317 and parameters: {'kernel_type': 'Matern', 'length_scale': 0.052286701158304034, 'noise_level': 0.0012386094914221637, 'constant_value': 74.5273276780551, 'nu': 0.5}. Best is trial 881 with value: 0.35916990930150405.
[I 2024-12-04 20:28:08,004] Trial 1487 finished with value: 0.35921122565438457 and parameters: {'kernel_type': 'Matern', 'length_scale': 1.7624100710282842, 'noise_level': 0.03821040722211723, 'constant_value': 1353.2626674232238, 'nu': 0.5}. Best is trial 881 with value: 0.35916990930150405.
[I 2024-12-04 20:28:12,182] Trial 1489 finished with value: 0.3592106616009823 and parameters: {'kernel_type': 'Matern', 'length_scale': 20.803685253876512, 'noise_level': 0.00961514629554016, 'constant_value': 718.4240645753895, 'nu': 0.5}. Best is trial 881 with value: 0.35916990930150405.
[I 2024-12-04 20:28:13,708] Trial 1490 finished with value: 0.3592112008267547 and parameters: {'kernel_type': 'Matern', 'length_scale': 425.13729752970846, 'noise_level': 0.021227779902536586, 'constant_value': 730.1520515102515, 'nu': 0.5}. Best is trial 881 with value: 0.35916990930150405.
[I 2024-12-04 20:28:14,046] Trial 1491 finished with value: 0.35921125058303316 and parameters: {'kernel_type': 'Matern', 'length_scale': 421.6842500920464, 'noise_level': 0.005203638831590634, 'constant_value': 364.55156358189447, 'nu': 0.5}. Best is trial 881 with value: 0.35916990930150405.
[I 2024-12-04 20:28:17,417] Trial 1494 finished with value: 1.0624161170671382 and parameters: {'kernel_type': 'Matern', 'length_scale': 336.54733591985985, 'noise_level': 0.00025291476926237203, 'constant_value': 1.7969591820009427, 'nu': 0.5}. Best is trial 881 with value: 0.35916990930150405.
[I 2024-12-04 20:28:18,262] Trial 1492 finished with value: 0.3592126789226014 and parameters: {'kernel_type': 'Matern', 'length_scale': 0.262086348755077, 'noise_level': 0.1808804008390629, 'constant_value': 1.4728444187938439, 'nu': 0.5}. Best is trial 881 with value: 0.35916990930150405.
[I 2024-12-04 20:28:19,464] Trial 1493 finished with value: 0.35921130316253996 and parameters: {'kernel_type': 'Matern', 'length_scale': 1.5965684474522903, 'noise_level': 0.5956176939685061, 'constant_value': 12967.67842301116, 'nu': 0.5}. Best is trial 881 with value: 0.35916990930150405.
[I 2024-12-04 20:28:22,955] Trial 1495 finished with value: 0.3592112556721998 and parameters: {'kernel_type': 'Matern', 'length_scale': 0.8969557398396463, 'noise_level': 0.0001402091792269045, 'constant_value': 4.092822590695764, 'nu': 0.5}. Best is trial 881 with value: 0.35916990930150405.
[I 2024-12-04 20:28:24,006] Trial 1496 finished with value: 1.0624161172692177 and parameters: {'kernel_type': 'Matern', 'length_scale': 64.29977424510831, 'noise_level': 0.00047993420974253037, 'constant_value': 0.02304361558679562, 'nu': 0.5}. Best is trial 881 with value: 0.35916990930150405.
[I 2024-12-04 20:28:24,524] Trial 1497 finished with value: 0.3592119026309808 and parameters: {'kernel_type': 'Matern', 'length_scale': 4.027524843139213, 'noise_level': 0.031605140823540406, 'constant_value': 96209.56742039409, 'nu': 0.5}. Best is trial 881 with value: 0.35916990930150405.
[I 2024-12-04 20:28:28,329] Trial 1500 finished with value: 1.0624161029067074 and parameters: {'kernel_type': 'Matern', 'length_scale': 0.05710392085731219, 'noise_level': 0.03378196297172493, 'constant_value': 1017.0961611365701, 'nu': 0.5}. Best is trial 881 with value: 0.35916990930150405.
[I 2024-12-04 20:28:28,586] Trial 1498 finished with value: 0.35921125538110477 and parameters: {'kernel_type': 'Matern', 'length_scale': 1090.2343268718605, 'noise_level': 0.08688818145446427, 'constant_value': 3885.055621970711, 'nu': 0.5}. Best is trial 881 with value: 0.35916990930150405.
[I 2024-12-04 20:28:29,641] Trial 1499 finished with value: 0.35921143320085075 and parameters: {'kernel_type': 'Matern', 'length_scale': 165.7458825675461, 'noise_level': 0.06338918343756653, 'constant_value': 88865.2785639928, 'nu': 0.5}. Best is trial 881 with value: 0.35916990930150405.
[I 2024-12-04 20:28:32,610] Trial 1501 finished with value: 1.0624161173991533 and parameters: {'kernel_type': 'Matern', 'length_scale': 0.01657859381675648, 'noise_level': 0.003119762753622298, 'constant_value': 1.0577775029125396, 'nu': 0.5}. Best is trial 881 with value: 0.35916990930150405.
[I 2024-12-04 20:28:34,328] Trial 1502 finished with value: 0.3592109807560783 and parameters: {'kernel_type': 'Matern', 'length_scale': 4.505559945229307, 'noise_level': 0.0027869556903057655, 'constant_value': 1753.357160148165, 'nu': 0.5}. Best is trial 881 with value: 0.35916990930150405.
[I 2024-12-04 20:28:36,082] Trial 1503 finished with value: 0.35921116212344406 and parameters: {'kernel_type': 'Matern', 'length_scale': 19.615459933910746, 'noise_level': 0.032013344019037396, 'constant_value': 116.54156940829803, 'nu': 0.5}. Best is trial 881 with value: 0.35916990930150405.
[I 2024-12-04 20:28:41,627] Trial 1504 finished with value: 1.0624161171576236 and parameters: {'kernel_type': 'RBF', 'length_scale': 618.0794772753836, 'noise_level': 0.004750035775822587, 'constant_value': 17.60301019836084, 'nu': 0.5}. Best is trial 881 with value: 0.35916990930150405.
[I 2024-12-04 20:28:41,724] Trial 1506 finished with value: 1.0624161171510416 and parameters: {'kernel_type': 'Matern', 'length_scale': 0.006551128856729254, 'noise_level': 0.0005399875893792194, 'constant_value': 0.05686601876051589, 'nu': 0.5}. Best is trial 881 with value: 0.35916990930150405.
[I 2024-12-04 20:28:44,244] Trial 1505 finished with value: 1.0624161172589686 and parameters: {'kernel_type': 'RBF', 'length_scale': 166.5807110244357, 'noise_level': 0.007218054943708403, 'constant_value': 0.21130860796080336, 'nu': 0.5}. Best is trial 881 with value: 0.35916990930150405.
[I 2024-12-04 20:28:47,591] Trial 1508 finished with value: 1.0624161134096917 and parameters: {'kernel_type': 'RBF', 'length_scale': 0.16297068153549218, 'noise_level': 0.01683835802102212, 'constant_value': 42.294170778673866, 'nu': 0.5}. Best is trial 881 with value: 0.35916990930150405.
[I 2024-12-04 20:28:49,795] Trial 1507 finished with value: 0.359211201887513 and parameters: {'kernel_type': 'Matern', 'length_scale': 3.9858376667456077, 'noise_level': 0.02317879761686232, 'constant_value': 3.39654738465338, 'nu': 0.5}. Best is trial 881 with value: 0.35916990930150405.
[I 2024-12-04 20:28:54,934] Trial 1510 finished with value: 1.0624160795435034 and parameters: {'kernel_type': 'RBF', 'length_scale': 0.1738710628028356, 'noise_level': 0.9517900954402311, 'constant_value': 1.2600227520333407, 'nu': 2.5}. Best is trial 881 with value: 0.35916990930150405.
[I 2024-12-04 20:28:59,354] Trial 1512 finished with value: 0.3592112537552099 and parameters: {'kernel_type': 'Matern', 'length_scale': 37.58109915155459, 'noise_level': 0.007646188942359754, 'constant_value': 1.0697777540738926, 'nu': 0.5}. Best is trial 881 with value: 0.35916990930150405.
[I 2024-12-04 20:29:00,001] Trial 1511 finished with value: 0.35921125935206866 and parameters: {'kernel_type': 'Matern', 'length_scale': 0.1570267763787086, 'noise_level': 0.92761694873896, 'constant_value': 13.604217917930706, 'nu': 0.5}. Best is trial 881 with value: 0.35916990930150405.
[I 2024-12-04 20:29:01,205] Trial 1509 finished with value: 1.0624161177652358 and parameters: {'kernel_type': 'RBF', 'length_scale': 24161.458582088297, 'noise_level': 3.9119551489644415e-10, 'constant_value': 3.614042163938278e-05, 'nu': 0.5}. Best is trial 881 with value: 0.35916990930150405.
[I 2024-12-04 20:29:04,239] Trial 1514 finished with value: 1.0624161166239476 and parameters: {'kernel_type': 'Matern', 'length_scale': 5712.886955617515, 'noise_level': 5.569564188376348e-05, 'constant_value': 0.866964693786065, 'nu': 0.5}. Best is trial 881 with value: 0.35916990930150405.
[I 2024-12-04 20:29:05,618] Trial 1513 finished with value: 0.3592112489682176 and parameters: {'kernel_type': 'Matern', 'length_scale': 0.26801447061423606, 'noise_level': 0.7953484320217606, 'constant_value': 938.6414011693797, 'nu': 0.5}. Best is trial 881 with value: 0.35916990930150405.
[I 2024-12-04 20:29:07,040] Trial 1515 finished with value: 1.062416117276469 and parameters: {'kernel_type': 'Matern', 'length_scale': 8010.888776637743, 'noise_level': 0.004107627564047058, 'constant_value': 16.9859764984708, 'nu': 0.5}. Best is trial 881 with value: 0.35916990930150405.
[I 2024-12-04 20:29:08,722] Trial 1516 finished with value: 0.3592109162890854 and parameters: {'kernel_type': 'Matern', 'length_scale': 4.42346000461194, 'noise_level': 0.0026249719734673374, 'constant_value': 44.94624530106953, 'nu': 0.5}. Best is trial 881 with value: 0.35916990930150405.
[I 2024-12-04 20:29:09,901] Trial 1517 finished with value: 0.359211023785721 and parameters: {'kernel_type': 'Matern', 'length_scale': 13.11622771074957, 'noise_level': 0.0017030245819438534, 'constant_value': 582.4458054004509, 'nu': 0.5}. Best is trial 881 with value: 0.35916990930150405.
[I 2024-12-04 20:29:15,245] Trial 1518 finished with value: 0.35921127522211044 and parameters: {'kernel_type': 'Matern', 'length_scale': 4.867813068790241, 'noise_level': 0.8616665010570684, 'constant_value': 750.8745496593024, 'nu': 0.5}. Best is trial 881 with value: 0.35916990930150405.
[I 2024-12-04 20:29:17,935] Trial 1520 finished with value: 1.0916558493684274 and parameters: {'kernel_type': 'Matern', 'length_scale': 0.008763756338536665, 'noise_level': 0.004822026591360246, 'constant_value': 28604.053932243536, 'nu': 0.5}. Best is trial 881 with value: 0.35916990930150405.
[I 2024-12-04 20:29:18,207] Trial 1519 finished with value: 0.4286835249133163 and parameters: {'kernel_type': 'RBF', 'length_scale': 0.46886684117107075, 'noise_level': 0.4337753341515711, 'constant_value': 0.06550130568590821, 'nu': 1.5}. Best is trial 881 with value: 0.35916990930150405.
[I 2024-12-04 20:29:22,039] Trial 1521 finished with value: 0.35921159470009884 and parameters: {'kernel_type': 'Matern', 'length_scale': 365.2726499322545, 'noise_level': 0.009553991199624239, 'constant_value': 14.371843270730727, 'nu': 0.5}. Best is trial 881 with value: 0.35916990930150405.
[I 2024-12-04 20:29:22,367] Trial 1523 finished with value: 0.35921121776644976 and parameters: {'kernel_type': 'Matern', 'length_scale': 16.020754919984814, 'noise_level': 0.024605150532250097, 'constant_value': 23.83923282580378, 'nu': 0.5}. Best is trial 881 with value: 0.35916990930150405.
