[I 2024-12-04 20:04:31,477] Trial 758 finished with value: 0.6691273380893594 and parameters: {'n_estimators': 437, 'max_depth': 46, 'min_samples_split': 43, 'min_samples_leaf': 1, 'max_features': 'sqrt', 'bootstrap': False, 'criterion': 'squared_error'}. Best is trial 457 with value: 0.3223992246327795.
[I 2024-12-04 20:04:32,676] Trial 759 finished with value: 0.676820525564662 and parameters: {'n_estimators': 376, 'max_depth': 48, 'min_samples_split': 4, 'min_samples_leaf': 2, 'max_features': 'sqrt', 'bootstrap': False, 'criterion': 'squared_error'}. Best is trial 457 with value: 0.3223992246327795.
[I 2024-12-04 20:04:34,530] Trial 749 finished with value: 0.6428552589485522 and parameters: {'n_estimators': 656, 'max_depth': 9, 'min_samples_split': 7, 'min_samples_leaf': 12, 'max_features': None, 'bootstrap': False, 'criterion': 'absolute_error'}. Best is trial 457 with value: 0.3223992246327795.
[I 2024-12-04 20:04:35,405] Trial 760 finished with value: 0.32785507889898685 and parameters: {'n_estimators': 568, 'max_depth': 50, 'min_samples_split': 2, 'min_samples_leaf': 1, 'max_features': 'sqrt', 'bootstrap': False, 'criterion': 'squared_error'}. Best is trial 457 with value: 0.3223992246327795.
[I 2024-12-04 20:04:35,900] Trial 761 finished with value: 0.3251356458239662 and parameters: {'n_estimators': 182, 'max_depth': 50, 'min_samples_split': 2, 'min_samples_leaf': 1, 'max_features': 'sqrt', 'bootstrap': False, 'criterion': 'squared_error'}. Best is trial 457 with value: 0.3223992246327795.
[I 2024-12-04 20:04:37,385] Trial 762 finished with value: 0.39171632611719615 and parameters: {'n_estimators': 490, 'max_depth': 50, 'min_samples_split': 4, 'min_samples_leaf': 1, 'max_features': 'sqrt', 'bootstrap': False, 'criterion': 'squared_error'}. Best is trial 457 with value: 0.3223992246327795.
[I 2024-12-04 20:04:39,110] Trial 764 finished with value: 0.32432958404010126 and parameters: {'n_estimators': 308, 'max_depth': 50, 'min_samples_split': 2, 'min_samples_leaf': 1, 'max_features': 'sqrt', 'bootstrap': False, 'criterion': 'squared_error'}. Best is trial 457 with value: 0.3223992246327795.
[I 2024-12-04 20:04:40,561] Trial 765 finished with value: 0.4106741004350085 and parameters: {'n_estimators': 360, 'max_depth': 41, 'min_samples_split': 4, 'min_samples_leaf': 1, 'max_features': 'sqrt', 'bootstrap': False, 'criterion': 'squared_error'}. Best is trial 457 with value: 0.3223992246327795.
[I 2024-12-04 20:04:41,587] Trial 766 finished with value: 0.398383539783632 and parameters: {'n_estimators': 107, 'max_depth': 39, 'min_samples_split': 2, 'min_samples_leaf': 1, 'max_features': 'sqrt', 'bootstrap': False, 'criterion': 'squared_error'}. Best is trial 457 with value: 0.3223992246327795.
[I 2024-12-04 20:04:43,245] Trial 767 finished with value: 1.0970266506262387 and parameters: {'n_estimators': 863, 'max_depth': 36, 'min_samples_split': 7, 'min_samples_leaf': 5, 'max_features': 'sqrt', 'bootstrap': True, 'criterion': 'squared_error'}. Best is trial 457 with value: 0.3223992246327795.
[I 2024-12-04 20:04:44,301] Trial 768 finished with value: 0.5067377844363379 and parameters: {'n_estimators': 114, 'max_depth': 29, 'min_samples_split': 2, 'min_samples_leaf': 4, 'max_features': None, 'bootstrap': True, 'criterion': 'squared_error'}. Best is trial 457 with value: 0.3223992246327795.
[I 2024-12-04 20:04:45,743] Trial 763 finished with value: 0.36841919565395703 and parameters: {'n_estimators': 393, 'max_depth': 50, 'min_samples_split': 3, 'min_samples_leaf': 1, 'max_features': 'sqrt', 'bootstrap': False, 'criterion': 'absolute_error'}. Best is trial 457 with value: 0.3223992246327795.
[I 2024-12-04 20:04:47,172] Trial 770 finished with value: 0.5840442825774529 and parameters: {'n_estimators': 137, 'max_depth': 23, 'min_samples_split': 9, 'min_samples_leaf': 6, 'max_features': None, 'bootstrap': False, 'criterion': 'squared_error'}. Best is trial 457 with value: 0.3223992246327795.
[I 2024-12-04 20:04:47,987] Trial 769 finished with value: 0.43364397062462257 and parameters: {'n_estimators': 344, 'max_depth': 49, 'min_samples_split': 2, 'min_samples_leaf': 1, 'max_features': None, 'bootstrap': False, 'criterion': 'squared_error'}. Best is trial 457 with value: 0.3223992246327795.
[I 2024-12-04 20:04:49,197] Trial 771 finished with value: 0.3221369243160699 and parameters: {'n_estimators': 348, 'max_depth': 50, 'min_samples_split': 2, 'min_samples_leaf': 1, 'max_features': 'sqrt', 'bootstrap': False, 'criterion': 'squared_error'}. Best is trial 771 with value: 0.3221369243160699.
[I 2024-12-04 20:04:50,644] Trial 773 finished with value: 0.4362657400784676 and parameters: {'n_estimators': 156, 'max_depth': 24, 'min_samples_split': 3, 'min_samples_leaf': 1, 'max_features': None, 'bootstrap': True, 'criterion': 'squared_error'}. Best is trial 771 with value: 0.3221369243160699.
[I 2024-12-04 20:04:51,164] Trial 772 finished with value: 0.5373542998016747 and parameters: {'n_estimators': 406, 'max_depth': 50, 'min_samples_split': 3, 'min_samples_leaf': 2, 'max_features': None, 'bootstrap': False, 'criterion': 'squared_error'}. Best is trial 771 with value: 0.3221369243160699.
[I 2024-12-04 20:04:52,127] Trial 774 finished with value: 0.6847990960302719 and parameters: {'n_estimators': 416, 'max_depth': 50, 'min_samples_split': 2, 'min_samples_leaf': 2, 'max_features': 'sqrt', 'bootstrap': False, 'criterion': 'squared_error'}. Best is trial 771 with value: 0.3221369243160699.
[I 2024-12-04 20:04:52,705] Trial 775 finished with value: 0.40855901769697417 and parameters: {'n_estimators': 273, 'max_depth': 42, 'min_samples_split': 4, 'min_samples_leaf': 1, 'max_features': 'sqrt', 'bootstrap': False, 'criterion': 'squared_error'}. Best is trial 771 with value: 0.3221369243160699.
[I 2024-12-04 20:04:53,869] Trial 777 finished with value: 0.6752771191620804 and parameters: {'n_estimators': 255, 'max_depth': 41, 'min_samples_split': 2, 'min_samples_leaf': 2, 'max_features': 'sqrt', 'bootstrap': False, 'criterion': 'squared_error'}. Best is trial 771 with value: 0.3221369243160699.
[I 2024-12-04 20:04:54,345] Trial 776 finished with value: 0.34843592213709645 and parameters: {'n_estimators': 380, 'max_depth': 43, 'min_samples_split': 2, 'min_samples_leaf': 1, 'max_features': 'sqrt', 'bootstrap': False, 'criterion': 'squared_error'}. Best is trial 771 with value: 0.3221369243160699.
[I 2024-12-04 20:04:55,027] Trial 778 finished with value: 1.1372788093411788 and parameters: {'n_estimators': 241, 'max_depth': 16, 'min_samples_split': 24, 'min_samples_leaf': 5, 'max_features': 'sqrt', 'bootstrap': True, 'criterion': 'squared_error'}. Best is trial 771 with value: 0.3221369243160699.
[I 2024-12-04 20:04:56,328] Trial 779 finished with value: 0.323498830228993 and parameters: {'n_estimators': 248, 'max_depth': 50, 'min_samples_split': 2, 'min_samples_leaf': 1, 'max_features': 'sqrt', 'bootstrap': False, 'criterion': 'squared_error'}. Best is trial 771 with value: 0.3221369243160699.
[I 2024-12-04 20:04:57,254] Trial 780 finished with value: 1.346081626358641 and parameters: {'n_estimators': 991, 'max_depth': 44, 'min_samples_split': 49, 'min_samples_leaf': 13, 'max_features': 'log2', 'bootstrap': True, 'criterion': 'absolute_error'}. Best is trial 771 with value: 0.3221369243160699.
[I 2024-12-04 20:04:58,150] Trial 781 finished with value: 0.3858182634454276 and parameters: {'n_estimators': 353, 'max_depth': 50, 'min_samples_split': 4, 'min_samples_leaf': 1, 'max_features': 'sqrt', 'bootstrap': False, 'criterion': 'squared_error'}. Best is trial 771 with value: 0.3221369243160699.
[I 2024-12-04 20:04:59,349] Trial 783 finished with value: 0.33609723495882526 and parameters: {'n_estimators': 147, 'max_depth': 50, 'min_samples_split': 2, 'min_samples_leaf': 1, 'max_features': 'sqrt', 'bootstrap': False, 'criterion': 'squared_error'}. Best is trial 771 with value: 0.3221369243160699.
[I 2024-12-04 20:05:00,315] Trial 782 finished with value: 1.3065473012856328 and parameters: {'n_estimators': 806, 'max_depth': 42, 'min_samples_split': 22, 'min_samples_leaf': 4, 'max_features': 'log2', 'bootstrap': False, 'criterion': 'absolute_error'}. Best is trial 771 with value: 0.3221369243160699.
[I 2024-12-04 20:05:00,836] Trial 784 finished with value: 0.3851721599907912 and parameters: {'n_estimators': 310, 'max_depth': 50, 'min_samples_split': 4, 'min_samples_leaf': 1, 'max_features': 'sqrt', 'bootstrap': False, 'criterion': 'squared_error'}. Best is trial 771 with value: 0.3221369243160699.
[I 2024-12-04 20:05:01,890] Trial 786 finished with value: 0.6660013623627633 and parameters: {'n_estimators': 182, 'max_depth': 41, 'min_samples_split': 4, 'min_samples_leaf': 2, 'max_features': 'sqrt', 'bootstrap': False, 'criterion': 'squared_error'}. Best is trial 771 with value: 0.3221369243160699.
[I 2024-12-04 20:05:02,158] Trial 785 finished with value: 0.324148867593595 and parameters: {'n_estimators': 307, 'max_depth': 50, 'min_samples_split': 2, 'min_samples_leaf': 1, 'max_features': 'sqrt', 'bootstrap': False, 'criterion': 'squared_error'}. Best is trial 771 with value: 0.3221369243160699.
[I 2024-12-04 20:05:04,104] Trial 787 finished with value: 0.35105784499140325 and parameters: {'n_estimators': 423, 'max_depth': 43, 'min_samples_split': 2, 'min_samples_leaf': 1, 'max_features': 'sqrt', 'bootstrap': False, 'criterion': 'squared_error'}. Best is trial 771 with value: 0.3221369243160699.
[I 2024-12-04 20:05:04,165] Trial 788 finished with value: 0.3463177718721637 and parameters: {'n_estimators': 362, 'max_depth': 43, 'min_samples_split': 2, 'min_samples_leaf': 1, 'max_features': 'sqrt', 'bootstrap': False, 'criterion': 'squared_error'}. Best is trial 771 with value: 0.3221369243160699.
[I 2024-12-04 20:05:05,181] Trial 757 finished with value: 0.6029892706712054 and parameters: {'n_estimators': 318, 'max_depth': 21, 'min_samples_split': 44, 'min_samples_leaf': 1, 'max_features': None, 'bootstrap': False, 'criterion': 'absolute_error'}. Best is trial 771 with value: 0.3221369243160699.
[I 2024-12-04 20:05:05,244] Trial 789 finished with value: 0.6515227566630162 and parameters: {'n_estimators': 169, 'max_depth': 50, 'min_samples_split': 2, 'min_samples_leaf': 2, 'max_features': 'sqrt', 'bootstrap': False, 'criterion': 'squared_error'}. Best is trial 771 with value: 0.3221369243160699.
[I 2024-12-04 20:05:05,557] Trial 790 finished with value: 0.6653393099200129 and parameters: {'n_estimators': 234, 'max_depth': 50, 'min_samples_split': 2, 'min_samples_leaf': 2, 'max_features': 'sqrt', 'bootstrap': False, 'criterion': 'squared_error'}. Best is trial 771 with value: 0.3221369243160699.
[I 2024-12-04 20:05:06,399] Trial 791 finished with value: 1.0813464574640577 and parameters: {'n_estimators': 181, 'max_depth': 47, 'min_samples_split': 2, 'min_samples_leaf': 2, 'max_features': 'log2', 'bootstrap': False, 'criterion': 'squared_error'}. Best is trial 771 with value: 0.3221369243160699.
[I 2024-12-04 20:05:07,809] Trial 792 finished with value: 0.4967707335451065 and parameters: {'n_estimators': 450, 'max_depth': 50, 'min_samples_split': 2, 'min_samples_leaf': 1, 'max_features': 'log2', 'bootstrap': False, 'criterion': 'squared_error'}. Best is trial 771 with value: 0.3221369243160699.
[I 2024-12-04 20:05:07,879] Trial 794 finished with value: 0.34878042056759667 and parameters: {'n_estimators': 226, 'max_depth': 41, 'min_samples_split': 2, 'min_samples_leaf': 1, 'max_features': 'sqrt', 'bootstrap': False, 'criterion': 'squared_error'}. Best is trial 771 with value: 0.3221369243160699.
[I 2024-12-04 20:05:08,033] Trial 793 finished with value: 0.32179807021578266 and parameters: {'n_estimators': 376, 'max_depth': 50, 'min_samples_split': 2, 'min_samples_leaf': 1, 'max_features': 'sqrt', 'bootstrap': False, 'criterion': 'squared_error'}. Best is trial 793 with value: 0.32179807021578266.
[I 2024-12-04 20:05:09,874] Trial 795 finished with value: 1.2748149137517975 and parameters: {'n_estimators': 727, 'max_depth': 6, 'min_samples_split': 13, 'min_samples_leaf': 9, 'max_features': 'log2', 'bootstrap': True, 'criterion': 'squared_error'}. Best is trial 793 with value: 0.32179807021578266.
[I 2024-12-04 20:05:09,937] Trial 796 finished with value: 0.6684289581828659 and parameters: {'n_estimators': 336, 'max_depth': 49, 'min_samples_split': 4, 'min_samples_leaf': 2, 'max_features': 'sqrt', 'bootstrap': False, 'criterion': 'squared_error'}. Best is trial 793 with value: 0.32179807021578266.
[I 2024-12-04 20:05:11,402] Trial 797 finished with value: 0.35721270295181085 and parameters: {'n_estimators': 482, 'max_depth': 42, 'min_samples_split': 2, 'min_samples_leaf': 1, 'max_features': 'sqrt', 'bootstrap': False, 'criterion': 'squared_error'}. Best is trial 793 with value: 0.32179807021578266.
[I 2024-12-04 20:05:12,893] Trial 798 finished with value: 0.3274312800271848 and parameters: {'n_estimators': 517, 'max_depth': 50, 'min_samples_split': 2, 'min_samples_leaf': 1, 'max_features': 'sqrt', 'bootstrap': False, 'criterion': 'squared_error'}. Best is trial 793 with value: 0.32179807021578266.
[I 2024-12-04 20:05:13,979] Trial 799 finished with value: 0.4724946674839936 and parameters: {'n_estimators': 612, 'max_depth': 33, 'min_samples_split': 9, 'min_samples_leaf': 1, 'max_features': None, 'bootstrap': True, 'criterion': 'squared_error'}. Best is trial 793 with value: 0.32179807021578266.
[I 2024-12-04 20:05:14,471] Trial 801 finished with value: 0.35583824525959257 and parameters: {'n_estimators': 289, 'max_depth': 50, 'min_samples_split': 3, 'min_samples_leaf': 1, 'max_features': 'sqrt', 'bootstrap': False, 'criterion': 'squared_error'}. Best is trial 793 with value: 0.32179807021578266.
[I 2024-12-04 20:05:15,851] Trial 802 finished with value: 0.3242568274330358 and parameters: {'n_estimators': 288, 'max_depth': 50, 'min_samples_split': 2, 'min_samples_leaf': 1, 'max_features': 'sqrt', 'bootstrap': False, 'criterion': 'squared_error'}. Best is trial 793 with value: 0.32179807021578266.
[I 2024-12-04 20:05:16,307] Trial 800 finished with value: 1.215554861467982 and parameters: {'n_estimators': 769, 'max_depth': 5, 'min_samples_split': 10, 'min_samples_leaf': 1, 'max_features': 'sqrt', 'bootstrap': True, 'criterion': 'absolute_error'}. Best is trial 793 with value: 0.32179807021578266.
[I 2024-12-04 20:05:17,045] Trial 803 finished with value: 0.3487284659627865 and parameters: {'n_estimators': 401, 'max_depth': 43, 'min_samples_split': 2, 'min_samples_leaf': 1, 'max_features': 'sqrt', 'bootstrap': False, 'criterion': 'squared_error'}. Best is trial 793 with value: 0.32179807021578266.
[I 2024-12-04 20:05:17,870] Trial 804 finished with value: 0.32586237884113484 and parameters: {'n_estimators': 277, 'max_depth': 50, 'min_samples_split': 2, 'min_samples_leaf': 1, 'max_features': 'sqrt', 'bootstrap': False, 'criterion': 'squared_error'}. Best is trial 793 with value: 0.32179807021578266.
[I 2024-12-04 20:05:18,917] Trial 805 finished with value: 0.3454104218594828 and parameters: {'n_estimators': 349, 'max_depth': 42, 'min_samples_split': 2, 'min_samples_leaf': 1, 'max_features': 'sqrt', 'bootstrap': False, 'criterion': 'squared_error'}. Best is trial 793 with value: 0.32179807021578266.
[I 2024-12-04 20:05:19,028] Trial 807 finished with value: 1.2756670141016726 and parameters: {'n_estimators': 387, 'max_depth': 20, 'min_samples_split': 4, 'min_samples_leaf': 10, 'max_features': 'log2', 'bootstrap': True, 'criterion': 'squared_error'}. Best is trial 793 with value: 0.32179807021578266.
[I 2024-12-04 20:05:19,285] Trial 806 finished with value: 0.3227436309075193 and parameters: {'n_estimators': 350, 'max_depth': 50, 'min_samples_split': 2, 'min_samples_leaf': 1, 'max_features': 'sqrt', 'bootstrap': False, 'criterion': 'squared_error'}. Best is trial 793 with value: 0.32179807021578266.
[I 2024-12-04 20:05:20,496] Trial 809 finished with value: 1.0375334856129859 and parameters: {'n_estimators': 109, 'max_depth': 14, 'min_samples_split': 7, 'min_samples_leaf': 1, 'max_features': 'log2', 'bootstrap': False, 'criterion': 'squared_error'}. Best is trial 793 with value: 0.32179807021578266.
[I 2024-12-04 20:05:20,977] Trial 808 finished with value: 0.325132547283245 and parameters: {'n_estimators': 282, 'max_depth': 50, 'min_samples_split': 2, 'min_samples_leaf': 1, 'max_features': 'sqrt', 'bootstrap': False, 'criterion': 'squared_error'}. Best is trial 793 with value: 0.32179807021578266.
[I 2024-12-04 20:05:21,955] Trial 810 finished with value: 0.41536174300199935 and parameters: {'n_estimators': 487, 'max_depth': 43, 'min_samples_split': 4, 'min_samples_leaf': 1, 'max_features': 'sqrt', 'bootstrap': False, 'criterion': 'squared_error'}. Best is trial 793 with value: 0.32179807021578266.
[I 2024-12-04 20:05:22,554] Trial 811 finished with value: 0.3242568274330358 and parameters: {'n_estimators': 288, 'max_depth': 50, 'min_samples_split': 2, 'min_samples_leaf': 1, 'max_features': 'sqrt', 'bootstrap': False, 'criterion': 'squared_error'}. Best is trial 793 with value: 0.32179807021578266.
[I 2024-12-04 20:05:23,406] Trial 812 finished with value: 0.39339391287501624 and parameters: {'n_estimators': 414, 'max_depth': 48, 'min_samples_split': 2, 'min_samples_leaf': 1, 'max_features': 'sqrt', 'bootstrap': True, 'criterion': 'squared_error'}. Best is trial 793 with value: 0.32179807021578266.
[I 2024-12-04 20:05:24,191] Trial 814 finished with value: 0.6663909192947454 and parameters: {'n_estimators': 347, 'max_depth': 50, 'min_samples_split': 2, 'min_samples_leaf': 2, 'max_features': 'sqrt', 'bootstrap': False, 'criterion': 'squared_error'}. Best is trial 793 with value: 0.32179807021578266.
[I 2024-12-04 20:05:25,445] Trial 813 finished with value: 0.587692102201418 and parameters: {'n_estimators': 570, 'max_depth': 19, 'min_samples_split': 16, 'min_samples_leaf': 5, 'max_features': None, 'bootstrap': False, 'criterion': 'squared_error'}. Best is trial 793 with value: 0.32179807021578266.
[I 2024-12-04 20:05:25,463] Trial 815 finished with value: 0.3625925771222866 and parameters: {'n_estimators': 436, 'max_depth': 50, 'min_samples_split': 3, 'min_samples_leaf': 1, 'max_features': 'sqrt', 'bootstrap': False, 'criterion': 'squared_error'}. Best is trial 793 with value: 0.32179807021578266.
[I 2024-12-04 20:05:25,508] Trial 816 finished with value: 0.6929658678344726 and parameters: {'n_estimators': 446, 'max_depth': 50, 'min_samples_split': 2, 'min_samples_leaf': 2, 'max_features': 'sqrt', 'bootstrap': False, 'criterion': 'squared_error'}. Best is trial 793 with value: 0.32179807021578266.
[I 2024-12-04 20:05:27,487] Trial 817 finished with value: 0.3249881617763395 and parameters: {'n_estimators': 269, 'max_depth': 50, 'min_samples_split': 2, 'min_samples_leaf': 1, 'max_features': 'sqrt', 'bootstrap': False, 'criterion': 'squared_error'}. Best is trial 793 with value: 0.32179807021578266.
[I 2024-12-04 20:05:28,324] Trial 819 finished with value: 0.32475997933255907 and parameters: {'n_estimators': 418, 'max_depth': 49, 'min_samples_split': 2, 'min_samples_leaf': 1, 'max_features': 'sqrt', 'bootstrap': False, 'criterion': 'squared_error'}. Best is trial 793 with value: 0.32179807021578266.
[I 2024-12-04 20:05:28,382] Trial 818 finished with value: 0.3236604085713581 and parameters: {'n_estimators': 404, 'max_depth': 49, 'min_samples_split': 2, 'min_samples_leaf': 1, 'max_features': 'sqrt', 'bootstrap': False, 'criterion': 'squared_error'}. Best is trial 793 with value: 0.32179807021578266.
[I 2024-12-04 20:05:29,437] Trial 822 finished with value: 0.8832076426766033 and parameters: {'n_estimators': 124, 'max_depth': 21, 'min_samples_split': 20, 'min_samples_leaf': 3, 'max_features': 'sqrt', 'bootstrap': False, 'criterion': 'squared_error'}. Best is trial 793 with value: 0.32179807021578266.
[I 2024-12-04 20:05:30,620] Trial 823 finished with value: 0.41246552033823364 and parameters: {'n_estimators': 236, 'max_depth': 41, 'min_samples_split': 4, 'min_samples_leaf': 1, 'max_features': 'sqrt', 'bootstrap': False, 'criterion': 'squared_error'}. Best is trial 793 with value: 0.32179807021578266.
[I 2024-12-04 20:05:31,667] Trial 824 finished with value: 1.2736647978090805 and parameters: {'n_estimators': 490, 'max_depth': 42, 'min_samples_split': 35, 'min_samples_leaf': 11, 'max_features': 'log2', 'bootstrap': False, 'criterion': 'squared_error'}. Best is trial 793 with value: 0.32179807021578266.
[I 2024-12-04 20:05:32,943] Trial 825 finished with value: 0.6666555242050992 and parameters: {'n_estimators': 292, 'max_depth': 43, 'min_samples_split': 2, 'min_samples_leaf': 2, 'max_features': 'sqrt', 'bootstrap': False, 'criterion': 'squared_error'}. Best is trial 793 with value: 0.32179807021578266.
[I 2024-12-04 20:05:33,750] Trial 820 finished with value: 0.4340596938170443 and parameters: {'n_estimators': 599, 'max_depth': 50, 'min_samples_split': 2, 'min_samples_leaf': 1, 'max_features': None, 'bootstrap': False, 'criterion': 'squared_error'}. Best is trial 793 with value: 0.32179807021578266.
[I 2024-12-04 20:05:34,585] Trial 826 finished with value: 0.6045607158454899 and parameters: {'n_estimators': 286, 'max_depth': 40, 'min_samples_split': 2, 'min_samples_leaf': 1, 'max_features': 'log2', 'bootstrap': False, 'criterion': 'squared_error'}. Best is trial 793 with value: 0.32179807021578266.
[I 2024-12-04 20:05:35,400] Trial 827 finished with value: 0.3858625617753142 and parameters: {'n_estimators': 312, 'max_depth': 41, 'min_samples_split': 3, 'min_samples_leaf': 1, 'max_features': 'sqrt', 'bootstrap': False, 'criterion': 'squared_error'}. Best is trial 793 with value: 0.32179807021578266.
[I 2024-12-04 20:05:37,224] Trial 828 finished with value: 0.3499135888958377 and parameters: {'n_estimators': 534, 'max_depth': 44, 'min_samples_split': 2, 'min_samples_leaf': 1, 'max_features': 'sqrt', 'bootstrap': False, 'criterion': 'squared_error'}. Best is trial 793 with value: 0.32179807021578266.
