[I 2024-12-04 15:18:29,609] Trial 1403 finished with value: 0.1343543985166937 and parameters: {'kernel_type': 'Matern', 'length_scale': 162.11525059063482, 'noise_level': 0.9079301810882945, 'constant_value': 1076.8686776638183, 'nu': 1.5}. Best is trial 750 with value: 0.13435342446039877.
[I 2024-12-04 15:18:29,939] Trial 1412 finished with value: 0.1343543869141221 and parameters: {'kernel_type': 'Matern', 'length_scale': 31.461045786880245, 'noise_level': 0.9225623927138159, 'constant_value': 224.5914534364938, 'nu': 1.5}. Best is trial 750 with value: 0.13435342446039877.
[I 2024-12-04 15:18:30,378] Trial 1421 finished with value: 0.13435441085904723 and parameters: {'kernel_type': 'Matern', 'length_scale': 343.91324252686394, 'noise_level': 0.0028126005475489356, 'constant_value': 70355.86767454671, 'nu': 1.5}. Best is trial 750 with value: 0.13435342446039877.
[I 2024-12-04 15:18:33,901] Trial 1418 finished with value: 1.2693635028570311 and parameters: {'kernel_type': 'RBF', 'length_scale': 33.52655675307662, 'noise_level': 2.3284168332281573e-10, 'constant_value': 5.343659674041431, 'nu': 0.5}. Best is trial 750 with value: 0.13435342446039877.
[I 2024-12-04 15:18:34,102] Trial 1420 finished with value: 0.1343545826148532 and parameters: {'kernel_type': 'Matern', 'length_scale': 528.4796139341494, 'noise_level': 0.12786343780120188, 'constant_value': 31208.039037473598, 'nu': 1.5}. Best is trial 750 with value: 0.13435342446039877.
[I 2024-12-04 15:18:34,159] Trial 1416 finished with value: 0.15167303958580158 and parameters: {'kernel_type': 'RBF', 'length_scale': 0.29617218908151377, 'noise_level': 5.231588837774527e-09, 'constant_value': 0.7489112249870001, 'nu': 0.5}. Best is trial 750 with value: 0.13435342446039877.
[I 2024-12-04 15:18:35,333] Trial 1417 finished with value: 0.13435437636363118 and parameters: {'kernel_type': 'Matern', 'length_scale': 603.4421113261031, 'noise_level': 0.9688229754678643, 'constant_value': 21688.031101658464, 'nu': 1.5}. Best is trial 750 with value: 0.13435342446039877.
[I 2024-12-04 15:18:35,772] Trial 1414 finished with value: 0.13435436285045466 and parameters: {'kernel_type': 'Matern', 'length_scale': 2091.5513143899925, 'noise_level': 0.4518985872424273, 'constant_value': 1796.4876531033976, 'nu': 1.5}. Best is trial 750 with value: 0.13435342446039877.
[I 2024-12-04 15:18:37,019] Trial 1415 finished with value: 0.134354498584708 and parameters: {'kernel_type': 'Matern', 'length_scale': 263.139319356226, 'noise_level': 0.0036170554764979996, 'constant_value': 14249.33837426889, 'nu': 1.5}. Best is trial 750 with value: 0.13435342446039877.
[I 2024-12-04 15:18:39,987] Trial 1406 finished with value: 0.13435440717083166 and parameters: {'kernel_type': 'Matern', 'length_scale': 133.72038779827204, 'noise_level': 0.4638066801170061, 'constant_value': 4147.909034099639, 'nu': 1.5}. Best is trial 750 with value: 0.13435342446039877.
[I 2024-12-04 15:18:41,571] Trial 1419 finished with value: 0.15167309267286508 and parameters: {'kernel_type': 'RBF', 'length_scale': 0.48869926422173904, 'noise_level': 5.147920268918627e-09, 'constant_value': 0.08274768183464422, 'nu': 1.5}. Best is trial 750 with value: 0.13435342446039877.
[I 2024-12-04 15:18:45,221] Trial 1431 finished with value: 0.1343543697935457 and parameters: {'kernel_type': 'Matern', 'length_scale': 60.33285725926875, 'noise_level': 0.3345311178350326, 'constant_value': 4200.69057916235, 'nu': 1.5}. Best is trial 750 with value: 0.13435342446039877.
[I 2024-12-04 15:18:46,099] Trial 1424 finished with value: 0.1343543208186948 and parameters: {'kernel_type': 'Matern', 'length_scale': 502.5605200844582, 'noise_level': 0.06518967514833775, 'constant_value': 41487.98723951344, 'nu': 1.5}. Best is trial 750 with value: 0.13435342446039877.
[I 2024-12-04 15:18:46,140] Trial 1423 finished with value: 0.1343544549685048 and parameters: {'kernel_type': 'Matern', 'length_scale': 728.2638386668469, 'noise_level': 0.2115940303130933, 'constant_value': 92194.60009612502, 'nu': 1.5}. Best is trial 750 with value: 0.13435342446039877.
[I 2024-12-04 15:18:46,324] Trial 1429 finished with value: 1.2693635028572958 and parameters: {'kernel_type': 'RBF', 'length_scale': 0.124612816558827, 'noise_level': 2.6349706066002826e-08, 'constant_value': 0.001866125334433674, 'nu': 2.5}. Best is trial 750 with value: 0.13435342446039877.
[I 2024-12-04 15:18:46,900] Trial 1428 finished with value: 1.2693635028536012 and parameters: {'kernel_type': 'Matern', 'length_scale': 34.17953433328557, 'noise_level': 0.0006592476415232753, 'constant_value': 0.16183263423979824, 'nu': 2.5}. Best is trial 750 with value: 0.13435342446039877.
[I 2024-12-04 15:18:50,780] Trial 1436 finished with value: 0.1516729379443562 and parameters: {'kernel_type': 'RBF', 'length_scale': 165.27925074695384, 'noise_level': 0.10008991315040072, 'constant_value': 130.31195256992422, 'nu': 1.5}. Best is trial 750 with value: 0.13435342446039877.
[I 2024-12-04 15:18:51,265] Trial 1427 finished with value: 0.1343544003686704 and parameters: {'kernel_type': 'Matern', 'length_scale': 1580.8143723074463, 'noise_level': 0.2167817218702552, 'constant_value': 15016.340804966825, 'nu': 1.5}. Best is trial 750 with value: 0.13435342446039877.
[I 2024-12-04 15:18:53,288] Trial 1435 finished with value: 0.1725103981289571 and parameters: {'kernel_type': 'Matern', 'length_scale': 280.3420996861801, 'noise_level': 0.12621042056131798, 'constant_value': 608.2080169508524, 'nu': 0.5}. Best is trial 750 with value: 0.13435342446039877.
[I 2024-12-04 15:18:55,286] Trial 1432 finished with value: 1.2693635028569672 and parameters: {'kernel_type': 'Matern', 'length_scale': 1.3078748743846166e-05, 'noise_level': 2.067618812427485e-08, 'constant_value': 0.04065348009678051, 'nu': 0.5}. Best is trial 750 with value: 0.13435342446039877.
[I 2024-12-04 15:18:57,215] Trial 1434 finished with value: 0.17251039329943196 and parameters: {'kernel_type': 'Matern', 'length_scale': 2602.138415771773, 'noise_level': 0.3689938733428282, 'constant_value': 195.8516935815149, 'nu': 0.5}. Best is trial 750 with value: 0.13435342446039877.
[I 2024-12-04 15:18:57,842] Trial 1430 finished with value: 0.13435438263161184 and parameters: {'kernel_type': 'Matern', 'length_scale': 84562.23964048749, 'noise_level': 0.9737575174895463, 'constant_value': 3456.8040663761317, 'nu': 1.5}. Best is trial 750 with value: 0.13435342446039877.
[I 2024-12-04 15:18:57,877] Trial 1422 finished with value: 0.13435435995289094 and parameters: {'kernel_type': 'Matern', 'length_scale': 58.68310258463952, 'noise_level': 0.6393492651376457, 'constant_value': 12093.71912588372, 'nu': 1.5}. Best is trial 750 with value: 0.13435342446039877.
[I 2024-12-04 15:18:57,961] Trial 1437 finished with value: 0.13435439930609502 and parameters: {'kernel_type': 'Matern', 'length_scale': 188.84560721956964, 'noise_level': 0.8015393468959078, 'constant_value': 3385.330062831544, 'nu': 1.5}. Best is trial 750 with value: 0.13435342446039877.
[I 2024-12-04 15:18:58,792] Trial 1439 finished with value: 0.13435493087670256 and parameters: {'kernel_type': 'Matern', 'length_scale': 1227.5250264470862, 'noise_level': 0.641825251190042, 'constant_value': 5795.644665647573, 'nu': 1.5}. Best is trial 750 with value: 0.13435342446039877.
[I 2024-12-04 15:18:58,810] Trial 1425 finished with value: 0.14859824267533892 and parameters: {'kernel_type': 'Matern', 'length_scale': 391.18766790479634, 'noise_level': 0.003757862932538404, 'constant_value': 67564.79629348071, 'nu': 2.5}. Best is trial 750 with value: 0.13435342446039877.
[I 2024-12-04 15:18:59,582] Trial 1442 finished with value: 0.1343544010458711 and parameters: {'kernel_type': 'Matern', 'length_scale': 5.983319436401861, 'noise_level': 0.7266012638444865, 'constant_value': 1683.7783740370737, 'nu': 1.5}. Best is trial 750 with value: 0.13435342446039877.
[I 2024-12-04 15:19:00,040] Trial 1433 finished with value: 0.13435438872465 and parameters: {'kernel_type': 'Matern', 'length_scale': 3235.192325788761, 'noise_level': 0.45685256723309486, 'constant_value': 22934.359455533253, 'nu': 1.5}. Best is trial 750 with value: 0.13435342446039877.
[I 2024-12-04 15:19:02,794] Trial 1426 finished with value: 0.1343543873675084 and parameters: {'kernel_type': 'Matern', 'length_scale': 292.35336029024074, 'noise_level': 0.20988959569079418, 'constant_value': 81422.99922514737, 'nu': 1.5}. Best is trial 750 with value: 0.13435342446039877.
[I 2024-12-04 15:19:03,042] Trial 1438 finished with value: 1.2693635028582673 and parameters: {'kernel_type': 'Matern', 'length_scale': 0.013756839430625868, 'noise_level': 0.6717383864262032, 'constant_value': 3.232807054190099, 'nu': 2.5}. Best is trial 750 with value: 0.13435342446039877.
[I 2024-12-04 15:19:05,366] Trial 1444 finished with value: 0.13435441922046437 and parameters: {'kernel_type': 'Matern', 'length_scale': 860.1276899873286, 'noise_level': 0.01937854828924947, 'constant_value': 1214.761088561033, 'nu': 1.5}. Best is trial 750 with value: 0.13435342446039877.
[I 2024-12-04 15:19:06,778] Trial 1451 finished with value: 0.1485982821328414 and parameters: {'kernel_type': 'Matern', 'length_scale': 106.27121832868661, 'noise_level': 0.006609639868206444, 'constant_value': 46.743768883349006, 'nu': 2.5}. Best is trial 750 with value: 0.13435342446039877.
[I 2024-12-04 15:19:06,895] Trial 1450 finished with value: 0.134354454629158 and parameters: {'kernel_type': 'Matern', 'length_scale': 266.7570737434291, 'noise_level': 0.9297793236745684, 'constant_value': 437.32988169628686, 'nu': 1.5}. Best is trial 750 with value: 0.13435342446039877.
[I 2024-12-04 15:19:08,818] Trial 1447 finished with value: 0.13435439868043716 and parameters: {'kernel_type': 'Matern', 'length_scale': 21019.77623913167, 'noise_level': 0.929486967933825, 'constant_value': 59247.250133440204, 'nu': 1.5}. Best is trial 750 with value: 0.13435342446039877.
[I 2024-12-04 15:19:08,844] Trial 1443 finished with value: 0.13435441194378614 and parameters: {'kernel_type': 'Matern', 'length_scale': 5963.187330723157, 'noise_level': 0.30346540983948467, 'constant_value': 63585.59256714822, 'nu': 1.5}. Best is trial 750 with value: 0.13435342446039877.
[I 2024-12-04 15:19:08,847] Trial 1440 finished with value: 0.13435421203300502 and parameters: {'kernel_type': 'Matern', 'length_scale': 866.3709454063169, 'noise_level': 0.02748233914848855, 'constant_value': 4.7062363207988795, 'nu': 1.5}. Best is trial 750 with value: 0.13435342446039877.
[I 2024-12-04 15:19:10,656] Trial 1441 finished with value: 0.13435440164733256 and parameters: {'kernel_type': 'Matern', 'length_scale': 35.45887842456518, 'noise_level': 0.3864409000640557, 'constant_value': 60912.46097187519, 'nu': 1.5}. Best is trial 750 with value: 0.13435342446039877.
[I 2024-12-04 15:19:11,218] Trial 1445 finished with value: 0.13435441659792563 and parameters: {'kernel_type': 'Matern', 'length_scale': 147.73225111539355, 'noise_level': 0.9398708691964675, 'constant_value': 22104.695224374453, 'nu': 1.5}. Best is trial 750 with value: 0.13435342446039877.
[I 2024-12-04 15:19:11,505] Trial 1446 finished with value: 0.1516729857926031 and parameters: {'kernel_type': 'RBF', 'length_scale': 1317.8038359764369, 'noise_level': 0.0030410088563792054, 'constant_value': 11145.199501062172, 'nu': 1.5}. Best is trial 750 with value: 0.13435342446039877.
[I 2024-12-04 15:19:12,932] Trial 1457 finished with value: 0.13435439388205184 and parameters: {'kernel_type': 'Matern', 'length_scale': 245.23422740036432, 'noise_level': 0.1935144386038871, 'constant_value': 65178.25701498732, 'nu': 1.5}. Best is trial 750 with value: 0.13435342446039877.
[I 2024-12-04 15:19:12,933] Trial 1449 finished with value: 0.13435444607995162 and parameters: {'kernel_type': 'Matern', 'length_scale': 26.010564443896474, 'noise_level': 0.03873448413493479, 'constant_value': 24.541568978151055, 'nu': 1.5}. Best is trial 750 with value: 0.13435342446039877.
[I 2024-12-04 15:19:13,473] Trial 1455 finished with value: 0.1343543995939905 and parameters: {'kernel_type': 'Matern', 'length_scale': 41.43360637720835, 'noise_level': 0.957234556974052, 'constant_value': 18465.139322945124, 'nu': 1.5}. Best is trial 750 with value: 0.13435342446039877.
[I 2024-12-04 15:19:14,364] Trial 1458 finished with value: 0.13435440405980825 and parameters: {'kernel_type': 'Matern', 'length_scale': 3.9655249780322928, 'noise_level': 0.04693539585173072, 'constant_value': 65696.72441104642, 'nu': 1.5}. Best is trial 750 with value: 0.13435342446039877.
[I 2024-12-04 15:19:16,366] Trial 1452 finished with value: 0.13435440155944892 and parameters: {'kernel_type': 'Matern', 'length_scale': 72.74152001459112, 'noise_level': 0.9303007656913489, 'constant_value': 4965.327670589157, 'nu': 1.5}. Best is trial 750 with value: 0.13435342446039877.
[I 2024-12-04 15:19:16,923] Trial 1454 finished with value: 0.1343544063448995 and parameters: {'kernel_type': 'Matern', 'length_scale': 0.35457601668547833, 'noise_level': 0.2543081354306022, 'constant_value': 477.45991168831404, 'nu': 1.5}. Best is trial 750 with value: 0.13435342446039877.
[I 2024-12-04 15:19:18,976] Trial 1461 finished with value: 1.2693634821196145 and parameters: {'kernel_type': 'Matern', 'length_scale': 0.08461625374268862, 'noise_level': 0.9060424749035694, 'constant_value': 1280.1288679070526, 'nu': 1.5}. Best is trial 750 with value: 0.13435342446039877.
[I 2024-12-04 15:19:21,457] Trial 1462 finished with value: 0.13435443398535618 and parameters: {'kernel_type': 'Matern', 'length_scale': 21.482771763733812, 'noise_level': 0.00033906709265759885, 'constant_value': 956.8883127275222, 'nu': 1.5}. Best is trial 750 with value: 0.13435342446039877.
[I 2024-12-04 15:19:21,479] Trial 1453 finished with value: 0.1725103966536002 and parameters: {'kernel_type': 'Matern', 'length_scale': 936.3163688737955, 'noise_level': 0.9854345335090839, 'constant_value': 21129.528483605365, 'nu': 0.5}. Best is trial 750 with value: 0.13435342446039877.
[I 2024-12-04 15:19:21,915] Trial 1448 finished with value: 1.269363502857115 and parameters: {'kernel_type': 'RBF', 'length_scale': 27980.53478076052, 'noise_level': 7.93900063450515e-08, 'constant_value': 8.419017146268715e-07, 'nu': 1.5}. Best is trial 750 with value: 0.13435342446039877.
[I 2024-12-04 15:19:24,873] Trial 1465 finished with value: 1.2693634767287802 and parameters: {'kernel_type': 'Matern', 'length_scale': 0.08563013674147428, 'noise_level': 0.01222248764453896, 'constant_value': 8.242753572898787, 'nu': 1.5}. Best is trial 1456 with value: 0.13435337537029549.
[I 2024-12-04 15:19:24,877] Trial 1456 finished with value: 0.13435337537029549 and parameters: {'kernel_type': 'Matern', 'length_scale': 8.547200115834613, 'noise_level': 0.018919566406012084, 'constant_value': 95444.28008503551, 'nu': 1.5}. Best is trial 1456 with value: 0.13435337537029549.
[I 2024-12-04 15:19:26,013] Trial 1466 finished with value: 0.1343543976457596 and parameters: {'kernel_type': 'Matern', 'length_scale': 42.47388326588192, 'noise_level': 0.9342007511457762, 'constant_value': 23.394632807155343, 'nu': 1.5}. Best is trial 1456 with value: 0.13435337537029549.
[I 2024-12-04 15:19:26,079] Trial 1460 finished with value: 0.1343544086464145 and parameters: {'kernel_type': 'Matern', 'length_scale': 21.84447092798225, 'noise_level': 0.33117576544967814, 'constant_value': 99761.70562688712, 'nu': 1.5}. Best is trial 1456 with value: 0.13435337537029549.
[I 2024-12-04 15:19:26,530] Trial 1463 finished with value: 0.14859827408504692 and parameters: {'kernel_type': 'Matern', 'length_scale': 92.22220368750058, 'noise_level': 0.672023013385135, 'constant_value': 4848.695553738571, 'nu': 2.5}. Best is trial 1456 with value: 0.13435337537029549.
[I 2024-12-04 15:19:30,266] Trial 1464 finished with value: 1.2693635028564845 and parameters: {'kernel_type': 'Matern', 'length_scale': 978.922643374278, 'noise_level': 0.004933320181808549, 'constant_value': 33.79968175508479, 'nu': 1.5}. Best is trial 1456 with value: 0.13435337537029549.
[I 2024-12-04 15:19:30,486] Trial 1470 finished with value: 1.3007745979653202 and parameters: {'kernel_type': 'Matern', 'length_scale': 0.9115981305824077, 'noise_level': 0.0009846326889899307, 'constant_value': 484.07848699485004, 'nu': 1.5}. Best is trial 1456 with value: 0.13435337537029549.
[I 2024-12-04 15:19:31,592] Trial 1469 finished with value: 1.2693635028569008 and parameters: {'kernel_type': 'Matern', 'length_scale': 0.019575604273704337, 'noise_level': 2.0260499190145504e-05, 'constant_value': 52.43910111390899, 'nu': 1.5}. Best is trial 1456 with value: 0.13435337537029549.
[I 2024-12-04 15:19:33,707] Trial 1476 finished with value: 0.1343544123430711 and parameters: {'kernel_type': 'Matern', 'length_scale': 7.368058096995158, 'noise_level': 0.05168185869374866, 'constant_value': 1905.1360204196299, 'nu': 1.5}. Best is trial 1456 with value: 0.13435337537029549.
[I 2024-12-04 15:19:36,629] Trial 1459 finished with value: 0.13435443378914239 and parameters: {'kernel_type': 'Matern', 'length_scale': 378.16160688016964, 'noise_level': 0.003628785151735185, 'constant_value': 33.04137451705372, 'nu': 1.5}. Best is trial 1456 with value: 0.13435337537029549.
[I 2024-12-04 15:19:36,840] Trial 1468 finished with value: 0.13435439815717953 and parameters: {'kernel_type': 'Matern', 'length_scale': 1.3161960361073026, 'noise_level': 0.02421235759600051, 'constant_value': 82722.2185600734, 'nu': 1.5}. Best is trial 1456 with value: 0.13435337537029549.
[I 2024-12-04 15:19:36,856] Trial 1478 finished with value: 1.3007739230724422 and parameters: {'kernel_type': 'Matern', 'length_scale': 0.09590392924097062, 'noise_level': 0.0012335020738028157, 'constant_value': 67003.54567620803, 'nu': 1.5}. Best is trial 1456 with value: 0.13435337537029549.
[I 2024-12-04 15:19:36,878] Trial 1467 finished with value: 0.13435440458003717 and parameters: {'kernel_type': 'Matern', 'length_scale': 1.4101248047587793, 'noise_level': 0.9072137166661268, 'constant_value': 27.116916929840812, 'nu': 1.5}. Best is trial 1456 with value: 0.13435337537029549.
[I 2024-12-04 15:19:36,879] Trial 1472 finished with value: 0.15167297590778472 and parameters: {'kernel_type': 'RBF', 'length_scale': 0.2561096052291528, 'noise_level': 1.2913506316418468e-10, 'constant_value': 22.200577737032017, 'nu': 2.5}. Best is trial 1456 with value: 0.13435337537029549.
[I 2024-12-04 15:19:37,564] Trial 1471 finished with value: 0.13435444090113519 and parameters: {'kernel_type': 'Matern', 'length_scale': 768.1709762923097, 'noise_level': 0.03417912908495777, 'constant_value': 1141.97624133426, 'nu': 1.5}. Best is trial 1456 with value: 0.13435337537029549.
[I 2024-12-04 15:19:41,379] Trial 1475 finished with value: 1.2693635028568373 and parameters: {'kernel_type': 'RBF', 'length_scale': 0.0023284639137942423, 'noise_level': 1.7639868617736074e-10, 'constant_value': 8.470600511184337e-05, 'nu': 2.5}. Best is trial 1456 with value: 0.13435337537029549.
[I 2024-12-04 15:19:45,704] Trial 1474 finished with value: 0.13435439405846653 and parameters: {'kernel_type': 'Matern', 'length_scale': 0.1268380832574313, 'noise_level': 0.052628894101451565, 'constant_value': 75302.66564433086, 'nu': 1.5}. Best is trial 1456 with value: 0.13435337537029549.
[I 2024-12-04 15:19:46,503] Trial 1490 finished with value: 1.3007744885243286 and parameters: {'kernel_type': 'Matern', 'length_scale': 14.651534889332872, 'noise_level': 1.3470545959402157e-07, 'constant_value': 1040.8594223941163, 'nu': 0.5}. Best is trial 1456 with value: 0.13435337537029549.
[I 2024-12-04 15:19:49,337] Trial 1483 finished with value: 0.17251040759478894 and parameters: {'kernel_type': 'Matern', 'length_scale': 57.99240322613833, 'noise_level': 0.018712087060330368, 'constant_value': 0.022701408527692975, 'nu': 0.5}. Best is trial 1456 with value: 0.13435337537029549.
[I 2024-12-04 15:19:49,367] Trial 1477 finished with value: 0.1343546120393051 and parameters: {'kernel_type': 'Matern', 'length_scale': 6.337232026352709, 'noise_level': 0.005929972768248507, 'constant_value': 51289.24759787522, 'nu': 1.5}. Best is trial 1456 with value: 0.13435337537029549.
[I 2024-12-04 15:19:50,814] Trial 1480 finished with value: 0.13435418514842012 and parameters: {'kernel_type': 'Matern', 'length_scale': 33.225685001989646, 'noise_level': 0.11706011792099688, 'constant_value': 0.0011127832449445698, 'nu': 1.5}. Best is trial 1456 with value: 0.13435337537029549.
[I 2024-12-04 15:19:51,090] Trial 1482 finished with value: 0.13435424794781084 and parameters: {'kernel_type': 'Matern', 'length_scale': 12.441911652201977, 'noise_level': 0.0014544105166619927, 'constant_value': 4370.683760485308, 'nu': 1.5}. Best is trial 1456 with value: 0.13435337537029549.
[I 2024-12-04 15:19:54,553] Trial 1488 finished with value: 1.2693635028562074 and parameters: {'kernel_type': 'RBF', 'length_scale': 20.350827304471647, 'noise_level': 1.1902742245761121e-05, 'constant_value': 0.0008422500357013701, 'nu': 0.5}. Best is trial 1456 with value: 0.13435337537029549.
[I 2024-12-04 15:19:54,803] Trial 1479 finished with value: 0.13435441397102843 and parameters: {'kernel_type': 'Matern', 'length_scale': 0.3267414897370454, 'noise_level': 0.0010384356288243779, 'constant_value': 3702.7653789834653, 'nu': 1.5}. Best is trial 1456 with value: 0.13435337537029549.
[I 2024-12-04 15:19:55,713] Trial 1473 finished with value: 1.2693635028568813 and parameters: {'kernel_type': 'Matern', 'length_scale': 0.00909968142385214, 'noise_level': 7.925286258230885e-05, 'constant_value': 3.3281466104421654e-07, 'nu': 2.5}. Best is trial 1456 with value: 0.13435337537029549.
