[I 2024-12-04 11:59:54,017] Trial 1302 finished with value: 0.5517975516810654 and parameters: {'max_depth': 29, 'min_samples_split': 17, 'min_samples_leaf': 1, 'max_features': 'sqrt', 'criterion': 'friedman_mse', 'splitter': 'best'}. Best is trial 245 with value: 0.5517975516810654.
[I 2024-12-04 11:59:54,664] Trial 1305 finished with value: 0.5795289611129476 and parameters: {'max_depth': 35, 'min_samples_split': 20, 'min_samples_leaf': 1, 'max_features': 'sqrt', 'criterion': 'friedman_mse', 'splitter': 'best'}. Best is trial 245 with value: 0.5517975516810654.
[I 2024-12-04 11:59:54,967] Trial 1311 finished with value: 1.0746652081803512 and parameters: {'max_depth': 29, 'min_samples_split': 18, 'min_samples_leaf': 3, 'max_features': 'sqrt', 'criterion': 'squared_error', 'splitter': 'best'}. Best is trial 245 with value: 0.5517975516810654.
[I 2024-12-04 11:59:55,043] Trial 1316 finished with value: 1.0746652081803512 and parameters: {'max_depth': 33, 'min_samples_split': 15, 'min_samples_leaf': 3, 'max_features': 'sqrt', 'criterion': 'friedman_mse', 'splitter': 'best'}. Best is trial 245 with value: 0.5517975516810654.
[I 2024-12-04 11:59:56,691] Trial 1315 finished with value: 0.6004802931373475 and parameters: {'max_depth': 29, 'min_samples_split': 16, 'min_samples_leaf': 1, 'max_features': 'sqrt', 'criterion': 'friedman_mse', 'splitter': 'best'}. Best is trial 245 with value: 0.5517975516810654.
[I 2024-12-04 11:59:57,306] Trial 1313 finished with value: 0.5945975836542683 and parameters: {'max_depth': 32, 'min_samples_split': 19, 'min_samples_leaf': 2, 'max_features': 'sqrt', 'criterion': 'friedman_mse', 'splitter': 'best'}. Best is trial 245 with value: 0.5517975516810654.
[I 2024-12-04 11:59:57,335] Trial 1319 finished with value: 0.5957889156966119 and parameters: {'max_depth': 26, 'min_samples_split': 17, 'min_samples_leaf': 1, 'max_features': 'sqrt', 'criterion': 'friedman_mse', 'splitter': 'best'}. Best is trial 245 with value: 0.5517975516810654.
[I 2024-12-04 11:59:57,716] Trial 1323 finished with value: 1.0746652081803512 and parameters: {'max_depth': 25, 'min_samples_split': 18, 'min_samples_leaf': 3, 'max_features': 'sqrt', 'criterion': 'friedman_mse', 'splitter': 'best'}. Best is trial 245 with value: 0.5517975516810654.
[I 2024-12-04 11:59:57,984] Trial 1318 finished with value: 0.5883040364889727 and parameters: {'max_depth': 25, 'min_samples_split': 18, 'min_samples_leaf': 1, 'max_features': 'sqrt', 'criterion': 'friedman_mse', 'splitter': 'best'}. Best is trial 245 with value: 0.5517975516810654.
[I 2024-12-04 11:59:58,317] Trial 1324 finished with value: 0.5924912260784201 and parameters: {'max_depth': 31, 'min_samples_split': 16, 'min_samples_leaf': 1, 'max_features': 'sqrt', 'criterion': 'friedman_mse', 'splitter': 'best'}. Best is trial 245 with value: 0.5517975516810654.
[I 2024-12-04 11:59:58,413] Trial 1320 finished with value: 1.3737845361400185 and parameters: {'max_depth': 18, 'min_samples_split': 7, 'min_samples_leaf': 6, 'max_features': 'log2', 'criterion': 'absolute_error', 'splitter': 'random'}. Best is trial 245 with value: 0.5517975516810654.
[I 2024-12-04 11:59:58,875] Trial 1327 finished with value: 0.5856844165343162 and parameters: {'max_depth': 28, 'min_samples_split': 18, 'min_samples_leaf': 1, 'max_features': 'sqrt', 'criterion': 'friedman_mse', 'splitter': 'best'}. Best is trial 245 with value: 0.5517975516810654.
[I 2024-12-04 11:59:58,879] Trial 1303 finished with value: 0.6018386975242761 and parameters: {'max_depth': 23, 'min_samples_split': 16, 'min_samples_leaf': 1, 'max_features': 'sqrt', 'criterion': 'friedman_mse', 'splitter': 'best'}. Best is trial 245 with value: 0.5517975516810654.
[I 2024-12-04 11:59:58,988] Trial 1309 finished with value: 1.0855266432011492 and parameters: {'max_depth': 11, 'min_samples_split': 8, 'min_samples_leaf': 7, 'max_features': 'sqrt', 'criterion': 'squared_error', 'splitter': 'best'}. Best is trial 245 with value: 0.5517975516810654.
[I 2024-12-04 11:59:59,013] Trial 1322 finished with value: 0.5945975836542683 and parameters: {'max_depth': 26, 'min_samples_split': 18, 'min_samples_leaf': 2, 'max_features': 'sqrt', 'criterion': 'friedman_mse', 'splitter': 'best'}. Best is trial 245 with value: 0.5517975516810654.
[I 2024-12-04 11:59:59,084] Trial 1329 finished with value: 0.5708182886221415 and parameters: {'max_depth': 31, 'min_samples_split': 18, 'min_samples_leaf': 1, 'max_features': 'sqrt', 'criterion': 'friedman_mse', 'splitter': 'best'}. Best is trial 245 with value: 0.5517975516810654.
[I 2024-12-04 12:00:00,031] Trial 1326 finished with value: 0.5718668665680694 and parameters: {'max_depth': 32, 'min_samples_split': 18, 'min_samples_leaf': 1, 'max_features': 'sqrt', 'criterion': 'friedman_mse', 'splitter': 'best'}. Best is trial 245 with value: 0.5517975516810654.
[I 2024-12-04 12:00:00,979] Trial 1338 finished with value: 0.5945975836542683 and parameters: {'max_depth': 31, 'min_samples_split': 18, 'min_samples_leaf': 2, 'max_features': 'sqrt', 'criterion': 'friedman_mse', 'splitter': 'best'}. Best is trial 245 with value: 0.5517975516810654.
[I 2024-12-04 12:00:00,980] Trial 1335 finished with value: 0.6004802931373475 and parameters: {'max_depth': 29, 'min_samples_split': 16, 'min_samples_leaf': 1, 'max_features': 'sqrt', 'criterion': 'squared_error', 'splitter': 'best'}. Best is trial 245 with value: 0.5517975516810654.
[I 2024-12-04 12:00:01,429] Trial 1332 finished with value: 1.259809444253076 and parameters: {'max_depth': 6, 'min_samples_split': 15, 'min_samples_leaf': 5, 'max_features': 'sqrt', 'criterion': 'friedman_mse', 'splitter': 'random'}. Best is trial 245 with value: 0.5517975516810654.
[I 2024-12-04 12:00:01,535] Trial 1331 finished with value: 1.1245475399817655 and parameters: {'max_depth': 28, 'min_samples_split': 18, 'min_samples_leaf': 2, 'max_features': 'sqrt', 'criterion': 'friedman_mse', 'splitter': 'random'}. Best is trial 245 with value: 0.5517975516810654.
[I 2024-12-04 12:00:02,167] Trial 1336 finished with value: 0.5951824649333685 and parameters: {'max_depth': 30, 'min_samples_split': 17, 'min_samples_leaf': 1, 'max_features': 'sqrt', 'criterion': 'friedman_mse', 'splitter': 'best'}. Best is trial 245 with value: 0.5517975516810654.
[I 2024-12-04 12:00:02,562] Trial 1317 finished with value: 0.5517975516810654 and parameters: {'max_depth': 29, 'min_samples_split': 17, 'min_samples_leaf': 1, 'max_features': 'sqrt', 'criterion': 'friedman_mse', 'splitter': 'best'}. Best is trial 245 with value: 0.5517975516810654.
[I 2024-12-04 12:00:02,592] Trial 1340 finished with value: 1.3696699836108748 and parameters: {'max_depth': 21, 'min_samples_split': 20, 'min_samples_leaf': 6, 'max_features': 'sqrt', 'criterion': 'absolute_error', 'splitter': 'random'}. Best is trial 245 with value: 0.5517975516810654.
[I 2024-12-04 12:00:02,607] Trial 1330 finished with value: 0.5752162445274535 and parameters: {'max_depth': 24, 'min_samples_split': 18, 'min_samples_leaf': 1, 'max_features': 'sqrt', 'criterion': 'friedman_mse', 'splitter': 'best'}. Best is trial 245 with value: 0.5517975516810654.
[I 2024-12-04 12:00:02,963] Trial 1341 finished with value: 0.5800554303398895 and parameters: {'max_depth': 26, 'min_samples_split': 19, 'min_samples_leaf': 1, 'max_features': 'sqrt', 'criterion': 'friedman_mse', 'splitter': 'best'}. Best is trial 245 with value: 0.5517975516810654.
[I 2024-12-04 12:00:03,256] Trial 1339 finished with value: 1.0679871915906742 and parameters: {'max_depth': 8, 'min_samples_split': 10, 'min_samples_leaf': 2, 'max_features': 'sqrt', 'criterion': 'friedman_mse', 'splitter': 'best'}. Best is trial 245 with value: 0.5517975516810654.
[I 2024-12-04 12:00:03,518] Trial 1325 finished with value: 0.5860539268492149 and parameters: {'max_depth': 24, 'min_samples_split': 15, 'min_samples_leaf': 1, 'max_features': 'sqrt', 'criterion': 'friedman_mse', 'splitter': 'best'}. Best is trial 245 with value: 0.5517975516810654.
[I 2024-12-04 12:00:04,055] Trial 1321 finished with value: 0.5803899068012356 and parameters: {'max_depth': 27, 'min_samples_split': 19, 'min_samples_leaf': 1, 'max_features': 'sqrt', 'criterion': 'friedman_mse', 'splitter': 'best'}. Best is trial 245 with value: 0.5517975516810654.
[I 2024-12-04 12:00:04,682] Trial 1333 finished with value: 0.5782048303592521 and parameters: {'max_depth': 22, 'min_samples_split': 18, 'min_samples_leaf': 1, 'max_features': 'sqrt', 'criterion': 'friedman_mse', 'splitter': 'best'}. Best is trial 245 with value: 0.5517975516810654.
[I 2024-12-04 12:00:06,774] Trial 1328 finished with value: 1.0746652081803512 and parameters: {'max_depth': 32, 'min_samples_split': 20, 'min_samples_leaf': 3, 'max_features': 'sqrt', 'criterion': 'squared_error', 'splitter': 'best'}. Best is trial 245 with value: 0.5517975516810654.
[I 2024-12-04 12:00:06,778] Trial 1342 finished with value: 0.5840920196378592 and parameters: {'max_depth': 25, 'min_samples_split': 13, 'min_samples_leaf': 1, 'max_features': 'sqrt', 'criterion': 'squared_error', 'splitter': 'best'}. Best is trial 245 with value: 0.5517975516810654.
[I 2024-12-04 12:00:07,211] Trial 1347 finished with value: 1.0746652081803512 and parameters: {'max_depth': 32, 'min_samples_split': 16, 'min_samples_leaf': 3, 'max_features': 'sqrt', 'criterion': 'squared_error', 'splitter': 'best'}. Best is trial 245 with value: 0.5517975516810654.
[I 2024-12-04 12:00:07,624] Trial 1343 finished with value: 1.259809444253076 and parameters: {'max_depth': 6, 'min_samples_split': 17, 'min_samples_leaf': 6, 'max_features': 'sqrt', 'criterion': 'squared_error', 'splitter': 'random'}. Best is trial 245 with value: 0.5517975516810654.
[I 2024-12-04 12:00:08,471] Trial 1334 finished with value: 0.5803392978839049 and parameters: {'max_depth': 27, 'min_samples_split': 20, 'min_samples_leaf': 1, 'max_features': 'sqrt', 'criterion': 'squared_error', 'splitter': 'best'}. Best is trial 245 with value: 0.5517975516810654.
[I 2024-12-04 12:00:09,612] Trial 1345 finished with value: 0.5743856205068374 and parameters: {'max_depth': 27, 'min_samples_split': 17, 'min_samples_leaf': 1, 'max_features': 'sqrt', 'criterion': 'friedman_mse', 'splitter': 'best'}. Best is trial 245 with value: 0.5517975516810654.
[I 2024-12-04 12:00:09,793] Trial 1355 finished with value: 1.261454797635251 and parameters: {'max_depth': 33, 'min_samples_split': 3, 'min_samples_leaf': 4, 'max_features': 'log2', 'criterion': 'squared_error', 'splitter': 'best'}. Best is trial 245 with value: 0.5517975516810654.
[I 2024-12-04 12:00:10,088] Trial 1356 finished with value: 0.6205845799839496 and parameters: {'max_depth': 33, 'min_samples_split': 14, 'min_samples_leaf': 1, 'max_features': 'sqrt', 'criterion': 'squared_error', 'splitter': 'best'}. Best is trial 245 with value: 0.5517975516810654.
[I 2024-12-04 12:00:10,225] Trial 1353 finished with value: 1.0746652081803512 and parameters: {'max_depth': 31, 'min_samples_split': 14, 'min_samples_leaf': 3, 'max_features': 'sqrt', 'criterion': 'squared_error', 'splitter': 'best'}. Best is trial 245 with value: 0.5517975516810654.
[I 2024-12-04 12:00:10,692] Trial 1337 finished with value: 1.0746652081803512 and parameters: {'max_depth': 24, 'min_samples_split': 15, 'min_samples_leaf': 3, 'max_features': 'sqrt', 'criterion': 'friedman_mse', 'splitter': 'best'}. Best is trial 245 with value: 0.5517975516810654.
[I 2024-12-04 12:00:11,462] Trial 1364 finished with value: 1.0746652081803512 and parameters: {'max_depth': 27, 'min_samples_split': 17, 'min_samples_leaf': 3, 'max_features': 'sqrt', 'criterion': 'friedman_mse', 'splitter': 'best'}. Best is trial 245 with value: 0.5517975516810654.
[I 2024-12-04 12:00:11,816] Trial 1350 finished with value: 1.3696699836108748 and parameters: {'max_depth': 19, 'min_samples_split': 9, 'min_samples_leaf': 9, 'max_features': 'sqrt', 'criterion': 'absolute_error', 'splitter': 'random'}. Best is trial 245 with value: 0.5517975516810654.
[I 2024-12-04 12:00:11,987] Trial 1348 finished with value: 1.261454797635251 and parameters: {'max_depth': 25, 'min_samples_split': 15, 'min_samples_leaf': 10, 'max_features': 'log2', 'criterion': 'squared_error', 'splitter': 'best'}. Best is trial 245 with value: 0.5517975516810654.
[I 2024-12-04 12:00:12,255] Trial 1346 finished with value: 0.5619094132389268 and parameters: {'max_depth': 29, 'min_samples_split': 18, 'min_samples_leaf': 1, 'max_features': 'sqrt', 'criterion': 'friedman_mse', 'splitter': 'best'}. Best is trial 245 with value: 0.5517975516810654.
[I 2024-12-04 12:00:12,607] Trial 1349 finished with value: 1.1782798013992881 and parameters: {'max_depth': 15, 'min_samples_split': 11, 'min_samples_leaf': 2, 'max_features': 'log2', 'criterion': 'friedman_mse', 'splitter': 'random'}. Best is trial 245 with value: 0.5517975516810654.
[I 2024-12-04 12:00:13,001] Trial 1363 finished with value: 0.6346812484158476 and parameters: {'max_depth': 25, 'min_samples_split': 16, 'min_samples_leaf': 2, 'max_features': 'sqrt', 'criterion': 'friedman_mse', 'splitter': 'best'}. Best is trial 245 with value: 0.5517975516810654.
[I 2024-12-04 12:00:13,020] Trial 1369 finished with value: 0.9424778759919019 and parameters: {'max_depth': 26, 'min_samples_split': 17, 'min_samples_leaf': 3, 'max_features': 'log2', 'criterion': 'friedman_mse', 'splitter': 'best'}. Best is trial 245 with value: 0.5517975516810654.
[I 2024-12-04 12:00:13,152] Trial 1344 finished with value: 0.5619342153963266 and parameters: {'max_depth': 32, 'min_samples_split': 17, 'min_samples_leaf': 1, 'max_features': 'sqrt', 'criterion': 'squared_error', 'splitter': 'best'}. Best is trial 245 with value: 0.5517975516810654.
[I 2024-12-04 12:00:13,159] Trial 1366 finished with value: 0.6076714769073656 and parameters: {'max_depth': 28, 'min_samples_split': 16, 'min_samples_leaf': 1, 'max_features': 'sqrt', 'criterion': 'friedman_mse', 'splitter': 'best'}. Best is trial 245 with value: 0.5517975516810654.
[I 2024-12-04 12:00:13,771] Trial 1359 finished with value: 0.7021416529015542 and parameters: {'max_depth': 27, 'min_samples_split': 15, 'min_samples_leaf': 1, 'max_features': 'log2', 'criterion': 'absolute_error', 'splitter': 'best'}. Best is trial 245 with value: 0.5517975516810654.
[I 2024-12-04 12:00:14,127] Trial 1354 finished with value: 1.3696699836108748 and parameters: {'max_depth': 24, 'min_samples_split': 3, 'min_samples_leaf': 9, 'max_features': 'sqrt', 'criterion': 'absolute_error', 'splitter': 'random'}. Best is trial 245 with value: 0.5517975516810654.
[I 2024-12-04 12:00:14,244] Trial 1351 finished with value: 0.8770853024537941 and parameters: {'max_depth': 28, 'min_samples_split': 20, 'min_samples_leaf': 1, 'max_features': 'sqrt', 'criterion': 'absolute_error', 'splitter': 'best'}. Best is trial 245 with value: 0.5517975516810654.
[I 2024-12-04 12:00:14,277] Trial 1365 finished with value: 0.9424778759919019 and parameters: {'max_depth': 35, 'min_samples_split': 19, 'min_samples_leaf': 3, 'max_features': 'log2', 'criterion': 'friedman_mse', 'splitter': 'best'}. Best is trial 245 with value: 0.5517975516810654.
[I 2024-12-04 12:00:15,825] Trial 1371 finished with value: 0.6033893981188482 and parameters: {'max_depth': 27, 'min_samples_split': 15, 'min_samples_leaf': 1, 'max_features': 'sqrt', 'criterion': 'friedman_mse', 'splitter': 'best'}. Best is trial 245 with value: 0.5517975516810654.
[I 2024-12-04 12:00:15,919] Trial 1358 finished with value: 0.5693224466498369 and parameters: {'max_depth': 22, 'min_samples_split': 17, 'min_samples_leaf': 1, 'max_features': 'sqrt', 'criterion': 'squared_error', 'splitter': 'best'}. Best is trial 245 with value: 0.5517975516810654.
[I 2024-12-04 12:00:16,751] Trial 1362 finished with value: 1.0746652081803512 and parameters: {'max_depth': 26, 'min_samples_split': 12, 'min_samples_leaf': 3, 'max_features': 'sqrt', 'criterion': 'squared_error', 'splitter': 'best'}. Best is trial 245 with value: 0.5517975516810654.
[I 2024-12-04 12:00:17,636] Trial 1360 finished with value: 0.5784943231450516 and parameters: {'max_depth': 27, 'min_samples_split': 14, 'min_samples_leaf': 1, 'max_features': 'sqrt', 'criterion': 'squared_error', 'splitter': 'best'}. Best is trial 245 with value: 0.5517975516810654.
[I 2024-12-04 12:00:17,774] Trial 1361 finished with value: 1.085029928131974 and parameters: {'max_depth': 27, 'min_samples_split': 20, 'min_samples_leaf': 8, 'max_features': 'sqrt', 'criterion': 'squared_error', 'splitter': 'best'}. Best is trial 245 with value: 0.5517975516810654.
[I 2024-12-04 12:00:18,834] Trial 1367 finished with value: 0.5720131029894097 and parameters: {'max_depth': 26, 'min_samples_split': 15, 'min_samples_leaf': 1, 'max_features': 'sqrt', 'criterion': 'friedman_mse', 'splitter': 'best'}. Best is trial 245 with value: 0.5517975516810654.
[I 2024-12-04 12:00:18,835] Trial 1368 finished with value: 0.5968934631423269 and parameters: {'max_depth': 23, 'min_samples_split': 10, 'min_samples_leaf': 2, 'max_features': 'sqrt', 'criterion': 'squared_error', 'splitter': 'best'}. Best is trial 245 with value: 0.5517975516810654.
[I 2024-12-04 12:00:19,695] Trial 1377 finished with value: 0.5945975836542683 and parameters: {'max_depth': 30, 'min_samples_split': 18, 'min_samples_leaf': 2, 'max_features': 'sqrt', 'criterion': 'friedman_mse', 'splitter': 'best'}. Best is trial 245 with value: 0.5517975516810654.
[I 2024-12-04 12:00:19,697] Trial 1373 finished with value: 1.0746652081803512 and parameters: {'max_depth': 30, 'min_samples_split': 19, 'min_samples_leaf': 3, 'max_features': 'sqrt', 'criterion': 'friedman_mse', 'splitter': 'best'}. Best is trial 245 with value: 0.5517975516810654.
[I 2024-12-04 12:00:19,759] Trial 1352 finished with value: 1.422615004128031 and parameters: {'max_depth': 23, 'min_samples_split': 15, 'min_samples_leaf': 6, 'max_features': 'sqrt', 'criterion': 'absolute_error', 'splitter': 'best'}. Best is trial 245 with value: 0.5517975516810654.
[I 2024-12-04 12:00:19,974] Trial 1370 finished with value: 1.0746652081803512 and parameters: {'max_depth': 29, 'min_samples_split': 16, 'min_samples_leaf': 3, 'max_features': 'sqrt', 'criterion': 'friedman_mse', 'splitter': 'best'}. Best is trial 245 with value: 0.5517975516810654.
[I 2024-12-04 12:00:21,044] Trial 1372 finished with value: 1.0746652081803512 and parameters: {'max_depth': 17, 'min_samples_split': 12, 'min_samples_leaf': 3, 'max_features': 'sqrt', 'criterion': 'friedman_mse', 'splitter': 'best'}. Best is trial 245 with value: 0.5517975516810654.
[I 2024-12-04 12:00:22,756] Trial 1374 finished with value: 0.6366870857247696 and parameters: {'max_depth': 31, 'min_samples_split': 16, 'min_samples_leaf': 2, 'max_features': 'sqrt', 'criterion': 'squared_error', 'splitter': 'best'}. Best is trial 245 with value: 0.5517975516810654.
[I 2024-12-04 12:00:22,859] Trial 1386 finished with value: 0.7733827950170924 and parameters: {'max_depth': 26, 'min_samples_split': 18, 'min_samples_leaf': 1, 'max_features': 'log2', 'criterion': 'friedman_mse', 'splitter': 'best'}. Best is trial 245 with value: 0.5517975516810654.
[I 2024-12-04 12:00:23,198] Trial 1388 finished with value: 1.261454797635251 and parameters: {'max_depth': 22, 'min_samples_split': 2, 'min_samples_leaf': 7, 'max_features': 'log2', 'criterion': 'friedman_mse', 'splitter': 'best'}. Best is trial 245 with value: 0.5517975516810654.
[I 2024-12-04 12:00:23,278] Trial 1357 finished with value: 1.0676909185264827 and parameters: {'max_depth': 17, 'min_samples_split': 7, 'min_samples_leaf': 1, 'max_features': 'sqrt', 'criterion': 'squared_error', 'splitter': 'random'}. Best is trial 245 with value: 0.5517975516810654.
[I 2024-12-04 12:00:23,677] Trial 1381 finished with value: 0.6241169559432111 and parameters: {'max_depth': 30, 'min_samples_split': 16, 'min_samples_leaf': 1, 'max_features': 'sqrt', 'criterion': 'squared_error', 'splitter': 'best'}. Best is trial 245 with value: 0.5517975516810654.
[I 2024-12-04 12:00:24,032] Trial 1375 finished with value: 0.6616723436258111 and parameters: {'max_depth': 13, 'min_samples_split': 8, 'min_samples_leaf': 1, 'max_features': 'sqrt', 'criterion': 'friedman_mse', 'splitter': 'best'}. Best is trial 245 with value: 0.5517975516810654.
[I 2024-12-04 12:00:24,571] Trial 1391 finished with value: 0.5839147361488086 and parameters: {'max_depth': 33, 'min_samples_split': 18, 'min_samples_leaf': 1, 'max_features': 'sqrt', 'criterion': 'friedman_mse', 'splitter': 'best'}. Best is trial 245 with value: 0.5517975516810654.
[I 2024-12-04 12:00:24,981] Trial 1379 finished with value: 0.6033893981188482 and parameters: {'max_depth': 27, 'min_samples_split': 15, 'min_samples_leaf': 1, 'max_features': 'sqrt', 'criterion': 'friedman_mse', 'splitter': 'best'}. Best is trial 245 with value: 0.5517975516810654.
[I 2024-12-04 12:00:25,194] Trial 1376 finished with value: 0.6028119884261227 and parameters: {'max_depth': 23, 'min_samples_split': 9, 'min_samples_leaf': 1, 'max_features': 'sqrt', 'criterion': 'squared_error', 'splitter': 'best'}. Best is trial 245 with value: 0.5517975516810654.
[I 2024-12-04 12:00:25,452] Trial 1389 finished with value: 0.8827160346356013 and parameters: {'max_depth': 35, 'min_samples_split': 15, 'min_samples_leaf': 1, 'max_features': 'sqrt', 'criterion': 'absolute_error', 'splitter': 'best'}. Best is trial 245 with value: 0.5517975516810654.
[I 2024-12-04 12:00:25,644] Trial 1378 finished with value: 0.5743856205068374 and parameters: {'max_depth': 27, 'min_samples_split': 17, 'min_samples_leaf': 1, 'max_features': 'sqrt', 'criterion': 'friedman_mse', 'splitter': 'best'}. Best is trial 245 with value: 0.5517975516810654.
[I 2024-12-04 12:00:25,646] Trial 1394 finished with value: 1.0746652081803512 and parameters: {'max_depth': 35, 'min_samples_split': 19, 'min_samples_leaf': 3, 'max_features': 'sqrt', 'criterion': 'friedman_mse', 'splitter': 'best'}. Best is trial 245 with value: 0.5517975516810654.
