[I 2024-12-04 12:21:37,400] Trial 2074 finished with value: 0.31448510568996846 and parameters: {'n_estimators': 801, 'max_depth': 41, 'min_samples_split': 4, 'min_samples_leaf': 1, 'max_features': 'sqrt', 'bootstrap': False, 'criterion': 'squared_error'}. Best is trial 341 with value: 0.2909369124469028.
[I 2024-12-04 12:21:41,304] Trial 2075 finished with value: 0.7041938579805458 and parameters: {'n_estimators': 696, 'max_depth': 49, 'min_samples_split': 38, 'min_samples_leaf': 2, 'max_features': 'log2', 'bootstrap': False, 'criterion': 'squared_error'}. Best is trial 341 with value: 0.2909369124469028.
[I 2024-12-04 12:21:41,658] Trial 2080 finished with value: 0.29538924666139216 and parameters: {'n_estimators': 344, 'max_depth': 50, 'min_samples_split': 3, 'min_samples_leaf': 1, 'max_features': 'sqrt', 'bootstrap': False, 'criterion': 'squared_error'}. Best is trial 341 with value: 0.2909369124469028.
[I 2024-12-04 12:21:46,232] Trial 2012 finished with value: 0.38726295653575576 and parameters: {'n_estimators': 775, 'max_depth': 32, 'min_samples_split': 14, 'min_samples_leaf': 3, 'max_features': None, 'bootstrap': True, 'criterion': 'absolute_error'}. Best is trial 341 with value: 0.2909369124469028.
[I 2024-12-04 12:21:46,986] Trial 2090 finished with value: 0.2997725988687561 and parameters: {'n_estimators': 256, 'max_depth': 50, 'min_samples_split': 2, 'min_samples_leaf': 1, 'max_features': 'sqrt', 'bootstrap': False, 'criterion': 'squared_error'}. Best is trial 341 with value: 0.2909369124469028.
[I 2024-12-04 12:21:47,415] Trial 2084 finished with value: 0.3131529635237578 and parameters: {'n_estimators': 340, 'max_depth': 45, 'min_samples_split': 5, 'min_samples_leaf': 1, 'max_features': 'sqrt', 'bootstrap': False, 'criterion': 'squared_error'}. Best is trial 341 with value: 0.2909369124469028.
[I 2024-12-04 12:21:48,578] Trial 2088 finished with value: 0.3164371522584909 and parameters: {'n_estimators': 247, 'max_depth': 43, 'min_samples_split': 5, 'min_samples_leaf': 1, 'max_features': 'sqrt', 'bootstrap': False, 'criterion': 'squared_error'}. Best is trial 341 with value: 0.2909369124469028.
[I 2024-12-04 12:21:48,987] Trial 2082 finished with value: 0.4440878081471241 and parameters: {'n_estimators': 173, 'max_depth': 50, 'min_samples_split': 5, 'min_samples_leaf': 2, 'max_features': 'sqrt', 'bootstrap': False, 'criterion': 'squared_error'}. Best is trial 341 with value: 0.2909369124469028.
[I 2024-12-04 12:21:50,170] Trial 2083 finished with value: 0.379399291439575 and parameters: {'n_estimators': 290, 'max_depth': 50, 'min_samples_split': 3, 'min_samples_leaf': 1, 'max_features': 'log2', 'bootstrap': False, 'criterion': 'squared_error'}. Best is trial 341 with value: 0.2909369124469028.
[I 2024-12-04 12:21:50,336] Trial 2085 finished with value: 0.455042613834415 and parameters: {'n_estimators': 372, 'max_depth': 33, 'min_samples_split': 6, 'min_samples_leaf': 2, 'max_features': 'sqrt', 'bootstrap': False, 'criterion': 'squared_error'}. Best is trial 341 with value: 0.2909369124469028.
[I 2024-12-04 12:21:50,458] Trial 2091 finished with value: 0.30152208979617634 and parameters: {'n_estimators': 584, 'max_depth': 43, 'min_samples_split': 3, 'min_samples_leaf': 1, 'max_features': 'sqrt', 'bootstrap': False, 'criterion': 'squared_error'}. Best is trial 341 with value: 0.2909369124469028.
[I 2024-12-04 12:21:50,650] Trial 2094 finished with value: 0.44615143443236144 and parameters: {'n_estimators': 115, 'max_depth': 49, 'min_samples_split': 5, 'min_samples_leaf': 2, 'max_features': 'sqrt', 'bootstrap': False, 'criterion': 'squared_error'}. Best is trial 341 with value: 0.2909369124469028.
[I 2024-12-04 12:21:50,833] Trial 2089 finished with value: 0.3001755743415285 and parameters: {'n_estimators': 343, 'max_depth': 50, 'min_samples_split': 4, 'min_samples_leaf': 1, 'max_features': 'sqrt', 'bootstrap': False, 'criterion': 'squared_error'}. Best is trial 341 with value: 0.2909369124469028.
[I 2024-12-04 12:21:51,185] Trial 2048 finished with value: 0.30384510669163 and parameters: {'n_estimators': 529, 'max_depth': 50, 'min_samples_split': 2, 'min_samples_leaf': 1, 'max_features': 'sqrt', 'bootstrap': False, 'criterion': 'absolute_error'}. Best is trial 341 with value: 0.2909369124469028.
[I 2024-12-04 12:21:51,238] Trial 2087 finished with value: 0.4424694372984487 and parameters: {'n_estimators': 248, 'max_depth': 50, 'min_samples_split': 3, 'min_samples_leaf': 2, 'max_features': 'sqrt', 'bootstrap': False, 'criterion': 'squared_error'}. Best is trial 341 with value: 0.2909369124469028.
[I 2024-12-04 12:21:51,474] Trial 2063 finished with value: 0.32462547862198093 and parameters: {'n_estimators': 369, 'max_depth': 40, 'min_samples_split': 2, 'min_samples_leaf': 1, 'max_features': 'sqrt', 'bootstrap': False, 'criterion': 'absolute_error'}. Best is trial 341 with value: 0.2909369124469028.
[I 2024-12-04 12:21:52,764] Trial 2095 finished with value: 0.4430789573114092 and parameters: {'n_estimators': 780, 'max_depth': 50, 'min_samples_split': 2, 'min_samples_leaf': 2, 'max_features': 'sqrt', 'bootstrap': False, 'criterion': 'squared_error'}. Best is trial 341 with value: 0.2909369124469028.
[I 2024-12-04 12:21:52,925] Trial 2062 finished with value: 0.5441528481495258 and parameters: {'n_estimators': 877, 'max_depth': 37, 'min_samples_split': 45, 'min_samples_leaf': 12, 'max_features': None, 'bootstrap': True, 'criterion': 'absolute_error'}. Best is trial 341 with value: 0.2909369124469028.
[I 2024-12-04 12:21:53,817] Trial 2092 finished with value: 0.29391880332283715 and parameters: {'n_estimators': 483, 'max_depth': 50, 'min_samples_split': 3, 'min_samples_leaf': 1, 'max_features': 'sqrt', 'bootstrap': False, 'criterion': 'squared_error'}. Best is trial 341 with value: 0.2909369124469028.
[I 2024-12-04 12:21:54,358] Trial 2081 finished with value: 0.3110472328830109 and parameters: {'n_estimators': 371, 'max_depth': 50, 'min_samples_split': 4, 'min_samples_leaf': 1, 'max_features': 'sqrt', 'bootstrap': False, 'criterion': 'absolute_error'}. Best is trial 341 with value: 0.2909369124469028.
[I 2024-12-04 12:21:54,369] Trial 2078 finished with value: 0.44779155513323626 and parameters: {'n_estimators': 553, 'max_depth': 25, 'min_samples_split': 7, 'min_samples_leaf': 1, 'max_features': 'sqrt', 'bootstrap': True, 'criterion': 'absolute_error'}. Best is trial 341 with value: 0.2909369124469028.
[I 2024-12-04 12:21:54,846] Trial 2097 finished with value: 0.2952109083688594 and parameters: {'n_estimators': 265, 'max_depth': 50, 'min_samples_split': 3, 'min_samples_leaf': 1, 'max_features': 'sqrt', 'bootstrap': False, 'criterion': 'squared_error'}. Best is trial 341 with value: 0.2909369124469028.
[I 2024-12-04 12:21:55,103] Trial 2073 finished with value: 0.6522249769643131 and parameters: {'n_estimators': 643, 'max_depth': 22, 'min_samples_split': 27, 'min_samples_leaf': 1, 'max_features': 'log2', 'bootstrap': True, 'criterion': 'absolute_error'}. Best is trial 341 with value: 0.2909369124469028.
[I 2024-12-04 12:21:55,930] Trial 2098 finished with value: 0.300750907414017 and parameters: {'n_estimators': 249, 'max_depth': 43, 'min_samples_split': 3, 'min_samples_leaf': 1, 'max_features': 'sqrt', 'bootstrap': False, 'criterion': 'squared_error'}. Best is trial 341 with value: 0.2909369124469028.
[I 2024-12-04 12:21:55,964] Trial 2105 finished with value: 0.44244322189677143 and parameters: {'n_estimators': 113, 'max_depth': 50, 'min_samples_split': 3, 'min_samples_leaf': 2, 'max_features': 'sqrt', 'bootstrap': False, 'criterion': 'squared_error'}. Best is trial 341 with value: 0.2909369124469028.
[I 2024-12-04 12:21:56,971] Trial 2096 finished with value: 0.30055759384796155 and parameters: {'n_estimators': 249, 'max_depth': 50, 'min_samples_split': 4, 'min_samples_leaf': 1, 'max_features': 'sqrt', 'bootstrap': False, 'criterion': 'squared_error'}. Best is trial 341 with value: 0.2909369124469028.
[I 2024-12-04 12:21:58,441] Trial 2101 finished with value: 0.31045713120367513 and parameters: {'n_estimators': 596, 'max_depth': 42, 'min_samples_split': 2, 'min_samples_leaf': 1, 'max_features': 'sqrt', 'bootstrap': False, 'criterion': 'squared_error'}. Best is trial 341 with value: 0.2909369124469028.
[I 2024-12-04 12:21:58,509] Trial 2103 finished with value: 0.2983852183731019 and parameters: {'n_estimators': 153, 'max_depth': 42, 'min_samples_split': 3, 'min_samples_leaf': 1, 'max_features': 'sqrt', 'bootstrap': False, 'criterion': 'squared_error'}. Best is trial 341 with value: 0.2909369124469028.
[I 2024-12-04 12:21:59,319] Trial 2104 finished with value: 0.29409254747552094 and parameters: {'n_estimators': 537, 'max_depth': 50, 'min_samples_split': 3, 'min_samples_leaf': 1, 'max_features': 'sqrt', 'bootstrap': False, 'criterion': 'squared_error'}. Best is trial 341 with value: 0.2909369124469028.
[I 2024-12-04 12:22:00,089] Trial 2102 finished with value: 0.29374905065990575 and parameters: {'n_estimators': 728, 'max_depth': 50, 'min_samples_split': 3, 'min_samples_leaf': 1, 'max_features': 'sqrt', 'bootstrap': False, 'criterion': 'squared_error'}. Best is trial 341 with value: 0.2909369124469028.
[I 2024-12-04 12:22:02,590] Trial 2099 finished with value: 0.945294524651323 and parameters: {'n_estimators': 851, 'max_depth': 6, 'min_samples_split': 5, 'min_samples_leaf': 6, 'max_features': 'log2', 'bootstrap': True, 'criterion': 'squared_error'}. Best is trial 341 with value: 0.2909369124469028.
[I 2024-12-04 12:22:03,910] Trial 2106 finished with value: 0.38921917674239315 and parameters: {'n_estimators': 278, 'max_depth': 40, 'min_samples_split': 2, 'min_samples_leaf': 1, 'max_features': None, 'bootstrap': False, 'criterion': 'squared_error'}. Best is trial 341 with value: 0.2909369124469028.
[I 2024-12-04 12:22:07,625] Trial 2086 finished with value: 0.8111567681381365 and parameters: {'n_estimators': 960, 'max_depth': 9, 'min_samples_split': 14, 'min_samples_leaf': 1, 'max_features': 'log2', 'bootstrap': False, 'criterion': 'absolute_error'}. Best is trial 341 with value: 0.2909369124469028.
[I 2024-12-04 12:22:07,719] Trial 2109 finished with value: 0.4401143205280573 and parameters: {'n_estimators': 499, 'max_depth': 49, 'min_samples_split': 2, 'min_samples_leaf': 2, 'max_features': 'sqrt', 'bootstrap': False, 'criterion': 'squared_error'}. Best is trial 341 with value: 0.2909369124469028.
[I 2024-12-04 12:22:08,339] Trial 2100 finished with value: 0.409851814855099 and parameters: {'n_estimators': 779, 'max_depth': 45, 'min_samples_split': 2, 'min_samples_leaf': 1, 'max_features': 'log2', 'bootstrap': True, 'criterion': 'squared_error'}. Best is trial 341 with value: 0.2909369124469028.
[I 2024-12-04 12:22:09,896] Trial 2108 finished with value: 0.3377988378284999 and parameters: {'n_estimators': 304, 'max_depth': 34, 'min_samples_split': 4, 'min_samples_leaf': 1, 'max_features': 'sqrt', 'bootstrap': False, 'criterion': 'squared_error'}. Best is trial 341 with value: 0.2909369124469028.
[I 2024-12-04 12:22:10,339] Trial 2107 finished with value: 0.5837034014855039 and parameters: {'n_estimators': 257, 'max_depth': 49, 'min_samples_split': 25, 'min_samples_leaf': 3, 'max_features': 'sqrt', 'bootstrap': True, 'criterion': 'absolute_error'}. Best is trial 341 with value: 0.2909369124469028.
[I 2024-12-04 12:22:11,059] Trial 2116 finished with value: 0.30741596746123856 and parameters: {'n_estimators': 262, 'max_depth': 42, 'min_samples_split': 2, 'min_samples_leaf': 1, 'max_features': 'sqrt', 'bootstrap': False, 'criterion': 'squared_error'}. Best is trial 341 with value: 0.2909369124469028.
[I 2024-12-04 12:22:11,621] Trial 2111 finished with value: 0.31661365458668483 and parameters: {'n_estimators': 601, 'max_depth': 50, 'min_samples_split': 8, 'min_samples_leaf': 1, 'max_features': 'sqrt', 'bootstrap': False, 'criterion': 'squared_error'}. Best is trial 341 with value: 0.2909369124469028.
[I 2024-12-04 12:22:12,638] Trial 2110 finished with value: 0.4413718512458515 and parameters: {'n_estimators': 418, 'max_depth': 50, 'min_samples_split': 3, 'min_samples_leaf': 2, 'max_features': 'sqrt', 'bootstrap': False, 'criterion': 'squared_error'}. Best is trial 341 with value: 0.2909369124469028.
[I 2024-12-04 12:22:14,472] Trial 2121 finished with value: 0.3012977682464866 and parameters: {'n_estimators': 462, 'max_depth': 43, 'min_samples_split': 3, 'min_samples_leaf': 1, 'max_features': 'sqrt', 'bootstrap': False, 'criterion': 'squared_error'}. Best is trial 341 with value: 0.2909369124469028.
[I 2024-12-04 12:22:14,513] Trial 2115 finished with value: 0.29449185695200614 and parameters: {'n_estimators': 377, 'max_depth': 50, 'min_samples_split': 3, 'min_samples_leaf': 1, 'max_features': 'sqrt', 'bootstrap': False, 'criterion': 'squared_error'}. Best is trial 341 with value: 0.2909369124469028.
[I 2024-12-04 12:22:15,117] Trial 2113 finished with value: 0.30804815616598713 and parameters: {'n_estimators': 324, 'max_depth': 50, 'min_samples_split': 6, 'min_samples_leaf': 1, 'max_features': 'sqrt', 'bootstrap': False, 'criterion': 'squared_error'}. Best is trial 341 with value: 0.2909369124469028.
[I 2024-12-04 12:22:15,119] Trial 2119 finished with value: 0.8487961804562055 and parameters: {'n_estimators': 940, 'max_depth': 49, 'min_samples_split': 12, 'min_samples_leaf': 4, 'max_features': 'log2', 'bootstrap': False, 'criterion': 'squared_error'}. Best is trial 341 with value: 0.2909369124469028.
[I 2024-12-04 12:22:15,475] Trial 2114 finished with value: 0.2988306379704992 and parameters: {'n_estimators': 131, 'max_depth': 50, 'min_samples_split': 2, 'min_samples_leaf': 1, 'max_features': 'sqrt', 'bootstrap': False, 'criterion': 'squared_error'}. Best is trial 341 with value: 0.2909369124469028.
[I 2024-12-04 12:22:15,926] Trial 2122 finished with value: 0.3102517583686943 and parameters: {'n_estimators': 528, 'max_depth': 42, 'min_samples_split': 4, 'min_samples_leaf': 1, 'max_features': 'sqrt', 'bootstrap': False, 'criterion': 'squared_error'}. Best is trial 341 with value: 0.2909369124469028.
[I 2024-12-04 12:22:16,543] Trial 2128 finished with value: 0.44327912710125805 and parameters: {'n_estimators': 626, 'max_depth': 43, 'min_samples_split': 3, 'min_samples_leaf': 2, 'max_features': 'sqrt', 'bootstrap': False, 'criterion': 'squared_error'}. Best is trial 341 with value: 0.2909369124469028.
[I 2024-12-04 12:22:16,885] Trial 2127 finished with value: 0.307141109913568 and parameters: {'n_estimators': 406, 'max_depth': 43, 'min_samples_split': 2, 'min_samples_leaf': 1, 'max_features': 'sqrt', 'bootstrap': False, 'criterion': 'squared_error'}. Best is trial 341 with value: 0.2909369124469028.
[I 2024-12-04 12:22:19,301] Trial 2125 finished with value: 0.2997731622441819 and parameters: {'n_estimators': 102, 'max_depth': 44, 'min_samples_split': 2, 'min_samples_leaf': 1, 'max_features': 'sqrt', 'bootstrap': False, 'criterion': 'squared_error'}. Best is trial 341 with value: 0.2909369124469028.
[I 2024-12-04 12:22:19,425] Trial 2120 finished with value: 0.3086878918097984 and parameters: {'n_estimators': 220, 'max_depth': 50, 'min_samples_split': 6, 'min_samples_leaf': 1, 'max_features': 'sqrt', 'bootstrap': False, 'criterion': 'squared_error'}. Best is trial 341 with value: 0.2909369124469028.
[I 2024-12-04 12:22:20,123] Trial 2129 finished with value: 0.2921174992987839 and parameters: {'n_estimators': 573, 'max_depth': 49, 'min_samples_split': 3, 'min_samples_leaf': 1, 'max_features': 'sqrt', 'bootstrap': False, 'criterion': 'squared_error'}. Best is trial 341 with value: 0.2909369124469028.
[I 2024-12-04 12:22:20,566] Trial 2093 finished with value: 0.363938341178571 and parameters: {'n_estimators': 293, 'max_depth': 24, 'min_samples_split': 3, 'min_samples_leaf': 2, 'max_features': None, 'bootstrap': True, 'criterion': 'absolute_error'}. Best is trial 341 with value: 0.2909369124469028.
[I 2024-12-04 12:22:21,183] Trial 2123 finished with value: 0.3118699414935756 and parameters: {'n_estimators': 114, 'max_depth': 42, 'min_samples_split': 2, 'min_samples_leaf': 1, 'max_features': 'sqrt', 'bootstrap': False, 'criterion': 'squared_error'}. Best is trial 341 with value: 0.2909369124469028.
[I 2024-12-04 12:22:21,198] Trial 2117 finished with value: 0.3312698237095106 and parameters: {'n_estimators': 434, 'max_depth': 48, 'min_samples_split': 3, 'min_samples_leaf': 1, 'max_features': 'sqrt', 'bootstrap': True, 'criterion': 'absolute_error'}. Best is trial 341 with value: 0.2909369124469028.
[I 2024-12-04 12:22:21,347] Trial 2131 finished with value: 0.4441531846341231 and parameters: {'n_estimators': 474, 'max_depth': 41, 'min_samples_split': 8, 'min_samples_leaf': 2, 'max_features': 'sqrt', 'bootstrap': False, 'criterion': 'squared_error'}. Best is trial 341 with value: 0.2909369124469028.
[I 2024-12-04 12:22:21,952] Trial 2118 finished with value: 0.7108568456764619 and parameters: {'n_estimators': 422, 'max_depth': 37, 'min_samples_split': 4, 'min_samples_leaf': 2, 'max_features': 'log2', 'bootstrap': False, 'criterion': 'absolute_error'}. Best is trial 341 with value: 0.2909369124469028.
[I 2024-12-04 12:22:25,887] Trial 2130 finished with value: 0.32187212527712994 and parameters: {'n_estimators': 127, 'max_depth': 38, 'min_samples_split': 4, 'min_samples_leaf': 1, 'max_features': 'sqrt', 'bootstrap': False, 'criterion': 'squared_error'}. Best is trial 341 with value: 0.2909369124469028.
[I 2024-12-04 12:22:26,062] Trial 2124 finished with value: 0.2983454590155714 and parameters: {'n_estimators': 550, 'max_depth': 50, 'min_samples_split': 2, 'min_samples_leaf': 1, 'max_features': 'sqrt', 'bootstrap': False, 'criterion': 'squared_error'}. Best is trial 341 with value: 0.2909369124469028.
[I 2024-12-04 12:22:26,075] Trial 2133 finished with value: 0.3413066458818215 and parameters: {'n_estimators': 257, 'max_depth': 50, 'min_samples_split': 13, 'min_samples_leaf': 1, 'max_features': 'sqrt', 'bootstrap': False, 'criterion': 'squared_error'}. Best is trial 341 with value: 0.2909369124469028.
[I 2024-12-04 12:22:27,487] Trial 2126 finished with value: 0.5433043272162251 and parameters: {'n_estimators': 170, 'max_depth': 24, 'min_samples_split': 3, 'min_samples_leaf': 3, 'max_features': 'sqrt', 'bootstrap': False, 'criterion': 'absolute_error'}. Best is trial 341 with value: 0.2909369124469028.
[I 2024-12-04 12:22:29,629] Trial 2135 finished with value: 0.30651182790640685 and parameters: {'n_estimators': 338, 'max_depth': 45, 'min_samples_split': 4, 'min_samples_leaf': 1, 'max_features': 'sqrt', 'bootstrap': False, 'criterion': 'squared_error'}. Best is trial 341 with value: 0.2909369124469028.
[I 2024-12-04 12:22:30,171] Trial 2132 finished with value: 0.3104751760022234 and parameters: {'n_estimators': 590, 'max_depth': 42, 'min_samples_split': 4, 'min_samples_leaf': 1, 'max_features': 'sqrt', 'bootstrap': False, 'criterion': 'squared_error'}. Best is trial 341 with value: 0.2909369124469028.
[I 2024-12-04 12:22:30,234] Trial 2139 finished with value: 0.30073170897172874 and parameters: {'n_estimators': 631, 'max_depth': 50, 'min_samples_split': 4, 'min_samples_leaf': 1, 'max_features': 'sqrt', 'bootstrap': False, 'criterion': 'squared_error'}. Best is trial 341 with value: 0.2909369124469028.
[I 2024-12-04 12:22:33,262] Trial 2134 finished with value: 0.3063024661226242 and parameters: {'n_estimators': 722, 'max_depth': 43, 'min_samples_split': 2, 'min_samples_leaf': 1, 'max_features': 'sqrt', 'bootstrap': False, 'criterion': 'squared_error'}. Best is trial 341 with value: 0.2909369124469028.
[I 2024-12-04 12:22:33,866] Trial 2136 finished with value: 0.29519980571216947 and parameters: {'n_estimators': 715, 'max_depth': 47, 'min_samples_split': 3, 'min_samples_leaf': 1, 'max_features': 'sqrt', 'bootstrap': False, 'criterion': 'squared_error'}. Best is trial 341 with value: 0.2909369124469028.
[I 2024-12-04 12:22:34,464] Trial 2143 finished with value: 0.8623295460467317 and parameters: {'n_estimators': 667, 'max_depth': 36, 'min_samples_split': 44, 'min_samples_leaf': 4, 'max_features': 'log2', 'bootstrap': False, 'criterion': 'absolute_error'}. Best is trial 341 with value: 0.2909369124469028.
[I 2024-12-04 12:22:34,466] Trial 2141 finished with value: 0.4415136258904814 and parameters: {'n_estimators': 657, 'max_depth': 50, 'min_samples_split': 3, 'min_samples_leaf': 2, 'max_features': 'sqrt', 'bootstrap': False, 'criterion': 'squared_error'}. Best is trial 341 with value: 0.2909369124469028.
[I 2024-12-04 12:22:35,376] Trial 2152 finished with value: 0.8476778129805158 and parameters: {'n_estimators': 461, 'max_depth': 8, 'min_samples_split': 15, 'min_samples_leaf': 13, 'max_features': 'sqrt', 'bootstrap': False, 'criterion': 'squared_error'}. Best is trial 341 with value: 0.2909369124469028.
[I 2024-12-04 12:22:36,975] Trial 2138 finished with value: 0.29863824730715716 and parameters: {'n_estimators': 611, 'max_depth': 50, 'min_samples_split': 2, 'min_samples_leaf': 1, 'max_features': 'sqrt', 'bootstrap': False, 'criterion': 'squared_error'}. Best is trial 341 with value: 0.2909369124469028.
[I 2024-12-04 12:22:37,126] Trial 2149 finished with value: 0.4803660415144736 and parameters: {'n_estimators': 311, 'max_depth': 37, 'min_samples_split': 9, 'min_samples_leaf': 1, 'max_features': 'log2', 'bootstrap': False, 'criterion': 'squared_error'}. Best is trial 341 with value: 0.2909369124469028.
[I 2024-12-04 12:22:38,725] Trial 2112 finished with value: 0.3080956580900378 and parameters: {'n_estimators': 725, 'max_depth': 50, 'min_samples_split': 4, 'min_samples_leaf': 1, 'max_features': 'sqrt', 'bootstrap': False, 'criterion': 'absolute_error'}. Best is trial 341 with value: 0.2909369124469028.
