[I 2024-12-04 20:43:23,428] Trial 1967 finished with value: 0.35921117932039864 and parameters: {'kernel_type': 'Matern', 'length_scale': 0.37621827096588467, 'noise_level': 0.7991067168583627, 'constant_value': 1384.1205965260835, 'nu': 0.5}. Best is trial 881 with value: 0.35916990930150405.
[I 2024-12-04 20:43:23,946] Trial 1968 finished with value: 0.35921124749759303 and parameters: {'kernel_type': 'Matern', 'length_scale': 0.440671338698334, 'noise_level': 0.012561010717472277, 'constant_value': 1059.3502996798916, 'nu': 0.5}. Best is trial 881 with value: 0.35916990930150405.
[I 2024-12-04 20:43:26,395] Trial 1969 finished with value: 0.3592109006103946 and parameters: {'kernel_type': 'Matern', 'length_scale': 2.007685727368792, 'noise_level': 0.054040948239214216, 'constant_value': 1815.2066512844783, 'nu': 0.5}. Best is trial 881 with value: 0.35916990930150405.
[I 2024-12-04 20:43:28,171] Trial 1970 finished with value: 0.35921078094173603 and parameters: {'kernel_type': 'Matern', 'length_scale': 0.65772508517639, 'noise_level': 0.034946478521560076, 'constant_value': 275.20374000053215, 'nu': 0.5}. Best is trial 881 with value: 0.35916990930150405.
[I 2024-12-04 20:43:29,211] Trial 1971 finished with value: 0.359211043168517 and parameters: {'kernel_type': 'Matern', 'length_scale': 0.6808163169208492, 'noise_level': 0.03360717716368876, 'constant_value': 96256.56282218861, 'nu': 0.5}. Best is trial 881 with value: 0.35916990930150405.
[I 2024-12-04 20:43:31,299] Trial 1972 finished with value: 0.35921117782390927 and parameters: {'kernel_type': 'Matern', 'length_scale': 7.47459016880372, 'noise_level': 0.8901821061804805, 'constant_value': 94.94515963721, 'nu': 0.5}. Best is trial 881 with value: 0.35916990930150405.
[I 2024-12-04 20:43:33,036] Trial 1973 finished with value: 0.35921131336554846 and parameters: {'kernel_type': 'Matern', 'length_scale': 1.1980031117215648, 'noise_level': 0.8641619379874873, 'constant_value': 0.33475742010064835, 'nu': 0.5}. Best is trial 881 with value: 0.35916990930150405.
[I 2024-12-04 20:43:34,461] Trial 1974 finished with value: 0.42268974123477776 and parameters: {'kernel_type': 'Matern', 'length_scale': 0.8126084464873446, 'noise_level': 0.1281633761415194, 'constant_value': 27.95950636049055, 'nu': 1.5}. Best is trial 881 with value: 0.35916990930150405.
[I 2024-12-04 20:43:37,078] Trial 1975 finished with value: 0.35921087509792726 and parameters: {'kernel_type': 'Matern', 'length_scale': 29.53250661013187, 'noise_level': 0.05216444841000619, 'constant_value': 139.34229853810936, 'nu': 0.5}. Best is trial 881 with value: 0.35916990930150405.
[I 2024-12-04 20:43:39,983] Trial 1977 finished with value: 0.3592107357668616 and parameters: {'kernel_type': 'Matern', 'length_scale': 1549.160237348538, 'noise_level': 0.10239841978872907, 'constant_value': 141.65591626214083, 'nu': 0.5}. Best is trial 881 with value: 0.35916990930150405.
[I 2024-12-04 20:43:42,268] Trial 1976 finished with value: 1.062416117060437 and parameters: {'kernel_type': 'RBF', 'length_scale': 7686.633175420428, 'noise_level': 0.0023320619249993287, 'constant_value': 0.1786130143979894, 'nu': 1.5}. Best is trial 881 with value: 0.35916990930150405.
[I 2024-12-04 20:43:42,468] Trial 1978 finished with value: 0.3592112479544249 and parameters: {'kernel_type': 'Matern', 'length_scale': 102.55850133535758, 'noise_level': 0.9792917513423723, 'constant_value': 412.2207256908555, 'nu': 0.5}. Best is trial 881 with value: 0.35916990930150405.
[I 2024-12-04 20:43:45,864] Trial 1980 finished with value: 1.06241611686431 and parameters: {'kernel_type': 'Matern', 'length_scale': 0.002728005920019678, 'noise_level': 0.017368761588368618, 'constant_value': 84.1176513889864, 'nu': 0.5}. Best is trial 881 with value: 0.35916990930150405.
[I 2024-12-04 20:43:46,483] Trial 1979 finished with value: 0.4286835361627762 and parameters: {'kernel_type': 'RBF', 'length_scale': 0.37733013344024374, 'noise_level': 0.054193726180027275, 'constant_value': 67.57867592887305, 'nu': 0.5}. Best is trial 881 with value: 0.35916990930150405.
[I 2024-12-04 20:43:47,475] Trial 1981 finished with value: 0.3592112009997399 and parameters: {'kernel_type': 'Matern', 'length_scale': 2.135489352586767, 'noise_level': 0.8180969977841954, 'constant_value': 2565.8668311885385, 'nu': 0.5}. Best is trial 881 with value: 0.35916990930150405.
[I 2024-12-04 20:43:51,079] Trial 1982 finished with value: 0.3592112564608403 and parameters: {'kernel_type': 'Matern', 'length_scale': 354.3755962101648, 'noise_level': 0.01822319117908704, 'constant_value': 38.39268106975418, 'nu': 0.5}. Best is trial 881 with value: 0.35916990930150405.
[I 2024-12-04 20:43:51,848] Trial 1983 finished with value: 0.35921124036627794 and parameters: {'kernel_type': 'Matern', 'length_scale': 24.854074600834554, 'noise_level': 0.963233121473446, 'constant_value': 3.258238193586039, 'nu': 0.5}. Best is trial 881 with value: 0.35916990930150405.
[I 2024-12-04 20:43:55,316] Trial 1984 finished with value: 0.42268984839366014 and parameters: {'kernel_type': 'Matern', 'length_scale': 0.19835641572086105, 'noise_level': 0.2830039843572654, 'constant_value': 2705.5511128728995, 'nu': 1.5}. Best is trial 881 with value: 0.35916990930150405.
[I 2024-12-04 20:43:56,933] Trial 1986 finished with value: 0.3592113212782949 and parameters: {'kernel_type': 'Matern', 'length_scale': 0.2768047262563765, 'noise_level': 0.03729433319973711, 'constant_value': 25.499161981272156, 'nu': 0.5}. Best is trial 881 with value: 0.35916990930150405.
[I 2024-12-04 20:43:57,673] Trial 1985 finished with value: 0.42868348626354685 and parameters: {'kernel_type': 'RBF', 'length_scale': 3.291087780909174, 'noise_level': 0.014234167411713483, 'constant_value': 1459.566730871027, 'nu': 0.5}. Best is trial 881 with value: 0.35916990930150405.
[I 2024-12-04 20:44:00,643] Trial 1987 finished with value: 0.35921100236709763 and parameters: {'kernel_type': 'Matern', 'length_scale': 4.910915656861258, 'noise_level': 0.11804668247863714, 'constant_value': 1093.0219151105666, 'nu': 0.5}. Best is trial 881 with value: 0.35916990930150405.
[I 2024-12-04 20:44:02,608] Trial 1988 finished with value: 0.35921149257187984 and parameters: {'kernel_type': 'Matern', 'length_scale': 1.1309940011092663, 'noise_level': 0.004865469824316278, 'constant_value': 166.8737203317498, 'nu': 0.5}. Best is trial 881 with value: 0.35916990930150405.
[I 2024-12-04 20:44:02,988] Trial 1989 finished with value: 0.3592111412579574 and parameters: {'kernel_type': 'Matern', 'length_scale': 3.853562383713064, 'noise_level': 0.060605109128133036, 'constant_value': 5.582594612294638, 'nu': 0.5}. Best is trial 881 with value: 0.35916990930150405.
[I 2024-12-04 20:44:05,856] Trial 1990 finished with value: 0.35921071569074137 and parameters: {'kernel_type': 'Matern', 'length_scale': 32.64946387781708, 'noise_level': 0.025015960986924247, 'constant_value': 303.3158474516219, 'nu': 0.5}. Best is trial 881 with value: 0.35916990930150405.
[I 2024-12-04 20:44:07,394] Trial 1991 finished with value: 0.3592110694086618 and parameters: {'kernel_type': 'Matern', 'length_scale': 1.0906365399240752, 'noise_level': 0.13641649608497247, 'constant_value': 10.472704838864777, 'nu': 0.5}. Best is trial 881 with value: 0.35916990930150405.
[I 2024-12-04 20:44:09,157] Trial 1992 finished with value: 0.359211225152683 and parameters: {'kernel_type': 'Matern', 'length_scale': 0.7824235446652671, 'noise_level': 0.6764237493319212, 'constant_value': 78585.12317659464, 'nu': 0.5}. Best is trial 881 with value: 0.35916990930150405.
[I 2024-12-04 20:44:10,726] Trial 1993 finished with value: 0.3592114578609909 and parameters: {'kernel_type': 'Matern', 'length_scale': 0.5632765965421439, 'noise_level': 0.0003884590662568201, 'constant_value': 3300.2022525496377, 'nu': 0.5}. Best is trial 881 with value: 0.35916990930150405.
[I 2024-12-04 20:44:11,342] Trial 1994 finished with value: 1.0624147938036568 and parameters: {'kernel_type': 'Matern', 'length_scale': 0.07688041017239412, 'noise_level': 0.0034285768506816822, 'constant_value': 118.27285379324664, 'nu': 0.5}. Best is trial 881 with value: 0.35916990930150405.
[I 2024-12-04 20:44:14,472] Trial 1997 finished with value: 0.359156695282073 and parameters: {'kernel_type': 'Matern', 'length_scale': 13.46407935189874, 'noise_level': 0.028896792471612406, 'constant_value': 2279.5708674330135, 'nu': 0.5}. Best is trial 1997 with value: 0.359156695282073.
[I 2024-12-04 20:44:16,351] Trial 1996 finished with value: 0.35921117731673097 and parameters: {'kernel_type': 'Matern', 'length_scale': 6.753783216777401, 'noise_level': 0.019403964342975262, 'constant_value': 236.63742597866715, 'nu': 0.5}. Best is trial 1997 with value: 0.359156695282073.
[I 2024-12-04 20:44:16,924] Trial 1995 finished with value: 1.0624161172666329 and parameters: {'kernel_type': 'Matern', 'length_scale': 435.7719688637336, 'noise_level': 0.0014341133661793905, 'constant_value': 21747.436319111486, 'nu': 2.5}. Best is trial 1997 with value: 0.359156695282073.
[I 2024-12-04 20:44:19,305] Trial 1998 finished with value: 0.359211235826561 and parameters: {'kernel_type': 'Matern', 'length_scale': 0.9913797134272145, 'noise_level': 0.0006172292863916709, 'constant_value': 12846.1386413384, 'nu': 0.5}. Best is trial 1997 with value: 0.359156695282073.
[I 2024-12-04 20:44:21,552] Trial 1999 finished with value: 0.35921136156339184 and parameters: {'kernel_type': 'Matern', 'length_scale': 15.493267206294256, 'noise_level': 0.0010151788212159583, 'constant_value': 2032.013296124925, 'nu': 0.5}. Best is trial 1997 with value: 0.359156695282073.
[I 2024-12-04 20:44:23,499] Trial 2000 finished with value: 0.3592112768275348 and parameters: {'kernel_type': 'Matern', 'length_scale': 35.156934696198554, 'noise_level': 0.030539636077499398, 'constant_value': 355.3706271754867, 'nu': 0.5}. Best is trial 1997 with value: 0.359156695282073.
[I 2024-12-04 20:44:24,720] Trial 2001 finished with value: 0.3592112341954895 and parameters: {'kernel_type': 'Matern', 'length_scale': 27.378909039769226, 'noise_level': 0.10868675325310743, 'constant_value': 6592.934980458396, 'nu': 0.5}. Best is trial 1997 with value: 0.359156695282073.
[I 2024-12-04 20:44:27,089] Trial 2002 finished with value: 0.359211220769492 and parameters: {'kernel_type': 'Matern', 'length_scale': 29.289544895551405, 'noise_level': 0.015992208298070354, 'constant_value': 1773.9878034264714, 'nu': 0.5}. Best is trial 1997 with value: 0.359156695282073.
[I 2024-12-04 20:44:28,148] Trial 2003 finished with value: 0.359208951596776 and parameters: {'kernel_type': 'Matern', 'length_scale': 1.3280640942205169, 'noise_level': 0.0015443498028307042, 'constant_value': 1042.267908193179, 'nu': 0.5}. Best is trial 1997 with value: 0.359156695282073.
[I 2024-12-04 20:44:33,519] Trial 2004 finished with value: 0.35921124132200694 and parameters: {'kernel_type': 'Matern', 'length_scale': 0.2576399438721522, 'noise_level': 0.004045816721511738, 'constant_value': 3234.270249917146, 'nu': 0.5}. Best is trial 1997 with value: 0.359156695282073.
[I 2024-12-04 20:44:35,863] Trial 2006 finished with value: 1.0916558493821849 and parameters: {'kernel_type': 'Matern', 'length_scale': 0.011798166852421153, 'noise_level': 6.545909666642466e-05, 'constant_value': 3775.8428201492543, 'nu': 0.5}. Best is trial 1997 with value: 0.359156695282073.
[I 2024-12-04 20:44:36,229] Trial 2005 finished with value: 0.4195661033953142 and parameters: {'kernel_type': 'Matern', 'length_scale': 0.46848525322152484, 'noise_level': 0.5653326156945208, 'constant_value': 12267.472369820265, 'nu': 2.5}. Best is trial 1997 with value: 0.359156695282073.
[I 2024-12-04 20:44:40,584] Trial 2007 finished with value: 1.062414917461973 and parameters: {'kernel_type': 'Matern', 'length_scale': 0.07603770665720701, 'noise_level': 0.0007843327333812766, 'constant_value': 41509.62188206275, 'nu': 0.5}. Best is trial 1997 with value: 0.359156695282073.
[I 2024-12-04 20:44:40,669] Trial 2008 finished with value: 0.359211259169284 and parameters: {'kernel_type': 'Matern', 'length_scale': 2.945304430478005, 'noise_level': 0.001423196290542745, 'constant_value': 14124.404981350966, 'nu': 0.5}. Best is trial 1997 with value: 0.359156695282073.
[I 2024-12-04 20:44:44,335] Trial 2010 finished with value: 1.0916561724488814 and parameters: {'kernel_type': 'Matern', 'length_scale': 0.7758352582610138, 'noise_level': 3.714353107245208e-05, 'constant_value': 3905.7713551672023, 'nu': 0.5}. Best is trial 1997 with value: 0.359156695282073.
[I 2024-12-04 20:44:44,680] Trial 2009 finished with value: 1.0624161172799966 and parameters: {'kernel_type': 'RBF', 'length_scale': 6.354120064566516e-05, 'noise_level': 0.7584949476969195, 'constant_value': 0.0037337332177705164, 'nu': 0.5}. Best is trial 1997 with value: 0.359156695282073.
[I 2024-12-04 20:44:46,760] Trial 2011 finished with value: 0.35921089028376973 and parameters: {'kernel_type': 'Matern', 'length_scale': 0.3519378456843669, 'noise_level': 0.0019960943694587187, 'constant_value': 1500.1729000435716, 'nu': 0.5}. Best is trial 1997 with value: 0.359156695282073.
[I 2024-12-04 20:44:48,642] Trial 2012 finished with value: 0.4195655263524937 and parameters: {'kernel_type': 'Matern', 'length_scale': 2.925372783636639, 'noise_level': 0.0011971261128659698, 'constant_value': 589.82305502374, 'nu': 2.5}. Best is trial 1997 with value: 0.359156695282073.
[I 2024-12-04 20:44:49,831] Trial 2013 finished with value: 0.35921126133964876 and parameters: {'kernel_type': 'Matern', 'length_scale': 33.06192975964768, 'noise_level': 0.00011683505598966824, 'constant_value': 3475.1336736234653, 'nu': 0.5}. Best is trial 1997 with value: 0.359156695282073.
[I 2024-12-04 20:44:52,424] Trial 2014 finished with value: 0.359211234811983 and parameters: {'kernel_type': 'Matern', 'length_scale': 78.6645448020669, 'noise_level': 0.012857659723214888, 'constant_value': 715.3178633427008, 'nu': 0.5}. Best is trial 1997 with value: 0.359156695282073.
[I 2024-12-04 20:44:52,691] Trial 2015 finished with value: 0.35921145270108423 and parameters: {'kernel_type': 'Matern', 'length_scale': 4.483427566651313, 'noise_level': 0.00045944214835738016, 'constant_value': 12566.294183502418, 'nu': 0.5}. Best is trial 1997 with value: 0.359156695282073.
[I 2024-12-04 20:44:55,000] Trial 2016 finished with value: 0.3592112616117589 and parameters: {'kernel_type': 'Matern', 'length_scale': 33.06090276710759, 'noise_level': 0.0019592464761313713, 'constant_value': 529.2988716967429, 'nu': 0.5}. Best is trial 1997 with value: 0.359156695282073.
[I 2024-12-04 20:44:59,365] Trial 2018 finished with value: 1.0624161148008995 and parameters: {'kernel_type': 'RBF', 'length_scale': 0.16080277484139963, 'noise_level': 0.0004313585829798348, 'constant_value': 283.8227133715637, 'nu': 1.5}. Best is trial 1997 with value: 0.359156695282073.
[I 2024-12-04 20:45:04,252] Trial 2019 finished with value: 0.35921102290556206 and parameters: {'kernel_type': 'Matern', 'length_scale': 2.5465110639669373, 'noise_level': 0.0032071216381925056, 'constant_value': 1412.0076821349955, 'nu': 0.5}. Best is trial 1997 with value: 0.359156695282073.
[I 2024-12-04 20:45:04,545] Trial 2017 finished with value: 0.42268987742326 and parameters: {'kernel_type': 'Matern', 'length_scale': 43.611232526453, 'noise_level': 0.0007758001182730823, 'constant_value': 28946.42183823083, 'nu': 1.5}. Best is trial 1997 with value: 0.359156695282073.
[I 2024-12-04 20:45:11,104] Trial 2021 finished with value: 1.09165669625128 and parameters: {'kernel_type': 'Matern', 'length_scale': 0.5742641085369271, 'noise_level': 0.00582720464884835, 'constant_value': 2155.0620037024614, 'nu': 0.5}. Best is trial 1997 with value: 0.359156695282073.
[I 2024-12-04 20:45:12,025] Trial 2020 finished with value: 1.0624161172629076 and parameters: {'kernel_type': 'Matern', 'length_scale': 0.012549915577736066, 'noise_level': 1.140002374327128e-10, 'constant_value': 1.1312630380402138e-06, 'nu': 0.5}. Best is trial 1997 with value: 0.359156695282073.
[I 2024-12-04 20:45:13,291] Trial 2022 finished with value: 0.35921115645709323 and parameters: {'kernel_type': 'Matern', 'length_scale': 1.2784304261042776, 'noise_level': 0.0002577304506723712, 'constant_value': 6754.558041407831, 'nu': 0.5}. Best is trial 1997 with value: 0.359156695282073.
[I 2024-12-04 20:45:16,681] Trial 2024 finished with value: 0.3592111243742791 and parameters: {'kernel_type': 'Matern', 'length_scale': 0.9379605932733595, 'noise_level': 0.0036222306385653423, 'constant_value': 665.2678026349522, 'nu': 0.5}. Best is trial 1997 with value: 0.359156695282073.
[I 2024-12-04 20:45:16,688] Trial 2023 finished with value: 1.0916567282536798 and parameters: {'kernel_type': 'Matern', 'length_scale': 93055.4870155056, 'noise_level': 0.32782332728702723, 'constant_value': 68.82317201667301, 'nu': 1.5}. Best is trial 1997 with value: 0.359156695282073.
[I 2024-12-04 20:45:18,046] Trial 2025 finished with value: 0.35921088647259625 and parameters: {'kernel_type': 'Matern', 'length_scale': 2.839148462134851, 'noise_level': 0.0013365424642097484, 'constant_value': 326.5151248261868, 'nu': 0.5}. Best is trial 1997 with value: 0.359156695282073.
[I 2024-12-04 20:45:21,664] Trial 2026 finished with value: 0.3592116013320754 and parameters: {'kernel_type': 'Matern', 'length_scale': 16.864321933717303, 'noise_level': 0.0006621642840165608, 'constant_value': 1079.8568108115671, 'nu': 0.5}. Best is trial 1997 with value: 0.359156695282073.
[I 2024-12-04 20:45:24,319] Trial 2029 finished with value: 1.091656704854989 and parameters: {'kernel_type': 'Matern', 'length_scale': 17.856735881219986, 'noise_level': 0.00566098876602952, 'constant_value': 1070.2986693480468, 'nu': 0.5}. Best is trial 1997 with value: 0.359156695282073.
[I 2024-12-04 20:45:25,908] Trial 2028 finished with value: 0.3592113902635283 and parameters: {'kernel_type': 'Matern', 'length_scale': 0.12424883440606786, 'noise_level': 0.0011926860375852729, 'constant_value': 46.427954317360026, 'nu': 0.5}. Best is trial 1997 with value: 0.359156695282073.
[I 2024-12-04 20:45:27,753] Trial 2030 finished with value: 1.091656720416787 and parameters: {'kernel_type': 'Matern', 'length_scale': 3155.1918975722274, 'noise_level': 0.09754023402776449, 'constant_value': 1.2273372754590938e-07, 'nu': 1.5}. Best is trial 1997 with value: 0.359156695282073.
[I 2024-12-04 20:45:28,391] Trial 2027 finished with value: 1.062416117266502 and parameters: {'kernel_type': 'RBF', 'length_scale': 42029.119103533405, 'noise_level': 1.0724051002731387e-08, 'constant_value': 9.638068349395806e-06, 'nu': 2.5}. Best is trial 1997 with value: 0.359156695282073.
[I 2024-12-04 20:45:32,231] Trial 2031 finished with value: 0.3592114792799925 and parameters: {'kernel_type': 'Matern', 'length_scale': 1.228730280203146, 'noise_level': 0.0006600894785875551, 'constant_value': 717.4914828881784, 'nu': 0.5}. Best is trial 1997 with value: 0.359156695282073.
[I 2024-12-04 20:45:36,558] Trial 2033 finished with value: 1.0624161172626163 and parameters: {'kernel_type': 'Matern', 'length_scale': 0.011184498902677989, 'noise_level': 0.019149859799587467, 'constant_value': 3059.1878110371867, 'nu': 0.5}. Best is trial 1997 with value: 0.359156695282073.
[I 2024-12-04 20:45:37,247] Trial 2032 finished with value: 0.35920992392429624 and parameters: {'kernel_type': 'Matern', 'length_scale': 1.1036110873625637, 'noise_level': 0.010931295150821682, 'constant_value': 88607.64121181959, 'nu': 0.5}. Best is trial 1997 with value: 0.359156695282073.
[I 2024-12-04 20:45:37,319] Trial 2034 finished with value: 1.0916567048549852 and parameters: {'kernel_type': 'Matern', 'length_scale': 6.723135139915848, 'noise_level': 0.006294762529585629, 'constant_value': 37989.434557512475, 'nu': 0.5}. Best is trial 1997 with value: 0.359156695282073.
[I 2024-12-04 20:45:43,148] Trial 2036 finished with value: 0.3592112103465242 and parameters: {'kernel_type': 'Matern', 'length_scale': 19.793960472934334, 'noise_level': 0.0035558859245466727, 'constant_value': 64174.60288412568, 'nu': 0.5}. Best is trial 1997 with value: 0.359156695282073.
[I 2024-12-04 20:45:45,227] Trial 2035 finished with value: 0.35921212957703885 and parameters: {'kernel_type': 'Matern', 'length_scale': 0.1730382015660852, 'noise_level': 0.0014435699300131472, 'constant_value': 255.082860804909, 'nu': 0.5}. Best is trial 1997 with value: 0.359156695282073.
[I 2024-12-04 20:45:46,167] Trial 2038 finished with value: 1.0916558454612442 and parameters: {'kernel_type': 'RBF', 'length_scale': 0.007859340696252935, 'noise_level': 0.2654361836538103, 'constant_value': 2.3228073858615918e-07, 'nu': 1.5}. Best is trial 1997 with value: 0.359156695282073.
[I 2024-12-04 20:45:48,744] Trial 2037 finished with value: 0.4286835151540504 and parameters: {'kernel_type': 'RBF', 'length_scale': 0.2571509476603253, 'noise_level': 0.00034294524630445, 'constant_value': 12320.130500919224, 'nu': 0.5}. Best is trial 1997 with value: 0.359156695282073.
[I 2024-12-04 20:45:49,754] Trial 2039 finished with value: 0.35921123864249216 and parameters: {'kernel_type': 'Matern', 'length_scale': 6.836713679028135, 'noise_level': 0.0374612223368532, 'constant_value': 36833.24212562756, 'nu': 0.5}. Best is trial 1997 with value: 0.359156695282073.
[I 2024-12-04 20:45:50,886] Trial 2040 finished with value: 0.35921108542535957 and parameters: {'kernel_type': 'Matern', 'length_scale': 1.1049232144967778, 'noise_level': 0.0030433554678923713, 'constant_value': 12459.511968078592, 'nu': 0.5}. Best is trial 1997 with value: 0.359156695282073.
