[I 2024-12-04 20:45:53,675] Trial 2041 finished with value: 0.3592105068464185 and parameters: {'kernel_type': 'Matern', 'length_scale': 1.0476474931019182, 'noise_level': 0.0012668518576426672, 'constant_value': 47024.97289383256, 'nu': 0.5}. Best is trial 1997 with value: 0.359156695282073.
[I 2024-12-04 20:45:53,887] Trial 2043 finished with value: 1.0916556559812554 and parameters: {'kernel_type': 'Matern', 'length_scale': 0.2210088564325713, 'noise_level': 0.00026711689199655314, 'constant_value': 96675.05972664486, 'nu': 0.5}. Best is trial 1997 with value: 0.359156695282073.
[I 2024-12-04 20:45:56,083] Trial 2042 finished with value: 0.35921111249347537 and parameters: {'kernel_type': 'Matern', 'length_scale': 0.8714131258871772, 'noise_level': 0.008851491059031746, 'constant_value': 51238.94386259717, 'nu': 0.5}. Best is trial 1997 with value: 0.359156695282073.
[I 2024-12-04 20:45:58,217] Trial 2045 finished with value: 1.0624161172688973 and parameters: {'kernel_type': 'Matern', 'length_scale': 0.0010231869736236593, 'noise_level': 0.008652515847576045, 'constant_value': 41010.50001119405, 'nu': 0.5}. Best is trial 1997 with value: 0.359156695282073.
[I 2024-12-04 20:46:00,159] Trial 2044 finished with value: 0.35921125573272195 and parameters: {'kernel_type': 'Matern', 'length_scale': 140.36327808672692, 'noise_level': 0.00017954599939381543, 'constant_value': 1540.8657363003954, 'nu': 0.5}. Best is trial 1997 with value: 0.359156695282073.
[I 2024-12-04 20:46:01,728] Trial 2046 finished with value: 0.35921139858104795 and parameters: {'kernel_type': 'Matern', 'length_scale': 0.4545346942569759, 'noise_level': 0.011851476123216884, 'constant_value': 5120.374916870691, 'nu': 0.5}. Best is trial 1997 with value: 0.359156695282073.
[I 2024-12-04 20:46:03,322] Trial 2047 finished with value: 0.35921117753519227 and parameters: {'kernel_type': 'Matern', 'length_scale': 2.440526878231018, 'noise_level': 0.014166533824992097, 'constant_value': 53912.208988604274, 'nu': 0.5}. Best is trial 1997 with value: 0.359156695282073.
[I 2024-12-04 20:46:06,641] Trial 2048 finished with value: 0.35921128625290105 and parameters: {'kernel_type': 'Matern', 'length_scale': 0.34135013168774425, 'noise_level': 0.10423115792954248, 'constant_value': 54489.79899386836, 'nu': 0.5}. Best is trial 1997 with value: 0.359156695282073.
[I 2024-12-04 20:46:07,382] Trial 2049 finished with value: 0.35921132255636257 and parameters: {'kernel_type': 'Matern', 'length_scale': 7.0494202325689965, 'noise_level': 0.02161597118390185, 'constant_value': 60841.126565936655, 'nu': 0.5}. Best is trial 1997 with value: 0.359156695282073.
[I 2024-12-04 20:46:09,942] Trial 2050 finished with value: 1.0624161172680018 and parameters: {'kernel_type': 'Matern', 'length_scale': 965.6486772371064, 'noise_level': 4.89925271254347e-08, 'constant_value': 58.07726711262747, 'nu': 1.5}. Best is trial 1997 with value: 0.359156695282073.
[I 2024-12-04 20:46:12,544] Trial 2052 finished with value: 0.35921119532734175 and parameters: {'kernel_type': 'Matern', 'length_scale': 7.2913085740646615, 'noise_level': 0.03983959065573942, 'constant_value': 50630.91156491374, 'nu': 0.5}. Best is trial 1997 with value: 0.359156695282073.
[I 2024-12-04 20:46:13,105] Trial 2051 finished with value: 0.35920992050196066 and parameters: {'kernel_type': 'Matern', 'length_scale': 0.213795594097965, 'noise_level': 0.015457527254435404, 'constant_value': 10499.063881151116, 'nu': 0.5}. Best is trial 1997 with value: 0.359156695282073.
[I 2024-12-04 20:46:16,434] Trial 2054 finished with value: 1.0916558493701878 and parameters: {'kernel_type': 'Matern', 'length_scale': 0.03720917688850952, 'noise_level': 0.005096676343614291, 'constant_value': 2418.052604038667, 'nu': 0.5}. Best is trial 1997 with value: 0.359156695282073.
[I 2024-12-04 20:46:18,235] Trial 2055 finished with value: 1.0624161172701485 and parameters: {'kernel_type': 'Matern', 'length_scale': 0.0257588150889633, 'noise_level': 0.002410940000219874, 'constant_value': 1793.5960094294019, 'nu': 0.5}. Best is trial 1997 with value: 0.359156695282073.
[I 2024-12-04 20:46:18,991] Trial 2053 finished with value: 0.3592111452527974 and parameters: {'kernel_type': 'Matern', 'length_scale': 0.15379052846263763, 'noise_level': 0.0002457442380842407, 'constant_value': 1381.2029936658107, 'nu': 0.5}. Best is trial 1997 with value: 0.359156695282073.
[I 2024-12-04 20:46:22,326] Trial 2056 finished with value: 0.35921129419812176 and parameters: {'kernel_type': 'Matern', 'length_scale': 61.271127493697406, 'noise_level': 0.019415323524457122, 'constant_value': 326.9572783337627, 'nu': 0.5}. Best is trial 1997 with value: 0.359156695282073.
[I 2024-12-04 20:46:22,727] Trial 2057 finished with value: 1.0624161172672806 and parameters: {'kernel_type': 'Matern', 'length_scale': 0.0024309965387132215, 'noise_level': 0.008278461200074435, 'constant_value': 51278.196800909966, 'nu': 0.5}. Best is trial 1997 with value: 0.359156695282073.
[I 2024-12-04 20:46:24,311] Trial 2058 finished with value: 0.35921119978867044 and parameters: {'kernel_type': 'Matern', 'length_scale': 0.35744844980394974, 'noise_level': 0.06258594321690068, 'constant_value': 63418.568894027296, 'nu': 0.5}. Best is trial 1997 with value: 0.359156695282073.
[I 2024-12-04 20:46:27,669] Trial 2060 finished with value: 0.3592112411278639 and parameters: {'kernel_type': 'Matern', 'length_scale': 12.06500143219751, 'noise_level': 0.0024476216503304176, 'constant_value': 667.1113540110078, 'nu': 0.5}. Best is trial 1997 with value: 0.359156695282073.
[I 2024-12-04 20:46:30,131] Trial 2061 finished with value: 0.35921144937503585 and parameters: {'kernel_type': 'Matern', 'length_scale': 424.3037254481556, 'noise_level': 0.0036448386588110353, 'constant_value': 745.2782068374905, 'nu': 0.5}. Best is trial 1997 with value: 0.359156695282073.
[I 2024-12-04 20:46:30,675] Trial 2059 finished with value: 0.3592161036540431 and parameters: {'kernel_type': 'Matern', 'length_scale': 0.09583115132204248, 'noise_level': 0.03974029334781922, 'constant_value': 1920.5726090529133, 'nu': 0.5}. Best is trial 1997 with value: 0.359156695282073.
[I 2024-12-04 20:46:33,205] Trial 2063 finished with value: 1.0916558493454958 and parameters: {'kernel_type': 'Matern', 'length_scale': 0.0028840055138105924, 'noise_level': 0.005634417114274714, 'constant_value': 64.2040929865196, 'nu': 0.5}. Best is trial 1997 with value: 0.359156695282073.
[I 2024-12-04 20:46:33,928] Trial 2064 finished with value: 1.0916558493107824 and parameters: {'kernel_type': 'Matern', 'length_scale': 0.07458683005133891, 'noise_level': 0.00561343924285442, 'constant_value': 95616.04339726985, 'nu': 0.5}. Best is trial 1997 with value: 0.359156695282073.
[I 2024-12-04 20:46:39,876] Trial 2065 finished with value: 1.09165584523455 and parameters: {'kernel_type': 'Matern', 'length_scale': 0.007152894019178723, 'noise_level': 0.015024560232446046, 'constant_value': 10830.095896224406, 'nu': 0.5}. Best is trial 1997 with value: 0.359156695282073.
[I 2024-12-04 20:46:40,965] Trial 2062 finished with value: 1.0624161175345614 and parameters: {'kernel_type': 'Matern', 'length_scale': 0.036851853869503993, 'noise_level': 0.000288671344425634, 'constant_value': 4098.75724308638, 'nu': 0.5}. Best is trial 1997 with value: 0.359156695282073.
[I 2024-12-04 20:46:42,586] Trial 2066 finished with value: 0.422689769976631 and parameters: {'kernel_type': 'Matern', 'length_scale': 0.7319665701086685, 'noise_level': 0.0014143039118157566, 'constant_value': 1672.328295192211, 'nu': 1.5}. Best is trial 1997 with value: 0.359156695282073.
[I 2024-12-04 20:46:46,075] Trial 2068 finished with value: 1.0624161172706639 and parameters: {'kernel_type': 'Matern', 'length_scale': 0.023552767124039888, 'noise_level': 0.002039642595938449, 'constant_value': 707.8280309306634, 'nu': 0.5}. Best is trial 1997 with value: 0.359156695282073.
[I 2024-12-04 20:46:47,765] Trial 2067 finished with value: 0.42268960610304607 and parameters: {'kernel_type': 'Matern', 'length_scale': 0.3235577483717254, 'noise_level': 0.0127287882942991, 'constant_value': 4829.898256593476, 'nu': 1.5}. Best is trial 1997 with value: 0.359156695282073.
[I 2024-12-04 20:46:47,774] Trial 2069 finished with value: 0.3592112561454576 and parameters: {'kernel_type': 'Matern', 'length_scale': 1808.8650232965715, 'noise_level': 0.11578138288362319, 'constant_value': 53.758661761592144, 'nu': 0.5}. Best is trial 1997 with value: 0.359156695282073.
[I 2024-12-04 20:46:51,778] Trial 2070 finished with value: 0.4286834935528478 and parameters: {'kernel_type': 'RBF', 'length_scale': 0.31070337303004, 'noise_level': 0.2725481570428675, 'constant_value': 75712.37930108976, 'nu': 1.5}. Best is trial 1997 with value: 0.359156695282073.
[I 2024-12-04 20:46:53,436] Trial 2071 finished with value: 0.359211161887092 and parameters: {'kernel_type': 'Matern', 'length_scale': 0.2315760591290244, 'noise_level': 0.002252274511522606, 'constant_value': 87.89100211308377, 'nu': 0.5}. Best is trial 1997 with value: 0.359156695282073.
[I 2024-12-04 20:46:54,151] Trial 2072 finished with value: 0.3592114100861409 and parameters: {'kernel_type': 'Matern', 'length_scale': 0.20872135155538135, 'noise_level': 0.0008967860221083881, 'constant_value': 1638.4806785807837, 'nu': 0.5}. Best is trial 1997 with value: 0.359156695282073.
[I 2024-12-04 20:46:56,736] Trial 2074 finished with value: 1.091656704854987 and parameters: {'kernel_type': 'Matern', 'length_scale': 3.1850120633080734, 'noise_level': 0.005934373701219538, 'constant_value': 754.0833427916631, 'nu': 0.5}. Best is trial 1997 with value: 0.359156695282073.
[I 2024-12-04 20:46:57,270] Trial 2073 finished with value: 0.359211240650762 and parameters: {'kernel_type': 'Matern', 'length_scale': 110.1056745013201, 'noise_level': 0.0032419387421056887, 'constant_value': 918.2310603934466, 'nu': 0.5}. Best is trial 1997 with value: 0.359156695282073.
[I 2024-12-04 20:46:59,755] Trial 2075 finished with value: 0.35921064387441115 and parameters: {'kernel_type': 'Matern', 'length_scale': 10740.423164590575, 'noise_level': 0.08205115660490829, 'constant_value': 46.40752597352439, 'nu': 0.5}. Best is trial 1997 with value: 0.359156695282073.
[I 2024-12-04 20:47:01,086] Trial 2077 finished with value: 1.0624161082933528 and parameters: {'kernel_type': 'Matern', 'length_scale': 0.05564142469314628, 'noise_level': 0.029600917478114705, 'constant_value': 827.1427802280195, 'nu': 0.5}. Best is trial 1997 with value: 0.359156695282073.
[I 2024-12-04 20:47:02,305] Trial 2076 finished with value: 0.3592113394900296 and parameters: {'kernel_type': 'Matern', 'length_scale': 2999.9459449414194, 'noise_level': 0.005438399589021172, 'constant_value': 91.4997610722752, 'nu': 0.5}. Best is trial 1997 with value: 0.359156695282073.
[I 2024-12-04 20:47:05,358] Trial 2078 finished with value: 0.4286834653024202 and parameters: {'kernel_type': 'RBF', 'length_scale': 14.358216118192168, 'noise_level': 0.019701290818832946, 'constant_value': 92824.16350372307, 'nu': 0.5}. Best is trial 1997 with value: 0.359156695282073.
[I 2024-12-04 20:47:06,500] Trial 2079 finished with value: 0.35921130639609855 and parameters: {'kernel_type': 'Matern', 'length_scale': 21.195252987945754, 'noise_level': 0.0002170531125184225, 'constant_value': 1468.652179971182, 'nu': 0.5}. Best is trial 1997 with value: 0.359156695282073.
[I 2024-12-04 20:47:07,712] Trial 2080 finished with value: 0.3592112520606863 and parameters: {'kernel_type': 'Matern', 'length_scale': 3307.2732811294277, 'noise_level': 0.0198454454839195, 'constant_value': 97.54353825676124, 'nu': 0.5}. Best is trial 1997 with value: 0.359156695282073.
[I 2024-12-04 20:47:10,069] Trial 2081 finished with value: 1.0624161172701112 and parameters: {'kernel_type': 'Matern', 'length_scale': 0.02047638083879778, 'noise_level': 0.08301967810675731, 'constant_value': 625.9831184082983, 'nu': 0.5}. Best is trial 1997 with value: 0.359156695282073.
[I 2024-12-04 20:47:12,704] Trial 2083 finished with value: 1.0624161172602842 and parameters: {'kernel_type': 'Matern', 'length_scale': 0.024381947845713375, 'noise_level': 0.016963281503722658, 'constant_value': 5586.877541596195, 'nu': 0.5}. Best is trial 1997 with value: 0.359156695282073.
[I 2024-12-04 20:47:13,160] Trial 2082 finished with value: 0.3592112224024409 and parameters: {'kernel_type': 'Matern', 'length_scale': 63.22645971625186, 'noise_level': 0.02369961812786513, 'constant_value': 1014.3613397407031, 'nu': 0.5}. Best is trial 1997 with value: 0.359156695282073.
[I 2024-12-04 20:47:15,546] Trial 2084 finished with value: 0.3592092089188189 and parameters: {'kernel_type': 'Matern', 'length_scale': 7.426532871570075, 'noise_level': 0.004109778465081304, 'constant_value': 979.4668135341498, 'nu': 0.5}. Best is trial 1997 with value: 0.359156695282073.
[I 2024-12-04 20:47:18,098] Trial 2085 finished with value: 0.35921129229618015 and parameters: {'kernel_type': 'Matern', 'length_scale': 522.7721613153356, 'noise_level': 0.06427119588393919, 'constant_value': 1402.8686231040156, 'nu': 0.5}. Best is trial 1997 with value: 0.359156695282073.
[I 2024-12-04 20:47:19,803] Trial 2087 finished with value: 0.35921144884175654 and parameters: {'kernel_type': 'Matern', 'length_scale': 28.106083590605042, 'noise_level': 0.0006379082669671892, 'constant_value': 373.44544900430304, 'nu': 0.5}. Best is trial 1997 with value: 0.359156695282073.
[I 2024-12-04 20:47:20,575] Trial 2086 finished with value: 0.4195659920116302 and parameters: {'kernel_type': 'Matern', 'length_scale': 1.2648762258126003, 'noise_level': 0.012782007212401485, 'constant_value': 8099.02172136552, 'nu': 2.5}. Best is trial 1997 with value: 0.359156695282073.
[I 2024-12-04 20:47:23,109] Trial 2088 finished with value: 0.35921119470730023 and parameters: {'kernel_type': 'Matern', 'length_scale': 26.51417085111358, 'noise_level': 0.00010983776204191586, 'constant_value': 63343.769939823, 'nu': 0.5}. Best is trial 1997 with value: 0.359156695282073.
[I 2024-12-04 20:47:24,240] Trial 2089 finished with value: 0.3592111723787492 and parameters: {'kernel_type': 'Matern', 'length_scale': 15.017696051269473, 'noise_level': 0.0017576123783586144, 'constant_value': 177.73215536003036, 'nu': 0.5}. Best is trial 1997 with value: 0.359156695282073.
[I 2024-12-04 20:47:25,481] Trial 2090 finished with value: 0.35921120943889273 and parameters: {'kernel_type': 'Matern', 'length_scale': 3.5714712668240676, 'noise_level': 0.0004495511354728147, 'constant_value': 27.56943505168609, 'nu': 0.5}. Best is trial 1997 with value: 0.359156695282073.
[I 2024-12-04 20:47:26,623] Trial 2091 finished with value: 1.091655849388296 and parameters: {'kernel_type': 'Matern', 'length_scale': 0.0009566073963680306, 'noise_level': 8.683534318080258e-09, 'constant_value': 74632.52731114981, 'nu': 0.5}. Best is trial 1997 with value: 0.359156695282073.
[I 2024-12-04 20:47:29,509] Trial 2092 finished with value: 0.3592115596242908 and parameters: {'kernel_type': 'Matern', 'length_scale': 28.427287880628153, 'noise_level': 0.0007528804982499815, 'constant_value': 3773.0190913242827, 'nu': 0.5}. Best is trial 1997 with value: 0.359156695282073.
[I 2024-12-04 20:47:30,433] Trial 2093 finished with value: 0.3592112369063168 and parameters: {'kernel_type': 'Matern', 'length_scale': 15.631273496599087, 'noise_level': 0.002998601412572756, 'constant_value': 696.8154294994371, 'nu': 0.5}. Best is trial 1997 with value: 0.359156695282073.
[I 2024-12-04 20:47:31,545] Trial 2094 finished with value: 0.35921123107981284 and parameters: {'kernel_type': 'Matern', 'length_scale': 134.55610850699344, 'noise_level': 0.0024160379731058236, 'constant_value': 898.8683721297348, 'nu': 0.5}. Best is trial 1997 with value: 0.359156695282073.
[I 2024-12-04 20:47:35,384] Trial 2095 finished with value: 0.3592112421200507 and parameters: {'kernel_type': 'Matern', 'length_scale': 94.59944303327988, 'noise_level': 0.01877043136390089, 'constant_value': 965.4593788044217, 'nu': 0.5}. Best is trial 1997 with value: 0.359156695282073.
[I 2024-12-04 20:47:35,390] Trial 2096 finished with value: 0.35921119918649314 and parameters: {'kernel_type': 'Matern', 'length_scale': 26.844999172692752, 'noise_level': 0.04791462883356579, 'constant_value': 1193.5937297989183, 'nu': 0.5}. Best is trial 1997 with value: 0.359156695282073.
[I 2024-12-04 20:47:36,448] Trial 2097 finished with value: 0.35921131112604376 and parameters: {'kernel_type': 'Matern', 'length_scale': 2821.225289453243, 'noise_level': 0.004208789307186966, 'constant_value': 890.4874454188988, 'nu': 0.5}. Best is trial 1997 with value: 0.359156695282073.
[I 2024-12-04 20:47:39,983] Trial 2098 finished with value: 0.359211425396215 and parameters: {'kernel_type': 'Matern', 'length_scale': 392.276747921726, 'noise_level': 0.07784826661672739, 'constant_value': 128.3925122064092, 'nu': 0.5}. Best is trial 1997 with value: 0.359156695282073.
[I 2024-12-04 20:47:40,349] Trial 2100 finished with value: 0.35921078702474446 and parameters: {'kernel_type': 'Matern', 'length_scale': 4.2122248024899775, 'noise_level': 0.041474875853520166, 'constant_value': 1486.615618789393, 'nu': 0.5}. Best is trial 1997 with value: 0.359156695282073.
[I 2024-12-04 20:47:41,121] Trial 2099 finished with value: 0.35921116867583225 and parameters: {'kernel_type': 'Matern', 'length_scale': 131.21960267046106, 'noise_level': 0.0014153159911193995, 'constant_value': 580.7490294612782, 'nu': 0.5}. Best is trial 1997 with value: 0.359156695282073.
[I 2024-12-04 20:47:45,187] Trial 2101 finished with value: 0.3592113864165165 and parameters: {'kernel_type': 'Matern', 'length_scale': 97.93922995842685, 'noise_level': 0.15786497364766816, 'constant_value': 4075.8781496941033, 'nu': 0.5}. Best is trial 1997 with value: 0.359156695282073.
[I 2024-12-04 20:47:46,269] Trial 2102 finished with value: 0.35921179094637856 and parameters: {'kernel_type': 'Matern', 'length_scale': 98.77873336109239, 'noise_level': 0.013343086628585108, 'constant_value': 4141.171883721358, 'nu': 0.5}. Best is trial 1997 with value: 0.359156695282073.
[I 2024-12-04 20:47:46,357] Trial 2103 finished with value: 0.35920910421036994 and parameters: {'kernel_type': 'Matern', 'length_scale': 0.37842573199635104, 'noise_level': 0.0005793181891554854, 'constant_value': 249.05373506555256, 'nu': 0.5}. Best is trial 1997 with value: 0.359156695282073.
[I 2024-12-04 20:47:49,224] Trial 2106 finished with value: 1.0916567014504974 and parameters: {'kernel_type': 'Matern', 'length_scale': 0.7150131079620641, 'noise_level': 0.0062145568147874515, 'constant_value': 11.382211131809123, 'nu': 0.5}. Best is trial 1997 with value: 0.359156695282073.
[I 2024-12-04 20:47:50,798] Trial 2104 finished with value: 0.3592147331329043 and parameters: {'kernel_type': 'Matern', 'length_scale': 97190.83308199717, 'noise_level': 0.028942727092292533, 'constant_value': 2464.3971154320147, 'nu': 0.5}. Best is trial 1997 with value: 0.359156695282073.
[I 2024-12-04 20:47:51,181] Trial 2105 finished with value: 1.0624161205634144 and parameters: {'kernel_type': 'Matern', 'length_scale': 0.0396227093287867, 'noise_level': 0.00012545204220861783, 'constant_value': 28.36983751974874, 'nu': 0.5}. Best is trial 1997 with value: 0.359156695282073.
[I 2024-12-04 20:47:54,203] Trial 2107 finished with value: 0.3592112567422075 and parameters: {'kernel_type': 'Matern', 'length_scale': 12.088869109101001, 'noise_level': 0.0005778969193480928, 'constant_value': 20519.227706361165, 'nu': 0.5}. Best is trial 1997 with value: 0.359156695282073.
[I 2024-12-04 20:47:54,272] Trial 2108 finished with value: 1.0916561588258669 and parameters: {'kernel_type': 'Matern', 'length_scale': 1.6737198732255492, 'noise_level': 1.5743099735061875e-05, 'constant_value': 439.27885079192066, 'nu': 0.5}. Best is trial 1997 with value: 0.359156695282073.
[I 2024-12-04 20:47:57,291] Trial 2110 finished with value: 1.0916565826483349 and parameters: {'kernel_type': 'Matern', 'length_scale': 17.094560585766786, 'noise_level': 2.960904268401176e-05, 'constant_value': 443.9215137551623, 'nu': 0.5}. Best is trial 1997 with value: 0.359156695282073.
[I 2024-12-04 20:47:58,462] Trial 2109 finished with value: 0.3592112319422868 and parameters: {'kernel_type': 'Matern', 'length_scale': 0.11933593652005932, 'noise_level': 0.0027286678539308884, 'constant_value': 26.95747466348997, 'nu': 0.5}. Best is trial 1997 with value: 0.359156695282073.
[I 2024-12-04 20:47:58,861] Trial 2111 finished with value: 0.3592111987032727 and parameters: {'kernel_type': 'Matern', 'length_scale': 4.578790350322892, 'noise_level': 0.00023726819001048787, 'constant_value': 1191.0437913317417, 'nu': 0.5}. Best is trial 1997 with value: 0.359156695282073.
[I 2024-12-04 20:48:00,854] Trial 2112 finished with value: 1.0916558493878532 and parameters: {'kernel_type': 'Matern', 'length_scale': 0.04655720434096312, 'noise_level': 7.747037034709664e-06, 'constant_value': 491.01983649810717, 'nu': 0.5}. Best is trial 1997 with value: 0.359156695282073.
[I 2024-12-04 20:48:02,874] Trial 2113 finished with value: 0.3592114263468717 and parameters: {'kernel_type': 'Matern', 'length_scale': 2.0854000203592227, 'noise_level': 0.0022770907760247612, 'constant_value': 153.36408129278018, 'nu': 0.5}. Best is trial 1997 with value: 0.359156695282073.
[I 2024-12-04 20:48:03,971] Trial 2114 finished with value: 0.3592112519344215 and parameters: {'kernel_type': 'Matern', 'length_scale': 0.7619266491450012, 'noise_level': 0.0006513379889529601, 'constant_value': 271.0418021737958, 'nu': 0.5}. Best is trial 1997 with value: 0.359156695282073.
