[I 2024-12-04 15:34:02,269] Trial 2297 finished with value: 0.13435446968033002 and parameters: {'kernel_type': 'Matern', 'length_scale': 29.08327506590841, 'noise_level': 0.00012852296444752138, 'constant_value': 89067.13512447954, 'nu': 1.5}. Best is trial 1985 with value: 0.134351948015208.
[I 2024-12-04 15:34:05,331] Trial 2304 finished with value: 0.13435439626123813 and parameters: {'kernel_type': 'Matern', 'length_scale': 0.5850424088499314, 'noise_level': 0.10470062735319789, 'constant_value': 1612.7008259234253, 'nu': 1.5}. Best is trial 1985 with value: 0.134351948015208.
[I 2024-12-04 15:34:08,550] Trial 2300 finished with value: 0.13435413615217257 and parameters: {'kernel_type': 'Matern', 'length_scale': 15.570920232110353, 'noise_level': 0.00997501298756978, 'constant_value': 87799.050535871, 'nu': 1.5}. Best is trial 1985 with value: 0.134351948015208.
[I 2024-12-04 15:34:08,634] Trial 2307 finished with value: 0.13435440320719338 and parameters: {'kernel_type': 'Matern', 'length_scale': 3.4632816812969898, 'noise_level': 0.07699745607043168, 'constant_value': 74173.37744287463, 'nu': 1.5}. Best is trial 1985 with value: 0.134351948015208.
[I 2024-12-04 15:34:08,638] Trial 2296 finished with value: 0.13435427610441159 and parameters: {'kernel_type': 'Matern', 'length_scale': 775.2620923267979, 'noise_level': 0.19215739949818206, 'constant_value': 1695.0555021036632, 'nu': 1.5}. Best is trial 1985 with value: 0.134351948015208.
[I 2024-12-04 15:34:08,904] Trial 2306 finished with value: 0.1343542864325742 and parameters: {'kernel_type': 'Matern', 'length_scale': 0.9409821699373329, 'noise_level': 0.02720457738888383, 'constant_value': 65027.89326568993, 'nu': 1.5}. Best is trial 1985 with value: 0.134351948015208.
[I 2024-12-04 15:34:13,266] Trial 2308 finished with value: 1.3007738377093023 and parameters: {'kernel_type': 'Matern', 'length_scale': 0.24548087661477117, 'noise_level': 3.4408196788620553e-06, 'constant_value': 88359.39095487403, 'nu': 1.5}. Best is trial 1985 with value: 0.134351948015208.
[I 2024-12-04 15:34:14,654] Trial 2309 finished with value: 0.13435440582756839 and parameters: {'kernel_type': 'Matern', 'length_scale': 12.580715383217866, 'noise_level': 0.8775400619154413, 'constant_value': 5395.960360580732, 'nu': 1.5}. Best is trial 1985 with value: 0.134351948015208.
[I 2024-12-04 15:34:14,953] Trial 2315 finished with value: 0.13435445558449252 and parameters: {'kernel_type': 'Matern', 'length_scale': 1166.387528845628, 'noise_level': 0.09169518256579527, 'constant_value': 3465.3181551029465, 'nu': 1.5}. Best is trial 1985 with value: 0.134351948015208.
[I 2024-12-04 15:34:17,734] Trial 2317 finished with value: 0.13435440080867295 and parameters: {'kernel_type': 'Matern', 'length_scale': 74.11591282885125, 'noise_level': 0.018972514120805063, 'constant_value': 62018.19901945578, 'nu': 1.5}. Best is trial 1985 with value: 0.134351948015208.
[I 2024-12-04 15:34:17,738] Trial 2322 finished with value: 0.13435439135780147 and parameters: {'kernel_type': 'Matern', 'length_scale': 16.6348021764677, 'noise_level': 0.08648008240003875, 'constant_value': 80167.89807822314, 'nu': 1.5}. Best is trial 1985 with value: 0.134351948015208.
[I 2024-12-04 15:34:17,882] Trial 2313 finished with value: 1.2693635028566566 and parameters: {'kernel_type': 'Matern', 'length_scale': 40935.93450082347, 'noise_level': 0.01934743741375159, 'constant_value': 897.7028852642417, 'nu': 1.5}. Best is trial 1985 with value: 0.134351948015208.
[I 2024-12-04 15:34:17,930] Trial 2310 finished with value: 0.1343543923449754 and parameters: {'kernel_type': 'Matern', 'length_scale': 26.421085250900855, 'noise_level': 0.30098900434269255, 'constant_value': 2031.1503659825519, 'nu': 1.5}. Best is trial 1985 with value: 0.134351948015208.
[I 2024-12-04 15:34:18,717] Trial 2299 finished with value: 1.2693635028556303 and parameters: {'kernel_type': 'RBF', 'length_scale': 47.849169619381975, 'noise_level': 0.0007078156071801888, 'constant_value': 0.0004151431902087503, 'nu': 2.5}. Best is trial 1985 with value: 0.134351948015208.
[I 2024-12-04 15:34:19,555] Trial 2320 finished with value: 0.14859826614028857 and parameters: {'kernel_type': 'Matern', 'length_scale': 743.0641332365703, 'noise_level': 0.09390468674466516, 'constant_value': 655.7412444278519, 'nu': 2.5}. Best is trial 1985 with value: 0.134351948015208.
[I 2024-12-04 15:34:20,574] Trial 2319 finished with value: 0.14859827099884376 and parameters: {'kernel_type': 'Matern', 'length_scale': 430.70762324247954, 'noise_level': 0.0025024018530571796, 'constant_value': 701.4881725984834, 'nu': 2.5}. Best is trial 1985 with value: 0.134351948015208.
[I 2024-12-04 15:34:20,997] Trial 2305 finished with value: 0.1343543730330183 and parameters: {'kernel_type': 'Matern', 'length_scale': 18.871271111298405, 'noise_level': 0.06290333672447339, 'constant_value': 1604.328900700116, 'nu': 1.5}. Best is trial 1985 with value: 0.134351948015208.
[I 2024-12-04 15:34:21,863] Trial 2314 finished with value: 1.2693635028568329 and parameters: {'kernel_type': 'Matern', 'length_scale': 0.023358598493198785, 'noise_level': 0.0017413700765928943, 'constant_value': 323.0804554155637, 'nu': 1.5}. Best is trial 1985 with value: 0.134351948015208.
[I 2024-12-04 15:34:22,571] Trial 2312 finished with value: 0.13435438268743166 and parameters: {'kernel_type': 'Matern', 'length_scale': 176.2420729436974, 'noise_level': 0.019202310323081104, 'constant_value': 1616.585203855385, 'nu': 1.5}. Best is trial 1985 with value: 0.134351948015208.
[I 2024-12-04 15:34:23,159] Trial 2323 finished with value: 0.1343543151740575 and parameters: {'kernel_type': 'Matern', 'length_scale': 4.197205266579725, 'noise_level': 0.010423414838143881, 'constant_value': 1709.486891327579, 'nu': 1.5}. Best is trial 1985 with value: 0.134351948015208.
[I 2024-12-04 15:34:23,674] Trial 2321 finished with value: 0.13435440585264102 and parameters: {'kernel_type': 'Matern', 'length_scale': 4.864869199060463, 'noise_level': 0.005580169279570092, 'constant_value': 1767.7649858420343, 'nu': 1.5}. Best is trial 1985 with value: 0.134351948015208.
[I 2024-12-04 15:34:23,870] Trial 2316 finished with value: 0.15167296032255226 and parameters: {'kernel_type': 'RBF', 'length_scale': 0.6898236960329983, 'noise_level': 0.0023987843336850277, 'constant_value': 99557.06334343093, 'nu': 1.5}. Best is trial 1985 with value: 0.134351948015208.
[I 2024-12-04 15:34:24,014] Trial 2318 finished with value: 1.3007745979712406 and parameters: {'kernel_type': 'RBF', 'length_scale': 3.465703255305582, 'noise_level': 1.0408733469007373e-06, 'constant_value': 78297.99838804186, 'nu': 0.5}. Best is trial 1985 with value: 0.134351948015208.
[I 2024-12-04 15:34:24,432] Trial 2324 finished with value: 0.1343543990272117 and parameters: {'kernel_type': 'Matern', 'length_scale': 1462.2450233902503, 'noise_level': 0.0061805172557159145, 'constant_value': 86000.21085525033, 'nu': 1.5}. Best is trial 1985 with value: 0.134351948015208.
[I 2024-12-04 15:34:25,832] Trial 2311 finished with value: 0.13435439881762676 and parameters: {'kernel_type': 'Matern', 'length_scale': 62.9439329090971, 'noise_level': 0.0007033310459093455, 'constant_value': 63271.72191418707, 'nu': 1.5}. Best is trial 1985 with value: 0.134351948015208.
[I 2024-12-04 15:34:26,935] Trial 2325 finished with value: 0.13435432849012185 and parameters: {'kernel_type': 'Matern', 'length_scale': 93.20772932235575, 'noise_level': 0.47716846443782035, 'constant_value': 96527.7643389867, 'nu': 1.5}. Best is trial 1985 with value: 0.134351948015208.
[I 2024-12-04 15:34:27,365] Trial 2326 finished with value: 0.13435433792538856 and parameters: {'kernel_type': 'Matern', 'length_scale': 7.652194948123453, 'noise_level': 0.000396358787139185, 'constant_value': 90899.49062504216, 'nu': 1.5}. Best is trial 1985 with value: 0.134351948015208.
[I 2024-12-04 15:34:27,673] Trial 2330 finished with value: 1.2693569741663309 and parameters: {'kernel_type': 'Matern', 'length_scale': 0.12023714329863919, 'noise_level': 0.005013181898870648, 'constant_value': 1075.5639253237166, 'nu': 1.5}. Best is trial 1985 with value: 0.134351948015208.
[I 2024-12-04 15:34:28,337] Trial 2329 finished with value: 0.13435440187909772 and parameters: {'kernel_type': 'Matern', 'length_scale': 27.415008256297877, 'noise_level': 0.021612829584161008, 'constant_value': 2673.6688015726413, 'nu': 1.5}. Best is trial 1985 with value: 0.134351948015208.
[I 2024-12-04 15:34:30,930] Trial 2328 finished with value: 0.17251040208200272 and parameters: {'kernel_type': 'Matern', 'length_scale': 1.2231281551314743, 'noise_level': 0.0374970828829883, 'constant_value': 15056.271257457685, 'nu': 0.5}. Best is trial 1985 with value: 0.134351948015208.
[I 2024-12-04 15:34:32,744] Trial 2337 finished with value: 1.2693635028569679 and parameters: {'kernel_type': 'Matern', 'length_scale': 0.034371489017621736, 'noise_level': 0.5223453801074723, 'constant_value': 96141.05904296594, 'nu': 1.5}. Best is trial 1985 with value: 0.134351948015208.
[I 2024-12-04 15:34:33,634] Trial 2332 finished with value: 0.1343543856907305 and parameters: {'kernel_type': 'Matern', 'length_scale': 11.28247738601366, 'noise_level': 0.11878962117408741, 'constant_value': 879.3172434140309, 'nu': 1.5}. Best is trial 1985 with value: 0.134351948015208.
[I 2024-12-04 15:34:36,590] Trial 2327 finished with value: 0.13435438987223125 and parameters: {'kernel_type': 'Matern', 'length_scale': 9.054374357680647, 'noise_level': 0.0016487112507287591, 'constant_value': 2614.9252841495622, 'nu': 1.5}. Best is trial 1985 with value: 0.134351948015208.
[I 2024-12-04 15:34:38,001] Trial 2335 finished with value: 0.1343529342807503 and parameters: {'kernel_type': 'Matern', 'length_scale': 458.7334277858143, 'noise_level': 0.03662020619388396, 'constant_value': 94392.31200972639, 'nu': 1.5}. Best is trial 1985 with value: 0.134351948015208.
[I 2024-12-04 15:34:39,121] Trial 2336 finished with value: 0.13435439457584408 and parameters: {'kernel_type': 'Matern', 'length_scale': 14.074509676259932, 'noise_level': 0.008536488431183275, 'constant_value': 96008.0875784082, 'nu': 1.5}. Best is trial 1985 with value: 0.134351948015208.
[I 2024-12-04 15:34:41,541] Trial 2333 finished with value: 0.13435441040824223 and parameters: {'kernel_type': 'Matern', 'length_scale': 0.24517978071555857, 'noise_level': 0.5817490697076587, 'constant_value': 86680.5005857439, 'nu': 1.5}. Best is trial 1985 with value: 0.134351948015208.
[I 2024-12-04 15:34:41,754] Trial 2334 finished with value: 0.13435438605024447 and parameters: {'kernel_type': 'Matern', 'length_scale': 31.82350075202388, 'noise_level': 0.13514507854478364, 'constant_value': 659.4884161746343, 'nu': 1.5}. Best is trial 1985 with value: 0.134351948015208.
[I 2024-12-04 15:34:41,978] Trial 2341 finished with value: 0.1343543377253861 and parameters: {'kernel_type': 'Matern', 'length_scale': 1.901834677270941, 'noise_level': 0.015575914316258457, 'constant_value': 75449.86089046398, 'nu': 1.5}. Best is trial 1985 with value: 0.134351948015208.
[I 2024-12-04 15:34:42,030] Trial 2342 finished with value: 1.2693635022579692 and parameters: {'kernel_type': 'Matern', 'length_scale': 0.07165683209772343, 'noise_level': 0.006208311501523532, 'constant_value': 623.88944317034, 'nu': 1.5}. Best is trial 1985 with value: 0.134351948015208.
[I 2024-12-04 15:34:43,018] Trial 2340 finished with value: 0.13435440066240678 and parameters: {'kernel_type': 'Matern', 'length_scale': 4.476241577842676, 'noise_level': 0.0013949082614358418, 'constant_value': 76280.02658902013, 'nu': 1.5}. Best is trial 1985 with value: 0.134351948015208.
[I 2024-12-04 15:34:45,379] Trial 2339 finished with value: 1.2693635028569596 and parameters: {'kernel_type': 'RBF', 'length_scale': 0.10932718791961885, 'noise_level': 0.3521727150970411, 'constant_value': 69638.99245341899, 'nu': 1.5}. Best is trial 1985 with value: 0.134351948015208.
[I 2024-12-04 15:34:46,079] Trial 2331 finished with value: 0.13435417455148094 and parameters: {'kernel_type': 'Matern', 'length_scale': 0.8113849792498246, 'noise_level': 0.0031897269815802606, 'constant_value': 99756.3194832001, 'nu': 1.5}. Best is trial 1985 with value: 0.134351948015208.
[I 2024-12-04 15:34:49,676] Trial 2343 finished with value: 0.134354404664492 and parameters: {'kernel_type': 'Matern', 'length_scale': 15645.290287576767, 'noise_level': 0.3089501767283993, 'constant_value': 20497.393026398295, 'nu': 1.5}. Best is trial 1985 with value: 0.134351948015208.
[I 2024-12-04 15:34:50,556] Trial 2348 finished with value: 1.2693635028581371 and parameters: {'kernel_type': 'Matern', 'length_scale': 6290.71439461989, 'noise_level': 0.0009103006361774879, 'constant_value': 8163.949382509641, 'nu': 1.5}. Best is trial 1985 with value: 0.134351948015208.
[I 2024-12-04 15:34:50,582] Trial 2347 finished with value: 0.13435462303668305 and parameters: {'kernel_type': 'Matern', 'length_scale': 936.689478414682, 'noise_level': 0.01823996942586927, 'constant_value': 99082.15358747037, 'nu': 1.5}. Best is trial 1985 with value: 0.134351948015208.
[I 2024-12-04 15:34:50,617] Trial 2338 finished with value: 0.13435439714218156 and parameters: {'kernel_type': 'Matern', 'length_scale': 36721.23278441365, 'noise_level': 0.6890942495851846, 'constant_value': 131.8256175351627, 'nu': 1.5}. Best is trial 1985 with value: 0.134351948015208.
[I 2024-12-04 15:34:51,022] Trial 2355 finished with value: 0.13435453142599593 and parameters: {'kernel_type': 'Matern', 'length_scale': 529.2890895935917, 'noise_level': 0.06055519472568817, 'constant_value': 42256.44291743813, 'nu': 1.5}. Best is trial 1985 with value: 0.134351948015208.
[I 2024-12-04 15:34:51,059] Trial 2354 finished with value: 0.13435439663678714 and parameters: {'kernel_type': 'Matern', 'length_scale': 6205.997803097348, 'noise_level': 0.010687380247484786, 'constant_value': 11897.968178331525, 'nu': 1.5}. Best is trial 1985 with value: 0.134351948015208.
[I 2024-12-04 15:34:51,085] Trial 2350 finished with value: 0.13435441670666393 and parameters: {'kernel_type': 'Matern', 'length_scale': 4966.412751560482, 'noise_level': 0.12995735563888003, 'constant_value': 36734.51916197048, 'nu': 1.5}. Best is trial 1985 with value: 0.134351948015208.
[I 2024-12-04 15:34:52,723] Trial 2345 finished with value: 0.13435440048611527 and parameters: {'kernel_type': 'Matern', 'length_scale': 2068.4786994730594, 'noise_level': 0.10041190567068656, 'constant_value': 13575.981087043087, 'nu': 1.5}. Best is trial 1985 with value: 0.134351948015208.
[I 2024-12-04 15:34:52,849] Trial 2346 finished with value: 0.17251041665197028 and parameters: {'kernel_type': 'Matern', 'length_scale': 3000.18091322435, 'noise_level': 3.251437494156321e-09, 'constant_value': 5723.357495719615, 'nu': 0.5}. Best is trial 1985 with value: 0.134351948015208.
[I 2024-12-04 15:34:52,901] Trial 2353 finished with value: 0.13435439932315313 and parameters: {'kernel_type': 'Matern', 'length_scale': 44572.8069144316, 'noise_level': 0.08924542711859429, 'constant_value': 73735.43276926398, 'nu': 1.5}. Best is trial 1985 with value: 0.134351948015208.
[I 2024-12-04 15:34:55,617] Trial 2349 finished with value: 1.2693635028568466 and parameters: {'kernel_type': 'Matern', 'length_scale': 17469.021598405867, 'noise_level': 0.004997728695595896, 'constant_value': 8791.28200238469, 'nu': 1.5}. Best is trial 1985 with value: 0.134351948015208.
[I 2024-12-04 15:34:56,498] Trial 2352 finished with value: 0.13435442160861322 and parameters: {'kernel_type': 'Matern', 'length_scale': 1338.033165797317, 'noise_level': 0.027125022654834068, 'constant_value': 89047.1413588168, 'nu': 1.5}. Best is trial 1985 with value: 0.134351948015208.
[I 2024-12-04 15:34:58,685] Trial 2357 finished with value: 0.13435412935025334 and parameters: {'kernel_type': 'Matern', 'length_scale': 101.42616945921742, 'noise_level': 0.8463268027027713, 'constant_value': 86415.51476136914, 'nu': 1.5}. Best is trial 1985 with value: 0.134351948015208.
[I 2024-12-04 15:34:59,376] Trial 2359 finished with value: 0.13435439954608572 and parameters: {'kernel_type': 'Matern', 'length_scale': 1663.263550172007, 'noise_level': 0.07562662896226957, 'constant_value': 2533.3827474548443, 'nu': 1.5}. Best is trial 1985 with value: 0.134351948015208.
[I 2024-12-04 15:35:00,998] Trial 2361 finished with value: 0.1343543737274038 and parameters: {'kernel_type': 'Matern', 'length_scale': 2054.5528826383916, 'noise_level': 0.19304739745770957, 'constant_value': 869.4381523700067, 'nu': 1.5}. Best is trial 1985 with value: 0.134351948015208.
[I 2024-12-04 15:35:01,853] Trial 2356 finished with value: 0.17251040102635856 and parameters: {'kernel_type': 'Matern', 'length_scale': 112.6384475956515, 'noise_level': 0.01697593478729691, 'constant_value': 1644.8024278789103, 'nu': 0.5}. Best is trial 1985 with value: 0.134351948015208.
[I 2024-12-04 15:35:03,027] Trial 2344 finished with value: 0.15167304311775126 and parameters: {'kernel_type': 'RBF', 'length_scale': 3.360556150940179, 'noise_level': 2.2075433663082206e-10, 'constant_value': 1.937345376165439e-06, 'nu': 2.5}. Best is trial 1985 with value: 0.134351948015208.
[I 2024-12-04 15:35:04,451] Trial 2360 finished with value: 0.1343541008379657 and parameters: {'kernel_type': 'Matern', 'length_scale': 851.1927233305822, 'noise_level': 0.03161889089283122, 'constant_value': 626.459956612501, 'nu': 1.5}. Best is trial 1985 with value: 0.134351948015208.
[I 2024-12-04 15:35:04,883] Trial 2362 finished with value: 0.13435440575905974 and parameters: {'kernel_type': 'Matern', 'length_scale': 75.04604147083623, 'noise_level': 0.18965510832428278, 'constant_value': 1349.2396708003348, 'nu': 1.5}. Best is trial 1985 with value: 0.134351948015208.
[I 2024-12-04 15:35:06,926] Trial 2358 finished with value: 0.13435445664005252 and parameters: {'kernel_type': 'Matern', 'length_scale': 940.7614297553831, 'noise_level': 0.007771153521631148, 'constant_value': 4568.305280524545, 'nu': 1.5}. Best is trial 1985 with value: 0.134351948015208.
[I 2024-12-04 15:35:08,878] Trial 2370 finished with value: 0.1343544008547044 and parameters: {'kernel_type': 'Matern', 'length_scale': 1061.6446611729748, 'noise_level': 0.0002527104887862504, 'constant_value': 14497.153734933494, 'nu': 1.5}. Best is trial 1985 with value: 0.134351948015208.
[I 2024-12-04 15:35:09,480] Trial 2351 finished with value: 0.13435437892085525 and parameters: {'kernel_type': 'Matern', 'length_scale': 77.94909158701185, 'noise_level': 0.8761860302127062, 'constant_value': 83422.10306996267, 'nu': 1.5}. Best is trial 1985 with value: 0.134351948015208.
[I 2024-12-04 15:35:10,670] Trial 2364 finished with value: 0.17251040247307461 and parameters: {'kernel_type': 'Matern', 'length_scale': 1096.8915499632694, 'noise_level': 0.045151506148327754, 'constant_value': 29396.043184010632, 'nu': 0.5}. Best is trial 1985 with value: 0.134351948015208.
[I 2024-12-04 15:35:11,027] Trial 2368 finished with value: 0.13435440240570634 and parameters: {'kernel_type': 'Matern', 'length_scale': 56.85564373826688, 'noise_level': 0.051681400104767704, 'constant_value': 84029.24759679579, 'nu': 1.5}. Best is trial 1985 with value: 0.134351948015208.
[I 2024-12-04 15:35:12,432] Trial 2366 finished with value: 0.13435463298335254 and parameters: {'kernel_type': 'Matern', 'length_scale': 152.00108822192976, 'noise_level': 0.006073501057301568, 'constant_value': 89059.5970654158, 'nu': 1.5}. Best is trial 1985 with value: 0.134351948015208.
[I 2024-12-04 15:35:13,744] Trial 2373 finished with value: 0.13435439641701094 and parameters: {'kernel_type': 'Matern', 'length_scale': 139.09741360632094, 'noise_level': 0.773184757272792, 'constant_value': 3723.2317631745645, 'nu': 1.5}. Best is trial 1985 with value: 0.134351948015208.
[I 2024-12-04 15:35:13,818] Trial 2369 finished with value: 1.3007745936537018 and parameters: {'kernel_type': 'Matern', 'length_scale': 96114.82640080524, 'noise_level': 0.03556440082152563, 'constant_value': 10.41072544598054, 'nu': 1.5}. Best is trial 1985 with value: 0.134351948015208.
[I 2024-12-04 15:35:14,646] Trial 2371 finished with value: 1.269363502857314 and parameters: {'kernel_type': 'Matern', 'length_scale': 4444.243368363017, 'noise_level': 0.00015244844614194293, 'constant_value': 30286.939169670764, 'nu': 1.5}. Best is trial 1985 with value: 0.134351948015208.
[I 2024-12-04 15:35:14,739] Trial 2363 finished with value: 0.13435435871599355 and parameters: {'kernel_type': 'Matern', 'length_scale': 149.7548690505684, 'noise_level': 0.021802988746971466, 'constant_value': 4157.192839498549, 'nu': 1.5}. Best is trial 1985 with value: 0.134351948015208.
[I 2024-12-04 15:35:15,011] Trial 2367 finished with value: 0.13435439637087185 and parameters: {'kernel_type': 'Matern', 'length_scale': 212.623113731727, 'noise_level': 0.018894334589950098, 'constant_value': 2653.824301585483, 'nu': 1.5}. Best is trial 1985 with value: 0.134351948015208.
[I 2024-12-04 15:35:15,167] Trial 2374 finished with value: 0.13435439835828072 and parameters: {'kernel_type': 'Matern', 'length_scale': 248.26309760785912, 'noise_level': 0.0002932521539325278, 'constant_value': 88785.58874821362, 'nu': 1.5}. Best is trial 1985 with value: 0.134351948015208.
[I 2024-12-04 15:35:15,168] Trial 2365 finished with value: 0.13435476982550865 and parameters: {'kernel_type': 'Matern', 'length_scale': 630.6616831011104, 'noise_level': 0.00041332838833429617, 'constant_value': 5896.870346949491, 'nu': 1.5}. Best is trial 1985 with value: 0.134351948015208.
[I 2024-12-04 15:35:16,126] Trial 2380 finished with value: 0.13435439915884861 and parameters: {'kernel_type': 'Matern', 'length_scale': 1011.0563693074758, 'noise_level': 0.015896476816566977, 'constant_value': 53646.1015022372, 'nu': 1.5}. Best is trial 1985 with value: 0.134351948015208.
