[I 2024-12-04 00:09:28,516] Trial 597 finished with value: 0.1648313574026506 and parameters: {'kernel': 'rbf', 'C': 95.75866565398238, 'gamma': 0.015143284371539468, 'epsilon': 0.0010500160509957991}. Best is trial 448 with value: 0.13989258940934515.
[I 2024-12-04 00:09:29,895] Trial 601 finished with value: 0.18550427003846706 and parameters: {'kernel': 'rbf', 'C': 20.953700446681015, 'gamma': 0.04131412846624706, 'epsilon': 0.0010411361042793044}. Best is trial 448 with value: 0.13989258940934515.
[I 2024-12-04 00:09:30,410] Trial 604 finished with value: 0.4089452141608102 and parameters: {'kernel': 'linear', 'C': 0.03738095913099088, 'gamma': 0.3923138189055835, 'epsilon': 0.013016563558205758}. Best is trial 448 with value: 0.13989258940934515.
[I 2024-12-04 00:09:31,223] Trial 602 finished with value: 0.14293358090398298 and parameters: {'kernel': 'rbf', 'C': 75.23975743086146, 'gamma': 0.007532478874350714, 'epsilon': 0.0011206016857692876}. Best is trial 448 with value: 0.13989258940934515.
[I 2024-12-04 00:09:33,032] Trial 606 finished with value: 0.22638360199869734 and parameters: {'kernel': 'rbf', 'C': 74.11595310393442, 'gamma': 0.0018649786541458917, 'epsilon': 0.0010439893497289554}. Best is trial 448 with value: 0.13989258940934515.
[I 2024-12-04 00:09:34,507] Trial 603 finished with value: 0.15436007831371293 and parameters: {'kernel': 'rbf', 'C': 82.23265885364282, 'gamma': 0.013264887022271037, 'epsilon': 0.0011713653374870298}. Best is trial 448 with value: 0.13989258940934515.
[I 2024-12-04 00:09:34,508] Trial 605 finished with value: 0.1448415172566657 and parameters: {'kernel': 'rbf', 'C': 50.20140448418851, 'gamma': 0.011016918000737005, 'epsilon': 0.0010262425697093421}. Best is trial 448 with value: 0.13989258940934515.
[I 2024-12-04 00:09:36,022] Trial 608 finished with value: 0.2890878848749261 and parameters: {'kernel': 'rbf', 'C': 12.203977280143002, 'gamma': 0.0025479211319041793, 'epsilon': 0.00372120540394985}. Best is trial 448 with value: 0.13989258940934515.
[I 2024-12-04 00:09:36,884] Trial 610 finished with value: 0.26767775114568493 and parameters: {'kernel': 'rbf', 'C': 16.047762105037148, 'gamma': 0.00315502088657242, 'epsilon': 0.0027973822941415047}. Best is trial 448 with value: 0.13989258940934515.
[I 2024-12-04 00:09:36,885] Trial 609 finished with value: 0.46045140604667095 and parameters: {'kernel': 'rbf', 'C': 4.674965943322038, 'gamma': 0.40530278424026217, 'epsilon': 0.0014516773271648074}. Best is trial 448 with value: 0.13989258940934515.
[I 2024-12-04 00:09:37,143] Trial 607 finished with value: 0.14521015439579132 and parameters: {'kernel': 'rbf', 'C': 93.25012301875829, 'gamma': 0.011076514695187103, 'epsilon': 0.0012424250129078687}. Best is trial 448 with value: 0.13989258940934515.
[I 2024-12-04 00:09:39,083] Trial 611 finished with value: 0.17052223489868185 and parameters: {'kernel': 'rbf', 'C': 22.009726069473594, 'gamma': 0.010880793526530274, 'epsilon': 0.0030819987984974664}. Best is trial 448 with value: 0.13989258940934515.
[I 2024-12-04 00:09:39,419] Trial 612 finished with value: 0.2745315865666168 and parameters: {'kernel': 'rbf', 'C': 15.431428540453384, 'gamma': 0.0026615630245183635, 'epsilon': 0.0010765012303290723}. Best is trial 448 with value: 0.13989258940934515.
[I 2024-12-04 00:09:41,784] Trial 614 finished with value: 0.15576863672010996 and parameters: {'kernel': 'rbf', 'C': 92.17657034665157, 'gamma': 0.004852996912842094, 'epsilon': 0.002182970293283149}. Best is trial 448 with value: 0.13989258940934515.
[I 2024-12-04 00:09:42,109] Trial 616 finished with value: 0.25536740207154146 and parameters: {'kernel': 'rbf', 'C': 12.93068244985499, 'gamma': 0.005122786516669952, 'epsilon': 0.0021964184542029}. Best is trial 448 with value: 0.13989258940934515.
[I 2024-12-04 00:09:43,154] Trial 613 finished with value: 0.1411075856162357 and parameters: {'kernel': 'rbf', 'C': 90.97096100996816, 'gamma': 0.010072049581381274, 'epsilon': 0.003317235752941162}. Best is trial 448 with value: 0.13989258940934515.
[I 2024-12-04 00:09:45,410] Trial 619 finished with value: 340.94990099460347 and parameters: {'kernel': 'sigmoid', 'C': 12.762107814784436, 'gamma': 0.27019731050551715, 'epsilon': 0.07464330665742949}. Best is trial 448 with value: 0.13989258940934515.
[I 2024-12-04 00:09:45,430] Trial 618 finished with value: 0.15736716489290634 and parameters: {'kernel': 'rbf', 'C': 13.35217559271265, 'gamma': 0.021741918954631248, 'epsilon': 0.002086742079979127}. Best is trial 448 with value: 0.13989258940934515.
[I 2024-12-04 00:09:46,513] Trial 615 finished with value: 0.15438065260691447 and parameters: {'kernel': 'rbf', 'C': 95.91312625594261, 'gamma': 0.012491862588175891, 'epsilon': 0.002026168750159562}. Best is trial 448 with value: 0.13989258940934515.
[I 2024-12-04 00:09:48,221] Trial 617 finished with value: 0.1410350546866902 and parameters: {'kernel': 'rbf', 'C': 91.61995352080503, 'gamma': 0.010038152006467925, 'epsilon': 0.0020666001738707702}. Best is trial 448 with value: 0.13989258940934515.
[I 2024-12-04 00:09:49,406] Trial 622 finished with value: 0.1939952081356872 and parameters: {'kernel': 'rbf', 'C': 13.879939011554054, 'gamma': 0.011624901083104785, 'epsilon': 0.003432306082068528}. Best is trial 448 with value: 0.13989258940934515.
[I 2024-12-04 00:09:52,579] Trial 623 finished with value: 0.16237729013046961 and parameters: {'kernel': 'rbf', 'C': 80.5811740182314, 'gamma': 0.004637565078074211, 'epsilon': 0.003909039876241717}. Best is trial 448 with value: 0.13989258940934515.
[I 2024-12-04 00:09:52,714] Trial 620 finished with value: 0.16008357231052622 and parameters: {'kernel': 'rbf', 'C': 95.66082503907138, 'gamma': 0.013968216487969202, 'epsilon': 0.002481038832016215}. Best is trial 448 with value: 0.13989258940934515.
[I 2024-12-04 00:09:54,038] Trial 621 finished with value: 0.18662791198122597 and parameters: {'kernel': 'rbf', 'C': 73.31750693666571, 'gamma': 0.03529575136723842, 'epsilon': 0.0031865287032194424}. Best is trial 448 with value: 0.13989258940934515.
[I 2024-12-04 00:09:54,149] Trial 624 finished with value: 0.14760346900807525 and parameters: {'kernel': 'rbf', 'C': 26.79997578722787, 'gamma': 0.016998097280249827, 'epsilon': 0.0031934006481637604}. Best is trial 448 with value: 0.13989258940934515.
[I 2024-12-04 00:09:55,584] Trial 626 finished with value: 0.9654539442025957 and parameters: {'kernel': 'sigmoid', 'C': 0.0011967585620659563, 'gamma': 0.14936481786512643, 'epsilon': 0.0014220575594617651}. Best is trial 448 with value: 0.13989258940934515.
[I 2024-12-04 00:09:55,897] Trial 625 finished with value: 0.21920326965490838 and parameters: {'kernel': 'rbf', 'C': 11.427197494247924, 'gamma': 0.010346010576203747, 'epsilon': 0.0030403895336180336}. Best is trial 448 with value: 0.13989258940934515.
[I 2024-12-04 00:10:00,723] Trial 629 finished with value: 0.14287223226951198 and parameters: {'kernel': 'rbf', 'C': 95.56339948094224, 'gamma': 0.007152047967579003, 'epsilon': 0.005565865173635976}. Best is trial 448 with value: 0.13989258940934515.
[I 2024-12-04 00:10:01,210] Trial 628 finished with value: 0.2240757682459528 and parameters: {'kernel': 'rbf', 'C': 87.9780998412299, 'gamma': 0.08083391498182484, 'epsilon': 0.0028597020201632157}. Best is trial 448 with value: 0.13989258940934515.
[I 2024-12-04 00:10:03,905] Trial 631 finished with value: 0.2051290847603933 and parameters: {'kernel': 'rbf', 'C': 68.3737170081243, 'gamma': 0.0029510748235640175, 'epsilon': 0.001004586077757872}. Best is trial 448 with value: 0.13989258940934515.
[I 2024-12-04 00:10:04,461] Trial 630 finished with value: 0.17939615568419676 and parameters: {'kernel': 'rbf', 'C': 93.91942265408483, 'gamma': 0.026684416956349894, 'epsilon': 0.003427009793564164}. Best is trial 448 with value: 0.13989258940934515.
[I 2024-12-04 00:10:04,461] Trial 481 finished with value: 0.3525215556127685 and parameters: {'kernel': 'linear', 'C': 30.61728868905252, 'gamma': 0.0029081113916171264, 'epsilon': 0.00176719195228197}. Best is trial 448 with value: 0.13989258940934515.
[I 2024-12-04 00:10:06,210] Trial 634 finished with value: 179.4261690395333 and parameters: {'kernel': 'sigmoid', 'C': 8.035053616055128, 'gamma': 0.035428394760049914, 'epsilon': 0.002715435574937893}. Best is trial 448 with value: 0.13989258940934515.
[I 2024-12-04 00:10:06,233] Trial 632 finished with value: 0.16732562006885338 and parameters: {'kernel': 'rbf', 'C': 93.10232783405172, 'gamma': 0.016862717411304608, 'epsilon': 0.003661679511138154}. Best is trial 448 with value: 0.13989258940934515.
[I 2024-12-04 00:10:06,444] Trial 633 finished with value: 0.15224963800889782 and parameters: {'kernel': 'rbf', 'C': 21.40730796290385, 'gamma': 0.015711273383951035, 'epsilon': 0.003392485695011417}. Best is trial 448 with value: 0.13989258940934515.
[I 2024-12-04 00:10:08,555] Trial 638 finished with value: 0.2520788091803317 and parameters: {'kernel': 'rbf', 'C': 17.070060826448216, 'gamma': 0.004324458966603806, 'epsilon': 0.002775500464385021}. Best is trial 448 with value: 0.13989258940934515.
[I 2024-12-04 00:10:08,681] Trial 635 finished with value: 0.14301460890546244 and parameters: {'kernel': 'rbf', 'C': 91.02406992802037, 'gamma': 0.01058529059526892, 'epsilon': 0.0012174908773546116}. Best is trial 448 with value: 0.13989258940934515.
[I 2024-12-04 00:10:08,995] Trial 627 finished with value: 0.3076044412643116 and parameters: {'kernel': 'linear', 'C': 5.8873684477175345, 'gamma': 0.38869762512004524, 'epsilon': 0.1436580413541104}. Best is trial 448 with value: 0.13989258940934515.
[I 2024-12-04 00:10:10,548] Trial 639 finished with value: 0.23799218959099672 and parameters: {'kernel': 'rbf', 'C': 15.690677051056158, 'gamma': 0.006150212819843919, 'epsilon': 0.003957762917088714}. Best is trial 448 with value: 0.13989258940934515.
[I 2024-12-04 00:10:10,795] Trial 641 finished with value: 0.664545830563958 and parameters: {'kernel': 'rbf', 'C': 0.025634821533107546, 'gamma': 0.022848211959133866, 'epsilon': 0.0061301009227100476}. Best is trial 448 with value: 0.13989258940934515.
[I 2024-12-04 00:10:11,731] Trial 636 finished with value: 0.15954186651866248 and parameters: {'kernel': 'rbf', 'C': 85.52985136348813, 'gamma': 0.014635248519666178, 'epsilon': 0.0025378606835599915}. Best is trial 448 with value: 0.13989258940934515.
[I 2024-12-04 00:10:12,287] Trial 640 finished with value: 0.1599705584519134 and parameters: {'kernel': 'rbf', 'C': 90.36806622620632, 'gamma': 0.004478178666704883, 'epsilon': 0.003138613106524533}. Best is trial 448 with value: 0.13989258940934515.
[I 2024-12-04 00:10:13,922] Trial 644 finished with value: 0.27650473186236807 and parameters: {'kernel': 'rbf', 'C': 28.560846747663053, 'gamma': 0.0015113734455143226, 'epsilon': 0.002791849188477667}. Best is trial 448 with value: 0.13989258940934515.
[I 2024-12-04 00:10:15,312] Trial 643 finished with value: 0.14990667793700255 and parameters: {'kernel': 'rbf', 'C': 88.72864012814289, 'gamma': 0.005735634358588112, 'epsilon': 0.0013768331033049593}. Best is trial 448 with value: 0.13989258940934515.
[I 2024-12-04 00:10:15,834] Trial 646 finished with value: 1200.523223595221 and parameters: {'kernel': 'sigmoid', 'C': 88.32216126269319, 'gamma': 0.01080037249661841, 'epsilon': 0.001064013318836246}. Best is trial 448 with value: 0.13989258940934515.
[I 2024-12-04 00:10:16,680] Trial 642 finished with value: 0.15559242258379122 and parameters: {'kernel': 'rbf', 'C': 80.68573509176665, 'gamma': 0.01390032021797808, 'epsilon': 0.0037675984193377577}. Best is trial 448 with value: 0.13989258940934515.
[I 2024-12-04 00:10:18,516] Trial 647 finished with value: 0.19523282720057553 and parameters: {'kernel': 'rbf', 'C': 12.604212121179469, 'gamma': 0.012342767627016605, 'epsilon': 0.0024371155627248577}. Best is trial 448 with value: 0.13989258940934515.
[I 2024-12-04 00:10:21,005] Trial 645 finished with value: 0.1702437317418453 and parameters: {'kernel': 'rbf', 'C': 98.68522243632185, 'gamma': 0.017626085791875332, 'epsilon': 0.001178557038982399}. Best is trial 448 with value: 0.13989258940934515.
[I 2024-12-04 00:10:21,147] Trial 649 finished with value: 0.23218516267925107 and parameters: {'kernel': 'rbf', 'C': 17.641035815828094, 'gamma': 0.09487414317502822, 'epsilon': 0.0023650469596192387}. Best is trial 448 with value: 0.13989258940934515.
[I 2024-12-04 00:10:21,602] Trial 648 finished with value: 0.14169814761060145 and parameters: {'kernel': 'rbf', 'C': 97.23791991892384, 'gamma': 0.010283625163033125, 'epsilon': 0.0031017174464767166}. Best is trial 448 with value: 0.13989258940934515.
[I 2024-12-04 00:10:22,558] Trial 545 finished with value: 0.3514769523824571 and parameters: {'kernel': 'linear', 'C': 27.246272280328242, 'gamma': 0.002730697625631464, 'epsilon': 0.012004391498425448}. Best is trial 448 with value: 0.13989258940934515.
[I 2024-12-04 00:10:22,769] Trial 651 finished with value: 0.9657179066920092 and parameters: {'kernel': 'poly', 'C': 0.066957756821346, 'gamma': 0.001259350856125461, 'epsilon': 0.0016310004797086095}. Best is trial 448 with value: 0.13989258940934515.
[I 2024-12-04 00:10:23,398] Trial 650 finished with value: 0.14039943816374004 and parameters: {'kernel': 'rbf', 'C': 93.83639370299225, 'gamma': 0.009230830883458423, 'epsilon': 0.003372299210593165}. Best is trial 448 with value: 0.13989258940934515.
[I 2024-12-04 00:10:23,793] Trial 653 finished with value: 0.7132031889094567 and parameters: {'kernel': 'poly', 'C': 35.93860316206113, 'gamma': 0.004990804623051323, 'epsilon': 0.006144722193438342}. Best is trial 448 with value: 0.13989258940934515.
[I 2024-12-04 00:10:24,886] Trial 654 finished with value: 0.31892297752614834 and parameters: {'kernel': 'linear', 'C': 0.37918732425870716, 'gamma': 0.018626762367384864, 'epsilon': 0.11052322152451258}. Best is trial 448 with value: 0.13989258940934515.
[I 2024-12-04 00:10:25,072] Trial 161 finished with value: 0.3530742251694476 and parameters: {'kernel': 'linear', 'C': 90.50023836633443, 'gamma': 0.00990927575127994, 'epsilon': 0.009679160140887398}. Best is trial 448 with value: 0.13989258940934515.
[I 2024-12-04 00:10:26,339] Trial 658 finished with value: 0.2712895885617629 and parameters: {'kernel': 'rbf', 'C': 17.771833487517966, 'gamma': 0.0025033542331497232, 'epsilon': 0.004157891756206955}. Best is trial 448 with value: 0.13989258940934515.
[I 2024-12-04 00:10:26,909] Trial 328 finished with value: 0.3550136546838485 and parameters: {'kernel': 'linear', 'C': 69.12562866433234, 'gamma': 0.0004389902444267229, 'epsilon': 0.024127482790891608}. Best is trial 448 with value: 0.13989258940934515.
[I 2024-12-04 00:10:28,482] Trial 659 finished with value: 0.1423888611290907 and parameters: {'kernel': 'rbf', 'C': 99.25093986899084, 'gamma': 0.006547714632885108, 'epsilon': 0.0023445120166434197}. Best is trial 448 with value: 0.13989258940934515.
[I 2024-12-04 00:10:29,076] Trial 655 finished with value: 0.16746971752134351 and parameters: {'kernel': 'rbf', 'C': 98.97983461809488, 'gamma': 0.018111943047194705, 'epsilon': 0.005597297723037784}. Best is trial 448 with value: 0.13989258940934515.
[I 2024-12-04 00:10:29,751] Trial 661 finished with value: 0.17655331251499767 and parameters: {'kernel': 'rbf', 'C': 20.175346081210048, 'gamma': 0.03614063031474739, 'epsilon': 0.004690452901211418}. Best is trial 448 with value: 0.13989258940934515.
[I 2024-12-04 00:10:30,284] Trial 656 finished with value: 0.18511712585255785 and parameters: {'kernel': 'rbf', 'C': 97.43753683383775, 'gamma': 0.031466942506519435, 'epsilon': 0.0031927547489433946}. Best is trial 448 with value: 0.13989258940934515.
[I 2024-12-04 00:10:30,404] Trial 662 finished with value: 0.26855486061815215 and parameters: {'kernel': 'rbf', 'C': 73.63035197411564, 'gamma': 0.0007717007902015309, 'epsilon': 0.004073231426626435}. Best is trial 448 with value: 0.13989258940934515.
[I 2024-12-04 00:10:30,451] Trial 637 finished with value: 0.35341321119973107 and parameters: {'kernel': 'linear', 'C': 5.653503787526142, 'gamma': 0.01614692365686945, 'epsilon': 0.0018480648745498192}. Best is trial 448 with value: 0.13989258940934515.
[I 2024-12-04 00:10:31,511] Trial 663 finished with value: 0.17310306540510878 and parameters: {'kernel': 'rbf', 'C': 74.34356837283997, 'gamma': 0.004187657082123054, 'epsilon': 0.003582291314714365}. Best is trial 448 with value: 0.13989258940934515.
[I 2024-12-04 00:10:31,965] Trial 664 finished with value: 0.22912607484122186 and parameters: {'kernel': 'rbf', 'C': 24.63666455287611, 'gamma': 0.004771744915937798, 'epsilon': 0.0037508437252107827}. Best is trial 448 with value: 0.13989258940934515.
[I 2024-12-04 00:10:32,281] Trial 666 finished with value: 0.987979597593788 and parameters: {'kernel': 'sigmoid', 'C': 0.01391017719202825, 'gamma': 0.00021611594553258982, 'epsilon': 0.07651899203761131}. Best is trial 448 with value: 0.13989258940934515.
[I 2024-12-04 00:10:32,864] Trial 665 finished with value: 0.2066991884863639 and parameters: {'kernel': 'rbf', 'C': 78.4618371806021, 'gamma': 0.002563124386450268, 'epsilon': 0.002618455304424131}. Best is trial 448 with value: 0.13989258940934515.
[I 2024-12-04 00:10:34,262] Trial 667 finished with value: 0.18781523902808628 and parameters: {'kernel': 'rbf', 'C': 83.09394655247561, 'gamma': 0.003216942548688773, 'epsilon': 0.0033389993394970945}. Best is trial 448 with value: 0.13989258940934515.
[I 2024-12-04 00:10:35,652] Trial 275 finished with value: 0.35323054990982583 and parameters: {'kernel': 'linear', 'C': 68.0788914047961, 'gamma': 0.003654938524618758, 'epsilon': 0.004504028925817369}. Best is trial 448 with value: 0.13989258940934515.
[I 2024-12-04 00:10:35,781] Trial 669 finished with value: 0.14154967319902947 and parameters: {'kernel': 'rbf', 'C': 81.02444949577168, 'gamma': 0.009168800760398776, 'epsilon': 0.0038264630108230785}. Best is trial 448 with value: 0.13989258940934515.
[I 2024-12-04 00:10:35,799] Trial 671 finished with value: 0.19444067071575424 and parameters: {'kernel': 'rbf', 'C': 23.955968616373625, 'gamma': 0.007728139222649562, 'epsilon': 0.0045478483958140345}. Best is trial 448 with value: 0.13989258940934515.
[I 2024-12-04 00:10:38,275] Trial 672 finished with value: 0.1568353810208954 and parameters: {'kernel': 'rbf', 'C': 64.64525201825451, 'gamma': 0.016052194861568416, 'epsilon': 0.0031187078580203497}. Best is trial 448 with value: 0.13989258940934515.
[I 2024-12-04 00:10:39,614] Trial 676 finished with value: 40.06802236572714 and parameters: {'kernel': 'sigmoid', 'C': 0.9647075081877274, 'gamma': 0.8394265849678039, 'epsilon': 0.4561952964135669}. Best is trial 448 with value: 0.13989258940934515.
[I 2024-12-04 00:10:40,299] Trial 673 finished with value: 0.1455339750110606 and parameters: {'kernel': 'rbf', 'C': 77.50569983224058, 'gamma': 0.01159615916335755, 'epsilon': 0.004926425495213918}. Best is trial 448 with value: 0.13989258940934515.
[I 2024-12-04 00:10:40,319] Trial 675 finished with value: 0.14117449685234537 and parameters: {'kernel': 'rbf', 'C': 92.47307464531174, 'gamma': 0.009870927129305708, 'epsilon': 0.004174927116721691}. Best is trial 448 with value: 0.13989258940934515.
[I 2024-12-04 00:10:41,211] Trial 674 finished with value: 0.16460589423408162 and parameters: {'kernel': 'rbf', 'C': 85.44652468090068, 'gamma': 0.016627717148341017, 'epsilon': 0.004702855496234853}. Best is trial 448 with value: 0.13989258940934515.
[I 2024-12-04 00:10:41,758] Trial 677 finished with value: 0.3072963630329939 and parameters: {'kernel': 'rbf', 'C': 88.0196627054148, 'gamma': 0.18477902693710457, 'epsilon': 0.0022074349797876086}. Best is trial 448 with value: 0.13989258940934515.
[I 2024-12-04 00:10:42,470] Trial 679 finished with value: 0.24820039706916933 and parameters: {'kernel': 'rbf', 'C': 23.497175832670706, 'gamma': 0.0035717771814091615, 'epsilon': 0.004541883234132199}. Best is trial 448 with value: 0.13989258940934515.
[I 2024-12-04 00:10:43,328] Trial 678 finished with value: 0.1733356376579244 and parameters: {'kernel': 'rbf', 'C': 97.90582853213124, 'gamma': 0.003458253782224209, 'epsilon': 0.002593899515423175}. Best is trial 448 with value: 0.13989258940934515.
[I 2024-12-04 00:10:43,797] Trial 680 finished with value: 0.149396204711462 and parameters: {'kernel': 'rbf', 'C': 18.317077917897375, 'gamma': 0.021894621480416654, 'epsilon': 0.006228262121524308}. Best is trial 448 with value: 0.13989258940934515.
[I 2024-12-04 00:10:44,171] Trial 681 finished with value: 0.21271544290341235 and parameters: {'kernel': 'rbf', 'C': 97.28027858502074, 'gamma': 0.001916114972992276, 'epsilon': 0.004185195775975361}. Best is trial 448 with value: 0.13989258940934515.
[I 2024-12-04 00:10:45,085] Trial 683 finished with value: 0.4023946228348203 and parameters: {'kernel': 'rbf', 'C': 0.7129582850740657, 'gamma': 0.008266996685219938, 'epsilon': 0.003900007977527231}. Best is trial 448 with value: 0.13989258940934515.
[I 2024-12-04 00:10:45,981] Trial 684 finished with value: 0.23053135632279467 and parameters: {'kernel': 'rbf', 'C': 35.5420467458865, 'gamma': 0.0034248878337477754, 'epsilon': 0.00440591524497702}. Best is trial 448 with value: 0.13989258940934515.
[I 2024-12-04 00:10:46,329] Trial 682 finished with value: 0.1433274486945037 and parameters: {'kernel': 'rbf', 'C': 85.26584090347131, 'gamma': 0.010925217111526333, 'epsilon': 0.003419734958334819}. Best is trial 448 with value: 0.13989258940934515.
[I 2024-12-04 00:10:47,611] Trial 687 finished with value: 941.9030721331474 and parameters: {'kernel': 'sigmoid', 'C': 83.46611559850885, 'gamma': 0.008345364042097615, 'epsilon': 0.004096383654391463}. Best is trial 448 with value: 0.13989258940934515.
