[I 2024-12-04 12:41:26,149] Trial 726 finished with value: 0.2275959894197893 and parameters: {'n_estimators': 1417, 'learning_rate': 0.06778554191011217, 'max_depth': 12, 'min_samples_split': 11, 'min_samples_leaf': 1, 'subsample': 0.6628372846090396, 'max_features': 'sqrt'}. Best is trial 611 with value: 0.2042243937933349.
[I 2024-12-04 12:41:26,151] Trial 723 finished with value: 0.21795263264420237 and parameters: {'n_estimators': 1498, 'learning_rate': 0.09216276167802753, 'max_depth': 11, 'min_samples_split': 14, 'min_samples_leaf': 1, 'subsample': 0.6031589676602682, 'max_features': 'log2'}. Best is trial 611 with value: 0.2042243937933349.
[I 2024-12-04 12:41:27,418] Trial 744 finished with value: 0.30527973906131384 and parameters: {'n_estimators': 658, 'learning_rate': 0.05716505246127466, 'max_depth': 6, 'min_samples_split': 6, 'min_samples_leaf': 5, 'subsample': 0.7397688485221451, 'max_features': None}. Best is trial 611 with value: 0.2042243937933349.
[I 2024-12-04 12:41:28,894] Trial 728 finished with value: 0.23705817928542358 and parameters: {'n_estimators': 1405, 'learning_rate': 0.09990643064581832, 'max_depth': 12, 'min_samples_split': 19, 'min_samples_leaf': 2, 'subsample': 0.6221981211086995, 'max_features': 'sqrt'}. Best is trial 611 with value: 0.2042243937933349.
[I 2024-12-04 12:41:29,652] Trial 733 finished with value: 0.43151772856776804 and parameters: {'n_estimators': 1154, 'learning_rate': 0.09750544850455728, 'max_depth': 5, 'min_samples_split': 20, 'min_samples_leaf': 10, 'subsample': 0.6674616725556765, 'max_features': 'sqrt'}. Best is trial 611 with value: 0.2042243937933349.
[I 2024-12-04 12:41:31,355] Trial 741 finished with value: 0.23745181020539605 and parameters: {'n_estimators': 886, 'learning_rate': 0.0921984101601755, 'max_depth': 10, 'min_samples_split': 13, 'min_samples_leaf': 1, 'subsample': 0.6491446010854076, 'max_features': 'sqrt'}. Best is trial 611 with value: 0.2042243937933349.
[I 2024-12-04 12:41:41,375] Trial 730 finished with value: 0.2189568678787086 and parameters: {'n_estimators': 1490, 'learning_rate': 0.08826801785036198, 'max_depth': 11, 'min_samples_split': 14, 'min_samples_leaf': 1, 'subsample': 0.7018575193790181, 'max_features': 'sqrt'}. Best is trial 611 with value: 0.2042243937933349.
[I 2024-12-04 12:41:45,362] Trial 737 finished with value: 0.21491012235727266 and parameters: {'n_estimators': 1251, 'learning_rate': 0.09729375857017025, 'max_depth': 11, 'min_samples_split': 20, 'min_samples_leaf': 1, 'subsample': 0.6890533408992954, 'max_features': 'sqrt'}. Best is trial 611 with value: 0.2042243937933349.
[I 2024-12-04 12:41:48,111] Trial 752 finished with value: 0.526049588431349 and parameters: {'n_estimators': 813, 'learning_rate': 0.06967929363626542, 'max_depth': 5, 'min_samples_split': 6, 'min_samples_leaf': 10, 'subsample': 0.60979193325054, 'max_features': 'log2'}. Best is trial 611 with value: 0.2042243937933349.
[I 2024-12-04 12:41:50,296] Trial 738 finished with value: 0.3247315509650806 and parameters: {'n_estimators': 1256, 'learning_rate': 0.019669473837378597, 'max_depth': 3, 'min_samples_split': 20, 'min_samples_leaf': 3, 'subsample': 0.8240740679687165, 'max_features': None}. Best is trial 611 with value: 0.2042243937933349.
[I 2024-12-04 12:41:56,565] Trial 746 finished with value: 0.2409000066388482 and parameters: {'n_estimators': 1154, 'learning_rate': 0.046159753624367236, 'max_depth': 10, 'min_samples_split': 14, 'min_samples_leaf': 1, 'subsample': 0.6598045704330221, 'max_features': 'sqrt'}. Best is trial 611 with value: 0.2042243937933349.
[I 2024-12-04 12:41:58,267] Trial 748 finished with value: 0.21802701945376252 and parameters: {'n_estimators': 1101, 'learning_rate': 0.0999236996984477, 'max_depth': 12, 'min_samples_split': 7, 'min_samples_leaf': 1, 'subsample': 0.6312154555108119, 'max_features': 'sqrt'}. Best is trial 611 with value: 0.2042243937933349.
[I 2024-12-04 12:42:00,435] Trial 764 finished with value: 0.3987973252709071 and parameters: {'n_estimators': 429, 'learning_rate': 0.02332547753434212, 'max_depth': 8, 'min_samples_split': 18, 'min_samples_leaf': 9, 'subsample': 0.644581044003919, 'max_features': None}. Best is trial 611 with value: 0.2042243937933349.
[I 2024-12-04 12:42:01,540] Trial 743 finished with value: 0.2124916830639554 and parameters: {'n_estimators': 1321, 'learning_rate': 0.08162320543309175, 'max_depth': 12, 'min_samples_split': 17, 'min_samples_leaf': 1, 'subsample': 0.6832379140379284, 'max_features': 'sqrt'}. Best is trial 611 with value: 0.2042243937933349.
[I 2024-12-04 12:42:05,929] Trial 750 finished with value: 0.23141903281833645 and parameters: {'n_estimators': 1138, 'learning_rate': 0.05782518905638298, 'max_depth': 12, 'min_samples_split': 16, 'min_samples_leaf': 1, 'subsample': 0.685577299100396, 'max_features': 'sqrt'}. Best is trial 611 with value: 0.2042243937933349.
[I 2024-12-04 12:42:05,947] Trial 740 finished with value: 0.21792300681351112 and parameters: {'n_estimators': 1490, 'learning_rate': 0.06601650760083716, 'max_depth': 12, 'min_samples_split': 20, 'min_samples_leaf': 1, 'subsample': 0.6083114348949703, 'max_features': 'sqrt'}. Best is trial 611 with value: 0.2042243937933349.
[I 2024-12-04 12:42:05,955] Trial 742 finished with value: 0.2428609236461598 and parameters: {'n_estimators': 1452, 'learning_rate': 0.06504921979371597, 'max_depth': 11, 'min_samples_split': 15, 'min_samples_leaf': 2, 'subsample': 0.6888364314083653, 'max_features': 'sqrt'}. Best is trial 611 with value: 0.2042243937933349.
[I 2024-12-04 12:42:08,484] Trial 749 finished with value: 0.22805953092227402 and parameters: {'n_estimators': 1177, 'learning_rate': 0.0771427863690326, 'max_depth': 11, 'min_samples_split': 15, 'min_samples_leaf': 1, 'subsample': 0.6863290460201558, 'max_features': 'sqrt'}. Best is trial 611 with value: 0.2042243937933349.
[I 2024-12-04 12:42:15,139] Trial 745 finished with value: 0.2343989866342735 and parameters: {'n_estimators': 1457, 'learning_rate': 0.050820878105258906, 'max_depth': 10, 'min_samples_split': 20, 'min_samples_leaf': 1, 'subsample': 0.7134332590806683, 'max_features': 'sqrt'}. Best is trial 611 with value: 0.2042243937933349.
[I 2024-12-04 12:42:17,883] Trial 762 finished with value: 0.2337773012109547 and parameters: {'n_estimators': 859, 'learning_rate': 0.0972054267720124, 'max_depth': 12, 'min_samples_split': 16, 'min_samples_leaf': 1, 'subsample': 0.6694026267701185, 'max_features': 'log2'}. Best is trial 611 with value: 0.2042243937933349.
[I 2024-12-04 12:42:20,416] Trial 761 finished with value: 0.34459172618214895 and parameters: {'n_estimators': 941, 'learning_rate': 0.03690551543657397, 'max_depth': 8, 'min_samples_split': 3, 'min_samples_leaf': 7, 'subsample': 0.8583847408132312, 'max_features': 'sqrt'}. Best is trial 611 with value: 0.2042243937933349.
[I 2024-12-04 12:42:22,072] Trial 755 finished with value: 0.24685495654185113 and parameters: {'n_estimators': 1150, 'learning_rate': 0.06135027564685875, 'max_depth': 10, 'min_samples_split': 14, 'min_samples_leaf': 1, 'subsample': 0.6886307493513036, 'max_features': 'sqrt'}. Best is trial 611 with value: 0.2042243937933349.
[I 2024-12-04 12:42:23,460] Trial 757 finished with value: 0.2406992970304907 and parameters: {'n_estimators': 1115, 'learning_rate': 0.09382389852561511, 'max_depth': 12, 'min_samples_split': 14, 'min_samples_leaf': 1, 'subsample': 0.7975398966319134, 'max_features': 'sqrt'}. Best is trial 611 with value: 0.2042243937933349.
[I 2024-12-04 12:42:28,271] Trial 751 finished with value: 0.21352867854987992 and parameters: {'n_estimators': 1488, 'learning_rate': 0.09692252538673646, 'max_depth': 12, 'min_samples_split': 16, 'min_samples_leaf': 1, 'subsample': 0.68098475712487, 'max_features': 'sqrt'}. Best is trial 611 with value: 0.2042243937933349.
[I 2024-12-04 12:42:34,099] Trial 763 finished with value: 0.2529544942587577 and parameters: {'n_estimators': 1077, 'learning_rate': 0.09974372116717624, 'max_depth': 9, 'min_samples_split': 18, 'min_samples_leaf': 4, 'subsample': 0.7422257700529017, 'max_features': 'sqrt'}. Best is trial 611 with value: 0.2042243937933349.
[I 2024-12-04 12:42:35,830] Trial 753 finished with value: 0.2317011695869556 and parameters: {'n_estimators': 1461, 'learning_rate': 0.06560616142540815, 'max_depth': 11, 'min_samples_split': 14, 'min_samples_leaf': 2, 'subsample': 0.684379468923434, 'max_features': 'sqrt'}. Best is trial 611 with value: 0.2042243937933349.
[I 2024-12-04 12:42:39,141] Trial 754 finished with value: 0.22011443654019236 and parameters: {'n_estimators': 1472, 'learning_rate': 0.09305150257724792, 'max_depth': 12, 'min_samples_split': 16, 'min_samples_leaf': 1, 'subsample': 0.7236055792782192, 'max_features': 'sqrt'}. Best is trial 611 with value: 0.2042243937933349.
[I 2024-12-04 12:42:41,181] Trial 756 finished with value: 0.2326030222064349 and parameters: {'n_estimators': 1479, 'learning_rate': 0.09579539341311905, 'max_depth': 12, 'min_samples_split': 13, 'min_samples_leaf': 2, 'subsample': 0.6744897746330888, 'max_features': 'sqrt'}. Best is trial 611 with value: 0.2042243937933349.
[I 2024-12-04 12:42:42,606] Trial 767 finished with value: 0.22430268408403867 and parameters: {'n_estimators': 986, 'learning_rate': 0.09708718675606595, 'max_depth': 11, 'min_samples_split': 13, 'min_samples_leaf': 1, 'subsample': 0.6561945866113864, 'max_features': 'sqrt'}. Best is trial 611 with value: 0.2042243937933349.
[I 2024-12-04 12:42:45,257] Trial 759 finished with value: 0.23850936802520237 and parameters: {'n_estimators': 1421, 'learning_rate': 0.05421967110762502, 'max_depth': 12, 'min_samples_split': 19, 'min_samples_leaf': 3, 'subsample': 0.6577964860869936, 'max_features': 'sqrt'}. Best is trial 611 with value: 0.2042243937933349.
[I 2024-12-04 12:42:46,235] Trial 765 finished with value: 0.28268364250346406 and parameters: {'n_estimators': 1139, 'learning_rate': 0.07233773676721761, 'max_depth': 10, 'min_samples_split': 16, 'min_samples_leaf': 3, 'subsample': 0.7127046881903655, 'max_features': 'log2'}. Best is trial 611 with value: 0.2042243937933349.
[I 2024-12-04 12:42:48,082] Trial 758 finished with value: 0.23103292770992087 and parameters: {'n_estimators': 1478, 'learning_rate': 0.06924715558336457, 'max_depth': 12, 'min_samples_split': 10, 'min_samples_leaf': 1, 'subsample': 0.6223673727106157, 'max_features': 'sqrt'}. Best is trial 611 with value: 0.2042243937933349.
[I 2024-12-04 12:42:48,093] Trial 760 finished with value: 0.4419623000154423 and parameters: {'n_estimators': 1370, 'learning_rate': 0.07610875753532592, 'max_depth': 3, 'min_samples_split': 9, 'min_samples_leaf': 10, 'subsample': 0.6332514097276865, 'max_features': 'sqrt'}. Best is trial 611 with value: 0.2042243937933349.
[I 2024-12-04 12:42:54,370] Trial 771 finished with value: 0.26225335764462593 and parameters: {'n_estimators': 1133, 'learning_rate': 0.03645018104042084, 'max_depth': 10, 'min_samples_split': 20, 'min_samples_leaf': 2, 'subsample': 0.6856037189505059, 'max_features': 'sqrt'}. Best is trial 611 with value: 0.2042243937933349.
[I 2024-12-04 12:42:56,561] Trial 770 finished with value: 0.23202071728693635 and parameters: {'n_estimators': 1146, 'learning_rate': 0.0811647148399356, 'max_depth': 12, 'min_samples_split': 13, 'min_samples_leaf': 1, 'subsample': 0.6729602482107886, 'max_features': 'sqrt'}. Best is trial 611 with value: 0.2042243937933349.
[I 2024-12-04 12:42:58,360] Trial 788 finished with value: 0.3155107305435315 and parameters: {'n_estimators': 420, 'learning_rate': 0.019244088747645903, 'max_depth': 10, 'min_samples_split': 10, 'min_samples_leaf': 4, 'subsample': 0.9560985796317819, 'max_features': None}. Best is trial 611 with value: 0.2042243937933349.
[I 2024-12-04 12:43:00,824] Trial 769 finished with value: 0.23618873886395092 and parameters: {'n_estimators': 1198, 'learning_rate': 0.0973133731557068, 'max_depth': 9, 'min_samples_split': 13, 'min_samples_leaf': 2, 'subsample': 0.7249867629431445, 'max_features': 'sqrt'}. Best is trial 611 with value: 0.2042243937933349.
[I 2024-12-04 12:43:01,650] Trial 773 finished with value: 0.24310406259368703 and parameters: {'n_estimators': 1135, 'learning_rate': 0.06390799077210382, 'max_depth': 10, 'min_samples_split': 14, 'min_samples_leaf': 2, 'subsample': 0.6098106450470756, 'max_features': 'sqrt'}. Best is trial 611 with value: 0.2042243937933349.
[I 2024-12-04 12:43:09,546] Trial 768 finished with value: 0.23187549442161362 and parameters: {'n_estimators': 1459, 'learning_rate': 0.05947887747350635, 'max_depth': 12, 'min_samples_split': 14, 'min_samples_leaf': 2, 'subsample': 0.6351243382062761, 'max_features': 'sqrt'}. Best is trial 611 with value: 0.2042243937933349.
[I 2024-12-04 12:43:11,782] Trial 766 finished with value: 0.2196196970160349 and parameters: {'n_estimators': 1454, 'learning_rate': 0.09918000479568446, 'max_depth': 10, 'min_samples_split': 11, 'min_samples_leaf': 1, 'subsample': 0.6682928781050678, 'max_features': 'sqrt'}. Best is trial 611 with value: 0.2042243937933349.
[I 2024-12-04 12:43:16,829] Trial 772 finished with value: 0.21628294541554824 and parameters: {'n_estimators': 1457, 'learning_rate': 0.06698073050946839, 'max_depth': 11, 'min_samples_split': 18, 'min_samples_leaf': 1, 'subsample': 0.6079417676607057, 'max_features': 'sqrt'}. Best is trial 611 with value: 0.2042243937933349.
[I 2024-12-04 12:43:18,186] Trial 774 finished with value: 0.22798091750997532 and parameters: {'n_estimators': 1369, 'learning_rate': 0.055858495011527794, 'max_depth': 11, 'min_samples_split': 15, 'min_samples_leaf': 1, 'subsample': 0.6412414152863593, 'max_features': 'sqrt'}. Best is trial 611 with value: 0.2042243937933349.
[I 2024-12-04 12:43:18,187] Trial 775 finished with value: 0.2358640442353257 and parameters: {'n_estimators': 1337, 'learning_rate': 0.04162912472415088, 'max_depth': 11, 'min_samples_split': 19, 'min_samples_leaf': 1, 'subsample': 0.6070247238196786, 'max_features': 'sqrt'}. Best is trial 611 with value: 0.2042243937933349.
[I 2024-12-04 12:43:21,526] Trial 781 finished with value: 0.2398121843656146 and parameters: {'n_estimators': 1062, 'learning_rate': 0.09899127897452072, 'max_depth': 11, 'min_samples_split': 17, 'min_samples_leaf': 2, 'subsample': 0.7125881542970232, 'max_features': 'sqrt'}. Best is trial 611 with value: 0.2042243937933349.
[I 2024-12-04 12:43:23,167] Trial 805 finished with value: 0.8685500893243953 and parameters: {'n_estimators': 124, 'learning_rate': 0.01300698045033582, 'max_depth': 11, 'min_samples_split': 19, 'min_samples_leaf': 4, 'subsample': 0.8362598911078418, 'max_features': 'log2'}. Best is trial 611 with value: 0.2042243937933349.
[I 2024-12-04 12:43:24,937] Trial 804 finished with value: 0.5264267665544328 and parameters: {'n_estimators': 184, 'learning_rate': 0.04675378575726687, 'max_depth': 7, 'min_samples_split': 14, 'min_samples_leaf': 3, 'subsample': 0.7761398620608297, 'max_features': 'log2'}. Best is trial 611 with value: 0.2042243937933349.
[I 2024-12-04 12:43:29,169] Trial 802 finished with value: 0.3909838285975798 and parameters: {'n_estimators': 395, 'learning_rate': 0.027564625240340115, 'max_depth': 12, 'min_samples_split': 10, 'min_samples_leaf': 7, 'subsample': 0.8372341980538869, 'max_features': 'sqrt'}. Best is trial 611 with value: 0.2042243937933349.
[I 2024-12-04 12:43:29,179] Trial 783 finished with value: 0.21291389659905346 and parameters: {'n_estimators': 1160, 'learning_rate': 0.09413729732330231, 'max_depth': 12, 'min_samples_split': 13, 'min_samples_leaf': 1, 'subsample': 0.6891067599436753, 'max_features': 'sqrt'}. Best is trial 611 with value: 0.2042243937933349.
[I 2024-12-04 12:43:32,638] Trial 784 finished with value: 0.199214954455861 and parameters: {'n_estimators': 1174, 'learning_rate': 0.09644585123395706, 'max_depth': 12, 'min_samples_split': 18, 'min_samples_leaf': 1, 'subsample': 0.6479257667364182, 'max_features': 'sqrt'}. Best is trial 784 with value: 0.199214954455861.
[I 2024-12-04 12:43:32,645] Trial 778 finished with value: 0.23077727220057415 and parameters: {'n_estimators': 1384, 'learning_rate': 0.060979549109389415, 'max_depth': 12, 'min_samples_split': 15, 'min_samples_leaf': 2, 'subsample': 0.6705236766539093, 'max_features': 'sqrt'}. Best is trial 784 with value: 0.199214954455861.
[I 2024-12-04 12:43:33,138] Trial 776 finished with value: 0.22366188423860445 and parameters: {'n_estimators': 1479, 'learning_rate': 0.06643704891747494, 'max_depth': 9, 'min_samples_split': 16, 'min_samples_leaf': 1, 'subsample': 0.6758820236415473, 'max_features': 'sqrt'}. Best is trial 784 with value: 0.199214954455861.
[I 2024-12-04 12:43:36,495] Trial 782 finished with value: 0.21618768878401934 and parameters: {'n_estimators': 1304, 'learning_rate': 0.07868052868814984, 'max_depth': 12, 'min_samples_split': 18, 'min_samples_leaf': 1, 'subsample': 0.6697936710161901, 'max_features': 'sqrt'}. Best is trial 784 with value: 0.199214954455861.
[I 2024-12-04 12:43:36,967] Trial 794 finished with value: 0.3977150270003589 and parameters: {'n_estimators': 745, 'learning_rate': 0.026438388632971682, 'max_depth': 5, 'min_samples_split': 7, 'min_samples_leaf': 9, 'subsample': 0.6132627697100845, 'max_features': None}. Best is trial 784 with value: 0.199214954455861.
[I 2024-12-04 12:43:37,379] Trial 777 finished with value: 0.2215837791632818 and parameters: {'n_estimators': 1491, 'learning_rate': 0.05420064823807207, 'max_depth': 12, 'min_samples_split': 18, 'min_samples_leaf': 1, 'subsample': 0.6707706112442859, 'max_features': 'sqrt'}. Best is trial 784 with value: 0.199214954455861.
[I 2024-12-04 12:43:38,564] Trial 779 finished with value: 0.2407566543170674 and parameters: {'n_estimators': 1457, 'learning_rate': 0.054811334937895424, 'max_depth': 11, 'min_samples_split': 16, 'min_samples_leaf': 1, 'subsample': 0.6239373133908636, 'max_features': 'sqrt'}. Best is trial 784 with value: 0.199214954455861.
[I 2024-12-04 12:43:47,528] Trial 780 finished with value: 0.2207671832300255 and parameters: {'n_estimators': 1465, 'learning_rate': 0.05984566095029237, 'max_depth': 12, 'min_samples_split': 15, 'min_samples_leaf': 1, 'subsample': 0.6599083318486016, 'max_features': 'sqrt'}. Best is trial 784 with value: 0.199214954455861.
[I 2024-12-04 12:43:48,549] Trial 785 finished with value: 0.2215162004333792 and parameters: {'n_estimators': 1390, 'learning_rate': 0.09906170578893556, 'max_depth': 12, 'min_samples_split': 14, 'min_samples_leaf': 1, 'subsample': 0.6875866444627632, 'max_features': 'sqrt'}. Best is trial 784 with value: 0.199214954455861.
[I 2024-12-04 12:43:49,016] Trial 789 finished with value: 0.2550419700972841 and parameters: {'n_estimators': 1289, 'learning_rate': 0.0799729067179503, 'max_depth': 12, 'min_samples_split': 14, 'min_samples_leaf': 3, 'subsample': 0.6549992119140555, 'max_features': 'sqrt'}. Best is trial 784 with value: 0.199214954455861.
[I 2024-12-04 12:43:53,761] Trial 790 finished with value: 0.2352146134512049 and parameters: {'n_estimators': 1252, 'learning_rate': 0.05688770699723245, 'max_depth': 11, 'min_samples_split': 20, 'min_samples_leaf': 1, 'subsample': 0.7102946214382824, 'max_features': 'sqrt'}. Best is trial 784 with value: 0.199214954455861.
[I 2024-12-04 12:43:55,080] Trial 786 finished with value: 0.22321991079702122 and parameters: {'n_estimators': 1480, 'learning_rate': 0.09501245268224855, 'max_depth': 11, 'min_samples_split': 11, 'min_samples_leaf': 1, 'subsample': 0.669888738081095, 'max_features': 'sqrt'}. Best is trial 784 with value: 0.199214954455861.
[I 2024-12-04 12:43:55,125] Trial 787 finished with value: 0.23178136542738756 and parameters: {'n_estimators': 1439, 'learning_rate': 0.09992729706506287, 'max_depth': 9, 'min_samples_split': 17, 'min_samples_leaf': 1, 'subsample': 0.7399710223369155, 'max_features': 'sqrt'}. Best is trial 784 with value: 0.199214954455861.
[I 2024-12-04 12:44:00,188] Trial 817 finished with value: 0.634328938019999 and parameters: {'n_estimators': 240, 'learning_rate': 0.057644897158935796, 'max_depth': 12, 'min_samples_split': 15, 'min_samples_leaf': 7, 'subsample': 0.8126575416526954, 'max_features': 'log2'}. Best is trial 784 with value: 0.199214954455861.
[I 2024-12-04 12:44:00,606] Trial 798 finished with value: 0.2960034656202749 and parameters: {'n_estimators': 1057, 'learning_rate': 0.05743416720634741, 'max_depth': 3, 'min_samples_split': 12, 'min_samples_leaf': 4, 'subsample': 0.6555687656661894, 'max_features': None}. Best is trial 784 with value: 0.199214954455861.
[I 2024-12-04 12:44:00,619] Trial 791 finished with value: 0.22752984684521002 and parameters: {'n_estimators': 1340, 'learning_rate': 0.06569128388608676, 'max_depth': 11, 'min_samples_split': 16, 'min_samples_leaf': 2, 'subsample': 0.6973175903250433, 'max_features': 'sqrt'}. Best is trial 784 with value: 0.199214954455861.
[I 2024-12-04 12:44:02,516] Trial 792 finished with value: 0.21726886250098285 and parameters: {'n_estimators': 1312, 'learning_rate': 0.09639241326249587, 'max_depth': 12, 'min_samples_split': 16, 'min_samples_leaf': 1, 'subsample': 0.7405365781693176, 'max_features': 'sqrt'}. Best is trial 784 with value: 0.199214954455861.
[I 2024-12-04 12:44:07,792] Trial 800 finished with value: 0.21334605787768193 and parameters: {'n_estimators': 1089, 'learning_rate': 0.08790668475073107, 'max_depth': 11, 'min_samples_split': 15, 'min_samples_leaf': 1, 'subsample': 0.6128011975361186, 'max_features': 'sqrt'}. Best is trial 784 with value: 0.199214954455861.
[I 2024-12-04 12:44:07,810] Trial 803 finished with value: 0.3378152104660795 and parameters: {'n_estimators': 929, 'learning_rate': 0.024948566128308137, 'max_depth': 10, 'min_samples_split': 4, 'min_samples_leaf': 6, 'subsample': 0.6237691686253278, 'max_features': None}. Best is trial 784 with value: 0.199214954455861.
