[I 2024-12-04 12:24:22,058] Trial 325 finished with value: 0.2522116934702228 and parameters: {'n_estimators': 1390, 'learning_rate': 0.053790124906461394, 'max_depth': 5, 'min_samples_split': 6, 'min_samples_leaf': 1, 'subsample': 0.9281500601223683, 'max_features': 'sqrt'}. Best is trial 300 with value: 0.23199682095001278.
[I 2024-12-04 12:24:25,353] Trial 349 finished with value: 0.3586347445018066 and parameters: {'n_estimators': 426, 'learning_rate': 0.04357426929295367, 'max_depth': 5, 'min_samples_split': 2, 'min_samples_leaf': 1, 'subsample': 0.7504794848345874, 'max_features': 'sqrt'}. Best is trial 300 with value: 0.23199682095001278.
[I 2024-12-04 12:24:30,833] Trial 335 finished with value: 0.2582393205282286 and parameters: {'n_estimators': 1135, 'learning_rate': 0.0518148418070342, 'max_depth': 7, 'min_samples_split': 4, 'min_samples_leaf': 1, 'subsample': 0.8084509104127858, 'max_features': 'sqrt'}. Best is trial 300 with value: 0.23199682095001278.
[I 2024-12-04 12:24:32,474] Trial 351 finished with value: 0.5104639011868083 and parameters: {'n_estimators': 540, 'learning_rate': 0.04408809716464963, 'max_depth': 7, 'min_samples_split': 5, 'min_samples_leaf': 9, 'subsample': 0.7605963803909322, 'max_features': 'sqrt'}. Best is trial 300 with value: 0.23199682095001278.
[I 2024-12-04 12:24:35,015] Trial 330 finished with value: 0.25346266836823395 and parameters: {'n_estimators': 1469, 'learning_rate': 0.02651285296478695, 'max_depth': 6, 'min_samples_split': 3, 'min_samples_leaf': 1, 'subsample': 0.7816063331656725, 'max_features': 'sqrt'}. Best is trial 300 with value: 0.23199682095001278.
[I 2024-12-04 12:24:36,618] Trial 329 finished with value: 0.26965071395099455 and parameters: {'n_estimators': 1478, 'learning_rate': 0.02977472812850327, 'max_depth': 11, 'min_samples_split': 2, 'min_samples_leaf': 1, 'subsample': 0.7241073170300008, 'max_features': 'sqrt'}. Best is trial 300 with value: 0.23199682095001278.
[I 2024-12-04 12:24:37,199] Trial 332 finished with value: 0.23275220205769628 and parameters: {'n_estimators': 1362, 'learning_rate': 0.06370769890961303, 'max_depth': 10, 'min_samples_split': 5, 'min_samples_leaf': 1, 'subsample': 0.7240919516456439, 'max_features': 'sqrt'}. Best is trial 300 with value: 0.23199682095001278.
[I 2024-12-04 12:24:39,910] Trial 342 finished with value: 0.35926746424427186 and parameters: {'n_estimators': 997, 'learning_rate': 0.05381102309227192, 'max_depth': 9, 'min_samples_split': 2, 'min_samples_leaf': 3, 'subsample': 0.7967369500502821, 'max_features': 'sqrt'}. Best is trial 300 with value: 0.23199682095001278.
[I 2024-12-04 12:24:41,136] Trial 333 finished with value: 0.2624565084922486 and parameters: {'n_estimators': 1401, 'learning_rate': 0.051777037681425504, 'max_depth': 8, 'min_samples_split': 8, 'min_samples_leaf': 1, 'subsample': 0.9048111281832129, 'max_features': 'sqrt'}. Best is trial 300 with value: 0.23199682095001278.
[I 2024-12-04 12:24:44,640] Trial 338 finished with value: 0.2409888756508538 and parameters: {'n_estimators': 1272, 'learning_rate': 0.05250394803894972, 'max_depth': 8, 'min_samples_split': 2, 'min_samples_leaf': 1, 'subsample': 0.8239093080622256, 'max_features': 'sqrt'}. Best is trial 300 with value: 0.23199682095001278.
[I 2024-12-04 12:24:47,816] Trial 340 finished with value: 0.2789337911792446 and parameters: {'n_estimators': 1253, 'learning_rate': 0.03929378088574323, 'max_depth': 7, 'min_samples_split': 4, 'min_samples_leaf': 1, 'subsample': 0.8963162281139723, 'max_features': 'sqrt'}. Best is trial 300 with value: 0.23199682095001278.
[I 2024-12-04 12:24:49,610] Trial 361 finished with value: 0.2466886529729782 and parameters: {'n_estimators': 589, 'learning_rate': 0.05489114979455429, 'max_depth': 8, 'min_samples_split': 4, 'min_samples_leaf': 1, 'subsample': 0.6923502881508234, 'max_features': 'sqrt'}. Best is trial 300 with value: 0.23199682095001278.
[I 2024-12-04 12:24:52,286] Trial 358 finished with value: 0.42025487997227773 and parameters: {'n_estimators': 771, 'learning_rate': 0.05224564806367331, 'max_depth': 9, 'min_samples_split': 20, 'min_samples_leaf': 8, 'subsample': 0.9602996296608216, 'max_features': 'sqrt'}. Best is trial 300 with value: 0.23199682095001278.
[I 2024-12-04 12:24:53,652] Trial 355 finished with value: 0.5185800800221809 and parameters: {'n_estimators': 884, 'learning_rate': 0.0824634797346381, 'max_depth': 11, 'min_samples_split': 15, 'min_samples_leaf': 9, 'subsample': 0.9869487610867717, 'max_features': 'log2'}. Best is trial 300 with value: 0.23199682095001278.
[I 2024-12-04 12:24:53,670] Trial 345 finished with value: 0.24675477883120667 and parameters: {'n_estimators': 1226, 'learning_rate': 0.04657129498897209, 'max_depth': 9, 'min_samples_split': 7, 'min_samples_leaf': 1, 'subsample': 0.8653954107501274, 'max_features': 'sqrt'}. Best is trial 300 with value: 0.23199682095001278.
[I 2024-12-04 12:24:56,094] Trial 364 finished with value: 0.255759208305384 and parameters: {'n_estimators': 627, 'learning_rate': 0.07386897912287536, 'max_depth': 8, 'min_samples_split': 4, 'min_samples_leaf': 1, 'subsample': 0.8044706306149773, 'max_features': 'sqrt'}. Best is trial 300 with value: 0.23199682095001278.
[I 2024-12-04 12:24:58,301] Trial 339 finished with value: 0.28060249455200387 and parameters: {'n_estimators': 1484, 'learning_rate': 0.08479914973651935, 'max_depth': 8, 'min_samples_split': 3, 'min_samples_leaf': 2, 'subsample': 0.7917731027033246, 'max_features': 'sqrt'}. Best is trial 300 with value: 0.23199682095001278.
[I 2024-12-04 12:25:01,146] Trial 341 finished with value: 0.23769881444450375 and parameters: {'n_estimators': 1484, 'learning_rate': 0.04281768007146685, 'max_depth': 9, 'min_samples_split': 2, 'min_samples_leaf': 1, 'subsample': 0.8090356622626723, 'max_features': 'sqrt'}. Best is trial 300 with value: 0.23199682095001278.
[I 2024-12-04 12:25:02,274] Trial 362 finished with value: 0.2886975799211248 and parameters: {'n_estimators': 729, 'learning_rate': 0.06105937256531761, 'max_depth': 11, 'min_samples_split': 4, 'min_samples_leaf': 1, 'subsample': 0.7975182290621705, 'max_features': 'log2'}. Best is trial 300 with value: 0.23199682095001278.
[I 2024-12-04 12:25:02,295] Trial 347 finished with value: 0.26475028841933324 and parameters: {'n_estimators': 1352, 'learning_rate': 0.04088325923519913, 'max_depth': 6, 'min_samples_split': 7, 'min_samples_leaf': 1, 'subsample': 0.9520315901223293, 'max_features': 'sqrt'}. Best is trial 300 with value: 0.23199682095001278.
[I 2024-12-04 12:25:04,521] Trial 363 finished with value: 0.29223492527516026 and parameters: {'n_estimators': 793, 'learning_rate': 0.08569755895325298, 'max_depth': 8, 'min_samples_split': 2, 'min_samples_leaf': 2, 'subsample': 0.7936218815349002, 'max_features': 'sqrt'}. Best is trial 300 with value: 0.23199682095001278.
[I 2024-12-04 12:25:04,592] Trial 353 finished with value: 0.29283749625343963 and parameters: {'n_estimators': 1152, 'learning_rate': 0.06466936185003572, 'max_depth': 6, 'min_samples_split': 4, 'min_samples_leaf': 1, 'subsample': 0.819648636421832, 'max_features': 'log2'}. Best is trial 300 with value: 0.23199682095001278.
[I 2024-12-04 12:25:09,935] Trial 348 finished with value: 0.30392069609043443 and parameters: {'n_estimators': 1470, 'learning_rate': 0.09036179094379049, 'max_depth': 6, 'min_samples_split': 5, 'min_samples_leaf': 2, 'subsample': 0.6185361771413148, 'max_features': 'sqrt'}. Best is trial 300 with value: 0.23199682095001278.
[I 2024-12-04 12:25:11,332] Trial 354 finished with value: 0.2412949213194055 and parameters: {'n_estimators': 1244, 'learning_rate': 0.0648081486265954, 'max_depth': 7, 'min_samples_split': 2, 'min_samples_leaf': 1, 'subsample': 0.7833041513662076, 'max_features': 'sqrt'}. Best is trial 300 with value: 0.23199682095001278.
[I 2024-12-04 12:25:11,341] Trial 350 finished with value: 0.3063243290373827 and parameters: {'n_estimators': 1472, 'learning_rate': 0.07347016062777922, 'max_depth': 5, 'min_samples_split': 7, 'min_samples_leaf': 2, 'subsample': 0.967921946945089, 'max_features': 'log2'}. Best is trial 300 with value: 0.23199682095001278.
[I 2024-12-04 12:25:12,860] Trial 359 finished with value: 0.3010613612311206 and parameters: {'n_estimators': 1144, 'learning_rate': 0.06157460190331689, 'max_depth': 8, 'min_samples_split': 2, 'min_samples_leaf': 2, 'subsample': 0.9470681581767322, 'max_features': 'sqrt'}. Best is trial 300 with value: 0.23199682095001278.
[I 2024-12-04 12:25:16,468] Trial 357 finished with value: 0.29972289590891443 and parameters: {'n_estimators': 1230, 'learning_rate': 0.045953160814935536, 'max_depth': 11, 'min_samples_split': 4, 'min_samples_leaf': 2, 'subsample': 0.6130782480095989, 'max_features': 'sqrt'}. Best is trial 300 with value: 0.23199682095001278.
[I 2024-12-04 12:25:19,673] Trial 352 finished with value: 0.2814320768358534 and parameters: {'n_estimators': 1469, 'learning_rate': 0.038982387571194106, 'max_depth': 7, 'min_samples_split': 4, 'min_samples_leaf': 2, 'subsample': 0.9028105176948596, 'max_features': 'sqrt'}. Best is trial 300 with value: 0.23199682095001278.
[I 2024-12-04 12:25:21,307] Trial 360 finished with value: 0.2288165351387474 and parameters: {'n_estimators': 1273, 'learning_rate': 0.07489578337288552, 'max_depth': 8, 'min_samples_split': 6, 'min_samples_leaf': 1, 'subsample': 0.6777235980620597, 'max_features': 'sqrt'}. Best is trial 360 with value: 0.2288165351387474.
[I 2024-12-04 12:25:21,385] Trial 378 finished with value: 0.2467768420903923 and parameters: {'n_estimators': 608, 'learning_rate': 0.06960263462601353, 'max_depth': 9, 'min_samples_split': 3, 'min_samples_leaf': 1, 'subsample': 0.7367986322193508, 'max_features': 'sqrt'}. Best is trial 360 with value: 0.2288165351387474.
[I 2024-12-04 12:25:23,071] Trial 356 finished with value: 0.24324739864161157 and parameters: {'n_estimators': 1467, 'learning_rate': 0.059354918053135614, 'max_depth': 7, 'min_samples_split': 2, 'min_samples_leaf': 1, 'subsample': 0.7031919197566378, 'max_features': 'sqrt'}. Best is trial 360 with value: 0.2288165351387474.
[I 2024-12-04 12:25:26,272] Trial 369 finished with value: 0.24348121931449962 and parameters: {'n_estimators': 1066, 'learning_rate': 0.039374614310449293, 'max_depth': 9, 'min_samples_split': 2, 'min_samples_leaf': 1, 'subsample': 0.7846397668510056, 'max_features': 'sqrt'}. Best is trial 360 with value: 0.2288165351387474.
[I 2024-12-04 12:25:27,620] Trial 383 finished with value: 1.1455614150867153 and parameters: {'n_estimators': 550, 'learning_rate': 0.011127329499800097, 'max_depth': 12, 'min_samples_split': 5, 'min_samples_leaf': 9, 'subsample': 0.7678752894291864, 'max_features': 'log2'}. Best is trial 360 with value: 0.2288165351387474.
[I 2024-12-04 12:25:31,279] Trial 366 finished with value: 0.2506367949618106 and parameters: {'n_estimators': 1298, 'learning_rate': 0.07536709246478747, 'max_depth': 4, 'min_samples_split': 3, 'min_samples_leaf': 1, 'subsample': 0.8454341672872941, 'max_features': 'sqrt'}. Best is trial 360 with value: 0.2288165351387474.
[I 2024-12-04 12:25:33,946] Trial 381 finished with value: 0.2686994816139252 and parameters: {'n_estimators': 730, 'learning_rate': 0.06138845197614055, 'max_depth': 7, 'min_samples_split': 2, 'min_samples_leaf': 1, 'subsample': 0.7180719784832091, 'max_features': 'sqrt'}. Best is trial 360 with value: 0.2288165351387474.
[I 2024-12-04 12:25:36,734] Trial 388 finished with value: 0.3086958787459125 and parameters: {'n_estimators': 570, 'learning_rate': 0.03985136528518353, 'max_depth': 8, 'min_samples_split': 4, 'min_samples_leaf': 2, 'subsample': 0.8202027191045863, 'max_features': 'sqrt'}. Best is trial 360 with value: 0.2288165351387474.
[I 2024-12-04 12:25:37,089] Trial 371 finished with value: 0.3014083788319737 and parameters: {'n_estimators': 1217, 'learning_rate': 0.07280952465565957, 'max_depth': 7, 'min_samples_split': 2, 'min_samples_leaf': 2, 'subsample': 0.6386233555114587, 'max_features': 'sqrt'}. Best is trial 360 with value: 0.2288165351387474.
[I 2024-12-04 12:25:38,258] Trial 365 finished with value: 0.29992739124121903 and parameters: {'n_estimators': 1385, 'learning_rate': 0.0782514633819046, 'max_depth': 5, 'min_samples_split': 6, 'min_samples_leaf': 1, 'subsample': 0.6367275375012337, 'max_features': None}. Best is trial 360 with value: 0.2288165351387474.
[I 2024-12-04 12:25:41,509] Trial 367 finished with value: 0.2898314868994374 and parameters: {'n_estimators': 1472, 'learning_rate': 0.049936539373261625, 'max_depth': 8, 'min_samples_split': 3, 'min_samples_leaf': 2, 'subsample': 0.8654736722889033, 'max_features': 'sqrt'}. Best is trial 360 with value: 0.2288165351387474.
[I 2024-12-04 12:25:41,594] Trial 377 finished with value: 0.264928203808739 and parameters: {'n_estimators': 1032, 'learning_rate': 0.09498678700671218, 'max_depth': 10, 'min_samples_split': 2, 'min_samples_leaf': 1, 'subsample': 0.7838723992137178, 'max_features': 'sqrt'}. Best is trial 360 with value: 0.2288165351387474.
[I 2024-12-04 12:25:43,489] Trial 374 finished with value: 0.2598264306691714 and parameters: {'n_estimators': 1224, 'learning_rate': 0.05019743243595342, 'max_depth': 10, 'min_samples_split': 3, 'min_samples_leaf': 1, 'subsample': 0.8604753188390365, 'max_features': 'sqrt'}. Best is trial 360 with value: 0.2288165351387474.
[I 2024-12-04 12:25:46,526] Trial 370 finished with value: 0.2661480478327693 and parameters: {'n_estimators': 1466, 'learning_rate': 0.059040099631600534, 'max_depth': 4, 'min_samples_split': 7, 'min_samples_leaf': 1, 'subsample': 0.9156807067140336, 'max_features': 'sqrt'}. Best is trial 360 with value: 0.2288165351387474.
[I 2024-12-04 12:25:46,554] Trial 372 finished with value: 0.2865212622603926 and parameters: {'n_estimators': 1339, 'learning_rate': 0.06711818218780566, 'max_depth': 11, 'min_samples_split': 3, 'min_samples_leaf': 2, 'subsample': 0.7966511942256504, 'max_features': 'sqrt'}. Best is trial 360 with value: 0.2288165351387474.
[I 2024-12-04 12:25:47,801] Trial 368 finished with value: 0.4004006849946972 and parameters: {'n_estimators': 1441, 'learning_rate': 0.08513314409567174, 'max_depth': 8, 'min_samples_split': 3, 'min_samples_leaf': 3, 'subsample': 0.8351253325216454, 'max_features': None}. Best is trial 360 with value: 0.2288165351387474.
[I 2024-12-04 12:25:48,508] Trial 373 finished with value: 0.2770127191960531 and parameters: {'n_estimators': 1345, 'learning_rate': 0.054520761050887066, 'max_depth': 10, 'min_samples_split': 3, 'min_samples_leaf': 2, 'subsample': 0.7832550770451895, 'max_features': 'sqrt'}. Best is trial 360 with value: 0.2288165351387474.
[I 2024-12-04 12:25:48,782] Trial 384 finished with value: 0.41895129212125587 and parameters: {'n_estimators': 856, 'learning_rate': 0.014406756723149727, 'max_depth': 3, 'min_samples_split': 17, 'min_samples_leaf': 4, 'subsample': 0.8183897252170977, 'max_features': None}. Best is trial 360 with value: 0.2288165351387474.
[I 2024-12-04 12:25:52,705] Trial 375 finished with value: 0.3852961836186863 and parameters: {'n_estimators': 1400, 'learning_rate': 0.07919398254455978, 'max_depth': 3, 'min_samples_split': 14, 'min_samples_leaf': 6, 'subsample': 0.708200171473226, 'max_features': 'sqrt'}. Best is trial 360 with value: 0.2288165351387474.
[I 2024-12-04 12:25:54,524] Trial 395 finished with value: 0.27903811505106313 and parameters: {'n_estimators': 541, 'learning_rate': 0.062084355847097046, 'max_depth': 10, 'min_samples_split': 4, 'min_samples_leaf': 1, 'subsample': 0.7050826768139974, 'max_features': 'sqrt'}. Best is trial 360 with value: 0.2288165351387474.
[I 2024-12-04 12:25:55,745] Trial 380 finished with value: 0.2903492122781782 and parameters: {'n_estimators': 1118, 'learning_rate': 0.03810684139187432, 'max_depth': 10, 'min_samples_split': 6, 'min_samples_leaf': 2, 'subsample': 0.8540177016833017, 'max_features': 'sqrt'}. Best is trial 360 with value: 0.2288165351387474.
[I 2024-12-04 12:25:56,963] Trial 382 finished with value: 0.29337393302934006 and parameters: {'n_estimators': 1129, 'learning_rate': 0.05252871068067425, 'max_depth': 8, 'min_samples_split': 5, 'min_samples_leaf': 2, 'subsample': 0.8499065329261166, 'max_features': 'sqrt'}. Best is trial 360 with value: 0.2288165351387474.
[I 2024-12-04 12:25:59,171] Trial 376 finished with value: 0.39307451451585573 and parameters: {'n_estimators': 1498, 'learning_rate': 0.08759656700701789, 'max_depth': 11, 'min_samples_split': 2, 'min_samples_leaf': 5, 'subsample': 0.6679253780881793, 'max_features': 'log2'}. Best is trial 360 with value: 0.2288165351387474.
[I 2024-12-04 12:26:04,057] Trial 379 finished with value: 0.2429495766997766 and parameters: {'n_estimators': 1386, 'learning_rate': 0.06246159253586516, 'max_depth': 12, 'min_samples_split': 4, 'min_samples_leaf': 1, 'subsample': 0.7182382387694632, 'max_features': 'sqrt'}. Best is trial 360 with value: 0.2288165351387474.
[I 2024-12-04 12:26:04,894] Trial 385 finished with value: 0.2702397040014089 and parameters: {'n_estimators': 1149, 'learning_rate': 0.03861639199349454, 'max_depth': 9, 'min_samples_split': 2, 'min_samples_leaf': 1, 'subsample': 0.8492340193981556, 'max_features': 'sqrt'}. Best is trial 360 with value: 0.2288165351387474.
[I 2024-12-04 12:26:04,900] Trial 396 finished with value: 0.28912311911301497 and parameters: {'n_estimators': 780, 'learning_rate': 0.06646459721122627, 'max_depth': 9, 'min_samples_split': 3, 'min_samples_leaf': 2, 'subsample': 0.7165088475102175, 'max_features': 'sqrt'}. Best is trial 360 with value: 0.2288165351387474.
[I 2024-12-04 12:26:08,704] Trial 390 finished with value: 0.41369452641327925 and parameters: {'n_estimators': 980, 'learning_rate': 0.04618671799599038, 'max_depth': 8, 'min_samples_split': 2, 'min_samples_leaf': 3, 'subsample': 0.730955206106136, 'max_features': None}. Best is trial 360 with value: 0.2288165351387474.
[I 2024-12-04 12:26:11,857] Trial 404 finished with value: 0.8904285744319864 and parameters: {'n_estimators': 574, 'learning_rate': 0.010851222318812012, 'max_depth': 9, 'min_samples_split': 3, 'min_samples_leaf': 8, 'subsample': 0.6696567402534928, 'max_features': 'sqrt'}. Best is trial 360 with value: 0.2288165351387474.
[I 2024-12-04 12:26:12,696] Trial 406 finished with value: 0.26093850378141786 and parameters: {'n_estimators': 493, 'learning_rate': 0.06639580648745552, 'max_depth': 10, 'min_samples_split': 3, 'min_samples_leaf': 1, 'subsample': 0.7823247245134484, 'max_features': 'sqrt'}. Best is trial 360 with value: 0.2288165351387474.
[I 2024-12-04 12:26:15,520] Trial 393 finished with value: 0.28341473542029794 and parameters: {'n_estimators': 1111, 'learning_rate': 0.0636851224124461, 'max_depth': 7, 'min_samples_split': 5, 'min_samples_leaf': 2, 'subsample': 0.7991769533655796, 'max_features': 'sqrt'}. Best is trial 360 with value: 0.2288165351387474.
[I 2024-12-04 12:26:15,594] Trial 389 finished with value: 0.3273586469168793 and parameters: {'n_estimators': 1265, 'learning_rate': 0.03938870636400444, 'max_depth': 8, 'min_samples_split': 3, 'min_samples_leaf': 2, 'subsample': 0.867606590217864, 'max_features': 'log2'}. Best is trial 360 with value: 0.2288165351387474.
[I 2024-12-04 12:26:19,225] Trial 411 finished with value: 0.30696305632582593 and parameters: {'n_estimators': 439, 'learning_rate': 0.051773259624727605, 'max_depth': 8, 'min_samples_split': 3, 'min_samples_leaf': 2, 'subsample': 0.7290820887306743, 'max_features': 'sqrt'}. Best is trial 360 with value: 0.2288165351387474.
[I 2024-12-04 12:26:20,583] Trial 386 finished with value: 0.2872893460623196 and parameters: {'n_estimators': 1411, 'learning_rate': 0.03978005183918023, 'max_depth': 10, 'min_samples_split': 4, 'min_samples_leaf': 2, 'subsample': 0.7686840709186369, 'max_features': 'sqrt'}. Best is trial 360 with value: 0.2288165351387474.
[I 2024-12-04 12:26:21,315] Trial 407 finished with value: 0.5535397883126832 and parameters: {'n_estimators': 636, 'learning_rate': 0.019124720027060477, 'max_depth': 12, 'min_samples_split': 9, 'min_samples_leaf': 9, 'subsample': 0.9911567986703863, 'max_features': 'sqrt'}. Best is trial 360 with value: 0.2288165351387474.
[I 2024-12-04 12:26:23,756] Trial 387 finished with value: 0.2552630026536107 and parameters: {'n_estimators': 1437, 'learning_rate': 0.04732545665621875, 'max_depth': 8, 'min_samples_split': 2, 'min_samples_leaf': 1, 'subsample': 0.8164905728571207, 'max_features': 'sqrt'}. Best is trial 360 with value: 0.2288165351387474.
[I 2024-12-04 12:26:27,325] Trial 403 finished with value: 0.2518413505343653 and parameters: {'n_estimators': 844, 'learning_rate': 0.06694251611500733, 'max_depth': 7, 'min_samples_split': 6, 'min_samples_leaf': 1, 'subsample': 0.7516849926628375, 'max_features': 'sqrt'}. Best is trial 360 with value: 0.2288165351387474.
[I 2024-12-04 12:26:28,839] Trial 394 finished with value: 0.33937025458935144 and parameters: {'n_estimators': 1260, 'learning_rate': 0.06298282387158845, 'max_depth': 8, 'min_samples_split': 2, 'min_samples_leaf': 3, 'subsample': 0.8276613039711549, 'max_features': 'sqrt'}. Best is trial 360 with value: 0.2288165351387474.
[I 2024-12-04 12:26:29,927] Trial 399 finished with value: 0.3517688014162935 and parameters: {'n_estimators': 1114, 'learning_rate': 0.08521939686431979, 'max_depth': 5, 'min_samples_split': 5, 'min_samples_leaf': 3, 'subsample': 0.603450772778414, 'max_features': 'sqrt'}. Best is trial 360 with value: 0.2288165351387474.
[I 2024-12-04 12:26:31,549] Trial 397 finished with value: 0.3515615037214805 and parameters: {'n_estimators': 1212, 'learning_rate': 0.08756173264051936, 'max_depth': 8, 'min_samples_split': 8, 'min_samples_leaf': 3, 'subsample': 0.6917260784276739, 'max_features': 'sqrt'}. Best is trial 360 with value: 0.2288165351387474.
