[I 2024-12-03 18:45:34,794] Trial 329 finished with value: 0.13561041320067468 and parameters: {'kernel': 'linear', 'C': 70.57503356198865, 'gamma': 0.08632083956815734, 'epsilon': 0.03391688405981299}. Best is trial 345 with value: 0.13438257115663557.
[I 2024-12-03 18:45:34,892] Trial 362 finished with value: 0.13515079977832928 and parameters: {'kernel': 'linear', 'C': 48.351158272418985, 'gamma': 0.041954957145952265, 'epsilon': 0.056844394176921186}. Best is trial 345 with value: 0.13438257115663557.
[I 2024-12-03 18:45:35,327] Trial 417 finished with value: 0.13979696009196713 and parameters: {'kernel': 'linear', 'C': 17.852519843761925, 'gamma': 0.032000785131260964, 'epsilon': 0.08739635236767797}. Best is trial 345 with value: 0.13438257115663557.
[I 2024-12-03 18:45:35,945] Trial 421 finished with value: 0.437931483297744 and parameters: {'kernel': 'linear', 'C': 39.38542133255629, 'gamma': 0.002801828977463935, 'epsilon': 0.8349268255858858}. Best is trial 345 with value: 0.13438257115663557.
[I 2024-12-03 18:45:37,361] Trial 342 finished with value: 0.13573278925949925 and parameters: {'kernel': 'linear', 'C': 64.1078424589092, 'gamma': 0.011423294053373294, 'epsilon': 0.03698279107630674}. Best is trial 345 with value: 0.13438257115663557.
[I 2024-12-03 18:45:37,615] Trial 425 finished with value: 1296.3450568102844 and parameters: {'kernel': 'sigmoid', 'C': 81.08314259153065, 'gamma': 0.042484469543856436, 'epsilon': 0.1496245116461775}. Best is trial 345 with value: 0.13438257115663557.
[I 2024-12-03 18:45:38,428] Trial 422 finished with value: 0.14907074078520513 and parameters: {'kernel': 'linear', 'C': 8.856545723754445, 'gamma': 0.001763522629348173, 'epsilon': 0.1332410884507696}. Best is trial 345 with value: 0.13438257115663557.
[I 2024-12-03 18:45:38,559] Trial 424 finished with value: 0.19653392803629663 and parameters: {'kernel': 'linear', 'C': 42.67896156663034, 'gamma': 0.016665549582816033, 'epsilon': 0.2513194034846251}. Best is trial 345 with value: 0.13438257115663557.
[I 2024-12-03 18:45:39,479] Trial 415 finished with value: 0.1382889957741294 and parameters: {'kernel': 'linear', 'C': 6.370854344646192, 'gamma': 0.0510646140485946, 'epsilon': 0.014586591467574354}. Best is trial 345 with value: 0.13438257115663557.
[I 2024-12-03 18:45:40,091] Trial 431 finished with value: 3.275689763536567 and parameters: {'kernel': 'sigmoid', 'C': 0.17632692145061718, 'gamma': 0.03505558468035785, 'epsilon': 0.0014278492352189673}. Best is trial 345 with value: 0.13438257115663557.
[I 2024-12-03 18:45:40,153] Trial 429 finished with value: 0.30831344104068326 and parameters: {'kernel': 'rbf', 'C': 41.93490900603006, 'gamma': 0.049980157807856036, 'epsilon': 0.004012348747113312}. Best is trial 345 with value: 0.13438257115663557.
[I 2024-12-03 18:45:41,419] Trial 434 finished with value: 0.8161211415455205 and parameters: {'kernel': 'poly', 'C': 0.005580169567924308, 'gamma': 0.06643298012496125, 'epsilon': 0.0021106132275635413}. Best is trial 345 with value: 0.13438257115663557.
[I 2024-12-03 18:45:42,045] Trial 426 finished with value: 0.13512157682244194 and parameters: {'kernel': 'linear', 'C': 10.73612275528562, 'gamma': 0.00805912907194217, 'epsilon': 0.061657918400680814}. Best is trial 345 with value: 0.13438257115663557.
[I 2024-12-03 18:45:42,680] Trial 433 finished with value: 0.13936072349663683 and parameters: {'kernel': 'linear', 'C': 5.471727346241917, 'gamma': 0.0003127856260373258, 'epsilon': 0.07747411747941371}. Best is trial 345 with value: 0.13438257115663557.
[I 2024-12-03 18:45:43,219] Trial 432 finished with value: 0.20617754761187274 and parameters: {'kernel': 'linear', 'C': 72.42038703475632, 'gamma': 0.003107005200755543, 'epsilon': 0.2680624579371914}. Best is trial 345 with value: 0.13438257115663557.
[I 2024-12-03 18:45:43,847] Trial 414 finished with value: 0.13851529911393887 and parameters: {'kernel': 'linear', 'C': 6.9384090335313875, 'gamma': 0.013517844648166707, 'epsilon': 0.009074219606351177}. Best is trial 345 with value: 0.13438257115663557.
[I 2024-12-03 18:45:45,549] Trial 398 finished with value: 0.13622501537529377 and parameters: {'kernel': 'linear', 'C': 25.958699209720898, 'gamma': 0.005769502993117989, 'epsilon': 0.02602020848189742}. Best is trial 345 with value: 0.13438257115663557.
[I 2024-12-03 18:45:46,517] Trial 440 finished with value: 0.17096878246075572 and parameters: {'kernel': 'linear', 'C': 0.8313946672884712, 'gamma': 0.012666707928317514, 'epsilon': 0.1314506588067388}. Best is trial 345 with value: 0.13438257115663557.
[I 2024-12-03 18:45:47,058] Trial 372 finished with value: 0.13684139183667948 and parameters: {'kernel': 'linear', 'C': 97.08117957627914, 'gamma': 0.0003464510640353387, 'epsilon': 0.04933279863216073}. Best is trial 345 with value: 0.13438257115663557.
[I 2024-12-03 18:45:47,083] Trial 437 finished with value: 0.140572253468652 and parameters: {'kernel': 'linear', 'C': 8.27361819556637, 'gamma': 0.008572367034986289, 'epsilon': 0.08469810495128549}. Best is trial 345 with value: 0.13438257115663557.
[I 2024-12-03 18:45:47,534] Trial 427 finished with value: 0.13713097415143302 and parameters: {'kernel': 'linear', 'C': 14.357065871733647, 'gamma': 0.003085733968459942, 'epsilon': 0.04847890739116965}. Best is trial 345 with value: 0.13438257115663557.
[I 2024-12-03 18:45:48,075] Trial 441 finished with value: 1.2956452511900645 and parameters: {'kernel': 'rbf', 'C': 0.04131458743032806, 'gamma': 0.5935232989778108, 'epsilon': 0.0032542630453064013}. Best is trial 345 with value: 0.13438257115663557.
[I 2024-12-03 18:45:49,290] Trial 420 finished with value: 0.1351464122296659 and parameters: {'kernel': 'linear', 'C': 36.417356307543116, 'gamma': 0.0011026289598997576, 'epsilon': 0.06362718596304777}. Best is trial 345 with value: 0.13438257115663557.
[I 2024-12-03 18:45:49,291] Trial 439 finished with value: 0.13507368281188648 and parameters: {'kernel': 'linear', 'C': 12.121351886858854, 'gamma': 0.02307817810947781, 'epsilon': 0.06434663393063184}. Best is trial 345 with value: 0.13438257115663557.
[I 2024-12-03 18:45:49,602] Trial 443 finished with value: 0.1538105904277438 and parameters: {'kernel': 'linear', 'C': 8.14340619282766, 'gamma': 0.028142103071834547, 'epsilon': 0.15210919818102756}. Best is trial 345 with value: 0.13438257115663557.
[I 2024-12-03 18:45:49,968] Trial 369 finished with value: 0.13702344232054006 and parameters: {'kernel': 'linear', 'C': 98.21840102930716, 'gamma': 0.025729304199666195, 'epsilon': 0.04481031704366634}. Best is trial 345 with value: 0.13438257115663557.
[I 2024-12-03 18:45:50,805] Trial 442 finished with value: 0.1490061934698972 and parameters: {'kernel': 'linear', 'C': 10.612861213430365, 'gamma': 0.027720475501883196, 'epsilon': 0.13358139534804625}. Best is trial 345 with value: 0.13438257115663557.
[I 2024-12-03 18:45:50,970] Trial 428 finished with value: 0.14182796848328705 and parameters: {'kernel': 'linear', 'C': 66.17514012314909, 'gamma': 0.021205532759097197, 'epsilon': 0.09490383993530446}. Best is trial 345 with value: 0.13438257115663557.
[I 2024-12-03 18:45:51,635] Trial 293 finished with value: 0.13809547598385885 and parameters: {'kernel': 'linear', 'C': 94.61427029430907, 'gamma': 0.1472866899698264, 'epsilon': 0.010091197999953122}. Best is trial 345 with value: 0.13438257115663557.
[I 2024-12-03 18:45:51,975] Trial 449 finished with value: 215.8711334813959 and parameters: {'kernel': 'sigmoid', 'C': 13.338972380473052, 'gamma': 0.04740168228939183, 'epsilon': 0.04684970640919814}. Best is trial 345 with value: 0.13438257115663557.
[I 2024-12-03 18:45:52,046] Trial 375 finished with value: 0.13664332772696375 and parameters: {'kernel': 'linear', 'C': 96.82897521551212, 'gamma': 0.0024621990425643184, 'epsilon': 0.04412640526581166}. Best is trial 345 with value: 0.13438257115663557.
[I 2024-12-03 18:45:52,951] Trial 436 finished with value: 0.14601053482556228 and parameters: {'kernel': 'linear', 'C': 65.23364651511241, 'gamma': 0.06307990278095257, 'epsilon': 0.12946498620732427}. Best is trial 345 with value: 0.13438257115663557.
[I 2024-12-03 18:45:53,599] Trial 453 finished with value: 1.2290775985165887 and parameters: {'kernel': 'poly', 'C': 86.59988391187288, 'gamma': 0.0002539272976547909, 'epsilon': 0.020640298242748684}. Best is trial 345 with value: 0.13438257115663557.
[I 2024-12-03 18:45:53,668] Trial 445 finished with value: 0.1348115105461234 and parameters: {'kernel': 'linear', 'C': 10.661291049193553, 'gamma': 0.0007385576794202424, 'epsilon': 0.06499317274626058}. Best is trial 345 with value: 0.13438257115663557.
[I 2024-12-03 18:45:53,671] Trial 368 finished with value: 0.13492450657727065 and parameters: {'kernel': 'linear', 'C': 71.55892138319028, 'gamma': 0.014939949179749749, 'epsilon': 0.03914130462382041}. Best is trial 345 with value: 0.13438257115663557.
[I 2024-12-03 18:45:54,770] Trial 448 finished with value: 0.13709757721242824 and parameters: {'kernel': 'linear', 'C': 2.6408159204803683, 'gamma': 0.020621646040303438, 'epsilon': 0.02964577414132147}. Best is trial 345 with value: 0.13438257115663557.
[I 2024-12-03 18:45:55,661] Trial 458 finished with value: 1909.7846646354908 and parameters: {'kernel': 'sigmoid', 'C': 87.9741919750296, 'gamma': 0.5152583904642593, 'epsilon': 0.0010330595116030804}. Best is trial 345 with value: 0.13438257115663557.
[I 2024-12-03 18:45:57,576] Trial 459 finished with value: 0.14031920726554875 and parameters: {'kernel': 'linear', 'C': 1.7752104646900384, 'gamma': 0.0009081198952242419, 'epsilon': 0.05932620652901094}. Best is trial 345 with value: 0.13438257115663557.
[I 2024-12-03 18:45:57,781] Trial 457 finished with value: 0.13878502720925773 and parameters: {'kernel': 'linear', 'C': 9.451095507053505, 'gamma': 0.00021597105401291388, 'epsilon': 0.07788669890818488}. Best is trial 345 with value: 0.13438257115663557.
[I 2024-12-03 18:45:58,588] Trial 461 finished with value: 0.27655317168351035 and parameters: {'kernel': 'linear', 'C': 0.9897036645236443, 'gamma': 0.00034842467138527535, 'epsilon': 0.395668925149539}. Best is trial 345 with value: 0.13438257115663557.
[I 2024-12-03 18:45:59,223] Trial 462 finished with value: 0.19877379688762492 and parameters: {'kernel': 'linear', 'C': 2.2028783752597954, 'gamma': 0.0013616937873180165, 'epsilon': 0.21719821536231002}. Best is trial 345 with value: 0.13438257115663557.
[I 2024-12-03 18:46:00,952] Trial 463 finished with value: 0.14017030092882504 and parameters: {'kernel': 'linear', 'C': 1.1303368697215104, 'gamma': 0.005315892103113468, 'epsilon': 0.039918388646318324}. Best is trial 345 with value: 0.13438257115663557.
[I 2024-12-03 18:46:01,942] Trial 452 finished with value: 0.13793433314959963 and parameters: {'kernel': 'linear', 'C': 9.87275474715235, 'gamma': 0.0001730484126327424, 'epsilon': 0.018671418088494273}. Best is trial 345 with value: 0.13438257115663557.
[I 2024-12-03 18:46:02,443] Trial 447 finished with value: 0.1357894365871077 and parameters: {'kernel': 'linear', 'C': 13.606835381299728, 'gamma': 0.00044049329753024455, 'epsilon': 0.05755179030383801}. Best is trial 345 with value: 0.13438257115663557.
[I 2024-12-03 18:46:02,586] Trial 438 finished with value: 0.13809717832801702 and parameters: {'kernel': 'linear', 'C': 93.22879585533036, 'gamma': 0.10794338843049064, 'epsilon': 0.07884593227697297}. Best is trial 345 with value: 0.13438257115663557.
[I 2024-12-03 18:46:03,823] Trial 389 finished with value: 0.13528590628137593 and parameters: {'kernel': 'linear', 'C': 99.91491221026615, 'gamma': 0.008435898144724367, 'epsilon': 0.0650631899447456}. Best is trial 345 with value: 0.13438257115663557.
[I 2024-12-03 18:46:03,844] Trial 465 finished with value: 0.14380499061476895 and parameters: {'kernel': 'linear', 'C': 5.016749345229895, 'gamma': 0.002137926130229948, 'epsilon': 0.08753346146253999}. Best is trial 345 with value: 0.13438257115663557.
[I 2024-12-03 18:46:04,264] Trial 381 finished with value: 0.13811975763830062 and parameters: {'kernel': 'linear', 'C': 49.35014159385671, 'gamma': 0.020147542660580043, 'epsilon': 0.014460447319638385}. Best is trial 345 with value: 0.13438257115663557.
[I 2024-12-03 18:46:04,650] Trial 451 finished with value: 0.13569516486540104 and parameters: {'kernel': 'linear', 'C': 13.384958425950733, 'gamma': 0.018679739300177127, 'epsilon': 0.05800567539478077}. Best is trial 345 with value: 0.13438257115663557.
[I 2024-12-03 18:46:05,945] Trial 339 finished with value: 0.1386813464092527 and parameters: {'kernel': 'linear', 'C': 74.38704918929825, 'gamma': 0.009962475546869168, 'epsilon': 0.010873749300774884}. Best is trial 345 with value: 0.13438257115663557.
[I 2024-12-03 18:46:06,583] Trial 471 finished with value: 0.20577519798542995 and parameters: {'kernel': 'linear', 'C': 12.867264341083398, 'gamma': 0.001116563993040158, 'epsilon': 0.2645028967370553}. Best is trial 345 with value: 0.13438257115663557.
[I 2024-12-03 18:46:07,729] Trial 468 finished with value: 0.14205955551397323 and parameters: {'kernel': 'linear', 'C': 18.480429807379153, 'gamma': 0.0005430029462988161, 'epsilon': 0.09250758061178571}. Best is trial 345 with value: 0.13438257115663557.
[I 2024-12-03 18:46:08,689] Trial 371 finished with value: 0.13619728881507553 and parameters: {'kernel': 'linear', 'C': 72.65800581166728, 'gamma': 0.052371720982851006, 'epsilon': 0.024043281234210418}. Best is trial 345 with value: 0.13438257115663557.
[I 2024-12-03 18:46:09,307] Trial 475 finished with value: 0.14406361611262505 and parameters: {'kernel': 'linear', 'C': 1.3376143211957678, 'gamma': 0.023867806324067434, 'epsilon': 0.06687615060883385}. Best is trial 345 with value: 0.13438257115663557.
[I 2024-12-03 18:46:09,923] Trial 455 finished with value: 0.1359034840813382 and parameters: {'kernel': 'linear', 'C': 13.812256394321398, 'gamma': 0.02702617061544683, 'epsilon': 0.03580721901808783}. Best is trial 345 with value: 0.13438257115663557.
[I 2024-12-03 18:46:09,970] Trial 435 finished with value: 0.13781073863710655 and parameters: {'kernel': 'linear', 'C': 19.769125939129026, 'gamma': 0.0002566710456896293, 'epsilon': 0.005186593025016264}. Best is trial 345 with value: 0.13438257115663557.
[I 2024-12-03 18:46:11,350] Trial 478 finished with value: 0.5963056431962572 and parameters: {'kernel': 'sigmoid', 'C': 41.6604747101483, 'gamma': 0.0008320589348524822, 'epsilon': 0.023774829657185918}. Best is trial 345 with value: 0.13438257115663557.
[I 2024-12-03 18:46:11,537] Trial 446 finished with value: 0.14055153088073874 and parameters: {'kernel': 'linear', 'C': 81.35175190728022, 'gamma': 0.0009462433223368834, 'epsilon': 0.09024153209601413}. Best is trial 345 with value: 0.13438257115663557.
[I 2024-12-03 18:46:12,525] Trial 480 finished with value: 1.3281476358529551 and parameters: {'kernel': 'sigmoid', 'C': 0.003036331547347605, 'gamma': 0.13773532885054054, 'epsilon': 0.008984141169065646}. Best is trial 345 with value: 0.13438257115663557.
[I 2024-12-03 18:46:12,527] Trial 454 finished with value: 0.13657047081051826 and parameters: {'kernel': 'linear', 'C': 35.74017471581999, 'gamma': 0.0016006764492414102, 'epsilon': 0.0437085891573875}. Best is trial 345 with value: 0.13438257115663557.
[I 2024-12-03 18:46:13,438] Trial 477 finished with value: 0.14214981863186948 and parameters: {'kernel': 'linear', 'C': 8.365691596915603, 'gamma': 0.009385272021326675, 'epsilon': 0.09442281974984737}. Best is trial 345 with value: 0.13438257115663557.
[I 2024-12-03 18:46:14,869] Trial 474 finished with value: 0.13664094724909362 and parameters: {'kernel': 'linear', 'C': 8.206076154906704, 'gamma': 0.0011110255641942999, 'epsilon': 0.04469561692112304}. Best is trial 345 with value: 0.13438257115663557.
[I 2024-12-03 18:46:16,046] Trial 485 finished with value: 0.841374161544261 and parameters: {'kernel': 'rbf', 'C': 0.15164684646464438, 'gamma': 0.05691636182509486, 'epsilon': 0.008369721914746235}. Best is trial 345 with value: 0.13438257115663557.
[I 2024-12-03 18:46:16,360] Trial 464 finished with value: 0.1424190761138972 and parameters: {'kernel': 'linear', 'C': 98.86618784985254, 'gamma': 0.002012205189996122, 'epsilon': 0.1162486813065056}. Best is trial 345 with value: 0.13438257115663557.
[I 2024-12-03 18:46:17,483] Trial 456 finished with value: 0.13572416526609876 and parameters: {'kernel': 'linear', 'C': 23.75448791335165, 'gamma': 0.00035167458508575356, 'epsilon': 0.03521822003665946}. Best is trial 345 with value: 0.13438257115663557.
[I 2024-12-03 18:46:18,244] Trial 400 finished with value: 0.13657652641988977 and parameters: {'kernel': 'linear', 'C': 47.614134646296215, 'gamma': 0.017719572487814177, 'epsilon': 0.024358615046330065}. Best is trial 345 with value: 0.13438257115663557.
[I 2024-12-03 18:46:19,280] Trial 373 finished with value: 0.13868126186145682 and parameters: {'kernel': 'linear', 'C': 80.32650496069137, 'gamma': 0.0005035959058635167, 'epsilon': 0.016964757300362586}. Best is trial 345 with value: 0.13438257115663557.
[I 2024-12-03 18:46:19,957] Trial 413 finished with value: 0.136872742511032 and parameters: {'kernel': 'linear', 'C': 85.83420113947551, 'gamma': 0.00825269740653453, 'epsilon': 0.04982757785389022}. Best is trial 345 with value: 0.13438257115663557.
[I 2024-12-03 18:46:20,614] Trial 490 finished with value: 0.22116617065255822 and parameters: {'kernel': 'rbf', 'C': 6.312828051381159, 'gamma': 0.007538186695503067, 'epsilon': 0.017119204696338253}. Best is trial 345 with value: 0.13438257115663557.
[I 2024-12-03 18:46:21,470] Trial 491 finished with value: 0.16146833449575324 and parameters: {'kernel': 'linear', 'C': 8.931484419153543, 'gamma': 0.007253432628050211, 'epsilon': 0.18012590204205442}. Best is trial 345 with value: 0.13438257115663557.
[I 2024-12-03 18:46:21,905] Trial 430 finished with value: 0.13527102811820163 and parameters: {'kernel': 'linear', 'C': 46.630988838374705, 'gamma': 0.000671070172392353, 'epsilon': 0.05819652223844893}. Best is trial 345 with value: 0.13438257115663557.
[I 2024-12-03 18:46:22,278] Trial 466 finished with value: 0.1353217924648156 and parameters: {'kernel': 'linear', 'C': 23.83893766532399, 'gamma': 0.0005285904065255352, 'epsilon': 0.05832285625827281}. Best is trial 345 with value: 0.13438257115663557.
[I 2024-12-03 18:46:22,409] Trial 492 finished with value: 0.18166723722303516 and parameters: {'kernel': 'rbf', 'C': 80.23965080453715, 'gamma': 0.022112523915801808, 'epsilon': 0.027623672016605618}. Best is trial 345 with value: 0.13438257115663557.
[I 2024-12-03 18:46:23,648] Trial 489 finished with value: 0.13569382445730585 and parameters: {'kernel': 'linear', 'C': 7.0822942501544475, 'gamma': 0.02600998689255753, 'epsilon': 0.05230233065215629}. Best is trial 345 with value: 0.13438257115663557.
[I 2024-12-03 18:46:24,548] Trial 493 finished with value: 0.1388987884651347 and parameters: {'kernel': 'linear', 'C': 1.6114855502780845, 'gamma': 0.0011917210299589984, 'epsilon': 0.008101303506737887}. Best is trial 345 with value: 0.13438257115663557.
[I 2024-12-03 18:46:24,906] Trial 495 finished with value: 0.34120476588378235 and parameters: {'kernel': 'poly', 'C': 26.44613582800246, 'gamma': 0.02286965154363874, 'epsilon': 0.05451514900397493}. Best is trial 345 with value: 0.13438257115663557.
[I 2024-12-03 18:46:25,637] Trial 488 finished with value: 0.13514741208227896 and parameters: {'kernel': 'linear', 'C': 15.135771190811107, 'gamma': 0.0013836464429839664, 'epsilon': 0.06426423508586795}. Best is trial 345 with value: 0.13438257115663557.
[I 2024-12-03 18:46:25,638] Trial 484 finished with value: 0.1379517957450782 and parameters: {'kernel': 'linear', 'C': 8.393017983360574, 'gamma': 0.0008380010084879559, 'epsilon': 0.018961363835839306}. Best is trial 345 with value: 0.13438257115663557.
[I 2024-12-03 18:46:26,219] Trial 473 finished with value: 0.13567529277492915 and parameters: {'kernel': 'linear', 'C': 19.86588584651515, 'gamma': 0.006370921619188356, 'epsilon': 0.02696004763181717}. Best is trial 345 with value: 0.13438257115663557.
[I 2024-12-03 18:46:26,537] Trial 499 finished with value: 0.7401011847261688 and parameters: {'kernel': 'rbf', 'C': 95.84666900351701, 'gamma': 0.49484924804906677, 'epsilon': 0.05673131415044258}. Best is trial 345 with value: 0.13438257115663557.
[I 2024-12-03 18:46:26,680] Trial 494 finished with value: 0.136851571777066 and parameters: {'kernel': 'linear', 'C': 3.0052929087969296, 'gamma': 0.004740325531157409, 'epsilon': 0.0313508501483014}. Best is trial 345 with value: 0.13438257115663557.
[I 2024-12-03 18:46:26,864] Trial 486 finished with value: 0.13575835648911158 and parameters: {'kernel': 'linear', 'C': 8.269066247136251, 'gamma': 0.01479573000365628, 'epsilon': 0.03668859465579951}. Best is trial 345 with value: 0.13438257115663557.
[I 2024-12-03 18:46:27,120] Trial 501 finished with value: 0.25272872658031165 and parameters: {'kernel': 'rbf', 'C': 14.048830703526141, 'gamma': 0.0008547740466217458, 'epsilon': 0.06992795841341251}. Best is trial 345 with value: 0.13438257115663557.
[I 2024-12-03 18:46:27,121] Trial 496 finished with value: 0.1399255920894325 and parameters: {'kernel': 'linear', 'C': 19.67838670418243, 'gamma': 0.002993360729622125, 'epsilon': 0.08874710168312225}. Best is trial 345 with value: 0.13438257115663557.
[I 2024-12-03 18:46:28,519] Trial 500 finished with value: 0.15943408242518586 and parameters: {'kernel': 'linear', 'C': 9.018874090682901, 'gamma': 0.0005034531665359113, 'epsilon': 0.17487528878987219}. Best is trial 345 with value: 0.13438257115663557.
[I 2024-12-03 18:46:28,520] Trial 502 finished with value: 0.3932258263083218 and parameters: {'kernel': 'sigmoid', 'C': 14.750990496033486, 'gamma': 0.0003897752504728891, 'epsilon': 0.4152091691804307}. Best is trial 345 with value: 0.13438257115663557.
