[I 2024-12-04 19:41:22,712] Using an existing study with name 'Vc_rf' instead of creating a new one.
[I 2024-12-04 19:42:03,440] Trial 38 finished with value: 0.47791304735290285 and parameters: {'n_estimators': 641, 'max_depth': 35, 'min_samples_split': 5, 'min_samples_leaf': 2, 'max_features': None, 'bootstrap': True, 'criterion': 'absolute_error'}. Best is trial 20 with value: 0.4252751644953182.
[I 2024-12-04 19:42:24,047] Trial 39 finished with value: 0.4910224525610649 and parameters: {'n_estimators': 952, 'max_depth': 26, 'min_samples_split': 4, 'min_samples_leaf': 2, 'max_features': None, 'bootstrap': True, 'criterion': 'absolute_error'}. Best is trial 20 with value: 0.4252751644953182.
[I 2024-12-04 19:42:29,840] Trial 37 finished with value: 0.45096647198726786 and parameters: {'n_estimators': 668, 'max_depth': 26, 'min_samples_split': 5, 'min_samples_leaf': 1, 'max_features': None, 'bootstrap': True, 'criterion': 'absolute_error'}. Best is trial 20 with value: 0.4252751644953182.
[I 2024-12-04 19:42:33,220] Trial 42 finished with value: 0.4451971028320529 and parameters: {'n_estimators': 574, 'max_depth': 26, 'min_samples_split': 4, 'min_samples_leaf': 1, 'max_features': None, 'bootstrap': True, 'criterion': 'squared_error'}. Best is trial 20 with value: 0.4252751644953182.
[I 2024-12-04 19:43:07,975] Trial 41 finished with value: 0.48644882528711114 and parameters: {'n_estimators': 660, 'max_depth': 39, 'min_samples_split': 4, 'min_samples_leaf': 2, 'max_features': None, 'bootstrap': True, 'criterion': 'absolute_error'}. Best is trial 20 with value: 0.4252751644953182.
[I 2024-12-04 19:43:10,497] Trial 44 finished with value: 0.46209176069667235 and parameters: {'n_estimators': 461, 'max_depth': 22, 'min_samples_split': 6, 'min_samples_leaf': 1, 'max_features': None, 'bootstrap': True, 'criterion': 'squared_error'}. Best is trial 20 with value: 0.4252751644953182.
[I 2024-12-04 19:43:12,472] Trial 45 finished with value: 0.5062801673208637 and parameters: {'n_estimators': 389, 'max_depth': 20, 'min_samples_split': 3, 'min_samples_leaf': 3, 'max_features': None, 'bootstrap': True, 'criterion': 'squared_error'}. Best is trial 20 with value: 0.4252751644953182.
[I 2024-12-04 19:43:15,309] Trial 46 finished with value: 0.4600177969506548 and parameters: {'n_estimators': 564, 'max_depth': 17, 'min_samples_split': 6, 'min_samples_leaf': 1, 'max_features': None, 'bootstrap': True, 'criterion': 'squared_error'}. Best is trial 20 with value: 0.4252751644953182.
[I 2024-12-04 19:43:16,744] Trial 47 finished with value: 1.0195145181827219 and parameters: {'n_estimators': 664, 'max_depth': 8, 'min_samples_split': 5, 'min_samples_leaf': 1, 'max_features': 'sqrt', 'bootstrap': True, 'criterion': 'squared_error'}. Best is trial 20 with value: 0.4252751644953182.
[I 2024-12-04 19:43:20,592] Trial 40 finished with value: 0.5340566476837301 and parameters: {'n_estimators': 630, 'max_depth': 39, 'min_samples_split': 5, 'min_samples_leaf': 2, 'max_features': None, 'bootstrap': False, 'criterion': 'absolute_error'}. Best is trial 20 with value: 0.4252751644953182.
[I 2024-12-04 19:43:25,757] Trial 48 finished with value: 1.0568458906889155 and parameters: {'n_estimators': 553, 'max_depth': 20, 'min_samples_split': 7, 'min_samples_leaf': 1, 'max_features': 'log2', 'bootstrap': False, 'criterion': 'absolute_error'}. Best is trial 20 with value: 0.4252751644953182.
[I 2024-12-04 19:43:26,976] Trial 43 finished with value: 0.430676617481826 and parameters: {'n_estimators': 518, 'max_depth': 22, 'min_samples_split': 3, 'min_samples_leaf': 1, 'max_features': None, 'bootstrap': True, 'criterion': 'absolute_error'}. Best is trial 20 with value: 0.4252751644953182.
[I 2024-12-04 19:43:29,883] Trial 51 finished with value: 1.1829656486385522 and parameters: {'n_estimators': 460, 'max_depth': 12, 'min_samples_split': 2, 'min_samples_leaf': 1, 'max_features': 'log2', 'bootstrap': True, 'criterion': 'absolute_error'}. Best is trial 20 with value: 0.4252751644953182.
[I 2024-12-04 19:43:30,633] Trial 50 finished with value: 0.42137518429139076 and parameters: {'n_estimators': 569, 'max_depth': 23, 'min_samples_split': 2, 'min_samples_leaf': 1, 'max_features': None, 'bootstrap': False, 'criterion': 'squared_error'}. Best is trial 50 with value: 0.42137518429139076.
[I 2024-12-04 19:43:34,392] Trial 53 finished with value: 0.42938863658927023 and parameters: {'n_estimators': 473, 'max_depth': 36, 'min_samples_split': 4, 'min_samples_leaf': 1, 'max_features': None, 'bootstrap': False, 'criterion': 'squared_error'}. Best is trial 50 with value: 0.42137518429139076.
[I 2024-12-04 19:43:40,385] Trial 54 finished with value: 0.43177165628269304 and parameters: {'n_estimators': 745, 'max_depth': 39, 'min_samples_split': 3, 'min_samples_leaf': 1, 'max_features': None, 'bootstrap': False, 'criterion': 'squared_error'}. Best is trial 50 with value: 0.42137518429139076.
[I 2024-12-04 19:43:45,348] Trial 55 finished with value: 0.4333980684979269 and parameters: {'n_estimators': 558, 'max_depth': 32, 'min_samples_split': 2, 'min_samples_leaf': 1, 'max_features': None, 'bootstrap': False, 'criterion': 'squared_error'}. Best is trial 50 with value: 0.42137518429139076.
[I 2024-12-04 19:43:50,505] Trial 56 finished with value: 0.4284936922771442 and parameters: {'n_estimators': 653, 'max_depth': 30, 'min_samples_split': 3, 'min_samples_leaf': 1, 'max_features': None, 'bootstrap': False, 'criterion': 'squared_error'}. Best is trial 50 with value: 0.42137518429139076.
[I 2024-12-04 19:43:50,718] Trial 52 finished with value: 0.43401136538982965 and parameters: {'n_estimators': 307, 'max_depth': 20, 'min_samples_split': 2, 'min_samples_leaf': 1, 'max_features': None, 'bootstrap': True, 'criterion': 'absolute_error'}. Best is trial 50 with value: 0.42137518429139076.
[I 2024-12-04 19:43:52,054] Trial 58 finished with value: 0.6424599161342501 and parameters: {'n_estimators': 244, 'max_depth': 41, 'min_samples_split': 4, 'min_samples_leaf': 1, 'max_features': 'log2', 'bootstrap': False, 'criterion': 'squared_error'}. Best is trial 50 with value: 0.42137518429139076.
[I 2024-12-04 19:43:53,331] Trial 59 finished with value: 0.8953471746923676 and parameters: {'n_estimators': 382, 'max_depth': 20, 'min_samples_split': 2, 'min_samples_leaf': 1, 'max_features': 'log2', 'bootstrap': False, 'criterion': 'squared_error'}. Best is trial 50 with value: 0.42137518429139076.
[I 2024-12-04 19:43:57,325] Trial 57 finished with value: 0.48432168549913546 and parameters: {'n_estimators': 899, 'max_depth': 40, 'min_samples_split': 5, 'min_samples_leaf': 1, 'max_features': None, 'bootstrap': False, 'criterion': 'squared_error'}. Best is trial 50 with value: 0.42137518429139076.
[I 2024-12-04 19:43:57,532] Trial 60 finished with value: 0.541489714413307 and parameters: {'n_estimators': 737, 'max_depth': 13, 'min_samples_split': 2, 'min_samples_leaf': 2, 'max_features': None, 'bootstrap': False, 'criterion': 'squared_error'}. Best is trial 50 with value: 0.42137518429139076.
[I 2024-12-04 19:43:59,889] Trial 61 finished with value: 0.5364338814548176 and parameters: {'n_estimators': 339, 'max_depth': 29, 'min_samples_split': 7, 'min_samples_leaf': 2, 'max_features': None, 'bootstrap': False, 'criterion': 'squared_error'}. Best is trial 50 with value: 0.42137518429139076.
[I 2024-12-04 19:44:01,663] Trial 63 finished with value: 0.6700336334082516 and parameters: {'n_estimators': 707, 'max_depth': 41, 'min_samples_split': 5, 'min_samples_leaf': 1, 'max_features': 'log2', 'bootstrap': False, 'criterion': 'squared_error'}. Best is trial 50 with value: 0.42137518429139076.
[I 2024-12-04 19:44:02,425] Trial 62 finished with value: 0.42577772389086305 and parameters: {'n_estimators': 541, 'max_depth': 47, 'min_samples_split': 4, 'min_samples_leaf': 1, 'max_features': None, 'bootstrap': False, 'criterion': 'squared_error'}. Best is trial 50 with value: 0.42137518429139076.
[I 2024-12-04 19:44:05,424] Trial 64 finished with value: 0.4213495595823642 and parameters: {'n_estimators': 419, 'max_depth': 23, 'min_samples_split': 2, 'min_samples_leaf': 1, 'max_features': None, 'bootstrap': False, 'criterion': 'squared_error'}. Best is trial 64 with value: 0.4213495595823642.
[I 2024-12-04 19:44:06,734] Trial 65 finished with value: 0.484035476440655 and parameters: {'n_estimators': 558, 'max_depth': 43, 'min_samples_split': 5, 'min_samples_leaf': 1, 'max_features': None, 'bootstrap': False, 'criterion': 'squared_error'}. Best is trial 64 with value: 0.4213495595823642.
[I 2024-12-04 19:44:07,201] Trial 66 finished with value: 0.44649053013135825 and parameters: {'n_estimators': 330, 'max_depth': 7, 'min_samples_split': 2, 'min_samples_leaf': 1, 'max_features': None, 'bootstrap': False, 'criterion': 'squared_error'}. Best is trial 64 with value: 0.4213495595823642.
[I 2024-12-04 19:44:08,592] Trial 67 finished with value: 0.48600975698194365 and parameters: {'n_estimators': 497, 'max_depth': 31, 'min_samples_split': 3, 'min_samples_leaf': 1, 'max_features': 'sqrt', 'bootstrap': False, 'criterion': 'squared_error'}. Best is trial 64 with value: 0.4213495595823642.
[I 2024-12-04 19:44:09,643] Trial 68 finished with value: 0.5362318807419597 and parameters: {'n_estimators': 312, 'max_depth': 48, 'min_samples_split': 3, 'min_samples_leaf': 3, 'max_features': None, 'bootstrap': False, 'criterion': 'squared_error'}. Best is trial 64 with value: 0.4213495595823642.
[I 2024-12-04 19:44:11,452] Trial 69 finished with value: 0.42298961507493615 and parameters: {'n_estimators': 296, 'max_depth': 24, 'min_samples_split': 2, 'min_samples_leaf': 1, 'max_features': None, 'bootstrap': False, 'criterion': 'squared_error'}. Best is trial 64 with value: 0.4213495595823642.
[I 2024-12-04 19:44:13,684] Trial 71 finished with value: 0.4339714281749227 and parameters: {'n_estimators': 203, 'max_depth': 32, 'min_samples_split': 2, 'min_samples_leaf': 1, 'max_features': None, 'bootstrap': False, 'criterion': 'squared_error'}. Best is trial 64 with value: 0.4213495595823642.
[I 2024-12-04 19:44:16,983] Trial 72 finished with value: 0.5421283315536433 and parameters: {'n_estimators': 482, 'max_depth': 26, 'min_samples_split': 2, 'min_samples_leaf': 2, 'max_features': None, 'bootstrap': False, 'criterion': 'squared_error'}. Best is trial 64 with value: 0.4213495595823642.
[I 2024-12-04 19:44:20,901] Trial 73 finished with value: 0.5065052774661222 and parameters: {'n_estimators': 605, 'max_depth': 23, 'min_samples_split': 7, 'min_samples_leaf': 1, 'max_features': None, 'bootstrap': False, 'criterion': 'squared_error'}. Best is trial 64 with value: 0.4213495595823642.
[I 2024-12-04 19:44:36,807] Trial 49 finished with value: 0.4243439851564813 and parameters: {'n_estimators': 562, 'max_depth': 47, 'min_samples_split': 3, 'min_samples_leaf': 1, 'max_features': None, 'bootstrap': False, 'criterion': 'absolute_error'}. Best is trial 64 with value: 0.4213495595823642.
[I 2024-12-04 19:44:46,326] Trial 70 finished with value: 0.4243265790041951 and parameters: {'n_estimators': 284, 'max_depth': 29, 'min_samples_split': 3, 'min_samples_leaf': 1, 'max_features': None, 'bootstrap': False, 'criterion': 'absolute_error'}. Best is trial 64 with value: 0.4213495595823642.
[I 2024-12-04 19:45:04,419] Trial 76 finished with value: 0.4263993579389389 and parameters: {'n_estimators': 140, 'max_depth': 29, 'min_samples_split': 4, 'min_samples_leaf': 1, 'max_features': None, 'bootstrap': False, 'criterion': 'absolute_error'}. Best is trial 64 with value: 0.4213495595823642.
[I 2024-12-04 19:45:13,657] Trial 77 finished with value: 0.5262733575691703 and parameters: {'n_estimators': 107, 'max_depth': 23, 'min_samples_split': 3, 'min_samples_leaf': 2, 'max_features': None, 'bootstrap': False, 'criterion': 'absolute_error'}. Best is trial 64 with value: 0.4213495595823642.
[I 2024-12-04 19:45:34,408] Trial 78 finished with value: 0.47441286908585817 and parameters: {'n_estimators': 160, 'max_depth': 34, 'min_samples_split': 6, 'min_samples_leaf': 1, 'max_features': None, 'bootstrap': False, 'criterion': 'absolute_error'}. Best is trial 64 with value: 0.4213495595823642.
[I 2024-12-04 19:45:42,926] Trial 75 finished with value: 0.4225362987649587 and parameters: {'n_estimators': 506, 'max_depth': 45, 'min_samples_split': 2, 'min_samples_leaf': 1, 'max_features': None, 'bootstrap': False, 'criterion': 'absolute_error'}. Best is trial 64 with value: 0.4213495595823642.
[I 2024-12-04 19:45:59,166] Trial 79 finished with value: 0.419665050138139 and parameters: {'n_estimators': 189, 'max_depth': 34, 'min_samples_split': 2, 'min_samples_leaf': 1, 'max_features': None, 'bootstrap': False, 'criterion': 'absolute_error'}. Best is trial 79 with value: 0.419665050138139.
[I 2024-12-04 19:46:28,902] Trial 74 finished with value: 0.4228083820968862 and parameters: {'n_estimators': 981, 'max_depth': 38, 'min_samples_split': 3, 'min_samples_leaf': 1, 'max_features': None, 'bootstrap': False, 'criterion': 'absolute_error'}. Best is trial 79 with value: 0.419665050138139.
[I 2024-12-04 19:46:41,206] Trial 82 finished with value: 0.3635041514482964 and parameters: {'n_estimators': 504, 'max_depth': 46, 'min_samples_split': 2, 'min_samples_leaf': 1, 'max_features': 'sqrt', 'bootstrap': False, 'criterion': 'absolute_error'}. Best is trial 82 with value: 0.3635041514482964.
[I 2024-12-04 19:46:53,242] Trial 81 finished with value: 0.42287282398553777 and parameters: {'n_estimators': 418, 'max_depth': 38, 'min_samples_split': 3, 'min_samples_leaf': 1, 'max_features': None, 'bootstrap': False, 'criterion': 'absolute_error'}. Best is trial 82 with value: 0.3635041514482964.
[I 2024-12-04 19:46:55,841] Trial 83 finished with value: 0.4245946622423649 and parameters: {'n_estimators': 640, 'max_depth': 45, 'min_samples_split': 4, 'min_samples_leaf': 1, 'max_features': 'sqrt', 'bootstrap': False, 'criterion': 'absolute_error'}. Best is trial 82 with value: 0.3635041514482964.
[I 2024-12-04 19:47:12,880] Trial 80 finished with value: 0.4190474340652358 and parameters: {'n_estimators': 698, 'max_depth': 34, 'min_samples_split': 2, 'min_samples_leaf': 1, 'max_features': None, 'bootstrap': False, 'criterion': 'absolute_error'}. Best is trial 82 with value: 0.3635041514482964.
[I 2024-12-04 19:47:40,625] Trial 85 finished with value: 0.4219800076967203 and parameters: {'n_estimators': 341, 'max_depth': 44, 'min_samples_split': 2, 'min_samples_leaf': 1, 'max_features': None, 'bootstrap': False, 'criterion': 'absolute_error'}. Best is trial 82 with value: 0.3635041514482964.
[I 2024-12-04 19:47:46,173] Trial 87 finished with value: 0.5187341905538457 and parameters: {'n_estimators': 386, 'max_depth': 38, 'min_samples_split': 2, 'min_samples_leaf': 1, 'max_features': 'sqrt', 'bootstrap': True, 'criterion': 'absolute_error'}. Best is trial 82 with value: 0.3635041514482964.
[I 2024-12-04 19:48:30,801] Trial 86 finished with value: 0.4188441960965093 and parameters: {'n_estimators': 612, 'max_depth': 26, 'min_samples_split': 2, 'min_samples_leaf': 1, 'max_features': None, 'bootstrap': False, 'criterion': 'absolute_error'}. Best is trial 82 with value: 0.3635041514482964.
[I 2024-12-04 19:48:59,489] Trial 84 finished with value: 0.4749668047303785 and parameters: {'n_estimators': 997, 'max_depth': 33, 'min_samples_split': 5, 'min_samples_leaf': 1, 'max_features': None, 'bootstrap': False, 'criterion': 'absolute_error'}. Best is trial 82 with value: 0.3635041514482964.
[I 2024-12-04 19:49:01,205] Trial 90 finished with value: 1.2600968260220522 and parameters: {'n_estimators': 305, 'max_depth': 49, 'min_samples_split': 6, 'min_samples_leaf': 3, 'max_features': 'log2', 'bootstrap': False, 'criterion': 'absolute_error'}. Best is trial 82 with value: 0.3635041514482964.
[I 2024-12-04 19:49:02,231] Trial 88 finished with value: 0.5279030123160823 and parameters: {'n_estimators': 923, 'max_depth': 48, 'min_samples_split': 2, 'min_samples_leaf': 2, 'max_features': None, 'bootstrap': False, 'criterion': 'absolute_error'}. Best is trial 82 with value: 0.3635041514482964.
[I 2024-12-04 19:49:07,362] Trial 91 finished with value: 0.8918371261597204 and parameters: {'n_estimators': 423, 'max_depth': 38, 'min_samples_split': 2, 'min_samples_leaf': 2, 'max_features': 'sqrt', 'bootstrap': False, 'criterion': 'absolute_error'}. Best is trial 82 with value: 0.3635041514482964.
[I 2024-12-04 19:49:21,143] Trial 93 finished with value: 0.43361496913560416 and parameters: {'n_estimators': 197, 'max_depth': 43, 'min_samples_split': 3, 'min_samples_leaf': 1, 'max_features': None, 'bootstrap': True, 'criterion': 'absolute_error'}. Best is trial 82 with value: 0.3635041514482964.
[I 2024-12-04 19:49:23,548] Trial 92 finished with value: 0.4243717434752298 and parameters: {'n_estimators': 160, 'max_depth': 49, 'min_samples_split': 3, 'min_samples_leaf': 1, 'max_features': None, 'bootstrap': False, 'criterion': 'absolute_error'}. Best is trial 82 with value: 0.3635041514482964.
[I 2024-12-04 19:49:30,059] Trial 94 finished with value: 0.7251424979837049 and parameters: {'n_estimators': 417, 'max_depth': 36, 'min_samples_split': 2, 'min_samples_leaf': 1, 'max_features': 'log2', 'bootstrap': False, 'criterion': 'absolute_error'}. Best is trial 82 with value: 0.3635041514482964.
[I 2024-12-04 19:50:05,244] Trial 89 finished with value: 0.4219548497100514 and parameters: {'n_estimators': 752, 'max_depth': 24, 'min_samples_split': 3, 'min_samples_leaf': 1, 'max_features': None, 'bootstrap': False, 'criterion': 'absolute_error'}. Best is trial 82 with value: 0.3635041514482964.
[I 2024-12-04 19:50:14,352] Trial 96 finished with value: 0.5280935578071362 and parameters: {'n_estimators': 538, 'max_depth': 27, 'min_samples_split': 2, 'min_samples_leaf': 2, 'max_features': None, 'bootstrap': False, 'criterion': 'absolute_error'}. Best is trial 82 with value: 0.3635041514482964.
[I 2024-12-04 19:50:25,373] Trial 98 finished with value: 0.9702528055031288 and parameters: {'n_estimators': 838, 'max_depth': 23, 'min_samples_split': 3, 'min_samples_leaf': 1, 'max_features': 'log2', 'bootstrap': False, 'criterion': 'absolute_error'}. Best is trial 82 with value: 0.3635041514482964.
[I 2024-12-04 19:50:25,483] Trial 95 finished with value: 0.4207841557818978 and parameters: {'n_estimators': 458, 'max_depth': 41, 'min_samples_split': 2, 'min_samples_leaf': 1, 'max_features': None, 'bootstrap': False, 'criterion': 'absolute_error'}. Best is trial 82 with value: 0.3635041514482964.
[I 2024-12-04 19:50:33,264] Trial 100 finished with value: 0.37541714525562797 and parameters: {'n_estimators': 316, 'max_depth': 46, 'min_samples_split': 3, 'min_samples_leaf': 1, 'max_features': 'sqrt', 'bootstrap': False, 'criterion': 'absolute_error'}. Best is trial 82 with value: 0.3635041514482964.
[I 2024-12-04 19:50:40,505] Trial 101 finished with value: 0.36564274579858297 and parameters: {'n_estimators': 296, 'max_depth': 48, 'min_samples_split': 3, 'min_samples_leaf': 1, 'max_features': 'sqrt', 'bootstrap': False, 'criterion': 'absolute_error'}. Best is trial 82 with value: 0.3635041514482964.
[I 2024-12-04 19:50:48,200] Trial 102 finished with value: 0.5470443025045908 and parameters: {'n_estimators': 328, 'max_depth': 40, 'min_samples_split': 6, 'min_samples_leaf': 1, 'max_features': 'sqrt', 'bootstrap': False, 'criterion': 'absolute_error'}. Best is trial 82 with value: 0.3635041514482964.
[I 2024-12-04 19:50:52,142] Trial 103 finished with value: 0.4125809242633573 and parameters: {'n_estimators': 151, 'max_depth': 50, 'min_samples_split': 4, 'min_samples_leaf': 1, 'max_features': 'sqrt', 'bootstrap': False, 'criterion': 'absolute_error'}. Best is trial 82 with value: 0.3635041514482964.
[I 2024-12-04 19:50:57,256] Trial 104 finished with value: 0.4705807111747488 and parameters: {'n_estimators': 204, 'max_depth': 49, 'min_samples_split': 5, 'min_samples_leaf': 1, 'max_features': 'sqrt', 'bootstrap': False, 'criterion': 'absolute_error'}. Best is trial 82 with value: 0.3635041514482964.
[I 2024-12-04 19:51:03,438] Trial 105 finished with value: 0.36640609639452854 and parameters: {'n_estimators': 245, 'max_depth': 44, 'min_samples_split': 2, 'min_samples_leaf': 1, 'max_features': 'sqrt', 'bootstrap': False, 'criterion': 'absolute_error'}. Best is trial 82 with value: 0.3635041514482964.
[I 2024-12-04 19:51:06,093] Trial 106 finished with value: 0.8712324939974273 and parameters: {'n_estimators': 154, 'max_depth': 44, 'min_samples_split': 2, 'min_samples_leaf': 2, 'max_features': 'sqrt', 'bootstrap': False, 'criterion': 'absolute_error'}. Best is trial 82 with value: 0.3635041514482964.
[I 2024-12-04 19:51:13,051] Trial 107 finished with value: 0.42479476460962473 and parameters: {'n_estimators': 291, 'max_depth': 36, 'min_samples_split': 2, 'min_samples_leaf': 1, 'max_features': 'sqrt', 'bootstrap': False, 'criterion': 'absolute_error'}. Best is trial 82 with value: 0.3635041514482964.
[I 2024-12-04 19:51:13,985] Trial 108 finished with value: 0.6602883653208237 and parameters: {'n_estimators': 213, 'max_depth': 50, 'min_samples_split': 2, 'min_samples_leaf': 2, 'max_features': 'sqrt', 'bootstrap': False, 'criterion': 'squared_error'}. Best is trial 82 with value: 0.3635041514482964.
[I 2024-12-04 19:51:22,249] Trial 109 finished with value: 0.3417378614168333 and parameters: {'n_estimators': 330, 'max_depth': 50, 'min_samples_split': 2, 'min_samples_leaf': 1, 'max_features': 'sqrt', 'bootstrap': False, 'criterion': 'absolute_error'}. Best is trial 109 with value: 0.3417378614168333.
[I 2024-12-04 19:51:28,916] Trial 97 finished with value: 0.42791585057784715 and parameters: {'n_estimators': 723, 'max_depth': 16, 'min_samples_split': 4, 'min_samples_leaf': 1, 'max_features': None, 'bootstrap': False, 'criterion': 'absolute_error'}. Best is trial 109 with value: 0.3417378614168333.
