[I 2024-12-04 19:53:24,840] Trial 180 finished with value: 0.337060480165448 and parameters: {'n_estimators': 432, 'max_depth': 48, 'min_samples_split': 2, 'min_samples_leaf': 1, 'max_features': 'sqrt', 'bootstrap': False, 'criterion': 'squared_error'}. Best is trial 143 with value: 0.32310115881146656.
[I 2024-12-04 19:53:25,479] Trial 179 finished with value: 0.34633767932067644 and parameters: {'n_estimators': 590, 'max_depth': 44, 'min_samples_split': 2, 'min_samples_leaf': 1, 'max_features': 'sqrt', 'bootstrap': False, 'criterion': 'squared_error'}. Best is trial 143 with value: 0.32310115881146656.
[I 2024-12-04 19:53:26,705] Trial 182 finished with value: 0.32956329681003255 and parameters: {'n_estimators': 285, 'max_depth': 48, 'min_samples_split': 2, 'min_samples_leaf': 1, 'max_features': 'sqrt', 'bootstrap': False, 'criterion': 'squared_error'}. Best is trial 143 with value: 0.32310115881146656.
[I 2024-12-04 19:53:27,247] Trial 183 finished with value: 0.3232467036184264 and parameters: {'n_estimators': 344, 'max_depth': 49, 'min_samples_split': 2, 'min_samples_leaf': 1, 'max_features': 'sqrt', 'bootstrap': False, 'criterion': 'squared_error'}. Best is trial 143 with value: 0.32310115881146656.
[I 2024-12-04 19:53:27,733] Trial 184 finished with value: 0.3484418647055036 and parameters: {'n_estimators': 359, 'max_depth': 44, 'min_samples_split': 2, 'min_samples_leaf': 1, 'max_features': 'sqrt', 'bootstrap': False, 'criterion': 'squared_error'}. Best is trial 143 with value: 0.32310115881146656.
[I 2024-12-04 19:53:28,782] Trial 187 finished with value: 0.8355865882901563 and parameters: {'n_estimators': 269, 'max_depth': 40, 'min_samples_split': 2, 'min_samples_leaf': 3, 'max_features': 'sqrt', 'bootstrap': False, 'criterion': 'squared_error'}. Best is trial 143 with value: 0.32310115881146656.
[I 2024-12-04 19:53:28,859] Trial 185 finished with value: 0.32269081148361717 and parameters: {'n_estimators': 339, 'max_depth': 50, 'min_samples_split': 2, 'min_samples_leaf': 1, 'max_features': 'sqrt', 'bootstrap': False, 'criterion': 'squared_error'}. Best is trial 185 with value: 0.32269081148361717.
[I 2024-12-04 19:53:29,481] Trial 186 finished with value: 0.34469689142267246 and parameters: {'n_estimators': 307, 'max_depth': 43, 'min_samples_split': 2, 'min_samples_leaf': 1, 'max_features': 'sqrt', 'bootstrap': False, 'criterion': 'squared_error'}. Best is trial 185 with value: 0.32269081148361717.
[I 2024-12-04 19:53:30,741] Trial 188 finished with value: 0.35953997415923294 and parameters: {'n_estimators': 383, 'max_depth': 50, 'min_samples_split': 3, 'min_samples_leaf': 1, 'max_features': 'sqrt', 'bootstrap': False, 'criterion': 'squared_error'}. Best is trial 185 with value: 0.32269081148361717.
[I 2024-12-04 19:53:30,760] Trial 190 finished with value: 0.6777404970755972 and parameters: {'n_estimators': 386, 'max_depth': 50, 'min_samples_split': 2, 'min_samples_leaf': 2, 'max_features': 'sqrt', 'bootstrap': False, 'criterion': 'squared_error'}. Best is trial 185 with value: 0.32269081148361717.
[I 2024-12-04 19:53:31,577] Trial 189 finished with value: 0.3245891159907407 and parameters: {'n_estimators': 387, 'max_depth': 49, 'min_samples_split': 2, 'min_samples_leaf': 1, 'max_features': 'sqrt', 'bootstrap': False, 'criterion': 'squared_error'}. Best is trial 185 with value: 0.32269081148361717.
[I 2024-12-04 19:53:33,694] Trial 193 finished with value: 0.3224133091717219 and parameters: {'n_estimators': 370, 'max_depth': 50, 'min_samples_split': 2, 'min_samples_leaf': 1, 'max_features': 'sqrt', 'bootstrap': False, 'criterion': 'squared_error'}. Best is trial 193 with value: 0.3224133091717219.
[I 2024-12-04 19:53:34,625] Trial 192 finished with value: 0.32466365528924146 and parameters: {'n_estimators': 744, 'max_depth': 49, 'min_samples_split': 2, 'min_samples_leaf': 1, 'max_features': 'sqrt', 'bootstrap': False, 'criterion': 'squared_error'}. Best is trial 193 with value: 0.3224133091717219.
[I 2024-12-04 19:53:34,863] Trial 191 finished with value: 0.32504757345896035 and parameters: {'n_estimators': 864, 'max_depth': 49, 'min_samples_split': 2, 'min_samples_leaf': 1, 'max_features': 'sqrt', 'bootstrap': False, 'criterion': 'squared_error'}. Best is trial 193 with value: 0.3224133091717219.
[I 2024-12-04 19:53:35,450] Trial 194 finished with value: 0.38447409322118936 and parameters: {'n_estimators': 330, 'max_depth': 50, 'min_samples_split': 4, 'min_samples_leaf': 1, 'max_features': 'sqrt', 'bootstrap': False, 'criterion': 'squared_error'}. Best is trial 193 with value: 0.3224133091717219.
[I 2024-12-04 19:53:38,111] Trial 197 finished with value: 0.4079078095955056 and parameters: {'n_estimators': 852, 'max_depth': 43, 'min_samples_split': 4, 'min_samples_leaf': 1, 'max_features': 'sqrt', 'bootstrap': False, 'criterion': 'squared_error'}. Best is trial 193 with value: 0.3224133091717219.
[I 2024-12-04 19:53:38,156] Trial 195 finished with value: 0.32591234795848123 and parameters: {'n_estimators': 726, 'max_depth': 50, 'min_samples_split': 2, 'min_samples_leaf': 1, 'max_features': 'sqrt', 'bootstrap': False, 'criterion': 'squared_error'}. Best is trial 193 with value: 0.3224133091717219.
[I 2024-12-04 19:53:41,584] Trial 198 finished with value: 0.3331963408696459 and parameters: {'n_estimators': 767, 'max_depth': 47, 'min_samples_split': 2, 'min_samples_leaf': 1, 'max_features': 'sqrt', 'bootstrap': False, 'criterion': 'squared_error'}. Best is trial 193 with value: 0.3224133091717219.
[I 2024-12-04 19:53:42,597] Trial 199 finished with value: 0.324114989153609 and parameters: {'n_estimators': 972, 'max_depth': 49, 'min_samples_split': 2, 'min_samples_leaf': 1, 'max_features': 'sqrt', 'bootstrap': False, 'criterion': 'squared_error'}. Best is trial 193 with value: 0.3224133091717219.
[I 2024-12-04 19:53:45,082] Trial 200 finished with value: 0.340234037949759 and parameters: {'n_estimators': 782, 'max_depth': 45, 'min_samples_split': 2, 'min_samples_leaf': 1, 'max_features': 'sqrt', 'bootstrap': False, 'criterion': 'squared_error'}. Best is trial 193 with value: 0.3224133091717219.
[I 2024-12-04 19:53:45,861] Trial 201 finished with value: 0.6752400937058066 and parameters: {'n_estimators': 979, 'max_depth': 37, 'min_samples_split': 2, 'min_samples_leaf': 1, 'max_features': 'log2', 'bootstrap': False, 'criterion': 'squared_error'}. Best is trial 193 with value: 0.3224133091717219.
[I 2024-12-04 19:53:48,059] Trial 203 finished with value: 0.42007526897570163 and parameters: {'n_estimators': 669, 'max_depth': 46, 'min_samples_split': 3, 'min_samples_leaf': 1, 'max_features': 'sqrt', 'bootstrap': True, 'criterion': 'squared_error'}. Best is trial 193 with value: 0.3224133091717219.
[I 2024-12-04 19:53:49,094] Trial 202 finished with value: 0.38410340958247813 and parameters: {'n_estimators': 925, 'max_depth': 38, 'min_samples_split': 2, 'min_samples_leaf': 1, 'max_features': 'sqrt', 'bootstrap': False, 'criterion': 'squared_error'}. Best is trial 193 with value: 0.3224133091717219.
[I 2024-12-04 19:53:51,254] Trial 204 finished with value: 1.2226979750615765 and parameters: {'n_estimators': 804, 'max_depth': 6, 'min_samples_split': 31, 'min_samples_leaf': 4, 'max_features': 'sqrt', 'bootstrap': True, 'criterion': 'absolute_error'}. Best is trial 193 with value: 0.3224133091717219.
[I 2024-12-04 19:53:52,389] Trial 205 finished with value: 0.3312196538861929 and parameters: {'n_estimators': 727, 'max_depth': 46, 'min_samples_split': 2, 'min_samples_leaf': 1, 'max_features': 'sqrt', 'bootstrap': False, 'criterion': 'squared_error'}. Best is trial 193 with value: 0.3224133091717219.
[I 2024-12-04 19:53:55,513] Trial 207 finished with value: 0.3723629341733097 and parameters: {'n_estimators': 959, 'max_depth': 49, 'min_samples_split': 3, 'min_samples_leaf': 1, 'max_features': 'sqrt', 'bootstrap': False, 'criterion': 'squared_error'}. Best is trial 193 with value: 0.3224133091717219.
[I 2024-12-04 19:53:59,278] Trial 206 finished with value: 0.718158953610783 and parameters: {'n_estimators': 772, 'max_depth': 26, 'min_samples_split': 8, 'min_samples_leaf': 11, 'max_features': None, 'bootstrap': True, 'criterion': 'absolute_error'}. Best is trial 193 with value: 0.3224133091717219.
[I 2024-12-04 19:53:59,477] Trial 208 finished with value: 0.4339584310274751 and parameters: {'n_estimators': 409, 'max_depth': 50, 'min_samples_split': 2, 'min_samples_leaf': 1, 'max_features': None, 'bootstrap': False, 'criterion': 'squared_error'}. Best is trial 193 with value: 0.3224133091717219.
[I 2024-12-04 19:54:01,940] Trial 210 finished with value: 0.3890737388344167 and parameters: {'n_estimators': 699, 'max_depth': 49, 'min_samples_split': 4, 'min_samples_leaf': 1, 'max_features': 'sqrt', 'bootstrap': False, 'criterion': 'squared_error'}. Best is trial 193 with value: 0.3224133091717219.
[I 2024-12-04 19:54:03,512] Trial 209 finished with value: 0.49761694210565366 and parameters: {'n_estimators': 768, 'max_depth': 50, 'min_samples_split': 3, 'min_samples_leaf': 2, 'max_features': None, 'bootstrap': True, 'criterion': 'squared_error'}. Best is trial 193 with value: 0.3224133091717219.
[I 2024-12-04 19:54:04,203] Trial 211 finished with value: 0.5629073375876643 and parameters: {'n_estimators': 512, 'max_depth': 45, 'min_samples_split': 2, 'min_samples_leaf': 1, 'max_features': 'log2', 'bootstrap': False, 'criterion': 'squared_error'}. Best is trial 193 with value: 0.3224133091717219.
[I 2024-12-04 19:54:05,402] Trial 212 finished with value: 1.2524561349018686 and parameters: {'n_estimators': 812, 'max_depth': 38, 'min_samples_split': 27, 'min_samples_leaf': 4, 'max_features': 'log2', 'bootstrap': True, 'criterion': 'squared_error'}. Best is trial 193 with value: 0.3224133091717219.
[I 2024-12-04 19:54:08,661] Trial 213 finished with value: 0.32480130975500143 and parameters: {'n_estimators': 989, 'max_depth': 49, 'min_samples_split': 2, 'min_samples_leaf': 1, 'max_features': 'sqrt', 'bootstrap': False, 'criterion': 'squared_error'}. Best is trial 193 with value: 0.3224133091717219.
[I 2024-12-04 19:54:10,947] Trial 215 finished with value: 0.32885328744861403 and parameters: {'n_estimators': 484, 'max_depth': 50, 'min_samples_split': 2, 'min_samples_leaf': 1, 'max_features': 'sqrt', 'bootstrap': False, 'criterion': 'squared_error'}. Best is trial 193 with value: 0.3224133091717219.
[I 2024-12-04 19:54:13,571] Trial 216 finished with value: 0.3274874713613399 and parameters: {'n_estimators': 584, 'max_depth': 50, 'min_samples_split': 2, 'min_samples_leaf': 1, 'max_features': 'sqrt', 'bootstrap': False, 'criterion': 'squared_error'}. Best is trial 193 with value: 0.3224133091717219.
[I 2024-12-04 19:54:17,330] Trial 217 finished with value: 0.3250678090161042 and parameters: {'n_estimators': 933, 'max_depth': 49, 'min_samples_split': 2, 'min_samples_leaf': 1, 'max_features': 'sqrt', 'bootstrap': False, 'criterion': 'squared_error'}. Best is trial 193 with value: 0.3224133091717219.
[I 2024-12-04 19:54:19,024] Trial 218 finished with value: 0.6777020220187369 and parameters: {'n_estimators': 752, 'max_depth': 49, 'min_samples_split': 2, 'min_samples_leaf': 2, 'max_features': 'sqrt', 'bootstrap': False, 'criterion': 'squared_error'}. Best is trial 193 with value: 0.3224133091717219.
[I 2024-12-04 19:54:20,729] Trial 196 finished with value: 0.6960855539582385 and parameters: {'n_estimators': 713, 'max_depth': 27, 'min_samples_split': 34, 'min_samples_leaf': 1, 'max_features': None, 'bootstrap': True, 'criterion': 'absolute_error'}. Best is trial 193 with value: 0.3224133091717219.
[I 2024-12-04 19:54:22,031] Trial 219 finished with value: 0.41176545769549766 and parameters: {'n_estimators': 902, 'max_depth': 47, 'min_samples_split': 3, 'min_samples_leaf': 1, 'max_features': 'sqrt', 'bootstrap': True, 'criterion': 'squared_error'}. Best is trial 193 with value: 0.3224133091717219.
[I 2024-12-04 19:54:24,825] Trial 220 finished with value: 0.35505401686600657 and parameters: {'n_estimators': 990, 'max_depth': 42, 'min_samples_split': 2, 'min_samples_leaf': 1, 'max_features': 'sqrt', 'bootstrap': False, 'criterion': 'squared_error'}. Best is trial 193 with value: 0.3224133091717219.
[I 2024-12-04 19:54:25,774] Trial 222 finished with value: 1.2754700521474545 and parameters: {'n_estimators': 485, 'max_depth': 24, 'min_samples_split': 10, 'min_samples_leaf': 15, 'max_features': 'log2', 'bootstrap': False, 'criterion': 'squared_error'}. Best is trial 193 with value: 0.3224133091717219.
[I 2024-12-04 19:54:25,796] Trial 221 finished with value: 0.32618095247106654 and parameters: {'n_estimators': 831, 'max_depth': 50, 'min_samples_split': 2, 'min_samples_leaf': 1, 'max_features': 'sqrt', 'bootstrap': False, 'criterion': 'squared_error'}. Best is trial 193 with value: 0.3224133091717219.
[I 2024-12-04 19:54:28,196] Trial 224 finished with value: 0.6768820491186573 and parameters: {'n_estimators': 972, 'max_depth': 47, 'min_samples_split': 2, 'min_samples_leaf': 2, 'max_features': 'sqrt', 'bootstrap': False, 'criterion': 'squared_error'}. Best is trial 193 with value: 0.3224133091717219.
[I 2024-12-04 19:54:30,264] Trial 214 finished with value: 0.36552058984371205 and parameters: {'n_estimators': 987, 'max_depth': 46, 'min_samples_split': 2, 'min_samples_leaf': 1, 'max_features': 'sqrt', 'bootstrap': False, 'criterion': 'absolute_error'}. Best is trial 193 with value: 0.3224133091717219.
[I 2024-12-04 19:54:32,292] Trial 225 finished with value: 0.32477198409781555 and parameters: {'n_estimators': 947, 'max_depth': 49, 'min_samples_split': 2, 'min_samples_leaf': 1, 'max_features': 'sqrt', 'bootstrap': False, 'criterion': 'squared_error'}. Best is trial 193 with value: 0.3224133091717219.
[I 2024-12-04 19:54:32,698] Trial 226 finished with value: 0.5509305035117865 and parameters: {'n_estimators': 773, 'max_depth': 50, 'min_samples_split': 3, 'min_samples_leaf': 1, 'max_features': 'log2', 'bootstrap': False, 'criterion': 'squared_error'}. Best is trial 193 with value: 0.3224133091717219.
[I 2024-12-04 19:54:34,587] Trial 223 finished with value: 0.435928319959413 and parameters: {'n_estimators': 872, 'max_depth': 45, 'min_samples_split': 2, 'min_samples_leaf': 1, 'max_features': None, 'bootstrap': False, 'criterion': 'squared_error'}. Best is trial 193 with value: 0.3224133091717219.
[I 2024-12-04 19:54:36,594] Trial 227 finished with value: 0.324651328287528 and parameters: {'n_estimators': 941, 'max_depth': 49, 'min_samples_split': 2, 'min_samples_leaf': 1, 'max_features': 'sqrt', 'bootstrap': False, 'criterion': 'squared_error'}. Best is trial 193 with value: 0.3224133091717219.
[I 2024-12-04 19:54:37,052] Trial 228 finished with value: 0.3334150462879852 and parameters: {'n_estimators': 954, 'max_depth': 46, 'min_samples_split': 2, 'min_samples_leaf': 1, 'max_features': 'sqrt', 'bootstrap': False, 'criterion': 'squared_error'}. Best is trial 193 with value: 0.3224133091717219.
[I 2024-12-04 19:54:37,431] Trial 229 finished with value: 0.33919183549931753 and parameters: {'n_estimators': 552, 'max_depth': 48, 'min_samples_split': 2, 'min_samples_leaf': 1, 'max_features': 'sqrt', 'bootstrap': False, 'criterion': 'squared_error'}. Best is trial 193 with value: 0.3224133091717219.
[I 2024-12-04 19:54:38,552] Trial 232 finished with value: 1.1293024921765065 and parameters: {'n_estimators': 126, 'max_depth': 7, 'min_samples_split': 18, 'min_samples_leaf': 6, 'max_features': 'sqrt', 'bootstrap': False, 'criterion': 'squared_error'}. Best is trial 193 with value: 0.3224133091717219.
[I 2024-12-04 19:54:40,762] Trial 231 finished with value: 0.541461018999522 and parameters: {'n_estimators': 918, 'max_depth': 50, 'min_samples_split': 2, 'min_samples_leaf': 1, 'max_features': 'log2', 'bootstrap': True, 'criterion': 'squared_error'}. Best is trial 193 with value: 0.3224133091717219.
[I 2024-12-04 19:54:40,837] Trial 230 finished with value: 0.3249973618890479 and parameters: {'n_estimators': 865, 'max_depth': 49, 'min_samples_split': 2, 'min_samples_leaf': 1, 'max_features': 'sqrt', 'bootstrap': False, 'criterion': 'squared_error'}. Best is trial 193 with value: 0.3224133091717219.
[I 2024-12-04 19:54:42,963] Trial 233 finished with value: 0.3273044582711156 and parameters: {'n_estimators': 918, 'max_depth': 50, 'min_samples_split': 2, 'min_samples_leaf': 1, 'max_features': 'sqrt', 'bootstrap': False, 'criterion': 'squared_error'}. Best is trial 193 with value: 0.3224133091717219.
[I 2024-12-04 19:54:45,314] Trial 235 finished with value: 0.32728044026975583 and parameters: {'n_estimators': 925, 'max_depth': 50, 'min_samples_split': 2, 'min_samples_leaf': 1, 'max_features': 'sqrt', 'bootstrap': False, 'criterion': 'squared_error'}. Best is trial 193 with value: 0.3224133091717219.
[I 2024-12-04 19:54:45,505] Trial 234 finished with value: 0.3267913804525787 and parameters: {'n_estimators': 998, 'max_depth': 50, 'min_samples_split': 2, 'min_samples_leaf': 1, 'max_features': 'sqrt', 'bootstrap': False, 'criterion': 'squared_error'}. Best is trial 193 with value: 0.3224133091717219.
[I 2024-12-04 19:54:47,200] Trial 236 finished with value: 0.3268301098437954 and parameters: {'n_estimators': 878, 'max_depth': 50, 'min_samples_split': 2, 'min_samples_leaf': 1, 'max_features': 'sqrt', 'bootstrap': False, 'criterion': 'squared_error'}. Best is trial 193 with value: 0.3224133091717219.
[I 2024-12-04 19:54:48,638] Trial 238 finished with value: 0.5118576299973193 and parameters: {'n_estimators': 999, 'max_depth': 49, 'min_samples_split': 10, 'min_samples_leaf': 1, 'max_features': 'sqrt', 'bootstrap': False, 'criterion': 'squared_error'}. Best is trial 193 with value: 0.3224133091717219.
[I 2024-12-04 19:54:49,184] Trial 239 finished with value: 0.8503432777351198 and parameters: {'n_estimators': 979, 'max_depth': 50, 'min_samples_split': 4, 'min_samples_leaf': 3, 'max_features': 'sqrt', 'bootstrap': False, 'criterion': 'squared_error'}. Best is trial 193 with value: 0.3224133091717219.
[I 2024-12-04 19:54:50,231] Trial 237 finished with value: 0.3353309191395262 and parameters: {'n_estimators': 869, 'max_depth': 48, 'min_samples_split': 2, 'min_samples_leaf': 1, 'max_features': 'sqrt', 'bootstrap': False, 'criterion': 'squared_error'}. Best is trial 193 with value: 0.3224133091717219.
[I 2024-12-04 19:54:52,682] Trial 240 finished with value: 0.5199773642992791 and parameters: {'n_estimators': 957, 'max_depth': 50, 'min_samples_split': 2, 'min_samples_leaf': 1, 'max_features': 'log2', 'bootstrap': False, 'criterion': 'squared_error'}. Best is trial 193 with value: 0.3224133091717219.
[I 2024-12-04 19:54:54,106] Trial 241 finished with value: 0.32670119430695693 and parameters: {'n_estimators': 874, 'max_depth': 50, 'min_samples_split': 2, 'min_samples_leaf': 1, 'max_features': 'sqrt', 'bootstrap': False, 'criterion': 'squared_error'}. Best is trial 193 with value: 0.3224133091717219.
[I 2024-12-04 19:54:56,448] Trial 243 finished with value: 0.3882831922006435 and parameters: {'n_estimators': 859, 'max_depth': 49, 'min_samples_split': 4, 'min_samples_leaf': 1, 'max_features': 'sqrt', 'bootstrap': False, 'criterion': 'squared_error'}. Best is trial 193 with value: 0.3224133091717219.
[I 2024-12-04 19:54:56,789] Trial 242 finished with value: 1.1946219408133933 and parameters: {'n_estimators': 659, 'max_depth': 6, 'min_samples_split': 16, 'min_samples_leaf': 1, 'max_features': 'sqrt', 'bootstrap': False, 'criterion': 'absolute_error'}. Best is trial 193 with value: 0.3224133091717219.
[I 2024-12-04 19:54:58,804] Trial 244 finished with value: 0.3270203282085091 and parameters: {'n_estimators': 969, 'max_depth': 50, 'min_samples_split': 2, 'min_samples_leaf': 1, 'max_features': 'sqrt', 'bootstrap': False, 'criterion': 'squared_error'}. Best is trial 193 with value: 0.3224133091717219.
[I 2024-12-04 19:54:59,038] Trial 246 finished with value: 0.6822012764917827 and parameters: {'n_estimators': 891, 'max_depth': 48, 'min_samples_split': 2, 'min_samples_leaf': 2, 'max_features': 'sqrt', 'bootstrap': False, 'criterion': 'squared_error'}. Best is trial 193 with value: 0.3224133091717219.
[I 2024-12-04 19:55:00,450] Trial 245 finished with value: 0.3678493364973647 and parameters: {'n_estimators': 961, 'max_depth': 50, 'min_samples_split': 3, 'min_samples_leaf': 1, 'max_features': 'sqrt', 'bootstrap': False, 'criterion': 'squared_error'}. Best is trial 193 with value: 0.3224133091717219.
[I 2024-12-04 19:55:01,379] Trial 249 finished with value: 1.2570726755655033 and parameters: {'n_estimators': 220, 'max_depth': 40, 'min_samples_split': 3, 'min_samples_leaf': 5, 'max_features': 'log2', 'bootstrap': True, 'criterion': 'squared_error'}. Best is trial 193 with value: 0.3224133091717219.
[I 2024-12-04 19:55:02,804] Trial 247 finished with value: 0.3260990725430359 and parameters: {'n_estimators': 800, 'max_depth': 50, 'min_samples_split': 2, 'min_samples_leaf': 1, 'max_features': 'sqrt', 'bootstrap': False, 'criterion': 'squared_error'}. Best is trial 193 with value: 0.3224133091717219.
[I 2024-12-04 19:55:02,918] Trial 248 finished with value: 0.32584583843427656 and parameters: {'n_estimators': 771, 'max_depth': 50, 'min_samples_split': 2, 'min_samples_leaf': 1, 'max_features': 'sqrt', 'bootstrap': False, 'criterion': 'squared_error'}. Best is trial 193 with value: 0.3224133091717219.
[I 2024-12-04 19:55:05,813] Trial 250 finished with value: 0.33492281973299876 and parameters: {'n_estimators': 965, 'max_depth': 48, 'min_samples_split': 2, 'min_samples_leaf': 1, 'max_features': 'sqrt', 'bootstrap': False, 'criterion': 'squared_error'}. Best is trial 193 with value: 0.3224133091717219.
[I 2024-12-04 19:55:05,824] Trial 252 finished with value: 0.36803421204874354 and parameters: {'n_estimators': 764, 'max_depth': 48, 'min_samples_split': 3, 'min_samples_leaf': 1, 'max_features': 'sqrt', 'bootstrap': False, 'criterion': 'squared_error'}. Best is trial 193 with value: 0.3224133091717219.
