[I 2024-12-04 14:46:48,629] Trial 57 finished with value: 0.4863971915340875 and parameters: {'n_estimators': 224, 'max_depth': 17, 'min_samples_split': 8, 'min_samples_leaf': 1, 'max_features': None, 'bootstrap': True, 'criterion': 'absolute_error'}. Best is trial 55 with value: 0.4376808190504977.
[I 2024-12-04 14:46:48,829] Trial 74 finished with value: 0.516599146674485 and parameters: {'n_estimators': 401, 'max_depth': 11, 'min_samples_split': 3, 'min_samples_leaf': 1, 'max_features': None, 'bootstrap': True, 'criterion': 'squared_error'}. Best is trial 55 with value: 0.4376808190504977.
[I 2024-12-04 14:46:49,641] Trial 85 finished with value: 0.5180935511335308 and parameters: {'n_estimators': 136, 'max_depth': 16, 'min_samples_split': 9, 'min_samples_leaf': 3, 'max_features': None, 'bootstrap': True, 'criterion': 'squared_error'}. Best is trial 55 with value: 0.4376808190504977.
[I 2024-12-04 14:46:51,204] Trial 78 finished with value: 0.4728922637093144 and parameters: {'n_estimators': 558, 'max_depth': 49, 'min_samples_split': 3, 'min_samples_leaf': 1, 'max_features': 'sqrt', 'bootstrap': False, 'criterion': 'squared_error'}. Best is trial 55 with value: 0.4376808190504977.
[I 2024-12-04 14:46:53,364] Trial 66 finished with value: 0.4650838381145879 and parameters: {'n_estimators': 181, 'max_depth': 26, 'min_samples_split': 2, 'min_samples_leaf': 2, 'max_features': None, 'bootstrap': True, 'criterion': 'absolute_error'}. Best is trial 55 with value: 0.4376808190504977.
[I 2024-12-04 14:46:53,765] Trial 89 finished with value: 0.8601241987651439 and parameters: {'n_estimators': 403, 'max_depth': 8, 'min_samples_split': 2, 'min_samples_leaf': 1, 'max_features': 'sqrt', 'bootstrap': False, 'criterion': 'squared_error'}. Best is trial 55 with value: 0.4376808190504977.
[I 2024-12-04 14:46:54,374] Trial 81 finished with value: 0.4605943185897668 and parameters: {'n_estimators': 207, 'max_depth': 16, 'min_samples_split': 3, 'min_samples_leaf': 1, 'max_features': None, 'bootstrap': True, 'criterion': 'squared_error'}. Best is trial 55 with value: 0.4376808190504977.
[I 2024-12-04 14:46:54,678] Trial 79 finished with value: 0.48535710211332267 and parameters: {'n_estimators': 112, 'max_depth': 40, 'min_samples_split': 13, 'min_samples_leaf': 2, 'max_features': None, 'bootstrap': True, 'criterion': 'squared_error'}. Best is trial 55 with value: 0.4376808190504977.
[I 2024-12-04 14:46:56,564] Trial 91 finished with value: 0.4694700209040676 and parameters: {'n_estimators': 157, 'max_depth': 32, 'min_samples_split': 2, 'min_samples_leaf': 2, 'max_features': None, 'bootstrap': True, 'criterion': 'squared_error'}. Best is trial 55 with value: 0.4376808190504977.
[I 2024-12-04 14:46:56,772] Trial 87 finished with value: 0.6495503850318773 and parameters: {'n_estimators': 471, 'max_depth': 36, 'min_samples_split': 6, 'min_samples_leaf': 8, 'max_features': None, 'bootstrap': True, 'criterion': 'squared_error'}. Best is trial 55 with value: 0.4376808190504977.
[I 2024-12-04 14:46:58,522] Trial 93 finished with value: 0.4240800565195573 and parameters: {'n_estimators': 194, 'max_depth': 46, 'min_samples_split': 2, 'min_samples_leaf': 1, 'max_features': None, 'bootstrap': True, 'criterion': 'squared_error'}. Best is trial 93 with value: 0.4240800565195573.
[I 2024-12-04 14:46:58,643] Trial 86 finished with value: 0.5664121060222412 and parameters: {'n_estimators': 106, 'max_depth': 41, 'min_samples_split': 3, 'min_samples_leaf': 4, 'max_features': None, 'bootstrap': True, 'criterion': 'squared_error'}. Best is trial 93 with value: 0.4240800565195573.
[I 2024-12-04 14:46:58,927] Trial 88 finished with value: 0.42679710483515065 and parameters: {'n_estimators': 238, 'max_depth': 44, 'min_samples_split': 3, 'min_samples_leaf': 1, 'max_features': None, 'bootstrap': True, 'criterion': 'squared_error'}. Best is trial 93 with value: 0.4240800565195573.
[I 2024-12-04 14:47:00,043] Trial 76 finished with value: 0.42225555491996447 and parameters: {'n_estimators': 502, 'max_depth': 31, 'min_samples_split': 2, 'min_samples_leaf': 1, 'max_features': None, 'bootstrap': True, 'criterion': 'squared_error'}. Best is trial 92 with value: 0.42099440235797364.
[I 2024-12-04 14:47:00,287] Trial 92 finished with value: 0.42099440235797364 and parameters: {'n_estimators': 247, 'max_depth': 40, 'min_samples_split': 2, 'min_samples_leaf': 1, 'max_features': None, 'bootstrap': True, 'criterion': 'squared_error'}. Best is trial 92 with value: 0.42099440235797364.
[I 2024-12-04 14:47:01,279] Trial 90 finished with value: 0.652852683530227 and parameters: {'n_estimators': 134, 'max_depth': 40, 'min_samples_split': 38, 'min_samples_leaf': 6, 'max_features': None, 'bootstrap': True, 'criterion': 'squared_error'}. Best is trial 92 with value: 0.42099440235797364.
[I 2024-12-04 14:47:02,936] Trial 83 finished with value: 0.5159869956243264 and parameters: {'n_estimators': 180, 'max_depth': 39, 'min_samples_split': 27, 'min_samples_leaf': 2, 'max_features': None, 'bootstrap': True, 'criterion': 'absolute_error'}. Best is trial 92 with value: 0.42099440235797364.
[I 2024-12-04 14:47:02,936] Trial 101 finished with value: 0.48116132123032634 and parameters: {'n_estimators': 112, 'max_depth': 49, 'min_samples_split': 22, 'min_samples_leaf': 1, 'max_features': None, 'bootstrap': True, 'criterion': 'squared_error'}. Best is trial 92 with value: 0.42099440235797364.
[I 2024-12-04 14:47:03,001] Trial 95 finished with value: 0.4746696320316154 and parameters: {'n_estimators': 552, 'max_depth': 47, 'min_samples_split': 2, 'min_samples_leaf': 1, 'max_features': 'sqrt', 'bootstrap': False, 'criterion': 'squared_error'}. Best is trial 92 with value: 0.42099440235797364.
[I 2024-12-04 14:47:06,549] Trial 100 finished with value: 0.5291536483254592 and parameters: {'n_estimators': 241, 'max_depth': 35, 'min_samples_split': 21, 'min_samples_leaf': 3, 'max_features': None, 'bootstrap': True, 'criterion': 'squared_error'}. Best is trial 92 with value: 0.42099440235797364.
[I 2024-12-04 14:47:08,470] Trial 105 finished with value: 0.427602633208183 and parameters: {'n_estimators': 133, 'max_depth': 46, 'min_samples_split': 3, 'min_samples_leaf': 1, 'max_features': None, 'bootstrap': True, 'criterion': 'squared_error'}. Best is trial 92 with value: 0.42099440235797364.
[I 2024-12-04 14:47:08,572] Trial 96 finished with value: 0.5221372363539178 and parameters: {'n_estimators': 252, 'max_depth': 40, 'min_samples_split': 17, 'min_samples_leaf': 3, 'max_features': None, 'bootstrap': True, 'criterion': 'squared_error'}. Best is trial 92 with value: 0.42099440235797364.
[I 2024-12-04 14:47:09,040] Trial 70 finished with value: 0.5933509251319746 and parameters: {'n_estimators': 198, 'max_depth': 35, 'min_samples_split': 28, 'min_samples_leaf': 2, 'max_features': None, 'bootstrap': False, 'criterion': 'absolute_error'}. Best is trial 92 with value: 0.42099440235797364.
[I 2024-12-04 14:47:10,457] Trial 72 finished with value: 0.445674007765031 and parameters: {'n_estimators': 270, 'max_depth': 40, 'min_samples_split': 10, 'min_samples_leaf': 1, 'max_features': None, 'bootstrap': True, 'criterion': 'absolute_error'}. Best is trial 92 with value: 0.42099440235797364.
[I 2024-12-04 14:47:10,460] Trial 102 finished with value: 0.5297309965752531 and parameters: {'n_estimators': 152, 'max_depth': 16, 'min_samples_split': 3, 'min_samples_leaf': 3, 'max_features': None, 'bootstrap': True, 'criterion': 'absolute_error'}. Best is trial 92 with value: 0.42099440235797364.
[I 2024-12-04 14:47:11,327] Trial 25 finished with value: 0.7478527217695664 and parameters: {'n_estimators': 594, 'max_depth': 5, 'min_samples_split': 8, 'min_samples_leaf': 1, 'max_features': None, 'bootstrap': False, 'criterion': 'absolute_error'}. Best is trial 92 with value: 0.42099440235797364.
[I 2024-12-04 14:47:14,602] Trial 107 finished with value: 0.5108031185653428 and parameters: {'n_estimators': 144, 'max_depth': 43, 'min_samples_split': 3, 'min_samples_leaf': 1, 'max_features': None, 'bootstrap': False, 'criterion': 'squared_error'}. Best is trial 92 with value: 0.42099440235797364.
[I 2024-12-04 14:47:15,508] Trial 94 finished with value: 0.5925928983964637 and parameters: {'n_estimators': 137, 'max_depth': 31, 'min_samples_split': 3, 'min_samples_leaf': 3, 'max_features': None, 'bootstrap': False, 'criterion': 'absolute_error'}. Best is trial 92 with value: 0.42099440235797364.
[I 2024-12-04 14:47:15,728] Trial 109 finished with value: 0.4299808501340297 and parameters: {'n_estimators': 180, 'max_depth': 30, 'min_samples_split': 3, 'min_samples_leaf': 1, 'max_features': None, 'bootstrap': True, 'criterion': 'squared_error'}. Best is trial 92 with value: 0.42099440235797364.
[I 2024-12-04 14:47:18,063] Trial 117 finished with value: 0.42515685461387864 and parameters: {'n_estimators': 190, 'max_depth': 50, 'min_samples_split': 2, 'min_samples_leaf': 1, 'max_features': None, 'bootstrap': True, 'criterion': 'squared_error'}. Best is trial 92 with value: 0.42099440235797364.
[I 2024-12-04 14:47:18,076] Trial 108 finished with value: 0.42754113587079506 and parameters: {'n_estimators': 330, 'max_depth': 33, 'min_samples_split': 3, 'min_samples_leaf': 1, 'max_features': None, 'bootstrap': True, 'criterion': 'squared_error'}. Best is trial 92 with value: 0.42099440235797364.
[I 2024-12-04 14:47:18,089] Trial 97 finished with value: 0.532955979742826 and parameters: {'n_estimators': 261, 'max_depth': 15, 'min_samples_split': 2, 'min_samples_leaf': 3, 'max_features': None, 'bootstrap': True, 'criterion': 'absolute_error'}. Best is trial 92 with value: 0.42099440235797364.
[I 2024-12-04 14:47:18,113] Trial 113 finished with value: 0.5944696206936151 and parameters: {'n_estimators': 310, 'max_depth': 47, 'min_samples_split': 3, 'min_samples_leaf': 1, 'max_features': 'log2', 'bootstrap': True, 'criterion': 'squared_error'}. Best is trial 92 with value: 0.42099440235797364.
[I 2024-12-04 14:47:18,519] Trial 112 finished with value: 0.5115221006656753 and parameters: {'n_estimators': 156, 'max_depth': 37, 'min_samples_split': 2, 'min_samples_leaf': 1, 'max_features': 'sqrt', 'bootstrap': True, 'criterion': 'squared_error'}. Best is trial 92 with value: 0.42099440235797364.
[I 2024-12-04 14:47:18,520] Trial 103 finished with value: 0.4282982244840541 and parameters: {'n_estimators': 281, 'max_depth': 32, 'min_samples_split': 3, 'min_samples_leaf': 1, 'max_features': None, 'bootstrap': True, 'criterion': 'squared_error'}. Best is trial 92 with value: 0.42099440235797364.
[I 2024-12-04 14:47:18,575] Trial 98 finished with value: 0.4435431485583178 and parameters: {'n_estimators': 182, 'max_depth': 25, 'min_samples_split': 2, 'min_samples_leaf': 1, 'max_features': None, 'bootstrap': True, 'criterion': 'absolute_error'}. Best is trial 92 with value: 0.42099440235797364.
[I 2024-12-04 14:47:18,957] Trial 111 finished with value: 0.4240595470888071 and parameters: {'n_estimators': 491, 'max_depth': 33, 'min_samples_split': 2, 'min_samples_leaf': 1, 'max_features': None, 'bootstrap': True, 'criterion': 'squared_error'}. Best is trial 92 with value: 0.42099440235797364.
[I 2024-12-04 14:47:19,256] Trial 26 finished with value: 0.5827205163526853 and parameters: {'n_estimators': 536, 'max_depth': 16, 'min_samples_split': 4, 'min_samples_leaf': 1, 'max_features': None, 'bootstrap': False, 'criterion': 'absolute_error'}. Best is trial 92 with value: 0.42099440235797364.
[I 2024-12-04 14:47:21,045] Trial 110 finished with value: 0.4223501085824871 and parameters: {'n_estimators': 460, 'max_depth': 38, 'min_samples_split': 2, 'min_samples_leaf': 1, 'max_features': None, 'bootstrap': True, 'criterion': 'squared_error'}. Best is trial 92 with value: 0.42099440235797364.
[I 2024-12-04 14:47:21,491] Trial 106 finished with value: 0.4227467676683932 and parameters: {'n_estimators': 531, 'max_depth': 48, 'min_samples_split': 2, 'min_samples_leaf': 1, 'max_features': None, 'bootstrap': True, 'criterion': 'squared_error'}. Best is trial 92 with value: 0.42099440235797364.
[I 2024-12-04 14:47:22,620] Trial 118 finished with value: 0.9716958418814002 and parameters: {'n_estimators': 223, 'max_depth': 32, 'min_samples_split': 2, 'min_samples_leaf': 2, 'max_features': 'log2', 'bootstrap': True, 'criterion': 'absolute_error'}. Best is trial 92 with value: 0.42099440235797364.
[I 2024-12-04 14:47:23,853] Trial 104 finished with value: 0.42082808954956263 and parameters: {'n_estimators': 798, 'max_depth': 31, 'min_samples_split': 2, 'min_samples_leaf': 1, 'max_features': None, 'bootstrap': True, 'criterion': 'squared_error'}. Best is trial 104 with value: 0.42082808954956263.
[I 2024-12-04 14:47:24,640] Trial 114 finished with value: 0.522500105049337 and parameters: {'n_estimators': 237, 'max_depth': 45, 'min_samples_split': 3, 'min_samples_leaf': 1, 'max_features': 'sqrt', 'bootstrap': True, 'criterion': 'absolute_error'}. Best is trial 115 with value: 0.4201866544365906.
[I 2024-12-04 14:47:25,278] Trial 84 finished with value: 0.5285349499459701 and parameters: {'n_estimators': 769, 'max_depth': 50, 'min_samples_split': 7, 'min_samples_leaf': 1, 'max_features': 'sqrt', 'bootstrap': False, 'criterion': 'absolute_error'}. Best is trial 115 with value: 0.4201866544365906.
[I 2024-12-04 14:47:25,378] Trial 115 finished with value: 0.4201866544365906 and parameters: {'n_estimators': 258, 'max_depth': 41, 'min_samples_split': 2, 'min_samples_leaf': 1, 'max_features': None, 'bootstrap': True, 'criterion': 'squared_error'}. Best is trial 115 with value: 0.4201866544365906.
[I 2024-12-04 14:47:26,746] Trial 125 finished with value: 0.43910031091991236 and parameters: {'n_estimators': 282, 'max_depth': 46, 'min_samples_split': 5, 'min_samples_leaf': 1, 'max_features': None, 'bootstrap': True, 'criterion': 'squared_error'}. Best is trial 115 with value: 0.4201866544365906.
[I 2024-12-04 14:47:28,359] Trial 127 finished with value: 0.4380874611239819 and parameters: {'n_estimators': 353, 'max_depth': 33, 'min_samples_split': 6, 'min_samples_leaf': 1, 'max_features': None, 'bootstrap': True, 'criterion': 'squared_error'}. Best is trial 115 with value: 0.4201866544365906.
[I 2024-12-04 14:47:29,629] Trial 119 finished with value: 0.5223392219119658 and parameters: {'n_estimators': 210, 'max_depth': 46, 'min_samples_split': 2, 'min_samples_leaf': 3, 'max_features': None, 'bootstrap': True, 'criterion': 'absolute_error'}. Best is trial 115 with value: 0.4201866544365906.
[I 2024-12-04 14:47:30,230] Trial 123 finished with value: 0.42486188323539864 and parameters: {'n_estimators': 290, 'max_depth': 50, 'min_samples_split': 2, 'min_samples_leaf': 1, 'max_features': None, 'bootstrap': True, 'criterion': 'squared_error'}. Best is trial 115 with value: 0.4201866544365906.
[I 2024-12-04 14:47:34,470] Trial 116 finished with value: 0.42742705355248783 and parameters: {'n_estimators': 432, 'max_depth': 31, 'min_samples_split': 3, 'min_samples_leaf': 1, 'max_features': None, 'bootstrap': True, 'criterion': 'squared_error'}. Best is trial 115 with value: 0.4201866544365906.
[I 2024-12-04 14:47:34,472] Trial 128 finished with value: 0.4272211637994269 and parameters: {'n_estimators': 386, 'max_depth': 32, 'min_samples_split': 3, 'min_samples_leaf': 1, 'max_features': None, 'bootstrap': True, 'criterion': 'squared_error'}. Best is trial 115 with value: 0.4201866544365906.
[I 2024-12-04 14:47:36,240] Trial 130 finished with value: 0.42645842380371235 and parameters: {'n_estimators': 129, 'max_depth': 46, 'min_samples_split': 3, 'min_samples_leaf': 1, 'max_features': None, 'bootstrap': True, 'criterion': 'squared_error'}. Best is trial 115 with value: 0.4201866544365906.
[I 2024-12-04 14:47:36,866] Trial 133 finished with value: 0.42425906449167416 and parameters: {'n_estimators': 131, 'max_depth': 45, 'min_samples_split': 2, 'min_samples_leaf': 1, 'max_features': None, 'bootstrap': True, 'criterion': 'squared_error'}. Best is trial 115 with value: 0.4201866544365906.
[I 2024-12-04 14:47:40,229] Trial 129 finished with value: 0.4650423339553105 and parameters: {'n_estimators': 603, 'max_depth': 38, 'min_samples_split': 2, 'min_samples_leaf': 2, 'max_features': None, 'bootstrap': True, 'criterion': 'squared_error'}. Best is trial 115 with value: 0.4201866544365906.
[I 2024-12-04 14:47:40,243] Trial 126 finished with value: 0.5275710690967244 and parameters: {'n_estimators': 516, 'max_depth': 40, 'min_samples_split': 2, 'min_samples_leaf': 1, 'max_features': None, 'bootstrap': False, 'criterion': 'squared_error'}. Best is trial 115 with value: 0.4201866544365906.
[I 2024-12-04 14:47:41,875] Trial 132 finished with value: 0.4202237154673795 and parameters: {'n_estimators': 400, 'max_depth': 41, 'min_samples_split': 2, 'min_samples_leaf': 1, 'max_features': None, 'bootstrap': True, 'criterion': 'squared_error'}. Best is trial 115 with value: 0.4201866544365906.
[I 2024-12-04 14:47:43,887] Trial 124 finished with value: 0.421541790838095 and parameters: {'n_estimators': 563, 'max_depth': 48, 'min_samples_split': 2, 'min_samples_leaf': 1, 'max_features': None, 'bootstrap': True, 'criterion': 'squared_error'}. Best is trial 115 with value: 0.4201866544365906.
[I 2024-12-04 14:47:44,627] Trial 121 finished with value: 0.4421762565213721 and parameters: {'n_estimators': 189, 'max_depth': 42, 'min_samples_split': 8, 'min_samples_leaf': 1, 'max_features': None, 'bootstrap': True, 'criterion': 'absolute_error'}. Best is trial 115 with value: 0.4201866544365906.
[I 2024-12-04 14:47:44,671] Trial 143 finished with value: 0.4270562209541543 and parameters: {'n_estimators': 148, 'max_depth': 48, 'min_samples_split': 3, 'min_samples_leaf': 1, 'max_features': None, 'bootstrap': True, 'criterion': 'squared_error'}. Best is trial 115 with value: 0.4201866544365906.
[I 2024-12-04 14:47:45,241] Trial 139 finished with value: 0.7040736401542231 and parameters: {'n_estimators': 500, 'max_depth': 29, 'min_samples_split': 2, 'min_samples_leaf': 1, 'max_features': 'log2', 'bootstrap': True, 'criterion': 'squared_error'}. Best is trial 115 with value: 0.4201866544365906.
[I 2024-12-04 14:47:46,180] Trial 137 finished with value: 0.4245659137710615 and parameters: {'n_estimators': 302, 'max_depth': 50, 'min_samples_split': 2, 'min_samples_leaf': 1, 'max_features': None, 'bootstrap': True, 'criterion': 'squared_error'}. Best is trial 115 with value: 0.4201866544365906.
[I 2024-12-04 14:47:46,226] Trial 136 finished with value: 0.43030085254151873 and parameters: {'n_estimators': 593, 'max_depth': 22, 'min_samples_split': 2, 'min_samples_leaf': 1, 'max_features': None, 'bootstrap': True, 'criterion': 'squared_error'}. Best is trial 115 with value: 0.4201866544365906.
[I 2024-12-04 14:47:46,242] Trial 138 finished with value: 0.421313459055674 and parameters: {'n_estimators': 340, 'max_depth': 48, 'min_samples_split': 2, 'min_samples_leaf': 1, 'max_features': None, 'bootstrap': True, 'criterion': 'squared_error'}. Best is trial 115 with value: 0.4201866544365906.
[I 2024-12-04 14:47:47,150] Trial 141 finished with value: 0.6972718069053381 and parameters: {'n_estimators': 563, 'max_depth': 35, 'min_samples_split': 3, 'min_samples_leaf': 2, 'max_features': 'sqrt', 'bootstrap': True, 'criterion': 'squared_error'}. Best is trial 122 with value: 0.41989619919923427.
[I 2024-12-04 14:47:48,093] Trial 135 finished with value: 0.5934002667274871 and parameters: {'n_estimators': 747, 'max_depth': 46, 'min_samples_split': 2, 'min_samples_leaf': 1, 'max_features': 'log2', 'bootstrap': True, 'criterion': 'squared_error'}. Best is trial 122 with value: 0.41989619919923427.
[I 2024-12-04 14:47:48,540] Trial 122 finished with value: 0.41989619919923427 and parameters: {'n_estimators': 790, 'max_depth': 41, 'min_samples_split': 2, 'min_samples_leaf': 1, 'max_features': None, 'bootstrap': True, 'criterion': 'squared_error'}. Best is trial 122 with value: 0.41989619919923427.
[I 2024-12-04 14:47:48,612] Trial 144 finished with value: 0.46650222402583763 and parameters: {'n_estimators': 389, 'max_depth': 46, 'min_samples_split': 3, 'min_samples_leaf': 2, 'max_features': None, 'bootstrap': True, 'criterion': 'squared_error'}. Best is trial 122 with value: 0.41989619919923427.
[I 2024-12-04 14:47:49,575] Trial 146 finished with value: 0.42443428705657693 and parameters: {'n_estimators': 184, 'max_depth': 44, 'min_samples_split': 2, 'min_samples_leaf': 1, 'max_features': None, 'bootstrap': True, 'criterion': 'squared_error'}. Best is trial 122 with value: 0.41989619919923427.
[I 2024-12-04 14:47:50,111] Trial 140 finished with value: 0.6061615238331377 and parameters: {'n_estimators': 944, 'max_depth': 32, 'min_samples_split': 2, 'min_samples_leaf': 2, 'max_features': None, 'bootstrap': False, 'criterion': 'squared_error'}. Best is trial 122 with value: 0.41989619919923427.
[I 2024-12-04 14:47:51,043] Trial 149 finished with value: 0.9551895434598747 and parameters: {'n_estimators': 593, 'max_depth': 7, 'min_samples_split': 3, 'min_samples_leaf': 5, 'max_features': 'sqrt', 'bootstrap': True, 'criterion': 'squared_error'}. Best is trial 122 with value: 0.41989619919923427.
[I 2024-12-04 14:47:52,145] Trial 134 finished with value: 0.4949472555839941 and parameters: {'n_estimators': 514, 'max_depth': 45, 'min_samples_split': 2, 'min_samples_leaf': 1, 'max_features': 'sqrt', 'bootstrap': True, 'criterion': 'squared_error'}. Best is trial 122 with value: 0.41989619919923427.
[I 2024-12-04 14:47:53,535] Trial 131 finished with value: 0.4327890850621077 and parameters: {'n_estimators': 943, 'max_depth': 32, 'min_samples_split': 4, 'min_samples_leaf': 1, 'max_features': None, 'bootstrap': True, 'criterion': 'squared_error'}. Best is trial 122 with value: 0.41989619919923427.
