[I 2024-12-04 12:57:24,039] Trial 1205 finished with value: 0.2524060636942403 and parameters: {'n_estimators': 1223, 'learning_rate': 0.08935051269111197, 'max_depth': 9, 'min_samples_split': 4, 'min_samples_leaf': 1, 'subsample': 0.8070037580324626, 'max_features': 'sqrt'}. Best is trial 621 with value: 0.2256726988932517.
[I 2024-12-04 12:57:24,090] Trial 1203 finished with value: 0.2863525645372187 and parameters: {'n_estimators': 1360, 'learning_rate': 0.06837283108879061, 'max_depth': 9, 'min_samples_split': 2, 'min_samples_leaf': 2, 'subsample': 0.8138522943682741, 'max_features': 'sqrt'}. Best is trial 621 with value: 0.2256726988932517.
[I 2024-12-04 12:57:25,880] Trial 1227 finished with value: 0.4280431150090535 and parameters: {'n_estimators': 364, 'learning_rate': 0.01595613838947019, 'max_depth': 11, 'min_samples_split': 14, 'min_samples_leaf': 4, 'subsample': 0.6674926601301254, 'max_features': None}. Best is trial 621 with value: 0.2256726988932517.
[I 2024-12-04 12:57:28,500] Trial 1209 finished with value: 0.36431386305189695 and parameters: {'n_estimators': 1153, 'learning_rate': 0.08813683721928744, 'max_depth': 7, 'min_samples_split': 5, 'min_samples_leaf': 3, 'subsample': 0.8305068665125681, 'max_features': 'sqrt'}. Best is trial 621 with value: 0.2256726988932517.
[I 2024-12-04 12:57:29,602] Trial 1207 finished with value: 0.23126795109804577 and parameters: {'n_estimators': 1229, 'learning_rate': 0.07087106370480119, 'max_depth': 7, 'min_samples_split': 4, 'min_samples_leaf': 1, 'subsample': 0.854870672106577, 'max_features': 'sqrt'}. Best is trial 621 with value: 0.2256726988932517.
[I 2024-12-04 12:57:34,831] Trial 1213 finished with value: 0.4258385223990899 and parameters: {'n_estimators': 874, 'learning_rate': 0.019300192192023412, 'max_depth': 7, 'min_samples_split': 13, 'min_samples_leaf': 5, 'subsample': 0.7569653873552745, 'max_features': None}. Best is trial 621 with value: 0.2256726988932517.
[I 2024-12-04 12:57:34,940] Trial 1208 finished with value: 0.2837005037753276 and parameters: {'n_estimators': 1299, 'learning_rate': 0.07120561282099941, 'max_depth': 8, 'min_samples_split': 2, 'min_samples_leaf': 2, 'subsample': 0.7722575024307254, 'max_features': 'sqrt'}. Best is trial 621 with value: 0.2256726988932517.
[I 2024-12-04 12:57:41,284] Trial 1206 finished with value: 0.29608698002074235 and parameters: {'n_estimators': 1496, 'learning_rate': 0.03950523741375998, 'max_depth': 8, 'min_samples_split': 4, 'min_samples_leaf': 2, 'subsample': 0.6690519288207308, 'max_features': 'sqrt'}. Best is trial 621 with value: 0.2256726988932517.
[I 2024-12-04 12:57:41,453] Trial 1219 finished with value: 0.5511298740952454 and parameters: {'n_estimators': 892, 'learning_rate': 0.010556746901948398, 'max_depth': 10, 'min_samples_split': 11, 'min_samples_leaf': 1, 'subsample': 0.7884906806103233, 'max_features': 'log2'}. Best is trial 621 with value: 0.2256726988932517.
[I 2024-12-04 12:57:44,218] Trial 1211 finished with value: 0.28972876003999537 and parameters: {'n_estimators': 1383, 'learning_rate': 0.09933134485582537, 'max_depth': 7, 'min_samples_split': 8, 'min_samples_leaf': 2, 'subsample': 0.7483745280356886, 'max_features': 'sqrt'}. Best is trial 621 with value: 0.2256726988932517.
[I 2024-12-04 12:57:45,896] Trial 1210 finished with value: 0.23857605344221605 and parameters: {'n_estimators': 1425, 'learning_rate': 0.08969101579786816, 'max_depth': 8, 'min_samples_split': 5, 'min_samples_leaf': 1, 'subsample': 0.8477316717988175, 'max_features': 'sqrt'}. Best is trial 621 with value: 0.2256726988932517.
[I 2024-12-04 12:57:48,258] Trial 1220 finished with value: 0.25800157391844414 and parameters: {'n_estimators': 1009, 'learning_rate': 0.07037883839394808, 'max_depth': 8, 'min_samples_split': 6, 'min_samples_leaf': 1, 'subsample': 0.6757684336945489, 'max_features': 'sqrt'}. Best is trial 621 with value: 0.2256726988932517.
[I 2024-12-04 12:57:54,529] Trial 1218 finished with value: 0.24520148859289578 and parameters: {'n_estimators': 1141, 'learning_rate': 0.09726577241395118, 'max_depth': 10, 'min_samples_split': 5, 'min_samples_leaf': 1, 'subsample': 0.8871712250401691, 'max_features': 'sqrt'}. Best is trial 621 with value: 0.2256726988932517.
[I 2024-12-04 12:57:55,886] Trial 1215 finished with value: 0.2862235394401939 and parameters: {'n_estimators': 1281, 'learning_rate': 0.09180837527560892, 'max_depth': 7, 'min_samples_split': 5, 'min_samples_leaf': 2, 'subsample': 0.8144185582688527, 'max_features': 'sqrt'}. Best is trial 621 with value: 0.2256726988932517.
[I 2024-12-04 12:57:57,064] Trial 1217 finished with value: 0.25198473309193065 and parameters: {'n_estimators': 1217, 'learning_rate': 0.09085864731148374, 'max_depth': 6, 'min_samples_split': 7, 'min_samples_leaf': 1, 'subsample': 0.7975434040851876, 'max_features': 'sqrt'}. Best is trial 621 with value: 0.2256726988932517.
[I 2024-12-04 12:57:58,650] Trial 1214 finished with value: 0.2935647547535191 and parameters: {'n_estimators': 1376, 'learning_rate': 0.05178754688633359, 'max_depth': 7, 'min_samples_split': 4, 'min_samples_leaf': 2, 'subsample': 0.7073821056565774, 'max_features': 'sqrt'}. Best is trial 621 with value: 0.2256726988932517.
[I 2024-12-04 12:57:59,084] Trial 1223 finished with value: 0.9947374225214856 and parameters: {'n_estimators': 1065, 'learning_rate': 0.014843121092564825, 'max_depth': 7, 'min_samples_split': 20, 'min_samples_leaf': 10, 'subsample': 0.985974451666618, 'max_features': 'log2'}. Best is trial 621 with value: 0.2256726988932517.
[I 2024-12-04 12:58:05,099] Trial 1216 finished with value: 0.23693628691584498 and parameters: {'n_estimators': 1387, 'learning_rate': 0.07516514665819683, 'max_depth': 9, 'min_samples_split': 6, 'min_samples_leaf': 1, 'subsample': 0.7475612889206297, 'max_features': 'sqrt'}. Best is trial 621 with value: 0.2256726988932517.
[I 2024-12-04 12:58:09,292] Trial 1221 finished with value: 0.25326073658914544 and parameters: {'n_estimators': 1268, 'learning_rate': 0.06042044622447629, 'max_depth': 8, 'min_samples_split': 4, 'min_samples_leaf': 1, 'subsample': 0.7636156404788279, 'max_features': 'sqrt'}. Best is trial 621 with value: 0.2256726988932517.
[I 2024-12-04 12:58:12,336] Trial 1224 finished with value: 0.9195273894313818 and parameters: {'n_estimators': 1146, 'learning_rate': 0.011713062249757843, 'max_depth': 6, 'min_samples_split': 4, 'min_samples_leaf': 5, 'subsample': 0.6235034903925682, 'max_features': 'log2'}. Best is trial 621 with value: 0.2256726988932517.
[I 2024-12-04 12:58:15,098] Trial 1233 finished with value: 0.3644908915263219 and parameters: {'n_estimators': 975, 'learning_rate': 0.06303078524881767, 'max_depth': 12, 'min_samples_split': 4, 'min_samples_leaf': 4, 'subsample': 0.6359100505576759, 'max_features': 'sqrt'}. Best is trial 621 with value: 0.2256726988932517.
[I 2024-12-04 12:58:20,730] Trial 1235 finished with value: 0.26420072576275366 and parameters: {'n_estimators': 992, 'learning_rate': 0.09761424413001112, 'max_depth': 7, 'min_samples_split': 7, 'min_samples_leaf': 1, 'subsample': 0.7441544378699229, 'max_features': 'sqrt'}. Best is trial 621 with value: 0.2256726988932517.
[I 2024-12-04 12:58:22,642] Trial 1222 finished with value: 0.27683247092808416 and parameters: {'n_estimators': 1496, 'learning_rate': 0.05327048490568904, 'max_depth': 7, 'min_samples_split': 2, 'min_samples_leaf': 2, 'subsample': 0.7204086398047125, 'max_features': 'sqrt'}. Best is trial 621 with value: 0.2256726988932517.
[I 2024-12-04 12:58:24,923] Trial 1245 finished with value: 0.2897648651180889 and parameters: {'n_estimators': 569, 'learning_rate': 0.08897547528913678, 'max_depth': 7, 'min_samples_split': 8, 'min_samples_leaf': 2, 'subsample': 0.849622504069793, 'max_features': 'sqrt'}. Best is trial 621 with value: 0.2256726988932517.
[I 2024-12-04 12:58:27,748] Trial 1225 finished with value: 0.34542575044179646 and parameters: {'n_estimators': 1470, 'learning_rate': 0.0825733830759233, 'max_depth': 6, 'min_samples_split': 7, 'min_samples_leaf': 3, 'subsample': 0.7279144949346813, 'max_features': 'sqrt'}. Best is trial 621 with value: 0.2256726988932517.
[I 2024-12-04 12:58:27,797] Trial 1254 finished with value: 0.8252969161980915 and parameters: {'n_estimators': 336, 'learning_rate': 0.032919485991786186, 'max_depth': 12, 'min_samples_split': 7, 'min_samples_leaf': 4, 'subsample': 0.9391813715230231, 'max_features': 'log2'}. Best is trial 621 with value: 0.2256726988932517.
[I 2024-12-04 12:58:29,576] Trial 1238 finished with value: 0.4632051538090701 and parameters: {'n_estimators': 948, 'learning_rate': 0.05233698714537168, 'max_depth': 7, 'min_samples_split': 2, 'min_samples_leaf': 10, 'subsample': 0.9498897866343552, 'max_features': 'sqrt'}. Best is trial 621 with value: 0.2256726988932517.
[I 2024-12-04 12:58:32,265] Trial 1226 finished with value: 0.3659614916407359 and parameters: {'n_estimators': 1408, 'learning_rate': 0.07289240086474234, 'max_depth': 6, 'min_samples_split': 2, 'min_samples_leaf': 3, 'subsample': 0.8091743432946646, 'max_features': 'sqrt'}. Best is trial 621 with value: 0.2256726988932517.
[I 2024-12-04 12:58:35,169] Trial 1236 finished with value: 0.3042150712236111 and parameters: {'n_estimators': 1120, 'learning_rate': 0.06290030635669053, 'max_depth': 9, 'min_samples_split': 5, 'min_samples_leaf': 2, 'subsample': 0.6062437400418352, 'max_features': 'sqrt'}. Best is trial 621 with value: 0.2256726988932517.
[I 2024-12-04 12:58:35,172] Trial 1231 finished with value: 0.2817111806472565 and parameters: {'n_estimators': 1383, 'learning_rate': 0.09618261858569824, 'max_depth': 8, 'min_samples_split': 4, 'min_samples_leaf': 2, 'subsample': 0.8145525115156123, 'max_features': 'sqrt'}. Best is trial 621 with value: 0.2256726988932517.
[I 2024-12-04 12:58:37,198] Trial 1230 finished with value: 0.319487280269426 and parameters: {'n_estimators': 1268, 'learning_rate': 0.09105697804494542, 'max_depth': 7, 'min_samples_split': 2, 'min_samples_leaf': 1, 'subsample': 0.6495820746970494, 'max_features': None}. Best is trial 621 with value: 0.2256726988932517.
[I 2024-12-04 12:58:42,198] Trial 1232 finished with value: 0.29078943115775713 and parameters: {'n_estimators': 1430, 'learning_rate': 0.09502856393253051, 'max_depth': 8, 'min_samples_split': 2, 'min_samples_leaf': 2, 'subsample': 0.6874728593911414, 'max_features': 'sqrt'}. Best is trial 621 with value: 0.2256726988932517.
[I 2024-12-04 12:58:44,602] Trial 1234 finished with value: 0.22944440381438647 and parameters: {'n_estimators': 1385, 'learning_rate': 0.09420970477780188, 'max_depth': 6, 'min_samples_split': 2, 'min_samples_leaf': 1, 'subsample': 0.723710187835946, 'max_features': 'sqrt'}. Best is trial 621 with value: 0.2256726988932517.
[I 2024-12-04 12:58:44,915] Trial 1229 finished with value: 0.2901541015423571 and parameters: {'n_estimators': 1490, 'learning_rate': 0.09150971418189634, 'max_depth': 8, 'min_samples_split': 4, 'min_samples_leaf': 2, 'subsample': 0.8217075776707791, 'max_features': 'sqrt'}. Best is trial 621 with value: 0.2256726988932517.
[I 2024-12-04 12:58:46,129] Trial 1239 finished with value: 0.27933072243241824 and parameters: {'n_estimators': 1160, 'learning_rate': 0.08244691921900528, 'max_depth': 12, 'min_samples_split': 2, 'min_samples_leaf': 2, 'subsample': 0.6290000384221949, 'max_features': 'log2'}. Best is trial 621 with value: 0.2256726988932517.
[I 2024-12-04 12:58:52,443] Trial 1246 finished with value: 0.3704550445633872 and parameters: {'n_estimators': 1048, 'learning_rate': 0.02864435925544287, 'max_depth': 8, 'min_samples_split': 17, 'min_samples_leaf': 4, 'subsample': 0.6054559738892363, 'max_features': 'sqrt'}. Best is trial 621 with value: 0.2256726988932517.
[I 2024-12-04 12:58:55,339] Trial 1243 finished with value: 0.2488326438944599 and parameters: {'n_estimators': 1211, 'learning_rate': 0.05752622328670274, 'max_depth': 6, 'min_samples_split': 4, 'min_samples_leaf': 1, 'subsample': 0.8593464993094018, 'max_features': 'sqrt'}. Best is trial 621 with value: 0.2256726988932517.
[I 2024-12-04 12:58:57,163] Trial 1260 finished with value: 0.7710339014284653 and parameters: {'n_estimators': 479, 'learning_rate': 0.06318142027914789, 'max_depth': 6, 'min_samples_split': 7, 'min_samples_leaf': 8, 'subsample': 0.7646926117899444, 'max_features': 'log2'}. Best is trial 621 with value: 0.2256726988932517.
[I 2024-12-04 12:59:00,095] Trial 1237 finished with value: 0.243193443149803 and parameters: {'n_estimators': 1496, 'learning_rate': 0.05102767433562013, 'max_depth': 7, 'min_samples_split': 4, 'min_samples_leaf': 1, 'subsample': 0.802381408544889, 'max_features': 'sqrt'}. Best is trial 621 with value: 0.2256726988932517.
[I 2024-12-04 12:59:00,738] Trial 1240 finished with value: 0.24945481695691823 and parameters: {'n_estimators': 1408, 'learning_rate': 0.08211585634432796, 'max_depth': 7, 'min_samples_split': 6, 'min_samples_leaf': 1, 'subsample': 0.8969313534002068, 'max_features': 'log2'}. Best is trial 621 with value: 0.2256726988932517.
[I 2024-12-04 12:59:05,734] Trial 1241 finished with value: 0.23910822893471295 and parameters: {'n_estimators': 1404, 'learning_rate': 0.06219288003219275, 'max_depth': 8, 'min_samples_split': 5, 'min_samples_leaf': 1, 'subsample': 0.6819104613572433, 'max_features': 'sqrt'}. Best is trial 621 with value: 0.2256726988932517.
[I 2024-12-04 12:59:06,642] Trial 1242 finished with value: 0.2689605875241831 and parameters: {'n_estimators': 1424, 'learning_rate': 0.06934182627386326, 'max_depth': 6, 'min_samples_split': 8, 'min_samples_leaf': 1, 'subsample': 0.7562109850563468, 'max_features': 'sqrt'}. Best is trial 621 with value: 0.2256726988932517.
[I 2024-12-04 12:59:08,215] Trial 1262 finished with value: 0.504255226845578 and parameters: {'n_estimators': 542, 'learning_rate': 0.0406186805849919, 'max_depth': 10, 'min_samples_split': 14, 'min_samples_leaf': 8, 'subsample': 0.6493066014415, 'max_features': 'sqrt'}. Best is trial 621 with value: 0.2256726988932517.
[I 2024-12-04 12:59:12,062] Trial 1247 finished with value: 0.2863755610459101 and parameters: {'n_estimators': 1283, 'learning_rate': 0.09673478684299483, 'max_depth': 8, 'min_samples_split': 5, 'min_samples_leaf': 2, 'subsample': 0.7748916904664299, 'max_features': 'sqrt'}. Best is trial 621 with value: 0.2256726988932517.
[I 2024-12-04 12:59:13,844] Trial 1244 finished with value: 0.2694991883127885 and parameters: {'n_estimators': 1469, 'learning_rate': 0.07021766829984452, 'max_depth': 6, 'min_samples_split': 5, 'min_samples_leaf': 1, 'subsample': 0.8030609852332505, 'max_features': 'sqrt'}. Best is trial 621 with value: 0.2256726988932517.
[I 2024-12-04 12:59:18,852] Trial 1249 finished with value: 0.24680432705578684 and parameters: {'n_estimators': 1372, 'learning_rate': 0.07601464368448815, 'max_depth': 6, 'min_samples_split': 7, 'min_samples_leaf': 1, 'subsample': 0.8296170113565094, 'max_features': 'sqrt'}. Best is trial 621 with value: 0.2256726988932517.
[I 2024-12-04 12:59:20,528] Trial 1270 finished with value: 0.6886827382209362 and parameters: {'n_estimators': 445, 'learning_rate': 0.011971540185962344, 'max_depth': 5, 'min_samples_split': 7, 'min_samples_leaf': 1, 'subsample': 0.6221485590759228, 'max_features': 'sqrt'}. Best is trial 621 with value: 0.2256726988932517.
[I 2024-12-04 12:59:21,421] Trial 1257 finished with value: 0.3043483139634938 and parameters: {'n_estimators': 1055, 'learning_rate': 0.08555262370778798, 'max_depth': 7, 'min_samples_split': 8, 'min_samples_leaf': 1, 'subsample': 0.8228796442408434, 'max_features': 'log2'}. Best is trial 621 with value: 0.2256726988932517.
[I 2024-12-04 12:59:22,767] Trial 1252 finished with value: 0.29862706148816476 and parameters: {'n_estimators': 1243, 'learning_rate': 0.07309334868250066, 'max_depth': 12, 'min_samples_split': 4, 'min_samples_leaf': 2, 'subsample': 0.6421904098919559, 'max_features': 'sqrt'}. Best is trial 621 with value: 0.2256726988932517.
[I 2024-12-04 12:59:23,084] Trial 1251 finished with value: 0.3844664849849988 and parameters: {'n_estimators': 1233, 'learning_rate': 0.025232233833299866, 'max_depth': 4, 'min_samples_split': 17, 'min_samples_leaf': 3, 'subsample': 0.7010151962041804, 'max_features': None}. Best is trial 621 with value: 0.2256726988932517.
[I 2024-12-04 12:59:25,705] Trial 1248 finished with value: 0.372413744376629 and parameters: {'n_estimators': 1362, 'learning_rate': 0.026730947280308195, 'max_depth': 7, 'min_samples_split': 4, 'min_samples_leaf': 2, 'subsample': 0.6038031266012573, 'max_features': None}. Best is trial 621 with value: 0.2256726988932517.
[I 2024-12-04 12:59:26,086] Trial 1250 finished with value: 0.2903746184197015 and parameters: {'n_estimators': 1348, 'learning_rate': 0.044276838198973836, 'max_depth': 7, 'min_samples_split': 2, 'min_samples_leaf': 2, 'subsample': 0.6438065165559368, 'max_features': 'sqrt'}. Best is trial 621 with value: 0.2256726988932517.
[I 2024-12-04 12:59:28,674] Trial 1266 finished with value: 0.25010042446278674 and parameters: {'n_estimators': 638, 'learning_rate': 0.06089206377033367, 'max_depth': 6, 'min_samples_split': 2, 'min_samples_leaf': 1, 'subsample': 0.8628265946194703, 'max_features': 'sqrt'}. Best is trial 621 with value: 0.2256726988932517.
[I 2024-12-04 12:59:33,957] Trial 1255 finished with value: 0.27245296242134603 and parameters: {'n_estimators': 1311, 'learning_rate': 0.038458880010448684, 'max_depth': 4, 'min_samples_split': 6, 'min_samples_leaf': 1, 'subsample': 0.8202767767238477, 'max_features': 'sqrt'}. Best is trial 621 with value: 0.2256726988932517.
[I 2024-12-04 12:59:36,256] Trial 1253 finished with value: 0.3560343079149233 and parameters: {'n_estimators': 1420, 'learning_rate': 0.08689235797172144, 'max_depth': 8, 'min_samples_split': 7, 'min_samples_leaf': 3, 'subsample': 0.6760410507967588, 'max_features': 'sqrt'}. Best is trial 621 with value: 0.2256726988932517.
[I 2024-12-04 12:59:39,769] Trial 1258 finished with value: 0.24323126900694805 and parameters: {'n_estimators': 1298, 'learning_rate': 0.06575660609372262, 'max_depth': 7, 'min_samples_split': 6, 'min_samples_leaf': 1, 'subsample': 0.8211026879694076, 'max_features': 'sqrt'}. Best is trial 621 with value: 0.2256726988932517.
[I 2024-12-04 12:59:39,888] Trial 1259 finished with value: 0.35345390785128716 and parameters: {'n_estimators': 1197, 'learning_rate': 0.09408689932120798, 'max_depth': 8, 'min_samples_split': 9, 'min_samples_leaf': 3, 'subsample': 0.8706476985397951, 'max_features': 'sqrt'}. Best is trial 621 with value: 0.2256726988932517.
[I 2024-12-04 12:59:45,320] Trial 1256 finished with value: 0.28869222106559456 and parameters: {'n_estimators': 1491, 'learning_rate': 0.03415799742804822, 'max_depth': 9, 'min_samples_split': 2, 'min_samples_leaf': 2, 'subsample': 0.6116393503204927, 'max_features': 'sqrt'}. Best is trial 621 with value: 0.2256726988932517.
[I 2024-12-04 12:59:47,718] Trial 1263 finished with value: 0.24990594355668086 and parameters: {'n_estimators': 1162, 'learning_rate': 0.062169160009931716, 'max_depth': 7, 'min_samples_split': 2, 'min_samples_leaf': 1, 'subsample': 0.8219134678880742, 'max_features': 'sqrt'}. Best is trial 621 with value: 0.2256726988932517.
[I 2024-12-04 12:59:52,391] Trial 1268 finished with value: 0.25104628944031704 and parameters: {'n_estimators': 1099, 'learning_rate': 0.059469481071636625, 'max_depth': 6, 'min_samples_split': 5, 'min_samples_leaf': 1, 'subsample': 0.7918071412184186, 'max_features': 'sqrt'}. Best is trial 621 with value: 0.2256726988932517.
[I 2024-12-04 12:59:54,596] Trial 1272 finished with value: 0.2633648063452454 and parameters: {'n_estimators': 976, 'learning_rate': 0.09317899303751008, 'max_depth': 9, 'min_samples_split': 3, 'min_samples_leaf': 1, 'subsample': 0.6620936127652604, 'max_features': 'sqrt'}. Best is trial 621 with value: 0.2256726988932517.
[I 2024-12-04 12:59:58,293] Trial 1267 finished with value: 0.2416376630905074 and parameters: {'n_estimators': 1160, 'learning_rate': 0.08624987333089178, 'max_depth': 6, 'min_samples_split': 3, 'min_samples_leaf': 1, 'subsample': 0.8420738157923808, 'max_features': 'sqrt'}. Best is trial 621 with value: 0.2256726988932517.
[I 2024-12-04 13:00:00,343] Trial 1265 finished with value: 0.22805654260263208 and parameters: {'n_estimators': 1292, 'learning_rate': 0.09627359732704549, 'max_depth': 8, 'min_samples_split': 3, 'min_samples_leaf': 1, 'subsample': 0.783286787597568, 'max_features': 'sqrt'}. Best is trial 621 with value: 0.2256726988932517.
[I 2024-12-04 13:00:02,382] Trial 1261 finished with value: 0.2890712242786497 and parameters: {'n_estimators': 1487, 'learning_rate': 0.043483992034707014, 'max_depth': 5, 'min_samples_split': 2, 'min_samples_leaf': 2, 'subsample': 0.867643563224935, 'max_features': 'sqrt'}. Best is trial 621 with value: 0.2256726988932517.
[I 2024-12-04 13:00:02,407] Trial 1281 finished with value: 0.5610556813893385 and parameters: {'n_estimators': 742, 'learning_rate': 0.06443899172944681, 'max_depth': 12, 'min_samples_split': 7, 'min_samples_leaf': 7, 'subsample': 0.8012892933220679, 'max_features': 'log2'}. Best is trial 621 with value: 0.2256726988932517.
[I 2024-12-04 13:00:04,328] Trial 1275 finished with value: 0.3523041629831394 and parameters: {'n_estimators': 885, 'learning_rate': 0.08175725954183981, 'max_depth': 12, 'min_samples_split': 3, 'min_samples_leaf': 1, 'subsample': 0.626669770033514, 'max_features': None}. Best is trial 621 with value: 0.2256726988932517.
[I 2024-12-04 13:00:08,862] Trial 1264 finished with value: 0.2741897914630489 and parameters: {'n_estimators': 1471, 'learning_rate': 0.09007986732730003, 'max_depth': 7, 'min_samples_split': 6, 'min_samples_leaf': 1, 'subsample': 0.8215054041564567, 'max_features': 'sqrt'}. Best is trial 621 with value: 0.2256726988932517.
