[I 2024-12-04 11:54:26,628] Trial 454 finished with value: 0.5775376465321826 and parameters: {'max_depth': 34, 'min_samples_split': 17, 'min_samples_leaf': 1, 'max_features': 'sqrt', 'criterion': 'squared_error', 'splitter': 'best'}. Best is trial 245 with value: 0.5517975516810654.
[I 2024-12-04 11:54:26,893] Trial 461 finished with value: 1.0746652081803512 and parameters: {'max_depth': 29, 'min_samples_split': 19, 'min_samples_leaf': 3, 'max_features': 'sqrt', 'criterion': 'squared_error', 'splitter': 'best'}. Best is trial 245 with value: 0.5517975516810654.
[I 2024-12-04 11:54:26,898] Trial 456 finished with value: 0.5801533780931414 and parameters: {'max_depth': 24, 'min_samples_split': 13, 'min_samples_leaf': 1, 'max_features': 'sqrt', 'criterion': 'squared_error', 'splitter': 'best'}. Best is trial 245 with value: 0.5517975516810654.
[I 2024-12-04 11:54:26,953] Trial 470 finished with value: 1.2559430945799082 and parameters: {'max_depth': 14, 'min_samples_split': 16, 'min_samples_leaf': 3, 'max_features': 'log2', 'criterion': 'squared_error', 'splitter': 'random'}. Best is trial 245 with value: 0.5517975516810654.
[I 2024-12-04 11:54:27,027] Trial 472 finished with value: 1.261454797635251 and parameters: {'max_depth': 30, 'min_samples_split': 18, 'min_samples_leaf': 4, 'max_features': 'log2', 'criterion': 'friedman_mse', 'splitter': 'best'}. Best is trial 245 with value: 0.5517975516810654.
[I 2024-12-04 11:54:27,033] Trial 468 finished with value: 1.1048628153479851 and parameters: {'max_depth': 25, 'min_samples_split': 8, 'min_samples_leaf': 2, 'max_features': 'sqrt', 'criterion': 'squared_error', 'splitter': 'random'}. Best is trial 245 with value: 0.5517975516810654.
[I 2024-12-04 11:54:27,160] Trial 465 finished with value: 1.0746652081803512 and parameters: {'max_depth': 28, 'min_samples_split': 20, 'min_samples_leaf': 3, 'max_features': 'sqrt', 'criterion': 'friedman_mse', 'splitter': 'best'}. Best is trial 245 with value: 0.5517975516810654.
[I 2024-12-04 11:54:27,534] Trial 458 finished with value: 1.3737845361400185 and parameters: {'max_depth': 13, 'min_samples_split': 4, 'min_samples_leaf': 10, 'max_features': 'log2', 'criterion': 'absolute_error', 'splitter': 'best'}. Best is trial 245 with value: 0.5517975516810654.
[I 2024-12-04 11:54:27,537] Trial 463 finished with value: 1.261454797635251 and parameters: {'max_depth': 33, 'min_samples_split': 20, 'min_samples_leaf': 10, 'max_features': 'log2', 'criterion': 'squared_error', 'splitter': 'best'}. Best is trial 245 with value: 0.5517975516810654.
[I 2024-12-04 11:54:27,926] Trial 460 finished with value: 0.5875137637998102 and parameters: {'max_depth': 35, 'min_samples_split': 18, 'min_samples_leaf': 1, 'max_features': 'sqrt', 'criterion': 'friedman_mse', 'splitter': 'best'}. Best is trial 245 with value: 0.5517975516810654.
[I 2024-12-04 11:54:28,295] Trial 473 finished with value: 0.5785444383766838 and parameters: {'max_depth': 26, 'min_samples_split': 20, 'min_samples_leaf': 1, 'max_features': 'sqrt', 'criterion': 'friedman_mse', 'splitter': 'best'}. Best is trial 245 with value: 0.5517975516810654.
[I 2024-12-04 11:54:28,763] Trial 471 finished with value: 1.3218178523383912 and parameters: {'max_depth': 2, 'min_samples_split': 13, 'min_samples_leaf': 1, 'max_features': 'sqrt', 'criterion': 'absolute_error', 'splitter': 'random'}. Best is trial 245 with value: 0.5517975516810654.
[I 2024-12-04 11:54:29,082] Trial 474 finished with value: 0.5860869405927785 and parameters: {'max_depth': 35, 'min_samples_split': 16, 'min_samples_leaf': 1, 'max_features': 'sqrt', 'criterion': 'friedman_mse', 'splitter': 'best'}. Best is trial 245 with value: 0.5517975516810654.
[I 2024-12-04 11:54:29,542] Trial 478 finished with value: 0.8845052246927926 and parameters: {'max_depth': 21, 'min_samples_split': 12, 'min_samples_leaf': 1, 'max_features': 'log2', 'criterion': 'absolute_error', 'splitter': 'best'}. Best is trial 245 with value: 0.5517975516810654.
[I 2024-12-04 11:54:30,882] Trial 475 finished with value: 1.3696699836108748 and parameters: {'max_depth': 24, 'min_samples_split': 9, 'min_samples_leaf': 5, 'max_features': 'sqrt', 'criterion': 'absolute_error', 'splitter': 'random'}. Best is trial 245 with value: 0.5517975516810654.
[I 2024-12-04 11:54:31,697] Trial 481 finished with value: 1.259809444253076 and parameters: {'max_depth': 3, 'min_samples_split': 17, 'min_samples_leaf': 10, 'max_features': 'sqrt', 'criterion': 'friedman_mse', 'splitter': 'random'}. Best is trial 245 with value: 0.5517975516810654.
[I 2024-12-04 11:54:32,352] Trial 477 finished with value: 0.6241169559432111 and parameters: {'max_depth': 30, 'min_samples_split': 15, 'min_samples_leaf': 1, 'max_features': 'sqrt', 'criterion': 'squared_error', 'splitter': 'best'}. Best is trial 245 with value: 0.5517975516810654.
[I 2024-12-04 11:54:33,881] Trial 482 finished with value: 0.9424778759919019 and parameters: {'max_depth': 6, 'min_samples_split': 12, 'min_samples_leaf': 2, 'max_features': 'log2', 'criterion': 'squared_error', 'splitter': 'best'}. Best is trial 245 with value: 0.5517975516810654.
[I 2024-12-04 11:54:34,259] Trial 484 finished with value: 0.8403973805957579 and parameters: {'max_depth': 23, 'min_samples_split': 13, 'min_samples_leaf': 1, 'max_features': 'log2', 'criterion': 'squared_error', 'splitter': 'best'}. Best is trial 245 with value: 0.5517975516810654.
[I 2024-12-04 11:54:34,262] Trial 480 finished with value: 1.0746652081803512 and parameters: {'max_depth': 32, 'min_samples_split': 17, 'min_samples_leaf': 3, 'max_features': 'sqrt', 'criterion': 'friedman_mse', 'splitter': 'best'}. Best is trial 245 with value: 0.5517975516810654.
[I 2024-12-04 11:54:35,687] Trial 486 finished with value: 1.261454797635251 and parameters: {'max_depth': 19, 'min_samples_split': 12, 'min_samples_leaf': 4, 'max_features': 'log2', 'criterion': 'friedman_mse', 'splitter': 'best'}. Best is trial 245 with value: 0.5517975516810654.
[I 2024-12-04 11:54:35,811] Trial 483 finished with value: 1.261454797635251 and parameters: {'max_depth': 9, 'min_samples_split': 3, 'min_samples_leaf': 4, 'max_features': 'log2', 'criterion': 'friedman_mse', 'splitter': 'best'}. Best is trial 245 with value: 0.5517975516810654.
[I 2024-12-04 11:54:35,983] Trial 500 finished with value: 1.0746652081803512 and parameters: {'max_depth': 27, 'min_samples_split': 14, 'min_samples_leaf': 3, 'max_features': 'sqrt', 'criterion': 'squared_error', 'splitter': 'best'}. Best is trial 245 with value: 0.5517975516810654.
[I 2024-12-04 11:54:36,379] Trial 495 finished with value: 0.5883040364889727 and parameters: {'max_depth': 25, 'min_samples_split': 18, 'min_samples_leaf': 1, 'max_features': 'sqrt', 'criterion': 'friedman_mse', 'splitter': 'best'}. Best is trial 245 with value: 0.5517975516810654.
[I 2024-12-04 11:54:36,839] Trial 487 finished with value: 1.0746652081803512 and parameters: {'max_depth': 24, 'min_samples_split': 20, 'min_samples_leaf': 3, 'max_features': 'sqrt', 'criterion': 'squared_error', 'splitter': 'best'}. Best is trial 245 with value: 0.5517975516810654.
[I 2024-12-04 11:54:36,841] Trial 476 finished with value: 0.5875137637998102 and parameters: {'max_depth': 35, 'min_samples_split': 19, 'min_samples_leaf': 1, 'max_features': 'sqrt', 'criterion': 'squared_error', 'splitter': 'best'}. Best is trial 245 with value: 0.5517975516810654.
[I 2024-12-04 11:54:37,184] Trial 489 finished with value: 0.5803392978839049 and parameters: {'max_depth': 27, 'min_samples_split': 20, 'min_samples_leaf': 1, 'max_features': 'sqrt', 'criterion': 'friedman_mse', 'splitter': 'best'}. Best is trial 245 with value: 0.5517975516810654.
[I 2024-12-04 11:54:37,252] Trial 497 finished with value: 1.3737845361400185 and parameters: {'max_depth': 14, 'min_samples_split': 8, 'min_samples_leaf': 6, 'max_features': 'log2', 'criterion': 'absolute_error', 'splitter': 'best'}. Best is trial 245 with value: 0.5517975516810654.
[I 2024-12-04 11:54:37,302] Trial 479 finished with value: 0.563179779570873 and parameters: {'max_depth': 29, 'min_samples_split': 20, 'min_samples_leaf': 1, 'max_features': 'sqrt', 'criterion': 'friedman_mse', 'splitter': 'best'}. Best is trial 245 with value: 0.5517975516810654.
[I 2024-12-04 11:54:37,593] Trial 488 finished with value: 1.4087076338256468 and parameters: {'max_depth': 5, 'min_samples_split': 13, 'min_samples_leaf': 1, 'max_features': 'sqrt', 'criterion': 'absolute_error', 'splitter': 'best'}. Best is trial 245 with value: 0.5517975516810654.
[I 2024-12-04 11:54:38,003] Trial 501 finished with value: 0.590403219918811 and parameters: {'max_depth': 35, 'min_samples_split': 14, 'min_samples_leaf': 1, 'max_features': 'sqrt', 'criterion': 'friedman_mse', 'splitter': 'best'}. Best is trial 245 with value: 0.5517975516810654.
[I 2024-12-04 11:54:38,211] Trial 498 finished with value: 1.0746652081803512 and parameters: {'max_depth': 35, 'min_samples_split': 16, 'min_samples_leaf': 3, 'max_features': 'sqrt', 'criterion': 'squared_error', 'splitter': 'best'}. Best is trial 245 with value: 0.5517975516810654.
[I 2024-12-04 11:54:38,240] Trial 491 finished with value: 0.6205845799839496 and parameters: {'max_depth': 33, 'min_samples_split': 15, 'min_samples_leaf': 1, 'max_features': 'sqrt', 'criterion': 'squared_error', 'splitter': 'best'}. Best is trial 245 with value: 0.5517975516810654.
[I 2024-12-04 11:54:38,242] Trial 485 finished with value: 0.5924912260784201 and parameters: {'max_depth': 31, 'min_samples_split': 16, 'min_samples_leaf': 1, 'max_features': 'sqrt', 'criterion': 'friedman_mse', 'splitter': 'best'}. Best is trial 245 with value: 0.5517975516810654.
[I 2024-12-04 11:54:38,560] Trial 506 finished with value: 1.0655153228779684 and parameters: {'max_depth': 23, 'min_samples_split': 18, 'min_samples_leaf': 1, 'max_features': 'sqrt', 'criterion': 'squared_error', 'splitter': 'random'}. Best is trial 245 with value: 0.5517975516810654.
[I 2024-12-04 11:54:38,561] Trial 494 finished with value: 1.0746652081803512 and parameters: {'max_depth': 32, 'min_samples_split': 19, 'min_samples_leaf': 3, 'max_features': 'sqrt', 'criterion': 'friedman_mse', 'splitter': 'best'}. Best is trial 245 with value: 0.5517975516810654.
[I 2024-12-04 11:54:38,794] Trial 499 finished with value: 0.5718668665680694 and parameters: {'max_depth': 32, 'min_samples_split': 18, 'min_samples_leaf': 1, 'max_features': 'sqrt', 'criterion': 'friedman_mse', 'splitter': 'best'}. Best is trial 245 with value: 0.5517975516810654.
[I 2024-12-04 11:54:39,047] Trial 492 finished with value: 0.5839098349716451 and parameters: {'max_depth': 33, 'min_samples_split': 19, 'min_samples_leaf': 1, 'max_features': 'sqrt', 'criterion': 'friedman_mse', 'splitter': 'best'}. Best is trial 245 with value: 0.5517975516810654.
[I 2024-12-04 11:54:39,568] Trial 503 finished with value: 0.8189380285216872 and parameters: {'max_depth': 35, 'min_samples_split': 10, 'min_samples_leaf': 1, 'max_features': 'sqrt', 'criterion': 'friedman_mse', 'splitter': 'random'}. Best is trial 245 with value: 0.5517975516810654.
[I 2024-12-04 11:54:40,242] Trial 505 finished with value: 0.5718668665680694 and parameters: {'max_depth': 32, 'min_samples_split': 20, 'min_samples_leaf': 1, 'max_features': 'sqrt', 'criterion': 'friedman_mse', 'splitter': 'best'}. Best is trial 245 with value: 0.5517975516810654.
[I 2024-12-04 11:54:40,725] Trial 502 finished with value: 0.5945975836542683 and parameters: {'max_depth': 35, 'min_samples_split': 20, 'min_samples_leaf': 2, 'max_features': 'sqrt', 'criterion': 'friedman_mse', 'splitter': 'best'}. Best is trial 245 with value: 0.5517975516810654.
[I 2024-12-04 11:54:41,047] Trial 504 finished with value: 1.259809444253076 and parameters: {'max_depth': 17, 'min_samples_split': 3, 'min_samples_leaf': 10, 'max_features': 'sqrt', 'criterion': 'squared_error', 'splitter': 'random'}. Best is trial 245 with value: 0.5517975516810654.
[I 2024-12-04 11:54:41,262] Trial 508 finished with value: 1.261454797635251 and parameters: {'max_depth': 10, 'min_samples_split': 5, 'min_samples_leaf': 10, 'max_features': 'log2', 'criterion': 'squared_error', 'splitter': 'random'}. Best is trial 245 with value: 0.5517975516810654.
[I 2024-12-04 11:54:41,744] Trial 507 finished with value: 1.0746652081803512 and parameters: {'max_depth': 28, 'min_samples_split': 16, 'min_samples_leaf': 3, 'max_features': 'sqrt', 'criterion': 'friedman_mse', 'splitter': 'best'}. Best is trial 245 with value: 0.5517975516810654.
[I 2024-12-04 11:54:42,176] Trial 496 finished with value: 0.5867867610009655 and parameters: {'max_depth': 23, 'min_samples_split': 18, 'min_samples_leaf': 1, 'max_features': 'sqrt', 'criterion': 'squared_error', 'splitter': 'best'}. Best is trial 245 with value: 0.5517975516810654.
[I 2024-12-04 11:54:42,700] Trial 493 finished with value: 0.5945975836542683 and parameters: {'max_depth': 27, 'min_samples_split': 20, 'min_samples_leaf': 2, 'max_features': 'sqrt', 'criterion': 'friedman_mse', 'splitter': 'best'}. Best is trial 245 with value: 0.5517975516810654.
[I 2024-12-04 11:54:43,268] Trial 511 finished with value: 0.9424778759919019 and parameters: {'max_depth': 28, 'min_samples_split': 16, 'min_samples_leaf': 2, 'max_features': 'log2', 'criterion': 'friedman_mse', 'splitter': 'best'}. Best is trial 245 with value: 0.5517975516810654.
[I 2024-12-04 11:54:43,535] Trial 514 finished with value: 0.5957889156966119 and parameters: {'max_depth': 26, 'min_samples_split': 17, 'min_samples_leaf': 1, 'max_features': 'sqrt', 'criterion': 'friedman_mse', 'splitter': 'best'}. Best is trial 245 with value: 0.5517975516810654.
[I 2024-12-04 11:54:43,929] Trial 515 finished with value: 0.58427781353575 and parameters: {'max_depth': 24, 'min_samples_split': 17, 'min_samples_leaf': 1, 'max_features': 'sqrt', 'criterion': 'friedman_mse', 'splitter': 'best'}. Best is trial 245 with value: 0.5517975516810654.
[I 2024-12-04 11:54:44,057] Trial 509 finished with value: 0.58952069790992 and parameters: {'max_depth': 25, 'min_samples_split': 20, 'min_samples_leaf': 1, 'max_features': 'sqrt', 'criterion': 'friedman_mse', 'splitter': 'best'}. Best is trial 245 with value: 0.5517975516810654.
[I 2024-12-04 11:54:44,224] Trial 490 finished with value: 1.1249126480499743 and parameters: {'max_depth': 33, 'min_samples_split': 18, 'min_samples_leaf': 2, 'max_features': 'sqrt', 'criterion': 'friedman_mse', 'splitter': 'random'}. Best is trial 245 with value: 0.5517975516810654.
[I 2024-12-04 11:54:44,417] Trial 513 finished with value: 0.5941518523990704 and parameters: {'max_depth': 14, 'min_samples_split': 15, 'min_samples_leaf': 1, 'max_features': 'sqrt', 'criterion': 'friedman_mse', 'splitter': 'best'}. Best is trial 245 with value: 0.5517975516810654.
[I 2024-12-04 11:54:45,419] Trial 510 finished with value: 1.2136887711129722 and parameters: {'max_depth': 1, 'min_samples_split': 8, 'min_samples_leaf': 1, 'max_features': 'sqrt', 'criterion': 'friedman_mse', 'splitter': 'random'}. Best is trial 245 with value: 0.5517975516810654.
[I 2024-12-04 11:54:45,547] Trial 520 finished with value: 1.3696699836108748 and parameters: {'max_depth': 29, 'min_samples_split': 8, 'min_samples_leaf': 9, 'max_features': 'sqrt', 'criterion': 'absolute_error', 'splitter': 'random'}. Best is trial 245 with value: 0.5517975516810654.
[I 2024-12-04 11:54:46,049] Trial 521 finished with value: 0.5800554303398895 and parameters: {'max_depth': 26, 'min_samples_split': 19, 'min_samples_leaf': 1, 'max_features': 'sqrt', 'criterion': 'squared_error', 'splitter': 'best'}. Best is trial 245 with value: 0.5517975516810654.
[I 2024-12-04 11:54:46,252] Trial 512 finished with value: 1.0746652081803512 and parameters: {'max_depth': 28, 'min_samples_split': 20, 'min_samples_leaf': 3, 'max_features': 'sqrt', 'criterion': 'friedman_mse', 'splitter': 'best'}. Best is trial 245 with value: 0.5517975516810654.
[I 2024-12-04 11:54:46,336] Trial 522 finished with value: 0.5930831005428419 and parameters: {'max_depth': 31, 'min_samples_split': 17, 'min_samples_leaf': 1, 'max_features': 'sqrt', 'criterion': 'friedman_mse', 'splitter': 'best'}. Best is trial 245 with value: 0.5517975516810654.
[I 2024-12-04 11:54:47,066] Trial 528 finished with value: 0.5783416336589506 and parameters: {'max_depth': 27, 'min_samples_split': 18, 'min_samples_leaf': 1, 'max_features': 'sqrt', 'criterion': 'friedman_mse', 'splitter': 'best'}. Best is trial 245 with value: 0.5517975516810654.
[I 2024-12-04 11:54:47,577] Trial 531 finished with value: 1.3179355425138606 and parameters: {'max_depth': 1, 'min_samples_split': 10, 'min_samples_leaf': 1, 'max_features': 'log2', 'criterion': 'absolute_error', 'splitter': 'random'}. Best is trial 245 with value: 0.5517975516810654.
[I 2024-12-04 11:54:47,578] Trial 529 finished with value: 0.8272888462502314 and parameters: {'max_depth': 33, 'min_samples_split': 20, 'min_samples_leaf': 1, 'max_features': 'sqrt', 'criterion': 'friedman_mse', 'splitter': 'random'}. Best is trial 245 with value: 0.5517975516810654.
[I 2024-12-04 11:54:47,593] Trial 524 finished with value: 0.5732162781181424 and parameters: {'max_depth': 23, 'min_samples_split': 13, 'min_samples_leaf': 1, 'max_features': 'sqrt', 'criterion': 'squared_error', 'splitter': 'best'}. Best is trial 245 with value: 0.5517975516810654.
[I 2024-12-04 11:54:47,807] Trial 517 finished with value: 0.5709421836140235 and parameters: {'max_depth': 20, 'min_samples_split': 16, 'min_samples_leaf': 1, 'max_features': 'sqrt', 'criterion': 'friedman_mse', 'splitter': 'best'}. Best is trial 245 with value: 0.5517975516810654.
[I 2024-12-04 11:54:47,822] Trial 519 finished with value: 1.259809444253076 and parameters: {'max_depth': 33, 'min_samples_split': 2, 'min_samples_leaf': 4, 'max_features': 'sqrt', 'criterion': 'squared_error', 'splitter': 'random'}. Best is trial 245 with value: 0.5517975516810654.
[I 2024-12-04 11:54:48,578] Trial 525 finished with value: 0.5803392978839049 and parameters: {'max_depth': 27, 'min_samples_split': 20, 'min_samples_leaf': 1, 'max_features': 'sqrt', 'criterion': 'friedman_mse', 'splitter': 'best'}. Best is trial 245 with value: 0.5517975516810654.
[I 2024-12-04 11:54:48,650] Trial 532 finished with value: 1.4244636828600914 and parameters: {'max_depth': 28, 'min_samples_split': 18, 'min_samples_leaf': 3, 'max_features': 'sqrt', 'criterion': 'absolute_error', 'splitter': 'best'}. Best is trial 245 with value: 0.5517975516810654.
[I 2024-12-04 11:54:48,837] Trial 523 finished with value: 0.5708182886221415 and parameters: {'max_depth': 31, 'min_samples_split': 18, 'min_samples_leaf': 1, 'max_features': 'sqrt', 'criterion': 'friedman_mse', 'splitter': 'best'}. Best is trial 245 with value: 0.5517975516810654.
[I 2024-12-04 11:54:48,869] Trial 527 finished with value: 1.0874428099108078 and parameters: {'max_depth': 16, 'min_samples_split': 7, 'min_samples_leaf': 10, 'max_features': 'sqrt', 'criterion': 'squared_error', 'splitter': 'best'}. Best is trial 245 with value: 0.5517975516810654.
[I 2024-12-04 11:54:49,765] Trial 537 finished with value: 0.6278044549608603 and parameters: {'max_depth': 34, 'min_samples_split': 9, 'min_samples_leaf': 2, 'max_features': 'sqrt', 'criterion': 'friedman_mse', 'splitter': 'best'}. Best is trial 245 with value: 0.5517975516810654.
[I 2024-12-04 11:54:50,280] Trial 518 finished with value: 0.5854261816964598 and parameters: {'max_depth': 28, 'min_samples_split': 20, 'min_samples_leaf': 1, 'max_features': 'sqrt', 'criterion': 'friedman_mse', 'splitter': 'best'}. Best is trial 245 with value: 0.5517975516810654.
[I 2024-12-04 11:54:50,526] Trial 530 finished with value: 0.6241169559432111 and parameters: {'max_depth': 30, 'min_samples_split': 15, 'min_samples_leaf': 1, 'max_features': 'sqrt', 'criterion': 'friedman_mse', 'splitter': 'best'}. Best is trial 245 with value: 0.5517975516810654.
[I 2024-12-04 11:54:50,569] Trial 516 finished with value: 0.6000285247016761 and parameters: {'max_depth': 29, 'min_samples_split': 15, 'min_samples_leaf': 1, 'max_features': 'sqrt', 'criterion': 'friedman_mse', 'splitter': 'best'}. Best is trial 245 with value: 0.5517975516810654.
[I 2024-12-04 11:54:50,837] Trial 539 finished with value: 0.5708182886221415 and parameters: {'max_depth': 31, 'min_samples_split': 18, 'min_samples_leaf': 1, 'max_features': 'sqrt', 'criterion': 'squared_error', 'splitter': 'best'}. Best is trial 245 with value: 0.5517975516810654.
[I 2024-12-04 11:54:50,998] Trial 538 finished with value: 1.0746652081803512 and parameters: {'max_depth': 28, 'min_samples_split': 16, 'min_samples_leaf': 3, 'max_features': 'sqrt', 'criterion': 'friedman_mse', 'splitter': 'best'}. Best is trial 245 with value: 0.5517975516810654.
[I 2024-12-04 11:54:51,477] Trial 526 finished with value: 0.6033893981188482 and parameters: {'max_depth': 27, 'min_samples_split': 16, 'min_samples_leaf': 1, 'max_features': 'sqrt', 'criterion': 'squared_error', 'splitter': 'best'}. Best is trial 245 with value: 0.5517975516810654.
[I 2024-12-04 11:54:52,258] Trial 535 finished with value: 0.5963013888683532 and parameters: {'max_depth': 25, 'min_samples_split': 16, 'min_samples_leaf': 1, 'max_features': 'sqrt', 'criterion': 'friedman_mse', 'splitter': 'best'}. Best is trial 245 with value: 0.5517975516810654.
[I 2024-12-04 11:54:52,635] Trial 533 finished with value: 0.558420287135432 and parameters: {'max_depth': 27, 'min_samples_split': 11, 'min_samples_leaf': 1, 'max_features': 'sqrt', 'criterion': 'squared_error', 'splitter': 'best'}. Best is trial 245 with value: 0.5517975516810654.
[I 2024-12-04 11:54:53,691] Trial 543 finished with value: 1.0694561420716724 and parameters: {'max_depth': 34, 'min_samples_split': 13, 'min_samples_leaf': 1, 'max_features': 'log2', 'criterion': 'absolute_error', 'splitter': 'random'}. Best is trial 245 with value: 0.5517975516810654.
