[I 2024-12-04 15:11:57,114] Trial 1046 finished with value: 0.17251040374433826 and parameters: {'kernel_type': 'Matern', 'length_scale': 184.29229200443618, 'noise_level': 0.01685052965885095, 'constant_value': 91130.86200440546, 'nu': 0.5}. Best is trial 750 with value: 0.13435342446039877.
[I 2024-12-04 15:11:57,143] Trial 1038 finished with value: 0.13435433973156133 and parameters: {'kernel_type': 'Matern', 'length_scale': 15.56898975775682, 'noise_level': 0.8747567690617248, 'constant_value': 4577.166061859774, 'nu': 1.5}. Best is trial 750 with value: 0.13435342446039877.
[I 2024-12-04 15:11:57,222] Trial 1047 finished with value: 0.1343543864963614 and parameters: {'kernel_type': 'Matern', 'length_scale': 61.97575312237636, 'noise_level': 0.026032416076606984, 'constant_value': 66165.3811198583, 'nu': 1.5}. Best is trial 750 with value: 0.13435342446039877.
[I 2024-12-04 15:11:57,684] Trial 1049 finished with value: 1.2693635028568648 and parameters: {'kernel_type': 'Matern', 'length_scale': 0.05229594772839996, 'noise_level': 0.5545409375274699, 'constant_value': 6.6636174024667225, 'nu': 1.5}. Best is trial 750 with value: 0.13435342446039877.
[I 2024-12-04 15:11:58,896] Trial 1036 finished with value: 0.1343543606433686 and parameters: {'kernel_type': 'Matern', 'length_scale': 21.40997568141011, 'noise_level': 0.04795579438370339, 'constant_value': 1.5993814393677108, 'nu': 1.5}. Best is trial 750 with value: 0.13435342446039877.
[I 2024-12-04 15:11:59,003] Trial 1040 finished with value: 0.17251040308632706 and parameters: {'kernel_type': 'Matern', 'length_scale': 8.401155817091588, 'noise_level': 0.8806886131385343, 'constant_value': 86976.31074096507, 'nu': 0.5}. Best is trial 750 with value: 0.13435342446039877.
[I 2024-12-04 15:11:59,970] Trial 1052 finished with value: 0.13435440442251087 and parameters: {'kernel_type': 'Matern', 'length_scale': 11.76022491965538, 'noise_level': 0.015873558796010486, 'constant_value': 29.437352343002257, 'nu': 1.5}. Best is trial 750 with value: 0.13435342446039877.
[I 2024-12-04 15:12:01,369] Trial 1043 finished with value: 0.13435437374965764 and parameters: {'kernel_type': 'Matern', 'length_scale': 399.4958021305195, 'noise_level': 0.9881957728937301, 'constant_value': 80239.39744445178, 'nu': 1.5}. Best is trial 750 with value: 0.13435342446039877.
[I 2024-12-04 15:12:02,172] Trial 1042 finished with value: 0.13435421258395697 and parameters: {'kernel_type': 'Matern', 'length_scale': 19.338792623508173, 'noise_level': 0.11911032171482144, 'constant_value': 1.1213452090742422, 'nu': 1.5}. Best is trial 750 with value: 0.13435342446039877.
[I 2024-12-04 15:12:04,811] Trial 1048 finished with value: 0.13435439874601093 and parameters: {'kernel_type': 'Matern', 'length_scale': 30.047539413111494, 'noise_level': 0.002390292886963896, 'constant_value': 7.1494005674719965, 'nu': 1.5}. Best is trial 750 with value: 0.13435342446039877.
[I 2024-12-04 15:12:04,851] Trial 1053 finished with value: 0.13435440838000767 and parameters: {'kernel_type': 'Matern', 'length_scale': 100.69268996992162, 'noise_level': 0.010158199105961463, 'constant_value': 2205.4659164322575, 'nu': 1.5}. Best is trial 750 with value: 0.13435342446039877.
[I 2024-12-04 15:12:05,206] Trial 1057 finished with value: 0.13435440081236927 and parameters: {'kernel_type': 'Matern', 'length_scale': 0.7066016763437318, 'noise_level': 0.013477038082414608, 'constant_value': 1.1439540977717852, 'nu': 1.5}. Best is trial 750 with value: 0.13435342446039877.
[I 2024-12-04 15:12:06,227] Trial 1056 finished with value: 0.13435439567350063 and parameters: {'kernel_type': 'Matern', 'length_scale': 422.4516915320077, 'noise_level': 0.8058993134885462, 'constant_value': 84.960390944005, 'nu': 1.5}. Best is trial 750 with value: 0.13435342446039877.
[I 2024-12-04 15:12:08,210] Trial 1050 finished with value: 0.13435439706058658 and parameters: {'kernel_type': 'Matern', 'length_scale': 3.7128616360877436, 'noise_level': 0.02748751021675713, 'constant_value': 896.1925202343117, 'nu': 1.5}. Best is trial 750 with value: 0.13435342446039877.
[I 2024-12-04 15:12:08,771] Trial 1063 finished with value: 1.300774596738282 and parameters: {'kernel_type': 'Matern', 'length_scale': 0.8476179059496356, 'noise_level': 1.5475161772338928e-10, 'constant_value': 2754.1730658986303, 'nu': 2.5}. Best is trial 750 with value: 0.13435342446039877.
[I 2024-12-04 15:12:09,275] Trial 1058 finished with value: 0.13435439647691333 and parameters: {'kernel_type': 'Matern', 'length_scale': 167.8931047392234, 'noise_level': 0.01193458125147913, 'constant_value': 2585.7360207890606, 'nu': 1.5}. Best is trial 750 with value: 0.13435342446039877.
[I 2024-12-04 15:12:10,470] Trial 1055 finished with value: 0.13435438854690313 and parameters: {'kernel_type': 'Matern', 'length_scale': 23.678684818762772, 'noise_level': 0.01486202678565345, 'constant_value': 2890.2911883124493, 'nu': 1.5}. Best is trial 750 with value: 0.13435342446039877.
[I 2024-12-04 15:12:10,670] Trial 1061 finished with value: 0.13435439859854703 and parameters: {'kernel_type': 'Matern', 'length_scale': 48.431123861490455, 'noise_level': 0.13208201518060883, 'constant_value': 67471.10466997574, 'nu': 1.5}. Best is trial 750 with value: 0.13435342446039877.
[I 2024-12-04 15:12:10,674] Trial 1064 finished with value: 0.1343544312478949 and parameters: {'kernel_type': 'Matern', 'length_scale': 4.191021470495301, 'noise_level': 0.05370109847684487, 'constant_value': 80144.74356244321, 'nu': 1.5}. Best is trial 750 with value: 0.13435342446039877.
[I 2024-12-04 15:12:11,181] Trial 1059 finished with value: 0.1343544000973847 and parameters: {'kernel_type': 'Matern', 'length_scale': 2.579601581048826, 'noise_level': 0.8614862030932907, 'constant_value': 186.42203409130676, 'nu': 1.5}. Best is trial 750 with value: 0.13435342446039877.
[I 2024-12-04 15:12:11,577] Trial 1054 finished with value: 0.1485982781799877 and parameters: {'kernel_type': 'Matern', 'length_scale': 255.7478908523842, 'noise_level': 0.00038422882633973825, 'constant_value': 13139.482143788087, 'nu': 2.5}. Best is trial 750 with value: 0.13435342446039877.
[I 2024-12-04 15:12:12,475] Trial 1066 finished with value: 0.13435439491117676 and parameters: {'kernel_type': 'Matern', 'length_scale': 77.64969745889034, 'noise_level': 0.02005303519674957, 'constant_value': 764.3009279080818, 'nu': 1.5}. Best is trial 750 with value: 0.13435342446039877.
[I 2024-12-04 15:12:12,531] Trial 1051 finished with value: 0.17251040534622675 and parameters: {'kernel_type': 'Matern', 'length_scale': 0.09611823147310786, 'noise_level': 0.1012232189086475, 'constant_value': 1314.7291576373073, 'nu': 0.5}. Best is trial 750 with value: 0.13435342446039877.
[I 2024-12-04 15:12:12,579] Trial 1065 finished with value: 0.13435438801716074 and parameters: {'kernel_type': 'Matern', 'length_scale': 47.3431502015124, 'noise_level': 5.3428815047167524e-05, 'constant_value': 52946.144490777006, 'nu': 1.5}. Best is trial 750 with value: 0.13435342446039877.
[I 2024-12-04 15:12:15,060] Trial 1060 finished with value: 0.13435439382844544 and parameters: {'kernel_type': 'Matern', 'length_scale': 291.8319888235379, 'noise_level': 0.13431700814078537, 'constant_value': 557.0742016187149, 'nu': 1.5}. Best is trial 750 with value: 0.13435342446039877.
[I 2024-12-04 15:12:17,192] Trial 1068 finished with value: 0.17251040122882963 and parameters: {'kernel_type': 'Matern', 'length_scale': 0.544046046144248, 'noise_level': 0.029728637627116722, 'constant_value': 0.5117345591580137, 'nu': 0.5}. Best is trial 750 with value: 0.13435342446039877.
[I 2024-12-04 15:12:19,828] Trial 1062 finished with value: 0.13435439917231654 and parameters: {'kernel_type': 'Matern', 'length_scale': 67.68183370787789, 'noise_level': 0.14586597705110965, 'constant_value': 76931.8330010307, 'nu': 1.5}. Best is trial 750 with value: 0.13435342446039877.
[I 2024-12-04 15:12:22,134] Trial 1072 finished with value: 0.13435477991244324 and parameters: {'kernel_type': 'Matern', 'length_scale': 163.81749550113318, 'noise_level': 0.025550770089343564, 'constant_value': 77069.66878238534, 'nu': 1.5}. Best is trial 750 with value: 0.13435342446039877.
[I 2024-12-04 15:12:22,449] Trial 1069 finished with value: 0.13435436798225145 and parameters: {'kernel_type': 'Matern', 'length_scale': 357.59504027873544, 'noise_level': 0.13167760176429227, 'constant_value': 762.0576218336331, 'nu': 1.5}. Best is trial 750 with value: 0.13435342446039877.
[I 2024-12-04 15:12:22,538] Trial 1067 finished with value: 0.13435410821566135 and parameters: {'kernel_type': 'Matern', 'length_scale': 17.76746426503078, 'noise_level': 0.0014289541518764457, 'constant_value': 70943.10647131475, 'nu': 1.5}. Best is trial 750 with value: 0.13435342446039877.
[I 2024-12-04 15:12:25,020] Trial 1070 finished with value: 0.13435440133350157 and parameters: {'kernel_type': 'Matern', 'length_scale': 0.17886518472985735, 'noise_level': 0.3737821795430483, 'constant_value': 2.988717754608355, 'nu': 1.5}. Best is trial 750 with value: 0.13435342446039877.
[I 2024-12-04 15:12:27,975] Trial 1073 finished with value: 1.2693635028570014 and parameters: {'kernel_type': 'RBF', 'length_scale': 76.32775709804436, 'noise_level': 0.002730854369462279, 'constant_value': 0.1096147931958713, 'nu': 1.5}. Best is trial 750 with value: 0.13435342446039877.
[I 2024-12-04 15:12:28,510] Trial 1080 finished with value: 0.1485982583880339 and parameters: {'kernel_type': 'Matern', 'length_scale': 5.84338654351664, 'noise_level': 0.4086472772654098, 'constant_value': 0.14698128531288507, 'nu': 2.5}. Best is trial 750 with value: 0.13435342446039877.
[I 2024-12-04 15:12:29,136] Trial 1078 finished with value: 0.13435439560242513 and parameters: {'kernel_type': 'Matern', 'length_scale': 0.6082985036553029, 'noise_level': 0.17453952425385688, 'constant_value': 89286.55384437706, 'nu': 1.5}. Best is trial 750 with value: 0.13435342446039877.
[I 2024-12-04 15:12:29,166] Trial 1082 finished with value: 0.13435436474312668 and parameters: {'kernel_type': 'Matern', 'length_scale': 474.68820403397297, 'noise_level': 0.0002616501997726255, 'constant_value': 84944.57901022803, 'nu': 1.5}. Best is trial 750 with value: 0.13435342446039877.
[I 2024-12-04 15:12:32,771] Trial 1076 finished with value: 0.1343543896250443 and parameters: {'kernel_type': 'Matern', 'length_scale': 0.3941610923782776, 'noise_level': 6.41691260583436e-05, 'constant_value': 0.858190754356224, 'nu': 1.5}. Best is trial 750 with value: 0.13435342446039877.
[I 2024-12-04 15:12:34,148] Trial 1075 finished with value: 0.17251047278850856 and parameters: {'kernel_type': 'Matern', 'length_scale': 9.234943617254599, 'noise_level': 0.9100299680725967, 'constant_value': 1.1955337643931059, 'nu': 0.5}. Best is trial 750 with value: 0.13435342446039877.
[I 2024-12-04 15:12:34,482] Trial 1079 finished with value: 0.148598269708648 and parameters: {'kernel_type': 'Matern', 'length_scale': 139.0344311182775, 'noise_level': 0.18881382210386566, 'constant_value': 1610.1852508314814, 'nu': 2.5}. Best is trial 750 with value: 0.13435342446039877.
[I 2024-12-04 15:12:35,156] Trial 1086 finished with value: 0.13435441271581988 and parameters: {'kernel_type': 'Matern', 'length_scale': 2.604706586615893, 'noise_level': 0.8780784707485961, 'constant_value': 63970.75005987604, 'nu': 1.5}. Best is trial 750 with value: 0.13435342446039877.
[I 2024-12-04 15:12:35,768] Trial 1077 finished with value: 0.1343543945239535 and parameters: {'kernel_type': 'Matern', 'length_scale': 110.87272696455351, 'noise_level': 0.2446931614985283, 'constant_value': 71831.29006136434, 'nu': 1.5}. Best is trial 750 with value: 0.13435342446039877.
[I 2024-12-04 15:12:36,396] Trial 1081 finished with value: 0.13435436977611032 and parameters: {'kernel_type': 'Matern', 'length_scale': 14.131891377365559, 'noise_level': 0.006980881434094998, 'constant_value': 84622.64822876784, 'nu': 1.5}. Best is trial 750 with value: 0.13435342446039877.
[I 2024-12-04 15:12:37,178] Trial 1088 finished with value: 0.13435439818563288 and parameters: {'kernel_type': 'Matern', 'length_scale': 15.353506662603168, 'noise_level': 0.00025500406059657043, 'constant_value': 3648.1568330058094, 'nu': 1.5}. Best is trial 750 with value: 0.13435342446039877.
[I 2024-12-04 15:12:38,222] Trial 1083 finished with value: 0.13435437244769086 and parameters: {'kernel_type': 'Matern', 'length_scale': 1.8896622294680576, 'noise_level': 0.00046174177472788183, 'constant_value': 915.9353572646095, 'nu': 1.5}. Best is trial 750 with value: 0.13435342446039877.
[I 2024-12-04 15:12:38,833] Trial 1074 finished with value: 0.13435479336745282 and parameters: {'kernel_type': 'Matern', 'length_scale': 1.1584384497575784, 'noise_level': 0.009149808953888916, 'constant_value': 265.85490493060286, 'nu': 1.5}. Best is trial 750 with value: 0.13435342446039877.
[I 2024-12-04 15:12:38,834] Trial 1071 finished with value: 0.13435444379444209 and parameters: {'kernel_type': 'Matern', 'length_scale': 0.18010034912141332, 'noise_level': 0.9247401814914392, 'constant_value': 57.8232508869679, 'nu': 1.5}. Best is trial 750 with value: 0.13435342446039877.
[I 2024-12-04 15:12:41,517] Trial 1092 finished with value: 0.1343543735442877 and parameters: {'kernel_type': 'Matern', 'length_scale': 1.315666642844291, 'noise_level': 0.00041208603530008543, 'constant_value': 170.8575561703699, 'nu': 1.5}. Best is trial 750 with value: 0.13435342446039877.
[I 2024-12-04 15:12:41,521] Trial 1089 finished with value: 0.13435449910644864 and parameters: {'kernel_type': 'Matern', 'length_scale': 42.61342509537127, 'noise_level': 0.004269989936874067, 'constant_value': 99412.53469063692, 'nu': 1.5}. Best is trial 750 with value: 0.13435342446039877.
[I 2024-12-04 15:12:43,104] Trial 1090 finished with value: 0.1343544841569053 and parameters: {'kernel_type': 'Matern', 'length_scale': 16.682479872421787, 'noise_level': 0.00023945051597380596, 'constant_value': 2141.265855104017, 'nu': 1.5}. Best is trial 750 with value: 0.13435342446039877.
[I 2024-12-04 15:12:43,742] Trial 1093 finished with value: 1.3007745979657148 and parameters: {'kernel_type': 'Matern', 'length_scale': 39.40345015347148, 'noise_level': 0.0011237495447065898, 'constant_value': 85275.82235410284, 'nu': 1.5}. Best is trial 750 with value: 0.13435342446039877.
[I 2024-12-04 15:12:45,163] Trial 1087 finished with value: 1.2693635028557042 and parameters: {'kernel_type': 'RBF', 'length_scale': 0.008936644965540886, 'noise_level': 0.07253409487893388, 'constant_value': 0.08322607897755036, 'nu': 1.5}. Best is trial 750 with value: 0.13435342446039877.
[I 2024-12-04 15:12:45,916] Trial 1091 finished with value: 1.2693635028677956 and parameters: {'kernel_type': 'RBF', 'length_scale': 0.0010591694895809474, 'noise_level': 0.0041485037416387925, 'constant_value': 1.7396988146169229e-06, 'nu': 2.5}. Best is trial 750 with value: 0.13435342446039877.
[I 2024-12-04 15:12:45,941] Trial 1095 finished with value: 0.134354396351229 and parameters: {'kernel_type': 'Matern', 'length_scale': 193.68812310487093, 'noise_level': 0.9004993159260445, 'constant_value': 4051.070730321189, 'nu': 1.5}. Best is trial 750 with value: 0.13435342446039877.
[I 2024-12-04 15:12:46,263] Trial 1096 finished with value: 0.13435410633911288 and parameters: {'kernel_type': 'Matern', 'length_scale': 7.110471060085486, 'noise_level': 0.04986081523990423, 'constant_value': 1321.6556305629563, 'nu': 1.5}. Best is trial 750 with value: 0.13435342446039877.
[I 2024-12-04 15:12:51,140] Trial 1084 finished with value: 1.2693635028685204 and parameters: {'kernel_type': 'Matern', 'length_scale': 671.7169706426959, 'noise_level': 0.023001924986200933, 'constant_value': 0.13921959873299264, 'nu': 1.5}. Best is trial 750 with value: 0.13435342446039877.
[I 2024-12-04 15:12:52,487] Trial 1103 finished with value: 0.13435441701609457 and parameters: {'kernel_type': 'Matern', 'length_scale': 20.277925046965166, 'noise_level': 0.024844970964260873, 'constant_value': 98802.4852903423, 'nu': 1.5}. Best is trial 750 with value: 0.13435342446039877.
[I 2024-12-04 15:12:53,281] Trial 1101 finished with value: 0.13435443380574658 and parameters: {'kernel_type': 'Matern', 'length_scale': 0.6424307253379742, 'noise_level': 0.9036512548084186, 'constant_value': 51.972921381254324, 'nu': 1.5}. Best is trial 750 with value: 0.13435342446039877.
[I 2024-12-04 15:12:53,514] Trial 1106 finished with value: 0.13435447754028754 and parameters: {'kernel_type': 'Matern', 'length_scale': 190.2622114186657, 'noise_level': 0.0059634354468378215, 'constant_value': 1628.2890027321207, 'nu': 1.5}. Best is trial 750 with value: 0.13435342446039877.
[I 2024-12-04 15:12:53,778] Trial 1100 finished with value: 0.13435440905861448 and parameters: {'kernel_type': 'Matern', 'length_scale': 50.175011846696464, 'noise_level': 0.010694808300652846, 'constant_value': 573.9188649121114, 'nu': 1.5}. Best is trial 750 with value: 0.13435342446039877.
[I 2024-12-04 15:12:53,941] Trial 1097 finished with value: 0.13435453047955345 and parameters: {'kernel_type': 'Matern', 'length_scale': 4.074725642822408, 'noise_level': 0.07643456448692364, 'constant_value': 6.644504689611431, 'nu': 1.5}. Best is trial 750 with value: 0.13435342446039877.
[I 2024-12-04 15:12:55,024] Trial 1099 finished with value: 0.14859774820506688 and parameters: {'kernel_type': 'Matern', 'length_scale': 0.20264823298538184, 'noise_level': 0.06276613640484895, 'constant_value': 59.31319120977372, 'nu': 2.5}. Best is trial 750 with value: 0.13435342446039877.
[I 2024-12-04 15:12:55,613] Trial 1108 finished with value: 0.13435439297830337 and parameters: {'kernel_type': 'Matern', 'length_scale': 0.7273623013625549, 'noise_level': 0.012226413965502739, 'constant_value': 589.9916960101203, 'nu': 1.5}. Best is trial 750 with value: 0.13435342446039877.
[I 2024-12-04 15:12:56,087] Trial 1085 finished with value: 0.13435448339656889 and parameters: {'kernel_type': 'Matern', 'length_scale': 21.227111044345577, 'noise_level': 0.0005270927764038962, 'constant_value': 71881.67245027634, 'nu': 1.5}. Best is trial 750 with value: 0.13435342446039877.
[I 2024-12-04 15:12:57,821] Trial 1098 finished with value: 0.1343543362549202 and parameters: {'kernel_type': 'Matern', 'length_scale': 936.1050251883478, 'noise_level': 0.07255131443979153, 'constant_value': 455.89489819810535, 'nu': 1.5}. Best is trial 750 with value: 0.13435342446039877.
[I 2024-12-04 15:12:58,024] Trial 1102 finished with value: 0.13435437506155587 and parameters: {'kernel_type': 'Matern', 'length_scale': 0.7005878986932138, 'noise_level': 0.010205477569503359, 'constant_value': 556.0876234502188, 'nu': 1.5}. Best is trial 750 with value: 0.13435342446039877.
[I 2024-12-04 15:13:02,332] Trial 1110 finished with value: 0.13435440043745225 and parameters: {'kernel_type': 'Matern', 'length_scale': 3.8105743434377857, 'noise_level': 0.553142465738146, 'constant_value': 1.2745183013864787, 'nu': 1.5}. Best is trial 750 with value: 0.13435342446039877.
[I 2024-12-04 15:13:02,596] Trial 1109 finished with value: 1.2693635028569685 and parameters: {'kernel_type': 'RBF', 'length_scale': 53.418621250598015, 'noise_level': 1.805452188196432e-08, 'constant_value': 1.2753631257563605, 'nu': 2.5}. Best is trial 750 with value: 0.13435342446039877.
[I 2024-12-04 15:13:02,876] Trial 1094 finished with value: 0.13435418475526428 and parameters: {'kernel_type': 'Matern', 'length_scale': 6.194245361489771, 'noise_level': 0.009371348934311893, 'constant_value': 372.8303749810645, 'nu': 1.5}. Best is trial 750 with value: 0.13435342446039877.
[I 2024-12-04 15:13:05,792] Trial 1114 finished with value: 0.13435440580734728 and parameters: {'kernel_type': 'Matern', 'length_scale': 7.242184044304599, 'noise_level': 0.05513300613508799, 'constant_value': 16.641753350431763, 'nu': 1.5}. Best is trial 750 with value: 0.13435342446039877.
[I 2024-12-04 15:13:05,937] Trial 1107 finished with value: 0.13435440044783326 and parameters: {'kernel_type': 'Matern', 'length_scale': 0.28309980210670793, 'noise_level': 0.018985129090638046, 'constant_value': 128.03358199917506, 'nu': 1.5}. Best is trial 750 with value: 0.13435342446039877.
[I 2024-12-04 15:13:07,780] Trial 1105 finished with value: 0.13435411211528944 and parameters: {'kernel_type': 'Matern', 'length_scale': 1.8017151055324259, 'noise_level': 0.0013519718972332092, 'constant_value': 19.29594395276083, 'nu': 1.5}. Best is trial 750 with value: 0.13435342446039877.
[I 2024-12-04 15:13:08,308] Trial 1112 finished with value: 0.13435441640437823 and parameters: {'kernel_type': 'Matern', 'length_scale': 33.05733746099006, 'noise_level': 0.009742808477155909, 'constant_value': 281.32205641819246, 'nu': 1.5}. Best is trial 750 with value: 0.13435342446039877.
[I 2024-12-04 15:13:08,382] Trial 1111 finished with value: 0.1343544008958223 and parameters: {'kernel_type': 'Matern', 'length_scale': 21.485645085044233, 'noise_level': 0.0021329109208686886, 'constant_value': 2.6054788257396755, 'nu': 1.5}. Best is trial 750 with value: 0.13435342446039877.
[I 2024-12-04 15:13:08,411] Trial 1115 finished with value: 1.3007745979329182 and parameters: {'kernel_type': 'Matern', 'length_scale': 1.385446285949949, 'noise_level': 1.9012058892968685e-05, 'constant_value': 78148.89651915988, 'nu': 1.5}. Best is trial 750 with value: 0.13435342446039877.
[I 2024-12-04 15:13:08,977] Trial 1104 finished with value: 0.1343544095373788 and parameters: {'kernel_type': 'Matern', 'length_scale': 46.74313855081174, 'noise_level': 0.0004489422135814687, 'constant_value': 1012.0172312894674, 'nu': 1.5}. Best is trial 750 with value: 0.13435342446039877.
