[I 2024-12-04 15:04:09,202] Trial 1072 finished with value: 0.5086929887075132 and parameters: {'n_estimators': 1117, 'learning_rate': 0.08545661087625663, 'max_depth': 10, 'min_samples_split': 20, 'min_samples_leaf': 1, 'subsample': 0.9561300443438696, 'max_features': None}. Best is trial 603 with value: 0.45955205541891275.
[I 2024-12-04 15:04:10,836] Trial 1073 finished with value: 0.477570780830439 and parameters: {'n_estimators': 1123, 'learning_rate': 0.08134968634354194, 'max_depth': 12, 'min_samples_split': 20, 'min_samples_leaf': 1, 'subsample': 0.9020265552640713, 'max_features': None}. Best is trial 603 with value: 0.45955205541891275.
[I 2024-12-04 15:04:13,140] Trial 1095 finished with value: 0.6675820606354044 and parameters: {'n_estimators': 293, 'learning_rate': 0.07905826164918035, 'max_depth': 10, 'min_samples_split': 15, 'min_samples_leaf': 4, 'subsample': 0.9898740039811342, 'max_features': None}. Best is trial 603 with value: 0.45955205541891275.
[I 2024-12-04 15:04:14,401] Trial 1065 finished with value: 0.674292377610622 and parameters: {'n_estimators': 1483, 'learning_rate': 0.0873542311987578, 'max_depth': 11, 'min_samples_split': 11, 'min_samples_leaf': 4, 'subsample': 0.9746547379396163, 'max_features': None}. Best is trial 603 with value: 0.45955205541891275.
[I 2024-12-04 15:04:14,595] Trial 1071 finished with value: 0.4777047119069635 and parameters: {'n_estimators': 1354, 'learning_rate': 0.05271034439161182, 'max_depth': 10, 'min_samples_split': 18, 'min_samples_leaf': 1, 'subsample': 0.9079926207694123, 'max_features': None}. Best is trial 603 with value: 0.45955205541891275.
[I 2024-12-04 15:04:15,706] Trial 1088 finished with value: 0.8086694338191355 and parameters: {'n_estimators': 1035, 'learning_rate': 0.0392833346995585, 'max_depth': 7, 'min_samples_split': 10, 'min_samples_leaf': 9, 'subsample': 0.9060010628614591, 'max_features': 'sqrt'}. Best is trial 603 with value: 0.45955205541891275.
[I 2024-12-04 15:04:16,615] Trial 1070 finished with value: 0.4956912353185747 and parameters: {'n_estimators': 1441, 'learning_rate': 0.04823918361596846, 'max_depth': 9, 'min_samples_split': 17, 'min_samples_leaf': 1, 'subsample': 0.8795846698054376, 'max_features': None}. Best is trial 603 with value: 0.45955205541891275.
[I 2024-12-04 15:04:17,503] Trial 1094 finished with value: 0.6555449096946009 and parameters: {'n_estimators': 380, 'learning_rate': 0.09239706808609598, 'max_depth': 11, 'min_samples_split': 15, 'min_samples_leaf': 4, 'subsample': 0.9820046150406878, 'max_features': None}. Best is trial 603 with value: 0.45955205541891275.
[I 2024-12-04 15:04:17,517] Trial 1068 finished with value: 0.49910783296558403 and parameters: {'n_estimators': 1487, 'learning_rate': 0.07526999336260275, 'max_depth': 10, 'min_samples_split': 15, 'min_samples_leaf': 1, 'subsample': 0.9872373503498229, 'max_features': None}. Best is trial 603 with value: 0.45955205541891275.
[I 2024-12-04 15:04:19,502] Trial 1083 finished with value: 0.5025743247010395 and parameters: {'n_estimators': 1066, 'learning_rate': 0.039364960117511595, 'max_depth': 10, 'min_samples_split': 20, 'min_samples_leaf': 1, 'subsample': 0.9869016989067723, 'max_features': None}. Best is trial 603 with value: 0.45955205541891275.
[I 2024-12-04 15:04:19,536] Trial 1099 finished with value: 0.8262862917075497 and parameters: {'n_estimators': 453, 'learning_rate': 0.025733196145070605, 'max_depth': 3, 'min_samples_split': 13, 'min_samples_leaf': 10, 'subsample': 0.9969307781411763, 'max_features': 'sqrt'}. Best is trial 603 with value: 0.45955205541891275.
[I 2024-12-04 15:04:20,564] Trial 1079 finished with value: 0.4815529163081688 and parameters: {'n_estimators': 1211, 'learning_rate': 0.05557225946134741, 'max_depth': 12, 'min_samples_split': 19, 'min_samples_leaf': 1, 'subsample': 0.9897314663637429, 'max_features': None}. Best is trial 603 with value: 0.45955205541891275.
[I 2024-12-04 15:04:20,683] Trial 1076 finished with value: 0.48011961411073856 and parameters: {'n_estimators': 1278, 'learning_rate': 0.03841084652903925, 'max_depth': 11, 'min_samples_split': 20, 'min_samples_leaf': 1, 'subsample': 0.9919223042366663, 'max_features': None}. Best is trial 603 with value: 0.45955205541891275.
[I 2024-12-04 15:04:22,095] Trial 1078 finished with value: 0.5126677202189737 and parameters: {'n_estimators': 1246, 'learning_rate': 0.040562977877534656, 'max_depth': 10, 'min_samples_split': 16, 'min_samples_leaf': 1, 'subsample': 0.9740125682640184, 'max_features': None}. Best is trial 603 with value: 0.45955205541891275.
[I 2024-12-04 15:04:22,308] Trial 1085 finished with value: 0.6280261187077574 and parameters: {'n_estimators': 1053, 'learning_rate': 0.06418209957883783, 'max_depth': 11, 'min_samples_split': 18, 'min_samples_leaf': 2, 'subsample': 0.9847404688058968, 'max_features': None}. Best is trial 603 with value: 0.45955205541891275.
[I 2024-12-04 15:04:24,851] Trial 1075 finished with value: 0.4725394857141695 and parameters: {'n_estimators': 1383, 'learning_rate': 0.03737293801201916, 'max_depth': 12, 'min_samples_split': 20, 'min_samples_leaf': 1, 'subsample': 0.991364657195601, 'max_features': None}. Best is trial 603 with value: 0.45955205541891275.
[I 2024-12-04 15:04:26,834] Trial 1087 finished with value: 0.652140346373361 and parameters: {'n_estimators': 1130, 'learning_rate': 0.059077820901746736, 'max_depth': 12, 'min_samples_split': 14, 'min_samples_leaf': 3, 'subsample': 0.9976013624325962, 'max_features': None}. Best is trial 603 with value: 0.45955205541891275.
[I 2024-12-04 15:04:27,734] Trial 1084 finished with value: 0.4917569799433093 and parameters: {'n_estimators': 1243, 'learning_rate': 0.05051324208127219, 'max_depth': 12, 'min_samples_split': 17, 'min_samples_leaf': 1, 'subsample': 0.9821137177160904, 'max_features': None}. Best is trial 603 with value: 0.45955205541891275.
[I 2024-12-04 15:04:29,298] Trial 1102 finished with value: 1.1622046532372488 and parameters: {'n_estimators': 681, 'learning_rate': 0.011146349399003814, 'max_depth': 10, 'min_samples_split': 2, 'min_samples_leaf': 9, 'subsample': 0.6479607171836294, 'max_features': 'log2'}. Best is trial 603 with value: 0.45955205541891275.
[I 2024-12-04 15:04:30,009] Trial 1082 finished with value: 0.7544354041258621 and parameters: {'n_estimators': 1486, 'learning_rate': 0.035083545608073044, 'max_depth': 8, 'min_samples_split': 13, 'min_samples_leaf': 9, 'subsample': 0.8930562554200323, 'max_features': None}. Best is trial 603 with value: 0.45955205541891275.
[I 2024-12-04 15:04:31,567] Trial 1090 finished with value: 0.6817825720561322 and parameters: {'n_estimators': 1360, 'learning_rate': 0.05270828785527747, 'max_depth': 12, 'min_samples_split': 19, 'min_samples_leaf': 2, 'subsample': 0.9934926230966654, 'max_features': 'log2'}. Best is trial 603 with value: 0.45955205541891275.
[I 2024-12-04 15:04:32,776] Trial 1101 finished with value: 0.5181657837416253 and parameters: {'n_estimators': 668, 'learning_rate': 0.06684670949651235, 'max_depth': 12, 'min_samples_split': 13, 'min_samples_leaf': 1, 'subsample': 0.9947794549513376, 'max_features': None}. Best is trial 603 with value: 0.45955205541891275.
[I 2024-12-04 15:04:32,831] Trial 1089 finished with value: 0.6062552443424454 and parameters: {'n_estimators': 1410, 'learning_rate': 0.05742370209451048, 'max_depth': 11, 'min_samples_split': 20, 'min_samples_leaf': 1, 'subsample': 0.9812848837375846, 'max_features': 'log2'}. Best is trial 603 with value: 0.45955205541891275.
[I 2024-12-04 15:04:36,642] Trial 1100 finished with value: 0.6498632525685085 and parameters: {'n_estimators': 845, 'learning_rate': 0.07303195502946659, 'max_depth': 10, 'min_samples_split': 17, 'min_samples_leaf': 3, 'subsample': 0.9070533617415479, 'max_features': None}. Best is trial 603 with value: 0.45955205541891275.
[I 2024-12-04 15:04:40,792] Trial 1109 finished with value: 0.7409022723954882 and parameters: {'n_estimators': 755, 'learning_rate': 0.027192230812110054, 'max_depth': 12, 'min_samples_split': 20, 'min_samples_leaf': 9, 'subsample': 0.7486231158487489, 'max_features': None}. Best is trial 603 with value: 0.45955205541891275.
[I 2024-12-04 15:04:42,539] Trial 1092 finished with value: 0.5076612651630419 and parameters: {'n_estimators': 1269, 'learning_rate': 0.0896118597761234, 'max_depth': 10, 'min_samples_split': 20, 'min_samples_leaf': 1, 'subsample': 0.9186380393980502, 'max_features': None}. Best is trial 603 with value: 0.45955205541891275.
[I 2024-12-04 15:04:42,591] Trial 1114 finished with value: 0.7201838803929318 and parameters: {'n_estimators': 679, 'learning_rate': 0.010163924728550178, 'max_depth': 6, 'min_samples_split': 18, 'min_samples_leaf': 4, 'subsample': 0.6262176137044243, 'max_features': 'sqrt'}. Best is trial 603 with value: 0.45955205541891275.
[I 2024-12-04 15:04:43,442] Trial 1097 finished with value: 0.6727857988771819 and parameters: {'n_estimators': 1164, 'learning_rate': 0.07832370656356295, 'max_depth': 12, 'min_samples_split': 19, 'min_samples_leaf': 3, 'subsample': 0.9050697107265434, 'max_features': None}. Best is trial 603 with value: 0.45955205541891275.
[I 2024-12-04 15:04:45,792] Trial 1091 finished with value: 0.6655672828884932 and parameters: {'n_estimators': 1396, 'learning_rate': 0.06577256510353742, 'max_depth': 11, 'min_samples_split': 20, 'min_samples_leaf': 2, 'subsample': 0.8830789297134457, 'max_features': None}. Best is trial 603 with value: 0.45955205541891275.
[I 2024-12-04 15:04:46,973] Trial 1103 finished with value: 0.5113656912397946 and parameters: {'n_estimators': 1058, 'learning_rate': 0.0899932765095415, 'max_depth': 12, 'min_samples_split': 16, 'min_samples_leaf': 1, 'subsample': 0.8842403853687466, 'max_features': None}. Best is trial 603 with value: 0.45955205541891275.
[I 2024-12-04 15:04:47,061] Trial 1110 finished with value: 0.47349973753201957 and parameters: {'n_estimators': 821, 'learning_rate': 0.09524296952124056, 'max_depth': 12, 'min_samples_split': 18, 'min_samples_leaf': 1, 'subsample': 0.9864492583717736, 'max_features': None}. Best is trial 603 with value: 0.45955205541891275.
[I 2024-12-04 15:04:49,481] Trial 1125 finished with value: 0.8889429417322375 and parameters: {'n_estimators': 570, 'learning_rate': 0.02515206406882741, 'max_depth': 8, 'min_samples_split': 2, 'min_samples_leaf': 10, 'subsample': 0.6180311470506636, 'max_features': 'sqrt'}. Best is trial 603 with value: 0.45955205541891275.
[I 2024-12-04 15:04:51,126] Trial 1105 finished with value: 0.6119257672950376 and parameters: {'n_estimators': 1355, 'learning_rate': 0.019478164191805564, 'max_depth': 3, 'min_samples_split': 7, 'min_samples_leaf': 4, 'subsample': 0.9518991318989326, 'max_features': 'sqrt'}. Best is trial 603 with value: 0.45955205541891275.
[I 2024-12-04 15:04:51,150] Trial 1093 finished with value: 0.5049207627877482 and parameters: {'n_estimators': 1470, 'learning_rate': 0.0687399374643752, 'max_depth': 10, 'min_samples_split': 20, 'min_samples_leaf': 1, 'subsample': 0.8862628257841729, 'max_features': None}. Best is trial 603 with value: 0.45955205541891275.
[I 2024-12-04 15:04:52,618] Trial 1096 finished with value: 0.48043397066648 and parameters: {'n_estimators': 1402, 'learning_rate': 0.09910900473432643, 'max_depth': 10, 'min_samples_split': 19, 'min_samples_leaf': 1, 'subsample': 0.9765881019902241, 'max_features': None}. Best is trial 603 with value: 0.45955205541891275.
[I 2024-12-04 15:04:53,872] Trial 1098 finished with value: 0.5067124151692911 and parameters: {'n_estimators': 1384, 'learning_rate': 0.03149208475123283, 'max_depth': 12, 'min_samples_split': 19, 'min_samples_leaf': 1, 'subsample': 0.7765476450537311, 'max_features': None}. Best is trial 603 with value: 0.45955205541891275.
[I 2024-12-04 15:04:55,598] Trial 1106 finished with value: 0.6768665000147771 and parameters: {'n_estimators': 1258, 'learning_rate': 0.09748726047158505, 'max_depth': 10, 'min_samples_split': 20, 'min_samples_leaf': 2, 'subsample': 0.8929372397562712, 'max_features': None}. Best is trial 603 with value: 0.45955205541891275.
[I 2024-12-04 15:04:56,449] Trial 1124 finished with value: 0.8302234616535971 and parameters: {'n_estimators': 829, 'learning_rate': 0.01884354144692677, 'max_depth': 6, 'min_samples_split': 20, 'min_samples_leaf': 4, 'subsample': 0.6695258722205581, 'max_features': 'log2'}. Best is trial 603 with value: 0.45955205541891275.
[I 2024-12-04 15:04:56,915] Trial 1111 finished with value: 0.5399631011120652 and parameters: {'n_estimators': 1221, 'learning_rate': 0.09758126804230428, 'max_depth': 11, 'min_samples_split': 20, 'min_samples_leaf': 1, 'subsample': 0.8875446535318944, 'max_features': 'sqrt'}. Best is trial 603 with value: 0.45955205541891275.
[I 2024-12-04 15:04:57,481] Trial 1104 finished with value: 0.49199241381057607 and parameters: {'n_estimators': 1314, 'learning_rate': 0.09132977825552503, 'max_depth': 12, 'min_samples_split': 19, 'min_samples_leaf': 1, 'subsample': 0.8862823019999606, 'max_features': None}. Best is trial 603 with value: 0.45955205541891275.
[I 2024-12-04 15:04:57,673] Trial 1120 finished with value: 0.8244954566872393 and parameters: {'n_estimators': 1002, 'learning_rate': 0.056873619976826814, 'max_depth': 12, 'min_samples_split': 10, 'min_samples_leaf': 9, 'subsample': 0.784761495840748, 'max_features': 'sqrt'}. Best is trial 603 with value: 0.45955205541891275.
[I 2024-12-04 15:04:58,953] Trial 1113 finished with value: 0.7472684150723292 and parameters: {'n_estimators': 1241, 'learning_rate': 0.03393370679462663, 'max_depth': 12, 'min_samples_split': 7, 'min_samples_leaf': 7, 'subsample': 0.6068144315573227, 'max_features': 'sqrt'}. Best is trial 603 with value: 0.45955205541891275.
[I 2024-12-04 15:04:59,215] Trial 1112 finished with value: 0.4840634070347548 and parameters: {'n_estimators': 1073, 'learning_rate': 0.049097355181285884, 'max_depth': 12, 'min_samples_split': 18, 'min_samples_leaf': 1, 'subsample': 0.9595371675664783, 'max_features': None}. Best is trial 603 with value: 0.45955205541891275.
[I 2024-12-04 15:04:59,379] Trial 1107 finished with value: 0.48851580528771665 and parameters: {'n_estimators': 1256, 'learning_rate': 0.06021342684497099, 'max_depth': 10, 'min_samples_split': 20, 'min_samples_leaf': 1, 'subsample': 0.9360284741606034, 'max_features': None}. Best is trial 603 with value: 0.45955205541891275.
[I 2024-12-04 15:05:00,638] Trial 1137 finished with value: 0.7991350676099703 and parameters: {'n_estimators': 175, 'learning_rate': 0.02264411974701548, 'max_depth': 12, 'min_samples_split': 6, 'min_samples_leaf': 4, 'subsample': 0.8331033196974086, 'max_features': 'sqrt'}. Best is trial 603 with value: 0.45955205541891275.
[I 2024-12-04 15:05:01,123] Trial 1117 finished with value: 0.6464618058902066 and parameters: {'n_estimators': 1005, 'learning_rate': 0.023278900991942915, 'max_depth': 11, 'min_samples_split': 9, 'min_samples_leaf': 8, 'subsample': 0.9452714767539754, 'max_features': None}. Best is trial 603 with value: 0.45955205541891275.
[I 2024-12-04 15:05:03,716] Trial 1123 finished with value: 0.7474925277685658 and parameters: {'n_estimators': 990, 'learning_rate': 0.022032824621963893, 'max_depth': 8, 'min_samples_split': 2, 'min_samples_leaf': 10, 'subsample': 0.7772270597296971, 'max_features': None}. Best is trial 603 with value: 0.45955205541891275.
[I 2024-12-04 15:05:04,070] Trial 1108 finished with value: 0.4864815269585383 and parameters: {'n_estimators': 1317, 'learning_rate': 0.06594180215366796, 'max_depth': 12, 'min_samples_split': 20, 'min_samples_leaf': 1, 'subsample': 0.8035982331921954, 'max_features': None}. Best is trial 603 with value: 0.45955205541891275.
[I 2024-12-04 15:05:05,320] Trial 1116 finished with value: 0.47369315615198593 and parameters: {'n_estimators': 1109, 'learning_rate': 0.05070679250074818, 'max_depth': 11, 'min_samples_split': 20, 'min_samples_leaf': 1, 'subsample': 0.9821190331289277, 'max_features': None}. Best is trial 603 with value: 0.45955205541891275.
[I 2024-12-04 15:05:08,387] Trial 1148 finished with value: 1.2098056338421332 and parameters: {'n_estimators': 140, 'learning_rate': 0.012385047328273632, 'max_depth': 7, 'min_samples_split': 20, 'min_samples_leaf': 10, 'subsample': 0.8534173759620509, 'max_features': 'log2'}. Best is trial 603 with value: 0.45955205541891275.
[I 2024-12-04 15:05:09,459] Trial 1118 finished with value: 0.498721093296375 and parameters: {'n_estimators': 1196, 'learning_rate': 0.05187287177131065, 'max_depth': 11, 'min_samples_split': 17, 'min_samples_leaf': 1, 'subsample': 0.9148463450524034, 'max_features': None}. Best is trial 603 with value: 0.45955205541891275.
[I 2024-12-04 15:05:09,540] Trial 1122 finished with value: 0.6066072531244915 and parameters: {'n_estimators': 1335, 'learning_rate': 0.09449441493776205, 'max_depth': 9, 'min_samples_split': 20, 'min_samples_leaf': 1, 'subsample': 0.9120736801195479, 'max_features': 'log2'}. Best is trial 603 with value: 0.45955205541891275.
[I 2024-12-04 15:05:11,036] Trial 1119 finished with value: 0.7440403909729338 and parameters: {'n_estimators': 1309, 'learning_rate': 0.02349842284752324, 'max_depth': 9, 'min_samples_split': 19, 'min_samples_leaf': 10, 'subsample': 0.9502151565234149, 'max_features': None}. Best is trial 603 with value: 0.45955205541891275.
[I 2024-12-04 15:05:12,311] Trial 1130 finished with value: 0.47269380631823327 and parameters: {'n_estimators': 725, 'learning_rate': 0.0972665596606238, 'max_depth': 12, 'min_samples_split': 18, 'min_samples_leaf': 1, 'subsample': 0.9945805899204863, 'max_features': None}. Best is trial 603 with value: 0.45955205541891275.
[I 2024-12-04 15:05:13,225] Trial 1143 finished with value: 0.7993383435597388 and parameters: {'n_estimators': 422, 'learning_rate': 0.045430666052323106, 'max_depth': 3, 'min_samples_split': 4, 'min_samples_leaf': 10, 'subsample': 0.9992348938261681, 'max_features': 'sqrt'}. Best is trial 603 with value: 0.45955205541891275.
[I 2024-12-04 15:05:13,471] Trial 1121 finished with value: 0.5108886873989049 and parameters: {'n_estimators': 1246, 'learning_rate': 0.09894925184689721, 'max_depth': 10, 'min_samples_split': 16, 'min_samples_leaf': 1, 'subsample': 0.9861386663604172, 'max_features': None}. Best is trial 603 with value: 0.45955205541891275.
[I 2024-12-04 15:05:14,250] Trial 1126 finished with value: 0.8025063834858315 and parameters: {'n_estimators': 1352, 'learning_rate': 0.02363620136723065, 'max_depth': 8, 'min_samples_split': 18, 'min_samples_leaf': 8, 'subsample': 0.8125123530883694, 'max_features': 'log2'}. Best is trial 603 with value: 0.45955205541891275.
[I 2024-12-04 15:05:14,402] Trial 1127 finished with value: 0.5304898554051984 and parameters: {'n_estimators': 1101, 'learning_rate': 0.061977563953488475, 'max_depth': 12, 'min_samples_split': 15, 'min_samples_leaf': 1, 'subsample': 0.9072895799081797, 'max_features': None}. Best is trial 603 with value: 0.45955205541891275.
[I 2024-12-04 15:05:15,785] Trial 1115 finished with value: 0.6671782557584176 and parameters: {'n_estimators': 1479, 'learning_rate': 0.09478625450266798, 'max_depth': 11, 'min_samples_split': 20, 'min_samples_leaf': 3, 'subsample': 0.9151582498961639, 'max_features': None}. Best is trial 603 with value: 0.45955205541891275.
[I 2024-12-04 15:05:19,654] Trial 1136 finished with value: 0.5016525390737775 and parameters: {'n_estimators': 774, 'learning_rate': 0.09562870440285269, 'max_depth': 12, 'min_samples_split': 20, 'min_samples_leaf': 1, 'subsample': 0.9944302623236179, 'max_features': None}. Best is trial 603 with value: 0.45955205541891275.
[I 2024-12-04 15:05:19,703] Trial 1128 finished with value: 0.659234209240476 and parameters: {'n_estimators': 1424, 'learning_rate': 0.010086853009557896, 'max_depth': 10, 'min_samples_split': 10, 'min_samples_leaf': 5, 'subsample': 0.6822761866926608, 'max_features': 'sqrt'}. Best is trial 603 with value: 0.45955205541891275.
[I 2024-12-04 15:05:24,718] Trial 1145 finished with value: 0.48140224330758863 and parameters: {'n_estimators': 677, 'learning_rate': 0.07716983271358933, 'max_depth': 10, 'min_samples_split': 18, 'min_samples_leaf': 1, 'subsample': 0.9907968929687601, 'max_features': None}. Best is trial 603 with value: 0.45955205541891275.
[I 2024-12-04 15:05:28,083] Trial 1134 finished with value: 0.6252985134372077 and parameters: {'n_estimators': 1146, 'learning_rate': 0.044143119299699496, 'max_depth': 12, 'min_samples_split': 18, 'min_samples_leaf': 3, 'subsample': 0.9998761123107313, 'max_features': None}. Best is trial 603 with value: 0.45955205541891275.
[I 2024-12-04 15:05:29,262] Trial 1157 finished with value: 0.5001354913612575 and parameters: {'n_estimators': 664, 'learning_rate': 0.08496066416060336, 'max_depth': 11, 'min_samples_split': 7, 'min_samples_leaf': 1, 'subsample': 0.7745460260988161, 'max_features': 'sqrt'}. Best is trial 603 with value: 0.45955205541891275.
[I 2024-12-04 15:05:29,289] Trial 1141 finished with value: 0.5366347186737134 and parameters: {'n_estimators': 1044, 'learning_rate': 0.025285180949104615, 'max_depth': 8, 'min_samples_split': 10, 'min_samples_leaf': 1, 'subsample': 0.693085493008956, 'max_features': None}. Best is trial 603 with value: 0.45955205541891275.
[I 2024-12-04 15:05:29,893] Trial 1147 finished with value: 0.8473723628289418 and parameters: {'n_estimators': 1001, 'learning_rate': 0.0772381590771212, 'max_depth': 5, 'min_samples_split': 13, 'min_samples_leaf': 10, 'subsample': 0.6514007827241375, 'max_features': 'sqrt'}. Best is trial 603 with value: 0.45955205541891275.
[I 2024-12-04 15:05:32,430] Trial 1135 finished with value: 0.6489403272643145 and parameters: {'n_estimators': 1288, 'learning_rate': 0.06188571926294773, 'max_depth': 12, 'min_samples_split': 16, 'min_samples_leaf': 3, 'subsample': 0.9424154489812157, 'max_features': None}. Best is trial 603 with value: 0.45955205541891275.
