[I 2024-12-04 15:22:56,539] Trial 2068 finished with value: 0.45816850975689305 and parameters: {'n_estimators': 930, 'learning_rate': 0.0857214988689281, 'max_depth': 12, 'min_samples_split': 20, 'min_samples_leaf': 1, 'subsample': 0.9955296258074476, 'max_features': None}. Best is trial 1435 with value: 0.45467030752684195.
[I 2024-12-04 15:22:56,544] Trial 2069 finished with value: 0.503529227060613 and parameters: {'n_estimators': 943, 'learning_rate': 0.09634053341770162, 'max_depth': 12, 'min_samples_split': 16, 'min_samples_leaf': 1, 'subsample': 0.9978263363469744, 'max_features': None}. Best is trial 1435 with value: 0.45467030752684195.
[I 2024-12-04 15:22:57,874] Trial 2061 finished with value: 0.4638813194875356 and parameters: {'n_estimators': 1087, 'learning_rate': 0.06764894641914261, 'max_depth': 12, 'min_samples_split': 20, 'min_samples_leaf': 1, 'subsample': 0.9939326748446379, 'max_features': None}. Best is trial 1435 with value: 0.45467030752684195.
[I 2024-12-04 15:22:57,915] Trial 2076 finished with value: 0.4838120368719484 and parameters: {'n_estimators': 794, 'learning_rate': 0.05258825904683708, 'max_depth': 12, 'min_samples_split': 18, 'min_samples_leaf': 1, 'subsample': 0.957859873816436, 'max_features': None}. Best is trial 1435 with value: 0.45467030752684195.
[I 2024-12-04 15:23:01,054] Trial 2089 finished with value: 0.6426771947083362 and parameters: {'n_estimators': 630, 'learning_rate': 0.01999986099066071, 'max_depth': 9, 'min_samples_split': 12, 'min_samples_leaf': 4, 'subsample': 0.6537490177282492, 'max_features': 'sqrt'}. Best is trial 1435 with value: 0.45467030752684195.
[I 2024-12-04 15:23:01,752] Trial 2083 finished with value: 0.6428481840536062 and parameters: {'n_estimators': 797, 'learning_rate': 0.09825679081568676, 'max_depth': 12, 'min_samples_split': 16, 'min_samples_leaf': 4, 'subsample': 0.9113574803551747, 'max_features': None}. Best is trial 1435 with value: 0.45467030752684195.
[I 2024-12-04 15:23:03,183] Trial 2059 finished with value: 0.6552284136118477 and parameters: {'n_estimators': 1333, 'learning_rate': 0.09877143155348984, 'max_depth': 12, 'min_samples_split': 17, 'min_samples_leaf': 2, 'subsample': 0.9807087224365926, 'max_features': None}. Best is trial 1435 with value: 0.45467030752684195.
[I 2024-12-04 15:23:03,189] Trial 2063 finished with value: 0.4742987609295247 and parameters: {'n_estimators': 1177, 'learning_rate': 0.06839874496351567, 'max_depth': 12, 'min_samples_split': 18, 'min_samples_leaf': 1, 'subsample': 0.9852807288882645, 'max_features': None}. Best is trial 1435 with value: 0.45467030752684195.
[I 2024-12-04 15:23:03,679] Trial 2094 finished with value: 1.084668208270962 and parameters: {'n_estimators': 504, 'learning_rate': 0.010231511117477483, 'max_depth': 3, 'min_samples_split': 19, 'min_samples_leaf': 5, 'subsample': 0.8741365567190988, 'max_features': 'log2'}. Best is trial 1435 with value: 0.45467030752684195.
[I 2024-12-04 15:23:03,682] Trial 2084 finished with value: 0.5344824611249378 and parameters: {'n_estimators': 798, 'learning_rate': 0.09516666781382449, 'max_depth': 12, 'min_samples_split': 15, 'min_samples_leaf': 1, 'subsample': 0.9275064086988412, 'max_features': None}. Best is trial 1435 with value: 0.45467030752684195.
[I 2024-12-04 15:23:06,398] Trial 2071 finished with value: 0.5146928723579728 and parameters: {'n_estimators': 1144, 'learning_rate': 0.06344499575869743, 'max_depth': 12, 'min_samples_split': 13, 'min_samples_leaf': 1, 'subsample': 0.9764953887750156, 'max_features': None}. Best is trial 1435 with value: 0.45467030752684195.
[I 2024-12-04 15:23:06,399] Trial 2075 finished with value: 0.6092410808348816 and parameters: {'n_estimators': 1093, 'learning_rate': 0.05568812279557021, 'max_depth': 12, 'min_samples_split': 20, 'min_samples_leaf': 2, 'subsample': 0.9479368960730985, 'max_features': None}. Best is trial 1435 with value: 0.45467030752684195.
[I 2024-12-04 15:23:07,381] Trial 2104 finished with value: 1.0199274399577505 and parameters: {'n_estimators': 112, 'learning_rate': 0.04846860292141969, 'max_depth': 12, 'min_samples_split': 10, 'min_samples_leaf': 4, 'subsample': 0.9912322028997135, 'max_features': 'log2'}. Best is trial 1435 with value: 0.45467030752684195.
[I 2024-12-04 15:23:10,301] Trial 2086 finished with value: 0.557321453422399 and parameters: {'n_estimators': 1035, 'learning_rate': 0.0994983462744716, 'max_depth': 12, 'min_samples_split': 19, 'min_samples_leaf': 1, 'subsample': 0.9188297179179749, 'max_features': 'sqrt'}. Best is trial 1435 with value: 0.45467030752684195.
[I 2024-12-04 15:23:10,625] Trial 2087 finished with value: 0.5609573409447918 and parameters: {'n_estimators': 981, 'learning_rate': 0.06238105864151541, 'max_depth': 8, 'min_samples_split': 20, 'min_samples_leaf': 1, 'subsample': 0.9258415153365535, 'max_features': 'sqrt'}. Best is trial 1435 with value: 0.45467030752684195.
[I 2024-12-04 15:23:11,249] Trial 2072 finished with value: 0.5201629185164486 and parameters: {'n_estimators': 1173, 'learning_rate': 0.08605267943201363, 'max_depth': 12, 'min_samples_split': 16, 'min_samples_leaf': 1, 'subsample': 0.9951268397609846, 'max_features': None}. Best is trial 1435 with value: 0.45467030752684195.
[I 2024-12-04 15:23:11,624] Trial 2108 finished with value: 1.2389695887902696 and parameters: {'n_estimators': 106, 'learning_rate': 0.012738689014374874, 'max_depth': 12, 'min_samples_split': 6, 'min_samples_leaf': 10, 'subsample': 0.8346927691149778, 'max_features': 'log2'}. Best is trial 1435 with value: 0.45467030752684195.
[I 2024-12-04 15:23:12,264] Trial 2070 finished with value: 0.5164222183975006 and parameters: {'n_estimators': 1194, 'learning_rate': 0.06505084730599538, 'max_depth': 11, 'min_samples_split': 16, 'min_samples_leaf': 1, 'subsample': 0.9995263558869709, 'max_features': None}. Best is trial 1435 with value: 0.45467030752684195.
[I 2024-12-04 15:23:12,463] Trial 2090 finished with value: 0.5961320123689846 and parameters: {'n_estimators': 820, 'learning_rate': 0.01937020125669805, 'max_depth': 6, 'min_samples_split': 19, 'min_samples_leaf': 6, 'subsample': 0.9592107198585882, 'max_features': None}. Best is trial 1435 with value: 0.45467030752684195.
[I 2024-12-04 15:23:15,759] Trial 2078 finished with value: 0.4600665284161438 and parameters: {'n_estimators': 1147, 'learning_rate': 0.08323896969242033, 'max_depth': 12, 'min_samples_split': 19, 'min_samples_leaf': 1, 'subsample': 0.9912424116975275, 'max_features': None}. Best is trial 1435 with value: 0.45467030752684195.
[I 2024-12-04 15:23:16,668] Trial 2085 finished with value: 0.5222695862829807 and parameters: {'n_estimators': 1111, 'learning_rate': 0.09708975027976618, 'max_depth': 10, 'min_samples_split': 16, 'min_samples_leaf': 1, 'subsample': 0.9997725550998672, 'max_features': None}. Best is trial 1435 with value: 0.45467030752684195.
[I 2024-12-04 15:23:17,792] Trial 2088 finished with value: 0.6274914452352524 and parameters: {'n_estimators': 966, 'learning_rate': 0.06729849499245442, 'max_depth': 12, 'min_samples_split': 18, 'min_samples_leaf': 3, 'subsample': 0.9995995166281556, 'max_features': None}. Best is trial 1435 with value: 0.45467030752684195.
[I 2024-12-04 15:23:17,936] Trial 2074 finished with value: 0.5183590369652464 and parameters: {'n_estimators': 1355, 'learning_rate': 0.09778061766660699, 'max_depth': 12, 'min_samples_split': 14, 'min_samples_leaf': 1, 'subsample': 0.9384828734854019, 'max_features': None}. Best is trial 1435 with value: 0.45467030752684195.
[I 2024-12-04 15:23:18,718] Trial 2107 finished with value: 0.5111064729099947 and parameters: {'n_estimators': 294, 'learning_rate': 0.028471150890811942, 'max_depth': 11, 'min_samples_split': 7, 'min_samples_leaf': 1, 'subsample': 0.7381963439916934, 'max_features': None}. Best is trial 1435 with value: 0.45467030752684195.
[I 2024-12-04 15:23:20,490] Trial 2079 finished with value: 0.46768572382913726 and parameters: {'n_estimators': 1207, 'learning_rate': 0.08196772345868208, 'max_depth': 12, 'min_samples_split': 20, 'min_samples_leaf': 1, 'subsample': 0.9964694642714615, 'max_features': None}. Best is trial 1435 with value: 0.45467030752684195.
[I 2024-12-04 15:23:21,358] Trial 2102 finished with value: 0.6459600376181678 and parameters: {'n_estimators': 633, 'learning_rate': 0.0611248082442383, 'max_depth': 12, 'min_samples_split': 20, 'min_samples_leaf': 2, 'subsample': 0.9498801434138533, 'max_features': 'log2'}. Best is trial 1435 with value: 0.45467030752684195.
[I 2024-12-04 15:23:21,646] Trial 2115 finished with value: 1.1320989087051243 and parameters: {'n_estimators': 198, 'learning_rate': 0.032566743101692004, 'max_depth': 7, 'min_samples_split': 3, 'min_samples_leaf': 9, 'subsample': 0.8843213100894125, 'max_features': 'log2'}. Best is trial 1435 with value: 0.45467030752684195.
[I 2024-12-04 15:23:23,515] Trial 2095 finished with value: 0.48229012094321994 and parameters: {'n_estimators': 872, 'learning_rate': 0.05658950118497616, 'max_depth': 12, 'min_samples_split': 17, 'min_samples_leaf': 1, 'subsample': 0.9584424493895946, 'max_features': None}. Best is trial 1435 with value: 0.45467030752684195.
[I 2024-12-04 15:23:23,603] Trial 2098 finished with value: 0.6428160494734079 and parameters: {'n_estimators': 738, 'learning_rate': 0.058030724913187864, 'max_depth': 11, 'min_samples_split': 20, 'min_samples_leaf': 2, 'subsample': 0.9022201600482562, 'max_features': None}. Best is trial 1435 with value: 0.45467030752684195.
[I 2024-12-04 15:23:23,653] Trial 2091 finished with value: 0.9134144131147715 and parameters: {'n_estimators': 1225, 'learning_rate': 0.0200594113406157, 'max_depth': 12, 'min_samples_split': 16, 'min_samples_leaf': 8, 'subsample': 0.7471593253381998, 'max_features': 'log2'}. Best is trial 1435 with value: 0.45467030752684195.
[I 2024-12-04 15:23:26,241] Trial 2092 finished with value: 0.5009493859398279 and parameters: {'n_estimators': 1055, 'learning_rate': 0.06588540638106549, 'max_depth': 10, 'min_samples_split': 18, 'min_samples_leaf': 1, 'subsample': 0.9938752926451953, 'max_features': None}. Best is trial 1435 with value: 0.45467030752684195.
[I 2024-12-04 15:23:27,509] Trial 2097 finished with value: 0.5115353366562515 and parameters: {'n_estimators': 860, 'learning_rate': 0.06449037918216657, 'max_depth': 12, 'min_samples_split': 16, 'min_samples_leaf': 1, 'subsample': 0.9998098691700414, 'max_features': None}. Best is trial 1435 with value: 0.45467030752684195.
[I 2024-12-04 15:23:28,055] Trial 2100 finished with value: 0.599252863050354 and parameters: {'n_estimators': 870, 'learning_rate': 0.02632480251560588, 'max_depth': 3, 'min_samples_split': 5, 'min_samples_leaf': 6, 'subsample': 0.6981929956992822, 'max_features': None}. Best is trial 1435 with value: 0.45467030752684195.
[I 2024-12-04 15:23:28,685] Trial 2099 finished with value: 0.4820930270420168 and parameters: {'n_estimators': 805, 'learning_rate': 0.06922833506086892, 'max_depth': 10, 'min_samples_split': 20, 'min_samples_leaf': 1, 'subsample': 0.9035537994756553, 'max_features': None}. Best is trial 1435 with value: 0.45467030752684195.
[I 2024-12-04 15:23:29,968] Trial 2082 finished with value: 0.6838709145523968 and parameters: {'n_estimators': 1499, 'learning_rate': 0.09597281463016573, 'max_depth': 11, 'min_samples_split': 16, 'min_samples_leaf': 3, 'subsample': 0.914648253374781, 'max_features': None}. Best is trial 1435 with value: 0.45467030752684195.
[I 2024-12-04 15:23:30,055] Trial 2093 finished with value: 0.4790070062999353 and parameters: {'n_estimators': 1088, 'learning_rate': 0.09859309458054694, 'max_depth': 12, 'min_samples_split': 19, 'min_samples_leaf': 1, 'subsample': 0.9639392447973093, 'max_features': None}. Best is trial 1435 with value: 0.45467030752684195.
[I 2024-12-04 15:23:33,495] Trial 2103 finished with value: 0.6290996277458799 and parameters: {'n_estimators': 820, 'learning_rate': 0.06428584286132802, 'max_depth': 10, 'min_samples_split': 20, 'min_samples_leaf': 2, 'subsample': 0.9874249164851544, 'max_features': None}. Best is trial 1435 with value: 0.45467030752684195.
[I 2024-12-04 15:23:35,521] Trial 2096 finished with value: 0.6175014976173483 and parameters: {'n_estimators': 1388, 'learning_rate': 0.09378813974488222, 'max_depth': 5, 'min_samples_split': 10, 'min_samples_leaf': 4, 'subsample': 0.8273978213115404, 'max_features': 'log2'}. Best is trial 1435 with value: 0.45467030752684195.
[I 2024-12-04 15:23:36,625] Trial 2112 finished with value: 0.649191853912596 and parameters: {'n_estimators': 787, 'learning_rate': 0.06057250142973769, 'max_depth': 12, 'min_samples_split': 18, 'min_samples_leaf': 3, 'subsample': 0.9427967926674252, 'max_features': 'sqrt'}. Best is trial 1435 with value: 0.45467030752684195.
[I 2024-12-04 15:23:37,868] Trial 2110 finished with value: 0.6378072520683405 and parameters: {'n_estimators': 763, 'learning_rate': 0.08228638145108849, 'max_depth': 10, 'min_samples_split': 18, 'min_samples_leaf': 3, 'subsample': 0.9857077038811825, 'max_features': None}. Best is trial 1435 with value: 0.45467030752684195.
[I 2024-12-04 15:23:38,787] Trial 2106 finished with value: 0.7128624599391269 and parameters: {'n_estimators': 1064, 'learning_rate': 0.0527568081442851, 'max_depth': 4, 'min_samples_split': 16, 'min_samples_leaf': 5, 'subsample': 0.6075893639293408, 'max_features': 'sqrt'}. Best is trial 1435 with value: 0.45467030752684195.
[I 2024-12-04 15:23:39,393] Trial 2114 finished with value: 0.4694427249527709 and parameters: {'n_estimators': 666, 'learning_rate': 0.09963245721220983, 'max_depth': 10, 'min_samples_split': 20, 'min_samples_leaf': 1, 'subsample': 0.9822027529816074, 'max_features': None}. Best is trial 1435 with value: 0.45467030752684195.
[I 2024-12-04 15:23:39,851] Trial 2132 finished with value: 0.5813396610043254 and parameters: {'n_estimators': 239, 'learning_rate': 0.01714976461716523, 'max_depth': 5, 'min_samples_split': 19, 'min_samples_leaf': 6, 'subsample': 0.9324332060889585, 'max_features': None}. Best is trial 1435 with value: 0.45467030752684195.
[I 2024-12-04 15:23:41,738] Trial 2105 finished with value: 0.48535229368233146 and parameters: {'n_estimators': 978, 'learning_rate': 0.05961596571021127, 'max_depth': 10, 'min_samples_split': 20, 'min_samples_leaf': 1, 'subsample': 0.9558064333368408, 'max_features': None}. Best is trial 1435 with value: 0.45467030752684195.
[I 2024-12-04 15:23:42,669] Trial 2109 finished with value: 0.8167932780740437 and parameters: {'n_estimators': 1045, 'learning_rate': 0.02947508560602428, 'max_depth': 8, 'min_samples_split': 13, 'min_samples_leaf': 10, 'subsample': 0.6262195322763464, 'max_features': 'sqrt'}. Best is trial 1435 with value: 0.45467030752684195.
[I 2024-12-04 15:23:44,172] Trial 2101 finished with value: 0.8577581406766086 and parameters: {'n_estimators': 1393, 'learning_rate': 0.07915894528671738, 'max_depth': 7, 'min_samples_split': 19, 'min_samples_leaf': 10, 'subsample': 0.8232489425311884, 'max_features': 'sqrt'}. Best is trial 1435 with value: 0.45467030752684195.
[I 2024-12-04 15:23:46,994] Trial 2111 finished with value: 0.6560180707562296 and parameters: {'n_estimators': 1003, 'learning_rate': 0.0950740785900331, 'max_depth': 10, 'min_samples_split': 20, 'min_samples_leaf': 3, 'subsample': 0.9410000376450686, 'max_features': None}. Best is trial 1435 with value: 0.45467030752684195.
[I 2024-12-04 15:23:47,265] Trial 2113 finished with value: 0.4930362407393312 and parameters: {'n_estimators': 956, 'learning_rate': 0.08917552671534455, 'max_depth': 10, 'min_samples_split': 19, 'min_samples_leaf': 1, 'subsample': 0.9990058473769924, 'max_features': None}. Best is trial 1435 with value: 0.45467030752684195.
[I 2024-12-04 15:23:49,544] Trial 2122 finished with value: 0.6565110168609061 and parameters: {'n_estimators': 941, 'learning_rate': 0.05515867955267569, 'max_depth': 12, 'min_samples_split': 16, 'min_samples_leaf': 2, 'subsample': 0.9899302174441382, 'max_features': 'log2'}. Best is trial 1435 with value: 0.45467030752684195.
[I 2024-12-04 15:23:50,182] Trial 2120 finished with value: 0.4648713795880057 and parameters: {'n_estimators': 815, 'learning_rate': 0.07118231099379493, 'max_depth': 12, 'min_samples_split': 20, 'min_samples_leaf': 1, 'subsample': 0.9964086600594428, 'max_features': None}. Best is trial 1435 with value: 0.45467030752684195.
[I 2024-12-04 15:23:50,228] Trial 2118 finished with value: 0.4559760543563109 and parameters: {'n_estimators': 881, 'learning_rate': 0.08461369928155059, 'max_depth': 12, 'min_samples_split': 20, 'min_samples_leaf': 1, 'subsample': 0.9888268406852676, 'max_features': None}. Best is trial 1435 with value: 0.45467030752684195.
[I 2024-12-04 15:23:51,075] Trial 2117 finished with value: 0.4811346277296486 and parameters: {'n_estimators': 918, 'learning_rate': 0.06635963840628839, 'max_depth': 12, 'min_samples_split': 19, 'min_samples_leaf': 1, 'subsample': 0.9957984538155297, 'max_features': None}. Best is trial 1435 with value: 0.45467030752684195.
[I 2024-12-04 15:23:51,774] Trial 2130 finished with value: 0.7397947859506759 and parameters: {'n_estimators': 794, 'learning_rate': 0.08311774770750449, 'max_depth': 6, 'min_samples_split': 10, 'min_samples_leaf': 8, 'subsample': 0.8975662198597951, 'max_features': 'sqrt'}. Best is trial 1435 with value: 0.45467030752684195.
[I 2024-12-04 15:23:53,308] Trial 2119 finished with value: 0.48566869080361535 and parameters: {'n_estimators': 967, 'learning_rate': 0.0952646642052106, 'max_depth': 12, 'min_samples_split': 20, 'min_samples_leaf': 1, 'subsample': 0.947536631785585, 'max_features': None}. Best is trial 1435 with value: 0.45467030752684195.
[I 2024-12-04 15:23:54,308] Trial 2124 finished with value: 0.47083933984114656 and parameters: {'n_estimators': 837, 'learning_rate': 0.06491936077649452, 'max_depth': 11, 'min_samples_split': 20, 'min_samples_leaf': 1, 'subsample': 0.9952791138972835, 'max_features': None}. Best is trial 1435 with value: 0.45467030752684195.
[I 2024-12-04 15:23:55,448] Trial 2136 finished with value: 0.7213713366875703 and parameters: {'n_estimators': 586, 'learning_rate': 0.07007124830913289, 'max_depth': 10, 'min_samples_split': 13, 'min_samples_leaf': 2, 'subsample': 0.9940440110857418, 'max_features': None}. Best is trial 1435 with value: 0.45467030752684195.
[I 2024-12-04 15:23:55,849] Trial 2127 finished with value: 0.6392913567608578 and parameters: {'n_estimators': 812, 'learning_rate': 0.08153712337233922, 'max_depth': 12, 'min_samples_split': 17, 'min_samples_leaf': 3, 'subsample': 0.925225487304052, 'max_features': None}. Best is trial 1435 with value: 0.45467030752684195.
[I 2024-12-04 15:23:56,439] Trial 2116 finished with value: 0.6492142523945168 and parameters: {'n_estimators': 1054, 'learning_rate': 0.05466097123067646, 'max_depth': 12, 'min_samples_split': 20, 'min_samples_leaf': 3, 'subsample': 0.9171982036553431, 'max_features': None}. Best is trial 1435 with value: 0.45467030752684195.
[I 2024-12-04 15:23:59,450] Trial 2121 finished with value: 0.639939015067572 and parameters: {'n_estimators': 1038, 'learning_rate': 0.0920045542800841, 'max_depth': 12, 'min_samples_split': 18, 'min_samples_leaf': 2, 'subsample': 0.9989259489529203, 'max_features': None}. Best is trial 1435 with value: 0.45467030752684195.
[I 2024-12-04 15:23:59,936] Trial 2125 finished with value: 0.5893948881122727 and parameters: {'n_estimators': 1182, 'learning_rate': 0.07488006206288576, 'max_depth': 12, 'min_samples_split': 20, 'min_samples_leaf': 1, 'subsample': 0.9383892314663335, 'max_features': 'log2'}. Best is trial 1435 with value: 0.45467030752684195.
[I 2024-12-04 15:24:01,513] Trial 2129 finished with value: 0.47542596356664496 and parameters: {'n_estimators': 887, 'learning_rate': 0.06352356651922252, 'max_depth': 12, 'min_samples_split': 18, 'min_samples_leaf': 1, 'subsample': 0.9177349965256628, 'max_features': None}. Best is trial 1435 with value: 0.45467030752684195.
[I 2024-12-04 15:24:02,855] Trial 2134 finished with value: 0.6489380414268597 and parameters: {'n_estimators': 837, 'learning_rate': 0.06692384138869131, 'max_depth': 12, 'min_samples_split': 20, 'min_samples_leaf': 3, 'subsample': 0.912040812826589, 'max_features': None}. Best is trial 1435 with value: 0.45467030752684195.
[I 2024-12-04 15:24:05,031] Trial 2123 finished with value: 0.6647446288789303 and parameters: {'n_estimators': 1157, 'learning_rate': 0.09537105373928012, 'max_depth': 12, 'min_samples_split': 16, 'min_samples_leaf': 3, 'subsample': 0.9997190727981348, 'max_features': None}. Best is trial 1435 with value: 0.45467030752684195.
[I 2024-12-04 15:24:05,082] Trial 2131 finished with value: 0.6346017654966848 and parameters: {'n_estimators': 961, 'learning_rate': 0.09938642259946867, 'max_depth': 12, 'min_samples_split': 18, 'min_samples_leaf': 2, 'subsample': 0.9953055024492447, 'max_features': None}. Best is trial 1435 with value: 0.45467030752684195.
[I 2024-12-04 15:24:06,528] Trial 2139 finished with value: 0.48034616796973845 and parameters: {'n_estimators': 761, 'learning_rate': 0.06367040033751668, 'max_depth': 12, 'min_samples_split': 17, 'min_samples_leaf': 1, 'subsample': 0.9405073126209468, 'max_features': None}. Best is trial 1435 with value: 0.45467030752684195.
[I 2024-12-04 15:24:06,610] Trial 2128 finished with value: 0.48687925664197856 and parameters: {'n_estimators': 1075, 'learning_rate': 0.08853431507474313, 'max_depth': 12, 'min_samples_split': 20, 'min_samples_leaf': 1, 'subsample': 0.9031614179748393, 'max_features': None}. Best is trial 1435 with value: 0.45467030752684195.
