[I 2024-12-04 14:56:14,137] Trial 679 finished with value: 0.5645316567623312 and parameters: {'n_estimators': 702, 'learning_rate': 0.04848598978443321, 'max_depth': 11, 'min_samples_split': 20, 'min_samples_leaf': 1, 'subsample': 0.9850514942117478, 'max_features': 'log2'}. Best is trial 603 with value: 0.45955205541891275.
[I 2024-12-04 14:56:14,957] Trial 696 finished with value: 0.8783717535221033 and parameters: {'n_estimators': 206, 'learning_rate': 0.08969508828594688, 'max_depth': 12, 'min_samples_split': 12, 'min_samples_leaf': 7, 'subsample': 0.89116298144665, 'max_features': 'log2'}. Best is trial 603 with value: 0.45955205541891275.
[I 2024-12-04 14:56:16,347] Trial 686 finished with value: 0.5087783038291742 and parameters: {'n_estimators': 482, 'learning_rate': 0.07898979070513248, 'max_depth': 11, 'min_samples_split': 16, 'min_samples_leaf': 1, 'subsample': 0.9858789154178774, 'max_features': None}. Best is trial 603 with value: 0.45955205541891275.
[I 2024-12-04 14:56:17,374] Trial 667 finished with value: 0.5300089770340931 and parameters: {'n_estimators': 928, 'learning_rate': 0.06203543138155838, 'max_depth': 12, 'min_samples_split': 13, 'min_samples_leaf': 1, 'subsample': 0.933157447262033, 'max_features': None}. Best is trial 603 with value: 0.45955205541891275.
[I 2024-12-04 14:56:18,310] Trial 678 finished with value: 0.6002172150708629 and parameters: {'n_estimators': 680, 'learning_rate': 0.07185501651423344, 'max_depth': 12, 'min_samples_split': 20, 'min_samples_leaf': 2, 'subsample': 0.9474410358413715, 'max_features': None}. Best is trial 603 with value: 0.45955205541891275.
[I 2024-12-04 14:56:20,821] Trial 671 finished with value: 0.6173112944603362 and parameters: {'n_estimators': 1087, 'learning_rate': 0.05644155850000628, 'max_depth': 12, 'min_samples_split': 20, 'min_samples_leaf': 2, 'subsample': 0.9691291593748647, 'max_features': None}. Best is trial 603 with value: 0.45955205541891275.
[I 2024-12-04 14:56:21,073] Trial 673 finished with value: 0.4901879938288607 and parameters: {'n_estimators': 1001, 'learning_rate': 0.0852760372102581, 'max_depth': 11, 'min_samples_split': 19, 'min_samples_leaf': 1, 'subsample': 0.9849663650532093, 'max_features': None}. Best is trial 603 with value: 0.45955205541891275.
[I 2024-12-04 14:56:21,773] Trial 680 finished with value: 0.4842507011386828 and parameters: {'n_estimators': 712, 'learning_rate': 0.06519639909718346, 'max_depth': 12, 'min_samples_split': 20, 'min_samples_leaf': 1, 'subsample': 0.9116688237700704, 'max_features': None}. Best is trial 603 with value: 0.45955205541891275.
[I 2024-12-04 14:56:22,737] Trial 668 finished with value: 0.6147045143333045 and parameters: {'n_estimators': 1039, 'learning_rate': 0.059253579045262746, 'max_depth': 12, 'min_samples_split': 20, 'min_samples_leaf': 2, 'subsample': 0.9629058578630706, 'max_features': None}. Best is trial 603 with value: 0.45955205541891275.
[I 2024-12-04 14:56:23,726] Trial 685 finished with value: 0.46840213516119483 and parameters: {'n_estimators': 681, 'learning_rate': 0.09048803119560841, 'max_depth': 12, 'min_samples_split': 18, 'min_samples_leaf': 1, 'subsample': 0.9901042642194052, 'max_features': None}. Best is trial 603 with value: 0.45955205541891275.
[I 2024-12-04 14:56:24,735] Trial 694 finished with value: 0.7347236897712531 and parameters: {'n_estimators': 600, 'learning_rate': 0.023877553033841464, 'max_depth': 8, 'min_samples_split': 12, 'min_samples_leaf': 9, 'subsample': 0.886692666185846, 'max_features': None}. Best is trial 603 with value: 0.45955205541891275.
[I 2024-12-04 14:56:25,373] Trial 688 finished with value: 0.6233134594308408 and parameters: {'n_estimators': 742, 'learning_rate': 0.061476469871061, 'max_depth': 10, 'min_samples_split': 17, 'min_samples_leaf': 3, 'subsample': 0.9633051747573932, 'max_features': None}. Best is trial 603 with value: 0.45955205541891275.
[I 2024-12-04 14:56:25,880] Trial 677 finished with value: 0.46313474529304977 and parameters: {'n_estimators': 960, 'learning_rate': 0.07606291058225008, 'max_depth': 12, 'min_samples_split': 19, 'min_samples_leaf': 1, 'subsample': 0.989887145999616, 'max_features': None}. Best is trial 603 with value: 0.45955205541891275.
[I 2024-12-04 14:56:25,961] Trial 683 finished with value: 0.6356196253355572 and parameters: {'n_estimators': 852, 'learning_rate': 0.050315583379822094, 'max_depth': 12, 'min_samples_split': 20, 'min_samples_leaf': 3, 'subsample': 0.892211572732346, 'max_features': None}. Best is trial 603 with value: 0.45955205541891275.
[I 2024-12-04 14:56:28,391] Trial 687 finished with value: 0.6125931554990144 and parameters: {'n_estimators': 740, 'learning_rate': 0.07252643303584003, 'max_depth': 12, 'min_samples_split': 17, 'min_samples_leaf': 2, 'subsample': 0.9590999309083434, 'max_features': None}. Best is trial 603 with value: 0.45955205541891275.
[I 2024-12-04 14:56:29,537] Trial 681 finished with value: 0.4745943269900147 and parameters: {'n_estimators': 979, 'learning_rate': 0.06324206864600723, 'max_depth': 12, 'min_samples_split': 20, 'min_samples_leaf': 1, 'subsample': 0.9776041051123244, 'max_features': None}. Best is trial 603 with value: 0.45955205541891275.
[I 2024-12-04 14:56:29,829] Trial 674 finished with value: 0.49034604349016114 and parameters: {'n_estimators': 1183, 'learning_rate': 0.07549051719159124, 'max_depth': 12, 'min_samples_split': 20, 'min_samples_leaf': 1, 'subsample': 0.9169919536766266, 'max_features': None}. Best is trial 603 with value: 0.45955205541891275.
[I 2024-12-04 14:56:29,848] Trial 704 finished with value: 0.7074626548810817 and parameters: {'n_estimators': 469, 'learning_rate': 0.09451323422746104, 'max_depth': 7, 'min_samples_split': 2, 'min_samples_leaf': 6, 'subsample': 0.9841099104990477, 'max_features': 'sqrt'}. Best is trial 603 with value: 0.45955205541891275.
[I 2024-12-04 14:56:29,865] Trial 706 finished with value: 0.796384777752694 and parameters: {'n_estimators': 353, 'learning_rate': 0.03761006767100681, 'max_depth': 8, 'min_samples_split': 7, 'min_samples_leaf': 9, 'subsample': 0.8922986987867658, 'max_features': 'sqrt'}. Best is trial 603 with value: 0.45955205541891275.
[I 2024-12-04 14:56:30,798] Trial 700 finished with value: 0.4836518049659484 and parameters: {'n_estimators': 554, 'learning_rate': 0.09562141333174423, 'max_depth': 12, 'min_samples_split': 20, 'min_samples_leaf': 1, 'subsample': 0.9656677976276792, 'max_features': None}. Best is trial 603 with value: 0.45955205541891275.
[I 2024-12-04 14:56:31,052] Trial 672 finished with value: 0.6666811049572388 and parameters: {'n_estimators': 1265, 'learning_rate': 0.07318151256986416, 'max_depth': 11, 'min_samples_split': 19, 'min_samples_leaf': 3, 'subsample': 0.89758895091018, 'max_features': None}. Best is trial 603 with value: 0.45955205541891275.
[I 2024-12-04 14:56:31,184] Trial 689 finished with value: 0.6221843641040612 and parameters: {'n_estimators': 806, 'learning_rate': 0.059445941844331274, 'max_depth': 12, 'min_samples_split': 20, 'min_samples_leaf': 2, 'subsample': 0.9946797630658344, 'max_features': None}. Best is trial 603 with value: 0.45955205541891275.
[I 2024-12-04 14:56:31,460] Trial 711 finished with value: 1.0382290263890366 and parameters: {'n_estimators': 155, 'learning_rate': 0.03720634782717522, 'max_depth': 6, 'min_samples_split': 13, 'min_samples_leaf': 5, 'subsample': 0.9910969559469232, 'max_features': 'log2'}. Best is trial 603 with value: 0.45955205541891275.
[I 2024-12-04 14:56:34,478] Trial 684 finished with value: 0.7652384244577222 and parameters: {'n_estimators': 1174, 'learning_rate': 0.06433166128878982, 'max_depth': 12, 'min_samples_split': 11, 'min_samples_leaf': 9, 'subsample': 0.7102441907285018, 'max_features': None}. Best is trial 603 with value: 0.45955205541891275.
[I 2024-12-04 14:56:34,825] Trial 691 finished with value: 0.5026433950813476 and parameters: {'n_estimators': 892, 'learning_rate': 0.0676419980092252, 'max_depth': 12, 'min_samples_split': 16, 'min_samples_leaf': 1, 'subsample': 0.9970555727346091, 'max_features': None}. Best is trial 603 with value: 0.45955205541891275.
[I 2024-12-04 14:56:36,080] Trial 697 finished with value: 0.49789358770194064 and parameters: {'n_estimators': 681, 'learning_rate': 0.05039884431530417, 'max_depth': 12, 'min_samples_split': 15, 'min_samples_leaf': 1, 'subsample': 0.9918181196872907, 'max_features': None}. Best is trial 603 with value: 0.45955205541891275.
[I 2024-12-04 14:56:36,081] Trial 692 finished with value: 0.5438699954851933 and parameters: {'n_estimators': 1163, 'learning_rate': 0.08029136900545918, 'max_depth': 12, 'min_samples_split': 16, 'min_samples_leaf': 1, 'subsample': 0.8613078906792891, 'max_features': 'sqrt'}. Best is trial 603 with value: 0.45955205541891275.
[I 2024-12-04 14:56:36,471] Trial 699 finished with value: 0.6206246293779778 and parameters: {'n_estimators': 732, 'learning_rate': 0.052790557050183776, 'max_depth': 12, 'min_samples_split': 20, 'min_samples_leaf': 2, 'subsample': 0.9905345075060152, 'max_features': None}. Best is trial 603 with value: 0.45955205541891275.
[I 2024-12-04 14:56:37,084] Trial 712 finished with value: 0.8329373834782544 and parameters: {'n_estimators': 367, 'learning_rate': 0.012982214017586322, 'max_depth': 6, 'min_samples_split': 2, 'min_samples_leaf': 5, 'subsample': 0.7276508756525829, 'max_features': 'sqrt'}. Best is trial 603 with value: 0.45955205541891275.
[I 2024-12-04 14:56:38,555] Trial 698 finished with value: 0.699386491863918 and parameters: {'n_estimators': 1040, 'learning_rate': 0.022218864782760108, 'max_depth': 5, 'min_samples_split': 20, 'min_samples_leaf': 6, 'subsample': 0.7682694465942668, 'max_features': 'sqrt'}. Best is trial 603 with value: 0.45955205541891275.
[I 2024-12-04 14:56:38,891] Trial 682 finished with value: 0.686980825963715 and parameters: {'n_estimators': 1387, 'learning_rate': 0.0438622294715761, 'max_depth': 9, 'min_samples_split': 4, 'min_samples_leaf': 3, 'subsample': 0.7423958790234333, 'max_features': None}. Best is trial 603 with value: 0.45955205541891275.
[I 2024-12-04 14:56:40,467] Trial 690 finished with value: 0.4775421186219883 and parameters: {'n_estimators': 1183, 'learning_rate': 0.04209114004038434, 'max_depth': 11, 'min_samples_split': 20, 'min_samples_leaf': 1, 'subsample': 0.8858356739907087, 'max_features': None}. Best is trial 603 with value: 0.45955205541891275.
[I 2024-12-04 14:56:41,975] Trial 702 finished with value: 0.9868118738109692 and parameters: {'n_estimators': 1108, 'learning_rate': 0.012043739508283956, 'max_depth': 12, 'min_samples_split': 11, 'min_samples_leaf': 7, 'subsample': 0.7214378030158651, 'max_features': 'log2'}. Best is trial 603 with value: 0.45955205541891275.
[I 2024-12-04 14:56:42,041] Trial 723 finished with value: 0.6501901749730644 and parameters: {'n_estimators': 109, 'learning_rate': 0.01855819179849382, 'max_depth': 12, 'min_samples_split': 20, 'min_samples_leaf': 9, 'subsample': 0.8524021177920571, 'max_features': None}. Best is trial 603 with value: 0.45955205541891275.
[I 2024-12-04 14:56:42,161] Trial 710 finished with value: 0.4830729855449495 and parameters: {'n_estimators': 554, 'learning_rate': 0.08690485013157982, 'max_depth': 12, 'min_samples_split': 17, 'min_samples_leaf': 1, 'subsample': 0.9426903471128613, 'max_features': None}. Best is trial 603 with value: 0.45955205541891275.
[I 2024-12-04 14:56:42,164] Trial 703 finished with value: 0.6911319441573281 and parameters: {'n_estimators': 930, 'learning_rate': 0.05912736365352692, 'max_depth': 8, 'min_samples_split': 3, 'min_samples_leaf': 7, 'subsample': 0.8250685731038634, 'max_features': None}. Best is trial 603 with value: 0.45955205541891275.
[I 2024-12-04 14:56:43,115] Trial 695 finished with value: 0.4819483011634968 and parameters: {'n_estimators': 1087, 'learning_rate': 0.05953950763965844, 'max_depth': 12, 'min_samples_split': 20, 'min_samples_leaf': 1, 'subsample': 0.8966544216620383, 'max_features': None}. Best is trial 603 with value: 0.45955205541891275.
[I 2024-12-04 14:56:43,296] Trial 701 finished with value: 0.6808026835687171 and parameters: {'n_estimators': 1012, 'learning_rate': 0.08957466697729365, 'max_depth': 10, 'min_samples_split': 20, 'min_samples_leaf': 3, 'subsample': 0.8380671716579386, 'max_features': None}. Best is trial 603 with value: 0.45955205541891275.
[I 2024-12-04 14:56:46,035] Trial 713 finished with value: 0.5458234032053471 and parameters: {'n_estimators': 610, 'learning_rate': 0.017272963193078975, 'max_depth': 3, 'min_samples_split': 18, 'min_samples_leaf': 1, 'subsample': 0.8369031790315501, 'max_features': None}. Best is trial 603 with value: 0.45955205541891275.
[I 2024-12-04 14:56:49,009] Trial 708 finished with value: 0.47810185913190095 and parameters: {'n_estimators': 758, 'learning_rate': 0.06579007969602634, 'max_depth': 12, 'min_samples_split': 19, 'min_samples_leaf': 1, 'subsample': 0.9868251771230357, 'max_features': None}. Best is trial 603 with value: 0.45955205541891275.
[I 2024-12-04 14:56:52,088] Trial 693 finished with value: 0.4704230054254384 and parameters: {'n_estimators': 1496, 'learning_rate': 0.09065885066900892, 'max_depth': 12, 'min_samples_split': 18, 'min_samples_leaf': 1, 'subsample': 0.9833347491382645, 'max_features': None}. Best is trial 603 with value: 0.45955205541891275.
[I 2024-12-04 14:56:53,189] Trial 715 finished with value: 0.582999677431166 and parameters: {'n_estimators': 1031, 'learning_rate': 0.010297961689274477, 'max_depth': 7, 'min_samples_split': 17, 'min_samples_leaf': 1, 'subsample': 0.9386057313232029, 'max_features': 'sqrt'}. Best is trial 603 with value: 0.45955205541891275.
[I 2024-12-04 14:56:55,160] Trial 707 finished with value: 0.5075782600981177 and parameters: {'n_estimators': 1167, 'learning_rate': 0.06444080499220546, 'max_depth': 10, 'min_samples_split': 17, 'min_samples_leaf': 1, 'subsample': 0.9752507492438712, 'max_features': None}. Best is trial 603 with value: 0.45955205541891275.
[I 2024-12-04 14:56:56,974] Trial 705 finished with value: 0.6501711884418572 and parameters: {'n_estimators': 1299, 'learning_rate': 0.045767785692757613, 'max_depth': 11, 'min_samples_split': 16, 'min_samples_leaf': 3, 'subsample': 0.988513159025558, 'max_features': None}. Best is trial 603 with value: 0.45955205541891275.
[I 2024-12-04 14:56:59,382] Trial 716 finished with value: 0.633952377684018 and parameters: {'n_estimators': 1241, 'learning_rate': 0.015225927714058018, 'max_depth': 10, 'min_samples_split': 8, 'min_samples_leaf': 2, 'subsample': 0.6292783427732256, 'max_features': 'sqrt'}. Best is trial 603 with value: 0.45955205541891275.
[I 2024-12-04 14:57:00,344] Trial 717 finished with value: 0.5092386373830302 and parameters: {'n_estimators': 923, 'learning_rate': 0.07713471902805795, 'max_depth': 10, 'min_samples_split': 17, 'min_samples_leaf': 1, 'subsample': 0.990298034005048, 'max_features': None}. Best is trial 603 with value: 0.45955205541891275.
[I 2024-12-04 14:57:00,346] Trial 722 finished with value: 0.644177698063811 and parameters: {'n_estimators': 710, 'learning_rate': 0.09717201051716333, 'max_depth': 12, 'min_samples_split': 20, 'min_samples_leaf': 3, 'subsample': 0.9501047571369431, 'max_features': None}. Best is trial 603 with value: 0.45955205541891275.
[I 2024-12-04 14:57:00,392] Trial 709 finished with value: 0.4978519532614124 and parameters: {'n_estimators': 1220, 'learning_rate': 0.07515806061315643, 'max_depth': 12, 'min_samples_split': 16, 'min_samples_leaf': 1, 'subsample': 0.9269301649325006, 'max_features': None}. Best is trial 603 with value: 0.45955205541891275.
[I 2024-12-04 14:57:02,035] Trial 729 finished with value: 0.47964751667200745 and parameters: {'n_estimators': 564, 'learning_rate': 0.07633054776984836, 'max_depth': 11, 'min_samples_split': 17, 'min_samples_leaf': 1, 'subsample': 0.9945164724125577, 'max_features': None}. Best is trial 603 with value: 0.45955205541891275.
[I 2024-12-04 14:57:06,006] Trial 724 finished with value: 0.47388201571344224 and parameters: {'n_estimators': 879, 'learning_rate': 0.09495144925856876, 'max_depth': 12, 'min_samples_split': 18, 'min_samples_leaf': 1, 'subsample': 0.9599811817873589, 'max_features': None}. Best is trial 603 with value: 0.45955205541891275.
[I 2024-12-04 14:57:07,087] Trial 725 finished with value: 0.6271154025704142 and parameters: {'n_estimators': 868, 'learning_rate': 0.09175464200739653, 'max_depth': 11, 'min_samples_split': 18, 'min_samples_leaf': 2, 'subsample': 0.9959349987870024, 'max_features': None}. Best is trial 603 with value: 0.45955205541891275.
[I 2024-12-04 14:57:07,780] Trial 718 finished with value: 0.470648860849417 and parameters: {'n_estimators': 1100, 'learning_rate': 0.09467791119492107, 'max_depth': 12, 'min_samples_split': 20, 'min_samples_leaf': 1, 'subsample': 0.9865315873258819, 'max_features': None}. Best is trial 603 with value: 0.45955205541891275.
[I 2024-12-04 14:57:07,837] Trial 714 finished with value: 0.5056384783068391 and parameters: {'n_estimators': 1226, 'learning_rate': 0.0522043488525746, 'max_depth': 12, 'min_samples_split': 15, 'min_samples_leaf': 1, 'subsample': 0.9924387726250901, 'max_features': None}. Best is trial 603 with value: 0.45955205541891275.
[I 2024-12-04 14:57:08,712] Trial 742 finished with value: 0.5404937859644999 and parameters: {'n_estimators': 676, 'learning_rate': 0.08881005011819618, 'max_depth': 12, 'min_samples_split': 18, 'min_samples_leaf': 1, 'subsample': 0.910677498669414, 'max_features': 'sqrt'}. Best is trial 603 with value: 0.45955205541891275.
[I 2024-12-04 14:57:10,069] Trial 733 finished with value: 0.46996376245447563 and parameters: {'n_estimators': 830, 'learning_rate': 0.07212067121099233, 'max_depth': 12, 'min_samples_split': 20, 'min_samples_leaf': 1, 'subsample': 0.9975706124714424, 'max_features': None}. Best is trial 603 with value: 0.45955205541891275.
[I 2024-12-04 14:57:10,387] Trial 719 finished with value: 0.6210525230990583 and parameters: {'n_estimators': 1149, 'learning_rate': 0.0715330601918433, 'max_depth': 12, 'min_samples_split': 17, 'min_samples_leaf': 2, 'subsample': 0.9994534770617304, 'max_features': None}. Best is trial 603 with value: 0.45955205541891275.
[I 2024-12-04 14:57:11,174] Trial 731 finished with value: 0.639892113942822 and parameters: {'n_estimators': 821, 'learning_rate': 0.0945738184557322, 'max_depth': 12, 'min_samples_split': 15, 'min_samples_leaf': 2, 'subsample': 0.975487165916165, 'max_features': None}. Best is trial 603 with value: 0.45955205541891275.
[I 2024-12-04 14:57:11,175] Trial 720 finished with value: 0.4822637749819354 and parameters: {'n_estimators': 1173, 'learning_rate': 0.05563200422560668, 'max_depth': 11, 'min_samples_split': 18, 'min_samples_leaf': 1, 'subsample': 0.9601084792533964, 'max_features': None}. Best is trial 603 with value: 0.45955205541891275.
[I 2024-12-04 14:57:11,878] Trial 728 finished with value: 0.6732581126031723 and parameters: {'n_estimators': 1310, 'learning_rate': 0.06569090257038003, 'max_depth': 3, 'min_samples_split': 5, 'min_samples_leaf': 3, 'subsample': 0.9838876124307849, 'max_features': 'log2'}. Best is trial 603 with value: 0.45955205541891275.
[I 2024-12-04 14:57:12,862] Trial 721 finished with value: 0.47851238144908925 and parameters: {'n_estimators': 1106, 'learning_rate': 0.09041643472403273, 'max_depth': 12, 'min_samples_split': 17, 'min_samples_leaf': 1, 'subsample': 0.9498666888969012, 'max_features': None}. Best is trial 603 with value: 0.45955205541891275.
[I 2024-12-04 14:57:13,093] Trial 727 finished with value: 0.4749746538371859 and parameters: {'n_estimators': 1010, 'learning_rate': 0.06642868853361991, 'max_depth': 12, 'min_samples_split': 20, 'min_samples_leaf': 1, 'subsample': 0.9943891090879767, 'max_features': None}. Best is trial 603 with value: 0.45955205541891275.
[I 2024-12-04 14:57:13,861] Trial 726 finished with value: 0.6156225362706562 and parameters: {'n_estimators': 1143, 'learning_rate': 0.05143556815463317, 'max_depth': 12, 'min_samples_split': 19, 'min_samples_leaf': 2, 'subsample': 0.9993243200556305, 'max_features': None}. Best is trial 603 with value: 0.45955205541891275.
[I 2024-12-04 14:57:14,718] Trial 737 finished with value: 0.729517044211364 and parameters: {'n_estimators': 1121, 'learning_rate': 0.016145516997529464, 'max_depth': 8, 'min_samples_split': 9, 'min_samples_leaf': 7, 'subsample': 0.7676565002128991, 'max_features': 'sqrt'}. Best is trial 603 with value: 0.45955205541891275.
[I 2024-12-04 14:57:15,116] Trial 738 finished with value: 0.6508402287701011 and parameters: {'n_estimators': 924, 'learning_rate': 0.06086769995472002, 'max_depth': 12, 'min_samples_split': 16, 'min_samples_leaf': 3, 'subsample': 0.9299490916444924, 'max_features': None}. Best is trial 603 with value: 0.45955205541891275.
[I 2024-12-04 14:57:15,117] Trial 736 finished with value: 0.738346072096573 and parameters: {'n_estimators': 1242, 'learning_rate': 0.05948131321911764, 'max_depth': 4, 'min_samples_split': 20, 'min_samples_leaf': 7, 'subsample': 0.9603173079952609, 'max_features': 'sqrt'}. Best is trial 603 with value: 0.45955205541891275.
[I 2024-12-04 14:57:15,296] Trial 747 finished with value: 0.6938638810343084 and parameters: {'n_estimators': 552, 'learning_rate': 0.020190754015859513, 'max_depth': 11, 'min_samples_split': 9, 'min_samples_leaf': 7, 'subsample': 0.9908032491951433, 'max_features': 'sqrt'}. Best is trial 603 with value: 0.45955205541891275.
[I 2024-12-04 14:57:15,530] Trial 740 finished with value: 0.6590896500823924 and parameters: {'n_estimators': 1055, 'learning_rate': 0.037708033926842896, 'max_depth': 12, 'min_samples_split': 18, 'min_samples_leaf': 3, 'subsample': 0.890449747848185, 'max_features': 'sqrt'}. Best is trial 603 with value: 0.45955205541891275.
