[I 2024-12-04 21:06:00,135] Trial 1900 finished with value: 0.9864686821606995 and parameters: {'kernel_type': 'Matern', 'length_scale': 3414.3789635192493, 'noise_level': 0.020288368181075874, 'constant_value': 0.0169393725982827, 'nu': 1.5}. Best is trial 959 with value: 0.1375110730946576.
[I 2024-12-04 21:06:01,999] Trial 1902 finished with value: 0.9864686819283088 and parameters: {'kernel_type': 'Matern', 'length_scale': 0.006102196198681014, 'noise_level': 0.46648835918337084, 'constant_value': 0.4688105507961094, 'nu': 1.5}. Best is trial 959 with value: 0.1375110730946576.
[I 2024-12-04 21:06:07,389] Trial 1901 finished with value: 0.14249506330068543 and parameters: {'kernel_type': 'Matern', 'length_scale': 0.13025751440727806, 'noise_level': 0.7755262995927406, 'constant_value': 32.51678412707484, 'nu': 1.5}. Best is trial 959 with value: 0.1375110730946576.
[I 2024-12-04 21:06:09,760] Trial 1903 finished with value: 0.9864686819264789 and parameters: {'kernel_type': 'RBF', 'length_scale': 60676.786080782826, 'noise_level': 0.00026738880449330804, 'constant_value': 0.6352705268314357, 'nu': 1.5}. Best is trial 959 with value: 0.1375110730946576.
[I 2024-12-04 21:06:10,905] Trial 1904 finished with value: 0.13779635728666267 and parameters: {'kernel_type': 'Matern', 'length_scale': 60.24924583383219, 'noise_level': 0.7775621772063014, 'constant_value': 12.004134512219876, 'nu': 1.5}. Best is trial 959 with value: 0.1375110730946576.
[I 2024-12-04 21:06:11,693] Trial 1905 finished with value: 0.9864686674130132 and parameters: {'kernel_type': 'Matern', 'length_scale': 0.08517153977925458, 'noise_level': 0.035397541372192934, 'constant_value': 0.794206342128635, 'nu': 1.5}. Best is trial 959 with value: 0.1375110730946576.
[I 2024-12-04 21:06:16,466] Trial 1906 finished with value: 0.14249469338446794 and parameters: {'kernel_type': 'Matern', 'length_scale': 7.172049795884109, 'noise_level': 0.9643089904479386, 'constant_value': 1.1705570531095602, 'nu': 1.5}. Best is trial 959 with value: 0.1375110730946576.
[I 2024-12-04 21:06:19,749] Trial 1908 finished with value: 0.14249501593943475 and parameters: {'kernel_type': 'Matern', 'length_scale': 10.143883260402289, 'noise_level': 0.43718082648574447, 'constant_value': 206.90034004379774, 'nu': 1.5}. Best is trial 959 with value: 0.1375110730946576.
[I 2024-12-04 21:06:19,860] Trial 1907 finished with value: 0.13778620674133044 and parameters: {'kernel_type': 'Matern', 'length_scale': 555.307408305787, 'noise_level': 0.3535664848764462, 'constant_value': 0.9947472183623949, 'nu': 1.5}. Best is trial 959 with value: 0.1375110730946576.
[I 2024-12-04 21:06:23,981] Trial 1909 finished with value: 0.14249506325633796 and parameters: {'kernel_type': 'Matern', 'length_scale': 159.5523232255437, 'noise_level': 0.23215826143144597, 'constant_value': 16.86133849004812, 'nu': 1.5}. Best is trial 959 with value: 0.1375110730946576.
[I 2024-12-04 21:06:24,510] Trial 1911 finished with value: 0.9982167338040101 and parameters: {'kernel_type': 'Matern', 'length_scale': 0.00014373481272965017, 'noise_level': 5.286804617538174e-08, 'constant_value': 55.830882671404844, 'nu': 1.5}. Best is trial 959 with value: 0.1375110730946576.
[I 2024-12-04 21:06:28,308] Trial 1910 finished with value: 0.1424950531545694 and parameters: {'kernel_type': 'Matern', 'length_scale': 18450.34666366565, 'noise_level': 0.5937387425087449, 'constant_value': 85.90145852683912, 'nu': 1.5}. Best is trial 959 with value: 0.1375110730946576.
[I 2024-12-04 21:06:30,851] Trial 1912 finished with value: 0.1972000437771844 and parameters: {'kernel_type': 'Matern', 'length_scale': 2876.6149818337726, 'noise_level': 0.40596427602445245, 'constant_value': 0.9358739802250012, 'nu': 0.5}. Best is trial 959 with value: 0.1375110730946576.
[I 2024-12-04 21:06:33,829] Trial 1913 finished with value: 0.14249492967449015 and parameters: {'kernel_type': 'Matern', 'length_scale': 1868.1077035994501, 'noise_level': 0.06501124837530657, 'constant_value': 3.154101421742767, 'nu': 1.5}. Best is trial 959 with value: 0.1375110730946576.
[I 2024-12-04 21:06:36,503] Trial 1914 finished with value: 0.14249505902448045 and parameters: {'kernel_type': 'Matern', 'length_scale': 355.5591213710949, 'noise_level': 0.18957871920199978, 'constant_value': 0.039920690472793924, 'nu': 1.5}. Best is trial 959 with value: 0.1375110730946576.
[I 2024-12-04 21:06:38,635] Trial 1915 finished with value: 0.1424951241650553 and parameters: {'kernel_type': 'Matern', 'length_scale': 3270.8280908078586, 'noise_level': 0.4349424510681225, 'constant_value': 5.574200747046962, 'nu': 1.5}. Best is trial 959 with value: 0.1375110730946576.
[I 2024-12-04 21:06:42,055] Trial 1916 finished with value: 0.9864686819144561 and parameters: {'kernel_type': 'Matern', 'length_scale': 2569.631085481689, 'noise_level': 0.007071841956561923, 'constant_value': 2.1698928782062645, 'nu': 1.5}. Best is trial 959 with value: 0.1375110730946576.
[I 2024-12-04 21:06:44,104] Trial 1917 finished with value: 0.9982171090618738 and parameters: {'kernel_type': 'Matern', 'length_scale': 34360.73563897958, 'noise_level': 0.2563187956330582, 'constant_value': 3.2467325772069584, 'nu': 1.5}. Best is trial 959 with value: 0.1375110730946576.
[I 2024-12-04 21:06:48,022] Trial 1918 finished with value: 0.986468681922611 and parameters: {'kernel_type': 'RBF', 'length_scale': 1357.315108460811, 'noise_level': 2.902855806550398e-10, 'constant_value': 0.008210122926968653, 'nu': 2.5}. Best is trial 959 with value: 0.1375110730946576.
[I 2024-12-04 21:06:50,982] Trial 1919 finished with value: 0.9864686818118733 and parameters: {'kernel_type': 'Matern', 'length_scale': 578.9136789075055, 'noise_level': 0.019564437717199838, 'constant_value': 0.5398373512488732, 'nu': 1.5}. Best is trial 959 with value: 0.1375110730946576.
[I 2024-12-04 21:06:56,755] Trial 1922 finished with value: 0.14771003332763535 and parameters: {'kernel_type': 'RBF', 'length_scale': 3.1084465000186405, 'noise_level': 0.822974237690121, 'constant_value': 0.043691613544764044, 'nu': 1.5}. Best is trial 959 with value: 0.1375110730946576.
[I 2024-12-04 21:06:57,112] Trial 1920 finished with value: 0.14249505079964453 and parameters: {'kernel_type': 'Matern', 'length_scale': 1659.4787901721265, 'noise_level': 0.16663079519238294, 'constant_value': 0.032760778243969856, 'nu': 1.5}. Best is trial 959 with value: 0.1375110730946576.
[I 2024-12-04 21:06:58,457] Trial 1921 finished with value: 0.9864686819224914 and parameters: {'kernel_type': 'Matern', 'length_scale': 29268.794906442876, 'noise_level': 0.004401701367920208, 'constant_value': 0.18933633597217986, 'nu': 1.5}. Best is trial 959 with value: 0.1375110730946576.
[I 2024-12-04 21:07:05,868] Trial 1924 finished with value: 0.1424951084657231 and parameters: {'kernel_type': 'Matern', 'length_scale': 156.8115293966564, 'noise_level': 0.12024926259780215, 'constant_value': 0.5332467246254521, 'nu': 1.5}. Best is trial 959 with value: 0.1375110730946576.
[I 2024-12-04 21:07:07,013] Trial 1923 finished with value: 0.14249506692891656 and parameters: {'kernel_type': 'Matern', 'length_scale': 633.9163511045407, 'noise_level': 0.6004778150598699, 'constant_value': 0.280587783791876, 'nu': 1.5}. Best is trial 959 with value: 0.1375110730946576.
[I 2024-12-04 21:07:07,673] Trial 1925 finished with value: 0.1424950654736876 and parameters: {'kernel_type': 'Matern', 'length_scale': 5613.114046310423, 'noise_level': 0.11315800295933294, 'constant_value': 0.9028560463072116, 'nu': 1.5}. Best is trial 959 with value: 0.1375110730946576.
[I 2024-12-04 21:07:15,140] Trial 1927 finished with value: 0.9864686819236619 and parameters: {'kernel_type': 'Matern', 'length_scale': 211.25132275117247, 'noise_level': 0.021127631893351595, 'constant_value': 1.1056571390670251, 'nu': 1.5}. Best is trial 959 with value: 0.1375110730946576.
[I 2024-12-04 21:07:15,200] Trial 1926 finished with value: 0.1424950813118562 and parameters: {'kernel_type': 'Matern', 'length_scale': 135.95402412900498, 'noise_level': 0.7494214805876498, 'constant_value': 0.00411332612446014, 'nu': 1.5}. Best is trial 959 with value: 0.1375110730946576.
[I 2024-12-04 21:07:15,395] Trial 1928 finished with value: 0.14249505856585318 and parameters: {'kernel_type': 'Matern', 'length_scale': 2592.501619876164, 'noise_level': 0.37287118663986063, 'constant_value': 13.45379044374347, 'nu': 1.5}. Best is trial 959 with value: 0.1375110730946576.
[I 2024-12-04 21:07:24,762] Trial 1931 finished with value: 0.14249506329120357 and parameters: {'kernel_type': 'Matern', 'length_scale': 519.2794043719362, 'noise_level': 0.7039900049503294, 'constant_value': 0.662192599969087, 'nu': 1.5}. Best is trial 959 with value: 0.1375110730946576.
[I 2024-12-04 21:07:24,770] Trial 1930 finished with value: 0.14249506966442047 and parameters: {'kernel_type': 'Matern', 'length_scale': 78.4935714300784, 'noise_level': 0.4406866547900856, 'constant_value': 1.3364879794448725, 'nu': 1.5}. Best is trial 959 with value: 0.1375110730946576.
[I 2024-12-04 21:07:30,066] Trial 1929 finished with value: 0.14249520715513322 and parameters: {'kernel_type': 'Matern', 'length_scale': 4383.93619994147, 'noise_level': 0.07162196829469165, 'constant_value': 0.05984339268276436, 'nu': 1.5}. Best is trial 959 with value: 0.1375110730946576.
[I 2024-12-04 21:07:33,377] Trial 1933 finished with value: 0.14249504319288012 and parameters: {'kernel_type': 'Matern', 'length_scale': 5.735260326803671, 'noise_level': 0.9507629819307943, 'constant_value': 26.092019252523684, 'nu': 1.5}. Best is trial 959 with value: 0.1375110730946576.
[I 2024-12-04 21:07:33,708] Trial 1932 finished with value: 0.1377279263819621 and parameters: {'kernel_type': 'Matern', 'length_scale': 172.3829249991565, 'noise_level': 0.21717601437011855, 'constant_value': 8.229029471102931, 'nu': 1.5}. Best is trial 959 with value: 0.1375110730946576.
[I 2024-12-04 21:07:37,834] Trial 1934 finished with value: 0.14249506415168275 and parameters: {'kernel_type': 'Matern', 'length_scale': 35.231381640126905, 'noise_level': 0.7046849511456672, 'constant_value': 34.063880313838695, 'nu': 1.5}. Best is trial 959 with value: 0.1375110730946576.
[I 2024-12-04 21:07:39,227] Trial 1936 finished with value: 0.9982170241240227 and parameters: {'kernel_type': 'Matern', 'length_scale': 4921.569223878149, 'noise_level': 0.8317782004193647, 'constant_value': 0.19209190190680192, 'nu': 1.5}. Best is trial 959 with value: 0.1375110730946576.
[I 2024-12-04 21:07:40,047] Trial 1935 finished with value: 0.14249508234568584 and parameters: {'kernel_type': 'Matern', 'length_scale': 1199.8424223014997, 'noise_level': 0.6974753061644515, 'constant_value': 11.230063277107433, 'nu': 1.5}. Best is trial 959 with value: 0.1375110730946576.
[I 2024-12-04 21:07:45,559] Trial 1937 finished with value: 0.1424950414305569 and parameters: {'kernel_type': 'Matern', 'length_scale': 82.27432465927758, 'noise_level': 0.6996237733325096, 'constant_value': 48.43870021428655, 'nu': 1.5}. Best is trial 959 with value: 0.1375110730946576.
[I 2024-12-04 21:07:46,927] Trial 1938 finished with value: 0.9864686819636698 and parameters: {'kernel_type': 'Matern', 'length_scale': 1815.9707856129078, 'noise_level': 0.04949925819648276, 'constant_value': 1.6245130595460955, 'nu': 1.5}. Best is trial 959 with value: 0.1375110730946576.
[I 2024-12-04 21:07:46,998] Trial 1939 finished with value: 0.14249506140387042 and parameters: {'kernel_type': 'Matern', 'length_scale': 266.8649108397398, 'noise_level': 0.9738870623028666, 'constant_value': 7.741731740972324, 'nu': 1.5}. Best is trial 959 with value: 0.1375110730946576.
[I 2024-12-04 21:07:54,538] Trial 1941 finished with value: 0.14249506243509422 and parameters: {'kernel_type': 'Matern', 'length_scale': 144.46984012055424, 'noise_level': 0.20622576172717894, 'constant_value': 17.62780009278887, 'nu': 1.5}. Best is trial 959 with value: 0.1375110730946576.
[I 2024-12-04 21:07:55,412] Trial 1942 finished with value: 0.14249490249135777 and parameters: {'kernel_type': 'Matern', 'length_scale': 69.38704654522286, 'noise_level': 0.8787132176307139, 'constant_value': 8.368139808613874, 'nu': 1.5}. Best is trial 959 with value: 0.1375110730946576.
[I 2024-12-04 21:07:55,514] Trial 1940 finished with value: 0.9864686819437711 and parameters: {'kernel_type': 'Matern', 'length_scale': 335.79140164070935, 'noise_level': 0.005230333630875805, 'constant_value': 0.026900633345017723, 'nu': 1.5}. Best is trial 959 with value: 0.1375110730946576.
[I 2024-12-04 21:08:01,292] Trial 1943 finished with value: 0.14249505302063747 and parameters: {'kernel_type': 'Matern', 'length_scale': 30.086225932981463, 'noise_level': 0.8565292747496228, 'constant_value': 3.9242155334780775, 'nu': 1.5}. Best is trial 959 with value: 0.1375110730946576.
[I 2024-12-04 21:08:05,135] Trial 1944 finished with value: 0.9864686819211872 and parameters: {'kernel_type': 'Matern', 'length_scale': 4620.784430997962, 'noise_level': 0.0076121706128571874, 'constant_value': 0.93836960775375, 'nu': 1.5}. Best is trial 959 with value: 0.1375110730946576.
[I 2024-12-04 21:08:08,299] Trial 1945 finished with value: 0.14249509068972643 and parameters: {'kernel_type': 'Matern', 'length_scale': 799.4689370009464, 'noise_level': 0.6630144086618742, 'constant_value': 3.6360835507967537, 'nu': 1.5}. Best is trial 959 with value: 0.1375110730946576.
[I 2024-12-04 21:08:08,676] Trial 1946 finished with value: 0.14249514296034838 and parameters: {'kernel_type': 'Matern', 'length_scale': 75.35790391178757, 'noise_level': 0.8168016036985938, 'constant_value': 64.06764776253706, 'nu': 1.5}. Best is trial 959 with value: 0.1375110730946576.
[I 2024-12-04 21:08:13,865] Trial 1947 finished with value: 0.14249503845736478 and parameters: {'kernel_type': 'Matern', 'length_scale': 459.93943908139795, 'noise_level': 0.07945723382631337, 'constant_value': 0.2733516053345083, 'nu': 1.5}. Best is trial 959 with value: 0.1375110730946576.
[I 2024-12-04 21:08:17,449] Trial 1948 finished with value: 0.14249506043117813 and parameters: {'kernel_type': 'Matern', 'length_scale': 226.18984169978836, 'noise_level': 0.3435214415793994, 'constant_value': 0.05820524004339241, 'nu': 1.5}. Best is trial 959 with value: 0.1375110730946576.
[I 2024-12-04 21:08:17,774] Trial 1949 finished with value: 0.1424950866581321 and parameters: {'kernel_type': 'Matern', 'length_scale': 1284.540011132137, 'noise_level': 0.14443439223630508, 'constant_value': 2.3918849886428273, 'nu': 1.5}. Best is trial 959 with value: 0.1375110730946576.
[I 2024-12-04 21:08:21,163] Trial 1950 finished with value: 0.14249500624947817 and parameters: {'kernel_type': 'Matern', 'length_scale': 227.12224857402805, 'noise_level': 0.978524123598699, 'constant_value': 5.042855528906977, 'nu': 1.5}. Best is trial 959 with value: 0.1375110730946576.
[I 2024-12-04 21:08:21,692] Trial 1951 finished with value: 0.9982170902797592 and parameters: {'kernel_type': 'Matern', 'length_scale': 0.6450164144878725, 'noise_level': 1.6619779371681546e-09, 'constant_value': 85.53251369383356, 'nu': 2.5}. Best is trial 959 with value: 0.1375110730946576.
[I 2024-12-04 21:08:25,607] Trial 1952 finished with value: 0.14249506259597813 and parameters: {'kernel_type': 'Matern', 'length_scale': 36.77369247608978, 'noise_level': 0.13782814364357368, 'constant_value': 0.11485759813874764, 'nu': 1.5}. Best is trial 959 with value: 0.1375110730946576.
[I 2024-12-04 21:08:28,290] Trial 1954 finished with value: 0.14469898007491885 and parameters: {'kernel_type': 'Matern', 'length_scale': 1023.038590992294, 'noise_level': 0.13059887942627266, 'constant_value': 12.430709435214927, 'nu': 2.5}. Best is trial 959 with value: 0.1375110730946576.
[I 2024-12-04 21:08:28,292] Trial 1955 finished with value: 0.9982171094981757 and parameters: {'kernel_type': 'Matern', 'length_scale': 88697.9968474215, 'noise_level': 0.55906895741389, 'constant_value': 1.5905128914096843e-06, 'nu': 2.5}. Best is trial 959 with value: 0.1375110730946576.
[I 2024-12-04 21:08:30,699] Trial 1953 finished with value: 0.1477106083905511 and parameters: {'kernel_type': 'RBF', 'length_scale': 280.8872368644111, 'noise_level': 0.016571449053969768, 'constant_value': 87.18765996984753, 'nu': 1.5}. Best is trial 959 with value: 0.1375110730946576.
[I 2024-12-04 21:08:33,825] Trial 1957 finished with value: 0.9864686819117426 and parameters: {'kernel_type': 'Matern', 'length_scale': 14868.315021870354, 'noise_level': 4.332402922730553e-07, 'constant_value': 29.480200518480945, 'nu': 0.5}. Best is trial 959 with value: 0.1375110730946576.
[I 2024-12-04 21:08:38,579] Trial 1956 finished with value: 0.1424951023219434 and parameters: {'kernel_type': 'Matern', 'length_scale': 393.12840529518843, 'noise_level': 0.5622008411424824, 'constant_value': 0.06065367965140695, 'nu': 1.5}. Best is trial 959 with value: 0.1375110730946576.
[I 2024-12-04 21:08:39,378] Trial 1958 finished with value: 0.14249511227840436 and parameters: {'kernel_type': 'Matern', 'length_scale': 8.08793233285416, 'noise_level': 0.868811393005123, 'constant_value': 235.94757498923005, 'nu': 1.5}. Best is trial 959 with value: 0.1375110730946576.
[I 2024-12-04 21:08:43,794] Trial 1961 finished with value: 0.986468681930493 and parameters: {'kernel_type': 'Matern', 'length_scale': 1.1400730553580991e-05, 'noise_level': 0.0025793423878390457, 'constant_value': 0.026810681816744043, 'nu': 0.5}. Best is trial 959 with value: 0.1375110730946576.
[I 2024-12-04 21:08:45,371] Trial 1959 finished with value: 0.9864686819333669 and parameters: {'kernel_type': 'Matern', 'length_scale': 2318.5558382843706, 'noise_level': 0.03243022566084744, 'constant_value': 7.6767127686739265, 'nu': 1.5}. Best is trial 959 with value: 0.1375110730946576.
[I 2024-12-04 21:08:48,074] Trial 1960 finished with value: 0.14249505421021655 and parameters: {'kernel_type': 'Matern', 'length_scale': 41.29936085562529, 'noise_level': 0.025666387894568, 'constant_value': 0.29764917678981595, 'nu': 1.5}. Best is trial 959 with value: 0.1375110730946576.
[I 2024-12-04 21:08:54,392] Trial 1963 finished with value: 0.13808231026315376 and parameters: {'kernel_type': 'Matern', 'length_scale': 8.471562851977025, 'noise_level': 0.6286278924008338, 'constant_value': 498.77844606870127, 'nu': 1.5}. Best is trial 959 with value: 0.1375110730946576.
[I 2024-12-04 21:08:54,672] Trial 1962 finished with value: 0.14469882411039622 and parameters: {'kernel_type': 'Matern', 'length_scale': 124.04750768655236, 'noise_level': 0.8335690259964068, 'constant_value': 0.003014123835383165, 'nu': 2.5}. Best is trial 959 with value: 0.1375110730946576.
[I 2024-12-04 21:08:56,767] Trial 1964 finished with value: 0.14469881157775702 and parameters: {'kernel_type': 'Matern', 'length_scale': 0.23297029964166008, 'noise_level': 0.6629745124549387, 'constant_value': 4.905575871575378, 'nu': 2.5}. Best is trial 959 with value: 0.1375110730946576.
[I 2024-12-04 21:09:02,596] Trial 1965 finished with value: 0.14249506716802032 and parameters: {'kernel_type': 'Matern', 'length_scale': 265.3090227849706, 'noise_level': 0.44302081453418046, 'constant_value': 7.590467519089246, 'nu': 1.5}. Best is trial 959 with value: 0.1375110730946576.
[I 2024-12-04 21:09:03,385] Trial 1966 finished with value: 0.14249503827065954 and parameters: {'kernel_type': 'Matern', 'length_scale': 112.1406581883383, 'noise_level': 0.7077877080525752, 'constant_value': 1.4677528238264397, 'nu': 1.5}. Best is trial 959 with value: 0.1375110730946576.
[I 2024-12-04 21:09:03,454] Trial 1967 finished with value: 0.14249508176507866 and parameters: {'kernel_type': 'Matern', 'length_scale': 48.01365361260496, 'noise_level': 0.3325764969999518, 'constant_value': 61.13923332266328, 'nu': 1.5}. Best is trial 959 with value: 0.1375110730946576.
[I 2024-12-04 21:09:08,790] Trial 1968 finished with value: 0.19720001839732182 and parameters: {'kernel_type': 'Matern', 'length_scale': 284.2107354747758, 'noise_level': 0.36737057209459534, 'constant_value': 7.025962180000028, 'nu': 0.5}. Best is trial 959 with value: 0.1375110730946576.
[I 2024-12-04 21:09:11,213] Trial 1969 finished with value: 0.14249490425938374 and parameters: {'kernel_type': 'Matern', 'length_scale': 70.38167021915966, 'noise_level': 0.7561634607936578, 'constant_value': 2.070624995116993, 'nu': 1.5}. Best is trial 959 with value: 0.1375110730946576.
[I 2024-12-04 21:09:14,447] Trial 1970 finished with value: 0.9864686817666142 and parameters: {'kernel_type': 'RBF', 'length_scale': 241.64852239623013, 'noise_level': 0.020389050759826843, 'constant_value': 2.3452895729653376, 'nu': 1.5}. Best is trial 959 with value: 0.1375110730946576.
[I 2024-12-04 21:09:17,497] Trial 1971 finished with value: 0.1424949191509385 and parameters: {'kernel_type': 'Matern', 'length_scale': 3673.81695502658, 'noise_level': 0.6492020221238303, 'constant_value': 11.870335312514205, 'nu': 1.5}. Best is trial 959 with value: 0.1375110730946576.
[I 2024-12-04 21:09:19,716] Trial 1972 finished with value: 0.1424950526039231 and parameters: {'kernel_type': 'Matern', 'length_scale': 164.64081929339707, 'noise_level': 0.5252712001450461, 'constant_value': 88.3263750713341, 'nu': 1.5}. Best is trial 959 with value: 0.1375110730946576.
[I 2024-12-04 21:09:22,595] Trial 1973 finished with value: 0.1424950632123629 and parameters: {'kernel_type': 'Matern', 'length_scale': 55.794961035571994, 'noise_level': 0.5801721832379088, 'constant_value': 1.183767240453054, 'nu': 1.5}. Best is trial 959 with value: 0.1375110730946576.
[I 2024-12-04 21:09:25,219] Trial 1974 finished with value: 0.14249502812465326 and parameters: {'kernel_type': 'Matern', 'length_scale': 167.62922439356737, 'noise_level': 0.03262176288058536, 'constant_value': 26.420749488498696, 'nu': 1.5}. Best is trial 959 with value: 0.1375110730946576.
