[I 2024-12-04 11:58:17,405] Trial 220 finished with value: 0.9352462221724298 and parameters: {'n_estimators': 940, 'max_depth': 10, 'min_samples_split': 43, 'min_samples_leaf': 5, 'max_features': 'log2', 'bootstrap': True, 'criterion': 'squared_error'}. Best is trial 204 with value: 0.2923715058098161.
[I 2024-12-04 11:58:17,867] Trial 218 finished with value: 0.3004262050002038 and parameters: {'n_estimators': 452, 'max_depth': 44, 'min_samples_split': 3, 'min_samples_leaf': 1, 'max_features': 'sqrt', 'bootstrap': False, 'criterion': 'squared_error'}. Best is trial 204 with value: 0.2923715058098161.
[I 2024-12-04 11:58:17,979] Trial 200 finished with value: 0.678601159195122 and parameters: {'n_estimators': 847, 'max_depth': 18, 'min_samples_split': 14, 'min_samples_leaf': 1, 'max_features': 'log2', 'bootstrap': False, 'criterion': 'absolute_error'}. Best is trial 204 with value: 0.2923715058098161.
[I 2024-12-04 11:58:18,253] Trial 224 finished with value: 0.30496312184213026 and parameters: {'n_estimators': 535, 'max_depth': 41, 'min_samples_split': 3, 'min_samples_leaf': 1, 'max_features': 'sqrt', 'bootstrap': False, 'criterion': 'squared_error'}. Best is trial 204 with value: 0.2923715058098161.
[I 2024-12-04 11:58:18,265] Trial 213 finished with value: 0.4660005957250843 and parameters: {'n_estimators': 166, 'max_depth': 20, 'min_samples_split': 29, 'min_samples_leaf': 7, 'max_features': None, 'bootstrap': True, 'criterion': 'absolute_error'}. Best is trial 204 with value: 0.2923715058098161.
[I 2024-12-04 11:58:19,122] Trial 219 finished with value: 0.30104783270325564 and parameters: {'n_estimators': 375, 'max_depth': 47, 'min_samples_split': 2, 'min_samples_leaf': 1, 'max_features': 'sqrt', 'bootstrap': False, 'criterion': 'squared_error'}. Best is trial 204 with value: 0.2923715058098161.
[I 2024-12-04 11:58:19,616] Trial 210 finished with value: 0.2987082695041395 and parameters: {'n_estimators': 835, 'max_depth': 50, 'min_samples_split': 2, 'min_samples_leaf': 1, 'max_features': 'sqrt', 'bootstrap': False, 'criterion': 'squared_error'}. Best is trial 204 with value: 0.2923715058098161.
[I 2024-12-04 11:58:23,095] Trial 231 finished with value: 0.3084511250578784 and parameters: {'n_estimators': 107, 'max_depth': 45, 'min_samples_split': 4, 'min_samples_leaf': 1, 'max_features': 'sqrt', 'bootstrap': False, 'criterion': 'squared_error'}. Best is trial 204 with value: 0.2923715058098161.
[I 2024-12-04 11:58:23,316] Trial 230 finished with value: 0.30398106276726383 and parameters: {'n_estimators': 178, 'max_depth': 49, 'min_samples_split': 5, 'min_samples_leaf': 1, 'max_features': 'sqrt', 'bootstrap': False, 'criterion': 'squared_error'}. Best is trial 204 with value: 0.2923715058098161.
[I 2024-12-04 11:58:23,619] Trial 225 finished with value: 0.29825039936863945 and parameters: {'n_estimators': 521, 'max_depth': 50, 'min_samples_split': 2, 'min_samples_leaf': 1, 'max_features': 'sqrt', 'bootstrap': False, 'criterion': 'squared_error'}. Best is trial 204 with value: 0.2923715058098161.
[I 2024-12-04 11:58:23,853] Trial 227 finished with value: 0.4416920100190954 and parameters: {'n_estimators': 505, 'max_depth': 48, 'min_samples_split': 4, 'min_samples_leaf': 2, 'max_features': 'sqrt', 'bootstrap': False, 'criterion': 'squared_error'}. Best is trial 204 with value: 0.2923715058098161.
[I 2024-12-04 11:58:24,079] Trial 228 finished with value: 0.9130129299553248 and parameters: {'n_estimators': 820, 'max_depth': 46, 'min_samples_split': 41, 'min_samples_leaf': 15, 'max_features': 'sqrt', 'bootstrap': True, 'criterion': 'absolute_error'}. Best is trial 204 with value: 0.2923715058098161.
[I 2024-12-04 11:58:24,457] Trial 229 finished with value: 0.3987454925201856 and parameters: {'n_estimators': 631, 'max_depth': 45, 'min_samples_split': 49, 'min_samples_leaf': 1, 'max_features': None, 'bootstrap': True, 'criterion': 'squared_error'}. Best is trial 204 with value: 0.2923715058098161.
[I 2024-12-04 11:58:24,977] Trial 236 finished with value: 0.31363537485951 and parameters: {'n_estimators': 163, 'max_depth': 39, 'min_samples_split': 2, 'min_samples_leaf': 1, 'max_features': 'sqrt', 'bootstrap': False, 'criterion': 'squared_error'}. Best is trial 204 with value: 0.2923715058098161.
[I 2024-12-04 11:58:25,283] Trial 226 finished with value: 0.3858958285972674 and parameters: {'n_estimators': 560, 'max_depth': 49, 'min_samples_split': 2, 'min_samples_leaf': 1, 'max_features': 'log2', 'bootstrap': False, 'criterion': 'squared_error'}. Best is trial 204 with value: 0.2923715058098161.
[I 2024-12-04 11:58:25,931] Trial 233 finished with value: 0.2929663992160164 and parameters: {'n_estimators': 148, 'max_depth': 49, 'min_samples_split': 3, 'min_samples_leaf': 1, 'max_features': 'sqrt', 'bootstrap': False, 'criterion': 'squared_error'}. Best is trial 204 with value: 0.2923715058098161.
[I 2024-12-04 11:58:26,253] Trial 232 finished with value: 0.2932492280902247 and parameters: {'n_estimators': 340, 'max_depth': 49, 'min_samples_split': 3, 'min_samples_leaf': 1, 'max_features': 'sqrt', 'bootstrap': False, 'criterion': 'squared_error'}. Best is trial 204 with value: 0.2923715058098161.
[I 2024-12-04 11:58:26,258] Trial 235 finished with value: 0.9668888344105755 and parameters: {'n_estimators': 456, 'max_depth': 40, 'min_samples_split': 13, 'min_samples_leaf': 13, 'max_features': 'log2', 'bootstrap': True, 'criterion': 'absolute_error'}. Best is trial 204 with value: 0.2923715058098161.
[I 2024-12-04 11:58:26,867] Trial 206 finished with value: 0.3033747194490437 and parameters: {'n_estimators': 501, 'max_depth': 50, 'min_samples_split': 2, 'min_samples_leaf': 1, 'max_features': 'sqrt', 'bootstrap': False, 'criterion': 'absolute_error'}. Best is trial 204 with value: 0.2923715058098161.
[I 2024-12-04 11:58:26,887] Trial 240 finished with value: 0.29334005936081764 and parameters: {'n_estimators': 344, 'max_depth': 49, 'min_samples_split': 3, 'min_samples_leaf': 1, 'max_features': 'sqrt', 'bootstrap': False, 'criterion': 'squared_error'}. Best is trial 204 with value: 0.2923715058098161.
[I 2024-12-04 11:58:27,824] Trial 237 finished with value: 0.292809545130324 and parameters: {'n_estimators': 259, 'max_depth': 48, 'min_samples_split': 3, 'min_samples_leaf': 1, 'max_features': 'sqrt', 'bootstrap': False, 'criterion': 'squared_error'}. Best is trial 204 with value: 0.2923715058098161.
[I 2024-12-04 11:58:28,228] Trial 243 finished with value: 0.3027343479418175 and parameters: {'n_estimators': 121, 'max_depth': 45, 'min_samples_split': 2, 'min_samples_leaf': 1, 'max_features': 'sqrt', 'bootstrap': False, 'criterion': 'squared_error'}. Best is trial 204 with value: 0.2923715058098161.
[I 2024-12-04 11:58:28,398] Trial 234 finished with value: 0.3026898772494731 and parameters: {'n_estimators': 590, 'max_depth': 47, 'min_samples_split': 4, 'min_samples_leaf': 1, 'max_features': 'sqrt', 'bootstrap': False, 'criterion': 'squared_error'}. Best is trial 204 with value: 0.2923715058098161.
[I 2024-12-04 11:58:29,265] Trial 239 finished with value: 0.8476874701256403 and parameters: {'n_estimators': 390, 'max_depth': 9, 'min_samples_split': 12, 'min_samples_leaf': 3, 'max_features': 'log2', 'bootstrap': False, 'criterion': 'squared_error'}. Best is trial 204 with value: 0.2923715058098161.
[I 2024-12-04 11:58:30,226] Trial 251 finished with value: 0.29917441437570447 and parameters: {'n_estimators': 292, 'max_depth': 50, 'min_samples_split': 4, 'min_samples_leaf': 1, 'max_features': 'sqrt', 'bootstrap': False, 'criterion': 'squared_error'}. Best is trial 204 with value: 0.2923715058098161.
[I 2024-12-04 11:58:30,440] Trial 246 finished with value: 0.29532689822078767 and parameters: {'n_estimators': 329, 'max_depth': 50, 'min_samples_split': 3, 'min_samples_leaf': 1, 'max_features': 'sqrt', 'bootstrap': False, 'criterion': 'squared_error'}. Best is trial 204 with value: 0.2923715058098161.
[I 2024-12-04 11:58:31,960] Trial 217 finished with value: 0.2971079179898024 and parameters: {'n_estimators': 678, 'max_depth': 49, 'min_samples_split': 2, 'min_samples_leaf': 1, 'max_features': 'sqrt', 'bootstrap': False, 'criterion': 'squared_error'}. Best is trial 204 with value: 0.2923715058098161.
[I 2024-12-04 11:58:32,544] Trial 249 finished with value: 0.30144558014662887 and parameters: {'n_estimators': 389, 'max_depth': 45, 'min_samples_split': 2, 'min_samples_leaf': 1, 'max_features': 'sqrt', 'bootstrap': False, 'criterion': 'squared_error'}. Best is trial 204 with value: 0.2923715058098161.
[I 2024-12-04 11:58:33,569] Trial 248 finished with value: 0.2950943916848423 and parameters: {'n_estimators': 312, 'max_depth': 47, 'min_samples_split': 3, 'min_samples_leaf': 1, 'max_features': 'sqrt', 'bootstrap': False, 'criterion': 'squared_error'}. Best is trial 204 with value: 0.2923715058098161.
[I 2024-12-04 11:58:33,578] Trial 252 finished with value: 0.29466220605888294 and parameters: {'n_estimators': 270, 'max_depth': 47, 'min_samples_split': 3, 'min_samples_leaf': 1, 'max_features': 'sqrt', 'bootstrap': False, 'criterion': 'squared_error'}. Best is trial 204 with value: 0.2923715058098161.
[I 2024-12-04 11:58:33,755] Trial 242 finished with value: 0.29430081938753655 and parameters: {'n_estimators': 698, 'max_depth': 50, 'min_samples_split': 3, 'min_samples_leaf': 1, 'max_features': 'sqrt', 'bootstrap': False, 'criterion': 'squared_error'}. Best is trial 204 with value: 0.2923715058098161.
[I 2024-12-04 11:58:33,769] Trial 255 finished with value: 0.4431639351734888 and parameters: {'n_estimators': 255, 'max_depth': 49, 'min_samples_split': 5, 'min_samples_leaf': 2, 'max_features': 'sqrt', 'bootstrap': False, 'criterion': 'squared_error'}. Best is trial 204 with value: 0.2923715058098161.
[I 2024-12-04 11:58:34,061] Trial 257 finished with value: 0.44411518999816973 and parameters: {'n_estimators': 294, 'max_depth': 47, 'min_samples_split': 4, 'min_samples_leaf': 2, 'max_features': 'sqrt', 'bootstrap': False, 'criterion': 'squared_error'}. Best is trial 204 with value: 0.2923715058098161.
[I 2024-12-04 11:58:34,776] Trial 241 finished with value: 0.3025841343998689 and parameters: {'n_estimators': 361, 'max_depth': 49, 'min_samples_split': 4, 'min_samples_leaf': 1, 'max_features': 'sqrt', 'bootstrap': False, 'criterion': 'squared_error'}. Best is trial 204 with value: 0.2923715058098161.
[I 2024-12-04 11:58:34,970] Trial 254 finished with value: 0.2927507827889893 and parameters: {'n_estimators': 176, 'max_depth': 50, 'min_samples_split': 3, 'min_samples_leaf': 1, 'max_features': 'sqrt', 'bootstrap': False, 'criterion': 'squared_error'}. Best is trial 204 with value: 0.2923715058098161.
[I 2024-12-04 11:58:35,420] Trial 253 finished with value: 0.7601072142276385 and parameters: {'n_estimators': 659, 'max_depth': 6, 'min_samples_split': 2, 'min_samples_leaf': 2, 'max_features': 'sqrt', 'bootstrap': False, 'criterion': 'squared_error'}. Best is trial 204 with value: 0.2923715058098161.
[I 2024-12-04 11:58:36,811] Trial 244 finished with value: 0.29501312480262976 and parameters: {'n_estimators': 228, 'max_depth': 50, 'min_samples_split': 3, 'min_samples_leaf': 1, 'max_features': 'sqrt', 'bootstrap': False, 'criterion': 'squared_error'}. Best is trial 204 with value: 0.2923715058098161.
[I 2024-12-04 11:58:37,024] Trial 245 finished with value: 0.3032295903998566 and parameters: {'n_estimators': 252, 'max_depth': 49, 'min_samples_split': 4, 'min_samples_leaf': 1, 'max_features': 'sqrt', 'bootstrap': False, 'criterion': 'squared_error'}. Best is trial 204 with value: 0.2923715058098161.
[I 2024-12-04 11:58:37,499] Trial 259 finished with value: 0.30398714178884895 and parameters: {'n_estimators': 253, 'max_depth': 46, 'min_samples_split': 4, 'min_samples_leaf': 1, 'max_features': 'sqrt', 'bootstrap': False, 'criterion': 'squared_error'}. Best is trial 204 with value: 0.2923715058098161.
[I 2024-12-04 11:58:38,241] Trial 260 finished with value: 0.2937680436479395 and parameters: {'n_estimators': 276, 'max_depth': 49, 'min_samples_split': 3, 'min_samples_leaf': 1, 'max_features': 'sqrt', 'bootstrap': False, 'criterion': 'squared_error'}. Best is trial 204 with value: 0.2923715058098161.
[I 2024-12-04 11:58:38,806] Trial 256 finished with value: 0.29837918857199175 and parameters: {'n_estimators': 290, 'max_depth': 45, 'min_samples_split': 3, 'min_samples_leaf': 1, 'max_features': 'sqrt', 'bootstrap': False, 'criterion': 'squared_error'}. Best is trial 204 with value: 0.2923715058098161.
[I 2024-12-04 11:58:39,172] Trial 264 finished with value: 0.30015702105821346 and parameters: {'n_estimators': 291, 'max_depth': 48, 'min_samples_split': 4, 'min_samples_leaf': 1, 'max_features': 'sqrt', 'bootstrap': False, 'criterion': 'squared_error'}. Best is trial 204 with value: 0.2923715058098161.
[I 2024-12-04 11:58:39,763] Trial 262 finished with value: 0.30607748374708066 and parameters: {'n_estimators': 400, 'max_depth': 45, 'min_samples_split': 4, 'min_samples_leaf': 1, 'max_features': 'sqrt', 'bootstrap': False, 'criterion': 'squared_error'}. Best is trial 204 with value: 0.2923715058098161.
[I 2024-12-04 11:58:42,072] Trial 269 finished with value: 0.29418547094534186 and parameters: {'n_estimators': 334, 'max_depth': 48, 'min_samples_split': 3, 'min_samples_leaf': 1, 'max_features': 'sqrt', 'bootstrap': False, 'criterion': 'squared_error'}. Best is trial 204 with value: 0.2923715058098161.
[I 2024-12-04 11:58:43,911] Trial 265 finished with value: 0.29614275545698177 and parameters: {'n_estimators': 150, 'max_depth': 48, 'min_samples_split': 4, 'min_samples_leaf': 1, 'max_features': 'sqrt', 'bootstrap': False, 'criterion': 'squared_error'}. Best is trial 204 with value: 0.2923715058098161.
[I 2024-12-04 11:58:46,400] Trial 247 finished with value: 0.5616365372936878 and parameters: {'n_estimators': 490, 'max_depth': 15, 'min_samples_split': 3, 'min_samples_leaf': 1, 'max_features': 'sqrt', 'bootstrap': True, 'criterion': 'absolute_error'}. Best is trial 204 with value: 0.2923715058098161.
[I 2024-12-04 11:58:47,099] Trial 272 finished with value: 0.44140745215893834 and parameters: {'n_estimators': 411, 'max_depth': 50, 'min_samples_split': 3, 'min_samples_leaf': 2, 'max_features': 'sqrt', 'bootstrap': False, 'criterion': 'squared_error'}. Best is trial 204 with value: 0.2923715058098161.
[I 2024-12-04 11:58:48,885] Trial 274 finished with value: 0.29258250068781944 and parameters: {'n_estimators': 328, 'max_depth': 49, 'min_samples_split': 3, 'min_samples_leaf': 1, 'max_features': 'sqrt', 'bootstrap': False, 'criterion': 'squared_error'}. Best is trial 204 with value: 0.2923715058098161.
[I 2024-12-04 11:58:49,755] Trial 267 finished with value: 0.3523338994382824 and parameters: {'n_estimators': 448, 'max_depth': 36, 'min_samples_split': 4, 'min_samples_leaf': 1, 'max_features': 'sqrt', 'bootstrap': True, 'criterion': 'squared_error'}. Best is trial 204 with value: 0.2923715058098161.
[I 2024-12-04 11:58:50,070] Trial 263 finished with value: 0.29508955185646657 and parameters: {'n_estimators': 273, 'max_depth': 50, 'min_samples_split': 3, 'min_samples_leaf': 1, 'max_features': 'sqrt', 'bootstrap': False, 'criterion': 'squared_error'}. Best is trial 204 with value: 0.2923715058098161.
[I 2024-12-04 11:58:50,578] Trial 285 finished with value: 0.4471769148724446 and parameters: {'n_estimators': 158, 'max_depth': 48, 'min_samples_split': 3, 'min_samples_leaf': 2, 'max_features': 'sqrt', 'bootstrap': False, 'criterion': 'squared_error'}. Best is trial 204 with value: 0.2923715058098161.
[I 2024-12-04 11:58:51,282] Trial 280 finished with value: 0.407042459649278 and parameters: {'n_estimators': 315, 'max_depth': 46, 'min_samples_split': 5, 'min_samples_leaf': 1, 'max_features': 'log2', 'bootstrap': False, 'criterion': 'squared_error'}. Best is trial 204 with value: 0.2923715058098161.
[I 2024-12-04 11:58:51,884] Trial 270 finished with value: 0.342023008892277 and parameters: {'n_estimators': 421, 'max_depth': 20, 'min_samples_split': 2, 'min_samples_leaf': 1, 'max_features': None, 'bootstrap': True, 'criterion': 'squared_error'}. Best is trial 204 with value: 0.2923715058098161.
[I 2024-12-04 11:58:52,664] Trial 281 finished with value: 0.3043409292054338 and parameters: {'n_estimators': 329, 'max_depth': 41, 'min_samples_split': 3, 'min_samples_leaf': 1, 'max_features': 'sqrt', 'bootstrap': False, 'criterion': 'squared_error'}. Best is trial 204 with value: 0.2923715058098161.
[I 2024-12-04 11:58:52,850] Trial 275 finished with value: 0.3108926957556335 and parameters: {'n_estimators': 349, 'max_depth': 39, 'min_samples_split': 3, 'min_samples_leaf': 1, 'max_features': 'sqrt', 'bootstrap': False, 'criterion': 'squared_error'}. Best is trial 204 with value: 0.2923715058098161.
[I 2024-12-04 11:58:53,126] Trial 279 finished with value: 0.3102755594822564 and parameters: {'n_estimators': 447, 'max_depth': 49, 'min_samples_split': 6, 'min_samples_leaf': 1, 'max_features': 'sqrt', 'bootstrap': False, 'criterion': 'squared_error'}. Best is trial 204 with value: 0.2923715058098161.
[I 2024-12-04 11:58:53,792] Trial 282 finished with value: 0.30131336916995083 and parameters: {'n_estimators': 181, 'max_depth': 44, 'min_samples_split': 3, 'min_samples_leaf': 1, 'max_features': 'sqrt', 'bootstrap': False, 'criterion': 'squared_error'}. Best is trial 204 with value: 0.2923715058098161.
[I 2024-12-04 11:58:54,412] Trial 266 finished with value: 0.29424536740476964 and parameters: {'n_estimators': 383, 'max_depth': 50, 'min_samples_split': 3, 'min_samples_leaf': 1, 'max_features': 'sqrt', 'bootstrap': False, 'criterion': 'squared_error'}. Best is trial 204 with value: 0.2923715058098161.
[I 2024-12-04 11:58:55,164] Trial 271 finished with value: 0.2996396655191842 and parameters: {'n_estimators': 279, 'max_depth': 50, 'min_samples_split': 4, 'min_samples_leaf': 1, 'max_features': 'sqrt', 'bootstrap': False, 'criterion': 'squared_error'}. Best is trial 204 with value: 0.2923715058098161.
[I 2024-12-04 11:58:55,280] Trial 287 finished with value: 0.9353220051404793 and parameters: {'n_estimators': 263, 'max_depth': 10, 'min_samples_split': 27, 'min_samples_leaf': 5, 'max_features': 'log2', 'bootstrap': True, 'criterion': 'squared_error'}. Best is trial 204 with value: 0.2923715058098161.
[I 2024-12-04 11:58:55,909] Trial 286 finished with value: 0.2944640030185939 and parameters: {'n_estimators': 292, 'max_depth': 50, 'min_samples_split': 3, 'min_samples_leaf': 1, 'max_features': 'sqrt', 'bootstrap': False, 'criterion': 'squared_error'}. Best is trial 278 with value: 0.29190081509522536.
[I 2024-12-04 11:58:56,721] Trial 278 finished with value: 0.29190081509522536 and parameters: {'n_estimators': 244, 'max_depth': 48, 'min_samples_split': 3, 'min_samples_leaf': 1, 'max_features': 'sqrt', 'bootstrap': False, 'criterion': 'squared_error'}. Best is trial 278 with value: 0.29190081509522536.
[I 2024-12-04 11:58:58,316] Trial 283 finished with value: 0.29882668579911015 and parameters: {'n_estimators': 261, 'max_depth': 45, 'min_samples_split': 3, 'min_samples_leaf': 1, 'max_features': 'sqrt', 'bootstrap': False, 'criterion': 'squared_error'}. Best is trial 278 with value: 0.29190081509522536.
[I 2024-12-04 11:59:00,372] Trial 273 finished with value: 0.45951650220708956 and parameters: {'n_estimators': 181, 'max_depth': 47, 'min_samples_split': 3, 'min_samples_leaf': 2, 'max_features': 'sqrt', 'bootstrap': False, 'criterion': 'absolute_error'}. Best is trial 278 with value: 0.29190081509522536.
[I 2024-12-04 11:59:00,704] Trial 290 finished with value: 0.4801679897572389 and parameters: {'n_estimators': 376, 'max_depth': 46, 'min_samples_split': 3, 'min_samples_leaf': 2, 'max_features': 'sqrt', 'bootstrap': True, 'criterion': 'squared_error'}. Best is trial 278 with value: 0.29190081509522536.
[I 2024-12-04 11:59:00,771] Trial 276 finished with value: 0.8408683878055924 and parameters: {'n_estimators': 514, 'max_depth': 10, 'min_samples_split': 7, 'min_samples_leaf': 2, 'max_features': 'log2', 'bootstrap': True, 'criterion': 'absolute_error'}. Best is trial 278 with value: 0.29190081509522536.
[I 2024-12-04 11:59:02,198] Trial 289 finished with value: 0.30639786796595153 and parameters: {'n_estimators': 364, 'max_depth': 49, 'min_samples_split': 5, 'min_samples_leaf': 1, 'max_features': 'sqrt', 'bootstrap': False, 'criterion': 'squared_error'}. Best is trial 278 with value: 0.29190081509522536.
[I 2024-12-04 11:59:02,772] Trial 288 finished with value: 0.29526469562376456 and parameters: {'n_estimators': 300, 'max_depth': 49, 'min_samples_split': 2, 'min_samples_leaf': 1, 'max_features': 'sqrt', 'bootstrap': False, 'criterion': 'squared_error'}. Best is trial 278 with value: 0.29190081509522536.
[I 2024-12-04 11:59:02,970] Trial 292 finished with value: 0.29949932997069345 and parameters: {'n_estimators': 305, 'max_depth': 50, 'min_samples_split': 4, 'min_samples_leaf': 1, 'max_features': 'sqrt', 'bootstrap': False, 'criterion': 'squared_error'}. Best is trial 278 with value: 0.29190081509522536.
[I 2024-12-04 11:59:08,143] Trial 297 finished with value: 0.29562964421281174 and parameters: {'n_estimators': 112, 'max_depth': 50, 'min_samples_split': 3, 'min_samples_leaf': 1, 'max_features': 'sqrt', 'bootstrap': False, 'criterion': 'squared_error'}. Best is trial 278 with value: 0.29190081509522536.
[I 2024-12-04 11:59:08,490] Trial 293 finished with value: 0.9292284892480659 and parameters: {'n_estimators': 149, 'max_depth': 16, 'min_samples_split': 10, 'min_samples_leaf': 6, 'max_features': 'log2', 'bootstrap': False, 'criterion': 'absolute_error'}. Best is trial 278 with value: 0.29190081509522536.
[I 2024-12-04 11:59:08,956] Trial 296 finished with value: 0.3278586205167271 and parameters: {'n_estimators': 380, 'max_depth': 48, 'min_samples_split': 5, 'min_samples_leaf': 1, 'max_features': 'sqrt', 'bootstrap': True, 'criterion': 'squared_error'}. Best is trial 301 with value: 0.2918547308494618.
