[I 2024-12-03 18:48:53,479] Trial 1707 finished with value: 0.6110345862166183 and parameters: {'kernel': 'rbf', 'C': 86.70014102930068, 'gamma': 0.06673405893779236, 'epsilon': 0.16990291881700886}. Best is trial 1119 with value: 0.4485361816812923.
[I 2024-12-03 18:48:53,649] Trial 1702 finished with value: 0.5579803934548908 and parameters: {'kernel': 'rbf', 'C': 5.6219985834019495, 'gamma': 0.017284772509306746, 'epsilon': 0.03582216372813503}. Best is trial 1119 with value: 0.4485361816812923.
[I 2024-12-03 18:48:54,220] Trial 1715 finished with value: 0.4693016128145701 and parameters: {'kernel': 'rbf', 'C': 93.422964766469, 'gamma': 0.008640993487270066, 'epsilon': 0.13864382946306916}. Best is trial 1119 with value: 0.4485361816812923.
[I 2024-12-03 18:48:54,398] Trial 1712 finished with value: 0.46833642240314993 and parameters: {'kernel': 'rbf', 'C': 99.42208647172515, 'gamma': 0.009657950698098333, 'epsilon': 0.019026429532540974}. Best is trial 1119 with value: 0.4485361816812923.
[I 2024-12-03 18:48:54,880] Trial 1706 finished with value: 0.6544455055682328 and parameters: {'kernel': 'rbf', 'C': 19.30394386042655, 'gamma': 0.002080628118467131, 'epsilon': 0.08032919587322769}. Best is trial 1119 with value: 0.4485361816812923.
[I 2024-12-03 18:48:55,205] Trial 1699 finished with value: 0.48710693816764666 and parameters: {'kernel': 'rbf', 'C': 25.562850163604864, 'gamma': 0.018837568664783064, 'epsilon': 0.21842909934325017}. Best is trial 1119 with value: 0.4485361816812923.
[I 2024-12-03 18:48:55,398] Trial 1716 finished with value: 0.5063819052868493 and parameters: {'kernel': 'rbf', 'C': 95.77768510770892, 'gamma': 0.004984262658951571, 'epsilon': 0.029806455292645716}. Best is trial 1119 with value: 0.4485361816812923.
[I 2024-12-03 18:48:55,989] Trial 1710 finished with value: 43.94094147102688 and parameters: {'kernel': 'sigmoid', 'C': 20.68142375512833, 'gamma': 0.013181507404824329, 'epsilon': 0.04137824944891852}. Best is trial 1119 with value: 0.4485361816812923.
[I 2024-12-03 18:48:56,341] Trial 1704 finished with value: 0.604881628067218 and parameters: {'kernel': 'rbf', 'C': 15.231437647875465, 'gamma': 0.024686544179360788, 'epsilon': 0.7119363043220315}. Best is trial 1119 with value: 0.4485361816812923.
[I 2024-12-03 18:48:57,158] Trial 1714 finished with value: 0.520980023867864 and parameters: {'kernel': 'rbf', 'C': 97.1181977242305, 'gamma': 0.0042905425308688095, 'epsilon': 0.13994012300037986}. Best is trial 1119 with value: 0.4485361816812923.
[I 2024-12-03 18:48:57,414] Trial 1698 finished with value: 0.541164288339438 and parameters: {'kernel': 'rbf', 'C': 19.729364162368995, 'gamma': 0.007710454681101092, 'epsilon': 0.08926583720707029}. Best is trial 1119 with value: 0.4485361816812923.
[I 2024-12-03 18:48:57,635] Trial 1722 finished with value: 0.504274068580425 and parameters: {'kernel': 'rbf', 'C': 23.36696686563563, 'gamma': 0.05048244695048103, 'epsilon': 0.023509090954274302}. Best is trial 1119 with value: 0.4485361816812923.
[I 2024-12-03 18:48:57,731] Trial 1696 finished with value: 0.46561735690162015 and parameters: {'kernel': 'rbf', 'C': 24.5999712496845, 'gamma': 0.02278146651494794, 'epsilon': 0.05963955433264004}. Best is trial 1119 with value: 0.4485361816812923.
[I 2024-12-03 18:48:58,648] Trial 1718 finished with value: 0.9794219809103875 and parameters: {'kernel': 'sigmoid', 'C': 0.17287934079735534, 'gamma': 0.008184984326005406, 'epsilon': 0.0011516059688179067}. Best is trial 1119 with value: 0.4485361816812923.
[I 2024-12-03 18:48:58,649] Trial 1725 finished with value: 0.4831084512354255 and parameters: {'kernel': 'rbf', 'C': 96.90827058888908, 'gamma': 0.007116677635882744, 'epsilon': 0.039160036781224324}. Best is trial 1119 with value: 0.4485361816812923.
[I 2024-12-03 18:48:58,808] Trial 1723 finished with value: 0.618110319539461 and parameters: {'kernel': 'rbf', 'C': 89.11973711033122, 'gamma': 0.04947541157704369, 'epsilon': 0.1093008677592624}. Best is trial 1119 with value: 0.4485361816812923.
[I 2024-12-03 18:48:58,947] Trial 1709 finished with value: 0.47702825830108414 and parameters: {'kernel': 'rbf', 'C': 95.34788522499069, 'gamma': 0.02184271428902992, 'epsilon': 0.07168762356471696}. Best is trial 1119 with value: 0.4485361816812923.
[I 2024-12-03 18:48:59,140] Trial 1721 finished with value: 0.6537213462709898 and parameters: {'kernel': 'rbf', 'C': 3.461591953810322, 'gamma': 0.01078809421396744, 'epsilon': 0.06762984287593993}. Best is trial 1119 with value: 0.4485361816812923.
[I 2024-12-03 18:48:59,648] Trial 1728 finished with value: 0.45227455657550697 and parameters: {'kernel': 'rbf', 'C': 94.0227780859087, 'gamma': 0.011940815430184276, 'epsilon': 0.1028534284174113}. Best is trial 1119 with value: 0.4485361816812923.
[I 2024-12-03 18:49:00,179] Trial 1713 finished with value: 0.5968839046556089 and parameters: {'kernel': 'rbf', 'C': 92.29829241736343, 'gamma': 0.046340212052080706, 'epsilon': 0.07446087702427022}. Best is trial 1119 with value: 0.4485361816812923.
[I 2024-12-03 18:49:00,532] Trial 1711 finished with value: 0.5498785559761494 and parameters: {'kernel': 'rbf', 'C': 23.379212652081776, 'gamma': 0.006057768335387388, 'epsilon': 0.12104324535688493}. Best is trial 1119 with value: 0.4485361816812923.
[I 2024-12-03 18:49:00,714] Trial 1720 finished with value: 0.47047143014091164 and parameters: {'kernel': 'rbf', 'C': 31.95503201995863, 'gamma': 0.03109477286573856, 'epsilon': 0.0440429224286791}. Best is trial 1119 with value: 0.4485361816812923.
[I 2024-12-03 18:49:00,907] Trial 1727 finished with value: 0.497067776792229 and parameters: {'kernel': 'rbf', 'C': 19.807539830927247, 'gamma': 0.015189764818480236, 'epsilon': 0.08721717029382911}. Best is trial 1119 with value: 0.4485361816812923.
[I 2024-12-03 18:49:01,179] Trial 1724 finished with value: 0.5459606015801438 and parameters: {'kernel': 'rbf', 'C': 15.375862770414681, 'gamma': 0.008677954599883207, 'epsilon': 0.14621958802735216}. Best is trial 1119 with value: 0.4485361816812923.
[I 2024-12-03 18:49:01,529] Trial 1737 finished with value: 0.4898179303446933 and parameters: {'kernel': 'rbf', 'C': 98.6253955349272, 'gamma': 0.02530340089636194, 'epsilon': 0.040382994545071514}. Best is trial 1119 with value: 0.4485361816812923.
[I 2024-12-03 18:49:01,658] Trial 1730 finished with value: 0.551366258624782 and parameters: {'kernel': 'rbf', 'C': 93.87382293114038, 'gamma': 0.03366245788277663, 'epsilon': 0.039542101855607054}. Best is trial 1119 with value: 0.4485361816812923.
[I 2024-12-03 18:49:01,937] Trial 1739 finished with value: 0.5486927448168494 and parameters: {'kernel': 'rbf', 'C': 21.68997729376415, 'gamma': 0.01063223967241897, 'epsilon': 0.4179711713593465}. Best is trial 1119 with value: 0.4485361816812923.
[I 2024-12-03 18:49:02,051] Trial 1732 finished with value: 0.6076908599751439 and parameters: {'kernel': 'linear', 'C': 98.79743111127455, 'gamma': 0.013710735587902229, 'epsilon': 0.23645586206990582}. Best is trial 1119 with value: 0.4485361816812923.
[I 2024-12-03 18:49:02,077] Trial 1733 finished with value: 0.6341834754513904 and parameters: {'kernel': 'rbf', 'C': 98.4063602636894, 'gamma': 0.05165936066497622, 'epsilon': 0.1652391409215359}. Best is trial 1119 with value: 0.4485361816812923.
[I 2024-12-03 18:49:02,707] Trial 1719 finished with value: 134.10861256558044 and parameters: {'kernel': 'sigmoid', 'C': 34.473991686597905, 'gamma': 0.020710844913535295, 'epsilon': 0.1670410400974442}. Best is trial 1119 with value: 0.4485361816812923.
[I 2024-12-03 18:49:03,090] Trial 1736 finished with value: 0.5558371428888788 and parameters: {'kernel': 'rbf', 'C': 23.149490200495126, 'gamma': 0.005766923971661108, 'epsilon': 0.043963470720360436}. Best is trial 1119 with value: 0.4485361816812923.
[I 2024-12-03 18:49:03,257] Trial 1734 finished with value: 0.6099470408195704 and parameters: {'kernel': 'rbf', 'C': 92.05296032955108, 'gamma': 0.14093963790653016, 'epsilon': 0.0221223744738874}. Best is trial 1119 with value: 0.4485361816812923.
[I 2024-12-03 18:49:03,299] Trial 1729 finished with value: 0.5235754206344817 and parameters: {'kernel': 'rbf', 'C': 15.780730890069869, 'gamma': 0.013040094716559519, 'epsilon': 0.03272966226152712}. Best is trial 1119 with value: 0.4485361816812923.
[I 2024-12-03 18:49:03,628] Trial 1717 finished with value: 0.4578793614489213 and parameters: {'kernel': 'rbf', 'C': 90.3634948692281, 'gamma': 0.015966405916786393, 'epsilon': 0.08753590108679565}. Best is trial 1119 with value: 0.4485361816812923.
[I 2024-12-03 18:49:04,465] Trial 1741 finished with value: 0.4967145438688802 and parameters: {'kernel': 'rbf', 'C': 23.5861684928468, 'gamma': 0.03840945366639274, 'epsilon': 0.13535776152225482}. Best is trial 1119 with value: 0.4485361816812923.
[I 2024-12-03 18:49:04,654] Trial 1726 finished with value: 0.6248701538801633 and parameters: {'kernel': 'rbf', 'C': 96.47602122030307, 'gamma': 0.0005230376973107528, 'epsilon': 0.17878600465873362}. Best is trial 1119 with value: 0.4485361816812923.
[I 2024-12-03 18:49:05,116] Trial 1731 finished with value: 0.4930318434324558 and parameters: {'kernel': 'rbf', 'C': 25.68684948903695, 'gamma': 0.013110599219221676, 'epsilon': 0.08893940275889804}. Best is trial 1119 with value: 0.4485361816812923.
[I 2024-12-03 18:49:05,672] Trial 1738 finished with value: 0.6274327185792088 and parameters: {'kernel': 'rbf', 'C': 18.584840839053005, 'gamma': 0.0026696313446579498, 'epsilon': 0.05660936121984442}. Best is trial 1119 with value: 0.4485361816812923.
[I 2024-12-03 18:49:06,774] Trial 1749 finished with value: 1.3596260671375966 and parameters: {'kernel': 'sigmoid', 'C': 0.003460352804984157, 'gamma': 0.9916509806094759, 'epsilon': 0.13299950006376665}. Best is trial 1119 with value: 0.4485361816812923.
[I 2024-12-03 18:49:06,776] Trial 1742 finished with value: 0.5071657446206773 and parameters: {'kernel': 'rbf', 'C': 98.68274927812193, 'gamma': 0.027746124424690308, 'epsilon': 0.02405523242495331}. Best is trial 1119 with value: 0.4485361816812923.
[I 2024-12-03 18:49:07,824] Trial 1745 finished with value: 0.5497208449575812 and parameters: {'kernel': 'rbf', 'C': 4.002191355093908, 'gamma': 0.03508490613237141, 'epsilon': 0.11340969069222606}. Best is trial 1119 with value: 0.4485361816812923.
[I 2024-12-03 18:49:08,256] Trial 1746 finished with value: 0.5045207090555718 and parameters: {'kernel': 'rbf', 'C': 95.97555240056805, 'gamma': 0.00481740934189585, 'epsilon': 0.04176162403205032}. Best is trial 1119 with value: 0.4485361816812923.
[I 2024-12-03 18:49:08,526] Trial 1743 finished with value: 0.4671731757706121 and parameters: {'kernel': 'rbf', 'C': 89.2886944812425, 'gamma': 0.011032518743582395, 'epsilon': 0.15782117731537076}. Best is trial 1119 with value: 0.4485361816812923.
[I 2024-12-03 18:49:08,660] Trial 1744 finished with value: 0.47624889172871726 and parameters: {'kernel': 'rbf', 'C': 99.57258925360843, 'gamma': 0.007857185370987427, 'epsilon': 0.0352104024119892}. Best is trial 1119 with value: 0.4485361816812923.
[I 2024-12-03 18:49:09,098] Trial 1748 finished with value: 0.49443354842507514 and parameters: {'kernel': 'rbf', 'C': 19.402586948812555, 'gamma': 0.015509851263662238, 'epsilon': 0.050048604941949966}. Best is trial 1119 with value: 0.4485361816812923.
[I 2024-12-03 18:49:09,100] Trial 1756 finished with value: 0.5472714844826311 and parameters: {'kernel': 'rbf', 'C': 98.7764195681542, 'gamma': 0.031627175786948666, 'epsilon': 0.057998555310064995}. Best is trial 1119 with value: 0.4485361816812923.
[I 2024-12-03 18:49:09,454] Trial 1751 finished with value: 0.4608933931267231 and parameters: {'kernel': 'rbf', 'C': 99.18938457043464, 'gamma': 0.017498855962462687, 'epsilon': 0.028296867063156494}. Best is trial 1119 with value: 0.4485361816812923.
[I 2024-12-03 18:49:09,679] Trial 1740 finished with value: 0.5329669229807554 and parameters: {'kernel': 'rbf', 'C': 92.26787310465964, 'gamma': 0.010173285220881968, 'epsilon': 0.33532548260848705}. Best is trial 1119 with value: 0.4485361816812923.
[I 2024-12-03 18:49:09,841] Trial 1735 finished with value: 0.530313352010425 and parameters: {'kernel': 'rbf', 'C': 24.959447970769766, 'gamma': 0.009741378447946852, 'epsilon': 0.1534700204966491}. Best is trial 1119 with value: 0.4485361816812923.
[I 2024-12-03 18:49:10,142] Trial 1755 finished with value: 0.5408087414561398 and parameters: {'kernel': 'rbf', 'C': 25.864406259263355, 'gamma': 0.006579616660488003, 'epsilon': 0.03554922945332818}. Best is trial 1119 with value: 0.4485361816812923.
[I 2024-12-03 18:49:10,730] Trial 1753 finished with value: 0.561799370413187 and parameters: {'kernel': 'linear', 'C': 2.758895978633939, 'gamma': 0.03599038695399861, 'epsilon': 0.054118312589450435}. Best is trial 1119 with value: 0.4485361816812923.
[I 2024-12-03 18:49:10,992] Trial 1750 finished with value: 0.5844135756030311 and parameters: {'kernel': 'rbf', 'C': 95.00383932804274, 'gamma': 0.03542224258891643, 'epsilon': 0.26867713510949776}. Best is trial 1119 with value: 0.4485361816812923.
[I 2024-12-03 18:49:11,302] Trial 1747 finished with value: 0.4703954338525868 and parameters: {'kernel': 'rbf', 'C': 25.303125572054824, 'gamma': 0.03246314994172804, 'epsilon': 0.043477289739949604}. Best is trial 1119 with value: 0.4485361816812923.
[I 2024-12-03 18:49:11,316] Trial 1760 finished with value: 0.5433285266213901 and parameters: {'kernel': 'rbf', 'C': 3.9214519922935662, 'gamma': 0.07360252936362044, 'epsilon': 0.06084335088095172}. Best is trial 1119 with value: 0.4485361816812923.
[I 2024-12-03 18:49:11,585] Trial 1762 finished with value: 0.5569052214000635 and parameters: {'kernel': 'rbf', 'C': 99.53621395944546, 'gamma': 0.00237822226946813, 'epsilon': 0.056331035381888245}. Best is trial 1119 with value: 0.4485361816812923.
[I 2024-12-03 18:49:11,753] Trial 1763 finished with value: 0.4525446219606792 and parameters: {'kernel': 'rbf', 'C': 87.57797550325395, 'gamma': 0.012661513169242087, 'epsilon': 0.1009483756391656}. Best is trial 1119 with value: 0.4485361816812923.
[I 2024-12-03 18:49:11,782] Trial 1754 finished with value: 0.583270703064299 and parameters: {'kernel': 'rbf', 'C': 39.14337403452366, 'gamma': 0.002344350456091616, 'epsilon': 0.009030623474115965}. Best is trial 1119 with value: 0.4485361816812923.
[I 2024-12-03 18:49:12,077] Trial 1761 finished with value: 0.45942779950921847 and parameters: {'kernel': 'rbf', 'C': 94.2284580651835, 'gamma': 0.011264221367668551, 'epsilon': 0.04426848799107064}. Best is trial 1119 with value: 0.4485361816812923.
[I 2024-12-03 18:49:12,247] Trial 1768 finished with value: 0.9173512552982166 and parameters: {'kernel': 'poly', 'C': 11.098664003045313, 'gamma': 0.017677552989554052, 'epsilon': 0.03090814769949146}. Best is trial 1119 with value: 0.4485361816812923.
[I 2024-12-03 18:49:12,655] Trial 1752 finished with value: 0.5213944017425026 and parameters: {'kernel': 'rbf', 'C': 21.284262902940267, 'gamma': 0.011677238709891683, 'epsilon': 0.13917570448178238}. Best is trial 1119 with value: 0.4485361816812923.
[I 2024-12-03 18:49:13,651] Trial 1767 finished with value: 0.587692586526775 and parameters: {'kernel': 'rbf', 'C': 24.258805850870644, 'gamma': 0.0029047365603520497, 'epsilon': 0.12533387292898276}. Best is trial 1119 with value: 0.4485361816812923.
[I 2024-12-03 18:49:13,840] Trial 1771 finished with value: 0.5727291691069156 and parameters: {'kernel': 'rbf', 'C': 18.1513562553165, 'gamma': 0.004822925533885655, 'epsilon': 0.056686557686191706}. Best is trial 1119 with value: 0.4485361816812923.
[I 2024-12-03 18:49:13,841] Trial 1766 finished with value: 0.5366091662925914 and parameters: {'kernel': 'rbf', 'C': 98.13217750040464, 'gamma': 0.0035872087758658786, 'epsilon': 0.14318415627065204}. Best is trial 1119 with value: 0.4485361816812923.
[I 2024-12-03 18:49:13,900] Trial 1758 finished with value: 0.47247231935399114 and parameters: {'kernel': 'rbf', 'C': 29.064610909057645, 'gamma': 0.025609794355681583, 'epsilon': 0.14549021146810798}. Best is trial 1119 with value: 0.4485361816812923.
[I 2024-12-03 18:49:14,468] Trial 1769 finished with value: 0.6020007469251882 and parameters: {'kernel': 'rbf', 'C': 23.792917671762684, 'gamma': 0.13952013939148586, 'epsilon': 0.07697476942799551}. Best is trial 1119 with value: 0.4485361816812923.
[I 2024-12-03 18:49:14,473] Trial 1764 finished with value: 0.45824610370148744 and parameters: {'kernel': 'rbf', 'C': 91.4598177410587, 'gamma': 0.011721072329595955, 'epsilon': 0.04714144539534254}. Best is trial 1119 with value: 0.4485361816812923.
[I 2024-12-03 18:49:15,848] Trial 1765 finished with value: 0.5545040605721585 and parameters: {'kernel': 'linear', 'C': 22.69759446346529, 'gamma': 0.05271881597706916, 'epsilon': 0.01615548314972778}. Best is trial 1119 with value: 0.4485361816812923.
[I 2024-12-03 18:49:15,850] Trial 1759 finished with value: 0.5542944657235035 and parameters: {'kernel': 'rbf', 'C': 98.2506856544012, 'gamma': 0.004675270433517107, 'epsilon': 0.23345951420298838}. Best is trial 1119 with value: 0.4485361816812923.
[I 2024-12-03 18:49:16,257] Trial 1757 finished with value: 0.46505898581216143 and parameters: {'kernel': 'rbf', 'C': 23.529988105657523, 'gamma': 0.028666136036933697, 'epsilon': 0.05294012722436064}. Best is trial 1119 with value: 0.4485361816812923.
[I 2024-12-03 18:49:16,439] Trial 1772 finished with value: 0.724166698654099 and parameters: {'kernel': 'rbf', 'C': 7.02332296149347, 'gamma': 0.002364243144311716, 'epsilon': 0.2366475084086973}. Best is trial 1119 with value: 0.4485361816812923.
[I 2024-12-03 18:49:16,470] Trial 1770 finished with value: 1.109751333486293 and parameters: {'kernel': 'poly', 'C': 79.97372941975576, 'gamma': 0.00244260533390574, 'epsilon': 0.044671513326294564}. Best is trial 1119 with value: 0.4485361816812923.
[I 2024-12-03 18:49:16,833] Trial 1780 finished with value: 0.49875984219510233 and parameters: {'kernel': 'rbf', 'C': 89.16077897330305, 'gamma': 0.005325726606371746, 'epsilon': 0.05194362338414409}. Best is trial 1119 with value: 0.4485361816812923.
[I 2024-12-03 18:49:17,070] Trial 1776 finished with value: 0.5594206992735065 and parameters: {'kernel': 'rbf', 'C': 99.42196108211117, 'gamma': 0.03440896141944815, 'epsilon': 0.07848047182180644}. Best is trial 1119 with value: 0.4485361816812923.
[I 2024-12-03 18:49:17,213] Trial 1775 finished with value: 2.827379645760664 and parameters: {'kernel': 'sigmoid', 'C': 1.3002174763038903, 'gamma': 0.016385812748433155, 'epsilon': 0.05951169789497597}. Best is trial 1119 with value: 0.4485361816812923.
[I 2024-12-03 18:49:17,307] Trial 1773 finished with value: 0.6257193892892465 and parameters: {'kernel': 'rbf', 'C': 99.45268589543502, 'gamma': 0.045433025579544054, 'epsilon': 0.18512916292960646}. Best is trial 1119 with value: 0.4485361816812923.
[I 2024-12-03 18:49:17,586] Trial 1778 finished with value: 98.39796954272313 and parameters: {'kernel': 'sigmoid', 'C': 73.32857302240483, 'gamma': 0.00997554507783464, 'epsilon': 0.05037825459376693}. Best is trial 1119 with value: 0.4485361816812923.
[I 2024-12-03 18:49:17,897] Trial 1774 finished with value: 0.559632013741526 and parameters: {'kernel': 'rbf', 'C': 24.31184514196851, 'gamma': 0.005831717260254213, 'epsilon': 0.01546346037531988}. Best is trial 1119 with value: 0.4485361816812923.
[I 2024-12-03 18:49:18,378] Trial 1784 finished with value: 0.5242389120188128 and parameters: {'kernel': 'rbf', 'C': 18.12574005412883, 'gamma': 0.011323625550444218, 'epsilon': 0.07363843697947237}. Best is trial 1119 with value: 0.4485361816812923.
[I 2024-12-03 18:49:18,459] Trial 1788 finished with value: 0.5279453444761334 and parameters: {'kernel': 'rbf', 'C': 27.940656028793374, 'gamma': 0.007939474623521773, 'epsilon': 0.053007526903250474}. Best is trial 1119 with value: 0.4485361816812923.
[I 2024-12-03 18:49:18,611] Trial 1779 finished with value: 0.44972324796422036 and parameters: {'kernel': 'rbf', 'C': 92.38333824578675, 'gamma': 0.012809249564439424, 'epsilon': 0.06207147536988537}. Best is trial 1119 with value: 0.4485361816812923.
[I 2024-12-03 18:49:19,547] Trial 1785 finished with value: 0.46934640796518523 and parameters: {'kernel': 'rbf', 'C': 19.071249749711605, 'gamma': 0.03265074164365487, 'epsilon': 0.04635493466387553}. Best is trial 1119 with value: 0.4485361816812923.
[I 2024-12-03 18:49:20,330] Trial 1793 finished with value: 0.48252089919507146 and parameters: {'kernel': 'rbf', 'C': 89.95339922400717, 'gamma': 0.007678240192314234, 'epsilon': 0.13268549705729912}. Best is trial 1119 with value: 0.4485361816812923.
[I 2024-12-03 18:49:20,336] Trial 1781 finished with value: 0.4734518836903985 and parameters: {'kernel': 'rbf', 'C': 18.674100584614038, 'gamma': 0.02108024145719023, 'epsilon': 0.14342171369669213}. Best is trial 1119 with value: 0.4485361816812923.
[I 2024-12-03 18:49:20,675] Trial 1777 finished with value: 0.6536530564465759 and parameters: {'kernel': 'rbf', 'C': 88.37601978452645, 'gamma': 0.058012408849502685, 'epsilon': 0.023613032250381118}. Best is trial 1119 with value: 0.4485361816812923.
[I 2024-12-03 18:49:20,985] Trial 1783 finished with value: 1.2332331113773671 and parameters: {'kernel': 'poly', 'C': 0.14417984771343162, 'gamma': 0.005161057283848346, 'epsilon': 0.0011157667045739318}. Best is trial 1119 with value: 0.4485361816812923.
[I 2024-12-03 18:49:21,166] Trial 1790 finished with value: 0.4637135953160363 and parameters: {'kernel': 'rbf', 'C': 98.48913156284021, 'gamma': 0.015827719469479987, 'epsilon': 0.09874498394372334}. Best is trial 1119 with value: 0.4485361816812923.
[I 2024-12-03 18:49:21,381] Trial 1786 finished with value: 0.5607746188810503 and parameters: {'kernel': 'rbf', 'C': 5.5663765189571315, 'gamma': 0.01734245195653472, 'epsilon': 0.02195092523815867}. Best is trial 1119 with value: 0.4485361816812923.
