[I 2024-12-04 15:17:08,636] Trial 1334 finished with value: 0.15167297771186047 and parameters: {'kernel_type': 'RBF', 'length_scale': 24.967332927039344, 'noise_level': 0.05566587124882165, 'constant_value': 45967.590003964906, 'nu': 1.5}. Best is trial 750 with value: 0.13435342446039877.
[I 2024-12-04 15:17:11,409] Trial 1341 finished with value: 0.1343544042077334 and parameters: {'kernel_type': 'Matern', 'length_scale': 7.699814809695054, 'noise_level': 0.0705443975593247, 'constant_value': 333.84251667267523, 'nu': 1.5}. Best is trial 750 with value: 0.13435342446039877.
[I 2024-12-04 15:17:13,516] Trial 1344 finished with value: 0.1343544404413424 and parameters: {'kernel_type': 'Matern', 'length_scale': 0.3116026463630031, 'noise_level': 3.150896438010816e-06, 'constant_value': 3.9026429099478444, 'nu': 1.5}. Best is trial 750 with value: 0.13435342446039877.
[I 2024-12-04 15:17:15,315] Trial 1336 finished with value: 0.13435436689229024 and parameters: {'kernel_type': 'Matern', 'length_scale': 71.28221869991279, 'noise_level': 0.8910088337856082, 'constant_value': 1503.956725811899, 'nu': 1.5}. Best is trial 750 with value: 0.13435342446039877.
[I 2024-12-04 15:17:15,363] Trial 1345 finished with value: 0.13435440555631165 and parameters: {'kernel_type': 'Matern', 'length_scale': 326.54101227917096, 'noise_level': 0.013743248210086653, 'constant_value': 1989.9827286189898, 'nu': 1.5}. Best is trial 750 with value: 0.13435342446039877.
[I 2024-12-04 15:17:16,680] Trial 1338 finished with value: 0.13435439943544392 and parameters: {'kernel_type': 'Matern', 'length_scale': 0.2601154953341658, 'noise_level': 0.00047379929089101994, 'constant_value': 7813.310360312904, 'nu': 1.5}. Best is trial 750 with value: 0.13435342446039877.
[I 2024-12-04 15:17:17,112] Trial 1342 finished with value: 0.13435438985117182 and parameters: {'kernel_type': 'Matern', 'length_scale': 63.00991287990623, 'noise_level': 0.004653947310207018, 'constant_value': 7.579983212911571, 'nu': 1.5}. Best is trial 750 with value: 0.13435342446039877.
[I 2024-12-04 15:17:20,425] Trial 1354 finished with value: 0.1343544001507837 and parameters: {'kernel_type': 'Matern', 'length_scale': 156.18157031339422, 'noise_level': 0.07589737821921594, 'constant_value': 98803.73587631999, 'nu': 1.5}. Best is trial 750 with value: 0.13435342446039877.
[I 2024-12-04 15:17:20,942] Trial 1340 finished with value: 0.13435430144108923 and parameters: {'kernel_type': 'Matern', 'length_scale': 0.9126548669221647, 'noise_level': 0.01139621322397001, 'constant_value': 664.4100720502054, 'nu': 1.5}. Best is trial 750 with value: 0.13435342446039877.
[I 2024-12-04 15:17:21,666] Trial 1349 finished with value: 0.14859816453010785 and parameters: {'kernel_type': 'Matern', 'length_scale': 0.6060393962205499, 'noise_level': 2.7243787332539107e-08, 'constant_value': 4.000737581173845, 'nu': 2.5}. Best is trial 750 with value: 0.13435342446039877.
[I 2024-12-04 15:17:21,822] Trial 1343 finished with value: 0.13435440234043194 and parameters: {'kernel_type': 'Matern', 'length_scale': 360.4003296979561, 'noise_level': 0.02092710514350015, 'constant_value': 19.419794101401614, 'nu': 1.5}. Best is trial 750 with value: 0.13435342446039877.
[I 2024-12-04 15:17:22,105] Trial 1361 finished with value: 0.1343544001460653 and parameters: {'kernel_type': 'Matern', 'length_scale': 195.8739023956523, 'noise_level': 0.8165914353147835, 'constant_value': 112.83790554225168, 'nu': 1.5}. Best is trial 750 with value: 0.13435342446039877.
[I 2024-12-04 15:17:24,064] Trial 1351 finished with value: 0.13435486398913754 and parameters: {'kernel_type': 'Matern', 'length_scale': 0.42138707511950624, 'noise_level': 0.0798893807438423, 'constant_value': 57.67731215695289, 'nu': 1.5}. Best is trial 750 with value: 0.13435342446039877.
[I 2024-12-04 15:17:24,207] Trial 1350 finished with value: 0.14859827225339214 and parameters: {'kernel_type': 'Matern', 'length_scale': 4.393884659626789, 'noise_level': 1.0388506618064986e-10, 'constant_value': 1.0599302333396882e-07, 'nu': 2.5}. Best is trial 750 with value: 0.13435342446039877.
[I 2024-12-04 15:17:25,791] Trial 1347 finished with value: 0.13435451717300576 and parameters: {'kernel_type': 'Matern', 'length_scale': 142.3399259916787, 'noise_level': 0.0526308986308631, 'constant_value': 1084.3838968452555, 'nu': 1.5}. Best is trial 750 with value: 0.13435342446039877.
[I 2024-12-04 15:17:26,101] Trial 1358 finished with value: 0.13435439472768648 and parameters: {'kernel_type': 'Matern', 'length_scale': 13.174430236313126, 'noise_level': 0.0671893386738414, 'constant_value': 276.2829401810585, 'nu': 1.5}. Best is trial 750 with value: 0.13435342446039877.
[I 2024-12-04 15:17:27,255] Trial 1348 finished with value: 1.2693635028579122 and parameters: {'kernel_type': 'RBF', 'length_scale': 1170.611398752244, 'noise_level': 1.884666569567912e-08, 'constant_value': 1.590969364251669e-07, 'nu': 0.5}. Best is trial 750 with value: 0.13435342446039877.
[I 2024-12-04 15:17:27,346] Trial 1346 finished with value: 0.13435455654038744 and parameters: {'kernel_type': 'Matern', 'length_scale': 210.75076582592618, 'noise_level': 0.05724691602227609, 'constant_value': 708.2603075870644, 'nu': 1.5}. Best is trial 750 with value: 0.13435342446039877.
[I 2024-12-04 15:17:27,933] Trial 1356 finished with value: 1.2693634464279804 and parameters: {'kernel_type': 'Matern', 'length_scale': 0.0891955718880444, 'noise_level': 0.03678011983144734, 'constant_value': 1070.9027599323415, 'nu': 1.5}. Best is trial 750 with value: 0.13435342446039877.
[I 2024-12-04 15:17:30,869] Trial 1357 finished with value: 0.1343544001163795 and parameters: {'kernel_type': 'Matern', 'length_scale': 0.5503116504720703, 'noise_level': 0.5261764066912307, 'constant_value': 1149.7208472893326, 'nu': 1.5}. Best is trial 750 with value: 0.13435342446039877.
[I 2024-12-04 15:17:31,691] Trial 1362 finished with value: 0.1343544007233948 and parameters: {'kernel_type': 'Matern', 'length_scale': 2.4054250031137623, 'noise_level': 0.9045252117743172, 'constant_value': 53873.84296526068, 'nu': 1.5}. Best is trial 750 with value: 0.13435342446039877.
[I 2024-12-04 15:17:33,965] Trial 1365 finished with value: 0.13435440796400558 and parameters: {'kernel_type': 'Matern', 'length_scale': 1201.3130995477393, 'noise_level': 0.007882488499642166, 'constant_value': 48895.84353891849, 'nu': 1.5}. Best is trial 750 with value: 0.13435342446039877.
[I 2024-12-04 15:17:34,911] Trial 1359 finished with value: 0.1343544347712207 and parameters: {'kernel_type': 'Matern', 'length_scale': 22.044190434203426, 'noise_level': 0.6377734714522475, 'constant_value': 47822.014465109336, 'nu': 1.5}. Best is trial 750 with value: 0.13435342446039877.
[I 2024-12-04 15:17:36,215] Trial 1352 finished with value: 0.134354414870934 and parameters: {'kernel_type': 'Matern', 'length_scale': 6.210118242899971, 'noise_level': 0.0033949865726169777, 'constant_value': 342.27562815560026, 'nu': 1.5}. Best is trial 750 with value: 0.13435342446039877.
[I 2024-12-04 15:17:36,643] Trial 1353 finished with value: 1.269363502856498 and parameters: {'kernel_type': 'Matern', 'length_scale': 2447.958858593391, 'noise_level': 4.7204978531567707e-07, 'constant_value': 1.023688003396564e-06, 'nu': 1.5}. Best is trial 750 with value: 0.13435342446039877.
[I 2024-12-04 15:17:37,285] Trial 1360 finished with value: 0.134354359132985 and parameters: {'kernel_type': 'Matern', 'length_scale': 17.408906483596347, 'noise_level': 0.05563693257746471, 'constant_value': 1101.097248028201, 'nu': 1.5}. Best is trial 750 with value: 0.13435342446039877.
[I 2024-12-04 15:17:37,813] Trial 1355 finished with value: 0.13435440080854885 and parameters: {'kernel_type': 'Matern', 'length_scale': 4.142959039654107, 'noise_level': 0.5825137513377323, 'constant_value': 4.076860901949618, 'nu': 1.5}. Best is trial 750 with value: 0.13435342446039877.
[I 2024-12-04 15:17:40,231] Trial 1368 finished with value: 1.3007739235930267 and parameters: {'kernel_type': 'RBF', 'length_scale': 0.00010341665420324995, 'noise_level': 1.9833888043702498e-07, 'constant_value': 85350.39569820093, 'nu': 1.5}. Best is trial 750 with value: 0.13435342446039877.
[I 2024-12-04 15:17:41,029] Trial 1363 finished with value: 0.1343543684927996 and parameters: {'kernel_type': 'Matern', 'length_scale': 0.14540905075019847, 'noise_level': 0.5864219443004162, 'constant_value': 4758.222122456615, 'nu': 1.5}. Best is trial 750 with value: 0.13435342446039877.
[I 2024-12-04 15:17:41,331] Trial 1370 finished with value: 0.13435440522578243 and parameters: {'kernel_type': 'Matern', 'length_scale': 19.18924352294636, 'noise_level': 0.0028042946153644683, 'constant_value': 128.6797165572878, 'nu': 1.5}. Best is trial 750 with value: 0.13435342446039877.
[I 2024-12-04 15:17:41,652] Trial 1371 finished with value: 0.17251040267063344 and parameters: {'kernel_type': 'Matern', 'length_scale': 0.6803254255628699, 'noise_level': 0.7117251506490634, 'constant_value': 1582.4513102961669, 'nu': 0.5}. Best is trial 750 with value: 0.13435342446039877.
[I 2024-12-04 15:17:41,798] Trial 1369 finished with value: 0.13435422941657826 and parameters: {'kernel_type': 'Matern', 'length_scale': 85.9788343457684, 'noise_level': 0.001870700541036362, 'constant_value': 274.51357826145284, 'nu': 1.5}. Best is trial 750 with value: 0.13435342446039877.
[I 2024-12-04 15:17:42,076] Trial 1366 finished with value: 0.148598270838794 and parameters: {'kernel_type': 'Matern', 'length_scale': 15.130228204818906, 'noise_level': 0.5335190431694853, 'constant_value': 61.58864026085075, 'nu': 2.5}. Best is trial 750 with value: 0.13435342446039877.
[I 2024-12-04 15:17:43,040] Trial 1374 finished with value: 0.13435439975088354 and parameters: {'kernel_type': 'Matern', 'length_scale': 4.51475283494812, 'noise_level': 0.011347430828672423, 'constant_value': 831.6450903797812, 'nu': 1.5}. Best is trial 750 with value: 0.13435342446039877.
[I 2024-12-04 15:17:44,320] Trial 1378 finished with value: 0.13435439984350875 and parameters: {'kernel_type': 'Matern', 'length_scale': 3.228482195166885, 'noise_level': 0.04928990024838622, 'constant_value': 12.75617189152871, 'nu': 1.5}. Best is trial 750 with value: 0.13435342446039877.
[I 2024-12-04 15:17:45,388] Trial 1364 finished with value: 0.15167295961967744 and parameters: {'kernel_type': 'RBF', 'length_scale': 1.6284117712556485, 'noise_level': 0.5524000497553635, 'constant_value': 2.61277934258933e-05, 'nu': 1.5}. Best is trial 750 with value: 0.13435342446039877.
[I 2024-12-04 15:17:46,045] Trial 1367 finished with value: 1.2693635028570045 and parameters: {'kernel_type': 'Matern', 'length_scale': 1.4307859502731422e-05, 'noise_level': 3.6112813830086767e-07, 'constant_value': 0.001002289004843638, 'nu': 2.5}. Best is trial 750 with value: 0.13435342446039877.
[I 2024-12-04 15:17:46,660] Trial 1375 finished with value: 0.13435438162463847 and parameters: {'kernel_type': 'Matern', 'length_scale': 14.181161085367213, 'noise_level': 0.029149930418289224, 'constant_value': 1717.1428073911493, 'nu': 1.5}. Best is trial 750 with value: 0.13435342446039877.
[I 2024-12-04 15:17:46,865] Trial 1385 finished with value: 1.269363502857013 and parameters: {'kernel_type': 'RBF', 'length_scale': 0.0001911740659111909, 'noise_level': 0.7621206192167683, 'constant_value': 101.42493333451017, 'nu': 1.5}. Best is trial 750 with value: 0.13435342446039877.
[I 2024-12-04 15:17:51,772] Trial 1377 finished with value: 0.13435439687699602 and parameters: {'kernel_type': 'Matern', 'length_scale': 146.5059932778899, 'noise_level': 0.05986973925442561, 'constant_value': 5073.209695167396, 'nu': 1.5}. Best is trial 750 with value: 0.13435342446039877.
[I 2024-12-04 15:17:53,058] Trial 1380 finished with value: 0.13435439051383322 and parameters: {'kernel_type': 'Matern', 'length_scale': 13.601763834937392, 'noise_level': 0.7399003731294346, 'constant_value': 68336.08680108574, 'nu': 1.5}. Best is trial 750 with value: 0.13435342446039877.
[I 2024-12-04 15:17:53,956] Trial 1373 finished with value: 0.17251040236864795 and parameters: {'kernel_type': 'Matern', 'length_scale': 40.926469291112795, 'noise_level': 0.035102573686255356, 'constant_value': 60764.61409560651, 'nu': 0.5}. Best is trial 750 with value: 0.13435342446039877.
[I 2024-12-04 15:17:54,478] Trial 1372 finished with value: 0.13435439518045675 and parameters: {'kernel_type': 'Matern', 'length_scale': 12.585411070210325, 'noise_level': 0.4637494957882361, 'constant_value': 93088.99750492982, 'nu': 1.5}. Best is trial 750 with value: 0.13435342446039877.
[I 2024-12-04 15:17:55,462] Trial 1387 finished with value: 0.13435441461791284 and parameters: {'kernel_type': 'Matern', 'length_scale': 190.8426112054089, 'noise_level': 0.0074894394203705895, 'constant_value': 1426.5788314538158, 'nu': 1.5}. Best is trial 750 with value: 0.13435342446039877.
[I 2024-12-04 15:17:57,313] Trial 1379 finished with value: 0.13435374138449058 and parameters: {'kernel_type': 'Matern', 'length_scale': 432.2845588654476, 'noise_level': 0.932738762155504, 'constant_value': 1864.3832448226822, 'nu': 1.5}. Best is trial 750 with value: 0.13435342446039877.
[I 2024-12-04 15:17:58,702] Trial 1382 finished with value: 0.17251040289278374 and parameters: {'kernel_type': 'Matern', 'length_scale': 611.8663956114528, 'noise_level': 0.21678246883413865, 'constant_value': 2.569264376549605, 'nu': 0.5}. Best is trial 750 with value: 0.13435342446039877.
[I 2024-12-04 15:17:59,209] Trial 1384 finished with value: 0.134354493885554 and parameters: {'kernel_type': 'Matern', 'length_scale': 0.5164052547250504, 'noise_level': 0.02866674644106861, 'constant_value': 20.731397676592135, 'nu': 1.5}. Best is trial 750 with value: 0.13435342446039877.
[I 2024-12-04 15:17:59,678] Trial 1386 finished with value: 0.15167290789752896 and parameters: {'kernel_type': 'RBF', 'length_scale': 4.5754033373231335, 'noise_level': 9.5073059905381e-08, 'constant_value': 4.845867002937156e-07, 'nu': 2.5}. Best is trial 750 with value: 0.13435342446039877.
[I 2024-12-04 15:17:59,687] Trial 1376 finished with value: 0.13435443963841845 and parameters: {'kernel_type': 'Matern', 'length_scale': 8.192808808049605, 'noise_level': 0.9629060247946195, 'constant_value': 84498.92814830969, 'nu': 1.5}. Best is trial 750 with value: 0.13435342446039877.
[I 2024-12-04 15:18:00,145] Trial 1381 finished with value: 0.13435440005850274 and parameters: {'kernel_type': 'Matern', 'length_scale': 118.49353085825457, 'noise_level': 0.7839990435721399, 'constant_value': 219.00660154503697, 'nu': 1.5}. Best is trial 750 with value: 0.13435342446039877.
[I 2024-12-04 15:18:05,864] Trial 1383 finished with value: 0.13435437479211265 and parameters: {'kernel_type': 'Matern', 'length_scale': 13.458170339615554, 'noise_level': 0.02663806932307504, 'constant_value': 1479.0846628207519, 'nu': 1.5}. Best is trial 750 with value: 0.13435342446039877.
[I 2024-12-04 15:18:06,179] Trial 1396 finished with value: 0.13435444666237278 and parameters: {'kernel_type': 'Matern', 'length_scale': 564.8510810419309, 'noise_level': 0.029557585021982722, 'constant_value': 80590.86250200999, 'nu': 1.5}. Best is trial 750 with value: 0.13435342446039877.
[I 2024-12-04 15:18:07,669] Trial 1391 finished with value: 1.269363502851225 and parameters: {'kernel_type': 'Matern', 'length_scale': 0.002729500201724991, 'noise_level': 3.0716944826417654e-05, 'constant_value': 0.06949867088309185, 'nu': 2.5}. Best is trial 750 with value: 0.13435342446039877.
[I 2024-12-04 15:18:10,467] Trial 1397 finished with value: 1.300774182277878 and parameters: {'kernel_type': 'Matern', 'length_scale': 26844.475998044294, 'noise_level': 0.18377812921922412, 'constant_value': 10.03542321977598, 'nu': 1.5}. Best is trial 750 with value: 0.13435342446039877.
[I 2024-12-04 15:18:12,683] Trial 1393 finished with value: 0.1343542966939454 and parameters: {'kernel_type': 'Matern', 'length_scale': 1320.4569203878623, 'noise_level': 0.08430351913455329, 'constant_value': 1124.3920171324137, 'nu': 1.5}. Best is trial 750 with value: 0.13435342446039877.
[I 2024-12-04 15:18:13,062] Trial 1394 finished with value: 1.2693635028568173 and parameters: {'kernel_type': 'RBF', 'length_scale': 198.7915903239874, 'noise_level': 1.9481893564069e-09, 'constant_value': 79214.58191730315, 'nu': 2.5}. Best is trial 750 with value: 0.13435342446039877.
[I 2024-12-04 15:18:13,930] Trial 1395 finished with value: 0.13435442773127163 and parameters: {'kernel_type': 'Matern', 'length_scale': 476.5884026967127, 'noise_level': 0.9424904788633932, 'constant_value': 1108.5593835929317, 'nu': 1.5}. Best is trial 750 with value: 0.13435342446039877.
[I 2024-12-04 15:18:14,644] Trial 1401 finished with value: 0.13435441025597886 and parameters: {'kernel_type': 'Matern', 'length_scale': 1273.868204869324, 'noise_level': 0.3876173697421339, 'constant_value': 1758.6597769329535, 'nu': 1.5}. Best is trial 750 with value: 0.13435342446039877.
[I 2024-12-04 15:18:15,886] Trial 1389 finished with value: 0.13435441619128816 and parameters: {'kernel_type': 'Matern', 'length_scale': 35.48884937483708, 'noise_level': 0.033375310476841946, 'constant_value': 0.7290690510454316, 'nu': 1.5}. Best is trial 750 with value: 0.13435342446039877.
[I 2024-12-04 15:18:15,921] Trial 1405 finished with value: 1.2693635028570405 and parameters: {'kernel_type': 'RBF', 'length_scale': 44.58249966318421, 'noise_level': 0.00023820757309445543, 'constant_value': 0.7834711412240274, 'nu': 2.5}. Best is trial 750 with value: 0.13435342446039877.
[I 2024-12-04 15:18:16,105] Trial 1398 finished with value: 0.13435437601544906 and parameters: {'kernel_type': 'Matern', 'length_scale': 391.33353521723285, 'noise_level': 0.23382451953321315, 'constant_value': 619.3363290059501, 'nu': 1.5}. Best is trial 750 with value: 0.13435342446039877.
[I 2024-12-04 15:18:18,740] Trial 1399 finished with value: 0.1516729729760881 and parameters: {'kernel_type': 'RBF', 'length_scale': 3.0161531564411246, 'noise_level': 0.5355471973223832, 'constant_value': 0.0009262118552959257, 'nu': 2.5}. Best is trial 750 with value: 0.13435342446039877.
[I 2024-12-04 15:18:18,743] Trial 1392 finished with value: 1.2693635028571284 and parameters: {'kernel_type': 'Matern', 'length_scale': 1544.5638651245022, 'noise_level': 0.0036291007746987003, 'constant_value': 0.558861426603969, 'nu': 1.5}. Best is trial 750 with value: 0.13435342446039877.
[I 2024-12-04 15:18:19,863] Trial 1390 finished with value: 0.13435431927915423 and parameters: {'kernel_type': 'Matern', 'length_scale': 61.67259126459788, 'noise_level': 0.001463398334002567, 'constant_value': 1159.9149308287826, 'nu': 1.5}. Best is trial 750 with value: 0.13435342446039877.
[I 2024-12-04 15:18:22,520] Trial 1404 finished with value: 0.13435440954768946 and parameters: {'kernel_type': 'Matern', 'length_scale': 229.93802046384172, 'noise_level': 0.45411080038503765, 'constant_value': 190.25218828985524, 'nu': 1.5}. Best is trial 750 with value: 0.13435342446039877.
[I 2024-12-04 15:18:23,367] Trial 1402 finished with value: 0.15167296898773558 and parameters: {'kernel_type': 'RBF', 'length_scale': 0.8347195436122006, 'noise_level': 1.331826945945328e-10, 'constant_value': 0.0010975316905578007, 'nu': 0.5}. Best is trial 750 with value: 0.13435342446039877.
[I 2024-12-04 15:18:23,824] Trial 1410 finished with value: 0.13435405015409235 and parameters: {'kernel_type': 'Matern', 'length_scale': 209.48348552614954, 'noise_level': 0.8300682110127099, 'constant_value': 82796.6337329994, 'nu': 1.5}. Best is trial 750 with value: 0.13435342446039877.
[I 2024-12-04 15:18:24,342] Trial 1413 finished with value: 1.2693635028599062 and parameters: {'kernel_type': 'Matern', 'length_scale': 0.002982819538242862, 'noise_level': 3.6896140455854634e-07, 'constant_value': 0.05722852143037641, 'nu': 1.5}. Best is trial 750 with value: 0.13435342446039877.
[I 2024-12-04 15:18:24,481] Trial 1411 finished with value: 0.13435441044905946 and parameters: {'kernel_type': 'Matern', 'length_scale': 1.0089915439554336, 'noise_level': 2.7218456574837927e-07, 'constant_value': 0.5552830533531357, 'nu': 1.5}. Best is trial 750 with value: 0.13435342446039877.
[I 2024-12-04 15:18:25,440] Trial 1409 finished with value: 0.1343543973361881 and parameters: {'kernel_type': 'Matern', 'length_scale': 1149.2961305009012, 'noise_level': 0.9721172795175896, 'constant_value': 54.46636645851621, 'nu': 1.5}. Best is trial 750 with value: 0.13435342446039877.
[I 2024-12-04 15:18:25,835] Trial 1388 finished with value: 0.13435441348126992 and parameters: {'kernel_type': 'Matern', 'length_scale': 0.16761458741967744, 'noise_level': 0.007773995788290815, 'constant_value': 1012.2473060460985, 'nu': 1.5}. Best is trial 750 with value: 0.13435342446039877.
[I 2024-12-04 15:18:27,093] Trial 1408 finished with value: 0.13435439475932842 and parameters: {'kernel_type': 'Matern', 'length_scale': 196.058639016637, 'noise_level': 0.2395213247971304, 'constant_value': 7.686756650136219, 'nu': 1.5}. Best is trial 750 with value: 0.13435342446039877.
[I 2024-12-04 15:18:27,584] Trial 1400 finished with value: 0.13435437499981567 and parameters: {'kernel_type': 'Matern', 'length_scale': 27256.054448834977, 'noise_level': 0.7665025639889222, 'constant_value': 410.2712266580782, 'nu': 1.5}. Best is trial 750 with value: 0.13435342446039877.
[I 2024-12-04 15:18:28,127] Trial 1407 finished with value: 0.1343544388613026 and parameters: {'kernel_type': 'Matern', 'length_scale': 941.485948358381, 'noise_level': 0.16865102441471655, 'constant_value': 80788.56482775559, 'nu': 1.5}. Best is trial 750 with value: 0.13435342446039877.
