[I 2024-12-04 12:03:19,071] Trial 1772 finished with value: 0.5878770883113559 and parameters: {'max_depth': 25, 'min_samples_split': 11, 'min_samples_leaf': 1, 'max_features': 'sqrt', 'criterion': 'squared_error', 'splitter': 'best'}. Best is trial 245 with value: 0.5517975516810654.
[I 2024-12-04 12:03:19,475] Trial 1777 finished with value: 0.6118266143130937 and parameters: {'max_depth': 29, 'min_samples_split': 10, 'min_samples_leaf': 1, 'max_features': 'sqrt', 'criterion': 'squared_error', 'splitter': 'best'}. Best is trial 245 with value: 0.5517975516810654.
[I 2024-12-04 12:03:20,107] Trial 1769 finished with value: 0.5923563202035496 and parameters: {'max_depth': 24, 'min_samples_split': 11, 'min_samples_leaf': 2, 'max_features': 'sqrt', 'criterion': 'squared_error', 'splitter': 'best'}. Best is trial 245 with value: 0.5517975516810654.
[I 2024-12-04 12:03:21,323] Trial 1781 finished with value: 1.1878009715999618 and parameters: {'max_depth': 11, 'min_samples_split': 4, 'min_samples_leaf': 1, 'max_features': 'log2', 'criterion': 'friedman_mse', 'splitter': 'random'}. Best is trial 245 with value: 0.5517975516810654.
[I 2024-12-04 12:03:21,849] Trial 1768 finished with value: 1.3179355425138606 and parameters: {'max_depth': 1, 'min_samples_split': 2, 'min_samples_leaf': 2, 'max_features': 'sqrt', 'criterion': 'absolute_error', 'splitter': 'random'}. Best is trial 245 with value: 0.5517975516810654.
[I 2024-12-04 12:03:22,694] Trial 1779 finished with value: 1.261454797635251 and parameters: {'max_depth': 32, 'min_samples_split': 13, 'min_samples_leaf': 4, 'max_features': 'log2', 'criterion': 'friedman_mse', 'splitter': 'best'}. Best is trial 245 with value: 0.5517975516810654.
[I 2024-12-04 12:03:22,846] Trial 1780 finished with value: 0.7723192831148243 and parameters: {'max_depth': 15, 'min_samples_split': 4, 'min_samples_leaf': 1, 'max_features': 'sqrt', 'criterion': 'friedman_mse', 'splitter': 'best'}. Best is trial 245 with value: 0.5517975516810654.
[I 2024-12-04 12:03:23,290] Trial 1786 finished with value: 0.5878770883113559 and parameters: {'max_depth': 25, 'min_samples_split': 11, 'min_samples_leaf': 1, 'max_features': 'sqrt', 'criterion': 'friedman_mse', 'splitter': 'best'}. Best is trial 245 with value: 0.5517975516810654.
[I 2024-12-04 12:03:23,420] Trial 1776 finished with value: 0.5932995079316209 and parameters: {'max_depth': 28, 'min_samples_split': 14, 'min_samples_leaf': 2, 'max_features': 'sqrt', 'criterion': 'friedman_mse', 'splitter': 'best'}. Best is trial 245 with value: 0.5517975516810654.
[I 2024-12-04 12:03:23,694] Trial 1785 finished with value: 0.9424778759919019 and parameters: {'max_depth': 25, 'min_samples_split': 12, 'min_samples_leaf': 2, 'max_features': 'log2', 'criterion': 'squared_error', 'splitter': 'best'}. Best is trial 245 with value: 0.5517975516810654.
[I 2024-12-04 12:03:23,996] Trial 1782 finished with value: 0.5932995079316209 and parameters: {'max_depth': 29, 'min_samples_split': 14, 'min_samples_leaf': 2, 'max_features': 'sqrt', 'criterion': 'friedman_mse', 'splitter': 'best'}. Best is trial 245 with value: 0.5517975516810654.
[I 2024-12-04 12:03:24,798] Trial 1771 finished with value: 0.6366870857247696 and parameters: {'max_depth': 27, 'min_samples_split': 17, 'min_samples_leaf': 2, 'max_features': 'sqrt', 'criterion': 'friedman_mse', 'splitter': 'best'}. Best is trial 245 with value: 0.5517975516810654.
[I 2024-12-04 12:03:26,289] Trial 1791 finished with value: 0.7848347149782351 and parameters: {'max_depth': 12, 'min_samples_split': 10, 'min_samples_leaf': 2, 'max_features': 'sqrt', 'criterion': 'friedman_mse', 'splitter': 'best'}. Best is trial 245 with value: 0.5517975516810654.
[I 2024-12-04 12:03:26,436] Trial 1778 finished with value: 0.9756221805986449 and parameters: {'max_depth': 20, 'min_samples_split': 10, 'min_samples_leaf': 1, 'max_features': 'sqrt', 'criterion': 'absolute_error', 'splitter': 'best'}. Best is trial 245 with value: 0.5517975516810654.
[I 2024-12-04 12:03:26,724] Trial 1784 finished with value: 1.0746652081803512 and parameters: {'max_depth': 29, 'min_samples_split': 18, 'min_samples_leaf': 3, 'max_features': 'sqrt', 'criterion': 'friedman_mse', 'splitter': 'best'}. Best is trial 245 with value: 0.5517975516810654.
[I 2024-12-04 12:03:27,130] Trial 1788 finished with value: 0.5517975516810654 and parameters: {'max_depth': 29, 'min_samples_split': 17, 'min_samples_leaf': 1, 'max_features': 'sqrt', 'criterion': 'friedman_mse', 'splitter': 'best'}. Best is trial 245 with value: 0.5517975516810654.
[I 2024-12-04 12:03:27,295] Trial 1797 finished with value: 0.9282734991421414 and parameters: {'max_depth': 29, 'min_samples_split': 14, 'min_samples_leaf': 1, 'max_features': 'sqrt', 'criterion': 'squared_error', 'splitter': 'random'}. Best is trial 245 with value: 0.5517975516810654.
[I 2024-12-04 12:03:27,532] Trial 1760 finished with value: 1.0746652081803512 and parameters: {'max_depth': 21, 'min_samples_split': 9, 'min_samples_leaf': 3, 'max_features': 'sqrt', 'criterion': 'friedman_mse', 'splitter': 'best'}. Best is trial 245 with value: 0.5517975516810654.
[I 2024-12-04 12:03:27,863] Trial 1775 finished with value: 1.0151024087594254 and parameters: {'max_depth': 25, 'min_samples_split': 15, 'min_samples_leaf': 1, 'max_features': 'sqrt', 'criterion': 'friedman_mse', 'splitter': 'random'}. Best is trial 245 with value: 0.5517975516810654.
[I 2024-12-04 12:03:28,251] Trial 1783 finished with value: 0.5683216622867179 and parameters: {'max_depth': 30, 'min_samples_split': 19, 'min_samples_leaf': 1, 'max_features': 'sqrt', 'criterion': 'friedman_mse', 'splitter': 'best'}. Best is trial 245 with value: 0.5517975516810654.
[I 2024-12-04 12:03:28,252] Trial 1793 finished with value: 0.593204960471941 and parameters: {'max_depth': 28, 'min_samples_split': 13, 'min_samples_leaf': 1, 'max_features': 'sqrt', 'criterion': 'friedman_mse', 'splitter': 'best'}. Best is trial 245 with value: 0.5517975516810654.
[I 2024-12-04 12:03:28,450] Trial 1796 finished with value: 0.6006242848138452 and parameters: {'max_depth': 26, 'min_samples_split': 16, 'min_samples_leaf': 1, 'max_features': 'sqrt', 'criterion': 'friedman_mse', 'splitter': 'best'}. Best is trial 245 with value: 0.5517975516810654.
[I 2024-12-04 12:03:28,584] Trial 1787 finished with value: 0.5801533780931414 and parameters: {'max_depth': 24, 'min_samples_split': 13, 'min_samples_leaf': 1, 'max_features': 'sqrt', 'criterion': 'squared_error', 'splitter': 'best'}. Best is trial 245 with value: 0.5517975516810654.
[I 2024-12-04 12:03:28,913] Trial 1794 finished with value: 1.0707565500894376 and parameters: {'max_depth': 24, 'min_samples_split': 16, 'min_samples_leaf': 6, 'max_features': 'sqrt', 'criterion': 'friedman_mse', 'splitter': 'best'}. Best is trial 245 with value: 0.5517975516810654.
[I 2024-12-04 12:03:30,366] Trial 1795 finished with value: 0.5945975836542683 and parameters: {'max_depth': 31, 'min_samples_split': 20, 'min_samples_leaf': 2, 'max_features': 'sqrt', 'criterion': 'friedman_mse', 'splitter': 'best'}. Best is trial 245 with value: 0.5517975516810654.
[I 2024-12-04 12:03:30,738] Trial 1792 finished with value: 0.5843337620699963 and parameters: {'max_depth': 18, 'min_samples_split': 10, 'min_samples_leaf': 1, 'max_features': 'sqrt', 'criterion': 'friedman_mse', 'splitter': 'best'}. Best is trial 245 with value: 0.5517975516810654.
[I 2024-12-04 12:03:31,379] Trial 1800 finished with value: 0.5712745326408165 and parameters: {'max_depth': 29, 'min_samples_split': 12, 'min_samples_leaf': 1, 'max_features': 'sqrt', 'criterion': 'squared_error', 'splitter': 'best'}. Best is trial 245 with value: 0.5517975516810654.
[I 2024-12-04 12:03:31,916] Trial 1790 finished with value: 1.0746652081803512 and parameters: {'max_depth': 30, 'min_samples_split': 17, 'min_samples_leaf': 3, 'max_features': 'sqrt', 'criterion': 'friedman_mse', 'splitter': 'best'}. Best is trial 245 with value: 0.5517975516810654.
[I 2024-12-04 12:03:32,276] Trial 1801 finished with value: 0.5957889156966119 and parameters: {'max_depth': 26, 'min_samples_split': 17, 'min_samples_leaf': 1, 'max_features': 'sqrt', 'criterion': 'friedman_mse', 'splitter': 'best'}. Best is trial 245 with value: 0.5517975516810654.
[I 2024-12-04 12:03:32,537] Trial 1802 finished with value: 0.6018378780540037 and parameters: {'max_depth': 23, 'min_samples_split': 17, 'min_samples_leaf': 1, 'max_features': 'sqrt', 'criterion': 'friedman_mse', 'splitter': 'best'}. Best is trial 245 with value: 0.5517975516810654.
[I 2024-12-04 12:03:32,770] Trial 1799 finished with value: 0.6346812484158476 and parameters: {'max_depth': 25, 'min_samples_split': 16, 'min_samples_leaf': 2, 'max_features': 'sqrt', 'criterion': 'friedman_mse', 'splitter': 'best'}. Best is trial 245 with value: 0.5517975516810654.
[I 2024-12-04 12:03:32,897] Trial 1789 finished with value: 0.5801717998172633 and parameters: {'max_depth': 28, 'min_samples_split': 17, 'min_samples_leaf': 1, 'max_features': 'sqrt', 'criterion': 'friedman_mse', 'splitter': 'best'}. Best is trial 245 with value: 0.5517975516810654.
[I 2024-12-04 12:03:33,517] Trial 1798 finished with value: 0.5638995247461974 and parameters: {'max_depth': 29, 'min_samples_split': 19, 'min_samples_leaf': 1, 'max_features': 'sqrt', 'criterion': 'friedman_mse', 'splitter': 'best'}. Best is trial 245 with value: 0.5517975516810654.
[I 2024-12-04 12:03:33,630] Trial 1806 finished with value: 0.6366870857247696 and parameters: {'max_depth': 30, 'min_samples_split': 17, 'min_samples_leaf': 2, 'max_features': 'sqrt', 'criterion': 'friedman_mse', 'splitter': 'best'}. Best is trial 245 with value: 0.5517975516810654.
[I 2024-12-04 12:03:34,131] Trial 1804 finished with value: 0.5951824649333685 and parameters: {'max_depth': 30, 'min_samples_split': 17, 'min_samples_leaf': 1, 'max_features': 'sqrt', 'criterion': 'friedman_mse', 'splitter': 'best'}. Best is trial 245 with value: 0.5517975516810654.
[I 2024-12-04 12:03:34,507] Trial 1810 finished with value: 0.5708182886221415 and parameters: {'max_depth': 31, 'min_samples_split': 18, 'min_samples_leaf': 1, 'max_features': 'sqrt', 'criterion': 'friedman_mse', 'splitter': 'best'}. Best is trial 245 with value: 0.5517975516810654.
[I 2024-12-04 12:03:34,717] Trial 1803 finished with value: 0.5801717998172633 and parameters: {'max_depth': 28, 'min_samples_split': 17, 'min_samples_leaf': 1, 'max_features': 'sqrt', 'criterion': 'friedman_mse', 'splitter': 'best'}. Best is trial 245 with value: 0.5517975516810654.
[I 2024-12-04 12:03:35,383] Trial 1807 finished with value: 0.5784943231450516 and parameters: {'max_depth': 27, 'min_samples_split': 14, 'min_samples_leaf': 1, 'max_features': 'sqrt', 'criterion': 'friedman_mse', 'splitter': 'best'}. Best is trial 245 with value: 0.5517975516810654.
[I 2024-12-04 12:03:35,436] Trial 1809 finished with value: 1.259809444253076 and parameters: {'max_depth': 15, 'min_samples_split': 9, 'min_samples_leaf': 5, 'max_features': 'sqrt', 'criterion': 'squared_error', 'splitter': 'random'}. Best is trial 245 with value: 0.5517975516810654.
[I 2024-12-04 12:03:36,103] Trial 1813 finished with value: 0.5945975836542683 and parameters: {'max_depth': 35, 'min_samples_split': 19, 'min_samples_leaf': 2, 'max_features': 'sqrt', 'criterion': 'friedman_mse', 'splitter': 'best'}. Best is trial 245 with value: 0.5517975516810654.
[I 2024-12-04 12:03:36,318] Trial 1811 finished with value: 0.5801717998172633 and parameters: {'max_depth': 28, 'min_samples_split': 17, 'min_samples_leaf': 1, 'max_features': 'sqrt', 'criterion': 'friedman_mse', 'splitter': 'best'}. Best is trial 245 with value: 0.5517975516810654.
[I 2024-12-04 12:03:36,799] Trial 1805 finished with value: 1.0746652081803512 and parameters: {'max_depth': 31, 'min_samples_split': 11, 'min_samples_leaf': 3, 'max_features': 'sqrt', 'criterion': 'friedman_mse', 'splitter': 'best'}. Best is trial 245 with value: 0.5517975516810654.
[I 2024-12-04 12:03:37,845] Trial 1814 finished with value: 0.6241169559432111 and parameters: {'max_depth': 30, 'min_samples_split': 16, 'min_samples_leaf': 1, 'max_features': 'sqrt', 'criterion': 'friedman_mse', 'splitter': 'best'}. Best is trial 245 with value: 0.5517975516810654.
[I 2024-12-04 12:03:38,158] Trial 1808 finished with value: 0.5856781341418308 and parameters: {'max_depth': 23, 'min_samples_split': 20, 'min_samples_leaf': 1, 'max_features': 'sqrt', 'criterion': 'friedman_mse', 'splitter': 'best'}. Best is trial 245 with value: 0.5517975516810654.
[I 2024-12-04 12:03:38,604] Trial 1823 finished with value: 1.0746652081803512 and parameters: {'max_depth': 27, 'min_samples_split': 18, 'min_samples_leaf': 3, 'max_features': 'sqrt', 'criterion': 'friedman_mse', 'splitter': 'best'}. Best is trial 245 with value: 0.5517975516810654.
[I 2024-12-04 12:03:39,054] Trial 1815 finished with value: 0.5858076274380273 and parameters: {'max_depth': 13, 'min_samples_split': 7, 'min_samples_leaf': 1, 'max_features': 'sqrt', 'criterion': 'squared_error', 'splitter': 'best'}. Best is trial 245 with value: 0.5517975516810654.
[I 2024-12-04 12:03:39,058] Trial 1820 finished with value: 0.5810345058109859 and parameters: {'max_depth': 30, 'min_samples_split': 13, 'min_samples_leaf': 1, 'max_features': 'sqrt', 'criterion': 'friedman_mse', 'splitter': 'best'}. Best is trial 245 with value: 0.5517975516810654.
[I 2024-12-04 12:03:39,237] Trial 1821 finished with value: 1.261454797635251 and parameters: {'max_depth': 24, 'min_samples_split': 9, 'min_samples_leaf': 5, 'max_features': 'log2', 'criterion': 'squared_error', 'splitter': 'best'}. Best is trial 245 with value: 0.5517975516810654.
[I 2024-12-04 12:03:39,608] Trial 1812 finished with value: 0.6033893981188482 and parameters: {'max_depth': 27, 'min_samples_split': 16, 'min_samples_leaf': 1, 'max_features': 'sqrt', 'criterion': 'friedman_mse', 'splitter': 'best'}. Best is trial 245 with value: 0.5517975516810654.
[I 2024-12-04 12:03:40,314] Trial 1819 finished with value: 0.6366870857247696 and parameters: {'max_depth': 30, 'min_samples_split': 16, 'min_samples_leaf': 2, 'max_features': 'sqrt', 'criterion': 'friedman_mse', 'splitter': 'best'}. Best is trial 245 with value: 0.5517975516810654.
[I 2024-12-04 12:03:41,901] Trial 1816 finished with value: 0.943594069535859 and parameters: {'max_depth': 25, 'min_samples_split': 13, 'min_samples_leaf': 1, 'max_features': 'sqrt', 'criterion': 'absolute_error', 'splitter': 'best'}. Best is trial 245 with value: 0.5517975516810654.
[I 2024-12-04 12:03:41,904] Trial 1827 finished with value: 0.5727157110955119 and parameters: {'max_depth': 30, 'min_samples_split': 20, 'min_samples_leaf': 1, 'max_features': 'sqrt', 'criterion': 'friedman_mse', 'splitter': 'best'}. Best is trial 245 with value: 0.5517975516810654.
[I 2024-12-04 12:03:43,697] Trial 1824 finished with value: 0.584126237447847 and parameters: {'max_depth': 28, 'min_samples_split': 15, 'min_samples_leaf': 1, 'max_features': 'sqrt', 'criterion': 'friedman_mse', 'splitter': 'best'}. Best is trial 245 with value: 0.5517975516810654.
[I 2024-12-04 12:03:44,453] Trial 1825 finished with value: 0.7712377021886665 and parameters: {'max_depth': 26, 'min_samples_split': 20, 'min_samples_leaf': 1, 'max_features': 'log2', 'criterion': 'squared_error', 'splitter': 'best'}. Best is trial 245 with value: 0.5517975516810654.
[I 2024-12-04 12:03:45,253] Trial 1834 finished with value: 1.0746652081803512 and parameters: {'max_depth': 22, 'min_samples_split': 15, 'min_samples_leaf': 3, 'max_features': 'sqrt', 'criterion': 'friedman_mse', 'splitter': 'best'}. Best is trial 245 with value: 0.5517975516810654.
[I 2024-12-04 12:03:45,534] Trial 1829 finished with value: 1.0746652081803512 and parameters: {'max_depth': 30, 'min_samples_split': 18, 'min_samples_leaf': 3, 'max_features': 'sqrt', 'criterion': 'friedman_mse', 'splitter': 'best'}. Best is trial 245 with value: 0.5517975516810654.
[I 2024-12-04 12:03:45,878] Trial 1817 finished with value: 0.5775658601345119 and parameters: {'max_depth': 21, 'min_samples_split': 17, 'min_samples_leaf': 1, 'max_features': 'sqrt', 'criterion': 'friedman_mse', 'splitter': 'best'}. Best is trial 245 with value: 0.5517975516810654.
[I 2024-12-04 12:03:45,960] Trial 1818 finished with value: 1.0733356440450181 and parameters: {'max_depth': 29, 'min_samples_split': 8, 'min_samples_leaf': 3, 'max_features': 'sqrt', 'criterion': 'squared_error', 'splitter': 'best'}. Best is trial 245 with value: 0.5517975516810654.
[I 2024-12-04 12:03:45,993] Trial 1826 finished with value: 1.4094873558287564 and parameters: {'max_depth': 5, 'min_samples_split': 13, 'min_samples_leaf': 10, 'max_features': 'sqrt', 'criterion': 'absolute_error', 'splitter': 'best'}. Best is trial 245 with value: 0.5517975516810654.
[I 2024-12-04 12:03:46,149] Trial 1835 finished with value: 0.5823080139356801 and parameters: {'max_depth': 35, 'min_samples_split': 13, 'min_samples_leaf': 1, 'max_features': 'sqrt', 'criterion': 'friedman_mse', 'splitter': 'best'}. Best is trial 245 with value: 0.5517975516810654.
[I 2024-12-04 12:03:46,325] Trial 1822 finished with value: 1.0746652081803512 and parameters: {'max_depth': 23, 'min_samples_split': 11, 'min_samples_leaf': 3, 'max_features': 'sqrt', 'criterion': 'friedman_mse', 'splitter': 'best'}. Best is trial 245 with value: 0.5517975516810654.
[I 2024-12-04 12:03:47,042] Trial 1841 finished with value: 1.0746652081803512 and parameters: {'max_depth': 33, 'min_samples_split': 13, 'min_samples_leaf': 3, 'max_features': 'sqrt', 'criterion': 'friedman_mse', 'splitter': 'best'}. Best is trial 245 with value: 0.5517975516810654.
[I 2024-12-04 12:03:47,067] Trial 1837 finished with value: 0.887993870396294 and parameters: {'max_depth': 32, 'min_samples_split': 14, 'min_samples_leaf': 2, 'max_features': 'sqrt', 'criterion': 'absolute_error', 'splitter': 'random'}. Best is trial 245 with value: 0.5517975516810654.
[I 2024-12-04 12:03:47,591] Trial 1840 finished with value: 0.5715320714451931 and parameters: {'max_depth': 31, 'min_samples_split': 15, 'min_samples_leaf': 1, 'max_features': 'sqrt', 'criterion': 'friedman_mse', 'splitter': 'best'}. Best is trial 245 with value: 0.5517975516810654.
[I 2024-12-04 12:03:47,592] Trial 1830 finished with value: 1.0746652081803512 and parameters: {'max_depth': 31, 'min_samples_split': 19, 'min_samples_leaf': 3, 'max_features': 'sqrt', 'criterion': 'friedman_mse', 'splitter': 'best'}. Best is trial 245 with value: 0.5517975516810654.
[I 2024-12-04 12:03:47,593] Trial 1839 finished with value: 1.0824703988245958 and parameters: {'max_depth': 4, 'min_samples_split': 5, 'min_samples_leaf': 2, 'max_features': 'sqrt', 'criterion': 'friedman_mse', 'splitter': 'best'}. Best is trial 245 with value: 0.5517975516810654.
[I 2024-12-04 12:03:47,982] Trial 1838 finished with value: 0.6366870857247696 and parameters: {'max_depth': 27, 'min_samples_split': 16, 'min_samples_leaf': 2, 'max_features': 'sqrt', 'criterion': 'friedman_mse', 'splitter': 'best'}. Best is trial 245 with value: 0.5517975516810654.
[I 2024-12-04 12:03:48,251] Trial 1836 finished with value: 0.9424778759919019 and parameters: {'max_depth': 22, 'min_samples_split': 16, 'min_samples_leaf': 2, 'max_features': 'log2', 'criterion': 'friedman_mse', 'splitter': 'best'}. Best is trial 245 with value: 0.5517975516810654.
[I 2024-12-04 12:03:48,257] Trial 1843 finished with value: 0.5801533780931414 and parameters: {'max_depth': 24, 'min_samples_split': 13, 'min_samples_leaf': 1, 'max_features': 'sqrt', 'criterion': 'friedman_mse', 'splitter': 'best'}. Best is trial 245 with value: 0.5517975516810654.
[I 2024-12-04 12:03:48,493] Trial 1828 finished with value: 1.2388346947472622 and parameters: {'max_depth': 19, 'min_samples_split': 3, 'min_samples_leaf': 3, 'max_features': 'sqrt', 'criterion': 'squared_error', 'splitter': 'random'}. Best is trial 245 with value: 0.5517975516810654.
[I 2024-12-04 12:03:48,989] Trial 1831 finished with value: 0.5875137637998102 and parameters: {'max_depth': 35, 'min_samples_split': 18, 'min_samples_leaf': 1, 'max_features': 'sqrt', 'criterion': 'friedman_mse', 'splitter': 'best'}. Best is trial 245 with value: 0.5517975516810654.
[I 2024-12-04 12:03:49,115] Trial 1832 finished with value: 1.261454797635251 and parameters: {'max_depth': 35, 'min_samples_split': 13, 'min_samples_leaf': 8, 'max_features': 'log2', 'criterion': 'friedman_mse', 'splitter': 'random'}. Best is trial 245 with value: 0.5517975516810654.
[I 2024-12-04 12:03:49,342] Trial 1833 finished with value: 0.6385257346724956 and parameters: {'max_depth': 32, 'min_samples_split': 13, 'min_samples_leaf': 1, 'max_features': 'sqrt', 'criterion': 'friedman_mse', 'splitter': 'best'}. Best is trial 245 with value: 0.5517975516810654.
[I 2024-12-04 12:03:49,451] Trial 1845 finished with value: 1.3737845361400185 and parameters: {'max_depth': 7, 'min_samples_split': 15, 'min_samples_leaf': 5, 'max_features': 'log2', 'criterion': 'absolute_error', 'splitter': 'random'}. Best is trial 245 with value: 0.5517975516810654.
[I 2024-12-04 12:03:49,812] Trial 1847 finished with value: 0.619319706107842 and parameters: {'max_depth': 28, 'min_samples_split': 8, 'min_samples_leaf': 1, 'max_features': 'sqrt', 'criterion': 'friedman_mse', 'splitter': 'best'}. Best is trial 245 with value: 0.5517975516810654.
[I 2024-12-04 12:03:50,012] Trial 1849 finished with value: 0.786399658386983 and parameters: {'max_depth': 10, 'min_samples_split': 7, 'min_samples_leaf': 1, 'max_features': 'sqrt', 'criterion': 'friedman_mse', 'splitter': 'best'}. Best is trial 245 with value: 0.5517975516810654.
[I 2024-12-04 12:03:50,480] Trial 1848 finished with value: 0.5957889156966119 and parameters: {'max_depth': 26, 'min_samples_split': 17, 'min_samples_leaf': 1, 'max_features': 'sqrt', 'criterion': 'friedman_mse', 'splitter': 'best'}. Best is trial 245 with value: 0.5517975516810654.
