[I 2024-12-04 19:51:29,698] Trial 110 finished with value: 0.3554825634437033 and parameters: {'n_estimators': 288, 'max_depth': 47, 'min_samples_split': 2, 'min_samples_leaf': 1, 'max_features': 'sqrt', 'bootstrap': False, 'criterion': 'absolute_error'}. Best is trial 109 with value: 0.3417378614168333.
[I 2024-12-04 19:51:36,373] Trial 112 finished with value: 0.3556052107465954 and parameters: {'n_estimators': 265, 'max_depth': 47, 'min_samples_split': 2, 'min_samples_leaf': 1, 'max_features': 'sqrt', 'bootstrap': False, 'criterion': 'absolute_error'}. Best is trial 109 with value: 0.3417378614168333.
[I 2024-12-04 19:51:38,866] Trial 111 finished with value: 0.36985670985276337 and parameters: {'n_estimators': 404, 'max_depth': 44, 'min_samples_split': 2, 'min_samples_leaf': 1, 'max_features': 'sqrt', 'bootstrap': False, 'criterion': 'absolute_error'}. Best is trial 109 with value: 0.3417378614168333.
[I 2024-12-04 19:51:41,057] Trial 113 finished with value: 0.3483365884649564 and parameters: {'n_estimators': 165, 'max_depth': 49, 'min_samples_split': 2, 'min_samples_leaf': 1, 'max_features': 'sqrt', 'bootstrap': False, 'criterion': 'absolute_error'}. Best is trial 109 with value: 0.3417378614168333.
[I 2024-12-04 19:51:41,123] Trial 114 finished with value: 0.5213906910312931 and parameters: {'n_estimators': 111, 'max_depth': 48, 'min_samples_split': 3, 'min_samples_leaf': 1, 'max_features': 'sqrt', 'bootstrap': True, 'criterion': 'absolute_error'}. Best is trial 109 with value: 0.3417378614168333.
[I 2024-12-04 19:51:48,455] Trial 99 finished with value: 0.4197037531332466 and parameters: {'n_estimators': 658, 'max_depth': 27, 'min_samples_split': 2, 'min_samples_leaf': 1, 'max_features': None, 'bootstrap': False, 'criterion': 'absolute_error'}. Best is trial 109 with value: 0.3417378614168333.
[I 2024-12-04 19:51:48,624] Trial 116 finished with value: 0.38222708372766456 and parameters: {'n_estimators': 280, 'max_depth': 45, 'min_samples_split': 2, 'min_samples_leaf': 1, 'max_features': 'sqrt', 'bootstrap': False, 'criterion': 'absolute_error'}. Best is trial 109 with value: 0.3417378614168333.
[I 2024-12-04 19:51:51,611] Trial 115 finished with value: 0.36159943235814385 and parameters: {'n_estimators': 413, 'max_depth': 47, 'min_samples_split': 2, 'min_samples_leaf': 1, 'max_features': 'sqrt', 'bootstrap': False, 'criterion': 'absolute_error'}. Best is trial 109 with value: 0.3417378614168333.
[I 2024-12-04 19:51:53,027] Trial 117 finished with value: 0.36221356420180545 and parameters: {'n_estimators': 165, 'max_depth': 48, 'min_samples_split': 2, 'min_samples_leaf': 1, 'max_features': 'sqrt', 'bootstrap': False, 'criterion': 'absolute_error'}. Best is trial 109 with value: 0.3417378614168333.
[I 2024-12-04 19:51:53,226] Trial 118 finished with value: 0.5394526568161925 and parameters: {'n_estimators': 221, 'max_depth': 49, 'min_samples_split': 3, 'min_samples_leaf': 1, 'max_features': 'log2', 'bootstrap': False, 'criterion': 'absolute_error'}. Best is trial 109 with value: 0.3417378614168333.
[I 2024-12-04 19:51:59,003] Trial 120 finished with value: 0.34834880699111515 and parameters: {'n_estimators': 232, 'max_depth': 49, 'min_samples_split': 2, 'min_samples_leaf': 1, 'max_features': 'sqrt', 'bootstrap': False, 'criterion': 'absolute_error'}. Best is trial 109 with value: 0.3417378614168333.
[I 2024-12-04 19:52:01,277] Trial 119 finished with value: 0.343422068824852 and parameters: {'n_estimators': 386, 'max_depth': 50, 'min_samples_split': 2, 'min_samples_leaf': 1, 'max_features': 'sqrt', 'bootstrap': False, 'criterion': 'absolute_error'}. Best is trial 109 with value: 0.3417378614168333.
[I 2024-12-04 19:52:02,534] Trial 122 finished with value: 0.3908507799052999 and parameters: {'n_estimators': 126, 'max_depth': 42, 'min_samples_split': 2, 'min_samples_leaf': 1, 'max_features': 'sqrt', 'bootstrap': False, 'criterion': 'absolute_error'}. Best is trial 109 with value: 0.3417378614168333.
[I 2024-12-04 19:52:04,512] Trial 121 finished with value: 0.38111856496669494 and parameters: {'n_estimators': 454, 'max_depth': 45, 'min_samples_split': 2, 'min_samples_leaf': 1, 'max_features': 'sqrt', 'bootstrap': False, 'criterion': 'absolute_error'}. Best is trial 109 with value: 0.3417378614168333.
[I 2024-12-04 19:52:09,481] Trial 124 finished with value: 0.3499301094030418 and parameters: {'n_estimators': 272, 'max_depth': 48, 'min_samples_split': 2, 'min_samples_leaf': 1, 'max_features': 'sqrt', 'bootstrap': False, 'criterion': 'absolute_error'}. Best is trial 109 with value: 0.3417378614168333.
[I 2024-12-04 19:52:10,851] Trial 125 finished with value: 0.8774913659457937 and parameters: {'n_estimators': 386, 'max_depth': 49, 'min_samples_split': 2, 'min_samples_leaf': 2, 'max_features': 'sqrt', 'bootstrap': False, 'criterion': 'absolute_error'}. Best is trial 109 with value: 0.3417378614168333.
[I 2024-12-04 19:52:12,251] Trial 123 finished with value: 0.3548848644107445 and parameters: {'n_estimators': 411, 'max_depth': 49, 'min_samples_split': 2, 'min_samples_leaf': 1, 'max_features': 'sqrt', 'bootstrap': False, 'criterion': 'absolute_error'}. Best is trial 109 with value: 0.3417378614168333.
[I 2024-12-04 19:52:12,850] Trial 127 finished with value: 0.40774350230370854 and parameters: {'n_estimators': 276, 'max_depth': 41, 'min_samples_split': 4, 'min_samples_leaf': 1, 'max_features': 'sqrt', 'bootstrap': False, 'criterion': 'squared_error'}. Best is trial 109 with value: 0.3417378614168333.
[I 2024-12-04 19:52:15,755] Trial 128 finished with value: 0.8737987149684997 and parameters: {'n_estimators': 197, 'max_depth': 50, 'min_samples_split': 2, 'min_samples_leaf': 2, 'max_features': 'sqrt', 'bootstrap': False, 'criterion': 'absolute_error'}. Best is trial 109 with value: 0.3417378614168333.
[I 2024-12-04 19:52:18,426] Trial 126 finished with value: 0.35394637961448755 and parameters: {'n_estimators': 354, 'max_depth': 48, 'min_samples_split': 2, 'min_samples_leaf': 1, 'max_features': 'sqrt', 'bootstrap': False, 'criterion': 'absolute_error'}. Best is trial 109 with value: 0.3417378614168333.
[I 2024-12-04 19:52:20,203] Trial 129 finished with value: 0.33705260035645274 and parameters: {'n_estimators': 273, 'max_depth': 50, 'min_samples_split': 2, 'min_samples_leaf': 1, 'max_features': 'sqrt', 'bootstrap': False, 'criterion': 'absolute_error'}. Best is trial 129 with value: 0.33705260035645274.
[I 2024-12-04 19:52:26,272] Trial 132 finished with value: 0.34709247901012635 and parameters: {'n_estimators': 235, 'max_depth': 49, 'min_samples_split': 2, 'min_samples_leaf': 1, 'max_features': 'sqrt', 'bootstrap': False, 'criterion': 'absolute_error'}. Best is trial 129 with value: 0.33705260035645274.
[I 2024-12-04 19:52:32,406] Trial 131 finished with value: 0.3477457361005052 and parameters: {'n_estimators': 510, 'max_depth': 50, 'min_samples_split': 2, 'min_samples_leaf': 1, 'max_features': 'sqrt', 'bootstrap': False, 'criterion': 'absolute_error'}. Best is trial 129 with value: 0.33705260035645274.
[I 2024-12-04 19:52:33,722] Trial 130 finished with value: 0.3589501719132317 and parameters: {'n_estimators': 626, 'max_depth': 48, 'min_samples_split': 2, 'min_samples_leaf': 1, 'max_features': 'sqrt', 'bootstrap': False, 'criterion': 'absolute_error'}. Best is trial 129 with value: 0.33705260035645274.
[I 2024-12-04 19:52:35,140] Trial 135 finished with value: 0.38722963781758146 and parameters: {'n_estimators': 287, 'max_depth': 45, 'min_samples_split': 2, 'min_samples_leaf': 1, 'max_features': 'sqrt', 'bootstrap': True, 'criterion': 'squared_error'}. Best is trial 129 with value: 0.33705260035645274.
[I 2024-12-04 19:52:36,600] Trial 133 finished with value: 0.5374636243625507 and parameters: {'n_estimators': 415, 'max_depth': 50, 'min_samples_split': 2, 'min_samples_leaf': 1, 'max_features': 'log2', 'bootstrap': False, 'criterion': 'absolute_error'}. Best is trial 129 with value: 0.33705260035645274.
[I 2024-12-04 19:52:38,665] Trial 136 finished with value: 1.1655126641953937 and parameters: {'n_estimators': 740, 'max_depth': 43, 'min_samples_split': 25, 'min_samples_leaf': 4, 'max_features': 'sqrt', 'bootstrap': True, 'criterion': 'absolute_error'}. Best is trial 129 with value: 0.33705260035645274.
[I 2024-12-04 19:52:41,905] Trial 134 finished with value: 0.4013499577598966 and parameters: {'n_estimators': 393, 'max_depth': 50, 'min_samples_split': 4, 'min_samples_leaf': 1, 'max_features': 'sqrt', 'bootstrap': False, 'criterion': 'absolute_error'}. Best is trial 129 with value: 0.33705260035645274.
[I 2024-12-04 19:52:43,601] Trial 137 finished with value: 0.33705380692145503 and parameters: {'n_estimators': 247, 'max_depth': 50, 'min_samples_split': 2, 'min_samples_leaf': 1, 'max_features': 'sqrt', 'bootstrap': False, 'criterion': 'absolute_error'}. Best is trial 129 with value: 0.33705260035645274.
[I 2024-12-04 19:52:49,700] Trial 140 finished with value: 0.3474384932901436 and parameters: {'n_estimators': 238, 'max_depth': 49, 'min_samples_split': 2, 'min_samples_leaf': 1, 'max_features': 'sqrt', 'bootstrap': False, 'criterion': 'absolute_error'}. Best is trial 129 with value: 0.33705260035645274.
[I 2024-12-04 19:52:51,378] Trial 138 finished with value: 0.34356480719731736 and parameters: {'n_estimators': 443, 'max_depth': 50, 'min_samples_split': 2, 'min_samples_leaf': 1, 'max_features': 'sqrt', 'bootstrap': False, 'criterion': 'absolute_error'}. Best is trial 129 with value: 0.33705260035645274.
[I 2024-12-04 19:52:55,946] Trial 141 finished with value: 0.3480663126083813 and parameters: {'n_estimators': 244, 'max_depth': 48, 'min_samples_split': 2, 'min_samples_leaf': 1, 'max_features': 'sqrt', 'bootstrap': False, 'criterion': 'absolute_error'}. Best is trial 129 with value: 0.33705260035645274.
[I 2024-12-04 19:52:57,603] Trial 139 finished with value: 0.37034931054243425 and parameters: {'n_estimators': 574, 'max_depth': 50, 'min_samples_split': 3, 'min_samples_leaf': 1, 'max_features': 'sqrt', 'bootstrap': False, 'criterion': 'absolute_error'}. Best is trial 129 with value: 0.33705260035645274.
[I 2024-12-04 19:52:57,864] Trial 143 finished with value: 0.32310115881146656 and parameters: {'n_estimators': 367, 'max_depth': 49, 'min_samples_split': 2, 'min_samples_leaf': 1, 'max_features': 'sqrt', 'bootstrap': False, 'criterion': 'squared_error'}. Best is trial 143 with value: 0.32310115881146656.
[I 2024-12-04 19:52:59,104] Trial 142 finished with value: 0.347246003068688 and parameters: {'n_estimators': 294, 'max_depth': 49, 'min_samples_split': 2, 'min_samples_leaf': 1, 'max_features': 'sqrt', 'bootstrap': False, 'criterion': 'absolute_error'}. Best is trial 143 with value: 0.32310115881146656.
[I 2024-12-04 19:52:59,581] Trial 144 finished with value: 0.3735082399647559 and parameters: {'n_estimators': 452, 'max_depth': 49, 'min_samples_split': 3, 'min_samples_leaf': 1, 'max_features': 'sqrt', 'bootstrap': False, 'criterion': 'squared_error'}. Best is trial 143 with value: 0.32310115881146656.
[I 2024-12-04 19:53:00,331] Trial 146 finished with value: 0.3446014853161855 and parameters: {'n_estimators': 153, 'max_depth': 48, 'min_samples_split': 2, 'min_samples_leaf': 1, 'max_features': 'sqrt', 'bootstrap': False, 'criterion': 'squared_error'}. Best is trial 143 with value: 0.32310115881146656.
[I 2024-12-04 19:53:01,550] Trial 148 finished with value: 0.37609761820465515 and parameters: {'n_estimators': 228, 'max_depth': 47, 'min_samples_split': 3, 'min_samples_leaf': 1, 'max_features': 'sqrt', 'bootstrap': False, 'criterion': 'squared_error'}. Best is trial 143 with value: 0.32310115881146656.
[I 2024-12-04 19:53:03,076] Trial 149 finished with value: 0.3251924253615176 and parameters: {'n_estimators': 265, 'max_depth': 50, 'min_samples_split': 2, 'min_samples_leaf': 1, 'max_features': 'sqrt', 'bootstrap': False, 'criterion': 'squared_error'}. Best is trial 143 with value: 0.32310115881146656.
[I 2024-12-04 19:53:03,616] Trial 147 finished with value: 0.354093757477672 and parameters: {'n_estimators': 141, 'max_depth': 46, 'min_samples_split': 2, 'min_samples_leaf': 1, 'max_features': 'sqrt', 'bootstrap': False, 'criterion': 'absolute_error'}. Best is trial 143 with value: 0.32310115881146656.
[I 2024-12-04 19:53:04,070] Trial 150 finished with value: 0.4508909190849822 and parameters: {'n_estimators': 105, 'max_depth': 32, 'min_samples_split': 2, 'min_samples_leaf': 1, 'max_features': 'sqrt', 'bootstrap': False, 'criterion': 'squared_error'}. Best is trial 143 with value: 0.32310115881146656.
[I 2024-12-04 19:53:05,270] Trial 152 finished with value: 0.8738847773208429 and parameters: {'n_estimators': 425, 'max_depth': 19, 'min_samples_split': 48, 'min_samples_leaf': 2, 'max_features': 'sqrt', 'bootstrap': False, 'criterion': 'squared_error'}. Best is trial 143 with value: 0.32310115881146656.
[I 2024-12-04 19:53:05,533] Trial 151 finished with value: 0.32370481251745215 and parameters: {'n_estimators': 318, 'max_depth': 50, 'min_samples_split': 2, 'min_samples_leaf': 1, 'max_features': 'sqrt', 'bootstrap': False, 'criterion': 'squared_error'}. Best is trial 143 with value: 0.32310115881146656.
[I 2024-12-04 19:53:07,060] Trial 145 finished with value: 0.3552665435828083 and parameters: {'n_estimators': 356, 'max_depth': 48, 'min_samples_split': 2, 'min_samples_leaf': 1, 'max_features': 'sqrt', 'bootstrap': False, 'criterion': 'absolute_error'}. Best is trial 143 with value: 0.32310115881146656.
[I 2024-12-04 19:53:07,656] Trial 153 finished with value: 0.9891973353526384 and parameters: {'n_estimators': 222, 'max_depth': 47, 'min_samples_split': 2, 'min_samples_leaf': 2, 'max_features': 'sqrt', 'bootstrap': True, 'criterion': 'absolute_error'}. Best is trial 143 with value: 0.32310115881146656.
[I 2024-12-04 19:53:07,694] Trial 154 finished with value: 0.3487284659627865 and parameters: {'n_estimators': 401, 'max_depth': 43, 'min_samples_split': 2, 'min_samples_leaf': 1, 'max_features': 'sqrt', 'bootstrap': False, 'criterion': 'squared_error'}. Best is trial 143 with value: 0.32310115881146656.
[I 2024-12-04 19:53:08,442] Trial 155 finished with value: 1.2805129841182163 and parameters: {'n_estimators': 269, 'max_depth': 31, 'min_samples_split': 22, 'min_samples_leaf': 11, 'max_features': 'sqrt', 'bootstrap': False, 'criterion': 'absolute_error'}. Best is trial 143 with value: 0.32310115881146656.
[I 2024-12-04 19:53:09,471] Trial 157 finished with value: 0.3269222257193432 and parameters: {'n_estimators': 178, 'max_depth': 50, 'min_samples_split': 2, 'min_samples_leaf': 1, 'max_features': 'sqrt', 'bootstrap': False, 'criterion': 'squared_error'}. Best is trial 143 with value: 0.32310115881146656.
[I 2024-12-04 19:53:09,589] Trial 156 finished with value: 0.5222063024165743 and parameters: {'n_estimators': 233, 'max_depth': 50, 'min_samples_split': 2, 'min_samples_leaf': 1, 'max_features': 'log2', 'bootstrap': False, 'criterion': 'squared_error'}. Best is trial 143 with value: 0.32310115881146656.
[I 2024-12-04 19:53:10,598] Trial 158 finished with value: 0.9410466856274708 and parameters: {'n_estimators': 797, 'max_depth': 50, 'min_samples_split': 7, 'min_samples_leaf': 3, 'max_features': 'sqrt', 'bootstrap': True, 'criterion': 'squared_error'}. Best is trial 143 with value: 0.32310115881146656.
[I 2024-12-04 19:53:11,372] Trial 160 finished with value: 0.33399915082268417 and parameters: {'n_estimators': 239, 'max_depth': 48, 'min_samples_split': 2, 'min_samples_leaf': 1, 'max_features': 'sqrt', 'bootstrap': False, 'criterion': 'squared_error'}. Best is trial 143 with value: 0.32310115881146656.
[I 2024-12-04 19:53:11,730] Trial 159 finished with value: 0.4330074644994048 and parameters: {'n_estimators': 166, 'max_depth': 46, 'min_samples_split': 2, 'min_samples_leaf': 1, 'max_features': None, 'bootstrap': False, 'criterion': 'squared_error'}. Best is trial 143 with value: 0.32310115881146656.
[I 2024-12-04 19:53:12,553] Trial 162 finished with value: 0.38247207530258376 and parameters: {'n_estimators': 188, 'max_depth': 47, 'min_samples_split': 3, 'min_samples_leaf': 1, 'max_features': 'sqrt', 'bootstrap': False, 'criterion': 'squared_error'}. Best is trial 143 with value: 0.32310115881146656.
[I 2024-12-04 19:53:12,588] Trial 161 finished with value: 0.3235015797135766 and parameters: {'n_estimators': 360, 'max_depth': 50, 'min_samples_split': 2, 'min_samples_leaf': 1, 'max_features': 'sqrt', 'bootstrap': False, 'criterion': 'squared_error'}. Best is trial 143 with value: 0.32310115881146656.
[I 2024-12-04 19:53:13,257] Trial 163 finished with value: 0.37084730095326146 and parameters: {'n_estimators': 113, 'max_depth': 44, 'min_samples_split': 2, 'min_samples_leaf': 1, 'max_features': 'sqrt', 'bootstrap': False, 'criterion': 'squared_error'}. Best is trial 143 with value: 0.32310115881146656.
[I 2024-12-04 19:53:14,181] Trial 165 finished with value: 0.33816766276958754 and parameters: {'n_estimators': 176, 'max_depth': 48, 'min_samples_split': 2, 'min_samples_leaf': 1, 'max_features': 'sqrt', 'bootstrap': False, 'criterion': 'squared_error'}. Best is trial 143 with value: 0.32310115881146656.
[I 2024-12-04 19:53:14,831] Trial 166 finished with value: 0.6933935024194006 and parameters: {'n_estimators': 460, 'max_depth': 49, 'min_samples_split': 2, 'min_samples_leaf': 2, 'max_features': 'sqrt', 'bootstrap': False, 'criterion': 'squared_error'}. Best is trial 143 with value: 0.32310115881146656.
[I 2024-12-04 19:53:14,845] Trial 164 finished with value: 0.3315461850166213 and parameters: {'n_estimators': 299, 'max_depth': 45, 'min_samples_split': 2, 'min_samples_leaf': 1, 'max_features': 'sqrt', 'bootstrap': False, 'criterion': 'squared_error'}. Best is trial 143 with value: 0.32310115881146656.
[I 2024-12-04 19:53:16,010] Trial 167 finished with value: 0.330164840445605 and parameters: {'n_estimators': 293, 'max_depth': 48, 'min_samples_split': 2, 'min_samples_leaf': 1, 'max_features': 'sqrt', 'bootstrap': False, 'criterion': 'squared_error'}. Best is trial 143 with value: 0.32310115881146656.
[I 2024-12-04 19:53:16,511] Trial 168 finished with value: 0.3264287616748619 and parameters: {'n_estimators': 248, 'max_depth': 49, 'min_samples_split': 2, 'min_samples_leaf': 1, 'max_features': 'sqrt', 'bootstrap': False, 'criterion': 'squared_error'}. Best is trial 143 with value: 0.32310115881146656.
[I 2024-12-04 19:53:16,576] Trial 169 finished with value: 0.33597210847497455 and parameters: {'n_estimators': 207, 'max_depth': 48, 'min_samples_split': 2, 'min_samples_leaf': 1, 'max_features': 'sqrt', 'bootstrap': False, 'criterion': 'squared_error'}. Best is trial 143 with value: 0.32310115881146656.
[I 2024-12-04 19:53:17,953] Trial 170 finished with value: 0.5370751371800965 and parameters: {'n_estimators': 482, 'max_depth': 48, 'min_samples_split': 7, 'min_samples_leaf': 1, 'max_features': 'sqrt', 'bootstrap': True, 'criterion': 'squared_error'}. Best is trial 143 with value: 0.32310115881146656.
[I 2024-12-04 19:53:18,852] Trial 172 finished with value: 0.33317033677861924 and parameters: {'n_estimators': 332, 'max_depth': 47, 'min_samples_split': 2, 'min_samples_leaf': 1, 'max_features': 'sqrt', 'bootstrap': False, 'criterion': 'squared_error'}. Best is trial 143 with value: 0.32310115881146656.
[I 2024-12-04 19:53:19,076] Trial 171 finished with value: 0.33401992427930394 and parameters: {'n_estimators': 390, 'max_depth': 48, 'min_samples_split': 2, 'min_samples_leaf': 1, 'max_features': 'sqrt', 'bootstrap': False, 'criterion': 'squared_error'}. Best is trial 143 with value: 0.32310115881146656.
[I 2024-12-04 19:53:19,077] Trial 173 finished with value: 0.3354499901412706 and parameters: {'n_estimators': 138, 'max_depth': 50, 'min_samples_split': 2, 'min_samples_leaf': 1, 'max_features': 'sqrt', 'bootstrap': False, 'criterion': 'squared_error'}. Best is trial 143 with value: 0.32310115881146656.
[I 2024-12-04 19:53:20,683] Trial 174 finished with value: 0.3313420395046572 and parameters: {'n_estimators': 276, 'max_depth': 48, 'min_samples_split': 2, 'min_samples_leaf': 1, 'max_features': 'sqrt', 'bootstrap': False, 'criterion': 'squared_error'}. Best is trial 143 with value: 0.32310115881146656.
[I 2024-12-04 19:53:21,318] Trial 175 finished with value: 0.32447397201574063 and parameters: {'n_estimators': 290, 'max_depth': 50, 'min_samples_split': 2, 'min_samples_leaf': 1, 'max_features': 'sqrt', 'bootstrap': False, 'criterion': 'squared_error'}. Best is trial 143 with value: 0.32310115881146656.
[I 2024-12-04 19:53:22,297] Trial 176 finished with value: 0.32780655304316225 and parameters: {'n_estimators': 570, 'max_depth': 50, 'min_samples_split': 2, 'min_samples_leaf': 1, 'max_features': 'sqrt', 'bootstrap': False, 'criterion': 'squared_error'}. Best is trial 143 with value: 0.32310115881146656.
[I 2024-12-04 19:53:22,298] Trial 177 finished with value: 0.3684221258894739 and parameters: {'n_estimators': 325, 'max_depth': 48, 'min_samples_split': 3, 'min_samples_leaf': 1, 'max_features': 'sqrt', 'bootstrap': False, 'criterion': 'squared_error'}. Best is trial 143 with value: 0.32310115881146656.
[I 2024-12-04 19:53:23,167] Trial 178 finished with value: 0.3313420395046572 and parameters: {'n_estimators': 276, 'max_depth': 48, 'min_samples_split': 2, 'min_samples_leaf': 1, 'max_features': 'sqrt', 'bootstrap': False, 'criterion': 'squared_error'}. Best is trial 143 with value: 0.32310115881146656.
[I 2024-12-04 19:53:24,764] Trial 181 finished with value: 0.32336654210411875 and parameters: {'n_estimators': 255, 'max_depth': 50, 'min_samples_split': 2, 'min_samples_leaf': 1, 'max_features': 'sqrt', 'bootstrap': False, 'criterion': 'squared_error'}. Best is trial 143 with value: 0.32310115881146656.
