[I 2024-12-04 15:23:45,645] Trial 1714 finished with value: 0.13435440867863763 and parameters: {'kernel_type': 'Matern', 'length_scale': 65.48108188130412, 'noise_level': 0.0009636130784082635, 'constant_value': 31.426228698611386, 'nu': 1.5}. Best is trial 1456 with value: 0.13435337537029549.
[I 2024-12-04 15:23:47,756] Trial 1708 finished with value: 0.1343549686714594 and parameters: {'kernel_type': 'Matern', 'length_scale': 50.02974861030762, 'noise_level': 0.1210128266854189, 'constant_value': 2081.5277275379804, 'nu': 1.5}. Best is trial 1456 with value: 0.13435337537029549.
[I 2024-12-04 15:23:48,025] Trial 1707 finished with value: 0.13435464008587517 and parameters: {'kernel_type': 'Matern', 'length_scale': 1.4132115914926284, 'noise_level': 0.4494976328178806, 'constant_value': 1175.5159892430393, 'nu': 1.5}. Best is trial 1456 with value: 0.13435337537029549.
[I 2024-12-04 15:23:48,025] Trial 1715 finished with value: 0.1343542752358594 and parameters: {'kernel_type': 'Matern', 'length_scale': 54.972489011674114, 'noise_level': 0.8847252124494739, 'constant_value': 6873.980743989348, 'nu': 1.5}. Best is trial 1456 with value: 0.13435337537029549.
[I 2024-12-04 15:23:48,026] Trial 1703 finished with value: 0.13435424489161207 and parameters: {'kernel_type': 'Matern', 'length_scale': 3.808400362743576, 'noise_level': 0.5402990264153024, 'constant_value': 77927.4272644565, 'nu': 1.5}. Best is trial 1456 with value: 0.13435337537029549.
[I 2024-12-04 15:23:50,865] Trial 1709 finished with value: 1.2693635028568848 and parameters: {'kernel_type': 'Matern', 'length_scale': 35.54787512465446, 'noise_level': 0.0035790253682341363, 'constant_value': 0.044290682197055106, 'nu': 1.5}. Best is trial 1456 with value: 0.13435337537029549.
[I 2024-12-04 15:23:51,362] Trial 1716 finished with value: 1.2693634929187771 and parameters: {'kernel_type': 'Matern', 'length_scale': 0.05513095673613697, 'noise_level': 0.8499748777377143, 'constant_value': 29.301492751936614, 'nu': 0.5}. Best is trial 1456 with value: 0.13435337537029549.
[I 2024-12-04 15:23:51,695] Trial 1719 finished with value: 1.2693635028571342 and parameters: {'kernel_type': 'RBF', 'length_scale': 0.00038871536614861244, 'noise_level': 2.5323863206507693e-07, 'constant_value': 0.00034222508819136544, 'nu': 2.5}. Best is trial 1456 with value: 0.13435337537029549.
[I 2024-12-04 15:23:52,141] Trial 1717 finished with value: 1.2693635028571402 and parameters: {'kernel_type': 'RBF', 'length_scale': 0.0011434255120328783, 'noise_level': 1.653021111546017e-10, 'constant_value': 14.572879331744758, 'nu': 0.5}. Best is trial 1456 with value: 0.13435337537029549.
[I 2024-12-04 15:23:52,678] Trial 1713 finished with value: 0.13435409723011144 and parameters: {'kernel_type': 'Matern', 'length_scale': 121.30140494343942, 'noise_level': 0.7671419618678438, 'constant_value': 64544.245636652246, 'nu': 1.5}. Best is trial 1456 with value: 0.13435337537029549.
[I 2024-12-04 15:23:52,695] Trial 1712 finished with value: 0.1343543298687363 and parameters: {'kernel_type': 'Matern', 'length_scale': 145.91963337210674, 'noise_level': 0.7086864605351071, 'constant_value': 43843.77364789547, 'nu': 1.5}. Best is trial 1456 with value: 0.13435337537029549.
[I 2024-12-04 15:23:53,873] Trial 1724 finished with value: 0.1343544636191739 and parameters: {'kernel_type': 'Matern', 'length_scale': 134.95362543699747, 'noise_level': 0.02722538102292806, 'constant_value': 46.73355774976297, 'nu': 1.5}. Best is trial 1456 with value: 0.13435337537029549.
[I 2024-12-04 15:24:01,364] Trial 1722 finished with value: 0.13435440811375332 and parameters: {'kernel_type': 'Matern', 'length_scale': 6.222319408535775, 'noise_level': 0.012753840228019842, 'constant_value': 3.410363357849318, 'nu': 1.5}. Best is trial 1456 with value: 0.13435337537029549.
[I 2024-12-04 15:24:01,691] Trial 1718 finished with value: 0.13435443979765194 and parameters: {'kernel_type': 'Matern', 'length_scale': 103.15732101617812, 'noise_level': 0.0014389381682565908, 'constant_value': 511.4349753448066, 'nu': 1.5}. Best is trial 1456 with value: 0.13435337537029549.
[I 2024-12-04 15:24:02,178] Trial 1721 finished with value: 0.1343544185872049 and parameters: {'kernel_type': 'Matern', 'length_scale': 3058.4713275436116, 'noise_level': 0.011427133104652034, 'constant_value': 1269.0494017434344, 'nu': 1.5}. Best is trial 1456 with value: 0.13435337537029549.
[I 2024-12-04 15:24:02,665] Trial 1725 finished with value: 0.13435439973935606 and parameters: {'kernel_type': 'Matern', 'length_scale': 10.090884358318988, 'noise_level': 0.08266660705489355, 'constant_value': 7766.840864931686, 'nu': 1.5}. Best is trial 1456 with value: 0.13435337537029549.
[I 2024-12-04 15:24:03,085] Trial 1720 finished with value: 0.1343543987935736 and parameters: {'kernel_type': 'Matern', 'length_scale': 0.15127123200987552, 'noise_level': 0.9309426750184876, 'constant_value': 12471.0750414393, 'nu': 1.5}. Best is trial 1456 with value: 0.13435337537029549.
[I 2024-12-04 15:24:04,130] Trial 1729 finished with value: 0.134354382437577 and parameters: {'kernel_type': 'Matern', 'length_scale': 33.49514297882932, 'noise_level': 0.032558478503099404, 'constant_value': 1075.8732109414984, 'nu': 1.5}. Best is trial 1456 with value: 0.13435337537029549.
[I 2024-12-04 15:24:04,131] Trial 1731 finished with value: 0.13435434245037478 and parameters: {'kernel_type': 'Matern', 'length_scale': 156.1828002200328, 'noise_level': 0.006028074368399467, 'constant_value': 1992.5521706273205, 'nu': 1.5}. Best is trial 1456 with value: 0.13435337537029549.
[I 2024-12-04 15:24:04,690] Trial 1726 finished with value: 0.1343543799173011 and parameters: {'kernel_type': 'Matern', 'length_scale': 8266.952285564274, 'noise_level': 0.03336005706342027, 'constant_value': 98286.43058179697, 'nu': 1.5}. Best is trial 1456 with value: 0.13435337537029549.
[I 2024-12-04 15:24:04,976] Trial 1710 finished with value: 0.13435449287151083 and parameters: {'kernel_type': 'Matern', 'length_scale': 13.170389188185196, 'noise_level': 0.00019925456162804894, 'constant_value': 0.3343759789856824, 'nu': 1.5}. Best is trial 1456 with value: 0.13435337537029549.
[I 2024-12-04 15:24:05,297] Trial 1723 finished with value: 1.2693635028569923 and parameters: {'kernel_type': 'RBF', 'length_scale': 2181.600062432111, 'noise_level': 0.03169483035068482, 'constant_value': 21.769052219045914, 'nu': 1.5}. Best is trial 1456 with value: 0.13435337537029549.
[I 2024-12-04 15:24:07,588] Trial 1727 finished with value: 0.1343547588729582 and parameters: {'kernel_type': 'Matern', 'length_scale': 4.99493205785986, 'noise_level': 0.02061111346770462, 'constant_value': 1455.5536104788187, 'nu': 1.5}. Best is trial 1456 with value: 0.13435337537029549.
[I 2024-12-04 15:24:07,649] Trial 1728 finished with value: 0.1343546721223785 and parameters: {'kernel_type': 'Matern', 'length_scale': 1165.0935044001799, 'noise_level': 0.04356228119760157, 'constant_value': 1725.7603998372958, 'nu': 1.5}. Best is trial 1456 with value: 0.13435337537029549.
[I 2024-12-04 15:24:09,992] Trial 1736 finished with value: 0.1343543768759445 and parameters: {'kernel_type': 'Matern', 'length_scale': 8.978765660167031, 'noise_level': 0.0307141776387741, 'constant_value': 16.90670621666461, 'nu': 1.5}. Best is trial 1456 with value: 0.13435337537029549.
[I 2024-12-04 15:24:11,285] Trial 1737 finished with value: 0.13435433030490568 and parameters: {'kernel_type': 'Matern', 'length_scale': 0.48459169538222246, 'noise_level': 0.055486648901979886, 'constant_value': 1083.3598231813403, 'nu': 1.5}. Best is trial 1456 with value: 0.13435337537029549.
[I 2024-12-04 15:24:11,464] Trial 1743 finished with value: 1.3007739191849652 and parameters: {'kernel_type': 'RBF', 'length_scale': 0.0012210006237086595, 'noise_level': 0.22274582425370523, 'constant_value': 1.336867545700491e-06, 'nu': 1.5}. Best is trial 1456 with value: 0.13435337537029549.
[I 2024-12-04 15:24:11,728] Trial 1739 finished with value: 0.1343544005628408 and parameters: {'kernel_type': 'Matern', 'length_scale': 0.6707798952593205, 'noise_level': 0.8315769848672673, 'constant_value': 146.1408305736485, 'nu': 1.5}. Best is trial 1456 with value: 0.13435337537029549.
[I 2024-12-04 15:24:11,957] Trial 1738 finished with value: 0.17251040248192076 and parameters: {'kernel_type': 'Matern', 'length_scale': 99.68225155589604, 'noise_level': 0.8450501626246643, 'constant_value': 954.547262970463, 'nu': 0.5}. Best is trial 1456 with value: 0.13435337537029549.
[I 2024-12-04 15:24:12,020] Trial 1734 finished with value: 0.1343538332596465 and parameters: {'kernel_type': 'Matern', 'length_scale': 15.586394300606447, 'noise_level': 0.018205290545751433, 'constant_value': 69917.54936665503, 'nu': 1.5}. Best is trial 1456 with value: 0.13435337537029549.
[I 2024-12-04 15:24:12,036] Trial 1732 finished with value: 0.13435419826766173 and parameters: {'kernel_type': 'Matern', 'length_scale': 12.188729555334742, 'noise_level': 0.16035967221205766, 'constant_value': 2281.2086479894124, 'nu': 1.5}. Best is trial 1456 with value: 0.13435337537029549.
[I 2024-12-04 15:24:13,030] Trial 1735 finished with value: 0.13435438890018203 and parameters: {'kernel_type': 'Matern', 'length_scale': 1.6538210951950119, 'noise_level': 0.20259254819067557, 'constant_value': 86405.84994978378, 'nu': 1.5}. Best is trial 1456 with value: 0.13435337537029549.
[I 2024-12-04 15:24:15,475] Trial 1740 finished with value: 0.13435437743960793 and parameters: {'kernel_type': 'Matern', 'length_scale': 77.21347763144391, 'noise_level': 0.00023478253056207583, 'constant_value': 1479.6399535020357, 'nu': 1.5}. Best is trial 1456 with value: 0.13435337537029549.
[I 2024-12-04 15:24:17,470] Trial 1741 finished with value: 0.13435439958551165 and parameters: {'kernel_type': 'Matern', 'length_scale': 59.183268564950666, 'noise_level': 0.05540616045236451, 'constant_value': 2188.387989491821, 'nu': 1.5}. Best is trial 1456 with value: 0.13435337537029549.
[I 2024-12-04 15:24:18,853] Trial 1733 finished with value: 0.14859842805630677 and parameters: {'kernel_type': 'Matern', 'length_scale': 12.845291355623726, 'noise_level': 0.6914538998063429, 'constant_value': 70365.33859961184, 'nu': 2.5}. Best is trial 1456 with value: 0.13435337537029549.
[I 2024-12-04 15:24:19,530] Trial 1746 finished with value: 0.1343543987322849 and parameters: {'kernel_type': 'Matern', 'length_scale': 7.865682997877473, 'noise_level': 0.0007278647321368075, 'constant_value': 125.89920577477643, 'nu': 1.5}. Best is trial 1456 with value: 0.13435337537029549.
[I 2024-12-04 15:24:19,828] Trial 1730 finished with value: 1.269363502857022 and parameters: {'kernel_type': 'Matern', 'length_scale': 1440.292563114086, 'noise_level': 0.0005483671678099841, 'constant_value': 26.50263092563724, 'nu': 1.5}. Best is trial 1456 with value: 0.13435337537029549.
[I 2024-12-04 15:24:20,069] Trial 1742 finished with value: 0.1343544575059411 and parameters: {'kernel_type': 'Matern', 'length_scale': 126.55896693437741, 'noise_level': 0.07618231163150024, 'constant_value': 97691.77071551055, 'nu': 1.5}. Best is trial 1456 with value: 0.13435337537029549.
[I 2024-12-04 15:24:20,126] Trial 1745 finished with value: 1.2693635028569623 and parameters: {'kernel_type': 'RBF', 'length_scale': 7.101196117625712e-05, 'noise_level': 9.538338101290315e-09, 'constant_value': 2.452216863670447, 'nu': 2.5}. Best is trial 1456 with value: 0.13435337537029549.
[I 2024-12-04 15:24:20,127] Trial 1744 finished with value: 0.17251023633344792 and parameters: {'kernel_type': 'Matern', 'length_scale': 15.93363145121251, 'noise_level': 0.09596620959472738, 'constant_value': 85585.56502559719, 'nu': 0.5}. Best is trial 1456 with value: 0.13435337537029549.
[I 2024-12-04 15:24:21,024] Trial 1747 finished with value: 0.13435446156123035 and parameters: {'kernel_type': 'Matern', 'length_scale': 66.80365012294669, 'noise_level': 0.030221374017909704, 'constant_value': 1741.810421568148, 'nu': 1.5}. Best is trial 1456 with value: 0.13435337537029549.
[I 2024-12-04 15:24:21,305] Trial 1748 finished with value: 0.13435439257854498 and parameters: {'kernel_type': 'Matern', 'length_scale': 16.14050480436255, 'noise_level': 0.9112969661825805, 'constant_value': 73321.95472979102, 'nu': 1.5}. Best is trial 1456 with value: 0.13435337537029549.
[I 2024-12-04 15:24:23,575] Trial 1753 finished with value: 0.13435442787523103 and parameters: {'kernel_type': 'Matern', 'length_scale': 57.8404532520447, 'noise_level': 0.017489201540557265, 'constant_value': 77652.70379758539, 'nu': 1.5}. Best is trial 1456 with value: 0.13435337537029549.
[I 2024-12-04 15:24:24,652] Trial 1754 finished with value: 0.13435439964967696 and parameters: {'kernel_type': 'Matern', 'length_scale': 2.5715126733670317, 'noise_level': 0.042833608782643445, 'constant_value': 5479.341343331125, 'nu': 1.5}. Best is trial 1456 with value: 0.13435337537029549.
[I 2024-12-04 15:24:25,725] Trial 1757 finished with value: 0.15167299064759568 and parameters: {'kernel_type': 'RBF', 'length_scale': 61.4170230857063, 'noise_level': 0.017755761098902853, 'constant_value': 4499.032714022031, 'nu': 1.5}. Best is trial 1456 with value: 0.13435337537029549.
[I 2024-12-04 15:24:27,563] Trial 1752 finished with value: 0.13435439078993963 and parameters: {'kernel_type': 'Matern', 'length_scale': 16.517408971316428, 'noise_level': 0.0035870677422724572, 'constant_value': 3457.034681088629, 'nu': 1.5}. Best is trial 1456 with value: 0.13435337537029549.
[I 2024-12-04 15:24:28,378] Trial 1749 finished with value: 0.1343544098652687 and parameters: {'kernel_type': 'Matern', 'length_scale': 80.44994568227366, 'noise_level': 0.014127450607858406, 'constant_value': 4415.219367031469, 'nu': 1.5}. Best is trial 1456 with value: 0.13435337537029549.
[I 2024-12-04 15:24:29,741] Trial 1759 finished with value: 0.13435441265605008 and parameters: {'kernel_type': 'Matern', 'length_scale': 0.44662121053944287, 'noise_level': 0.01582228253863832, 'constant_value': 58979.23288155418, 'nu': 1.5}. Best is trial 1456 with value: 0.13435337537029549.
[I 2024-12-04 15:24:30,921] Trial 1758 finished with value: 0.13435439749366238 and parameters: {'kernel_type': 'Matern', 'length_scale': 12.592036993927032, 'noise_level': 0.012331057276106675, 'constant_value': 91864.79489684387, 'nu': 1.5}. Best is trial 1456 with value: 0.13435337537029549.
[I 2024-12-04 15:24:32,255] Trial 1756 finished with value: 0.13435435110884478 and parameters: {'kernel_type': 'Matern', 'length_scale': 72.30816357654292, 'noise_level': 0.0006820668402155583, 'constant_value': 2914.1304214208244, 'nu': 1.5}. Best is trial 1456 with value: 0.13435337537029549.
[I 2024-12-04 15:24:34,200] Trial 1760 finished with value: 0.13435441893987413 and parameters: {'kernel_type': 'Matern', 'length_scale': 122.25198323184667, 'noise_level': 0.015110192704953854, 'constant_value': 14831.282006346873, 'nu': 1.5}. Best is trial 1456 with value: 0.13435337537029549.
[I 2024-12-04 15:24:34,948] Trial 1755 finished with value: 0.13435439763979679 and parameters: {'kernel_type': 'Matern', 'length_scale': 4.971295398801211, 'noise_level': 0.04168127432549006, 'constant_value': 32588.2374501259, 'nu': 1.5}. Best is trial 1456 with value: 0.13435337537029549.
[I 2024-12-04 15:24:35,104] Trial 1751 finished with value: 0.17251038892807027 and parameters: {'kernel_type': 'Matern', 'length_scale': 2.3570301303905743, 'noise_level': 0.8929337730960978, 'constant_value': 1.0793279016617161e-07, 'nu': 0.5}. Best is trial 1456 with value: 0.13435337537029549.
[I 2024-12-04 15:24:35,422] Trial 1750 finished with value: 1.2693635028569124 and parameters: {'kernel_type': 'Matern', 'length_scale': 2819.229112764663, 'noise_level': 0.0004989280164587123, 'constant_value': 4145.349026077384, 'nu': 1.5}. Best is trial 1456 with value: 0.13435337537029549.
[I 2024-12-04 15:24:36,129] Trial 1762 finished with value: 0.1343543874868347 and parameters: {'kernel_type': 'Matern', 'length_scale': 0.5144469397436752, 'noise_level': 0.004861541573734798, 'constant_value': 1061.8154346922393, 'nu': 1.5}. Best is trial 1456 with value: 0.13435337537029549.
[I 2024-12-04 15:24:37,833] Trial 1763 finished with value: 0.13435438513768774 and parameters: {'kernel_type': 'Matern', 'length_scale': 67.57477118920775, 'noise_level': 0.10574301467366223, 'constant_value': 86886.6700074689, 'nu': 1.5}. Best is trial 1456 with value: 0.13435337537029549.
[I 2024-12-04 15:24:38,476] Trial 1769 finished with value: 0.13435438955562523 and parameters: {'kernel_type': 'Matern', 'length_scale': 28.66781456804835, 'noise_level': 0.779691881558906, 'constant_value': 0.09190916108156315, 'nu': 1.5}. Best is trial 1456 with value: 0.13435337537029549.
[I 2024-12-04 15:24:39,922] Trial 1772 finished with value: 0.13435436851588567 and parameters: {'kernel_type': 'Matern', 'length_scale': 7.304757082443211, 'noise_level': 0.007739880247839053, 'constant_value': 780.2666535543318, 'nu': 1.5}. Best is trial 1456 with value: 0.13435337537029549.
[I 2024-12-04 15:24:40,155] Trial 1765 finished with value: 1.2693635028550587 and parameters: {'kernel_type': 'Matern', 'length_scale': 6368.567281082113, 'noise_level': 0.00020066382638930173, 'constant_value': 1259.5792506659873, 'nu': 1.5}. Best is trial 1456 with value: 0.13435337537029549.
[I 2024-12-04 15:24:40,856] Trial 1764 finished with value: 0.1343544431952006 and parameters: {'kernel_type': 'Matern', 'length_scale': 32.795748968864324, 'noise_level': 0.0003335238143506363, 'constant_value': 85958.96704769098, 'nu': 1.5}. Best is trial 1456 with value: 0.13435337537029549.
[I 2024-12-04 15:24:41,619] Trial 1761 finished with value: 0.13435437114059573 and parameters: {'kernel_type': 'Matern', 'length_scale': 0.1829892994968529, 'noise_level': 0.5104721661280349, 'constant_value': 91038.52382869656, 'nu': 1.5}. Best is trial 1456 with value: 0.13435337537029549.
[I 2024-12-04 15:24:43,120] Trial 1773 finished with value: 0.13435456904266185 and parameters: {'kernel_type': 'Matern', 'length_scale': 72.23418010084492, 'noise_level': 0.0016984280792317827, 'constant_value': 73250.61434901599, 'nu': 1.5}. Best is trial 1456 with value: 0.13435337537029549.
[I 2024-12-04 15:24:45,709] Trial 1776 finished with value: 0.13435440261993828 and parameters: {'kernel_type': 'Matern', 'length_scale': 6898.842171641543, 'noise_level': 0.021612231831779086, 'constant_value': 83971.38201632937, 'nu': 1.5}. Best is trial 1456 with value: 0.13435337537029549.
[I 2024-12-04 15:24:45,763] Trial 1770 finished with value: 1.2693635028569685 and parameters: {'kernel_type': 'Matern', 'length_scale': 1529.571104552073, 'noise_level': 0.005879782763241127, 'constant_value': 393.3220460761402, 'nu': 2.5}. Best is trial 1456 with value: 0.13435337537029549.
[I 2024-12-04 15:24:46,689] Trial 1766 finished with value: 0.13435440186712658 and parameters: {'kernel_type': 'Matern', 'length_scale': 1.7050005673322193, 'noise_level': 0.002965842204392979, 'constant_value': 3714.616141494839, 'nu': 1.5}. Best is trial 1456 with value: 0.13435337537029549.
[I 2024-12-04 15:24:46,960] Trial 1774 finished with value: 0.1343543967301128 and parameters: {'kernel_type': 'Matern', 'length_scale': 1.6289382813764424, 'noise_level': 0.039829040002721305, 'constant_value': 89734.09657763947, 'nu': 1.5}. Best is trial 1456 with value: 0.13435337537029549.
[I 2024-12-04 15:24:47,311] Trial 1775 finished with value: 0.13435436930930003 and parameters: {'kernel_type': 'Matern', 'length_scale': 1.70924865683873, 'noise_level': 0.7740529809518992, 'constant_value': 1359.3219969956183, 'nu': 1.5}. Best is trial 1456 with value: 0.13435337537029549.
[I 2024-12-04 15:24:47,599] Trial 1767 finished with value: 1.2693635028569692 and parameters: {'kernel_type': 'Matern', 'length_scale': 3.1077818686822234e-05, 'noise_level': 7.241390613018605e-06, 'constant_value': 6.251430161208651e-06, 'nu': 0.5}. Best is trial 1456 with value: 0.13435337537029549.
[I 2024-12-04 15:24:49,906] Trial 1778 finished with value: 0.13435439761924917 and parameters: {'kernel_type': 'Matern', 'length_scale': 8.288918240001394, 'noise_level': 0.04473911079742541, 'constant_value': 1144.8137120981835, 'nu': 1.5}. Best is trial 1456 with value: 0.13435337537029549.
[I 2024-12-04 15:24:49,955] Trial 1780 finished with value: 0.13435440036596838 and parameters: {'kernel_type': 'Matern', 'length_scale': 79.2485416445384, 'noise_level': 0.05287222540725881, 'constant_value': 668.0058815711153, 'nu': 1.5}. Best is trial 1456 with value: 0.13435337537029549.
[I 2024-12-04 15:24:50,004] Trial 1771 finished with value: 0.13435462070970136 and parameters: {'kernel_type': 'Matern', 'length_scale': 0.9307501405175851, 'noise_level': 0.018363046533412405, 'constant_value': 968.5998543123006, 'nu': 1.5}. Best is trial 1456 with value: 0.13435337537029549.
[I 2024-12-04 15:24:50,955] Trial 1781 finished with value: 0.13435403267982476 and parameters: {'kernel_type': 'Matern', 'length_scale': 505.8128741995167, 'noise_level': 0.13211337882104554, 'constant_value': 20.94262512987557, 'nu': 1.5}. Best is trial 1456 with value: 0.13435337537029549.
[I 2024-12-04 15:24:50,955] Trial 1768 finished with value: 0.1343544001899993 and parameters: {'kernel_type': 'Matern', 'length_scale': 1534.2433192006918, 'noise_level': 0.20155486240986026, 'constant_value': 93863.57170161529, 'nu': 1.5}. Best is trial 1456 with value: 0.13435337537029549.
[I 2024-12-04 15:24:52,724] Trial 1779 finished with value: 0.13435440278840022 and parameters: {'kernel_type': 'Matern', 'length_scale': 210.17250694438582, 'noise_level': 0.050098049240004425, 'constant_value': 2783.0211359180016, 'nu': 1.5}. Best is trial 1456 with value: 0.13435337537029549.
