[I 2024-12-03 18:49:50,945] Trial 1878 finished with value: 1.106023426617607 and parameters: {'kernel': 'poly', 'C': 0.0011143602446018125, 'gamma': 0.0594423060343156, 'epsilon': 0.06473637587822276}. Best is trial 1119 with value: 0.4485361816812923.
[I 2024-12-03 18:49:52,010] Trial 1877 finished with value: 0.46873032376304297 and parameters: {'kernel': 'rbf', 'C': 19.81835062583037, 'gamma': 0.03359488472383582, 'epsilon': 0.03752378425978599}. Best is trial 1119 with value: 0.4485361816812923.
[I 2024-12-03 18:49:53,003] Trial 1879 finished with value: 0.5342063124377215 and parameters: {'kernel': 'rbf', 'C': 36.8320987367306, 'gamma': 0.047915932459182325, 'epsilon': 0.03782845274383991}. Best is trial 1119 with value: 0.4485361816812923.
[I 2024-12-03 18:49:53,267] Trial 1880 finished with value: 0.5506816648299564 and parameters: {'kernel': 'rbf', 'C': 26.094607227376617, 'gamma': 0.006194523616819487, 'epsilon': 0.021072697534206767}. Best is trial 1119 with value: 0.4485361816812923.
[I 2024-12-03 18:49:54,154] Trial 1882 finished with value: 0.5583744895353523 and parameters: {'kernel': 'rbf', 'C': 27.214983064636545, 'gamma': 0.06309432597815184, 'epsilon': 0.011581138613451027}. Best is trial 1119 with value: 0.4485361816812923.
[I 2024-12-03 18:49:55,290] Trial 1902 finished with value: 0.5061814307860991 and parameters: {'kernel': 'rbf', 'C': 23.2173181982736, 'gamma': 0.012458995784897254, 'epsilon': 0.03307558648477587}. Best is trial 1119 with value: 0.4485361816812923.
[I 2024-12-03 18:49:55,385] Trial 1870 finished with value: 0.5733425593637214 and parameters: {'kernel': 'linear', 'C': 97.38685471280924, 'gamma': 0.0051049543604201235, 'epsilon': 0.06866141966516989}. Best is trial 1119 with value: 0.4485361816812923.
[I 2024-12-03 18:49:55,487] Trial 1894 finished with value: 0.48638835396964625 and parameters: {'kernel': 'rbf', 'C': 92.05699751586499, 'gamma': 0.025331036610827525, 'epsilon': 0.026212751082696092}. Best is trial 1119 with value: 0.4485361816812923.
[I 2024-12-03 18:49:55,615] Trial 1887 finished with value: 0.7807437292834071 and parameters: {'kernel': 'poly', 'C': 26.225623139774672, 'gamma': 0.0335788943112135, 'epsilon': 0.0811949449743016}. Best is trial 1119 with value: 0.4485361816812923.
[I 2024-12-03 18:49:55,616] Trial 1883 finished with value: 0.4960535866090906 and parameters: {'kernel': 'rbf', 'C': 83.8996486556426, 'gamma': 0.028129793710630926, 'epsilon': 0.0469935903695641}. Best is trial 1119 with value: 0.4485361816812923.
[I 2024-12-03 18:49:55,999] Trial 1889 finished with value: 0.46360972571686787 and parameters: {'kernel': 'rbf', 'C': 89.47800329074018, 'gamma': 0.019440330918497374, 'epsilon': 0.019903223767864776}. Best is trial 1119 with value: 0.4485361816812923.
[I 2024-12-03 18:49:56,422] Trial 1888 finished with value: 1.2047054841568212 and parameters: {'kernel': 'sigmoid', 'C': 0.03908850795788898, 'gamma': 0.008357014786818565, 'epsilon': 0.5418391074552502}. Best is trial 1119 with value: 0.4485361816812923.
[I 2024-12-03 18:49:56,795] Trial 1893 finished with value: 0.5303713212421038 and parameters: {'kernel': 'rbf', 'C': 97.97071110181045, 'gamma': 0.022342855460814253, 'epsilon': 0.18490481500361297}. Best is trial 1119 with value: 0.4485361816812923.
[I 2024-12-03 18:49:57,543] Trial 1892 finished with value: 0.4931336717232029 and parameters: {'kernel': 'rbf', 'C': 92.87314305626535, 'gamma': 0.023246891636492226, 'epsilon': 0.08763159833237436}. Best is trial 1119 with value: 0.4485361816812923.
[I 2024-12-03 18:49:57,820] Trial 1885 finished with value: 0.4536774937696241 and parameters: {'kernel': 'rbf', 'C': 99.69221540966166, 'gamma': 0.012825809143573482, 'epsilon': 0.04617808769349999}. Best is trial 1119 with value: 0.4485361816812923.
[I 2024-12-03 18:49:57,846] Trial 1891 finished with value: 0.4649035619202362 and parameters: {'kernel': 'rbf', 'C': 88.8390823828412, 'gamma': 0.013828824154508531, 'epsilon': 0.1302556432611218}. Best is trial 1119 with value: 0.4485361816812923.
[I 2024-12-03 18:49:58,335] Trial 1881 finished with value: 0.9205962816830657 and parameters: {'kernel': 'rbf', 'C': 14.111653463982925, 'gamma': 0.9683476045168954, 'epsilon': 0.044460547822428025}. Best is trial 1119 with value: 0.4485361816812923.
[I 2024-12-03 18:49:59,067] Trial 1904 finished with value: 0.45162477669248835 and parameters: {'kernel': 'rbf', 'C': 92.318767755901, 'gamma': 0.014304267042141805, 'epsilon': 0.0823566938336177}. Best is trial 1119 with value: 0.4485361816812923.
[I 2024-12-03 18:49:59,068] Trial 1884 finished with value: 0.48994344033798537 and parameters: {'kernel': 'rbf', 'C': 18.526150871118354, 'gamma': 0.04375646411378823, 'epsilon': 0.07575968790236282}. Best is trial 1119 with value: 0.4485361816812923.
[I 2024-12-03 18:49:59,093] Trial 1901 finished with value: 0.562871885863987 and parameters: {'kernel': 'rbf', 'C': 4.627103725399027, 'gamma': 0.019588830439902942, 'epsilon': 0.11632877090999624}. Best is trial 1119 with value: 0.4485361816812923.
[I 2024-12-03 18:49:59,264] Trial 1890 finished with value: 0.4639332758190046 and parameters: {'kernel': 'rbf', 'C': 98.13163262158814, 'gamma': 0.017297935471711306, 'epsilon': 0.013268826265412264}. Best is trial 1119 with value: 0.4485361816812923.
[I 2024-12-03 18:49:59,328] Trial 1895 finished with value: 0.5701975975058322 and parameters: {'kernel': 'rbf', 'C': 99.58894959956314, 'gamma': 0.037058967279165834, 'epsilon': 0.057918177742334764}. Best is trial 1119 with value: 0.4485361816812923.
[I 2024-12-03 18:50:00,208] Trial 1898 finished with value: 0.49888269583540723 and parameters: {'kernel': 'rbf', 'C': 97.37469667891952, 'gamma': 0.019507259041673723, 'epsilon': 0.12942371748034087}. Best is trial 1119 with value: 0.4485361816812923.
[I 2024-12-03 18:50:00,210] Trial 1905 finished with value: 0.7775277811313668 and parameters: {'kernel': 'poly', 'C': 98.4687780803115, 'gamma': 0.024583070764609458, 'epsilon': 0.06768127152878337}. Best is trial 1119 with value: 0.4485361816812923.
[I 2024-12-03 18:50:00,215] Trial 1903 finished with value: 0.47393706156805193 and parameters: {'kernel': 'rbf', 'C': 98.32503766283857, 'gamma': 0.021346235062797564, 'epsilon': 0.031570888949922}. Best is trial 1119 with value: 0.4485361816812923.
[I 2024-12-03 18:50:00,247] Trial 1908 finished with value: 50.803925405619054 and parameters: {'kernel': 'sigmoid', 'C': 7.701319021909252, 'gamma': 0.057095998474724054, 'epsilon': 0.09232022747132673}. Best is trial 1119 with value: 0.4485361816812923.
[I 2024-12-03 18:50:00,520] Trial 1900 finished with value: 0.7671518361601235 and parameters: {'kernel': 'rbf', 'C': 13.168592520288042, 'gamma': 0.0007804497487549494, 'epsilon': 0.036821502575722566}. Best is trial 1119 with value: 0.4485361816812923.
[I 2024-12-03 18:50:00,744] Trial 1899 finished with value: 0.46470835733306687 and parameters: {'kernel': 'rbf', 'C': 94.59906858034348, 'gamma': 0.00900721132807881, 'epsilon': 0.09286249060562399}. Best is trial 1119 with value: 0.4485361816812923.
[I 2024-12-03 18:50:00,962] Trial 1886 finished with value: 0.6067146330783486 and parameters: {'kernel': 'rbf', 'C': 94.8004198991871, 'gamma': 0.0006998415602281218, 'epsilon': 0.03781887294347925}. Best is trial 1119 with value: 0.4485361816812923.
[I 2024-12-03 18:50:01,329] Trial 1906 finished with value: 18.82321946797115 and parameters: {'kernel': 'sigmoid', 'C': 10.649895343860267, 'gamma': 0.012149639890283512, 'epsilon': 0.13493996860888938}. Best is trial 1119 with value: 0.4485361816812923.
[I 2024-12-03 18:50:01,335] Trial 1909 finished with value: 0.5578967801132788 and parameters: {'kernel': 'rbf', 'C': 19.36006742662857, 'gamma': 0.005945599006109274, 'epsilon': 0.06303191467765662}. Best is trial 1119 with value: 0.4485361816812923.
[I 2024-12-03 18:50:01,783] Trial 1897 finished with value: 0.5696778724176161 and parameters: {'kernel': 'rbf', 'C': 24.233715539902363, 'gamma': 0.004072937072888863, 'epsilon': 0.04817305157973503}. Best is trial 1119 with value: 0.4485361816812923.
[I 2024-12-03 18:50:02,022] Trial 1907 finished with value: 0.7688634798712495 and parameters: {'kernel': 'linear', 'C': 0.01628582226207821, 'gamma': 0.03543167848027787, 'epsilon': 0.019169538649035714}. Best is trial 1119 with value: 0.4485361816812923.
[I 2024-12-03 18:50:02,860] Trial 1896 finished with value: 0.56243816096994 and parameters: {'kernel': 'linear', 'C': 96.46698019765829, 'gamma': 0.05491214737418887, 'epsilon': 0.03131332446607201}. Best is trial 1119 with value: 0.4485361816812923.
[I 2024-12-03 18:50:02,861] Trial 1914 finished with value: 0.4589650140952461 and parameters: {'kernel': 'rbf', 'C': 97.3628496930875, 'gamma': 0.011192405575385568, 'epsilon': 0.03806799122537122}. Best is trial 1119 with value: 0.4485361816812923.
[I 2024-12-03 18:50:02,865] Trial 1912 finished with value: 0.6044434676417512 and parameters: {'kernel': 'rbf', 'C': 20.764342796758754, 'gamma': 0.17100244700422776, 'epsilon': 0.1335242650054864}. Best is trial 1119 with value: 0.4485361816812923.
[I 2024-12-03 18:50:03,982] Trial 1911 finished with value: 0.46937586231783573 and parameters: {'kernel': 'rbf', 'C': 98.58478147112729, 'gamma': 0.008315420381030182, 'epsilon': 0.0989887765575624}. Best is trial 1119 with value: 0.4485361816812923.
[I 2024-12-03 18:50:04,376] Trial 1916 finished with value: 0.5374925630514703 and parameters: {'kernel': 'rbf', 'C': 19.515784399456958, 'gamma': 0.05937647241219324, 'epsilon': 0.11449189741749914}. Best is trial 1119 with value: 0.4485361816812923.
[I 2024-12-03 18:50:04,890] Trial 1921 finished with value: 0.5013412188617657 and parameters: {'kernel': 'rbf', 'C': 90.03227121309928, 'gamma': 0.005611647036603956, 'epsilon': 0.027083113415745062}. Best is trial 1119 with value: 0.4485361816812923.
[I 2024-12-03 18:50:05,249] Trial 1920 finished with value: 2.3803279539915425 and parameters: {'kernel': 'sigmoid', 'C': 69.24235463123833, 'gamma': 0.002418260533099773, 'epsilon': 0.028140782138992963}. Best is trial 1119 with value: 0.4485361816812923.
[I 2024-12-03 18:50:05,475] Trial 1910 finished with value: 0.6030592200499647 and parameters: {'kernel': 'rbf', 'C': 3.7558750002075088, 'gamma': 0.01579548317517304, 'epsilon': 0.03768253254236264}. Best is trial 1119 with value: 0.4485361816812923.
[I 2024-12-03 18:50:05,733] Trial 1913 finished with value: 1179.7664372548038 and parameters: {'kernel': 'sigmoid', 'C': 79.46249302039212, 'gamma': 0.32243383818154775, 'epsilon': 0.05755511086894251}. Best is trial 1119 with value: 0.4485361816812923.
[I 2024-12-03 18:50:06,631] Trial 1918 finished with value: 1.3289476047715416 and parameters: {'kernel': 'sigmoid', 'C': 0.059194498586378784, 'gamma': 0.0013453205293324358, 'epsilon': 0.07317156784131662}. Best is trial 1119 with value: 0.4485361816812923.
[I 2024-12-03 18:50:06,819] Trial 1917 finished with value: 0.5245187855785753 and parameters: {'kernel': 'rbf', 'C': 5.1647652167080675, 'gamma': 0.06195180517209696, 'epsilon': 0.06518471918606465}. Best is trial 1119 with value: 0.4485361816812923.
[I 2024-12-03 18:50:07,622] Trial 1915 finished with value: 0.5713315958280957 and parameters: {'kernel': 'rbf', 'C': 19.48236624802406, 'gamma': 0.07885565623072535, 'epsilon': 0.024431894574363712}. Best is trial 1119 with value: 0.4485361816812923.
[I 2024-12-03 18:50:07,629] Trial 1926 finished with value: 0.5489294419728858 and parameters: {'kernel': 'rbf', 'C': 21.76255882782613, 'gamma': 0.006449670566183523, 'epsilon': 0.11842664969962628}. Best is trial 1119 with value: 0.4485361816812923.
[I 2024-12-03 18:50:08,034] Trial 1919 finished with value: 0.48018911228155625 and parameters: {'kernel': 'rbf', 'C': 21.164148000251977, 'gamma': 0.017612772366537206, 'epsilon': 0.08501257106161386}. Best is trial 1119 with value: 0.4485361816812923.
[I 2024-12-03 18:50:08,781] Trial 1938 finished with value: 0.5220446954621244 and parameters: {'kernel': 'rbf', 'C': 30.450389006620636, 'gamma': 0.008156108724048915, 'epsilon': 0.03559332808375563}. Best is trial 1119 with value: 0.4485361816812923.
[I 2024-12-03 18:50:09,395] Trial 1933 finished with value: 0.49864991379426593 and parameters: {'kernel': 'rbf', 'C': 95.82932271273489, 'gamma': 0.005019557209996619, 'epsilon': 0.07811724228105704}. Best is trial 1119 with value: 0.4485361816812923.
[I 2024-12-03 18:50:09,892] Trial 1935 finished with value: 0.6084011870389504 and parameters: {'kernel': 'linear', 'C': 0.14524107076493126, 'gamma': 0.1577102379544108, 'epsilon': 0.07642258578876114}. Best is trial 1119 with value: 0.4485361816812923.
[I 2024-12-03 18:50:10,147] Trial 1924 finished with value: 283.82052197771594 and parameters: {'kernel': 'sigmoid', 'C': 47.16244626152524, 'gamma': 0.038430622222688, 'epsilon': 0.0015588221061405456}. Best is trial 1119 with value: 0.4485361816812923.
[I 2024-12-03 18:50:10,413] Trial 1922 finished with value: 0.4665019191535624 and parameters: {'kernel': 'rbf', 'C': 96.20641175638876, 'gamma': 0.009015456216310901, 'epsilon': 0.07319171413778047}. Best is trial 1119 with value: 0.4485361816812923.
[I 2024-12-03 18:50:10,479] Trial 1940 finished with value: 0.6210636908808774 and parameters: {'kernel': 'rbf', 'C': 19.166813002765917, 'gamma': 0.0025306891088392853, 'epsilon': 0.16495548197268003}. Best is trial 1119 with value: 0.4485361816812923.
[I 2024-12-03 18:50:11,026] Trial 1932 finished with value: 0.6104855184569261 and parameters: {'kernel': 'rbf', 'C': 99.84544908158173, 'gamma': 0.006493067295494649, 'epsilon': 0.6968337969756777}. Best is trial 1119 with value: 0.4485361816812923.
[I 2024-12-03 18:50:11,434] Trial 1934 finished with value: 1.3714713178788527 and parameters: {'kernel': 'sigmoid', 'C': 0.0014569204186194366, 'gamma': 0.0005698612455257408, 'epsilon': 0.03331476610691841}. Best is trial 1119 with value: 0.4485361816812923.
[I 2024-12-03 18:50:11,491] Trial 1936 finished with value: 0.5469131594867777 and parameters: {'kernel': 'rbf', 'C': 94.02104812943935, 'gamma': 0.0029020533066321606, 'epsilon': 0.02802880197809823}. Best is trial 1119 with value: 0.4485361816812923.
[I 2024-12-03 18:50:11,773] Trial 1927 finished with value: 0.8030836831854339 and parameters: {'kernel': 'linear', 'C': 0.006490364896907915, 'gamma': 0.0001141277675637185, 'epsilon': 0.05847768489114716}. Best is trial 1119 with value: 0.4485361816812923.
[I 2024-12-03 18:50:11,871] Trial 1925 finished with value: 0.4675018515578217 and parameters: {'kernel': 'rbf', 'C': 20.80150830149124, 'gamma': 0.021865143289412085, 'epsilon': 0.11193053335581858}. Best is trial 1119 with value: 0.4485361816812923.
[I 2024-12-03 18:50:12,074] Trial 1944 finished with value: 0.5214537336257602 and parameters: {'kernel': 'rbf', 'C': 20.472511332074024, 'gamma': 0.010913968899204507, 'epsilon': 0.0620389611048389}. Best is trial 1119 with value: 0.4485361816812923.
[I 2024-12-03 18:50:12,765] Trial 1947 finished with value: 1.0197638105745341 and parameters: {'kernel': 'rbf', 'C': 0.21503316506649536, 'gamma': 0.0020461146995575112, 'epsilon': 0.0010021485050151478}. Best is trial 1119 with value: 0.4485361816812923.
[I 2024-12-03 18:50:12,773] Trial 1939 finished with value: 0.5009936300431813 and parameters: {'kernel': 'rbf', 'C': 98.84942911021587, 'gamma': 0.023242618660864516, 'epsilon': 0.09252211652475333}. Best is trial 1119 with value: 0.4485361816812923.
[I 2024-12-03 18:50:12,844] Trial 1929 finished with value: 0.45758794121665614 and parameters: {'kernel': 'rbf', 'C': 94.31747474963693, 'gamma': 0.011930557312320799, 'epsilon': 0.039759378489931906}. Best is trial 1119 with value: 0.4485361816812923.
[I 2024-12-03 18:50:13,144] Trial 1937 finished with value: 0.4721836480958704 and parameters: {'kernel': 'rbf', 'C': 96.48701828914803, 'gamma': 0.0214043084692684, 'epsilon': 0.041618742212458364}. Best is trial 1119 with value: 0.4485361816812923.
[I 2024-12-03 18:50:13,269] Trial 1943 finished with value: 0.5956635323461247 and parameters: {'kernel': 'rbf', 'C': 19.71978268510081, 'gamma': 0.09547850481687785, 'epsilon': 0.038720957149934225}. Best is trial 1119 with value: 0.4485361816812923.
[I 2024-12-03 18:50:13,270] Trial 1942 finished with value: 0.9783522376903486 and parameters: {'kernel': 'poly', 'C': 17.88657686460866, 'gamma': 0.010615728498012405, 'epsilon': 0.0688207714760778}. Best is trial 1119 with value: 0.4485361816812923.
[I 2024-12-03 18:50:13,478] Trial 1931 finished with value: 0.4658646037737871 and parameters: {'kernel': 'rbf', 'C': 21.419818027803327, 'gamma': 0.022071586580316625, 'epsilon': 0.11199400386279117}. Best is trial 1119 with value: 0.4485361816812923.
[I 2024-12-03 18:50:13,683] Trial 1923 finished with value: 0.496102216599191 and parameters: {'kernel': 'rbf', 'C': 99.68221602258184, 'gamma': 0.02628762087358039, 'epsilon': 0.017492378440945196}. Best is trial 1119 with value: 0.4485361816812923.
[I 2024-12-03 18:50:13,781] Trial 1941 finished with value: 0.5538793632857081 and parameters: {'kernel': 'rbf', 'C': 96.09613501745308, 'gamma': 0.024832970003183012, 'epsilon': 0.41079062742270983}. Best is trial 1119 with value: 0.4485361816812923.
[I 2024-12-03 18:50:13,981] Trial 1928 finished with value: 0.6293540575980789 and parameters: {'kernel': 'rbf', 'C': 99.57543088772108, 'gamma': 0.0650081348048275, 'epsilon': 0.12293512059888786}. Best is trial 1119 with value: 0.4485361816812923.
[I 2024-12-03 18:50:14,266] Trial 1930 finished with value: 0.5335720340630351 and parameters: {'kernel': 'rbf', 'C': 92.07156388245956, 'gamma': 0.0038530642279414697, 'epsilon': 0.13057209985659482}. Best is trial 1119 with value: 0.4485361816812923.
[I 2024-12-03 18:50:14,378] Trial 1948 finished with value: 0.5547044949476804 and parameters: {'kernel': 'rbf', 'C': 96.28168952349775, 'gamma': 0.0018709041398498878, 'epsilon': 0.29551127019078727}. Best is trial 1119 with value: 0.4485361816812923.
[I 2024-12-03 18:50:15,119] Trial 1946 finished with value: 113.51069663630395 and parameters: {'kernel': 'sigmoid', 'C': 17.27690890370291, 'gamma': 0.04659430065680656, 'epsilon': 0.02326614103258391}. Best is trial 1119 with value: 0.4485361816812923.
[I 2024-12-03 18:50:15,254] Trial 1952 finished with value: 0.45005794520124526 and parameters: {'kernel': 'rbf', 'C': 96.77163479139914, 'gamma': 0.013094180180387478, 'epsilon': 0.05844104277944959}. Best is trial 1119 with value: 0.4485361816812923.
[I 2024-12-03 18:50:15,589] Trial 1945 finished with value: 0.5525978600955456 and parameters: {'kernel': 'linear', 'C': 9.733282985977427, 'gamma': 0.019569986122099862, 'epsilon': 0.0018297618251456663}. Best is trial 1119 with value: 0.4485361816812923.
[I 2024-12-03 18:50:15,795] Trial 1951 finished with value: 0.466959230936315 and parameters: {'kernel': 'rbf', 'C': 28.167639994004062, 'gamma': 0.016973655990806764, 'epsilon': 0.05315664823906515}. Best is trial 1119 with value: 0.4485361816812923.
[I 2024-12-03 18:50:17,787] Trial 1949 finished with value: 0.5625123581871372 and parameters: {'kernel': 'rbf', 'C': 20.11618516583856, 'gamma': 0.006214555650711902, 'epsilon': 0.019168152272918838}. Best is trial 1119 with value: 0.4485361816812923.
[I 2024-12-03 18:50:18,664] Trial 1958 finished with value: 0.5117571546194618 and parameters: {'kernel': 'rbf', 'C': 96.28911473887925, 'gamma': 0.02420897535179925, 'epsilon': 0.10082756654207403}. Best is trial 1119 with value: 0.4485361816812923.
[I 2024-12-03 18:50:19,421] Trial 1954 finished with value: 0.463655840024128 and parameters: {'kernel': 'rbf', 'C': 23.26087323353658, 'gamma': 0.026876547968074066, 'epsilon': 0.030861099400652743}. Best is trial 1119 with value: 0.4485361816812923.
[I 2024-12-03 18:50:19,870] Trial 1956 finished with value: 0.5967687111988715 and parameters: {'kernel': 'rbf', 'C': 26.864556450264747, 'gamma': 0.0024230885969896746, 'epsilon': 0.04319976596124964}. Best is trial 1119 with value: 0.4485361816812923.
[I 2024-12-03 18:50:20,154] Trial 1959 finished with value: 0.7083242672284784 and parameters: {'kernel': 'rbf', 'C': 3.8298429699375074, 'gamma': 0.006176562538609714, 'epsilon': 0.09226815206557966}. Best is trial 1119 with value: 0.4485361816812923.
[I 2024-12-03 18:50:20,294] Trial 1953 finished with value: 0.45654561340132843 and parameters: {'kernel': 'rbf', 'C': 89.09497569444255, 'gamma': 0.017995104932503458, 'epsilon': 0.06482028005404875}. Best is trial 1119 with value: 0.4485361816812923.
[I 2024-12-03 18:50:20,502] Trial 1950 finished with value: 0.508392375332826 and parameters: {'kernel': 'rbf', 'C': 21.23436340720211, 'gamma': 0.012656919076792941, 'epsilon': 0.040010721525875245}. Best is trial 1119 with value: 0.4485361816812923.
[I 2024-12-03 18:50:20,503] Trial 1970 finished with value: 0.5324189860154995 and parameters: {'kernel': 'rbf', 'C': 98.36058588795515, 'gamma': 0.0037168906643341012, 'epsilon': 0.12423946467508296}. Best is trial 1119 with value: 0.4485361816812923.
[I 2024-12-03 18:50:20,511] Trial 1964 finished with value: 0.4765787391395055 and parameters: {'kernel': 'rbf', 'C': 21.973661723214484, 'gamma': 0.03433547143811432, 'epsilon': 0.06754010448040944}. Best is trial 1119 with value: 0.4485361816812923.
[I 2024-12-03 18:50:20,530] Trial 1960 finished with value: 0.677917512522835 and parameters: {'kernel': 'rbf', 'C': 90.15950153218294, 'gamma': 0.06331308485831183, 'epsilon': 0.033549512407614654}. Best is trial 1119 with value: 0.4485361816812923.
[I 2024-12-03 18:50:20,687] Trial 1957 finished with value: 0.4735887427444393 and parameters: {'kernel': 'rbf', 'C': 93.19307452216341, 'gamma': 0.012119996553509753, 'epsilon': 0.17359919814614494}. Best is trial 1119 with value: 0.4485361816812923.
