[I 2024-12-03 18:46:02,741] Trial 779 finished with value: 0.508363425619825 and parameters: {'kernel': 'rbf', 'C': 1.4440567568500313, 'gamma': 0.049414562070178164, 'epsilon': 0.05836130032746784}. Best is trial 88 with value: 0.3542875001421725.
[I 2024-12-03 18:46:03,734] Trial 781 finished with value: 0.8780815277243653 and parameters: {'kernel': 'linear', 'C': 0.005183593182932387, 'gamma': 0.009521769626744692, 'epsilon': 0.0972024903780116}. Best is trial 88 with value: 0.3542875001421725.
[I 2024-12-03 18:46:04,455] Trial 782 finished with value: 0.36819069672852406 and parameters: {'kernel': 'rbf', 'C': 96.40291730587684, 'gamma': 0.06133553024851064, 'epsilon': 0.11837118738449282}. Best is trial 88 with value: 0.3542875001421725.
[I 2024-12-03 18:46:04,456] Trial 783 finished with value: 0.41301898853452335 and parameters: {'kernel': 'rbf', 'C': 24.184623838817046, 'gamma': 0.030668707522770774, 'epsilon': 0.07788836003242318}. Best is trial 88 with value: 0.3542875001421725.
[I 2024-12-03 18:46:05,224] Trial 785 finished with value: 0.44194365708575645 and parameters: {'kernel': 'rbf', 'C': 79.87282060362112, 'gamma': 0.007111091157437156, 'epsilon': 0.13244539073355374}. Best is trial 88 with value: 0.3542875001421725.
[I 2024-12-03 18:46:05,225] Trial 784 finished with value: 0.36834140098524487 and parameters: {'kernel': 'rbf', 'C': 89.6203367563977, 'gamma': 0.03019305836024933, 'epsilon': 0.061620485281989254}. Best is trial 88 with value: 0.3542875001421725.
[I 2024-12-03 18:46:05,735] Trial 786 finished with value: 0.5808082491101595 and parameters: {'kernel': 'rbf', 'C': 90.94121463575067, 'gamma': 0.2216953628819124, 'epsilon': 0.3043269861361684}. Best is trial 88 with value: 0.3542875001421725.
[I 2024-12-03 18:46:05,817] Trial 787 finished with value: 0.3738466101372001 and parameters: {'kernel': 'rbf', 'C': 96.79444855747806, 'gamma': 0.03624299314759198, 'epsilon': 0.3311160174647661}. Best is trial 88 with value: 0.3542875001421725.
[I 2024-12-03 18:46:06,855] Trial 788 finished with value: 0.42003561645197296 and parameters: {'kernel': 'rbf', 'C': 13.122308063576174, 'gamma': 0.041021972291824395, 'epsilon': 0.1707586101155225}. Best is trial 88 with value: 0.3542875001421725.
[I 2024-12-03 18:46:07,632] Trial 790 finished with value: 0.7907592212659341 and parameters: {'kernel': 'linear', 'C': 0.03130038069929774, 'gamma': 0.00023633970801178157, 'epsilon': 0.7140772826790779}. Best is trial 88 with value: 0.3542875001421725.
[I 2024-12-03 18:46:07,912] Trial 791 finished with value: 0.39915576087875254 and parameters: {'kernel': 'rbf', 'C': 19.910855086778014, 'gamma': 0.05371136694052511, 'epsilon': 0.09256869645089012}. Best is trial 88 with value: 0.3542875001421725.
[I 2024-12-03 18:46:08,132] Trial 792 finished with value: 0.47188154065652893 and parameters: {'kernel': 'rbf', 'C': 21.654853511183425, 'gamma': 0.047464530292987674, 'epsilon': 0.5614139524175753}. Best is trial 88 with value: 0.3542875001421725.
[I 2024-12-03 18:46:08,935] Trial 711 finished with value: 0.7978974012164177 and parameters: {'kernel': 'linear', 'C': 32.95575903009611, 'gamma': 0.044131862816352826, 'epsilon': 0.006610746966283841}. Best is trial 88 with value: 0.3542875001421725.
[I 2024-12-03 18:46:09,590] Trial 793 finished with value: 0.9041811662296142 and parameters: {'kernel': 'sigmoid', 'C': 1.813576257894548, 'gamma': 0.00019440109410885002, 'epsilon': 0.05081554622381213}. Best is trial 88 with value: 0.3542875001421725.
[I 2024-12-03 18:46:10,571] Trial 795 finished with value: 0.41553401618569547 and parameters: {'kernel': 'rbf', 'C': 19.526413184202013, 'gamma': 0.10418274919870307, 'epsilon': 0.10254621548583442}. Best is trial 88 with value: 0.3542875001421725.
[I 2024-12-03 18:46:11,123] Trial 796 finished with value: 0.5451995743514613 and parameters: {'kernel': 'rbf', 'C': 72.34197836131206, 'gamma': 0.25153483145628636, 'epsilon': 0.03594858232807047}. Best is trial 88 with value: 0.3542875001421725.
[I 2024-12-03 18:46:11,596] Trial 797 finished with value: 0.5502364977068706 and parameters: {'kernel': 'rbf', 'C': 72.64785146045868, 'gamma': 0.259438715871052, 'epsilon': 0.030081947279492118}. Best is trial 88 with value: 0.3542875001421725.
[I 2024-12-03 18:46:12,303] Trial 798 finished with value: 0.6465823656803513 and parameters: {'kernel': 'rbf', 'C': 0.208048698419063, 'gamma': 0.10457934232209402, 'epsilon': 0.0019752824382804177}. Best is trial 88 with value: 0.3542875001421725.
[I 2024-12-03 18:46:12,405] Trial 799 finished with value: 0.6313634964046285 and parameters: {'kernel': 'rbf', 'C': 10.733056550277256, 'gamma': 0.0005583963953301656, 'epsilon': 0.5640773903891602}. Best is trial 88 with value: 0.3542875001421725.
[I 2024-12-03 18:46:13,226] Trial 800 finished with value: 0.8085769227184055 and parameters: {'kernel': 'linear', 'C': 0.11600703112718017, 'gamma': 0.02644765672106306, 'epsilon': 0.010708203660106632}. Best is trial 88 with value: 0.3542875001421725.
[I 2024-12-03 18:46:13,887] Trial 801 finished with value: 0.3966455779229455 and parameters: {'kernel': 'rbf', 'C': 90.45212199278532, 'gamma': 0.09973888481149243, 'epsilon': 0.10621539450833739}. Best is trial 88 with value: 0.3542875001421725.
[I 2024-12-03 18:46:13,888] Trial 802 finished with value: 0.365699499670414 and parameters: {'kernel': 'rbf', 'C': 98.16381847778695, 'gamma': 0.0311492744307555, 'epsilon': 0.1769853451603394}. Best is trial 88 with value: 0.3542875001421725.
[I 2024-12-03 18:46:14,723] Trial 803 finished with value: 0.38123102439627593 and parameters: {'kernel': 'rbf', 'C': 97.8819232937046, 'gamma': 0.05919576144778499, 'epsilon': 0.2776667955037922}. Best is trial 88 with value: 0.3542875001421725.
[I 2024-12-03 18:46:15,341] Trial 805 finished with value: 0.41346180221938206 and parameters: {'kernel': 'rbf', 'C': 14.517610479039146, 'gamma': 0.02763361317957939, 'epsilon': 0.2501320140088724}. Best is trial 88 with value: 0.3542875001421725.
[I 2024-12-03 18:46:15,687] Trial 804 finished with value: 1215.9116823659542 and parameters: {'kernel': 'sigmoid', 'C': 65.46094061228762, 'gamma': 0.025455484098547164, 'epsilon': 0.14862310137262327}. Best is trial 88 with value: 0.3542875001421725.
[I 2024-12-03 18:46:16,465] Trial 753 finished with value: 0.8110148446260522 and parameters: {'kernel': 'poly', 'C': 42.167996464574834, 'gamma': 0.02819792365623994, 'epsilon': 0.16553427053417538}. Best is trial 88 with value: 0.3542875001421725.
[I 2024-12-03 18:46:16,815] Trial 807 finished with value: 0.5813460715157891 and parameters: {'kernel': 'rbf', 'C': 0.8283160319570297, 'gamma': 0.006688210134474323, 'epsilon': 0.133982835906882}. Best is trial 88 with value: 0.3542875001421725.
[I 2024-12-03 18:46:17,868] Trial 809 finished with value: 0.40118262918282593 and parameters: {'kernel': 'rbf', 'C': 90.67111933921042, 'gamma': 0.007887838493883302, 'epsilon': 0.33397563061012175}. Best is trial 88 with value: 0.3542875001421725.
[I 2024-12-03 18:46:18,000] Trial 806 finished with value: 0.8001414836988902 and parameters: {'kernel': 'linear', 'C': 1.760407751726925, 'gamma': 0.010078911225914044, 'epsilon': 0.00223139498466875}. Best is trial 88 with value: 0.3542875001421725.
[I 2024-12-03 18:46:18,939] Trial 810 finished with value: 0.3732834320793608 and parameters: {'kernel': 'rbf', 'C': 81.67355956900151, 'gamma': 0.02100549195246378, 'epsilon': 0.13955624741795716}. Best is trial 88 with value: 0.3542875001421725.
[I 2024-12-03 18:46:19,769] Trial 683 finished with value: 0.7850804748346268 and parameters: {'kernel': 'linear', 'C': 71.51418545306447, 'gamma': 0.34941561028246015, 'epsilon': 0.09920064145875734}. Best is trial 88 with value: 0.3542875001421725.
[I 2024-12-03 18:46:19,933] Trial 811 finished with value: 0.4302401475325387 and parameters: {'kernel': 'rbf', 'C': 17.778462748213634, 'gamma': 0.11954942729796196, 'epsilon': 0.05967470613990707}. Best is trial 88 with value: 0.3542875001421725.
[I 2024-12-03 18:46:20,006] Trial 812 finished with value: 0.42264735990454194 and parameters: {'kernel': 'rbf', 'C': 33.343885677953416, 'gamma': 0.01511045281651894, 'epsilon': 0.09521987977683363}. Best is trial 88 with value: 0.3542875001421725.
[I 2024-12-03 18:46:20,109] Trial 794 finished with value: 0.7207087849227775 and parameters: {'kernel': 'linear', 'C': 19.513401973159716, 'gamma': 0.051124061729472654, 'epsilon': 0.3156664765012805}. Best is trial 88 with value: 0.3542875001421725.
[I 2024-12-03 18:46:20,319] Trial 813 finished with value: 0.5557076838165718 and parameters: {'kernel': 'rbf', 'C': 92.63836943605664, 'gamma': 0.03754424939481877, 'epsilon': 0.8230215439601409}. Best is trial 88 with value: 0.3542875001421725.
[I 2024-12-03 18:46:23,667] Trial 816 finished with value: 1.1541349110327992 and parameters: {'kernel': 'poly', 'C': 0.0019307917607361616, 'gamma': 0.02829527019507282, 'epsilon': 0.5530240078414229}. Best is trial 88 with value: 0.3542875001421725.
[I 2024-12-03 18:46:23,698] Trial 815 finished with value: 0.3876947584382555 and parameters: {'kernel': 'rbf', 'C': 86.31731461902632, 'gamma': 0.01696113694128811, 'epsilon': 0.12466410579246166}. Best is trial 88 with value: 0.3542875001421725.
[I 2024-12-03 18:46:23,926] Trial 814 finished with value: 0.41396258455184654 and parameters: {'kernel': 'rbf', 'C': 94.47216304146703, 'gamma': 0.010205293308512458, 'epsilon': 0.1144611026084853}. Best is trial 88 with value: 0.3542875001421725.
[I 2024-12-03 18:46:24,080] Trial 818 finished with value: 0.35783285739540377 and parameters: {'kernel': 'rbf', 'C': 96.843011084026, 'gamma': 0.03596281390179215, 'epsilon': 0.21916086355074593}. Best is trial 88 with value: 0.3542875001421725.
[I 2024-12-03 18:46:24,083] Trial 817 finished with value: 0.41227536780689117 and parameters: {'kernel': 'rbf', 'C': 90.59997165637068, 'gamma': 0.009967052513584332, 'epsilon': 0.13426081937730275}. Best is trial 88 with value: 0.3542875001421725.
[I 2024-12-03 18:46:26,556] Trial 820 finished with value: 0.3597437317562145 and parameters: {'kernel': 'rbf', 'C': 93.37098432286209, 'gamma': 0.03762670792973324, 'epsilon': 0.1580127297416106}. Best is trial 88 with value: 0.3542875001421725.
[I 2024-12-03 18:46:26,786] Trial 819 finished with value: 219.8738288107766 and parameters: {'kernel': 'sigmoid', 'C': 8.693734088951532, 'gamma': 0.3200837506703538, 'epsilon': 0.19455162711666266}. Best is trial 88 with value: 0.3542875001421725.
[I 2024-12-03 18:46:26,810] Trial 822 finished with value: 0.42999665915837576 and parameters: {'kernel': 'rbf', 'C': 17.10479356470929, 'gamma': 0.01851123536143894, 'epsilon': 0.19608281246259907}. Best is trial 88 with value: 0.3542875001421725.
[I 2024-12-03 18:46:27,673] Trial 680 finished with value: 0.7684968270833517 and parameters: {'kernel': 'linear', 'C': 74.1214637149887, 'gamma': 0.02896155879739993, 'epsilon': 0.15023047544561316}. Best is trial 88 with value: 0.3542875001421725.
[I 2024-12-03 18:46:27,954] Trial 821 finished with value: 0.4396823561060237 and parameters: {'kernel': 'rbf', 'C': 14.095268585518832, 'gamma': 0.02681548518670504, 'epsilon': 0.024306524067057605}. Best is trial 88 with value: 0.3542875001421725.
[I 2024-12-03 18:46:28,237] Trial 823 finished with value: 0.43195033336915534 and parameters: {'kernel': 'rbf', 'C': 23.802131026445718, 'gamma': 0.020143400849767783, 'epsilon': 0.02218656777306837}. Best is trial 88 with value: 0.3542875001421725.
[I 2024-12-03 18:46:29,577] Trial 824 finished with value: 0.517649512766433 and parameters: {'kernel': 'rbf', 'C': 17.463330448837535, 'gamma': 0.2043193711067407, 'epsilon': 0.11599390690596995}. Best is trial 88 with value: 0.3542875001421725.
[I 2024-12-03 18:46:30,573] Trial 825 finished with value: 0.3736517115386109 and parameters: {'kernel': 'rbf', 'C': 94.80404438310578, 'gamma': 0.01597506165431067, 'epsilon': 0.31405712259108487}. Best is trial 88 with value: 0.3542875001421725.
[I 2024-12-03 18:46:30,935] Trial 827 finished with value: 0.3700591089934012 and parameters: {'kernel': 'rbf', 'C': 92.21161856426241, 'gamma': 0.023939805687285643, 'epsilon': 0.1851632475747725}. Best is trial 88 with value: 0.3542875001421725.
[I 2024-12-03 18:46:31,486] Trial 828 finished with value: 0.5458581377729613 and parameters: {'kernel': 'rbf', 'C': 97.8217251599871, 'gamma': 0.2282450736897795, 'epsilon': 0.15280893289975503}. Best is trial 88 with value: 0.3542875001421725.
[I 2024-12-03 18:46:31,755] Trial 829 finished with value: 0.44918425556860053 and parameters: {'kernel': 'rbf', 'C': 88.59944116814692, 'gamma': 0.14725757535924275, 'epsilon': 0.0803457115139939}. Best is trial 88 with value: 0.3542875001421725.
[I 2024-12-03 18:46:32,196] Trial 826 finished with value: 0.37765610199675753 and parameters: {'kernel': 'rbf', 'C': 33.72997710847942, 'gamma': 0.04792032436648851, 'epsilon': 0.05947647298615443}. Best is trial 88 with value: 0.3542875001421725.
[I 2024-12-03 18:46:32,819] Trial 830 finished with value: 1.0007752484064796 and parameters: {'kernel': 'poly', 'C': 98.66953448704379, 'gamma': 0.001011512785794962, 'epsilon': 0.10656106244320937}. Best is trial 88 with value: 0.3542875001421725.
[I 2024-12-03 18:46:33,458] Trial 831 finished with value: 1.0629774801341718 and parameters: {'kernel': 'sigmoid', 'C': 0.046239158543016814, 'gamma': 0.0001355515923545361, 'epsilon': 0.5437758361818488}. Best is trial 88 with value: 0.3542875001421725.
[I 2024-12-03 18:46:34,229] Trial 832 finished with value: 0.3947955270244461 and parameters: {'kernel': 'rbf', 'C': 20.813883888412047, 'gamma': 0.04527869513988855, 'epsilon': 0.21095282816622501}. Best is trial 88 with value: 0.3542875001421725.
[I 2024-12-03 18:46:35,679] Trial 834 finished with value: 0.47257512720703004 and parameters: {'kernel': 'rbf', 'C': 13.162294079297586, 'gamma': 0.001850440115047594, 'epsilon': 0.05378259479327759}. Best is trial 88 with value: 0.3542875001421725.
[I 2024-12-03 18:46:35,968] Trial 837 finished with value: 0.4769580705210875 and parameters: {'kernel': 'rbf', 'C': 24.409774032044883, 'gamma': 0.11534111863947104, 'epsilon': 0.3067257529016456}. Best is trial 88 with value: 0.3542875001421725.
[I 2024-12-03 18:46:36,069] Trial 835 finished with value: 0.3609161249151765 and parameters: {'kernel': 'rbf', 'C': 74.04015504932497, 'gamma': 0.04772660939425571, 'epsilon': 0.06495627083891957}. Best is trial 88 with value: 0.3542875001421725.
[I 2024-12-03 18:46:36,704] Trial 838 finished with value: 0.45332511837501294 and parameters: {'kernel': 'rbf', 'C': 15.331714903430866, 'gamma': 0.11754798681576975, 'epsilon': 0.1928642161786459}. Best is trial 88 with value: 0.3542875001421725.
[I 2024-12-03 18:46:36,863] Trial 836 finished with value: 0.3727421286878122 and parameters: {'kernel': 'rbf', 'C': 96.73476113717675, 'gamma': 0.019923110411725915, 'epsilon': 0.0692094326718545}. Best is trial 88 with value: 0.3542875001421725.
[I 2024-12-03 18:46:39,032] Trial 839 finished with value: 0.36606238317768586 and parameters: {'kernel': 'rbf', 'C': 92.5129175984009, 'gamma': 0.024793284910521754, 'epsilon': 0.09916102396003282}. Best is trial 88 with value: 0.3542875001421725.
[I 2024-12-03 18:46:40,173] Trial 841 finished with value: 75.93936645427704 and parameters: {'kernel': 'sigmoid', 'C': 9.8009368771772, 'gamma': 0.005739997612291603, 'epsilon': 0.1460130008399408}. Best is trial 88 with value: 0.3542875001421725.
[I 2024-12-03 18:46:40,379] Trial 842 finished with value: 0.5822326334589008 and parameters: {'kernel': 'rbf', 'C': 98.12057273161425, 'gamma': 0.23554688327901083, 'epsilon': 0.2752595701369611}. Best is trial 88 with value: 0.3542875001421725.
[I 2024-12-03 18:46:40,789] Trial 843 finished with value: 0.39445465284241316 and parameters: {'kernel': 'rbf', 'C': 25.246797143247072, 'gamma': 0.03874946435378319, 'epsilon': 0.11899216821844}. Best is trial 88 with value: 0.3542875001421725.
[I 2024-12-03 18:46:40,790] Trial 840 finished with value: 0.3794012082290678 and parameters: {'kernel': 'rbf', 'C': 80.60752637427478, 'gamma': 0.07282996026969261, 'epsilon': 0.047238141053797734}. Best is trial 88 with value: 0.3542875001421725.
[I 2024-12-03 18:46:41,727] Trial 844 finished with value: 2.1971137594792887 and parameters: {'kernel': 'poly', 'C': 0.49678122549514825, 'gamma': 0.014927684641731323, 'epsilon': 0.008295651059785886}. Best is trial 88 with value: 0.3542875001421725.
[I 2024-12-03 18:46:41,923] Trial 845 finished with value: 0.40668634812347165 and parameters: {'kernel': 'rbf', 'C': 22.7291700225284, 'gamma': 0.017035454902730764, 'epsilon': 0.29346529920629894}. Best is trial 88 with value: 0.3542875001421725.
[I 2024-12-03 18:46:42,448] Trial 846 finished with value: 0.40514815253437947 and parameters: {'kernel': 'rbf', 'C': 16.718644895924783, 'gamma': 0.05503746690607013, 'epsilon': 0.2050398239734755}. Best is trial 88 with value: 0.3542875001421725.
[I 2024-12-03 18:46:43,530] Trial 848 finished with value: 0.38557655577737737 and parameters: {'kernel': 'rbf', 'C': 26.906600423220787, 'gamma': 0.04962262997693129, 'epsilon': 0.07854072686383559}. Best is trial 88 with value: 0.3542875001421725.
[I 2024-12-03 18:46:43,607] Trial 849 finished with value: 0.6367697104857373 and parameters: {'kernel': 'rbf', 'C': 8.490325473582576, 'gamma': 0.014251860099580918, 'epsilon': 0.8977829885120314}. Best is trial 88 with value: 0.3542875001421725.
[I 2024-12-03 18:46:44,264] Trial 851 finished with value: 0.6264069372971852 and parameters: {'kernel': 'rbf', 'C': 85.66211521041377, 'gamma': 0.0836572387760086, 'epsilon': 0.736501789916715}. Best is trial 88 with value: 0.3542875001421725.
[I 2024-12-03 18:46:44,265] Trial 850 finished with value: 0.5007379477739035 and parameters: {'kernel': 'rbf', 'C': 2.2095300859534825, 'gamma': 0.05134796138380002, 'epsilon': 0.15426979393738194}. Best is trial 88 with value: 0.3542875001421725.
[I 2024-12-03 18:46:45,098] Trial 853 finished with value: 0.39616445824216695 and parameters: {'kernel': 'rbf', 'C': 21.473244672801556, 'gamma': 0.03446298081453736, 'epsilon': 0.24267884822397642}. Best is trial 88 with value: 0.3542875001421725.
[I 2024-12-03 18:46:46,156] Trial 852 finished with value: 0.35872922978409205 and parameters: {'kernel': 'rbf', 'C': 99.41227958862302, 'gamma': 0.04411595178976887, 'epsilon': 0.07245911251211117}. Best is trial 88 with value: 0.3542875001421725.
[I 2024-12-03 18:46:46,273] Trial 854 finished with value: 0.4109595195320674 and parameters: {'kernel': 'rbf', 'C': 13.358143288365222, 'gamma': 0.009029693444385629, 'epsilon': 0.1560382831271115}. Best is trial 88 with value: 0.3542875001421725.
[I 2024-12-03 18:46:46,591] Trial 855 finished with value: 0.3586285884871021 and parameters: {'kernel': 'rbf', 'C': 86.64795356838466, 'gamma': 0.03794881826379336, 'epsilon': 0.23207735225867884}. Best is trial 88 with value: 0.3542875001421725.
[I 2024-12-03 18:46:47,304] Trial 856 finished with value: 0.3983462010347196 and parameters: {'kernel': 'rbf', 'C': 20.72007555618177, 'gamma': 0.07033043868171963, 'epsilon': 0.1251654353416008}. Best is trial 88 with value: 0.3542875001421725.
[I 2024-12-03 18:46:48,050] Trial 858 finished with value: 1.3095137927907285 and parameters: {'kernel': 'poly', 'C': 0.8538390334971145, 'gamma': 0.001783313157664307, 'epsilon': 0.9484076552694802}. Best is trial 88 with value: 0.3542875001421725.
[I 2024-12-03 18:46:48,233] Trial 857 finished with value: 0.3764552039088794 and parameters: {'kernel': 'rbf', 'C': 93.29755467115676, 'gamma': 0.057061195446459406, 'epsilon': 0.2633050207802583}. Best is trial 88 with value: 0.3542875001421725.
[I 2024-12-03 18:46:48,682] Trial 859 finished with value: 0.3812712976184248 and parameters: {'kernel': 'rbf', 'C': 94.06736920943764, 'gamma': 0.012255117686319681, 'epsilon': 0.34967096392025787}. Best is trial 88 with value: 0.3542875001421725.
[I 2024-12-03 18:46:50,173] Trial 860 finished with value: 0.3606415374697952 and parameters: {'kernel': 'rbf', 'C': 83.45545122476997, 'gamma': 0.05376269912352017, 'epsilon': 0.06392277892407178}. Best is trial 88 with value: 0.3542875001421725.
[I 2024-12-03 18:46:50,279] Trial 861 finished with value: 0.5978959950752933 and parameters: {'kernel': 'rbf', 'C': 92.12187900126827, 'gamma': 0.32660297077133077, 'epsilon': 0.07925384742963164}. Best is trial 88 with value: 0.3542875001421725.
[I 2024-12-03 18:46:51,602] Trial 862 finished with value: 0.3581571204537533 and parameters: {'kernel': 'rbf', 'C': 93.4612853538024, 'gamma': 0.03964112714172488, 'epsilon': 0.13684882582467114}. Best is trial 88 with value: 0.3542875001421725.
[I 2024-12-03 18:46:51,994] Trial 54 finished with value: 1.5292871387957971 and parameters: {'kernel': 'poly', 'C': 15.243972199634904, 'gamma': 0.058246559001819416, 'epsilon': 0.027568550039138474}. Best is trial 88 with value: 0.3542875001421725.
[I 2024-12-03 18:46:52,320] Trial 863 finished with value: 0.36820353229525693 and parameters: {'kernel': 'rbf', 'C': 88.86980790221227, 'gamma': 0.023262169290348883, 'epsilon': 0.05446825320257786}. Best is trial 88 with value: 0.3542875001421725.
[I 2024-12-03 18:46:53,071] Trial 864 finished with value: 0.36841133619519273 and parameters: {'kernel': 'rbf', 'C': 73.35060245261681, 'gamma': 0.027408711904662632, 'epsilon': 0.3279685199036018}. Best is trial 88 with value: 0.3542875001421725.
[I 2024-12-03 18:46:53,306] Trial 865 finished with value: 0.4030375967560821 and parameters: {'kernel': 'rbf', 'C': 22.87569259747366, 'gamma': 0.027335835763088435, 'epsilon': 0.19107594505739017}. Best is trial 88 with value: 0.3542875001421725.
[I 2024-12-03 18:46:54,100] Trial 868 finished with value: 0.4150669657749138 and parameters: {'kernel': 'rbf', 'C': 98.7961472243105, 'gamma': 0.09732275196735679, 'epsilon': 0.20792694545627757}. Best is trial 88 with value: 0.3542875001421725.
