[I 2024-12-03 18:52:27,695] Trial 2307 finished with value: 5.170510886830337 and parameters: {'kernel': 'sigmoid', 'C': 25.28789445008419, 'gamma': 0.004582055122810039, 'epsilon': 0.12198654880850662}. Best is trial 1119 with value: 0.4485361816812923.
[I 2024-12-03 18:52:27,699] Trial 2317 finished with value: 0.4870735006949637 and parameters: {'kernel': 'rbf', 'C': 96.19847992782398, 'gamma': 0.024723465706947733, 'epsilon': 0.010328280361130149}. Best is trial 1119 with value: 0.4485361816812923.
[I 2024-12-03 18:52:27,917] Trial 2319 finished with value: 0.5920366192394418 and parameters: {'kernel': 'rbf', 'C': 5.609455456545021, 'gamma': 0.011276926462009815, 'epsilon': 0.03429015337558974}. Best is trial 1119 with value: 0.4485361816812923.
[I 2024-12-03 18:52:28,568] Trial 2312 finished with value: 0.6087054121258023 and parameters: {'kernel': 'rbf', 'C': 30.892875151212753, 'gamma': 0.09569642180342328, 'epsilon': 0.0820814134480409}. Best is trial 1119 with value: 0.4485361816812923.
[I 2024-12-03 18:52:28,587] Trial 2324 finished with value: 0.46271128532290523 and parameters: {'kernel': 'rbf', 'C': 24.475967791361885, 'gamma': 0.024892662610371697, 'epsilon': 0.03440421948253361}. Best is trial 1119 with value: 0.4485361816812923.
[I 2024-12-03 18:52:29,011] Trial 2316 finished with value: 0.9618754444552033 and parameters: {'kernel': 'poly', 'C': 97.32864247749366, 'gamma': 0.006910756224722008, 'epsilon': 0.028465011742227375}. Best is trial 1119 with value: 0.4485361816812923.
[I 2024-12-03 18:52:29,016] Trial 2315 finished with value: 0.5370250762977541 and parameters: {'kernel': 'rbf', 'C': 98.91162066762891, 'gamma': 0.0031282884967420996, 'epsilon': 0.07530330059150318}. Best is trial 1119 with value: 0.4485361816812923.
[I 2024-12-03 18:52:29,022] Trial 2323 finished with value: 0.5069507700201834 and parameters: {'kernel': 'rbf', 'C': 96.67883601242083, 'gamma': 0.004356133678053216, 'epsilon': 0.07630973904710386}. Best is trial 1119 with value: 0.4485361816812923.
[I 2024-12-03 18:52:29,027] Trial 2322 finished with value: 0.5120607982090646 and parameters: {'kernel': 'rbf', 'C': 97.28322480878873, 'gamma': 0.022425470302761565, 'epsilon': 0.11844000566293882}. Best is trial 1119 with value: 0.4485361816812923.
[I 2024-12-03 18:52:29,173] Trial 2311 finished with value: 0.5839367200111412 and parameters: {'kernel': 'rbf', 'C': 19.608042987259434, 'gamma': 0.0038711005484229673, 'epsilon': 0.061008558355912144}. Best is trial 1119 with value: 0.4485361816812923.
[I 2024-12-03 18:52:30,612] Trial 2321 finished with value: 0.5026319282257956 and parameters: {'kernel': 'rbf', 'C': 94.73834801033965, 'gamma': 0.0051986221432478285, 'epsilon': 0.10116854897358886}. Best is trial 1119 with value: 0.4485361816812923.
[I 2024-12-03 18:52:30,617] Trial 2326 finished with value: 0.5861785412620577 and parameters: {'kernel': 'rbf', 'C': 97.4258966757175, 'gamma': 0.041137132855102725, 'epsilon': 0.028175515268157578}. Best is trial 1119 with value: 0.4485361816812923.
[I 2024-12-03 18:52:30,862] Trial 2320 finished with value: 0.5343158555278493 and parameters: {'kernel': 'rbf', 'C': 23.996246474250242, 'gamma': 0.031123509683446075, 'epsilon': 0.387721944279088}. Best is trial 1119 with value: 0.4485361816812923.
[I 2024-12-03 18:52:31,055] Trial 2325 finished with value: 0.47250460754413676 and parameters: {'kernel': 'rbf', 'C': 98.81949835669515, 'gamma': 0.009067443807194564, 'epsilon': 0.013316438197646321}. Best is trial 1119 with value: 0.4485361816812923.
[I 2024-12-03 18:52:31,474] Trial 2328 finished with value: 0.4511889591967602 and parameters: {'kernel': 'rbf', 'C': 98.51472542094297, 'gamma': 0.015277691295115694, 'epsilon': 0.056491688360680366}. Best is trial 1119 with value: 0.4485361816812923.
[I 2024-12-03 18:52:32,035] Trial 2310 finished with value: 0.5742736089556483 and parameters: {'kernel': 'linear', 'C': 70.88381128264116, 'gamma': 0.038174768130501774, 'epsilon': 0.07238932007246636}. Best is trial 1119 with value: 0.4485361816812923.
[I 2024-12-03 18:52:32,315] Trial 2318 finished with value: 0.5060695510625377 and parameters: {'kernel': 'rbf', 'C': 99.47854819519937, 'gamma': 0.01908551594011895, 'epsilon': 0.14872293777030543}. Best is trial 1119 with value: 0.4485361816812923.
[I 2024-12-03 18:52:32,512] Trial 2331 finished with value: 0.5481123317160536 and parameters: {'kernel': 'rbf', 'C': 5.789159708825758, 'gamma': 0.018903486366285263, 'epsilon': 0.1407194742775441}. Best is trial 1119 with value: 0.4485361816812923.
[I 2024-12-03 18:52:32,827] Trial 2334 finished with value: 0.7486558089374297 and parameters: {'kernel': 'poly', 'C': 0.08120776729237258, 'gamma': 0.3973981110610826, 'epsilon': 0.0426020375906111}. Best is trial 1119 with value: 0.4485361816812923.
[I 2024-12-03 18:52:33,269] Trial 2329 finished with value: 0.4756561140487278 and parameters: {'kernel': 'rbf', 'C': 21.801959416422765, 'gamma': 0.019400185063255453, 'epsilon': 0.07934784894001197}. Best is trial 1119 with value: 0.4485361816812923.
[I 2024-12-03 18:52:33,649] Trial 2338 finished with value: 0.49514294864467145 and parameters: {'kernel': 'rbf', 'C': 92.23827733902075, 'gamma': 0.0054381307977165415, 'epsilon': 0.06300433999246842}. Best is trial 1119 with value: 0.4485361816812923.
[I 2024-12-03 18:52:33,934] Trial 2327 finished with value: 0.46103066958542654 and parameters: {'kernel': 'rbf', 'C': 98.94037190903865, 'gamma': 0.011908693872374941, 'epsilon': 0.023367197961296608}. Best is trial 1119 with value: 0.4485361816812923.
[I 2024-12-03 18:52:34,613] Trial 2330 finished with value: 1.2373974429009578 and parameters: {'kernel': 'rbf', 'C': 0.05798550478209449, 'gamma': 0.31395443503345327, 'epsilon': 0.32026077742462183}. Best is trial 1119 with value: 0.4485361816812923.
[I 2024-12-03 18:52:34,819] Trial 2335 finished with value: 0.5094618311382295 and parameters: {'kernel': 'rbf', 'C': 26.395896771091806, 'gamma': 0.01085175856519088, 'epsilon': 0.03239808672755466}. Best is trial 1119 with value: 0.4485361816812923.
[I 2024-12-03 18:52:35,238] Trial 2333 finished with value: 0.5914802512576082 and parameters: {'kernel': 'rbf', 'C': 22.023015698145485, 'gamma': 0.0031221218622161256, 'epsilon': 0.04083695426661461}. Best is trial 1119 with value: 0.4485361816812923.
[I 2024-12-03 18:52:35,238] Trial 2336 finished with value: 0.605149706479733 and parameters: {'kernel': 'rbf', 'C': 91.04100817998044, 'gamma': 0.097112545844684, 'epsilon': 0.1012775968870423}. Best is trial 1119 with value: 0.4485361816812923.
[I 2024-12-03 18:52:36,906] Trial 2332 finished with value: 0.5478796329474953 and parameters: {'kernel': 'rbf', 'C': 22.42885960492464, 'gamma': 0.0067240812401904914, 'epsilon': 0.19668988403962653}. Best is trial 1119 with value: 0.4485361816812923.
[I 2024-12-03 18:52:37,609] Trial 2344 finished with value: 0.8964137235230497 and parameters: {'kernel': 'linear', 'C': 0.0017912291715093491, 'gamma': 0.015020129411595818, 'epsilon': 0.035549947701896636}. Best is trial 1119 with value: 0.4485361816812923.
[I 2024-12-03 18:52:38,131] Trial 2345 finished with value: 0.5427122575489276 and parameters: {'kernel': 'rbf', 'C': 11.48074898886352, 'gamma': 0.08123045012092932, 'epsilon': 0.03172957081995427}. Best is trial 1119 with value: 0.4485361816812923.
[I 2024-12-03 18:52:38,292] Trial 2346 finished with value: 0.5339633589015075 and parameters: {'kernel': 'rbf', 'C': 91.04973182231875, 'gamma': 0.003687740401221431, 'epsilon': 0.019243523705106635}. Best is trial 1119 with value: 0.4485361816812923.
[I 2024-12-03 18:52:38,436] Trial 2349 finished with value: 0.7162594232015302 and parameters: {'kernel': 'rbf', 'C': 13.41592787068758, 'gamma': 0.0015492084483091065, 'epsilon': 0.15634518563849426}. Best is trial 1119 with value: 0.4485361816812923.
[I 2024-12-03 18:52:38,833] Trial 2353 finished with value: 1.3513913201376193 and parameters: {'kernel': 'rbf', 'C': 0.0026959218930020647, 'gamma': 0.04078050316943418, 'epsilon': 0.0012479235371045502}. Best is trial 1119 with value: 0.4485361816812923.
[I 2024-12-03 18:52:38,843] Trial 2347 finished with value: 0.4582884840806841 and parameters: {'kernel': 'rbf', 'C': 97.21632211412162, 'gamma': 0.010647263175927811, 'epsilon': 0.055724579899586915}. Best is trial 1119 with value: 0.4485361816812923.
[I 2024-12-03 18:52:39,330] Trial 2357 finished with value: 0.5155725913002566 and parameters: {'kernel': 'rbf', 'C': 17.811204929908094, 'gamma': 0.013501139078768687, 'epsilon': 0.10950604077830473}. Best is trial 1119 with value: 0.4485361816812923.
[I 2024-12-03 18:52:39,655] Trial 2341 finished with value: 0.46770593601442056 and parameters: {'kernel': 'rbf', 'C': 28.11616033328347, 'gamma': 0.029714530649043332, 'epsilon': 0.05700655357884889}. Best is trial 1119 with value: 0.4485361816812923.
[I 2024-12-03 18:52:39,864] Trial 2348 finished with value: 0.4860364099213819 and parameters: {'kernel': 'rbf', 'C': 24.108436325289226, 'gamma': 0.04193752689238848, 'epsilon': 0.027800140582589984}. Best is trial 1119 with value: 0.4485361816812923.
[I 2024-12-03 18:52:39,914] Trial 2342 finished with value: 0.5707067265127603 and parameters: {'kernel': 'rbf', 'C': 95.21417736350202, 'gamma': 0.001317197573395072, 'epsilon': 0.20642804967361625}. Best is trial 1119 with value: 0.4485361816812923.
[I 2024-12-03 18:52:40,167] Trial 2339 finished with value: 0.5505221547955982 and parameters: {'kernel': 'rbf', 'C': 95.76002373184743, 'gamma': 0.015085178304453217, 'epsilon': 0.3904180264162487}. Best is trial 1119 with value: 0.4485361816812923.
[I 2024-12-03 18:52:40,535] Trial 2355 finished with value: 0.4541203036220825 and parameters: {'kernel': 'rbf', 'C': 93.57274097024055, 'gamma': 0.011064069332633234, 'epsilon': 0.10445712989203448}. Best is trial 1119 with value: 0.4485361816812923.
[I 2024-12-03 18:52:40,820] Trial 2351 finished with value: 0.6732908556534405 and parameters: {'kernel': 'rbf', 'C': 98.86198343403952, 'gamma': 0.063715184639923, 'epsilon': 0.03904255472760152}. Best is trial 1119 with value: 0.4485361816812923.
[I 2024-12-03 18:52:40,822] Trial 2354 finished with value: 0.4785190666935602 and parameters: {'kernel': 'rbf', 'C': 23.388232087088696, 'gamma': 0.018661489578815634, 'epsilon': 0.1820413311644258}. Best is trial 1119 with value: 0.4485361816812923.
[I 2024-12-03 18:52:40,823] Trial 2352 finished with value: 0.604347882919768 and parameters: {'kernel': 'linear', 'C': 86.49252395617785, 'gamma': 0.003747137519566985, 'epsilon': 0.22587916598741847}. Best is trial 1119 with value: 0.4485361816812923.
[I 2024-12-03 18:52:41,396] Trial 2340 finished with value: 0.5925736072639878 and parameters: {'kernel': 'rbf', 'C': 97.84568656272772, 'gamma': 0.043390140379732385, 'epsilon': 0.052251811485294605}. Best is trial 1119 with value: 0.4485361816812923.
[I 2024-12-03 18:52:41,793] Trial 2356 finished with value: 0.45754696612423496 and parameters: {'kernel': 'rbf', 'C': 94.29275867305384, 'gamma': 0.011973515857249848, 'epsilon': 0.03632276826431863}. Best is trial 1119 with value: 0.4485361816812923.
[I 2024-12-03 18:52:41,868] Trial 2343 finished with value: 0.6818777892068899 and parameters: {'kernel': 'rbf', 'C': 6.257717429865204, 'gamma': 0.0049157137264390595, 'epsilon': 0.09445007694142026}. Best is trial 1119 with value: 0.4485361816812923.
[I 2024-12-03 18:52:42,818] Trial 2365 finished with value: 0.5540558206802509 and parameters: {'kernel': 'rbf', 'C': 20.45986779279578, 'gamma': 0.006207834521898967, 'epsilon': 0.13363934248505946}. Best is trial 1119 with value: 0.4485361816812923.
[I 2024-12-03 18:52:42,884] Trial 2364 finished with value: 109.55804454293043 and parameters: {'kernel': 'sigmoid', 'C': 23.312664699952002, 'gamma': 0.02542122832423151, 'epsilon': 0.06938727072985303}. Best is trial 1119 with value: 0.4485361816812923.
[I 2024-12-03 18:52:42,944] Trial 2358 finished with value: 0.5436554333603466 and parameters: {'kernel': 'rbf', 'C': 92.72289418945283, 'gamma': 0.027424371972610603, 'epsilon': 0.1666198424530274}. Best is trial 1119 with value: 0.4485361816812923.
[I 2024-12-03 18:52:44,478] Trial 2363 finished with value: 0.8519872994014106 and parameters: {'kernel': 'poly', 'C': 12.179439134156326, 'gamma': 0.025143600309223715, 'epsilon': 0.14054154437399533}. Best is trial 1119 with value: 0.4485361816812923.
[I 2024-12-03 18:52:44,479] Trial 2361 finished with value: 0.46939717524110053 and parameters: {'kernel': 'rbf', 'C': 22.05052050813621, 'gamma': 0.021577696080862508, 'epsilon': 0.08828254460809375}. Best is trial 1119 with value: 0.4485361816812923.
[I 2024-12-03 18:52:44,865] Trial 2362 finished with value: 0.5806159026347573 and parameters: {'kernel': 'rbf', 'C': 96.75340813626013, 'gamma': 0.041145802591400084, 'epsilon': 0.06970573588801808}. Best is trial 1119 with value: 0.4485361816812923.
[I 2024-12-03 18:52:47,082] Trial 2367 finished with value: 269.1587230332775 and parameters: {'kernel': 'sigmoid', 'C': 98.51841912494716, 'gamma': 0.015487466000067777, 'epsilon': 0.08065203935688807}. Best is trial 1119 with value: 0.4485361816812923.
[I 2024-12-03 18:52:47,243] Trial 2368 finished with value: 0.5524340701963377 and parameters: {'kernel': 'rbf', 'C': 19.530576475319517, 'gamma': 0.006967553774863543, 'epsilon': 0.02821454630107667}. Best is trial 1119 with value: 0.4485361816812923.
[I 2024-12-03 18:52:47,266] Trial 2360 finished with value: 0.5006690572869568 and parameters: {'kernel': 'rbf', 'C': 94.35722524191564, 'gamma': 0.005874339814034653, 'epsilon': 0.013918100890986261}. Best is trial 1119 with value: 0.4485361816812923.
[I 2024-12-03 18:52:47,886] Trial 2359 finished with value: 0.6702526655535492 and parameters: {'kernel': 'rbf', 'C': 25.784815365687617, 'gamma': 0.0013206924801098738, 'epsilon': 0.112517534087227}. Best is trial 1119 with value: 0.4485361816812923.
[I 2024-12-03 18:52:48,481] Trial 2371 finished with value: 0.5155020750995521 and parameters: {'kernel': 'rbf', 'C': 6.718407720264377, 'gamma': 0.0557005341818983, 'epsilon': 0.10345561202328671}. Best is trial 1119 with value: 0.4485361816812923.
[I 2024-12-03 18:52:48,922] Trial 2369 finished with value: 0.4862153824689705 and parameters: {'kernel': 'rbf', 'C': 96.83787413640921, 'gamma': 0.00685068065591639, 'epsilon': 0.10008207205189587}. Best is trial 1119 with value: 0.4485361816812923.
[I 2024-12-03 18:52:49,073] Trial 2370 finished with value: 0.471121173656446 and parameters: {'kernel': 'rbf', 'C': 92.05633423590827, 'gamma': 0.008741414271064382, 'epsilon': 0.044553583356304896}. Best is trial 1119 with value: 0.4485361816812923.
[I 2024-12-03 18:52:49,200] Trial 2366 finished with value: 0.7057244057756682 and parameters: {'kernel': 'rbf', 'C': 46.121997949125955, 'gamma': 0.4675034919910896, 'epsilon': 0.002855759057947895}. Best is trial 1119 with value: 0.4485361816812923.
[I 2024-12-03 18:52:49,203] Trial 2373 finished with value: 0.4506618050815989 and parameters: {'kernel': 'rbf', 'C': 97.62782514925219, 'gamma': 0.012063348585609746, 'epsilon': 0.05992257950042934}. Best is trial 1119 with value: 0.4485361816812923.
[I 2024-12-03 18:52:49,461] Trial 2372 finished with value: 0.5506213975529063 and parameters: {'kernel': 'rbf', 'C': 86.82607793600876, 'gamma': 0.007985343110182515, 'epsilon': 0.3918259623925737}. Best is trial 1119 with value: 0.4485361816812923.
[I 2024-12-03 18:52:49,996] Trial 2350 finished with value: 0.5029300587829608 and parameters: {'kernel': 'rbf', 'C': 22.715118490840727, 'gamma': 0.012993728008413695, 'epsilon': 0.03925541094750526}. Best is trial 1119 with value: 0.4485361816812923.
[I 2024-12-03 18:52:50,259] Trial 2378 finished with value: 0.4736703015874174 and parameters: {'kernel': 'rbf', 'C': 20.267960988078233, 'gamma': 0.027772400599354773, 'epsilon': 0.09061750739945504}. Best is trial 1119 with value: 0.4485361816812923.
[I 2024-12-03 18:52:50,375] Trial 2374 finished with value: 0.5410329916995241 and parameters: {'kernel': 'rbf', 'C': 19.1089445186977, 'gamma': 0.008009449940189763, 'epsilon': 0.10956296602022363}. Best is trial 1119 with value: 0.4485361816812923.
[I 2024-12-03 18:52:50,718] Trial 2337 finished with value: 2.5555883313831576 and parameters: {'kernel': 'sigmoid', 'C': 15.501690594942644, 'gamma': 0.004270113674503082, 'epsilon': 0.009874671576194925}. Best is trial 1119 with value: 0.4485361816812923.
[I 2024-12-03 18:52:50,937] Trial 2380 finished with value: 0.5868790034203006 and parameters: {'kernel': 'rbf', 'C': 23.833461929542246, 'gamma': 0.003219650552759782, 'epsilon': 0.04478195628000937}. Best is trial 1119 with value: 0.4485361816812923.
[I 2024-12-03 18:52:51,187] Trial 2381 finished with value: 0.4693822437703758 and parameters: {'kernel': 'rbf', 'C': 25.219001866027604, 'gamma': 0.022680960177414264, 'epsilon': 0.01019311305726234}. Best is trial 1119 with value: 0.4485361816812923.
[I 2024-12-03 18:52:51,963] Trial 2384 finished with value: 0.554053404447141 and parameters: {'kernel': 'rbf', 'C': 20.525483635463882, 'gamma': 0.00638839862352983, 'epsilon': 0.038594847927588154}. Best is trial 1119 with value: 0.4485361816812923.
[I 2024-12-03 18:52:52,015] Trial 2389 finished with value: 0.4786479487798325 and parameters: {'kernel': 'rbf', 'C': 97.57587938584167, 'gamma': 0.0074654859587472274, 'epsilon': 0.08580020443341978}. Best is trial 1119 with value: 0.4485361816812923.
[I 2024-12-03 18:52:52,110] Trial 2388 finished with value: 0.4690414824529638 and parameters: {'kernel': 'rbf', 'C': 23.939159422493343, 'gamma': 0.021836569033682775, 'epsilon': 0.011894053550265116}. Best is trial 1119 with value: 0.4485361816812923.
[I 2024-12-03 18:52:52,113] Trial 2377 finished with value: 0.4762753670654711 and parameters: {'kernel': 'rbf', 'C': 21.28484144093464, 'gamma': 0.037178590598112675, 'epsilon': 0.03620192716468379}. Best is trial 1119 with value: 0.4485361816812923.
[I 2024-12-03 18:52:52,127] Trial 2375 finished with value: 0.46278537501446904 and parameters: {'kernel': 'rbf', 'C': 92.21268587738992, 'gamma': 0.0095483238785305, 'epsilon': 0.10519003003449989}. Best is trial 1119 with value: 0.4485361816812923.
[I 2024-12-03 18:52:52,148] Trial 2382 finished with value: 0.5250507229150039 and parameters: {'kernel': 'rbf', 'C': 96.9798078108292, 'gamma': 0.026454846407451268, 'epsilon': 0.10025525609368004}. Best is trial 1119 with value: 0.4485361816812923.
[I 2024-12-03 18:52:52,841] Trial 2391 finished with value: 0.5453377522857987 and parameters: {'kernel': 'rbf', 'C': 18.45507361207861, 'gamma': 0.007535480602667784, 'epsilon': 0.07863940655294685}. Best is trial 1119 with value: 0.4485361816812923.
[I 2024-12-03 18:52:53,620] Trial 2383 finished with value: 0.5727819620600682 and parameters: {'kernel': 'linear', 'C': 95.731950253509, 'gamma': 0.008080952463072756, 'epsilon': 0.06596908914050305}. Best is trial 1119 with value: 0.4485361816812923.
[I 2024-12-03 18:52:53,800] Trial 2386 finished with value: 0.6483525864344312 and parameters: {'kernel': 'rbf', 'C': 98.89582501053206, 'gamma': 0.07626757606038602, 'epsilon': 0.018392521494844452}. Best is trial 1119 with value: 0.4485361816812923.
[I 2024-12-03 18:52:54,363] Trial 2376 finished with value: 0.5133505180692624 and parameters: {'kernel': 'rbf', 'C': 24.803821877241155, 'gamma': 0.011772653020530398, 'epsilon': 0.19565806834988686}. Best is trial 1119 with value: 0.4485361816812923.
[I 2024-12-03 18:52:56,263] Trial 2395 finished with value: 0.5497317158058269 and parameters: {'kernel': 'rbf', 'C': 95.34194284187267, 'gamma': 0.003093807629418149, 'epsilon': 0.1808812878070421}. Best is trial 1119 with value: 0.4485361816812923.
[I 2024-12-03 18:52:56,414] Trial 2385 finished with value: 0.7848278999576581 and parameters: {'kernel': 'poly', 'C': 14.98175336227918, 'gamma': 0.027237197642089036, 'epsilon': 0.03856044623082583}. Best is trial 1119 with value: 0.4485361816812923.
[I 2024-12-03 18:52:57,148] Trial 2387 finished with value: 1.305946425587121 and parameters: {'kernel': 'rbf', 'C': 0.035091392128596056, 'gamma': 0.0017354601768332424, 'epsilon': 0.11857363783399892}. Best is trial 1119 with value: 0.4485361816812923.
[I 2024-12-03 18:52:57,827] Trial 2379 finished with value: 0.5683026211764273 and parameters: {'kernel': 'linear', 'C': 20.774821672469535, 'gamma': 0.0048493587318081555, 'epsilon': 0.052321633453245975}. Best is trial 1119 with value: 0.4485361816812923.
[I 2024-12-03 18:52:57,828] Trial 2398 finished with value: 0.4871729579852955 and parameters: {'kernel': 'rbf', 'C': 92.05138920903129, 'gamma': 0.006863565139162009, 'epsilon': 0.03341154550416703}. Best is trial 1119 with value: 0.4485361816812923.
[I 2024-12-03 18:52:58,092] Trial 2399 finished with value: 1.0581834523453404 and parameters: {'kernel': 'poly', 'C': 0.013694714533258968, 'gamma': 0.8832278398720281, 'epsilon': 0.3820622977896135}. Best is trial 1119 with value: 0.4485361816812923.
[I 2024-12-03 18:52:58,296] Trial 2404 finished with value: 0.5586328958128066 and parameters: {'kernel': 'rbf', 'C': 20.034686439899666, 'gamma': 0.005790116015135384, 'epsilon': 0.09233066205049993}. Best is trial 1119 with value: 0.4485361816812923.
[I 2024-12-03 18:52:58,829] Trial 2400 finished with value: 0.8577342340077663 and parameters: {'kernel': 'sigmoid', 'C': 2.8451303065137354, 'gamma': 0.000857161962749332, 'epsilon': 0.06267903502939375}. Best is trial 1119 with value: 0.4485361816812923.
[I 2024-12-03 18:52:58,836] Trial 2396 finished with value: 0.5782777391385178 and parameters: {'kernel': 'rbf', 'C': 98.44563735778331, 'gamma': 0.039502689806375696, 'epsilon': 0.03304658803493769}. Best is trial 1119 with value: 0.4485361816812923.
[I 2024-12-03 18:52:59,103] Trial 2402 finished with value: 0.657475784720819 and parameters: {'kernel': 'rbf', 'C': 5.267435037737058, 'gamma': 0.006887324981348469, 'epsilon': 0.035267635599239434}. Best is trial 1119 with value: 0.4485361816812923.
