[I 2024-12-04 11:58:32,279] Trial 220 finished with value: 0.6776754983458818 and parameters: {'n_estimators': 419, 'max_depth': 33, 'min_samples_split': 17, 'min_samples_leaf': 7, 'max_features': None, 'bootstrap': True, 'criterion': 'absolute_error'}. Best is trial 170 with value: 0.5079262681451786.
[I 2024-12-04 11:58:33,615] Trial 211 finished with value: 0.5215844467056274 and parameters: {'n_estimators': 815, 'max_depth': 14, 'min_samples_split': 7, 'min_samples_leaf': 1, 'max_features': None, 'bootstrap': True, 'criterion': 'squared_error'}. Best is trial 170 with value: 0.5079262681451786.
[I 2024-12-04 11:58:35,488] Trial 223 finished with value: 0.5693259648340746 and parameters: {'n_estimators': 242, 'max_depth': 11, 'min_samples_split': 3, 'min_samples_leaf': 3, 'max_features': None, 'bootstrap': True, 'criterion': 'absolute_error'}. Best is trial 170 with value: 0.5079262681451786.
[I 2024-12-04 11:58:35,512] Trial 219 finished with value: 0.5263049623791558 and parameters: {'n_estimators': 656, 'max_depth': 9, 'min_samples_split': 4, 'min_samples_leaf': 1, 'max_features': None, 'bootstrap': True, 'criterion': 'squared_error'}. Best is trial 170 with value: 0.5079262681451786.
[I 2024-12-04 11:58:35,518] Trial 214 finished with value: 0.512157199226574 and parameters: {'n_estimators': 931, 'max_depth': 18, 'min_samples_split': 6, 'min_samples_leaf': 1, 'max_features': None, 'bootstrap': True, 'criterion': 'squared_error'}. Best is trial 170 with value: 0.5079262681451786.
[I 2024-12-04 11:58:36,303] Trial 227 finished with value: 1.2321753307079832 and parameters: {'n_estimators': 688, 'max_depth': 18, 'min_samples_split': 4, 'min_samples_leaf': 10, 'max_features': 'log2', 'bootstrap': False, 'criterion': 'squared_error'}. Best is trial 170 with value: 0.5079262681451786.
[I 2024-12-04 11:58:36,505] Trial 228 finished with value: 0.8892124129714716 and parameters: {'n_estimators': 827, 'max_depth': 39, 'min_samples_split': 6, 'min_samples_leaf': 2, 'max_features': 'sqrt', 'bootstrap': True, 'criterion': 'squared_error'}. Best is trial 170 with value: 0.5079262681451786.
[I 2024-12-04 11:58:43,074] Trial 229 finished with value: 0.509926913179557 and parameters: {'n_estimators': 935, 'max_depth': 19, 'min_samples_split': 5, 'min_samples_leaf': 1, 'max_features': None, 'bootstrap': True, 'criterion': 'squared_error'}. Best is trial 170 with value: 0.5079262681451786.
[I 2024-12-04 11:58:43,340] Trial 231 finished with value: 0.519896166261881 and parameters: {'n_estimators': 115, 'max_depth': 19, 'min_samples_split': 3, 'min_samples_leaf': 1, 'max_features': None, 'bootstrap': True, 'criterion': 'absolute_error'}. Best is trial 170 with value: 0.5079262681451786.
[I 2024-12-04 11:58:44,031] Trial 237 finished with value: 0.5126987540313247 and parameters: {'n_estimators': 118, 'max_depth': 17, 'min_samples_split': 4, 'min_samples_leaf': 1, 'max_features': None, 'bootstrap': True, 'criterion': 'absolute_error'}. Best is trial 170 with value: 0.5079262681451786.
[I 2024-12-04 11:58:44,577] Trial 225 finished with value: 0.5159264875281702 and parameters: {'n_estimators': 598, 'max_depth': 18, 'min_samples_split': 4, 'min_samples_leaf': 1, 'max_features': None, 'bootstrap': True, 'criterion': 'squared_error'}. Best is trial 170 with value: 0.5079262681451786.
[I 2024-12-04 11:58:45,420] Trial 184 finished with value: 0.5184332906905366 and parameters: {'n_estimators': 872, 'max_depth': 22, 'min_samples_split': 4, 'min_samples_leaf': 1, 'max_features': None, 'bootstrap': True, 'criterion': 'absolute_error'}. Best is trial 170 with value: 0.5079262681451786.
[I 2024-12-04 11:58:45,426] Trial 234 finished with value: 0.9672093147592125 and parameters: {'n_estimators': 300, 'max_depth': 28, 'min_samples_split': 14, 'min_samples_leaf': 2, 'max_features': 'sqrt', 'bootstrap': True, 'criterion': 'absolute_error'}. Best is trial 170 with value: 0.5079262681451786.
[I 2024-12-04 11:58:45,426] Trial 233 finished with value: 0.5989346286101063 and parameters: {'n_estimators': 892, 'max_depth': 47, 'min_samples_split': 9, 'min_samples_leaf': 1, 'max_features': 'sqrt', 'bootstrap': False, 'criterion': 'squared_error'}. Best is trial 170 with value: 0.5079262681451786.
[I 2024-12-04 11:58:45,457] Trial 185 finished with value: 0.5138778752192548 and parameters: {'n_estimators': 982, 'max_depth': 12, 'min_samples_split': 2, 'min_samples_leaf': 1, 'max_features': None, 'bootstrap': True, 'criterion': 'absolute_error'}. Best is trial 170 with value: 0.5079262681451786.
[I 2024-12-04 11:58:46,379] Trial 247 finished with value: 0.5314394847967724 and parameters: {'n_estimators': 124, 'max_depth': 10, 'min_samples_split': 12, 'min_samples_leaf': 1, 'max_features': None, 'bootstrap': True, 'criterion': 'squared_error'}. Best is trial 170 with value: 0.5079262681451786.
[I 2024-12-04 11:58:47,670] Trial 235 finished with value: 1.0592483872091358 and parameters: {'n_estimators': 787, 'max_depth': 6, 'min_samples_split': 7, 'min_samples_leaf': 1, 'max_features': 'sqrt', 'bootstrap': True, 'criterion': 'squared_error'}. Best is trial 170 with value: 0.5079262681451786.
[I 2024-12-04 11:58:48,218] Trial 230 finished with value: 0.5215928836281749 and parameters: {'n_estimators': 804, 'max_depth': 26, 'min_samples_split': 7, 'min_samples_leaf': 1, 'max_features': None, 'bootstrap': True, 'criterion': 'squared_error'}. Best is trial 170 with value: 0.5079262681451786.
[I 2024-12-04 11:58:48,911] Trial 224 finished with value: 0.5132722481318234 and parameters: {'n_estimators': 825, 'max_depth': 24, 'min_samples_split': 5, 'min_samples_leaf': 1, 'max_features': None, 'bootstrap': True, 'criterion': 'squared_error'}. Best is trial 170 with value: 0.5079262681451786.
[I 2024-12-04 11:58:49,817] Trial 236 finished with value: 0.5198098799371931 and parameters: {'n_estimators': 970, 'max_depth': 17, 'min_samples_split': 7, 'min_samples_leaf': 1, 'max_features': None, 'bootstrap': True, 'criterion': 'squared_error'}. Best is trial 170 with value: 0.5079262681451786.
[I 2024-12-04 11:58:50,367] Trial 232 finished with value: 0.5542548556221268 and parameters: {'n_estimators': 866, 'max_depth': 20, 'min_samples_split': 8, 'min_samples_leaf': 2, 'max_features': None, 'bootstrap': True, 'criterion': 'squared_error'}. Best is trial 170 with value: 0.5079262681451786.
[I 2024-12-04 11:58:50,863] Trial 204 finished with value: 0.5540934670902277 and parameters: {'n_estimators': 991, 'max_depth': 5, 'min_samples_split': 5, 'min_samples_leaf': 1, 'max_features': None, 'bootstrap': True, 'criterion': 'absolute_error'}. Best is trial 170 with value: 0.5079262681451786.
[I 2024-12-04 11:58:51,854] Trial 238 finished with value: 0.5281920847138651 and parameters: {'n_estimators': 827, 'max_depth': 14, 'min_samples_split': 8, 'min_samples_leaf': 1, 'max_features': None, 'bootstrap': True, 'criterion': 'squared_error'}. Best is trial 170 with value: 0.5079262681451786.
[I 2024-12-04 11:58:52,431] Trial 240 finished with value: 0.509630186978547 and parameters: {'n_estimators': 945, 'max_depth': 19, 'min_samples_split': 5, 'min_samples_leaf': 1, 'max_features': None, 'bootstrap': True, 'criterion': 'squared_error'}. Best is trial 170 with value: 0.5079262681451786.
[I 2024-12-04 11:58:53,768] Trial 244 finished with value: 0.5114475829123418 and parameters: {'n_estimators': 120, 'max_depth': 13, 'min_samples_split': 4, 'min_samples_leaf': 1, 'max_features': None, 'bootstrap': True, 'criterion': 'absolute_error'}. Best is trial 170 with value: 0.5079262681451786.
[I 2024-12-04 11:58:59,209] Trial 243 finished with value: 0.5216259955153266 and parameters: {'n_estimators': 175, 'max_depth': 12, 'min_samples_split': 3, 'min_samples_leaf': 1, 'max_features': None, 'bootstrap': True, 'criterion': 'absolute_error'}. Best is trial 170 with value: 0.5079262681451786.
[I 2024-12-04 11:59:02,415] Trial 254 finished with value: 0.509063264786846 and parameters: {'n_estimators': 104, 'max_depth': 15, 'min_samples_split': 5, 'min_samples_leaf': 1, 'max_features': None, 'bootstrap': True, 'criterion': 'absolute_error'}. Best is trial 170 with value: 0.5079262681451786.
[I 2024-12-04 11:59:04,807] Trial 239 finished with value: 0.514490229017969 and parameters: {'n_estimators': 830, 'max_depth': 20, 'min_samples_split': 4, 'min_samples_leaf': 1, 'max_features': None, 'bootstrap': True, 'criterion': 'squared_error'}. Best is trial 170 with value: 0.5079262681451786.
[I 2024-12-04 11:59:05,586] Trial 249 finished with value: 0.5160360213765895 and parameters: {'n_estimators': 138, 'max_depth': 23, 'min_samples_split': 5, 'min_samples_leaf': 1, 'max_features': None, 'bootstrap': True, 'criterion': 'absolute_error'}. Best is trial 170 with value: 0.5079262681451786.
[I 2024-12-04 11:59:05,609] Trial 248 finished with value: 0.5092780964866046 and parameters: {'n_estimators': 955, 'max_depth': 17, 'min_samples_split': 5, 'min_samples_leaf': 1, 'max_features': None, 'bootstrap': True, 'criterion': 'squared_error'}. Best is trial 170 with value: 0.5079262681451786.
[I 2024-12-04 11:59:05,699] Trial 255 finished with value: 0.6558065857180437 and parameters: {'n_estimators': 206, 'max_depth': 39, 'min_samples_split': 4, 'min_samples_leaf': 10, 'max_features': None, 'bootstrap': False, 'criterion': 'absolute_error'}. Best is trial 170 with value: 0.5079262681451786.
[I 2024-12-04 11:59:07,147] Trial 251 finished with value: 0.5432128331100857 and parameters: {'n_estimators': 741, 'max_depth': 12, 'min_samples_split': 6, 'min_samples_leaf': 2, 'max_features': None, 'bootstrap': True, 'criterion': 'squared_error'}. Best is trial 170 with value: 0.5079262681451786.
[I 2024-12-04 11:59:11,059] Trial 250 finished with value: 0.5118008233421788 and parameters: {'n_estimators': 831, 'max_depth': 15, 'min_samples_split': 5, 'min_samples_leaf': 1, 'max_features': None, 'bootstrap': True, 'criterion': 'squared_error'}. Best is trial 170 with value: 0.5079262681451786.
[I 2024-12-04 11:59:13,078] Trial 241 finished with value: 0.5226017359026371 and parameters: {'n_estimators': 167, 'max_depth': 11, 'min_samples_split': 7, 'min_samples_leaf': 1, 'max_features': None, 'bootstrap': True, 'criterion': 'absolute_error'}. Best is trial 170 with value: 0.5079262681451786.
[I 2024-12-04 11:59:13,607] Trial 209 finished with value: 0.5311437836385621 and parameters: {'n_estimators': 857, 'max_depth': 35, 'min_samples_split': 9, 'min_samples_leaf': 1, 'max_features': None, 'bootstrap': True, 'criterion': 'absolute_error'}. Best is trial 170 with value: 0.5079262681451786.
[I 2024-12-04 11:59:14,757] Trial 262 finished with value: 0.5118763591352218 and parameters: {'n_estimators': 129, 'max_depth': 14, 'min_samples_split': 4, 'min_samples_leaf': 1, 'max_features': None, 'bootstrap': True, 'criterion': 'absolute_error'}. Best is trial 170 with value: 0.5079262681451786.
[I 2024-12-04 11:59:15,797] Trial 260 finished with value: 0.7672354910557856 and parameters: {'n_estimators': 767, 'max_depth': 49, 'min_samples_split': 23, 'min_samples_leaf': 1, 'max_features': 'log2', 'bootstrap': True, 'criterion': 'squared_error'}. Best is trial 170 with value: 0.5079262681451786.
[I 2024-12-04 11:59:15,962] Trial 265 finished with value: 0.5252489144291315 and parameters: {'n_estimators': 100, 'max_depth': 9, 'min_samples_split': 7, 'min_samples_leaf': 1, 'max_features': None, 'bootstrap': True, 'criterion': 'absolute_error'}. Best is trial 170 with value: 0.5079262681451786.
[I 2024-12-04 11:59:18,153] Trial 263 finished with value: 0.6293585446795107 and parameters: {'n_estimators': 101, 'max_depth': 22, 'min_samples_split': 2, 'min_samples_leaf': 3, 'max_features': None, 'bootstrap': False, 'criterion': 'absolute_error'}. Best is trial 170 with value: 0.5079262681451786.
[I 2024-12-04 11:59:18,779] Trial 268 finished with value: 1.2097000971506198 and parameters: {'n_estimators': 964, 'max_depth': 48, 'min_samples_split': 2, 'min_samples_leaf': 5, 'max_features': 'log2', 'bootstrap': False, 'criterion': 'squared_error'}. Best is trial 170 with value: 0.5079262681451786.
[I 2024-12-04 11:59:18,993] Trial 258 finished with value: 0.5155114751697808 and parameters: {'n_estimators': 117, 'max_depth': 15, 'min_samples_split': 3, 'min_samples_leaf': 1, 'max_features': None, 'bootstrap': True, 'criterion': 'absolute_error'}. Best is trial 170 with value: 0.5079262681451786.
[I 2024-12-04 11:59:19,313] Trial 261 finished with value: 0.5205650661098159 and parameters: {'n_estimators': 165, 'max_depth': 10, 'min_samples_split': 6, 'min_samples_leaf': 1, 'max_features': None, 'bootstrap': True, 'criterion': 'absolute_error'}. Best is trial 170 with value: 0.5079262681451786.
[I 2024-12-04 11:59:20,421] Trial 272 finished with value: 1.2349405095171946 and parameters: {'n_estimators': 527, 'max_depth': 48, 'min_samples_split': 7, 'min_samples_leaf': 7, 'max_features': 'log2', 'bootstrap': True, 'criterion': 'squared_error'}. Best is trial 170 with value: 0.5079262681451786.
[I 2024-12-04 11:59:20,534] Trial 267 finished with value: 0.5270161984186477 and parameters: {'n_estimators': 107, 'max_depth': 44, 'min_samples_split': 8, 'min_samples_leaf': 1, 'max_features': None, 'bootstrap': True, 'criterion': 'absolute_error'}. Best is trial 170 with value: 0.5079262681451786.
[I 2024-12-04 11:59:20,575] Trial 252 finished with value: 0.5122787627504288 and parameters: {'n_estimators': 854, 'max_depth': 22, 'min_samples_split': 5, 'min_samples_leaf': 1, 'max_features': None, 'bootstrap': True, 'criterion': 'squared_error'}. Best is trial 170 with value: 0.5079262681451786.
[I 2024-12-04 11:59:20,956] Trial 269 finished with value: 1.2220707677416438 and parameters: {'n_estimators': 347, 'max_depth': 44, 'min_samples_split': 2, 'min_samples_leaf': 10, 'max_features': 'sqrt', 'bootstrap': True, 'criterion': 'squared_error'}. Best is trial 170 with value: 0.5079262681451786.
[I 2024-12-04 11:59:21,016] Trial 242 finished with value: 0.5195630713254659 and parameters: {'n_estimators': 331, 'max_depth': 50, 'min_samples_split': 6, 'min_samples_leaf': 1, 'max_features': None, 'bootstrap': True, 'criterion': 'absolute_error'}. Best is trial 170 with value: 0.5079262681451786.
[I 2024-12-04 11:59:21,253] Trial 257 finished with value: 1.3160235510679001 and parameters: {'n_estimators': 723, 'max_depth': 24, 'min_samples_split': 9, 'min_samples_leaf': 8, 'max_features': 'sqrt', 'bootstrap': True, 'criterion': 'absolute_error'}. Best is trial 170 with value: 0.5079262681451786.
[I 2024-12-04 11:59:21,437] Trial 259 finished with value: 0.5136078814768257 and parameters: {'n_estimators': 929, 'max_depth': 23, 'min_samples_split': 4, 'min_samples_leaf': 1, 'max_features': None, 'bootstrap': True, 'criterion': 'squared_error'}. Best is trial 170 with value: 0.5079262681451786.
[I 2024-12-04 11:59:27,221] Trial 273 finished with value: 0.5117078301883861 and parameters: {'n_estimators': 125, 'max_depth': 14, 'min_samples_split': 6, 'min_samples_leaf': 1, 'max_features': None, 'bootstrap': True, 'criterion': 'absolute_error'}. Best is trial 170 with value: 0.5079262681451786.
[I 2024-12-04 11:59:27,247] Trial 264 finished with value: 0.5240943038415287 and parameters: {'n_estimators': 955, 'max_depth': 8, 'min_samples_split': 5, 'min_samples_leaf': 1, 'max_features': None, 'bootstrap': True, 'criterion': 'squared_error'}. Best is trial 170 with value: 0.5079262681451786.
[I 2024-12-04 11:59:29,691] Trial 271 finished with value: 0.5152901277990949 and parameters: {'n_estimators': 953, 'max_depth': 11, 'min_samples_split': 5, 'min_samples_leaf': 1, 'max_features': None, 'bootstrap': True, 'criterion': 'squared_error'}. Best is trial 170 with value: 0.5079262681451786.
[I 2024-12-04 11:59:31,075] Trial 274 finished with value: 0.5545796858789013 and parameters: {'n_estimators': 177, 'max_depth': 14, 'min_samples_split': 3, 'min_samples_leaf': 2, 'max_features': None, 'bootstrap': True, 'criterion': 'absolute_error'}. Best is trial 170 with value: 0.5079262681451786.
[I 2024-12-04 11:59:32,026] Trial 266 finished with value: 0.5126061926854851 and parameters: {'n_estimators': 960, 'max_depth': 19, 'min_samples_split': 4, 'min_samples_leaf': 1, 'max_features': None, 'bootstrap': True, 'criterion': 'squared_error'}. Best is trial 170 with value: 0.5079262681451786.
[I 2024-12-04 11:59:32,028] Trial 277 finished with value: 0.5494492300516293 and parameters: {'n_estimators': 130, 'max_depth': 13, 'min_samples_split': 4, 'min_samples_leaf': 2, 'max_features': None, 'bootstrap': True, 'criterion': 'absolute_error'}. Best is trial 170 with value: 0.5079262681451786.
[I 2024-12-04 11:59:32,219] Trial 270 finished with value: 0.5138820363982494 and parameters: {'n_estimators': 977, 'max_depth': 23, 'min_samples_split': 6, 'min_samples_leaf': 1, 'max_features': None, 'bootstrap': True, 'criterion': 'squared_error'}. Best is trial 170 with value: 0.5079262681451786.
[I 2024-12-04 11:59:33,029] Trial 275 finished with value: 0.5172175158248501 and parameters: {'n_estimators': 152, 'max_depth': 11, 'min_samples_split': 3, 'min_samples_leaf': 1, 'max_features': None, 'bootstrap': True, 'criterion': 'absolute_error'}. Best is trial 170 with value: 0.5079262681451786.
[I 2024-12-04 11:59:33,228] Trial 278 finished with value: 0.5560779140378984 and parameters: {'n_estimators': 100, 'max_depth': 19, 'min_samples_split': 5, 'min_samples_leaf': 2, 'max_features': None, 'bootstrap': True, 'criterion': 'absolute_error'}. Best is trial 170 with value: 0.5079262681451786.
[I 2024-12-04 11:59:33,898] Trial 282 finished with value: 0.9328480853422025 and parameters: {'n_estimators': 866, 'max_depth': 17, 'min_samples_split': 3, 'min_samples_leaf': 1, 'max_features': 'log2', 'bootstrap': False, 'criterion': 'squared_error'}. Best is trial 170 with value: 0.5079262681451786.
[I 2024-12-04 11:59:34,065] Trial 245 finished with value: 0.5618711251630492 and parameters: {'n_estimators': 865, 'max_depth': 21, 'min_samples_split': 2, 'min_samples_leaf': 2, 'max_features': None, 'bootstrap': True, 'criterion': 'absolute_error'}. Best is trial 170 with value: 0.5079262681451786.
[I 2024-12-04 11:59:35,240] Trial 287 finished with value: 1.2086754762085254 and parameters: {'n_estimators': 124, 'max_depth': 27, 'min_samples_split': 8, 'min_samples_leaf': 7, 'max_features': 'sqrt', 'bootstrap': True, 'criterion': 'squared_error'}. Best is trial 170 with value: 0.5079262681451786.
[I 2024-12-04 11:59:36,456] Trial 253 finished with value: 0.556231617989453 and parameters: {'n_estimators': 868, 'max_depth': 5, 'min_samples_split': 2, 'min_samples_leaf': 1, 'max_features': None, 'bootstrap': True, 'criterion': 'absolute_error'}. Best is trial 170 with value: 0.5079262681451786.
[I 2024-12-04 11:59:39,768] Trial 280 finished with value: 0.5149020148569511 and parameters: {'n_estimators': 114, 'max_depth': 21, 'min_samples_split': 6, 'min_samples_leaf': 1, 'max_features': None, 'bootstrap': True, 'criterion': 'absolute_error'}. Best is trial 170 with value: 0.5079262681451786.
[I 2024-12-04 11:59:40,083] Trial 285 finished with value: 1.0789858096229639 and parameters: {'n_estimators': 105, 'max_depth': 18, 'min_samples_split': 10, 'min_samples_leaf': 1, 'max_features': 'log2', 'bootstrap': True, 'criterion': 'absolute_error'}. Best is trial 170 with value: 0.5079262681451786.
[I 2024-12-04 11:59:40,153] Trial 276 finished with value: 0.6234267170743715 and parameters: {'n_estimators': 590, 'max_depth': 17, 'min_samples_split': 3, 'min_samples_leaf': 5, 'max_features': None, 'bootstrap': False, 'criterion': 'absolute_error'}. Best is trial 170 with value: 0.5079262681451786.
[I 2024-12-04 11:59:40,160] Trial 292 finished with value: 0.517360330299838 and parameters: {'n_estimators': 145, 'max_depth': 14, 'min_samples_split': 5, 'min_samples_leaf': 1, 'max_features': None, 'bootstrap': True, 'criterion': 'squared_error'}. Best is trial 170 with value: 0.5079262681451786.
[I 2024-12-04 11:59:40,378] Trial 284 finished with value: 1.3672460472930645 and parameters: {'n_estimators': 804, 'max_depth': 5, 'min_samples_split': 24, 'min_samples_leaf': 15, 'max_features': 'log2', 'bootstrap': True, 'criterion': 'absolute_error'}. Best is trial 170 with value: 0.5079262681451786.
[I 2024-12-04 11:59:41,614] Trial 290 finished with value: 1.1661748473889921 and parameters: {'n_estimators': 138, 'max_depth': 11, 'min_samples_split': 10, 'min_samples_leaf': 1, 'max_features': 'log2', 'bootstrap': True, 'criterion': 'absolute_error'}. Best is trial 170 with value: 0.5079262681451786.
[I 2024-12-04 11:59:41,639] Trial 279 finished with value: 0.5208697401703498 and parameters: {'n_estimators': 845, 'max_depth': 20, 'min_samples_split': 7, 'min_samples_leaf': 1, 'max_features': None, 'bootstrap': True, 'criterion': 'squared_error'}. Best is trial 170 with value: 0.5079262681451786.
[I 2024-12-04 11:59:41,663] Trial 297 finished with value: 0.7070990086334218 and parameters: {'n_estimators': 181, 'max_depth': 12, 'min_samples_split': 7, 'min_samples_leaf': 14, 'max_features': None, 'bootstrap': False, 'criterion': 'squared_error'}. Best is trial 170 with value: 0.5079262681451786.
[I 2024-12-04 11:59:42,689] Trial 286 finished with value: 0.510804359486979 and parameters: {'n_estimators': 151, 'max_depth': 14, 'min_samples_split': 5, 'min_samples_leaf': 1, 'max_features': None, 'bootstrap': True, 'criterion': 'absolute_error'}. Best is trial 170 with value: 0.5079262681451786.
[I 2024-12-04 11:59:42,845] Trial 291 finished with value: 0.5256667077483556 and parameters: {'n_estimators': 354, 'max_depth': 13, 'min_samples_split': 7, 'min_samples_leaf': 1, 'max_features': None, 'bootstrap': True, 'criterion': 'squared_error'}. Best is trial 170 with value: 0.5079262681451786.
