[I 2024-12-04 14:59:39,658] Trial 574 finished with value: 0.4652319332310069 and parameters: {'n_estimators': 768, 'max_depth': 41, 'min_samples_split': 3, 'min_samples_leaf': 2, 'max_features': None, 'bootstrap': True, 'criterion': 'squared_error'}. Best is trial 223 with value: 0.4188398890260366.
[I 2024-12-04 14:59:39,965] Trial 585 finished with value: 0.6315514364788728 and parameters: {'n_estimators': 971, 'max_depth': 48, 'min_samples_split': 2, 'min_samples_leaf': 2, 'max_features': 'sqrt', 'bootstrap': False, 'criterion': 'squared_error'}. Best is trial 223 with value: 0.4188398890260366.
[I 2024-12-04 14:59:43,846] Trial 592 finished with value: 1.0677263322978716 and parameters: {'n_estimators': 285, 'max_depth': 29, 'min_samples_split': 46, 'min_samples_leaf': 12, 'max_features': 'log2', 'bootstrap': False, 'criterion': 'squared_error'}. Best is trial 223 with value: 0.4188398890260366.
[I 2024-12-04 14:59:46,472] Trial 575 finished with value: 0.42108913759742916 and parameters: {'n_estimators': 827, 'max_depth': 33, 'min_samples_split': 2, 'min_samples_leaf': 1, 'max_features': None, 'bootstrap': True, 'criterion': 'squared_error'}. Best is trial 223 with value: 0.4188398890260366.
[I 2024-12-04 14:59:46,783] Trial 595 finished with value: 0.9591760872747177 and parameters: {'n_estimators': 155, 'max_depth': 39, 'min_samples_split': 2, 'min_samples_leaf': 9, 'max_features': 'sqrt', 'bootstrap': False, 'criterion': 'squared_error'}. Best is trial 223 with value: 0.4188398890260366.
[I 2024-12-04 14:59:51,845] Trial 579 finished with value: 0.42286646522257726 and parameters: {'n_estimators': 666, 'max_depth': 47, 'min_samples_split': 2, 'min_samples_leaf': 1, 'max_features': None, 'bootstrap': True, 'criterion': 'squared_error'}. Best is trial 223 with value: 0.4188398890260366.
[I 2024-12-04 14:59:52,587] Trial 578 finished with value: 0.423838099480212 and parameters: {'n_estimators': 757, 'max_depth': 41, 'min_samples_split': 3, 'min_samples_leaf': 1, 'max_features': None, 'bootstrap': True, 'criterion': 'squared_error'}. Best is trial 223 with value: 0.4188398890260366.
[I 2024-12-04 14:59:52,599] Trial 577 finished with value: 0.4206370529694929 and parameters: {'n_estimators': 989, 'max_depth': 33, 'min_samples_split': 2, 'min_samples_leaf': 1, 'max_features': None, 'bootstrap': True, 'criterion': 'squared_error'}. Best is trial 223 with value: 0.4188398890260366.
[I 2024-12-04 14:59:52,959] Trial 601 finished with value: 0.9939691760545971 and parameters: {'n_estimators': 130, 'max_depth': 6, 'min_samples_split': 3, 'min_samples_leaf': 6, 'max_features': 'sqrt', 'bootstrap': True, 'criterion': 'absolute_error'}. Best is trial 223 with value: 0.4188398890260366.
[I 2024-12-04 14:59:53,310] Trial 598 finished with value: 0.9671545169966711 and parameters: {'n_estimators': 916, 'max_depth': 14, 'min_samples_split': 50, 'min_samples_leaf': 10, 'max_features': 'sqrt', 'bootstrap': False, 'criterion': 'squared_error'}. Best is trial 223 with value: 0.4188398890260366.
[I 2024-12-04 14:59:54,061] Trial 593 finished with value: 0.5245549224542451 and parameters: {'n_estimators': 636, 'max_depth': 37, 'min_samples_split': 2, 'min_samples_leaf': 1, 'max_features': 'sqrt', 'bootstrap': True, 'criterion': 'squared_error'}. Best is trial 223 with value: 0.4188398890260366.
[I 2024-12-04 14:59:55,469] Trial 583 finished with value: 0.4209134276306523 and parameters: {'n_estimators': 782, 'max_depth': 37, 'min_samples_split': 2, 'min_samples_leaf': 1, 'max_features': None, 'bootstrap': True, 'criterion': 'squared_error'}. Best is trial 223 with value: 0.4188398890260366.
[I 2024-12-04 14:59:55,776] Trial 597 finished with value: 0.9437292768451608 and parameters: {'n_estimators': 124, 'max_depth': 15, 'min_samples_split': 10, 'min_samples_leaf': 2, 'max_features': 'log2', 'bootstrap': False, 'criterion': 'squared_error'}. Best is trial 223 with value: 0.4188398890260366.
[I 2024-12-04 14:59:55,829] Trial 587 finished with value: 0.5281741924642748 and parameters: {'n_estimators': 968, 'max_depth': 41, 'min_samples_split': 2, 'min_samples_leaf': 1, 'max_features': None, 'bootstrap': False, 'criterion': 'squared_error'}. Best is trial 223 with value: 0.4188398890260366.
[I 2024-12-04 14:59:56,314] Trial 582 finished with value: 0.5728239881051547 and parameters: {'n_estimators': 632, 'max_depth': 42, 'min_samples_split': 8, 'min_samples_leaf': 1, 'max_features': 'sqrt', 'bootstrap': True, 'criterion': 'absolute_error'}. Best is trial 223 with value: 0.4188398890260366.
[I 2024-12-04 14:59:59,191] Trial 586 finished with value: 0.4204972165367326 and parameters: {'n_estimators': 963, 'max_depth': 43, 'min_samples_split': 2, 'min_samples_leaf': 1, 'max_features': None, 'bootstrap': True, 'criterion': 'squared_error'}. Best is trial 223 with value: 0.4188398890260366.
[I 2024-12-04 14:59:59,771] Trial 591 finished with value: 0.5582680531321711 and parameters: {'n_estimators': 716, 'max_depth': 30, 'min_samples_split': 2, 'min_samples_leaf': 1, 'max_features': 'sqrt', 'bootstrap': True, 'criterion': 'squared_error'}. Best is trial 590 with value: 0.4185444504443197.
[I 2024-12-04 15:00:00,449] Trial 590 finished with value: 0.4185444504443197 and parameters: {'n_estimators': 766, 'max_depth': 40, 'min_samples_split': 2, 'min_samples_leaf': 1, 'max_features': None, 'bootstrap': True, 'criterion': 'squared_error'}. Best is trial 590 with value: 0.4185444504443197.
[I 2024-12-04 15:00:00,452] Trial 589 finished with value: 0.6979969201562309 and parameters: {'n_estimators': 813, 'max_depth': 47, 'min_samples_split': 43, 'min_samples_leaf': 12, 'max_features': None, 'bootstrap': True, 'criterion': 'squared_error'}. Best is trial 590 with value: 0.4185444504443197.
[I 2024-12-04 15:00:03,540] Trial 596 finished with value: 0.8661710190217214 and parameters: {'n_estimators': 680, 'max_depth': 40, 'min_samples_split': 2, 'min_samples_leaf': 4, 'max_features': 'sqrt', 'bootstrap': True, 'criterion': 'squared_error'}. Best is trial 590 with value: 0.4185444504443197.
[I 2024-12-04 15:00:03,642] Trial 554 finished with value: 0.506805173303288 and parameters: {'n_estimators': 649, 'max_depth': 17, 'min_samples_split': 18, 'min_samples_leaf': 1, 'max_features': None, 'bootstrap': True, 'criterion': 'absolute_error'}. Best is trial 590 with value: 0.4185444504443197.
[I 2024-12-04 15:00:04,857] Trial 580 finished with value: 0.563420275875147 and parameters: {'n_estimators': 946, 'max_depth': 47, 'min_samples_split': 9, 'min_samples_leaf': 1, 'max_features': 'sqrt', 'bootstrap': True, 'criterion': 'absolute_error'}. Best is trial 590 with value: 0.4185444504443197.
[I 2024-12-04 15:00:06,748] Trial 594 finished with value: 0.4214563478804752 and parameters: {'n_estimators': 818, 'max_depth': 44, 'min_samples_split': 2, 'min_samples_leaf': 1, 'max_features': None, 'bootstrap': True, 'criterion': 'squared_error'}. Best is trial 590 with value: 0.4185444504443197.
[I 2024-12-04 15:00:08,967] Trial 599 finished with value: 1.0477735762671885 and parameters: {'n_estimators': 960, 'max_depth': 8, 'min_samples_split': 34, 'min_samples_leaf': 6, 'max_features': 'log2', 'bootstrap': True, 'criterion': 'absolute_error'}. Best is trial 590 with value: 0.4185444504443197.
[I 2024-12-04 15:00:14,712] Trial 600 finished with value: 0.4327877923367417 and parameters: {'n_estimators': 896, 'max_depth': 34, 'min_samples_split': 4, 'min_samples_leaf': 1, 'max_features': None, 'bootstrap': True, 'criterion': 'squared_error'}. Best is trial 590 with value: 0.4185444504443197.
[I 2024-12-04 15:00:18,622] Trial 610 finished with value: 0.6833967545970997 and parameters: {'n_estimators': 475, 'max_depth': 10, 'min_samples_split': 2, 'min_samples_leaf': 1, 'max_features': None, 'bootstrap': False, 'criterion': 'squared_error'}. Best is trial 590 with value: 0.4185444504443197.
[I 2024-12-04 15:00:18,700] Trial 604 finished with value: 0.4320090658019134 and parameters: {'n_estimators': 954, 'max_depth': 36, 'min_samples_split': 4, 'min_samples_leaf': 1, 'max_features': None, 'bootstrap': True, 'criterion': 'squared_error'}. Best is trial 590 with value: 0.4185444504443197.
[I 2024-12-04 15:00:19,072] Trial 608 finished with value: 0.4655089756053852 and parameters: {'n_estimators': 806, 'max_depth': 41, 'min_samples_split': 2, 'min_samples_leaf': 2, 'max_features': None, 'bootstrap': True, 'criterion': 'squared_error'}. Best is trial 590 with value: 0.4185444504443197.
[I 2024-12-04 15:00:20,176] Trial 605 finished with value: 0.4651791763236205 and parameters: {'n_estimators': 777, 'max_depth': 46, 'min_samples_split': 2, 'min_samples_leaf': 2, 'max_features': None, 'bootstrap': True, 'criterion': 'squared_error'}. Best is trial 590 with value: 0.4185444504443197.
[I 2024-12-04 15:00:22,669] Trial 602 finished with value: 0.43153536532700376 and parameters: {'n_estimators': 969, 'max_depth': 38, 'min_samples_split': 4, 'min_samples_leaf': 1, 'max_features': None, 'bootstrap': True, 'criterion': 'squared_error'}. Best is trial 590 with value: 0.4185444504443197.
[I 2024-12-04 15:00:25,386] Trial 609 finished with value: 0.4207267322412003 and parameters: {'n_estimators': 727, 'max_depth': 37, 'min_samples_split': 2, 'min_samples_leaf': 1, 'max_features': None, 'bootstrap': True, 'criterion': 'squared_error'}. Best is trial 590 with value: 0.4185444504443197.
[I 2024-12-04 15:00:25,578] Trial 606 finished with value: 0.42007620212438984 and parameters: {'n_estimators': 771, 'max_depth': 38, 'min_samples_split': 2, 'min_samples_leaf': 1, 'max_features': None, 'bootstrap': True, 'criterion': 'squared_error'}. Best is trial 590 with value: 0.4185444504443197.
[I 2024-12-04 15:00:32,126] Trial 613 finished with value: 0.9400788686541361 and parameters: {'n_estimators': 781, 'max_depth': 10, 'min_samples_split': 2, 'min_samples_leaf': 1, 'max_features': 'log2', 'bootstrap': True, 'criterion': 'squared_error'}. Best is trial 590 with value: 0.4185444504443197.
[I 2024-12-04 15:00:33,370] Trial 625 finished with value: 0.9417031979228108 and parameters: {'n_estimators': 606, 'max_depth': 7, 'min_samples_split': 2, 'min_samples_leaf': 7, 'max_features': 'sqrt', 'bootstrap': False, 'criterion': 'squared_error'}. Best is trial 590 with value: 0.4185444504443197.
[I 2024-12-04 15:00:33,698] Trial 615 finished with value: 0.4313617342457752 and parameters: {'n_estimators': 713, 'max_depth': 42, 'min_samples_split': 4, 'min_samples_leaf': 1, 'max_features': None, 'bootstrap': True, 'criterion': 'squared_error'}. Best is trial 590 with value: 0.4185444504443197.
[I 2024-12-04 15:00:34,487] Trial 603 finished with value: 0.4211213343098564 and parameters: {'n_estimators': 979, 'max_depth': 49, 'min_samples_split': 2, 'min_samples_leaf': 1, 'max_features': None, 'bootstrap': True, 'criterion': 'squared_error'}. Best is trial 590 with value: 0.4185444504443197.
[I 2024-12-04 15:00:35,338] Trial 616 finished with value: 0.6129381316600022 and parameters: {'n_estimators': 803, 'max_depth': 50, 'min_samples_split': 2, 'min_samples_leaf': 2, 'max_features': None, 'bootstrap': False, 'criterion': 'squared_error'}. Best is trial 590 with value: 0.4185444504443197.
[I 2024-12-04 15:00:36,329] Trial 627 finished with value: 1.0563313638766298 and parameters: {'n_estimators': 561, 'max_depth': 36, 'min_samples_split': 15, 'min_samples_leaf': 13, 'max_features': 'log2', 'bootstrap': False, 'criterion': 'absolute_error'}. Best is trial 590 with value: 0.4185444504443197.
[I 2024-12-04 15:00:38,732] Trial 621 finished with value: 0.732442902527204 and parameters: {'n_estimators': 394, 'max_depth': 15, 'min_samples_split': 2, 'min_samples_leaf': 1, 'max_features': 'sqrt', 'bootstrap': True, 'criterion': 'squared_error'}. Best is trial 590 with value: 0.4185444504443197.
[I 2024-12-04 15:00:38,779] Trial 617 finished with value: 0.4232374068288455 and parameters: {'n_estimators': 670, 'max_depth': 49, 'min_samples_split': 2, 'min_samples_leaf': 1, 'max_features': None, 'bootstrap': True, 'criterion': 'squared_error'}. Best is trial 590 with value: 0.4185444504443197.
[I 2024-12-04 15:00:39,076] Trial 607 finished with value: 0.4204968293197128 and parameters: {'n_estimators': 1000, 'max_depth': 46, 'min_samples_split': 2, 'min_samples_leaf': 1, 'max_features': None, 'bootstrap': True, 'criterion': 'squared_error'}. Best is trial 590 with value: 0.4185444504443197.
[I 2024-12-04 15:00:39,652] Trial 614 finished with value: 0.4214013255362822 and parameters: {'n_estimators': 744, 'max_depth': 45, 'min_samples_split': 2, 'min_samples_leaf': 1, 'max_features': None, 'bootstrap': True, 'criterion': 'squared_error'}. Best is trial 590 with value: 0.4185444504443197.
[I 2024-12-04 15:00:39,672] Trial 619 finished with value: 0.41953285191082185 and parameters: {'n_estimators': 746, 'max_depth': 39, 'min_samples_split': 2, 'min_samples_leaf': 1, 'max_features': None, 'bootstrap': True, 'criterion': 'squared_error'}. Best is trial 590 with value: 0.4185444504443197.
[I 2024-12-04 15:00:39,986] Trial 622 finished with value: 0.421341316757548 and parameters: {'n_estimators': 633, 'max_depth': 31, 'min_samples_split': 2, 'min_samples_leaf': 1, 'max_features': None, 'bootstrap': True, 'criterion': 'squared_error'}. Best is trial 590 with value: 0.4185444504443197.
[I 2024-12-04 15:00:42,318] Trial 618 finished with value: 0.41925000277215113 and parameters: {'n_estimators': 777, 'max_depth': 41, 'min_samples_split': 2, 'min_samples_leaf': 1, 'max_features': None, 'bootstrap': True, 'criterion': 'squared_error'}. Best is trial 590 with value: 0.4185444504443197.
[I 2024-12-04 15:00:47,173] Trial 611 finished with value: 0.4209686585161482 and parameters: {'n_estimators': 662, 'max_depth': 48, 'min_samples_split': 2, 'min_samples_leaf': 1, 'max_features': None, 'bootstrap': True, 'criterion': 'squared_error'}. Best is trial 590 with value: 0.4185444504443197.
[I 2024-12-04 15:00:50,901] Trial 631 finished with value: 0.6953497858998059 and parameters: {'n_estimators': 981, 'max_depth': 50, 'min_samples_split': 4, 'min_samples_leaf': 2, 'max_features': 'sqrt', 'bootstrap': True, 'criterion': 'squared_error'}. Best is trial 590 with value: 0.4185444504443197.
[I 2024-12-04 15:00:52,840] Trial 623 finished with value: 0.46521431757959036 and parameters: {'n_estimators': 834, 'max_depth': 31, 'min_samples_split': 4, 'min_samples_leaf': 2, 'max_features': None, 'bootstrap': True, 'criterion': 'squared_error'}. Best is trial 590 with value: 0.4185444504443197.
[I 2024-12-04 15:00:59,341] Trial 636 finished with value: 0.5283906677419301 and parameters: {'n_estimators': 634, 'max_depth': 41, 'min_samples_split': 2, 'min_samples_leaf': 1, 'max_features': None, 'bootstrap': False, 'criterion': 'squared_error'}. Best is trial 590 with value: 0.4185444504443197.
[I 2024-12-04 15:00:59,342] Trial 638 finished with value: 0.7199939830131271 and parameters: {'n_estimators': 448, 'max_depth': 34, 'min_samples_split': 35, 'min_samples_leaf': 11, 'max_features': None, 'bootstrap': False, 'criterion': 'squared_error'}. Best is trial 590 with value: 0.4185444504443197.
[I 2024-12-04 15:01:00,058] Trial 632 finished with value: 0.46488995399618466 and parameters: {'n_estimators': 741, 'max_depth': 40, 'min_samples_split': 2, 'min_samples_leaf': 2, 'max_features': None, 'bootstrap': True, 'criterion': 'squared_error'}. Best is trial 590 with value: 0.4185444504443197.
[I 2024-12-04 15:01:03,172] Trial 626 finished with value: 0.4192092581787764 and parameters: {'n_estimators': 978, 'max_depth': 40, 'min_samples_split': 2, 'min_samples_leaf': 1, 'max_features': None, 'bootstrap': True, 'criterion': 'squared_error'}. Best is trial 590 with value: 0.4185444504443197.
[I 2024-12-04 15:01:05,694] Trial 624 finished with value: 0.4190354621930464 and parameters: {'n_estimators': 985, 'max_depth': 40, 'min_samples_split': 2, 'min_samples_leaf': 1, 'max_features': None, 'bootstrap': True, 'criterion': 'squared_error'}. Best is trial 590 with value: 0.4185444504443197.
[I 2024-12-04 15:01:06,582] Trial 630 finished with value: 0.43193835561650085 and parameters: {'n_estimators': 641, 'max_depth': 38, 'min_samples_split': 4, 'min_samples_leaf': 1, 'max_features': None, 'bootstrap': True, 'criterion': 'squared_error'}. Best is trial 590 with value: 0.4185444504443197.
[I 2024-12-04 15:01:06,654] Trial 642 finished with value: 1.0507191187572167 and parameters: {'n_estimators': 101, 'max_depth': 47, 'min_samples_split': 5, 'min_samples_leaf': 6, 'max_features': 'log2', 'bootstrap': False, 'criterion': 'squared_error'}. Best is trial 590 with value: 0.4185444504443197.
[I 2024-12-04 15:01:06,777] Trial 628 finished with value: 0.42183628789936595 and parameters: {'n_estimators': 747, 'max_depth': 35, 'min_samples_split': 2, 'min_samples_leaf': 1, 'max_features': None, 'bootstrap': True, 'criterion': 'squared_error'}. Best is trial 590 with value: 0.4185444504443197.
[I 2024-12-04 15:01:11,594] Trial 652 finished with value: 1.0257448688654383 and parameters: {'n_estimators': 171, 'max_depth': 5, 'min_samples_split': 16, 'min_samples_leaf': 3, 'max_features': 'log2', 'bootstrap': False, 'criterion': 'absolute_error'}. Best is trial 590 with value: 0.4185444504443197.
[I 2024-12-04 15:01:11,961] Trial 637 finished with value: 0.5132039411342196 and parameters: {'n_estimators': 987, 'max_depth': 21, 'min_samples_split': 3, 'min_samples_leaf': 1, 'max_features': None, 'bootstrap': False, 'criterion': 'squared_error'}. Best is trial 590 with value: 0.4185444504443197.
[I 2024-12-04 15:01:12,211] Trial 581 finished with value: 0.5794310721434586 and parameters: {'n_estimators': 567, 'max_depth': 38, 'min_samples_split': 9, 'min_samples_leaf': 1, 'max_features': None, 'bootstrap': False, 'criterion': 'absolute_error'}. Best is trial 590 with value: 0.4185444504443197.
[I 2024-12-04 15:01:13,280] Trial 639 finished with value: 0.46562472237346475 and parameters: {'n_estimators': 589, 'max_depth': 41, 'min_samples_split': 2, 'min_samples_leaf': 2, 'max_features': None, 'bootstrap': True, 'criterion': 'squared_error'}. Best is trial 590 with value: 0.4185444504443197.
[I 2024-12-04 15:01:13,293] Trial 633 finished with value: 0.42154652969067413 and parameters: {'n_estimators': 816, 'max_depth': 35, 'min_samples_split': 2, 'min_samples_leaf': 1, 'max_features': None, 'bootstrap': True, 'criterion': 'squared_error'}. Best is trial 590 with value: 0.4185444504443197.
[I 2024-12-04 15:01:13,617] Trial 645 finished with value: 0.688964328950366 and parameters: {'n_estimators': 372, 'max_depth': 42, 'min_samples_split': 24, 'min_samples_leaf': 12, 'max_features': None, 'bootstrap': True, 'criterion': 'absolute_error'}. Best is trial 590 with value: 0.4185444504443197.
[I 2024-12-04 15:01:14,367] Trial 629 finished with value: 0.4653240231114534 and parameters: {'n_estimators': 991, 'max_depth': 47, 'min_samples_split': 4, 'min_samples_leaf': 2, 'max_features': None, 'bootstrap': True, 'criterion': 'squared_error'}. Best is trial 590 with value: 0.4185444504443197.
[I 2024-12-04 15:01:14,909] Trial 634 finished with value: 0.4201071167672439 and parameters: {'n_estimators': 863, 'max_depth': 43, 'min_samples_split': 2, 'min_samples_leaf': 1, 'max_features': None, 'bootstrap': True, 'criterion': 'squared_error'}. Best is trial 590 with value: 0.4185444504443197.
[I 2024-12-04 15:01:15,647] Trial 635 finished with value: 0.4654181300397118 and parameters: {'n_estimators': 821, 'max_depth': 40, 'min_samples_split': 2, 'min_samples_leaf': 2, 'max_features': None, 'bootstrap': True, 'criterion': 'squared_error'}. Best is trial 590 with value: 0.4185444504443197.
[I 2024-12-04 15:01:15,772] Trial 640 finished with value: 0.43114008236880297 and parameters: {'n_estimators': 746, 'max_depth': 48, 'min_samples_split': 4, 'min_samples_leaf': 1, 'max_features': None, 'bootstrap': True, 'criterion': 'squared_error'}. Best is trial 590 with value: 0.4185444504443197.
[I 2024-12-04 15:01:15,945] Trial 646 finished with value: 0.6122454948452849 and parameters: {'n_estimators': 853, 'max_depth': 39, 'min_samples_split': 38, 'min_samples_leaf': 2, 'max_features': None, 'bootstrap': False, 'criterion': 'squared_error'}. Best is trial 590 with value: 0.4185444504443197.
[I 2024-12-04 15:01:16,494] Trial 641 finished with value: 0.6522528946720778 and parameters: {'n_estimators': 902, 'max_depth': 19, 'min_samples_split': 2, 'min_samples_leaf': 8, 'max_features': None, 'bootstrap': True, 'criterion': 'squared_error'}. Best is trial 590 with value: 0.4185444504443197.
[I 2024-12-04 15:01:17,559] Trial 651 finished with value: 0.9590269851331463 and parameters: {'n_estimators': 798, 'max_depth': 41, 'min_samples_split': 3, 'min_samples_leaf': 2, 'max_features': 'log2', 'bootstrap': True, 'criterion': 'squared_error'}. Best is trial 590 with value: 0.4185444504443197.
[I 2024-12-04 15:01:18,083] Trial 643 finished with value: 0.42200111875208624 and parameters: {'n_estimators': 600, 'max_depth': 42, 'min_samples_split': 2, 'min_samples_leaf': 1, 'max_features': None, 'bootstrap': True, 'criterion': 'squared_error'}. Best is trial 590 with value: 0.4185444504443197.
[I 2024-12-04 15:01:18,638] Trial 647 finished with value: 0.6405938178744038 and parameters: {'n_estimators': 648, 'max_depth': 42, 'min_samples_split': 5, 'min_samples_leaf': 1, 'max_features': 'log2', 'bootstrap': True, 'criterion': 'squared_error'}. Best is trial 590 with value: 0.4185444504443197.
[I 2024-12-04 15:01:18,647] Trial 620 finished with value: 0.4300309763531912 and parameters: {'n_estimators': 553, 'max_depth': 39, 'min_samples_split': 3, 'min_samples_leaf': 1, 'max_features': None, 'bootstrap': True, 'criterion': 'absolute_error'}. Best is trial 590 with value: 0.4185444504443197.
