[I 2024-12-04 12:26:22,306] Trial 658 finished with value: 0.3693290640591805 and parameters: {'n_estimators': 1454, 'learning_rate': 0.0634163362715502, 'max_depth': 8, 'min_samples_split': 9, 'min_samples_leaf': 4, 'subsample': 0.6988364646085602, 'max_features': None}. Best is trial 428 with value: 0.31740361133065975.
[I 2024-12-04 12:26:22,862] Trial 682 finished with value: 0.38425132524874783 and parameters: {'n_estimators': 630, 'learning_rate': 0.09835447719121491, 'max_depth': 7, 'min_samples_split': 3, 'min_samples_leaf': 3, 'subsample': 0.7265485406382535, 'max_features': None}. Best is trial 428 with value: 0.31740361133065975.
[I 2024-12-04 12:26:23,106] Trial 670 finished with value: 0.3333263119372653 and parameters: {'n_estimators': 1054, 'learning_rate': 0.0951964305873076, 'max_depth': 6, 'min_samples_split': 5, 'min_samples_leaf': 2, 'subsample': 0.6034514995219599, 'max_features': None}. Best is trial 428 with value: 0.31740361133065975.
[I 2024-12-04 12:26:28,155] Trial 687 finished with value: 0.5613484628954061 and parameters: {'n_estimators': 531, 'learning_rate': 0.04373815756753682, 'max_depth': 8, 'min_samples_split': 12, 'min_samples_leaf': 4, 'subsample': 0.8890110311325417, 'max_features': 'log2'}. Best is trial 428 with value: 0.31740361133065975.
[I 2024-12-04 12:26:29,252] Trial 674 finished with value: 0.3447046526260858 and parameters: {'n_estimators': 1072, 'learning_rate': 0.0948694647048997, 'max_depth': 7, 'min_samples_split': 9, 'min_samples_leaf': 2, 'subsample': 0.6982085530444325, 'max_features': None}. Best is trial 428 with value: 0.31740361133065975.
[I 2024-12-04 12:26:29,831] Trial 671 finished with value: 0.36961542421277005 and parameters: {'n_estimators': 1223, 'learning_rate': 0.021460657753797067, 'max_depth': 8, 'min_samples_split': 6, 'min_samples_leaf': 1, 'subsample': 0.6074279757991826, 'max_features': None}. Best is trial 428 with value: 0.31740361133065975.
[I 2024-12-04 12:26:29,843] Trial 680 finished with value: 0.38781775325790396 and parameters: {'n_estimators': 945, 'learning_rate': 0.08935278412572963, 'max_depth': 6, 'min_samples_split': 4, 'min_samples_leaf': 3, 'subsample': 0.7105317437903464, 'max_features': None}. Best is trial 428 with value: 0.31740361133065975.
[I 2024-12-04 12:26:30,954] Trial 672 finished with value: 0.37791109050837424 and parameters: {'n_estimators': 1205, 'learning_rate': 0.03653984747721371, 'max_depth': 9, 'min_samples_split': 5, 'min_samples_leaf': 1, 'subsample': 0.6283645690815259, 'max_features': None}. Best is trial 428 with value: 0.31740361133065975.
[I 2024-12-04 12:26:31,974] Trial 673 finished with value: 0.33899452213759584 and parameters: {'n_estimators': 1236, 'learning_rate': 0.08641875552545342, 'max_depth': 9, 'min_samples_split': 7, 'min_samples_leaf': 2, 'subsample': 0.700575109046628, 'max_features': None}. Best is trial 428 with value: 0.31740361133065975.
[I 2024-12-04 12:26:33,504] Trial 675 finished with value: 0.3908336375393236 and parameters: {'n_estimators': 1213, 'learning_rate': 0.024143660164779014, 'max_depth': 8, 'min_samples_split': 3, 'min_samples_leaf': 3, 'subsample': 0.6584059207163186, 'max_features': None}. Best is trial 428 with value: 0.31740361133065975.
[I 2024-12-04 12:26:34,894] Trial 678 finished with value: 0.3782872821013075 and parameters: {'n_estimators': 1109, 'learning_rate': 0.05195757786347923, 'max_depth': 7, 'min_samples_split': 11, 'min_samples_leaf': 5, 'subsample': 0.6013644273297736, 'max_features': None}. Best is trial 428 with value: 0.31740361133065975.
[I 2024-12-04 12:26:35,693] Trial 684 finished with value: 0.3905709103087042 and parameters: {'n_estimators': 940, 'learning_rate': 0.04847788586458794, 'max_depth': 7, 'min_samples_split': 7, 'min_samples_leaf': 1, 'subsample': 0.6261875992275495, 'max_features': 'sqrt'}. Best is trial 428 with value: 0.31740361133065975.
[I 2024-12-04 12:26:39,200] Trial 705 finished with value: 0.9446443605704236 and parameters: {'n_estimators': 171, 'learning_rate': 0.019998565719311637, 'max_depth': 12, 'min_samples_split': 11, 'min_samples_leaf': 5, 'subsample': 0.9177311145476709, 'max_features': 'log2'}. Best is trial 428 with value: 0.31740361133065975.
[I 2024-12-04 12:26:40,955] Trial 679 finished with value: 0.3807998983603069 and parameters: {'n_estimators': 1260, 'learning_rate': 0.03406432894654741, 'max_depth': 9, 'min_samples_split': 5, 'min_samples_leaf': 3, 'subsample': 0.7053912485068657, 'max_features': None}. Best is trial 428 with value: 0.31740361133065975.
[I 2024-12-04 12:26:40,971] Trial 685 finished with value: 0.3972277538715852 and parameters: {'n_estimators': 1066, 'learning_rate': 0.09025909536392504, 'max_depth': 3, 'min_samples_split': 2, 'min_samples_leaf': 4, 'subsample': 0.9517885794606402, 'max_features': None}. Best is trial 428 with value: 0.31740361133065975.
[I 2024-12-04 12:26:41,004] Trial 699 finished with value: 0.7869407920039329 and parameters: {'n_estimators': 501, 'learning_rate': 0.013538422241061724, 'max_depth': 4, 'min_samples_split': 5, 'min_samples_leaf': 10, 'subsample': 0.7581185674746009, 'max_features': 'sqrt'}. Best is trial 428 with value: 0.31740361133065975.
[I 2024-12-04 12:26:42,170] Trial 676 finished with value: 0.3608576939960265 and parameters: {'n_estimators': 1479, 'learning_rate': 0.09815636217750498, 'max_depth': 6, 'min_samples_split': 4, 'min_samples_leaf': 4, 'subsample': 0.7657886005832084, 'max_features': None}. Best is trial 428 with value: 0.31740361133065975.
[I 2024-12-04 12:26:45,092] Trial 681 finished with value: 0.39522324827150457 and parameters: {'n_estimators': 1383, 'learning_rate': 0.021033642181198447, 'max_depth': 5, 'min_samples_split': 3, 'min_samples_leaf': 1, 'subsample': 0.7190885335420998, 'max_features': None}. Best is trial 428 with value: 0.31740361133065975.
[I 2024-12-04 12:26:45,820] Trial 690 finished with value: 0.34735558641636255 and parameters: {'n_estimators': 865, 'learning_rate': 0.08908492911688316, 'max_depth': 4, 'min_samples_split': 2, 'min_samples_leaf': 2, 'subsample': 0.9802619435875366, 'max_features': None}. Best is trial 428 with value: 0.31740361133065975.
[I 2024-12-04 12:26:46,114] Trial 677 finished with value: 0.382271881551381 and parameters: {'n_estimators': 1493, 'learning_rate': 0.09935055159454355, 'max_depth': 6, 'min_samples_split': 2, 'min_samples_leaf': 3, 'subsample': 0.7428328509820276, 'max_features': None}. Best is trial 428 with value: 0.31740361133065975.
[I 2024-12-04 12:26:46,396] Trial 693 finished with value: 0.39684545921374276 and parameters: {'n_estimators': 796, 'learning_rate': 0.022776866534326923, 'max_depth': 7, 'min_samples_split': 7, 'min_samples_leaf': 1, 'subsample': 0.6643373263418313, 'max_features': None}. Best is trial 428 with value: 0.31740361133065975.
[I 2024-12-04 12:26:46,788] Trial 701 finished with value: 0.945284734157275 and parameters: {'n_estimators': 525, 'learning_rate': 0.010009120746844324, 'max_depth': 3, 'min_samples_split': 4, 'min_samples_leaf': 7, 'subsample': 0.9508274627577841, 'max_features': 'log2'}. Best is trial 428 with value: 0.31740361133065975.
[I 2024-12-04 12:26:48,524] Trial 689 finished with value: 0.3630277911212815 and parameters: {'n_estimators': 968, 'learning_rate': 0.0465766616401824, 'max_depth': 9, 'min_samples_split': 2, 'min_samples_leaf': 1, 'subsample': 0.6011144064978393, 'max_features': None}. Best is trial 428 with value: 0.31740361133065975.
[I 2024-12-04 12:26:52,503] Trial 697 finished with value: 0.6350881364984181 and parameters: {'n_estimators': 971, 'learning_rate': 0.03032849094034751, 'max_depth': 4, 'min_samples_split': 17, 'min_samples_leaf': 6, 'subsample': 0.654137719242111, 'max_features': 'log2'}. Best is trial 428 with value: 0.31740361133065975.
[I 2024-12-04 12:26:55,904] Trial 714 finished with value: 0.47014208734997615 and parameters: {'n_estimators': 503, 'learning_rate': 0.03369746134790513, 'max_depth': 4, 'min_samples_split': 11, 'min_samples_leaf': 1, 'subsample': 0.9524343223902504, 'max_features': 'sqrt'}. Best is trial 428 with value: 0.31740361133065975.
[I 2024-12-04 12:26:56,390] Trial 717 finished with value: 0.7056470038892207 and parameters: {'n_estimators': 412, 'learning_rate': 0.026108706533496295, 'max_depth': 11, 'min_samples_split': 14, 'min_samples_leaf': 10, 'subsample': 0.6312177220450493, 'max_features': 'sqrt'}. Best is trial 428 with value: 0.31740361133065975.
[I 2024-12-04 12:26:57,440] Trial 694 finished with value: 0.38104492146645225 and parameters: {'n_estimators': 1125, 'learning_rate': 0.04791406596067191, 'max_depth': 7, 'min_samples_split': 8, 'min_samples_leaf': 3, 'subsample': 0.6312004072639312, 'max_features': None}. Best is trial 428 with value: 0.31740361133065975.
[I 2024-12-04 12:26:58,545] Trial 691 finished with value: 0.6032462663116717 and parameters: {'n_estimators': 1455, 'learning_rate': 0.010588220539526124, 'max_depth': 11, 'min_samples_split': 17, 'min_samples_leaf': 8, 'subsample': 0.7133132803033406, 'max_features': 'sqrt'}. Best is trial 428 with value: 0.31740361133065975.
[I 2024-12-04 12:26:59,917] Trial 695 finished with value: 0.37051416908641055 and parameters: {'n_estimators': 1127, 'learning_rate': 0.05763796578607607, 'max_depth': 8, 'min_samples_split': 11, 'min_samples_leaf': 1, 'subsample': 0.6189599957318619, 'max_features': None}. Best is trial 428 with value: 0.31740361133065975.
[I 2024-12-04 12:27:00,613] Trial 686 finished with value: 0.33680358579386677 and parameters: {'n_estimators': 1498, 'learning_rate': 0.06874198832953597, 'max_depth': 8, 'min_samples_split': 10, 'min_samples_leaf': 2, 'subsample': 0.7142239278938625, 'max_features': None}. Best is trial 428 with value: 0.31740361133065975.
[I 2024-12-04 12:27:01,536] Trial 688 finished with value: 0.3293256984838428 and parameters: {'n_estimators': 1449, 'learning_rate': 0.04686925531636477, 'max_depth': 8, 'min_samples_split': 7, 'min_samples_leaf': 2, 'subsample': 0.7415089093663685, 'max_features': None}. Best is trial 428 with value: 0.31740361133065975.
[I 2024-12-04 12:27:03,855] Trial 692 finished with value: 0.37027313641068654 and parameters: {'n_estimators': 1283, 'learning_rate': 0.03493811337010647, 'max_depth': 7, 'min_samples_split': 2, 'min_samples_leaf': 1, 'subsample': 0.6702528087546993, 'max_features': None}. Best is trial 428 with value: 0.31740361133065975.
[I 2024-12-04 12:27:04,635] Trial 698 finished with value: 0.44505699976631674 and parameters: {'n_estimators': 1243, 'learning_rate': 0.020742910476529885, 'max_depth': 4, 'min_samples_split': 9, 'min_samples_leaf': 1, 'subsample': 0.8411803666109392, 'max_features': 'sqrt'}. Best is trial 428 with value: 0.31740361133065975.
[I 2024-12-04 12:27:08,080] Trial 723 finished with value: 0.6174774590885042 and parameters: {'n_estimators': 538, 'learning_rate': 0.07555008752997469, 'max_depth': 8, 'min_samples_split': 2, 'min_samples_leaf': 10, 'subsample': 0.6534568319311562, 'max_features': 'sqrt'}. Best is trial 428 with value: 0.31740361133065975.
[I 2024-12-04 12:27:10,784] Trial 696 finished with value: 0.3754705224422615 and parameters: {'n_estimators': 1413, 'learning_rate': 0.0742758731894281, 'max_depth': 9, 'min_samples_split': 10, 'min_samples_leaf': 3, 'subsample': 0.623952159082272, 'max_features': None}. Best is trial 428 with value: 0.31740361133065975.
[I 2024-12-04 12:27:13,384] Trial 732 finished with value: 0.9690514216737813 and parameters: {'n_estimators': 333, 'learning_rate': 0.010365519718070024, 'max_depth': 3, 'min_samples_split': 10, 'min_samples_leaf': 1, 'subsample': 0.9420202158121321, 'max_features': 'log2'}. Best is trial 428 with value: 0.31740361133065975.
[I 2024-12-04 12:27:13,455] Trial 700 finished with value: 0.37783256751562494 and parameters: {'n_estimators': 1422, 'learning_rate': 0.04869286271410048, 'max_depth': 9, 'min_samples_split': 10, 'min_samples_leaf': 1, 'subsample': 0.6361512111243195, 'max_features': None}. Best is trial 428 with value: 0.31740361133065975.
[I 2024-12-04 12:27:14,807] Trial 710 finished with value: 0.3914119137214456 and parameters: {'n_estimators': 1293, 'learning_rate': 0.04646544627893078, 'max_depth': 6, 'min_samples_split': 8, 'min_samples_leaf': 1, 'subsample': 0.9077105747869331, 'max_features': 'sqrt'}. Best is trial 428 with value: 0.31740361133065975.
[I 2024-12-04 12:27:17,083] Trial 711 finished with value: 0.611398275365777 and parameters: {'n_estimators': 1334, 'learning_rate': 0.011537187961147053, 'max_depth': 8, 'min_samples_split': 12, 'min_samples_leaf': 9, 'subsample': 0.9791501377735328, 'max_features': 'sqrt'}. Best is trial 428 with value: 0.31740361133065975.
[I 2024-12-04 12:27:17,090] Trial 706 finished with value: 0.3648579027765663 and parameters: {'n_estimators': 1270, 'learning_rate': 0.09298849258910026, 'max_depth': 6, 'min_samples_split': 6, 'min_samples_leaf': 1, 'subsample': 0.7072720687215492, 'max_features': None}. Best is trial 428 with value: 0.31740361133065975.
[I 2024-12-04 12:27:17,126] Trial 708 finished with value: 0.3201061565644327 and parameters: {'n_estimators': 1256, 'learning_rate': 0.09569020781548528, 'max_depth': 7, 'min_samples_split': 7, 'min_samples_leaf': 2, 'subsample': 0.717394906065228, 'max_features': None}. Best is trial 428 with value: 0.31740361133065975.
[I 2024-12-04 12:27:17,142] Trial 702 finished with value: 0.3231454458486291 and parameters: {'n_estimators': 1494, 'learning_rate': 0.0556192626841613, 'max_depth': 7, 'min_samples_split': 8, 'min_samples_leaf': 2, 'subsample': 0.6290916498535926, 'max_features': None}. Best is trial 428 with value: 0.31740361133065975.
[I 2024-12-04 12:27:18,158] Trial 716 finished with value: 0.3336040928956462 and parameters: {'n_estimators': 981, 'learning_rate': 0.030660085968070374, 'max_depth': 8, 'min_samples_split': 4, 'min_samples_leaf': 2, 'subsample': 0.6102639904717679, 'max_features': None}. Best is trial 428 with value: 0.31740361133065975.
[I 2024-12-04 12:27:18,551] Trial 718 finished with value: 0.3703431423591635 and parameters: {'n_estimators': 980, 'learning_rate': 0.055407621706337076, 'max_depth': 7, 'min_samples_split': 10, 'min_samples_leaf': 4, 'subsample': 0.7128883164845992, 'max_features': None}. Best is trial 428 with value: 0.31740361133065975.
[I 2024-12-04 12:27:19,185] Trial 724 finished with value: 0.41991057312190555 and parameters: {'n_estimators': 943, 'learning_rate': 0.04746486452123685, 'max_depth': 7, 'min_samples_split': 7, 'min_samples_leaf': 1, 'subsample': 0.7203167373964843, 'max_features': 'log2'}. Best is trial 428 with value: 0.31740361133065975.
[I 2024-12-04 12:27:19,567] Trial 734 finished with value: 0.6431264343461869 and parameters: {'n_estimators': 445, 'learning_rate': 0.02315454064986878, 'max_depth': 3, 'min_samples_split': 8, 'min_samples_leaf': 7, 'subsample': 0.9519277779556549, 'max_features': 'sqrt'}. Best is trial 428 with value: 0.31740361133065975.
[I 2024-12-04 12:27:20,101] Trial 713 finished with value: 0.3924203826685827 and parameters: {'n_estimators': 1366, 'learning_rate': 0.03814257845035153, 'max_depth': 7, 'min_samples_split': 6, 'min_samples_leaf': 1, 'subsample': 0.6672873090832321, 'max_features': 'sqrt'}. Best is trial 428 with value: 0.31740361133065975.
[I 2024-12-04 12:27:20,508] Trial 704 finished with value: 0.368665150914576 and parameters: {'n_estimators': 1413, 'learning_rate': 0.08371326217169939, 'max_depth': 8, 'min_samples_split': 9, 'min_samples_leaf': 1, 'subsample': 0.6231816702480826, 'max_features': None}. Best is trial 428 with value: 0.31740361133065975.
[I 2024-12-04 12:27:20,672] Trial 722 finished with value: 0.32701312106164093 and parameters: {'n_estimators': 878, 'learning_rate': 0.036900487283350346, 'max_depth': 7, 'min_samples_split': 4, 'min_samples_leaf': 2, 'subsample': 0.7357927352253616, 'max_features': None}. Best is trial 428 with value: 0.31740361133065975.
[I 2024-12-04 12:27:20,674] Trial 712 finished with value: 0.3263056878560504 and parameters: {'n_estimators': 1234, 'learning_rate': 0.09881100250230776, 'max_depth': 5, 'min_samples_split': 6, 'min_samples_leaf': 2, 'subsample': 0.8652910689650343, 'max_features': None}. Best is trial 428 with value: 0.31740361133065975.
[I 2024-12-04 12:27:20,675] Trial 703 finished with value: 0.38466779508199317 and parameters: {'n_estimators': 1496, 'learning_rate': 0.04086656706747139, 'max_depth': 7, 'min_samples_split': 3, 'min_samples_leaf': 1, 'subsample': 0.7198492409468695, 'max_features': None}. Best is trial 428 with value: 0.31740361133065975.
[I 2024-12-04 12:27:20,743] Trial 707 finished with value: 0.38944253470052503 and parameters: {'n_estimators': 1369, 'learning_rate': 0.04171401021841805, 'max_depth': 7, 'min_samples_split': 2, 'min_samples_leaf': 6, 'subsample': 0.6944727455390348, 'max_features': None}. Best is trial 428 with value: 0.31740361133065975.
[I 2024-12-04 12:27:21,131] Trial 728 finished with value: 0.5312233342064347 and parameters: {'n_estimators': 719, 'learning_rate': 0.01033221637246615, 'max_depth': 12, 'min_samples_split': 12, 'min_samples_leaf': 1, 'subsample': 0.9646189644229292, 'max_features': 'log2'}. Best is trial 428 with value: 0.31740361133065975.
[I 2024-12-04 12:27:24,659] Trial 725 finished with value: 0.3712533181653736 and parameters: {'n_estimators': 923, 'learning_rate': 0.03918267652938877, 'max_depth': 7, 'min_samples_split': 8, 'min_samples_leaf': 1, 'subsample': 0.6085846191078086, 'max_features': None}. Best is trial 428 with value: 0.31740361133065975.
[I 2024-12-04 12:27:26,126] Trial 715 finished with value: 0.3335257178961629 and parameters: {'n_estimators': 1281, 'learning_rate': 0.03912797849861115, 'max_depth': 7, 'min_samples_split': 4, 'min_samples_leaf': 2, 'subsample': 0.6443329307323031, 'max_features': None}. Best is trial 428 with value: 0.31740361133065975.
[I 2024-12-04 12:27:27,122] Trial 709 finished with value: 0.41029374077014236 and parameters: {'n_estimators': 1403, 'learning_rate': 0.012703515994396992, 'max_depth': 8, 'min_samples_split': 11, 'min_samples_leaf': 7, 'subsample': 0.8777393970053866, 'max_features': None}. Best is trial 428 with value: 0.31740361133065975.
[I 2024-12-04 12:27:28,645] Trial 726 finished with value: 0.3664361284891037 and parameters: {'n_estimators': 895, 'learning_rate': 0.06801723848276763, 'max_depth': 8, 'min_samples_split': 6, 'min_samples_leaf': 1, 'subsample': 0.7397660983036265, 'max_features': None}. Best is trial 428 with value: 0.31740361133065975.
[I 2024-12-04 12:27:29,061] Trial 731 finished with value: 0.38165771934339954 and parameters: {'n_estimators': 855, 'learning_rate': 0.08883656160526868, 'max_depth': 7, 'min_samples_split': 2, 'min_samples_leaf': 3, 'subsample': 0.9972467985711392, 'max_features': None}. Best is trial 428 with value: 0.31740361133065975.
[I 2024-12-04 12:27:33,547] Trial 721 finished with value: 0.32749967039059646 and parameters: {'n_estimators': 1400, 'learning_rate': 0.059550941023367374, 'max_depth': 6, 'min_samples_split': 4, 'min_samples_leaf': 2, 'subsample': 0.7614358177438133, 'max_features': None}. Best is trial 428 with value: 0.31740361133065975.
[I 2024-12-04 12:27:34,441] Trial 730 finished with value: 0.38843646583986957 and parameters: {'n_estimators': 1026, 'learning_rate': 0.057138453642094515, 'max_depth': 8, 'min_samples_split': 3, 'min_samples_leaf': 3, 'subsample': 0.7269689697712881, 'max_features': None}. Best is trial 428 with value: 0.31740361133065975.
[I 2024-12-04 12:27:34,501] Trial 719 finished with value: 0.37302841946426224 and parameters: {'n_estimators': 1474, 'learning_rate': 0.04233269892019763, 'max_depth': 10, 'min_samples_split': 9, 'min_samples_leaf': 4, 'subsample': 0.608140632225235, 'max_features': None}. Best is trial 428 with value: 0.31740361133065975.
[I 2024-12-04 12:27:34,535] Trial 720 finished with value: 0.37251262675709784 and parameters: {'n_estimators': 1368, 'learning_rate': 0.04242922234437972, 'max_depth': 7, 'min_samples_split': 6, 'min_samples_leaf': 4, 'subsample': 0.7036351056556147, 'max_features': None}. Best is trial 428 with value: 0.31740361133065975.
[I 2024-12-04 12:27:41,860] Trial 729 finished with value: 0.33088882632047384 and parameters: {'n_estimators': 1389, 'learning_rate': 0.07155475179399565, 'max_depth': 6, 'min_samples_split': 2, 'min_samples_leaf': 2, 'subsample': 0.6907702538544119, 'max_features': None}. Best is trial 428 with value: 0.31740361133065975.
[I 2024-12-04 12:27:42,638] Trial 762 finished with value: 0.8411053110931793 and parameters: {'n_estimators': 216, 'learning_rate': 0.039267620356207705, 'max_depth': 8, 'min_samples_split': 17, 'min_samples_leaf': 5, 'subsample': 0.7425629060346753, 'max_features': 'log2'}. Best is trial 428 with value: 0.31740361133065975.
[I 2024-12-04 12:27:43,427] Trial 727 finished with value: 0.33011799571032086 and parameters: {'n_estimators': 1486, 'learning_rate': 0.07593656164012755, 'max_depth': 5, 'min_samples_split': 4, 'min_samples_leaf': 2, 'subsample': 0.7889941267165148, 'max_features': None}. Best is trial 428 with value: 0.31740361133065975.
[I 2024-12-04 12:27:46,451] Trial 733 finished with value: 0.41958999147180454 and parameters: {'n_estimators': 1336, 'learning_rate': 0.031553926086199384, 'max_depth': 8, 'min_samples_split': 5, 'min_samples_leaf': 8, 'subsample': 0.9862940154586443, 'max_features': None}. Best is trial 428 with value: 0.31740361133065975.
[I 2024-12-04 12:27:46,452] Trial 747 finished with value: 0.3683257936151376 and parameters: {'n_estimators': 625, 'learning_rate': 0.04075615209738438, 'max_depth': 6, 'min_samples_split': 8, 'min_samples_leaf': 2, 'subsample': 0.7846653766900448, 'max_features': None}. Best is trial 428 with value: 0.31740361133065975.
