[I 2024-12-04 12:18:40,778] Trial 260 finished with value: 0.3743017304201834 and parameters: {'n_estimators': 915, 'learning_rate': 0.08338131863017838, 'max_depth': 11, 'min_samples_split': 17, 'min_samples_leaf': 1, 'subsample': 0.7720161302810467, 'max_features': None}. Best is trial 75 with value: 0.3356123167576939.
[I 2024-12-04 12:18:41,428] Trial 279 finished with value: 0.35060351963747627 and parameters: {'n_estimators': 395, 'learning_rate': 0.0712431533685077, 'max_depth': 10, 'min_samples_split': 16, 'min_samples_leaf': 2, 'subsample': 0.7384283532808, 'max_features': None}. Best is trial 75 with value: 0.3356123167576939.
[I 2024-12-04 12:18:42,411] Trial 266 finished with value: 0.36836749267670216 and parameters: {'n_estimators': 755, 'learning_rate': 0.08441904440341216, 'max_depth': 9, 'min_samples_split': 17, 'min_samples_leaf': 3, 'subsample': 0.8031843663878413, 'max_features': None}. Best is trial 75 with value: 0.3356123167576939.
[I 2024-12-04 12:18:42,912] Trial 255 finished with value: 0.3500708735846306 and parameters: {'n_estimators': 928, 'learning_rate': 0.036539437126241504, 'max_depth': 12, 'min_samples_split': 6, 'min_samples_leaf': 2, 'subsample': 0.9031656783396502, 'max_features': None}. Best is trial 75 with value: 0.3356123167576939.
[I 2024-12-04 12:18:44,348] Trial 273 finished with value: 0.34220560039146963 and parameters: {'n_estimators': 600, 'learning_rate': 0.04240537441438461, 'max_depth': 10, 'min_samples_split': 4, 'min_samples_leaf': 2, 'subsample': 0.801991299577784, 'max_features': None}. Best is trial 75 with value: 0.3356123167576939.
[I 2024-12-04 12:18:44,663] Trial 274 finished with value: 0.39325360062997644 and parameters: {'n_estimators': 630, 'learning_rate': 0.034557466619199, 'max_depth': 9, 'min_samples_split': 5, 'min_samples_leaf': 3, 'subsample': 0.783005703996881, 'max_features': None}. Best is trial 75 with value: 0.3356123167576939.
[I 2024-12-04 12:18:45,124] Trial 287 finished with value: 0.5730227452808261 and parameters: {'n_estimators': 376, 'learning_rate': 0.037725533253524006, 'max_depth': 5, 'min_samples_split': 11, 'min_samples_leaf': 10, 'subsample': 0.6188081369585013, 'max_features': None}. Best is trial 75 with value: 0.3356123167576939.
[I 2024-12-04 12:18:45,483] Trial 271 finished with value: 0.34810378715381657 and parameters: {'n_estimators': 636, 'learning_rate': 0.02945915615942614, 'max_depth': 11, 'min_samples_split': 3, 'min_samples_leaf': 2, 'subsample': 0.8789493817512499, 'max_features': None}. Best is trial 75 with value: 0.3356123167576939.
[I 2024-12-04 12:18:46,121] Trial 258 finished with value: 0.3651840393946812 and parameters: {'n_estimators': 969, 'learning_rate': 0.035518284800909794, 'max_depth': 12, 'min_samples_split': 8, 'min_samples_leaf': 4, 'subsample': 0.6189084120228242, 'max_features': None}. Best is trial 75 with value: 0.3356123167576939.
[I 2024-12-04 12:18:47,718] Trial 286 finished with value: 0.5718781819500964 and parameters: {'n_estimators': 347, 'learning_rate': 0.011398853459304867, 'max_depth': 10, 'min_samples_split': 2, 'min_samples_leaf': 10, 'subsample': 0.9247303493580566, 'max_features': None}. Best is trial 75 with value: 0.3356123167576939.
[I 2024-12-04 12:18:50,075] Trial 254 finished with value: 0.3787893364334645 and parameters: {'n_estimators': 1304, 'learning_rate': 0.022643336593200364, 'max_depth': 12, 'min_samples_split': 9, 'min_samples_leaf': 1, 'subsample': 0.6816215034167143, 'max_features': None}. Best is trial 75 with value: 0.3356123167576939.
[I 2024-12-04 12:18:50,139] Trial 275 finished with value: 0.3780080427450667 and parameters: {'n_estimators': 694, 'learning_rate': 0.027825444303030505, 'max_depth': 10, 'min_samples_split': 11, 'min_samples_leaf': 1, 'subsample': 0.7079659529358183, 'max_features': None}. Best is trial 75 with value: 0.3356123167576939.
[I 2024-12-04 12:18:50,474] Trial 278 finished with value: 0.38482047777743505 and parameters: {'n_estimators': 918, 'learning_rate': 0.030801734204985654, 'max_depth': 11, 'min_samples_split': 11, 'min_samples_leaf': 1, 'subsample': 0.7352907710759307, 'max_features': 'sqrt'}. Best is trial 75 with value: 0.3356123167576939.
[I 2024-12-04 12:18:50,711] Trial 302 finished with value: 0.3641410487397907 and parameters: {'n_estimators': 128, 'learning_rate': 0.07834229941496079, 'max_depth': 12, 'min_samples_split': 2, 'min_samples_leaf': 2, 'subsample': 0.7497972747524707, 'max_features': None}. Best is trial 75 with value: 0.3356123167576939.
[I 2024-12-04 12:18:50,737] Trial 280 finished with value: 0.37113168330977153 and parameters: {'n_estimators': 697, 'learning_rate': 0.026041101121457032, 'max_depth': 12, 'min_samples_split': 10, 'min_samples_leaf': 3, 'subsample': 0.6046992293463506, 'max_features': None}. Best is trial 75 with value: 0.3356123167576939.
[I 2024-12-04 12:18:52,234] Trial 277 finished with value: 0.37554325057048804 and parameters: {'n_estimators': 967, 'learning_rate': 0.027805796512211503, 'max_depth': 12, 'min_samples_split': 11, 'min_samples_leaf': 2, 'subsample': 0.6937396671497111, 'max_features': 'sqrt'}. Best is trial 75 with value: 0.3356123167576939.
[I 2024-12-04 12:18:53,085] Trial 276 finished with value: 0.34189996170648806 and parameters: {'n_estimators': 756, 'learning_rate': 0.03214939027932518, 'max_depth': 11, 'min_samples_split': 7, 'min_samples_leaf': 2, 'subsample': 0.7125001919213727, 'max_features': None}. Best is trial 75 with value: 0.3356123167576939.
[I 2024-12-04 12:18:53,331] Trial 296 finished with value: 0.39376069217968324 and parameters: {'n_estimators': 436, 'learning_rate': 0.09025190796841598, 'max_depth': 10, 'min_samples_split': 6, 'min_samples_leaf': 3, 'subsample': 0.8074560740425037, 'max_features': None}. Best is trial 75 with value: 0.3356123167576939.
[I 2024-12-04 12:18:55,402] Trial 295 finished with value: 0.38255236778154517 and parameters: {'n_estimators': 460, 'learning_rate': 0.05976342612234747, 'max_depth': 9, 'min_samples_split': 2, 'min_samples_leaf': 3, 'subsample': 0.7677528685872492, 'max_features': None}. Best is trial 75 with value: 0.3356123167576939.
[I 2024-12-04 12:18:55,796] Trial 293 finished with value: 0.4806856001492925 and parameters: {'n_estimators': 560, 'learning_rate': 0.05147233169505316, 'max_depth': 5, 'min_samples_split': 16, 'min_samples_leaf': 1, 'subsample': 0.624624577441447, 'max_features': 'log2'}. Best is trial 75 with value: 0.3356123167576939.
[I 2024-12-04 12:18:57,630] Trial 297 finished with value: 0.34462429478780654 and parameters: {'n_estimators': 560, 'learning_rate': 0.037342232902356026, 'max_depth': 11, 'min_samples_split': 12, 'min_samples_leaf': 2, 'subsample': 0.6523560584077271, 'max_features': None}. Best is trial 75 with value: 0.3356123167576939.
[I 2024-12-04 12:18:59,062] Trial 299 finished with value: 0.36161871209075164 and parameters: {'n_estimators': 519, 'learning_rate': 0.08039915888208711, 'max_depth': 9, 'min_samples_split': 13, 'min_samples_leaf': 2, 'subsample': 0.7547175278362752, 'max_features': None}. Best is trial 75 with value: 0.3356123167576939.
[I 2024-12-04 12:19:00,033] Trial 291 finished with value: 0.7612055758739338 and parameters: {'n_estimators': 912, 'learning_rate': 0.022174679039859743, 'max_depth': 11, 'min_samples_split': 8, 'min_samples_leaf': 8, 'subsample': 0.8165178158184242, 'max_features': 'log2'}. Best is trial 75 with value: 0.3356123167576939.
[I 2024-12-04 12:19:00,773] Trial 282 finished with value: 0.41271779834028804 and parameters: {'n_estimators': 893, 'learning_rate': 0.04754428677667203, 'max_depth': 8, 'min_samples_split': 5, 'min_samples_leaf': 1, 'subsample': 0.8213567858380515, 'max_features': None}. Best is trial 75 with value: 0.3356123167576939.
[I 2024-12-04 12:19:03,280] Trial 317 finished with value: 0.8150056551681558 and parameters: {'n_estimators': 190, 'learning_rate': 0.07391107662282997, 'max_depth': 7, 'min_samples_split': 6, 'min_samples_leaf': 5, 'subsample': 0.8151880209945812, 'max_features': 'log2'}. Best is trial 75 with value: 0.3356123167576939.
[I 2024-12-04 12:19:04,054] Trial 310 finished with value: 0.454147216433547 and parameters: {'n_estimators': 259, 'learning_rate': 0.01898142714041258, 'max_depth': 7, 'min_samples_split': 14, 'min_samples_leaf': 1, 'subsample': 0.6250455629156346, 'max_features': None}. Best is trial 75 with value: 0.3356123167576939.
[I 2024-12-04 12:19:04,840] Trial 283 finished with value: 0.3409369554072053 and parameters: {'n_estimators': 1025, 'learning_rate': 0.06980060812995312, 'max_depth': 8, 'min_samples_split': 7, 'min_samples_leaf': 2, 'subsample': 0.9577577403268737, 'max_features': None}. Best is trial 75 with value: 0.3356123167576939.
[I 2024-12-04 12:19:07,416] Trial 304 finished with value: 0.395924013277262 and parameters: {'n_estimators': 718, 'learning_rate': 0.062257360699928904, 'max_depth': 12, 'min_samples_split': 17, 'min_samples_leaf': 1, 'subsample': 0.7386360938175434, 'max_features': 'sqrt'}. Best is trial 75 with value: 0.3356123167576939.
[I 2024-12-04 12:19:08,238] Trial 316 finished with value: 0.5259935750236 and parameters: {'n_estimators': 388, 'learning_rate': 0.05882242695327379, 'max_depth': 3, 'min_samples_split': 14, 'min_samples_leaf': 7, 'subsample': 0.8123597910710335, 'max_features': 'sqrt'}. Best is trial 75 with value: 0.3356123167576939.
[I 2024-12-04 12:19:08,791] Trial 294 finished with value: 0.47448666050970545 and parameters: {'n_estimators': 1217, 'learning_rate': 0.03215609760377433, 'max_depth': 4, 'min_samples_split': 7, 'min_samples_leaf': 2, 'subsample': 0.7289923640959314, 'max_features': 'log2'}. Best is trial 75 with value: 0.3356123167576939.
[I 2024-12-04 12:19:09,191] Trial 285 finished with value: 0.496458899318054 and parameters: {'n_estimators': 1454, 'learning_rate': 0.015270835902993092, 'max_depth': 4, 'min_samples_split': 18, 'min_samples_leaf': 7, 'subsample': 0.9853952569051135, 'max_features': 'sqrt'}. Best is trial 75 with value: 0.3356123167576939.
[I 2024-12-04 12:19:09,826] Trial 301 finished with value: 0.38867819297495854 and parameters: {'n_estimators': 781, 'learning_rate': 0.04636850168701562, 'max_depth': 7, 'min_samples_split': 4, 'min_samples_leaf': 3, 'subsample': 0.8822360756415568, 'max_features': None}. Best is trial 75 with value: 0.3356123167576939.
[I 2024-12-04 12:19:11,015] Trial 315 finished with value: 0.40485148948261146 and parameters: {'n_estimators': 374, 'learning_rate': 0.046376756345017686, 'max_depth': 8, 'min_samples_split': 5, 'min_samples_leaf': 3, 'subsample': 0.8786172069246283, 'max_features': None}. Best is trial 75 with value: 0.3356123167576939.
[I 2024-12-04 12:19:11,639] Trial 298 finished with value: 0.3783641650592535 and parameters: {'n_estimators': 926, 'learning_rate': 0.03894564354977131, 'max_depth': 11, 'min_samples_split': 10, 'min_samples_leaf': 1, 'subsample': 0.6376307475971366, 'max_features': None}. Best is trial 75 with value: 0.3356123167576939.
[I 2024-12-04 12:19:12,838] Trial 290 finished with value: 0.5792004097454374 and parameters: {'n_estimators': 1267, 'learning_rate': 0.0912460428464032, 'max_depth': 8, 'min_samples_split': 18, 'min_samples_leaf': 10, 'subsample': 0.9573129706870873, 'max_features': 'sqrt'}. Best is trial 75 with value: 0.3356123167576939.
[I 2024-12-04 12:19:12,967] Trial 319 finished with value: 0.3538171359148349 and parameters: {'n_estimators': 361, 'learning_rate': 0.03866575014574122, 'max_depth': 8, 'min_samples_split': 2, 'min_samples_leaf': 2, 'subsample': 0.8324088881543089, 'max_features': None}. Best is trial 75 with value: 0.3356123167576939.
[I 2024-12-04 12:19:13,227] Trial 289 finished with value: 0.33941182848710916 and parameters: {'n_estimators': 1161, 'learning_rate': 0.0822751719028139, 'max_depth': 7, 'min_samples_split': 2, 'min_samples_leaf': 2, 'subsample': 0.796950744242657, 'max_features': None}. Best is trial 75 with value: 0.3356123167576939.
[I 2024-12-04 12:19:13,620] Trial 307 finished with value: 0.3618225976867112 and parameters: {'n_estimators': 617, 'learning_rate': 0.030260845904079875, 'max_depth': 12, 'min_samples_split': 7, 'min_samples_leaf': 2, 'subsample': 0.9031739605932888, 'max_features': None}. Best is trial 75 with value: 0.3356123167576939.
[I 2024-12-04 12:19:13,965] Trial 305 finished with value: 0.3933825964962808 and parameters: {'n_estimators': 688, 'learning_rate': 0.020954674723089848, 'max_depth': 10, 'min_samples_split': 7, 'min_samples_leaf': 3, 'subsample': 0.914033410052036, 'max_features': None}. Best is trial 75 with value: 0.3356123167576939.
[I 2024-12-04 12:19:14,359] Trial 292 finished with value: 0.3965958023804135 and parameters: {'n_estimators': 1089, 'learning_rate': 0.0635432341513904, 'max_depth': 9, 'min_samples_split': 12, 'min_samples_leaf': 1, 'subsample': 0.8678884917849536, 'max_features': None}. Best is trial 75 with value: 0.3356123167576939.
[I 2024-12-04 12:19:14,360] Trial 318 finished with value: 0.39895991144766785 and parameters: {'n_estimators': 385, 'learning_rate': 0.06523476304811365, 'max_depth': 11, 'min_samples_split': 8, 'min_samples_leaf': 1, 'subsample': 0.76580876559457, 'max_features': None}. Best is trial 75 with value: 0.3356123167576939.
[I 2024-12-04 12:19:16,095] Trial 324 finished with value: 0.37783821467255696 and parameters: {'n_estimators': 308, 'learning_rate': 0.08215467826869023, 'max_depth': 10, 'min_samples_split': 18, 'min_samples_leaf': 1, 'subsample': 0.7433445166923998, 'max_features': None}. Best is trial 75 with value: 0.3356123167576939.
[I 2024-12-04 12:19:16,097] Trial 303 finished with value: 0.396781512429188 and parameters: {'n_estimators': 828, 'learning_rate': 0.04604074780073246, 'max_depth': 12, 'min_samples_split': 6, 'min_samples_leaf': 1, 'subsample': 0.8180143443234923, 'max_features': None}. Best is trial 75 with value: 0.3356123167576939.
[I 2024-12-04 12:19:16,868] Trial 281 finished with value: 0.3716973971738353 and parameters: {'n_estimators': 1348, 'learning_rate': 0.061823401272853705, 'max_depth': 10, 'min_samples_split': 6, 'min_samples_leaf': 4, 'subsample': 0.7942263957907283, 'max_features': None}. Best is trial 75 with value: 0.3356123167576939.
[I 2024-12-04 12:19:17,483] Trial 306 finished with value: 0.3540485737547782 and parameters: {'n_estimators': 762, 'learning_rate': 0.028620159005322478, 'max_depth': 10, 'min_samples_split': 3, 'min_samples_leaf': 2, 'subsample': 0.9481848356180514, 'max_features': None}. Best is trial 75 with value: 0.3356123167576939.
[I 2024-12-04 12:19:18,766] Trial 288 finished with value: 0.4017019527924651 and parameters: {'n_estimators': 1337, 'learning_rate': 0.0387439131447107, 'max_depth': 7, 'min_samples_split': 9, 'min_samples_leaf': 1, 'subsample': 0.8758463867909103, 'max_features': None}. Best is trial 75 with value: 0.3356123167576939.
[I 2024-12-04 12:19:18,956] Trial 308 finished with value: 0.40130055458083724 and parameters: {'n_estimators': 766, 'learning_rate': 0.041272836641207414, 'max_depth': 11, 'min_samples_split': 7, 'min_samples_leaf': 1, 'subsample': 0.9590462452991289, 'max_features': None}. Best is trial 75 with value: 0.3356123167576939.
[I 2024-12-04 12:19:19,534] Trial 322 finished with value: 0.3734125169828838 and parameters: {'n_estimators': 531, 'learning_rate': 0.04180856565205886, 'max_depth': 8, 'min_samples_split': 17, 'min_samples_leaf': 4, 'subsample': 0.7376399023688319, 'max_features': None}. Best is trial 75 with value: 0.3356123167576939.
[I 2024-12-04 12:19:20,263] Trial 312 finished with value: 0.3933902537647774 and parameters: {'n_estimators': 683, 'learning_rate': 0.03856247666118162, 'max_depth': 11, 'min_samples_split': 7, 'min_samples_leaf': 3, 'subsample': 0.7270585483854762, 'max_features': None}. Best is trial 75 with value: 0.3356123167576939.
[I 2024-12-04 12:19:20,710] Trial 300 finished with value: 0.36087460447613195 and parameters: {'n_estimators': 1049, 'learning_rate': 0.02416677947506915, 'max_depth': 12, 'min_samples_split': 12, 'min_samples_leaf': 2, 'subsample': 0.9673222831080466, 'max_features': None}. Best is trial 75 with value: 0.3356123167576939.
[I 2024-12-04 12:19:21,760] Trial 311 finished with value: 0.374269551239898 and parameters: {'n_estimators': 776, 'learning_rate': 0.05202974350144247, 'max_depth': 10, 'min_samples_split': 5, 'min_samples_leaf': 4, 'subsample': 0.9010309159791843, 'max_features': None}. Best is trial 75 with value: 0.3356123167576939.
[I 2024-12-04 12:19:22,836] Trial 320 finished with value: 0.3784338066351261 and parameters: {'n_estimators': 635, 'learning_rate': 0.020724578729166783, 'max_depth': 12, 'min_samples_split': 10, 'min_samples_leaf': 1, 'subsample': 0.6775709432951592, 'max_features': None}. Best is trial 75 with value: 0.3356123167576939.
[I 2024-12-04 12:19:25,030] Trial 321 finished with value: 0.34304550921609606 and parameters: {'n_estimators': 647, 'learning_rate': 0.04727910130105161, 'max_depth': 12, 'min_samples_split': 10, 'min_samples_leaf': 2, 'subsample': 0.6913463541778999, 'max_features': None}. Best is trial 75 with value: 0.3356123167576939.
[I 2024-12-04 12:19:25,073] Trial 329 finished with value: 0.3781171175044622 and parameters: {'n_estimators': 389, 'learning_rate': 0.03587944187227685, 'max_depth': 11, 'min_samples_split': 13, 'min_samples_leaf': 3, 'subsample': 0.6725647625146055, 'max_features': None}. Best is trial 75 with value: 0.3356123167576939.
[I 2024-12-04 12:19:25,108] Trial 326 finished with value: 0.45741174399284434 and parameters: {'n_estimators': 698, 'learning_rate': 0.018687310279924634, 'max_depth': 6, 'min_samples_split': 19, 'min_samples_leaf': 1, 'subsample': 0.8355908797216376, 'max_features': 'sqrt'}. Best is trial 75 with value: 0.3356123167576939.
[I 2024-12-04 12:19:28,307] Trial 330 finished with value: 0.3810857641960663 and parameters: {'n_estimators': 504, 'learning_rate': 0.08793353354753032, 'max_depth': 6, 'min_samples_split': 20, 'min_samples_leaf': 2, 'subsample': 0.8564513888944817, 'max_features': None}. Best is trial 75 with value: 0.3356123167576939.
[I 2024-12-04 12:19:29,363] Trial 313 finished with value: 0.4103360062363066 and parameters: {'n_estimators': 1322, 'learning_rate': 0.015300696229176665, 'max_depth': 7, 'min_samples_split': 17, 'min_samples_leaf': 2, 'subsample': 0.644866777583962, 'max_features': 'sqrt'}. Best is trial 75 with value: 0.3356123167576939.
[I 2024-12-04 12:19:30,629] Trial 323 finished with value: 0.33558594202603503 and parameters: {'n_estimators': 1126, 'learning_rate': 0.07820927882889114, 'max_depth': 11, 'min_samples_split': 10, 'min_samples_leaf': 2, 'subsample': 0.680486816533112, 'max_features': 'sqrt'}. Best is trial 323 with value: 0.33558594202603503.
[I 2024-12-04 12:19:32,055] Trial 309 finished with value: 0.38313069634191926 and parameters: {'n_estimators': 1159, 'learning_rate': 0.04994909816938157, 'max_depth': 12, 'min_samples_split': 10, 'min_samples_leaf': 3, 'subsample': 0.9052934672054427, 'max_features': None}. Best is trial 323 with value: 0.33558594202603503.
[I 2024-12-04 12:19:32,778] Trial 314 finished with value: 0.41871952913696925 and parameters: {'n_estimators': 1099, 'learning_rate': 0.020428291911458743, 'max_depth': 12, 'min_samples_split': 6, 'min_samples_leaf': 1, 'subsample': 0.9321959180468782, 'max_features': None}. Best is trial 323 with value: 0.33558594202603503.
[I 2024-12-04 12:19:33,640] Trial 332 finished with value: 0.34699952003580237 and parameters: {'n_estimators': 632, 'learning_rate': 0.04929315601028476, 'max_depth': 10, 'min_samples_split': 19, 'min_samples_leaf': 2, 'subsample': 0.7055371305142177, 'max_features': None}. Best is trial 323 with value: 0.33558594202603503.
[I 2024-12-04 12:19:37,267] Trial 335 finished with value: 0.3756187751558298 and parameters: {'n_estimators': 640, 'learning_rate': 0.025637489345479533, 'max_depth': 10, 'min_samples_split': 12, 'min_samples_leaf': 4, 'subsample': 0.70371476650773, 'max_features': None}. Best is trial 323 with value: 0.33558594202603503.
[I 2024-12-04 12:19:37,948] Trial 337 finished with value: 0.3947774567803375 and parameters: {'n_estimators': 647, 'learning_rate': 0.05309124482085604, 'max_depth': 9, 'min_samples_split': 2, 'min_samples_leaf': 1, 'subsample': 0.8081039571560865, 'max_features': None}. Best is trial 323 with value: 0.33558594202603503.
[I 2024-12-04 12:19:38,467] Trial 333 finished with value: 0.45319442370249907 and parameters: {'n_estimators': 989, 'learning_rate': 0.04657915652389135, 'max_depth': 5, 'min_samples_split': 5, 'min_samples_leaf': 2, 'subsample': 0.9367186150830155, 'max_features': 'log2'}. Best is trial 323 with value: 0.33558594202603503.
[I 2024-12-04 12:19:40,162] Trial 343 finished with value: 0.3568928102357959 and parameters: {'n_estimators': 449, 'learning_rate': 0.037892346280322536, 'max_depth': 10, 'min_samples_split': 2, 'min_samples_leaf': 2, 'subsample': 0.7869176119143539, 'max_features': None}. Best is trial 323 with value: 0.33558594202603503.
[I 2024-12-04 12:19:40,557] Trial 325 finished with value: 0.3841367416854148 and parameters: {'n_estimators': 1067, 'learning_rate': 0.09576557301463426, 'max_depth': 8, 'min_samples_split': 6, 'min_samples_leaf': 3, 'subsample': 0.9465381573613936, 'max_features': None}. Best is trial 323 with value: 0.33558594202603503.
[I 2024-12-04 12:19:41,419] Trial 342 finished with value: 0.8327849226799429 and parameters: {'n_estimators': 754, 'learning_rate': 0.012343154008373967, 'max_depth': 5, 'min_samples_split': 7, 'min_samples_leaf': 5, 'subsample': 0.7944780478115457, 'max_features': 'log2'}. Best is trial 323 with value: 0.33558594202603503.
