[I 2024-12-04 12:36:21,600] Trial 670 finished with value: 0.29698809591879727 and parameters: {'n_estimators': 972, 'learning_rate': 0.08861501595435112, 'max_depth': 8, 'min_samples_split': 5, 'min_samples_leaf': 2, 'subsample': 0.6920419114846621, 'max_features': 'sqrt'}. Best is trial 621 with value: 0.2256726988932517.
[I 2024-12-04 12:36:26,321] Trial 678 finished with value: 0.27318439117584886 and parameters: {'n_estimators': 722, 'learning_rate': 0.09900626628974393, 'max_depth': 7, 'min_samples_split': 2, 'min_samples_leaf': 1, 'subsample': 0.7126414601515968, 'max_features': 'sqrt'}. Best is trial 621 with value: 0.2256726988932517.
[I 2024-12-04 12:36:30,363] Trial 669 finished with value: 0.23109509096640296 and parameters: {'n_estimators': 1169, 'learning_rate': 0.09808969266442817, 'max_depth': 8, 'min_samples_split': 5, 'min_samples_leaf': 1, 'subsample': 0.9167549630947635, 'max_features': 'sqrt'}. Best is trial 621 with value: 0.2256726988932517.
[I 2024-12-04 12:36:32,208] Trial 668 finished with value: 0.39437591412388073 and parameters: {'n_estimators': 1291, 'learning_rate': 0.08168894811499453, 'max_depth': 6, 'min_samples_split': 5, 'min_samples_leaf': 5, 'subsample': 0.9322842232393687, 'max_features': 'sqrt'}. Best is trial 621 with value: 0.2256726988932517.
[I 2024-12-04 12:36:34,351] Trial 687 finished with value: 0.5823019474129775 and parameters: {'n_estimators': 379, 'learning_rate': 0.016714978170015396, 'max_depth': 6, 'min_samples_split': 16, 'min_samples_leaf': 1, 'subsample': 0.6757272610115286, 'max_features': 'sqrt'}. Best is trial 621 with value: 0.2256726988932517.
[I 2024-12-04 12:36:34,551] Trial 677 finished with value: 0.25441163722714316 and parameters: {'n_estimators': 945, 'learning_rate': 0.061588399986487574, 'max_depth': 8, 'min_samples_split': 5, 'min_samples_leaf': 1, 'subsample': 0.6524267912609011, 'max_features': 'sqrt'}. Best is trial 621 with value: 0.2256726988932517.
[I 2024-12-04 12:36:34,598] Trial 674 finished with value: 0.29620212572546584 and parameters: {'n_estimators': 1080, 'learning_rate': 0.08779154571336514, 'max_depth': 7, 'min_samples_split': 3, 'min_samples_leaf': 2, 'subsample': 0.6234556741106893, 'max_features': 'sqrt'}. Best is trial 621 with value: 0.2256726988932517.
[I 2024-12-04 12:36:34,640] Trial 688 finished with value: 0.4465569318272037 and parameters: {'n_estimators': 507, 'learning_rate': 0.06680871507774812, 'max_depth': 10, 'min_samples_split': 9, 'min_samples_leaf': 4, 'subsample': 0.9477404482728724, 'max_features': 'log2'}. Best is trial 621 with value: 0.2256726988932517.
[I 2024-12-04 12:36:40,828] Trial 681 finished with value: 0.6245297771847331 and parameters: {'n_estimators': 813, 'learning_rate': 0.010750130094740507, 'max_depth': 12, 'min_samples_split': 10, 'min_samples_leaf': 2, 'subsample': 0.983719651590906, 'max_features': 'log2'}. Best is trial 621 with value: 0.2256726988932517.
[I 2024-12-04 12:36:41,280] Trial 664 finished with value: 0.31868506199616636 and parameters: {'n_estimators': 1478, 'learning_rate': 0.07501590068500014, 'max_depth': 9, 'min_samples_split': 11, 'min_samples_leaf': 1, 'subsample': 0.8141301439224842, 'max_features': None}. Best is trial 621 with value: 0.2256726988932517.
[I 2024-12-04 12:36:46,449] Trial 672 finished with value: 0.3787313007606887 and parameters: {'n_estimators': 1339, 'learning_rate': 0.020082256977680582, 'max_depth': 11, 'min_samples_split': 19, 'min_samples_leaf': 2, 'subsample': 0.6071634145534843, 'max_features': 'log2'}. Best is trial 621 with value: 0.2256726988932517.
[I 2024-12-04 12:36:46,848] Trial 684 finished with value: 0.23197172260883545 and parameters: {'n_estimators': 834, 'learning_rate': 0.09990141002997326, 'max_depth': 7, 'min_samples_split': 3, 'min_samples_leaf': 1, 'subsample': 0.8789393182854066, 'max_features': 'sqrt'}. Best is trial 621 with value: 0.2256726988932517.
[I 2024-12-04 12:36:48,023] Trial 675 finished with value: 0.23524837132274473 and parameters: {'n_estimators': 1157, 'learning_rate': 0.09922219597968464, 'max_depth': 5, 'min_samples_split': 2, 'min_samples_leaf': 1, 'subsample': 0.7241191845211511, 'max_features': 'sqrt'}. Best is trial 621 with value: 0.2256726988932517.
[I 2024-12-04 12:36:49,732] Trial 704 finished with value: 0.47301926214306655 and parameters: {'n_estimators': 175, 'learning_rate': 0.013963863954274246, 'max_depth': 9, 'min_samples_split': 7, 'min_samples_leaf': 6, 'subsample': 0.9682936556064582, 'max_features': None}. Best is trial 621 with value: 0.2256726988932517.
[I 2024-12-04 12:36:49,754] Trial 676 finished with value: 0.2442725788124183 and parameters: {'n_estimators': 1198, 'learning_rate': 0.09753744317016817, 'max_depth': 7, 'min_samples_split': 3, 'min_samples_leaf': 1, 'subsample': 0.9922557172281246, 'max_features': 'sqrt'}. Best is trial 621 with value: 0.2256726988932517.
[I 2024-12-04 12:36:56,622] Trial 686 finished with value: 0.30055595323588047 and parameters: {'n_estimators': 970, 'learning_rate': 0.05670523394519364, 'max_depth': 7, 'min_samples_split': 2, 'min_samples_leaf': 1, 'subsample': 0.9277011891647494, 'max_features': 'log2'}. Best is trial 621 with value: 0.2256726988932517.
[I 2024-12-04 12:37:01,580] Trial 695 finished with value: 0.38197991676606197 and parameters: {'n_estimators': 751, 'learning_rate': 0.04125659951294844, 'max_depth': 9, 'min_samples_split': 6, 'min_samples_leaf': 5, 'subsample': 0.664367441426621, 'max_features': 'sqrt'}. Best is trial 621 with value: 0.2256726988932517.
[I 2024-12-04 12:37:05,802] Trial 702 finished with value: 0.49435446889099904 and parameters: {'n_estimators': 510, 'learning_rate': 0.020327539627351718, 'max_depth': 9, 'min_samples_split': 11, 'min_samples_leaf': 10, 'subsample': 0.9407979216698326, 'max_features': None}. Best is trial 621 with value: 0.2256726988932517.
[I 2024-12-04 12:37:07,624] Trial 682 finished with value: 0.36539234159482703 and parameters: {'n_estimators': 1393, 'learning_rate': 0.04580240208956759, 'max_depth': 12, 'min_samples_split': 5, 'min_samples_leaf': 3, 'subsample': 0.6545842758803924, 'max_features': 'log2'}. Best is trial 621 with value: 0.2256726988932517.
[I 2024-12-04 12:37:10,028] Trial 685 finished with value: 0.2559996829048497 and parameters: {'n_estimators': 1156, 'learning_rate': 0.051882384877411696, 'max_depth': 9, 'min_samples_split': 8, 'min_samples_leaf': 1, 'subsample': 0.6945578120785109, 'max_features': 'sqrt'}. Best is trial 621 with value: 0.2256726988932517.
[I 2024-12-04 12:37:12,801] Trial 683 finished with value: 0.23143289249852703 and parameters: {'n_estimators': 1364, 'learning_rate': 0.05703137671300258, 'max_depth': 12, 'min_samples_split': 4, 'min_samples_leaf': 1, 'subsample': 0.6098410959393491, 'max_features': 'sqrt'}. Best is trial 621 with value: 0.2256726988932517.
[I 2024-12-04 12:37:16,071] Trial 696 finished with value: 0.2915623356720081 and parameters: {'n_estimators': 952, 'learning_rate': 0.07889141315045958, 'max_depth': 9, 'min_samples_split': 11, 'min_samples_leaf': 2, 'subsample': 0.7759458784353792, 'max_features': 'sqrt'}. Best is trial 621 with value: 0.2256726988932517.
[I 2024-12-04 12:37:16,102] Trial 680 finished with value: 0.24201545304680253 and parameters: {'n_estimators': 1319, 'learning_rate': 0.04687785588424048, 'max_depth': 12, 'min_samples_split': 8, 'min_samples_leaf': 1, 'subsample': 0.7180670012200256, 'max_features': 'sqrt'}. Best is trial 621 with value: 0.2256726988932517.
[I 2024-12-04 12:37:16,618] Trial 689 finished with value: 0.24282289648692987 and parameters: {'n_estimators': 1149, 'learning_rate': 0.08712143225178473, 'max_depth': 9, 'min_samples_split': 3, 'min_samples_leaf': 1, 'subsample': 0.6699306153258819, 'max_features': 'sqrt'}. Best is trial 621 with value: 0.2256726988932517.
[I 2024-12-04 12:37:20,485] Trial 691 finished with value: 0.3882720165060905 and parameters: {'n_estimators': 1232, 'learning_rate': 0.0766071564448381, 'max_depth': 10, 'min_samples_split': 5, 'min_samples_leaf': 5, 'subsample': 0.9282897399353771, 'max_features': 'sqrt'}. Best is trial 621 with value: 0.2256726988932517.
[I 2024-12-04 12:37:24,195] Trial 706 finished with value: 0.3512354138284186 and parameters: {'n_estimators': 564, 'learning_rate': 0.08494099310676932, 'max_depth': 6, 'min_samples_split': 4, 'min_samples_leaf': 2, 'subsample': 0.7583833527029754, 'max_features': 'log2'}. Best is trial 621 with value: 0.2256726988932517.
[I 2024-12-04 12:37:24,284] Trial 699 finished with value: 0.2350884751723395 and parameters: {'n_estimators': 983, 'learning_rate': 0.09996653648598773, 'max_depth': 7, 'min_samples_split': 2, 'min_samples_leaf': 1, 'subsample': 0.9320928732164125, 'max_features': 'sqrt'}. Best is trial 621 with value: 0.2256726988932517.
[I 2024-12-04 12:37:24,289] Trial 716 finished with value: 0.31256770346505897 and parameters: {'n_estimators': 386, 'learning_rate': 0.07625166146559177, 'max_depth': 6, 'min_samples_split': 3, 'min_samples_leaf': 2, 'subsample': 0.8772797897240565, 'max_features': 'sqrt'}. Best is trial 621 with value: 0.2256726988932517.
[I 2024-12-04 12:37:24,299] Trial 692 finished with value: 0.253722329034424 and parameters: {'n_estimators': 1163, 'learning_rate': 0.04469231216868611, 'max_depth': 8, 'min_samples_split': 3, 'min_samples_leaf': 1, 'subsample': 0.6235587821824035, 'max_features': 'sqrt'}. Best is trial 621 with value: 0.2256726988932517.
[I 2024-12-04 12:37:27,115] Trial 694 finished with value: 0.30035772724360404 and parameters: {'n_estimators': 1176, 'learning_rate': 0.07930613535084491, 'max_depth': 6, 'min_samples_split': 5, 'min_samples_leaf': 2, 'subsample': 0.858136796602476, 'max_features': 'sqrt'}. Best is trial 621 with value: 0.2256726988932517.
[I 2024-12-04 12:37:31,729] Trial 700 finished with value: 0.2691952583818099 and parameters: {'n_estimators': 1034, 'learning_rate': 0.05781528765031413, 'max_depth': 5, 'min_samples_split': 6, 'min_samples_leaf': 1, 'subsample': 0.6096215960611691, 'max_features': 'sqrt'}. Best is trial 621 with value: 0.2256726988932517.
[I 2024-12-04 12:37:32,301] Trial 705 finished with value: 0.28003277914853597 and parameters: {'n_estimators': 838, 'learning_rate': 0.05575810719353417, 'max_depth': 7, 'min_samples_split': 7, 'min_samples_leaf': 1, 'subsample': 0.8511366702086564, 'max_features': 'sqrt'}. Best is trial 621 with value: 0.2256726988932517.
[I 2024-12-04 12:37:35,521] Trial 697 finished with value: 0.38487606801511415 and parameters: {'n_estimators': 1244, 'learning_rate': 0.07178569717850176, 'max_depth': 8, 'min_samples_split': 6, 'min_samples_leaf': 4, 'subsample': 0.6911985348027453, 'max_features': 'log2'}. Best is trial 621 with value: 0.2256726988932517.
[I 2024-12-04 12:37:36,542] Trial 709 finished with value: 0.28291738265036986 and parameters: {'n_estimators': 808, 'learning_rate': 0.06529463086413918, 'max_depth': 8, 'min_samples_split': 7, 'min_samples_leaf': 2, 'subsample': 0.9567138520448097, 'max_features': 'sqrt'}. Best is trial 621 with value: 0.2256726988932517.
[I 2024-12-04 12:37:38,165] Trial 698 finished with value: 0.2486291038619449 and parameters: {'n_estimators': 1212, 'learning_rate': 0.049211846476373555, 'max_depth': 9, 'min_samples_split': 7, 'min_samples_leaf': 1, 'subsample': 0.7477777348382239, 'max_features': 'sqrt'}. Best is trial 621 with value: 0.2256726988932517.
[I 2024-12-04 12:37:40,454] Trial 690 finished with value: 0.4252571701577253 and parameters: {'n_estimators': 1462, 'learning_rate': 0.015155844163881558, 'max_depth': 8, 'min_samples_split': 13, 'min_samples_leaf': 4, 'subsample': 0.686036104887995, 'max_features': None}. Best is trial 621 with value: 0.2256726988932517.
[I 2024-12-04 12:37:40,826] Trial 701 finished with value: 0.3896831593553238 and parameters: {'n_estimators': 1179, 'learning_rate': 0.08271147457267727, 'max_depth': 10, 'min_samples_split': 16, 'min_samples_leaf': 5, 'subsample': 0.8472072358391742, 'max_features': 'sqrt'}. Best is trial 621 with value: 0.2256726988932517.
[I 2024-12-04 12:37:41,970] Trial 693 finished with value: 0.3365036846090409 and parameters: {'n_estimators': 1478, 'learning_rate': 0.03302000071888763, 'max_depth': 9, 'min_samples_split': 4, 'min_samples_leaf': 2, 'subsample': 0.6560422551583667, 'max_features': 'log2'}. Best is trial 621 with value: 0.2256726988932517.
[I 2024-12-04 12:37:44,710] Trial 712 finished with value: 0.2546478135123585 and parameters: {'n_estimators': 884, 'learning_rate': 0.06846706430370023, 'max_depth': 7, 'min_samples_split': 3, 'min_samples_leaf': 1, 'subsample': 0.9626267105808873, 'max_features': 'sqrt'}. Best is trial 621 with value: 0.2256726988932517.
[I 2024-12-04 12:37:46,837] Trial 710 finished with value: 0.28643890589518406 and parameters: {'n_estimators': 951, 'learning_rate': 0.07462326118097908, 'max_depth': 7, 'min_samples_split': 7, 'min_samples_leaf': 2, 'subsample': 0.8914820731245747, 'max_features': 'sqrt'}. Best is trial 621 with value: 0.2256726988932517.
[I 2024-12-04 12:37:51,106] Trial 703 finished with value: 0.29686611417820863 and parameters: {'n_estimators': 1309, 'learning_rate': 0.09562409094158353, 'max_depth': 8, 'min_samples_split': 6, 'min_samples_leaf': 2, 'subsample': 0.8712476584575499, 'max_features': 'sqrt'}. Best is trial 621 with value: 0.2256726988932517.
[I 2024-12-04 12:37:54,455] Trial 715 finished with value: 0.3628335426337613 and parameters: {'n_estimators': 939, 'learning_rate': 0.09520382995713106, 'max_depth': 5, 'min_samples_split': 2, 'min_samples_leaf': 3, 'subsample': 0.9290262964319244, 'max_features': 'sqrt'}. Best is trial 621 with value: 0.2256726988932517.
[I 2024-12-04 12:37:55,476] Trial 714 finished with value: 0.29699132850463006 and parameters: {'n_estimators': 1008, 'learning_rate': 0.09963305248182619, 'max_depth': 8, 'min_samples_split': 10, 'min_samples_leaf': 2, 'subsample': 0.9173256018430312, 'max_features': 'sqrt'}. Best is trial 621 with value: 0.2256726988932517.
[I 2024-12-04 12:37:55,528] Trial 708 finished with value: 0.3901495814607343 and parameters: {'n_estimators': 1093, 'learning_rate': 0.08823967350531439, 'max_depth': 5, 'min_samples_split': 5, 'min_samples_leaf': 2, 'subsample': 0.747521849654508, 'max_features': None}. Best is trial 621 with value: 0.2256726988932517.
[I 2024-12-04 12:37:56,975] Trial 713 finished with value: 0.3110888915428392 and parameters: {'n_estimators': 933, 'learning_rate': 0.08268030367193252, 'max_depth': 8, 'min_samples_split': 6, 'min_samples_leaf': 2, 'subsample': 0.8676626892787541, 'max_features': 'sqrt'}. Best is trial 621 with value: 0.2256726988932517.
[I 2024-12-04 12:37:57,005] Trial 718 finished with value: 0.306152376884222 and parameters: {'n_estimators': 810, 'learning_rate': 0.049041756625932964, 'max_depth': 7, 'min_samples_split': 6, 'min_samples_leaf': 2, 'subsample': 0.7567371475060312, 'max_features': 'sqrt'}. Best is trial 621 with value: 0.2256726988932517.
[I 2024-12-04 12:37:58,277] Trial 711 finished with value: 0.2958172985784707 and parameters: {'n_estimators': 1150, 'learning_rate': 0.08534147819060048, 'max_depth': 8, 'min_samples_split': 3, 'min_samples_leaf': 2, 'subsample': 0.9112934138999208, 'max_features': 'sqrt'}. Best is trial 621 with value: 0.2256726988932517.
[I 2024-12-04 12:38:04,811] Trial 720 finished with value: 0.35880678838043495 and parameters: {'n_estimators': 896, 'learning_rate': 0.09201585855722001, 'max_depth': 4, 'min_samples_split': 2, 'min_samples_leaf': 4, 'subsample': 0.7387264245878048, 'max_features': 'sqrt'}. Best is trial 621 with value: 0.2256726988932517.
[I 2024-12-04 12:38:05,508] Trial 707 finished with value: 0.3041205059777758 and parameters: {'n_estimators': 1386, 'learning_rate': 0.08750091633522795, 'max_depth': 11, 'min_samples_split': 4, 'min_samples_leaf': 2, 'subsample': 0.9628753470032474, 'max_features': 'sqrt'}. Best is trial 621 with value: 0.2256726988932517.
[I 2024-12-04 12:38:10,182] Trial 719 finished with value: 0.24499101791482378 and parameters: {'n_estimators': 1052, 'learning_rate': 0.09303546488081721, 'max_depth': 9, 'min_samples_split': 8, 'min_samples_leaf': 1, 'subsample': 0.9510137870357742, 'max_features': 'sqrt'}. Best is trial 621 with value: 0.2256726988932517.
[I 2024-12-04 12:38:11,880] Trial 726 finished with value: 0.5330052175905672 and parameters: {'n_estimators': 796, 'learning_rate': 0.08422111105566786, 'max_depth': 9, 'min_samples_split': 9, 'min_samples_leaf': 9, 'subsample': 0.8158217018286835, 'max_features': 'log2'}. Best is trial 621 with value: 0.2256726988932517.
[I 2024-12-04 12:38:13,656] Trial 723 finished with value: 0.2658782250683202 and parameters: {'n_estimators': 884, 'learning_rate': 0.07716029658103855, 'max_depth': 8, 'min_samples_split': 3, 'min_samples_leaf': 1, 'subsample': 0.8431907331865345, 'max_features': 'sqrt'}. Best is trial 621 with value: 0.2256726988932517.
[I 2024-12-04 12:38:18,149] Trial 717 finished with value: 0.26635641273725574 and parameters: {'n_estimators': 1348, 'learning_rate': 0.08760002741975864, 'max_depth': 8, 'min_samples_split': 5, 'min_samples_leaf': 1, 'subsample': 0.890048215984691, 'max_features': 'sqrt'}. Best is trial 621 with value: 0.2256726988932517.
[I 2024-12-04 12:38:21,453] Trial 731 finished with value: 0.6546055811794913 and parameters: {'n_estimators': 776, 'learning_rate': 0.07663114671996088, 'max_depth': 12, 'min_samples_split': 14, 'min_samples_leaf': 8, 'subsample': 0.6981491275089889, 'max_features': 'log2'}. Best is trial 621 with value: 0.2256726988932517.
[I 2024-12-04 12:38:24,600] Trial 725 finished with value: 0.2631449217697573 and parameters: {'n_estimators': 1097, 'learning_rate': 0.09525895396166971, 'max_depth': 9, 'min_samples_split': 10, 'min_samples_leaf': 1, 'subsample': 0.7194180218144725, 'max_features': 'log2'}. Best is trial 621 with value: 0.2256726988932517.
[I 2024-12-04 12:38:26,233] Trial 728 finished with value: 0.27372490676731664 and parameters: {'n_estimators': 969, 'learning_rate': 0.07052032827026418, 'max_depth': 3, 'min_samples_split': 3, 'min_samples_leaf': 1, 'subsample': 0.795490061893827, 'max_features': 'sqrt'}. Best is trial 621 with value: 0.2256726988932517.
[I 2024-12-04 12:38:32,371] Trial 730 finished with value: 0.26103488481219306 and parameters: {'n_estimators': 989, 'learning_rate': 0.07477132832271494, 'max_depth': 8, 'min_samples_split': 3, 'min_samples_leaf': 1, 'subsample': 0.8636183109678155, 'max_features': 'sqrt'}. Best is trial 621 with value: 0.2256726988932517.
[I 2024-12-04 12:38:32,784] Trial 722 finished with value: 0.3445586830762766 and parameters: {'n_estimators': 1221, 'learning_rate': 0.08915563845815043, 'max_depth': 8, 'min_samples_split': 3, 'min_samples_leaf': 1, 'subsample': 0.9248910485353067, 'max_features': None}. Best is trial 621 with value: 0.2256726988932517.
[I 2024-12-04 12:38:33,765] Trial 721 finished with value: 0.3565488502540537 and parameters: {'n_estimators': 1388, 'learning_rate': 0.09024394020032962, 'max_depth': 8, 'min_samples_split': 2, 'min_samples_leaf': 3, 'subsample': 0.739997581368045, 'max_features': 'sqrt'}. Best is trial 621 with value: 0.2256726988932517.
[I 2024-12-04 12:38:35,640] Trial 736 finished with value: 0.26380446531783064 and parameters: {'n_estimators': 818, 'learning_rate': 0.09193149159985327, 'max_depth': 7, 'min_samples_split': 2, 'min_samples_leaf': 1, 'subsample': 0.9561999263276934, 'max_features': 'sqrt'}. Best is trial 621 with value: 0.2256726988932517.
[I 2024-12-04 12:38:37,179] Trial 738 finished with value: 0.27020302844816635 and parameters: {'n_estimators': 726, 'learning_rate': 0.09846801223083106, 'max_depth': 6, 'min_samples_split': 4, 'min_samples_leaf': 1, 'subsample': 0.8358418949415413, 'max_features': 'sqrt'}. Best is trial 621 with value: 0.2256726988932517.
[I 2024-12-04 12:38:39,679] Trial 727 finished with value: 0.24184145623442188 and parameters: {'n_estimators': 1110, 'learning_rate': 0.059975169152101104, 'max_depth': 5, 'min_samples_split': 2, 'min_samples_leaf': 1, 'subsample': 0.945178040888502, 'max_features': 'sqrt'}. Best is trial 621 with value: 0.2256726988932517.
[I 2024-12-04 12:38:43,368] Trial 732 finished with value: 0.4265471064885518 and parameters: {'n_estimators': 946, 'learning_rate': 0.013743467777999611, 'max_depth': 10, 'min_samples_split': 3, 'min_samples_leaf': 6, 'subsample': 0.6212389303871149, 'max_features': None}. Best is trial 621 with value: 0.2256726988932517.
[I 2024-12-04 12:38:43,389] Trial 724 finished with value: 0.3755678080833623 and parameters: {'n_estimators': 1402, 'learning_rate': 0.05263192101728242, 'max_depth': 10, 'min_samples_split': 7, 'min_samples_leaf': 4, 'subsample': 0.6086942922733346, 'max_features': 'sqrt'}. Best is trial 621 with value: 0.2256726988932517.
[I 2024-12-04 12:38:44,879] Trial 729 finished with value: 0.28984743604072644 and parameters: {'n_estimators': 1226, 'learning_rate': 0.08338070836576347, 'max_depth': 6, 'min_samples_split': 3, 'min_samples_leaf': 2, 'subsample': 0.9428913088474132, 'max_features': 'sqrt'}. Best is trial 621 with value: 0.2256726988932517.
[I 2024-12-04 12:38:50,133] Trial 758 finished with value: 0.9524178342864682 and parameters: {'n_estimators': 201, 'learning_rate': 0.053754526813219544, 'max_depth': 10, 'min_samples_split': 15, 'min_samples_leaf': 6, 'subsample': 0.6592825614111877, 'max_features': 'log2'}. Best is trial 621 with value: 0.2256726988932517.
[I 2024-12-04 12:38:50,179] Trial 733 finished with value: 0.23811977615814892 and parameters: {'n_estimators': 1179, 'learning_rate': 0.09413971945575843, 'max_depth': 8, 'min_samples_split': 3, 'min_samples_leaf': 1, 'subsample': 0.8823643870666397, 'max_features': 'sqrt'}. Best is trial 621 with value: 0.2256726988932517.
