[I 2024-12-04 12:18:02,243] Trial 131 finished with value: 0.2849855714824849 and parameters: {'n_estimators': 1263, 'learning_rate': 0.016633663266755513, 'max_depth': 9, 'min_samples_split': 7, 'min_samples_leaf': 1, 'subsample': 0.924907209785416, 'max_features': 'sqrt'}. Best is trial 16 with value: 0.24131607807430555.
[I 2024-12-04 12:18:03,208] Trial 133 finished with value: 0.2705045119943894 and parameters: {'n_estimators': 1098, 'learning_rate': 0.03827064388462925, 'max_depth': 5, 'min_samples_split': 3, 'min_samples_leaf': 1, 'subsample': 0.631876100781794, 'max_features': 'sqrt'}. Best is trial 16 with value: 0.24131607807430555.
[I 2024-12-04 12:18:05,195] Trial 151 finished with value: 0.34656803123003377 and parameters: {'n_estimators': 607, 'learning_rate': 0.06574522199497027, 'max_depth': 8, 'min_samples_split': 7, 'min_samples_leaf': 3, 'subsample': 0.8940435116282814, 'max_features': 'sqrt'}. Best is trial 16 with value: 0.24131607807430555.
[I 2024-12-04 12:18:05,246] Trial 149 finished with value: 0.3738451716358344 and parameters: {'n_estimators': 686, 'learning_rate': 0.035710985231895316, 'max_depth': 6, 'min_samples_split': 2, 'min_samples_leaf': 4, 'subsample': 0.6829281658311945, 'max_features': 'sqrt'}. Best is trial 16 with value: 0.24131607807430555.
[I 2024-12-04 12:18:06,576] Trial 140 finished with value: 0.28047512017890547 and parameters: {'n_estimators': 983, 'learning_rate': 0.0864675524484093, 'max_depth': 7, 'min_samples_split': 13, 'min_samples_leaf': 1, 'subsample': 0.9096819510017498, 'max_features': 'log2'}. Best is trial 16 with value: 0.24131607807430555.
[I 2024-12-04 12:18:08,994] Trial 137 finished with value: 0.36991520101271025 and parameters: {'n_estimators': 1105, 'learning_rate': 0.09009202746549036, 'max_depth': 10, 'min_samples_split': 4, 'min_samples_leaf': 3, 'subsample': 0.6014758585830241, 'max_features': 'sqrt'}. Best is trial 16 with value: 0.24131607807430555.
[I 2024-12-04 12:18:09,100] Trial 144 finished with value: 0.2876507242233625 and parameters: {'n_estimators': 858, 'learning_rate': 0.01814139683885187, 'max_depth': 9, 'min_samples_split': 2, 'min_samples_leaf': 1, 'subsample': 0.9654042846015161, 'max_features': 'sqrt'}. Best is trial 16 with value: 0.24131607807430555.
[I 2024-12-04 12:18:10,320] Trial 132 finished with value: 0.26970032551733386 and parameters: {'n_estimators': 1340, 'learning_rate': 0.01769360598614411, 'max_depth': 12, 'min_samples_split': 2, 'min_samples_leaf': 1, 'subsample': 0.8636710104220218, 'max_features': 'sqrt'}. Best is trial 16 with value: 0.24131607807430555.
[I 2024-12-04 12:18:10,325] Trial 142 finished with value: 0.28710553470567024 and parameters: {'n_estimators': 1000, 'learning_rate': 0.06419445810278387, 'max_depth': 12, 'min_samples_split': 15, 'min_samples_leaf': 2, 'subsample': 0.8094635301377054, 'max_features': 'log2'}. Best is trial 16 with value: 0.24131607807430555.
[I 2024-12-04 12:18:10,526] Trial 152 finished with value: 0.27334341490120817 and parameters: {'n_estimators': 625, 'learning_rate': 0.09555230492092916, 'max_depth': 5, 'min_samples_split': 7, 'min_samples_leaf': 1, 'subsample': 0.9199328504051681, 'max_features': 'sqrt'}. Best is trial 16 with value: 0.24131607807430555.
[I 2024-12-04 12:18:13,285] Trial 136 finished with value: 0.29084055144015175 and parameters: {'n_estimators': 1198, 'learning_rate': 0.024590989698391227, 'max_depth': 8, 'min_samples_split': 7, 'min_samples_leaf': 1, 'subsample': 0.8179703070614306, 'max_features': 'sqrt'}. Best is trial 16 with value: 0.24131607807430555.
[I 2024-12-04 12:18:13,605] Trial 153 finished with value: 0.28100451526099657 and parameters: {'n_estimators': 677, 'learning_rate': 0.06617557379319396, 'max_depth': 12, 'min_samples_split': 7, 'min_samples_leaf': 1, 'subsample': 0.6166372242109994, 'max_features': 'sqrt'}. Best is trial 16 with value: 0.24131607807430555.
[I 2024-12-04 12:18:14,365] Trial 155 finished with value: 0.28796000383567244 and parameters: {'n_estimators': 606, 'learning_rate': 0.09011205289207067, 'max_depth': 10, 'min_samples_split': 10, 'min_samples_leaf': 2, 'subsample': 0.9450636842092934, 'max_features': 'sqrt'}. Best is trial 16 with value: 0.24131607807430555.
[I 2024-12-04 12:18:17,863] Trial 135 finished with value: 0.43444956164600484 and parameters: {'n_estimators': 1263, 'learning_rate': 0.013088320252153325, 'max_depth': 9, 'min_samples_split': 2, 'min_samples_leaf': 4, 'subsample': 0.8944401859111594, 'max_features': None}. Best is trial 16 with value: 0.24131607807430555.
[I 2024-12-04 12:18:17,868] Trial 138 finished with value: 0.25495295033563786 and parameters: {'n_estimators': 1313, 'learning_rate': 0.02699502256482037, 'max_depth': 8, 'min_samples_split': 6, 'min_samples_leaf': 1, 'subsample': 0.752158058763561, 'max_features': 'sqrt'}. Best is trial 16 with value: 0.24131607807430555.
[I 2024-12-04 12:18:23,678] Trial 139 finished with value: 0.36680106424332043 and parameters: {'n_estimators': 1272, 'learning_rate': 0.04819281062189388, 'max_depth': 9, 'min_samples_split': 3, 'min_samples_leaf': 3, 'subsample': 0.7265973149947808, 'max_features': 'sqrt'}. Best is trial 16 with value: 0.24131607807430555.
[I 2024-12-04 12:18:24,501] Trial 147 finished with value: 0.2928826817820994 and parameters: {'n_estimators': 1074, 'learning_rate': 0.046308903423484586, 'max_depth': 12, 'min_samples_split': 2, 'min_samples_leaf': 2, 'subsample': 0.9339182703607705, 'max_features': 'sqrt'}. Best is trial 16 with value: 0.24131607807430555.
[I 2024-12-04 12:18:24,831] Trial 146 finished with value: 0.2718199866582607 and parameters: {'n_estimators': 1164, 'learning_rate': 0.04163201417402048, 'max_depth': 6, 'min_samples_split': 4, 'min_samples_leaf': 1, 'subsample': 0.8801024591896354, 'max_features': 'sqrt'}. Best is trial 16 with value: 0.24131607807430555.
[I 2024-12-04 12:18:25,185] Trial 148 finished with value: 0.33247882565287185 and parameters: {'n_estimators': 1041, 'learning_rate': 0.024392465367900733, 'max_depth': 10, 'min_samples_split': 10, 'min_samples_leaf': 1, 'subsample': 0.9089681322168323, 'max_features': 'log2'}. Best is trial 16 with value: 0.24131607807430555.
[I 2024-12-04 12:18:27,234] Trial 145 finished with value: 0.26380791675401205 and parameters: {'n_estimators': 1260, 'learning_rate': 0.03884733308568396, 'max_depth': 12, 'min_samples_split': 8, 'min_samples_leaf': 1, 'subsample': 0.9771521976064257, 'max_features': 'sqrt'}. Best is trial 16 with value: 0.24131607807430555.
[I 2024-12-04 12:18:27,250] Trial 141 finished with value: 0.35456435885177995 and parameters: {'n_estimators': 1464, 'learning_rate': 0.0604444642234958, 'max_depth': 4, 'min_samples_split': 7, 'min_samples_leaf': 4, 'subsample': 0.8394700355778335, 'max_features': 'sqrt'}. Best is trial 16 with value: 0.24131607807430555.
[I 2024-12-04 12:18:32,784] Trial 164 finished with value: 0.2944175979738054 and parameters: {'n_estimators': 802, 'learning_rate': 0.06439679568125231, 'max_depth': 11, 'min_samples_split': 13, 'min_samples_leaf': 2, 'subsample': 0.6675952955253893, 'max_features': 'sqrt'}. Best is trial 16 with value: 0.24131607807430555.
[I 2024-12-04 12:18:33,705] Trial 162 finished with value: 0.2466223516315644 and parameters: {'n_estimators': 868, 'learning_rate': 0.0484302536712812, 'max_depth': 10, 'min_samples_split': 4, 'min_samples_leaf': 1, 'subsample': 0.8232026516476941, 'max_features': 'sqrt'}. Best is trial 16 with value: 0.24131607807430555.
[I 2024-12-04 12:18:35,787] Trial 156 finished with value: 0.35867758416018664 and parameters: {'n_estimators': 1085, 'learning_rate': 0.0206068483567356, 'max_depth': 12, 'min_samples_split': 3, 'min_samples_leaf': 3, 'subsample': 0.9672923614294565, 'max_features': 'sqrt'}. Best is trial 16 with value: 0.24131607807430555.
[I 2024-12-04 12:18:38,959] Trial 161 finished with value: 0.2827791537757437 and parameters: {'n_estimators': 1047, 'learning_rate': 0.033138345332521836, 'max_depth': 12, 'min_samples_split': 12, 'min_samples_leaf': 1, 'subsample': 0.7024731177919434, 'max_features': 'log2'}. Best is trial 16 with value: 0.24131607807430555.
[I 2024-12-04 12:18:40,008] Trial 158 finished with value: 0.3540089828867668 and parameters: {'n_estimators': 1033, 'learning_rate': 0.04619081439675052, 'max_depth': 7, 'min_samples_split': 9, 'min_samples_leaf': 2, 'subsample': 0.9842132047001527, 'max_features': None}. Best is trial 16 with value: 0.24131607807430555.
[I 2024-12-04 12:18:42,303] Trial 154 finished with value: 0.25726217971155996 and parameters: {'n_estimators': 1191, 'learning_rate': 0.028468375706469876, 'max_depth': 9, 'min_samples_split': 4, 'min_samples_leaf': 1, 'subsample': 0.9578885246012419, 'max_features': 'sqrt'}. Best is trial 16 with value: 0.24131607807430555.
[I 2024-12-04 12:18:43,067] Trial 171 finished with value: 0.29436232457118006 and parameters: {'n_estimators': 633, 'learning_rate': 0.05303354384712374, 'max_depth': 5, 'min_samples_split': 6, 'min_samples_leaf': 1, 'subsample': 0.8646007555225382, 'max_features': 'sqrt'}. Best is trial 16 with value: 0.24131607807430555.
[I 2024-12-04 12:18:49,125] Trial 169 finished with value: 0.2720659387236121 and parameters: {'n_estimators': 900, 'learning_rate': 0.06269126275340747, 'max_depth': 6, 'min_samples_split': 5, 'min_samples_leaf': 1, 'subsample': 0.6155403711241837, 'max_features': 'sqrt'}. Best is trial 16 with value: 0.24131607807430555.
[I 2024-12-04 12:18:52,567] Trial 170 finished with value: 0.36616540090436017 and parameters: {'n_estimators': 961, 'learning_rate': 0.08607739010571382, 'max_depth': 7, 'min_samples_split': 14, 'min_samples_leaf': 3, 'subsample': 0.8145045180489092, 'max_features': 'log2'}. Best is trial 16 with value: 0.24131607807430555.
[I 2024-12-04 12:18:52,594] Trial 174 finished with value: 0.3301564595856816 and parameters: {'n_estimators': 794, 'learning_rate': 0.061899691956130716, 'max_depth': 3, 'min_samples_split': 8, 'min_samples_leaf': 1, 'subsample': 0.9496264601274917, 'max_features': 'sqrt'}. Best is trial 16 with value: 0.24131607807430555.
[I 2024-12-04 12:18:53,350] Trial 159 finished with value: 0.30275198768456574 and parameters: {'n_estimators': 1432, 'learning_rate': 0.09523256695594248, 'max_depth': 8, 'min_samples_split': 10, 'min_samples_leaf': 2, 'subsample': 0.9235759297293116, 'max_features': 'sqrt'}. Best is trial 16 with value: 0.24131607807430555.
[I 2024-12-04 12:18:53,384] Trial 157 finished with value: 0.4434912876102163 and parameters: {'n_estimators': 1353, 'learning_rate': 0.047595436095175754, 'max_depth': 11, 'min_samples_split': 4, 'min_samples_leaf': 3, 'subsample': 0.959080274456198, 'max_features': None}. Best is trial 16 with value: 0.24131607807430555.
[I 2024-12-04 12:18:55,964] Trial 163 finished with value: 0.27177022966106745 and parameters: {'n_estimators': 1337, 'learning_rate': 0.029697433908352847, 'max_depth': 11, 'min_samples_split': 14, 'min_samples_leaf': 1, 'subsample': 0.6907048744976456, 'max_features': 'sqrt'}. Best is trial 16 with value: 0.24131607807430555.
[I 2024-12-04 12:18:56,405] Trial 160 finished with value: 0.2893752101667399 and parameters: {'n_estimators': 1382, 'learning_rate': 0.051826725957298606, 'max_depth': 10, 'min_samples_split': 9, 'min_samples_leaf': 2, 'subsample': 0.8864637709437238, 'max_features': 'sqrt'}. Best is trial 16 with value: 0.24131607807430555.
[I 2024-12-04 12:18:59,611] Trial 168 finished with value: 0.37204383393673346 and parameters: {'n_estimators': 1156, 'learning_rate': 0.054795136455759653, 'max_depth': 7, 'min_samples_split': 15, 'min_samples_leaf': 3, 'subsample': 0.9880796463756027, 'max_features': 'log2'}. Best is trial 16 with value: 0.24131607807430555.
[I 2024-12-04 12:19:02,856] Trial 175 finished with value: 0.2619213783798652 and parameters: {'n_estimators': 861, 'learning_rate': 0.02017836107391983, 'max_depth': 11, 'min_samples_split': 3, 'min_samples_leaf': 1, 'subsample': 0.7558393275587071, 'max_features': 'sqrt'}. Best is trial 16 with value: 0.24131607807430555.
[I 2024-12-04 12:19:03,985] Trial 167 finished with value: 0.3051518657781618 and parameters: {'n_estimators': 1278, 'learning_rate': 0.034275269991829956, 'max_depth': 4, 'min_samples_split': 2, 'min_samples_leaf': 2, 'subsample': 0.6921966897256313, 'max_features': 'sqrt'}. Best is trial 16 with value: 0.24131607807430555.
[I 2024-12-04 12:19:06,712] Trial 165 finished with value: 0.289571450634085 and parameters: {'n_estimators': 1460, 'learning_rate': 0.039709253153353594, 'max_depth': 7, 'min_samples_split': 2, 'min_samples_leaf': 2, 'subsample': 0.9573712293471729, 'max_features': 'sqrt'}. Best is trial 16 with value: 0.24131607807430555.
[I 2024-12-04 12:19:07,724] Trial 191 finished with value: 0.5883285326254121 and parameters: {'n_estimators': 524, 'learning_rate': 0.07749464552648681, 'max_depth': 3, 'min_samples_split': 4, 'min_samples_leaf': 4, 'subsample': 0.9236953543589894, 'max_features': 'log2'}. Best is trial 16 with value: 0.24131607807430555.
[I 2024-12-04 12:19:10,536] Trial 188 finished with value: 0.3514663152224667 and parameters: {'n_estimators': 705, 'learning_rate': 0.04606873840322349, 'max_depth': 9, 'min_samples_split': 5, 'min_samples_leaf': 3, 'subsample': 0.8281703532932888, 'max_features': 'sqrt'}. Best is trial 16 with value: 0.24131607807430555.
[I 2024-12-04 12:19:11,628] Trial 179 finished with value: 0.3467200388588162 and parameters: {'n_estimators': 1013, 'learning_rate': 0.028928860159838962, 'max_depth': 10, 'min_samples_split': 4, 'min_samples_leaf': 2, 'subsample': 0.9838138103344936, 'max_features': 'log2'}. Best is trial 16 with value: 0.24131607807430555.
[I 2024-12-04 12:19:11,633] Trial 166 finished with value: 0.27880393244966656 and parameters: {'n_estimators': 1466, 'learning_rate': 0.07525012760465251, 'max_depth': 9, 'min_samples_split': 4, 'min_samples_leaf': 2, 'subsample': 0.978615829969806, 'max_features': 'log2'}. Best is trial 16 with value: 0.24131607807430555.
[I 2024-12-04 12:19:13,899] Trial 173 finished with value: 0.32300969293376625 and parameters: {'n_estimators': 1189, 'learning_rate': 0.09289092245993473, 'max_depth': 4, 'min_samples_split': 13, 'min_samples_leaf': 2, 'subsample': 0.9417884376265507, 'max_features': 'log2'}. Best is trial 16 with value: 0.24131607807430555.
[I 2024-12-04 12:19:15,141] Trial 172 finished with value: 0.272403749865803 and parameters: {'n_estimators': 1276, 'learning_rate': 0.0339995603365904, 'max_depth': 10, 'min_samples_split': 2, 'min_samples_leaf': 1, 'subsample': 0.8723595836322158, 'max_features': 'sqrt'}. Best is trial 16 with value: 0.24131607807430555.
[I 2024-12-04 12:19:21,630] Trial 189 finished with value: 0.30433390951066164 and parameters: {'n_estimators': 876, 'learning_rate': 0.04059615683161939, 'max_depth': 11, 'min_samples_split': 5, 'min_samples_leaf': 2, 'subsample': 0.7975527031080016, 'max_features': 'sqrt'}. Best is trial 16 with value: 0.24131607807430555.
[I 2024-12-04 12:19:23,413] Trial 177 finished with value: 0.4740357016162492 and parameters: {'n_estimators': 1257, 'learning_rate': 0.04537002157052473, 'max_depth': 3, 'min_samples_split': 4, 'min_samples_leaf': 3, 'subsample': 0.6186389106838522, 'max_features': 'log2'}. Best is trial 16 with value: 0.24131607807430555.
[I 2024-12-04 12:19:24,231] Trial 183 finished with value: 0.3024429435591935 and parameters: {'n_estimators': 1044, 'learning_rate': 0.046179859172969746, 'max_depth': 5, 'min_samples_split': 2, 'min_samples_leaf': 2, 'subsample': 0.8654575184578265, 'max_features': 'sqrt'}. Best is trial 16 with value: 0.24131607807430555.
[I 2024-12-04 12:19:26,961] Trial 176 finished with value: 0.27152600294612034 and parameters: {'n_estimators': 1332, 'learning_rate': 0.02238807574693191, 'max_depth': 10, 'min_samples_split': 8, 'min_samples_leaf': 1, 'subsample': 0.7253302243718921, 'max_features': 'sqrt'}. Best is trial 16 with value: 0.24131607807430555.
[I 2024-12-04 12:19:28,953] Trial 181 finished with value: 0.3149706991490302 and parameters: {'n_estimators': 1244, 'learning_rate': 0.05740081302692642, 'max_depth': 4, 'min_samples_split': 5, 'min_samples_leaf': 2, 'subsample': 0.9461756360264505, 'max_features': 'sqrt'}. Best is trial 16 with value: 0.24131607807430555.
[I 2024-12-04 12:19:30,755] Trial 178 finished with value: 0.29223497649654034 and parameters: {'n_estimators': 1370, 'learning_rate': 0.05532131420178196, 'max_depth': 6, 'min_samples_split': 10, 'min_samples_leaf': 2, 'subsample': 0.6812862239400418, 'max_features': 'sqrt'}. Best is trial 16 with value: 0.24131607807430555.
[I 2024-12-04 12:19:32,589] Trial 180 finished with value: 0.3267106975529641 and parameters: {'n_estimators': 1366, 'learning_rate': 0.031163087996489314, 'max_depth': 6, 'min_samples_split': 7, 'min_samples_leaf': 1, 'subsample': 0.8429974144539701, 'max_features': 'log2'}. Best is trial 16 with value: 0.24131607807430555.
[I 2024-12-04 12:19:32,649] Trial 192 finished with value: 0.2909076083551263 and parameters: {'n_estimators': 943, 'learning_rate': 0.04664599213725644, 'max_depth': 9, 'min_samples_split': 10, 'min_samples_leaf': 1, 'subsample': 0.9712694131913651, 'max_features': 'sqrt'}. Best is trial 16 with value: 0.24131607807430555.
[I 2024-12-04 12:19:39,258] Trial 182 finished with value: 0.25231559440322965 and parameters: {'n_estimators': 1407, 'learning_rate': 0.06111300279707212, 'max_depth': 6, 'min_samples_split': 6, 'min_samples_leaf': 1, 'subsample': 0.8808033603643821, 'max_features': 'sqrt'}. Best is trial 16 with value: 0.24131607807430555.
[I 2024-12-04 12:19:41,064] Trial 186 finished with value: 0.255614539226324 and parameters: {'n_estimators': 1362, 'learning_rate': 0.03449877275422326, 'max_depth': 12, 'min_samples_split': 5, 'min_samples_leaf': 1, 'subsample': 0.9959204498676871, 'max_features': 'sqrt'}. Best is trial 16 with value: 0.24131607807430555.
[I 2024-12-04 12:19:42,399] Trial 194 finished with value: 0.2685422310283233 and parameters: {'n_estimators': 967, 'learning_rate': 0.06237301916525886, 'max_depth': 6, 'min_samples_split': 8, 'min_samples_leaf': 1, 'subsample': 0.654581159968405, 'max_features': 'sqrt'}. Best is trial 16 with value: 0.24131607807430555.
[I 2024-12-04 12:19:44,186] Trial 185 finished with value: 0.25603886513947777 and parameters: {'n_estimators': 1430, 'learning_rate': 0.03398327011014126, 'max_depth': 12, 'min_samples_split': 12, 'min_samples_leaf': 1, 'subsample': 0.9656477859187536, 'max_features': 'log2'}. Best is trial 16 with value: 0.24131607807430555.
[I 2024-12-04 12:19:46,031] Trial 197 finished with value: 0.3044035853351402 and parameters: {'n_estimators': 855, 'learning_rate': 0.0648467473265715, 'max_depth': 5, 'min_samples_split': 2, 'min_samples_leaf': 2, 'subsample': 0.6418203960081812, 'max_features': 'sqrt'}. Best is trial 16 with value: 0.24131607807430555.
[I 2024-12-04 12:19:46,111] Trial 184 finished with value: 0.2680654790476625 and parameters: {'n_estimators': 1461, 'learning_rate': 0.03224146375460067, 'max_depth': 8, 'min_samples_split': 4, 'min_samples_leaf': 1, 'subsample': 0.8113544374822268, 'max_features': 'sqrt'}. Best is trial 16 with value: 0.24131607807430555.
[I 2024-12-04 12:19:46,112] Trial 206 finished with value: 0.3557535095726035 and parameters: {'n_estimators': 600, 'learning_rate': 0.015228209410710231, 'max_depth': 11, 'min_samples_split': 4, 'min_samples_leaf': 2, 'subsample': 0.7175045002353292, 'max_features': 'sqrt'}. Best is trial 16 with value: 0.24131607807430555.
[I 2024-12-04 12:19:48,599] Trial 187 finished with value: 0.27463165469525674 and parameters: {'n_estimators': 1413, 'learning_rate': 0.012741667652748877, 'max_depth': 12, 'min_samples_split': 7, 'min_samples_leaf': 1, 'subsample': 0.7962213076504533, 'max_features': 'sqrt'}. Best is trial 16 with value: 0.24131607807430555.
[I 2024-12-04 12:19:53,287] Trial 190 finished with value: 0.3148555802738005 and parameters: {'n_estimators': 1464, 'learning_rate': 0.020969029001044838, 'max_depth': 6, 'min_samples_split': 9, 'min_samples_leaf': 2, 'subsample': 0.978241677850685, 'max_features': 'sqrt'}. Best is trial 16 with value: 0.24131607807430555.
[I 2024-12-04 12:19:54,498] Trial 201 finished with value: 0.2761259214761665 and parameters: {'n_estimators': 955, 'learning_rate': 0.03852534159669363, 'max_depth': 5, 'min_samples_split': 3, 'min_samples_leaf': 1, 'subsample': 0.6228438580420984, 'max_features': 'sqrt'}. Best is trial 16 with value: 0.24131607807430555.
[I 2024-12-04 12:19:56,878] Trial 195 finished with value: 0.2939597764589658 and parameters: {'n_estimators': 1173, 'learning_rate': 0.032264834046603054, 'max_depth': 9, 'min_samples_split': 2, 'min_samples_leaf': 2, 'subsample': 0.9911613642265334, 'max_features': 'sqrt'}. Best is trial 16 with value: 0.24131607807430555.
[I 2024-12-04 12:19:59,142] Trial 211 finished with value: 0.4149359095501523 and parameters: {'n_estimators': 697, 'learning_rate': 0.019472733575081527, 'max_depth': 11, 'min_samples_split': 2, 'min_samples_leaf': 1, 'subsample': 0.7377466357266186, 'max_features': 'log2'}. Best is trial 16 with value: 0.24131607807430555.
[I 2024-12-04 12:20:00,603] Trial 209 finished with value: 0.29363017318145346 and parameters: {'n_estimators': 808, 'learning_rate': 0.023555609720577374, 'max_depth': 12, 'min_samples_split': 4, 'min_samples_leaf': 2, 'subsample': 0.7847113199708148, 'max_features': 'sqrt'}. Best is trial 16 with value: 0.24131607807430555.
[I 2024-12-04 12:20:01,350] Trial 193 finished with value: 0.3758856369485305 and parameters: {'n_estimators': 1334, 'learning_rate': 0.013490836859883986, 'max_depth': 11, 'min_samples_split': 2, 'min_samples_leaf': 1, 'subsample': 0.8469883882551716, 'max_features': None}. Best is trial 16 with value: 0.24131607807430555.
