[I 2024-12-04 12:14:19,975] Trial 1513 finished with value: 0.29893729179030465 and parameters: {'n_estimators': 414, 'max_depth': 50, 'min_samples_split': 2, 'min_samples_leaf': 1, 'max_features': 'sqrt', 'bootstrap': False, 'criterion': 'squared_error'}. Best is trial 341 with value: 0.2909369124469028.
[I 2024-12-04 12:14:20,423] Trial 1512 finished with value: 0.30606576354213466 and parameters: {'n_estimators': 627, 'max_depth': 43, 'min_samples_split': 2, 'min_samples_leaf': 1, 'max_features': 'sqrt', 'bootstrap': False, 'criterion': 'squared_error'}. Best is trial 341 with value: 0.2909369124469028.
[I 2024-12-04 12:14:22,002] Trial 1506 finished with value: 0.34764426676156 and parameters: {'n_estimators': 100, 'max_depth': 41, 'min_samples_split': 3, 'min_samples_leaf': 2, 'max_features': None, 'bootstrap': True, 'criterion': 'squared_error'}. Best is trial 341 with value: 0.2909369124469028.
[I 2024-12-04 12:14:22,096] Trial 1482 finished with value: 0.5578550503146852 and parameters: {'n_estimators': 731, 'max_depth': 26, 'min_samples_split': 4, 'min_samples_leaf': 14, 'max_features': None, 'bootstrap': True, 'criterion': 'absolute_error'}. Best is trial 341 with value: 0.2909369124469028.
[I 2024-12-04 12:14:22,097] Trial 1514 finished with value: 0.2997419881493414 and parameters: {'n_estimators': 200, 'max_depth': 43, 'min_samples_split': 3, 'min_samples_leaf': 1, 'max_features': 'sqrt', 'bootstrap': False, 'criterion': 'squared_error'}. Best is trial 341 with value: 0.2909369124469028.
[I 2024-12-04 12:14:22,106] Trial 1511 finished with value: 0.7607102817151833 and parameters: {'n_estimators': 903, 'max_depth': 12, 'min_samples_split': 46, 'min_samples_leaf': 1, 'max_features': 'log2', 'bootstrap': False, 'criterion': 'squared_error'}. Best is trial 341 with value: 0.2909369124469028.
[I 2024-12-04 12:14:22,328] Trial 1509 finished with value: 0.30008866868168893 and parameters: {'n_estimators': 456, 'max_depth': 50, 'min_samples_split': 4, 'min_samples_leaf': 1, 'max_features': 'sqrt', 'bootstrap': False, 'criterion': 'squared_error'}. Best is trial 341 with value: 0.2909369124469028.
[I 2024-12-04 12:14:22,762] Trial 1516 finished with value: 0.43872119367041557 and parameters: {'n_estimators': 425, 'max_depth': 50, 'min_samples_split': 5, 'min_samples_leaf': 2, 'max_features': 'sqrt', 'bootstrap': False, 'criterion': 'squared_error'}. Best is trial 341 with value: 0.2909369124469028.
[I 2024-12-04 12:14:26,080] Trial 1521 finished with value: 0.44268088991368176 and parameters: {'n_estimators': 261, 'max_depth': 50, 'min_samples_split': 4, 'min_samples_leaf': 2, 'max_features': 'sqrt', 'bootstrap': False, 'criterion': 'squared_error'}. Best is trial 341 with value: 0.2909369124469028.
[I 2024-12-04 12:14:26,468] Trial 1515 finished with value: 0.29237598196273074 and parameters: {'n_estimators': 595, 'max_depth': 49, 'min_samples_split': 3, 'min_samples_leaf': 1, 'max_features': 'sqrt', 'bootstrap': False, 'criterion': 'squared_error'}. Best is trial 341 with value: 0.2909369124469028.
[I 2024-12-04 12:14:26,822] Trial 1504 finished with value: 0.44174058623096923 and parameters: {'n_estimators': 316, 'max_depth': 35, 'min_samples_split': 31, 'min_samples_leaf': 5, 'max_features': None, 'bootstrap': True, 'criterion': 'absolute_error'}. Best is trial 341 with value: 0.2909369124469028.
[I 2024-12-04 12:14:28,596] Trial 1523 finished with value: 0.46765282634321886 and parameters: {'n_estimators': 113, 'max_depth': 31, 'min_samples_split': 2, 'min_samples_leaf': 2, 'max_features': 'sqrt', 'bootstrap': False, 'criterion': 'squared_error'}. Best is trial 341 with value: 0.2909369124469028.
[I 2024-12-04 12:14:29,903] Trial 1526 finished with value: 0.9137602672183546 and parameters: {'n_estimators': 758, 'max_depth': 5, 'min_samples_split': 2, 'min_samples_leaf': 5, 'max_features': 'log2', 'bootstrap': False, 'criterion': 'squared_error'}. Best is trial 341 with value: 0.2909369124469028.
[I 2024-12-04 12:14:31,240] Trial 1518 finished with value: 0.624747948514333 and parameters: {'n_estimators': 237, 'max_depth': 22, 'min_samples_split': 4, 'min_samples_leaf': 1, 'max_features': 'log2', 'bootstrap': True, 'criterion': 'absolute_error'}. Best is trial 341 with value: 0.2909369124469028.
[I 2024-12-04 12:14:31,241] Trial 1519 finished with value: 0.8604288659672024 and parameters: {'n_estimators': 421, 'max_depth': 44, 'min_samples_split': 2, 'min_samples_leaf': 4, 'max_features': 'log2', 'bootstrap': False, 'criterion': 'absolute_error'}. Best is trial 341 with value: 0.2909369124469028.
[I 2024-12-04 12:14:32,040] Trial 1517 finished with value: 0.31177086330605636 and parameters: {'n_estimators': 252, 'max_depth': 46, 'min_samples_split': 3, 'min_samples_leaf': 1, 'max_features': 'sqrt', 'bootstrap': False, 'criterion': 'absolute_error'}. Best is trial 341 with value: 0.2909369124469028.
[I 2024-12-04 12:14:32,143] Trial 1532 finished with value: 0.30028252620521745 and parameters: {'n_estimators': 336, 'max_depth': 50, 'min_samples_split': 4, 'min_samples_leaf': 1, 'max_features': 'sqrt', 'bootstrap': False, 'criterion': 'squared_error'}. Best is trial 341 with value: 0.2909369124469028.
[I 2024-12-04 12:14:32,410] Trial 1524 finished with value: 0.4441856952066071 and parameters: {'n_estimators': 782, 'max_depth': 45, 'min_samples_split': 3, 'min_samples_leaf': 2, 'max_features': 'sqrt', 'bootstrap': False, 'criterion': 'squared_error'}. Best is trial 341 with value: 0.2909369124469028.
[I 2024-12-04 12:14:34,162] Trial 1520 finished with value: 0.6426826398314707 and parameters: {'n_estimators': 313, 'max_depth': 20, 'min_samples_split': 4, 'min_samples_leaf': 1, 'max_features': 'log2', 'bootstrap': True, 'criterion': 'absolute_error'}. Best is trial 341 with value: 0.2909369124469028.
[I 2024-12-04 12:14:35,055] Trial 1522 finished with value: 0.865811119150334 and parameters: {'n_estimators': 638, 'max_depth': 6, 'min_samples_split': 32, 'min_samples_leaf': 14, 'max_features': 'sqrt', 'bootstrap': False, 'criterion': 'absolute_error'}. Best is trial 341 with value: 0.2909369124469028.
[I 2024-12-04 12:14:36,619] Trial 1528 finished with value: 0.3007661571391656 and parameters: {'n_estimators': 621, 'max_depth': 49, 'min_samples_split': 4, 'min_samples_leaf': 1, 'max_features': 'sqrt', 'bootstrap': False, 'criterion': 'squared_error'}. Best is trial 341 with value: 0.2909369124469028.
[I 2024-12-04 12:14:37,523] Trial 1530 finished with value: 0.31771981507025954 and parameters: {'n_estimators': 695, 'max_depth': 45, 'min_samples_split': 6, 'min_samples_leaf': 1, 'max_features': 'sqrt', 'bootstrap': False, 'criterion': 'squared_error'}. Best is trial 341 with value: 0.2909369124469028.
[I 2024-12-04 12:14:40,958] Trial 1525 finished with value: 0.3003635414181912 and parameters: {'n_estimators': 616, 'max_depth': 44, 'min_samples_split': 3, 'min_samples_leaf': 1, 'max_features': 'sqrt', 'bootstrap': False, 'criterion': 'squared_error'}. Best is trial 341 with value: 0.2909369124469028.
[I 2024-12-04 12:14:40,960] Trial 1533 finished with value: 0.2922841777543365 and parameters: {'n_estimators': 619, 'max_depth': 49, 'min_samples_split': 3, 'min_samples_leaf': 1, 'max_features': 'sqrt', 'bootstrap': False, 'criterion': 'squared_error'}. Best is trial 341 with value: 0.2909369124469028.
[I 2024-12-04 12:14:41,192] Trial 1531 finished with value: 0.4605660083804504 and parameters: {'n_estimators': 209, 'max_depth': 50, 'min_samples_split': 4, 'min_samples_leaf': 2, 'max_features': 'sqrt', 'bootstrap': False, 'criterion': 'absolute_error'}. Best is trial 341 with value: 0.2909369124469028.
[I 2024-12-04 12:14:44,446] Trial 1498 finished with value: 0.4373671876093958 and parameters: {'n_estimators': 948, 'max_depth': 33, 'min_samples_split': 24, 'min_samples_leaf': 1, 'max_features': 'sqrt', 'bootstrap': True, 'criterion': 'absolute_error'}. Best is trial 341 with value: 0.2909369124469028.
[I 2024-12-04 12:14:44,458] Trial 1534 finished with value: 0.29391815001503613 and parameters: {'n_estimators': 551, 'max_depth': 50, 'min_samples_split': 3, 'min_samples_leaf': 1, 'max_features': 'sqrt', 'bootstrap': False, 'criterion': 'squared_error'}. Best is trial 341 with value: 0.2909369124469028.
[I 2024-12-04 12:14:46,469] Trial 1535 finished with value: 0.3007376750987443 and parameters: {'n_estimators': 722, 'max_depth': 49, 'min_samples_split': 4, 'min_samples_leaf': 1, 'max_features': 'sqrt', 'bootstrap': False, 'criterion': 'squared_error'}. Best is trial 341 with value: 0.2909369124469028.
[I 2024-12-04 12:14:46,573] Trial 1540 finished with value: 0.2994466504233274 and parameters: {'n_estimators': 702, 'max_depth': 45, 'min_samples_split': 3, 'min_samples_leaf': 1, 'max_features': 'sqrt', 'bootstrap': False, 'criterion': 'squared_error'}. Best is trial 341 with value: 0.2909369124469028.
[I 2024-12-04 12:14:46,584] Trial 1538 finished with value: 0.38764366836420294 and parameters: {'n_estimators': 290, 'max_depth': 50, 'min_samples_split': 2, 'min_samples_leaf': 1, 'max_features': None, 'bootstrap': False, 'criterion': 'squared_error'}. Best is trial 341 with value: 0.2909369124469028.
[I 2024-12-04 12:14:47,112] Trial 1438 finished with value: 0.44812457406549094 and parameters: {'n_estimators': 949, 'max_depth': 24, 'min_samples_split': 2, 'min_samples_leaf': 6, 'max_features': None, 'bootstrap': False, 'criterion': 'absolute_error'}. Best is trial 341 with value: 0.2909369124469028.
[I 2024-12-04 12:14:47,238] Trial 1537 finished with value: 0.30199754613335755 and parameters: {'n_estimators': 597, 'max_depth': 46, 'min_samples_split': 2, 'min_samples_leaf': 1, 'max_features': 'sqrt', 'bootstrap': False, 'criterion': 'squared_error'}. Best is trial 341 with value: 0.2909369124469028.
[I 2024-12-04 12:14:48,789] Trial 1539 finished with value: 0.9640340159121105 and parameters: {'n_estimators': 668, 'max_depth': 14, 'min_samples_split': 15, 'min_samples_leaf': 11, 'max_features': 'log2', 'bootstrap': True, 'criterion': 'squared_error'}. Best is trial 341 with value: 0.2909369124469028.
[I 2024-12-04 12:14:49,831] Trial 1529 finished with value: 0.3071462168899467 and parameters: {'n_estimators': 495, 'max_depth': 45, 'min_samples_split': 4, 'min_samples_leaf': 1, 'max_features': 'sqrt', 'bootstrap': False, 'criterion': 'squared_error'}. Best is trial 341 with value: 0.2909369124469028.
[I 2024-12-04 12:14:51,021] Trial 1536 finished with value: 0.3048618214627076 and parameters: {'n_estimators': 572, 'max_depth': 44, 'min_samples_split': 2, 'min_samples_leaf': 1, 'max_features': 'sqrt', 'bootstrap': False, 'criterion': 'squared_error'}. Best is trial 341 with value: 0.2909369124469028.
[I 2024-12-04 12:14:51,895] Trial 1542 finished with value: 0.3004965165344176 and parameters: {'n_estimators': 660, 'max_depth': 49, 'min_samples_split': 4, 'min_samples_leaf': 1, 'max_features': 'sqrt', 'bootstrap': False, 'criterion': 'squared_error'}. Best is trial 341 with value: 0.2909369124469028.
[I 2024-12-04 12:14:53,499] Trial 1541 finished with value: 0.3000426500013068 and parameters: {'n_estimators': 588, 'max_depth': 44, 'min_samples_split': 3, 'min_samples_leaf': 1, 'max_features': 'sqrt', 'bootstrap': False, 'criterion': 'squared_error'}. Best is trial 341 with value: 0.2909369124469028.
[I 2024-12-04 12:14:53,682] Trial 1548 finished with value: 0.4420470901980814 and parameters: {'n_estimators': 661, 'max_depth': 48, 'min_samples_split': 2, 'min_samples_leaf': 2, 'max_features': 'sqrt', 'bootstrap': False, 'criterion': 'squared_error'}. Best is trial 341 with value: 0.2909369124469028.
[I 2024-12-04 12:14:54,013] Trial 1553 finished with value: 0.31868379359188165 and parameters: {'n_estimators': 554, 'max_depth': 41, 'min_samples_split': 5, 'min_samples_leaf': 1, 'max_features': 'sqrt', 'bootstrap': False, 'criterion': 'squared_error'}. Best is trial 341 with value: 0.2909369124469028.
[I 2024-12-04 12:14:56,563] Trial 1543 finished with value: 0.4423667512525347 and parameters: {'n_estimators': 754, 'max_depth': 49, 'min_samples_split': 3, 'min_samples_leaf': 2, 'max_features': 'sqrt', 'bootstrap': False, 'criterion': 'squared_error'}. Best is trial 341 with value: 0.2909369124469028.
[I 2024-12-04 12:14:58,437] Trial 1544 finished with value: 0.2983020848551239 and parameters: {'n_estimators': 650, 'max_depth': 50, 'min_samples_split': 2, 'min_samples_leaf': 1, 'max_features': 'sqrt', 'bootstrap': False, 'criterion': 'squared_error'}. Best is trial 341 with value: 0.2909369124469028.
[I 2024-12-04 12:15:00,967] Trial 1555 finished with value: 0.9690124371924909 and parameters: {'n_estimators': 139, 'max_depth': 32, 'min_samples_split': 18, 'min_samples_leaf': 13, 'max_features': 'log2', 'bootstrap': True, 'criterion': 'absolute_error'}. Best is trial 341 with value: 0.2909369124469028.
[I 2024-12-04 12:15:00,979] Trial 1546 finished with value: 0.3880000192866066 and parameters: {'n_estimators': 725, 'max_depth': 47, 'min_samples_split': 2, 'min_samples_leaf': 1, 'max_features': None, 'bootstrap': False, 'criterion': 'squared_error'}. Best is trial 341 with value: 0.2909369124469028.
[I 2024-12-04 12:15:01,845] Trial 1550 finished with value: 0.3011206112252929 and parameters: {'n_estimators': 664, 'max_depth': 50, 'min_samples_split': 4, 'min_samples_leaf': 1, 'max_features': 'sqrt', 'bootstrap': False, 'criterion': 'squared_error'}. Best is trial 341 with value: 0.2909369124469028.
[I 2024-12-04 12:15:01,940] Trial 1549 finished with value: 0.4811218892163707 and parameters: {'n_estimators': 417, 'max_depth': 50, 'min_samples_split': 2, 'min_samples_leaf': 2, 'max_features': 'sqrt', 'bootstrap': True, 'criterion': 'squared_error'}. Best is trial 341 with value: 0.2909369124469028.
[I 2024-12-04 12:15:05,120] Trial 1554 finished with value: 0.29648174279572065 and parameters: {'n_estimators': 710, 'max_depth': 48, 'min_samples_split': 2, 'min_samples_leaf': 1, 'max_features': 'sqrt', 'bootstrap': False, 'criterion': 'squared_error'}. Best is trial 341 with value: 0.2909369124469028.
[I 2024-12-04 12:15:05,168] Trial 1547 finished with value: 0.9375258884748714 and parameters: {'n_estimators': 941, 'max_depth': 29, 'min_samples_split': 2, 'min_samples_leaf': 5, 'max_features': 'log2', 'bootstrap': True, 'criterion': 'absolute_error'}. Best is trial 341 with value: 0.2909369124469028.
[I 2024-12-04 12:15:05,177] Trial 1559 finished with value: 0.4441997409422343 and parameters: {'n_estimators': 570, 'max_depth': 40, 'min_samples_split': 2, 'min_samples_leaf': 2, 'max_features': 'sqrt', 'bootstrap': False, 'criterion': 'squared_error'}. Best is trial 341 with value: 0.2909369124469028.
[I 2024-12-04 12:15:05,678] Trial 1558 finished with value: 0.29382151287060904 and parameters: {'n_estimators': 533, 'max_depth': 48, 'min_samples_split': 3, 'min_samples_leaf': 1, 'max_features': 'sqrt', 'bootstrap': False, 'criterion': 'squared_error'}. Best is trial 341 with value: 0.2909369124469028.
[I 2024-12-04 12:15:06,113] Trial 1564 finished with value: 0.7000798974587213 and parameters: {'n_estimators': 645, 'max_depth': 47, 'min_samples_split': 3, 'min_samples_leaf': 2, 'max_features': 'log2', 'bootstrap': False, 'criterion': 'squared_error'}. Best is trial 341 with value: 0.2909369124469028.
[I 2024-12-04 12:15:06,351] Trial 1552 finished with value: 0.30643962753437126 and parameters: {'n_estimators': 802, 'max_depth': 43, 'min_samples_split': 2, 'min_samples_leaf': 1, 'max_features': 'sqrt', 'bootstrap': False, 'criterion': 'squared_error'}. Best is trial 341 with value: 0.2909369124469028.
[I 2024-12-04 12:15:06,446] Trial 1560 finished with value: 0.3070577596148437 and parameters: {'n_estimators': 539, 'max_depth': 49, 'min_samples_split': 5, 'min_samples_leaf': 1, 'max_features': 'sqrt', 'bootstrap': False, 'criterion': 'squared_error'}. Best is trial 341 with value: 0.2909369124469028.
[I 2024-12-04 12:15:06,926] Trial 1412 finished with value: 0.4373102580170422 and parameters: {'n_estimators': 727, 'max_depth': 47, 'min_samples_split': 2, 'min_samples_leaf': 2, 'max_features': None, 'bootstrap': False, 'criterion': 'absolute_error'}. Best is trial 341 with value: 0.2909369124469028.
[I 2024-12-04 12:15:07,270] Trial 1565 finished with value: 0.29901907298328684 and parameters: {'n_estimators': 736, 'max_depth': 45, 'min_samples_split': 3, 'min_samples_leaf': 1, 'max_features': 'sqrt', 'bootstrap': False, 'criterion': 'squared_error'}. Best is trial 341 with value: 0.2909369124469028.
[I 2024-12-04 12:15:08,221] Trial 1527 finished with value: 0.3797253314886875 and parameters: {'n_estimators': 921, 'max_depth': 32, 'min_samples_split': 3, 'min_samples_leaf': 1, 'max_features': 'sqrt', 'bootstrap': True, 'criterion': 'absolute_error'}. Best is trial 341 with value: 0.2909369124469028.
[I 2024-12-04 12:15:08,583] Trial 1556 finished with value: 0.29856636146450843 and parameters: {'n_estimators': 606, 'max_depth': 50, 'min_samples_split': 2, 'min_samples_leaf': 1, 'max_features': 'sqrt', 'bootstrap': False, 'criterion': 'squared_error'}. Best is trial 341 with value: 0.2909369124469028.
[I 2024-12-04 12:15:08,967] Trial 1563 finished with value: 0.4394225441791824 and parameters: {'n_estimators': 654, 'max_depth': 50, 'min_samples_split': 5, 'min_samples_leaf': 2, 'max_features': 'sqrt', 'bootstrap': False, 'criterion': 'squared_error'}. Best is trial 341 with value: 0.2909369124469028.
[I 2024-12-04 12:15:09,401] Trial 1569 finished with value: 0.7931407044746612 and parameters: {'n_estimators': 127, 'max_depth': 8, 'min_samples_split': 11, 'min_samples_leaf': 5, 'max_features': 'sqrt', 'bootstrap': True, 'criterion': 'absolute_error'}. Best is trial 341 with value: 0.2909369124469028.
[I 2024-12-04 12:15:11,278] Trial 1566 finished with value: 0.2941923373241061 and parameters: {'n_estimators': 571, 'max_depth': 50, 'min_samples_split': 3, 'min_samples_leaf': 1, 'max_features': 'sqrt', 'bootstrap': False, 'criterion': 'squared_error'}. Best is trial 341 with value: 0.2909369124469028.
[I 2024-12-04 12:15:11,378] Trial 1567 finished with value: 0.6240568706209098 and parameters: {'n_estimators': 362, 'max_depth': 27, 'min_samples_split': 8, 'min_samples_leaf': 5, 'max_features': 'sqrt', 'bootstrap': False, 'criterion': 'absolute_error'}. Best is trial 341 with value: 0.2909369124469028.
[I 2024-12-04 12:15:11,717] Trial 1545 finished with value: 0.6843341298081873 and parameters: {'n_estimators': 974, 'max_depth': 18, 'min_samples_split': 12, 'min_samples_leaf': 1, 'max_features': 'log2', 'bootstrap': True, 'criterion': 'absolute_error'}. Best is trial 341 with value: 0.2909369124469028.
[I 2024-12-04 12:15:11,719] Trial 1551 finished with value: 0.32995943165916547 and parameters: {'n_estimators': 604, 'max_depth': 41, 'min_samples_split': 2, 'min_samples_leaf': 1, 'max_features': 'sqrt', 'bootstrap': True, 'criterion': 'squared_error'}. Best is trial 341 with value: 0.2909369124469028.
[I 2024-12-04 12:15:14,112] Trial 1557 finished with value: 0.4978988972384427 and parameters: {'n_estimators': 681, 'max_depth': 26, 'min_samples_split': 45, 'min_samples_leaf': 9, 'max_features': None, 'bootstrap': True, 'criterion': 'squared_error'}. Best is trial 341 with value: 0.2909369124469028.
[I 2024-12-04 12:15:14,282] Trial 1562 finished with value: 0.30135384503279894 and parameters: {'n_estimators': 680, 'max_depth': 50, 'min_samples_split': 4, 'min_samples_leaf': 1, 'max_features': 'sqrt', 'bootstrap': False, 'criterion': 'squared_error'}. Best is trial 341 with value: 0.2909369124469028.
[I 2024-12-04 12:15:14,287] Trial 1571 finished with value: 0.8557040178141665 and parameters: {'n_estimators': 811, 'max_depth': 6, 'min_samples_split': 2, 'min_samples_leaf': 1, 'max_features': 'log2', 'bootstrap': False, 'criterion': 'squared_error'}. Best is trial 341 with value: 0.2909369124469028.
[I 2024-12-04 12:15:14,975] Trial 1572 finished with value: 0.33820223559132345 and parameters: {'n_estimators': 752, 'max_depth': 35, 'min_samples_split': 5, 'min_samples_leaf': 1, 'max_features': 'sqrt', 'bootstrap': False, 'criterion': 'squared_error'}. Best is trial 341 with value: 0.2909369124469028.
[I 2024-12-04 12:15:16,106] Trial 1561 finished with value: 0.4612255705639572 and parameters: {'n_estimators': 909, 'max_depth': 36, 'min_samples_split': 10, 'min_samples_leaf': 6, 'max_features': None, 'bootstrap': False, 'criterion': 'squared_error'}. Best is trial 341 with value: 0.2909369124469028.
[I 2024-12-04 12:15:17,524] Trial 1576 finished with value: 0.4417127275566296 and parameters: {'n_estimators': 608, 'max_depth': 46, 'min_samples_split': 2, 'min_samples_leaf': 2, 'max_features': 'sqrt', 'bootstrap': False, 'criterion': 'squared_error'}. Best is trial 341 with value: 0.2909369124469028.
[I 2024-12-04 12:15:19,486] Trial 1570 finished with value: 0.3117436860586643 and parameters: {'n_estimators': 511, 'max_depth': 41, 'min_samples_split': 2, 'min_samples_leaf': 1, 'max_features': 'sqrt', 'bootstrap': False, 'criterion': 'squared_error'}. Best is trial 341 with value: 0.2909369124469028.
[I 2024-12-04 12:15:20,369] Trial 1579 finished with value: 0.4858291325396556 and parameters: {'n_estimators': 455, 'max_depth': 33, 'min_samples_split': 3, 'min_samples_leaf': 1, 'max_features': 'log2', 'bootstrap': False, 'criterion': 'squared_error'}. Best is trial 341 with value: 0.2909369124469028.
[I 2024-12-04 12:15:20,565] Trial 1574 finished with value: 0.3000647811311811 and parameters: {'n_estimators': 501, 'max_depth': 50, 'min_samples_split': 4, 'min_samples_leaf': 1, 'max_features': 'sqrt', 'bootstrap': False, 'criterion': 'squared_error'}. Best is trial 341 with value: 0.2909369124469028.
