[I 2024-12-04 12:05:36,393] Trial 715 finished with value: 0.6210071345827908 and parameters: {'n_estimators': 167, 'max_depth': 21, 'min_samples_split': 4, 'min_samples_leaf': 2, 'max_features': None, 'bootstrap': False, 'criterion': 'absolute_error'}. Best is trial 694 with value: 0.5040991153389499.
[I 2024-12-04 12:05:38,099] Trial 714 finished with value: 0.5138066155430456 and parameters: {'n_estimators': 118, 'max_depth': 21, 'min_samples_split': 4, 'min_samples_leaf': 1, 'max_features': None, 'bootstrap': True, 'criterion': 'absolute_error'}. Best is trial 694 with value: 0.5040991153389499.
[I 2024-12-04 12:05:38,361] Trial 723 finished with value: 0.8331004318847857 and parameters: {'n_estimators': 149, 'max_depth': 18, 'min_samples_split': 4, 'min_samples_leaf': 1, 'max_features': 'sqrt', 'bootstrap': True, 'criterion': 'absolute_error'}. Best is trial 694 with value: 0.5040991153389499.
[I 2024-12-04 12:05:38,547] Trial 725 finished with value: 0.5096193458540085 and parameters: {'n_estimators': 100, 'max_depth': 16, 'min_samples_split': 5, 'min_samples_leaf': 1, 'max_features': None, 'bootstrap': True, 'criterion': 'absolute_error'}. Best is trial 694 with value: 0.5040991153389499.
[I 2024-12-04 12:05:38,923] Trial 720 finished with value: 0.7819195057393782 and parameters: {'n_estimators': 374, 'max_depth': 24, 'min_samples_split': 21, 'min_samples_leaf': 1, 'max_features': 'sqrt', 'bootstrap': False, 'criterion': 'absolute_error'}. Best is trial 694 with value: 0.5040991153389499.
[I 2024-12-04 12:05:41,084] Trial 729 finished with value: 1.300222827803944 and parameters: {'n_estimators': 101, 'max_depth': 23, 'min_samples_split': 4, 'min_samples_leaf': 2, 'max_features': 'log2', 'bootstrap': True, 'criterion': 'absolute_error'}. Best is trial 694 with value: 0.5040991153389499.
[I 2024-12-04 12:05:41,798] Trial 718 finished with value: 0.5194906899885144 and parameters: {'n_estimators': 241, 'max_depth': 19, 'min_samples_split': 3, 'min_samples_leaf': 1, 'max_features': None, 'bootstrap': True, 'criterion': 'absolute_error'}. Best is trial 694 with value: 0.5040991153389499.
[I 2024-12-04 12:05:42,363] Trial 733 finished with value: 0.5581067793104577 and parameters: {'n_estimators': 115, 'max_depth': 17, 'min_samples_split': 3, 'min_samples_leaf': 2, 'max_features': None, 'bootstrap': True, 'criterion': 'absolute_error'}. Best is trial 694 with value: 0.5040991153389499.
[I 2024-12-04 12:05:43,836] Trial 734 finished with value: 0.5137587818386657 and parameters: {'n_estimators': 113, 'max_depth': 15, 'min_samples_split': 3, 'min_samples_leaf': 1, 'max_features': None, 'bootstrap': True, 'criterion': 'absolute_error'}. Best is trial 694 with value: 0.5040991153389499.
[I 2024-12-04 12:05:43,907] Trial 732 finished with value: 0.5188468929571468 and parameters: {'n_estimators': 115, 'max_depth': 18, 'min_samples_split': 3, 'min_samples_leaf': 1, 'max_features': None, 'bootstrap': True, 'criterion': 'absolute_error'}. Best is trial 694 with value: 0.5040991153389499.
[I 2024-12-04 12:05:45,648] Trial 739 finished with value: 0.5545372805004668 and parameters: {'n_estimators': 147, 'max_depth': 14, 'min_samples_split': 6, 'min_samples_leaf': 1, 'max_features': None, 'bootstrap': False, 'criterion': 'squared_error'}. Best is trial 694 with value: 0.5040991153389499.
[I 2024-12-04 12:05:48,686] Trial 736 finished with value: 0.5154491968622988 and parameters: {'n_estimators': 102, 'max_depth': 22, 'min_samples_split': 4, 'min_samples_leaf': 1, 'max_features': None, 'bootstrap': True, 'criterion': 'absolute_error'}. Best is trial 694 with value: 0.5040991153389499.
[I 2024-12-04 12:05:49,184] Trial 722 finished with value: 0.5170825943216827 and parameters: {'n_estimators': 271, 'max_depth': 14, 'min_samples_split': 2, 'min_samples_leaf': 1, 'max_features': None, 'bootstrap': True, 'criterion': 'absolute_error'}. Best is trial 694 with value: 0.5040991153389499.
[I 2024-12-04 12:05:50,129] Trial 740 finished with value: 0.510290346256624 and parameters: {'n_estimators': 117, 'max_depth': 14, 'min_samples_split': 5, 'min_samples_leaf': 1, 'max_features': None, 'bootstrap': True, 'criterion': 'absolute_error'}. Best is trial 694 with value: 0.5040991153389499.
[I 2024-12-04 12:05:51,094] Trial 737 finished with value: 0.5580835608181716 and parameters: {'n_estimators': 119, 'max_depth': 17, 'min_samples_split': 5, 'min_samples_leaf': 2, 'max_features': None, 'bootstrap': True, 'criterion': 'absolute_error'}. Best is trial 694 with value: 0.5040991153389499.
[I 2024-12-04 12:05:51,124] Trial 738 finished with value: 0.5084202128526101 and parameters: {'n_estimators': 110, 'max_depth': 17, 'min_samples_split': 5, 'min_samples_leaf': 1, 'max_features': None, 'bootstrap': True, 'criterion': 'absolute_error'}. Best is trial 694 with value: 0.5040991153389499.
[I 2024-12-04 12:05:51,872] Trial 735 finished with value: 1.0265288337440792 and parameters: {'n_estimators': 351, 'max_depth': 19, 'min_samples_split': 3, 'min_samples_leaf': 1, 'max_features': 'log2', 'bootstrap': True, 'criterion': 'absolute_error'}. Best is trial 694 with value: 0.5040991153389499.
[I 2024-12-04 12:05:57,500] Trial 730 finished with value: 0.5128789462785127 and parameters: {'n_estimators': 301, 'max_depth': 14, 'min_samples_split': 5, 'min_samples_leaf': 1, 'max_features': None, 'bootstrap': True, 'criterion': 'absolute_error'}. Best is trial 694 with value: 0.5040991153389499.
[I 2024-12-04 12:05:57,599] Trial 746 finished with value: 1.0667197396000818 and parameters: {'n_estimators': 105, 'max_depth': 17, 'min_samples_split': 4, 'min_samples_leaf': 1, 'max_features': 'log2', 'bootstrap': True, 'criterion': 'absolute_error'}. Best is trial 694 with value: 0.5040991153389499.
[I 2024-12-04 12:05:58,133] Trial 741 finished with value: 0.5621360576399 and parameters: {'n_estimators': 243, 'max_depth': 19, 'min_samples_split': 5, 'min_samples_leaf': 2, 'max_features': None, 'bootstrap': True, 'criterion': 'absolute_error'}. Best is trial 744 with value: 0.5032383725751689.
[I 2024-12-04 12:05:58,385] Trial 748 finished with value: 0.5133518542530027 and parameters: {'n_estimators': 107, 'max_depth': 14, 'min_samples_split': 4, 'min_samples_leaf': 1, 'max_features': None, 'bootstrap': True, 'criterion': 'absolute_error'}. Best is trial 744 with value: 0.5032383725751689.
[I 2024-12-04 12:05:58,894] Trial 758 finished with value: 1.2286322017543385 and parameters: {'n_estimators': 553, 'max_depth': 32, 'min_samples_split': 48, 'min_samples_leaf': 5, 'max_features': 'log2', 'bootstrap': True, 'criterion': 'squared_error'}. Best is trial 744 with value: 0.5032383725751689.
[I 2024-12-04 12:06:00,829] Trial 744 finished with value: 0.5032383725751689 and parameters: {'n_estimators': 100, 'max_depth': 16, 'min_samples_split': 4, 'min_samples_leaf': 1, 'max_features': None, 'bootstrap': True, 'criterion': 'absolute_error'}. Best is trial 744 with value: 0.5032383725751689.
[I 2024-12-04 12:06:01,808] Trial 727 finished with value: 0.5151219730600906 and parameters: {'n_estimators': 249, 'max_depth': 16, 'min_samples_split': 4, 'min_samples_leaf': 1, 'max_features': None, 'bootstrap': True, 'criterion': 'absolute_error'}. Best is trial 744 with value: 0.5032383725751689.
[I 2024-12-04 12:06:02,770] Trial 750 finished with value: 0.5202622571347908 and parameters: {'n_estimators': 107, 'max_depth': 9, 'min_samples_split': 3, 'min_samples_leaf': 1, 'max_features': None, 'bootstrap': True, 'criterion': 'absolute_error'}. Best is trial 744 with value: 0.5032383725751689.
[I 2024-12-04 12:06:02,856] Trial 756 finished with value: 0.5172588732400782 and parameters: {'n_estimators': 102, 'max_depth': 22, 'min_samples_split': 7, 'min_samples_leaf': 1, 'max_features': None, 'bootstrap': True, 'criterion': 'absolute_error'}. Best is trial 744 with value: 0.5032383725751689.
[I 2024-12-04 12:06:02,857] Trial 754 finished with value: 0.6226742294428983 and parameters: {'n_estimators': 123, 'max_depth': 12, 'min_samples_split': 3, 'min_samples_leaf': 2, 'max_features': None, 'bootstrap': False, 'criterion': 'absolute_error'}. Best is trial 744 with value: 0.5032383725751689.
[I 2024-12-04 12:06:04,358] Trial 751 finished with value: 0.6806757288794846 and parameters: {'n_estimators': 429, 'max_depth': 31, 'min_samples_split': 6, 'min_samples_leaf': 7, 'max_features': None, 'bootstrap': False, 'criterion': 'squared_error'}. Best is trial 744 with value: 0.5032383725751689.
[I 2024-12-04 12:06:05,717] Trial 743 finished with value: 0.5197085533580313 and parameters: {'n_estimators': 238, 'max_depth': 21, 'min_samples_split': 4, 'min_samples_leaf': 1, 'max_features': None, 'bootstrap': True, 'criterion': 'absolute_error'}. Best is trial 744 with value: 0.5032383725751689.
[I 2024-12-04 12:06:07,082] Trial 731 finished with value: 0.5246899301384174 and parameters: {'n_estimators': 317, 'max_depth': 21, 'min_samples_split': 8, 'min_samples_leaf': 1, 'max_features': None, 'bootstrap': True, 'criterion': 'absolute_error'}. Best is trial 744 with value: 0.5032383725751689.
[I 2024-12-04 12:06:07,821] Trial 753 finished with value: 1.1989904370037827 and parameters: {'n_estimators': 302, 'max_depth': 47, 'min_samples_split': 3, 'min_samples_leaf': 13, 'max_features': 'sqrt', 'bootstrap': False, 'criterion': 'squared_error'}. Best is trial 744 with value: 0.5032383725751689.
[I 2024-12-04 12:06:07,871] Trial 742 finished with value: 0.5173556222835712 and parameters: {'n_estimators': 265, 'max_depth': 16, 'min_samples_split': 6, 'min_samples_leaf': 1, 'max_features': None, 'bootstrap': True, 'criterion': 'absolute_error'}. Best is trial 744 with value: 0.5032383725751689.
[I 2024-12-04 12:06:09,180] Trial 761 finished with value: 0.5264812862532823 and parameters: {'n_estimators': 265, 'max_depth': 16, 'min_samples_split': 3, 'min_samples_leaf': 1, 'max_features': None, 'bootstrap': True, 'criterion': 'squared_error'}. Best is trial 744 with value: 0.5032383725751689.
[I 2024-12-04 12:06:11,065] Trial 760 finished with value: 0.5120402910757145 and parameters: {'n_estimators': 115, 'max_depth': 16, 'min_samples_split': 5, 'min_samples_leaf': 1, 'max_features': None, 'bootstrap': True, 'criterion': 'absolute_error'}. Best is trial 744 with value: 0.5032383725751689.
[I 2024-12-04 12:06:13,682] Trial 747 finished with value: 0.5171873127758966 and parameters: {'n_estimators': 237, 'max_depth': 16, 'min_samples_split': 3, 'min_samples_leaf': 1, 'max_features': None, 'bootstrap': True, 'criterion': 'absolute_error'}. Best is trial 744 with value: 0.5032383725751689.
[I 2024-12-04 12:06:13,853] Trial 762 finished with value: 0.5184993171877086 and parameters: {'n_estimators': 128, 'max_depth': 21, 'min_samples_split': 3, 'min_samples_leaf': 1, 'max_features': None, 'bootstrap': True, 'criterion': 'absolute_error'}. Best is trial 744 with value: 0.5032383725751689.
[I 2024-12-04 12:06:13,854] Trial 765 finished with value: 0.51924070272346 and parameters: {'n_estimators': 100, 'max_depth': 16, 'min_samples_split': 7, 'min_samples_leaf': 1, 'max_features': None, 'bootstrap': True, 'criterion': 'absolute_error'}. Best is trial 744 with value: 0.5032383725751689.
[I 2024-12-04 12:06:13,906] Trial 752 finished with value: 0.5139368157569973 and parameters: {'n_estimators': 122, 'max_depth': 21, 'min_samples_split': 4, 'min_samples_leaf': 1, 'max_features': None, 'bootstrap': True, 'criterion': 'absolute_error'}. Best is trial 744 with value: 0.5032383725751689.
[I 2024-12-04 12:06:13,952] Trial 769 finished with value: 1.3453775854379233 and parameters: {'n_estimators': 178, 'max_depth': 43, 'min_samples_split': 5, 'min_samples_leaf': 6, 'max_features': 'log2', 'bootstrap': False, 'criterion': 'absolute_error'}. Best is trial 744 with value: 0.5032383725751689.
[I 2024-12-04 12:06:13,953] Trial 757 finished with value: 0.5162213651805563 and parameters: {'n_estimators': 128, 'max_depth': 21, 'min_samples_split': 2, 'min_samples_leaf': 1, 'max_features': None, 'bootstrap': True, 'criterion': 'absolute_error'}. Best is trial 744 with value: 0.5032383725751689.
[I 2024-12-04 12:06:14,510] Trial 759 finished with value: 0.5168599997396685 and parameters: {'n_estimators': 140, 'max_depth': 22, 'min_samples_split': 2, 'min_samples_leaf': 1, 'max_features': None, 'bootstrap': True, 'criterion': 'absolute_error'}. Best is trial 744 with value: 0.5032383725751689.
[I 2024-12-04 12:06:14,793] Trial 770 finished with value: 1.196305610806194 and parameters: {'n_estimators': 182, 'max_depth': 9, 'min_samples_split': 2, 'min_samples_leaf': 1, 'max_features': 'log2', 'bootstrap': True, 'criterion': 'absolute_error'}. Best is trial 744 with value: 0.5032383725751689.
[I 2024-12-04 12:06:15,125] Trial 745 finished with value: 0.5871118156390867 and parameters: {'n_estimators': 336, 'max_depth': 19, 'min_samples_split': 11, 'min_samples_leaf': 2, 'max_features': None, 'bootstrap': False, 'criterion': 'absolute_error'}. Best is trial 744 with value: 0.5032383725751689.
[I 2024-12-04 12:06:15,506] Trial 749 finished with value: 0.5178124294053119 and parameters: {'n_estimators': 271, 'max_depth': 20, 'min_samples_split': 6, 'min_samples_leaf': 1, 'max_features': None, 'bootstrap': True, 'criterion': 'absolute_error'}. Best is trial 744 with value: 0.5032383725751689.
[I 2024-12-04 12:06:15,895] Trial 755 finished with value: 0.5243600762156743 and parameters: {'n_estimators': 282, 'max_depth': 18, 'min_samples_split': 9, 'min_samples_leaf': 1, 'max_features': None, 'bootstrap': True, 'criterion': 'absolute_error'}. Best is trial 744 with value: 0.5032383725751689.
[I 2024-12-04 12:06:16,427] Trial 767 finished with value: 0.5103118520424398 and parameters: {'n_estimators': 119, 'max_depth': 18, 'min_samples_split': 5, 'min_samples_leaf': 1, 'max_features': None, 'bootstrap': True, 'criterion': 'absolute_error'}. Best is trial 744 with value: 0.5032383725751689.
[I 2024-12-04 12:06:16,433] Trial 766 finished with value: 1.22131626011797 and parameters: {'n_estimators': 911, 'max_depth': 30, 'min_samples_split': 30, 'min_samples_leaf': 4, 'max_features': 'log2', 'bootstrap': True, 'criterion': 'squared_error'}. Best is trial 744 with value: 0.5032383725751689.
[I 2024-12-04 12:06:19,930] Trial 764 finished with value: 0.6146973012190879 and parameters: {'n_estimators': 972, 'max_depth': 16, 'min_samples_split': 30, 'min_samples_leaf': 6, 'max_features': None, 'bootstrap': False, 'criterion': 'squared_error'}. Best is trial 744 with value: 0.5032383725751689.
[I 2024-12-04 12:06:19,951] Trial 763 finished with value: 0.5186585059016733 and parameters: {'n_estimators': 199, 'max_depth': 22, 'min_samples_split': 7, 'min_samples_leaf': 1, 'max_features': None, 'bootstrap': True, 'criterion': 'absolute_error'}. Best is trial 744 with value: 0.5032383725751689.
[I 2024-12-04 12:06:21,776] Trial 783 finished with value: 0.5203839446071686 and parameters: {'n_estimators': 123, 'max_depth': 23, 'min_samples_split': 6, 'min_samples_leaf': 1, 'max_features': None, 'bootstrap': True, 'criterion': 'squared_error'}. Best is trial 744 with value: 0.5032383725751689.
[I 2024-12-04 12:06:22,221] Trial 768 finished with value: 0.5488798750628251 and parameters: {'n_estimators': 131, 'max_depth': 9, 'min_samples_split': 3, 'min_samples_leaf': 2, 'max_features': None, 'bootstrap': True, 'criterion': 'absolute_error'}. Best is trial 744 with value: 0.5032383725751689.
[I 2024-12-04 12:06:22,247] Trial 774 finished with value: 0.524699959792056 and parameters: {'n_estimators': 102, 'max_depth': 25, 'min_samples_split': 7, 'min_samples_leaf': 1, 'max_features': None, 'bootstrap': True, 'criterion': 'absolute_error'}. Best is trial 744 with value: 0.5032383725751689.
[I 2024-12-04 12:06:24,941] Trial 775 finished with value: 0.5591708312273145 and parameters: {'n_estimators': 145, 'max_depth': 19, 'min_samples_split': 6, 'min_samples_leaf': 2, 'max_features': None, 'bootstrap': True, 'criterion': 'absolute_error'}. Best is trial 744 with value: 0.5032383725751689.
[I 2024-12-04 12:06:24,965] Trial 773 finished with value: 0.5584563181151563 and parameters: {'n_estimators': 112, 'max_depth': 17, 'min_samples_split': 4, 'min_samples_leaf': 2, 'max_features': None, 'bootstrap': True, 'criterion': 'absolute_error'}. Best is trial 744 with value: 0.5032383725751689.
[I 2024-12-04 12:06:26,614] Trial 777 finished with value: 0.5095070065367802 and parameters: {'n_estimators': 110, 'max_depth': 20, 'min_samples_split': 5, 'min_samples_leaf': 1, 'max_features': None, 'bootstrap': True, 'criterion': 'absolute_error'}. Best is trial 744 with value: 0.5032383725751689.
[I 2024-12-04 12:06:27,013] Trial 776 finished with value: 0.5156007935413374 and parameters: {'n_estimators': 116, 'max_depth': 21, 'min_samples_split': 6, 'min_samples_leaf': 1, 'max_features': None, 'bootstrap': True, 'criterion': 'absolute_error'}. Best is trial 744 with value: 0.5032383725751689.
[I 2024-12-04 12:06:29,121] Trial 779 finished with value: 0.5059759562911091 and parameters: {'n_estimators': 108, 'max_depth': 19, 'min_samples_split': 4, 'min_samples_leaf': 1, 'max_features': None, 'bootstrap': True, 'criterion': 'absolute_error'}. Best is trial 744 with value: 0.5032383725751689.
[I 2024-12-04 12:06:29,125] Trial 771 finished with value: 0.5163037627931222 and parameters: {'n_estimators': 243, 'max_depth': 17, 'min_samples_split': 4, 'min_samples_leaf': 1, 'max_features': None, 'bootstrap': True, 'criterion': 'absolute_error'}. Best is trial 744 with value: 0.5032383725751689.
[I 2024-12-04 12:06:29,238] Trial 784 finished with value: 0.5144790808042284 and parameters: {'n_estimators': 100, 'max_depth': 9, 'min_samples_split': 6, 'min_samples_leaf': 1, 'max_features': None, 'bootstrap': True, 'criterion': 'absolute_error'}. Best is trial 744 with value: 0.5032383725751689.
[I 2024-12-04 12:06:29,948] Trial 781 finished with value: 0.5141181044236646 and parameters: {'n_estimators': 104, 'max_depth': 15, 'min_samples_split': 3, 'min_samples_leaf': 1, 'max_features': None, 'bootstrap': True, 'criterion': 'absolute_error'}. Best is trial 744 with value: 0.5032383725751689.
[I 2024-12-04 12:06:31,268] Trial 782 finished with value: 0.554186883699908 and parameters: {'n_estimators': 104, 'max_depth': 22, 'min_samples_split': 4, 'min_samples_leaf': 2, 'max_features': None, 'bootstrap': True, 'criterion': 'absolute_error'}. Best is trial 744 with value: 0.5032383725751689.
[I 2024-12-04 12:06:33,341] Trial 772 finished with value: 0.5528567269105982 and parameters: {'n_estimators': 302, 'max_depth': 12, 'min_samples_split': 6, 'min_samples_leaf': 2, 'max_features': None, 'bootstrap': True, 'criterion': 'absolute_error'}. Best is trial 744 with value: 0.5032383725751689.
[I 2024-12-04 12:06:33,743] Trial 798 finished with value: 1.2318314347144552 and parameters: {'n_estimators': 159, 'max_depth': 17, 'min_samples_split': 25, 'min_samples_leaf': 14, 'max_features': 'sqrt', 'bootstrap': False, 'criterion': 'squared_error'}. Best is trial 744 with value: 0.5032383725751689.
[I 2024-12-04 12:06:35,096] Trial 789 finished with value: 0.5637435845802031 and parameters: {'n_estimators': 109, 'max_depth': 19, 'min_samples_split': 9, 'min_samples_leaf': 2, 'max_features': None, 'bootstrap': True, 'criterion': 'absolute_error'}. Best is trial 744 with value: 0.5032383725751689.
[I 2024-12-04 12:06:35,208] Trial 786 finished with value: 0.5284464286809077 and parameters: {'n_estimators': 107, 'max_depth': 15, 'min_samples_split': 11, 'min_samples_leaf': 1, 'max_features': None, 'bootstrap': True, 'criterion': 'absolute_error'}. Best is trial 744 with value: 0.5032383725751689.
[I 2024-12-04 12:06:35,336] Trial 788 finished with value: 1.2462766942845034 and parameters: {'n_estimators': 813, 'max_depth': 32, 'min_samples_split': 4, 'min_samples_leaf': 10, 'max_features': 'log2', 'bootstrap': True, 'criterion': 'squared_error'}. Best is trial 744 with value: 0.5032383725751689.
[I 2024-12-04 12:06:39,591] Trial 792 finished with value: 0.5186750015876292 and parameters: {'n_estimators': 100, 'max_depth': 17, 'min_samples_split': 7, 'min_samples_leaf': 1, 'max_features': None, 'bootstrap': True, 'criterion': 'absolute_error'}. Best is trial 744 with value: 0.5032383725751689.
[I 2024-12-04 12:06:40,272] Trial 793 finished with value: 1.2231604995771916 and parameters: {'n_estimators': 705, 'max_depth': 50, 'min_samples_split': 3, 'min_samples_leaf': 10, 'max_features': 'sqrt', 'bootstrap': True, 'criterion': 'squared_error'}. Best is trial 744 with value: 0.5032383725751689.
[I 2024-12-04 12:06:40,275] Trial 794 finished with value: 0.5132946516779918 and parameters: {'n_estimators': 101, 'max_depth': 17, 'min_samples_split': 2, 'min_samples_leaf': 1, 'max_features': None, 'bootstrap': True, 'criterion': 'absolute_error'}. Best is trial 744 with value: 0.5032383725751689.
[I 2024-12-04 12:06:41,087] Trial 797 finished with value: 0.5107451738914641 and parameters: {'n_estimators': 102, 'max_depth': 16, 'min_samples_split': 5, 'min_samples_leaf': 1, 'max_features': None, 'bootstrap': True, 'criterion': 'absolute_error'}. Best is trial 744 with value: 0.5032383725751689.
[I 2024-12-04 12:06:41,258] Trial 790 finished with value: 0.5065195518209974 and parameters: {'n_estimators': 110, 'max_depth': 19, 'min_samples_split': 5, 'min_samples_leaf': 1, 'max_features': None, 'bootstrap': True, 'criterion': 'absolute_error'}. Best is trial 744 with value: 0.5032383725751689.
[I 2024-12-04 12:06:42,176] Trial 800 finished with value: 0.7962373182538713 and parameters: {'n_estimators': 369, 'max_depth': 15, 'min_samples_split': 12, 'min_samples_leaf': 1, 'max_features': 'sqrt', 'bootstrap': False, 'criterion': 'squared_error'}. Best is trial 744 with value: 0.5032383725751689.
