[I 2024-12-04 15:06:42,143] Trial 1196 finished with value: 0.6468484217569487 and parameters: {'n_estimators': 1271, 'learning_rate': 0.08112502990668961, 'max_depth': 12, 'min_samples_split': 20, 'min_samples_leaf': 3, 'subsample': 0.9864006559510805, 'max_features': None}. Best is trial 603 with value: 0.45955205541891275.
[I 2024-12-04 15:06:43,557] Trial 1211 finished with value: 0.49719793454507466 and parameters: {'n_estimators': 726, 'learning_rate': 0.0644056747873389, 'max_depth': 12, 'min_samples_split': 20, 'min_samples_leaf': 1, 'subsample': 0.9945807845256466, 'max_features': None}. Best is trial 603 with value: 0.45955205541891275.
[I 2024-12-04 15:06:44,160] Trial 1215 finished with value: 0.8727660279574987 and parameters: {'n_estimators': 865, 'learning_rate': 0.011083293654502568, 'max_depth': 3, 'min_samples_split': 7, 'min_samples_leaf': 1, 'subsample': 0.6289382360175404, 'max_features': 'log2'}. Best is trial 603 with value: 0.45955205541891275.
[I 2024-12-04 15:06:47,262] Trial 1229 finished with value: 0.609778865518326 and parameters: {'n_estimators': 403, 'learning_rate': 0.046356832921526, 'max_depth': 12, 'min_samples_split': 19, 'min_samples_leaf': 4, 'subsample': 0.9839788194046976, 'max_features': 'sqrt'}. Best is trial 603 with value: 0.45955205541891275.
[I 2024-12-04 15:06:47,873] Trial 1203 finished with value: 0.4980885644127296 and parameters: {'n_estimators': 1367, 'learning_rate': 0.045227923538615274, 'max_depth': 11, 'min_samples_split': 17, 'min_samples_leaf': 1, 'subsample': 0.9636789518904533, 'max_features': None}. Best is trial 603 with value: 0.45955205541891275.
[I 2024-12-04 15:06:52,792] Trial 1204 finished with value: 0.47432123576015106 and parameters: {'n_estimators': 1482, 'learning_rate': 0.04250967595527768, 'max_depth': 12, 'min_samples_split': 18, 'min_samples_leaf': 1, 'subsample': 0.9078415224612111, 'max_features': None}. Best is trial 603 with value: 0.45955205541891275.
[I 2024-12-04 15:06:53,417] Trial 1213 finished with value: 0.7466836270240661 and parameters: {'n_estimators': 1203, 'learning_rate': 0.015354908315449601, 'max_depth': 7, 'min_samples_split': 19, 'min_samples_leaf': 10, 'subsample': 0.6806670834432935, 'max_features': None}. Best is trial 603 with value: 0.45955205541891275.
[I 2024-12-04 15:06:57,125] Trial 1220 finished with value: 0.5969004507384618 and parameters: {'n_estimators': 1130, 'learning_rate': 0.04716422023601038, 'max_depth': 12, 'min_samples_split': 20, 'min_samples_leaf': 1, 'subsample': 0.9017535130919512, 'max_features': 'log2'}. Best is trial 603 with value: 0.45955205541891275.
[I 2024-12-04 15:06:58,625] Trial 1240 finished with value: 0.8224282942826668 and parameters: {'n_estimators': 603, 'learning_rate': 0.09473333579350177, 'max_depth': 10, 'min_samples_split': 10, 'min_samples_leaf': 9, 'subsample': 0.6206664636404904, 'max_features': 'log2'}. Best is trial 603 with value: 0.45955205541891275.
[I 2024-12-04 15:06:59,458] Trial 1209 finished with value: 0.49091996325103054 and parameters: {'n_estimators': 1343, 'learning_rate': 0.0328638335667268, 'max_depth': 12, 'min_samples_split': 17, 'min_samples_leaf': 1, 'subsample': 0.9325980226182169, 'max_features': None}. Best is trial 603 with value: 0.45955205541891275.
[I 2024-12-04 15:07:00,419] Trial 1217 finished with value: 0.49387156053313375 and parameters: {'n_estimators': 1103, 'learning_rate': 0.09899713192423924, 'max_depth': 10, 'min_samples_split': 17, 'min_samples_leaf': 1, 'subsample': 0.976249681577594, 'max_features': None}. Best is trial 603 with value: 0.45955205541891275.
[I 2024-12-04 15:07:00,650] Trial 1225 finished with value: 0.48339305975043917 and parameters: {'n_estimators': 897, 'learning_rate': 0.07324845634460447, 'max_depth': 10, 'min_samples_split': 20, 'min_samples_leaf': 1, 'subsample': 0.9983937244476384, 'max_features': None}. Best is trial 603 with value: 0.45955205541891275.
[I 2024-12-04 15:07:02,697] Trial 1210 finished with value: 0.47174162443791134 and parameters: {'n_estimators': 1380, 'learning_rate': 0.04560162111291351, 'max_depth': 12, 'min_samples_split': 20, 'min_samples_leaf': 1, 'subsample': 0.9797287516090275, 'max_features': None}. Best is trial 603 with value: 0.45955205541891275.
[I 2024-12-04 15:07:03,416] Trial 1222 finished with value: 0.633525657210699 and parameters: {'n_estimators': 1283, 'learning_rate': 0.05371732904353089, 'max_depth': 12, 'min_samples_split': 20, 'min_samples_leaf': 2, 'subsample': 0.9180268995065037, 'max_features': 'sqrt'}. Best is trial 603 with value: 0.45955205541891275.
[I 2024-12-04 15:07:03,514] Trial 1214 finished with value: 0.6469843818235886 and parameters: {'n_estimators': 1355, 'learning_rate': 0.05184141119136561, 'max_depth': 10, 'min_samples_split': 17, 'min_samples_leaf': 2, 'subsample': 0.9930226494593989, 'max_features': None}. Best is trial 603 with value: 0.45955205541891275.
[I 2024-12-04 15:07:03,901] Trial 1243 finished with value: 0.8269304470616128 and parameters: {'n_estimators': 587, 'learning_rate': 0.020736225011978002, 'max_depth': 5, 'min_samples_split': 18, 'min_samples_leaf': 10, 'subsample': 0.8882222362636153, 'max_features': 'sqrt'}. Best is trial 603 with value: 0.45955205541891275.
[I 2024-12-04 15:07:05,206] Trial 1218 finished with value: 0.6469999149592081 and parameters: {'n_estimators': 1179, 'learning_rate': 0.046482672990577456, 'max_depth': 12, 'min_samples_split': 20, 'min_samples_leaf': 3, 'subsample': 0.9197726397580757, 'max_features': None}. Best is trial 603 with value: 0.45955205541891275.
[I 2024-12-04 15:07:06,966] Trial 1221 finished with value: 0.6411026468389541 and parameters: {'n_estimators': 1177, 'learning_rate': 0.05057223856215649, 'max_depth': 12, 'min_samples_split': 17, 'min_samples_leaf': 3, 'subsample': 0.9206856222373215, 'max_features': None}. Best is trial 603 with value: 0.45955205541891275.
[I 2024-12-04 15:07:08,736] Trial 1216 finished with value: 0.6493016556005123 and parameters: {'n_estimators': 1457, 'learning_rate': 0.03622095801707017, 'max_depth': 12, 'min_samples_split': 19, 'min_samples_leaf': 3, 'subsample': 0.8133977674919931, 'max_features': None}. Best is trial 603 with value: 0.45955205541891275.
[I 2024-12-04 15:07:08,742] Trial 1230 finished with value: 0.6159580115185721 and parameters: {'n_estimators': 965, 'learning_rate': 0.05793016968610182, 'max_depth': 12, 'min_samples_split': 20, 'min_samples_leaf': 3, 'subsample': 0.992568675488237, 'max_features': None}. Best is trial 603 with value: 0.45955205541891275.
[I 2024-12-04 15:07:08,978] Trial 1249 finished with value: 0.8007657752608057 and parameters: {'n_estimators': 197, 'learning_rate': 0.023246359141664927, 'max_depth': 10, 'min_samples_split': 3, 'min_samples_leaf': 4, 'subsample': 0.6177878982996273, 'max_features': 'sqrt'}. Best is trial 603 with value: 0.45955205541891275.
[I 2024-12-04 15:07:09,571] Trial 1212 finished with value: 0.4700895307529267 and parameters: {'n_estimators': 1476, 'learning_rate': 0.04324725475768649, 'max_depth': 12, 'min_samples_split': 18, 'min_samples_leaf': 1, 'subsample': 0.9679232327423551, 'max_features': None}. Best is trial 603 with value: 0.45955205541891275.
[I 2024-12-04 15:07:10,947] Trial 1224 finished with value: 0.48665026850635734 and parameters: {'n_estimators': 1215, 'learning_rate': 0.03611558001444255, 'max_depth': 12, 'min_samples_split': 20, 'min_samples_leaf': 1, 'subsample': 0.9615128953588494, 'max_features': None}. Best is trial 603 with value: 0.45955205541891275.
[I 2024-12-04 15:07:11,109] Trial 1239 finished with value: 0.643964949844144 and parameters: {'n_estimators': 886, 'learning_rate': 0.06833312572374876, 'max_depth': 12, 'min_samples_split': 20, 'min_samples_leaf': 3, 'subsample': 0.916973622850014, 'max_features': None}. Best is trial 603 with value: 0.45955205541891275.
[I 2024-12-04 15:07:11,769] Trial 1231 finished with value: 0.5522076350391895 and parameters: {'n_estimators': 1359, 'learning_rate': 0.03509974953891228, 'max_depth': 10, 'min_samples_split': 13, 'min_samples_leaf': 1, 'subsample': 0.9871484630036118, 'max_features': 'log2'}. Best is trial 603 with value: 0.45955205541891275.
[I 2024-12-04 15:07:11,960] Trial 1234 finished with value: 0.5000490532256903 and parameters: {'n_estimators': 936, 'learning_rate': 0.0548758759120336, 'max_depth': 12, 'min_samples_split': 16, 'min_samples_leaf': 1, 'subsample': 0.9642775017108043, 'max_features': None}. Best is trial 603 with value: 0.45955205541891275.
[I 2024-12-04 15:07:12,422] Trial 1227 finished with value: 0.4758190617205981 and parameters: {'n_estimators': 1153, 'learning_rate': 0.06787129808986885, 'max_depth': 11, 'min_samples_split': 17, 'min_samples_leaf': 1, 'subsample': 0.9986765376789286, 'max_features': None}. Best is trial 603 with value: 0.45955205541891275.
[I 2024-12-04 15:07:12,712] Trial 1226 finished with value: 0.4774135118359324 and parameters: {'n_estimators': 1244, 'learning_rate': 0.057418328883743174, 'max_depth': 12, 'min_samples_split': 18, 'min_samples_leaf': 1, 'subsample': 0.9970131236515757, 'max_features': None}. Best is trial 603 with value: 0.45955205541891275.
[I 2024-12-04 15:07:16,867] Trial 1242 finished with value: 0.61308755280915 and parameters: {'n_estimators': 1178, 'learning_rate': 0.04894412581598065, 'max_depth': 4, 'min_samples_split': 18, 'min_samples_leaf': 1, 'subsample': 0.7191051707340935, 'max_features': 'log2'}. Best is trial 603 with value: 0.45955205541891275.
[I 2024-12-04 15:07:17,441] Trial 1228 finished with value: 0.5189649939898119 and parameters: {'n_estimators': 1498, 'learning_rate': 0.053453321768930286, 'max_depth': 6, 'min_samples_split': 3, 'min_samples_leaf': 1, 'subsample': 0.9087597662318863, 'max_features': None}. Best is trial 603 with value: 0.45955205541891275.
[I 2024-12-04 15:07:17,801] Trial 1223 finished with value: 0.5063339740083451 and parameters: {'n_estimators': 1460, 'learning_rate': 0.09537713958264223, 'max_depth': 11, 'min_samples_split': 16, 'min_samples_leaf': 1, 'subsample': 0.9960467085183657, 'max_features': None}. Best is trial 603 with value: 0.45955205541891275.
[I 2024-12-04 15:07:17,805] Trial 1232 finished with value: 0.4937455487750561 and parameters: {'n_estimators': 1253, 'learning_rate': 0.07712556278466345, 'max_depth': 12, 'min_samples_split': 16, 'min_samples_leaf': 1, 'subsample': 0.9947536078629765, 'max_features': None}. Best is trial 603 with value: 0.45955205541891275.
[I 2024-12-04 15:07:20,818] Trial 1233 finished with value: 0.6464326385551182 and parameters: {'n_estimators': 1313, 'learning_rate': 0.07204740160181596, 'max_depth': 12, 'min_samples_split': 17, 'min_samples_leaf': 3, 'subsample': 0.984439875611546, 'max_features': None}. Best is trial 603 with value: 0.45955205541891275.
[I 2024-12-04 15:07:20,909] Trial 1251 finished with value: 0.4979859927793785 and parameters: {'n_estimators': 507, 'learning_rate': 0.0997818756997201, 'max_depth': 10, 'min_samples_split': 18, 'min_samples_leaf': 1, 'subsample': 0.9438945590175943, 'max_features': None}. Best is trial 603 with value: 0.45955205541891275.
[I 2024-12-04 15:07:21,941] Trial 1247 finished with value: 0.724262477091726 and parameters: {'n_estimators': 1062, 'learning_rate': 0.01212271116269287, 'max_depth': 8, 'min_samples_split': 3, 'min_samples_leaf': 2, 'subsample': 0.9219470118493907, 'max_features': 'log2'}. Best is trial 603 with value: 0.45955205541891275.
[I 2024-12-04 15:07:23,472] Trial 1238 finished with value: 0.6506965746887172 and parameters: {'n_estimators': 1332, 'learning_rate': 0.040371751605276854, 'max_depth': 12, 'min_samples_split': 14, 'min_samples_leaf': 3, 'subsample': 0.9921482031155147, 'max_features': None}. Best is trial 603 with value: 0.45955205541891275.
[I 2024-12-04 15:07:24,281] Trial 1241 finished with value: 0.6408259379630721 and parameters: {'n_estimators': 1366, 'learning_rate': 0.04620968060680866, 'max_depth': 11, 'min_samples_split': 20, 'min_samples_leaf': 3, 'subsample': 0.927844821420616, 'max_features': None}. Best is trial 603 with value: 0.45955205541891275.
[I 2024-12-04 15:07:24,399] Trial 1236 finished with value: 0.5046401432969386 and parameters: {'n_estimators': 1439, 'learning_rate': 0.0511729951953451, 'max_depth': 10, 'min_samples_split': 17, 'min_samples_leaf': 1, 'subsample': 0.9923604950234001, 'max_features': None}. Best is trial 603 with value: 0.45955205541891275.
[I 2024-12-04 15:07:24,642] Trial 1245 finished with value: 0.48765120752689134 and parameters: {'n_estimators': 1002, 'learning_rate': 0.06852542966382062, 'max_depth': 12, 'min_samples_split': 20, 'min_samples_leaf': 1, 'subsample': 0.9110024383404136, 'max_features': None}. Best is trial 603 with value: 0.45955205541891275.
[I 2024-12-04 15:07:24,950] Trial 1237 finished with value: 0.4747920369078991 and parameters: {'n_estimators': 1445, 'learning_rate': 0.04883316011491864, 'max_depth': 12, 'min_samples_split': 18, 'min_samples_leaf': 1, 'subsample': 0.9893875273640858, 'max_features': None}. Best is trial 603 with value: 0.45955205541891275.
[I 2024-12-04 15:07:25,874] Trial 1258 finished with value: 1.1100795394118441 and parameters: {'n_estimators': 434, 'learning_rate': 0.01163835549386185, 'max_depth': 11, 'min_samples_split': 12, 'min_samples_leaf': 6, 'subsample': 0.8496368944186269, 'max_features': 'log2'}. Best is trial 603 with value: 0.45955205541891275.
[I 2024-12-04 15:07:25,878] Trial 1235 finished with value: 0.6280285804794049 and parameters: {'n_estimators': 1488, 'learning_rate': 0.06368929410702094, 'max_depth': 12, 'min_samples_split': 16, 'min_samples_leaf': 2, 'subsample': 0.9625678239019695, 'max_features': None}. Best is trial 603 with value: 0.45955205541891275.
[I 2024-12-04 15:07:27,097] Trial 1244 finished with value: 0.4844449591216397 and parameters: {'n_estimators': 1105, 'learning_rate': 0.05320544193074366, 'max_depth': 12, 'min_samples_split': 20, 'min_samples_leaf': 1, 'subsample': 0.927634821177967, 'max_features': None}. Best is trial 603 with value: 0.45955205541891275.
[I 2024-12-04 15:07:30,109] Trial 1255 finished with value: 0.6184322975648386 and parameters: {'n_estimators': 632, 'learning_rate': 0.09900505810635808, 'max_depth': 12, 'min_samples_split': 20, 'min_samples_leaf': 4, 'subsample': 0.9997730677011605, 'max_features': None}. Best is trial 603 with value: 0.45955205541891275.
[I 2024-12-04 15:07:32,433] Trial 1260 finished with value: 0.8491260551898782 and parameters: {'n_estimators': 804, 'learning_rate': 0.012933308102817467, 'max_depth': 8, 'min_samples_split': 20, 'min_samples_leaf': 10, 'subsample': 0.8154447744902742, 'max_features': 'sqrt'}. Best is trial 603 with value: 0.45955205541891275.
[I 2024-12-04 15:07:32,994] Trial 1246 finished with value: 0.4816797121314118 and parameters: {'n_estimators': 1168, 'learning_rate': 0.08725499239312302, 'max_depth': 11, 'min_samples_split': 20, 'min_samples_leaf': 1, 'subsample': 0.9870955179540382, 'max_features': None}. Best is trial 603 with value: 0.45955205541891275.
[I 2024-12-04 15:07:33,330] Trial 1259 finished with value: 0.48459595189894233 and parameters: {'n_estimators': 606, 'learning_rate': 0.07599084859509476, 'max_depth': 12, 'min_samples_split': 20, 'min_samples_leaf': 1, 'subsample': 0.9284050675318305, 'max_features': None}. Best is trial 603 with value: 0.45955205541891275.
[I 2024-12-04 15:07:34,002] Trial 1252 finished with value: 0.6667240226976754 and parameters: {'n_estimators': 900, 'learning_rate': 0.09970685580298619, 'max_depth': 11, 'min_samples_split': 17, 'min_samples_leaf': 3, 'subsample': 0.9880434118460482, 'max_features': None}. Best is trial 603 with value: 0.45955205541891275.
[I 2024-12-04 15:07:34,005] Trial 1253 finished with value: 0.6531151632490159 and parameters: {'n_estimators': 874, 'learning_rate': 0.0990768765582009, 'max_depth': 12, 'min_samples_split': 17, 'min_samples_leaf': 3, 'subsample': 0.9075960161562052, 'max_features': None}. Best is trial 603 with value: 0.45955205541891275.
[I 2024-12-04 15:07:36,416] Trial 1262 finished with value: 0.7658049891819134 and parameters: {'n_estimators': 597, 'learning_rate': 0.054574859739238264, 'max_depth': 5, 'min_samples_split': 2, 'min_samples_leaf': 8, 'subsample': 0.7458376115859414, 'max_features': 'sqrt'}. Best is trial 603 with value: 0.45955205541891275.
[I 2024-12-04 15:07:37,807] Trial 1250 finished with value: 0.48811258347074993 and parameters: {'n_estimators': 1155, 'learning_rate': 0.06470515711383414, 'max_depth': 12, 'min_samples_split': 20, 'min_samples_leaf': 1, 'subsample': 0.9330847000762195, 'max_features': None}. Best is trial 603 with value: 0.45955205541891275.
[I 2024-12-04 15:07:38,762] Trial 1264 finished with value: 0.6426343873931666 and parameters: {'n_estimators': 526, 'learning_rate': 0.08918743632161182, 'max_depth': 12, 'min_samples_split': 18, 'min_samples_leaf': 3, 'subsample': 0.8899242138747372, 'max_features': None}. Best is trial 603 with value: 0.45955205541891275.
[I 2024-12-04 15:07:39,918] Trial 1265 finished with value: 0.5595113088828447 and parameters: {'n_estimators': 618, 'learning_rate': 0.04057701459445898, 'max_depth': 11, 'min_samples_split': 3, 'min_samples_leaf': 4, 'subsample': 0.6244804874266313, 'max_features': None}. Best is trial 603 with value: 0.45955205541891275.
[I 2024-12-04 15:07:44,153] Trial 1270 finished with value: 0.6679021323031974 and parameters: {'n_estimators': 750, 'learning_rate': 0.09086113486291096, 'max_depth': 10, 'min_samples_split': 16, 'min_samples_leaf': 3, 'subsample': 0.9624662112133053, 'max_features': 'sqrt'}. Best is trial 603 with value: 0.45955205541891275.
[I 2024-12-04 15:07:46,057] Trial 1248 finished with value: 0.4743079407199994 and parameters: {'n_estimators': 1482, 'learning_rate': 0.05972597403443648, 'max_depth': 11, 'min_samples_split': 20, 'min_samples_leaf': 1, 'subsample': 0.9977359986701225, 'max_features': None}. Best is trial 603 with value: 0.45955205541891275.
[I 2024-12-04 15:07:46,427] Trial 1256 finished with value: 0.5022703271580128 and parameters: {'n_estimators': 1201, 'learning_rate': 0.047396994577381314, 'max_depth': 10, 'min_samples_split': 20, 'min_samples_leaf': 1, 'subsample': 0.9446527972957797, 'max_features': None}. Best is trial 603 with value: 0.45955205541891275.
[I 2024-12-04 15:07:49,566] Trial 1261 finished with value: 0.49216895171436814 and parameters: {'n_estimators': 919, 'learning_rate': 0.07488608864835483, 'max_depth': 12, 'min_samples_split': 16, 'min_samples_leaf': 1, 'subsample': 0.9203301083684856, 'max_features': None}. Best is trial 603 with value: 0.45955205541891275.
[I 2024-12-04 15:07:49,965] Trial 1254 finished with value: 0.5002466085673993 and parameters: {'n_estimators': 1379, 'learning_rate': 0.0573166766909912, 'max_depth': 12, 'min_samples_split': 16, 'min_samples_leaf': 1, 'subsample': 0.9544928762380502, 'max_features': None}. Best is trial 603 with value: 0.45955205541891275.
[I 2024-12-04 15:07:50,338] Trial 1267 finished with value: 0.5124844377072059 and parameters: {'n_estimators': 760, 'learning_rate': 0.048953923389744684, 'max_depth': 11, 'min_samples_split': 16, 'min_samples_leaf': 1, 'subsample': 0.9988510641390453, 'max_features': None}. Best is trial 603 with value: 0.45955205541891275.
[I 2024-12-04 15:07:50,961] Trial 1288 finished with value: 0.6765212135339845 and parameters: {'n_estimators': 575, 'learning_rate': 0.09734535314168404, 'max_depth': 12, 'min_samples_split': 16, 'min_samples_leaf': 3, 'subsample': 0.9978671422822964, 'max_features': 'sqrt'}. Best is trial 603 with value: 0.45955205541891275.
[I 2024-12-04 15:07:51,606] Trial 1283 finished with value: 0.4941474031282983 and parameters: {'n_estimators': 514, 'learning_rate': 0.08986089328654882, 'max_depth': 12, 'min_samples_split': 17, 'min_samples_leaf': 1, 'subsample': 0.9950512861791645, 'max_features': None}. Best is trial 603 with value: 0.45955205541891275.
[I 2024-12-04 15:07:52,175] Trial 1272 finished with value: 0.6305636024622545 and parameters: {'n_estimators': 751, 'learning_rate': 0.08553132864052604, 'max_depth': 12, 'min_samples_split': 15, 'min_samples_leaf': 2, 'subsample': 0.9995225523718966, 'max_features': None}. Best is trial 603 with value: 0.45955205541891275.
[I 2024-12-04 15:07:53,233] Trial 1278 finished with value: 0.4884515904316012 and parameters: {'n_estimators': 676, 'learning_rate': 0.059081853638587686, 'max_depth': 10, 'min_samples_split': 19, 'min_samples_leaf': 1, 'subsample': 0.9364131441191916, 'max_features': None}. Best is trial 603 with value: 0.45955205541891275.
[I 2024-12-04 15:07:54,321] Trial 1266 finished with value: 0.4723519866346321 and parameters: {'n_estimators': 1053, 'learning_rate': 0.05007851365699287, 'max_depth': 12, 'min_samples_split': 20, 'min_samples_leaf': 1, 'subsample': 0.9970208582880153, 'max_features': None}. Best is trial 603 with value: 0.45955205541891275.
[I 2024-12-04 15:07:54,328] Trial 1285 finished with value: 0.4937802475348544 and parameters: {'n_estimators': 549, 'learning_rate': 0.07808072035389545, 'max_depth': 10, 'min_samples_split': 20, 'min_samples_leaf': 1, 'subsample': 0.9952241587748661, 'max_features': None}. Best is trial 603 with value: 0.45955205541891275.
[I 2024-12-04 15:07:56,478] Trial 1263 finished with value: 0.4850507869221134 and parameters: {'n_estimators': 1136, 'learning_rate': 0.038943395833361975, 'max_depth': 11, 'min_samples_split': 19, 'min_samples_leaf': 1, 'subsample': 0.9968028192240963, 'max_features': None}. Best is trial 603 with value: 0.45955205541891275.
[I 2024-12-04 15:07:56,846] Trial 1282 finished with value: 0.6263386980316398 and parameters: {'n_estimators': 698, 'learning_rate': 0.06876409304981718, 'max_depth': 12, 'min_samples_split': 18, 'min_samples_leaf': 3, 'subsample': 0.9917390804267501, 'max_features': None}. Best is trial 603 with value: 0.45955205541891275.
