[I 2024-12-04 15:08:37,794] Trial 1357 finished with value: 1.26143377892734 and parameters: {'kernel_type': 'Matern', 'length_scale': 670.372756901807, 'noise_level': 0.011676417651456536, 'constant_value': 0.0037017115541839924, 'nu': 0.5}. Best is trial 386 with value: 0.4872991004520934.
[I 2024-12-04 15:08:39,855] Trial 1352 finished with value: 1.2401112324791905 and parameters: {'kernel_type': 'Matern', 'length_scale': 502.44054698158243, 'noise_level': 0.007904989744121693, 'constant_value': 2.7298935225971155, 'nu': 0.5}. Best is trial 386 with value: 0.4872991004520934.
[I 2024-12-04 15:08:40,992] Trial 1351 finished with value: 1.2614547940515315 and parameters: {'kernel_type': 'Matern', 'length_scale': 63240.763925643194, 'noise_level': 0.16799316042375625, 'constant_value': 0.002236352857811069, 'nu': 0.5}. Best is trial 386 with value: 0.4872991004520934.
[I 2024-12-04 15:08:41,141] Trial 1348 finished with value: 0.48830289704673535 and parameters: {'kernel_type': 'Matern', 'length_scale': 14221.323975781166, 'noise_level': 0.01240372015443553, 'constant_value': 75966.90047562406, 'nu': 0.5}. Best is trial 386 with value: 0.4872991004520934.
[I 2024-12-04 15:08:41,593] Trial 1353 finished with value: 0.5273053750610696 and parameters: {'kernel_type': 'Matern', 'length_scale': 13.017052979226685, 'noise_level': 0.911280476296135, 'constant_value': 104.99738875446954, 'nu': 1.5}. Best is trial 386 with value: 0.4872991004520934.
[I 2024-12-04 15:08:41,674] Trial 1355 finished with value: 0.4883034109804969 and parameters: {'kernel_type': 'Matern', 'length_scale': 91140.25930817625, 'noise_level': 0.00017816763817872085, 'constant_value': 2996.075422977424, 'nu': 0.5}. Best is trial 386 with value: 0.4872991004520934.
[I 2024-12-04 15:08:42,415] Trial 1356 finished with value: 0.48830328634862524 and parameters: {'kernel_type': 'Matern', 'length_scale': 896.595990392004, 'noise_level': 0.8280463653325377, 'constant_value': 26.84635708035196, 'nu': 0.5}. Best is trial 386 with value: 0.4872991004520934.
[I 2024-12-04 15:08:42,907] Trial 1360 finished with value: 1.2614547953941473 and parameters: {'kernel_type': 'Matern', 'length_scale': 119.03490913075068, 'noise_level': 0.02280107638682683, 'constant_value': 1279.7407726388578, 'nu': 0.5}. Best is trial 386 with value: 0.4872991004520934.
[I 2024-12-04 15:08:43,471] Trial 1358 finished with value: 0.4883034316859743 and parameters: {'kernel_type': 'Matern', 'length_scale': 331.0650652266209, 'noise_level': 0.009480693602265937, 'constant_value': 45.37879963937005, 'nu': 0.5}. Best is trial 386 with value: 0.4872991004520934.
[I 2024-12-04 15:08:44,182] Trial 1359 finished with value: 0.4883034222114639 and parameters: {'kernel_type': 'Matern', 'length_scale': 4011.551212453968, 'noise_level': 0.9932627916543577, 'constant_value': 3.7781244078136385, 'nu': 0.5}. Best is trial 386 with value: 0.4872991004520934.
[I 2024-12-04 15:08:45,433] Trial 1347 finished with value: 1.240111231859669 and parameters: {'kernel_type': 'Matern', 'length_scale': 10403.866327489488, 'noise_level': 3.577221077111936e-06, 'constant_value': 1535.6209986320127, 'nu': 2.5}. Best is trial 386 with value: 0.4872991004520934.
[I 2024-12-04 15:08:45,590] Trial 1365 finished with value: 0.6443867850620959 and parameters: {'kernel_type': 'RBF', 'length_scale': 615.4624949015439, 'noise_level': 0.2819996280668451, 'constant_value': 523.6454818159061, 'nu': 0.5}. Best is trial 386 with value: 0.4872991004520934.
[I 2024-12-04 15:08:45,784] Trial 1369 finished with value: 0.4883033255931026 and parameters: {'kernel_type': 'Matern', 'length_scale': 21396.79161796814, 'noise_level': 0.000372673767241896, 'constant_value': 57315.62024066073, 'nu': 0.5}. Best is trial 386 with value: 0.4872991004520934.
[I 2024-12-04 15:08:46,024] Trial 1361 finished with value: 0.4883034228322525 and parameters: {'kernel_type': 'Matern', 'length_scale': 0.11155671880801342, 'noise_level': 0.3804002250077231, 'constant_value': 0.0012187278126528716, 'nu': 0.5}. Best is trial 386 with value: 0.4872991004520934.
[I 2024-12-04 15:08:47,098] Trial 1364 finished with value: 1.2614547953941473 and parameters: {'kernel_type': 'Matern', 'length_scale': 6237.795283056107, 'noise_level': 0.03182020635371151, 'constant_value': 53660.49362479258, 'nu': 0.5}. Best is trial 386 with value: 0.4872991004520934.
[I 2024-12-04 15:08:47,699] Trial 1374 finished with value: 0.48830343586274305 and parameters: {'kernel_type': 'Matern', 'length_scale': 35403.653919212586, 'noise_level': 0.0012756149898409971, 'constant_value': 69571.46124766332, 'nu': 0.5}. Best is trial 386 with value: 0.4872991004520934.
[I 2024-12-04 15:08:50,540] Trial 1367 finished with value: 0.4883034329753155 and parameters: {'kernel_type': 'Matern', 'length_scale': 2182.271646179857, 'noise_level': 0.00029354372158279574, 'constant_value': 80791.60710125277, 'nu': 0.5}. Best is trial 386 with value: 0.4872991004520934.
[I 2024-12-04 15:08:50,581] Trial 1375 finished with value: 1.2614547976352386 and parameters: {'kernel_type': 'Matern', 'length_scale': 37540.77255822939, 'noise_level': 0.49105751514668866, 'constant_value': 0.007259819642089188, 'nu': 2.5}. Best is trial 386 with value: 0.4872991004520934.
[I 2024-12-04 15:08:50,607] Trial 1370 finished with value: 1.2614547953941475 and parameters: {'kernel_type': 'Matern', 'length_scale': 643.8151496933466, 'noise_level': 0.025465419714453107, 'constant_value': 3371.965452056672, 'nu': 0.5}. Best is trial 386 with value: 0.4872991004520934.
[I 2024-12-04 15:08:50,676] Trial 1362 finished with value: 0.4883034137767904 and parameters: {'kernel_type': 'Matern', 'length_scale': 46256.41249062339, 'noise_level': 0.05897978124545744, 'constant_value': 18695.767949986282, 'nu': 0.5}. Best is trial 386 with value: 0.4872991004520934.
[I 2024-12-04 15:08:51,381] Trial 1363 finished with value: 1.2614543702027636 and parameters: {'kernel_type': 'RBF', 'length_scale': 0.006270796591867606, 'noise_level': 1.1797636842039138e-08, 'constant_value': 4.340632194255533, 'nu': 2.5}. Best is trial 386 with value: 0.4872991004520934.
[I 2024-12-04 15:08:52,602] Trial 1372 finished with value: 0.48830342127707677 and parameters: {'kernel_type': 'Matern', 'length_scale': 77589.94794792164, 'noise_level': 0.0012088615161116492, 'constant_value': 21604.19677803634, 'nu': 0.5}. Best is trial 386 with value: 0.4872991004520934.
[I 2024-12-04 15:08:53,711] Trial 1373 finished with value: 0.4883034361323905 and parameters: {'kernel_type': 'Matern', 'length_scale': 25877.523584770584, 'noise_level': 0.10712532352205997, 'constant_value': 62370.90944886267, 'nu': 0.5}. Best is trial 386 with value: 0.4872991004520934.
[I 2024-12-04 15:08:54,083] Trial 1378 finished with value: 0.48830341594725796 and parameters: {'kernel_type': 'Matern', 'length_scale': 0.35159558634541455, 'noise_level': 0.007872014825815324, 'constant_value': 0.00810772838073811, 'nu': 0.5}. Best is trial 386 with value: 0.4872991004520934.
[I 2024-12-04 15:08:54,878] Trial 1368 finished with value: 0.644385361026771 and parameters: {'kernel_type': 'RBF', 'length_scale': 37771.604448293234, 'noise_level': 0.9506773997301698, 'constant_value': 45194.70715706188, 'nu': 0.5}. Best is trial 386 with value: 0.4872991004520934.
[I 2024-12-04 15:08:54,945] Trial 1366 finished with value: 0.4883034172295465 and parameters: {'kernel_type': 'Matern', 'length_scale': 17130.106028268496, 'noise_level': 0.0104637749170966, 'constant_value': 24157.669646285547, 'nu': 0.5}. Best is trial 386 with value: 0.4872991004520934.
[I 2024-12-04 15:08:55,340] Trial 1380 finished with value: 0.4883024327949614 and parameters: {'kernel_type': 'Matern', 'length_scale': 66775.77086524371, 'noise_level': 0.9361405557586545, 'constant_value': 69702.26407632107, 'nu': 0.5}. Best is trial 386 with value: 0.4872991004520934.
[I 2024-12-04 15:08:55,825] Trial 1376 finished with value: 1.2401112272406196 and parameters: {'kernel_type': 'RBF', 'length_scale': 0.09612729530701032, 'noise_level': 1.611453019628321e-08, 'constant_value': 1.206148602729573e-07, 'nu': 0.5}. Best is trial 386 with value: 0.4872991004520934.
[I 2024-12-04 15:08:56,312] Trial 1381 finished with value: 0.48830341703978575 and parameters: {'kernel_type': 'Matern', 'length_scale': 84768.5699817995, 'noise_level': 0.015796556989506206, 'constant_value': 70343.77821979552, 'nu': 0.5}. Best is trial 386 with value: 0.4872991004520934.
[I 2024-12-04 15:08:56,363] Trial 1377 finished with value: 0.48830343125166126 and parameters: {'kernel_type': 'Matern', 'length_scale': 1498.7281481087593, 'noise_level': 0.06749764063274263, 'constant_value': 92511.6704383049, 'nu': 0.5}. Best is trial 386 with value: 0.4872991004520934.
[I 2024-12-04 15:08:56,494] Trial 1371 finished with value: 0.4883034066193148 and parameters: {'kernel_type': 'Matern', 'length_scale': 20603.77941828117, 'noise_level': 0.03281122626426524, 'constant_value': 50082.81804523131, 'nu': 0.5}. Best is trial 386 with value: 0.4872991004520934.
[I 2024-12-04 15:08:56,628] Trial 1379 finished with value: 1.2401112326096706 and parameters: {'kernel_type': 'Matern', 'length_scale': 88421.27829345601, 'noise_level': 0.015862445547851805, 'constant_value': 4595.62213194715, 'nu': 2.5}. Best is trial 386 with value: 0.4872991004520934.
[I 2024-12-04 15:08:57,500] Trial 1386 finished with value: 1.2614547953941475 and parameters: {'kernel_type': 'Matern', 'length_scale': 10505.66960710576, 'noise_level': 0.029926248093228625, 'constant_value': 92624.40430292753, 'nu': 0.5}. Best is trial 386 with value: 0.4872991004520934.
[I 2024-12-04 15:09:00,153] Trial 1387 finished with value: 0.4883034192484344 and parameters: {'kernel_type': 'Matern', 'length_scale': 26150.925045074684, 'noise_level': 0.8567992837392572, 'constant_value': 59630.237244608805, 'nu': 0.5}. Best is trial 386 with value: 0.4872991004520934.
[I 2024-12-04 15:09:01,181] Trial 1385 finished with value: 0.4883034283496931 and parameters: {'kernel_type': 'Matern', 'length_scale': 23827.397943717267, 'noise_level': 0.04209567116322553, 'constant_value': 54906.80444841056, 'nu': 0.5}. Best is trial 386 with value: 0.4872991004520934.
[I 2024-12-04 15:09:01,952] Trial 1383 finished with value: 0.4883034266103716 and parameters: {'kernel_type': 'Matern', 'length_scale': 66.02771618466637, 'noise_level': 0.9672964620473362, 'constant_value': 59564.64515980319, 'nu': 0.5}. Best is trial 386 with value: 0.4872991004520934.
[I 2024-12-04 15:09:03,318] Trial 1389 finished with value: 0.6443853791088007 and parameters: {'kernel_type': 'RBF', 'length_scale': 7858.022548454669, 'noise_level': 0.1711280485960883, 'constant_value': 545.8045924553213, 'nu': 1.5}. Best is trial 386 with value: 0.4872991004520934.
[I 2024-12-04 15:09:03,691] Trial 1382 finished with value: 0.4883034207825708 and parameters: {'kernel_type': 'Matern', 'length_scale': 504.46701554332253, 'noise_level': 0.19005949448720633, 'constant_value': 78299.23259123758, 'nu': 0.5}. Best is trial 386 with value: 0.4872991004520934.
[I 2024-12-04 15:09:03,889] Trial 1396 finished with value: 0.488302634898758 and parameters: {'kernel_type': 'Matern', 'length_scale': 90669.51264270248, 'noise_level': 0.22795043786136643, 'constant_value': 27351.405330757156, 'nu': 0.5}. Best is trial 386 with value: 0.4872991004520934.
[I 2024-12-04 15:09:04,547] Trial 1395 finished with value: 1.240111232603652 and parameters: {'kernel_type': 'Matern', 'length_scale': 3.6673649571579474e-05, 'noise_level': 2.100937765762981e-06, 'constant_value': 0.003079413433949793, 'nu': 0.5}. Best is trial 386 with value: 0.4872991004520934.
[I 2024-12-04 15:09:05,522] Trial 1388 finished with value: 0.4883035100368278 and parameters: {'kernel_type': 'Matern', 'length_scale': 2929.1739775831797, 'noise_level': 0.4345617070555873, 'constant_value': 67197.23901513344, 'nu': 0.5}. Best is trial 386 with value: 0.4872991004520934.
[I 2024-12-04 15:09:05,701] Trial 1392 finished with value: 0.4883040590124299 and parameters: {'kernel_type': 'Matern', 'length_scale': 4550.56015641333, 'noise_level': 0.6959422010046705, 'constant_value': 335.61013379453016, 'nu': 0.5}. Best is trial 386 with value: 0.4872991004520934.
[I 2024-12-04 15:09:06,314] Trial 1393 finished with value: 0.48830319893988255 and parameters: {'kernel_type': 'Matern', 'length_scale': 738.3770710652801, 'noise_level': 0.7571347560509152, 'constant_value': 330.89499329118524, 'nu': 0.5}. Best is trial 386 with value: 0.4872991004520934.
[I 2024-12-04 15:09:06,338] Trial 1390 finished with value: 0.4883034157338461 and parameters: {'kernel_type': 'Matern', 'length_scale': 94873.88590933784, 'noise_level': 0.4694920545443435, 'constant_value': 3915.081804961259, 'nu': 0.5}. Best is trial 386 with value: 0.4872991004520934.
[I 2024-12-04 15:09:08,351] Trial 1391 finished with value: 0.48830336055201645 and parameters: {'kernel_type': 'Matern', 'length_scale': 4410.129506855742, 'noise_level': 0.8295136704604098, 'constant_value': 128.63918613614734, 'nu': 0.5}. Best is trial 386 with value: 0.4872991004520934.
[I 2024-12-04 15:09:09,001] Trial 1398 finished with value: 0.48830341090147983 and parameters: {'kernel_type': 'Matern', 'length_scale': 77187.30580634825, 'noise_level': 0.03832766283921439, 'constant_value': 16198.755173576634, 'nu': 0.5}. Best is trial 386 with value: 0.4872991004520934.
[I 2024-12-04 15:09:09,507] Trial 1403 finished with value: 0.48830342107944663 and parameters: {'kernel_type': 'Matern', 'length_scale': 83006.42241734675, 'noise_level': 0.4071886107304844, 'constant_value': 5537.529263513971, 'nu': 0.5}. Best is trial 386 with value: 0.4872991004520934.
[I 2024-12-04 15:09:09,592] Trial 1400 finished with value: 0.4883034076270157 and parameters: {'kernel_type': 'Matern', 'length_scale': 92112.03749649513, 'noise_level': 0.047478904275628404, 'constant_value': 61543.61259119456, 'nu': 0.5}. Best is trial 386 with value: 0.4872991004520934.
[I 2024-12-04 15:09:10,104] Trial 1394 finished with value: 0.48830347096764715 and parameters: {'kernel_type': 'Matern', 'length_scale': 22303.45698871054, 'noise_level': 0.41886750185887844, 'constant_value': 53775.561314054845, 'nu': 0.5}. Best is trial 386 with value: 0.4872991004520934.
[I 2024-12-04 15:09:12,245] Trial 1402 finished with value: 0.4883034236975002 and parameters: {'kernel_type': 'Matern', 'length_scale': 13327.03512406043, 'noise_level': 0.4321788690359461, 'constant_value': 24871.241117778085, 'nu': 0.5}. Best is trial 386 with value: 0.4872991004520934.
[I 2024-12-04 15:09:13,199] Trial 1401 finished with value: 0.488303417240727 and parameters: {'kernel_type': 'Matern', 'length_scale': 3958.9292977712275, 'noise_level': 0.07232476627659636, 'constant_value': 92311.01536622169, 'nu': 0.5}. Best is trial 386 with value: 0.4872991004520934.
[I 2024-12-04 15:09:13,216] Trial 1404 finished with value: 0.4883034579205953 and parameters: {'kernel_type': 'Matern', 'length_scale': 7014.12689783679, 'noise_level': 0.7719270409544133, 'constant_value': 2386.499992493625, 'nu': 0.5}. Best is trial 386 with value: 0.4872991004520934.
[I 2024-12-04 15:09:13,641] Trial 1384 finished with value: 0.48830338365019504 and parameters: {'kernel_type': 'Matern', 'length_scale': 29032.840211018716, 'noise_level': 0.2593932656976339, 'constant_value': 72152.04973057032, 'nu': 0.5}. Best is trial 386 with value: 0.4872991004520934.
[I 2024-12-04 15:09:13,643] Trial 1399 finished with value: 0.4883034100060743 and parameters: {'kernel_type': 'Matern', 'length_scale': 1991.5938444291191, 'noise_level': 0.11849672591572084, 'constant_value': 56479.44339599899, 'nu': 0.5}. Best is trial 386 with value: 0.4872991004520934.
[I 2024-12-04 15:09:14,741] Trial 1397 finished with value: 1.240111233297698 and parameters: {'kernel_type': 'Matern', 'length_scale': 77045.09916091975, 'noise_level': 0.015452663391939812, 'constant_value': 376.85226512316376, 'nu': 1.5}. Best is trial 386 with value: 0.4872991004520934.
[I 2024-12-04 15:09:15,662] Trial 1411 finished with value: 0.4883034133623308 and parameters: {'kernel_type': 'Matern', 'length_scale': 1519.9259535570266, 'noise_level': 0.004570880891815073, 'constant_value': 89932.36949080632, 'nu': 0.5}. Best is trial 386 with value: 0.4872991004520934.
[I 2024-12-04 15:09:16,265] Trial 1409 finished with value: 1.2401112325703425 and parameters: {'kernel_type': 'Matern', 'length_scale': 9070.89854710489, 'noise_level': 0.03231205567608632, 'constant_value': 20681.338903523716, 'nu': 2.5}. Best is trial 386 with value: 0.4872991004520934.
[I 2024-12-04 15:09:16,911] Trial 1405 finished with value: 0.4883032928177083 and parameters: {'kernel_type': 'Matern', 'length_scale': 18470.26515143853, 'noise_level': 0.7254907061395058, 'constant_value': 1504.3042909359976, 'nu': 0.5}. Best is trial 386 with value: 0.4872991004520934.
[I 2024-12-04 15:09:17,641] Trial 1410 finished with value: 0.48830340447203124 and parameters: {'kernel_type': 'Matern', 'length_scale': 62802.43953095328, 'noise_level': 0.9950184464302652, 'constant_value': 5701.018542105894, 'nu': 0.5}. Best is trial 386 with value: 0.4872991004520934.
[I 2024-12-04 15:09:18,638] Trial 1406 finished with value: 0.4883034146984452 and parameters: {'kernel_type': 'Matern', 'length_scale': 73824.63392401913, 'noise_level': 0.055855481040538425, 'constant_value': 12686.887986550248, 'nu': 0.5}. Best is trial 386 with value: 0.4872991004520934.
[I 2024-12-04 15:09:18,677] Trial 1414 finished with value: 0.4883034120880525 and parameters: {'kernel_type': 'Matern', 'length_scale': 66727.18288253924, 'noise_level': 0.781425574206982, 'constant_value': 963.2357731873152, 'nu': 0.5}. Best is trial 386 with value: 0.4872991004520934.
[I 2024-12-04 15:09:19,640] Trial 1421 finished with value: 0.4883034010096612 and parameters: {'kernel_type': 'Matern', 'length_scale': 16530.88316793329, 'noise_level': 0.01206203406611231, 'constant_value': 94696.09373102832, 'nu': 0.5}. Best is trial 386 with value: 0.4872991004520934.
[I 2024-12-04 15:09:19,747] Trial 1408 finished with value: 1.2401112272406196 and parameters: {'kernel_type': 'Matern', 'length_scale': 3.448658887287611e-05, 'noise_level': 1.356385787547497e-07, 'constant_value': 5.60102947504314e-07, 'nu': 0.5}. Best is trial 386 with value: 0.4872991004520934.
[I 2024-12-04 15:09:20,485] Trial 1413 finished with value: 0.4883034202321018 and parameters: {'kernel_type': 'Matern', 'length_scale': 97032.36585348836, 'noise_level': 0.11781271258159613, 'constant_value': 87488.56361378229, 'nu': 0.5}. Best is trial 386 with value: 0.4872991004520934.
[I 2024-12-04 15:09:21,179] Trial 1425 finished with value: 0.4883034149161688 and parameters: {'kernel_type': 'Matern', 'length_scale': 58497.804247948516, 'noise_level': 0.023583604895942013, 'constant_value': 51811.19330550659, 'nu': 0.5}. Best is trial 386 with value: 0.4872991004520934.
[I 2024-12-04 15:09:21,358] Trial 1423 finished with value: 0.4883034221433567 and parameters: {'kernel_type': 'Matern', 'length_scale': 5299.7097655498665, 'noise_level': 0.48599473900784446, 'constant_value': 98285.87000138029, 'nu': 0.5}. Best is trial 386 with value: 0.4872991004520934.
[I 2024-12-04 15:09:21,387] Trial 1420 finished with value: 0.48830344565479494 and parameters: {'kernel_type': 'Matern', 'length_scale': 5914.649646822636, 'noise_level': 0.41577483573068874, 'constant_value': 88890.12221700377, 'nu': 0.5}. Best is trial 386 with value: 0.4872991004520934.
[I 2024-12-04 15:09:22,767] Trial 1426 finished with value: 0.5663936351139514 and parameters: {'kernel_type': 'Matern', 'length_scale': 182.7249351369425, 'noise_level': 0.28806544180387356, 'constant_value': 0.6774938107879067, 'nu': 2.5}. Best is trial 386 with value: 0.4872991004520934.
[I 2024-12-04 15:09:22,795] Trial 1424 finished with value: 0.4883034311555578 and parameters: {'kernel_type': 'Matern', 'length_scale': 329.490023241388, 'noise_level': 0.05202647921563227, 'constant_value': 2157.9186333026746, 'nu': 0.5}. Best is trial 386 with value: 0.4872991004520934.
[I 2024-12-04 15:09:23,858] Trial 1419 finished with value: 0.4883034313959094 and parameters: {'kernel_type': 'Matern', 'length_scale': 49948.14906434366, 'noise_level': 0.02130527274068514, 'constant_value': 84899.42425144369, 'nu': 0.5}. Best is trial 386 with value: 0.4872991004520934.
[I 2024-12-04 15:09:23,970] Trial 1417 finished with value: 0.5663937344987978 and parameters: {'kernel_type': 'Matern', 'length_scale': 18674.593698632685, 'noise_level': 0.4482468003178947, 'constant_value': 65771.21386226364, 'nu': 2.5}. Best is trial 386 with value: 0.4872991004520934.
[I 2024-12-04 15:09:24,069] Trial 1407 finished with value: 0.48830341670412997 and parameters: {'kernel_type': 'Matern', 'length_scale': 534.6135954532468, 'noise_level': 0.8621609293879385, 'constant_value': 35179.84142829285, 'nu': 0.5}. Best is trial 386 with value: 0.4872991004520934.
[I 2024-12-04 15:09:24,082] Trial 1418 finished with value: 0.48830341864413357 and parameters: {'kernel_type': 'Matern', 'length_scale': 37681.41379737915, 'noise_level': 0.9791364477823546, 'constant_value': 39685.148462473466, 'nu': 0.5}. Best is trial 386 with value: 0.4872991004520934.
[I 2024-12-04 15:09:25,959] Trial 1427 finished with value: 0.4883034130735478 and parameters: {'kernel_type': 'Matern', 'length_scale': 108.0567114889355, 'noise_level': 0.012559231935971658, 'constant_value': 33468.597867874974, 'nu': 0.5}. Best is trial 386 with value: 0.4872991004520934.
[I 2024-12-04 15:09:27,413] Trial 1429 finished with value: 1.2401112316923593 and parameters: {'kernel_type': 'Matern', 'length_scale': 274.7505733163259, 'noise_level': 2.4691966887878893e-09, 'constant_value': 0.20657532808423895, 'nu': 2.5}. Best is trial 386 with value: 0.4872991004520934.
