[I 2024-12-04 15:28:49,027] Trial 2005 finished with value: 0.13435435748943797 and parameters: {'kernel_type': 'Matern', 'length_scale': 7.515752292331718, 'noise_level': 0.0013347870972686966, 'constant_value': 89234.60454668383, 'nu': 1.5}. Best is trial 1985 with value: 0.134351948015208.
[I 2024-12-04 15:28:49,418] Trial 2013 finished with value: 0.13435440674507254 and parameters: {'kernel_type': 'Matern', 'length_scale': 7.459273344679277, 'noise_level': 0.01296165663109129, 'constant_value': 94293.26774185945, 'nu': 1.5}. Best is trial 1985 with value: 0.134351948015208.
[I 2024-12-04 15:28:49,465] Trial 2007 finished with value: 0.14859827054360636 and parameters: {'kernel_type': 'Matern', 'length_scale': 1.87705966407714, 'noise_level': 0.0004218005931975797, 'constant_value': 6481.086492923786, 'nu': 2.5}. Best is trial 1985 with value: 0.134351948015208.
[I 2024-12-04 15:28:52,413] Trial 2011 finished with value: 1.2693635028565453 and parameters: {'kernel_type': 'RBF', 'length_scale': 1.1537509037217014e-05, 'noise_level': 1.9719768904077158e-08, 'constant_value': 26.401179989931304, 'nu': 0.5}. Best is trial 1985 with value: 0.134351948015208.
[I 2024-12-04 15:28:54,609] Trial 2018 finished with value: 0.1343544108869537 and parameters: {'kernel_type': 'Matern', 'length_scale': 264.76110130884257, 'noise_level': 0.00018308357397424832, 'constant_value': 55010.576562267364, 'nu': 1.5}. Best is trial 1985 with value: 0.134351948015208.
[I 2024-12-04 15:28:54,968] Trial 2009 finished with value: 0.1343544016392503 and parameters: {'kernel_type': 'Matern', 'length_scale': 187.3846841050045, 'noise_level': 0.0035190605270559324, 'constant_value': 41071.079744827555, 'nu': 1.5}. Best is trial 1985 with value: 0.134351948015208.
[I 2024-12-04 15:28:56,093] Trial 1991 finished with value: 0.13435439550451897 and parameters: {'kernel_type': 'Matern', 'length_scale': 14.43631084578521, 'noise_level': 0.0004054633960846001, 'constant_value': 63051.01735081492, 'nu': 1.5}. Best is trial 1985 with value: 0.134351948015208.
[I 2024-12-04 15:28:57,603] Trial 2014 finished with value: 0.1343541929870809 and parameters: {'kernel_type': 'Matern', 'length_scale': 1.6741486236541987, 'noise_level': 0.0029382140510150765, 'constant_value': 75462.44432491351, 'nu': 1.5}. Best is trial 1985 with value: 0.134351948015208.
[I 2024-12-04 15:28:58,078] Trial 2008 finished with value: 0.13435440148621539 and parameters: {'kernel_type': 'Matern', 'length_scale': 2135.2522683991497, 'noise_level': 3.825409241998489e-05, 'constant_value': 92324.8775181457, 'nu': 1.5}. Best is trial 1985 with value: 0.134351948015208.
[I 2024-12-04 15:28:58,209] Trial 2012 finished with value: 0.13435440588493922 and parameters: {'kernel_type': 'Matern', 'length_scale': 0.14619436483287065, 'noise_level': 0.002889849281632472, 'constant_value': 76249.16187193169, 'nu': 1.5}. Best is trial 1985 with value: 0.134351948015208.
[I 2024-12-04 15:28:58,549] Trial 2017 finished with value: 0.13435439906825425 and parameters: {'kernel_type': 'Matern', 'length_scale': 318.67188541690194, 'noise_level': 0.0003589897906827679, 'constant_value': 87874.56441246644, 'nu': 1.5}. Best is trial 1985 with value: 0.134351948015208.
[I 2024-12-04 15:28:58,551] Trial 2010 finished with value: 1.2693635028567776 and parameters: {'kernel_type': 'Matern', 'length_scale': 1.3032036368470591e-05, 'noise_level': 0.0036595433382817233, 'constant_value': 2.2074513100983258e-07, 'nu': 2.5}. Best is trial 1985 with value: 0.134351948015208.
[I 2024-12-04 15:28:59,389] Trial 2006 finished with value: 0.134354149362396 and parameters: {'kernel_type': 'Matern', 'length_scale': 6.0584193688533095, 'noise_level': 0.00014589636027636797, 'constant_value': 60684.52540969506, 'nu': 1.5}. Best is trial 1985 with value: 0.134351948015208.
[I 2024-12-04 15:28:59,824] Trial 2015 finished with value: 0.13435435306604507 and parameters: {'kernel_type': 'Matern', 'length_scale': 1.7306071583104, 'noise_level': 0.0017796647052075918, 'constant_value': 7286.529414487148, 'nu': 1.5}. Best is trial 1985 with value: 0.134351948015208.
[I 2024-12-04 15:28:59,889] Trial 2004 finished with value: 1.269363502856995 and parameters: {'kernel_type': 'Matern', 'length_scale': 5456.310465638226, 'noise_level': 8.497928101053147e-07, 'constant_value': 0.0010445419220227003, 'nu': 2.5}. Best is trial 1985 with value: 0.134351948015208.
[I 2024-12-04 15:29:01,030] Trial 2020 finished with value: 0.1343544019882247 and parameters: {'kernel_type': 'Matern', 'length_scale': 10.095175127947655, 'noise_level': 0.006716017301440254, 'constant_value': 98568.74681404927, 'nu': 1.5}. Best is trial 1985 with value: 0.134351948015208.
[I 2024-12-04 15:29:02,505] Trial 2024 finished with value: 1.3007745979712406 and parameters: {'kernel_type': 'RBF', 'length_scale': 3.1748908629480086, 'noise_level': 0.001050489349807905, 'constant_value': 21832.21662720303, 'nu': 1.5}. Best is trial 1985 with value: 0.134351948015208.
[I 2024-12-04 15:29:03,773] Trial 2019 finished with value: 1.3007745979657548 and parameters: {'kernel_type': 'Matern', 'length_scale': 2.3631038729783103, 'noise_level': 0.0008607531263114777, 'constant_value': 4912.515882064987, 'nu': 1.5}. Best is trial 1985 with value: 0.134351948015208.
[I 2024-12-04 15:29:04,943] Trial 2016 finished with value: 1.3007745978084202 and parameters: {'kernel_type': 'RBF', 'length_scale': 12896.630878279475, 'noise_level': 0.02917518286977916, 'constant_value': 0.0005716082896830966, 'nu': 1.5}. Best is trial 1985 with value: 0.134351948015208.
[I 2024-12-04 15:29:05,850] Trial 2028 finished with value: 1.2693635028577828 and parameters: {'kernel_type': 'Matern', 'length_scale': 0.002038465049427153, 'noise_level': 0.00330663755464494, 'constant_value': 1055.123366190047, 'nu': 0.5}. Best is trial 1985 with value: 0.134351948015208.
[I 2024-12-04 15:29:07,324] Trial 2026 finished with value: 0.13435439866844093 and parameters: {'kernel_type': 'Matern', 'length_scale': 1.2437972739875411, 'noise_level': 0.00040033682540246816, 'constant_value': 95699.81817486956, 'nu': 1.5}. Best is trial 1985 with value: 0.134351948015208.
[I 2024-12-04 15:29:10,807] Trial 2022 finished with value: 0.13435440081073832 and parameters: {'kernel_type': 'Matern', 'length_scale': 0.23718874053890004, 'noise_level': 0.011587879664535419, 'constant_value': 91666.13834050564, 'nu': 1.5}. Best is trial 1985 with value: 0.134351948015208.
[I 2024-12-04 15:29:11,632] Trial 2025 finished with value: 0.13435445508733354 and parameters: {'kernel_type': 'Matern', 'length_scale': 0.9306973735508102, 'noise_level': 0.0358975149888129, 'constant_value': 99251.98038612308, 'nu': 1.5}. Best is trial 1985 with value: 0.134351948015208.
[I 2024-12-04 15:29:12,564] Trial 2027 finished with value: 0.13435439405278501 and parameters: {'kernel_type': 'Matern', 'length_scale': 0.20062667567839226, 'noise_level': 0.0437844112633139, 'constant_value': 82115.1260799615, 'nu': 1.5}. Best is trial 1985 with value: 0.134351948015208.
[I 2024-12-04 15:29:12,817] Trial 2032 finished with value: 0.1343544000809772 and parameters: {'kernel_type': 'Matern', 'length_scale': 446.1249780470202, 'noise_level': 0.002582772081273148, 'constant_value': 50280.482334854714, 'nu': 1.5}. Best is trial 1985 with value: 0.134351948015208.
[I 2024-12-04 15:29:15,588] Trial 2030 finished with value: 0.13435391915353656 and parameters: {'kernel_type': 'Matern', 'length_scale': 0.27325833992081655, 'noise_level': 0.02385160871124968, 'constant_value': 2629.213747447848, 'nu': 1.5}. Best is trial 1985 with value: 0.134351948015208.
[I 2024-12-04 15:29:16,247] Trial 2034 finished with value: 0.13435438250146112 and parameters: {'kernel_type': 'Matern', 'length_scale': 8.957763857340746, 'noise_level': 0.004706286797835195, 'constant_value': 3675.898888285292, 'nu': 1.5}. Best is trial 1985 with value: 0.134351948015208.
[I 2024-12-04 15:29:16,739] Trial 2031 finished with value: 0.13435439970822094 and parameters: {'kernel_type': 'Matern', 'length_scale': 1.5800124006504381, 'noise_level': 0.03746826930397573, 'constant_value': 2003.3986625461841, 'nu': 1.5}. Best is trial 1985 with value: 0.134351948015208.
[I 2024-12-04 15:29:17,104] Trial 2038 finished with value: 0.13435399865801992 and parameters: {'kernel_type': 'Matern', 'length_scale': 87.77648173297415, 'noise_level': 0.030197378798945993, 'constant_value': 74963.95744771865, 'nu': 1.5}. Best is trial 1985 with value: 0.134351948015208.
[I 2024-12-04 15:29:17,670] Trial 2023 finished with value: 0.13435446226469216 and parameters: {'kernel_type': 'Matern', 'length_scale': 8.727345894724266, 'noise_level': 0.03335190549401083, 'constant_value': 33832.90640666702, 'nu': 1.5}. Best is trial 1985 with value: 0.134351948015208.
[I 2024-12-04 15:29:17,750] Trial 2029 finished with value: 0.13435420750525487 and parameters: {'kernel_type': 'Matern', 'length_scale': 5.588926046370658, 'noise_level': 0.08646031434737741, 'constant_value': 63993.8326888212, 'nu': 1.5}. Best is trial 1985 with value: 0.134351948015208.
[I 2024-12-04 15:29:20,228] Trial 2021 finished with value: 0.13435419471358118 and parameters: {'kernel_type': 'Matern', 'length_scale': 21.046015126704994, 'noise_level': 0.001285622735706655, 'constant_value': 88923.54152682683, 'nu': 1.5}. Best is trial 1985 with value: 0.134351948015208.
[I 2024-12-04 15:29:28,296] Trial 2033 finished with value: 1.2693635028573018 and parameters: {'kernel_type': 'Matern', 'length_scale': 822.3536514811784, 'noise_level': 1.1824349291685485e-10, 'constant_value': 5.580037741365266e-07, 'nu': 0.5}. Best is trial 1985 with value: 0.134351948015208.
[I 2024-12-04 15:29:28,757] Trial 2036 finished with value: 0.13435441999467593 and parameters: {'kernel_type': 'Matern', 'length_scale': 4.313851476880847, 'noise_level': 0.017679975369123586, 'constant_value': 91542.56177505208, 'nu': 1.5}. Best is trial 1985 with value: 0.134351948015208.
[I 2024-12-04 15:29:29,067] Trial 2044 finished with value: 0.14859812878087883 and parameters: {'kernel_type': 'Matern', 'length_scale': 5.05709825813649, 'noise_level': 0.026880751308783885, 'constant_value': 1797.547612614781, 'nu': 2.5}. Best is trial 1985 with value: 0.134351948015208.
[I 2024-12-04 15:29:31,593] Trial 2042 finished with value: 0.1343544643621878 and parameters: {'kernel_type': 'Matern', 'length_scale': 3.939885311068234, 'noise_level': 0.0006861790482870008, 'constant_value': 77599.55019995886, 'nu': 1.5}. Best is trial 1985 with value: 0.134351948015208.
[I 2024-12-04 15:29:32,069] Trial 2046 finished with value: 1.2693635028568362 and parameters: {'kernel_type': 'Matern', 'length_scale': 0.026450087205564413, 'noise_level': 0.1225051294806587, 'constant_value': 91.55842995909155, 'nu': 1.5}. Best is trial 1985 with value: 0.134351948015208.
[I 2024-12-04 15:29:36,015] Trial 2041 finished with value: 1.2693635028570207 and parameters: {'kernel_type': 'Matern', 'length_scale': 0.039501829438518, 'noise_level': 0.0801295799378072, 'constant_value': 477.7846892629064, 'nu': 1.5}. Best is trial 1985 with value: 0.134351948015208.
[I 2024-12-04 15:29:36,026] Trial 2043 finished with value: 1.3007745979657548 and parameters: {'kernel_type': 'Matern', 'length_scale': 29.716215647792758, 'noise_level': 8.192862946890917e-06, 'constant_value': 88035.70208207628, 'nu': 1.5}. Best is trial 1985 with value: 0.134351948015208.
[I 2024-12-04 15:29:36,034] Trial 2035 finished with value: 1.2693635028569576 and parameters: {'kernel_type': 'Matern', 'length_scale': 5693.992154204402, 'noise_level': 3.0561937628759406e-06, 'constant_value': 17899.284137790193, 'nu': 2.5}. Best is trial 1985 with value: 0.134351948015208.
[I 2024-12-04 15:29:36,944] Trial 2047 finished with value: 1.2693635028566608 and parameters: {'kernel_type': 'Matern', 'length_scale': 0.026046200203351553, 'noise_level': 0.004321608594230509, 'constant_value': 2238.6774045004618, 'nu': 1.5}. Best is trial 1985 with value: 0.134351948015208.
[I 2024-12-04 15:29:37,653] Trial 2050 finished with value: 1.2693635028542563 and parameters: {'kernel_type': 'Matern', 'length_scale': 0.026735315149695852, 'noise_level': 0.16447168832236292, 'constant_value': 26344.863060895845, 'nu': 1.5}. Best is trial 1985 with value: 0.134351948015208.
[I 2024-12-04 15:29:38,100] Trial 2037 finished with value: 0.13435467097027143 and parameters: {'kernel_type': 'Matern', 'length_scale': 88.5482231693957, 'noise_level': 0.014997060606993694, 'constant_value': 32512.830582151328, 'nu': 1.5}. Best is trial 1985 with value: 0.134351948015208.
[I 2024-12-04 15:29:38,101] Trial 2051 finished with value: 1.269363502856907 and parameters: {'kernel_type': 'Matern', 'length_scale': 0.008406951680186209, 'noise_level': 0.017859748132871736, 'constant_value': 40263.423135745084, 'nu': 1.5}. Best is trial 1985 with value: 0.134351948015208.
[I 2024-12-04 15:29:38,270] Trial 2040 finished with value: 0.13435439360739349 and parameters: {'kernel_type': 'Matern', 'length_scale': 47.874302617656326, 'noise_level': 0.005480275273924425, 'constant_value': 73366.15975482961, 'nu': 1.5}. Best is trial 1985 with value: 0.134351948015208.
[I 2024-12-04 15:29:38,301] Trial 2055 finished with value: 1.26936350285763 and parameters: {'kernel_type': 'Matern', 'length_scale': 0.0008652777039268721, 'noise_level': 0.0031817998514911644, 'constant_value': 59546.259240800406, 'nu': 1.5}. Best is trial 1985 with value: 0.134351948015208.
[I 2024-12-04 15:29:39,520] Trial 2039 finished with value: 0.13435442242189802 and parameters: {'kernel_type': 'Matern', 'length_scale': 34.57627210824542, 'noise_level': 0.0034417581825204858, 'constant_value': 89113.74569269078, 'nu': 1.5}. Best is trial 1985 with value: 0.134351948015208.
[I 2024-12-04 15:29:40,353] Trial 2053 finished with value: 1.2693635028569568 and parameters: {'kernel_type': 'Matern', 'length_scale': 0.033626196924143655, 'noise_level': 0.24831126790311417, 'constant_value': 130.37252554888204, 'nu': 1.5}. Best is trial 1985 with value: 0.134351948015208.
[I 2024-12-04 15:29:41,973] Trial 2052 finished with value: 1.2693634849070459 and parameters: {'kernel_type': 'Matern', 'length_scale': 0.0839950963418418, 'noise_level': 0.027091625675047512, 'constant_value': 11909.041311431303, 'nu': 1.5}. Best is trial 1985 with value: 0.134351948015208.
[I 2024-12-04 15:29:43,518] Trial 2048 finished with value: 1.2693635028569994 and parameters: {'kernel_type': 'Matern', 'length_scale': 0.001069007845918982, 'noise_level': 0.006508286226505841, 'constant_value': 610.3808131919016, 'nu': 1.5}. Best is trial 1985 with value: 0.134351948015208.
[I 2024-12-04 15:29:43,987] Trial 2054 finished with value: 1.2693635028569914 and parameters: {'kernel_type': 'Matern', 'length_scale': 0.022348135275400693, 'noise_level': 0.026635756295480928, 'constant_value': 10459.725488552938, 'nu': 0.5}. Best is trial 1985 with value: 0.134351948015208.
[I 2024-12-04 15:29:46,486] Trial 2049 finished with value: 0.13435439839305424 and parameters: {'kernel_type': 'Matern', 'length_scale': 0.2072123263677908, 'noise_level': 0.07723015786971718, 'constant_value': 798.4432869886907, 'nu': 1.5}. Best is trial 1985 with value: 0.134351948015208.
[I 2024-12-04 15:29:47,383] Trial 2045 finished with value: 1.2693635028569723 and parameters: {'kernel_type': 'RBF', 'length_scale': 38820.529063539, 'noise_level': 1.4810883328883712e-05, 'constant_value': 1.7130321652174365e-05, 'nu': 0.5}. Best is trial 1985 with value: 0.134351948015208.
[I 2024-12-04 15:29:48,329] Trial 2061 finished with value: 1.2693635028577288 and parameters: {'kernel_type': 'Matern', 'length_scale': 0.005926376315342163, 'noise_level': 3.277027117602105e-05, 'constant_value': 7249.430083335091, 'nu': 1.5}. Best is trial 1985 with value: 0.134351948015208.
[I 2024-12-04 15:29:51,061] Trial 2064 finished with value: 1.2693632589570365 and parameters: {'kernel_type': 'Matern', 'length_scale': 0.09687770958503097, 'noise_level': 0.00069792390613582, 'constant_value': 5321.3163058801465, 'nu': 1.5}. Best is trial 1985 with value: 0.134351948015208.
[I 2024-12-04 15:29:52,163] Trial 2057 finished with value: 0.17251040780062513 and parameters: {'kernel_type': 'Matern', 'length_scale': 21.69813547304857, 'noise_level': 0.0013674259212244973, 'constant_value': 98611.02982923228, 'nu': 0.5}. Best is trial 1985 with value: 0.134351948015208.
[I 2024-12-04 15:29:53,340] Trial 2056 finished with value: 0.15123559910514214 and parameters: {'kernel_type': 'Matern', 'length_scale': 0.20651354849889042, 'noise_level': 0.08263770622785926, 'constant_value': 66.09144714547907, 'nu': 1.5}. Best is trial 1985 with value: 0.134351948015208.
[I 2024-12-04 15:29:53,645] Trial 2068 finished with value: 1.2693635028569639 and parameters: {'kernel_type': 'Matern', 'length_scale': 0.02877624924087963, 'noise_level': 0.039614857380266294, 'constant_value': 2566.8805676667644, 'nu': 1.5}. Best is trial 1985 with value: 0.134351948015208.
[I 2024-12-04 15:29:54,159] Trial 2065 finished with value: 0.13435439902959145 and parameters: {'kernel_type': 'Matern', 'length_scale': 0.1355389538982647, 'noise_level': 0.007732515755246432, 'constant_value': 436.16803351476807, 'nu': 1.5}. Best is trial 1985 with value: 0.134351948015208.
[I 2024-12-04 15:29:54,642] Trial 2067 finished with value: 1.2693631875067197 and parameters: {'kernel_type': 'Matern', 'length_scale': 0.09837611823345217, 'noise_level': 0.01738021050279893, 'constant_value': 153.89314580907086, 'nu': 1.5}. Best is trial 1985 with value: 0.134351948015208.
[I 2024-12-04 15:29:55,499] Trial 2058 finished with value: 0.14859828451462018 and parameters: {'kernel_type': 'Matern', 'length_scale': 3.701365944321251, 'noise_level': 0.03204708905639407, 'constant_value': 83863.13679315812, 'nu': 2.5}. Best is trial 1985 with value: 0.134351948015208.
[I 2024-12-04 15:29:57,117] Trial 2060 finished with value: 0.13435439824320772 and parameters: {'kernel_type': 'Matern', 'length_scale': 0.3597009213645019, 'noise_level': 0.014122640663785987, 'constant_value': 3420.3014203441026, 'nu': 1.5}. Best is trial 1985 with value: 0.134351948015208.
[I 2024-12-04 15:29:57,384] Trial 2059 finished with value: 0.13435445006281227 and parameters: {'kernel_type': 'Matern', 'length_scale': 0.7135009619070704, 'noise_level': 0.956329267109293, 'constant_value': 2281.8643119784306, 'nu': 1.5}. Best is trial 1985 with value: 0.134351948015208.
[I 2024-12-04 15:29:59,829] Trial 2080 finished with value: 1.3007739235935083 and parameters: {'kernel_type': 'RBF', 'length_scale': 1.3892403327067315e-05, 'noise_level': 9.385283013818394e-08, 'constant_value': 2560.711696510843, 'nu': 2.5}. Best is trial 1985 with value: 0.134351948015208.
[I 2024-12-04 15:29:59,852] Trial 2069 finished with value: 0.13435434629857856 and parameters: {'kernel_type': 'Matern', 'length_scale': 23.025213794980914, 'noise_level': 0.023703249074692862, 'constant_value': 76080.28062733015, 'nu': 1.5}. Best is trial 1985 with value: 0.134351948015208.
[I 2024-12-04 15:30:00,882] Trial 2072 finished with value: 0.13435440388429426 and parameters: {'kernel_type': 'Matern', 'length_scale': 0.3675837715753244, 'noise_level': 0.011252019680490204, 'constant_value': 1531.766276597421, 'nu': 1.5}. Best is trial 1985 with value: 0.134351948015208.
[I 2024-12-04 15:30:06,864] Trial 2074 finished with value: 0.13435439533278826 and parameters: {'kernel_type': 'Matern', 'length_scale': 0.28590252102667146, 'noise_level': 0.048581062574492705, 'constant_value': 17653.52879216862, 'nu': 1.5}. Best is trial 1985 with value: 0.134351948015208.
[I 2024-12-04 15:30:07,174] Trial 2079 finished with value: 0.13435450334558766 and parameters: {'kernel_type': 'Matern', 'length_scale': 227.10737426771817, 'noise_level': 0.007361997009144729, 'constant_value': 76247.61221166584, 'nu': 1.5}. Best is trial 1985 with value: 0.134351948015208.
[I 2024-12-04 15:30:09,094] Trial 2062 finished with value: 0.1343544389232288 and parameters: {'kernel_type': 'Matern', 'length_scale': 0.14555549217575187, 'noise_level': 0.00044467485567722124, 'constant_value': 1088.3386825160992, 'nu': 1.5}. Best is trial 1985 with value: 0.134351948015208.
[I 2024-12-04 15:30:09,688] Trial 2073 finished with value: 0.1343544022474844 and parameters: {'kernel_type': 'Matern', 'length_scale': 3.6707886848502462, 'noise_level': 0.00976863094599853, 'constant_value': 1601.3839103291286, 'nu': 1.5}. Best is trial 1985 with value: 0.134351948015208.
[I 2024-12-04 15:30:11,026] Trial 2071 finished with value: 0.13435442244029858 and parameters: {'kernel_type': 'Matern', 'length_scale': 0.2195777435255239, 'noise_level': 0.007783204692249883, 'constant_value': 3925.393910970254, 'nu': 1.5}. Best is trial 1985 with value: 0.134351948015208.
[I 2024-12-04 15:30:11,732] Trial 2085 finished with value: 0.15167301417438114 and parameters: {'kernel_type': 'RBF', 'length_scale': 0.7940908171583585, 'noise_level': 0.014700835592968598, 'constant_value': 1036.2277217515907, 'nu': 1.5}. Best is trial 1985 with value: 0.134351948015208.
[I 2024-12-04 15:30:12,330] Trial 2075 finished with value: 0.1343544035696757 and parameters: {'kernel_type': 'Matern', 'length_scale': 2.594538322886668, 'noise_level': 0.0015843976284078227, 'constant_value': 3376.5699757159914, 'nu': 1.5}. Best is trial 1985 with value: 0.134351948015208.
[I 2024-12-04 15:30:12,331] Trial 2063 finished with value: 0.13435458871256176 and parameters: {'kernel_type': 'Matern', 'length_scale': 0.3380083974514616, 'noise_level': 0.0006873478230192969, 'constant_value': 1263.6715224058155, 'nu': 1.5}. Best is trial 1985 with value: 0.134351948015208.
