[I 2024-12-04 15:06:07,873] Trial 1120 finished with value: 1.2401112352679982 and parameters: {'kernel_type': 'Matern', 'length_scale': 12510.623686560064, 'noise_level': 0.014626533168761231, 'constant_value': 7.144449169134193, 'nu': 0.5}. Best is trial 386 with value: 0.4872991004520934.
[I 2024-12-04 15:06:08,928] Trial 1129 finished with value: 0.48830351779239567 and parameters: {'kernel_type': 'Matern', 'length_scale': 16009.996323408177, 'noise_level': 0.0016140930912790777, 'constant_value': 277.4120005341322, 'nu': 0.5}. Best is trial 386 with value: 0.4872991004520934.
[I 2024-12-04 15:06:08,930] Trial 1118 finished with value: 0.48830342313985203 and parameters: {'kernel_type': 'Matern', 'length_scale': 38357.554291628716, 'noise_level': 0.11586250209908269, 'constant_value': 1.4289483097468663, 'nu': 0.5}. Best is trial 386 with value: 0.4872991004520934.
[I 2024-12-04 15:06:10,208] Trial 1128 finished with value: 0.4883034102274991 and parameters: {'kernel_type': 'Matern', 'length_scale': 4155.817337948718, 'noise_level': 0.019803808954251597, 'constant_value': 183.64752047284372, 'nu': 0.5}. Best is trial 386 with value: 0.4872991004520934.
[I 2024-12-04 15:06:10,915] Trial 1133 finished with value: 0.4883035356451857 and parameters: {'kernel_type': 'Matern', 'length_scale': 97509.83846092293, 'noise_level': 0.16547003219731124, 'constant_value': 7.17382662712092, 'nu': 0.5}. Best is trial 386 with value: 0.4872991004520934.
[I 2024-12-04 15:06:11,117] Trial 1137 finished with value: 0.4883034233694838 and parameters: {'kernel_type': 'Matern', 'length_scale': 53658.516683781425, 'noise_level': 0.05353119807925314, 'constant_value': 334.69440877273365, 'nu': 0.5}. Best is trial 386 with value: 0.4872991004520934.
[I 2024-12-04 15:06:12,029] Trial 1124 finished with value: 1.2614547976352462 and parameters: {'kernel_type': 'Matern', 'length_scale': 87481.66084696878, 'noise_level': 0.0013849827631760097, 'constant_value': 0.0074907767045874415, 'nu': 1.5}. Best is trial 386 with value: 0.4872991004520934.
[I 2024-12-04 15:06:12,199] Trial 1130 finished with value: 0.5663936634222652 and parameters: {'kernel_type': 'Matern', 'length_scale': 45867.294257036556, 'noise_level': 0.08583850447600072, 'constant_value': 6045.437992931447, 'nu': 2.5}. Best is trial 386 with value: 0.4872991004520934.
[I 2024-12-04 15:06:12,899] Trial 1135 finished with value: 1.261454797635203 and parameters: {'kernel_type': 'Matern', 'length_scale': 28012.966780312243, 'noise_level': 0.8047195980253221, 'constant_value': 2.178442462241482, 'nu': 1.5}. Best is trial 386 with value: 0.4872991004520934.
[I 2024-12-04 15:06:13,362] Trial 1136 finished with value: 0.4883034097061534 and parameters: {'kernel_type': 'Matern', 'length_scale': 61121.21991999921, 'noise_level': 0.0019511021783273842, 'constant_value': 5970.352372774295, 'nu': 0.5}. Best is trial 386 with value: 0.4872991004520934.
[I 2024-12-04 15:06:13,431] Trial 1125 finished with value: 0.48830341895727575 and parameters: {'kernel_type': 'Matern', 'length_scale': 91348.48793267537, 'noise_level': 0.035195054100962596, 'constant_value': 335.3187546518156, 'nu': 0.5}. Best is trial 386 with value: 0.4872991004520934.
[I 2024-12-04 15:06:13,764] Trial 1132 finished with value: 0.4883023410633049 and parameters: {'kernel_type': 'Matern', 'length_scale': 84273.1626947472, 'noise_level': 0.10265463858543457, 'constant_value': 145.07060993020252, 'nu': 0.5}. Best is trial 386 with value: 0.4872991004520934.
[I 2024-12-04 15:06:14,638] Trial 1139 finished with value: 0.5725529341396433 and parameters: {'kernel_type': 'RBF', 'length_scale': 509.005106791868, 'noise_level': 0.5772513917591401, 'constant_value': 44873.205860261136, 'nu': 0.5}. Best is trial 386 with value: 0.4872991004520934.
[I 2024-12-04 15:06:14,862] Trial 1143 finished with value: 0.4883034487367348 and parameters: {'kernel_type': 'Matern', 'length_scale': 512.1130092199558, 'noise_level': 0.8619010456938877, 'constant_value': 673.7779912779257, 'nu': 0.5}. Best is trial 386 with value: 0.4872991004520934.
[I 2024-12-04 15:06:16,072] Trial 1138 finished with value: 0.48830340782972254 and parameters: {'kernel_type': 'Matern', 'length_scale': 27592.616201130408, 'noise_level': 0.016987064784050272, 'constant_value': 408.62183922530545, 'nu': 0.5}. Best is trial 386 with value: 0.4872991004520934.
[I 2024-12-04 15:06:16,336] Trial 1134 finished with value: 0.48830340583308535 and parameters: {'kernel_type': 'Matern', 'length_scale': 65733.42387115567, 'noise_level': 0.04634229337094746, 'constant_value': 111.48647438319468, 'nu': 0.5}. Best is trial 386 with value: 0.4872991004520934.
[I 2024-12-04 15:06:16,906] Trial 1142 finished with value: 0.48830341950135653 and parameters: {'kernel_type': 'Matern', 'length_scale': 2377.838573464961, 'noise_level': 0.014556102134981631, 'constant_value': 1962.3245989038585, 'nu': 0.5}. Best is trial 386 with value: 0.4872991004520934.
[I 2024-12-04 15:06:17,588] Trial 1148 finished with value: 0.48830341867634713 and parameters: {'kernel_type': 'Matern', 'length_scale': 49168.32060926991, 'noise_level': 0.9104388323426406, 'constant_value': 676.2494073593398, 'nu': 0.5}. Best is trial 386 with value: 0.4872991004520934.
[I 2024-12-04 15:06:17,873] Trial 1140 finished with value: 1.2401112325789334 and parameters: {'kernel_type': 'Matern', 'length_scale': 71009.12152723206, 'noise_level': 0.013914975831212881, 'constant_value': 79.57182923466524, 'nu': 0.5}. Best is trial 386 with value: 0.4872991004520934.
[I 2024-12-04 15:06:17,971] Trial 1146 finished with value: 0.48830341574447006 and parameters: {'kernel_type': 'Matern', 'length_scale': 81458.0636513357, 'noise_level': 0.017464146928237053, 'constant_value': 27415.636162892093, 'nu': 0.5}. Best is trial 386 with value: 0.4872991004520934.
[I 2024-12-04 15:06:19,160] Trial 1152 finished with value: 1.2401112324449213 and parameters: {'kernel_type': 'RBF', 'length_scale': 1184.1585448601584, 'noise_level': 0.004194177661670301, 'constant_value': 2.542826445620101, 'nu': 0.5}. Best is trial 386 with value: 0.4872991004520934.
[I 2024-12-04 15:06:20,584] Trial 1145 finished with value: 1.2401112322255696 and parameters: {'kernel_type': 'Matern', 'length_scale': 36424.973423972864, 'noise_level': 0.015741637490301684, 'constant_value': 100.45436054445703, 'nu': 0.5}. Best is trial 386 with value: 0.4872991004520934.
[I 2024-12-04 15:06:20,586] Trial 1144 finished with value: 0.48830343173590146 and parameters: {'kernel_type': 'Matern', 'length_scale': 5663.96168325161, 'noise_level': 0.0031996824670913137, 'constant_value': 164.26646196046133, 'nu': 0.5}. Best is trial 386 with value: 0.4872991004520934.
[I 2024-12-04 15:06:23,272] Trial 1151 finished with value: 0.48830343575765095 and parameters: {'kernel_type': 'Matern', 'length_scale': 4404.799560090699, 'noise_level': 0.2702100376871236, 'constant_value': 0.42296847081947514, 'nu': 0.5}. Best is trial 386 with value: 0.4872991004520934.
[I 2024-12-04 15:06:23,302] Trial 1154 finished with value: 0.4883030828767337 and parameters: {'kernel_type': 'Matern', 'length_scale': 61556.058157184576, 'noise_level': 0.10179851952500278, 'constant_value': 227.28804040743125, 'nu': 0.5}. Best is trial 386 with value: 0.4872991004520934.
[I 2024-12-04 15:06:24,463] Trial 1155 finished with value: 0.4883034119304932 and parameters: {'kernel_type': 'Matern', 'length_scale': 21073.77515579325, 'noise_level': 0.05157511393372599, 'constant_value': 561.5269704144946, 'nu': 0.5}. Best is trial 386 with value: 0.4872991004520934.
[I 2024-12-04 15:06:24,954] Trial 1141 finished with value: 1.2416661782759901 and parameters: {'kernel_type': 'Matern', 'length_scale': 29309.493820714197, 'noise_level': 0.010854816706421033, 'constant_value': 19.68574244610404, 'nu': 0.5}. Best is trial 386 with value: 0.4872991004520934.
[I 2024-12-04 15:06:26,694] Trial 1150 finished with value: 0.48830341444041164 and parameters: {'kernel_type': 'Matern', 'length_scale': 97858.53007722054, 'noise_level': 0.9701955698019145, 'constant_value': 63.05677491646311, 'nu': 0.5}. Best is trial 386 with value: 0.4872991004520934.
[I 2024-12-04 15:06:26,709] Trial 1147 finished with value: 1.259413638760075 and parameters: {'kernel_type': 'Matern', 'length_scale': 81160.53675465586, 'noise_level': 0.9393348309981444, 'constant_value': 1.4874833618672718, 'nu': 0.5}. Best is trial 386 with value: 0.4872991004520934.
[I 2024-12-04 15:06:26,950] Trial 1160 finished with value: 0.4883033979636219 and parameters: {'kernel_type': 'Matern', 'length_scale': 96641.67305191894, 'noise_level': 0.35306915372350184, 'constant_value': 2826.065414807634, 'nu': 0.5}. Best is trial 386 with value: 0.4872991004520934.
[I 2024-12-04 15:06:27,078] Trial 1164 finished with value: 0.48830330246139353 and parameters: {'kernel_type': 'Matern', 'length_scale': 2640.8373641537974, 'noise_level': 0.008740853522722978, 'constant_value': 471.8511728217392, 'nu': 0.5}. Best is trial 386 with value: 0.4872991004520934.
[I 2024-12-04 15:06:27,421] Trial 1157 finished with value: 0.48830346613973397 and parameters: {'kernel_type': 'Matern', 'length_scale': 70856.66631528265, 'noise_level': 0.005861407333665952, 'constant_value': 6982.278500265136, 'nu': 0.5}. Best is trial 386 with value: 0.4872991004520934.
[I 2024-12-04 15:06:28,570] Trial 1153 finished with value: 0.5273055929645836 and parameters: {'kernel_type': 'Matern', 'length_scale': 0.9946070441290306, 'noise_level': 6.864864248692145e-10, 'constant_value': 1.6704529058005639e-07, 'nu': 1.5}. Best is trial 386 with value: 0.4872991004520934.
[I 2024-12-04 15:06:30,275] Trial 1156 finished with value: 1.261454797635247 and parameters: {'kernel_type': 'RBF', 'length_scale': 52314.69810925253, 'noise_level': 0.7643834709747606, 'constant_value': 2.1007422960270083e-05, 'nu': 1.5}. Best is trial 386 with value: 0.4872991004520934.
[I 2024-12-04 15:06:31,645] Trial 1162 finished with value: 1.2401112325725043 and parameters: {'kernel_type': 'Matern', 'length_scale': 80751.51002841596, 'noise_level': 0.00010026882491765393, 'constant_value': 43.37085988517723, 'nu': 0.5}. Best is trial 386 with value: 0.4872991004520934.
[I 2024-12-04 15:06:31,649] Trial 1161 finished with value: 0.4883034146127623 and parameters: {'kernel_type': 'Matern', 'length_scale': 56661.75404815895, 'noise_level': 0.3545384849757012, 'constant_value': 10.195777313302186, 'nu': 0.5}. Best is trial 386 with value: 0.4872991004520934.
[I 2024-12-04 15:06:32,158] Trial 1166 finished with value: 1.240111232598192 and parameters: {'kernel_type': 'Matern', 'length_scale': 95624.45946896325, 'noise_level': 0.005264802393656571, 'constant_value': 640.61496714285, 'nu': 0.5}. Best is trial 386 with value: 0.4872991004520934.
[I 2024-12-04 15:06:34,162] Trial 1167 finished with value: 1.2401112337156488 and parameters: {'kernel_type': 'Matern', 'length_scale': 93118.9107499686, 'noise_level': 0.009430412506205563, 'constant_value': 57.99230834132833, 'nu': 0.5}. Best is trial 386 with value: 0.4872991004520934.
[I 2024-12-04 15:06:34,477] Trial 1159 finished with value: 1.2401112334611948 and parameters: {'kernel_type': 'RBF', 'length_scale': 9701.289388823174, 'noise_level': 0.00014989731179601535, 'constant_value': 202.95693406350244, 'nu': 1.5}. Best is trial 386 with value: 0.4872991004520934.
[I 2024-12-04 15:06:35,451] Trial 1169 finished with value: 0.4883034155733352 and parameters: {'kernel_type': 'Matern', 'length_scale': 79426.26010144432, 'noise_level': 0.008616877768637999, 'constant_value': 3451.741941509197, 'nu': 0.5}. Best is trial 386 with value: 0.4872991004520934.
[I 2024-12-04 15:06:35,874] Trial 1149 finished with value: 0.4883035562090759 and parameters: {'kernel_type': 'Matern', 'length_scale': 66200.83277320761, 'noise_level': 0.4093652291590101, 'constant_value': 2.133605659216517, 'nu': 0.5}. Best is trial 386 with value: 0.4872991004520934.
[I 2024-12-04 15:06:36,575] Trial 1163 finished with value: 1.2401112325837487 and parameters: {'kernel_type': 'Matern', 'length_scale': 28384.453756396353, 'noise_level': 0.00524163033663458, 'constant_value': 1.4271372407279053, 'nu': 0.5}. Best is trial 386 with value: 0.4872991004520934.
[I 2024-12-04 15:06:37,736] Trial 1165 finished with value: 1.2401112328447539 and parameters: {'kernel_type': 'Matern', 'length_scale': 4221.641564845192, 'noise_level': 0.0036087263943338412, 'constant_value': 40.81551947993473, 'nu': 0.5}. Best is trial 386 with value: 0.4872991004520934.
[I 2024-12-04 15:06:38,529] Trial 1172 finished with value: 1.2614543702027643 and parameters: {'kernel_type': 'RBF', 'length_scale': 0.0055011880938274915, 'noise_level': 3.351240663343326e-08, 'constant_value': 1.7957298793388983, 'nu': 1.5}. Best is trial 386 with value: 0.4872991004520934.
[I 2024-12-04 15:06:40,666] Trial 1178 finished with value: 1.2401112324483994 and parameters: {'kernel_type': 'Matern', 'length_scale': 20406.56950612165, 'noise_level': 0.03818187322723267, 'constant_value': 16.796083854923445, 'nu': 0.5}. Best is trial 386 with value: 0.4872991004520934.
[I 2024-12-04 15:06:40,817] Trial 1177 finished with value: 0.4883033707662962 and parameters: {'kernel_type': 'Matern', 'length_scale': 59141.34336713469, 'noise_level': 0.053921471169543364, 'constant_value': 157.51159981574634, 'nu': 0.5}. Best is trial 386 with value: 0.4872991004520934.
[I 2024-12-04 15:06:41,642] Trial 1174 finished with value: 0.488303414774304 and parameters: {'kernel_type': 'Matern', 'length_scale': 89783.42278468354, 'noise_level': 0.016073798875370998, 'constant_value': 5415.6716531077245, 'nu': 0.5}. Best is trial 386 with value: 0.4872991004520934.
[I 2024-12-04 15:06:41,656] Trial 1170 finished with value: 0.48830342878710803 and parameters: {'kernel_type': 'Matern', 'length_scale': 28830.333960038013, 'noise_level': 0.12009038558290255, 'constant_value': 8.58034612570756, 'nu': 0.5}. Best is trial 386 with value: 0.4872991004520934.
[I 2024-12-04 15:06:42,503] Trial 1179 finished with value: 1.2401112329817334 and parameters: {'kernel_type': 'Matern', 'length_scale': 0.023031994590751937, 'noise_level': 1.13028749502724e-06, 'constant_value': 0.00021418903597501056, 'nu': 2.5}. Best is trial 386 with value: 0.4872991004520934.
[I 2024-12-04 15:06:42,903] Trial 1175 finished with value: 1.2401112327900556 and parameters: {'kernel_type': 'RBF', 'length_scale': 1.8564419754599027e-05, 'noise_level': 2.0475958551554864e-06, 'constant_value': 0.032529920010941654, 'nu': 1.5}. Best is trial 386 with value: 0.4872991004520934.
[I 2024-12-04 15:06:44,426] Trial 1171 finished with value: 1.2401112326546633 and parameters: {'kernel_type': 'Matern', 'length_scale': 82855.12980594559, 'noise_level': 0.004863331155639203, 'constant_value': 5.4049398808816385, 'nu': 0.5}. Best is trial 386 with value: 0.4872991004520934.
[I 2024-12-04 15:06:44,565] Trial 1176 finished with value: 0.4883034184146162 and parameters: {'kernel_type': 'Matern', 'length_scale': 93372.3286199905, 'noise_level': 0.013789140786715684, 'constant_value': 1098.7691126608436, 'nu': 0.5}. Best is trial 386 with value: 0.4872991004520934.
[I 2024-12-04 15:06:44,664] Trial 1173 finished with value: 0.4883034345550993 and parameters: {'kernel_type': 'Matern', 'length_scale': 0.26808432831197765, 'noise_level': 5.393212033263465e-09, 'constant_value': 2.8981311715402924e-07, 'nu': 0.5}. Best is trial 386 with value: 0.4872991004520934.
[I 2024-12-04 15:06:45,426] Trial 1185 finished with value: 0.5273039399004823 and parameters: {'kernel_type': 'Matern', 'length_scale': 0.29249045593196726, 'noise_level': 0.01281285260776905, 'constant_value': 1.0644291124612686, 'nu': 1.5}. Best is trial 386 with value: 0.4872991004520934.
[I 2024-12-04 15:06:45,438] Trial 1158 finished with value: 0.5663936539386436 and parameters: {'kernel_type': 'Matern', 'length_scale': 48619.78572662205, 'noise_level': 0.6879603186383321, 'constant_value': 1585.6308687876126, 'nu': 2.5}. Best is trial 386 with value: 0.4872991004520934.
[I 2024-12-04 15:06:46,518] Trial 1168 finished with value: 0.4883034180326406 and parameters: {'kernel_type': 'Matern', 'length_scale': 94631.88817486627, 'noise_level': 0.27665893697277566, 'constant_value': 23749.447630124792, 'nu': 0.5}. Best is trial 386 with value: 0.4872991004520934.
[I 2024-12-04 15:06:47,745] Trial 1180 finished with value: 0.4883034178092215 and parameters: {'kernel_type': 'Matern', 'length_scale': 34122.93038947215, 'noise_level': 0.09583700184672005, 'constant_value': 61.661861811870835, 'nu': 0.5}. Best is trial 386 with value: 0.4872991004520934.
[I 2024-12-04 15:06:48,791] Trial 1186 finished with value: 0.48830334534076286 and parameters: {'kernel_type': 'Matern', 'length_scale': 4322.94833335146, 'noise_level': 0.036795971969210015, 'constant_value': 6046.198778526875, 'nu': 0.5}. Best is trial 386 with value: 0.4872991004520934.
[I 2024-12-04 15:06:49,342] Trial 1182 finished with value: 0.4883035323682383 and parameters: {'kernel_type': 'Matern', 'length_scale': 15427.445031189338, 'noise_level': 0.06502898102649694, 'constant_value': 781.4448275465771, 'nu': 0.5}. Best is trial 386 with value: 0.4872991004520934.
[I 2024-12-04 15:06:49,508] Trial 1181 finished with value: 1.240111232582541 and parameters: {'kernel_type': 'Matern', 'length_scale': 41323.9669622357, 'noise_level': 1.1146921629409674e-10, 'constant_value': 0.0016071716463104966, 'nu': 2.5}. Best is trial 386 with value: 0.4872991004520934.
[I 2024-12-04 15:06:50,607] Trial 1189 finished with value: 1.2401112326663695 and parameters: {'kernel_type': 'RBF', 'length_scale': 5197.334992533313, 'noise_level': 3.182424240469029e-08, 'constant_value': 9.876401090958913e-06, 'nu': 0.5}. Best is trial 386 with value: 0.4872991004520934.
[I 2024-12-04 15:06:51,286] Trial 1188 finished with value: 0.4883034165573097 and parameters: {'kernel_type': 'Matern', 'length_scale': 90815.59506996121, 'noise_level': 0.5239614866540646, 'constant_value': 5868.196263774454, 'nu': 0.5}. Best is trial 386 with value: 0.4872991004520934.
[I 2024-12-04 15:06:52,105] Trial 1187 finished with value: 0.48830366674352055 and parameters: {'kernel_type': 'Matern', 'length_scale': 62654.77699389324, 'noise_level': 0.02578104287142158, 'constant_value': 1782.6178684688102, 'nu': 0.5}. Best is trial 386 with value: 0.4872991004520934.
[I 2024-12-04 15:06:53,646] Trial 1197 finished with value: 0.4926188628727449 and parameters: {'kernel_type': 'Matern', 'length_scale': 6.339255895655187, 'noise_level': 0.1492045668725929, 'constant_value': 0.007523105926490187, 'nu': 0.5}. Best is trial 386 with value: 0.4872991004520934.
[I 2024-12-04 15:06:53,791] Trial 1184 finished with value: 1.2401112328732065 and parameters: {'kernel_type': 'Matern', 'length_scale': 11022.949561364696, 'noise_level': 0.0008105054813774959, 'constant_value': 7.898447249691292, 'nu': 2.5}. Best is trial 386 with value: 0.4872991004520934.
[I 2024-12-04 15:06:54,836] Trial 1196 finished with value: 1.240111232654433 and parameters: {'kernel_type': 'Matern', 'length_scale': 2630.5701619270167, 'noise_level': 0.00020148111487994493, 'constant_value': 0.0852494411219608, 'nu': 0.5}. Best is trial 386 with value: 0.4872991004520934.
[I 2024-12-04 15:06:55,489] Trial 1193 finished with value: 1.2401112325147907 and parameters: {'kernel_type': 'Matern', 'length_scale': 86281.62593568263, 'noise_level': 0.0012269993235049287, 'constant_value': 66.92318972328032, 'nu': 0.5}. Best is trial 386 with value: 0.4872991004520934.
[I 2024-12-04 15:06:55,782] Trial 1194 finished with value: 0.48830338035809023 and parameters: {'kernel_type': 'Matern', 'length_scale': 64064.38345593327, 'noise_level': 0.03203711761665876, 'constant_value': 210.56854674280225, 'nu': 0.5}. Best is trial 386 with value: 0.4872991004520934.
[I 2024-12-04 15:06:57,554] Trial 1200 finished with value: 0.48830338688934416 and parameters: {'kernel_type': 'Matern', 'length_scale': 1454.2451956039959, 'noise_level': 0.02127527152858629, 'constant_value': 39.30084704340459, 'nu': 0.5}. Best is trial 386 with value: 0.4872991004520934.
[I 2024-12-04 15:06:58,395] Trial 1202 finished with value: 1.2614543702027892 and parameters: {'kernel_type': 'RBF', 'length_scale': 0.025318075739378228, 'noise_level': 3.4410023560756445e-05, 'constant_value': 610.5417922114618, 'nu': 1.5}. Best is trial 386 with value: 0.4872991004520934.
[I 2024-12-04 15:06:58,405] Trial 1199 finished with value: 1.2401112325914172 and parameters: {'kernel_type': 'Matern', 'length_scale': 1070.4301593348578, 'noise_level': 0.006548845449577526, 'constant_value': 44292.440099642285, 'nu': 2.5}. Best is trial 386 with value: 0.4872991004520934.
[I 2024-12-04 15:06:58,675] Trial 1195 finished with value: 0.4883034448507692 and parameters: {'kernel_type': 'Matern', 'length_scale': 2132.1340999439626, 'noise_level': 0.01684079908440003, 'constant_value': 1159.9496621674543, 'nu': 0.5}. Best is trial 386 with value: 0.4872991004520934.
[I 2024-12-04 15:06:58,689] Trial 1190 finished with value: 0.4883034178167105 and parameters: {'kernel_type': 'Matern', 'length_scale': 94949.51609495486, 'noise_level': 0.0616009158025805, 'constant_value': 3066.745150558435, 'nu': 0.5}. Best is trial 386 with value: 0.4872991004520934.
[I 2024-12-04 15:06:59,217] Trial 1203 finished with value: 0.488303417972448 and parameters: {'kernel_type': 'Matern', 'length_scale': 3987.4628187111484, 'noise_level': 0.02269102768116446, 'constant_value': 339.321907895945, 'nu': 0.5}. Best is trial 386 with value: 0.4872991004520934.
[I 2024-12-04 15:07:00,051] Trial 1192 finished with value: 0.48830342842906105 and parameters: {'kernel_type': 'Matern', 'length_scale': 1522.6106529480521, 'noise_level': 0.009610780429533911, 'constant_value': 255.36315315564204, 'nu': 0.5}. Best is trial 386 with value: 0.4872991004520934.
