[I 2024-12-04 00:07:12,854] Trial 329 finished with value: 0.14936931633471492 and parameters: {'kernel': 'rbf', 'C': 91.47865916715479, 'gamma': 0.011828551529688877, 'epsilon': 0.0027120408895793566}. Best is trial 270 with value: 0.14046642316818972.
[I 2024-12-04 00:07:12,922] Trial 114 finished with value: 0.5764000768347111 and parameters: {'kernel': 'poly', 'C': 63.42333929335135, 'gamma': 0.021005401726442014, 'epsilon': 0.007186111181782927}. Best is trial 270 with value: 0.14046642316818972.
[I 2024-12-04 00:07:13,108] Trial 331 finished with value: 0.24675796249697052 and parameters: {'kernel': 'rbf', 'C': 18.55559319642244, 'gamma': 0.004667161195244135, 'epsilon': 0.03663432368019989}. Best is trial 270 with value: 0.14046642316818972.
[I 2024-12-04 00:07:13,378] Trial 335 finished with value: 0.18995344810496678 and parameters: {'kernel': 'rbf', 'C': 31.101699277055545, 'gamma': 0.044438191853970854, 'epsilon': 0.03566873095501961}. Best is trial 270 with value: 0.14046642316818972.
[I 2024-12-04 00:07:13,729] Trial 333 finished with value: 0.1491742245199724 and parameters: {'kernel': 'rbf', 'C': 89.50954727552964, 'gamma': 0.01246596199117518, 'epsilon': 0.02474732207823584}. Best is trial 270 with value: 0.14046642316818972.
[I 2024-12-04 00:07:14,200] Trial 337 finished with value: 0.30487099223661135 and parameters: {'kernel': 'rbf', 'C': 4.000820649105919, 'gamma': 0.005304373746317035, 'epsilon': 0.004659190030615044}. Best is trial 270 with value: 0.14046642316818972.
[I 2024-12-04 00:07:14,399] Trial 340 finished with value: 0.26070561611015736 and parameters: {'kernel': 'rbf', 'C': 20.120176682159116, 'gamma': 0.0028370209180957613, 'epsilon': 0.025339193744576934}. Best is trial 270 with value: 0.14046642316818972.
[I 2024-12-04 00:07:14,454] Trial 339 finished with value: 47.76037266697605 and parameters: {'kernel': 'sigmoid', 'C': 38.51969801862279, 'gamma': 0.0016413232057236507, 'epsilon': 0.0056711350173840715}. Best is trial 270 with value: 0.14046642316818972.
[I 2024-12-04 00:07:14,934] Trial 334 finished with value: 360.1791472407481 and parameters: {'kernel': 'sigmoid', 'C': 75.00422840278075, 'gamma': 0.0036482363481293184, 'epsilon': 0.034025056941081794}. Best is trial 270 with value: 0.14046642316818972.
[I 2024-12-04 00:07:15,384] Trial 338 finished with value: 0.15238275673822302 and parameters: {'kernel': 'rbf', 'C': 97.96199926057335, 'gamma': 0.012040599397647586, 'epsilon': 0.0019836343911850724}. Best is trial 270 with value: 0.14046642316818972.
[I 2024-12-04 00:07:15,696] Trial 336 finished with value: 0.1587710677656007 and parameters: {'kernel': 'rbf', 'C': 95.45377325175306, 'gamma': 0.013892254716704588, 'epsilon': 0.0046606474646828135}. Best is trial 270 with value: 0.14046642316818972.
[I 2024-12-04 00:07:15,792] Trial 342 finished with value: 0.16971688176560543 and parameters: {'kernel': 'rbf', 'C': 99.48943381883089, 'gamma': 0.0034661325579313233, 'epsilon': 0.01700809123420911}. Best is trial 270 with value: 0.14046642316818972.
[I 2024-12-04 00:07:15,887] Trial 341 finished with value: 0.1447724348913102 and parameters: {'kernel': 'rbf', 'C': 98.8810575058911, 'gamma': 0.006686628581843159, 'epsilon': 0.010650175816859281}. Best is trial 270 with value: 0.14046642316818972.
[I 2024-12-04 00:07:16,676] Trial 345 finished with value: 1.4888949517640209 and parameters: {'kernel': 'sigmoid', 'C': 0.05351623120085329, 'gamma': 0.3680267834688943, 'epsilon': 0.004606338639849539}. Best is trial 270 with value: 0.14046642316818972.
[I 2024-12-04 00:07:16,677] Trial 343 finished with value: 0.16442679679550243 and parameters: {'kernel': 'rbf', 'C': 9.589578445088046, 'gamma': 0.025973584296967816, 'epsilon': 0.013250989715888806}. Best is trial 270 with value: 0.14046642316818972.
[I 2024-12-04 00:07:17,428] Trial 348 finished with value: 0.26024387700974333 and parameters: {'kernel': 'rbf', 'C': 9.075413943952244, 'gamma': 0.006225961304168538, 'epsilon': 0.004659328358776339}. Best is trial 270 with value: 0.14046642316818972.
[I 2024-12-04 00:07:18,010] Trial 346 finished with value: 0.28940045783058477 and parameters: {'kernel': 'rbf', 'C': 20.224058500864, 'gamma': 0.0016567131296358333, 'epsilon': 0.0012983923941760512}. Best is trial 270 with value: 0.14046642316818972.
[I 2024-12-04 00:07:18,749] Trial 349 finished with value: 1493.9898146330456 and parameters: {'kernel': 'sigmoid', 'C': 68.08558516205154, 'gamma': 0.032201630883974784, 'epsilon': 0.00707019611439189}. Best is trial 270 with value: 0.14046642316818972.
[I 2024-12-04 00:07:19,094] Trial 350 finished with value: 0.14659599687429925 and parameters: {'kernel': 'rbf', 'C': 91.17149052629594, 'gamma': 0.006578910749794831, 'epsilon': 0.010722562878576616}. Best is trial 270 with value: 0.14046642316818972.
[I 2024-12-04 00:07:20,022] Trial 352 finished with value: 0.176387333202031 and parameters: {'kernel': 'rbf', 'C': 91.85723709361429, 'gamma': 0.003462145304373079, 'epsilon': 0.002149382052183327}. Best is trial 270 with value: 0.14046642316818972.
[I 2024-12-04 00:07:20,414] Trial 357 finished with value: 0.9078858411869621 and parameters: {'kernel': 'poly', 'C': 1.2785946777772608, 'gamma': 0.0025274214840735544, 'epsilon': 0.01743995515811881}. Best is trial 270 with value: 0.14046642316818972.
[I 2024-12-04 00:07:20,503] Trial 351 finished with value: 0.20419121898218784 and parameters: {'kernel': 'rbf', 'C': 88.82895667803201, 'gamma': 0.04982526464301095, 'epsilon': 0.0315895134972811}. Best is trial 270 with value: 0.14046642316818972.
[I 2024-12-04 00:07:20,867] Trial 358 finished with value: 0.20726658711100177 and parameters: {'kernel': 'rbf', 'C': 16.17984826404366, 'gamma': 0.008904012632371044, 'epsilon': 0.042997112789318885}. Best is trial 270 with value: 0.14046642316818972.
[I 2024-12-04 00:07:21,052] Trial 360 finished with value: 0.34006964285465596 and parameters: {'kernel': 'rbf', 'C': 11.015179506967165, 'gamma': 0.0014906924345648117, 'epsilon': 0.015891318730461335}. Best is trial 270 with value: 0.14046642316818972.
[I 2024-12-04 00:07:22,071] Trial 359 finished with value: 0.9586052193480545 and parameters: {'kernel': 'rbf', 'C': 0.0025359954091503196, 'gamma': 0.0047675678641460675, 'epsilon': 0.0012382581771017598}. Best is trial 270 with value: 0.14046642316818972.
[I 2024-12-04 00:07:22,207] Trial 361 finished with value: 0.9998360522751908 and parameters: {'kernel': 'poly', 'C': 0.0018238456736154114, 'gamma': 0.00010727168243544172, 'epsilon': 0.21984587437125128}. Best is trial 270 with value: 0.14046642316818972.
[I 2024-12-04 00:07:22,406] Trial 353 finished with value: 0.14144874200833799 and parameters: {'kernel': 'rbf', 'C': 90.74609434194178, 'gamma': 0.008469355944204565, 'epsilon': 0.004083735832664952}. Best is trial 270 with value: 0.14046642316818972.
[I 2024-12-04 00:07:22,470] Trial 356 finished with value: 0.15393043686637115 and parameters: {'kernel': 'rbf', 'C': 96.78736531047862, 'gamma': 0.004950259899498614, 'epsilon': 0.0015615333281709177}. Best is trial 270 with value: 0.14046642316818972.
[I 2024-12-04 00:07:22,471] Trial 355 finished with value: 0.1507145437867906 and parameters: {'kernel': 'rbf', 'C': 96.18315175840448, 'gamma': 0.00832948064458626, 'epsilon': 0.044079105537718516}. Best is trial 270 with value: 0.14046642316818972.
[I 2024-12-04 00:07:22,712] Trial 347 finished with value: 0.5271703958677263 and parameters: {'kernel': 'poly', 'C': 19.465006599221322, 'gamma': 0.01771632537707203, 'epsilon': 0.004094202293296589}. Best is trial 270 with value: 0.14046642316818972.
[I 2024-12-04 00:07:22,802] Trial 364 finished with value: 0.198929419654845 and parameters: {'kernel': 'rbf', 'C': 11.54885963260459, 'gamma': 0.012551522484977791, 'epsilon': 0.008473824436142198}. Best is trial 270 with value: 0.14046642316818972.
[I 2024-12-04 00:07:22,806] Trial 363 finished with value: 0.16564097090524565 and parameters: {'kernel': 'rbf', 'C': 14.483512630411232, 'gamma': 0.03387933129131382, 'epsilon': 0.005680419921994678}. Best is trial 270 with value: 0.14046642316818972.
[I 2024-12-04 00:07:23,468] Trial 362 finished with value: 0.1588633711914255 and parameters: {'kernel': 'rbf', 'C': 97.96201715499818, 'gamma': 0.004086022061989371, 'epsilon': 0.014880175411893468}. Best is trial 270 with value: 0.14046642316818972.
[I 2024-12-04 00:07:23,658] Trial 354 finished with value: 0.20230644759219998 and parameters: {'kernel': 'rbf', 'C': 99.47035455910188, 'gamma': 0.04525813067718294, 'epsilon': 0.005935566462613621}. Best is trial 270 with value: 0.14046642316818972.
[I 2024-12-04 00:07:24,391] Trial 366 finished with value: 0.25902477001825464 and parameters: {'kernel': 'rbf', 'C': 95.93693107794914, 'gamma': 0.0007389721988259954, 'epsilon': 0.0036904642979294125}. Best is trial 270 with value: 0.14046642316818972.
[I 2024-12-04 00:07:25,457] Trial 369 finished with value: 0.2550941377831843 and parameters: {'kernel': 'rbf', 'C': 13.28785064241805, 'gamma': 0.005034463407920479, 'epsilon': 0.004889343810785769}. Best is trial 270 with value: 0.14046642316818972.
[I 2024-12-04 00:07:25,827] Trial 368 finished with value: 0.14707077250162134 and parameters: {'kernel': 'rbf', 'C': 81.75527438156409, 'gamma': 0.0063332090294633, 'epsilon': 0.0011960652043818466}. Best is trial 270 with value: 0.14046642316818972.
[I 2024-12-04 00:07:25,953] Trial 367 finished with value: 0.15045996542238813 and parameters: {'kernel': 'rbf', 'C': 79.64392797521057, 'gamma': 0.012673189976675131, 'epsilon': 0.0033338933447707286}. Best is trial 270 with value: 0.14046642316818972.
[I 2024-12-04 00:07:26,406] Trial 372 finished with value: 0.16319830811058045 and parameters: {'kernel': 'rbf', 'C': 10.002515959592783, 'gamma': 0.027674216358901462, 'epsilon': 0.004005385034725052}. Best is trial 270 with value: 0.14046642316818972.
[I 2024-12-04 00:07:26,816] Trial 370 finished with value: 0.149031524156251 and parameters: {'kernel': 'rbf', 'C': 85.70126007914811, 'gamma': 0.012044438816048931, 'epsilon': 0.008339178860710256}. Best is trial 270 with value: 0.14046642316818972.
[I 2024-12-04 00:07:28,169] Trial 375 finished with value: 0.16080236324830327 and parameters: {'kernel': 'rbf', 'C': 83.55974762189022, 'gamma': 0.004669396481293002, 'epsilon': 0.00397205470210164}. Best is trial 270 with value: 0.14046642316818972.
[I 2024-12-04 00:07:28,179] Trial 379 finished with value: 0.2588629827661462 and parameters: {'kernel': 'rbf', 'C': 15.303379556124836, 'gamma': 0.004074408688201074, 'epsilon': 0.006081877355748679}. Best is trial 270 with value: 0.14046642316818972.
[I 2024-12-04 00:07:28,611] Trial 378 finished with value: 0.15360134222821822 and parameters: {'kernel': 'rbf', 'C': 16.557644889969986, 'gamma': 0.02624443552827582, 'epsilon': 0.013142899333282223}. Best is trial 270 with value: 0.14046642316818972.
[I 2024-12-04 00:07:28,641] Trial 371 finished with value: 0.14176002012578842 and parameters: {'kernel': 'rbf', 'C': 88.5607772097316, 'gamma': 0.008001255946174693, 'epsilon': 0.0037116274892146635}. Best is trial 270 with value: 0.14046642316818972.
[I 2024-12-04 00:07:29,102] Trial 374 finished with value: 0.14934898804761668 and parameters: {'kernel': 'rbf', 'C': 90.77944463601892, 'gamma': 0.0112198309586639, 'epsilon': 0.011308255790534828}. Best is trial 270 with value: 0.14046642316818972.
[I 2024-12-04 00:07:29,143] Trial 376 finished with value: 0.16478797510135468 and parameters: {'kernel': 'rbf', 'C': 56.347325794603165, 'gamma': 0.020763524317926083, 'epsilon': 0.003532263718484021}. Best is trial 270 with value: 0.14046642316818972.
[I 2024-12-04 00:07:29,511] Trial 373 finished with value: 0.1428789310887456 and parameters: {'kernel': 'rbf', 'C': 96.92846049817325, 'gamma': 0.009241353109302583, 'epsilon': 0.008518178873481065}. Best is trial 270 with value: 0.14046642316818972.
[I 2024-12-04 00:07:29,913] Trial 380 finished with value: 0.15142229410538063 and parameters: {'kernel': 'rbf', 'C': 21.467237946116093, 'gamma': 0.015465812198037138, 'epsilon': 0.014739076883874012}. Best is trial 270 with value: 0.14046642316818972.
[I 2024-12-04 00:07:29,914] Trial 382 finished with value: 0.27385697573290724 and parameters: {'kernel': 'rbf', 'C': 15.676569023200257, 'gamma': 0.0026282165359798174, 'epsilon': 0.013353014789011153}. Best is trial 270 with value: 0.14046642316818972.
[I 2024-12-04 00:07:30,815] Trial 381 finished with value: 0.1408797686642146 and parameters: {'kernel': 'rbf', 'C': 98.11836659806652, 'gamma': 0.007026326986183377, 'epsilon': 0.002737228398717277}. Best is trial 270 with value: 0.14046642316818972.
[I 2024-12-04 00:07:32,761] Trial 387 finished with value: 0.1641873918695459 and parameters: {'kernel': 'rbf', 'C': 73.93454436278628, 'gamma': 0.004761989481478075, 'epsilon': 0.005411912244645266}. Best is trial 270 with value: 0.14046642316818972.
[I 2024-12-04 00:07:32,766] Trial 386 finished with value: 0.1597792600838916 and parameters: {'kernel': 'rbf', 'C': 76.94349535802971, 'gamma': 0.004996028445156742, 'epsilon': 0.005291917019663694}. Best is trial 270 with value: 0.14046642316818972.
[I 2024-12-04 00:07:32,766] Trial 391 finished with value: 0.7953308945614597 and parameters: {'kernel': 'poly', 'C': 91.19740823693213, 'gamma': 0.002014797885857561, 'epsilon': 0.001988325696199692}. Best is trial 270 with value: 0.14046642316818972.
[I 2024-12-04 00:07:32,776] Trial 377 finished with value: 0.16962990194325342 and parameters: {'kernel': 'rbf', 'C': 86.45431285639908, 'gamma': 0.01965988088239462, 'epsilon': 0.0024345165056729465}. Best is trial 270 with value: 0.14046642316818972.
[I 2024-12-04 00:07:32,784] Trial 389 finished with value: 0.6930418748914361 and parameters: {'kernel': 'sigmoid', 'C': 1.9888975703952203, 'gamma': 0.00018605584918245075, 'epsilon': 0.01436157949156403}. Best is trial 270 with value: 0.14046642316818972.
[I 2024-12-04 00:07:33,242] Trial 385 finished with value: 0.1735996371924804 and parameters: {'kernel': 'rbf', 'C': 96.5402882750734, 'gamma': 0.022441234455546213, 'epsilon': 0.0026867643645062493}. Best is trial 270 with value: 0.14046642316818972.
[I 2024-12-04 00:07:33,420] Trial 388 finished with value: 0.14289569548908246 and parameters: {'kernel': 'rbf', 'C': 81.04101485420331, 'gamma': 0.008630852556022589, 'epsilon': 0.006882472696128486}. Best is trial 270 with value: 0.14046642316818972.
[I 2024-12-04 00:07:33,800] Trial 390 finished with value: 659.2460837014536 and parameters: {'kernel': 'sigmoid', 'C': 61.14905087709875, 'gamma': 0.007868258762983674, 'epsilon': 0.003259939230175742}. Best is trial 270 with value: 0.14046642316818972.
[I 2024-12-04 00:07:34,614] Trial 395 finished with value: 0.2348803754272994 and parameters: {'kernel': 'rbf', 'C': 15.97063124114758, 'gamma': 0.0063472657953845164, 'epsilon': 0.002395237023170754}. Best is trial 270 with value: 0.14046642316818972.
[I 2024-12-04 00:07:34,941] Trial 394 finished with value: 0.23247046679991212 and parameters: {'kernel': 'rbf', 'C': 71.50794119569791, 'gamma': 0.0016822053723742404, 'epsilon': 0.002928935594961864}. Best is trial 270 with value: 0.14046642316818972.
[I 2024-12-04 00:07:35,596] Trial 393 finished with value: 0.6421172254371634 and parameters: {'kernel': 'poly', 'C': 0.003939412051972523, 'gamma': 0.8310632728745877, 'epsilon': 0.8006341045068338}. Best is trial 270 with value: 0.14046642316818972.
[I 2024-12-04 00:07:35,784] Trial 398 finished with value: 0.27546109695249016 and parameters: {'kernel': 'rbf', 'C': 9.074001187938897, 'gamma': 0.00439845283408213, 'epsilon': 0.0013987593159420658}. Best is trial 270 with value: 0.14046642316818972.
[I 2024-12-04 00:07:36,377] Trial 401 finished with value: 0.8412122682884101 and parameters: {'kernel': 'poly', 'C': 4.689639932363319, 'gamma': 0.0043072954302768845, 'epsilon': 0.9225004077800666}. Best is trial 270 with value: 0.14046642316818972.
[I 2024-12-04 00:07:36,907] Trial 392 finished with value: 0.1405995170556999 and parameters: {'kernel': 'rbf', 'C': 96.49658432675416, 'gamma': 0.009136954108122671, 'epsilon': 0.0015978947995774994}. Best is trial 270 with value: 0.14046642316818972.
[I 2024-12-04 00:07:37,227] Trial 399 finished with value: 0.20532558238975895 and parameters: {'kernel': 'rbf', 'C': 85.91578389156493, 'gamma': 0.0024023394134006946, 'epsilon': 0.004822822388799226}. Best is trial 270 with value: 0.14046642316818972.
[I 2024-12-04 00:07:37,541] Trial 397 finished with value: 0.21846649428309595 and parameters: {'kernel': 'rbf', 'C': 60.7922458496641, 'gamma': 0.0026082788520417404, 'epsilon': 0.004969998470608552}. Best is trial 270 with value: 0.14046642316818972.
[I 2024-12-04 00:07:37,737] Trial 402 finished with value: 0.15534751893694285 and parameters: {'kernel': 'rbf', 'C': 18.06526084887596, 'gamma': 0.016965246658265976, 'epsilon': 0.002772770377738171}. Best is trial 270 with value: 0.14046642316818972.
[I 2024-12-04 00:07:38,104] Trial 344 finished with value: 0.35232550735355633 and parameters: {'kernel': 'linear', 'C': 6.6048235991258295, 'gamma': 0.00502053303219769, 'epsilon': 0.03426549063804254}. Best is trial 270 with value: 0.14046642316818972.
[I 2024-12-04 00:07:38,326] Trial 406 finished with value: 2203.833884060904 and parameters: {'kernel': 'sigmoid', 'C': 92.26903026722944, 'gamma': 0.0685861618140631, 'epsilon': 0.0014417086304054044}. Best is trial 270 with value: 0.14046642316818972.
[I 2024-12-04 00:07:38,774] Trial 400 finished with value: 0.22092975403761014 and parameters: {'kernel': 'rbf', 'C': 89.47810273017245, 'gamma': 0.07692729510180578, 'epsilon': 0.012668428202049251}. Best is trial 270 with value: 0.14046642316818972.
[I 2024-12-04 00:07:38,816] Trial 396 finished with value: 0.14236414373572598 and parameters: {'kernel': 'rbf', 'C': 96.30550857076483, 'gamma': 0.010465186246875834, 'epsilon': 0.001949773437913543}. Best is trial 270 with value: 0.14046642316818972.
[I 2024-12-04 00:07:38,825] Trial 91 finished with value: 0.3525055357056138 and parameters: {'kernel': 'linear', 'C': 59.541824150308564, 'gamma': 0.030222180605268413, 'epsilon': 0.001034726948252851}. Best is trial 270 with value: 0.14046642316818972.
[I 2024-12-04 00:07:39,242] Trial 404 finished with value: 0.1515175083730022 and parameters: {'kernel': 'rbf', 'C': 96.98178959080026, 'gamma': 0.005274457435765131, 'epsilon': 0.0037170904325675956}. Best is trial 270 with value: 0.14046642316818972.
[I 2024-12-04 00:07:39,782] Trial 410 finished with value: 0.2505045489036447 and parameters: {'kernel': 'rbf', 'C': 11.629866495092713, 'gamma': 0.006371458409191788, 'epsilon': 0.0015504853646430418}. Best is trial 270 with value: 0.14046642316818972.
[I 2024-12-04 00:07:40,086] Trial 409 finished with value: 0.9755164920250614 and parameters: {'kernel': 'sigmoid', 'C': 0.0011548561267645536, 'gamma': 0.01766240790641386, 'epsilon': 0.3758270060061424}. Best is trial 270 with value: 0.14046642316818972.
[I 2024-12-04 00:07:41,366] Trial 405 finished with value: 0.1471321311178728 and parameters: {'kernel': 'rbf', 'C': 87.06315353076168, 'gamma': 0.011639439578836714, 'epsilon': 0.0018635699202096266}. Best is trial 270 with value: 0.14046642316818972.
[I 2024-12-04 00:07:41,488] Trial 411 finished with value: 0.1816584314640564 and parameters: {'kernel': 'rbf', 'C': 78.92516702348229, 'gamma': 0.0036062957961167726, 'epsilon': 0.002021149940426281}. Best is trial 270 with value: 0.14046642316818972.
[I 2024-12-04 00:07:41,489] Trial 403 finished with value: 0.17588485217789515 and parameters: {'kernel': 'rbf', 'C': 78.90327692728683, 'gamma': 0.025640621292492546, 'epsilon': 0.004610717908259902}. Best is trial 270 with value: 0.14046642316818972.
[I 2024-12-04 00:07:41,972] Trial 412 finished with value: 0.1807517582322128 and parameters: {'kernel': 'rbf', 'C': 61.822997505801446, 'gamma': 0.0043461246860959655, 'epsilon': 0.002179841630960816}. Best is trial 270 with value: 0.14046642316818972.
[I 2024-12-04 00:07:42,147] Trial 407 finished with value: 0.16111289496887796 and parameters: {'kernel': 'rbf', 'C': 97.16769811790712, 'gamma': 0.013953318385318216, 'epsilon': 0.001122326894006123}. Best is trial 270 with value: 0.14046642316818972.
[I 2024-12-04 00:07:42,706] Trial 414 finished with value: 0.1591812155572849 and parameters: {'kernel': 'rbf', 'C': 32.97240792340485, 'gamma': 0.009190543338120636, 'epsilon': 0.0014387989205620817}. Best is trial 270 with value: 0.14046642316818972.
[I 2024-12-04 00:07:43,244] Trial 420 finished with value: 0.1891764799784906 and parameters: {'kernel': 'rbf', 'C': 38.67380628870118, 'gamma': 0.005659579350786747, 'epsilon': 0.0014148632287557072}. Best is trial 270 with value: 0.14046642316818972.
[I 2024-12-04 00:07:44,317] Trial 418 finished with value: 0.1783098698077105 and parameters: {'kernel': 'rbf', 'C': 12.41851592375888, 'gamma': 0.015463995391795096, 'epsilon': 0.0034155099925940405}. Best is trial 270 with value: 0.14046642316818972.
[I 2024-12-04 00:07:44,726] Trial 422 finished with value: 0.22409341394349916 and parameters: {'kernel': 'rbf', 'C': 91.15781367586708, 'gamma': 0.0016315445387591245, 'epsilon': 0.0013819305315101252}. Best is trial 270 with value: 0.14046642316818972.
[I 2024-12-04 00:07:45,128] Trial 421 finished with value: 0.17784777025459714 and parameters: {'kernel': 'rbf', 'C': 45.2358692834122, 'gamma': 0.005799853156141237, 'epsilon': 0.004357929685569866}. Best is trial 270 with value: 0.14046642316818972.
[I 2024-12-04 00:07:45,907] Trial 413 finished with value: 0.17765010932281183 and parameters: {'kernel': 'rbf', 'C': 71.39567296330662, 'gamma': 0.027121351786524788, 'epsilon': 0.00161365959613192}. Best is trial 270 with value: 0.14046642316818972.
