[I 2024-12-04 15:17:58,475] Trial 1793 finished with value: 0.5730601307197146 and parameters: {'n_estimators': 1442, 'learning_rate': 0.016261738467469367, 'max_depth': 7, 'min_samples_split': 9, 'min_samples_leaf': 5, 'subsample': 0.7270840619753285, 'max_features': None}. Best is trial 1435 with value: 0.45467030752684195.
[I 2024-12-04 15:18:01,457] Trial 1799 finished with value: 0.9496037934577856 and parameters: {'n_estimators': 1328, 'learning_rate': 0.012223405258323756, 'max_depth': 5, 'min_samples_split': 2, 'min_samples_leaf': 6, 'subsample': 0.6150366672646941, 'max_features': 'log2'}. Best is trial 1435 with value: 0.45467030752684195.
[I 2024-12-04 15:18:02,540] Trial 1802 finished with value: 0.48546744087583 and parameters: {'n_estimators': 893, 'learning_rate': 0.07342211654530086, 'max_depth': 11, 'min_samples_split': 18, 'min_samples_leaf': 1, 'subsample': 0.9895619645020987, 'max_features': None}. Best is trial 1435 with value: 0.45467030752684195.
[I 2024-12-04 15:18:03,742] Trial 1805 finished with value: 0.4745879530944534 and parameters: {'n_estimators': 918, 'learning_rate': 0.0856441076791515, 'max_depth': 12, 'min_samples_split': 19, 'min_samples_leaf': 1, 'subsample': 0.9858355505517868, 'max_features': None}. Best is trial 1435 with value: 0.45467030752684195.
[I 2024-12-04 15:18:03,789] Trial 1834 finished with value: 1.1972213945466605 and parameters: {'n_estimators': 105, 'learning_rate': 0.01571438923312253, 'max_depth': 5, 'min_samples_split': 12, 'min_samples_leaf': 7, 'subsample': 0.701186873006985, 'max_features': 'log2'}. Best is trial 1435 with value: 0.45467030752684195.
[I 2024-12-04 15:18:04,512] Trial 1804 finished with value: 0.606331463125411 and parameters: {'n_estimators': 997, 'learning_rate': 0.09493725685120295, 'max_depth': 12, 'min_samples_split': 19, 'min_samples_leaf': 2, 'subsample': 0.9878764572409284, 'max_features': None}. Best is trial 1435 with value: 0.45467030752684195.
[I 2024-12-04 15:18:07,074] Trial 1806 finished with value: 0.4991443645447301 and parameters: {'n_estimators': 918, 'learning_rate': 0.0537976713062797, 'max_depth': 12, 'min_samples_split': 16, 'min_samples_leaf': 1, 'subsample': 0.9924896454038451, 'max_features': None}. Best is trial 1435 with value: 0.45467030752684195.
[I 2024-12-04 15:18:08,727] Trial 1808 finished with value: 0.6788320568545215 and parameters: {'n_estimators': 1116, 'learning_rate': 0.03980279521145747, 'max_depth': 10, 'min_samples_split': 3, 'min_samples_leaf': 8, 'subsample': 0.6735947545194235, 'max_features': None}. Best is trial 1435 with value: 0.45467030752684195.
[I 2024-12-04 15:18:09,590] Trial 1809 finished with value: 0.4914095859056564 and parameters: {'n_estimators': 925, 'learning_rate': 0.06114020632309742, 'max_depth': 10, 'min_samples_split': 20, 'min_samples_leaf': 1, 'subsample': 0.9761792400246347, 'max_features': None}. Best is trial 1435 with value: 0.45467030752684195.
[I 2024-12-04 15:18:10,253] Trial 1803 finished with value: 0.7123417132866986 and parameters: {'n_estimators': 1327, 'learning_rate': 0.02911578393829064, 'max_depth': 7, 'min_samples_split': 14, 'min_samples_leaf': 8, 'subsample': 0.9899623050847088, 'max_features': 'sqrt'}. Best is trial 1435 with value: 0.45467030752684195.
[I 2024-12-04 15:18:10,255] Trial 1813 finished with value: 0.49403511494329666 and parameters: {'n_estimators': 894, 'learning_rate': 0.05795696891497708, 'max_depth': 12, 'min_samples_split': 18, 'min_samples_leaf': 1, 'subsample': 0.9383950966064885, 'max_features': None}. Best is trial 1435 with value: 0.45467030752684195.
[I 2024-12-04 15:18:11,720] Trial 1841 finished with value: 1.2357457021074605 and parameters: {'n_estimators': 154, 'learning_rate': 0.010228152934276513, 'max_depth': 7, 'min_samples_split': 8, 'min_samples_leaf': 7, 'subsample': 0.7837305923250716, 'max_features': 'log2'}. Best is trial 1435 with value: 0.45467030752684195.
[I 2024-12-04 15:18:13,505] Trial 1814 finished with value: 0.6734755529791671 and parameters: {'n_estimators': 923, 'learning_rate': 0.06591364154942825, 'max_depth': 10, 'min_samples_split': 16, 'min_samples_leaf': 3, 'subsample': 0.9414981050564616, 'max_features': None}. Best is trial 1435 with value: 0.45467030752684195.
[I 2024-12-04 15:18:13,976] Trial 1825 finished with value: 0.63214533066989 and parameters: {'n_estimators': 704, 'learning_rate': 0.08690044639268706, 'max_depth': 12, 'min_samples_split': 15, 'min_samples_leaf': 2, 'subsample': 0.8273378664846145, 'max_features': None}. Best is trial 1435 with value: 0.45467030752684195.
[I 2024-12-04 15:18:15,550] Trial 1821 finished with value: 0.5088108769869667 and parameters: {'n_estimators': 1027, 'learning_rate': 0.07388916537392573, 'max_depth': 12, 'min_samples_split': 15, 'min_samples_leaf': 1, 'subsample': 0.9828298429125134, 'max_features': 'sqrt'}. Best is trial 1435 with value: 0.45467030752684195.
[I 2024-12-04 15:18:16,366] Trial 1817 finished with value: 0.5688879778300128 and parameters: {'n_estimators': 1077, 'learning_rate': 0.09282090498165588, 'max_depth': 4, 'min_samples_split': 13, 'min_samples_leaf': 5, 'subsample': 0.7765470782698705, 'max_features': None}. Best is trial 1435 with value: 0.45467030752684195.
[I 2024-12-04 15:18:16,979] Trial 1815 finished with value: 0.6559742247350508 and parameters: {'n_estimators': 1004, 'learning_rate': 0.09600102712997712, 'max_depth': 12, 'min_samples_split': 20, 'min_samples_leaf': 3, 'subsample': 0.9512960886222466, 'max_features': None}. Best is trial 1435 with value: 0.45467030752684195.
[I 2024-12-04 15:18:17,633] Trial 1836 finished with value: 0.7556649284585373 and parameters: {'n_estimators': 530, 'learning_rate': 0.04869806667762668, 'max_depth': 3, 'min_samples_split': 8, 'min_samples_leaf': 3, 'subsample': 0.6387176472718638, 'max_features': 'log2'}. Best is trial 1435 with value: 0.45467030752684195.
[I 2024-12-04 15:18:20,720] Trial 1833 finished with value: 0.6275853117694631 and parameters: {'n_estimators': 595, 'learning_rate': 0.09323355587991812, 'max_depth': 12, 'min_samples_split': 18, 'min_samples_leaf': 2, 'subsample': 0.9895744836584579, 'max_features': None}. Best is trial 1435 with value: 0.45467030752684195.
[I 2024-12-04 15:18:21,025] Trial 1824 finished with value: 0.4679532620184467 and parameters: {'n_estimators': 930, 'learning_rate': 0.06363758270740814, 'max_depth': 12, 'min_samples_split': 19, 'min_samples_leaf': 1, 'subsample': 0.9634145830407438, 'max_features': None}. Best is trial 1435 with value: 0.45467030752684195.
[I 2024-12-04 15:18:21,947] Trial 1842 finished with value: 0.7374432177693239 and parameters: {'n_estimators': 471, 'learning_rate': 0.09821274050618037, 'max_depth': 9, 'min_samples_split': 16, 'min_samples_leaf': 6, 'subsample': 0.8837236314929028, 'max_features': 'log2'}. Best is trial 1435 with value: 0.45467030752684195.
[I 2024-12-04 15:18:21,947] Trial 1840 finished with value: 0.4813696902270638 and parameters: {'n_estimators': 428, 'learning_rate': 0.0869305408807645, 'max_depth': 11, 'min_samples_split': 20, 'min_samples_leaf': 1, 'subsample': 0.8951805762404018, 'max_features': None}. Best is trial 1435 with value: 0.45467030752684195.
[I 2024-12-04 15:18:21,956] Trial 1819 finished with value: 1.0028834070602621 and parameters: {'n_estimators': 1332, 'learning_rate': 0.01356371858736003, 'max_depth': 4, 'min_samples_split': 3, 'min_samples_leaf': 10, 'subsample': 0.7592019204114862, 'max_features': 'log2'}. Best is trial 1435 with value: 0.45467030752684195.
[I 2024-12-04 15:18:23,413] Trial 1820 finished with value: 0.8494518548053727 and parameters: {'n_estimators': 1333, 'learning_rate': 0.09082885008821805, 'max_depth': 9, 'min_samples_split': 3, 'min_samples_leaf': 10, 'subsample': 0.9679810517473105, 'max_features': 'sqrt'}. Best is trial 1435 with value: 0.45467030752684195.
[I 2024-12-04 15:18:23,943] Trial 1816 finished with value: 0.48864062463579166 and parameters: {'n_estimators': 1141, 'learning_rate': 0.08611647563903468, 'max_depth': 10, 'min_samples_split': 19, 'min_samples_leaf': 1, 'subsample': 0.9483774939432177, 'max_features': None}. Best is trial 1435 with value: 0.45467030752684195.
[I 2024-12-04 15:18:24,421] Trial 1822 finished with value: 0.6330407768186616 and parameters: {'n_estimators': 1224, 'learning_rate': 0.04717130988050515, 'max_depth': 3, 'min_samples_split': 3, 'min_samples_leaf': 3, 'subsample': 0.6023044109694734, 'max_features': None}. Best is trial 1435 with value: 0.45467030752684195.
[I 2024-12-04 15:18:24,936] Trial 1818 finished with value: 0.6480578302407867 and parameters: {'n_estimators': 1160, 'learning_rate': 0.06536706880564201, 'max_depth': 10, 'min_samples_split': 20, 'min_samples_leaf': 2, 'subsample': 0.9157611990085698, 'max_features': None}. Best is trial 1435 with value: 0.45467030752684195.
[I 2024-12-04 15:18:25,609] Trial 1837 finished with value: 0.6081284587106801 and parameters: {'n_estimators': 623, 'learning_rate': 0.04669455230330908, 'max_depth': 12, 'min_samples_split': 18, 'min_samples_leaf': 3, 'subsample': 0.9943680596103582, 'max_features': None}. Best is trial 1435 with value: 0.45467030752684195.
[I 2024-12-04 15:18:26,217] Trial 1846 finished with value: 0.5528571521489493 and parameters: {'n_estimators': 326, 'learning_rate': 0.01169887724624953, 'max_depth': 9, 'min_samples_split': 16, 'min_samples_leaf': 5, 'subsample': 0.9200116571457463, 'max_features': None}. Best is trial 1435 with value: 0.45467030752684195.
[I 2024-12-04 15:18:26,860] Trial 1828 finished with value: 0.6578140297899526 and parameters: {'n_estimators': 957, 'learning_rate': 0.09937735354191743, 'max_depth': 12, 'min_samples_split': 20, 'min_samples_leaf': 2, 'subsample': 0.9023316322426506, 'max_features': None}. Best is trial 1435 with value: 0.45467030752684195.
[I 2024-12-04 15:18:29,030] Trial 1832 finished with value: 0.48236991867159995 and parameters: {'n_estimators': 804, 'learning_rate': 0.05745882699565588, 'max_depth': 10, 'min_samples_split': 20, 'min_samples_leaf': 1, 'subsample': 0.9104537461506859, 'max_features': None}. Best is trial 1435 with value: 0.45467030752684195.
[I 2024-12-04 15:18:29,583] Trial 1827 finished with value: 0.5020530197638177 and parameters: {'n_estimators': 1076, 'learning_rate': 0.06900954029645132, 'max_depth': 10, 'min_samples_split': 17, 'min_samples_leaf': 1, 'subsample': 0.98825969067931, 'max_features': None}. Best is trial 1435 with value: 0.45467030752684195.
[I 2024-12-04 15:18:30,762] Trial 1844 finished with value: 0.47904414619336216 and parameters: {'n_estimators': 455, 'learning_rate': 0.08687254487199554, 'max_depth': 12, 'min_samples_split': 16, 'min_samples_leaf': 1, 'subsample': 0.8756856714628087, 'max_features': None}. Best is trial 1435 with value: 0.45467030752684195.
[I 2024-12-04 15:18:31,786] Trial 1835 finished with value: 0.48086504859261936 and parameters: {'n_estimators': 859, 'learning_rate': 0.08694097437578813, 'max_depth': 12, 'min_samples_split': 20, 'min_samples_leaf': 1, 'subsample': 0.935374990069981, 'max_features': None}. Best is trial 1435 with value: 0.45467030752684195.
[I 2024-12-04 15:18:31,787] Trial 1830 finished with value: 0.4699725651514156 and parameters: {'n_estimators': 967, 'learning_rate': 0.06698645200505511, 'max_depth': 12, 'min_samples_split': 20, 'min_samples_leaf': 1, 'subsample': 0.9917350535958405, 'max_features': None}. Best is trial 1435 with value: 0.45467030752684195.
[I 2024-12-04 15:18:32,665] Trial 1856 finished with value: 0.7040162720446043 and parameters: {'n_estimators': 178, 'learning_rate': 0.0438408343711413, 'max_depth': 7, 'min_samples_split': 2, 'min_samples_leaf': 9, 'subsample': 0.780138569456326, 'max_features': None}. Best is trial 1435 with value: 0.45467030752684195.
[I 2024-12-04 15:18:34,480] Trial 1838 finished with value: 0.48360236120030015 and parameters: {'n_estimators': 871, 'learning_rate': 0.0951657674010411, 'max_depth': 10, 'min_samples_split': 20, 'min_samples_leaf': 1, 'subsample': 0.9281505967282042, 'max_features': None}. Best is trial 1435 with value: 0.45467030752684195.
[I 2024-12-04 15:18:34,757] Trial 1831 finished with value: 0.6682815503098398 and parameters: {'n_estimators': 1007, 'learning_rate': 0.09626029796584598, 'max_depth': 12, 'min_samples_split': 20, 'min_samples_leaf': 2, 'subsample': 0.9937433491218741, 'max_features': None}. Best is trial 1435 with value: 0.45467030752684195.
[I 2024-12-04 15:18:35,356] Trial 1843 finished with value: 0.649897562055108 and parameters: {'n_estimators': 776, 'learning_rate': 0.09714874445768261, 'max_depth': 10, 'min_samples_split': 16, 'min_samples_leaf': 4, 'subsample': 0.9574506029793207, 'max_features': None}. Best is trial 1435 with value: 0.45467030752684195.
[I 2024-12-04 15:18:35,818] Trial 1826 finished with value: 0.4664187056858608 and parameters: {'n_estimators': 1257, 'learning_rate': 0.08973494976702671, 'max_depth': 12, 'min_samples_split': 20, 'min_samples_leaf': 1, 'subsample': 0.9966324969267475, 'max_features': None}. Best is trial 1435 with value: 0.45467030752684195.
[I 2024-12-04 15:18:38,371] Trial 1829 finished with value: 0.48860002850512546 and parameters: {'n_estimators': 1191, 'learning_rate': 0.09284624773982142, 'max_depth': 11, 'min_samples_split': 20, 'min_samples_leaf': 1, 'subsample': 0.990351673350592, 'max_features': None}. Best is trial 1435 with value: 0.45467030752684195.
[I 2024-12-04 15:18:38,869] Trial 1845 finished with value: 0.48308177641624317 and parameters: {'n_estimators': 747, 'learning_rate': 0.08127658699943625, 'max_depth': 12, 'min_samples_split': 20, 'min_samples_leaf': 1, 'subsample': 0.994616738109046, 'max_features': None}. Best is trial 1435 with value: 0.45467030752684195.
[I 2024-12-04 15:18:40,878] Trial 1850 finished with value: 0.6916216119995866 and parameters: {'n_estimators': 837, 'learning_rate': 0.0965166355905455, 'max_depth': 12, 'min_samples_split': 17, 'min_samples_leaf': 2, 'subsample': 0.9875497966666246, 'max_features': 'log2'}. Best is trial 1435 with value: 0.45467030752684195.
[I 2024-12-04 15:18:41,201] Trial 1849 finished with value: 0.9614961998404012 and parameters: {'n_estimators': 870, 'learning_rate': 0.010360689348876018, 'max_depth': 9, 'min_samples_split': 12, 'min_samples_leaf': 4, 'subsample': 0.8417418464713765, 'max_features': 'log2'}. Best is trial 1435 with value: 0.45467030752684195.
[I 2024-12-04 15:18:41,367] Trial 1851 finished with value: 0.49987013969453314 and parameters: {'n_estimators': 641, 'learning_rate': 0.09673452823082608, 'max_depth': 12, 'min_samples_split': 16, 'min_samples_leaf': 1, 'subsample': 0.9858929821144375, 'max_features': None}. Best is trial 1435 with value: 0.45467030752684195.
[I 2024-12-04 15:18:41,718] Trial 1854 finished with value: 0.665223387087854 and parameters: {'n_estimators': 665, 'learning_rate': 0.021204094926730983, 'max_depth': 3, 'min_samples_split': 17, 'min_samples_leaf': 2, 'subsample': 0.9350877463468452, 'max_features': 'sqrt'}. Best is trial 1435 with value: 0.45467030752684195.
[I 2024-12-04 15:18:43,309] Trial 1853 finished with value: 0.4848965474635952 and parameters: {'n_estimators': 713, 'learning_rate': 0.06915264261631256, 'max_depth': 12, 'min_samples_split': 20, 'min_samples_leaf': 1, 'subsample': 0.9481322696895131, 'max_features': None}. Best is trial 1435 with value: 0.45467030752684195.
[I 2024-12-04 15:18:43,946] Trial 1864 finished with value: 0.7664906172258046 and parameters: {'n_estimators': 387, 'learning_rate': 0.049058037638484125, 'max_depth': 9, 'min_samples_split': 20, 'min_samples_leaf': 8, 'subsample': 0.7296558375752964, 'max_features': 'sqrt'}. Best is trial 1435 with value: 0.45467030752684195.
[I 2024-12-04 15:18:45,574] Trial 1867 finished with value: 0.7609845640337914 and parameters: {'n_estimators': 336, 'learning_rate': 0.09830382605785505, 'max_depth': 5, 'min_samples_split': 12, 'min_samples_leaf': 9, 'subsample': 0.8410757670003128, 'max_features': None}. Best is trial 1435 with value: 0.45467030752684195.
[I 2024-12-04 15:18:45,829] Trial 1858 finished with value: 0.5621460303152618 and parameters: {'n_estimators': 694, 'learning_rate': 0.060358177092849775, 'max_depth': 12, 'min_samples_split': 18, 'min_samples_leaf': 1, 'subsample': 0.9289722505303962, 'max_features': 'log2'}. Best is trial 1435 with value: 0.45467030752684195.
[I 2024-12-04 15:18:46,992] Trial 1847 finished with value: 0.6378580059854163 and parameters: {'n_estimators': 1139, 'learning_rate': 0.011611547516855194, 'max_depth': 5, 'min_samples_split': 9, 'min_samples_leaf': 3, 'subsample': 0.8713809527121437, 'max_features': 'sqrt'}. Best is trial 1435 with value: 0.45467030752684195.
[I 2024-12-04 15:18:48,219] Trial 1852 finished with value: 0.9076763076297963 and parameters: {'n_estimators': 1086, 'learning_rate': 0.013734668617757385, 'max_depth': 12, 'min_samples_split': 17, 'min_samples_leaf': 8, 'subsample': 0.920138001746473, 'max_features': 'log2'}. Best is trial 1435 with value: 0.45467030752684195.
[I 2024-12-04 15:18:48,958] Trial 1839 finished with value: 0.6704368854452817 and parameters: {'n_estimators': 1266, 'learning_rate': 0.09329207149364961, 'max_depth': 12, 'min_samples_split': 16, 'min_samples_leaf': 3, 'subsample': 0.9998168168956993, 'max_features': None}. Best is trial 1435 with value: 0.45467030752684195.
[I 2024-12-04 15:18:49,720] Trial 1855 finished with value: 0.505430891450004 and parameters: {'n_estimators': 785, 'learning_rate': 0.060580923352171745, 'max_depth': 10, 'min_samples_split': 16, 'min_samples_leaf': 1, 'subsample': 0.899557586928144, 'max_features': None}. Best is trial 1435 with value: 0.45467030752684195.
[I 2024-12-04 15:18:52,704] Trial 1848 finished with value: 0.4961085181410624 and parameters: {'n_estimators': 1129, 'learning_rate': 0.06276372105985034, 'max_depth': 10, 'min_samples_split': 18, 'min_samples_leaf': 1, 'subsample': 0.9106823070167953, 'max_features': None}. Best is trial 1435 with value: 0.45467030752684195.
[I 2024-12-04 15:18:52,712] Trial 1862 finished with value: 0.47910041364613726 and parameters: {'n_estimators': 598, 'learning_rate': 0.07728120735550502, 'max_depth': 12, 'min_samples_split': 20, 'min_samples_leaf': 1, 'subsample': 0.9917069710991846, 'max_features': None}. Best is trial 1435 with value: 0.45467030752684195.
[I 2024-12-04 15:18:53,647] Trial 1866 finished with value: 0.48360208912616104 and parameters: {'n_estimators': 533, 'learning_rate': 0.09932913411897207, 'max_depth': 10, 'min_samples_split': 18, 'min_samples_leaf': 1, 'subsample': 0.959815613764937, 'max_features': None}. Best is trial 1435 with value: 0.45467030752684195.
[I 2024-12-04 15:18:57,154] Trial 1860 finished with value: 0.6426598433216258 and parameters: {'n_estimators': 801, 'learning_rate': 0.08913284934913857, 'max_depth': 12, 'min_samples_split': 20, 'min_samples_leaf': 2, 'subsample': 0.9989164279233557, 'max_features': None}. Best is trial 1435 with value: 0.45467030752684195.
[I 2024-12-04 15:19:00,175] Trial 1859 finished with value: 0.649929545030494 and parameters: {'n_estimators': 1014, 'learning_rate': 0.09322038463448988, 'max_depth': 10, 'min_samples_split': 17, 'min_samples_leaf': 3, 'subsample': 0.9966820374326716, 'max_features': None}. Best is trial 1435 with value: 0.45467030752684195.
[I 2024-12-04 15:19:00,180] Trial 1857 finished with value: 0.5203822645499416 and parameters: {'n_estimators': 1018, 'learning_rate': 0.07537189448866807, 'max_depth': 12, 'min_samples_split': 16, 'min_samples_leaf': 1, 'subsample': 0.9993128239965761, 'max_features': None}. Best is trial 1435 with value: 0.45467030752684195.
[I 2024-12-04 15:19:01,212] Trial 1885 finished with value: 0.5782276449297125 and parameters: {'n_estimators': 319, 'learning_rate': 0.03759760850295548, 'max_depth': 8, 'min_samples_split': 20, 'min_samples_leaf': 1, 'subsample': 0.6579412645353028, 'max_features': 'sqrt'}. Best is trial 1435 with value: 0.45467030752684195.
[I 2024-12-04 15:19:02,968] Trial 1874 finished with value: 0.6070216232026657 and parameters: {'n_estimators': 610, 'learning_rate': 0.08136944665400538, 'max_depth': 5, 'min_samples_split': 18, 'min_samples_leaf': 6, 'subsample': 0.9984156647317737, 'max_features': None}. Best is trial 1435 with value: 0.45467030752684195.
[I 2024-12-04 15:19:05,228] Trial 1865 finished with value: 0.5456629809340605 and parameters: {'n_estimators': 1062, 'learning_rate': 0.04298348160579295, 'max_depth': 12, 'min_samples_split': 19, 'min_samples_leaf': 1, 'subsample': 0.999819846927164, 'max_features': 'sqrt'}. Best is trial 1435 with value: 0.45467030752684195.
[I 2024-12-04 15:19:05,672] Trial 1871 finished with value: 0.5107930246434633 and parameters: {'n_estimators': 701, 'learning_rate': 0.09679938439033332, 'max_depth': 11, 'min_samples_split': 16, 'min_samples_leaf': 1, 'subsample': 0.9503419116532016, 'max_features': None}. Best is trial 1435 with value: 0.45467030752684195.
[I 2024-12-04 15:19:06,656] Trial 1861 finished with value: 0.8129015034516422 and parameters: {'n_estimators': 1330, 'learning_rate': 0.09008500811238891, 'max_depth': 7, 'min_samples_split': 5, 'min_samples_leaf': 10, 'subsample': 0.6740016040458061, 'max_features': 'sqrt'}. Best is trial 1435 with value: 0.45467030752684195.
[I 2024-12-04 15:19:07,354] Trial 1863 finished with value: 0.4852673236721311 and parameters: {'n_estimators': 991, 'learning_rate': 0.07932756627734884, 'max_depth': 12, 'min_samples_split': 19, 'min_samples_leaf': 1, 'subsample': 0.9986126659208415, 'max_features': None}. Best is trial 1435 with value: 0.45467030752684195.
