[I 2024-12-04 15:04:28,788] Trial 598 finished with value: 1.2693635028553973 and parameters: {'kernel_type': 'Matern', 'length_scale': 801.0498119319192, 'noise_level': 0.0005455267505905004, 'constant_value': 103.0988213226635, 'nu': 1.5}. Best is trial 276 with value: 0.13435392997433446.
[I 2024-12-04 15:04:28,793] Trial 600 finished with value: 0.13435440077486505 and parameters: {'kernel_type': 'Matern', 'length_scale': 81.24887037046234, 'noise_level': 0.00018185660380759967, 'constant_value': 752.4850361121238, 'nu': 1.5}. Best is trial 276 with value: 0.13435392997433446.
[I 2024-12-04 15:04:28,799] Trial 596 finished with value: 0.17251039552214922 and parameters: {'kernel_type': 'Matern', 'length_scale': 1.5200689201852724, 'noise_level': 8.363214930006927e-05, 'constant_value': 891.3170345093314, 'nu': 0.5}. Best is trial 276 with value: 0.13435392997433446.
[I 2024-12-04 15:04:30,905] Trial 597 finished with value: 0.13435439614500738 and parameters: {'kernel_type': 'Matern', 'length_scale': 118.54025905645678, 'noise_level': 0.0013694533921445621, 'constant_value': 9.988291448436238, 'nu': 1.5}. Best is trial 276 with value: 0.13435392997433446.
[I 2024-12-04 15:04:31,946] Trial 607 finished with value: 1.3007742971301273 and parameters: {'kernel_type': 'RBF', 'length_scale': 530.3868198528787, 'noise_level': 0.006124696106574236, 'constant_value': 3.3517021953169153e-06, 'nu': 1.5}. Best is trial 276 with value: 0.13435392997433446.
[I 2024-12-04 15:04:32,071] Trial 595 finished with value: 0.15167297543708053 and parameters: {'kernel_type': 'RBF', 'length_scale': 25.335768418168126, 'noise_level': 0.003328697353446502, 'constant_value': 5904.520651794176, 'nu': 0.5}. Best is trial 276 with value: 0.13435392997433446.
[I 2024-12-04 15:04:32,138] Trial 584 finished with value: 1.269363502858512 and parameters: {'kernel_type': 'RBF', 'length_scale': 29495.774450376357, 'noise_level': 1.1006981755583564e-09, 'constant_value': 0.030351716402251247, 'nu': 1.5}. Best is trial 276 with value: 0.13435392997433446.
[I 2024-12-04 15:04:32,853] Trial 599 finished with value: 0.13435428633271967 and parameters: {'kernel_type': 'Matern', 'length_scale': 108.86399438098975, 'noise_level': 0.0001668584121668303, 'constant_value': 4717.542647704157, 'nu': 1.5}. Best is trial 276 with value: 0.13435392997433446.
[I 2024-12-04 15:04:34,083] Trial 605 finished with value: 0.134354369080351 and parameters: {'kernel_type': 'Matern', 'length_scale': 20.45501187398899, 'noise_level': 0.00417420953400806, 'constant_value': 495.38821404357816, 'nu': 1.5}. Best is trial 276 with value: 0.13435392997433446.
[I 2024-12-04 15:04:35,469] Trial 604 finished with value: 0.13435441451432956 and parameters: {'kernel_type': 'Matern', 'length_scale': 78.28313198025197, 'noise_level': 0.0002686112525966524, 'constant_value': 374.6251602127668, 'nu': 1.5}. Best is trial 276 with value: 0.13435392997433446.
[I 2024-12-04 15:04:37,393] Trial 606 finished with value: 0.13435441101117102 and parameters: {'kernel_type': 'Matern', 'length_scale': 7.8094499727170605, 'noise_level': 0.000192536871435113, 'constant_value': 965.9003722000001, 'nu': 1.5}. Best is trial 276 with value: 0.13435392997433446.
[I 2024-12-04 15:04:40,477] Trial 612 finished with value: 0.13435435714149674 and parameters: {'kernel_type': 'Matern', 'length_scale': 2.565331453892097, 'noise_level': 0.003357438081807423, 'constant_value': 731.9137348928592, 'nu': 1.5}. Best is trial 276 with value: 0.13435392997433446.
[I 2024-12-04 15:04:40,478] Trial 611 finished with value: 0.15167300459178845 and parameters: {'kernel_type': 'RBF', 'length_scale': 18.425385461956907, 'noise_level': 0.010831977721043662, 'constant_value': 12186.684299217566, 'nu': 1.5}. Best is trial 276 with value: 0.13435392997433446.
[I 2024-12-04 15:04:41,056] Trial 609 finished with value: 0.13435473433687486 and parameters: {'kernel_type': 'Matern', 'length_scale': 35707.17492222375, 'noise_level': 0.5541664285064584, 'constant_value': 92885.81126440893, 'nu': 1.5}. Best is trial 276 with value: 0.13435392997433446.
[I 2024-12-04 15:04:41,877] Trial 603 finished with value: 1.2693635028570451 and parameters: {'kernel_type': 'Matern', 'length_scale': 49857.66092564722, 'noise_level': 0.0013616304919882522, 'constant_value': 0.003550527952075966, 'nu': 0.5}. Best is trial 276 with value: 0.13435392997433446.
[I 2024-12-04 15:04:42,611] Trial 621 finished with value: 1.3007739235773872 and parameters: {'kernel_type': 'Matern', 'length_scale': 0.046618351628205955, 'noise_level': 0.00012045554848057972, 'constant_value': 97575.02536003443, 'nu': 1.5}. Best is trial 276 with value: 0.13435392997433446.
[I 2024-12-04 15:04:44,137] Trial 601 finished with value: 0.1343544002751525 and parameters: {'kernel_type': 'Matern', 'length_scale': 0.3207466857849341, 'noise_level': 0.10933084814511167, 'constant_value': 478.29388324089797, 'nu': 1.5}. Best is trial 276 with value: 0.13435392997433446.
[I 2024-12-04 15:04:45,522] Trial 608 finished with value: 0.1343544003185357 and parameters: {'kernel_type': 'Matern', 'length_scale': 0.15589697971758795, 'noise_level': 0.009487185714850056, 'constant_value': 1157.0861472659067, 'nu': 1.5}. Best is trial 276 with value: 0.13435392997433446.
[I 2024-12-04 15:04:45,683] Trial 614 finished with value: 0.13435433709843203 and parameters: {'kernel_type': 'Matern', 'length_scale': 6.07595567411315, 'noise_level': 0.02865730933947794, 'constant_value': 544.306693127309, 'nu': 1.5}. Best is trial 276 with value: 0.13435392997433446.
[I 2024-12-04 15:04:45,760] Trial 623 finished with value: 0.13435440439571483 and parameters: {'kernel_type': 'Matern', 'length_scale': 27.83117106928696, 'noise_level': 0.0025956380657678694, 'constant_value': 71061.40949865225, 'nu': 1.5}. Best is trial 276 with value: 0.13435392997433446.
[I 2024-12-04 15:04:46,546] Trial 616 finished with value: 1.2693635028570278 and parameters: {'kernel_type': 'Matern', 'length_scale': 122.22585449221665, 'noise_level': 2.4533132096960635e-06, 'constant_value': 0.2775006226412374, 'nu': 2.5}. Best is trial 276 with value: 0.13435392997433446.
[I 2024-12-04 15:04:47,209] Trial 613 finished with value: 0.13435439825197637 and parameters: {'kernel_type': 'Matern', 'length_scale': 29.74070981918984, 'noise_level': 0.4824406456851615, 'constant_value': 2239.682215189837, 'nu': 1.5}. Best is trial 276 with value: 0.13435392997433446.
[I 2024-12-04 15:04:49,552] Trial 619 finished with value: 0.13435443090316498 and parameters: {'kernel_type': 'Matern', 'length_scale': 7.870035328156144, 'noise_level': 0.0017540780631417824, 'constant_value': 16.517956751065352, 'nu': 1.5}. Best is trial 276 with value: 0.13435392997433446.
[I 2024-12-04 15:04:51,683] Trial 610 finished with value: 0.13435440927489875 and parameters: {'kernel_type': 'Matern', 'length_scale': 0.2727440669025381, 'noise_level': 1.002478615145549e-08, 'constant_value': 0.21317991666312555, 'nu': 1.5}. Best is trial 276 with value: 0.13435392997433446.
[I 2024-12-04 15:04:52,306] Trial 618 finished with value: 0.1725104025983182 and parameters: {'kernel_type': 'Matern', 'length_scale': 10.717969811519012, 'noise_level': 0.014254476366295869, 'constant_value': 250.0947770906151, 'nu': 0.5}. Best is trial 276 with value: 0.13435392997433446.
[I 2024-12-04 15:04:53,243] Trial 602 finished with value: 0.13435463605867712 and parameters: {'kernel_type': 'Matern', 'length_scale': 0.42219296361769915, 'noise_level': 0.005194429970198823, 'constant_value': 469.7448755175685, 'nu': 1.5}. Best is trial 276 with value: 0.13435392997433446.
[I 2024-12-04 15:04:55,830] Trial 626 finished with value: 0.13435407927720158 and parameters: {'kernel_type': 'Matern', 'length_scale': 4.567718072699622, 'noise_level': 0.009035133901513429, 'constant_value': 3701.2136711409717, 'nu': 1.5}. Best is trial 276 with value: 0.13435392997433446.
[I 2024-12-04 15:04:56,209] Trial 617 finished with value: 0.13435438699982466 and parameters: {'kernel_type': 'Matern', 'length_scale': 0.20223257699284036, 'noise_level': 0.0018739502715032228, 'constant_value': 94858.93720678902, 'nu': 1.5}. Best is trial 276 with value: 0.13435392997433446.
[I 2024-12-04 15:04:56,686] Trial 620 finished with value: 1.2693635028569483 and parameters: {'kernel_type': 'Matern', 'length_scale': 0.0054964350327453525, 'noise_level': 0.2393152676802283, 'constant_value': 830.142560512938, 'nu': 1.5}. Best is trial 276 with value: 0.13435392997433446.
[I 2024-12-04 15:04:59,064] Trial 615 finished with value: 0.15167297586736106 and parameters: {'kernel_type': 'RBF', 'length_scale': 0.7195856874905094, 'noise_level': 0.03326734065525532, 'constant_value': 7.967417407611849e-07, 'nu': 2.5}. Best is trial 276 with value: 0.13435392997433446.
[I 2024-12-04 15:04:59,349] Trial 628 finished with value: 1.2693635028569739 and parameters: {'kernel_type': 'RBF', 'length_scale': 0.008507041189048398, 'noise_level': 0.02686439695431176, 'constant_value': 11127.082975619636, 'nu': 1.5}. Best is trial 276 with value: 0.13435392997433446.
[I 2024-12-04 15:05:01,783] Trial 624 finished with value: 1.2693635028561736 and parameters: {'kernel_type': 'Matern', 'length_scale': 1040.1967730645918, 'noise_level': 0.0008053746407574445, 'constant_value': 207.04096728225716, 'nu': 2.5}. Best is trial 276 with value: 0.13435392997433446.
[I 2024-12-04 15:05:03,789] Trial 631 finished with value: 1.269363502859503 and parameters: {'kernel_type': 'Matern', 'length_scale': 0.016496260075700153, 'noise_level': 0.04176945694433805, 'constant_value': 95578.04934064412, 'nu': 1.5}. Best is trial 276 with value: 0.13435392997433446.
[I 2024-12-04 15:05:05,927] Trial 625 finished with value: 0.1343543825986533 and parameters: {'kernel_type': 'Matern', 'length_scale': 2.244604942584419, 'noise_level': 0.048374940864156356, 'constant_value': 73640.66605265235, 'nu': 1.5}. Best is trial 276 with value: 0.13435392997433446.
[I 2024-12-04 15:05:06,648] Trial 635 finished with value: 1.2693635028557062 and parameters: {'kernel_type': 'Matern', 'length_scale': 1.0975961324725425e-05, 'noise_level': 3.698744211079619e-08, 'constant_value': 35.52289989994269, 'nu': 1.5}. Best is trial 276 with value: 0.13435392997433446.
[I 2024-12-04 15:05:06,655] Trial 622 finished with value: 0.13435437901671837 and parameters: {'kernel_type': 'Matern', 'length_scale': 21.635629098073647, 'noise_level': 0.7242064506182988, 'constant_value': 868.5906543414962, 'nu': 1.5}. Best is trial 276 with value: 0.13435392997433446.
[I 2024-12-04 15:05:06,951] Trial 633 finished with value: 1.2693635028567676 and parameters: {'kernel_type': 'Matern', 'length_scale': 0.01874397836836105, 'noise_level': 9.601674622992148e-09, 'constant_value': 0.0010551001841516373, 'nu': 1.5}. Best is trial 276 with value: 0.13435392997433446.
[I 2024-12-04 15:05:08,934] Trial 632 finished with value: 1.26936350285707 and parameters: {'kernel_type': 'Matern', 'length_scale': 7.597811868922026e-05, 'noise_level': 5.7744137579181955e-06, 'constant_value': 0.030029642655368123, 'nu': 1.5}. Best is trial 276 with value: 0.13435392997433446.
[I 2024-12-04 15:05:09,284] Trial 629 finished with value: 0.13435439437141472 and parameters: {'kernel_type': 'Matern', 'length_scale': 1.6795102151073384, 'noise_level': 0.002475500296821726, 'constant_value': 833.2172789386533, 'nu': 1.5}. Best is trial 276 with value: 0.13435392997433446.
[I 2024-12-04 15:05:09,507] Trial 630 finished with value: 0.13435436761852546 and parameters: {'kernel_type': 'Matern', 'length_scale': 416.62608187218444, 'noise_level': 0.8250527628516618, 'constant_value': 60260.27192306901, 'nu': 1.5}. Best is trial 276 with value: 0.13435392997433446.
[I 2024-12-04 15:05:09,895] Trial 627 finished with value: 1.2693635028571666 and parameters: {'kernel_type': 'Matern', 'length_scale': 18420.88180186643, 'noise_level': 1.719058056131598e-09, 'constant_value': 0.03473720839249242, 'nu': 2.5}. Best is trial 276 with value: 0.13435392997433446.
[I 2024-12-04 15:05:10,224] Trial 638 finished with value: 0.13435440754905156 and parameters: {'kernel_type': 'Matern', 'length_scale': 1.3973986598503239, 'noise_level': 0.005705085774445909, 'constant_value': 1413.9134336063728, 'nu': 1.5}. Best is trial 276 with value: 0.13435392997433446.
[I 2024-12-04 15:05:15,558] Trial 634 finished with value: 1.2693635028569603 and parameters: {'kernel_type': 'RBF', 'length_scale': 854.3341196883961, 'noise_level': 1.2828234420296721e-06, 'constant_value': 13442.584789908533, 'nu': 0.5}. Best is trial 276 with value: 0.13435392997433446.
[I 2024-12-04 15:05:15,560] Trial 640 finished with value: 0.13435440394341022 and parameters: {'kernel_type': 'Matern', 'length_scale': 0.31787195868632584, 'noise_level': 0.010423154353623306, 'constant_value': 673.9631064950078, 'nu': 1.5}. Best is trial 276 with value: 0.13435392997433446.
[I 2024-12-04 15:05:16,171] Trial 636 finished with value: 0.13435438740231562 and parameters: {'kernel_type': 'Matern', 'length_scale': 5.261053033763569, 'noise_level': 0.008629031248617443, 'constant_value': 124.66087226020143, 'nu': 1.5}. Best is trial 276 with value: 0.13435392997433446.
[I 2024-12-04 15:05:19,420] Trial 645 finished with value: 0.13435438950826847 and parameters: {'kernel_type': 'Matern', 'length_scale': 1629.4076731193336, 'noise_level': 0.009628626244711721, 'constant_value': 62630.91426355144, 'nu': 1.5}. Best is trial 276 with value: 0.13435392997433446.
[I 2024-12-04 15:05:20,387] Trial 647 finished with value: 0.13435439210556813 and parameters: {'kernel_type': 'Matern', 'length_scale': 0.4339518138734555, 'noise_level': 0.5576149670947601, 'constant_value': 587.3627462033302, 'nu': 1.5}. Best is trial 276 with value: 0.13435392997433446.
[I 2024-12-04 15:05:22,922] Trial 642 finished with value: 1.2693635028568122 and parameters: {'kernel_type': 'Matern', 'length_scale': 1084.972417940915, 'noise_level': 0.002156583839136507, 'constant_value': 0.07215778502030916, 'nu': 1.5}. Best is trial 276 with value: 0.13435392997433446.
[I 2024-12-04 15:05:25,128] Trial 639 finished with value: 0.134354581828546 and parameters: {'kernel_type': 'Matern', 'length_scale': 0.8501987946858792, 'noise_level': 0.03368575198819415, 'constant_value': 84890.05880034677, 'nu': 1.5}. Best is trial 276 with value: 0.13435392997433446.
[I 2024-12-04 15:05:25,545] Trial 646 finished with value: 1.2693635028570058 and parameters: {'kernel_type': 'RBF', 'length_scale': 147.40085116053805, 'noise_level': 1.4363852502251771e-09, 'constant_value': 5.682268136586319e-05, 'nu': 0.5}. Best is trial 276 with value: 0.13435392997433446.
[I 2024-12-04 15:05:26,888] Trial 651 finished with value: 0.13435439682734893 and parameters: {'kernel_type': 'Matern', 'length_scale': 138.51742926420965, 'noise_level': 0.06984758976478193, 'constant_value': 99.76995103815553, 'nu': 1.5}. Best is trial 276 with value: 0.13435392997433446.
[I 2024-12-04 15:05:27,360] Trial 641 finished with value: 0.13435434900651258 and parameters: {'kernel_type': 'Matern', 'length_scale': 87.04100681719336, 'noise_level': 0.8624838234092347, 'constant_value': 91792.50961030119, 'nu': 1.5}. Best is trial 276 with value: 0.13435392997433446.
[I 2024-12-04 15:05:28,226] Trial 654 finished with value: 0.13435440690015046 and parameters: {'kernel_type': 'Matern', 'length_scale': 27.36723553581115, 'noise_level': 0.0030898907148871023, 'constant_value': 576.6917350821836, 'nu': 1.5}. Best is trial 276 with value: 0.13435392997433446.
[I 2024-12-04 15:05:29,397] Trial 655 finished with value: 0.13435423730651147 and parameters: {'kernel_type': 'Matern', 'length_scale': 47.933074886504635, 'noise_level': 0.007207487247574648, 'constant_value': 1785.0659116373101, 'nu': 1.5}. Best is trial 276 with value: 0.13435392997433446.
[I 2024-12-04 15:05:29,696] Trial 637 finished with value: 0.13435431718552973 and parameters: {'kernel_type': 'Matern', 'length_scale': 2.693340397095039, 'noise_level': 0.03506643156578966, 'constant_value': 723.8815002195126, 'nu': 1.5}. Best is trial 276 with value: 0.13435392997433446.
[I 2024-12-04 15:05:29,991] Trial 650 finished with value: 1.269363502855306 and parameters: {'kernel_type': 'RBF', 'length_scale': 0.08625002690107585, 'noise_level': 8.180369352537969e-07, 'constant_value': 7.784399984201893, 'nu': 2.5}. Best is trial 276 with value: 0.13435392997433446.
[I 2024-12-04 15:05:30,336] Trial 656 finished with value: 0.13435462543005983 and parameters: {'kernel_type': 'Matern', 'length_scale': 0.9444925462807388, 'noise_level': 0.010251204388767091, 'constant_value': 86293.70266132282, 'nu': 1.5}. Best is trial 276 with value: 0.13435392997433446.
[I 2024-12-04 15:05:31,506] Trial 653 finished with value: 1.269363502854492 and parameters: {'kernel_type': 'Matern', 'length_scale': 94.46691423614276, 'noise_level': 0.00017685366076201534, 'constant_value': 3.0346259275643765, 'nu': 1.5}. Best is trial 276 with value: 0.13435392997433446.
[I 2024-12-04 15:05:32,152] Trial 652 finished with value: 0.13435445055343334 and parameters: {'kernel_type': 'Matern', 'length_scale': 20.931715215056496, 'noise_level': 0.010465711457755902, 'constant_value': 17.20429846344403, 'nu': 1.5}. Best is trial 276 with value: 0.13435392997433446.
[I 2024-12-04 15:05:32,818] Trial 643 finished with value: 1.2693635028569692 and parameters: {'kernel_type': 'Matern', 'length_scale': 0.00028438563924472265, 'noise_level': 3.2573425531149673e-10, 'constant_value': 8.325785197207633e-07, 'nu': 1.5}. Best is trial 276 with value: 0.13435392997433446.
[I 2024-12-04 15:05:32,885] Trial 658 finished with value: 0.13435442374467224 and parameters: {'kernel_type': 'Matern', 'length_scale': 7.114080675706144, 'noise_level': 0.00039253983018892354, 'constant_value': 1118.4727028338298, 'nu': 1.5}. Best is trial 276 with value: 0.13435392997433446.
[I 2024-12-04 15:05:33,163] Trial 649 finished with value: 0.13435434749166308 and parameters: {'kernel_type': 'Matern', 'length_scale': 2685.648267762357, 'noise_level': 0.10779944838668536, 'constant_value': 173.43547498218305, 'nu': 1.5}. Best is trial 276 with value: 0.13435392997433446.
[I 2024-12-04 15:05:35,031] Trial 664 finished with value: 0.13435439127193982 and parameters: {'kernel_type': 'Matern', 'length_scale': 94.57715838956898, 'noise_level': 0.010441954330909865, 'constant_value': 2710.4981325281638, 'nu': 1.5}. Best is trial 276 with value: 0.13435392997433446.
[I 2024-12-04 15:05:35,520] Trial 662 finished with value: 0.1343543228783763 and parameters: {'kernel_type': 'Matern', 'length_scale': 443.41144302762154, 'noise_level': 0.008520595678679823, 'constant_value': 74660.52575876463, 'nu': 1.5}. Best is trial 276 with value: 0.13435392997433446.
[I 2024-12-04 15:05:35,993] Trial 644 finished with value: 0.13435439547753472 and parameters: {'kernel_type': 'Matern', 'length_scale': 2.845104067373979, 'noise_level': 0.0003973332747984231, 'constant_value': 92307.0995253735, 'nu': 1.5}. Best is trial 276 with value: 0.13435392997433446.
[I 2024-12-04 15:05:37,429] Trial 661 finished with value: 0.13435443452105275 and parameters: {'kernel_type': 'Matern', 'length_scale': 0.6536188930700528, 'noise_level': 7.518898478064728e-08, 'constant_value': 0.0040490048146003, 'nu': 1.5}. Best is trial 276 with value: 0.13435392997433446.
[I 2024-12-04 15:05:40,929] Trial 665 finished with value: 0.13435439374675048 and parameters: {'kernel_type': 'Matern', 'length_scale': 1.7094773675470176, 'noise_level': 0.6489066962609426, 'constant_value': 81592.45589927303, 'nu': 1.5}. Best is trial 276 with value: 0.13435392997433446.
[I 2024-12-04 15:05:44,298] Trial 660 finished with value: 1.2693635028569705 and parameters: {'kernel_type': 'Matern', 'length_scale': 164.20480014947813, 'noise_level': 4.595620681832655e-09, 'constant_value': 0.0001548253543242623, 'nu': 1.5}. Best is trial 667 with value: 0.1343538855187432.
[I 2024-12-04 15:05:45,460] Trial 657 finished with value: 1.2693635028567074 and parameters: {'kernel_type': 'RBF', 'length_scale': 125.12468808805255, 'noise_level': 3.7460434135154903e-06, 'constant_value': 1.1899976195263494e-05, 'nu': 1.5}. Best is trial 667 with value: 0.1343538855187432.
[I 2024-12-04 15:05:46,040] Trial 663 finished with value: 0.13435452011086896 and parameters: {'kernel_type': 'Matern', 'length_scale': 159.95010582229935, 'noise_level': 0.04306681169184589, 'constant_value': 511.0255521643148, 'nu': 1.5}. Best is trial 667 with value: 0.1343538855187432.
[I 2024-12-04 15:05:46,408] Trial 667 finished with value: 0.1343538855187432 and parameters: {'kernel_type': 'Matern', 'length_scale': 12.98362850278162, 'noise_level': 0.012805106534922776, 'constant_value': 94131.60276934414, 'nu': 1.5}. Best is trial 667 with value: 0.1343538855187432.
[I 2024-12-04 15:05:47,762] Trial 669 finished with value: 0.13435443365134958 and parameters: {'kernel_type': 'Matern', 'length_scale': 16.35948131956814, 'noise_level': 0.000437398357656876, 'constant_value': 8.991148514577773, 'nu': 1.5}. Best is trial 667 with value: 0.1343538855187432.
[I 2024-12-04 15:05:47,897] Trial 648 finished with value: 0.1343546211008101 and parameters: {'kernel_type': 'Matern', 'length_scale': 108.95775021524881, 'noise_level': 0.0008707751611398249, 'constant_value': 540.806121395515, 'nu': 1.5}. Best is trial 667 with value: 0.1343538855187432.
[I 2024-12-04 15:05:49,123] Trial 659 finished with value: 0.13435440087745593 and parameters: {'kernel_type': 'Matern', 'length_scale': 0.16082672046875915, 'noise_level': 0.009636186307252614, 'constant_value': 61578.366481499594, 'nu': 1.5}. Best is trial 667 with value: 0.1343538855187432.
