[I 2024-12-04 15:21:15,032] Trial 2472 finished with value: 1.2401112312461726 and parameters: {'kernel_type': 'RBF', 'length_scale': 79.55424998271069, 'noise_level': 1.8568315777519366e-05, 'constant_value': 12451.751257994132, 'nu': 0.5}. Best is trial 386 with value: 0.4872991004520934.
[I 2024-12-04 15:21:16,191] Trial 2477 finished with value: 1.24011123255511 and parameters: {'kernel_type': 'RBF', 'length_scale': 0.12933457230894302, 'noise_level': 6.514751385671523e-10, 'constant_value': 0.0013231323141907237, 'nu': 2.5}. Best is trial 386 with value: 0.4872991004520934.
[I 2024-12-04 15:21:17,069] Trial 2484 finished with value: 0.4883034204128842 and parameters: {'kernel_type': 'Matern', 'length_scale': 5440.980838182217, 'noise_level': 0.8566051912746036, 'constant_value': 321.96978966468566, 'nu': 0.5}. Best is trial 386 with value: 0.4872991004520934.
[I 2024-12-04 15:21:18,555] Trial 2481 finished with value: 0.5663938138842268 and parameters: {'kernel_type': 'Matern', 'length_scale': 9.88781296415659, 'noise_level': 0.012578950895968001, 'constant_value': 3856.4418977491027, 'nu': 2.5}. Best is trial 386 with value: 0.4872991004520934.
[I 2024-12-04 15:21:18,885] Trial 2478 finished with value: 0.48830342336493493 and parameters: {'kernel_type': 'Matern', 'length_scale': 69.10887917527943, 'noise_level': 0.001078667741144335, 'constant_value': 2.1828752147461388, 'nu': 0.5}. Best is trial 386 with value: 0.4872991004520934.
[I 2024-12-04 15:21:18,948] Trial 2479 finished with value: 0.48830340050944215 and parameters: {'kernel_type': 'Matern', 'length_scale': 166.64485050030333, 'noise_level': 0.9523101597886652, 'constant_value': 1734.2413859522303, 'nu': 0.5}. Best is trial 386 with value: 0.4872991004520934.
[I 2024-12-04 15:21:18,950] Trial 2483 finished with value: 1.261454797610333 and parameters: {'kernel_type': 'Matern', 'length_scale': 92734.91950269256, 'noise_level': 0.10161327119572562, 'constant_value': 1186.2133950285868, 'nu': 2.5}. Best is trial 386 with value: 0.4872991004520934.
[I 2024-12-04 15:21:18,964] Trial 2474 finished with value: 0.4883034165668664 and parameters: {'kernel_type': 'Matern', 'length_scale': 367.0487820597737, 'noise_level': 0.7603642770318302, 'constant_value': 392.4635133355594, 'nu': 0.5}. Best is trial 386 with value: 0.4872991004520934.
[I 2024-12-04 15:21:18,965] Trial 2487 finished with value: 1.261454795394147 and parameters: {'kernel_type': 'Matern', 'length_scale': 2.447371202002513, 'noise_level': 0.015137983876936364, 'constant_value': 44509.477217226624, 'nu': 0.5}. Best is trial 386 with value: 0.4872991004520934.
[I 2024-12-04 15:21:19,431] Trial 2490 finished with value: 1.2401112325761932 and parameters: {'kernel_type': 'Matern', 'length_scale': 97905.17714092534, 'noise_level': 0.012873162006081365, 'constant_value': 477.1222774233022, 'nu': 0.5}. Best is trial 386 with value: 0.4872991004520934.
[I 2024-12-04 15:21:19,436] Trial 2486 finished with value: 1.2401112328402724 and parameters: {'kernel_type': 'Matern', 'length_scale': 133.0651228319478, 'noise_level': 1.0243421759434454e-08, 'constant_value': 7747.07838976242, 'nu': 2.5}. Best is trial 386 with value: 0.4872991004520934.
[I 2024-12-04 15:21:20,929] Trial 2485 finished with value: 0.48830341791440507 and parameters: {'kernel_type': 'Matern', 'length_scale': 59869.60442781328, 'noise_level': 0.012566298534584236, 'constant_value': 4318.107919558813, 'nu': 0.5}. Best is trial 386 with value: 0.4872991004520934.
[I 2024-12-04 15:21:21,404] Trial 2482 finished with value: 0.4883034208727998 and parameters: {'kernel_type': 'Matern', 'length_scale': 0.603411307788745, 'noise_level': 0.01819041662500026, 'constant_value': 300.9288583486594, 'nu': 0.5}. Best is trial 386 with value: 0.4872991004520934.
[I 2024-12-04 15:21:21,988] Trial 2488 finished with value: 0.4883032779627904 and parameters: {'kernel_type': 'Matern', 'length_scale': 1290.3678934871282, 'noise_level': 0.0027652943654105228, 'constant_value': 97464.22931565186, 'nu': 0.5}. Best is trial 386 with value: 0.4872991004520934.
[I 2024-12-04 15:21:22,184] Trial 2480 finished with value: 1.2401112322749706 and parameters: {'kernel_type': 'RBF', 'length_scale': 40.861104935773014, 'noise_level': 0.00025198001486459996, 'constant_value': 7.452876209975978, 'nu': 0.5}. Best is trial 386 with value: 0.4872991004520934.
[I 2024-12-04 15:21:22,377] Trial 2489 finished with value: 0.4883033752909569 and parameters: {'kernel_type': 'Matern', 'length_scale': 25.44471043253922, 'noise_level': 0.712937968123318, 'constant_value': 45.01952937290869, 'nu': 0.5}. Best is trial 386 with value: 0.4872991004520934.
[I 2024-12-04 15:21:22,684] Trial 2494 finished with value: 0.4883033408950898 and parameters: {'kernel_type': 'Matern', 'length_scale': 36.00123083472512, 'noise_level': 0.003457220431023048, 'constant_value': 73897.89636558773, 'nu': 0.5}. Best is trial 386 with value: 0.4872991004520934.
[I 2024-12-04 15:21:22,694] Trial 2495 finished with value: 0.4883034148214203 and parameters: {'kernel_type': 'Matern', 'length_scale': 7374.978414557165, 'noise_level': 0.035050484931831466, 'constant_value': 39.044560681458805, 'nu': 0.5}. Best is trial 386 with value: 0.4872991004520934.
[I 2024-12-04 15:21:22,815] Trial 2491 finished with value: 1.2401112325805763 and parameters: {'kernel_type': 'Matern', 'length_scale': 6.201943804721437, 'noise_level': 2.0355434070702866e-06, 'constant_value': 6.428999545808096e-05, 'nu': 0.5}. Best is trial 386 with value: 0.4872991004520934.
[I 2024-12-04 15:21:23,936] Trial 2492 finished with value: 0.4883034190266023 and parameters: {'kernel_type': 'Matern', 'length_scale': 96671.73646362149, 'noise_level': 0.019251494420146203, 'constant_value': 82938.31239066958, 'nu': 0.5}. Best is trial 386 with value: 0.4872991004520934.
[I 2024-12-04 15:21:23,940] Trial 2496 finished with value: 0.4883034196491805 and parameters: {'kernel_type': 'Matern', 'length_scale': 55.808552202497616, 'noise_level': 0.003918184227554346, 'constant_value': 393.06740955793117, 'nu': 0.5}. Best is trial 386 with value: 0.4872991004520934.
[I 2024-12-04 15:21:24,268] Trial 2497 finished with value: 0.4883034170686316 and parameters: {'kernel_type': 'Matern', 'length_scale': 6786.665313399147, 'noise_level': 0.02146964581645631, 'constant_value': 3417.58492772915, 'nu': 0.5}. Best is trial 386 with value: 0.4872991004520934.
[I 2024-12-04 15:21:24,392] Trial 2499 finished with value: 0.48830340367883107 and parameters: {'kernel_type': 'Matern', 'length_scale': 57414.98397648257, 'noise_level': 0.9781118310605271, 'constant_value': 31551.57019096107, 'nu': 0.5}. Best is trial 386 with value: 0.4872991004520934.
[I 2024-12-04 15:21:24,397] Trial 2498 finished with value: 0.4883034190572126 and parameters: {'kernel_type': 'Matern', 'length_scale': 4671.609916344671, 'noise_level': 0.006680630891509982, 'constant_value': 98133.01797222524, 'nu': 0.5}. Best is trial 386 with value: 0.4872991004520934.
[I 2024-12-04 15:21:25,155] Trial 2493 finished with value: 1.2401112325797883 and parameters: {'kernel_type': 'RBF', 'length_scale': 5.968919738595311e-05, 'noise_level': 0.0008629165471770565, 'constant_value': 5.19236396233548e-07, 'nu': 2.5}. Best is trial 386 with value: 0.4872991004520934.
