[I 2024-12-04 15:07:07,751] Trial 756 finished with value: 1.2693635028553343 and parameters: {'kernel_type': 'Matern', 'length_scale': 0.01958612532625749, 'noise_level': 6.151597942936462e-08, 'constant_value': 1.1268238218886804, 'nu': 1.5}. Best is trial 667 with value: 0.1343538855187432.
[I 2024-12-04 15:07:07,907] Trial 735 finished with value: 0.13435439738455743 and parameters: {'kernel_type': 'Matern', 'length_scale': 1.0027821992861206, 'noise_level': 1.2982099962171996e-07, 'constant_value': 0.005736751260026283, 'nu': 1.5}. Best is trial 667 with value: 0.1343538855187432.
[I 2024-12-04 15:07:08,889] Trial 744 finished with value: 0.1343544637405249 and parameters: {'kernel_type': 'Matern', 'length_scale': 3305.2775203900146, 'noise_level': 0.3089573300980725, 'constant_value': 1513.8235067607716, 'nu': 1.5}. Best is trial 667 with value: 0.1343538855187432.
[I 2024-12-04 15:07:10,600] Trial 755 finished with value: 0.1516729764628494 and parameters: {'kernel_type': 'RBF', 'length_scale': 7.506062377857306, 'noise_level': 0.00025317705312817996, 'constant_value': 0.7256499422418845, 'nu': 0.5}. Best is trial 750 with value: 0.13435342446039877.
[I 2024-12-04 15:07:11,013] Trial 747 finished with value: 0.1343543889241272 and parameters: {'kernel_type': 'Matern', 'length_scale': 68.55954532107363, 'noise_level': 7.319567974408997e-05, 'constant_value': 54231.149438999535, 'nu': 1.5}. Best is trial 750 with value: 0.13435342446039877.
[I 2024-12-04 15:07:11,964] Trial 750 finished with value: 0.13435342446039877 and parameters: {'kernel_type': 'Matern', 'length_scale': 19.069279204465904, 'noise_level': 0.011660806800177632, 'constant_value': 91093.88871981694, 'nu': 1.5}. Best is trial 750 with value: 0.13435342446039877.
[I 2024-12-04 15:07:14,283] Trial 751 finished with value: 0.13435439821853545 and parameters: {'kernel_type': 'Matern', 'length_scale': 53.60145014541806, 'noise_level': 0.018560284072677905, 'constant_value': 95328.6342879743, 'nu': 1.5}. Best is trial 750 with value: 0.13435342446039877.
[I 2024-12-04 15:07:15,297] Trial 745 finished with value: 0.13435439473415742 and parameters: {'kernel_type': 'Matern', 'length_scale': 0.7712314283128419, 'noise_level': 3.4248529540762574e-06, 'constant_value': 0.008055427984386295, 'nu': 1.5}. Best is trial 750 with value: 0.13435342446039877.
[I 2024-12-04 15:07:16,673] Trial 746 finished with value: 1.269363502855457 and parameters: {'kernel_type': 'Matern', 'length_scale': 0.010021251562470588, 'noise_level': 0.0002024097981546965, 'constant_value': 3582.3369427826956, 'nu': 1.5}. Best is trial 750 with value: 0.13435342446039877.
[I 2024-12-04 15:07:16,781] Trial 749 finished with value: 0.1343545196944544 and parameters: {'kernel_type': 'Matern', 'length_scale': 32.76432296085923, 'noise_level': 0.27614189033516945, 'constant_value': 1402.5688465421633, 'nu': 1.5}. Best is trial 750 with value: 0.13435342446039877.
[I 2024-12-04 15:07:16,784] Trial 763 finished with value: 0.1516730006687748 and parameters: {'kernel_type': 'RBF', 'length_scale': 315.1149788064261, 'noise_level': 0.028531582706897388, 'constant_value': 46145.80903382591, 'nu': 1.5}. Best is trial 750 with value: 0.13435342446039877.
[I 2024-12-04 15:07:16,806] Trial 742 finished with value: 0.1343544034911841 and parameters: {'kernel_type': 'Matern', 'length_scale': 0.15258561746445393, 'noise_level': 0.0015259897802335262, 'constant_value': 240.17348940482873, 'nu': 1.5}. Best is trial 750 with value: 0.13435342446039877.
[I 2024-12-04 15:07:16,918] Trial 753 finished with value: 1.2693635028570713 and parameters: {'kernel_type': 'Matern', 'length_scale': 2980.10675314069, 'noise_level': 0.0017101030443530713, 'constant_value': 1042.689029100052, 'nu': 1.5}. Best is trial 750 with value: 0.13435342446039877.
[I 2024-12-04 15:07:19,193] Trial 752 finished with value: 0.13435426425964486 and parameters: {'kernel_type': 'Matern', 'length_scale': 1.6273746165911436, 'noise_level': 0.00463061268301837, 'constant_value': 298.857223174441, 'nu': 1.5}. Best is trial 750 with value: 0.13435342446039877.
[I 2024-12-04 15:07:19,559] Trial 760 finished with value: 0.1725104032102889 and parameters: {'kernel_type': 'Matern', 'length_scale': 1714.560965909789, 'noise_level': 0.9785229105872987, 'constant_value': 27312.510913709575, 'nu': 0.5}. Best is trial 750 with value: 0.13435342446039877.
[I 2024-12-04 15:07:19,738] Trial 768 finished with value: 0.13435437684524218 and parameters: {'kernel_type': 'Matern', 'length_scale': 664.529497211003, 'noise_level': 0.05967208177089282, 'constant_value': 81658.29872081045, 'nu': 1.5}. Best is trial 750 with value: 0.13435342446039877.
[I 2024-12-04 15:07:19,781] Trial 759 finished with value: 0.1343543972748865 and parameters: {'kernel_type': 'Matern', 'length_scale': 640.1259612344069, 'noise_level': 0.0007868798272525796, 'constant_value': 1167.8635551390419, 'nu': 1.5}. Best is trial 750 with value: 0.13435342446039877.
[I 2024-12-04 15:07:21,064] Trial 765 finished with value: 1.269363502856776 and parameters: {'kernel_type': 'Matern', 'length_scale': 0.01526272970951046, 'noise_level': 0.00011494612620314787, 'constant_value': 2.498463788366208, 'nu': 1.5}. Best is trial 750 with value: 0.13435342446039877.
[I 2024-12-04 15:07:21,107] Trial 766 finished with value: 0.13435436539979692 and parameters: {'kernel_type': 'Matern', 'length_scale': 53.110012885998934, 'noise_level': 0.0014012949109059026, 'constant_value': 56728.883683734435, 'nu': 1.5}. Best is trial 750 with value: 0.13435342446039877.
[I 2024-12-04 15:07:21,219] Trial 761 finished with value: 0.1343543327721533 and parameters: {'kernel_type': 'Matern', 'length_scale': 37.588329615638514, 'noise_level': 0.6551459053579247, 'constant_value': 4148.899611502924, 'nu': 1.5}. Best is trial 750 with value: 0.13435342446039877.
[I 2024-12-04 15:07:21,290] Trial 754 finished with value: 1.269363502857184 and parameters: {'kernel_type': 'Matern', 'length_scale': 0.000110563577491541, 'noise_level': 0.6782130069926703, 'constant_value': 0.00130219347674258, 'nu': 2.5}. Best is trial 750 with value: 0.13435342446039877.
[I 2024-12-04 15:07:23,693] Trial 762 finished with value: 0.1343543959093889 and parameters: {'kernel_type': 'Matern', 'length_scale': 1.5457468253759516, 'noise_level': 0.00048311671639129705, 'constant_value': 2063.130279329655, 'nu': 1.5}. Best is trial 750 with value: 0.13435342446039877.
[I 2024-12-04 15:07:25,372] Trial 767 finished with value: 0.1343544005536347 and parameters: {'kernel_type': 'Matern', 'length_scale': 37.54477585624519, 'noise_level': 0.05446195117390965, 'constant_value': 2387.612144256542, 'nu': 1.5}. Best is trial 750 with value: 0.13435342446039877.
[I 2024-12-04 15:07:25,639] Trial 769 finished with value: 0.13435440243321803 and parameters: {'kernel_type': 'Matern', 'length_scale': 50.13548326131473, 'noise_level': 0.5798378305065697, 'constant_value': 50390.45497226728, 'nu': 1.5}. Best is trial 750 with value: 0.13435342446039877.
[I 2024-12-04 15:07:25,841] Trial 757 finished with value: 0.13435439154562243 and parameters: {'kernel_type': 'Matern', 'length_scale': 74.08377282938478, 'noise_level': 0.017417615724511216, 'constant_value': 221.70085371503006, 'nu': 1.5}. Best is trial 750 with value: 0.13435342446039877.
[I 2024-12-04 15:07:25,907] Trial 764 finished with value: 0.13435437147933468 and parameters: {'kernel_type': 'Matern', 'length_scale': 15.613441847719649, 'noise_level': 0.05296016362672569, 'constant_value': 2403.005858940405, 'nu': 1.5}. Best is trial 750 with value: 0.13435342446039877.
[I 2024-12-04 15:07:27,954] Trial 770 finished with value: 0.1343544009625706 and parameters: {'kernel_type': 'Matern', 'length_scale': 2.031379347139648, 'noise_level': 0.009404231800787078, 'constant_value': 52453.25730865457, 'nu': 1.5}. Best is trial 750 with value: 0.13435342446039877.
[I 2024-12-04 15:07:31,398] Trial 758 finished with value: 0.13435440014160197 and parameters: {'kernel_type': 'Matern', 'length_scale': 0.20857820880000455, 'noise_level': 1.705130359500032e-07, 'constant_value': 2.9181274511901844e-05, 'nu': 1.5}. Best is trial 750 with value: 0.13435342446039877.
[I 2024-12-04 15:07:35,016] Trial 780 finished with value: 1.3007745979657548 and parameters: {'kernel_type': 'Matern', 'length_scale': 0.9591465613868938, 'noise_level': 0.0012860197593809256, 'constant_value': 66192.98208366644, 'nu': 1.5}. Best is trial 750 with value: 0.13435342446039877.
[I 2024-12-04 15:07:35,210] Trial 773 finished with value: 0.1343555523211721 and parameters: {'kernel_type': 'Matern', 'length_scale': 81.83770789701869, 'noise_level': 0.04482512784113184, 'constant_value': 69082.74713748347, 'nu': 1.5}. Best is trial 750 with value: 0.13435342446039877.
[I 2024-12-04 15:07:35,260] Trial 774 finished with value: 0.13435440294214893 and parameters: {'kernel_type': 'Matern', 'length_scale': 286.3512864878388, 'noise_level': 0.0011841860828732003, 'constant_value': 65478.969940089504, 'nu': 1.5}. Best is trial 750 with value: 0.13435342446039877.
[I 2024-12-04 15:07:35,337] Trial 777 finished with value: 0.1343543999173441 and parameters: {'kernel_type': 'Matern', 'length_scale': 2023.8542054898542, 'noise_level': 0.3561328883668449, 'constant_value': 87830.14503191461, 'nu': 1.5}. Best is trial 750 with value: 0.13435342446039877.
[I 2024-12-04 15:07:35,386] Trial 771 finished with value: 0.13435439946686337 and parameters: {'kernel_type': 'Matern', 'length_scale': 0.16702792282617426, 'noise_level': 0.12218764549519455, 'constant_value': 191.73851036982745, 'nu': 1.5}. Best is trial 750 with value: 0.13435342446039877.
[I 2024-12-04 15:07:37,109] Trial 783 finished with value: 0.1343544008601906 and parameters: {'kernel_type': 'Matern', 'length_scale': 115.65434644409707, 'noise_level': 0.008148098874805441, 'constant_value': 71370.47529214526, 'nu': 1.5}. Best is trial 750 with value: 0.13435342446039877.
[I 2024-12-04 15:07:40,476] Trial 784 finished with value: 0.13435438164507132 and parameters: {'kernel_type': 'Matern', 'length_scale': 33.082458871058336, 'noise_level': 0.0030563939118243926, 'constant_value': 92883.38700531896, 'nu': 1.5}. Best is trial 750 with value: 0.13435342446039877.
[I 2024-12-04 15:07:40,818] Trial 779 finished with value: 0.13435631841160475 and parameters: {'kernel_type': 'Matern', 'length_scale': 24.797160384128947, 'noise_level': 0.00752776001539793, 'constant_value': 2434.1637747949903, 'nu': 1.5}. Best is trial 750 with value: 0.13435342446039877.
[I 2024-12-04 15:07:41,193] Trial 772 finished with value: 0.1343544224007624 and parameters: {'kernel_type': 'Matern', 'length_scale': 1.8407910048824943, 'noise_level': 0.06036472850051758, 'constant_value': 4.604876258942084, 'nu': 1.5}. Best is trial 750 with value: 0.13435342446039877.
[I 2024-12-04 15:07:42,113] Trial 781 finished with value: 0.1343543999906704 and parameters: {'kernel_type': 'Matern', 'length_scale': 1.12917080500398, 'noise_level': 0.043617174453831196, 'constant_value': 993.1731733841507, 'nu': 1.5}. Best is trial 750 with value: 0.13435342446039877.
[I 2024-12-04 15:07:45,761] Trial 775 finished with value: 1.2693635028569648 and parameters: {'kernel_type': 'Matern', 'length_scale': 2184.38370999497, 'noise_level': 0.00034383813654536335, 'constant_value': 10.00243403649313, 'nu': 1.5}. Best is trial 750 with value: 0.13435342446039877.
[I 2024-12-04 15:07:47,632] Trial 786 finished with value: 0.1485982371704399 and parameters: {'kernel_type': 'Matern', 'length_scale': 3699.8853803609118, 'noise_level': 0.032122152777731054, 'constant_value': 126.21192751508805, 'nu': 2.5}. Best is trial 750 with value: 0.13435342446039877.
[I 2024-12-04 15:07:48,365] Trial 794 finished with value: 1.2693635028566803 and parameters: {'kernel_type': 'Matern', 'length_scale': 1322.8958196258302, 'noise_level': 0.016092633998176446, 'constant_value': 20.707481351039252, 'nu': 1.5}. Best is trial 750 with value: 0.13435342446039877.
[I 2024-12-04 15:07:48,368] Trial 778 finished with value: 1.2693635028569747 and parameters: {'kernel_type': 'Matern', 'length_scale': 19002.98907769149, 'noise_level': 0.00012284182095848343, 'constant_value': 41102.654004410004, 'nu': 1.5}. Best is trial 750 with value: 0.13435342446039877.
[I 2024-12-04 15:07:51,139] Trial 790 finished with value: 0.1343543301617352 and parameters: {'kernel_type': 'Matern', 'length_scale': 6.594839735968311, 'noise_level': 0.0067536431979586245, 'constant_value': 1.3536873925176505, 'nu': 1.5}. Best is trial 750 with value: 0.13435342446039877.
[I 2024-12-04 15:07:51,561] Trial 791 finished with value: 0.15167297797981188 and parameters: {'kernel_type': 'RBF', 'length_scale': 5.140145479960515, 'noise_level': 0.7682808968312929, 'constant_value': 843.3156763438712, 'nu': 0.5}. Best is trial 750 with value: 0.13435342446039877.
[I 2024-12-04 15:07:52,716] Trial 789 finished with value: 0.13435427301847536 and parameters: {'kernel_type': 'Matern', 'length_scale': 560.9684009407972, 'noise_level': 0.0008651094501647835, 'constant_value': 428.58360931342054, 'nu': 1.5}. Best is trial 750 with value: 0.13435342446039877.
[I 2024-12-04 15:07:53,273] Trial 788 finished with value: 0.17251039992733355 and parameters: {'kernel_type': 'Matern', 'length_scale': 15.154038060574182, 'noise_level': 0.9377677613714686, 'constant_value': 5348.145910464636, 'nu': 0.5}. Best is trial 750 with value: 0.13435342446039877.
[I 2024-12-04 15:07:56,917] Trial 798 finished with value: 1.2693635028573083 and parameters: {'kernel_type': 'RBF', 'length_scale': 0.003983715001593423, 'noise_level': 2.7028010983412955e-07, 'constant_value': 1.205367063414094, 'nu': 0.5}. Best is trial 750 with value: 0.13435342446039877.
[I 2024-12-04 15:07:57,493] Trial 799 finished with value: 0.13435439493161722 and parameters: {'kernel_type': 'Matern', 'length_scale': 23.359578736408153, 'noise_level': 0.47008306360486224, 'constant_value': 78940.33751700967, 'nu': 1.5}. Best is trial 750 with value: 0.13435342446039877.
[I 2024-12-04 15:07:57,498] Trial 796 finished with value: 0.1343543597372628 and parameters: {'kernel_type': 'Matern', 'length_scale': 4093.8932472225374, 'noise_level': 0.5830324718980789, 'constant_value': 991.7820151316267, 'nu': 1.5}. Best is trial 750 with value: 0.13435342446039877.
[I 2024-12-04 15:07:58,174] Trial 797 finished with value: 0.13435450415510083 and parameters: {'kernel_type': 'Matern', 'length_scale': 24.41453579270904, 'noise_level': 0.008333661842021148, 'constant_value': 1088.0787450733176, 'nu': 1.5}. Best is trial 750 with value: 0.13435342446039877.
[I 2024-12-04 15:07:58,199] Trial 785 finished with value: 1.2693635028571926 and parameters: {'kernel_type': 'RBF', 'length_scale': 312.081638830103, 'noise_level': 1.4887820505253698e-05, 'constant_value': 242.85590638678465, 'nu': 1.5}. Best is trial 750 with value: 0.13435342446039877.
[I 2024-12-04 15:07:58,220] Trial 793 finished with value: 0.15167295587685234 and parameters: {'kernel_type': 'RBF', 'length_scale': 856.1679159538347, 'noise_level': 0.8917799864698647, 'constant_value': 171.3969953957649, 'nu': 1.5}. Best is trial 750 with value: 0.13435342446039877.
[I 2024-12-04 15:07:58,999] Trial 776 finished with value: 0.13435410715407614 and parameters: {'kernel_type': 'Matern', 'length_scale': 10.346158778764602, 'noise_level': 0.0026970189545459616, 'constant_value': 77692.3872466652, 'nu': 1.5}. Best is trial 750 with value: 0.13435342446039877.
[I 2024-12-04 15:07:59,359] Trial 792 finished with value: 0.13435425690658342 and parameters: {'kernel_type': 'Matern', 'length_scale': 117.2842049173095, 'noise_level': 0.0027714634928757017, 'constant_value': 498.6002817873678, 'nu': 1.5}. Best is trial 750 with value: 0.13435342446039877.
[I 2024-12-04 15:08:00,622] Trial 787 finished with value: 1.269363502857725 and parameters: {'kernel_type': 'Matern', 'length_scale': 0.008685777784614768, 'noise_level': 2.1107055626759494e-07, 'constant_value': 0.025793283076101244, 'nu': 0.5}. Best is trial 750 with value: 0.13435342446039877.
[I 2024-12-04 15:08:01,974] Trial 795 finished with value: 0.1343544144027609 and parameters: {'kernel_type': 'Matern', 'length_scale': 0.5995489873165118, 'noise_level': 0.060861922272538775, 'constant_value': 252.9269352761594, 'nu': 1.5}. Best is trial 750 with value: 0.13435342446039877.
[I 2024-12-04 15:08:04,268] Trial 810 finished with value: 0.13435440014388186 and parameters: {'kernel_type': 'Matern', 'length_scale': 1.475113803661154, 'noise_level': 0.0006250010633990731, 'constant_value': 43855.587917120334, 'nu': 1.5}. Best is trial 750 with value: 0.13435342446039877.
[I 2024-12-04 15:08:04,533] Trial 782 finished with value: 1.2693635028570396 and parameters: {'kernel_type': 'Matern', 'length_scale': 72462.39942389762, 'noise_level': 3.331461769784761e-10, 'constant_value': 0.24104095565964126, 'nu': 1.5}. Best is trial 750 with value: 0.13435342446039877.
[I 2024-12-04 15:08:05,329] Trial 804 finished with value: 0.13435430419064537 and parameters: {'kernel_type': 'Matern', 'length_scale': 83.98873116152005, 'noise_level': 0.007291525289781629, 'constant_value': 26.805265727010944, 'nu': 1.5}. Best is trial 750 with value: 0.13435342446039877.
[I 2024-12-04 15:08:07,781] Trial 807 finished with value: 0.1343543672983645 and parameters: {'kernel_type': 'Matern', 'length_scale': 2.061720448935332, 'noise_level': 0.0218683571160554, 'constant_value': 47995.063475681905, 'nu': 1.5}. Best is trial 750 with value: 0.13435342446039877.
[I 2024-12-04 15:08:08,480] Trial 809 finished with value: 0.13435439625579196 and parameters: {'kernel_type': 'Matern', 'length_scale': 45.23535621292875, 'noise_level': 6.607019058687511e-05, 'constant_value': 71641.39511141939, 'nu': 1.5}. Best is trial 750 with value: 0.13435342446039877.
[I 2024-12-04 15:08:08,980] Trial 800 finished with value: 0.13435432495699454 and parameters: {'kernel_type': 'Matern', 'length_scale': 3.7551925197724945, 'noise_level': 0.004495697751560828, 'constant_value': 1105.0170390933663, 'nu': 1.5}. Best is trial 750 with value: 0.13435342446039877.
[I 2024-12-04 15:08:10,863] Trial 805 finished with value: 0.14859826937481435 and parameters: {'kernel_type': 'Matern', 'length_scale': 2.900834908680036, 'noise_level': 0.0001704514493570777, 'constant_value': 52852.62384469186, 'nu': 2.5}. Best is trial 750 with value: 0.13435342446039877.
[I 2024-12-04 15:08:12,627] Trial 801 finished with value: 1.2693635028572503 and parameters: {'kernel_type': 'Matern', 'length_scale': 892.8955286634573, 'noise_level': 8.594461822483968e-05, 'constant_value': 735.4583712892818, 'nu': 1.5}. Best is trial 750 with value: 0.13435342446039877.
[I 2024-12-04 15:08:12,648] Trial 802 finished with value: 0.134354382175353 and parameters: {'kernel_type': 'Matern', 'length_scale': 3954.6173785306582, 'noise_level': 0.012822914722553756, 'constant_value': 546.5318733896643, 'nu': 1.5}. Best is trial 750 with value: 0.13435342446039877.
[I 2024-12-04 15:08:13,706] Trial 811 finished with value: 1.269363502857234 and parameters: {'kernel_type': 'RBF', 'length_scale': 0.0001237600354305824, 'noise_level': 5.244311094542618e-05, 'constant_value': 1859.7279886985243, 'nu': 2.5}. Best is trial 750 with value: 0.13435342446039877.
[I 2024-12-04 15:08:14,939] Trial 808 finished with value: 0.13435414930731718 and parameters: {'kernel_type': 'Matern', 'length_scale': 22.48913255908474, 'noise_level': 0.0016863475766451719, 'constant_value': 76361.89890766978, 'nu': 1.5}. Best is trial 750 with value: 0.13435342446039877.
[I 2024-12-04 15:08:15,117] Trial 812 finished with value: 0.13435439687686357 and parameters: {'kernel_type': 'Matern', 'length_scale': 2.141728313198258, 'noise_level': 0.00019846677967292112, 'constant_value': 63099.71128173172, 'nu': 1.5}. Best is trial 750 with value: 0.13435342446039877.
[I 2024-12-04 15:08:15,434] Trial 803 finished with value: 0.13435427392018104 and parameters: {'kernel_type': 'Matern', 'length_scale': 13.053404781709727, 'noise_level': 0.04175949654274019, 'constant_value': 81752.61319486679, 'nu': 1.5}. Best is trial 750 with value: 0.13435342446039877.
[I 2024-12-04 15:08:18,070] Trial 815 finished with value: 0.13435443002768357 and parameters: {'kernel_type': 'Matern', 'length_scale': 1951.00586044117, 'noise_level': 0.004261872101683416, 'constant_value': 4746.019771072245, 'nu': 1.5}. Best is trial 750 with value: 0.13435342446039877.
[I 2024-12-04 15:08:18,102] Trial 814 finished with value: 1.3007739235928963 and parameters: {'kernel_type': 'RBF', 'length_scale': 5.520581213824266e-05, 'noise_level': 1.2916578900191497e-07, 'constant_value': 105.72319460294682, 'nu': 1.5}. Best is trial 750 with value: 0.13435342446039877.
[I 2024-12-04 15:08:18,119] Trial 816 finished with value: 0.13435439799599672 and parameters: {'kernel_type': 'Matern', 'length_scale': 84.38371733904519, 'noise_level': 0.0014726211935263893, 'constant_value': 706.0331071599303, 'nu': 1.5}. Best is trial 750 with value: 0.13435342446039877.
[I 2024-12-04 15:08:18,122] Trial 806 finished with value: 0.1343543290110654 and parameters: {'kernel_type': 'Matern', 'length_scale': 11.76138574732378, 'noise_level': 0.0024652133640748197, 'constant_value': 78232.09637220377, 'nu': 1.5}. Best is trial 750 with value: 0.13435342446039877.
[I 2024-12-04 15:08:21,420] Trial 821 finished with value: 0.13435437953819032 and parameters: {'kernel_type': 'Matern', 'length_scale': 223.22976921318374, 'noise_level': 0.0014422460321141697, 'constant_value': 1206.4637360412403, 'nu': 1.5}. Best is trial 750 with value: 0.13435342446039877.
