[I 2024-12-04 12:06:36,784] Trial 937 finished with value: 0.9511759412675146 and parameters: {'n_estimators': 418, 'max_depth': 37, 'min_samples_split': 5, 'min_samples_leaf': 11, 'max_features': 'log2', 'bootstrap': False, 'criterion': 'squared_error'}. Best is trial 341 with value: 0.2909369124469028.
[I 2024-12-04 12:06:39,300] Trial 948 finished with value: 0.44412107971766734 and parameters: {'n_estimators': 300, 'max_depth': 41, 'min_samples_split': 6, 'min_samples_leaf': 2, 'max_features': 'sqrt', 'bootstrap': False, 'criterion': 'squared_error'}. Best is trial 341 with value: 0.2909369124469028.
[I 2024-12-04 12:06:39,365] Trial 943 finished with value: 0.4406635406704422 and parameters: {'n_estimators': 498, 'max_depth': 44, 'min_samples_split': 5, 'min_samples_leaf': 2, 'max_features': 'sqrt', 'bootstrap': False, 'criterion': 'squared_error'}. Best is trial 341 with value: 0.2909369124469028.
[I 2024-12-04 12:06:39,471] Trial 940 finished with value: 0.3046153162664292 and parameters: {'n_estimators': 105, 'max_depth': 43, 'min_samples_split': 2, 'min_samples_leaf': 1, 'max_features': 'sqrt', 'bootstrap': False, 'criterion': 'squared_error'}. Best is trial 341 with value: 0.2909369124469028.
[I 2024-12-04 12:06:40,543] Trial 945 finished with value: 0.3156948371058096 and parameters: {'n_estimators': 296, 'max_depth': 48, 'min_samples_split': 7, 'min_samples_leaf': 1, 'max_features': 'sqrt', 'bootstrap': False, 'criterion': 'squared_error'}. Best is trial 341 with value: 0.2909369124469028.
[I 2024-12-04 12:06:41,904] Trial 936 finished with value: 0.38101001481164976 and parameters: {'n_estimators': 663, 'max_depth': 48, 'min_samples_split': 3, 'min_samples_leaf': 1, 'max_features': None, 'bootstrap': False, 'criterion': 'squared_error'}. Best is trial 341 with value: 0.2909369124469028.
[I 2024-12-04 12:06:42,415] Trial 953 finished with value: 0.3314487469715462 and parameters: {'n_estimators': 351, 'max_depth': 35, 'min_samples_split': 2, 'min_samples_leaf': 1, 'max_features': 'sqrt', 'bootstrap': False, 'criterion': 'squared_error'}. Best is trial 341 with value: 0.2909369124469028.
[I 2024-12-04 12:06:43,361] Trial 944 finished with value: 0.7854560247264011 and parameters: {'n_estimators': 475, 'max_depth': 8, 'min_samples_split': 5, 'min_samples_leaf': 5, 'max_features': 'sqrt', 'bootstrap': True, 'criterion': 'absolute_error'}. Best is trial 341 with value: 0.2909369124469028.
[I 2024-12-04 12:06:43,643] Trial 952 finished with value: 0.30590802720343735 and parameters: {'n_estimators': 113, 'max_depth': 49, 'min_samples_split': 4, 'min_samples_leaf': 1, 'max_features': 'sqrt', 'bootstrap': False, 'criterion': 'squared_error'}. Best is trial 341 with value: 0.2909369124469028.
[I 2024-12-04 12:06:43,737] Trial 921 finished with value: 0.4974060714407567 and parameters: {'n_estimators': 1000, 'max_depth': 50, 'min_samples_split': 4, 'min_samples_leaf': 2, 'max_features': 'sqrt', 'bootstrap': True, 'criterion': 'absolute_error'}. Best is trial 341 with value: 0.2909369124469028.
[I 2024-12-04 12:06:44,010] Trial 949 finished with value: 0.6085302103014276 and parameters: {'n_estimators': 836, 'max_depth': 23, 'min_samples_split': 13, 'min_samples_leaf': 1, 'max_features': 'log2', 'bootstrap': False, 'criterion': 'squared_error'}. Best is trial 341 with value: 0.2909369124469028.
[I 2024-12-04 12:06:45,201] Trial 959 finished with value: 0.3000500954567332 and parameters: {'n_estimators': 326, 'max_depth': 44, 'min_samples_split': 3, 'min_samples_leaf': 1, 'max_features': 'sqrt', 'bootstrap': False, 'criterion': 'squared_error'}. Best is trial 341 with value: 0.2909369124469028.
[I 2024-12-04 12:06:45,208] Trial 941 finished with value: 0.49367262015481567 and parameters: {'n_estimators': 218, 'max_depth': 48, 'min_samples_split': 2, 'min_samples_leaf': 2, 'max_features': 'sqrt', 'bootstrap': True, 'criterion': 'absolute_error'}. Best is trial 341 with value: 0.2909369124469028.
[I 2024-12-04 12:06:45,600] Trial 954 finished with value: 0.299048145060066 and parameters: {'n_estimators': 299, 'max_depth': 50, 'min_samples_split': 4, 'min_samples_leaf': 1, 'max_features': 'sqrt', 'bootstrap': False, 'criterion': 'squared_error'}. Best is trial 341 with value: 0.2909369124469028.
[I 2024-12-04 12:06:45,745] Trial 950 finished with value: 0.3039522985647527 and parameters: {'n_estimators': 403, 'max_depth': 50, 'min_samples_split': 5, 'min_samples_leaf': 1, 'max_features': 'sqrt', 'bootstrap': False, 'criterion': 'squared_error'}. Best is trial 341 with value: 0.2909369124469028.
[I 2024-12-04 12:06:45,756] Trial 946 finished with value: 0.30061103628972724 and parameters: {'n_estimators': 635, 'max_depth': 50, 'min_samples_split': 4, 'min_samples_leaf': 1, 'max_features': 'sqrt', 'bootstrap': False, 'criterion': 'squared_error'}. Best is trial 341 with value: 0.2909369124469028.
[I 2024-12-04 12:06:46,109] Trial 956 finished with value: 0.4448492141159385 and parameters: {'n_estimators': 303, 'max_depth': 43, 'min_samples_split': 2, 'min_samples_leaf': 2, 'max_features': 'sqrt', 'bootstrap': False, 'criterion': 'squared_error'}. Best is trial 341 with value: 0.2909369124469028.
[I 2024-12-04 12:06:46,239] Trial 942 finished with value: 0.3188007354316311 and parameters: {'n_estimators': 534, 'max_depth': 45, 'min_samples_split': 3, 'min_samples_leaf': 1, 'max_features': 'sqrt', 'bootstrap': True, 'criterion': 'squared_error'}. Best is trial 341 with value: 0.2909369124469028.
[I 2024-12-04 12:06:46,510] Trial 947 finished with value: 0.7960776042303778 and parameters: {'n_estimators': 349, 'max_depth': 27, 'min_samples_split': 17, 'min_samples_leaf': 2, 'max_features': 'log2', 'bootstrap': True, 'criterion': 'squared_error'}. Best is trial 341 with value: 0.2909369124469028.
[I 2024-12-04 12:06:49,210] Trial 957 finished with value: 0.3010591194119132 and parameters: {'n_estimators': 237, 'max_depth': 43, 'min_samples_split': 3, 'min_samples_leaf': 1, 'max_features': 'sqrt', 'bootstrap': False, 'criterion': 'squared_error'}. Best is trial 341 with value: 0.2909369124469028.
[I 2024-12-04 12:06:49,242] Trial 958 finished with value: 0.695863904353774 and parameters: {'n_estimators': 300, 'max_depth': 46, 'min_samples_split': 4, 'min_samples_leaf': 2, 'max_features': 'log2', 'bootstrap': False, 'criterion': 'squared_error'}. Best is trial 341 with value: 0.2909369124469028.
[I 2024-12-04 12:06:49,500] Trial 963 finished with value: 0.44515362741556874 and parameters: {'n_estimators': 237, 'max_depth': 43, 'min_samples_split': 3, 'min_samples_leaf': 2, 'max_features': 'sqrt', 'bootstrap': False, 'criterion': 'squared_error'}. Best is trial 341 with value: 0.2909369124469028.
[I 2024-12-04 12:06:49,709] Trial 955 finished with value: 0.3057959799742235 and parameters: {'n_estimators': 252, 'max_depth': 43, 'min_samples_split': 2, 'min_samples_leaf': 1, 'max_features': 'sqrt', 'bootstrap': False, 'criterion': 'squared_error'}. Best is trial 341 with value: 0.2909369124469028.
[I 2024-12-04 12:06:50,475] Trial 961 finished with value: 0.2934437956044893 and parameters: {'n_estimators': 518, 'max_depth': 50, 'min_samples_split': 3, 'min_samples_leaf': 1, 'max_features': 'sqrt', 'bootstrap': False, 'criterion': 'squared_error'}. Best is trial 341 with value: 0.2909369124469028.
[I 2024-12-04 12:06:51,258] Trial 951 finished with value: 0.2988360722433222 and parameters: {'n_estimators': 727, 'max_depth': 50, 'min_samples_split': 2, 'min_samples_leaf': 1, 'max_features': 'sqrt', 'bootstrap': False, 'criterion': 'squared_error'}. Best is trial 341 with value: 0.2909369124469028.
[I 2024-12-04 12:06:52,357] Trial 965 finished with value: 0.30237616805359024 and parameters: {'n_estimators': 110, 'max_depth': 50, 'min_samples_split': 5, 'min_samples_leaf': 1, 'max_features': 'sqrt', 'bootstrap': False, 'criterion': 'squared_error'}. Best is trial 341 with value: 0.2909369124469028.
[I 2024-12-04 12:06:52,596] Trial 960 finished with value: 0.2930492834740009 and parameters: {'n_estimators': 177, 'max_depth': 50, 'min_samples_split': 3, 'min_samples_leaf': 1, 'max_features': 'sqrt', 'bootstrap': False, 'criterion': 'squared_error'}. Best is trial 341 with value: 0.2909369124469028.
[I 2024-12-04 12:06:53,894] Trial 966 finished with value: 0.30023034637379126 and parameters: {'n_estimators': 320, 'max_depth': 44, 'min_samples_split': 3, 'min_samples_leaf': 1, 'max_features': 'sqrt', 'bootstrap': False, 'criterion': 'squared_error'}. Best is trial 341 with value: 0.2909369124469028.
[I 2024-12-04 12:06:53,926] Trial 968 finished with value: 0.6962650955812689 and parameters: {'n_estimators': 336, 'max_depth': 50, 'min_samples_split': 24, 'min_samples_leaf': 2, 'max_features': 'log2', 'bootstrap': False, 'criterion': 'squared_error'}. Best is trial 341 with value: 0.2909369124469028.
[I 2024-12-04 12:06:56,451] Trial 973 finished with value: 0.4455928519896328 and parameters: {'n_estimators': 114, 'max_depth': 43, 'min_samples_split': 4, 'min_samples_leaf': 2, 'max_features': 'sqrt', 'bootstrap': False, 'criterion': 'squared_error'}. Best is trial 341 with value: 0.2909369124469028.
[I 2024-12-04 12:06:56,511] Trial 972 finished with value: 0.29463617517638974 and parameters: {'n_estimators': 111, 'max_depth': 50, 'min_samples_split': 3, 'min_samples_leaf': 1, 'max_features': 'sqrt', 'bootstrap': False, 'criterion': 'squared_error'}. Best is trial 341 with value: 0.2909369124469028.
[I 2024-12-04 12:06:57,313] Trial 981 finished with value: 0.4425004039948871 and parameters: {'n_estimators': 103, 'max_depth': 50, 'min_samples_split': 3, 'min_samples_leaf': 2, 'max_features': 'sqrt', 'bootstrap': False, 'criterion': 'squared_error'}. Best is trial 341 with value: 0.2909369124469028.
[I 2024-12-04 12:06:59,128] Trial 971 finished with value: 0.4458189048056393 and parameters: {'n_estimators': 209, 'max_depth': 42, 'min_samples_split': 4, 'min_samples_leaf': 2, 'max_features': 'sqrt', 'bootstrap': False, 'criterion': 'squared_error'}. Best is trial 341 with value: 0.2909369124469028.
[I 2024-12-04 12:07:00,058] Trial 969 finished with value: 0.47704071882512944 and parameters: {'n_estimators': 267, 'max_depth': 49, 'min_samples_split': 4, 'min_samples_leaf': 2, 'max_features': 'sqrt', 'bootstrap': True, 'criterion': 'squared_error'}. Best is trial 341 with value: 0.2909369124469028.
[I 2024-12-04 12:07:01,039] Trial 974 finished with value: 0.2996655177799195 and parameters: {'n_estimators': 207, 'max_depth': 43, 'min_samples_split': 3, 'min_samples_leaf': 1, 'max_features': 'sqrt', 'bootstrap': False, 'criterion': 'squared_error'}. Best is trial 341 with value: 0.2909369124469028.
[I 2024-12-04 12:07:03,370] Trial 970 finished with value: 0.4278377976040702 and parameters: {'n_estimators': 221, 'max_depth': 15, 'min_samples_split': 2, 'min_samples_leaf': 5, 'max_features': None, 'bootstrap': True, 'criterion': 'absolute_error'}. Best is trial 341 with value: 0.2909369124469028.
[I 2024-12-04 12:07:05,291] Trial 979 finished with value: 0.3005465633253513 and parameters: {'n_estimators': 359, 'max_depth': 44, 'min_samples_split': 3, 'min_samples_leaf': 1, 'max_features': 'sqrt', 'bootstrap': False, 'criterion': 'squared_error'}. Best is trial 341 with value: 0.2909369124469028.
[I 2024-12-04 12:07:05,896] Trial 967 finished with value: 0.3843001661008379 and parameters: {'n_estimators': 316, 'max_depth': 50, 'min_samples_split': 4, 'min_samples_leaf': 1, 'max_features': None, 'bootstrap': False, 'criterion': 'squared_error'}. Best is trial 341 with value: 0.2909369124469028.
[I 2024-12-04 12:07:05,949] Trial 984 finished with value: 0.2999331250780687 and parameters: {'n_estimators': 262, 'max_depth': 50, 'min_samples_split': 4, 'min_samples_leaf': 1, 'max_features': 'sqrt', 'bootstrap': False, 'criterion': 'squared_error'}. Best is trial 341 with value: 0.2909369124469028.
[I 2024-12-04 12:07:06,589] Trial 964 finished with value: 0.3289428973428145 and parameters: {'n_estimators': 748, 'max_depth': 29, 'min_samples_split': 3, 'min_samples_leaf': 1, 'max_features': None, 'bootstrap': True, 'criterion': 'squared_error'}. Best is trial 341 with value: 0.2909369124469028.
[I 2024-12-04 12:07:06,635] Trial 975 finished with value: 0.2983169719915531 and parameters: {'n_estimators': 199, 'max_depth': 50, 'min_samples_split': 2, 'min_samples_leaf': 1, 'max_features': 'sqrt', 'bootstrap': False, 'criterion': 'squared_error'}. Best is trial 341 with value: 0.2909369124469028.
[I 2024-12-04 12:07:06,690] Trial 978 finished with value: 0.42738705696164664 and parameters: {'n_estimators': 226, 'max_depth': 42, 'min_samples_split': 2, 'min_samples_leaf': 1, 'max_features': 'log2', 'bootstrap': False, 'criterion': 'squared_error'}. Best is trial 341 with value: 0.2909369124469028.
[I 2024-12-04 12:07:06,818] Trial 982 finished with value: 0.9258748100028489 and parameters: {'n_estimators': 821, 'max_depth': 32, 'min_samples_split': 4, 'min_samples_leaf': 7, 'max_features': 'log2', 'bootstrap': False, 'criterion': 'squared_error'}. Best is trial 341 with value: 0.2909369124469028.
[I 2024-12-04 12:07:07,044] Trial 983 finished with value: 0.39065588473462526 and parameters: {'n_estimators': 423, 'max_depth': 48, 'min_samples_split': 3, 'min_samples_leaf': 1, 'max_features': 'log2', 'bootstrap': False, 'criterion': 'squared_error'}. Best is trial 341 with value: 0.2909369124469028.
[I 2024-12-04 12:07:08,464] Trial 980 finished with value: 0.2944987563725716 and parameters: {'n_estimators': 409, 'max_depth': 50, 'min_samples_split': 3, 'min_samples_leaf': 1, 'max_features': 'sqrt', 'bootstrap': False, 'criterion': 'squared_error'}. Best is trial 341 with value: 0.2909369124469028.
[I 2024-12-04 12:07:08,875] Trial 990 finished with value: 0.3046651889624379 and parameters: {'n_estimators': 108, 'max_depth': 43, 'min_samples_split': 2, 'min_samples_leaf': 1, 'max_features': 'sqrt', 'bootstrap': False, 'criterion': 'squared_error'}. Best is trial 341 with value: 0.2909369124469028.
[I 2024-12-04 12:07:11,015] Trial 993 finished with value: 0.31982062006035783 and parameters: {'n_estimators': 238, 'max_depth': 40, 'min_samples_split': 5, 'min_samples_leaf': 1, 'max_features': 'sqrt', 'bootstrap': False, 'criterion': 'squared_error'}. Best is trial 341 with value: 0.2909369124469028.
[I 2024-12-04 12:07:11,022] Trial 986 finished with value: 0.31059682444459286 and parameters: {'n_estimators': 282, 'max_depth': 44, 'min_samples_split': 5, 'min_samples_leaf': 1, 'max_features': 'sqrt', 'bootstrap': False, 'criterion': 'squared_error'}. Best is trial 341 with value: 0.2909369124469028.
[I 2024-12-04 12:07:11,766] Trial 991 finished with value: 0.4428952098255893 and parameters: {'n_estimators': 279, 'max_depth': 50, 'min_samples_split': 3, 'min_samples_leaf': 2, 'max_features': 'sqrt', 'bootstrap': False, 'criterion': 'squared_error'}. Best is trial 341 with value: 0.2909369124469028.
[I 2024-12-04 12:07:14,835] Trial 988 finished with value: 0.6086073759376553 and parameters: {'n_estimators': 787, 'max_depth': 49, 'min_samples_split': 11, 'min_samples_leaf': 5, 'max_features': 'sqrt', 'bootstrap': False, 'criterion': 'squared_error'}. Best is trial 341 with value: 0.2909369124469028.
[I 2024-12-04 12:07:15,659] Trial 987 finished with value: 0.2980357726529028 and parameters: {'n_estimators': 169, 'max_depth': 42, 'min_samples_split': 3, 'min_samples_leaf': 1, 'max_features': 'sqrt', 'bootstrap': False, 'criterion': 'squared_error'}. Best is trial 341 with value: 0.2909369124469028.
[I 2024-12-04 12:07:17,423] Trial 998 finished with value: 0.3230204225209094 and parameters: {'n_estimators': 228, 'max_depth': 45, 'min_samples_split': 8, 'min_samples_leaf': 1, 'max_features': 'sqrt', 'bootstrap': False, 'criterion': 'squared_error'}. Best is trial 341 with value: 0.2909369124469028.
[I 2024-12-04 12:07:17,424] Trial 996 finished with value: 0.30123860811199793 and parameters: {'n_estimators': 365, 'max_depth': 47, 'min_samples_split': 2, 'min_samples_leaf': 1, 'max_features': 'sqrt', 'bootstrap': False, 'criterion': 'squared_error'}. Best is trial 341 with value: 0.2909369124469028.
[I 2024-12-04 12:07:17,648] Trial 997 finished with value: 0.29467623463416376 and parameters: {'n_estimators': 306, 'max_depth': 50, 'min_samples_split': 3, 'min_samples_leaf': 1, 'max_features': 'sqrt', 'bootstrap': False, 'criterion': 'squared_error'}. Best is trial 341 with value: 0.2909369124469028.
[I 2024-12-04 12:07:19,441] Trial 1003 finished with value: 0.295259872534501 and parameters: {'n_estimators': 105, 'max_depth': 49, 'min_samples_split': 2, 'min_samples_leaf': 1, 'max_features': 'sqrt', 'bootstrap': False, 'criterion': 'squared_error'}. Best is trial 341 with value: 0.2909369124469028.
[I 2024-12-04 12:07:19,442] Trial 989 finished with value: 0.3203645529980812 and parameters: {'n_estimators': 431, 'max_depth': 38, 'min_samples_split': 2, 'min_samples_leaf': 1, 'max_features': 'sqrt', 'bootstrap': False, 'criterion': 'squared_error'}. Best is trial 341 with value: 0.2909369124469028.
[I 2024-12-04 12:07:24,500] Trial 995 finished with value: 0.5044917796404499 and parameters: {'n_estimators': 434, 'max_depth': 49, 'min_samples_split': 2, 'min_samples_leaf': 11, 'max_features': None, 'bootstrap': False, 'criterion': 'squared_error'}. Best is trial 341 with value: 0.2909369124469028.
[I 2024-12-04 12:07:27,047] Trial 1001 finished with value: 0.300633282136553 and parameters: {'n_estimators': 580, 'max_depth': 50, 'min_samples_split': 4, 'min_samples_leaf': 1, 'max_features': 'sqrt', 'bootstrap': False, 'criterion': 'squared_error'}. Best is trial 341 with value: 0.2909369124469028.
[I 2024-12-04 12:07:27,186] Trial 977 finished with value: 0.5363383118406182 and parameters: {'n_estimators': 441, 'max_depth': 25, 'min_samples_split': 17, 'min_samples_leaf': 12, 'max_features': None, 'bootstrap': True, 'criterion': 'absolute_error'}. Best is trial 341 with value: 0.2909369124469028.
[I 2024-12-04 12:07:28,679] Trial 1014 finished with value: 0.4208165835246727 and parameters: {'n_estimators': 106, 'max_depth': 44, 'min_samples_split': 5, 'min_samples_leaf': 1, 'max_features': 'log2', 'bootstrap': False, 'criterion': 'squared_error'}. Best is trial 341 with value: 0.2909369124469028.
[I 2024-12-04 12:07:33,932] Trial 1004 finished with value: 0.3478002643770653 and parameters: {'n_estimators': 279, 'max_depth': 49, 'min_samples_split': 5, 'min_samples_leaf': 2, 'max_features': None, 'bootstrap': True, 'criterion': 'squared_error'}. Best is trial 341 with value: 0.2909369124469028.
[I 2024-12-04 12:07:34,423] Trial 1010 finished with value: 0.4420864487595863 and parameters: {'n_estimators': 285, 'max_depth': 49, 'min_samples_split': 2, 'min_samples_leaf': 2, 'max_features': 'sqrt', 'bootstrap': False, 'criterion': 'squared_error'}. Best is trial 341 with value: 0.2909369124469028.
[I 2024-12-04 12:07:36,088] Trial 1008 finished with value: 0.9125102959834169 and parameters: {'n_estimators': 528, 'max_depth': 27, 'min_samples_split': 12, 'min_samples_leaf': 4, 'max_features': 'log2', 'bootstrap': True, 'criterion': 'absolute_error'}. Best is trial 341 with value: 0.2909369124469028.
[I 2024-12-04 12:07:36,883] Trial 1006 finished with value: 0.30046245632286955 and parameters: {'n_estimators': 271, 'max_depth': 43, 'min_samples_split': 3, 'min_samples_leaf': 1, 'max_features': 'sqrt', 'bootstrap': False, 'criterion': 'squared_error'}. Best is trial 341 with value: 0.2909369124469028.
[I 2024-12-04 12:07:37,117] Trial 1002 finished with value: 0.3061036511367554 and parameters: {'n_estimators': 301, 'max_depth': 43, 'min_samples_split': 4, 'min_samples_leaf': 1, 'max_features': 'sqrt', 'bootstrap': False, 'criterion': 'squared_error'}. Best is trial 341 with value: 0.2909369124469028.
[I 2024-12-04 12:07:38,321] Trial 962 finished with value: 0.4379958049264391 and parameters: {'n_estimators': 263, 'max_depth': 26, 'min_samples_split': 3, 'min_samples_leaf': 2, 'max_features': None, 'bootstrap': False, 'criterion': 'absolute_error'}. Best is trial 341 with value: 0.2909369124469028.
[I 2024-12-04 12:07:38,842] Trial 1015 finished with value: 0.30055759384796155 and parameters: {'n_estimators': 249, 'max_depth': 50, 'min_samples_split': 4, 'min_samples_leaf': 1, 'max_features': 'sqrt', 'bootstrap': False, 'criterion': 'squared_error'}. Best is trial 341 with value: 0.2909369124469028.
[I 2024-12-04 12:07:39,076] Trial 1012 finished with value: 0.943755325840706 and parameters: {'n_estimators': 827, 'max_depth': 10, 'min_samples_split': 12, 'min_samples_leaf': 8, 'max_features': 'log2', 'bootstrap': False, 'criterion': 'absolute_error'}. Best is trial 341 with value: 0.2909369124469028.
[I 2024-12-04 12:07:39,162] Trial 1005 finished with value: 0.8752365694476135 and parameters: {'n_estimators': 776, 'max_depth': 46, 'min_samples_split': 29, 'min_samples_leaf': 3, 'max_features': 'log2', 'bootstrap': True, 'criterion': 'absolute_error'}. Best is trial 341 with value: 0.2909369124469028.
[I 2024-12-04 12:07:40,139] Trial 1018 finished with value: 0.3102574479508664 and parameters: {'n_estimators': 138, 'max_depth': 42, 'min_samples_split': 4, 'min_samples_leaf': 1, 'max_features': 'sqrt', 'bootstrap': False, 'criterion': 'squared_error'}. Best is trial 341 with value: 0.2909369124469028.
[I 2024-12-04 12:07:40,937] Trial 992 finished with value: 0.625730221178892 and parameters: {'n_estimators': 865, 'max_depth': 40, 'min_samples_split': 35, 'min_samples_leaf': 5, 'max_features': 'sqrt', 'bootstrap': False, 'criterion': 'absolute_error'}. Best is trial 341 with value: 0.2909369124469028.
[I 2024-12-04 12:07:41,229] Trial 1013 finished with value: 0.4883064771600489 and parameters: {'n_estimators': 833, 'max_depth': 44, 'min_samples_split': 27, 'min_samples_leaf': 1, 'max_features': 'log2', 'bootstrap': False, 'criterion': 'squared_error'}. Best is trial 341 with value: 0.2909369124469028.
