[I 2024-12-04 00:10:48,606] Trial 688 finished with value: 0.17687036090447184 and parameters: {'kernel': 'rbf', 'C': 12.753673758983682, 'gamma': 0.015533661505784259, 'epsilon': 0.002569101502407858}. Best is trial 448 with value: 0.13989258940934515.
[I 2024-12-04 00:10:48,753] Trial 685 finished with value: 0.1585903749251519 and parameters: {'kernel': 'rbf', 'C': 94.56524151742713, 'gamma': 0.01391015677636558, 'epsilon': 0.0048068189854751885}. Best is trial 448 with value: 0.13989258940934515.
[I 2024-12-04 00:10:50,406] Trial 689 finished with value: 0.17182525246513086 and parameters: {'kernel': 'rbf', 'C': 99.38393368517814, 'gamma': 0.003497682908315221, 'epsilon': 0.006013217333371193}. Best is trial 448 with value: 0.13989258940934515.
[I 2024-12-04 00:10:51,104] Trial 690 finished with value: 0.18107135937828114 and parameters: {'kernel': 'rbf', 'C': 10.522047829356076, 'gamma': 0.01684780000218812, 'epsilon': 0.006648878810291332}. Best is trial 448 with value: 0.13989258940934515.
[I 2024-12-04 00:10:51,131] Trial 686 finished with value: 0.17367281165182422 and parameters: {'kernel': 'rbf', 'C': 97.3929491847822, 'gamma': 0.02262256919668524, 'epsilon': 0.0048776706000966214}. Best is trial 448 with value: 0.13989258940934515.
[I 2024-12-04 00:10:52,099] Trial 691 finished with value: 0.1534688012606082 and parameters: {'kernel': 'rbf', 'C': 94.75793093806116, 'gamma': 0.005036377445730138, 'epsilon': 0.002673657864692455}. Best is trial 448 with value: 0.13989258940934515.
[I 2024-12-04 00:10:52,594] Trial 692 finished with value: 0.19505442223383007 and parameters: {'kernel': 'rbf', 'C': 17.918950398508922, 'gamma': 0.009423309015722263, 'epsilon': 0.004248369177757001}. Best is trial 448 with value: 0.13989258940934515.
[I 2024-12-04 00:10:53,484] Trial 694 finished with value: 0.9050811861667297 and parameters: {'kernel': 'poly', 'C': 25.84863872364211, 'gamma': 0.0009640740857833124, 'epsilon': 0.0025859897469430503}. Best is trial 448 with value: 0.13989258940934515.
[I 2024-12-04 00:10:53,510] Trial 693 finished with value: 71.62689845977933 and parameters: {'kernel': 'sigmoid', 'C': 8.741625850433547, 'gamma': 0.005826478506646501, 'epsilon': 0.004691331413036359}. Best is trial 448 with value: 0.13989258940934515.
[I 2024-12-04 00:10:56,168] Trial 697 finished with value: 0.7621634973164937 and parameters: {'kernel': 'sigmoid', 'C': 0.03149881740696533, 'gamma': 0.013773173509187716, 'epsilon': 0.059284031022030816}. Best is trial 448 with value: 0.13989258940934515.
[I 2024-12-04 00:10:57,051] Trial 698 finished with value: 0.173596231905427 and parameters: {'kernel': 'rbf', 'C': 17.570032829765125, 'gamma': 0.012584237690080822, 'epsilon': 0.003531910523097414}. Best is trial 448 with value: 0.13989258940934515.
[I 2024-12-04 00:10:57,888] Trial 695 finished with value: 0.1426091949107963 and parameters: {'kernel': 'rbf', 'C': 78.970152635981, 'gamma': 0.010552242279545002, 'epsilon': 0.003868014816505158}. Best is trial 448 with value: 0.13989258940934515.
[I 2024-12-04 00:10:59,176] Trial 696 finished with value: 0.14103818070677482 and parameters: {'kernel': 'rbf', 'C': 94.9736549836779, 'gamma': 0.008695316050539003, 'epsilon': 0.005794890560115764}. Best is trial 448 with value: 0.13989258940934515.
[I 2024-12-04 00:11:00,974] Trial 700 finished with value: 0.17650252389131346 and parameters: {'kernel': 'rbf', 'C': 13.851218384420457, 'gamma': 0.039327333681862524, 'epsilon': 0.002760063037355177}. Best is trial 448 with value: 0.13989258940934515.
[I 2024-12-04 00:11:01,631] Trial 699 finished with value: 0.142340683713041 and parameters: {'kernel': 'rbf', 'C': 82.00247622588395, 'gamma': 0.007469169415850839, 'epsilon': 0.003112690333006767}. Best is trial 448 with value: 0.13989258940934515.
[I 2024-12-04 00:11:02,534] Trial 703 finished with value: 0.7616296065862856 and parameters: {'kernel': 'rbf', 'C': 0.049673760775730984, 'gamma': 0.005538473421056336, 'epsilon': 0.8666852763879566}. Best is trial 448 with value: 0.13989258940934515.
[I 2024-12-04 00:11:04,153] Trial 702 finished with value: 0.15173197728524912 and parameters: {'kernel': 'rbf', 'C': 94.98976006100129, 'gamma': 0.00526215726699757, 'epsilon': 0.003217316309078737}. Best is trial 448 with value: 0.13989258940934515.
[I 2024-12-04 00:11:04,792] Trial 705 finished with value: 0.682170147940728 and parameters: {'kernel': 'sigmoid', 'C': 1.3113187326021787, 'gamma': 0.0004730920916805639, 'epsilon': 0.0012092986487775056}. Best is trial 448 with value: 0.13989258940934515.
[I 2024-12-04 00:11:05,442] Trial 704 finished with value: 0.1720928127074292 and parameters: {'kernel': 'rbf', 'C': 81.6210164135576, 'gamma': 0.003956424262805136, 'epsilon': 0.005731319426746972}. Best is trial 448 with value: 0.13989258940934515.
[I 2024-12-04 00:11:07,060] Trial 701 finished with value: 0.19024318712003518 and parameters: {'kernel': 'rbf', 'C': 91.44469336306055, 'gamma': 0.037390369273707605, 'epsilon': 0.0051049692419980535}. Best is trial 448 with value: 0.13989258940934515.
[I 2024-12-04 00:11:07,712] Trial 706 finished with value: 0.1624822386787141 and parameters: {'kernel': 'rbf', 'C': 21.96872048836467, 'gamma': 0.012590993289814145, 'epsilon': 0.00284713093511064}. Best is trial 448 with value: 0.13989258940934515.
[I 2024-12-04 00:11:08,160] Trial 708 finished with value: 0.2544304702020379 and parameters: {'kernel': 'rbf', 'C': 14.054994412155704, 'gamma': 0.004833522875525885, 'epsilon': 0.0029691526816680164}. Best is trial 448 with value: 0.13989258940934515.
[I 2024-12-04 00:11:10,396] Trial 711 finished with value: 0.550848802948927 and parameters: {'kernel': 'linear', 'C': 0.005652509778323331, 'gamma': 0.0011780867919403417, 'epsilon': 0.01580604868315302}. Best is trial 448 with value: 0.13989258940934515.
[I 2024-12-04 00:11:10,416] Trial 707 finished with value: 0.1415444784188014 and parameters: {'kernel': 'rbf', 'C': 92.72860626198536, 'gamma': 0.007098052412045746, 'epsilon': 0.0029909282096291854}. Best is trial 448 with value: 0.13989258940934515.
[I 2024-12-04 00:11:11,763] Trial 305 finished with value: 0.3529064146331422 and parameters: {'kernel': 'linear', 'C': 80.54701110605937, 'gamma': 0.08149095591222662, 'epsilon': 0.009317978424315114}. Best is trial 448 with value: 0.13989258940934515.
[I 2024-12-04 00:11:13,011] Trial 710 finished with value: 0.1419368488188416 and parameters: {'kernel': 'rbf', 'C': 85.78919471654604, 'gamma': 0.00739983879084239, 'epsilon': 0.003179505997084597}. Best is trial 448 with value: 0.13989258940934515.
[I 2024-12-04 00:11:13,017] Trial 576 finished with value: 0.5716065363620949 and parameters: {'kernel': 'poly', 'C': 93.94081239403232, 'gamma': 0.017118417434846447, 'epsilon': 0.0010357495071393829}. Best is trial 448 with value: 0.13989258940934515.
[I 2024-12-04 00:11:13,205] Trial 709 finished with value: 0.14159027915269143 and parameters: {'kernel': 'rbf', 'C': 98.50154043665836, 'gamma': 0.007654589558058576, 'epsilon': 0.006874087839636954}. Best is trial 448 with value: 0.13989258940934515.
[I 2024-12-04 00:11:13,365] Trial 714 finished with value: 0.2169254916038553 and parameters: {'kernel': 'rbf', 'C': 84.5645003885086, 'gamma': 0.0020654121415805047, 'epsilon': 0.0011144081501220143}. Best is trial 448 with value: 0.13989258940934515.
[I 2024-12-04 00:11:13,804] Trial 712 finished with value: 0.1965972450914878 and parameters: {'kernel': 'rbf', 'C': 18.755222547543227, 'gamma': 0.008952405895065883, 'epsilon': 0.0034691454434718667}. Best is trial 448 with value: 0.13989258940934515.
[I 2024-12-04 00:11:16,266] Trial 715 finished with value: 0.20260913722563176 and parameters: {'kernel': 'rbf', 'C': 98.0165937994735, 'gamma': 0.002277207460219349, 'epsilon': 0.0034575598802078656}. Best is trial 448 with value: 0.13989258940934515.
[I 2024-12-04 00:11:17,692] Trial 719 finished with value: 0.25608387576969155 and parameters: {'kernel': 'rbf', 'C': 10.216393950147147, 'gamma': 0.006173249565750708, 'epsilon': 0.001258590113853474}. Best is trial 448 with value: 0.13989258940934515.
[I 2024-12-04 00:11:18,186] Trial 713 finished with value: 0.18872348530075594 and parameters: {'kernel': 'rbf', 'C': 98.09670457853497, 'gamma': 0.03416843910874675, 'epsilon': 0.0014881617530090037}. Best is trial 448 with value: 0.13989258940934515.
[I 2024-12-04 00:11:18,933] Trial 717 finished with value: 0.15952789434851888 and parameters: {'kernel': 'rbf', 'C': 90.03898549230803, 'gamma': 0.014452312089273566, 'epsilon': 0.004434423808622325}. Best is trial 448 with value: 0.13989258940934515.
[I 2024-12-04 00:11:18,933] Trial 716 finished with value: 0.15226964283034844 and parameters: {'kernel': 'rbf', 'C': 99.51203178428106, 'gamma': 0.01203498415289792, 'epsilon': 0.006915465081789196}. Best is trial 448 with value: 0.13989258940934515.
[I 2024-12-04 00:11:19,741] Trial 721 finished with value: 0.25115279887585557 and parameters: {'kernel': 'rbf', 'C': 13.163556539809077, 'gamma': 0.00555361261007598, 'epsilon': 0.003033687718872914}. Best is trial 448 with value: 0.13989258940934515.
[I 2024-12-04 00:11:19,743] Trial 718 finished with value: 0.14278923781394945 and parameters: {'kernel': 'rbf', 'C': 92.07290152263607, 'gamma': 0.00676496282607138, 'epsilon': 0.0023995370585191216}. Best is trial 448 with value: 0.13989258940934515.
[I 2024-12-04 00:11:20,231] Trial 720 finished with value: 0.15612653465136744 and parameters: {'kernel': 'rbf', 'C': 92.38874075418211, 'gamma': 0.0047488335352659375, 'epsilon': 0.0035201407918752357}. Best is trial 448 with value: 0.13989258940934515.
[I 2024-12-04 00:11:21,030] Trial 724 finished with value: 0.9903330150229646 and parameters: {'kernel': 'poly', 'C': 0.0021646576861095164, 'gamma': 0.001586514507186358, 'epsilon': 0.00202117257651314}. Best is trial 448 with value: 0.13989258940934515.
[I 2024-12-04 00:11:21,130] Trial 723 finished with value: 0.7693076902511428 and parameters: {'kernel': 'poly', 'C': 4.2402364680704805, 'gamma': 0.007077396743642528, 'epsilon': 0.004352739316925726}. Best is trial 448 with value: 0.13989258940934515.
[I 2024-12-04 00:11:23,502] Trial 729 finished with value: 0.9094597970881295 and parameters: {'kernel': 'sigmoid', 'C': 0.019422992980917514, 'gamma': 0.0016408206901273254, 'epsilon': 0.005585235708249925}. Best is trial 448 with value: 0.13989258940934515.
[I 2024-12-04 00:11:24,143] Trial 728 finished with value: 0.2496920908464508 and parameters: {'kernel': 'rbf', 'C': 14.590431962354746, 'gamma': 0.005282444390459499, 'epsilon': 0.001222006312470142}. Best is trial 448 with value: 0.13989258940934515.
[I 2024-12-04 00:11:24,860] Trial 574 finished with value: 0.35445311127848117 and parameters: {'kernel': 'linear', 'C': 44.26410530957759, 'gamma': 0.01826902752917694, 'epsilon': 0.0040932912284963215}. Best is trial 448 with value: 0.13989258940934515.
[I 2024-12-04 00:11:24,861] Trial 725 finished with value: 0.20704168503744452 and parameters: {'kernel': 'rbf', 'C': 21.481341245113555, 'gamma': 0.06216859949822509, 'epsilon': 0.001578872885084936}. Best is trial 448 with value: 0.13989258940934515.
[I 2024-12-04 00:11:25,727] Trial 731 finished with value: 12.935471574126503 and parameters: {'kernel': 'sigmoid', 'C': 6.736466813117648, 'gamma': 0.0022261827221253254, 'epsilon': 0.3847944262187022}. Best is trial 448 with value: 0.13989258940934515.
[I 2024-12-04 00:11:25,759] Trial 726 finished with value: 0.23078628646886887 and parameters: {'kernel': 'rbf', 'C': 89.44496003878135, 'gamma': 0.09118699565016587, 'epsilon': 0.005063021827162847}. Best is trial 448 with value: 0.13989258940934515.
[I 2024-12-04 00:11:26,034] Trial 730 finished with value: 0.20178144964185973 and parameters: {'kernel': 'rbf', 'C': 16.401475786458438, 'gamma': 0.009494955749589227, 'epsilon': 0.006701993568778093}. Best is trial 448 with value: 0.13989258940934515.
[I 2024-12-04 00:11:27,595] Trial 735 finished with value: 0.9822608988266788 and parameters: {'kernel': 'sigmoid', 'C': 0.019275115240236385, 'gamma': 0.00030959836228014004, 'epsilon': 0.7842503695320443}. Best is trial 448 with value: 0.13989258940934515.
[I 2024-12-04 00:11:28,242] Trial 733 finished with value: 0.1822307169897066 and parameters: {'kernel': 'rbf', 'C': 14.663225672619207, 'gamma': 0.012728382902645377, 'epsilon': 0.0021172395234336787}. Best is trial 448 with value: 0.13989258940934515.
[I 2024-12-04 00:11:28,731] Trial 727 finished with value: 0.18615849530394363 and parameters: {'kernel': 'rbf', 'C': 90.33377604119967, 'gamma': 0.03277763198927627, 'epsilon': 0.0014942268724400423}. Best is trial 448 with value: 0.13989258940934515.
[I 2024-12-04 00:11:28,794] Trial 732 finished with value: 0.17851467215349304 and parameters: {'kernel': 'rbf', 'C': 85.13811053993012, 'gamma': 0.003563083160661457, 'epsilon': 0.0026889918322312123}. Best is trial 448 with value: 0.13989258940934515.
[I 2024-12-04 00:11:29,824] Trial 737 finished with value: 0.2905912991323815 and parameters: {'kernel': 'rbf', 'C': 19.51860769621628, 'gamma': 0.001661371318885442, 'epsilon': 0.008362769919222583}. Best is trial 448 with value: 0.13989258940934515.
[I 2024-12-04 00:11:30,744] Trial 738 finished with value: 0.7027520121102218 and parameters: {'kernel': 'poly', 'C': 58.24843675695966, 'gamma': 0.004522153696396234, 'epsilon': 0.0011281882884470126}. Best is trial 448 with value: 0.13989258940934515.
[I 2024-12-04 00:11:30,891] Trial 734 finished with value: 0.14045542843320094 and parameters: {'kernel': 'rbf', 'C': 89.4185915580332, 'gamma': 0.008809165353390975, 'epsilon': 0.0014231605746004724}. Best is trial 448 with value: 0.13989258940934515.
[I 2024-12-04 00:11:31,274] Trial 739 finished with value: 0.35792905118152823 and parameters: {'kernel': 'rbf', 'C': 12.979145224087443, 'gamma': 0.0010767675053515746, 'epsilon': 0.0028687177221832674}. Best is trial 448 with value: 0.13989258940934515.
[I 2024-12-04 00:11:32,456] Trial 736 finished with value: 0.16483105455984065 and parameters: {'kernel': 'rbf', 'C': 99.19019206187389, 'gamma': 0.015255111072079334, 'epsilon': 0.004051077309288615}. Best is trial 448 with value: 0.13989258940934515.
[I 2024-12-04 00:11:32,525] Trial 741 finished with value: 0.19429502184589956 and parameters: {'kernel': 'rbf', 'C': 91.08024042905268, 'gamma': 0.0027827804667430204, 'epsilon': 0.003924024124378017}. Best is trial 448 with value: 0.13989258940934515.
[I 2024-12-04 00:11:33,916] Trial 742 finished with value: 0.15913711453763607 and parameters: {'kernel': 'rbf', 'C': 11.793143081345216, 'gamma': 0.02460998070862773, 'epsilon': 0.0016599526738576215}. Best is trial 448 with value: 0.13989258940934515.
[I 2024-12-04 00:11:34,311] Trial 744 finished with value: 0.638274495054878 and parameters: {'kernel': 'rbf', 'C': 3.202634335048821, 'gamma': 0.7519864959908651, 'epsilon': 0.0487390106707156}. Best is trial 448 with value: 0.13989258940934515.
[I 2024-12-04 00:11:34,745] Trial 743 finished with value: 0.22126404602679217 and parameters: {'kernel': 'rbf', 'C': 90.88453447175026, 'gamma': 0.0017441811335840607, 'epsilon': 0.0010238062558776235}. Best is trial 448 with value: 0.13989258940934515.
[I 2024-12-04 00:11:35,915] Trial 748 finished with value: 0.996721940922631 and parameters: {'kernel': 'rbf', 'C': 0.001393371468780995, 'gamma': 0.7791859837622801, 'epsilon': 0.6607591880282341}. Best is trial 448 with value: 0.13989258940934515.
[I 2024-12-04 00:11:35,951] Trial 740 finished with value: 0.21231054617690603 and parameters: {'kernel': 'rbf', 'C': 83.3661973547491, 'gamma': 0.05859273207426583, 'epsilon': 0.0024705563526492796}. Best is trial 448 with value: 0.13989258940934515.
[I 2024-12-04 00:11:36,180] Trial 747 finished with value: 0.252358333561793 and parameters: {'kernel': 'rbf', 'C': 8.93259192558305, 'gamma': 0.007644236506744986, 'epsilon': 0.0011587800486199081}. Best is trial 448 with value: 0.13989258940934515.
[I 2024-12-04 00:11:37,214] Trial 749 finished with value: 0.2628184274677636 and parameters: {'kernel': 'rbf', 'C': 15.363960521967677, 'gamma': 0.003634569203960755, 'epsilon': 0.0018922233899021123}. Best is trial 448 with value: 0.13989258940934515.
[I 2024-12-04 00:11:37,288] Trial 577 finished with value: 0.3529196664902443 and parameters: {'kernel': 'linear', 'C': 38.355461343488436, 'gamma': 0.3766502941995239, 'epsilon': 0.0010722398912073293}. Best is trial 448 with value: 0.13989258940934515.
[I 2024-12-04 00:11:37,714] Trial 745 finished with value: 0.14061908732301412 and parameters: {'kernel': 'rbf', 'C': 90.1694561585034, 'gamma': 0.00883530835537338, 'epsilon': 0.0015514224939653853}. Best is trial 448 with value: 0.13989258940934515.
[I 2024-12-04 00:11:37,757] Trial 746 finished with value: 0.14196687261331542 and parameters: {'kernel': 'rbf', 'C': 99.65194203114697, 'gamma': 0.010310392503265691, 'epsilon': 0.0028519144170929553}. Best is trial 448 with value: 0.13989258940934515.
[I 2024-12-04 00:11:38,351] Trial 751 finished with value: 0.9901071387896332 and parameters: {'kernel': 'rbf', 'C': 0.002185615959716166, 'gamma': 0.47551908058686043, 'epsilon': 0.0010652825926917736}. Best is trial 448 with value: 0.13989258940934515.
[I 2024-12-04 00:11:39,382] Trial 750 finished with value: 0.1866434253284178 and parameters: {'kernel': 'rbf', 'C': 15.903679570390159, 'gamma': 0.044785044851630776, 'epsilon': 0.0030885414654840716}. Best is trial 448 with value: 0.13989258940934515.
[I 2024-12-04 00:11:39,857] Trial 753 finished with value: 0.21958749843557326 and parameters: {'kernel': 'rbf', 'C': 14.504056295331733, 'gamma': 0.008529777197984895, 'epsilon': 0.0011124762211623368}. Best is trial 448 with value: 0.13989258940934515.
[I 2024-12-04 00:11:40,611] Trial 754 finished with value: 0.8802010709075451 and parameters: {'kernel': 'poly', 'C': 0.0034341360696838364, 'gamma': 0.02413580026365915, 'epsilon': 0.0021753496576809943}. Best is trial 448 with value: 0.13989258940934515.
[I 2024-12-04 00:11:42,273] Trial 757 finished with value: 0.22552080694993853 and parameters: {'kernel': 'rbf', 'C': 21.77216617941966, 'gamma': 0.005537305842155119, 'epsilon': 0.0010663581536309204}. Best is trial 448 with value: 0.13989258940934515.
[I 2024-12-04 00:11:42,555] Trial 756 finished with value: 0.14132544998014976 and parameters: {'kernel': 'rbf', 'C': 74.2318314398704, 'gamma': 0.009108232578102105, 'epsilon': 0.001138447453978867}. Best is trial 448 with value: 0.13989258940934515.
[I 2024-12-04 00:11:42,566] Trial 758 finished with value: 0.2701369581009992 and parameters: {'kernel': 'rbf', 'C': 16.808002325987736, 'gamma': 0.0027965953509492716, 'epsilon': 0.0024906985917829377}. Best is trial 448 with value: 0.13989258940934515.
[I 2024-12-04 00:11:42,612] Trial 759 finished with value: 0.29795822900374447 and parameters: {'kernel': 'rbf', 'C': 14.40511324419241, 'gamma': 0.0019414090058685923, 'epsilon': 0.0021478621460879737}. Best is trial 448 with value: 0.13989258940934515.
[I 2024-12-04 00:11:44,029] Trial 760 finished with value: 0.18655894721231017 and parameters: {'kernel': 'rbf', 'C': 88.759024160092, 'gamma': 0.003122732841261828, 'epsilon': 0.0016777577066701553}. Best is trial 448 with value: 0.13989258940934515.
[I 2024-12-04 00:11:44,177] Trial 755 finished with value: 0.16397493583983036 and parameters: {'kernel': 'rbf', 'C': 92.00353233301121, 'gamma': 0.015368123047686411, 'epsilon': 0.0031548296765664856}. Best is trial 448 with value: 0.13989258940934515.
[I 2024-12-04 00:11:45,269] Trial 764 finished with value: 0.2674449015349596 and parameters: {'kernel': 'rbf', 'C': 20.663525546199242, 'gamma': 0.0023685468717428563, 'epsilon': 0.001042314051957956}. Best is trial 448 with value: 0.13989258940934515.
[I 2024-12-04 00:11:46,193] Trial 761 finished with value: 0.1611311895477664 and parameters: {'kernel': 'rbf', 'C': 11.233863074258062, 'gamma': 0.029981752547993124, 'epsilon': 0.0010896479424660906}. Best is trial 448 with value: 0.13989258940934515.
[I 2024-12-04 00:11:46,812] Trial 765 finished with value: 0.16945346584137946 and parameters: {'kernel': 'rbf', 'C': 11.570508709310174, 'gamma': 0.018966667967675935, 'epsilon': 0.0010242666845272658}. Best is trial 448 with value: 0.13989258940934515.
[I 2024-12-04 00:11:47,501] Trial 762 finished with value: 0.1456895754644724 and parameters: {'kernel': 'rbf', 'C': 56.55780393145177, 'gamma': 0.011692463082315658, 'epsilon': 0.0010030170751243587}. Best is trial 448 with value: 0.13989258940934515.
[I 2024-12-04 00:11:48,097] Trial 767 finished with value: 0.9615219750755637 and parameters: {'kernel': 'sigmoid', 'C': 0.0012772839769101389, 'gamma': 0.6662723762929904, 'epsilon': 0.11720439456955412}. Best is trial 448 with value: 0.13989258940934515.
[I 2024-12-04 00:11:48,254] Trial 763 finished with value: 0.1405580025342162 and parameters: {'kernel': 'rbf', 'C': 90.50823740301283, 'gamma': 0.008716355916524476, 'epsilon': 0.0017004740994071826}. Best is trial 448 with value: 0.13989258940934515.
[I 2024-12-04 00:11:48,752] Trial 769 finished with value: 0.7126788153118108 and parameters: {'kernel': 'rbf', 'C': 2.7934189419307867, 'gamma': 0.5911445986246152, 'epsilon': 0.5529851964602751}. Best is trial 448 with value: 0.13989258940934515.
[I 2024-12-04 00:11:48,753] Trial 768 finished with value: 353.30090115267427 and parameters: {'kernel': 'sigmoid', 'C': 92.36422454851592, 'gamma': 0.003102379646197307, 'epsilon': 0.0018986092376049675}. Best is trial 448 with value: 0.13989258940934515.
[I 2024-12-04 00:11:51,304] Trial 766 finished with value: 0.16939789010898534 and parameters: {'kernel': 'rbf', 'C': 92.66037698203245, 'gamma': 0.01697006460467558, 'epsilon': 0.0010455851256054032}. Best is trial 448 with value: 0.13989258940934515.
