[I 2024-12-04 20:09:59,766] Trial 929 finished with value: 1.0624161172731086 and parameters: {'kernel_type': 'RBF', 'length_scale': 8.23640669329266e-05, 'noise_level': 2.510578502767281e-06, 'constant_value': 0.6953164196492038, 'nu': 1.5}. Best is trial 881 with value: 0.35916990930150405.
[I 2024-12-04 20:10:03,182] Trial 933 finished with value: 1.0624161176407314 and parameters: {'kernel_type': 'Matern', 'length_scale': 3952.1071226401245, 'noise_level': 0.010165726655447328, 'constant_value': 7.230874543392331, 'nu': 0.5}. Best is trial 881 with value: 0.35916990930150405.
[I 2024-12-04 20:10:04,104] Trial 932 finished with value: 0.3592112133993702 and parameters: {'kernel_type': 'Matern', 'length_scale': 728.9494398627058, 'noise_level': 0.9826101316193038, 'constant_value': 0.8830377509940891, 'nu': 0.5}. Best is trial 881 with value: 0.35916990930150405.
[I 2024-12-04 20:10:05,211] Trial 934 finished with value: 0.35921087474690455 and parameters: {'kernel_type': 'Matern', 'length_scale': 8.333932174189856, 'noise_level': 0.016961538108407937, 'constant_value': 106.1127504056121, 'nu': 0.5}. Best is trial 881 with value: 0.35916990930150405.
[I 2024-12-04 20:10:07,698] Trial 935 finished with value: 0.3592113176474379 and parameters: {'kernel_type': 'Matern', 'length_scale': 2.610061350626577, 'noise_level': 0.7465991374156711, 'constant_value': 1.7941837614090312, 'nu': 0.5}. Best is trial 881 with value: 0.35916990930150405.
[I 2024-12-04 20:10:10,565] Trial 936 finished with value: 0.4226898010772538 and parameters: {'kernel_type': 'Matern', 'length_scale': 323.9126198068726, 'noise_level': 0.1061618528743658, 'constant_value': 105.32186601344588, 'nu': 1.5}. Best is trial 881 with value: 0.35916990930150405.
[I 2024-12-04 20:10:12,638] Trial 938 finished with value: 0.3592108077317245 and parameters: {'kernel_type': 'Matern', 'length_scale': 986.4097130413923, 'noise_level': 0.040094016381584587, 'constant_value': 39.51832803971737, 'nu': 0.5}. Best is trial 881 with value: 0.35916990930150405.
[I 2024-12-04 20:10:14,925] Trial 937 finished with value: 1.0624161173065232 and parameters: {'kernel_type': 'Matern', 'length_scale': 38288.43765230069, 'noise_level': 0.0004549285180096879, 'constant_value': 204.16084963288054, 'nu': 1.5}. Best is trial 881 with value: 0.35916990930150405.
[I 2024-12-04 20:10:16,929] Trial 940 finished with value: 0.35921102427344437 and parameters: {'kernel_type': 'Matern', 'length_scale': 2.366379190647418, 'noise_level': 0.0014832809932503021, 'constant_value': 0.19988198931348156, 'nu': 0.5}. Best is trial 881 with value: 0.35916990930150405.
[I 2024-12-04 20:10:20,059] Trial 939 finished with value: 1.0624161173736484 and parameters: {'kernel_type': 'Matern', 'length_scale': 23092.207701091476, 'noise_level': 0.01137792573668462, 'constant_value': 0.03102044710108416, 'nu': 0.5}. Best is trial 881 with value: 0.35916990930150405.
[I 2024-12-04 20:10:20,462] Trial 941 finished with value: 0.3592111982645253 and parameters: {'kernel_type': 'Matern', 'length_scale': 5.167517929963011, 'noise_level': 0.00012718091377465128, 'constant_value': 1444.8602695887405, 'nu': 0.5}. Best is trial 881 with value: 0.35916990930150405.
[I 2024-12-04 20:10:22,263] Trial 942 finished with value: 0.3592112048070801 and parameters: {'kernel_type': 'Matern', 'length_scale': 1.1172340442595923, 'noise_level': 0.015304379368866689, 'constant_value': 400.23334693826916, 'nu': 0.5}. Best is trial 881 with value: 0.35916990930150405.
[I 2024-12-04 20:10:26,462] Trial 944 finished with value: 0.35921124150065664 and parameters: {'kernel_type': 'Matern', 'length_scale': 433.7906908439999, 'noise_level': 0.6544011428633781, 'constant_value': 21.922123525837428, 'nu': 0.5}. Best is trial 881 with value: 0.35916990930150405.
[I 2024-12-04 20:10:27,116] Trial 943 finished with value: 0.359211391682573 and parameters: {'kernel_type': 'Matern', 'length_scale': 20.948268330025797, 'noise_level': 0.013312247454256375, 'constant_value': 1.430325067428405, 'nu': 0.5}. Best is trial 881 with value: 0.35916990930150405.
[I 2024-12-04 20:10:27,204] Trial 945 finished with value: 1.062416117265921 and parameters: {'kernel_type': 'Matern', 'length_scale': 0.015697625251603897, 'noise_level': 0.005433672524339029, 'constant_value': 0.3422529965877717, 'nu': 0.5}. Best is trial 881 with value: 0.35916990930150405.
[I 2024-12-04 20:10:33,412] Trial 948 finished with value: 1.0624161172485966 and parameters: {'kernel_type': 'RBF', 'length_scale': 46877.09284447969, 'noise_level': 0.00017338840479099306, 'constant_value': 50.40861507996864, 'nu': 0.5}. Best is trial 881 with value: 0.35916990930150405.
[I 2024-12-04 20:10:34,907] Trial 947 finished with value: 0.35921126160613526 and parameters: {'kernel_type': 'Matern', 'length_scale': 0.21473978198552063, 'noise_level': 0.02039009341676134, 'constant_value': 0.022176859626015597, 'nu': 0.5}. Best is trial 881 with value: 0.35916990930150405.
[I 2024-12-04 20:10:38,577] Trial 946 finished with value: 1.0624161172825997 and parameters: {'kernel_type': 'RBF', 'length_scale': 11776.551987845096, 'noise_level': 7.929851762522404e-06, 'constant_value': 2.0013864848723017e-06, 'nu': 2.5}. Best is trial 881 with value: 0.35916990930150405.
[I 2024-12-04 20:10:40,453] Trial 950 finished with value: 0.3592110966410386 and parameters: {'kernel_type': 'Matern', 'length_scale': 1.6000858408088787, 'noise_level': 0.9306622992540811, 'constant_value': 34.712542825882316, 'nu': 0.5}. Best is trial 881 with value: 0.35916990930150405.
[I 2024-12-04 20:10:43,021] Trial 949 finished with value: 1.0624161173377964 and parameters: {'kernel_type': 'Matern', 'length_scale': 0.05940351340753284, 'noise_level': 0.0002882702260970438, 'constant_value': 13457.975686308522, 'nu': 2.5}. Best is trial 881 with value: 0.35916990930150405.
[I 2024-12-04 20:10:45,444] Trial 951 finished with value: 0.35921110012426927 and parameters: {'kernel_type': 'Matern', 'length_scale': 25.601035866148532, 'noise_level': 0.057997201075752035, 'constant_value': 0.0025036919272636423, 'nu': 0.5}. Best is trial 881 with value: 0.35916990930150405.
[I 2024-12-04 20:10:46,538] Trial 952 finished with value: 0.35921042533798736 and parameters: {'kernel_type': 'Matern', 'length_scale': 40.84470384206908, 'noise_level': 0.3667203650272046, 'constant_value': 0.16149152491866658, 'nu': 0.5}. Best is trial 881 with value: 0.35916990930150405.
[I 2024-12-04 20:10:47,801] Trial 953 finished with value: 0.4195660157685373 and parameters: {'kernel_type': 'Matern', 'length_scale': 1.9454589742696715, 'noise_level': 0.01182758362833019, 'constant_value': 0.1508876391522033, 'nu': 2.5}. Best is trial 881 with value: 0.35916990930150405.
[I 2024-12-04 20:10:53,306] Trial 955 finished with value: 0.35921113159260476 and parameters: {'kernel_type': 'Matern', 'length_scale': 10.184140527723784, 'noise_level': 0.04547830874782416, 'constant_value': 0.37727981643761765, 'nu': 0.5}. Best is trial 881 with value: 0.35916990930150405.
[I 2024-12-04 20:10:58,482] Trial 956 finished with value: 1.0624161178603326 and parameters: {'kernel_type': 'Matern', 'length_scale': 0.02442762915531695, 'noise_level': 0.9920512661723271, 'constant_value': 0.049894461590259245, 'nu': 1.5}. Best is trial 881 with value: 0.35916990930150405.
[I 2024-12-04 20:10:58,770] Trial 954 finished with value: 0.35921117301676303 and parameters: {'kernel_type': 'Matern', 'length_scale': 0.10643190189472522, 'noise_level': 0.01335582175690698, 'constant_value': 379.7390954065301, 'nu': 0.5}. Best is trial 881 with value: 0.35916990930150405.
[I 2024-12-04 20:11:02,454] Trial 957 finished with value: 0.3592113459975662 and parameters: {'kernel_type': 'Matern', 'length_scale': 0.35431566136613923, 'noise_level': 0.9060571341709781, 'constant_value': 0.009900516612152214, 'nu': 0.5}. Best is trial 881 with value: 0.35916990930150405.
[I 2024-12-04 20:11:02,837] Trial 958 finished with value: 0.35921131868888634 and parameters: {'kernel_type': 'Matern', 'length_scale': 63.443263643944576, 'noise_level': 0.8164578732686072, 'constant_value': 5.5198952649362125, 'nu': 0.5}. Best is trial 881 with value: 0.35916990930150405.
[I 2024-12-04 20:11:03,917] Trial 959 finished with value: 0.3592105559715937 and parameters: {'kernel_type': 'Matern', 'length_scale': 0.6752924137310745, 'noise_level': 0.022409401006804747, 'constant_value': 0.16126180089188324, 'nu': 0.5}. Best is trial 881 with value: 0.35916990930150405.
[I 2024-12-04 20:11:07,460] Trial 960 finished with value: 0.3592110599101586 and parameters: {'kernel_type': 'Matern', 'length_scale': 16.46266580099224, 'noise_level': 0.0001994141766521328, 'constant_value': 11.95301261587926, 'nu': 0.5}. Best is trial 881 with value: 0.35916990930150405.
[I 2024-12-04 20:11:08,871] Trial 961 finished with value: 0.3592112553490668 and parameters: {'kernel_type': 'Matern', 'length_scale': 21.01930514831188, 'noise_level': 0.010761992576150957, 'constant_value': 411.2873571096488, 'nu': 0.5}. Best is trial 881 with value: 0.35916990930150405.
[I 2024-12-04 20:11:09,571] Trial 962 finished with value: 0.35921120114001825 and parameters: {'kernel_type': 'Matern', 'length_scale': 0.901810736836399, 'noise_level': 0.9090330827847048, 'constant_value': 0.3436020157211965, 'nu': 0.5}. Best is trial 881 with value: 0.35916990930150405.
[I 2024-12-04 20:11:13,498] Trial 963 finished with value: 0.35921123672611505 and parameters: {'kernel_type': 'Matern', 'length_scale': 20.707850756463706, 'noise_level': 0.061254972270929714, 'constant_value': 0.0007902086775273293, 'nu': 0.5}. Best is trial 881 with value: 0.35916990930150405.
[I 2024-12-04 20:11:15,188] Trial 965 finished with value: 0.35921124307863045 and parameters: {'kernel_type': 'Matern', 'length_scale': 0.47838313770606117, 'noise_level': 0.015767001305987464, 'constant_value': 0.9641955241191854, 'nu': 0.5}. Best is trial 881 with value: 0.35916990930150405.
[I 2024-12-04 20:11:17,798] Trial 964 finished with value: 0.3592109692124466 and parameters: {'kernel_type': 'Matern', 'length_scale': 5.810347819562806, 'noise_level': 0.0007647306061070695, 'constant_value': 0.07550646862860018, 'nu': 0.5}. Best is trial 881 with value: 0.35916990930150405.
[I 2024-12-04 20:11:21,174] Trial 967 finished with value: 1.062416117276678 and parameters: {'kernel_type': 'Matern', 'length_scale': 0.022121618213071122, 'noise_level': 0.05542981426121285, 'constant_value': 45.94151393533758, 'nu': 0.5}. Best is trial 881 with value: 0.35916990930150405.
[I 2024-12-04 20:11:23,689] Trial 968 finished with value: 1.0624161174466955 and parameters: {'kernel_type': 'Matern', 'length_scale': 0.019785459941820262, 'noise_level': 0.006998353884962065, 'constant_value': 0.22748099054355803, 'nu': 0.5}. Best is trial 881 with value: 0.35916990930150405.
[I 2024-12-04 20:11:24,464] Trial 966 finished with value: 0.3592112429514232 and parameters: {'kernel_type': 'Matern', 'length_scale': 0.2816270145330409, 'noise_level': 0.0027166152482042457, 'constant_value': 4.654731509174631e-06, 'nu': 0.5}. Best is trial 881 with value: 0.35916990930150405.
[I 2024-12-04 20:11:27,789] Trial 969 finished with value: 0.3592129489176712 and parameters: {'kernel_type': 'Matern', 'length_scale': 29.85685434134222, 'noise_level': 0.1395386658632452, 'constant_value': 0.028692059162364034, 'nu': 0.5}. Best is trial 881 with value: 0.35916990930150405.
[I 2024-12-04 20:11:31,090] Trial 971 finished with value: 1.0624161172629076 and parameters: {'kernel_type': 'Matern', 'length_scale': 6.64287196640923e-05, 'noise_level': 3.3731647310731583e-10, 'constant_value': 1.2287518728589451e-07, 'nu': 1.5}. Best is trial 881 with value: 0.35916990930150405.
[I 2024-12-04 20:11:32,056] Trial 970 finished with value: 1.0624161173532671 and parameters: {'kernel_type': 'Matern', 'length_scale': 0.0029739923980082773, 'noise_level': 0.7779576659411023, 'constant_value': 0.00290382198913991, 'nu': 0.5}. Best is trial 881 with value: 0.35916990930150405.
[I 2024-12-04 20:11:34,826] Trial 972 finished with value: 0.3592112713818982 and parameters: {'kernel_type': 'Matern', 'length_scale': 0.1510639655957126, 'noise_level': 0.03543693399524575, 'constant_value': 0.015429641745251776, 'nu': 0.5}. Best is trial 881 with value: 0.35916990930150405.
[I 2024-12-04 20:11:36,786] Trial 973 finished with value: 0.35921033670675 and parameters: {'kernel_type': 'Matern', 'length_scale': 0.569846814470768, 'noise_level': 0.019551341625808218, 'constant_value': 0.1375078207148555, 'nu': 0.5}. Best is trial 881 with value: 0.35916990930150405.
[I 2024-12-04 20:11:39,351] Trial 974 finished with value: 1.0624161172837514 and parameters: {'kernel_type': 'RBF', 'length_scale': 0.00989616890414747, 'noise_level': 0.11897308312180918, 'constant_value': 0.0012315710292370983, 'nu': 2.5}. Best is trial 881 with value: 0.35916990930150405.
[I 2024-12-04 20:11:41,014] Trial 975 finished with value: 0.3592107944216752 and parameters: {'kernel_type': 'Matern', 'length_scale': 13.470910954561655, 'noise_level': 0.0789684670732745, 'constant_value': 0.012805479681559678, 'nu': 0.5}. Best is trial 881 with value: 0.35916990930150405.
[I 2024-12-04 20:11:44,510] Trial 977 finished with value: 0.3592110684427607 and parameters: {'kernel_type': 'Matern', 'length_scale': 1.0426286294902285, 'noise_level': 0.02023331540024632, 'constant_value': 0.12151884695791719, 'nu': 0.5}. Best is trial 881 with value: 0.35916990930150405.
[I 2024-12-04 20:11:46,564] Trial 976 finished with value: 1.0624161173771862 and parameters: {'kernel_type': 'Matern', 'length_scale': 727.9553388285034, 'noise_level': 9.94868446523955e-07, 'constant_value': 2.2523914359076896e-06, 'nu': 2.5}. Best is trial 881 with value: 0.35916990930150405.
[I 2024-12-04 20:11:48,206] Trial 978 finished with value: 0.35921124146794176 and parameters: {'kernel_type': 'Matern', 'length_scale': 0.6393842490160048, 'noise_level': 0.010607168082716811, 'constant_value': 0.0011993280636533985, 'nu': 0.5}. Best is trial 881 with value: 0.35916990930150405.
[I 2024-12-04 20:11:53,081] Trial 979 finished with value: 0.3592177351233313 and parameters: {'kernel_type': 'Matern', 'length_scale': 0.08299234581933668, 'noise_level': 0.010140428408817542, 'constant_value': 0.08451194479964032, 'nu': 0.5}. Best is trial 881 with value: 0.35916990930150405.
[I 2024-12-04 20:11:53,447] Trial 981 finished with value: 1.0624161171505455 and parameters: {'kernel_type': 'RBF', 'length_scale': 3.3202135788798333, 'noise_level': 2.812453147928233e-09, 'constant_value': 0.002852345445594121, 'nu': 2.5}. Best is trial 881 with value: 0.35916990930150405.
[I 2024-12-04 20:11:55,667] Trial 980 finished with value: 1.0624161172678162 and parameters: {'kernel_type': 'Matern', 'length_scale': 263.5262351253221, 'noise_level': 0.035267301895065835, 'constant_value': 0.05468484112337626, 'nu': 2.5}. Best is trial 881 with value: 0.35916990930150405.
[I 2024-12-04 20:11:58,276] Trial 983 finished with value: 1.0624161169541972 and parameters: {'kernel_type': 'Matern', 'length_scale': 0.00047736873075792107, 'noise_level': 0.01595729474618962, 'constant_value': 1039.407886667682, 'nu': 2.5}. Best is trial 881 with value: 0.35916990930150405.
[I 2024-12-04 20:12:01,745] Trial 984 finished with value: 1.0624161172680833 and parameters: {'kernel_type': 'Matern', 'length_scale': 0.01701804969331988, 'noise_level': 0.026344365147016355, 'constant_value': 0.3767675024657225, 'nu': 0.5}. Best is trial 881 with value: 0.35916990930150405.
[I 2024-12-04 20:12:02,537] Trial 982 finished with value: 1.0624161172615376 and parameters: {'kernel_type': 'Matern', 'length_scale': 5381.48511860241, 'noise_level': 0.0010001002718775245, 'constant_value': 25.47258253507116, 'nu': 2.5}. Best is trial 881 with value: 0.35916990930150405.
[I 2024-12-04 20:12:05,795] Trial 985 finished with value: 1.0624161159341925 and parameters: {'kernel_type': 'Matern', 'length_scale': 77067.89070988662, 'noise_level': 7.203488029517717e-06, 'constant_value': 0.36139795946088293, 'nu': 0.5}. Best is trial 881 with value: 0.35916990930150405.
[I 2024-12-04 20:12:08,791] Trial 987 finished with value: 0.3592114244019791 and parameters: {'kernel_type': 'Matern', 'length_scale': 0.3472656944626566, 'noise_level': 0.06533937777882635, 'constant_value': 0.04415804154813472, 'nu': 0.5}. Best is trial 881 with value: 0.35916990930150405.
[I 2024-12-04 20:12:10,947] Trial 986 finished with value: 0.35921126637551476 and parameters: {'kernel_type': 'Matern', 'length_scale': 0.20408068126587597, 'noise_level': 0.0005033559907979489, 'constant_value': 0.0020278424060717988, 'nu': 0.5}. Best is trial 881 with value: 0.35916990930150405.
[I 2024-12-04 20:12:14,145] Trial 988 finished with value: 1.0624161172684685 and parameters: {'kernel_type': 'Matern', 'length_scale': 0.015096403777624959, 'noise_level': 0.3348057888809765, 'constant_value': 0.299246627199034, 'nu': 0.5}. Best is trial 881 with value: 0.35916990930150405.
[I 2024-12-04 20:12:17,373] Trial 990 finished with value: 1.0624161172170448 and parameters: {'kernel_type': 'Matern', 'length_scale': 0.0027603738201897824, 'noise_level': 0.0012620957713621033, 'constant_value': 3331.9811621784693, 'nu': 0.5}. Best is trial 881 with value: 0.35916990930150405.
[I 2024-12-04 20:12:20,827] Trial 989 finished with value: 1.062416117268493 and parameters: {'kernel_type': 'Matern', 'length_scale': 0.0018761104309544272, 'noise_level': 0.0018260282400976437, 'constant_value': 8.601601257550812e-05, 'nu': 0.5}. Best is trial 881 with value: 0.35916990930150405.
[I 2024-12-04 20:12:20,982] Trial 991 finished with value: 0.3592112475952576 and parameters: {'kernel_type': 'Matern', 'length_scale': 0.482601463231279, 'noise_level': 0.004012609770387017, 'constant_value': 0.028808214804049857, 'nu': 0.5}. Best is trial 881 with value: 0.35916990930150405.
[I 2024-12-04 20:12:25,417] Trial 992 finished with value: 0.35921126553414123 and parameters: {'kernel_type': 'Matern', 'length_scale': 0.10677540310975608, 'noise_level': 0.036019913795967216, 'constant_value': 8.932995252920836, 'nu': 0.5}. Best is trial 881 with value: 0.35916990930150405.
[I 2024-12-04 20:12:26,353] Trial 994 finished with value: 0.3592083214386265 and parameters: {'kernel_type': 'Matern', 'length_scale': 620.6049179942851, 'noise_level': 0.012865323176916476, 'constant_value': 882.4585008593705, 'nu': 0.5}. Best is trial 881 with value: 0.35916990930150405.
[I 2024-12-04 20:12:27,982] Trial 993 finished with value: 0.4226902735902377 and parameters: {'kernel_type': 'Matern', 'length_scale': 0.3495214034950236, 'noise_level': 0.04670490213997805, 'constant_value': 0.00012233983829472366, 'nu': 1.5}. Best is trial 881 with value: 0.35916990930150405.
[I 2024-12-04 20:12:30,844] Trial 995 finished with value: 0.3592094488891741 and parameters: {'kernel_type': 'Matern', 'length_scale': 28.627472771107982, 'noise_level': 0.6163409856610658, 'constant_value': 0.35241655357936663, 'nu': 0.5}. Best is trial 881 with value: 0.35916990930150405.
[I 2024-12-04 20:12:32,833] Trial 996 finished with value: 0.3592114413038454 and parameters: {'kernel_type': 'Matern', 'length_scale': 57.375834486420445, 'noise_level': 0.008550578397500497, 'constant_value': 225.51203803288715, 'nu': 0.5}. Best is trial 881 with value: 0.35916990930150405.
[I 2024-12-04 20:12:33,001] Trial 997 finished with value: 0.3592112416305222 and parameters: {'kernel_type': 'Matern', 'length_scale': 460.51678198167684, 'noise_level': 0.0005934835863039264, 'constant_value': 496.888314908155, 'nu': 0.5}. Best is trial 881 with value: 0.35916990930150405.
[I 2024-12-04 20:12:37,514] Trial 998 finished with value: 0.35921124095784324 and parameters: {'kernel_type': 'Matern', 'length_scale': 914.9455388083747, 'noise_level': 0.005506093683714508, 'constant_value': 2600.6445823076433, 'nu': 0.5}. Best is trial 881 with value: 0.35916990930150405.
[I 2024-12-04 20:12:38,581] Trial 1000 finished with value: 0.35921122523921833 and parameters: {'kernel_type': 'Matern', 'length_scale': 6264.968743915148, 'noise_level': 0.017809948575914288, 'constant_value': 40717.2157681086, 'nu': 0.5}. Best is trial 881 with value: 0.35916990930150405.
[I 2024-12-04 20:12:39,098] Trial 999 finished with value: 0.35921122561943025 and parameters: {'kernel_type': 'Matern', 'length_scale': 527.4725152844378, 'noise_level': 0.044012944823105395, 'constant_value': 4766.478095930754, 'nu': 0.5}. Best is trial 881 with value: 0.35916990930150405.
[I 2024-12-04 20:12:43,210] Trial 1001 finished with value: 0.3592112352310092 and parameters: {'kernel_type': 'Matern', 'length_scale': 787.9626678338859, 'noise_level': 0.017917629745570197, 'constant_value': 1224.1798585404422, 'nu': 0.5}. Best is trial 881 with value: 0.35916990930150405.
[I 2024-12-04 20:12:43,824] Trial 1003 finished with value: 0.35921114468731236 and parameters: {'kernel_type': 'Matern', 'length_scale': 29.21715944899394, 'noise_level': 0.7665256616646674, 'constant_value': 105.88970450999886, 'nu': 0.5}. Best is trial 881 with value: 0.35916990930150405.
[I 2024-12-04 20:12:43,952] Trial 1002 finished with value: 0.3592112424605837 and parameters: {'kernel_type': 'Matern', 'length_scale': 6565.717121742612, 'noise_level': 0.02224426913451033, 'constant_value': 224.62673938116782, 'nu': 0.5}. Best is trial 881 with value: 0.35916990930150405.
[I 2024-12-04 20:12:48,962] Trial 1006 finished with value: 0.3592111316069935 and parameters: {'kernel_type': 'Matern', 'length_scale': 2.0729090206545013, 'noise_level': 0.00117910581094844, 'constant_value': 5996.603867083749, 'nu': 0.5}. Best is trial 881 with value: 0.35916990930150405.
