[I 2024-12-04 15:01:25,122] Trial 671 finished with value: 0.4883034221035496 and parameters: {'kernel_type': 'Matern', 'length_scale': 98551.31495930479, 'noise_level': 0.2858319091107393, 'constant_value': 84385.29378366753, 'nu': 0.5}. Best is trial 386 with value: 0.4872991004520934.
[I 2024-12-04 15:01:25,612] Trial 672 finished with value: 0.48830341864649013 and parameters: {'kernel_type': 'Matern', 'length_scale': 49923.03986586521, 'noise_level': 0.821368983932233, 'constant_value': 91.92050323545936, 'nu': 0.5}. Best is trial 386 with value: 0.4872991004520934.
[I 2024-12-04 15:01:25,772] Trial 677 finished with value: 0.48830341885690975 and parameters: {'kernel_type': 'Matern', 'length_scale': 36606.334584996584, 'noise_level': 0.9308401529972697, 'constant_value': 258.4640581625757, 'nu': 0.5}. Best is trial 386 with value: 0.4872991004520934.
[I 2024-12-04 15:01:25,829] Trial 666 finished with value: 1.2614543702023704 and parameters: {'kernel_type': 'RBF', 'length_scale': 1.392474784985801e-05, 'noise_level': 1.570319516128324e-05, 'constant_value': 1871.4514363112476, 'nu': 1.5}. Best is trial 386 with value: 0.4872991004520934.
[I 2024-12-04 15:01:26,735] Trial 681 finished with value: 0.48830341927653714 and parameters: {'kernel_type': 'Matern', 'length_scale': 629.8129299559631, 'noise_level': 0.0007797248935464183, 'constant_value': 89020.93680519465, 'nu': 0.5}. Best is trial 386 with value: 0.4872991004520934.
[I 2024-12-04 15:01:27,570] Trial 682 finished with value: 1.2614547953941475 and parameters: {'kernel_type': 'Matern', 'length_scale': 869.1188663965099, 'noise_level': 0.03288026487874019, 'constant_value': 73480.02616892531, 'nu': 0.5}. Best is trial 386 with value: 0.4872991004520934.
[I 2024-12-04 15:01:27,726] Trial 688 finished with value: 0.48830345659539726 and parameters: {'kernel_type': 'Matern', 'length_scale': 89220.34476420171, 'noise_level': 0.0016246796392419202, 'constant_value': 10657.000498586229, 'nu': 0.5}. Best is trial 386 with value: 0.4872991004520934.
[I 2024-12-04 15:01:28,363] Trial 683 finished with value: 0.48830342523678416 and parameters: {'kernel_type': 'Matern', 'length_scale': 5869.708489651403, 'noise_level': 0.047209367492280746, 'constant_value': 94790.58922220557, 'nu': 0.5}. Best is trial 386 with value: 0.4872991004520934.
[I 2024-12-04 15:01:29,003] Trial 686 finished with value: 0.4883034103662365 and parameters: {'kernel_type': 'Matern', 'length_scale': 3617.1552888994197, 'noise_level': 0.8607453255111099, 'constant_value': 96496.49126173182, 'nu': 0.5}. Best is trial 386 with value: 0.4872991004520934.
[I 2024-12-04 15:01:30,810] Trial 687 finished with value: 0.48830340613588885 and parameters: {'kernel_type': 'Matern', 'length_scale': 61.21494198848094, 'noise_level': 0.0006219104883209344, 'constant_value': 125.73949611004984, 'nu': 0.5}. Best is trial 386 with value: 0.4872991004520934.
[I 2024-12-04 15:01:31,647] Trial 679 finished with value: 1.2614543702025565 and parameters: {'kernel_type': 'Matern', 'length_scale': 0.0008129560687423823, 'noise_level': 1.1009922940768559e-05, 'constant_value': 62326.12433773733, 'nu': 2.5}. Best is trial 386 with value: 0.4872991004520934.
[I 2024-12-04 15:01:32,382] Trial 691 finished with value: 0.4883033976594252 and parameters: {'kernel_type': 'Matern', 'length_scale': 12.89480689738117, 'noise_level': 0.08887578681762248, 'constant_value': 1760.4957307024033, 'nu': 0.5}. Best is trial 386 with value: 0.4872991004520934.
[I 2024-12-04 15:01:32,551] Trial 685 finished with value: 1.240111232421823 and parameters: {'kernel_type': 'RBF', 'length_scale': 4996.813541959118, 'noise_level': 6.888817676330008e-08, 'constant_value': 1.4767118229816395e-05, 'nu': 2.5}. Best is trial 386 with value: 0.4872991004520934.
[I 2024-12-04 15:01:32,664] Trial 678 finished with value: 0.5663936628759433 and parameters: {'kernel_type': 'Matern', 'length_scale': 1.303462636410438, 'noise_level': 0.008310495164768556, 'constant_value': 26.307718001601387, 'nu': 2.5}. Best is trial 386 with value: 0.4872991004520934.
[I 2024-12-04 15:01:32,819] Trial 684 finished with value: 1.2401112328683552 and parameters: {'kernel_type': 'RBF', 'length_scale': 1.777344932641786e-05, 'noise_level': 8.184437869814769e-08, 'constant_value': 0.04640743107051793, 'nu': 2.5}. Best is trial 386 with value: 0.4872991004520934.
[I 2024-12-04 15:01:36,085] Trial 697 finished with value: 0.48830344100633216 and parameters: {'kernel_type': 'Matern', 'length_scale': 12467.455701953215, 'noise_level': 0.00897728162272536, 'constant_value': 90266.82970056703, 'nu': 0.5}. Best is trial 386 with value: 0.4872991004520934.
[I 2024-12-04 15:01:36,701] Trial 701 finished with value: 1.2614547885482383 and parameters: {'kernel_type': 'Matern', 'length_scale': 0.47152665890915435, 'noise_level': 0.026333623319071246, 'constant_value': 49917.625330594456, 'nu': 1.5}. Best is trial 386 with value: 0.4872991004520934.
[I 2024-12-04 15:01:37,513] Trial 689 finished with value: 1.2401112314135592 and parameters: {'kernel_type': 'Matern', 'length_scale': 0.05002506357826205, 'noise_level': 0.18515557154586454, 'constant_value': 0.0026719873601368143, 'nu': 0.5}. Best is trial 386 with value: 0.4872991004520934.
[I 2024-12-04 15:01:37,631] Trial 692 finished with value: 0.4883034047000246 and parameters: {'kernel_type': 'Matern', 'length_scale': 1253.4199069062315, 'noise_level': 0.018927132208453875, 'constant_value': 1890.3963193878578, 'nu': 0.5}. Best is trial 386 with value: 0.4872991004520934.
[I 2024-12-04 15:01:38,932] Trial 696 finished with value: 0.48830331417036094 and parameters: {'kernel_type': 'Matern', 'length_scale': 27.2620779933713, 'noise_level': 0.009881969462869835, 'constant_value': 13.7758850469619, 'nu': 0.5}. Best is trial 386 with value: 0.4872991004520934.
[I 2024-12-04 15:01:39,621] Trial 698 finished with value: 0.644385031007168 and parameters: {'kernel_type': 'RBF', 'length_scale': 0.6983204670044127, 'noise_level': 0.6219360707522298, 'constant_value': 9.731597600969158, 'nu': 2.5}. Best is trial 386 with value: 0.4872991004520934.
[I 2024-12-04 15:01:40,612] Trial 702 finished with value: 1.2401112272406196 and parameters: {'kernel_type': 'RBF', 'length_scale': 0.005621871655509707, 'noise_level': 1.3896166133738092e-08, 'constant_value': 7.969916134168132e-07, 'nu': 1.5}. Best is trial 386 with value: 0.4872991004520934.
[I 2024-12-04 15:01:40,682] Trial 699 finished with value: 0.4883033438225041 and parameters: {'kernel_type': 'Matern', 'length_scale': 80594.83632964616, 'noise_level': 0.573158362572915, 'constant_value': 3809.6857187856185, 'nu': 0.5}. Best is trial 386 with value: 0.4872991004520934.
[I 2024-12-04 15:01:41,268] Trial 690 finished with value: 0.5273054426118672 and parameters: {'kernel_type': 'Matern', 'length_scale': 3419.343360912874, 'noise_level': 0.7782026800486036, 'constant_value': 48.336709434801975, 'nu': 1.5}. Best is trial 386 with value: 0.4872991004520934.
[I 2024-12-04 15:01:41,358] Trial 694 finished with value: 0.4883034069489894 and parameters: {'kernel_type': 'Matern', 'length_scale': 0.09523065102583901, 'noise_level': 0.02658797890475329, 'constant_value': 1.3241243847923618, 'nu': 0.5}. Best is trial 386 with value: 0.4872991004520934.
[I 2024-12-04 15:01:42,364] Trial 703 finished with value: 0.48830341838031 and parameters: {'kernel_type': 'Matern', 'length_scale': 481.9841229846712, 'noise_level': 0.027835620235751455, 'constant_value': 760.6016596509145, 'nu': 0.5}. Best is trial 386 with value: 0.4872991004520934.
[I 2024-12-04 15:01:42,794] Trial 707 finished with value: 1.240111232574458 and parameters: {'kernel_type': 'Matern', 'length_scale': 3084.9714539821243, 'noise_level': 0.00446944728931918, 'constant_value': 5.291098631669913, 'nu': 0.5}. Best is trial 386 with value: 0.4872991004520934.
[I 2024-12-04 15:01:42,803] Trial 711 finished with value: 0.4883033996985396 and parameters: {'kernel_type': 'Matern', 'length_scale': 63.86121685226679, 'noise_level': 0.015277328544332424, 'constant_value': 1172.3034984654835, 'nu': 0.5}. Best is trial 386 with value: 0.4872991004520934.
[I 2024-12-04 15:01:42,813] Trial 695 finished with value: 1.2401112272406196 and parameters: {'kernel_type': 'Matern', 'length_scale': 0.0057522326564096, 'noise_level': 1.6591522782407963e-09, 'constant_value': 4.3862195329946875e-06, 'nu': 2.5}. Best is trial 386 with value: 0.4872991004520934.
[I 2024-12-04 15:01:43,421] Trial 700 finished with value: 0.48830349103855664 and parameters: {'kernel_type': 'Matern', 'length_scale': 53081.98753867473, 'noise_level': 0.9937519847715093, 'constant_value': 2569.6109820096976, 'nu': 0.5}. Best is trial 386 with value: 0.4872991004520934.
[I 2024-12-04 15:01:44,620] Trial 693 finished with value: 0.4883034169636279 and parameters: {'kernel_type': 'Matern', 'length_scale': 72493.97666589564, 'noise_level': 0.007239217601440315, 'constant_value': 3996.1333221169125, 'nu': 0.5}. Best is trial 386 with value: 0.4872991004520934.
[I 2024-12-04 15:01:45,180] Trial 705 finished with value: 0.4883034236912499 and parameters: {'kernel_type': 'Matern', 'length_scale': 522.750838717058, 'noise_level': 0.03517794067112396, 'constant_value': 4.199863043457142, 'nu': 0.5}. Best is trial 386 with value: 0.4872991004520934.
[I 2024-12-04 15:01:45,265] Trial 709 finished with value: 0.48830344700735984 and parameters: {'kernel_type': 'Matern', 'length_scale': 0.8808032168771263, 'noise_level': 0.10697501088915283, 'constant_value': 29.86712048118911, 'nu': 0.5}. Best is trial 386 with value: 0.4872991004520934.
[I 2024-12-04 15:01:46,345] Trial 712 finished with value: 0.48830342007334393 and parameters: {'kernel_type': 'Matern', 'length_scale': 62608.77697133156, 'noise_level': 0.01493144390569138, 'constant_value': 89629.35278571016, 'nu': 0.5}. Best is trial 386 with value: 0.4872991004520934.
[I 2024-12-04 15:01:46,347] Trial 713 finished with value: 0.48830340976257913 and parameters: {'kernel_type': 'Matern', 'length_scale': 8321.772659090622, 'noise_level': 0.036552486189601, 'constant_value': 1047.4578918189493, 'nu': 0.5}. Best is trial 386 with value: 0.4872991004520934.
[I 2024-12-04 15:01:46,381] Trial 706 finished with value: 0.4883034221098612 and parameters: {'kernel_type': 'Matern', 'length_scale': 61.18742736665735, 'noise_level': 0.17668971965555272, 'constant_value': 57846.223998191344, 'nu': 0.5}. Best is trial 386 with value: 0.4872991004520934.
[I 2024-12-04 15:01:46,644] Trial 720 finished with value: 0.4883032809826403 and parameters: {'kernel_type': 'Matern', 'length_scale': 579.2020578804792, 'noise_level': 0.28848182111681364, 'constant_value': 5263.908182318688, 'nu': 0.5}. Best is trial 386 with value: 0.4872991004520934.
[I 2024-12-04 15:01:47,736] Trial 708 finished with value: 0.48830342216824835 and parameters: {'kernel_type': 'Matern', 'length_scale': 2.7603770278168964, 'noise_level': 0.00445011270034672, 'constant_value': 0.11341563898953944, 'nu': 0.5}. Best is trial 386 with value: 0.4872991004520934.
[I 2024-12-04 15:01:48,771] Trial 710 finished with value: 0.48830317271063245 and parameters: {'kernel_type': 'Matern', 'length_scale': 670.1583559072448, 'noise_level': 0.00251408763834709, 'constant_value': 3744.457989795311, 'nu': 0.5}. Best is trial 386 with value: 0.4872991004520934.
[I 2024-12-04 15:01:49,202] Trial 715 finished with value: 1.2401112323514474 and parameters: {'kernel_type': 'Matern', 'length_scale': 8472.505929365945, 'noise_level': 0.0010602143581377949, 'constant_value': 1136.0666606024656, 'nu': 2.5}. Best is trial 386 with value: 0.4872991004520934.
[I 2024-12-04 15:01:49,204] Trial 714 finished with value: 0.48830341874817385 and parameters: {'kernel_type': 'Matern', 'length_scale': 4436.986936624828, 'noise_level': 0.00020594492230466223, 'constant_value': 1675.290034131451, 'nu': 0.5}. Best is trial 386 with value: 0.4872991004520934.
[I 2024-12-04 15:01:49,212] Trial 704 finished with value: 0.48828551254977853 and parameters: {'kernel_type': 'Matern', 'length_scale': 30.14592178151214, 'noise_level': 0.8248928504833302, 'constant_value': 1571.1242253197163, 'nu': 0.5}. Best is trial 386 with value: 0.4872991004520934.
[I 2024-12-04 15:01:49,221] Trial 717 finished with value: 0.4883034097305373 and parameters: {'kernel_type': 'Matern', 'length_scale': 2634.4131349503923, 'noise_level': 0.8461522409460566, 'constant_value': 537.9324068116131, 'nu': 0.5}. Best is trial 386 with value: 0.4872991004520934.
[I 2024-12-04 15:01:49,223] Trial 718 finished with value: 0.4883033833280597 and parameters: {'kernel_type': 'Matern', 'length_scale': 1298.8900536465098, 'noise_level': 0.0096769600996944, 'constant_value': 82405.06632585509, 'nu': 0.5}. Best is trial 386 with value: 0.4872991004520934.
[I 2024-12-04 15:01:52,060] Trial 722 finished with value: 1.2614547817116402 and parameters: {'kernel_type': 'Matern', 'length_scale': 10.916397931399425, 'noise_level': 0.00016730490176663045, 'constant_value': 230.42551758796643, 'nu': 0.5}. Best is trial 386 with value: 0.4872991004520934.
[I 2024-12-04 15:01:52,114] Trial 719 finished with value: 0.4883034077656688 and parameters: {'kernel_type': 'Matern', 'length_scale': 98977.1449615927, 'noise_level': 0.9056604758835131, 'constant_value': 47713.38961219224, 'nu': 0.5}. Best is trial 386 with value: 0.4872991004520934.
[I 2024-12-04 15:01:52,224] Trial 716 finished with value: 0.48830424935919486 and parameters: {'kernel_type': 'Matern', 'length_scale': 0.784757447838366, 'noise_level': 0.001553700666154868, 'constant_value': 546.1843902152444, 'nu': 0.5}. Best is trial 386 with value: 0.4872991004520934.
[I 2024-12-04 15:01:54,957] Trial 731 finished with value: 0.48830346632543487 and parameters: {'kernel_type': 'Matern', 'length_scale': 51.72017134730296, 'noise_level': 0.20330956763156535, 'constant_value': 3416.5775704030566, 'nu': 0.5}. Best is trial 386 with value: 0.4872991004520934.
[I 2024-12-04 15:01:55,180] Trial 724 finished with value: 0.48830341184496895 and parameters: {'kernel_type': 'Matern', 'length_scale': 0.22621722728867422, 'noise_level': 0.11400696867094974, 'constant_value': 1903.4190214422729, 'nu': 0.5}. Best is trial 386 with value: 0.4872991004520934.
[I 2024-12-04 15:01:55,621] Trial 733 finished with value: 0.48830333115211333 and parameters: {'kernel_type': 'Matern', 'length_scale': 1.0697553906357786, 'noise_level': 0.28576879358407353, 'constant_value': 84778.25130705845, 'nu': 0.5}. Best is trial 386 with value: 0.4872991004520934.
[I 2024-12-04 15:01:55,650] Trial 728 finished with value: 0.4883034268162872 and parameters: {'kernel_type': 'Matern', 'length_scale': 18.88688458748456, 'noise_level': 0.06937563724999195, 'constant_value': 98.44191720115656, 'nu': 0.5}. Best is trial 386 with value: 0.4872991004520934.
[I 2024-12-04 15:01:57,073] Trial 730 finished with value: 0.4883034387879447 and parameters: {'kernel_type': 'Matern', 'length_scale': 64.00021133917586, 'noise_level': 0.459417627314697, 'constant_value': 1073.3251785080618, 'nu': 0.5}. Best is trial 386 with value: 0.4872991004520934.
[I 2024-12-04 15:01:58,138] Trial 735 finished with value: 0.4883032387475953 and parameters: {'kernel_type': 'Matern', 'length_scale': 6.679454780945027, 'noise_level': 0.4059832299907341, 'constant_value': 880.2896526424545, 'nu': 0.5}. Best is trial 386 with value: 0.4872991004520934.
[I 2024-12-04 15:01:58,371] Trial 726 finished with value: 0.5663936565723509 and parameters: {'kernel_type': 'Matern', 'length_scale': 33.90249155161791, 'noise_level': 0.2674284984438231, 'constant_value': 4.052683771187399, 'nu': 2.5}. Best is trial 386 with value: 0.4872991004520934.
[I 2024-12-04 15:01:58,584] Trial 723 finished with value: 1.2614547953941473 and parameters: {'kernel_type': 'Matern', 'length_scale': 14.045513494183465, 'noise_level': 0.02011228731014472, 'constant_value': 690.6373343614612, 'nu': 0.5}. Best is trial 386 with value: 0.4872991004520934.
[I 2024-12-04 15:02:00,105] Trial 725 finished with value: 0.4883032038558654 and parameters: {'kernel_type': 'Matern', 'length_scale': 30.104284854336544, 'noise_level': 0.3291253113003359, 'constant_value': 52.16325145385003, 'nu': 0.5}. Best is trial 386 with value: 0.4872991004520934.
[I 2024-12-04 15:02:01,097] Trial 729 finished with value: 1.2614543702026846 and parameters: {'kernel_type': 'Matern', 'length_scale': 2.4548328816761518e-05, 'noise_level': 1.4942967437883283e-07, 'constant_value': 258.68405075624037, 'nu': 1.5}. Best is trial 386 with value: 0.4872991004520934.
[I 2024-12-04 15:02:02,189] Trial 727 finished with value: 0.48830353683048605 and parameters: {'kernel_type': 'Matern', 'length_scale': 13.187705978603201, 'noise_level': 0.5894470836450458, 'constant_value': 344.11647106220437, 'nu': 0.5}. Best is trial 386 with value: 0.4872991004520934.
[I 2024-12-04 15:02:02,590] Trial 742 finished with value: 0.4883034182627874 and parameters: {'kernel_type': 'Matern', 'length_scale': 2.5208643596141265, 'noise_level': 0.8827512016039205, 'constant_value': 10299.174199715842, 'nu': 0.5}. Best is trial 386 with value: 0.4872991004520934.
[I 2024-12-04 15:02:02,592] Trial 732 finished with value: 1.2614547870520976 and parameters: {'kernel_type': 'Matern', 'length_scale': 502.79829519688343, 'noise_level': 1.2421207400818348e-06, 'constant_value': 960.0911090056522, 'nu': 0.5}. Best is trial 386 with value: 0.4872991004520934.
[I 2024-12-04 15:02:04,342] Trial 738 finished with value: 0.48830341886683615 and parameters: {'kernel_type': 'Matern', 'length_scale': 92.10815521392357, 'noise_level': 0.012601599609850418, 'constant_value': 85.77394464315186, 'nu': 0.5}. Best is trial 386 with value: 0.4872991004520934.
[I 2024-12-04 15:02:04,782] Trial 739 finished with value: 1.240111232505261 and parameters: {'kernel_type': 'Matern', 'length_scale': 348.2179296418305, 'noise_level': 0.005302442852478688, 'constant_value': 0.7902918934693477, 'nu': 0.5}. Best is trial 386 with value: 0.4872991004520934.
[I 2024-12-04 15:02:05,079] Trial 741 finished with value: 0.48830346110283573 and parameters: {'kernel_type': 'Matern', 'length_scale': 2.6616883018513784, 'noise_level': 0.21491745859534553, 'constant_value': 3595.595512240109, 'nu': 0.5}. Best is trial 386 with value: 0.4872991004520934.
[I 2024-12-04 15:02:05,092] Trial 750 finished with value: 0.4883034162599213 and parameters: {'kernel_type': 'Matern', 'length_scale': 0.6119854088598871, 'noise_level': 0.6509213819419107, 'constant_value': 1.9094819927967055, 'nu': 0.5}. Best is trial 386 with value: 0.4872991004520934.
[I 2024-12-04 15:02:05,098] Trial 748 finished with value: 0.48830340937195726 and parameters: {'kernel_type': 'Matern', 'length_scale': 17.059358595705074, 'noise_level': 0.0031673683489910867, 'constant_value': 6.191382980134691, 'nu': 0.5}. Best is trial 386 with value: 0.4872991004520934.
[I 2024-12-04 15:02:05,099] Trial 743 finished with value: 1.2401112325344401 and parameters: {'kernel_type': 'RBF', 'length_scale': 0.0007835958138992616, 'noise_level': 0.2471155210093705, 'constant_value': 15.74801875876876, 'nu': 0.5}. Best is trial 386 with value: 0.4872991004520934.
[I 2024-12-04 15:02:05,118] Trial 736 finished with value: 1.2401112327111752 and parameters: {'kernel_type': 'RBF', 'length_scale': 40.272390840440615, 'noise_level': 2.4654402607188285e-05, 'constant_value': 0.0009496837241565504, 'nu': 1.5}. Best is trial 386 with value: 0.4872991004520934.
[I 2024-12-04 15:02:05,438] Trial 737 finished with value: 0.4883034165838779 and parameters: {'kernel_type': 'Matern', 'length_scale': 276.3431896273163, 'noise_level': 0.8942300756491264, 'constant_value': 4.993622661268442, 'nu': 0.5}. Best is trial 386 with value: 0.4872991004520934.
[I 2024-12-04 15:02:05,666] Trial 744 finished with value: 0.48830341700913854 and parameters: {'kernel_type': 'Matern', 'length_scale': 28.779552779925343, 'noise_level': 0.12162009050041084, 'constant_value': 8.690809619840563, 'nu': 0.5}. Best is trial 386 with value: 0.4872991004520934.
[I 2024-12-04 15:02:05,694] Trial 721 finished with value: 1.2401112333238153 and parameters: {'kernel_type': 'Matern', 'length_scale': 3968.5367451912293, 'noise_level': 2.149083605327584e-06, 'constant_value': 25.11354960091173, 'nu': 0.5}. Best is trial 386 with value: 0.4872991004520934.
[I 2024-12-04 15:02:06,312] Trial 734 finished with value: 0.48830342380642017 and parameters: {'kernel_type': 'Matern', 'length_scale': 46.36245329444545, 'noise_level': 0.8579236552400293, 'constant_value': 12.938814099053449, 'nu': 0.5}. Best is trial 386 with value: 0.4872991004520934.
[I 2024-12-04 15:02:06,431] Trial 740 finished with value: 0.4883032691280934 and parameters: {'kernel_type': 'Matern', 'length_scale': 5.693384549817069, 'noise_level': 0.3557393332992146, 'constant_value': 181.37699020772595, 'nu': 0.5}. Best is trial 386 with value: 0.4872991004520934.
[I 2024-12-04 15:02:07,421] Trial 747 finished with value: 0.6443855955015511 and parameters: {'kernel_type': 'RBF', 'length_scale': 2.6915720005595207, 'noise_level': 0.15994228314452233, 'constant_value': 391.97370065238346, 'nu': 0.5}. Best is trial 386 with value: 0.4872991004520934.
[I 2024-12-04 15:02:08,020] Trial 745 finished with value: 0.4883034535054582 and parameters: {'kernel_type': 'Matern', 'length_scale': 33.67235351266715, 'noise_level': 0.08321117778792102, 'constant_value': 1.7558400290680343, 'nu': 0.5}. Best is trial 386 with value: 0.4872991004520934.
[I 2024-12-04 15:02:10,637] Trial 749 finished with value: 0.4883034189012193 and parameters: {'kernel_type': 'Matern', 'length_scale': 1.100389325655391, 'noise_level': 0.2160583528231069, 'constant_value': 186.48430019585427, 'nu': 0.5}. Best is trial 386 with value: 0.4872991004520934.
