[I 2024-12-04 12:18:39,659] Trial 136 finished with value: 0.28341680812589426 and parameters: {'n_estimators': 820, 'learning_rate': 0.08374931924063665, 'max_depth': 8, 'min_samples_split': 2, 'min_samples_leaf': 3, 'subsample': 0.9908367827077914, 'max_features': 'log2'}. Best is trial 101 with value: 0.22711647448686362.
[I 2024-12-04 12:18:40,675] Trial 135 finished with value: 0.25233019726643297 and parameters: {'n_estimators': 842, 'learning_rate': 0.06094059345625407, 'max_depth': 11, 'min_samples_split': 14, 'min_samples_leaf': 2, 'subsample': 0.746354581442508, 'max_features': 'sqrt'}. Best is trial 101 with value: 0.22711647448686362.
[I 2024-12-04 12:18:40,677] Trial 117 finished with value: 0.2999052340451583 and parameters: {'n_estimators': 1334, 'learning_rate': 0.03872594797415651, 'max_depth': 12, 'min_samples_split': 9, 'min_samples_leaf': 2, 'subsample': 0.7457849488953621, 'max_features': None}. Best is trial 101 with value: 0.22711647448686362.
[I 2024-12-04 12:18:47,866] Trial 151 finished with value: 0.2774604716439331 and parameters: {'n_estimators': 425, 'learning_rate': 0.0934163041903918, 'max_depth': 8, 'min_samples_split': 15, 'min_samples_leaf': 1, 'subsample': 0.9917173620326583, 'max_features': 'sqrt'}. Best is trial 101 with value: 0.22711647448686362.
[I 2024-12-04 12:18:54,681] Trial 145 finished with value: 0.24812325491424536 and parameters: {'n_estimators': 754, 'learning_rate': 0.09221709898060985, 'max_depth': 12, 'min_samples_split': 4, 'min_samples_leaf': 3, 'subsample': 0.7358370462433865, 'max_features': 'sqrt'}. Best is trial 101 with value: 0.22711647448686362.
[I 2024-12-04 12:18:56,750] Trial 132 finished with value: 0.31291741483099533 and parameters: {'n_estimators': 1238, 'learning_rate': 0.06600317504905298, 'max_depth': 10, 'min_samples_split': 6, 'min_samples_leaf': 5, 'subsample': 0.8672226340086843, 'max_features': 'log2'}. Best is trial 101 with value: 0.22711647448686362.
[I 2024-12-04 12:18:59,052] Trial 128 finished with value: 0.24692321463041397 and parameters: {'n_estimators': 1388, 'learning_rate': 0.05848212471157915, 'max_depth': 10, 'min_samples_split': 16, 'min_samples_leaf': 1, 'subsample': 0.6801507625770209, 'max_features': 'log2'}. Best is trial 101 with value: 0.22711647448686362.
[I 2024-12-04 12:19:01,624] Trial 134 finished with value: 0.2739115621418473 and parameters: {'n_estimators': 1295, 'learning_rate': 0.08401864458630882, 'max_depth': 10, 'min_samples_split': 7, 'min_samples_leaf': 3, 'subsample': 0.8825601444522532, 'max_features': 'log2'}. Best is trial 101 with value: 0.22711647448686362.
[I 2024-12-04 12:19:04,549] Trial 143 finished with value: 0.2864551397137025 and parameters: {'n_estimators': 825, 'learning_rate': 0.08858633878765378, 'max_depth': 8, 'min_samples_split': 4, 'min_samples_leaf': 5, 'subsample': 0.8564472014434686, 'max_features': 'sqrt'}. Best is trial 101 with value: 0.22711647448686362.
[I 2024-12-04 12:19:05,515] Trial 137 finished with value: 0.25575648872515205 and parameters: {'n_estimators': 1277, 'learning_rate': 0.08576298378066612, 'max_depth': 10, 'min_samples_split': 11, 'min_samples_leaf': 1, 'subsample': 0.8462039477256882, 'max_features': 'log2'}. Best is trial 101 with value: 0.22711647448686362.
[I 2024-12-04 12:19:06,764] Trial 141 finished with value: 0.2551432747736625 and parameters: {'n_estimators': 1149, 'learning_rate': 0.09573493250966955, 'max_depth': 12, 'min_samples_split': 2, 'min_samples_leaf': 2, 'subsample': 0.8681862559471709, 'max_features': 'log2'}. Best is trial 101 with value: 0.22711647448686362.
[I 2024-12-04 12:19:09,960] Trial 148 finished with value: 0.3168836838592395 and parameters: {'n_estimators': 872, 'learning_rate': 0.08353520878826921, 'max_depth': 12, 'min_samples_split': 5, 'min_samples_leaf': 6, 'subsample': 0.8687771934689664, 'max_features': 'sqrt'}. Best is trial 101 with value: 0.22711647448686362.
[I 2024-12-04 12:19:13,067] Trial 169 finished with value: 0.3201649375425225 and parameters: {'n_estimators': 271, 'learning_rate': 0.07989103927660259, 'max_depth': 11, 'min_samples_split': 9, 'min_samples_leaf': 1, 'subsample': 0.8177709175442107, 'max_features': 'log2'}. Best is trial 101 with value: 0.22711647448686362.
[I 2024-12-04 12:19:18,675] Trial 164 finished with value: 0.3064871548009612 and parameters: {'n_estimators': 507, 'learning_rate': 0.049676200534667106, 'max_depth': 10, 'min_samples_split': 14, 'min_samples_leaf': 4, 'subsample': 0.6134971176412798, 'max_features': 'sqrt'}. Best is trial 101 with value: 0.22711647448686362.
[I 2024-12-04 12:19:19,613] Trial 167 finished with value: 0.25865851690343306 and parameters: {'n_estimators': 428, 'learning_rate': 0.09104515224750181, 'max_depth': 10, 'min_samples_split': 11, 'min_samples_leaf': 2, 'subsample': 0.8166839042959755, 'max_features': 'sqrt'}. Best is trial 101 with value: 0.22711647448686362.
[I 2024-12-04 12:19:23,481] Trial 146 finished with value: 0.242043624424662 and parameters: {'n_estimators': 1272, 'learning_rate': 0.07395388329230523, 'max_depth': 11, 'min_samples_split': 12, 'min_samples_leaf': 2, 'subsample': 0.840761533315968, 'max_features': 'sqrt'}. Best is trial 101 with value: 0.22711647448686362.
[I 2024-12-04 12:19:27,575] Trial 140 finished with value: 0.25577747667381856 and parameters: {'n_estimators': 1472, 'learning_rate': 0.09615475726828003, 'max_depth': 7, 'min_samples_split': 14, 'min_samples_leaf': 2, 'subsample': 0.835096104012589, 'max_features': 'sqrt'}. Best is trial 101 with value: 0.22711647448686362.
[I 2024-12-04 12:19:29,737] Trial 147 finished with value: 0.2595440749973871 and parameters: {'n_estimators': 1246, 'learning_rate': 0.07973024101269839, 'max_depth': 8, 'min_samples_split': 3, 'min_samples_leaf': 1, 'subsample': 0.9224061712613002, 'max_features': 'sqrt'}. Best is trial 101 with value: 0.22711647448686362.
[I 2024-12-04 12:19:29,753] Trial 142 finished with value: 0.2672829978288363 and parameters: {'n_estimators': 1300, 'learning_rate': 0.09014081618914725, 'max_depth': 4, 'min_samples_split': 9, 'min_samples_leaf': 2, 'subsample': 0.9413413844983529, 'max_features': 'sqrt'}. Best is trial 101 with value: 0.22711647448686362.
[I 2024-12-04 12:19:32,317] Trial 156 finished with value: 0.27177384089931267 and parameters: {'n_estimators': 918, 'learning_rate': 0.05851777340010593, 'max_depth': 6, 'min_samples_split': 16, 'min_samples_leaf': 1, 'subsample': 0.7306477220248964, 'max_features': None}. Best is trial 101 with value: 0.22711647448686362.
[I 2024-12-04 12:19:37,837] Trial 152 finished with value: 0.2305762729969103 and parameters: {'n_estimators': 1204, 'learning_rate': 0.09462261010158445, 'max_depth': 11, 'min_samples_split': 6, 'min_samples_leaf': 1, 'subsample': 0.9207641472580971, 'max_features': 'sqrt'}. Best is trial 101 with value: 0.22711647448686362.
[I 2024-12-04 12:19:41,537] Trial 153 finished with value: 0.29748145283548677 and parameters: {'n_estimators': 1232, 'learning_rate': 0.06685452527550349, 'max_depth': 3, 'min_samples_split': 12, 'min_samples_leaf': 1, 'subsample': 0.7725449881942423, 'max_features': 'sqrt'}. Best is trial 101 with value: 0.22711647448686362.
[I 2024-12-04 12:19:41,597] Trial 150 finished with value: 0.2271986186864326 and parameters: {'n_estimators': 1327, 'learning_rate': 0.0751979818717049, 'max_depth': 8, 'min_samples_split': 14, 'min_samples_leaf': 1, 'subsample': 0.6779133158161313, 'max_features': 'sqrt'}. Best is trial 101 with value: 0.22711647448686362.
[I 2024-12-04 12:19:42,133] Trial 154 finished with value: 0.2864756350902222 and parameters: {'n_estimators': 1256, 'learning_rate': 0.0810398010169384, 'max_depth': 3, 'min_samples_split': 13, 'min_samples_leaf': 1, 'subsample': 0.7646315433100193, 'max_features': 'sqrt'}. Best is trial 101 with value: 0.22711647448686362.
[I 2024-12-04 12:19:42,878] Trial 174 finished with value: 0.2470341535708498 and parameters: {'n_estimators': 538, 'learning_rate': 0.09513137946903255, 'max_depth': 12, 'min_samples_split': 10, 'min_samples_leaf': 2, 'subsample': 0.7206018440001909, 'max_features': 'sqrt'}. Best is trial 101 with value: 0.22711647448686362.
[I 2024-12-04 12:19:44,248] Trial 158 finished with value: 0.22624977502014332 and parameters: {'n_estimators': 1061, 'learning_rate': 0.09535950486152565, 'max_depth': 9, 'min_samples_split': 16, 'min_samples_leaf': 1, 'subsample': 0.8975317155944929, 'max_features': 'sqrt'}. Best is trial 158 with value: 0.22624977502014332.
[I 2024-12-04 12:19:45,962] Trial 173 finished with value: 0.2834345538663037 and parameters: {'n_estimators': 582, 'learning_rate': 0.06534295532566393, 'max_depth': 9, 'min_samples_split': 6, 'min_samples_leaf': 2, 'subsample': 0.7122419971426136, 'max_features': None}. Best is trial 158 with value: 0.22624977502014332.
[I 2024-12-04 12:19:49,588] Trial 170 finished with value: 0.24631571178109157 and parameters: {'n_estimators': 804, 'learning_rate': 0.08126031510719063, 'max_depth': 12, 'min_samples_split': 2, 'min_samples_leaf': 2, 'subsample': 0.7611056691018755, 'max_features': 'sqrt'}. Best is trial 158 with value: 0.22624977502014332.
[I 2024-12-04 12:19:50,199] Trial 155 finished with value: 0.2962042687511381 and parameters: {'n_estimators': 1273, 'learning_rate': 0.08753648489232767, 'max_depth': 4, 'min_samples_split': 16, 'min_samples_leaf': 2, 'subsample': 0.8157900363811326, 'max_features': 'log2'}. Best is trial 158 with value: 0.22624977502014332.
[I 2024-12-04 12:19:51,003] Trial 149 finished with value: 0.23756114143480123 and parameters: {'n_estimators': 1496, 'learning_rate': 0.06911431341803413, 'max_depth': 11, 'min_samples_split': 9, 'min_samples_leaf': 1, 'subsample': 0.6811683486029577, 'max_features': 'log2'}. Best is trial 158 with value: 0.22624977502014332.
[I 2024-12-04 12:19:52,984] Trial 168 finished with value: 0.23788242282076222 and parameters: {'n_estimators': 885, 'learning_rate': 0.04980645147497394, 'max_depth': 10, 'min_samples_split': 11, 'min_samples_leaf': 1, 'subsample': 0.649242517596987, 'max_features': 'sqrt'}. Best is trial 158 with value: 0.22624977502014332.
[I 2024-12-04 12:19:57,580] Trial 161 finished with value: 0.264623849560318 and parameters: {'n_estimators': 1232, 'learning_rate': 0.024721267911240324, 'max_depth': 11, 'min_samples_split': 5, 'min_samples_leaf': 3, 'subsample': 0.7980025068910206, 'max_features': 'sqrt'}. Best is trial 158 with value: 0.22624977502014332.
[I 2024-12-04 12:19:59,139] Trial 157 finished with value: 0.25316820227981135 and parameters: {'n_estimators': 1328, 'learning_rate': 0.03606752538626779, 'max_depth': 9, 'min_samples_split': 14, 'min_samples_leaf': 2, 'subsample': 0.8029347095238542, 'max_features': 'sqrt'}. Best is trial 158 with value: 0.22624977502014332.
[I 2024-12-04 12:19:59,431] Trial 159 finished with value: 0.23776272570056112 and parameters: {'n_estimators': 1224, 'learning_rate': 0.07903882071323545, 'max_depth': 10, 'min_samples_split': 7, 'min_samples_leaf': 2, 'subsample': 0.7286993317858056, 'max_features': 'sqrt'}. Best is trial 158 with value: 0.22624977502014332.
[I 2024-12-04 12:19:59,727] Trial 160 finished with value: 0.2290707390213992 and parameters: {'n_estimators': 1260, 'learning_rate': 0.05919338596931414, 'max_depth': 10, 'min_samples_split': 4, 'min_samples_leaf': 1, 'subsample': 0.6734703078361142, 'max_features': 'sqrt'}. Best is trial 158 with value: 0.22624977502014332.
[I 2024-12-04 12:20:02,095] Trial 162 finished with value: 0.26332995283858734 and parameters: {'n_estimators': 1095, 'learning_rate': 0.09233464254460609, 'max_depth': 5, 'min_samples_split': 16, 'min_samples_leaf': 1, 'subsample': 0.9351924443521166, 'max_features': 'sqrt'}. Best is trial 158 with value: 0.22624977502014332.
[I 2024-12-04 12:20:03,250] Trial 182 finished with value: 0.2567377766467547 and parameters: {'n_estimators': 507, 'learning_rate': 0.0739533177620521, 'max_depth': 11, 'min_samples_split': 5, 'min_samples_leaf': 2, 'subsample': 0.7520697832948356, 'max_features': 'sqrt'}. Best is trial 158 with value: 0.22624977502014332.
[I 2024-12-04 12:20:03,750] Trial 165 finished with value: 0.2648274730005705 and parameters: {'n_estimators': 1122, 'learning_rate': 0.06677928291820197, 'max_depth': 6, 'min_samples_split': 15, 'min_samples_leaf': 2, 'subsample': 0.9199857943449438, 'max_features': 'sqrt'}. Best is trial 158 with value: 0.22624977502014332.
[I 2024-12-04 12:20:06,219] Trial 177 finished with value: 0.22661837746629857 and parameters: {'n_estimators': 830, 'learning_rate': 0.08532777643724886, 'max_depth': 11, 'min_samples_split': 9, 'min_samples_leaf': 1, 'subsample': 0.8203728320407949, 'max_features': 'sqrt'}. Best is trial 158 with value: 0.22624977502014332.
[I 2024-12-04 12:20:06,552] Trial 166 finished with value: 0.33884788611286154 and parameters: {'n_estimators': 1315, 'learning_rate': 0.03425090635450597, 'max_depth': 10, 'min_samples_split': 12, 'min_samples_leaf': 4, 'subsample': 0.7761268234247428, 'max_features': 'log2'}. Best is trial 158 with value: 0.22624977502014332.
[I 2024-12-04 12:20:06,554] Trial 180 finished with value: 0.2917691556947017 and parameters: {'n_estimators': 733, 'learning_rate': 0.07427487095352146, 'max_depth': 7, 'min_samples_split': 13, 'min_samples_leaf': 2, 'subsample': 0.9944711911501264, 'max_features': 'log2'}. Best is trial 158 with value: 0.22624977502014332.
[I 2024-12-04 12:20:10,110] Trial 163 finished with value: 0.24101852435053592 and parameters: {'n_estimators': 1343, 'learning_rate': 0.06457270101251934, 'max_depth': 10, 'min_samples_split': 17, 'min_samples_leaf': 1, 'subsample': 0.9996841359482627, 'max_features': 'sqrt'}. Best is trial 158 with value: 0.22624977502014332.
[I 2024-12-04 12:20:11,926] Trial 171 finished with value: 0.2670814095957875 and parameters: {'n_estimators': 1219, 'learning_rate': 0.026080204453121168, 'max_depth': 11, 'min_samples_split': 8, 'min_samples_leaf': 3, 'subsample': 0.9935125845193842, 'max_features': 'sqrt'}. Best is trial 158 with value: 0.22624977502014332.
[I 2024-12-04 12:20:12,271] Trial 176 finished with value: 0.23651075935660787 and parameters: {'n_estimators': 939, 'learning_rate': 0.04741111279594925, 'max_depth': 11, 'min_samples_split': 15, 'min_samples_leaf': 1, 'subsample': 0.7752595414908433, 'max_features': 'sqrt'}. Best is trial 158 with value: 0.22624977502014332.
[I 2024-12-04 12:20:22,114] Trial 185 finished with value: 0.2522853167861019 and parameters: {'n_estimators': 847, 'learning_rate': 0.07050693258739615, 'max_depth': 11, 'min_samples_split': 16, 'min_samples_leaf': 3, 'subsample': 0.6927618522009323, 'max_features': 'sqrt'}. Best is trial 158 with value: 0.22624977502014332.
[I 2024-12-04 12:20:22,116] Trial 172 finished with value: 0.2612070373355116 and parameters: {'n_estimators': 1419, 'learning_rate': 0.04722809277587045, 'max_depth': 10, 'min_samples_split': 16, 'min_samples_leaf': 1, 'subsample': 0.6811828400478256, 'max_features': 'log2'}. Best is trial 158 with value: 0.22624977502014332.
[I 2024-12-04 12:20:26,323] Trial 175 finished with value: 0.2289132371274382 and parameters: {'n_estimators': 1315, 'learning_rate': 0.08895677239421539, 'max_depth': 9, 'min_samples_split': 17, 'min_samples_leaf': 1, 'subsample': 0.6480807764510901, 'max_features': 'log2'}. Best is trial 158 with value: 0.22624977502014332.
[I 2024-12-04 12:20:27,798] Trial 181 finished with value: 0.28282422275293984 and parameters: {'n_estimators': 1115, 'learning_rate': 0.026919339786071056, 'max_depth': 12, 'min_samples_split': 8, 'min_samples_leaf': 1, 'subsample': 0.8333721858335243, 'max_features': 'log2'}. Best is trial 158 with value: 0.22624977502014332.
[I 2024-12-04 12:20:29,061] Trial 178 finished with value: 0.2546461659087416 and parameters: {'n_estimators': 1301, 'learning_rate': 0.04314136689173331, 'max_depth': 8, 'min_samples_split': 8, 'min_samples_leaf': 1, 'subsample': 0.7968138439133937, 'max_features': 'sqrt'}. Best is trial 158 with value: 0.22624977502014332.
[I 2024-12-04 12:20:30,925] Trial 179 finished with value: 0.25880401483229454 and parameters: {'n_estimators': 1213, 'learning_rate': 0.03505691301526118, 'max_depth': 12, 'min_samples_split': 4, 'min_samples_leaf': 1, 'subsample': 0.8801339620458067, 'max_features': 'sqrt'}. Best is trial 158 with value: 0.22624977502014332.
[I 2024-12-04 12:20:41,657] Trial 190 finished with value: 0.26960352492629175 and parameters: {'n_estimators': 892, 'learning_rate': 0.033258089574418545, 'max_depth': 9, 'min_samples_split': 13, 'min_samples_leaf': 1, 'subsample': 0.6309650522675871, 'max_features': 'sqrt'}. Best is trial 158 with value: 0.22624977502014332.
[I 2024-12-04 12:20:42,898] Trial 184 finished with value: 0.2788921310313076 and parameters: {'n_estimators': 1247, 'learning_rate': 0.06041355163058093, 'max_depth': 9, 'min_samples_split': 13, 'min_samples_leaf': 5, 'subsample': 0.8805558433936798, 'max_features': 'sqrt'}. Best is trial 158 with value: 0.22624977502014332.
[I 2024-12-04 12:20:43,694] Trial 189 finished with value: 0.24262159148129078 and parameters: {'n_estimators': 1047, 'learning_rate': 0.08896162598978169, 'max_depth': 12, 'min_samples_split': 11, 'min_samples_leaf': 2, 'subsample': 0.9483770818998288, 'max_features': 'sqrt'}. Best is trial 158 with value: 0.22624977502014332.
[I 2024-12-04 12:20:45,983] Trial 214 finished with value: 0.5975363149792319 and parameters: {'n_estimators': 186, 'learning_rate': 0.08316741454260793, 'max_depth': 6, 'min_samples_split': 15, 'min_samples_leaf': 6, 'subsample': 0.6898470700174254, 'max_features': 'log2'}. Best is trial 158 with value: 0.22624977502014332.
[I 2024-12-04 12:20:53,391] Trial 183 finished with value: 0.22300043601809105 and parameters: {'n_estimators': 1446, 'learning_rate': 0.08646826240828355, 'max_depth': 11, 'min_samples_split': 10, 'min_samples_leaf': 1, 'subsample': 0.805362227125971, 'max_features': 'sqrt'}. Best is trial 183 with value: 0.22300043601809105.
[I 2024-12-04 12:20:55,398] Trial 186 finished with value: 0.2840834926274665 and parameters: {'n_estimators': 1381, 'learning_rate': 0.07129751299686565, 'max_depth': 10, 'min_samples_split': 2, 'min_samples_leaf': 1, 'subsample': 0.9169486239720139, 'max_features': 'log2'}. Best is trial 183 with value: 0.22300043601809105.
[I 2024-12-04 12:20:58,218] Trial 188 finished with value: 0.22256485204112325 and parameters: {'n_estimators': 1311, 'learning_rate': 0.08490575008176789, 'max_depth': 10, 'min_samples_split': 15, 'min_samples_leaf': 1, 'subsample': 0.6884667326738466, 'max_features': 'sqrt'}. Best is trial 188 with value: 0.22256485204112325.
[I 2024-12-04 12:21:05,386] Trial 197 finished with value: 0.23741963524601076 and parameters: {'n_estimators': 1024, 'learning_rate': 0.08831964861383339, 'max_depth': 8, 'min_samples_split': 9, 'min_samples_leaf': 1, 'subsample': 0.8251090136622357, 'max_features': 'sqrt'}. Best is trial 188 with value: 0.22256485204112325.
[I 2024-12-04 12:21:06,618] Trial 195 finished with value: 0.22556194200813412 and parameters: {'n_estimators': 1163, 'learning_rate': 0.08489251653620655, 'max_depth': 10, 'min_samples_split': 7, 'min_samples_leaf': 1, 'subsample': 0.7012981174633693, 'max_features': 'sqrt'}. Best is trial 188 with value: 0.22256485204112325.
[I 2024-12-04 12:21:07,707] Trial 187 finished with value: 0.24716493153432342 and parameters: {'n_estimators': 1411, 'learning_rate': 0.09509718122265311, 'max_depth': 11, 'min_samples_split': 3, 'min_samples_leaf': 3, 'subsample': 0.8177805291639436, 'max_features': 'sqrt'}. Best is trial 188 with value: 0.22256485204112325.
[I 2024-12-04 12:21:09,023] Trial 199 finished with value: 0.2671232282513762 and parameters: {'n_estimators': 837, 'learning_rate': 0.07064387559987773, 'max_depth': 12, 'min_samples_split': 10, 'min_samples_leaf': 1, 'subsample': 0.7799889943567894, 'max_features': None}. Best is trial 188 with value: 0.22256485204112325.
[I 2024-12-04 12:21:10,906] Trial 192 finished with value: 0.30639723653588746 and parameters: {'n_estimators': 1153, 'learning_rate': 0.08437755634620613, 'max_depth': 11, 'min_samples_split': 15, 'min_samples_leaf': 2, 'subsample': 0.7850772698335189, 'max_features': None}. Best is trial 188 with value: 0.22256485204112325.
[I 2024-12-04 12:21:13,778] Trial 191 finished with value: 0.25409250440696957 and parameters: {'n_estimators': 1493, 'learning_rate': 0.06995603137093023, 'max_depth': 7, 'min_samples_split': 15, 'min_samples_leaf': 2, 'subsample': 0.6088415471485379, 'max_features': 'sqrt'}. Best is trial 188 with value: 0.22256485204112325.
[I 2024-12-04 12:21:15,232] Trial 193 finished with value: 0.2691518551164805 and parameters: {'n_estimators': 1387, 'learning_rate': 0.05602152500013339, 'max_depth': 12, 'min_samples_split': 8, 'min_samples_leaf': 2, 'subsample': 0.6119486276314503, 'max_features': 'log2'}. Best is trial 188 with value: 0.22256485204112325.
[I 2024-12-04 12:21:17,165] Trial 207 finished with value: 0.249063428343818 and parameters: {'n_estimators': 979, 'learning_rate': 0.07844636160897943, 'max_depth': 9, 'min_samples_split': 16, 'min_samples_leaf': 2, 'subsample': 0.967186811999738, 'max_features': 'sqrt'}. Best is trial 188 with value: 0.22256485204112325.
[I 2024-12-04 12:21:21,812] Trial 204 finished with value: 0.22230397456137438 and parameters: {'n_estimators': 1062, 'learning_rate': 0.09368508519665752, 'max_depth': 9, 'min_samples_split': 20, 'min_samples_leaf': 1, 'subsample': 0.9730535686711917, 'max_features': 'sqrt'}. Best is trial 204 with value: 0.22230397456137438.
[I 2024-12-04 12:21:22,432] Trial 194 finished with value: 0.2545135925020033 and parameters: {'n_estimators': 1405, 'learning_rate': 0.08335475455766625, 'max_depth': 12, 'min_samples_split': 7, 'min_samples_leaf': 3, 'subsample': 0.6305343817978328, 'max_features': 'sqrt'}. Best is trial 204 with value: 0.22230397456137438.
