[I 2024-12-04 00:30:07,098] Trial 1821 finished with value: 0.35032638632834145 and parameters: {'kernel': 'linear', 'C': 18.902604400625275, 'gamma': 0.010126383242843718, 'epsilon': 0.016707705043325305}. Best is trial 1479 with value: 0.13978216740910654.
[I 2024-12-04 00:30:09,631] Trial 1891 finished with value: 0.1511047659431278 and parameters: {'kernel': 'rbf', 'C': 72.62870937299964, 'gamma': 0.013325195061977015, 'epsilon': 0.001046634019179643}. Best is trial 1479 with value: 0.13978216740910654.
[I 2024-12-04 00:30:10,698] Trial 1894 finished with value: 0.27506562000820356 and parameters: {'kernel': 'rbf', 'C': 6.053020110381911, 'gamma': 0.006361235955834216, 'epsilon': 0.0010559941378232925}. Best is trial 1479 with value: 0.13978216740910654.
[I 2024-12-04 00:30:12,255] Trial 1895 finished with value: 0.22406524586565607 and parameters: {'kernel': 'rbf', 'C': 15.714713685575347, 'gamma': 0.007510466403471523, 'epsilon': 0.0023870972162839117}. Best is trial 1479 with value: 0.13978216740910654.
[I 2024-12-04 00:30:12,257] Trial 1889 finished with value: 0.2026705746454667 and parameters: {'kernel': 'rbf', 'C': 91.9161931329339, 'gamma': 0.04598695128779407, 'epsilon': 0.00235074700327475}. Best is trial 1479 with value: 0.13978216740910654.
[I 2024-12-04 00:30:13,644] Trial 1893 finished with value: 0.16347107009064615 and parameters: {'kernel': 'rbf', 'C': 99.56987730385907, 'gamma': 0.014368532888308772, 'epsilon': 0.001001415481437665}. Best is trial 1479 with value: 0.13978216740910654.
[I 2024-12-04 00:30:13,819] Trial 1896 finished with value: 0.16249683211158872 and parameters: {'kernel': 'rbf', 'C': 17.030436555745922, 'gamma': 0.015354399900738691, 'epsilon': 0.0020093317988723763}. Best is trial 1479 with value: 0.13978216740910654.
[I 2024-12-04 00:30:16,153] Trial 1898 finished with value: 0.14842970909329958 and parameters: {'kernel': 'rbf', 'C': 23.26108087400104, 'gamma': 0.020516243680415117, 'epsilon': 0.0010519382331855892}. Best is trial 1479 with value: 0.13978216740910654.
[I 2024-12-04 00:30:17,218] Trial 1899 finished with value: 0.162548016148485 and parameters: {'kernel': 'rbf', 'C': 22.212371365316777, 'gamma': 0.012359707400033424, 'epsilon': 0.001005407685615751}. Best is trial 1479 with value: 0.13978216740910654.
[I 2024-12-04 00:30:18,370] Trial 1897 finished with value: 0.13982415134251078 and parameters: {'kernel': 'rbf', 'C': 92.71734271668855, 'gamma': 0.008395988619566475, 'epsilon': 0.001006106375608552}. Best is trial 1479 with value: 0.13978216740910654.
[I 2024-12-04 00:30:19,821] Trial 1902 finished with value: 0.26293519344346267 and parameters: {'kernel': 'rbf', 'C': 25.864412660884717, 'gamma': 0.0022042654575244367, 'epsilon': 0.0029378758815646476}. Best is trial 1479 with value: 0.13978216740910654.
[I 2024-12-04 00:30:21,156] Trial 1901 finished with value: 0.1405888941594312 and parameters: {'kernel': 'rbf', 'C': 93.05154102338545, 'gamma': 0.00948793147203754, 'epsilon': 0.0030336273032914116}. Best is trial 1479 with value: 0.13978216740910654.
[I 2024-12-04 00:30:22,561] Trial 1900 finished with value: 0.1751252861754785 and parameters: {'kernel': 'rbf', 'C': 97.18533382140257, 'gamma': 0.02308521742404798, 'epsilon': 0.0010107764324529705}. Best is trial 1479 with value: 0.13978216740910654.
[I 2024-12-04 00:30:23,057] Trial 1904 finished with value: 0.20681307596242576 and parameters: {'kernel': 'rbf', 'C': 85.45616637273977, 'gamma': 0.002394953932543637, 'epsilon': 0.002201057385522216}. Best is trial 1479 with value: 0.13978216740910654.
[I 2024-12-04 00:30:23,078] Trial 1892 finished with value: 0.3489165607216615 and parameters: {'kernel': 'linear', 'C': 3.171816290474757, 'gamma': 0.008157872208520003, 'epsilon': 0.0011955297638341262}. Best is trial 1479 with value: 0.13978216740910654.
[I 2024-12-04 00:30:25,006] Trial 1903 finished with value: 0.15517308053883516 and parameters: {'kernel': 'rbf', 'C': 88.75484821118687, 'gamma': 0.013004155432826408, 'epsilon': 0.0010884053488592312}. Best is trial 1479 with value: 0.13978216740910654.
[I 2024-12-04 00:30:26,332] Trial 1906 finished with value: 0.172416205799056 and parameters: {'kernel': 'rbf', 'C': 90.99000141252702, 'gamma': 0.0036643188773633636, 'epsilon': 0.001182758256629185}. Best is trial 1479 with value: 0.13978216740910654.
[I 2024-12-04 00:30:27,074] Trial 1908 finished with value: 0.14978866141395314 and parameters: {'kernel': 'rbf', 'C': 20.296094719441616, 'gamma': 0.017433708791310915, 'epsilon': 0.005924364060441105}. Best is trial 1479 with value: 0.13978216740910654.
[I 2024-12-04 00:30:27,956] Trial 1909 finished with value: 0.21491195270778493 and parameters: {'kernel': 'rbf', 'C': 91.63339791640806, 'gamma': 0.0019635075603179797, 'epsilon': 0.002692475473062149}. Best is trial 1479 with value: 0.13978216740910654.
[I 2024-12-04 00:30:28,841] Trial 1907 finished with value: 0.14033015130536805 and parameters: {'kernel': 'rbf', 'C': 92.90096679721037, 'gamma': 0.007849516176953925, 'epsilon': 0.0011753550952080384}. Best is trial 1479 with value: 0.13978216740910654.
[I 2024-12-04 00:30:29,728] Trial 1911 finished with value: 0.4414891095036093 and parameters: {'kernel': 'rbf', 'C': 12.411303495092959, 'gamma': 0.000479812118077609, 'epsilon': 0.0016989565946270936}. Best is trial 1479 with value: 0.13978216740910654.
[I 2024-12-04 00:30:30,194] Trial 1905 finished with value: 0.3675446391275286 and parameters: {'kernel': 'linear', 'C': 51.20210274895041, 'gamma': 0.0002680610004953442, 'epsilon': 0.49853885729435066}. Best is trial 1479 with value: 0.13978216740910654.
[I 2024-12-04 00:30:31,318] Trial 1912 finished with value: 0.27826837734394894 and parameters: {'kernel': 'rbf', 'C': 14.578119570866958, 'gamma': 0.0025791645070844804, 'epsilon': 0.001953708649940756}. Best is trial 1479 with value: 0.13978216740910654.
[I 2024-12-04 00:30:31,447] Trial 1913 finished with value: 0.8006706166833801 and parameters: {'kernel': 'sigmoid', 'C': 0.012151092731307225, 'gamma': 0.8853834450016618, 'epsilon': 0.22964047374063384}. Best is trial 1479 with value: 0.13978216740910654.
[I 2024-12-04 00:30:33,475] Trial 1914 finished with value: 0.3553284209431737 and parameters: {'kernel': 'rbf', 'C': 18.545440953622148, 'gamma': 0.0008291865768640516, 'epsilon': 0.0010299051774619835}. Best is trial 1479 with value: 0.13978216740910654.
[I 2024-12-04 00:30:34,206] Trial 1910 finished with value: 0.1736686519057768 and parameters: {'kernel': 'rbf', 'C': 98.97652616937187, 'gamma': 0.02234090720076862, 'epsilon': 0.002751112667345265}. Best is trial 1479 with value: 0.13978216740910654.
[I 2024-12-04 00:30:35,372] Trial 1916 finished with value: 0.21470543399968403 and parameters: {'kernel': 'rbf', 'C': 21.77863028984109, 'gamma': 0.006501307114644771, 'epsilon': 0.0018348063054144808}. Best is trial 1479 with value: 0.13978216740910654.
[I 2024-12-04 00:30:35,638] Trial 1917 finished with value: 0.18899234276433685 and parameters: {'kernel': 'rbf', 'C': 49.24619936240185, 'gamma': 0.004661539569311414, 'epsilon': 0.001011208329283171}. Best is trial 1479 with value: 0.13978216740910654.
[I 2024-12-04 00:30:36,510] Trial 657 finished with value: 0.7498064128494578 and parameters: {'kernel': 'poly', 'C': 2.4604531465711683, 'gamma': 0.10620697970683501, 'epsilon': 0.0010354337661394012}. Best is trial 1479 with value: 0.13978216740910654.
[I 2024-12-04 00:30:36,900] Trial 1918 finished with value: 0.1539761600543436 and parameters: {'kernel': 'rbf', 'C': 30.816302364064974, 'gamma': 0.010925245228407881, 'epsilon': 0.0010831871153298414}. Best is trial 1479 with value: 0.13978216740910654.
[I 2024-12-04 00:30:36,901] Trial 1919 finished with value: 0.21071847334364066 and parameters: {'kernel': 'rbf', 'C': 11.095362863617572, 'gamma': 0.01159579545052289, 'epsilon': 0.0011204051306126235}. Best is trial 1479 with value: 0.13978216740910654.
[I 2024-12-04 00:30:38,405] Trial 1921 finished with value: 0.25655868071513055 and parameters: {'kernel': 'rbf', 'C': 21.07322839131139, 'gamma': 0.003176241062597306, 'epsilon': 0.0011281136759498536}. Best is trial 1479 with value: 0.13978216740910654.
[I 2024-12-04 00:30:39,833] Trial 1920 finished with value: 0.23398075277461597 and parameters: {'kernel': 'rbf', 'C': 19.567911175856455, 'gamma': 0.09665770985203356, 'epsilon': 0.0010385292754895212}. Best is trial 1479 with value: 0.13978216740910654.
[I 2024-12-04 00:30:39,993] Trial 1922 finished with value: 0.23504868392387127 and parameters: {'kernel': 'rbf', 'C': 91.34256181389185, 'gamma': 0.00129668385802757, 'epsilon': 0.0014416402425434982}. Best is trial 1479 with value: 0.13978216740910654.
[I 2024-12-04 00:30:40,723] Trial 1924 finished with value: 0.20159612239015767 and parameters: {'kernel': 'rbf', 'C': 96.04420395415936, 'gamma': 0.0023801503119936446, 'epsilon': 0.0015658407068835669}. Best is trial 1479 with value: 0.13978216740910654.
[I 2024-12-04 00:30:41,349] Trial 1925 finished with value: 0.2581759506661792 and parameters: {'kernel': 'rbf', 'C': 13.539805108045801, 'gamma': 0.004547145782109872, 'epsilon': 0.0010872350216348547}. Best is trial 1479 with value: 0.13978216740910654.
[I 2024-12-04 00:30:43,088] Trial 1915 finished with value: 0.534613754616261 and parameters: {'kernel': 'poly', 'C': 25.987048812618507, 'gamma': 0.015299316550422533, 'epsilon': 0.0017483756737605694}. Best is trial 1479 with value: 0.13978216740910654.
[I 2024-12-04 00:30:44,036] Trial 1928 finished with value: 0.2575705552547725 and parameters: {'kernel': 'rbf', 'C': 20.016806394573205, 'gamma': 0.0032482320645561497, 'epsilon': 0.0027117912167272944}. Best is trial 1479 with value: 0.13978216740910654.
[I 2024-12-04 00:30:44,984] Trial 1929 finished with value: 0.16107738768528257 and parameters: {'kernel': 'rbf', 'C': 22.149379018312615, 'gamma': 0.01272512027415017, 'epsilon': 0.001065006727003207}. Best is trial 1479 with value: 0.13978216740910654.
[I 2024-12-04 00:30:45,701] Trial 1930 finished with value: 0.2398801711727427 and parameters: {'kernel': 'rbf', 'C': 12.644013069973177, 'gamma': 0.00713314391394676, 'epsilon': 0.001005371923239127}. Best is trial 1479 with value: 0.13978216740910654.
[I 2024-12-04 00:30:46,431] Trial 1927 finished with value: 0.1436763083517225 and parameters: {'kernel': 'rbf', 'C': 91.39210873421291, 'gamma': 0.010839786581812698, 'epsilon': 0.0012963139517643625}. Best is trial 1479 with value: 0.13978216740910654.
[I 2024-12-04 00:30:46,431] Trial 1923 finished with value: 0.21241184766493693 and parameters: {'kernel': 'rbf', 'C': 96.43214019244888, 'gamma': 0.05659322222050205, 'epsilon': 0.001101700205058599}. Best is trial 1479 with value: 0.13978216740910654.
[I 2024-12-04 00:30:46,512] Trial 1926 finished with value: 0.14782587897388147 and parameters: {'kernel': 'rbf', 'C': 96.49041587152608, 'gamma': 0.011352728211333514, 'epsilon': 0.0012087669380686356}. Best is trial 1479 with value: 0.13978216740910654.
[I 2024-12-04 00:30:47,611] Trial 1932 finished with value: 0.22060777077944446 and parameters: {'kernel': 'rbf', 'C': 66.50613760068634, 'gamma': 0.002383626818066636, 'epsilon': 0.0010348006348387063}. Best is trial 1479 with value: 0.13978216740910654.
[I 2024-12-04 00:30:47,887] Trial 1931 finished with value: 0.16279529903628995 and parameters: {'kernel': 'rbf', 'C': 98.48558584428957, 'gamma': 0.004007201949000426, 'epsilon': 0.0011803977523411084}. Best is trial 1479 with value: 0.13978216740910654.
[I 2024-12-04 00:30:50,254] Trial 1933 finished with value: 0.1682378989565919 and parameters: {'kernel': 'rbf', 'C': 92.85589406479059, 'gamma': 0.003828265082103992, 'epsilon': 0.0024737768241738425}. Best is trial 1479 with value: 0.13978216740910654.
[I 2024-12-04 00:30:52,370] Trial 1937 finished with value: 0.18680963054598637 and parameters: {'kernel': 'rbf', 'C': 5.649443788094246, 'gamma': 0.028319726166800813, 'epsilon': 0.001031389592790012}. Best is trial 1479 with value: 0.13978216740910654.
[I 2024-12-04 00:30:52,542] Trial 1935 finished with value: 0.14056189728553134 and parameters: {'kernel': 'rbf', 'C': 95.71067098885725, 'gamma': 0.007284649564928658, 'epsilon': 0.002001018511635151}. Best is trial 1479 with value: 0.13978216740910654.
[I 2024-12-04 00:30:53,360] Trial 1936 finished with value: 0.14115635923792988 and parameters: {'kernel': 'rbf', 'C': 77.6244672834732, 'gamma': 0.009021948217590602, 'epsilon': 0.001035997794267388}. Best is trial 1479 with value: 0.13978216740910654.
[I 2024-12-04 00:30:53,363] Trial 1938 finished with value: 0.20261442492972764 and parameters: {'kernel': 'rbf', 'C': 55.08325149172549, 'gamma': 0.0035788520793201693, 'epsilon': 0.0010284057948619161}. Best is trial 1479 with value: 0.13978216740910654.
[I 2024-12-04 00:30:54,347] Trial 1939 finished with value: 0.17200661506875847 and parameters: {'kernel': 'rbf', 'C': 21.021597476481396, 'gamma': 0.011026374482701056, 'epsilon': 0.002424143070649532}. Best is trial 1479 with value: 0.13978216740910654.
[I 2024-12-04 00:30:55,176] Trial 1940 finished with value: 1196.6867447797415 and parameters: {'kernel': 'sigmoid', 'C': 92.69265946892018, 'gamma': 0.010118275353668818, 'epsilon': 0.0013074894734530493}. Best is trial 1479 with value: 0.13978216740910654.
[I 2024-12-04 00:30:58,033] Trial 1944 finished with value: 0.2303385606588838 and parameters: {'kernel': 'rbf', 'C': 16.678463145877167, 'gamma': 0.006522719758507439, 'epsilon': 0.0010035367807408923}. Best is trial 1479 with value: 0.13978216740910654.
[I 2024-12-04 00:30:58,615] Trial 1942 finished with value: 0.1828418077101344 and parameters: {'kernel': 'rbf', 'C': 20.138215501812766, 'gamma': 0.039897347908611734, 'epsilon': 0.00225076021298627}. Best is trial 1479 with value: 0.13978216740910654.
[I 2024-12-04 00:31:01,172] Trial 1946 finished with value: 0.21011521696864702 and parameters: {'kernel': 'rbf', 'C': 22.84074366596947, 'gamma': 0.006652633395821268, 'epsilon': 0.0031925642598287156}. Best is trial 1479 with value: 0.13978216740910654.
[I 2024-12-04 00:31:01,205] Trial 1945 finished with value: 0.14855959110965766 and parameters: {'kernel': 'rbf', 'C': 97.36537395160671, 'gamma': 0.005679565565463816, 'epsilon': 0.001634312264923986}. Best is trial 1479 with value: 0.13978216740910654.
[I 2024-12-04 00:31:02,107] Trial 1941 finished with value: 0.16867165138999568 and parameters: {'kernel': 'rbf', 'C': 94.57452980336116, 'gamma': 0.01809595247716548, 'epsilon': 0.002827959732694398}. Best is trial 1479 with value: 0.13978216740910654.
[I 2024-12-04 00:31:02,910] Trial 1947 finished with value: 0.20983801784950332 and parameters: {'kernel': 'rbf', 'C': 85.0860086449396, 'gamma': 0.0023098657835052805, 'epsilon': 0.0010769125833514216}. Best is trial 1479 with value: 0.13978216740910654.
[I 2024-12-04 00:31:03,395] Trial 1934 finished with value: 0.5343863311594195 and parameters: {'kernel': 'poly', 'C': 89.77797605678691, 'gamma': 0.010126125381205555, 'epsilon': 0.0013603637779934685}. Best is trial 1479 with value: 0.13978216740910654.
[I 2024-12-04 00:31:03,396] Trial 1943 finished with value: 0.17479557752745484 and parameters: {'kernel': 'rbf', 'C': 77.48703057785701, 'gamma': 0.024252955557170084, 'epsilon': 0.0010779590975702118}. Best is trial 1479 with value: 0.13978216740910654.
[I 2024-12-04 00:31:03,837] Trial 1949 finished with value: 0.3921798573786802 and parameters: {'kernel': 'linear', 'C': 0.05199118210556046, 'gamma': 0.0012427328586543135, 'epsilon': 0.04021854748239093}. Best is trial 1479 with value: 0.13978216740910654.
[I 2024-12-04 00:31:06,083] Trial 1948 finished with value: 0.16345240717924786 and parameters: {'kernel': 'rbf', 'C': 94.7434951718649, 'gamma': 0.004059082890476558, 'epsilon': 0.0010623311500262487}. Best is trial 1479 with value: 0.13978216740910654.
[I 2024-12-04 00:31:06,399] Trial 1951 finished with value: 0.241946313262858 and parameters: {'kernel': 'rbf', 'C': 20.024317891837782, 'gamma': 0.004629993242510707, 'epsilon': 0.0020934991089517343}. Best is trial 1479 with value: 0.13978216740910654.
[I 2024-12-04 00:31:06,740] Trial 1950 finished with value: 0.16139788901212604 and parameters: {'kernel': 'rbf', 'C': 97.11251717346317, 'gamma': 0.004181838780707784, 'epsilon': 0.0012346695483087323}. Best is trial 1479 with value: 0.13978216740910654.
[I 2024-12-04 00:31:07,718] Trial 1954 finished with value: 0.3604024423618351 and parameters: {'kernel': 'rbf', 'C': 3.8842989688379674, 'gamma': 0.0027548264320862194, 'epsilon': 0.0010989332937145707}. Best is trial 1479 with value: 0.13978216740910654.
[I 2024-12-04 00:31:08,061] Trial 1952 finished with value: 0.27614507498682384 and parameters: {'kernel': 'rbf', 'C': 11.835942229363079, 'gamma': 0.1479454344979582, 'epsilon': 0.003041981876736002}. Best is trial 1479 with value: 0.13978216740910654.
[I 2024-12-04 00:31:10,407] Trial 1957 finished with value: 0.2148454937618077 and parameters: {'kernel': 'rbf', 'C': 22.95590123790553, 'gamma': 0.00618765900886747, 'epsilon': 0.0010281242477134492}. Best is trial 1479 with value: 0.13978216740910654.
[I 2024-12-04 00:31:12,158] Trial 1958 finished with value: 0.7781390790780743 and parameters: {'kernel': 'poly', 'C': 10.286325501682217, 'gamma': 0.004857899892855671, 'epsilon': 0.0012502014767978968}. Best is trial 1479 with value: 0.13978216740910654.
[I 2024-12-04 00:31:12,457] Trial 1953 finished with value: 0.1593047875783772 and parameters: {'kernel': 'rbf', 'C': 81.39331355957593, 'gamma': 0.014711049268201751, 'epsilon': 0.0010469413040384446}. Best is trial 1479 with value: 0.13978216740910654.
[I 2024-12-04 00:31:12,850] Trial 1955 finished with value: 0.15537251399114885 and parameters: {'kernel': 'rbf', 'C': 55.97392242474735, 'gamma': 0.016737288582967583, 'epsilon': 0.0010080880746537629}. Best is trial 1479 with value: 0.13978216740910654.
[I 2024-12-04 00:31:13,972] Trial 1960 finished with value: 270.3653358638524 and parameters: {'kernel': 'sigmoid', 'C': 12.194272499867566, 'gamma': 0.034398222946405266, 'epsilon': 0.002434630179580944}. Best is trial 1479 with value: 0.13978216740910654.
[I 2024-12-04 00:31:13,973] Trial 1956 finished with value: 0.14132842583162933 and parameters: {'kernel': 'rbf', 'C': 90.52736025617334, 'gamma': 0.009935804152710857, 'epsilon': 0.0011179113690517612}. Best is trial 1479 with value: 0.13978216740910654.
[I 2024-12-04 00:31:14,875] Trial 1959 finished with value: 0.14045843049726706 and parameters: {'kernel': 'rbf', 'C': 85.32378132660065, 'gamma': 0.008920184641697115, 'epsilon': 0.0010474176757765197}. Best is trial 1479 with value: 0.13978216740910654.
[I 2024-12-04 00:31:15,814] Trial 1962 finished with value: 0.23470263299460528 and parameters: {'kernel': 'rbf', 'C': 21.58668289329254, 'gamma': 0.0049034522834137196, 'epsilon': 0.0029399079743168835}. Best is trial 1479 with value: 0.13978216740910654.
[I 2024-12-04 00:31:16,147] Trial 1961 finished with value: 0.1794870483973615 and parameters: {'kernel': 'rbf', 'C': 26.284518609335926, 'gamma': 0.008463676976038755, 'epsilon': 0.002371065076581247}. Best is trial 1479 with value: 0.13978216740910654.
[I 2024-12-04 00:31:16,631] Trial 1963 finished with value: 0.20064117529808068 and parameters: {'kernel': 'rbf', 'C': 96.09311851231534, 'gamma': 0.002408474758030531, 'epsilon': 0.0026610867674391136}. Best is trial 1479 with value: 0.13978216740910654.
[I 2024-12-04 00:31:16,953] Trial 1871 finished with value: 0.3531651664083061 and parameters: {'kernel': 'linear', 'C': 26.164026894653933, 'gamma': 0.021629908608507793, 'epsilon': 0.003043642416414287}. Best is trial 1479 with value: 0.13978216740910654.
[I 2024-12-04 00:31:17,450] Trial 1965 finished with value: 0.3069065227932585 and parameters: {'kernel': 'rbf', 'C': 25.262611073031433, 'gamma': 0.0010924233509156391, 'epsilon': 0.002351986216616627}. Best is trial 1479 with value: 0.13978216740910654.
[I 2024-12-04 00:31:19,258] Trial 1964 finished with value: 0.15470484233983609 and parameters: {'kernel': 'rbf', 'C': 20.11080267680227, 'gamma': 0.02643099861173085, 'epsilon': 0.001018400987751256}. Best is trial 1479 with value: 0.13978216740910654.
[I 2024-12-04 00:31:21,603] Trial 1969 finished with value: 0.19402534221284384 and parameters: {'kernel': 'rbf', 'C': 13.276146270335788, 'gamma': 0.011975242322196853, 'epsilon': 0.0010103212046036196}. Best is trial 1479 with value: 0.13978216740910654.
[I 2024-12-04 00:31:21,638] Trial 1966 finished with value: 0.20261457679869044 and parameters: {'kernel': 'rbf', 'C': 29.376338214864873, 'gamma': 0.056887837712222465, 'epsilon': 0.0018184187567332464}. Best is trial 1479 with value: 0.13978216740910654.
[I 2024-12-04 00:31:22,143] Trial 1970 finished with value: 0.19882441405609702 and parameters: {'kernel': 'rbf', 'C': 21.297871252998924, 'gamma': 0.007959044171992514, 'epsilon': 0.0027565614375193383}. Best is trial 1479 with value: 0.13978216740910654.
[I 2024-12-04 00:31:23,160] Trial 1972 finished with value: 0.27175219525703564 and parameters: {'kernel': 'rbf', 'C': 24.36310368919775, 'gamma': 0.0018694205638903022, 'epsilon': 0.0028134427090467113}. Best is trial 1479 with value: 0.13978216740910654.
[I 2024-12-04 00:31:23,676] Trial 1971 finished with value: 0.16894964268792542 and parameters: {'kernel': 'rbf', 'C': 81.81601356326557, 'gamma': 0.004147118867821876, 'epsilon': 0.0010673287886025383}. Best is trial 1479 with value: 0.13978216740910654.
[I 2024-12-04 00:31:25,571] Trial 1973 finished with value: 0.1902482584419334 and parameters: {'kernel': 'rbf', 'C': 29.452194478768483, 'gamma': 0.006912925864282571, 'epsilon': 0.0025298679780613293}. Best is trial 1479 with value: 0.13978216740910654.
[I 2024-12-04 00:31:26,289] Trial 1974 finished with value: 0.15491029271525178 and parameters: {'kernel': 'rbf', 'C': 21.179988037061253, 'gamma': 0.014888778214588469, 'epsilon': 0.00243180380732713}. Best is trial 1479 with value: 0.13978216740910654.
