[I 2024-12-03 18:42:00,008] Trial 483 finished with value: 0.5520931531528076 and parameters: {'kernel': 'linear', 'C': 10.714494371549394, 'gamma': 0.00017879807139256436, 'epsilon': 0.003918576726169783}. Best is trial 482 with value: 0.4491649651596098.
[I 2024-12-03 18:42:00,296] Trial 493 finished with value: 0.4743810204984324 and parameters: {'kernel': 'rbf', 'C': 19.72441531714261, 'gamma': 0.036884322437652876, 'epsilon': 0.029153368719325633}. Best is trial 482 with value: 0.4491649651596098.
[I 2024-12-03 18:42:00,826] Trial 490 finished with value: 0.521101226042098 and parameters: {'kernel': 'rbf', 'C': 21.9549790421005, 'gamma': 0.010682213173887995, 'epsilon': 0.023669159448636436}. Best is trial 482 with value: 0.4491649651596098.
[I 2024-12-03 18:42:01,220] Trial 479 finished with value: 0.44991871813339096 and parameters: {'kernel': 'rbf', 'C': 85.21923385479491, 'gamma': 0.014846437028663345, 'epsilon': 0.07215319250957349}. Best is trial 482 with value: 0.4491649651596098.
[I 2024-12-03 18:42:01,416] Trial 495 finished with value: 0.5415958529461824 and parameters: {'kernel': 'rbf', 'C': 83.53126667225773, 'gamma': 0.0033817050846201347, 'epsilon': 0.025312836993670037}. Best is trial 482 with value: 0.4491649651596098.
[I 2024-12-03 18:42:01,835] Trial 488 finished with value: 0.6010880346401081 and parameters: {'kernel': 'rbf', 'C': 92.12213685520271, 'gamma': 0.04520503997204954, 'epsilon': 0.023085021600191914}. Best is trial 482 with value: 0.4491649651596098.
[I 2024-12-03 18:42:01,920] Trial 497 finished with value: 0.50078675029997 and parameters: {'kernel': 'rbf', 'C': 99.76135649223663, 'gamma': 0.005442879300690966, 'epsilon': 0.12438181833063006}. Best is trial 482 with value: 0.4491649651596098.
[I 2024-12-03 18:42:01,935] Trial 489 finished with value: 0.5215021486742358 and parameters: {'kernel': 'rbf', 'C': 17.343768747129673, 'gamma': 0.012795296487613808, 'epsilon': 0.021401287605782315}. Best is trial 482 with value: 0.4491649651596098.
[I 2024-12-03 18:42:03,259] Trial 485 finished with value: 1.3662773915541273 and parameters: {'kernel': 'poly', 'C': 0.003106339950216696, 'gamma': 0.0001319292705936891, 'epsilon': 0.05217801514604526}. Best is trial 482 with value: 0.4491649651596098.
[I 2024-12-03 18:42:03,450] Trial 498 finished with value: 0.5169574546923865 and parameters: {'kernel': 'rbf', 'C': 91.13592576862615, 'gamma': 0.004108585112003307, 'epsilon': 0.053037626319363665}. Best is trial 482 with value: 0.4491649651596098.
[I 2024-12-03 18:42:04,386] Trial 492 finished with value: 0.9176378995488151 and parameters: {'kernel': 'poly', 'C': 17.9624566563918, 'gamma': 0.013688379125469887, 'epsilon': 0.12740974057546361}. Best is trial 482 with value: 0.4491649651596098.
[I 2024-12-03 18:42:04,927] Trial 508 finished with value: 0.9566406739035994 and parameters: {'kernel': 'poly', 'C': 91.2372067629481, 'gamma': 0.006726967205033597, 'epsilon': 0.1534305175944548}. Best is trial 482 with value: 0.4491649651596098.
[I 2024-12-03 18:42:05,146] Trial 505 finished with value: 0.4821701780941601 and parameters: {'kernel': 'rbf', 'C': 77.23615443595979, 'gamma': 0.01971699993772468, 'epsilon': 0.12161466383070771}. Best is trial 482 with value: 0.4491649651596098.
[I 2024-12-03 18:42:05,978] Trial 502 finished with value: 0.48908435991435417 and parameters: {'kernel': 'rbf', 'C': 22.413044280563266, 'gamma': 0.030485218017018423, 'epsilon': 0.19927598958608722}. Best is trial 482 with value: 0.4491649651596098.
[I 2024-12-03 18:42:06,632] Trial 501 finished with value: 297.0388548428461 and parameters: {'kernel': 'sigmoid', 'C': 72.15492692718531, 'gamma': 0.02174879521170945, 'epsilon': 0.03638305807540971}. Best is trial 482 with value: 0.4491649651596098.
[I 2024-12-03 18:42:07,244] Trial 499 finished with value: 0.4783961507040246 and parameters: {'kernel': 'rbf', 'C': 13.581242662530734, 'gamma': 0.028857530626263186, 'epsilon': 0.12183290309940224}. Best is trial 482 with value: 0.4491649651596098.
[I 2024-12-03 18:42:07,352] Trial 496 finished with value: 0.5898198123450301 and parameters: {'kernel': 'linear', 'C': 94.6821728658708, 'gamma': 0.12724348555316192, 'epsilon': 0.17160650617652118}. Best is trial 482 with value: 0.4491649651596098.
[I 2024-12-03 18:42:07,795] Trial 506 finished with value: 0.4807658477580363 and parameters: {'kernel': 'rbf', 'C': 13.001474494783022, 'gamma': 0.0266218165366095, 'epsilon': 0.06462001942648278}. Best is trial 482 with value: 0.4491649651596098.
[I 2024-12-03 18:42:08,293] Trial 504 finished with value: 0.4502887702334186 and parameters: {'kernel': 'rbf', 'C': 91.02994135801723, 'gamma': 0.012033397978795666, 'epsilon': 0.06434417391573355}. Best is trial 482 with value: 0.4491649651596098.
[I 2024-12-03 18:42:09,443] Trial 503 finished with value: 0.45126354024233656 and parameters: {'kernel': 'rbf', 'C': 99.29867283286572, 'gamma': 0.013895671230807788, 'epsilon': 0.08268741354572773}. Best is trial 482 with value: 0.4491649651596098.
[I 2024-12-03 18:42:10,081] Trial 515 finished with value: 0.599012716079813 and parameters: {'kernel': 'rbf', 'C': 33.16604993836729, 'gamma': 0.06805711238966472, 'epsilon': 0.14334402536127944}. Best is trial 482 with value: 0.4491649651596098.
[I 2024-12-03 18:42:10,120] Trial 500 finished with value: 0.44979626535448924 and parameters: {'kernel': 'rbf', 'C': 98.47529145831206, 'gamma': 0.012585954952592323, 'epsilon': 0.06109049342275309}. Best is trial 482 with value: 0.4491649651596098.
[I 2024-12-03 18:42:10,137] Trial 507 finished with value: 0.5743631886766575 and parameters: {'kernel': 'rbf', 'C': 95.11938512621803, 'gamma': 0.039062202966503375, 'epsilon': 0.041911395842622705}. Best is trial 482 with value: 0.4491649651596098.
[I 2024-12-03 18:42:10,147] Trial 510 finished with value: 1.3448752239702064 and parameters: {'kernel': 'sigmoid', 'C': 0.009746747825967458, 'gamma': 0.7134081505121348, 'epsilon': 0.004310391835876837}. Best is trial 482 with value: 0.4491649651596098.
[I 2024-12-03 18:42:12,025] Trial 511 finished with value: 0.9009591953685443 and parameters: {'kernel': 'linear', 'C': 0.0016708681759180838, 'gamma': 0.0021023064575418303, 'epsilon': 0.036023904090965536}. Best is trial 482 with value: 0.4491649651596098.
[I 2024-12-03 18:42:12,026] Trial 513 finished with value: 0.6220891345838715 and parameters: {'kernel': 'rbf', 'C': 98.8718713855827, 'gamma': 0.05588775078244443, 'epsilon': 0.17350831467494462}. Best is trial 482 with value: 0.4491649651596098.
[I 2024-12-03 18:42:12,265] Trial 520 finished with value: 0.5138458586999535 and parameters: {'kernel': 'rbf', 'C': 88.8897121103881, 'gamma': 0.028910211810829048, 'epsilon': 0.05764690477247923}. Best is trial 482 with value: 0.4491649651596098.
[I 2024-12-03 18:42:13,992] Trial 509 finished with value: 0.4762512118246503 and parameters: {'kernel': 'rbf', 'C': 86.40109706090202, 'gamma': 0.024158366315069197, 'epsilon': 0.04221067107023538}. Best is trial 482 with value: 0.4491649651596098.
[I 2024-12-03 18:42:14,578] Trial 518 finished with value: 0.9467346644990627 and parameters: {'kernel': 'rbf', 'C': 1.2586160666958643, 'gamma': 0.00045615460708188087, 'epsilon': 0.014073394089720657}. Best is trial 482 with value: 0.4491649651596098.
[I 2024-12-03 18:42:14,579] Trial 517 finished with value: 0.5906941990674296 and parameters: {'kernel': 'linear', 'C': 0.2083934854902291, 'gamma': 0.522663465262078, 'epsilon': 0.01807486369075094}. Best is trial 482 with value: 0.4491649651596098.
[I 2024-12-03 18:42:15,095] Trial 522 finished with value: 1.0536490008400858 and parameters: {'kernel': 'rbf', 'C': 0.09271176753955873, 'gamma': 0.06786954549589216, 'epsilon': 0.07425961679120972}. Best is trial 482 with value: 0.4491649651596098.
[I 2024-12-03 18:42:15,387] Trial 512 finished with value: 0.6881507385570698 and parameters: {'kernel': 'linear', 'C': 0.0568796801260705, 'gamma': 0.002572155810912486, 'epsilon': 0.004375662945063949}. Best is trial 482 with value: 0.4491649651596098.
[I 2024-12-03 18:42:15,482] Trial 521 finished with value: 0.5274223222264801 and parameters: {'kernel': 'rbf', 'C': 16.569393117042324, 'gamma': 0.011660894795099115, 'epsilon': 0.04889967912116148}. Best is trial 482 with value: 0.4491649651596098.
[I 2024-12-03 18:42:16,963] Trial 516 finished with value: 0.5931756046043624 and parameters: {'kernel': 'rbf', 'C': 13.945561549293886, 'gamma': 0.004653514466388754, 'epsilon': 0.0555038498334201}. Best is trial 482 with value: 0.4491649651596098.
[I 2024-12-03 18:42:17,125] Trial 527 finished with value: 0.5649697710119804 and parameters: {'kernel': 'linear', 'C': 4.244456334201362, 'gamma': 0.002794055350865627, 'epsilon': 0.05945306538595284}. Best is trial 482 with value: 0.4491649651596098.
[I 2024-12-03 18:42:17,289] Trial 514 finished with value: 0.47392215775655566 and parameters: {'kernel': 'rbf', 'C': 19.98767346458759, 'gamma': 0.022629371550753317, 'epsilon': 0.07126350236344306}. Best is trial 482 with value: 0.4491649651596098.
[I 2024-12-03 18:42:17,876] Trial 524 finished with value: 0.459018754275557 and parameters: {'kernel': 'rbf', 'C': 92.1634735662955, 'gamma': 0.01447137038443231, 'epsilon': 0.09865267105635163}. Best is trial 482 with value: 0.4491649651596098.
[I 2024-12-03 18:42:18,007] Trial 526 finished with value: 0.5273392856585379 and parameters: {'kernel': 'rbf', 'C': 24.02624819790114, 'gamma': 0.008908448722614627, 'epsilon': 0.049797552148225344}. Best is trial 482 with value: 0.4491649651596098.
[I 2024-12-03 18:42:18,082] Trial 519 finished with value: 6.7669753931158425 and parameters: {'kernel': 'sigmoid', 'C': 0.5171811991066553, 'gamma': 0.513367099474454, 'epsilon': 0.25731905906660274}. Best is trial 482 with value: 0.4491649651596098.
[I 2024-12-03 18:42:18,692] Trial 528 finished with value: 0.4950075411455442 and parameters: {'kernel': 'rbf', 'C': 96.07444672476962, 'gamma': 0.005515377122309334, 'epsilon': 0.04844910741417162}. Best is trial 482 with value: 0.4491649651596098.
[I 2024-12-03 18:42:20,269] Trial 525 finished with value: 0.5892511951372482 and parameters: {'kernel': 'rbf', 'C': 83.34709486416718, 'gamma': 0.04596181966261401, 'epsilon': 0.0626131925100653}. Best is trial 482 with value: 0.4491649651596098.
[I 2024-12-03 18:42:21,545] Trial 532 finished with value: 0.4562200973086029 and parameters: {'kernel': 'rbf', 'C': 71.41752371069478, 'gamma': 0.01427487638458111, 'epsilon': 0.03535798002432083}. Best is trial 482 with value: 0.4491649651596098.
[I 2024-12-03 18:42:21,588] Trial 523 finished with value: 0.5647911059405281 and parameters: {'kernel': 'rbf', 'C': 85.14001276322756, 'gamma': 0.038061696524608474, 'epsilon': 0.038559761871972124}. Best is trial 482 with value: 0.4491649651596098.
[I 2024-12-03 18:42:22,126] Trial 530 finished with value: 0.5328897538347159 and parameters: {'kernel': 'rbf', 'C': 99.46387962768486, 'gamma': 0.008523089171376903, 'epsilon': 0.3232838203036731}. Best is trial 482 with value: 0.4491649651596098.
[I 2024-12-03 18:42:22,784] Trial 531 finished with value: 0.5412106555293381 and parameters: {'kernel': 'rbf', 'C': 14.234378525748564, 'gamma': 0.01023462439163918, 'epsilon': 0.082846493178242}. Best is trial 482 with value: 0.4491649651596098.
[I 2024-12-03 18:42:23,689] Trial 534 finished with value: 0.5326057293655467 and parameters: {'kernel': 'rbf', 'C': 96.81642811086896, 'gamma': 0.0034950151328506174, 'epsilon': 0.03219678996655425}. Best is trial 482 with value: 0.4491649651596098.
[I 2024-12-03 18:42:23,996] Trial 543 finished with value: 0.49237880038921156 and parameters: {'kernel': 'rbf', 'C': 49.99804893180204, 'gamma': 0.00890852143611864, 'epsilon': 0.10103322669430773}. Best is trial 482 with value: 0.4491649651596098.
[I 2024-12-03 18:42:23,997] Trial 541 finished with value: 0.48086611028045384 and parameters: {'kernel': 'rbf', 'C': 84.65175046836433, 'gamma': 0.023289965326171693, 'epsilon': 0.07848951712242683}. Best is trial 482 with value: 0.4491649651596098.
[I 2024-12-03 18:42:24,369] Trial 539 finished with value: 0.4535798136203004 and parameters: {'kernel': 'rbf', 'C': 96.82596967709726, 'gamma': 0.010806940111213673, 'epsilon': 0.06755405377962431}. Best is trial 482 with value: 0.4491649651596098.
[I 2024-12-03 18:42:24,506] Trial 544 finished with value: 0.6683571333568656 and parameters: {'kernel': 'rbf', 'C': 4.111105591575377, 'gamma': 0.0066795243470855956, 'epsilon': 0.2606626532252434}. Best is trial 482 with value: 0.4491649651596098.
[I 2024-12-03 18:42:24,511] Trial 529 finished with value: 0.4630466792081117 and parameters: {'kernel': 'rbf', 'C': 92.03650714702638, 'gamma': 0.010987100642894102, 'epsilon': 0.027140076390660645}. Best is trial 482 with value: 0.4491649651596098.
[I 2024-12-03 18:42:24,535] Trial 542 finished with value: 0.7645662070479551 and parameters: {'kernel': 'poly', 'C': 66.24129021679855, 'gamma': 0.022887172243043225, 'epsilon': 0.06012506302310642}. Best is trial 482 with value: 0.4491649651596098.
[I 2024-12-03 18:42:25,298] Trial 533 finished with value: 0.7305157066613917 and parameters: {'kernel': 'rbf', 'C': 15.536950341249431, 'gamma': 0.0013500681055651279, 'epsilon': 0.042701762285184346}. Best is trial 482 with value: 0.4491649651596098.
[I 2024-12-03 18:42:25,597] Trial 537 finished with value: 0.5060189807100902 and parameters: {'kernel': 'rbf', 'C': 90.39980743294356, 'gamma': 0.027025480744094797, 'epsilon': 0.06731894359766591}. Best is trial 482 with value: 0.4491649651596098.
[I 2024-12-03 18:42:25,884] Trial 540 finished with value: 0.6493919373412197 and parameters: {'kernel': 'linear', 'C': 71.09968891125034, 'gamma': 0.009308521440753632, 'epsilon': 0.3292389836576181}. Best is trial 482 with value: 0.4491649651596098.
[I 2024-12-03 18:42:25,925] Trial 535 finished with value: 0.5015895344816358 and parameters: {'kernel': 'rbf', 'C': 13.825558522726526, 'gamma': 0.029356255925142245, 'epsilon': 0.26615926179867005}. Best is trial 482 with value: 0.4491649651596098.
[I 2024-12-03 18:42:26,726] Trial 553 finished with value: 0.534627659872423 and parameters: {'kernel': 'rbf', 'C': 20.92491809151137, 'gamma': 0.009323267302829258, 'epsilon': 0.12120266412939708}. Best is trial 482 with value: 0.4491649651596098.
[I 2024-12-03 18:42:26,726] Trial 548 finished with value: 0.6162993762036486 and parameters: {'kernel': 'rbf', 'C': 32.14794605156715, 'gamma': 0.0016587263881966251, 'epsilon': 0.14941190249130792}. Best is trial 482 with value: 0.4491649651596098.
[I 2024-12-03 18:42:27,004] Trial 550 finished with value: 0.5520562081991514 and parameters: {'kernel': 'rbf', 'C': 15.616225458872728, 'gamma': 0.007743744794284519, 'epsilon': 0.13460876978837785}. Best is trial 482 with value: 0.4491649651596098.
[I 2024-12-03 18:42:27,183] Trial 555 finished with value: 0.6054504024227794 and parameters: {'kernel': 'rbf', 'C': 91.67239463776961, 'gamma': 0.04593647040328141, 'epsilon': 0.12580805681782622}. Best is trial 482 with value: 0.4491649651596098.
[I 2024-12-03 18:42:27,287] Trial 536 finished with value: 0.5380542884715794 and parameters: {'kernel': 'rbf', 'C': 76.99217988737661, 'gamma': 0.0036709807074881804, 'epsilon': 0.09166128790611686}. Best is trial 482 with value: 0.4491649651596098.
[I 2024-12-03 18:42:29,521] Trial 547 finished with value: 0.5763571536009127 and parameters: {'kernel': 'rbf', 'C': 15.007612724005414, 'gamma': 0.005612544328692142, 'epsilon': 0.01606221045149049}. Best is trial 482 with value: 0.4491649651596098.
[I 2024-12-03 18:42:29,701] Trial 554 finished with value: 0.7613579491465692 and parameters: {'kernel': 'sigmoid', 'C': 25.144622903764358, 'gamma': 0.0009884308699727592, 'epsilon': 0.02563268968545047}. Best is trial 482 with value: 0.4491649651596098.
[I 2024-12-03 18:42:30,021] Trial 560 finished with value: 0.46285382832277083 and parameters: {'kernel': 'rbf', 'C': 91.54440596573254, 'gamma': 0.019649424219135368, 'epsilon': 0.049254911632222724}. Best is trial 482 with value: 0.4491649651596098.
[I 2024-12-03 18:42:30,200] Trial 545 finished with value: 0.8236831688070122 and parameters: {'kernel': 'sigmoid', 'C': 1.111506487611709, 'gamma': 0.0038025098075038597, 'epsilon': 0.0019688965820276044}. Best is trial 482 with value: 0.4491649651596098.
[I 2024-12-03 18:42:31,155] Trial 551 finished with value: 0.7927067852263472 and parameters: {'kernel': 'rbf', 'C': 1.2648039202889954, 'gamma': 0.004198313660601941, 'epsilon': 0.02270379788177801}. Best is trial 482 with value: 0.4491649651596098.
[I 2024-12-03 18:42:31,241] Trial 557 finished with value: 0.49408317383776373 and parameters: {'kernel': 'rbf', 'C': 14.689365727940865, 'gamma': 0.04812695827179998, 'epsilon': 0.06520064660810576}. Best is trial 482 with value: 0.4491649651596098.
[I 2024-12-03 18:42:31,265] Trial 546 finished with value: 0.5041996171874332 and parameters: {'kernel': 'rbf', 'C': 97.46335261153082, 'gamma': 0.004642003127670649, 'epsilon': 0.046956014014926196}. Best is trial 482 with value: 0.4491649651596098.
[I 2024-12-03 18:42:31,292] Trial 552 finished with value: 1.3125375072873313 and parameters: {'kernel': 'poly', 'C': 55.245378062717045, 'gamma': 0.00025139107719662106, 'epsilon': 0.5569922727961152}. Best is trial 482 with value: 0.4491649651596098.
[I 2024-12-03 18:42:31,379] Trial 561 finished with value: 0.5974014444164946 and parameters: {'kernel': 'rbf', 'C': 15.555419754469956, 'gamma': 0.004044073213016346, 'epsilon': 0.04094901397118207}. Best is trial 482 with value: 0.4491649651596098.
[I 2024-12-03 18:42:31,458] Trial 556 finished with value: 1.001546873874375 and parameters: {'kernel': 'poly', 'C': 0.03935507776820568, 'gamma': 0.069599254076916, 'epsilon': 0.05747127792797736}. Best is trial 482 with value: 0.4491649651596098.
[I 2024-12-03 18:42:32,314] Trial 549 finished with value: 0.45775247179339495 and parameters: {'kernel': 'rbf', 'C': 84.63604622984296, 'gamma': 0.014308188668719345, 'epsilon': 0.10502503877331298}. Best is trial 482 with value: 0.4491649651596098.
[I 2024-12-03 18:42:33,290] Trial 563 finished with value: 0.5105229229592898 and parameters: {'kernel': 'rbf', 'C': 13.56943851718552, 'gamma': 0.016872919417851386, 'epsilon': 0.04932412983306812}. Best is trial 482 with value: 0.4491649651596098.
[I 2024-12-03 18:42:33,402] Trial 559 finished with value: 0.6082965013193405 and parameters: {'kernel': 'rbf', 'C': 18.405615604886545, 'gamma': 0.11050829630496979, 'epsilon': 0.03912043721313707}. Best is trial 482 with value: 0.4491649651596098.
[I 2024-12-03 18:42:33,573] Trial 538 finished with value: 0.4520782815986167 and parameters: {'kernel': 'rbf', 'C': 98.08028531464595, 'gamma': 0.011239283795884665, 'epsilon': 0.06140342832448266}. Best is trial 482 with value: 0.4491649651596098.
[I 2024-12-03 18:42:33,617] Trial 573 finished with value: 0.6606310407185734 and parameters: {'kernel': 'rbf', 'C': 94.83977266735616, 'gamma': 0.3552641889500171, 'epsilon': 0.03141885639051181}. Best is trial 482 with value: 0.4491649651596098.
[I 2024-12-03 18:42:33,618] Trial 570 finished with value: 0.4629871065079618 and parameters: {'kernel': 'rbf', 'C': 94.22628777988334, 'gamma': 0.019376283987639846, 'epsilon': 0.05027141217743515}. Best is trial 482 with value: 0.4491649651596098.
[I 2024-12-03 18:42:34,341] Trial 558 finished with value: 0.5645749924044778 and parameters: {'kernel': 'linear', 'C': 78.21575986236721, 'gamma': 0.04667052951170806, 'epsilon': 0.03963271826922518}. Best is trial 482 with value: 0.4491649651596098.
[I 2024-12-03 18:42:34,423] Trial 564 finished with value: 0.5546469415692558 and parameters: {'kernel': 'rbf', 'C': 80.17995809067197, 'gamma': 0.0028373470290185307, 'epsilon': 0.11457219923789762}. Best is trial 482 with value: 0.4491649651596098.
[I 2024-12-03 18:42:34,599] Trial 571 finished with value: 0.512876898714189 and parameters: {'kernel': 'rbf', 'C': 58.76813998430931, 'gamma': 0.005743552988827781, 'epsilon': 0.04548488002058508}. Best is trial 482 with value: 0.4491649651596098.
[I 2024-12-03 18:42:34,736] Trial 572 finished with value: 0.47403860475365894 and parameters: {'kernel': 'rbf', 'C': 92.9996387505772, 'gamma': 0.01794736630140975, 'epsilon': 0.1089836606480369}. Best is trial 482 with value: 0.4491649651596098.
[I 2024-12-03 18:42:34,782] Trial 574 finished with value: 0.546664331457599 and parameters: {'kernel': 'rbf', 'C': 19.27952895721314, 'gamma': 0.007864506482951436, 'epsilon': 0.02289035874884235}. Best is trial 482 with value: 0.4491649651596098.
[I 2024-12-03 18:42:34,869] Trial 567 finished with value: 0.5117958355510321 and parameters: {'kernel': 'rbf', 'C': 88.97790104982569, 'gamma': 0.004890004851862555, 'epsilon': 0.025655332566395198}. Best is trial 482 with value: 0.4491649651596098.
[I 2024-12-03 18:42:35,054] Trial 562 finished with value: 0.5727856586149156 and parameters: {'kernel': 'linear', 'C': 98.36225368420943, 'gamma': 0.00696940077748827, 'epsilon': 0.065802047473663}. Best is trial 482 with value: 0.4491649651596098.
[I 2024-12-03 18:42:35,098] Trial 576 finished with value: 0.4894592864727054 and parameters: {'kernel': 'rbf', 'C': 14.23524240218476, 'gamma': 0.04729468923382112, 'epsilon': 0.028767353603741348}. Best is trial 482 with value: 0.4491649651596098.
[I 2024-12-03 18:42:35,167] Trial 578 finished with value: 0.4792088862125779 and parameters: {'kernel': 'rbf', 'C': 13.778924965914022, 'gamma': 0.02409955446973497, 'epsilon': 0.045935602146259434}. Best is trial 482 with value: 0.4491649651596098.
[I 2024-12-03 18:42:35,268] Trial 568 finished with value: 0.4657817923270564 and parameters: {'kernel': 'rbf', 'C': 83.68810661529902, 'gamma': 0.02113450552783111, 'epsilon': 0.021218374987162048}. Best is trial 482 with value: 0.4491649651596098.
