[I 2024-12-03 18:50:50,666] Trial 2050 finished with value: 0.4755723182172916 and parameters: {'kernel': 'rbf', 'C': 92.01728739006272, 'gamma': 0.017080499103691846, 'epsilon': 0.11492751169882967}. Best is trial 1119 with value: 0.4485361816812923.
[I 2024-12-03 18:50:51,683] Trial 2055 finished with value: 0.5742742285201969 and parameters: {'kernel': 'linear', 'C': 40.97185625558735, 'gamma': 0.021670931926529247, 'epsilon': 0.07210069647710189}. Best is trial 1119 with value: 0.4485361816812923.
[I 2024-12-03 18:50:51,714] Trial 2057 finished with value: 0.46045070283630474 and parameters: {'kernel': 'rbf', 'C': 96.32196487434511, 'gamma': 0.018426477064616833, 'epsilon': 0.05626403547601674}. Best is trial 1119 with value: 0.4485361816812923.
[I 2024-12-03 18:50:51,798] Trial 2049 finished with value: 0.8513023683951227 and parameters: {'kernel': 'poly', 'C': 97.68419683443271, 'gamma': 0.012544558675591516, 'epsilon': 0.12306906955855575}. Best is trial 1119 with value: 0.4485361816812923.
[I 2024-12-03 18:50:51,799] Trial 2053 finished with value: 0.49565689986282324 and parameters: {'kernel': 'rbf', 'C': 99.72487522417585, 'gamma': 0.0057867293220478, 'epsilon': 0.02711830105280368}. Best is trial 1119 with value: 0.4485361816812923.
[I 2024-12-03 18:50:51,916] Trial 2048 finished with value: 0.4974013251341058 and parameters: {'kernel': 'rbf', 'C': 25.50921072358506, 'gamma': 0.03538202069582687, 'epsilon': 0.18340170469696876}. Best is trial 1119 with value: 0.4485361816812923.
[I 2024-12-03 18:50:52,086] Trial 2061 finished with value: 0.6953124766983221 and parameters: {'kernel': 'linear', 'C': 49.30643606201323, 'gamma': 0.02186323770699996, 'epsilon': 0.8406707407401397}. Best is trial 1119 with value: 0.4485361816812923.
[I 2024-12-03 18:50:52,368] Trial 2052 finished with value: 0.5463969119348481 and parameters: {'kernel': 'rbf', 'C': 22.953833906431004, 'gamma': 0.06245750674519772, 'epsilon': 0.052782612029950826}. Best is trial 1119 with value: 0.4485361816812923.
[I 2024-12-03 18:50:52,371] Trial 2062 finished with value: 0.540409368774196 and parameters: {'kernel': 'rbf', 'C': 19.67561511825697, 'gamma': 0.008039391005599457, 'epsilon': 0.03316764940663424}. Best is trial 1119 with value: 0.4485361816812923.
[I 2024-12-03 18:50:52,592] Trial 2056 finished with value: 0.6226402697463539 and parameters: {'kernel': 'rbf', 'C': 96.31882009302139, 'gamma': 0.04902300278308524, 'epsilon': 0.012797363415612786}. Best is trial 1119 with value: 0.4485361816812923.
[I 2024-12-03 18:50:53,301] Trial 2047 finished with value: 0.9681484463823212 and parameters: {'kernel': 'sigmoid', 'C': 2.9950716540872033, 'gamma': 0.00035125146577589096, 'epsilon': 0.0019434005398846746}. Best is trial 1119 with value: 0.4485361816812923.
[I 2024-12-03 18:50:53,423] Trial 2059 finished with value: 0.474671987044283 and parameters: {'kernel': 'rbf', 'C': 21.325685390469122, 'gamma': 0.018298617683407212, 'epsilon': 0.10553954097625443}. Best is trial 1119 with value: 0.4485361816812923.
[I 2024-12-03 18:50:53,723] Trial 2058 finished with value: 0.7630145189058185 and parameters: {'kernel': 'rbf', 'C': 5.0753946393875236, 'gamma': 0.002425418257210406, 'epsilon': 0.0415529862286998}. Best is trial 1119 with value: 0.4485361816812923.
[I 2024-12-03 18:50:54,038] Trial 2064 finished with value: 1.364704279482501 and parameters: {'kernel': 'rbf', 'C': 0.0014641859997171134, 'gamma': 0.06128401262571582, 'epsilon': 0.10530823621251591}. Best is trial 1119 with value: 0.4485361816812923.
[I 2024-12-03 18:50:55,192] Trial 2060 finished with value: 0.6034705497210728 and parameters: {'kernel': 'rbf', 'C': 12.21821632379892, 'gamma': 0.00458485994324035, 'epsilon': 0.645384795053876}. Best is trial 1119 with value: 0.4485361816812923.
[I 2024-12-03 18:50:55,322] Trial 2075 finished with value: 0.4923594111384365 and parameters: {'kernel': 'rbf', 'C': 92.43944825494873, 'gamma': 0.005950411239482732, 'epsilon': 0.05291444413862928}. Best is trial 1119 with value: 0.4485361816812923.
[I 2024-12-03 18:50:55,386] Trial 2072 finished with value: 0.5383129198862375 and parameters: {'kernel': 'rbf', 'C': 28.018621554167442, 'gamma': 0.006959135265562114, 'epsilon': 0.04348652069065346}. Best is trial 1119 with value: 0.4485361816812923.
[I 2024-12-03 18:50:55,537] Trial 2067 finished with value: 0.561181985739729 and parameters: {'kernel': 'rbf', 'C': 29.56368028979036, 'gamma': 0.003835532677037326, 'epsilon': 0.21346711591554898}. Best is trial 1119 with value: 0.4485361816812923.
[I 2024-12-03 18:50:56,115] Trial 2066 finished with value: 0.5709011770564574 and parameters: {'kernel': 'rbf', 'C': 6.845642122249021, 'gamma': 0.11368383662694138, 'epsilon': 0.07622925763044192}. Best is trial 1119 with value: 0.4485361816812923.
[I 2024-12-03 18:50:56,339] Trial 2073 finished with value: 0.4640911383859651 and parameters: {'kernel': 'rbf', 'C': 97.45524521503789, 'gamma': 0.019846625911859952, 'epsilon': 0.06578668227672445}. Best is trial 1119 with value: 0.4485361816812923.
[I 2024-12-03 18:50:56,830] Trial 2076 finished with value: 0.7179203473334772 and parameters: {'kernel': 'rbf', 'C': 3.2883845020582827, 'gamma': 0.00695308866025653, 'epsilon': 0.015471743681414716}. Best is trial 1119 with value: 0.4485361816812923.
[I 2024-12-03 18:50:56,916] Trial 2071 finished with value: 0.5789659697647691 and parameters: {'kernel': 'rbf', 'C': 97.96770171800857, 'gamma': 0.03952925358681681, 'epsilon': 0.051570328303087325}. Best is trial 1119 with value: 0.4485361816812923.
[I 2024-12-03 18:50:57,098] Trial 2080 finished with value: 0.4700130133190548 and parameters: {'kernel': 'rbf', 'C': 96.60490466945781, 'gamma': 0.009246808220508718, 'epsilon': 0.02316796218080797}. Best is trial 1119 with value: 0.4485361816812923.
[I 2024-12-03 18:50:58,060] Trial 2077 finished with value: 0.4993270454648443 and parameters: {'kernel': 'rbf', 'C': 24.27594373693489, 'gamma': 0.01274559208352597, 'epsilon': 0.09558895304689338}. Best is trial 1119 with value: 0.4485361816812923.
[I 2024-12-03 18:50:58,325] Trial 2063 finished with value: 0.46878034442070027 and parameters: {'kernel': 'rbf', 'C': 18.811837863976343, 'gamma': 0.030183673554468056, 'epsilon': 0.026048097190560397}. Best is trial 1119 with value: 0.4485361816812923.
[I 2024-12-03 18:50:58,687] Trial 2078 finished with value: 0.8178808293001935 and parameters: {'kernel': 'linear', 'C': 0.00415432672331662, 'gamma': 0.09251158631489327, 'epsilon': 0.10730138557918718}. Best is trial 1119 with value: 0.4485361816812923.
[I 2024-12-03 18:50:58,903] Trial 2082 finished with value: 0.5533198389534582 and parameters: {'kernel': 'rbf', 'C': 18.963786828010132, 'gamma': 0.06902991430442715, 'epsilon': 0.11073529173530637}. Best is trial 1119 with value: 0.4485361816812923.
[I 2024-12-03 18:50:59,119] Trial 2070 finished with value: 0.49625456794553313 and parameters: {'kernel': 'rbf', 'C': 88.98212684854172, 'gamma': 0.00608129779053007, 'epsilon': 0.101082334479454}. Best is trial 1119 with value: 0.4485361816812923.
[I 2024-12-03 18:50:59,497] Trial 2088 finished with value: 0.5563567612582224 and parameters: {'kernel': 'rbf', 'C': 94.0302387227728, 'gamma': 0.0025390686073707694, 'epsilon': 0.053705189718186816}. Best is trial 1119 with value: 0.4485361816812923.
[I 2024-12-03 18:50:59,673] Trial 2083 finished with value: 0.606484366668922 and parameters: {'kernel': 'rbf', 'C': 99.52693931079654, 'gamma': 0.12849240628709604, 'epsilon': 0.03588109937972754}. Best is trial 1119 with value: 0.4485361816812923.
[I 2024-12-03 18:50:59,698] Trial 2086 finished with value: 0.5398282422727784 and parameters: {'kernel': 'rbf', 'C': 24.946655650619057, 'gamma': 0.006398793605514165, 'epsilon': 0.08083745936385768}. Best is trial 1119 with value: 0.4485361816812923.
[I 2024-12-03 18:50:59,699] Trial 2081 finished with value: 0.5178700503795457 and parameters: {'kernel': 'rbf', 'C': 98.73840729679979, 'gamma': 0.01908701071959779, 'epsilon': 0.21481771763489824}. Best is trial 1119 with value: 0.4485361816812923.
[I 2024-12-03 18:50:59,897] Trial 2074 finished with value: 0.5754957485281823 and parameters: {'kernel': 'rbf', 'C': 21.63063835532684, 'gamma': 0.004186371535061089, 'epsilon': 0.31737018352915153}. Best is trial 1119 with value: 0.4485361816812923.
[I 2024-12-03 18:50:59,982] Trial 2068 finished with value: 0.549694048306022 and parameters: {'kernel': 'linear', 'C': 77.85136231610583, 'gamma': 0.0031702201578749233, 'epsilon': 0.0014219113337280989}. Best is trial 1119 with value: 0.4485361816812923.
[I 2024-12-03 18:51:01,511] Trial 2085 finished with value: 1.0836895205405697 and parameters: {'kernel': 'poly', 'C': 14.2328344913938, 'gamma': 0.04240701754693174, 'epsilon': 0.731303199873719}. Best is trial 1119 with value: 0.4485361816812923.
[I 2024-12-03 18:51:02,001] Trial 2079 finished with value: 0.5784726792701189 and parameters: {'kernel': 'rbf', 'C': 18.099471721851295, 'gamma': 0.004786871282869395, 'epsilon': 0.008606742780022105}. Best is trial 1119 with value: 0.4485361816812923.
[I 2024-12-03 18:51:02,452] Trial 2091 finished with value: 0.4845551329093689 and parameters: {'kernel': 'rbf', 'C': 24.37817180352311, 'gamma': 0.014697288845002909, 'epsilon': 0.04478609201256701}. Best is trial 1119 with value: 0.4485361816812923.
[I 2024-12-03 18:51:02,561] Trial 2095 finished with value: 0.47706454063184695 and parameters: {'kernel': 'rbf', 'C': 18.878256753107436, 'gamma': 0.0222647859034158, 'epsilon': 0.07479684072535991}. Best is trial 1119 with value: 0.4485361816812923.
[I 2024-12-03 18:51:02,689] Trial 2069 finished with value: 0.7520446476582247 and parameters: {'kernel': 'rbf', 'C': 13.480767021890726, 'gamma': 0.0010323569821931394, 'epsilon': 0.06982960030250587}. Best is trial 1119 with value: 0.4485361816812923.
[I 2024-12-03 18:51:02,692] Trial 2093 finished with value: 0.5347539650336472 and parameters: {'kernel': 'rbf', 'C': 11.861471632133926, 'gamma': 0.013334209410585515, 'epsilon': 0.03178638689246198}. Best is trial 1119 with value: 0.4485361816812923.
[I 2024-12-03 18:51:02,995] Trial 2089 finished with value: 0.5135006494017588 and parameters: {'kernel': 'rbf', 'C': 97.77127905581263, 'gamma': 0.026515437589650994, 'epsilon': 0.07420585954129139}. Best is trial 1119 with value: 0.4485361816812923.
[I 2024-12-03 18:51:03,468] Trial 2090 finished with value: 0.48571025160662856 and parameters: {'kernel': 'rbf', 'C': 96.02689697448305, 'gamma': 0.0069232239850240945, 'epsilon': 0.10140343234071283}. Best is trial 1119 with value: 0.4485361816812923.
[I 2024-12-03 18:51:03,633] Trial 2084 finished with value: 275.3445160473544 and parameters: {'kernel': 'sigmoid', 'C': 87.09297435395206, 'gamma': 0.017314413975959054, 'epsilon': 0.028032329933055884}. Best is trial 1119 with value: 0.4485361816812923.
[I 2024-12-03 18:51:03,771] Trial 2103 finished with value: 290.5435921218064 and parameters: {'kernel': 'sigmoid', 'C': 89.28895812653731, 'gamma': 0.017728815647236256, 'epsilon': 0.0085387135944831}. Best is trial 1119 with value: 0.4485361816812923.
[I 2024-12-03 18:51:04,379] Trial 2104 finished with value: 0.5985792150415169 and parameters: {'kernel': 'rbf', 'C': 98.09287332870012, 'gamma': 0.043698266258607774, 'epsilon': 0.03353033317705357}. Best is trial 1119 with value: 0.4485361816812923.
[I 2024-12-03 18:51:04,523] Trial 2087 finished with value: 1.1021854067661865 and parameters: {'kernel': 'poly', 'C': 6.543641278706146, 'gamma': 0.0027370529696644375, 'epsilon': 0.002332885674276973}. Best is trial 1119 with value: 0.4485361816812923.
[I 2024-12-03 18:51:04,819] Trial 2094 finished with value: 0.5091867029996427 and parameters: {'kernel': 'rbf', 'C': 97.07384443117013, 'gamma': 0.02824250023240881, 'epsilon': 0.03555633247535704}. Best is trial 1119 with value: 0.4485361816812923.
[I 2024-12-03 18:51:06,207] Trial 2092 finished with value: 0.5036619633403404 and parameters: {'kernel': 'rbf', 'C': 93.20818855828286, 'gamma': 0.005416879602403715, 'epsilon': 0.12445587460772299}. Best is trial 1119 with value: 0.4485361816812923.
[I 2024-12-03 18:51:06,491] Trial 2101 finished with value: 1.1054726849255854 and parameters: {'kernel': 'poly', 'C': 6.835621193813879, 'gamma': 0.0042203345644009176, 'epsilon': 0.11788787669112007}. Best is trial 1119 with value: 0.4485361816812923.
[I 2024-12-03 18:51:06,662] Trial 2096 finished with value: 0.4891308964900126 and parameters: {'kernel': 'rbf', 'C': 26.59611982081891, 'gamma': 0.013278543934372411, 'epsilon': 0.16960510327117165}. Best is trial 1119 with value: 0.4485361816812923.
[I 2024-12-03 18:51:07,023] Trial 2099 finished with value: 0.4807004201613573 and parameters: {'kernel': 'rbf', 'C': 93.5824059007806, 'gamma': 0.007490165959668584, 'epsilon': 0.1001296180382707}. Best is trial 1119 with value: 0.4485361816812923.
[I 2024-12-03 18:51:07,048] Trial 2097 finished with value: 0.5916395037551047 and parameters: {'kernel': 'linear', 'C': 0.3955796160152622, 'gamma': 0.03106411845717599, 'epsilon': 0.29937811915505613}. Best is trial 1119 with value: 0.4485361816812923.
[I 2024-12-03 18:51:07,980] Trial 2114 finished with value: 0.5290769405727832 and parameters: {'kernel': 'rbf', 'C': 92.1464876252543, 'gamma': 0.0052196973140253965, 'epsilon': 0.19861809244865364}. Best is trial 1119 with value: 0.4485361816812923.
[I 2024-12-03 18:51:08,119] Trial 2109 finished with value: 0.6021791249743613 and parameters: {'kernel': 'rbf', 'C': 28.024167995464666, 'gamma': 0.12430281445365127, 'epsilon': 0.07871180885350898}. Best is trial 1119 with value: 0.4485361816812923.
[I 2024-12-03 18:51:08,509] Trial 2108 finished with value: 0.4650259178302722 and parameters: {'kernel': 'rbf', 'C': 99.30872070454406, 'gamma': 0.008778825423501023, 'epsilon': 0.09779382134304174}. Best is trial 1119 with value: 0.4485361816812923.
[I 2024-12-03 18:51:08,748] Trial 2102 finished with value: 0.503964396673805 and parameters: {'kernel': 'rbf', 'C': 22.925888919894692, 'gamma': 0.04361450791366951, 'epsilon': 0.09899058215776135}. Best is trial 1119 with value: 0.4485361816812923.
[I 2024-12-03 18:51:09,232] Trial 2100 finished with value: 0.4829472238488462 and parameters: {'kernel': 'rbf', 'C': 24.17751854876508, 'gamma': 0.016039125332034613, 'epsilon': 0.02150695174300212}. Best is trial 1119 with value: 0.4485361816812923.
[I 2024-12-03 18:51:09,309] Trial 2098 finished with value: 0.5380393899101025 and parameters: {'kernel': 'rbf', 'C': 23.183637517142568, 'gamma': 0.0074996262830271665, 'epsilon': 0.04501273543799594}. Best is trial 1119 with value: 0.4485361816812923.
[I 2024-12-03 18:51:10,162] Trial 2107 finished with value: 0.6031881177287282 and parameters: {'kernel': 'rbf', 'C': 2.4891524913820726, 'gamma': 0.10687210914654872, 'epsilon': 0.18973013554244264}. Best is trial 1119 with value: 0.4485361816812923.
[I 2024-12-03 18:51:10,163] Trial 2115 finished with value: 0.6007971566921123 and parameters: {'kernel': 'rbf', 'C': 97.07968029716473, 'gamma': 0.08491594128585382, 'epsilon': 0.163399414870104}. Best is trial 1119 with value: 0.4485361816812923.
[I 2024-12-03 18:51:10,408] Trial 2116 finished with value: 0.536808106026042 and parameters: {'kernel': 'rbf', 'C': 4.872999265675207, 'gamma': 0.03251710395648866, 'epsilon': 0.036034547781132034}. Best is trial 1119 with value: 0.4485361816812923.
[I 2024-12-03 18:51:10,487] Trial 2110 finished with value: 0.619967867046645 and parameters: {'kernel': 'rbf', 'C': 5.166641755886721, 'gamma': 0.009928855097970373, 'epsilon': 0.0634879730969588}. Best is trial 1119 with value: 0.4485361816812923.
[I 2024-12-03 18:51:10,516] Trial 2118 finished with value: 0.6444153371754813 and parameters: {'kernel': 'linear', 'C': 7.606933361565023, 'gamma': 0.0021425950697370666, 'epsilon': 0.68699713014996}. Best is trial 1119 with value: 0.4485361816812923.
[I 2024-12-03 18:51:10,532] Trial 2111 finished with value: 0.5068263789857944 and parameters: {'kernel': 'rbf', 'C': 95.85006615495942, 'gamma': 0.004919567048634751, 'epsilon': 0.03084376427905471}. Best is trial 1119 with value: 0.4485361816812923.
[I 2024-12-03 18:51:10,940] Trial 2105 finished with value: 1.1073956425816176 and parameters: {'kernel': 'poly', 'C': 15.115776205771772, 'gamma': 0.004140208319815266, 'epsilon': 0.02929767151083758}. Best is trial 1119 with value: 0.4485361816812923.
[I 2024-12-03 18:51:11,437] Trial 2106 finished with value: 0.5359218187847581 and parameters: {'kernel': 'rbf', 'C': 94.46406781276495, 'gamma': 0.024580820550893202, 'epsilon': 0.25347696328886565}. Best is trial 1119 with value: 0.4485361816812923.
[I 2024-12-03 18:51:11,610] Trial 2119 finished with value: 0.5038847405761078 and parameters: {'kernel': 'rbf', 'C': 20.268887533903484, 'gamma': 0.013421703128251332, 'epsilon': 0.060046572118786314}. Best is trial 1119 with value: 0.4485361816812923.
[I 2024-12-03 18:51:12,189] Trial 2113 finished with value: 0.5917849558170031 and parameters: {'kernel': 'linear', 'C': 46.38241548622476, 'gamma': 0.007170952525345582, 'epsilon': 0.16899443631450384}. Best is trial 1119 with value: 0.4485361816812923.
[I 2024-12-03 18:51:12,740] Trial 2117 finished with value: 0.5904524523461049 and parameters: {'kernel': 'rbf', 'C': 26.48698227895655, 'gamma': 0.0026648047188300127, 'epsilon': 0.056581553767929504}. Best is trial 1119 with value: 0.4485361816812923.
[I 2024-12-03 18:51:13,038] Trial 2125 finished with value: 0.5293915063963535 and parameters: {'kernel': 'rbf', 'C': 23.546218897803943, 'gamma': 0.009485831435353276, 'epsilon': 0.10811680250148964}. Best is trial 1119 with value: 0.4485361816812923.
[I 2024-12-03 18:51:13,189] Trial 2112 finished with value: 497.52989661116453 and parameters: {'kernel': 'sigmoid', 'C': 76.32403057410706, 'gamma': 0.052741867020082475, 'epsilon': 0.09928820155058418}. Best is trial 1119 with value: 0.4485361816812923.
[I 2024-12-03 18:51:13,559] Trial 2122 finished with value: 0.573984495537772 and parameters: {'kernel': 'linear', 'C': 88.42573868670411, 'gamma': 0.015454129679392031, 'epsilon': 0.0827978736997481}. Best is trial 1119 with value: 0.4485361816812923.
[I 2024-12-03 18:51:13,991] Trial 2121 finished with value: 0.5466200268564354 and parameters: {'kernel': 'rbf', 'C': 97.34121233795949, 'gamma': 0.03285922260930846, 'epsilon': 0.01873385757193428}. Best is trial 1119 with value: 0.4485361816812923.
[I 2024-12-03 18:51:15,860] Trial 2134 finished with value: 0.45303967828170416 and parameters: {'kernel': 'rbf', 'C': 97.84733029055123, 'gamma': 0.013929333746570908, 'epsilon': 0.08695609349103316}. Best is trial 1119 with value: 0.4485361816812923.
[I 2024-12-03 18:51:15,868] Trial 2123 finished with value: 0.45767068080389606 and parameters: {'kernel': 'rbf', 'C': 92.84866345260902, 'gamma': 0.011592745157608227, 'epsilon': 0.04929957438232442}. Best is trial 1119 with value: 0.4485361816812923.
[I 2024-12-03 18:51:16,281] Trial 2127 finished with value: 1.2330903401268907 and parameters: {'kernel': 'rbf', 'C': 0.007640810361516133, 'gamma': 0.09804444717272896, 'epsilon': 0.8343140646262359}. Best is trial 1119 with value: 0.4485361816812923.
[I 2024-12-03 18:51:16,683] Trial 2126 finished with value: 0.6817092475074666 and parameters: {'kernel': 'rbf', 'C': 6.721739975528189, 'gamma': 0.0042558944599179315, 'epsilon': 0.18555096062563664}. Best is trial 1119 with value: 0.4485361816812923.
[I 2024-12-03 18:51:16,685] Trial 2128 finished with value: 2.4632685632734135 and parameters: {'kernel': 'sigmoid', 'C': 15.547407344506357, 'gamma': 0.004267399674423393, 'epsilon': 0.06811570934993896}. Best is trial 1119 with value: 0.4485361816812923.
[I 2024-12-03 18:51:17,796] Trial 2130 finished with value: 0.5000115285229055 and parameters: {'kernel': 'rbf', 'C': 24.19825061571744, 'gamma': 0.03167041337915131, 'epsilon': 0.2294343876472565}. Best is trial 1119 with value: 0.4485361816812923.
[I 2024-12-03 18:51:17,953] Trial 2137 finished with value: 0.49189405563214655 and parameters: {'kernel': 'rbf', 'C': 95.39914581791191, 'gamma': 0.015470190313774978, 'epsilon': 0.20416414446063968}. Best is trial 1119 with value: 0.4485361816812923.
[I 2024-12-03 18:51:17,960] Trial 2132 finished with value: 0.48833046209891023 and parameters: {'kernel': 'rbf', 'C': 20.520025017044713, 'gamma': 0.04274553304642623, 'epsilon': 0.06923523865663282}. Best is trial 1119 with value: 0.4485361816812923.
[I 2024-12-03 18:51:17,965] Trial 2131 finished with value: 0.45939048051523834 and parameters: {'kernel': 'rbf', 'C': 90.87066691619543, 'gamma': 0.01482443286178914, 'epsilon': 0.02302781230019983}. Best is trial 1119 with value: 0.4485361816812923.
[I 2024-12-03 18:51:17,966] Trial 2120 finished with value: 0.5146336320461786 and parameters: {'kernel': 'rbf', 'C': 21.6243245430664, 'gamma': 0.011282918216606248, 'epsilon': 0.04792833942618001}. Best is trial 1119 with value: 0.4485361816812923.
[I 2024-12-03 18:51:18,474] Trial 2133 finished with value: 0.5422505571682699 and parameters: {'kernel': 'rbf', 'C': 23.745989422363856, 'gamma': 0.006686169539660909, 'epsilon': 0.05089976431771096}. Best is trial 1119 with value: 0.4485361816812923.
[I 2024-12-03 18:51:19,766] Trial 2139 finished with value: 0.4820274394088729 and parameters: {'kernel': 'rbf', 'C': 94.17791224714921, 'gamma': 0.007340093309229393, 'epsilon': 0.09641552193886424}. Best is trial 1119 with value: 0.4485361816812923.
[I 2024-12-03 18:51:20,102] Trial 2141 finished with value: 0.5477983388017453 and parameters: {'kernel': 'rbf', 'C': 22.491190162749092, 'gamma': 0.007216397348737118, 'epsilon': 0.015810104936884013}. Best is trial 1119 with value: 0.4485361816812923.
[I 2024-12-03 18:51:20,274] Trial 2136 finished with value: 0.5019356067525454 and parameters: {'kernel': 'rbf', 'C': 97.63803217013631, 'gamma': 0.025457705510794165, 'epsilon': 0.06874479970754438}. Best is trial 1119 with value: 0.4485361816812923.
