[I 2024-12-03 21:01:30,277] Trial 99 finished with value: 24.800944748290853 and parameters: {'kernel': 'poly', 'C': 61.23160922582146, 'gamma': 0.2891609007380062, 'epsilon': 0.3433803934788304}. Best is trial 88 with value: 0.3542875001421725.
[I 2024-12-03 21:10:29,920] Trial 557 finished with value: 1742.7687542362837 and parameters: {'kernel': 'poly', 'C': 85.07757936561418, 'gamma': 0.8113560145954655, 'epsilon': 0.11623260785463103}. Best is trial 88 with value: 0.3542875001421725.
[I 2024-12-03 21:14:27,803] Trial 2012 finished with value: 44.447177755946015 and parameters: {'kernel': 'poly', 'C': 77.34052757359186, 'gamma': 0.28799138808499564, 'epsilon': 0.20772763979183823}. Best is trial 88 with value: 0.3542875001421725.
