[I 2024-12-04 15:00:38,094] Trial 374 finished with value: 1.3007739118865138 and parameters: {'kernel_type': 'Matern', 'length_scale': 0.00043126289272745654, 'noise_level': 0.14387654709531847, 'constant_value': 1.0458990062136588e-06, 'nu': 2.5}. Best is trial 276 with value: 0.13435392997433446.
[I 2024-12-04 15:00:38,777] Trial 361 finished with value: 0.13435418315718423 and parameters: {'kernel_type': 'Matern', 'length_scale': 1.2322462764830804, 'noise_level': 3.142627498680819e-07, 'constant_value': 0.0034302592199300327, 'nu': 1.5}. Best is trial 276 with value: 0.13435392997433446.
[I 2024-12-04 15:00:41,481] Trial 371 finished with value: 1.26936350285662 and parameters: {'kernel_type': 'Matern', 'length_scale': 0.001336929569015824, 'noise_level': 0.003195275146225997, 'constant_value': 606.6710843926797, 'nu': 1.5}. Best is trial 276 with value: 0.13435392997433446.
[I 2024-12-04 15:00:41,878] Trial 383 finished with value: 1.2693634862999899 and parameters: {'kernel_type': 'Matern', 'length_scale': 0.05672646404109119, 'noise_level': 0.004739088144916268, 'constant_value': 85.05189107351129, 'nu': 0.5}. Best is trial 276 with value: 0.13435392997433446.
[I 2024-12-04 15:00:41,882] Trial 379 finished with value: 0.13435439850019046 and parameters: {'kernel_type': 'Matern', 'length_scale': 0.5406942048500126, 'noise_level': 0.06746500895074253, 'constant_value': 21.356145721031957, 'nu': 1.5}. Best is trial 276 with value: 0.13435392997433446.
[I 2024-12-04 15:00:43,767] Trial 378 finished with value: 0.13435471201202445 and parameters: {'kernel_type': 'Matern', 'length_scale': 3.162177592009574, 'noise_level': 3.1938921695109763e-06, 'constant_value': 4.336378135128009, 'nu': 1.5}. Best is trial 276 with value: 0.13435392997433446.
[I 2024-12-04 15:00:44,010] Trial 373 finished with value: 0.13435441137971296 and parameters: {'kernel_type': 'Matern', 'length_scale': 79.49729054016132, 'noise_level': 0.003417712001396217, 'constant_value': 0.9698338629059243, 'nu': 1.5}. Best is trial 276 with value: 0.13435392997433446.
[I 2024-12-04 15:00:44,638] Trial 372 finished with value: 1.3007522667224598 and parameters: {'kernel_type': 'RBF', 'length_scale': 601.2962948001285, 'noise_level': 0.00012937451302261392, 'constant_value': 6.194731590116705e-06, 'nu': 2.5}. Best is trial 276 with value: 0.13435392997433446.
[I 2024-12-04 15:00:47,409] Trial 381 finished with value: 0.13435426992426544 and parameters: {'kernel_type': 'Matern', 'length_scale': 39.87968368046589, 'noise_level': 0.2612136283238628, 'constant_value': 93639.74316919052, 'nu': 1.5}. Best is trial 276 with value: 0.13435392997433446.
[I 2024-12-04 15:00:47,669] Trial 368 finished with value: 1.2693635028566317 and parameters: {'kernel_type': 'RBF', 'length_scale': 8658.72816336666, 'noise_level': 2.6266304294790927e-08, 'constant_value': 0.01845202089422781, 'nu': 2.5}. Best is trial 276 with value: 0.13435392997433446.
[I 2024-12-04 15:00:47,985] Trial 387 finished with value: 1.2693635028572243 and parameters: {'kernel_type': 'Matern', 'length_scale': 0.03306604838523234, 'noise_level': 3.751341082520254e-07, 'constant_value': 0.15591991541193456, 'nu': 1.5}. Best is trial 276 with value: 0.13435392997433446.
[I 2024-12-04 15:00:49,275] Trial 384 finished with value: 0.14859822762737956 and parameters: {'kernel_type': 'Matern', 'length_scale': 145.18340176662142, 'noise_level': 4.247617254417323e-05, 'constant_value': 58934.593293448954, 'nu': 2.5}. Best is trial 276 with value: 0.13435392997433446.
[I 2024-12-04 15:00:51,871] Trial 380 finished with value: 0.13435466594037315 and parameters: {'kernel_type': 'Matern', 'length_scale': 0.9351101053674856, 'noise_level': 0.002478627324305218, 'constant_value': 31.82782209038604, 'nu': 1.5}. Best is trial 276 with value: 0.13435392997433446.
[I 2024-12-04 15:00:53,242] Trial 385 finished with value: 1.269363502857028 and parameters: {'kernel_type': 'RBF', 'length_scale': 8.861977048837272e-05, 'noise_level': 1.5854444026309015e-10, 'constant_value': 7.517357575439249, 'nu': 1.5}. Best is trial 276 with value: 0.13435392997433446.
[I 2024-12-04 15:00:55,760] Trial 382 finished with value: 0.1343544000719639 and parameters: {'kernel_type': 'Matern', 'length_scale': 0.1510911161423782, 'noise_level': 0.0006975390914896426, 'constant_value': 102.07851830865175, 'nu': 1.5}. Best is trial 276 with value: 0.13435392997433446.
[I 2024-12-04 15:00:56,413] Trial 393 finished with value: 0.13435440563966272 and parameters: {'kernel_type': 'Matern', 'length_scale': 1.47737977241633, 'noise_level': 1.4392039184659736e-07, 'constant_value': 0.11339079617030581, 'nu': 1.5}. Best is trial 276 with value: 0.13435392997433446.
[I 2024-12-04 15:00:57,036] Trial 388 finished with value: 1.2693635028565677 and parameters: {'kernel_type': 'Matern', 'length_scale': 0.0028099150912355296, 'noise_level': 2.7585576092846744e-07, 'constant_value': 0.00016533625644179933, 'nu': 1.5}. Best is trial 276 with value: 0.13435392997433446.
[I 2024-12-04 15:00:57,611] Trial 392 finished with value: 0.15167301513143908 and parameters: {'kernel_type': 'RBF', 'length_scale': 2.672668091291322, 'noise_level': 0.0004272852167092573, 'constant_value': 2757.8504792070435, 'nu': 2.5}. Best is trial 276 with value: 0.13435392997433446.
[I 2024-12-04 15:00:58,211] Trial 389 finished with value: 0.1343545740814933 and parameters: {'kernel_type': 'Matern', 'length_scale': 0.24581180489307813, 'noise_level': 0.027635791084679787, 'constant_value': 69.97136014735945, 'nu': 1.5}. Best is trial 276 with value: 0.13435392997433446.
[I 2024-12-04 15:00:58,804] Trial 397 finished with value: 0.13435441105979629 and parameters: {'kernel_type': 'Matern', 'length_scale': 2.8379582199408686, 'noise_level': 4.523573409085666e-07, 'constant_value': 194.64628573363186, 'nu': 1.5}. Best is trial 276 with value: 0.13435392997433446.
[I 2024-12-04 15:00:59,195] Trial 395 finished with value: 1.3007739234688411 and parameters: {'kernel_type': 'Matern', 'length_scale': 0.006686601786276878, 'noise_level': 0.5680829061218854, 'constant_value': 1.9489092011951698e-07, 'nu': 0.5}. Best is trial 276 with value: 0.13435392997433446.
[I 2024-12-04 15:01:01,398] Trial 394 finished with value: 1.2693634848354445 and parameters: {'kernel_type': 'Matern', 'length_scale': 0.0815687292949073, 'noise_level': 3.383805172997096e-06, 'constant_value': 6.43656278438212e-05, 'nu': 1.5}. Best is trial 276 with value: 0.13435392997433446.
[I 2024-12-04 15:01:03,959] Trial 399 finished with value: 0.13435434227675852 and parameters: {'kernel_type': 'Matern', 'length_scale': 20.753162073921654, 'noise_level': 0.004605897513887334, 'constant_value': 21447.977496798463, 'nu': 1.5}. Best is trial 276 with value: 0.13435392997433446.
[I 2024-12-04 15:01:04,572] Trial 401 finished with value: 0.1343542164016987 and parameters: {'kernel_type': 'Matern', 'length_scale': 57.7657069999044, 'noise_level': 0.007805437665913697, 'constant_value': 275.999081459971, 'nu': 1.5}. Best is trial 276 with value: 0.13435392997433446.
[I 2024-12-04 15:01:05,638] Trial 386 finished with value: 1.2693635028565453 and parameters: {'kernel_type': 'Matern', 'length_scale': 51.44051708867958, 'noise_level': 2.2842061878034125e-07, 'constant_value': 0.0024272880627144015, 'nu': 1.5}. Best is trial 276 with value: 0.13435392997433446.
[I 2024-12-04 15:01:06,704] Trial 406 finished with value: 0.13435436215723612 and parameters: {'kernel_type': 'Matern', 'length_scale': 16.326941660823405, 'noise_level': 0.010890801470503987, 'constant_value': 3110.35395906951, 'nu': 1.5}. Best is trial 276 with value: 0.13435392997433446.
[I 2024-12-04 15:01:07,291] Trial 391 finished with value: 1.2693635028565455 and parameters: {'kernel_type': 'Matern', 'length_scale': 3496.169266726082, 'noise_level': 0.004676227799806554, 'constant_value': 0.7926213135344644, 'nu': 2.5}. Best is trial 276 with value: 0.13435392997433446.
[I 2024-12-04 15:01:07,716] Trial 402 finished with value: 0.13435432980656237 and parameters: {'kernel_type': 'Matern', 'length_scale': 7.324637172075233, 'noise_level': 0.5260884290932206, 'constant_value': 22362.915593102625, 'nu': 1.5}. Best is trial 276 with value: 0.13435392997433446.
[I 2024-12-04 15:01:09,932] Trial 407 finished with value: 1.2693635028562313 and parameters: {'kernel_type': 'Matern', 'length_scale': 0.003361433208076586, 'noise_level': 0.00010780361506424292, 'constant_value': 38.371127922111285, 'nu': 1.5}. Best is trial 276 with value: 0.13435392997433446.
[I 2024-12-04 15:01:11,097] Trial 396 finished with value: 0.1343544284773313 and parameters: {'kernel_type': 'Matern', 'length_scale': 0.6021334107318533, 'noise_level': 3.5780166369375576e-06, 'constant_value': 0.0002787299903331447, 'nu': 1.5}. Best is trial 276 with value: 0.13435392997433446.
[I 2024-12-04 15:01:11,482] Trial 410 finished with value: 0.13435438512629694 and parameters: {'kernel_type': 'Matern', 'length_scale': 15.738554159517328, 'noise_level': 0.013073592685589485, 'constant_value': 22803.921846831072, 'nu': 1.5}. Best is trial 276 with value: 0.13435392997433446.
[I 2024-12-04 15:01:11,964] Trial 408 finished with value: 0.13435440799708023 and parameters: {'kernel_type': 'Matern', 'length_scale': 21.35588357306474, 'noise_level': 0.22446869950217183, 'constant_value': 26926.92336595177, 'nu': 1.5}. Best is trial 276 with value: 0.13435392997433446.
[I 2024-12-04 15:01:12,026] Trial 409 finished with value: 0.17251040267360293 and parameters: {'kernel_type': 'Matern', 'length_scale': 124.75425038238247, 'noise_level': 0.09413948873635404, 'constant_value': 71406.65789074152, 'nu': 0.5}. Best is trial 276 with value: 0.13435392997433446.
[I 2024-12-04 15:01:13,910] Trial 390 finished with value: 1.2693635028555534 and parameters: {'kernel_type': 'Matern', 'length_scale': 725.7960877784651, 'noise_level': 3.568632260791657e-05, 'constant_value': 2.468819208181789e-06, 'nu': 0.5}. Best is trial 276 with value: 0.13435392997433446.
[I 2024-12-04 15:01:17,553] Trial 412 finished with value: 0.13435456059308443 and parameters: {'kernel_type': 'Matern', 'length_scale': 148.2570223171261, 'noise_level': 0.005144858044920474, 'constant_value': 429.83516651680077, 'nu': 1.5}. Best is trial 276 with value: 0.13435392997433446.
[I 2024-12-04 15:01:17,856] Trial 400 finished with value: 0.13435420821104005 and parameters: {'kernel_type': 'Matern', 'length_scale': 916.7931128292621, 'noise_level': 0.0034962172699304277, 'constant_value': 440.4304384359017, 'nu': 1.5}. Best is trial 276 with value: 0.13435392997433446.
[I 2024-12-04 15:01:18,677] Trial 411 finished with value: 0.13435438922655993 and parameters: {'kernel_type': 'Matern', 'length_scale': 26.502065802275123, 'noise_level': 0.0026843923711420536, 'constant_value': 51.42394721978424, 'nu': 1.5}. Best is trial 276 with value: 0.13435392997433446.
[I 2024-12-04 15:01:21,419] Trial 398 finished with value: 0.13435441733130238 and parameters: {'kernel_type': 'Matern', 'length_scale': 1.6199057799121785, 'noise_level': 7.906912614911464e-09, 'constant_value': 0.005109842213935956, 'nu': 1.5}. Best is trial 276 with value: 0.13435392997433446.
[I 2024-12-04 15:01:22,760] Trial 403 finished with value: 0.134354399959435 and parameters: {'kernel_type': 'Matern', 'length_scale': 0.14839818688303788, 'noise_level': 0.0010699124207656876, 'constant_value': 0.4995241301770447, 'nu': 1.5}. Best is trial 276 with value: 0.13435392997433446.
[I 2024-12-04 15:01:22,792] Trial 404 finished with value: 0.13435441287193634 and parameters: {'kernel_type': 'Matern', 'length_scale': 0.3157959967883737, 'noise_level': 2.0618667749805422e-07, 'constant_value': 0.0036795907637079623, 'nu': 1.5}. Best is trial 276 with value: 0.13435392997433446.
[I 2024-12-04 15:01:23,039] Trial 413 finished with value: 0.13435436044039675 and parameters: {'kernel_type': 'Matern', 'length_scale': 0.45467619648104085, 'noise_level': 0.6370291909264794, 'constant_value': 91394.80411214339, 'nu': 1.5}. Best is trial 276 with value: 0.13435392997433446.
[I 2024-12-04 15:01:24,174] Trial 405 finished with value: 1.2693635028574797 and parameters: {'kernel_type': 'Matern', 'length_scale': 41.567952315916294, 'noise_level': 1.588361490534468e-09, 'constant_value': 4.461157609535205e-06, 'nu': 0.5}. Best is trial 276 with value: 0.13435392997433446.
[I 2024-12-04 15:01:25,351] Trial 422 finished with value: 1.3007739235905813 and parameters: {'kernel_type': 'Matern', 'length_scale': 0.00017945537735190026, 'noise_level': 1.8617927507334884e-05, 'constant_value': 13391.636492653692, 'nu': 0.5}. Best is trial 276 with value: 0.13435392997433446.
[I 2024-12-04 15:01:25,777] Trial 414 finished with value: 0.13435408942859278 and parameters: {'kernel_type': 'Matern', 'length_scale': 90.09949437782849, 'noise_level': 0.07449108608677119, 'constant_value': 56057.94924187272, 'nu': 1.5}. Best is trial 276 with value: 0.13435392997433446.
[I 2024-12-04 15:01:26,203] Trial 417 finished with value: 0.13435439923913672 and parameters: {'kernel_type': 'Matern', 'length_scale': 2.9820463983366743, 'noise_level': 0.00889322347122635, 'constant_value': 55692.374198510806, 'nu': 1.5}. Best is trial 276 with value: 0.13435392997433446.
[I 2024-12-04 15:01:27,534] Trial 418 finished with value: 1.2693635028567665 and parameters: {'kernel_type': 'Matern', 'length_scale': 13.752714151362587, 'noise_level': 1.7117143998897423e-06, 'constant_value': 0.00786745840817739, 'nu': 1.5}. Best is trial 276 with value: 0.13435392997433446.
[I 2024-12-04 15:01:28,743] Trial 423 finished with value: 1.2693634631007487 and parameters: {'kernel_type': 'RBF', 'length_scale': 0.17418329542512123, 'noise_level': 1.0319326926092163e-07, 'constant_value': 0.0019273733202923593, 'nu': 0.5}. Best is trial 276 with value: 0.13435392997433446.
[I 2024-12-04 15:01:28,869] Trial 415 finished with value: 1.2693635028566832 and parameters: {'kernel_type': 'Matern', 'length_scale': 55.82348520278157, 'noise_level': 0.0018196973133207878, 'constant_value': 0.17025623805518833, 'nu': 1.5}. Best is trial 276 with value: 0.13435392997433446.
[I 2024-12-04 15:01:29,518] Trial 424 finished with value: 0.13435440296334214 and parameters: {'kernel_type': 'Matern', 'length_scale': 39.165763282859125, 'noise_level': 0.0028702722293560013, 'constant_value': 290.44328143673323, 'nu': 1.5}. Best is trial 276 with value: 0.13435392997433446.
[I 2024-12-04 15:01:30,083] Trial 420 finished with value: 0.1343544010164646 and parameters: {'kernel_type': 'Matern', 'length_scale': 0.20036325010921516, 'noise_level': 0.002716277995344667, 'constant_value': 271.6800287130734, 'nu': 1.5}. Best is trial 276 with value: 0.13435392997433446.
[I 2024-12-04 15:01:32,645] Trial 421 finished with value: 0.13435457270004858 and parameters: {'kernel_type': 'Matern', 'length_scale': 0.2320317178586626, 'noise_level': 2.0168326461052044e-06, 'constant_value': 0.07495578665761603, 'nu': 1.5}. Best is trial 276 with value: 0.13435392997433446.
[I 2024-12-04 15:01:35,189] Trial 426 finished with value: 0.1725102198142847 and parameters: {'kernel_type': 'Matern', 'length_scale': 752.8816350774347, 'noise_level': 0.0005770594542688637, 'constant_value': 47.85701483573121, 'nu': 0.5}. Best is trial 276 with value: 0.13435392997433446.
[I 2024-12-04 15:01:35,200] Trial 432 finished with value: 0.1485982494387776 and parameters: {'kernel_type': 'Matern', 'length_scale': 4.685963609174204, 'noise_level': 0.0029514164504348714, 'constant_value': 89610.3266006346, 'nu': 2.5}. Best is trial 276 with value: 0.13435392997433446.
[I 2024-12-04 15:01:35,204] Trial 430 finished with value: 0.1343543789282444 and parameters: {'kernel_type': 'Matern', 'length_scale': 232.30642037882575, 'noise_level': 0.11786588400447895, 'constant_value': 64630.733826115706, 'nu': 1.5}. Best is trial 276 with value: 0.13435392997433446.
[I 2024-12-04 15:01:37,138] Trial 427 finished with value: 1.2693635028568078 and parameters: {'kernel_type': 'Matern', 'length_scale': 19242.38229511861, 'noise_level': 0.0011095731697977676, 'constant_value': 208.3708956145196, 'nu': 1.5}. Best is trial 276 with value: 0.13435392997433446.
[I 2024-12-04 15:01:37,505] Trial 429 finished with value: 1.2693635028569692 and parameters: {'kernel_type': 'RBF', 'length_scale': 0.011467958980389988, 'noise_level': 5.538512178902596e-09, 'constant_value': 2.754956984648335e-06, 'nu': 2.5}. Best is trial 276 with value: 0.13435392997433446.
[I 2024-12-04 15:01:38,290] Trial 425 finished with value: 1.2693635028582138 and parameters: {'kernel_type': 'RBF', 'length_scale': 45299.62357002862, 'noise_level': 0.002085185935383478, 'constant_value': 0.26213898879379355, 'nu': 0.5}. Best is trial 276 with value: 0.13435392997433446.
[I 2024-12-04 15:01:38,337] Trial 431 finished with value: 0.13435437191293742 and parameters: {'kernel_type': 'Matern', 'length_scale': 401.8022438366564, 'noise_level': 0.006118719928778173, 'constant_value': 961.7093841604877, 'nu': 1.5}. Best is trial 276 with value: 0.13435392997433446.
[I 2024-12-04 15:01:39,181] Trial 428 finished with value: 0.13435442476326445 and parameters: {'kernel_type': 'Matern', 'length_scale': 3358.4491952202193, 'noise_level': 0.002276076078220397, 'constant_value': 16775.782012695046, 'nu': 1.5}. Best is trial 276 with value: 0.13435392997433446.
[I 2024-12-04 15:01:39,205] Trial 416 finished with value: 0.13435408264020587 and parameters: {'kernel_type': 'Matern', 'length_scale': 0.5539865389106812, 'noise_level': 0.009019949383853252, 'constant_value': 140.33611214811577, 'nu': 1.5}. Best is trial 276 with value: 0.13435392997433446.
[I 2024-12-04 15:01:39,325] Trial 419 finished with value: 0.13435441144720905 and parameters: {'kernel_type': 'Matern', 'length_scale': 27.821749450075746, 'noise_level': 0.03161206958215013, 'constant_value': 82278.3423857057, 'nu': 1.5}. Best is trial 276 with value: 0.13435392997433446.
[I 2024-12-04 15:01:41,881] Trial 436 finished with value: 0.1516729744818416 and parameters: {'kernel_type': 'RBF', 'length_scale': 8.720438633383111, 'noise_level': 0.806397441610761, 'constant_value': 2321.613064573514, 'nu': 1.5}. Best is trial 276 with value: 0.13435392997433446.
[I 2024-12-04 15:01:41,910] Trial 434 finished with value: 1.2693635028595256 and parameters: {'kernel_type': 'Matern', 'length_scale': 1.916112775209585e-05, 'noise_level': 0.00010826634501326653, 'constant_value': 7.5740054456969395, 'nu': 2.5}. Best is trial 276 with value: 0.13435392997433446.
[I 2024-12-04 15:01:42,752] Trial 437 finished with value: 0.13435439521773213 and parameters: {'kernel_type': 'Matern', 'length_scale': 40.47675667925463, 'noise_level': 0.0014610859662629982, 'constant_value': 66195.14620147817, 'nu': 1.5}. Best is trial 276 with value: 0.13435392997433446.
[I 2024-12-04 15:01:43,605] Trial 433 finished with value: 0.13435447926378147 and parameters: {'kernel_type': 'Matern', 'length_scale': 21.27744097030983, 'noise_level': 0.022655733597279994, 'constant_value': 2205.8209118359973, 'nu': 1.5}. Best is trial 276 with value: 0.13435392997433446.
[I 2024-12-04 15:01:46,376] Trial 435 finished with value: 0.13435458435602873 and parameters: {'kernel_type': 'Matern', 'length_scale': 20.7195581156322, 'noise_level': 0.27735558754569345, 'constant_value': 60030.53408058866, 'nu': 1.5}. Best is trial 276 with value: 0.13435392997433446.
[I 2024-12-04 15:01:48,219] Trial 438 finished with value: 0.1343541353600783 and parameters: {'kernel_type': 'Matern', 'length_scale': 478.58612370022325, 'noise_level': 0.005361678471771854, 'constant_value': 690.6389146956898, 'nu': 1.5}. Best is trial 276 with value: 0.13435392997433446.
[I 2024-12-04 15:01:49,600] Trial 443 finished with value: 0.13435440238950183 and parameters: {'kernel_type': 'Matern', 'length_scale': 362.9261329521536, 'noise_level': 0.02378139872867185, 'constant_value': 3.591360768352285, 'nu': 1.5}. Best is trial 276 with value: 0.13435392997433446.
[I 2024-12-04 15:01:50,868] Trial 444 finished with value: 1.269363502856393 and parameters: {'kernel_type': 'Matern', 'length_scale': 0.028767765920890878, 'noise_level': 0.015143454965034404, 'constant_value': 2.718306214665764, 'nu': 1.5}. Best is trial 276 with value: 0.13435392997433446.
[I 2024-12-04 15:01:52,168] Trial 449 finished with value: 0.1516729719304721 and parameters: {'kernel_type': 'RBF', 'length_scale': 1.1647910306894547, 'noise_level': 0.003583363680030984, 'constant_value': 0.43321788195553856, 'nu': 2.5}. Best is trial 276 with value: 0.13435392997433446.
[I 2024-12-04 15:01:53,243] Trial 442 finished with value: 0.13435419662609185 and parameters: {'kernel_type': 'Matern', 'length_scale': 0.38511083776942995, 'noise_level': 0.011588513084263815, 'constant_value': 93748.1821668278, 'nu': 1.5}. Best is trial 276 with value: 0.13435392997433446.
[I 2024-12-04 15:01:53,529] Trial 445 finished with value: 0.1343543322950869 and parameters: {'kernel_type': 'Matern', 'length_scale': 420.3426564630889, 'noise_level': 0.10344730461113333, 'constant_value': 65596.8665016056, 'nu': 1.5}. Best is trial 276 with value: 0.13435392997433446.
[I 2024-12-04 15:01:54,852] Trial 447 finished with value: 0.1725103869912436 and parameters: {'kernel_type': 'Matern', 'length_scale': 1.3133216758908814, 'noise_level': 2.7477558865359555e-09, 'constant_value': 0.15129793430724844, 'nu': 0.5}. Best is trial 276 with value: 0.13435392997433446.
[I 2024-12-04 15:01:55,813] Trial 441 finished with value: 1.2693635028552486 and parameters: {'kernel_type': 'RBF', 'length_scale': 5341.41997578422, 'noise_level': 2.276769727959857e-09, 'constant_value': 619.1708073857959, 'nu': 0.5}. Best is trial 276 with value: 0.13435392997433446.
