[I 2024-12-03 18:53:30,109] Trial 2482 finished with value: 256.4821333050871 and parameters: {'kernel': 'sigmoid', 'C': 81.88811044385965, 'gamma': 0.017181684128800053, 'epsilon': 0.2008128414394985}. Best is trial 1119 with value: 0.4485361816812923.
[I 2024-12-03 18:53:30,121] Trial 2481 finished with value: 0.5459284302890066 and parameters: {'kernel': 'rbf', 'C': 98.93231408271924, 'gamma': 0.0029096337762767135, 'epsilon': 0.020864805337863602}. Best is trial 1119 with value: 0.4485361816812923.
[I 2024-12-03 18:53:30,571] Trial 2479 finished with value: 0.5792111767334598 and parameters: {'kernel': 'rbf', 'C': 4.399025555059722, 'gamma': 0.014805671215629618, 'epsilon': 0.10163872428017683}. Best is trial 1119 with value: 0.4485361816812923.
[I 2024-12-03 18:53:30,696] Trial 2495 finished with value: 0.46931649654636776 and parameters: {'kernel': 'rbf', 'C': 27.108846077026175, 'gamma': 0.02737231829138193, 'epsilon': 0.07982036843441685}. Best is trial 1119 with value: 0.4485361816812923.
[I 2024-12-03 18:53:30,946] Trial 2485 finished with value: 0.8040929274656714 and parameters: {'kernel': 'rbf', 'C': 5.618077347222585, 'gamma': 0.000492518789629912, 'epsilon': 0.32083395803033377}. Best is trial 1119 with value: 0.4485361816812923.
[I 2024-12-03 18:53:30,980] Trial 2488 finished with value: 0.7401045753199966 and parameters: {'kernel': 'poly', 'C': 94.97899676773659, 'gamma': 0.04217159072076949, 'epsilon': 0.024270164701634612}. Best is trial 1119 with value: 0.4485361816812923.
[I 2024-12-03 18:53:30,982] Trial 2489 finished with value: 0.48929522850501284 and parameters: {'kernel': 'rbf', 'C': 98.21522102633128, 'gamma': 0.00624314974772783, 'epsilon': 0.07896067466096271}. Best is trial 1119 with value: 0.4485361816812923.
[I 2024-12-03 18:53:31,442] Trial 2492 finished with value: 0.5638625076175482 and parameters: {'kernel': 'rbf', 'C': 95.35806803810223, 'gamma': 0.03619446678616407, 'epsilon': 0.0395487932230158}. Best is trial 1119 with value: 0.4485361816812923.
[I 2024-12-03 18:53:31,537] Trial 2487 finished with value: 0.525895832583532 and parameters: {'kernel': 'rbf', 'C': 99.28674395252989, 'gamma': 0.0034794023415176665, 'epsilon': 0.08230460462013166}. Best is trial 1119 with value: 0.4485361816812923.
[I 2024-12-03 18:53:31,645] Trial 2494 finished with value: 0.7630384910671869 and parameters: {'kernel': 'rbf', 'C': 4.668590467092736, 'gamma': 0.002810062092707435, 'epsilon': 0.015722289598627516}. Best is trial 1119 with value: 0.4485361816812923.
[I 2024-12-03 18:53:31,749] Trial 2498 finished with value: 0.564321076359761 and parameters: {'kernel': 'linear', 'C': 3.753717799834485, 'gamma': 0.011779177843374407, 'epsilon': 0.16104545431901024}. Best is trial 1119 with value: 0.4485361816812923.
[I 2024-12-03 18:53:31,876] Trial 2490 finished with value: 1.3207921201786978 and parameters: {'kernel': 'sigmoid', 'C': 0.0034179158679088465, 'gamma': 0.0008123750881126122, 'epsilon': 0.525189566039546}. Best is trial 1119 with value: 0.4485361816812923.
[I 2024-12-03 18:53:31,878] Trial 2497 finished with value: 0.45152934481258994 and parameters: {'kernel': 'rbf', 'C': 92.09064692716187, 'gamma': 0.01194060691993413, 'epsilon': 0.059288013876216676}. Best is trial 1119 with value: 0.4485361816812923.
[I 2024-12-03 18:53:31,889] Trial 2496 finished with value: 0.5412713752214453 and parameters: {'kernel': 'rbf', 'C': 23.208540051373596, 'gamma': 0.008394224489597722, 'epsilon': 0.15287855519719118}. Best is trial 1119 with value: 0.4485361816812923.
[I 2024-12-03 18:53:32,132] Trial 2493 finished with value: 1.1020906572672853 and parameters: {'kernel': 'poly', 'C': 0.01901674850103576, 'gamma': 0.03167593016888199, 'epsilon': 0.0012556021888268309}. Best is trial 1119 with value: 0.4485361816812923.
[I 2024-12-03 18:53:32,137] Trial 2499 finished with value: 0.5100623640962875 and parameters: {'kernel': 'rbf', 'C': 99.23133141643125, 'gamma': 0.02628499537508126, 'epsilon': 0.06882897104678094}. Best is trial 1119 with value: 0.4485361816812923.
[I 2024-12-03 19:17:19,356] Trial 2065 finished with value: 1.0319807822251357 and parameters: {'kernel': 'poly', 'C': 72.24014758149288, 'gamma': 0.8285758572914221, 'epsilon': 0.0320391466525078}. Best is trial 1119 with value: 0.4485361816812923.
