[I 2024-12-04 11:55:06,917] A new study created in RDB with name: Pc_rf
[I 2024-12-04 11:55:19,343] Trial 6 finished with value: 0.9703080642437955 and parameters: {'n_estimators': 204, 'max_depth': 6, 'min_samples_split': 39, 'min_samples_leaf': 4, 'max_features': 'sqrt', 'bootstrap': True, 'criterion': 'absolute_error'}. Best is trial 12 with value: 0.6412015766563829.
[I 2024-12-04 11:55:19,488] Trial 18 finished with value: 1.0149311933595855 and parameters: {'n_estimators': 753, 'max_depth': 15, 'min_samples_split': 46, 'min_samples_leaf': 4, 'max_features': 'log2', 'bootstrap': False, 'criterion': 'squared_error'}. Best is trial 12 with value: 0.6412015766563829.
[I 2024-12-04 11:55:21,786] Trial 7 finished with value: 0.9391111266800167 and parameters: {'n_estimators': 227, 'max_depth': 19, 'min_samples_split': 19, 'min_samples_leaf': 2, 'max_features': 'log2', 'bootstrap': False, 'criterion': 'absolute_error'}. Best is trial 12 with value: 0.6412015766563829.
[I 2024-12-04 11:55:22,140] Trial 5 finished with value: 0.9639145369156858 and parameters: {'n_estimators': 257, 'max_depth': 44, 'min_samples_split': 11, 'min_samples_leaf': 2, 'max_features': 'log2', 'bootstrap': True, 'criterion': 'squared_error'}. Best is trial 12 with value: 0.6412015766563829.
[I 2024-12-04 11:55:22,604] Trial 12 finished with value: 0.6412015766563829 and parameters: {'n_estimators': 333, 'max_depth': 33, 'min_samples_split': 2, 'min_samples_leaf': 7, 'max_features': None, 'bootstrap': True, 'criterion': 'squared_error'}. Best is trial 12 with value: 0.6412015766563829.
[I 2024-12-04 11:55:23,478] Trial 0 finished with value: 0.7729611489319609 and parameters: {'n_estimators': 447, 'max_depth': 13, 'min_samples_split': 37, 'min_samples_leaf': 1, 'max_features': 'sqrt', 'bootstrap': False, 'criterion': 'squared_error'}. Best is trial 12 with value: 0.6412015766563829.
[W 2024-12-04 11:55:23,866] Trial 2 failed with parameters: {'n_estimators': 331, 'max_depth': 16, 'min_samples_split': 37, 'min_samples_leaf': 1, 'max_features': 'sqrt', 'bootstrap': True} because of the following error: StorageInternalError('An exception is raised during the commit. This typically happens due to invalid data in the commit, e.g. exceeding max length. ').
Traceback (most recent call last):
  File "/zhome/b1/0/88900/miniconda3/envs/critprops/lib/python3.9/site-packages/sqlalchemy/engine/base.py", line 1967, in _exec_single_context
    self.dialect.do_execute(
  File "/zhome/b1/0/88900/miniconda3/envs/critprops/lib/python3.9/site-packages/sqlalchemy/engine/default.py", line 941, in do_execute
    cursor.execute(statement, parameters)
sqlite3.OperationalError: database is locked

The above exception was the direct cause of the following exception:

Traceback (most recent call last):
  File "/zhome/b1/0/88900/miniconda3/envs/critprops/lib/python3.9/site-packages/optuna/storages/_rdb/storage.py", line 81, in _create_scoped_session
    session.commit()
  File "/zhome/b1/0/88900/miniconda3/envs/critprops/lib/python3.9/site-packages/sqlalchemy/orm/session.py", line 2028, in commit
    trans.commit(_to_root=True)
  File "<string>", line 2, in commit
  File "/zhome/b1/0/88900/miniconda3/envs/critprops/lib/python3.9/site-packages/sqlalchemy/orm/state_changes.py", line 139, in _go
    ret_value = fn(self, *arg, **kw)
  File "/zhome/b1/0/88900/miniconda3/envs/critprops/lib/python3.9/site-packages/sqlalchemy/orm/session.py", line 1313, in commit
    self._prepare_impl()
  File "<string>", line 2, in _prepare_impl
  File "/zhome/b1/0/88900/miniconda3/envs/critprops/lib/python3.9/site-packages/sqlalchemy/orm/state_changes.py", line 139, in _go
    ret_value = fn(self, *arg, **kw)
  File "/zhome/b1/0/88900/miniconda3/envs/critprops/lib/python3.9/site-packages/sqlalchemy/orm/session.py", line 1288, in _prepare_impl
    self.session.flush()
  File "/zhome/b1/0/88900/miniconda3/envs/critprops/lib/python3.9/site-packages/sqlalchemy/orm/session.py", line 4352, in flush
    self._flush(objects)
  File "/zhome/b1/0/88900/miniconda3/envs/critprops/lib/python3.9/site-packages/sqlalchemy/orm/session.py", line 4488, in _flush
    transaction.rollback(_capture_exception=True)
  File "/zhome/b1/0/88900/miniconda3/envs/critprops/lib/python3.9/site-packages/sqlalchemy/util/langhelpers.py", line 146, in __exit__
    raise exc_value.with_traceback(exc_tb)
  File "/zhome/b1/0/88900/miniconda3/envs/critprops/lib/python3.9/site-packages/sqlalchemy/orm/session.py", line 4448, in _flush
    flush_context.execute()
  File "/zhome/b1/0/88900/miniconda3/envs/critprops/lib/python3.9/site-packages/sqlalchemy/orm/unitofwork.py", line 466, in execute
    rec.execute(self)
  File "/zhome/b1/0/88900/miniconda3/envs/critprops/lib/python3.9/site-packages/sqlalchemy/orm/unitofwork.py", line 642, in execute
    util.preloaded.orm_persistence.save_obj(
  File "/zhome/b1/0/88900/miniconda3/envs/critprops/lib/python3.9/site-packages/sqlalchemy/orm/persistence.py", line 93, in save_obj
    _emit_insert_statements(
  File "/zhome/b1/0/88900/miniconda3/envs/critprops/lib/python3.9/site-packages/sqlalchemy/orm/persistence.py", line 1233, in _emit_insert_statements
    result = connection.execute(
  File "/zhome/b1/0/88900/miniconda3/envs/critprops/lib/python3.9/site-packages/sqlalchemy/engine/base.py", line 1418, in execute
    return meth(
  File "/zhome/b1/0/88900/miniconda3/envs/critprops/lib/python3.9/site-packages/sqlalchemy/sql/elements.py", line 515, in _execute_on_connection
    return connection._execute_clauseelement(
  File "/zhome/b1/0/88900/miniconda3/envs/critprops/lib/python3.9/site-packages/sqlalchemy/engine/base.py", line 1640, in _execute_clauseelement
    ret = self._execute_context(
  File "/zhome/b1/0/88900/miniconda3/envs/critprops/lib/python3.9/site-packages/sqlalchemy/engine/base.py", line 1846, in _execute_context
    return self._exec_single_context(
  File "/zhome/b1/0/88900/miniconda3/envs/critprops/lib/python3.9/site-packages/sqlalchemy/engine/base.py", line 1986, in _exec_single_context
    self._handle_dbapi_exception(
  File "/zhome/b1/0/88900/miniconda3/envs/critprops/lib/python3.9/site-packages/sqlalchemy/engine/base.py", line 2355, in _handle_dbapi_exception
    raise sqlalchemy_exception.with_traceback(exc_info[2]) from e
  File "/zhome/b1/0/88900/miniconda3/envs/critprops/lib/python3.9/site-packages/sqlalchemy/engine/base.py", line 1967, in _exec_single_context
    self.dialect.do_execute(
  File "/zhome/b1/0/88900/miniconda3/envs/critprops/lib/python3.9/site-packages/sqlalchemy/engine/default.py", line 941, in do_execute
    cursor.execute(statement, parameters)
sqlalchemy.exc.OperationalError: (sqlite3.OperationalError) database is locked
[SQL: INSERT INTO trial_params (trial_id, param_name, param_value, distribution_json) VALUES (?, ?, ?, ?)]
[parameters: (3, 'criterion', 1.0, '{"name": "CategoricalDistribution", "attributes": {"choices": ["squared_error", "absolute_error"]}}')]
(Background on this error at: https://sqlalche.me/e/20/e3q8)

The above exception was the direct cause of the following exception:

Traceback (most recent call last):
  File "/zhome/b1/0/88900/miniconda3/envs/critprops/lib/python3.9/site-packages/optuna/study/_optimize.py", line 197, in _run_trial
    value_or_values = func(trial)
  File "/zhome/b1/0/88900/Documents/fair_gc/src/optims.py", line 242, in objective
    params = {
  File "/zhome/b1/0/88900/Documents/fair_gc/src/optims.py", line 243, in <dictcomp>
    name: suggest_fn(trial, name)
  File "/zhome/b1/0/88900/Documents/fair_gc/src/optims.py", line 155, in <lambda>
    return lambda trial, name: trial.suggest_categorical(name, param_config['values'])
  File "/zhome/b1/0/88900/miniconda3/envs/critprops/lib/python3.9/site-packages/optuna/trial/_trial.py", line 402, in suggest_categorical
    return self._suggest(name, CategoricalDistribution(choices=choices))
  File "/zhome/b1/0/88900/miniconda3/envs/critprops/lib/python3.9/site-packages/optuna/trial/_trial.py", line 637, in _suggest
    storage.set_trial_param(trial_id, name, param_value_in_internal_repr, distribution)
  File "/zhome/b1/0/88900/miniconda3/envs/critprops/lib/python3.9/site-packages/optuna/storages/_cached_storage.py", line 171, in set_trial_param
    self._backend.set_trial_param(trial_id, param_name, param_value_internal, distribution)
  File "/zhome/b1/0/88900/miniconda3/envs/critprops/lib/python3.9/site-packages/optuna/storages/_rdb/storage.py", line 585, in set_trial_param
    self._set_trial_param_without_commit(
  File "/zhome/b1/0/88900/miniconda3/envs/critprops/lib/python3.9/contextlib.py", line 126, in __exit__
    next(self.gen)
  File "/zhome/b1/0/88900/miniconda3/envs/critprops/lib/python3.9/site-packages/optuna/storages/_rdb/storage.py", line 98, in _create_scoped_session
    raise optuna.exceptions.StorageInternalError(message) from e
optuna.exceptions.StorageInternalError: An exception is raised during the commit. This typically happens due to invalid data in the commit, e.g. exceeding max length. 
[W 2024-12-04 11:55:24,222] Trial 2 failed with value None.
[I 2024-12-04 11:55:24,975] Trial 26 finished with value: 0.7496090098569665 and parameters: {'n_estimators': 141, 'max_depth': 28, 'min_samples_split': 3, 'min_samples_leaf': 1, 'max_features': 'log2', 'bootstrap': True, 'criterion': 'absolute_error'}. Best is trial 12 with value: 0.6412015766563829.
[I 2024-12-04 11:55:24,978] Trial 28 finished with value: 0.9982684180867644 and parameters: {'n_estimators': 460, 'max_depth': 25, 'min_samples_split': 5, 'min_samples_leaf': 8, 'max_features': 'sqrt', 'bootstrap': True, 'criterion': 'absolute_error'}. Best is trial 12 with value: 0.6412015766563829.
[I 2024-12-04 11:55:24,994] Trial 21 finished with value: 0.6426154374867372 and parameters: {'n_estimators': 125, 'max_depth': 19, 'min_samples_split': 6, 'min_samples_leaf': 1, 'max_features': 'sqrt', 'bootstrap': False, 'criterion': 'squared_error'}. Best is trial 12 with value: 0.6412015766563829.
[I 2024-12-04 11:55:24,995] Trial 25 finished with value: 1.0551620237452322 and parameters: {'n_estimators': 600, 'max_depth': 21, 'min_samples_split': 20, 'min_samples_leaf': 9, 'max_features': 'log2', 'bootstrap': True, 'criterion': 'absolute_error'}. Best is trial 12 with value: 0.6412015766563829.
[I 2024-12-04 11:55:25,232] Trial 17 finished with value: 0.7302352498882597 and parameters: {'n_estimators': 773, 'max_depth': 15, 'min_samples_split': 18, 'min_samples_leaf': 1, 'max_features': 'sqrt', 'bootstrap': False, 'criterion': 'squared_error'}. Best is trial 12 with value: 0.6412015766563829.
[I 2024-12-04 11:55:25,287] Trial 11 finished with value: 0.9693271535307845 and parameters: {'n_estimators': 453, 'max_depth': 17, 'min_samples_split': 9, 'min_samples_leaf': 2, 'max_features': 'log2', 'bootstrap': True, 'criterion': 'absolute_error'}. Best is trial 12 with value: 0.6412015766563829.
[W 2024-12-04 11:55:25,324] Trial 13 failed with parameters: {'n_estimators': 471, 'max_depth': 36} because of the following error: StorageInternalError('An exception is raised during the commit. This typically happens due to invalid data in the commit, e.g. exceeding max length. ').
Traceback (most recent call last):
  File "/zhome/b1/0/88900/miniconda3/envs/critprops/lib/python3.9/site-packages/sqlalchemy/engine/base.py", line 1967, in _exec_single_context
    self.dialect.do_execute(
  File "/zhome/b1/0/88900/miniconda3/envs/critprops/lib/python3.9/site-packages/sqlalchemy/engine/default.py", line 941, in do_execute
    cursor.execute(statement, parameters)
sqlite3.OperationalError: database is locked

The above exception was the direct cause of the following exception:

Traceback (most recent call last):
  File "/zhome/b1/0/88900/miniconda3/envs/critprops/lib/python3.9/site-packages/optuna/storages/_rdb/storage.py", line 81, in _create_scoped_session
    session.commit()
  File "/zhome/b1/0/88900/miniconda3/envs/critprops/lib/python3.9/site-packages/sqlalchemy/orm/session.py", line 2028, in commit
    trans.commit(_to_root=True)
  File "<string>", line 2, in commit
  File "/zhome/b1/0/88900/miniconda3/envs/critprops/lib/python3.9/site-packages/sqlalchemy/orm/state_changes.py", line 139, in _go
    ret_value = fn(self, *arg, **kw)
  File "/zhome/b1/0/88900/miniconda3/envs/critprops/lib/python3.9/site-packages/sqlalchemy/orm/session.py", line 1313, in commit
    self._prepare_impl()
  File "<string>", line 2, in _prepare_impl
  File "/zhome/b1/0/88900/miniconda3/envs/critprops/lib/python3.9/site-packages/sqlalchemy/orm/state_changes.py", line 139, in _go
    ret_value = fn(self, *arg, **kw)
  File "/zhome/b1/0/88900/miniconda3/envs/critprops/lib/python3.9/site-packages/sqlalchemy/orm/session.py", line 1288, in _prepare_impl
    self.session.flush()
  File "/zhome/b1/0/88900/miniconda3/envs/critprops/lib/python3.9/site-packages/sqlalchemy/orm/session.py", line 4352, in flush
    self._flush(objects)
  File "/zhome/b1/0/88900/miniconda3/envs/critprops/lib/python3.9/site-packages/sqlalchemy/orm/session.py", line 4488, in _flush
    transaction.rollback(_capture_exception=True)
  File "/zhome/b1/0/88900/miniconda3/envs/critprops/lib/python3.9/site-packages/sqlalchemy/util/langhelpers.py", line 146, in __exit__
    raise exc_value.with_traceback(exc_tb)
  File "/zhome/b1/0/88900/miniconda3/envs/critprops/lib/python3.9/site-packages/sqlalchemy/orm/session.py", line 4448, in _flush
    flush_context.execute()
  File "/zhome/b1/0/88900/miniconda3/envs/critprops/lib/python3.9/site-packages/sqlalchemy/orm/unitofwork.py", line 466, in execute
    rec.execute(self)
  File "/zhome/b1/0/88900/miniconda3/envs/critprops/lib/python3.9/site-packages/sqlalchemy/orm/unitofwork.py", line 642, in execute
    util.preloaded.orm_persistence.save_obj(
  File "/zhome/b1/0/88900/miniconda3/envs/critprops/lib/python3.9/site-packages/sqlalchemy/orm/persistence.py", line 93, in save_obj
    _emit_insert_statements(
  File "/zhome/b1/0/88900/miniconda3/envs/critprops/lib/python3.9/site-packages/sqlalchemy/orm/persistence.py", line 1233, in _emit_insert_statements
    result = connection.execute(
  File "/zhome/b1/0/88900/miniconda3/envs/critprops/lib/python3.9/site-packages/sqlalchemy/engine/base.py", line 1418, in execute
    return meth(
  File "/zhome/b1/0/88900/miniconda3/envs/critprops/lib/python3.9/site-packages/sqlalchemy/sql/elements.py", line 515, in _execute_on_connection
    return connection._execute_clauseelement(
  File "/zhome/b1/0/88900/miniconda3/envs/critprops/lib/python3.9/site-packages/sqlalchemy/engine/base.py", line 1640, in _execute_clauseelement
    ret = self._execute_context(
  File "/zhome/b1/0/88900/miniconda3/envs/critprops/lib/python3.9/site-packages/sqlalchemy/engine/base.py", line 1846, in _execute_context
    return self._exec_single_context(
  File "/zhome/b1/0/88900/miniconda3/envs/critprops/lib/python3.9/site-packages/sqlalchemy/engine/base.py", line 1986, in _exec_single_context
    self._handle_dbapi_exception(
  File "/zhome/b1/0/88900/miniconda3/envs/critprops/lib/python3.9/site-packages/sqlalchemy/engine/base.py", line 2355, in _handle_dbapi_exception
    raise sqlalchemy_exception.with_traceback(exc_info[2]) from e
  File "/zhome/b1/0/88900/miniconda3/envs/critprops/lib/python3.9/site-packages/sqlalchemy/engine/base.py", line 1967, in _exec_single_context
    self.dialect.do_execute(
  File "/zhome/b1/0/88900/miniconda3/envs/critprops/lib/python3.9/site-packages/sqlalchemy/engine/default.py", line 941, in do_execute
    cursor.execute(statement, parameters)
sqlalchemy.exc.OperationalError: (sqlite3.OperationalError) database is locked
[SQL: INSERT INTO trial_params (trial_id, param_name, param_value, distribution_json) VALUES (?, ?, ?, ?)]
[parameters: (14, 'min_samples_split', 36.0, '{"name": "IntDistribution", "attributes": {"log": true, "step": 1, "low": 2, "high": 50}}')]
(Background on this error at: https://sqlalche.me/e/20/e3q8)

The above exception was the direct cause of the following exception:

Traceback (most recent call last):
  File "/zhome/b1/0/88900/miniconda3/envs/critprops/lib/python3.9/site-packages/optuna/study/_optimize.py", line 197, in _run_trial
    value_or_values = func(trial)
  File "/zhome/b1/0/88900/Documents/fair_gc/src/optims.py", line 242, in objective
    params = {
  File "/zhome/b1/0/88900/Documents/fair_gc/src/optims.py", line 243, in <dictcomp>
    name: suggest_fn(trial, name)
  File "/zhome/b1/0/88900/Documents/fair_gc/src/optims.py", line 164, in <lambda>
    return lambda trial, name: trial.suggest_int(
  File "/zhome/b1/0/88900/miniconda3/envs/critprops/lib/python3.9/site-packages/optuna/_convert_positional_args.py", line 83, in converter_wrapper
    return func(**kwargs)  # type: ignore[call-arg]
  File "/zhome/b1/0/88900/miniconda3/envs/critprops/lib/python3.9/site-packages/optuna/trial/_trial.py", line 324, in suggest_int
    suggested_value = int(self._suggest(name, distribution))
  File "/zhome/b1/0/88900/miniconda3/envs/critprops/lib/python3.9/site-packages/optuna/trial/_trial.py", line 637, in _suggest
    storage.set_trial_param(trial_id, name, param_value_in_internal_repr, distribution)
  File "/zhome/b1/0/88900/miniconda3/envs/critprops/lib/python3.9/site-packages/optuna/storages/_cached_storage.py", line 171, in set_trial_param
    self._backend.set_trial_param(trial_id, param_name, param_value_internal, distribution)
  File "/zhome/b1/0/88900/miniconda3/envs/critprops/lib/python3.9/site-packages/optuna/storages/_rdb/storage.py", line 585, in set_trial_param
    self._set_trial_param_without_commit(
  File "/zhome/b1/0/88900/miniconda3/envs/critprops/lib/python3.9/contextlib.py", line 126, in __exit__
    next(self.gen)
  File "/zhome/b1/0/88900/miniconda3/envs/critprops/lib/python3.9/site-packages/optuna/storages/_rdb/storage.py", line 98, in _create_scoped_session
    raise optuna.exceptions.StorageInternalError(message) from e
optuna.exceptions.StorageInternalError: An exception is raised during the commit. This typically happens due to invalid data in the commit, e.g. exceeding max length. 
[W 2024-12-04 11:55:25,381] Trial 13 failed with value None.
[I 2024-12-04 11:55:25,984] Trial 31 finished with value: 1.039772776979466 and parameters: {'n_estimators': 227, 'max_depth': 30, 'min_samples_split': 22, 'min_samples_leaf': 4, 'max_features': 'log2', 'bootstrap': True, 'criterion': 'absolute_error'}. Best is trial 12 with value: 0.6412015766563829.
[I 2024-12-04 11:55:26,231] Trial 10 finished with value: 0.9654415952350598 and parameters: {'n_estimators': 746, 'max_depth': 28, 'min_samples_split': 42, 'min_samples_leaf': 2, 'max_features': 'log2', 'bootstrap': True, 'criterion': 'squared_error'}. Best is trial 12 with value: 0.6412015766563829.
[I 2024-12-04 11:55:26,298] Trial 16 finished with value: 0.641408601664651 and parameters: {'n_estimators': 124, 'max_depth': 14, 'min_samples_split': 2, 'min_samples_leaf': 6, 'max_features': None, 'bootstrap': True, 'criterion': 'absolute_error'}. Best is trial 12 with value: 0.6412015766563829.
[I 2024-12-04 11:55:26,334] Trial 4 finished with value: 0.9996898816637833 and parameters: {'n_estimators': 869, 'max_depth': 33, 'min_samples_split': 5, 'min_samples_leaf': 14, 'max_features': 'sqrt', 'bootstrap': False, 'criterion': 'absolute_error'}. Best is trial 12 with value: 0.6412015766563829.
[I 2024-12-04 11:55:27,019] Trial 1 finished with value: 0.8161472512751943 and parameters: {'n_estimators': 431, 'max_depth': 19, 'min_samples_split': 3, 'min_samples_leaf': 1, 'max_features': 'log2', 'bootstrap': True, 'criterion': 'squared_error'}. Best is trial 12 with value: 0.6412015766563829.
[I 2024-12-04 11:55:27,496] Trial 20 finished with value: 0.9889894441925737 and parameters: {'n_estimators': 846, 'max_depth': 11, 'min_samples_split': 30, 'min_samples_leaf': 2, 'max_features': 'log2', 'bootstrap': True, 'criterion': 'squared_error'}. Best is trial 12 with value: 0.6412015766563829.
[I 2024-12-04 11:55:27,843] Trial 23 finished with value: 1.0579343569316708 and parameters: {'n_estimators': 722, 'max_depth': 11, 'min_samples_split': 32, 'min_samples_leaf': 11, 'max_features': 'log2', 'bootstrap': True, 'criterion': 'absolute_error'}. Best is trial 12 with value: 0.6412015766563829.
[I 2024-12-04 11:55:29,782] Trial 27 finished with value: 0.785910065775931 and parameters: {'n_estimators': 689, 'max_depth': 15, 'min_samples_split': 17, 'min_samples_leaf': 1, 'max_features': 'sqrt', 'bootstrap': True, 'criterion': 'absolute_error'}. Best is trial 12 with value: 0.6412015766563829.
[I 2024-12-04 11:55:30,179] Trial 9 finished with value: 0.5622105351247589 and parameters: {'n_estimators': 499, 'max_depth': 33, 'min_samples_split': 25, 'min_samples_leaf': 1, 'max_features': None, 'bootstrap': False, 'criterion': 'squared_error'}. Best is trial 9 with value: 0.5622105351247589.
[I 2024-12-04 11:55:30,194] Trial 8 finished with value: 0.959516399090677 and parameters: {'n_estimators': 839, 'max_depth': 46, 'min_samples_split': 15, 'min_samples_leaf': 2, 'max_features': 'log2', 'bootstrap': True, 'criterion': 'squared_error'}. Best is trial 9 with value: 0.5622105351247589.
[I 2024-12-04 11:55:30,229] Trial 3 finished with value: 0.9516105130833159 and parameters: {'n_estimators': 416, 'max_depth': 8, 'min_samples_split': 9, 'min_samples_leaf': 5, 'max_features': 'sqrt', 'bootstrap': True, 'criterion': 'absolute_error'}. Best is trial 9 with value: 0.5622105351247589.
[I 2024-12-04 11:55:30,730] Trial 19 finished with value: 0.4768285433645094 and parameters: {'n_estimators': 939, 'max_depth': 36, 'min_samples_split': 23, 'min_samples_leaf': 1, 'max_features': None, 'bootstrap': True, 'criterion': 'squared_error'}. Best is trial 19 with value: 0.4768285433645094.
