[I 2024-12-04 15:26:21,992] Trial 1860 finished with value: 0.134354378661956 and parameters: {'kernel_type': 'Matern', 'length_scale': 1.077777868862499, 'noise_level': 0.0007447174537185597, 'constant_value': 2949.735783287813, 'nu': 1.5}. Best is trial 1456 with value: 0.13435337537029549.
[I 2024-12-04 15:26:21,993] Trial 1848 finished with value: 0.1343542535526691 and parameters: {'kernel_type': 'Matern', 'length_scale': 2.525889896458649, 'noise_level': 0.0019847408524135512, 'constant_value': 623.736910273361, 'nu': 1.5}. Best is trial 1456 with value: 0.13435337537029549.
[I 2024-12-04 15:26:22,012] Trial 1862 finished with value: 0.14859826683614846 and parameters: {'kernel_type': 'Matern', 'length_scale': 33.254479708086286, 'noise_level': 0.008169668714172795, 'constant_value': 36533.857025921214, 'nu': 2.5}. Best is trial 1456 with value: 0.13435337537029549.
[I 2024-12-04 15:26:24,778] Trial 1865 finished with value: 0.13435438496294871 and parameters: {'kernel_type': 'Matern', 'length_scale': 0.740365772676101, 'noise_level': 0.03714633128102646, 'constant_value': 91665.20228663059, 'nu': 1.5}. Best is trial 1456 with value: 0.13435337537029549.
[I 2024-12-04 15:26:25,471] Trial 1861 finished with value: 0.13435440227152692 and parameters: {'kernel_type': 'Matern', 'length_scale': 41.555072985002845, 'noise_level': 0.000645702001602636, 'constant_value': 2813.8408963650277, 'nu': 1.5}. Best is trial 1456 with value: 0.13435337537029549.
[I 2024-12-04 15:26:26,009] Trial 1858 finished with value: 1.269363502857949 and parameters: {'kernel_type': 'Matern', 'length_scale': 0.021801751833568663, 'noise_level': 0.006468611025844781, 'constant_value': 1401.1666626523688, 'nu': 1.5}. Best is trial 1456 with value: 0.13435337537029549.
[I 2024-12-04 15:26:26,383] Trial 1852 finished with value: 0.13435440056248582 and parameters: {'kernel_type': 'Matern', 'length_scale': 2530.569518750606, 'noise_level': 0.7114973487810405, 'constant_value': 3.880607856169793, 'nu': 1.5}. Best is trial 1456 with value: 0.13435337537029549.
[I 2024-12-04 15:26:26,398] Trial 1867 finished with value: 1.2693635028563772 and parameters: {'kernel_type': 'Matern', 'length_scale': 0.0017447345497160413, 'noise_level': 0.456885750360463, 'constant_value': 63510.07219743246, 'nu': 1.5}. Best is trial 1456 with value: 0.13435337537029549.
[I 2024-12-04 15:26:26,399] Trial 1864 finished with value: 0.13435435468724755 and parameters: {'kernel_type': 'Matern', 'length_scale': 0.7780469492996838, 'noise_level': 0.0029280970439470263, 'constant_value': 2213.7753274669903, 'nu': 1.5}. Best is trial 1456 with value: 0.13435337537029549.
[I 2024-12-04 15:26:27,505] Trial 1859 finished with value: 0.13435440098133616 and parameters: {'kernel_type': 'Matern', 'length_scale': 960.0213215838575, 'noise_level': 0.0030449514586132135, 'constant_value': 2097.064967883916, 'nu': 1.5}. Best is trial 1456 with value: 0.13435337537029549.
[I 2024-12-04 15:26:28,664] Trial 1844 finished with value: 0.1343544010037583 and parameters: {'kernel_type': 'Matern', 'length_scale': 96253.9179402514, 'noise_level': 0.050040325857301775, 'constant_value': 57.11686216878305, 'nu': 1.5}. Best is trial 1456 with value: 0.13435337537029549.
[I 2024-12-04 15:26:29,728] Trial 1853 finished with value: 1.2693635028572998 and parameters: {'kernel_type': 'Matern', 'length_scale': 49325.74666981614, 'noise_level': 0.002248549608903786, 'constant_value': 20.45268170531953, 'nu': 1.5}. Best is trial 1456 with value: 0.13435337537029549.
[I 2024-12-04 15:26:30,115] Trial 1866 finished with value: 0.13435435414796112 and parameters: {'kernel_type': 'Matern', 'length_scale': 2.3557032454069695, 'noise_level': 0.005591975431008744, 'constant_value': 3377.415404070457, 'nu': 1.5}. Best is trial 1456 with value: 0.13435337537029549.
[I 2024-12-04 15:26:31,808] Trial 1872 finished with value: 0.13435440344292357 and parameters: {'kernel_type': 'Matern', 'length_scale': 16.753231565769962, 'noise_level': 0.002569944216777004, 'constant_value': 94646.70156434149, 'nu': 1.5}. Best is trial 1456 with value: 0.13435337537029549.
[I 2024-12-04 15:26:32,286] Trial 1868 finished with value: 0.134354418235509 and parameters: {'kernel_type': 'Matern', 'length_scale': 111.32564475911141, 'noise_level': 0.0005468335549659623, 'constant_value': 70659.25181682939, 'nu': 1.5}. Best is trial 1456 with value: 0.13435337537029549.
[I 2024-12-04 15:26:33,304] Trial 1869 finished with value: 1.2693635028596004 and parameters: {'kernel_type': 'Matern', 'length_scale': 0.011677498473612977, 'noise_level': 0.00041118385572758685, 'constant_value': 3139.711344600602, 'nu': 1.5}. Best is trial 1456 with value: 0.13435337537029549.
[I 2024-12-04 15:26:34,574] Trial 1871 finished with value: 0.13435437120789312 and parameters: {'kernel_type': 'Matern', 'length_scale': 11.11041623802055, 'noise_level': 0.007478454430681715, 'constant_value': 2417.806065308503, 'nu': 1.5}. Best is trial 1456 with value: 0.13435337537029549.
[I 2024-12-04 15:26:35,812] Trial 1874 finished with value: 0.1343542320059719 and parameters: {'kernel_type': 'Matern', 'length_scale': 589.5254250862491, 'noise_level': 0.0065301260952867314, 'constant_value': 1398.6886671149116, 'nu': 1.5}. Best is trial 1456 with value: 0.13435337537029549.
[I 2024-12-04 15:26:37,131] Trial 1878 finished with value: 0.13435437014778717 and parameters: {'kernel_type': 'Matern', 'length_scale': 2.3540409908363977, 'noise_level': 0.0022023289056713915, 'constant_value': 4136.639519044102, 'nu': 1.5}. Best is trial 1456 with value: 0.13435337537029549.
[I 2024-12-04 15:26:37,984] Trial 1877 finished with value: 1.300773912543337 and parameters: {'kernel_type': 'Matern', 'length_scale': 0.19079636426597305, 'noise_level': 0.0009132834970631356, 'constant_value': 58617.900953348755, 'nu': 1.5}. Best is trial 1456 with value: 0.13435337537029549.
[I 2024-12-04 15:26:41,387] Trial 1876 finished with value: 0.1343541568679994 and parameters: {'kernel_type': 'Matern', 'length_scale': 69.22410969105688, 'noise_level': 0.010628957963434294, 'constant_value': 2985.297851467244, 'nu': 1.5}. Best is trial 1456 with value: 0.13435337537029549.
[I 2024-12-04 15:26:41,397] Trial 1875 finished with value: 0.13435439711223776 and parameters: {'kernel_type': 'Matern', 'length_scale': 97.22191463002883, 'noise_level': 0.06014762536438609, 'constant_value': 92869.34401085123, 'nu': 1.5}. Best is trial 1456 with value: 0.13435337537029549.
[I 2024-12-04 15:26:43,327] Trial 1881 finished with value: 0.13435439120715847 and parameters: {'kernel_type': 'Matern', 'length_scale': 1.848068769375542, 'noise_level': 0.010921026895468654, 'constant_value': 77582.56554085622, 'nu': 1.5}. Best is trial 1456 with value: 0.13435337537029549.
[I 2024-12-04 15:26:43,360] Trial 1870 finished with value: 0.1343540312044315 and parameters: {'kernel_type': 'Matern', 'length_scale': 19.324189689975796, 'noise_level': 0.0015562846614656151, 'constant_value': 490.14872494212113, 'nu': 1.5}. Best is trial 1456 with value: 0.13435337537029549.
[I 2024-12-04 15:26:44,911] Trial 1886 finished with value: 0.1343543998555586 and parameters: {'kernel_type': 'Matern', 'length_scale': 1.5771720264287927, 'noise_level': 0.0014855926892178998, 'constant_value': 88085.70597196104, 'nu': 1.5}. Best is trial 1456 with value: 0.13435337537029549.
[I 2024-12-04 15:26:46,160] Trial 1880 finished with value: 0.13435444741403468 and parameters: {'kernel_type': 'Matern', 'length_scale': 0.4061244245408068, 'noise_level': 0.07310727786002033, 'constant_value': 1619.2098268068441, 'nu': 1.5}. Best is trial 1456 with value: 0.13435337537029549.
[I 2024-12-04 15:26:46,917] Trial 1879 finished with value: 0.13435479857019528 and parameters: {'kernel_type': 'Matern', 'length_scale': 82.54112169712428, 'noise_level': 0.0006026407003974474, 'constant_value': 94815.11976227762, 'nu': 1.5}. Best is trial 1456 with value: 0.13435337537029549.
[I 2024-12-04 15:26:48,628] Trial 1882 finished with value: 0.13435437185608834 and parameters: {'kernel_type': 'Matern', 'length_scale': 2.0982202631747686, 'noise_level': 0.014921877992336676, 'constant_value': 70696.098953347, 'nu': 1.5}. Best is trial 1456 with value: 0.13435337537029549.
[I 2024-12-04 15:26:48,899] Trial 1884 finished with value: 0.1343544146421958 and parameters: {'kernel_type': 'Matern', 'length_scale': 103.77575045779007, 'noise_level': 0.00024601613108787016, 'constant_value': 86.22544549691224, 'nu': 1.5}. Best is trial 1456 with value: 0.13435337537029549.
[I 2024-12-04 15:26:49,269] Trial 1883 finished with value: 0.13435439847773634 and parameters: {'kernel_type': 'Matern', 'length_scale': 1.1523498369177907, 'noise_level': 0.0018827060092058046, 'constant_value': 27.291854277252753, 'nu': 1.5}. Best is trial 1456 with value: 0.13435337537029549.
[I 2024-12-04 15:26:49,282] Trial 1890 finished with value: 0.15167297458328458 and parameters: {'kernel_type': 'RBF', 'length_scale': 9.723410148362685, 'noise_level': 0.05171004627981142, 'constant_value': 2.461900241958863, 'nu': 0.5}. Best is trial 1456 with value: 0.13435337537029549.
[I 2024-12-04 15:26:51,908] Trial 1891 finished with value: 0.1343543150974518 and parameters: {'kernel_type': 'Matern', 'length_scale': 4.726522191776567, 'noise_level': 0.0030139995212452196, 'constant_value': 98993.89395214964, 'nu': 1.5}. Best is trial 1456 with value: 0.13435337537029549.
[I 2024-12-04 15:26:53,991] Trial 1885 finished with value: 0.13435418391324389 and parameters: {'kernel_type': 'Matern', 'length_scale': 611.2042134048341, 'noise_level': 0.05300808038831277, 'constant_value': 247.65500322849104, 'nu': 1.5}. Best is trial 1456 with value: 0.13435337537029549.
[I 2024-12-04 15:26:56,312] Trial 1873 finished with value: 0.148598270360522 and parameters: {'kernel_type': 'Matern', 'length_scale': 544.9608219221767, 'noise_level': 0.16224562434810832, 'constant_value': 1.6247544060956634, 'nu': 2.5}. Best is trial 1456 with value: 0.13435337537029549.
[I 2024-12-04 15:27:00,241] Trial 1898 finished with value: 1.269363502854374 and parameters: {'kernel_type': 'Matern', 'length_scale': 307.45438070100715, 'noise_level': 3.913412838357993e-05, 'constant_value': 113.47370637444685, 'nu': 1.5}. Best is trial 1456 with value: 0.13435337537029549.
[I 2024-12-04 15:27:00,677] Trial 1893 finished with value: 0.15167297759055812 and parameters: {'kernel_type': 'RBF', 'length_scale': 132.11119663318294, 'noise_level': 0.39978099814067003, 'constant_value': 0.034137434339800425, 'nu': 1.5}. Best is trial 1456 with value: 0.13435337537029549.
[I 2024-12-04 15:27:01,438] Trial 1894 finished with value: 0.13435441969195833 and parameters: {'kernel_type': 'Matern', 'length_scale': 57.20183370453553, 'noise_level': 0.03768618945612361, 'constant_value': 1619.8667262641472, 'nu': 1.5}. Best is trial 1456 with value: 0.13435337537029549.
[I 2024-12-04 15:27:04,466] Trial 1899 finished with value: 0.13435439714807865 and parameters: {'kernel_type': 'Matern', 'length_scale': 0.3176274242630964, 'noise_level': 0.0006779853373155531, 'constant_value': 322.8253966190595, 'nu': 1.5}. Best is trial 1456 with value: 0.13435337537029549.
[I 2024-12-04 15:27:04,798] Trial 1889 finished with value: 0.13435440908520838 and parameters: {'kernel_type': 'Matern', 'length_scale': 88.33963160671368, 'noise_level': 0.0003563392075790407, 'constant_value': 54.80840505778088, 'nu': 1.5}. Best is trial 1456 with value: 0.13435337537029549.
[I 2024-12-04 15:27:04,937] Trial 1887 finished with value: 0.13435443434331865 and parameters: {'kernel_type': 'Matern', 'length_scale': 22514.761327301356, 'noise_level': 0.9578377739294867, 'constant_value': 55.10964976469492, 'nu': 1.5}. Best is trial 1456 with value: 0.13435337537029549.
[I 2024-12-04 15:27:04,959] Trial 1895 finished with value: 0.13435440382939912 and parameters: {'kernel_type': 'Matern', 'length_scale': 353.7987309604775, 'noise_level': 0.030569370502254993, 'constant_value': 557.8022698128028, 'nu': 1.5}. Best is trial 1456 with value: 0.13435337537029549.
[I 2024-12-04 15:27:05,647] Trial 1901 finished with value: 1.2693635028569712 and parameters: {'kernel_type': 'RBF', 'length_scale': 0.10667539495442735, 'noise_level': 0.054178028664862994, 'constant_value': 38233.31119167, 'nu': 1.5}. Best is trial 1456 with value: 0.13435337537029549.
[I 2024-12-04 15:27:07,135] Trial 1897 finished with value: 0.14859828725735913 and parameters: {'kernel_type': 'Matern', 'length_scale': 1.2013802520373988, 'noise_level': 0.008302195124653196, 'constant_value': 1788.5534269497932, 'nu': 2.5}. Best is trial 1456 with value: 0.13435337537029549.
[I 2024-12-04 15:27:08,467] Trial 1896 finished with value: 0.1343544076417585 and parameters: {'kernel_type': 'Matern', 'length_scale': 8.003600922838004, 'noise_level': 0.0016554786107429696, 'constant_value': 26.252190146707658, 'nu': 1.5}. Best is trial 1456 with value: 0.13435337537029549.
[I 2024-12-04 15:27:09,798] Trial 1892 finished with value: 0.13435422548849277 and parameters: {'kernel_type': 'Matern', 'length_scale': 7.828440211902231, 'noise_level': 0.0002528144462154747, 'constant_value': 1285.1211713912694, 'nu': 1.5}. Best is trial 1456 with value: 0.13435337537029549.
[I 2024-12-04 15:27:09,846] Trial 1907 finished with value: 1.3007739235931115 and parameters: {'kernel_type': 'RBF', 'length_scale': 1.788031067109942e-05, 'noise_level': 1.7199446077009154e-10, 'constant_value': 49246.100249972325, 'nu': 0.5}. Best is trial 1456 with value: 0.13435337537029549.
[I 2024-12-04 15:27:09,930] Trial 1902 finished with value: 0.1343543933703036 and parameters: {'kernel_type': 'Matern', 'length_scale': 27.762978592052516, 'noise_level': 0.00023729467718162738, 'constant_value': 611.5574929670016, 'nu': 1.5}. Best is trial 1456 with value: 0.13435337537029549.
[I 2024-12-04 15:27:10,550] Trial 1888 finished with value: 0.15167297879115127 and parameters: {'kernel_type': 'RBF', 'length_scale': 17.699480687606016, 'noise_level': 0.0004928528023337255, 'constant_value': 173.54856466154183, 'nu': 1.5}. Best is trial 1456 with value: 0.13435337537029549.
[I 2024-12-04 15:27:10,551] Trial 1900 finished with value: 1.2693635028569692 and parameters: {'kernel_type': 'RBF', 'length_scale': 0.007506779344780214, 'noise_level': 1.9293251219116166e-09, 'constant_value': 4.553460626333878e-07, 'nu': 0.5}. Best is trial 1456 with value: 0.13435337537029549.
[I 2024-12-04 15:27:10,820] Trial 1903 finished with value: 0.13435441646419333 and parameters: {'kernel_type': 'Matern', 'length_scale': 1.2883536902135295, 'noise_level': 0.0001731244784390648, 'constant_value': 8.394871368531753, 'nu': 1.5}. Best is trial 1456 with value: 0.13435337537029549.
[I 2024-12-04 15:27:11,085] Trial 1906 finished with value: 1.269363502856946 and parameters: {'kernel_type': 'RBF', 'length_scale': 298.87897875545934, 'noise_level': 0.007344390249965065, 'constant_value': 7.317811003470467e-05, 'nu': 0.5}. Best is trial 1456 with value: 0.13435337537029549.
[I 2024-12-04 15:27:11,287] Trial 1911 finished with value: 0.134354450268308 and parameters: {'kernel_type': 'Matern', 'length_scale': 79.19299927778437, 'noise_level': 7.44200405969721e-05, 'constant_value': 3740.5276997601723, 'nu': 1.5}. Best is trial 1456 with value: 0.13435337537029549.
[I 2024-12-04 15:27:11,294] Trial 1905 finished with value: 1.2693635028569736 and parameters: {'kernel_type': 'Matern', 'length_scale': 0.0005088368565829489, 'noise_level': 2.160341288222431e-10, 'constant_value': 2.0425105471737144e-05, 'nu': 2.5}. Best is trial 1456 with value: 0.13435337537029549.
[I 2024-12-04 15:27:11,673] Trial 1913 finished with value: 0.1343543924304845 and parameters: {'kernel_type': 'Matern', 'length_scale': 44.38573774782242, 'noise_level': 0.0003949603019585236, 'constant_value': 84.2683050013648, 'nu': 1.5}. Best is trial 1456 with value: 0.13435337537029549.
[I 2024-12-04 15:27:11,976] Trial 1908 finished with value: 0.13435439789773873 and parameters: {'kernel_type': 'Matern', 'length_scale': 14.607380031801663, 'noise_level': 0.0004590914956785198, 'constant_value': 75.99805588412505, 'nu': 1.5}. Best is trial 1456 with value: 0.13435337537029549.
[I 2024-12-04 15:27:14,033] Trial 1916 finished with value: 0.13435453377139242 and parameters: {'kernel_type': 'Matern', 'length_scale': 12.289679985457715, 'noise_level': 0.0014211988031520198, 'constant_value': 316.90800405119035, 'nu': 1.5}. Best is trial 1456 with value: 0.13435337537029549.
[I 2024-12-04 15:27:14,330] Trial 1904 finished with value: 0.1343544962647925 and parameters: {'kernel_type': 'Matern', 'length_scale': 7.172156817751918, 'noise_level': 0.0026300090486095374, 'constant_value': 50.18308401604933, 'nu': 1.5}. Best is trial 1456 with value: 0.13435337537029549.
[I 2024-12-04 15:27:15,147] Trial 1914 finished with value: 0.13435442382234766 and parameters: {'kernel_type': 'Matern', 'length_scale': 0.2970185433409737, 'noise_level': 0.0005580377949875585, 'constant_value': 81.05448927663693, 'nu': 1.5}. Best is trial 1456 with value: 0.13435337537029549.
[I 2024-12-04 15:27:15,408] Trial 1912 finished with value: 0.17251050543161878 and parameters: {'kernel_type': 'Matern', 'length_scale': 112.95447597751766, 'noise_level': 0.007873538428920792, 'constant_value': 2240.360321977902, 'nu': 0.5}. Best is trial 1456 with value: 0.13435337537029549.
[I 2024-12-04 15:27:16,039] Trial 1917 finished with value: 1.3007745979671212 and parameters: {'kernel_type': 'Matern', 'length_scale': 2.3738495302594678, 'noise_level': 2.3437158154770028e-06, 'constant_value': 85640.13657317973, 'nu': 2.5}. Best is trial 1456 with value: 0.13435337537029549.
[I 2024-12-04 15:27:17,046] Trial 1915 finished with value: 0.17251040265854903 and parameters: {'kernel_type': 'Matern', 'length_scale': 0.21289027773307853, 'noise_level': 0.004667747970605814, 'constant_value': 0.0006325096418008241, 'nu': 0.5}. Best is trial 1456 with value: 0.13435337537029549.
[I 2024-12-04 15:27:17,906] Trial 1909 finished with value: 0.13435439977242492 and parameters: {'kernel_type': 'Matern', 'length_scale': 31.607693590596675, 'noise_level': 0.022324305082059664, 'constant_value': 38.04668809708096, 'nu': 1.5}. Best is trial 1456 with value: 0.13435337537029549.
[I 2024-12-04 15:27:21,634] Trial 1920 finished with value: 0.13435425685227523 and parameters: {'kernel_type': 'Matern', 'length_scale': 2.6055055996413734, 'noise_level': 0.014250560698688, 'constant_value': 417.53897382475026, 'nu': 1.5}. Best is trial 1456 with value: 0.13435337537029549.
[I 2024-12-04 15:27:22,605] Trial 1918 finished with value: 0.13435449472313207 and parameters: {'kernel_type': 'Matern', 'length_scale': 5.214424450604007, 'noise_level': 0.0035344578318719146, 'constant_value': 182.18712526085537, 'nu': 1.5}. Best is trial 1456 with value: 0.13435337537029549.
[I 2024-12-04 15:27:24,867] Trial 1910 finished with value: 1.2693635028569932 and parameters: {'kernel_type': 'RBF', 'length_scale': 0.01604215301267774, 'noise_level': 5.6397069687844094e-05, 'constant_value': 22.52475155723934, 'nu': 2.5}. Best is trial 1456 with value: 0.13435337537029549.
[I 2024-12-04 15:27:29,210] Trial 1925 finished with value: 0.13435440231066678 and parameters: {'kernel_type': 'Matern', 'length_scale': 104.03525992135951, 'noise_level': 0.9241479462559565, 'constant_value': 0.9108097486093397, 'nu': 1.5}. Best is trial 1456 with value: 0.13435337537029549.
[I 2024-12-04 15:27:29,291] Trial 1919 finished with value: 0.13435440103954796 and parameters: {'kernel_type': 'Matern', 'length_scale': 20.580966772264198, 'noise_level': 9.427316683555752e-06, 'constant_value': 3544.8733714412892, 'nu': 1.5}. Best is trial 1456 with value: 0.13435337537029549.
[I 2024-12-04 15:27:33,070] Trial 1926 finished with value: 1.2693635026911698 and parameters: {'kernel_type': 'Matern', 'length_scale': 0.08093049740987761, 'noise_level': 0.004701741219749865, 'constant_value': 23231.508071708762, 'nu': 2.5}. Best is trial 1456 with value: 0.13435337537029549.
[I 2024-12-04 15:27:33,955] Trial 1923 finished with value: 0.134354396091907 and parameters: {'kernel_type': 'Matern', 'length_scale': 92.32302321766443, 'noise_level': 0.001884970247594498, 'constant_value': 1099.4401835825574, 'nu': 1.5}. Best is trial 1456 with value: 0.13435337537029549.
[I 2024-12-04 15:27:34,047] Trial 1927 finished with value: 1.2693635028661197 and parameters: {'kernel_type': 'RBF', 'length_scale': 851.5746021593174, 'noise_level': 0.000517536313381353, 'constant_value': 65.55537575325994, 'nu': 1.5}. Best is trial 1456 with value: 0.13435337537029549.
[I 2024-12-04 15:27:36,657] Trial 1931 finished with value: 0.1343544162393013 and parameters: {'kernel_type': 'Matern', 'length_scale': 0.5412833051681548, 'noise_level': 0.00014416567064935273, 'constant_value': 2478.6067357093157, 'nu': 1.5}. Best is trial 1456 with value: 0.13435337537029549.
[I 2024-12-04 15:27:36,962] Trial 1922 finished with value: 0.1343544992484698 and parameters: {'kernel_type': 'Matern', 'length_scale': 273.2431720048156, 'noise_level': 0.0027227116392934967, 'constant_value': 2368.096699994061, 'nu': 1.5}. Best is trial 1456 with value: 0.13435337537029549.
[I 2024-12-04 15:27:38,348] Trial 1940 finished with value: 0.1485982889802234 and parameters: {'kernel_type': 'Matern', 'length_scale': 7.369074709907907, 'noise_level': 0.0003650276704957198, 'constant_value': 98.06956870803278, 'nu': 2.5}. Best is trial 1456 with value: 0.13435337537029549.
[I 2024-12-04 15:27:38,367] Trial 1929 finished with value: 0.13435439982448508 and parameters: {'kernel_type': 'Matern', 'length_scale': 4.798386364679358, 'noise_level': 0.00016365854914275938, 'constant_value': 2720.106716561873, 'nu': 1.5}. Best is trial 1456 with value: 0.13435337537029549.
