[I 2024-12-03 19:14:21,720] Trial 1957 finished with value: 0.7764112818830468 and parameters: {'kernel': 'poly', 'C': 35.60703171075876, 'gamma': 0.0007858241238904532, 'epsilon': 0.008049779961486848}. Best is trial 345 with value: 0.13438257115663557.
[I 2024-12-03 19:14:22,327] Trial 1917 finished with value: 0.13483553941590287 and parameters: {'kernel': 'linear', 'C': 42.634676297255076, 'gamma': 0.0008820738850916745, 'epsilon': 0.04040552086550927}. Best is trial 345 with value: 0.13438257115663557.
[I 2024-12-03 19:14:23,346] Trial 1934 finished with value: 0.13639182963518895 and parameters: {'kernel': 'linear', 'C': 19.82564136891588, 'gamma': 0.0019061489620496462, 'epsilon': 0.025326790779512276}. Best is trial 345 with value: 0.13438257115663557.
[I 2024-12-03 19:14:23,348] Trial 1814 finished with value: 0.137251571521513 and parameters: {'kernel': 'linear', 'C': 98.85600669481991, 'gamma': 0.0011057757915532533, 'epsilon': 0.01843448432155871}. Best is trial 345 with value: 0.13438257115663557.
[I 2024-12-03 19:14:24,774] Trial 1961 finished with value: 0.18683869861453348 and parameters: {'kernel': 'rbf', 'C': 23.093846877334673, 'gamma': 0.001743359408530164, 'epsilon': 0.016679810777573426}. Best is trial 345 with value: 0.13438257115663557.
[I 2024-12-03 19:14:25,447] Trial 1962 finished with value: 0.13665460622001757 and parameters: {'kernel': 'linear', 'C': 3.498519146954897, 'gamma': 0.002173962611187575, 'epsilon': 0.06092537047675103}. Best is trial 345 with value: 0.13438257115663557.
[I 2024-12-03 19:14:25,449] Trial 1817 finished with value: 0.13824320483463845 and parameters: {'kernel': 'linear', 'C': 86.5128717433756, 'gamma': 0.0034699864603391327, 'epsilon': 0.007108157604033016}. Best is trial 345 with value: 0.13438257115663557.
[I 2024-12-03 19:14:25,721] Trial 1958 finished with value: 0.13647058912234558 and parameters: {'kernel': 'linear', 'C': 20.50211955826961, 'gamma': 0.0024192739869710496, 'epsilon': 0.07531744816663428}. Best is trial 345 with value: 0.13438257115663557.
[I 2024-12-03 19:14:27,734] Trial 1967 finished with value: 0.4120238083721951 and parameters: {'kernel': 'poly', 'C': 0.0020032701592333038, 'gamma': 0.19215051860101187, 'epsilon': 0.008192928241435098}. Best is trial 345 with value: 0.13438257115663557.
[I 2024-12-03 19:14:29,103] Trial 1949 finished with value: 0.13615489236964443 and parameters: {'kernel': 'linear', 'C': 30.69387028432325, 'gamma': 0.0011697457238583119, 'epsilon': 0.05157553991848565}. Best is trial 345 with value: 0.13438257115663557.
[I 2024-12-03 19:14:29,473] Trial 1970 finished with value: 40.19904688663948 and parameters: {'kernel': 'sigmoid', 'C': 2.438787818073559, 'gamma': 0.047621884947006435, 'epsilon': 0.001227329850117933}. Best is trial 345 with value: 0.13438257115663557.
[I 2024-12-03 19:14:29,728] Trial 1971 finished with value: 47.6029152520799 and parameters: {'kernel': 'sigmoid', 'C': 2.146772718902009, 'gamma': 0.5469834399921136, 'epsilon': 0.9870453608099984}. Best is trial 345 with value: 0.13438257115663557.
[I 2024-12-03 19:14:30,019] Trial 1972 finished with value: 0.8577899484589334 and parameters: {'kernel': 'poly', 'C': 12.48602923473719, 'gamma': 0.004647391656159163, 'epsilon': 0.03751559133527717}. Best is trial 345 with value: 0.13438257115663557.
[I 2024-12-03 19:14:30,546] Trial 1943 finished with value: 0.13517466738154627 and parameters: {'kernel': 'linear', 'C': 26.30626807245028, 'gamma': 0.0005079875057926754, 'epsilon': 0.029362696840726493}. Best is trial 345 with value: 0.13438257115663557.
[I 2024-12-03 19:14:31,611] Trial 1973 finished with value: 0.140863954518984 and parameters: {'kernel': 'linear', 'C': 1.0669973989272412, 'gamma': 0.022509141899705806, 'epsilon': 0.02934760009228333}. Best is trial 345 with value: 0.13438257115663557.
[I 2024-12-03 19:14:32,173] Trial 1952 finished with value: 0.13829070945552996 and parameters: {'kernel': 'linear', 'C': 11.109183747987009, 'gamma': 0.0023992621894805962, 'epsilon': 0.009121874076489327}. Best is trial 345 with value: 0.13438257115663557.
[I 2024-12-03 19:14:32,858] Trial 1976 finished with value: 0.25845671266462505 and parameters: {'kernel': 'rbf', 'C': 20.933212577959594, 'gamma': 0.0005531828042628421, 'epsilon': 0.0956310412648165}. Best is trial 345 with value: 0.13438257115663557.
[I 2024-12-03 19:14:33,026] Trial 1947 finished with value: 0.1383810784628554 and parameters: {'kernel': 'linear', 'C': 14.180409544805839, 'gamma': 0.0004913679627594692, 'epsilon': 0.008778579100461842}. Best is trial 345 with value: 0.13438257115663557.
[I 2024-12-03 19:14:33,753] Trial 1978 finished with value: 0.16695451972153813 and parameters: {'kernel': 'rbf', 'C': 33.76782759270971, 'gamma': 0.005242307745436908, 'epsilon': 0.03777789742829283}. Best is trial 345 with value: 0.13438257115663557.
[I 2024-12-03 19:14:33,755] Trial 1977 finished with value: 0.19252421932954716 and parameters: {'kernel': 'linear', 'C': 30.274481189649528, 'gamma': 0.02576268521535129, 'epsilon': 0.24452452037307873}. Best is trial 345 with value: 0.13438257115663557.
[I 2024-12-03 19:14:34,358] Trial 1975 finished with value: 0.14014779171149142 and parameters: {'kernel': 'linear', 'C': 3.3612711015177448, 'gamma': 0.006946186055895125, 'epsilon': 0.07313431920072713}. Best is trial 345 with value: 0.13438257115663557.
[I 2024-12-03 19:14:40,994] Trial 1837 finished with value: 0.1357357597202425 and parameters: {'kernel': 'linear', 'C': 99.37426298888948, 'gamma': 0.020014388210409427, 'epsilon': 0.034474519219845574}. Best is trial 345 with value: 0.13438257115663557.
[I 2024-12-03 19:14:41,686] Trial 1899 finished with value: 0.13803095253409337 and parameters: {'kernel': 'linear', 'C': 80.61088272135422, 'gamma': 0.005661255197139062, 'epsilon': 0.01769433530095441}. Best is trial 345 with value: 0.13438257115663557.
[I 2024-12-03 19:14:42,674] Trial 1979 finished with value: 0.13660829873567276 and parameters: {'kernel': 'linear', 'C': 13.553703428648179, 'gamma': 0.006285859907658448, 'epsilon': 0.04384037566326563}. Best is trial 345 with value: 0.13438257115663557.
[I 2024-12-03 19:14:45,627] Trial 1983 finished with value: 0.1355311080628179 and parameters: {'kernel': 'linear', 'C': 12.973666373819304, 'gamma': 0.010791358512075267, 'epsilon': 0.05914262236546682}. Best is trial 345 with value: 0.13438257115663557.
[I 2024-12-03 19:14:46,408] Trial 1987 finished with value: 0.13705414434333407 and parameters: {'kernel': 'linear', 'C': 2.694481953443059, 'gamma': 0.02874892629454029, 'epsilon': 0.03154475922509674}. Best is trial 345 with value: 0.13438257115663557.
[I 2024-12-03 19:14:46,510] Trial 1984 finished with value: 0.13701751881490465 and parameters: {'kernel': 'linear', 'C': 5.906303933944999, 'gamma': 0.0023281488247347136, 'epsilon': 0.021669981322594855}. Best is trial 345 with value: 0.13438257115663557.
[I 2024-12-03 19:14:47,621] Trial 1966 finished with value: 0.13712432151922965 and parameters: {'kernel': 'linear', 'C': 22.833592386270265, 'gamma': 0.002451240116388208, 'epsilon': 0.04773447491360824}. Best is trial 345 with value: 0.13438257115663557.
[I 2024-12-03 19:14:48,493] Trial 1988 finished with value: 0.15506033449067277 and parameters: {'kernel': 'linear', 'C': 10.696087169913783, 'gamma': 0.12136970116097902, 'epsilon': 0.16263408361927584}. Best is trial 345 with value: 0.13438257115663557.
[I 2024-12-03 19:14:48,995] Trial 1989 finished with value: 3.4596314299245785 and parameters: {'kernel': 'sigmoid', 'C': 0.1370355107099656, 'gamma': 0.32189847925736637, 'epsilon': 0.0013224055161234357}. Best is trial 345 with value: 0.13438257115663557.
[I 2024-12-03 19:14:51,307] Trial 1959 finished with value: 0.1356382926689344 and parameters: {'kernel': 'linear', 'C': 27.406989710005497, 'gamma': 0.004122945926692882, 'epsilon': 0.03681352779515414}. Best is trial 345 with value: 0.13438257115663557.
[I 2024-12-03 19:14:52,771] Trial 1938 finished with value: 0.13524451196550702 and parameters: {'kernel': 'linear', 'C': 74.57617256519512, 'gamma': 0.17038530175600727, 'epsilon': 0.04071550913260151}. Best is trial 345 with value: 0.13438257115663557.
[I 2024-12-03 19:14:52,771] Trial 1994 finished with value: 0.455660119981859 and parameters: {'kernel': 'rbf', 'C': 9.906222424059962, 'gamma': 0.08841873142721207, 'epsilon': 0.0015686697617205245}. Best is trial 345 with value: 0.13438257115663557.
[I 2024-12-03 19:14:53,912] Trial 1982 finished with value: 0.13497770094866632 and parameters: {'kernel': 'linear', 'C': 21.40325357691835, 'gamma': 0.014775588371682304, 'epsilon': 0.057087573781806206}. Best is trial 345 with value: 0.13438257115663557.
[I 2024-12-03 19:14:54,444] Trial 1903 finished with value: 0.13752723632760402 and parameters: {'kernel': 'linear', 'C': 94.83657502808136, 'gamma': 0.0032765807467454023, 'epsilon': 0.020407584278840197}. Best is trial 345 with value: 0.13438257115663557.
[I 2024-12-03 19:14:54,795] Trial 1965 finished with value: 0.13573388557853286 and parameters: {'kernel': 'linear', 'C': 18.544848042891413, 'gamma': 0.0062028926637127, 'epsilon': 0.02679175776435255}. Best is trial 345 with value: 0.13438257115663557.
[I 2024-12-03 19:14:56,128] Trial 1998 finished with value: 1.3566282181298412 and parameters: {'kernel': 'rbf', 'C': 0.00129151565458344, 'gamma': 0.0007619092483948916, 'epsilon': 0.018495017039912742}. Best is trial 345 with value: 0.13438257115663557.
[I 2024-12-03 19:14:56,674] Trial 1999 finished with value: 32.824743017746904 and parameters: {'kernel': 'sigmoid', 'C': 14.061638686181858, 'gamma': 0.005759602877091285, 'epsilon': 0.1228164602149803}. Best is trial 345 with value: 0.13438257115663557.
[I 2024-12-03 19:14:59,033] Trial 1992 finished with value: 0.1465489002730579 and parameters: {'kernel': 'linear', 'C': 35.08278244206712, 'gamma': 0.0012776525974514082, 'epsilon': 0.12623349001088804}. Best is trial 345 with value: 0.13438257115663557.
[I 2024-12-03 19:15:00,559] Trial 2002 finished with value: 1.0612401324960383 and parameters: {'kernel': 'poly', 'C': 22.226256023920595, 'gamma': 0.0012486364370424886, 'epsilon': 0.10541334422796955}. Best is trial 345 with value: 0.13438257115663557.
[I 2024-12-03 19:15:01,152] Trial 1996 finished with value: 0.13694952314482342 and parameters: {'kernel': 'linear', 'C': 21.2807525405422, 'gamma': 0.007793830263276186, 'epsilon': 0.07690158933619731}. Best is trial 345 with value: 0.13438257115663557.
[I 2024-12-03 19:15:01,613] Trial 1997 finished with value: 0.136008924354277 and parameters: {'kernel': 'linear', 'C': 5.019499316807805, 'gamma': 0.0005980490801907997, 'epsilon': 0.02957617572935528}. Best is trial 345 with value: 0.13438257115663557.
[I 2024-12-03 19:15:02,410] Trial 2000 finished with value: 0.13670663954308745 and parameters: {'kernel': 'linear', 'C': 21.757361494830537, 'gamma': 0.009067699871909056, 'epsilon': 0.07626597064882637}. Best is trial 345 with value: 0.13438257115663557.
[I 2024-12-03 19:15:02,930] Trial 1986 finished with value: 0.13653597319874064 and parameters: {'kernel': 'linear', 'C': 24.658858356336456, 'gamma': 0.0004573389331125384, 'epsilon': 0.04396556253244521}. Best is trial 345 with value: 0.13438257115663557.
[I 2024-12-03 19:15:03,056] Trial 2004 finished with value: 1.1510761447937667 and parameters: {'kernel': 'sigmoid', 'C': 0.02083539679336978, 'gamma': 0.004824295614348786, 'epsilon': 0.10705810063150281}. Best is trial 345 with value: 0.13438257115663557.
[I 2024-12-03 19:15:04,124] Trial 1963 finished with value: 0.13787688829306638 and parameters: {'kernel': 'linear', 'C': 29.26487007592617, 'gamma': 0.0023398550135325944, 'epsilon': 0.013110061524609681}. Best is trial 345 with value: 0.13438257115663557.
[I 2024-12-03 19:15:05,581] Trial 1981 finished with value: 0.1355763908019524 and parameters: {'kernel': 'linear', 'C': 24.197039790800233, 'gamma': 0.0016732287948407435, 'epsilon': 0.037445028085608824}. Best is trial 345 with value: 0.13438257115663557.
[I 2024-12-03 19:15:06,775] Trial 1990 finished with value: 0.13775763993014334 and parameters: {'kernel': 'linear', 'C': 18.5514959084647, 'gamma': 0.0047647613209377045, 'epsilon': 0.01756055899104725}. Best is trial 345 with value: 0.13438257115663557.
[I 2024-12-03 19:15:07,993] Trial 2010 finished with value: 0.14307430232347454 and parameters: {'kernel': 'linear', 'C': 6.298177117297283, 'gamma': 0.0009779329615500082, 'epsilon': 0.10728467698213603}. Best is trial 345 with value: 0.13438257115663557.
[I 2024-12-03 19:15:10,648] Trial 2001 finished with value: 0.1379995551184848 and parameters: {'kernel': 'linear', 'C': 10.881237275787141, 'gamma': 0.0005057403299980131, 'epsilon': 0.01471833065627606}. Best is trial 345 with value: 0.13438257115663557.
[I 2024-12-03 19:15:10,695] Trial 2011 finished with value: 0.13649940437858482 and parameters: {'kernel': 'linear', 'C': 8.259516043426313, 'gamma': 0.003352896966735451, 'epsilon': 0.0729657439616122}. Best is trial 345 with value: 0.13438257115663557.
[I 2024-12-03 19:15:12,444] Trial 2013 finished with value: 0.30012903286172593 and parameters: {'kernel': 'rbf', 'C': 8.224617625827952, 'gamma': 0.03060180934814469, 'epsilon': 0.10138156578193447}. Best is trial 345 with value: 0.13438257115663557.
[I 2024-12-03 19:15:12,952] Trial 2008 finished with value: 0.13450475131155715 and parameters: {'kernel': 'linear', 'C': 13.04967919749052, 'gamma': 0.07953468589047646, 'epsilon': 0.06269103821760885}. Best is trial 345 with value: 0.13438257115663557.
[I 2024-12-03 19:15:13,873] Trial 1964 finished with value: 0.13513873335993185 and parameters: {'kernel': 'linear', 'C': 95.94651588293333, 'gamma': 0.011590763005872057, 'epsilon': 0.06388970476437031}. Best is trial 345 with value: 0.13438257115663557.
[I 2024-12-03 19:15:14,400] Trial 1960 finished with value: 0.13623074292896023 and parameters: {'kernel': 'linear', 'C': 96.57178148106487, 'gamma': 0.0044335628288165434, 'epsilon': 0.07009948993376683}. Best is trial 345 with value: 0.13438257115663557.
[I 2024-12-03 19:15:15,303] Trial 2012 finished with value: 0.13850075253389166 and parameters: {'kernel': 'linear', 'C': 5.723790692481055, 'gamma': 0.007068659673481935, 'epsilon': 0.013848892511321332}. Best is trial 345 with value: 0.13438257115663557.
[I 2024-12-03 19:15:15,304] Trial 1862 finished with value: 0.1356441486305592 and parameters: {'kernel': 'linear', 'C': 99.21747068054687, 'gamma': 0.0016086923421147915, 'epsilon': 0.026725914344913244}. Best is trial 345 with value: 0.13438257115663557.
[I 2024-12-03 19:15:16,442] Trial 2017 finished with value: 0.14414545095483372 and parameters: {'kernel': 'linear', 'C': 5.494194073413669, 'gamma': 0.13446285939856112, 'epsilon': 0.09379667589290357}. Best is trial 345 with value: 0.13438257115663557.
[I 2024-12-03 19:15:17,097] Trial 2015 finished with value: 0.1416545812841911 and parameters: {'kernel': 'linear', 'C': 10.041393460993842, 'gamma': 0.23519891518268135, 'epsilon': 0.09572863646414155}. Best is trial 345 with value: 0.13438257115663557.
[I 2024-12-03 19:15:18,868] Trial 2018 finished with value: 0.13667805209646186 and parameters: {'kernel': 'linear', 'C': 2.8783560394296432, 'gamma': 0.1537209013149572, 'epsilon': 0.027684954818079647}. Best is trial 345 with value: 0.13438257115663557.
[I 2024-12-03 19:15:20,790] Trial 2023 finished with value: 0.15185987448992336 and parameters: {'kernel': 'linear', 'C': 11.292683027378386, 'gamma': 0.036011405409232054, 'epsilon': 0.14690586375078502}. Best is trial 345 with value: 0.13438257115663557.
[I 2024-12-03 19:15:22,372] Trial 2024 finished with value: 0.15885664979147887 and parameters: {'kernel': 'linear', 'C': 1.3212185165161356, 'gamma': 0.0592012362249457, 'epsilon': 0.11270239321012904}. Best is trial 345 with value: 0.13438257115663557.
[I 2024-12-03 19:15:22,793] Trial 1991 finished with value: 0.13837886323457918 and parameters: {'kernel': 'linear', 'C': 27.178333896690507, 'gamma': 0.004627011846205669, 'epsilon': 0.010036745778718645}. Best is trial 345 with value: 0.13438257115663557.
[I 2024-12-03 19:15:23,695] Trial 2016 finished with value: 0.136328397979137 and parameters: {'kernel': 'linear', 'C': 7.3085290036265365, 'gamma': 0.018299974678887033, 'epsilon': 0.02720392097642905}. Best is trial 345 with value: 0.13438257115663557.
[I 2024-12-03 19:15:23,956] Trial 1993 finished with value: 0.13615369105748548 and parameters: {'kernel': 'linear', 'C': 17.516279265737168, 'gamma': 0.007778677706993232, 'epsilon': 0.02588786235145282}. Best is trial 345 with value: 0.13438257115663557.
[I 2024-12-03 19:15:24,208] Trial 2025 finished with value: 0.17879158943003576 and parameters: {'kernel': 'linear', 'C': 0.7462556434727112, 'gamma': 0.12170261541906599, 'epsilon': 0.15231391532603522}. Best is trial 345 with value: 0.13438257115663557.
[I 2024-12-03 19:15:24,774] Trial 2005 finished with value: 0.13500753732195497 and parameters: {'kernel': 'linear', 'C': 26.58957951442673, 'gamma': 0.0014564098771163456, 'epsilon': 0.0392461451592785}. Best is trial 345 with value: 0.13438257115663557.
[I 2024-12-03 19:15:25,929] Trial 1946 finished with value: 0.13477558640801254 and parameters: {'kernel': 'linear', 'C': 91.46896204013335, 'gamma': 0.00046507648490577843, 'epsilon': 0.030662883971466468}. Best is trial 345 with value: 0.13438257115663557.
[I 2024-12-03 19:15:26,353] Trial 2027 finished with value: 0.14289859496880752 and parameters: {'kernel': 'linear', 'C': 3.569115816235086, 'gamma': 0.036680074076827406, 'epsilon': 0.08229449341936411}. Best is trial 345 with value: 0.13438257115663557.
[I 2024-12-03 19:15:27,404] Trial 2022 finished with value: 0.1348428997183655 and parameters: {'kernel': 'linear', 'C': 8.94762641645277, 'gamma': 0.1089440519861516, 'epsilon': 0.040793825610198}. Best is trial 345 with value: 0.13438257115663557.
[I 2024-12-03 19:15:27,509] Trial 2028 finished with value: 0.20375778404696201 and parameters: {'kernel': 'linear', 'C': 20.573101689933306, 'gamma': 0.051186563311291115, 'epsilon': 0.26138772423973616}. Best is trial 345 with value: 0.13438257115663557.
[I 2024-12-03 19:15:27,971] Trial 1930 finished with value: 0.3249796012631761 and parameters: {'kernel': 'poly', 'C': 74.68964179649525, 'gamma': 0.04816578225869702, 'epsilon': 0.02602303996387524}. Best is trial 345 with value: 0.13438257115663557.
[I 2024-12-03 19:15:29,861] Trial 2026 finished with value: 0.14085881539712183 and parameters: {'kernel': 'linear', 'C': 25.78724308020691, 'gamma': 0.6390172542208014, 'epsilon': 0.0913064885756303}. Best is trial 345 with value: 0.13438257115663557.
[I 2024-12-03 19:15:30,076] Trial 2029 finished with value: 0.1504118485013702 and parameters: {'kernel': 'linear', 'C': 62.577755469807755, 'gamma': 0.15431816076105076, 'epsilon': 0.14460942124867282}. Best is trial 345 with value: 0.13438257115663557.
[I 2024-12-03 19:15:30,796] Trial 1941 finished with value: 0.1351485321947633 and parameters: {'kernel': 'linear', 'C': 89.22862701379039, 'gamma': 0.0007268874600438757, 'epsilon': 0.05949608515855666}. Best is trial 345 with value: 0.13438257115663557.
[I 2024-12-03 19:15:30,881] Trial 2033 finished with value: 0.2523050879827055 and parameters: {'kernel': 'linear', 'C': 13.42209946889985, 'gamma': 0.2466757367129343, 'epsilon': 0.369993350463118}. Best is trial 345 with value: 0.13438257115663557.
[I 2024-12-03 19:15:32,455] Trial 2037 finished with value: 0.2288518957517273 and parameters: {'kernel': 'linear', 'C': 2.3224738959034155, 'gamma': 0.010992866785102065, 'epsilon': 0.2843172981024085}. Best is trial 345 with value: 0.13438257115663557.
[I 2024-12-03 19:15:32,478] Trial 2036 finished with value: 0.4225582499327629 and parameters: {'kernel': 'linear', 'C': 0.0018232334922714162, 'gamma': 0.002407859771165864, 'epsilon': 0.0015979313417157708}. Best is trial 345 with value: 0.13438257115663557.
[I 2024-12-03 19:15:32,777] Trial 2014 finished with value: 0.1370145809275228 and parameters: {'kernel': 'linear', 'C': 19.77392366793168, 'gamma': 0.0015832896547361486, 'epsilon': 0.04616586171968621}. Best is trial 345 with value: 0.13438257115663557.
[I 2024-12-03 19:15:33,701] Trial 2039 finished with value: 1.3148364315986734 and parameters: {'kernel': 'poly', 'C': 37.737982975050826, 'gamma': 0.00023564426718856925, 'epsilon': 0.015842750825885273}. Best is trial 345 with value: 0.13438257115663557.
[I 2024-12-03 19:15:34,123] Trial 1985 finished with value: 0.13509753236676744 and parameters: {'kernel': 'linear', 'C': 96.02220003969519, 'gamma': 0.0026814373602114076, 'epsilon': 0.055388194487993724}. Best is trial 345 with value: 0.13438257115663557.
[I 2024-12-03 19:15:35,639] Trial 2020 finished with value: 0.13546945745625158 and parameters: {'kernel': 'linear', 'C': 21.64493247488677, 'gamma': 0.08598913943869975, 'epsilon': 0.0316435737407928}. Best is trial 345 with value: 0.13438257115663557.
[I 2024-12-03 19:15:36,379] Trial 2042 finished with value: 0.16008562519504257 and parameters: {'kernel': 'linear', 'C': 13.710117400472035, 'gamma': 0.02252371560522889, 'epsilon': 0.17278375638499613}. Best is trial 345 with value: 0.13438257115663557.
[I 2024-12-03 19:15:37,109] Trial 2035 finished with value: 0.13595727245640343 and parameters: {'kernel': 'linear', 'C': 6.520702852556763, 'gamma': 0.04893032772425681, 'epsilon': 0.03040846732168539}. Best is trial 345 with value: 0.13438257115663557.
[I 2024-12-03 19:15:37,560] Trial 2041 finished with value: 0.13653570092030362 and parameters: {'kernel': 'linear', 'C': 2.222038723938434, 'gamma': 0.28111104741491166, 'epsilon': 0.04458740328113521}. Best is trial 345 with value: 0.13438257115663557.
