[I 2024-12-04 21:23:04,302] Trial 2274 finished with value: 0.1424950431063299 and parameters: {'kernel_type': 'Matern', 'length_scale': 1.743138688554881, 'noise_level': 0.04326674124898784, 'constant_value': 151.80081182709765, 'nu': 1.5}. Best is trial 959 with value: 0.1375110730946576.
[I 2024-12-04 21:23:05,651] Trial 2276 finished with value: 0.14249506904352188 and parameters: {'kernel_type': 'Matern', 'length_scale': 5013.8285444137455, 'noise_level': 0.7563861235755353, 'constant_value': 299.11343925137334, 'nu': 1.5}. Best is trial 959 with value: 0.1375110730946576.
[I 2024-12-04 21:23:10,078] Trial 2278 finished with value: 0.9982171093941455 and parameters: {'kernel_type': 'Matern', 'length_scale': 39752.07403141127, 'noise_level': 0.8957317409445749, 'constant_value': 1.0367350839122367, 'nu': 1.5}. Best is trial 959 with value: 0.1375110730946576.
[I 2024-12-04 21:23:13,123] Trial 2277 finished with value: 0.1424950659768318 and parameters: {'kernel_type': 'Matern', 'length_scale': 666.441218602352, 'noise_level': 0.032794011296832876, 'constant_value': 55.33962622698008, 'nu': 1.5}. Best is trial 959 with value: 0.1375110730946576.
[I 2024-12-04 21:23:15,503] Trial 2279 finished with value: 0.14249520564223542 and parameters: {'kernel_type': 'Matern', 'length_scale': 1046.5899169972981, 'noise_level': 0.9139738549411016, 'constant_value': 8.806640782311018, 'nu': 1.5}. Best is trial 959 with value: 0.1375110730946576.
[I 2024-12-04 21:23:17,942] Trial 2280 finished with value: 0.9864686819230972 and parameters: {'kernel_type': 'Matern', 'length_scale': 8.903534226891727, 'noise_level': 0.009926520113730016, 'constant_value': 0.033480793413886926, 'nu': 2.5}. Best is trial 959 with value: 0.1375110730946576.
[I 2024-12-04 21:23:18,702] Trial 2281 finished with value: 0.9864686819224975 and parameters: {'kernel_type': 'RBF', 'length_scale': 0.00043689134739534514, 'noise_level': 4.3726349230992814e-07, 'constant_value': 0.017363690279064408, 'nu': 2.5}. Best is trial 959 with value: 0.1375110730946576.
[I 2024-12-04 21:23:25,136] Trial 2283 finished with value: 0.14249509175224878 and parameters: {'kernel_type': 'Matern', 'length_scale': 15.434170057240856, 'noise_level': 0.10277509422911843, 'constant_value': 11.229984140813599, 'nu': 1.5}. Best is trial 959 with value: 0.1375110730946576.
[I 2024-12-04 21:23:25,213] Trial 2282 finished with value: 0.1424950678881897 and parameters: {'kernel_type': 'Matern', 'length_scale': 3.1421502635940617, 'noise_level': 0.049169594627169994, 'constant_value': 1116.9456234670608, 'nu': 1.5}. Best is trial 959 with value: 0.1375110730946576.
[I 2024-12-04 21:23:25,652] Trial 2284 finished with value: 0.14771058232128217 and parameters: {'kernel_type': 'RBF', 'length_scale': 13.039917880454649, 'noise_level': 7.663462263434488e-05, 'constant_value': 18219.367230813306, 'nu': 2.5}. Best is trial 959 with value: 0.1375110730946576.
[I 2024-12-04 21:23:32,847] Trial 2286 finished with value: 0.19720002792061908 and parameters: {'kernel_type': 'Matern', 'length_scale': 2461.0922959682925, 'noise_level': 0.03657298263364683, 'constant_value': 2.4763868908825932, 'nu': 0.5}. Best is trial 959 with value: 0.1375110730946576.
[I 2024-12-04 21:23:34,120] Trial 2285 finished with value: 0.14249513699483618 and parameters: {'kernel_type': 'Matern', 'length_scale': 56.71442529824773, 'noise_level': 0.7548737061416441, 'constant_value': 2.6154625739004853, 'nu': 1.5}. Best is trial 959 with value: 0.1375110730946576.
[I 2024-12-04 21:23:35,682] Trial 2287 finished with value: 0.14249503429988497 and parameters: {'kernel_type': 'Matern', 'length_scale': 0.24186463329649793, 'noise_level': 0.042174280649253174, 'constant_value': 20.178545817954507, 'nu': 1.5}. Best is trial 959 with value: 0.1375110730946576.
[I 2024-12-04 21:23:40,995] Trial 2288 finished with value: 0.1424951678563627 and parameters: {'kernel_type': 'Matern', 'length_scale': 93.16337065650863, 'noise_level': 0.883969601306654, 'constant_value': 66.93290853388761, 'nu': 1.5}. Best is trial 959 with value: 0.1375110730946576.
[I 2024-12-04 21:23:41,663] Trial 2289 finished with value: 0.9864686819173116 and parameters: {'kernel_type': 'Matern', 'length_scale': 77.00698790807188, 'noise_level': 0.00030274605104840796, 'constant_value': 4.043527599861442, 'nu': 1.5}. Best is trial 959 with value: 0.1375110730946576.
[I 2024-12-04 21:23:43,098] Trial 2290 finished with value: 0.14249505674166138 and parameters: {'kernel_type': 'Matern', 'length_scale': 15.2528155552279, 'noise_level': 0.9916634880918146, 'constant_value': 25.854026585440213, 'nu': 1.5}. Best is trial 959 with value: 0.1375110730946576.
[I 2024-12-04 21:23:46,291] Trial 2292 finished with value: 0.9864686818834942 and parameters: {'kernel_type': 'Matern', 'length_scale': 0.004518121885971184, 'noise_level': 0.055190379821359985, 'constant_value': 63912.72670461297, 'nu': 1.5}. Best is trial 959 with value: 0.1375110730946576.
[I 2024-12-04 21:23:48,765] Trial 2293 finished with value: 0.9864686819342653 and parameters: {'kernel_type': 'Matern', 'length_scale': 0.004094994668471658, 'noise_level': 0.7977471890589275, 'constant_value': 9.144502732504023, 'nu': 1.5}. Best is trial 959 with value: 0.1375110730946576.
[I 2024-12-04 21:23:51,409] Trial 2291 finished with value: 0.14249503813335607 and parameters: {'kernel_type': 'Matern', 'length_scale': 640.3528640790754, 'noise_level': 0.06428899960137165, 'constant_value': 0.1930860867664771, 'nu': 1.5}. Best is trial 959 with value: 0.1375110730946576.
[I 2024-12-04 21:23:52,712] Trial 2294 finished with value: 0.1424950162432273 and parameters: {'kernel_type': 'Matern', 'length_scale': 8.730381691573443, 'noise_level': 0.8467145308996468, 'constant_value': 27425.401678294693, 'nu': 1.5}. Best is trial 959 with value: 0.1375110730946576.
[I 2024-12-04 21:23:55,387] Trial 2295 finished with value: 0.14249475184558877 and parameters: {'kernel_type': 'Matern', 'length_scale': 0.8353526087378818, 'noise_level': 0.02003133729918491, 'constant_value': 293.9217726469403, 'nu': 1.5}. Best is trial 959 with value: 0.1375110730946576.
[I 2024-12-04 21:23:57,900] Trial 2296 finished with value: 0.14771043904326592 and parameters: {'kernel_type': 'RBF', 'length_scale': 1.9163645558219118, 'noise_level': 0.9730847143239213, 'constant_value': 448.8946208529165, 'nu': 1.5}. Best is trial 959 with value: 0.1375110730946576.
[I 2024-12-04 21:24:02,811] Trial 2297 finished with value: 0.1424950126508399 and parameters: {'kernel_type': 'Matern', 'length_scale': 0.2781178755768292, 'noise_level': 0.981720868987218, 'constant_value': 64.2327070279514, 'nu': 1.5}. Best is trial 959 with value: 0.1375110730946576.
[I 2024-12-04 21:24:03,329] Trial 2298 finished with value: 0.14249503859637566 and parameters: {'kernel_type': 'Matern', 'length_scale': 1.4985351934035005, 'noise_level': 0.06152647293673411, 'constant_value': 3569.0879950343983, 'nu': 1.5}. Best is trial 959 with value: 0.1375110730946576.
[I 2024-12-04 21:24:05,056] Trial 2299 finished with value: 0.14249489126737702 and parameters: {'kernel_type': 'Matern', 'length_scale': 203.51262706729275, 'noise_level': 0.04497705870148809, 'constant_value': 12.415534817225792, 'nu': 1.5}. Best is trial 959 with value: 0.1375110730946576.
[I 2024-12-04 21:24:10,010] Trial 2302 finished with value: 0.14771045804507418 and parameters: {'kernel_type': 'RBF', 'length_scale': 145.80825128814942, 'noise_level': 0.9308905248202545, 'constant_value': 798.3794870039823, 'nu': 1.5}. Best is trial 959 with value: 0.1375110730946576.
[I 2024-12-04 21:24:11,225] Trial 2300 finished with value: 0.14249492859995885 and parameters: {'kernel_type': 'Matern', 'length_scale': 4.005408225405632, 'noise_level': 0.03546041520611569, 'constant_value': 68.12262227464353, 'nu': 1.5}. Best is trial 959 with value: 0.1375110730946576.
[I 2024-12-04 21:24:15,385] Trial 2304 finished with value: 0.9864686814357696 and parameters: {'kernel_type': 'Matern', 'length_scale': 0.057735296980562435, 'noise_level': 0.045101538435982566, 'constant_value': 270.4280717860839, 'nu': 2.5}. Best is trial 959 with value: 0.1375110730946576.
[I 2024-12-04 21:24:17,694] Trial 2301 finished with value: 0.14249526943597557 and parameters: {'kernel_type': 'Matern', 'length_scale': 35.2435920084451, 'noise_level': 0.9075461764876632, 'constant_value': 45.99885985063718, 'nu': 1.5}. Best is trial 959 with value: 0.1375110730946576.
[I 2024-12-04 21:24:17,766] Trial 2303 finished with value: 0.9864686819007056 and parameters: {'kernel_type': 'RBF', 'length_scale': 0.005978865579857683, 'noise_level': 2.430779458308581e-09, 'constant_value': 2.8422130203091872e-06, 'nu': 2.5}. Best is trial 959 with value: 0.1375110730946576.
[I 2024-12-04 21:24:21,596] Trial 2305 finished with value: 0.1477106786403486 and parameters: {'kernel_type': 'RBF', 'length_scale': 5.548838279834681, 'noise_level': 0.024640424622426275, 'constant_value': 757.8824930471727, 'nu': 0.5}. Best is trial 959 with value: 0.1375110730946576.
[I 2024-12-04 21:24:25,034] Trial 2307 finished with value: 0.9864686819264079 and parameters: {'kernel_type': 'Matern', 'length_scale': 0.03894544575833608, 'noise_level': 0.8826282523169987, 'constant_value': 831.7666354520948, 'nu': 1.5}. Best is trial 959 with value: 0.1375110730946576.
[I 2024-12-04 21:24:29,018] Trial 2306 finished with value: 0.14249506849090374 and parameters: {'kernel_type': 'Matern', 'length_scale': 10.159281680781042, 'noise_level': 0.9563490623774265, 'constant_value': 13.387009699275234, 'nu': 1.5}. Best is trial 959 with value: 0.1375110730946576.
[I 2024-12-04 21:24:29,021] Trial 2308 finished with value: 0.14249506574983467 and parameters: {'kernel_type': 'Matern', 'length_scale': 21.47252796001736, 'noise_level': 0.042370552079879886, 'constant_value': 509.3440208736834, 'nu': 1.5}. Best is trial 959 with value: 0.1375110730946576.
[I 2024-12-04 21:24:31,806] Trial 2309 finished with value: 0.1972000228465392 and parameters: {'kernel_type': 'Matern', 'length_scale': 4.6043442014265175, 'noise_level': 0.04684618056224669, 'constant_value': 1014.8111315864967, 'nu': 0.5}. Best is trial 959 with value: 0.1375110730946576.
[I 2024-12-04 21:24:32,376] Trial 2310 finished with value: 0.9982160255052593 and parameters: {'kernel_type': 'RBF', 'length_scale': 0.00019144472745234056, 'noise_level': 0.8119611687647714, 'constant_value': 2.885146197583202e-05, 'nu': 2.5}. Best is trial 959 with value: 0.1375110730946576.
[I 2024-12-04 21:24:37,676] Trial 2311 finished with value: 0.1396999760891565 and parameters: {'kernel_type': 'Matern', 'length_scale': 3.30348102277588, 'noise_level': 0.7900063931376491, 'constant_value': 503.4669124455326, 'nu': 1.5}. Best is trial 959 with value: 0.1375110730946576.
[I 2024-12-04 21:24:43,316] Trial 2312 finished with value: 0.14249500519784308 and parameters: {'kernel_type': 'Matern', 'length_scale': 28.63196310085425, 'noise_level': 0.0008069411414377204, 'constant_value': 4.226743595210766, 'nu': 1.5}. Best is trial 959 with value: 0.1375110730946576.
[I 2024-12-04 21:24:44,134] Trial 2313 finished with value: 0.1379963935949307 and parameters: {'kernel_type': 'Matern', 'length_scale': 20.62532103347188, 'noise_level': 0.03022823667132457, 'constant_value': 0.042675452921515734, 'nu': 1.5}. Best is trial 959 with value: 0.1375110730946576.
[I 2024-12-04 21:24:46,417] Trial 2314 finished with value: 0.14249506208520688 and parameters: {'kernel_type': 'Matern', 'length_scale': 12.71711569247712, 'noise_level': 0.022810478170563968, 'constant_value': 4.686693432154151, 'nu': 1.5}. Best is trial 959 with value: 0.1375110730946576.
[I 2024-12-04 21:24:49,679] Trial 2315 finished with value: 0.14249509274360986 and parameters: {'kernel_type': 'Matern', 'length_scale': 57.19392850591313, 'noise_level': 0.9372474567357374, 'constant_value': 9.881545142198735, 'nu': 1.5}. Best is trial 959 with value: 0.1375110730946576.
[I 2024-12-04 21:24:56,563] Trial 2316 finished with value: 0.9864686820620777 and parameters: {'kernel_type': 'Matern', 'length_scale': 387.6516060788897, 'noise_level': 0.02419396822280276, 'constant_value': 0.021447724307764118, 'nu': 1.5}. Best is trial 959 with value: 0.1375110730946576.
[I 2024-12-04 21:24:58,274] Trial 2318 finished with value: 0.1424950850394597 and parameters: {'kernel_type': 'Matern', 'length_scale': 1.8871071555766472, 'noise_level': 0.1111595614212345, 'constant_value': 0.0037301587934518445, 'nu': 1.5}. Best is trial 959 with value: 0.1375110730946576.
[I 2024-12-04 21:24:59,194] Trial 2317 finished with value: 0.15578796676981116 and parameters: {'kernel_type': 'Matern', 'length_scale': 204.45849338617032, 'noise_level': 0.5630868626021903, 'constant_value': 0.0007145133279719836, 'nu': 1.5}. Best is trial 959 with value: 0.1375110730946576.
[I 2024-12-04 21:25:04,552] Trial 2320 finished with value: 0.9864686819224198 and parameters: {'kernel_type': 'Matern', 'length_scale': 14.603134504138879, 'noise_level': 0.00028793797384532485, 'constant_value': 0.2673772036167056, 'nu': 1.5}. Best is trial 959 with value: 0.1375110730946576.
[I 2024-12-04 21:25:07,202] Trial 2319 finished with value: 0.9864686820108283 and parameters: {'kernel_type': 'Matern', 'length_scale': 7.459277196735158, 'noise_level': 0.006374609882957769, 'constant_value': 0.011264433412180936, 'nu': 1.5}. Best is trial 959 with value: 0.1375110730946576.
[I 2024-12-04 21:25:10,550] Trial 2321 finished with value: 0.9864686819105054 and parameters: {'kernel_type': 'Matern', 'length_scale': 13.273175913354612, 'noise_level': 0.0059850533491668054, 'constant_value': 0.0004978829459821883, 'nu': 1.5}. Best is trial 959 with value: 0.1375110730946576.
[I 2024-12-04 21:25:15,027] Trial 2322 finished with value: 0.14249506328189526 and parameters: {'kernel_type': 'Matern', 'length_scale': 2.651436606357307, 'noise_level': 0.7805288200169788, 'constant_value': 0.0002161961461645603, 'nu': 1.5}. Best is trial 959 with value: 0.1375110730946576.
[I 2024-12-04 21:25:15,961] Trial 2324 finished with value: 0.9864686819230817 and parameters: {'kernel_type': 'Matern', 'length_scale': 25.399827101847883, 'noise_level': 0.0014487850048116946, 'constant_value': 0.44649034244871777, 'nu': 1.5}. Best is trial 959 with value: 0.1375110730946576.
[I 2024-12-04 21:25:18,782] Trial 2323 finished with value: 0.9864686819224058 and parameters: {'kernel_type': 'Matern', 'length_scale': 71.35175446252998, 'noise_level': 0.0008345343145555251, 'constant_value': 0.052844798965285975, 'nu': 1.5}. Best is trial 959 with value: 0.1375110730946576.
[I 2024-12-04 21:25:24,242] Trial 2326 finished with value: 0.986468681936694 and parameters: {'kernel_type': 'Matern', 'length_scale': 5.067493074813674, 'noise_level': 0.007543922739530452, 'constant_value': 0.002797974827137825, 'nu': 1.5}. Best is trial 959 with value: 0.1375110730946576.
[I 2024-12-04 21:25:25,950] Trial 2325 finished with value: 0.9864686820530256 and parameters: {'kernel_type': 'Matern', 'length_scale': 450.7866422229313, 'noise_level': 0.004248513626644807, 'constant_value': 0.0005325295743148635, 'nu': 1.5}. Best is trial 959 with value: 0.1375110730946576.
[I 2024-12-04 21:25:26,526] Trial 2327 finished with value: 0.9864686816809173 and parameters: {'kernel_type': 'Matern', 'length_scale': 117.52747126466869, 'noise_level': 0.00620995841808089, 'constant_value': 0.030657787983230385, 'nu': 1.5}. Best is trial 959 with value: 0.1375110730946576.
[I 2024-12-04 21:25:34,651] Trial 2329 finished with value: 0.1424950681534041 and parameters: {'kernel_type': 'Matern', 'length_scale': 0.1653548734041761, 'noise_level': 0.0007227706286367093, 'constant_value': 0.0014718466897749327, 'nu': 1.5}. Best is trial 959 with value: 0.1375110730946576.
[I 2024-12-04 21:25:35,404] Trial 2330 finished with value: 0.14249506971790946 and parameters: {'kernel_type': 'Matern', 'length_scale': 8.878291427709316, 'noise_level': 0.043635788914406476, 'constant_value': 0.007079538317904632, 'nu': 1.5}. Best is trial 959 with value: 0.1375110730946576.
[I 2024-12-04 21:25:37,606] Trial 2328 finished with value: 0.9864686815190303 and parameters: {'kernel_type': 'Matern', 'length_scale': 820.509437082956, 'noise_level': 0.013249663948995337, 'constant_value': 0.0017678020124759423, 'nu': 1.5}. Best is trial 959 with value: 0.1375110730946576.
[I 2024-12-04 21:25:41,112] Trial 2331 finished with value: 0.14249505471089538 and parameters: {'kernel_type': 'Matern', 'length_scale': 0.932994819653467, 'noise_level': 0.004450183109068306, 'constant_value': 0.3802384624187272, 'nu': 1.5}. Best is trial 959 with value: 0.1375110730946576.
[I 2024-12-04 21:25:42,674] Trial 2332 finished with value: 0.1424950701802937 and parameters: {'kernel_type': 'Matern', 'length_scale': 36.43836089350102, 'noise_level': 0.080007613338768, 'constant_value': 0.0020446037193631887, 'nu': 1.5}. Best is trial 959 with value: 0.1375110730946576.
[I 2024-12-04 21:25:46,086] Trial 2333 finished with value: 0.1424950414373968 and parameters: {'kernel_type': 'Matern', 'length_scale': 15.261410804333394, 'noise_level': 0.08019173332966459, 'constant_value': 0.018634631881216102, 'nu': 1.5}. Best is trial 959 with value: 0.1375110730946576.
[I 2024-12-04 21:25:49,925] Trial 2334 finished with value: 0.9864686819179167 and parameters: {'kernel_type': 'Matern', 'length_scale': 22.249084722727794, 'noise_level': 0.0052554367908754325, 'constant_value': 0.0140065178950101, 'nu': 1.5}. Best is trial 959 with value: 0.1375110730946576.
[I 2024-12-04 21:25:52,744] Trial 2336 finished with value: 0.14249505515085653 and parameters: {'kernel_type': 'Matern', 'length_scale': 4.058338539578967, 'noise_level': 0.0312042886044986, 'constant_value': 0.22119076052466843, 'nu': 1.5}. Best is trial 959 with value: 0.1375110730946576.
[I 2024-12-04 21:25:58,345] Trial 2335 finished with value: 0.986468681927317 and parameters: {'kernel_type': 'Matern', 'length_scale': 2020.9394807289186, 'noise_level': 0.005191742785466972, 'constant_value': 3.8717519518031724, 'nu': 1.5}. Best is trial 959 with value: 0.1375110730946576.
[I 2024-12-04 21:25:58,717] Trial 2338 finished with value: 0.1972028067861081 and parameters: {'kernel_type': 'Matern', 'length_scale': 118.00886767697861, 'noise_level': 0.9699845060211838, 'constant_value': 3.8173617423768706, 'nu': 0.5}. Best is trial 959 with value: 0.1375110730946576.
[I 2024-12-04 21:26:00,600] Trial 2337 finished with value: 0.14249498729665347 and parameters: {'kernel_type': 'Matern', 'length_scale': 52.76074049476389, 'noise_level': 0.9948983139198346, 'constant_value': 0.0011845931662247953, 'nu': 1.5}. Best is trial 959 with value: 0.1375110730946576.
[I 2024-12-04 21:26:05,947] Trial 2340 finished with value: 0.14249506967088535 and parameters: {'kernel_type': 'Matern', 'length_scale': 3562.320578946086, 'noise_level': 0.06564602928175936, 'constant_value': 83.67395188855491, 'nu': 1.5}. Best is trial 959 with value: 0.1375110730946576.
[I 2024-12-04 21:26:06,389] Trial 2339 finished with value: 0.9864686819226881 and parameters: {'kernel_type': 'Matern', 'length_scale': 151.316140089056, 'noise_level': 0.017110344495473138, 'constant_value': 0.06444588942140876, 'nu': 1.5}. Best is trial 959 with value: 0.1375110730946576.
[I 2024-12-04 21:26:11,249] Trial 2341 finished with value: 0.14249501704115258 and parameters: {'kernel_type': 'Matern', 'length_scale': 128.74307347507818, 'noise_level': 0.7310528804576297, 'constant_value': 0.629883523353008, 'nu': 1.5}. Best is trial 959 with value: 0.1375110730946576.
[I 2024-12-04 21:26:12,575] Trial 2342 finished with value: 0.14249506233361542 and parameters: {'kernel_type': 'Matern', 'length_scale': 4.443603414058821, 'noise_level': 0.021031820930661506, 'constant_value': 0.6303459500351734, 'nu': 1.5}. Best is trial 959 with value: 0.1375110730946576.
[I 2024-12-04 21:26:13,413] Trial 2343 finished with value: 0.14249504205546848 and parameters: {'kernel_type': 'Matern', 'length_scale': 4.084000546346637, 'noise_level': 0.02942323960397932, 'constant_value': 1.483029062083779, 'nu': 1.5}. Best is trial 959 with value: 0.1375110730946576.
[I 2024-12-04 21:26:18,195] Trial 2344 finished with value: 0.14249509846490888 and parameters: {'kernel_type': 'Matern', 'length_scale': 1909.679031022695, 'noise_level': 0.9933719352256425, 'constant_value': 1.996008515926252, 'nu': 1.5}. Best is trial 959 with value: 0.1375110730946576.
[I 2024-12-04 21:26:18,904] Trial 2345 finished with value: 0.9864686819658595 and parameters: {'kernel_type': 'RBF', 'length_scale': 2.10550119787844, 'noise_level': 0.0010775649765320896, 'constant_value': 0.009717082757075375, 'nu': 0.5}. Best is trial 959 with value: 0.1375110730946576.
[I 2024-12-04 21:26:22,436] Trial 2346 finished with value: 0.14249502535149888 and parameters: {'kernel_type': 'Matern', 'length_scale': 6.78953045434257, 'noise_level': 0.9547184931912619, 'constant_value': 0.0031638108055971905, 'nu': 1.5}. Best is trial 959 with value: 0.1375110730946576.
[I 2024-12-04 21:26:24,547] Trial 2347 finished with value: 0.986468681951437 and parameters: {'kernel_type': 'Matern', 'length_scale': 3.4955565223143252, 'noise_level': 0.0005222913177974341, 'constant_value': 0.012507923947155348, 'nu': 1.5}. Best is trial 959 with value: 0.1375110730946576.
[I 2024-12-04 21:26:30,469] Trial 2349 finished with value: 0.9864686819399281 and parameters: {'kernel_type': 'Matern', 'length_scale': 13610.887712372974, 'noise_level': 0.021196492536162743, 'constant_value': 0.23322804443106823, 'nu': 1.5}. Best is trial 959 with value: 0.1375110730946576.
