[I 2024-12-04 13:08:33,659] Trial 1465 finished with value: 0.2444572998106431 and parameters: {'n_estimators': 1466, 'learning_rate': 0.06480689587723551, 'max_depth': 6, 'min_samples_split': 3, 'min_samples_leaf': 1, 'subsample': 0.7334208315561426, 'max_features': 'sqrt'}. Best is trial 1389 with value: 0.22332552856343169.
[I 2024-12-04 13:08:40,316] Trial 1474 finished with value: 0.43802111648323266 and parameters: {'n_estimators': 929, 'learning_rate': 0.06125371292438084, 'max_depth': 6, 'min_samples_split': 8, 'min_samples_leaf': 7, 'subsample': 0.9778777937047471, 'max_features': None}. Best is trial 1389 with value: 0.22332552856343169.
[I 2024-12-04 13:08:42,868] Trial 1471 finished with value: 0.331784867407559 and parameters: {'n_estimators': 1115, 'learning_rate': 0.05897194731915802, 'max_depth': 9, 'min_samples_split': 10, 'min_samples_leaf': 1, 'subsample': 0.7751445336235134, 'max_features': None}. Best is trial 1389 with value: 0.22332552856343169.
[I 2024-12-04 13:08:43,342] Trial 1475 finished with value: 0.298185979390803 and parameters: {'n_estimators': 1141, 'learning_rate': 0.09680168132298236, 'max_depth': 7, 'min_samples_split': 3, 'min_samples_leaf': 2, 'subsample': 0.8722150472569022, 'max_features': 'sqrt'}. Best is trial 1389 with value: 0.22332552856343169.
[I 2024-12-04 13:08:43,567] Trial 1467 finished with value: 0.3823284453004815 and parameters: {'n_estimators': 1370, 'learning_rate': 0.06599248308664189, 'max_depth': 9, 'min_samples_split': 6, 'min_samples_leaf': 2, 'subsample': 0.8706617614777101, 'max_features': None}. Best is trial 1389 with value: 0.22332552856343169.
[I 2024-12-04 13:08:43,571] Trial 1497 finished with value: 0.4429829329751547 and parameters: {'n_estimators': 152, 'learning_rate': 0.059062293599651754, 'max_depth': 8, 'min_samples_split': 11, 'min_samples_leaf': 4, 'subsample': 0.9475273506504159, 'max_features': None}. Best is trial 1389 with value: 0.22332552856343169.
[I 2024-12-04 13:08:46,677] Trial 1470 finished with value: 0.2662441881596991 and parameters: {'n_estimators': 1396, 'learning_rate': 0.07866709262689744, 'max_depth': 11, 'min_samples_split': 4, 'min_samples_leaf': 1, 'subsample': 0.6045473122385975, 'max_features': 'sqrt'}. Best is trial 1389 with value: 0.22332552856343169.
[I 2024-12-04 13:08:47,151] Trial 1492 finished with value: 0.4419907688758085 and parameters: {'n_estimators': 246, 'learning_rate': 0.069159545063594, 'max_depth': 5, 'min_samples_split': 2, 'min_samples_leaf': 5, 'subsample': 0.9925257450473602, 'max_features': None}. Best is trial 1389 with value: 0.22332552856343169.
[I 2024-12-04 13:08:49,833] Trial 1478 finished with value: 0.259114016566818 and parameters: {'n_estimators': 1089, 'learning_rate': 0.061705449962123606, 'max_depth': 8, 'min_samples_split': 2, 'min_samples_leaf': 1, 'subsample': 0.878789055476391, 'max_features': 'sqrt'}. Best is trial 1389 with value: 0.22332552856343169.
[I 2024-12-04 13:08:55,771] Trial 1485 finished with value: 0.26643926092557496 and parameters: {'n_estimators': 904, 'learning_rate': 0.08689288805312034, 'max_depth': 5, 'min_samples_split': 3, 'min_samples_leaf': 1, 'subsample': 0.8380834985778756, 'max_features': 'sqrt'}. Best is trial 1389 with value: 0.22332552856343169.
[I 2024-12-04 13:08:57,232] Trial 1479 finished with value: 0.368777005940871 and parameters: {'n_estimators': 1088, 'learning_rate': 0.09469041724439496, 'max_depth': 9, 'min_samples_split': 3, 'min_samples_leaf': 4, 'subsample': 0.6698528811891772, 'max_features': 'sqrt'}. Best is trial 1389 with value: 0.22332552856343169.
[I 2024-12-04 13:08:57,644] Trial 1484 finished with value: 0.24499287657312693 and parameters: {'n_estimators': 892, 'learning_rate': 0.0713886954755342, 'max_depth': 10, 'min_samples_split': 8, 'min_samples_leaf': 1, 'subsample': 0.73604114547229, 'max_features': 'sqrt'}. Best is trial 1389 with value: 0.22332552856343169.
[I 2024-12-04 13:08:57,791] Trial 1477 finished with value: 0.2648083642908561 and parameters: {'n_estimators': 1214, 'learning_rate': 0.06536919229099052, 'max_depth': 7, 'min_samples_split': 3, 'min_samples_leaf': 1, 'subsample': 0.8867329452708422, 'max_features': 'sqrt'}. Best is trial 1389 with value: 0.22332552856343169.
[I 2024-12-04 13:08:59,086] Trial 1482 finished with value: 0.3502564391595281 and parameters: {'n_estimators': 1027, 'learning_rate': 0.07562794976234509, 'max_depth': 6, 'min_samples_split': 7, 'min_samples_leaf': 3, 'subsample': 0.9007608253925852, 'max_features': 'sqrt'}. Best is trial 1389 with value: 0.22332552856343169.
[I 2024-12-04 13:09:00,260] Trial 1486 finished with value: 0.2896180742081016 and parameters: {'n_estimators': 912, 'learning_rate': 0.07551695274375515, 'max_depth': 8, 'min_samples_split': 6, 'min_samples_leaf': 1, 'subsample': 0.6062838346794729, 'max_features': 'sqrt'}. Best is trial 1389 with value: 0.22332552856343169.
[I 2024-12-04 13:09:26,131] Trial 1489 finished with value: 0.23831555500917542 and parameters: {'n_estimators': 1196, 'learning_rate': 0.09757433987198393, 'max_depth': 9, 'min_samples_split': 5, 'min_samples_leaf': 1, 'subsample': 0.90006570788017, 'max_features': 'sqrt'}. Best is trial 1389 with value: 0.22332552856343169.
[I 2024-12-04 13:09:26,852] Trial 1490 finished with value: 0.35534593420088906 and parameters: {'n_estimators': 1067, 'learning_rate': 0.062371757844410014, 'max_depth': 11, 'min_samples_split': 6, 'min_samples_leaf': 3, 'subsample': 0.6731910153454681, 'max_features': 'sqrt'}. Best is trial 1389 with value: 0.22332552856343169.
[I 2024-12-04 13:09:28,064] Trial 1481 finished with value: 0.2598631243938245 and parameters: {'n_estimators': 1451, 'learning_rate': 0.06799991087299799, 'max_depth': 10, 'min_samples_split': 6, 'min_samples_leaf': 1, 'subsample': 0.6793520461244327, 'max_features': 'sqrt'}. Best is trial 1389 with value: 0.22332552856343169.
[I 2024-12-04 13:09:31,693] Trial 1494 finished with value: 0.2571171238760847 and parameters: {'n_estimators': 1117, 'learning_rate': 0.044852654076758015, 'max_depth': 8, 'min_samples_split': 2, 'min_samples_leaf': 1, 'subsample': 0.9743317930543844, 'max_features': 'sqrt'}. Best is trial 1389 with value: 0.22332552856343169.
[I 2024-12-04 13:09:33,837] Trial 1487 finished with value: 0.35293593647672344 and parameters: {'n_estimators': 1465, 'learning_rate': 0.08854220870102962, 'max_depth': 7, 'min_samples_split': 7, 'min_samples_leaf': 3, 'subsample': 0.7613612328267392, 'max_features': 'sqrt'}. Best is trial 1389 with value: 0.22332552856343169.
[I 2024-12-04 13:09:38,461] Trial 1491 finished with value: 0.2736385274340804 and parameters: {'n_estimators': 1337, 'learning_rate': 0.06307657236269326, 'max_depth': 4, 'min_samples_split': 6, 'min_samples_leaf': 1, 'subsample': 0.7122531042483468, 'max_features': 'sqrt'}. Best is trial 1389 with value: 0.22332552856343169.
[I 2024-12-04 13:09:38,474] Trial 1488 finished with value: 0.2561918193318573 and parameters: {'n_estimators': 1483, 'learning_rate': 0.07921287854111243, 'max_depth': 7, 'min_samples_split': 8, 'min_samples_leaf': 1, 'subsample': 0.891305432994659, 'max_features': 'sqrt'}. Best is trial 1389 with value: 0.22332552856343169.
[I 2024-12-04 13:09:40,334] Trial 1496 finished with value: 0.3485789868315036 and parameters: {'n_estimators': 1126, 'learning_rate': 0.09677369512730112, 'max_depth': 9, 'min_samples_split': 8, 'min_samples_leaf': 3, 'subsample': 0.8030760582839481, 'max_features': 'sqrt'}. Best is trial 1389 with value: 0.22332552856343169.
[I 2024-12-04 13:09:42,308] Trial 1512 finished with value: 0.4812571963747246 and parameters: {'n_estimators': 516, 'learning_rate': 0.05242323107166969, 'max_depth': 9, 'min_samples_split': 3, 'min_samples_leaf': 10, 'subsample': 0.7914372950354394, 'max_features': None}. Best is trial 1389 with value: 0.22332552856343169.
[I 2024-12-04 13:09:47,135] Trial 1498 finished with value: 0.23318344670265653 and parameters: {'n_estimators': 1234, 'learning_rate': 0.05419466162528189, 'max_depth': 10, 'min_samples_split': 3, 'min_samples_leaf': 1, 'subsample': 0.6857073000179361, 'max_features': 'sqrt'}. Best is trial 1389 with value: 0.22332552856343169.
[I 2024-12-04 13:09:48,707] Trial 1495 finished with value: 0.5159868351124001 and parameters: {'n_estimators': 1250, 'learning_rate': 0.0114253392378515, 'max_depth': 9, 'min_samples_split': 13, 'min_samples_leaf': 2, 'subsample': 0.8985376529809186, 'max_features': 'log2'}. Best is trial 1389 with value: 0.22332552856343169.
[I 2024-12-04 13:09:49,895] Trial 1508 finished with value: 0.8623588829276896 and parameters: {'n_estimators': 887, 'learning_rate': 0.02230755058681028, 'max_depth': 3, 'min_samples_split': 16, 'min_samples_leaf': 5, 'subsample': 0.8844795358425309, 'max_features': 'log2'}. Best is trial 1389 with value: 0.22332552856343169.
[I 2024-12-04 13:09:51,382] Trial 1499 finished with value: 0.4411183917312455 and parameters: {'n_estimators': 1133, 'learning_rate': 0.0665289892400408, 'max_depth': 8, 'min_samples_split': 4, 'min_samples_leaf': 2, 'subsample': 0.8377315556565629, 'max_features': None}. Best is trial 1389 with value: 0.22332552856343169.
[I 2024-12-04 13:09:52,336] Trial 1501 finished with value: 0.2569896363450236 and parameters: {'n_estimators': 1187, 'learning_rate': 0.08886511366689749, 'max_depth': 8, 'min_samples_split': 5, 'min_samples_leaf': 1, 'subsample': 0.6162478597551638, 'max_features': 'sqrt'}. Best is trial 1389 with value: 0.22332552856343169.
[I 2024-12-04 13:09:55,723] Trial 1500 finished with value: 0.2333305208683492 and parameters: {'n_estimators': 1245, 'learning_rate': 0.06954336597315096, 'max_depth': 11, 'min_samples_split': 8, 'min_samples_leaf': 1, 'subsample': 0.701214986241522, 'max_features': 'sqrt'}. Best is trial 1389 with value: 0.22332552856343169.
[I 2024-12-04 13:10:01,604] Trial 1502 finished with value: 0.296010076777821 and parameters: {'n_estimators': 1224, 'learning_rate': 0.0678900489905301, 'max_depth': 7, 'min_samples_split': 5, 'min_samples_leaf': 2, 'subsample': 0.7610747743658391, 'max_features': 'sqrt'}. Best is trial 1389 with value: 0.22332552856343169.
[I 2024-12-04 13:10:05,278] Trial 1505 finished with value: 0.26058317660955754 and parameters: {'n_estimators': 1253, 'learning_rate': 0.05208194782936696, 'max_depth': 8, 'min_samples_split': 6, 'min_samples_leaf': 1, 'subsample': 0.8300477365421302, 'max_features': 'sqrt'}. Best is trial 1389 with value: 0.22332552856343169.
[I 2024-12-04 13:10:07,044] Trial 1504 finished with value: 0.3713698507369464 and parameters: {'n_estimators': 1218, 'learning_rate': 0.07866196728503759, 'max_depth': 6, 'min_samples_split': 2, 'min_samples_leaf': 2, 'subsample': 0.7398513988568715, 'max_features': None}. Best is trial 1389 with value: 0.22332552856343169.
[I 2024-12-04 13:10:09,607] Trial 1493 finished with value: 0.24639716376676424 and parameters: {'n_estimators': 1474, 'learning_rate': 0.05333795515281954, 'max_depth': 8, 'min_samples_split': 3, 'min_samples_leaf': 1, 'subsample': 0.7472010210109822, 'max_features': 'sqrt'}. Best is trial 1389 with value: 0.22332552856343169.
[I 2024-12-04 13:10:13,433] Trial 1510 finished with value: 0.23821298179843467 and parameters: {'n_estimators': 1162, 'learning_rate': 0.097424034137264, 'max_depth': 8, 'min_samples_split': 4, 'min_samples_leaf': 1, 'subsample': 0.7291110819428863, 'max_features': 'sqrt'}. Best is trial 1389 with value: 0.22332552856343169.
[I 2024-12-04 13:10:17,431] Trial 1507 finished with value: 0.353485496026727 and parameters: {'n_estimators': 1190, 'learning_rate': 0.09646257917265802, 'max_depth': 6, 'min_samples_split': 5, 'min_samples_leaf': 3, 'subsample': 0.8856283487447288, 'max_features': 'sqrt'}. Best is trial 1389 with value: 0.22332552856343169.
[I 2024-12-04 13:10:17,445] Trial 1509 finished with value: 0.276087127186569 and parameters: {'n_estimators': 1189, 'learning_rate': 0.06500847142321063, 'max_depth': 8, 'min_samples_split': 6, 'min_samples_leaf': 1, 'subsample': 0.7457773218355357, 'max_features': 'sqrt'}. Best is trial 1389 with value: 0.22332552856343169.
[I 2024-12-04 13:10:19,692] Trial 1503 finished with value: 0.2416154613362338 and parameters: {'n_estimators': 1480, 'learning_rate': 0.09111654275676719, 'max_depth': 5, 'min_samples_split': 5, 'min_samples_leaf': 1, 'subsample': 0.7479830203658175, 'max_features': 'sqrt'}. Best is trial 1389 with value: 0.22332552856343169.
[I 2024-12-04 13:10:20,943] Trial 1506 finished with value: 0.27792726101265675 and parameters: {'n_estimators': 1419, 'learning_rate': 0.0979887320262238, 'max_depth': 10, 'min_samples_split': 2, 'min_samples_leaf': 2, 'subsample': 0.8445186857840808, 'max_features': 'sqrt'}. Best is trial 1389 with value: 0.22332552856343169.
[I 2024-12-04 13:10:24,978] Trial 1532 finished with value: 0.8407622759949969 and parameters: {'n_estimators': 252, 'learning_rate': 0.014554216882863187, 'max_depth': 5, 'min_samples_split': 20, 'min_samples_leaf': 1, 'subsample': 0.8766601794492304, 'max_features': 'sqrt'}. Best is trial 1389 with value: 0.22332552856343169.
[I 2024-12-04 13:10:25,520] Trial 1523 finished with value: 0.2460079448110164 and parameters: {'n_estimators': 673, 'learning_rate': 0.07968663754232412, 'max_depth': 6, 'min_samples_split': 6, 'min_samples_leaf': 1, 'subsample': 0.9113907449596214, 'max_features': 'sqrt'}. Best is trial 1389 with value: 0.22332552856343169.
[I 2024-12-04 13:10:28,254] Trial 1535 finished with value: 1.2096554855136 and parameters: {'n_estimators': 247, 'learning_rate': 0.0190165970124714, 'max_depth': 7, 'min_samples_split': 3, 'min_samples_leaf': 8, 'subsample': 0.6953423302340545, 'max_features': 'log2'}. Best is trial 1389 with value: 0.22332552856343169.
[I 2024-12-04 13:10:30,728] Trial 1526 finished with value: 0.6030776778847374 and parameters: {'n_estimators': 605, 'learning_rate': 0.09987046816624737, 'max_depth': 5, 'min_samples_split': 18, 'min_samples_leaf': 10, 'subsample': 0.6035595147898996, 'max_features': 'log2'}. Best is trial 1389 with value: 0.22332552856343169.
[I 2024-12-04 13:10:33,864] Trial 1514 finished with value: 0.2617630718296841 and parameters: {'n_estimators': 1138, 'learning_rate': 0.09860743178571557, 'max_depth': 8, 'min_samples_split': 4, 'min_samples_leaf': 1, 'subsample': 0.8641541662566351, 'max_features': 'sqrt'}. Best is trial 1389 with value: 0.22332552856343169.
[I 2024-12-04 13:10:35,677] Trial 1519 finished with value: 0.25513178474582904 and parameters: {'n_estimators': 1075, 'learning_rate': 0.052310564874251377, 'max_depth': 7, 'min_samples_split': 5, 'min_samples_leaf': 1, 'subsample': 0.7369530892198926, 'max_features': 'sqrt'}. Best is trial 1389 with value: 0.22332552856343169.
[I 2024-12-04 13:10:39,019] Trial 1516 finished with value: 0.252913311967709 and parameters: {'n_estimators': 1172, 'learning_rate': 0.040471157786216086, 'max_depth': 11, 'min_samples_split': 6, 'min_samples_leaf': 1, 'subsample': 0.632064845595089, 'max_features': 'sqrt'}. Best is trial 1389 with value: 0.22332552856343169.
[I 2024-12-04 13:10:41,855] Trial 1522 finished with value: 0.35011702712928333 and parameters: {'n_estimators': 906, 'learning_rate': 0.06735709079673549, 'max_depth': 10, 'min_samples_split': 8, 'min_samples_leaf': 3, 'subsample': 0.935452582946859, 'max_features': 'sqrt'}. Best is trial 1389 with value: 0.22332552856343169.
[I 2024-12-04 13:10:41,941] Trial 1511 finished with value: 0.24029527428540035 and parameters: {'n_estimators': 1423, 'learning_rate': 0.06599769787458505, 'max_depth': 8, 'min_samples_split': 3, 'min_samples_leaf': 1, 'subsample': 0.6856627811509932, 'max_features': 'sqrt'}. Best is trial 1389 with value: 0.22332552856343169.
[I 2024-12-04 13:10:44,951] Trial 1513 finished with value: 0.25893695591374444 and parameters: {'n_estimators': 1439, 'learning_rate': 0.04928012303523107, 'max_depth': 7, 'min_samples_split': 2, 'min_samples_leaf': 1, 'subsample': 0.8066020139043537, 'max_features': 'sqrt'}. Best is trial 1389 with value: 0.22332552856343169.
[I 2024-12-04 13:10:48,418] Trial 1536 finished with value: 0.2593672710868185 and parameters: {'n_estimators': 503, 'learning_rate': 0.09521640511886573, 'max_depth': 7, 'min_samples_split': 2, 'min_samples_leaf': 1, 'subsample': 0.911773329316003, 'max_features': 'sqrt'}. Best is trial 1389 with value: 0.22332552856343169.
[I 2024-12-04 13:10:49,658] Trial 1515 finished with value: 0.5177623010768467 and parameters: {'n_estimators': 1431, 'learning_rate': 0.05847169168120651, 'max_depth': 6, 'min_samples_split': 10, 'min_samples_leaf': 9, 'subsample': 0.8054963875962386, 'max_features': 'log2'}. Best is trial 1389 with value: 0.22332552856343169.
[I 2024-12-04 13:10:56,376] Trial 1518 finished with value: 0.2634944806123516 and parameters: {'n_estimators': 1475, 'learning_rate': 0.09835101560237534, 'max_depth': 9, 'min_samples_split': 6, 'min_samples_leaf': 1, 'subsample': 0.8715642383542661, 'max_features': 'sqrt'}. Best is trial 1389 with value: 0.22332552856343169.
[I 2024-12-04 13:10:56,468] Trial 1517 finished with value: 0.3069368124409807 and parameters: {'n_estimators': 1368, 'learning_rate': 0.09863543006544663, 'max_depth': 6, 'min_samples_split': 5, 'min_samples_leaf': 1, 'subsample': 0.7229018181396184, 'max_features': None}. Best is trial 1389 with value: 0.22332552856343169.
[I 2024-12-04 13:10:58,542] Trial 1528 finished with value: 0.2989785012477755 and parameters: {'n_estimators': 941, 'learning_rate': 0.07532629986995913, 'max_depth': 10, 'min_samples_split': 2, 'min_samples_leaf': 2, 'subsample': 0.6020291343113948, 'max_features': 'sqrt'}. Best is trial 1389 with value: 0.22332552856343169.
[I 2024-12-04 13:11:04,664] Trial 1524 finished with value: 0.2489803813292387 and parameters: {'n_estimators': 1251, 'learning_rate': 0.08199913544964384, 'max_depth': 5, 'min_samples_split': 3, 'min_samples_leaf': 1, 'subsample': 0.9445331416824244, 'max_features': 'sqrt'}. Best is trial 1389 with value: 0.22332552856343169.
[I 2024-12-04 13:11:06,543] Trial 1521 finished with value: 0.2591390404075336 and parameters: {'n_estimators': 1346, 'learning_rate': 0.06909931099584178, 'max_depth': 6, 'min_samples_split': 2, 'min_samples_leaf': 1, 'subsample': 0.8310529009490227, 'max_features': 'sqrt'}. Best is trial 1389 with value: 0.22332552856343169.
[I 2024-12-04 13:11:12,480] Trial 1520 finished with value: 0.2713940097544065 and parameters: {'n_estimators': 1487, 'learning_rate': 0.05806523924891544, 'max_depth': 5, 'min_samples_split': 3, 'min_samples_leaf': 1, 'subsample': 0.6661314953326849, 'max_features': 'sqrt'}. Best is trial 1389 with value: 0.22332552856343169.
[I 2024-12-04 13:11:14,446] Trial 1530 finished with value: 0.2507323470625439 and parameters: {'n_estimators': 1115, 'learning_rate': 0.07154726992593939, 'max_depth': 8, 'min_samples_split': 2, 'min_samples_leaf': 1, 'subsample': 0.7644527207138025, 'max_features': 'sqrt'}. Best is trial 1389 with value: 0.22332552856343169.
[I 2024-12-04 13:11:22,249] Trial 1531 finished with value: 0.3422018929425884 and parameters: {'n_estimators': 1173, 'learning_rate': 0.08370267269026398, 'max_depth': 10, 'min_samples_split': 2, 'min_samples_leaf': 3, 'subsample': 0.8300735306810288, 'max_features': 'sqrt'}. Best is trial 1389 with value: 0.22332552856343169.
[I 2024-12-04 13:11:25,039] Trial 1527 finished with value: 0.38256475069935597 and parameters: {'n_estimators': 1440, 'learning_rate': 0.04583621195021586, 'max_depth': 9, 'min_samples_split': 3, 'min_samples_leaf': 4, 'subsample': 0.8169378904975926, 'max_features': 'log2'}. Best is trial 1389 with value: 0.22332552856343169.
[I 2024-12-04 13:11:26,328] Trial 1525 finished with value: 0.2526051003785363 and parameters: {'n_estimators': 1478, 'learning_rate': 0.09147628759049667, 'max_depth': 7, 'min_samples_split': 8, 'min_samples_leaf': 1, 'subsample': 0.6504891656552478, 'max_features': 'sqrt'}. Best is trial 1389 with value: 0.22332552856343169.
[I 2024-12-04 13:11:26,903] Trial 1534 finished with value: 0.8546752307697978 and parameters: {'n_estimators': 1199, 'learning_rate': 0.016309157770188636, 'max_depth': 4, 'min_samples_split': 3, 'min_samples_leaf': 8, 'subsample': 0.9031591357642526, 'max_features': 'log2'}. Best is trial 1389 with value: 0.22332552856343169.
[I 2024-12-04 13:11:34,828] Trial 1533 finished with value: 0.2504581324078406 and parameters: {'n_estimators': 1312, 'learning_rate': 0.06450713168628484, 'max_depth': 12, 'min_samples_split': 2, 'min_samples_leaf': 1, 'subsample': 0.6236521097105767, 'max_features': 'sqrt'}. Best is trial 1389 with value: 0.22332552856343169.
[I 2024-12-04 13:11:36,520] Trial 1529 finished with value: 0.36092890852004234 and parameters: {'n_estimators': 1474, 'learning_rate': 0.06173607862900512, 'max_depth': 11, 'min_samples_split': 6, 'min_samples_leaf': 3, 'subsample': 0.6352914191849834, 'max_features': 'sqrt'}. Best is trial 1389 with value: 0.22332552856343169.
[I 2024-12-04 13:11:38,156] Trial 1542 finished with value: 0.3560375454450715 and parameters: {'n_estimators': 1050, 'learning_rate': 0.06289519630555823, 'max_depth': 7, 'min_samples_split': 6, 'min_samples_leaf': 3, 'subsample': 0.8818613605648711, 'max_features': 'sqrt'}. Best is trial 1389 with value: 0.22332552856343169.
[I 2024-12-04 13:11:41,295] Trial 1543 finished with value: 0.3482979119466166 and parameters: {'n_estimators': 1002, 'learning_rate': 0.05564385005071698, 'max_depth': 8, 'min_samples_split': 6, 'min_samples_leaf': 3, 'subsample': 0.8020771819946556, 'max_features': 'sqrt'}. Best is trial 1389 with value: 0.22332552856343169.
