[I 2024-12-03 19:22:44,625] Trial 2178 finished with value: 0.4655371435055836 and parameters: {'kernel': 'rbf', 'C': 4.680641960169598, 'gamma': 0.022406498792879728, 'epsilon': 0.2536411784412739}. Best is trial 88 with value: 0.3542875001421725.
[I 2024-12-03 19:22:45,834] Trial 2179 finished with value: 0.39330042831674966 and parameters: {'kernel': 'rbf', 'C': 22.996398361570687, 'gamma': 0.06702956745922818, 'epsilon': 0.07305459829609849}. Best is trial 88 with value: 0.3542875001421725.
[I 2024-12-03 19:22:46,673] Trial 2180 finished with value: 0.5279813245325752 and parameters: {'kernel': 'rbf', 'C': 3.5974176790103254, 'gamma': 0.14718904716169964, 'epsilon': 0.2236827189759556}. Best is trial 88 with value: 0.3542875001421725.
[I 2024-12-03 19:22:47,761] Trial 2174 finished with value: 0.7963450327921019 and parameters: {'kernel': 'linear', 'C': 7.251853654143606, 'gamma': 0.016650112978981498, 'epsilon': 0.020446804116947805}. Best is trial 88 with value: 0.3542875001421725.
[I 2024-12-03 19:22:47,853] Trial 1965 finished with value: 1.746079864226411 and parameters: {'kernel': 'poly', 'C': 20.166280907460425, 'gamma': 0.05140214836918292, 'epsilon': 0.04510996773971274}. Best is trial 88 with value: 0.3542875001421725.
[I 2024-12-03 19:22:48,261] Trial 2181 finished with value: 0.3624249304054692 and parameters: {'kernel': 'rbf', 'C': 96.48600003159476, 'gamma': 0.03183623863299525, 'epsilon': 0.2119284906094094}. Best is trial 88 with value: 0.3542875001421725.
[I 2024-12-03 19:22:49,308] Trial 2182 finished with value: 0.4594589728205771 and parameters: {'kernel': 'rbf', 'C': 99.5957546682423, 'gamma': 0.02433683079111133, 'epsilon': 0.6698630196676312}. Best is trial 88 with value: 0.3542875001421725.
[I 2024-12-03 19:22:50,131] Trial 2184 finished with value: 0.8983091787990573 and parameters: {'kernel': 'linear', 'C': 0.001451488431545746, 'gamma': 0.000169451827982099, 'epsilon': 0.018948321695753723}. Best is trial 88 with value: 0.3542875001421725.
[I 2024-12-03 19:22:50,279] Trial 2183 finished with value: 0.5081310477106933 and parameters: {'kernel': 'rbf', 'C': 95.14035887366812, 'gamma': 0.19017717516393767, 'epsilon': 0.13511171612116665}. Best is trial 88 with value: 0.3542875001421725.
[I 2024-12-03 19:22:50,980] Trial 2185 finished with value: 0.5705450942777325 and parameters: {'kernel': 'rbf', 'C': 23.840469398855017, 'gamma': 0.27044747436218536, 'epsilon': 0.12180469208083264}. Best is trial 88 with value: 0.3542875001421725.
[I 2024-12-03 19:22:51,629] Trial 2186 finished with value: 0.3847611025345599 and parameters: {'kernel': 'rbf', 'C': 96.95954933483452, 'gamma': 0.07937439695835119, 'epsilon': 0.11071211170087954}. Best is trial 88 with value: 0.3542875001421725.
[I 2024-12-03 19:22:52,517] Trial 2188 finished with value: 0.4027596221855591 and parameters: {'kernel': 'rbf', 'C': 95.2342380871791, 'gamma': 0.009861191392613506, 'epsilon': 0.3044168983748395}. Best is trial 88 with value: 0.3542875001421725.
[I 2024-12-03 19:22:53,029] Trial 2187 finished with value: 0.4005387131406015 and parameters: {'kernel': 'rbf', 'C': 18.439201251942148, 'gamma': 0.009984428022752774, 'epsilon': 0.040479045704055076}. Best is trial 88 with value: 0.3542875001421725.
[I 2024-12-03 19:22:53,182] Trial 2189 finished with value: 0.4701282520206063 and parameters: {'kernel': 'rbf', 'C': 27.710010380426276, 'gamma': 0.16630497911153877, 'epsilon': 0.055434294513819864}. Best is trial 88 with value: 0.3542875001421725.
[I 2024-12-03 19:22:54,669] Trial 2190 finished with value: 1665.3741474831868 and parameters: {'kernel': 'sigmoid', 'C': 78.82611639997843, 'gamma': 0.06860015749487437, 'epsilon': 0.08641422271958382}. Best is trial 88 with value: 0.3542875001421725.
[I 2024-12-03 19:22:55,604] Trial 2192 finished with value: 0.5146678764076972 and parameters: {'kernel': 'rbf', 'C': 95.13969797478255, 'gamma': 0.15387408361774987, 'epsilon': 0.2827702492334586}. Best is trial 88 with value: 0.3542875001421725.
[I 2024-12-03 19:22:55,800] Trial 2191 finished with value: 0.3768946051972874 and parameters: {'kernel': 'rbf', 'C': 96.36280096523981, 'gamma': 0.01879317082273883, 'epsilon': 0.07189620040924592}. Best is trial 88 with value: 0.3542875001421725.
[I 2024-12-03 19:22:56,090] Trial 2193 finished with value: 0.4305014578031989 and parameters: {'kernel': 'rbf', 'C': 15.725636604407043, 'gamma': 0.005557569017116264, 'epsilon': 0.21954461109121995}. Best is trial 88 with value: 0.3542875001421725.
[I 2024-12-03 19:22:57,646] Trial 2194 finished with value: 0.41148718623788655 and parameters: {'kernel': 'rbf', 'C': 99.58861224820267, 'gamma': 0.006604630639839658, 'epsilon': 0.01982508353059425}. Best is trial 88 with value: 0.3542875001421725.
[I 2024-12-03 19:22:58,312] Trial 2195 finished with value: 0.3807081051212988 and parameters: {'kernel': 'rbf', 'C': 33.17439519854037, 'gamma': 0.0401458159534971, 'epsilon': 0.24797913618363063}. Best is trial 88 with value: 0.3542875001421725.
[I 2024-12-03 19:22:58,581] Trial 2196 finished with value: 0.38751783173395404 and parameters: {'kernel': 'rbf', 'C': 94.60003369849015, 'gamma': 0.0869045742109249, 'epsilon': 0.10963658272239282}. Best is trial 88 with value: 0.3542875001421725.
[I 2024-12-03 19:23:00,627] Trial 2200 finished with value: 0.6298715834898182 and parameters: {'kernel': 'rbf', 'C': 22.822859572649747, 'gamma': 0.26740066873450685, 'epsilon': 0.3750734722287408}. Best is trial 88 with value: 0.3542875001421725.
[I 2024-12-03 19:23:02,520] Trial 2201 finished with value: 0.6046045289637844 and parameters: {'kernel': 'rbf', 'C': 98.61619878446001, 'gamma': 0.33384323790468146, 'epsilon': 0.09887863083930142}. Best is trial 88 with value: 0.3542875001421725.
[I 2024-12-03 19:23:05,312] Trial 2202 finished with value: 0.38356230709963657 and parameters: {'kernel': 'rbf', 'C': 93.56111467892026, 'gamma': 0.0680871299801224, 'epsilon': 0.028135831264065513}. Best is trial 88 with value: 0.3542875001421725.
[I 2024-12-03 19:23:06,700] Trial 2203 finished with value: 0.4130415583311631 and parameters: {'kernel': 'rbf', 'C': 19.51231964297262, 'gamma': 0.04368516418454701, 'epsilon': 0.05758581986878872}. Best is trial 88 with value: 0.3542875001421725.
[I 2024-12-03 19:23:08,271] Trial 2204 finished with value: 0.40602295735080807 and parameters: {'kernel': 'rbf', 'C': 26.997238064386334, 'gamma': 0.06650704213337681, 'epsilon': 0.288853363214115}. Best is trial 88 with value: 0.3542875001421725.
[I 2024-12-03 19:23:09,068] Trial 2197 finished with value: 0.8000660499978535 and parameters: {'kernel': 'poly', 'C': 22.36543250359028, 'gamma': 0.02649120096812972, 'epsilon': 0.08985215269728505}. Best is trial 88 with value: 0.3542875001421725.
[I 2024-12-03 19:23:09,701] Trial 2205 finished with value: 0.4191684085217007 and parameters: {'kernel': 'rbf', 'C': 19.72728983874458, 'gamma': 0.027104618391637317, 'epsilon': 0.09981889003505284}. Best is trial 88 with value: 0.3542875001421725.
[I 2024-12-03 19:23:10,489] Trial 2206 finished with value: 0.3684767086481533 and parameters: {'kernel': 'rbf', 'C': 98.51386643159205, 'gamma': 0.026242300836887358, 'epsilon': 0.23080231503924295}. Best is trial 88 with value: 0.3542875001421725.
[I 2024-12-03 19:23:11,284] Trial 2207 finished with value: 0.4288033869415095 and parameters: {'kernel': 'rbf', 'C': 21.0891904642887, 'gamma': 0.034426569732756776, 'epsilon': 0.4671403366649986}. Best is trial 88 with value: 0.3542875001421725.
[I 2024-12-03 19:23:12,383] Trial 2208 finished with value: 0.38972769581788946 and parameters: {'kernel': 'rbf', 'C': 95.02018654393025, 'gamma': 0.08876387189649648, 'epsilon': 0.08670927020399892}. Best is trial 88 with value: 0.3542875001421725.
[I 2024-12-03 19:23:12,842] Trial 2209 finished with value: 0.5998890013430315 and parameters: {'kernel': 'rbf', 'C': 97.45184368299195, 'gamma': 0.23489002445305318, 'epsilon': 0.33951628699683795}. Best is trial 88 with value: 0.3542875001421725.
[I 2024-12-03 19:23:14,059] Trial 2210 finished with value: 1.4785996079316845 and parameters: {'kernel': 'poly', 'C': 0.018542756406649857, 'gamma': 0.006937127534258694, 'epsilon': 0.19748645903642445}. Best is trial 88 with value: 0.3542875001421725.
[I 2024-12-03 19:23:14,667] Trial 2211 finished with value: 0.4058204236276044 and parameters: {'kernel': 'rbf', 'C': 19.118520042021835, 'gamma': 0.011539894711086551, 'epsilon': 0.11744542617931196}. Best is trial 88 with value: 0.3542875001421725.
[I 2024-12-03 19:23:15,441] Trial 2212 finished with value: 0.37586306129243735 and parameters: {'kernel': 'rbf', 'C': 99.2991815507218, 'gamma': 0.053548095559640255, 'epsilon': 0.2798592814104471}. Best is trial 88 with value: 0.3542875001421725.
[I 2024-12-03 19:23:16,487] Trial 2213 finished with value: 0.4153029421739528 and parameters: {'kernel': 'rbf', 'C': 97.17454700654895, 'gamma': 0.009251498454652684, 'epsilon': 0.15106043915577694}. Best is trial 88 with value: 0.3542875001421725.
[I 2024-12-03 19:23:17,106] Trial 2214 finished with value: 0.3809294187292662 and parameters: {'kernel': 'rbf', 'C': 31.501732790528823, 'gamma': 0.05841400113539447, 'epsilon': 0.12481911292604274}. Best is trial 88 with value: 0.3542875001421725.
[I 2024-12-03 19:23:18,104] Trial 2215 finished with value: 0.41035138936244425 and parameters: {'kernel': 'rbf', 'C': 26.921903526470544, 'gamma': 0.022446653223334022, 'epsilon': 0.14749343507870613}. Best is trial 88 with value: 0.3542875001421725.
[I 2024-12-03 19:23:18,716] Trial 2216 finished with value: 1.096011362033305 and parameters: {'kernel': 'poly', 'C': 0.00244858143127846, 'gamma': 0.0006143858690322957, 'epsilon': 0.8842081046142445}. Best is trial 88 with value: 0.3542875001421725.
[I 2024-12-03 19:23:19,867] Trial 2217 finished with value: 0.41802988063954505 and parameters: {'kernel': 'rbf', 'C': 19.68069055041459, 'gamma': 0.015087596811435944, 'epsilon': 0.02964273084982741}. Best is trial 88 with value: 0.3542875001421725.
[I 2024-12-03 19:23:20,820] Trial 2218 finished with value: 0.40925290123569574 and parameters: {'kernel': 'rbf', 'C': 98.57619830805473, 'gamma': 0.011785955524841204, 'epsilon': 0.06910158467803174}. Best is trial 88 with value: 0.3542875001421725.
[I 2024-12-03 19:23:21,429] Trial 2219 finished with value: 0.49480320719536136 and parameters: {'kernel': 'rbf', 'C': 18.86662973054233, 'gamma': 0.17483213650562698, 'epsilon': 0.12456841640557731}. Best is trial 88 with value: 0.3542875001421725.
[I 2024-12-03 19:23:22,481] Trial 2220 finished with value: 121.66002593276163 and parameters: {'kernel': 'sigmoid', 'C': 13.265185190078965, 'gamma': 0.007047884449521936, 'epsilon': 0.035552875874791036}. Best is trial 88 with value: 0.3542875001421725.
[I 2024-12-03 19:23:23,149] Trial 2221 finished with value: 1980.009572652559 and parameters: {'kernel': 'sigmoid', 'C': 96.27938411567342, 'gamma': 0.1033909642316376, 'epsilon': 0.3137175564711058}. Best is trial 88 with value: 0.3542875001421725.
[I 2024-12-03 19:23:24,199] Trial 2222 finished with value: 8.314103694580835 and parameters: {'kernel': 'sigmoid', 'C': 15.98407914015741, 'gamma': 0.0009201363365080541, 'epsilon': 0.0012102842773431197}. Best is trial 88 with value: 0.3542875001421725.
[I 2024-12-03 19:23:24,800] Trial 2223 finished with value: 0.3778920123909793 and parameters: {'kernel': 'rbf', 'C': 99.05022283666085, 'gamma': 0.07004582767625281, 'epsilon': 0.13176125938062877}. Best is trial 88 with value: 0.3542875001421725.
[I 2024-12-03 19:23:25,923] Trial 2224 finished with value: 240.05844426283582 and parameters: {'kernel': 'sigmoid', 'C': 12.07720698924109, 'gamma': 0.033894877540756214, 'epsilon': 0.03744113303224309}. Best is trial 88 with value: 0.3542875001421725.
[I 2024-12-03 19:23:26,533] Trial 2225 finished with value: 0.4316651671881878 and parameters: {'kernel': 'rbf', 'C': 95.57695165080933, 'gamma': 0.09387948019147843, 'epsilon': 0.2779434067347812}. Best is trial 88 with value: 0.3542875001421725.
[I 2024-12-03 19:23:27,612] Trial 2226 finished with value: 0.4219278544781426 and parameters: {'kernel': 'rbf', 'C': 24.001776364128553, 'gamma': 0.028653776851414837, 'epsilon': 0.04980987560573637}. Best is trial 88 with value: 0.3542875001421725.
[I 2024-12-03 19:23:28,527] Trial 2227 finished with value: 0.4128244174276982 and parameters: {'kernel': 'rbf', 'C': 87.99031578370408, 'gamma': 0.11968785707188162, 'epsilon': 0.02988765781469331}. Best is trial 88 with value: 0.3542875001421725.
[I 2024-12-03 19:23:29,138] Trial 2228 finished with value: 0.4057738166471438 and parameters: {'kernel': 'rbf', 'C': 19.112193503650893, 'gamma': 0.023619107710523893, 'epsilon': 0.2820127146625201}. Best is trial 88 with value: 0.3542875001421725.
[I 2024-12-03 19:23:30,247] Trial 2229 finished with value: 0.35825313888257515 and parameters: {'kernel': 'rbf', 'C': 98.21009992721493, 'gamma': 0.03966221077011193, 'epsilon': 0.11153800905316463}. Best is trial 88 with value: 0.3542875001421725.
[I 2024-12-03 19:23:31,197] Trial 2230 finished with value: 0.5040516006213962 and parameters: {'kernel': 'rbf', 'C': 20.996820501802368, 'gamma': 0.2018968996986185, 'epsilon': 0.04501508969583844}. Best is trial 88 with value: 0.3542875001421725.
[I 2024-12-03 19:23:31,804] Trial 2231 finished with value: 0.39469116914335295 and parameters: {'kernel': 'rbf', 'C': 23.751192453759682, 'gamma': 0.06122336794404147, 'epsilon': 0.20001734560304404}. Best is trial 88 with value: 0.3542875001421725.
[I 2024-12-03 19:23:32,559] Trial 2232 finished with value: 0.7740746466387598 and parameters: {'kernel': 'rbf', 'C': 27.099364212821214, 'gamma': 0.08579614229212044, 'epsilon': 0.9987833333514133}. Best is trial 88 with value: 0.3542875001421725.
[I 2024-12-03 19:23:33,665] Trial 2233 finished with value: 0.3568667890332875 and parameters: {'kernel': 'rbf', 'C': 96.50822427002511, 'gamma': 0.0457068571453061, 'epsilon': 0.0824625349439568}. Best is trial 88 with value: 0.3542875001421725.
[I 2024-12-03 19:23:34,254] Trial 2234 finished with value: 0.3991880867476914 and parameters: {'kernel': 'rbf', 'C': 99.62546920544094, 'gamma': 0.010804147067509463, 'epsilon': 0.20120573994311267}. Best is trial 88 with value: 0.3542875001421725.
[I 2024-12-03 19:23:35,332] Trial 2235 finished with value: 0.407149334723449 and parameters: {'kernel': 'rbf', 'C': 18.596138332395665, 'gamma': 0.011902493257951782, 'epsilon': 0.11807567565987523}. Best is trial 88 with value: 0.3542875001421725.
[I 2024-12-03 19:23:35,937] Trial 2236 finished with value: 0.39989447882804324 and parameters: {'kernel': 'rbf', 'C': 96.37410778989033, 'gamma': 0.055977056994266756, 'epsilon': 0.35677652418998795}. Best is trial 88 with value: 0.3542875001421725.
[I 2024-12-03 19:23:36,676] Trial 2237 finished with value: 0.4420783874151897 and parameters: {'kernel': 'rbf', 'C': 16.564244449568502, 'gamma': 0.007802031720045411, 'epsilon': 0.3696767666088618}. Best is trial 88 with value: 0.3542875001421725.
[I 2024-12-03 19:23:37,625] Trial 2238 finished with value: 0.37074475417449465 and parameters: {'kernel': 'rbf', 'C': 98.33907449499203, 'gamma': 0.02221627922262961, 'epsilon': 0.18078634083540868}. Best is trial 88 with value: 0.3542875001421725.
[I 2024-12-03 19:23:38,471] Trial 2239 finished with value: 0.4526352365382179 and parameters: {'kernel': 'rbf', 'C': 4.156828952995098, 'gamma': 0.03241077926201107, 'epsilon': 0.05883072603348057}. Best is trial 88 with value: 0.3542875001421725.
[I 2024-12-03 19:23:39,055] Trial 2240 finished with value: 0.467497013219156 and parameters: {'kernel': 'rbf', 'C': 4.009914847032299, 'gamma': 0.05895347047046262, 'epsilon': 0.15292196209874395}. Best is trial 88 with value: 0.3542875001421725.
[I 2024-12-03 19:23:40,209] Trial 2241 finished with value: 0.9383801065484223 and parameters: {'kernel': 'sigmoid', 'C': 0.3846269188245794, 'gamma': 0.0010018474262704466, 'epsilon': 0.06281043211840422}. Best is trial 88 with value: 0.3542875001421725.
[I 2024-12-03 19:23:41,047] Trial 2242 finished with value: 0.3880851008430203 and parameters: {'kernel': 'rbf', 'C': 25.2347566833681, 'gamma': 0.04842350564424891, 'epsilon': 0.09374772970728083}. Best is trial 88 with value: 0.3542875001421725.
[I 2024-12-03 19:23:41,878] Trial 2243 finished with value: 0.4779079305105168 and parameters: {'kernel': 'rbf', 'C': 16.995211391825055, 'gamma': 0.1625329093677233, 'epsilon': 0.06398452344204636}. Best is trial 88 with value: 0.3542875001421725.
[I 2024-12-03 19:23:43,179] Trial 2244 finished with value: 0.43401425150612993 and parameters: {'kernel': 'rbf', 'C': 24.78786250272847, 'gamma': 0.01500846301780673, 'epsilon': 0.09855368715002295}. Best is trial 88 with value: 0.3542875001421725.
[I 2024-12-03 19:23:43,771] Trial 2245 finished with value: 0.5110563219355885 and parameters: {'kernel': 'rbf', 'C': 97.13296533405006, 'gamma': 0.19352319289480452, 'epsilon': 0.13348713603944612}. Best is trial 88 with value: 0.3542875001421725.
[I 2024-12-03 19:23:46,150] Trial 2247 finished with value: 2.9535773857389933 and parameters: {'kernel': 'poly', 'C': 0.14149193296333196, 'gamma': 0.06045814844087017, 'epsilon': 0.1766003501768252}. Best is trial 88 with value: 0.3542875001421725.
[I 2024-12-03 19:23:47,948] Trial 2248 finished with value: 0.434328473755838 and parameters: {'kernel': 'rbf', 'C': 17.77512190895922, 'gamma': 0.10211456554267707, 'epsilon': 0.20312976699985688}. Best is trial 88 with value: 0.3542875001421725.
[I 2024-12-03 19:23:49,900] Trial 2249 finished with value: 0.3650524180242511 and parameters: {'kernel': 'rbf', 'C': 99.58752909092752, 'gamma': 0.04163582237117685, 'epsilon': 0.04710414225123184}. Best is trial 88 with value: 0.3542875001421725.
[I 2024-12-03 19:23:51,720] Trial 2250 finished with value: 0.39727117661809846 and parameters: {'kernel': 'rbf', 'C': 23.046496689583844, 'gamma': 0.07039233386513787, 'epsilon': 0.028289367046960754}. Best is trial 88 with value: 0.3542875001421725.
[I 2024-12-03 19:23:52,947] Trial 2251 finished with value: 0.41201574700907234 and parameters: {'kernel': 'rbf', 'C': 16.223516814288708, 'gamma': 0.028433999865850837, 'epsilon': 0.31910504166542547}. Best is trial 88 with value: 0.3542875001421725.
[I 2024-12-03 19:23:54,362] Trial 2252 finished with value: 0.43758072048826174 and parameters: {'kernel': 'rbf', 'C': 24.901053483844528, 'gamma': 0.12741273947069592, 'epsilon': 0.09057784507307823}. Best is trial 88 with value: 0.3542875001421725.
[I 2024-12-03 19:23:55,624] Trial 2253 finished with value: 0.3984323288659787 and parameters: {'kernel': 'rbf', 'C': 18.655781809539583, 'gamma': 0.04689110824685231, 'epsilon': 0.18805525267435869}. Best is trial 88 with value: 0.3542875001421725.
[I 2024-12-03 19:23:56,945] Trial 2254 finished with value: 0.40253238685919257 and parameters: {'kernel': 'rbf', 'C': 25.642720776251416, 'gamma': 0.027502154583378565, 'epsilon': 0.15540268921015335}. Best is trial 88 with value: 0.3542875001421725.
[I 2024-12-03 19:23:58,434] Trial 2255 finished with value: 0.8010439886273074 and parameters: {'kernel': 'rbf', 'C': 1.9394041598117118, 'gamma': 0.8774471874106059, 'epsilon': 0.02956682550554181}. Best is trial 88 with value: 0.3542875001421725.
[I 2024-12-03 19:23:59,925] Trial 2256 finished with value: 0.40139605126998923 and parameters: {'kernel': 'rbf', 'C': 24.049233744223468, 'gamma': 0.03908445097358854, 'epsilon': 0.08665453120463565}. Best is trial 88 with value: 0.3542875001421725.
[I 2024-12-03 19:24:01,736] Trial 2257 finished with value: 0.4041142114091949 and parameters: {'kernel': 'rbf', 'C': 99.79054055153296, 'gamma': 0.012777997117431099, 'epsilon': 0.060730679115035734}. Best is trial 88 with value: 0.3542875001421725.
[I 2024-12-03 19:24:03,020] Trial 2258 finished with value: 0.3621301532942146 and parameters: {'kernel': 'rbf', 'C': 99.85145726855683, 'gamma': 0.031442464023689165, 'epsilon': 0.2299153109150023}. Best is trial 88 with value: 0.3542875001421725.
[I 2024-12-03 19:24:04,500] Trial 2259 finished with value: 0.6216566429212039 and parameters: {'kernel': 'rbf', 'C': 94.19283448772654, 'gamma': 0.38131142776079313, 'epsilon': 0.04642120913479426}. Best is trial 88 with value: 0.3542875001421725.
[I 2024-12-03 19:24:05,764] Trial 2260 finished with value: 0.4775429627365511 and parameters: {'kernel': 'rbf', 'C': 22.967918757526686, 'gamma': 0.13058329000618316, 'epsilon': 0.24341106702045093}. Best is trial 88 with value: 0.3542875001421725.
[I 2024-12-03 19:24:07,328] Trial 2261 finished with value: 0.4327232664529093 and parameters: {'kernel': 'rbf', 'C': 15.399837009538057, 'gamma': 0.02544774774839808, 'epsilon': 0.043219000862619844}. Best is trial 88 with value: 0.3542875001421725.
[I 2024-12-03 19:24:09,036] Trial 2262 finished with value: 0.35958298489454593 and parameters: {'kernel': 'rbf', 'C': 87.67295453911647, 'gamma': 0.04755809571296093, 'epsilon': 0.062139229493692424}. Best is trial 88 with value: 0.3542875001421725.
[I 2024-12-03 19:24:10,505] Trial 2263 finished with value: 0.39912485585006696 and parameters: {'kernel': 'rbf', 'C': 93.15531978408707, 'gamma': 0.10358970443047438, 'epsilon': 0.07961455206192387}. Best is trial 88 with value: 0.3542875001421725.
[I 2024-12-03 19:24:12,107] Trial 2264 finished with value: 0.3671548405414303 and parameters: {'kernel': 'rbf', 'C': 91.0287026921841, 'gamma': 0.02953506602743441, 'epsilon': 0.0810215861699875}. Best is trial 88 with value: 0.3542875001421725.
[I 2024-12-03 19:24:13,336] Trial 2265 finished with value: 0.48293827923358923 and parameters: {'kernel': 'rbf', 'C': 7.265861302598073, 'gamma': 0.002979131953816206, 'epsilon': 0.06806642873072598}. Best is trial 88 with value: 0.3542875001421725.
