[I 2024-12-04 12:09:53,688] Trial 1152 finished with value: 0.4991182630592808 and parameters: {'n_estimators': 495, 'max_depth': 18, 'min_samples_split': 2, 'min_samples_leaf': 1, 'max_features': 'sqrt', 'bootstrap': True, 'criterion': 'squared_error'}. Best is trial 341 with value: 0.2909369124469028.
[I 2024-12-04 12:09:54,061] Trial 1155 finished with value: 0.3279566775300324 and parameters: {'n_estimators': 674, 'max_depth': 36, 'min_samples_split': 2, 'min_samples_leaf': 1, 'max_features': 'sqrt', 'bootstrap': False, 'criterion': 'squared_error'}. Best is trial 341 with value: 0.2909369124469028.
[I 2024-12-04 12:09:54,478] Trial 1154 finished with value: 0.3037070109497397 and parameters: {'n_estimators': 554, 'max_depth': 50, 'min_samples_split': 5, 'min_samples_leaf': 1, 'max_features': 'sqrt', 'bootstrap': False, 'criterion': 'squared_error'}. Best is trial 341 with value: 0.2909369124469028.
[I 2024-12-04 12:09:55,163] Trial 1159 finished with value: 0.4823925272975856 and parameters: {'n_estimators': 693, 'max_depth': 50, 'min_samples_split': 6, 'min_samples_leaf': 2, 'max_features': 'sqrt', 'bootstrap': True, 'criterion': 'squared_error'}. Best is trial 341 with value: 0.2909369124469028.
[I 2024-12-04 12:09:55,183] Trial 1156 finished with value: 0.30177526858426323 and parameters: {'n_estimators': 593, 'max_depth': 48, 'min_samples_split': 4, 'min_samples_leaf': 1, 'max_features': 'sqrt', 'bootstrap': False, 'criterion': 'squared_error'}. Best is trial 341 with value: 0.2909369124469028.
[I 2024-12-04 12:09:56,059] Trial 1161 finished with value: 0.44158939207451914 and parameters: {'n_estimators': 656, 'max_depth': 50, 'min_samples_split': 2, 'min_samples_leaf': 2, 'max_features': 'sqrt', 'bootstrap': False, 'criterion': 'squared_error'}. Best is trial 341 with value: 0.2909369124469028.
[I 2024-12-04 12:09:57,028] Trial 1158 finished with value: 0.4438890250473082 and parameters: {'n_estimators': 576, 'max_depth': 41, 'min_samples_split': 2, 'min_samples_leaf': 2, 'max_features': 'sqrt', 'bootstrap': False, 'criterion': 'squared_error'}. Best is trial 341 with value: 0.2909369124469028.
[I 2024-12-04 12:09:58,931] Trial 1148 finished with value: 0.3846740418074029 and parameters: {'n_estimators': 519, 'max_depth': 47, 'min_samples_split': 4, 'min_samples_leaf': 1, 'max_features': None, 'bootstrap': False, 'criterion': 'squared_error'}. Best is trial 341 with value: 0.2909369124469028.
[I 2024-12-04 12:09:59,779] Trial 985 finished with value: 0.4203096379729189 and parameters: {'n_estimators': 760, 'max_depth': 42, 'min_samples_split': 8, 'min_samples_leaf': 1, 'max_features': None, 'bootstrap': False, 'criterion': 'absolute_error'}. Best is trial 341 with value: 0.2909369124469028.
[I 2024-12-04 12:09:59,827] Trial 1153 finished with value: 0.4483142913196451 and parameters: {'n_estimators': 707, 'max_depth': 39, 'min_samples_split': 2, 'min_samples_leaf': 2, 'max_features': 'sqrt', 'bootstrap': False, 'criterion': 'squared_error'}. Best is trial 341 with value: 0.2909369124469028.
[I 2024-12-04 12:10:00,837] Trial 1162 finished with value: 0.29180157781345084 and parameters: {'n_estimators': 531, 'max_depth': 49, 'min_samples_split': 3, 'min_samples_leaf': 1, 'max_features': 'sqrt', 'bootstrap': False, 'criterion': 'squared_error'}. Best is trial 341 with value: 0.2909369124469028.
[I 2024-12-04 12:10:01,368] Trial 1166 finished with value: 0.32652959110976726 and parameters: {'n_estimators': 431, 'max_depth': 50, 'min_samples_split': 5, 'min_samples_leaf': 1, 'max_features': 'sqrt', 'bootstrap': True, 'criterion': 'squared_error'}. Best is trial 341 with value: 0.2909369124469028.
[I 2024-12-04 12:10:01,449] Trial 1160 finished with value: 0.2996183075359618 and parameters: {'n_estimators': 524, 'max_depth': 44, 'min_samples_split': 3, 'min_samples_leaf': 1, 'max_features': 'sqrt', 'bootstrap': False, 'criterion': 'squared_error'}. Best is trial 341 with value: 0.2909369124469028.
[I 2024-12-04 12:10:01,704] Trial 1167 finished with value: 0.9620148429531977 and parameters: {'n_estimators': 705, 'max_depth': 34, 'min_samples_split': 4, 'min_samples_leaf': 15, 'max_features': 'log2', 'bootstrap': False, 'criterion': 'absolute_error'}. Best is trial 341 with value: 0.2909369124469028.
[I 2024-12-04 12:10:03,508] Trial 1173 finished with value: 0.3038152937316915 and parameters: {'n_estimators': 223, 'max_depth': 41, 'min_samples_split': 3, 'min_samples_leaf': 1, 'max_features': 'sqrt', 'bootstrap': False, 'criterion': 'squared_error'}. Best is trial 341 with value: 0.2909369124469028.
[I 2024-12-04 12:10:04,250] Trial 1164 finished with value: 0.2940618660110476 and parameters: {'n_estimators': 611, 'max_depth': 50, 'min_samples_split': 3, 'min_samples_leaf': 1, 'max_features': 'sqrt', 'bootstrap': False, 'criterion': 'squared_error'}. Best is trial 341 with value: 0.2909369124469028.
[I 2024-12-04 12:10:04,786] Trial 1169 finished with value: 0.44016282096281484 and parameters: {'n_estimators': 424, 'max_depth': 49, 'min_samples_split': 2, 'min_samples_leaf': 2, 'max_features': 'sqrt', 'bootstrap': False, 'criterion': 'squared_error'}. Best is trial 341 with value: 0.2909369124469028.
[I 2024-12-04 12:10:07,763] Trial 1172 finished with value: 0.29414092378394674 and parameters: {'n_estimators': 642, 'max_depth': 50, 'min_samples_split': 3, 'min_samples_leaf': 1, 'max_features': 'sqrt', 'bootstrap': False, 'criterion': 'squared_error'}. Best is trial 341 with value: 0.2909369124469028.
[I 2024-12-04 12:10:08,450] Trial 1170 finished with value: 0.3015295530847772 and parameters: {'n_estimators': 504, 'max_depth': 43, 'min_samples_split': 3, 'min_samples_leaf': 1, 'max_features': 'sqrt', 'bootstrap': False, 'criterion': 'squared_error'}. Best is trial 341 with value: 0.2909369124469028.
[I 2024-12-04 12:10:08,536] Trial 1163 finished with value: 0.4290834211527363 and parameters: {'n_estimators': 926, 'max_depth': 27, 'min_samples_split': 35, 'min_samples_leaf': 1, 'max_features': None, 'bootstrap': False, 'criterion': 'squared_error'}. Best is trial 341 with value: 0.2909369124469028.
[I 2024-12-04 12:10:09,220] Trial 1168 finished with value: 0.44140745215893834 and parameters: {'n_estimators': 411, 'max_depth': 50, 'min_samples_split': 4, 'min_samples_leaf': 2, 'max_features': 'sqrt', 'bootstrap': False, 'criterion': 'squared_error'}. Best is trial 341 with value: 0.2909369124469028.
[I 2024-12-04 12:10:12,956] Trial 1165 finished with value: 0.5913562329910387 and parameters: {'n_estimators': 873, 'max_depth': 20, 'min_samples_split': 2, 'min_samples_leaf': 4, 'max_features': 'sqrt', 'bootstrap': False, 'criterion': 'absolute_error'}. Best is trial 341 with value: 0.2909369124469028.
[I 2024-12-04 12:10:13,432] Trial 1179 finished with value: 0.47853577933688246 and parameters: {'n_estimators': 568, 'max_depth': 39, 'min_samples_split': 2, 'min_samples_leaf': 2, 'max_features': 'sqrt', 'bootstrap': True, 'criterion': 'squared_error'}. Best is trial 341 with value: 0.2909369124469028.
[I 2024-12-04 12:10:14,299] Trial 1183 finished with value: 0.3006826820293791 and parameters: {'n_estimators': 602, 'max_depth': 50, 'min_samples_split': 4, 'min_samples_leaf': 1, 'max_features': 'sqrt', 'bootstrap': False, 'criterion': 'squared_error'}. Best is trial 341 with value: 0.2909369124469028.
[I 2024-12-04 12:10:14,366] Trial 1176 finished with value: 0.3036988656518266 and parameters: {'n_estimators': 553, 'max_depth': 50, 'min_samples_split': 5, 'min_samples_leaf': 1, 'max_features': 'sqrt', 'bootstrap': False, 'criterion': 'squared_error'}. Best is trial 341 with value: 0.2909369124469028.
[I 2024-12-04 12:10:15,415] Trial 1182 finished with value: 0.4417472910511334 and parameters: {'n_estimators': 574, 'max_depth': 46, 'min_samples_split': 4, 'min_samples_leaf': 2, 'max_features': 'sqrt', 'bootstrap': False, 'criterion': 'squared_error'}. Best is trial 341 with value: 0.2909369124469028.
[I 2024-12-04 12:10:16,048] Trial 1181 finished with value: 0.3010380053306098 and parameters: {'n_estimators': 529, 'max_depth': 48, 'min_samples_split': 4, 'min_samples_leaf': 1, 'max_features': 'sqrt', 'bootstrap': False, 'criterion': 'squared_error'}. Best is trial 341 with value: 0.2909369124469028.
[I 2024-12-04 12:10:16,067] Trial 1174 finished with value: 0.30540788278620745 and parameters: {'n_estimators': 599, 'max_depth': 44, 'min_samples_split': 2, 'min_samples_leaf': 1, 'max_features': 'sqrt', 'bootstrap': False, 'criterion': 'squared_error'}. Best is trial 341 with value: 0.2909369124469028.
[I 2024-12-04 12:10:16,423] Trial 1171 finished with value: 0.5025403815937457 and parameters: {'n_estimators': 807, 'max_depth': 17, 'min_samples_split': 4, 'min_samples_leaf': 10, 'max_features': None, 'bootstrap': True, 'criterion': 'squared_error'}. Best is trial 341 with value: 0.2909369124469028.
[I 2024-12-04 12:10:16,441] Trial 1180 finished with value: 0.29660505888855526 and parameters: {'n_estimators': 626, 'max_depth': 49, 'min_samples_split': 2, 'min_samples_leaf': 1, 'max_features': 'sqrt', 'bootstrap': False, 'criterion': 'squared_error'}. Best is trial 341 with value: 0.2909369124469028.
[I 2024-12-04 12:10:16,748] Trial 1184 finished with value: 0.3264571390797287 and parameters: {'n_estimators': 266, 'max_depth': 36, 'min_samples_split': 3, 'min_samples_leaf': 1, 'max_features': None, 'bootstrap': True, 'criterion': 'squared_error'}. Best is trial 341 with value: 0.2909369124469028.
[I 2024-12-04 12:10:18,764] Trial 1177 finished with value: 0.9375240625791588 and parameters: {'n_estimators': 409, 'max_depth': 23, 'min_samples_split': 40, 'min_samples_leaf': 5, 'max_features': 'log2', 'bootstrap': True, 'criterion': 'absolute_error'}. Best is trial 341 with value: 0.2909369124469028.
[I 2024-12-04 12:10:24,095] Trial 1178 finished with value: 0.31488978212479757 and parameters: {'n_estimators': 637, 'max_depth': 49, 'min_samples_split': 2, 'min_samples_leaf': 1, 'max_features': 'sqrt', 'bootstrap': True, 'criterion': 'squared_error'}. Best is trial 341 with value: 0.2909369124469028.
[I 2024-12-04 12:10:24,683] Trial 1185 finished with value: 0.36454533047614357 and parameters: {'n_estimators': 126, 'max_depth': 31, 'min_samples_split': 3, 'min_samples_leaf': 1, 'max_features': 'sqrt', 'bootstrap': False, 'criterion': 'absolute_error'}. Best is trial 341 with value: 0.2909369124469028.
[I 2024-12-04 12:10:25,664] Trial 1190 finished with value: 0.3106070050255522 and parameters: {'n_estimators': 466, 'max_depth': 42, 'min_samples_split': 4, 'min_samples_leaf': 1, 'max_features': 'sqrt', 'bootstrap': False, 'criterion': 'squared_error'}. Best is trial 341 with value: 0.2909369124469028.
[I 2024-12-04 12:10:26,291] Trial 1191 finished with value: 0.2982454337138236 and parameters: {'n_estimators': 523, 'max_depth': 50, 'min_samples_split': 2, 'min_samples_leaf': 1, 'max_features': 'sqrt', 'bootstrap': False, 'criterion': 'squared_error'}. Best is trial 341 with value: 0.2909369124469028.
[I 2024-12-04 12:10:26,376] Trial 1186 finished with value: 0.4298426101700776 and parameters: {'n_estimators': 629, 'max_depth': 37, 'min_samples_split': 11, 'min_samples_leaf': 2, 'max_features': None, 'bootstrap': False, 'criterion': 'squared_error'}. Best is trial 341 with value: 0.2909369124469028.
[I 2024-12-04 12:10:26,838] Trial 1195 finished with value: 0.2939563055007028 and parameters: {'n_estimators': 499, 'max_depth': 48, 'min_samples_split': 3, 'min_samples_leaf': 1, 'max_features': 'sqrt', 'bootstrap': False, 'criterion': 'squared_error'}. Best is trial 341 with value: 0.2909369124469028.
[I 2024-12-04 12:10:26,906] Trial 1187 finished with value: 0.3078622120131519 and parameters: {'n_estimators': 560, 'max_depth': 40, 'min_samples_split': 3, 'min_samples_leaf': 1, 'max_features': 'sqrt', 'bootstrap': False, 'criterion': 'squared_error'}. Best is trial 341 with value: 0.2909369124469028.
[I 2024-12-04 12:10:28,154] Trial 1175 finished with value: 0.3519914967550478 and parameters: {'n_estimators': 512, 'max_depth': 37, 'min_samples_split': 8, 'min_samples_leaf': 1, 'max_features': 'sqrt', 'bootstrap': False, 'criterion': 'absolute_error'}. Best is trial 341 with value: 0.2909369124469028.
[I 2024-12-04 12:10:28,628] Trial 1192 finished with value: 0.443502354800382 and parameters: {'n_estimators': 911, 'max_depth': 46, 'min_samples_split': 2, 'min_samples_leaf': 2, 'max_features': 'sqrt', 'bootstrap': False, 'criterion': 'squared_error'}. Best is trial 341 with value: 0.2909369124469028.
[I 2024-12-04 12:10:28,711] Trial 1196 finished with value: 0.4047995028617614 and parameters: {'n_estimators': 671, 'max_depth': 44, 'min_samples_split': 2, 'min_samples_leaf': 1, 'max_features': 'log2', 'bootstrap': False, 'criterion': 'squared_error'}. Best is trial 341 with value: 0.2909369124469028.
[I 2024-12-04 12:10:30,831] Trial 1202 finished with value: 0.4388671903769373 and parameters: {'n_estimators': 511, 'max_depth': 47, 'min_samples_split': 5, 'min_samples_leaf': 2, 'max_features': 'sqrt', 'bootstrap': False, 'criterion': 'squared_error'}. Best is trial 341 with value: 0.2909369124469028.
[I 2024-12-04 12:10:31,595] Trial 1197 finished with value: 0.3122994131888879 and parameters: {'n_estimators': 544, 'max_depth': 44, 'min_samples_split': 5, 'min_samples_leaf': 1, 'max_features': 'sqrt', 'bootstrap': False, 'criterion': 'squared_error'}. Best is trial 341 with value: 0.2909369124469028.
[I 2024-12-04 12:10:31,739] Trial 1194 finished with value: 0.31849678251404406 and parameters: {'n_estimators': 553, 'max_depth': 39, 'min_samples_split': 4, 'min_samples_leaf': 1, 'max_features': 'sqrt', 'bootstrap': False, 'criterion': 'squared_error'}. Best is trial 341 with value: 0.2909369124469028.
[I 2024-12-04 12:10:32,675] Trial 1189 finished with value: 0.38813962705839095 and parameters: {'n_estimators': 536, 'max_depth': 46, 'min_samples_split': 2, 'min_samples_leaf': 1, 'max_features': None, 'bootstrap': False, 'criterion': 'squared_error'}. Best is trial 341 with value: 0.2909369124469028.
[I 2024-12-04 12:10:34,143] Trial 1201 finished with value: 0.29407934248167406 and parameters: {'n_estimators': 606, 'max_depth': 48, 'min_samples_split': 3, 'min_samples_leaf': 1, 'max_features': 'sqrt', 'bootstrap': False, 'criterion': 'squared_error'}. Best is trial 341 with value: 0.2909369124469028.
[I 2024-12-04 12:10:34,143] Trial 1203 finished with value: 0.9380387542185905 and parameters: {'n_estimators': 199, 'max_depth': 50, 'min_samples_split': 2, 'min_samples_leaf': 8, 'max_features': 'log2', 'bootstrap': False, 'criterion': 'squared_error'}. Best is trial 341 with value: 0.2909369124469028.
[I 2024-12-04 12:10:34,340] Trial 1106 finished with value: 0.46008148732431303 and parameters: {'n_estimators': 872, 'max_depth': 8, 'min_samples_split': 43, 'min_samples_leaf': 1, 'max_features': None, 'bootstrap': True, 'criterion': 'absolute_error'}. Best is trial 341 with value: 0.2909369124469028.
[I 2024-12-04 12:10:34,547] Trial 1212 finished with value: 0.9059425344443306 and parameters: {'n_estimators': 144, 'max_depth': 28, 'min_samples_split': 2, 'min_samples_leaf': 5, 'max_features': 'log2', 'bootstrap': False, 'criterion': 'squared_error'}. Best is trial 341 with value: 0.2909369124469028.
[I 2024-12-04 12:10:34,898] Trial 1199 finished with value: 0.44086277998276574 and parameters: {'n_estimators': 438, 'max_depth': 49, 'min_samples_split': 2, 'min_samples_leaf': 2, 'max_features': 'sqrt', 'bootstrap': False, 'criterion': 'squared_error'}. Best is trial 341 with value: 0.2909369124469028.
[I 2024-12-04 12:10:35,153] Trial 1209 finished with value: 0.30326579756174743 and parameters: {'n_estimators': 466, 'max_depth': 42, 'min_samples_split': 3, 'min_samples_leaf': 1, 'max_features': 'sqrt', 'bootstrap': False, 'criterion': 'squared_error'}. Best is trial 341 with value: 0.2909369124469028.
[I 2024-12-04 12:10:37,660] Trial 1208 finished with value: 0.2944501359145026 and parameters: {'n_estimators': 108, 'max_depth': 50, 'min_samples_split': 3, 'min_samples_leaf': 1, 'max_features': 'sqrt', 'bootstrap': False, 'criterion': 'squared_error'}. Best is trial 341 with value: 0.2909369124469028.
[I 2024-12-04 12:10:40,576] Trial 1204 finished with value: 0.38196634585031075 and parameters: {'n_estimators': 277, 'max_depth': 42, 'min_samples_split': 3, 'min_samples_leaf': 1, 'max_features': None, 'bootstrap': False, 'criterion': 'squared_error'}. Best is trial 341 with value: 0.2909369124469028.
[I 2024-12-04 12:10:43,816] Trial 1198 finished with value: 0.41627873131582654 and parameters: {'n_estimators': 492, 'max_depth': 50, 'min_samples_split': 3, 'min_samples_leaf': 2, 'max_features': None, 'bootstrap': False, 'criterion': 'squared_error'}. Best is trial 341 with value: 0.2909369124469028.
[I 2024-12-04 12:10:45,080] Trial 1215 finished with value: 0.29178144494845465 and parameters: {'n_estimators': 525, 'max_depth': 49, 'min_samples_split': 3, 'min_samples_leaf': 1, 'max_features': 'sqrt', 'bootstrap': False, 'criterion': 'squared_error'}. Best is trial 341 with value: 0.2909369124469028.
[I 2024-12-04 12:10:45,661] Trial 1218 finished with value: 0.3132565713209542 and parameters: {'n_estimators': 306, 'max_depth': 41, 'min_samples_split': 4, 'min_samples_leaf': 1, 'max_features': 'sqrt', 'bootstrap': False, 'criterion': 'squared_error'}. Best is trial 341 with value: 0.2909369124469028.
[I 2024-12-04 12:10:45,871] Trial 1219 finished with value: 0.44663750258685064 and parameters: {'n_estimators': 191, 'max_depth': 42, 'min_samples_split': 4, 'min_samples_leaf': 2, 'max_features': 'sqrt', 'bootstrap': False, 'criterion': 'squared_error'}. Best is trial 341 with value: 0.2909369124469028.
[I 2024-12-04 12:10:47,036] Trial 1200 finished with value: 0.5882727633257302 and parameters: {'n_estimators': 186, 'max_depth': 14, 'min_samples_split': 3, 'min_samples_leaf': 1, 'max_features': 'sqrt', 'bootstrap': True, 'criterion': 'absolute_error'}. Best is trial 341 with value: 0.2909369124469028.
[I 2024-12-04 12:10:50,054] Trial 1217 finished with value: 0.3892987614896276 and parameters: {'n_estimators': 420, 'max_depth': 49, 'min_samples_split': 4, 'min_samples_leaf': 1, 'max_features': 'log2', 'bootstrap': False, 'criterion': 'squared_error'}. Best is trial 341 with value: 0.2909369124469028.
[I 2024-12-04 12:10:50,428] Trial 1216 finished with value: 0.3341897251885627 and parameters: {'n_estimators': 277, 'max_depth': 40, 'min_samples_split': 3, 'min_samples_leaf': 1, 'max_features': 'sqrt', 'bootstrap': True, 'criterion': 'squared_error'}. Best is trial 341 with value: 0.2909369124469028.
[I 2024-12-04 12:10:51,346] Trial 1214 finished with value: 0.2942621133622712 and parameters: {'n_estimators': 418, 'max_depth': 50, 'min_samples_split': 3, 'min_samples_leaf': 1, 'max_features': 'sqrt', 'bootstrap': False, 'criterion': 'squared_error'}. Best is trial 341 with value: 0.2909369124469028.
[I 2024-12-04 12:10:52,952] Trial 1220 finished with value: 0.7659106022733924 and parameters: {'n_estimators': 586, 'max_depth': 6, 'min_samples_split': 12, 'min_samples_leaf': 4, 'max_features': 'sqrt', 'bootstrap': False, 'criterion': 'squared_error'}. Best is trial 341 with value: 0.2909369124469028.
[I 2024-12-04 12:10:53,738] Trial 1213 finished with value: 0.4404690174680394 and parameters: {'n_estimators': 535, 'max_depth': 49, 'min_samples_split': 3, 'min_samples_leaf': 2, 'max_features': 'sqrt', 'bootstrap': False, 'criterion': 'squared_error'}. Best is trial 341 with value: 0.2909369124469028.
[I 2024-12-04 12:10:55,720] Trial 1207 finished with value: 0.32265451094103587 and parameters: {'n_estimators': 479, 'max_depth': 45, 'min_samples_split': 3, 'min_samples_leaf': 1, 'max_features': None, 'bootstrap': True, 'criterion': 'squared_error'}. Best is trial 341 with value: 0.2909369124469028.
[I 2024-12-04 12:10:57,991] Trial 1206 finished with value: 0.3215292676070611 and parameters: {'n_estimators': 446, 'max_depth': 41, 'min_samples_split': 3, 'min_samples_leaf': 1, 'max_features': 'sqrt', 'bootstrap': False, 'criterion': 'absolute_error'}. Best is trial 341 with value: 0.2909369124469028.
[I 2024-12-04 12:10:59,957] Trial 1188 finished with value: 0.3892436344866719 and parameters: {'n_estimators': 836, 'max_depth': 49, 'min_samples_split': 2, 'min_samples_leaf': 1, 'max_features': 'log2', 'bootstrap': False, 'criterion': 'absolute_error'}. Best is trial 341 with value: 0.2909369124469028.
[I 2024-12-04 12:11:01,380] Trial 1230 finished with value: 0.3027409399016364 and parameters: {'n_estimators': 474, 'max_depth': 47, 'min_samples_split': 4, 'min_samples_leaf': 1, 'max_features': 'sqrt', 'bootstrap': False, 'criterion': 'squared_error'}. Best is trial 341 with value: 0.2909369124469028.
[I 2024-12-04 12:11:02,650] Trial 1223 finished with value: 0.2982198025953347 and parameters: {'n_estimators': 513, 'max_depth': 50, 'min_samples_split': 2, 'min_samples_leaf': 1, 'max_features': 'sqrt', 'bootstrap': False, 'criterion': 'squared_error'}. Best is trial 341 with value: 0.2909369124469028.
[I 2024-12-04 12:11:03,071] Trial 1225 finished with value: 0.4405339007745686 and parameters: {'n_estimators': 630, 'max_depth': 49, 'min_samples_split': 4, 'min_samples_leaf': 2, 'max_features': 'sqrt', 'bootstrap': False, 'criterion': 'squared_error'}. Best is trial 341 with value: 0.2909369124469028.
[I 2024-12-04 12:11:03,073] Trial 1193 finished with value: 0.3024721696311668 and parameters: {'n_estimators': 633, 'max_depth': 50, 'min_samples_split': 2, 'min_samples_leaf': 1, 'max_features': 'sqrt', 'bootstrap': False, 'criterion': 'absolute_error'}. Best is trial 341 with value: 0.2909369124469028.
