[I 2024-12-04 20:24:42,672] Trial 1376 finished with value: 1.0916561928884227 and parameters: {'kernel_type': 'Matern', 'length_scale': 25.729100323099907, 'noise_level': 4.912695260255421e-08, 'constant_value': 3.082639889261449, 'nu': 0.5}. Best is trial 881 with value: 0.35916990930150405.
[I 2024-12-04 20:24:43,457] Trial 1375 finished with value: 1.0624161171790805 and parameters: {'kernel_type': 'Matern', 'length_scale': 4967.145129240791, 'noise_level': 0.002253019748884292, 'constant_value': 15.898350664489802, 'nu': 0.5}. Best is trial 881 with value: 0.35916990930150405.
[I 2024-12-04 20:24:45,171] Trial 1377 finished with value: 1.0624161168337087 and parameters: {'kernel_type': 'Matern', 'length_scale': 0.0024729396226738946, 'noise_level': 0.002532312885215987, 'constant_value': 5.239973796768088, 'nu': 0.5}. Best is trial 881 with value: 0.35916990930150405.
[I 2024-12-04 20:24:45,695] Trial 1378 finished with value: 1.0916558493899062 and parameters: {'kernel_type': 'RBF', 'length_scale': 0.0008160989302454842, 'noise_level': 1.5913816889289264e-08, 'constant_value': 18.659523780226206, 'nu': 1.5}. Best is trial 881 with value: 0.35916990930150405.
[I 2024-12-04 20:24:46,679] Trial 1379 finished with value: 1.0916567285230356 and parameters: {'kernel_type': 'Matern', 'length_scale': 2.5059854601033025, 'noise_level': 4.441038527865622e-05, 'constant_value': 11878.336688588226, 'nu': 2.5}. Best is trial 881 with value: 0.35916990930150405.
[I 2024-12-04 20:24:49,662] Trial 1380 finished with value: 0.42868352442507435 and parameters: {'kernel_type': 'RBF', 'length_scale': 3.8165486379957136, 'noise_level': 0.8330534544826992, 'constant_value': 65.68403339877135, 'nu': 0.5}. Best is trial 881 with value: 0.35916990930150405.
[I 2024-12-04 20:24:51,110] Trial 1382 finished with value: 1.062416117295096 and parameters: {'kernel_type': 'Matern', 'length_scale': 441.6104900332374, 'noise_level': 0.0047905998518407815, 'constant_value': 0.48229985069881665, 'nu': 0.5}. Best is trial 881 with value: 0.35916990930150405.
[I 2024-12-04 20:24:51,349] Trial 1381 finished with value: 0.3592111740139932 and parameters: {'kernel_type': 'Matern', 'length_scale': 0.3407873781382007, 'noise_level': 0.8028299394825568, 'constant_value': 27706.13843265243, 'nu': 0.5}. Best is trial 881 with value: 0.35916990930150405.
[I 2024-12-04 20:24:54,597] Trial 1383 finished with value: 0.35921123335282473 and parameters: {'kernel_type': 'Matern', 'length_scale': 260.17044041151627, 'noise_level': 0.029770113404409774, 'constant_value': 33.54688727127109, 'nu': 0.5}. Best is trial 881 with value: 0.35916990930150405.
[I 2024-12-04 20:24:56,202] Trial 1384 finished with value: 0.35921113878645555 and parameters: {'kernel_type': 'Matern', 'length_scale': 1.1341996117548792, 'noise_level': 0.0006418624466796895, 'constant_value': 0.3895495015789032, 'nu': 0.5}. Best is trial 881 with value: 0.35916990930150405.
[I 2024-12-04 20:24:57,028] Trial 1385 finished with value: 0.359211229975999 and parameters: {'kernel_type': 'Matern', 'length_scale': 128.93686809149014, 'noise_level': 0.05725320452270046, 'constant_value': 387.1966689410624, 'nu': 0.5}. Best is trial 881 with value: 0.35916990930150405.
[I 2024-12-04 20:24:59,372] Trial 1386 finished with value: 0.35921134932083576 and parameters: {'kernel_type': 'Matern', 'length_scale': 16.000734841776136, 'noise_level': 0.31921218939510926, 'constant_value': 14.418973808701962, 'nu': 0.5}. Best is trial 881 with value: 0.35916990930150405.
[I 2024-12-04 20:24:59,866] Trial 1388 finished with value: 1.0916558493898412 and parameters: {'kernel_type': 'RBF', 'length_scale': 0.0005155912571002564, 'noise_level': 2.8376179279843052e-09, 'constant_value': 17.33928665961297, 'nu': 2.5}. Best is trial 881 with value: 0.35916990930150405.
[I 2024-12-04 20:25:01,268] Trial 1387 finished with value: 0.3592108888316807 and parameters: {'kernel_type': 'Matern', 'length_scale': 3.467459918987142, 'noise_level': 0.01117386117179581, 'constant_value': 662.1647851161588, 'nu': 0.5}. Best is trial 881 with value: 0.35916990930150405.
[I 2024-12-04 20:25:02,946] Trial 1390 finished with value: 1.0916561564838838 and parameters: {'kernel_type': 'Matern', 'length_scale': 7.518872566166331, 'noise_level': 6.542399934385939e-06, 'constant_value': 10.015212784272656, 'nu': 0.5}. Best is trial 881 with value: 0.35916990930150405.
[I 2024-12-04 20:25:05,295] Trial 1389 finished with value: 0.3592112914816815 and parameters: {'kernel_type': 'Matern', 'length_scale': 1551.6512293744424, 'noise_level': 0.6196412942332299, 'constant_value': 88676.14084849317, 'nu': 0.5}. Best is trial 881 with value: 0.35916990930150405.
[I 2024-12-04 20:25:06,030] Trial 1391 finished with value: 0.3592121995362241 and parameters: {'kernel_type': 'Matern', 'length_scale': 0.41055529119697864, 'noise_level': 0.011698659050623606, 'constant_value': 417.3987033064398, 'nu': 0.5}. Best is trial 881 with value: 0.35916990930150405.
[I 2024-12-04 20:25:06,683] Trial 1392 finished with value: 1.0624161171955597 and parameters: {'kernel_type': 'RBF', 'length_scale': 49.455075796741376, 'noise_level': 0.001383639828853475, 'constant_value': 1795.7204634371537, 'nu': 2.5}. Best is trial 881 with value: 0.35916990930150405.
[I 2024-12-04 20:25:09,703] Trial 1394 finished with value: 1.0624161170021023 and parameters: {'kernel_type': 'RBF', 'length_scale': 3.6893218545953226e-05, 'noise_level': 0.0003740578428090741, 'constant_value': 0.0037891286274325748, 'nu': 0.5}. Best is trial 881 with value: 0.35916990930150405.
[I 2024-12-04 20:25:10,692] Trial 1393 finished with value: 0.3592112500433144 and parameters: {'kernel_type': 'Matern', 'length_scale': 107.87265105080218, 'noise_level': 0.00026087279187903434, 'constant_value': 570.8078021442672, 'nu': 0.5}. Best is trial 881 with value: 0.35916990930150405.
[I 2024-12-04 20:25:11,828] Trial 1395 finished with value: 0.35921106399116615 and parameters: {'kernel_type': 'Matern', 'length_scale': 13.393311852204075, 'noise_level': 0.8536493019024377, 'constant_value': 18.23299714105354, 'nu': 0.5}. Best is trial 881 with value: 0.35916990930150405.
[I 2024-12-04 20:25:15,900] Trial 1397 finished with value: 0.3592112088037265 and parameters: {'kernel_type': 'Matern', 'length_scale': 20.71792503246177, 'noise_level': 0.29717968003689266, 'constant_value': 1193.6848000854, 'nu': 0.5}. Best is trial 881 with value: 0.35916990930150405.
[I 2024-12-04 20:25:16,566] Trial 1398 finished with value: 0.35921125104788215 and parameters: {'kernel_type': 'Matern', 'length_scale': 31.464260749298926, 'noise_level': 0.02078116213621366, 'constant_value': 1.8873544030615343, 'nu': 0.5}. Best is trial 881 with value: 0.35916990930150405.
[I 2024-12-04 20:25:19,700] Trial 1396 finished with value: 1.0624161172699553 and parameters: {'kernel_type': 'RBF', 'length_scale': 0.01366694244109131, 'noise_level': 0.00755000874668759, 'constant_value': 11072.462521505073, 'nu': 0.5}. Best is trial 881 with value: 0.35916990930150405.
[I 2024-12-04 20:25:20,580] Trial 1399 finished with value: 1.0624161032800847 and parameters: {'kernel_type': 'Matern', 'length_scale': 0.00015768163890879873, 'noise_level': 2.7070297321975046e-08, 'constant_value': 0.00013516314397429662, 'nu': 0.5}. Best is trial 881 with value: 0.35916990930150405.
[I 2024-12-04 20:25:21,558] Trial 1400 finished with value: 0.35921081319485615 and parameters: {'kernel_type': 'Matern', 'length_scale': 1.9999407286458417, 'noise_level': 0.0002676508012857337, 'constant_value': 107.54844748450999, 'nu': 0.5}. Best is trial 881 with value: 0.35916990930150405.
[I 2024-12-04 20:25:25,675] Trial 1402 finished with value: 0.3592112397692269 and parameters: {'kernel_type': 'Matern', 'length_scale': 42.750037613277044, 'noise_level': 0.0016536595695928339, 'constant_value': 1188.3357241785611, 'nu': 0.5}. Best is trial 881 with value: 0.35916990930150405.
[I 2024-12-04 20:25:27,682] Trial 1403 finished with value: 0.35921126541063364 and parameters: {'kernel_type': 'Matern', 'length_scale': 0.3260725528471291, 'noise_level': 0.023528444328243178, 'constant_value': 1121.1952027925845, 'nu': 0.5}. Best is trial 881 with value: 0.35916990930150405.
[I 2024-12-04 20:25:27,993] Trial 1401 finished with value: 1.0624161175202962 and parameters: {'kernel_type': 'Matern', 'length_scale': 6602.6843924666055, 'noise_level': 0.005020458771882672, 'constant_value': 0.647470553711049, 'nu': 0.5}. Best is trial 881 with value: 0.35916990930150405.
[I 2024-12-04 20:25:31,720] Trial 1404 finished with value: 0.3592112120517351 and parameters: {'kernel_type': 'Matern', 'length_scale': 7.271307525093929, 'noise_level': 0.027781928722865314, 'constant_value': 2914.899159289769, 'nu': 0.5}. Best is trial 881 with value: 0.35916990930150405.
[I 2024-12-04 20:25:33,367] Trial 1405 finished with value: 1.0624161172616662 and parameters: {'kernel_type': 'Matern', 'length_scale': 0.004614039313434335, 'noise_level': 6.677616686280287e-05, 'constant_value': 16.321841787588248, 'nu': 0.5}. Best is trial 881 with value: 0.35916990930150405.
[I 2024-12-04 20:25:33,426] Trial 1406 finished with value: 0.35921129563829146 and parameters: {'kernel_type': 'Matern', 'length_scale': 435.4186865893006, 'noise_level': 0.09972038850220215, 'constant_value': 9.40339569173272, 'nu': 0.5}. Best is trial 881 with value: 0.35916990930150405.
[I 2024-12-04 20:25:36,508] Trial 1408 finished with value: 1.0624160303545178 and parameters: {'kernel_type': 'Matern', 'length_scale': 0.06361408723504011, 'noise_level': 0.12933049750728925, 'constant_value': 0.40291880224199805, 'nu': 0.5}. Best is trial 881 with value: 0.35916990930150405.
[I 2024-12-04 20:25:36,655] Trial 1407 finished with value: 0.35921127927863566 and parameters: {'kernel_type': 'Matern', 'length_scale': 1.2739514913279237, 'noise_level': 0.003872010079261294, 'constant_value': 6.911928947350941, 'nu': 0.5}. Best is trial 881 with value: 0.35916990930150405.
[I 2024-12-04 20:25:38,763] Trial 1409 finished with value: 0.4286836190651171 and parameters: {'kernel_type': 'RBF', 'length_scale': 3.4059908884883163, 'noise_level': 0.003715028590003318, 'constant_value': 70315.67548491902, 'nu': 0.5}. Best is trial 881 with value: 0.35916990930150405.
[I 2024-12-04 20:25:41,347] Trial 1410 finished with value: 0.359211200178895 and parameters: {'kernel_type': 'Matern', 'length_scale': 0.39197875623866785, 'noise_level': 0.8116877152463672, 'constant_value': 124.82626077957694, 'nu': 0.5}. Best is trial 881 with value: 0.35916990930150405.
[I 2024-12-04 20:25:42,319] Trial 1411 finished with value: 1.091656488797981 and parameters: {'kernel_type': 'RBF', 'length_scale': 2769.963361079387, 'noise_level': 0.24714020676958487, 'constant_value': 0.21526061855062664, 'nu': 2.5}. Best is trial 881 with value: 0.35916990930150405.
[I 2024-12-04 20:25:44,300] Trial 1412 finished with value: 0.35921111007599743 and parameters: {'kernel_type': 'Matern', 'length_scale': 271.11655483648207, 'noise_level': 0.0063410865940285, 'constant_value': 3.001848052305903, 'nu': 0.5}. Best is trial 881 with value: 0.35916990930150405.
[I 2024-12-04 20:25:47,263] Trial 1414 finished with value: 0.35921090639039127 and parameters: {'kernel_type': 'Matern', 'length_scale': 25.523536195540576, 'noise_level': 0.9037989360895531, 'constant_value': 48.76348518717395, 'nu': 0.5}. Best is trial 881 with value: 0.35916990930150405.
[I 2024-12-04 20:25:47,595] Trial 1413 finished with value: 0.35921122568281016 and parameters: {'kernel_type': 'Matern', 'length_scale': 22.04463500013807, 'noise_level': 0.013636483061606905, 'constant_value': 65741.66237902913, 'nu': 0.5}. Best is trial 881 with value: 0.35916990930150405.
[I 2024-12-04 20:25:49,959] Trial 1415 finished with value: 0.3592112656704538 and parameters: {'kernel_type': 'Matern', 'length_scale': 1094.533090037465, 'noise_level': 0.004446982072254549, 'constant_value': 812.904779674438, 'nu': 0.5}. Best is trial 881 with value: 0.35916990930150405.
[I 2024-12-04 20:25:52,000] Trial 1416 finished with value: 1.0624161176674976 and parameters: {'kernel_type': 'Matern', 'length_scale': 71.90632162486837, 'noise_level': 6.018021326923279e-05, 'constant_value': 0.562854689132017, 'nu': 0.5}. Best is trial 881 with value: 0.35916990930150405.
[I 2024-12-04 20:25:53,287] Trial 1417 finished with value: 0.4226896615213696 and parameters: {'kernel_type': 'Matern', 'length_scale': 1.9269080057098107, 'noise_level': 0.3628155111440952, 'constant_value': 3468.162377294368, 'nu': 1.5}. Best is trial 881 with value: 0.35916990930150405.
[I 2024-12-04 20:25:54,880] Trial 1418 finished with value: 0.3592111650648946 and parameters: {'kernel_type': 'Matern', 'length_scale': 1.0479321493923721, 'noise_level': 0.014436529550444492, 'constant_value': 3.953747402172969, 'nu': 0.5}. Best is trial 881 with value: 0.35916990930150405.
[I 2024-12-04 20:25:57,542] Trial 1419 finished with value: 0.3592112414516455 and parameters: {'kernel_type': 'Matern', 'length_scale': 9670.209080553086, 'noise_level': 0.7444380823856234, 'constant_value': 487.5577882501401, 'nu': 0.5}. Best is trial 881 with value: 0.35916990930150405.
[I 2024-12-04 20:26:02,197] Trial 1422 finished with value: 0.4286835027297085 and parameters: {'kernel_type': 'RBF', 'length_scale': 1.75838212819729, 'noise_level': 0.1394614696443369, 'constant_value': 352.0292851082393, 'nu': 1.5}. Best is trial 881 with value: 0.35916990930150405.
[I 2024-12-04 20:26:02,340] Trial 1420 finished with value: 0.359211240150627 and parameters: {'kernel_type': 'Matern', 'length_scale': 0.2296912093238683, 'noise_level': 0.016187172084563058, 'constant_value': 90387.17147511871, 'nu': 0.5}. Best is trial 881 with value: 0.35916990930150405.
[I 2024-12-04 20:26:03,506] Trial 1421 finished with value: 1.0624161172811544 and parameters: {'kernel_type': 'Matern', 'length_scale': 79848.67875002677, 'noise_level': 1.584378349618469e-07, 'constant_value': 0.01870022189710634, 'nu': 1.5}. Best is trial 881 with value: 0.35916990930150405.
[I 2024-12-04 20:26:07,346] Trial 1424 finished with value: 0.359210996543938 and parameters: {'kernel_type': 'Matern', 'length_scale': 38.022834511720866, 'noise_level': 3.64636667126497e-05, 'constant_value': 393.83047326123284, 'nu': 0.5}. Best is trial 881 with value: 0.35916990930150405.
[I 2024-12-04 20:26:08,253] Trial 1423 finished with value: 0.3592112264486769 and parameters: {'kernel_type': 'Matern', 'length_scale': 2.223773099909832, 'noise_level': 0.03836821679921017, 'constant_value': 2124.5060478470723, 'nu': 0.5}. Best is trial 881 with value: 0.35916990930150405.
[I 2024-12-04 20:26:08,721] Trial 1425 finished with value: 0.3592114238620715 and parameters: {'kernel_type': 'Matern', 'length_scale': 75.13385679882641, 'noise_level': 0.016865677402798138, 'constant_value': 1.5315123953488008, 'nu': 0.5}. Best is trial 881 with value: 0.35916990930150405.
[I 2024-12-04 20:26:12,596] Trial 1427 finished with value: 1.0624161172686641 and parameters: {'kernel_type': 'Matern', 'length_scale': 0.024323470265020526, 'noise_level': 0.895016973910462, 'constant_value': 9273.847455033567, 'nu': 0.5}. Best is trial 881 with value: 0.35916990930150405.
[I 2024-12-04 20:26:14,135] Trial 1428 finished with value: 0.35921124996771425 and parameters: {'kernel_type': 'Matern', 'length_scale': 23.577512702948802, 'noise_level': 0.7521970792919197, 'constant_value': 26714.876485795256, 'nu': 0.5}. Best is trial 881 with value: 0.35916990930150405.
[I 2024-12-04 20:26:15,846] Trial 1426 finished with value: 1.0624161170469162 and parameters: {'kernel_type': 'Matern', 'length_scale': 86473.60193708258, 'noise_level': 0.002204743524171883, 'constant_value': 1.5225295212524734, 'nu': 2.5}. Best is trial 881 with value: 0.35916990930150405.
[I 2024-12-04 20:26:17,823] Trial 1429 finished with value: 0.35921098167124865 and parameters: {'kernel_type': 'Matern', 'length_scale': 55.17181607092522, 'noise_level': 0.002483848121782089, 'constant_value': 36.0038635034062, 'nu': 0.5}. Best is trial 881 with value: 0.35916990930150405.
[I 2024-12-04 20:26:18,108] Trial 1430 finished with value: 0.35921124752433903 and parameters: {'kernel_type': 'Matern', 'length_scale': 285.67211392102377, 'noise_level': 0.4742967690349444, 'constant_value': 14.542150612817991, 'nu': 0.5}. Best is trial 881 with value: 0.35916990930150405.
[I 2024-12-04 20:26:20,768] Trial 1431 finished with value: 0.3592106388603494 and parameters: {'kernel_type': 'Matern', 'length_scale': 9.819421410971604, 'noise_level': 0.07110992319584897, 'constant_value': 1646.0896635846455, 'nu': 0.5}. Best is trial 881 with value: 0.35916990930150405.
[I 2024-12-04 20:26:21,344] Trial 1432 finished with value: 1.0624161171396933 and parameters: {'kernel_type': 'Matern', 'length_scale': 0.0018003625213138216, 'noise_level': 0.33304183946284543, 'constant_value': 11.173643044913096, 'nu': 0.5}. Best is trial 881 with value: 0.35916990930150405.
[I 2024-12-04 20:26:25,796] Trial 1433 finished with value: 0.3592112418083155 and parameters: {'kernel_type': 'Matern', 'length_scale': 0.1003380712795242, 'noise_level': 0.0014661186310194016, 'constant_value': 31.56704236262313, 'nu': 0.5}. Best is trial 881 with value: 0.35916990930150405.
[I 2024-12-04 20:26:25,811] Trial 1434 finished with value: 0.35921123604822397 and parameters: {'kernel_type': 'Matern', 'length_scale': 106.56818069073479, 'noise_level': 0.02072501096213858, 'constant_value': 1862.7722085590704, 'nu': 0.5}. Best is trial 881 with value: 0.35916990930150405.
[I 2024-12-04 20:26:26,595] Trial 1435 finished with value: 0.3592108516186079 and parameters: {'kernel_type': 'Matern', 'length_scale': 0.6896554322849464, 'noise_level': 0.9445749146162393, 'constant_value': 567.009799681251, 'nu': 0.5}. Best is trial 881 with value: 0.35916990930150405.
[I 2024-12-04 20:26:30,567] Trial 1437 finished with value: 0.35921104353906713 and parameters: {'kernel_type': 'Matern', 'length_scale': 0.7846793286519976, 'noise_level': 0.0007061464570192254, 'constant_value': 8956.45686544462, 'nu': 0.5}. Best is trial 881 with value: 0.35916990930150405.
[I 2024-12-04 20:26:33,611] Trial 1438 finished with value: 0.4226898472981506 and parameters: {'kernel_type': 'Matern', 'length_scale': 1.4549168387855003, 'noise_level': 0.9677010346920815, 'constant_value': 43.199087796500976, 'nu': 1.5}. Best is trial 881 with value: 0.35916990930150405.
[I 2024-12-04 20:26:37,472] Trial 1439 finished with value: 1.091655849388495 and parameters: {'kernel_type': 'Matern', 'length_scale': 0.017960974847330318, 'noise_level': 1.2044945807425858e-06, 'constant_value': 23415.92251284798, 'nu': 2.5}. Best is trial 881 with value: 0.35916990930150405.
[I 2024-12-04 20:26:38,253] Trial 1436 finished with value: 1.0624161172706172 and parameters: {'kernel_type': 'RBF', 'length_scale': 32.28025027254954, 'noise_level': 0.00467046738246408, 'constant_value': 3.471549439202523e-05, 'nu': 1.5}. Best is trial 881 with value: 0.35916990930150405.
[I 2024-12-04 20:26:41,763] Trial 1440 finished with value: 0.3592106811313221 and parameters: {'kernel_type': 'Matern', 'length_scale': 2.2255985293556435, 'noise_level': 0.0036472728899657413, 'constant_value': 0.08033950169223873, 'nu': 0.5}. Best is trial 881 with value: 0.35916990930150405.
[I 2024-12-04 20:26:43,761] Trial 1442 finished with value: 0.3592112638035176 and parameters: {'kernel_type': 'Matern', 'length_scale': 1546.933624482915, 'noise_level': 0.04772623478594829, 'constant_value': 16.816693545002764, 'nu': 0.5}. Best is trial 881 with value: 0.35916990930150405.
[I 2024-12-04 20:26:46,126] Trial 1441 finished with value: 1.0624161172643292 and parameters: {'kernel_type': 'Matern', 'length_scale': 18.519910046419177, 'noise_level': 0.0002063753120628708, 'constant_value': 0.0008459646332430403, 'nu': 1.5}. Best is trial 881 with value: 0.35916990930150405.
[I 2024-12-04 20:26:48,253] Trial 1443 finished with value: 1.0624161173491844 and parameters: {'kernel_type': 'Matern', 'length_scale': 683.7643864075756, 'noise_level': 0.0034952967260858028, 'constant_value': 145.01932253573727, 'nu': 2.5}. Best is trial 881 with value: 0.35916990930150405.
[I 2024-12-04 20:26:49,162] Trial 1444 finished with value: 0.35921191324069685 and parameters: {'kernel_type': 'Matern', 'length_scale': 0.6121298388740075, 'noise_level': 0.020404657822912897, 'constant_value': 9.076247092723033, 'nu': 0.5}. Best is trial 881 with value: 0.35916990930150405.
[I 2024-12-04 20:26:50,189] Trial 1445 finished with value: 0.3592114297155593 and parameters: {'kernel_type': 'Matern', 'length_scale': 1.357259446862918, 'noise_level': 0.06345388092221038, 'constant_value': 0.574558330437894, 'nu': 0.5}. Best is trial 881 with value: 0.35916990930150405.
[I 2024-12-04 20:26:53,675] Trial 1446 finished with value: 0.3592112311124421 and parameters: {'kernel_type': 'Matern', 'length_scale': 7.110733946758631, 'noise_level': 0.05213719604602291, 'constant_value': 20.666128102768045, 'nu': 0.5}. Best is trial 881 with value: 0.35916990930150405.
[I 2024-12-04 20:26:53,680] Trial 1448 finished with value: 1.0916552177172982 and parameters: {'kernel_type': 'Matern', 'length_scale': 0.4544923107297419, 'noise_level': 3.5655839462008556e-05, 'constant_value': 91.73549603226328, 'nu': 0.5}. Best is trial 881 with value: 0.35916990930150405.
[I 2024-12-04 20:26:54,268] Trial 1447 finished with value: 0.3592112397946327 and parameters: {'kernel_type': 'Matern', 'length_scale': 97.58396252277228, 'noise_level': 0.00045504301327350786, 'constant_value': 69727.64186913302, 'nu': 0.5}. Best is trial 881 with value: 0.35916990930150405.
