[I 2024-12-04 14:48:29,246] Trial 195 finished with value: 0.5210408460809628 and parameters: {'n_estimators': 823, 'learning_rate': 0.03406750709927018, 'max_depth': 12, 'min_samples_split': 14, 'min_samples_leaf': 1, 'subsample': 0.8965236384815319, 'max_features': None}. Best is trial 167 with value: 0.47128001676423487.
[I 2024-12-04 14:48:29,505] Trial 198 finished with value: 0.4983389224028322 and parameters: {'n_estimators': 854, 'learning_rate': 0.08932190865887525, 'max_depth': 7, 'min_samples_split': 16, 'min_samples_leaf': 1, 'subsample': 0.8546530908119943, 'max_features': None}. Best is trial 167 with value: 0.47128001676423487.
[I 2024-12-04 14:48:29,508] Trial 211 finished with value: 0.5409220624109699 and parameters: {'n_estimators': 576, 'learning_rate': 0.06315695187279213, 'max_depth': 7, 'min_samples_split': 19, 'min_samples_leaf': 1, 'subsample': 0.9150599931309904, 'max_features': 'sqrt'}. Best is trial 167 with value: 0.47128001676423487.
[I 2024-12-04 14:48:29,566] Trial 207 finished with value: 0.6187901927599453 and parameters: {'n_estimators': 493, 'learning_rate': 0.08541330463217618, 'max_depth': 11, 'min_samples_split': 20, 'min_samples_leaf': 2, 'subsample': 0.9096553631608892, 'max_features': None}. Best is trial 167 with value: 0.47128001676423487.
[I 2024-12-04 14:48:29,756] Trial 206 finished with value: 0.5839523710295413 and parameters: {'n_estimators': 462, 'learning_rate': 0.0484218185086768, 'max_depth': 12, 'min_samples_split': 19, 'min_samples_leaf': 2, 'subsample': 0.9922942524871066, 'max_features': None}. Best is trial 167 with value: 0.47128001676423487.
[I 2024-12-04 14:48:33,570] Trial 203 finished with value: 0.603235777698656 and parameters: {'n_estimators': 787, 'learning_rate': 0.03536301132957821, 'max_depth': 11, 'min_samples_split': 20, 'min_samples_leaf': 2, 'subsample': 0.8611288273730136, 'max_features': None}. Best is trial 167 with value: 0.47128001676423487.
[I 2024-12-04 14:48:35,513] Trial 201 finished with value: 0.497466351272892 and parameters: {'n_estimators': 921, 'learning_rate': 0.05079262702827019, 'max_depth': 11, 'min_samples_split': 18, 'min_samples_leaf': 1, 'subsample': 0.8129750747029636, 'max_features': None}. Best is trial 167 with value: 0.47128001676423487.
[I 2024-12-04 14:48:35,517] Trial 228 finished with value: 0.5006701251388759 and parameters: {'n_estimators': 185, 'learning_rate': 0.09623594804210152, 'max_depth': 10, 'min_samples_split': 16, 'min_samples_leaf': 1, 'subsample': 0.8614238168752549, 'max_features': None}. Best is trial 167 with value: 0.47128001676423487.
[I 2024-12-04 14:48:36,214] Trial 226 finished with value: 0.525104934223582 and parameters: {'n_estimators': 265, 'learning_rate': 0.04827759385906893, 'max_depth': 12, 'min_samples_split': 20, 'min_samples_leaf': 1, 'subsample': 0.7175256598675503, 'max_features': None}. Best is trial 167 with value: 0.47128001676423487.
[I 2024-12-04 14:48:37,050] Trial 213 finished with value: 0.5089961018555977 and parameters: {'n_estimators': 565, 'learning_rate': 0.07382408645507572, 'max_depth': 7, 'min_samples_split': 18, 'min_samples_leaf': 1, 'subsample': 0.8235190008836313, 'max_features': None}. Best is trial 167 with value: 0.47128001676423487.
[I 2024-12-04 14:48:37,053] Trial 210 finished with value: 0.5107640216538423 and parameters: {'n_estimators': 669, 'learning_rate': 0.048730877209649075, 'max_depth': 11, 'min_samples_split': 16, 'min_samples_leaf': 1, 'subsample': 0.9205737685500313, 'max_features': None}. Best is trial 167 with value: 0.47128001676423487.
[I 2024-12-04 14:48:39,096] Trial 225 finished with value: 0.49338373958170395 and parameters: {'n_estimators': 384, 'learning_rate': 0.0843251971202712, 'max_depth': 12, 'min_samples_split': 15, 'min_samples_leaf': 1, 'subsample': 0.9469323754186725, 'max_features': None}. Best is trial 167 with value: 0.47128001676423487.
[I 2024-12-04 14:48:39,109] Trial 205 finished with value: 0.4959272260636642 and parameters: {'n_estimators': 963, 'learning_rate': 0.09391277557335168, 'max_depth': 9, 'min_samples_split': 20, 'min_samples_leaf': 1, 'subsample': 0.9282543180501791, 'max_features': None}. Best is trial 167 with value: 0.47128001676423487.
[I 2024-12-04 14:48:40,217] Trial 220 finished with value: 0.59474723834718 and parameters: {'n_estimators': 547, 'learning_rate': 0.01513086727233444, 'max_depth': 12, 'min_samples_split': 15, 'min_samples_leaf': 3, 'subsample': 0.9962083872933536, 'max_features': None}. Best is trial 167 with value: 0.47128001676423487.
[I 2024-12-04 14:48:40,504] Trial 212 finished with value: 0.7976542455944609 and parameters: {'n_estimators': 971, 'learning_rate': 0.02238185497923446, 'max_depth': 6, 'min_samples_split': 6, 'min_samples_leaf': 10, 'subsample': 0.7262682336583077, 'max_features': 'sqrt'}. Best is trial 167 with value: 0.47128001676423487.
[I 2024-12-04 14:48:42,289] Trial 221 finished with value: 0.4893970575477132 and parameters: {'n_estimators': 516, 'learning_rate': 0.05219789049787967, 'max_depth': 10, 'min_samples_split': 19, 'min_samples_leaf': 1, 'subsample': 0.8886542081946546, 'max_features': None}. Best is trial 167 with value: 0.47128001676423487.
[I 2024-12-04 14:48:42,502] Trial 199 finished with value: 0.632622237255093 and parameters: {'n_estimators': 1189, 'learning_rate': 0.053544238677640084, 'max_depth': 10, 'min_samples_split': 20, 'min_samples_leaf': 2, 'subsample': 0.9456930650406519, 'max_features': None}. Best is trial 167 with value: 0.47128001676423487.
[I 2024-12-04 14:48:44,419] Trial 219 finished with value: 0.5225389440251978 and parameters: {'n_estimators': 641, 'learning_rate': 0.0275334959890153, 'max_depth': 9, 'min_samples_split': 13, 'min_samples_leaf': 1, 'subsample': 0.9579526202597434, 'max_features': None}. Best is trial 167 with value: 0.47128001676423487.
[I 2024-12-04 14:48:45,154] Trial 243 finished with value: 0.5176243153291045 and parameters: {'n_estimators': 143, 'learning_rate': 0.06444933143110221, 'max_depth': 8, 'min_samples_split': 20, 'min_samples_leaf': 1, 'subsample': 0.8347447450661375, 'max_features': None}. Best is trial 167 with value: 0.47128001676423487.
[I 2024-12-04 14:48:45,929] Trial 236 finished with value: 0.5484793709585037 and parameters: {'n_estimators': 340, 'learning_rate': 0.061581950789189, 'max_depth': 6, 'min_samples_split': 13, 'min_samples_leaf': 1, 'subsample': 0.8236322707130477, 'max_features': None}. Best is trial 167 with value: 0.47128001676423487.
[I 2024-12-04 14:48:46,185] Trial 218 finished with value: 0.4948830626784194 and parameters: {'n_estimators': 645, 'learning_rate': 0.024305547219148113, 'max_depth': 12, 'min_samples_split': 18, 'min_samples_leaf': 1, 'subsample': 0.821505686273682, 'max_features': None}. Best is trial 167 with value: 0.47128001676423487.
[I 2024-12-04 14:48:46,187] Trial 222 finished with value: 0.4929062450072719 and parameters: {'n_estimators': 624, 'learning_rate': 0.04378874500816526, 'max_depth': 10, 'min_samples_split': 20, 'min_samples_leaf': 1, 'subsample': 0.926584531927242, 'max_features': None}. Best is trial 167 with value: 0.47128001676423487.
[I 2024-12-04 14:48:47,196] Trial 223 finished with value: 0.5706265311346401 and parameters: {'n_estimators': 736, 'learning_rate': 0.06976566730780423, 'max_depth': 12, 'min_samples_split': 18, 'min_samples_leaf': 1, 'subsample': 0.8915012792533378, 'max_features': 'log2'}. Best is trial 167 with value: 0.47128001676423487.
[I 2024-12-04 14:48:47,607] Trial 241 finished with value: 0.49501119638475205 and parameters: {'n_estimators': 244, 'learning_rate': 0.09238975306164784, 'max_depth': 11, 'min_samples_split': 20, 'min_samples_leaf': 1, 'subsample': 0.8252555459702761, 'max_features': None}. Best is trial 167 with value: 0.47128001676423487.
[I 2024-12-04 14:48:47,628] Trial 234 finished with value: 0.6870784683672837 and parameters: {'n_estimators': 458, 'learning_rate': 0.058772757150934114, 'max_depth': 7, 'min_samples_split': 18, 'min_samples_leaf': 2, 'subsample': 0.8561535022912881, 'max_features': 'log2'}. Best is trial 167 with value: 0.47128001676423487.
[I 2024-12-04 14:48:48,574] Trial 216 finished with value: 0.5913856456771251 and parameters: {'n_estimators': 944, 'learning_rate': 0.013994389182668609, 'max_depth': 12, 'min_samples_split': 16, 'min_samples_leaf': 3, 'subsample': 0.9026076943860389, 'max_features': None}. Best is trial 167 with value: 0.47128001676423487.
[I 2024-12-04 14:48:49,676] Trial 229 finished with value: 0.5006765912888369 and parameters: {'n_estimators': 630, 'learning_rate': 0.020276625390479943, 'max_depth': 10, 'min_samples_split': 20, 'min_samples_leaf': 1, 'subsample': 0.9298025861904835, 'max_features': None}. Best is trial 167 with value: 0.47128001676423487.
[I 2024-12-04 14:48:50,803] Trial 231 finished with value: 0.5394429398112829 and parameters: {'n_estimators': 579, 'learning_rate': 0.07297477864071023, 'max_depth': 6, 'min_samples_split': 15, 'min_samples_leaf': 1, 'subsample': 0.9463885404570542, 'max_features': None}. Best is trial 167 with value: 0.47128001676423487.
[I 2024-12-04 14:48:52,131] Trial 238 finished with value: 0.588499479194341 and parameters: {'n_estimators': 516, 'learning_rate': 0.027076239858372635, 'max_depth': 8, 'min_samples_split': 18, 'min_samples_leaf': 2, 'subsample': 0.8155307529671003, 'max_features': None}. Best is trial 167 with value: 0.47128001676423487.
[I 2024-12-04 14:48:52,135] Trial 248 finished with value: 0.49394168283982054 and parameters: {'n_estimators': 263, 'learning_rate': 0.08886506798339641, 'max_depth': 10, 'min_samples_split': 15, 'min_samples_leaf': 1, 'subsample': 0.860026671009248, 'max_features': None}. Best is trial 167 with value: 0.47128001676423487.
[I 2024-12-04 14:48:53,430] Trial 215 finished with value: 0.5961306267430878 and parameters: {'n_estimators': 993, 'learning_rate': 0.021741395264510233, 'max_depth': 12, 'min_samples_split': 19, 'min_samples_leaf': 2, 'subsample': 0.8009107181575781, 'max_features': None}. Best is trial 167 with value: 0.47128001676423487.
[I 2024-12-04 14:48:54,188] Trial 217 finished with value: 0.6729145504828261 and parameters: {'n_estimators': 1058, 'learning_rate': 0.07639523309290681, 'max_depth': 12, 'min_samples_split': 14, 'min_samples_leaf': 3, 'subsample': 0.920604260930841, 'max_features': None}. Best is trial 167 with value: 0.47128001676423487.
[I 2024-12-04 14:48:54,268] Trial 230 finished with value: 0.6199940064190228 and parameters: {'n_estimators': 748, 'learning_rate': 0.024052996014494902, 'max_depth': 7, 'min_samples_split': 17, 'min_samples_leaf': 2, 'subsample': 0.9740637890355597, 'max_features': None}. Best is trial 167 with value: 0.47128001676423487.
[I 2024-12-04 14:48:56,356] Trial 252 finished with value: 0.5718220008469823 and parameters: {'n_estimators': 292, 'learning_rate': 0.0371793122470389, 'max_depth': 10, 'min_samples_split': 19, 'min_samples_leaf': 2, 'subsample': 0.8876320300326199, 'max_features': None}. Best is trial 167 with value: 0.47128001676423487.
[I 2024-12-04 14:48:57,750] Trial 214 finished with value: 0.5006530055024444 and parameters: {'n_estimators': 1047, 'learning_rate': 0.015464884776501748, 'max_depth': 12, 'min_samples_split': 16, 'min_samples_leaf': 1, 'subsample': 0.9623202137384546, 'max_features': None}. Best is trial 167 with value: 0.47128001676423487.
[I 2024-12-04 14:48:58,383] Trial 235 finished with value: 0.5089650396125651 and parameters: {'n_estimators': 819, 'learning_rate': 0.04582323852293387, 'max_depth': 7, 'min_samples_split': 18, 'min_samples_leaf': 1, 'subsample': 0.9084908083699605, 'max_features': None}. Best is trial 167 with value: 0.47128001676423487.
[I 2024-12-04 14:48:58,383] Trial 246 finished with value: 0.5136259652626685 and parameters: {'n_estimators': 516, 'learning_rate': 0.0805079410457317, 'max_depth': 9, 'min_samples_split': 17, 'min_samples_leaf': 1, 'subsample': 0.8826783052121372, 'max_features': None}. Best is trial 167 with value: 0.47128001676423487.
[I 2024-12-04 14:48:58,830] Trial 240 finished with value: 0.5284144055714941 and parameters: {'n_estimators': 839, 'learning_rate': 0.018233065118677422, 'max_depth': 11, 'min_samples_split': 19, 'min_samples_leaf': 1, 'subsample': 0.9867064318204215, 'max_features': 'sqrt'}. Best is trial 167 with value: 0.47128001676423487.
[I 2024-12-04 14:48:59,022] Trial 256 finished with value: 0.6251165378170783 and parameters: {'n_estimators': 141, 'learning_rate': 0.07052077500921101, 'max_depth': 12, 'min_samples_split': 20, 'min_samples_leaf': 1, 'subsample': 0.9009894406870621, 'max_features': 'log2'}. Best is trial 167 with value: 0.47128001676423487.
[I 2024-12-04 14:48:59,845] Trial 257 finished with value: 0.5863862978591724 and parameters: {'n_estimators': 194, 'learning_rate': 0.07040854586810968, 'max_depth': 11, 'min_samples_split': 19, 'min_samples_leaf': 2, 'subsample': 0.8600600203654364, 'max_features': None}. Best is trial 167 with value: 0.47128001676423487.
[I 2024-12-04 14:49:00,146] Trial 259 finished with value: 0.5861834108194467 and parameters: {'n_estimators': 180, 'learning_rate': 0.09713822656563208, 'max_depth': 10, 'min_samples_split': 15, 'min_samples_leaf': 5, 'subsample': 0.8434321890361763, 'max_features': None}. Best is trial 167 with value: 0.47128001676423487.
[I 2024-12-04 14:49:00,371] Trial 233 finished with value: 0.5390316427028858 and parameters: {'n_estimators': 870, 'learning_rate': 0.06415923750236915, 'max_depth': 9, 'min_samples_split': 15, 'min_samples_leaf': 1, 'subsample': 0.9298554088566351, 'max_features': None}. Best is trial 167 with value: 0.47128001676423487.
[I 2024-12-04 14:49:03,182] Trial 250 finished with value: 0.49765796580625893 and parameters: {'n_estimators': 521, 'learning_rate': 0.021221410885484494, 'max_depth': 12, 'min_samples_split': 16, 'min_samples_leaf': 1, 'subsample': 0.980673075390486, 'max_features': None}. Best is trial 167 with value: 0.47128001676423487.
[I 2024-12-04 14:49:03,350] Trial 251 finished with value: 0.6155152309283302 and parameters: {'n_estimators': 495, 'learning_rate': 0.053356617775963226, 'max_depth': 12, 'min_samples_split': 19, 'min_samples_leaf': 2, 'subsample': 0.8630423929766502, 'max_features': None}. Best is trial 167 with value: 0.47128001676423487.
[I 2024-12-04 14:49:03,381] Trial 260 finished with value: 0.6191933782314601 and parameters: {'n_estimators': 206, 'learning_rate': 0.09926879830027607, 'max_depth': 11, 'min_samples_split': 17, 'min_samples_leaf': 2, 'subsample': 0.7736215433411515, 'max_features': None}. Best is trial 167 with value: 0.47128001676423487.
[I 2024-12-04 14:49:03,395] Trial 237 finished with value: 0.6171716794952162 and parameters: {'n_estimators': 837, 'learning_rate': 0.03425317342223621, 'max_depth': 11, 'min_samples_split': 19, 'min_samples_leaf': 3, 'subsample': 0.9705069503256183, 'max_features': None}. Best is trial 167 with value: 0.47128001676423487.
[I 2024-12-04 14:49:03,936] Trial 227 finished with value: 0.49179750529027827 and parameters: {'n_estimators': 1111, 'learning_rate': 0.021089316506858063, 'max_depth': 9, 'min_samples_split': 20, 'min_samples_leaf': 1, 'subsample': 0.9873683321616069, 'max_features': None}. Best is trial 167 with value: 0.47128001676423487.
[I 2024-12-04 14:49:04,027] Trial 262 finished with value: 0.5128990977593447 and parameters: {'n_estimators': 170, 'learning_rate': 0.06392482672000223, 'max_depth': 10, 'min_samples_split': 15, 'min_samples_leaf': 1, 'subsample': 0.9002557608590456, 'max_features': None}. Best is trial 167 with value: 0.47128001676423487.
[I 2024-12-04 14:49:05,170] Trial 224 finished with value: 0.5896309617629042 and parameters: {'n_estimators': 1143, 'learning_rate': 0.013857147859866727, 'max_depth': 8, 'min_samples_split': 20, 'min_samples_leaf': 2, 'subsample': 0.8760192440582649, 'max_features': None}. Best is trial 167 with value: 0.47128001676423487.
[I 2024-12-04 14:49:05,198] Trial 244 finished with value: 0.62971709286082 and parameters: {'n_estimators': 857, 'learning_rate': 0.06993312922510599, 'max_depth': 10, 'min_samples_split': 17, 'min_samples_leaf': 4, 'subsample': 0.8568717909864542, 'max_features': None}. Best is trial 167 with value: 0.47128001676423487.
[I 2024-12-04 14:49:05,987] Trial 258 finished with value: 0.5128367195176596 and parameters: {'n_estimators': 433, 'learning_rate': 0.02201507502012807, 'max_depth': 8, 'min_samples_split': 20, 'min_samples_leaf': 1, 'subsample': 0.9302617300733489, 'max_features': None}. Best is trial 167 with value: 0.47128001676423487.
[I 2024-12-04 14:49:06,546] Trial 245 finished with value: 0.4880243374000087 and parameters: {'n_estimators': 822, 'learning_rate': 0.0937912038939502, 'max_depth': 10, 'min_samples_split': 20, 'min_samples_leaf': 1, 'subsample': 0.9548304490380339, 'max_features': None}. Best is trial 167 with value: 0.47128001676423487.
[I 2024-12-04 14:49:06,766] Trial 232 finished with value: 0.48438720726619544 and parameters: {'n_estimators': 1113, 'learning_rate': 0.024588668076178544, 'max_depth': 12, 'min_samples_split': 20, 'min_samples_leaf': 1, 'subsample': 0.9460625824588801, 'max_features': None}. Best is trial 167 with value: 0.47128001676423487.
[I 2024-12-04 14:49:06,891] Trial 247 finished with value: 0.7296222788130896 and parameters: {'n_estimators': 861, 'learning_rate': 0.08969977431245797, 'max_depth': 8, 'min_samples_split': 10, 'min_samples_leaf': 2, 'subsample': 0.8549143841791536, 'max_features': None}. Best is trial 167 with value: 0.47128001676423487.
[I 2024-12-04 14:49:07,648] Trial 254 finished with value: 0.5004399428103473 and parameters: {'n_estimators': 628, 'learning_rate': 0.02420064689154545, 'max_depth': 12, 'min_samples_split': 19, 'min_samples_leaf': 1, 'subsample': 0.7468476551653012, 'max_features': None}. Best is trial 167 with value: 0.47128001676423487.
[I 2024-12-04 14:49:08,441] Trial 255 finished with value: 0.5066579613049454 and parameters: {'n_estimators': 624, 'learning_rate': 0.015165460780308426, 'max_depth': 12, 'min_samples_split': 17, 'min_samples_leaf': 1, 'subsample': 0.8277296614229188, 'max_features': None}. Best is trial 167 with value: 0.47128001676423487.
[I 2024-12-04 14:49:11,245] Trial 249 finished with value: 0.613656322422813 and parameters: {'n_estimators': 1326, 'learning_rate': 0.08367280289936267, 'max_depth': 4, 'min_samples_split': 20, 'min_samples_leaf': 4, 'subsample': 0.6089252968640534, 'max_features': 'sqrt'}. Best is trial 167 with value: 0.47128001676423487.
[I 2024-12-04 14:49:11,562] Trial 242 finished with value: 0.5149253588299537 and parameters: {'n_estimators': 1114, 'learning_rate': 0.04570493747478643, 'max_depth': 11, 'min_samples_split': 16, 'min_samples_leaf': 1, 'subsample': 0.8543257303622928, 'max_features': None}. Best is trial 167 with value: 0.47128001676423487.
[I 2024-12-04 14:49:13,427] Trial 261 finished with value: 0.4947799326713559 and parameters: {'n_estimators': 685, 'learning_rate': 0.022568611761679423, 'max_depth': 11, 'min_samples_split': 17, 'min_samples_leaf': 1, 'subsample': 0.8778749356692417, 'max_features': None}. Best is trial 167 with value: 0.47128001676423487.
[I 2024-12-04 14:49:13,895] Trial 253 finished with value: 0.48637000647112566 and parameters: {'n_estimators': 745, 'learning_rate': 0.027278115651144377, 'max_depth': 12, 'min_samples_split': 19, 'min_samples_leaf': 1, 'subsample': 0.7971999681460955, 'max_features': None}. Best is trial 167 with value: 0.47128001676423487.
[I 2024-12-04 14:49:14,189] Trial 239 finished with value: 0.7598512776901029 and parameters: {'n_estimators': 1393, 'learning_rate': 0.0780926745403944, 'max_depth': 12, 'min_samples_split': 12, 'min_samples_leaf': 9, 'subsample': 0.8981638401357783, 'max_features': None}. Best is trial 167 with value: 0.47128001676423487.
[I 2024-12-04 14:49:15,172] Trial 263 finished with value: 0.4922495209248412 and parameters: {'n_estimators': 735, 'learning_rate': 0.033539326068846964, 'max_depth': 11, 'min_samples_split': 17, 'min_samples_leaf': 1, 'subsample': 0.8675168454972796, 'max_features': None}. Best is trial 167 with value: 0.47128001676423487.
[I 2024-12-04 14:49:15,175] Trial 264 finished with value: 0.5667611042493469 and parameters: {'n_estimators': 652, 'learning_rate': 0.013537989168604188, 'max_depth': 12, 'min_samples_split': 20, 'min_samples_leaf': 2, 'subsample': 0.9916138279894214, 'max_features': None}. Best is trial 167 with value: 0.47128001676423487.
[I 2024-12-04 14:49:15,354] Trial 270 finished with value: 0.5047552916144793 and parameters: {'n_estimators': 574, 'learning_rate': 0.09449142076608168, 'max_depth': 11, 'min_samples_split': 15, 'min_samples_leaf': 1, 'subsample': 0.9761874385656274, 'max_features': None}. Best is trial 167 with value: 0.47128001676423487.
[I 2024-12-04 14:49:18,302] Trial 265 finished with value: 0.49372960141781425 and parameters: {'n_estimators': 782, 'learning_rate': 0.016867833144241475, 'max_depth': 11, 'min_samples_split': 20, 'min_samples_leaf': 1, 'subsample': 0.9129933716835245, 'max_features': None}. Best is trial 167 with value: 0.47128001676423487.
[I 2024-12-04 14:49:19,434] Trial 266 finished with value: 0.6619203677621669 and parameters: {'n_estimators': 1105, 'learning_rate': 0.07215758283784611, 'max_depth': 8, 'min_samples_split': 20, 'min_samples_leaf': 3, 'subsample': 0.9496248025247553, 'max_features': 'sqrt'}. Best is trial 167 with value: 0.47128001676423487.
[I 2024-12-04 14:49:20,020] Trial 267 finished with value: 0.49148984569544574 and parameters: {'n_estimators': 773, 'learning_rate': 0.0349218033269925, 'max_depth': 11, 'min_samples_split': 18, 'min_samples_leaf': 1, 'subsample': 0.9816582820647923, 'max_features': None}. Best is trial 167 with value: 0.47128001676423487.
