[I 2024-12-04 12:47:22,316] Trial 1673 finished with value: 0.32218091476654814 and parameters: {'n_estimators': 935, 'learning_rate': 0.05850206973175437, 'max_depth': 8, 'min_samples_split': 2, 'min_samples_leaf': 2, 'subsample': 0.7756474873091547, 'max_features': None}. Best is trial 1454 with value: 0.30763307678022894.
[I 2024-12-04 12:47:23,347] Trial 1668 finished with value: 0.33100627920874054 and parameters: {'n_estimators': 1154, 'learning_rate': 0.09906760202516879, 'max_depth': 6, 'min_samples_split': 5, 'min_samples_leaf': 2, 'subsample': 0.9525790115227739, 'max_features': None}. Best is trial 1454 with value: 0.30763307678022894.
[I 2024-12-04 12:47:25,961] Trial 1695 finished with value: 0.765055525227687 and parameters: {'n_estimators': 441, 'learning_rate': 0.04797177034803499, 'max_depth': 8, 'min_samples_split': 17, 'min_samples_leaf': 10, 'subsample': 0.9858766425125312, 'max_features': 'log2'}. Best is trial 1454 with value: 0.30763307678022894.
[I 2024-12-04 12:47:25,992] Trial 1680 finished with value: 0.3798227453568758 and parameters: {'n_estimators': 956, 'learning_rate': 0.07217739660311488, 'max_depth': 5, 'min_samples_split': 3, 'min_samples_leaf': 4, 'subsample': 0.7407340102218698, 'max_features': None}. Best is trial 1454 with value: 0.30763307678022894.
[I 2024-12-04 12:47:26,634] Trial 1693 finished with value: 0.49964472904906815 and parameters: {'n_estimators': 566, 'learning_rate': 0.011685085937918283, 'max_depth': 12, 'min_samples_split': 16, 'min_samples_leaf': 3, 'subsample': 0.8903193130948884, 'max_features': 'sqrt'}. Best is trial 1454 with value: 0.30763307678022894.
[I 2024-12-04 12:47:29,890] Trial 1683 finished with value: 0.3863946107135216 and parameters: {'n_estimators': 799, 'learning_rate': 0.06565210309957449, 'max_depth': 5, 'min_samples_split': 5, 'min_samples_leaf': 3, 'subsample': 0.6282691958049215, 'max_features': None}. Best is trial 1454 with value: 0.30763307678022894.
[I 2024-12-04 12:47:30,409] Trial 1672 finished with value: 0.32950742479893097 and parameters: {'n_estimators': 1301, 'learning_rate': 0.06874112035034417, 'max_depth': 7, 'min_samples_split': 8, 'min_samples_leaf': 2, 'subsample': 0.6540923161980012, 'max_features': None}. Best is trial 1454 with value: 0.30763307678022894.
[I 2024-12-04 12:47:30,521] Trial 1665 finished with value: 0.33792077312916075 and parameters: {'n_estimators': 1479, 'learning_rate': 0.09985687067899705, 'max_depth': 8, 'min_samples_split': 5, 'min_samples_leaf': 2, 'subsample': 0.6134592758717567, 'max_features': None}. Best is trial 1454 with value: 0.30763307678022894.
[I 2024-12-04 12:47:30,865] Trial 1675 finished with value: 0.4020096721296738 and parameters: {'n_estimators': 1156, 'learning_rate': 0.05753722670379518, 'max_depth': 8, 'min_samples_split': 4, 'min_samples_leaf': 1, 'subsample': 0.72175647256788, 'max_features': None}. Best is trial 1454 with value: 0.30763307678022894.
[I 2024-12-04 12:47:30,914] Trial 1692 finished with value: 0.43558927722494173 and parameters: {'n_estimators': 750, 'learning_rate': 0.04343854648702141, 'max_depth': 7, 'min_samples_split': 15, 'min_samples_leaf': 6, 'subsample': 0.9370306243753959, 'max_features': 'sqrt'}. Best is trial 1454 with value: 0.30763307678022894.
[I 2024-12-04 12:47:32,513] Trial 1704 finished with value: 0.8649569038096644 and parameters: {'n_estimators': 269, 'learning_rate': 0.042220497187314306, 'max_depth': 3, 'min_samples_split': 5, 'min_samples_leaf': 8, 'subsample': 0.6352453180556532, 'max_features': 'log2'}. Best is trial 1454 with value: 0.30763307678022894.
[I 2024-12-04 12:47:34,352] Trial 1682 finished with value: 0.3933365963836614 and parameters: {'n_estimators': 1033, 'learning_rate': 0.032981097471700395, 'max_depth': 7, 'min_samples_split': 2, 'min_samples_leaf': 3, 'subsample': 0.958771604696444, 'max_features': None}. Best is trial 1454 with value: 0.30763307678022894.
[I 2024-12-04 12:47:36,555] Trial 1677 finished with value: 0.3754304066657703 and parameters: {'n_estimators': 1105, 'learning_rate': 0.0540098818027785, 'max_depth': 8, 'min_samples_split': 6, 'min_samples_leaf': 1, 'subsample': 0.7665369306338157, 'max_features': None}. Best is trial 1454 with value: 0.30763307678022894.
[I 2024-12-04 12:47:37,886] Trial 1689 finished with value: 0.3271322528950011 and parameters: {'n_estimators': 965, 'learning_rate': 0.0626762429106932, 'max_depth': 6, 'min_samples_split': 2, 'min_samples_leaf': 2, 'subsample': 0.7061376893296236, 'max_features': None}. Best is trial 1454 with value: 0.30763307678022894.
[I 2024-12-04 12:47:39,326] Trial 1674 finished with value: 0.39567989892202565 and parameters: {'n_estimators': 1363, 'learning_rate': 0.07774801676118687, 'max_depth': 9, 'min_samples_split': 2, 'min_samples_leaf': 3, 'subsample': 0.8136728244608578, 'max_features': None}. Best is trial 1454 with value: 0.30763307678022894.
[I 2024-12-04 12:47:41,060] Trial 1684 finished with value: 0.4062859269586504 and parameters: {'n_estimators': 1161, 'learning_rate': 0.0566123073359817, 'max_depth': 5, 'min_samples_split': 5, 'min_samples_leaf': 1, 'subsample': 0.6178997024009977, 'max_features': None}. Best is trial 1454 with value: 0.30763307678022894.
[I 2024-12-04 12:47:41,540] Trial 1690 finished with value: 0.6854131100228443 and parameters: {'n_estimators': 1213, 'learning_rate': 0.03791200547988741, 'max_depth': 4, 'min_samples_split': 19, 'min_samples_leaf': 10, 'subsample': 0.9271796564437876, 'max_features': 'log2'}. Best is trial 1454 with value: 0.30763307678022894.
[I 2024-12-04 12:47:42,868] Trial 1681 finished with value: 0.3355817346285671 and parameters: {'n_estimators': 1342, 'learning_rate': 0.0995648749578734, 'max_depth': 5, 'min_samples_split': 7, 'min_samples_leaf': 2, 'subsample': 0.7178126668643104, 'max_features': None}. Best is trial 1454 with value: 0.30763307678022894.
[I 2024-12-04 12:47:44,831] Trial 1685 finished with value: 0.39206772223075015 and parameters: {'n_estimators': 1321, 'learning_rate': 0.06550083829585282, 'max_depth': 5, 'min_samples_split': 2, 'min_samples_leaf': 3, 'subsample': 0.6969375777720974, 'max_features': None}. Best is trial 1454 with value: 0.30763307678022894.
[I 2024-12-04 12:47:46,426] Trial 1679 finished with value: 0.3898313101516091 and parameters: {'n_estimators': 1478, 'learning_rate': 0.09013795347205472, 'max_depth': 5, 'min_samples_split': 5, 'min_samples_leaf': 1, 'subsample': 0.8206372701262601, 'max_features': None}. Best is trial 1454 with value: 0.30763307678022894.
[I 2024-12-04 12:47:47,299] Trial 1694 finished with value: 0.38122444318032794 and parameters: {'n_estimators': 1022, 'learning_rate': 0.039872205354787645, 'max_depth': 8, 'min_samples_split': 3, 'min_samples_leaf': 3, 'subsample': 0.7029058067441477, 'max_features': None}. Best is trial 1454 with value: 0.30763307678022894.
[I 2024-12-04 12:47:48,123] Trial 1698 finished with value: 0.3312900004582177 and parameters: {'n_estimators': 899, 'learning_rate': 0.07844439200561024, 'max_depth': 6, 'min_samples_split': 2, 'min_samples_leaf': 2, 'subsample': 0.7669146946279611, 'max_features': None}. Best is trial 1454 with value: 0.30763307678022894.
[I 2024-12-04 12:47:48,125] Trial 1688 finished with value: 0.34464388936774576 and parameters: {'n_estimators': 1245, 'learning_rate': 0.05412705957957142, 'max_depth': 5, 'min_samples_split': 2, 'min_samples_leaf': 2, 'subsample': 0.6526232426856889, 'max_features': None}. Best is trial 1454 with value: 0.30763307678022894.
[I 2024-12-04 12:47:49,107] Trial 1696 finished with value: 0.3801382430703272 and parameters: {'n_estimators': 999, 'learning_rate': 0.07678033073134179, 'max_depth': 7, 'min_samples_split': 2, 'min_samples_leaf': 3, 'subsample': 0.7162749004860177, 'max_features': None}. Best is trial 1454 with value: 0.30763307678022894.
[I 2024-12-04 12:47:49,181] Trial 1700 finished with value: 0.37523264148988844 and parameters: {'n_estimators': 888, 'learning_rate': 0.05792835687733528, 'max_depth': 6, 'min_samples_split': 9, 'min_samples_leaf': 3, 'subsample': 0.6844726015716492, 'max_features': None}. Best is trial 1454 with value: 0.30763307678022894.
[I 2024-12-04 12:47:53,547] Trial 1699 finished with value: 0.38544590056155675 and parameters: {'n_estimators': 1002, 'learning_rate': 0.07710212328179415, 'max_depth': 6, 'min_samples_split': 5, 'min_samples_leaf': 3, 'subsample': 0.9072089855284666, 'max_features': None}. Best is trial 1454 with value: 0.30763307678022894.
[I 2024-12-04 12:47:54,810] Trial 1702 finished with value: 0.33869628340656327 and parameters: {'n_estimators': 937, 'learning_rate': 0.0635713537362779, 'max_depth': 7, 'min_samples_split': 6, 'min_samples_leaf': 2, 'subsample': 0.618032002156625, 'max_features': None}. Best is trial 1454 with value: 0.30763307678022894.
[I 2024-12-04 12:47:56,851] Trial 1703 finished with value: 0.4500967105082313 and parameters: {'n_estimators': 1147, 'learning_rate': 0.08520081910985954, 'max_depth': 8, 'min_samples_split': 11, 'min_samples_leaf': 3, 'subsample': 0.8090975694264897, 'max_features': 'log2'}. Best is trial 1454 with value: 0.30763307678022894.
[I 2024-12-04 12:47:58,217] Trial 1697 finished with value: 0.38953606580811945 and parameters: {'n_estimators': 1203, 'learning_rate': 0.08155208407728841, 'max_depth': 10, 'min_samples_split': 8, 'min_samples_leaf': 6, 'subsample': 0.6168877507160109, 'max_features': None}. Best is trial 1454 with value: 0.30763307678022894.
[I 2024-12-04 12:47:59,401] Trial 1706 finished with value: 0.41026326702823396 and parameters: {'n_estimators': 1093, 'learning_rate': 0.0917178718295585, 'max_depth': 11, 'min_samples_split': 11, 'min_samples_leaf': 5, 'subsample': 0.9780253741021787, 'max_features': 'sqrt'}. Best is trial 1454 with value: 0.30763307678022894.
[I 2024-12-04 12:47:59,402] Trial 1701 finished with value: 0.4129006494234536 and parameters: {'n_estimators': 1021, 'learning_rate': 0.013613938394173465, 'max_depth': 7, 'min_samples_split': 7, 'min_samples_leaf': 6, 'subsample': 0.9939776724339144, 'max_features': None}. Best is trial 1454 with value: 0.30763307678022894.
[I 2024-12-04 12:48:01,245] Trial 1714 finished with value: 0.4109386755336447 and parameters: {'n_estimators': 785, 'learning_rate': 0.0377523162202336, 'max_depth': 6, 'min_samples_split': 6, 'min_samples_leaf': 2, 'subsample': 0.8879525607381703, 'max_features': 'sqrt'}. Best is trial 1454 with value: 0.30763307678022894.
[I 2024-12-04 12:48:05,023] Trial 1716 finished with value: 0.3200007926133747 and parameters: {'n_estimators': 794, 'learning_rate': 0.08935208446952461, 'max_depth': 7, 'min_samples_split': 2, 'min_samples_leaf': 2, 'subsample': 0.6951396099202891, 'max_features': None}. Best is trial 1454 with value: 0.30763307678022894.
[I 2024-12-04 12:48:08,743] Trial 1710 finished with value: 0.3883197022294299 and parameters: {'n_estimators': 1070, 'learning_rate': 0.06413403150261099, 'max_depth': 8, 'min_samples_split': 3, 'min_samples_leaf': 3, 'subsample': 0.8805898975457161, 'max_features': None}. Best is trial 1454 with value: 0.30763307678022894.
[I 2024-12-04 12:48:08,812] Trial 1708 finished with value: 0.38167031634247073 and parameters: {'n_estimators': 1180, 'learning_rate': 0.08605174797102391, 'max_depth': 7, 'min_samples_split': 8, 'min_samples_leaf': 1, 'subsample': 0.9975635077779579, 'max_features': None}. Best is trial 1454 with value: 0.30763307678022894.
[I 2024-12-04 12:48:10,455] Trial 1707 finished with value: 0.32679332937125893 and parameters: {'n_estimators': 1253, 'learning_rate': 0.09082842083396299, 'max_depth': 6, 'min_samples_split': 3, 'min_samples_leaf': 2, 'subsample': 0.8410866630049071, 'max_features': None}. Best is trial 1454 with value: 0.30763307678022894.
[I 2024-12-04 12:48:11,901] Trial 1718 finished with value: 0.3785077177919647 and parameters: {'n_estimators': 967, 'learning_rate': 0.07136688098540628, 'max_depth': 6, 'min_samples_split': 7, 'min_samples_leaf': 5, 'subsample': 0.6175048893819748, 'max_features': None}. Best is trial 1454 with value: 0.30763307678022894.
[I 2024-12-04 12:48:12,319] Trial 1705 finished with value: 0.39002290930077843 and parameters: {'n_estimators': 1464, 'learning_rate': 0.07566665368259103, 'max_depth': 4, 'min_samples_split': 11, 'min_samples_leaf': 1, 'subsample': 0.6758169073550911, 'max_features': None}. Best is trial 1454 with value: 0.30763307678022894.
[I 2024-12-04 12:48:13,264] Trial 1712 finished with value: 0.3706550386427784 and parameters: {'n_estimators': 1039, 'learning_rate': 0.09279876723418186, 'max_depth': 8, 'min_samples_split': 2, 'min_samples_leaf': 1, 'subsample': 0.7319660955733065, 'max_features': None}. Best is trial 1454 with value: 0.30763307678022894.
[I 2024-12-04 12:48:14,985] Trial 1717 finished with value: 0.4009141603588239 and parameters: {'n_estimators': 1041, 'learning_rate': 0.09400830536570452, 'max_depth': 8, 'min_samples_split': 2, 'min_samples_leaf': 6, 'subsample': 0.6002749374826213, 'max_features': None}. Best is trial 1454 with value: 0.30763307678022894.
[I 2024-12-04 12:48:15,979] Trial 1711 finished with value: 0.4275569518386781 and parameters: {'n_estimators': 1478, 'learning_rate': 0.043144832905066925, 'max_depth': 4, 'min_samples_split': 20, 'min_samples_leaf': 1, 'subsample': 0.8384585069180848, 'max_features': 'log2'}. Best is trial 1454 with value: 0.30763307678022894.
[I 2024-12-04 12:48:17,341] Trial 1721 finished with value: 0.40683603683346076 and parameters: {'n_estimators': 1133, 'learning_rate': 0.059054512370158144, 'max_depth': 7, 'min_samples_split': 6, 'min_samples_leaf': 3, 'subsample': 0.7821493248872272, 'max_features': 'sqrt'}. Best is trial 1454 with value: 0.30763307678022894.
[I 2024-12-04 12:48:17,390] Trial 1722 finished with value: 0.39218428391961124 and parameters: {'n_estimators': 933, 'learning_rate': 0.09009255458416716, 'max_depth': 7, 'min_samples_split': 4, 'min_samples_leaf': 3, 'subsample': 0.7557305043876389, 'max_features': None}. Best is trial 1454 with value: 0.30763307678022894.
[I 2024-12-04 12:48:17,967] Trial 1741 finished with value: 0.7277592462798878 and parameters: {'n_estimators': 161, 'learning_rate': 0.03231842112671, 'max_depth': 5, 'min_samples_split': 2, 'min_samples_leaf': 8, 'subsample': 0.954306928142838, 'max_features': 'sqrt'}. Best is trial 1454 with value: 0.30763307678022894.
[I 2024-12-04 12:48:18,121] Trial 1729 finished with value: 0.3960702428028628 and parameters: {'n_estimators': 739, 'learning_rate': 0.06786158094709069, 'max_depth': 7, 'min_samples_split': 6, 'min_samples_leaf': 1, 'subsample': 0.6087059973735143, 'max_features': None}. Best is trial 1454 with value: 0.30763307678022894.
[I 2024-12-04 12:48:19,847] Trial 1709 finished with value: 0.37440638881686855 and parameters: {'n_estimators': 1394, 'learning_rate': 0.08995903470172761, 'max_depth': 8, 'min_samples_split': 11, 'min_samples_leaf': 1, 'subsample': 0.7352355826860231, 'max_features': None}. Best is trial 1454 with value: 0.30763307678022894.
[I 2024-12-04 12:48:21,641] Trial 1731 finished with value: 0.42656895005572304 and parameters: {'n_estimators': 901, 'learning_rate': 0.026987945648386226, 'max_depth': 5, 'min_samples_split': 17, 'min_samples_leaf': 1, 'subsample': 0.6833389853236087, 'max_features': 'sqrt'}. Best is trial 1454 with value: 0.30763307678022894.
[I 2024-12-04 12:48:22,179] Trial 1713 finished with value: 0.38683272847872613 and parameters: {'n_estimators': 1340, 'learning_rate': 0.06860944869752876, 'max_depth': 7, 'min_samples_split': 6, 'min_samples_leaf': 1, 'subsample': 0.6531392405086203, 'max_features': None}. Best is trial 1454 with value: 0.30763307678022894.
[I 2024-12-04 12:48:25,952] Trial 1715 finished with value: 0.3227684606309454 and parameters: {'n_estimators': 1392, 'learning_rate': 0.06176709731886919, 'max_depth': 8, 'min_samples_split': 6, 'min_samples_leaf': 2, 'subsample': 0.7064064684270427, 'max_features': None}. Best is trial 1454 with value: 0.30763307678022894.
[I 2024-12-04 12:48:26,656] Trial 1734 finished with value: 0.41956028852164495 and parameters: {'n_estimators': 922, 'learning_rate': 0.057482396783307424, 'max_depth': 8, 'min_samples_split': 4, 'min_samples_leaf': 4, 'subsample': 0.6002771273785934, 'max_features': 'sqrt'}. Best is trial 1454 with value: 0.30763307678022894.
[I 2024-12-04 12:48:27,189] Trial 1726 finished with value: 0.5556194171200998 and parameters: {'n_estimators': 1280, 'learning_rate': 0.013576746252952694, 'max_depth': 6, 'min_samples_split': 17, 'min_samples_leaf': 2, 'subsample': 0.6789477359614559, 'max_features': 'log2'}. Best is trial 1454 with value: 0.30763307678022894.
[I 2024-12-04 12:48:28,995] Trial 1724 finished with value: 0.4287214954299775 and parameters: {'n_estimators': 1429, 'learning_rate': 0.07387812638090137, 'max_depth': 6, 'min_samples_split': 8, 'min_samples_leaf': 1, 'subsample': 0.7662414856686272, 'max_features': 'log2'}. Best is trial 1454 with value: 0.30763307678022894.
[I 2024-12-04 12:48:29,110] Trial 1725 finished with value: 0.4050831661610027 and parameters: {'n_estimators': 1237, 'learning_rate': 0.03601019726563764, 'max_depth': 5, 'min_samples_split': 5, 'min_samples_leaf': 3, 'subsample': 0.7261196419929548, 'max_features': None}. Best is trial 1454 with value: 0.30763307678022894.
[I 2024-12-04 12:48:29,234] Trial 1723 finished with value: 0.32216057144595844 and parameters: {'n_estimators': 1266, 'learning_rate': 0.0518336949384216, 'max_depth': 7, 'min_samples_split': 4, 'min_samples_leaf': 2, 'subsample': 0.7767501785475375, 'max_features': None}. Best is trial 1454 with value: 0.30763307678022894.
[I 2024-12-04 12:48:29,966] Trial 1745 finished with value: 0.633362563659879 and parameters: {'n_estimators': 354, 'learning_rate': 0.04655735680641818, 'max_depth': 7, 'min_samples_split': 10, 'min_samples_leaf': 10, 'subsample': 0.8563957276041059, 'max_features': 'sqrt'}. Best is trial 1454 with value: 0.30763307678022894.
[I 2024-12-04 12:48:32,418] Trial 1730 finished with value: 0.32764714674836115 and parameters: {'n_estimators': 1124, 'learning_rate': 0.09870355505318504, 'max_depth': 5, 'min_samples_split': 2, 'min_samples_leaf': 2, 'subsample': 0.7874805663660052, 'max_features': None}. Best is trial 1454 with value: 0.30763307678022894.
[I 2024-12-04 12:48:34,190] Trial 1720 finished with value: 0.3949550398803678 and parameters: {'n_estimators': 1479, 'learning_rate': 0.0956314314858719, 'max_depth': 7, 'min_samples_split': 5, 'min_samples_leaf': 3, 'subsample': 0.7040009280017234, 'max_features': None}. Best is trial 1454 with value: 0.30763307678022894.
[I 2024-12-04 12:48:35,093] Trial 1719 finished with value: 0.3910491239469337 and parameters: {'n_estimators': 1421, 'learning_rate': 0.01176518890490436, 'max_depth': 11, 'min_samples_split': 20, 'min_samples_leaf': 1, 'subsample': 0.8561152622326936, 'max_features': None}. Best is trial 1454 with value: 0.30763307678022894.
[I 2024-12-04 12:48:35,095] Trial 1739 finished with value: 0.3942421763728646 and parameters: {'n_estimators': 773, 'learning_rate': 0.06692278501236933, 'max_depth': 8, 'min_samples_split': 2, 'min_samples_leaf': 3, 'subsample': 0.6837318566214261, 'max_features': None}. Best is trial 1454 with value: 0.30763307678022894.
[I 2024-12-04 12:48:37,004] Trial 1733 finished with value: 0.8058860149566509 and parameters: {'n_estimators': 1364, 'learning_rate': 0.01801515613248532, 'max_depth': 3, 'min_samples_split': 9, 'min_samples_leaf': 10, 'subsample': 0.6490977372707776, 'max_features': 'log2'}. Best is trial 1454 with value: 0.30763307678022894.
[I 2024-12-04 12:48:37,031] Trial 1740 finished with value: 0.32490090266378757 and parameters: {'n_estimators': 680, 'learning_rate': 0.06173818207980724, 'max_depth': 7, 'min_samples_split': 4, 'min_samples_leaf': 2, 'subsample': 0.6615877556987226, 'max_features': None}. Best is trial 1454 with value: 0.30763307678022894.
[I 2024-12-04 12:48:38,509] Trial 1738 finished with value: 0.3711600045978159 and parameters: {'n_estimators': 1016, 'learning_rate': 0.0978078836936818, 'max_depth': 6, 'min_samples_split': 5, 'min_samples_leaf': 4, 'subsample': 0.6759340128274957, 'max_features': None}. Best is trial 1454 with value: 0.30763307678022894.
[I 2024-12-04 12:48:39,401] Trial 1727 finished with value: 0.3966862746145065 and parameters: {'n_estimators': 1462, 'learning_rate': 0.09652353449384113, 'max_depth': 5, 'min_samples_split': 4, 'min_samples_leaf': 3, 'subsample': 0.6958046521048237, 'max_features': None}. Best is trial 1454 with value: 0.30763307678022894.
[I 2024-12-04 12:48:40,816] Trial 1728 finished with value: 0.3920099900348432 and parameters: {'n_estimators': 1285, 'learning_rate': 0.0779209255957973, 'max_depth': 10, 'min_samples_split': 2, 'min_samples_leaf': 1, 'subsample': 0.7869467723804188, 'max_features': None}. Best is trial 1454 with value: 0.30763307678022894.
[I 2024-12-04 12:48:41,152] Trial 1744 finished with value: 0.3389982870498819 and parameters: {'n_estimators': 668, 'learning_rate': 0.07218533379854009, 'max_depth': 5, 'min_samples_split': 2, 'min_samples_leaf': 2, 'subsample': 0.6000868081046121, 'max_features': None}. Best is trial 1454 with value: 0.30763307678022894.
[I 2024-12-04 12:48:43,037] Trial 1742 finished with value: 0.3986359847315849 and parameters: {'n_estimators': 799, 'learning_rate': 0.06921265013164975, 'max_depth': 6, 'min_samples_split': 2, 'min_samples_leaf': 3, 'subsample': 0.7375624399391131, 'max_features': None}. Best is trial 1454 with value: 0.30763307678022894.
[I 2024-12-04 12:48:43,257] Trial 1732 finished with value: 0.3727321902822763 and parameters: {'n_estimators': 1341, 'learning_rate': 0.09925269968550561, 'max_depth': 7, 'min_samples_split': 2, 'min_samples_leaf': 1, 'subsample': 0.6611469043889838, 'max_features': None}. Best is trial 1454 with value: 0.30763307678022894.
