[I 2024-12-04 20:03:00,257] Trial 684 finished with value: 0.3234505867493585 and parameters: {'n_estimators': 412, 'max_depth': 50, 'min_samples_split': 2, 'min_samples_leaf': 1, 'max_features': 'sqrt', 'bootstrap': False, 'criterion': 'squared_error'}. Best is trial 457 with value: 0.3223992246327795.
[I 2024-12-04 20:03:02,035] Trial 687 finished with value: 1.2631600238320968 and parameters: {'n_estimators': 990, 'max_depth': 33, 'min_samples_split': 26, 'min_samples_leaf': 8, 'max_features': 'log2', 'bootstrap': False, 'criterion': 'squared_error'}. Best is trial 457 with value: 0.3223992246327795.
[I 2024-12-04 20:03:02,791] Trial 686 finished with value: 0.32291045724389833 and parameters: {'n_estimators': 350, 'max_depth': 49, 'min_samples_split': 2, 'min_samples_leaf': 1, 'max_features': 'sqrt', 'bootstrap': False, 'criterion': 'squared_error'}. Best is trial 457 with value: 0.3223992246327795.
[I 2024-12-04 20:03:03,219] Trial 688 finished with value: 0.3893489467239245 and parameters: {'n_estimators': 186, 'max_depth': 50, 'min_samples_split': 4, 'min_samples_leaf': 1, 'max_features': 'sqrt', 'bootstrap': False, 'criterion': 'squared_error'}. Best is trial 457 with value: 0.3223992246327795.
[I 2024-12-04 20:03:04,681] Trial 689 finished with value: 0.3235194005806658 and parameters: {'n_estimators': 333, 'max_depth': 50, 'min_samples_split': 2, 'min_samples_leaf': 1, 'max_features': 'sqrt', 'bootstrap': False, 'criterion': 'squared_error'}. Best is trial 457 with value: 0.3223992246327795.
[I 2024-12-04 20:03:05,582] Trial 690 finished with value: 1.017186246442923 and parameters: {'n_estimators': 159, 'max_depth': 42, 'min_samples_split': 8, 'min_samples_leaf': 3, 'max_features': 'sqrt', 'bootstrap': False, 'criterion': 'absolute_error'}. Best is trial 457 with value: 0.3223992246327795.
[I 2024-12-04 20:03:06,480] Trial 691 finished with value: 0.3251493599904596 and parameters: {'n_estimators': 283, 'max_depth': 50, 'min_samples_split': 2, 'min_samples_leaf': 1, 'max_features': 'sqrt', 'bootstrap': False, 'criterion': 'squared_error'}. Best is trial 457 with value: 0.3223992246327795.
[I 2024-12-04 20:03:07,389] Trial 692 finished with value: 0.4041742522807069 and parameters: {'n_estimators': 458, 'max_depth': 44, 'min_samples_split': 4, 'min_samples_leaf': 1, 'max_features': 'sqrt', 'bootstrap': False, 'criterion': 'squared_error'}. Best is trial 457 with value: 0.3223992246327795.
[I 2024-12-04 20:03:07,883] Trial 693 finished with value: 0.5410156880829147 and parameters: {'n_estimators': 214, 'max_depth': 49, 'min_samples_split': 2, 'min_samples_leaf': 1, 'max_features': 'log2', 'bootstrap': False, 'criterion': 'squared_error'}. Best is trial 457 with value: 0.3223992246327795.
[I 2024-12-04 20:03:08,715] Trial 694 finished with value: 0.664340760751789 and parameters: {'n_estimators': 314, 'max_depth': 50, 'min_samples_split': 2, 'min_samples_leaf': 2, 'max_features': 'sqrt', 'bootstrap': False, 'criterion': 'squared_error'}. Best is trial 457 with value: 0.3223992246327795.
[I 2024-12-04 20:03:13,340] Trial 696 finished with value: 0.43501070256781366 and parameters: {'n_estimators': 486, 'max_depth': 43, 'min_samples_split': 2, 'min_samples_leaf': 1, 'max_features': None, 'bootstrap': False, 'criterion': 'squared_error'}. Best is trial 457 with value: 0.3223992246327795.
[I 2024-12-04 20:03:14,828] Trial 697 finished with value: 0.3248131125184363 and parameters: {'n_estimators': 238, 'max_depth': 50, 'min_samples_split': 2, 'min_samples_leaf': 1, 'max_features': 'sqrt', 'bootstrap': False, 'criterion': 'squared_error'}. Best is trial 457 with value: 0.3223992246327795.
[I 2024-12-04 20:03:15,905] Trial 698 finished with value: 0.6796720956721349 and parameters: {'n_estimators': 280, 'max_depth': 38, 'min_samples_split': 3, 'min_samples_leaf': 2, 'max_features': 'sqrt', 'bootstrap': False, 'criterion': 'squared_error'}. Best is trial 457 with value: 0.3223992246327795.
[I 2024-12-04 20:03:16,753] Trial 695 finished with value: 0.8539204095815724 and parameters: {'n_estimators': 458, 'max_depth': 20, 'min_samples_split': 13, 'min_samples_leaf': 1, 'max_features': 'sqrt', 'bootstrap': False, 'criterion': 'absolute_error'}. Best is trial 457 with value: 0.3223992246327795.
[I 2024-12-04 20:03:18,449] Trial 699 finished with value: 0.3608395587904482 and parameters: {'n_estimators': 465, 'max_depth': 41, 'min_samples_split': 2, 'min_samples_leaf': 1, 'max_features': 'sqrt', 'bootstrap': False, 'criterion': 'squared_error'}. Best is trial 457 with value: 0.3223992246327795.
[I 2024-12-04 20:03:18,500] Trial 700 finished with value: 1.0398945673981113 and parameters: {'n_estimators': 887, 'max_depth': 17, 'min_samples_split': 23, 'min_samples_leaf': 4, 'max_features': 'sqrt', 'bootstrap': True, 'criterion': 'squared_error'}. Best is trial 457 with value: 0.3223992246327795.
[I 2024-12-04 20:03:20,463] Trial 701 finished with value: 1.2499581387343868 and parameters: {'n_estimators': 219, 'max_depth': 11, 'min_samples_split': 14, 'min_samples_leaf': 2, 'max_features': 'log2', 'bootstrap': False, 'criterion': 'absolute_error'}. Best is trial 457 with value: 0.3223992246327795.
[I 2024-12-04 20:03:20,978] Trial 702 finished with value: 0.3241660666406343 and parameters: {'n_estimators': 413, 'max_depth': 50, 'min_samples_split': 2, 'min_samples_leaf': 1, 'max_features': 'sqrt', 'bootstrap': False, 'criterion': 'squared_error'}. Best is trial 457 with value: 0.3223992246327795.
[I 2024-12-04 20:03:22,132] Trial 704 finished with value: 1.3371501134006931 and parameters: {'n_estimators': 266, 'max_depth': 5, 'min_samples_split': 17, 'min_samples_leaf': 9, 'max_features': 'log2', 'bootstrap': False, 'criterion': 'absolute_error'}. Best is trial 457 with value: 0.3223992246327795.
[I 2024-12-04 20:03:22,686] Trial 703 finished with value: 0.3493128334443279 and parameters: {'n_estimators': 387, 'max_depth': 43, 'min_samples_split': 2, 'min_samples_leaf': 1, 'max_features': 'sqrt', 'bootstrap': False, 'criterion': 'squared_error'}. Best is trial 457 with value: 0.3223992246327795.
[I 2024-12-04 20:03:23,845] Trial 705 finished with value: 0.3626800818970826 and parameters: {'n_estimators': 265, 'max_depth': 40, 'min_samples_split': 2, 'min_samples_leaf': 1, 'max_features': 'sqrt', 'bootstrap': False, 'criterion': 'squared_error'}. Best is trial 457 with value: 0.3223992246327795.
[I 2024-12-04 20:03:24,778] Trial 706 finished with value: 0.3235194005806658 and parameters: {'n_estimators': 333, 'max_depth': 50, 'min_samples_split': 2, 'min_samples_leaf': 1, 'max_features': 'sqrt', 'bootstrap': False, 'criterion': 'squared_error'}. Best is trial 457 with value: 0.3223992246327795.
[I 2024-12-04 20:03:25,215] Trial 707 finished with value: 0.680928630042919 and parameters: {'n_estimators': 392, 'max_depth': 50, 'min_samples_split': 2, 'min_samples_leaf': 2, 'max_features': 'sqrt', 'bootstrap': False, 'criterion': 'squared_error'}. Best is trial 457 with value: 0.3223992246327795.
[I 2024-12-04 20:03:26,762] Trial 709 finished with value: 0.38723084353896525 and parameters: {'n_estimators': 327, 'max_depth': 49, 'min_samples_split': 4, 'min_samples_leaf': 1, 'max_features': 'sqrt', 'bootstrap': False, 'criterion': 'squared_error'}. Best is trial 457 with value: 0.3223992246327795.
[I 2024-12-04 20:03:28,515] Trial 710 finished with value: 0.3620509114193808 and parameters: {'n_estimators': 414, 'max_depth': 50, 'min_samples_split': 3, 'min_samples_leaf': 1, 'max_features': 'sqrt', 'bootstrap': False, 'criterion': 'squared_error'}. Best is trial 457 with value: 0.3223992246327795.
[I 2024-12-04 20:03:29,693] Trial 711 finished with value: 0.7865442535751344 and parameters: {'n_estimators': 319, 'max_depth': 49, 'min_samples_split': 4, 'min_samples_leaf': 2, 'max_features': 'sqrt', 'bootstrap': True, 'criterion': 'squared_error'}. Best is trial 457 with value: 0.3223992246327795.
[I 2024-12-04 20:03:30,418] Trial 708 finished with value: 0.7591153428290391 and parameters: {'n_estimators': 566, 'max_depth': 17, 'min_samples_split': 14, 'min_samples_leaf': 13, 'max_features': None, 'bootstrap': True, 'criterion': 'absolute_error'}. Best is trial 457 with value: 0.3223992246327795.
[I 2024-12-04 20:03:30,924] Trial 712 finished with value: 0.6666684873986873 and parameters: {'n_estimators': 290, 'max_depth': 42, 'min_samples_split': 2, 'min_samples_leaf': 2, 'max_features': 'sqrt', 'bootstrap': False, 'criterion': 'squared_error'}. Best is trial 457 with value: 0.3223992246327795.
[I 2024-12-04 20:03:32,482] Trial 713 finished with value: 0.3460040968049445 and parameters: {'n_estimators': 364, 'max_depth': 42, 'min_samples_split': 2, 'min_samples_leaf': 1, 'max_features': 'sqrt', 'bootstrap': False, 'criterion': 'squared_error'}. Best is trial 457 with value: 0.3223992246327795.
[I 2024-12-04 20:03:33,125] Trial 714 finished with value: 0.32309794764926164 and parameters: {'n_estimators': 384, 'max_depth': 50, 'min_samples_split': 2, 'min_samples_leaf': 1, 'max_features': 'sqrt', 'bootstrap': False, 'criterion': 'squared_error'}. Best is trial 457 with value: 0.3223992246327795.
[I 2024-12-04 20:03:34,234] Trial 716 finished with value: 1.2787104889175613 and parameters: {'n_estimators': 407, 'max_depth': 49, 'min_samples_split': 41, 'min_samples_leaf': 11, 'max_features': 'log2', 'bootstrap': True, 'criterion': 'squared_error'}. Best is trial 457 with value: 0.3223992246327795.
[I 2024-12-04 20:03:37,481] Trial 715 finished with value: 0.8828870264312895 and parameters: {'n_estimators': 267, 'max_depth': 50, 'min_samples_split': 2, 'min_samples_leaf': 2, 'max_features': 'sqrt', 'bootstrap': False, 'criterion': 'absolute_error'}. Best is trial 457 with value: 0.3223992246327795.
[I 2024-12-04 20:03:39,418] Trial 718 finished with value: 0.34859308285524765 and parameters: {'n_estimators': 390, 'max_depth': 41, 'min_samples_split': 2, 'min_samples_leaf': 1, 'max_features': 'sqrt', 'bootstrap': False, 'criterion': 'squared_error'}. Best is trial 457 with value: 0.3223992246327795.
[I 2024-12-04 20:03:40,790] Trial 673 finished with value: 0.5519532380635985 and parameters: {'n_estimators': 746, 'max_depth': 47, 'min_samples_split': 21, 'min_samples_leaf': 1, 'max_features': None, 'bootstrap': True, 'criterion': 'absolute_error'}. Best is trial 457 with value: 0.3223992246327795.
[I 2024-12-04 20:03:42,690] Trial 720 finished with value: 0.3235015797135766 and parameters: {'n_estimators': 360, 'max_depth': 50, 'min_samples_split': 2, 'min_samples_leaf': 1, 'max_features': 'sqrt', 'bootstrap': False, 'criterion': 'squared_error'}. Best is trial 457 with value: 0.3223992246327795.
[I 2024-12-04 20:03:44,038] Trial 721 finished with value: 1.1155949858169467 and parameters: {'n_estimators': 849, 'max_depth': 5, 'min_samples_split': 19, 'min_samples_leaf': 3, 'max_features': 'sqrt', 'bootstrap': False, 'criterion': 'squared_error'}. Best is trial 457 with value: 0.3223992246327795.
[I 2024-12-04 20:03:45,539] Trial 722 finished with value: 0.3237977392306879 and parameters: {'n_estimators': 246, 'max_depth': 50, 'min_samples_split': 2, 'min_samples_leaf': 1, 'max_features': 'sqrt', 'bootstrap': False, 'criterion': 'squared_error'}. Best is trial 457 with value: 0.3223992246327795.
[I 2024-12-04 20:03:46,901] Trial 723 finished with value: 0.4110917893170398 and parameters: {'n_estimators': 326, 'max_depth': 43, 'min_samples_split': 4, 'min_samples_leaf': 1, 'max_features': 'sqrt', 'bootstrap': False, 'criterion': 'squared_error'}. Best is trial 457 with value: 0.3223992246327795.
[I 2024-12-04 20:03:48,409] Trial 724 finished with value: 1.3035494922502442 and parameters: {'n_estimators': 602, 'max_depth': 8, 'min_samples_split': 45, 'min_samples_leaf': 11, 'max_features': 'sqrt', 'bootstrap': True, 'criterion': 'absolute_error'}. Best is trial 457 with value: 0.3223992246327795.
[I 2024-12-04 20:03:52,105] Trial 719 finished with value: 0.6073176837795384 and parameters: {'n_estimators': 399, 'max_depth': 27, 'min_samples_split': 43, 'min_samples_leaf': 7, 'max_features': None, 'bootstrap': False, 'criterion': 'absolute_error'}. Best is trial 457 with value: 0.3223992246327795.
[I 2024-12-04 20:03:53,634] Trial 726 finished with value: 0.38636913646174187 and parameters: {'n_estimators': 363, 'max_depth': 50, 'min_samples_split': 4, 'min_samples_leaf': 1, 'max_features': 'sqrt', 'bootstrap': False, 'criterion': 'squared_error'}. Best is trial 457 with value: 0.3223992246327795.
[I 2024-12-04 20:03:54,799] Trial 727 finished with value: 1.2678375876089998 and parameters: {'n_estimators': 371, 'max_depth': 46, 'min_samples_split': 8, 'min_samples_leaf': 10, 'max_features': 'log2', 'bootstrap': False, 'criterion': 'squared_error'}. Best is trial 457 with value: 0.3223992246327795.
[I 2024-12-04 20:03:55,575] Trial 728 finished with value: 1.2696343394483898 and parameters: {'n_estimators': 156, 'max_depth': 33, 'min_samples_split': 17, 'min_samples_leaf': 9, 'max_features': 'log2', 'bootstrap': False, 'criterion': 'squared_error'}. Best is trial 457 with value: 0.3223992246327795.
[I 2024-12-04 20:03:57,668] Trial 729 finished with value: 0.3233400304361499 and parameters: {'n_estimators': 418, 'max_depth': 50, 'min_samples_split': 2, 'min_samples_leaf': 1, 'max_features': 'sqrt', 'bootstrap': False, 'criterion': 'squared_error'}. Best is trial 457 with value: 0.3223992246327795.
[I 2024-12-04 20:03:59,403] Trial 730 finished with value: 0.3613103806007935 and parameters: {'n_estimators': 412, 'max_depth': 50, 'min_samples_split': 3, 'min_samples_leaf': 1, 'max_features': 'sqrt', 'bootstrap': False, 'criterion': 'squared_error'}. Best is trial 457 with value: 0.3223992246327795.
[I 2024-12-04 20:04:00,987] Trial 731 finished with value: 1.2778443491393792 and parameters: {'n_estimators': 899, 'max_depth': 40, 'min_samples_split': 20, 'min_samples_leaf': 12, 'max_features': 'log2', 'bootstrap': True, 'criterion': 'squared_error'}. Best is trial 457 with value: 0.3223992246327795.
[I 2024-12-04 20:04:05,691] Trial 717 finished with value: 0.5620282926810602 and parameters: {'n_estimators': 770, 'max_depth': 12, 'min_samples_split': 22, 'min_samples_leaf': 2, 'max_features': None, 'bootstrap': True, 'criterion': 'absolute_error'}. Best is trial 457 with value: 0.3223992246327795.
[I 2024-12-04 20:04:07,572] Trial 733 finished with value: 0.5880525955257061 and parameters: {'n_estimators': 407, 'max_depth': 8, 'min_samples_split': 2, 'min_samples_leaf': 11, 'max_features': None, 'bootstrap': False, 'criterion': 'squared_error'}. Best is trial 457 with value: 0.3223992246327795.
[I 2024-12-04 20:04:09,214] Trial 734 finished with value: 0.6752859426066745 and parameters: {'n_estimators': 599, 'max_depth': 50, 'min_samples_split': 2, 'min_samples_leaf': 2, 'max_features': 'sqrt', 'bootstrap': False, 'criterion': 'squared_error'}. Best is trial 457 with value: 0.3223992246327795.
[I 2024-12-04 20:04:10,039] Trial 732 finished with value: 0.41560041099263456 and parameters: {'n_estimators': 326, 'max_depth': 47, 'min_samples_split': 4, 'min_samples_leaf': 1, 'max_features': 'sqrt', 'bootstrap': False, 'criterion': 'absolute_error'}. Best is trial 457 with value: 0.3223992246327795.
[I 2024-12-04 20:04:10,792] Trial 735 finished with value: 0.5891157369751496 and parameters: {'n_estimators': 375, 'max_depth': 47, 'min_samples_split': 4, 'min_samples_leaf': 1, 'max_features': 'log2', 'bootstrap': False, 'criterion': 'squared_error'}. Best is trial 457 with value: 0.3223992246327795.
[I 2024-12-04 20:04:11,360] Trial 736 finished with value: 1.2235063202967402 and parameters: {'n_estimators': 424, 'max_depth': 44, 'min_samples_split': 13, 'min_samples_leaf': 3, 'max_features': 'log2', 'bootstrap': True, 'criterion': 'squared_error'}. Best is trial 457 with value: 0.3223992246327795.
[I 2024-12-04 20:04:12,145] Trial 737 finished with value: 0.6625664198762813 and parameters: {'n_estimators': 303, 'max_depth': 50, 'min_samples_split': 2, 'min_samples_leaf': 2, 'max_features': 'sqrt', 'bootstrap': False, 'criterion': 'squared_error'}. Best is trial 457 with value: 0.3223992246327795.
[I 2024-12-04 20:04:13,475] Trial 739 finished with value: 0.35323149762976386 and parameters: {'n_estimators': 199, 'max_depth': 44, 'min_samples_split': 2, 'min_samples_leaf': 1, 'max_features': 'sqrt', 'bootstrap': False, 'criterion': 'squared_error'}. Best is trial 457 with value: 0.3223992246327795.
[I 2024-12-04 20:04:13,919] Trial 738 finished with value: 0.3234659763435935 and parameters: {'n_estimators': 417, 'max_depth': 50, 'min_samples_split': 2, 'min_samples_leaf': 1, 'max_features': 'sqrt', 'bootstrap': False, 'criterion': 'squared_error'}. Best is trial 457 with value: 0.3223992246327795.
[I 2024-12-04 20:04:14,937] Trial 740 finished with value: 0.6657157505641917 and parameters: {'n_estimators': 315, 'max_depth': 50, 'min_samples_split': 2, 'min_samples_leaf': 2, 'max_features': 'sqrt', 'bootstrap': False, 'criterion': 'squared_error'}. Best is trial 457 with value: 0.3223992246327795.
[I 2024-12-04 20:04:15,666] Trial 741 finished with value: 0.3557388262470975 and parameters: {'n_estimators': 299, 'max_depth': 50, 'min_samples_split': 3, 'min_samples_leaf': 1, 'max_features': 'sqrt', 'bootstrap': False, 'criterion': 'squared_error'}. Best is trial 457 with value: 0.3223992246327795.
[I 2024-12-04 20:04:16,073] Trial 742 finished with value: 0.7971617927435299 and parameters: {'n_estimators': 233, 'max_depth': 42, 'min_samples_split': 2, 'min_samples_leaf': 2, 'max_features': 'sqrt', 'bootstrap': True, 'criterion': 'squared_error'}. Best is trial 457 with value: 0.3223992246327795.
[I 2024-12-04 20:04:17,538] Trial 743 finished with value: 0.34580614001468585 and parameters: {'n_estimators': 315, 'max_depth': 43, 'min_samples_split': 2, 'min_samples_leaf': 1, 'max_features': 'sqrt', 'bootstrap': False, 'criterion': 'squared_error'}. Best is trial 457 with value: 0.3223992246327795.
[I 2024-12-04 20:04:17,970] Trial 744 finished with value: 0.32506853049252815 and parameters: {'n_estimators': 296, 'max_depth': 50, 'min_samples_split': 2, 'min_samples_leaf': 1, 'max_features': 'sqrt', 'bootstrap': False, 'criterion': 'squared_error'}. Best is trial 457 with value: 0.3223992246327795.
[I 2024-12-04 20:04:19,044] Trial 746 finished with value: 0.3759732451657556 and parameters: {'n_estimators': 122, 'max_depth': 50, 'min_samples_split': 3, 'min_samples_leaf': 1, 'max_features': 'sqrt', 'bootstrap': False, 'criterion': 'squared_error'}. Best is trial 457 with value: 0.3223992246327795.
[I 2024-12-04 20:04:19,468] Trial 745 finished with value: 0.3237871829641958 and parameters: {'n_estimators': 320, 'max_depth': 50, 'min_samples_split': 2, 'min_samples_leaf': 1, 'max_features': 'sqrt', 'bootstrap': False, 'criterion': 'squared_error'}. Best is trial 457 with value: 0.3223992246327795.
[I 2024-12-04 20:04:21,033] Trial 747 finished with value: 0.41422197841172825 and parameters: {'n_estimators': 388, 'max_depth': 40, 'min_samples_split': 2, 'min_samples_leaf': 1, 'max_features': 'sqrt', 'bootstrap': True, 'criterion': 'squared_error'}. Best is trial 457 with value: 0.3223992246327795.
[I 2024-12-04 20:04:21,275] Trial 748 finished with value: 0.48057602809083616 and parameters: {'n_estimators': 448, 'max_depth': 50, 'min_samples_split': 5, 'min_samples_leaf': 1, 'max_features': 'sqrt', 'bootstrap': True, 'criterion': 'squared_error'}. Best is trial 457 with value: 0.3223992246327795.
[I 2024-12-04 20:04:22,315] Trial 750 finished with value: 0.9007505957260848 and parameters: {'n_estimators': 108, 'max_depth': 20, 'min_samples_split': 3, 'min_samples_leaf': 1, 'max_features': 'log2', 'bootstrap': True, 'criterion': 'squared_error'}. Best is trial 457 with value: 0.3223992246327795.
[I 2024-12-04 20:04:23,958] Trial 725 finished with value: 0.48997351402737715 and parameters: {'n_estimators': 511, 'max_depth': 32, 'min_samples_split': 13, 'min_samples_leaf': 1, 'max_features': None, 'bootstrap': True, 'criterion': 'absolute_error'}. Best is trial 457 with value: 0.3223992246327795.
[I 2024-12-04 20:04:25,426] Trial 751 finished with value: 1.2737930925967853 and parameters: {'n_estimators': 689, 'max_depth': 24, 'min_samples_split': 48, 'min_samples_leaf': 2, 'max_features': 'log2', 'bootstrap': True, 'criterion': 'absolute_error'}. Best is trial 457 with value: 0.3223992246327795.
[I 2024-12-04 20:04:26,332] Trial 752 finished with value: 0.3599161741245895 and parameters: {'n_estimators': 491, 'max_depth': 41, 'min_samples_split': 2, 'min_samples_leaf': 1, 'max_features': 'sqrt', 'bootstrap': False, 'criterion': 'squared_error'}. Best is trial 457 with value: 0.3223992246327795.
[I 2024-12-04 20:04:27,053] Trial 753 finished with value: 0.4761463683228915 and parameters: {'n_estimators': 179, 'max_depth': 40, 'min_samples_split': 10, 'min_samples_leaf': 1, 'max_features': None, 'bootstrap': True, 'criterion': 'squared_error'}. Best is trial 457 with value: 0.3223992246327795.
[I 2024-12-04 20:04:28,745] Trial 754 finished with value: 0.3290612550567856 and parameters: {'n_estimators': 467, 'max_depth': 50, 'min_samples_split': 2, 'min_samples_leaf': 1, 'max_features': 'sqrt', 'bootstrap': False, 'criterion': 'squared_error'}. Best is trial 457 with value: 0.3223992246327795.
[I 2024-12-04 20:04:28,799] Trial 755 finished with value: 0.344978293408278 and parameters: {'n_estimators': 351, 'max_depth': 42, 'min_samples_split': 2, 'min_samples_leaf': 1, 'max_features': 'sqrt', 'bootstrap': False, 'criterion': 'squared_error'}. Best is trial 457 with value: 0.3223992246327795.
[I 2024-12-04 20:04:30,221] Trial 756 finished with value: 0.6961345601507187 and parameters: {'n_estimators': 444, 'max_depth': 43, 'min_samples_split': 2, 'min_samples_leaf': 2, 'max_features': 'sqrt', 'bootstrap': False, 'criterion': 'squared_error'}. Best is trial 457 with value: 0.3223992246327795.
