[I 2024-12-04 19:55:30,513] Trial 482 finished with value: 0.3592111102200993 and parameters: {'kernel_type': 'Matern', 'length_scale': 0.5270529753353501, 'noise_level': 0.4814411726964377, 'constant_value': 323.8250502397403, 'nu': 0.5}. Best is trial 448 with value: 0.3592093758005386.
[I 2024-12-04 19:55:30,888] Trial 481 finished with value: 0.3592112320137555 and parameters: {'kernel_type': 'Matern', 'length_scale': 18.42108436919888, 'noise_level': 0.016930224711464555, 'constant_value': 3.4805890382742226, 'nu': 0.5}. Best is trial 448 with value: 0.3592093758005386.
[I 2024-12-04 19:55:33,600] Trial 484 finished with value: 1.0916557446533557 and parameters: {'kernel_type': 'Matern', 'length_scale': 1.0327377040390766, 'noise_level': 3.2959569955635884e-06, 'constant_value': 100.06438410979476, 'nu': 0.5}. Best is trial 448 with value: 0.3592093758005386.
[I 2024-12-04 19:55:34,577] Trial 485 finished with value: 1.0624161175882882 and parameters: {'kernel_type': 'Matern', 'length_scale': 0.0005015272767529448, 'noise_level': 0.5134977304974203, 'constant_value': 21140.737181598157, 'nu': 0.5}. Best is trial 448 with value: 0.3592093758005386.
[I 2024-12-04 19:55:35,447] Trial 483 finished with value: 0.419565949765852 and parameters: {'kernel_type': 'Matern', 'length_scale': 0.18328306386513663, 'noise_level': 0.07433943431447777, 'constant_value': 23.075118777542166, 'nu': 2.5}. Best is trial 448 with value: 0.3592093758005386.
[I 2024-12-04 19:55:37,638] Trial 486 finished with value: 0.3592112380442496 and parameters: {'kernel_type': 'Matern', 'length_scale': 10.532563730223583, 'noise_level': 0.007324376358867267, 'constant_value': 14.696007761514489, 'nu': 0.5}. Best is trial 448 with value: 0.3592093758005386.
[I 2024-12-04 19:55:38,091] Trial 487 finished with value: 1.0624161173427342 and parameters: {'kernel_type': 'Matern', 'length_scale': 1.0901498541632242e-05, 'noise_level': 0.0006666956910829176, 'constant_value': 0.05986325239634482, 'nu': 1.5}. Best is trial 448 with value: 0.3592093758005386.
[I 2024-12-04 19:55:39,458] Trial 488 finished with value: 1.0624161172314657 and parameters: {'kernel_type': 'Matern', 'length_scale': 8.436696599304892e-05, 'noise_level': 0.03456496554516879, 'constant_value': 55046.41089070642, 'nu': 1.5}. Best is trial 448 with value: 0.3592093758005386.
[I 2024-12-04 19:55:42,191] Trial 490 finished with value: 0.4286835249267132 and parameters: {'kernel_type': 'RBF', 'length_scale': 8.788689376461873, 'noise_level': 0.5003076728774274, 'constant_value': 0.6656903475792529, 'nu': 0.5}. Best is trial 448 with value: 0.3592093758005386.
[I 2024-12-04 19:55:42,485] Trial 489 finished with value: 0.3592108528279754 and parameters: {'kernel_type': 'Matern', 'length_scale': 112.89675998389531, 'noise_level': 0.03825801280580809, 'constant_value': 8.407058361855983, 'nu': 0.5}. Best is trial 448 with value: 0.3592093758005386.
[I 2024-12-04 19:55:45,312] Trial 491 finished with value: 0.3592113215002856 and parameters: {'kernel_type': 'Matern', 'length_scale': 147.01854300984218, 'noise_level': 0.002639360871951608, 'constant_value': 4.570687749396924, 'nu': 0.5}. Best is trial 448 with value: 0.3592093758005386.
[I 2024-12-04 19:55:47,608] Trial 493 finished with value: 0.3592123230047358 and parameters: {'kernel_type': 'Matern', 'length_scale': 10.142049563439386, 'noise_level': 0.03088318035642058, 'constant_value': 86.61133090241056, 'nu': 0.5}. Best is trial 448 with value: 0.3592093758005386.
[I 2024-12-04 19:55:47,700] Trial 492 finished with value: 0.35921123523579834 and parameters: {'kernel_type': 'Matern', 'length_scale': 1.6509043838963167, 'noise_level': 0.016311715914788496, 'constant_value': 78.17733514996759, 'nu': 0.5}. Best is trial 448 with value: 0.3592093758005386.
[I 2024-12-04 19:55:51,030] Trial 495 finished with value: 1.0916558493878483 and parameters: {'kernel_type': 'Matern', 'length_scale': 3.3177321342873796e-05, 'noise_level': 5.381298873856155e-07, 'constant_value': 499.71624453246665, 'nu': 0.5}. Best is trial 448 with value: 0.3592093758005386.
[I 2024-12-04 19:55:51,779] Trial 496 finished with value: 0.35921320772889415 and parameters: {'kernel_type': 'Matern', 'length_scale': 6.501771298711591, 'noise_level': 0.01677136902580526, 'constant_value': 0.6495545112169279, 'nu': 0.5}. Best is trial 448 with value: 0.3592093758005386.
[I 2024-12-04 19:55:52,914] Trial 494 finished with value: 1.0624161172401128 and parameters: {'kernel_type': 'Matern', 'length_scale': 975.9297011283334, 'noise_level': 0.009405232511268123, 'constant_value': 0.42328377463909805, 'nu': 0.5}. Best is trial 448 with value: 0.3592093758005386.
[I 2024-12-04 19:55:56,418] Trial 498 finished with value: 1.0624161130358287 and parameters: {'kernel_type': 'Matern', 'length_scale': 0.05371235751250838, 'noise_level': 0.00016084351893917915, 'constant_value': 9.100492731112709, 'nu': 0.5}. Best is trial 448 with value: 0.3592093758005386.
[I 2024-12-04 19:55:57,346] Trial 499 finished with value: 0.4286835102034587 and parameters: {'kernel_type': 'RBF', 'length_scale': 7.190422262353072, 'noise_level': 0.24358768290533556, 'constant_value': 0.042106349561682986, 'nu': 2.5}. Best is trial 448 with value: 0.3592093758005386.
[I 2024-12-04 19:55:57,398] Trial 497 finished with value: 0.3592112364111248 and parameters: {'kernel_type': 'Matern', 'length_scale': 335.1130800918237, 'noise_level': 0.045903273135170834, 'constant_value': 25114.369368933523, 'nu': 0.5}. Best is trial 448 with value: 0.3592093758005386.
[I 2024-12-04 19:56:01,521] Trial 500 finished with value: 0.35921123849678743 and parameters: {'kernel_type': 'Matern', 'length_scale': 18.84416897991923, 'noise_level': 0.0005682967200122534, 'constant_value': 43612.01223031829, 'nu': 0.5}. Best is trial 448 with value: 0.3592093758005386.
[I 2024-12-04 19:56:02,157] Trial 501 finished with value: 0.3592112925653278 and parameters: {'kernel_type': 'Matern', 'length_scale': 329.5661299753266, 'noise_level': 0.028433976585991262, 'constant_value': 9.096292514141085, 'nu': 0.5}. Best is trial 448 with value: 0.3592093758005386.
[I 2024-12-04 19:56:05,286] Trial 502 finished with value: 0.35921118245996236 and parameters: {'kernel_type': 'Matern', 'length_scale': 810.6517346586047, 'noise_level': 0.018720572580997505, 'constant_value': 0.9474468898478741, 'nu': 0.5}. Best is trial 448 with value: 0.3592093758005386.
[I 2024-12-04 19:56:10,354] Trial 503 finished with value: 1.0624161172796414 and parameters: {'kernel_type': 'Matern', 'length_scale': 0.022010163406100385, 'noise_level': 3.278564118082826e-07, 'constant_value': 5.996033785887705e-05, 'nu': 1.5}. Best is trial 448 with value: 0.3592093758005386.
[I 2024-12-04 19:56:11,939] Trial 504 finished with value: 0.35921087858736894 and parameters: {'kernel_type': 'Matern', 'length_scale': 27.007115594305137, 'noise_level': 0.07749898316164003, 'constant_value': 122.75496091105676, 'nu': 0.5}. Best is trial 448 with value: 0.3592093758005386.
[I 2024-12-04 19:56:12,895] Trial 505 finished with value: 0.3592112570540334 and parameters: {'kernel_type': 'Matern', 'length_scale': 4.9073660238765795, 'noise_level': 0.6424595671326411, 'constant_value': 203.20069647143788, 'nu': 0.5}. Best is trial 448 with value: 0.3592093758005386.
[I 2024-12-04 19:56:15,523] Trial 506 finished with value: 0.3592101428401762 and parameters: {'kernel_type': 'Matern', 'length_scale': 106.28593650059912, 'noise_level': 0.042602676387251445, 'constant_value': 5.114795603861239, 'nu': 0.5}. Best is trial 448 with value: 0.3592093758005386.
[I 2024-12-04 19:56:17,975] Trial 508 finished with value: 1.0624161174016513 and parameters: {'kernel_type': 'Matern', 'length_scale': 0.01917361068083871, 'noise_level': 0.0052190932202974116, 'constant_value': 8.888879311762766, 'nu': 0.5}. Best is trial 448 with value: 0.3592093758005386.
[I 2024-12-04 19:56:18,476] Trial 507 finished with value: 0.3592113204514361 and parameters: {'kernel_type': 'Matern', 'length_scale': 22.96454962800091, 'noise_level': 0.839326797915231, 'constant_value': 6.136459124469029, 'nu': 0.5}. Best is trial 448 with value: 0.3592093758005386.
[I 2024-12-04 19:56:20,835] Trial 509 finished with value: 0.35921123775274943 and parameters: {'kernel_type': 'Matern', 'length_scale': 1788.1957503349706, 'noise_level': 0.011277704605680365, 'constant_value': 415.41156778340587, 'nu': 0.5}. Best is trial 448 with value: 0.3592093758005386.
[I 2024-12-04 19:56:23,299] Trial 510 finished with value: 0.3592112393447108 and parameters: {'kernel_type': 'Matern', 'length_scale': 5.315110883503328, 'noise_level': 0.0007371653303403864, 'constant_value': 4.264381882081952, 'nu': 0.5}. Best is trial 448 with value: 0.3592093758005386.
[I 2024-12-04 19:56:23,578] Trial 511 finished with value: 0.3592112424243945 and parameters: {'kernel_type': 'Matern', 'length_scale': 84.47517949878647, 'noise_level': 0.03002401250458751, 'constant_value': 2.94301419359651, 'nu': 0.5}. Best is trial 448 with value: 0.3592093758005386.
[I 2024-12-04 19:56:27,362] Trial 512 finished with value: 0.3592106081510388 and parameters: {'kernel_type': 'Matern', 'length_scale': 1.7572961295883744, 'noise_level': 0.44078937518623373, 'constant_value': 25485.25249968808, 'nu': 0.5}. Best is trial 448 with value: 0.3592093758005386.
[I 2024-12-04 19:56:28,324] Trial 514 finished with value: 0.35921180251664814 and parameters: {'kernel_type': 'Matern', 'length_scale': 85.06998012260588, 'noise_level': 0.030474277705377948, 'constant_value': 7.072728308186174, 'nu': 0.5}. Best is trial 448 with value: 0.3592093758005386.
[I 2024-12-04 19:56:28,602] Trial 513 finished with value: 0.35921176669000515 and parameters: {'kernel_type': 'Matern', 'length_scale': 1141.6419069278645, 'noise_level': 0.6169603011516341, 'constant_value': 5.344082198600847, 'nu': 0.5}. Best is trial 448 with value: 0.3592093758005386.
[I 2024-12-04 19:56:34,295] Trial 516 finished with value: 0.35921136387524966 and parameters: {'kernel_type': 'Matern', 'length_scale': 0.8778244685978263, 'noise_level': 0.08812655206407898, 'constant_value': 63373.99704078762, 'nu': 0.5}. Best is trial 448 with value: 0.3592093758005386.
[I 2024-12-04 19:56:34,625] Trial 515 finished with value: 0.359211192640895 and parameters: {'kernel_type': 'Matern', 'length_scale': 0.2425454832725881, 'noise_level': 0.010042270843255274, 'constant_value': 10646.043153023737, 'nu': 0.5}. Best is trial 448 with value: 0.3592093758005386.
[I 2024-12-04 19:56:35,579] Trial 517 finished with value: 1.0624161187262933 and parameters: {'kernel_type': 'Matern', 'length_scale': 3520.6566168033237, 'noise_level': 0.038333694734159277, 'constant_value': 0.3371031082506698, 'nu': 0.5}. Best is trial 448 with value: 0.3592093758005386.
[I 2024-12-04 19:56:38,055] Trial 519 finished with value: 1.0916558493874524 and parameters: {'kernel_type': 'RBF', 'length_scale': 3.3000716900426016e-05, 'noise_level': 4.2630237608258284e-07, 'constant_value': 1012.3111061549371, 'nu': 2.5}. Best is trial 448 with value: 0.3592093758005386.
[I 2024-12-04 19:56:39,811] Trial 520 finished with value: 1.0624150289790573 and parameters: {'kernel_type': 'Matern', 'length_scale': 0.07574664045028079, 'noise_level': 0.20963247877746174, 'constant_value': 31891.277005798354, 'nu': 0.5}. Best is trial 448 with value: 0.3592093758005386.
[I 2024-12-04 19:56:40,912] Trial 518 finished with value: 1.0624161174288322 and parameters: {'kernel_type': 'Matern', 'length_scale': 0.042075385082645765, 'noise_level': 3.963774474916531e-09, 'constant_value': 1.6975484422247035e-05, 'nu': 0.5}. Best is trial 448 with value: 0.3592093758005386.
[I 2024-12-04 19:56:44,688] Trial 521 finished with value: 0.3592109032699284 and parameters: {'kernel_type': 'Matern', 'length_scale': 0.28434139559362515, 'noise_level': 0.9355261416512222, 'constant_value': 4508.484547456423, 'nu': 0.5}. Best is trial 448 with value: 0.3592093758005386.
[I 2024-12-04 19:56:44,818] Trial 523 finished with value: 0.35921130518537814 and parameters: {'kernel_type': 'Matern', 'length_scale': 5.3451785096483055, 'noise_level': 0.018337566886864196, 'constant_value': 0.6044071748805983, 'nu': 0.5}. Best is trial 448 with value: 0.3592093758005386.
[I 2024-12-04 19:56:47,008] Trial 522 finished with value: 1.0624161170477822 and parameters: {'kernel_type': 'RBF', 'length_scale': 2551.718304479923, 'noise_level': 1.2031793803015705e-06, 'constant_value': 2389.168632660124, 'nu': 2.5}. Best is trial 448 with value: 0.3592093758005386.
[I 2024-12-04 19:56:49,730] Trial 524 finished with value: 0.35921121426715585 and parameters: {'kernel_type': 'Matern', 'length_scale': 3296.1663064446984, 'noise_level': 0.00024272303513356124, 'constant_value': 43.165654889662726, 'nu': 0.5}. Best is trial 448 with value: 0.3592093758005386.
[I 2024-12-04 19:56:50,147] Trial 525 finished with value: 0.35921118911471367 and parameters: {'kernel_type': 'Matern', 'length_scale': 1.0828806326932132, 'noise_level': 0.3696442336389987, 'constant_value': 37465.29512244314, 'nu': 0.5}. Best is trial 448 with value: 0.3592093758005386.
[I 2024-12-04 19:56:52,919] Trial 526 finished with value: 0.35921206796162186 and parameters: {'kernel_type': 'Matern', 'length_scale': 0.22239794097936236, 'noise_level': 0.0013249945831220742, 'constant_value': 310.8181337305644, 'nu': 0.5}. Best is trial 448 with value: 0.3592093758005386.
[I 2024-12-04 19:56:54,655] Trial 528 finished with value: 0.3592114073863803 and parameters: {'kernel_type': 'Matern', 'length_scale': 3.0612848208630377, 'noise_level': 0.0003342306445365413, 'constant_value': 0.2654746752075367, 'nu': 0.5}. Best is trial 448 with value: 0.3592093758005386.
[I 2024-12-04 19:56:55,093] Trial 527 finished with value: 0.35921138380431894 and parameters: {'kernel_type': 'Matern', 'length_scale': 355.7289666875821, 'noise_level': 0.035099372435778466, 'constant_value': 0.922542452058811, 'nu': 0.5}. Best is trial 448 with value: 0.3592093758005386.
[I 2024-12-04 19:56:58,277] Trial 531 finished with value: 1.0624161171534254 and parameters: {'kernel_type': 'RBF', 'length_scale': 0.04495908336962557, 'noise_level': 0.0003075178761587738, 'constant_value': 6.085382988107966, 'nu': 0.5}. Best is trial 448 with value: 0.3592093758005386.
[I 2024-12-04 19:56:59,708] Trial 529 finished with value: 1.0624161170175457 and parameters: {'kernel_type': 'RBF', 'length_scale': 104.12088625209016, 'noise_level': 0.0012501954741686592, 'constant_value': 0.070181467251513, 'nu': 0.5}. Best is trial 448 with value: 0.3592093758005386.
[I 2024-12-04 19:57:00,772] Trial 532 finished with value: 1.09165670485499 and parameters: {'kernel_type': 'Matern', 'length_scale': 3.8282037741110373, 'noise_level': 0.0065578251874824686, 'constant_value': 36574.565511634, 'nu': 0.5}. Best is trial 448 with value: 0.3592093758005386.
[I 2024-12-04 19:57:03,173] Trial 530 finished with value: 0.42868344828288674 and parameters: {'kernel_type': 'RBF', 'length_scale': 0.2860700231143917, 'noise_level': 6.308847497453183e-08, 'constant_value': 0.016055681748185478, 'nu': 0.5}. Best is trial 448 with value: 0.3592093758005386.
[I 2024-12-04 19:57:05,501] Trial 533 finished with value: 0.3592112512804679 and parameters: {'kernel_type': 'Matern', 'length_scale': 53.19775420824336, 'noise_level': 0.000268794406730739, 'constant_value': 0.6064864563668787, 'nu': 0.5}. Best is trial 448 with value: 0.3592093758005386.
[I 2024-12-04 19:57:05,783] Trial 534 finished with value: 0.3592113403585373 and parameters: {'kernel_type': 'Matern', 'length_scale': 10.120656527341113, 'noise_level': 0.1800841472012648, 'constant_value': 33873.42400697323, 'nu': 0.5}. Best is trial 448 with value: 0.3592093758005386.
[I 2024-12-04 19:57:11,465] Trial 535 finished with value: 0.42268998036087824 and parameters: {'kernel_type': 'Matern', 'length_scale': 0.7786839517981817, 'noise_level': 0.005609777080222663, 'constant_value': 0.014099306827032875, 'nu': 1.5}. Best is trial 448 with value: 0.3592093758005386.
[I 2024-12-04 19:57:11,474] Trial 536 finished with value: 0.3592112123862673 and parameters: {'kernel_type': 'Matern', 'length_scale': 84.54743678370616, 'noise_level': 0.021337279090054114, 'constant_value': 0.41871150876716295, 'nu': 0.5}. Best is trial 448 with value: 0.3592093758005386.
[I 2024-12-04 19:57:14,934] Trial 537 finished with value: 1.062416117348301 and parameters: {'kernel_type': 'Matern', 'length_scale': 543.2856454186781, 'noise_level': 0.005365118608027421, 'constant_value': 0.3755644315462304, 'nu': 2.5}. Best is trial 448 with value: 0.3592093758005386.
[I 2024-12-04 19:57:17,459] Trial 538 finished with value: 0.35921146950902594 and parameters: {'kernel_type': 'Matern', 'length_scale': 0.1935116713721791, 'noise_level': 0.018277009238012887, 'constant_value': 205.32372411088, 'nu': 0.5}. Best is trial 448 with value: 0.3592093758005386.
[I 2024-12-04 19:57:18,193] Trial 539 finished with value: 0.42268976788904755 and parameters: {'kernel_type': 'Matern', 'length_scale': 0.3769635547698471, 'noise_level': 0.28754506231464017, 'constant_value': 37903.11927804717, 'nu': 1.5}. Best is trial 448 with value: 0.3592093758005386.
[I 2024-12-04 19:57:19,586] Trial 540 finished with value: 0.35921121761522784 and parameters: {'kernel_type': 'Matern', 'length_scale': 6.92963861178454, 'noise_level': 0.016808370691830592, 'constant_value': 0.8449111428240339, 'nu': 0.5}. Best is trial 448 with value: 0.3592093758005386.
[I 2024-12-04 19:57:22,178] Trial 541 finished with value: 0.3592113083362677 and parameters: {'kernel_type': 'Matern', 'length_scale': 2.455355896878304, 'noise_level': 0.015400464025334933, 'constant_value': 0.08057765351888159, 'nu': 0.5}. Best is trial 448 with value: 0.3592093758005386.
[I 2024-12-04 19:57:24,548] Trial 542 finished with value: 0.3592112708560368 and parameters: {'kernel_type': 'Matern', 'length_scale': 12.948783033773404, 'noise_level': 8.669857651692506e-05, 'constant_value': 21.935139615402502, 'nu': 0.5}. Best is trial 448 with value: 0.3592093758005386.
[I 2024-12-04 19:57:24,834] Trial 543 finished with value: 0.35921124059402537 and parameters: {'kernel_type': 'Matern', 'length_scale': 235.59164937295245, 'noise_level': 0.01861503436724084, 'constant_value': 40.63941327393204, 'nu': 0.5}. Best is trial 448 with value: 0.3592093758005386.
[I 2024-12-04 19:57:28,052] Trial 544 finished with value: 1.062416116077587 and parameters: {'kernel_type': 'Matern', 'length_scale': 1240.9823190603386, 'noise_level': 0.008620176564310219, 'constant_value': 0.32446871992348636, 'nu': 0.5}. Best is trial 448 with value: 0.3592093758005386.
[I 2024-12-04 19:57:29,752] Trial 545 finished with value: 0.3592112332880091 and parameters: {'kernel_type': 'Matern', 'length_scale': 313.726627944592, 'noise_level': 0.04705440067840186, 'constant_value': 0.5505720563916469, 'nu': 0.5}. Best is trial 448 with value: 0.3592093758005386.
[I 2024-12-04 19:57:29,804] Trial 546 finished with value: 0.35921110171546505 and parameters: {'kernel_type': 'Matern', 'length_scale': 37.88769007216224, 'noise_level': 0.6046129485277859, 'constant_value': 2.6575119307928587, 'nu': 0.5}. Best is trial 448 with value: 0.3592093758005386.
[I 2024-12-04 19:57:32,629] Trial 547 finished with value: 1.0916567285261058 and parameters: {'kernel_type': 'RBF', 'length_scale': 93383.0466744586, 'noise_level': 0.11746162346111112, 'constant_value': 0.0014649090373749, 'nu': 0.5}. Best is trial 448 with value: 0.3592093758005386.
[I 2024-12-04 19:57:34,428] Trial 548 finished with value: 0.35921160353718523 and parameters: {'kernel_type': 'Matern', 'length_scale': 93.08374967705008, 'noise_level': 0.004985031153167984, 'constant_value': 98.99274121040928, 'nu': 0.5}. Best is trial 448 with value: 0.3592093758005386.
[I 2024-12-04 19:57:36,084] Trial 549 finished with value: 0.35921123958642637 and parameters: {'kernel_type': 'Matern', 'length_scale': 57.608347047713536, 'noise_level': 0.008604432366015727, 'constant_value': 432.189772526957, 'nu': 0.5}. Best is trial 448 with value: 0.3592093758005386.
[I 2024-12-04 19:57:37,788] Trial 550 finished with value: 0.35921128503822763 and parameters: {'kernel_type': 'Matern', 'length_scale': 0.5605229614726165, 'noise_level': 0.828665362252783, 'constant_value': 34703.14901805051, 'nu': 0.5}. Best is trial 448 with value: 0.3592093758005386.
[I 2024-12-04 19:57:39,531] Trial 552 finished with value: 1.0624161142257837 and parameters: {'kernel_type': 'Matern', 'length_scale': 0.08781020727343772, 'noise_level': 0.03256934431249968, 'constant_value': 93367.79055626999, 'nu': 2.5}. Best is trial 448 with value: 0.3592093758005386.
[I 2024-12-04 19:57:39,531] Trial 551 finished with value: 0.35921040404949417 and parameters: {'kernel_type': 'Matern', 'length_scale': 801.405587928309, 'noise_level': 0.8816788238159985, 'constant_value': 5.919178405937877, 'nu': 0.5}. Best is trial 448 with value: 0.3592093758005386.
[I 2024-12-04 19:57:43,057] Trial 553 finished with value: 0.35920959640171596 and parameters: {'kernel_type': 'Matern', 'length_scale': 3.128519878111621, 'noise_level': 0.007235481631951311, 'constant_value': 7.601049123463449, 'nu': 0.5}. Best is trial 448 with value: 0.3592093758005386.
[I 2024-12-04 19:57:44,124] Trial 554 finished with value: 0.359235777786717 and parameters: {'kernel_type': 'Matern', 'length_scale': 7.616091067249892, 'noise_level': 0.045328692844737443, 'constant_value': 0.0994168393938685, 'nu': 0.5}. Best is trial 448 with value: 0.3592093758005386.
[I 2024-12-04 19:57:49,126] Trial 555 finished with value: 0.36664831992855956 and parameters: {'kernel_type': 'Matern', 'length_scale': 1550.7380366707418, 'noise_level': 0.955675670160881, 'constant_value': 0.6551730152762416, 'nu': 2.5}. Best is trial 448 with value: 0.3592093758005386.
