[I 2024-12-04 14:49:54,600] Trial 211 finished with value: 0.42471933087321523 and parameters: {'n_estimators': 999, 'max_depth': 48, 'min_samples_split': 3, 'min_samples_leaf': 1, 'max_features': None, 'bootstrap': True, 'criterion': 'squared_error'}. Best is trial 194 with value: 0.4194559540623761.
[I 2024-12-04 14:49:59,457] Trial 229 finished with value: 0.6960279496338853 and parameters: {'n_estimators': 802, 'max_depth': 50, 'min_samples_split': 2, 'min_samples_leaf': 2, 'max_features': 'sqrt', 'bootstrap': True, 'criterion': 'squared_error'}. Best is trial 194 with value: 0.4194559540623761.
[I 2024-12-04 14:49:59,838] Trial 225 finished with value: 0.42058611398678575 and parameters: {'n_estimators': 697, 'max_depth': 39, 'min_samples_split': 2, 'min_samples_leaf': 1, 'max_features': None, 'bootstrap': True, 'criterion': 'squared_error'}. Best is trial 194 with value: 0.4194559540623761.
[I 2024-12-04 14:50:00,090] Trial 224 finished with value: 0.4207073179508883 and parameters: {'n_estimators': 394, 'max_depth': 36, 'min_samples_split': 2, 'min_samples_leaf': 1, 'max_features': None, 'bootstrap': True, 'criterion': 'squared_error'}. Best is trial 194 with value: 0.4194559540623761.
[I 2024-12-04 14:50:00,688] Trial 215 finished with value: 0.4197879159448637 and parameters: {'n_estimators': 963, 'max_depth': 39, 'min_samples_split': 2, 'min_samples_leaf': 1, 'max_features': None, 'bootstrap': True, 'criterion': 'squared_error'}. Best is trial 194 with value: 0.4194559540623761.
[I 2024-12-04 14:50:02,178] Trial 227 finished with value: 0.42256702499090865 and parameters: {'n_estimators': 371, 'max_depth': 42, 'min_samples_split': 2, 'min_samples_leaf': 1, 'max_features': None, 'bootstrap': True, 'criterion': 'squared_error'}. Best is trial 194 with value: 0.4194559540623761.
[I 2024-12-04 14:50:05,737] Trial 220 finished with value: 0.4201081311056596 and parameters: {'n_estimators': 760, 'max_depth': 38, 'min_samples_split': 2, 'min_samples_leaf': 1, 'max_features': None, 'bootstrap': True, 'criterion': 'squared_error'}. Best is trial 194 with value: 0.4194559540623761.
[I 2024-12-04 14:50:06,037] Trial 219 finished with value: 0.4204096755016128 and parameters: {'n_estimators': 821, 'max_depth': 38, 'min_samples_split': 2, 'min_samples_leaf': 1, 'max_features': None, 'bootstrap': True, 'criterion': 'squared_error'}. Best is trial 194 with value: 0.4194559540623761.
[I 2024-12-04 14:50:06,154] Trial 222 finished with value: 0.4215647416234521 and parameters: {'n_estimators': 814, 'max_depth': 35, 'min_samples_split': 2, 'min_samples_leaf': 1, 'max_features': None, 'bootstrap': True, 'criterion': 'squared_error'}. Best is trial 194 with value: 0.4194559540623761.
[I 2024-12-04 14:50:06,567] Trial 234 finished with value: 0.5056945508482291 and parameters: {'n_estimators': 697, 'max_depth': 36, 'min_samples_split': 3, 'min_samples_leaf': 1, 'max_features': None, 'bootstrap': False, 'criterion': 'squared_error'}. Best is trial 194 with value: 0.4194559540623761.
[I 2024-12-04 14:50:15,731] Trial 230 finished with value: 0.4212883039044157 and parameters: {'n_estimators': 671, 'max_depth': 48, 'min_samples_split': 2, 'min_samples_leaf': 1, 'max_features': None, 'bootstrap': True, 'criterion': 'squared_error'}. Best is trial 223 with value: 0.4188398890260366.
[I 2024-12-04 14:50:18,127] Trial 223 finished with value: 0.4188398890260366 and parameters: {'n_estimators': 842, 'max_depth': 40, 'min_samples_split': 2, 'min_samples_leaf': 1, 'max_features': None, 'bootstrap': True, 'criterion': 'squared_error'}. Best is trial 223 with value: 0.4188398890260366.
[I 2024-12-04 14:50:18,133] Trial 244 finished with value: 0.9731594851300897 and parameters: {'n_estimators': 558, 'max_depth': 23, 'min_samples_split': 47, 'min_samples_leaf': 10, 'max_features': 'sqrt', 'bootstrap': False, 'criterion': 'squared_error'}. Best is trial 223 with value: 0.4188398890260366.
[I 2024-12-04 14:50:18,487] Trial 226 finished with value: 0.6328486351670961 and parameters: {'n_estimators': 748, 'max_depth': 48, 'min_samples_split': 3, 'min_samples_leaf': 1, 'max_features': 'log2', 'bootstrap': True, 'criterion': 'absolute_error'}. Best is trial 223 with value: 0.4188398890260366.
[I 2024-12-04 14:50:18,634] Trial 248 finished with value: 1.0487296138989128 and parameters: {'n_estimators': 302, 'max_depth': 35, 'min_samples_split': 2, 'min_samples_leaf': 9, 'max_features': 'log2', 'bootstrap': False, 'criterion': 'absolute_error'}. Best is trial 223 with value: 0.4188398890260366.
[I 2024-12-04 14:50:18,766] Trial 231 finished with value: 0.6931530980309081 and parameters: {'n_estimators': 688, 'max_depth': 30, 'min_samples_split': 15, 'min_samples_leaf': 7, 'max_features': None, 'bootstrap': False, 'criterion': 'squared_error'}. Best is trial 223 with value: 0.4188398890260366.
[I 2024-12-04 14:50:27,217] Trial 237 finished with value: 0.5315493714766294 and parameters: {'n_estimators': 999, 'max_depth': 49, 'min_samples_split': 2, 'min_samples_leaf': 1, 'max_features': None, 'bootstrap': False, 'criterion': 'squared_error'}. Best is trial 223 with value: 0.4188398890260366.
[I 2024-12-04 14:50:30,296] Trial 253 finished with value: 0.6355628022155996 and parameters: {'n_estimators': 167, 'max_depth': 38, 'min_samples_split': 2, 'min_samples_leaf': 1, 'max_features': 'log2', 'bootstrap': True, 'criterion': 'squared_error'}. Best is trial 223 with value: 0.4188398890260366.
[I 2024-12-04 14:50:30,577] Trial 232 finished with value: 0.46467788172608593 and parameters: {'n_estimators': 896, 'max_depth': 41, 'min_samples_split': 2, 'min_samples_leaf': 2, 'max_features': None, 'bootstrap': True, 'criterion': 'squared_error'}. Best is trial 223 with value: 0.4188398890260366.
[I 2024-12-04 14:50:32,296] Trial 204 finished with value: 0.4602363892354162 and parameters: {'n_estimators': 982, 'max_depth': 37, 'min_samples_split': 3, 'min_samples_leaf': 2, 'max_features': None, 'bootstrap': True, 'criterion': 'absolute_error'}. Best is trial 223 with value: 0.4188398890260366.
[I 2024-12-04 14:50:32,538] Trial 241 finished with value: 0.6372183145171509 and parameters: {'n_estimators': 870, 'max_depth': 39, 'min_samples_split': 2, 'min_samples_leaf': 1, 'max_features': 'log2', 'bootstrap': True, 'criterion': 'squared_error'}. Best is trial 223 with value: 0.4188398890260366.
[I 2024-12-04 14:50:32,963] Trial 238 finished with value: 0.42052960496298003 and parameters: {'n_estimators': 825, 'max_depth': 48, 'min_samples_split': 2, 'min_samples_leaf': 1, 'max_features': None, 'bootstrap': True, 'criterion': 'squared_error'}. Best is trial 223 with value: 0.4188398890260366.
[I 2024-12-04 14:50:34,160] Trial 233 finished with value: 0.8262939054848489 and parameters: {'n_estimators': 990, 'max_depth': 26, 'min_samples_split': 41, 'min_samples_leaf': 1, 'max_features': 'log2', 'bootstrap': True, 'criterion': 'absolute_error'}. Best is trial 223 with value: 0.4188398890260366.
[I 2024-12-04 14:50:34,561] Trial 235 finished with value: 0.4215122145792189 and parameters: {'n_estimators': 832, 'max_depth': 47, 'min_samples_split': 2, 'min_samples_leaf': 1, 'max_features': None, 'bootstrap': True, 'criterion': 'squared_error'}. Best is trial 223 with value: 0.4188398890260366.
[I 2024-12-04 14:50:35,653] Trial 236 finished with value: 0.42141635156929486 and parameters: {'n_estimators': 932, 'max_depth': 50, 'min_samples_split': 2, 'min_samples_leaf': 1, 'max_features': None, 'bootstrap': True, 'criterion': 'squared_error'}. Best is trial 223 with value: 0.4188398890260366.
[I 2024-12-04 14:50:36,099] Trial 256 finished with value: 0.6973462184143724 and parameters: {'n_estimators': 173, 'max_depth': 50, 'min_samples_split': 3, 'min_samples_leaf': 2, 'max_features': 'sqrt', 'bootstrap': True, 'criterion': 'squared_error'}. Best is trial 223 with value: 0.4188398890260366.
[I 2024-12-04 14:50:37,056] Trial 240 finished with value: 0.4257000406983181 and parameters: {'n_estimators': 651, 'max_depth': 50, 'min_samples_split': 3, 'min_samples_leaf': 1, 'max_features': None, 'bootstrap': True, 'criterion': 'squared_error'}. Best is trial 223 with value: 0.4188398890260366.
[I 2024-12-04 14:50:42,999] Trial 242 finished with value: 0.4245575447952298 and parameters: {'n_estimators': 966, 'max_depth': 35, 'min_samples_split': 3, 'min_samples_leaf': 1, 'max_features': None, 'bootstrap': True, 'criterion': 'squared_error'}. Best is trial 223 with value: 0.4188398890260366.
[I 2024-12-04 14:50:43,142] Trial 239 finished with value: 0.42123541193162684 and parameters: {'n_estimators': 954, 'max_depth': 35, 'min_samples_split': 2, 'min_samples_leaf': 1, 'max_features': None, 'bootstrap': True, 'criterion': 'squared_error'}. Best is trial 223 with value: 0.4188398890260366.
[I 2024-12-04 14:50:45,693] Trial 246 finished with value: 0.41947691567885426 and parameters: {'n_estimators': 742, 'max_depth': 39, 'min_samples_split': 2, 'min_samples_leaf': 1, 'max_features': None, 'bootstrap': True, 'criterion': 'squared_error'}. Best is trial 223 with value: 0.4188398890260366.
[I 2024-12-04 14:50:46,729] Trial 255 finished with value: 1.0704656186566337 and parameters: {'n_estimators': 781, 'max_depth': 38, 'min_samples_split': 46, 'min_samples_leaf': 10, 'max_features': 'log2', 'bootstrap': True, 'criterion': 'squared_error'}. Best is trial 223 with value: 0.4188398890260366.
[I 2024-12-04 14:50:46,882] Trial 262 finished with value: 1.0510380761129703 and parameters: {'n_estimators': 497, 'max_depth': 47, 'min_samples_split': 24, 'min_samples_leaf': 6, 'max_features': 'log2', 'bootstrap': False, 'criterion': 'squared_error'}. Best is trial 223 with value: 0.4188398890260366.
[I 2024-12-04 14:50:46,883] Trial 251 finished with value: 0.42382097637065125 and parameters: {'n_estimators': 793, 'max_depth': 41, 'min_samples_split': 3, 'min_samples_leaf': 1, 'max_features': None, 'bootstrap': True, 'criterion': 'squared_error'}. Best is trial 223 with value: 0.4188398890260366.
[I 2024-12-04 14:50:47,459] Trial 252 finished with value: 0.5232621983027169 and parameters: {'n_estimators': 725, 'max_depth': 36, 'min_samples_split': 2, 'min_samples_leaf': 1, 'max_features': 'sqrt', 'bootstrap': True, 'criterion': 'squared_error'}. Best is trial 223 with value: 0.4188398890260366.
[I 2024-12-04 14:50:47,580] Trial 258 finished with value: 0.9043474241008042 and parameters: {'n_estimators': 307, 'max_depth': 8, 'min_samples_split': 17, 'min_samples_leaf': 5, 'max_features': 'sqrt', 'bootstrap': False, 'criterion': 'squared_error'}. Best is trial 223 with value: 0.4188398890260366.
[I 2024-12-04 14:50:48,407] Trial 247 finished with value: 0.42421073433235595 and parameters: {'n_estimators': 737, 'max_depth': 38, 'min_samples_split': 3, 'min_samples_leaf': 1, 'max_features': None, 'bootstrap': True, 'criterion': 'squared_error'}. Best is trial 223 with value: 0.4188398890260366.
[I 2024-12-04 14:50:48,679] Trial 243 finished with value: 0.42107315305149884 and parameters: {'n_estimators': 948, 'max_depth': 37, 'min_samples_split': 2, 'min_samples_leaf': 1, 'max_features': None, 'bootstrap': True, 'criterion': 'squared_error'}. Best is trial 223 with value: 0.4188398890260366.
[I 2024-12-04 14:50:50,160] Trial 245 finished with value: 0.4206583884778281 and parameters: {'n_estimators': 761, 'max_depth': 37, 'min_samples_split': 2, 'min_samples_leaf': 1, 'max_features': None, 'bootstrap': True, 'criterion': 'squared_error'}. Best is trial 223 with value: 0.4188398890260366.
[I 2024-12-04 14:50:50,164] Trial 249 finished with value: 0.42081981639100213 and parameters: {'n_estimators': 915, 'max_depth': 37, 'min_samples_split': 2, 'min_samples_leaf': 1, 'max_features': None, 'bootstrap': True, 'criterion': 'squared_error'}. Best is trial 223 with value: 0.4188398890260366.
[I 2024-12-04 14:50:53,307] Trial 266 finished with value: 0.4280549016029023 and parameters: {'n_estimators': 111, 'max_depth': 34, 'min_samples_split': 2, 'min_samples_leaf': 1, 'max_features': None, 'bootstrap': True, 'criterion': 'squared_error'}. Best is trial 223 with value: 0.4188398890260366.
[I 2024-12-04 14:50:57,048] Trial 270 finished with value: 0.42279219563451104 and parameters: {'n_estimators': 219, 'max_depth': 33, 'min_samples_split': 2, 'min_samples_leaf': 1, 'max_features': None, 'bootstrap': True, 'criterion': 'squared_error'}. Best is trial 223 with value: 0.4188398890260366.
[I 2024-12-04 14:50:57,332] Trial 264 finished with value: 0.7162231269540188 and parameters: {'n_estimators': 140, 'max_depth': 11, 'min_samples_split': 25, 'min_samples_leaf': 6, 'max_features': None, 'bootstrap': False, 'criterion': 'absolute_error'}. Best is trial 223 with value: 0.4188398890260366.
[I 2024-12-04 14:50:58,964] Trial 257 finished with value: 0.41977834721055685 and parameters: {'n_estimators': 764, 'max_depth': 38, 'min_samples_split': 2, 'min_samples_leaf': 1, 'max_features': None, 'bootstrap': True, 'criterion': 'squared_error'}. Best is trial 223 with value: 0.4188398890260366.
[I 2024-12-04 14:50:59,367] Trial 250 finished with value: 0.6530210691587813 and parameters: {'n_estimators': 612, 'max_depth': 6, 'min_samples_split': 24, 'min_samples_leaf': 3, 'max_features': None, 'bootstrap': True, 'criterion': 'absolute_error'}. Best is trial 223 with value: 0.4188398890260366.
[I 2024-12-04 14:50:59,685] Trial 259 finished with value: 0.4649694170184058 and parameters: {'n_estimators': 732, 'max_depth': 41, 'min_samples_split': 2, 'min_samples_leaf': 2, 'max_features': None, 'bootstrap': True, 'criterion': 'squared_error'}. Best is trial 223 with value: 0.4188398890260366.
[I 2024-12-04 14:50:59,689] Trial 254 finished with value: 0.4201684033314269 and parameters: {'n_estimators': 831, 'max_depth': 38, 'min_samples_split': 2, 'min_samples_leaf': 1, 'max_features': None, 'bootstrap': True, 'criterion': 'squared_error'}. Best is trial 223 with value: 0.4188398890260366.
[I 2024-12-04 14:51:01,100] Trial 191 finished with value: 0.5527350492876036 and parameters: {'n_estimators': 775, 'max_depth': 46, 'min_samples_split': 2, 'min_samples_leaf': 1, 'max_features': None, 'bootstrap': False, 'criterion': 'absolute_error'}. Best is trial 223 with value: 0.4188398890260366.
[I 2024-12-04 14:51:02,481] Trial 261 finished with value: 0.4211601751105702 and parameters: {'n_estimators': 855, 'max_depth': 42, 'min_samples_split': 2, 'min_samples_leaf': 1, 'max_features': None, 'bootstrap': True, 'criterion': 'squared_error'}. Best is trial 223 with value: 0.4188398890260366.
[I 2024-12-04 14:51:04,405] Trial 263 finished with value: 0.4223874114019508 and parameters: {'n_estimators': 669, 'max_depth': 42, 'min_samples_split': 2, 'min_samples_leaf': 1, 'max_features': None, 'bootstrap': True, 'criterion': 'squared_error'}. Best is trial 223 with value: 0.4188398890260366.
[I 2024-12-04 14:51:05,108] Trial 260 finished with value: 0.41938654623605776 and parameters: {'n_estimators': 838, 'max_depth': 41, 'min_samples_split': 2, 'min_samples_leaf': 1, 'max_features': None, 'bootstrap': True, 'criterion': 'squared_error'}. Best is trial 223 with value: 0.4188398890260366.
[I 2024-12-04 14:51:25,150] Trial 265 finished with value: 0.4210828210137643 and parameters: {'n_estimators': 892, 'max_depth': 42, 'min_samples_split': 2, 'min_samples_leaf': 1, 'max_features': None, 'bootstrap': True, 'criterion': 'squared_error'}. Best is trial 223 with value: 0.4188398890260366.
[I 2024-12-04 14:51:25,325] Trial 269 finished with value: 0.4229830040238309 and parameters: {'n_estimators': 808, 'max_depth': 28, 'min_samples_split': 2, 'min_samples_leaf': 1, 'max_features': None, 'bootstrap': True, 'criterion': 'squared_error'}. Best is trial 223 with value: 0.4188398890260366.
[I 2024-12-04 14:51:25,328] Trial 267 finished with value: 0.4210605799656376 and parameters: {'n_estimators': 747, 'max_depth': 34, 'min_samples_split': 2, 'min_samples_leaf': 1, 'max_features': None, 'bootstrap': True, 'criterion': 'squared_error'}. Best is trial 223 with value: 0.4188398890260366.
[I 2024-12-04 14:51:25,956] Trial 268 finished with value: 0.42083324043439757 and parameters: {'n_estimators': 910, 'max_depth': 36, 'min_samples_split': 2, 'min_samples_leaf': 1, 'max_features': None, 'bootstrap': True, 'criterion': 'squared_error'}. Best is trial 223 with value: 0.4188398890260366.
[I 2024-12-04 14:51:26,295] Trial 282 finished with value: 0.6095863802911076 and parameters: {'n_estimators': 334, 'max_depth': 33, 'min_samples_split': 3, 'min_samples_leaf': 2, 'max_features': None, 'bootstrap': False, 'criterion': 'squared_error'}. Best is trial 223 with value: 0.4188398890260366.
[I 2024-12-04 14:51:27,660] Trial 281 finished with value: 0.4221404327645484 and parameters: {'n_estimators': 230, 'max_depth': 38, 'min_samples_split': 2, 'min_samples_leaf': 1, 'max_features': None, 'bootstrap': True, 'criterion': 'squared_error'}. Best is trial 223 with value: 0.4188398890260366.
[I 2024-12-04 14:51:28,703] Trial 286 finished with value: 0.8091794980799618 and parameters: {'n_estimators': 434, 'max_depth': 31, 'min_samples_split': 5, 'min_samples_leaf': 4, 'max_features': 'sqrt', 'bootstrap': False, 'criterion': 'absolute_error'}. Best is trial 223 with value: 0.4188398890260366.
[I 2024-12-04 14:51:30,242] Trial 271 finished with value: 0.41917817516017797 and parameters: {'n_estimators': 987, 'max_depth': 40, 'min_samples_split': 2, 'min_samples_leaf': 1, 'max_features': None, 'bootstrap': True, 'criterion': 'squared_error'}. Best is trial 223 with value: 0.4188398890260366.
[I 2024-12-04 14:51:30,260] Trial 272 finished with value: 0.4653178993477386 and parameters: {'n_estimators': 1000, 'max_depth': 36, 'min_samples_split': 2, 'min_samples_leaf': 2, 'max_features': None, 'bootstrap': True, 'criterion': 'squared_error'}. Best is trial 223 with value: 0.4188398890260366.
[I 2024-12-04 14:51:30,265] Trial 280 finished with value: 0.41909761987009475 and parameters: {'n_estimators': 735, 'max_depth': 40, 'min_samples_split': 2, 'min_samples_leaf': 1, 'max_features': None, 'bootstrap': True, 'criterion': 'squared_error'}. Best is trial 223 with value: 0.4188398890260366.
[I 2024-12-04 14:51:30,922] Trial 273 finished with value: 0.4199669143632495 and parameters: {'n_estimators': 918, 'max_depth': 38, 'min_samples_split': 2, 'min_samples_leaf': 1, 'max_features': None, 'bootstrap': True, 'criterion': 'squared_error'}. Best is trial 223 with value: 0.4188398890260366.
[I 2024-12-04 14:51:31,382] Trial 275 finished with value: 0.4674359150347926 and parameters: {'n_estimators': 953, 'max_depth': 36, 'min_samples_split': 6, 'min_samples_leaf': 2, 'max_features': None, 'bootstrap': True, 'criterion': 'squared_error'}. Best is trial 223 with value: 0.4188398890260366.
[I 2024-12-04 14:51:31,924] Trial 277 finished with value: 0.4214045824104411 and parameters: {'n_estimators': 796, 'max_depth': 33, 'min_samples_split': 2, 'min_samples_leaf': 1, 'max_features': None, 'bootstrap': True, 'criterion': 'squared_error'}. Best is trial 223 with value: 0.4188398890260366.
[I 2024-12-04 14:51:32,592] Trial 274 finished with value: 0.41967527970523555 and parameters: {'n_estimators': 749, 'max_depth': 39, 'min_samples_split': 2, 'min_samples_leaf': 1, 'max_features': None, 'bootstrap': True, 'criterion': 'squared_error'}. Best is trial 223 with value: 0.4188398890260366.
[I 2024-12-04 14:51:32,830] Trial 278 finished with value: 0.41966317701780426 and parameters: {'n_estimators': 704, 'max_depth': 39, 'min_samples_split': 2, 'min_samples_leaf': 1, 'max_features': None, 'bootstrap': True, 'criterion': 'squared_error'}. Best is trial 223 with value: 0.4188398890260366.
[I 2024-12-04 14:51:33,050] Trial 207 finished with value: 0.6429208468015991 and parameters: {'n_estimators': 894, 'max_depth': 13, 'min_samples_split': 33, 'min_samples_leaf': 1, 'max_features': None, 'bootstrap': False, 'criterion': 'absolute_error'}. Best is trial 223 with value: 0.4188398890260366.
[I 2024-12-04 14:51:33,270] Trial 284 finished with value: 0.42501210886821766 and parameters: {'n_estimators': 740, 'max_depth': 32, 'min_samples_split': 3, 'min_samples_leaf': 1, 'max_features': None, 'bootstrap': True, 'criterion': 'squared_error'}. Best is trial 223 with value: 0.4188398890260366.
[I 2024-12-04 14:51:34,175] Trial 288 finished with value: 1.0287826234712938 and parameters: {'n_estimators': 610, 'max_depth': 37, 'min_samples_split': 33, 'min_samples_leaf': 13, 'max_features': 'sqrt', 'bootstrap': True, 'criterion': 'absolute_error'}. Best is trial 223 with value: 0.4188398890260366.
[I 2024-12-04 14:51:34,615] Trial 283 finished with value: 0.43069956848653407 and parameters: {'n_estimators': 765, 'max_depth': 39, 'min_samples_split': 4, 'min_samples_leaf': 1, 'max_features': None, 'bootstrap': True, 'criterion': 'squared_error'}. Best is trial 223 with value: 0.4188398890260366.
[I 2024-12-04 14:51:35,740] Trial 279 finished with value: 0.41884681167658167 and parameters: {'n_estimators': 843, 'max_depth': 40, 'min_samples_split': 2, 'min_samples_leaf': 1, 'max_features': None, 'bootstrap': True, 'criterion': 'squared_error'}. Best is trial 223 with value: 0.4188398890260366.
[I 2024-12-04 14:51:38,140] Trial 285 finished with value: 0.4193229766545206 and parameters: {'n_estimators': 840, 'max_depth': 41, 'min_samples_split': 2, 'min_samples_leaf': 1, 'max_features': None, 'bootstrap': True, 'criterion': 'squared_error'}. Best is trial 223 with value: 0.4188398890260366.
[I 2024-12-04 14:51:44,667] Trial 304 finished with value: 1.0702899551091283 and parameters: {'n_estimators': 481, 'max_depth': 37, 'min_samples_split': 4, 'min_samples_leaf': 14, 'max_features': 'log2', 'bootstrap': False, 'criterion': 'squared_error'}. Best is trial 223 with value: 0.4188398890260366.
