[I 2024-12-04 15:30:12,443] Trial 2077 finished with value: 0.13435439977097455 and parameters: {'kernel_type': 'Matern', 'length_scale': 3.788946353004923, 'noise_level': 0.0002476942322638113, 'constant_value': 3042.3777989191326, 'nu': 1.5}. Best is trial 1985 with value: 0.134351948015208.
[I 2024-12-04 15:30:12,789] Trial 2070 finished with value: 0.13435439544212896 and parameters: {'kernel_type': 'Matern', 'length_scale': 3.1071909298459115, 'noise_level': 0.1094552762925493, 'constant_value': 89630.5260600585, 'nu': 1.5}. Best is trial 1985 with value: 0.134351948015208.
[I 2024-12-04 15:30:13,047] Trial 2081 finished with value: 0.1343544059038452 and parameters: {'kernel_type': 'Matern', 'length_scale': 75.34805680610349, 'noise_level': 0.001999015021622508, 'constant_value': 81442.05776202735, 'nu': 1.5}. Best is trial 1985 with value: 0.134351948015208.
[I 2024-12-04 15:30:13,056] Trial 2078 finished with value: 1.3007739234634321 and parameters: {'kernel_type': 'Matern', 'length_scale': 0.051341256623709676, 'noise_level': 0.00013981506470087484, 'constant_value': 83964.12183150186, 'nu': 1.5}. Best is trial 1985 with value: 0.134351948015208.
[I 2024-12-04 15:30:13,570] Trial 2082 finished with value: 0.15167297787396403 and parameters: {'kernel_type': 'RBF', 'length_scale': 2.121493017786363, 'noise_level': 0.4095043973807301, 'constant_value': 6121.050523054475, 'nu': 1.5}. Best is trial 1985 with value: 0.134351948015208.
[I 2024-12-04 15:30:14,086] Trial 2066 finished with value: 1.269363502856718 and parameters: {'kernel_type': 'RBF', 'length_scale': 0.025745269580249013, 'noise_level': 0.0032030125733951255, 'constant_value': 0.0054968783310913715, 'nu': 0.5}. Best is trial 1985 with value: 0.134351948015208.
[I 2024-12-04 15:30:14,643] Trial 2083 finished with value: 0.13435430346483057 and parameters: {'kernel_type': 'Matern', 'length_scale': 2.755951381857995, 'noise_level': 0.015467159387444822, 'constant_value': 91220.51265351234, 'nu': 1.5}. Best is trial 1985 with value: 0.134351948015208.
[I 2024-12-04 15:30:17,748] Trial 2086 finished with value: 1.2693635028557069 and parameters: {'kernel_type': 'RBF', 'length_scale': 83429.50927814443, 'noise_level': 1.5961726202276458e-07, 'constant_value': 0.005262502800693598, 'nu': 0.5}. Best is trial 1985 with value: 0.134351948015208.
[I 2024-12-04 15:30:20,458] Trial 2090 finished with value: 0.13435439987965447 and parameters: {'kernel_type': 'Matern', 'length_scale': 0.8484852364910362, 'noise_level': 0.012330475568993107, 'constant_value': 24.173563681068284, 'nu': 1.5}. Best is trial 1985 with value: 0.134351948015208.
[I 2024-12-04 15:30:20,839] Trial 2076 finished with value: 0.13435432351366275 and parameters: {'kernel_type': 'Matern', 'length_scale': 52.25511393428061, 'noise_level': 0.0100883236195069, 'constant_value': 91958.25179718215, 'nu': 1.5}. Best is trial 1985 with value: 0.134351948015208.
[I 2024-12-04 15:30:21,881] Trial 2084 finished with value: 0.17251040447469493 and parameters: {'kernel_type': 'Matern', 'length_scale': 0.15513893797137385, 'noise_level': 0.0065216550837636465, 'constant_value': 116.0805966484846, 'nu': 0.5}. Best is trial 1985 with value: 0.134351948015208.
[I 2024-12-04 15:30:21,900] Trial 2088 finished with value: 1.300772638592256 and parameters: {'kernel_type': 'RBF', 'length_scale': 0.03674544186201928, 'noise_level': 0.5554543946963544, 'constant_value': 2.903730415623993e-05, 'nu': 2.5}. Best is trial 1985 with value: 0.134351948015208.
[I 2024-12-04 15:30:22,616] Trial 2089 finished with value: 0.13435440888498448 and parameters: {'kernel_type': 'Matern', 'length_scale': 0.4236136622079529, 'noise_level': 0.29727428532388, 'constant_value': 76799.46967958353, 'nu': 1.5}. Best is trial 1985 with value: 0.134351948015208.
[I 2024-12-04 15:30:23,434] Trial 2087 finished with value: 0.1343543987934768 and parameters: {'kernel_type': 'Matern', 'length_scale': 2.3411681494965277, 'noise_level': 0.030399270456393578, 'constant_value': 2505.2175573660747, 'nu': 1.5}. Best is trial 1985 with value: 0.134351948015208.
[I 2024-12-04 15:30:23,453] Trial 2092 finished with value: 1.269363502855562 and parameters: {'kernel_type': 'Matern', 'length_scale': 0.05697659842915475, 'noise_level': 0.9848430852072788, 'constant_value': 1.6242010570174532, 'nu': 1.5}. Best is trial 1985 with value: 0.134351948015208.
[I 2024-12-04 15:30:23,464] Trial 2091 finished with value: 0.13435440407122662 and parameters: {'kernel_type': 'Matern', 'length_scale': 0.43353633606990133, 'noise_level': 0.0005522480304394486, 'constant_value': 29.028687543072728, 'nu': 1.5}. Best is trial 1985 with value: 0.134351948015208.
[I 2024-12-04 15:30:24,041] Trial 2093 finished with value: 0.13435431624034447 and parameters: {'kernel_type': 'Matern', 'length_scale': 1.2923727187804541, 'noise_level': 0.14315889781718563, 'constant_value': 70028.27717342251, 'nu': 1.5}. Best is trial 1985 with value: 0.134351948015208.
[I 2024-12-04 15:30:24,567] Trial 2096 finished with value: 1.3007745979657548 and parameters: {'kernel_type': 'Matern', 'length_scale': 1.3911849860435919, 'noise_level': 0.0008790733432010606, 'constant_value': 1203.227056943838, 'nu': 1.5}. Best is trial 1985 with value: 0.134351948015208.
[I 2024-12-04 15:30:25,130] Trial 2100 finished with value: 0.13435453492765204 and parameters: {'kernel_type': 'Matern', 'length_scale': 1.2591229018295975, 'noise_level': 0.0015110331106308922, 'constant_value': 48299.396871624194, 'nu': 1.5}. Best is trial 1985 with value: 0.134351948015208.
[I 2024-12-04 15:30:27,072] Trial 2095 finished with value: 0.1343543766573813 and parameters: {'kernel_type': 'Matern', 'length_scale': 309.82643701837554, 'noise_level': 0.007187986286965489, 'constant_value': 89247.04151585257, 'nu': 1.5}. Best is trial 1985 with value: 0.134351948015208.
[I 2024-12-04 15:30:29,792] Trial 2099 finished with value: 0.13435440023976 and parameters: {'kernel_type': 'Matern', 'length_scale': 152.5800247399178, 'noise_level': 0.01603609458214984, 'constant_value': 92673.98690219547, 'nu': 1.5}. Best is trial 1985 with value: 0.134351948015208.
[I 2024-12-04 15:30:30,551] Trial 2104 finished with value: 0.13435434344495725 and parameters: {'kernel_type': 'Matern', 'length_scale': 16.88720933317517, 'noise_level': 4.56681622341212e-05, 'constant_value': 26974.729238142514, 'nu': 1.5}. Best is trial 1985 with value: 0.134351948015208.
[I 2024-12-04 15:30:31,186] Trial 2103 finished with value: 1.2693635028579928 and parameters: {'kernel_type': 'Matern', 'length_scale': 0.000319419355229803, 'noise_level': 1.6566240814840571e-09, 'constant_value': 0.0004814483396649509, 'nu': 0.5}. Best is trial 1985 with value: 0.134351948015208.
[I 2024-12-04 15:30:32,017] Trial 2097 finished with value: 0.1343544136463352 and parameters: {'kernel_type': 'Matern', 'length_scale': 20.108948372658453, 'noise_level': 0.038653652104730395, 'constant_value': 84677.96414932898, 'nu': 1.5}. Best is trial 1985 with value: 0.134351948015208.
[I 2024-12-04 15:30:32,405] Trial 2102 finished with value: 0.1485981909250027 and parameters: {'kernel_type': 'Matern', 'length_scale': 2.3980589435548874, 'noise_level': 0.017794989712050444, 'constant_value': 3.9708395165052743, 'nu': 2.5}. Best is trial 1985 with value: 0.134351948015208.
[I 2024-12-04 15:30:32,431] Trial 2106 finished with value: 0.13435442168266468 and parameters: {'kernel_type': 'Matern', 'length_scale': 11.638800469964256, 'noise_level': 0.00041113445497521046, 'constant_value': 5788.43863745473, 'nu': 1.5}. Best is trial 1985 with value: 0.134351948015208.
[I 2024-12-04 15:30:35,086] Trial 2101 finished with value: 1.3007745979657548 and parameters: {'kernel_type': 'Matern', 'length_scale': 4.37598449307134, 'noise_level': 0.001091175919799148, 'constant_value': 800.5130415670887, 'nu': 1.5}. Best is trial 1985 with value: 0.134351948015208.
[I 2024-12-04 15:30:35,513] Trial 2094 finished with value: 1.2693635028569692 and parameters: {'kernel_type': 'Matern', 'length_scale': 5.9576315238619436e-05, 'noise_level': 6.836699446193031e-06, 'constant_value': 5.82398138912134e-07, 'nu': 2.5}. Best is trial 1985 with value: 0.134351948015208.
[I 2024-12-04 15:30:36,475] Trial 2113 finished with value: 1.2693635028571615 and parameters: {'kernel_type': 'Matern', 'length_scale': 0.010028835246483608, 'noise_level': 0.9726877960933401, 'constant_value': 4339.975969057814, 'nu': 1.5}. Best is trial 1985 with value: 0.134351948015208.
[I 2024-12-04 15:30:36,990] Trial 2105 finished with value: 0.13435437547897794 and parameters: {'kernel_type': 'Matern', 'length_scale': 30.463733958797057, 'noise_level': 0.0013874614656362143, 'constant_value': 1938.8659407528114, 'nu': 1.5}. Best is trial 1985 with value: 0.134351948015208.
[I 2024-12-04 15:30:38,159] Trial 2107 finished with value: 0.13435443439260278 and parameters: {'kernel_type': 'Matern', 'length_scale': 0.3025648255963247, 'noise_level': 0.0006046949277800414, 'constant_value': 94448.92937853633, 'nu': 1.5}. Best is trial 1985 with value: 0.134351948015208.
[I 2024-12-04 15:30:38,597] Trial 2110 finished with value: 0.1343542486411267 and parameters: {'kernel_type': 'Matern', 'length_scale': 1.4144230212632314, 'noise_level': 0.05016409510688228, 'constant_value': 2300.2954515286733, 'nu': 1.5}. Best is trial 1985 with value: 0.134351948015208.
[I 2024-12-04 15:30:38,655] Trial 2098 finished with value: 0.13435440064586557 and parameters: {'kernel_type': 'Matern', 'length_scale': 68.51404882144054, 'noise_level': 0.000342082172688012, 'constant_value': 1576.916784402976, 'nu': 1.5}. Best is trial 1985 with value: 0.134351948015208.
[I 2024-12-04 15:30:41,518] Trial 2114 finished with value: 0.13435439463261134 and parameters: {'kernel_type': 'Matern', 'length_scale': 2.2899669553608866, 'noise_level': 0.3877486511292891, 'constant_value': 1115.2113222175446, 'nu': 1.5}. Best is trial 1985 with value: 0.134351948015208.
[I 2024-12-04 15:30:41,806] Trial 2115 finished with value: 0.17251039554092637 and parameters: {'kernel_type': 'Matern', 'length_scale': 2.359288972214883, 'noise_level': 0.05553176957505615, 'constant_value': 23516.97705191233, 'nu': 0.5}. Best is trial 1985 with value: 0.134351948015208.
[I 2024-12-04 15:30:43,990] Trial 2109 finished with value: 0.13435441266838505 and parameters: {'kernel_type': 'Matern', 'length_scale': 60.28430055234187, 'noise_level': 0.003006755956469031, 'constant_value': 4038.004772593007, 'nu': 1.5}. Best is trial 1985 with value: 0.134351948015208.
[I 2024-12-04 15:30:45,867] Trial 2118 finished with value: 1.300774597527726 and parameters: {'kernel_type': 'RBF', 'length_scale': 0.6535840545234332, 'noise_level': 1.4948884253129718e-05, 'constant_value': 91868.66313719077, 'nu': 2.5}. Best is trial 1985 with value: 0.134351948015208.
[I 2024-12-04 15:30:46,943] Trial 2117 finished with value: 0.13435440408623947 and parameters: {'kernel_type': 'Matern', 'length_scale': 0.7121171473376888, 'noise_level': 0.053388403960453704, 'constant_value': 3558.0344727166867, 'nu': 1.5}. Best is trial 1985 with value: 0.134351948015208.
[I 2024-12-04 15:30:47,756] Trial 2108 finished with value: 0.1343543396429882 and parameters: {'kernel_type': 'Matern', 'length_scale': 0.8882302583730938, 'noise_level': 0.02853553920461512, 'constant_value': 557.6171769766956, 'nu': 1.5}. Best is trial 1985 with value: 0.134351948015208.
[I 2024-12-04 15:30:47,769] Trial 2111 finished with value: 0.1343543925289542 and parameters: {'kernel_type': 'Matern', 'length_scale': 8.999235123054145, 'noise_level': 0.0005816420613080209, 'constant_value': 94823.05525059887, 'nu': 1.5}. Best is trial 1985 with value: 0.134351948015208.
[I 2024-12-04 15:30:48,415] Trial 2112 finished with value: 0.13435440002157764 and parameters: {'kernel_type': 'Matern', 'length_scale': 0.24050637400984168, 'noise_level': 0.025384448582894813, 'constant_value': 21.43467425254575, 'nu': 1.5}. Best is trial 1985 with value: 0.134351948015208.
[I 2024-12-04 15:30:50,304] Trial 2120 finished with value: 0.13435443409389058 and parameters: {'kernel_type': 'Matern', 'length_scale': 0.3478154246046191, 'noise_level': 0.04245826366988798, 'constant_value': 2597.544050072302, 'nu': 1.5}. Best is trial 1985 with value: 0.134351948015208.
[I 2024-12-04 15:30:50,556] Trial 2122 finished with value: 1.2693635028572738 and parameters: {'kernel_type': 'RBF', 'length_scale': 41614.24534751473, 'noise_level': 1.6782108913452214e-08, 'constant_value': 21591.781349962734, 'nu': 1.5}. Best is trial 1985 with value: 0.134351948015208.
[I 2024-12-04 15:30:50,751] Trial 2121 finished with value: 0.13435436480489757 and parameters: {'kernel_type': 'Matern', 'length_scale': 1.079252861089854, 'noise_level': 0.009904163182057148, 'constant_value': 43804.93134641631, 'nu': 1.5}. Best is trial 1985 with value: 0.134351948015208.
[I 2024-12-04 15:30:50,792] Trial 2125 finished with value: 0.13435434503810226 and parameters: {'kernel_type': 'Matern', 'length_scale': 11.72978423654553, 'noise_level': 0.0002660246443784452, 'constant_value': 66544.57389555419, 'nu': 1.5}. Best is trial 1985 with value: 0.134351948015208.
[I 2024-12-04 15:30:52,545] Trial 2127 finished with value: 0.13435440589917888 and parameters: {'kernel_type': 'Matern', 'length_scale': 96.76969101030845, 'noise_level': 0.0258050142110753, 'constant_value': 56982.39496681735, 'nu': 1.5}. Best is trial 1985 with value: 0.134351948015208.
[I 2024-12-04 15:30:54,168] Trial 2116 finished with value: 0.13435439385223383 and parameters: {'kernel_type': 'Matern', 'length_scale': 8.67137778663529, 'noise_level': 0.17426277274931046, 'constant_value': 94314.49229770443, 'nu': 1.5}. Best is trial 1985 with value: 0.134351948015208.
[I 2024-12-04 15:30:55,100] Trial 2124 finished with value: 0.13435439982401892 and parameters: {'kernel_type': 'Matern', 'length_scale': 32.09996737028276, 'noise_level': 0.07028915279799232, 'constant_value': 72287.82638740908, 'nu': 1.5}. Best is trial 1985 with value: 0.134351948015208.
[I 2024-12-04 15:30:57,618] Trial 2128 finished with value: 0.1343543255649547 and parameters: {'kernel_type': 'Matern', 'length_scale': 8.54868626211971, 'noise_level': 0.0352205741920349, 'constant_value': 79840.3961317888, 'nu': 1.5}. Best is trial 1985 with value: 0.134351948015208.
[I 2024-12-04 15:30:57,675] Trial 2119 finished with value: 0.13435423048957654 and parameters: {'kernel_type': 'Matern', 'length_scale': 4.979366165767118, 'noise_level': 0.004990207268597638, 'constant_value': 345.46517994238684, 'nu': 1.5}. Best is trial 1985 with value: 0.134351948015208.
[I 2024-12-04 15:31:00,454] Trial 2137 finished with value: 0.1343543923791012 and parameters: {'kernel_type': 'Matern', 'length_scale': 72.28967410141135, 'noise_level': 0.00010089690560525403, 'constant_value': 85825.0562207913, 'nu': 1.5}. Best is trial 1985 with value: 0.134351948015208.
[I 2024-12-04 15:31:02,664] Trial 2126 finished with value: 0.13435447138513512 and parameters: {'kernel_type': 'Matern', 'length_scale': 919.069248094671, 'noise_level': 0.0023306933022562964, 'constant_value': 1910.1863231048972, 'nu': 1.5}. Best is trial 1985 with value: 0.134351948015208.
[I 2024-12-04 15:31:03,010] Trial 2138 finished with value: 0.13435440051302316 and parameters: {'kernel_type': 'Matern', 'length_scale': 217.84047441624676, 'noise_level': 0.024903078056351734, 'constant_value': 2185.237369205748, 'nu': 1.5}. Best is trial 1985 with value: 0.134351948015208.
[I 2024-12-04 15:31:03,043] Trial 2129 finished with value: 0.1516729770835196 and parameters: {'kernel_type': 'RBF', 'length_scale': 23.790072622333234, 'noise_level': 0.0004094314752844649, 'constant_value': 1824.3615288411304, 'nu': 1.5}. Best is trial 1985 with value: 0.134351948015208.
[I 2024-12-04 15:31:03,485] Trial 2132 finished with value: 0.13435438574333014 and parameters: {'kernel_type': 'Matern', 'length_scale': 4.779861007847907, 'noise_level': 0.004499714483346775, 'constant_value': 1485.1666918431622, 'nu': 1.5}. Best is trial 1985 with value: 0.134351948015208.
[I 2024-12-04 15:31:04,411] Trial 2136 finished with value: 0.14859820420753195 and parameters: {'kernel_type': 'Matern', 'length_scale': 118.78050665478706, 'noise_level': 0.0005963637129172725, 'constant_value': 61420.30765156677, 'nu': 2.5}. Best is trial 1985 with value: 0.134351948015208.
[I 2024-12-04 15:31:05,500] Trial 2123 finished with value: 0.1343545929874089 and parameters: {'kernel_type': 'Matern', 'length_scale': 5.181515126896038, 'noise_level': 0.005293175953748764, 'constant_value': 2739.1185694630617, 'nu': 1.5}. Best is trial 1985 with value: 0.134351948015208.
[I 2024-12-04 15:31:06,597] Trial 2142 finished with value: 0.1343543532396292 and parameters: {'kernel_type': 'Matern', 'length_scale': 37.720288358812454, 'noise_level': 0.03393458272335461, 'constant_value': 77949.06674301115, 'nu': 1.5}. Best is trial 1985 with value: 0.134351948015208.
[I 2024-12-04 15:31:07,026] Trial 2131 finished with value: 0.13435452656874486 and parameters: {'kernel_type': 'Matern', 'length_scale': 34.29665895012513, 'noise_level': 0.03005480111293078, 'constant_value': 1816.3311060517206, 'nu': 1.5}. Best is trial 1985 with value: 0.134351948015208.
[I 2024-12-04 15:31:07,357] Trial 2141 finished with value: 1.3007739235851041 and parameters: {'kernel_type': 'Matern', 'length_scale': 0.0942594010248517, 'noise_level': 0.0010396696735508854, 'constant_value': 30.156555731553137, 'nu': 1.5}. Best is trial 1985 with value: 0.134351948015208.
[I 2024-12-04 15:31:07,407] Trial 2139 finished with value: 1.3007739235932871 and parameters: {'kernel_type': 'RBF', 'length_scale': 0.0009089186820211268, 'noise_level': 7.980519832902673e-10, 'constant_value': 14134.35345587959, 'nu': 1.5}. Best is trial 1985 with value: 0.134351948015208.
[I 2024-12-04 15:31:08,123] Trial 2130 finished with value: 0.1343543961227792 and parameters: {'kernel_type': 'Matern', 'length_scale': 4.3484662918083945, 'noise_level': 0.0038223349037908444, 'constant_value': 49131.51409040579, 'nu': 1.5}. Best is trial 1985 with value: 0.134351948015208.
[I 2024-12-04 15:31:08,493] Trial 2135 finished with value: 0.1485983310598836 and parameters: {'kernel_type': 'Matern', 'length_scale': 231.92199176942242, 'noise_level': 0.00012445357038518994, 'constant_value': 40854.600057332806, 'nu': 2.5}. Best is trial 1985 with value: 0.134351948015208.
[I 2024-12-04 15:31:09,392] Trial 2133 finished with value: 0.1343542887489152 and parameters: {'kernel_type': 'Matern', 'length_scale': 0.8528899980822683, 'noise_level': 0.07231667415435937, 'constant_value': 76.48513791549642, 'nu': 1.5}. Best is trial 1985 with value: 0.134351948015208.
[I 2024-12-04 15:31:11,192] Trial 2144 finished with value: 1.2693635028521513 and parameters: {'kernel_type': 'Matern', 'length_scale': 0.00569092163185718, 'noise_level': 0.006391621241868798, 'constant_value': 29.996522832813056, 'nu': 1.5}. Best is trial 1985 with value: 0.134351948015208.
[I 2024-12-04 15:31:14,022] Trial 2143 finished with value: 1.2693634890707373 and parameters: {'kernel_type': 'Matern', 'length_scale': 0.08288384243912451, 'noise_level': 0.07013306905061227, 'constant_value': 46824.55638671062, 'nu': 1.5}. Best is trial 1985 with value: 0.134351948015208.
[I 2024-12-04 15:31:14,448] Trial 2148 finished with value: 0.1343543676644016 and parameters: {'kernel_type': 'Matern', 'length_scale': 4932.710285960146, 'noise_level': 0.007050694348392522, 'constant_value': 89315.82325308182, 'nu': 1.5}. Best is trial 1985 with value: 0.134351948015208.
[I 2024-12-04 15:31:14,591] Trial 2146 finished with value: 1.2693635028569237 and parameters: {'kernel_type': 'Matern', 'length_scale': 24737.345787271704, 'noise_level': 0.0033048239657817897, 'constant_value': 75711.45784297737, 'nu': 1.5}. Best is trial 1985 with value: 0.134351948015208.
[I 2024-12-04 15:31:14,596] Trial 2134 finished with value: 0.13435440229245982 and parameters: {'kernel_type': 'Matern', 'length_scale': 1.1306333034794613, 'noise_level': 0.9930337611811513, 'constant_value': 536.9155060073149, 'nu': 1.5}. Best is trial 1985 with value: 0.134351948015208.
[I 2024-12-04 15:31:16,962] Trial 2150 finished with value: 0.13435449377858436 and parameters: {'kernel_type': 'Matern', 'length_scale': 37.67825752872656, 'noise_level': 0.0058949884243885515, 'constant_value': 98200.05557241515, 'nu': 1.5}. Best is trial 1985 with value: 0.134351948015208.
[I 2024-12-04 15:31:19,126] Trial 2149 finished with value: 0.13435437430822184 and parameters: {'kernel_type': 'Matern', 'length_scale': 70.4808253730982, 'noise_level': 0.000765599586168145, 'constant_value': 1809.8598882323283, 'nu': 1.5}. Best is trial 1985 with value: 0.134351948015208.
[I 2024-12-04 15:31:20,173] Trial 2157 finished with value: 0.13435445323348302 and parameters: {'kernel_type': 'Matern', 'length_scale': 2.3712768332897567, 'noise_level': 0.00372250305563046, 'constant_value': 69082.77437643665, 'nu': 1.5}. Best is trial 1985 with value: 0.134351948015208.
[I 2024-12-04 15:31:20,247] Trial 2147 finished with value: 0.1725104053451302 and parameters: {'kernel_type': 'Matern', 'length_scale': 584.866622211548, 'noise_level': 0.005288190496214448, 'constant_value': 97840.82995543862, 'nu': 0.5}. Best is trial 1985 with value: 0.134351948015208.
[I 2024-12-04 15:31:20,879] Trial 2152 finished with value: 0.13435433264697486 and parameters: {'kernel_type': 'Matern', 'length_scale': 2.657852022353893, 'noise_level': 0.0020218853924632743, 'constant_value': 94492.27551379724, 'nu': 1.5}. Best is trial 1985 with value: 0.134351948015208.
