[I 2024-12-04 20:58:26,322] Trial 1748 finished with value: 0.14249488161490217 and parameters: {'kernel_type': 'Matern', 'length_scale': 6.733062923674933, 'noise_level': 0.073510877422999, 'constant_value': 0.837975675141606, 'nu': 1.5}. Best is trial 959 with value: 0.1375110730946576.
[I 2024-12-04 20:58:34,263] Trial 1751 finished with value: 0.14249666906681627 and parameters: {'kernel_type': 'Matern', 'length_scale': 3.5743280910652757, 'noise_level': 0.8890952870692468, 'constant_value': 22.118552216247373, 'nu': 1.5}. Best is trial 959 with value: 0.1375110730946576.
[I 2024-12-04 20:58:34,343] Trial 1752 finished with value: 0.1424948223831379 and parameters: {'kernel_type': 'Matern', 'length_scale': 1.6127971858090098, 'noise_level': 0.532352869829685, 'constant_value': 167.4381981420576, 'nu': 1.5}. Best is trial 959 with value: 0.1375110730946576.
[I 2024-12-04 20:58:34,532] Trial 1753 finished with value: 0.14469891244972494 and parameters: {'kernel_type': 'Matern', 'length_scale': 72.10137981160497, 'noise_level': 0.8097089462728335, 'constant_value': 0.7865175117483408, 'nu': 2.5}. Best is trial 959 with value: 0.1375110730946576.
[I 2024-12-04 20:58:39,707] Trial 1756 finished with value: 0.9864686819204155 and parameters: {'kernel_type': 'RBF', 'length_scale': 6.566320172229776e-05, 'noise_level': 0.1322169043311593, 'constant_value': 38345.55722730879, 'nu': 0.5}. Best is trial 959 with value: 0.1375110730946576.
[I 2024-12-04 20:58:40,046] Trial 1755 finished with value: 0.14249506397533548 and parameters: {'kernel_type': 'Matern', 'length_scale': 40.218839929266444, 'noise_level': 0.0016337877908483402, 'constant_value': 2511.2440222254395, 'nu': 1.5}. Best is trial 959 with value: 0.1375110730946576.
[I 2024-12-04 20:58:46,826] Trial 1758 finished with value: 0.9864686819259038 and parameters: {'kernel_type': 'Matern', 'length_scale': 12.367055269498476, 'noise_level': 0.023681589952097196, 'constant_value': 0.2257581390238857, 'nu': 1.5}. Best is trial 959 with value: 0.1375110730946576.
[I 2024-12-04 20:58:49,227] Trial 1757 finished with value: 0.14249501991647737 and parameters: {'kernel_type': 'Matern', 'length_scale': 2431.5472969143234, 'noise_level': 0.9140322551254066, 'constant_value': 1.172069921936153, 'nu': 1.5}. Best is trial 959 with value: 0.1375110730946576.
[I 2024-12-04 20:58:49,780] Trial 1754 finished with value: 0.9864686819203288 and parameters: {'kernel_type': 'RBF', 'length_scale': 259.01385727642565, 'noise_level': 5.8952714245779756e-05, 'constant_value': 4.285074453764908e-07, 'nu': 0.5}. Best is trial 959 with value: 0.1375110730946576.
[I 2024-12-04 20:58:54,572] Trial 1759 finished with value: 0.14249506446829036 and parameters: {'kernel_type': 'Matern', 'length_scale': 1.7155205723320366, 'noise_level': 0.03224228413788163, 'constant_value': 7.126401317470136, 'nu': 1.5}. Best is trial 959 with value: 0.1375110730946576.
[I 2024-12-04 20:59:04,077] Trial 1761 finished with value: 0.1424950745962408 and parameters: {'kernel_type': 'Matern', 'length_scale': 113.11970065119054, 'noise_level': 0.061370274455329346, 'constant_value': 3.8915416471385202, 'nu': 1.5}. Best is trial 959 with value: 0.1375110730946576.
[I 2024-12-04 20:59:06,057] Trial 1762 finished with value: 0.9864686819100443 and parameters: {'kernel_type': 'Matern', 'length_scale': 0.014813912798492533, 'noise_level': 0.034471842639867516, 'constant_value': 659.0099373796033, 'nu': 1.5}. Best is trial 959 with value: 0.1375110730946576.
[I 2024-12-04 20:59:06,628] Trial 1760 finished with value: 0.9864686819199566 and parameters: {'kernel_type': 'Matern', 'length_scale': 3324.2921243975316, 'noise_level': 0.008728955726841438, 'constant_value': 116.29768337642315, 'nu': 1.5}. Best is trial 959 with value: 0.1375110730946576.
[I 2024-12-04 20:59:13,489] Trial 1763 finished with value: 0.1394473408379147 and parameters: {'kernel_type': 'Matern', 'length_scale': 23.09068224770759, 'noise_level': 0.04181368545642378, 'constant_value': 70.65868609383513, 'nu': 1.5}. Best is trial 959 with value: 0.1375110730946576.
[I 2024-12-04 20:59:15,147] Trial 1764 finished with value: 0.1378137880296209 and parameters: {'kernel_type': 'Matern', 'length_scale': 11.281046681841406, 'noise_level': 0.7554933573020729, 'constant_value': 2.3509072478985233, 'nu': 1.5}. Best is trial 959 with value: 0.1375110730946576.
[I 2024-12-04 20:59:18,752] Trial 1765 finished with value: 0.9864686819097059 and parameters: {'kernel_type': 'Matern', 'length_scale': 31.358254672234306, 'noise_level': 0.022580288028362486, 'constant_value': 0.0013953277441599251, 'nu': 1.5}. Best is trial 959 with value: 0.1375110730946576.
[I 2024-12-04 20:59:20,827] Trial 1766 finished with value: 0.9864686820002575 and parameters: {'kernel_type': 'Matern', 'length_scale': 121.25123954609266, 'noise_level': 0.0046841854144322745, 'constant_value': 2.1965499390604957, 'nu': 1.5}. Best is trial 959 with value: 0.1375110730946576.
[I 2024-12-04 20:59:23,367] Trial 1767 finished with value: 0.14249506333445858 and parameters: {'kernel_type': 'Matern', 'length_scale': 37.27759411337864, 'noise_level': 0.08342435476310148, 'constant_value': 0.21861799394280698, 'nu': 1.5}. Best is trial 959 with value: 0.1375110730946576.
[I 2024-12-04 20:59:26,691] Trial 1768 finished with value: 0.1424950714296694 and parameters: {'kernel_type': 'Matern', 'length_scale': 6.374733286969647, 'noise_level': 0.4172140343517908, 'constant_value': 3.570485928428668, 'nu': 1.5}. Best is trial 959 with value: 0.1375110730946576.
[I 2024-12-04 20:59:28,686] Trial 1769 finished with value: 0.14249507145730622 and parameters: {'kernel_type': 'Matern', 'length_scale': 0.8990967291873743, 'noise_level': 0.2323429849469914, 'constant_value': 2.027052196855642, 'nu': 1.5}. Best is trial 959 with value: 0.1375110730946576.
[I 2024-12-04 20:59:31,055] Trial 1770 finished with value: 0.14249495596434622 and parameters: {'kernel_type': 'Matern', 'length_scale': 3.6068017650561948, 'noise_level': 0.9730222428340362, 'constant_value': 1.6209822228169963, 'nu': 1.5}. Best is trial 959 with value: 0.1375110730946576.
[I 2024-12-04 20:59:35,918] Trial 1771 finished with value: 0.9864686818869077 and parameters: {'kernel_type': 'RBF', 'length_scale': 14.247562372475564, 'noise_level': 1.1746796468593803e-09, 'constant_value': 0.00012906345052606118, 'nu': 2.5}. Best is trial 959 with value: 0.1375110730946576.
[I 2024-12-04 20:59:37,556] Trial 1772 finished with value: 0.14249478338947766 and parameters: {'kernel_type': 'Matern', 'length_scale': 0.2508375650661151, 'noise_level': 0.04666287608535589, 'constant_value': 1.798454644570419, 'nu': 1.5}. Best is trial 959 with value: 0.1375110730946576.
[I 2024-12-04 20:59:40,927] Trial 1773 finished with value: 0.14249508196861413 and parameters: {'kernel_type': 'Matern', 'length_scale': 319.70697304274603, 'noise_level': 0.7269864972326001, 'constant_value': 0.00824040784705659, 'nu': 1.5}. Best is trial 959 with value: 0.1375110730946576.
[I 2024-12-04 20:59:42,687] Trial 1774 finished with value: 0.14249503554834692 and parameters: {'kernel_type': 'Matern', 'length_scale': 5.367156186336899, 'noise_level': 0.63197561223719, 'constant_value': 0.3567665699116838, 'nu': 1.5}. Best is trial 959 with value: 0.1375110730946576.
[I 2024-12-04 20:59:44,399] Trial 1775 finished with value: 0.14249498904016225 and parameters: {'kernel_type': 'Matern', 'length_scale': 4.179160822867608, 'noise_level': 0.01817096802685065, 'constant_value': 0.6230872264539615, 'nu': 1.5}. Best is trial 959 with value: 0.1375110730946576.
[I 2024-12-04 20:59:48,705] Trial 1776 finished with value: 0.14249483554632758 and parameters: {'kernel_type': 'Matern', 'length_scale': 78.17914004117605, 'noise_level': 0.09215714846980468, 'constant_value': 3.9170644885971155, 'nu': 1.5}. Best is trial 959 with value: 0.1375110730946576.
[I 2024-12-04 20:59:50,709] Trial 1777 finished with value: 0.14249545594930862 and parameters: {'kernel_type': 'Matern', 'length_scale': 19.822634839174174, 'noise_level': 0.3969616492540316, 'constant_value': 6.179022297855989, 'nu': 1.5}. Best is trial 959 with value: 0.1375110730946576.
[I 2024-12-04 20:59:51,497] Trial 1778 finished with value: 0.14249482869562632 and parameters: {'kernel_type': 'Matern', 'length_scale': 2.0091781015883514, 'noise_level': 0.02384942052420002, 'constant_value': 0.023351229828433975, 'nu': 1.5}. Best is trial 959 with value: 0.1375110730946576.
[I 2024-12-04 20:59:57,783] Trial 1780 finished with value: 0.1424950629381909 and parameters: {'kernel_type': 'Matern', 'length_scale': 27.59095731785968, 'noise_level': 0.03001213298703314, 'constant_value': 12.978372657284035, 'nu': 1.5}. Best is trial 959 with value: 0.1375110730946576.
[I 2024-12-04 20:59:59,088] Trial 1781 finished with value: 0.14249507847880938 and parameters: {'kernel_type': 'Matern', 'length_scale': 3.5187306241558876, 'noise_level': 0.024340159125781465, 'constant_value': 2.569236733840844, 'nu': 1.5}. Best is trial 959 with value: 0.1375110730946576.
[I 2024-12-04 21:00:02,611] Trial 1779 finished with value: 0.14249535496310337 and parameters: {'kernel_type': 'Matern', 'length_scale': 372.3748240171864, 'noise_level': 0.04496447835331904, 'constant_value': 2.073481644390729, 'nu': 1.5}. Best is trial 959 with value: 0.1375110730946576.
[I 2024-12-04 21:00:05,264] Trial 1782 finished with value: 0.14249500640863216 and parameters: {'kernel_type': 'Matern', 'length_scale': 1745.4718799211578, 'noise_level': 0.8200438871755941, 'constant_value': 3.9437091772415904, 'nu': 1.5}. Best is trial 959 with value: 0.1375110730946576.
[I 2024-12-04 21:00:06,488] Trial 1783 finished with value: 0.14249554639322623 and parameters: {'kernel_type': 'Matern', 'length_scale': 21.18913927483598, 'noise_level': 0.9536921189871648, 'constant_value': 2.5527870615515535, 'nu': 1.5}. Best is trial 959 with value: 0.1375110730946576.
[I 2024-12-04 21:00:10,958] Trial 1784 finished with value: 0.1424950495364706 and parameters: {'kernel_type': 'Matern', 'length_scale': 17.95460167652949, 'noise_level': 0.9047603259849268, 'constant_value': 0.08685106964743038, 'nu': 1.5}. Best is trial 959 with value: 0.1375110730946576.
[I 2024-12-04 21:00:12,572] Trial 1786 finished with value: 0.14249507992445468 and parameters: {'kernel_type': 'Matern', 'length_scale': 4.32117431053116, 'noise_level': 0.000789358869587659, 'constant_value': 3.233700156112235, 'nu': 1.5}. Best is trial 959 with value: 0.1375110730946576.
[I 2024-12-04 21:00:14,802] Trial 1785 finished with value: 0.14249452320418843 and parameters: {'kernel_type': 'Matern', 'length_scale': 4.966794859164782, 'noise_level': 0.9982592253319994, 'constant_value': 7.7902203125484295, 'nu': 1.5}. Best is trial 959 with value: 0.1375110730946576.
[I 2024-12-04 21:00:17,671] Trial 1787 finished with value: 0.9864686819282615 and parameters: {'kernel_type': 'RBF', 'length_scale': 0.03416776808987012, 'noise_level': 0.8476690664138753, 'constant_value': 0.15473147990901212, 'nu': 1.5}. Best is trial 959 with value: 0.1375110730946576.
[I 2024-12-04 21:00:19,403] Trial 1788 finished with value: 0.14249497851285575 and parameters: {'kernel_type': 'Matern', 'length_scale': 5.903994017974969, 'noise_level': 0.7778512570236106, 'constant_value': 353.1008457512191, 'nu': 1.5}. Best is trial 959 with value: 0.1375110730946576.
[I 2024-12-04 21:00:22,137] Trial 1789 finished with value: 0.14249506348864813 and parameters: {'kernel_type': 'Matern', 'length_scale': 0.5355608248027041, 'noise_level': 0.0885566740834856, 'constant_value': 31.370746371745586, 'nu': 1.5}. Best is trial 959 with value: 0.1375110730946576.
[I 2024-12-04 21:00:23,753] Trial 1790 finished with value: 0.19720003650536508 and parameters: {'kernel_type': 'Matern', 'length_scale': 233.0058003717776, 'noise_level': 0.009147047601961915, 'constant_value': 8.224841481612255, 'nu': 0.5}. Best is trial 959 with value: 0.1375110730946576.
[I 2024-12-04 21:00:27,335] Trial 1791 finished with value: 0.14249493834703178 and parameters: {'kernel_type': 'Matern', 'length_scale': 147.97365002337872, 'noise_level': 0.9294083458867417, 'constant_value': 52.058226220751145, 'nu': 1.5}. Best is trial 959 with value: 0.1375110730946576.
[I 2024-12-04 21:00:27,405] Trial 1792 finished with value: 0.986468649750095 and parameters: {'kernel_type': 'Matern', 'length_scale': 0.08882086606811278, 'noise_level': 0.9130663562458278, 'constant_value': 0.8370782127754611, 'nu': 1.5}. Best is trial 959 with value: 0.1375110730946576.
[I 2024-12-04 21:00:33,162] Trial 1793 finished with value: 0.9864686819169893 and parameters: {'kernel_type': 'Matern', 'length_scale': 247.03637675993716, 'noise_level': 0.02458666406194455, 'constant_value': 0.14663214194943977, 'nu': 1.5}. Best is trial 959 with value: 0.1375110730946576.
[I 2024-12-04 21:00:34,342] Trial 1795 finished with value: 0.9864686818691306 and parameters: {'kernel_type': 'Matern', 'length_scale': 0.009392748682011341, 'noise_level': 0.009699862886237373, 'constant_value': 0.055266415196312035, 'nu': 1.5}. Best is trial 959 with value: 0.1375110730946576.
[I 2024-12-04 21:00:36,644] Trial 1794 finished with value: 0.14249485020631986 and parameters: {'kernel_type': 'Matern', 'length_scale': 4.806340429862723, 'noise_level': 0.8201802810087797, 'constant_value': 249.85123593394584, 'nu': 1.5}. Best is trial 959 with value: 0.1375110730946576.
[I 2024-12-04 21:00:41,499] Trial 1797 finished with value: 0.14249505787644423 and parameters: {'kernel_type': 'Matern', 'length_scale': 2.0674003031889807, 'noise_level': 0.0014882873073725402, 'constant_value': 2.0678220057707324, 'nu': 1.5}. Best is trial 959 with value: 0.1375110730946576.
[I 2024-12-04 21:00:42,284] Trial 1796 finished with value: 0.9864686819213259 and parameters: {'kernel_type': 'Matern', 'length_scale': 645.2805478786004, 'noise_level': 0.008438924713747607, 'constant_value': 0.6141438588443751, 'nu': 2.5}. Best is trial 959 with value: 0.1375110730946576.
[I 2024-12-04 21:00:43,518] Trial 1798 finished with value: 0.14249501764566444 and parameters: {'kernel_type': 'Matern', 'length_scale': 23.175984296259486, 'noise_level': 0.714272848057255, 'constant_value': 0.017153818849935765, 'nu': 1.5}. Best is trial 959 with value: 0.1375110730946576.
[I 2024-12-04 21:00:49,120] Trial 1799 finished with value: 0.14249495897209472 and parameters: {'kernel_type': 'Matern', 'length_scale': 0.2945321933849731, 'noise_level': 0.6988250963826114, 'constant_value': 159.74593038384228, 'nu': 1.5}. Best is trial 959 with value: 0.1375110730946576.
[I 2024-12-04 21:00:49,898] Trial 1801 finished with value: 0.1424950740680976 and parameters: {'kernel_type': 'Matern', 'length_scale': 1.3343499390051536, 'noise_level': 0.025061998994000356, 'constant_value': 0.4376370582510432, 'nu': 1.5}. Best is trial 959 with value: 0.1375110730946576.
[I 2024-12-04 21:00:52,833] Trial 1800 finished with value: 0.9864686819273608 and parameters: {'kernel_type': 'Matern', 'length_scale': 235.77867389415624, 'noise_level': 0.019792473542472322, 'constant_value': 2.3288643150797204, 'nu': 1.5}. Best is trial 959 with value: 0.1375110730946576.
[I 2024-12-04 21:00:55,731] Trial 1802 finished with value: 0.14249506185697697 and parameters: {'kernel_type': 'Matern', 'length_scale': 0.7164940888996977, 'noise_level': 0.8404620077098638, 'constant_value': 0.03279044424266775, 'nu': 1.5}. Best is trial 959 with value: 0.1375110730946576.
[I 2024-12-04 21:00:57,256] Trial 1803 finished with value: 0.14249505950881822 and parameters: {'kernel_type': 'Matern', 'length_scale': 0.2608701368159317, 'noise_level': 0.03776760493403965, 'constant_value': 58.37809063966594, 'nu': 1.5}. Best is trial 959 with value: 0.1375110730946576.
[I 2024-12-04 21:01:06,268] Trial 1804 finished with value: 0.14249500866031337 and parameters: {'kernel_type': 'Matern', 'length_scale': 4.885468402759096, 'noise_level': 0.04333916943486773, 'constant_value': 3.3313374889036287, 'nu': 1.5}. Best is trial 959 with value: 0.1375110730946576.
[I 2024-12-04 21:01:18,887] Trial 1806 finished with value: 0.14249502421291274 and parameters: {'kernel_type': 'Matern', 'length_scale': 30.677840271918257, 'noise_level': 0.05373836533296582, 'constant_value': 3.1767469212655786, 'nu': 1.5}. Best is trial 959 with value: 0.1375110730946576.
[I 2024-12-04 21:01:21,786] Trial 1805 finished with value: 0.9864686819336369 and parameters: {'kernel_type': 'Matern', 'length_scale': 0.02058991811623311, 'noise_level': 2.014690581285714e-07, 'constant_value': 0.20377565826455332, 'nu': 2.5}. Best is trial 959 with value: 0.1375110730946576.
[I 2024-12-04 21:01:23,323] Trial 1807 finished with value: 0.14771039207993644 and parameters: {'kernel_type': 'RBF', 'length_scale': 9.826158574818812, 'noise_level': 0.6835446164475268, 'constant_value': 38.00678173991236, 'nu': 1.5}. Best is trial 959 with value: 0.1375110730946576.
[I 2024-12-04 21:01:29,169] Trial 1808 finished with value: 0.9864686819862961 and parameters: {'kernel_type': 'RBF', 'length_scale': 13616.749109813887, 'noise_level': 0.0012929664443315572, 'constant_value': 9.530078064538078, 'nu': 0.5}. Best is trial 959 with value: 0.1375110730946576.
[I 2024-12-04 21:01:31,378] Trial 1810 finished with value: 0.13807292508697463 and parameters: {'kernel_type': 'Matern', 'length_scale': 101.49858714308367, 'noise_level': 0.8820640717149232, 'constant_value': 5.894487302588835, 'nu': 1.5}. Best is trial 959 with value: 0.1375110730946576.
[I 2024-12-04 21:01:36,425] Trial 1811 finished with value: 0.14249498621805082 and parameters: {'kernel_type': 'Matern', 'length_scale': 4.999786044185585, 'noise_level': 0.900958321240221, 'constant_value': 25.89871857375118, 'nu': 1.5}. Best is trial 959 with value: 0.1375110730946576.
[I 2024-12-04 21:01:37,266] Trial 1809 finished with value: 0.14249506579715301 and parameters: {'kernel_type': 'Matern', 'length_scale': 0.16196933046320852, 'noise_level': 0.9758212937811902, 'constant_value': 1166.257044055884, 'nu': 1.5}. Best is trial 959 with value: 0.1375110730946576.
[I 2024-12-04 21:01:40,315] Trial 1812 finished with value: 0.14249506549753874 and parameters: {'kernel_type': 'Matern', 'length_scale': 835.068344720989, 'noise_level': 0.08930793521760078, 'constant_value': 0.7523239080483473, 'nu': 1.5}. Best is trial 959 with value: 0.1375110730946576.
[I 2024-12-04 21:01:42,246] Trial 1813 finished with value: 0.19720004082332138 and parameters: {'kernel_type': 'Matern', 'length_scale': 13.743152920534472, 'noise_level': 0.6282058752576801, 'constant_value': 5.008094384772317, 'nu': 0.5}. Best is trial 959 with value: 0.1375110730946576.
[I 2024-12-04 21:01:45,038] Trial 1814 finished with value: 0.14249507091433464 and parameters: {'kernel_type': 'Matern', 'length_scale': 139.7475383946072, 'noise_level': 0.18472313996984133, 'constant_value': 26.542941218543643, 'nu': 1.5}. Best is trial 959 with value: 0.1375110730946576.
[I 2024-12-04 21:01:48,241] Trial 1815 finished with value: 0.14249451457509885 and parameters: {'kernel_type': 'Matern', 'length_scale': 90.5136783967037, 'noise_level': 0.7147819253339366, 'constant_value': 0.09473565092318868, 'nu': 1.5}. Best is trial 959 with value: 0.1375110730946576.
[I 2024-12-04 21:01:50,623] Trial 1816 finished with value: 0.14249495249522243 and parameters: {'kernel_type': 'Matern', 'length_scale': 2796.679485050077, 'noise_level': 0.5787151567733488, 'constant_value': 5.234992573186221, 'nu': 1.5}. Best is trial 959 with value: 0.1375110730946576.
[I 2024-12-04 21:01:53,298] Trial 1817 finished with value: 0.1424950596117405 and parameters: {'kernel_type': 'Matern', 'length_scale': 26.268523019250765, 'noise_level': 0.9215203357396203, 'constant_value': 7.613066297549038, 'nu': 1.5}. Best is trial 959 with value: 0.1375110730946576.
[I 2024-12-04 21:01:55,972] Trial 1818 finished with value: 0.14249505904121124 and parameters: {'kernel_type': 'Matern', 'length_scale': 21.125413573836298, 'noise_level': 0.6280852412057397, 'constant_value': 1.0278911384209146, 'nu': 1.5}. Best is trial 959 with value: 0.1375110730946576.
[I 2024-12-04 21:01:59,147] Trial 1819 finished with value: 0.142495071732031 and parameters: {'kernel_type': 'Matern', 'length_scale': 1163.0714585429482, 'noise_level': 0.3230614525587213, 'constant_value': 4.79399531595644, 'nu': 1.5}. Best is trial 959 with value: 0.1375110730946576.
[I 2024-12-04 21:02:00,467] Trial 1820 finished with value: 0.14249491979335405 and parameters: {'kernel_type': 'Matern', 'length_scale': 158.0266793317334, 'noise_level': 0.29624572192649673, 'constant_value': 0.9628859880210365, 'nu': 1.5}. Best is trial 959 with value: 0.1375110730946576.
[I 2024-12-04 21:02:01,845] Trial 1821 finished with value: 0.9982171090096834 and parameters: {'kernel_type': 'Matern', 'length_scale': 17066.304122099362, 'noise_level': 0.4674720785035873, 'constant_value': 0.03297496512072743, 'nu': 1.5}. Best is trial 959 with value: 0.1375110730946576.
[I 2024-12-04 21:02:06,174] Trial 1822 finished with value: 0.9864686819117714 and parameters: {'kernel_type': 'RBF', 'length_scale': 0.0015311253621789116, 'noise_level': 0.983323969800787, 'constant_value': 0.15975791957076776, 'nu': 2.5}. Best is trial 959 with value: 0.1375110730946576.
[I 2024-12-04 21:02:07,637] Trial 1823 finished with value: 0.9864686819007056 and parameters: {'kernel_type': 'Matern', 'length_scale': 0.0008187035541627453, 'noise_level': 3.220906136876559e-08, 'constant_value': 1.368707947580533e-07, 'nu': 2.5}. Best is trial 959 with value: 0.1375110730946576.
[I 2024-12-04 21:02:09,744] Trial 1824 finished with value: 0.14249498270189642 and parameters: {'kernel_type': 'Matern', 'length_scale': 46.35785459744898, 'noise_level': 0.022428166245372527, 'constant_value': 12.446225902861588, 'nu': 1.5}. Best is trial 959 with value: 0.1375110730946576.
