[I 2024-12-04 11:55:05,219] Trial 602 finished with value: 1.0816149376799358 and parameters: {'max_depth': 19, 'min_samples_split': 19, 'min_samples_leaf': 6, 'max_features': 'sqrt', 'criterion': 'friedman_mse', 'splitter': 'random'}. Best is trial 368 with value: 0.6055877317086851.
[I 2024-12-04 11:55:05,658] Trial 612 finished with value: 0.6789802738421568 and parameters: {'max_depth': 35, 'min_samples_split': 13, 'min_samples_leaf': 1, 'max_features': 'sqrt', 'criterion': 'friedman_mse', 'splitter': 'best'}. Best is trial 368 with value: 0.6055877317086851.
[I 2024-12-04 11:55:05,914] Trial 623 finished with value: 0.6789802738421568 and parameters: {'max_depth': 35, 'min_samples_split': 13, 'min_samples_leaf': 1, 'max_features': 'sqrt', 'criterion': 'friedman_mse', 'splitter': 'best'}. Best is trial 368 with value: 0.6055877317086851.
[I 2024-12-04 11:55:05,979] Trial 617 finished with value: 0.9083958305641366 and parameters: {'max_depth': 8, 'min_samples_split': 6, 'min_samples_leaf': 7, 'max_features': 'sqrt', 'criterion': 'absolute_error', 'splitter': 'best'}. Best is trial 368 with value: 0.6055877317086851.
[I 2024-12-04 11:55:06,282] Trial 614 finished with value: 1.091656728529238 and parameters: {'max_depth': 28, 'min_samples_split': 16, 'min_samples_leaf': 10, 'max_features': 'log2', 'criterion': 'friedman_mse', 'splitter': 'best'}. Best is trial 368 with value: 0.6055877317086851.
[I 2024-12-04 11:55:06,641] Trial 627 finished with value: 0.8197632085734636 and parameters: {'max_depth': 31, 'min_samples_split': 13, 'min_samples_leaf': 2, 'max_features': 'sqrt', 'criterion': 'squared_error', 'splitter': 'best'}. Best is trial 368 with value: 0.6055877317086851.
[I 2024-12-04 11:55:07,055] Trial 631 finished with value: 0.6657045440033218 and parameters: {'max_depth': 35, 'min_samples_split': 12, 'min_samples_leaf': 1, 'max_features': 'sqrt', 'criterion': 'friedman_mse', 'splitter': 'best'}. Best is trial 368 with value: 0.6055877317086851.
[I 2024-12-04 11:55:07,627] Trial 625 finished with value: 0.6657045440033218 and parameters: {'max_depth': 35, 'min_samples_split': 12, 'min_samples_leaf': 1, 'max_features': 'sqrt', 'criterion': 'squared_error', 'splitter': 'best'}. Best is trial 368 with value: 0.6055877317086851.
[I 2024-12-04 11:55:07,848] Trial 628 finished with value: 0.825562298787238 and parameters: {'max_depth': 31, 'min_samples_split': 14, 'min_samples_leaf': 3, 'max_features': 'sqrt', 'criterion': 'friedman_mse', 'splitter': 'best'}. Best is trial 368 with value: 0.6055877317086851.
[I 2024-12-04 11:55:08,528] Trial 621 finished with value: 0.6439029894887489 and parameters: {'max_depth': 29, 'min_samples_split': 13, 'min_samples_leaf': 1, 'max_features': 'sqrt', 'criterion': 'friedman_mse', 'splitter': 'best'}. Best is trial 368 with value: 0.6055877317086851.
[I 2024-12-04 11:55:09,047] Trial 630 finished with value: 0.6570109226401653 and parameters: {'max_depth': 35, 'min_samples_split': 11, 'min_samples_leaf': 1, 'max_features': 'sqrt', 'criterion': 'friedman_mse', 'splitter': 'best'}. Best is trial 368 with value: 0.6055877317086851.
[I 2024-12-04 11:55:09,056] Trial 618 finished with value: 0.6724429399742451 and parameters: {'max_depth': 27, 'min_samples_split': 14, 'min_samples_leaf': 1, 'max_features': 'sqrt', 'criterion': 'friedman_mse', 'splitter': 'best'}. Best is trial 368 with value: 0.6055877317086851.
[I 2024-12-04 11:55:10,225] Trial 629 finished with value: 0.8066762268897443 and parameters: {'max_depth': 35, 'min_samples_split': 9, 'min_samples_leaf': 3, 'max_features': 'sqrt', 'criterion': 'friedman_mse', 'splitter': 'best'}. Best is trial 368 with value: 0.6055877317086851.
[I 2024-12-04 11:55:10,690] Trial 632 finished with value: 0.6862313348684029 and parameters: {'max_depth': 29, 'min_samples_split': 12, 'min_samples_leaf': 1, 'max_features': 'sqrt', 'criterion': 'friedman_mse', 'splitter': 'best'}. Best is trial 368 with value: 0.6055877317086851.
[I 2024-12-04 11:55:10,723] Trial 619 finished with value: 0.8197632085734636 and parameters: {'max_depth': 29, 'min_samples_split': 13, 'min_samples_leaf': 2, 'max_features': 'sqrt', 'criterion': 'friedman_mse', 'splitter': 'best'}. Best is trial 368 with value: 0.6055877317086851.
[I 2024-12-04 11:55:11,243] Trial 638 finished with value: 0.8260837121483238 and parameters: {'max_depth': 29, 'min_samples_split': 14, 'min_samples_leaf': 2, 'max_features': 'log2', 'criterion': 'friedman_mse', 'splitter': 'best'}. Best is trial 368 with value: 0.6055877317086851.
[I 2024-12-04 11:55:11,342] Trial 626 finished with value: 0.6789802738421568 and parameters: {'max_depth': 35, 'min_samples_split': 13, 'min_samples_leaf': 1, 'max_features': 'sqrt', 'criterion': 'friedman_mse', 'splitter': 'best'}. Best is trial 368 with value: 0.6055877317086851.
[I 2024-12-04 11:55:11,783] Trial 633 finished with value: 0.7520063813550075 and parameters: {'max_depth': 27, 'min_samples_split': 13, 'min_samples_leaf': 1, 'max_features': 'log2', 'criterion': 'friedman_mse', 'splitter': 'best'}. Best is trial 368 with value: 0.6055877317086851.
[I 2024-12-04 11:55:11,807] Trial 635 finished with value: 0.6935908088501267 and parameters: {'max_depth': 35, 'min_samples_split': 10, 'min_samples_leaf': 1, 'max_features': 'sqrt', 'criterion': 'friedman_mse', 'splitter': 'best'}. Best is trial 368 with value: 0.6055877317086851.
[I 2024-12-04 11:55:11,809] Trial 634 finished with value: 0.679321659918252 and parameters: {'max_depth': 30, 'min_samples_split': 12, 'min_samples_leaf': 1, 'max_features': 'sqrt', 'criterion': 'friedman_mse', 'splitter': 'best'}. Best is trial 368 with value: 0.6055877317086851.
[I 2024-12-04 11:55:11,827] Trial 639 finished with value: 0.8125271942876539 and parameters: {'max_depth': 30, 'min_samples_split': 11, 'min_samples_leaf': 3, 'max_features': 'sqrt', 'criterion': 'friedman_mse', 'splitter': 'best'}. Best is trial 368 with value: 0.6055877317086851.
[I 2024-12-04 11:55:11,903] Trial 637 finished with value: 0.6935908088501267 and parameters: {'max_depth': 35, 'min_samples_split': 10, 'min_samples_leaf': 1, 'max_features': 'sqrt', 'criterion': 'friedman_mse', 'splitter': 'best'}. Best is trial 368 with value: 0.6055877317086851.
[I 2024-12-04 11:55:12,174] Trial 636 finished with value: 0.825562298787238 and parameters: {'max_depth': 32, 'min_samples_split': 13, 'min_samples_leaf': 3, 'max_features': 'sqrt', 'criterion': 'friedman_mse', 'splitter': 'best'}. Best is trial 368 with value: 0.6055877317086851.
[I 2024-12-04 11:55:12,285] Trial 624 finished with value: 0.8137608958686491 and parameters: {'max_depth': 29, 'min_samples_split': 12, 'min_samples_leaf': 2, 'max_features': 'sqrt', 'criterion': 'friedman_mse', 'splitter': 'best'}. Best is trial 368 with value: 0.6055877317086851.
[I 2024-12-04 11:55:13,126] Trial 640 finished with value: 0.7222286893478446 and parameters: {'max_depth': 28, 'min_samples_split': 12, 'min_samples_leaf': 1, 'max_features': 'sqrt', 'criterion': 'friedman_mse', 'splitter': 'best'}. Best is trial 368 with value: 0.6055877317086851.
[I 2024-12-04 11:55:13,336] Trial 646 finished with value: 0.6804306336908117 and parameters: {'max_depth': 25, 'min_samples_split': 9, 'min_samples_leaf': 1, 'max_features': 'sqrt', 'criterion': 'squared_error', 'splitter': 'best'}. Best is trial 368 with value: 0.6055877317086851.
[I 2024-12-04 11:55:13,475] Trial 644 finished with value: 0.6657045440033218 and parameters: {'max_depth': 35, 'min_samples_split': 12, 'min_samples_leaf': 1, 'max_features': 'sqrt', 'criterion': 'friedman_mse', 'splitter': 'best'}. Best is trial 368 with value: 0.6055877317086851.
[I 2024-12-04 11:55:14,808] Trial 648 finished with value: 0.6688365699501411 and parameters: {'max_depth': 29, 'min_samples_split': 15, 'min_samples_leaf': 1, 'max_features': 'sqrt', 'criterion': 'friedman_mse', 'splitter': 'best'}. Best is trial 368 with value: 0.6055877317086851.
[I 2024-12-04 11:55:15,081] Trial 643 finished with value: 0.7523612500696832 and parameters: {'max_depth': 35, 'min_samples_split': 9, 'min_samples_leaf': 2, 'max_features': 'sqrt', 'criterion': 'friedman_mse', 'splitter': 'random'}. Best is trial 368 with value: 0.6055877317086851.
[I 2024-12-04 11:55:15,085] Trial 642 finished with value: 0.825562298787238 and parameters: {'max_depth': 35, 'min_samples_split': 13, 'min_samples_leaf': 3, 'max_features': 'sqrt', 'criterion': 'squared_error', 'splitter': 'best'}. Best is trial 368 with value: 0.6055877317086851.
[I 2024-12-04 11:55:15,951] Trial 655 finished with value: 0.6657045440033218 and parameters: {'max_depth': 35, 'min_samples_split': 12, 'min_samples_leaf': 1, 'max_features': 'sqrt', 'criterion': 'friedman_mse', 'splitter': 'best'}. Best is trial 368 with value: 0.6055877317086851.
[I 2024-12-04 11:55:16,263] Trial 652 finished with value: 0.8061624324255678 and parameters: {'max_depth': 32, 'min_samples_split': 10, 'min_samples_leaf': 3, 'max_features': 'sqrt', 'criterion': 'absolute_error', 'splitter': 'best'}. Best is trial 368 with value: 0.6055877317086851.
[I 2024-12-04 11:55:18,033] Trial 660 finished with value: 1.0909840109486761 and parameters: {'max_depth': 16, 'min_samples_split': 6, 'min_samples_leaf': 7, 'max_features': 'log2', 'criterion': 'friedman_mse', 'splitter': 'random'}. Best is trial 368 with value: 0.6055877317086851.
[I 2024-12-04 11:55:18,034] Trial 649 finished with value: 0.689714141504323 and parameters: {'max_depth': 31, 'min_samples_split': 14, 'min_samples_leaf': 1, 'max_features': 'sqrt', 'criterion': 'friedman_mse', 'splitter': 'best'}. Best is trial 368 with value: 0.6055877317086851.
[I 2024-12-04 11:55:18,223] Trial 647 finished with value: 1.091656728529238 and parameters: {'max_depth': 2, 'min_samples_split': 12, 'min_samples_leaf': 6, 'max_features': 'log2', 'criterion': 'friedman_mse', 'splitter': 'best'}. Best is trial 368 with value: 0.6055877317086851.
[I 2024-12-04 11:55:18,291] Trial 645 finished with value: 0.8137608958686491 and parameters: {'max_depth': 35, 'min_samples_split': 11, 'min_samples_leaf': 2, 'max_features': 'sqrt', 'criterion': 'friedman_mse', 'splitter': 'best'}. Best is trial 368 with value: 0.6055877317086851.
[I 2024-12-04 11:55:19,975] Trial 650 finished with value: 0.6862313348684029 and parameters: {'max_depth': 29, 'min_samples_split': 12, 'min_samples_leaf': 1, 'max_features': 'sqrt', 'criterion': 'friedman_mse', 'splitter': 'best'}. Best is trial 368 with value: 0.6055877317086851.
[I 2024-12-04 11:55:20,139] Trial 641 finished with value: 1.0745658542945478 and parameters: {'max_depth': 16, 'min_samples_split': 2, 'min_samples_leaf': 6, 'max_features': 'log2', 'criterion': 'absolute_error', 'splitter': 'random'}. Best is trial 368 with value: 0.6055877317086851.
[I 2024-12-04 11:55:20,588] Trial 654 finished with value: 0.7318251625114702 and parameters: {'max_depth': 28, 'min_samples_split': 11, 'min_samples_leaf': 1, 'max_features': 'sqrt', 'criterion': 'friedman_mse', 'splitter': 'best'}. Best is trial 368 with value: 0.6055877317086851.
[I 2024-12-04 11:55:20,789] Trial 656 finished with value: 0.751783218829171 and parameters: {'max_depth': 34, 'min_samples_split': 15, 'min_samples_leaf': 1, 'max_features': 'log2', 'criterion': 'friedman_mse', 'splitter': 'best'}. Best is trial 368 with value: 0.6055877317086851.
[I 2024-12-04 11:55:21,205] Trial 659 finished with value: 1.0859331338976363 and parameters: {'max_depth': 19, 'min_samples_split': 9, 'min_samples_leaf': 5, 'max_features': 'sqrt', 'criterion': 'squared_error', 'splitter': 'random'}. Best is trial 368 with value: 0.6055877317086851.
[I 2024-12-04 11:55:21,383] Trial 668 finished with value: 0.7222286893478446 and parameters: {'max_depth': 28, 'min_samples_split': 12, 'min_samples_leaf': 1, 'max_features': 'sqrt', 'criterion': 'squared_error', 'splitter': 'best'}. Best is trial 368 with value: 0.6055877317086851.
[I 2024-12-04 11:55:21,430] Trial 669 finished with value: 0.6570109226401653 and parameters: {'max_depth': 35, 'min_samples_split': 11, 'min_samples_leaf': 1, 'max_features': 'sqrt', 'criterion': 'friedman_mse', 'splitter': 'best'}. Best is trial 368 with value: 0.6055877317086851.
[I 2024-12-04 11:55:21,508] Trial 653 finished with value: 1.0944406534581308 and parameters: {'max_depth': 1, 'min_samples_split': 2, 'min_samples_leaf': 10, 'max_features': 'sqrt', 'criterion': 'friedman_mse', 'splitter': 'random'}. Best is trial 368 with value: 0.6055877317086851.
[I 2024-12-04 11:55:21,903] Trial 657 finished with value: 0.8131482590578788 and parameters: {'max_depth': 32, 'min_samples_split': 10, 'min_samples_leaf': 3, 'max_features': 'sqrt', 'criterion': 'friedman_mse', 'splitter': 'best'}. Best is trial 368 with value: 0.6055877317086851.
[I 2024-12-04 11:55:22,306] Trial 661 finished with value: 0.6935908088501267 and parameters: {'max_depth': 35, 'min_samples_split': 10, 'min_samples_leaf': 1, 'max_features': 'sqrt', 'criterion': 'friedman_mse', 'splitter': 'best'}. Best is trial 368 with value: 0.6055877317086851.
[I 2024-12-04 11:55:22,310] Trial 667 finished with value: 0.825562298787238 and parameters: {'max_depth': 35, 'min_samples_split': 14, 'min_samples_leaf': 3, 'max_features': 'sqrt', 'criterion': 'friedman_mse', 'splitter': 'best'}. Best is trial 368 with value: 0.6055877317086851.
[I 2024-12-04 11:55:22,553] Trial 666 finished with value: 1.091656728529238 and parameters: {'max_depth': 35, 'min_samples_split': 4, 'min_samples_leaf': 10, 'max_features': 'log2', 'criterion': 'friedman_mse', 'splitter': 'best'}. Best is trial 368 with value: 0.6055877317086851.
[I 2024-12-04 11:55:23,198] Trial 664 finished with value: 0.7608055883921979 and parameters: {'max_depth': 27, 'min_samples_split': 5, 'min_samples_leaf': 1, 'max_features': 'sqrt', 'criterion': 'squared_error', 'splitter': 'best'}. Best is trial 368 with value: 0.6055877317086851.
[I 2024-12-04 11:55:23,323] Trial 670 finished with value: 0.6774751628355143 and parameters: {'max_depth': 29, 'min_samples_split': 11, 'min_samples_leaf': 1, 'max_features': 'sqrt', 'criterion': 'squared_error', 'splitter': 'best'}. Best is trial 368 with value: 0.6055877317086851.
[I 2024-12-04 11:55:23,588] Trial 658 finished with value: 0.8125271942876539 and parameters: {'max_depth': 31, 'min_samples_split': 11, 'min_samples_leaf': 3, 'max_features': 'sqrt', 'criterion': 'friedman_mse', 'splitter': 'best'}. Best is trial 368 with value: 0.6055877317086851.
[I 2024-12-04 11:55:24,238] Trial 672 finished with value: 0.6918037388964751 and parameters: {'max_depth': 30, 'min_samples_split': 15, 'min_samples_leaf': 1, 'max_features': 'sqrt', 'criterion': 'friedman_mse', 'splitter': 'best'}. Best is trial 368 with value: 0.6055877317086851.
[I 2024-12-04 11:55:24,285] Trial 651 finished with value: 0.8131482590578788 and parameters: {'max_depth': 35, 'min_samples_split': 10, 'min_samples_leaf': 3, 'max_features': 'sqrt', 'criterion': 'friedman_mse', 'splitter': 'best'}. Best is trial 368 with value: 0.6055877317086851.
[I 2024-12-04 11:55:24,313] Trial 662 finished with value: 0.9137125462958938 and parameters: {'max_depth': 8, 'min_samples_split': 20, 'min_samples_leaf': 8, 'max_features': 'sqrt', 'criterion': 'absolute_error', 'splitter': 'best'}. Best is trial 368 with value: 0.6055877317086851.
[I 2024-12-04 11:55:24,768] Trial 674 finished with value: 0.8802379018172154 and parameters: {'max_depth': 25, 'min_samples_split': 3, 'min_samples_leaf': 9, 'max_features': 'sqrt', 'criterion': 'squared_error', 'splitter': 'best'}. Best is trial 368 with value: 0.6055877317086851.
[I 2024-12-04 11:55:25,205] Trial 677 finished with value: 0.6439029894887489 and parameters: {'max_depth': 29, 'min_samples_split': 13, 'min_samples_leaf': 1, 'max_features': 'sqrt', 'criterion': 'friedman_mse', 'splitter': 'best'}. Best is trial 368 with value: 0.6055877317086851.
[I 2024-12-04 11:55:25,942] Trial 663 finished with value: 0.825562298787238 and parameters: {'max_depth': 29, 'min_samples_split': 13, 'min_samples_leaf': 3, 'max_features': 'sqrt', 'criterion': 'friedman_mse', 'splitter': 'best'}. Best is trial 368 with value: 0.6055877317086851.
[I 2024-12-04 11:55:26,340] Trial 673 finished with value: 0.7030091902207406 and parameters: {'max_depth': 35, 'min_samples_split': 7, 'min_samples_leaf': 1, 'max_features': 'sqrt', 'criterion': 'friedman_mse', 'splitter': 'best'}. Best is trial 368 with value: 0.6055877317086851.
[I 2024-12-04 11:55:26,521] Trial 676 finished with value: 0.6889323634393683 and parameters: {'max_depth': 30, 'min_samples_split': 11, 'min_samples_leaf': 1, 'max_features': 'sqrt', 'criterion': 'friedman_mse', 'splitter': 'best'}. Best is trial 368 with value: 0.6055877317086851.
[I 2024-12-04 11:55:27,093] Trial 678 finished with value: 0.7898534915435493 and parameters: {'max_depth': 35, 'min_samples_split': 12, 'min_samples_leaf': 1, 'max_features': 'sqrt', 'criterion': 'friedman_mse', 'splitter': 'random'}. Best is trial 368 with value: 0.6055877317086851.
[I 2024-12-04 11:55:27,431] Trial 671 finished with value: 0.780100031339473 and parameters: {'max_depth': 35, 'min_samples_split': 13, 'min_samples_leaf': 1, 'max_features': 'sqrt', 'criterion': 'absolute_error', 'splitter': 'best'}. Best is trial 368 with value: 0.6055877317086851.
[I 2024-12-04 11:55:27,867] Trial 684 finished with value: 0.6935908088501267 and parameters: {'max_depth': 35, 'min_samples_split': 10, 'min_samples_leaf': 1, 'max_features': 'sqrt', 'criterion': 'friedman_mse', 'splitter': 'best'}. Best is trial 368 with value: 0.6055877317086851.
[I 2024-12-04 11:55:28,420] Trial 665 finished with value: 1.075383350593605 and parameters: {'max_depth': 28, 'min_samples_split': 20, 'min_samples_leaf': 7, 'max_features': 'sqrt', 'criterion': 'absolute_error', 'splitter': 'random'}. Best is trial 368 with value: 0.6055877317086851.
[I 2024-12-04 11:55:29,823] Trial 683 finished with value: 0.8149195364906061 and parameters: {'max_depth': 27, 'min_samples_split': 5, 'min_samples_leaf': 4, 'max_features': 'sqrt', 'criterion': 'squared_error', 'splitter': 'best'}. Best is trial 368 with value: 0.6055877317086851.
[I 2024-12-04 11:55:29,828] Trial 675 finished with value: 0.68655352883041 and parameters: {'max_depth': 30, 'min_samples_split': 13, 'min_samples_leaf': 1, 'max_features': 'sqrt', 'criterion': 'friedman_mse', 'splitter': 'best'}. Best is trial 368 with value: 0.6055877317086851.
[I 2024-12-04 11:55:29,954] Trial 681 finished with value: 0.7165302295489007 and parameters: {'max_depth': 35, 'min_samples_split': 16, 'min_samples_leaf': 1, 'max_features': 'sqrt', 'criterion': 'friedman_mse', 'splitter': 'best'}. Best is trial 368 with value: 0.6055877317086851.
[I 2024-12-04 11:55:30,247] Trial 679 finished with value: 0.6868714023038909 and parameters: {'max_depth': 34, 'min_samples_split': 15, 'min_samples_leaf': 1, 'max_features': 'sqrt', 'criterion': 'friedman_mse', 'splitter': 'best'}. Best is trial 368 with value: 0.6055877317086851.
[I 2024-12-04 11:55:30,438] Trial 690 finished with value: 1.0753381761853185 and parameters: {'max_depth': 30, 'min_samples_split': 10, 'min_samples_leaf': 10, 'max_features': 'log2', 'criterion': 'absolute_error', 'splitter': 'random'}. Best is trial 368 with value: 0.6055877317086851.
[I 2024-12-04 11:55:30,844] Trial 685 finished with value: 0.6361563548204678 and parameters: {'max_depth': 30, 'min_samples_split': 4, 'min_samples_leaf': 1, 'max_features': 'sqrt', 'criterion': 'squared_error', 'splitter': 'best'}. Best is trial 368 with value: 0.6055877317086851.
[I 2024-12-04 11:55:31,077] Trial 693 finished with value: 0.7114266712285047 and parameters: {'max_depth': 29, 'min_samples_split': 10, 'min_samples_leaf': 1, 'max_features': 'sqrt', 'criterion': 'friedman_mse', 'splitter': 'best'}. Best is trial 368 with value: 0.6055877317086851.
[I 2024-12-04 11:55:31,642] Trial 682 finished with value: 0.7470160077116038 and parameters: {'max_depth': 33, 'min_samples_split': 2, 'min_samples_leaf': 1, 'max_features': 'sqrt', 'criterion': 'absolute_error', 'splitter': 'best'}. Best is trial 368 with value: 0.6055877317086851.
[I 2024-12-04 11:55:31,855] Trial 689 finished with value: 1.0307221029499998 and parameters: {'max_depth': 34, 'min_samples_split': 13, 'min_samples_leaf': 1, 'max_features': 'log2', 'criterion': 'friedman_mse', 'splitter': 'random'}. Best is trial 368 with value: 0.6055877317086851.
[I 2024-12-04 11:55:32,714] Trial 686 finished with value: 0.6789802738421568 and parameters: {'max_depth': 35, 'min_samples_split': 13, 'min_samples_leaf': 1, 'max_features': 'sqrt', 'criterion': 'friedman_mse', 'splitter': 'best'}. Best is trial 368 with value: 0.6055877317086851.
[I 2024-12-04 11:55:32,764] Trial 680 finished with value: 0.8209492412990053 and parameters: {'max_depth': 34, 'min_samples_split': 7, 'min_samples_leaf': 2, 'max_features': 'sqrt', 'criterion': 'squared_error', 'splitter': 'best'}. Best is trial 368 with value: 0.6055877317086851.
[I 2024-12-04 11:55:33,196] Trial 698 finished with value: 0.7101567764769892 and parameters: {'max_depth': 25, 'min_samples_split': 4, 'min_samples_leaf': 1, 'max_features': 'sqrt', 'criterion': 'squared_error', 'splitter': 'best'}. Best is trial 368 with value: 0.6055877317086851.
[I 2024-12-04 11:55:33,207] Trial 696 finished with value: 0.7222286893478446 and parameters: {'max_depth': 28, 'min_samples_split': 12, 'min_samples_leaf': 1, 'max_features': 'sqrt', 'criterion': 'friedman_mse', 'splitter': 'best'}. Best is trial 368 with value: 0.6055877317086851.
[I 2024-12-04 11:55:33,232] Trial 695 finished with value: 0.6902141202180059 and parameters: {'max_depth': 31, 'min_samples_split': 3, 'min_samples_leaf': 1, 'max_features': 'sqrt', 'criterion': 'squared_error', 'splitter': 'best'}. Best is trial 368 with value: 0.6055877317086851.
