[I 2024-12-04 12:07:42,687] Trial 1011 finished with value: 0.4147988469237675 and parameters: {'n_estimators': 255, 'max_depth': 8, 'min_samples_split': 7, 'min_samples_leaf': 2, 'max_features': None, 'bootstrap': True, 'criterion': 'squared_error'}. Best is trial 341 with value: 0.2909369124469028.
[I 2024-12-04 12:07:44,290] Trial 1016 finished with value: 0.44196616557791923 and parameters: {'n_estimators': 342, 'max_depth': 50, 'min_samples_split': 5, 'min_samples_leaf': 2, 'max_features': 'sqrt', 'bootstrap': False, 'criterion': 'squared_error'}. Best is trial 341 with value: 0.2909369124469028.
[I 2024-12-04 12:07:44,302] Trial 1022 finished with value: 0.2941840652807526 and parameters: {'n_estimators': 136, 'max_depth': 50, 'min_samples_split': 3, 'min_samples_leaf': 1, 'max_features': 'sqrt', 'bootstrap': False, 'criterion': 'squared_error'}. Best is trial 341 with value: 0.2909369124469028.
[I 2024-12-04 12:07:45,230] Trial 1019 finished with value: 0.31763840035180285 and parameters: {'n_estimators': 334, 'max_depth': 49, 'min_samples_split': 2, 'min_samples_leaf': 1, 'max_features': 'sqrt', 'bootstrap': True, 'criterion': 'squared_error'}. Best is trial 341 with value: 0.2909369124469028.
[I 2024-12-04 12:07:45,607] Trial 1000 finished with value: 0.4085453290665773 and parameters: {'n_estimators': 294, 'max_depth': 42, 'min_samples_split': 19, 'min_samples_leaf': 1, 'max_features': 'sqrt', 'bootstrap': True, 'criterion': 'absolute_error'}. Best is trial 341 with value: 0.2909369124469028.
[I 2024-12-04 12:07:45,971] Trial 1021 finished with value: 0.30603642420677124 and parameters: {'n_estimators': 304, 'max_depth': 43, 'min_samples_split': 2, 'min_samples_leaf': 1, 'max_features': 'sqrt', 'bootstrap': False, 'criterion': 'squared_error'}. Best is trial 341 with value: 0.2909369124469028.
[I 2024-12-04 12:07:48,673] Trial 1025 finished with value: 0.30853811207806847 and parameters: {'n_estimators': 247, 'max_depth': 50, 'min_samples_split': 6, 'min_samples_leaf': 1, 'max_features': 'sqrt', 'bootstrap': False, 'criterion': 'squared_error'}. Best is trial 341 with value: 0.2909369124469028.
[I 2024-12-04 12:07:51,302] Trial 1023 finished with value: 0.29567564535228286 and parameters: {'n_estimators': 238, 'max_depth': 50, 'min_samples_split': 3, 'min_samples_leaf': 1, 'max_features': 'sqrt', 'bootstrap': False, 'criterion': 'squared_error'}. Best is trial 341 with value: 0.2909369124469028.
[I 2024-12-04 12:07:54,053] Trial 1009 finished with value: 0.8938228647986711 and parameters: {'n_estimators': 786, 'max_depth': 42, 'min_samples_split': 20, 'min_samples_leaf': 5, 'max_features': 'log2', 'bootstrap': False, 'criterion': 'absolute_error'}. Best is trial 341 with value: 0.2909369124469028.
[I 2024-12-04 12:07:56,872] Trial 1032 finished with value: 0.4448192182071739 and parameters: {'n_estimators': 118, 'max_depth': 50, 'min_samples_split': 5, 'min_samples_leaf': 2, 'max_features': 'sqrt', 'bootstrap': False, 'criterion': 'squared_error'}. Best is trial 341 with value: 0.2909369124469028.
[I 2024-12-04 12:07:56,897] Trial 1024 finished with value: 0.2954731925535575 and parameters: {'n_estimators': 342, 'max_depth': 50, 'min_samples_split': 3, 'min_samples_leaf': 1, 'max_features': 'sqrt', 'bootstrap': False, 'criterion': 'squared_error'}. Best is trial 341 with value: 0.2909369124469028.
[I 2024-12-04 12:07:56,899] Trial 1036 finished with value: 0.3003072897358713 and parameters: {'n_estimators': 139, 'max_depth': 42, 'min_samples_split': 3, 'min_samples_leaf': 1, 'max_features': 'sqrt', 'bootstrap': False, 'criterion': 'squared_error'}. Best is trial 341 with value: 0.2909369124469028.
[I 2024-12-04 12:07:57,187] Trial 1027 finished with value: 0.2938558690370489 and parameters: {'n_estimators': 214, 'max_depth': 50, 'min_samples_split': 3, 'min_samples_leaf': 1, 'max_features': 'sqrt', 'bootstrap': False, 'criterion': 'squared_error'}. Best is trial 341 with value: 0.2909369124469028.
[I 2024-12-04 12:07:57,209] Trial 1030 finished with value: 0.4484277046655537 and parameters: {'n_estimators': 148, 'max_depth': 50, 'min_samples_split': 6, 'min_samples_leaf': 2, 'max_features': 'sqrt', 'bootstrap': False, 'criterion': 'squared_error'}. Best is trial 341 with value: 0.2909369124469028.
[I 2024-12-04 12:08:02,025] Trial 1028 finished with value: 0.3100089294702406 and parameters: {'n_estimators': 671, 'max_depth': 42, 'min_samples_split': 2, 'min_samples_leaf': 1, 'max_features': 'sqrt', 'bootstrap': False, 'criterion': 'squared_error'}. Best is trial 341 with value: 0.2909369124469028.
[I 2024-12-04 12:08:02,762] Trial 1029 finished with value: 0.30261334263311646 and parameters: {'n_estimators': 258, 'max_depth': 41, 'min_samples_split': 3, 'min_samples_leaf': 1, 'max_features': 'sqrt', 'bootstrap': False, 'criterion': 'squared_error'}. Best is trial 341 with value: 0.2909369124469028.
[I 2024-12-04 12:08:02,863] Trial 919 finished with value: 0.4865487427645647 and parameters: {'n_estimators': 838, 'max_depth': 7, 'min_samples_split': 10, 'min_samples_leaf': 2, 'max_features': None, 'bootstrap': False, 'criterion': 'absolute_error'}. Best is trial 341 with value: 0.2909369124469028.
[I 2024-12-04 12:08:03,043] Trial 1033 finished with value: 0.7931127458441054 and parameters: {'n_estimators': 191, 'max_depth': 41, 'min_samples_split': 8, 'min_samples_leaf': 2, 'max_features': 'log2', 'bootstrap': True, 'criterion': 'squared_error'}. Best is trial 341 with value: 0.2909369124469028.
[I 2024-12-04 12:08:03,552] Trial 1035 finished with value: 0.37988850856736356 and parameters: {'n_estimators': 194, 'max_depth': 50, 'min_samples_split': 2, 'min_samples_leaf': 1, 'max_features': 'log2', 'bootstrap': False, 'criterion': 'squared_error'}. Best is trial 341 with value: 0.2909369124469028.
[I 2024-12-04 12:08:05,485] Trial 1017 finished with value: 0.4245841007678393 and parameters: {'n_estimators': 728, 'max_depth': 49, 'min_samples_split': 19, 'min_samples_leaf': 1, 'max_features': None, 'bootstrap': False, 'criterion': 'squared_error'}. Best is trial 341 with value: 0.2909369124469028.
[I 2024-12-04 12:08:06,366] Trial 1034 finished with value: 0.3017284410837792 and parameters: {'n_estimators': 285, 'max_depth': 46, 'min_samples_split': 2, 'min_samples_leaf': 1, 'max_features': 'sqrt', 'bootstrap': False, 'criterion': 'squared_error'}. Best is trial 341 with value: 0.2909369124469028.
[I 2024-12-04 12:08:06,919] Trial 1038 finished with value: 0.4416384094942954 and parameters: {'n_estimators': 496, 'max_depth': 48, 'min_samples_split': 4, 'min_samples_leaf': 2, 'max_features': 'sqrt', 'bootstrap': False, 'criterion': 'squared_error'}. Best is trial 341 with value: 0.2909369124469028.
[I 2024-12-04 12:08:07,147] Trial 1020 finished with value: 0.7287727608604453 and parameters: {'n_estimators': 606, 'max_depth': 25, 'min_samples_split': 47, 'min_samples_leaf': 2, 'max_features': 'log2', 'bootstrap': False, 'criterion': 'absolute_error'}. Best is trial 341 with value: 0.2909369124469028.
[I 2024-12-04 12:08:07,455] Trial 1039 finished with value: 0.9477372534951618 and parameters: {'n_estimators': 958, 'max_depth': 24, 'min_samples_split': 34, 'min_samples_leaf': 6, 'max_features': 'log2', 'bootstrap': True, 'criterion': 'absolute_error'}. Best is trial 341 with value: 0.2909369124469028.
[I 2024-12-04 12:08:07,879] Trial 1031 finished with value: 0.7493528586996938 and parameters: {'n_estimators': 260, 'max_depth': 13, 'min_samples_split': 5, 'min_samples_leaf': 1, 'max_features': 'log2', 'bootstrap': False, 'criterion': 'absolute_error'}. Best is trial 341 with value: 0.2909369124469028.
[I 2024-12-04 12:08:08,956] Trial 1043 finished with value: 0.2983290469546679 and parameters: {'n_estimators': 217, 'max_depth': 50, 'min_samples_split': 2, 'min_samples_leaf': 1, 'max_features': 'sqrt', 'bootstrap': False, 'criterion': 'squared_error'}. Best is trial 341 with value: 0.2909369124469028.
[I 2024-12-04 12:08:13,139] Trial 1044 finished with value: 0.2991343833875472 and parameters: {'n_estimators': 104, 'max_depth': 50, 'min_samples_split': 2, 'min_samples_leaf': 1, 'max_features': 'sqrt', 'bootstrap': False, 'criterion': 'squared_error'}. Best is trial 341 with value: 0.2909369124469028.
[I 2024-12-04 12:08:16,570] Trial 1046 finished with value: 0.44436289373561244 and parameters: {'n_estimators': 323, 'max_depth': 44, 'min_samples_split': 3, 'min_samples_leaf': 2, 'max_features': 'sqrt', 'bootstrap': False, 'criterion': 'squared_error'}. Best is trial 341 with value: 0.2909369124469028.
[I 2024-12-04 12:08:17,408] Trial 1050 finished with value: 0.31542784895653175 and parameters: {'n_estimators': 122, 'max_depth': 40, 'min_samples_split': 4, 'min_samples_leaf': 1, 'max_features': 'sqrt', 'bootstrap': False, 'criterion': 'squared_error'}. Best is trial 341 with value: 0.2909369124469028.
[I 2024-12-04 12:08:17,409] Trial 1047 finished with value: 0.44782884416731766 and parameters: {'n_estimators': 116, 'max_depth': 48, 'min_samples_split': 2, 'min_samples_leaf': 2, 'max_features': 'sqrt', 'bootstrap': False, 'criterion': 'squared_error'}. Best is trial 341 with value: 0.2909369124469028.
[I 2024-12-04 12:08:18,537] Trial 1041 finished with value: 0.462811490112097 and parameters: {'n_estimators': 181, 'max_depth': 47, 'min_samples_split': 7, 'min_samples_leaf': 2, 'max_features': 'sqrt', 'bootstrap': False, 'criterion': 'absolute_error'}. Best is trial 341 with value: 0.2909369124469028.
[I 2024-12-04 12:08:18,619] Trial 905 finished with value: 0.35108939599250316 and parameters: {'n_estimators': 834, 'max_depth': 43, 'min_samples_split': 16, 'min_samples_leaf': 1, 'max_features': None, 'bootstrap': True, 'criterion': 'absolute_error'}. Best is trial 341 with value: 0.2909369124469028.
[I 2024-12-04 12:08:19,057] Trial 1054 finished with value: 0.4425457842850503 and parameters: {'n_estimators': 241, 'max_depth': 50, 'min_samples_split': 3, 'min_samples_leaf': 2, 'max_features': 'sqrt', 'bootstrap': False, 'criterion': 'squared_error'}. Best is trial 341 with value: 0.2909369124469028.
[I 2024-12-04 12:08:20,205] Trial 1045 finished with value: 0.29565726075768817 and parameters: {'n_estimators': 338, 'max_depth': 50, 'min_samples_split': 3, 'min_samples_leaf': 1, 'max_features': 'sqrt', 'bootstrap': False, 'criterion': 'squared_error'}. Best is trial 341 with value: 0.2909369124469028.
[I 2024-12-04 12:08:21,015] Trial 976 finished with value: 0.4327613882490654 and parameters: {'n_estimators': 339, 'max_depth': 49, 'min_samples_split': 3, 'min_samples_leaf': 1, 'max_features': None, 'bootstrap': False, 'criterion': 'absolute_error'}. Best is trial 341 with value: 0.2909369124469028.
[I 2024-12-04 12:08:21,352] Trial 1053 finished with value: 0.906936476729026 and parameters: {'n_estimators': 364, 'max_depth': 31, 'min_samples_split': 2, 'min_samples_leaf': 4, 'max_features': 'log2', 'bootstrap': True, 'criterion': 'squared_error'}. Best is trial 341 with value: 0.2909369124469028.
[I 2024-12-04 12:08:22,452] Trial 1040 finished with value: 0.3864524485274859 and parameters: {'n_estimators': 584, 'max_depth': 23, 'min_samples_split': 2, 'min_samples_leaf': 3, 'max_features': None, 'bootstrap': False, 'criterion': 'squared_error'}. Best is trial 341 with value: 0.2909369124469028.
[I 2024-12-04 12:08:22,455] Trial 1007 finished with value: 0.3127440132790684 and parameters: {'n_estimators': 737, 'max_depth': 45, 'min_samples_split': 4, 'min_samples_leaf': 1, 'max_features': 'sqrt', 'bootstrap': False, 'criterion': 'absolute_error'}. Best is trial 341 with value: 0.2909369124469028.
[I 2024-12-04 12:08:22,866] Trial 1026 finished with value: 0.32552545863613386 and parameters: {'n_estimators': 707, 'max_depth': 47, 'min_samples_split': 2, 'min_samples_leaf': 1, 'max_features': None, 'bootstrap': True, 'criterion': 'squared_error'}. Best is trial 341 with value: 0.2909369124469028.
[I 2024-12-04 12:08:22,999] Trial 1056 finished with value: 0.30467118320892467 and parameters: {'n_estimators': 271, 'max_depth': 50, 'min_samples_split': 5, 'min_samples_leaf': 1, 'max_features': 'sqrt', 'bootstrap': False, 'criterion': 'squared_error'}. Best is trial 341 with value: 0.2909369124469028.
[I 2024-12-04 12:08:23,497] Trial 1049 finished with value: 0.30769058264923954 and parameters: {'n_estimators': 490, 'max_depth': 40, 'min_samples_split': 3, 'min_samples_leaf': 1, 'max_features': 'sqrt', 'bootstrap': False, 'criterion': 'squared_error'}. Best is trial 341 with value: 0.2909369124469028.
[I 2024-12-04 12:08:23,521] Trial 1048 finished with value: 0.8401155331207796 and parameters: {'n_estimators': 524, 'max_depth': 41, 'min_samples_split': 2, 'min_samples_leaf': 13, 'max_features': 'sqrt', 'bootstrap': False, 'criterion': 'squared_error'}. Best is trial 341 with value: 0.2909369124469028.
[I 2024-12-04 12:08:23,805] Trial 1042 finished with value: 0.4070878314968502 and parameters: {'n_estimators': 931, 'max_depth': 13, 'min_samples_split': 19, 'min_samples_leaf': 4, 'max_features': None, 'bootstrap': True, 'criterion': 'squared_error'}. Best is trial 341 with value: 0.2909369124469028.
[I 2024-12-04 12:08:23,822] Trial 1055 finished with value: 0.31963242791213164 and parameters: {'n_estimators': 445, 'max_depth': 42, 'min_samples_split': 6, 'min_samples_leaf': 1, 'max_features': 'sqrt', 'bootstrap': False, 'criterion': 'squared_error'}. Best is trial 341 with value: 0.2909369124469028.
[I 2024-12-04 12:08:24,783] Trial 1059 finished with value: 0.3156039713683092 and parameters: {'n_estimators': 234, 'max_depth': 42, 'min_samples_split': 5, 'min_samples_leaf': 1, 'max_features': 'sqrt', 'bootstrap': False, 'criterion': 'squared_error'}. Best is trial 341 with value: 0.2909369124469028.
[I 2024-12-04 12:08:25,359] Trial 1052 finished with value: 0.306912228690667 and parameters: {'n_estimators': 241, 'max_depth': 43, 'min_samples_split': 4, 'min_samples_leaf': 1, 'max_features': 'sqrt', 'bootstrap': False, 'criterion': 'squared_error'}. Best is trial 341 with value: 0.2909369124469028.
[I 2024-12-04 12:08:26,596] Trial 1062 finished with value: 0.29825019899214755 and parameters: {'n_estimators': 354, 'max_depth': 50, 'min_samples_split': 2, 'min_samples_leaf': 1, 'max_features': 'sqrt', 'bootstrap': False, 'criterion': 'squared_error'}. Best is trial 341 with value: 0.2909369124469028.
[I 2024-12-04 12:08:26,656] Trial 1037 finished with value: 0.49036879429382396 and parameters: {'n_estimators': 139, 'max_depth': 7, 'min_samples_split': 2, 'min_samples_leaf': 3, 'max_features': None, 'bootstrap': False, 'criterion': 'absolute_error'}. Best is trial 341 with value: 0.2909369124469028.
[I 2024-12-04 12:08:27,653] Trial 1060 finished with value: 0.3874939682583058 and parameters: {'n_estimators': 119, 'max_depth': 47, 'min_samples_split': 2, 'min_samples_leaf': 1, 'max_features': None, 'bootstrap': False, 'criterion': 'squared_error'}. Best is trial 341 with value: 0.2909369124469028.
[I 2024-12-04 12:08:29,454] Trial 1063 finished with value: 0.8075927909142132 and parameters: {'n_estimators': 810, 'max_depth': 9, 'min_samples_split': 26, 'min_samples_leaf': 1, 'max_features': 'log2', 'bootstrap': True, 'criterion': 'squared_error'}. Best is trial 341 with value: 0.2909369124469028.
[I 2024-12-04 12:08:30,156] Trial 1061 finished with value: 0.8666609190410042 and parameters: {'n_estimators': 169, 'max_depth': 30, 'min_samples_split': 7, 'min_samples_leaf': 4, 'max_features': 'log2', 'bootstrap': False, 'criterion': 'squared_error'}. Best is trial 341 with value: 0.2909369124469028.
[I 2024-12-04 12:08:30,721] Trial 1069 finished with value: 0.3017992308495922 and parameters: {'n_estimators': 169, 'max_depth': 50, 'min_samples_split': 5, 'min_samples_leaf': 1, 'max_features': 'sqrt', 'bootstrap': False, 'criterion': 'squared_error'}. Best is trial 341 with value: 0.2909369124469028.
[I 2024-12-04 12:08:35,095] Trial 1071 finished with value: 0.31574691598841714 and parameters: {'n_estimators': 171, 'max_depth': 49, 'min_samples_split': 3, 'min_samples_leaf': 1, 'max_features': 'sqrt', 'bootstrap': True, 'criterion': 'squared_error'}. Best is trial 341 with value: 0.2909369124469028.
[I 2024-12-04 12:08:35,097] Trial 1067 finished with value: 0.29807355491732024 and parameters: {'n_estimators': 216, 'max_depth': 48, 'min_samples_split': 4, 'min_samples_leaf': 1, 'max_features': 'sqrt', 'bootstrap': False, 'criterion': 'squared_error'}. Best is trial 341 with value: 0.2909369124469028.
[I 2024-12-04 12:08:36,017] Trial 1066 finished with value: 0.29475749672288964 and parameters: {'n_estimators': 282, 'max_depth': 50, 'min_samples_split': 3, 'min_samples_leaf': 1, 'max_features': 'sqrt', 'bootstrap': False, 'criterion': 'squared_error'}. Best is trial 341 with value: 0.2909369124469028.
[I 2024-12-04 12:08:36,578] Trial 1058 finished with value: 0.5341882401453331 and parameters: {'n_estimators': 533, 'max_depth': 8, 'min_samples_split': 4, 'min_samples_leaf': 15, 'max_features': None, 'bootstrap': False, 'criterion': 'squared_error'}. Best is trial 341 with value: 0.2909369124469028.
[I 2024-12-04 12:08:39,781] Trial 1072 finished with value: 0.6543374484772331 and parameters: {'n_estimators': 902, 'max_depth': 37, 'min_samples_split': 4, 'min_samples_leaf': 4, 'max_features': 'sqrt', 'bootstrap': True, 'criterion': 'squared_error'}. Best is trial 341 with value: 0.2909369124469028.
[I 2024-12-04 12:08:40,999] Trial 1082 finished with value: 0.3001367231335329 and parameters: {'n_estimators': 133, 'max_depth': 50, 'min_samples_split': 4, 'min_samples_leaf': 1, 'max_features': 'sqrt', 'bootstrap': False, 'criterion': 'squared_error'}. Best is trial 341 with value: 0.2909369124469028.
[I 2024-12-04 12:08:41,000] Trial 1080 finished with value: 0.3047189484347109 and parameters: {'n_estimators': 115, 'max_depth': 44, 'min_samples_split': 3, 'min_samples_leaf': 1, 'max_features': 'sqrt', 'bootstrap': False, 'criterion': 'squared_error'}. Best is trial 341 with value: 0.2909369124469028.
[I 2024-12-04 12:08:41,960] Trial 1064 finished with value: 0.46227694035249156 and parameters: {'n_estimators': 284, 'max_depth': 41, 'min_samples_split': 2, 'min_samples_leaf': 2, 'max_features': 'sqrt', 'bootstrap': False, 'criterion': 'absolute_error'}. Best is trial 341 with value: 0.2909369124469028.
[I 2024-12-04 12:08:42,177] Trial 1083 finished with value: 0.4195552183600003 and parameters: {'n_estimators': 183, 'max_depth': 19, 'min_samples_split': 49, 'min_samples_leaf': 3, 'max_features': None, 'bootstrap': True, 'criterion': 'squared_error'}. Best is trial 341 with value: 0.2909369124469028.
[I 2024-12-04 12:08:42,865] Trial 1074 finished with value: 0.44515679077759684 and parameters: {'n_estimators': 260, 'max_depth': 43, 'min_samples_split': 3, 'min_samples_leaf': 2, 'max_features': 'sqrt', 'bootstrap': False, 'criterion': 'squared_error'}. Best is trial 341 with value: 0.2909369124469028.
[I 2024-12-04 12:08:42,867] Trial 1076 finished with value: 0.30818020199420276 and parameters: {'n_estimators': 346, 'max_depth': 42, 'min_samples_split': 2, 'min_samples_leaf': 1, 'max_features': 'sqrt', 'bootstrap': False, 'criterion': 'squared_error'}. Best is trial 341 with value: 0.2909369124469028.
[I 2024-12-04 12:08:44,160] Trial 1075 finished with value: 0.44301717018199294 and parameters: {'n_estimators': 325, 'max_depth': 50, 'min_samples_split': 3, 'min_samples_leaf': 2, 'max_features': 'sqrt', 'bootstrap': False, 'criterion': 'squared_error'}. Best is trial 341 with value: 0.2909369124469028.
[I 2024-12-04 12:08:44,894] Trial 1073 finished with value: 0.3013638775352519 and parameters: {'n_estimators': 133, 'max_depth': 49, 'min_samples_split': 2, 'min_samples_leaf': 1, 'max_features': 'sqrt', 'bootstrap': False, 'criterion': 'absolute_error'}. Best is trial 341 with value: 0.2909369124469028.
[I 2024-12-04 12:08:45,221] Trial 994 finished with value: 0.4513612713937152 and parameters: {'n_estimators': 936, 'max_depth': 47, 'min_samples_split': 3, 'min_samples_leaf': 5, 'max_features': None, 'bootstrap': False, 'criterion': 'absolute_error'}. Best is trial 341 with value: 0.2909369124469028.
[I 2024-12-04 12:08:45,681] Trial 1078 finished with value: 0.4431037495596901 and parameters: {'n_estimators': 359, 'max_depth': 42, 'min_samples_split': 3, 'min_samples_leaf': 2, 'max_features': 'sqrt', 'bootstrap': False, 'criterion': 'squared_error'}. Best is trial 341 with value: 0.2909369124469028.
[I 2024-12-04 12:08:45,840] Trial 1077 finished with value: 0.30372541785655743 and parameters: {'n_estimators': 379, 'max_depth': 44, 'min_samples_split': 2, 'min_samples_leaf': 1, 'max_features': 'sqrt', 'bootstrap': False, 'criterion': 'squared_error'}. Best is trial 341 with value: 0.2909369124469028.
[I 2024-12-04 12:08:47,660] Trial 1086 finished with value: 0.9562572766665167 and parameters: {'n_estimators': 654, 'max_depth': 40, 'min_samples_split': 50, 'min_samples_leaf': 8, 'max_features': 'log2', 'bootstrap': True, 'criterion': 'squared_error'}. Best is trial 341 with value: 0.2909369124469028.
[I 2024-12-04 12:08:47,691] Trial 1068 finished with value: 0.9691553122281165 and parameters: {'n_estimators': 852, 'max_depth': 45, 'min_samples_split': 3, 'min_samples_leaf': 14, 'max_features': 'log2', 'bootstrap': True, 'criterion': 'squared_error'}. Best is trial 341 with value: 0.2909369124469028.
[I 2024-12-04 12:08:50,938] Trial 1079 finished with value: 0.2981970892976419 and parameters: {'n_estimators': 300, 'max_depth': 50, 'min_samples_split': 2, 'min_samples_leaf': 1, 'max_features': 'sqrt', 'bootstrap': False, 'criterion': 'squared_error'}. Best is trial 341 with value: 0.2909369124469028.
