[I 2024-12-03 19:18:41,312] Trial 2004 finished with value: 0.7239441179458069 and parameters: {'kernel': 'rbf', 'C': 95.27123483636656, 'gamma': 0.10976627369759939, 'epsilon': 0.8454312218549875}. Best is trial 88 with value: 0.3542875001421725.
[I 2024-12-03 19:18:42,686] Trial 2005 finished with value: 0.3852288366116692 and parameters: {'kernel': 'rbf', 'C': 92.9460411407355, 'gamma': 0.016822235902877607, 'epsilon': 0.09214405342624886}. Best is trial 88 with value: 0.3542875001421725.
[I 2024-12-03 19:18:43,239] Trial 2006 finished with value: 0.8382854310214382 and parameters: {'kernel': 'rbf', 'C': 0.018298652947175798, 'gamma': 0.013768596844479794, 'epsilon': 0.002270784959233744}. Best is trial 88 with value: 0.3542875001421725.
[I 2024-12-03 19:18:44,184] Trial 2007 finished with value: 0.3997441803738555 and parameters: {'kernel': 'rbf', 'C': 18.55939066541327, 'gamma': 0.06545445578247164, 'epsilon': 0.10248418711894926}. Best is trial 88 with value: 0.3542875001421725.
[I 2024-12-03 19:18:45,015] Trial 2008 finished with value: 0.42374986217493177 and parameters: {'kernel': 'rbf', 'C': 78.3701764378808, 'gamma': 0.0031761501158550785, 'epsilon': 0.11888487210515823}. Best is trial 88 with value: 0.3542875001421725.
[I 2024-12-03 19:18:45,595] Trial 2009 finished with value: 0.36490161470259236 and parameters: {'kernel': 'rbf', 'C': 93.92527628560676, 'gamma': 0.03191194999031277, 'epsilon': 0.18311755947463826}. Best is trial 88 with value: 0.3542875001421725.
[I 2024-12-03 19:18:46,319] Trial 2010 finished with value: 0.40305967174779744 and parameters: {'kernel': 'rbf', 'C': 21.676409392242757, 'gamma': 0.058569320150109995, 'epsilon': 0.263141767525728}. Best is trial 88 with value: 0.3542875001421725.
[I 2024-12-03 19:18:47,269] Trial 2011 finished with value: 1.0739285981910156 and parameters: {'kernel': 'poly', 'C': 0.019049210547891857, 'gamma': 0.00011503927090554433, 'epsilon': 0.021771244823084745}. Best is trial 88 with value: 0.3542875001421725.
[I 2024-12-03 19:18:48,514] Trial 2013 finished with value: 0.40967950135778985 and parameters: {'kernel': 'rbf', 'C': 19.354680136493428, 'gamma': 0.02346706409801226, 'epsilon': 0.2090507339011282}. Best is trial 88 with value: 0.3542875001421725.
[I 2024-12-03 19:18:49,817] Trial 2014 finished with value: 0.40960465305753063 and parameters: {'kernel': 'rbf', 'C': 15.36739517712775, 'gamma': 0.07151516097336492, 'epsilon': 0.1528415480671318}. Best is trial 88 with value: 0.3542875001421725.
[I 2024-12-03 19:18:51,715] Trial 2015 finished with value: 0.3804772329445099 and parameters: {'kernel': 'rbf', 'C': 99.37522212065659, 'gamma': 0.01741625081559852, 'epsilon': 0.05186632690721944}. Best is trial 88 with value: 0.3542875001421725.
[I 2024-12-03 19:18:53,088] Trial 2016 finished with value: 0.41609205038621816 and parameters: {'kernel': 'rbf', 'C': 22.974768897163727, 'gamma': 0.023708465317871776, 'epsilon': 0.11395189506748553}. Best is trial 88 with value: 0.3542875001421725.
[I 2024-12-03 19:18:54,296] Trial 2017 finished with value: 0.4359730490678149 and parameters: {'kernel': 'rbf', 'C': 93.21550589932568, 'gamma': 0.0044474120732272025, 'epsilon': 0.30734588042107486}. Best is trial 88 with value: 0.3542875001421725.
[I 2024-12-03 19:18:55,419] Trial 2018 finished with value: 0.4281943839297918 and parameters: {'kernel': 'rbf', 'C': 29.66671843991725, 'gamma': 0.008145304559854794, 'epsilon': 0.3777157623210001}. Best is trial 88 with value: 0.3542875001421725.
[I 2024-12-03 19:18:56,678] Trial 2019 finished with value: 0.431535129112427 and parameters: {'kernel': 'rbf', 'C': 99.17797151718896, 'gamma': 0.11753118359473533, 'epsilon': 0.1677694642954209}. Best is trial 88 with value: 0.3542875001421725.
[I 2024-12-03 19:18:57,828] Trial 2020 finished with value: 0.39077460817692133 and parameters: {'kernel': 'rbf', 'C': 23.930539861286388, 'gamma': 0.03300067758629623, 'epsilon': 0.3143885308641143}. Best is trial 88 with value: 0.3542875001421725.
[I 2024-12-03 19:18:59,067] Trial 2021 finished with value: 0.4095881740544692 and parameters: {'kernel': 'rbf', 'C': 90.75898128886026, 'gamma': 0.09519875324448028, 'epsilon': 0.19983726464260038}. Best is trial 88 with value: 0.3542875001421725.
[I 2024-12-03 19:19:00,526] Trial 2022 finished with value: 0.3882364824302644 and parameters: {'kernel': 'rbf', 'C': 99.42700895149358, 'gamma': 0.086056850900682, 'epsilon': 0.09234476106858704}. Best is trial 88 with value: 0.3542875001421725.
[I 2024-12-03 19:19:02,509] Trial 2023 finished with value: 1.8443074336556144 and parameters: {'kernel': 'sigmoid', 'C': 0.05468220897498731, 'gamma': 0.2726522212403089, 'epsilon': 0.05313883097543918}. Best is trial 88 with value: 0.3542875001421725.
[I 2024-12-03 19:19:03,781] Trial 2024 finished with value: 0.3758052656730847 and parameters: {'kernel': 'rbf', 'C': 92.50506653767486, 'gamma': 0.06528650560906549, 'epsilon': 0.20535096008549378}. Best is trial 88 with value: 0.3542875001421725.
[I 2024-12-03 19:19:05,103] Trial 2025 finished with value: 0.3969412005971754 and parameters: {'kernel': 'rbf', 'C': 19.04133895349705, 'gamma': 0.05716500088006186, 'epsilon': 0.1333662575197643}. Best is trial 88 with value: 0.3542875001421725.
[I 2024-12-03 19:19:05,249] Trial 1519 finished with value: 3.099404241203378 and parameters: {'kernel': 'poly', 'C': 75.962475295844, 'gamma': 0.06034844838155149, 'epsilon': 0.14168384171431678}. Best is trial 88 with value: 0.3542875001421725.
[I 2024-12-03 19:19:07,045] Trial 2026 finished with value: 0.3819831224695861 and parameters: {'kernel': 'rbf', 'C': 91.08146625791166, 'gamma': 0.01785584632500805, 'epsilon': 0.08032334210570156}. Best is trial 88 with value: 0.3542875001421725.
[I 2024-12-03 19:19:07,652] Trial 2027 finished with value: 0.36814562810266505 and parameters: {'kernel': 'rbf', 'C': 99.7420022663656, 'gamma': 0.059628264652188345, 'epsilon': 0.12770857630875976}. Best is trial 88 with value: 0.3542875001421725.
[I 2024-12-03 19:19:08,888] Trial 2028 finished with value: 0.3983763000362886 and parameters: {'kernel': 'rbf', 'C': 22.78582388386304, 'gamma': 0.04779628144974377, 'epsilon': 0.057663867270783424}. Best is trial 88 with value: 0.3542875001421725.
[I 2024-12-03 19:19:10,319] Trial 2030 finished with value: 0.41196593922175767 and parameters: {'kernel': 'rbf', 'C': 22.436925006298193, 'gamma': 0.0258095329045703, 'epsilon': 0.42241374195423737}. Best is trial 88 with value: 0.3542875001421725.
[I 2024-12-03 19:19:12,383] Trial 2031 finished with value: 3.0544149495240775 and parameters: {'kernel': 'poly', 'C': 1.7574048135639295, 'gamma': 0.07049671188449298, 'epsilon': 0.814855479812663}. Best is trial 88 with value: 0.3542875001421725.
[I 2024-12-03 19:19:13,410] Trial 2032 finished with value: 0.6665003871205684 and parameters: {'kernel': 'rbf', 'C': 8.48155031080451, 'gamma': 0.09822133316140645, 'epsilon': 0.7446630687069242}. Best is trial 88 with value: 0.3542875001421725.
[I 2024-12-03 19:19:14,559] Trial 2033 finished with value: 0.42419607761308536 and parameters: {'kernel': 'rbf', 'C': 88.37730028323848, 'gamma': 0.07211052604174897, 'epsilon': 0.3586898696996533}. Best is trial 88 with value: 0.3542875001421725.
[I 2024-12-03 19:19:15,847] Trial 2034 finished with value: 0.45376792922392734 and parameters: {'kernel': 'rbf', 'C': 3.8303670137531713, 'gamma': 0.030350827523969566, 'epsilon': 0.0885809186714575}. Best is trial 88 with value: 0.3542875001421725.
[I 2024-12-03 19:19:17,113] Trial 2035 finished with value: 0.3682813134952402 and parameters: {'kernel': 'rbf', 'C': 95.4067947019065, 'gamma': 0.052261131800322366, 'epsilon': 0.22661153117667737}. Best is trial 88 with value: 0.3542875001421725.
[I 2024-12-03 19:19:18,210] Trial 2036 finished with value: 0.4185898799490638 and parameters: {'kernel': 'rbf', 'C': 25.682605420105297, 'gamma': 0.014293690809018362, 'epsilon': 0.23299318625280632}. Best is trial 88 with value: 0.3542875001421725.
[I 2024-12-03 19:19:18,358] Trial 1991 finished with value: 0.7436660355652688 and parameters: {'kernel': 'linear', 'C': 91.42308499208268, 'gamma': 0.033429816591875695, 'epsilon': 0.23849578153231574}. Best is trial 88 with value: 0.3542875001421725.
[I 2024-12-03 19:19:19,675] Trial 2037 finished with value: 0.4129061474236738 and parameters: {'kernel': 'rbf', 'C': 20.656993850888995, 'gamma': 0.03545842427458609, 'epsilon': 0.09881161867109535}. Best is trial 88 with value: 0.3542875001421725.
[I 2024-12-03 19:19:20,405] Trial 2038 finished with value: 0.39527393379867387 and parameters: {'kernel': 'rbf', 'C': 95.88571971725341, 'gamma': 0.014719656821312993, 'epsilon': 0.07692360708215631}. Best is trial 88 with value: 0.3542875001421725.
[I 2024-12-03 19:19:20,885] Trial 2039 finished with value: 0.5894645970756551 and parameters: {'kernel': 'rbf', 'C': 28.44006780087667, 'gamma': 0.2656890610881119, 'epsilon': 0.22336630440747937}. Best is trial 88 with value: 0.3542875001421725.
[I 2024-12-03 19:19:21,943] Trial 2040 finished with value: 0.4176054123227265 and parameters: {'kernel': 'rbf', 'C': 81.63561396962717, 'gamma': 0.009782851341017808, 'epsilon': 0.42228430712637804}. Best is trial 88 with value: 0.3542875001421725.
[I 2024-12-03 19:19:22,529] Trial 2041 finished with value: 0.36358146357209836 and parameters: {'kernel': 'rbf', 'C': 98.5856428452053, 'gamma': 0.03150400133169172, 'epsilon': 0.19633718033889996}. Best is trial 88 with value: 0.3542875001421725.
[I 2024-12-03 19:19:23,506] Trial 2042 finished with value: 0.39948584728298314 and parameters: {'kernel': 'rbf', 'C': 97.48377823964184, 'gamma': 0.09743350783585773, 'epsilon': 0.148424244579469}. Best is trial 88 with value: 0.3542875001421725.
[I 2024-12-03 19:19:24,539] Trial 2043 finished with value: 0.36758566994643455 and parameters: {'kernel': 'rbf', 'C': 98.54617323884784, 'gamma': 0.05910121035945152, 'epsilon': 0.13214033518959517}. Best is trial 88 with value: 0.3542875001421725.
[I 2024-12-03 19:19:26,823] Trial 2045 finished with value: 0.369872422158577 and parameters: {'kernel': 'rbf', 'C': 92.24168363258003, 'gamma': 0.03671149496879599, 'epsilon': 0.04417089164886373}. Best is trial 88 with value: 0.3542875001421725.
[I 2024-12-03 19:19:28,098] Trial 2046 finished with value: 0.378364798481649 and parameters: {'kernel': 'rbf', 'C': 99.27778174495238, 'gamma': 0.014098208002221743, 'epsilon': 0.25362507411291746}. Best is trial 88 with value: 0.3542875001421725.
[I 2024-12-03 19:19:29,558] Trial 2047 finished with value: 0.5240628003716887 and parameters: {'kernel': 'rbf', 'C': 3.6573462758032615, 'gamma': 0.1591287216043937, 'epsilon': 0.08532013898275376}. Best is trial 88 with value: 0.3542875001421725.
[I 2024-12-03 19:19:39,140] Trial 1957 finished with value: 0.805905617872778 and parameters: {'kernel': 'linear', 'C': 96.42352079503684, 'gamma': 0.010717766459565042, 'epsilon': 0.04123143276046109}. Best is trial 88 with value: 0.3542875001421725.
[I 2024-12-03 19:19:40,635] Trial 2049 finished with value: 0.39395714679096316 and parameters: {'kernel': 'rbf', 'C': 21.043715287443217, 'gamma': 0.05461940731782696, 'epsilon': 0.19136099489921615}. Best is trial 88 with value: 0.3542875001421725.
[I 2024-12-03 19:19:42,367] Trial 2048 finished with value: 0.7842923017134944 and parameters: {'kernel': 'linear', 'C': 14.492063013481298, 'gamma': 0.28334321955734254, 'epsilon': 0.13882881390179466}. Best is trial 88 with value: 0.3542875001421725.
[I 2024-12-03 19:19:43,311] Trial 2050 finished with value: 0.3872713324822658 and parameters: {'kernel': 'rbf', 'C': 98.6774523915608, 'gamma': 0.08003661996999815, 'epsilon': 0.0657517955503895}. Best is trial 88 with value: 0.3542875001421725.
[I 2024-12-03 19:19:45,267] Trial 2051 finished with value: 2.4335740428984582 and parameters: {'kernel': 'poly', 'C': 95.9767253020901, 'gamma': 0.007952355485317907, 'epsilon': 0.07024850736032004}. Best is trial 88 with value: 0.3542875001421725.
[I 2024-12-03 19:19:46,098] Trial 2052 finished with value: 0.4178800808636002 and parameters: {'kernel': 'rbf', 'C': 96.8459980128796, 'gamma': 0.006655058065146874, 'epsilon': 0.036795946834622825}. Best is trial 88 with value: 0.3542875001421725.
[I 2024-12-03 19:19:46,688] Trial 2053 finished with value: 0.41755884152785033 and parameters: {'kernel': 'rbf', 'C': 96.39439429245493, 'gamma': 0.009886843509271085, 'epsilon': 0.10547072694948689}. Best is trial 88 with value: 0.3542875001421725.
[I 2024-12-03 19:19:47,534] Trial 2054 finished with value: 1834.8173992062905 and parameters: {'kernel': 'sigmoid', 'C': 86.04939464919656, 'gamma': 0.05943356492048692, 'epsilon': 0.32658088251680567}. Best is trial 88 with value: 0.3542875001421725.
[I 2024-12-03 19:19:48,076] Trial 2055 finished with value: 0.39086031867200904 and parameters: {'kernel': 'rbf', 'C': 23.16649696819682, 'gamma': 0.04987006223562562, 'epsilon': 0.11088956515408008}. Best is trial 88 with value: 0.3542875001421725.
[I 2024-12-03 19:19:48,946] Trial 2056 finished with value: 1.5601176279764857 and parameters: {'kernel': 'poly', 'C': 0.0030605693046919734, 'gamma': 0.019393166263555226, 'epsilon': 0.0012405728187821791}. Best is trial 88 with value: 0.3542875001421725.
[I 2024-12-03 19:19:49,781] Trial 2057 finished with value: 0.4470873159216229 and parameters: {'kernel': 'rbf', 'C': 22.897683533629806, 'gamma': 0.13701262212878493, 'epsilon': 0.06208754848818547}. Best is trial 88 with value: 0.3542875001421725.
[I 2024-12-03 19:19:50,627] Trial 2058 finished with value: 0.41990479963676725 and parameters: {'kernel': 'rbf', 'C': 25.85478826989257, 'gamma': 0.012517966023375007, 'epsilon': 0.10406806480532904}. Best is trial 88 with value: 0.3542875001421725.
[I 2024-12-03 19:19:51,198] Trial 2059 finished with value: 0.40208010293926333 and parameters: {'kernel': 'rbf', 'C': 17.8647562158581, 'gamma': 0.033490654443735134, 'epsilon': 0.29610493263815296}. Best is trial 88 with value: 0.3542875001421725.
[I 2024-12-03 19:19:52,228] Trial 2060 finished with value: 0.7911421420726991 and parameters: {'kernel': 'linear', 'C': 0.19315288410400705, 'gamma': 0.00479039160447912, 'epsilon': 0.0015880363720097012}. Best is trial 88 with value: 0.3542875001421725.
[I 2024-12-03 19:19:53,195] Trial 2061 finished with value: 0.36903570940871244 and parameters: {'kernel': 'rbf', 'C': 99.25166097904466, 'gamma': 0.02081616872718862, 'epsilon': 0.0535195911286593}. Best is trial 88 with value: 0.3542875001421725.
[I 2024-12-03 19:19:53,739] Trial 2062 finished with value: 0.36245077370766005 and parameters: {'kernel': 'rbf', 'C': 98.92432736034696, 'gamma': 0.052423376072486434, 'epsilon': 0.12172085175680554}. Best is trial 88 with value: 0.3542875001421725.
[I 2024-12-03 19:19:54,729] Trial 2063 finished with value: 0.36734827871517006 and parameters: {'kernel': 'rbf', 'C': 97.76007785890654, 'gamma': 0.029740409668865254, 'epsilon': 0.1568029988046077}. Best is trial 88 with value: 0.3542875001421725.
[I 2024-12-03 19:19:55,721] Trial 2064 finished with value: 0.4427289183631533 and parameters: {'kernel': 'rbf', 'C': 13.015339322772919, 'gamma': 0.04808184764788495, 'epsilon': 0.011453430045936339}. Best is trial 88 with value: 0.3542875001421725.
[I 2024-12-03 19:19:56,088] Trial 2065 finished with value: 0.38069365155390106 and parameters: {'kernel': 'rbf', 'C': 94.94415107839029, 'gamma': 0.01656940806920158, 'epsilon': 0.39661280942000166}. Best is trial 88 with value: 0.3542875001421725.
[I 2024-12-03 19:19:57,221] Trial 2066 finished with value: 0.3995261785468776 and parameters: {'kernel': 'rbf', 'C': 93.70923204721319, 'gamma': 0.1038789979501773, 'epsilon': 0.07624201581013954}. Best is trial 88 with value: 0.3542875001421725.
[I 2024-12-03 19:19:57,774] Trial 2067 finished with value: 0.5511308111551353 and parameters: {'kernel': 'rbf', 'C': 10.643984905923482, 'gamma': 0.20835983772148745, 'epsilon': 0.22194595308772316}. Best is trial 88 with value: 0.3542875001421725.
[I 2024-12-03 19:19:58,490] Trial 2068 finished with value: 0.514853764946875 and parameters: {'kernel': 'rbf', 'C': 21.884733856084715, 'gamma': 0.1377094453339328, 'epsilon': 0.3354141996600135}. Best is trial 88 with value: 0.3542875001421725.
[I 2024-12-03 19:19:59,692] Trial 2069 finished with value: 0.76331389711844 and parameters: {'kernel': 'rbf', 'C': 89.41129349560795, 'gamma': 0.7637190164686967, 'epsilon': 0.03742921664817919}. Best is trial 88 with value: 0.3542875001421725.
[I 2024-12-03 19:20:00,737] Trial 2070 finished with value: 0.7891967559184779 and parameters: {'kernel': 'rbf', 'C': 0.18807858433833313, 'gamma': 0.0015428544117458665, 'epsilon': 0.0023039243513166136}. Best is trial 88 with value: 0.3542875001421725.
[I 2024-12-03 19:20:01,626] Trial 2071 finished with value: 0.7911021667168244 and parameters: {'kernel': 'linear', 'C': 0.4462177151612945, 'gamma': 0.05258549529129179, 'epsilon': 0.0025810249420041456}. Best is trial 88 with value: 0.3542875001421725.
[I 2024-12-03 19:20:02,184] Trial 2072 finished with value: 0.5816043565779518 and parameters: {'kernel': 'rbf', 'C': 23.135003945937974, 'gamma': 0.2923769500160673, 'epsilon': 0.10313669904306211}. Best is trial 88 with value: 0.3542875001421725.
[I 2024-12-03 19:20:03,117] Trial 2073 finished with value: 0.37175843076947923 and parameters: {'kernel': 'rbf', 'C': 97.89133222739227, 'gamma': 0.018547476059263174, 'epsilon': 0.18924907056699855}. Best is trial 88 with value: 0.3542875001421725.
[I 2024-12-03 19:20:03,965] Trial 2074 finished with value: 0.4348359502094507 and parameters: {'kernel': 'rbf', 'C': 18.081710263714555, 'gamma': 0.018474346485589675, 'epsilon': 0.08573993173681993}. Best is trial 88 with value: 0.3542875001421725.
[I 2024-12-03 19:20:04,651] Trial 2075 finished with value: 0.45982646457835014 and parameters: {'kernel': 'rbf', 'C': 4.779063801789329, 'gamma': 0.014839443255508605, 'epsilon': 0.2228789023742013}. Best is trial 88 with value: 0.3542875001421725.
[I 2024-12-03 19:20:06,546] Trial 2077 finished with value: 0.3938818916084224 and parameters: {'kernel': 'rbf', 'C': 25.569006793814808, 'gamma': 0.0821761833341921, 'epsilon': 0.05731795235458568}. Best is trial 88 with value: 0.3542875001421725.
[I 2024-12-03 19:20:07,875] Trial 2078 finished with value: 0.41301990575819425 and parameters: {'kernel': 'rbf', 'C': 17.55496193234326, 'gamma': 0.06484441419996072, 'epsilon': 0.2712664068385149}. Best is trial 88 with value: 0.3542875001421725.
[I 2024-12-03 19:20:09,307] Trial 2079 finished with value: 0.5606253843889413 and parameters: {'kernel': 'rbf', 'C': 98.49224927150824, 'gamma': 0.2453796230690266, 'epsilon': 0.1600908391211339}. Best is trial 88 with value: 0.3542875001421725.
[I 2024-12-03 19:20:11,088] Trial 2080 finished with value: 0.3815294498707721 and parameters: {'kernel': 'rbf', 'C': 93.15006142736172, 'gamma': 0.07361691520424453, 'epsilon': 0.06673482545119441}. Best is trial 88 with value: 0.3542875001421725.
[I 2024-12-03 19:20:22,002] Trial 2081 finished with value: 0.7704615537920044 and parameters: {'kernel': 'linear', 'C': 14.850996906141132, 'gamma': 0.047954041705236226, 'epsilon': 0.17943669530221182}. Best is trial 88 with value: 0.3542875001421725.
[I 2024-12-03 19:20:24,247] Trial 2082 finished with value: 0.3557293680138965 and parameters: {'kernel': 'rbf', 'C': 97.78526943561918, 'gamma': 0.0419203042793768, 'epsilon': 0.14380543595669265}. Best is trial 88 with value: 0.3542875001421725.
[I 2024-12-03 19:20:26,890] Trial 2083 finished with value: 0.402957692753771 and parameters: {'kernel': 'rbf', 'C': 13.841822357534609, 'gamma': 0.014087451030981281, 'epsilon': 0.05031711949206202}. Best is trial 88 with value: 0.3542875001421725.
[I 2024-12-03 19:20:29,476] Trial 2084 finished with value: 0.3634332840839417 and parameters: {'kernel': 'rbf', 'C': 95.71864993098325, 'gamma': 0.055736094923803825, 'epsilon': 0.11350701475607745}. Best is trial 88 with value: 0.3542875001421725.
[I 2024-12-03 19:20:38,672] Trial 2029 finished with value: 0.8029045259906875 and parameters: {'kernel': 'linear', 'C': 99.84121174428326, 'gamma': 0.25290032007729224, 'epsilon': 0.06965506083205462}. Best is trial 88 with value: 0.3542875001421725.
[I 2024-12-03 19:20:39,979] Trial 2086 finished with value: 0.46975958216071256 and parameters: {'kernel': 'rbf', 'C': 4.812605633076631, 'gamma': 0.06537347288770916, 'epsilon': 0.11083671577690085}. Best is trial 88 with value: 0.3542875001421725.
[I 2024-12-03 19:20:41,351] Trial 2087 finished with value: 0.43653638276264 and parameters: {'kernel': 'rbf', 'C': 19.0986741749453, 'gamma': 0.12167097961443181, 'epsilon': 0.1056138246719686}. Best is trial 88 with value: 0.3542875001421725.
[I 2024-12-03 19:20:42,528] Trial 2088 finished with value: 0.40882874812983444 and parameters: {'kernel': 'rbf', 'C': 92.68228213544367, 'gamma': 0.049069057033143994, 'epsilon': 0.40779618882448326}. Best is trial 88 with value: 0.3542875001421725.
[I 2024-12-03 19:20:43,913] Trial 2076 finished with value: 0.7193551127708795 and parameters: {'kernel': 'linear', 'C': 78.93302502637631, 'gamma': 0.0033370311332876863, 'epsilon': 0.31448717490617334}. Best is trial 88 with value: 0.3542875001421725.
[I 2024-12-03 19:20:44,055] Trial 2089 finished with value: 0.42066730816486536 and parameters: {'kernel': 'rbf', 'C': 22.053054230135118, 'gamma': 0.03004001477802278, 'epsilon': 0.061977857432323764}. Best is trial 88 with value: 0.3542875001421725.
[I 2024-12-03 19:20:45,963] Trial 2091 finished with value: 0.6489095294494294 and parameters: {'kernel': 'rbf', 'C': 99.70052874035072, 'gamma': 0.3371040994513886, 'epsilon': 0.3079474495774668}. Best is trial 88 with value: 0.3542875001421725.
