[I 2024-12-04 14:57:54,615] Trial 512 finished with value: 0.7215488829994788 and parameters: {'n_estimators': 755, 'max_depth': 27, 'min_samples_split': 17, 'min_samples_leaf': 2, 'max_features': 'sqrt', 'bootstrap': True, 'criterion': 'squared_error'}. Best is trial 223 with value: 0.4188398890260366.
[I 2024-12-04 14:57:57,694] Trial 507 finished with value: 0.4276252523846461 and parameters: {'n_estimators': 586, 'max_depth': 33, 'min_samples_split': 3, 'min_samples_leaf': 1, 'max_features': None, 'bootstrap': True, 'criterion': 'squared_error'}. Best is trial 223 with value: 0.4188398890260366.
[I 2024-12-04 14:57:57,698] Trial 499 finished with value: 0.4210614866705391 and parameters: {'n_estimators': 820, 'max_depth': 43, 'min_samples_split': 2, 'min_samples_leaf': 1, 'max_features': None, 'bootstrap': True, 'criterion': 'squared_error'}. Best is trial 223 with value: 0.4188398890260366.
[I 2024-12-04 14:57:57,806] Trial 505 finished with value: 0.4201067757250526 and parameters: {'n_estimators': 593, 'max_depth': 40, 'min_samples_split': 2, 'min_samples_leaf': 1, 'max_features': None, 'bootstrap': True, 'criterion': 'squared_error'}. Best is trial 223 with value: 0.4188398890260366.
[I 2024-12-04 14:57:59,485] Trial 520 finished with value: 0.6972488218730111 and parameters: {'n_estimators': 646, 'max_depth': 40, 'min_samples_split': 12, 'min_samples_leaf': 1, 'max_features': 'log2', 'bootstrap': True, 'criterion': 'squared_error'}. Best is trial 223 with value: 0.4188398890260366.
[I 2024-12-04 14:58:02,077] Trial 514 finished with value: 0.46589892695083857 and parameters: {'n_estimators': 557, 'max_depth': 39, 'min_samples_split': 2, 'min_samples_leaf': 2, 'max_features': None, 'bootstrap': True, 'criterion': 'squared_error'}. Best is trial 223 with value: 0.4188398890260366.
[I 2024-12-04 14:58:02,590] Trial 508 finished with value: 0.4213458029940927 and parameters: {'n_estimators': 603, 'max_depth': 36, 'min_samples_split': 2, 'min_samples_leaf': 1, 'max_features': None, 'bootstrap': True, 'criterion': 'squared_error'}. Best is trial 223 with value: 0.4188398890260366.
[I 2024-12-04 14:58:05,210] Trial 479 finished with value: 0.4591937834839243 and parameters: {'n_estimators': 881, 'max_depth': 45, 'min_samples_split': 2, 'min_samples_leaf': 2, 'max_features': None, 'bootstrap': True, 'criterion': 'absolute_error'}. Best is trial 223 with value: 0.4188398890260366.
[I 2024-12-04 14:58:05,537] Trial 513 finished with value: 0.4317368151276483 and parameters: {'n_estimators': 700, 'max_depth': 40, 'min_samples_split': 4, 'min_samples_leaf': 1, 'max_features': None, 'bootstrap': True, 'criterion': 'squared_error'}. Best is trial 223 with value: 0.4188398890260366.
[I 2024-12-04 14:58:05,955] Trial 524 finished with value: 1.0358449656726052 and parameters: {'n_estimators': 733, 'max_depth': 18, 'min_samples_split': 8, 'min_samples_leaf': 13, 'max_features': 'sqrt', 'bootstrap': True, 'criterion': 'squared_error'}. Best is trial 223 with value: 0.4188398890260366.
[I 2024-12-04 14:58:15,725] Trial 529 finished with value: 1.0772637198676065 and parameters: {'n_estimators': 588, 'max_depth': 29, 'min_samples_split': 5, 'min_samples_leaf': 15, 'max_features': 'log2', 'bootstrap': True, 'criterion': 'squared_error'}. Best is trial 223 with value: 0.4188398890260366.
[I 2024-12-04 14:58:16,188] Trial 519 finished with value: 0.8634527541906827 and parameters: {'n_estimators': 808, 'max_depth': 44, 'min_samples_split': 7, 'min_samples_leaf': 5, 'max_features': 'sqrt', 'bootstrap': False, 'criterion': 'absolute_error'}. Best is trial 223 with value: 0.4188398890260366.
[I 2024-12-04 14:58:16,414] Trial 515 finished with value: 0.7184607216664798 and parameters: {'n_estimators': 582, 'max_depth': 30, 'min_samples_split': 3, 'min_samples_leaf': 9, 'max_features': None, 'bootstrap': False, 'criterion': 'absolute_error'}. Best is trial 223 with value: 0.4188398890260366.
[I 2024-12-04 14:58:18,644] Trial 516 finished with value: 0.7378855792842068 and parameters: {'n_estimators': 568, 'max_depth': 45, 'min_samples_split': 36, 'min_samples_leaf': 1, 'max_features': 'log2', 'bootstrap': True, 'criterion': 'absolute_error'}. Best is trial 223 with value: 0.4188398890260366.
[I 2024-12-04 14:58:18,973] Trial 533 finished with value: 0.9596713678848283 and parameters: {'n_estimators': 611, 'max_depth': 35, 'min_samples_split': 2, 'min_samples_leaf': 2, 'max_features': 'log2', 'bootstrap': True, 'criterion': 'squared_error'}. Best is trial 223 with value: 0.4188398890260366.
[I 2024-12-04 14:58:19,489] Trial 517 finished with value: 0.4258428309997497 and parameters: {'n_estimators': 675, 'max_depth': 46, 'min_samples_split': 3, 'min_samples_leaf': 1, 'max_features': None, 'bootstrap': True, 'criterion': 'squared_error'}. Best is trial 223 with value: 0.4188398890260366.
[I 2024-12-04 14:58:19,510] Trial 518 finished with value: 0.43085373045643743 and parameters: {'n_estimators': 719, 'max_depth': 46, 'min_samples_split': 4, 'min_samples_leaf': 1, 'max_features': None, 'bootstrap': True, 'criterion': 'squared_error'}. Best is trial 223 with value: 0.4188398890260366.
[I 2024-12-04 14:58:23,110] Trial 530 finished with value: 0.4705458775542395 and parameters: {'n_estimators': 546, 'max_depth': 49, 'min_samples_split': 8, 'min_samples_leaf': 2, 'max_features': None, 'bootstrap': True, 'criterion': 'squared_error'}. Best is trial 223 with value: 0.4188398890260366.
[I 2024-12-04 14:58:28,118] Trial 526 finished with value: 0.6971411483709427 and parameters: {'n_estimators': 662, 'max_depth': 45, 'min_samples_split': 30, 'min_samples_leaf': 2, 'max_features': 'sqrt', 'bootstrap': False, 'criterion': 'absolute_error'}. Best is trial 223 with value: 0.4188398890260366.
[I 2024-12-04 14:58:28,379] Trial 523 finished with value: 0.41904315984638313 and parameters: {'n_estimators': 726, 'max_depth': 40, 'min_samples_split': 2, 'min_samples_leaf': 1, 'max_features': None, 'bootstrap': True, 'criterion': 'squared_error'}. Best is trial 223 with value: 0.4188398890260366.
[I 2024-12-04 14:58:31,196] Trial 525 finished with value: 0.4199329199870197 and parameters: {'n_estimators': 636, 'max_depth': 40, 'min_samples_split': 2, 'min_samples_leaf': 1, 'max_features': None, 'bootstrap': True, 'criterion': 'squared_error'}. Best is trial 223 with value: 0.4188398890260366.
[I 2024-12-04 14:58:32,427] Trial 521 finished with value: 0.4317024652526806 and parameters: {'n_estimators': 886, 'max_depth': 41, 'min_samples_split': 4, 'min_samples_leaf': 1, 'max_features': None, 'bootstrap': True, 'criterion': 'squared_error'}. Best is trial 223 with value: 0.4188398890260366.
[I 2024-12-04 14:58:33,810] Trial 478 finished with value: 0.42960222792071273 and parameters: {'n_estimators': 761, 'max_depth': 40, 'min_samples_split': 2, 'min_samples_leaf': 1, 'max_features': None, 'bootstrap': True, 'criterion': 'absolute_error'}. Best is trial 223 with value: 0.4188398890260366.
[I 2024-12-04 14:58:33,816] Trial 522 finished with value: 0.423355175469983 and parameters: {'n_estimators': 997, 'max_depth': 40, 'min_samples_split': 3, 'min_samples_leaf': 1, 'max_features': None, 'bootstrap': True, 'criterion': 'squared_error'}. Best is trial 223 with value: 0.4188398890260366.
[I 2024-12-04 14:58:36,283] Trial 528 finished with value: 0.4647209371480374 and parameters: {'n_estimators': 868, 'max_depth': 39, 'min_samples_split': 2, 'min_samples_leaf': 2, 'max_features': None, 'bootstrap': True, 'criterion': 'squared_error'}. Best is trial 223 with value: 0.4188398890260366.
[I 2024-12-04 14:58:40,383] Trial 527 finished with value: 0.4235065675233981 and parameters: {'n_estimators': 694, 'max_depth': 30, 'min_samples_split': 2, 'min_samples_leaf': 1, 'max_features': None, 'bootstrap': True, 'criterion': 'squared_error'}. Best is trial 223 with value: 0.4188398890260366.
[I 2024-12-04 14:58:46,171] Trial 542 finished with value: 1.0237670588915215 and parameters: {'n_estimators': 928, 'max_depth': 10, 'min_samples_split': 10, 'min_samples_leaf': 3, 'max_features': 'log2', 'bootstrap': True, 'criterion': 'squared_error'}. Best is trial 223 with value: 0.4188398890260366.
[I 2024-12-04 14:58:46,694] Trial 541 finished with value: 0.4656086534408377 and parameters: {'n_estimators': 589, 'max_depth': 43, 'min_samples_split': 4, 'min_samples_leaf': 2, 'max_features': None, 'bootstrap': True, 'criterion': 'squared_error'}. Best is trial 223 with value: 0.4188398890260366.
[I 2024-12-04 14:58:46,824] Trial 531 finished with value: 0.42108113381115697 and parameters: {'n_estimators': 904, 'max_depth': 45, 'min_samples_split': 2, 'min_samples_leaf': 1, 'max_features': None, 'bootstrap': True, 'criterion': 'squared_error'}. Best is trial 223 with value: 0.4188398890260366.
[I 2024-12-04 14:58:47,314] Trial 540 finished with value: 0.4657520020733927 and parameters: {'n_estimators': 790, 'max_depth': 34, 'min_samples_split': 2, 'min_samples_leaf': 2, 'max_features': None, 'bootstrap': True, 'criterion': 'squared_error'}. Best is trial 223 with value: 0.4188398890260366.
[I 2024-12-04 14:58:47,330] Trial 536 finished with value: 0.41930690693073447 and parameters: {'n_estimators': 974, 'max_depth': 40, 'min_samples_split': 2, 'min_samples_leaf': 1, 'max_features': None, 'bootstrap': True, 'criterion': 'squared_error'}. Best is trial 223 with value: 0.4188398890260366.
[I 2024-12-04 14:58:47,421] Trial 534 finished with value: 0.46532288729424015 and parameters: {'n_estimators': 997, 'max_depth': 32, 'min_samples_split': 3, 'min_samples_leaf': 2, 'max_features': None, 'bootstrap': True, 'criterion': 'squared_error'}. Best is trial 223 with value: 0.4188398890260366.
[I 2024-12-04 14:58:48,372] Trial 539 finished with value: 0.4189746779601084 and parameters: {'n_estimators': 715, 'max_depth': 41, 'min_samples_split': 2, 'min_samples_leaf': 1, 'max_features': None, 'bootstrap': True, 'criterion': 'squared_error'}. Best is trial 223 with value: 0.4188398890260366.
[I 2024-12-04 14:58:48,410] Trial 474 finished with value: 0.43885216848345215 and parameters: {'n_estimators': 939, 'max_depth': 38, 'min_samples_split': 6, 'min_samples_leaf': 1, 'max_features': None, 'bootstrap': True, 'criterion': 'absolute_error'}. Best is trial 223 with value: 0.4188398890260366.
[I 2024-12-04 14:58:48,896] Trial 537 finished with value: 0.42150940194634184 and parameters: {'n_estimators': 796, 'max_depth': 34, 'min_samples_split': 2, 'min_samples_leaf': 1, 'max_features': None, 'bootstrap': True, 'criterion': 'squared_error'}. Best is trial 223 with value: 0.4188398890260366.
[I 2024-12-04 14:58:48,924] Trial 535 finished with value: 0.41937432376639416 and parameters: {'n_estimators': 974, 'max_depth': 41, 'min_samples_split': 2, 'min_samples_leaf': 1, 'max_features': None, 'bootstrap': True, 'criterion': 'squared_error'}. Best is trial 223 with value: 0.4188398890260366.
[I 2024-12-04 14:58:50,238] Trial 538 finished with value: 0.4194348689254595 and parameters: {'n_estimators': 653, 'max_depth': 41, 'min_samples_split': 2, 'min_samples_leaf': 1, 'max_features': None, 'bootstrap': True, 'criterion': 'squared_error'}. Best is trial 223 with value: 0.4188398890260366.
[I 2024-12-04 14:58:50,402] Trial 544 finished with value: 0.5399585359175911 and parameters: {'n_estimators': 545, 'max_depth': 38, 'min_samples_split': 5, 'min_samples_leaf': 1, 'max_features': 'sqrt', 'bootstrap': True, 'criterion': 'squared_error'}. Best is trial 223 with value: 0.4188398890260366.
[I 2024-12-04 14:58:51,441] Trial 532 finished with value: 0.42086852507309086 and parameters: {'n_estimators': 822, 'max_depth': 43, 'min_samples_split': 2, 'min_samples_leaf': 1, 'max_features': None, 'bootstrap': True, 'criterion': 'squared_error'}. Best is trial 223 with value: 0.4188398890260366.
[I 2024-12-04 14:58:51,821] Trial 543 finished with value: 0.4643094115104458 and parameters: {'n_estimators': 716, 'max_depth': 45, 'min_samples_split': 3, 'min_samples_leaf': 2, 'max_features': None, 'bootstrap': True, 'criterion': 'squared_error'}. Best is trial 223 with value: 0.4188398890260366.
[I 2024-12-04 14:58:56,280] Trial 553 finished with value: 0.7133740599648384 and parameters: {'n_estimators': 450, 'max_depth': 34, 'min_samples_split': 2, 'min_samples_leaf': 10, 'max_features': None, 'bootstrap': False, 'criterion': 'squared_error'}. Best is trial 223 with value: 0.4188398890260366.
[I 2024-12-04 14:58:57,460] Trial 548 finished with value: 0.4209039640537082 and parameters: {'n_estimators': 649, 'max_depth': 38, 'min_samples_split': 2, 'min_samples_leaf': 1, 'max_features': None, 'bootstrap': True, 'criterion': 'squared_error'}. Best is trial 223 with value: 0.4188398890260366.
[I 2024-12-04 14:59:06,710] Trial 549 finished with value: 0.4316562163019062 and parameters: {'n_estimators': 718, 'max_depth': 36, 'min_samples_split': 4, 'min_samples_leaf': 1, 'max_features': None, 'bootstrap': True, 'criterion': 'squared_error'}. Best is trial 223 with value: 0.4188398890260366.
[I 2024-12-04 14:59:07,427] Trial 545 finished with value: 0.4219353275112605 and parameters: {'n_estimators': 738, 'max_depth': 35, 'min_samples_split': 2, 'min_samples_leaf': 1, 'max_features': None, 'bootstrap': True, 'criterion': 'squared_error'}. Best is trial 223 with value: 0.4188398890260366.
[I 2024-12-04 14:59:09,548] Trial 547 finished with value: 0.43134494879626717 and parameters: {'n_estimators': 752, 'max_depth': 38, 'min_samples_split': 4, 'min_samples_leaf': 1, 'max_features': None, 'bootstrap': True, 'criterion': 'squared_error'}. Best is trial 223 with value: 0.4188398890260366.
[I 2024-12-04 14:59:10,107] Trial 566 finished with value: 1.0587173656106472 and parameters: {'n_estimators': 120, 'max_depth': 26, 'min_samples_split': 3, 'min_samples_leaf': 13, 'max_features': 'log2', 'bootstrap': True, 'criterion': 'absolute_error'}. Best is trial 223 with value: 0.4188398890260366.
[I 2024-12-04 14:59:10,816] Trial 550 finished with value: 0.4215661575883862 and parameters: {'n_estimators': 761, 'max_depth': 44, 'min_samples_split': 2, 'min_samples_leaf': 1, 'max_features': None, 'bootstrap': True, 'criterion': 'squared_error'}. Best is trial 223 with value: 0.4188398890260366.
[I 2024-12-04 14:59:11,481] Trial 551 finished with value: 0.4216666573280195 and parameters: {'n_estimators': 757, 'max_depth': 45, 'min_samples_split': 2, 'min_samples_leaf': 1, 'max_features': None, 'bootstrap': True, 'criterion': 'squared_error'}. Best is trial 223 with value: 0.4188398890260366.
[I 2024-12-04 14:59:11,680] Trial 498 finished with value: 0.5841662703053194 and parameters: {'n_estimators': 994, 'max_depth': 15, 'min_samples_split': 11, 'min_samples_leaf': 2, 'max_features': None, 'bootstrap': False, 'criterion': 'absolute_error'}. Best is trial 223 with value: 0.4188398890260366.
[I 2024-12-04 14:59:11,683] Trial 556 finished with value: 0.5242214117357238 and parameters: {'n_estimators': 621, 'max_depth': 30, 'min_samples_split': 2, 'min_samples_leaf': 1, 'max_features': None, 'bootstrap': False, 'criterion': 'squared_error'}. Best is trial 223 with value: 0.4188398890260366.
[I 2024-12-04 14:59:13,065] Trial 552 finished with value: 0.42313956363908556 and parameters: {'n_estimators': 629, 'max_depth': 35, 'min_samples_split': 2, 'min_samples_leaf': 1, 'max_features': None, 'bootstrap': True, 'criterion': 'squared_error'}. Best is trial 223 with value: 0.4188398890260366.
[I 2024-12-04 14:59:14,707] Trial 561 finished with value: 0.9490042699050395 and parameters: {'n_estimators': 710, 'max_depth': 11, 'min_samples_split': 49, 'min_samples_leaf': 1, 'max_features': 'log2', 'bootstrap': False, 'criterion': 'absolute_error'}. Best is trial 223 with value: 0.4188398890260366.
[I 2024-12-04 14:59:15,129] Trial 559 finished with value: 0.41960945045654796 and parameters: {'n_estimators': 635, 'max_depth': 41, 'min_samples_split': 2, 'min_samples_leaf': 1, 'max_features': None, 'bootstrap': True, 'criterion': 'squared_error'}. Best is trial 223 with value: 0.4188398890260366.
[I 2024-12-04 14:59:15,130] Trial 571 finished with value: 0.9101022104691582 and parameters: {'n_estimators': 266, 'max_depth': 38, 'min_samples_split': 5, 'min_samples_leaf': 2, 'max_features': 'log2', 'bootstrap': False, 'criterion': 'absolute_error'}. Best is trial 223 with value: 0.4188398890260366.
[I 2024-12-04 14:59:16,607] Trial 560 finished with value: 0.42134218089410047 and parameters: {'n_estimators': 609, 'max_depth': 43, 'min_samples_split': 2, 'min_samples_leaf': 1, 'max_features': None, 'bootstrap': True, 'criterion': 'squared_error'}. Best is trial 223 with value: 0.4188398890260366.
[I 2024-12-04 14:59:16,662] Trial 555 finished with value: 0.4194263396506861 and parameters: {'n_estimators': 626, 'max_depth': 40, 'min_samples_split': 2, 'min_samples_leaf': 1, 'max_features': None, 'bootstrap': True, 'criterion': 'squared_error'}. Best is trial 223 with value: 0.4188398890260366.
[I 2024-12-04 14:59:18,460] Trial 567 finished with value: 1.0445518090798278 and parameters: {'n_estimators': 399, 'max_depth': 49, 'min_samples_split': 26, 'min_samples_leaf': 5, 'max_features': 'log2', 'bootstrap': True, 'criterion': 'absolute_error'}. Best is trial 223 with value: 0.4188398890260366.
[I 2024-12-04 14:59:19,113] Trial 568 finished with value: 1.0289577433447 and parameters: {'n_estimators': 379, 'max_depth': 26, 'min_samples_split': 22, 'min_samples_leaf': 5, 'max_features': 'log2', 'bootstrap': False, 'criterion': 'absolute_error'}. Best is trial 223 with value: 0.4188398890260366.
[I 2024-12-04 14:59:19,903] Trial 569 finished with value: 0.6577469073756015 and parameters: {'n_estimators': 693, 'max_depth': 36, 'min_samples_split': 2, 'min_samples_leaf': 1, 'max_features': 'log2', 'bootstrap': True, 'criterion': 'squared_error'}. Best is trial 223 with value: 0.4188398890260366.
[I 2024-12-04 14:59:20,487] Trial 563 finished with value: 0.6019056508168419 and parameters: {'n_estimators': 784, 'max_depth': 7, 'min_samples_split': 7, 'min_samples_leaf': 1, 'max_features': None, 'bootstrap': True, 'criterion': 'squared_error'}. Best is trial 223 with value: 0.4188398890260366.
[I 2024-12-04 14:59:26,324] Trial 557 finished with value: 0.4200652159589153 and parameters: {'n_estimators': 955, 'max_depth': 38, 'min_samples_split': 2, 'min_samples_leaf': 1, 'max_features': None, 'bootstrap': True, 'criterion': 'squared_error'}. Best is trial 223 with value: 0.4188398890260366.
[I 2024-12-04 14:59:26,662] Trial 558 finished with value: 0.4317194499270799 and parameters: {'n_estimators': 884, 'max_depth': 48, 'min_samples_split': 4, 'min_samples_leaf': 1, 'max_features': None, 'bootstrap': True, 'criterion': 'squared_error'}. Best is trial 223 with value: 0.4188398890260366.
[I 2024-12-04 14:59:27,666] Trial 562 finished with value: 0.5013186401564873 and parameters: {'n_estimators': 877, 'max_depth': 42, 'min_samples_split': 2, 'min_samples_leaf': 1, 'max_features': 'sqrt', 'bootstrap': True, 'criterion': 'squared_error'}. Best is trial 223 with value: 0.4188398890260366.
[I 2024-12-04 14:59:29,154] Trial 572 finished with value: 0.46455043166777615 and parameters: {'n_estimators': 653, 'max_depth': 37, 'min_samples_split': 2, 'min_samples_leaf': 2, 'max_features': None, 'bootstrap': True, 'criterion': 'squared_error'}. Best is trial 223 with value: 0.4188398890260366.
[I 2024-12-04 14:59:29,262] Trial 570 finished with value: 0.41980440190167106 and parameters: {'n_estimators': 670, 'max_depth': 40, 'min_samples_split': 2, 'min_samples_leaf': 1, 'max_features': None, 'bootstrap': True, 'criterion': 'squared_error'}. Best is trial 223 with value: 0.4188398890260366.
[I 2024-12-04 14:59:30,875] Trial 565 finished with value: 0.4654190701798056 and parameters: {'n_estimators': 989, 'max_depth': 38, 'min_samples_split': 2, 'min_samples_leaf': 2, 'max_features': None, 'bootstrap': True, 'criterion': 'squared_error'}. Best is trial 223 with value: 0.4188398890260366.
[I 2024-12-04 14:59:31,154] Trial 576 finished with value: 0.4366874700615948 and parameters: {'n_estimators': 508, 'max_depth': 42, 'min_samples_split': 5, 'min_samples_leaf': 1, 'max_features': None, 'bootstrap': True, 'criterion': 'squared_error'}. Best is trial 223 with value: 0.4188398890260366.
[I 2024-12-04 14:59:33,195] Trial 573 finished with value: 0.43373155521870926 and parameters: {'n_estimators': 538, 'max_depth': 39, 'min_samples_split': 4, 'min_samples_leaf': 1, 'max_features': None, 'bootstrap': True, 'criterion': 'squared_error'}. Best is trial 223 with value: 0.4188398890260366.
[I 2024-12-04 14:59:33,504] Trial 564 finished with value: 0.6565200854767866 and parameters: {'n_estimators': 590, 'max_depth': 38, 'min_samples_split': 2, 'min_samples_leaf': 1, 'max_features': 'log2', 'bootstrap': False, 'criterion': 'absolute_error'}. Best is trial 223 with value: 0.4188398890260366.
[I 2024-12-04 14:59:36,003] Trial 584 finished with value: 0.9358894477364083 and parameters: {'n_estimators': 645, 'max_depth': 50, 'min_samples_split': 23, 'min_samples_leaf': 8, 'max_features': 'sqrt', 'bootstrap': False, 'criterion': 'squared_error'}. Best is trial 223 with value: 0.4188398890260366.
[I 2024-12-04 14:59:38,257] Trial 546 finished with value: 0.4612446790225803 and parameters: {'n_estimators': 702, 'max_depth': 37, 'min_samples_split': 2, 'min_samples_leaf': 2, 'max_features': None, 'bootstrap': True, 'criterion': 'absolute_error'}. Best is trial 223 with value: 0.4188398890260366.
[I 2024-12-04 14:59:39,048] Trial 588 finished with value: 1.0395187233277838 and parameters: {'n_estimators': 837, 'max_depth': 27, 'min_samples_split': 8, 'min_samples_leaf': 5, 'max_features': 'log2', 'bootstrap': False, 'criterion': 'squared_error'}. Best is trial 223 with value: 0.4188398890260366.
