[I 2024-12-04 12:55:26,726] Trial 2080 finished with value: 0.39185855659799773 and parameters: {'n_estimators': 818, 'learning_rate': 0.08935092661320608, 'max_depth': 6, 'min_samples_split': 4, 'min_samples_leaf': 3, 'subsample': 0.8213108749634062, 'max_features': None}. Best is trial 1454 with value: 0.30763307678022894.
[I 2024-12-04 12:55:27,757] Trial 2081 finished with value: 0.33164341794509256 and parameters: {'n_estimators': 834, 'learning_rate': 0.053130882700938145, 'max_depth': 8, 'min_samples_split': 4, 'min_samples_leaf': 2, 'subsample': 0.8019111416437812, 'max_features': None}. Best is trial 1454 with value: 0.30763307678022894.
[I 2024-12-04 12:55:28,324] Trial 2101 finished with value: 0.7473232691418975 and parameters: {'n_estimators': 177, 'learning_rate': 0.019583243322554185, 'max_depth': 10, 'min_samples_split': 20, 'min_samples_leaf': 1, 'subsample': 0.9300712392622482, 'max_features': 'log2'}. Best is trial 1454 with value: 0.30763307678022894.
[I 2024-12-04 12:55:30,616] Trial 2068 finished with value: 0.33462523755076967 and parameters: {'n_estimators': 1102, 'learning_rate': 0.06382552921913215, 'max_depth': 7, 'min_samples_split': 5, 'min_samples_leaf': 2, 'subsample': 0.7682219107379608, 'max_features': None}. Best is trial 1454 with value: 0.30763307678022894.
[I 2024-12-04 12:55:32,032] Trial 2079 finished with value: 0.37881059035823755 and parameters: {'n_estimators': 1087, 'learning_rate': 0.06374602526651159, 'max_depth': 7, 'min_samples_split': 8, 'min_samples_leaf': 1, 'subsample': 0.613416759773239, 'max_features': None}. Best is trial 1454 with value: 0.30763307678022894.
[I 2024-12-04 12:55:33,021] Trial 2073 finished with value: 0.3696627225214172 and parameters: {'n_estimators': 1258, 'learning_rate': 0.08196285770802195, 'max_depth': 7, 'min_samples_split': 5, 'min_samples_leaf': 1, 'subsample': 0.6189345842453794, 'max_features': None}. Best is trial 1454 with value: 0.30763307678022894.
[I 2024-12-04 12:55:36,439] Trial 2076 finished with value: 0.4078052196312645 and parameters: {'n_estimators': 1447, 'learning_rate': 0.08753367690533335, 'max_depth': 3, 'min_samples_split': 5, 'min_samples_leaf': 3, 'subsample': 0.6010998259962532, 'max_features': None}. Best is trial 1454 with value: 0.30763307678022894.
[I 2024-12-04 12:55:39,302] Trial 2087 finished with value: 0.45758924743349444 and parameters: {'n_estimators': 1236, 'learning_rate': 0.07197989024936094, 'max_depth': 7, 'min_samples_split': 2, 'min_samples_leaf': 3, 'subsample': 0.6098473175754237, 'max_features': 'log2'}. Best is trial 1454 with value: 0.30763307678022894.
[I 2024-12-04 12:55:40,174] Trial 2082 finished with value: 0.3708564284189796 and parameters: {'n_estimators': 1062, 'learning_rate': 0.042396910211344695, 'max_depth': 10, 'min_samples_split': 9, 'min_samples_leaf': 3, 'subsample': 0.6732291073635932, 'max_features': None}. Best is trial 1454 with value: 0.30763307678022894.
[I 2024-12-04 12:55:40,782] Trial 2091 finished with value: 0.38952085038506346 and parameters: {'n_estimators': 956, 'learning_rate': 0.06374811172058914, 'max_depth': 8, 'min_samples_split': 5, 'min_samples_leaf': 1, 'subsample': 0.6955716916150987, 'max_features': None}. Best is trial 1454 with value: 0.30763307678022894.
[I 2024-12-04 12:55:40,967] Trial 2089 finished with value: 0.32602936658893444 and parameters: {'n_estimators': 1012, 'learning_rate': 0.07598917625244779, 'max_depth': 6, 'min_samples_split': 2, 'min_samples_leaf': 2, 'subsample': 0.8323282999655368, 'max_features': None}. Best is trial 1454 with value: 0.30763307678022894.
[I 2024-12-04 12:55:42,179] Trial 2083 finished with value: 0.33551607759914465 and parameters: {'n_estimators': 1134, 'learning_rate': 0.09308680138829241, 'max_depth': 8, 'min_samples_split': 3, 'min_samples_leaf': 2, 'subsample': 0.8045627517655717, 'max_features': None}. Best is trial 1454 with value: 0.30763307678022894.
[I 2024-12-04 12:55:42,725] Trial 2085 finished with value: 0.3776366020869241 and parameters: {'n_estimators': 1113, 'learning_rate': 0.07682875845548066, 'max_depth': 8, 'min_samples_split': 5, 'min_samples_leaf': 3, 'subsample': 0.6033837149182505, 'max_features': None}. Best is trial 1454 with value: 0.30763307678022894.
[I 2024-12-04 12:55:42,726] Trial 2078 finished with value: 0.3884267464047375 and parameters: {'n_estimators': 1342, 'learning_rate': 0.0399588519810453, 'max_depth': 7, 'min_samples_split': 2, 'min_samples_leaf': 3, 'subsample': 0.6133189105224844, 'max_features': None}. Best is trial 1454 with value: 0.30763307678022894.
[I 2024-12-04 12:55:44,705] Trial 2095 finished with value: 0.3912705652213985 and parameters: {'n_estimators': 1088, 'learning_rate': 0.05276163755025288, 'max_depth': 9, 'min_samples_split': 6, 'min_samples_leaf': 1, 'subsample': 0.6530860666635402, 'max_features': 'log2'}. Best is trial 1454 with value: 0.30763307678022894.
[I 2024-12-04 12:55:47,609] Trial 2090 finished with value: 0.36374475894202263 and parameters: {'n_estimators': 1151, 'learning_rate': 0.04497735997564227, 'max_depth': 9, 'min_samples_split': 2, 'min_samples_leaf': 1, 'subsample': 0.6070080200701973, 'max_features': None}. Best is trial 1454 with value: 0.30763307678022894.
[I 2024-12-04 12:55:47,992] Trial 2117 finished with value: 0.7467415213954608 and parameters: {'n_estimators': 110, 'learning_rate': 0.049182758325080726, 'max_depth': 10, 'min_samples_split': 10, 'min_samples_leaf': 8, 'subsample': 0.8009627158509559, 'max_features': 'sqrt'}. Best is trial 1454 with value: 0.30763307678022894.
[I 2024-12-04 12:55:50,268] Trial 2093 finished with value: 0.3931997768730379 and parameters: {'n_estimators': 1227, 'learning_rate': 0.09305023707491768, 'max_depth': 5, 'min_samples_split': 10, 'min_samples_leaf': 3, 'subsample': 0.6040135842141675, 'max_features': None}. Best is trial 1454 with value: 0.30763307678022894.
[I 2024-12-04 12:55:50,337] Trial 2086 finished with value: 0.32632886915720805 and parameters: {'n_estimators': 1330, 'learning_rate': 0.05396795770206874, 'max_depth': 6, 'min_samples_split': 2, 'min_samples_leaf': 2, 'subsample': 0.7411747095858416, 'max_features': None}. Best is trial 1454 with value: 0.30763307678022894.
[I 2024-12-04 12:55:51,481] Trial 2094 finished with value: 0.37180179039155964 and parameters: {'n_estimators': 1181, 'learning_rate': 0.03553685859283936, 'max_depth': 7, 'min_samples_split': 2, 'min_samples_leaf': 4, 'subsample': 0.6650194170870909, 'max_features': None}. Best is trial 1454 with value: 0.30763307678022894.
[I 2024-12-04 12:55:51,995] Trial 2074 finished with value: 0.3727681760339208 and parameters: {'n_estimators': 1485, 'learning_rate': 0.04869233199011192, 'max_depth': 12, 'min_samples_split': 19, 'min_samples_leaf': 3, 'subsample': 0.7461619481470361, 'max_features': None}. Best is trial 1454 with value: 0.30763307678022894.
[I 2024-12-04 12:55:53,286] Trial 2084 finished with value: 0.35998362596903655 and parameters: {'n_estimators': 1446, 'learning_rate': 0.0809177659109029, 'max_depth': 9, 'min_samples_split': 7, 'min_samples_leaf': 1, 'subsample': 0.6252148893638237, 'max_features': None}. Best is trial 1454 with value: 0.30763307678022894.
[I 2024-12-04 12:55:55,978] Trial 2118 finished with value: 0.8112970161316404 and parameters: {'n_estimators': 337, 'learning_rate': 0.020436372438217908, 'max_depth': 11, 'min_samples_split': 5, 'min_samples_leaf': 3, 'subsample': 0.6172459658972518, 'max_features': 'log2'}. Best is trial 1454 with value: 0.30763307678022894.
[I 2024-12-04 12:55:57,137] Trial 2092 finished with value: 0.3628733145547824 and parameters: {'n_estimators': 1380, 'learning_rate': 0.06414991969008156, 'max_depth': 7, 'min_samples_split': 2, 'min_samples_leaf': 4, 'subsample': 0.6667375405856988, 'max_features': None}. Best is trial 1454 with value: 0.30763307678022894.
[I 2024-12-04 12:55:58,416] Trial 2106 finished with value: 0.37869298317760947 and parameters: {'n_estimators': 869, 'learning_rate': 0.07752633308366257, 'max_depth': 5, 'min_samples_split': 7, 'min_samples_leaf': 1, 'subsample': 0.6660575690348135, 'max_features': None}. Best is trial 1454 with value: 0.30763307678022894.
[I 2024-12-04 12:55:58,976] Trial 2099 finished with value: 0.42869066148831186 and parameters: {'n_estimators': 1255, 'learning_rate': 0.021797439240101364, 'max_depth': 4, 'min_samples_split': 13, 'min_samples_leaf': 7, 'subsample': 0.9461703250304012, 'max_features': None}. Best is trial 1454 with value: 0.30763307678022894.
[I 2024-12-04 12:55:59,998] Trial 2102 finished with value: 0.3177780857518645 and parameters: {'n_estimators': 986, 'learning_rate': 0.05362320851416596, 'max_depth': 7, 'min_samples_split': 4, 'min_samples_leaf': 2, 'subsample': 0.7158180092091803, 'max_features': None}. Best is trial 1454 with value: 0.30763307678022894.
[I 2024-12-04 12:56:02,441] Trial 2109 finished with value: 0.33574087909433525 and parameters: {'n_estimators': 818, 'learning_rate': 0.08892814905657676, 'max_depth': 10, 'min_samples_split': 6, 'min_samples_leaf': 2, 'subsample': 0.7660872196932581, 'max_features': None}. Best is trial 1454 with value: 0.30763307678022894.
[I 2024-12-04 12:56:02,816] Trial 2110 finished with value: 0.4508266273978423 and parameters: {'n_estimators': 1046, 'learning_rate': 0.08785153490986441, 'max_depth': 5, 'min_samples_split': 9, 'min_samples_leaf': 3, 'subsample': 0.7679278922024328, 'max_features': 'log2'}. Best is trial 1454 with value: 0.30763307678022894.
[I 2024-12-04 12:56:03,538] Trial 2100 finished with value: 0.37428967028296073 and parameters: {'n_estimators': 1176, 'learning_rate': 0.06418232683435514, 'max_depth': 6, 'min_samples_split': 2, 'min_samples_leaf': 4, 'subsample': 0.7338431240114128, 'max_features': None}. Best is trial 1454 with value: 0.30763307678022894.
[I 2024-12-04 12:56:03,540] Trial 2098 finished with value: 0.34177807306771835 and parameters: {'n_estimators': 1309, 'learning_rate': 0.09590361091075532, 'max_depth': 7, 'min_samples_split': 2, 'min_samples_leaf': 2, 'subsample': 0.9535648515119486, 'max_features': None}. Best is trial 1454 with value: 0.30763307678022894.
[I 2024-12-04 12:56:04,010] Trial 2107 finished with value: 0.33372951147623087 and parameters: {'n_estimators': 947, 'learning_rate': 0.09601465948714193, 'max_depth': 7, 'min_samples_split': 4, 'min_samples_leaf': 2, 'subsample': 0.7802974865015111, 'max_features': None}. Best is trial 1454 with value: 0.30763307678022894.
[I 2024-12-04 12:56:04,657] Trial 2104 finished with value: 0.3828197088300902 and parameters: {'n_estimators': 1064, 'learning_rate': 0.09590877512486223, 'max_depth': 7, 'min_samples_split': 6, 'min_samples_leaf': 4, 'subsample': 0.7055969596502402, 'max_features': None}. Best is trial 1454 with value: 0.30763307678022894.
[I 2024-12-04 12:56:06,977] Trial 2111 finished with value: 0.38805566057086205 and parameters: {'n_estimators': 913, 'learning_rate': 0.0883319428516524, 'max_depth': 8, 'min_samples_split': 5, 'min_samples_leaf': 4, 'subsample': 0.7485300251260575, 'max_features': None}. Best is trial 1454 with value: 0.30763307678022894.
[I 2024-12-04 12:56:09,112] Trial 2114 finished with value: 0.3237338270429698 and parameters: {'n_estimators': 860, 'learning_rate': 0.09405522418144648, 'max_depth': 7, 'min_samples_split': 2, 'min_samples_leaf': 2, 'subsample': 0.787598477753756, 'max_features': None}. Best is trial 1454 with value: 0.30763307678022894.
[I 2024-12-04 12:56:10,629] Trial 2103 finished with value: 0.3884985007596831 and parameters: {'n_estimators': 1262, 'learning_rate': 0.062280302827355596, 'max_depth': 7, 'min_samples_split': 5, 'min_samples_leaf': 3, 'subsample': 0.6253631633441025, 'max_features': None}. Best is trial 1454 with value: 0.30763307678022894.
[I 2024-12-04 12:56:12,474] Trial 2115 finished with value: 0.32031432779198626 and parameters: {'n_estimators': 872, 'learning_rate': 0.08924596069688928, 'max_depth': 8, 'min_samples_split': 6, 'min_samples_leaf': 2, 'subsample': 0.8066842912733179, 'max_features': None}. Best is trial 1454 with value: 0.30763307678022894.
[I 2024-12-04 12:56:16,057] Trial 2124 finished with value: 0.39427778612566716 and parameters: {'n_estimators': 778, 'learning_rate': 0.09289578744623035, 'max_depth': 5, 'min_samples_split': 6, 'min_samples_leaf': 1, 'subsample': 0.7022331800746398, 'max_features': 'sqrt'}. Best is trial 1454 with value: 0.30763307678022894.
[I 2024-12-04 12:56:16,501] Trial 2139 finished with value: 0.8869119336186598 and parameters: {'n_estimators': 242, 'learning_rate': 0.020394717531728397, 'max_depth': 10, 'min_samples_split': 5, 'min_samples_leaf': 5, 'subsample': 0.9550841610989389, 'max_features': 'log2'}. Best is trial 1454 with value: 0.30763307678022894.
[I 2024-12-04 12:56:16,509] Trial 2105 finished with value: 0.3701665068290457 and parameters: {'n_estimators': 1379, 'learning_rate': 0.06351051957102664, 'max_depth': 7, 'min_samples_split': 5, 'min_samples_leaf': 4, 'subsample': 0.6820042269142187, 'max_features': None}. Best is trial 1454 with value: 0.30763307678022894.
[I 2024-12-04 12:56:16,986] Trial 2121 finished with value: 0.40541956540949864 and parameters: {'n_estimators': 782, 'learning_rate': 0.06984604884380517, 'max_depth': 5, 'min_samples_split': 2, 'min_samples_leaf': 7, 'subsample': 0.7633551349997063, 'max_features': None}. Best is trial 1454 with value: 0.30763307678022894.
[I 2024-12-04 12:56:17,229] Trial 2132 finished with value: 0.9548371393339916 and parameters: {'n_estimators': 557, 'learning_rate': 0.012926832059430217, 'max_depth': 3, 'min_samples_split': 11, 'min_samples_leaf': 10, 'subsample': 0.8179568083228762, 'max_features': 'log2'}. Best is trial 1454 with value: 0.30763307678022894.
[I 2024-12-04 12:56:17,875] Trial 2113 finished with value: 0.32432711712898443 and parameters: {'n_estimators': 1134, 'learning_rate': 0.0786809476614482, 'max_depth': 7, 'min_samples_split': 2, 'min_samples_leaf': 2, 'subsample': 0.7672828172107189, 'max_features': None}. Best is trial 1454 with value: 0.30763307678022894.
[I 2024-12-04 12:56:20,214] Trial 2130 finished with value: 0.46915132610733723 and parameters: {'n_estimators': 651, 'learning_rate': 0.016930783339789125, 'max_depth': 3, 'min_samples_split': 15, 'min_samples_leaf': 4, 'subsample': 0.7419304315532939, 'max_features': None}. Best is trial 1454 with value: 0.30763307678022894.
[I 2024-12-04 12:56:22,984] Trial 2108 finished with value: 0.3900681061915787 and parameters: {'n_estimators': 1401, 'learning_rate': 0.09006700903327214, 'max_depth': 7, 'min_samples_split': 2, 'min_samples_leaf': 3, 'subsample': 0.8600638364991526, 'max_features': None}. Best is trial 1454 with value: 0.30763307678022894.
[I 2024-12-04 12:56:24,035] Trial 2123 finished with value: 0.38996220088219413 and parameters: {'n_estimators': 902, 'learning_rate': 0.08162075436331756, 'max_depth': 7, 'min_samples_split': 6, 'min_samples_leaf': 3, 'subsample': 0.7245741562508946, 'max_features': None}. Best is trial 1454 with value: 0.30763307678022894.
[I 2024-12-04 12:56:24,780] Trial 2125 finished with value: 0.38590563690433477 and parameters: {'n_estimators': 948, 'learning_rate': 0.07706101602115924, 'max_depth': 3, 'min_samples_split': 2, 'min_samples_leaf': 1, 'subsample': 0.7723256555702863, 'max_features': None}. Best is trial 1454 with value: 0.30763307678022894.
[I 2024-12-04 12:56:26,161] Trial 2122 finished with value: 0.40917718084929283 and parameters: {'n_estimators': 962, 'learning_rate': 0.09464366335961585, 'max_depth': 7, 'min_samples_split': 2, 'min_samples_leaf': 1, 'subsample': 0.816490775812089, 'max_features': None}. Best is trial 1454 with value: 0.30763307678022894.
[I 2024-12-04 12:56:29,376] Trial 2112 finished with value: 0.3409158162345316 and parameters: {'n_estimators': 1474, 'learning_rate': 0.028874807532436337, 'max_depth': 10, 'min_samples_split': 2, 'min_samples_leaf': 2, 'subsample': 0.6060498171416961, 'max_features': None}. Best is trial 1454 with value: 0.30763307678022894.
[I 2024-12-04 12:56:30,958] Trial 2119 finished with value: 0.37515703749409574 and parameters: {'n_estimators': 1222, 'learning_rate': 0.06219046440355042, 'max_depth': 6, 'min_samples_split': 2, 'min_samples_leaf': 1, 'subsample': 0.6936179127154566, 'max_features': None}. Best is trial 1454 with value: 0.30763307678022894.
[I 2024-12-04 12:56:34,134] Trial 2126 finished with value: 0.3893473745898908 and parameters: {'n_estimators': 1172, 'learning_rate': 0.0998466673678773, 'max_depth': 4, 'min_samples_split': 3, 'min_samples_leaf': 6, 'subsample': 0.788554214665016, 'max_features': None}. Best is trial 1454 with value: 0.30763307678022894.
[I 2024-12-04 12:56:34,188] Trial 2129 finished with value: 0.3516945033881681 and parameters: {'n_estimators': 1129, 'learning_rate': 0.05988075660881916, 'max_depth': 4, 'min_samples_split': 2, 'min_samples_leaf': 2, 'subsample': 0.6069937321214864, 'max_features': None}. Best is trial 1454 with value: 0.30763307678022894.
[I 2024-12-04 12:56:35,686] Trial 2116 finished with value: 0.32630329440280065 and parameters: {'n_estimators': 1493, 'learning_rate': 0.0971990461281283, 'max_depth': 7, 'min_samples_split': 7, 'min_samples_leaf': 2, 'subsample': 0.6099723952666851, 'max_features': None}. Best is trial 1454 with value: 0.30763307678022894.
[I 2024-12-04 12:56:35,688] Trial 2140 finished with value: 0.33119487799109765 and parameters: {'n_estimators': 722, 'learning_rate': 0.047545574539602196, 'max_depth': 8, 'min_samples_split': 6, 'min_samples_leaf': 2, 'subsample': 0.6819926126278273, 'max_features': None}. Best is trial 1454 with value: 0.30763307678022894.
[I 2024-12-04 12:56:37,294] Trial 2131 finished with value: 0.4039288880198937 and parameters: {'n_estimators': 1149, 'learning_rate': 0.053272962016850174, 'max_depth': 3, 'min_samples_split': 3, 'min_samples_leaf': 4, 'subsample': 0.8499064448961698, 'max_features': None}. Best is trial 1454 with value: 0.30763307678022894.
[I 2024-12-04 12:56:38,585] Trial 2120 finished with value: 0.3492221049171593 and parameters: {'n_estimators': 1496, 'learning_rate': 0.0493037357961419, 'max_depth': 4, 'min_samples_split': 5, 'min_samples_leaf': 2, 'subsample': 0.6972743106804097, 'max_features': None}. Best is trial 1454 with value: 0.30763307678022894.
[I 2024-12-04 12:56:41,695] Trial 2134 finished with value: 0.36779546202208774 and parameters: {'n_estimators': 1066, 'learning_rate': 0.03456655810798608, 'max_depth': 8, 'min_samples_split': 8, 'min_samples_leaf': 3, 'subsample': 0.7342351068995803, 'max_features': None}. Best is trial 1454 with value: 0.30763307678022894.
[I 2024-12-04 12:56:41,757] Trial 2151 finished with value: 0.7996551152249227 and parameters: {'n_estimators': 624, 'learning_rate': 0.01570357137744347, 'max_depth': 3, 'min_samples_split': 3, 'min_samples_leaf': 2, 'subsample': 0.6588002703954787, 'max_features': 'log2'}. Best is trial 1454 with value: 0.30763307678022894.
[I 2024-12-04 12:56:43,105] Trial 2135 finished with value: 0.348718119298915 and parameters: {'n_estimators': 1085, 'learning_rate': 0.042235219733567135, 'max_depth': 6, 'min_samples_split': 7, 'min_samples_leaf': 2, 'subsample': 0.7728134369991879, 'max_features': None}. Best is trial 1454 with value: 0.30763307678022894.
[I 2024-12-04 12:56:43,116] Trial 2136 finished with value: 0.41274173746774306 and parameters: {'n_estimators': 1022, 'learning_rate': 0.039564952579796614, 'max_depth': 6, 'min_samples_split': 4, 'min_samples_leaf': 1, 'subsample': 0.770825369512476, 'max_features': None}. Best is trial 1454 with value: 0.30763307678022894.
[I 2024-12-04 12:56:43,337] Trial 2133 finished with value: 0.3954641264646296 and parameters: {'n_estimators': 1151, 'learning_rate': 0.0579415194959347, 'max_depth': 6, 'min_samples_split': 3, 'min_samples_leaf': 1, 'subsample': 0.759037512840306, 'max_features': None}. Best is trial 1454 with value: 0.30763307678022894.
[I 2024-12-04 12:56:43,935] Trial 2137 finished with value: 0.370473361910441 and parameters: {'n_estimators': 1008, 'learning_rate': 0.049357768301880676, 'max_depth': 8, 'min_samples_split': 5, 'min_samples_leaf': 4, 'subsample': 0.7571163782675225, 'max_features': None}. Best is trial 1454 with value: 0.30763307678022894.
[I 2024-12-04 12:56:45,110] Trial 2143 finished with value: 0.32190849564295476 and parameters: {'n_estimators': 878, 'learning_rate': 0.06144965683209336, 'max_depth': 7, 'min_samples_split': 5, 'min_samples_leaf': 2, 'subsample': 0.7406723631687404, 'max_features': None}. Best is trial 1454 with value: 0.30763307678022894.
[I 2024-12-04 12:56:46,906] Trial 2138 finished with value: 0.3740454798214941 and parameters: {'n_estimators': 1048, 'learning_rate': 0.050279095732694755, 'max_depth': 6, 'min_samples_split': 4, 'min_samples_leaf': 1, 'subsample': 0.6923201601247515, 'max_features': None}. Best is trial 1454 with value: 0.30763307678022894.
[I 2024-12-04 12:56:47,073] Trial 2141 finished with value: 0.3685803562514046 and parameters: {'n_estimators': 989, 'learning_rate': 0.04556370633227483, 'max_depth': 7, 'min_samples_split': 8, 'min_samples_leaf': 3, 'subsample': 0.7206385394767589, 'max_features': None}. Best is trial 1454 with value: 0.30763307678022894.
[I 2024-12-04 12:56:48,109] Trial 2142 finished with value: 0.3846658358499507 and parameters: {'n_estimators': 994, 'learning_rate': 0.05332183664128631, 'max_depth': 7, 'min_samples_split': 5, 'min_samples_leaf': 1, 'subsample': 0.6954873480179693, 'max_features': None}. Best is trial 1454 with value: 0.30763307678022894.
[I 2024-12-04 12:56:48,979] Trial 2127 finished with value: 0.553003491502234 and parameters: {'n_estimators': 1470, 'learning_rate': 0.07741029913608098, 'max_depth': 8, 'min_samples_split': 20, 'min_samples_leaf': 10, 'subsample': 0.8794170599770434, 'max_features': None}. Best is trial 1454 with value: 0.30763307678022894.
