[I 2024-12-03 18:32:32,100] Trial 38 finished with value: 0.3534234456587547 and parameters: {'kernel': 'linear', 'C': 58.74523474096266, 'gamma': 0.025834126949214865, 'epsilon': 0.007327350958872215}. Best is trial 46 with value: 0.14565651779054078.
[I 2024-12-03 18:33:01,081] Trial 15 finished with value: 0.5870828719666435 and parameters: {'kernel': 'poly', 'C': 15.600972566270416, 'gamma': 0.040174020670610266, 'epsilon': 0.06429134777535998}. Best is trial 46 with value: 0.14565651779054078.
[I 2024-12-03 18:46:40,921] Trial 7 finished with value: 0.8004790884834069 and parameters: {'kernel': 'poly', 'C': 19.787185479767224, 'gamma': 0.09555613117216784, 'epsilon': 0.021604283173431008}. Best is trial 46 with value: 0.14565651779054078.
[I 2024-12-03 19:00:23,571] Trial 24 finished with value: 0.869774643597387 and parameters: {'kernel': 'poly', 'C': 90.9589111897638, 'gamma': 0.08739591165301397, 'epsilon': 0.023592716691538337}. Best is trial 46 with value: 0.14565651779054078.
[I 2024-12-03 19:56:53,456] Trial 22 finished with value: 0.8961187419029917 and parameters: {'kernel': 'poly', 'C': 0.590537325180788, 'gamma': 0.4875578894787635, 'epsilon': 0.00363989356768925}. Best is trial 46 with value: 0.14565651779054078.
[I 2024-12-03 21:08:32,903] Trial 3 finished with value: 5.6283169683300445 and parameters: {'kernel': 'poly', 'C': 2.9031902768190907, 'gamma': 0.45689671263192366, 'epsilon': 0.004498943740905158}. Best is trial 46 with value: 0.14565651779054078.
Traceback (most recent call last):
  File "/zhome/b1/0/88900/miniconda3/envs/critprops/lib/python3.9/site-packages/sqlalchemy/engine/base.py", line 1967, in _exec_single_context
    self.dialect.do_execute(
  File "/zhome/b1/0/88900/miniconda3/envs/critprops/lib/python3.9/site-packages/sqlalchemy/engine/default.py", line 941, in do_execute
    cursor.execute(statement, parameters)
sqlite3.OperationalError: database is locked

The above exception was the direct cause of the following exception:

Traceback (most recent call last):
  File "/zhome/b1/0/88900/miniconda3/envs/critprops/lib/python3.9/site-packages/optuna/storages/_rdb/storage.py", line 80, in _create_scoped_session
    yield session
  File "/zhome/b1/0/88900/miniconda3/envs/critprops/lib/python3.9/site-packages/optuna/storages/_rdb/storage.py", line 734, in set_trial_system_attr
    self._set_trial_attr_without_commit(
  File "/zhome/b1/0/88900/miniconda3/envs/critprops/lib/python3.9/site-packages/optuna/storages/_rdb/storage.py", line 769, in _set_trial_attr_without_commit
    session.execute(sqlite_upsert_stmt)
  File "/zhome/b1/0/88900/miniconda3/envs/critprops/lib/python3.9/site-packages/sqlalchemy/orm/session.py", line 2362, in execute
    return self._execute_internal(
  File "/zhome/b1/0/88900/miniconda3/envs/critprops/lib/python3.9/site-packages/sqlalchemy/orm/session.py", line 2247, in _execute_internal
    result: Result[Any] = compile_state_cls.orm_execute_statement(
  File "/zhome/b1/0/88900/miniconda3/envs/critprops/lib/python3.9/site-packages/sqlalchemy/orm/bulk_persistence.py", line 1294, in orm_execute_statement
    result = conn.execute(
  File "/zhome/b1/0/88900/miniconda3/envs/critprops/lib/python3.9/site-packages/sqlalchemy/engine/base.py", line 1418, in execute
    return meth(
  File "/zhome/b1/0/88900/miniconda3/envs/critprops/lib/python3.9/site-packages/sqlalchemy/sql/elements.py", line 515, in _execute_on_connection
    return connection._execute_clauseelement(
  File "/zhome/b1/0/88900/miniconda3/envs/critprops/lib/python3.9/site-packages/sqlalchemy/engine/base.py", line 1640, in _execute_clauseelement
    ret = self._execute_context(
  File "/zhome/b1/0/88900/miniconda3/envs/critprops/lib/python3.9/site-packages/sqlalchemy/engine/base.py", line 1846, in _execute_context
    return self._exec_single_context(
  File "/zhome/b1/0/88900/miniconda3/envs/critprops/lib/python3.9/site-packages/sqlalchemy/engine/base.py", line 1986, in _exec_single_context
    self._handle_dbapi_exception(
  File "/zhome/b1/0/88900/miniconda3/envs/critprops/lib/python3.9/site-packages/sqlalchemy/engine/base.py", line 2355, in _handle_dbapi_exception
    raise sqlalchemy_exception.with_traceback(exc_info[2]) from e
  File "/zhome/b1/0/88900/miniconda3/envs/critprops/lib/python3.9/site-packages/sqlalchemy/engine/base.py", line 1967, in _exec_single_context
    self.dialect.do_execute(
  File "/zhome/b1/0/88900/miniconda3/envs/critprops/lib/python3.9/site-packages/sqlalchemy/engine/default.py", line 941, in do_execute
    cursor.execute(statement, parameters)
sqlalchemy.exc.OperationalError: (sqlite3.OperationalError) database is locked
[SQL: INSERT INTO trial_system_attributes (trial_id, "key", value_json) VALUES (?, ?, ?) ON CONFLICT (trial_id, "key") DO UPDATE SET value_json = excluded.value_json]
[parameters: (423, 'auto:sampler', '"TPESampler"')]
(Background on this error at: https://sqlalche.me/e/20/e3q8)

The above exception was the direct cause of the following exception:

Traceback (most recent call last):
  File "/zhome/b1/0/88900/Documents/fair_gc/gc_ml.py", line 64, in <module>
    study, best_model = create_hyperparameter_optimizer(
  File "/zhome/b1/0/88900/Documents/fair_gc/src/optims.py", line 272, in create_hyperparameter_optimizer
    print(f"the desired number of iterations have already been done, consider increasing n_trials")
  File "/zhome/b1/0/88900/miniconda3/envs/critprops/lib/python3.9/site-packages/optuna/study/study.py", line 475, in optimize
    _optimize(
  File "/zhome/b1/0/88900/miniconda3/envs/critprops/lib/python3.9/site-packages/optuna/study/_optimize.py", line 100, in _optimize
    f.result()
  File "/zhome/b1/0/88900/miniconda3/envs/critprops/lib/python3.9/concurrent/futures/_base.py", line 439, in result
    return self.__get_result()
  File "/zhome/b1/0/88900/miniconda3/envs/critprops/lib/python3.9/concurrent/futures/_base.py", line 391, in __get_result
    raise self._exception
  File "/zhome/b1/0/88900/miniconda3/envs/critprops/lib/python3.9/concurrent/futures/thread.py", line 58, in run
    result = self.fn(*self.args, **self.kwargs)
  File "/zhome/b1/0/88900/miniconda3/envs/critprops/lib/python3.9/site-packages/optuna/study/_optimize.py", line 160, in _optimize_sequential
    frozen_trial = _run_trial(study, func, catch)
  File "/zhome/b1/0/88900/miniconda3/envs/critprops/lib/python3.9/site-packages/optuna/study/_optimize.py", line 188, in _run_trial
    trial = study.ask()
  File "/zhome/b1/0/88900/miniconda3/envs/critprops/lib/python3.9/site-packages/optuna/study/study.py", line 566, in ask
    trial = optuna.Trial(self, trial_id)
  File "/zhome/b1/0/88900/miniconda3/envs/critprops/lib/python3.9/site-packages/optuna/trial/_trial.py", line 59, in __init__
    self.study.sampler.before_trial(study, self._cached_frozen_trial)
  File "/zhome/b1/0/88900/.cache/optunahub/api.github.com/optuna/optunahub-registry/main/package/samplers/auto_sampler/_sampler.py", line 226, in before_trial
    study._storage.set_trial_system_attr(trial._trial_id, _SAMPLER_KEY, sampler_name)
  File "/zhome/b1/0/88900/miniconda3/envs/critprops/lib/python3.9/site-packages/optuna/storages/_cached_storage.py", line 198, in set_trial_system_attr
    self._backend.set_trial_system_attr(trial_id, key=key, value=value)
  File "/zhome/b1/0/88900/miniconda3/envs/critprops/lib/python3.9/site-packages/optuna/storages/_rdb/storage.py", line 734, in set_trial_system_attr
    self._set_trial_attr_without_commit(
  File "/zhome/b1/0/88900/miniconda3/envs/critprops/lib/python3.9/contextlib.py", line 137, in __exit__
    self.gen.throw(typ, value, traceback)
  File "/zhome/b1/0/88900/miniconda3/envs/critprops/lib/python3.9/site-packages/optuna/storages/_rdb/storage.py", line 98, in _create_scoped_session
    raise optuna.exceptions.StorageInternalError(message) from e
optuna.exceptions.StorageInternalError: An exception is raised during the commit. This typically happens due to invalid data in the commit, e.g. exceeding max length. 
