[I 2024-12-04 11:53:17,785] Trial 306 finished with value: 0.825562298787238 and parameters: {'max_depth': 33, 'min_samples_split': 13, 'min_samples_leaf': 3, 'max_features': 'sqrt', 'criterion': 'friedman_mse', 'splitter': 'best'}. Best is trial 181 with value: 0.6095141852505885.
[I 2024-12-04 11:53:18,138] Trial 317 finished with value: 1.0816149376799358 and parameters: {'max_depth': 17, 'min_samples_split': 15, 'min_samples_leaf': 6, 'max_features': 'sqrt', 'criterion': 'squared_error', 'splitter': 'random'}. Best is trial 181 with value: 0.6095141852505885.
[I 2024-12-04 11:53:18,747] Trial 305 finished with value: 0.7114266712285047 and parameters: {'max_depth': 29, 'min_samples_split': 10, 'min_samples_leaf': 1, 'max_features': 'sqrt', 'criterion': 'friedman_mse', 'splitter': 'best'}. Best is trial 181 with value: 0.6095141852505885.
[I 2024-12-04 11:53:18,920] Trial 315 finished with value: 0.6570109226401653 and parameters: {'max_depth': 35, 'min_samples_split': 11, 'min_samples_leaf': 1, 'max_features': 'sqrt', 'criterion': 'friedman_mse', 'splitter': 'best'}. Best is trial 181 with value: 0.6095141852505885.
[I 2024-12-04 11:53:18,955] Trial 300 finished with value: 0.8056989539390975 and parameters: {'max_depth': 33, 'min_samples_split': 8, 'min_samples_leaf': 3, 'max_features': 'sqrt', 'criterion': 'friedman_mse', 'splitter': 'best'}. Best is trial 181 with value: 0.6095141852505885.
[I 2024-12-04 11:53:19,641] Trial 322 finished with value: 0.7262995716177434 and parameters: {'max_depth': 22, 'min_samples_split': 16, 'min_samples_leaf': 1, 'max_features': 'sqrt', 'criterion': 'squared_error', 'splitter': 'best'}. Best is trial 181 with value: 0.6095141852505885.
[I 2024-12-04 11:53:20,100] Trial 309 finished with value: 0.8218134339362768 and parameters: {'max_depth': 27, 'min_samples_split': 15, 'min_samples_leaf': 2, 'max_features': 'sqrt', 'criterion': 'absolute_error', 'splitter': 'best'}. Best is trial 181 with value: 0.6095141852505885.
[I 2024-12-04 11:53:21,758] Trial 318 finished with value: 1.0816149376799358 and parameters: {'max_depth': 6, 'min_samples_split': 7, 'min_samples_leaf': 8, 'max_features': 'sqrt', 'criterion': 'friedman_mse', 'splitter': 'random'}. Best is trial 181 with value: 0.6095141852505885.
[I 2024-12-04 11:53:22,261] Trial 312 finished with value: 0.677911969128187 and parameters: {'max_depth': 33, 'min_samples_split': 10, 'min_samples_leaf': 1, 'max_features': 'sqrt', 'criterion': 'friedman_mse', 'splitter': 'best'}. Best is trial 181 with value: 0.6095141852505885.
[I 2024-12-04 11:53:22,731] Trial 319 finished with value: 0.615874208166451 and parameters: {'max_depth': 34, 'min_samples_split': 9, 'min_samples_leaf': 1, 'max_features': 'sqrt', 'criterion': 'friedman_mse', 'splitter': 'best'}. Best is trial 181 with value: 0.6095141852505885.
[I 2024-12-04 11:53:22,916] Trial 335 finished with value: 0.9058853713955142 and parameters: {'max_depth': 33, 'min_samples_split': 14, 'min_samples_leaf': 4, 'max_features': 'sqrt', 'criterion': 'friedman_mse', 'splitter': 'random'}. Best is trial 181 with value: 0.6095141852505885.
[I 2024-12-04 11:53:23,120] Trial 313 finished with value: 0.6789802738421568 and parameters: {'max_depth': 35, 'min_samples_split': 13, 'min_samples_leaf': 1, 'max_features': 'sqrt', 'criterion': 'friedman_mse', 'splitter': 'best'}. Best is trial 181 with value: 0.6095141852505885.
[I 2024-12-04 11:53:23,212] Trial 326 finished with value: 1.091656728529238 and parameters: {'max_depth': 11, 'min_samples_split': 20, 'min_samples_leaf': 8, 'max_features': 'log2', 'criterion': 'squared_error', 'splitter': 'best'}. Best is trial 181 with value: 0.6095141852505885.
[I 2024-12-04 11:53:23,213] Trial 316 finished with value: 0.7235062702460188 and parameters: {'max_depth': 34, 'min_samples_split': 11, 'min_samples_leaf': 1, 'max_features': 'sqrt', 'criterion': 'friedman_mse', 'splitter': 'best'}. Best is trial 181 with value: 0.6095141852505885.
[I 2024-12-04 11:53:23,419] Trial 320 finished with value: 0.6945768284293156 and parameters: {'max_depth': 35, 'min_samples_split': 9, 'min_samples_leaf': 1, 'max_features': 'sqrt', 'criterion': 'friedman_mse', 'splitter': 'best'}. Best is trial 181 with value: 0.6095141852505885.
[I 2024-12-04 11:53:23,424] Trial 323 finished with value: 0.7038211477850105 and parameters: {'max_depth': 29, 'min_samples_split': 14, 'min_samples_leaf': 1, 'max_features': 'sqrt', 'criterion': 'friedman_mse', 'splitter': 'best'}. Best is trial 181 with value: 0.6095141852505885.
[I 2024-12-04 11:53:23,492] Trial 330 finished with value: 0.6702654654144604 and parameters: {'max_depth': 35, 'min_samples_split': 14, 'min_samples_leaf': 1, 'max_features': 'sqrt', 'criterion': 'friedman_mse', 'splitter': 'best'}. Best is trial 181 with value: 0.6095141852505885.
[I 2024-12-04 11:53:23,509] Trial 327 finished with value: 0.8204547172829009 and parameters: {'max_depth': 22, 'min_samples_split': 10, 'min_samples_leaf': 3, 'max_features': 'sqrt', 'criterion': 'friedman_mse', 'splitter': 'best'}. Best is trial 181 with value: 0.6095141852505885.
[I 2024-12-04 11:53:23,647] Trial 324 finished with value: 0.6379386941389483 and parameters: {'max_depth': 34, 'min_samples_split': 12, 'min_samples_leaf': 1, 'max_features': 'sqrt', 'criterion': 'friedman_mse', 'splitter': 'best'}. Best is trial 181 with value: 0.6095141852505885.
[I 2024-12-04 11:53:23,784] Trial 314 finished with value: 0.6546301030051676 and parameters: {'max_depth': 34, 'min_samples_split': 8, 'min_samples_leaf': 1, 'max_features': 'sqrt', 'criterion': 'friedman_mse', 'splitter': 'best'}. Best is trial 181 with value: 0.6095141852505885.
[I 2024-12-04 11:53:23,804] Trial 321 finished with value: 0.6935908088501267 and parameters: {'max_depth': 35, 'min_samples_split': 10, 'min_samples_leaf': 1, 'max_features': 'sqrt', 'criterion': 'friedman_mse', 'splitter': 'best'}. Best is trial 181 with value: 0.6095141852505885.
[I 2024-12-04 11:53:24,312] Trial 329 finished with value: 0.6855856489406115 and parameters: {'max_depth': 34, 'min_samples_split': 7, 'min_samples_leaf': 1, 'max_features': 'sqrt', 'criterion': 'friedman_mse', 'splitter': 'best'}. Best is trial 181 with value: 0.6095141852505885.
[I 2024-12-04 11:53:24,550] Trial 325 finished with value: 1.0740768482351102 and parameters: {'max_depth': 24, 'min_samples_split': 9, 'min_samples_leaf': 9, 'max_features': 'log2', 'criterion': 'absolute_error', 'splitter': 'best'}. Best is trial 181 with value: 0.6095141852505885.
[I 2024-12-04 11:53:24,635] Trial 334 finished with value: 1.0753381761853185 and parameters: {'max_depth': 6, 'min_samples_split': 19, 'min_samples_leaf': 8, 'max_features': 'log2', 'criterion': 'absolute_error', 'splitter': 'random'}. Best is trial 181 with value: 0.6095141852505885.
[I 2024-12-04 11:53:25,285] Trial 331 finished with value: 0.6789802738421568 and parameters: {'max_depth': 35, 'min_samples_split': 13, 'min_samples_leaf': 1, 'max_features': 'sqrt', 'criterion': 'friedman_mse', 'splitter': 'best'}. Best is trial 181 with value: 0.6095141852505885.
[I 2024-12-04 11:53:25,567] Trial 332 finished with value: 0.6789669071314235 and parameters: {'max_depth': 31, 'min_samples_split': 10, 'min_samples_leaf': 1, 'max_features': 'sqrt', 'criterion': 'squared_error', 'splitter': 'best'}. Best is trial 181 with value: 0.6095141852505885.
[I 2024-12-04 11:53:25,903] Trial 333 finished with value: 0.8056989539390975 and parameters: {'max_depth': 33, 'min_samples_split': 8, 'min_samples_leaf': 3, 'max_features': 'sqrt', 'criterion': 'friedman_mse', 'splitter': 'best'}. Best is trial 181 with value: 0.6095141852505885.
[I 2024-12-04 11:53:26,322] Trial 336 finished with value: 1.092723027538113 and parameters: {'max_depth': 5, 'min_samples_split': 10, 'min_samples_leaf': 9, 'max_features': 'log2', 'criterion': 'squared_error', 'splitter': 'random'}. Best is trial 181 with value: 0.6095141852505885.
[I 2024-12-04 11:53:26,407] Trial 328 finished with value: 0.8137608958686491 and parameters: {'max_depth': 35, 'min_samples_split': 12, 'min_samples_leaf': 2, 'max_features': 'sqrt', 'criterion': 'friedman_mse', 'splitter': 'best'}. Best is trial 181 with value: 0.6095141852505885.
[I 2024-12-04 11:53:27,445] Trial 343 finished with value: 0.7692445040952437 and parameters: {'max_depth': 32, 'min_samples_split': 8, 'min_samples_leaf': 2, 'max_features': 'sqrt', 'criterion': 'friedman_mse', 'splitter': 'random'}. Best is trial 181 with value: 0.6095141852505885.
[I 2024-12-04 11:53:27,916] Trial 337 finished with value: 0.6945768284293156 and parameters: {'max_depth': 35, 'min_samples_split': 9, 'min_samples_leaf': 1, 'max_features': 'sqrt', 'criterion': 'friedman_mse', 'splitter': 'best'}. Best is trial 181 with value: 0.6095141852505885.
[I 2024-12-04 11:53:28,963] Trial 339 finished with value: 0.8093895718237184 and parameters: {'max_depth': 31, 'min_samples_split': 12, 'min_samples_leaf': 1, 'max_features': 'sqrt', 'criterion': 'absolute_error', 'splitter': 'best'}. Best is trial 181 with value: 0.6095141852505885.
[I 2024-12-04 11:53:29,030] Trial 341 finished with value: 0.7499193801652089 and parameters: {'max_depth': 30, 'min_samples_split': 11, 'min_samples_leaf': 1, 'max_features': 'log2', 'criterion': 'friedman_mse', 'splitter': 'best'}. Best is trial 181 with value: 0.6095141852505885.
[I 2024-12-04 11:53:29,367] Trial 349 finished with value: 0.6945768284293156 and parameters: {'max_depth': 35, 'min_samples_split': 9, 'min_samples_leaf': 1, 'max_features': 'sqrt', 'criterion': 'friedman_mse', 'splitter': 'best'}. Best is trial 181 with value: 0.6095141852505885.
[I 2024-12-04 11:53:29,699] Trial 342 finished with value: 0.7030091902207406 and parameters: {'max_depth': 35, 'min_samples_split': 7, 'min_samples_leaf': 1, 'max_features': 'sqrt', 'criterion': 'friedman_mse', 'splitter': 'best'}. Best is trial 181 with value: 0.6095141852505885.
[I 2024-12-04 11:53:30,050] Trial 345 finished with value: 0.7633379517558241 and parameters: {'max_depth': 35, 'min_samples_split': 13, 'min_samples_leaf': 2, 'max_features': 'sqrt', 'criterion': 'friedman_mse', 'splitter': 'random'}. Best is trial 181 with value: 0.6095141852505885.
[I 2024-12-04 11:53:30,320] Trial 338 finished with value: 0.689714141504323 and parameters: {'max_depth': 31, 'min_samples_split': 14, 'min_samples_leaf': 1, 'max_features': 'sqrt', 'criterion': 'friedman_mse', 'splitter': 'best'}. Best is trial 181 with value: 0.6095141852505885.
[I 2024-12-04 11:53:30,322] Trial 346 finished with value: 0.8105579954451577 and parameters: {'max_depth': 31, 'min_samples_split': 12, 'min_samples_leaf': 3, 'max_features': 'sqrt', 'criterion': 'friedman_mse', 'splitter': 'best'}. Best is trial 181 with value: 0.6095141852505885.
[I 2024-12-04 11:53:30,590] Trial 348 finished with value: 0.6657045440033218 and parameters: {'max_depth': 35, 'min_samples_split': 12, 'min_samples_leaf': 1, 'max_features': 'sqrt', 'criterion': 'friedman_mse', 'splitter': 'best'}. Best is trial 181 with value: 0.6095141852505885.
[I 2024-12-04 11:53:30,802] Trial 340 finished with value: 0.8125271942876539 and parameters: {'max_depth': 31, 'min_samples_split': 11, 'min_samples_leaf': 3, 'max_features': 'sqrt', 'criterion': 'friedman_mse', 'splitter': 'best'}. Best is trial 181 with value: 0.6095141852505885.
[I 2024-12-04 11:53:31,426] Trial 347 finished with value: 0.6995519727819436 and parameters: {'max_depth': 28, 'min_samples_split': 9, 'min_samples_leaf': 1, 'max_features': 'sqrt', 'criterion': 'friedman_mse', 'splitter': 'best'}. Best is trial 181 with value: 0.6095141852505885.
[I 2024-12-04 11:53:31,446] Trial 357 finished with value: 0.6657045440033218 and parameters: {'max_depth': 35, 'min_samples_split': 12, 'min_samples_leaf': 1, 'max_features': 'sqrt', 'criterion': 'friedman_mse', 'splitter': 'best'}. Best is trial 181 with value: 0.6095141852505885.
[I 2024-12-04 11:53:31,447] Trial 352 finished with value: 0.6546301030051676 and parameters: {'max_depth': 34, 'min_samples_split': 8, 'min_samples_leaf': 1, 'max_features': 'sqrt', 'criterion': 'squared_error', 'splitter': 'best'}. Best is trial 181 with value: 0.6095141852505885.
[I 2024-12-04 11:53:31,616] Trial 362 finished with value: 0.8125271942876539 and parameters: {'max_depth': 35, 'min_samples_split': 11, 'min_samples_leaf': 3, 'max_features': 'sqrt', 'criterion': 'squared_error', 'splitter': 'best'}. Best is trial 181 with value: 0.6095141852505885.
[I 2024-12-04 11:53:31,683] Trial 353 finished with value: 1.091656728529238 and parameters: {'max_depth': 21, 'min_samples_split': 3, 'min_samples_leaf': 6, 'max_features': 'log2', 'criterion': 'squared_error', 'splitter': 'best'}. Best is trial 181 with value: 0.6095141852505885.
[I 2024-12-04 11:53:32,105] Trial 351 finished with value: 0.8197632085734636 and parameters: {'max_depth': 28, 'min_samples_split': 14, 'min_samples_leaf': 2, 'max_features': 'sqrt', 'criterion': 'friedman_mse', 'splitter': 'best'}. Best is trial 181 with value: 0.6095141852505885.
[I 2024-12-04 11:53:32,766] Trial 344 finished with value: 0.8066762268897443 and parameters: {'max_depth': 35, 'min_samples_split': 9, 'min_samples_leaf': 3, 'max_features': 'sqrt', 'criterion': 'friedman_mse', 'splitter': 'best'}. Best is trial 181 with value: 0.6095141852505885.
[I 2024-12-04 11:53:33,395] Trial 350 finished with value: 0.7205130543696373 and parameters: {'max_depth': 31, 'min_samples_split': 8, 'min_samples_leaf': 1, 'max_features': 'sqrt', 'criterion': 'squared_error', 'splitter': 'best'}. Best is trial 181 with value: 0.6095141852505885.
[I 2024-12-04 11:53:33,396] Trial 360 finished with value: 0.6570109226401653 and parameters: {'max_depth': 35, 'min_samples_split': 11, 'min_samples_leaf': 1, 'max_features': 'sqrt', 'criterion': 'squared_error', 'splitter': 'best'}. Best is trial 181 with value: 0.6095141852505885.
[I 2024-12-04 11:53:33,465] Trial 356 finished with value: 0.6694087139298565 and parameters: {'max_depth': 29, 'min_samples_split': 9, 'min_samples_leaf': 1, 'max_features': 'sqrt', 'criterion': 'friedman_mse', 'splitter': 'best'}. Best is trial 181 with value: 0.6095141852505885.
[I 2024-12-04 11:53:33,581] Trial 355 finished with value: 0.6724429399742451 and parameters: {'max_depth': 27, 'min_samples_split': 14, 'min_samples_leaf': 1, 'max_features': 'sqrt', 'criterion': 'friedman_mse', 'splitter': 'best'}. Best is trial 181 with value: 0.6095141852505885.
[I 2024-12-04 11:53:34,558] Trial 359 finished with value: 0.7527536657921049 and parameters: {'max_depth': 23, 'min_samples_split': 11, 'min_samples_leaf': 1, 'max_features': 'sqrt', 'criterion': 'absolute_error', 'splitter': 'random'}. Best is trial 181 with value: 0.6095141852505885.
[I 2024-12-04 11:53:36,230] Trial 361 finished with value: 0.8875445445003438 and parameters: {'max_depth': 14, 'min_samples_split': 3, 'min_samples_leaf': 10, 'max_features': 'sqrt', 'criterion': 'squared_error', 'splitter': 'best'}. Best is trial 181 with value: 0.6095141852505885.
[I 2024-12-04 11:53:36,242] Trial 369 finished with value: 0.8264837817782097 and parameters: {'max_depth': 35, 'min_samples_split': 8, 'min_samples_leaf': 2, 'max_features': 'sqrt', 'criterion': 'absolute_error', 'splitter': 'best'}. Best is trial 181 with value: 0.6095141852505885.
[I 2024-12-04 11:53:36,255] Trial 365 finished with value: 0.7030091902207406 and parameters: {'max_depth': 35, 'min_samples_split': 7, 'min_samples_leaf': 1, 'max_features': 'sqrt', 'criterion': 'squared_error', 'splitter': 'best'}. Best is trial 181 with value: 0.6095141852505885.
[I 2024-12-04 11:53:36,275] Trial 366 finished with value: 0.7242053946898249 and parameters: {'max_depth': 30, 'min_samples_split': 7, 'min_samples_leaf': 1, 'max_features': 'sqrt', 'criterion': 'squared_error', 'splitter': 'best'}. Best is trial 181 with value: 0.6095141852505885.
[I 2024-12-04 11:53:36,680] Trial 363 finished with value: 1.0693351372656477 and parameters: {'max_depth': 5, 'min_samples_split': 20, 'min_samples_leaf': 1, 'max_features': 'sqrt', 'criterion': 'friedman_mse', 'splitter': 'best'}. Best is trial 181 with value: 0.6095141852505885.
[I 2024-12-04 11:53:37,010] Trial 370 finished with value: 0.6688365699501411 and parameters: {'max_depth': 29, 'min_samples_split': 15, 'min_samples_leaf': 1, 'max_features': 'sqrt', 'criterion': 'friedman_mse', 'splitter': 'best'}. Best is trial 181 with value: 0.6095141852505885.
[I 2024-12-04 11:53:37,166] Trial 358 finished with value: 0.6460053267613093 and parameters: {'max_depth': 33, 'min_samples_split': 6, 'min_samples_leaf': 1, 'max_features': 'sqrt', 'criterion': 'squared_error', 'splitter': 'best'}. Best is trial 181 with value: 0.6095141852505885.
[I 2024-12-04 11:53:37,255] Trial 373 finished with value: 0.7030091902207406 and parameters: {'max_depth': 35, 'min_samples_split': 7, 'min_samples_leaf': 1, 'max_features': 'sqrt', 'criterion': 'friedman_mse', 'splitter': 'best'}. Best is trial 181 with value: 0.6095141852505885.
[I 2024-12-04 11:53:37,345] Trial 367 finished with value: 0.6889323634393683 and parameters: {'max_depth': 30, 'min_samples_split': 11, 'min_samples_leaf': 1, 'max_features': 'sqrt', 'criterion': 'friedman_mse', 'splitter': 'best'}. Best is trial 181 with value: 0.6095141852505885.
[I 2024-12-04 11:53:38,533] Trial 372 finished with value: 0.6862313348684029 and parameters: {'max_depth': 29, 'min_samples_split': 12, 'min_samples_leaf': 1, 'max_features': 'sqrt', 'criterion': 'friedman_mse', 'splitter': 'best'}. Best is trial 181 with value: 0.6095141852505885.
[I 2024-12-04 11:53:38,809] Trial 377 finished with value: 0.677269555622075 and parameters: {'max_depth': 27, 'min_samples_split': 12, 'min_samples_leaf': 1, 'max_features': 'sqrt', 'criterion': 'squared_error', 'splitter': 'best'}. Best is trial 181 with value: 0.6095141852505885.
[I 2024-12-04 11:53:39,195] Trial 354 finished with value: 0.7222286893478446 and parameters: {'max_depth': 28, 'min_samples_split': 12, 'min_samples_leaf': 1, 'max_features': 'sqrt', 'criterion': 'friedman_mse', 'splitter': 'best'}. Best is trial 181 with value: 0.6095141852505885.
[I 2024-12-04 11:53:39,529] Trial 378 finished with value: 0.6288333537578643 and parameters: {'max_depth': 34, 'min_samples_split': 4, 'min_samples_leaf': 1, 'max_features': 'sqrt', 'criterion': 'squared_error', 'splitter': 'best'}. Best is trial 181 with value: 0.6095141852505885.
[I 2024-12-04 11:53:40,134] Trial 374 finished with value: 0.8101385948198155 and parameters: {'max_depth': 31, 'min_samples_split': 6, 'min_samples_leaf': 3, 'max_features': 'sqrt', 'criterion': 'squared_error', 'splitter': 'best'}. Best is trial 181 with value: 0.6095141852505885.
[I 2024-12-04 11:53:40,463] Trial 364 finished with value: 1.091656728529238 and parameters: {'max_depth': 13, 'min_samples_split': 5, 'min_samples_leaf': 7, 'max_features': 'log2', 'criterion': 'friedman_mse', 'splitter': 'best'}. Best is trial 181 with value: 0.6095141852505885.
[I 2024-12-04 11:53:41,091] Trial 379 finished with value: 0.8241861685151659 and parameters: {'max_depth': 35, 'min_samples_split': 4, 'min_samples_leaf': 2, 'max_features': 'sqrt', 'criterion': 'squared_error', 'splitter': 'best'}. Best is trial 368 with value: 0.6055877317086851.
[I 2024-12-04 11:53:41,343] Trial 368 finished with value: 0.6055877317086851 and parameters: {'max_depth': 32, 'min_samples_split': 7, 'min_samples_leaf': 1, 'max_features': 'sqrt', 'criterion': 'squared_error', 'splitter': 'best'}. Best is trial 368 with value: 0.6055877317086851.
[I 2024-12-04 11:53:41,368] Trial 388 finished with value: 0.8163908890442707 and parameters: {'max_depth': 32, 'min_samples_split': 15, 'min_samples_leaf': 3, 'max_features': 'sqrt', 'criterion': 'friedman_mse', 'splitter': 'best'}. Best is trial 368 with value: 0.6055877317086851.
[I 2024-12-04 11:53:41,483] Trial 387 finished with value: 0.8148620426453123 and parameters: {'max_depth': 28, 'min_samples_split': 9, 'min_samples_leaf': 1, 'max_features': 'sqrt', 'criterion': 'squared_error', 'splitter': 'random'}. Best is trial 368 with value: 0.6055877317086851.
[I 2024-12-04 11:53:41,750] Trial 383 finished with value: 0.8300015320785108 and parameters: {'max_depth': 34, 'min_samples_split': 5, 'min_samples_leaf': 2, 'max_features': 'sqrt', 'criterion': 'squared_error', 'splitter': 'best'}. Best is trial 368 with value: 0.6055877317086851.
[I 2024-12-04 11:53:42,100] Trial 380 finished with value: 0.7271069002219231 and parameters: {'max_depth': 33, 'min_samples_split': 5, 'min_samples_leaf': 1, 'max_features': 'sqrt', 'criterion': 'squared_error', 'splitter': 'best'}. Best is trial 368 with value: 0.6055877317086851.
[I 2024-12-04 11:53:42,136] Trial 382 finished with value: 0.6838717643138409 and parameters: {'max_depth': 27, 'min_samples_split': 2, 'min_samples_leaf': 1, 'max_features': 'sqrt', 'criterion': 'squared_error', 'splitter': 'best'}. Best is trial 368 with value: 0.6055877317086851.
[I 2024-12-04 11:53:42,953] Trial 375 finished with value: 0.6897370689523286 and parameters: {'max_depth': 34, 'min_samples_split': 10, 'min_samples_leaf': 1, 'max_features': 'sqrt', 'criterion': 'squared_error', 'splitter': 'best'}. Best is trial 368 with value: 0.6055877317086851.
[I 2024-12-04 11:53:43,227] Trial 385 finished with value: 0.773946438627816 and parameters: {'max_depth': 33, 'min_samples_split': 6, 'min_samples_leaf': 2, 'max_features': 'sqrt', 'criterion': 'squared_error', 'splitter': 'random'}. Best is trial 368 with value: 0.6055877317086851.
[I 2024-12-04 11:53:43,291] Trial 384 finished with value: 1.0689310653398096 and parameters: {'max_depth': 31, 'min_samples_split': 19, 'min_samples_leaf': 3, 'max_features': 'log2', 'criterion': 'absolute_error', 'splitter': 'random'}. Best is trial 368 with value: 0.6055877317086851.
