[I 2024-12-04 19:40:06,105] Using an existing study with name 'Tc_gpr' instead of creating a new one.
[I 2024-12-04 19:40:14,568] Trial 33 finished with value: 0.9864686818043252 and parameters: {'kernel_type': 'Matern', 'length_scale': 0.07998918513724196, 'noise_level': 4.348494962759108e-09, 'constant_value': 2.56443047086969e-07, 'nu': 2.5}. Best is trial 11 with value: 0.1424950545886159.
[I 2024-12-04 19:40:17,362] Trial 34 finished with value: 0.9864686819186451 and parameters: {'kernel_type': 'RBF', 'length_scale': 133.75151602246962, 'noise_level': 2.098816072415279e-08, 'constant_value': 0.00013040144163433044, 'nu': 2.5}. Best is trial 11 with value: 0.1424950545886159.
[I 2024-12-04 19:40:20,553] Trial 32 finished with value: 0.9864686820002282 and parameters: {'kernel_type': 'Matern', 'length_scale': 30.89933878962828, 'noise_level': 0.000548635420917774, 'constant_value': 2.988659778522321e-05, 'nu': 2.5}. Best is trial 11 with value: 0.1424950545886159.
[I 2024-12-04 19:40:21,854] Trial 36 finished with value: 0.9982166356751678 and parameters: {'kernel_type': 'Matern', 'length_scale': 0.25088052857600296, 'noise_level': 1.3625186591564412e-06, 'constant_value': 565.1324554686888, 'nu': 1.5}. Best is trial 11 with value: 0.1424950545886159.
[I 2024-12-04 19:40:25,186] Trial 35 finished with value: 0.9864686819212009 and parameters: {'kernel_type': 'Matern', 'length_scale': 128.3432337054967, 'noise_level': 4.60826893576481e-09, 'constant_value': 3.925441117921191e-06, 'nu': 0.5}. Best is trial 11 with value: 0.1424950545886159.
[I 2024-12-04 19:40:27,398] Trial 38 finished with value: 0.9864686819197749 and parameters: {'kernel_type': 'RBF', 'length_scale': 0.012334786136577252, 'noise_level': 1.228340142654768e-10, 'constant_value': 0.00021760988998591787, 'nu': 2.5}. Best is trial 11 with value: 0.1424950545886159.
[I 2024-12-04 19:40:27,750] Trial 37 finished with value: 0.19720004861434345 and parameters: {'kernel_type': 'Matern', 'length_scale': 40637.68898932423, 'noise_level': 0.003819305984908654, 'constant_value': 1092.6603259462993, 'nu': 0.5}. Best is trial 11 with value: 0.1424950545886159.
[I 2024-12-04 19:40:30,252] Trial 39 finished with value: 0.986468680601098 and parameters: {'kernel_type': 'Matern', 'length_scale': 0.08889969506730776, 'noise_level': 4.2432360158520645e-06, 'constant_value': 0.0012586686458155374, 'nu': 2.5}. Best is trial 11 with value: 0.1424950545886159.
[I 2024-12-04 19:40:32,149] Trial 40 finished with value: 0.9982170585311965 and parameters: {'kernel_type': 'Matern', 'length_scale': 9905.183935649462, 'noise_level': 7.361819131315219e-08, 'constant_value': 15919.879883403144, 'nu': 0.5}. Best is trial 11 with value: 0.1424950545886159.
[I 2024-12-04 19:40:39,369] Trial 41 finished with value: 0.9864686819178204 and parameters: {'kernel_type': 'RBF', 'length_scale': 45818.154886070544, 'noise_level': 4.4402833494642696e-05, 'constant_value': 41.130508395521986, 'nu': 0.5}. Best is trial 11 with value: 0.1424950545886159.
[I 2024-12-04 19:40:39,485] Trial 42 finished with value: 0.9864686819314001 and parameters: {'kernel_type': 'Matern', 'length_scale': 6.500630467007518, 'noise_level': 1.2867522136210508e-06, 'constant_value': 2.870085235827029e-07, 'nu': 2.5}. Best is trial 11 with value: 0.1424950545886159.
[I 2024-12-04 19:40:39,658] Trial 43 finished with value: 0.9864686819007056 and parameters: {'kernel_type': 'RBF', 'length_scale': 0.05354089231664872, 'noise_level': 6.586473815600485e-08, 'constant_value': 5.31599139997731e-07, 'nu': 2.5}. Best is trial 11 with value: 0.1424950545886159.
[I 2024-12-04 19:40:44,346] Trial 46 finished with value: 0.9982170087081309 and parameters: {'kernel_type': 'Matern', 'length_scale': 7352.026615468612, 'noise_level': 7.867290042142912e-06, 'constant_value': 825.8357210293863, 'nu': 0.5}. Best is trial 11 with value: 0.1424950545886159.
[I 2024-12-04 19:40:44,510] Trial 44 finished with value: 0.9864686819226686 and parameters: {'kernel_type': 'Matern', 'length_scale': 10398.33849543584, 'noise_level': 0.00018207284919112248, 'constant_value': 41904.96899658397, 'nu': 1.5}. Best is trial 11 with value: 0.1424950545886159.
[I 2024-12-04 19:40:50,394] Trial 48 finished with value: 0.9864686819157191 and parameters: {'kernel_type': 'Matern', 'length_scale': 0.0029356657603250274, 'noise_level': 0.42784768905957443, 'constant_value': 855.9623291493153, 'nu': 2.5}. Best is trial 11 with value: 0.1424950545886159.
[I 2024-12-04 19:40:53,149] Trial 47 finished with value: 0.986468682115307 and parameters: {'kernel_type': 'Matern', 'length_scale': 0.02727325483253703, 'noise_level': 0.7261910856005113, 'constant_value': 0.09002516743491257, 'nu': 0.5}. Best is trial 11 with value: 0.1424950545886159.
[I 2024-12-04 19:40:54,935] Trial 45 finished with value: 0.14771034649280582 and parameters: {'kernel_type': 'RBF', 'length_scale': 0.5842254318044368, 'noise_level': 1.18672457754469e-08, 'constant_value': 4.947037048943628e-05, 'nu': 0.5}. Best is trial 11 with value: 0.1424950545886159.
[I 2024-12-04 19:40:59,756] Trial 50 finished with value: 0.14469874319683484 and parameters: {'kernel_type': 'Matern', 'length_scale': 43.515138835554176, 'noise_level': 1.7868916589178918e-05, 'constant_value': 80165.89073528508, 'nu': 2.5}. Best is trial 11 with value: 0.1424950545886159.
[I 2024-12-04 19:41:01,952] Trial 49 finished with value: 0.19719999968827032 and parameters: {'kernel_type': 'Matern', 'length_scale': 1671.5868407787632, 'noise_level': 0.2765882526346455, 'constant_value': 0.003241491939048415, 'nu': 0.5}. Best is trial 11 with value: 0.1424950545886159.
[I 2024-12-04 19:41:04,345] Trial 51 finished with value: 0.986468681955004 and parameters: {'kernel_type': 'RBF', 'length_scale': 8.555927260980123, 'noise_level': 1.5266163667736335e-07, 'constant_value': 0.00017121626902281652, 'nu': 0.5}. Best is trial 11 with value: 0.1424950545886159.
[I 2024-12-04 19:41:08,174] Trial 52 finished with value: 0.1446988142142674 and parameters: {'kernel_type': 'Matern', 'length_scale': 17.33168593381179, 'noise_level': 4.3688155075204806e-05, 'constant_value': 12658.930144349079, 'nu': 2.5}. Best is trial 11 with value: 0.1424950545886159.
[I 2024-12-04 19:41:13,230] Trial 54 finished with value: 0.19719997449412885 and parameters: {'kernel_type': 'Matern', 'length_scale': 0.27704479036492635, 'noise_level': 8.517567499693234e-06, 'constant_value': 2.3478826301355446e-06, 'nu': 0.5}. Best is trial 11 with value: 0.1424950545886159.
[I 2024-12-04 19:41:13,932] Trial 53 finished with value: 0.1477103715653167 and parameters: {'kernel_type': 'RBF', 'length_scale': 0.28686490171497525, 'noise_level': 8.340421179061773e-10, 'constant_value': 1.6918807470307255e-05, 'nu': 0.5}. Best is trial 11 with value: 0.1424950545886159.
[I 2024-12-04 19:41:14,273] Trial 55 finished with value: 0.14469913790719263 and parameters: {'kernel_type': 'Matern', 'length_scale': 30.894364929967328, 'noise_level': 0.001126282399228603, 'constant_value': 65579.71343623218, 'nu': 2.5}. Best is trial 11 with value: 0.1424950545886159.
[I 2024-12-04 19:41:18,277] Trial 56 finished with value: 0.9982167338022524 and parameters: {'kernel_type': 'RBF', 'length_scale': 0.0713881406491474, 'noise_level': 3.380289972896133e-05, 'constant_value': 80062.22159271197, 'nu': 2.5}. Best is trial 11 with value: 0.1424950545886159.
[I 2024-12-04 19:41:18,916] Trial 57 finished with value: 0.9982171094984962 and parameters: {'kernel_type': 'Matern', 'length_scale': 12.911846775335437, 'noise_level': 1.0696718448374368e-05, 'constant_value': 63064.31810590387, 'nu': 2.5}. Best is trial 11 with value: 0.1424950545886159.
[I 2024-12-04 19:41:19,963] Trial 58 finished with value: 0.14469875757144504 and parameters: {'kernel_type': 'Matern', 'length_scale': 48.16154851165834, 'noise_level': 0.023397483458154716, 'constant_value': 195.15854968133453, 'nu': 2.5}. Best is trial 11 with value: 0.1424950545886159.
[I 2024-12-04 19:41:23,865] Trial 60 finished with value: 0.9982171094518734 and parameters: {'kernel_type': 'Matern', 'length_scale': 17.57630603414728, 'noise_level': 2.783453200202877e-06, 'constant_value': 29469.74687958414, 'nu': 1.5}. Best is trial 11 with value: 0.1424950545886159.
[I 2024-12-04 19:41:24,938] Trial 59 finished with value: 0.9864686819233947 and parameters: {'kernel_type': 'Matern', 'length_scale': 107.10066455093843, 'noise_level': 4.289913953729535e-05, 'constant_value': 565.6179743384602, 'nu': 2.5}. Best is trial 11 with value: 0.1424950545886159.
[I 2024-12-04 19:41:25,990] Trial 61 finished with value: 0.9982171061620594 and parameters: {'kernel_type': 'Matern', 'length_scale': 25507.014018130503, 'noise_level': 0.9068710348464667, 'constant_value': 8.173335033585232, 'nu': 2.5}. Best is trial 11 with value: 0.1424950545886159.
[I 2024-12-04 19:41:28,766] Trial 62 finished with value: 0.14771075349596607 and parameters: {'kernel_type': 'RBF', 'length_scale': 3.83103654381012, 'noise_level': 0.1786220177035243, 'constant_value': 2349.0793524164924, 'nu': 1.5}. Best is trial 11 with value: 0.1424950545886159.
[I 2024-12-04 19:41:30,663] Trial 63 finished with value: 0.14469891162132212 and parameters: {'kernel_type': 'Matern', 'length_scale': 236.4874961936571, 'noise_level': 0.03475613960348756, 'constant_value': 7642.100477932892, 'nu': 2.5}. Best is trial 11 with value: 0.1424950545886159.
[I 2024-12-04 19:41:33,275] Trial 65 finished with value: 0.9982162657657145 and parameters: {'kernel_type': 'Matern', 'length_scale': 0.8172712863112743, 'noise_level': 1.0932236310606669e-05, 'constant_value': 42332.06730948589, 'nu': 0.5}. Best is trial 11 with value: 0.1424950545886159.
[I 2024-12-04 19:41:34,756] Trial 64 finished with value: 0.14469881040787447 and parameters: {'kernel_type': 'Matern', 'length_scale': 8.880139180566786, 'noise_level': 0.0020555362884851006, 'constant_value': 3.0926541317128335, 'nu': 2.5}. Best is trial 11 with value: 0.1424950545886159.
[I 2024-12-04 19:41:37,505] Trial 66 finished with value: 0.14469892332054754 and parameters: {'kernel_type': 'Matern', 'length_scale': 1259.9402621300337, 'noise_level': 0.009793176936734616, 'constant_value': 12785.677946773205, 'nu': 2.5}. Best is trial 11 with value: 0.1424950545886159.
[I 2024-12-04 19:41:39,962] Trial 67 finished with value: 0.14469886617502992 and parameters: {'kernel_type': 'Matern', 'length_scale': 1.3341149073480016, 'noise_level': 0.11744150309117732, 'constant_value': 85129.76223625291, 'nu': 2.5}. Best is trial 11 with value: 0.1424950545886159.
[I 2024-12-04 19:41:44,353] Trial 68 finished with value: 0.1477105411048528 and parameters: {'kernel_type': 'RBF', 'length_scale': 2243.863004480376, 'noise_level': 0.8032877799831847, 'constant_value': 9834.584701854354, 'nu': 2.5}. Best is trial 11 with value: 0.1424950545886159.
[I 2024-12-04 19:41:45,734] Trial 69 finished with value: 0.9864686819182494 and parameters: {'kernel_type': 'Matern', 'length_scale': 0.01524764305980888, 'noise_level': 0.0004254110276585423, 'constant_value': 32.071479320841064, 'nu': 2.5}. Best is trial 11 with value: 0.1424950545886159.
[I 2024-12-04 19:41:48,878] Trial 70 finished with value: 0.1972000378168406 and parameters: {'kernel_type': 'Matern', 'length_scale': 4.163335847511144, 'noise_level': 0.2666221618950714, 'constant_value': 12338.296012065479, 'nu': 0.5}. Best is trial 11 with value: 0.1424950545886159.
[I 2024-12-04 19:41:52,617] Trial 71 finished with value: 0.14469882041072013 and parameters: {'kernel_type': 'Matern', 'length_scale': 1.055318144920441, 'noise_level': 0.013207381083435266, 'constant_value': 1136.5112984279654, 'nu': 2.5}. Best is trial 11 with value: 0.1424950545886159.
[I 2024-12-04 19:41:53,946] Trial 73 finished with value: 0.9982167338001214 and parameters: {'kernel_type': 'Matern', 'length_scale': 0.11727172533206473, 'noise_level': 7.578174318710836e-08, 'constant_value': 14363.121303910946, 'nu': 2.5}. Best is trial 11 with value: 0.1424950545886159.
[I 2024-12-04 19:41:58,695] Trial 72 finished with value: 0.9864686819230876 and parameters: {'kernel_type': 'Matern', 'length_scale': 242.85405910555164, 'noise_level': 0.0010522433169912067, 'constant_value': 0.7674244841358507, 'nu': 2.5}. Best is trial 11 with value: 0.1424950545886159.
[I 2024-12-04 19:42:00,798] Trial 74 finished with value: 0.1446987618009185 and parameters: {'kernel_type': 'Matern', 'length_scale': 13.937427328389767, 'noise_level': 0.23173948680403056, 'constant_value': 2.3284528639021667, 'nu': 2.5}. Best is trial 11 with value: 0.1424950545886159.
[I 2024-12-04 19:42:02,516] Trial 75 finished with value: 0.9864686819229082 and parameters: {'kernel_type': 'Matern', 'length_scale': 25.72095361995365, 'noise_level': 8.476218073881271e-05, 'constant_value': 0.07675101589822476, 'nu': 1.5}. Best is trial 11 with value: 0.1424950545886159.
[I 2024-12-04 19:42:04,835] Trial 76 finished with value: 0.9864686819197814 and parameters: {'kernel_type': 'RBF', 'length_scale': 143.64610653730472, 'noise_level': 5.355894578715592e-08, 'constant_value': 1760.513436420802, 'nu': 2.5}. Best is trial 11 with value: 0.1424950545886159.
[I 2024-12-04 19:42:08,144] Trial 78 finished with value: 0.9864686821362086 and parameters: {'kernel_type': 'Matern', 'length_scale': 8.074289214242388, 'noise_level': 0.0011904781018896215, 'constant_value': 0.2339769964711785, 'nu': 2.5}. Best is trial 11 with value: 0.1424950545886159.
[I 2024-12-04 19:42:09,626] Trial 77 finished with value: 0.14469883815306842 and parameters: {'kernel_type': 'Matern', 'length_scale': 5.594919484504602, 'noise_level': 0.8728589907655045, 'constant_value': 0.00994341696391611, 'nu': 2.5}. Best is trial 11 with value: 0.1424950545886159.
[I 2024-12-04 19:42:10,495] Trial 79 finished with value: 0.1446991648831949 and parameters: {'kernel_type': 'Matern', 'length_scale': 17.84125156879624, 'noise_level': 0.03243166595370948, 'constant_value': 36.606221491762234, 'nu': 2.5}. Best is trial 11 with value: 0.1424950545886159.
[I 2024-12-04 19:42:16,265] Trial 81 finished with value: 0.9982162496372482 and parameters: {'kernel_type': 'Matern', 'length_scale': 388.151363468622, 'noise_level': 0.4109893228336193, 'constant_value': 0.00012848547809859138, 'nu': 2.5}. Best is trial 11 with value: 0.1424950545886159.
[I 2024-12-04 19:42:17,712] Trial 80 finished with value: 0.9864686819004302 and parameters: {'kernel_type': 'Matern', 'length_scale': 9952.23634279448, 'noise_level': 1.1380023886314446e-06, 'constant_value': 10908.859619189989, 'nu': 2.5}. Best is trial 11 with value: 0.1424950545886159.
[I 2024-12-04 19:42:19,236] Trial 82 finished with value: 0.14469881044146085 and parameters: {'kernel_type': 'Matern', 'length_scale': 4.678599618051317, 'noise_level': 0.37778387502640043, 'constant_value': 0.0040261403549890565, 'nu': 2.5}. Best is trial 11 with value: 0.1424950545886159.
[I 2024-12-04 19:42:24,000] Trial 83 finished with value: 0.14771034882159 and parameters: {'kernel_type': 'RBF', 'length_scale': 0.4141297332168266, 'noise_level': 0.0008282416067499104, 'constant_value': 0.4133060868217867, 'nu': 2.5}. Best is trial 11 with value: 0.1424950545886159.
[I 2024-12-04 19:42:25,019] Trial 84 finished with value: 0.1424950756577041 and parameters: {'kernel_type': 'Matern', 'length_scale': 40.59319725723403, 'noise_level': 0.17958053882889394, 'constant_value': 242.41141859541634, 'nu': 1.5}. Best is trial 11 with value: 0.1424950545886159.
[I 2024-12-04 19:42:27,327] Trial 85 finished with value: 0.14469880900747006 and parameters: {'kernel_type': 'Matern', 'length_scale': 0.5650593826303424, 'noise_level': 0.0002935728321345067, 'constant_value': 3804.2705473338674, 'nu': 2.5}. Best is trial 11 with value: 0.1424950545886159.
[I 2024-12-04 19:42:31,715] Trial 86 finished with value: 0.14469883133293013 and parameters: {'kernel_type': 'Matern', 'length_scale': 0.9615764028831838, 'noise_level': 0.07119051793194518, 'constant_value': 19.791519678393332, 'nu': 2.5}. Best is trial 11 with value: 0.1424950545886159.
[I 2024-12-04 19:42:32,676] Trial 87 finished with value: 0.13777769741398374 and parameters: {'kernel_type': 'Matern', 'length_scale': 30.846914586456293, 'noise_level': 0.38398426118048645, 'constant_value': 13.85099929198616, 'nu': 1.5}. Best is trial 87 with value: 0.13777769741398374.
[I 2024-12-04 19:42:35,156] Trial 88 finished with value: 0.14249505542076235 and parameters: {'kernel_type': 'Matern', 'length_scale': 1.5624790743496815, 'noise_level': 0.7280803630540997, 'constant_value': 6745.317438797094, 'nu': 1.5}. Best is trial 87 with value: 0.13777769741398374.
[I 2024-12-04 19:42:38,959] Trial 89 finished with value: 0.9864686819096745 and parameters: {'kernel_type': 'RBF', 'length_scale': 10.580869501335746, 'noise_level': 1.2247442295945332e-06, 'constant_value': 215.27127066061666, 'nu': 1.5}. Best is trial 87 with value: 0.13777769741398374.
[I 2024-12-04 19:42:43,430] Trial 90 finished with value: 0.14249509605785657 and parameters: {'kernel_type': 'Matern', 'length_scale': 2985.357094262764, 'noise_level': 0.33021157639513465, 'constant_value': 0.390020548945024, 'nu': 1.5}. Best is trial 87 with value: 0.13777769741398374.
[I 2024-12-04 19:42:44,004] Trial 91 finished with value: 0.1424950861409519 and parameters: {'kernel_type': 'Matern', 'length_scale': 4.962443990566826, 'noise_level': 0.01847925771072389, 'constant_value': 9105.16344715217, 'nu': 1.5}. Best is trial 87 with value: 0.13777769741398374.
[I 2024-12-04 19:42:46,535] Trial 92 finished with value: 0.14249507813708984 and parameters: {'kernel_type': 'Matern', 'length_scale': 0.48649351904599336, 'noise_level': 0.9879175967568417, 'constant_value': 6.956072221663252, 'nu': 1.5}. Best is trial 87 with value: 0.13777769741398374.
[I 2024-12-04 19:42:50,126] Trial 94 finished with value: 0.1424946142792836 and parameters: {'kernel_type': 'Matern', 'length_scale': 15.390589142990219, 'noise_level': 0.37645692070492626, 'constant_value': 6544.592268601911, 'nu': 1.5}. Best is trial 87 with value: 0.13777769741398374.
[I 2024-12-04 19:42:51,449] Trial 95 finished with value: 0.9864686816311731 and parameters: {'kernel_type': 'Matern', 'length_scale': 0.00033134234988243307, 'noise_level': 0.31772321000453896, 'constant_value': 1.045133433507098, 'nu': 1.5}. Best is trial 87 with value: 0.13777769741398374.
[I 2024-12-04 19:42:52,284] Trial 93 finished with value: 0.13813291664190236 and parameters: {'kernel_type': 'Matern', 'length_scale': 18.299287729672447, 'noise_level': 0.12829043207709961, 'constant_value': 15.12598581272964, 'nu': 1.5}. Best is trial 87 with value: 0.13777769741398374.
[I 2024-12-04 19:42:56,393] Trial 96 finished with value: 0.14249510205097615 and parameters: {'kernel_type': 'Matern', 'length_scale': 3.668686528102738, 'noise_level': 0.5930133034475497, 'constant_value': 36914.62473503291, 'nu': 1.5}. Best is trial 87 with value: 0.13777769741398374.
[I 2024-12-04 19:42:59,570] Trial 98 finished with value: 0.14249508975523542 and parameters: {'kernel_type': 'Matern', 'length_scale': 1352.6901524665159, 'noise_level': 0.589908328988101, 'constant_value': 72.0843030059054, 'nu': 1.5}. Best is trial 87 with value: 0.13777769741398374.
[I 2024-12-04 19:43:03,914] Trial 99 finished with value: 0.14249501112723623 and parameters: {'kernel_type': 'Matern', 'length_scale': 0.4807382637696102, 'noise_level': 0.10304633094245044, 'constant_value': 37726.50182500235, 'nu': 1.5}. Best is trial 87 with value: 0.13777769741398374.
[I 2024-12-04 19:43:06,518] Trial 97 finished with value: 0.14249506714730162 and parameters: {'kernel_type': 'Matern', 'length_scale': 779.8091076950259, 'noise_level': 0.741981486757346, 'constant_value': 0.008012623237059393, 'nu': 1.5}. Best is trial 87 with value: 0.13777769741398374.
[I 2024-12-04 19:43:07,039] Trial 100 finished with value: 0.14249506646546942 and parameters: {'kernel_type': 'Matern', 'length_scale': 81.82482185101613, 'noise_level': 0.9158994799993728, 'constant_value': 2.3736365166071436, 'nu': 1.5}. Best is trial 87 with value: 0.13777769741398374.
[I 2024-12-04 19:43:08,647] Trial 101 finished with value: 0.9864686819223918 and parameters: {'kernel_type': 'Matern', 'length_scale': 0.00047567907804510256, 'noise_level': 0.00588929367757491, 'constant_value': 7954.608429044453, 'nu': 1.5}. Best is trial 87 with value: 0.13777769741398374.
[I 2024-12-04 19:43:13,776] Trial 103 finished with value: 0.9864686819191191 and parameters: {'kernel_type': 'RBF', 'length_scale': 942.1803255893511, 'noise_level': 0.012871204660505313, 'constant_value': 0.0015630658231702203, 'nu': 1.5}. Best is trial 87 with value: 0.13777769741398374.
[I 2024-12-04 19:43:14,006] Trial 102 finished with value: 0.14249494806331728 and parameters: {'kernel_type': 'Matern', 'length_scale': 0.326533678229554, 'noise_level': 0.0011779251750765067, 'constant_value': 9485.736546613078, 'nu': 1.5}. Best is trial 87 with value: 0.13777769741398374.
[I 2024-12-04 19:43:15,603] Trial 104 finished with value: 0.1424950819235295 and parameters: {'kernel_type': 'Matern', 'length_scale': 3.4161713947995658, 'noise_level': 0.17934134029210066, 'constant_value': 13.102759867850466, 'nu': 1.5}. Best is trial 87 with value: 0.13777769741398374.
[I 2024-12-04 19:43:21,024] Trial 105 finished with value: 0.9982171094932836 and parameters: {'kernel_type': 'Matern', 'length_scale': 97420.53935341415, 'noise_level': 0.05207381827873304, 'constant_value': 0.00025927132342096275, 'nu': 1.5}. Best is trial 87 with value: 0.13777769741398374.
[I 2024-12-04 19:43:24,065] Trial 107 finished with value: 0.14249506336592382 and parameters: {'kernel_type': 'Matern', 'length_scale': 8.913432640357952, 'noise_level': 0.1475064632799703, 'constant_value': 0.8098684240081413, 'nu': 1.5}. Best is trial 87 with value: 0.13777769741398374.
