[I 2024-12-03 18:42:35,489] Trial 569 finished with value: 0.5799422218947056 and parameters: {'kernel': 'rbf', 'C': 13.864382419769111, 'gamma': 0.0051152426971724585, 'epsilon': 0.08392456094127793}. Best is trial 482 with value: 0.4491649651596098.
[I 2024-12-03 18:42:36,022] Trial 575 finished with value: 0.4657929544307873 and parameters: {'kernel': 'rbf', 'C': 78.92314747171213, 'gamma': 0.01049191527270342, 'epsilon': 0.1487254190811664}. Best is trial 482 with value: 0.4491649651596098.
[I 2024-12-03 18:42:36,102] Trial 577 finished with value: 206.16123532005003 and parameters: {'kernel': 'sigmoid', 'C': 76.54111162475641, 'gamma': 0.015336948143337968, 'epsilon': 0.09131897233450817}. Best is trial 482 with value: 0.4491649651596098.
[I 2024-12-03 18:42:36,556] Trial 580 finished with value: 0.4721209848461176 and parameters: {'kernel': 'rbf', 'C': 95.97671734197965, 'gamma': 0.022100987712817658, 'epsilon': 0.048651520668877894}. Best is trial 482 with value: 0.4491649651596098.
[I 2024-12-03 18:42:36,639] Trial 566 finished with value: 0.5032419605530181 and parameters: {'kernel': 'rbf', 'C': 96.71667670124113, 'gamma': 0.00611636150452493, 'epsilon': 0.1684946271435064}. Best is trial 482 with value: 0.4491649651596098.
[I 2024-12-03 18:42:37,568] Trial 579 finished with value: 0.4754139164870968 and parameters: {'kernel': 'rbf', 'C': 96.24442020453944, 'gamma': 0.008666091441749128, 'epsilon': 0.015027930658662784}. Best is trial 482 with value: 0.4491649651596098.
[I 2024-12-03 18:42:39,311] Trial 584 finished with value: 0.4741302615027706 and parameters: {'kernel': 'rbf', 'C': 25.391776368263745, 'gamma': 0.017534233907076174, 'epsilon': 0.06857911498644227}. Best is trial 482 with value: 0.4491649651596098.
[I 2024-12-03 18:42:39,681] Trial 590 finished with value: 0.5880613622455028 and parameters: {'kernel': 'linear', 'C': 0.6742125346962584, 'gamma': 0.0002510950303792214, 'epsilon': 0.022725600793300667}. Best is trial 482 with value: 0.4491649651596098.
[I 2024-12-03 18:42:40,140] Trial 587 finished with value: 1.0729237062890244 and parameters: {'kernel': 'poly', 'C': 16.78433510602344, 'gamma': 0.0060802336067239645, 'epsilon': 0.050479528935750424}. Best is trial 482 with value: 0.4491649651596098.
[I 2024-12-03 18:42:40,184] Trial 583 finished with value: 0.5534656995246018 and parameters: {'kernel': 'linear', 'C': 24.884968705733456, 'gamma': 0.004963946201655993, 'epsilon': 0.012115432644017087}. Best is trial 482 with value: 0.4491649651596098.
[I 2024-12-03 18:42:40,509] Trial 565 finished with value: 0.5222351335751735 and parameters: {'kernel': 'rbf', 'C': 95.58491443348795, 'gamma': 0.003732685982726041, 'epsilon': 0.06922209279576753}. Best is trial 482 with value: 0.4491649651596098.
[I 2024-12-03 18:42:40,535] Trial 581 finished with value: 0.5233008148917369 and parameters: {'kernel': 'rbf', 'C': 19.26475555676067, 'gamma': 0.01102845274459629, 'epsilon': 0.04549599274637809}. Best is trial 482 with value: 0.4491649651596098.
[I 2024-12-03 18:42:40,906] Trial 586 finished with value: 0.4542270948402707 and parameters: {'kernel': 'rbf', 'C': 97.59671348764272, 'gamma': 0.013138483006094683, 'epsilon': 0.09528638151802361}. Best is trial 482 with value: 0.4491649651596098.
[I 2024-12-03 18:42:41,927] Trial 594 finished with value: 0.4622015335935944 and parameters: {'kernel': 'rbf', 'C': 84.83223861855232, 'gamma': 0.020445672740493595, 'epsilon': 0.053153807474225594}. Best is trial 482 with value: 0.4491649651596098.
[I 2024-12-03 18:42:42,208] Trial 602 finished with value: 0.47304000815240344 and parameters: {'kernel': 'rbf', 'C': 99.14258368415025, 'gamma': 0.008059915890812177, 'epsilon': 0.049245981433525404}. Best is trial 482 with value: 0.4491649651596098.
[I 2024-12-03 18:42:42,421] Trial 596 finished with value: 0.47555386999224675 and parameters: {'kernel': 'rbf', 'C': 97.33301118671503, 'gamma': 0.007821297816218334, 'epsilon': 0.06291266081732871}. Best is trial 482 with value: 0.4491649651596098.
[I 2024-12-03 18:42:42,495] Trial 582 finished with value: 0.49327027616184993 and parameters: {'kernel': 'rbf', 'C': 69.56363740388645, 'gamma': 0.019903049343414036, 'epsilon': 0.19378176832416244}. Best is trial 482 with value: 0.4491649651596098.
[I 2024-12-03 18:42:42,747] Trial 592 finished with value: 0.5230908175726015 and parameters: {'kernel': 'rbf', 'C': 14.550258836599655, 'gamma': 0.014199886005040038, 'epsilon': 0.1164156062442162}. Best is trial 482 with value: 0.4491649651596098.
[I 2024-12-03 18:42:42,977] Trial 600 finished with value: 0.47960174565888763 and parameters: {'kernel': 'rbf', 'C': 14.967815768173995, 'gamma': 0.022605120012522413, 'epsilon': 0.1503394147192621}. Best is trial 482 with value: 0.4491649651596098.
[I 2024-12-03 18:42:43,523] Trial 593 finished with value: 0.5481183542084119 and parameters: {'kernel': 'rbf', 'C': 96.09010842453732, 'gamma': 0.028543266211902386, 'epsilon': 0.20069100209129637}. Best is trial 482 with value: 0.4491649651596098.
[I 2024-12-03 18:42:43,915] Trial 603 finished with value: 0.493707850731657 and parameters: {'kernel': 'rbf', 'C': 15.013097729968518, 'gamma': 0.019358337745970556, 'epsilon': 0.11745054475873144}. Best is trial 482 with value: 0.4491649651596098.
[I 2024-12-03 18:42:44,123] Trial 606 finished with value: 0.5462958230832894 and parameters: {'kernel': 'rbf', 'C': 84.70296860036497, 'gamma': 0.00212971397458285, 'epsilon': 0.23681528586791276}. Best is trial 482 with value: 0.4491649651596098.
[I 2024-12-03 18:42:44,154] Trial 607 finished with value: 0.603772447746632 and parameters: {'kernel': 'rbf', 'C': 31.485259459641398, 'gamma': 0.15421925080956855, 'epsilon': 0.07071241233943203}. Best is trial 482 with value: 0.4491649651596098.
[I 2024-12-03 18:42:45,137] Trial 609 finished with value: 0.5068874343066225 and parameters: {'kernel': 'rbf', 'C': 16.271983185550233, 'gamma': 0.015962628760751763, 'epsilon': 0.02998964742211377}. Best is trial 482 with value: 0.4491649651596098.
[I 2024-12-03 18:42:45,321] Trial 599 finished with value: 0.5835424442148287 and parameters: {'kernel': 'rbf', 'C': 2.776458434656983, 'gamma': 0.0981875250254568, 'epsilon': 0.11261520571182787}. Best is trial 482 with value: 0.4491649651596098.
[I 2024-12-03 18:42:45,454] Trial 604 finished with value: 0.6001352402780422 and parameters: {'kernel': 'rbf', 'C': 91.63067682678088, 'gamma': 0.04713527717431707, 'epsilon': 0.06772593606280856}. Best is trial 482 with value: 0.4491649651596098.
[I 2024-12-03 18:42:45,537] Trial 595 finished with value: 0.45809155330708407 and parameters: {'kernel': 'rbf', 'C': 94.34522540670463, 'gamma': 0.017836245713993733, 'epsilon': 0.04797879760831884}. Best is trial 482 with value: 0.4491649651596098.
[I 2024-12-03 18:42:45,672] Trial 597 finished with value: 0.5701941581329362 and parameters: {'kernel': 'rbf', 'C': 22.007542571889985, 'gamma': 0.004136636150307862, 'epsilon': 0.07974990942137569}. Best is trial 482 with value: 0.4491649651596098.
[I 2024-12-03 18:42:45,674] Trial 601 finished with value: 0.4591003043246446 and parameters: {'kernel': 'rbf', 'C': 96.68424844265795, 'gamma': 0.010028686922955013, 'epsilon': 0.06996170095093794}. Best is trial 482 with value: 0.4491649651596098.
[I 2024-12-03 18:42:45,757] Trial 598 finished with value: 0.4619721453917899 and parameters: {'kernel': 'rbf', 'C': 93.60931371862732, 'gamma': 0.012056984899940906, 'epsilon': 0.12901325561400218}. Best is trial 482 with value: 0.4491649651596098.
[I 2024-12-03 18:42:46,205] Trial 585 finished with value: 0.6227165496685165 and parameters: {'kernel': 'rbf', 'C': 68.69068053729805, 'gamma': 0.02682941446837935, 'epsilon': 0.6825613332108844}. Best is trial 482 with value: 0.4491649651596098.
[I 2024-12-03 18:42:46,708] Trial 589 finished with value: 0.45238328465061844 and parameters: {'kernel': 'rbf', 'C': 88.39813663707575, 'gamma': 0.011469629005174044, 'epsilon': 0.07677548595086672}. Best is trial 482 with value: 0.4491649651596098.
[I 2024-12-03 18:42:46,718] Trial 608 finished with value: 0.9653605761759653 and parameters: {'kernel': 'rbf', 'C': 1.7934092132184118, 'gamma': 0.00033215735910163815, 'epsilon': 0.635419759924373}. Best is trial 482 with value: 0.4491649651596098.
[I 2024-12-03 18:42:47,100] Trial 614 finished with value: 0.5388622000501782 and parameters: {'kernel': 'rbf', 'C': 86.75629575118569, 'gamma': 0.026673747291876576, 'epsilon': 0.15032452866024398}. Best is trial 482 with value: 0.4491649651596098.
[I 2024-12-03 18:42:47,219] Trial 588 finished with value: 0.6962329429761357 and parameters: {'kernel': 'rbf', 'C': 1.0056782965708302, 'gamma': 0.0341587091482677, 'epsilon': 0.026792773353701515}. Best is trial 482 with value: 0.4491649651596098.
[I 2024-12-03 18:42:47,983] Trial 605 finished with value: 0.4867456569935674 and parameters: {'kernel': 'rbf', 'C': 16.687768069125482, 'gamma': 0.04192382815380768, 'epsilon': 0.07302221583972597}. Best is trial 482 with value: 0.4491649651596098.
[I 2024-12-03 18:42:47,994] Trial 613 finished with value: 0.4555985920279707 and parameters: {'kernel': 'rbf', 'C': 97.9545939189399, 'gamma': 0.015852617438577733, 'epsilon': 0.03991802087334226}. Best is trial 482 with value: 0.4491649651596098.
[I 2024-12-03 18:42:48,006] Trial 610 finished with value: 0.4910837460587685 and parameters: {'kernel': 'rbf', 'C': 94.73346361893776, 'gamma': 0.006998904897995922, 'epsilon': 0.1465439374609664}. Best is trial 482 with value: 0.4491649651596098.
[I 2024-12-03 18:42:49,118] Trial 615 finished with value: 0.5485460333636719 and parameters: {'kernel': 'rbf', 'C': 22.28223769675089, 'gamma': 0.0063685810502372535, 'epsilon': 0.1087248799819441}. Best is trial 482 with value: 0.4491649651596098.
[I 2024-12-03 18:42:49,471] Trial 617 finished with value: 0.5495576323876201 and parameters: {'kernel': 'rbf', 'C': 85.89739504584736, 'gamma': 0.002991165529983246, 'epsilon': 0.08946073639568831}. Best is trial 482 with value: 0.4491649651596098.
[I 2024-12-03 18:42:49,797] Trial 618 finished with value: 0.6318391024005361 and parameters: {'kernel': 'rbf', 'C': 94.95912707239093, 'gamma': 0.06872262096712245, 'epsilon': 0.10476574573257906}. Best is trial 482 with value: 0.4491649651596098.
[I 2024-12-03 18:42:50,157] Trial 611 finished with value: 1.060413191581427 and parameters: {'kernel': 'poly', 'C': 1.8673813302190974, 'gamma': 0.3797350746590305, 'epsilon': 0.22521885315011045}. Best is trial 482 with value: 0.4491649651596098.
[I 2024-12-03 18:42:50,627] Trial 612 finished with value: 0.8764593988752106 and parameters: {'kernel': 'linear', 'C': 0.0019447494526741618, 'gamma': 0.05128592992242943, 'epsilon': 0.34130513894893366}. Best is trial 482 with value: 0.4491649651596098.
[I 2024-12-03 18:42:51,995] Trial 619 finished with value: 1.356994534281468 and parameters: {'kernel': 'sigmoid', 'C': 0.003215094900303616, 'gamma': 0.010786183418485917, 'epsilon': 0.019674921956847686}. Best is trial 482 with value: 0.4491649651596098.
[I 2024-12-03 18:42:52,473] Trial 625 finished with value: 0.5717359048989245 and parameters: {'kernel': 'rbf', 'C': 10.417067271876572, 'gamma': 0.007582521157394776, 'epsilon': 0.22605052413442725}. Best is trial 482 with value: 0.4491649651596098.
[I 2024-12-03 18:42:52,474] Trial 624 finished with value: 1.371096423113565 and parameters: {'kernel': 'rbf', 'C': 0.001840342208870945, 'gamma': 0.9051655893328924, 'epsilon': 0.016226817712812786}. Best is trial 482 with value: 0.4491649651596098.
[I 2024-12-03 18:42:52,478] Trial 626 finished with value: 0.4960335622769815 and parameters: {'kernel': 'rbf', 'C': 96.98850954620886, 'gamma': 0.023197958940018304, 'epsilon': 0.08741815939620935}. Best is trial 482 with value: 0.4491649651596098.
[I 2024-12-03 18:42:53,069] Trial 623 finished with value: 0.5585671797033277 and parameters: {'kernel': 'rbf', 'C': 37.351494632937026, 'gamma': 0.007922307935311925, 'epsilon': 0.28749163798883626}. Best is trial 482 with value: 0.4491649651596098.
[I 2024-12-03 18:42:53,229] Trial 630 finished with value: 0.5732262347836014 and parameters: {'kernel': 'rbf', 'C': 19.247726329277217, 'gamma': 0.004435834796177987, 'epsilon': 0.08511093388763949}. Best is trial 482 with value: 0.4491649651596098.
[I 2024-12-03 18:42:53,955] Trial 620 finished with value: 0.6047412443095828 and parameters: {'kernel': 'rbf', 'C': 24.135060927071404, 'gamma': 0.002477335154063134, 'epsilon': 0.03617521765292448}. Best is trial 482 with value: 0.4491649651596098.
[I 2024-12-03 18:42:54,300] Trial 631 finished with value: 0.4731625957549105 and parameters: {'kernel': 'rbf', 'C': 85.91023541295765, 'gamma': 0.008554359839589373, 'epsilon': 0.1060169028002674}. Best is trial 482 with value: 0.4491649651596098.
[I 2024-12-03 18:42:54,301] Trial 635 finished with value: 277.2209574672884 and parameters: {'kernel': 'sigmoid', 'C': 25.945689886505992, 'gamma': 0.8032070522535742, 'epsilon': 0.1903225329910997}. Best is trial 482 with value: 0.4491649651596098.
[I 2024-12-03 18:42:54,305] Trial 621 finished with value: 0.5014042699616139 and parameters: {'kernel': 'rbf', 'C': 95.48281527642528, 'gamma': 0.026316509099357708, 'epsilon': 0.060971038205524415}. Best is trial 482 with value: 0.4491649651596098.
[I 2024-12-03 18:42:55,164] Trial 622 finished with value: 0.6386264903571883 and parameters: {'kernel': 'linear', 'C': 0.0851576463324291, 'gamma': 0.4212186799465424, 'epsilon': 0.7947612279186459}. Best is trial 482 with value: 0.4491649651596098.
[I 2024-12-03 18:42:55,231] Trial 629 finished with value: 0.4501012859920266 and parameters: {'kernel': 'rbf', 'C': 87.8118865206316, 'gamma': 0.012232634933267185, 'epsilon': 0.07391694063240539}. Best is trial 482 with value: 0.4491649651596098.
[I 2024-12-03 18:42:55,488] Trial 627 finished with value: 0.5381730472496793 and parameters: {'kernel': 'rbf', 'C': 13.177208303189866, 'gamma': 0.011427394611354889, 'epsilon': 0.10714448858596687}. Best is trial 482 with value: 0.4491649651596098.
[I 2024-12-03 18:42:55,580] Trial 637 finished with value: 0.47186662753205133 and parameters: {'kernel': 'rbf', 'C': 81.6780343548765, 'gamma': 0.011610013688860622, 'epsilon': 0.17211919319514432}. Best is trial 482 with value: 0.4491649651596098.
[I 2024-12-03 18:42:55,806] Trial 639 finished with value: 21.5361909329347 and parameters: {'kernel': 'sigmoid', 'C': 12.719353296319676, 'gamma': 0.011676800079811778, 'epsilon': 0.06687320270871011}. Best is trial 482 with value: 0.4491649651596098.
[I 2024-12-03 18:42:55,808] Trial 643 finished with value: 63.782248876684804 and parameters: {'kernel': 'sigmoid', 'C': 58.58846521007762, 'gamma': 0.00893699858193972, 'epsilon': 0.012635328359709484}. Best is trial 482 with value: 0.4491649651596098.
[I 2024-12-03 18:42:56,104] Trial 628 finished with value: 0.6257998936450458 and parameters: {'kernel': 'rbf', 'C': 97.52283044619185, 'gamma': 0.047203081195552984, 'epsilon': 0.14214079073659783}. Best is trial 482 with value: 0.4491649651596098.
[I 2024-12-03 18:42:56,269] Trial 632 finished with value: 0.45702430893884843 and parameters: {'kernel': 'rbf', 'C': 98.34606223276764, 'gamma': 0.01209727016380185, 'epsilon': 0.03538469167298485}. Best is trial 482 with value: 0.4491649651596098.
[I 2024-12-03 18:42:56,851] Trial 641 finished with value: 0.5523201626057928 and parameters: {'kernel': 'rbf', 'C': 86.46459366729565, 'gamma': 0.03423418453282401, 'epsilon': 0.12314212073648166}. Best is trial 482 with value: 0.4491649651596098.
[I 2024-12-03 18:42:57,072] Trial 633 finished with value: 0.4753835212539337 and parameters: {'kernel': 'rbf', 'C': 13.698410709810291, 'gamma': 0.03290945077925837, 'epsilon': 0.03102935224538197}. Best is trial 482 with value: 0.4491649651596098.
[I 2024-12-03 18:42:57,104] Trial 638 finished with value: 0.4512808074328456 and parameters: {'kernel': 'rbf', 'C': 96.5271188871034, 'gamma': 0.012349751037473464, 'epsilon': 0.09439216135114872}. Best is trial 482 with value: 0.4491649651596098.
[I 2024-12-03 18:42:57,712] Trial 616 finished with value: 0.5003679427160119 and parameters: {'kernel': 'rbf', 'C': 95.92012962895294, 'gamma': 0.004868280251536242, 'epsilon': 0.0801168544119951}. Best is trial 482 with value: 0.4491649651596098.
[I 2024-12-03 18:42:57,894] Trial 591 finished with value: 1.1719660209589025 and parameters: {'kernel': 'poly', 'C': 5.949004264769454, 'gamma': 0.3530950820630138, 'epsilon': 0.0013701867693911242}. Best is trial 482 with value: 0.4491649651596098.
[I 2024-12-03 18:42:57,914] Trial 634 finished with value: 0.4682439978728008 and parameters: {'kernel': 'rbf', 'C': 85.74116534278082, 'gamma': 0.009053866442274204, 'epsilon': 0.12663493738170134}. Best is trial 482 with value: 0.4491649651596098.
[I 2024-12-03 18:42:58,080] Trial 647 finished with value: 0.5585999680765045 and parameters: {'kernel': 'rbf', 'C': 99.90722718369439, 'gamma': 0.0017527156649106207, 'epsilon': 0.12193962918030408}. Best is trial 482 with value: 0.4491649651596098.
[I 2024-12-03 18:42:58,282] Trial 645 finished with value: 0.4564228080321281 and parameters: {'kernel': 'rbf', 'C': 89.03447995531144, 'gamma': 0.013365404584897345, 'epsilon': 0.10659128364093018}. Best is trial 482 with value: 0.4491649651596098.
[I 2024-12-03 18:42:58,346] Trial 636 finished with value: 0.473586746703016 and parameters: {'kernel': 'rbf', 'C': 19.67148417431957, 'gamma': 0.023762952589656782, 'epsilon': 0.07132972192051465}. Best is trial 482 with value: 0.4491649651596098.
[I 2024-12-03 18:42:58,788] Trial 642 finished with value: 0.5866999295753915 and parameters: {'kernel': 'rbf', 'C': 92.65571701956111, 'gamma': 0.04081873517317257, 'epsilon': 0.1600876837950258}. Best is trial 482 with value: 0.4491649651596098.
[I 2024-12-03 18:42:59,191] Trial 640 finished with value: 0.5028774809002239 and parameters: {'kernel': 'rbf', 'C': 96.08862381167053, 'gamma': 0.006843485330751495, 'epsilon': 0.18311509318809996}. Best is trial 482 with value: 0.4491649651596098.
[I 2024-12-03 18:43:00,025] Trial 644 finished with value: 0.5677906711460485 and parameters: {'kernel': 'rbf', 'C': 16.760547822573717, 'gamma': 0.005355534843317254, 'epsilon': 0.06921894901501131}. Best is trial 482 with value: 0.4491649651596098.
[I 2024-12-03 18:43:00,852] Trial 649 finished with value: 669.8988000761271 and parameters: {'kernel': 'sigmoid', 'C': 78.76412418560838, 'gamma': 0.06901742207961713, 'epsilon': 0.04532151045952425}. Best is trial 482 with value: 0.4491649651596098.
[I 2024-12-03 18:43:00,888] Trial 654 finished with value: 0.4792938143016882 and parameters: {'kernel': 'rbf', 'C': 17.537453316502447, 'gamma': 0.0331550039760424, 'epsilon': 0.09506159164777991}. Best is trial 482 with value: 0.4491649651596098.
[I 2024-12-03 18:43:01,284] Trial 651 finished with value: 0.662772158844587 and parameters: {'kernel': 'rbf', 'C': 98.5698904908161, 'gamma': 0.06591183940966817, 'epsilon': 0.04730133279895705}. Best is trial 482 with value: 0.4491649651596098.
[I 2024-12-03 18:43:01,295] Trial 650 finished with value: 0.5008540339526737 and parameters: {'kernel': 'rbf', 'C': 27.81785519550894, 'gamma': 0.01142280927761181, 'epsilon': 0.04633156864919568}. Best is trial 482 with value: 0.4491649651596098.
[I 2024-12-03 18:43:01,575] Trial 653 finished with value: 0.8158423141170934 and parameters: {'kernel': 'poly', 'C': 0.044231051308503244, 'gamma': 0.3768162040910139, 'epsilon': 0.006585756683144316}. Best is trial 482 with value: 0.4491649651596098.
[I 2024-12-03 18:43:01,668] Trial 646 finished with value: 0.6050635517048192 and parameters: {'kernel': 'rbf', 'C': 99.45450390690755, 'gamma': 0.1321396473413867, 'epsilon': 0.0427283469638125}. Best is trial 482 with value: 0.4491649651596098.
[I 2024-12-03 18:43:01,677] Trial 655 finished with value: 0.8381897720132917 and parameters: {'kernel': 'poly', 'C': 95.34717643311828, 'gamma': 0.012278264279628576, 'epsilon': 0.07427787143382619}. Best is trial 482 with value: 0.4491649651596098.
[I 2024-12-03 18:43:02,044] Trial 648 finished with value: 0.49247164160705176 and parameters: {'kernel': 'rbf', 'C': 14.896022707754856, 'gamma': 0.019604661204410803, 'epsilon': 0.1459466857360938}. Best is trial 482 with value: 0.4491649651596098.
[I 2024-12-03 18:43:03,363] Trial 665 finished with value: 0.6474790341204016 and parameters: {'kernel': 'linear', 'C': 3.4817149598191612, 'gamma': 0.06152520558929892, 'epsilon': 0.8158983012049926}. Best is trial 482 with value: 0.4491649651596098.
[I 2024-12-03 18:43:04,679] Trial 670 finished with value: 0.5311858286708333 and parameters: {'kernel': 'rbf', 'C': 11.519210090739008, 'gamma': 0.014553057777322468, 'epsilon': 0.03737016233225746}. Best is trial 482 with value: 0.4491649651596098.
[I 2024-12-03 18:43:05,153] Trial 660 finished with value: 0.5262782532810821 and parameters: {'kernel': 'rbf', 'C': 12.762783728216316, 'gamma': 0.014272378702823598, 'epsilon': 0.08452300111901893}. Best is trial 482 with value: 0.4491649651596098.
[I 2024-12-03 18:43:05,181] Trial 661 finished with value: 0.5307117295336438 and parameters: {'kernel': 'rbf', 'C': 96.14636161825881, 'gamma': 0.003389412032468616, 'epsilon': 0.07119646902827385}. Best is trial 482 with value: 0.4491649651596098.
[I 2024-12-03 18:43:05,182] Trial 657 finished with value: 0.4865546956983776 and parameters: {'kernel': 'rbf', 'C': 23.208350293406298, 'gamma': 0.014839538166485556, 'epsilon': 0.05742836472506688}. Best is trial 482 with value: 0.4491649651596098.
[I 2024-12-03 18:43:05,334] Trial 658 finished with value: 0.45813188137277655 and parameters: {'kernel': 'rbf', 'C': 89.02649106582372, 'gamma': 0.018504386658845674, 'epsilon': 0.0718694211509345}. Best is trial 482 with value: 0.4491649651596098.
