[I 2024-12-04 12:02:47,389] Trial 1700 finished with value: 1.0807998923483113 and parameters: {'max_depth': 26, 'min_samples_split': 7, 'min_samples_leaf': 3, 'max_features': 'sqrt', 'criterion': 'squared_error', 'splitter': 'best'}. Best is trial 245 with value: 0.5517975516810654.
[I 2024-12-04 12:02:47,410] Trial 1699 finished with value: 0.6018386975242761 and parameters: {'max_depth': 23, 'min_samples_split': 15, 'min_samples_leaf': 1, 'max_features': 'sqrt', 'criterion': 'friedman_mse', 'splitter': 'best'}. Best is trial 245 with value: 0.5517975516810654.
[I 2024-12-04 12:02:47,419] Trial 1704 finished with value: 1.0874428099108078 and parameters: {'max_depth': 26, 'min_samples_split': 11, 'min_samples_leaf': 10, 'max_features': 'sqrt', 'criterion': 'friedman_mse', 'splitter': 'best'}. Best is trial 245 with value: 0.5517975516810654.
[I 2024-12-04 12:02:47,445] Trial 1697 finished with value: 0.5517975516810654 and parameters: {'max_depth': 29, 'min_samples_split': 17, 'min_samples_leaf': 1, 'max_features': 'sqrt', 'criterion': 'squared_error', 'splitter': 'best'}. Best is trial 245 with value: 0.5517975516810654.
[I 2024-12-04 12:02:47,447] Trial 1682 finished with value: 1.0746652081803512 and parameters: {'max_depth': 24, 'min_samples_split': 18, 'min_samples_leaf': 3, 'max_features': 'sqrt', 'criterion': 'squared_error', 'splitter': 'best'}. Best is trial 245 with value: 0.5517975516810654.
[I 2024-12-04 12:02:47,550] Trial 1681 finished with value: 1.185650275657291 and parameters: {'max_depth': 12, 'min_samples_split': 19, 'min_samples_leaf': 1, 'max_features': 'log2', 'criterion': 'squared_error', 'splitter': 'random'}. Best is trial 245 with value: 0.5517975516810654.
[I 2024-12-04 12:02:47,603] Trial 1689 finished with value: 1.085029928131974 and parameters: {'max_depth': 2, 'min_samples_split': 10, 'min_samples_leaf': 1, 'max_features': 'sqrt', 'criterion': 'friedman_mse', 'splitter': 'best'}. Best is trial 245 with value: 0.5517975516810654.
[I 2024-12-04 12:02:47,972] Trial 1695 finished with value: 0.5877723420587634 and parameters: {'max_depth': 25, 'min_samples_split': 15, 'min_samples_leaf': 1, 'max_features': 'sqrt', 'criterion': 'friedman_mse', 'splitter': 'best'}. Best is trial 245 with value: 0.5517975516810654.
[I 2024-12-04 12:02:48,112] Trial 1701 finished with value: 0.5712745326408165 and parameters: {'max_depth': 29, 'min_samples_split': 12, 'min_samples_leaf': 1, 'max_features': 'sqrt', 'criterion': 'squared_error', 'splitter': 'best'}. Best is trial 245 with value: 0.5517975516810654.
[I 2024-12-04 12:02:48,708] Trial 1691 finished with value: 1.2387090204317202 and parameters: {'max_depth': 29, 'min_samples_split': 16, 'min_samples_leaf': 3, 'max_features': 'sqrt', 'criterion': 'squared_error', 'splitter': 'random'}. Best is trial 245 with value: 0.5517975516810654.
[I 2024-12-04 12:02:49,079] Trial 1698 finished with value: 0.5856844165343162 and parameters: {'max_depth': 28, 'min_samples_split': 18, 'min_samples_leaf': 1, 'max_features': 'sqrt', 'criterion': 'squared_error', 'splitter': 'best'}. Best is trial 245 with value: 0.5517975516810654.
[I 2024-12-04 12:02:49,111] Trial 1690 finished with value: 0.5945975836542683 and parameters: {'max_depth': 28, 'min_samples_split': 19, 'min_samples_leaf': 2, 'max_features': 'sqrt', 'criterion': 'squared_error', 'splitter': 'best'}. Best is trial 245 with value: 0.5517975516810654.
[I 2024-12-04 12:02:51,320] Trial 1708 finished with value: 1.259809444253076 and parameters: {'max_depth': 15, 'min_samples_split': 20, 'min_samples_leaf': 6, 'max_features': 'sqrt', 'criterion': 'squared_error', 'splitter': 'random'}. Best is trial 245 with value: 0.5517975516810654.
[I 2024-12-04 12:02:52,513] Trial 1710 finished with value: 0.5945975836542683 and parameters: {'max_depth': 26, 'min_samples_split': 18, 'min_samples_leaf': 2, 'max_features': 'sqrt', 'criterion': 'squared_error', 'splitter': 'best'}. Best is trial 245 with value: 0.5517975516810654.
[I 2024-12-04 12:02:52,705] Trial 1705 finished with value: 1.3737845361400185 and parameters: {'max_depth': 24, 'min_samples_split': 15, 'min_samples_leaf': 10, 'max_features': 'log2', 'criterion': 'absolute_error', 'splitter': 'random'}. Best is trial 245 with value: 0.5517975516810654.
[I 2024-12-04 12:02:52,726] Trial 1707 finished with value: 0.58952069790992 and parameters: {'max_depth': 25, 'min_samples_split': 20, 'min_samples_leaf': 1, 'max_features': 'sqrt', 'criterion': 'squared_error', 'splitter': 'best'}. Best is trial 245 with value: 0.5517975516810654.
[I 2024-12-04 12:02:53,934] Trial 1714 finished with value: 0.5840920196378592 and parameters: {'max_depth': 25, 'min_samples_split': 13, 'min_samples_leaf': 1, 'max_features': 'sqrt', 'criterion': 'friedman_mse', 'splitter': 'best'}. Best is trial 245 with value: 0.5517975516810654.
[I 2024-12-04 12:02:53,937] Trial 1717 finished with value: 1.0746652081803512 and parameters: {'max_depth': 22, 'min_samples_split': 16, 'min_samples_leaf': 3, 'max_features': 'sqrt', 'criterion': 'squared_error', 'splitter': 'best'}. Best is trial 245 with value: 0.5517975516810654.
[I 2024-12-04 12:02:54,105] Trial 1706 finished with value: 0.5854261816964598 and parameters: {'max_depth': 28, 'min_samples_split': 20, 'min_samples_leaf': 1, 'max_features': 'sqrt', 'criterion': 'friedman_mse', 'splitter': 'best'}. Best is trial 245 with value: 0.5517975516810654.
[I 2024-12-04 12:02:54,268] Trial 1711 finished with value: 1.261454797635251 and parameters: {'max_depth': 26, 'min_samples_split': 3, 'min_samples_leaf': 4, 'max_features': 'log2', 'criterion': 'friedman_mse', 'splitter': 'random'}. Best is trial 245 with value: 0.5517975516810654.
[I 2024-12-04 12:02:54,490] Trial 1709 finished with value: 0.6018386975242761 and parameters: {'max_depth': 23, 'min_samples_split': 15, 'min_samples_leaf': 1, 'max_features': 'sqrt', 'criterion': 'squared_error', 'splitter': 'best'}. Best is trial 245 with value: 0.5517975516810654.
[I 2024-12-04 12:02:56,713] Trial 1724 finished with value: 1.0746652081803512 and parameters: {'max_depth': 24, 'min_samples_split': 17, 'min_samples_leaf': 3, 'max_features': 'sqrt', 'criterion': 'friedman_mse', 'splitter': 'best'}. Best is trial 245 with value: 0.5517975516810654.
[I 2024-12-04 12:02:57,620] Trial 1715 finished with value: 0.5638995247461974 and parameters: {'max_depth': 29, 'min_samples_split': 19, 'min_samples_leaf': 1, 'max_features': 'sqrt', 'criterion': 'squared_error', 'splitter': 'best'}. Best is trial 245 with value: 0.5517975516810654.
[I 2024-12-04 12:02:58,205] Trial 1721 finished with value: 0.9453894198302558 and parameters: {'max_depth': 26, 'min_samples_split': 16, 'min_samples_leaf': 1, 'max_features': 'sqrt', 'criterion': 'absolute_error', 'splitter': 'best'}. Best is trial 245 with value: 0.5517975516810654.
[I 2024-12-04 12:02:58,622] Trial 1712 finished with value: 1.0746652081803512 and parameters: {'max_depth': 30, 'min_samples_split': 9, 'min_samples_leaf': 3, 'max_features': 'sqrt', 'criterion': 'friedman_mse', 'splitter': 'best'}. Best is trial 245 with value: 0.5517975516810654.
[I 2024-12-04 12:02:58,892] Trial 1728 finished with value: 0.6033893981188482 and parameters: {'max_depth': 27, 'min_samples_split': 16, 'min_samples_leaf': 1, 'max_features': 'sqrt', 'criterion': 'squared_error', 'splitter': 'best'}. Best is trial 245 with value: 0.5517975516810654.
[I 2024-12-04 12:02:59,065] Trial 1731 finished with value: 1.261454797635251 and parameters: {'max_depth': 16, 'min_samples_split': 16, 'min_samples_leaf': 9, 'max_features': 'log2', 'criterion': 'squared_error', 'splitter': 'random'}. Best is trial 245 with value: 0.5517975516810654.
[I 2024-12-04 12:02:59,235] Trial 1722 finished with value: 0.670646030416925 and parameters: {'max_depth': 26, 'min_samples_split': 6, 'min_samples_leaf': 1, 'max_features': 'sqrt', 'criterion': 'friedman_mse', 'splitter': 'best'}. Best is trial 245 with value: 0.5517975516810654.
[I 2024-12-04 12:02:59,238] Trial 1720 finished with value: 1.2162526878214968 and parameters: {'max_depth': 21, 'min_samples_split': 10, 'min_samples_leaf': 1, 'max_features': 'log2', 'criterion': 'squared_error', 'splitter': 'random'}. Best is trial 245 with value: 0.5517975516810654.
[I 2024-12-04 12:02:59,657] Trial 1732 finished with value: 1.261454797635251 and parameters: {'max_depth': 35, 'min_samples_split': 10, 'min_samples_leaf': 4, 'max_features': 'log2', 'criterion': 'friedman_mse', 'splitter': 'random'}. Best is trial 245 with value: 0.5517975516810654.
[I 2024-12-04 12:03:00,036] Trial 1734 finished with value: 1.259809444253076 and parameters: {'max_depth': 33, 'min_samples_split': 5, 'min_samples_leaf': 8, 'max_features': 'sqrt', 'criterion': 'squared_error', 'splitter': 'random'}. Best is trial 245 with value: 0.5517975516810654.
[I 2024-12-04 12:03:00,190] Trial 1716 finished with value: 0.5886826765578131 and parameters: {'max_depth': 18, 'min_samples_split': 8, 'min_samples_leaf': 1, 'max_features': 'sqrt', 'criterion': 'friedman_mse', 'splitter': 'best'}. Best is trial 245 with value: 0.5517975516810654.
[I 2024-12-04 12:03:00,617] Trial 1725 finished with value: 0.5619094132389268 and parameters: {'max_depth': 29, 'min_samples_split': 18, 'min_samples_leaf': 1, 'max_features': 'sqrt', 'criterion': 'squared_error', 'splitter': 'best'}. Best is trial 245 with value: 0.5517975516810654.
[I 2024-12-04 12:03:01,341] Trial 1718 finished with value: 1.0746652081803512 and parameters: {'max_depth': 26, 'min_samples_split': 17, 'min_samples_leaf': 3, 'max_features': 'sqrt', 'criterion': 'friedman_mse', 'splitter': 'best'}. Best is trial 245 with value: 0.5517975516810654.
[I 2024-12-04 12:03:01,597] Trial 1726 finished with value: 0.5945975836542683 and parameters: {'max_depth': 27, 'min_samples_split': 18, 'min_samples_leaf': 2, 'max_features': 'sqrt', 'criterion': 'friedman_mse', 'splitter': 'best'}. Best is trial 245 with value: 0.5517975516810654.
[I 2024-12-04 12:03:01,599] Trial 1727 finished with value: 0.9424778759919019 and parameters: {'max_depth': 10, 'min_samples_split': 17, 'min_samples_leaf': 3, 'max_features': 'log2', 'criterion': 'friedman_mse', 'splitter': 'best'}. Best is trial 245 with value: 0.5517975516810654.
[I 2024-12-04 12:03:01,794] Trial 1713 finished with value: 1.261454797635251 and parameters: {'max_depth': 17, 'min_samples_split': 17, 'min_samples_leaf': 10, 'max_features': 'log2', 'criterion': 'squared_error', 'splitter': 'random'}. Best is trial 245 with value: 0.5517975516810654.
[I 2024-12-04 12:03:02,058] Trial 1719 finished with value: 0.5932995079316209 and parameters: {'max_depth': 28, 'min_samples_split': 13, 'min_samples_leaf': 2, 'max_features': 'sqrt', 'criterion': 'friedman_mse', 'splitter': 'best'}. Best is trial 245 with value: 0.5517975516810654.
[I 2024-12-04 12:03:02,917] Trial 1733 finished with value: 0.9498699969907309 and parameters: {'max_depth': 19, 'min_samples_split': 16, 'min_samples_leaf': 1, 'max_features': 'sqrt', 'criterion': 'squared_error', 'splitter': 'random'}. Best is trial 245 with value: 0.5517975516810654.
[I 2024-12-04 12:03:03,156] Trial 1735 finished with value: 0.7308152954782433 and parameters: {'max_depth': 31, 'min_samples_split': 3, 'min_samples_leaf': 1, 'max_features': 'sqrt', 'criterion': 'absolute_error', 'splitter': 'best'}. Best is trial 245 with value: 0.5517975516810654.
[I 2024-12-04 12:03:03,296] Trial 1729 finished with value: 0.5986847411989119 and parameters: {'max_depth': 27, 'min_samples_split': 10, 'min_samples_leaf': 1, 'max_features': 'sqrt', 'criterion': 'friedman_mse', 'splitter': 'best'}. Best is trial 245 with value: 0.5517975516810654.
[I 2024-12-04 12:03:03,432] Trial 1736 finished with value: 1.0746652081803512 and parameters: {'max_depth': 24, 'min_samples_split': 16, 'min_samples_leaf': 3, 'max_features': 'sqrt', 'criterion': 'squared_error', 'splitter': 'best'}. Best is trial 245 with value: 0.5517975516810654.
[I 2024-12-04 12:03:03,527] Trial 1737 finished with value: 0.5957889156966119 and parameters: {'max_depth': 26, 'min_samples_split': 17, 'min_samples_leaf': 1, 'max_features': 'sqrt', 'criterion': 'squared_error', 'splitter': 'best'}. Best is trial 245 with value: 0.5517975516810654.
[I 2024-12-04 12:03:04,804] Trial 1739 finished with value: 0.5957889156966119 and parameters: {'max_depth': 26, 'min_samples_split': 17, 'min_samples_leaf': 1, 'max_features': 'sqrt', 'criterion': 'squared_error', 'splitter': 'best'}. Best is trial 245 with value: 0.5517975516810654.
[I 2024-12-04 12:03:05,824] Trial 1723 finished with value: 0.6018386975242761 and parameters: {'max_depth': 23, 'min_samples_split': 15, 'min_samples_leaf': 1, 'max_features': 'sqrt', 'criterion': 'friedman_mse', 'splitter': 'best'}. Best is trial 245 with value: 0.5517975516810654.
[I 2024-12-04 12:03:05,971] Trial 1741 finished with value: 0.5743856205068374 and parameters: {'max_depth': 27, 'min_samples_split': 17, 'min_samples_leaf': 1, 'max_features': 'sqrt', 'criterion': 'friedman_mse', 'splitter': 'best'}. Best is trial 245 with value: 0.5517975516810654.
[I 2024-12-04 12:03:06,171] Trial 1742 finished with value: 1.0746652081803512 and parameters: {'max_depth': 28, 'min_samples_split': 13, 'min_samples_leaf': 3, 'max_features': 'sqrt', 'criterion': 'friedman_mse', 'splitter': 'best'}. Best is trial 245 with value: 0.5517975516810654.
[I 2024-12-04 12:03:06,380] Trial 1738 finished with value: 0.6537865628525096 and parameters: {'max_depth': 29, 'min_samples_split': 13, 'min_samples_leaf': 1, 'max_features': 'sqrt', 'criterion': 'friedman_mse', 'splitter': 'best'}. Best is trial 245 with value: 0.5517975516810654.
[I 2024-12-04 12:03:06,641] Trial 1743 finished with value: 0.558420287135432 and parameters: {'max_depth': 27, 'min_samples_split': 11, 'min_samples_leaf': 1, 'max_features': 'sqrt', 'criterion': 'squared_error', 'splitter': 'best'}. Best is trial 245 with value: 0.5517975516810654.
[I 2024-12-04 12:03:07,090] Trial 1744 finished with value: 0.5860539268492149 and parameters: {'max_depth': 24, 'min_samples_split': 15, 'min_samples_leaf': 1, 'max_features': 'sqrt', 'criterion': 'friedman_mse', 'splitter': 'best'}. Best is trial 245 with value: 0.5517975516810654.
[I 2024-12-04 12:03:07,276] Trial 1745 finished with value: 0.5800554303398895 and parameters: {'max_depth': 26, 'min_samples_split': 19, 'min_samples_leaf': 1, 'max_features': 'sqrt', 'criterion': 'friedman_mse', 'splitter': 'best'}. Best is trial 245 with value: 0.5517975516810654.
[I 2024-12-04 12:03:07,527] Trial 1740 finished with value: 1.0746652081803512 and parameters: {'max_depth': 28, 'min_samples_split': 14, 'min_samples_leaf': 3, 'max_features': 'sqrt', 'criterion': 'squared_error', 'splitter': 'best'}. Best is trial 245 with value: 0.5517975516810654.
[I 2024-12-04 12:03:07,528] Trial 1730 finished with value: 1.0746652081803512 and parameters: {'max_depth': 29, 'min_samples_split': 20, 'min_samples_leaf': 3, 'max_features': 'sqrt', 'criterion': 'squared_error', 'splitter': 'best'}. Best is trial 245 with value: 0.5517975516810654.
[I 2024-12-04 12:03:08,348] Trial 1751 finished with value: 0.5931811383733339 and parameters: {'max_depth': 29, 'min_samples_split': 12, 'min_samples_leaf': 2, 'max_features': 'sqrt', 'criterion': 'squared_error', 'splitter': 'best'}. Best is trial 245 with value: 0.5517975516810654.
[I 2024-12-04 12:03:08,588] Trial 1753 finished with value: 1.008090857131291 and parameters: {'max_depth': 30, 'min_samples_split': 12, 'min_samples_leaf': 3, 'max_features': 'log2', 'criterion': 'absolute_error', 'splitter': 'best'}. Best is trial 245 with value: 0.5517975516810654.
[I 2024-12-04 12:03:08,991] Trial 1747 finished with value: 0.5994775415082588 and parameters: {'max_depth': 21, 'min_samples_split': 12, 'min_samples_leaf': 1, 'max_features': 'sqrt', 'criterion': 'squared_error', 'splitter': 'best'}. Best is trial 245 with value: 0.5517975516810654.
[I 2024-12-04 12:03:09,193] Trial 1749 finished with value: 0.5803899068012356 and parameters: {'max_depth': 27, 'min_samples_split': 19, 'min_samples_leaf': 1, 'max_features': 'sqrt', 'criterion': 'friedman_mse', 'splitter': 'best'}. Best is trial 245 with value: 0.5517975516810654.
[I 2024-12-04 12:03:10,088] Trial 1746 finished with value: 1.0746652081803512 and parameters: {'max_depth': 28, 'min_samples_split': 13, 'min_samples_leaf': 3, 'max_features': 'sqrt', 'criterion': 'squared_error', 'splitter': 'best'}. Best is trial 245 with value: 0.5517975516810654.
[I 2024-12-04 12:03:11,171] Trial 1752 finished with value: 0.7241530015591718 and parameters: {'max_depth': 25, 'min_samples_split': 9, 'min_samples_leaf': 1, 'max_features': 'sqrt', 'criterion': 'squared_error', 'splitter': 'best'}. Best is trial 245 with value: 0.5517975516810654.
[I 2024-12-04 12:03:11,655] Trial 1755 finished with value: 0.5827867495611898 and parameters: {'max_depth': 30, 'min_samples_split': 7, 'min_samples_leaf': 1, 'max_features': 'sqrt', 'criterion': 'squared_error', 'splitter': 'best'}. Best is trial 245 with value: 0.5517975516810654.
[I 2024-12-04 12:03:11,827] Trial 1750 finished with value: 0.5663394808801311 and parameters: {'max_depth': 26, 'min_samples_split': 13, 'min_samples_leaf': 1, 'max_features': 'sqrt', 'criterion': 'squared_error', 'splitter': 'best'}. Best is trial 245 with value: 0.5517975516810654.
[I 2024-12-04 12:03:11,973] Trial 1763 finished with value: 0.7500556563147068 and parameters: {'max_depth': 31, 'min_samples_split': 4, 'min_samples_leaf': 1, 'max_features': 'log2', 'criterion': 'friedman_mse', 'splitter': 'best'}. Best is trial 245 with value: 0.5517975516810654.
[I 2024-12-04 12:03:13,295] Trial 1754 finished with value: 0.6070130528002383 and parameters: {'max_depth': 30, 'min_samples_split': 10, 'min_samples_leaf': 1, 'max_features': 'sqrt', 'criterion': 'squared_error', 'splitter': 'best'}. Best is trial 245 with value: 0.5517975516810654.
[I 2024-12-04 12:03:14,076] Trial 1759 finished with value: 0.6482805331741939 and parameters: {'max_depth': 22, 'min_samples_split': 10, 'min_samples_leaf': 1, 'max_features': 'sqrt', 'criterion': 'squared_error', 'splitter': 'best'}. Best is trial 245 with value: 0.5517975516810654.
[I 2024-12-04 12:03:14,199] Trial 1748 finished with value: 0.5865784043755198 and parameters: {'max_depth': 25, 'min_samples_split': 10, 'min_samples_leaf': 2, 'max_features': 'sqrt', 'criterion': 'squared_error', 'splitter': 'best'}. Best is trial 245 with value: 0.5517975516810654.
[I 2024-12-04 12:03:15,436] Trial 1757 finished with value: 0.6278044549608603 and parameters: {'max_depth': 29, 'min_samples_split': 10, 'min_samples_leaf': 2, 'max_features': 'sqrt', 'criterion': 'squared_error', 'splitter': 'best'}. Best is trial 245 with value: 0.5517975516810654.
[I 2024-12-04 12:03:16,294] Trial 1758 finished with value: 0.6278044549608603 and parameters: {'max_depth': 26, 'min_samples_split': 10, 'min_samples_leaf': 2, 'max_features': 'sqrt', 'criterion': 'squared_error', 'splitter': 'best'}. Best is trial 245 with value: 0.5517975516810654.
[I 2024-12-04 12:03:16,426] Trial 1756 finished with value: 0.6394091808456486 and parameters: {'max_depth': 26, 'min_samples_split': 11, 'min_samples_leaf': 1, 'max_features': 'sqrt', 'criterion': 'squared_error', 'splitter': 'best'}. Best is trial 245 with value: 0.5517975516810654.
[I 2024-12-04 12:03:16,954] Trial 1764 finished with value: 0.6580426029996769 and parameters: {'max_depth': 33, 'min_samples_split': 10, 'min_samples_leaf': 1, 'max_features': 'sqrt', 'criterion': 'squared_error', 'splitter': 'best'}. Best is trial 245 with value: 0.5517975516810654.
[I 2024-12-04 12:03:16,959] Trial 1766 finished with value: 1.0746652081803512 and parameters: {'max_depth': 29, 'min_samples_split': 14, 'min_samples_leaf': 3, 'max_features': 'sqrt', 'criterion': 'friedman_mse', 'splitter': 'best'}. Best is trial 245 with value: 0.5517975516810654.
[I 2024-12-04 12:03:16,962] Trial 1761 finished with value: 0.5840756540504097 and parameters: {'max_depth': 15, 'min_samples_split': 13, 'min_samples_leaf': 2, 'max_features': 'sqrt', 'criterion': 'squared_error', 'splitter': 'best'}. Best is trial 245 with value: 0.5517975516810654.
[I 2024-12-04 12:03:16,963] Trial 1773 finished with value: 0.6385257346724956 and parameters: {'max_depth': 32, 'min_samples_split': 13, 'min_samples_leaf': 1, 'max_features': 'sqrt', 'criterion': 'friedman_mse', 'splitter': 'best'}. Best is trial 245 with value: 0.5517975516810654.
[I 2024-12-04 12:03:17,033] Trial 1774 finished with value: 1.0746652081803512 and parameters: {'max_depth': 21, 'min_samples_split': 10, 'min_samples_leaf': 3, 'max_features': 'sqrt', 'criterion': 'squared_error', 'splitter': 'best'}. Best is trial 245 with value: 0.5517975516810654.
[I 2024-12-04 12:03:17,399] Trial 1765 finished with value: 0.611677828112404 and parameters: {'max_depth': 30, 'min_samples_split': 9, 'min_samples_leaf': 1, 'max_features': 'sqrt', 'criterion': 'squared_error', 'splitter': 'best'}. Best is trial 245 with value: 0.5517975516810654.
[I 2024-12-04 12:03:17,449] Trial 1767 finished with value: 0.6001834028375898 and parameters: {'max_depth': 24, 'min_samples_split': 11, 'min_samples_leaf': 1, 'max_features': 'sqrt', 'criterion': 'squared_error', 'splitter': 'best'}. Best is trial 245 with value: 0.5517975516810654.
[I 2024-12-04 12:03:18,539] Trial 1770 finished with value: 1.0222350599701424 and parameters: {'max_depth': 21, 'min_samples_split': 8, 'min_samples_leaf': 1, 'max_features': 'sqrt', 'criterion': 'friedman_mse', 'splitter': 'random'}. Best is trial 245 with value: 0.5517975516810654.
[I 2024-12-04 12:03:18,920] Trial 1762 finished with value: 0.5856863453381322 and parameters: {'max_depth': 27, 'min_samples_split': 11, 'min_samples_leaf': 2, 'max_features': 'sqrt', 'criterion': 'squared_error', 'splitter': 'best'}. Best is trial 245 with value: 0.5517975516810654.
