[I 2024-12-04 21:26:33,905] Trial 2348 finished with value: 0.1424951892755092 and parameters: {'kernel_type': 'Matern', 'length_scale': 1590.4827924435917, 'noise_level': 0.7664233356848726, 'constant_value': 0.09649191173634386, 'nu': 1.5}. Best is trial 959 with value: 0.1375110730946576.
[I 2024-12-04 21:26:34,895] Trial 2351 finished with value: 0.9864686819170044 and parameters: {'kernel_type': 'RBF', 'length_scale': 1.3203598888975508e-05, 'noise_level': 4.072544320502202e-05, 'constant_value': 3.8303705013085634, 'nu': 1.5}. Best is trial 959 with value: 0.1375110730946576.
[I 2024-12-04 21:26:42,829] Trial 2353 finished with value: 0.14249519415713646 and parameters: {'kernel_type': 'Matern', 'length_scale': 304.4767554953002, 'noise_level': 0.04525223790409888, 'constant_value': 1.4931850140666838, 'nu': 1.5}. Best is trial 959 with value: 0.1375110730946576.
[I 2024-12-04 21:26:43,537] Trial 2350 finished with value: 0.14249495672882406 and parameters: {'kernel_type': 'Matern', 'length_scale': 31.52413867119551, 'noise_level': 0.01861775850224638, 'constant_value': 1.2595495072328637, 'nu': 1.5}. Best is trial 959 with value: 0.1375110730946576.
[I 2024-12-04 21:26:44,427] Trial 2352 finished with value: 0.9864686818973515 and parameters: {'kernel_type': 'Matern', 'length_scale': 79.16348473690007, 'noise_level': 0.015148172472154846, 'constant_value': 0.4358098815989448, 'nu': 1.5}. Best is trial 959 with value: 0.1375110730946576.
[I 2024-12-04 21:26:50,279] Trial 2354 finished with value: 0.14249506626171243 and parameters: {'kernel_type': 'Matern', 'length_scale': 105.53854175928431, 'noise_level': 0.05427992820976542, 'constant_value': 0.14939955409372072, 'nu': 1.5}. Best is trial 959 with value: 0.1375110730946576.
[I 2024-12-04 21:26:52,051] Trial 2355 finished with value: 0.9864686819215579 and parameters: {'kernel_type': 'Matern', 'length_scale': 3203.551197138523, 'noise_level': 0.0004979912791022301, 'constant_value': 0.9326564584080038, 'nu': 1.5}. Best is trial 959 with value: 0.1375110730946576.
[I 2024-12-04 21:26:52,130] Trial 2356 finished with value: 0.14771027039430148 and parameters: {'kernel_type': 'RBF', 'length_scale': 2.4585218573409557, 'noise_level': 0.039211947740616676, 'constant_value': 0.5383911335923841, 'nu': 1.5}. Best is trial 959 with value: 0.1375110730946576.
[I 2024-12-04 21:27:00,376] Trial 2359 finished with value: 0.142495075372065 and parameters: {'kernel_type': 'Matern', 'length_scale': 2.024463081377653, 'noise_level': 0.002322616606155024, 'constant_value': 3.324523334706354, 'nu': 1.5}. Best is trial 959 with value: 0.1375110730946576.
[I 2024-12-04 21:27:00,809] Trial 2358 finished with value: 0.9864686820392302 and parameters: {'kernel_type': 'Matern', 'length_scale': 580.8413687106321, 'noise_level': 0.01941249603807365, 'constant_value': 6.095099918950604, 'nu': 1.5}. Best is trial 959 with value: 0.1375110730946576.
[I 2024-12-04 21:27:04,513] Trial 2357 finished with value: 0.14249511385148975 and parameters: {'kernel_type': 'Matern', 'length_scale': 604.5485487356577, 'noise_level': 0.8840097041728836, 'constant_value': 0.05920402096324729, 'nu': 1.5}. Best is trial 959 with value: 0.1375110730946576.
[I 2024-12-04 21:27:08,064] Trial 2360 finished with value: 0.14249505573920482 and parameters: {'kernel_type': 'Matern', 'length_scale': 6.902906052431683, 'noise_level': 0.022039426833808502, 'constant_value': 1.7955067192011607, 'nu': 1.5}. Best is trial 959 with value: 0.1375110730946576.
[I 2024-12-04 21:27:09,843] Trial 2361 finished with value: 0.9864686819236309 and parameters: {'kernel_type': 'Matern', 'length_scale': 46.53685856159884, 'noise_level': 5.139561730982941e-05, 'constant_value': 0.0003168160118905691, 'nu': 1.5}. Best is trial 959 with value: 0.1375110730946576.
[I 2024-12-04 21:27:13,685] Trial 2362 finished with value: 0.14249501556352728 and parameters: {'kernel_type': 'Matern', 'length_scale': 28.903694342635422, 'noise_level': 0.07713653795589959, 'constant_value': 0.023138522854511463, 'nu': 1.5}. Best is trial 959 with value: 0.1375110730946576.
[I 2024-12-04 21:27:16,204] Trial 2363 finished with value: 0.1424950566708456 and parameters: {'kernel_type': 'Matern', 'length_scale': 23.563009977005777, 'noise_level': 0.01823688587074939, 'constant_value': 23.687532307994044, 'nu': 1.5}. Best is trial 959 with value: 0.1375110730946576.
[I 2024-12-04 21:27:17,627] Trial 2364 finished with value: 0.14249506550433338 and parameters: {'kernel_type': 'Matern', 'length_scale': 0.8840511292314925, 'noise_level': 0.04914652230502095, 'constant_value': 4.440320678789157, 'nu': 1.5}. Best is trial 959 with value: 0.1375110730946576.
[I 2024-12-04 21:27:21,172] Trial 2365 finished with value: 0.14249507749163984 and parameters: {'kernel_type': 'Matern', 'length_scale': 0.19580912231392175, 'noise_level': 0.0262576073246556, 'constant_value': 0.009074798313766735, 'nu': 1.5}. Best is trial 959 with value: 0.1375110730946576.
[I 2024-12-04 21:27:26,636] Trial 2368 finished with value: 0.1424950288334714 and parameters: {'kernel_type': 'Matern', 'length_scale': 37.90650322357837, 'noise_level': 0.7621990006950905, 'constant_value': 14.796906325722755, 'nu': 1.5}. Best is trial 959 with value: 0.1375110730946576.
[I 2024-12-04 21:27:26,718] Trial 2367 finished with value: 0.14249506588320482 and parameters: {'kernel_type': 'Matern', 'length_scale': 113.2765612289216, 'noise_level': 0.906029497685335, 'constant_value': 0.031070582171864237, 'nu': 1.5}. Best is trial 959 with value: 0.1375110730946576.
[I 2024-12-04 21:27:26,860] Trial 2366 finished with value: 0.14249479898761394 and parameters: {'kernel_type': 'Matern', 'length_scale': 54.65893562602594, 'noise_level': 0.003472933342490652, 'constant_value': 20.876540439443737, 'nu': 1.5}. Best is trial 959 with value: 0.1375110730946576.
[I 2024-12-04 21:27:34,834] Trial 2370 finished with value: 0.14249507322348137 and parameters: {'kernel_type': 'Matern', 'length_scale': 58.13211523022196, 'noise_level': 0.06926233309921635, 'constant_value': 0.4475789566589737, 'nu': 1.5}. Best is trial 959 with value: 0.1375110730946576.
[I 2024-12-04 21:27:36,603] Trial 2371 finished with value: 0.13787071273440282 and parameters: {'kernel_type': 'Matern', 'length_scale': 387.22732921568775, 'noise_level': 0.027401777009036427, 'constant_value': 30.18108452004762, 'nu': 1.5}. Best is trial 959 with value: 0.1375110730946576.
[I 2024-12-04 21:27:37,552] Trial 2369 finished with value: 0.14469841118628288 and parameters: {'kernel_type': 'Matern', 'length_scale': 38.74894109954498, 'noise_level': 0.02306496103274402, 'constant_value': 1.4601346174781216, 'nu': 2.5}. Best is trial 959 with value: 0.1375110730946576.
[I 2024-12-04 21:27:41,821] Trial 2373 finished with value: 0.1424950838593062 and parameters: {'kernel_type': 'Matern', 'length_scale': 1272.9906013527877, 'noise_level': 0.03537045794648899, 'constant_value': 339.22226383799654, 'nu': 1.5}. Best is trial 959 with value: 0.1375110730946576.
[I 2024-12-04 21:27:41,824] Trial 2372 finished with value: 0.14249497720577642 and parameters: {'kernel_type': 'Matern', 'length_scale': 16.654965805997026, 'noise_level': 0.02556945443683423, 'constant_value': 7.134789783192308, 'nu': 1.5}. Best is trial 959 with value: 0.1375110730946576.
[I 2024-12-04 21:27:46,655] Trial 2374 finished with value: 0.9864686820147666 and parameters: {'kernel_type': 'Matern', 'length_scale': 18822.76149881645, 'noise_level': 0.0017108063438379599, 'constant_value': 1.4545246559712686, 'nu': 1.5}. Best is trial 959 with value: 0.1375110730946576.
[I 2024-12-04 21:27:50,793] Trial 2375 finished with value: 0.9864686819194378 and parameters: {'kernel_type': 'Matern', 'length_scale': 2969.733541645842, 'noise_level': 0.0339167083819089, 'constant_value': 9.566946526339327, 'nu': 1.5}. Best is trial 959 with value: 0.1375110730946576.
[I 2024-12-04 21:27:52,240] Trial 2376 finished with value: 0.9864686818812879 and parameters: {'kernel_type': 'Matern', 'length_scale': 1385.1705106734335, 'noise_level': 0.004642686689232607, 'constant_value': 0.38433165757654747, 'nu': 1.5}. Best is trial 959 with value: 0.1375110730946576.
[I 2024-12-04 21:27:52,580] Trial 2377 finished with value: 0.1424948574353018 and parameters: {'kernel_type': 'Matern', 'length_scale': 33.974891817000035, 'noise_level': 0.007970249606707279, 'constant_value': 212.71292493092304, 'nu': 1.5}. Best is trial 959 with value: 0.1375110730946576.
[I 2024-12-04 21:27:56,336] Trial 2378 finished with value: 0.986468681987737 and parameters: {'kernel_type': 'RBF', 'length_scale': 5.99921319649394, 'noise_level': 8.248420271119636e-05, 'constant_value': 0.09025034740076197, 'nu': 1.5}. Best is trial 959 with value: 0.1375110730946576.
[I 2024-12-04 21:27:57,500] Trial 2379 finished with value: 0.9864686822613146 and parameters: {'kernel_type': 'RBF', 'length_scale': 0.0018279316985583731, 'noise_level': 0.05286661234580093, 'constant_value': 0.07789587531333142, 'nu': 0.5}. Best is trial 959 with value: 0.1375110730946576.
[I 2024-12-04 21:28:00,572] Trial 2380 finished with value: 0.9864686819082384 and parameters: {'kernel_type': 'Matern', 'length_scale': 1141.5497804479066, 'noise_level': 0.045956436928133004, 'constant_value': 1.5352307178303786, 'nu': 1.5}. Best is trial 959 with value: 0.1375110730946576.
[I 2024-12-04 21:28:04,387] Trial 2382 finished with value: 0.9864686819240841 and parameters: {'kernel_type': 'Matern', 'length_scale': 253.90258765453788, 'noise_level': 0.0007860727937088422, 'constant_value': 38.19780367580387, 'nu': 1.5}. Best is trial 959 with value: 0.1375110730946576.
[I 2024-12-04 21:28:07,922] Trial 2381 finished with value: 0.14249551857224693 and parameters: {'kernel_type': 'Matern', 'length_scale': 1617.6755502344226, 'noise_level': 0.09439618905195069, 'constant_value': 344.67256809890443, 'nu': 1.5}. Best is trial 959 with value: 0.1375110730946576.
[I 2024-12-04 21:28:09,753] Trial 2383 finished with value: 0.9864686819307862 and parameters: {'kernel_type': 'Matern', 'length_scale': 1400.0254701071428, 'noise_level': 0.026710545448184766, 'constant_value': 4.225948757885149, 'nu': 1.5}. Best is trial 959 with value: 0.1375110730946576.
[I 2024-12-04 21:28:10,812] Trial 2384 finished with value: 0.14771037614773827 and parameters: {'kernel_type': 'RBF', 'length_scale': 19.032682571852025, 'noise_level': 0.5543079692089483, 'constant_value': 0.05648236821198486, 'nu': 1.5}. Best is trial 959 with value: 0.1375110730946576.
[I 2024-12-04 21:28:14,838] Trial 2385 finished with value: 0.9864686819243513 and parameters: {'kernel_type': 'Matern', 'length_scale': 254.8546668850337, 'noise_level': 0.0004113162041566921, 'constant_value': 7.4779815784502635, 'nu': 1.5}. Best is trial 959 with value: 0.1375110730946576.
[I 2024-12-04 21:28:16,072] Trial 2386 finished with value: 0.9864686819164656 and parameters: {'kernel_type': 'RBF', 'length_scale': 251.30022359336886, 'noise_level': 1.372577780615256e-09, 'constant_value': 2.511972790766574, 'nu': 0.5}. Best is trial 959 with value: 0.1375110730946576.
[I 2024-12-04 21:28:17,040] Trial 2387 finished with value: 0.14249466563602803 and parameters: {'kernel_type': 'Matern', 'length_scale': 2641.0086348965083, 'noise_level': 0.09963506876477483, 'constant_value': 128.15083621546438, 'nu': 1.5}. Best is trial 959 with value: 0.1375110730946576.
[I 2024-12-04 21:28:20,913] Trial 2388 finished with value: 0.14249507696211514 and parameters: {'kernel_type': 'Matern', 'length_scale': 2375.9494457733417, 'noise_level': 0.09387981203045911, 'constant_value': 122.88212236409325, 'nu': 1.5}. Best is trial 959 with value: 0.1375110730946576.
[I 2024-12-04 21:28:24,766] Trial 2389 finished with value: 0.9864686819412752 and parameters: {'kernel_type': 'Matern', 'length_scale': 362.3984848148068, 'noise_level': 0.0027645659526234472, 'constant_value': 11.909963256800024, 'nu': 1.5}. Best is trial 959 with value: 0.1375110730946576.
[I 2024-12-04 21:28:26,822] Trial 2391 finished with value: 0.14249505648418742 and parameters: {'kernel_type': 'Matern', 'length_scale': 218.31089488258198, 'noise_level': 0.06994743452405117, 'constant_value': 149.38694469683887, 'nu': 1.5}. Best is trial 959 with value: 0.1375110730946576.
[I 2024-12-04 21:28:27,644] Trial 2390 finished with value: 0.14249518894667615 and parameters: {'kernel_type': 'Matern', 'length_scale': 684.3809673527059, 'noise_level': 0.17357204017720243, 'constant_value': 39.0032676332498, 'nu': 1.5}. Best is trial 959 with value: 0.1375110730946576.
[I 2024-12-04 21:28:35,144] Trial 2392 finished with value: 0.9864686818698153 and parameters: {'kernel_type': 'Matern', 'length_scale': 4903.366948845173, 'noise_level': 0.0008822717460076365, 'constant_value': 49.34942606237306, 'nu': 1.5}. Best is trial 959 with value: 0.1375110730946576.
[I 2024-12-04 21:28:35,694] Trial 2394 finished with value: 0.9864686819134196 and parameters: {'kernel_type': 'RBF', 'length_scale': 866.1944832494592, 'noise_level': 0.040564377397825424, 'constant_value': 10.135145976487726, 'nu': 1.5}. Best is trial 959 with value: 0.1375110730946576.
[I 2024-12-04 21:28:35,975] Trial 2393 finished with value: 0.9864686819228078 and parameters: {'kernel_type': 'Matern', 'length_scale': 770.9163651380409, 'noise_level': 0.020490477820817463, 'constant_value': 0.6947355891111798, 'nu': 1.5}. Best is trial 959 with value: 0.1375110730946576.
[I 2024-12-04 21:28:43,884] Trial 2396 finished with value: 0.14249508785492673 and parameters: {'kernel_type': 'Matern', 'length_scale': 33.28182006533943, 'noise_level': 0.8505168588894682, 'constant_value': 2.5274786598765537, 'nu': 1.5}. Best is trial 959 with value: 0.1375110730946576.
[I 2024-12-04 21:28:45,007] Trial 2397 finished with value: 0.1424948120720882 and parameters: {'kernel_type': 'Matern', 'length_scale': 1.0323327644081621, 'noise_level': 0.9915463181185209, 'constant_value': 15.562497714194395, 'nu': 1.5}. Best is trial 959 with value: 0.1375110730946576.
[I 2024-12-04 21:28:48,636] Trial 2395 finished with value: 0.9864686818618439 and parameters: {'kernel_type': 'Matern', 'length_scale': 1262.0160026757446, 'noise_level': 0.004621844723527597, 'constant_value': 0.004088702221587901, 'nu': 2.5}. Best is trial 959 with value: 0.1375110730946576.
[I 2024-12-04 21:28:54,284] Trial 2398 finished with value: 0.9864686819209195 and parameters: {'kernel_type': 'Matern', 'length_scale': 2273.9112292959853, 'noise_level': 0.016887423193703642, 'constant_value': 139.06725636266114, 'nu': 1.5}. Best is trial 959 with value: 0.1375110730946576.
[I 2024-12-04 21:28:54,439] Trial 2399 finished with value: 0.9864686819236695 and parameters: {'kernel_type': 'RBF', 'length_scale': 10552.722543225736, 'noise_level': 0.003451238167185164, 'constant_value': 0.12566238702453833, 'nu': 2.5}. Best is trial 959 with value: 0.1375110730946576.
[I 2024-12-04 21:28:56,640] Trial 2400 finished with value: 0.1424950226391631 and parameters: {'kernel_type': 'Matern', 'length_scale': 31.362030604857498, 'noise_level': 0.8431382710094285, 'constant_value': 0.08483386010316053, 'nu': 1.5}. Best is trial 959 with value: 0.1375110730946576.
[I 2024-12-04 21:28:58,863] Trial 2401 finished with value: 0.998217109442391 and parameters: {'kernel_type': 'RBF', 'length_scale': 26729.829824489883, 'noise_level': 0.06041803128463442, 'constant_value': 1.7647120206155546e-07, 'nu': 2.5}. Best is trial 959 with value: 0.1375110730946576.
[I 2024-12-04 21:29:02,276] Trial 2403 finished with value: 0.14249499426160323 and parameters: {'kernel_type': 'Matern', 'length_scale': 83.23463448700898, 'noise_level': 0.08044556527192981, 'constant_value': 531.6186779481485, 'nu': 1.5}. Best is trial 959 with value: 0.1375110730946576.
[I 2024-12-04 21:29:03,620] Trial 2402 finished with value: 0.9864686819243057 and parameters: {'kernel_type': 'Matern', 'length_scale': 33.53731306565429, 'noise_level': 0.03050164334593003, 'constant_value': 0.010854215272349975, 'nu': 1.5}. Best is trial 959 with value: 0.1375110730946576.
[I 2024-12-04 21:29:05,489] Trial 2404 finished with value: 0.9982171094940396 and parameters: {'kernel_type': 'Matern', 'length_scale': 807.266685674369, 'noise_level': 0.03712007691601073, 'constant_value': 11.92969209955297, 'nu': 1.5}. Best is trial 959 with value: 0.1375110730946576.
[I 2024-12-04 21:29:09,231] Trial 2405 finished with value: 0.9864686820740052 and parameters: {'kernel_type': 'Matern', 'length_scale': 23905.31280898648, 'noise_level': 0.48206210270097616, 'constant_value': 38.337826191519355, 'nu': 1.5}. Best is trial 959 with value: 0.1375110730946576.
[I 2024-12-04 21:29:13,098] Trial 2406 finished with value: 0.14249453458408104 and parameters: {'kernel_type': 'Matern', 'length_scale': 173.74824161797108, 'noise_level': 0.04940000336096021, 'constant_value': 37.32817368391354, 'nu': 1.5}. Best is trial 959 with value: 0.1375110730946576.
[I 2024-12-04 21:29:14,305] Trial 2407 finished with value: 0.9864686819295011 and parameters: {'kernel_type': 'Matern', 'length_scale': 217.45495230707894, 'noise_level': 0.00025967635675242645, 'constant_value': 0.009839911177247807, 'nu': 1.5}. Best is trial 959 with value: 0.1375110730946576.
[I 2024-12-04 21:29:19,127] Trial 2409 finished with value: 0.19720000332294707 and parameters: {'kernel_type': 'Matern', 'length_scale': 30.14709488462035, 'noise_level': 0.029968289029897843, 'constant_value': 2.4036414394066346, 'nu': 0.5}. Best is trial 959 with value: 0.1375110730946576.
[I 2024-12-04 21:29:20,254] Trial 2410 finished with value: 0.1424950698037615 and parameters: {'kernel_type': 'Matern', 'length_scale': 73.93623225760794, 'noise_level': 0.07426638949004506, 'constant_value': 82.08526328872703, 'nu': 1.5}. Best is trial 959 with value: 0.1375110730946576.
[I 2024-12-04 21:29:24,785] Trial 2408 finished with value: 0.14249484902008624 and parameters: {'kernel_type': 'Matern', 'length_scale': 332.2021659692368, 'noise_level': 0.9456267974736753, 'constant_value': 0.028594001246649046, 'nu': 1.5}. Best is trial 959 with value: 0.1375110730946576.
[I 2024-12-04 21:29:27,825] Trial 2411 finished with value: 0.9864686819135311 and parameters: {'kernel_type': 'Matern', 'length_scale': 31970.593502944954, 'noise_level': 0.009226074092500052, 'constant_value': 166.49750044178927, 'nu': 1.5}. Best is trial 959 with value: 0.1375110730946576.
[I 2024-12-04 21:29:27,840] Trial 2412 finished with value: 0.14249505809342528 and parameters: {'kernel_type': 'Matern', 'length_scale': 261.5855538097808, 'noise_level': 0.9044980640578526, 'constant_value': 3.0186868023801945, 'nu': 1.5}. Best is trial 959 with value: 0.1375110730946576.
[I 2024-12-04 21:29:32,131] Trial 2413 finished with value: 0.14249507238067555 and parameters: {'kernel_type': 'Matern', 'length_scale': 0.9030524475347497, 'noise_level': 0.025743056202600156, 'constant_value': 0.15739061962373835, 'nu': 1.5}. Best is trial 959 with value: 0.1375110730946576.
[I 2024-12-04 21:29:36,166] Trial 2414 finished with value: 0.1424950625602003 and parameters: {'kernel_type': 'Matern', 'length_scale': 75.62952673176417, 'noise_level': 0.004270474049896736, 'constant_value': 39.84950258541104, 'nu': 1.5}. Best is trial 959 with value: 0.1375110730946576.
[I 2024-12-04 21:29:38,540] Trial 2415 finished with value: 0.14771059157159147 and parameters: {'kernel_type': 'RBF', 'length_scale': 0.8076729889071695, 'noise_level': 8.154691760636651e-05, 'constant_value': 0.0005592553885412337, 'nu': 2.5}. Best is trial 959 with value: 0.1375110730946576.
[I 2024-12-04 21:29:39,920] Trial 2416 finished with value: 0.1424950710811534 and parameters: {'kernel_type': 'Matern', 'length_scale': 1.7704537061119445, 'noise_level': 0.8856013150308375, 'constant_value': 0.6662871522643112, 'nu': 1.5}. Best is trial 959 with value: 0.1375110730946576.
[I 2024-12-04 21:29:48,607] Trial 2419 finished with value: 0.14249508786128995 and parameters: {'kernel_type': 'Matern', 'length_scale': 196.2834645123935, 'noise_level': 0.9905363718538274, 'constant_value': 0.2917892308507274, 'nu': 1.5}. Best is trial 959 with value: 0.1375110730946576.
[I 2024-12-04 21:29:49,676] Trial 2417 finished with value: 0.14771037271797735 and parameters: {'kernel_type': 'RBF', 'length_scale': 12.44370538957656, 'noise_level': 0.7000622794817464, 'constant_value': 2.3905800070315516e-06, 'nu': 0.5}. Best is trial 959 with value: 0.1375110730946576.
[I 2024-12-04 21:29:57,020] Trial 2418 finished with value: 0.14771034423720406 and parameters: {'kernel_type': 'RBF', 'length_scale': 717.2284422765147, 'noise_level': 0.2510472589538877, 'constant_value': 0.0009557796310267542, 'nu': 1.5}. Best is trial 959 with value: 0.1375110730946576.
[I 2024-12-04 21:29:58,442] Trial 2420 finished with value: 0.14249506104722007 and parameters: {'kernel_type': 'Matern', 'length_scale': 6111.285438397551, 'noise_level': 0.7195715597649374, 'constant_value': 4.319134184953359, 'nu': 1.5}. Best is trial 959 with value: 0.1375110730946576.
[I 2024-12-04 21:29:59,702] Trial 2421 finished with value: 0.9864686819290844 and parameters: {'kernel_type': 'Matern', 'length_scale': 3561.394793428932, 'noise_level': 0.014327106234860183, 'constant_value': 0.01031783904211551, 'nu': 1.5}. Best is trial 959 with value: 0.1375110730946576.
[I 2024-12-04 21:30:04,172] Trial 2424 finished with value: 0.9982167338039986 and parameters: {'kernel_type': 'RBF', 'length_scale': 3.2487395441729616e-05, 'noise_level': 9.411506653985389e-08, 'constant_value': 154.4812400495504, 'nu': 0.5}. Best is trial 959 with value: 0.1375110730946576.
[I 2024-12-04 21:30:04,618] Trial 2423 finished with value: 0.14249505264792414 and parameters: {'kernel_type': 'Matern', 'length_scale': 186.6934611060014, 'noise_level': 0.7345190732565435, 'constant_value': 356.3352651476438, 'nu': 1.5}. Best is trial 959 with value: 0.1375110730946576.
