[I 2024-12-03 18:41:25,531] A new study created in RDB with name: Pc_svr
/zhome/b1/0/88900/miniconda3/envs/critprops/lib/python3.9/site-packages/optuna/_experimental.py:31: ExperimentalWarning: Argument ``multivariate`` is an experimental feature. The interface can change in the future.
  warnings.warn(
/zhome/b1/0/88900/miniconda3/envs/critprops/lib/python3.9/site-packages/optuna/_experimental.py:31: ExperimentalWarning: Argument ``constant_liar`` is an experimental feature. The interface can change in the future.
  warnings.warn(
/zhome/b1/0/88900/miniconda3/envs/critprops/lib/python3.9/site-packages/optuna/_experimental.py:31: ExperimentalWarning: Argument ``multivariate`` is an experimental feature. The interface can change in the future.
  warnings.warn(
/zhome/b1/0/88900/miniconda3/envs/critprops/lib/python3.9/site-packages/optuna/_experimental.py:31: ExperimentalWarning: Argument ``constant_liar`` is an experimental feature. The interface can change in the future.
  warnings.warn(
[I 2024-12-03 18:41:29,883] Trial 3 finished with value: 0.861223776750886 and parameters: {'kernel': 'linear', 'C': 0.028522444147507802, 'gamma': 0.000382487393048935, 'epsilon': 0.0018990663912303014}. Best is trial 3 with value: 0.861223776750886.
/zhome/b1/0/88900/miniconda3/envs/critprops/lib/python3.9/site-packages/optuna/_experimental.py:31: ExperimentalWarning: Argument ``multivariate`` is an experimental feature. The interface can change in the future.
  warnings.warn(
/zhome/b1/0/88900/miniconda3/envs/critprops/lib/python3.9/site-packages/optuna/_experimental.py:31: ExperimentalWarning: Argument ``constant_liar`` is an experimental feature. The interface can change in the future.
  warnings.warn(
[I 2024-12-03 18:41:30,055] Trial 16 finished with value: 1029.869841018865 and parameters: {'kernel': 'sigmoid', 'C': 58.98584453180284, 'gamma': 0.021670579048543522, 'epsilon': 0.22777825049926673}. Best is trial 18 with value: 0.4828428757728425.
[I 2024-12-03 18:41:30,271] Trial 2 finished with value: 0.8779766086281017 and parameters: {'kernel': 'linear', 'C': 0.0023356950913014057, 'gamma': 0.0006871425106982094, 'epsilon': 0.22967335194628433}. Best is trial 18 with value: 0.4828428757728425.
/zhome/b1/0/88900/miniconda3/envs/critprops/lib/python3.9/site-packages/optuna/_experimental.py:31: ExperimentalWarning: Argument ``multivariate`` is an experimental feature. The interface can change in the future.
  warnings.warn(
/zhome/b1/0/88900/miniconda3/envs/critprops/lib/python3.9/site-packages/optuna/_experimental.py:31: ExperimentalWarning: Argument ``constant_liar`` is an experimental feature. The interface can change in the future.
  warnings.warn(
[I 2024-12-03 18:41:30,505] Trial 27 finished with value: 0.851500001028654 and parameters: {'kernel': 'rbf', 'C': 0.17293295262030006, 'gamma': 0.4737803784997517, 'epsilon': 0.0023054410100413797}. Best is trial 18 with value: 0.4828428757728425.
[I 2024-12-03 18:41:30,506] Trial 7 finished with value: 2.055187974901435 and parameters: {'kernel': 'poly', 'C': 4.767091370850843, 'gamma': 0.006459341264866723, 'epsilon': 0.04192110312297648}. Best is trial 18 with value: 0.4828428757728425.
[I 2024-12-03 18:41:30,559] Trial 21 finished with value: 1.0498559723575183 and parameters: {'kernel': 'sigmoid', 'C': 0.05507841412941421, 'gamma': 0.00013036320631689037, 'epsilon': 0.009712822567246185}. Best is trial 18 with value: 0.4828428757728425.
[I 2024-12-03 18:41:30,729] Trial 18 finished with value: 0.4828428757728425 and parameters: {'kernel': 'rbf', 'C': 1.8622285500524374, 'gamma': 0.03424111696064376, 'epsilon': 0.003117648564827705}. Best is trial 18 with value: 0.4828428757728425.
/zhome/b1/0/88900/miniconda3/envs/critprops/lib/python3.9/site-packages/optuna/_experimental.py:31: ExperimentalWarning: Argument ``multivariate`` is an experimental feature. The interface can change in the future.
  warnings.warn(
/zhome/b1/0/88900/miniconda3/envs/critprops/lib/python3.9/site-packages/optuna/_experimental.py:31: ExperimentalWarning: Argument ``constant_liar`` is an experimental feature. The interface can change in the future.
  warnings.warn(
[I 2024-12-03 18:41:30,831] Trial 15 finished with value: 0.8668483443324743 and parameters: {'kernel': 'linear', 'C': 0.02230556556511578, 'gamma': 0.02135379829054925, 'epsilon': 0.0012956043251291876}. Best is trial 18 with value: 0.4828428757728425.
[I 2024-12-03 18:41:30,869] Trial 0 finished with value: 19.699925479363813 and parameters: {'kernel': 'sigmoid', 'C': 0.7214341838129266, 'gamma': 0.4028722982651922, 'epsilon': 0.004139715425345878}. Best is trial 18 with value: 0.4828428757728425.
/zhome/b1/0/88900/miniconda3/envs/critprops/lib/python3.9/site-packages/optuna/_experimental.py:31: ExperimentalWarning: Argument ``multivariate`` is an experimental feature. The interface can change in the future.
  warnings.warn(
/zhome/b1/0/88900/miniconda3/envs/critprops/lib/python3.9/site-packages/optuna/_experimental.py:31: ExperimentalWarning: Argument ``constant_liar`` is an experimental feature. The interface can change in the future.
  warnings.warn(
/zhome/b1/0/88900/miniconda3/envs/critprops/lib/python3.9/site-packages/optuna/_experimental.py:31: ExperimentalWarning: Argument ``multivariate`` is an experimental feature. The interface can change in the future.
  warnings.warn(
/zhome/b1/0/88900/miniconda3/envs/critprops/lib/python3.9/site-packages/optuna/_experimental.py:31: ExperimentalWarning: Argument ``constant_liar`` is an experimental feature. The interface can change in the future.
  warnings.warn(
/zhome/b1/0/88900/miniconda3/envs/critprops/lib/python3.9/site-packages/optuna/_experimental.py:31: ExperimentalWarning: Argument ``multivariate`` is an experimental feature. The interface can change in the future.
  warnings.warn(
/zhome/b1/0/88900/miniconda3/envs/critprops/lib/python3.9/site-packages/optuna/_experimental.py:31: ExperimentalWarning: Argument ``constant_liar`` is an experimental feature. The interface can change in the future.
  warnings.warn(
[I 2024-12-03 18:41:31,699] Trial 26 finished with value: 0.9845218196690465 and parameters: {'kernel': 'sigmoid', 'C': 0.1304120967843587, 'gamma': 0.00024039887228759373, 'epsilon': 0.0462177826533862}. Best is trial 18 with value: 0.4828428757728425.
[I 2024-12-03 18:41:31,776] Trial 25 finished with value: 1.580006876288518 and parameters: {'kernel': 'poly', 'C': 33.82907080643762, 'gamma': 0.0008450457802338081, 'epsilon': 0.0032819137394957966}. Best is trial 18 with value: 0.4828428757728425.
[I 2024-12-03 18:41:32,274] Trial 24 finished with value: 0.8250558805197382 and parameters: {'kernel': 'linear', 'C': 0.011554921930695121, 'gamma': 0.00023974586908363297, 'epsilon': 0.33960962561376473}. Best is trial 18 with value: 0.4828428757728425.
[I 2024-12-03 18:41:33,003] Trial 5 finished with value: 0.8067360252312822 and parameters: {'kernel': 'linear', 'C': 1.925244720988044, 'gamma': 0.0005464998355879387, 'epsilon': 0.06409051651706445}. Best is trial 4 with value: 0.4482974280636226.
[I 2024-12-03 18:41:33,224] Trial 4 finished with value: 0.4482974280636226 and parameters: {'kernel': 'rbf', 'C': 3.14760846331734, 'gamma': 0.0197395262095021, 'epsilon': 0.003598538835468305}. Best is trial 17 with value: 0.4168049033927919.
[I 2024-12-03 18:41:33,228] Trial 11 finished with value: 2.6377065337487338 and parameters: {'kernel': 'sigmoid', 'C': 0.07668631675112182, 'gamma': 0.4653260952586114, 'epsilon': 0.002674939151328373}. Best is trial 17 with value: 0.4168049033927919.
[I 2024-12-03 18:41:33,247] Trial 23 finished with value: 1.0795597446573977 and parameters: {'kernel': 'poly', 'C': 0.0021057046422013385, 'gamma': 0.0002195118733094276, 'epsilon': 0.46952310383185225}. Best is trial 17 with value: 0.4168049033927919.
[I 2024-12-03 18:41:33,251] Trial 9 finished with value: 1.8621642188009098 and parameters: {'kernel': 'poly', 'C': 0.035465065891748124, 'gamma': 0.16087400067653868, 'epsilon': 0.1132973860349503}. Best is trial 17 with value: 0.4168049033927919.
/zhome/b1/0/88900/miniconda3/envs/critprops/lib/python3.9/site-packages/optuna/_experimental.py:31: ExperimentalWarning: Argument ``multivariate`` is an experimental feature. The interface can change in the future.
  warnings.warn(
/zhome/b1/0/88900/miniconda3/envs/critprops/lib/python3.9/site-packages/optuna/_experimental.py:31: ExperimentalWarning: Argument ``constant_liar`` is an experimental feature. The interface can change in the future.
  warnings.warn(
[I 2024-12-03 18:41:33,378] Trial 14 finished with value: 1.0756247581803466 and parameters: {'kernel': 'sigmoid', 'C': 0.0013835860436956417, 'gamma': 0.0002585516262917682, 'epsilon': 0.1284337193134373}. Best is trial 17 with value: 0.4168049033927919.
/zhome/b1/0/88900/miniconda3/envs/critprops/lib/python3.9/site-packages/optuna/_experimental.py:31: ExperimentalWarning: Argument ``multivariate`` is an experimental feature. The interface can change in the future.
  warnings.warn(
/zhome/b1/0/88900/miniconda3/envs/critprops/lib/python3.9/site-packages/optuna/_experimental.py:31: ExperimentalWarning: Argument ``constant_liar`` is an experimental feature. The interface can change in the future.
  warnings.warn(
[I 2024-12-03 18:41:33,682] Trial 28 finished with value: 0.7488885090813455 and parameters: {'kernel': 'linear', 'C': 0.6286013658000992, 'gamma': 0.00047696485137834995, 'epsilon': 0.23546202647859366}. Best is trial 17 with value: 0.4168049033927919.
/zhome/b1/0/88900/miniconda3/envs/critprops/lib/python3.9/site-packages/optuna/_experimental.py:31: ExperimentalWarning: Argument ``multivariate`` is an experimental feature. The interface can change in the future.
  warnings.warn(
/zhome/b1/0/88900/miniconda3/envs/critprops/lib/python3.9/site-packages/optuna/_experimental.py:31: ExperimentalWarning: Argument ``constant_liar`` is an experimental feature. The interface can change in the future.
  warnings.warn(
[I 2024-12-03 18:41:33,923] Trial 20 finished with value: 0.7159060687871525 and parameters: {'kernel': 'rbf', 'C': 0.06867392940012947, 'gamma': 0.03770717972231691, 'epsilon': 0.00992369442190197}. Best is trial 17 with value: 0.4168049033927919.
[I 2024-12-03 18:41:33,974] Trial 19 finished with value: 0.9031877002321719 and parameters: {'kernel': 'linear', 'C': 0.001299604633221318, 'gamma': 0.11011682000553075, 'epsilon': 0.02275021497915278}. Best is trial 17 with value: 0.4168049033927919.
[I 2024-12-03 18:41:34,266] Trial 17 finished with value: 0.4168049033927919 and parameters: {'kernel': 'rbf', 'C': 37.69896770076909, 'gamma': 0.002455509635859339, 'epsilon': 0.162776927216788}. Best is trial 17 with value: 0.4168049033927919.
[I 2024-12-03 18:41:34,310] Trial 12 finished with value: 0.626866044143353 and parameters: {'kernel': 'rbf', 'C': 38.17685534359795, 'gamma': 0.40366759785782674, 'epsilon': 0.0028408621418317456}. Best is trial 17 with value: 0.4168049033927919.
[I 2024-12-03 18:41:34,521] Trial 29 finished with value: 0.7972439346829228 and parameters: {'kernel': 'linear', 'C': 19.351004454960893, 'gamma': 0.0003670697402244502, 'epsilon': 0.0033962343217895773}. Best is trial 17 with value: 0.4168049033927919.
[I 2024-12-03 18:41:34,589] Trial 8 finished with value: 0.5075681502610752 and parameters: {'kernel': 'rbf', 'C': 2.636396284116074, 'gamma': 0.006558339922875196, 'epsilon': 0.004776496787646553}. Best is trial 17 with value: 0.4168049033927919.
/zhome/b1/0/88900/miniconda3/envs/critprops/lib/python3.9/site-packages/optuna/_experimental.py:31: ExperimentalWarning: Argument ``multivariate`` is an experimental feature. The interface can change in the future.
  warnings.warn(
/zhome/b1/0/88900/miniconda3/envs/critprops/lib/python3.9/site-packages/optuna/_experimental.py:31: ExperimentalWarning: Argument ``constant_liar`` is an experimental feature. The interface can change in the future.
  warnings.warn(
[I 2024-12-03 18:41:35,043] Trial 31 finished with value: 0.6810049170317246 and parameters: {'kernel': 'rbf', 'C': 93.72492177825445, 'gamma': 0.5378161333659123, 'epsilon': 0.0011463938969775436}. Best is trial 17 with value: 0.4168049033927919.
/zhome/b1/0/88900/miniconda3/envs/critprops/lib/python3.9/site-packages/optuna/_experimental.py:31: ExperimentalWarning: Argument ``multivariate`` is an experimental feature. The interface can change in the future.
  warnings.warn(
/zhome/b1/0/88900/miniconda3/envs/critprops/lib/python3.9/site-packages/optuna/_experimental.py:31: ExperimentalWarning: Argument ``constant_liar`` is an experimental feature. The interface can change in the future.
  warnings.warn(
[I 2024-12-03 18:41:35,259] Trial 30 finished with value: 0.4451499439688464 and parameters: {'kernel': 'rbf', 'C': 25.909908410788002, 'gamma': 0.00148220625244939, 'epsilon': 0.0251100817023764}. Best is trial 17 with value: 0.4168049033927919.
[I 2024-12-03 18:41:35,260] Trial 22 finished with value: 1.0548350701516533 and parameters: {'kernel': 'poly', 'C': 0.08095969502677061, 'gamma': 0.0006715337159178296, 'epsilon': 0.0012489124479548351}. Best is trial 17 with value: 0.4168049033927919.
/zhome/b1/0/88900/miniconda3/envs/critprops/lib/python3.9/site-packages/optuna/_experimental.py:31: ExperimentalWarning: Argument ``multivariate`` is an experimental feature. The interface can change in the future.
  warnings.warn(
/zhome/b1/0/88900/miniconda3/envs/critprops/lib/python3.9/site-packages/optuna/_experimental.py:31: ExperimentalWarning: Argument ``constant_liar`` is an experimental feature. The interface can change in the future.
  warnings.warn(
[I 2024-12-03 18:41:35,736] Trial 13 finished with value: 0.7612549707390373 and parameters: {'kernel': 'rbf', 'C': 1.3355041730956672, 'gamma': 0.0133011592822586, 'epsilon': 0.9894233208001506}. Best is trial 17 with value: 0.4168049033927919.
/zhome/b1/0/88900/miniconda3/envs/critprops/lib/python3.9/site-packages/optuna/_experimental.py:31: ExperimentalWarning: Argument ``multivariate`` is an experimental feature. The interface can change in the future.
  warnings.warn(
/zhome/b1/0/88900/miniconda3/envs/critprops/lib/python3.9/site-packages/optuna/_experimental.py:31: ExperimentalWarning: Argument ``constant_liar`` is an experimental feature. The interface can change in the future.
  warnings.warn(
[I 2024-12-03 18:41:36,360] Trial 37 finished with value: 0.7294291675325829 and parameters: {'kernel': 'rbf', 'C': 2.4288737037958876, 'gamma': 0.0004199080418364301, 'epsilon': 0.03914071475978121}. Best is trial 17 with value: 0.4168049033927919.
[I 2024-12-03 18:41:37,032] Trial 6 finished with value: 0.7967776449192241 and parameters: {'kernel': 'linear', 'C': 5.075489855187741, 'gamma': 0.05646830597241441, 'epsilon': 0.004222178613677284}. Best is trial 17 with value: 0.4168049033927919.
/zhome/b1/0/88900/miniconda3/envs/critprops/lib/python3.9/site-packages/optuna/_experimental.py:31: ExperimentalWarning: Argument ``multivariate`` is an experimental feature. The interface can change in the future.
  warnings.warn(
/zhome/b1/0/88900/miniconda3/envs/critprops/lib/python3.9/site-packages/optuna/_experimental.py:31: ExperimentalWarning: Argument ``constant_liar`` is an experimental feature. The interface can change in the future.
  warnings.warn(
[I 2024-12-03 18:41:37,662] Trial 39 finished with value: 0.4653512700329754 and parameters: {'kernel': 'rbf', 'C': 67.73878154098938, 'gamma': 0.0005294235229613237, 'epsilon': 0.11146685203525315}. Best is trial 38 with value: 0.39518858884450847.
[I 2024-12-03 18:41:37,808] Trial 40 finished with value: 1.4219296918200066 and parameters: {'kernel': 'poly', 'C': 65.46470855790832, 'gamma': 0.000671970705562816, 'epsilon': 0.34089896176670403}. Best is trial 38 with value: 0.39518858884450847.
[I 2024-12-03 18:41:38,076] Trial 38 finished with value: 0.39518858884450847 and parameters: {'kernel': 'rbf', 'C': 27.743758014605167, 'gamma': 0.009770703923207046, 'epsilon': 0.0832401477769845}. Best is trial 38 with value: 0.39518858884450847.
[I 2024-12-03 18:41:38,601] Trial 33 finished with value: 226.00106669423795 and parameters: {'kernel': 'sigmoid', 'C': 14.844959231824987, 'gamma': 0.015326871019862312, 'epsilon': 0.008088498052327498}. Best is trial 38 with value: 0.39518858884450847.
/zhome/b1/0/88900/miniconda3/envs/critprops/lib/python3.9/site-packages/optuna/_experimental.py:31: ExperimentalWarning: Argument ``multivariate`` is an experimental feature. The interface can change in the future.
  warnings.warn(
/zhome/b1/0/88900/miniconda3/envs/critprops/lib/python3.9/site-packages/optuna/_experimental.py:31: ExperimentalWarning: Argument ``constant_liar`` is an experimental feature. The interface can change in the future.
  warnings.warn(
[I 2024-12-03 18:41:39,437] Trial 43 finished with value: 0.49964403582879074 and parameters: {'kernel': 'rbf', 'C': 3.6539586555307557, 'gamma': 0.08729549614409993, 'epsilon': 0.008409844186251562}. Best is trial 47 with value: 0.38906719949744645.
[I 2024-12-03 18:41:39,446] Trial 34 finished with value: 0.4086486226289003 and parameters: {'kernel': 'rbf', 'C': 88.888674229101, 'gamma': 0.005631930966601161, 'epsilon': 0.012299770213623143}. Best is trial 47 with value: 0.38906719949744645.
/zhome/b1/0/88900/miniconda3/envs/critprops/lib/python3.9/site-packages/optuna/_experimental.py:31: ExperimentalWarning: Argument ``multivariate`` is an experimental feature. The interface can change in the future.
  warnings.warn(
/zhome/b1/0/88900/miniconda3/envs/critprops/lib/python3.9/site-packages/optuna/_experimental.py:31: ExperimentalWarning: Argument ``constant_liar`` is an experimental feature. The interface can change in the future.
  warnings.warn(
[I 2024-12-03 18:41:39,948] Trial 47 finished with value: 0.38906719949744645 and parameters: {'kernel': 'rbf', 'C': 26.420161366130657, 'gamma': 0.06375844230262873, 'epsilon': 0.09576471412039002}. Best is trial 48 with value: 0.37107933732335385.
/zhome/b1/0/88900/miniconda3/envs/critprops/lib/python3.9/site-packages/optuna/_experimental.py:31: ExperimentalWarning: Argument ``multivariate`` is an experimental feature. The interface can change in the future.
  warnings.warn(
/zhome/b1/0/88900/miniconda3/envs/critprops/lib/python3.9/site-packages/optuna/_experimental.py:31: ExperimentalWarning: Argument ``constant_liar`` is an experimental feature. The interface can change in the future.
  warnings.warn(
[I 2024-12-03 18:41:40,286] Trial 35 finished with value: 0.39626001176748377 and parameters: {'kernel': 'rbf', 'C': 58.25087646724038, 'gamma': 0.003443455094473301, 'epsilon': 0.006533644327345308}. Best is trial 48 with value: 0.37107933732335385.
[I 2024-12-03 18:41:40,343] Trial 48 finished with value: 0.37107933732335385 and parameters: {'kernel': 'rbf', 'C': 41.431045639571906, 'gamma': 0.036458869766121164, 'epsilon': 0.15328994110028735}. Best is trial 48 with value: 0.37107933732335385.
[I 2024-12-03 18:41:40,830] Trial 51 finished with value: 0.49419906291215343 and parameters: {'kernel': 'rbf', 'C': 2.8297026428441954, 'gamma': 0.007883014620083562, 'epsilon': 0.05725590384716436}. Best is trial 48 with value: 0.37107933732335385.
[I 2024-12-03 18:41:40,849] Trial 42 finished with value: 0.3966008736898544 and parameters: {'kernel': 'rbf', 'C': 45.50762416906908, 'gamma': 0.005568985741422374, 'epsilon': 0.006617070891131876}. Best is trial 48 with value: 0.37107933732335385.
[I 2024-12-03 18:41:41,114] Trial 32 finished with value: 0.556475185685051 and parameters: {'kernel': 'rbf', 'C': 19.758937123032318, 'gamma': 0.001796680159636542, 'epsilon': 0.6093365697231793}. Best is trial 52 with value: 0.36614321458791227.
/zhome/b1/0/88900/miniconda3/envs/critprops/lib/python3.9/site-packages/optuna/_experimental.py:31: ExperimentalWarning: Argument ``multivariate`` is an experimental feature. The interface can change in the future.
  warnings.warn(
/zhome/b1/0/88900/miniconda3/envs/critprops/lib/python3.9/site-packages/optuna/_experimental.py:31: ExperimentalWarning: Argument ``constant_liar`` is an experimental feature. The interface can change in the future.
  warnings.warn(
[I 2024-12-03 18:41:41,523] Trial 36 finished with value: 0.6905001231779765 and parameters: {'kernel': 'rbf', 'C': 34.51670177774597, 'gamma': 0.4901367668097151, 'epsilon': 0.17781270580315664}. Best is trial 52 with value: 0.36614321458791227.
[I 2024-12-03 18:41:41,666] Trial 46 finished with value: 0.5451667678410013 and parameters: {'kernel': 'rbf', 'C': 81.42154833125521, 'gamma': 0.025489928215154407, 'epsilon': 0.879529646599187}. Best is trial 52 with value: 0.36614321458791227.
[I 2024-12-03 18:41:41,970] Trial 52 finished with value: 0.36614321458791227 and parameters: {'kernel': 'rbf', 'C': 60.6518470631314, 'gamma': 0.03589173328411112, 'epsilon': 0.0928412917344195}. Best is trial 52 with value: 0.36614321458791227.
[I 2024-12-03 18:41:42,135] Trial 60 finished with value: 0.4378454184035025 and parameters: {'kernel': 'rbf', 'C': 51.59247116872251, 'gamma': 0.14242290121710938, 'epsilon': 0.03504288100014622}. Best is trial 52 with value: 0.36614321458791227.
[I 2024-12-03 18:41:42,721] Trial 62 finished with value: 0.4140240599065058 and parameters: {'kernel': 'rbf', 'C': 21.667464287481106, 'gamma': 0.01958147114150265, 'epsilon': 0.16459554996099518}. Best is trial 52 with value: 0.36614321458791227.
[I 2024-12-03 18:41:42,740] Trial 61 finished with value: 0.9318046206625172 and parameters: {'kernel': 'rbf', 'C': 0.00900491320213703, 'gamma': 0.028665747321569027, 'epsilon': 0.3584612221875351}. Best is trial 52 with value: 0.36614321458791227.
[I 2024-12-03 18:41:42,750] Trial 44 finished with value: 0.43709177259398857 and parameters: {'kernel': 'rbf', 'C': 26.92329212739593, 'gamma': 0.0016148268414956518, 'epsilon': 0.001029624354827777}. Best is trial 52 with value: 0.36614321458791227.
