[I 2024-12-04 00:35:28,633] Trial 1967 finished with value: 0.3533080849917955 and parameters: {'kernel': 'linear', 'C': 57.3040769044006, 'gamma': 0.040247172183424725, 'epsilon': 0.005037356808335068}. Best is trial 1479 with value: 0.13978216740910654.
[I 2024-12-04 00:35:28,636] Trial 2233 finished with value: 0.26307548295146366 and parameters: {'kernel': 'rbf', 'C': 26.607917801577365, 'gamma': 0.0021115069329737867, 'epsilon': 0.0026298346495018336}. Best is trial 1479 with value: 0.13978216740910654.
[I 2024-12-04 00:35:30,081] Trial 2230 finished with value: 0.14099087290822634 and parameters: {'kernel': 'rbf', 'C': 98.93906514285815, 'gamma': 0.009629391574760112, 'epsilon': 0.001126324664319614}. Best is trial 1479 with value: 0.13978216740910654.
[I 2024-12-04 00:35:31,102] Trial 2229 finished with value: 0.1697030967044558 and parameters: {'kernel': 'rbf', 'C': 96.35670417798966, 'gamma': 0.016590891240857664, 'epsilon': 0.001020715731192326}. Best is trial 1479 with value: 0.13978216740910654.
[I 2024-12-04 00:35:31,383] Trial 2237 finished with value: 0.5886351526215493 and parameters: {'kernel': 'poly', 'C': 0.0302812679725081, 'gamma': 0.14265511038273931, 'epsilon': 0.4761658899519462}. Best is trial 1479 with value: 0.13978216740910654.
[I 2024-12-04 00:35:31,384] Trial 2235 finished with value: 0.1641724193797928 and parameters: {'kernel': 'rbf', 'C': 30.33491895329449, 'gamma': 0.02644939121009458, 'epsilon': 0.002698469021410666}. Best is trial 1479 with value: 0.13978216740910654.
[I 2024-12-04 00:35:32,089] Trial 2238 finished with value: 17.042292327059123 and parameters: {'kernel': 'sigmoid', 'C': 1.1245862219376064, 'gamma': 0.013304423984059385, 'epsilon': 0.005127203346234877}. Best is trial 1479 with value: 0.13978216740910654.
[I 2024-12-04 00:35:33,575] Trial 2239 finished with value: 0.15681687757132903 and parameters: {'kernel': 'rbf', 'C': 18.093729567861505, 'gamma': 0.01644137497346829, 'epsilon': 0.0027199533448280743}. Best is trial 1479 with value: 0.13978216740910654.
[I 2024-12-04 00:35:33,946] Trial 2241 finished with value: 0.3542934028054768 and parameters: {'kernel': 'rbf', 'C': 0.5754318596961845, 'gamma': 0.02469014478181315, 'epsilon': 0.12090315126573194}. Best is trial 1479 with value: 0.13978216740910654.
[I 2024-12-04 00:35:33,947] Trial 2236 finished with value: 0.5694816819092783 and parameters: {'kernel': 'poly', 'C': 78.27570986926578, 'gamma': 0.008474147588145997, 'epsilon': 0.0010753937355443967}. Best is trial 1479 with value: 0.13978216740910654.
[I 2024-12-04 00:35:34,118] Trial 2234 finished with value: 0.548199963792821 and parameters: {'kernel': 'poly', 'C': 86.91379248553248, 'gamma': 0.009293136122104579, 'epsilon': 0.004877933590151432}. Best is trial 1479 with value: 0.13978216740910654.
[I 2024-12-04 00:35:35,231] Trial 2240 finished with value: 0.14961795314413984 and parameters: {'kernel': 'rbf', 'C': 99.04200857842368, 'gamma': 0.0055146092586405284, 'epsilon': 0.0012661548713492699}. Best is trial 1479 with value: 0.13978216740910654.
[I 2024-12-04 00:35:35,371] Trial 2243 finished with value: 1726.635861184343 and parameters: {'kernel': 'sigmoid', 'C': 78.72195099475074, 'gamma': 0.1289475620343589, 'epsilon': 0.004945032091936035}. Best is trial 1479 with value: 0.13978216740910654.
[I 2024-12-04 00:35:37,469] Trial 2245 finished with value: 0.6364785546477347 and parameters: {'kernel': 'linear', 'C': 0.0010825311029341307, 'gamma': 0.0002735257844262831, 'epsilon': 0.0011471954589419781}. Best is trial 1479 with value: 0.13978216740910654.
[I 2024-12-04 00:35:38,886] Trial 2247 finished with value: 0.9659362194575607 and parameters: {'kernel': 'poly', 'C': 0.0010293793488811754, 'gamma': 0.004269951590132713, 'epsilon': 0.0055326582301116435}. Best is trial 1479 with value: 0.13978216740910654.
[I 2024-12-04 00:35:39,950] Trial 2242 finished with value: 0.16927285694892574 and parameters: {'kernel': 'rbf', 'C': 98.84529790053463, 'gamma': 0.01752251631908765, 'epsilon': 0.0021308054542693304}. Best is trial 1479 with value: 0.13978216740910654.
[I 2024-12-04 00:35:40,027] Trial 2248 finished with value: 0.1779866246101895 and parameters: {'kernel': 'rbf', 'C': 23.548647583592228, 'gamma': 0.009275225445385846, 'epsilon': 0.0010097392033864016}. Best is trial 1479 with value: 0.13978216740910654.
[I 2024-12-04 00:35:40,252] Trial 2250 finished with value: 0.29461605417086345 and parameters: {'kernel': 'rbf', 'C': 20.500038758749668, 'gamma': 0.0015154106316492705, 'epsilon': 0.005616050768901881}. Best is trial 1479 with value: 0.13978216740910654.
[I 2024-12-04 00:35:41,108] Trial 2249 finished with value: 0.1687877703552206 and parameters: {'kernel': 'rbf', 'C': 26.061237625363226, 'gamma': 0.009695790563140204, 'epsilon': 0.0031351978175507386}. Best is trial 1479 with value: 0.13978216740910654.
[I 2024-12-04 00:35:41,309] Trial 2251 finished with value: 0.2625383266352418 and parameters: {'kernel': 'rbf', 'C': 23.40781844704582, 'gamma': 0.0024672517943042063, 'epsilon': 0.006265144103163298}. Best is trial 1479 with value: 0.13978216740910654.
[I 2024-12-04 00:35:43,088] Trial 2252 finished with value: 0.2373293665806983 and parameters: {'kernel': 'rbf', 'C': 87.74476672623418, 'gamma': 0.0012690712923305245, 'epsilon': 0.0026740380864685082}. Best is trial 1479 with value: 0.13978216740910654.
[I 2024-12-04 00:35:44,028] Trial 2253 finished with value: 19.465187110594584 and parameters: {'kernel': 'sigmoid', 'C': 26.135559993150284, 'gamma': 0.00131432125827517, 'epsilon': 0.0025559794387202215}. Best is trial 1479 with value: 0.13978216740910654.
[I 2024-12-04 00:35:45,833] Trial 2257 finished with value: 0.42068803623504375 and parameters: {'kernel': 'rbf', 'C': 2.5428743644702214, 'gamma': 0.0021341591224051134, 'epsilon': 0.0011292332918440417}. Best is trial 1479 with value: 0.13978216740910654.
[I 2024-12-04 00:35:46,071] Trial 1886 finished with value: 0.3525851347750167 and parameters: {'kernel': 'linear', 'C': 97.32687194527135, 'gamma': 0.014065148758346602, 'epsilon': 0.001111773111797077}. Best is trial 1479 with value: 0.13978216740910654.
[I 2024-12-04 00:35:47,102] Trial 2246 finished with value: 0.18842159392320987 and parameters: {'kernel': 'rbf', 'C': 98.2923964414669, 'gamma': 0.034125179500496476, 'epsilon': 0.002696692349938162}. Best is trial 1479 with value: 0.13978216740910654.
[I 2024-12-04 00:35:47,530] Trial 2259 finished with value: 0.24093304521091083 and parameters: {'kernel': 'rbf', 'C': 23.933195375735444, 'gamma': 0.004034484721749956, 'epsilon': 0.0023381790231950263}. Best is trial 1479 with value: 0.13978216740910654.
[I 2024-12-04 00:35:48,002] Trial 2258 finished with value: 0.2004663873402114 and parameters: {'kernel': 'rbf', 'C': 98.02426764492112, 'gamma': 0.002388217260438688, 'epsilon': 0.0016821096767164598}. Best is trial 1479 with value: 0.13978216740910654.
[I 2024-12-04 00:35:49,195] Trial 2254 finished with value: 0.16234095832298118 and parameters: {'kernel': 'rbf', 'C': 87.03042969107302, 'gamma': 0.015201667161591053, 'epsilon': 0.001054139197339035}. Best is trial 1479 with value: 0.13978216740910654.
[I 2024-12-04 00:35:49,196] Trial 2260 finished with value: 0.21482504603300867 and parameters: {'kernel': 'rbf', 'C': 30.97069099255128, 'gamma': 0.004808410467479737, 'epsilon': 0.001010370816311111}. Best is trial 1479 with value: 0.13978216740910654.
[I 2024-12-04 00:35:49,197] Trial 2255 finished with value: 0.16215648361246374 and parameters: {'kernel': 'rbf', 'C': 98.02269981876078, 'gamma': 0.014252403282827807, 'epsilon': 0.002846995091702978}. Best is trial 1479 with value: 0.13978216740910654.
[I 2024-12-04 00:35:49,221] Trial 2256 finished with value: 0.151538142476966 and parameters: {'kernel': 'rbf', 'C': 97.49375803295065, 'gamma': 0.011947471297815971, 'epsilon': 0.004719348607608457}. Best is trial 1479 with value: 0.13978216740910654.
[I 2024-12-04 00:35:49,773] Trial 2261 finished with value: 0.18370520151673028 and parameters: {'kernel': 'rbf', 'C': 97.15843955201696, 'gamma': 0.003056416950307679, 'epsilon': 0.002749771339432458}. Best is trial 1479 with value: 0.13978216740910654.
[I 2024-12-04 00:35:50,842] Trial 2262 finished with value: 0.15132113682669962 and parameters: {'kernel': 'rbf', 'C': 25.285211401798062, 'gamma': 0.014010624334057314, 'epsilon': 0.0028506347997782726}. Best is trial 1479 with value: 0.13978216740910654.
[I 2024-12-04 00:35:51,081] Trial 2264 finished with value: 0.9266878167168241 and parameters: {'kernel': 'rbf', 'C': 0.002449877205107151, 'gamma': 0.0669241879586677, 'epsilon': 0.0046923552700574465}. Best is trial 1479 with value: 0.13978216740910654.
[I 2024-12-04 00:35:51,933] Trial 2263 finished with value: 0.15524795083907225 and parameters: {'kernel': 'rbf', 'C': 96.17426084148597, 'gamma': 0.004708801781827884, 'epsilon': 0.0037623636979787606}. Best is trial 1479 with value: 0.13978216740910654.
[I 2024-12-04 00:35:53,165] Trial 2268 finished with value: 0.25793209681734297 and parameters: {'kernel': 'rbf', 'C': 37.36650729663296, 'gamma': 0.0017652723646049114, 'epsilon': 0.001015246873833646}. Best is trial 1479 with value: 0.13978216740910654.
[I 2024-12-04 00:35:53,756] Trial 2265 finished with value: 0.15398413615627457 and parameters: {'kernel': 'rbf', 'C': 14.800334473134974, 'gamma': 0.020887076267096585, 'epsilon': 0.006765915366450812}. Best is trial 1479 with value: 0.13978216740910654.
[I 2024-12-04 00:35:54,149] Trial 2267 finished with value: 0.22908261142947398 and parameters: {'kernel': 'rbf', 'C': 4.171275450658157, 'gamma': 0.019564847656509014, 'epsilon': 0.002153462646807866}. Best is trial 1479 with value: 0.13978216740910654.
[I 2024-12-04 00:35:54,882] Trial 2269 finished with value: 0.22987613504746238 and parameters: {'kernel': 'rbf', 'C': 15.865293355558586, 'gamma': 0.007009300778800314, 'epsilon': 0.006520009357305424}. Best is trial 1479 with value: 0.13978216740910654.
[I 2024-12-04 00:35:55,316] Trial 1999 finished with value: 0.35390810161428743 and parameters: {'kernel': 'linear', 'C': 85.33840070823561, 'gamma': 0.0073818843148554854, 'epsilon': 0.003480168181121011}. Best is trial 1479 with value: 0.13978216740910654.
[I 2024-12-04 00:35:55,317] Trial 2270 finished with value: 0.17414912915498218 and parameters: {'kernel': 'rbf', 'C': 99.16951764380651, 'gamma': 0.0033815464777478045, 'epsilon': 0.009465887178952666}. Best is trial 1479 with value: 0.13978216740910654.
[I 2024-12-04 00:35:57,301] Trial 2273 finished with value: 0.2036204207495824 and parameters: {'kernel': 'rbf', 'C': 94.9842921122199, 'gamma': 0.002314259981865143, 'epsilon': 0.0011352718509120441}. Best is trial 1479 with value: 0.13978216740910654.
[I 2024-12-04 00:35:57,307] Trial 2271 finished with value: 0.1425199030250185 and parameters: {'kernel': 'rbf', 'C': 94.99598619816186, 'gamma': 0.006686924971472299, 'epsilon': 0.002185727211162661}. Best is trial 1479 with value: 0.13978216740910654.
[I 2024-12-04 00:35:58,123] Trial 2274 finished with value: 0.9041712431917074 and parameters: {'kernel': 'poly', 'C': 73.32861880298998, 'gamma': 0.0006872775580549288, 'epsilon': 0.0033237479410399024}. Best is trial 1479 with value: 0.13978216740910654.
[I 2024-12-04 00:35:58,423] Trial 2272 finished with value: 0.1485422080115534 and parameters: {'kernel': 'rbf', 'C': 99.24308469813019, 'gamma': 0.005634415463518556, 'epsilon': 0.0010327763120046105}. Best is trial 1479 with value: 0.13978216740910654.
[I 2024-12-04 00:35:59,908] Trial 2275 finished with value: 0.1519633420051013 and parameters: {'kernel': 'rbf', 'C': 90.7638695569966, 'gamma': 0.005406668177017769, 'epsilon': 0.0011255697667658924}. Best is trial 1479 with value: 0.13978216740910654.
[I 2024-12-04 00:36:00,459] Trial 2276 finished with value: 0.20792925937801449 and parameters: {'kernel': 'rbf', 'C': 9.930404496769894, 'gamma': 0.06671502457723259, 'epsilon': 0.002657632654138215}. Best is trial 1479 with value: 0.13978216740910654.
[I 2024-12-04 00:36:00,461] Trial 2277 finished with value: 0.2373731657781135 and parameters: {'kernel': 'rbf', 'C': 19.30545943517949, 'gamma': 0.005150476545888658, 'epsilon': 0.0023094840347168415}. Best is trial 1479 with value: 0.13978216740910654.
[I 2024-12-04 00:36:02,137] Trial 2278 finished with value: 0.1523086283718705 and parameters: {'kernel': 'rbf', 'C': 18.79580348601562, 'gamma': 0.02519611312905353, 'epsilon': 0.0010484285866186828}. Best is trial 1479 with value: 0.13978216740910654.
[I 2024-12-04 00:36:03,263] Trial 2280 finished with value: 0.150832937418343 and parameters: {'kernel': 'rbf', 'C': 17.649603346369837, 'gamma': 0.024274927702655796, 'epsilon': 0.002421503621925255}. Best is trial 1479 with value: 0.13978216740910654.
[I 2024-12-04 00:36:03,453] Trial 2279 finished with value: 0.16157492483984795 and parameters: {'kernel': 'rbf', 'C': 26.07935690771853, 'gamma': 0.010862861859341941, 'epsilon': 0.0022618770857622946}. Best is trial 1479 with value: 0.13978216740910654.
[I 2024-12-04 00:36:04,605] Trial 2282 finished with value: 0.19681016097790632 and parameters: {'kernel': 'rbf', 'C': 99.81634919140879, 'gamma': 0.0025204715304837162, 'epsilon': 0.0012334393113890352}. Best is trial 1479 with value: 0.13978216740910654.
[I 2024-12-04 00:36:05,240] Trial 2285 finished with value: 0.2701320888145161 and parameters: {'kernel': 'rbf', 'C': 13.900793090852568, 'gamma': 0.0033998593562390603, 'epsilon': 0.0023629017324458255}. Best is trial 1479 with value: 0.13978216740910654.
[I 2024-12-04 00:36:06,637] Trial 2286 finished with value: 4.480911118016958 and parameters: {'kernel': 'sigmoid', 'C': 0.1726691801517782, 'gamma': 0.22496141840449835, 'epsilon': 0.43237038150141466}. Best is trial 1479 with value: 0.13978216740910654.
[I 2024-12-04 00:36:09,678] Trial 2289 finished with value: 0.16385231228222355 and parameters: {'kernel': 'rbf', 'C': 21.961718815507485, 'gamma': 0.012209063054749825, 'epsilon': 0.002392549888261344}. Best is trial 1479 with value: 0.13978216740910654.
[I 2024-12-04 00:36:09,680] Trial 2281 finished with value: 0.15792092488884266 and parameters: {'kernel': 'rbf', 'C': 93.38809669944122, 'gamma': 0.013305440640335892, 'epsilon': 0.0010837698118868263}. Best is trial 1479 with value: 0.13978216740910654.
[I 2024-12-04 00:36:10,526] Trial 2284 finished with value: 0.13948515847988838 and parameters: {'kernel': 'rbf', 'C': 99.55812542982332, 'gamma': 0.008315847013867483, 'epsilon': 0.0011116288478546675}. Best is trial 2284 with value: 0.13948515847988838.
[I 2024-12-04 00:36:11,744] Trial 2290 finished with value: 0.15873989789769793 and parameters: {'kernel': 'rbf', 'C': 93.7582878952531, 'gamma': 0.004497805896382025, 'epsilon': 0.0026393536214989054}. Best is trial 2284 with value: 0.13948515847988838.
[I 2024-12-04 00:36:11,942] Trial 2291 finished with value: 0.15645917899860595 and parameters: {'kernel': 'rbf', 'C': 24.04897180711016, 'gamma': 0.013078989585361706, 'epsilon': 0.002714150941522399}. Best is trial 2284 with value: 0.13948515847988838.
[I 2024-12-04 00:36:13,568] Trial 2283 finished with value: 0.17227617952450924 and parameters: {'kernel': 'rbf', 'C': 90.15070245881525, 'gamma': 0.020933726572697355, 'epsilon': 0.0010106588479630216}. Best is trial 2284 with value: 0.13948515847988838.
[I 2024-12-04 00:36:14,482] Trial 2294 finished with value: 29.04560082840057 and parameters: {'kernel': 'sigmoid', 'C': 7.188633349723821, 'gamma': 0.0033052700959960084, 'epsilon': 0.0019450824495881778}. Best is trial 2284 with value: 0.13948515847988838.
[I 2024-12-04 00:36:14,559] Trial 2293 finished with value: 0.17118681297496802 and parameters: {'kernel': 'rbf', 'C': 25.42809475987314, 'gamma': 0.009543474688602617, 'epsilon': 0.0016372662358930534}. Best is trial 2284 with value: 0.13948515847988838.
[I 2024-12-04 00:36:14,672] Trial 2292 finished with value: 0.16787367214361118 and parameters: {'kernel': 'rbf', 'C': 34.59303669734791, 'gamma': 0.007954491233213682, 'epsilon': 0.0010070815826624365}. Best is trial 2284 with value: 0.13948515847988838.
[I 2024-12-04 00:36:14,826] Trial 2288 finished with value: 0.17699691319288569 and parameters: {'kernel': 'rbf', 'C': 94.87253917896024, 'gamma': 0.024862972609338292, 'epsilon': 0.00350535893150392}. Best is trial 2284 with value: 0.13948515847988838.
[I 2024-12-04 00:36:16,375] Trial 2296 finished with value: 0.268995208899211 and parameters: {'kernel': 'rbf', 'C': 5.636816898223028, 'gamma': 0.007744264096222154, 'epsilon': 0.0010676143756994463}. Best is trial 2284 with value: 0.13948515847988838.
[I 2024-12-04 00:36:17,167] Trial 2295 finished with value: 0.15085611494958046 and parameters: {'kernel': 'rbf', 'C': 31.623742520343715, 'gamma': 0.01166272869950485, 'epsilon': 0.0010804653356526178}. Best is trial 2284 with value: 0.13948515847988838.
[I 2024-12-04 00:36:17,543] Trial 1758 finished with value: 0.6174229944354859 and parameters: {'kernel': 'poly', 'C': 90.57228579879512, 'gamma': 0.022113043890700432, 'epsilon': 0.002211601121640487}. Best is trial 2284 with value: 0.13948515847988838.
[I 2024-12-04 00:36:17,802] Trial 2297 finished with value: 0.22550405807278773 and parameters: {'kernel': 'rbf', 'C': 68.78091111367793, 'gamma': 0.002148328850852173, 'epsilon': 0.0010151753440315772}. Best is trial 2284 with value: 0.13948515847988838.
[I 2024-12-04 00:36:17,899] Trial 2298 finished with value: 0.951448736435239 and parameters: {'kernel': 'rbf', 'C': 0.0076338165141002405, 'gamma': 0.0016786653401443632, 'epsilon': 0.5382601189185414}. Best is trial 2284 with value: 0.13948515847988838.
[I 2024-12-04 00:36:20,427] Trial 2300 finished with value: 0.22825380614060398 and parameters: {'kernel': 'rbf', 'C': 20.501887211875534, 'gamma': 0.005651651764599496, 'epsilon': 0.0024150710254741627}. Best is trial 2284 with value: 0.13948515847988838.
[I 2024-12-04 00:36:22,225] Trial 2301 finished with value: 0.32410871426929955 and parameters: {'kernel': 'linear', 'C': 5.103361568301133, 'gamma': 0.015392594921534044, 'epsilon': 0.3466722054354033}. Best is trial 2284 with value: 0.13948515847988838.
[I 2024-12-04 00:36:22,573] Trial 2302 finished with value: 0.819907232045824 and parameters: {'kernel': 'poly', 'C': 18.939524965484328, 'gamma': 0.002656556662520477, 'epsilon': 0.0011766160677246817}. Best is trial 2284 with value: 0.13948515847988838.
[I 2024-12-04 00:36:23,801] Trial 2303 finished with value: 0.2679109050419167 and parameters: {'kernel': 'rbf', 'C': 16.4880872478455, 'gamma': 0.003075134239897036, 'epsilon': 0.0010620503168401608}. Best is trial 2284 with value: 0.13948515847988838.
[I 2024-12-04 00:36:27,232] Trial 2299 finished with value: 0.19250676479044632 and parameters: {'kernel': 'rbf', 'C': 99.89351273470132, 'gamma': 0.03697297780169005, 'epsilon': 0.0024442888445532955}. Best is trial 2284 with value: 0.13948515847988838.
[I 2024-12-04 00:36:28,975] Trial 2305 finished with value: 0.14079291024130158 and parameters: {'kernel': 'rbf', 'C': 94.83147718283239, 'gamma': 0.00778857228572169, 'epsilon': 0.0031940779868012983}. Best is trial 2284 with value: 0.13948515847988838.
[I 2024-12-04 00:36:29,051] Trial 2304 finished with value: 0.14081381482275726 and parameters: {'kernel': 'rbf', 'C': 83.92997125932922, 'gamma': 0.008396426970348642, 'epsilon': 0.001109028107498551}. Best is trial 2284 with value: 0.13948515847988838.
[I 2024-12-04 00:36:30,004] Trial 2307 finished with value: 0.17485698538273312 and parameters: {'kernel': 'rbf', 'C': 37.25303261515604, 'gamma': 0.029506755955911696, 'epsilon': 0.0010074633698782364}. Best is trial 2284 with value: 0.13948515847988838.
[I 2024-12-04 00:36:30,622] Trial 2310 finished with value: 0.15694733442900471 and parameters: {'kernel': 'rbf', 'C': 31.055018354216074, 'gamma': 0.010112182557001416, 'epsilon': 0.0010346684081308955}. Best is trial 2284 with value: 0.13948515847988838.
[I 2024-12-04 00:36:32,513] Trial 2311 finished with value: 0.18938764926516283 and parameters: {'kernel': 'rbf', 'C': 56.258844521733565, 'gamma': 0.0041573856810127475, 'epsilon': 0.0010120675682011842}. Best is trial 2284 with value: 0.13948515847988838.
[I 2024-12-04 00:36:34,175] Trial 2312 finished with value: 0.23459068828822888 and parameters: {'kernel': 'rbf', 'C': 19.075861708029684, 'gamma': 0.0054674237423135074, 'epsilon': 0.0023069133545534515}. Best is trial 2284 with value: 0.13948515847988838.
[I 2024-12-04 00:36:35,987] Trial 2313 finished with value: 0.15283200104822747 and parameters: {'kernel': 'rbf', 'C': 25.54836185530552, 'gamma': 0.013437361609516347, 'epsilon': 0.0024189642189122442}. Best is trial 2284 with value: 0.13948515847988838.
[I 2024-12-04 00:36:35,987] Trial 2308 finished with value: 0.18006474900216013 and parameters: {'kernel': 'rbf', 'C': 98.35810710315084, 'gamma': 0.02631533087848003, 'epsilon': 0.001364473905896251}. Best is trial 2284 with value: 0.13948515847988838.
[I 2024-12-04 00:36:40,276] Trial 2317 finished with value: 0.1702260620106127 and parameters: {'kernel': 'rbf', 'C': 96.16722976311674, 'gamma': 0.00363450364537179, 'epsilon': 0.0020061318605527415}. Best is trial 2284 with value: 0.13948515847988838.
[I 2024-12-04 00:36:40,752] Trial 2314 finished with value: 0.14336416958714132 and parameters: {'kernel': 'rbf', 'C': 85.61531389258809, 'gamma': 0.01073237913466593, 'epsilon': 0.0010575197649633531}. Best is trial 2284 with value: 0.13948515847988838.
[I 2024-12-04 00:36:40,849] Trial 2316 finished with value: 0.20632779802548215 and parameters: {'kernel': 'rbf', 'C': 26.629731473994305, 'gamma': 0.06209444616386552, 'epsilon': 0.002714959232949669}. Best is trial 2284 with value: 0.13948515847988838.
[I 2024-12-04 00:36:41,268] Trial 2318 finished with value: 0.17369927977067648 and parameters: {'kernel': 'rbf', 'C': 17.878236769193098, 'gamma': 0.01240078306658915, 'epsilon': 0.001077318317429444}. Best is trial 2284 with value: 0.13948515847988838.
