[I 2024-12-04 19:40:23,768] Using an existing study with name 'Pc_gpr' instead of creating a new one.
[I 2024-12-04 19:40:32,792] Trial 33 finished with value: 0.4226898273205247 and parameters: {'kernel_type': 'Matern', 'length_scale': 0.3336517176673478, 'noise_level': 0.007426340227389641, 'constant_value': 0.002679573507962286, 'nu': 1.5}. Best is trial 3 with value: 0.42268980113309695.
[I 2024-12-04 19:40:34,523] Trial 32 finished with value: 1.0624160818561168 and parameters: {'kernel_type': 'Matern', 'length_scale': 0.08835218666331172, 'noise_level': 0.012979346124267944, 'constant_value': 0.0006447085303159871, 'nu': 1.5}. Best is trial 3 with value: 0.42268980113309695.
[I 2024-12-04 19:40:36,232] Trial 34 finished with value: 0.4226899251760968 and parameters: {'kernel_type': 'Matern', 'length_scale': 0.1993981769880915, 'noise_level': 0.0019036019717957495, 'constant_value': 0.0005019753451110975, 'nu': 1.5}. Best is trial 3 with value: 0.42268980113309695.
[I 2024-12-04 19:40:37,779] Trial 35 finished with value: 1.0916558488439472 and parameters: {'kernel_type': 'RBF', 'length_scale': 0.22960425634669157, 'noise_level': 1.590784668077005e-05, 'constant_value': 43575.643119231776, 'nu': 0.5}. Best is trial 3 with value: 0.42268980113309695.
[I 2024-12-04 19:40:45,074] Trial 36 finished with value: 1.0624161181187621 and parameters: {'kernel_type': 'Matern', 'length_scale': 29.786931375090624, 'noise_level': 0.021794766050228124, 'constant_value': 1.6470122477105633, 'nu': 2.5}. Best is trial 3 with value: 0.42268980113309695.
[I 2024-12-04 19:40:45,986] Trial 38 finished with value: 1.062416117244144 and parameters: {'kernel_type': 'Matern', 'length_scale': 0.018687749834165074, 'noise_level': 0.049459175172039176, 'constant_value': 738.5230933248296, 'nu': 1.5}. Best is trial 3 with value: 0.42268980113309695.
[I 2024-12-04 19:40:48,539] Trial 37 finished with value: 1.0624161173326625 and parameters: {'kernel_type': 'Matern', 'length_scale': 678.4353899067398, 'noise_level': 0.0005239044057799433, 'constant_value': 0.0181523089410545, 'nu': 1.5}. Best is trial 3 with value: 0.42268980113309695.
[I 2024-12-04 19:40:51,187] Trial 40 finished with value: 1.0624161171288016 and parameters: {'kernel_type': 'RBF', 'length_scale': 3.6518095247506963, 'noise_level': 0.00028240118069166584, 'constant_value': 0.06321270296360079, 'nu': 0.5}. Best is trial 3 with value: 0.42268980113309695.
[I 2024-12-04 19:40:56,831] Trial 42 finished with value: 0.35921129848478583 and parameters: {'kernel_type': 'Matern', 'length_scale': 0.9994755383090957, 'noise_level': 0.06206424705874526, 'constant_value': 0.10713267082643865, 'nu': 0.5}. Best is trial 42 with value: 0.35921129848478583.
[I 2024-12-04 19:40:59,192] Trial 39 finished with value: 0.4226898444987622 and parameters: {'kernel_type': 'Matern', 'length_scale': 7.152782465715206, 'noise_level': 0.43420903348756845, 'constant_value': 8.243047476002693e-07, 'nu': 1.5}. Best is trial 42 with value: 0.35921129848478583.
[I 2024-12-04 19:40:59,809] Trial 41 finished with value: 0.4226867011575964 and parameters: {'kernel_type': 'Matern', 'length_scale': 1.3748811381635853, 'noise_level': 4.49653985422047e-05, 'constant_value': 0.00030461038678006764, 'nu': 1.5}. Best is trial 42 with value: 0.35921129848478583.
[I 2024-12-04 19:41:01,512] Trial 44 finished with value: 1.091656728006505 and parameters: {'kernel_type': 'Matern', 'length_scale': 31169.678857133124, 'noise_level': 0.5966231582529702, 'constant_value': 6.0718643214451276e-05, 'nu': 1.5}. Best is trial 42 with value: 0.35921129848478583.
[I 2024-12-04 19:41:05,280] Trial 43 finished with value: 0.3592112972071051 and parameters: {'kernel_type': 'Matern', 'length_scale': 0.11772749628374228, 'noise_level': 0.0330099102698923, 'constant_value': 0.1451462375086548, 'nu': 0.5}. Best is trial 43 with value: 0.3592112972071051.
[I 2024-12-04 19:41:09,668] Trial 45 finished with value: 0.4195660127481174 and parameters: {'kernel_type': 'Matern', 'length_scale': 0.3925189884163444, 'noise_level': 0.00017587175918980347, 'constant_value': 0.0003684405113111804, 'nu': 2.5}. Best is trial 43 with value: 0.3592112972071051.
[I 2024-12-04 19:41:11,354] Trial 46 finished with value: 1.0624161183431833 and parameters: {'kernel_type': 'Matern', 'length_scale': 95.99392324369192, 'noise_level': 0.00010975376094825393, 'constant_value': 4.7099512478360126e-07, 'nu': 1.5}. Best is trial 43 with value: 0.3592112972071051.
[I 2024-12-04 19:41:13,812] Trial 47 finished with value: 0.3592112606896346 and parameters: {'kernel_type': 'Matern', 'length_scale': 0.5002971444218278, 'noise_level': 0.006005751671281413, 'constant_value': 0.000447548580333143, 'nu': 0.5}. Best is trial 47 with value: 0.3592112606896346.
[I 2024-12-04 19:41:13,905] Trial 48 finished with value: 1.0624161168554127 and parameters: {'kernel_type': 'Matern', 'length_scale': 0.033594816126198655, 'noise_level': 0.02755713311761692, 'constant_value': 35.872047464375946, 'nu': 0.5}. Best is trial 47 with value: 0.3592112606896346.
[I 2024-12-04 19:41:16,877] Trial 49 finished with value: 0.3592108850713264 and parameters: {'kernel_type': 'Matern', 'length_scale': 231.18880889539653, 'noise_level': 0.19467522088141306, 'constant_value': 0.031361943277116694, 'nu': 0.5}. Best is trial 49 with value: 0.3592108850713264.
[I 2024-12-04 19:41:20,318] Trial 51 finished with value: 1.0624161174790536 and parameters: {'kernel_type': 'Matern', 'length_scale': 2.998524049285032, 'noise_level': 1.974828144092691e-06, 'constant_value': 6.160075831645444e-05, 'nu': 2.5}. Best is trial 49 with value: 0.3592108850713264.
[I 2024-12-04 19:41:23,607] Trial 52 finished with value: 0.3592111281671255 and parameters: {'kernel_type': 'Matern', 'length_scale': 4.190629572728499, 'noise_level': 0.6106564352567403, 'constant_value': 0.001740411174028485, 'nu': 0.5}. Best is trial 49 with value: 0.3592108850713264.
[I 2024-12-04 19:41:24,035] Trial 50 finished with value: 0.41956501798463025 and parameters: {'kernel_type': 'Matern', 'length_scale': 0.4986992954247918, 'noise_level': 0.00012884752174085207, 'constant_value': 0.0004625810362203085, 'nu': 2.5}. Best is trial 49 with value: 0.3592108850713264.
[I 2024-12-04 19:41:26,145] Trial 53 finished with value: 0.35921123871334054 and parameters: {'kernel_type': 'Matern', 'length_scale': 1110.4322845663514, 'noise_level': 0.006604515617860128, 'constant_value': 47.08890616380264, 'nu': 0.5}. Best is trial 49 with value: 0.3592108850713264.
[I 2024-12-04 19:41:26,998] Trial 55 finished with value: 1.0916434000963 and parameters: {'kernel_type': 'Matern', 'length_scale': 170.03505813273347, 'noise_level': 0.24444997820050382, 'constant_value': 5.397311943659351e-06, 'nu': 0.5}. Best is trial 49 with value: 0.3592108850713264.
[I 2024-12-04 19:41:27,976] Trial 54 finished with value: 0.35921141672240336 and parameters: {'kernel_type': 'Matern', 'length_scale': 3.9444479438559785, 'noise_level': 0.7900734527408529, 'constant_value': 0.06886485648466505, 'nu': 0.5}. Best is trial 49 with value: 0.3592108850713264.
[I 2024-12-04 19:41:31,597] Trial 56 finished with value: 0.3592112490214549 and parameters: {'kernel_type': 'Matern', 'length_scale': 2712.5233214556574, 'noise_level': 0.052175831644917035, 'constant_value': 0.2936103972079949, 'nu': 0.5}. Best is trial 49 with value: 0.3592108850713264.
[I 2024-12-04 19:41:34,452] Trial 57 finished with value: 0.35921122396289296 and parameters: {'kernel_type': 'Matern', 'length_scale': 0.1474193915155428, 'noise_level': 0.005533307700012687, 'constant_value': 0.0007331845875387034, 'nu': 0.5}. Best is trial 49 with value: 0.3592108850713264.
[I 2024-12-04 19:41:34,781] Trial 58 finished with value: 0.3592112495672548 and parameters: {'kernel_type': 'Matern', 'length_scale': 18257.41563347182, 'noise_level': 0.0028785543014921517, 'constant_value': 202.28890069004746, 'nu': 0.5}. Best is trial 49 with value: 0.3592108850713264.
[I 2024-12-04 19:41:36,983] Trial 59 finished with value: 1.0916549377517162 and parameters: {'kernel_type': 'RBF', 'length_scale': 6233.510822932305, 'noise_level': 0.17289111746827676, 'constant_value': 1.3129907614558984, 'nu': 0.5}. Best is trial 49 with value: 0.3592108850713264.
[I 2024-12-04 19:41:39,194] Trial 60 finished with value: 0.35921125279966476 and parameters: {'kernel_type': 'Matern', 'length_scale': 7748.781636872342, 'noise_level': 0.12097423139411072, 'constant_value': 887.2294621348871, 'nu': 0.5}. Best is trial 49 with value: 0.3592108850713264.
[I 2024-12-04 19:41:43,331] Trial 62 finished with value: 1.0624161174876603 and parameters: {'kernel_type': 'Matern', 'length_scale': 36065.24648671894, 'noise_level': 0.005369016003121922, 'constant_value': 154.1486481681388, 'nu': 1.5}. Best is trial 49 with value: 0.3592108850713264.
[I 2024-12-04 19:41:43,343] Trial 61 finished with value: 0.359211250246017 and parameters: {'kernel_type': 'Matern', 'length_scale': 8372.198551994128, 'noise_level': 0.1295293686807183, 'constant_value': 0.0072766686545716235, 'nu': 0.5}. Best is trial 49 with value: 0.3592108850713264.
[I 2024-12-04 19:41:43,882] Trial 63 finished with value: 0.3592113138049426 and parameters: {'kernel_type': 'Matern', 'length_scale': 916.881366421936, 'noise_level': 0.0046720163229841, 'constant_value': 10.014439658826753, 'nu': 0.5}. Best is trial 49 with value: 0.3592108850713264.
[I 2024-12-04 19:41:49,912] Trial 64 finished with value: 1.091656728503642 and parameters: {'kernel_type': 'Matern', 'length_scale': 45458.28611102208, 'noise_level': 0.005123114841525476, 'constant_value': 0.0037866669788773786, 'nu': 2.5}. Best is trial 49 with value: 0.3592108850713264.
[I 2024-12-04 19:41:50,679] Trial 65 finished with value: 0.35921149116403006 and parameters: {'kernel_type': 'Matern', 'length_scale': 1847.7383604229822, 'noise_level': 0.6279225586249837, 'constant_value': 0.039353246279554624, 'nu': 0.5}. Best is trial 49 with value: 0.3592108850713264.
[I 2024-12-04 19:41:53,768] Trial 68 finished with value: 1.091656674934911 and parameters: {'kernel_type': 'Matern', 'length_scale': 16.9272065143429, 'noise_level': 5.1576814241367875e-05, 'constant_value': 20562.068088770186, 'nu': 0.5}. Best is trial 49 with value: 0.3592108850713264.
[I 2024-12-04 19:41:54,325] Trial 66 finished with value: 1.0624161172710918 and parameters: {'kernel_type': 'Matern', 'length_scale': 3175.5558932310064, 'noise_level': 0.01343527844919122, 'constant_value': 0.0050856646456865435, 'nu': 0.5}. Best is trial 49 with value: 0.3592108850713264.
[I 2024-12-04 19:41:57,953] Trial 69 finished with value: 1.0624161094303377 and parameters: {'kernel_type': 'Matern', 'length_scale': 0.00021634271044943383, 'noise_level': 0.0002544675497808865, 'constant_value': 0.002576838510485115, 'nu': 0.5}. Best is trial 49 with value: 0.3592108850713264.
[I 2024-12-04 19:41:58,085] Trial 67 finished with value: 1.06241611729408 and parameters: {'kernel_type': 'Matern', 'length_scale': 23058.172174560943, 'noise_level': 0.0008476049697290609, 'constant_value': 3560.376334744946, 'nu': 2.5}. Best is trial 49 with value: 0.3592108850713264.
[I 2024-12-04 19:41:59,821] Trial 70 finished with value: 0.3592112928020657 and parameters: {'kernel_type': 'Matern', 'length_scale': 18334.103291721418, 'noise_level': 0.08214977550159931, 'constant_value': 1.913906517865463, 'nu': 0.5}. Best is trial 49 with value: 0.3592108850713264.
[I 2024-12-04 19:42:02,409] Trial 73 finished with value: 1.0916166085821055 and parameters: {'kernel_type': 'Matern', 'length_scale': 26.19445823393939, 'noise_level': 0.0372814273834825, 'constant_value': 0.0008944608454463437, 'nu': 0.5}. Best is trial 49 with value: 0.3592108850713264.
[I 2024-12-04 19:42:03,505] Trial 71 finished with value: 0.359211217621193 and parameters: {'kernel_type': 'Matern', 'length_scale': 7195.049705413615, 'noise_level': 0.002393025780791775, 'constant_value': 1468.2317699667628, 'nu': 0.5}. Best is trial 49 with value: 0.3592108850713264.
[I 2024-12-04 19:42:04,169] Trial 72 finished with value: 0.4226898123500212 and parameters: {'kernel_type': 'Matern', 'length_scale': 45.64331377990882, 'noise_level': 0.5810714197146856, 'constant_value': 6.534383807730578, 'nu': 1.5}. Best is trial 49 with value: 0.3592108850713264.
[I 2024-12-04 19:42:08,986] Trial 76 finished with value: 1.062416117344015 and parameters: {'kernel_type': 'Matern', 'length_scale': 18608.999848287796, 'noise_level': 0.0001361291975039862, 'constant_value': 1.8242905513156653, 'nu': 0.5}. Best is trial 49 with value: 0.3592108850713264.
[I 2024-12-04 19:42:09,339] Trial 74 finished with value: 1.0914738425647517 and parameters: {'kernel_type': 'RBF', 'length_scale': 346.0016022144799, 'noise_level': 0.6885346072710187, 'constant_value': 0.0006189203857238322, 'nu': 0.5}. Best is trial 49 with value: 0.3592108850713264.
[I 2024-12-04 19:42:10,639] Trial 75 finished with value: 1.0624161172689266 and parameters: {'kernel_type': 'RBF', 'length_scale': 3288.399478428078, 'noise_level': 0.014659279057193973, 'constant_value': 2233.044199023326, 'nu': 0.5}. Best is trial 49 with value: 0.3592108850713264.
[I 2024-12-04 19:42:14,683] Trial 77 finished with value: 0.3592112494785465 and parameters: {'kernel_type': 'Matern', 'length_scale': 2806.81043917852, 'noise_level': 0.0009319859643655017, 'constant_value': 1367.2089481890623, 'nu': 0.5}. Best is trial 49 with value: 0.3592108850713264.
[I 2024-12-04 19:42:15,636] Trial 78 finished with value: 1.0916566813976727 and parameters: {'kernel_type': 'Matern', 'length_scale': 59432.6390565945, 'noise_level': 0.04545313835391892, 'constant_value': 0.0006711583097749435, 'nu': 0.5}. Best is trial 49 with value: 0.3592108850713264.
[I 2024-12-04 19:42:16,692] Trial 79 finished with value: 0.35921123733463456 and parameters: {'kernel_type': 'Matern', 'length_scale': 480.974106661695, 'noise_level': 0.0011029043714197793, 'constant_value': 158.8841535624437, 'nu': 0.5}. Best is trial 49 with value: 0.3592108850713264.
[I 2024-12-04 19:42:20,211] Trial 80 finished with value: 0.35921124771471974 and parameters: {'kernel_type': 'Matern', 'length_scale': 1222.293244158454, 'noise_level': 0.002264256741436777, 'constant_value': 2508.1518184326846, 'nu': 0.5}. Best is trial 49 with value: 0.3592108850713264.
[I 2024-12-04 19:42:23,156] Trial 81 finished with value: 0.3592112539901543 and parameters: {'kernel_type': 'Matern', 'length_scale': 24832.645792246924, 'noise_level': 0.009770802455748939, 'constant_value': 91216.91427806194, 'nu': 0.5}. Best is trial 49 with value: 0.3592108850713264.
[I 2024-12-04 19:42:28,356] Trial 83 finished with value: 0.3989623509496524 and parameters: {'kernel_type': 'Matern', 'length_scale': 0.15487801299451662, 'noise_level': 0.724284193201231, 'constant_value': 0.0008335289862551216, 'nu': 0.5}. Best is trial 49 with value: 0.3592108850713264.
[I 2024-12-04 19:42:29,556] Trial 84 finished with value: 0.4195659794833102 and parameters: {'kernel_type': 'Matern', 'length_scale': 607.1895674397958, 'noise_level': 0.7627160200720903, 'constant_value': 302.5893020211378, 'nu': 2.5}. Best is trial 49 with value: 0.3592108850713264.
[I 2024-12-04 19:42:32,595] Trial 82 finished with value: 0.4195662024001202 and parameters: {'kernel_type': 'Matern', 'length_scale': 0.45358721971500493, 'noise_level': 0.16496105809689723, 'constant_value': 9.679753424519484e-06, 'nu': 2.5}. Best is trial 49 with value: 0.3592108850713264.
[I 2024-12-04 19:42:33,377] Trial 85 finished with value: 0.3592112519684685 and parameters: {'kernel_type': 'Matern', 'length_scale': 74.619753106536, 'noise_level': 0.5230579908305194, 'constant_value': 484.88204337601417, 'nu': 0.5}. Best is trial 49 with value: 0.3592108850713264.
[I 2024-12-04 19:42:34,415] Trial 86 finished with value: 0.35921122607053424 and parameters: {'kernel_type': 'Matern', 'length_scale': 193.79944946573082, 'noise_level': 0.0026286470128949794, 'constant_value': 1255.7736072217963, 'nu': 0.5}. Best is trial 49 with value: 0.3592108850713264.
[I 2024-12-04 19:42:37,924] Trial 87 finished with value: 0.3592116227863807 and parameters: {'kernel_type': 'Matern', 'length_scale': 1581.7801670178783, 'noise_level': 7.080987053539009e-05, 'constant_value': 27062.818317249887, 'nu': 0.5}. Best is trial 49 with value: 0.3592108850713264.
[I 2024-12-04 19:42:38,988] Trial 89 finished with value: 0.359211245030557 and parameters: {'kernel_type': 'Matern', 'length_scale': 21.57284103835217, 'noise_level': 0.0024446486773265436, 'constant_value': 1009.5908468336007, 'nu': 0.5}. Best is trial 49 with value: 0.3592108850713264.
[I 2024-12-04 19:42:39,838] Trial 88 finished with value: 1.062416117275899 and parameters: {'kernel_type': 'Matern', 'length_scale': 126.97328007091254, 'noise_level': 9.609786853660313e-06, 'constant_value': 4.853248378670381, 'nu': 0.5}. Best is trial 49 with value: 0.3592108850713264.
[I 2024-12-04 19:42:41,702] Trial 91 finished with value: 1.0916558292090262 and parameters: {'kernel_type': 'RBF', 'length_scale': 1.3400353833723994e-05, 'noise_level': 0.13857152404036982, 'constant_value': 6.97442642262565e-07, 'nu': 2.5}. Best is trial 49 with value: 0.3592108850713264.
[I 2024-12-04 19:42:42,658] Trial 90 finished with value: 0.35921163355503616 and parameters: {'kernel_type': 'Matern', 'length_scale': 575.0476986640589, 'noise_level': 0.00182108992640024, 'constant_value': 208.92595097757516, 'nu': 0.5}. Best is trial 49 with value: 0.3592108850713264.
[I 2024-12-04 19:42:47,612] Trial 94 finished with value: 0.359211134270609 and parameters: {'kernel_type': 'Matern', 'length_scale': 8.481675490667346, 'noise_level': 0.004657411445287971, 'constant_value': 623.1561035223139, 'nu': 0.5}. Best is trial 49 with value: 0.3592108850713264.
[I 2024-12-04 19:42:48,809] Trial 92 finished with value: 0.42268978432735765 and parameters: {'kernel_type': 'Matern', 'length_scale': 127.03738626356014, 'noise_level': 4.000480785459991e-05, 'constant_value': 6589.419869625826, 'nu': 1.5}. Best is trial 49 with value: 0.3592108850713264.
[I 2024-12-04 19:42:50,403] Trial 93 finished with value: 1.062416117327402 and parameters: {'kernel_type': 'RBF', 'length_scale': 324.19615996653846, 'noise_level': 2.1725636653645797e-05, 'constant_value': 58.58244460480323, 'nu': 0.5}. Best is trial 49 with value: 0.3592108850713264.
[I 2024-12-04 19:42:51,262] Trial 95 finished with value: 0.428683518201221 and parameters: {'kernel_type': 'RBF', 'length_scale': 0.4370210689973534, 'noise_level': 0.00012782825076747807, 'constant_value': 21.583406687152472, 'nu': 2.5}. Best is trial 49 with value: 0.3592108850713264.
[I 2024-12-04 19:42:54,272] Trial 96 finished with value: 0.35921122014072804 and parameters: {'kernel_type': 'Matern', 'length_scale': 2.8438217254911224, 'noise_level': 0.044558370315370986, 'constant_value': 165.97657799730717, 'nu': 0.5}. Best is trial 49 with value: 0.3592108850713264.
[I 2024-12-04 19:42:54,794] Trial 97 finished with value: 0.35921094048902025 and parameters: {'kernel_type': 'Matern', 'length_scale': 14.587715517225908, 'noise_level': 0.001203574825085987, 'constant_value': 27.01919031618457, 'nu': 0.5}. Best is trial 49 with value: 0.3592108850713264.
[I 2024-12-04 19:42:56,217] Trial 98 finished with value: 0.3592111719663717 and parameters: {'kernel_type': 'Matern', 'length_scale': 29.34483764320503, 'noise_level': 0.004670069763002756, 'constant_value': 3491.9609785861835, 'nu': 0.5}. Best is trial 49 with value: 0.3592108850713264.
[I 2024-12-04 19:43:00,206] Trial 99 finished with value: 0.3592111745950592 and parameters: {'kernel_type': 'Matern', 'length_scale': 0.3199784894436668, 'noise_level': 0.995009958330754, 'constant_value': 2541.806163760732, 'nu': 0.5}. Best is trial 49 with value: 0.3592108850713264.
[I 2024-12-04 19:43:00,821] Trial 101 finished with value: 0.359212348051008 and parameters: {'kernel_type': 'Matern', 'length_scale': 1.286729185804629, 'noise_level': 0.002197229699938263, 'constant_value': 23.310764038341972, 'nu': 0.5}. Best is trial 49 with value: 0.3592108850713264.
[I 2024-12-04 19:43:04,811] Trial 100 finished with value: 1.0624161172579247 and parameters: {'kernel_type': 'RBF', 'length_scale': 2.349433491081091, 'noise_level': 3.588250517490996e-10, 'constant_value': 0.5891012357062937, 'nu': 1.5}. Best is trial 49 with value: 0.3592108850713264.
[I 2024-12-04 19:43:09,437] Trial 102 finished with value: 1.0624161172954465 and parameters: {'kernel_type': 'Matern', 'length_scale': 0.010178305114195018, 'noise_level': 0.18249743395489265, 'constant_value': 704.8015440742133, 'nu': 0.5}. Best is trial 49 with value: 0.3592108850713264.
[I 2024-12-04 19:43:14,818] Trial 103 finished with value: 0.3592104079601842 and parameters: {'kernel_type': 'Matern', 'length_scale': 2.5714625380551377, 'noise_level': 0.06741283156359555, 'constant_value': 3739.530250147513, 'nu': 0.5}. Best is trial 103 with value: 0.3592104079601842.
[I 2024-12-04 19:43:17,572] Trial 104 finished with value: 0.35921116674741993 and parameters: {'kernel_type': 'Matern', 'length_scale': 2.317266942323256, 'noise_level': 0.26063192525149015, 'constant_value': 45848.962085546904, 'nu': 0.5}. Best is trial 103 with value: 0.3592104079601842.
[I 2024-12-04 19:43:18,611] Trial 105 finished with value: 1.0624161172662572 and parameters: {'kernel_type': 'Matern', 'length_scale': 0.02116779176163788, 'noise_level': 0.2399662470865166, 'constant_value': 6513.219970679512, 'nu': 2.5}. Best is trial 103 with value: 0.3592104079601842.
[I 2024-12-04 19:43:21,695] Trial 106 finished with value: 0.359212233902465 and parameters: {'kernel_type': 'Matern', 'length_scale': 1.6311127529424687, 'noise_level': 0.09039981920852524, 'constant_value': 1849.1875767195033, 'nu': 0.5}. Best is trial 103 with value: 0.3592104079601842.
