[I 2024-12-04 20:29:19,693] Trial 2106 finished with value: 0.5880486660569622 and parameters: {'n_estimators': 369, 'max_depth': 45, 'min_samples_split': 2, 'min_samples_leaf': 1, 'max_features': 'log2', 'bootstrap': True, 'criterion': 'squared_error'}. Best is trial 1631 with value: 0.32128932742921457.
[I 2024-12-04 20:29:22,131] Trial 2108 finished with value: 0.3513950743904615 and parameters: {'n_estimators': 413, 'max_depth': 43, 'min_samples_split': 2, 'min_samples_leaf': 1, 'max_features': 'sqrt', 'bootstrap': False, 'criterion': 'squared_error'}. Best is trial 1631 with value: 0.32128932742921457.
[I 2024-12-04 20:29:22,632] Trial 2109 finished with value: 0.5108585890041522 and parameters: {'n_estimators': 523, 'max_depth': 50, 'min_samples_split': 2, 'min_samples_leaf': 1, 'max_features': 'log2', 'bootstrap': False, 'criterion': 'squared_error'}. Best is trial 1631 with value: 0.32128932742921457.
[I 2024-12-04 20:29:22,750] Trial 2099 finished with value: 0.36840074287385366 and parameters: {'n_estimators': 436, 'max_depth': 50, 'min_samples_split': 3, 'min_samples_leaf': 1, 'max_features': 'sqrt', 'bootstrap': False, 'criterion': 'absolute_error'}. Best is trial 1631 with value: 0.32128932742921457.
[I 2024-12-04 20:29:24,557] Trial 2112 finished with value: 0.33060408309662653 and parameters: {'n_estimators': 164, 'max_depth': 50, 'min_samples_split': 2, 'min_samples_leaf': 1, 'max_features': 'sqrt', 'bootstrap': False, 'criterion': 'squared_error'}. Best is trial 1631 with value: 0.32128932742921457.
[I 2024-12-04 20:29:24,998] Trial 2111 finished with value: 0.345126390810931 and parameters: {'n_estimators': 260, 'max_depth': 43, 'min_samples_split': 2, 'min_samples_leaf': 1, 'max_features': 'sqrt', 'bootstrap': False, 'criterion': 'squared_error'}. Best is trial 1631 with value: 0.32128932742921457.
[I 2024-12-04 20:29:25,099] Trial 2110 finished with value: 0.3280572080588456 and parameters: {'n_estimators': 442, 'max_depth': 50, 'min_samples_split': 2, 'min_samples_leaf': 1, 'max_features': 'sqrt', 'bootstrap': False, 'criterion': 'squared_error'}. Best is trial 1631 with value: 0.32128932742921457.
[I 2024-12-04 20:29:26,599] Trial 2113 finished with value: 1.0644012259980384 and parameters: {'n_estimators': 496, 'max_depth': 49, 'min_samples_split': 4, 'min_samples_leaf': 2, 'max_features': 'log2', 'bootstrap': False, 'criterion': 'squared_error'}. Best is trial 1631 with value: 0.32128932742921457.
[I 2024-12-04 20:29:27,684] Trial 2115 finished with value: 0.3890430278144339 and parameters: {'n_estimators': 432, 'max_depth': 50, 'min_samples_split': 4, 'min_samples_leaf': 1, 'max_features': 'sqrt', 'bootstrap': False, 'criterion': 'squared_error'}. Best is trial 1631 with value: 0.32128932742921457.
[I 2024-12-04 20:29:28,015] Trial 2116 finished with value: 0.6771894758441812 and parameters: {'n_estimators': 354, 'max_depth': 42, 'min_samples_split': 2, 'min_samples_leaf': 2, 'max_features': 'sqrt', 'bootstrap': False, 'criterion': 'squared_error'}. Best is trial 1631 with value: 0.32128932742921457.
[I 2024-12-04 20:29:28,973] Trial 2117 finished with value: 0.39389588180811097 and parameters: {'n_estimators': 146, 'max_depth': 50, 'min_samples_split': 4, 'min_samples_leaf': 1, 'max_features': 'sqrt', 'bootstrap': False, 'criterion': 'squared_error'}. Best is trial 1631 with value: 0.32128932742921457.
[I 2024-12-04 20:29:30,227] Trial 2118 finished with value: 0.3235096817473656 and parameters: {'n_estimators': 324, 'max_depth': 50, 'min_samples_split': 2, 'min_samples_leaf': 1, 'max_features': 'sqrt', 'bootstrap': False, 'criterion': 'squared_error'}. Best is trial 1631 with value: 0.32128932742921457.
[I 2024-12-04 20:29:30,537] Trial 2119 finished with value: 0.6930959567088832 and parameters: {'n_estimators': 455, 'max_depth': 50, 'min_samples_split': 2, 'min_samples_leaf': 2, 'max_features': 'sqrt', 'bootstrap': False, 'criterion': 'squared_error'}. Best is trial 1631 with value: 0.32128932742921457.
[I 2024-12-04 20:29:32,195] Trial 2114 finished with value: 0.889644487075578 and parameters: {'n_estimators': 393, 'max_depth': 41, 'min_samples_split': 2, 'min_samples_leaf': 2, 'max_features': 'sqrt', 'bootstrap': False, 'criterion': 'absolute_error'}. Best is trial 1631 with value: 0.32128932742921457.
[I 2024-12-04 20:29:32,395] Trial 2121 finished with value: 0.4012295725072748 and parameters: {'n_estimators': 295, 'max_depth': 34, 'min_samples_split': 2, 'min_samples_leaf': 1, 'max_features': 'sqrt', 'bootstrap': False, 'criterion': 'squared_error'}. Best is trial 1631 with value: 0.32128932742921457.
[I 2024-12-04 20:29:33,299] Trial 2122 finished with value: 1.2451868758216944 and parameters: {'n_estimators': 123, 'max_depth': 5, 'min_samples_split': 22, 'min_samples_leaf': 6, 'max_features': 'log2', 'bootstrap': False, 'criterion': 'squared_error'}. Best is trial 1631 with value: 0.32128932742921457.
[I 2024-12-04 20:29:33,368] Trial 2120 finished with value: 0.3537052359709946 and parameters: {'n_estimators': 555, 'max_depth': 43, 'min_samples_split': 2, 'min_samples_leaf': 1, 'max_features': 'sqrt', 'bootstrap': False, 'criterion': 'squared_error'}. Best is trial 1631 with value: 0.32128932742921457.
[I 2024-12-04 20:29:34,832] Trial 2123 finished with value: 0.3845889553676907 and parameters: {'n_estimators': 312, 'max_depth': 50, 'min_samples_split': 4, 'min_samples_leaf': 1, 'max_features': 'sqrt', 'bootstrap': False, 'criterion': 'squared_error'}. Best is trial 1631 with value: 0.32128932742921457.
[I 2024-12-04 20:29:35,704] Trial 2124 finished with value: 0.6772569953500847 and parameters: {'n_estimators': 627, 'max_depth': 50, 'min_samples_split': 3, 'min_samples_leaf': 2, 'max_features': 'sqrt', 'bootstrap': False, 'criterion': 'squared_error'}. Best is trial 1631 with value: 0.32128932742921457.
[I 2024-12-04 20:29:50,501] Trial 2127 finished with value: 0.34601126770223845 and parameters: {'n_estimators': 491, 'max_depth': 50, 'min_samples_split': 2, 'min_samples_leaf': 1, 'max_features': 'sqrt', 'bootstrap': False, 'criterion': 'absolute_error'}. Best is trial 1631 with value: 0.32128932742921457.
[I 2024-12-04 20:29:51,963] Trial 2128 finished with value: 0.3986235060067859 and parameters: {'n_estimators': 277, 'max_depth': 43, 'min_samples_split': 3, 'min_samples_leaf': 1, 'max_features': 'sqrt', 'bootstrap': False, 'criterion': 'squared_error'}. Best is trial 1631 with value: 0.32128932742921457.
[I 2024-12-04 20:29:53,991] Trial 2129 finished with value: 0.3230739760881745 and parameters: {'n_estimators': 353, 'max_depth': 50, 'min_samples_split': 2, 'min_samples_leaf': 1, 'max_features': 'sqrt', 'bootstrap': False, 'criterion': 'squared_error'}. Best is trial 1631 with value: 0.32128932742921457.
[I 2024-12-04 20:29:55,890] Trial 2130 finished with value: 0.34609327291607367 and parameters: {'n_estimators': 342, 'max_depth': 43, 'min_samples_split': 2, 'min_samples_leaf': 1, 'max_features': 'sqrt', 'bootstrap': False, 'criterion': 'squared_error'}. Best is trial 1631 with value: 0.32128932742921457.
[I 2024-12-04 20:29:56,874] Trial 2131 finished with value: 1.2530986544080607 and parameters: {'n_estimators': 119, 'max_depth': 16, 'min_samples_split': 2, 'min_samples_leaf': 8, 'max_features': 'log2', 'bootstrap': False, 'criterion': 'squared_error'}. Best is trial 1631 with value: 0.32128932742921457.
[I 2024-12-04 20:29:58,187] Trial 2132 finished with value: 0.9191492275895635 and parameters: {'n_estimators': 295, 'max_depth': 14, 'min_samples_split': 44, 'min_samples_leaf': 1, 'max_features': 'sqrt', 'bootstrap': True, 'criterion': 'squared_error'}. Best is trial 1631 with value: 0.32128932742921457.
[I 2024-12-04 20:30:00,023] Trial 2133 finished with value: 0.39916540865744016 and parameters: {'n_estimators': 411, 'max_depth': 43, 'min_samples_split': 3, 'min_samples_leaf': 1, 'max_features': 'sqrt', 'bootstrap': False, 'criterion': 'squared_error'}. Best is trial 1631 with value: 0.32128932742921457.
[I 2024-12-04 20:30:01,175] Trial 2134 finished with value: 0.36247399297797456 and parameters: {'n_estimators': 109, 'max_depth': 43, 'min_samples_split': 2, 'min_samples_leaf': 1, 'max_features': 'sqrt', 'bootstrap': False, 'criterion': 'squared_error'}. Best is trial 1631 with value: 0.32128932742921457.
[I 2024-12-04 20:30:03,052] Trial 2135 finished with value: 0.36344924225193115 and parameters: {'n_estimators': 437, 'max_depth': 50, 'min_samples_split': 3, 'min_samples_leaf': 1, 'max_features': 'sqrt', 'bootstrap': False, 'criterion': 'squared_error'}. Best is trial 1631 with value: 0.32128932742921457.
[I 2024-12-04 20:30:04,194] Trial 2136 finished with value: 1.2218165035393906 and parameters: {'n_estimators': 343, 'max_depth': 28, 'min_samples_split': 15, 'min_samples_leaf': 3, 'max_features': 'log2', 'bootstrap': True, 'criterion': 'squared_error'}. Best is trial 1631 with value: 0.32128932742921457.
[I 2024-12-04 20:30:05,558] Trial 2137 finished with value: 0.6948875000144441 and parameters: {'n_estimators': 415, 'max_depth': 41, 'min_samples_split': 3, 'min_samples_leaf': 2, 'max_features': 'sqrt', 'bootstrap': False, 'criterion': 'squared_error'}. Best is trial 1631 with value: 0.32128932742921457.
[I 2024-12-04 20:30:07,513] Trial 2138 finished with value: 0.5038558880587412 and parameters: {'n_estimators': 397, 'max_depth': 50, 'min_samples_split': 2, 'min_samples_leaf': 1, 'max_features': 'log2', 'bootstrap': False, 'criterion': 'squared_error'}. Best is trial 1631 with value: 0.32128932742921457.
[I 2024-12-04 20:30:09,098] Trial 2139 finished with value: 0.34581388504122035 and parameters: {'n_estimators': 248, 'max_depth': 43, 'min_samples_split': 2, 'min_samples_leaf': 1, 'max_features': 'sqrt', 'bootstrap': False, 'criterion': 'squared_error'}. Best is trial 1631 with value: 0.32128932742921457.
[I 2024-12-04 20:30:09,560] Trial 2125 finished with value: 0.5646329398911061 and parameters: {'n_estimators': 899, 'max_depth': 43, 'min_samples_split': 2, 'min_samples_leaf': 6, 'max_features': None, 'bootstrap': False, 'criterion': 'absolute_error'}. Best is trial 1631 with value: 0.32128932742921457.
[I 2024-12-04 20:30:11,088] Trial 2141 finished with value: 0.6870930014336825 and parameters: {'n_estimators': 420, 'max_depth': 45, 'min_samples_split': 4, 'min_samples_leaf': 2, 'max_features': 'sqrt', 'bootstrap': False, 'criterion': 'squared_error'}. Best is trial 1631 with value: 0.32128932742921457.
[I 2024-12-04 20:30:11,865] Trial 2140 finished with value: 0.3278115791098966 and parameters: {'n_estimators': 449, 'max_depth': 50, 'min_samples_split': 2, 'min_samples_leaf': 1, 'max_features': 'sqrt', 'bootstrap': False, 'criterion': 'squared_error'}. Best is trial 1631 with value: 0.32128932742921457.
[I 2024-12-04 20:30:13,029] Trial 2143 finished with value: 1.160483235958111 and parameters: {'n_estimators': 424, 'max_depth': 35, 'min_samples_split': 23, 'min_samples_leaf': 9, 'max_features': 'sqrt', 'bootstrap': False, 'criterion': 'squared_error'}. Best is trial 1631 with value: 0.32128932742921457.
[I 2024-12-04 20:30:13,687] Trial 2142 finished with value: 0.32339470343049653 and parameters: {'n_estimators': 411, 'max_depth': 50, 'min_samples_split': 2, 'min_samples_leaf': 1, 'max_features': 'sqrt', 'bootstrap': False, 'criterion': 'squared_error'}. Best is trial 1631 with value: 0.32128932742921457.
[I 2024-12-04 20:30:15,192] Trial 2145 finished with value: 0.35679332502236866 and parameters: {'n_estimators': 239, 'max_depth': 50, 'min_samples_split': 3, 'min_samples_leaf': 1, 'max_features': 'sqrt', 'bootstrap': False, 'criterion': 'squared_error'}. Best is trial 1631 with value: 0.32128932742921457.
[I 2024-12-04 20:30:15,305] Trial 2144 finished with value: 0.3221053321576918 and parameters: {'n_estimators': 371, 'max_depth': 50, 'min_samples_split': 2, 'min_samples_leaf': 1, 'max_features': 'sqrt', 'bootstrap': False, 'criterion': 'squared_error'}. Best is trial 1631 with value: 0.32128932742921457.
[I 2024-12-04 20:30:16,853] Trial 2146 finished with value: 0.47015516129110396 and parameters: {'n_estimators': 114, 'max_depth': 25, 'min_samples_split': 9, 'min_samples_leaf': 1, 'max_features': None, 'bootstrap': True, 'criterion': 'squared_error'}. Best is trial 1631 with value: 0.32128932742921457.
[I 2024-12-04 20:30:17,777] Trial 2147 finished with value: 0.41428604458564366 and parameters: {'n_estimators': 547, 'max_depth': 43, 'min_samples_split': 4, 'min_samples_leaf': 1, 'max_features': 'sqrt', 'bootstrap': False, 'criterion': 'squared_error'}. Best is trial 1631 with value: 0.32128932742921457.
[I 2024-12-04 20:30:18,028] Trial 2148 finished with value: 0.6667376918812498 and parameters: {'n_estimators': 230, 'max_depth': 50, 'min_samples_split': 2, 'min_samples_leaf': 2, 'max_features': 'sqrt', 'bootstrap': False, 'criterion': 'squared_error'}. Best is trial 1631 with value: 0.32128932742921457.
[I 2024-12-04 20:30:20,356] Trial 2149 finished with value: 0.3657048282938296 and parameters: {'n_estimators': 605, 'max_depth': 50, 'min_samples_split': 3, 'min_samples_leaf': 1, 'max_features': 'sqrt', 'bootstrap': False, 'criterion': 'squared_error'}. Best is trial 1631 with value: 0.32128932742921457.
[I 2024-12-04 20:30:21,923] Trial 2150 finished with value: 0.4358682075348706 and parameters: {'n_estimators': 341, 'max_depth': 40, 'min_samples_split': 2, 'min_samples_leaf': 1, 'max_features': None, 'bootstrap': False, 'criterion': 'squared_error'}. Best is trial 1631 with value: 0.32128932742921457.
[I 2024-12-04 20:30:23,609] Trial 2151 finished with value: 0.47760631138567033 and parameters: {'n_estimators': 172, 'max_depth': 50, 'min_samples_split': 3, 'min_samples_leaf': 1, 'max_features': 'sqrt', 'bootstrap': True, 'criterion': 'absolute_error'}. Best is trial 1631 with value: 0.32128932742921457.
[I 2024-12-04 20:30:24,639] Trial 2152 finished with value: 0.355704615986409 and parameters: {'n_estimators': 517, 'max_depth': 43, 'min_samples_split': 2, 'min_samples_leaf': 1, 'max_features': 'sqrt', 'bootstrap': False, 'criterion': 'squared_error'}. Best is trial 1631 with value: 0.32128932742921457.
[I 2024-12-04 20:30:25,876] Trial 2153 finished with value: 0.3462717364679137 and parameters: {'n_estimators': 370, 'max_depth': 43, 'min_samples_split': 2, 'min_samples_leaf': 1, 'max_features': 'sqrt', 'bootstrap': False, 'criterion': 'squared_error'}. Best is trial 1631 with value: 0.32128932742921457.
[I 2024-12-04 20:30:27,235] Trial 2154 finished with value: 0.32856520280613166 and parameters: {'n_estimators': 457, 'max_depth': 50, 'min_samples_split': 2, 'min_samples_leaf': 1, 'max_features': 'sqrt', 'bootstrap': False, 'criterion': 'squared_error'}. Best is trial 1631 with value: 0.32128932742921457.
[I 2024-12-04 20:30:27,314] Trial 2155 finished with value: 0.6835948201040746 and parameters: {'n_estimators': 430, 'max_depth': 50, 'min_samples_split': 3, 'min_samples_leaf': 2, 'max_features': 'sqrt', 'bootstrap': False, 'criterion': 'squared_error'}. Best is trial 1631 with value: 0.32128932742921457.
[I 2024-12-04 20:30:28,571] Trial 2157 finished with value: 1.1986521983087615 and parameters: {'n_estimators': 143, 'max_depth': 21, 'min_samples_split': 34, 'min_samples_leaf': 11, 'max_features': 'sqrt', 'bootstrap': False, 'criterion': 'squared_error'}. Best is trial 1631 with value: 0.32128932742921457.
[I 2024-12-04 20:30:29,910] Trial 2158 finished with value: 0.6727381842170259 and parameters: {'n_estimators': 369, 'max_depth': 50, 'min_samples_split': 2, 'min_samples_leaf': 2, 'max_features': 'sqrt', 'bootstrap': False, 'criterion': 'squared_error'}. Best is trial 1631 with value: 0.32128932742921457.
[I 2024-12-04 20:30:31,332] Trial 2159 finished with value: 0.3277335824233288 and parameters: {'n_estimators': 177, 'max_depth': 50, 'min_samples_split': 2, 'min_samples_leaf': 1, 'max_features': 'sqrt', 'bootstrap': False, 'criterion': 'squared_error'}. Best is trial 1631 with value: 0.32128932742921457.
[I 2024-12-04 20:30:33,697] Trial 2160 finished with value: 0.35086467483973366 and parameters: {'n_estimators': 416, 'max_depth': 43, 'min_samples_split': 2, 'min_samples_leaf': 1, 'max_features': 'sqrt', 'bootstrap': False, 'criterion': 'squared_error'}. Best is trial 1631 with value: 0.32128932742921457.
[I 2024-12-04 20:30:37,823] Trial 2161 finished with value: 1.0987241122524016 and parameters: {'n_estimators': 595, 'max_depth': 18, 'min_samples_split': 4, 'min_samples_leaf': 3, 'max_features': 'sqrt', 'bootstrap': True, 'criterion': 'absolute_error'}. Best is trial 1631 with value: 0.32128932742921457.
[I 2024-12-04 20:30:38,188] Trial 2156 finished with value: 0.6385945497973528 and parameters: {'n_estimators': 608, 'max_depth': 25, 'min_samples_split': 24, 'min_samples_leaf': 6, 'max_features': None, 'bootstrap': True, 'criterion': 'absolute_error'}. Best is trial 1631 with value: 0.32128932742921457.
[I 2024-12-04 20:30:40,744] Trial 2162 finished with value: 0.3270297149445098 and parameters: {'n_estimators': 542, 'max_depth': 50, 'min_samples_split': 2, 'min_samples_leaf': 1, 'max_features': 'sqrt', 'bootstrap': False, 'criterion': 'squared_error'}. Best is trial 1631 with value: 0.32128932742921457.
[I 2024-12-04 20:30:42,485] Trial 2164 finished with value: 0.32566126485847013 and parameters: {'n_estimators': 276, 'max_depth': 50, 'min_samples_split': 2, 'min_samples_leaf': 1, 'max_features': 'sqrt', 'bootstrap': False, 'criterion': 'squared_error'}. Best is trial 1631 with value: 0.32128932742921457.
[I 2024-12-04 20:30:42,860] Trial 2126 finished with value: 0.4761303528952708 and parameters: {'n_estimators': 519, 'max_depth': 50, 'min_samples_split': 5, 'min_samples_leaf': 1, 'max_features': None, 'bootstrap': False, 'criterion': 'absolute_error'}. Best is trial 1631 with value: 0.32128932742921457.
[I 2024-12-04 20:30:44,183] Trial 2165 finished with value: 0.509400962353386 and parameters: {'n_estimators': 333, 'max_depth': 50, 'min_samples_split': 6, 'min_samples_leaf': 1, 'max_features': 'sqrt', 'bootstrap': True, 'criterion': 'squared_error'}. Best is trial 1631 with value: 0.32128932742921457.
[I 2024-12-04 20:30:44,871] Trial 2166 finished with value: 0.4106842665059707 and parameters: {'n_estimators': 333, 'max_depth': 43, 'min_samples_split': 4, 'min_samples_leaf': 1, 'max_features': 'sqrt', 'bootstrap': False, 'criterion': 'squared_error'}. Best is trial 1631 with value: 0.32128932742921457.
[I 2024-12-04 20:30:46,529] Trial 2167 finished with value: 0.3949237841815794 and parameters: {'n_estimators': 388, 'max_depth': 42, 'min_samples_split': 3, 'min_samples_leaf': 1, 'max_features': 'sqrt', 'bootstrap': False, 'criterion': 'squared_error'}. Best is trial 1631 with value: 0.32128932742921457.
[I 2024-12-04 20:30:46,722] Trial 2168 finished with value: 1.302317415160674 and parameters: {'n_estimators': 571, 'max_depth': 5, 'min_samples_split': 11, 'min_samples_leaf': 11, 'max_features': 'sqrt', 'bootstrap': True, 'criterion': 'absolute_error'}. Best is trial 1631 with value: 0.32128932742921457.
[I 2024-12-04 20:30:47,760] Trial 2163 finished with value: 1.0030445337673473 and parameters: {'n_estimators': 687, 'max_depth': 16, 'min_samples_split': 2, 'min_samples_leaf': 2, 'max_features': 'sqrt', 'bootstrap': False, 'criterion': 'absolute_error'}. Best is trial 1631 with value: 0.32128932742921457.
[I 2024-12-04 20:30:48,407] Trial 2170 finished with value: 0.6681573501413228 and parameters: {'n_estimators': 325, 'max_depth': 50, 'min_samples_split': 2, 'min_samples_leaf': 2, 'max_features': 'sqrt', 'bootstrap': False, 'criterion': 'squared_error'}. Best is trial 1631 with value: 0.32128932742921457.
[I 2024-12-04 20:30:49,141] Trial 2169 finished with value: 0.3224133091717219 and parameters: {'n_estimators': 370, 'max_depth': 50, 'min_samples_split': 2, 'min_samples_leaf': 1, 'max_features': 'sqrt', 'bootstrap': False, 'criterion': 'squared_error'}. Best is trial 1631 with value: 0.32128932742921457.
[I 2024-12-04 20:30:50,031] Trial 2172 finished with value: 0.3347829883871215 and parameters: {'n_estimators': 135, 'max_depth': 50, 'min_samples_split': 2, 'min_samples_leaf': 1, 'max_features': 'sqrt', 'bootstrap': False, 'criterion': 'squared_error'}. Best is trial 1631 with value: 0.32128932742921457.
[I 2024-12-04 20:30:50,127] Trial 2171 finished with value: 0.3236261716550514 and parameters: {'n_estimators': 326, 'max_depth': 50, 'min_samples_split': 2, 'min_samples_leaf': 1, 'max_features': 'sqrt', 'bootstrap': False, 'criterion': 'squared_error'}. Best is trial 1631 with value: 0.32128932742921457.
[I 2024-12-04 20:30:51,879] Trial 2173 finished with value: 0.3230509500930674 and parameters: {'n_estimators': 405, 'max_depth': 50, 'min_samples_split': 2, 'min_samples_leaf': 1, 'max_features': 'sqrt', 'bootstrap': False, 'criterion': 'squared_error'}. Best is trial 1631 with value: 0.32128932742921457.
[I 2024-12-04 20:30:52,428] Trial 2174 finished with value: 0.36740241207798763 and parameters: {'n_estimators': 455, 'max_depth': 50, 'min_samples_split': 3, 'min_samples_leaf': 1, 'max_features': 'sqrt', 'bootstrap': False, 'criterion': 'squared_error'}. Best is trial 1631 with value: 0.32128932742921457.
[I 2024-12-04 20:30:53,003] Trial 2175 finished with value: 0.35086467483973366 and parameters: {'n_estimators': 416, 'max_depth': 43, 'min_samples_split': 2, 'min_samples_leaf': 1, 'max_features': 'sqrt', 'bootstrap': False, 'criterion': 'squared_error'}. Best is trial 1631 with value: 0.32128932742921457.
[I 2024-12-04 20:30:55,287] Trial 2177 finished with value: 0.35402895665618095 and parameters: {'n_estimators': 463, 'max_depth': 44, 'min_samples_split': 2, 'min_samples_leaf': 1, 'max_features': 'sqrt', 'bootstrap': False, 'criterion': 'squared_error'}. Best is trial 1631 with value: 0.32128932742921457.
