[I 2024-12-04 11:57:59,603] Trial 1079 finished with value: 1.0081785092902962 and parameters: {'max_depth': 27, 'min_samples_split': 2, 'min_samples_leaf': 1, 'max_features': 'sqrt', 'criterion': 'absolute_error', 'splitter': 'best'}. Best is trial 309 with value: 0.46729638362398634.
[I 2024-12-04 11:57:59,619] Trial 1063 finished with value: 1.2971851837112935 and parameters: {'max_depth': 4, 'min_samples_split': 20, 'min_samples_leaf': 2, 'max_features': 'log2', 'criterion': 'squared_error', 'splitter': 'random'}. Best is trial 309 with value: 0.46729638362398634.
[I 2024-12-04 11:57:59,644] Trial 1069 finished with value: 0.87491152180457 and parameters: {'max_depth': 25, 'min_samples_split': 20, 'min_samples_leaf': 6, 'max_features': 'sqrt', 'criterion': 'absolute_error', 'splitter': 'best'}. Best is trial 309 with value: 0.46729638362398634.
[I 2024-12-04 11:57:59,811] Trial 1083 finished with value: 0.8666968382247049 and parameters: {'max_depth': 28, 'min_samples_split': 2, 'min_samples_leaf': 3, 'max_features': 'sqrt', 'criterion': 'absolute_error', 'splitter': 'best'}. Best is trial 309 with value: 0.46729638362398634.
[I 2024-12-04 11:58:00,357] Trial 1075 finished with value: 0.5209986636170143 and parameters: {'max_depth': 29, 'min_samples_split': 2, 'min_samples_leaf': 1, 'max_features': 'sqrt', 'criterion': 'absolute_error', 'splitter': 'best'}. Best is trial 309 with value: 0.46729638362398634.
[I 2024-12-04 11:58:00,358] Trial 1078 finished with value: 0.6326823486502899 and parameters: {'max_depth': 26, 'min_samples_split': 5, 'min_samples_leaf': 2, 'max_features': 'sqrt', 'criterion': 'absolute_error', 'splitter': 'best'}. Best is trial 309 with value: 0.46729638362398634.
[I 2024-12-04 11:58:00,678] Trial 1081 finished with value: 1.0977389566103577 and parameters: {'max_depth': 30, 'min_samples_split': 2, 'min_samples_leaf': 2, 'max_features': 'sqrt', 'criterion': 'absolute_error', 'splitter': 'best'}. Best is trial 309 with value: 0.46729638362398634.
[I 2024-12-04 11:58:01,410] Trial 1084 finished with value: 0.5209986636170143 and parameters: {'max_depth': 29, 'min_samples_split': 2, 'min_samples_leaf': 1, 'max_features': 'sqrt', 'criterion': 'absolute_error', 'splitter': 'best'}. Best is trial 309 with value: 0.46729638362398634.
[I 2024-12-04 11:58:02,010] Trial 1082 finished with value: 0.46729638362398634 and parameters: {'max_depth': 31, 'min_samples_split': 2, 'min_samples_leaf': 1, 'max_features': 'sqrt', 'criterion': 'absolute_error', 'splitter': 'best'}. Best is trial 309 with value: 0.46729638362398634.
[I 2024-12-04 11:58:02,170] Trial 1089 finished with value: 1.0081785092902962 and parameters: {'max_depth': 27, 'min_samples_split': 2, 'min_samples_leaf': 1, 'max_features': 'sqrt', 'criterion': 'absolute_error', 'splitter': 'best'}. Best is trial 309 with value: 0.46729638362398634.
[I 2024-12-04 11:58:02,351] Trial 1077 finished with value: 0.7012760837183374 and parameters: {'max_depth': 32, 'min_samples_split': 5, 'min_samples_leaf': 1, 'max_features': 'sqrt', 'criterion': 'absolute_error', 'splitter': 'best'}. Best is trial 309 with value: 0.46729638362398634.
[I 2024-12-04 11:58:02,537] Trial 1088 finished with value: 1.298283307656757 and parameters: {'max_depth': 23, 'min_samples_split': 13, 'min_samples_leaf': 5, 'max_features': 'log2', 'criterion': 'squared_error', 'splitter': 'random'}. Best is trial 309 with value: 0.46729638362398634.
[I 2024-12-04 11:58:03,671] Trial 1091 finished with value: 1.0894525583560912 and parameters: {'max_depth': 35, 'min_samples_split': 2, 'min_samples_leaf': 2, 'max_features': 'sqrt', 'criterion': 'absolute_error', 'splitter': 'best'}. Best is trial 309 with value: 0.46729638362398634.
[I 2024-12-04 11:58:04,320] Trial 1086 finished with value: 0.46729638362398634 and parameters: {'max_depth': 31, 'min_samples_split': 2, 'min_samples_leaf': 1, 'max_features': 'sqrt', 'criterion': 'absolute_error', 'splitter': 'best'}. Best is trial 309 with value: 0.46729638362398634.
[I 2024-12-04 11:58:04,961] Trial 1087 finished with value: 1.3527002456820276 and parameters: {'max_depth': 10, 'min_samples_split': 10, 'min_samples_leaf': 1, 'max_features': 'log2', 'criterion': 'absolute_error', 'splitter': 'random'}. Best is trial 309 with value: 0.46729638362398634.
[I 2024-12-04 11:58:05,065] Trial 1085 finished with value: 1.3007745979739842 and parameters: {'max_depth': 34, 'min_samples_split': 2, 'min_samples_leaf': 8, 'max_features': 'log2', 'criterion': 'friedman_mse', 'splitter': 'best'}. Best is trial 309 with value: 0.46729638362398634.
[I 2024-12-04 11:58:05,243] Trial 1092 finished with value: 1.111989940503367 and parameters: {'max_depth': 29, 'min_samples_split': 5, 'min_samples_leaf': 2, 'max_features': 'sqrt', 'criterion': 'absolute_error', 'splitter': 'best'}. Best is trial 309 with value: 0.46729638362398634.
[I 2024-12-04 11:58:06,204] Trial 1095 finished with value: 1.3130149982826922 and parameters: {'max_depth': 26, 'min_samples_split': 11, 'min_samples_leaf': 9, 'max_features': 'sqrt', 'criterion': 'squared_error', 'splitter': 'random'}. Best is trial 309 with value: 0.46729638362398634.
[I 2024-12-04 11:58:06,640] Trial 1076 finished with value: 0.5222024842783579 and parameters: {'max_depth': 35, 'min_samples_split': 2, 'min_samples_leaf': 1, 'max_features': 'sqrt', 'criterion': 'absolute_error', 'splitter': 'best'}. Best is trial 309 with value: 0.46729638362398634.
[I 2024-12-04 11:58:06,866] Trial 1097 finished with value: 0.9391413480553363 and parameters: {'max_depth': 28, 'min_samples_split': 2, 'min_samples_leaf': 1, 'max_features': 'sqrt', 'criterion': 'absolute_error', 'splitter': 'best'}. Best is trial 309 with value: 0.46729638362398634.
[I 2024-12-04 11:58:07,206] Trial 1090 finished with value: 0.7012760837183374 and parameters: {'max_depth': 32, 'min_samples_split': 5, 'min_samples_leaf': 1, 'max_features': 'sqrt', 'criterion': 'absolute_error', 'splitter': 'best'}. Best is trial 309 with value: 0.46729638362398634.
[I 2024-12-04 11:58:07,336] Trial 1105 finished with value: 0.5266640698896663 and parameters: {'max_depth': 32, 'min_samples_split': 2, 'min_samples_leaf': 1, 'max_features': 'sqrt', 'criterion': 'absolute_error', 'splitter': 'best'}. Best is trial 309 with value: 0.46729638362398634.
[I 2024-12-04 11:58:07,523] Trial 1093 finished with value: 1.0977389566103577 and parameters: {'max_depth': 30, 'min_samples_split': 2, 'min_samples_leaf': 2, 'max_features': 'sqrt', 'criterion': 'absolute_error', 'splitter': 'best'}. Best is trial 309 with value: 0.46729638362398634.
[I 2024-12-04 11:58:07,976] Trial 1099 finished with value: 0.6242410834238855 and parameters: {'max_depth': 27, 'min_samples_split': 5, 'min_samples_leaf': 1, 'max_features': 'sqrt', 'criterion': 'absolute_error', 'splitter': 'best'}. Best is trial 309 with value: 0.46729638362398634.
[I 2024-12-04 11:58:08,951] Trial 1101 finished with value: 0.5958153346878527 and parameters: {'max_depth': 23, 'min_samples_split': 2, 'min_samples_leaf': 1, 'max_features': 'sqrt', 'criterion': 'absolute_error', 'splitter': 'best'}. Best is trial 309 with value: 0.46729638362398634.
[I 2024-12-04 11:58:09,226] Trial 1096 finished with value: 0.5891208940219524 and parameters: {'max_depth': 23, 'min_samples_split': 6, 'min_samples_leaf': 1, 'max_features': 'sqrt', 'criterion': 'absolute_error', 'splitter': 'best'}. Best is trial 309 with value: 0.46729638362398634.
[I 2024-12-04 11:58:09,349] Trial 1094 finished with value: 0.8666968382247049 and parameters: {'max_depth': 32, 'min_samples_split': 2, 'min_samples_leaf': 3, 'max_features': 'sqrt', 'criterion': 'absolute_error', 'splitter': 'best'}. Best is trial 309 with value: 0.46729638362398634.
[I 2024-12-04 11:58:09,388] Trial 1098 finished with value: 0.8666968382247049 and parameters: {'max_depth': 25, 'min_samples_split': 2, 'min_samples_leaf': 3, 'max_features': 'sqrt', 'criterion': 'absolute_error', 'splitter': 'best'}. Best is trial 309 with value: 0.46729638362398634.
[I 2024-12-04 11:58:09,472] Trial 1103 finished with value: 0.8666968382247049 and parameters: {'max_depth': 24, 'min_samples_split': 2, 'min_samples_leaf': 3, 'max_features': 'sqrt', 'criterion': 'absolute_error', 'splitter': 'best'}. Best is trial 309 with value: 0.46729638362398634.
[I 2024-12-04 11:58:10,190] Trial 1112 finished with value: 0.46729638362398634 and parameters: {'max_depth': 31, 'min_samples_split': 2, 'min_samples_leaf': 1, 'max_features': 'sqrt', 'criterion': 'absolute_error', 'splitter': 'best'}. Best is trial 309 with value: 0.46729638362398634.
[I 2024-12-04 11:58:10,676] Trial 1109 finished with value: 0.5209986636170143 and parameters: {'max_depth': 29, 'min_samples_split': 2, 'min_samples_leaf': 1, 'max_features': 'sqrt', 'criterion': 'absolute_error', 'splitter': 'best'}. Best is trial 309 with value: 0.46729638362398634.
[I 2024-12-04 11:58:10,686] Trial 1107 finished with value: 1.01795202196865 and parameters: {'max_depth': 33, 'min_samples_split': 5, 'min_samples_leaf': 1, 'max_features': 'sqrt', 'criterion': 'absolute_error', 'splitter': 'best'}. Best is trial 309 with value: 0.46729638362398634.
[I 2024-12-04 11:58:10,691] Trial 1102 finished with value: 0.5266640698896663 and parameters: {'max_depth': 32, 'min_samples_split': 2, 'min_samples_leaf': 1, 'max_features': 'sqrt', 'criterion': 'absolute_error', 'splitter': 'best'}. Best is trial 309 with value: 0.46729638362398634.
[I 2024-12-04 11:58:11,714] Trial 1100 finished with value: 0.5380234000646094 and parameters: {'max_depth': 30, 'min_samples_split': 2, 'min_samples_leaf': 1, 'max_features': 'sqrt', 'criterion': 'absolute_error', 'splitter': 'best'}. Best is trial 309 with value: 0.46729638362398634.
[I 2024-12-04 11:58:11,773] Trial 1110 finished with value: 0.5266640698896663 and parameters: {'max_depth': 32, 'min_samples_split': 2, 'min_samples_leaf': 1, 'max_features': 'sqrt', 'criterion': 'absolute_error', 'splitter': 'best'}. Best is trial 309 with value: 0.46729638362398634.
[I 2024-12-04 11:58:12,808] Trial 1113 finished with value: 1.0081785092902962 and parameters: {'max_depth': 27, 'min_samples_split': 2, 'min_samples_leaf': 1, 'max_features': 'sqrt', 'criterion': 'absolute_error', 'splitter': 'best'}. Best is trial 309 with value: 0.46729638362398634.
[I 2024-12-04 11:58:13,027] Trial 1118 finished with value: 0.8666968382247049 and parameters: {'max_depth': 33, 'min_samples_split': 2, 'min_samples_leaf': 3, 'max_features': 'sqrt', 'criterion': 'absolute_error', 'splitter': 'best'}. Best is trial 309 with value: 0.46729638362398634.
[I 2024-12-04 11:58:13,028] Trial 1108 finished with value: 0.8666968382247049 and parameters: {'max_depth': 35, 'min_samples_split': 5, 'min_samples_leaf': 3, 'max_features': 'sqrt', 'criterion': 'absolute_error', 'splitter': 'best'}. Best is trial 309 with value: 0.46729638362398634.
[I 2024-12-04 11:58:14,567] Trial 1122 finished with value: 0.6128215778007012 and parameters: {'max_depth': 30, 'min_samples_split': 5, 'min_samples_leaf': 1, 'max_features': 'sqrt', 'criterion': 'absolute_error', 'splitter': 'best'}. Best is trial 309 with value: 0.46729638362398634.
[I 2024-12-04 11:58:14,610] Trial 1116 finished with value: 0.5222024842783579 and parameters: {'max_depth': 35, 'min_samples_split': 2, 'min_samples_leaf': 1, 'max_features': 'sqrt', 'criterion': 'absolute_error', 'splitter': 'best'}. Best is trial 309 with value: 0.46729638362398634.
[I 2024-12-04 11:58:14,611] Trial 1120 finished with value: 0.5958153346878527 and parameters: {'max_depth': 23, 'min_samples_split': 2, 'min_samples_leaf': 1, 'max_features': 'sqrt', 'criterion': 'absolute_error', 'splitter': 'best'}. Best is trial 309 with value: 0.46729638362398634.
[I 2024-12-04 11:58:15,007] Trial 1115 finished with value: 0.8666968382247049 and parameters: {'max_depth': 29, 'min_samples_split': 5, 'min_samples_leaf': 3, 'max_features': 'sqrt', 'criterion': 'absolute_error', 'splitter': 'best'}. Best is trial 309 with value: 0.46729638362398634.
[I 2024-12-04 11:58:15,494] Trial 1117 finished with value: 0.8666968382247049 and parameters: {'max_depth': 28, 'min_samples_split': 2, 'min_samples_leaf': 3, 'max_features': 'sqrt', 'criterion': 'absolute_error', 'splitter': 'best'}. Best is trial 309 with value: 0.46729638362398634.
[I 2024-12-04 11:58:15,769] Trial 1114 finished with value: 1.074625725712342 and parameters: {'max_depth': 30, 'min_samples_split': 4, 'min_samples_leaf': 1, 'max_features': 'sqrt', 'criterion': 'absolute_error', 'splitter': 'random'}. Best is trial 309 with value: 0.46729638362398634.
[I 2024-12-04 11:58:16,012] Trial 1104 finished with value: 0.9765549682866087 and parameters: {'max_depth': 27, 'min_samples_split': 6, 'min_samples_leaf': 1, 'max_features': 'sqrt', 'criterion': 'absolute_error', 'splitter': 'best'}. Best is trial 309 with value: 0.46729638362398634.
[I 2024-12-04 11:58:16,583] Trial 1106 finished with value: 1.2576959234055558 and parameters: {'max_depth': 18, 'min_samples_split': 17, 'min_samples_leaf': 4, 'max_features': 'sqrt', 'criterion': 'squared_error', 'splitter': 'random'}. Best is trial 309 with value: 0.46729638362398634.
[I 2024-12-04 11:58:16,873] Trial 1111 finished with value: 0.46729638362398634 and parameters: {'max_depth': 31, 'min_samples_split': 2, 'min_samples_leaf': 1, 'max_features': 'sqrt', 'criterion': 'absolute_error', 'splitter': 'best'}. Best is trial 309 with value: 0.46729638362398634.
[I 2024-12-04 11:58:17,587] Trial 1119 finished with value: 1.01795202196865 and parameters: {'max_depth': 33, 'min_samples_split': 5, 'min_samples_leaf': 1, 'max_features': 'sqrt', 'criterion': 'absolute_error', 'splitter': 'best'}. Best is trial 309 with value: 0.46729638362398634.
[I 2024-12-04 11:58:17,920] Trial 1123 finished with value: 0.6128215778007012 and parameters: {'max_depth': 30, 'min_samples_split': 5, 'min_samples_leaf': 1, 'max_features': 'sqrt', 'criterion': 'absolute_error', 'splitter': 'best'}. Best is trial 309 with value: 0.46729638362398634.
[I 2024-12-04 11:58:18,055] Trial 1136 finished with value: 0.5680194359354153 and parameters: {'max_depth': 34, 'min_samples_split': 2, 'min_samples_leaf': 1, 'max_features': 'sqrt', 'criterion': 'absolute_error', 'splitter': 'best'}. Best is trial 309 with value: 0.46729638362398634.
[I 2024-12-04 11:58:18,261] Trial 1131 finished with value: 0.5380234000646094 and parameters: {'max_depth': 30, 'min_samples_split': 2, 'min_samples_leaf': 1, 'max_features': 'sqrt', 'criterion': 'absolute_error', 'splitter': 'best'}. Best is trial 309 with value: 0.46729638362398634.
[I 2024-12-04 11:58:18,415] Trial 1132 finished with value: 0.8666968382247049 and parameters: {'max_depth': 35, 'min_samples_split': 2, 'min_samples_leaf': 3, 'max_features': 'sqrt', 'criterion': 'absolute_error', 'splitter': 'best'}. Best is trial 309 with value: 0.46729638362398634.
[I 2024-12-04 11:58:18,746] Trial 1121 finished with value: 0.5380234000646094 and parameters: {'max_depth': 30, 'min_samples_split': 2, 'min_samples_leaf': 1, 'max_features': 'sqrt', 'criterion': 'absolute_error', 'splitter': 'best'}. Best is trial 309 with value: 0.46729638362398634.
[I 2024-12-04 11:58:18,844] Trial 1127 finished with value: 1.3130149982826922 and parameters: {'max_depth': 35, 'min_samples_split': 12, 'min_samples_leaf': 7, 'max_features': 'sqrt', 'criterion': 'friedman_mse', 'splitter': 'random'}. Best is trial 309 with value: 0.46729638362398634.
[I 2024-12-04 11:58:19,036] Trial 1124 finished with value: 0.6567233315466673 and parameters: {'max_depth': 27, 'min_samples_split': 2, 'min_samples_leaf': 2, 'max_features': 'sqrt', 'criterion': 'absolute_error', 'splitter': 'best'}. Best is trial 309 with value: 0.46729638362398634.
[I 2024-12-04 11:58:19,329] Trial 1125 finished with value: 0.7238455884864453 and parameters: {'max_depth': 35, 'min_samples_split': 5, 'min_samples_leaf': 1, 'max_features': 'sqrt', 'criterion': 'absolute_error', 'splitter': 'best'}. Best is trial 309 with value: 0.46729638362398634.
[I 2024-12-04 11:58:19,559] Trial 1126 finished with value: 0.46729638362398634 and parameters: {'max_depth': 31, 'min_samples_split': 2, 'min_samples_leaf': 1, 'max_features': 'sqrt', 'criterion': 'absolute_error', 'splitter': 'best'}. Best is trial 309 with value: 0.46729638362398634.
[I 2024-12-04 11:58:19,954] Trial 1137 finished with value: 0.7238455884864453 and parameters: {'max_depth': 35, 'min_samples_split': 5, 'min_samples_leaf': 1, 'max_features': 'sqrt', 'criterion': 'absolute_error', 'splitter': 'best'}. Best is trial 309 with value: 0.46729638362398634.
[I 2024-12-04 11:58:20,389] Trial 1134 finished with value: 0.9391413480553363 and parameters: {'max_depth': 28, 'min_samples_split': 2, 'min_samples_leaf': 1, 'max_features': 'sqrt', 'criterion': 'absolute_error', 'splitter': 'best'}. Best is trial 309 with value: 0.46729638362398634.
[I 2024-12-04 11:58:20,834] Trial 1130 finished with value: 0.8666968382247049 and parameters: {'max_depth': 32, 'min_samples_split': 5, 'min_samples_leaf': 3, 'max_features': 'sqrt', 'criterion': 'absolute_error', 'splitter': 'best'}. Best is trial 309 with value: 0.46729638362398634.
[I 2024-12-04 11:58:21,184] Trial 1142 finished with value: 1.3629276849850611 and parameters: {'max_depth': 6, 'min_samples_split': 2, 'min_samples_leaf': 10, 'max_features': 'log2', 'criterion': 'absolute_error', 'splitter': 'random'}. Best is trial 309 with value: 0.46729638362398634.
[I 2024-12-04 11:58:21,743] Trial 1140 finished with value: 0.7698922830511513 and parameters: {'max_depth': 26, 'min_samples_split': 5, 'min_samples_leaf': 1, 'max_features': 'sqrt', 'criterion': 'absolute_error', 'splitter': 'best'}. Best is trial 309 with value: 0.46729638362398634.
[I 2024-12-04 11:58:22,967] Trial 1135 finished with value: 0.5380234000646094 and parameters: {'max_depth': 30, 'min_samples_split': 2, 'min_samples_leaf': 1, 'max_features': 'sqrt', 'criterion': 'absolute_error', 'splitter': 'best'}. Best is trial 309 with value: 0.46729638362398634.
[I 2024-12-04 11:58:23,843] Trial 1139 finished with value: 0.5209986636170143 and parameters: {'max_depth': 29, 'min_samples_split': 2, 'min_samples_leaf': 1, 'max_features': 'sqrt', 'criterion': 'absolute_error', 'splitter': 'best'}. Best is trial 309 with value: 0.46729638362398634.
[I 2024-12-04 11:58:24,242] Trial 1133 finished with value: 0.5209986636170143 and parameters: {'max_depth': 29, 'min_samples_split': 2, 'min_samples_leaf': 1, 'max_features': 'sqrt', 'criterion': 'absolute_error', 'splitter': 'best'}. Best is trial 309 with value: 0.46729638362398634.
[I 2024-12-04 11:58:24,422] Trial 1141 finished with value: 0.8666968382247049 and parameters: {'max_depth': 31, 'min_samples_split': 2, 'min_samples_leaf': 3, 'max_features': 'sqrt', 'criterion': 'absolute_error', 'splitter': 'best'}. Best is trial 309 with value: 0.46729638362398634.
[I 2024-12-04 11:58:25,288] Trial 1138 finished with value: 0.8666968382247049 and parameters: {'max_depth': 31, 'min_samples_split': 5, 'min_samples_leaf': 3, 'max_features': 'sqrt', 'criterion': 'absolute_error', 'splitter': 'best'}. Best is trial 309 with value: 0.46729638362398634.
[I 2024-12-04 11:58:25,743] Trial 1150 finished with value: 1.1219892396840783 and parameters: {'max_depth': 23, 'min_samples_split': 5, 'min_samples_leaf': 1, 'max_features': 'sqrt', 'criterion': 'absolute_error', 'splitter': 'best'}. Best is trial 309 with value: 0.46729638362398634.
[I 2024-12-04 11:58:25,745] Trial 1144 finished with value: 1.111989940503367 and parameters: {'max_depth': 29, 'min_samples_split': 5, 'min_samples_leaf': 2, 'max_features': 'sqrt', 'criterion': 'absolute_error', 'splitter': 'best'}. Best is trial 309 with value: 0.46729638362398634.
[I 2024-12-04 11:58:25,748] Trial 1155 finished with value: 1.0977389566103577 and parameters: {'max_depth': 30, 'min_samples_split': 2, 'min_samples_leaf': 2, 'max_features': 'sqrt', 'criterion': 'absolute_error', 'splitter': 'best'}. Best is trial 309 with value: 0.46729638362398634.
[I 2024-12-04 11:58:25,762] Trial 1129 finished with value: 0.5222024842783579 and parameters: {'max_depth': 35, 'min_samples_split': 2, 'min_samples_leaf': 1, 'max_features': 'sqrt', 'criterion': 'absolute_error', 'splitter': 'best'}. Best is trial 309 with value: 0.46729638362398634.
[I 2024-12-04 11:58:25,869] Trial 1145 finished with value: 1.2576959234055558 and parameters: {'max_depth': 27, 'min_samples_split': 17, 'min_samples_leaf': 4, 'max_features': 'sqrt', 'criterion': 'friedman_mse', 'splitter': 'random'}. Best is trial 309 with value: 0.46729638362398634.
[I 2024-12-04 11:58:26,563] Trial 1156 finished with value: 0.48023816165717975 and parameters: {'max_depth': 33, 'min_samples_split': 2, 'min_samples_leaf': 1, 'max_features': 'sqrt', 'criterion': 'absolute_error', 'splitter': 'best'}. Best is trial 309 with value: 0.46729638362398634.
[I 2024-12-04 11:58:27,304] Trial 1148 finished with value: 1.3629276849850611 and parameters: {'max_depth': 10, 'min_samples_split': 19, 'min_samples_leaf': 10, 'max_features': 'log2', 'criterion': 'absolute_error', 'splitter': 'random'}. Best is trial 309 with value: 0.46729638362398634.
[I 2024-12-04 11:58:27,673] Trial 1152 finished with value: 0.6050209057105678 and parameters: {'max_depth': 29, 'min_samples_split': 5, 'min_samples_leaf': 1, 'max_features': 'sqrt', 'criterion': 'absolute_error', 'splitter': 'best'}. Best is trial 309 with value: 0.46729638362398634.
[I 2024-12-04 11:58:28,331] Trial 1151 finished with value: 0.5380234000646094 and parameters: {'max_depth': 30, 'min_samples_split': 2, 'min_samples_leaf': 1, 'max_features': 'sqrt', 'criterion': 'absolute_error', 'splitter': 'best'}. Best is trial 309 with value: 0.46729638362398634.
