[I 2024-12-04 20:37:13,916] Trial 1304 finished with value: 0.14249502982212917 and parameters: {'kernel_type': 'Matern', 'length_scale': 11.517480320547993, 'noise_level': 0.755175275092891, 'constant_value': 0.8787430749600189, 'nu': 1.5}. Best is trial 959 with value: 0.1375110730946576.
[I 2024-12-04 20:37:14,880] Trial 1305 finished with value: 0.14249505957253356 and parameters: {'kernel_type': 'Matern', 'length_scale': 2.42325249224994, 'noise_level': 0.0010387313793376704, 'constant_value': 542.0400363849394, 'nu': 1.5}. Best is trial 959 with value: 0.1375110730946576.
[I 2024-12-04 20:37:16,998] Trial 1303 finished with value: 0.1424948894067908 and parameters: {'kernel_type': 'Matern', 'length_scale': 98.39455828425774, 'noise_level': 0.46117694843057083, 'constant_value': 9.329005890291674, 'nu': 1.5}. Best is trial 959 with value: 0.1375110730946576.
[I 2024-12-04 20:37:20,902] Trial 1306 finished with value: 0.14249506517405064 and parameters: {'kernel_type': 'Matern', 'length_scale': 0.35927339842631056, 'noise_level': 0.026446102623895934, 'constant_value': 46.79525585796555, 'nu': 1.5}. Best is trial 959 with value: 0.1375110730946576.
[I 2024-12-04 20:37:23,036] Trial 1307 finished with value: 0.14469881085925854 and parameters: {'kernel_type': 'Matern', 'length_scale': 0.39619463371289404, 'noise_level': 0.0010339692448427566, 'constant_value': 7.003484889588504, 'nu': 2.5}. Best is trial 959 with value: 0.1375110730946576.
[I 2024-12-04 20:37:25,735] Trial 1308 finished with value: 0.1424950538280418 and parameters: {'kernel_type': 'Matern', 'length_scale': 10.001143676118005, 'noise_level': 0.037612735432255455, 'constant_value': 10.197495848748813, 'nu': 1.5}. Best is trial 959 with value: 0.1375110730946576.
[I 2024-12-04 20:37:30,624] Trial 1311 finished with value: 0.9864686818863059 and parameters: {'kernel_type': 'Matern', 'length_scale': 0.005289610745195235, 'noise_level': 0.7065103013330022, 'constant_value': 2791.246163448134, 'nu': 1.5}. Best is trial 959 with value: 0.1375110730946576.
[I 2024-12-04 20:37:30,634] Trial 1309 finished with value: 0.14249506239159104 and parameters: {'kernel_type': 'Matern', 'length_scale': 404.43051916554913, 'noise_level': 0.996931827989092, 'constant_value': 0.6777487354132395, 'nu': 1.5}. Best is trial 959 with value: 0.1375110730946576.
[I 2024-12-04 20:37:31,395] Trial 1310 finished with value: 0.1424949588403695 and parameters: {'kernel_type': 'Matern', 'length_scale': 13.961233038431613, 'noise_level': 0.02903459981349705, 'constant_value': 38.76143877251364, 'nu': 1.5}. Best is trial 959 with value: 0.1375110730946576.
[I 2024-12-04 20:37:36,390] Trial 1314 finished with value: 0.19720000081382819 and parameters: {'kernel_type': 'Matern', 'length_scale': 10.774122649266248, 'noise_level': 0.03056460852035793, 'constant_value': 3163.2434893748286, 'nu': 0.5}. Best is trial 959 with value: 0.1375110730946576.
[I 2024-12-04 20:37:36,667] Trial 1312 finished with value: 0.142495008757648 and parameters: {'kernel_type': 'Matern', 'length_scale': 1996.2929990914029, 'noise_level': 0.14431065994307446, 'constant_value': 1025.1243335566428, 'nu': 1.5}. Best is trial 959 with value: 0.1375110730946576.
[I 2024-12-04 20:37:38,931] Trial 1313 finished with value: 0.14249522778939516 and parameters: {'kernel_type': 'Matern', 'length_scale': 0.4839590303122961, 'noise_level': 0.08531240925145651, 'constant_value': 14.206661762062675, 'nu': 1.5}. Best is trial 959 with value: 0.1375110730946576.
[I 2024-12-04 20:37:44,292] Trial 1316 finished with value: 0.9864686819034157 and parameters: {'kernel_type': 'RBF', 'length_scale': 2.490683100403123, 'noise_level': 9.869541688792818e-07, 'constant_value': 8.005144134957675e-05, 'nu': 2.5}. Best is trial 959 with value: 0.1375110730946576.
[I 2024-12-04 20:37:45,627] Trial 1315 finished with value: 0.1424958772781498 and parameters: {'kernel_type': 'Matern', 'length_scale': 18.739736093072448, 'noise_level': 0.0008006120850684497, 'constant_value': 10443.291840541062, 'nu': 1.5}. Best is trial 959 with value: 0.1375110730946576.
[I 2024-12-04 20:37:46,458] Trial 1317 finished with value: 0.9864686819316979 and parameters: {'kernel_type': 'Matern', 'length_scale': 36.505428066696666, 'noise_level': 0.006011262322435294, 'constant_value': 0.12965214460385596, 'nu': 1.5}. Best is trial 959 with value: 0.1375110730946576.
[I 2024-12-04 20:37:53,337] Trial 1318 finished with value: 0.9864686819201521 and parameters: {'kernel_type': 'Matern', 'length_scale': 144.52896725158186, 'noise_level': 0.0002064972353296911, 'constant_value': 0.00179596045940416, 'nu': 2.5}. Best is trial 959 with value: 0.1375110730946576.
[I 2024-12-04 20:37:53,433] Trial 1319 finished with value: 0.14249506852507077 and parameters: {'kernel_type': 'Matern', 'length_scale': 111.94491309304723, 'noise_level': 0.7170381893029865, 'constant_value': 43.268311822070544, 'nu': 1.5}. Best is trial 959 with value: 0.1375110730946576.
[I 2024-12-04 20:37:59,701] Trial 1322 finished with value: 0.14249506152833474 and parameters: {'kernel_type': 'Matern', 'length_scale': 1590.4244163652063, 'noise_level': 0.008484463371153175, 'constant_value': 4340.058900429825, 'nu': 1.5}. Best is trial 959 with value: 0.1375110730946576.
[I 2024-12-04 20:37:59,795] Trial 1321 finished with value: 0.14249547464566595 and parameters: {'kernel_type': 'Matern', 'length_scale': 75.93451941539455, 'noise_level': 0.013762121048766836, 'constant_value': 136.41051891994752, 'nu': 1.5}. Best is trial 959 with value: 0.1375110730946576.
[I 2024-12-04 20:38:01,305] Trial 1320 finished with value: 0.14249507102476847 and parameters: {'kernel_type': 'Matern', 'length_scale': 1823.899118600412, 'noise_level': 0.04936233274928021, 'constant_value': 38.326612976018666, 'nu': 1.5}. Best is trial 959 with value: 0.1375110730946576.
[I 2024-12-04 20:38:07,221] Trial 1324 finished with value: 0.14771037011291901 and parameters: {'kernel_type': 'RBF', 'length_scale': 10.0842404084256, 'noise_level': 7.01513710193873e-05, 'constant_value': 37.47894266581758, 'nu': 1.5}. Best is trial 959 with value: 0.1375110730946576.
[I 2024-12-04 20:38:10,764] Trial 1325 finished with value: 0.14469877772777676 and parameters: {'kernel_type': 'Matern', 'length_scale': 365.94966197579134, 'noise_level': 0.10510761602242019, 'constant_value': 0.004470755315963517, 'nu': 2.5}. Best is trial 959 with value: 0.1375110730946576.
[I 2024-12-04 20:38:12,517] Trial 1323 finished with value: 0.14249486673113182 and parameters: {'kernel_type': 'Matern', 'length_scale': 0.24246900397684892, 'noise_level': 0.0335592457756666, 'constant_value': 99.25799535224289, 'nu': 1.5}. Best is trial 959 with value: 0.1375110730946576.
[I 2024-12-04 20:38:18,359] Trial 1327 finished with value: 0.9864686819142268 and parameters: {'kernel_type': 'Matern', 'length_scale': 53686.2102450242, 'noise_level': 1.204585451229738e-08, 'constant_value': 4873.146174931523, 'nu': 2.5}. Best is trial 959 with value: 0.1375110730946576.
[I 2024-12-04 20:38:18,477] Trial 1326 finished with value: 0.14249508753486081 and parameters: {'kernel_type': 'Matern', 'length_scale': 57.16134019933407, 'noise_level': 0.0899889735418796, 'constant_value': 357.2674697120512, 'nu': 1.5}. Best is trial 959 with value: 0.1375110730946576.
[I 2024-12-04 20:38:19,254] Trial 1328 finished with value: 0.14469880663911455 and parameters: {'kernel_type': 'Matern', 'length_scale': 8.904889597946621, 'noise_level': 0.04092448372126983, 'constant_value': 11.52393442033022, 'nu': 2.5}. Best is trial 959 with value: 0.1375110730946576.
[I 2024-12-04 20:38:25,225] Trial 1330 finished with value: 0.9864686817003343 and parameters: {'kernel_type': 'Matern', 'length_scale': 8.449122369671933, 'noise_level': 0.008041303473166504, 'constant_value': 0.17107154570599842, 'nu': 1.5}. Best is trial 959 with value: 0.1375110730946576.
[I 2024-12-04 20:38:28,405] Trial 1331 finished with value: 0.14249510006003774 and parameters: {'kernel_type': 'Matern', 'length_scale': 3.244460143320743, 'noise_level': 0.907230206676006, 'constant_value': 6.381514848939845, 'nu': 1.5}. Best is trial 959 with value: 0.1375110730946576.
[I 2024-12-04 20:38:29,943] Trial 1329 finished with value: 0.14249509993138734 and parameters: {'kernel_type': 'Matern', 'length_scale': 0.2232512836381495, 'noise_level': 0.8538714389417964, 'constant_value': 2832.3581666178434, 'nu': 1.5}. Best is trial 959 with value: 0.1375110730946576.
[I 2024-12-04 20:38:31,453] Trial 1332 finished with value: 0.14249500183137065 and parameters: {'kernel_type': 'Matern', 'length_scale': 0.7985428222562291, 'noise_level': 0.02136067812382444, 'constant_value': 258.94808363741424, 'nu': 1.5}. Best is trial 959 with value: 0.1375110730946576.
[I 2024-12-04 20:38:35,863] Trial 1333 finished with value: 0.1424949880619775 and parameters: {'kernel_type': 'Matern', 'length_scale': 4.1670562302084715, 'noise_level': 0.021107324297142696, 'constant_value': 198.91157506030981, 'nu': 1.5}. Best is trial 959 with value: 0.1375110730946576.
[I 2024-12-04 20:38:35,956] Trial 1335 finished with value: 0.1424950688104385 and parameters: {'kernel_type': 'Matern', 'length_scale': 147.2803195070848, 'noise_level': 0.05437032535470987, 'constant_value': 1539.5912359642057, 'nu': 1.5}. Best is trial 959 with value: 0.1375110730946576.
[I 2024-12-04 20:38:37,180] Trial 1334 finished with value: 0.14249504881542363 and parameters: {'kernel_type': 'Matern', 'length_scale': 3.6455852729931637, 'noise_level': 2.9852527341444388e-05, 'constant_value': 35.35532321461006, 'nu': 1.5}. Best is trial 959 with value: 0.1375110730946576.
[I 2024-12-04 20:38:40,658] Trial 1336 finished with value: 0.9982167338038397 and parameters: {'kernel_type': 'Matern', 'length_scale': 0.0003357411640998341, 'noise_level': 2.385102844477718e-10, 'constant_value': 1686.1506741077294, 'nu': 2.5}. Best is trial 959 with value: 0.1375110730946576.
[I 2024-12-04 20:38:44,357] Trial 1337 finished with value: 0.14249499103974353 and parameters: {'kernel_type': 'Matern', 'length_scale': 60.16675530558359, 'noise_level': 0.3883768588820735, 'constant_value': 0.009055776322359148, 'nu': 1.5}. Best is trial 959 with value: 0.1375110730946576.
[I 2024-12-04 20:38:44,914] Trial 1338 finished with value: 0.14249506525612246 and parameters: {'kernel_type': 'Matern', 'length_scale': 381.4211726393643, 'noise_level': 0.9166826441586531, 'constant_value': 52.63436091627683, 'nu': 1.5}. Best is trial 959 with value: 0.1375110730946576.
[I 2024-12-04 20:38:47,353] Trial 1339 finished with value: 0.14249503780464476 and parameters: {'kernel_type': 'Matern', 'length_scale': 40.09401793525014, 'noise_level': 0.008511775520494801, 'constant_value': 74.85719400617197, 'nu': 1.5}. Best is trial 959 with value: 0.1375110730946576.
[I 2024-12-04 20:38:53,181] Trial 1341 finished with value: 0.1424950486647509 and parameters: {'kernel_type': 'Matern', 'length_scale': 2.285774723842374, 'noise_level': 0.6814536747154528, 'constant_value': 56.81243521639952, 'nu': 1.5}. Best is trial 959 with value: 0.1375110730946576.
[I 2024-12-04 20:38:53,516] Trial 1340 finished with value: 0.986468681931471 and parameters: {'kernel_type': 'Matern', 'length_scale': 126.23679320704743, 'noise_level': 0.001974342912537322, 'constant_value': 1.0242568921528898, 'nu': 1.5}. Best is trial 959 with value: 0.1375110730946576.
[I 2024-12-04 20:38:54,078] Trial 1342 finished with value: 0.14249506906295656 and parameters: {'kernel_type': 'Matern', 'length_scale': 1.2363743732752763, 'noise_level': 0.07086292456469878, 'constant_value': 0.4595287367945816, 'nu': 1.5}. Best is trial 959 with value: 0.1375110730946576.
[I 2024-12-04 20:38:59,593] Trial 1343 finished with value: 0.1424951426191346 and parameters: {'kernel_type': 'Matern', 'length_scale': 1.5803488659031135, 'noise_level': 0.02268336312076267, 'constant_value': 20666.912249033372, 'nu': 1.5}. Best is trial 959 with value: 0.1375110730946576.
[I 2024-12-04 20:39:01,661] Trial 1344 finished with value: 0.1424950585519403 and parameters: {'kernel_type': 'Matern', 'length_scale': 164.3742206118848, 'noise_level': 0.6570736848467938, 'constant_value': 0.23842273916743856, 'nu': 1.5}. Best is trial 959 with value: 0.1375110730946576.
[I 2024-12-04 20:39:01,690] Trial 1345 finished with value: 0.1424951914362734 and parameters: {'kernel_type': 'Matern', 'length_scale': 21.928912229718147, 'noise_level': 0.9029123101619142, 'constant_value': 24.400373344887928, 'nu': 1.5}. Best is trial 959 with value: 0.1375110730946576.
[I 2024-12-04 20:39:06,398] Trial 1346 finished with value: 0.14249453892205996 and parameters: {'kernel_type': 'Matern', 'length_scale': 10.810348804498556, 'noise_level': 0.003898245222252484, 'constant_value': 190.25645290742898, 'nu': 1.5}. Best is trial 959 with value: 0.1375110730946576.
[I 2024-12-04 20:39:12,513] Trial 1347 finished with value: 0.14249544821027083 and parameters: {'kernel_type': 'Matern', 'length_scale': 4.613520675500558, 'noise_level': 0.8969630623549493, 'constant_value': 10677.853909061005, 'nu': 1.5}. Best is trial 959 with value: 0.1375110730946576.
[I 2024-12-04 20:39:14,361] Trial 1349 finished with value: 0.1424952505111586 and parameters: {'kernel_type': 'Matern', 'length_scale': 0.3967850444186166, 'noise_level': 0.00047662549628584824, 'constant_value': 1.0982825669876852, 'nu': 1.5}. Best is trial 959 with value: 0.1375110730946576.
[I 2024-12-04 20:39:15,741] Trial 1348 finished with value: 0.9864686819502598 and parameters: {'kernel_type': 'Matern', 'length_scale': 88843.68549041913, 'noise_level': 4.4999534346412484e-10, 'constant_value': 1.0575679191442267e-07, 'nu': 1.5}. Best is trial 959 with value: 0.1375110730946576.
[I 2024-12-04 20:39:16,862] Trial 1350 finished with value: 0.9864686818716379 and parameters: {'kernel_type': 'RBF', 'length_scale': 0.00544536547382418, 'noise_level': 0.0001417787394558223, 'constant_value': 0.08600630242570778, 'nu': 2.5}. Best is trial 959 with value: 0.1375110730946576.
[I 2024-12-04 20:39:21,762] Trial 1352 finished with value: 0.9864686821402219 and parameters: {'kernel_type': 'Matern', 'length_scale': 0.03091363303409213, 'noise_level': 0.07999181452405135, 'constant_value': 27.841974483495164, 'nu': 0.5}. Best is trial 959 with value: 0.1375110730946576.
[I 2024-12-04 20:39:22,965] Trial 1351 finished with value: 0.1424950629158554 and parameters: {'kernel_type': 'Matern', 'length_scale': 1.0792935480335877, 'noise_level': 0.9224558452090637, 'constant_value': 13.95636099813639, 'nu': 1.5}. Best is trial 959 with value: 0.1375110730946576.
[I 2024-12-04 20:39:26,892] Trial 1354 finished with value: 0.14249394396323173 and parameters: {'kernel_type': 'Matern', 'length_scale': 105.96875671393539, 'noise_level': 0.04403905524141829, 'constant_value': 879.9746028279416, 'nu': 1.5}. Best is trial 959 with value: 0.1375110730946576.
[I 2024-12-04 20:39:27,973] Trial 1355 finished with value: 0.9864686819226008 and parameters: {'kernel_type': 'Matern', 'length_scale': 0.0026615318520612536, 'noise_level': 0.27611901486557483, 'constant_value': 59623.54683575775, 'nu': 2.5}. Best is trial 959 with value: 0.1375110730946576.
[I 2024-12-04 20:39:28,334] Trial 1353 finished with value: 0.1424948958719238 and parameters: {'kernel_type': 'Matern', 'length_scale': 254.12645870507305, 'noise_level': 0.03449418574811859, 'constant_value': 2.2415421810233287, 'nu': 1.5}. Best is trial 959 with value: 0.1375110730946576.
[I 2024-12-04 20:39:32,654] Trial 1356 finished with value: 0.9864686819227576 and parameters: {'kernel_type': 'Matern', 'length_scale': 5927.280467352586, 'noise_level': 0.005451592345862025, 'constant_value': 60847.15242017359, 'nu': 1.5}. Best is trial 959 with value: 0.1375110730946576.
[I 2024-12-04 20:39:32,679] Trial 1358 finished with value: 0.9982167338040306 and parameters: {'kernel_type': 'Matern', 'length_scale': 0.0005096160571156826, 'noise_level': 3.374942548785178e-06, 'constant_value': 16673.83524878438, 'nu': 1.5}. Best is trial 959 with value: 0.1375110730946576.
[I 2024-12-04 20:39:35,307] Trial 1357 finished with value: 0.9864686819232201 and parameters: {'kernel_type': 'Matern', 'length_scale': 637.0192985759746, 'noise_level': 0.0002348009305796517, 'constant_value': 1138.9634659029248, 'nu': 1.5}. Best is trial 959 with value: 0.1375110730946576.
[I 2024-12-04 20:39:37,603] Trial 1360 finished with value: 0.9864686717150569 and parameters: {'kernel_type': 'Matern', 'length_scale': 0.08366309544689154, 'noise_level': 0.7868029471755957, 'constant_value': 60458.39799760502, 'nu': 1.5}. Best is trial 959 with value: 0.1375110730946576.
[I 2024-12-04 20:39:41,534] Trial 1361 finished with value: 0.14249496035959733 and parameters: {'kernel_type': 'Matern', 'length_scale': 51.20102417021728, 'noise_level': 0.0033180893825342363, 'constant_value': 92740.80921371131, 'nu': 1.5}. Best is trial 959 with value: 0.1375110730946576.
[I 2024-12-04 20:39:42,338] Trial 1359 finished with value: 0.1424948161141969 and parameters: {'kernel_type': 'Matern', 'length_scale': 115.41548935211047, 'noise_level': 0.002124798603211166, 'constant_value': 94.95885618392785, 'nu': 1.5}. Best is trial 959 with value: 0.1375110730946576.
[I 2024-12-04 20:39:43,023] Trial 1362 finished with value: 0.14249551009235334 and parameters: {'kernel_type': 'Matern', 'length_scale': 550.6011946573509, 'noise_level': 0.01248369486164217, 'constant_value': 2885.6089190840116, 'nu': 1.5}. Best is trial 959 with value: 0.1375110730946576.
[I 2024-12-04 20:39:48,578] Trial 1363 finished with value: 0.9864686819392123 and parameters: {'kernel_type': 'RBF', 'length_scale': 169.09352685119092, 'noise_level': 0.002144546335161918, 'constant_value': 48.606553611745625, 'nu': 1.5}. Best is trial 959 with value: 0.1375110730946576.
[I 2024-12-04 20:39:49,436] Trial 1364 finished with value: 0.1424950709687449 and parameters: {'kernel_type': 'Matern', 'length_scale': 8.96446261502447, 'noise_level': 0.0007405175868030682, 'constant_value': 1464.4879176183292, 'nu': 1.5}. Best is trial 959 with value: 0.1375110730946576.
[I 2024-12-04 20:39:50,638] Trial 1365 finished with value: 0.1477103354901267 and parameters: {'kernel_type': 'RBF', 'length_scale': 8.159546683744205, 'noise_level': 0.06744196899427657, 'constant_value': 0.10534985232325987, 'nu': 1.5}. Best is trial 959 with value: 0.1375110730946576.
[I 2024-12-04 20:39:58,214] Trial 1368 finished with value: 0.9864686819222254 and parameters: {'kernel_type': 'RBF', 'length_scale': 0.0025634347214272494, 'noise_level': 0.00036478539679668954, 'constant_value': 2.8326779375263578, 'nu': 1.5}. Best is trial 959 with value: 0.1375110730946576.
[I 2024-12-04 20:39:58,279] Trial 1367 finished with value: 0.9864686819229913 and parameters: {'kernel_type': 'Matern', 'length_scale': 0.02305859371460918, 'noise_level': 0.06870578317566627, 'constant_value': 31.74125315716757, 'nu': 1.5}. Best is trial 959 with value: 0.1375110730946576.
[I 2024-12-04 20:40:00,516] Trial 1366 finished with value: 0.1424950389218039 and parameters: {'kernel_type': 'Matern', 'length_scale': 0.713927095224635, 'noise_level': 0.006501186167111023, 'constant_value': 0.41405095372501677, 'nu': 1.5}. Best is trial 959 with value: 0.1375110730946576.
[I 2024-12-04 20:40:04,229] Trial 1371 finished with value: 0.9982167270683353 and parameters: {'kernel_type': 'Matern', 'length_scale': 0.00011017855330657893, 'noise_level': 0.17423445665557144, 'constant_value': 5.484736171520885e-06, 'nu': 1.5}. Best is trial 959 with value: 0.1375110730946576.
[I 2024-12-04 20:40:04,874] Trial 1369 finished with value: 0.14249506691996724 and parameters: {'kernel_type': 'Matern', 'length_scale': 0.8009062707436153, 'noise_level': 0.024254341377233014, 'constant_value': 1082.0731504992748, 'nu': 1.5}. Best is trial 959 with value: 0.1375110730946576.
[I 2024-12-04 20:40:06,236] Trial 1370 finished with value: 0.1424953374911097 and parameters: {'kernel_type': 'Matern', 'length_scale': 7.607144426305201, 'noise_level': 0.01132180852424323, 'constant_value': 4.483974637019844, 'nu': 1.5}. Best is trial 959 with value: 0.1375110730946576.
[I 2024-12-04 20:40:10,950] Trial 1372 finished with value: 0.19720002284958377 and parameters: {'kernel_type': 'Matern', 'length_scale': 15.871043986124612, 'noise_level': 0.002158230735525851, 'constant_value': 50.22906536255763, 'nu': 0.5}. Best is trial 959 with value: 0.1375110730946576.
[I 2024-12-04 20:40:11,456] Trial 1374 finished with value: 0.14249508756348317 and parameters: {'kernel_type': 'Matern', 'length_scale': 222.63632577817876, 'noise_level': 0.03173344684601833, 'constant_value': 1450.6089783907719, 'nu': 1.5}. Best is trial 959 with value: 0.1375110730946576.
[I 2024-12-04 20:40:12,547] Trial 1373 finished with value: 0.9864686819246571 and parameters: {'kernel_type': 'Matern', 'length_scale': 291.5524023141164, 'noise_level': 0.001696220531800885, 'constant_value': 1.2078339818463777, 'nu': 1.5}. Best is trial 959 with value: 0.1375110730946576.
[I 2024-12-04 20:40:16,553] Trial 1375 finished with value: 0.9864686814168058 and parameters: {'kernel_type': 'RBF', 'length_scale': 12.470818444218212, 'noise_level': 8.056216532174919e-10, 'constant_value': 0.015569994536360668, 'nu': 1.5}. Best is trial 959 with value: 0.1375110730946576.
[I 2024-12-04 20:40:17,709] Trial 1376 finished with value: 0.14249516290285646 and parameters: {'kernel_type': 'Matern', 'length_scale': 9.185345588169067, 'noise_level': 0.0442534643458738, 'constant_value': 3153.8027315470054, 'nu': 1.5}. Best is trial 959 with value: 0.1375110730946576.
