[I 2024-12-04 15:12:47,079] Trial 1724 finished with value: 1.2401112327884263 and parameters: {'kernel_type': 'Matern', 'length_scale': 77901.31658016378, 'noise_level': 0.010522730661513284, 'constant_value': 9.785116254898515, 'nu': 0.5}. Best is trial 386 with value: 0.4872991004520934.
[I 2024-12-04 15:12:47,300] Trial 1725 finished with value: 1.240110765779147 and parameters: {'kernel_type': 'Matern', 'length_scale': 0.07775178503906909, 'noise_level': 1.699160772947244e-08, 'constant_value': 0.0012866309632578428, 'nu': 0.5}. Best is trial 386 with value: 0.4872991004520934.
[I 2024-12-04 15:12:47,301] Trial 1730 finished with value: 0.4883014378584233 and parameters: {'kernel_type': 'Matern', 'length_scale': 1389.6325456069198, 'noise_level': 0.7615176847305044, 'constant_value': 788.0533218069097, 'nu': 0.5}. Best is trial 386 with value: 0.4872991004520934.
[I 2024-12-04 15:12:47,330] Trial 1731 finished with value: 1.240111232578482 and parameters: {'kernel_type': 'RBF', 'length_scale': 0.01634935621578837, 'noise_level': 0.1477086510589546, 'constant_value': 9440.626804153128, 'nu': 0.5}. Best is trial 386 with value: 0.4872991004520934.
[I 2024-12-04 15:12:48,112] Trial 1727 finished with value: 0.48830342734194304 and parameters: {'kernel_type': 'Matern', 'length_scale': 739.003006883876, 'noise_level': 0.07541830023403548, 'constant_value': 97800.0010824906, 'nu': 0.5}. Best is trial 386 with value: 0.4872991004520934.
[I 2024-12-04 15:12:48,119] Trial 1732 finished with value: 0.4883034252255184 and parameters: {'kernel_type': 'Matern', 'length_scale': 4966.876078598661, 'noise_level': 0.025564161275462637, 'constant_value': 1242.0767345251427, 'nu': 0.5}. Best is trial 386 with value: 0.4872991004520934.
[I 2024-12-04 15:12:48,318] Trial 1719 finished with value: 0.48830335477389486 and parameters: {'kernel_type': 'Matern', 'length_scale': 80762.3882396916, 'noise_level': 0.98799745071492, 'constant_value': 13594.699315210482, 'nu': 0.5}. Best is trial 386 with value: 0.4872991004520934.
[I 2024-12-04 15:12:49,317] Trial 1736 finished with value: 0.48830354081916627 and parameters: {'kernel_type': 'Matern', 'length_scale': 85728.84338669629, 'noise_level': 0.1525500570537746, 'constant_value': 69468.32107527633, 'nu': 0.5}. Best is trial 386 with value: 0.4872991004520934.
[I 2024-12-04 15:12:50,039] Trial 1737 finished with value: 0.48830341807083544 and parameters: {'kernel_type': 'Matern', 'length_scale': 14.126614949519706, 'noise_level': 0.011122570473935329, 'constant_value': 83171.3740787825, 'nu': 0.5}. Best is trial 386 with value: 0.4872991004520934.
[I 2024-12-04 15:12:51,936] Trial 1722 finished with value: 0.4883034652913493 and parameters: {'kernel_type': 'Matern', 'length_scale': 144.34349025725552, 'noise_level': 0.5862305911403071, 'constant_value': 0.007418492821453876, 'nu': 0.5}. Best is trial 386 with value: 0.4872991004520934.
[I 2024-12-04 15:12:53,474] Trial 1733 finished with value: 0.4883035047593655 and parameters: {'kernel_type': 'Matern', 'length_scale': 23.478479440008357, 'noise_level': 0.9293690741098523, 'constant_value': 3747.1576480935214, 'nu': 0.5}. Best is trial 386 with value: 0.4872991004520934.
[I 2024-12-04 15:12:54,161] Trial 1741 finished with value: 1.261454370202761 and parameters: {'kernel_type': 'RBF', 'length_scale': 2.099432213057492e-05, 'noise_level': 1.936541104961631e-08, 'constant_value': 87.60508874221692, 'nu': 2.5}. Best is trial 386 with value: 0.4872991004520934.
[I 2024-12-04 15:12:54,550] Trial 1738 finished with value: 1.2614543702025685 and parameters: {'kernel_type': 'RBF', 'length_scale': 4.2507267427914474e-05, 'noise_level': 1.4130212190665678e-07, 'constant_value': 42484.623363443614, 'nu': 0.5}. Best is trial 386 with value: 0.4872991004520934.
[I 2024-12-04 15:12:54,772] Trial 1734 finished with value: 1.261453698327503 and parameters: {'kernel_type': 'Matern', 'length_scale': 0.07333084533984968, 'noise_level': 0.03240755841696564, 'constant_value': 1.4061760133312658e-05, 'nu': 0.5}. Best is trial 386 with value: 0.4872991004520934.
[I 2024-12-04 15:12:54,774] Trial 1739 finished with value: 0.48830348172932025 and parameters: {'kernel_type': 'Matern', 'length_scale': 255.24464449831603, 'noise_level': 0.850131547169574, 'constant_value': 156.02849753667354, 'nu': 0.5}. Best is trial 386 with value: 0.4872991004520934.
[I 2024-12-04 15:12:55,166] Trial 1744 finished with value: 0.48830354464967224 and parameters: {'kernel_type': 'Matern', 'length_scale': 1232.7387695328212, 'noise_level': 0.49206299632758427, 'constant_value': 89.45785395363379, 'nu': 0.5}. Best is trial 386 with value: 0.4872991004520934.
[I 2024-12-04 15:12:55,682] Trial 1743 finished with value: 0.48830341916889786 and parameters: {'kernel_type': 'Matern', 'length_scale': 33696.927863239216, 'noise_level': 0.9911914407414938, 'constant_value': 643.9654744511113, 'nu': 0.5}. Best is trial 386 with value: 0.4872991004520934.
[I 2024-12-04 15:12:56,834] Trial 1745 finished with value: 0.4883034537004356 and parameters: {'kernel_type': 'Matern', 'length_scale': 1302.4436382849092, 'noise_level': 0.7568079715302545, 'constant_value': 117.96462879119083, 'nu': 0.5}. Best is trial 386 with value: 0.4872991004520934.
[I 2024-12-04 15:12:56,903] Trial 1746 finished with value: 0.488303420604029 and parameters: {'kernel_type': 'Matern', 'length_scale': 88244.93273116364, 'noise_level': 0.03771843703481687, 'constant_value': 13665.249431397731, 'nu': 0.5}. Best is trial 386 with value: 0.4872991004520934.
[I 2024-12-04 15:12:57,291] Trial 1735 finished with value: 0.4883034190876781 and parameters: {'kernel_type': 'Matern', 'length_scale': 1504.1979869929426, 'noise_level': 0.7416752850147269, 'constant_value': 355.5777330059418, 'nu': 0.5}. Best is trial 386 with value: 0.4872991004520934.
[I 2024-12-04 15:12:58,831] Trial 1740 finished with value: 0.4883034186963601 and parameters: {'kernel_type': 'Matern', 'length_scale': 1445.0792763519735, 'noise_level': 0.9090301434123436, 'constant_value': 5744.117459146449, 'nu': 0.5}. Best is trial 386 with value: 0.4872991004520934.
[I 2024-12-04 15:13:00,476] Trial 1750 finished with value: 0.4883034060242208 and parameters: {'kernel_type': 'Matern', 'length_scale': 87.24378376210072, 'noise_level': 0.8291466493659249, 'constant_value': 25.893027601742777, 'nu': 0.5}. Best is trial 386 with value: 0.4872991004520934.
[I 2024-12-04 15:13:01,610] Trial 1751 finished with value: 0.4883034157338264 and parameters: {'kernel_type': 'Matern', 'length_scale': 90097.1481556854, 'noise_level': 0.75935188580849, 'constant_value': 68786.51996138989, 'nu': 0.5}. Best is trial 386 with value: 0.4872991004520934.
[I 2024-12-04 15:13:01,774] Trial 1753 finished with value: 0.48830340944627 and parameters: {'kernel_type': 'Matern', 'length_scale': 4916.08989274544, 'noise_level': 0.0371775256088039, 'constant_value': 2381.5596280509526, 'nu': 0.5}. Best is trial 386 with value: 0.4872991004520934.
[I 2024-12-04 15:13:02,063] Trial 1748 finished with value: 0.48830343092970047 and parameters: {'kernel_type': 'Matern', 'length_scale': 4885.2763671256, 'noise_level': 0.04092421104769167, 'constant_value': 1956.705626560364, 'nu': 0.5}. Best is trial 386 with value: 0.4872991004520934.
[I 2024-12-04 15:13:02,691] Trial 1742 finished with value: 0.5663935804076325 and parameters: {'kernel_type': 'Matern', 'length_scale': 917.639165835789, 'noise_level': 0.7086039461091678, 'constant_value': 1039.2275686051082, 'nu': 2.5}. Best is trial 386 with value: 0.4872991004520934.
[I 2024-12-04 15:13:03,966] Trial 1756 finished with value: 0.4883034176867788 and parameters: {'kernel_type': 'Matern', 'length_scale': 6617.732185438821, 'noise_level': 0.9994907529040185, 'constant_value': 175.60384244427192, 'nu': 0.5}. Best is trial 386 with value: 0.4872991004520934.
[I 2024-12-04 15:13:03,970] Trial 1752 finished with value: 0.48830404358798857 and parameters: {'kernel_type': 'Matern', 'length_scale': 10709.438316210808, 'noise_level': 0.01986066755484305, 'constant_value': 2263.635446435302, 'nu': 0.5}. Best is trial 386 with value: 0.4872991004520934.
[I 2024-12-04 15:13:04,243] Trial 1754 finished with value: 0.4883034258228425 and parameters: {'kernel_type': 'Matern', 'length_scale': 0.9352106578628662, 'noise_level': 0.029464032550300376, 'constant_value': 0.2788006380567494, 'nu': 0.5}. Best is trial 386 with value: 0.4872991004520934.
[I 2024-12-04 15:13:04,270] Trial 1762 finished with value: 1.2401112344910774 and parameters: {'kernel_type': 'Matern', 'length_scale': 98803.44562437988, 'noise_level': 0.005338007849745325, 'constant_value': 337.03104315334105, 'nu': 0.5}. Best is trial 386 with value: 0.4872991004520934.
[I 2024-12-04 15:13:04,273] Trial 1747 finished with value: 0.4883033878922782 and parameters: {'kernel_type': 'Matern', 'length_scale': 96237.05332834422, 'noise_level': 0.665580139487789, 'constant_value': 78.27275732025579, 'nu': 0.5}. Best is trial 386 with value: 0.4872991004520934.
[I 2024-12-04 15:13:04,806] Trial 1749 finished with value: 0.48830341880520844 and parameters: {'kernel_type': 'Matern', 'length_scale': 4074.0958309551797, 'noise_level': 0.9734795029770075, 'constant_value': 4683.340782192674, 'nu': 0.5}. Best is trial 386 with value: 0.4872991004520934.
[I 2024-12-04 15:13:05,368] Trial 1765 finished with value: 1.2614545272928057 and parameters: {'kernel_type': 'Matern', 'length_scale': 96307.83389186203, 'noise_level': 0.8730568194527606, 'constant_value': 1.5156314908526094, 'nu': 0.5}. Best is trial 386 with value: 0.4872991004520934.
[I 2024-12-04 15:13:07,430] Trial 1761 finished with value: 0.4883034188067974 and parameters: {'kernel_type': 'Matern', 'length_scale': 1.5879502066664009, 'noise_level': 0.970122271325666, 'constant_value': 54636.94080019295, 'nu': 0.5}. Best is trial 386 with value: 0.4872991004520934.
[I 2024-12-04 15:13:08,193] Trial 1768 finished with value: 1.2614543700676863 and parameters: {'kernel_type': 'RBF', 'length_scale': 7.496713994836216e-05, 'noise_level': 0.04689820617577465, 'constant_value': 14625.562870379728, 'nu': 2.5}. Best is trial 386 with value: 0.4872991004520934.
[I 2024-12-04 15:13:08,441] Trial 1760 finished with value: 0.4883034086076427 and parameters: {'kernel_type': 'Matern', 'length_scale': 4129.965644781571, 'noise_level': 0.9274904213871611, 'constant_value': 7.934234072723304, 'nu': 0.5}. Best is trial 386 with value: 0.4872991004520934.
[I 2024-12-04 15:13:08,843] Trial 1755 finished with value: 0.4883034666151782 and parameters: {'kernel_type': 'Matern', 'length_scale': 4075.2898086733007, 'noise_level': 0.04756024229823589, 'constant_value': 1182.277730735622, 'nu': 0.5}. Best is trial 386 with value: 0.4872991004520934.
[I 2024-12-04 15:13:10,728] Trial 1771 finished with value: 0.4883034386549776 and parameters: {'kernel_type': 'Matern', 'length_scale': 906.1081102367768, 'noise_level': 0.0039987322365171345, 'constant_value': 86648.47850109242, 'nu': 0.5}. Best is trial 386 with value: 0.4872991004520934.
[I 2024-12-04 15:13:11,026] Trial 1764 finished with value: 1.2614547953941473 and parameters: {'kernel_type': 'Matern', 'length_scale': 20.302424879931976, 'noise_level': 0.0373922938106871, 'constant_value': 1966.6890386025216, 'nu': 0.5}. Best is trial 386 with value: 0.4872991004520934.
[I 2024-12-04 15:13:11,199] Trial 1763 finished with value: 0.5273054445618963 and parameters: {'kernel_type': 'Matern', 'length_scale': 602.622222614973, 'noise_level': 0.7818051560113574, 'constant_value': 68.57785410983621, 'nu': 1.5}. Best is trial 386 with value: 0.4872991004520934.
[I 2024-12-04 15:13:11,227] Trial 1757 finished with value: 0.48830341795218213 and parameters: {'kernel_type': 'Matern', 'length_scale': 624.2429313661567, 'noise_level': 0.9672385911895718, 'constant_value': 29758.53716308288, 'nu': 0.5}. Best is trial 386 with value: 0.4872991004520934.
[I 2024-12-04 15:13:12,279] Trial 1774 finished with value: 0.4883034186710749 and parameters: {'kernel_type': 'Matern', 'length_scale': 98925.36988633945, 'noise_level': 0.7743618360055364, 'constant_value': 47.60607485287239, 'nu': 0.5}. Best is trial 386 with value: 0.4872991004520934.
[I 2024-12-04 15:13:12,323] Trial 1759 finished with value: 0.48830339389745925 and parameters: {'kernel_type': 'Matern', 'length_scale': 7505.485384340597, 'noise_level': 0.9070632371198595, 'constant_value': 2463.5272767449273, 'nu': 0.5}. Best is trial 386 with value: 0.4872991004520934.
[I 2024-12-04 15:13:12,907] Trial 1776 finished with value: 0.48830341891410967 and parameters: {'kernel_type': 'Matern', 'length_scale': 256.8742594953373, 'noise_level': 0.991164496515801, 'constant_value': 1555.2790763006035, 'nu': 0.5}. Best is trial 386 with value: 0.4872991004520934.
[I 2024-12-04 15:13:14,172] Trial 1758 finished with value: 0.6443853975745617 and parameters: {'kernel_type': 'RBF', 'length_scale': 3414.4066251166855, 'noise_level': 0.14555053173113777, 'constant_value': 50848.0050782929, 'nu': 0.5}. Best is trial 386 with value: 0.4872991004520934.
[I 2024-12-04 15:13:14,667] Trial 1775 finished with value: 0.48830341790744847 and parameters: {'kernel_type': 'Matern', 'length_scale': 95370.33227421781, 'noise_level': 0.0005554859509032814, 'constant_value': 6360.090891285598, 'nu': 0.5}. Best is trial 386 with value: 0.4872991004520934.
[I 2024-12-04 15:13:16,204] Trial 1769 finished with value: 1.2401112328062842 and parameters: {'kernel_type': 'RBF', 'length_scale': 89553.53369031443, 'noise_level': 0.004000314510179082, 'constant_value': 75.59986048236846, 'nu': 0.5}. Best is trial 386 with value: 0.4872991004520934.
[I 2024-12-04 15:13:17,233] Trial 1781 finished with value: 0.48830430324655016 and parameters: {'kernel_type': 'Matern', 'length_scale': 592.7954817622534, 'noise_level': 0.06965068693909866, 'constant_value': 292.9959112790164, 'nu': 0.5}. Best is trial 386 with value: 0.4872991004520934.
[I 2024-12-04 15:13:17,364] Trial 1766 finished with value: 0.48830341370508457 and parameters: {'kernel_type': 'Matern', 'length_scale': 62507.58150966017, 'noise_level': 0.009918247845943737, 'constant_value': 645.6892611534392, 'nu': 0.5}. Best is trial 386 with value: 0.4872991004520934.
[I 2024-12-04 15:13:18,035] Trial 1777 finished with value: 1.240111232594283 and parameters: {'kernel_type': 'Matern', 'length_scale': 2438.7519653073336, 'noise_level': 0.012571764034269824, 'constant_value': 1.0305749249671377, 'nu': 0.5}. Best is trial 386 with value: 0.4872991004520934.
[I 2024-12-04 15:13:18,260] Trial 1778 finished with value: 0.48830338455283395 and parameters: {'kernel_type': 'Matern', 'length_scale': 12876.170377925851, 'noise_level': 0.035661712555460426, 'constant_value': 86918.1822582671, 'nu': 0.5}. Best is trial 386 with value: 0.4872991004520934.
[I 2024-12-04 15:13:19,180] Trial 1772 finished with value: 0.48830343857605946 and parameters: {'kernel_type': 'Matern', 'length_scale': 518.0480510448853, 'noise_level': 0.7593205993162461, 'constant_value': 35.12595666163552, 'nu': 0.5}. Best is trial 386 with value: 0.4872991004520934.
[I 2024-12-04 15:13:19,468] Trial 1770 finished with value: 0.48830342492485423 and parameters: {'kernel_type': 'Matern', 'length_scale': 67041.65715462247, 'noise_level': 0.029641774238615526, 'constant_value': 98792.53214119856, 'nu': 0.5}. Best is trial 386 with value: 0.4872991004520934.
[I 2024-12-04 15:13:19,817] Trial 1767 finished with value: 0.4883034217380251 and parameters: {'kernel_type': 'Matern', 'length_scale': 14.33442470374016, 'noise_level': 0.914396158139809, 'constant_value': 20.911262751391178, 'nu': 0.5}. Best is trial 386 with value: 0.4872991004520934.
[I 2024-12-04 15:13:19,818] Trial 1773 finished with value: 0.48830374185856146 and parameters: {'kernel_type': 'Matern', 'length_scale': 40.44581049638625, 'noise_level': 0.9363962228562108, 'constant_value': 55.8994233814847, 'nu': 0.5}. Best is trial 386 with value: 0.4872991004520934.
[I 2024-12-04 15:13:20,320] Trial 1780 finished with value: 0.4883034228647994 and parameters: {'kernel_type': 'Matern', 'length_scale': 81399.55649645797, 'noise_level': 0.065579481402951, 'constant_value': 783.5841802082139, 'nu': 0.5}. Best is trial 386 with value: 0.4872991004520934.
[I 2024-12-04 15:13:21,066] Trial 1779 finished with value: 0.48830341580782644 and parameters: {'kernel_type': 'Matern', 'length_scale': 16098.33881659053, 'noise_level': 0.9540010580291719, 'constant_value': 3261.0701090964885, 'nu': 0.5}. Best is trial 386 with value: 0.4872991004520934.
[I 2024-12-04 15:13:21,222] Trial 1785 finished with value: 1.261453794829574 and parameters: {'kernel_type': 'Matern', 'length_scale': 705.8677439566741, 'noise_level': 0.8451320388643927, 'constant_value': 3.062124961070433e-05, 'nu': 0.5}. Best is trial 386 with value: 0.4872991004520934.
[I 2024-12-04 15:13:21,533] Trial 1787 finished with value: 0.4883034259345753 and parameters: {'kernel_type': 'Matern', 'length_scale': 5132.5602258810295, 'noise_level': 0.9801771967259627, 'constant_value': 135.60527766234551, 'nu': 0.5}. Best is trial 386 with value: 0.4872991004520934.
[I 2024-12-04 15:13:23,213] Trial 1783 finished with value: 0.4883033699176336 and parameters: {'kernel_type': 'Matern', 'length_scale': 4256.867399285138, 'noise_level': 0.011280681572439064, 'constant_value': 99521.3513796625, 'nu': 0.5}. Best is trial 386 with value: 0.4872991004520934.
[I 2024-12-04 15:13:24,240] Trial 1784 finished with value: 0.4883034544196116 and parameters: {'kernel_type': 'Matern', 'length_scale': 130.58947053981896, 'noise_level': 0.568187827906301, 'constant_value': 1399.3640111824573, 'nu': 0.5}. Best is trial 386 with value: 0.4872991004520934.
[I 2024-12-04 15:13:24,259] Trial 1786 finished with value: 0.48830340829285535 and parameters: {'kernel_type': 'Matern', 'length_scale': 2557.075979468145, 'noise_level': 0.6668812277166912, 'constant_value': 95860.81696656274, 'nu': 0.5}. Best is trial 386 with value: 0.4872991004520934.
[I 2024-12-04 15:13:25,250] Trial 1782 finished with value: 0.4883030460482581 and parameters: {'kernel_type': 'Matern', 'length_scale': 14139.444236262289, 'noise_level': 0.9817648606494073, 'constant_value': 3073.582676545555, 'nu': 0.5}. Best is trial 386 with value: 0.4872991004520934.
[I 2024-12-04 15:13:25,370] Trial 1791 finished with value: 0.4883033795682944 and parameters: {'kernel_type': 'Matern', 'length_scale': 134.66883832310242, 'noise_level': 0.9887173859396231, 'constant_value': 1460.5450837410567, 'nu': 0.5}. Best is trial 386 with value: 0.4872991004520934.
[I 2024-12-04 15:13:25,383] Trial 1793 finished with value: 0.4883034190176978 and parameters: {'kernel_type': 'Matern', 'length_scale': 1254.4022922523263, 'noise_level': 0.9048239947877028, 'constant_value': 2332.0042075281326, 'nu': 0.5}. Best is trial 386 with value: 0.4872991004520934.
[I 2024-12-04 15:13:26,802] Trial 1788 finished with value: 0.4883034192141769 and parameters: {'kernel_type': 'Matern', 'length_scale': 3573.1360281240236, 'noise_level': 0.5518681225584992, 'constant_value': 97545.39858749803, 'nu': 0.5}. Best is trial 386 with value: 0.4872991004520934.
[I 2024-12-04 15:13:28,062] Trial 1798 finished with value: 0.48830343048012176 and parameters: {'kernel_type': 'Matern', 'length_scale': 2112.3551584121537, 'noise_level': 0.8903250079418521, 'constant_value': 2970.1563492722134, 'nu': 0.5}. Best is trial 386 with value: 0.4872991004520934.
[I 2024-12-04 15:13:30,681] Trial 1789 finished with value: 0.6443837416401618 and parameters: {'kernel_type': 'RBF', 'length_scale': 0.2695356533282307, 'noise_level': 0.13729366002075633, 'constant_value': 15288.09992205006, 'nu': 1.5}. Best is trial 386 with value: 0.4872991004520934.
[I 2024-12-04 15:13:32,629] Trial 1796 finished with value: 0.48830355637900164 and parameters: {'kernel_type': 'Matern', 'length_scale': 880.424627854876, 'noise_level': 0.04688127607226345, 'constant_value': 98491.38007384332, 'nu': 0.5}. Best is trial 386 with value: 0.4872991004520934.
[I 2024-12-04 15:13:32,719] Trial 1803 finished with value: 0.6443848448855092 and parameters: {'kernel_type': 'RBF', 'length_scale': 63.462609263570684, 'noise_level': 0.27545409370625423, 'constant_value': 11.743531583333098, 'nu': 2.5}. Best is trial 386 with value: 0.4872991004520934.
[I 2024-12-04 15:13:34,790] Trial 1795 finished with value: 1.2401112325926482 and parameters: {'kernel_type': 'Matern', 'length_scale': 87671.90132750713, 'noise_level': 0.020967219800134673, 'constant_value': 67.85179067853912, 'nu': 0.5}. Best is trial 386 with value: 0.4872991004520934.
[I 2024-12-04 15:13:35,602] Trial 1800 finished with value: 0.4883034183357483 and parameters: {'kernel_type': 'Matern', 'length_scale': 84265.64593898998, 'noise_level': 0.04187334468283271, 'constant_value': 68930.70631282672, 'nu': 0.5}. Best is trial 386 with value: 0.4872991004520934.
[I 2024-12-04 15:13:35,848] Trial 1797 finished with value: 0.48830341954522866 and parameters: {'kernel_type': 'Matern', 'length_scale': 89104.45209443719, 'noise_level': 0.0923770505666379, 'constant_value': 1439.1372632301586, 'nu': 0.5}. Best is trial 386 with value: 0.4872991004520934.
[I 2024-12-04 15:13:35,942] Trial 1801 finished with value: 0.48830340155622837 and parameters: {'kernel_type': 'Matern', 'length_scale': 973.413928111823, 'noise_level': 0.00041164743089720486, 'constant_value': 1619.6264267326862, 'nu': 0.5}. Best is trial 386 with value: 0.4872991004520934.
[I 2024-12-04 15:13:35,946] Trial 1802 finished with value: 0.4883034010347222 and parameters: {'kernel_type': 'Matern', 'length_scale': 3275.5254145495596, 'noise_level': 0.03391040974757896, 'constant_value': 1623.5762511901964, 'nu': 0.5}. Best is trial 386 with value: 0.4872991004520934.
