[I 2024-12-04 15:44:54,986] Trial 2296 finished with value: 0.9604358354567153 and parameters: {'n_estimators': 670, 'max_depth': 37, 'min_samples_split': 2, 'min_samples_leaf': 2, 'max_features': 'log2', 'bootstrap': True, 'criterion': 'squared_error'}. Best is trial 1025 with value: 0.41844370194907604.
[I 2024-12-04 15:44:55,186] Trial 2285 finished with value: 0.42187409566989376 and parameters: {'n_estimators': 788, 'max_depth': 42, 'min_samples_split': 2, 'min_samples_leaf': 1, 'max_features': None, 'bootstrap': True, 'criterion': 'squared_error'}. Best is trial 1025 with value: 0.41844370194907604.
[I 2024-12-04 15:44:55,211] Trial 2289 finished with value: 0.41959752694159097 and parameters: {'n_estimators': 830, 'max_depth': 39, 'min_samples_split': 2, 'min_samples_leaf': 1, 'max_features': None, 'bootstrap': True, 'criterion': 'squared_error'}. Best is trial 1025 with value: 0.41844370194907604.
[I 2024-12-04 15:44:59,370] Trial 2292 finished with value: 0.46468559891577776 and parameters: {'n_estimators': 708, 'max_depth': 36, 'min_samples_split': 2, 'min_samples_leaf': 2, 'max_features': None, 'bootstrap': True, 'criterion': 'squared_error'}. Best is trial 1025 with value: 0.41844370194907604.
[I 2024-12-04 15:44:59,641] Trial 2297 finished with value: 0.6405572421951772 and parameters: {'n_estimators': 561, 'max_depth': 36, 'min_samples_split': 15, 'min_samples_leaf': 7, 'max_features': None, 'bootstrap': True, 'criterion': 'squared_error'}. Best is trial 1025 with value: 0.41844370194907604.
[I 2024-12-04 15:45:01,665] Trial 2294 finished with value: 0.42072034170718325 and parameters: {'n_estimators': 883, 'max_depth': 43, 'min_samples_split': 2, 'min_samples_leaf': 1, 'max_features': None, 'bootstrap': True, 'criterion': 'squared_error'}. Best is trial 1025 with value: 0.41844370194907604.
[I 2024-12-04 15:45:02,342] Trial 2282 finished with value: 0.42072124107152986 and parameters: {'n_estimators': 932, 'max_depth': 37, 'min_samples_split': 2, 'min_samples_leaf': 1, 'max_features': None, 'bootstrap': True, 'criterion': 'squared_error'}. Best is trial 1025 with value: 0.41844370194907604.
[I 2024-12-04 15:45:04,991] Trial 2299 finished with value: 0.4219378273061827 and parameters: {'n_estimators': 682, 'max_depth': 42, 'min_samples_split': 2, 'min_samples_leaf': 1, 'max_features': None, 'bootstrap': True, 'criterion': 'squared_error'}. Best is trial 1025 with value: 0.41844370194907604.
[I 2024-12-04 15:45:06,551] Trial 2293 finished with value: 0.4403561293934177 and parameters: {'n_estimators': 738, 'max_depth': 40, 'min_samples_split': 9, 'min_samples_leaf': 1, 'max_features': None, 'bootstrap': True, 'criterion': 'squared_error'}. Best is trial 1025 with value: 0.41844370194907604.
[I 2024-12-04 15:45:07,765] Trial 2312 finished with value: 0.7150084096042194 and parameters: {'n_estimators': 519, 'max_depth': 46, 'min_samples_split': 2, 'min_samples_leaf': 11, 'max_features': None, 'bootstrap': False, 'criterion': 'squared_error'}. Best is trial 1025 with value: 0.41844370194907604.
[I 2024-12-04 15:45:09,239] Trial 2298 finished with value: 0.42619531643276193 and parameters: {'n_estimators': 646, 'max_depth': 35, 'min_samples_split': 3, 'min_samples_leaf': 1, 'max_features': None, 'bootstrap': True, 'criterion': 'squared_error'}. Best is trial 1025 with value: 0.41844370194907604.
[I 2024-12-04 15:45:16,679] Trial 2301 finished with value: 0.4208518768180726 and parameters: {'n_estimators': 706, 'max_depth': 37, 'min_samples_split': 2, 'min_samples_leaf': 1, 'max_features': None, 'bootstrap': True, 'criterion': 'squared_error'}. Best is trial 1025 with value: 0.41844370194907604.
[I 2024-12-04 15:45:17,226] Trial 2303 finished with value: 0.42467704433721865 and parameters: {'n_estimators': 717, 'max_depth': 34, 'min_samples_split': 3, 'min_samples_leaf': 1, 'max_features': None, 'bootstrap': True, 'criterion': 'squared_error'}. Best is trial 1025 with value: 0.41844370194907604.
[I 2024-12-04 15:45:18,141] Trial 2300 finished with value: 0.4647501631814296 and parameters: {'n_estimators': 705, 'max_depth': 41, 'min_samples_split': 2, 'min_samples_leaf': 2, 'max_features': None, 'bootstrap': True, 'criterion': 'squared_error'}. Best is trial 1025 with value: 0.41844370194907604.
[I 2024-12-04 15:45:19,618] Trial 2305 finished with value: 0.42067471863820766 and parameters: {'n_estimators': 741, 'max_depth': 37, 'min_samples_split': 2, 'min_samples_leaf': 1, 'max_features': None, 'bootstrap': True, 'criterion': 'squared_error'}. Best is trial 1025 with value: 0.41844370194907604.
[I 2024-12-04 15:45:21,368] Trial 2307 finished with value: 0.42134835209707056 and parameters: {'n_estimators': 729, 'max_depth': 33, 'min_samples_split': 2, 'min_samples_leaf': 1, 'max_features': None, 'bootstrap': True, 'criterion': 'squared_error'}. Best is trial 1025 with value: 0.41844370194907604.
[I 2024-12-04 15:45:23,213] Trial 2314 finished with value: 0.5180349110358382 and parameters: {'n_estimators': 677, 'max_depth': 37, 'min_samples_split': 5, 'min_samples_leaf': 1, 'max_features': 'sqrt', 'bootstrap': False, 'criterion': 'squared_error'}. Best is trial 1025 with value: 0.41844370194907604.
[I 2024-12-04 15:45:23,494] Trial 2304 finished with value: 0.41888075303390954 and parameters: {'n_estimators': 739, 'max_depth': 40, 'min_samples_split': 2, 'min_samples_leaf': 1, 'max_features': None, 'bootstrap': True, 'criterion': 'squared_error'}. Best is trial 1025 with value: 0.41844370194907604.
[I 2024-12-04 15:45:24,684] Trial 2311 finished with value: 0.6961713720375492 and parameters: {'n_estimators': 798, 'max_depth': 43, 'min_samples_split': 2, 'min_samples_leaf': 2, 'max_features': 'sqrt', 'bootstrap': True, 'criterion': 'squared_error'}. Best is trial 1025 with value: 0.41844370194907604.
[I 2024-12-04 15:45:24,974] Trial 2306 finished with value: 0.42422101297829146 and parameters: {'n_estimators': 727, 'max_depth': 45, 'min_samples_split': 3, 'min_samples_leaf': 1, 'max_features': None, 'bootstrap': True, 'criterion': 'squared_error'}. Best is trial 1025 with value: 0.41844370194907604.
[I 2024-12-04 15:45:27,301] Trial 2302 finished with value: 0.4246616311953108 and parameters: {'n_estimators': 746, 'max_depth': 46, 'min_samples_split': 3, 'min_samples_leaf': 1, 'max_features': None, 'bootstrap': True, 'criterion': 'squared_error'}. Best is trial 1025 with value: 0.41844370194907604.
[I 2024-12-04 15:45:27,313] Trial 2309 finished with value: 0.42445689152093835 and parameters: {'n_estimators': 762, 'max_depth': 43, 'min_samples_split': 3, 'min_samples_leaf': 1, 'max_features': None, 'bootstrap': True, 'criterion': 'squared_error'}. Best is trial 1025 with value: 0.41844370194907604.
[I 2024-12-04 15:45:30,535] Trial 2315 finished with value: 0.46447733355673043 and parameters: {'n_estimators': 711, 'max_depth': 40, 'min_samples_split': 3, 'min_samples_leaf': 2, 'max_features': None, 'bootstrap': True, 'criterion': 'squared_error'}. Best is trial 1025 with value: 0.41844370194907604.
[I 2024-12-04 15:45:34,182] Trial 2308 finished with value: 0.42167597597659173 and parameters: {'n_estimators': 734, 'max_depth': 47, 'min_samples_split': 2, 'min_samples_leaf': 1, 'max_features': None, 'bootstrap': True, 'criterion': 'squared_error'}. Best is trial 1025 with value: 0.41844370194907604.
[I 2024-12-04 15:45:37,062] Trial 2313 finished with value: 0.41934168182936965 and parameters: {'n_estimators': 726, 'max_depth': 41, 'min_samples_split': 2, 'min_samples_leaf': 1, 'max_features': None, 'bootstrap': True, 'criterion': 'squared_error'}. Best is trial 1025 with value: 0.41844370194907604.
[I 2024-12-04 15:45:37,828] Trial 2263 finished with value: 0.43990704420116344 and parameters: {'n_estimators': 873, 'max_depth': 28, 'min_samples_split': 2, 'min_samples_leaf': 1, 'max_features': None, 'bootstrap': True, 'criterion': 'absolute_error'}. Best is trial 1025 with value: 0.41844370194907604.
[I 2024-12-04 15:45:38,687] Trial 2261 finished with value: 0.43000518997369475 and parameters: {'n_estimators': 895, 'max_depth': 39, 'min_samples_split': 2, 'min_samples_leaf': 1, 'max_features': None, 'bootstrap': True, 'criterion': 'absolute_error'}. Best is trial 1025 with value: 0.41844370194907604.
[I 2024-12-04 15:45:42,044] Trial 2310 finished with value: 0.4215428609464536 and parameters: {'n_estimators': 756, 'max_depth': 32, 'min_samples_split': 2, 'min_samples_leaf': 1, 'max_features': None, 'bootstrap': True, 'criterion': 'squared_error'}. Best is trial 1025 with value: 0.41844370194907604.
[I 2024-12-04 15:45:45,169] Trial 2323 finished with value: 0.7763951868334967 and parameters: {'n_estimators': 611, 'max_depth': 25, 'min_samples_split': 8, 'min_samples_leaf': 3, 'max_features': 'sqrt', 'bootstrap': False, 'criterion': 'absolute_error'}. Best is trial 1025 with value: 0.41844370194907604.
[I 2024-12-04 15:45:46,067] Trial 2319 finished with value: 0.4218548206391726 and parameters: {'n_estimators': 721, 'max_depth': 44, 'min_samples_split': 2, 'min_samples_leaf': 1, 'max_features': None, 'bootstrap': True, 'criterion': 'squared_error'}. Best is trial 1025 with value: 0.41844370194907604.
[I 2024-12-04 15:45:46,528] Trial 2325 finished with value: 0.46591006371506577 and parameters: {'n_estimators': 640, 'max_depth': 23, 'min_samples_split': 3, 'min_samples_leaf': 2, 'max_features': None, 'bootstrap': True, 'criterion': 'squared_error'}. Best is trial 1025 with value: 0.41844370194907604.
[I 2024-12-04 15:45:47,245] Trial 2321 finished with value: 0.4644283005165883 and parameters: {'n_estimators': 716, 'max_depth': 33, 'min_samples_split': 2, 'min_samples_leaf': 2, 'max_features': None, 'bootstrap': True, 'criterion': 'squared_error'}. Best is trial 1025 with value: 0.41844370194907604.
[I 2024-12-04 15:45:47,458] Trial 2318 finished with value: 0.46565700441945534 and parameters: {'n_estimators': 788, 'max_depth': 40, 'min_samples_split': 2, 'min_samples_leaf': 2, 'max_features': None, 'bootstrap': True, 'criterion': 'squared_error'}. Best is trial 1025 with value: 0.41844370194907604.
[I 2024-12-04 15:45:47,476] Trial 2320 finished with value: 0.42109830550521943 and parameters: {'n_estimators': 752, 'max_depth': 34, 'min_samples_split': 2, 'min_samples_leaf': 1, 'max_features': None, 'bootstrap': True, 'criterion': 'squared_error'}. Best is trial 1025 with value: 0.41844370194907604.
[I 2024-12-04 15:45:47,516] Trial 2317 finished with value: 0.4654276290595643 and parameters: {'n_estimators': 820, 'max_depth': 42, 'min_samples_split': 2, 'min_samples_leaf': 2, 'max_features': None, 'bootstrap': True, 'criterion': 'squared_error'}. Best is trial 1025 with value: 0.41844370194907604.
[I 2024-12-04 15:45:47,793] Trial 2316 finished with value: 0.42260657574725435 and parameters: {'n_estimators': 670, 'max_depth': 32, 'min_samples_split': 2, 'min_samples_leaf': 1, 'max_features': None, 'bootstrap': True, 'criterion': 'squared_error'}. Best is trial 1025 with value: 0.41844370194907604.
[I 2024-12-04 15:45:47,914] Trial 2322 finished with value: 0.43330558477893416 and parameters: {'n_estimators': 567, 'max_depth': 38, 'min_samples_split': 4, 'min_samples_leaf': 1, 'max_features': None, 'bootstrap': True, 'criterion': 'squared_error'}. Best is trial 1025 with value: 0.41844370194907604.
[I 2024-12-04 15:45:48,453] Trial 2326 finished with value: 0.46542748983895543 and parameters: {'n_estimators': 783, 'max_depth': 49, 'min_samples_split': 2, 'min_samples_leaf': 2, 'max_features': None, 'bootstrap': True, 'criterion': 'squared_error'}. Best is trial 1025 with value: 0.41844370194907604.
[I 2024-12-04 15:45:49,817] Trial 2327 finished with value: 0.4194256698804379 and parameters: {'n_estimators': 622, 'max_depth': 41, 'min_samples_split': 2, 'min_samples_leaf': 1, 'max_features': None, 'bootstrap': True, 'criterion': 'squared_error'}. Best is trial 1025 with value: 0.41844370194907604.
[I 2024-12-04 15:45:49,830] Trial 2328 finished with value: 0.42552117258409156 and parameters: {'n_estimators': 656, 'max_depth': 42, 'min_samples_split': 3, 'min_samples_leaf': 1, 'max_features': None, 'bootstrap': True, 'criterion': 'squared_error'}. Best is trial 1025 with value: 0.41844370194907604.
[I 2024-12-04 15:45:50,645] Trial 2332 finished with value: 0.7140620436343992 and parameters: {'n_estimators': 820, 'max_depth': 28, 'min_samples_split': 2, 'min_samples_leaf': 1, 'max_features': 'log2', 'bootstrap': False, 'criterion': 'squared_error'}. Best is trial 1025 with value: 0.41844370194907604.
[I 2024-12-04 15:45:51,503] Trial 2330 finished with value: 0.42194697558684385 and parameters: {'n_estimators': 627, 'max_depth': 34, 'min_samples_split': 2, 'min_samples_leaf': 1, 'max_features': None, 'bootstrap': True, 'criterion': 'squared_error'}. Best is trial 1025 with value: 0.41844370194907604.
[I 2024-12-04 15:45:55,979] Trial 2331 finished with value: 0.4225773924481449 and parameters: {'n_estimators': 686, 'max_depth': 35, 'min_samples_split': 2, 'min_samples_leaf': 1, 'max_features': None, 'bootstrap': True, 'criterion': 'squared_error'}. Best is trial 1025 with value: 0.41844370194907604.
[I 2024-12-04 15:45:56,655] Trial 2341 finished with value: 0.9745836157609451 and parameters: {'n_estimators': 148, 'max_depth': 5, 'min_samples_split': 20, 'min_samples_leaf': 7, 'max_features': 'sqrt', 'bootstrap': False, 'criterion': 'absolute_error'}. Best is trial 1025 with value: 0.41844370194907604.
[I 2024-12-04 15:45:57,322] Trial 2324 finished with value: 0.4221142804812399 and parameters: {'n_estimators': 666, 'max_depth': 42, 'min_samples_split': 2, 'min_samples_leaf': 1, 'max_features': None, 'bootstrap': True, 'criterion': 'squared_error'}. Best is trial 1025 with value: 0.41844370194907604.
[I 2024-12-04 15:46:05,584] Trial 2329 finished with value: 0.4222977643473158 and parameters: {'n_estimators': 730, 'max_depth': 49, 'min_samples_split': 2, 'min_samples_leaf': 1, 'max_features': None, 'bootstrap': True, 'criterion': 'squared_error'}. Best is trial 1025 with value: 0.41844370194907604.
[I 2024-12-04 15:46:07,395] Trial 2338 finished with value: 0.5278912792550717 and parameters: {'n_estimators': 715, 'max_depth': 39, 'min_samples_split': 2, 'min_samples_leaf': 1, 'max_features': None, 'bootstrap': False, 'criterion': 'squared_error'}. Best is trial 1025 with value: 0.41844370194907604.
[I 2024-12-04 15:46:08,635] Trial 2333 finished with value: 0.43196166281072496 and parameters: {'n_estimators': 748, 'max_depth': 36, 'min_samples_split': 4, 'min_samples_leaf': 1, 'max_features': None, 'bootstrap': True, 'criterion': 'squared_error'}. Best is trial 1025 with value: 0.41844370194907604.
[I 2024-12-04 15:46:09,365] Trial 2354 finished with value: 0.751540532163671 and parameters: {'n_estimators': 370, 'max_depth': 22, 'min_samples_split': 43, 'min_samples_leaf': 3, 'max_features': 'sqrt', 'bootstrap': False, 'criterion': 'squared_error'}. Best is trial 1025 with value: 0.41844370194907604.
[I 2024-12-04 15:46:09,420] Trial 2339 finished with value: 0.46647808779048 and parameters: {'n_estimators': 537, 'max_depth': 35, 'min_samples_split': 2, 'min_samples_leaf': 2, 'max_features': None, 'bootstrap': True, 'criterion': 'squared_error'}. Best is trial 1025 with value: 0.41844370194907604.
[I 2024-12-04 15:46:10,410] Trial 2336 finished with value: 0.4198257167401135 and parameters: {'n_estimators': 730, 'max_depth': 39, 'min_samples_split': 2, 'min_samples_leaf': 1, 'max_features': None, 'bootstrap': True, 'criterion': 'squared_error'}. Best is trial 1025 with value: 0.41844370194907604.
[I 2024-12-04 15:46:11,545] Trial 2283 finished with value: 0.5821571118248656 and parameters: {'n_estimators': 673, 'max_depth': 23, 'min_samples_split': 14, 'min_samples_leaf': 1, 'max_features': None, 'bootstrap': False, 'criterion': 'absolute_error'}. Best is trial 1025 with value: 0.41844370194907604.
[I 2024-12-04 15:46:13,996] Trial 2340 finished with value: 0.4312772215577337 and parameters: {'n_estimators': 715, 'max_depth': 35, 'min_samples_split': 4, 'min_samples_leaf': 1, 'max_features': None, 'bootstrap': True, 'criterion': 'squared_error'}. Best is trial 1025 with value: 0.41844370194907604.
[I 2024-12-04 15:46:14,253] Trial 2334 finished with value: 0.4203384058584445 and parameters: {'n_estimators': 712, 'max_depth': 38, 'min_samples_split': 2, 'min_samples_leaf': 1, 'max_features': None, 'bootstrap': True, 'criterion': 'squared_error'}. Best is trial 1025 with value: 0.41844370194907604.
[I 2024-12-04 15:46:16,771] Trial 2346 finished with value: 0.4653089363304641 and parameters: {'n_estimators': 575, 'max_depth': 48, 'min_samples_split': 4, 'min_samples_leaf': 2, 'max_features': None, 'bootstrap': True, 'criterion': 'squared_error'}. Best is trial 1025 with value: 0.41844370194907604.
[I 2024-12-04 15:46:18,643] Trial 2342 finished with value: 0.686501298994083 and parameters: {'n_estimators': 397, 'max_depth': 22, 'min_samples_split': 6, 'min_samples_leaf': 5, 'max_features': None, 'bootstrap': False, 'criterion': 'absolute_error'}. Best is trial 1025 with value: 0.41844370194907604.
[I 2024-12-04 15:46:19,665] Trial 2337 finished with value: 0.4205390281771333 and parameters: {'n_estimators': 737, 'max_depth': 43, 'min_samples_split': 2, 'min_samples_leaf': 1, 'max_features': None, 'bootstrap': True, 'criterion': 'squared_error'}. Best is trial 1025 with value: 0.41844370194907604.
[I 2024-12-04 15:46:23,284] Trial 2343 finished with value: 0.4648455434485095 and parameters: {'n_estimators': 640, 'max_depth': 47, 'min_samples_split': 4, 'min_samples_leaf': 2, 'max_features': None, 'bootstrap': True, 'criterion': 'squared_error'}. Best is trial 1025 with value: 0.41844370194907604.
[I 2024-12-04 15:46:25,702] Trial 2348 finished with value: 0.6280645716445169 and parameters: {'n_estimators': 747, 'max_depth': 40, 'min_samples_split': 2, 'min_samples_leaf': 1, 'max_features': 'log2', 'bootstrap': True, 'criterion': 'squared_error'}. Best is trial 1025 with value: 0.41844370194907604.
[I 2024-12-04 15:46:26,978] Trial 2352 finished with value: 0.42388602213938936 and parameters: {'n_estimators': 703, 'max_depth': 39, 'min_samples_split': 3, 'min_samples_leaf': 1, 'max_features': None, 'bootstrap': True, 'criterion': 'squared_error'}. Best is trial 1025 with value: 0.41844370194907604.
[I 2024-12-04 15:46:28,439] Trial 2345 finished with value: 0.46435122071386803 and parameters: {'n_estimators': 715, 'max_depth': 39, 'min_samples_split': 3, 'min_samples_leaf': 2, 'max_features': None, 'bootstrap': True, 'criterion': 'squared_error'}. Best is trial 1025 with value: 0.41844370194907604.
[I 2024-12-04 15:46:31,530] Trial 2349 finished with value: 0.4315683423329873 and parameters: {'n_estimators': 708, 'max_depth': 43, 'min_samples_split': 4, 'min_samples_leaf': 1, 'max_features': None, 'bootstrap': True, 'criterion': 'squared_error'}. Best is trial 1025 with value: 0.41844370194907604.
[I 2024-12-04 15:46:33,874] Trial 2353 finished with value: 0.5131842785859895 and parameters: {'n_estimators': 672, 'max_depth': 40, 'min_samples_split': 2, 'min_samples_leaf': 1, 'max_features': 'sqrt', 'bootstrap': True, 'criterion': 'squared_error'}. Best is trial 1025 with value: 0.41844370194907604.
[I 2024-12-04 15:46:34,455] Trial 2364 finished with value: 0.5795399622541569 and parameters: {'n_estimators': 112, 'max_depth': 38, 'min_samples_split': 6, 'min_samples_leaf': 1, 'max_features': 'sqrt', 'bootstrap': True, 'criterion': 'absolute_error'}. Best is trial 1025 with value: 0.41844370194907604.
[I 2024-12-04 15:46:34,773] Trial 2355 finished with value: 0.4649385367571575 and parameters: {'n_estimators': 678, 'max_depth': 45, 'min_samples_split': 2, 'min_samples_leaf': 2, 'max_features': None, 'bootstrap': True, 'criterion': 'squared_error'}. Best is trial 1025 with value: 0.41844370194907604.
[I 2024-12-04 15:46:35,927] Trial 2351 finished with value: 0.4212206805112509 and parameters: {'n_estimators': 677, 'max_depth': 38, 'min_samples_split': 2, 'min_samples_leaf': 1, 'max_features': None, 'bootstrap': True, 'criterion': 'squared_error'}. Best is trial 1025 with value: 0.41844370194907604.
[I 2024-12-04 15:46:35,980] Trial 2347 finished with value: 0.5907535410023589 and parameters: {'n_estimators': 962, 'max_depth': 14, 'min_samples_split': 18, 'min_samples_leaf': 1, 'max_features': None, 'bootstrap': False, 'criterion': 'squared_error'}. Best is trial 1025 with value: 0.41844370194907604.
[I 2024-12-04 15:46:36,838] Trial 2369 finished with value: 0.910208693054429 and parameters: {'n_estimators': 434, 'max_depth': 35, 'min_samples_split': 3, 'min_samples_leaf': 7, 'max_features': 'sqrt', 'bootstrap': False, 'criterion': 'squared_error'}. Best is trial 1025 with value: 0.41844370194907604.
[I 2024-12-04 15:46:37,177] Trial 2358 finished with value: 0.42209101458683074 and parameters: {'n_estimators': 731, 'max_depth': 46, 'min_samples_split': 2, 'min_samples_leaf': 1, 'max_features': None, 'bootstrap': True, 'criterion': 'squared_error'}. Best is trial 1025 with value: 0.41844370194907604.
[I 2024-12-04 15:46:38,283] Trial 2344 finished with value: 0.4207426991317398 and parameters: {'n_estimators': 737, 'max_depth': 37, 'min_samples_split': 2, 'min_samples_leaf': 1, 'max_features': None, 'bootstrap': True, 'criterion': 'squared_error'}. Best is trial 1025 with value: 0.41844370194907604.
[I 2024-12-04 15:46:38,358] Trial 2356 finished with value: 0.42185213510833597 and parameters: {'n_estimators': 717, 'max_depth': 46, 'min_samples_split': 2, 'min_samples_leaf': 1, 'max_features': None, 'bootstrap': True, 'criterion': 'squared_error'}. Best is trial 1025 with value: 0.41844370194907604.
