[I 2024-12-04 20:15:16,019] Trial 1080 finished with value: 0.3592112297426588 and parameters: {'kernel_type': 'Matern', 'length_scale': 34.41794353023958, 'noise_level': 0.9679033954343117, 'constant_value': 14.234937052751368, 'nu': 0.5}. Best is trial 881 with value: 0.35916990930150405.
[I 2024-12-04 20:15:16,170] Trial 1079 finished with value: 0.35921119705706134 and parameters: {'kernel_type': 'Matern', 'length_scale': 66373.17636283669, 'noise_level': 0.6567250871164846, 'constant_value': 18.454086519737807, 'nu': 0.5}. Best is trial 881 with value: 0.35916990930150405.
[I 2024-12-04 20:15:18,231] Trial 1081 finished with value: 0.3592111430827488 and parameters: {'kernel_type': 'Matern', 'length_scale': 17.762824276721794, 'noise_level': 0.04006606851128722, 'constant_value': 968.2544080998996, 'nu': 0.5}. Best is trial 881 with value: 0.35916990930150405.
[I 2024-12-04 20:15:20,999] Trial 1083 finished with value: 1.0624161174194844 and parameters: {'kernel_type': 'Matern', 'length_scale': 0.02855316868228184, 'noise_level': 0.00027452491531124526, 'constant_value': 13.44516022382293, 'nu': 0.5}. Best is trial 881 with value: 0.35916990930150405.
[I 2024-12-04 20:15:22,314] Trial 1084 finished with value: 0.4286834372085583 and parameters: {'kernel_type': 'RBF', 'length_scale': 0.6570632621965546, 'noise_level': 0.0026484463101357288, 'constant_value': 2.6518251142684255, 'nu': 0.5}. Best is trial 881 with value: 0.35916990930150405.
[I 2024-12-04 20:15:24,636] Trial 1082 finished with value: 1.0624161172708628 and parameters: {'kernel_type': 'RBF', 'length_scale': 43216.32555694726, 'noise_level': 0.001730800034630156, 'constant_value': 38926.139165313216, 'nu': 0.5}. Best is trial 881 with value: 0.35916990930150405.
[I 2024-12-04 20:15:26,284] Trial 1085 finished with value: 0.359211241928759 and parameters: {'kernel_type': 'Matern', 'length_scale': 855.278293339762, 'noise_level': 0.01817501570963647, 'constant_value': 24.81865249226834, 'nu': 0.5}. Best is trial 881 with value: 0.35916990930150405.
[I 2024-12-04 20:15:27,522] Trial 1086 finished with value: 0.35921123595389326 and parameters: {'kernel_type': 'Matern', 'length_scale': 5.45588272740831, 'noise_level': 0.07266371451123763, 'constant_value': 3130.790837342149, 'nu': 0.5}. Best is trial 881 with value: 0.35916990930150405.
[I 2024-12-04 20:15:31,123] Trial 1088 finished with value: 0.3592113683221392 and parameters: {'kernel_type': 'Matern', 'length_scale': 37.053785558612006, 'noise_level': 0.00026510388248296934, 'constant_value': 18.34726726975541, 'nu': 0.5}. Best is trial 881 with value: 0.35916990930150405.
[I 2024-12-04 20:15:32,122] Trial 1089 finished with value: 0.3592113221931185 and parameters: {'kernel_type': 'Matern', 'length_scale': 33.80196560781621, 'noise_level': 0.051327049477503064, 'constant_value': 5.488596859021754, 'nu': 0.5}. Best is trial 881 with value: 0.35916990930150405.
[I 2024-12-04 20:15:32,413] Trial 1087 finished with value: 1.0624161172747757 and parameters: {'kernel_type': 'Matern', 'length_scale': 17.03013315578103, 'noise_level': 0.012166895024628336, 'constant_value': 1.6701142788445672e-07, 'nu': 1.5}. Best is trial 881 with value: 0.35916990930150405.
[I 2024-12-04 20:15:36,515] Trial 1090 finished with value: 0.3592112106658578 and parameters: {'kernel_type': 'Matern', 'length_scale': 1.734603637457159, 'noise_level': 0.07236348961691669, 'constant_value': 481.16008431533976, 'nu': 0.5}. Best is trial 881 with value: 0.35916990930150405.
[I 2024-12-04 20:15:36,577] Trial 1091 finished with value: 0.3592112181170656 and parameters: {'kernel_type': 'Matern', 'length_scale': 3.9218554071815013, 'noise_level': 0.0012375150253755795, 'constant_value': 186.44414290479418, 'nu': 0.5}. Best is trial 881 with value: 0.35916990930150405.
[I 2024-12-04 20:15:38,338] Trial 1092 finished with value: 0.4226900340596132 and parameters: {'kernel_type': 'Matern', 'length_scale': 201.2318687464255, 'noise_level': 0.9763388662445375, 'constant_value': 92.50785243460692, 'nu': 1.5}. Best is trial 881 with value: 0.35916990930150405.
[I 2024-12-04 20:15:40,302] Trial 1093 finished with value: 1.0624161172686957 and parameters: {'kernel_type': 'RBF', 'length_scale': 0.00011273295377190364, 'noise_level': 2.2214894098069366e-05, 'constant_value': 0.0009209435037351666, 'nu': 2.5}. Best is trial 881 with value: 0.35916990930150405.
[I 2024-12-04 20:15:41,773] Trial 1094 finished with value: 0.35921123672956523 and parameters: {'kernel_type': 'Matern', 'length_scale': 213.88537634802995, 'noise_level': 0.6794714742563229, 'constant_value': 114.81064338290986, 'nu': 0.5}. Best is trial 881 with value: 0.35916990930150405.
[I 2024-12-04 20:15:43,289] Trial 1095 finished with value: 0.35921245656625655 and parameters: {'kernel_type': 'Matern', 'length_scale': 101.1319905950641, 'noise_level': 0.8004698280006148, 'constant_value': 0.8275451997104826, 'nu': 0.5}. Best is trial 881 with value: 0.35916990930150405.
[I 2024-12-04 20:15:45,478] Trial 1096 finished with value: 0.3592113290322285 and parameters: {'kernel_type': 'Matern', 'length_scale': 0.40193974891099676, 'noise_level': 0.02042188330123786, 'constant_value': 5286.398594227421, 'nu': 0.5}. Best is trial 881 with value: 0.35916990930150405.
[I 2024-12-04 20:15:47,424] Trial 1098 finished with value: 1.0624161168490676 and parameters: {'kernel_type': 'Matern', 'length_scale': 0.02684347111941083, 'noise_level': 0.00012623260197093975, 'constant_value': 0.823796304982297, 'nu': 0.5}. Best is trial 881 with value: 0.35916990930150405.
[I 2024-12-04 20:15:47,811] Trial 1097 finished with value: 0.35921124440913804 and parameters: {'kernel_type': 'Matern', 'length_scale': 17.225404859322953, 'noise_level': 0.12308499416976174, 'constant_value': 88550.44136745688, 'nu': 0.5}. Best is trial 881 with value: 0.35916990930150405.
[I 2024-12-04 20:15:50,523] Trial 1099 finished with value: 0.41956288336492387 and parameters: {'kernel_type': 'Matern', 'length_scale': 61.856709409154774, 'noise_level': 0.2886151756557587, 'constant_value': 30.99157393329058, 'nu': 2.5}. Best is trial 881 with value: 0.35916990930150405.
[I 2024-12-04 20:15:52,320] Trial 1100 finished with value: 0.3592113731331471 and parameters: {'kernel_type': 'Matern', 'length_scale': 2.3205162320663915, 'noise_level': 0.733358298769089, 'constant_value': 242.99444596824017, 'nu': 0.5}. Best is trial 881 with value: 0.35916990930150405.
[I 2024-12-04 20:15:53,034] Trial 1101 finished with value: 0.42868373885182326 and parameters: {'kernel_type': 'RBF', 'length_scale': 55.499197500671244, 'noise_level': 0.2097864048492971, 'constant_value': 13796.956061786374, 'nu': 0.5}. Best is trial 881 with value: 0.35916990930150405.
[I 2024-12-04 20:15:54,921] Trial 1102 finished with value: 1.0624161172703657 and parameters: {'kernel_type': 'Matern', 'length_scale': 25474.96017153176, 'noise_level': 0.0009708961210501623, 'constant_value': 6.711668383956602, 'nu': 0.5}. Best is trial 881 with value: 0.35916990930150405.
[I 2024-12-04 20:15:57,451] Trial 1103 finished with value: 0.35921125524350306 and parameters: {'kernel_type': 'Matern', 'length_scale': 603.2415086653373, 'noise_level': 0.014538472372937577, 'constant_value': 7.274639262840594, 'nu': 0.5}. Best is trial 881 with value: 0.35916990930150405.
[I 2024-12-04 20:15:57,548] Trial 1104 finished with value: 0.3592112610013936 and parameters: {'kernel_type': 'Matern', 'length_scale': 0.3208198061579778, 'noise_level': 0.004613779696811029, 'constant_value': 12.252299655663652, 'nu': 0.5}. Best is trial 881 with value: 0.35916990930150405.
[I 2024-12-04 20:15:59,715] Trial 1105 finished with value: 1.0916567285221177 and parameters: {'kernel_type': 'RBF', 'length_scale': 80493.76380858077, 'noise_level': 7.310986764618886e-05, 'constant_value': 1.9482228147520643e-07, 'nu': 0.5}. Best is trial 881 with value: 0.35916990930150405.
[I 2024-12-04 20:16:02,329] Trial 1107 finished with value: 0.35921124032589874 and parameters: {'kernel_type': 'Matern', 'length_scale': 29.741041525174506, 'noise_level': 0.011121901565670785, 'constant_value': 30.964658801128852, 'nu': 0.5}. Best is trial 881 with value: 0.35916990930150405.
[I 2024-12-04 20:16:02,394] Trial 1106 finished with value: 0.3592111488075586 and parameters: {'kernel_type': 'Matern', 'length_scale': 1.4907395693050416, 'noise_level': 0.0018661435766482372, 'constant_value': 93718.11853063911, 'nu': 0.5}. Best is trial 881 with value: 0.35916990930150405.
[I 2024-12-04 20:16:05,010] Trial 1108 finished with value: 0.359211225661003 and parameters: {'kernel_type': 'Matern', 'length_scale': 2473.4070909734637, 'noise_level': 0.9141647852852748, 'constant_value': 69.30784815252909, 'nu': 0.5}. Best is trial 881 with value: 0.35916990930150405.
[I 2024-12-04 20:16:08,700] Trial 1109 finished with value: 0.42268969858609207 and parameters: {'kernel_type': 'Matern', 'length_scale': 32.68031384207491, 'noise_level': 0.002161872351012292, 'constant_value': 1194.1201029574454, 'nu': 1.5}. Best is trial 881 with value: 0.35916990930150405.
[I 2024-12-04 20:16:10,694] Trial 1111 finished with value: 1.062416117355546 and parameters: {'kernel_type': 'Matern', 'length_scale': 5815.024664970014, 'noise_level': 0.009486777355222882, 'constant_value': 10.859612275712053, 'nu': 1.5}. Best is trial 881 with value: 0.35916990930150405.
[I 2024-12-04 20:16:11,528] Trial 1110 finished with value: 1.062416117056001 and parameters: {'kernel_type': 'RBF', 'length_scale': 0.04107036758157104, 'noise_level': 0.00039852915674261856, 'constant_value': 1.5967163003896495e-07, 'nu': 1.5}. Best is trial 881 with value: 0.35916990930150405.
[I 2024-12-04 20:16:14,876] Trial 1112 finished with value: 1.0624161172836926 and parameters: {'kernel_type': 'Matern', 'length_scale': 1668.5189231364907, 'noise_level': 0.0011084208181950984, 'constant_value': 0.017700233822648584, 'nu': 0.5}. Best is trial 881 with value: 0.35916990930150405.
[I 2024-12-04 20:16:16,386] Trial 1113 finished with value: 1.0624161178667861 and parameters: {'kernel_type': 'RBF', 'length_scale': 0.022865283952268386, 'noise_level': 2.5501291439858437e-08, 'constant_value': 1.0458437808380522e-05, 'nu': 2.5}. Best is trial 881 with value: 0.35916990930150405.
[I 2024-12-04 20:16:17,077] Trial 1114 finished with value: 1.0624161172723916 and parameters: {'kernel_type': 'Matern', 'length_scale': 3424.2947700144746, 'noise_level': 0.013779370163421982, 'constant_value': 2.867956387704945, 'nu': 0.5}. Best is trial 881 with value: 0.35916990930150405.
[I 2024-12-04 20:16:19,910] Trial 1115 finished with value: 0.35921126660660757 and parameters: {'kernel_type': 'Matern', 'length_scale': 132.98445385878085, 'noise_level': 0.036950492586157194, 'constant_value': 106.07821580003841, 'nu': 0.5}. Best is trial 881 with value: 0.35916990930150405.
[I 2024-12-04 20:16:21,384] Trial 1116 finished with value: 0.35921125922965724 and parameters: {'kernel_type': 'Matern', 'length_scale': 35.541770039093414, 'noise_level': 0.0006484546600013477, 'constant_value': 261.8585888853316, 'nu': 0.5}. Best is trial 881 with value: 0.35916990930150405.
[I 2024-12-04 20:16:22,718] Trial 1117 finished with value: 0.3592111840783702 and parameters: {'kernel_type': 'Matern', 'length_scale': 3.58688735108043, 'noise_level': 0.028740689267157865, 'constant_value': 144.83838449943048, 'nu': 0.5}. Best is trial 881 with value: 0.35916990930150405.
[I 2024-12-04 20:16:24,262] Trial 1118 finished with value: 0.35921123550952866 and parameters: {'kernel_type': 'Matern', 'length_scale': 0.547739495134229, 'noise_level': 0.0002089512466381679, 'constant_value': 1170.1695600319852, 'nu': 0.5}. Best is trial 881 with value: 0.35916990930150405.
[I 2024-12-04 20:16:28,848] Trial 1120 finished with value: 0.4226895821157772 and parameters: {'kernel_type': 'Matern', 'length_scale': 1.1001283257954608, 'noise_level': 0.008459257318536877, 'constant_value': 2.422201348118116, 'nu': 1.5}. Best is trial 881 with value: 0.35916990930150405.
[I 2024-12-04 20:16:29,542] Trial 1121 finished with value: 0.3592112403172034 and parameters: {'kernel_type': 'Matern', 'length_scale': 34.483264069861505, 'noise_level': 0.12644006765276755, 'constant_value': 2.0397784223325726, 'nu': 0.5}. Best is trial 881 with value: 0.35916990930150405.
[I 2024-12-04 20:16:33,212] Trial 1123 finished with value: 1.0916558493895503 and parameters: {'kernel_type': 'RBF', 'length_scale': 0.003715296323267246, 'noise_level': 1.4833430643476518e-05, 'constant_value': 5.315256516469955, 'nu': 2.5}. Best is trial 881 with value: 0.35916990930150405.
[I 2024-12-04 20:16:33,218] Trial 1119 finished with value: 1.0627918439257245 and parameters: {'kernel_type': 'Matern', 'length_scale': 1811.2948079038786, 'noise_level': 9.570822466890954e-06, 'constant_value': 3.694803578353447e-06, 'nu': 0.5}. Best is trial 881 with value: 0.35916990930150405.
[I 2024-12-04 20:16:34,353] Trial 1122 finished with value: 0.3592112432651727 and parameters: {'kernel_type': 'Matern', 'length_scale': 129.38972722980944, 'noise_level': 0.8484534817585728, 'constant_value': 1251.0312461206172, 'nu': 0.5}. Best is trial 881 with value: 0.35916990930150405.
[I 2024-12-04 20:16:37,748] Trial 1125 finished with value: 0.35921098609533253 and parameters: {'kernel_type': 'Matern', 'length_scale': 70.18795620572395, 'noise_level': 0.9080903878686902, 'constant_value': 5.873434285148803, 'nu': 0.5}. Best is trial 881 with value: 0.35916990930150405.
[I 2024-12-04 20:16:39,674] Trial 1126 finished with value: 0.3592110746887547 and parameters: {'kernel_type': 'Matern', 'length_scale': 0.7442463169688696, 'noise_level': 0.047939798196363216, 'constant_value': 151.813311089844, 'nu': 0.5}. Best is trial 881 with value: 0.35916990930150405.
[I 2024-12-04 20:16:42,254] Trial 1127 finished with value: 1.0624161172693465 and parameters: {'kernel_type': 'Matern', 'length_scale': 38.67776165114873, 'noise_level': 0.002063310525201808, 'constant_value': 0.1051333114134202, 'nu': 0.5}. Best is trial 881 with value: 0.35916990930150405.
[I 2024-12-04 20:16:45,507] Trial 1128 finished with value: 0.3592112368905185 and parameters: {'kernel_type': 'Matern', 'length_scale': 679.0536647316571, 'noise_level': 0.04605338572367815, 'constant_value': 0.2091186504717023, 'nu': 0.5}. Best is trial 881 with value: 0.35916990930150405.
[I 2024-12-04 20:16:46,909] Trial 1124 finished with value: 0.4226900034438635 and parameters: {'kernel_type': 'Matern', 'length_scale': 0.14738028666277256, 'noise_level': 0.00045843865730260663, 'constant_value': 5666.538642123412, 'nu': 1.5}. Best is trial 881 with value: 0.35916990930150405.
[I 2024-12-04 20:16:47,173] Trial 1129 finished with value: 0.3592107736718265 and parameters: {'kernel_type': 'Matern', 'length_scale': 5.777493104533842, 'noise_level': 0.022330247317855392, 'constant_value': 9958.816335752479, 'nu': 0.5}. Best is trial 881 with value: 0.35916990930150405.
[I 2024-12-04 20:16:53,098] Trial 1131 finished with value: 1.0624161172238384 and parameters: {'kernel_type': 'Matern', 'length_scale': 0.014752210793878206, 'noise_level': 0.0851882881203891, 'constant_value': 2803.2197390501224, 'nu': 0.5}. Best is trial 881 with value: 0.35916990930150405.
[I 2024-12-04 20:16:54,222] Trial 1130 finished with value: 0.3592112511141232 and parameters: {'kernel_type': 'Matern', 'length_scale': 1.8147725552327034, 'noise_level': 0.8169290177282861, 'constant_value': 11644.414499304165, 'nu': 0.5}. Best is trial 881 with value: 0.35916990930150405.
[I 2024-12-04 20:16:57,899] Trial 1132 finished with value: 1.06241611774682 and parameters: {'kernel_type': 'RBF', 'length_scale': 71459.99129064684, 'noise_level': 2.3761719422050585e-10, 'constant_value': 27055.54196416173, 'nu': 1.5}. Best is trial 881 with value: 0.35916990930150405.
[I 2024-12-04 20:16:59,299] Trial 1134 finished with value: 0.3592112622298299 and parameters: {'kernel_type': 'Matern', 'length_scale': 1.0278204743790036, 'noise_level': 0.667203066240779, 'constant_value': 12.728660977830367, 'nu': 0.5}. Best is trial 881 with value: 0.35916990930150405.
[I 2024-12-04 20:17:04,529] Trial 1135 finished with value: 0.3592112393767713 and parameters: {'kernel_type': 'Matern', 'length_scale': 1184.36373622865, 'noise_level': 0.007472749304453164, 'constant_value': 20.689794768522532, 'nu': 0.5}. Best is trial 881 with value: 0.35916990930150405.
[I 2024-12-04 20:17:05,310] Trial 1136 finished with value: 0.3592111677788607 and parameters: {'kernel_type': 'Matern', 'length_scale': 1.4781707309592782, 'noise_level': 0.00020931931331624626, 'constant_value': 43.53970673127908, 'nu': 0.5}. Best is trial 881 with value: 0.35916990930150405.
[I 2024-12-04 20:17:07,793] Trial 1133 finished with value: 0.42868351426844864 and parameters: {'kernel_type': 'RBF', 'length_scale': 7554.643753528227, 'noise_level': 0.4469307175012995, 'constant_value': 2.5172272773304387, 'nu': 0.5}. Best is trial 881 with value: 0.35916990930150405.
[I 2024-12-04 20:17:09,496] Trial 1138 finished with value: 0.3592112894916254 and parameters: {'kernel_type': 'Matern', 'length_scale': 13.544751243749843, 'noise_level': 0.7858851264409672, 'constant_value': 0.7198342398929665, 'nu': 0.5}. Best is trial 881 with value: 0.35916990930150405.
[I 2024-12-04 20:17:12,047] Trial 1137 finished with value: 1.0624161175409967 and parameters: {'kernel_type': 'RBF', 'length_scale': 137.0356052070016, 'noise_level': 5.975868240651479e-08, 'constant_value': 0.002985696366216329, 'nu': 0.5}. Best is trial 881 with value: 0.35916990930150405.
[I 2024-12-04 20:17:13,502] Trial 1139 finished with value: 0.42268978230373194 and parameters: {'kernel_type': 'Matern', 'length_scale': 151.24329511323927, 'noise_level': 0.4814318934722236, 'constant_value': 0.07557747036431778, 'nu': 1.5}. Best is trial 881 with value: 0.35916990930150405.
[I 2024-12-04 20:17:14,794] Trial 1140 finished with value: 1.0624161172166975 and parameters: {'kernel_type': 'RBF', 'length_scale': 0.050658089370017235, 'noise_level': 5.791818903090241e-10, 'constant_value': 5.283136756683195e-05, 'nu': 0.5}. Best is trial 881 with value: 0.35916990930150405.
[I 2024-12-04 20:17:17,332] Trial 1141 finished with value: 0.3592111349161972 and parameters: {'kernel_type': 'Matern', 'length_scale': 140.90800953412918, 'noise_level': 0.023939965325504096, 'constant_value': 61.28839701580732, 'nu': 0.5}. Best is trial 881 with value: 0.35916990930150405.
[I 2024-12-04 20:17:19,145] Trial 1142 finished with value: 0.35921114605087956 and parameters: {'kernel_type': 'Matern', 'length_scale': 3.5592395139264363, 'noise_level': 0.014963843122031044, 'constant_value': 81.9956127552676, 'nu': 0.5}. Best is trial 881 with value: 0.35916990930150405.
[I 2024-12-04 20:17:20,765] Trial 1144 finished with value: 1.0916567266206223 and parameters: {'kernel_type': 'Matern', 'length_scale': 0.6472322723953277, 'noise_level': 4.2663380432062886e-10, 'constant_value': 47720.25829610155, 'nu': 2.5}. Best is trial 881 with value: 0.35916990930150405.
[I 2024-12-04 20:17:21,070] Trial 1143 finished with value: 0.35921145363948853 and parameters: {'kernel_type': 'Matern', 'length_scale': 6730.819251293973, 'noise_level': 0.04959587421702423, 'constant_value': 3.340190509572554, 'nu': 0.5}. Best is trial 881 with value: 0.35916990930150405.
[I 2024-12-04 20:17:24,298] Trial 1145 finished with value: 0.35921121234748454 and parameters: {'kernel_type': 'Matern', 'length_scale': 2174.694348421176, 'noise_level': 0.8911513694585358, 'constant_value': 2.436167336854838, 'nu': 0.5}. Best is trial 881 with value: 0.35916990930150405.
[I 2024-12-04 20:17:25,807] Trial 1146 finished with value: 0.35921347192213293 and parameters: {'kernel_type': 'Matern', 'length_scale': 22.226535185491976, 'noise_level': 0.001296908571312462, 'constant_value': 0.6414877801853264, 'nu': 0.5}. Best is trial 881 with value: 0.35916990930150405.
[I 2024-12-04 20:17:26,781] Trial 1147 finished with value: 0.4286835157608414 and parameters: {'kernel_type': 'RBF', 'length_scale': 0.43275828742123357, 'noise_level': 0.388595479151636, 'constant_value': 7819.278253770351, 'nu': 0.5}. Best is trial 881 with value: 0.35916990930150405.
[I 2024-12-04 20:17:30,818] Trial 1148 finished with value: 0.3592112359827947 and parameters: {'kernel_type': 'Matern', 'length_scale': 53.15377376930087, 'noise_level': 0.24044611331942017, 'constant_value': 97838.94692565966, 'nu': 0.5}. Best is trial 881 with value: 0.35916990930150405.
[I 2024-12-04 20:17:32,242] Trial 1149 finished with value: 0.359210299892212 and parameters: {'kernel_type': 'Matern', 'length_scale': 30.572186268010313, 'noise_level': 0.030963019631178222, 'constant_value': 31.778107890672818, 'nu': 0.5}. Best is trial 881 with value: 0.35916990930150405.
[I 2024-12-04 20:17:32,829] Trial 1150 finished with value: 0.3592106369478613 and parameters: {'kernel_type': 'Matern', 'length_scale': 1.1852480559569665, 'noise_level': 0.012128821550489978, 'constant_value': 10786.461652522205, 'nu': 0.5}. Best is trial 881 with value: 0.35916990930150405.
[I 2024-12-04 20:17:34,991] Trial 1152 finished with value: 1.0916567048549848 and parameters: {'kernel_type': 'Matern', 'length_scale': 32.97804441202053, 'noise_level': 0.006882187138804751, 'constant_value': 297.7131497154619, 'nu': 0.5}. Best is trial 881 with value: 0.35916990930150405.
[I 2024-12-04 20:17:35,151] Trial 1151 finished with value: 0.35921117596983315 and parameters: {'kernel_type': 'Matern', 'length_scale': 54.9037227596767, 'noise_level': 0.02103469993771089, 'constant_value': 2.875408749237041, 'nu': 0.5}. Best is trial 881 with value: 0.35916990930150405.
