[I 2024-12-04 20:20:04,093] Trial 1227 finished with value: 0.359211235490057 and parameters: {'kernel_type': 'Matern', 'length_scale': 6025.243067736281, 'noise_level': 0.04377768114904381, 'constant_value': 50337.54086214296, 'nu': 0.5}. Best is trial 881 with value: 0.35916990930150405.
[I 2024-12-04 20:20:04,746] Trial 1228 finished with value: 0.35921121563735176 and parameters: {'kernel_type': 'Matern', 'length_scale': 591.2095077006293, 'noise_level': 0.010641086265826523, 'constant_value': 37657.4696679826, 'nu': 0.5}. Best is trial 881 with value: 0.35916990930150405.
[I 2024-12-04 20:20:05,817] Trial 1229 finished with value: 0.35921133956676055 and parameters: {'kernel_type': 'Matern', 'length_scale': 3.670157888606134, 'noise_level': 0.06910087877062727, 'constant_value': 47883.96671319495, 'nu': 0.5}. Best is trial 881 with value: 0.35916990930150405.
[I 2024-12-04 20:20:07,510] Trial 1230 finished with value: 1.0916558493875084 and parameters: {'kernel_type': 'Matern', 'length_scale': 0.00010793725454549336, 'noise_level': 9.12767812886197e-10, 'constant_value': 925.8525070769772, 'nu': 0.5}. Best is trial 881 with value: 0.35916990930150405.
[I 2024-12-04 20:20:11,194] Trial 1232 finished with value: 0.3592117789286111 and parameters: {'kernel_type': 'Matern', 'length_scale': 57.614598440719874, 'noise_level': 0.0016264438473935403, 'constant_value': 192.3016199558308, 'nu': 0.5}. Best is trial 881 with value: 0.35916990930150405.
[I 2024-12-04 20:20:11,284] Trial 1231 finished with value: 0.35921115365580225 and parameters: {'kernel_type': 'Matern', 'length_scale': 35.6513997244525, 'noise_level': 0.011773855816061846, 'constant_value': 37107.5938467134, 'nu': 0.5}. Best is trial 881 with value: 0.35916990930150405.
[I 2024-12-04 20:20:14,798] Trial 1233 finished with value: 0.3592109475795626 and parameters: {'kernel_type': 'Matern', 'length_scale': 26.3595503965794, 'noise_level': 0.011073674179565108, 'constant_value': 401.65713947052416, 'nu': 0.5}. Best is trial 881 with value: 0.35916990930150405.
[I 2024-12-04 20:20:18,885] Trial 1235 finished with value: 1.0624161170473299 and parameters: {'kernel_type': 'Matern', 'length_scale': 0.005087901630421005, 'noise_level': 3.174057746976211e-09, 'constant_value': 0.04975530329649015, 'nu': 0.5}. Best is trial 881 with value: 0.35916990930150405.
[I 2024-12-04 20:20:20,559] Trial 1234 finished with value: 0.3592112431149628 and parameters: {'kernel_type': 'Matern', 'length_scale': 161.0428718141009, 'noise_level': 0.012529724058835382, 'constant_value': 56829.04136251218, 'nu': 0.5}. Best is trial 881 with value: 0.35916990930150405.
[I 2024-12-04 20:20:22,320] Trial 1237 finished with value: 1.062416117974623 and parameters: {'kernel_type': 'RBF', 'length_scale': 0.061548534469504576, 'noise_level': 4.0346586622641484e-05, 'constant_value': 0.050347915966631594, 'nu': 0.5}. Best is trial 881 with value: 0.35916990930150405.
[I 2024-12-04 20:20:25,416] Trial 1236 finished with value: 1.062416117268514 and parameters: {'kernel_type': 'RBF', 'length_scale': 5000.960676894159, 'noise_level': 8.009770464204915e-06, 'constant_value': 0.00024651316278111787, 'nu': 1.5}. Best is trial 881 with value: 0.35916990930150405.
[I 2024-12-04 20:20:25,520] Trial 1238 finished with value: 0.359211232912836 and parameters: {'kernel_type': 'Matern', 'length_scale': 0.5226378252289373, 'noise_level': 6.737929250997114e-05, 'constant_value': 424.64956883311896, 'nu': 0.5}. Best is trial 881 with value: 0.35916990930150405.
[I 2024-12-04 20:20:27,151] Trial 1239 finished with value: 1.0624161172067863 and parameters: {'kernel_type': 'Matern', 'length_scale': 2.7938247614956007, 'noise_level': 1.475995611482082e-09, 'constant_value': 0.00045608635767481514, 'nu': 1.5}. Best is trial 881 with value: 0.35916990930150405.
[I 2024-12-04 20:20:30,818] Trial 1241 finished with value: 0.359211312769195 and parameters: {'kernel_type': 'Matern', 'length_scale': 0.3990285069804616, 'noise_level': 0.012857058603398861, 'constant_value': 1044.0123960764208, 'nu': 0.5}. Best is trial 881 with value: 0.35916990930150405.
[I 2024-12-04 20:20:31,508] Trial 1240 finished with value: 0.3592112279186094 and parameters: {'kernel_type': 'Matern', 'length_scale': 537.1845805745453, 'noise_level': 0.025991525700904308, 'constant_value': 61537.56554835311, 'nu': 0.5}. Best is trial 881 with value: 0.35916990930150405.
[I 2024-12-04 20:20:34,804] Trial 1242 finished with value: 1.0624161176708715 and parameters: {'kernel_type': 'Matern', 'length_scale': 300.7131648233792, 'noise_level': 1.1054212087724768e-06, 'constant_value': 72456.40706059564, 'nu': 1.5}. Best is trial 881 with value: 0.35916990930150405.
[I 2024-12-04 20:20:35,514] Trial 1243 finished with value: 0.35921117880318343 and parameters: {'kernel_type': 'Matern', 'length_scale': 8.177398191561544, 'noise_level': 0.0001705236969627881, 'constant_value': 778.5643927006217, 'nu': 0.5}. Best is trial 881 with value: 0.35916990930150405.
[I 2024-12-04 20:20:36,642] Trial 1244 finished with value: 0.35921081027002705 and parameters: {'kernel_type': 'Matern', 'length_scale': 3.8045113796722956, 'noise_level': 0.0014564524746500057, 'constant_value': 43603.475918432916, 'nu': 0.5}. Best is trial 881 with value: 0.35916990930150405.
[I 2024-12-04 20:20:40,773] Trial 1246 finished with value: 0.35921129232188626 and parameters: {'kernel_type': 'Matern', 'length_scale': 99.02690450429178, 'noise_level': 0.5716125646964864, 'constant_value': 1988.6756248341442, 'nu': 0.5}. Best is trial 881 with value: 0.35916990930150405.
[I 2024-12-04 20:20:42,338] Trial 1247 finished with value: 0.35921116624652694 and parameters: {'kernel_type': 'Matern', 'length_scale': 2.136926657955573, 'noise_level': 0.011728097040754391, 'constant_value': 40.42284646561758, 'nu': 0.5}. Best is trial 881 with value: 0.35916990930150405.
[I 2024-12-04 20:20:42,719] Trial 1245 finished with value: 1.0624161170676514 and parameters: {'kernel_type': 'RBF', 'length_scale': 96.87419457187752, 'noise_level': 1.3455863458757482e-06, 'constant_value': 0.000771549864699313, 'nu': 2.5}. Best is trial 881 with value: 0.35916990930150405.
[I 2024-12-04 20:20:46,210] Trial 1248 finished with value: 0.3592108063647018 and parameters: {'kernel_type': 'Matern', 'length_scale': 1.3507483951197012, 'noise_level': 0.04693807715973383, 'constant_value': 233.5430824975699, 'nu': 0.5}. Best is trial 881 with value: 0.35916990930150405.
[I 2024-12-04 20:20:46,812] Trial 1249 finished with value: 0.3592112697935601 and parameters: {'kernel_type': 'Matern', 'length_scale': 9.269218602509055, 'noise_level': 0.9517051933124576, 'constant_value': 6028.676593378265, 'nu': 0.5}. Best is trial 881 with value: 0.35916990930150405.
[I 2024-12-04 20:20:48,123] Trial 1250 finished with value: 0.35921124975135627 and parameters: {'kernel_type': 'Matern', 'length_scale': 14.094288631507059, 'noise_level': 0.0001800460527114806, 'constant_value': 50281.331418111076, 'nu': 0.5}. Best is trial 881 with value: 0.35916990930150405.
[I 2024-12-04 20:20:53,204] Trial 1253 finished with value: 0.35921085838627953 and parameters: {'kernel_type': 'Matern', 'length_scale': 17.54586333397655, 'noise_level': 0.00038496524711899505, 'constant_value': 40.836192096720936, 'nu': 0.5}. Best is trial 881 with value: 0.35916990930150405.
[I 2024-12-04 20:20:53,702] Trial 1252 finished with value: 0.3592112670311377 and parameters: {'kernel_type': 'Matern', 'length_scale': 15718.771648571896, 'noise_level': 0.009845416167685694, 'constant_value': 94340.62642086271, 'nu': 0.5}. Best is trial 881 with value: 0.35916990930150405.
[I 2024-12-04 20:20:55,525] Trial 1251 finished with value: 0.35921125228102835 and parameters: {'kernel_type': 'Matern', 'length_scale': 0.08460855395048175, 'noise_level': 0.0033039626536044667, 'constant_value': 56.396860416491435, 'nu': 0.5}. Best is trial 881 with value: 0.35916990930150405.
[I 2024-12-04 20:20:55,874] Trial 1254 finished with value: 1.0916567048549874 and parameters: {'kernel_type': 'Matern', 'length_scale': 12.58846359520822, 'noise_level': 0.007179243856822344, 'constant_value': 1378.3216581962126, 'nu': 0.5}. Best is trial 881 with value: 0.35916990930150405.
[I 2024-12-04 20:20:59,545] Trial 1255 finished with value: 0.3592112417079944 and parameters: {'kernel_type': 'Matern', 'length_scale': 4129.119781369522, 'noise_level': 0.00011560692064549188, 'constant_value': 26036.752202309475, 'nu': 0.5}. Best is trial 881 with value: 0.35916990930150405.
[I 2024-12-04 20:20:59,918] Trial 1256 finished with value: 0.35921109351824126 and parameters: {'kernel_type': 'Matern', 'length_scale': 12.688742088796289, 'noise_level': 0.02472913137133822, 'constant_value': 173.11885888611303, 'nu': 0.5}. Best is trial 881 with value: 0.35916990930150405.
[I 2024-12-04 20:21:02,160] Trial 1257 finished with value: 0.3592112661571886 and parameters: {'kernel_type': 'Matern', 'length_scale': 9.258147841895461, 'noise_level': 0.38006133354233596, 'constant_value': 92787.5785696256, 'nu': 0.5}. Best is trial 881 with value: 0.35916990930150405.
[I 2024-12-04 20:21:03,428] Trial 1258 finished with value: 1.062415781894062 and parameters: {'kernel_type': 'Matern', 'length_scale': 0.0695738106538785, 'noise_level': 0.08807336573314989, 'constant_value': 45.41017783208766, 'nu': 0.5}. Best is trial 881 with value: 0.35916990930150405.
[I 2024-12-04 20:21:06,294] Trial 1259 finished with value: 0.359211021215825 and parameters: {'kernel_type': 'Matern', 'length_scale': 216.38998887795105, 'noise_level': 0.4475736326482469, 'constant_value': 33925.70498518359, 'nu': 0.5}. Best is trial 881 with value: 0.35916990930150405.
[I 2024-12-04 20:21:07,202] Trial 1260 finished with value: 1.0624161172367288 and parameters: {'kernel_type': 'Matern', 'length_scale': 0.030505339044911085, 'noise_level': 0.0037276900610850395, 'constant_value': 9943.468636998128, 'nu': 0.5}. Best is trial 881 with value: 0.35916990930150405.
[I 2024-12-04 20:21:09,355] Trial 1261 finished with value: 0.3592110916485548 and parameters: {'kernel_type': 'Matern', 'length_scale': 2.2562756605373355, 'noise_level': 0.021127102752272902, 'constant_value': 113.7640198102044, 'nu': 0.5}. Best is trial 881 with value: 0.35916990930150405.
[I 2024-12-04 20:21:11,565] Trial 1262 finished with value: 0.3592119041317372 and parameters: {'kernel_type': 'Matern', 'length_scale': 125.51835735533474, 'noise_level': 0.0006455353339825582, 'constant_value': 41.48229106789989, 'nu': 0.5}. Best is trial 881 with value: 0.35916990930150405.
[I 2024-12-04 20:21:12,406] Trial 1263 finished with value: 0.35921123402479876 and parameters: {'kernel_type': 'Matern', 'length_scale': 18.184755535843017, 'noise_level': 0.004470279981769284, 'constant_value': 177.137667683668, 'nu': 0.5}. Best is trial 881 with value: 0.35916990930150405.
[I 2024-12-04 20:21:14,054] Trial 1264 finished with value: 0.3592112806498178 and parameters: {'kernel_type': 'Matern', 'length_scale': 10.903218457387684, 'noise_level': 0.03929986263988513, 'constant_value': 34.34843932472455, 'nu': 0.5}. Best is trial 881 with value: 0.35916990930150405.
[I 2024-12-04 20:21:18,158] Trial 1266 finished with value: 0.35921176740245603 and parameters: {'kernel_type': 'Matern', 'length_scale': 0.33148688118559444, 'noise_level': 0.04197238929935721, 'constant_value': 1791.076369472652, 'nu': 0.5}. Best is trial 881 with value: 0.35916990930150405.
[I 2024-12-04 20:21:20,099] Trial 1267 finished with value: 1.06241611725463 and parameters: {'kernel_type': 'Matern', 'length_scale': 82.84013656459821, 'noise_level': 0.0002903510216779609, 'constant_value': 15.564802709545038, 'nu': 1.5}. Best is trial 881 with value: 0.35916990930150405.
[I 2024-12-04 20:21:20,390] Trial 1265 finished with value: 0.35921122867813254 and parameters: {'kernel_type': 'Matern', 'length_scale': 0.07870252076763799, 'noise_level': 0.5104565601530622, 'constant_value': 4867.548158411743, 'nu': 0.5}. Best is trial 881 with value: 0.35916990930150405.
[I 2024-12-04 20:21:22,748] Trial 1268 finished with value: 0.3592107741367902 and parameters: {'kernel_type': 'Matern', 'length_scale': 0.22770467921598087, 'noise_level': 0.0004018636206903459, 'constant_value': 0.2410363728473431, 'nu': 0.5}. Best is trial 881 with value: 0.35916990930150405.
[I 2024-12-04 20:21:24,480] Trial 1270 finished with value: 1.0624161171326794 and parameters: {'kernel_type': 'Matern', 'length_scale': 0.0013677357302991871, 'noise_level': 0.00016403398720088127, 'constant_value': 544.344100705089, 'nu': 0.5}. Best is trial 881 with value: 0.35916990930150405.
[I 2024-12-04 20:21:25,311] Trial 1269 finished with value: 0.3592112383589774 and parameters: {'kernel_type': 'Matern', 'length_scale': 356.5532127916347, 'noise_level': 0.00020473315164201177, 'constant_value': 32.62394934000919, 'nu': 0.5}. Best is trial 881 with value: 0.35916990930150405.
[I 2024-12-04 20:21:28,692] Trial 1271 finished with value: 0.35921123629490276 and parameters: {'kernel_type': 'Matern', 'length_scale': 1.8715488576128143, 'noise_level': 0.020618411822651447, 'constant_value': 20966.069793652434, 'nu': 0.5}. Best is trial 881 with value: 0.35916990930150405.
[I 2024-12-04 20:21:31,534] Trial 1273 finished with value: 0.35921129064567947 and parameters: {'kernel_type': 'Matern', 'length_scale': 16.017366968577292, 'noise_level': 0.11328782707255765, 'constant_value': 244.41618506251763, 'nu': 0.5}. Best is trial 881 with value: 0.35916990930150405.
[I 2024-12-04 20:21:32,810] Trial 1272 finished with value: 0.4195659601583756 and parameters: {'kernel_type': 'Matern', 'length_scale': 1.4509773327093538, 'noise_level': 0.11221373666762835, 'constant_value': 17158.736921128326, 'nu': 2.5}. Best is trial 881 with value: 0.35916990930150405.
[I 2024-12-04 20:21:33,813] Trial 1274 finished with value: 1.0624161173875404 and parameters: {'kernel_type': 'Matern', 'length_scale': 0.04405110685454599, 'noise_level': 0.224253125629342, 'constant_value': 31240.117203965314, 'nu': 1.5}. Best is trial 881 with value: 0.35916990930150405.
[I 2024-12-04 20:21:38,749] Trial 1276 finished with value: 0.35921119328882267 and parameters: {'kernel_type': 'Matern', 'length_scale': 0.29258390831456943, 'noise_level': 0.005366325439477987, 'constant_value': 17.725861225663987, 'nu': 0.5}. Best is trial 881 with value: 0.35916990930150405.
[I 2024-12-04 20:21:39,033] Trial 1275 finished with value: 1.0624161172663975 and parameters: {'kernel_type': 'Matern', 'length_scale': 17.799800062267288, 'noise_level': 3.0303154647821117e-07, 'constant_value': 1.0142482270884959e-05, 'nu': 1.5}. Best is trial 881 with value: 0.35916990930150405.
[I 2024-12-04 20:21:39,129] Trial 1277 finished with value: 0.35921123751793993 and parameters: {'kernel_type': 'Matern', 'length_scale': 31.91243241214145, 'noise_level': 0.002326662420063886, 'constant_value': 1758.6329201356348, 'nu': 0.5}. Best is trial 881 with value: 0.35916990930150405.
[I 2024-12-04 20:21:43,865] Trial 1278 finished with value: 0.35921182622017556 and parameters: {'kernel_type': 'Matern', 'length_scale': 2.4447874233653946, 'noise_level': 0.00043625456332283, 'constant_value': 5.363240651825414, 'nu': 0.5}. Best is trial 881 with value: 0.35916990930150405.
[I 2024-12-04 20:21:45,329] Trial 1279 finished with value: 0.35921123611420663 and parameters: {'kernel_type': 'Matern', 'length_scale': 18.039651773421085, 'noise_level': 0.01097789940643261, 'constant_value': 86410.26139132281, 'nu': 0.5}. Best is trial 881 with value: 0.35916990930150405.
[I 2024-12-04 20:21:45,701] Trial 1280 finished with value: 0.35921123329269317 and parameters: {'kernel_type': 'Matern', 'length_scale': 0.16632057050132287, 'noise_level': 0.5891868739455269, 'constant_value': 5.668285137153684, 'nu': 0.5}. Best is trial 881 with value: 0.35916990930150405.
[I 2024-12-04 20:21:49,985] Trial 1281 finished with value: 0.3592112107940717 and parameters: {'kernel_type': 'Matern', 'length_scale': 26.113284551882955, 'noise_level': 0.03413261676997585, 'constant_value': 122.98617212844115, 'nu': 0.5}. Best is trial 881 with value: 0.35916990930150405.
[I 2024-12-04 20:21:50,490] Trial 1283 finished with value: 0.35921128017385423 and parameters: {'kernel_type': 'Matern', 'length_scale': 0.46395998231349833, 'noise_level': 0.0015397798080900192, 'constant_value': 412.05643237052334, 'nu': 0.5}. Best is trial 881 with value: 0.35916990930150405.
[I 2024-12-04 20:21:50,566] Trial 1282 finished with value: 1.0624161174392146 and parameters: {'kernel_type': 'RBF', 'length_scale': 36.28628180897853, 'noise_level': 7.520644719443821e-10, 'constant_value': 9195.928725359345, 'nu': 0.5}. Best is trial 881 with value: 0.35916990930150405.
[I 2024-12-04 20:21:53,490] Trial 1284 finished with value: 1.062416117172467 and parameters: {'kernel_type': 'Matern', 'length_scale': 0.04428345169557004, 'noise_level': 0.9761890236760135, 'constant_value': 83.27181810349632, 'nu': 0.5}. Best is trial 881 with value: 0.35916990930150405.
[I 2024-12-04 20:21:55,496] Trial 1285 finished with value: 0.3592112792440758 and parameters: {'kernel_type': 'Matern', 'length_scale': 2.65199206625635, 'noise_level': 0.010376191332674069, 'constant_value': 87191.23259413881, 'nu': 0.5}. Best is trial 881 with value: 0.35916990930150405.
[I 2024-12-04 20:21:55,601] Trial 1286 finished with value: 0.35921104986440094 and parameters: {'kernel_type': 'Matern', 'length_scale': 3.0147695302755517, 'noise_level': 0.1439074493809512, 'constant_value': 1153.85140352834, 'nu': 0.5}. Best is trial 881 with value: 0.35916990930150405.
[I 2024-12-04 20:21:57,650] Trial 1287 finished with value: 1.0624161174282634 and parameters: {'kernel_type': 'Matern', 'length_scale': 780.8237368504289, 'noise_level': 0.0001009883983734132, 'constant_value': 0.3453216193063636, 'nu': 0.5}. Best is trial 881 with value: 0.35916990930150405.
[I 2024-12-04 20:22:00,627] Trial 1289 finished with value: 0.3592099415742951 and parameters: {'kernel_type': 'Matern', 'length_scale': 3.496813160103252, 'noise_level': 0.8431801560799291, 'constant_value': 713.55373385654, 'nu': 0.5}. Best is trial 881 with value: 0.35916990930150405.
[I 2024-12-04 20:22:02,468] Trial 1288 finished with value: 1.062416117264471 and parameters: {'kernel_type': 'Matern', 'length_scale': 5311.639169402813, 'noise_level': 0.00038403649740969517, 'constant_value': 48629.116404708104, 'nu': 1.5}. Best is trial 881 with value: 0.35916990930150405.
[I 2024-12-04 20:22:03,736] Trial 1290 finished with value: 0.3592112209217014 and parameters: {'kernel_type': 'Matern', 'length_scale': 529.2540790823626, 'noise_level': 0.0019838402566610533, 'constant_value': 198.7301327498614, 'nu': 0.5}. Best is trial 881 with value: 0.35916990930150405.
[I 2024-12-04 20:22:05,805] Trial 1291 finished with value: 0.359211639955713 and parameters: {'kernel_type': 'Matern', 'length_scale': 0.5340323858087705, 'noise_level': 0.5718916846376555, 'constant_value': 178.44899807816216, 'nu': 0.5}. Best is trial 881 with value: 0.35916990930150405.
[I 2024-12-04 20:22:07,567] Trial 1292 finished with value: 0.3592111571033392 and parameters: {'kernel_type': 'Matern', 'length_scale': 10.110551785875925, 'noise_level': 0.1412623840219856, 'constant_value': 37.0381005386198, 'nu': 0.5}. Best is trial 881 with value: 0.35916990930150405.
[I 2024-12-04 20:22:08,757] Trial 1293 finished with value: 0.35921123509715797 and parameters: {'kernel_type': 'Matern', 'length_scale': 146.65699464179107, 'noise_level': 0.06387900000456181, 'constant_value': 501.89874986780245, 'nu': 0.5}. Best is trial 881 with value: 0.35916990930150405.
[I 2024-12-04 20:22:10,184] Trial 1294 finished with value: 0.35922851492147806 and parameters: {'kernel_type': 'Matern', 'length_scale': 2.7871061642832755, 'noise_level': 0.7746897403177889, 'constant_value': 24737.29679817507, 'nu': 0.5}. Best is trial 881 with value: 0.35916990930150405.
[I 2024-12-04 20:22:11,091] Trial 1295 finished with value: 0.42868351538844757 and parameters: {'kernel_type': 'RBF', 'length_scale': 1.6712705280455817, 'noise_level': 0.14958428749060435, 'constant_value': 2.9402283442988937, 'nu': 0.5}. Best is trial 881 with value: 0.35916990930150405.
[I 2024-12-04 20:22:14,380] Trial 1296 finished with value: 0.35921096448527423 and parameters: {'kernel_type': 'Matern', 'length_scale': 3.400075664290254, 'noise_level': 0.9614124110018697, 'constant_value': 37.54811376555654, 'nu': 0.5}. Best is trial 881 with value: 0.35916990930150405.
[I 2024-12-04 20:22:15,480] Trial 1297 finished with value: 0.35921083883740207 and parameters: {'kernel_type': 'Matern', 'length_scale': 1.5525120740534655, 'noise_level': 0.6771417320066156, 'constant_value': 1624.2125754639399, 'nu': 0.5}. Best is trial 881 with value: 0.35916990930150405.
[I 2024-12-04 20:22:16,215] Trial 1298 finished with value: 0.3592112288500179 and parameters: {'kernel_type': 'Matern', 'length_scale': 15.501625212205411, 'noise_level': 0.6098943026950107, 'constant_value': 270.0025150247514, 'nu': 0.5}. Best is trial 881 with value: 0.35916990930150405.
[I 2024-12-04 20:22:20,507] Trial 1299 finished with value: 0.3592314457751315 and parameters: {'kernel_type': 'Matern', 'length_scale': 5.918042347996248, 'noise_level': 0.003354920649054173, 'constant_value': 1.47021970965467, 'nu': 0.5}. Best is trial 881 with value: 0.35916990930150405.
[I 2024-12-04 20:22:21,974] Trial 1301 finished with value: 1.0624161172884963 and parameters: {'kernel_type': 'Matern', 'length_scale': 0.04831742671368109, 'noise_level': 1.2545096086417583e-07, 'constant_value': 0.0016299662686133478, 'nu': 2.5}. Best is trial 881 with value: 0.35916990930150405.
