[I 2024-12-04 14:54:44,050] Trial 3 finished with value: 0.42268980113309695 and parameters: {'kernel_type': 'Matern', 'length_scale': 1.7089738946013646, 'noise_level': 0.013003362109165644, 'constant_value': 0.008540603134849075, 'nu': 1.5}. Best is trial 3 with value: 0.42268980113309695.
Traceback (most recent call last):
  File "/zhome/b1/0/88900/miniconda3/envs/critprops/lib/python3.9/site-packages/sqlalchemy/engine/base.py", line 1967, in _exec_single_context
    self.dialect.do_execute(
  File "/zhome/b1/0/88900/miniconda3/envs/critprops/lib/python3.9/site-packages/sqlalchemy/engine/default.py", line 941, in do_execute
    cursor.execute(statement, parameters)
sqlite3.OperationalError: database is locked

The above exception was the direct cause of the following exception:

Traceback (most recent call last):
  File "/zhome/b1/0/88900/miniconda3/envs/critprops/lib/python3.9/site-packages/optuna/storages/_rdb/storage.py", line 81, in _create_scoped_session
    session.commit()
  File "/zhome/b1/0/88900/miniconda3/envs/critprops/lib/python3.9/site-packages/sqlalchemy/orm/session.py", line 2028, in commit
    trans.commit(_to_root=True)
  File "<string>", line 2, in commit
  File "/zhome/b1/0/88900/miniconda3/envs/critprops/lib/python3.9/site-packages/sqlalchemy/orm/state_changes.py", line 139, in _go
    ret_value = fn(self, *arg, **kw)
  File "/zhome/b1/0/88900/miniconda3/envs/critprops/lib/python3.9/site-packages/sqlalchemy/orm/session.py", line 1313, in commit
    self._prepare_impl()
  File "<string>", line 2, in _prepare_impl
  File "/zhome/b1/0/88900/miniconda3/envs/critprops/lib/python3.9/site-packages/sqlalchemy/orm/state_changes.py", line 139, in _go
    ret_value = fn(self, *arg, **kw)
  File "/zhome/b1/0/88900/miniconda3/envs/critprops/lib/python3.9/site-packages/sqlalchemy/orm/session.py", line 1288, in _prepare_impl
    self.session.flush()
  File "/zhome/b1/0/88900/miniconda3/envs/critprops/lib/python3.9/site-packages/sqlalchemy/orm/session.py", line 4352, in flush
    self._flush(objects)
  File "/zhome/b1/0/88900/miniconda3/envs/critprops/lib/python3.9/site-packages/sqlalchemy/orm/session.py", line 4488, in _flush
    transaction.rollback(_capture_exception=True)
  File "/zhome/b1/0/88900/miniconda3/envs/critprops/lib/python3.9/site-packages/sqlalchemy/util/langhelpers.py", line 146, in __exit__
    raise exc_value.with_traceback(exc_tb)
  File "/zhome/b1/0/88900/miniconda3/envs/critprops/lib/python3.9/site-packages/sqlalchemy/orm/session.py", line 4448, in _flush
    flush_context.execute()
  File "/zhome/b1/0/88900/miniconda3/envs/critprops/lib/python3.9/site-packages/sqlalchemy/orm/unitofwork.py", line 466, in execute
    rec.execute(self)
  File "/zhome/b1/0/88900/miniconda3/envs/critprops/lib/python3.9/site-packages/sqlalchemy/orm/unitofwork.py", line 642, in execute
    util.preloaded.orm_persistence.save_obj(
  File "/zhome/b1/0/88900/miniconda3/envs/critprops/lib/python3.9/site-packages/sqlalchemy/orm/persistence.py", line 93, in save_obj
    _emit_insert_statements(
  File "/zhome/b1/0/88900/miniconda3/envs/critprops/lib/python3.9/site-packages/sqlalchemy/orm/persistence.py", line 1233, in _emit_insert_statements
    result = connection.execute(
  File "/zhome/b1/0/88900/miniconda3/envs/critprops/lib/python3.9/site-packages/sqlalchemy/engine/base.py", line 1418, in execute
    return meth(
  File "/zhome/b1/0/88900/miniconda3/envs/critprops/lib/python3.9/site-packages/sqlalchemy/sql/elements.py", line 515, in _execute_on_connection
    return connection._execute_clauseelement(
  File "/zhome/b1/0/88900/miniconda3/envs/critprops/lib/python3.9/site-packages/sqlalchemy/engine/base.py", line 1640, in _execute_clauseelement
    ret = self._execute_context(
  File "/zhome/b1/0/88900/miniconda3/envs/critprops/lib/python3.9/site-packages/sqlalchemy/engine/base.py", line 1846, in _execute_context
    return self._exec_single_context(
  File "/zhome/b1/0/88900/miniconda3/envs/critprops/lib/python3.9/site-packages/sqlalchemy/engine/base.py", line 1986, in _exec_single_context
    self._handle_dbapi_exception(
  File "/zhome/b1/0/88900/miniconda3/envs/critprops/lib/python3.9/site-packages/sqlalchemy/engine/base.py", line 2355, in _handle_dbapi_exception
    raise sqlalchemy_exception.with_traceback(exc_info[2]) from e
  File "/zhome/b1/0/88900/miniconda3/envs/critprops/lib/python3.9/site-packages/sqlalchemy/engine/base.py", line 1967, in _exec_single_context
    self.dialect.do_execute(
  File "/zhome/b1/0/88900/miniconda3/envs/critprops/lib/python3.9/site-packages/sqlalchemy/engine/default.py", line 941, in do_execute
    cursor.execute(statement, parameters)
sqlalchemy.exc.OperationalError: (sqlite3.OperationalError) database is locked
[SQL: INSERT INTO trial_params (trial_id, param_name, param_value, distribution_json) VALUES (?, ?, ?, ?)]
[parameters: (20, 'nu', 1.0, '{"name": "CategoricalDistribution", "attributes": {"choices": [0.5, 1.5, 2.5]}}')]
(Background on this error at: https://sqlalche.me/e/20/e3q8)

The above exception was the direct cause of the following exception:

Traceback (most recent call last):
  File "/zhome/b1/0/88900/Documents/fair_gc/gc_ml.py", line 79, in <module>
    study, best_model = create_hyperparameter_optimizer(
  File "/zhome/b1/0/88900/Documents/fair_gc/src/optims.py", line 275, in create_hyperparameter_optimizer
    study.optimize(objective, n_trials=n_trials, n_jobs=n_jobs)
  File "/zhome/b1/0/88900/miniconda3/envs/critprops/lib/python3.9/site-packages/optuna/study/study.py", line 475, in optimize
    _optimize(
  File "/zhome/b1/0/88900/miniconda3/envs/critprops/lib/python3.9/site-packages/optuna/study/_optimize.py", line 100, in _optimize
    f.result()
  File "/zhome/b1/0/88900/miniconda3/envs/critprops/lib/python3.9/concurrent/futures/_base.py", line 439, in result
    return self.__get_result()
  File "/zhome/b1/0/88900/miniconda3/envs/critprops/lib/python3.9/concurrent/futures/_base.py", line 391, in __get_result
    raise self._exception
  File "/zhome/b1/0/88900/miniconda3/envs/critprops/lib/python3.9/concurrent/futures/thread.py", line 58, in run
    result = self.fn(*self.args, **self.kwargs)
  File "/zhome/b1/0/88900/miniconda3/envs/critprops/lib/python3.9/site-packages/optuna/study/_optimize.py", line 160, in _optimize_sequential
    frozen_trial = _run_trial(study, func, catch)
  File "/zhome/b1/0/88900/miniconda3/envs/critprops/lib/python3.9/site-packages/optuna/study/_optimize.py", line 248, in _run_trial
    raise func_err
  File "/zhome/b1/0/88900/miniconda3/envs/critprops/lib/python3.9/site-packages/optuna/study/_optimize.py", line 197, in _run_trial
    value_or_values = func(trial)
  File "/zhome/b1/0/88900/Documents/fair_gc/src/optims.py", line 242, in objective
    params = {
  File "/zhome/b1/0/88900/Documents/fair_gc/src/optims.py", line 243, in <dictcomp>
    name: suggest_fn(trial, name)
  File "/zhome/b1/0/88900/Documents/fair_gc/src/optims.py", line 155, in <lambda>
    return lambda trial, name: trial.suggest_categorical(name, param_config['values'])
  File "/zhome/b1/0/88900/miniconda3/envs/critprops/lib/python3.9/site-packages/optuna/trial/_trial.py", line 402, in suggest_categorical
    return self._suggest(name, CategoricalDistribution(choices=choices))
  File "/zhome/b1/0/88900/miniconda3/envs/critprops/lib/python3.9/site-packages/optuna/trial/_trial.py", line 637, in _suggest
    storage.set_trial_param(trial_id, name, param_value_in_internal_repr, distribution)
  File "/zhome/b1/0/88900/miniconda3/envs/critprops/lib/python3.9/site-packages/optuna/storages/_cached_storage.py", line 171, in set_trial_param
    self._backend.set_trial_param(trial_id, param_name, param_value_internal, distribution)
  File "/zhome/b1/0/88900/miniconda3/envs/critprops/lib/python3.9/site-packages/optuna/storages/_rdb/storage.py", line 585, in set_trial_param
    self._set_trial_param_without_commit(
  File "/zhome/b1/0/88900/miniconda3/envs/critprops/lib/python3.9/contextlib.py", line 126, in __exit__
    next(self.gen)
  File "/zhome/b1/0/88900/miniconda3/envs/critprops/lib/python3.9/site-packages/optuna/storages/_rdb/storage.py", line 98, in _create_scoped_session
    raise optuna.exceptions.StorageInternalError(message) from e
optuna.exceptions.StorageInternalError: An exception is raised during the commit. This typically happens due to invalid data in the commit, e.g. exceeding max length. 
