[I 2024-12-04 20:52:21,148] Trial 2262 finished with value: 0.35921123818120804 and parameters: {'kernel_type': 'Matern', 'length_scale': 220.32510593308203, 'noise_level': 0.000507430859377675, 'constant_value': 148.17802115762126, 'nu': 0.5}. Best is trial 1997 with value: 0.359156695282073.
[I 2024-12-04 20:52:24,158] Trial 2265 finished with value: 1.0916566565840347 and parameters: {'kernel_type': 'Matern', 'length_scale': 5.985827220959228, 'noise_level': 6.422267255888767e-05, 'constant_value': 4459.942317022237, 'nu': 0.5}. Best is trial 1997 with value: 0.359156695282073.
[I 2024-12-04 20:52:24,696] Trial 2266 finished with value: 1.091656549442762 and parameters: {'kernel_type': 'Matern', 'length_scale': 6.269122020007778, 'noise_level': 2.2944316185006717e-05, 'constant_value': 7398.787628318056, 'nu': 0.5}. Best is trial 1997 with value: 0.359156695282073.
[I 2024-12-04 20:52:26,418] Trial 2264 finished with value: 1.0624161172301951 and parameters: {'kernel_type': 'RBF', 'length_scale': 6.68255307238642, 'noise_level': 0.0034434995430359557, 'constant_value': 1.2140810562338258e-05, 'nu': 2.5}. Best is trial 1997 with value: 0.359156695282073.
[I 2024-12-04 20:52:29,697] Trial 2268 finished with value: 0.3592112360019232 and parameters: {'kernel_type': 'Matern', 'length_scale': 4219.773375871198, 'noise_level': 0.0017391307789674073, 'constant_value': 1660.2732524463727, 'nu': 0.5}. Best is trial 1997 with value: 0.359156695282073.
[I 2024-12-04 20:52:29,787] Trial 2267 finished with value: 0.3592110790830895 and parameters: {'kernel_type': 'Matern', 'length_scale': 97.93135977714105, 'noise_level': 0.00991016759518399, 'constant_value': 0.3212764718262966, 'nu': 0.5}. Best is trial 1997 with value: 0.359156695282073.
[I 2024-12-04 20:52:31,738] Trial 2269 finished with value: 0.3592112371717271 and parameters: {'kernel_type': 'Matern', 'length_scale': 0.6268247409261556, 'noise_level': 0.0004268016483993966, 'constant_value': 0.9535571340440283, 'nu': 0.5}. Best is trial 1997 with value: 0.359156695282073.
[I 2024-12-04 20:52:33,059] Trial 2271 finished with value: 1.091656684563837 and parameters: {'kernel_type': 'Matern', 'length_scale': 0.46352914620885943, 'noise_level': 2.6643576458913656e-05, 'constant_value': 117.1149081659326, 'nu': 1.5}. Best is trial 1997 with value: 0.359156695282073.
[I 2024-12-04 20:52:34,585] Trial 2270 finished with value: 0.359212137886747 and parameters: {'kernel_type': 'Matern', 'length_scale': 924.6745120421455, 'noise_level': 0.003934111476269094, 'constant_value': 8.887741084173243, 'nu': 0.5}. Best is trial 1997 with value: 0.359156695282073.
[I 2024-12-04 20:52:36,749] Trial 2273 finished with value: 1.0624161168493913 and parameters: {'kernel_type': 'Matern', 'length_scale': 0.0006784811900656417, 'noise_level': 0.0037578718038485293, 'constant_value': 36.0963787103338, 'nu': 1.5}. Best is trial 1997 with value: 0.359156695282073.
[I 2024-12-04 20:52:37,684] Trial 2272 finished with value: 0.3592112431042334 and parameters: {'kernel_type': 'Matern', 'length_scale': 1755.7096699333363, 'noise_level': 0.03657861261526234, 'constant_value': 1373.9498285554573, 'nu': 0.5}. Best is trial 1997 with value: 0.359156695282073.
[I 2024-12-04 20:52:40,449] Trial 2275 finished with value: 1.0624140287635655 and parameters: {'kernel_type': 'Matern', 'length_scale': 0.0796116215058133, 'noise_level': 0.00018455283087337067, 'constant_value': 154.57086284337458, 'nu': 0.5}. Best is trial 1997 with value: 0.359156695282073.
[I 2024-12-04 20:52:40,858] Trial 2274 finished with value: 1.0624161172629076 and parameters: {'kernel_type': 'RBF', 'length_scale': 0.015854052742811608, 'noise_level': 1.4714463147027162e-08, 'constant_value': 5.793960516622851e-07, 'nu': 0.5}. Best is trial 1997 with value: 0.359156695282073.
[I 2024-12-04 20:52:41,057] Trial 2276 finished with value: 1.091656601229403 and parameters: {'kernel_type': 'Matern', 'length_scale': 83.39583203721536, 'noise_level': 6.776685312841494e-06, 'constant_value': 4804.629039055216, 'nu': 0.5}. Best is trial 1997 with value: 0.359156695282073.
[I 2024-12-04 20:52:45,107] Trial 2277 finished with value: 0.3592113575819846 and parameters: {'kernel_type': 'Matern', 'length_scale': 21.985044083047313, 'noise_level': 0.0006325141587166463, 'constant_value': 6014.63527119625, 'nu': 0.5}. Best is trial 1997 with value: 0.359156695282073.
[I 2024-12-04 20:52:45,821] Trial 2278 finished with value: 0.35921124193484827 and parameters: {'kernel_type': 'Matern', 'length_scale': 108.42347176851008, 'noise_level': 0.0005656900294300379, 'constant_value': 94.94134978361879, 'nu': 0.5}. Best is trial 1997 with value: 0.359156695282073.
[I 2024-12-04 20:52:49,635] Trial 2280 finished with value: 0.3592110172476294 and parameters: {'kernel_type': 'Matern', 'length_scale': 80.69500932877509, 'noise_level': 0.0666320403895266, 'constant_value': 46.58004559872681, 'nu': 0.5}. Best is trial 1997 with value: 0.359156695282073.
[I 2024-12-04 20:52:50,646] Trial 2279 finished with value: 0.3592109550521812 and parameters: {'kernel_type': 'Matern', 'length_scale': 0.3479892960088692, 'noise_level': 4.144434749518712e-06, 'constant_value': 119.46604836446586, 'nu': 0.5}. Best is trial 1997 with value: 0.359156695282073.
[I 2024-12-04 20:52:54,444] Trial 2282 finished with value: 0.35921143073244666 and parameters: {'kernel_type': 'Matern', 'length_scale': 93.65603590000462, 'noise_level': 0.0009464329536385074, 'constant_value': 20.597218347224977, 'nu': 0.5}. Best is trial 1997 with value: 0.359156695282073.
[I 2024-12-04 20:52:54,449] Trial 2283 finished with value: 0.35921124273464605 and parameters: {'kernel_type': 'Matern', 'length_scale': 10.338418018602887, 'noise_level': 0.016418634348934473, 'constant_value': 3.9660298163318317, 'nu': 0.5}. Best is trial 1997 with value: 0.359156695282073.
[I 2024-12-04 20:52:56,425] Trial 2281 finished with value: 1.0624161173533226 and parameters: {'kernel_type': 'Matern', 'length_scale': 11178.178621800058, 'noise_level': 0.011925733293174322, 'constant_value': 0.0013277448647760995, 'nu': 0.5}. Best is trial 1997 with value: 0.359156695282073.
[I 2024-12-04 20:52:59,004] Trial 2284 finished with value: 0.35921098271486823 and parameters: {'kernel_type': 'Matern', 'length_scale': 6.405690916539583, 'noise_level': 0.00020240495018786266, 'constant_value': 3943.4765822321674, 'nu': 0.5}. Best is trial 1997 with value: 0.359156695282073.
[I 2024-12-04 20:52:59,951] Trial 2285 finished with value: 0.3592113041603371 and parameters: {'kernel_type': 'Matern', 'length_scale': 0.4080790675624631, 'noise_level': 0.016349861663201074, 'constant_value': 1.7376380378162062, 'nu': 0.5}. Best is trial 1997 with value: 0.359156695282073.
[I 2024-12-04 20:53:02,273] Trial 2286 finished with value: 0.3592112354798889 and parameters: {'kernel_type': 'Matern', 'length_scale': 30.86976597499399, 'noise_level': 0.060045631843871856, 'constant_value': 63.29918558210526, 'nu': 0.5}. Best is trial 1997 with value: 0.359156695282073.
[I 2024-12-04 20:53:04,451] Trial 2288 finished with value: 0.3592111334566763 and parameters: {'kernel_type': 'Matern', 'length_scale': 4.409242844369739, 'noise_level': 0.0004335719083948778, 'constant_value': 2165.7566130671366, 'nu': 0.5}. Best is trial 1997 with value: 0.359156695282073.
[I 2024-12-04 20:53:06,237] Trial 2287 finished with value: 1.0624161172834115 and parameters: {'kernel_type': 'RBF', 'length_scale': 203.49136347450136, 'noise_level': 0.0058294797175607385, 'constant_value': 355.30928665830913, 'nu': 0.5}. Best is trial 1997 with value: 0.359156695282073.
[I 2024-12-04 20:53:07,570] Trial 2289 finished with value: 0.35921129615728864 and parameters: {'kernel_type': 'Matern', 'length_scale': 3485.467719060096, 'noise_level': 0.01918049977539591, 'constant_value': 26.005315855259237, 'nu': 0.5}. Best is trial 1997 with value: 0.359156695282073.
[I 2024-12-04 20:53:08,212] Trial 2290 finished with value: 1.0916563002675417 and parameters: {'kernel_type': 'Matern', 'length_scale': 234.35351947707542, 'noise_level': 2.6606757215317217e-06, 'constant_value': 170.9057056960122, 'nu': 0.5}. Best is trial 1997 with value: 0.359156695282073.
[I 2024-12-04 20:53:12,273] Trial 2291 finished with value: 0.3592112412997817 and parameters: {'kernel_type': 'Matern', 'length_scale': 0.16912117341632515, 'noise_level': 0.0005209167556612193, 'constant_value': 6.854767328130331, 'nu': 0.5}. Best is trial 1997 with value: 0.359156695282073.
[I 2024-12-04 20:53:12,922] Trial 2293 finished with value: 0.35921121260263555 and parameters: {'kernel_type': 'Matern', 'length_scale': 2.026770684880293, 'noise_level': 0.007607937449155604, 'constant_value': 10.566742973599467, 'nu': 0.5}. Best is trial 1997 with value: 0.359156695282073.
[I 2024-12-04 20:53:13,956] Trial 2292 finished with value: 0.35921124061149634 and parameters: {'kernel_type': 'Matern', 'length_scale': 557.2460785891345, 'noise_level': 0.008224229120827705, 'constant_value': 9795.684421246964, 'nu': 0.5}. Best is trial 1997 with value: 0.359156695282073.
[I 2024-12-04 20:53:17,809] Trial 2295 finished with value: 0.42868351102530544 and parameters: {'kernel_type': 'RBF', 'length_scale': 18.91616621102058, 'noise_level': 0.019270994325543543, 'constant_value': 19.067587724840536, 'nu': 0.5}. Best is trial 1997 with value: 0.359156695282073.
[I 2024-12-04 20:53:17,814] Trial 2294 finished with value: 0.35921123057407467 and parameters: {'kernel_type': 'Matern', 'length_scale': 338.9350513631384, 'noise_level': 0.09747087711411209, 'constant_value': 1403.4093572575307, 'nu': 0.5}. Best is trial 1997 with value: 0.359156695282073.
[I 2024-12-04 20:53:19,712] Trial 2296 finished with value: 0.3592118182625649 and parameters: {'kernel_type': 'Matern', 'length_scale': 126.47465959255342, 'noise_level': 0.8180371616670405, 'constant_value': 2729.6458079832873, 'nu': 0.5}. Best is trial 1997 with value: 0.359156695282073.
[I 2024-12-04 20:53:22,772] Trial 2298 finished with value: 0.35921120401752255 and parameters: {'kernel_type': 'Matern', 'length_scale': 48.89187860495015, 'noise_level': 0.0042555883545650885, 'constant_value': 1022.6264744196615, 'nu': 0.5}. Best is trial 1997 with value: 0.359156695282073.
[I 2024-12-04 20:53:23,636] Trial 2297 finished with value: 0.3592112444613685 and parameters: {'kernel_type': 'Matern', 'length_scale': 154.26699093789813, 'noise_level': 0.045837939984839746, 'constant_value': 82.78109178319498, 'nu': 0.5}. Best is trial 1997 with value: 0.359156695282073.
[I 2024-12-04 20:53:26,278] Trial 2299 finished with value: 1.0624161186735004 and parameters: {'kernel_type': 'Matern', 'length_scale': 138.48502980695957, 'noise_level': 0.002534184815187217, 'constant_value': 0.017977273007616246, 'nu': 0.5}. Best is trial 1997 with value: 0.359156695282073.
[I 2024-12-04 20:53:28,020] Trial 2300 finished with value: 0.3592112207699011 and parameters: {'kernel_type': 'Matern', 'length_scale': 2.2377311122171246, 'noise_level': 0.019058745764473466, 'constant_value': 40.04325283103307, 'nu': 0.5}. Best is trial 1997 with value: 0.359156695282073.
[I 2024-12-04 20:53:28,619] Trial 2301 finished with value: 0.3592112004003966 and parameters: {'kernel_type': 'Matern', 'length_scale': 3.200363577982651, 'noise_level': 0.003252282215592082, 'constant_value': 65.56539341313494, 'nu': 0.5}. Best is trial 1997 with value: 0.359156695282073.
[I 2024-12-04 20:53:31,343] Trial 2302 finished with value: 1.0624161166380985 and parameters: {'kernel_type': 'Matern', 'length_scale': 108.77876279056207, 'noise_level': 0.0012636639170243008, 'constant_value': 16.519153879389627, 'nu': 1.5}. Best is trial 1997 with value: 0.359156695282073.
[I 2024-12-04 20:53:33,109] Trial 2303 finished with value: 0.3592113549305646 and parameters: {'kernel_type': 'Matern', 'length_scale': 60.99030092511451, 'noise_level': 0.5593574352778728, 'constant_value': 693.7412129286197, 'nu': 0.5}. Best is trial 1997 with value: 0.359156695282073.
[I 2024-12-04 20:53:33,343] Trial 2304 finished with value: 1.0624161177365266 and parameters: {'kernel_type': 'RBF', 'length_scale': 8.131017282454332, 'noise_level': 8.99989998255799e-06, 'constant_value': 1660.7155078019696, 'nu': 0.5}. Best is trial 1997 with value: 0.359156695282073.
[I 2024-12-04 20:53:36,566] Trial 2305 finished with value: 0.3592113687776759 and parameters: {'kernel_type': 'Matern', 'length_scale': 362.70130060490135, 'noise_level': 0.003242667277871257, 'constant_value': 2.0144688658449517, 'nu': 0.5}. Best is trial 1997 with value: 0.359156695282073.
[I 2024-12-04 20:53:37,896] Trial 2306 finished with value: 0.35921124020342254 and parameters: {'kernel_type': 'Matern', 'length_scale': 38.71049856523726, 'noise_level': 0.0013986792676980745, 'constant_value': 6294.258501392936, 'nu': 0.5}. Best is trial 1997 with value: 0.359156695282073.
[I 2024-12-04 20:53:40,926] Trial 2307 finished with value: 0.35921101976014697 and parameters: {'kernel_type': 'Matern', 'length_scale': 0.1407953608984768, 'noise_level': 0.0006803330589266003, 'constant_value': 1930.2124867213693, 'nu': 0.5}. Best is trial 1997 with value: 0.359156695282073.
[I 2024-12-04 20:53:42,130] Trial 2308 finished with value: 0.3592115655147317 and parameters: {'kernel_type': 'Matern', 'length_scale': 3.8146171499918653, 'noise_level': 3.629968209114784e-05, 'constant_value': 6.571330841587103, 'nu': 0.5}. Best is trial 1997 with value: 0.359156695282073.
[I 2024-12-04 20:53:42,865] Trial 2309 finished with value: 0.35921084782342266 and parameters: {'kernel_type': 'Matern', 'length_scale': 8285.159815631781, 'noise_level': 0.011811639208816288, 'constant_value': 3698.2115825174665, 'nu': 0.5}. Best is trial 1997 with value: 0.359156695282073.
[I 2024-12-04 20:53:45,644] Trial 2310 finished with value: 0.359212748551708 and parameters: {'kernel_type': 'Matern', 'length_scale': 1.221695066281998, 'noise_level': 0.0025779807971419697, 'constant_value': 312.60338929030775, 'nu': 0.5}. Best is trial 1997 with value: 0.359156695282073.
[I 2024-12-04 20:53:48,344] Trial 2311 finished with value: 0.4195660038975398 and parameters: {'kernel_type': 'Matern', 'length_scale': 37.49405158691122, 'noise_level': 6.291137514227962e-05, 'constant_value': 51148.79616966781, 'nu': 2.5}. Best is trial 1997 with value: 0.359156695282073.
[I 2024-12-04 20:53:48,345] Trial 2312 finished with value: 0.35921114332939735 and parameters: {'kernel_type': 'Matern', 'length_scale': 1.6652196223680258, 'noise_level': 0.041660030029417906, 'constant_value': 111.90943824905614, 'nu': 0.5}. Best is trial 1997 with value: 0.359156695282073.
[I 2024-12-04 20:53:50,465] Trial 2314 finished with value: 1.09165584938781 and parameters: {'kernel_type': 'RBF', 'length_scale': 0.013498689934663449, 'noise_level': 0.9199697070708341, 'constant_value': 3.382457527154001e-07, 'nu': 0.5}. Best is trial 1997 with value: 0.359156695282073.
[I 2024-12-04 20:53:50,561] Trial 2313 finished with value: 0.35921123731820254 and parameters: {'kernel_type': 'Matern', 'length_scale': 60.6001604979718, 'noise_level': 0.03241893141430228, 'constant_value': 43.43017712370581, 'nu': 0.5}. Best is trial 1997 with value: 0.359156695282073.
[I 2024-12-04 20:53:53,715] Trial 2315 finished with value: 0.359213160831673 and parameters: {'kernel_type': 'Matern', 'length_scale': 102.64759733985936, 'noise_level': 0.032161561491731994, 'constant_value': 0.2336099214636275, 'nu': 0.5}. Best is trial 1997 with value: 0.359156695282073.
[I 2024-12-04 20:53:55,732] Trial 2317 finished with value: 0.4226920192042475 and parameters: {'kernel_type': 'Matern', 'length_scale': 3.038068345672243, 'noise_level': 0.0021944859006139215, 'constant_value': 3.070158991938847, 'nu': 1.5}. Best is trial 1997 with value: 0.359156695282073.
[I 2024-12-04 20:53:57,597] Trial 2316 finished with value: 1.0624161172898228 and parameters: {'kernel_type': 'Matern', 'length_scale': 0.0033518449822394665, 'noise_level': 1.4544628963308975e-05, 'constant_value': 0.21925002034602664, 'nu': 0.5}. Best is trial 1997 with value: 0.359156695282073.
[I 2024-12-04 20:53:58,176] Trial 2318 finished with value: 0.419565949250913 and parameters: {'kernel_type': 'Matern', 'length_scale': 7.9696619715957695, 'noise_level': 0.2590342637332522, 'constant_value': 8.074200289073639, 'nu': 2.5}. Best is trial 1997 with value: 0.359156695282073.
[I 2024-12-04 20:54:00,636] Trial 2319 finished with value: 0.35921118562251375 and parameters: {'kernel_type': 'Matern', 'length_scale': 11.91403869112516, 'noise_level': 0.8303619966552145, 'constant_value': 919.0980986270613, 'nu': 0.5}. Best is trial 1997 with value: 0.359156695282073.
[I 2024-12-04 20:54:02,316] Trial 2321 finished with value: 1.062416117255008 and parameters: {'kernel_type': 'Matern', 'length_scale': 3248.471734868064, 'noise_level': 5.787909968979721e-08, 'constant_value': 1.0274715560797887, 'nu': 0.5}. Best is trial 1997 with value: 0.359156695282073.
[I 2024-12-04 20:54:03,078] Trial 2320 finished with value: 0.41956475182997666 and parameters: {'kernel_type': 'Matern', 'length_scale': 37.222473389082175, 'noise_level': 0.9124225168918344, 'constant_value': 755.4475448136369, 'nu': 2.5}. Best is trial 1997 with value: 0.359156695282073.
[I 2024-12-04 20:54:05,444] Trial 2322 finished with value: 0.3592112433036172 and parameters: {'kernel_type': 'Matern', 'length_scale': 176.04353031282437, 'noise_level': 0.0007061097076787211, 'constant_value': 76.09557071023869, 'nu': 0.5}. Best is trial 1997 with value: 0.359156695282073.
[I 2024-12-04 20:54:08,192] Trial 2324 finished with value: 0.4195660971956587 and parameters: {'kernel_type': 'Matern', 'length_scale': 0.5196197623559435, 'noise_level': 0.0018961776217757604, 'constant_value': 0.9065085057659238, 'nu': 2.5}. Best is trial 1997 with value: 0.359156695282073.
[I 2024-12-04 20:54:10,143] Trial 2323 finished with value: 1.0624161171535522 and parameters: {'kernel_type': 'Matern', 'length_scale': 69825.51177691288, 'noise_level': 0.024971904942606017, 'constant_value': 0.3544573689544971, 'nu': 0.5}. Best is trial 1997 with value: 0.359156695282073.
[I 2024-12-04 20:54:11,028] Trial 2325 finished with value: 0.35921181136024255 and parameters: {'kernel_type': 'Matern', 'length_scale': 37.60864925642853, 'noise_level': 0.690836174289655, 'constant_value': 83257.47000374217, 'nu': 0.5}. Best is trial 1997 with value: 0.359156695282073.
[I 2024-12-04 20:54:13,421] Trial 2326 finished with value: 0.3592112400068086 and parameters: {'kernel_type': 'Matern', 'length_scale': 46.8223852607025, 'noise_level': 0.002847147096853317, 'constant_value': 3216.4577284232237, 'nu': 0.5}. Best is trial 1997 with value: 0.359156695282073.
[I 2024-12-04 20:54:14,779] Trial 2327 finished with value: 0.3592094948656141 and parameters: {'kernel_type': 'Matern', 'length_scale': 41.023032621494444, 'noise_level': 0.0006098667012791046, 'constant_value': 71421.18066617903, 'nu': 0.5}. Best is trial 1997 with value: 0.359156695282073.
[I 2024-12-04 20:54:18,138] Trial 2330 finished with value: 1.0916567048549894 and parameters: {'kernel_type': 'Matern', 'length_scale': 11.199131332581485, 'noise_level': 0.00010397482246725674, 'constant_value': 70640.67214831166, 'nu': 0.5}. Best is trial 1997 with value: 0.359156695282073.
[I 2024-12-04 20:54:18,727] Trial 2328 finished with value: 0.3592115988290244 and parameters: {'kernel_type': 'Matern', 'length_scale': 0.10710290176325563, 'noise_level': 0.013234683858332789, 'constant_value': 36.71093436759634, 'nu': 0.5}. Best is trial 1997 with value: 0.359156695282073.
[I 2024-12-04 20:54:19,072] Trial 2329 finished with value: 0.35921121845642495 and parameters: {'kernel_type': 'Matern', 'length_scale': 4916.372711290961, 'noise_level': 0.00736742088208058, 'constant_value': 78.6047559786013, 'nu': 0.5}. Best is trial 1997 with value: 0.359156695282073.
[I 2024-12-04 20:54:24,420] Trial 2332 finished with value: 1.0916567045496925 and parameters: {'kernel_type': 'RBF', 'length_scale': 8377.347069197614, 'noise_level': 0.0008866742869461665, 'constant_value': 0.00015806081013674923, 'nu': 0.5}. Best is trial 1997 with value: 0.359156695282073.
[I 2024-12-04 20:54:24,753] Trial 2333 finished with value: 0.35921123459208615 and parameters: {'kernel_type': 'Matern', 'length_scale': 591.3392249527782, 'noise_level': 0.00015312854054713685, 'constant_value': 12824.303518236471, 'nu': 0.5}. Best is trial 1997 with value: 0.359156695282073.
[I 2024-12-04 20:54:25,165] Trial 2331 finished with value: 1.0624161176354723 and parameters: {'kernel_type': 'Matern', 'length_scale': 3455.6434880213096, 'noise_level': 1.898654526375083e-10, 'constant_value': 0.9211851655553381, 'nu': 1.5}. Best is trial 1997 with value: 0.359156695282073.
[I 2024-12-04 20:54:29,717] Trial 2335 finished with value: 0.35921064761436405 and parameters: {'kernel_type': 'Matern', 'length_scale': 2540.550379017829, 'noise_level': 8.99529603727359e-05, 'constant_value': 8393.813179179095, 'nu': 0.5}. Best is trial 1997 with value: 0.359156695282073.
[I 2024-12-04 20:54:30,454] Trial 2334 finished with value: 1.0624161172629076 and parameters: {'kernel_type': 'RBF', 'length_scale': 0.00017901869786095536, 'noise_level': 5.393366439193539e-07, 'constant_value': 1.4920147211632972e-06, 'nu': 2.5}. Best is trial 1997 with value: 0.359156695282073.
[I 2024-12-04 20:54:31,665] Trial 2336 finished with value: 0.3592112149541199 and parameters: {'kernel_type': 'Matern', 'length_scale': 73374.19312703398, 'noise_level': 0.0005225523043622301, 'constant_value': 24634.853355573396, 'nu': 0.5}. Best is trial 1997 with value: 0.359156695282073.
