[I 2024-12-04 12:29:04,928] Trial 801 finished with value: 0.5468613589518965 and parameters: {'n_estimators': 1459, 'learning_rate': 0.07017325832678163, 'max_depth': 8, 'min_samples_split': 9, 'min_samples_leaf': 8, 'subsample': 0.7979843274869416, 'max_features': 'log2'}. Best is trial 428 with value: 0.31740361133065975.
[I 2024-12-04 12:29:06,382] Trial 802 finished with value: 0.3850428786006946 and parameters: {'n_estimators': 1231, 'learning_rate': 0.011948421483025003, 'max_depth': 8, 'min_samples_split': 16, 'min_samples_leaf': 3, 'subsample': 0.6786581142945801, 'max_features': None}. Best is trial 428 with value: 0.31740361133065975.
[I 2024-12-04 12:29:07,262] Trial 805 finished with value: 0.37410639904242327 and parameters: {'n_estimators': 1009, 'learning_rate': 0.05957210128323839, 'max_depth': 8, 'min_samples_split': 4, 'min_samples_leaf': 4, 'subsample': 0.6112545443989436, 'max_features': None}. Best is trial 428 with value: 0.31740361133065975.
[I 2024-12-04 12:29:07,611] Trial 803 finished with value: 0.37315994503897676 and parameters: {'n_estimators': 1196, 'learning_rate': 0.0746260736162298, 'max_depth': 8, 'min_samples_split': 6, 'min_samples_leaf': 1, 'subsample': 0.7132513486737262, 'max_features': None}. Best is trial 428 with value: 0.31740361133065975.
[I 2024-12-04 12:29:11,240] Trial 809 finished with value: 0.418040014936782 and parameters: {'n_estimators': 1043, 'learning_rate': 0.08264144760679619, 'max_depth': 7, 'min_samples_split': 2, 'min_samples_leaf': 1, 'subsample': 0.7248956335474328, 'max_features': 'log2'}. Best is trial 428 with value: 0.31740361133065975.
[I 2024-12-04 12:29:12,829] Trial 815 finished with value: 0.43002363352849937 and parameters: {'n_estimators': 825, 'learning_rate': 0.09301348904601855, 'max_depth': 7, 'min_samples_split': 8, 'min_samples_leaf': 5, 'subsample': 0.624485598538933, 'max_features': 'sqrt'}. Best is trial 428 with value: 0.31740361133065975.
[I 2024-12-04 12:29:14,070] Trial 807 finished with value: 0.3876104504417853 and parameters: {'n_estimators': 1054, 'learning_rate': 0.09256971454482993, 'max_depth': 8, 'min_samples_split': 4, 'min_samples_leaf': 3, 'subsample': 0.7112425815049968, 'max_features': None}. Best is trial 428 with value: 0.31740361133065975.
[I 2024-12-04 12:29:15,658] Trial 808 finished with value: 0.3845512822527755 and parameters: {'n_estimators': 1017, 'learning_rate': 0.08106006277209456, 'max_depth': 7, 'min_samples_split': 6, 'min_samples_leaf': 3, 'subsample': 0.8413651602841944, 'max_features': None}. Best is trial 428 with value: 0.31740361133065975.
[I 2024-12-04 12:29:16,585] Trial 817 finished with value: 0.38952663079160316 and parameters: {'n_estimators': 868, 'learning_rate': 0.06547618890918294, 'max_depth': 7, 'min_samples_split': 3, 'min_samples_leaf': 3, 'subsample': 0.702042168676185, 'max_features': None}. Best is trial 428 with value: 0.31740361133065975.
[I 2024-12-04 12:29:18,305] Trial 819 finished with value: 0.505226928176721 and parameters: {'n_estimators': 911, 'learning_rate': 0.0648155527318218, 'max_depth': 9, 'min_samples_split': 14, 'min_samples_leaf': 7, 'subsample': 0.9674295301272423, 'max_features': 'log2'}. Best is trial 428 with value: 0.31740361133065975.
[I 2024-12-04 12:29:19,449] Trial 814 finished with value: 0.7973803901540513 and parameters: {'n_estimators': 1090, 'learning_rate': 0.014106800869233466, 'max_depth': 5, 'min_samples_split': 8, 'min_samples_leaf': 6, 'subsample': 0.6259601344228727, 'max_features': 'log2'}. Best is trial 428 with value: 0.31740361133065975.
[I 2024-12-04 12:29:20,206] Trial 810 finished with value: 0.3822001618383762 and parameters: {'n_estimators': 1134, 'learning_rate': 0.07624386251744919, 'max_depth': 8, 'min_samples_split': 4, 'min_samples_leaf': 1, 'subsample': 0.6381569731873029, 'max_features': None}. Best is trial 428 with value: 0.31740361133065975.
[I 2024-12-04 12:29:21,829] Trial 813 finished with value: 0.3754270604203029 and parameters: {'n_estimators': 1032, 'learning_rate': 0.06918580186429094, 'max_depth': 9, 'min_samples_split': 8, 'min_samples_leaf': 1, 'subsample': 0.6677163827393637, 'max_features': None}. Best is trial 428 with value: 0.31740361133065975.
[I 2024-12-04 12:29:21,833] Trial 825 finished with value: 0.4020242494574559 and parameters: {'n_estimators': 857, 'learning_rate': 0.09085114409444757, 'max_depth': 7, 'min_samples_split': 7, 'min_samples_leaf': 1, 'subsample': 0.8005573028659971, 'max_features': 'sqrt'}. Best is trial 428 with value: 0.31740361133065975.
[I 2024-12-04 12:29:21,858] Trial 828 finished with value: 0.3785973257710106 and parameters: {'n_estimators': 654, 'learning_rate': 0.06920219910983985, 'max_depth': 9, 'min_samples_split': 4, 'min_samples_leaf': 4, 'subsample': 0.6785363475200815, 'max_features': None}. Best is trial 428 with value: 0.31740361133065975.
[I 2024-12-04 12:29:21,865] Trial 811 finished with value: 0.3880537659280137 and parameters: {'n_estimators': 1123, 'learning_rate': 0.06741816073488757, 'max_depth': 7, 'min_samples_split': 6, 'min_samples_leaf': 3, 'subsample': 0.7499539781272574, 'max_features': None}. Best is trial 428 with value: 0.31740361133065975.
[I 2024-12-04 12:29:25,582] Trial 826 finished with value: 0.388759033222271 and parameters: {'n_estimators': 789, 'learning_rate': 0.05551636170763937, 'max_depth': 7, 'min_samples_split': 2, 'min_samples_leaf': 3, 'subsample': 0.7733904370690721, 'max_features': None}. Best is trial 428 with value: 0.31740361133065975.
[I 2024-12-04 12:29:26,779] Trial 835 finished with value: 0.4901178489265354 and parameters: {'n_estimators': 570, 'learning_rate': 0.011530045189871095, 'max_depth': 5, 'min_samples_split': 18, 'min_samples_leaf': 1, 'subsample': 0.8067086085667224, 'max_features': None}. Best is trial 428 with value: 0.31740361133065975.
[I 2024-12-04 12:29:27,800] Trial 823 finished with value: 0.3782641355698145 and parameters: {'n_estimators': 924, 'learning_rate': 0.057216660816120014, 'max_depth': 9, 'min_samples_split': 8, 'min_samples_leaf': 3, 'subsample': 0.7738981899001817, 'max_features': None}. Best is trial 428 with value: 0.31740361133065975.
[I 2024-12-04 12:29:27,843] Trial 812 finished with value: 0.38082449829411935 and parameters: {'n_estimators': 1216, 'learning_rate': 0.08978461117625422, 'max_depth': 6, 'min_samples_split': 6, 'min_samples_leaf': 1, 'subsample': 0.7321461643227847, 'max_features': None}. Best is trial 428 with value: 0.31740361133065975.
[I 2024-12-04 12:29:28,964] Trial 816 finished with value: 0.4163812738297451 and parameters: {'n_estimators': 1337, 'learning_rate': 0.08273406953278112, 'max_depth': 3, 'min_samples_split': 6, 'min_samples_leaf': 2, 'subsample': 0.7739269069928266, 'max_features': 'log2'}. Best is trial 428 with value: 0.31740361133065975.
[I 2024-12-04 12:29:29,999] Trial 842 finished with value: 0.4345191503480539 and parameters: {'n_estimators': 369, 'learning_rate': 0.0115209394214761, 'max_depth': 9, 'min_samples_split': 20, 'min_samples_leaf': 5, 'subsample': 0.9505029660057902, 'max_features': None}. Best is trial 428 with value: 0.31740361133065975.
[I 2024-12-04 12:29:31,321] Trial 820 finished with value: 0.377157508355676 and parameters: {'n_estimators': 1189, 'learning_rate': 0.08644249860776834, 'max_depth': 7, 'min_samples_split': 6, 'min_samples_leaf': 4, 'subsample': 0.6434408870852707, 'max_features': None}. Best is trial 428 with value: 0.31740361133065975.
[I 2024-12-04 12:29:34,867] Trial 818 finished with value: 0.3363511658720705 and parameters: {'n_estimators': 1397, 'learning_rate': 0.0975087917428794, 'max_depth': 7, 'min_samples_split': 7, 'min_samples_leaf': 2, 'subsample': 0.6973955635364276, 'max_features': None}. Best is trial 428 with value: 0.31740361133065975.
[I 2024-12-04 12:29:35,376] Trial 829 finished with value: 0.32547413332131647 and parameters: {'n_estimators': 982, 'learning_rate': 0.09592990805787258, 'max_depth': 8, 'min_samples_split': 7, 'min_samples_leaf': 2, 'subsample': 0.8363910238376941, 'max_features': None}. Best is trial 428 with value: 0.31740361133065975.
[I 2024-12-04 12:29:35,901] Trial 827 finished with value: 0.3214952456287818 and parameters: {'n_estimators': 1088, 'learning_rate': 0.0625804210822078, 'max_depth': 8, 'min_samples_split': 5, 'min_samples_leaf': 2, 'subsample': 0.6771916731646858, 'max_features': None}. Best is trial 428 with value: 0.31740361133065975.
[I 2024-12-04 12:29:35,902] Trial 832 finished with value: 0.6046371861178197 and parameters: {'n_estimators': 1085, 'learning_rate': 0.010229854603306148, 'max_depth': 10, 'min_samples_split': 10, 'min_samples_leaf': 7, 'subsample': 0.6564134935106848, 'max_features': 'sqrt'}. Best is trial 428 with value: 0.31740361133065975.
[I 2024-12-04 12:29:37,723] Trial 822 finished with value: 0.3845185383807811 and parameters: {'n_estimators': 1295, 'learning_rate': 0.09609001242229849, 'max_depth': 6, 'min_samples_split': 11, 'min_samples_leaf': 1, 'subsample': 0.7656050935700178, 'max_features': None}. Best is trial 428 with value: 0.31740361133065975.
[I 2024-12-04 12:29:37,941] Trial 824 finished with value: 0.3375474681563608 and parameters: {'n_estimators': 1151, 'learning_rate': 0.056917340035188516, 'max_depth': 7, 'min_samples_split': 6, 'min_samples_leaf': 2, 'subsample': 0.6608720330144098, 'max_features': None}. Best is trial 428 with value: 0.31740361133065975.
[I 2024-12-04 12:29:39,341] Trial 853 finished with value: 0.5290856433980649 and parameters: {'n_estimators': 257, 'learning_rate': 0.01369541697261294, 'max_depth': 5, 'min_samples_split': 7, 'min_samples_leaf': 6, 'subsample': 0.8141721780753868, 'max_features': None}. Best is trial 428 with value: 0.31740361133065975.
[I 2024-12-04 12:29:41,831] Trial 833 finished with value: 0.4103725483783928 and parameters: {'n_estimators': 1119, 'learning_rate': 0.0984916621611572, 'max_depth': 4, 'min_samples_split': 5, 'min_samples_leaf': 3, 'subsample': 0.8228758298837489, 'max_features': None}. Best is trial 428 with value: 0.31740361133065975.
[I 2024-12-04 12:29:42,488] Trial 834 finished with value: 0.38925787005477397 and parameters: {'n_estimators': 1027, 'learning_rate': 0.09151495956653488, 'max_depth': 7, 'min_samples_split': 6, 'min_samples_leaf': 1, 'subsample': 0.8490198515915995, 'max_features': None}. Best is trial 428 with value: 0.31740361133065975.
[I 2024-12-04 12:29:44,018] Trial 830 finished with value: 0.3855658125301542 and parameters: {'n_estimators': 1212, 'learning_rate': 0.08289217281787889, 'max_depth': 7, 'min_samples_split': 7, 'min_samples_leaf': 1, 'subsample': 0.8787664544374204, 'max_features': None}. Best is trial 428 with value: 0.31740361133065975.
[I 2024-12-04 12:29:44,699] Trial 838 finished with value: 0.3948565336770153 and parameters: {'n_estimators': 1011, 'learning_rate': 0.08168908309456166, 'max_depth': 6, 'min_samples_split': 6, 'min_samples_leaf': 3, 'subsample': 0.7098051482575002, 'max_features': None}. Best is trial 428 with value: 0.31740361133065975.
[I 2024-12-04 12:29:47,593] Trial 851 finished with value: 0.6680342251181064 and parameters: {'n_estimators': 718, 'learning_rate': 0.025538774185179056, 'max_depth': 4, 'min_samples_split': 16, 'min_samples_leaf': 4, 'subsample': 0.9324660698640022, 'max_features': 'log2'}. Best is trial 428 with value: 0.31740361133065975.
[I 2024-12-04 12:29:48,305] Trial 840 finished with value: 0.4949858028201141 and parameters: {'n_estimators': 1220, 'learning_rate': 0.03496844207196083, 'max_depth': 6, 'min_samples_split': 18, 'min_samples_leaf': 3, 'subsample': 0.9993749918291851, 'max_features': 'log2'}. Best is trial 428 with value: 0.31740361133065975.
[I 2024-12-04 12:29:49,499] Trial 831 finished with value: 0.3791578047518847 and parameters: {'n_estimators': 1286, 'learning_rate': 0.05424349270776889, 'max_depth': 7, 'min_samples_split': 8, 'min_samples_leaf': 3, 'subsample': 0.8063464475608223, 'max_features': None}. Best is trial 428 with value: 0.31740361133065975.
[I 2024-12-04 12:29:49,818] Trial 839 finished with value: 0.3849736864106687 and parameters: {'n_estimators': 1151, 'learning_rate': 0.07734562626674454, 'max_depth': 7, 'min_samples_split': 7, 'min_samples_leaf': 3, 'subsample': 0.7149190016532516, 'max_features': None}. Best is trial 428 with value: 0.31740361133065975.
[I 2024-12-04 12:29:51,895] Trial 855 finished with value: 0.5565270653908689 and parameters: {'n_estimators': 616, 'learning_rate': 0.05210883579878257, 'max_depth': 5, 'min_samples_split': 6, 'min_samples_leaf': 10, 'subsample': 0.7759217557877934, 'max_features': None}. Best is trial 428 with value: 0.31740361133065975.
[I 2024-12-04 12:29:53,282] Trial 837 finished with value: 0.35562709152926586 and parameters: {'n_estimators': 1313, 'learning_rate': 0.08604650416167989, 'max_depth': 6, 'min_samples_split': 12, 'min_samples_leaf': 4, 'subsample': 0.6650826537168547, 'max_features': None}. Best is trial 428 with value: 0.31740361133065975.
[I 2024-12-04 12:29:54,272] Trial 850 finished with value: 0.3848767144239505 and parameters: {'n_estimators': 832, 'learning_rate': 0.09980188285363555, 'max_depth': 9, 'min_samples_split': 2, 'min_samples_leaf': 3, 'subsample': 0.6138069268808514, 'max_features': None}. Best is trial 428 with value: 0.31740361133065975.
[I 2024-12-04 12:29:55,575] Trial 836 finished with value: 0.37853932171324545 and parameters: {'n_estimators': 1322, 'learning_rate': 0.09740496810243698, 'max_depth': 10, 'min_samples_split': 8, 'min_samples_leaf': 4, 'subsample': 0.7395341847101561, 'max_features': None}. Best is trial 428 with value: 0.31740361133065975.
[I 2024-12-04 12:29:56,407] Trial 848 finished with value: 0.3766822325368265 and parameters: {'n_estimators': 889, 'learning_rate': 0.09483541176210551, 'max_depth': 6, 'min_samples_split': 8, 'min_samples_leaf': 3, 'subsample': 0.7872136831721949, 'max_features': None}. Best is trial 428 with value: 0.31740361133065975.
[I 2024-12-04 12:29:56,676] Trial 841 finished with value: 0.3810293232367409 and parameters: {'n_estimators': 1388, 'learning_rate': 0.08689939173103006, 'max_depth': 5, 'min_samples_split': 6, 'min_samples_leaf': 2, 'subsample': 0.7743789404490489, 'max_features': 'sqrt'}. Best is trial 428 with value: 0.31740361133065975.
[I 2024-12-04 12:29:57,000] Trial 846 finished with value: 0.39033464383757027 and parameters: {'n_estimators': 1022, 'learning_rate': 0.06267555552293061, 'max_depth': 7, 'min_samples_split': 4, 'min_samples_leaf': 1, 'subsample': 0.6872422923903972, 'max_features': None}. Best is trial 428 with value: 0.31740361133065975.
[I 2024-12-04 12:29:58,773] Trial 845 finished with value: 0.32791812381178503 and parameters: {'n_estimators': 1102, 'learning_rate': 0.05516280727829594, 'max_depth': 6, 'min_samples_split': 4, 'min_samples_leaf': 2, 'subsample': 0.775830948030694, 'max_features': None}. Best is trial 428 with value: 0.31740361133065975.
[I 2024-12-04 12:30:01,190] Trial 849 finished with value: 0.44272823074014905 and parameters: {'n_estimators': 1175, 'learning_rate': 0.08344172877412676, 'max_depth': 7, 'min_samples_split': 5, 'min_samples_leaf': 4, 'subsample': 0.7013083684117715, 'max_features': 'log2'}. Best is trial 428 with value: 0.31740361133065975.
[I 2024-12-04 12:30:01,801] Trial 847 finished with value: 0.6092541128901262 and parameters: {'n_estimators': 1367, 'learning_rate': 0.07094582248910047, 'max_depth': 9, 'min_samples_split': 19, 'min_samples_leaf': 10, 'subsample': 0.9835387459973317, 'max_features': 'log2'}. Best is trial 428 with value: 0.31740361133065975.
[I 2024-12-04 12:30:02,638] Trial 844 finished with value: 0.33284327194694663 and parameters: {'n_estimators': 1234, 'learning_rate': 0.09273327185261107, 'max_depth': 8, 'min_samples_split': 6, 'min_samples_leaf': 2, 'subsample': 0.7704000948052647, 'max_features': None}. Best is trial 428 with value: 0.31740361133065975.
[I 2024-12-04 12:30:04,539] Trial 856 finished with value: 0.4316864156925609 and parameters: {'n_estimators': 1069, 'learning_rate': 0.08833236617129576, 'max_depth': 5, 'min_samples_split': 13, 'min_samples_leaf': 1, 'subsample': 0.660601941388802, 'max_features': 'log2'}. Best is trial 428 with value: 0.31740361133065975.
[I 2024-12-04 12:30:06,813] Trial 852 finished with value: 0.3388812157894595 and parameters: {'n_estimators': 1146, 'learning_rate': 0.0654536051099706, 'max_depth': 5, 'min_samples_split': 6, 'min_samples_leaf': 2, 'subsample': 0.8581315328453726, 'max_features': None}. Best is trial 428 with value: 0.31740361133065975.
[I 2024-12-04 12:30:07,533] Trial 859 finished with value: 0.3286895599847081 and parameters: {'n_estimators': 858, 'learning_rate': 0.04349899814199831, 'max_depth': 9, 'min_samples_split': 6, 'min_samples_leaf': 2, 'subsample': 0.6809255476518699, 'max_features': None}. Best is trial 428 with value: 0.31740361133065975.
[I 2024-12-04 12:30:09,045] Trial 843 finished with value: 0.424985717494187 and parameters: {'n_estimators': 1481, 'learning_rate': 0.09679467304931615, 'max_depth': 6, 'min_samples_split': 5, 'min_samples_leaf': 1, 'subsample': 0.9259591929959939, 'max_features': None}. Best is trial 428 with value: 0.31740361133065975.
[I 2024-12-04 12:30:12,672] Trial 863 finished with value: 0.5454183163469635 and parameters: {'n_estimators': 861, 'learning_rate': 0.05347821079329071, 'max_depth': 10, 'min_samples_split': 12, 'min_samples_leaf': 9, 'subsample': 0.9943236865910584, 'max_features': None}. Best is trial 428 with value: 0.31740361133065975.
[I 2024-12-04 12:30:12,721] Trial 857 finished with value: 0.38657235183000677 and parameters: {'n_estimators': 1134, 'learning_rate': 0.06285810060148331, 'max_depth': 7, 'min_samples_split': 3, 'min_samples_leaf': 3, 'subsample': 0.9071910506964227, 'max_features': None}. Best is trial 428 with value: 0.31740361133065975.
[I 2024-12-04 12:30:13,778] Trial 860 finished with value: 0.3776756163984584 and parameters: {'n_estimators': 981, 'learning_rate': 0.09786798504389387, 'max_depth': 8, 'min_samples_split': 8, 'min_samples_leaf': 6, 'subsample': 0.8885824853380986, 'max_features': None}. Best is trial 428 with value: 0.31740361133065975.
[I 2024-12-04 12:30:14,804] Trial 862 finished with value: 0.4072185600017427 and parameters: {'n_estimators': 961, 'learning_rate': 0.09178117926430074, 'max_depth': 9, 'min_samples_split': 6, 'min_samples_leaf': 1, 'subsample': 0.7950521741136118, 'max_features': None}. Best is trial 428 with value: 0.31740361133065975.
[I 2024-12-04 12:30:14,920] Trial 868 finished with value: 0.3236341244434786 and parameters: {'n_estimators': 805, 'learning_rate': 0.06371088719412456, 'max_depth': 8, 'min_samples_split': 6, 'min_samples_leaf': 2, 'subsample': 0.6689255120904563, 'max_features': None}. Best is trial 428 with value: 0.31740361133065975.
[I 2024-12-04 12:30:17,032] Trial 873 finished with value: 0.4472025773167061 and parameters: {'n_estimators': 812, 'learning_rate': 0.08500168974960039, 'max_depth': 9, 'min_samples_split': 6, 'min_samples_leaf': 4, 'subsample': 0.7622719421163276, 'max_features': 'log2'}. Best is trial 428 with value: 0.31740361133065975.
[I 2024-12-04 12:30:17,824] Trial 854 finished with value: 0.3847102744121259 and parameters: {'n_estimators': 1353, 'learning_rate': 0.07108432947077761, 'max_depth': 6, 'min_samples_split': 7, 'min_samples_leaf': 3, 'subsample': 0.8860095985927771, 'max_features': None}. Best is trial 428 with value: 0.31740361133065975.
[I 2024-12-04 12:30:17,836] Trial 869 finished with value: 0.37369525499629946 and parameters: {'n_estimators': 852, 'learning_rate': 0.0733459222040597, 'max_depth': 8, 'min_samples_split': 8, 'min_samples_leaf': 3, 'subsample': 0.8186717615162917, 'max_features': None}. Best is trial 428 with value: 0.31740361133065975.
[I 2024-12-04 12:30:19,518] Trial 861 finished with value: 0.3446987707848803 and parameters: {'n_estimators': 1009, 'learning_rate': 0.08983933538719613, 'max_depth': 10, 'min_samples_split': 7, 'min_samples_leaf': 2, 'subsample': 0.8997451407477675, 'max_features': None}. Best is trial 428 with value: 0.31740361133065975.
[I 2024-12-04 12:30:19,572] Trial 886 finished with value: 0.664757224809424 and parameters: {'n_estimators': 374, 'learning_rate': 0.024678713395598083, 'max_depth': 5, 'min_samples_split': 11, 'min_samples_leaf': 7, 'subsample': 0.6635582321153704, 'max_features': 'sqrt'}. Best is trial 428 with value: 0.31740361133065975.
[I 2024-12-04 12:30:19,805] Trial 865 finished with value: 0.39083878952860657 and parameters: {'n_estimators': 1026, 'learning_rate': 0.09618911757455968, 'max_depth': 8, 'min_samples_split': 7, 'min_samples_leaf': 3, 'subsample': 0.6821470607145804, 'max_features': None}. Best is trial 428 with value: 0.31740361133065975.
[I 2024-12-04 12:30:21,962] Trial 858 finished with value: 0.3411758503538923 and parameters: {'n_estimators': 1400, 'learning_rate': 0.09080190401418016, 'max_depth': 7, 'min_samples_split': 8, 'min_samples_leaf': 2, 'subsample': 0.7712546607317575, 'max_features': None}. Best is trial 428 with value: 0.31740361133065975.
[I 2024-12-04 12:30:23,078] Trial 867 finished with value: 0.397106349619624 and parameters: {'n_estimators': 1293, 'learning_rate': 0.06317166405136784, 'max_depth': 9, 'min_samples_split': 8, 'min_samples_leaf': 2, 'subsample': 0.6907017739624063, 'max_features': 'log2'}. Best is trial 428 with value: 0.31740361133065975.
[I 2024-12-04 12:30:24,974] Trial 866 finished with value: 0.3454741968805043 and parameters: {'n_estimators': 1090, 'learning_rate': 0.09850814686395615, 'max_depth': 8, 'min_samples_split': 3, 'min_samples_leaf': 2, 'subsample': 0.8888304873853905, 'max_features': None}. Best is trial 428 with value: 0.31740361133065975.
