[I 2024-12-04 13:29:26,542] Trial 1943 finished with value: 0.3031315617472616 and parameters: {'n_estimators': 805, 'learning_rate': 0.04766343038966618, 'max_depth': 7, 'min_samples_split': 15, 'min_samples_leaf': 2, 'subsample': 0.9368742664593479, 'max_features': 'sqrt'}. Best is trial 1389 with value: 0.22332552856343169.
[I 2024-12-04 13:29:29,289] Trial 1933 finished with value: 0.24716993909930735 and parameters: {'n_estimators': 1256, 'learning_rate': 0.099744775874282, 'max_depth': 7, 'min_samples_split': 2, 'min_samples_leaf': 1, 'subsample': 0.8699530239975601, 'max_features': 'sqrt'}. Best is trial 1389 with value: 0.22332552856343169.
[I 2024-12-04 13:29:29,422] Trial 1949 finished with value: 1.06986707331245 and parameters: {'n_estimators': 643, 'learning_rate': 0.01367875049108687, 'max_depth': 6, 'min_samples_split': 11, 'min_samples_leaf': 8, 'subsample': 0.7455186743563563, 'max_features': 'log2'}. Best is trial 1389 with value: 0.22332552856343169.
[I 2024-12-04 13:29:36,365] Trial 1938 finished with value: 0.24947064804292646 and parameters: {'n_estimators': 1210, 'learning_rate': 0.0966799084073999, 'max_depth': 7, 'min_samples_split': 10, 'min_samples_leaf': 1, 'subsample': 0.8794116932132068, 'max_features': 'sqrt'}. Best is trial 1389 with value: 0.22332552856343169.
[I 2024-12-04 13:29:36,388] Trial 1936 finished with value: 0.2751678302986339 and parameters: {'n_estimators': 1266, 'learning_rate': 0.07611613846196677, 'max_depth': 5, 'min_samples_split': 2, 'min_samples_leaf': 1, 'subsample': 0.7195417744493064, 'max_features': 'sqrt'}. Best is trial 1389 with value: 0.22332552856343169.
[I 2024-12-04 13:29:39,755] Trial 1937 finished with value: 0.34400296877154884 and parameters: {'n_estimators': 1291, 'learning_rate': 0.08886036377662754, 'max_depth': 4, 'min_samples_split': 2, 'min_samples_leaf': 3, 'subsample': 0.7638823825382084, 'max_features': 'sqrt'}. Best is trial 1389 with value: 0.22332552856343169.
[I 2024-12-04 13:29:43,626] Trial 1939 finished with value: 0.35854871660878157 and parameters: {'n_estimators': 1307, 'learning_rate': 0.07290865697050028, 'max_depth': 8, 'min_samples_split': 4, 'min_samples_leaf': 3, 'subsample': 0.86054226946064, 'max_features': 'sqrt'}. Best is trial 1389 with value: 0.22332552856343169.
[I 2024-12-04 13:29:43,657] Trial 1945 finished with value: 0.2938570271967374 and parameters: {'n_estimators': 1013, 'learning_rate': 0.09478209826992187, 'max_depth': 7, 'min_samples_split': 4, 'min_samples_leaf': 2, 'subsample': 0.9829699723823315, 'max_features': 'sqrt'}. Best is trial 1389 with value: 0.22332552856343169.
[I 2024-12-04 13:29:45,897] Trial 1948 finished with value: 0.7924915751339598 and parameters: {'n_estimators': 894, 'learning_rate': 0.0286206119709967, 'max_depth': 4, 'min_samples_split': 4, 'min_samples_leaf': 6, 'subsample': 0.6275956458491433, 'max_features': 'log2'}. Best is trial 1389 with value: 0.22332552856343169.
[I 2024-12-04 13:29:48,975] Trial 1934 finished with value: 0.3678363985842272 and parameters: {'n_estimators': 1500, 'learning_rate': 0.011509655772357595, 'max_depth': 12, 'min_samples_split': 13, 'min_samples_leaf': 3, 'subsample': 0.8428993433508783, 'max_features': 'sqrt'}. Best is trial 1389 with value: 0.22332552856343169.
[I 2024-12-04 13:29:52,516] Trial 1962 finished with value: 1.0557325604858159 and parameters: {'n_estimators': 453, 'learning_rate': 0.031930362940521005, 'max_depth': 12, 'min_samples_split': 18, 'min_samples_leaf': 9, 'subsample': 0.692235390754991, 'max_features': 'log2'}. Best is trial 1389 with value: 0.22332552856343169.
[I 2024-12-04 13:29:55,714] Trial 1942 finished with value: 0.23762054072479963 and parameters: {'n_estimators': 1243, 'learning_rate': 0.06303600999153017, 'max_depth': 8, 'min_samples_split': 4, 'min_samples_leaf': 1, 'subsample': 0.7529947595793014, 'max_features': 'sqrt'}. Best is trial 1389 with value: 0.22332552856343169.
[I 2024-12-04 13:29:57,980] Trial 1946 finished with value: 0.2549029352699395 and parameters: {'n_estimators': 1173, 'learning_rate': 0.09050595893467507, 'max_depth': 8, 'min_samples_split': 4, 'min_samples_leaf': 1, 'subsample': 0.978673519270664, 'max_features': 'sqrt'}. Best is trial 1389 with value: 0.22332552856343169.
[I 2024-12-04 13:30:01,663] Trial 1973 finished with value: 0.4944959158999351 and parameters: {'n_estimators': 165, 'learning_rate': 0.01717882756272532, 'max_depth': 4, 'min_samples_split': 6, 'min_samples_leaf': 7, 'subsample': 0.8871620621298315, 'max_features': None}. Best is trial 1389 with value: 0.22332552856343169.
[I 2024-12-04 13:30:05,071] Trial 1957 finished with value: 0.4200119691676102 and parameters: {'n_estimators': 698, 'learning_rate': 0.08082434517855999, 'max_depth': 7, 'min_samples_split': 3, 'min_samples_leaf': 3, 'subsample': 0.9012216290385673, 'max_features': None}. Best is trial 1389 with value: 0.22332552856343169.
[I 2024-12-04 13:30:06,768] Trial 1953 finished with value: 0.2689340125558183 and parameters: {'n_estimators': 959, 'learning_rate': 0.05489664526127713, 'max_depth': 7, 'min_samples_split': 5, 'min_samples_leaf': 1, 'subsample': 0.8621045866218079, 'max_features': 'sqrt'}. Best is trial 1389 with value: 0.22332552856343169.
[I 2024-12-04 13:30:08,023] Trial 1950 finished with value: 0.3205596364277155 and parameters: {'n_estimators': 1015, 'learning_rate': 0.06971022007543147, 'max_depth': 6, 'min_samples_split': 3, 'min_samples_leaf': 1, 'subsample': 0.9348843397738636, 'max_features': None}. Best is trial 1389 with value: 0.22332552856343169.
[I 2024-12-04 13:30:10,673] Trial 1941 finished with value: 0.2595839411583297 and parameters: {'n_estimators': 1478, 'learning_rate': 0.04291912902798746, 'max_depth': 10, 'min_samples_split': 4, 'min_samples_leaf': 1, 'subsample': 0.6723559932248945, 'max_features': 'log2'}. Best is trial 1389 with value: 0.22332552856343169.
[I 2024-12-04 13:30:11,115] Trial 1951 finished with value: 0.3587860503773814 and parameters: {'n_estimators': 1100, 'learning_rate': 0.053232056476202355, 'max_depth': 5, 'min_samples_split': 2, 'min_samples_leaf': 3, 'subsample': 0.8764630997172058, 'max_features': 'sqrt'}. Best is trial 1389 with value: 0.22332552856343169.
[I 2024-12-04 13:30:14,428] Trial 1956 finished with value: 0.2976217920115933 and parameters: {'n_estimators': 978, 'learning_rate': 0.05315966379520163, 'max_depth': 5, 'min_samples_split': 7, 'min_samples_leaf': 1, 'subsample': 0.9200443617643912, 'max_features': 'sqrt'}. Best is trial 1389 with value: 0.22332552856343169.
[I 2024-12-04 13:30:16,602] Trial 1944 finished with value: 0.23761317703924062 and parameters: {'n_estimators': 1427, 'learning_rate': 0.06517117280000709, 'max_depth': 7, 'min_samples_split': 6, 'min_samples_leaf': 1, 'subsample': 0.8222504383084688, 'max_features': 'sqrt'}. Best is trial 1389 with value: 0.22332552856343169.
[I 2024-12-04 13:30:18,811] Trial 1947 finished with value: 0.36422039877055545 and parameters: {'n_estimators': 1374, 'learning_rate': 0.0991113020178953, 'max_depth': 6, 'min_samples_split': 3, 'min_samples_leaf': 3, 'subsample': 0.7894873467699528, 'max_features': 'sqrt'}. Best is trial 1389 with value: 0.22332552856343169.
[I 2024-12-04 13:30:20,699] Trial 1954 finished with value: 0.34824818576078614 and parameters: {'n_estimators': 948, 'learning_rate': 0.054663627187595314, 'max_depth': 8, 'min_samples_split': 3, 'min_samples_leaf': 1, 'subsample': 0.9009565571174226, 'max_features': None}. Best is trial 1389 with value: 0.22332552856343169.
[I 2024-12-04 13:30:22,920] Trial 1961 finished with value: 0.3660574468466773 and parameters: {'n_estimators': 916, 'learning_rate': 0.0842281835368651, 'max_depth': 6, 'min_samples_split': 2, 'min_samples_leaf': 4, 'subsample': 0.9174775886677453, 'max_features': 'sqrt'}. Best is trial 1389 with value: 0.22332552856343169.
[I 2024-12-04 13:30:23,012] Trial 1958 finished with value: 0.29064101695108585 and parameters: {'n_estimators': 929, 'learning_rate': 0.058563064780739374, 'max_depth': 9, 'min_samples_split': 2, 'min_samples_leaf': 2, 'subsample': 0.941629074866766, 'max_features': 'sqrt'}. Best is trial 1389 with value: 0.22332552856343169.
[I 2024-12-04 13:30:27,124] Trial 1964 finished with value: 0.2873726583886469 and parameters: {'n_estimators': 856, 'learning_rate': 0.06038030226844481, 'max_depth': 7, 'min_samples_split': 4, 'min_samples_leaf': 2, 'subsample': 0.955440427217717, 'max_features': 'sqrt'}. Best is trial 1389 with value: 0.22332552856343169.
[I 2024-12-04 13:30:29,246] Trial 1959 finished with value: 0.24654952599587004 and parameters: {'n_estimators': 1103, 'learning_rate': 0.09839995164924915, 'max_depth': 6, 'min_samples_split': 2, 'min_samples_leaf': 1, 'subsample': 0.9967232208667193, 'max_features': 'sqrt'}. Best is trial 1389 with value: 0.22332552856343169.
[I 2024-12-04 13:30:29,851] Trial 1972 finished with value: 0.2677982288800315 and parameters: {'n_estimators': 591, 'learning_rate': 0.09955434231400773, 'max_depth': 9, 'min_samples_split': 4, 'min_samples_leaf': 1, 'subsample': 0.8472532312075796, 'max_features': 'sqrt'}. Best is trial 1389 with value: 0.22332552856343169.
[I 2024-12-04 13:30:31,432] Trial 1955 finished with value: 0.25115770107690155 and parameters: {'n_estimators': 1205, 'learning_rate': 0.09178919365104388, 'max_depth': 8, 'min_samples_split': 2, 'min_samples_leaf': 1, 'subsample': 0.9782628646680768, 'max_features': 'sqrt'}. Best is trial 1389 with value: 0.22332552856343169.
[I 2024-12-04 13:30:32,495] Trial 1952 finished with value: 0.325013321291689 and parameters: {'n_estimators': 1281, 'learning_rate': 0.04712973368287697, 'max_depth': 11, 'min_samples_split': 3, 'min_samples_leaf': 1, 'subsample': 0.6184494713718007, 'max_features': None}. Best is trial 1389 with value: 0.22332552856343169.
[I 2024-12-04 13:30:38,648] Trial 1969 finished with value: 0.27466303817909116 and parameters: {'n_estimators': 915, 'learning_rate': 0.06932765217475395, 'max_depth': 8, 'min_samples_split': 2, 'min_samples_leaf': 1, 'subsample': 0.9606751154016815, 'max_features': 'sqrt'}. Best is trial 1389 with value: 0.22332552856343169.
[I 2024-12-04 13:30:41,622] Trial 1960 finished with value: 0.2419333804215769 and parameters: {'n_estimators': 1198, 'learning_rate': 0.09430221155322743, 'max_depth': 7, 'min_samples_split': 5, 'min_samples_leaf': 1, 'subsample': 0.9351690113551278, 'max_features': 'sqrt'}. Best is trial 1389 with value: 0.22332552856343169.
[I 2024-12-04 13:30:47,319] Trial 1968 finished with value: 0.25442127104460094 and parameters: {'n_estimators': 1024, 'learning_rate': 0.08058647638664487, 'max_depth': 8, 'min_samples_split': 2, 'min_samples_leaf': 1, 'subsample': 0.956888604237672, 'max_features': 'sqrt'}. Best is trial 1389 with value: 0.22332552856343169.
[I 2024-12-04 13:30:50,187] Trial 1983 finished with value: 0.27526560896493624 and parameters: {'n_estimators': 413, 'learning_rate': 0.06738056561155997, 'max_depth': 8, 'min_samples_split': 2, 'min_samples_leaf': 1, 'subsample': 0.8490865428564064, 'max_features': 'sqrt'}. Best is trial 1389 with value: 0.22332552856343169.
[I 2024-12-04 13:30:50,335] Trial 1965 finished with value: 0.42088266883266157 and parameters: {'n_estimators': 1270, 'learning_rate': 0.08747587066346987, 'max_depth': 7, 'min_samples_split': 14, 'min_samples_leaf': 7, 'subsample': 0.8799557905598833, 'max_features': 'log2'}. Best is trial 1389 with value: 0.22332552856343169.
[I 2024-12-04 13:30:53,668] Trial 1977 finished with value: 0.3075179059690433 and parameters: {'n_estimators': 840, 'learning_rate': 0.08913218404675784, 'max_depth': 7, 'min_samples_split': 7, 'min_samples_leaf': 2, 'subsample': 0.9704326398051091, 'max_features': 'log2'}. Best is trial 1389 with value: 0.22332552856343169.
[I 2024-12-04 13:30:56,202] Trial 1966 finished with value: 0.2784692573501698 and parameters: {'n_estimators': 1322, 'learning_rate': 0.08576613678884748, 'max_depth': 6, 'min_samples_split': 3, 'min_samples_leaf': 1, 'subsample': 0.9658795508997189, 'max_features': 'log2'}. Best is trial 1389 with value: 0.22332552856343169.
[I 2024-12-04 13:30:57,552] Trial 1971 finished with value: 0.2738047909703901 and parameters: {'n_estimators': 1068, 'learning_rate': 0.0603178939043602, 'max_depth': 7, 'min_samples_split': 5, 'min_samples_leaf': 2, 'subsample': 0.89880307922602, 'max_features': 'sqrt'}. Best is trial 1389 with value: 0.22332552856343169.
[I 2024-12-04 13:31:03,239] Trial 1963 finished with value: 0.2978369054693186 and parameters: {'n_estimators': 1378, 'learning_rate': 0.08769014564406652, 'max_depth': 12, 'min_samples_split': 2, 'min_samples_leaf': 2, 'subsample': 0.7197899828143812, 'max_features': 'sqrt'}. Best is trial 1389 with value: 0.22332552856343169.
[I 2024-12-04 13:31:04,171] Trial 1978 finished with value: 0.2802354057031047 and parameters: {'n_estimators': 925, 'learning_rate': 0.06586357850017364, 'max_depth': 6, 'min_samples_split': 5, 'min_samples_leaf': 1, 'subsample': 0.943719194923698, 'max_features': 'sqrt'}. Best is trial 1389 with value: 0.22332552856343169.
[I 2024-12-04 13:31:04,189] Trial 1994 finished with value: 0.8198700255611532 and parameters: {'n_estimators': 249, 'learning_rate': 0.08358987854103084, 'max_depth': 3, 'min_samples_split': 4, 'min_samples_leaf': 2, 'subsample': 0.817309530370775, 'max_features': 'log2'}. Best is trial 1389 with value: 0.22332552856343169.
[I 2024-12-04 13:31:08,034] Trial 1986 finished with value: 0.4709053271023796 and parameters: {'n_estimators': 594, 'learning_rate': 0.07413035291752801, 'max_depth': 12, 'min_samples_split': 18, 'min_samples_leaf': 10, 'subsample': 0.7768638250359733, 'max_features': None}. Best is trial 1389 with value: 0.22332552856343169.
[I 2024-12-04 13:31:08,049] Trial 1970 finished with value: 0.297389817556437 and parameters: {'n_estimators': 1247, 'learning_rate': 0.05417653113846987, 'max_depth': 6, 'min_samples_split': 6, 'min_samples_leaf': 2, 'subsample': 0.6702375292475011, 'max_features': 'sqrt'}. Best is trial 1389 with value: 0.22332552856343169.
[I 2024-12-04 13:31:08,056] Trial 1974 finished with value: 0.24429309093834753 and parameters: {'n_estimators': 1099, 'learning_rate': 0.06570163166198358, 'max_depth': 6, 'min_samples_split': 3, 'min_samples_leaf': 1, 'subsample': 0.9158099659512414, 'max_features': 'sqrt'}. Best is trial 1389 with value: 0.22332552856343169.
[I 2024-12-04 13:31:10,450] Trial 1967 finished with value: 0.2703215906084861 and parameters: {'n_estimators': 1424, 'learning_rate': 0.0620461658018152, 'max_depth': 10, 'min_samples_split': 2, 'min_samples_leaf': 1, 'subsample': 0.7175709550873349, 'max_features': 'sqrt'}. Best is trial 1389 with value: 0.22332552856343169.
[I 2024-12-04 13:31:15,013] Trial 1979 finished with value: 0.34552784363324424 and parameters: {'n_estimators': 1054, 'learning_rate': 0.08080877856015796, 'max_depth': 8, 'min_samples_split': 6, 'min_samples_leaf': 3, 'subsample': 0.7132985892664181, 'max_features': 'sqrt'}. Best is trial 1389 with value: 0.22332552856343169.
[I 2024-12-04 13:31:16,802] Trial 1975 finished with value: 0.3646026339825886 and parameters: {'n_estimators': 1224, 'learning_rate': 0.06497479401022306, 'max_depth': 6, 'min_samples_split': 2, 'min_samples_leaf': 3, 'subsample': 0.8349315772857885, 'max_features': 'sqrt'}. Best is trial 1389 with value: 0.22332552856343169.
[I 2024-12-04 13:31:21,308] Trial 1976 finished with value: 0.2881761430363244 and parameters: {'n_estimators': 1246, 'learning_rate': 0.0685617885525182, 'max_depth': 6, 'min_samples_split': 2, 'min_samples_leaf': 2, 'subsample': 0.8431843616744763, 'max_features': 'sqrt'}. Best is trial 1389 with value: 0.22332552856343169.
[I 2024-12-04 13:31:22,749] Trial 1980 finished with value: 0.2373479625210748 and parameters: {'n_estimators': 1133, 'learning_rate': 0.07721348674255123, 'max_depth': 12, 'min_samples_split': 5, 'min_samples_leaf': 1, 'subsample': 0.6783941872320359, 'max_features': 'sqrt'}. Best is trial 1389 with value: 0.22332552856343169.
[I 2024-12-04 13:31:27,351] Trial 1988 finished with value: 0.27369196866970713 and parameters: {'n_estimators': 853, 'learning_rate': 0.09933744165462537, 'max_depth': 8, 'min_samples_split': 6, 'min_samples_leaf': 1, 'subsample': 0.8577589533481894, 'max_features': 'sqrt'}. Best is trial 1389 with value: 0.22332552856343169.
[I 2024-12-04 13:31:29,568] Trial 1985 finished with value: 0.30184653614368623 and parameters: {'n_estimators': 1078, 'learning_rate': 0.04461510975754379, 'max_depth': 5, 'min_samples_split': 4, 'min_samples_leaf': 2, 'subsample': 0.970209743162149, 'max_features': 'sqrt'}. Best is trial 1389 with value: 0.22332552856343169.
[I 2024-12-04 13:31:34,230] Trial 2009 finished with value: 0.9660902602371226 and parameters: {'n_estimators': 122, 'learning_rate': 0.03978658392912942, 'max_depth': 4, 'min_samples_split': 3, 'min_samples_leaf': 1, 'subsample': 0.6122427526525743, 'max_features': 'log2'}. Best is trial 1389 with value: 0.22332552856343169.
[I 2024-12-04 13:31:35,823] Trial 1984 finished with value: 0.28701158448781344 and parameters: {'n_estimators': 1114, 'learning_rate': 0.06679010911947104, 'max_depth': 7, 'min_samples_split': 5, 'min_samples_leaf': 2, 'subsample': 0.6681894247682582, 'max_features': 'sqrt'}. Best is trial 1389 with value: 0.22332552856343169.
[I 2024-12-04 13:31:41,029] Trial 1993 finished with value: 0.5024633741941766 and parameters: {'n_estimators': 833, 'learning_rate': 0.09351979048992787, 'max_depth': 10, 'min_samples_split': 4, 'min_samples_leaf': 8, 'subsample': 0.9050412031888057, 'max_features': 'log2'}. Best is trial 1389 with value: 0.22332552856343169.
[I 2024-12-04 13:31:44,222] Trial 1981 finished with value: 0.27444639297985207 and parameters: {'n_estimators': 1444, 'learning_rate': 0.05213105918099154, 'max_depth': 7, 'min_samples_split': 3, 'min_samples_leaf': 1, 'subsample': 0.8945509814843216, 'max_features': 'log2'}. Best is trial 1389 with value: 0.22332552856343169.
[I 2024-12-04 13:31:44,353] Trial 1982 finished with value: 0.42443974681329216 and parameters: {'n_estimators': 1414, 'learning_rate': 0.07788012968859466, 'max_depth': 12, 'min_samples_split': 2, 'min_samples_leaf': 8, 'subsample': 0.7850996194754105, 'max_features': 'sqrt'}. Best is trial 1389 with value: 0.22332552856343169.
[I 2024-12-04 13:31:48,594] Trial 1987 finished with value: 0.2596099143349933 and parameters: {'n_estimators': 1187, 'learning_rate': 0.07405872015297242, 'max_depth': 7, 'min_samples_split': 7, 'min_samples_leaf': 1, 'subsample': 0.7415086325521869, 'max_features': 'sqrt'}. Best is trial 1389 with value: 0.22332552856343169.
[I 2024-12-04 13:31:55,598] Trial 1990 finished with value: 0.2550110638102752 and parameters: {'n_estimators': 1215, 'learning_rate': 0.0717806541200681, 'max_depth': 6, 'min_samples_split': 6, 'min_samples_leaf': 1, 'subsample': 0.8059228876017924, 'max_features': 'sqrt'}. Best is trial 1389 with value: 0.22332552856343169.
[I 2024-12-04 13:31:58,781] Trial 1989 finished with value: 0.476088186823216 and parameters: {'n_estimators': 1226, 'learning_rate': 0.07573200889720266, 'max_depth': 11, 'min_samples_split': 4, 'min_samples_leaf': 10, 'subsample': 0.6937862882761487, 'max_features': None}. Best is trial 1389 with value: 0.22332552856343169.
[I 2024-12-04 13:32:00,539] Trial 1991 finished with value: 1.0559158490104703 and parameters: {'n_estimators': 1245, 'learning_rate': 0.010024968410404428, 'max_depth': 6, 'min_samples_split': 16, 'min_samples_leaf': 10, 'subsample': 0.684664312388089, 'max_features': 'log2'}. Best is trial 1389 with value: 0.22332552856343169.
[I 2024-12-04 13:32:07,028] Trial 1998 finished with value: 0.4010860825966097 and parameters: {'n_estimators': 1053, 'learning_rate': 0.05759963908056681, 'max_depth': 4, 'min_samples_split': 9, 'min_samples_leaf': 4, 'subsample': 0.7616256356814406, 'max_features': None}. Best is trial 1389 with value: 0.22332552856343169.
[I 2024-12-04 13:32:09,162] Trial 1992 finished with value: 0.24517492399650048 and parameters: {'n_estimators': 1324, 'learning_rate': 0.04205655510935198, 'max_depth': 6, 'min_samples_split': 2, 'min_samples_leaf': 1, 'subsample': 0.7084387036436467, 'max_features': 'sqrt'}. Best is trial 1389 with value: 0.22332552856343169.
[I 2024-12-04 13:32:13,482] Trial 1996 finished with value: 0.3512483223394973 and parameters: {'n_estimators': 1273, 'learning_rate': 0.06887362702850414, 'max_depth': 6, 'min_samples_split': 8, 'min_samples_leaf': 3, 'subsample': 0.8605563728153072, 'max_features': 'sqrt'}. Best is trial 1389 with value: 0.22332552856343169.
[I 2024-12-04 13:32:16,480] Trial 1995 finished with value: 0.391877841009672 and parameters: {'n_estimators': 1301, 'learning_rate': 0.018715533357191862, 'max_depth': 12, 'min_samples_split': 2, 'min_samples_leaf': 6, 'subsample': 0.8245458907273734, 'max_features': 'sqrt'}. Best is trial 1389 with value: 0.22332552856343169.
[I 2024-12-04 13:32:16,504] Trial 2007 finished with value: 0.27136548637422525 and parameters: {'n_estimators': 916, 'learning_rate': 0.05890962151583308, 'max_depth': 7, 'min_samples_split': 2, 'min_samples_leaf': 1, 'subsample': 0.9054288629728791, 'max_features': 'sqrt'}. Best is trial 1389 with value: 0.22332552856343169.
[I 2024-12-04 13:32:19,196] Trial 2004 finished with value: 0.2701916978710211 and parameters: {'n_estimators': 1050, 'learning_rate': 0.0633563280471866, 'max_depth': 6, 'min_samples_split': 2, 'min_samples_leaf': 1, 'subsample': 0.9835406782391232, 'max_features': 'sqrt'}. Best is trial 1389 with value: 0.22332552856343169.
