[I 2024-12-04 19:56:19,336] Trial 324 finished with value: 0.6864066812568447 and parameters: {'n_estimators': 981, 'max_depth': 40, 'min_samples_split': 4, 'min_samples_leaf': 2, 'max_features': 'sqrt', 'bootstrap': False, 'criterion': 'squared_error'}. Best is trial 193 with value: 0.3224133091717219.
[I 2024-12-04 19:56:20,723] Trial 326 finished with value: 0.3236326678212457 and parameters: {'n_estimators': 317, 'max_depth': 50, 'min_samples_split': 2, 'min_samples_leaf': 1, 'max_features': 'sqrt', 'bootstrap': False, 'criterion': 'squared_error'}. Best is trial 193 with value: 0.3224133091717219.
[I 2024-12-04 19:56:22,009] Trial 327 finished with value: 1.2750991021866258 and parameters: {'n_estimators': 931, 'max_depth': 50, 'min_samples_split': 41, 'min_samples_leaf': 11, 'max_features': 'sqrt', 'bootstrap': False, 'criterion': 'absolute_error'}. Best is trial 193 with value: 0.3224133091717219.
[I 2024-12-04 19:56:22,220] Trial 328 finished with value: 0.36741257398065613 and parameters: {'n_estimators': 266, 'max_depth': 39, 'min_samples_split': 2, 'min_samples_leaf': 1, 'max_features': 'sqrt', 'bootstrap': False, 'criterion': 'squared_error'}. Best is trial 193 with value: 0.3224133091717219.
[I 2024-12-04 19:56:23,261] Trial 329 finished with value: 0.6645657234632257 and parameters: {'n_estimators': 247, 'max_depth': 50, 'min_samples_split': 2, 'min_samples_leaf': 2, 'max_features': 'sqrt', 'bootstrap': False, 'criterion': 'squared_error'}. Best is trial 193 with value: 0.3224133091717219.
[I 2024-12-04 19:56:24,719] Trial 330 finished with value: 0.3233522130985557 and parameters: {'n_estimators': 410, 'max_depth': 50, 'min_samples_split': 2, 'min_samples_leaf': 1, 'max_features': 'sqrt', 'bootstrap': False, 'criterion': 'squared_error'}. Best is trial 193 with value: 0.3224133091717219.
[I 2024-12-04 19:56:25,946] Trial 332 finished with value: 0.5785247839683985 and parameters: {'n_estimators': 235, 'max_depth': 44, 'min_samples_split': 2, 'min_samples_leaf': 1, 'max_features': 'log2', 'bootstrap': True, 'criterion': 'squared_error'}. Best is trial 193 with value: 0.3224133091717219.
[I 2024-12-04 19:56:27,619] Trial 333 finished with value: 0.32407929059421764 and parameters: {'n_estimators': 299, 'max_depth': 49, 'min_samples_split': 2, 'min_samples_leaf': 1, 'max_features': 'sqrt', 'bootstrap': False, 'criterion': 'squared_error'}. Best is trial 193 with value: 0.3224133091717219.
[I 2024-12-04 19:56:28,800] Trial 334 finished with value: 1.060272487620574 and parameters: {'n_estimators': 349, 'max_depth': 49, 'min_samples_split': 5, 'min_samples_leaf': 2, 'max_features': 'log2', 'bootstrap': False, 'criterion': 'squared_error'}. Best is trial 193 with value: 0.3224133091717219.
[I 2024-12-04 19:56:30,170] Trial 325 finished with value: 0.8839093059597266 and parameters: {'n_estimators': 861, 'max_depth': 46, 'min_samples_split': 4, 'min_samples_leaf': 2, 'max_features': 'sqrt', 'bootstrap': False, 'criterion': 'absolute_error'}. Best is trial 193 with value: 0.3224133091717219.
[I 2024-12-04 19:56:30,970] Trial 335 finished with value: 0.3340611688869329 and parameters: {'n_estimators': 389, 'max_depth': 48, 'min_samples_split': 2, 'min_samples_leaf': 1, 'max_features': 'sqrt', 'bootstrap': False, 'criterion': 'squared_error'}. Best is trial 193 with value: 0.3224133091717219.
[I 2024-12-04 19:56:32,214] Trial 336 finished with value: 0.33133868872402694 and parameters: {'n_estimators': 357, 'max_depth': 48, 'min_samples_split': 2, 'min_samples_leaf': 1, 'max_features': 'sqrt', 'bootstrap': False, 'criterion': 'squared_error'}. Best is trial 193 with value: 0.3224133091717219.
[I 2024-12-04 19:56:33,100] Trial 331 finished with value: 0.9650667342662972 and parameters: {'n_estimators': 929, 'max_depth': 50, 'min_samples_split': 43, 'min_samples_leaf': 1, 'max_features': 'log2', 'bootstrap': True, 'criterion': 'absolute_error'}. Best is trial 193 with value: 0.3224133091717219.
[I 2024-12-04 19:56:33,120] Trial 338 finished with value: 1.0500339554421745 and parameters: {'n_estimators': 279, 'max_depth': 46, 'min_samples_split': 2, 'min_samples_leaf': 2, 'max_features': 'log2', 'bootstrap': False, 'criterion': 'squared_error'}. Best is trial 193 with value: 0.3224133091717219.
[I 2024-12-04 19:56:33,348] Trial 337 finished with value: 0.32455827241470087 and parameters: {'n_estimators': 431, 'max_depth': 50, 'min_samples_split': 2, 'min_samples_leaf': 1, 'max_features': 'sqrt', 'bootstrap': False, 'criterion': 'squared_error'}. Best is trial 193 with value: 0.3224133091717219.
[I 2024-12-04 19:56:35,105] Trial 340 finished with value: 1.2607788754870677 and parameters: {'n_estimators': 936, 'max_depth': 17, 'min_samples_split': 39, 'min_samples_leaf': 7, 'max_features': 'log2', 'bootstrap': False, 'criterion': 'squared_error'}. Best is trial 193 with value: 0.3224133091717219.
[I 2024-12-04 19:56:35,633] Trial 341 finished with value: 0.3883352394605009 and parameters: {'n_estimators': 423, 'max_depth': 50, 'min_samples_split': 4, 'min_samples_leaf': 1, 'max_features': 'sqrt', 'bootstrap': False, 'criterion': 'squared_error'}. Best is trial 193 with value: 0.3224133091717219.
[I 2024-12-04 19:56:36,104] Trial 339 finished with value: 0.32436908846410367 and parameters: {'n_estimators': 426, 'max_depth': 50, 'min_samples_split': 2, 'min_samples_leaf': 1, 'max_features': 'sqrt', 'bootstrap': False, 'criterion': 'squared_error'}. Best is trial 193 with value: 0.3224133091717219.
[I 2024-12-04 19:56:38,265] Trial 344 finished with value: 0.3238915190966349 and parameters: {'n_estimators': 359, 'max_depth': 50, 'min_samples_split': 2, 'min_samples_leaf': 1, 'max_features': 'sqrt', 'bootstrap': False, 'criterion': 'squared_error'}. Best is trial 193 with value: 0.3224133091717219.
[I 2024-12-04 19:56:41,246] Trial 342 finished with value: 1.2582084336144643 and parameters: {'n_estimators': 971, 'max_depth': 9, 'min_samples_split': 33, 'min_samples_leaf': 1, 'max_features': 'log2', 'bootstrap': True, 'criterion': 'absolute_error'}. Best is trial 193 with value: 0.3224133091717219.
[I 2024-12-04 19:56:42,493] Trial 346 finished with value: 0.6876942187572423 and parameters: {'n_estimators': 419, 'max_depth': 49, 'min_samples_split': 2, 'min_samples_leaf': 2, 'max_features': 'sqrt', 'bootstrap': False, 'criterion': 'squared_error'}. Best is trial 193 with value: 0.3224133091717219.
[I 2024-12-04 19:56:44,620] Trial 345 finished with value: 1.0104496088008623 and parameters: {'n_estimators': 421, 'max_depth': 16, 'min_samples_split': 2, 'min_samples_leaf': 2, 'max_features': 'sqrt', 'bootstrap': False, 'criterion': 'absolute_error'}. Best is trial 193 with value: 0.3224133091717219.
[I 2024-12-04 19:56:46,382] Trial 348 finished with value: 0.3245654012244244 and parameters: {'n_estimators': 299, 'max_depth': 50, 'min_samples_split': 2, 'min_samples_leaf': 1, 'max_features': 'sqrt', 'bootstrap': False, 'criterion': 'squared_error'}. Best is trial 193 with value: 0.3224133091717219.
[I 2024-12-04 19:56:48,316] Trial 349 finished with value: 0.3233051337543817 and parameters: {'n_estimators': 364, 'max_depth': 50, 'min_samples_split': 2, 'min_samples_leaf': 1, 'max_features': 'sqrt', 'bootstrap': False, 'criterion': 'squared_error'}. Best is trial 193 with value: 0.3224133091717219.
[I 2024-12-04 19:56:50,412] Trial 350 finished with value: 0.3261218746546039 and parameters: {'n_estimators': 433, 'max_depth': 49, 'min_samples_split': 2, 'min_samples_leaf': 1, 'max_features': 'sqrt', 'bootstrap': False, 'criterion': 'squared_error'}. Best is trial 193 with value: 0.3224133091717219.
[I 2024-12-04 19:56:52,168] Trial 351 finished with value: 0.3235267978441661 and parameters: {'n_estimators': 332, 'max_depth': 50, 'min_samples_split': 2, 'min_samples_leaf': 1, 'max_features': 'sqrt', 'bootstrap': False, 'criterion': 'squared_error'}. Best is trial 193 with value: 0.3224133091717219.
[I 2024-12-04 19:56:52,420] Trial 343 finished with value: 0.6533902627660957 and parameters: {'n_estimators': 830, 'max_depth': 44, 'min_samples_split': 3, 'min_samples_leaf': 14, 'max_features': None, 'bootstrap': False, 'criterion': 'absolute_error'}. Best is trial 193 with value: 0.3224133091717219.
[I 2024-12-04 19:56:53,486] Trial 352 finished with value: 0.6586991550595043 and parameters: {'n_estimators': 177, 'max_depth': 5, 'min_samples_split': 46, 'min_samples_leaf': 3, 'max_features': None, 'bootstrap': True, 'criterion': 'squared_error'}. Best is trial 193 with value: 0.3224133091717219.
[I 2024-12-04 19:56:53,953] Trial 353 finished with value: 0.8705780484440713 and parameters: {'n_estimators': 443, 'max_depth': 19, 'min_samples_split': 8, 'min_samples_leaf': 2, 'max_features': 'sqrt', 'bootstrap': True, 'criterion': 'squared_error'}. Best is trial 193 with value: 0.3224133091717219.
[I 2024-12-04 19:56:54,535] Trial 347 finished with value: 0.4722358071426607 and parameters: {'n_estimators': 174, 'max_depth': 25, 'min_samples_split': 9, 'min_samples_leaf': 1, 'max_features': None, 'bootstrap': True, 'criterion': 'absolute_error'}. Best is trial 193 with value: 0.3224133091717219.
[I 2024-12-04 19:56:55,338] Trial 354 finished with value: 0.37823669149346323 and parameters: {'n_estimators': 186, 'max_depth': 49, 'min_samples_split': 2, 'min_samples_leaf': 1, 'max_features': 'sqrt', 'bootstrap': True, 'criterion': 'squared_error'}. Best is trial 193 with value: 0.3224133091717219.
[I 2024-12-04 19:56:56,102] Trial 356 finished with value: 0.6921465193439449 and parameters: {'n_estimators': 424, 'max_depth': 41, 'min_samples_split': 3, 'min_samples_leaf': 2, 'max_features': 'sqrt', 'bootstrap': False, 'criterion': 'squared_error'}. Best is trial 193 with value: 0.3224133091717219.
[I 2024-12-04 19:56:56,824] Trial 357 finished with value: 0.3250061805821056 and parameters: {'n_estimators': 204, 'max_depth': 50, 'min_samples_split': 2, 'min_samples_leaf': 1, 'max_features': 'sqrt', 'bootstrap': False, 'criterion': 'squared_error'}. Best is trial 193 with value: 0.3224133091717219.
[I 2024-12-04 19:56:58,295] Trial 355 finished with value: 0.5373578943674554 and parameters: {'n_estimators': 529, 'max_depth': 42, 'min_samples_split': 2, 'min_samples_leaf': 2, 'max_features': None, 'bootstrap': False, 'criterion': 'squared_error'}. Best is trial 193 with value: 0.3224133091717219.
[I 2024-12-04 19:56:58,901] Trial 359 finished with value: 0.32418160508008215 and parameters: {'n_estimators': 389, 'max_depth': 49, 'min_samples_split': 2, 'min_samples_leaf': 1, 'max_features': 'sqrt', 'bootstrap': False, 'criterion': 'squared_error'}. Best is trial 193 with value: 0.3224133091717219.
[I 2024-12-04 19:56:59,119] Trial 358 finished with value: 0.8165144444015289 and parameters: {'n_estimators': 264, 'max_depth': 36, 'min_samples_split': 43, 'min_samples_leaf': 12, 'max_features': None, 'bootstrap': True, 'criterion': 'absolute_error'}. Best is trial 193 with value: 0.3224133091717219.
[I 2024-12-04 19:57:00,218] Trial 360 finished with value: 0.32521955773697214 and parameters: {'n_estimators': 271, 'max_depth': 50, 'min_samples_split': 2, 'min_samples_leaf': 1, 'max_features': 'sqrt', 'bootstrap': False, 'criterion': 'squared_error'}. Best is trial 193 with value: 0.3224133091717219.
[I 2024-12-04 19:57:01,349] Trial 361 finished with value: 0.34092517030396163 and parameters: {'n_estimators': 448, 'max_depth': 48, 'min_samples_split': 2, 'min_samples_leaf': 1, 'max_features': 'sqrt', 'bootstrap': False, 'criterion': 'squared_error'}. Best is trial 193 with value: 0.3224133091717219.
[I 2024-12-04 19:57:01,395] Trial 362 finished with value: 0.3232888595106857 and parameters: {'n_estimators': 386, 'max_depth': 50, 'min_samples_split': 2, 'min_samples_leaf': 1, 'max_features': 'sqrt', 'bootstrap': False, 'criterion': 'squared_error'}. Best is trial 193 with value: 0.3224133091717219.
[I 2024-12-04 19:57:02,226] Trial 363 finished with value: 0.5079075055935647 and parameters: {'n_estimators': 392, 'max_depth': 31, 'min_samples_split': 2, 'min_samples_leaf': 1, 'max_features': 'sqrt', 'bootstrap': True, 'criterion': 'squared_error'}. Best is trial 193 with value: 0.3224133091717219.
[I 2024-12-04 19:57:03,208] Trial 365 finished with value: 0.41335518243087804 and parameters: {'n_estimators': 300, 'max_depth': 40, 'min_samples_split': 4, 'min_samples_leaf': 1, 'max_features': 'sqrt', 'bootstrap': False, 'criterion': 'squared_error'}. Best is trial 193 with value: 0.3224133091717219.
[I 2024-12-04 19:57:04,025] Trial 364 finished with value: 0.6041476570464074 and parameters: {'n_estimators': 390, 'max_depth': 30, 'min_samples_split': 25, 'min_samples_leaf': 13, 'max_features': None, 'bootstrap': False, 'criterion': 'squared_error'}. Best is trial 193 with value: 0.3224133091717219.
[I 2024-12-04 19:57:04,467] Trial 366 finished with value: 0.35966867073093456 and parameters: {'n_estimators': 400, 'max_depth': 50, 'min_samples_split': 3, 'min_samples_leaf': 1, 'max_features': 'sqrt', 'bootstrap': False, 'criterion': 'squared_error'}. Best is trial 193 with value: 0.3224133091717219.
[I 2024-12-04 19:57:05,905] Trial 368 finished with value: 0.6950420819296312 and parameters: {'n_estimators': 454, 'max_depth': 49, 'min_samples_split': 2, 'min_samples_leaf': 2, 'max_features': 'sqrt', 'bootstrap': False, 'criterion': 'squared_error'}. Best is trial 193 with value: 0.3224133091717219.
[I 2024-12-04 19:57:06,349] Trial 367 finished with value: 0.3288512324323899 and parameters: {'n_estimators': 465, 'max_depth': 50, 'min_samples_split': 2, 'min_samples_leaf': 1, 'max_features': 'sqrt', 'bootstrap': False, 'criterion': 'squared_error'}. Best is trial 193 with value: 0.3224133091717219.
[I 2024-12-04 19:57:06,574] Trial 369 finished with value: 0.6830533016873377 and parameters: {'n_estimators': 344, 'max_depth': 37, 'min_samples_split': 2, 'min_samples_leaf': 2, 'max_features': 'sqrt', 'bootstrap': False, 'criterion': 'squared_error'}. Best is trial 193 with value: 0.3224133091717219.
[I 2024-12-04 19:57:08,869] Trial 370 finished with value: 0.333907630387421 and parameters: {'n_estimators': 392, 'max_depth': 48, 'min_samples_split': 2, 'min_samples_leaf': 1, 'max_features': 'sqrt', 'bootstrap': False, 'criterion': 'squared_error'}. Best is trial 193 with value: 0.3224133091717219.
[I 2024-12-04 19:57:09,096] Trial 371 finished with value: 1.1837396668326863 and parameters: {'n_estimators': 802, 'max_depth': 19, 'min_samples_split': 41, 'min_samples_leaf': 2, 'max_features': 'log2', 'bootstrap': True, 'criterion': 'squared_error'}. Best is trial 193 with value: 0.3224133091717219.
[I 2024-12-04 19:57:09,983] Trial 372 finished with value: 0.32322494444398325 and parameters: {'n_estimators': 338, 'max_depth': 50, 'min_samples_split': 2, 'min_samples_leaf': 1, 'max_features': 'sqrt', 'bootstrap': False, 'criterion': 'squared_error'}. Best is trial 193 with value: 0.3224133091717219.
[I 2024-12-04 19:57:10,769] Trial 373 finished with value: 0.3256228206564836 and parameters: {'n_estimators': 237, 'max_depth': 50, 'min_samples_split': 2, 'min_samples_leaf': 1, 'max_features': 'sqrt', 'bootstrap': False, 'criterion': 'squared_error'}. Best is trial 193 with value: 0.3224133091717219.
[I 2024-12-04 19:57:11,500] Trial 374 finished with value: 0.4217029939397685 and parameters: {'n_estimators': 476, 'max_depth': 46, 'min_samples_split': 3, 'min_samples_leaf': 1, 'max_features': 'sqrt', 'bootstrap': True, 'criterion': 'squared_error'}. Best is trial 193 with value: 0.3224133091717219.
[I 2024-12-04 19:57:12,574] Trial 375 finished with value: 0.3874236130955809 and parameters: {'n_estimators': 447, 'max_depth': 38, 'min_samples_split': 2, 'min_samples_leaf': 1, 'max_features': 'sqrt', 'bootstrap': False, 'criterion': 'squared_error'}. Best is trial 193 with value: 0.3224133091717219.
[I 2024-12-04 19:57:13,934] Trial 377 finished with value: 0.3232467036184264 and parameters: {'n_estimators': 344, 'max_depth': 49, 'min_samples_split': 2, 'min_samples_leaf': 1, 'max_features': 'sqrt', 'bootstrap': False, 'criterion': 'squared_error'}. Best is trial 193 with value: 0.3224133091717219.
[I 2024-12-04 19:57:14,832] Trial 378 finished with value: 0.3232888595106857 and parameters: {'n_estimators': 386, 'max_depth': 50, 'min_samples_split': 2, 'min_samples_leaf': 1, 'max_features': 'sqrt', 'bootstrap': False, 'criterion': 'squared_error'}. Best is trial 193 with value: 0.3224133091717219.
[I 2024-12-04 19:57:16,053] Trial 379 finished with value: 0.3592956268368441 and parameters: {'n_estimators': 385, 'max_depth': 50, 'min_samples_split': 3, 'min_samples_leaf': 1, 'max_features': 'sqrt', 'bootstrap': False, 'criterion': 'squared_error'}. Best is trial 193 with value: 0.3224133091717219.
[I 2024-12-04 19:57:19,150] Trial 381 finished with value: 0.5373508258818562 and parameters: {'n_estimators': 363, 'max_depth': 47, 'min_samples_split': 2, 'min_samples_leaf': 2, 'max_features': None, 'bootstrap': False, 'criterion': 'squared_error'}. Best is trial 193 with value: 0.3224133091717219.
[I 2024-12-04 19:57:19,344] Trial 380 finished with value: 0.8090209952783984 and parameters: {'n_estimators': 877, 'max_depth': 48, 'min_samples_split': 44, 'min_samples_leaf': 1, 'max_features': None, 'bootstrap': False, 'criterion': 'squared_error'}. Best is trial 193 with value: 0.3224133091717219.
[I 2024-12-04 19:57:20,556] Trial 382 finished with value: 0.6819579823579344 and parameters: {'n_estimators': 405, 'max_depth': 50, 'min_samples_split': 2, 'min_samples_leaf': 2, 'max_features': 'sqrt', 'bootstrap': False, 'criterion': 'squared_error'}. Best is trial 193 with value: 0.3224133091717219.
[I 2024-12-04 19:57:21,373] Trial 383 finished with value: 0.4132511964235771 and parameters: {'n_estimators': 503, 'max_depth': 43, 'min_samples_split': 4, 'min_samples_leaf': 1, 'max_features': 'sqrt', 'bootstrap': False, 'criterion': 'squared_error'}. Best is trial 193 with value: 0.3224133091717219.
[I 2024-12-04 19:57:22,611] Trial 385 finished with value: 0.38619117565376515 and parameters: {'n_estimators': 261, 'max_depth': 49, 'min_samples_split': 4, 'min_samples_leaf': 1, 'max_features': 'sqrt', 'bootstrap': False, 'criterion': 'squared_error'}. Best is trial 193 with value: 0.3224133091717219.
[I 2024-12-04 19:57:23,599] Trial 384 finished with value: 0.4325861923466509 and parameters: {'n_estimators': 283, 'max_depth': 47, 'min_samples_split': 2, 'min_samples_leaf': 1, 'max_features': None, 'bootstrap': False, 'criterion': 'squared_error'}. Best is trial 193 with value: 0.3224133091717219.
[I 2024-12-04 19:57:24,040] Trial 386 finished with value: 0.5163281833088103 and parameters: {'n_estimators': 249, 'max_depth': 50, 'min_samples_split': 2, 'min_samples_leaf': 1, 'max_features': 'log2', 'bootstrap': False, 'criterion': 'squared_error'}. Best is trial 193 with value: 0.3224133091717219.
[I 2024-12-04 19:57:25,453] Trial 387 finished with value: 0.32362107296092046 and parameters: {'n_estimators': 315, 'max_depth': 50, 'min_samples_split': 2, 'min_samples_leaf': 1, 'max_features': 'sqrt', 'bootstrap': False, 'criterion': 'squared_error'}. Best is trial 193 with value: 0.3224133091717219.
[I 2024-12-04 19:57:26,366] Trial 388 finished with value: 0.32717900793674853 and parameters: {'n_estimators': 437, 'max_depth': 49, 'min_samples_split': 2, 'min_samples_leaf': 1, 'max_features': 'sqrt', 'bootstrap': False, 'criterion': 'squared_error'}. Best is trial 193 with value: 0.3224133091717219.
[I 2024-12-04 19:57:26,818] Trial 389 finished with value: 0.4004475455779754 and parameters: {'n_estimators': 270, 'max_depth': 38, 'min_samples_split': 3, 'min_samples_leaf': 1, 'max_features': 'sqrt', 'bootstrap': False, 'criterion': 'squared_error'}. Best is trial 193 with value: 0.3224133091717219.
[I 2024-12-04 19:57:27,907] Trial 390 finished with value: 0.35672340614179965 and parameters: {'n_estimators': 260, 'max_depth': 50, 'min_samples_split': 3, 'min_samples_leaf': 1, 'max_features': 'sqrt', 'bootstrap': False, 'criterion': 'squared_error'}. Best is trial 193 with value: 0.3224133091717219.
[I 2024-12-04 19:57:29,168] Trial 391 finished with value: 0.6952150803610633 and parameters: {'n_estimators': 612, 'max_depth': 18, 'min_samples_split': 46, 'min_samples_leaf': 9, 'max_features': None, 'bootstrap': True, 'criterion': 'squared_error'}. Best is trial 193 with value: 0.3224133091717219.
[I 2024-12-04 19:57:30,020] Trial 392 finished with value: 0.6239977527970857 and parameters: {'n_estimators': 119, 'max_depth': 21, 'min_samples_split': 7, 'min_samples_leaf': 8, 'max_features': None, 'bootstrap': True, 'criterion': 'absolute_error'}. Best is trial 193 with value: 0.3224133091717219.
[I 2024-12-04 19:57:31,057] Trial 394 finished with value: 0.6679044017226569 and parameters: {'n_estimators': 271, 'max_depth': 44, 'min_samples_split': 2, 'min_samples_leaf': 2, 'max_features': 'sqrt', 'bootstrap': False, 'criterion': 'squared_error'}. Best is trial 193 with value: 0.3224133091717219.
[I 2024-12-04 19:57:31,460] Trial 393 finished with value: 0.3253968747133639 and parameters: {'n_estimators': 436, 'max_depth': 50, 'min_samples_split': 2, 'min_samples_leaf': 1, 'max_features': 'sqrt', 'bootstrap': False, 'criterion': 'squared_error'}. Best is trial 193 with value: 0.3224133091717219.
[I 2024-12-04 19:57:32,863] Trial 395 finished with value: 0.37416391848587793 and parameters: {'n_estimators': 342, 'max_depth': 38, 'min_samples_split': 2, 'min_samples_leaf': 1, 'max_features': 'sqrt', 'bootstrap': False, 'criterion': 'squared_error'}. Best is trial 193 with value: 0.3224133091717219.
[I 2024-12-04 19:57:33,333] Trial 396 finished with value: 0.32393180183718623 and parameters: {'n_estimators': 319, 'max_depth': 50, 'min_samples_split': 2, 'min_samples_leaf': 1, 'max_features': 'sqrt', 'bootstrap': False, 'criterion': 'squared_error'}. Best is trial 193 with value: 0.3224133091717219.
