[I 2024-12-04 21:33:27,522] Trial 2499 finished with value: 0.14249505657055173 and parameters: {'kernel_type': 'Matern', 'length_scale': 1.3654746218820073, 'noise_level': 0.04970042191628734, 'constant_value': 25.22984236722825, 'nu': 1.5}. Best is trial 959 with value: 0.1375110730946576.
