[I 2024-12-04 12:18:18,460] Trial 1796 finished with value: 0.9346586294347141 and parameters: {'n_estimators': 107, 'max_depth': 50, 'min_samples_split': 3, 'min_samples_leaf': 5, 'max_features': 'log2', 'bootstrap': True, 'criterion': 'absolute_error'}. Best is trial 341 with value: 0.2909369124469028.
[I 2024-12-04 12:18:18,463] Trial 1794 finished with value: 0.46966624634108717 and parameters: {'n_estimators': 434, 'max_depth': 34, 'min_samples_split': 43, 'min_samples_leaf': 2, 'max_features': 'sqrt', 'bootstrap': False, 'criterion': 'squared_error'}. Best is trial 341 with value: 0.2909369124469028.
[I 2024-12-04 12:18:18,780] Trial 1782 finished with value: 0.30442410474316767 and parameters: {'n_estimators': 686, 'max_depth': 42, 'min_samples_split': 3, 'min_samples_leaf': 1, 'max_features': 'sqrt', 'bootstrap': False, 'criterion': 'squared_error'}. Best is trial 341 with value: 0.2909369124469028.
[I 2024-12-04 12:18:18,787] Trial 1767 finished with value: 0.8095715082145548 and parameters: {'n_estimators': 955, 'max_depth': 20, 'min_samples_split': 42, 'min_samples_leaf': 3, 'max_features': 'log2', 'bootstrap': False, 'criterion': 'absolute_error'}. Best is trial 341 with value: 0.2909369124469028.
[I 2024-12-04 12:18:19,146] Trial 1775 finished with value: 0.46370666237235036 and parameters: {'n_estimators': 486, 'max_depth': 44, 'min_samples_split': 12, 'min_samples_leaf': 1, 'max_features': 'log2', 'bootstrap': False, 'criterion': 'absolute_error'}. Best is trial 341 with value: 0.2909369124469028.
[I 2024-12-04 12:18:21,046] Trial 1799 finished with value: 0.7469653232880529 and parameters: {'n_estimators': 125, 'max_depth': 20, 'min_samples_split': 16, 'min_samples_leaf': 2, 'max_features': 'log2', 'bootstrap': False, 'criterion': 'squared_error'}. Best is trial 341 with value: 0.2909369124469028.
[I 2024-12-04 12:18:21,103] Trial 1798 finished with value: 0.39600810591514085 and parameters: {'n_estimators': 255, 'max_depth': 49, 'min_samples_split': 8, 'min_samples_leaf': 1, 'max_features': None, 'bootstrap': False, 'criterion': 'squared_error'}. Best is trial 341 with value: 0.2909369124469028.
[I 2024-12-04 12:18:21,794] Trial 1616 finished with value: 0.41018209047118787 and parameters: {'n_estimators': 657, 'max_depth': 32, 'min_samples_split': 4, 'min_samples_leaf': 1, 'max_features': None, 'bootstrap': False, 'criterion': 'absolute_error'}. Best is trial 341 with value: 0.2909369124469028.
[I 2024-12-04 12:18:21,836] Trial 1795 finished with value: 0.2980870323666239 and parameters: {'n_estimators': 472, 'max_depth': 50, 'min_samples_split': 2, 'min_samples_leaf': 1, 'max_features': 'sqrt', 'bootstrap': False, 'criterion': 'squared_error'}. Best is trial 341 with value: 0.2909369124469028.
[I 2024-12-04 12:18:22,007] Trial 1800 finished with value: 0.69646819163918 and parameters: {'n_estimators': 346, 'max_depth': 32, 'min_samples_split': 5, 'min_samples_leaf': 2, 'max_features': 'log2', 'bootstrap': False, 'criterion': 'squared_error'}. Best is trial 341 with value: 0.2909369124469028.
[I 2024-12-04 12:18:23,427] Trial 1797 finished with value: 0.480194896315174 and parameters: {'n_estimators': 676, 'max_depth': 50, 'min_samples_split': 2, 'min_samples_leaf': 2, 'max_features': 'sqrt', 'bootstrap': True, 'criterion': 'squared_error'}. Best is trial 341 with value: 0.2909369124469028.
[I 2024-12-04 12:18:28,062] Trial 1802 finished with value: 0.30161112639318194 and parameters: {'n_estimators': 143, 'max_depth': 50, 'min_samples_split': 5, 'min_samples_leaf': 1, 'max_features': 'sqrt', 'bootstrap': False, 'criterion': 'squared_error'}. Best is trial 341 with value: 0.2909369124469028.
[I 2024-12-04 12:18:32,245] Trial 1812 finished with value: 0.3000479592253483 and parameters: {'n_estimators': 361, 'max_depth': 50, 'min_samples_split': 4, 'min_samples_leaf': 1, 'max_features': 'sqrt', 'bootstrap': False, 'criterion': 'squared_error'}. Best is trial 341 with value: 0.2909369124469028.
[I 2024-12-04 12:18:33,171] Trial 1803 finished with value: 0.33201517985825746 and parameters: {'n_estimators': 136, 'max_depth': 45, 'min_samples_split': 4, 'min_samples_leaf': 1, 'max_features': 'sqrt', 'bootstrap': True, 'criterion': 'squared_error'}. Best is trial 341 with value: 0.2909369124469028.
[I 2024-12-04 12:18:33,443] Trial 1804 finished with value: 0.5305009177725628 and parameters: {'n_estimators': 182, 'max_depth': 10, 'min_samples_split': 10, 'min_samples_leaf': 15, 'max_features': None, 'bootstrap': False, 'criterion': 'absolute_error'}. Best is trial 341 with value: 0.2909369124469028.
[I 2024-12-04 12:18:34,741] Trial 1809 finished with value: 0.29965620093864703 and parameters: {'n_estimators': 194, 'max_depth': 43, 'min_samples_split': 3, 'min_samples_leaf': 1, 'max_features': 'sqrt', 'bootstrap': False, 'criterion': 'squared_error'}. Best is trial 341 with value: 0.2909369124469028.
[I 2024-12-04 12:18:34,771] Trial 1814 finished with value: 0.4414933329350374 and parameters: {'n_estimators': 671, 'max_depth': 50, 'min_samples_split': 3, 'min_samples_leaf': 2, 'max_features': 'sqrt', 'bootstrap': False, 'criterion': 'squared_error'}. Best is trial 341 with value: 0.2909369124469028.
[I 2024-12-04 12:18:34,997] Trial 1808 finished with value: 0.4424603240347404 and parameters: {'n_estimators': 369, 'max_depth': 44, 'min_samples_split': 4, 'min_samples_leaf': 2, 'max_features': 'sqrt', 'bootstrap': False, 'criterion': 'squared_error'}. Best is trial 341 with value: 0.2909369124469028.
[I 2024-12-04 12:18:35,780] Trial 1810 finished with value: 0.3001632719848506 and parameters: {'n_estimators': 284, 'max_depth': 44, 'min_samples_split': 3, 'min_samples_leaf': 1, 'max_features': 'sqrt', 'bootstrap': False, 'criterion': 'squared_error'}. Best is trial 341 with value: 0.2909369124469028.
[I 2024-12-04 12:18:36,166] Trial 1820 finished with value: 0.4421788144647841 and parameters: {'n_estimators': 489, 'max_depth': 44, 'min_samples_split': 3, 'min_samples_leaf': 2, 'max_features': 'sqrt', 'bootstrap': False, 'criterion': 'squared_error'}. Best is trial 341 with value: 0.2909369124469028.
[I 2024-12-04 12:18:36,657] Trial 1818 finished with value: 0.30331755977097 and parameters: {'n_estimators': 544, 'max_depth': 42, 'min_samples_split': 3, 'min_samples_leaf': 1, 'max_features': 'sqrt', 'bootstrap': False, 'criterion': 'squared_error'}. Best is trial 341 with value: 0.2909369124469028.
[I 2024-12-04 12:18:37,192] Trial 1811 finished with value: 0.4873384451387593 and parameters: {'n_estimators': 504, 'max_depth': 33, 'min_samples_split': 2, 'min_samples_leaf': 1, 'max_features': 'log2', 'bootstrap': True, 'criterion': 'squared_error'}. Best is trial 341 with value: 0.2909369124469028.
[I 2024-12-04 12:18:38,574] Trial 1817 finished with value: 0.30012945212481423 and parameters: {'n_estimators': 254, 'max_depth': 50, 'min_samples_split': 4, 'min_samples_leaf': 1, 'max_features': 'sqrt', 'bootstrap': False, 'criterion': 'squared_error'}. Best is trial 341 with value: 0.2909369124469028.
[I 2024-12-04 12:18:38,889] Trial 1807 finished with value: 0.3066649342282487 and parameters: {'n_estimators': 820, 'max_depth': 50, 'min_samples_split': 6, 'min_samples_leaf': 1, 'max_features': 'sqrt', 'bootstrap': False, 'criterion': 'squared_error'}. Best is trial 341 with value: 0.2909369124469028.
[I 2024-12-04 12:18:41,402] Trial 1763 finished with value: 0.35474446276079424 and parameters: {'n_estimators': 958, 'max_depth': 32, 'min_samples_split': 2, 'min_samples_leaf': 1, 'max_features': 'sqrt', 'bootstrap': False, 'criterion': 'absolute_error'}. Best is trial 341 with value: 0.2909369124469028.
[I 2024-12-04 12:18:42,590] Trial 1816 finished with value: 0.3054637531495377 and parameters: {'n_estimators': 218, 'max_depth': 42, 'min_samples_split': 2, 'min_samples_leaf': 1, 'max_features': 'sqrt', 'bootstrap': False, 'criterion': 'squared_error'}. Best is trial 341 with value: 0.2909369124469028.
[I 2024-12-04 12:18:42,598] Trial 1813 finished with value: 0.3015863739039029 and parameters: {'n_estimators': 614, 'max_depth': 43, 'min_samples_split': 3, 'min_samples_leaf': 1, 'max_features': 'sqrt', 'bootstrap': False, 'criterion': 'squared_error'}. Best is trial 341 with value: 0.2909369124469028.
[I 2024-12-04 12:18:42,603] Trial 1805 finished with value: 0.30965931063443064 and parameters: {'n_estimators': 558, 'max_depth': 42, 'min_samples_split': 2, 'min_samples_leaf': 1, 'max_features': 'sqrt', 'bootstrap': False, 'criterion': 'squared_error'}. Best is trial 341 with value: 0.2909369124469028.
[I 2024-12-04 12:18:43,567] Trial 1828 finished with value: 0.4417466191021991 and parameters: {'n_estimators': 403, 'max_depth': 50, 'min_samples_split': 4, 'min_samples_leaf': 2, 'max_features': 'sqrt', 'bootstrap': False, 'criterion': 'squared_error'}. Best is trial 341 with value: 0.2909369124469028.
[I 2024-12-04 12:18:43,737] Trial 1825 finished with value: 0.4445533909634543 and parameters: {'n_estimators': 107, 'max_depth': 41, 'min_samples_split': 5, 'min_samples_leaf': 2, 'max_features': 'sqrt', 'bootstrap': False, 'criterion': 'squared_error'}. Best is trial 341 with value: 0.2909369124469028.
[I 2024-12-04 12:18:44,974] Trial 1815 finished with value: 0.29946537960461883 and parameters: {'n_estimators': 234, 'max_depth': 50, 'min_samples_split': 2, 'min_samples_leaf': 1, 'max_features': 'sqrt', 'bootstrap': False, 'criterion': 'squared_error'}. Best is trial 341 with value: 0.2909369124469028.
[I 2024-12-04 12:18:45,244] Trial 1827 finished with value: 0.3892795460659285 and parameters: {'n_estimators': 410, 'max_depth': 40, 'min_samples_split': 2, 'min_samples_leaf': 1, 'max_features': None, 'bootstrap': False, 'criterion': 'squared_error'}. Best is trial 341 with value: 0.2909369124469028.
[I 2024-12-04 12:18:45,661] Trial 1806 finished with value: 0.3014769429022758 and parameters: {'n_estimators': 722, 'max_depth': 50, 'min_samples_split': 4, 'min_samples_leaf': 1, 'max_features': 'sqrt', 'bootstrap': False, 'criterion': 'squared_error'}. Best is trial 341 with value: 0.2909369124469028.
[I 2024-12-04 12:18:45,701] Trial 1831 finished with value: 0.44987827898151506 and parameters: {'n_estimators': 148, 'max_depth': 40, 'min_samples_split': 3, 'min_samples_leaf': 2, 'max_features': 'sqrt', 'bootstrap': False, 'criterion': 'squared_error'}. Best is trial 341 with value: 0.2909369124469028.
[I 2024-12-04 12:18:46,431] Trial 1830 finished with value: 0.4471204301773524 and parameters: {'n_estimators': 188, 'max_depth': 44, 'min_samples_split': 3, 'min_samples_leaf': 2, 'max_features': 'sqrt', 'bootstrap': False, 'criterion': 'squared_error'}. Best is trial 341 with value: 0.2909369124469028.
[I 2024-12-04 12:18:46,591] Trial 1801 finished with value: 0.3133897127111542 and parameters: {'n_estimators': 384, 'max_depth': 47, 'min_samples_split': 4, 'min_samples_leaf': 1, 'max_features': 'sqrt', 'bootstrap': False, 'criterion': 'absolute_error'}. Best is trial 341 with value: 0.2909369124469028.
[I 2024-12-04 12:18:46,648] Trial 1832 finished with value: 0.5734428188127846 and parameters: {'n_estimators': 176, 'max_depth': 17, 'min_samples_split': 11, 'min_samples_leaf': 2, 'max_features': 'sqrt', 'bootstrap': True, 'criterion': 'squared_error'}. Best is trial 341 with value: 0.2909369124469028.
[I 2024-12-04 12:18:46,806] Trial 1821 finished with value: 0.35131767249485363 and parameters: {'n_estimators': 520, 'max_depth': 38, 'min_samples_split': 5, 'min_samples_leaf': 1, 'max_features': 'sqrt', 'bootstrap': True, 'criterion': 'squared_error'}. Best is trial 341 with value: 0.2909369124469028.
[I 2024-12-04 12:18:46,841] Trial 1829 finished with value: 0.6902545272612407 and parameters: {'n_estimators': 395, 'max_depth': 15, 'min_samples_split': 2, 'min_samples_leaf': 1, 'max_features': 'log2', 'bootstrap': True, 'criterion': 'squared_error'}. Best is trial 341 with value: 0.2909369124469028.
[I 2024-12-04 12:18:46,917] Trial 1822 finished with value: 0.4226900811421134 and parameters: {'n_estimators': 416, 'max_depth': 21, 'min_samples_split': 25, 'min_samples_leaf': 5, 'max_features': None, 'bootstrap': True, 'criterion': 'squared_error'}. Best is trial 341 with value: 0.2909369124469028.
[I 2024-12-04 12:18:47,152] Trial 1834 finished with value: 0.6344655476045531 and parameters: {'n_estimators': 123, 'max_depth': 13, 'min_samples_split': 8, 'min_samples_leaf': 3, 'max_features': 'sqrt', 'bootstrap': False, 'criterion': 'squared_error'}. Best is trial 341 with value: 0.2909369124469028.
[I 2024-12-04 12:18:47,964] Trial 1824 finished with value: 0.40062048550343743 and parameters: {'n_estimators': 452, 'max_depth': 32, 'min_samples_split': 3, 'min_samples_leaf': 4, 'max_features': None, 'bootstrap': True, 'criterion': 'squared_error'}. Best is trial 341 with value: 0.2909369124469028.
[I 2024-12-04 12:18:51,065] Trial 1838 finished with value: 0.7115968725985157 and parameters: {'n_estimators': 709, 'max_depth': 26, 'min_samples_split': 5, 'min_samples_leaf': 2, 'max_features': 'log2', 'bootstrap': False, 'criterion': 'squared_error'}. Best is trial 341 with value: 0.2909369124469028.
[I 2024-12-04 12:18:55,632] Trial 1842 finished with value: 0.32253910976883016 and parameters: {'n_estimators': 439, 'max_depth': 49, 'min_samples_split': 4, 'min_samples_leaf': 1, 'max_features': 'sqrt', 'bootstrap': True, 'criterion': 'squared_error'}. Best is trial 341 with value: 0.2909369124469028.
[I 2024-12-04 12:18:55,813] Trial 1819 finished with value: 0.4558646401301267 and parameters: {'n_estimators': 540, 'max_depth': 50, 'min_samples_split': 4, 'min_samples_leaf': 2, 'max_features': 'sqrt', 'bootstrap': False, 'criterion': 'absolute_error'}. Best is trial 341 with value: 0.2909369124469028.
[I 2024-12-04 12:18:55,839] Trial 1840 finished with value: 0.44519133795608234 and parameters: {'n_estimators': 326, 'max_depth': 38, 'min_samples_split': 3, 'min_samples_leaf': 1, 'max_features': 'log2', 'bootstrap': False, 'criterion': 'squared_error'}. Best is trial 341 with value: 0.2909369124469028.
[I 2024-12-04 12:18:56,835] Trial 1826 finished with value: 0.3892315902307486 and parameters: {'n_estimators': 951, 'max_depth': 12, 'min_samples_split': 20, 'min_samples_leaf': 1, 'max_features': None, 'bootstrap': True, 'criterion': 'squared_error'}. Best is trial 341 with value: 0.2909369124469028.
[I 2024-12-04 12:18:57,040] Trial 1837 finished with value: 0.857318694689156 and parameters: {'n_estimators': 863, 'max_depth': 39, 'min_samples_split': 6, 'min_samples_leaf': 15, 'max_features': 'sqrt', 'bootstrap': False, 'criterion': 'squared_error'}. Best is trial 341 with value: 0.2909369124469028.
[I 2024-12-04 12:18:57,082] Trial 1843 finished with value: 0.3193371015319161 and parameters: {'n_estimators': 405, 'max_depth': 41, 'min_samples_split': 5, 'min_samples_leaf': 1, 'max_features': 'sqrt', 'bootstrap': False, 'criterion': 'squared_error'}. Best is trial 341 with value: 0.2909369124469028.
[I 2024-12-04 12:18:57,092] Trial 1835 finished with value: 0.5025519703178051 and parameters: {'n_estimators': 857, 'max_depth': 50, 'min_samples_split': 7, 'min_samples_leaf': 10, 'max_features': None, 'bootstrap': True, 'criterion': 'squared_error'}. Best is trial 341 with value: 0.2909369124469028.
[I 2024-12-04 12:18:57,093] Trial 1823 finished with value: 0.5201316934630462 and parameters: {'n_estimators': 581, 'max_depth': 30, 'min_samples_split': 3, 'min_samples_leaf': 1, 'max_features': 'log2', 'bootstrap': False, 'criterion': 'absolute_error'}. Best is trial 341 with value: 0.2909369124469028.
[I 2024-12-04 12:18:58,575] Trial 1839 finished with value: 0.2944672442461747 and parameters: {'n_estimators': 429, 'max_depth': 50, 'min_samples_split': 3, 'min_samples_leaf': 1, 'max_features': 'sqrt', 'bootstrap': False, 'criterion': 'squared_error'}. Best is trial 341 with value: 0.2909369124469028.
[I 2024-12-04 12:18:58,668] Trial 1845 finished with value: 0.4426241043567331 and parameters: {'n_estimators': 106, 'max_depth': 50, 'min_samples_split': 3, 'min_samples_leaf': 2, 'max_features': 'sqrt', 'bootstrap': False, 'criterion': 'squared_error'}. Best is trial 341 with value: 0.2909369124469028.
[I 2024-12-04 12:19:00,376] Trial 1851 finished with value: 0.3066256375073712 and parameters: {'n_estimators': 221, 'max_depth': 42, 'min_samples_split': 2, 'min_samples_leaf': 1, 'max_features': 'sqrt', 'bootstrap': False, 'criterion': 'squared_error'}. Best is trial 341 with value: 0.2909369124469028.
[I 2024-12-04 12:19:01,274] Trial 1848 finished with value: 0.30077899425570787 and parameters: {'n_estimators': 550, 'max_depth': 49, 'min_samples_split': 4, 'min_samples_leaf': 1, 'max_features': 'sqrt', 'bootstrap': False, 'criterion': 'squared_error'}. Best is trial 341 with value: 0.2909369124469028.
[I 2024-12-04 12:19:01,409] Trial 1844 finished with value: 0.30367613874554206 and parameters: {'n_estimators': 109, 'max_depth': 47, 'min_samples_split': 2, 'min_samples_leaf': 1, 'max_features': 'sqrt', 'bootstrap': False, 'criterion': 'squared_error'}. Best is trial 341 with value: 0.2909369124469028.
[I 2024-12-04 12:19:03,014] Trial 1850 finished with value: 0.32125598336669553 and parameters: {'n_estimators': 273, 'max_depth': 43, 'min_samples_split': 7, 'min_samples_leaf': 1, 'max_features': 'sqrt', 'bootstrap': False, 'criterion': 'squared_error'}. Best is trial 341 with value: 0.2909369124469028.
[I 2024-12-04 12:19:03,282] Trial 1849 finished with value: 0.3058839245289574 and parameters: {'n_estimators': 328, 'max_depth': 44, 'min_samples_split': 4, 'min_samples_leaf': 1, 'max_features': 'sqrt', 'bootstrap': False, 'criterion': 'squared_error'}. Best is trial 341 with value: 0.2909369124469028.
[I 2024-12-04 12:19:03,291] Trial 1846 finished with value: 0.2983745918765216 and parameters: {'n_estimators': 567, 'max_depth': 50, 'min_samples_split': 2, 'min_samples_leaf': 1, 'max_features': 'sqrt', 'bootstrap': False, 'criterion': 'squared_error'}. Best is trial 341 with value: 0.2909369124469028.
[I 2024-12-04 12:19:03,641] Trial 1856 finished with value: 0.3004798301399668 and parameters: {'n_estimators': 104, 'max_depth': 45, 'min_samples_split': 3, 'min_samples_leaf': 1, 'max_features': 'sqrt', 'bootstrap': False, 'criterion': 'squared_error'}. Best is trial 341 with value: 0.2909369124469028.
[I 2024-12-04 12:19:03,790] Trial 1777 finished with value: 0.4180578794313689 and parameters: {'n_estimators': 271, 'max_depth': 50, 'min_samples_split': 7, 'min_samples_leaf': 1, 'max_features': None, 'bootstrap': False, 'criterion': 'absolute_error'}. Best is trial 341 with value: 0.2909369124469028.
[I 2024-12-04 12:19:04,821] Trial 1860 finished with value: 0.2998646024457291 and parameters: {'n_estimators': 201, 'max_depth': 50, 'min_samples_split': 4, 'min_samples_leaf': 1, 'max_features': 'sqrt', 'bootstrap': False, 'criterion': 'squared_error'}. Best is trial 341 with value: 0.2909369124469028.
[I 2024-12-04 12:19:05,953] Trial 1855 finished with value: 0.30854696861592934 and parameters: {'n_estimators': 102, 'max_depth': 45, 'min_samples_split': 4, 'min_samples_leaf': 1, 'max_features': 'sqrt', 'bootstrap': False, 'criterion': 'squared_error'}. Best is trial 341 with value: 0.2909369124469028.
[I 2024-12-04 12:19:06,329] Trial 1841 finished with value: 0.30600917136525896 and parameters: {'n_estimators': 580, 'max_depth': 50, 'min_samples_split': 6, 'min_samples_leaf': 1, 'max_features': 'sqrt', 'bootstrap': False, 'criterion': 'squared_error'}. Best is trial 341 with value: 0.2909369124469028.
[I 2024-12-04 12:19:06,839] Trial 1858 finished with value: 0.6937746094318286 and parameters: {'n_estimators': 333, 'max_depth': 9, 'min_samples_split': 48, 'min_samples_leaf': 2, 'max_features': 'sqrt', 'bootstrap': True, 'criterion': 'squared_error'}. Best is trial 341 with value: 0.2909369124469028.
[I 2024-12-04 12:19:08,014] Trial 1862 finished with value: 0.9632070023701376 and parameters: {'n_estimators': 176, 'max_depth': 21, 'min_samples_split': 27, 'min_samples_leaf': 9, 'max_features': 'log2', 'bootstrap': True, 'criterion': 'squared_error'}. Best is trial 341 with value: 0.2909369124469028.
[I 2024-12-04 12:19:08,305] Trial 1852 finished with value: 0.4404045981578698 and parameters: {'n_estimators': 498, 'max_depth': 50, 'min_samples_split': 3, 'min_samples_leaf': 2, 'max_features': 'sqrt', 'bootstrap': False, 'criterion': 'squared_error'}. Best is trial 341 with value: 0.2909369124469028.
[I 2024-12-04 12:19:08,576] Trial 1853 finished with value: 0.31554531402644337 and parameters: {'n_estimators': 442, 'max_depth': 40, 'min_samples_split': 2, 'min_samples_leaf': 1, 'max_features': 'sqrt', 'bootstrap': False, 'criterion': 'squared_error'}. Best is trial 341 with value: 0.2909369124469028.
[I 2024-12-04 12:19:09,186] Trial 1861 finished with value: 0.3046345364324214 and parameters: {'n_estimators': 251, 'max_depth': 50, 'min_samples_split': 5, 'min_samples_leaf': 1, 'max_features': 'sqrt', 'bootstrap': False, 'criterion': 'squared_error'}. Best is trial 341 with value: 0.2909369124469028.
[I 2024-12-04 12:19:09,196] Trial 1833 finished with value: 0.5590738261376432 and parameters: {'n_estimators': 545, 'max_depth': 5, 'min_samples_split': 9, 'min_samples_leaf': 14, 'max_features': None, 'bootstrap': False, 'criterion': 'absolute_error'}. Best is trial 341 with value: 0.2909369124469028.
[I 2024-12-04 12:19:09,406] Trial 1863 finished with value: 0.3081119682751324 and parameters: {'n_estimators': 335, 'max_depth': 42, 'min_samples_split': 2, 'min_samples_leaf': 1, 'max_features': 'sqrt', 'bootstrap': False, 'criterion': 'squared_error'}. Best is trial 341 with value: 0.2909369124469028.
