[I 2024-12-03 18:44:59,166] Trial 1006 finished with value: 0.5203477329190394 and parameters: {'kernel': 'rbf', 'C': 98.9869679887271, 'gamma': 0.029261535402812736, 'epsilon': 0.029877373837568992}. Best is trial 1002 with value: 0.44903193867462854.
[I 2024-12-03 18:44:59,170] Trial 1008 finished with value: 0.6239647611523873 and parameters: {'kernel': 'rbf', 'C': 13.499551418460456, 'gamma': 0.0036825755943123485, 'epsilon': 0.05030639117341945}. Best is trial 1002 with value: 0.44903193867462854.
[I 2024-12-03 18:44:59,241] Trial 1004 finished with value: 0.5503622871271374 and parameters: {'kernel': 'linear', 'C': 41.89725022608953, 'gamma': 0.5163130584271816, 'epsilon': 0.003473199350439989}. Best is trial 1002 with value: 0.44903193867462854.
[I 2024-12-03 18:44:59,559] Trial 1005 finished with value: 0.5528485602024893 and parameters: {'kernel': 'rbf', 'C': 17.297262639141138, 'gamma': 0.007018487566238855, 'epsilon': 0.08090323800946776}. Best is trial 1002 with value: 0.44903193867462854.
[I 2024-12-03 18:44:59,853] Trial 1012 finished with value: 0.5349005453310065 and parameters: {'kernel': 'rbf', 'C': 22.485595824003664, 'gamma': 0.05832132011499641, 'epsilon': 0.059844414887020754}. Best is trial 1002 with value: 0.44903193867462854.
[I 2024-12-03 18:45:00,245] Trial 998 finished with value: 0.5088292761418698 and parameters: {'kernel': 'rbf', 'C': 8.218096814900647, 'gamma': 0.029754690204008546, 'epsilon': 0.12357333003793863}. Best is trial 1002 with value: 0.44903193867462854.
[I 2024-12-03 18:45:00,359] Trial 1020 finished with value: 0.46836793862159354 and parameters: {'kernel': 'rbf', 'C': 21.21226294451361, 'gamma': 0.029576619774323944, 'epsilon': 0.01631864955961076}. Best is trial 1002 with value: 0.44903193867462854.
[I 2024-12-03 18:45:00,414] Trial 1019 finished with value: 1.3718369824368397 and parameters: {'kernel': 'poly', 'C': 0.008902264646427963, 'gamma': 0.000932095786191849, 'epsilon': 0.014715382629298049}. Best is trial 1002 with value: 0.44903193867462854.
[I 2024-12-03 18:45:00,989] Trial 1013 finished with value: 0.461051780919521 and parameters: {'kernel': 'rbf', 'C': 95.14949040691782, 'gamma': 0.010681960138494134, 'epsilon': 0.04421349664953377}. Best is trial 1002 with value: 0.44903193867462854.
[I 2024-12-03 18:45:01,880] Trial 1018 finished with value: 0.5129764147523178 and parameters: {'kernel': 'rbf', 'C': 14.82154901752893, 'gamma': 0.015867848402820357, 'epsilon': 0.08575726870550171}. Best is trial 1002 with value: 0.44903193867462854.
[I 2024-12-03 18:45:02,038] Trial 1017 finished with value: 0.5710665312289891 and parameters: {'kernel': 'rbf', 'C': 97.72989132760152, 'gamma': 0.004655282590103665, 'epsilon': 0.37315009366064555}. Best is trial 1002 with value: 0.44903193867462854.
[I 2024-12-03 18:45:02,039] Trial 1021 finished with value: 0.5999661202075693 and parameters: {'kernel': 'rbf', 'C': 15.191724016626486, 'gamma': 0.10826374188126994, 'epsilon': 0.09511853554455871}. Best is trial 1002 with value: 0.44903193867462854.
[I 2024-12-03 18:45:02,465] Trial 1022 finished with value: 0.45582316061677697 and parameters: {'kernel': 'rbf', 'C': 96.16360657650458, 'gamma': 0.011770840541236298, 'epsilon': 0.05098937798055702}. Best is trial 1002 with value: 0.44903193867462854.
[I 2024-12-03 18:45:03,306] Trial 1032 finished with value: 0.45011375072953635 and parameters: {'kernel': 'rbf', 'C': 98.87855588569258, 'gamma': 0.01488990987447276, 'epsilon': 0.05944813065843304}. Best is trial 1002 with value: 0.44903193867462854.
[I 2024-12-03 18:45:03,460] Trial 1016 finished with value: 109.02620240618882 and parameters: {'kernel': 'sigmoid', 'C': 70.12673789173704, 'gamma': 0.01085769466189077, 'epsilon': 0.47404290045918723}. Best is trial 1002 with value: 0.44903193867462854.
[I 2024-12-03 18:45:04,657] Trial 1023 finished with value: 0.4646597513220103 and parameters: {'kernel': 'rbf', 'C': 23.160959984914314, 'gamma': 0.023189561400560048, 'epsilon': 0.03735117779868337}. Best is trial 1002 with value: 0.44903193867462854.
[I 2024-12-03 18:45:05,190] Trial 1027 finished with value: 0.4639322533590755 and parameters: {'kernel': 'rbf', 'C': 97.57137871051287, 'gamma': 0.018080534633878043, 'epsilon': 0.08582154917511185}. Best is trial 1002 with value: 0.44903193867462854.
[I 2024-12-03 18:45:05,437] Trial 1030 finished with value: 0.5680348937938823 and parameters: {'kernel': 'rbf', 'C': 2.626477210079932, 'gamma': 0.04011623519161605, 'epsilon': 0.051193712774282266}. Best is trial 1002 with value: 0.44903193867462854.
[I 2024-12-03 18:45:05,462] Trial 1031 finished with value: 0.4786289714820987 and parameters: {'kernel': 'rbf', 'C': 99.50553744605885, 'gamma': 0.008030009290557803, 'epsilon': 0.01912463514284885}. Best is trial 1002 with value: 0.44903193867462854.
[I 2024-12-03 18:45:05,665] Trial 1029 finished with value: 0.4945936199950431 and parameters: {'kernel': 'rbf', 'C': 19.71609510488854, 'gamma': 0.04767460502869712, 'epsilon': 0.03841328360054615}. Best is trial 1002 with value: 0.44903193867462854.
[I 2024-12-03 18:45:05,862] Trial 1026 finished with value: 0.5996647684768085 and parameters: {'kernel': 'rbf', 'C': 90.77714799140821, 'gamma': 0.0466301612622997, 'epsilon': 0.09067560594122884}. Best is trial 1002 with value: 0.44903193867462854.
[I 2024-12-03 18:45:06,000] Trial 1025 finished with value: 0.47188673961297 and parameters: {'kernel': 'rbf', 'C': 16.122933374230247, 'gamma': 0.02389695473720811, 'epsilon': 0.044420980538982}. Best is trial 1002 with value: 0.44903193867462854.
[I 2024-12-03 18:45:07,882] Trial 1035 finished with value: 0.47003395737273523 and parameters: {'kernel': 'rbf', 'C': 18.647072850340756, 'gamma': 0.034171465705355356, 'epsilon': 0.025410563488400675}. Best is trial 1002 with value: 0.44903193867462854.
[I 2024-12-03 18:45:08,328] Trial 1034 finished with value: 0.5744697783483147 and parameters: {'kernel': 'rbf', 'C': 16.851200609053375, 'gamma': 0.005352313608662108, 'epsilon': 0.03545954824606165}. Best is trial 1002 with value: 0.44903193867462854.
[I 2024-12-03 18:45:08,333] Trial 1028 finished with value: 0.5075115041326284 and parameters: {'kernel': 'rbf', 'C': 95.64976981001801, 'gamma': 0.005160250789868621, 'epsilon': 0.020147961561660883}. Best is trial 1002 with value: 0.44903193867462854.
[I 2024-12-03 18:45:08,430] Trial 1039 finished with value: 0.4778783961303399 and parameters: {'kernel': 'rbf', 'C': 85.59480477415813, 'gamma': 0.023996360833131905, 'epsilon': 0.062687035606522}. Best is trial 1002 with value: 0.44903193867462854.
[I 2024-12-03 18:45:08,595] Trial 1037 finished with value: 0.48551626623517535 and parameters: {'kernel': 'rbf', 'C': 96.29763239648548, 'gamma': 0.0069438195549316305, 'epsilon': 0.1059675340694856}. Best is trial 1002 with value: 0.44903193867462854.
[I 2024-12-03 18:45:08,805] Trial 1033 finished with value: 0.6027997271883947 and parameters: {'kernel': 'rbf', 'C': 97.35867513105815, 'gamma': 0.12674219809705642, 'epsilon': 0.06579046380488285}. Best is trial 1002 with value: 0.44903193867462854.
[I 2024-12-03 18:45:08,873] Trial 1044 finished with value: 0.47218735935288075 and parameters: {'kernel': 'rbf', 'C': 26.137319251590235, 'gamma': 0.0249701282594087, 'epsilon': 0.15703570427731392}. Best is trial 1002 with value: 0.44903193867462854.
[I 2024-12-03 18:45:10,444] Trial 1050 finished with value: 0.49753723818841444 and parameters: {'kernel': 'rbf', 'C': 88.21494780925332, 'gamma': 0.02720021991418674, 'epsilon': 0.055435117408557125}. Best is trial 1002 with value: 0.44903193867462854.
[I 2024-12-03 18:45:10,752] Trial 1042 finished with value: 1.2300376235655857 and parameters: {'kernel': 'rbf', 'C': 0.03980397125311866, 'gamma': 0.0047689609416377505, 'epsilon': 0.002659342583254245}. Best is trial 1002 with value: 0.44903193867462854.
[I 2024-12-03 18:45:10,784] Trial 1041 finished with value: 1.0990689016536197 and parameters: {'kernel': 'poly', 'C': 10.503127346133194, 'gamma': 0.0023411777262444364, 'epsilon': 0.1332305769302265}. Best is trial 1002 with value: 0.44903193867462854.
[I 2024-12-03 18:45:10,802] Trial 1040 finished with value: 0.5173004787924081 and parameters: {'kernel': 'rbf', 'C': 22.53902497172013, 'gamma': 0.010577667896977084, 'epsilon': 0.06920209719887419}. Best is trial 1002 with value: 0.44903193867462854.
[I 2024-12-03 18:45:10,974] Trial 1048 finished with value: 0.5388687146040061 and parameters: {'kernel': 'rbf', 'C': 24.77572539865958, 'gamma': 0.006367012860190195, 'epsilon': 0.13352790326031974}. Best is trial 1002 with value: 0.44903193867462854.
[I 2024-12-03 18:45:11,039] Trial 1043 finished with value: 0.9714143918937085 and parameters: {'kernel': 'poly', 'C': 31.153045234874508, 'gamma': 0.08312226226921814, 'epsilon': 0.25248798396966643}. Best is trial 1002 with value: 0.44903193867462854.
[I 2024-12-03 18:45:11,399] Trial 1038 finished with value: 0.5123408045982099 and parameters: {'kernel': 'rbf', 'C': 19.02559857806013, 'gamma': 0.013158250803285558, 'epsilon': 0.032175055855187644}. Best is trial 1002 with value: 0.44903193867462854.
[I 2024-12-03 18:45:11,520] Trial 1024 finished with value: 0.45809019851072913 and parameters: {'kernel': 'rbf', 'C': 96.64739001854919, 'gamma': 0.01577942411236038, 'epsilon': 0.028010061264681564}. Best is trial 1002 with value: 0.44903193867462854.
[I 2024-12-03 18:45:12,022] Trial 1056 finished with value: 83.73675301523917 and parameters: {'kernel': 'sigmoid', 'C': 14.028697939184598, 'gamma': 0.03836614197150932, 'epsilon': 0.16159617149736544}. Best is trial 1002 with value: 0.44903193867462854.
[I 2024-12-03 18:45:12,090] Trial 1047 finished with value: 0.5469455447395746 and parameters: {'kernel': 'rbf', 'C': 95.09407299658056, 'gamma': 0.033180313689894804, 'epsilon': 0.02632142816350226}. Best is trial 1002 with value: 0.44903193867462854.
[I 2024-12-03 18:45:12,285] Trial 1057 finished with value: 0.4720311243183851 and parameters: {'kernel': 'rbf', 'C': 20.738948942834856, 'gamma': 0.025983498713834756, 'epsilon': 0.07817903319721359}. Best is trial 1002 with value: 0.44903193867462854.
[I 2024-12-03 18:45:12,448] Trial 1010 finished with value: 0.5307620065453572 and parameters: {'kernel': 'rbf', 'C': 18.915302037328907, 'gamma': 0.010933074622876203, 'epsilon': 0.11142881978147752}. Best is trial 1002 with value: 0.44903193867462854.
[I 2024-12-03 18:45:12,644] Trial 1049 finished with value: 0.45798523715865824 and parameters: {'kernel': 'rbf', 'C': 89.45029466224351, 'gamma': 0.018451452024242684, 'epsilon': 0.06294925797371612}. Best is trial 1002 with value: 0.44903193867462854.
[I 2024-12-03 18:45:12,888] Trial 1055 finished with value: 0.5663746298479927 and parameters: {'kernel': 'rbf', 'C': 24.579170587978926, 'gamma': 0.004235925414176045, 'epsilon': 0.051051506859092544}. Best is trial 1054 with value: 0.4488898878253922.
[I 2024-12-03 18:45:13,295] Trial 1036 finished with value: 0.4799820850627731 and parameters: {'kernel': 'rbf', 'C': 15.392326127331202, 'gamma': 0.03410022317720316, 'epsilon': 0.1086014142389973}. Best is trial 1054 with value: 0.4488898878253922.
[I 2024-12-03 18:45:13,394] Trial 1054 finished with value: 0.4488898878253922 and parameters: {'kernel': 'rbf', 'C': 95.25116457781925, 'gamma': 0.012716268717176757, 'epsilon': 0.07821033586182505}. Best is trial 1054 with value: 0.4488898878253922.
[I 2024-12-03 18:45:13,541] Trial 1046 finished with value: 0.49158620043931706 and parameters: {'kernel': 'rbf', 'C': 92.65840836816945, 'gamma': 0.006116513093095458, 'epsilon': 0.04294986129395921}. Best is trial 1054 with value: 0.4488898878253922.
[I 2024-12-03 18:45:14,105] Trial 1060 finished with value: 0.6131677418354374 and parameters: {'kernel': 'rbf', 'C': 87.57452037533191, 'gamma': 0.1447725262373015, 'epsilon': 0.012582394617128496}. Best is trial 1054 with value: 0.4488898878253922.
[I 2024-12-03 18:45:14,187] Trial 1063 finished with value: 0.48586350987859656 and parameters: {'kernel': 'rbf', 'C': 90.39848401786597, 'gamma': 0.007314904901966384, 'epsilon': 0.12435997956513407}. Best is trial 1054 with value: 0.4488898878253922.
[I 2024-12-03 18:45:14,328] Trial 1053 finished with value: 0.5407302312368808 and parameters: {'kernel': 'rbf', 'C': 20.101188889076425, 'gamma': 0.008927922429557955, 'epsilon': 0.34312141346451747}. Best is trial 1054 with value: 0.4488898878253922.
[I 2024-12-03 18:45:14,464] Trial 1045 finished with value: 1.3544978674244692 and parameters: {'kernel': 'rbf', 'C': 0.011659188638154627, 'gamma': 0.0013718038000132798, 'epsilon': 0.027126267447456817}. Best is trial 1054 with value: 0.4488898878253922.
[I 2024-12-03 18:45:15,473] Trial 1052 finished with value: 0.8352660826731653 and parameters: {'kernel': 'poly', 'C': 34.77499879968225, 'gamma': 0.02188926645668632, 'epsilon': 0.15326301765440342}. Best is trial 1054 with value: 0.4488898878253922.
[I 2024-12-03 18:45:16,203] Trial 1066 finished with value: 0.6690857409152245 and parameters: {'kernel': 'rbf', 'C': 27.81179637601639, 'gamma': 0.0010643028818098693, 'epsilon': 0.22817888809244694}. Best is trial 1054 with value: 0.4488898878253922.
[I 2024-12-03 18:45:16,468] Trial 1058 finished with value: 0.5002494551116446 and parameters: {'kernel': 'rbf', 'C': 96.33488640972539, 'gamma': 0.02655182553115421, 'epsilon': 0.05404201425095993}. Best is trial 1054 with value: 0.4488898878253922.
[I 2024-12-03 18:45:16,922] Trial 1061 finished with value: 0.5409717330302131 and parameters: {'kernel': 'rbf', 'C': 21.454191990371893, 'gamma': 0.009246224873482811, 'epsilon': 0.2154259398864382}. Best is trial 1054 with value: 0.4488898878253922.
[I 2024-12-03 18:45:17,406] Trial 1070 finished with value: 0.573966656948183 and parameters: {'kernel': 'linear', 'C': 22.725561737192688, 'gamma': 0.00420624578177408, 'epsilon': 0.06864963624174263}. Best is trial 1054 with value: 0.4488898878253922.
[I 2024-12-03 18:45:17,890] Trial 1067 finished with value: 0.5468308792625933 and parameters: {'kernel': 'rbf', 'C': 69.77310383611608, 'gamma': 0.03421849971510951, 'epsilon': 0.2005503245354011}. Best is trial 1054 with value: 0.4488898878253922.
[I 2024-12-03 18:45:18,257] Trial 1062 finished with value: 0.470974547481983 and parameters: {'kernel': 'rbf', 'C': 97.36503377811937, 'gamma': 0.00827032999490249, 'epsilon': 0.12444803589183971}. Best is trial 1054 with value: 0.4488898878253922.
[I 2024-12-03 18:45:18,342] Trial 1071 finished with value: 0.4941175290543273 and parameters: {'kernel': 'rbf', 'C': 99.03601769114636, 'gamma': 0.005353601174590752, 'epsilon': 0.06761784282114283}. Best is trial 1054 with value: 0.4488898878253922.
[I 2024-12-03 18:45:18,458] Trial 1065 finished with value: 0.56684924605899 and parameters: {'kernel': 'rbf', 'C': 83.66957765884902, 'gamma': 0.0018227198083657131, 'epsilon': 0.0642693731575513}. Best is trial 1054 with value: 0.4488898878253922.
[I 2024-12-03 18:45:18,792] Trial 1064 finished with value: 0.565072723106378 and parameters: {'kernel': 'rbf', 'C': 22.181924944251083, 'gamma': 0.004526837516759823, 'epsilon': 0.08528657558615693}. Best is trial 1054 with value: 0.4488898878253922.
[I 2024-12-03 18:45:18,843] Trial 1051 finished with value: 0.5667596760565107 and parameters: {'kernel': 'linear', 'C': 89.97759926659887, 'gamma': 0.021523013938503296, 'epsilon': 0.053132301826326174}. Best is trial 1054 with value: 0.4488898878253922.
[I 2024-12-03 18:45:19,222] Trial 1069 finished with value: 449.150253180097 and parameters: {'kernel': 'sigmoid', 'C': 99.03758533108255, 'gamma': 0.023098108976871562, 'epsilon': 0.11771340589906976}. Best is trial 1054 with value: 0.4488898878253922.
[I 2024-12-03 18:45:19,767] Trial 1076 finished with value: 0.9485194589026721 and parameters: {'kernel': 'poly', 'C': 48.962093757518566, 'gamma': 0.009365225398528595, 'epsilon': 0.024358533112830323}. Best is trial 1054 with value: 0.4488898878253922.
[I 2024-12-03 18:45:19,773] Trial 1075 finished with value: 192.7879839940929 and parameters: {'kernel': 'sigmoid', 'C': 81.09192089582616, 'gamma': 0.014126585407342771, 'epsilon': 0.05023899332442847}. Best is trial 1054 with value: 0.4488898878253922.
[I 2024-12-03 18:45:19,776] Trial 1074 finished with value: 1.3571387277422275 and parameters: {'kernel': 'poly', 'C': 0.003359610044847126, 'gamma': 0.00832380779714221, 'epsilon': 0.001428322227319827}. Best is trial 1054 with value: 0.4488898878253922.
[I 2024-12-03 18:45:20,098] Trial 1077 finished with value: 0.5389191324332798 and parameters: {'kernel': 'rbf', 'C': 18.315936901767582, 'gamma': 0.010215239008818327, 'epsilon': 0.23057320596080458}. Best is trial 1054 with value: 0.4488898878253922.
[I 2024-12-03 18:45:20,262] Trial 1059 finished with value: 0.7091147505735992 and parameters: {'kernel': 'rbf', 'C': 2.3811698932872845, 'gamma': 0.01002717356103724, 'epsilon': 0.023607002010521343}. Best is trial 1054 with value: 0.4488898878253922.
[I 2024-12-03 18:45:20,656] Trial 1082 finished with value: 0.5213687031617616 and parameters: {'kernel': 'rbf', 'C': 96.37109087652264, 'gamma': 0.020538537230675908, 'epsilon': 0.1914818901132365}. Best is trial 1054 with value: 0.4488898878253922.
[I 2024-12-03 18:45:20,660] Trial 1068 finished with value: 0.5590260692456375 and parameters: {'kernel': 'rbf', 'C': 16.977671945525294, 'gamma': 0.006604822707886211, 'epsilon': 0.03831461132340817}. Best is trial 1054 with value: 0.4488898878253922.
[I 2024-12-03 18:45:21,090] Trial 1073 finished with value: 0.6353741261695439 and parameters: {'kernel': 'linear', 'C': 38.85824595175192, 'gamma': 0.0238357390377097, 'epsilon': 0.2911493881092926}. Best is trial 1054 with value: 0.4488898878253922.
[I 2024-12-03 18:45:21,429] Trial 1072 finished with value: 0.48730797770180534 and parameters: {'kernel': 'rbf', 'C': 19.030996278332463, 'gamma': 0.01700272875111859, 'epsilon': 0.09579460345509723}. Best is trial 1054 with value: 0.4488898878253922.
[I 2024-12-03 18:45:22,051] Trial 1081 finished with value: 0.46415539673931605 and parameters: {'kernel': 'rbf', 'C': 25.24736756836421, 'gamma': 0.024377788907576015, 'epsilon': 0.12424498319122328}. Best is trial 1054 with value: 0.4488898878253922.
[I 2024-12-03 18:45:22,314] Trial 1080 finished with value: 0.998817934606598 and parameters: {'kernel': 'sigmoid', 'C': 0.1682820149749725, 'gamma': 0.013543357796777764, 'epsilon': 0.015720570546954405}. Best is trial 1054 with value: 0.4488898878253922.
[I 2024-12-03 18:45:23,045] Trial 1086 finished with value: 0.48833711951576575 and parameters: {'kernel': 'rbf', 'C': 97.09457717165907, 'gamma': 0.0068886948261238975, 'epsilon': 0.01600015201713612}. Best is trial 1054 with value: 0.4488898878253922.
[I 2024-12-03 18:45:23,721] Trial 1089 finished with value: 0.4901223527442545 and parameters: {'kernel': 'rbf', 'C': 98.66506732205345, 'gamma': 0.006613130405485225, 'epsilon': 0.1316920667827814}. Best is trial 1054 with value: 0.4488898878253922.
[I 2024-12-03 18:45:23,743] Trial 1078 finished with value: 0.568192166254546 and parameters: {'kernel': 'rbf', 'C': 96.323144896925, 'gamma': 0.03730617232175513, 'epsilon': 0.029862034070204147}. Best is trial 1054 with value: 0.4488898878253922.
[I 2024-12-03 18:45:23,858] Trial 1092 finished with value: 0.5189915590318722 and parameters: {'kernel': 'rbf', 'C': 23.949475016079067, 'gamma': 0.010063710765889217, 'epsilon': 0.03843164763026528}. Best is trial 1054 with value: 0.4488898878253922.
[I 2024-12-03 18:45:23,859] Trial 1085 finished with value: 0.6127651425499658 and parameters: {'kernel': 'rbf', 'C': 97.3959608381655, 'gamma': 0.04324536541793142, 'epsilon': 0.19339404545068622}. Best is trial 1054 with value: 0.4488898878253922.
[I 2024-12-03 18:45:23,998] Trial 1084 finished with value: 1.346041313783298 and parameters: {'kernel': 'poly', 'C': 0.31224137928696005, 'gamma': 0.0001330707320511107, 'epsilon': 0.2836298419482208}. Best is trial 1054 with value: 0.4488898878253922.
[I 2024-12-03 18:45:24,324] Trial 1079 finished with value: 0.6381229028198983 and parameters: {'kernel': 'rbf', 'C': 27.562446692846258, 'gamma': 0.0017031571403687876, 'epsilon': 0.07420422460902545}. Best is trial 1054 with value: 0.4488898878253922.
[I 2024-12-03 18:45:25,448] Trial 1087 finished with value: 0.5529739399489356 and parameters: {'kernel': 'rbf', 'C': 96.74988389941205, 'gamma': 0.0332550683984818, 'epsilon': 0.10103059132229891}. Best is trial 1054 with value: 0.4488898878253922.
[I 2024-12-03 18:45:25,804] Trial 1091 finished with value: 1.345903039808587 and parameters: {'kernel': 'rbf', 'C': 0.029999886492379894, 'gamma': 0.6771039915647002, 'epsilon': 0.06859545832647589}. Best is trial 1054 with value: 0.4488898878253922.
[I 2024-12-03 18:45:26,343] Trial 1090 finished with value: 0.4631870518005778 and parameters: {'kernel': 'rbf', 'C': 96.96460129312884, 'gamma': 0.018747604675710676, 'epsilon': 0.02833561055240709}. Best is trial 1054 with value: 0.4488898878253922.
[I 2024-12-03 18:45:26,678] Trial 1097 finished with value: 0.5372637705476075 and parameters: {'kernel': 'rbf', 'C': 24.97982196862842, 'gamma': 0.006950611125949963, 'epsilon': 0.06948604893549133}. Best is trial 1054 with value: 0.4488898878253922.
[I 2024-12-03 18:45:27,341] Trial 1088 finished with value: 0.507574967777194 and parameters: {'kernel': 'rbf', 'C': 84.64659746977668, 'gamma': 0.0051199530495477435, 'epsilon': 0.03715445921653915}. Best is trial 1054 with value: 0.4488898878253922.
[I 2024-12-03 18:45:27,394] Trial 1102 finished with value: 0.5954863062385846 and parameters: {'kernel': 'rbf', 'C': 18.26750548541751, 'gamma': 0.09321400451037051, 'epsilon': 0.10061019928680057}. Best is trial 1054 with value: 0.4488898878253922.
